Device: cuda
Seed: 987654321
Looking for images in: /home/student.unimelb.edu.au/mrangwala/Projects/Sketchguard/leaf/data/celeba/data/raw/img_align_celeba
Loading 1 LEAF CelebA train files...
LEAF CelebA train: 9343 users (celebrities), 177457 samples
Looking for images in: /home/student.unimelb.edu.au/mrangwala/Projects/Sketchguard/leaf/data/celeba/data/raw/img_align_celeba
Loading 1 LEAF CelebA test files...
LEAF CelebA test: 9343 users (celebrities), 22831 samples
Found 9343 train users, 9343 test users, 9343 common users
User sample counts range: 31 (max) to 4 (min)
Distributed ALL 9343 users across 20 clients
Users per client: 467 (with 3 clients getting +1 user)
Train partition sizes: [8843, 8998, 8728, 9034, 8866, 8946, 8873, 8776, 8816, 8801, 8913, 8656, 9115, 8921, 8699, 8823, 8912, 8766, 9102, 8869]
Test partition sizes: [1140, 1158, 1127, 1158, 1134, 1145, 1145, 1127, 1136, 1128, 1144, 1125, 1152, 1160, 1124, 1145, 1154, 1131, 1157, 1141]
  Client 0: 8843 train samples, 2 unique classes
  Client 1: 8998 train samples, 2 unique classes
  Client 2: 8728 train samples, 2 unique classes
  Client 3: 9034 train samples, 2 unique classes
  Client 4: 8866 train samples, 2 unique classes
  Client 5: 8946 train samples, 2 unique classes
  Client 6: 8873 train samples, 2 unique classes
  Client 7: 8776 train samples, 2 unique classes
  Client 8: 8816 train samples, 2 unique classes
  Client 9: 8801 train samples, 2 unique classes
  Client 10: 8913 train samples, 2 unique classes
  Client 11: 8656 train samples, 2 unique classes
  Client 12: 9115 train samples, 2 unique classes
  Client 13: 8921 train samples, 2 unique classes
  Client 14: 8699 train samples, 2 unique classes
  Client 15: 8823 train samples, 2 unique classes
  Client 16: 8912 train samples, 2 unique classes
  Client 17: 8766 train samples, 2 unique classes
  Client 18: 9102 train samples, 2 unique classes
  Client 19: 8869 train samples, 2 unique classes
Will sample 4500 samples per client per epoch
Graph: ring, nodes: 20, edges: 20
Degree statistics: avg=2.00, min=2, max=2
Attack: Compromised 12/20 nodes: [1, 2, 3, 5, 8, 11, 12, 13, 14, 15, 17, 18]
Attack type: backdoor, lambda: 1.0
Backdoor target label: 0, trigger size: 8
Model variant: baseline
Model parameters: 2,219,692
BALANCE algorithm:
Balance Config: BALANCEConfig(gamma=2, kappa=1, alpha=0.5, min_neighbors=1)
  - Model dimension: 2,219,692 parameters
  - Complexity: O(N×d) = O(20×2,219,692)
Initial test acc across nodes: mean=0.4978 ± 0.0208
Backdoor attack: Created poisoned datasets for 12 compromised nodes
Round 001: test acc mean=0.5447 ± 0.0560 | min=0.4933 max=0.7177
         : test loss mean=9125.4400 ± 13585.7123
         : individual accs = ['0.578070', '0.508636', '0.493345', '0.535406', '0.522046', '0.514410', '0.555459', '0.521739', '0.562500', '0.677305', '0.717657', '0.518222', '0.522569', '0.506897', '0.517794', '0.520524', '0.514731', '0.508400', '0.522040', '0.576687']
         : correct/total = [(659, 1140), (589, 1158), (556, 1127), (620, 1158), (592, 1134), (589, 1145), (636, 1145), (588, 1127), (639, 1136), (764, 1128), (821, 1144), (583, 1125), (602, 1152), (588, 1160), (582, 1124), (596, 1145), (594, 1154), (575, 1131), (604, 1157), (658, 1141)]
         : compromised: 0.5192, honest: 0.5830
Round 002: test acc mean=0.5848 ± 0.1131 | min=0.4780 max=0.7858
         : test loss mean=nan ± nan
         : individual accs = ['0.742105', '0.491364', '0.493345', '0.528497', '0.522046', '0.530131', '0.743231', '0.716060', '0.477993', '0.776596', '0.785839', '0.560000', '0.522569', '0.506897', '0.517794', '0.517031', '0.515598', '0.508400', '0.477960', '0.761613']
         : correct/total = [(846, 1140), (569, 1158), (556, 1127), (612, 1158), (592, 1134), (607, 1145), (851, 1145), (807, 1127), (543, 1136), (876, 1128), (899, 1144), (630, 1125), (602, 1152), (588, 1160), (582, 1124), (592, 1145), (595, 1154), (575, 1131), (553, 1157), (869, 1141)]
         : compromised: 0.5110, honest: 0.6954
Round 003: test acc mean=0.6130 ± 0.1479 | min=0.4933 max=0.8785
         : test loss mean=nan ± nan
         : individual accs = ['0.835088', '0.508636', '0.493345', '0.528497', '0.522046', '0.514410', '0.804367', '0.804791', '0.562500', '0.867021', '0.878497', '0.498667', '0.522569', '0.506897', '0.517794', '0.517031', '0.515598', '0.508400', '0.522040', '0.830850']
         : correct/total = [(952, 1140), (589, 1158), (556, 1127), (612, 1158), (592, 1134), (589, 1145), (921, 1145), (907, 1127), (639, 1136), (978, 1128), (1005, 1144), (561, 1125), (602, 1152), (588, 1160), (582, 1124), (592, 1145), (595, 1154), (575, 1131), (604, 1157), (948, 1141)]
         : compromised: 0.5167, honest: 0.7573
Round 004: test acc mean=0.6234 ± 0.1631 | min=0.4933 max=0.8830
         : test loss mean=nan ± nan
         : individual accs = ['0.864912', '0.508636', '0.493345', '0.528497', '0.522046', '0.514410', '0.871616', '0.859805', '0.562500', '0.882979', '0.882867', '0.498667', '0.522569', '0.506897', '0.517794', '0.517031', '0.515598', '0.508400', '0.522040', '0.867660']
         : correct/total = [(986, 1140), (589, 1158), (556, 1127), (612, 1158), (592, 1134), (589, 1145), (998, 1145), (969, 1127), (639, 1136), (996, 1128), (1010, 1144), (561, 1125), (602, 1152), (588, 1160), (582, 1124), (592, 1145), (595, 1154), (575, 1131), (604, 1157), (990, 1141)]
         : compromised: 0.5167, honest: 0.7834
Round 005: test acc mean=0.6252 ± 0.1662 | min=0.4933 max=0.9003
         : test loss mean=nan ± nan
         : individual accs = ['0.837719', '0.508636', '0.493345', '0.528497', '0.522046', '0.514410', '0.887336', '0.881100', '0.562500', '0.897163', '0.900350', '0.498667', '0.522569', '0.506897', '0.517794', '0.517031', '0.515598', '0.508400', '0.522040', '0.862401']
         : correct/total = [(955, 1140), (589, 1158), (556, 1127), (612, 1158), (592, 1134), (589, 1145), (1016, 1145), (993, 1127), (639, 1136), (1012, 1128), (1030, 1144), (561, 1125), (602, 1152), (588, 1160), (582, 1124), (592, 1145), (595, 1154), (575, 1131), (604, 1157), (984, 1141)]
         : compromised: 0.5167, honest: 0.7880
Round 006: test acc mean=0.6291 ± 0.1717 | min=0.4933 max=0.9066
         : test loss mean=nan ± nan
         : individual accs = ['0.890351', '0.508636', '0.493345', '0.528497', '0.522046', '0.514410', '0.906550', '0.886424', '0.562500', '0.884752', '0.891608', '0.498667', '0.522569', '0.506897', '0.517794', '0.517031', '0.515598', '0.508400', '0.522040', '0.883436']
         : correct/total = [(1015, 1140), (589, 1158), (556, 1127), (612, 1158), (592, 1134), (589, 1145), (1038, 1145), (999, 1127), (639, 1136), (998, 1128), (1020, 1144), (561, 1125), (602, 1152), (588, 1160), (582, 1124), (592, 1145), (595, 1154), (575, 1131), (604, 1157), (1008, 1141)]
         : compromised: 0.5167, honest: 0.7976
Round 007: test acc mean=0.6322 ± 0.1764 | min=0.4933 max=0.9078
         : test loss mean=nan ± nan
         : individual accs = ['0.895614', '0.508636', '0.493345', '0.528497', '0.522046', '0.514410', '0.900437', '0.901508', '0.562500', '0.907801', '0.903846', '0.498667', '0.522569', '0.506897', '0.517794', '0.517031', '0.515598', '0.508400', '0.522040', '0.896582']
         : correct/total = [(1021, 1140), (589, 1158), (556, 1127), (612, 1158), (592, 1134), (589, 1145), (1031, 1145), (1016, 1127), (639, 1136), (1024, 1128), (1034, 1144), (561, 1125), (602, 1152), (588, 1160), (582, 1124), (592, 1145), (595, 1154), (575, 1131), (604, 1157), (1023, 1141)]
         : compromised: 0.5167, honest: 0.8054
Round 008: test acc mean=0.6304 ± 0.1736 | min=0.4933 max=0.9006
         : test loss mean=nan ± nan
         : individual accs = ['0.892105', '0.508636', '0.493345', '0.528497', '0.522046', '0.514410', '0.897817', '0.900621', '0.562500', '0.894504', '0.896853', '0.498667', '0.522569', '0.506897', '0.517794', '0.517031', '0.515598', '0.508400', '0.522040', '0.886941']
         : correct/total = [(1017, 1140), (589, 1158), (556, 1127), (612, 1158), (592, 1134), (589, 1145), (1028, 1145), (1015, 1127), (639, 1136), (1009, 1128), (1026, 1144), (561, 1125), (602, 1152), (588, 1160), (582, 1124), (592, 1145), (595, 1154), (575, 1131), (604, 1157), (1012, 1141)]
         : compromised: 0.5167, honest: 0.8008
Round 009: test acc mean=0.6322 ± 0.1764 | min=0.4933 max=0.9066
         : test loss mean=nan ± nan
         : individual accs = ['0.900877', '0.508636', '0.493345', '0.528497', '0.522046', '0.514410', '0.906550', '0.904170', '0.562500', '0.898050', '0.901224', '0.498667', '0.522569', '0.506897', '0.517794', '0.517031', '0.515598', '0.508400', '0.522040', '0.894829']
         : correct/total = [(1027, 1140), (589, 1158), (556, 1127), (612, 1158), (592, 1134), (589, 1145), (1038, 1145), (1019, 1127), (639, 1136), (1013, 1128), (1031, 1144), (561, 1125), (602, 1152), (588, 1160), (582, 1124), (592, 1145), (595, 1154), (575, 1131), (604, 1157), (1021, 1141)]
         : compromised: 0.5167, honest: 0.8054
Round 010: test acc mean=0.6322 ± 0.1764 | min=0.4933 max=0.9065
         : test loss mean=nan ± nan
         : individual accs = ['0.899123', '0.508636', '0.493345', '0.528497', '0.522046', '0.514410', '0.895197', '0.904170', '0.562500', '0.898936', '0.906469', '0.498667', '0.522569', '0.506897', '0.517794', '0.517031', '0.515598', '0.508400', '0.522040', '0.900964']
         : correct/total = [(1025, 1140), (589, 1158), (556, 1127), (612, 1158), (592, 1134), (589, 1145), (1025, 1145), (1019, 1127), (639, 1136), (1014, 1128), (1037, 1144), (561, 1125), (602, 1152), (588, 1160), (582, 1124), (592, 1145), (595, 1154), (575, 1131), (604, 1157), (1028, 1141)]
         : compromised: 0.5167, honest: 0.8053

=== FINAL RESULTS ===
Dataset: celeba, Nodes: 20, Graph: ring, Aggregation: balance
Attack: backdoor, 60.0% compromised
Final accuracy - Compromised: 0.5167, Honest: 0.8053
Overall test accuracy: mean=0.6322 ± 0.1764

=== BACKDOOR ATTACK SUCCESS RATE (ASR) ===
Target label: 0
Trigger size: 8x8
Overall ASR: 0.8657 ± 0.2054
Honest nodes ASR: 0.6643 ± 0.1944
Compromised nodes ASR: 1.0000 ± 0.0000
Note: Higher ASR indicates more successful backdoor attack

=== BALANCE SUMMARY ===
Node 0: acceptance=0.500
Node 1: acceptance=0.150
Node 2: acceptance=0.000
Node 3: acceptance=0.050
Node 4: acceptance=0.000
Node 5: acceptance=0.150
Node 6: acceptance=0.500
Node 7: acceptance=0.500
Node 8: acceptance=0.200
Node 9: acceptance=0.500
Node 10: acceptance=0.500
Node 11: acceptance=0.150
Node 12: acceptance=0.000
Node 13: acceptance=0.000
Node 14: acceptance=0.000
Node 15: acceptance=0.050
Node 16: acceptance=0.000
Node 17: acceptance=0.050
Node 18: acceptance=0.150
Node 19: acceptance=0.500

=== PARALLEL EXECUTION TIME (realistic for distributed system) ===
  COMMUNICATION (max across nodes):
    - Full model transfer: 0.000s (0.0%)
  COMPUTATION (max across nodes):
    - Filtering: 0.011s (53.9%)
    - Aggregation: 0.010s (46.1%)
  TOTALS:
    - Total computation: 0.021s (100.0%)
    - Total communication: 0.000s (0.0%)
    - Total parallel time: 0.021s

=== PER-NODE AVERAGE TIME ===
  - Filtering: 0.008s
  - Aggregation: 0.003s
  - Model transfer: 0.000s
  - Total per node: 0.011s

=== TOTAL COMPUTATIONAL WORK (sum across all nodes) ===
  - Total filtering: 0.157s
  - Total aggregation: 0.066s
  - Total model transfer: 0.000s
  - Grand total: 0.223s
  - Mean acceptance rate: 0.197

BALANCE Algorithm Properties:
  - Model dimension: 2,219,692
  - No compression: Full parameter comparison
  - Theoretical complexity: O(deg(i)×d)
  - Approach: Full parameter filtering + averaging
