Device: cuda
Seed: 987654321
Looking for images in: /home/student.unimelb.edu.au/mrangwala/Projects/Sketchguard/leaf/data/celeba/data/raw/img_align_celeba
Loading 1 LEAF CelebA train files...
LEAF CelebA train: 9343 users (celebrities), 177457 samples
Looking for images in: /home/student.unimelb.edu.au/mrangwala/Projects/Sketchguard/leaf/data/celeba/data/raw/img_align_celeba
Loading 1 LEAF CelebA test files...
LEAF CelebA test: 9343 users (celebrities), 22831 samples
Found 9343 train users, 9343 test users, 9343 common users
User sample counts range: 31 (max) to 4 (min)
Distributed ALL 9343 users across 20 clients
Users per client: 467 (with 3 clients getting +1 user)
Train partition sizes: [8843, 8998, 8728, 9034, 8866, 8946, 8873, 8776, 8816, 8801, 8913, 8656, 9115, 8921, 8699, 8823, 8912, 8766, 9102, 8869]
Test partition sizes: [1140, 1158, 1127, 1158, 1134, 1145, 1145, 1127, 1136, 1128, 1144, 1125, 1152, 1160, 1124, 1145, 1154, 1131, 1157, 1141]
  Client 0: 8843 train samples, 2 unique classes
  Client 1: 8998 train samples, 2 unique classes
  Client 2: 8728 train samples, 2 unique classes
  Client 3: 9034 train samples, 2 unique classes
  Client 4: 8866 train samples, 2 unique classes
  Client 5: 8946 train samples, 2 unique classes
  Client 6: 8873 train samples, 2 unique classes
  Client 7: 8776 train samples, 2 unique classes
  Client 8: 8816 train samples, 2 unique classes
  Client 9: 8801 train samples, 2 unique classes
  Client 10: 8913 train samples, 2 unique classes
  Client 11: 8656 train samples, 2 unique classes
  Client 12: 9115 train samples, 2 unique classes
  Client 13: 8921 train samples, 2 unique classes
  Client 14: 8699 train samples, 2 unique classes
  Client 15: 8823 train samples, 2 unique classes
  Client 16: 8912 train samples, 2 unique classes
  Client 17: 8766 train samples, 2 unique classes
  Client 18: 9102 train samples, 2 unique classes
  Client 19: 8869 train samples, 2 unique classes
Will sample 4500 samples per client per epoch
Graph: fully, nodes: 20, edges: 190
Degree statistics: avg=19.00, min=19, max=19
Attack: Compromised 8/20 nodes: [1, 5, 11, 12, 13, 14, 17, 18]
Attack type: directed_deviation, lambda: 1.0
Model variant: baseline
Model parameters: 2,219,692
UBAR ALGORITHM (Two-Stage Byzantine-resilient)
  - Model dimension: 2,219,692 parameters
  - Rho parameter: 0.6
  - Stage 1: Distance-based filtering (select 60% closest neighbors)
  - Stage 2: Performance-based selection (loss comparison)
  - Complexity: O(deg(i)×d + deg(i)×inference)
Initial test acc across nodes: mean=0.4978 ± 0.0208
Round 001: test acc mean=0.6425 ± 0.0478 | min=0.5255 max=0.7170
         : test loss mean=0.6788 ± 0.0060
         : individual accs = ['0.628947', '0.654577', '0.622893', '0.651123', '0.587302', '0.717031', '0.681223', '0.636202', '0.582746', '0.685284', '0.626748', '0.663111', '0.701389', '0.703448', '0.677936', '0.612227', '0.590121', '0.613616', '0.525497', '0.688869']
         : correct/total = [(717, 1140), (758, 1158), (702, 1127), (754, 1158), (666, 1134), (821, 1145), (780, 1145), (717, 1127), (662, 1136), (773, 1128), (717, 1144), (746, 1125), (808, 1152), (816, 1160), (762, 1124), (701, 1145), (681, 1154), (694, 1131), (608, 1157), (786, 1141)]
         : compromised: 0.6571, honest: 0.6328
         : ubar stats = ['Node 0: s1=0.579, s2=0.182', 'Node 1: s1=0.579, s2=0.636', 'Node 2: s1=0.579, s2=0.273']...
Round 002: test acc mean=0.6378 ± 0.0615 | min=0.5214 max=0.7222
         : test loss mean=0.6674 ± 0.0157
         : individual accs = ['0.650877', '0.665803', '0.720497', '0.567358', '0.531746', '0.565066', '0.627948', '0.674357', '0.670775', '0.656915', '0.599650', '0.703111', '0.722222', '0.645690', '0.521352', '0.707424', '0.586655', '0.567639', '0.687986', '0.683611']
         : correct/total = [(742, 1140), (771, 1158), (812, 1127), (657, 1158), (603, 1134), (647, 1145), (719, 1145), (760, 1127), (762, 1136), (741, 1128), (686, 1144), (791, 1125), (832, 1152), (749, 1160), (586, 1124), (810, 1145), (677, 1154), (642, 1131), (796, 1157), (780, 1141)]
         : compromised: 0.6349, honest: 0.6398
         : ubar stats = ['Node 0: s1=0.579, s2=0.182', 'Node 1: s1=0.579, s2=0.636', 'Node 2: s1=0.579, s2=0.273']...
Round 003: test acc mean=0.7201 ± 0.0475 | min=0.5890 max=0.7886
         : test loss mean=0.6135 ± 0.0448
         : individual accs = ['0.759649', '0.708117', '0.760426', '0.746978', '0.644621', '0.655895', '0.734498', '0.685892', '0.735035', '0.718085', '0.746503', '0.757333', '0.689236', '0.707759', '0.588968', '0.788646', '0.779896', '0.725906', '0.750216', '0.717791']
         : correct/total = [(866, 1140), (820, 1158), (857, 1127), (865, 1158), (731, 1134), (751, 1145), (841, 1145), (773, 1127), (835, 1136), (810, 1128), (854, 1144), (852, 1125), (794, 1152), (821, 1160), (662, 1124), (903, 1145), (900, 1154), (821, 1131), (868, 1157), (819, 1141)]
         : compromised: 0.6979, honest: 0.7348
         : ubar stats = ['Node 0: s1=0.579, s2=0.242', 'Node 1: s1=0.579, s2=0.697', 'Node 2: s1=0.579, s2=0.242']...
Round 004: test acc mean=0.8028 ± 0.0256 | min=0.7580 max=0.8358
         : test loss mean=0.4705 ± 0.0587
         : individual accs = ['0.835088', '0.772884', '0.835847', '0.814335', '0.768959', '0.782533', '0.811354', '0.777285', '0.821303', '0.807624', '0.833916', '0.810667', '0.772569', '0.777586', '0.758007', '0.820087', '0.829289', '0.778073', '0.815903', '0.833479']
         : correct/total = [(952, 1140), (895, 1158), (942, 1127), (943, 1158), (872, 1134), (896, 1145), (929, 1145), (876, 1127), (933, 1136), (911, 1128), (954, 1144), (912, 1125), (890, 1152), (902, 1160), (852, 1124), (939, 1145), (957, 1154), (880, 1131), (944, 1157), (951, 1141)]
         : compromised: 0.7835, honest: 0.8157
         : ubar stats = ['Node 0: s1=0.579, s2=0.205', 'Node 1: s1=0.579, s2=0.705', 'Node 2: s1=0.579, s2=0.205']...
Round 005: test acc mean=0.8442 ± 0.0177 | min=0.8026 max=0.8696
         : test loss mean=0.3579 ± 0.0264
         : individual accs = ['0.835088', '0.869603', '0.834960', '0.853195', '0.832451', '0.802620', '0.858515', '0.839397', '0.856514', '0.859929', '0.868881', '0.841778', '0.816840', '0.822414', '0.842527', '0.843668', '0.852686', '0.854111', '0.829732', '0.869413']
         : correct/total = [(952, 1140), (1007, 1158), (941, 1127), (988, 1158), (944, 1134), (919, 1145), (983, 1145), (946, 1127), (973, 1136), (970, 1128), (994, 1144), (947, 1125), (941, 1152), (954, 1160), (947, 1124), (966, 1145), (984, 1154), (966, 1131), (960, 1157), (992, 1141)]
         : compromised: 0.8350, honest: 0.8504
         : ubar stats = ['Node 0: s1=0.579, s2=0.309', 'Node 1: s1=0.579, s2=0.691', 'Node 2: s1=0.579, s2=0.255']...
Round 006: test acc mean=0.8676 ± 0.0110 | min=0.8462 max=0.8864
         : test loss mean=0.3112 ± 0.0151
         : individual accs = ['0.877193', '0.873921', '0.865129', '0.865285', '0.851852', '0.882969', '0.878603', '0.859805', '0.882042', '0.862589', '0.886364', '0.880889', '0.866319', '0.859483', '0.864769', '0.851528', '0.862218', '0.864721', '0.846154', '0.871166']
         : correct/total = [(1000, 1140), (1012, 1158), (975, 1127), (1002, 1158), (966, 1134), (1011, 1145), (1006, 1145), (969, 1127), (1002, 1136), (973, 1128), (1014, 1144), (991, 1125), (998, 1152), (997, 1160), (972, 1124), (975, 1145), (995, 1154), (978, 1131), (979, 1157), (994, 1141)]
         : compromised: 0.8674, honest: 0.8678
         : ubar stats = ['Node 0: s1=0.579, s2=0.273', 'Node 1: s1=0.579, s2=0.697', 'Node 2: s1=0.579, s2=0.318']...
Round 007: test acc mean=0.8814 ± 0.0088 | min=0.8585 max=0.8943
         : test loss mean=0.2867 ± 0.0160
         : individual accs = ['0.885965', '0.888601', '0.874002', '0.883420', '0.873898', '0.894323', '0.889956', '0.881100', '0.883803', '0.893617', '0.885490', '0.885333', '0.866319', '0.884483', '0.881673', '0.858515', '0.884749', '0.877984', '0.869490', '0.885188']
         : correct/total = [(1010, 1140), (1029, 1158), (985, 1127), (1023, 1158), (991, 1134), (1024, 1145), (1019, 1145), (993, 1127), (1004, 1136), (1008, 1128), (1013, 1144), (996, 1125), (998, 1152), (1026, 1160), (991, 1124), (983, 1145), (1021, 1154), (993, 1131), (1006, 1157), (1010, 1141)]
         : compromised: 0.8810, honest: 0.8816
         : ubar stats = ['Node 0: s1=0.579, s2=0.273', 'Node 1: s1=0.579, s2=0.662', 'Node 2: s1=0.579, s2=0.338']...
Round 008: test acc mean=0.8847 ± 0.0083 | min=0.8653 max=0.8978
         : test loss mean=0.2773 ± 0.0154
         : individual accs = ['0.897368', '0.888601', '0.875776', '0.884283', '0.885362', '0.896943', '0.887336', '0.886424', '0.865317', '0.889184', '0.890734', '0.897778', '0.881076', '0.881897', '0.893238', '0.871616', '0.880416', '0.881521', '0.876404', '0.883436']
         : correct/total = [(1023, 1140), (1029, 1158), (987, 1127), (1024, 1158), (1004, 1134), (1027, 1145), (1016, 1145), (999, 1127), (983, 1136), (1003, 1128), (1019, 1144), (1010, 1125), (1015, 1152), (1023, 1160), (1004, 1124), (998, 1145), (1016, 1154), (997, 1131), (1014, 1157), (1008, 1141)]
         : compromised: 0.8872, honest: 0.8831
         : ubar stats = ['Node 0: s1=0.579, s2=0.250', 'Node 1: s1=0.579, s2=0.591', 'Node 2: s1=0.579, s2=0.341']...
Round 009: test acc mean=0.8898 ± 0.0135 | min=0.8479 max=0.9100
         : test loss mean=0.2672 ± 0.0215
         : individual accs = ['0.900877', '0.892055', '0.875776', '0.898100', '0.890653', '0.910044', '0.894323', '0.899734', '0.900528', '0.889184', '0.888986', '0.894222', '0.893229', '0.894828', '0.901246', '0.873362', '0.885615', '0.870911', '0.847882', '0.894829']
         : correct/total = [(1027, 1140), (1033, 1158), (987, 1127), (1040, 1158), (1010, 1134), (1042, 1145), (1024, 1145), (1014, 1127), (1023, 1136), (1003, 1128), (1017, 1144), (1006, 1125), (1029, 1152), (1038, 1160), (1013, 1124), (1000, 1145), (1022, 1154), (985, 1131), (981, 1157), (1021, 1141)]
         : compromised: 0.8881, honest: 0.8910
         : ubar stats = ['Node 0: s1=0.579, s2=0.232', 'Node 1: s1=0.579, s2=0.576', 'Node 2: s1=0.579, s2=0.384']...
Round 010: test acc mean=0.8951 ± 0.0080 | min=0.8786 max=0.9110
         : test loss mean=0.2556 ± 0.0157
         : individual accs = ['0.900877', '0.899827', '0.884650', '0.896373', '0.898589', '0.896943', '0.893450', '0.889973', '0.895246', '0.902482', '0.903846', '0.902222', '0.888889', '0.898276', '0.911032', '0.878603', '0.897747', '0.884173', '0.881590', '0.896582']
         : correct/total = [(1027, 1140), (1042, 1158), (997, 1127), (1038, 1158), (1019, 1134), (1027, 1145), (1023, 1145), (1003, 1127), (1017, 1136), (1018, 1128), (1034, 1144), (1015, 1125), (1024, 1152), (1042, 1160), (1024, 1124), (1006, 1145), (1036, 1154), (1000, 1131), (1020, 1157), (1023, 1141)]
         : compromised: 0.8954, honest: 0.8949
         : ubar stats = ['Node 0: s1=0.579, s2=0.218', 'Node 1: s1=0.579, s2=0.555', 'Node 2: s1=0.579, s2=0.355']...

=== FINAL RESULTS ===
Dataset: celeba, Nodes: 20, Graph: fully, Aggregation: ubar
Attack: directed_deviation, 40.0% compromised
Final accuracy - Compromised: 0.8954, Honest: 0.8949
Overall test accuracy: mean=0.8951 ± 0.0080

=== UBAR SUMMARY ===
Node 0: stage1=0.579, stage2=0.218, overall=0.126
Node 1: stage1=0.579, stage2=0.555, overall=0.321
Node 2: stage1=0.579, stage2=0.355, overall=0.205
Node 3: stage1=0.579, stage2=0.282, overall=0.163
Node 4: stage1=0.579, stage2=0.591, overall=0.342
Node 5: stage1=0.579, stage2=0.500, overall=0.289
Node 6: stage1=0.579, stage2=0.264, overall=0.153
Node 7: stage1=0.579, stage2=0.627, overall=0.363
Node 8: stage1=0.579, stage2=0.382, overall=0.221
Node 9: stage1=0.579, stage2=0.373, overall=0.216
Node 10: stage1=0.579, stage2=0.273, overall=0.158
Node 11: stage1=0.579, stage2=0.282, overall=0.163
Node 12: stage1=0.579, stage2=0.545, overall=0.316
Node 13: stage1=0.579, stage2=0.591, overall=0.342
Node 14: stage1=0.579, stage2=0.627, overall=0.363
Node 15: stage1=0.579, stage2=0.109, overall=0.063
Node 16: stage1=0.579, stage2=0.518, overall=0.300
Node 17: stage1=0.579, stage2=0.191, overall=0.111
Node 18: stage1=0.579, stage2=0.391, overall=0.226
Node 19: stage1=0.579, stage2=0.345, overall=0.200

=== PARALLEL EXECUTION TIME (realistic for distributed system) ===
  COMMUNICATION (max across nodes):
    - Full model transfer: 0.000s (0.0%)
  COMPUTATION (max across nodes):
    - Distance computation: 0.054s (19.5%)
    - Loss computation: 0.214s (77.7%)
    - Aggregation: 0.008s (2.8%)
  TOTALS:
    - Total computation: 0.275s (100.0%)
    - Total communication: 0.000s (0.0%)
    - Total parallel time: 0.275s

=== PER-NODE AVERAGE TIME ===
  - Distance computation: 0.047s
  - Loss computation: 0.189s
  - Aggregation: 0.006s
  - Model transfer: 0.000s
  - Total per node: 0.242s

=== TOTAL COMPUTATIONAL WORK (sum across all nodes) ===
  - Total distance computation: 0.948s
  - Total loss computation: 3.779s
  - Total aggregation: 0.110s
  - Total model transfer: 0.000s
  - Grand total: 4.838s
  - Mean Stage 1 acceptance rate: 0.579
  - Mean Stage 2 acceptance rate: 0.401
  - Overall acceptance rate: 0.232

UBAR Algorithm Properties:
  - Model dimension: 2,219,692
  - Rho parameter: 0.6
  - Two-stage approach: Distance filtering + loss evaluation
  - Stage 1 selects: 60% of neighbors
  - Stage 2 uses: Training sample loss comparison
  - Theoretical complexity: O(deg(i)×d + deg(i)×inference)
  - Approach: UBAR paper implementation
