Device: cuda
Seed: 987654321
Looking for images in: /home/student.unimelb.edu.au/mrangwala/Projects/Sketchguard/leaf/data/celeba/data/raw/img_align_celeba
Loading 1 LEAF CelebA train files...
LEAF CelebA train: 9343 users (celebrities), 177457 samples
Looking for images in: /home/student.unimelb.edu.au/mrangwala/Projects/Sketchguard/leaf/data/celeba/data/raw/img_align_celeba
Loading 1 LEAF CelebA test files...
LEAF CelebA test: 9343 users (celebrities), 22831 samples
Found 9343 train users, 9343 test users, 9343 common users
User sample counts range: 31 (max) to 4 (min)
Distributed ALL 9343 users across 20 clients
Users per client: 467 (with 3 clients getting +1 user)
Train partition sizes: [8843, 8998, 8728, 9034, 8866, 8946, 8873, 8776, 8816, 8801, 8913, 8656, 9115, 8921, 8699, 8823, 8912, 8766, 9102, 8869]
Test partition sizes: [1140, 1158, 1127, 1158, 1134, 1145, 1145, 1127, 1136, 1128, 1144, 1125, 1152, 1160, 1124, 1145, 1154, 1131, 1157, 1141]
  Client 0: 8843 train samples, 2 unique classes
  Client 1: 8998 train samples, 2 unique classes
  Client 2: 8728 train samples, 2 unique classes
  Client 3: 9034 train samples, 2 unique classes
  Client 4: 8866 train samples, 2 unique classes
  Client 5: 8946 train samples, 2 unique classes
  Client 6: 8873 train samples, 2 unique classes
  Client 7: 8776 train samples, 2 unique classes
  Client 8: 8816 train samples, 2 unique classes
  Client 9: 8801 train samples, 2 unique classes
  Client 10: 8913 train samples, 2 unique classes
  Client 11: 8656 train samples, 2 unique classes
  Client 12: 9115 train samples, 2 unique classes
  Client 13: 8921 train samples, 2 unique classes
  Client 14: 8699 train samples, 2 unique classes
  Client 15: 8823 train samples, 2 unique classes
  Client 16: 8912 train samples, 2 unique classes
  Client 17: 8766 train samples, 2 unique classes
  Client 18: 9102 train samples, 2 unique classes
  Client 19: 8869 train samples, 2 unique classes
Will sample 4500 samples per client per epoch
Graph: fully, nodes: 20, edges: 190
Degree statistics: avg=19.00, min=19, max=19
Attack: Compromised 10/20 nodes: [1, 2, 5, 11, 12, 13, 14, 15, 17, 18]
Attack type: backdoor, lambda: 1.0
Backdoor target label: 0, trigger size: 8
Model variant: baseline
Model parameters: 2,219,692
BALANCE algorithm:
Balance Config: BALANCEConfig(gamma=2, kappa=1, alpha=0.5, min_neighbors=1)
  - Model dimension: 2,219,692 parameters
  - Complexity: O(N×d) = O(20×2,219,692)
Initial test acc across nodes: mean=0.4978 ± 0.0208
Backdoor attack: Created poisoned datasets for 10 compromised nodes
Round 001: test acc mean=0.5948 ± 0.0848 | min=0.4942 max=0.7140
         : test loss mean=1940.0292 ± 1992.1887
         : individual accs = ['0.707895', '0.508636', '0.494232', '0.673575', '0.596120', '0.514410', '0.701310', '0.644188', '0.678697', '0.701241', '0.684441', '0.520889', '0.522569', '0.506897', '0.517794', '0.521397', '0.714038', '0.508400', '0.522040', '0.656442']
         : correct/total = [(807, 1140), (589, 1158), (557, 1127), (780, 1158), (676, 1134), (589, 1145), (803, 1145), (726, 1127), (771, 1136), (791, 1128), (783, 1144), (586, 1125), (602, 1152), (588, 1160), (582, 1124), (597, 1145), (824, 1154), (575, 1131), (604, 1157), (749, 1141)]
         : compromised: 0.5137, honest: 0.6758
Round 002: test acc mean=0.5732 ± 0.0811 | min=0.4769 max=0.6889
         : test loss mean=39451033.0469 ± 71274837.1230
         : individual accs = ['0.643860', '0.506045', '0.506655', '0.658895', '0.531746', '0.485590', '0.639301', '0.666371', '0.618838', '0.658688', '0.686189', '0.499556', '0.477431', '0.525862', '0.476868', '0.532751', '0.688908', '0.491600', '0.490061', '0.678352']
         : correct/total = [(734, 1140), (586, 1158), (571, 1127), (763, 1158), (603, 1134), (556, 1145), (732, 1145), (751, 1127), (703, 1136), (743, 1128), (785, 1144), (562, 1125), (550, 1152), (610, 1160), (536, 1124), (610, 1145), (795, 1154), (556, 1131), (567, 1157), (774, 1141)]
         : compromised: 0.4992, honest: 0.6471
Round 003: test acc mean=0.5920 ± 0.0844 | min=0.4933 max=0.7210
         : test loss mean=nan ± nan
         : individual accs = ['0.625439', '0.508636', '0.493345', '0.687392', '0.615520', '0.514410', '0.648035', '0.670807', '0.697183', '0.681738', '0.694056', '0.498667', '0.522569', '0.506897', '0.517794', '0.517031', '0.720971', '0.508400', '0.522040', '0.689746']
         : correct/total = [(713, 1140), (589, 1158), (556, 1127), (796, 1158), (698, 1134), (589, 1145), (742, 1145), (756, 1127), (792, 1136), (769, 1128), (794, 1144), (561, 1125), (602, 1152), (588, 1160), (582, 1124), (592, 1145), (832, 1154), (575, 1131), (604, 1157), (787, 1141)]
         : compromised: 0.5110, honest: 0.6731
Round 004: test acc mean=0.6223 ± 0.1119 | min=0.4933 max=0.7574
         : test loss mean=nan ± nan
         : individual accs = ['0.711404', '0.508636', '0.493345', '0.737478', '0.718695', '0.514410', '0.734498', '0.724933', '0.735915', '0.737589', '0.755245', '0.498667', '0.522569', '0.506897', '0.517794', '0.517031', '0.757366', '0.508400', '0.522040', '0.723050']
         : correct/total = [(811, 1140), (589, 1158), (556, 1127), (854, 1158), (815, 1134), (589, 1145), (841, 1145), (817, 1127), (836, 1136), (832, 1128), (864, 1144), (561, 1125), (602, 1152), (588, 1160), (582, 1124), (592, 1145), (874, 1154), (575, 1131), (604, 1157), (825, 1141)]
         : compromised: 0.5110, honest: 0.7336
Round 005: test acc mean=0.6482 ± 0.1378 | min=0.4933 max=0.8085
         : test loss mean=nan ± nan
         : individual accs = ['0.763158', '0.508636', '0.493345', '0.781520', '0.782187', '0.514410', '0.793886', '0.762201', '0.794014', '0.808511', '0.795455', '0.498667', '0.522569', '0.506897', '0.517794', '0.517031', '0.802426', '0.508400', '0.522040', '0.771253']
         : correct/total = [(870, 1140), (589, 1158), (556, 1127), (905, 1158), (887, 1134), (589, 1145), (909, 1145), (859, 1127), (902, 1136), (912, 1128), (910, 1144), (561, 1125), (602, 1152), (588, 1160), (582, 1124), (592, 1145), (926, 1154), (575, 1131), (604, 1157), (880, 1141)]
         : compromised: 0.5110, honest: 0.7855
Round 006: test acc mean=0.6661 ± 0.1556 | min=0.4933 max=0.8479
         : test loss mean=nan ± nan
         : individual accs = ['0.817544', '0.508636', '0.493345', '0.822107', '0.803351', '0.514410', '0.806987', '0.809228', '0.819542', '0.840426', '0.847902', '0.498667', '0.522569', '0.506897', '0.517794', '0.517031', '0.810225', '0.508400', '0.522040', '0.834356']
         : correct/total = [(932, 1140), (589, 1158), (556, 1127), (952, 1158), (911, 1134), (589, 1145), (924, 1145), (912, 1127), (931, 1136), (948, 1128), (970, 1144), (561, 1125), (602, 1152), (588, 1160), (582, 1124), (592, 1145), (935, 1154), (575, 1131), (604, 1157), (952, 1141)]
         : compromised: 0.5110, honest: 0.8212
Round 007: test acc mean=0.6841 ± 0.1733 | min=0.4933 max=0.8706
         : test loss mean=nan ± nan
         : individual accs = ['0.850000', '0.508636', '0.493345', '0.852332', '0.842152', '0.514410', '0.861135', '0.848270', '0.861796', '0.862589', '0.870629', '0.498667', '0.522569', '0.506897', '0.517794', '0.517031', '0.858752', '0.508400', '0.522040', '0.864154']
         : correct/total = [(969, 1140), (589, 1158), (556, 1127), (987, 1158), (955, 1134), (589, 1145), (986, 1145), (956, 1127), (979, 1136), (973, 1128), (996, 1144), (561, 1125), (602, 1152), (588, 1160), (582, 1124), (592, 1145), (991, 1154), (575, 1131), (604, 1157), (986, 1141)]
         : compromised: 0.5110, honest: 0.8572
Round 008: test acc mean=0.6899 ± 0.1791 | min=0.4933 max=0.8785
         : test loss mean=nan ± nan
         : individual accs = ['0.863158', '0.508636', '0.493345', '0.862694', '0.857143', '0.514410', '0.871616', '0.874002', '0.868838', '0.873227', '0.878497', '0.498667', '0.522569', '0.506897', '0.517794', '0.517031', '0.875217', '0.508400', '0.522040', '0.864154']
         : correct/total = [(984, 1140), (589, 1158), (556, 1127), (999, 1158), (972, 1134), (589, 1145), (998, 1145), (985, 1127), (987, 1136), (985, 1128), (1005, 1144), (561, 1125), (602, 1152), (588, 1160), (582, 1124), (592, 1145), (1010, 1154), (575, 1131), (604, 1157), (986, 1141)]
         : compromised: 0.5110, honest: 0.8689
Round 009: test acc mean=0.6982 ± 0.1874 | min=0.4933 max=0.8938
         : test loss mean=nan ± nan
         : individual accs = ['0.873684', '0.508636', '0.493345', '0.893782', '0.873016', '0.514410', '0.886463', '0.889086', '0.884683', '0.892730', '0.893357', '0.498667', '0.522569', '0.506897', '0.517794', '0.517031', '0.879549', '0.508400', '0.522040', '0.886941']
         : correct/total = [(996, 1140), (589, 1158), (556, 1127), (1035, 1158), (990, 1134), (589, 1145), (1015, 1145), (1002, 1127), (1005, 1136), (1007, 1128), (1022, 1144), (561, 1125), (602, 1152), (588, 1160), (582, 1124), (592, 1145), (1015, 1154), (575, 1131), (604, 1157), (1012, 1141)]
         : compromised: 0.5110, honest: 0.8853
Round 010: test acc mean=0.7006 ± 0.1898 | min=0.4933 max=0.9034
         : test loss mean=nan ± nan
         : individual accs = ['0.885965', '0.508636', '0.493345', '0.894646', '0.882716', '0.514410', '0.884716', '0.894410', '0.889085', '0.903369', '0.892483', '0.498667', '0.522569', '0.506897', '0.517794', '0.517031', '0.888215', '0.508400', '0.522040', '0.886941']
         : correct/total = [(1010, 1140), (589, 1158), (556, 1127), (1036, 1158), (1001, 1134), (589, 1145), (1013, 1145), (1008, 1127), (1010, 1136), (1019, 1128), (1021, 1144), (561, 1125), (602, 1152), (588, 1160), (582, 1124), (592, 1145), (1025, 1154), (575, 1131), (604, 1157), (1012, 1141)]
         : compromised: 0.5110, honest: 0.8903

=== FINAL RESULTS ===
Dataset: celeba, Nodes: 20, Graph: fully, Aggregation: balance
Attack: backdoor, 50.0% compromised
Final accuracy - Compromised: 0.5110, Honest: 0.8903
Overall test accuracy: mean=0.7006 ± 0.1898

=== BACKDOOR ATTACK SUCCESS RATE (ASR) ===
Target label: 0
Trigger size: 8x8
Overall ASR: 0.7759 ± 0.2244
Honest nodes ASR: 0.5518 ± 0.0167
Compromised nodes ASR: 1.0000 ± 0.0000
Note: Higher ASR indicates more successful backdoor attack

=== BALANCE SUMMARY ===
Node 0: acceptance=0.474
Node 1: acceptance=0.153
Node 2: acceptance=0.153
Node 3: acceptance=0.474
Node 4: acceptance=0.474
Node 5: acceptance=0.153
Node 6: acceptance=0.474
Node 7: acceptance=0.474
Node 8: acceptance=0.474
Node 9: acceptance=0.474
Node 10: acceptance=0.474
Node 11: acceptance=0.153
Node 12: acceptance=0.153
Node 13: acceptance=0.153
Node 14: acceptance=0.153
Node 15: acceptance=0.153
Node 16: acceptance=0.474
Node 17: acceptance=0.153
Node 18: acceptance=0.153
Node 19: acceptance=0.474

=== PARALLEL EXECUTION TIME (realistic for distributed system) ===
  COMMUNICATION (max across nodes):
    - Full model transfer: 0.000s (0.0%)
  COMPUTATION (max across nodes):
    - Filtering: 0.055s (81.6%)
    - Aggregation: 0.012s (18.4%)
  TOTALS:
    - Total computation: 0.068s (100.0%)
    - Total communication: 0.000s (0.0%)
    - Total parallel time: 0.068s

=== PER-NODE AVERAGE TIME ===
  - Filtering: 0.050s
  - Aggregation: 0.005s
  - Model transfer: 0.000s
  - Total per node: 0.055s

=== TOTAL COMPUTATIONAL WORK (sum across all nodes) ===
  - Total filtering: 0.992s
  - Total aggregation: 0.101s
  - Total model transfer: 0.000s
  - Grand total: 1.093s
  - Mean acceptance rate: 0.313

BALANCE Algorithm Properties:
  - Model dimension: 2,219,692
  - No compression: Full parameter comparison
  - Theoretical complexity: O(deg(i)×d)
  - Approach: Full parameter filtering + averaging
