Device: cuda
Seed: 987654321
Looking for images in: /home/student.unimelb.edu.au/mrangwala/Projects/Sketchguard/leaf/data/celeba/data/raw/img_align_celeba
Loading 1 LEAF CelebA train files...
LEAF CelebA train: 9343 users (celebrities), 177457 samples
Looking for images in: /home/student.unimelb.edu.au/mrangwala/Projects/Sketchguard/leaf/data/celeba/data/raw/img_align_celeba
Loading 1 LEAF CelebA test files...
LEAF CelebA test: 9343 users (celebrities), 22831 samples
Found 9343 train users, 9343 test users, 9343 common users
User sample counts range: 31 (max) to 4 (min)
Distributed ALL 9343 users across 20 clients
Users per client: 467 (with 3 clients getting +1 user)
Train partition sizes: [8843, 8998, 8728, 9034, 8866, 8946, 8873, 8776, 8816, 8801, 8913, 8656, 9115, 8921, 8699, 8823, 8912, 8766, 9102, 8869]
Test partition sizes: [1140, 1158, 1127, 1158, 1134, 1145, 1145, 1127, 1136, 1128, 1144, 1125, 1152, 1160, 1124, 1145, 1154, 1131, 1157, 1141]
  Client 0: 8843 train samples, 2 unique classes
  Client 1: 8998 train samples, 2 unique classes
  Client 2: 8728 train samples, 2 unique classes
  Client 3: 9034 train samples, 2 unique classes
  Client 4: 8866 train samples, 2 unique classes
  Client 5: 8946 train samples, 2 unique classes
  Client 6: 8873 train samples, 2 unique classes
  Client 7: 8776 train samples, 2 unique classes
  Client 8: 8816 train samples, 2 unique classes
  Client 9: 8801 train samples, 2 unique classes
  Client 10: 8913 train samples, 2 unique classes
  Client 11: 8656 train samples, 2 unique classes
  Client 12: 9115 train samples, 2 unique classes
  Client 13: 8921 train samples, 2 unique classes
  Client 14: 8699 train samples, 2 unique classes
  Client 15: 8823 train samples, 2 unique classes
  Client 16: 8912 train samples, 2 unique classes
  Client 17: 8766 train samples, 2 unique classes
  Client 18: 9102 train samples, 2 unique classes
  Client 19: 8869 train samples, 2 unique classes
Will sample 4500 samples per client per epoch
Graph: erdos, nodes: 20, edges: 126
Degree statistics: avg=12.60, min=8, max=16
Attack: Compromised 4/20 nodes: [5, 12, 13, 17]
Attack type: backdoor, lambda: 1.0
Backdoor target label: 0, trigger size: 8
Model variant: baseline
Model parameters: 2,219,692
Initial test acc across nodes: mean=0.4978 ± 0.0208
Backdoor attack: Created poisoned datasets for 4 compromised nodes
Round 001: test acc mean=0.4959 ± 0.0212 | min=0.4555 max=0.5326
         : test loss mean=84.7196 ± 87.1091
         : individual accs = ['0.487719', '0.489637', '0.480035', '0.474093', '0.532628', '0.521397', '0.521397', '0.511979', '0.514085', '0.482270', '0.491259', '0.502222', '0.520833', '0.487931', '0.481317', '0.529258', '0.475737', '0.483643', '0.455488', '0.474145']
         : correct/total = [(556, 1140), (567, 1158), (541, 1127), (549, 1158), (604, 1134), (597, 1145), (597, 1145), (577, 1127), (584, 1136), (544, 1128), (562, 1144), (565, 1125), (600, 1152), (566, 1160), (541, 1124), (606, 1145), (549, 1154), (547, 1131), (527, 1157), (541, 1141)]
         : compromised: 0.5035, honest: 0.4940
Round 002: test acc mean=0.4883 ± 0.0191 | min=0.4401 max=0.5225
         : test loss mean=199.5262 ± 257.7050
         : individual accs = ['0.511404', '0.500000', '0.492458', '0.508636', '0.486772', '0.483843', '0.468122', '0.483585', '0.440141', '0.509752', '0.458042', '0.497778', '0.493924', '0.497414', '0.481317', '0.496070', '0.487002', '0.522546', '0.464996', '0.482910']
         : correct/total = [(583, 1140), (579, 1158), (555, 1127), (589, 1158), (552, 1134), (554, 1145), (536, 1145), (545, 1127), (500, 1136), (575, 1128), (524, 1144), (560, 1125), (569, 1152), (577, 1160), (541, 1124), (568, 1145), (562, 1154), (591, 1131), (538, 1157), (551, 1141)]
         : compromised: 0.4994, honest: 0.4856
Round 003: test acc mean=0.5116 ± 0.0195 | min=0.4690 max=0.5503
         : test loss mean=277.5170 ± 400.4726
         : individual accs = ['0.524561', '0.508636', '0.489796', '0.480138', '0.522046', '0.514410', '0.521397', '0.496007', '0.522007', '0.468972', '0.525350', '0.501333', '0.550347', '0.549138', '0.509786', '0.501310', '0.500000', '0.508400', '0.519447', '0.517967']
         : correct/total = [(598, 1140), (589, 1158), (552, 1127), (556, 1158), (592, 1134), (589, 1145), (597, 1145), (559, 1127), (593, 1136), (529, 1128), (601, 1144), (564, 1125), (634, 1152), (637, 1160), (573, 1124), (574, 1145), (577, 1154), (575, 1131), (601, 1157), (591, 1141)]
         : compromised: 0.5306, honest: 0.5068
Round 004: test acc mean=0.5079 ± 0.0169 | min=0.4778 max=0.5423
         : test loss mean=393.3532 ± 721.4673
         : individual accs = ['0.525439', '0.509499', '0.495120', '0.530225', '0.521164', '0.503930', '0.483843', '0.485359', '0.542254', '0.488475', '0.499126', '0.489778', '0.522569', '0.506897', '0.477758', '0.515284', '0.515598', '0.508400', '0.522904', '0.515337']
         : correct/total = [(599, 1140), (590, 1158), (558, 1127), (614, 1158), (591, 1134), (577, 1145), (554, 1145), (547, 1127), (616, 1136), (551, 1128), (571, 1144), (551, 1125), (602, 1152), (588, 1160), (537, 1124), (590, 1145), (595, 1154), (575, 1131), (605, 1157), (588, 1141)]
         : compromised: 0.5104, honest: 0.5073
Round 005: test acc mean=0.5159 ± 0.0116 | min=0.4911 max=0.5352
         : test loss mean=nan ± nan
         : individual accs = ['0.528947', '0.506908', '0.514641', '0.528497', '0.506173', '0.514410', '0.521397', '0.503993', '0.535211', '0.509752', '0.525350', '0.498667', '0.522569', '0.506897', '0.491103', '0.517031', '0.525997', '0.508400', '0.533276', '0.517967']
         : correct/total = [(603, 1140), (587, 1158), (580, 1127), (612, 1158), (574, 1134), (589, 1145), (597, 1145), (568, 1127), (608, 1136), (575, 1128), (601, 1144), (561, 1125), (602, 1152), (588, 1160), (552, 1124), (592, 1145), (607, 1154), (575, 1131), (617, 1157), (591, 1141)]
         : compromised: 0.5131, honest: 0.5166
Round 006: test acc mean=0.5164 ± 0.0150 | min=0.4911 max=0.5625
         : test loss mean=nan ± nan
         : individual accs = ['0.528947', '0.508636', '0.493345', '0.528497', '0.522046', '0.514410', '0.521397', '0.503993', '0.562500', '0.491135', '0.525350', '0.498667', '0.522569', '0.506897', '0.517794', '0.517031', '0.515598', '0.508400', '0.522040', '0.517967']
         : correct/total = [(603, 1140), (589, 1158), (556, 1127), (612, 1158), (592, 1134), (589, 1145), (597, 1145), (568, 1127), (639, 1136), (554, 1128), (601, 1144), (561, 1125), (602, 1152), (588, 1160), (582, 1124), (592, 1145), (595, 1154), (575, 1131), (604, 1157), (591, 1141)]
         : compromised: 0.5131, honest: 0.5172
Round 007: test acc mean=0.5164 ± 0.0150 | min=0.4911 max=0.5625
         : test loss mean=nan ± nan
         : individual accs = ['0.528947', '0.508636', '0.493345', '0.528497', '0.522046', '0.514410', '0.521397', '0.503993', '0.562500', '0.491135', '0.525350', '0.498667', '0.522569', '0.506897', '0.517794', '0.517031', '0.515598', '0.508400', '0.522040', '0.517967']
         : correct/total = [(603, 1140), (589, 1158), (556, 1127), (612, 1158), (592, 1134), (589, 1145), (597, 1145), (568, 1127), (639, 1136), (554, 1128), (601, 1144), (561, 1125), (602, 1152), (588, 1160), (582, 1124), (592, 1145), (595, 1154), (575, 1131), (604, 1157), (591, 1141)]
         : compromised: 0.5131, honest: 0.5172
Round 008: test acc mean=0.5164 ± 0.0150 | min=0.4911 max=0.5625
         : test loss mean=nan ± nan
         : individual accs = ['0.528947', '0.508636', '0.493345', '0.528497', '0.522046', '0.514410', '0.521397', '0.503993', '0.562500', '0.491135', '0.525350', '0.498667', '0.522569', '0.506897', '0.517794', '0.517031', '0.515598', '0.508400', '0.522040', '0.517967']
         : correct/total = [(603, 1140), (589, 1158), (556, 1127), (612, 1158), (592, 1134), (589, 1145), (597, 1145), (568, 1127), (639, 1136), (554, 1128), (601, 1144), (561, 1125), (602, 1152), (588, 1160), (582, 1124), (592, 1145), (595, 1154), (575, 1131), (604, 1157), (591, 1141)]
         : compromised: 0.5131, honest: 0.5172
Round 009: test acc mean=0.5164 ± 0.0150 | min=0.4911 max=0.5625
         : test loss mean=nan ± nan
         : individual accs = ['0.528947', '0.508636', '0.493345', '0.528497', '0.522046', '0.514410', '0.521397', '0.503993', '0.562500', '0.491135', '0.525350', '0.498667', '0.522569', '0.506897', '0.517794', '0.517031', '0.515598', '0.508400', '0.522040', '0.517967']
         : correct/total = [(603, 1140), (589, 1158), (556, 1127), (612, 1158), (592, 1134), (589, 1145), (597, 1145), (568, 1127), (639, 1136), (554, 1128), (601, 1144), (561, 1125), (602, 1152), (588, 1160), (582, 1124), (592, 1145), (595, 1154), (575, 1131), (604, 1157), (591, 1141)]
         : compromised: 0.5131, honest: 0.5172
Round 010: test acc mean=0.5164 ± 0.0150 | min=0.4911 max=0.5625
         : test loss mean=nan ± nan
         : individual accs = ['0.528947', '0.508636', '0.493345', '0.528497', '0.522046', '0.514410', '0.521397', '0.503993', '0.562500', '0.491135', '0.525350', '0.498667', '0.522569', '0.506897', '0.517794', '0.517031', '0.515598', '0.508400', '0.522040', '0.517967']
         : correct/total = [(603, 1140), (589, 1158), (556, 1127), (612, 1158), (592, 1134), (589, 1145), (597, 1145), (568, 1127), (639, 1136), (554, 1128), (601, 1144), (561, 1125), (602, 1152), (588, 1160), (582, 1124), (592, 1145), (595, 1154), (575, 1131), (604, 1157), (591, 1141)]
         : compromised: 0.5131, honest: 0.5172

=== FINAL RESULTS ===
Dataset: celeba, Nodes: 20, Graph: erdos, Aggregation: d-fedavg
Attack: backdoor, 20.0% compromised
Final accuracy - Compromised: 0.5131, Honest: 0.5172
Overall test accuracy: mean=0.5164 ± 0.0150

=== BACKDOOR ATTACK SUCCESS RATE (ASR) ===
Target label: 0
Trigger size: 8x8
Overall ASR: 1.0000 ± 0.0000
Honest nodes ASR: 1.0000 ± 0.0000
Compromised nodes ASR: 1.0000 ± 0.0000
Note: Higher ASR indicates more successful backdoor attack
