Device: cuda
Seed: 987654321
Looking for images in: /home/student.unimelb.edu.au/mrangwala/Projects/Sketchguard/leaf/data/celeba/data/raw/img_align_celeba
Loading 1 LEAF CelebA train files...
LEAF CelebA train: 9343 users (celebrities), 177457 samples
Looking for images in: /home/student.unimelb.edu.au/mrangwala/Projects/Sketchguard/leaf/data/celeba/data/raw/img_align_celeba
Loading 1 LEAF CelebA test files...
LEAF CelebA test: 9343 users (celebrities), 22831 samples
Found 9343 train users, 9343 test users, 9343 common users
User sample counts range: 31 (max) to 4 (min)
Distributed ALL 9343 users across 20 clients
Users per client: 467 (with 3 clients getting +1 user)
Train partition sizes: [8843, 8998, 8728, 9034, 8866, 8946, 8873, 8776, 8816, 8801, 8913, 8656, 9115, 8921, 8699, 8823, 8912, 8766, 9102, 8869]
Test partition sizes: [1140, 1158, 1127, 1158, 1134, 1145, 1145, 1127, 1136, 1128, 1144, 1125, 1152, 1160, 1124, 1145, 1154, 1131, 1157, 1141]
  Client 0: 8843 train samples, 2 unique classes
  Client 1: 8998 train samples, 2 unique classes
  Client 2: 8728 train samples, 2 unique classes
  Client 3: 9034 train samples, 2 unique classes
  Client 4: 8866 train samples, 2 unique classes
  Client 5: 8946 train samples, 2 unique classes
  Client 6: 8873 train samples, 2 unique classes
  Client 7: 8776 train samples, 2 unique classes
  Client 8: 8816 train samples, 2 unique classes
  Client 9: 8801 train samples, 2 unique classes
  Client 10: 8913 train samples, 2 unique classes
  Client 11: 8656 train samples, 2 unique classes
  Client 12: 9115 train samples, 2 unique classes
  Client 13: 8921 train samples, 2 unique classes
  Client 14: 8699 train samples, 2 unique classes
  Client 15: 8823 train samples, 2 unique classes
  Client 16: 8912 train samples, 2 unique classes
  Client 17: 8766 train samples, 2 unique classes
  Client 18: 9102 train samples, 2 unique classes
  Client 19: 8869 train samples, 2 unique classes
Will sample 4500 samples per client per epoch
Graph: fully, nodes: 20, edges: 190
Degree statistics: avg=19.00, min=19, max=19
Attack: Compromised 12/20 nodes: [1, 2, 3, 5, 8, 11, 12, 13, 14, 15, 17, 18]
Attack type: backdoor, lambda: 1.0
Backdoor target label: 0, trigger size: 8
Model variant: baseline
Model parameters: 2,219,692
UBAR ALGORITHM (Two-Stage Byzantine-resilient)
  - Model dimension: 2,219,692 parameters
  - Rho parameter: 0.4
  - Stage 1: Distance-based filtering (select 40% closest neighbors)
  - Stage 2: Performance-based selection (loss comparison)
  - Complexity: O(deg(i)×d + deg(i)×inference)
Initial test acc across nodes: mean=0.4978 ± 0.0208
Backdoor attack: Created poisoned datasets for 12 compromised nodes
Round 001: test acc mean=0.5734 ± 0.0707 | min=0.4942 max=0.6986
         : test loss mean=2332.9239 ± 1962.3734
         : individual accs = ['0.683333', '0.508636', '0.494232', '0.534542', '0.608466', '0.514410', '0.605240', '0.623780', '0.562500', '0.698582', '0.688811', '0.520889', '0.522569', '0.506897', '0.517794', '0.521397', '0.668111', '0.508400', '0.522040', '0.657318']
         : correct/total = [(779, 1140), (589, 1158), (557, 1127), (619, 1158), (690, 1134), (589, 1145), (693, 1145), (703, 1127), (639, 1136), (788, 1128), (788, 1144), (586, 1125), (602, 1152), (588, 1160), (582, 1124), (597, 1145), (771, 1154), (575, 1131), (604, 1157), (750, 1141)]
         : compromised: 0.5195, honest: 0.6542
         : ubar stats = ['Node 0: s1=0.368, s2=0.143', 'Node 1: s1=0.368, s2=1.000', 'Node 2: s1=0.368, s2=1.000']...
Round 002: test acc mean=0.5771 ± 0.0904 | min=0.4681 max=0.7452
         : test loss mean=608.3271 ± 1385.3276
         : individual accs = ['0.669298', '0.505181', '0.492458', '0.528497', '0.552910', '0.514410', '0.733624', '0.662822', '0.556338', '0.666667', '0.696678', '0.496889', '0.519097', '0.500862', '0.519573', '0.468122', '0.745234', '0.507515', '0.514261', '0.692375']
         : correct/total = [(763, 1140), (585, 1158), (555, 1127), (612, 1158), (627, 1134), (589, 1145), (840, 1145), (747, 1127), (632, 1136), (752, 1128), (797, 1144), (559, 1125), (598, 1152), (581, 1160), (584, 1124), (536, 1145), (860, 1154), (574, 1131), (595, 1157), (790, 1141)]
         : compromised: 0.5103, honest: 0.6775
         : ubar stats = ['Node 0: s1=0.368, s2=0.143', 'Node 1: s1=0.368, s2=1.000', 'Node 2: s1=0.368, s2=1.000']...
Round 003: test acc mean=0.6000 ± 0.1428 | min=0.4375 max=0.8111
         : test loss mean=nan ± nan
         : individual accs = ['0.806140', '0.491364', '0.506655', '0.471503', '0.679894', '0.485590', '0.793013', '0.739130', '0.437500', '0.781028', '0.779720', '0.498667', '0.477431', '0.493103', '0.482206', '0.517031', '0.811092', '0.491600', '0.477960', '0.779141']
         : correct/total = [(919, 1140), (569, 1158), (571, 1127), (546, 1158), (771, 1134), (556, 1145), (908, 1145), (833, 1127), (497, 1136), (881, 1128), (892, 1144), (561, 1125), (550, 1152), (572, 1160), (542, 1124), (592, 1145), (936, 1154), (556, 1131), (553, 1157), (889, 1141)]
         : compromised: 0.4859, honest: 0.7711
         : ubar stats = ['Node 0: s1=0.368, s2=0.143', 'Node 1: s1=0.368, s2=1.000', 'Node 2: s1=0.368, s2=1.000']...
Round 004: test acc mean=0.6388 ± 0.1507 | min=0.4933 max=0.8428
         : test loss mean=nan ± nan
         : individual accs = ['0.838596', '0.508636', '0.493345', '0.528497', '0.804233', '0.514410', '0.842795', '0.779059', '0.562500', '0.813830', '0.840909', '0.498667', '0.522569', '0.506897', '0.517794', '0.517031', '0.820624', '0.508400', '0.522040', '0.836109']
         : correct/total = [(956, 1140), (589, 1158), (556, 1127), (612, 1158), (912, 1134), (589, 1145), (965, 1145), (878, 1127), (639, 1136), (918, 1128), (962, 1144), (561, 1125), (602, 1152), (588, 1160), (582, 1124), (592, 1145), (947, 1154), (575, 1131), (604, 1157), (954, 1141)]
         : compromised: 0.5167, honest: 0.8220
         : ubar stats = ['Node 0: s1=0.368, s2=0.143', 'Node 1: s1=0.368, s2=0.786', 'Node 2: s1=0.368, s2=0.786']...
Round 005: test acc mean=0.6548 ± 0.1701 | min=0.4933 max=0.8804
         : test loss mean=nan ± nan
         : individual accs = ['0.821930', '0.508636', '0.493345', '0.528497', '0.846561', '0.514410', '0.875983', '0.853594', '0.562500', '0.875000', '0.874126', '0.498667', '0.522569', '0.506897', '0.517794', '0.517031', '0.880416', '0.508400', '0.522040', '0.868536']
         : correct/total = [(937, 1140), (589, 1158), (556, 1127), (612, 1158), (960, 1134), (589, 1145), (1003, 1145), (962, 1127), (639, 1136), (987, 1128), (1000, 1144), (561, 1125), (602, 1152), (588, 1160), (582, 1124), (592, 1145), (1016, 1154), (575, 1131), (604, 1157), (991, 1141)]
         : compromised: 0.5167, honest: 0.8620
         : ubar stats = ['Node 0: s1=0.368, s2=0.314', 'Node 1: s1=0.368, s2=0.657', 'Node 2: s1=0.368, s2=0.657']...
Round 006: test acc mean=0.6637 ± 0.1805 | min=0.4933 max=0.8916
         : test loss mean=nan ± nan
         : individual accs = ['0.885965', '0.508636', '0.493345', '0.528497', '0.869489', '0.514410', '0.889083', '0.880213', '0.562500', '0.889184', '0.891608', '0.498667', '0.522569', '0.506897', '0.517794', '0.517031', '0.889081', '0.508400', '0.522040', '0.878177']
         : correct/total = [(1010, 1140), (589, 1158), (556, 1127), (612, 1158), (986, 1134), (589, 1145), (1018, 1145), (992, 1127), (639, 1136), (1003, 1128), (1020, 1144), (561, 1125), (602, 1152), (588, 1160), (582, 1124), (592, 1145), (1026, 1154), (575, 1131), (604, 1157), (1002, 1141)]
         : compromised: 0.5167, honest: 0.8841
         : ubar stats = ['Node 0: s1=0.368, s2=0.286', 'Node 1: s1=0.368, s2=0.571', 'Node 2: s1=0.368, s2=0.571']...
Round 007: test acc mean=0.6673 ± 0.1849 | min=0.4933 max=0.8982
         : test loss mean=nan ± nan
         : individual accs = ['0.898246', '0.508636', '0.493345', '0.528497', '0.884480', '0.514410', '0.890830', '0.895297', '0.562500', '0.897163', '0.895979', '0.498667', '0.522569', '0.506897', '0.517794', '0.517031', '0.896014', '0.508400', '0.522040', '0.887818']
         : correct/total = [(1024, 1140), (589, 1158), (556, 1127), (612, 1158), (1003, 1134), (589, 1145), (1020, 1145), (1009, 1127), (639, 1136), (1012, 1128), (1025, 1144), (561, 1125), (602, 1152), (588, 1160), (582, 1124), (592, 1145), (1034, 1154), (575, 1131), (604, 1157), (1013, 1141)]
         : compromised: 0.5167, honest: 0.8932
         : ubar stats = ['Node 0: s1=0.368, s2=0.286', 'Node 1: s1=0.368, s2=0.510', 'Node 2: s1=0.368, s2=0.510']...
Round 008: test acc mean=0.6684 ± 0.1862 | min=0.4933 max=0.9015
         : test loss mean=nan ± nan
         : individual accs = ['0.900000', '0.508636', '0.493345', '0.528497', '0.894180', '0.514410', '0.895197', '0.901508', '0.562500', '0.898936', '0.894231', '0.498667', '0.522569', '0.506897', '0.517794', '0.517031', '0.897747', '0.508400', '0.522040', '0.885188']
         : correct/total = [(1026, 1140), (589, 1158), (556, 1127), (612, 1158), (1014, 1134), (589, 1145), (1025, 1145), (1016, 1127), (639, 1136), (1014, 1128), (1023, 1144), (561, 1125), (602, 1152), (588, 1160), (582, 1124), (592, 1145), (1036, 1154), (575, 1131), (604, 1157), (1010, 1141)]
         : compromised: 0.5167, honest: 0.8959
         : ubar stats = ['Node 0: s1=0.368, s2=0.304', 'Node 1: s1=0.368, s2=0.464', 'Node 2: s1=0.368, s2=0.464']...
Round 009: test acc mean=0.6695 ± 0.1876 | min=0.4933 max=0.9053
         : test loss mean=nan ± nan
         : individual accs = ['0.905263', '0.508636', '0.493345', '0.528497', '0.904762', '0.514410', '0.895197', '0.899734', '0.562500', '0.895390', '0.895105', '0.498667', '0.522569', '0.506897', '0.517794', '0.517031', '0.900347', '0.508400', '0.522040', '0.893953']
         : correct/total = [(1032, 1140), (589, 1158), (556, 1127), (612, 1158), (1026, 1134), (589, 1145), (1025, 1145), (1014, 1127), (639, 1136), (1010, 1128), (1024, 1144), (561, 1125), (602, 1152), (588, 1160), (582, 1124), (592, 1145), (1039, 1154), (575, 1131), (604, 1157), (1020, 1141)]
         : compromised: 0.5167, honest: 0.8987
         : ubar stats = ['Node 0: s1=0.368, s2=0.286', 'Node 1: s1=0.368, s2=0.429', 'Node 2: s1=0.368, s2=0.429']...
Round 010: test acc mean=0.6710 ± 0.1894 | min=0.4933 max=0.9070
         : test loss mean=nan ± nan
         : individual accs = ['0.907018', '0.508636', '0.493345', '0.528497', '0.899471', '0.514410', '0.896943', '0.905945', '0.562500', '0.900709', '0.902098', '0.498667', '0.522569', '0.506897', '0.517794', '0.517031', '0.906412', '0.508400', '0.522040', '0.900964']
         : correct/total = [(1034, 1140), (589, 1158), (556, 1127), (612, 1158), (1020, 1134), (589, 1145), (1027, 1145), (1021, 1127), (639, 1136), (1016, 1128), (1032, 1144), (561, 1125), (602, 1152), (588, 1160), (582, 1124), (592, 1145), (1046, 1154), (575, 1131), (604, 1157), (1028, 1141)]
         : compromised: 0.5167, honest: 0.9024
         : ubar stats = ['Node 0: s1=0.368, s2=0.314', 'Node 1: s1=0.368, s2=0.400', 'Node 2: s1=0.368, s2=0.400']...

=== FINAL RESULTS ===
Dataset: celeba, Nodes: 20, Graph: fully, Aggregation: ubar
Attack: backdoor, 60.0% compromised
Final accuracy - Compromised: 0.5167, Honest: 0.9024
Overall test accuracy: mean=0.6710 ± 0.1894

=== BACKDOOR ATTACK SUCCESS RATE (ASR) ===
Target label: 0
Trigger size: 8x8
Overall ASR: 0.8160 ± 0.2259
Honest nodes ASR: 0.5401 ± 0.0247
Compromised nodes ASR: 1.0000 ± 0.0000
Note: Higher ASR indicates more successful backdoor attack

=== UBAR SUMMARY ===
Node 0: stage1=0.368, stage2=0.314, overall=0.116
Node 1: stage1=0.368, stage2=0.400, overall=0.147
Node 2: stage1=0.368, stage2=0.400, overall=0.147
Node 3: stage1=0.368, stage2=0.400, overall=0.147
Node 4: stage1=0.368, stage2=0.429, overall=0.158
Node 5: stage1=0.368, stage2=0.400, overall=0.147
Node 6: stage1=0.368, stage2=0.200, overall=0.074
Node 7: stage1=0.368, stage2=0.586, overall=0.216
Node 8: stage1=0.368, stage2=0.400, overall=0.147
Node 9: stage1=0.368, stage2=0.414, overall=0.153
Node 10: stage1=0.368, stage2=0.329, overall=0.121
Node 11: stage1=0.368, stage2=0.314, overall=0.116
Node 12: stage1=0.368, stage2=0.400, overall=0.147
Node 13: stage1=0.368, stage2=0.400, overall=0.147
Node 14: stage1=0.368, stage2=0.400, overall=0.147
Node 15: stage1=0.368, stage2=0.314, overall=0.116
Node 16: stage1=0.368, stage2=0.286, overall=0.105
Node 17: stage1=0.368, stage2=0.400, overall=0.147
Node 18: stage1=0.368, stage2=0.400, overall=0.147
Node 19: stage1=0.368, stage2=0.400, overall=0.147

=== PARALLEL EXECUTION TIME (realistic for distributed system) ===
  COMMUNICATION (max across nodes):
    - Full model transfer: 0.000s (0.0%)
  COMPUTATION (max across nodes):
    - Distance computation: 0.053s (20.5%)
    - Loss computation: 0.200s (77.5%)
    - Aggregation: 0.005s (2.0%)
  TOTALS:
    - Total computation: 0.258s (100.0%)
    - Total communication: 0.000s (0.0%)
    - Total parallel time: 0.258s

=== PER-NODE AVERAGE TIME ===
  - Distance computation: 0.047s
  - Loss computation: 0.171s
  - Aggregation: 0.004s
  - Model transfer: 0.000s
  - Total per node: 0.222s

=== TOTAL COMPUTATIONAL WORK (sum across all nodes) ===
  - Total distance computation: 0.942s
  - Total loss computation: 3.425s
  - Total aggregation: 0.079s
  - Total model transfer: 0.000s
  - Grand total: 4.446s
  - Mean Stage 1 acceptance rate: 0.368
  - Mean Stage 2 acceptance rate: 0.379
  - Overall acceptance rate: 0.140

UBAR Algorithm Properties:
  - Model dimension: 2,219,692
  - Rho parameter: 0.4
  - Two-stage approach: Distance filtering + loss evaluation
  - Stage 1 selects: 40% of neighbors
  - Stage 2 uses: Training sample loss comparison
  - Theoretical complexity: O(deg(i)×d + deg(i)×inference)
  - Approach: UBAR paper implementation
