Device: cuda
Seed: 987654321
Looking for images in: /home/student.unimelb.edu.au/mrangwala/Projects/Sketchguard/leaf/data/celeba/data/raw/img_align_celeba
Loading 1 LEAF CelebA train files...
LEAF CelebA train: 9343 users (celebrities), 177457 samples
Looking for images in: /home/student.unimelb.edu.au/mrangwala/Projects/Sketchguard/leaf/data/celeba/data/raw/img_align_celeba
Loading 1 LEAF CelebA test files...
LEAF CelebA test: 9343 users (celebrities), 22831 samples
Found 9343 train users, 9343 test users, 9343 common users
User sample counts range: 31 (max) to 4 (min)
Distributed ALL 9343 users across 20 clients
Users per client: 467 (with 3 clients getting +1 user)
Train partition sizes: [8843, 8998, 8728, 9034, 8866, 8946, 8873, 8776, 8816, 8801, 8913, 8656, 9115, 8921, 8699, 8823, 8912, 8766, 9102, 8869]
Test partition sizes: [1140, 1158, 1127, 1158, 1134, 1145, 1145, 1127, 1136, 1128, 1144, 1125, 1152, 1160, 1124, 1145, 1154, 1131, 1157, 1141]
  Client 0: 8843 train samples, 2 unique classes
  Client 1: 8998 train samples, 2 unique classes
  Client 2: 8728 train samples, 2 unique classes
  Client 3: 9034 train samples, 2 unique classes
  Client 4: 8866 train samples, 2 unique classes
  Client 5: 8946 train samples, 2 unique classes
  Client 6: 8873 train samples, 2 unique classes
  Client 7: 8776 train samples, 2 unique classes
  Client 8: 8816 train samples, 2 unique classes
  Client 9: 8801 train samples, 2 unique classes
  Client 10: 8913 train samples, 2 unique classes
  Client 11: 8656 train samples, 2 unique classes
  Client 12: 9115 train samples, 2 unique classes
  Client 13: 8921 train samples, 2 unique classes
  Client 14: 8699 train samples, 2 unique classes
  Client 15: 8823 train samples, 2 unique classes
  Client 16: 8912 train samples, 2 unique classes
  Client 17: 8766 train samples, 2 unique classes
  Client 18: 9102 train samples, 2 unique classes
  Client 19: 8869 train samples, 2 unique classes
Will sample 4500 samples per client per epoch
Graph: erdos, nodes: 20, edges: 48
Degree statistics: avg=4.80, min=2, max=7
Attack: Compromised 4/20 nodes: [5, 12, 13, 17]
Attack type: directed_deviation, lambda: 1.0
Model variant: baseline
Model parameters: 2,219,692
UBAR ALGORITHM (Two-Stage Byzantine-resilient)
  - Model dimension: 2,219,692 parameters
  - Rho parameter: 0.8
  - Stage 1: Distance-based filtering (select 80% closest neighbors)
  - Stage 2: Performance-based selection (loss comparison)
  - Complexity: O(deg(i)×d + deg(i)×inference)
Initial test acc across nodes: mean=0.4978 ± 0.0208
Round 001: test acc mean=0.6211 ± 0.0579 | min=0.5215 max=0.7149
         : test loss mean=0.6766 ± 0.0079
         : individual accs = ['0.671053', '0.648532', '0.563443', '0.683938', '0.566138', '0.531004', '0.696943', '0.578527', '0.637324', '0.656915', '0.606643', '0.552000', '0.704861', '0.656897', '0.641459', '0.620961', '0.714905', '0.608311', '0.560069', '0.521472']
         : correct/total = [(765, 1140), (751, 1158), (635, 1127), (792, 1158), (642, 1134), (608, 1145), (798, 1145), (652, 1127), (724, 1136), (741, 1128), (694, 1144), (621, 1125), (812, 1152), (762, 1160), (721, 1124), (711, 1145), (825, 1154), (688, 1131), (648, 1157), (595, 1141)]
         : compromised: 0.6253, honest: 0.6200
         : ubar stats = ['Node 0: s1=0.667, s2=0.500', 'Node 1: s1=0.667, s2=0.750', 'Node 2: s1=0.800, s2=0.250']...
Round 002: test acc mean=0.6918 ± 0.0760 | min=0.5247 max=0.7983
         : test loss mean=0.6202 ± 0.0536
         : individual accs = ['0.695614', '0.674439', '0.689441', '0.729706', '0.524691', '0.526638', '0.798253', '0.661934', '0.733275', '0.757092', '0.702797', '0.728000', '0.710069', '0.549138', '0.671708', '0.767686', '0.752166', '0.659593', '0.763181', '0.740578']
         : correct/total = [(793, 1140), (781, 1158), (777, 1127), (845, 1158), (595, 1134), (603, 1145), (914, 1145), (746, 1127), (833, 1136), (854, 1128), (804, 1144), (819, 1125), (818, 1152), (637, 1160), (755, 1124), (879, 1145), (868, 1154), (746, 1131), (883, 1157), (845, 1141)]
         : compromised: 0.6114, honest: 0.7119
         : ubar stats = ['Node 0: s1=0.667, s2=0.750', 'Node 1: s1=0.667, s2=0.750', 'Node 2: s1=0.800, s2=0.250']...
Round 003: test acc mean=0.7657 ± 0.0732 | min=0.5644 max=0.8379
         : test loss mean=0.5482 ± 0.0934
         : individual accs = ['0.811404', '0.764249', '0.814552', '0.785838', '0.564374', '0.641921', '0.778166', '0.778172', '0.831866', '0.830674', '0.801573', '0.810667', '0.668403', '0.755172', '0.751779', '0.827948', '0.826690', '0.774536', '0.658600', '0.837862']
         : correct/total = [(925, 1140), (885, 1158), (918, 1127), (910, 1158), (640, 1134), (735, 1145), (891, 1145), (877, 1127), (945, 1136), (937, 1128), (917, 1144), (912, 1125), (770, 1152), (876, 1160), (845, 1124), (948, 1145), (954, 1154), (876, 1131), (762, 1157), (956, 1141)]
         : compromised: 0.7100, honest: 0.7797
         : ubar stats = ['Node 0: s1=0.667, s2=0.750', 'Node 1: s1=0.667, s2=0.750', 'Node 2: s1=0.800, s2=0.250']...
Round 004: test acc mean=0.8063 ± 0.0577 | min=0.6975 max=0.8671
         : test loss mean=0.4562 ± 0.0997
         : individual accs = ['0.851754', '0.858377', '0.858030', '0.844560', '0.697531', '0.710917', '0.782533', '0.714286', '0.867077', '0.867021', '0.841783', '0.848000', '0.724826', '0.812931', '0.784698', '0.734498', '0.841421', '0.798408', '0.821953', '0.865031']
         : correct/total = [(971, 1140), (994, 1158), (967, 1127), (978, 1158), (791, 1134), (814, 1145), (896, 1145), (805, 1127), (985, 1136), (978, 1128), (963, 1144), (954, 1125), (835, 1152), (943, 1160), (882, 1124), (841, 1145), (971, 1154), (903, 1131), (951, 1157), (987, 1141)]
         : compromised: 0.7618, honest: 0.8174
         : ubar stats = ['Node 0: s1=0.667, s2=0.625', 'Node 1: s1=0.667, s2=0.625', 'Node 2: s1=0.800, s2=0.250']...
Round 005: test acc mean=0.8349 ± 0.0689 | min=0.5634 max=0.8916
         : test loss mean=0.4080 ± 0.0832
         : individual accs = ['0.831579', '0.862694', '0.563443', '0.876511', '0.826279', '0.839301', '0.859389', '0.855368', '0.882923', '0.875887', '0.891608', '0.872889', '0.770833', '0.844828', '0.800712', '0.851528', '0.811092', '0.842617', '0.856525', '0.881683']
         : correct/total = [(948, 1140), (999, 1158), (635, 1127), (1015, 1158), (937, 1134), (961, 1145), (984, 1145), (964, 1127), (1003, 1136), (988, 1128), (1020, 1144), (982, 1125), (888, 1152), (980, 1160), (900, 1124), (975, 1145), (936, 1154), (953, 1131), (991, 1157), (1006, 1141)]
         : compromised: 0.8244, honest: 0.8375
         : ubar stats = ['Node 0: s1=0.667, s2=0.550', 'Node 1: s1=0.667, s2=0.600', 'Node 2: s1=0.800, s2=0.250']...
Round 006: test acc mean=0.8618 ± 0.0201 | min=0.8009 max=0.8907
         : test loss mean=0.3362 ± 0.0421
         : individual accs = ['0.866667', '0.872193', '0.832298', '0.865285', '0.862434', '0.868122', '0.868122', '0.870453', '0.889085', '0.860816', '0.890734', '0.877333', '0.837674', '0.800862', '0.848754', '0.851528', '0.868284', '0.865606', '0.856525', '0.883436']
         : correct/total = [(988, 1140), (1010, 1158), (938, 1127), (1002, 1158), (978, 1134), (994, 1145), (994, 1145), (981, 1127), (1010, 1136), (971, 1128), (1019, 1144), (987, 1125), (965, 1152), (929, 1160), (954, 1124), (975, 1145), (1002, 1154), (979, 1131), (991, 1157), (1008, 1141)]
         : compromised: 0.8431, honest: 0.8665
         : ubar stats = ['Node 0: s1=0.667, s2=0.500', 'Node 1: s1=0.667, s2=0.625', 'Node 2: s1=0.800, s2=0.375']...
Round 007: test acc mean=0.8484 ± 0.0454 | min=0.7382 max=0.8883
         : test loss mean=0.3461 ± 0.0693
         : individual accs = ['0.883333', '0.886010', '0.865129', '0.863558', '0.803351', '0.884716', '0.879476', '0.738243', '0.881162', '0.888298', '0.766608', '0.885333', '0.845486', '0.820690', '0.865658', '0.849782', '0.885615', '0.766578', '0.825411', '0.883436']
         : correct/total = [(1007, 1140), (1026, 1158), (975, 1127), (1000, 1158), (911, 1134), (1013, 1145), (1007, 1145), (832, 1127), (1001, 1136), (1002, 1128), (877, 1144), (996, 1125), (974, 1152), (952, 1160), (973, 1124), (973, 1145), (1022, 1154), (867, 1131), (955, 1157), (1008, 1141)]
         : compromised: 0.8294, honest: 0.8532
         : ubar stats = ['Node 0: s1=0.667, s2=0.464', 'Node 1: s1=0.667, s2=0.571', 'Node 2: s1=0.800, s2=0.357']...
Round 008: test acc mean=0.8761 ± 0.0141 | min=0.8353 max=0.8947
         : test loss mean=0.2982 ± 0.0246
         : individual accs = ['0.894737', '0.884283', '0.858917', '0.852332', '0.877425', '0.876856', '0.875109', '0.878438', '0.886444', '0.883865', '0.868881', '0.892444', '0.878472', '0.835345', '0.894128', '0.871616', '0.889081', '0.871795', '0.872947', '0.879053']
         : correct/total = [(1020, 1140), (1024, 1158), (968, 1127), (987, 1158), (995, 1134), (1004, 1145), (1002, 1145), (990, 1127), (1007, 1136), (997, 1128), (994, 1144), (1004, 1125), (1012, 1152), (969, 1160), (1005, 1124), (998, 1145), (1026, 1154), (986, 1131), (1010, 1157), (1003, 1141)]
         : compromised: 0.8656, honest: 0.8787
         : ubar stats = ['Node 0: s1=0.667, s2=0.438', 'Node 1: s1=0.667, s2=0.562', 'Node 2: s1=0.800, s2=0.344']...
Round 009: test acc mean=0.8784 ± 0.0147 | min=0.8498 max=0.8986
         : test loss mean=0.2933 ± 0.0282
         : individual accs = ['0.897368', '0.892055', '0.859805', '0.892919', '0.862434', '0.892576', '0.870742', '0.880213', '0.891725', '0.889184', '0.898601', '0.878222', '0.849826', '0.859483', '0.871886', '0.875983', '0.889081', '0.870027', '0.856525', '0.889571']
         : correct/total = [(1023, 1140), (1033, 1158), (969, 1127), (1034, 1158), (978, 1134), (1022, 1145), (997, 1145), (992, 1127), (1013, 1136), (1003, 1128), (1028, 1144), (988, 1125), (979, 1152), (997, 1160), (980, 1124), (1003, 1145), (1026, 1154), (984, 1131), (991, 1157), (1015, 1141)]
         : compromised: 0.8680, honest: 0.8810
         : ubar stats = ['Node 0: s1=0.667, s2=0.417', 'Node 1: s1=0.667, s2=0.611', 'Node 2: s1=0.800, s2=0.333']...
Round 010: test acc mean=0.8855 ± 0.0135 | min=0.8527 max=0.9059
         : test loss mean=0.2830 ± 0.0287
         : individual accs = ['0.897368', '0.887737', '0.872227', '0.905872', '0.884480', '0.892576', '0.873362', '0.885537', '0.889965', '0.897163', '0.902972', '0.897778', '0.890625', '0.865517', '0.895018', '0.875983', '0.852686', '0.878868', '0.869490', '0.894829']
         : correct/total = [(1023, 1140), (1028, 1158), (983, 1127), (1049, 1158), (1003, 1134), (1022, 1145), (1000, 1145), (998, 1127), (1011, 1136), (1012, 1128), (1033, 1144), (1010, 1125), (1026, 1152), (1004, 1160), (1006, 1124), (1003, 1145), (984, 1154), (994, 1131), (1006, 1157), (1021, 1141)]
         : compromised: 0.8819, honest: 0.8864
         : ubar stats = ['Node 0: s1=0.667, s2=0.400', 'Node 1: s1=0.667, s2=0.600', 'Node 2: s1=0.800, s2=0.325']...

=== FINAL RESULTS ===
Dataset: celeba, Nodes: 20, Graph: erdos, Aggregation: ubar
Attack: directed_deviation, 20.0% compromised
Final accuracy - Compromised: 0.8819, Honest: 0.8864
Overall test accuracy: mean=0.8855 ± 0.0135

=== UBAR SUMMARY ===
Node 0: stage1=0.667, stage2=0.400, overall=0.267
Node 1: stage1=0.667, stage2=0.600, overall=0.400
Node 2: stage1=0.800, stage2=0.325, overall=0.260
Node 3: stage1=0.750, stage2=0.533, overall=0.400
Node 4: stage1=0.750, stage2=0.667, overall=0.500
Node 5: stage1=0.800, stage2=0.575, overall=0.460
Node 6: stage1=0.800, stage2=0.550, overall=0.440
Node 7: stage1=0.800, stage2=0.375, overall=0.300
Node 8: stage1=0.500, stage2=1.000, overall=0.500
Node 9: stage1=0.667, stage2=0.500, overall=0.333
Node 10: stage1=0.750, stage2=0.500, overall=0.375
Node 11: stage1=0.714, stage2=0.400, overall=0.286
Node 12: stage1=0.714, stage2=0.560, overall=0.400
Node 13: stage1=0.750, stage2=0.733, overall=0.550
Node 14: stage1=0.714, stage2=0.500, overall=0.357
Node 15: stage1=0.667, stage2=0.325, overall=0.217
Node 16: stage1=0.800, stage2=0.325, overall=0.260
Node 17: stage1=0.800, stage2=0.375, overall=0.300
Node 18: stage1=0.750, stage2=0.500, overall=0.375
Node 19: stage1=0.500, stage2=1.000, overall=0.500

=== PARALLEL EXECUTION TIME (realistic for distributed system) ===
  COMMUNICATION (max across nodes):
    - Full model transfer: 0.000s (0.0%)
  COMPUTATION (max across nodes):
    - Distance computation: 0.021s (10.1%)
    - Loss computation: 0.178s (87.2%)
    - Aggregation: 0.006s (2.7%)
  TOTALS:
    - Total computation: 0.204s (100.0%)
    - Total communication: 0.000s (0.0%)
    - Total parallel time: 0.204s

=== PER-NODE AVERAGE TIME ===
  - Distance computation: 0.012s
  - Loss computation: 0.135s
  - Aggregation: 0.003s
  - Model transfer: 0.000s
  - Total per node: 0.150s

=== TOTAL COMPUTATIONAL WORK (sum across all nodes) ===
  - Total distance computation: 0.249s
  - Total loss computation: 2.692s
  - Total aggregation: 0.066s
  - Total model transfer: 0.000s
  - Grand total: 3.008s
  - Mean Stage 1 acceptance rate: 0.718
  - Mean Stage 2 acceptance rate: 0.537
  - Overall acceptance rate: 0.386

UBAR Algorithm Properties:
  - Model dimension: 2,219,692
  - Rho parameter: 0.8
  - Two-stage approach: Distance filtering + loss evaluation
  - Stage 1 selects: 80% of neighbors
  - Stage 2 uses: Training sample loss comparison
  - Theoretical complexity: O(deg(i)×d + deg(i)×inference)
  - Approach: UBAR paper implementation
