Device: cuda
Seed: 987654321
Looking for images in: /home/student.unimelb.edu.au/mrangwala/Projects/Sketchguard/leaf/data/celeba/data/raw/img_align_celeba
Loading 1 LEAF CelebA train files...
LEAF CelebA train: 9343 users (celebrities), 177457 samples
Looking for images in: /home/student.unimelb.edu.au/mrangwala/Projects/Sketchguard/leaf/data/celeba/data/raw/img_align_celeba
Loading 1 LEAF CelebA test files...
LEAF CelebA test: 9343 users (celebrities), 22831 samples
Found 9343 train users, 9343 test users, 9343 common users
User sample counts range: 31 (max) to 4 (min)
Distributed ALL 9343 users across 20 clients
Users per client: 467 (with 3 clients getting +1 user)
Train partition sizes: [8843, 8998, 8728, 9034, 8866, 8946, 8873, 8776, 8816, 8801, 8913, 8656, 9115, 8921, 8699, 8823, 8912, 8766, 9102, 8869]
Test partition sizes: [1140, 1158, 1127, 1158, 1134, 1145, 1145, 1127, 1136, 1128, 1144, 1125, 1152, 1160, 1124, 1145, 1154, 1131, 1157, 1141]
  Client 0: 8843 train samples, 2 unique classes
  Client 1: 8998 train samples, 2 unique classes
  Client 2: 8728 train samples, 2 unique classes
  Client 3: 9034 train samples, 2 unique classes
  Client 4: 8866 train samples, 2 unique classes
  Client 5: 8946 train samples, 2 unique classes
  Client 6: 8873 train samples, 2 unique classes
  Client 7: 8776 train samples, 2 unique classes
  Client 8: 8816 train samples, 2 unique classes
  Client 9: 8801 train samples, 2 unique classes
  Client 10: 8913 train samples, 2 unique classes
  Client 11: 8656 train samples, 2 unique classes
  Client 12: 9115 train samples, 2 unique classes
  Client 13: 8921 train samples, 2 unique classes
  Client 14: 8699 train samples, 2 unique classes
  Client 15: 8823 train samples, 2 unique classes
  Client 16: 8912 train samples, 2 unique classes
  Client 17: 8766 train samples, 2 unique classes
  Client 18: 9102 train samples, 2 unique classes
  Client 19: 8869 train samples, 2 unique classes
Will sample 4500 samples per client per epoch
Graph: fully, nodes: 20, edges: 190
Degree statistics: avg=19.00, min=19, max=19
Attack: Compromised 14/20 nodes: [1, 2, 3, 5, 6, 8, 11, 12, 13, 14, 15, 17, 18, 19]
Attack type: krum, lambda: 1.0
Model variant: baseline
Model parameters: 2,219,692
BALANCE algorithm:
Balance Config: BALANCEConfig(gamma=2, kappa=1, alpha=0.5, min_neighbors=1)
  - Model dimension: 2,219,692 parameters
  - Complexity: O(N×d) = O(20×2,219,692)
Initial test acc across nodes: mean=0.4978 ± 0.0208
Round 001: test acc mean=0.6682 ± 0.0471 | min=0.5838 max=0.7368
         : test loss mean=0.6813 ± 0.0035
         : individual accs = ['0.707018', '0.642487', '0.604259', '0.665803', '0.583774', '0.675983', '0.683843', '0.606034', '0.736796', '0.714539', '0.698427', '0.720000', '0.681424', '0.712069', '0.596975', '0.630568', '0.714905', '0.685234', '0.701815', '0.602980']
         : correct/total = [(806, 1140), (744, 1158), (681, 1127), (771, 1158), (662, 1134), (774, 1145), (783, 1145), (683, 1127), (837, 1136), (806, 1128), (799, 1144), (810, 1125), (785, 1152), (826, 1160), (671, 1124), (722, 1145), (825, 1154), (775, 1131), (812, 1157), (688, 1141)]
         : compromised: 0.6672, honest: 0.6708
Round 002: test acc mean=0.6324 ± 0.0482 | min=0.5258 max=0.7019
         : test loss mean=0.6731 ± 0.0070
         : individual accs = ['0.647368', '0.645941', '0.642413', '0.664940', '0.580247', '0.547598', '0.613100', '0.642413', '0.578345', '0.664894', '0.685315', '0.633778', '0.686632', '0.612069', '0.525801', '0.570306', '0.701906', '0.649867', '0.683665', '0.670465']
         : correct/total = [(738, 1140), (748, 1158), (724, 1127), (770, 1158), (658, 1134), (627, 1145), (702, 1145), (724, 1127), (657, 1136), (750, 1128), (784, 1144), (713, 1125), (791, 1152), (710, 1160), (591, 1124), (653, 1145), (810, 1154), (735, 1131), (791, 1157), (765, 1141)]
         : compromised: 0.6232, honest: 0.6537
Round 003: test acc mean=0.6905 ± 0.0258 | min=0.6326 max=0.7409
         : test loss mean=0.6254 ± 0.0161
         : individual accs = ['0.679825', '0.691710', '0.697427', '0.700345', '0.668430', '0.709170', '0.703930', '0.692990', '0.705106', '0.738475', '0.701923', '0.685333', '0.660590', '0.699138', '0.632562', '0.645415', '0.740901', '0.671972', '0.700086', '0.684487']
         : correct/total = [(775, 1140), (801, 1158), (786, 1127), (811, 1158), (758, 1134), (812, 1145), (806, 1145), (781, 1127), (801, 1136), (833, 1128), (803, 1144), (771, 1125), (761, 1152), (811, 1160), (711, 1124), (739, 1145), (855, 1154), (760, 1131), (810, 1157), (781, 1141)]
         : compromised: 0.6848, honest: 0.7038
Round 004: test acc mean=0.7770 ± 0.0127 | min=0.7407 max=0.7988
         : test loss mean=0.4981 ± 0.0186
         : individual accs = ['0.786842', '0.781520', '0.779947', '0.774611', '0.789242', '0.776419', '0.767686', '0.766637', '0.764965', '0.798759', '0.798077', '0.790222', '0.776910', '0.773276', '0.777580', '0.765066', '0.782496', '0.771883', '0.740709', '0.777388']
         : correct/total = [(897, 1140), (905, 1158), (879, 1127), (897, 1158), (895, 1134), (889, 1145), (879, 1145), (864, 1127), (869, 1136), (901, 1128), (913, 1144), (889, 1125), (895, 1152), (897, 1160), (874, 1124), (876, 1145), (903, 1154), (873, 1131), (857, 1157), (887, 1141)]
         : compromised: 0.7727, honest: 0.7870
Round 005: test acc mean=0.8301 ± 0.0202 | min=0.7857 max=0.8644
         : test loss mean=0.3812 ± 0.0229
         : individual accs = ['0.817544', '0.854922', '0.828749', '0.830743', '0.820988', '0.786900', '0.843668', '0.831411', '0.842430', '0.864362', '0.842657', '0.816889', '0.829861', '0.820690', '0.836299', '0.807860', '0.846620', '0.837312', '0.785653', '0.856266']
         : correct/total = [(932, 1140), (990, 1158), (934, 1127), (962, 1158), (931, 1134), (901, 1145), (966, 1145), (937, 1127), (957, 1136), (975, 1128), (964, 1144), (919, 1125), (956, 1152), (952, 1160), (940, 1124), (925, 1145), (977, 1154), (947, 1131), (909, 1157), (977, 1141)]
         : compromised: 0.8270, honest: 0.8373
Round 006: test acc mean=0.8636 ± 0.0143 | min=0.8228 max=0.8846
         : test loss mean=0.3163 ± 0.0162
         : individual accs = ['0.869298', '0.872193', '0.860692', '0.875648', '0.843034', '0.879476', '0.859389', '0.860692', '0.871479', '0.876773', '0.884615', '0.872000', '0.855903', '0.860345', '0.864769', '0.844541', '0.873484', '0.853227', '0.822818', '0.872042']
         : correct/total = [(991, 1140), (1010, 1158), (970, 1127), (1014, 1158), (956, 1134), (1007, 1145), (984, 1145), (970, 1127), (990, 1136), (989, 1128), (1012, 1144), (981, 1125), (986, 1152), (998, 1160), (972, 1124), (967, 1145), (1008, 1154), (965, 1131), (952, 1157), (995, 1141)]
         : compromised: 0.8618, honest: 0.8680
Round 007: test acc mean=0.8818 ± 0.0094 | min=0.8585 max=0.8969
         : test loss mean=0.2870 ± 0.0153
         : individual accs = ['0.878070', '0.892919', '0.878438', '0.877375', '0.870370', '0.896943', '0.888210', '0.884650', '0.887324', '0.887411', '0.893357', '0.883556', '0.876736', '0.881897', '0.886121', '0.858515', '0.887348', '0.875332', '0.864304', '0.887818']
         : correct/total = [(1001, 1140), (1034, 1158), (990, 1127), (1016, 1158), (987, 1134), (1027, 1145), (1017, 1145), (997, 1127), (1008, 1136), (1001, 1128), (1022, 1144), (994, 1125), (1010, 1152), (1023, 1160), (996, 1124), (983, 1145), (1024, 1154), (990, 1131), (1000, 1157), (1013, 1141)]
         : compromised: 0.8811, honest: 0.8835
Round 008: test acc mean=0.8854 ± 0.0087 | min=0.8704 max=0.8987
         : test loss mean=0.2774 ± 0.0150
         : individual accs = ['0.892982', '0.894646', '0.870453', '0.886874', '0.876543', '0.898690', '0.889956', '0.894410', '0.876761', '0.888298', '0.887238', '0.893333', '0.886285', '0.880172', '0.898577', '0.871616', '0.887348', '0.880637', '0.870354', '0.883436']
         : correct/total = [(1018, 1140), (1036, 1158), (981, 1127), (1027, 1158), (994, 1134), (1029, 1145), (1019, 1145), (1008, 1127), (996, 1136), (1002, 1128), (1015, 1144), (1005, 1125), (1021, 1152), (1021, 1160), (1010, 1124), (998, 1145), (1024, 1154), (996, 1131), (1007, 1157), (1008, 1141)]
         : compromised: 0.8844, honest: 0.8878
Round 009: test acc mean=0.8914 ± 0.0110 | min=0.8522 max=0.9042
         : test loss mean=0.2642 ± 0.0191
         : individual accs = ['0.899123', '0.895509', '0.881988', '0.900691', '0.890653', '0.900437', '0.896070', '0.904170', '0.891725', '0.894504', '0.892483', '0.900444', '0.892361', '0.891379', '0.895907', '0.879476', '0.893414', '0.880637', '0.852204', '0.893953']
         : correct/total = [(1025, 1140), (1037, 1158), (994, 1127), (1043, 1158), (1010, 1134), (1031, 1145), (1026, 1145), (1019, 1127), (1013, 1136), (1009, 1128), (1021, 1144), (1013, 1125), (1028, 1152), (1034, 1160), (1007, 1124), (1007, 1145), (1031, 1154), (996, 1131), (986, 1157), (1020, 1141)]
         : compromised: 0.8895, honest: 0.8957
Round 010: test acc mean=0.8972 ± 0.0068 | min=0.8807 max=0.9061
         : test loss mean=0.2531 ± 0.0151
         : individual accs = ['0.906140', '0.898100', '0.886424', '0.904145', '0.895062', '0.902183', '0.898690', '0.902396', '0.897887', '0.900709', '0.901224', '0.900444', '0.899306', '0.894828', '0.905694', '0.888210', '0.902080', '0.886826', '0.880726', '0.892200']
         : correct/total = [(1033, 1140), (1040, 1158), (999, 1127), (1047, 1158), (1015, 1134), (1033, 1145), (1029, 1145), (1017, 1127), (1020, 1136), (1016, 1128), (1031, 1144), (1013, 1125), (1036, 1152), (1038, 1160), (1018, 1124), (1017, 1145), (1041, 1154), (1003, 1131), (1019, 1157), (1018, 1141)]
         : compromised: 0.8954, honest: 0.9013

=== FINAL RESULTS ===
Dataset: celeba, Nodes: 20, Graph: fully, Aggregation: balance
Attack: krum, 70.0% compromised
Final accuracy - Compromised: 0.8954, Honest: 0.9013
Overall test accuracy: mean=0.8972 ± 0.0068

=== BALANCE SUMMARY ===
Node 0: acceptance=0.263
Node 1: acceptance=0.316
Node 2: acceptance=0.316
Node 3: acceptance=0.316
Node 4: acceptance=0.263
Node 5: acceptance=0.316
Node 6: acceptance=0.316
Node 7: acceptance=0.263
Node 8: acceptance=0.316
Node 9: acceptance=0.263
Node 10: acceptance=0.263
Node 11: acceptance=0.316
Node 12: acceptance=0.316
Node 13: acceptance=0.316
Node 14: acceptance=0.316
Node 15: acceptance=0.316
Node 16: acceptance=0.263
Node 17: acceptance=0.316
Node 18: acceptance=0.316
Node 19: acceptance=0.316

=== PARALLEL EXECUTION TIME (realistic for distributed system) ===
  COMMUNICATION (max across nodes):
    - Full model transfer: 0.000s (0.0%)
  COMPUTATION (max across nodes):
    - Filtering: 0.054s (82.9%)
    - Aggregation: 0.011s (17.1%)
  TOTALS:
    - Total computation: 0.066s (100.0%)
    - Total communication: 0.000s (0.0%)
    - Total parallel time: 0.066s

=== PER-NODE AVERAGE TIME ===
  - Filtering: 0.050s
  - Aggregation: 0.005s
  - Model transfer: 0.000s
  - Total per node: 0.055s

=== TOTAL COMPUTATIONAL WORK (sum across all nodes) ===
  - Total filtering: 0.999s
  - Total aggregation: 0.097s
  - Total model transfer: 0.000s
  - Grand total: 1.096s
  - Mean acceptance rate: 0.300

BALANCE Algorithm Properties:
  - Model dimension: 2,219,692
  - No compression: Full parameter comparison
  - Theoretical complexity: O(deg(i)×d)
  - Approach: Full parameter filtering + averaging
