Device: cuda
Seed: 987654321
Looking for images in: /home/student.unimelb.edu.au/mrangwala/Projects/Sketchguard/leaf/data/celeba/data/raw/img_align_celeba
Loading 1 LEAF CelebA train files...
LEAF CelebA train: 9343 users (celebrities), 177457 samples
Looking for images in: /home/student.unimelb.edu.au/mrangwala/Projects/Sketchguard/leaf/data/celeba/data/raw/img_align_celeba
Loading 1 LEAF CelebA test files...
LEAF CelebA test: 9343 users (celebrities), 22831 samples
Found 9343 train users, 9343 test users, 9343 common users
User sample counts range: 31 (max) to 4 (min)
Distributed ALL 9343 users across 20 clients
Users per client: 467 (with 3 clients getting +1 user)
Train partition sizes: [8843, 8998, 8728, 9034, 8866, 8946, 8873, 8776, 8816, 8801, 8913, 8656, 9115, 8921, 8699, 8823, 8912, 8766, 9102, 8869]
Test partition sizes: [1140, 1158, 1127, 1158, 1134, 1145, 1145, 1127, 1136, 1128, 1144, 1125, 1152, 1160, 1124, 1145, 1154, 1131, 1157, 1141]
  Client 0: 8843 train samples, 2 unique classes
  Client 1: 8998 train samples, 2 unique classes
  Client 2: 8728 train samples, 2 unique classes
  Client 3: 9034 train samples, 2 unique classes
  Client 4: 8866 train samples, 2 unique classes
  Client 5: 8946 train samples, 2 unique classes
  Client 6: 8873 train samples, 2 unique classes
  Client 7: 8776 train samples, 2 unique classes
  Client 8: 8816 train samples, 2 unique classes
  Client 9: 8801 train samples, 2 unique classes
  Client 10: 8913 train samples, 2 unique classes
  Client 11: 8656 train samples, 2 unique classes
  Client 12: 9115 train samples, 2 unique classes
  Client 13: 8921 train samples, 2 unique classes
  Client 14: 8699 train samples, 2 unique classes
  Client 15: 8823 train samples, 2 unique classes
  Client 16: 8912 train samples, 2 unique classes
  Client 17: 8766 train samples, 2 unique classes
  Client 18: 9102 train samples, 2 unique classes
  Client 19: 8869 train samples, 2 unique classes
Will sample 4500 samples per client per epoch
Graph: erdos, nodes: 20, edges: 99
Degree statistics: avg=9.90, min=7, max=14
Attack: Compromised 8/20 nodes: [1, 5, 11, 12, 13, 14, 17, 18]
Attack type: directed_deviation, lambda: 1.0
Model variant: baseline
Model parameters: 2,219,692
UBAR ALGORITHM (Two-Stage Byzantine-resilient)
  - Model dimension: 2,219,692 parameters
  - Rho parameter: 0.6
  - Stage 1: Distance-based filtering (select 60% closest neighbors)
  - Stage 2: Performance-based selection (loss comparison)
  - Complexity: O(deg(i)×d + deg(i)×inference)
Initial test acc across nodes: mean=0.4978 ± 0.0208
Round 001: test acc mean=0.6178 ± 0.0626 | min=0.5013 max=0.7118
         : test loss mean=0.6781 ± 0.0057
         : individual accs = ['0.625439', '0.663212', '0.637977', '0.639896', '0.524691', '0.531878', '0.655895', '0.585626', '0.573063', '0.648936', '0.579545', '0.501333', '0.711806', '0.687069', '0.686833', '0.707424', '0.630849', '0.581786', '0.522040', '0.660824']
         : correct/total = [(713, 1140), (768, 1158), (719, 1127), (741, 1158), (595, 1134), (609, 1145), (751, 1145), (660, 1127), (651, 1136), (732, 1128), (663, 1144), (564, 1125), (820, 1152), (797, 1160), (772, 1124), (810, 1145), (728, 1154), (658, 1131), (604, 1157), (754, 1141)]
         : compromised: 0.6107, honest: 0.6225
         : ubar stats = ['Node 0: s1=0.583, s2=0.143', 'Node 1: s1=0.600, s2=0.833', 'Node 2: s1=0.500, s2=0.250']...
Round 002: test acc mean=0.6738 ± 0.0726 | min=0.5265 max=0.7764
         : test loss mean=0.6470 ± 0.0382
         : individual accs = ['0.691228', '0.670121', '0.582076', '0.739206', '0.526455', '0.582533', '0.613100', '0.692103', '0.742958', '0.716312', '0.765734', '0.685333', '0.716146', '0.662931', '0.529359', '0.736245', '0.776430', '0.639257', '0.742437', '0.666082']
         : correct/total = [(788, 1140), (776, 1158), (656, 1127), (856, 1158), (597, 1134), (667, 1145), (702, 1145), (780, 1127), (844, 1136), (808, 1128), (876, 1144), (771, 1125), (825, 1152), (769, 1160), (595, 1124), (843, 1145), (896, 1154), (723, 1131), (859, 1157), (760, 1141)]
         : compromised: 0.6535, honest: 0.6873
         : ubar stats = ['Node 0: s1=0.583, s2=0.143', 'Node 1: s1=0.600, s2=0.750', 'Node 2: s1=0.500, s2=0.250']...
Round 003: test acc mean=0.7523 ± 0.0611 | min=0.5703 max=0.8432
         : test loss mean=0.5716 ± 0.0792
         : individual accs = ['0.723684', '0.718480', '0.771961', '0.788428', '0.694885', '0.736245', '0.733624', '0.748891', '0.795775', '0.813830', '0.824301', '0.751111', '0.689236', '0.732759', '0.570285', '0.807860', '0.843154', '0.796640', '0.805532', '0.700263']
         : correct/total = [(825, 1140), (832, 1158), (870, 1127), (913, 1158), (788, 1134), (843, 1145), (840, 1145), (844, 1127), (904, 1136), (918, 1128), (943, 1144), (845, 1125), (794, 1152), (850, 1160), (641, 1124), (925, 1145), (973, 1154), (901, 1131), (932, 1157), (799, 1141)]
         : compromised: 0.7250, honest: 0.7706
         : ubar stats = ['Node 0: s1=0.583, s2=0.333', 'Node 1: s1=0.600, s2=0.778', 'Node 2: s1=0.500, s2=0.250']...
Round 004: test acc mean=0.7971 ± 0.0570 | min=0.6101 max=0.8533
         : test loss mean=0.4749 ± 0.0914
         : individual accs = ['0.813158', '0.784974', '0.838509', '0.839378', '0.793651', '0.853275', '0.735371', '0.804791', '0.844190', '0.851950', '0.824301', '0.736000', '0.771701', '0.759483', '0.762456', '0.829694', '0.850087', '0.610080', '0.844425', '0.794040']
         : correct/total = [(927, 1140), (909, 1158), (945, 1127), (972, 1158), (900, 1134), (977, 1145), (842, 1145), (907, 1127), (959, 1136), (961, 1128), (943, 1144), (828, 1125), (889, 1152), (881, 1160), (857, 1124), (950, 1145), (981, 1154), (690, 1131), (977, 1157), (906, 1141)]
         : compromised: 0.7653, honest: 0.8183
         : ubar stats = ['Node 0: s1=0.583, s2=0.357', 'Node 1: s1=0.600, s2=0.750', 'Node 2: s1=0.500, s2=0.250']...
Round 005: test acc mean=0.8383 ± 0.0309 | min=0.7520 max=0.8722
         : test loss mean=0.3928 ± 0.0605
         : individual accs = ['0.842105', '0.872193', '0.837622', '0.855786', '0.828924', '0.848908', '0.816594', '0.834073', '0.863556', '0.862589', '0.868007', '0.837333', '0.765625', '0.822414', '0.841637', '0.861135', '0.868284', '0.830239', '0.856525', '0.751972']
         : correct/total = [(960, 1140), (1010, 1158), (944, 1127), (991, 1158), (940, 1134), (972, 1145), (935, 1145), (940, 1127), (981, 1136), (973, 1128), (993, 1144), (942, 1125), (882, 1152), (954, 1160), (946, 1124), (986, 1145), (1002, 1154), (939, 1131), (991, 1157), (858, 1141)]
         : compromised: 0.8344, honest: 0.8409
         : ubar stats = ['Node 0: s1=0.583, s2=0.400', 'Node 1: s1=0.600, s2=0.667', 'Node 2: s1=0.500, s2=0.250']...
Round 006: test acc mean=0.8533 ± 0.0498 | min=0.6485 max=0.8907
         : test loss mean=0.3466 ± 0.0627
         : individual accs = ['0.878070', '0.871330', '0.864241', '0.648532', '0.858025', '0.886463', '0.868122', '0.850932', '0.879401', '0.854610', '0.890734', '0.813333', '0.862847', '0.855172', '0.846085', '0.866376', '0.887348', '0.862069', '0.862576', '0.858896']
         : correct/total = [(1001, 1140), (1009, 1158), (974, 1127), (751, 1158), (973, 1134), (1015, 1145), (994, 1145), (959, 1127), (999, 1136), (964, 1128), (1019, 1144), (915, 1125), (994, 1152), (992, 1160), (951, 1124), (992, 1145), (1024, 1154), (975, 1131), (998, 1157), (980, 1141)]
         : compromised: 0.8575, honest: 0.8504
         : ubar stats = ['Node 0: s1=0.583, s2=0.381', 'Node 1: s1=0.600, s2=0.611', 'Node 2: s1=0.500, s2=0.292']...
Round 007: test acc mean=0.8768 ± 0.0115 | min=0.8576 max=0.8969
         : test loss mean=0.2980 ± 0.0227
         : individual accs = ['0.883333', '0.893782', '0.878438', '0.879965', '0.880952', '0.896943', '0.870742', '0.858030', '0.874120', '0.890957', '0.879371', '0.871111', '0.861979', '0.869828', '0.860320', '0.857642', '0.890815', '0.887710', '0.871219', '0.878177']
         : correct/total = [(1007, 1140), (1035, 1158), (990, 1127), (1019, 1158), (999, 1134), (1027, 1145), (997, 1145), (967, 1127), (993, 1136), (1005, 1128), (1006, 1144), (980, 1125), (993, 1152), (1009, 1160), (967, 1124), (982, 1145), (1028, 1154), (1004, 1131), (1008, 1157), (1002, 1141)]
         : compromised: 0.8766, honest: 0.8769
         : ubar stats = ['Node 0: s1=0.583, s2=0.347', 'Node 1: s1=0.600, s2=0.571', 'Node 2: s1=0.500, s2=0.286']...
Round 008: test acc mean=0.8815 ± 0.0095 | min=0.8627 max=0.8960
         : test loss mean=0.2853 ± 0.0178
         : individual accs = ['0.894737', '0.888601', '0.878438', '0.867012', '0.890653', '0.892576', '0.882969', '0.878438', '0.862676', '0.888298', '0.874126', '0.883556', '0.876736', '0.871552', '0.895907', '0.878603', '0.896014', '0.880637', '0.872947', '0.874671']
         : correct/total = [(1020, 1140), (1029, 1158), (990, 1127), (1004, 1158), (1010, 1134), (1022, 1145), (1011, 1145), (990, 1127), (980, 1136), (1002, 1128), (1000, 1144), (994, 1125), (1010, 1152), (1011, 1160), (1007, 1124), (1006, 1145), (1034, 1154), (996, 1131), (1010, 1157), (998, 1141)]
         : compromised: 0.8828, honest: 0.8806
         : ubar stats = ['Node 0: s1=0.583, s2=0.321', 'Node 1: s1=0.600, s2=0.521', 'Node 2: s1=0.500, s2=0.281']...
Round 009: test acc mean=0.8897 ± 0.0121 | min=0.8574 max=0.9030
         : test loss mean=0.2682 ± 0.0208
         : individual accs = ['0.901754', '0.895509', '0.880213', '0.894646', '0.892416', '0.900437', '0.889083', '0.896185', '0.899648', '0.887411', '0.902972', '0.901333', '0.883681', '0.889655', '0.897687', '0.876856', '0.894281', '0.862953', '0.857390', '0.889571']
         : correct/total = [(1028, 1140), (1037, 1158), (992, 1127), (1036, 1158), (1012, 1134), (1031, 1145), (1018, 1145), (1010, 1127), (1022, 1136), (1001, 1128), (1033, 1144), (1014, 1125), (1018, 1152), (1032, 1160), (1009, 1124), (1004, 1145), (1032, 1154), (976, 1131), (992, 1157), (1015, 1141)]
         : compromised: 0.8861, honest: 0.8921
         : ubar stats = ['Node 0: s1=0.583, s2=0.302', 'Node 1: s1=0.600, s2=0.500', 'Node 2: s1=0.500, s2=0.306']...
Round 010: test acc mean=0.8933 ± 0.0112 | min=0.8634 max=0.9070
         : test loss mean=0.2608 ± 0.0188
         : individual accs = ['0.907018', '0.898964', '0.863354', '0.896373', '0.902116', '0.905677', '0.890830', '0.897072', '0.900528', '0.902482', '0.892483', '0.889778', '0.890625', '0.898276', '0.900356', '0.882096', '0.896880', '0.871795', '0.878133', '0.900964']
         : correct/total = [(1034, 1140), (1041, 1158), (973, 1127), (1038, 1158), (1023, 1134), (1037, 1145), (1020, 1145), (1011, 1127), (1023, 1136), (1018, 1128), (1021, 1144), (1001, 1125), (1026, 1152), (1042, 1160), (1012, 1124), (1010, 1145), (1035, 1154), (986, 1131), (1016, 1157), (1028, 1141)]
         : compromised: 0.8917, honest: 0.8943
         : ubar stats = ['Node 0: s1=0.583, s2=0.286', 'Node 1: s1=0.600, s2=0.483', 'Node 2: s1=0.500, s2=0.300']...

=== FINAL RESULTS ===
Dataset: celeba, Nodes: 20, Graph: erdos, Aggregation: ubar
Attack: directed_deviation, 40.0% compromised
Final accuracy - Compromised: 0.8917, Honest: 0.8943
Overall test accuracy: mean=0.8933 ± 0.0112

=== UBAR SUMMARY ===
Node 0: stage1=0.583, stage2=0.286, overall=0.167
Node 1: stage1=0.600, stage2=0.483, overall=0.290
Node 2: stage1=0.500, stage2=0.300, overall=0.150
Node 3: stage1=0.571, stage2=0.425, overall=0.243
Node 4: stage1=0.556, stage2=0.480, overall=0.267
Node 5: stage1=0.600, stage2=0.383, overall=0.230
Node 6: stage1=0.583, stage2=0.457, overall=0.267
Node 7: stage1=0.545, stage2=0.533, overall=0.291
Node 8: stage1=0.571, stage2=0.275, overall=0.157
Node 9: stage1=0.545, stage2=0.317, overall=0.173
Node 10: stage1=0.500, stage2=0.350, overall=0.175
Node 11: stage1=0.583, stage2=0.343, overall=0.200
Node 12: stage1=0.583, stage2=0.571, overall=0.333
Node 13: stage1=0.556, stage2=0.680, overall=0.378
Node 14: stage1=0.571, stage2=0.625, overall=0.357
Node 15: stage1=0.556, stage2=0.200, overall=0.111
Node 16: stage1=0.571, stage2=0.300, overall=0.171
Node 17: stage1=0.500, stage2=0.300, overall=0.150
Node 18: stage1=0.583, stage2=0.371, overall=0.217
Node 19: stage1=0.600, stage2=0.433, overall=0.260

=== PARALLEL EXECUTION TIME (realistic for distributed system) ===
  COMMUNICATION (max across nodes):
    - Full model transfer: 0.000s (0.0%)
  COMPUTATION (max across nodes):
    - Distance computation: 0.034s (14.8%)
    - Loss computation: 0.191s (82.6%)
    - Aggregation: 0.006s (2.6%)
  TOTALS:
    - Total computation: 0.232s (100.0%)
    - Total communication: 0.000s (0.0%)
    - Total parallel time: 0.232s

=== PER-NODE AVERAGE TIME ===
  - Distance computation: 0.025s
  - Loss computation: 0.148s
  - Aggregation: 0.004s
  - Model transfer: 0.000s
  - Total per node: 0.177s

=== TOTAL COMPUTATIONAL WORK (sum across all nodes) ===
  - Total distance computation: 0.507s
  - Total loss computation: 2.957s
  - Total aggregation: 0.076s
  - Total model transfer: 0.000s
  - Grand total: 3.540s
  - Mean Stage 1 acceptance rate: 0.563
  - Mean Stage 2 acceptance rate: 0.406
  - Overall acceptance rate: 0.228

UBAR Algorithm Properties:
  - Model dimension: 2,219,692
  - Rho parameter: 0.6
  - Two-stage approach: Distance filtering + loss evaluation
  - Stage 1 selects: 60% of neighbors
  - Stage 2 uses: Training sample loss comparison
  - Theoretical complexity: O(deg(i)×d + deg(i)×inference)
  - Approach: UBAR paper implementation
