Device: cuda
Seed: 987654321
Looking for images in: /home/student.unimelb.edu.au/mrangwala/Projects/Sketchguard/leaf/data/celeba/data/raw/img_align_celeba
Loading 1 LEAF CelebA train files...
LEAF CelebA train: 9343 users (celebrities), 177457 samples
Looking for images in: /home/student.unimelb.edu.au/mrangwala/Projects/Sketchguard/leaf/data/celeba/data/raw/img_align_celeba
Loading 1 LEAF CelebA test files...
LEAF CelebA test: 9343 users (celebrities), 22831 samples
Found 9343 train users, 9343 test users, 9343 common users
User sample counts range: 31 (max) to 4 (min)
Distributed ALL 9343 users across 20 clients
Users per client: 467 (with 3 clients getting +1 user)
Train partition sizes: [8843, 8998, 8728, 9034, 8866, 8946, 8873, 8776, 8816, 8801, 8913, 8656, 9115, 8921, 8699, 8823, 8912, 8766, 9102, 8869]
Test partition sizes: [1140, 1158, 1127, 1158, 1134, 1145, 1145, 1127, 1136, 1128, 1144, 1125, 1152, 1160, 1124, 1145, 1154, 1131, 1157, 1141]
  Client 0: 8843 train samples, 2 unique classes
  Client 1: 8998 train samples, 2 unique classes
  Client 2: 8728 train samples, 2 unique classes
  Client 3: 9034 train samples, 2 unique classes
  Client 4: 8866 train samples, 2 unique classes
  Client 5: 8946 train samples, 2 unique classes
  Client 6: 8873 train samples, 2 unique classes
  Client 7: 8776 train samples, 2 unique classes
  Client 8: 8816 train samples, 2 unique classes
  Client 9: 8801 train samples, 2 unique classes
  Client 10: 8913 train samples, 2 unique classes
  Client 11: 8656 train samples, 2 unique classes
  Client 12: 9115 train samples, 2 unique classes
  Client 13: 8921 train samples, 2 unique classes
  Client 14: 8699 train samples, 2 unique classes
  Client 15: 8823 train samples, 2 unique classes
  Client 16: 8912 train samples, 2 unique classes
  Client 17: 8766 train samples, 2 unique classes
  Client 18: 9102 train samples, 2 unique classes
  Client 19: 8869 train samples, 2 unique classes
Will sample 4500 samples per client per epoch
Graph: erdos, nodes: 20, edges: 126
Degree statistics: avg=12.60, min=8, max=16
Attack: Compromised 4/20 nodes: [5, 12, 13, 17]
Attack type: directed_deviation, lambda: 1.0
Model variant: baseline
Model parameters: 2,219,692
Initial test acc across nodes: mean=0.4978 ± 0.0208
Round 001: test acc mean=0.4959 ± 0.0212 | min=0.4555 max=0.5326
         : test loss mean=84.7196 ± 87.1091
         : individual accs = ['0.487719', '0.489637', '0.480035', '0.474093', '0.532628', '0.521397', '0.521397', '0.511979', '0.514085', '0.482270', '0.491259', '0.502222', '0.520833', '0.487931', '0.481317', '0.529258', '0.475737', '0.483643', '0.455488', '0.474145']
         : correct/total = [(556, 1140), (567, 1158), (541, 1127), (549, 1158), (604, 1134), (597, 1145), (597, 1145), (577, 1127), (584, 1136), (544, 1128), (562, 1144), (565, 1125), (600, 1152), (566, 1160), (541, 1124), (606, 1145), (549, 1154), (547, 1131), (527, 1157), (541, 1141)]
         : compromised: 0.5035, honest: 0.4940
Round 002: test acc mean=0.4925 ± 0.0205 | min=0.4375 max=0.5289
         : test loss mean=288.1323 ± 383.0183
         : individual accs = ['0.528947', '0.493955', '0.503993', '0.508636', '0.493827', '0.487336', '0.482096', '0.494232', '0.437500', '0.521277', '0.472028', '0.510222', '0.477431', '0.497414', '0.481317', '0.483843', '0.484402', '0.523431', '0.471910', '0.496933']
         : correct/total = [(603, 1140), (572, 1158), (568, 1127), (589, 1158), (560, 1134), (558, 1145), (552, 1145), (557, 1127), (497, 1136), (588, 1128), (540, 1144), (574, 1125), (550, 1152), (577, 1160), (541, 1124), (554, 1145), (559, 1154), (592, 1131), (546, 1157), (567, 1141)]
         : compromised: 0.4964, honest: 0.4916
Round 003: test acc mean=0.5178 ± 0.0199 | min=0.4729 max=0.5581
         : test loss mean=2.0523 ± 2.1331
         : individual accs = ['0.519298', '0.535406', '0.502218', '0.500000', '0.531746', '0.526638', '0.513537', '0.500444', '0.558099', '0.539007', '0.493007', '0.472889', '0.535590', '0.522414', '0.531139', '0.511790', '0.518198', '0.493369', '0.541054', '0.510079']
         : correct/total = [(592, 1140), (620, 1158), (566, 1127), (579, 1158), (603, 1134), (603, 1145), (588, 1145), (564, 1127), (634, 1136), (608, 1128), (564, 1144), (532, 1125), (617, 1152), (606, 1160), (597, 1124), (586, 1145), (598, 1154), (558, 1131), (626, 1157), (582, 1141)]
         : compromised: 0.5195, honest: 0.5174
Round 004: test acc mean=0.5197 ± 0.0169 | min=0.4898 max=0.5616
         : test loss mean=1.1757 ± 0.6272
         : individual accs = ['0.545614', '0.525907', '0.505768', '0.529361', '0.534392', '0.498690', '0.521397', '0.511979', '0.561620', '0.515957', '0.496503', '0.489778', '0.533854', '0.519828', '0.530249', '0.508297', '0.505199', '0.519010', '0.528954', '0.510955']
         : correct/total = [(622, 1140), (609, 1158), (570, 1127), (613, 1158), (606, 1134), (571, 1145), (597, 1145), (577, 1127), (638, 1136), (582, 1128), (568, 1144), (551, 1125), (615, 1152), (603, 1160), (596, 1124), (582, 1145), (583, 1154), (587, 1131), (612, 1157), (583, 1141)]
         : compromised: 0.5178, honest: 0.5201
Round 005: test acc mean=0.5162 ± 0.0104 | min=0.4960 max=0.5382
         : test loss mean=0.8033 ± 0.1967
         : individual accs = ['0.528070', '0.507772', '0.496007', '0.515544', '0.521164', '0.515284', '0.500437', '0.515528', '0.513204', '0.517730', '0.507867', '0.504000', '0.538194', '0.516379', '0.519573', '0.521397', '0.526863', '0.503979', '0.528954', '0.526731']
         : correct/total = [(602, 1140), (588, 1158), (559, 1127), (597, 1158), (591, 1134), (590, 1145), (573, 1145), (581, 1127), (583, 1136), (584, 1128), (581, 1144), (567, 1125), (620, 1152), (599, 1160), (584, 1124), (597, 1145), (608, 1154), (570, 1131), (612, 1157), (601, 1141)]
         : compromised: 0.5185, honest: 0.5157
Round 006: test acc mean=0.5192 ± 0.0152 | min=0.4924 max=0.5519
         : test loss mean=0.7733 ± 0.1068
         : individual accs = ['0.536842', '0.506908', '0.496894', '0.539724', '0.524691', '0.511790', '0.524017', '0.509317', '0.551937', '0.535461', '0.519231', '0.492444', '0.535590', '0.513793', '0.523132', '0.509170', '0.501733', '0.508400', '0.530683', '0.512708']
         : correct/total = [(612, 1140), (587, 1158), (560, 1127), (625, 1158), (595, 1134), (586, 1145), (600, 1145), (574, 1127), (627, 1136), (604, 1128), (594, 1144), (554, 1125), (617, 1152), (596, 1160), (588, 1124), (583, 1145), (579, 1154), (575, 1131), (614, 1157), (585, 1141)]
         : compromised: 0.5174, honest: 0.5197
Round 007: test acc mean=0.5181 ± 0.0128 | min=0.4886 max=0.5459
         : test loss mean=0.7453 ± 0.1075
         : individual accs = ['0.524561', '0.511226', '0.501331', '0.525907', '0.520282', '0.545852', '0.519651', '0.508429', '0.488556', '0.525709', '0.507867', '0.511111', '0.517361', '0.520690', '0.537367', '0.524017', '0.517331', '0.500442', '0.528954', '0.524978']
         : correct/total = [(598, 1140), (592, 1158), (565, 1127), (609, 1158), (590, 1134), (625, 1145), (595, 1145), (573, 1127), (555, 1136), (593, 1128), (581, 1144), (575, 1125), (596, 1152), (604, 1160), (604, 1124), (600, 1145), (597, 1154), (566, 1131), (612, 1157), (599, 1141)]
         : compromised: 0.5211, honest: 0.5173
Round 008: test acc mean=0.5196 ± 0.0137 | min=0.4942 max=0.5546
         : test loss mean=0.7301 ± 0.0554
         : individual accs = ['0.530702', '0.508636', '0.496894', '0.537133', '0.528219', '0.512664', '0.517904', '0.510204', '0.554577', '0.531915', '0.519231', '0.494222', '0.520833', '0.519828', '0.525801', '0.511790', '0.509532', '0.508400', '0.528954', '0.524978']
         : correct/total = [(605, 1140), (589, 1158), (560, 1127), (622, 1158), (599, 1134), (587, 1145), (593, 1145), (575, 1127), (630, 1136), (600, 1128), (594, 1144), (556, 1125), (600, 1152), (603, 1160), (591, 1124), (586, 1145), (588, 1154), (575, 1131), (612, 1157), (599, 1141)]
         : compromised: 0.5154, honest: 0.5207
Round 009: test acc mean=0.5319 ± 0.0162 | min=0.5057 max=0.5694
         : test loss mean=0.7210 ± 0.0565
         : individual accs = ['0.532456', '0.516408', '0.514641', '0.542314', '0.533510', '0.569432', '0.525764', '0.511979', '0.523768', '0.532801', '0.527972', '0.508444', '0.552951', '0.537069', '0.559609', '0.532751', '0.532929', '0.505747', '0.531547', '0.545136']
         : correct/total = [(607, 1140), (598, 1158), (580, 1127), (628, 1158), (605, 1134), (652, 1145), (602, 1145), (577, 1127), (595, 1136), (601, 1128), (604, 1144), (572, 1125), (637, 1152), (623, 1160), (629, 1124), (610, 1145), (615, 1154), (572, 1131), (615, 1157), (622, 1141)]
         : compromised: 0.5413, honest: 0.5295
Round 010: test acc mean=0.5232 ± 0.0166 | min=0.4942 max=0.5546
         : test loss mean=0.7168 ± 0.0363
         : individual accs = ['0.532456', '0.508636', '0.496007', '0.548359', '0.528219', '0.513537', '0.519651', '0.509317', '0.554577', '0.549645', '0.522727', '0.494222', '0.547743', '0.530172', '0.521352', '0.516157', '0.512132', '0.511052', '0.527226', '0.521472']
         : correct/total = [(607, 1140), (589, 1158), (559, 1127), (635, 1158), (599, 1134), (588, 1145), (595, 1145), (574, 1127), (630, 1136), (620, 1128), (598, 1144), (556, 1125), (631, 1152), (615, 1160), (586, 1124), (591, 1145), (591, 1154), (578, 1131), (610, 1157), (595, 1141)]
         : compromised: 0.5256, honest: 0.5226

=== FINAL RESULTS ===
Dataset: celeba, Nodes: 20, Graph: erdos, Aggregation: d-fedavg
Attack: directed_deviation, 20.0% compromised
Final accuracy - Compromised: 0.5256, Honest: 0.5226
Overall test accuracy: mean=0.5232 ± 0.0166
