Device: cuda
Seed: 987654321
Looking for images in: /home/student.unimelb.edu.au/mrangwala/Projects/Sketchguard/leaf/data/celeba/data/raw/img_align_celeba
Loading 1 LEAF CelebA train files...
LEAF CelebA train: 9343 users (celebrities), 177457 samples
Looking for images in: /home/student.unimelb.edu.au/mrangwala/Projects/Sketchguard/leaf/data/celeba/data/raw/img_align_celeba
Loading 1 LEAF CelebA test files...
LEAF CelebA test: 9343 users (celebrities), 22831 samples
Found 9343 train users, 9343 test users, 9343 common users
User sample counts range: 31 (max) to 4 (min)
Distributed ALL 9343 users across 20 clients
Users per client: 467 (with 3 clients getting +1 user)
Train partition sizes: [8843, 8998, 8728, 9034, 8866, 8946, 8873, 8776, 8816, 8801, 8913, 8656, 9115, 8921, 8699, 8823, 8912, 8766, 9102, 8869]
Test partition sizes: [1140, 1158, 1127, 1158, 1134, 1145, 1145, 1127, 1136, 1128, 1144, 1125, 1152, 1160, 1124, 1145, 1154, 1131, 1157, 1141]
  Client 0: 8843 train samples, 2 unique classes
  Client 1: 8998 train samples, 2 unique classes
  Client 2: 8728 train samples, 2 unique classes
  Client 3: 9034 train samples, 2 unique classes
  Client 4: 8866 train samples, 2 unique classes
  Client 5: 8946 train samples, 2 unique classes
  Client 6: 8873 train samples, 2 unique classes
  Client 7: 8776 train samples, 2 unique classes
  Client 8: 8816 train samples, 2 unique classes
  Client 9: 8801 train samples, 2 unique classes
  Client 10: 8913 train samples, 2 unique classes
  Client 11: 8656 train samples, 2 unique classes
  Client 12: 9115 train samples, 2 unique classes
  Client 13: 8921 train samples, 2 unique classes
  Client 14: 8699 train samples, 2 unique classes
  Client 15: 8823 train samples, 2 unique classes
  Client 16: 8912 train samples, 2 unique classes
  Client 17: 8766 train samples, 2 unique classes
  Client 18: 9102 train samples, 2 unique classes
  Client 19: 8869 train samples, 2 unique classes
Will sample 4500 samples per client per epoch
Graph: erdos, nodes: 20, edges: 99
Degree statistics: avg=9.90, min=7, max=14
Attack: Compromised 12/20 nodes: [1, 2, 3, 5, 8, 11, 12, 13, 14, 15, 17, 18]
Attack type: directed_deviation, lambda: 1.0
Model variant: baseline
Model parameters: 2,219,692
BALANCE algorithm:
Balance Config: BALANCEConfig(gamma=2, kappa=1, alpha=0.5, min_neighbors=1)
  - Model dimension: 2,219,692 parameters
  - Complexity: O(N×d) = O(20×2,219,692)
Initial test acc across nodes: mean=0.4978 ± 0.0208
Round 001: test acc mean=0.6443 ± 0.0601 | min=0.5256 max=0.7274
         : test loss mean=0.6807 ± 0.0042
         : individual accs = ['0.690351', '0.684801', '0.533274', '0.710708', '0.525573', '0.600000', '0.641048', '0.623780', '0.573944', '0.703901', '0.619755', '0.704889', '0.727431', '0.680172', '0.587189', '0.663755', '0.689775', '0.650752', '0.702679', '0.573181']
         : correct/total = [(787, 1140), (793, 1158), (601, 1127), (823, 1158), (596, 1134), (687, 1145), (734, 1145), (703, 1127), (652, 1136), (794, 1128), (709, 1144), (793, 1125), (838, 1152), (789, 1160), (660, 1124), (760, 1145), (796, 1154), (736, 1131), (813, 1157), (654, 1141)]
         : compromised: 0.6516, honest: 0.6334
Round 002: test acc mean=0.6431 ± 0.0525 | min=0.5365 max=0.7348
         : test loss mean=0.6672 ± 0.0138
         : individual accs = ['0.658772', '0.674439', '0.578527', '0.664076', '0.599647', '0.542358', '0.622707', '0.679681', '0.692782', '0.685284', '0.686189', '0.592000', '0.693576', '0.589655', '0.536477', '0.653275', '0.734835', '0.636605', '0.671564', '0.668712']
         : correct/total = [(751, 1140), (781, 1158), (652, 1127), (769, 1158), (680, 1134), (621, 1145), (713, 1145), (766, 1127), (787, 1136), (773, 1128), (785, 1144), (666, 1125), (799, 1152), (684, 1160), (603, 1124), (748, 1145), (848, 1154), (720, 1131), (777, 1157), (763, 1141)]
         : compromised: 0.6271, honest: 0.6670
Round 003: test acc mean=0.7038 ± 0.0277 | min=0.6533 max=0.7799
         : test loss mean=0.6217 ± 0.0266
         : individual accs = ['0.712281', '0.701209', '0.687666', '0.723661', '0.682540', '0.696070', '0.724017', '0.702751', '0.713028', '0.735816', '0.723776', '0.653333', '0.675347', '0.710345', '0.678826', '0.703057', '0.779896', '0.656057', '0.708729', '0.707274']
         : correct/total = [(812, 1140), (812, 1158), (775, 1127), (838, 1158), (774, 1134), (797, 1145), (829, 1145), (792, 1127), (810, 1136), (830, 1128), (828, 1144), (735, 1125), (778, 1152), (824, 1160), (763, 1124), (805, 1145), (900, 1154), (742, 1131), (820, 1157), (807, 1141)]
         : compromised: 0.6923, honest: 0.7210
Round 004: test acc mean=0.7754 ± 0.0134 | min=0.7511 max=0.7945
         : test loss mean=0.5177 ± 0.0271
         : individual accs = ['0.789474', '0.768566', '0.775510', '0.766839', '0.794533', '0.783406', '0.774672', '0.771961', '0.776408', '0.792553', '0.793706', '0.782222', '0.770833', '0.756034', '0.778470', '0.751965', '0.785095', '0.756852', '0.751080', '0.788782']
         : correct/total = [(900, 1140), (890, 1158), (874, 1127), (888, 1158), (901, 1134), (897, 1145), (887, 1145), (870, 1127), (882, 1136), (894, 1128), (908, 1144), (880, 1125), (888, 1152), (877, 1160), (875, 1124), (861, 1145), (906, 1154), (856, 1131), (869, 1157), (900, 1141)]
         : compromised: 0.7682, honest: 0.7863
Round 005: test acc mean=0.8228 ± 0.0193 | min=0.7782 max=0.8570
         : test loss mean=0.4060 ± 0.0277
         : individual accs = ['0.830702', '0.847150', '0.811003', '0.811744', '0.820106', '0.778166', '0.829694', '0.827862', '0.841549', '0.851950', '0.833916', '0.824889', '0.798611', '0.807759', '0.827402', '0.810480', '0.857019', '0.814324', '0.795160', '0.836109']
         : correct/total = [(947, 1140), (981, 1158), (914, 1127), (940, 1158), (930, 1134), (891, 1145), (950, 1145), (933, 1127), (956, 1136), (961, 1128), (954, 1144), (928, 1125), (920, 1152), (937, 1160), (930, 1124), (928, 1145), (989, 1154), (921, 1131), (920, 1157), (954, 1141)]
         : compromised: 0.8140, honest: 0.8359
Round 006: test acc mean=0.8609 ± 0.0150 | min=0.8228 max=0.8821
         : test loss mean=0.3286 ± 0.0171
         : individual accs = ['0.864035', '0.881693', '0.863354', '0.866149', '0.848325', '0.864629', '0.867249', '0.847382', '0.873239', '0.875000', '0.879371', '0.873778', '0.842014', '0.851724', '0.854093', '0.845415', '0.882149', '0.849691', '0.822818', '0.865031']
         : correct/total = [(985, 1140), (1021, 1158), (973, 1127), (1003, 1158), (962, 1134), (990, 1145), (993, 1145), (955, 1127), (992, 1136), (987, 1128), (1006, 1144), (983, 1125), (970, 1152), (988, 1160), (960, 1124), (968, 1145), (1018, 1154), (961, 1131), (952, 1157), (987, 1141)]
         : compromised: 0.8574, honest: 0.8661
Round 007: test acc mean=0.8798 ± 0.0089 | min=0.8638 max=0.8955
         : test loss mean=0.2922 ± 0.0136
         : individual accs = ['0.878070', '0.895509', '0.882875', '0.876511', '0.874780', '0.894323', '0.892576', '0.880213', '0.880282', '0.890071', '0.882867', '0.880889', '0.870660', '0.881034', '0.880783', '0.863755', '0.880416', '0.865606', '0.864304', '0.880806']
         : correct/total = [(1001, 1140), (1037, 1158), (995, 1127), (1015, 1158), (992, 1134), (1024, 1145), (1022, 1145), (992, 1127), (1000, 1136), (1004, 1128), (1010, 1144), (991, 1125), (1003, 1152), (1022, 1160), (990, 1124), (989, 1145), (1016, 1154), (979, 1131), (1000, 1157), (1005, 1141)]
         : compromised: 0.8780, honest: 0.8825
Round 008: test acc mean=0.8832 ± 0.0104 | min=0.8646 max=0.9004
         : test loss mean=0.2812 ± 0.0152
         : individual accs = ['0.893860', '0.888601', '0.868678', '0.875648', '0.881834', '0.899563', '0.888210', '0.889973', '0.867958', '0.883865', '0.890734', '0.893333', '0.885417', '0.877586', '0.900356', '0.864629', '0.889948', '0.873563', '0.869490', '0.881683']
         : correct/total = [(1019, 1140), (1029, 1158), (979, 1127), (1014, 1158), (1000, 1134), (1030, 1145), (1017, 1145), (1003, 1127), (986, 1136), (997, 1128), (1019, 1144), (1005, 1125), (1020, 1152), (1018, 1160), (1012, 1124), (990, 1145), (1027, 1154), (988, 1131), (1006, 1157), (1006, 1141)]
         : compromised: 0.8804, honest: 0.8875
Round 009: test acc mean=0.8929 ± 0.0113 | min=0.8539 max=0.9074
         : test loss mean=0.2648 ± 0.0193
         : individual accs = ['0.900000', '0.895509', '0.887311', '0.898100', '0.897707', '0.907424', '0.896070', '0.902396', '0.900528', '0.892730', '0.893357', '0.901333', '0.894097', '0.892241', '0.900356', '0.882969', '0.892548', '0.876216', '0.853933', '0.892200']
         : correct/total = [(1026, 1140), (1037, 1158), (1000, 1127), (1040, 1158), (1018, 1134), (1039, 1145), (1026, 1145), (1017, 1127), (1023, 1136), (1007, 1128), (1022, 1144), (1014, 1125), (1030, 1152), (1035, 1160), (1012, 1124), (1011, 1145), (1030, 1154), (991, 1131), (988, 1157), (1018, 1141)]
         : compromised: 0.8908, honest: 0.8959
Round 010: test acc mean=0.8968 ± 0.0080 | min=0.8780 max=0.9084
         : test loss mean=0.2540 ± 0.0149
         : individual accs = ['0.902632', '0.896373', '0.890861', '0.904145', '0.893298', '0.908297', '0.896943', '0.902396', '0.892606', '0.907801', '0.893357', '0.899556', '0.900174', '0.900862', '0.908363', '0.890830', '0.897747', '0.877984', '0.881590', '0.890447']
         : correct/total = [(1029, 1140), (1038, 1158), (1004, 1127), (1047, 1158), (1013, 1134), (1040, 1145), (1027, 1145), (1017, 1127), (1014, 1136), (1024, 1128), (1022, 1144), (1012, 1125), (1037, 1152), (1045, 1160), (1021, 1124), (1020, 1145), (1036, 1154), (993, 1131), (1020, 1157), (1016, 1141)]
         : compromised: 0.8960, honest: 0.8981

=== FINAL RESULTS ===
Dataset: celeba, Nodes: 20, Graph: erdos, Aggregation: balance
Attack: directed_deviation, 60.0% compromised
Final accuracy - Compromised: 0.8960, Honest: 0.8981
Overall test accuracy: mean=0.8968 ± 0.0080

=== BALANCE SUMMARY ===
Node 0: acceptance=0.417
Node 1: acceptance=0.500
Node 2: acceptance=0.500
Node 3: acceptance=0.571
Node 4: acceptance=0.333
Node 5: acceptance=0.400
Node 6: acceptance=0.333
Node 7: acceptance=0.273
Node 8: acceptance=0.286
Node 9: acceptance=0.545
Node 10: acceptance=0.500
Node 11: acceptance=0.333
Node 12: acceptance=0.500
Node 13: acceptance=0.333
Node 14: acceptance=0.357
Node 15: acceptance=0.444
Node 16: acceptance=0.286
Node 17: acceptance=0.625
Node 18: acceptance=0.333
Node 19: acceptance=0.300

=== PARALLEL EXECUTION TIME (realistic for distributed system) ===
  COMMUNICATION (max across nodes):
    - Full model transfer: 0.000s (0.0%)
  COMPUTATION (max across nodes):
    - Filtering: 0.038s (77.5%)
    - Aggregation: 0.011s (22.4%)
  TOTALS:
    - Total computation: 0.048s (100.0%)
    - Total communication: 0.000s (0.0%)
    - Total parallel time: 0.048s

=== PER-NODE AVERAGE TIME ===
  - Filtering: 0.028s
  - Aggregation: 0.004s
  - Model transfer: 0.000s
  - Total per node: 0.032s

=== TOTAL COMPUTATIONAL WORK (sum across all nodes) ===
  - Total filtering: 0.551s
  - Total aggregation: 0.085s
  - Total model transfer: 0.000s
  - Grand total: 0.636s
  - Mean acceptance rate: 0.409

BALANCE Algorithm Properties:
  - Model dimension: 2,219,692
  - No compression: Full parameter comparison
  - Theoretical complexity: O(deg(i)×d)
  - Approach: Full parameter filtering + averaging
