Device: cuda
Seed: 987654321
Looking for images in: /home/student.unimelb.edu.au/mrangwala/Projects/Sketchguard/leaf/data/celeba/data/raw/img_align_celeba
Loading 1 LEAF CelebA train files...
LEAF CelebA train: 9343 users (celebrities), 177457 samples
Looking for images in: /home/student.unimelb.edu.au/mrangwala/Projects/Sketchguard/leaf/data/celeba/data/raw/img_align_celeba
Loading 1 LEAF CelebA test files...
LEAF CelebA test: 9343 users (celebrities), 22831 samples
Found 9343 train users, 9343 test users, 9343 common users
User sample counts range: 31 (max) to 4 (min)
Distributed ALL 9343 users across 20 clients
Users per client: 467 (with 3 clients getting +1 user)
Train partition sizes: [8843, 8998, 8728, 9034, 8866, 8946, 8873, 8776, 8816, 8801, 8913, 8656, 9115, 8921, 8699, 8823, 8912, 8766, 9102, 8869]
Test partition sizes: [1140, 1158, 1127, 1158, 1134, 1145, 1145, 1127, 1136, 1128, 1144, 1125, 1152, 1160, 1124, 1145, 1154, 1131, 1157, 1141]
  Client 0: 8843 train samples, 2 unique classes
  Client 1: 8998 train samples, 2 unique classes
  Client 2: 8728 train samples, 2 unique classes
  Client 3: 9034 train samples, 2 unique classes
  Client 4: 8866 train samples, 2 unique classes
  Client 5: 8946 train samples, 2 unique classes
  Client 6: 8873 train samples, 2 unique classes
  Client 7: 8776 train samples, 2 unique classes
  Client 8: 8816 train samples, 2 unique classes
  Client 9: 8801 train samples, 2 unique classes
  Client 10: 8913 train samples, 2 unique classes
  Client 11: 8656 train samples, 2 unique classes
  Client 12: 9115 train samples, 2 unique classes
  Client 13: 8921 train samples, 2 unique classes
  Client 14: 8699 train samples, 2 unique classes
  Client 15: 8823 train samples, 2 unique classes
  Client 16: 8912 train samples, 2 unique classes
  Client 17: 8766 train samples, 2 unique classes
  Client 18: 9102 train samples, 2 unique classes
  Client 19: 8869 train samples, 2 unique classes
Will sample 4500 samples per client per epoch
Graph: erdos, nodes: 20, edges: 48
Degree statistics: avg=4.80, min=2, max=7
Attack: Compromised 14/20 nodes: [1, 2, 3, 5, 6, 8, 11, 12, 13, 14, 15, 17, 18, 19]
Attack type: backdoor, lambda: 1.0
Backdoor target label: 0, trigger size: 8
Model variant: baseline
Model parameters: 2,219,692
UBAR ALGORITHM (Two-Stage Byzantine-resilient)
  - Model dimension: 2,219,692 parameters
  - Rho parameter: 0.30000000000000004
  - Stage 1: Distance-based filtering (select 30% closest neighbors)
  - Stage 2: Performance-based selection (loss comparison)
  - Complexity: O(deg(i)×d + deg(i)×inference)
Initial test acc across nodes: mean=0.4978 ± 0.0208
Backdoor attack: Created poisoned datasets for 14 compromised nodes
Round 001: test acc mean=0.5543 ± 0.0620 | min=0.4942 max=0.7158
         : test loss mean=4457.7890 ± 7013.7690
         : individual accs = ['0.664035', '0.508636', '0.494232', '0.536269', '0.571429', '0.514410', '0.521397', '0.560781', '0.562500', '0.655142', '0.644231', '0.519111', '0.522569', '0.506897', '0.517794', '0.521397', '0.715771', '0.508400', '0.522040', '0.517967']
         : correct/total = [(757, 1140), (589, 1158), (557, 1127), (621, 1158), (648, 1134), (589, 1145), (597, 1145), (632, 1127), (639, 1136), (739, 1128), (737, 1144), (584, 1125), (602, 1152), (588, 1160), (582, 1124), (597, 1145), (826, 1154), (575, 1131), (604, 1157), (591, 1141)]
         : compromised: 0.5195, honest: 0.6352
         : ubar stats = ['Node 0: s1=0.167, s2=1.000', 'Node 1: s1=0.167, s2=1.000', 'Node 2: s1=0.200, s2=1.000']...
Round 002: test acc mean=0.5747 ± 0.1052 | min=0.4568 max=0.7828
         : test loss mean=nan ± nan
         : individual accs = ['0.750000', '0.501727', '0.487134', '0.521589', '0.666667', '0.512664', '0.521397', '0.685004', '0.559859', '0.782801', '0.719406', '0.497778', '0.515625', '0.506897', '0.517794', '0.456769', '0.769497', '0.504863', '0.514261', '0.501315']
         : correct/total = [(855, 1140), (581, 1158), (549, 1127), (604, 1158), (756, 1134), (587, 1145), (597, 1145), (772, 1127), (636, 1136), (883, 1128), (823, 1144), (560, 1125), (594, 1152), (588, 1160), (582, 1124), (523, 1145), (888, 1154), (571, 1131), (595, 1157), (572, 1141)]
         : compromised: 0.5085, honest: 0.7289
         : ubar stats = ['Node 0: s1=0.167, s2=1.000', 'Node 1: s1=0.167, s2=1.000', 'Node 2: s1=0.200, s2=1.000']...
Round 003: test acc mean=0.6114 ± 0.1449 | min=0.4933 max=0.8546
         : test loss mean=nan ± nan
         : individual accs = ['0.854386', '0.508636', '0.493345', '0.528497', '0.808642', '0.514410', '0.521397', '0.805679', '0.562500', '0.854610', '0.821678', '0.498667', '0.522569', '0.506897', '0.517794', '0.517031', '0.842288', '0.508400', '0.522040', '0.517967']
         : correct/total = [(974, 1140), (589, 1158), (556, 1127), (612, 1158), (917, 1134), (589, 1145), (597, 1145), (908, 1127), (639, 1136), (964, 1128), (940, 1144), (561, 1125), (602, 1152), (588, 1160), (582, 1124), (592, 1145), (972, 1154), (575, 1131), (604, 1157), (591, 1141)]
         : compromised: 0.5172, honest: 0.8312
         : ubar stats = ['Node 0: s1=0.167, s2=1.000', 'Node 1: s1=0.167, s2=1.000', 'Node 2: s1=0.200, s2=1.000']...
Round 004: test acc mean=0.6246 ± 0.1646 | min=0.4933 max=0.8874
         : test loss mean=nan ± nan
         : individual accs = ['0.873684', '0.508636', '0.493345', '0.528497', '0.868607', '0.514410', '0.521397', '0.866903', '0.562500', '0.887411', '0.875000', '0.498667', '0.522569', '0.506897', '0.517794', '0.517031', '0.879549', '0.508400', '0.522040', '0.517967']
         : correct/total = [(996, 1140), (589, 1158), (556, 1127), (612, 1158), (985, 1134), (589, 1145), (597, 1145), (977, 1127), (639, 1136), (1001, 1128), (1001, 1144), (561, 1125), (602, 1152), (588, 1160), (582, 1124), (592, 1145), (1015, 1154), (575, 1131), (604, 1157), (591, 1141)]
         : compromised: 0.5172, honest: 0.8752
         : ubar stats = ['Node 0: s1=0.167, s2=1.000', 'Node 1: s1=0.167, s2=1.000', 'Node 2: s1=0.200, s2=1.000']...
Round 005: test acc mean=0.6250 ± 0.1654 | min=0.4933 max=0.8936
         : test loss mean=nan ± nan
         : individual accs = ['0.868421', '0.508636', '0.493345', '0.528497', '0.865079', '0.514410', '0.521397', '0.866903', '0.562500', '0.893617', '0.881993', '0.498667', '0.522569', '0.506897', '0.517794', '0.517031', '0.884749', '0.508400', '0.522040', '0.517967']
         : correct/total = [(990, 1140), (589, 1158), (556, 1127), (612, 1158), (981, 1134), (589, 1145), (597, 1145), (977, 1127), (639, 1136), (1008, 1128), (1009, 1144), (561, 1125), (602, 1152), (588, 1160), (582, 1124), (592, 1145), (1021, 1154), (575, 1131), (604, 1157), (591, 1141)]
         : compromised: 0.5172, honest: 0.8768
         : ubar stats = ['Node 0: s1=0.167, s2=1.000', 'Node 1: s1=0.167, s2=1.000', 'Node 2: s1=0.200, s2=1.000']...
Round 006: test acc mean=0.6301 ± 0.1730 | min=0.4933 max=0.9035
         : test loss mean=nan ± nan
         : individual accs = ['0.903509', '0.508636', '0.493345', '0.528497', '0.885362', '0.514410', '0.521397', '0.890861', '0.562500', '0.892730', '0.895105', '0.498667', '0.522569', '0.506897', '0.517794', '0.517031', '0.893414', '0.508400', '0.522040', '0.517967']
         : correct/total = [(1030, 1140), (589, 1158), (556, 1127), (612, 1158), (1004, 1134), (589, 1145), (597, 1145), (1004, 1127), (639, 1136), (1007, 1128), (1024, 1144), (561, 1125), (602, 1152), (588, 1160), (582, 1124), (592, 1145), (1031, 1154), (575, 1131), (604, 1157), (591, 1141)]
         : compromised: 0.5172, honest: 0.8935
         : ubar stats = ['Node 0: s1=0.167, s2=1.000', 'Node 1: s1=0.167, s2=1.000', 'Node 2: s1=0.200, s2=1.000']...
Round 007: test acc mean=0.6315 ± 0.1752 | min=0.4933 max=0.9086
         : test loss mean=nan ± nan
         : individual accs = ['0.894737', '0.508636', '0.493345', '0.528497', '0.886243', '0.514410', '0.521397', '0.908607', '0.562500', '0.903369', '0.897727', '0.498667', '0.522569', '0.506897', '0.517794', '0.517031', '0.898614', '0.508400', '0.522040', '0.517967']
         : correct/total = [(1020, 1140), (589, 1158), (556, 1127), (612, 1158), (1005, 1134), (589, 1145), (597, 1145), (1024, 1127), (639, 1136), (1019, 1128), (1027, 1144), (561, 1125), (602, 1152), (588, 1160), (582, 1124), (592, 1145), (1037, 1154), (575, 1131), (604, 1157), (591, 1141)]
         : compromised: 0.5172, honest: 0.8982
         : ubar stats = ['Node 0: s1=0.167, s2=1.000', 'Node 1: s1=0.167, s2=1.000', 'Node 2: s1=0.200, s2=1.000']...
Round 008: test acc mean=0.6323 ± 0.1764 | min=0.4933 max=0.9095
         : test loss mean=nan ± nan
         : individual accs = ['0.904386', '0.508636', '0.493345', '0.528497', '0.895062', '0.514410', '0.521397', '0.909494', '0.562500', '0.897163', '0.900350', '0.498667', '0.522569', '0.506897', '0.517794', '0.517031', '0.899480', '0.508400', '0.522040', '0.517967']
         : correct/total = [(1031, 1140), (589, 1158), (556, 1127), (612, 1158), (1015, 1134), (589, 1145), (597, 1145), (1025, 1127), (639, 1136), (1012, 1128), (1030, 1144), (561, 1125), (602, 1152), (588, 1160), (582, 1124), (592, 1145), (1038, 1154), (575, 1131), (604, 1157), (591, 1141)]
         : compromised: 0.5172, honest: 0.9010
         : ubar stats = ['Node 0: s1=0.167, s2=1.000', 'Node 1: s1=0.167, s2=1.000', 'Node 2: s1=0.200, s2=1.000']...
Round 009: test acc mean=0.6333 ± 0.1779 | min=0.4933 max=0.9113
         : test loss mean=nan ± nan
         : individual accs = ['0.907018', '0.508636', '0.493345', '0.528497', '0.902116', '0.514410', '0.521397', '0.911269', '0.562500', '0.895390', '0.899476', '0.498667', '0.522569', '0.506897', '0.517794', '0.517031', '0.909879', '0.508400', '0.522040', '0.517967']
         : correct/total = [(1034, 1140), (589, 1158), (556, 1127), (612, 1158), (1023, 1134), (589, 1145), (597, 1145), (1027, 1127), (639, 1136), (1010, 1128), (1029, 1144), (561, 1125), (602, 1152), (588, 1160), (582, 1124), (592, 1145), (1050, 1154), (575, 1131), (604, 1157), (591, 1141)]
         : compromised: 0.5172, honest: 0.9042
         : ubar stats = ['Node 0: s1=0.167, s2=1.000', 'Node 1: s1=0.167, s2=1.000', 'Node 2: s1=0.200, s2=1.000']...
Round 010: test acc mean=0.6337 ± 0.1785 | min=0.4933 max=0.9175
         : test loss mean=nan ± nan
         : individual accs = ['0.900000', '0.508636', '0.493345', '0.528497', '0.904762', '0.514410', '0.521397', '0.917480', '0.562500', '0.903369', '0.900350', '0.498667', '0.522569', '0.506897', '0.517794', '0.517031', '0.907279', '0.508400', '0.522040', '0.517967']
         : correct/total = [(1026, 1140), (589, 1158), (556, 1127), (612, 1158), (1026, 1134), (589, 1145), (597, 1145), (1034, 1127), (639, 1136), (1019, 1128), (1030, 1144), (561, 1125), (602, 1152), (588, 1160), (582, 1124), (592, 1145), (1047, 1154), (575, 1131), (604, 1157), (591, 1141)]
         : compromised: 0.5172, honest: 0.9055
         : ubar stats = ['Node 0: s1=0.167, s2=1.000', 'Node 1: s1=0.167, s2=1.000', 'Node 2: s1=0.200, s2=1.000']...

=== FINAL RESULTS ===
Dataset: celeba, Nodes: 20, Graph: erdos, Aggregation: ubar
Attack: backdoor, 70.0% compromised
Final accuracy - Compromised: 0.5172, Honest: 0.9055
Overall test accuracy: mean=0.6337 ± 0.1785

=== BACKDOOR ATTACK SUCCESS RATE (ASR) ===
Target label: 0
Trigger size: 8x8
Overall ASR: 0.8608 ± 0.2131
Honest nodes ASR: 0.5360 ± 0.0263
Compromised nodes ASR: 1.0000 ± 0.0000
Note: Higher ASR indicates more successful backdoor attack

=== UBAR SUMMARY ===
Node 0: stage1=0.167, stage2=1.000, overall=0.167
Node 1: stage1=0.167, stage2=1.000, overall=0.167
Node 2: stage1=0.200, stage2=1.000, overall=0.200
Node 3: stage1=0.250, stage2=1.000, overall=0.250
Node 4: stage1=0.250, stage2=1.000, overall=0.250
Node 5: stage1=0.200, stage2=1.000, overall=0.200
Node 6: stage1=0.200, stage2=1.000, overall=0.200
Node 7: stage1=0.200, stage2=1.000, overall=0.200
Node 8: stage1=0.500, stage2=1.000, overall=0.500
Node 9: stage1=0.333, stage2=1.000, overall=0.333
Node 10: stage1=0.250, stage2=1.000, overall=0.250
Node 11: stage1=0.286, stage2=0.600, overall=0.171
Node 12: stage1=0.286, stage2=0.600, overall=0.171
Node 13: stage1=0.250, stage2=1.000, overall=0.250
Node 14: stage1=0.286, stage2=0.550, overall=0.157
Node 15: stage1=0.167, stage2=1.000, overall=0.167
Node 16: stage1=0.200, stage2=1.000, overall=0.200
Node 17: stage1=0.200, stage2=1.000, overall=0.200
Node 18: stage1=0.250, stage2=1.000, overall=0.250
Node 19: stage1=0.500, stage2=1.000, overall=0.500

=== PARALLEL EXECUTION TIME (realistic for distributed system) ===
  COMMUNICATION (max across nodes):
    - Full model transfer: 0.000s (0.0%)
  COMPUTATION (max across nodes):
    - Distance computation: 0.018s (9.9%)
    - Loss computation: 0.165s (88.5%)
    - Aggregation: 0.003s (1.6%)
  TOTALS:
    - Total computation: 0.186s (100.0%)
    - Total communication: 0.000s (0.0%)
    - Total parallel time: 0.186s

=== PER-NODE AVERAGE TIME ===
  - Distance computation: 0.013s
  - Loss computation: 0.128s
  - Aggregation: 0.003s
  - Model transfer: 0.000s
  - Total per node: 0.144s

=== TOTAL COMPUTATIONAL WORK (sum across all nodes) ===
  - Total distance computation: 0.255s
  - Total loss computation: 2.570s
  - Total aggregation: 0.053s
  - Total model transfer: 0.000s
  - Grand total: 2.878s
  - Mean Stage 1 acceptance rate: 0.257
  - Mean Stage 2 acceptance rate: 0.938
  - Overall acceptance rate: 0.241

UBAR Algorithm Properties:
  - Model dimension: 2,219,692
  - Rho parameter: 0.30000000000000004
  - Two-stage approach: Distance filtering + loss evaluation
  - Stage 1 selects: 30% of neighbors
  - Stage 2 uses: Training sample loss comparison
  - Theoretical complexity: O(deg(i)×d + deg(i)×inference)
  - Approach: UBAR paper implementation
