Device: cuda
Seed: 987654321
Looking for images in: /home/student.unimelb.edu.au/mrangwala/Projects/Sketchguard/leaf/data/celeba/data/raw/img_align_celeba
Loading 1 LEAF CelebA train files...
LEAF CelebA train: 9343 users (celebrities), 177457 samples
Looking for images in: /home/student.unimelb.edu.au/mrangwala/Projects/Sketchguard/leaf/data/celeba/data/raw/img_align_celeba
Loading 1 LEAF CelebA test files...
LEAF CelebA test: 9343 users (celebrities), 22831 samples
Found 9343 train users, 9343 test users, 9343 common users
User sample counts range: 31 (max) to 4 (min)
Distributed ALL 9343 users across 20 clients
Users per client: 467 (with 3 clients getting +1 user)
Train partition sizes: [8843, 8998, 8728, 9034, 8866, 8946, 8873, 8776, 8816, 8801, 8913, 8656, 9115, 8921, 8699, 8823, 8912, 8766, 9102, 8869]
Test partition sizes: [1140, 1158, 1127, 1158, 1134, 1145, 1145, 1127, 1136, 1128, 1144, 1125, 1152, 1160, 1124, 1145, 1154, 1131, 1157, 1141]
  Client 0: 8843 train samples, 2 unique classes
  Client 1: 8998 train samples, 2 unique classes
  Client 2: 8728 train samples, 2 unique classes
  Client 3: 9034 train samples, 2 unique classes
  Client 4: 8866 train samples, 2 unique classes
  Client 5: 8946 train samples, 2 unique classes
  Client 6: 8873 train samples, 2 unique classes
  Client 7: 8776 train samples, 2 unique classes
  Client 8: 8816 train samples, 2 unique classes
  Client 9: 8801 train samples, 2 unique classes
  Client 10: 8913 train samples, 2 unique classes
  Client 11: 8656 train samples, 2 unique classes
  Client 12: 9115 train samples, 2 unique classes
  Client 13: 8921 train samples, 2 unique classes
  Client 14: 8699 train samples, 2 unique classes
  Client 15: 8823 train samples, 2 unique classes
  Client 16: 8912 train samples, 2 unique classes
  Client 17: 8766 train samples, 2 unique classes
  Client 18: 9102 train samples, 2 unique classes
  Client 19: 8869 train samples, 2 unique classes
Will sample 4500 samples per client per epoch
Graph: erdos, nodes: 20, edges: 126
Degree statistics: avg=12.60, min=8, max=16
Attack: Compromised 10/20 nodes: [1, 2, 5, 11, 12, 13, 14, 15, 17, 18]
Attack type: krum, lambda: 1.0
Model variant: baseline
Model parameters: 2,219,692
UBAR ALGORITHM (Two-Stage Byzantine-resilient)
  - Model dimension: 2,219,692 parameters
  - Rho parameter: 0.5
  - Stage 1: Distance-based filtering (select 50% closest neighbors)
  - Stage 2: Performance-based selection (loss comparison)
  - Complexity: O(deg(i)×d + deg(i)×inference)
Initial test acc across nodes: mean=0.4978 ± 0.0208
Round 001: test acc mean=0.6416 ± 0.0496 | min=0.5625 max=0.7197
         : test loss mean=0.6761 ± 0.0071
         : individual accs = ['0.628070', '0.645078', '0.608696', '0.695164', '0.617284', '0.661135', '0.599127', '0.623780', '0.562500', '0.672872', '0.579545', '0.615111', '0.706597', '0.705172', '0.638790', '0.719651', '0.714905', '0.583554', '0.685393', '0.569676']
         : correct/total = [(716, 1140), (747, 1158), (686, 1127), (805, 1158), (700, 1134), (757, 1145), (686, 1145), (703, 1127), (639, 1136), (759, 1128), (663, 1144), (692, 1125), (814, 1152), (818, 1160), (718, 1124), (824, 1145), (825, 1154), (660, 1131), (793, 1157), (650, 1141)]
         : compromised: 0.6569, honest: 0.6263
         : ubar stats = ['Node 0: s1=0.500, s2=0.125', 'Node 1: s1=0.455, s2=0.800', 'Node 2: s1=0.500, s2=0.167']...
Round 002: test acc mean=0.6842 ± 0.0674 | min=0.5178 max=0.7666
         : test loss mean=0.6455 ± 0.0345
         : individual accs = ['0.701754', '0.675302', '0.752440', '0.732297', '0.576720', '0.556332', '0.729258', '0.684117', '0.696303', '0.690603', '0.766608', '0.720889', '0.705729', '0.587931', '0.517794', '0.677729', '0.726170', '0.724138', '0.739844', '0.722174']
         : correct/total = [(800, 1140), (782, 1158), (848, 1127), (848, 1158), (654, 1134), (637, 1145), (835, 1145), (771, 1127), (791, 1136), (779, 1128), (877, 1144), (811, 1125), (813, 1152), (682, 1160), (582, 1124), (776, 1145), (838, 1154), (819, 1131), (856, 1157), (824, 1141)]
         : compromised: 0.6658, honest: 0.7026
         : ubar stats = ['Node 0: s1=0.500, s2=0.125', 'Node 1: s1=0.455, s2=0.600', 'Node 2: s1=0.500, s2=0.167']...
Round 003: test acc mean=0.7470 ± 0.0516 | min=0.6201 max=0.8260
         : test loss mean=0.5736 ± 0.0662
         : individual accs = ['0.805263', '0.750432', '0.803017', '0.794473', '0.650794', '0.689083', '0.751965', '0.716948', '0.739437', '0.737589', '0.826049', '0.781333', '0.704861', '0.717241', '0.620107', '0.780786', '0.794627', '0.763042', '0.774417', '0.738826']
         : correct/total = [(918, 1140), (869, 1158), (905, 1127), (920, 1158), (738, 1134), (789, 1145), (861, 1145), (808, 1127), (840, 1136), (832, 1128), (945, 1144), (879, 1125), (812, 1152), (832, 1160), (697, 1124), (894, 1145), (917, 1154), (863, 1131), (896, 1157), (843, 1141)]
         : compromised: 0.7384, honest: 0.7556
         : ubar stats = ['Node 0: s1=0.500, s2=0.167', 'Node 1: s1=0.455, s2=0.600', 'Node 2: s1=0.500, s2=0.167']...
Round 004: test acc mean=0.8000 ± 0.0319 | min=0.7413 max=0.8558
         : test loss mean=0.4836 ± 0.0565
         : individual accs = ['0.847368', '0.812608', '0.849157', '0.803972', '0.761023', '0.799127', '0.743231', '0.781721', '0.828345', '0.767730', '0.855769', '0.741333', '0.789062', '0.787069', '0.788256', '0.793013', '0.815425', '0.799293', '0.801210', '0.836109']
         : correct/total = [(966, 1140), (941, 1158), (957, 1127), (931, 1158), (863, 1134), (915, 1145), (851, 1145), (881, 1127), (941, 1136), (866, 1128), (979, 1144), (834, 1125), (909, 1152), (913, 1160), (886, 1124), (908, 1145), (941, 1154), (904, 1131), (927, 1157), (954, 1141)]
         : compromised: 0.7960, honest: 0.8041
         : ubar stats = ['Node 0: s1=0.500, s2=0.156', 'Node 1: s1=0.455, s2=0.550', 'Node 2: s1=0.500, s2=0.167']...
Round 005: test acc mean=0.8450 ± 0.0232 | min=0.7921 max=0.8834
         : test loss mean=0.3676 ± 0.0312
         : individual accs = ['0.836842', '0.883420', '0.856256', '0.840242', '0.839506', '0.792140', '0.857642', '0.828749', '0.867077', '0.867908', '0.875000', '0.832000', '0.828125', '0.826724', '0.838968', '0.840175', '0.868284', '0.851459', '0.801210', '0.868536']
         : correct/total = [(954, 1140), (1023, 1158), (965, 1127), (973, 1158), (952, 1134), (907, 1145), (982, 1145), (934, 1127), (985, 1136), (979, 1128), (1001, 1144), (936, 1125), (954, 1152), (959, 1160), (943, 1124), (962, 1145), (1002, 1154), (963, 1131), (927, 1157), (991, 1141)]
         : compromised: 0.8350, honest: 0.8550
         : ubar stats = ['Node 0: s1=0.500, s2=0.300', 'Node 1: s1=0.455, s2=0.520', 'Node 2: s1=0.500, s2=0.167']...
Round 006: test acc mean=0.8727 ± 0.0115 | min=0.8507 max=0.8916
         : test loss mean=0.3037 ± 0.0170
         : individual accs = ['0.870175', '0.876511', '0.874889', '0.873057', '0.853616', '0.889956', '0.877729', '0.866016', '0.884683', '0.879433', '0.891608', '0.882667', '0.862847', '0.867241', '0.867438', '0.850655', '0.883016', '0.867374', '0.853068', '0.882559']
         : correct/total = [(992, 1140), (1015, 1158), (986, 1127), (1011, 1158), (968, 1134), (1019, 1145), (1005, 1145), (976, 1127), (1005, 1136), (992, 1128), (1020, 1144), (993, 1125), (994, 1152), (1006, 1160), (975, 1124), (974, 1145), (1019, 1154), (981, 1131), (987, 1157), (1007, 1141)]
         : compromised: 0.8693, honest: 0.8762
         : ubar stats = ['Node 0: s1=0.500, s2=0.271', 'Node 1: s1=0.455, s2=0.533', 'Node 2: s1=0.500, s2=0.222']...
Round 007: test acc mean=0.8838 ± 0.0105 | min=0.8594 max=0.8981
         : test loss mean=0.2808 ± 0.0172
         : individual accs = ['0.886842', '0.898100', '0.881100', '0.866149', '0.873898', '0.895197', '0.882096', '0.892635', '0.890845', '0.891844', '0.889860', '0.891556', '0.878472', '0.892241', '0.873665', '0.859389', '0.892548', '0.880637', '0.868626', '0.890447']
         : correct/total = [(1011, 1140), (1040, 1158), (993, 1127), (1003, 1158), (991, 1134), (1025, 1145), (1010, 1145), (1006, 1127), (1012, 1136), (1006, 1128), (1018, 1144), (1003, 1125), (1012, 1152), (1035, 1160), (982, 1124), (984, 1145), (1030, 1154), (996, 1131), (1005, 1157), (1016, 1141)]
         : compromised: 0.8819, honest: 0.8857
         : ubar stats = ['Node 0: s1=0.500, s2=0.286', 'Node 1: s1=0.455, s2=0.571', 'Node 2: s1=0.500, s2=0.214']...
Round 008: test acc mean=0.8891 ± 0.0085 | min=0.8742 max=0.9039
         : test loss mean=0.2693 ± 0.0146
         : individual accs = ['0.888596', '0.892055', '0.880213', '0.879102', '0.886243', '0.903057', '0.890830', '0.893523', '0.885563', '0.892730', '0.896853', '0.900444', '0.889757', '0.891379', '0.903915', '0.874236', '0.894281', '0.878868', '0.874676', '0.885188']
         : correct/total = [(1013, 1140), (1033, 1158), (992, 1127), (1018, 1158), (1005, 1134), (1034, 1145), (1020, 1145), (1007, 1127), (1006, 1136), (1007, 1128), (1026, 1144), (1013, 1125), (1025, 1152), (1034, 1160), (1016, 1124), (1001, 1145), (1032, 1154), (994, 1131), (1012, 1157), (1010, 1141)]
         : compromised: 0.8889, honest: 0.8893
         : ubar stats = ['Node 0: s1=0.500, s2=0.266', 'Node 1: s1=0.455, s2=0.600', 'Node 2: s1=0.500, s2=0.250']...
Round 009: test acc mean=0.8945 ± 0.0110 | min=0.8600 max=0.9120
         : test loss mean=0.2576 ± 0.0174
         : individual accs = ['0.903509', '0.897237', '0.880213', '0.896373', '0.896825', '0.904803', '0.896943', '0.902396', '0.902289', '0.893617', '0.901224', '0.912000', '0.896701', '0.894828', '0.899466', '0.883843', '0.889081', '0.882405', '0.859983', '0.895706']
         : correct/total = [(1030, 1140), (1039, 1158), (992, 1127), (1038, 1158), (1017, 1134), (1036, 1145), (1027, 1145), (1017, 1127), (1025, 1136), (1008, 1128), (1031, 1144), (1026, 1125), (1033, 1152), (1038, 1160), (1011, 1124), (1012, 1145), (1026, 1154), (998, 1131), (995, 1157), (1022, 1141)]
         : compromised: 0.8911, honest: 0.8978
         : ubar stats = ['Node 0: s1=0.500, s2=0.250', 'Node 1: s1=0.455, s2=0.622', 'Node 2: s1=0.500, s2=0.278']...
Round 010: test acc mean=0.8974 ± 0.0093 | min=0.8755 max=0.9102
         : test loss mean=0.2505 ± 0.0167
         : individual accs = ['0.903509', '0.900691', '0.881100', '0.910190', '0.894180', '0.904803', '0.894323', '0.902396', '0.896127', '0.909574', '0.902972', '0.901333', '0.903646', '0.900862', '0.901246', '0.889083', '0.902080', '0.879752', '0.875540', '0.893953']
         : correct/total = [(1030, 1140), (1043, 1158), (993, 1127), (1054, 1158), (1014, 1134), (1036, 1145), (1024, 1145), (1017, 1127), (1018, 1136), (1026, 1128), (1033, 1144), (1014, 1125), (1041, 1152), (1045, 1160), (1013, 1124), (1018, 1145), (1041, 1154), (995, 1131), (1013, 1157), (1020, 1141)]
         : compromised: 0.8938, honest: 0.9009
         : ubar stats = ['Node 0: s1=0.500, s2=0.237', 'Node 1: s1=0.455, s2=0.580', 'Node 2: s1=0.500, s2=0.267']...

=== FINAL RESULTS ===
Dataset: celeba, Nodes: 20, Graph: erdos, Aggregation: ubar
Attack: krum, 50.0% compromised
Final accuracy - Compromised: 0.8938, Honest: 0.9009
Overall test accuracy: mean=0.8974 ± 0.0093

=== UBAR SUMMARY ===
Node 0: stage1=0.500, stage2=0.237, overall=0.119
Node 1: stage1=0.455, stage2=0.580, overall=0.264
Node 2: stage1=0.500, stage2=0.267, overall=0.133
Node 3: stage1=0.500, stage2=0.400, overall=0.200
Node 4: stage1=0.455, stage2=0.560, overall=0.255
Node 5: stage1=0.467, stage2=0.643, overall=0.300
Node 6: stage1=0.500, stage2=0.286, overall=0.143
Node 7: stage1=0.500, stage2=0.557, overall=0.279
Node 8: stage1=0.500, stage2=0.400, overall=0.200
Node 9: stage1=0.462, stage2=0.500, overall=0.231
Node 10: stage1=0.444, stage2=0.300, overall=0.133
Node 11: stage1=0.500, stage2=0.314, overall=0.157
Node 12: stage1=0.500, stage2=0.700, overall=0.350
Node 13: stage1=0.462, stage2=0.533, overall=0.246
Node 14: stage1=0.467, stage2=0.543, overall=0.253
Node 15: stage1=0.455, stage2=0.360, overall=0.164
Node 16: stage1=0.462, stage2=0.250, overall=0.115
Node 17: stage1=0.444, stage2=0.300, overall=0.133
Node 18: stage1=0.500, stage2=0.475, overall=0.237
Node 19: stage1=0.500, stage2=0.250, overall=0.125

=== PARALLEL EXECUTION TIME (realistic for distributed system) ===
  COMMUNICATION (max across nodes):
    - Full model transfer: 0.000s (0.0%)
  COMPUTATION (max across nodes):
    - Distance computation: 0.046s (18.3%)
    - Loss computation: 0.202s (79.5%)
    - Aggregation: 0.006s (2.2%)
  TOTALS:
    - Total computation: 0.254s (100.0%)
    - Total communication: 0.000s (0.0%)
    - Total parallel time: 0.254s

=== PER-NODE AVERAGE TIME ===
  - Distance computation: 0.032s
  - Loss computation: 0.169s
  - Aggregation: 0.004s
  - Model transfer: 0.000s
  - Total per node: 0.205s

=== TOTAL COMPUTATIONAL WORK (sum across all nodes) ===
  - Total distance computation: 0.645s
  - Total loss computation: 3.376s
  - Total aggregation: 0.080s
  - Total model transfer: 0.000s
  - Grand total: 4.101s
  - Mean Stage 1 acceptance rate: 0.479
  - Mean Stage 2 acceptance rate: 0.423
  - Overall acceptance rate: 0.202

UBAR Algorithm Properties:
  - Model dimension: 2,219,692
  - Rho parameter: 0.5
  - Two-stage approach: Distance filtering + loss evaluation
  - Stage 1 selects: 50% of neighbors
  - Stage 2 uses: Training sample loss comparison
  - Theoretical complexity: O(deg(i)×d + deg(i)×inference)
  - Approach: UBAR paper implementation
