Device: cuda
Seed: 987654321
Looking for images in: /home/student.unimelb.edu.au/mrangwala/Projects/Sketchguard/leaf/data/celeba/data/raw/img_align_celeba
Loading 1 LEAF CelebA train files...
LEAF CelebA train: 9343 users (celebrities), 177457 samples
Looking for images in: /home/student.unimelb.edu.au/mrangwala/Projects/Sketchguard/leaf/data/celeba/data/raw/img_align_celeba
Loading 1 LEAF CelebA test files...
LEAF CelebA test: 9343 users (celebrities), 22831 samples
Found 9343 train users, 9343 test users, 9343 common users
User sample counts range: 31 (max) to 4 (min)
Distributed ALL 9343 users across 20 clients
Users per client: 467 (with 3 clients getting +1 user)
Train partition sizes: [8843, 8998, 8728, 9034, 8866, 8946, 8873, 8776, 8816, 8801, 8913, 8656, 9115, 8921, 8699, 8823, 8912, 8766, 9102, 8869]
Test partition sizes: [1140, 1158, 1127, 1158, 1134, 1145, 1145, 1127, 1136, 1128, 1144, 1125, 1152, 1160, 1124, 1145, 1154, 1131, 1157, 1141]
  Client 0: 8843 train samples, 2 unique classes
  Client 1: 8998 train samples, 2 unique classes
  Client 2: 8728 train samples, 2 unique classes
  Client 3: 9034 train samples, 2 unique classes
  Client 4: 8866 train samples, 2 unique classes
  Client 5: 8946 train samples, 2 unique classes
  Client 6: 8873 train samples, 2 unique classes
  Client 7: 8776 train samples, 2 unique classes
  Client 8: 8816 train samples, 2 unique classes
  Client 9: 8801 train samples, 2 unique classes
  Client 10: 8913 train samples, 2 unique classes
  Client 11: 8656 train samples, 2 unique classes
  Client 12: 9115 train samples, 2 unique classes
  Client 13: 8921 train samples, 2 unique classes
  Client 14: 8699 train samples, 2 unique classes
  Client 15: 8823 train samples, 2 unique classes
  Client 16: 8912 train samples, 2 unique classes
  Client 17: 8766 train samples, 2 unique classes
  Client 18: 9102 train samples, 2 unique classes
  Client 19: 8869 train samples, 2 unique classes
Will sample 4500 samples per client per epoch
Graph: ring, nodes: 20, edges: 20
Degree statistics: avg=2.00, min=2, max=2
Attack: Compromised 2/20 nodes: [5, 13]
Attack type: directed_deviation, lambda: 1.0
Model variant: baseline
Model parameters: 2,219,692
UBAR ALGORITHM (Two-Stage Byzantine-resilient)
  - Model dimension: 2,219,692 parameters
  - Rho parameter: 0.9
  - Stage 1: Distance-based filtering (select 90% closest neighbors)
  - Stage 2: Performance-based selection (loss comparison)
  - Complexity: O(deg(i)×d + deg(i)×inference)
Initial test acc across nodes: mean=0.4978 ± 0.0208
Round 001: test acc mean=0.6486 ± 0.0405 | min=0.5555 max=0.7177
         : test loss mean=0.6740 ± 0.0061
         : individual accs = ['0.670175', '0.670121', '0.669033', '0.644214', '0.640212', '0.602620', '0.555459', '0.622005', '0.685739', '0.677305', '0.717657', '0.703111', '0.712674', '0.638793', '0.630783', '0.620961', '0.629983', '0.583554', '0.656007', '0.640666']
         : correct/total = [(764, 1140), (776, 1158), (754, 1127), (746, 1158), (726, 1134), (690, 1145), (636, 1145), (701, 1127), (779, 1136), (764, 1128), (821, 1144), (791, 1125), (821, 1152), (741, 1160), (709, 1124), (711, 1145), (727, 1154), (660, 1131), (759, 1157), (731, 1141)]
         : compromised: 0.6207, honest: 0.6516
         : ubar stats = ['Node 0: s1=0.500, s2=1.000', 'Node 1: s1=0.500, s2=1.000', 'Node 2: s1=0.500, s2=1.000']...
Round 002: test acc mean=0.7518 ± 0.0274 | min=0.6856 max=0.7858
         : test loss mean=0.5423 ± 0.0462
         : individual accs = ['0.720175', '0.729706', '0.743567', '0.737478', '0.692240', '0.685590', '0.737991', '0.767524', '0.772887', '0.776596', '0.785839', '0.778667', '0.779514', '0.756034', '0.771352', '0.772926', '0.755633', '0.745358', '0.760588', '0.766871']
         : correct/total = [(821, 1140), (845, 1158), (838, 1127), (854, 1158), (785, 1134), (785, 1145), (845, 1145), (865, 1127), (878, 1136), (876, 1128), (899, 1144), (876, 1125), (898, 1152), (877, 1160), (867, 1124), (885, 1145), (872, 1154), (843, 1131), (880, 1157), (875, 1141)]
         : compromised: 0.7208, honest: 0.7553
         : ubar stats = ['Node 0: s1=0.500, s2=1.000', 'Node 1: s1=0.500, s2=1.000', 'Node 2: s1=0.500, s2=1.000']...
Round 003: test acc mean=0.8307 ± 0.0242 | min=0.7910 max=0.8785
         : test loss mean=0.3916 ± 0.0513
         : individual accs = ['0.836842', '0.844560', '0.836735', '0.823834', '0.791005', '0.792140', '0.797380', '0.841171', '0.847711', '0.867021', '0.878497', '0.837333', '0.835069', '0.824138', '0.812278', '0.800873', '0.850087', '0.802829', '0.837511', '0.856266']
         : correct/total = [(954, 1140), (978, 1158), (943, 1127), (954, 1158), (897, 1134), (907, 1145), (913, 1145), (948, 1127), (963, 1136), (978, 1128), (1005, 1144), (942, 1125), (962, 1152), (956, 1160), (913, 1124), (917, 1145), (981, 1154), (908, 1131), (969, 1157), (977, 1141)]
         : compromised: 0.8081, honest: 0.8332
         : ubar stats = ['Node 0: s1=0.500, s2=1.000', 'Node 1: s1=0.500, s2=1.000', 'Node 2: s1=0.500, s2=1.000']...
Round 004: test acc mean=0.8681 ± 0.0116 | min=0.8479 max=0.8830
         : test loss mean=0.3125 ± 0.0263
         : individual accs = ['0.864035', '0.879965', '0.880213', '0.872193', '0.850088', '0.857642', '0.873362', '0.874002', '0.870599', '0.882979', '0.882867', '0.880889', '0.870660', '0.870690', '0.859431', '0.855022', '0.860485', '0.847922', '0.848747', '0.880806']
         : correct/total = [(985, 1140), (1019, 1158), (992, 1127), (1010, 1158), (964, 1134), (982, 1145), (1000, 1145), (985, 1127), (989, 1136), (996, 1128), (1010, 1144), (991, 1125), (1003, 1152), (1010, 1160), (966, 1124), (979, 1145), (993, 1154), (959, 1131), (982, 1157), (1005, 1141)]
         : compromised: 0.8642, honest: 0.8686
         : ubar stats = ['Node 0: s1=0.500, s2=1.000', 'Node 1: s1=0.500, s2=1.000', 'Node 2: s1=0.500, s2=1.000']...
Round 005: test acc mean=0.8723 ± 0.0199 | min=0.8211 max=0.9003
         : test loss mean=0.2974 ± 0.0312
         : individual accs = ['0.848246', '0.844560', '0.874002', '0.886010', '0.873898', '0.842795', '0.878603', '0.887311', '0.882923', '0.897163', '0.900350', '0.879111', '0.884549', '0.886207', '0.884342', '0.856769', '0.886482', '0.869142', '0.821089', '0.862401']
         : correct/total = [(967, 1140), (978, 1158), (985, 1127), (1026, 1158), (991, 1134), (965, 1145), (1006, 1145), (1000, 1127), (1003, 1136), (1012, 1128), (1030, 1144), (989, 1125), (1019, 1152), (1028, 1160), (994, 1124), (981, 1145), (1023, 1154), (983, 1131), (950, 1157), (984, 1141)]
         : compromised: 0.8645, honest: 0.8732
         : ubar stats = ['Node 0: s1=0.500, s2=1.000', 'Node 1: s1=0.500, s2=1.000', 'Node 2: s1=0.500, s2=1.000']...
Round 006: test acc mean=0.8875 ± 0.0080 | min=0.8699 max=0.9007
         : test loss mean=0.2692 ± 0.0186
         : individual accs = ['0.892982', '0.895509', '0.889086', '0.900691', '0.896825', '0.877729', '0.899563', '0.881988', '0.880282', '0.884752', '0.891608', '0.888000', '0.886285', '0.892241', '0.887011', '0.869869', '0.890815', '0.883289', '0.872947', '0.888694']
         : correct/total = [(1018, 1140), (1037, 1158), (1002, 1127), (1043, 1158), (1017, 1134), (1005, 1145), (1030, 1145), (994, 1127), (1000, 1136), (998, 1128), (1020, 1144), (999, 1125), (1021, 1152), (1035, 1160), (997, 1124), (996, 1145), (1028, 1154), (999, 1131), (1010, 1157), (1014, 1141)]
         : compromised: 0.8850, honest: 0.8878
         : ubar stats = ['Node 0: s1=0.500, s2=1.000', 'Node 1: s1=0.500, s2=1.000', 'Node 2: s1=0.500, s2=1.000']...
Round 007: test acc mean=0.8927 ± 0.0088 | min=0.8716 max=0.9078
         : test loss mean=0.2594 ± 0.0186
         : individual accs = ['0.882456', '0.892919', '0.892635', '0.902418', '0.888889', '0.903057', '0.895197', '0.896185', '0.882923', '0.907801', '0.903846', '0.898667', '0.890625', '0.896552', '0.892349', '0.871616', '0.893414', '0.887710', '0.877269', '0.896582']
         : correct/total = [(1006, 1140), (1034, 1158), (1006, 1127), (1045, 1158), (1008, 1134), (1034, 1145), (1025, 1145), (1010, 1127), (1003, 1136), (1024, 1128), (1034, 1144), (1011, 1125), (1026, 1152), (1040, 1160), (1003, 1124), (998, 1145), (1031, 1154), (1004, 1131), (1015, 1157), (1023, 1141)]
         : compromised: 0.8998, honest: 0.8919
         : ubar stats = ['Node 0: s1=0.500, s2=1.000', 'Node 1: s1=0.500, s2=1.000', 'Node 2: s1=0.500, s2=1.000']...
Round 008: test acc mean=0.8951 ± 0.0094 | min=0.8738 max=0.9066
         : test loss mean=0.2535 ± 0.0170
         : individual accs = ['0.900877', '0.898964', '0.893523', '0.905872', '0.900353', '0.897817', '0.900437', '0.892635', '0.876761', '0.894504', '0.896853', '0.904000', '0.901910', '0.900862', '0.906584', '0.882969', '0.897747', '0.877984', '0.873812', '0.898335']
         : correct/total = [(1027, 1140), (1041, 1158), (1007, 1127), (1049, 1158), (1021, 1134), (1028, 1145), (1031, 1145), (1006, 1127), (996, 1136), (1009, 1128), (1026, 1144), (1017, 1125), (1039, 1152), (1045, 1160), (1019, 1124), (1011, 1145), (1036, 1154), (993, 1131), (1011, 1157), (1025, 1141)]
         : compromised: 0.8993, honest: 0.8947
         : ubar stats = ['Node 0: s1=0.500, s2=1.000', 'Node 1: s1=0.500, s2=1.000', 'Node 2: s1=0.500, s2=1.000']...
Round 009: test acc mean=0.8966 ± 0.0096 | min=0.8729 max=0.9084
         : test loss mean=0.2498 ± 0.0194
         : individual accs = ['0.900000', '0.900691', '0.896185', '0.904145', '0.902998', '0.906550', '0.904803', '0.898846', '0.889085', '0.898050', '0.901224', '0.902222', '0.899306', '0.900862', '0.908363', '0.890830', '0.897747', '0.873563', '0.872947', '0.884312']
         : correct/total = [(1026, 1140), (1043, 1158), (1010, 1127), (1047, 1158), (1024, 1134), (1038, 1145), (1036, 1145), (1013, 1127), (1010, 1136), (1013, 1128), (1031, 1144), (1015, 1125), (1036, 1152), (1045, 1160), (1021, 1124), (1020, 1145), (1036, 1154), (988, 1131), (1010, 1157), (1009, 1141)]
         : compromised: 0.9037, honest: 0.8959
         : ubar stats = ['Node 0: s1=0.500, s2=1.000', 'Node 1: s1=0.500, s2=1.000', 'Node 2: s1=0.500, s2=1.000']...
Round 010: test acc mean=0.8996 ± 0.0096 | min=0.8820 max=0.9138
         : test loss mean=0.2450 ± 0.0176
         : individual accs = ['0.912281', '0.905872', '0.890861', '0.909326', '0.900353', '0.903930', '0.896070', '0.905945', '0.882042', '0.898936', '0.906469', '0.913778', '0.902778', '0.905172', '0.908363', '0.882969', '0.896880', '0.887710', '0.882455', '0.899211']
         : correct/total = [(1040, 1140), (1049, 1158), (1004, 1127), (1053, 1158), (1021, 1134), (1035, 1145), (1026, 1145), (1021, 1127), (1002, 1136), (1014, 1128), (1037, 1144), (1028, 1125), (1040, 1152), (1050, 1160), (1021, 1124), (1011, 1145), (1035, 1154), (1004, 1131), (1021, 1157), (1026, 1141)]
         : compromised: 0.9046, honest: 0.8990
         : ubar stats = ['Node 0: s1=0.500, s2=1.000', 'Node 1: s1=0.500, s2=1.000', 'Node 2: s1=0.500, s2=1.000']...

=== FINAL RESULTS ===
Dataset: celeba, Nodes: 20, Graph: ring, Aggregation: ubar
Attack: directed_deviation, 10.0% compromised
Final accuracy - Compromised: 0.9046, Honest: 0.8990
Overall test accuracy: mean=0.8996 ± 0.0096

=== UBAR SUMMARY ===
Node 0: stage1=0.500, stage2=1.000, overall=0.500
Node 1: stage1=0.500, stage2=1.000, overall=0.500
Node 2: stage1=0.500, stage2=1.000, overall=0.500
Node 3: stage1=0.500, stage2=1.000, overall=0.500
Node 4: stage1=0.500, stage2=1.000, overall=0.500
Node 5: stage1=0.500, stage2=1.000, overall=0.500
Node 6: stage1=0.500, stage2=1.000, overall=0.500
Node 7: stage1=0.500, stage2=1.000, overall=0.500
Node 8: stage1=0.500, stage2=1.000, overall=0.500
Node 9: stage1=0.500, stage2=1.000, overall=0.500
Node 10: stage1=0.500, stage2=1.000, overall=0.500
Node 11: stage1=0.500, stage2=1.000, overall=0.500
Node 12: stage1=0.500, stage2=1.000, overall=0.500
Node 13: stage1=0.500, stage2=1.000, overall=0.500
Node 14: stage1=0.500, stage2=1.000, overall=0.500
Node 15: stage1=0.500, stage2=1.000, overall=0.500
Node 16: stage1=0.500, stage2=1.000, overall=0.500
Node 17: stage1=0.500, stage2=1.000, overall=0.500
Node 18: stage1=0.500, stage2=1.000, overall=0.500
Node 19: stage1=0.500, stage2=1.000, overall=0.500

=== PARALLEL EXECUTION TIME (realistic for distributed system) ===
  COMMUNICATION (max across nodes):
    - Full model transfer: 0.000s (0.0%)
  COMPUTATION (max across nodes):
    - Distance computation: 0.021s (10.3%)
    - Loss computation: 0.173s (84.6%)
    - Aggregation: 0.011s (5.1%)
  TOTALS:
    - Total computation: 0.205s (100.0%)
    - Total communication: 0.000s (0.0%)
    - Total parallel time: 0.205s

=== PER-NODE AVERAGE TIME ===
  - Distance computation: 0.006s
  - Loss computation: 0.140s
  - Aggregation: 0.003s
  - Model transfer: 0.000s
  - Total per node: 0.149s

=== TOTAL COMPUTATIONAL WORK (sum across all nodes) ===
  - Total distance computation: 0.126s
  - Total loss computation: 2.795s
  - Total aggregation: 0.066s
  - Total model transfer: 0.000s
  - Grand total: 2.988s
  - Mean Stage 1 acceptance rate: 0.500
  - Mean Stage 2 acceptance rate: 1.000
  - Overall acceptance rate: 0.500

UBAR Algorithm Properties:
  - Model dimension: 2,219,692
  - Rho parameter: 0.9
  - Two-stage approach: Distance filtering + loss evaluation
  - Stage 1 selects: 90% of neighbors
  - Stage 2 uses: Training sample loss comparison
  - Theoretical complexity: O(deg(i)×d + deg(i)×inference)
  - Approach: UBAR paper implementation
