Device: cuda
Seed: 987654321
Looking for images in: /home/student.unimelb.edu.au/mrangwala/Projects/Sketchguard/leaf/data/celeba/data/raw/img_align_celeba
Loading 1 LEAF CelebA train files...
LEAF CelebA train: 9343 users (celebrities), 177457 samples
Looking for images in: /home/student.unimelb.edu.au/mrangwala/Projects/Sketchguard/leaf/data/celeba/data/raw/img_align_celeba
Loading 1 LEAF CelebA test files...
LEAF CelebA test: 9343 users (celebrities), 22831 samples
Found 9343 train users, 9343 test users, 9343 common users
User sample counts range: 31 (max) to 4 (min)
Distributed ALL 9343 users across 20 clients
Users per client: 467 (with 3 clients getting +1 user)
Train partition sizes: [8843, 8998, 8728, 9034, 8866, 8946, 8873, 8776, 8816, 8801, 8913, 8656, 9115, 8921, 8699, 8823, 8912, 8766, 9102, 8869]
Test partition sizes: [1140, 1158, 1127, 1158, 1134, 1145, 1145, 1127, 1136, 1128, 1144, 1125, 1152, 1160, 1124, 1145, 1154, 1131, 1157, 1141]
  Client 0: 8843 train samples, 2 unique classes
  Client 1: 8998 train samples, 2 unique classes
  Client 2: 8728 train samples, 2 unique classes
  Client 3: 9034 train samples, 2 unique classes
  Client 4: 8866 train samples, 2 unique classes
  Client 5: 8946 train samples, 2 unique classes
  Client 6: 8873 train samples, 2 unique classes
  Client 7: 8776 train samples, 2 unique classes
  Client 8: 8816 train samples, 2 unique classes
  Client 9: 8801 train samples, 2 unique classes
  Client 10: 8913 train samples, 2 unique classes
  Client 11: 8656 train samples, 2 unique classes
  Client 12: 9115 train samples, 2 unique classes
  Client 13: 8921 train samples, 2 unique classes
  Client 14: 8699 train samples, 2 unique classes
  Client 15: 8823 train samples, 2 unique classes
  Client 16: 8912 train samples, 2 unique classes
  Client 17: 8766 train samples, 2 unique classes
  Client 18: 9102 train samples, 2 unique classes
  Client 19: 8869 train samples, 2 unique classes
Will sample 4500 samples per client per epoch
Graph: fully, nodes: 20, edges: 190
Degree statistics: avg=19.00, min=19, max=19
Attack: Compromised 8/20 nodes: [1, 5, 11, 12, 13, 14, 17, 18]
Attack type: directed_deviation, lambda: 1.0
Model variant: baseline
Model parameters: 2,219,692
BALANCE algorithm:
Balance Config: BALANCEConfig(gamma=2, kappa=1, alpha=0.5, min_neighbors=1)
  - Model dimension: 2,219,692 parameters
  - Complexity: O(N×d) = O(20×2,219,692)
Initial test acc across nodes: mean=0.4978 ± 0.0208
Round 001: test acc mean=0.6927 ± 0.0316 | min=0.5873 max=0.7252
         : test loss mean=0.6809 ± 0.0034
         : individual accs = ['0.702632', '0.682211', '0.662822', '0.671848', '0.587302', '0.709170', '0.711790', '0.655723', '0.714789', '0.712766', '0.683566', '0.716444', '0.708333', '0.715517', '0.682384', '0.724017', '0.716638', '0.695844', '0.725151', '0.675723']
         : correct/total = [(801, 1140), (790, 1158), (747, 1127), (778, 1158), (666, 1134), (812, 1145), (815, 1145), (739, 1127), (812, 1136), (804, 1128), (782, 1144), (806, 1125), (816, 1152), (830, 1160), (767, 1124), (829, 1145), (827, 1154), (787, 1131), (839, 1157), (771, 1141)]
         : compromised: 0.7044, honest: 0.6850
Round 002: test acc mean=0.6485 ± 0.0495 | min=0.5220 max=0.7101
         : test loss mean=0.6784 ± 0.0049
         : individual accs = ['0.645614', '0.661485', '0.683230', '0.667530', '0.522046', '0.559825', '0.673362', '0.671695', '0.648768', '0.648050', '0.680944', '0.631111', '0.710069', '0.633621', '0.548932', '0.690830', '0.685442', '0.627763', '0.693172', '0.686240']
         : correct/total = [(736, 1140), (766, 1158), (770, 1127), (773, 1158), (592, 1134), (641, 1145), (771, 1145), (757, 1127), (737, 1136), (731, 1128), (779, 1144), (710, 1125), (818, 1152), (735, 1160), (617, 1124), (791, 1145), (791, 1154), (710, 1131), (802, 1157), (783, 1141)]
         : compromised: 0.6332, honest: 0.6586
Round 003: test acc mean=0.6492 ± 0.0433 | min=0.5178 max=0.7088
         : test loss mean=0.6646 ± 0.0086
         : individual accs = ['0.617544', '0.663212', '0.675244', '0.683938', '0.574956', '0.615721', '0.638428', '0.651287', '0.705986', '0.679078', '0.652972', '0.637333', '0.655382', '0.681897', '0.517794', '0.649782', '0.708839', '0.630416', '0.675022', '0.669588']
         : correct/total = [(704, 1140), (768, 1158), (761, 1127), (792, 1158), (652, 1134), (705, 1145), (731, 1145), (734, 1127), (802, 1136), (766, 1128), (747, 1144), (717, 1125), (755, 1152), (791, 1160), (582, 1124), (744, 1145), (818, 1154), (713, 1131), (781, 1157), (764, 1141)]
         : compromised: 0.6346, honest: 0.6590
Round 004: test acc mean=0.7023 ± 0.0201 | min=0.6593 max=0.7342
         : test loss mean=0.6126 ± 0.0113
         : individual accs = ['0.698246', '0.688256', '0.709849', '0.713299', '0.686067', '0.707424', '0.717904', '0.678793', '0.717430', '0.706560', '0.726399', '0.734222', '0.711806', '0.712931', '0.659253', '0.681223', '0.733102', '0.707339', '0.682800', '0.672217']
         : correct/total = [(796, 1140), (797, 1158), (800, 1127), (826, 1158), (778, 1134), (810, 1145), (822, 1145), (765, 1127), (815, 1136), (797, 1128), (831, 1144), (826, 1125), (820, 1152), (827, 1160), (741, 1124), (780, 1145), (846, 1154), (800, 1131), (790, 1157), (767, 1141)]
         : compromised: 0.7005, honest: 0.7034
Round 005: test acc mean=0.7627 ± 0.0135 | min=0.7356 max=0.7828
         : test loss mean=0.5187 ± 0.0153
         : individual accs = ['0.759649', '0.767703', '0.735581', '0.759067', '0.759259', '0.763319', '0.782533', '0.750665', '0.767606', '0.782801', '0.777098', '0.778667', '0.747396', '0.754310', '0.759786', '0.759825', '0.782496', '0.768347', '0.736387', '0.760736']
         : correct/total = [(866, 1140), (889, 1158), (829, 1127), (879, 1158), (861, 1134), (874, 1145), (896, 1145), (846, 1127), (872, 1136), (883, 1128), (889, 1144), (876, 1125), (861, 1152), (875, 1160), (854, 1124), (870, 1145), (903, 1154), (869, 1131), (852, 1157), (868, 1141)]
         : compromised: 0.7595, honest: 0.7648
Round 006: test acc mean=0.8018 ± 0.0154 | min=0.7744 max=0.8357
         : test loss mean=0.4379 ± 0.0155
         : individual accs = ['0.790351', '0.822107', '0.817214', '0.800518', '0.792769', '0.812227', '0.794760', '0.793256', '0.800176', '0.827128', '0.835664', '0.817778', '0.797743', '0.792241', '0.784698', '0.793886', '0.785095', '0.794872', '0.774417', '0.809816']
         : correct/total = [(901, 1140), (952, 1158), (921, 1127), (927, 1158), (899, 1134), (930, 1145), (910, 1145), (894, 1127), (909, 1136), (933, 1128), (956, 1144), (920, 1125), (919, 1152), (919, 1160), (882, 1124), (909, 1145), (906, 1154), (899, 1131), (896, 1157), (924, 1141)]
         : compromised: 0.7995, honest: 0.8034
Round 007: test acc mean=0.8436 ± 0.0152 | min=0.8073 max=0.8679
         : test loss mean=0.3624 ± 0.0174
         : individual accs = ['0.842105', '0.867876', '0.840284', '0.839378', '0.837743', '0.851528', '0.852402', '0.834960', '0.853873', '0.864362', '0.859266', '0.857778', '0.820312', '0.843103', '0.842527', '0.822707', '0.844887', '0.830239', '0.807260', '0.859772']
         : correct/total = [(960, 1140), (1005, 1158), (947, 1127), (972, 1158), (950, 1134), (975, 1145), (976, 1145), (941, 1127), (970, 1136), (975, 1128), (983, 1144), (965, 1125), (945, 1152), (978, 1160), (947, 1124), (942, 1145), (975, 1154), (939, 1131), (934, 1157), (981, 1141)]
         : compromised: 0.8401, honest: 0.8460
Round 008: test acc mean=0.8642 ± 0.0110 | min=0.8366 max=0.8836
         : test loss mean=0.3191 ± 0.0153
         : individual accs = ['0.857895', '0.879102', '0.866016', '0.858377', '0.850088', '0.875109', '0.864629', '0.867791', '0.859155', '0.871454', '0.869755', '0.883556', '0.855903', '0.872414', '0.874555', '0.848908', '0.870017', '0.856764', '0.836646', '0.865031']
         : correct/total = [(978, 1140), (1018, 1158), (976, 1127), (994, 1158), (964, 1134), (1002, 1145), (990, 1145), (978, 1127), (976, 1136), (983, 1128), (995, 1144), (994, 1125), (986, 1152), (1012, 1160), (983, 1124), (972, 1145), (1004, 1154), (969, 1131), (968, 1157), (987, 1141)]
         : compromised: 0.8668, honest: 0.8624
Round 009: test acc mean=0.8769 ± 0.0140 | min=0.8384 max=0.8938
         : test loss mean=0.2931 ± 0.0212
         : individual accs = ['0.875439', '0.893782', '0.872227', '0.887737', '0.868607', '0.886463', '0.888210', '0.881988', '0.875000', '0.889184', '0.891608', '0.893333', '0.874132', '0.872414', '0.883452', '0.855895', '0.876950', '0.854111', '0.838375', '0.879930']
         : correct/total = [(998, 1140), (1035, 1158), (983, 1127), (1028, 1158), (985, 1134), (1015, 1145), (1017, 1145), (994, 1127), (994, 1136), (1003, 1128), (1020, 1144), (1005, 1125), (1007, 1152), (1012, 1160), (993, 1124), (980, 1145), (1012, 1154), (966, 1131), (970, 1157), (1004, 1141)]
         : compromised: 0.8745, honest: 0.8786
Round 010: test acc mean=0.8871 ± 0.0094 | min=0.8634 max=0.8986
         : test loss mean=0.2751 ± 0.0162
         : individual accs = ['0.881579', '0.893782', '0.880213', '0.898100', '0.880952', '0.895197', '0.889956', '0.890861', '0.889965', '0.896277', '0.892483', '0.897778', '0.887153', '0.889655', '0.898577', '0.869869', '0.885615', '0.873563', '0.863440', '0.886065']
         : correct/total = [(1005, 1140), (1035, 1158), (992, 1127), (1040, 1158), (999, 1134), (1025, 1145), (1019, 1145), (1004, 1127), (1011, 1136), (1011, 1128), (1021, 1144), (1010, 1125), (1022, 1152), (1032, 1160), (1010, 1124), (996, 1145), (1022, 1154), (988, 1131), (999, 1157), (1011, 1141)]
         : compromised: 0.8874, honest: 0.8868

=== FINAL RESULTS ===
Dataset: celeba, Nodes: 20, Graph: fully, Aggregation: balance
Attack: directed_deviation, 40.0% compromised
Final accuracy - Compromised: 0.8874, Honest: 0.8868
Overall test accuracy: mean=0.8871 ± 0.0094

=== BALANCE SUMMARY ===
Node 0: acceptance=0.579
Node 1: acceptance=0.632
Node 2: acceptance=0.579
Node 3: acceptance=0.579
Node 4: acceptance=0.579
Node 5: acceptance=0.632
Node 6: acceptance=0.579
Node 7: acceptance=0.579
Node 8: acceptance=0.579
Node 9: acceptance=0.579
Node 10: acceptance=0.579
Node 11: acceptance=0.632
Node 12: acceptance=0.632
Node 13: acceptance=0.632
Node 14: acceptance=0.632
Node 15: acceptance=0.579
Node 16: acceptance=0.579
Node 17: acceptance=0.632
Node 18: acceptance=0.632
Node 19: acceptance=0.579

=== PARALLEL EXECUTION TIME (realistic for distributed system) ===
  COMMUNICATION (max across nodes):
    - Full model transfer: 0.000s (0.0%)
  COMPUTATION (max across nodes):
    - Filtering: 0.052s (76.0%)
    - Aggregation: 0.016s (24.0%)
  TOTALS:
    - Total computation: 0.068s (100.0%)
    - Total communication: 0.000s (0.0%)
    - Total parallel time: 0.068s

=== PER-NODE AVERAGE TIME ===
  - Filtering: 0.049s
  - Aggregation: 0.007s
  - Model transfer: 0.000s
  - Total per node: 0.056s

=== TOTAL COMPUTATIONAL WORK (sum across all nodes) ===
  - Total filtering: 0.973s
  - Total aggregation: 0.139s
  - Total model transfer: 0.000s
  - Grand total: 1.112s
  - Mean acceptance rate: 0.600

BALANCE Algorithm Properties:
  - Model dimension: 2,219,692
  - No compression: Full parameter comparison
  - Theoretical complexity: O(deg(i)×d)
  - Approach: Full parameter filtering + averaging
