Device: cuda
Seed: 987654321
Looking for images in: /home/student.unimelb.edu.au/mrangwala/Projects/Sketchguard/leaf/data/celeba/data/raw/img_align_celeba
Loading 1 LEAF CelebA train files...
LEAF CelebA train: 9343 users (celebrities), 177457 samples
Looking for images in: /home/student.unimelb.edu.au/mrangwala/Projects/Sketchguard/leaf/data/celeba/data/raw/img_align_celeba
Loading 1 LEAF CelebA test files...
LEAF CelebA test: 9343 users (celebrities), 22831 samples
Found 9343 train users, 9343 test users, 9343 common users
User sample counts range: 31 (max) to 4 (min)
Distributed ALL 9343 users across 20 clients
Users per client: 467 (with 3 clients getting +1 user)
Train partition sizes: [8843, 8998, 8728, 9034, 8866, 8946, 8873, 8776, 8816, 8801, 8913, 8656, 9115, 8921, 8699, 8823, 8912, 8766, 9102, 8869]
Test partition sizes: [1140, 1158, 1127, 1158, 1134, 1145, 1145, 1127, 1136, 1128, 1144, 1125, 1152, 1160, 1124, 1145, 1154, 1131, 1157, 1141]
  Client 0: 8843 train samples, 2 unique classes
  Client 1: 8998 train samples, 2 unique classes
  Client 2: 8728 train samples, 2 unique classes
  Client 3: 9034 train samples, 2 unique classes
  Client 4: 8866 train samples, 2 unique classes
  Client 5: 8946 train samples, 2 unique classes
  Client 6: 8873 train samples, 2 unique classes
  Client 7: 8776 train samples, 2 unique classes
  Client 8: 8816 train samples, 2 unique classes
  Client 9: 8801 train samples, 2 unique classes
  Client 10: 8913 train samples, 2 unique classes
  Client 11: 8656 train samples, 2 unique classes
  Client 12: 9115 train samples, 2 unique classes
  Client 13: 8921 train samples, 2 unique classes
  Client 14: 8699 train samples, 2 unique classes
  Client 15: 8823 train samples, 2 unique classes
  Client 16: 8912 train samples, 2 unique classes
  Client 17: 8766 train samples, 2 unique classes
  Client 18: 9102 train samples, 2 unique classes
  Client 19: 8869 train samples, 2 unique classes
Will sample 4500 samples per client per epoch
Graph: erdos, nodes: 20, edges: 99
Degree statistics: avg=9.90, min=7, max=14
Attack: Compromised 2/20 nodes: [5, 13]
Attack type: backdoor, lambda: 1.0
Backdoor target label: 0, trigger size: 8
Model variant: baseline
Model parameters: 2,219,692
Initial test acc across nodes: mean=0.4978 ± 0.0208
Backdoor attack: Created poisoned datasets for 2 compromised nodes
Round 001: test acc mean=0.5065 ± 0.0168 | min=0.4788 max=0.5414
         : test loss mean=14.3728 ± 26.5210
         : individual accs = ['0.491228', '0.500864', '0.493345', '0.485320', '0.478836', '0.511790', '0.495197', '0.503993', '0.541373', '0.492021', '0.524476', '0.493333', '0.522569', '0.496552', '0.516014', '0.531878', '0.517331', '0.519010', '0.490925', '0.523225']
         : correct/total = [(560, 1140), (580, 1158), (556, 1127), (562, 1158), (543, 1134), (586, 1145), (567, 1145), (568, 1127), (615, 1136), (555, 1128), (600, 1144), (555, 1125), (602, 1152), (576, 1160), (580, 1124), (609, 1145), (597, 1154), (587, 1131), (568, 1157), (597, 1141)]
         : compromised: 0.5042, honest: 0.5067
Round 002: test acc mean=0.5177 ± 0.0230 | min=0.4741 max=0.5713
         : test loss mean=9.8053 ± 22.6676
         : individual accs = ['0.521930', '0.523316', '0.493345', '0.474093', '0.512346', '0.520524', '0.511790', '0.495120', '0.571303', '0.491135', '0.525350', '0.496889', '0.544271', '0.550862', '0.528470', '0.491703', '0.515598', '0.511936', '0.539326', '0.535495']
         : correct/total = [(595, 1140), (606, 1158), (556, 1127), (549, 1158), (581, 1134), (596, 1145), (586, 1145), (558, 1127), (649, 1136), (554, 1128), (601, 1144), (559, 1125), (627, 1152), (639, 1160), (594, 1124), (563, 1145), (595, 1154), (579, 1131), (624, 1157), (611, 1141)]
         : compromised: 0.5357, honest: 0.5157
Round 003: test acc mean=0.5488 ± 0.0824 | min=0.4658 max=0.7496
         : test loss mean=2.8189 ± 4.5564
         : individual accs = ['0.521930', '0.507772', '0.682343', '0.522453', '0.528219', '0.531004', '0.503930', '0.502218', '0.489437', '0.713652', '0.687063', '0.465778', '0.521701', '0.518966', '0.506228', '0.522271', '0.749567', '0.505747', '0.525497', '0.469763']
         : correct/total = [(595, 1140), (588, 1158), (769, 1127), (605, 1158), (599, 1134), (608, 1145), (577, 1145), (566, 1127), (556, 1136), (805, 1128), (786, 1144), (524, 1125), (601, 1152), (602, 1160), (569, 1124), (598, 1145), (865, 1154), (572, 1131), (608, 1157), (536, 1141)]
         : compromised: 0.5250, honest: 0.5514
Round 004: test acc mean=0.5521 ± 0.0674 | min=0.5013 max=0.7270
         : test loss mean=10.2152 ± 21.0263
         : individual accs = ['0.528947', '0.502591', '0.642413', '0.531952', '0.521164', '0.512664', '0.517904', '0.503993', '0.563380', '0.655142', '0.697552', '0.501333', '0.537326', '0.518103', '0.518683', '0.513537', '0.727036', '0.506631', '0.532411', '0.510079']
         : correct/total = [(603, 1140), (582, 1158), (724, 1127), (616, 1158), (591, 1134), (587, 1145), (593, 1145), (568, 1127), (640, 1136), (739, 1128), (798, 1144), (564, 1125), (619, 1152), (601, 1160), (583, 1124), (588, 1145), (839, 1154), (573, 1131), (616, 1157), (582, 1141)]
         : compromised: 0.5154, honest: 0.5562
Round 005: test acc mean=0.5344 ± 0.0691 | min=0.4650 max=0.6932
         : test loss mean=1.1272 ± 1.0948
         : individual accs = ['0.533333', '0.481865', '0.664596', '0.508636', '0.476190', '0.520524', '0.517031', '0.464951', '0.534331', '0.637411', '0.693182', '0.503111', '0.515625', '0.512931', '0.483096', '0.517904', '0.668977', '0.467728', '0.490925', '0.495180']
         : correct/total = [(608, 1140), (558, 1158), (749, 1127), (589, 1158), (540, 1134), (596, 1145), (592, 1145), (524, 1127), (607, 1136), (719, 1128), (793, 1144), (566, 1125), (594, 1152), (595, 1160), (543, 1124), (593, 1145), (772, 1154), (529, 1131), (568, 1157), (565, 1141)]
         : compromised: 0.5167, honest: 0.5363
Round 006: test acc mean=0.5095 ± 0.0605 | min=0.4375 max=0.6828
         : test loss mean=455.1656 ± 1057.8763
         : individual accs = ['0.471053', '0.491364', '0.588287', '0.471503', '0.477954', '0.485590', '0.478603', '0.496007', '0.437500', '0.627660', '0.593531', '0.501333', '0.477431', '0.493103', '0.482206', '0.482969', '0.682842', '0.491600', '0.477960', '0.482033']
         : correct/total = [(537, 1140), (569, 1158), (663, 1127), (546, 1158), (542, 1134), (556, 1145), (548, 1145), (559, 1127), (497, 1136), (708, 1128), (679, 1144), (564, 1125), (550, 1152), (572, 1160), (542, 1124), (553, 1145), (788, 1154), (556, 1131), (553, 1157), (550, 1141)]
         : compromised: 0.4893, honest: 0.5118
Round 007: test acc mean=0.4936 ± 0.0219 | min=0.4646 max=0.5345
         : test loss mean=807.3917 ± 2605.0223
         : individual accs = ['0.470175', '0.464594', '0.508429', '0.474957', '0.465608', '0.485590', '0.481223', '0.519965', '0.533451', '0.508865', '0.475524', '0.496889', '0.478299', '0.496552', '0.520463', '0.534498', '0.492201', '0.472149', '0.477960', '0.515337']
         : correct/total = [(536, 1140), (538, 1158), (573, 1127), (550, 1158), (528, 1134), (556, 1145), (551, 1145), (586, 1127), (606, 1136), (574, 1128), (544, 1144), (559, 1125), (551, 1152), (576, 1160), (585, 1124), (612, 1145), (568, 1154), (534, 1131), (553, 1157), (588, 1141)]
         : compromised: 0.4911, honest: 0.4939
Round 008: test acc mean=0.4919 ± 0.0211 | min=0.4684 max=0.5599
         : test loss mean=8569.8482 ± 22793.0858
         : individual accs = ['0.468421', '0.491364', '0.493345', '0.471503', '0.477954', '0.480349', '0.478603', '0.496007', '0.559859', '0.508865', '0.474650', '0.501333', '0.475694', '0.494828', '0.516014', '0.482969', '0.483536', '0.494253', '0.471046', '0.517967']
         : correct/total = [(534, 1140), (569, 1158), (556, 1127), (546, 1158), (542, 1134), (550, 1145), (548, 1145), (559, 1127), (636, 1136), (574, 1128), (543, 1144), (564, 1125), (548, 1152), (574, 1160), (580, 1124), (553, 1145), (558, 1154), (559, 1131), (545, 1157), (591, 1141)]
         : compromised: 0.4876, honest: 0.4924
Round 009: test acc mean=0.5164 ± 0.0150 | min=0.4911 max=0.5625
         : test loss mean=nan ± nan
         : individual accs = ['0.528947', '0.508636', '0.493345', '0.528497', '0.522046', '0.514410', '0.521397', '0.503993', '0.562500', '0.491135', '0.525350', '0.498667', '0.522569', '0.506897', '0.517794', '0.517031', '0.515598', '0.508400', '0.522040', '0.517967']
         : correct/total = [(603, 1140), (589, 1158), (556, 1127), (612, 1158), (592, 1134), (589, 1145), (597, 1145), (568, 1127), (639, 1136), (554, 1128), (601, 1144), (561, 1125), (602, 1152), (588, 1160), (582, 1124), (592, 1145), (595, 1154), (575, 1131), (604, 1157), (591, 1141)]
         : compromised: 0.5107, honest: 0.5170
Round 010: test acc mean=0.5164 ± 0.0150 | min=0.4911 max=0.5625
         : test loss mean=nan ± nan
         : individual accs = ['0.528947', '0.508636', '0.493345', '0.528497', '0.522046', '0.514410', '0.521397', '0.503993', '0.562500', '0.491135', '0.525350', '0.498667', '0.522569', '0.506897', '0.517794', '0.517031', '0.515598', '0.508400', '0.522040', '0.517967']
         : correct/total = [(603, 1140), (589, 1158), (556, 1127), (612, 1158), (592, 1134), (589, 1145), (597, 1145), (568, 1127), (639, 1136), (554, 1128), (601, 1144), (561, 1125), (602, 1152), (588, 1160), (582, 1124), (592, 1145), (595, 1154), (575, 1131), (604, 1157), (591, 1141)]
         : compromised: 0.5107, honest: 0.5170

=== FINAL RESULTS ===
Dataset: celeba, Nodes: 20, Graph: erdos, Aggregation: d-fedavg
Attack: backdoor, 10.0% compromised
Final accuracy - Compromised: 0.5107, Honest: 0.5170
Overall test accuracy: mean=0.5164 ± 0.0150

=== BACKDOOR ATTACK SUCCESS RATE (ASR) ===
Target label: 0
Trigger size: 8x8
Overall ASR: 1.0000 ± 0.0000
Honest nodes ASR: 1.0000 ± 0.0000
Compromised nodes ASR: 1.0000 ± 0.0000
Note: Higher ASR indicates more successful backdoor attack
