Device: cuda
Seed: 987654321
Looking for images in: /home/student.unimelb.edu.au/mrangwala/Projects/Sketchguard/leaf/data/celeba/data/raw/img_align_celeba
Loading 1 LEAF CelebA train files...
LEAF CelebA train: 9343 users (celebrities), 177457 samples
Looking for images in: /home/student.unimelb.edu.au/mrangwala/Projects/Sketchguard/leaf/data/celeba/data/raw/img_align_celeba
Loading 1 LEAF CelebA test files...
LEAF CelebA test: 9343 users (celebrities), 22831 samples
Found 9343 train users, 9343 test users, 9343 common users
User sample counts range: 31 (max) to 4 (min)
Distributed ALL 9343 users across 20 clients
Users per client: 467 (with 3 clients getting +1 user)
Train partition sizes: [8843, 8998, 8728, 9034, 8866, 8946, 8873, 8776, 8816, 8801, 8913, 8656, 9115, 8921, 8699, 8823, 8912, 8766, 9102, 8869]
Test partition sizes: [1140, 1158, 1127, 1158, 1134, 1145, 1145, 1127, 1136, 1128, 1144, 1125, 1152, 1160, 1124, 1145, 1154, 1131, 1157, 1141]
  Client 0: 8843 train samples, 2 unique classes
  Client 1: 8998 train samples, 2 unique classes
  Client 2: 8728 train samples, 2 unique classes
  Client 3: 9034 train samples, 2 unique classes
  Client 4: 8866 train samples, 2 unique classes
  Client 5: 8946 train samples, 2 unique classes
  Client 6: 8873 train samples, 2 unique classes
  Client 7: 8776 train samples, 2 unique classes
  Client 8: 8816 train samples, 2 unique classes
  Client 9: 8801 train samples, 2 unique classes
  Client 10: 8913 train samples, 2 unique classes
  Client 11: 8656 train samples, 2 unique classes
  Client 12: 9115 train samples, 2 unique classes
  Client 13: 8921 train samples, 2 unique classes
  Client 14: 8699 train samples, 2 unique classes
  Client 15: 8823 train samples, 2 unique classes
  Client 16: 8912 train samples, 2 unique classes
  Client 17: 8766 train samples, 2 unique classes
  Client 18: 9102 train samples, 2 unique classes
  Client 19: 8869 train samples, 2 unique classes
Will sample 4500 samples per client per epoch
Graph: erdos, nodes: 20, edges: 126
Degree statistics: avg=12.60, min=8, max=16
Attack: Compromised 14/20 nodes: [1, 2, 3, 5, 6, 8, 11, 12, 13, 14, 15, 17, 18, 19]
Attack type: directed_deviation, lambda: 1.0
Model variant: baseline
Model parameters: 2,219,692
BALANCE algorithm:
Balance Config: BALANCEConfig(gamma=2, kappa=1, alpha=0.5, min_neighbors=1)
  - Model dimension: 2,219,692 parameters
  - Complexity: O(N×d) = O(20×2,219,692)
Initial test acc across nodes: mean=0.4978 ± 0.0208
Round 001: test acc mean=0.6488 ± 0.0581 | min=0.5302 max=0.7314
         : test loss mean=0.6810 ± 0.0037
         : individual accs = ['0.707018', '0.666667', '0.567879', '0.694301', '0.601411', '0.639301', '0.675983', '0.610470', '0.563380', '0.709220', '0.625000', '0.704000', '0.688368', '0.700862', '0.530249', '0.603493', '0.731369', '0.650752', '0.719965', '0.587204']
         : correct/total = [(806, 1140), (772, 1158), (640, 1127), (804, 1158), (682, 1134), (732, 1145), (774, 1145), (688, 1127), (640, 1136), (800, 1128), (715, 1144), (792, 1125), (793, 1152), (813, 1160), (596, 1124), (691, 1145), (844, 1154), (736, 1131), (833, 1157), (670, 1141)]
         : compromised: 0.6423, honest: 0.6641
Round 002: test acc mean=0.6540 ± 0.0500 | min=0.5320 max=0.7210
         : test loss mean=0.6653 ± 0.0109
         : individual accs = ['0.671053', '0.667530', '0.659272', '0.710708', '0.637566', '0.533624', '0.614847', '0.668146', '0.675176', '0.686170', '0.716783', '0.609778', '0.684896', '0.644828', '0.532028', '0.638428', '0.720971', '0.659593', '0.695765', '0.653812']
         : correct/total = [(765, 1140), (773, 1158), (743, 1127), (823, 1158), (723, 1134), (611, 1145), (704, 1145), (753, 1127), (767, 1136), (774, 1128), (820, 1144), (686, 1125), (789, 1152), (748, 1160), (598, 1124), (731, 1145), (832, 1154), (746, 1131), (805, 1157), (746, 1141)]
         : compromised: 0.6414, honest: 0.6834
Round 003: test acc mean=0.7196 ± 0.0212 | min=0.6809 max=0.7614
         : test loss mean=0.6022 ± 0.0217
         : individual accs = ['0.725439', '0.704663', '0.738243', '0.740069', '0.714286', '0.711790', '0.714410', '0.703638', '0.735915', '0.756206', '0.761364', '0.680889', '0.692708', '0.714655', '0.708185', '0.721397', '0.748700', '0.707339', '0.722558', '0.689746']
         : correct/total = [(827, 1140), (816, 1158), (832, 1127), (857, 1158), (810, 1134), (815, 1145), (818, 1145), (793, 1127), (836, 1136), (853, 1128), (871, 1144), (766, 1125), (798, 1152), (829, 1160), (796, 1124), (826, 1145), (864, 1154), (800, 1131), (836, 1157), (787, 1141)]
         : compromised: 0.7130, honest: 0.7349
Round 004: test acc mean=0.7981 ± 0.0214 | min=0.7424 max=0.8453
         : test loss mean=0.4632 ± 0.0245
         : individual accs = ['0.812281', '0.797064', '0.803017', '0.802245', '0.797178', '0.822707', '0.795633', '0.806566', '0.795775', '0.808511', '0.845280', '0.810667', '0.782118', '0.789655', '0.802491', '0.742358', '0.794627', '0.784262', '0.755402', '0.813322']
         : correct/total = [(926, 1140), (923, 1158), (905, 1127), (929, 1158), (904, 1134), (942, 1145), (911, 1145), (909, 1127), (904, 1136), (912, 1128), (967, 1144), (912, 1125), (901, 1152), (916, 1160), (902, 1124), (850, 1145), (917, 1154), (887, 1131), (874, 1157), (928, 1141)]
         : compromised: 0.7926, honest: 0.8107
Round 005: test acc mean=0.8472 ± 0.0186 | min=0.7943 max=0.8722
         : test loss mean=0.3548 ± 0.0209
         : individual accs = ['0.842105', '0.872193', '0.834073', '0.862694', '0.839506', '0.819214', '0.852402', '0.845608', '0.860915', '0.867021', '0.864510', '0.830222', '0.847222', '0.843966', '0.854093', '0.832314', '0.865685', '0.848806', '0.794296', '0.866784']
         : correct/total = [(960, 1140), (1010, 1158), (940, 1127), (999, 1158), (952, 1134), (938, 1145), (976, 1145), (953, 1127), (978, 1136), (978, 1128), (989, 1144), (934, 1125), (976, 1152), (979, 1160), (960, 1124), (953, 1145), (999, 1154), (960, 1131), (919, 1157), (989, 1141)]
         : compromised: 0.8442, honest: 0.8541
Round 006: test acc mean=0.8693 ± 0.0129 | min=0.8349 max=0.8900
         : test loss mean=0.3059 ± 0.0158
         : individual accs = ['0.876316', '0.879102', '0.861579', '0.885147', '0.852734', '0.889956', '0.870742', '0.867791', '0.883803', '0.877660', '0.879371', '0.871111', '0.864583', '0.864655', '0.861210', '0.852402', '0.877816', '0.860301', '0.834918', '0.874671']
         : correct/total = [(999, 1140), (1018, 1158), (971, 1127), (1025, 1158), (967, 1134), (1019, 1145), (997, 1145), (978, 1127), (1004, 1136), (990, 1128), (1006, 1144), (980, 1125), (996, 1152), (1003, 1160), (968, 1124), (976, 1145), (1013, 1154), (973, 1131), (966, 1157), (998, 1141)]
         : compromised: 0.8682, honest: 0.8719
Round 007: test acc mean=0.8842 ± 0.0090 | min=0.8646 max=0.8961
         : test loss mean=0.2820 ± 0.0140
         : individual accs = ['0.887719', '0.895509', '0.880213', '0.880829', '0.880952', '0.896070', '0.890830', '0.888199', '0.893486', '0.891844', '0.888986', '0.882667', '0.875868', '0.875862', '0.885231', '0.864629', '0.895147', '0.877100', '0.865169', '0.886941']
         : correct/total = [(1012, 1140), (1037, 1158), (992, 1127), (1020, 1158), (999, 1134), (1026, 1145), (1020, 1145), (1001, 1127), (1015, 1136), (1006, 1128), (1017, 1144), (993, 1125), (1009, 1152), (1016, 1160), (995, 1124), (990, 1145), (1033, 1154), (992, 1131), (1001, 1157), (1012, 1141)]
         : compromised: 0.8822, honest: 0.8888
Round 008: test acc mean=0.8885 ± 0.0085 | min=0.8707 max=0.9021
         : test loss mean=0.2725 ± 0.0147
         : individual accs = ['0.897368', '0.893782', '0.871340', '0.887737', '0.888889', '0.896943', '0.892576', '0.893523', '0.885563', '0.890957', '0.893357', '0.898667', '0.887153', '0.887931', '0.902135', '0.870742', '0.891681', '0.879752', '0.875540', '0.884312']
         : correct/total = [(1023, 1140), (1035, 1158), (982, 1127), (1028, 1158), (1008, 1134), (1027, 1145), (1022, 1145), (1007, 1127), (1006, 1136), (1005, 1128), (1022, 1144), (1011, 1125), (1022, 1152), (1030, 1160), (1014, 1124), (997, 1145), (1029, 1154), (995, 1131), (1013, 1157), (1009, 1141)]
         : compromised: 0.8867, honest: 0.8926
Round 009: test acc mean=0.8922 ± 0.0113 | min=0.8565 max=0.9074
         : test loss mean=0.2629 ± 0.0191
         : individual accs = ['0.901754', '0.892919', '0.876664', '0.900691', '0.893298', '0.907424', '0.891703', '0.902396', '0.898768', '0.890071', '0.895105', '0.905778', '0.894097', '0.892241', '0.895907', '0.882096', '0.893414', '0.878868', '0.856525', '0.894829']
         : correct/total = [(1028, 1140), (1034, 1158), (988, 1127), (1043, 1158), (1013, 1134), (1039, 1145), (1021, 1145), (1017, 1127), (1021, 1136), (1004, 1128), (1024, 1144), (1019, 1125), (1030, 1152), (1035, 1160), (1007, 1124), (1010, 1145), (1031, 1154), (994, 1131), (991, 1157), (1021, 1141)]
         : compromised: 0.8906, honest: 0.8960
Round 010: test acc mean=0.8971 ± 0.0083 | min=0.8781 max=0.9093
         : test loss mean=0.2523 ± 0.0147
         : individual accs = ['0.904386', '0.897237', '0.885537', '0.905872', '0.900353', '0.905677', '0.896070', '0.899734', '0.897007', '0.900709', '0.895979', '0.909333', '0.901910', '0.900862', '0.904804', '0.890830', '0.898614', '0.879752', '0.878133', '0.889571']
         : correct/total = [(1031, 1140), (1039, 1158), (998, 1127), (1049, 1158), (1021, 1134), (1037, 1145), (1026, 1145), (1014, 1127), (1019, 1136), (1016, 1128), (1025, 1144), (1023, 1125), (1039, 1152), (1045, 1160), (1017, 1124), (1020, 1145), (1037, 1154), (995, 1131), (1016, 1157), (1015, 1141)]
         : compromised: 0.8959, honest: 0.9000

=== FINAL RESULTS ===
Dataset: celeba, Nodes: 20, Graph: erdos, Aggregation: balance
Attack: directed_deviation, 70.0% compromised
Final accuracy - Compromised: 0.8959, Honest: 0.9000
Overall test accuracy: mean=0.8971 ± 0.0083

=== BALANCE SUMMARY ===
Node 0: acceptance=0.312
Node 1: acceptance=0.364
Node 2: acceptance=0.333
Node 3: acceptance=0.375
Node 4: acceptance=0.364
Node 5: acceptance=0.267
Node 6: acceptance=0.286
Node 7: acceptance=0.286
Node 8: acceptance=0.200
Node 9: acceptance=0.308
Node 10: acceptance=0.222
Node 11: acceptance=0.357
Node 12: acceptance=0.333
Node 13: acceptance=0.231
Node 14: acceptance=0.267
Node 15: acceptance=0.273
Node 16: acceptance=0.231
Node 17: acceptance=0.444
Node 18: acceptance=0.312
Node 19: acceptance=0.312

=== PARALLEL EXECUTION TIME (realistic for distributed system) ===
  COMMUNICATION (max across nodes):
    - Full model transfer: 0.000s (0.0%)
  COMPUTATION (max across nodes):
    - Filtering: 0.046s (81.0%)
    - Aggregation: 0.011s (19.0%)
  TOTALS:
    - Total computation: 0.057s (100.0%)
    - Total communication: 0.000s (0.0%)
    - Total parallel time: 0.057s

=== PER-NODE AVERAGE TIME ===
  - Filtering: 0.034s
  - Aggregation: 0.004s
  - Model transfer: 0.000s
  - Total per node: 0.039s

=== TOTAL COMPUTATIONAL WORK (sum across all nodes) ===
  - Total filtering: 0.686s
  - Total aggregation: 0.085s
  - Total model transfer: 0.000s
  - Grand total: 0.771s
  - Mean acceptance rate: 0.304

BALANCE Algorithm Properties:
  - Model dimension: 2,219,692
  - No compression: Full parameter comparison
  - Theoretical complexity: O(deg(i)×d)
  - Approach: Full parameter filtering + averaging
