Device: cuda
Seed: 987654321
Looking for images in: /home/student.unimelb.edu.au/mrangwala/Projects/Sketchguard/leaf/data/celeba/data/raw/img_align_celeba
Loading 1 LEAF CelebA train files...
LEAF CelebA train: 9343 users (celebrities), 177457 samples
Looking for images in: /home/student.unimelb.edu.au/mrangwala/Projects/Sketchguard/leaf/data/celeba/data/raw/img_align_celeba
Loading 1 LEAF CelebA test files...
LEAF CelebA test: 9343 users (celebrities), 22831 samples
Found 9343 train users, 9343 test users, 9343 common users
User sample counts range: 31 (max) to 4 (min)
Distributed ALL 9343 users across 20 clients
Users per client: 467 (with 3 clients getting +1 user)
Train partition sizes: [8843, 8998, 8728, 9034, 8866, 8946, 8873, 8776, 8816, 8801, 8913, 8656, 9115, 8921, 8699, 8823, 8912, 8766, 9102, 8869]
Test partition sizes: [1140, 1158, 1127, 1158, 1134, 1145, 1145, 1127, 1136, 1128, 1144, 1125, 1152, 1160, 1124, 1145, 1154, 1131, 1157, 1141]
  Client 0: 8843 train samples, 2 unique classes
  Client 1: 8998 train samples, 2 unique classes
  Client 2: 8728 train samples, 2 unique classes
  Client 3: 9034 train samples, 2 unique classes
  Client 4: 8866 train samples, 2 unique classes
  Client 5: 8946 train samples, 2 unique classes
  Client 6: 8873 train samples, 2 unique classes
  Client 7: 8776 train samples, 2 unique classes
  Client 8: 8816 train samples, 2 unique classes
  Client 9: 8801 train samples, 2 unique classes
  Client 10: 8913 train samples, 2 unique classes
  Client 11: 8656 train samples, 2 unique classes
  Client 12: 9115 train samples, 2 unique classes
  Client 13: 8921 train samples, 2 unique classes
  Client 14: 8699 train samples, 2 unique classes
  Client 15: 8823 train samples, 2 unique classes
  Client 16: 8912 train samples, 2 unique classes
  Client 17: 8766 train samples, 2 unique classes
  Client 18: 9102 train samples, 2 unique classes
  Client 19: 8869 train samples, 2 unique classes
Will sample 4500 samples per client per epoch
Graph: fully, nodes: 20, edges: 190
Degree statistics: avg=19.00, min=19, max=19
Attack: Compromised 4/20 nodes: [5, 12, 13, 17]
Attack type: backdoor, lambda: 1.0
Backdoor target label: 0, trigger size: 8
Model variant: baseline
Model parameters: 2,219,692
Initial test acc across nodes: mean=0.4978 ± 0.0208
Backdoor attack: Created poisoned datasets for 4 compromised nodes
Round 001: test acc mean=0.5011 ± 0.0209 | min=0.4618 max=0.5561
         : test loss mean=51.2167 ± 25.6393
         : individual accs = ['0.484211', '0.556131', '0.520852', '0.528497', '0.493827', '0.490830', '0.487336', '0.503106', '0.470070', '0.503546', '0.486888', '0.488889', '0.461806', '0.505172', '0.508897', '0.487336', '0.515598', '0.510168', '0.496111', '0.523225']
         : correct/total = [(552, 1140), (644, 1158), (587, 1127), (612, 1158), (560, 1134), (562, 1145), (558, 1145), (567, 1127), (534, 1136), (568, 1128), (557, 1144), (550, 1125), (532, 1152), (586, 1160), (572, 1124), (558, 1145), (595, 1154), (577, 1131), (574, 1157), (597, 1141)]
         : compromised: 0.4920, honest: 0.5034
Round 002: test acc mean=0.5129 ± 0.0153 | min=0.4827 max=0.5440
         : test loss mean=92.0458 ± 3.7567
         : individual accs = ['0.518421', '0.496546', '0.495120', '0.522453', '0.530864', '0.495197', '0.514410', '0.521739', '0.544014', '0.498227', '0.528846', '0.482667', '0.525174', '0.507759', '0.524021', '0.492576', '0.525997', '0.507515', '0.515125', '0.510955']
         : correct/total = [(591, 1140), (575, 1158), (558, 1127), (605, 1158), (602, 1134), (567, 1145), (589, 1145), (588, 1127), (618, 1136), (562, 1128), (605, 1144), (543, 1125), (605, 1152), (589, 1160), (589, 1124), (564, 1145), (607, 1154), (574, 1131), (596, 1157), (583, 1141)]
         : compromised: 0.5089, honest: 0.5139
Round 003: test acc mean=0.5235 ± 0.0169 | min=0.4929 max=0.5713
         : test loss mean=5.0741 ± 0.3384
         : individual accs = ['0.523684', '0.496546', '0.527950', '0.532815', '0.541446', '0.518777', '0.538865', '0.515528', '0.571303', '0.492908', '0.527098', '0.515556', '0.525174', '0.503448', '0.522242', '0.529258', '0.522530', '0.509284', '0.539326', '0.516214']
         : correct/total = [(597, 1140), (575, 1158), (595, 1127), (617, 1158), (614, 1134), (594, 1145), (617, 1145), (581, 1127), (649, 1136), (556, 1128), (603, 1144), (580, 1125), (605, 1152), (584, 1160), (587, 1124), (606, 1145), (603, 1154), (576, 1131), (624, 1157), (589, 1141)]
         : compromised: 0.5142, honest: 0.5258
Round 004: test acc mean=0.4861 ± 0.0156 | min=0.4401 max=0.5076
         : test loss mean=1.9236 ± 0.1020
         : individual accs = ['0.481579', '0.498273', '0.493345', '0.454231', '0.490300', '0.496070', '0.475983', '0.498669', '0.440141', '0.502660', '0.489510', '0.507556', '0.483507', '0.493966', '0.473310', '0.489956', '0.496534', '0.487179', '0.479689', '0.489921']
         : correct/total = [(549, 1140), (577, 1158), (556, 1127), (526, 1158), (556, 1134), (568, 1145), (545, 1145), (562, 1127), (500, 1136), (567, 1128), (560, 1144), (571, 1125), (557, 1152), (573, 1160), (532, 1124), (561, 1145), (573, 1154), (551, 1131), (555, 1157), (559, 1141)]
         : compromised: 0.4902, honest: 0.4851
Round 005: test acc mean=0.4836 ± 0.0150 | min=0.4375 max=0.5089
         : test loss mean=2401.9287 ± 80.6735
         : individual accs = ['0.471053', '0.491364', '0.506655', '0.471503', '0.477954', '0.485590', '0.478603', '0.496007', '0.437500', '0.508865', '0.474650', '0.501333', '0.477431', '0.493103', '0.482206', '0.482969', '0.484402', '0.491600', '0.477960', '0.482033']
         : correct/total = [(537, 1140), (569, 1158), (571, 1127), (546, 1158), (542, 1134), (556, 1145), (548, 1145), (559, 1127), (497, 1136), (574, 1128), (543, 1144), (564, 1125), (550, 1152), (572, 1160), (542, 1124), (553, 1145), (559, 1154), (556, 1131), (553, 1157), (550, 1141)]
         : compromised: 0.4869, honest: 0.4828
Round 006: test acc mean=0.5164 ± 0.0150 | min=0.4911 max=0.5625
         : test loss mean=431918.2143 ± 15511.1642
         : individual accs = ['0.528947', '0.508636', '0.493345', '0.528497', '0.522046', '0.514410', '0.521397', '0.503993', '0.562500', '0.491135', '0.525350', '0.498667', '0.522569', '0.506897', '0.517794', '0.517031', '0.515598', '0.508400', '0.522040', '0.517967']
         : correct/total = [(603, 1140), (589, 1158), (556, 1127), (612, 1158), (592, 1134), (589, 1145), (597, 1145), (568, 1127), (639, 1136), (554, 1128), (601, 1144), (561, 1125), (602, 1152), (588, 1160), (582, 1124), (592, 1145), (595, 1154), (575, 1131), (604, 1157), (591, 1141)]
         : compromised: 0.5131, honest: 0.5172
Round 007: test acc mean=0.5165 ± 0.0148 | min=0.4920 max=0.5625
         : test loss mean=1.9610 ± 4.1380
         : individual accs = ['0.528947', '0.508636', '0.494232', '0.529361', '0.522046', '0.513537', '0.521397', '0.504880', '0.562500', '0.492021', '0.525350', '0.499556', '0.522569', '0.507759', '0.516904', '0.516157', '0.515598', '0.509284', '0.522040', '0.517967']
         : correct/total = [(603, 1140), (589, 1158), (557, 1127), (613, 1158), (592, 1134), (588, 1145), (597, 1145), (569, 1127), (639, 1136), (555, 1128), (601, 1144), (562, 1125), (602, 1152), (589, 1160), (581, 1124), (591, 1145), (595, 1154), (576, 1131), (604, 1157), (591, 1141)]
         : compromised: 0.5133, honest: 0.5173
Round 008: test acc mean=0.5164 ± 0.0150 | min=0.4911 max=0.5625
         : test loss mean=nan ± nan
         : individual accs = ['0.528947', '0.508636', '0.493345', '0.528497', '0.522046', '0.514410', '0.521397', '0.503993', '0.562500', '0.491135', '0.525350', '0.498667', '0.522569', '0.506897', '0.517794', '0.517031', '0.515598', '0.508400', '0.522040', '0.517967']
         : correct/total = [(603, 1140), (589, 1158), (556, 1127), (612, 1158), (592, 1134), (589, 1145), (597, 1145), (568, 1127), (639, 1136), (554, 1128), (601, 1144), (561, 1125), (602, 1152), (588, 1160), (582, 1124), (592, 1145), (595, 1154), (575, 1131), (604, 1157), (591, 1141)]
         : compromised: 0.5131, honest: 0.5172
Round 009: test acc mean=0.5164 ± 0.0150 | min=0.4911 max=0.5625
         : test loss mean=nan ± nan
         : individual accs = ['0.528947', '0.508636', '0.493345', '0.528497', '0.522046', '0.514410', '0.521397', '0.503993', '0.562500', '0.491135', '0.525350', '0.498667', '0.522569', '0.506897', '0.517794', '0.517031', '0.515598', '0.508400', '0.522040', '0.517967']
         : correct/total = [(603, 1140), (589, 1158), (556, 1127), (612, 1158), (592, 1134), (589, 1145), (597, 1145), (568, 1127), (639, 1136), (554, 1128), (601, 1144), (561, 1125), (602, 1152), (588, 1160), (582, 1124), (592, 1145), (595, 1154), (575, 1131), (604, 1157), (591, 1141)]
         : compromised: 0.5131, honest: 0.5172
Round 010: test acc mean=0.5164 ± 0.0150 | min=0.4911 max=0.5625
         : test loss mean=nan ± nan
         : individual accs = ['0.528947', '0.508636', '0.493345', '0.528497', '0.522046', '0.514410', '0.521397', '0.503993', '0.562500', '0.491135', '0.525350', '0.498667', '0.522569', '0.506897', '0.517794', '0.517031', '0.515598', '0.508400', '0.522040', '0.517967']
         : correct/total = [(603, 1140), (589, 1158), (556, 1127), (612, 1158), (592, 1134), (589, 1145), (597, 1145), (568, 1127), (639, 1136), (554, 1128), (601, 1144), (561, 1125), (602, 1152), (588, 1160), (582, 1124), (592, 1145), (595, 1154), (575, 1131), (604, 1157), (591, 1141)]
         : compromised: 0.5131, honest: 0.5172

=== FINAL RESULTS ===
Dataset: celeba, Nodes: 20, Graph: fully, Aggregation: d-fedavg
Attack: backdoor, 20.0% compromised
Final accuracy - Compromised: 0.5131, Honest: 0.5172
Overall test accuracy: mean=0.5164 ± 0.0150

=== BACKDOOR ATTACK SUCCESS RATE (ASR) ===
Target label: 0
Trigger size: 8x8
Overall ASR: 1.0000 ± 0.0000
Honest nodes ASR: 1.0000 ± 0.0000
Compromised nodes ASR: 1.0000 ± 0.0000
Note: Higher ASR indicates more successful backdoor attack
