Device: cuda
Seed: 987654321
Looking for images in: /home/student.unimelb.edu.au/mrangwala/Projects/Sketchguard/leaf/data/celeba/data/raw/img_align_celeba
Loading 1 LEAF CelebA train files...
LEAF CelebA train: 9343 users (celebrities), 177457 samples
Looking for images in: /home/student.unimelb.edu.au/mrangwala/Projects/Sketchguard/leaf/data/celeba/data/raw/img_align_celeba
Loading 1 LEAF CelebA test files...
LEAF CelebA test: 9343 users (celebrities), 22831 samples
Found 9343 train users, 9343 test users, 9343 common users
User sample counts range: 31 (max) to 4 (min)
Distributed ALL 9343 users across 20 clients
Users per client: 467 (with 3 clients getting +1 user)
Train partition sizes: [8843, 8998, 8728, 9034, 8866, 8946, 8873, 8776, 8816, 8801, 8913, 8656, 9115, 8921, 8699, 8823, 8912, 8766, 9102, 8869]
Test partition sizes: [1140, 1158, 1127, 1158, 1134, 1145, 1145, 1127, 1136, 1128, 1144, 1125, 1152, 1160, 1124, 1145, 1154, 1131, 1157, 1141]
  Client 0: 8843 train samples, 2 unique classes
  Client 1: 8998 train samples, 2 unique classes
  Client 2: 8728 train samples, 2 unique classes
  Client 3: 9034 train samples, 2 unique classes
  Client 4: 8866 train samples, 2 unique classes
  Client 5: 8946 train samples, 2 unique classes
  Client 6: 8873 train samples, 2 unique classes
  Client 7: 8776 train samples, 2 unique classes
  Client 8: 8816 train samples, 2 unique classes
  Client 9: 8801 train samples, 2 unique classes
  Client 10: 8913 train samples, 2 unique classes
  Client 11: 8656 train samples, 2 unique classes
  Client 12: 9115 train samples, 2 unique classes
  Client 13: 8921 train samples, 2 unique classes
  Client 14: 8699 train samples, 2 unique classes
  Client 15: 8823 train samples, 2 unique classes
  Client 16: 8912 train samples, 2 unique classes
  Client 17: 8766 train samples, 2 unique classes
  Client 18: 9102 train samples, 2 unique classes
  Client 19: 8869 train samples, 2 unique classes
Will sample 4500 samples per client per epoch
Graph: fully, nodes: 20, edges: 190
Degree statistics: avg=19.00, min=19, max=19
Attack: Compromised 14/20 nodes: [1, 2, 3, 5, 6, 8, 11, 12, 13, 14, 15, 17, 18, 19]
Attack type: gaussian, lambda: 1.0
Model variant: baseline
Model parameters: 2,219,692
UBAR ALGORITHM (Two-Stage Byzantine-resilient)
  - Model dimension: 2,219,692 parameters
  - Rho parameter: 0.30000000000000004
  - Stage 1: Distance-based filtering (select 30% closest neighbors)
  - Stage 2: Performance-based selection (loss comparison)
  - Complexity: O(deg(i)×d + deg(i)×inference)
Initial test acc across nodes: mean=0.4978 ± 0.0208
Round 001: test acc mean=0.6310 ± 0.0615 | min=0.5205 max=0.7164
         : test loss mean=0.6761 ± 0.0075
         : individual accs = ['0.683333', '0.601900', '0.608696', '0.620898', '0.613757', '0.619214', '0.581659', '0.582964', '0.563380', '0.699468', '0.702797', '0.615111', '0.700521', '0.716379', '0.530249', '0.520524', '0.714905', '0.689655', '0.685393', '0.569676']
         : correct/total = [(779, 1140), (697, 1158), (686, 1127), (719, 1158), (696, 1134), (709, 1145), (666, 1145), (657, 1127), (640, 1136), (789, 1128), (804, 1144), (692, 1125), (807, 1152), (831, 1160), (596, 1124), (596, 1145), (825, 1154), (780, 1131), (793, 1157), (650, 1141)]
         : compromised: 0.6159, honest: 0.6662
         : ubar stats = ['Node 0: s1=0.263, s2=0.200', 'Node 1: s1=0.263, s2=0.800', 'Node 2: s1=0.263, s2=0.200']...
Round 002: test acc mean=0.7020 ± 0.0545 | min=0.5383 max=0.7686
         : test loss mean=0.6127 ± 0.0511
         : individual accs = ['0.735965', '0.693437', '0.750665', '0.696028', '0.619048', '0.704803', '0.730131', '0.658385', '0.709507', '0.726950', '0.727273', '0.754667', '0.710069', '0.623276', '0.538256', '0.679476', '0.768631', '0.743590', '0.744166', '0.725679']
         : correct/total = [(839, 1140), (803, 1158), (846, 1127), (806, 1158), (702, 1134), (807, 1145), (836, 1145), (742, 1127), (806, 1136), (820, 1128), (832, 1144), (849, 1125), (818, 1152), (723, 1160), (605, 1124), (778, 1145), (887, 1154), (841, 1131), (861, 1157), (828, 1141)]
         : compromised: 0.7003, honest: 0.7060
         : ubar stats = ['Node 0: s1=0.263, s2=0.200', 'Node 1: s1=0.263, s2=0.600', 'Node 2: s1=0.263, s2=0.200']...
Round 003: test acc mean=0.7927 ± 0.0368 | min=0.7269 max=0.8437
         : test loss mean=0.4862 ± 0.0650
         : individual accs = ['0.842105', '0.798791', '0.814552', '0.816062', '0.753968', '0.843668', '0.804367', '0.785271', '0.800176', '0.834220', '0.814685', '0.810667', '0.729167', '0.775862', '0.733986', '0.779913', '0.840555', '0.747126', '0.726880', '0.802805']
         : correct/total = [(960, 1140), (925, 1158), (918, 1127), (945, 1158), (855, 1134), (966, 1145), (921, 1145), (885, 1127), (909, 1136), (941, 1128), (932, 1144), (912, 1125), (840, 1152), (900, 1160), (825, 1124), (893, 1145), (970, 1154), (845, 1131), (841, 1157), (916, 1141)]
         : compromised: 0.7846, honest: 0.8118
         : ubar stats = ['Node 0: s1=0.263, s2=0.200', 'Node 1: s1=0.263, s2=0.467', 'Node 2: s1=0.263, s2=0.200']...
Round 004: test acc mean=0.8538 ± 0.0158 | min=0.8281 max=0.8811
         : test loss mean=0.3522 ± 0.0303
         : individual accs = ['0.866667', '0.868739', '0.855368', '0.867876', '0.850088', '0.878603', '0.865502', '0.838509', '0.847711', '0.869681', '0.881119', '0.858667', '0.828125', '0.835345', '0.835409', '0.835808', '0.850953', '0.840849', '0.834918', '0.866784']
         : correct/total = [(988, 1140), (1006, 1158), (964, 1127), (1005, 1158), (964, 1134), (1006, 1145), (991, 1145), (945, 1127), (963, 1136), (981, 1128), (1008, 1144), (966, 1125), (954, 1152), (969, 1160), (939, 1124), (957, 1145), (982, 1154), (951, 1131), (966, 1157), (989, 1141)]
         : compromised: 0.8514, honest: 0.8595
         : ubar stats = ['Node 0: s1=0.263, s2=0.200', 'Node 1: s1=0.263, s2=0.450', 'Node 2: s1=0.263, s2=0.200']...
Round 005: test acc mean=0.8673 ± 0.0160 | min=0.8245 max=0.8892
         : test loss mean=0.3072 ± 0.0252
         : individual accs = ['0.846491', '0.874784', '0.858030', '0.888601', '0.870370', '0.856769', '0.883843', '0.853594', '0.870599', '0.889184', '0.888112', '0.875556', '0.871528', '0.868966', '0.861210', '0.857642', '0.879549', '0.850575', '0.824546', '0.876424']
         : correct/total = [(965, 1140), (1013, 1158), (967, 1127), (1029, 1158), (987, 1134), (981, 1145), (1012, 1145), (962, 1127), (989, 1136), (1003, 1128), (1016, 1144), (985, 1125), (1004, 1152), (1008, 1160), (968, 1124), (982, 1145), (1015, 1154), (962, 1131), (954, 1157), (1000, 1141)]
         : compromised: 0.8656, honest: 0.8712
         : ubar stats = ['Node 0: s1=0.263, s2=0.360', 'Node 1: s1=0.263, s2=0.400', 'Node 2: s1=0.263, s2=0.240']...
Round 006: test acc mean=0.8874 ± 0.0094 | min=0.8686 max=0.9004
         : test loss mean=0.2712 ± 0.0164
         : individual accs = ['0.893860', '0.883420', '0.881988', '0.894646', '0.879189', '0.900437', '0.894323', '0.892635', '0.897887', '0.882979', '0.895105', '0.896889', '0.877604', '0.891379', '0.882562', '0.869869', '0.897747', '0.876216', '0.868626', '0.890447']
         : correct/total = [(1019, 1140), (1023, 1158), (994, 1127), (1036, 1158), (997, 1134), (1031, 1145), (1024, 1145), (1006, 1127), (1020, 1136), (996, 1128), (1024, 1144), (1009, 1125), (1011, 1152), (1034, 1160), (992, 1124), (996, 1145), (1036, 1154), (991, 1131), (1005, 1157), (1016, 1141)]
         : compromised: 0.8862, honest: 0.8903
         : ubar stats = ['Node 0: s1=0.263, s2=0.333', 'Node 1: s1=0.263, s2=0.367', 'Node 2: s1=0.263, s2=0.233']...
Round 007: test acc mean=0.8940 ± 0.0082 | min=0.8764 max=0.9079
         : test loss mean=0.2582 ± 0.0139
         : individual accs = ['0.907895', '0.895509', '0.889086', '0.904145', '0.888007', '0.899563', '0.891703', '0.898846', '0.901408', '0.902482', '0.901224', '0.884444', '0.888889', '0.891379', '0.896797', '0.884716', '0.902080', '0.881521', '0.876404', '0.893953']
         : correct/total = [(1035, 1140), (1037, 1158), (1002, 1127), (1047, 1158), (1007, 1134), (1030, 1145), (1021, 1145), (1013, 1127), (1024, 1136), (1018, 1128), (1031, 1144), (995, 1125), (1024, 1152), (1034, 1160), (1008, 1124), (1013, 1145), (1041, 1154), (997, 1131), (1014, 1157), (1020, 1141)]
         : compromised: 0.8914, honest: 0.9001
         : ubar stats = ['Node 0: s1=0.263, s2=0.314', 'Node 1: s1=0.263, s2=0.400', 'Node 2: s1=0.263, s2=0.229']...
Round 008: test acc mean=0.8962 ± 0.0080 | min=0.8795 max=0.9093
         : test loss mean=0.2499 ± 0.0144
         : individual accs = ['0.904386', '0.896373', '0.886424', '0.902418', '0.895062', '0.896943', '0.897817', '0.898846', '0.890845', '0.900709', '0.903846', '0.909333', '0.897569', '0.900000', '0.908363', '0.879476', '0.897747', '0.888594', '0.881590', '0.887818']
         : correct/total = [(1031, 1140), (1038, 1158), (999, 1127), (1045, 1158), (1015, 1134), (1027, 1145), (1028, 1145), (1013, 1127), (1012, 1136), (1016, 1128), (1034, 1144), (1023, 1125), (1034, 1152), (1044, 1160), (1021, 1124), (1007, 1145), (1036, 1154), (1005, 1131), (1020, 1157), (1013, 1141)]
         : compromised: 0.8945, honest: 0.9001
         : ubar stats = ['Node 0: s1=0.263, s2=0.300', 'Node 1: s1=0.263, s2=0.375', 'Node 2: s1=0.263, s2=0.275']...
Round 009: test acc mean=0.8994 ± 0.0117 | min=0.8643 max=0.9132
         : test loss mean=0.2463 ± 0.0180
         : individual accs = ['0.913158', '0.895509', '0.886424', '0.911917', '0.902998', '0.906550', '0.906550', '0.901508', '0.900528', '0.891844', '0.904720', '0.912000', '0.905382', '0.904310', '0.911032', '0.884716', '0.899480', '0.885942', '0.864304', '0.900088']
         : correct/total = [(1041, 1140), (1037, 1158), (999, 1127), (1056, 1158), (1024, 1134), (1038, 1145), (1038, 1145), (1016, 1127), (1023, 1136), (1006, 1128), (1035, 1144), (1026, 1125), (1043, 1152), (1049, 1160), (1024, 1124), (1013, 1145), (1038, 1154), (1002, 1131), (1000, 1157), (1027, 1141)]
         : compromised: 0.8982, honest: 0.9023
         : ubar stats = ['Node 0: s1=0.263, s2=0.289', 'Node 1: s1=0.263, s2=0.422', 'Node 2: s1=0.263, s2=0.267']...
Round 010: test acc mean=0.9018 ± 0.0073 | min=0.8859 max=0.9132
         : test loss mean=0.2392 ± 0.0154
         : individual accs = ['0.913158', '0.901554', '0.897072', '0.907599', '0.899471', '0.900437', '0.902183', '0.909494', '0.900528', '0.903369', '0.906469', '0.910222', '0.901910', '0.906034', '0.912811', '0.889956', '0.903813', '0.890363', '0.885912', '0.893953']
         : correct/total = [(1041, 1140), (1044, 1158), (1011, 1127), (1051, 1158), (1020, 1134), (1031, 1145), (1033, 1145), (1025, 1127), (1023, 1136), (1019, 1128), (1037, 1144), (1024, 1125), (1039, 1152), (1051, 1160), (1026, 1124), (1019, 1145), (1043, 1154), (1007, 1131), (1025, 1157), (1020, 1141)]
         : compromised: 0.9000, honest: 0.9060
         : ubar stats = ['Node 0: s1=0.263, s2=0.300', 'Node 1: s1=0.263, s2=0.400', 'Node 2: s1=0.263, s2=0.300']...

=== FINAL RESULTS ===
Dataset: celeba, Nodes: 20, Graph: fully, Aggregation: ubar
Attack: gaussian, 70.0% compromised
Final accuracy - Compromised: 0.9000, Honest: 0.9060
Overall test accuracy: mean=0.9018 ± 0.0073

=== UBAR SUMMARY ===
Node 0: stage1=0.263, stage2=0.300, overall=0.079
Node 1: stage1=0.263, stage2=0.400, overall=0.105
Node 2: stage1=0.263, stage2=0.300, overall=0.079
Node 3: stage1=0.263, stage2=0.420, overall=0.111
Node 4: stage1=0.263, stage2=0.520, overall=0.137
Node 5: stage1=0.263, stage2=0.380, overall=0.100
Node 6: stage1=0.263, stage2=0.340, overall=0.089
Node 7: stage1=0.263, stage2=0.520, overall=0.137
Node 8: stage1=0.263, stage2=0.460, overall=0.121
Node 9: stage1=0.263, stage2=0.420, overall=0.111
Node 10: stage1=0.263, stage2=0.300, overall=0.079
Node 11: stage1=0.263, stage2=0.260, overall=0.068
Node 12: stage1=0.263, stage2=0.520, overall=0.137
Node 13: stage1=0.263, stage2=0.560, overall=0.147
Node 14: stage1=0.263, stage2=0.560, overall=0.147
Node 15: stage1=0.263, stage2=0.240, overall=0.063
Node 16: stage1=0.263, stage2=0.360, overall=0.095
Node 17: stage1=0.263, stage2=0.240, overall=0.063
Node 18: stage1=0.263, stage2=0.440, overall=0.116
Node 19: stage1=0.263, stage2=0.420, overall=0.111

=== PARALLEL EXECUTION TIME (realistic for distributed system) ===
  COMMUNICATION (max across nodes):
    - Full model transfer: 0.000s (0.0%)
  COMPUTATION (max across nodes):
    - Distance computation: 0.053s (21.3%)
    - Loss computation: 0.190s (76.8%)
    - Aggregation: 0.005s (1.8%)
  TOTALS:
    - Total computation: 0.248s (100.0%)
    - Total communication: 0.000s (0.0%)
    - Total parallel time: 0.248s

=== PER-NODE AVERAGE TIME ===
  - Distance computation: 0.048s
  - Loss computation: 0.163s
  - Aggregation: 0.003s
  - Model transfer: 0.000s
  - Total per node: 0.215s

=== TOTAL COMPUTATIONAL WORK (sum across all nodes) ===
  - Total distance computation: 0.961s
  - Total loss computation: 3.265s
  - Total aggregation: 0.069s
  - Total model transfer: 0.000s
  - Grand total: 4.296s
  - Mean Stage 1 acceptance rate: 0.263
  - Mean Stage 2 acceptance rate: 0.398
  - Overall acceptance rate: 0.105

UBAR Algorithm Properties:
  - Model dimension: 2,219,692
  - Rho parameter: 0.30000000000000004
  - Two-stage approach: Distance filtering + loss evaluation
  - Stage 1 selects: 30% of neighbors
  - Stage 2 uses: Training sample loss comparison
  - Theoretical complexity: O(deg(i)×d + deg(i)×inference)
  - Approach: UBAR paper implementation
