Device: cuda
Seed: 987654321
Looking for images in: /home/student.unimelb.edu.au/mrangwala/Projects/Sketchguard/leaf/data/celeba/data/raw/img_align_celeba
Loading 1 LEAF CelebA train files...
LEAF CelebA train: 9343 users (celebrities), 177457 samples
Looking for images in: /home/student.unimelb.edu.au/mrangwala/Projects/Sketchguard/leaf/data/celeba/data/raw/img_align_celeba
Loading 1 LEAF CelebA test files...
LEAF CelebA test: 9343 users (celebrities), 22831 samples
Found 9343 train users, 9343 test users, 9343 common users
User sample counts range: 31 (max) to 4 (min)
Distributed ALL 9343 users across 20 clients
Users per client: 467 (with 3 clients getting +1 user)
Train partition sizes: [8843, 8998, 8728, 9034, 8866, 8946, 8873, 8776, 8816, 8801, 8913, 8656, 9115, 8921, 8699, 8823, 8912, 8766, 9102, 8869]
Test partition sizes: [1140, 1158, 1127, 1158, 1134, 1145, 1145, 1127, 1136, 1128, 1144, 1125, 1152, 1160, 1124, 1145, 1154, 1131, 1157, 1141]
  Client 0: 8843 train samples, 2 unique classes
  Client 1: 8998 train samples, 2 unique classes
  Client 2: 8728 train samples, 2 unique classes
  Client 3: 9034 train samples, 2 unique classes
  Client 4: 8866 train samples, 2 unique classes
  Client 5: 8946 train samples, 2 unique classes
  Client 6: 8873 train samples, 2 unique classes
  Client 7: 8776 train samples, 2 unique classes
  Client 8: 8816 train samples, 2 unique classes
  Client 9: 8801 train samples, 2 unique classes
  Client 10: 8913 train samples, 2 unique classes
  Client 11: 8656 train samples, 2 unique classes
  Client 12: 9115 train samples, 2 unique classes
  Client 13: 8921 train samples, 2 unique classes
  Client 14: 8699 train samples, 2 unique classes
  Client 15: 8823 train samples, 2 unique classes
  Client 16: 8912 train samples, 2 unique classes
  Client 17: 8766 train samples, 2 unique classes
  Client 18: 9102 train samples, 2 unique classes
  Client 19: 8869 train samples, 2 unique classes
Will sample 4500 samples per client per epoch
Graph: erdos, nodes: 20, edges: 99
Degree statistics: avg=9.90, min=7, max=14
Attack: Compromised 6/20 nodes: [5, 12, 13, 14, 17, 18]
Attack type: krum, lambda: 1.0
Model variant: baseline
Model parameters: 2,219,692
BALANCE algorithm:
Balance Config: BALANCEConfig(gamma=2, kappa=1, alpha=0.5, min_neighbors=1)
  - Model dimension: 2,219,692 parameters
  - Complexity: O(N×d) = O(20×2,219,692)
Initial test acc across nodes: mean=0.4978 ± 0.0208
Round 001: test acc mean=0.6641 ± 0.0516 | min=0.5291 max=0.7227
         : test loss mean=0.6807 ± 0.0038
         : individual accs = ['0.708772', '0.676166', '0.614020', '0.708117', '0.529101', '0.650655', '0.684716', '0.596273', '0.573944', '0.709220', '0.668706', '0.722667', '0.721354', '0.689655', '0.662811', '0.660262', '0.669844', '0.694960', '0.718237', '0.623138']
         : correct/total = [(808, 1140), (783, 1158), (692, 1127), (820, 1158), (600, 1134), (745, 1145), (784, 1145), (672, 1127), (652, 1136), (800, 1128), (765, 1144), (813, 1125), (831, 1152), (800, 1160), (745, 1124), (756, 1145), (773, 1154), (786, 1131), (831, 1157), (711, 1141)]
         : compromised: 0.6896, honest: 0.6532
Round 002: test acc mean=0.6449 ± 0.0551 | min=0.5229 max=0.7196
         : test loss mean=0.6727 ± 0.0096
         : individual accs = ['0.650000', '0.664076', '0.643301', '0.633851', '0.522928', '0.530131', '0.648908', '0.653061', '0.704225', '0.658688', '0.677448', '0.661333', '0.719618', '0.630172', '0.523132', '0.660262', '0.704506', '0.659593', '0.688850', '0.664330']
         : correct/total = [(741, 1140), (769, 1158), (725, 1127), (734, 1158), (593, 1134), (607, 1145), (743, 1145), (736, 1127), (800, 1136), (743, 1128), (775, 1144), (744, 1125), (829, 1152), (731, 1160), (588, 1124), (756, 1145), (813, 1154), (746, 1131), (797, 1157), (758, 1141)]
         : compromised: 0.6252, honest: 0.6534
Round 003: test acc mean=0.6715 ± 0.0436 | min=0.5196 max=0.7253
         : test loss mean=0.6508 ± 0.0193
         : individual accs = ['0.650000', '0.682211', '0.677019', '0.699482', '0.638448', '0.614847', '0.683843', '0.676131', '0.721831', '0.696809', '0.687063', '0.701333', '0.656250', '0.698276', '0.519573', '0.689083', '0.725303', '0.655172', '0.688850', '0.668712']
         : correct/total = [(741, 1140), (790, 1158), (763, 1127), (810, 1158), (724, 1134), (704, 1145), (783, 1145), (762, 1127), (820, 1136), (786, 1128), (786, 1144), (789, 1125), (756, 1152), (810, 1160), (584, 1124), (789, 1145), (837, 1154), (741, 1131), (797, 1157), (763, 1141)]
         : compromised: 0.6388, honest: 0.6855
Round 004: test acc mean=0.7244 ± 0.0244 | min=0.6806 max=0.7605
         : test loss mean=0.5942 ± 0.0258
         : individual accs = ['0.716667', '0.727979', '0.721384', '0.748705', '0.698413', '0.708297', '0.731878', '0.708962', '0.758803', '0.739362', '0.760490', '0.755556', '0.706597', '0.718103', '0.680605', '0.751092', '0.755633', '0.717065', '0.685393', '0.696757']
         : correct/total = [(817, 1140), (843, 1158), (813, 1127), (867, 1158), (792, 1134), (811, 1145), (838, 1145), (799, 1127), (862, 1136), (834, 1128), (870, 1144), (850, 1125), (814, 1152), (833, 1160), (765, 1124), (860, 1145), (872, 1154), (811, 1131), (793, 1157), (795, 1141)]
         : compromised: 0.7027, honest: 0.7337
Round 005: test acc mean=0.7683 ± 0.0228 | min=0.7169 max=0.8111
         : test loss mean=0.5124 ± 0.0271
         : individual accs = ['0.773684', '0.772021', '0.732919', '0.772884', '0.769841', '0.751092', '0.784279', '0.753327', '0.779930', '0.798759', '0.791084', '0.792889', '0.744792', '0.760345', '0.769573', '0.781659', '0.811092', '0.768347', '0.739844', '0.716915']
         : correct/total = [(882, 1140), (894, 1158), (826, 1127), (895, 1158), (873, 1134), (860, 1145), (898, 1145), (849, 1127), (886, 1136), (901, 1128), (905, 1144), (892, 1125), (858, 1152), (882, 1160), (865, 1124), (895, 1145), (936, 1154), (869, 1131), (856, 1157), (818, 1141)]
         : compromised: 0.7557, honest: 0.7737
Round 006: test acc mean=0.8102 ± 0.0181 | min=0.7744 max=0.8418
         : test loss mean=0.4339 ± 0.0224
         : individual accs = ['0.805263', '0.832470', '0.818988', '0.823834', '0.798942', '0.821834', '0.805240', '0.792369', '0.818662', '0.831560', '0.841783', '0.830222', '0.799479', '0.793103', '0.784698', '0.809607', '0.830156', '0.789567', '0.774417', '0.801052']
         : correct/total = [(918, 1140), (964, 1158), (923, 1127), (954, 1158), (906, 1134), (941, 1145), (922, 1145), (893, 1127), (930, 1136), (938, 1128), (963, 1144), (934, 1125), (921, 1152), (920, 1160), (882, 1124), (927, 1145), (958, 1154), (893, 1131), (896, 1157), (914, 1141)]
         : compromised: 0.7938, honest: 0.8172
Round 007: test acc mean=0.8495 ± 0.0155 | min=0.8099 max=0.8723
         : test loss mean=0.3583 ± 0.0176
         : individual accs = ['0.847368', '0.869603', '0.852706', '0.854922', '0.841270', '0.852402', '0.855895', '0.850044', '0.850352', '0.872340', '0.862762', '0.870222', '0.828993', '0.849138', '0.840747', '0.829694', '0.867418', '0.832007', '0.809853', '0.852761']
         : correct/total = [(966, 1140), (1007, 1158), (961, 1127), (990, 1158), (954, 1134), (976, 1145), (980, 1145), (958, 1127), (966, 1136), (984, 1128), (987, 1144), (979, 1125), (955, 1152), (985, 1160), (945, 1124), (950, 1145), (1001, 1154), (941, 1131), (937, 1157), (973, 1141)]
         : compromised: 0.8355, honest: 0.8555
Round 008: test acc mean=0.8687 ± 0.0102 | min=0.8444 max=0.8836
         : test loss mean=0.3154 ± 0.0139
         : individual accs = ['0.863158', '0.883420', '0.870453', '0.867012', '0.858025', '0.879476', '0.868122', '0.873114', '0.865317', '0.876773', '0.873252', '0.883556', '0.861979', '0.874138', '0.880783', '0.858515', '0.875217', '0.851459', '0.844425', '0.865031']
         : correct/total = [(984, 1140), (1023, 1158), (981, 1127), (1004, 1158), (973, 1134), (1007, 1145), (994, 1145), (984, 1127), (983, 1136), (989, 1128), (999, 1144), (994, 1125), (993, 1152), (1014, 1160), (990, 1124), (983, 1145), (1010, 1154), (963, 1131), (977, 1157), (987, 1141)]
         : compromised: 0.8654, honest: 0.8701
Round 009: test acc mean=0.8798 ± 0.0129 | min=0.8462 max=0.8969
         : test loss mean=0.2886 ± 0.0207
         : individual accs = ['0.876316', '0.893782', '0.870453', '0.888601', '0.876543', '0.896070', '0.885590', '0.887311', '0.884683', '0.890071', '0.886364', '0.896889', '0.874132', '0.877586', '0.881673', '0.866376', '0.881282', '0.852343', '0.846154', '0.883436']
         : correct/total = [(999, 1140), (1035, 1158), (981, 1127), (1029, 1158), (994, 1134), (1026, 1145), (1014, 1145), (1000, 1127), (1005, 1136), (1004, 1128), (1014, 1144), (1009, 1125), (1007, 1152), (1018, 1160), (991, 1124), (992, 1145), (1017, 1154), (964, 1131), (979, 1157), (1008, 1141)]
         : compromised: 0.8713, honest: 0.8834
Round 010: test acc mean=0.8895 ± 0.0082 | min=0.8704 max=0.9043
         : test loss mean=0.2711 ± 0.0157
         : individual accs = ['0.892105', '0.892055', '0.884650', '0.891192', '0.888007', '0.896943', '0.888210', '0.896185', '0.895246', '0.904255', '0.888986', '0.894222', '0.886285', '0.891379', '0.899466', '0.877729', '0.889948', '0.871795', '0.870354', '0.890447']
         : correct/total = [(1017, 1140), (1033, 1158), (997, 1127), (1032, 1158), (1007, 1134), (1027, 1145), (1017, 1145), (1010, 1127), (1017, 1136), (1020, 1128), (1017, 1144), (1006, 1125), (1021, 1152), (1034, 1160), (1011, 1124), (1005, 1145), (1027, 1154), (986, 1131), (1007, 1157), (1016, 1141)]
         : compromised: 0.8860, honest: 0.8909

=== FINAL RESULTS ===
Dataset: celeba, Nodes: 20, Graph: erdos, Aggregation: balance
Attack: krum, 30.0% compromised
Final accuracy - Compromised: 0.8860, Honest: 0.8909
Overall test accuracy: mean=0.8895 ± 0.0082

=== BALANCE SUMMARY ===
Node 0: acceptance=0.667
Node 1: acceptance=0.800
Node 2: acceptance=0.750
Node 3: acceptance=0.714
Node 4: acceptance=0.667
Node 5: acceptance=0.700
Node 6: acceptance=0.583
Node 7: acceptance=0.545
Node 8: acceptance=0.286
Node 9: acceptance=0.909
Node 10: acceptance=0.750
Node 11: acceptance=0.583
Node 12: acceptance=0.750
Node 13: acceptance=0.778
Node 14: acceptance=0.643
Node 15: acceptance=0.556
Node 16: acceptance=0.571
Node 17: acceptance=0.750
Node 18: acceptance=0.750
Node 19: acceptance=0.600

=== PARALLEL EXECUTION TIME (realistic for distributed system) ===
  COMMUNICATION (max across nodes):
    - Full model transfer: 0.000s (0.0%)
  COMPUTATION (max across nodes):
    - Filtering: 0.041s (77.2%)
    - Aggregation: 0.012s (22.8%)
  TOTALS:
    - Total computation: 0.053s (100.0%)
    - Total communication: 0.000s (0.0%)
    - Total parallel time: 0.053s

=== PER-NODE AVERAGE TIME ===
  - Filtering: 0.028s
  - Aggregation: 0.005s
  - Model transfer: 0.000s
  - Total per node: 0.033s

=== TOTAL COMPUTATIONAL WORK (sum across all nodes) ===
  - Total filtering: 0.550s
  - Total aggregation: 0.102s
  - Total model transfer: 0.000s
  - Grand total: 0.652s
  - Mean acceptance rate: 0.668

BALANCE Algorithm Properties:
  - Model dimension: 2,219,692
  - No compression: Full parameter comparison
  - Theoretical complexity: O(deg(i)×d)
  - Approach: Full parameter filtering + averaging
