Device: cuda
Seed: 987654321
Looking for images in: /home/student.unimelb.edu.au/mrangwala/Projects/Sketchguard/leaf/data/celeba/data/raw/img_align_celeba
Loading 1 LEAF CelebA train files...
LEAF CelebA train: 9343 users (celebrities), 177457 samples
Looking for images in: /home/student.unimelb.edu.au/mrangwala/Projects/Sketchguard/leaf/data/celeba/data/raw/img_align_celeba
Loading 1 LEAF CelebA test files...
LEAF CelebA test: 9343 users (celebrities), 22831 samples
Found 9343 train users, 9343 test users, 9343 common users
User sample counts range: 31 (max) to 4 (min)
Distributed ALL 9343 users across 20 clients
Users per client: 467 (with 3 clients getting +1 user)
Train partition sizes: [8843, 8998, 8728, 9034, 8866, 8946, 8873, 8776, 8816, 8801, 8913, 8656, 9115, 8921, 8699, 8823, 8912, 8766, 9102, 8869]
Test partition sizes: [1140, 1158, 1127, 1158, 1134, 1145, 1145, 1127, 1136, 1128, 1144, 1125, 1152, 1160, 1124, 1145, 1154, 1131, 1157, 1141]
  Client 0: 8843 train samples, 2 unique classes
  Client 1: 8998 train samples, 2 unique classes
  Client 2: 8728 train samples, 2 unique classes
  Client 3: 9034 train samples, 2 unique classes
  Client 4: 8866 train samples, 2 unique classes
  Client 5: 8946 train samples, 2 unique classes
  Client 6: 8873 train samples, 2 unique classes
  Client 7: 8776 train samples, 2 unique classes
  Client 8: 8816 train samples, 2 unique classes
  Client 9: 8801 train samples, 2 unique classes
  Client 10: 8913 train samples, 2 unique classes
  Client 11: 8656 train samples, 2 unique classes
  Client 12: 9115 train samples, 2 unique classes
  Client 13: 8921 train samples, 2 unique classes
  Client 14: 8699 train samples, 2 unique classes
  Client 15: 8823 train samples, 2 unique classes
  Client 16: 8912 train samples, 2 unique classes
  Client 17: 8766 train samples, 2 unique classes
  Client 18: 9102 train samples, 2 unique classes
  Client 19: 8869 train samples, 2 unique classes
Will sample 4500 samples per client per epoch
Graph: erdos, nodes: 20, edges: 99
Degree statistics: avg=9.90, min=7, max=14
Attack: Compromised 4/20 nodes: [5, 12, 13, 17]
Attack type: backdoor, lambda: 1.0
Backdoor target label: 0, trigger size: 8
Model variant: baseline
Model parameters: 2,219,692
Initial test acc across nodes: mean=0.4978 ± 0.0208
Backdoor attack: Created poisoned datasets for 4 compromised nodes
Round 001: test acc mean=0.7135 ± 0.0321 | min=0.6615 max=0.7729
         : test loss mean=0.5946 ± 0.0448
         : individual accs = ['0.671930', '0.661485', '0.678793', '0.699482', '0.693122', '0.721397', '0.772926', '0.710736', '0.763204', '0.679078', '0.722028', '0.705778', '0.756944', '0.739655', '0.739324', '0.752838', '0.711438', '0.686118', '0.677615', '0.725679']
         : correct/total = [(766, 1140), (766, 1158), (765, 1127), (810, 1158), (786, 1134), (826, 1145), (885, 1145), (801, 1127), (867, 1136), (766, 1128), (826, 1144), (794, 1125), (872, 1152), (858, 1160), (831, 1124), (862, 1145), (821, 1154), (776, 1131), (784, 1157), (828, 1141)]
         : compromised: 0.7260, honest: 0.7103
Round 002: test acc mean=0.8096 ± 0.0202 | min=0.7544 max=0.8454
         : test loss mean=0.4274 ± 0.0198
         : individual accs = ['0.754386', '0.826425', '0.815439', '0.817789', '0.811287', '0.845415', '0.807860', '0.821650', '0.777289', '0.825355', '0.831294', '0.822222', '0.817708', '0.818966', '0.808719', '0.786900', '0.790295', '0.813439', '0.791703', '0.807187']
         : correct/total = [(860, 1140), (957, 1158), (919, 1127), (947, 1158), (920, 1134), (968, 1145), (925, 1145), (926, 1127), (883, 1136), (931, 1128), (951, 1144), (925, 1125), (942, 1152), (950, 1160), (909, 1124), (901, 1145), (912, 1154), (920, 1131), (916, 1157), (921, 1141)]
         : compromised: 0.8239, honest: 0.8060
Round 003: test acc mean=0.8519 ± 0.0141 | min=0.8245 max=0.8697
         : test loss mean=0.3352 ± 0.0200
         : individual accs = ['0.860526', '0.860967', '0.836735', '0.859240', '0.841270', '0.860262', '0.868996', '0.839397', '0.869718', '0.839539', '0.848776', '0.864889', '0.865451', '0.830172', '0.857651', '0.824454', '0.869151', '0.839965', '0.836646', '0.864154']
         : correct/total = [(981, 1140), (997, 1158), (943, 1127), (995, 1158), (954, 1134), (985, 1145), (995, 1145), (946, 1127), (988, 1136), (947, 1128), (971, 1144), (973, 1125), (997, 1152), (963, 1160), (964, 1124), (944, 1145), (1003, 1154), (950, 1131), (968, 1157), (986, 1141)]
         : compromised: 0.8490, honest: 0.8526
Round 004: test acc mean=0.8778 ± 0.0100 | min=0.8608 max=0.8986
         : test loss mean=0.2877 ± 0.0148
         : individual accs = ['0.864035', '0.896373', '0.871340', '0.873057', '0.879189', '0.884716', '0.885590', '0.875776', '0.874120', '0.893617', '0.898601', '0.888889', '0.872396', '0.875000', '0.872776', '0.872489', '0.876083', '0.870027', '0.860847', '0.871166']
         : correct/total = [(985, 1140), (1038, 1158), (982, 1127), (1011, 1158), (997, 1134), (1013, 1145), (1014, 1145), (987, 1127), (993, 1136), (1008, 1128), (1028, 1144), (1000, 1125), (1005, 1152), (1015, 1160), (981, 1124), (999, 1145), (1011, 1154), (984, 1131), (996, 1157), (994, 1141)]
         : compromised: 0.8755, honest: 0.8784
Round 005: test acc mean=0.8856 ± 0.0106 | min=0.8600 max=0.9004
         : test loss mean=0.2728 ± 0.0211
         : individual accs = ['0.879825', '0.898100', '0.874002', '0.894646', '0.887125', '0.888210', '0.895197', '0.886424', '0.860035', '0.889184', '0.894231', '0.900444', '0.887153', '0.885345', '0.884342', '0.874236', '0.898614', '0.884173', '0.864304', '0.886941']
         : correct/total = [(1003, 1140), (1040, 1158), (985, 1127), (1036, 1158), (1006, 1134), (1017, 1145), (1025, 1145), (999, 1127), (977, 1136), (1003, 1128), (1023, 1144), (1013, 1125), (1022, 1152), (1027, 1160), (994, 1124), (1001, 1145), (1037, 1154), (1000, 1131), (1000, 1157), (1012, 1141)]
         : compromised: 0.8862, honest: 0.8855
Round 006: test acc mean=0.8857 ± 0.0121 | min=0.8603 max=0.9042
         : test loss mean=0.2719 ± 0.0242
         : individual accs = ['0.890351', '0.885147', '0.874002', '0.888601', '0.890653', '0.901310', '0.878603', '0.904170', '0.895246', '0.890071', '0.877622', '0.900444', '0.874132', '0.874138', '0.896797', '0.860262', '0.890815', '0.889478', '0.860847', '0.890447']
         : correct/total = [(1015, 1140), (1025, 1158), (985, 1127), (1029, 1158), (1010, 1134), (1032, 1145), (1006, 1145), (1019, 1127), (1017, 1136), (1004, 1128), (1004, 1144), (1013, 1125), (1007, 1152), (1014, 1160), (1008, 1124), (985, 1145), (1028, 1154), (1006, 1131), (996, 1157), (1016, 1141)]
         : compromised: 0.8848, honest: 0.8859
Round 007: test acc mean=0.8958 ± 0.0092 | min=0.8747 max=0.9093
         : test loss mean=0.2496 ± 0.0172
         : individual accs = ['0.896491', '0.897237', '0.892635', '0.907599', '0.898589', '0.896943', '0.902183', '0.905945', '0.895246', '0.905142', '0.906469', '0.909333', '0.894965', '0.881897', '0.895907', '0.879476', '0.886482', '0.892131', '0.874676', '0.895706']
         : correct/total = [(1022, 1140), (1039, 1158), (1006, 1127), (1051, 1158), (1019, 1134), (1027, 1145), (1033, 1145), (1021, 1127), (1017, 1136), (1021, 1128), (1037, 1144), (1023, 1125), (1031, 1152), (1023, 1160), (1007, 1124), (1007, 1145), (1023, 1154), (1009, 1131), (1012, 1157), (1022, 1141)]
         : compromised: 0.8915, honest: 0.8968
Round 008: test acc mean=0.8965 ± 0.0118 | min=0.8634 max=0.9113
         : test loss mean=0.2479 ± 0.0219
         : individual accs = ['0.901754', '0.901554', '0.889973', '0.902418', '0.890653', '0.897817', '0.909170', '0.897959', '0.903169', '0.911348', '0.909091', '0.908444', '0.901042', '0.890517', '0.898577', '0.869869', '0.896014', '0.891247', '0.863440', '0.896582']
         : correct/total = [(1028, 1140), (1044, 1158), (1003, 1127), (1045, 1158), (1010, 1134), (1028, 1145), (1041, 1145), (1012, 1127), (1026, 1136), (1028, 1128), (1040, 1144), (1022, 1125), (1038, 1152), (1033, 1160), (1010, 1124), (996, 1145), (1034, 1154), (1008, 1131), (999, 1157), (1023, 1141)]
         : compromised: 0.8952, honest: 0.8969
Round 009: test acc mean=0.8950 ± 0.0151 | min=0.8617 max=0.9132
         : test loss mean=0.2551 ± 0.0274
         : individual accs = ['0.913158', '0.874784', '0.889973', '0.912781', '0.878307', '0.904803', '0.909170', '0.892635', '0.904930', '0.897163', '0.907343', '0.912889', '0.889757', '0.900862', '0.899466', '0.879476', '0.903813', '0.867374', '0.861711', '0.900088']
         : correct/total = [(1041, 1140), (1013, 1158), (1003, 1127), (1057, 1158), (996, 1134), (1036, 1145), (1041, 1145), (1006, 1127), (1028, 1136), (1012, 1128), (1038, 1144), (1027, 1125), (1025, 1152), (1045, 1160), (1011, 1124), (1007, 1145), (1043, 1154), (981, 1131), (997, 1157), (1027, 1141)]
         : compromised: 0.8907, honest: 0.8961
Round 010: test acc mean=0.8999 ± 0.0089 | min=0.8773 max=0.9101
         : test loss mean=0.2396 ± 0.0178
         : individual accs = ['0.903509', '0.898964', '0.887311', '0.905009', '0.893298', '0.896943', '0.903057', '0.909494', '0.896127', '0.909574', '0.903846', '0.909333', '0.907118', '0.902586', '0.910142', '0.889956', '0.904679', '0.885942', '0.877269', '0.903593']
         : correct/total = [(1030, 1140), (1041, 1158), (1000, 1127), (1048, 1158), (1013, 1134), (1027, 1145), (1034, 1145), (1025, 1127), (1018, 1136), (1026, 1128), (1034, 1144), (1023, 1125), (1045, 1152), (1047, 1160), (1023, 1124), (1019, 1145), (1044, 1154), (1002, 1131), (1015, 1157), (1031, 1141)]
         : compromised: 0.8981, honest: 0.9003

=== FINAL RESULTS ===
Dataset: celeba, Nodes: 20, Graph: erdos, Aggregation: krum
Attack: backdoor, 20.0% compromised
Final accuracy - Compromised: 0.8981, Honest: 0.9003
Overall test accuracy: mean=0.8999 ± 0.0089

=== BACKDOOR ATTACK SUCCESS RATE (ASR) ===
Target label: 0
Trigger size: 8x8
Overall ASR: 0.5315 ± 0.0261
Honest nodes ASR: 0.5302 ± 0.0277
Compromised nodes ASR: 0.5368 ± 0.0174
Note: Higher ASR indicates more successful backdoor attack
