Device: cuda
Seed: 987654321
Looking for images in: /home/student.unimelb.edu.au/mrangwala/Projects/Sketchguard/leaf/data/celeba/data/raw/img_align_celeba
Loading 1 LEAF CelebA train files...
LEAF CelebA train: 9343 users (celebrities), 177457 samples
Looking for images in: /home/student.unimelb.edu.au/mrangwala/Projects/Sketchguard/leaf/data/celeba/data/raw/img_align_celeba
Loading 1 LEAF CelebA test files...
LEAF CelebA test: 9343 users (celebrities), 22831 samples
Found 9343 train users, 9343 test users, 9343 common users
User sample counts range: 31 (max) to 4 (min)
Distributed ALL 9343 users across 20 clients
Users per client: 467 (with 3 clients getting +1 user)
Train partition sizes: [8843, 8998, 8728, 9034, 8866, 8946, 8873, 8776, 8816, 8801, 8913, 8656, 9115, 8921, 8699, 8823, 8912, 8766, 9102, 8869]
Test partition sizes: [1140, 1158, 1127, 1158, 1134, 1145, 1145, 1127, 1136, 1128, 1144, 1125, 1152, 1160, 1124, 1145, 1154, 1131, 1157, 1141]
  Client 0: 8843 train samples, 2 unique classes
  Client 1: 8998 train samples, 2 unique classes
  Client 2: 8728 train samples, 2 unique classes
  Client 3: 9034 train samples, 2 unique classes
  Client 4: 8866 train samples, 2 unique classes
  Client 5: 8946 train samples, 2 unique classes
  Client 6: 8873 train samples, 2 unique classes
  Client 7: 8776 train samples, 2 unique classes
  Client 8: 8816 train samples, 2 unique classes
  Client 9: 8801 train samples, 2 unique classes
  Client 10: 8913 train samples, 2 unique classes
  Client 11: 8656 train samples, 2 unique classes
  Client 12: 9115 train samples, 2 unique classes
  Client 13: 8921 train samples, 2 unique classes
  Client 14: 8699 train samples, 2 unique classes
  Client 15: 8823 train samples, 2 unique classes
  Client 16: 8912 train samples, 2 unique classes
  Client 17: 8766 train samples, 2 unique classes
  Client 18: 9102 train samples, 2 unique classes
  Client 19: 8869 train samples, 2 unique classes
Will sample 4500 samples per client per epoch
Graph: erdos, nodes: 20, edges: 48
Degree statistics: avg=4.80, min=2, max=7
Attack: Compromised 2/20 nodes: [5, 13]
Attack type: directed_deviation, lambda: 1.0
Model variant: baseline
Model parameters: 2,219,692
Initial test acc across nodes: mean=0.4978 ± 0.0208
Round 001: test acc mean=0.5371 ± 0.0576 | min=0.4722 max=0.6752
         : test loss mean=35.7067 ± 77.6608
         : individual accs = ['0.593860', '0.508636', '0.595386', '0.494819', '0.524691', '0.513537', '0.606987', '0.488021', '0.675176', '0.658688', '0.525350', '0.496000', '0.472222', '0.497414', '0.486655', '0.480349', '0.559792', '0.505747', '0.541054', '0.517967']
         : correct/total = [(677, 1140), (589, 1158), (671, 1127), (573, 1158), (595, 1134), (588, 1145), (695, 1145), (550, 1127), (767, 1136), (743, 1128), (601, 1144), (558, 1125), (544, 1152), (577, 1160), (547, 1124), (550, 1145), (646, 1154), (572, 1131), (626, 1157), (591, 1141)]
         : compromised: 0.5055, honest: 0.5406
Round 002: test acc mean=0.5044 ± 0.0258 | min=0.4573 max=0.5739
         : test loss mean=42.9681 ± 90.9690
         : individual accs = ['0.528070', '0.508636', '0.505768', '0.472366', '0.518519', '0.489956', '0.521397', '0.496007', '0.573944', '0.497340', '0.499126', '0.501333', '0.483507', '0.482759', '0.457295', '0.499563', '0.487868', '0.492485', '0.522040', '0.550394']
         : correct/total = [(602, 1140), (589, 1158), (570, 1127), (547, 1158), (588, 1134), (561, 1145), (597, 1145), (559, 1127), (652, 1136), (561, 1128), (571, 1144), (564, 1125), (557, 1152), (560, 1160), (514, 1124), (572, 1145), (563, 1154), (557, 1131), (604, 1157), (628, 1141)]
         : compromised: 0.4864, honest: 0.5064
Round 003: test acc mean=0.5071 ± 0.0268 | min=0.4632 max=0.5721
         : test loss mean=2.9421 ± 7.1704
         : individual accs = ['0.542982', '0.491364', '0.493345', '0.500864', '0.508818', '0.513537', '0.572052', '0.463177', '0.562500', '0.507979', '0.516608', '0.522667', '0.484375', '0.503448', '0.496441', '0.492576', '0.482669', '0.470380', '0.497839', '0.517967']
         : correct/total = [(619, 1140), (569, 1158), (556, 1127), (580, 1158), (577, 1134), (588, 1145), (655, 1145), (522, 1127), (639, 1136), (573, 1128), (591, 1144), (588, 1125), (558, 1152), (584, 1160), (558, 1124), (564, 1145), (557, 1154), (532, 1131), (576, 1157), (591, 1141)]
         : compromised: 0.5085, honest: 0.5069
Round 004: test acc mean=0.5133 ± 0.0229 | min=0.4695 max=0.5625
         : test loss mean=1.7256 ± 2.8599
         : individual accs = ['0.521930', '0.508636', '0.493345', '0.527634', '0.522928', '0.473362', '0.521397', '0.535936', '0.562500', '0.490248', '0.525350', '0.512889', '0.524306', '0.499138', '0.546263', '0.482096', '0.515598', '0.469496', '0.522040', '0.510955']
         : correct/total = [(595, 1140), (589, 1158), (556, 1127), (611, 1158), (593, 1134), (542, 1145), (597, 1145), (604, 1127), (639, 1136), (553, 1128), (601, 1144), (577, 1125), (604, 1152), (579, 1160), (614, 1124), (552, 1145), (595, 1154), (531, 1131), (604, 1157), (583, 1141)]
         : compromised: 0.4863, honest: 0.5163
Round 005: test acc mean=0.5135 ± 0.0353 | min=0.4516 max=0.6114
         : test loss mean=13.6639 ± 32.2739
         : individual accs = ['0.528947', '0.542314', '0.490683', '0.451641', '0.538801', '0.531004', '0.611354', '0.496894', '0.562500', '0.546099', '0.500874', '0.498667', '0.461806', '0.498276', '0.479537', '0.497817', '0.506932', '0.492485', '0.515990', '0.517967']
         : correct/total = [(603, 1140), (628, 1158), (553, 1127), (523, 1158), (611, 1134), (608, 1145), (700, 1145), (560, 1127), (639, 1136), (616, 1128), (573, 1144), (561, 1125), (532, 1152), (578, 1160), (539, 1124), (570, 1145), (585, 1154), (557, 1131), (597, 1157), (591, 1141)]
         : compromised: 0.5146, honest: 0.5134
Round 006: test acc mean=0.5243 ± 0.0233 | min=0.4933 max=0.5837
         : test loss mean=51.2258 ± 156.6634
         : individual accs = ['0.535088', '0.506908', '0.493345', '0.539724', '0.522928', '0.503057', '0.522271', '0.516415', '0.561620', '0.493794', '0.526224', '0.498667', '0.552083', '0.506897', '0.516904', '0.554585', '0.516464', '0.513705', '0.522040', '0.583699']
         : correct/total = [(610, 1140), (587, 1158), (556, 1127), (625, 1158), (593, 1134), (576, 1145), (598, 1145), (582, 1127), (638, 1136), (557, 1128), (602, 1144), (561, 1125), (636, 1152), (588, 1160), (581, 1124), (635, 1145), (596, 1154), (581, 1131), (604, 1157), (666, 1141)]
         : compromised: 0.5050, honest: 0.5265
Round 007: test acc mean=0.5138 ± 0.0373 | min=0.4603 max=0.6136
         : test loss mean=23.3168 ± 68.4034
         : individual accs = ['0.556140', '0.499136', '0.554570', '0.460276', '0.492063', '0.514410', '0.533624', '0.492458', '0.613556', '0.508865', '0.474650', '0.488000', '0.522569', '0.506897', '0.476868', '0.528384', '0.487868', '0.509284', '0.478825', '0.578440']
         : correct/total = [(634, 1140), (578, 1158), (625, 1127), (533, 1158), (558, 1134), (589, 1145), (611, 1145), (555, 1127), (697, 1136), (574, 1128), (543, 1144), (549, 1125), (602, 1152), (588, 1160), (536, 1124), (605, 1145), (563, 1154), (576, 1131), (554, 1157), (660, 1141)]
         : compromised: 0.5107, honest: 0.5142
Round 008: test acc mean=0.5111 ± 0.0275 | min=0.4672 max=0.6004
         : test loss mean=40.3671 ± 112.7765
         : individual accs = ['0.524561', '0.491364', '0.493345', '0.544041', '0.522046', '0.484716', '0.521397', '0.503993', '0.600352', '0.491135', '0.522727', '0.502222', '0.513889', '0.467241', '0.516904', '0.522271', '0.515598', '0.515473', '0.477960', '0.490798']
         : correct/total = [(598, 1140), (569, 1158), (556, 1127), (630, 1158), (592, 1134), (555, 1145), (597, 1145), (568, 1127), (682, 1136), (554, 1128), (598, 1144), (565, 1125), (592, 1152), (542, 1160), (581, 1124), (598, 1145), (595, 1154), (583, 1131), (553, 1157), (560, 1141)]
         : compromised: 0.4760, honest: 0.5150
Round 009: test acc mean=0.5170 ± 0.0343 | min=0.4755 max=0.6100
         : test loss mean=24.8369 ± 87.2356
         : individual accs = ['0.604386', '0.513817', '0.514641', '0.531088', '0.486772', '0.515284', '0.484716', '0.528838', '0.610035', '0.508865', '0.475524', '0.492444', '0.526910', '0.506897', '0.488434', '0.521397', '0.487002', '0.534925', '0.504754', '0.503944']
         : correct/total = [(689, 1140), (595, 1158), (580, 1127), (615, 1158), (552, 1134), (590, 1145), (555, 1145), (596, 1127), (693, 1136), (574, 1128), (544, 1144), (554, 1125), (607, 1152), (588, 1160), (549, 1124), (597, 1145), (562, 1154), (605, 1131), (584, 1157), (575, 1141)]
         : compromised: 0.5111, honest: 0.5177
Round 010: test acc mean=0.5115 ± 0.0339 | min=0.4716 max=0.6153
         : test loss mean=39.6364 ± 109.0215
         : individual accs = ['0.560526', '0.508636', '0.506655', '0.483592', '0.522046', '0.498690', '0.478603', '0.494232', '0.615317', '0.491135', '0.525350', '0.495111', '0.493924', '0.471552', '0.524911', '0.485590', '0.515598', '0.519010', '0.477960', '0.560911']
         : correct/total = [(639, 1140), (589, 1158), (571, 1127), (560, 1158), (592, 1134), (571, 1145), (548, 1145), (557, 1127), (699, 1136), (554, 1128), (601, 1144), (557, 1125), (569, 1152), (547, 1160), (590, 1124), (556, 1145), (595, 1154), (587, 1131), (553, 1157), (640, 1141)]
         : compromised: 0.4851, honest: 0.5144

=== FINAL RESULTS ===
Dataset: celeba, Nodes: 20, Graph: erdos, Aggregation: d-fedavg
Attack: directed_deviation, 10.0% compromised
Final accuracy - Compromised: 0.4851, Honest: 0.5144
Overall test accuracy: mean=0.5115 ± 0.0339
