Device: cuda
Seed: 987654321
Looking for images in: /home/student.unimelb.edu.au/mrangwala/Projects/Sketchguard/leaf/data/celeba/data/raw/img_align_celeba
Loading 1 LEAF CelebA train files...
LEAF CelebA train: 9343 users (celebrities), 177457 samples
Looking for images in: /home/student.unimelb.edu.au/mrangwala/Projects/Sketchguard/leaf/data/celeba/data/raw/img_align_celeba
Loading 1 LEAF CelebA test files...
LEAF CelebA test: 9343 users (celebrities), 22831 samples
Found 9343 train users, 9343 test users, 9343 common users
User sample counts range: 31 (max) to 4 (min)
Distributed ALL 9343 users across 20 clients
Users per client: 467 (with 3 clients getting +1 user)
Train partition sizes: [8843, 8998, 8728, 9034, 8866, 8946, 8873, 8776, 8816, 8801, 8913, 8656, 9115, 8921, 8699, 8823, 8912, 8766, 9102, 8869]
Test partition sizes: [1140, 1158, 1127, 1158, 1134, 1145, 1145, 1127, 1136, 1128, 1144, 1125, 1152, 1160, 1124, 1145, 1154, 1131, 1157, 1141]
  Client 0: 8843 train samples, 2 unique classes
  Client 1: 8998 train samples, 2 unique classes
  Client 2: 8728 train samples, 2 unique classes
  Client 3: 9034 train samples, 2 unique classes
  Client 4: 8866 train samples, 2 unique classes
  Client 5: 8946 train samples, 2 unique classes
  Client 6: 8873 train samples, 2 unique classes
  Client 7: 8776 train samples, 2 unique classes
  Client 8: 8816 train samples, 2 unique classes
  Client 9: 8801 train samples, 2 unique classes
  Client 10: 8913 train samples, 2 unique classes
  Client 11: 8656 train samples, 2 unique classes
  Client 12: 9115 train samples, 2 unique classes
  Client 13: 8921 train samples, 2 unique classes
  Client 14: 8699 train samples, 2 unique classes
  Client 15: 8823 train samples, 2 unique classes
  Client 16: 8912 train samples, 2 unique classes
  Client 17: 8766 train samples, 2 unique classes
  Client 18: 9102 train samples, 2 unique classes
  Client 19: 8869 train samples, 2 unique classes
Will sample 4500 samples per client per epoch
Graph: erdos, nodes: 20, edges: 48
Degree statistics: avg=4.80, min=2, max=7
Attack: Compromised 12/20 nodes: [1, 2, 3, 5, 8, 11, 12, 13, 14, 15, 17, 18]
Attack type: gaussian, lambda: 1.0
Model variant: baseline
Model parameters: 2,219,692
BALANCE algorithm:
Balance Config: BALANCEConfig(gamma=2, kappa=1, alpha=0.5, min_neighbors=1)
  - Model dimension: 2,219,692 parameters
  - Complexity: O(N×d) = O(20×2,219,692)
Initial test acc across nodes: mean=0.4978 ± 0.0208
Round 001: test acc mean=0.6274 ± 0.0637 | min=0.4802 max=0.7158
         : test loss mean=7537097.6036 ± 32853443.8287
         : individual accs = ['0.699123', '0.681347', '0.533274', '0.701209', '0.571429', '0.592140', '0.643668', '0.616681', '0.636444', '0.655142', '0.594406', '0.691556', '0.702257', '0.480172', '0.626335', '0.661135', '0.715771', '0.609195', '0.615385', '0.521472']
         : correct/total = [(797, 1140), (789, 1158), (601, 1127), (812, 1158), (648, 1134), (678, 1145), (737, 1145), (695, 1127), (723, 1136), (739, 1128), (680, 1144), (778, 1125), (809, 1152), (557, 1160), (704, 1124), (757, 1145), (826, 1154), (689, 1131), (712, 1157), (595, 1141)]
         : compromised: 0.6275, honest: 0.6272
Round 002: test acc mean=0.6970 ± 0.0530 | min=0.5069 max=0.7582
         : test loss mean=nan ± nan
         : individual accs = ['0.704386', '0.685665', '0.657498', '0.707254', '0.666667', '0.731878', '0.739738', '0.689441', '0.734155', '0.750000', '0.733392', '0.664889', '0.709201', '0.506897', '0.712633', '0.685590', '0.758232', '0.660477', '0.700951', '0.741455']
         : correct/total = [(803, 1140), (794, 1158), (741, 1127), (819, 1158), (756, 1134), (838, 1145), (847, 1145), (777, 1127), (834, 1136), (846, 1128), (839, 1144), (748, 1125), (817, 1152), (588, 1160), (801, 1124), (785, 1145), (875, 1154), (747, 1131), (811, 1157), (846, 1141)]
         : compromised: 0.6798, honest: 0.7229
Round 003: test acc mean=0.7748 ± 0.0741 | min=0.5069 max=0.8388
         : test loss mean=nan ± nan
         : individual accs = ['0.828947', '0.753886', '0.729370', '0.797927', '0.783069', '0.810480', '0.827948', '0.769299', '0.828345', '0.832447', '0.829545', '0.782222', '0.749132', '0.506897', '0.813167', '0.719651', '0.838821', '0.692308', '0.775281', '0.826468']
         : correct/total = [(945, 1140), (873, 1158), (822, 1127), (924, 1158), (888, 1134), (928, 1145), (948, 1145), (867, 1127), (941, 1136), (939, 1128), (949, 1144), (880, 1125), (863, 1152), (588, 1160), (914, 1124), (824, 1145), (968, 1154), (783, 1131), (897, 1157), (943, 1141)]
         : compromised: 0.7466, honest: 0.8171
Round 004: test acc mean=0.8166 ± 0.0867 | min=0.5069 max=0.8785
         : test loss mean=nan ± nan
         : individual accs = ['0.858772', '0.846287', '0.642413', '0.856649', '0.836861', '0.848908', '0.867249', '0.832298', '0.873239', '0.878546', '0.870629', '0.800000', '0.828993', '0.506897', '0.838968', '0.794760', '0.860485', '0.804598', '0.824546', '0.860649']
         : correct/total = [(979, 1140), (980, 1158), (724, 1127), (992, 1158), (949, 1134), (972, 1145), (993, 1145), (938, 1127), (992, 1136), (991, 1128), (996, 1144), (900, 1125), (955, 1152), (588, 1160), (943, 1124), (910, 1145), (993, 1154), (910, 1131), (954, 1157), (982, 1141)]
         : compromised: 0.7889, honest: 0.8582
Round 005: test acc mean=0.8417 ± 0.0822 | min=0.5069 max=0.8892
         : test loss mean=nan ± nan
         : individual accs = ['0.861404', '0.888601', '0.763975', '0.886874', '0.865961', '0.834934', '0.858515', '0.862467', '0.881162', '0.889184', '0.881119', '0.863111', '0.868924', '0.506897', '0.860320', '0.835808', '0.876950', '0.858532', '0.809853', '0.879930']
         : correct/total = [(982, 1140), (1029, 1158), (861, 1127), (1027, 1158), (982, 1134), (956, 1145), (983, 1145), (972, 1127), (1001, 1136), (1003, 1128), (1008, 1144), (971, 1125), (1001, 1152), (588, 1160), (967, 1124), (957, 1145), (1012, 1154), (971, 1131), (937, 1157), (1004, 1141)]
         : compromised: 0.8216, honest: 0.8719
Round 006: test acc mean=0.8533 ± 0.0846 | min=0.5069 max=0.8941
         : test loss mean=nan ± nan
         : individual accs = ['0.892982', '0.884283', '0.828749', '0.881693', '0.870370', '0.890830', '0.883843', '0.875776', '0.889965', '0.887411', '0.892483', '0.850667', '0.882812', '0.506897', '0.894128', '0.772926', '0.891681', '0.871795', '0.834054', '0.883436']
         : correct/total = [(1018, 1140), (1024, 1158), (934, 1127), (1021, 1158), (987, 1134), (1020, 1145), (1012, 1145), (987, 1127), (1011, 1136), (1001, 1128), (1021, 1144), (957, 1125), (1017, 1152), (588, 1160), (1005, 1124), (885, 1145), (1029, 1154), (986, 1131), (965, 1157), (1008, 1141)]
         : compromised: 0.8324, honest: 0.8847
Round 007: test acc mean=0.8651 ± 0.0847 | min=0.5069 max=0.9033
         : test loss mean=nan ± nan
         : individual accs = ['0.899123', '0.893782', '0.814552', '0.903282', '0.879189', '0.900437', '0.895197', '0.893523', '0.890845', '0.891844', '0.890734', '0.883556', '0.889757', '0.506897', '0.892349', '0.840175', '0.895147', '0.880637', '0.875540', '0.885188']
         : correct/total = [(1025, 1140), (1035, 1158), (918, 1127), (1046, 1158), (997, 1134), (1031, 1145), (1025, 1145), (1007, 1127), (1012, 1136), (1006, 1128), (1019, 1144), (994, 1125), (1025, 1152), (588, 1160), (1003, 1124), (962, 1145), (1033, 1154), (996, 1131), (1013, 1157), (1010, 1141)]
         : compromised: 0.8477, honest: 0.8912
Round 008: test acc mean=0.8686 ± 0.0844 | min=0.5069 max=0.9057
         : test loss mean=nan ± nan
         : individual accs = ['0.897368', '0.898100', '0.833185', '0.899827', '0.879189', '0.901310', '0.889956', '0.888199', '0.893486', '0.892730', '0.887238', '0.891556', '0.901910', '0.506897', '0.905694', '0.870742', '0.894281', '0.881521', '0.880726', '0.878177']
         : correct/total = [(1023, 1140), (1040, 1158), (939, 1127), (1042, 1158), (997, 1134), (1032, 1145), (1019, 1145), (1001, 1127), (1015, 1136), (1007, 1128), (1015, 1144), (1003, 1125), (1039, 1152), (588, 1160), (1018, 1124), (997, 1145), (1032, 1154), (997, 1131), (1019, 1157), (1002, 1141)]
         : compromised: 0.8554, honest: 0.8884
Round 009: test acc mean=0.8735 ± 0.0849 | min=0.5069 max=0.9083
         : test loss mean=nan ± nan
         : individual accs = ['0.900877', '0.893782', '0.872227', '0.905872', '0.888889', '0.908297', '0.898690', '0.900621', '0.900528', '0.890957', '0.900350', '0.897778', '0.898438', '0.506897', '0.893238', '0.876856', '0.901213', '0.879752', '0.864304', '0.891323']
         : correct/total = [(1027, 1140), (1035, 1158), (983, 1127), (1049, 1158), (1008, 1134), (1040, 1145), (1029, 1145), (1015, 1127), (1023, 1136), (1005, 1128), (1030, 1144), (1010, 1125), (1035, 1152), (588, 1160), (1004, 1124), (1004, 1145), (1040, 1154), (995, 1131), (1000, 1157), (1017, 1141)]
         : compromised: 0.8582, honest: 0.8966
Round 010: test acc mean=0.8793 ± 0.0860 | min=0.5069 max=0.9136
         : test loss mean=nan ± nan
         : individual accs = ['0.912281', '0.904145', '0.881100', '0.913644', '0.893298', '0.904803', '0.896943', '0.902396', '0.895246', '0.903369', '0.900350', '0.906667', '0.906250', '0.506897', '0.907473', '0.889083', '0.907279', '0.885057', '0.878133', '0.892200']
         : correct/total = [(1040, 1140), (1047, 1158), (993, 1127), (1058, 1158), (1013, 1134), (1036, 1145), (1027, 1145), (1017, 1127), (1017, 1136), (1019, 1128), (1030, 1144), (1020, 1125), (1044, 1152), (588, 1160), (1020, 1124), (1018, 1145), (1047, 1154), (1001, 1131), (1016, 1157), (1018, 1141)]
         : compromised: 0.8649, honest: 0.9010

=== FINAL RESULTS ===
Dataset: celeba, Nodes: 20, Graph: erdos, Aggregation: balance
Attack: gaussian, 60.0% compromised
Final accuracy - Compromised: 0.8649, Honest: 0.9010
Overall test accuracy: mean=0.8793 ± 0.0860

=== BALANCE SUMMARY ===
Node 0: acceptance=0.500
Node 1: acceptance=0.383
Node 2: acceptance=0.320
Node 3: acceptance=0.500
Node 4: acceptance=0.250
Node 5: acceptance=0.200
Node 6: acceptance=0.200
Node 7: acceptance=0.400
Node 8: acceptance=0.500
Node 9: acceptance=0.333
Node 10: acceptance=0.500
Node 11: acceptance=0.229
Node 12: acceptance=0.471
Node 13: acceptance=0.000
Node 14: acceptance=0.143
Node 15: acceptance=0.267
Node 16: acceptance=0.200
Node 17: acceptance=0.460
Node 18: acceptance=0.250
Node 19: acceptance=0.500

=== PARALLEL EXECUTION TIME (realistic for distributed system) ===
  COMMUNICATION (max across nodes):
    - Full model transfer: 0.000s (0.0%)
  COMPUTATION (max across nodes):
    - Filtering: 0.024s (68.3%)
    - Aggregation: 0.011s (31.7%)
  TOTALS:
    - Total computation: 0.035s (100.0%)
    - Total communication: 0.000s (0.0%)
    - Total parallel time: 0.035s

=== PER-NODE AVERAGE TIME ===
  - Filtering: 0.014s
  - Aggregation: 0.004s
  - Model transfer: 0.000s
  - Total per node: 0.018s

=== TOTAL COMPUTATIONAL WORK (sum across all nodes) ===
  - Total filtering: 0.284s
  - Total aggregation: 0.073s
  - Total model transfer: 0.000s
  - Grand total: 0.357s
  - Mean acceptance rate: 0.330

BALANCE Algorithm Properties:
  - Model dimension: 2,219,692
  - No compression: Full parameter comparison
  - Theoretical complexity: O(deg(i)×d)
  - Approach: Full parameter filtering + averaging
