Device: cuda
Seed: 987654321
Looking for images in: /home/student.unimelb.edu.au/mrangwala/Projects/Sketchguard/leaf/data/celeba/data/raw/img_align_celeba
Loading 1 LEAF CelebA train files...
LEAF CelebA train: 9343 users (celebrities), 177457 samples
Looking for images in: /home/student.unimelb.edu.au/mrangwala/Projects/Sketchguard/leaf/data/celeba/data/raw/img_align_celeba
Loading 1 LEAF CelebA test files...
LEAF CelebA test: 9343 users (celebrities), 22831 samples
Found 9343 train users, 9343 test users, 9343 common users
User sample counts range: 31 (max) to 4 (min)
Distributed ALL 9343 users across 20 clients
Users per client: 467 (with 3 clients getting +1 user)
Train partition sizes: [8843, 8998, 8728, 9034, 8866, 8946, 8873, 8776, 8816, 8801, 8913, 8656, 9115, 8921, 8699, 8823, 8912, 8766, 9102, 8869]
Test partition sizes: [1140, 1158, 1127, 1158, 1134, 1145, 1145, 1127, 1136, 1128, 1144, 1125, 1152, 1160, 1124, 1145, 1154, 1131, 1157, 1141]
  Client 0: 8843 train samples, 2 unique classes
  Client 1: 8998 train samples, 2 unique classes
  Client 2: 8728 train samples, 2 unique classes
  Client 3: 9034 train samples, 2 unique classes
  Client 4: 8866 train samples, 2 unique classes
  Client 5: 8946 train samples, 2 unique classes
  Client 6: 8873 train samples, 2 unique classes
  Client 7: 8776 train samples, 2 unique classes
  Client 8: 8816 train samples, 2 unique classes
  Client 9: 8801 train samples, 2 unique classes
  Client 10: 8913 train samples, 2 unique classes
  Client 11: 8656 train samples, 2 unique classes
  Client 12: 9115 train samples, 2 unique classes
  Client 13: 8921 train samples, 2 unique classes
  Client 14: 8699 train samples, 2 unique classes
  Client 15: 8823 train samples, 2 unique classes
  Client 16: 8912 train samples, 2 unique classes
  Client 17: 8766 train samples, 2 unique classes
  Client 18: 9102 train samples, 2 unique classes
  Client 19: 8869 train samples, 2 unique classes
Will sample 4500 samples per client per epoch
Graph: fully, nodes: 20, edges: 190
Degree statistics: avg=19.00, min=19, max=19
Attack: Compromised 16/20 nodes: [1, 2, 3, 5, 6, 8, 9, 10, 11, 12, 13, 14, 15, 17, 18, 19]
Attack type: backdoor, lambda: 1.0
Backdoor target label: 0, trigger size: 8
Model variant: baseline
Model parameters: 2,219,692
UBAR ALGORITHM (Two-Stage Byzantine-resilient)
  - Model dimension: 2,219,692 parameters
  - Rho parameter: 0.19999999999999996
  - Stage 1: Distance-based filtering (select 20% closest neighbors)
  - Stage 2: Performance-based selection (loss comparison)
  - Complexity: O(deg(i)×d + deg(i)×inference)
Initial test acc across nodes: mean=0.4978 ± 0.0208
Backdoor attack: Created poisoned datasets for 16 compromised nodes
Round 001: test acc mean=0.5488 ± 0.0641 | min=0.4938 max=0.7158
         : test loss mean=3097.0702 ± 1634.3634
         : individual accs = ['0.683333', '0.508636', '0.494232', '0.535406', '0.617284', '0.514410', '0.521397', '0.662822', '0.562500', '0.493794', '0.525350', '0.523556', '0.522569', '0.506897', '0.517794', '0.521397', '0.715771', '0.508400', '0.522040', '0.517967']
         : correct/total = [(779, 1140), (589, 1158), (557, 1127), (620, 1158), (700, 1134), (589, 1145), (597, 1145), (747, 1127), (639, 1136), (557, 1128), (601, 1144), (589, 1125), (602, 1152), (588, 1160), (582, 1124), (597, 1145), (826, 1154), (575, 1131), (604, 1157), (591, 1141)]
         : compromised: 0.5185, honest: 0.6698
         : ubar stats = ['Node 0: s1=0.158, s2=0.333', 'Node 1: s1=0.158, s2=1.000', 'Node 2: s1=0.158, s2=1.000']...
Round 002: test acc mean=0.5554 ± 0.0924 | min=0.4672 max=0.7660
         : test loss mean=1054.3542 ± 2069.8170
         : individual accs = ['0.733333', '0.501727', '0.492458', '0.527634', '0.694885', '0.512664', '0.520524', '0.748004', '0.556338', '0.495567', '0.518357', '0.494222', '0.519097', '0.502586', '0.521352', '0.467249', '0.766031', '0.507515', '0.518583', '0.509202']
         : correct/total = [(836, 1140), (581, 1158), (555, 1127), (611, 1158), (788, 1134), (587, 1145), (596, 1145), (843, 1127), (632, 1136), (559, 1128), (593, 1144), (556, 1125), (598, 1152), (583, 1160), (586, 1124), (535, 1145), (884, 1154), (574, 1131), (600, 1157), (581, 1141)]
         : compromised: 0.5103, honest: 0.7356
         : ubar stats = ['Node 0: s1=0.158, s2=0.333', 'Node 1: s1=0.158, s2=1.000', 'Node 2: s1=0.158, s2=1.000']...
Round 003: test acc mean=0.5526 ± 0.1342 | min=0.4375 max=0.8345
         : test loss mean=nan ± nan
         : individual accs = ['0.830702', '0.491364', '0.506655', '0.471503', '0.792769', '0.485590', '0.478603', '0.816327', '0.437500', '0.508865', '0.474650', '0.501333', '0.477431', '0.493103', '0.482206', '0.517031', '0.834489', '0.491600', '0.477960', '0.482033']
         : correct/total = [(947, 1140), (569, 1158), (571, 1127), (546, 1158), (899, 1134), (556, 1145), (548, 1145), (920, 1127), (497, 1136), (574, 1128), (543, 1144), (564, 1125), (550, 1152), (572, 1160), (542, 1124), (592, 1145), (963, 1154), (556, 1131), (553, 1157), (550, 1141)]
         : compromised: 0.4861, honest: 0.8186
         : ubar stats = ['Node 0: s1=0.158, s2=0.333', 'Node 1: s1=0.158, s2=1.000', 'Node 2: s1=0.158, s2=1.000']...
Round 004: test acc mean=0.5840 ± 0.1367 | min=0.4911 max=0.8598
         : test loss mean=nan ± nan
         : individual accs = ['0.859649', '0.508636', '0.493345', '0.528497', '0.850970', '0.514410', '0.521397', '0.859805', '0.562500', '0.491135', '0.525350', '0.498667', '0.522569', '0.506897', '0.517794', '0.517031', '0.852686', '0.508400', '0.522040', '0.517967']
         : correct/total = [(980, 1140), (589, 1158), (556, 1127), (612, 1158), (965, 1134), (589, 1145), (597, 1145), (969, 1127), (639, 1136), (554, 1128), (601, 1144), (561, 1125), (602, 1152), (588, 1160), (582, 1124), (592, 1145), (984, 1154), (575, 1131), (604, 1157), (591, 1141)]
         : compromised: 0.5160, honest: 0.8558
         : ubar stats = ['Node 0: s1=0.158, s2=0.333', 'Node 1: s1=0.158, s2=0.833', 'Node 2: s1=0.158, s2=0.833']...
Round 005: test acc mean=0.5852 ± 0.1392 | min=0.4911 max=0.8821
         : test loss mean=nan ± nan
         : individual accs = ['0.838596', '0.508636', '0.493345', '0.528497', '0.855379', '0.514410', '0.521397', '0.870453', '0.562500', '0.491135', '0.525350', '0.498667', '0.522569', '0.506897', '0.517794', '0.517031', '0.882149', '0.508400', '0.522040', '0.517967']
         : correct/total = [(956, 1140), (589, 1158), (556, 1127), (612, 1158), (970, 1134), (589, 1145), (597, 1145), (981, 1127), (639, 1136), (554, 1128), (601, 1144), (561, 1125), (602, 1152), (588, 1160), (582, 1124), (592, 1145), (1018, 1154), (575, 1131), (604, 1157), (591, 1141)]
         : compromised: 0.5160, honest: 0.8616
         : ubar stats = ['Node 0: s1=0.158, s2=0.467', 'Node 1: s1=0.158, s2=0.733', 'Node 2: s1=0.158, s2=0.733']...
Round 006: test acc mean=0.5899 ± 0.1484 | min=0.4911 max=0.8934
         : test loss mean=nan ± nan
         : individual accs = ['0.891228', '0.508636', '0.493345', '0.528497', '0.876543', '0.514410', '0.521397', '0.879326', '0.562500', '0.491135', '0.525350', '0.498667', '0.522569', '0.506897', '0.517794', '0.517031', '0.893414', '0.508400', '0.522040', '0.517967']
         : correct/total = [(1016, 1140), (589, 1158), (556, 1127), (612, 1158), (994, 1134), (589, 1145), (597, 1145), (991, 1127), (639, 1136), (554, 1128), (601, 1144), (561, 1125), (602, 1152), (588, 1160), (582, 1124), (592, 1145), (1031, 1154), (575, 1131), (604, 1157), (591, 1141)]
         : compromised: 0.5160, honest: 0.8851
         : ubar stats = ['Node 0: s1=0.158, s2=0.444', 'Node 1: s1=0.158, s2=0.667', 'Node 2: s1=0.158, s2=0.667']...
Round 007: test acc mean=0.5919 ± 0.1524 | min=0.4911 max=0.9053
         : test loss mean=nan ± nan
         : individual accs = ['0.905263', '0.508636', '0.493345', '0.528497', '0.884480', '0.514410', '0.521397', '0.896185', '0.562500', '0.491135', '0.525350', '0.498667', '0.522569', '0.506897', '0.517794', '0.517031', '0.895147', '0.508400', '0.522040', '0.517967']
         : correct/total = [(1032, 1140), (589, 1158), (556, 1127), (612, 1158), (1003, 1134), (589, 1145), (597, 1145), (1010, 1127), (639, 1136), (554, 1128), (601, 1144), (561, 1125), (602, 1152), (588, 1160), (582, 1124), (592, 1145), (1033, 1154), (575, 1131), (604, 1157), (591, 1141)]
         : compromised: 0.5160, honest: 0.8953
         : ubar stats = ['Node 0: s1=0.158, s2=0.476', 'Node 1: s1=0.158, s2=0.619', 'Node 2: s1=0.158, s2=0.619']...
Round 008: test acc mean=0.5923 ± 0.1532 | min=0.4911 max=0.9024
         : test loss mean=nan ± nan
         : individual accs = ['0.901754', '0.508636', '0.493345', '0.528497', '0.890653', '0.514410', '0.521397', '0.902396', '0.562500', '0.491135', '0.525350', '0.498667', '0.522569', '0.506897', '0.517794', '0.517031', '0.894281', '0.508400', '0.522040', '0.517967']
         : correct/total = [(1028, 1140), (589, 1158), (556, 1127), (612, 1158), (1010, 1134), (589, 1145), (597, 1145), (1017, 1127), (639, 1136), (554, 1128), (601, 1144), (561, 1125), (602, 1152), (588, 1160), (582, 1124), (592, 1145), (1032, 1154), (575, 1131), (604, 1157), (591, 1141)]
         : compromised: 0.5160, honest: 0.8973
         : ubar stats = ['Node 0: s1=0.158, s2=0.458', 'Node 1: s1=0.158, s2=0.583', 'Node 2: s1=0.158, s2=0.583']...
Round 009: test acc mean=0.5929 ± 0.1545 | min=0.4911 max=0.9033
         : test loss mean=nan ± nan
         : individual accs = ['0.901754', '0.508636', '0.493345', '0.528497', '0.898589', '0.514410', '0.521397', '0.903283', '0.562500', '0.491135', '0.525350', '0.498667', '0.522569', '0.506897', '0.517794', '0.517031', '0.898614', '0.508400', '0.522040', '0.517967']
         : correct/total = [(1028, 1140), (589, 1158), (556, 1127), (612, 1158), (1019, 1134), (589, 1145), (597, 1145), (1018, 1127), (639, 1136), (554, 1128), (601, 1144), (561, 1125), (602, 1152), (588, 1160), (582, 1124), (592, 1145), (1037, 1154), (575, 1131), (604, 1157), (591, 1141)]
         : compromised: 0.5160, honest: 0.9006
         : ubar stats = ['Node 0: s1=0.158, s2=0.444', 'Node 1: s1=0.158, s2=0.556', 'Node 2: s1=0.158, s2=0.556']...
Round 010: test acc mean=0.5936 ± 0.1557 | min=0.4911 max=0.9114
         : test loss mean=nan ± nan
         : individual accs = ['0.911404', '0.508636', '0.493345', '0.528497', '0.898589', '0.514410', '0.521397', '0.904170', '0.562500', '0.491135', '0.525350', '0.498667', '0.522569', '0.506897', '0.517794', '0.517031', '0.900347', '0.508400', '0.522040', '0.517967']
         : correct/total = [(1039, 1140), (589, 1158), (556, 1127), (612, 1158), (1019, 1134), (589, 1145), (597, 1145), (1019, 1127), (639, 1136), (554, 1128), (601, 1144), (561, 1125), (602, 1152), (588, 1160), (582, 1124), (592, 1145), (1039, 1154), (575, 1131), (604, 1157), (591, 1141)]
         : compromised: 0.5160, honest: 0.9036
         : ubar stats = ['Node 0: s1=0.158, s2=0.500', 'Node 1: s1=0.158, s2=0.533', 'Node 2: s1=0.158, s2=0.533']...

=== FINAL RESULTS ===
Dataset: celeba, Nodes: 20, Graph: fully, Aggregation: ubar
Attack: backdoor, 80.0% compromised
Final accuracy - Compromised: 0.5160, Honest: 0.9036
Overall test accuracy: mean=0.5936 ± 0.1557

=== BACKDOOR ATTACK SUCCESS RATE (ASR) ===
Target label: 0
Trigger size: 8x8
Overall ASR: 0.9109 ± 0.1782
Honest nodes ASR: 0.5545 ± 0.0043
Compromised nodes ASR: 1.0000 ± 0.0000
Note: Higher ASR indicates more successful backdoor attack

=== UBAR SUMMARY ===
Node 0: stage1=0.158, stage2=0.500, overall=0.079
Node 1: stage1=0.158, stage2=0.533, overall=0.084
Node 2: stage1=0.158, stage2=0.533, overall=0.084
Node 3: stage1=0.158, stage2=0.533, overall=0.084
Node 4: stage1=0.158, stage2=0.567, overall=0.089
Node 5: stage1=0.158, stage2=0.533, overall=0.084
Node 6: stage1=0.158, stage2=0.533, overall=0.084
Node 7: stage1=0.158, stage2=0.433, overall=0.068
Node 8: stage1=0.158, stage2=0.533, overall=0.084
Node 9: stage1=0.158, stage2=0.533, overall=0.084
Node 10: stage1=0.158, stage2=0.533, overall=0.084
Node 11: stage1=0.158, stage2=0.533, overall=0.084
Node 12: stage1=0.158, stage2=0.533, overall=0.084
Node 13: stage1=0.158, stage2=0.533, overall=0.084
Node 14: stage1=0.158, stage2=0.533, overall=0.084
Node 15: stage1=0.158, stage2=0.467, overall=0.074
Node 16: stage1=0.158, stage2=0.467, overall=0.074
Node 17: stage1=0.158, stage2=0.533, overall=0.084
Node 18: stage1=0.158, stage2=0.533, overall=0.084
Node 19: stage1=0.158, stage2=0.533, overall=0.084

=== PARALLEL EXECUTION TIME (realistic for distributed system) ===
  COMMUNICATION (max across nodes):
    - Full model transfer: 0.000s (0.0%)
  COMPUTATION (max across nodes):
    - Distance computation: 0.054s (22.4%)
    - Loss computation: 0.182s (75.9%)
    - Aggregation: 0.004s (1.7%)
  TOTALS:
    - Total computation: 0.240s (100.0%)
    - Total communication: 0.000s (0.0%)
    - Total parallel time: 0.240s

=== PER-NODE AVERAGE TIME ===
  - Distance computation: 0.046s
  - Loss computation: 0.156s
  - Aggregation: 0.003s
  - Model transfer: 0.000s
  - Total per node: 0.205s

=== TOTAL COMPUTATIONAL WORK (sum across all nodes) ===
  - Total distance computation: 0.925s
  - Total loss computation: 3.117s
  - Total aggregation: 0.060s
  - Total model transfer: 0.000s
  - Grand total: 4.102s
  - Mean Stage 1 acceptance rate: 0.158
  - Mean Stage 2 acceptance rate: 0.522
  - Overall acceptance rate: 0.082

UBAR Algorithm Properties:
  - Model dimension: 2,219,692
  - Rho parameter: 0.19999999999999996
  - Two-stage approach: Distance filtering + loss evaluation
  - Stage 1 selects: 20% of neighbors
  - Stage 2 uses: Training sample loss comparison
  - Theoretical complexity: O(deg(i)×d + deg(i)×inference)
  - Approach: UBAR paper implementation
