Device: cuda
Seed: 987654321
Looking for images in: /home/student.unimelb.edu.au/mrangwala/Projects/Sketchguard/leaf/data/celeba/data/raw/img_align_celeba
Loading 1 LEAF CelebA train files...
LEAF CelebA train: 9343 users (celebrities), 177457 samples
Looking for images in: /home/student.unimelb.edu.au/mrangwala/Projects/Sketchguard/leaf/data/celeba/data/raw/img_align_celeba
Loading 1 LEAF CelebA test files...
LEAF CelebA test: 9343 users (celebrities), 22831 samples
Found 9343 train users, 9343 test users, 9343 common users
User sample counts range: 31 (max) to 4 (min)
Distributed ALL 9343 users across 20 clients
Users per client: 467 (with 3 clients getting +1 user)
Train partition sizes: [8843, 8998, 8728, 9034, 8866, 8946, 8873, 8776, 8816, 8801, 8913, 8656, 9115, 8921, 8699, 8823, 8912, 8766, 9102, 8869]
Test partition sizes: [1140, 1158, 1127, 1158, 1134, 1145, 1145, 1127, 1136, 1128, 1144, 1125, 1152, 1160, 1124, 1145, 1154, 1131, 1157, 1141]
  Client 0: 8843 train samples, 2 unique classes
  Client 1: 8998 train samples, 2 unique classes
  Client 2: 8728 train samples, 2 unique classes
  Client 3: 9034 train samples, 2 unique classes
  Client 4: 8866 train samples, 2 unique classes
  Client 5: 8946 train samples, 2 unique classes
  Client 6: 8873 train samples, 2 unique classes
  Client 7: 8776 train samples, 2 unique classes
  Client 8: 8816 train samples, 2 unique classes
  Client 9: 8801 train samples, 2 unique classes
  Client 10: 8913 train samples, 2 unique classes
  Client 11: 8656 train samples, 2 unique classes
  Client 12: 9115 train samples, 2 unique classes
  Client 13: 8921 train samples, 2 unique classes
  Client 14: 8699 train samples, 2 unique classes
  Client 15: 8823 train samples, 2 unique classes
  Client 16: 8912 train samples, 2 unique classes
  Client 17: 8766 train samples, 2 unique classes
  Client 18: 9102 train samples, 2 unique classes
  Client 19: 8869 train samples, 2 unique classes
Will sample 4500 samples per client per epoch
Graph: erdos, nodes: 20, edges: 99
Degree statistics: avg=9.90, min=7, max=14
Attack: Compromised 2/20 nodes: [5, 13]
Attack type: gaussian, lambda: 1.0
Model variant: baseline
Model parameters: 2,219,692
BALANCE algorithm:
Balance Config: BALANCEConfig(gamma=2, kappa=1, alpha=0.5, min_neighbors=1)
  - Model dimension: 2,219,692 parameters
  - Complexity: O(N×d) = O(20×2,219,692)
Initial test acc across nodes: mean=0.4978 ± 0.0208
Round 001: test acc mean=0.6817 ± 0.0432 | min=0.5485 max=0.7254
         : test loss mean=0.6807 ± 0.0036
         : individual accs = ['0.702632', '0.665803', '0.621118', '0.718480', '0.548501', '0.672489', '0.685590', '0.618456', '0.725352', '0.711879', '0.678322', '0.722667', '0.710938', '0.714655', '0.678826', '0.672489', '0.706239', '0.704686', '0.719101', '0.655565']
         : correct/total = [(801, 1140), (771, 1158), (700, 1127), (832, 1158), (622, 1134), (770, 1145), (785, 1145), (697, 1127), (824, 1136), (803, 1128), (776, 1144), (813, 1125), (819, 1152), (829, 1160), (763, 1124), (770, 1145), (815, 1154), (797, 1131), (832, 1157), (748, 1141)]
         : compromised: 0.6936, honest: 0.6804
Round 002: test acc mean=0.6474 ± 0.0489 | min=0.5197 max=0.7075
         : test loss mean=0.6758 ± 0.0065
         : individual accs = ['0.648246', '0.664076', '0.652174', '0.631261', '0.529101', '0.519651', '0.636681', '0.671695', '0.690141', '0.641844', '0.691434', '0.684444', '0.707465', '0.643103', '0.584520', '0.660262', '0.667244', '0.655172', '0.691443', '0.678352']
         : correct/total = [(739, 1140), (769, 1158), (735, 1127), (731, 1158), (600, 1134), (595, 1145), (729, 1145), (757, 1127), (784, 1136), (724, 1128), (791, 1144), (770, 1125), (815, 1152), (746, 1160), (657, 1124), (756, 1145), (770, 1154), (741, 1131), (800, 1157), (774, 1141)]
         : compromised: 0.5814, honest: 0.6548
Round 003: test acc mean=0.6460 ± 0.0507 | min=0.5302 max=0.7236
         : test loss mean=0.6624 ± 0.0110
         : individual accs = ['0.607895', '0.668394', '0.667258', '0.696028', '0.572310', '0.543231', '0.613100', '0.641526', '0.723592', '0.679078', '0.677448', '0.674667', '0.653646', '0.662931', '0.530249', '0.654148', '0.673310', '0.614500', '0.715644', '0.650307']
         : correct/total = [(693, 1140), (774, 1158), (752, 1127), (806, 1158), (649, 1134), (622, 1145), (702, 1145), (723, 1127), (822, 1136), (766, 1128), (775, 1144), (759, 1125), (753, 1152), (769, 1160), (596, 1124), (749, 1145), (777, 1154), (695, 1131), (828, 1157), (742, 1141)]
         : compromised: 0.6031, honest: 0.6507
Round 004: test acc mean=0.6870 ± 0.0313 | min=0.6135 max=0.7322
         : test loss mean=0.6227 ± 0.0158
         : individual accs = ['0.686842', '0.701209', '0.677906', '0.722798', '0.654321', '0.648908', '0.674236', '0.645963', '0.721831', '0.698582', '0.705420', '0.726222', '0.690972', '0.662069', '0.658363', '0.706550', '0.732236', '0.691424', '0.719965', '0.613497']
         : correct/total = [(783, 1140), (812, 1158), (764, 1127), (837, 1158), (742, 1134), (743, 1145), (772, 1145), (728, 1127), (820, 1136), (788, 1128), (807, 1144), (817, 1125), (796, 1152), (768, 1160), (740, 1124), (809, 1145), (845, 1154), (782, 1131), (833, 1157), (700, 1141)]
         : compromised: 0.6555, honest: 0.6905
Round 005: test acc mean=0.7529 ± 0.0233 | min=0.7019 max=0.7867
         : test loss mean=0.5453 ± 0.0206
         : individual accs = ['0.756140', '0.765976', '0.701863', '0.767703', '0.745150', '0.758952', '0.772052', '0.732919', '0.779930', '0.753546', '0.786713', '0.768000', '0.730903', '0.756034', '0.719751', '0.775546', '0.764298', '0.760389', '0.759723', '0.702016']
         : correct/total = [(862, 1140), (887, 1158), (791, 1127), (889, 1158), (845, 1134), (869, 1145), (884, 1145), (826, 1127), (886, 1136), (850, 1128), (900, 1144), (864, 1125), (842, 1152), (877, 1160), (809, 1124), (888, 1145), (882, 1154), (860, 1131), (879, 1157), (801, 1141)]
         : compromised: 0.7575, honest: 0.7524
Round 006: test acc mean=0.7919 ± 0.0191 | min=0.7445 max=0.8239
         : test loss mean=0.4653 ± 0.0206
         : individual accs = ['0.776316', '0.808290', '0.789707', '0.808290', '0.778660', '0.812227', '0.787773', '0.765750', '0.823944', '0.783688', '0.817308', '0.793778', '0.807292', '0.798276', '0.787367', '0.798253', '0.804159', '0.744474', '0.787381', '0.765118']
         : correct/total = [(885, 1140), (936, 1158), (890, 1127), (936, 1158), (883, 1134), (930, 1145), (902, 1145), (863, 1127), (936, 1136), (884, 1128), (935, 1144), (893, 1125), (930, 1152), (926, 1160), (885, 1124), (914, 1145), (928, 1154), (842, 1131), (911, 1157), (873, 1141)]
         : compromised: 0.8053, honest: 0.7904
Round 007: test acc mean=0.8381 ± 0.0119 | min=0.8202 max=0.8594
         : test loss mean=0.3802 ± 0.0140
         : individual accs = ['0.834211', '0.855786', '0.837622', '0.839378', '0.823633', '0.859389', '0.853275', '0.825200', '0.841549', '0.851064', '0.846154', '0.856000', '0.830729', '0.842241', '0.826512', '0.827074', '0.831889', '0.825818', '0.820225', '0.833479']
         : correct/total = [(951, 1140), (991, 1158), (944, 1127), (972, 1158), (934, 1134), (984, 1145), (977, 1145), (930, 1127), (956, 1136), (960, 1128), (968, 1144), (963, 1125), (957, 1152), (977, 1160), (929, 1124), (947, 1145), (960, 1154), (934, 1131), (949, 1157), (951, 1141)]
         : compromised: 0.8508, honest: 0.8366
Round 008: test acc mean=0.8633 ± 0.0097 | min=0.8418 max=0.8795
         : test loss mean=0.3268 ± 0.0116
         : individual accs = ['0.860526', '0.874784', '0.863354', '0.866149', '0.854497', '0.879476', '0.867249', '0.865129', '0.866197', '0.867021', '0.871503', '0.877333', '0.853299', '0.862931', '0.872776', '0.853275', '0.864818', '0.845270', '0.841832', '0.858896']
         : correct/total = [(981, 1140), (1013, 1158), (973, 1127), (1003, 1158), (969, 1134), (1007, 1145), (993, 1145), (975, 1127), (984, 1136), (978, 1128), (997, 1144), (987, 1125), (983, 1152), (1001, 1160), (981, 1124), (977, 1145), (998, 1154), (956, 1131), (974, 1157), (980, 1141)]
         : compromised: 0.8712, honest: 0.8624
Round 009: test acc mean=0.8736 ± 0.0131 | min=0.8410 max=0.8917
         : test loss mean=0.3019 ± 0.0230
         : individual accs = ['0.880702', '0.891192', '0.855368', '0.879965', '0.864198', '0.891703', '0.885590', '0.876664', '0.875880', '0.879433', '0.885490', '0.887111', '0.867188', '0.880172', '0.868327', '0.857642', '0.873484', '0.854996', '0.840968', '0.876424']
         : correct/total = [(1004, 1140), (1032, 1158), (964, 1127), (1019, 1158), (980, 1134), (1021, 1145), (1014, 1145), (988, 1127), (995, 1136), (992, 1128), (1013, 1144), (998, 1125), (999, 1152), (1021, 1160), (976, 1124), (982, 1145), (1008, 1154), (967, 1131), (973, 1157), (1000, 1141)]
         : compromised: 0.8859, honest: 0.8723
Round 010: test acc mean=0.8853 ± 0.0080 | min=0.8660 max=0.8998
         : test loss mean=0.2795 ± 0.0153
         : individual accs = ['0.892982', '0.886010', '0.877551', '0.892919', '0.876543', '0.889083', '0.883843', '0.886424', '0.889965', '0.899823', '0.889860', '0.887111', '0.883681', '0.888793', '0.894128', '0.871616', '0.888215', '0.875332', '0.866033', '0.886941']
         : correct/total = [(1018, 1140), (1026, 1158), (989, 1127), (1034, 1158), (994, 1134), (1018, 1145), (1012, 1145), (999, 1127), (1011, 1136), (1015, 1128), (1018, 1144), (998, 1125), (1018, 1152), (1031, 1160), (1005, 1124), (998, 1145), (1025, 1154), (990, 1131), (1002, 1157), (1012, 1141)]
         : compromised: 0.8889, honest: 0.8849

=== FINAL RESULTS ===
Dataset: celeba, Nodes: 20, Graph: erdos, Aggregation: balance
Attack: gaussian, 10.0% compromised
Final accuracy - Compromised: 0.8889, Honest: 0.8849
Overall test accuracy: mean=0.8853 ± 0.0080

=== BALANCE SUMMARY ===
Node 0: acceptance=0.917
Node 1: acceptance=0.900
Node 2: acceptance=1.000
Node 3: acceptance=0.857
Node 4: acceptance=0.889
Node 5: acceptance=1.000
Node 6: acceptance=0.833
Node 7: acceptance=0.909
Node 8: acceptance=0.714
Node 9: acceptance=1.000
Node 10: acceptance=1.000
Node 11: acceptance=0.833
Node 12: acceptance=0.917
Node 13: acceptance=1.000
Node 14: acceptance=0.857
Node 15: acceptance=0.889
Node 16: acceptance=1.000
Node 17: acceptance=0.875
Node 18: acceptance=0.917
Node 19: acceptance=0.800

=== PARALLEL EXECUTION TIME (realistic for distributed system) ===
  COMMUNICATION (max across nodes):
    - Full model transfer: 0.000s (0.0%)
  COMPUTATION (max across nodes):
    - Filtering: 0.044s (73.3%)
    - Aggregation: 0.016s (26.7%)
  TOTALS:
    - Total computation: 0.059s (100.0%)
    - Total communication: 0.000s (0.0%)
    - Total parallel time: 0.059s

=== PER-NODE AVERAGE TIME ===
  - Filtering: 0.027s
  - Aggregation: 0.007s
  - Model transfer: 0.000s
  - Total per node: 0.034s

=== TOTAL COMPUTATIONAL WORK (sum across all nodes) ===
  - Total filtering: 0.538s
  - Total aggregation: 0.138s
  - Total model transfer: 0.000s
  - Grand total: 0.676s
  - Mean acceptance rate: 0.905

BALANCE Algorithm Properties:
  - Model dimension: 2,219,692
  - No compression: Full parameter comparison
  - Theoretical complexity: O(deg(i)×d)
  - Approach: Full parameter filtering + averaging
