Device: cuda
Seed: 987654321
Looking for images in: /home/student.unimelb.edu.au/mrangwala/Projects/Sketchguard/leaf/data/celeba/data/raw/img_align_celeba
Loading 1 LEAF CelebA train files...
LEAF CelebA train: 9343 users (celebrities), 177457 samples
Looking for images in: /home/student.unimelb.edu.au/mrangwala/Projects/Sketchguard/leaf/data/celeba/data/raw/img_align_celeba
Loading 1 LEAF CelebA test files...
LEAF CelebA test: 9343 users (celebrities), 22831 samples
Found 9343 train users, 9343 test users, 9343 common users
User sample counts range: 31 (max) to 4 (min)
Distributed ALL 9343 users across 20 clients
Users per client: 467 (with 3 clients getting +1 user)
Train partition sizes: [8843, 8998, 8728, 9034, 8866, 8946, 8873, 8776, 8816, 8801, 8913, 8656, 9115, 8921, 8699, 8823, 8912, 8766, 9102, 8869]
Test partition sizes: [1140, 1158, 1127, 1158, 1134, 1145, 1145, 1127, 1136, 1128, 1144, 1125, 1152, 1160, 1124, 1145, 1154, 1131, 1157, 1141]
  Client 0: 8843 train samples, 2 unique classes
  Client 1: 8998 train samples, 2 unique classes
  Client 2: 8728 train samples, 2 unique classes
  Client 3: 9034 train samples, 2 unique classes
  Client 4: 8866 train samples, 2 unique classes
  Client 5: 8946 train samples, 2 unique classes
  Client 6: 8873 train samples, 2 unique classes
  Client 7: 8776 train samples, 2 unique classes
  Client 8: 8816 train samples, 2 unique classes
  Client 9: 8801 train samples, 2 unique classes
  Client 10: 8913 train samples, 2 unique classes
  Client 11: 8656 train samples, 2 unique classes
  Client 12: 9115 train samples, 2 unique classes
  Client 13: 8921 train samples, 2 unique classes
  Client 14: 8699 train samples, 2 unique classes
  Client 15: 8823 train samples, 2 unique classes
  Client 16: 8912 train samples, 2 unique classes
  Client 17: 8766 train samples, 2 unique classes
  Client 18: 9102 train samples, 2 unique classes
  Client 19: 8869 train samples, 2 unique classes
Will sample 4500 samples per client per epoch
Graph: erdos, nodes: 20, edges: 99
Degree statistics: avg=9.90, min=7, max=14
Attack: Compromised 8/20 nodes: [1, 5, 11, 12, 13, 14, 17, 18]
Attack type: directed_deviation, lambda: 1.0
Model variant: baseline
Model parameters: 2,219,692
Initial test acc across nodes: mean=0.4978 ± 0.0208
Round 001: test acc mean=0.6071 ± 0.1122 | min=0.4594 max=0.7729
         : test loss mean=5460.4977 ± 13877.1201
         : individual accs = ['0.671930', '0.661485', '0.678793', '0.493092', '0.492063', '0.459389', '0.772926', '0.498669', '0.496479', '0.679078', '0.727273', '0.504889', '0.756944', '0.484483', '0.739324', '0.462009', '0.493934', '0.686118', '0.677615', '0.706398']
         : correct/total = [(766, 1140), (766, 1158), (765, 1127), (571, 1158), (558, 1134), (526, 1145), (885, 1145), (562, 1127), (564, 1136), (766, 1128), (832, 1144), (568, 1125), (872, 1152), (562, 1160), (831, 1124), (529, 1145), (570, 1154), (776, 1131), (784, 1157), (806, 1141)]
         : compromised: 0.6213, honest: 0.5977
Round 002: test acc mean=0.6052 ± 0.1360 | min=0.4987 max=0.8603
         : test loss mean=nan ± nan
         : individual accs = ['0.754386', '0.508636', '0.769299', '0.528497', '0.522046', '0.514410', '0.860262', '0.503993', '0.562500', '0.820922', '0.858392', '0.498667', '0.522569', '0.506897', '0.517794', '0.517031', '0.515598', '0.508400', '0.522040', '0.792287']
         : correct/total = [(860, 1140), (589, 1158), (867, 1127), (612, 1158), (592, 1134), (589, 1145), (985, 1145), (568, 1127), (639, 1136), (926, 1128), (982, 1144), (561, 1125), (602, 1152), (588, 1160), (582, 1124), (592, 1145), (595, 1154), (575, 1131), (604, 1157), (904, 1141)]
         : compromised: 0.5124, honest: 0.6671
Round 003: test acc mean=0.6192 ± 0.1559 | min=0.4987 max=0.8750
         : test loss mean=nan ± nan
         : individual accs = ['0.817544', '0.508636', '0.837622', '0.528497', '0.522046', '0.514410', '0.873362', '0.503993', '0.562500', '0.867908', '0.875000', '0.498667', '0.522569', '0.506897', '0.517794', '0.517031', '0.515598', '0.508400', '0.522040', '0.864154']
         : correct/total = [(932, 1140), (589, 1158), (944, 1127), (612, 1158), (592, 1134), (589, 1145), (1000, 1145), (568, 1127), (639, 1136), (979, 1128), (1001, 1144), (561, 1125), (602, 1152), (588, 1160), (582, 1124), (592, 1145), (595, 1154), (575, 1131), (604, 1157), (986, 1141)]
         : compromised: 0.5124, honest: 0.6904
Round 004: test acc mean=0.6260 ± 0.1657 | min=0.4987 max=0.8883
         : test loss mean=nan ± nan
         : individual accs = ['0.877193', '0.508636', '0.872227', '0.528497', '0.522046', '0.514410', '0.876856', '0.503993', '0.562500', '0.888298', '0.880245', '0.498667', '0.522569', '0.506897', '0.517794', '0.517031', '0.515598', '0.508400', '0.522040', '0.875548']
         : correct/total = [(1000, 1140), (589, 1158), (983, 1127), (612, 1158), (592, 1134), (589, 1145), (1004, 1145), (568, 1127), (639, 1136), (1002, 1128), (1007, 1144), (561, 1125), (602, 1152), (588, 1160), (582, 1124), (592, 1145), (595, 1154), (575, 1131), (604, 1157), (999, 1141)]
         : compromised: 0.5124, honest: 0.7017
Round 005: test acc mean=0.6220 ± 0.1601 | min=0.4987 max=0.8865
         : test loss mean=nan ± nan
         : individual accs = ['0.820175', '0.508636', '0.866016', '0.528497', '0.522046', '0.514410', '0.886463', '0.503993', '0.562500', '0.881206', '0.875000', '0.498667', '0.522569', '0.506897', '0.517794', '0.517031', '0.515598', '0.508400', '0.522040', '0.861525']
         : correct/total = [(935, 1140), (589, 1158), (976, 1127), (612, 1158), (592, 1134), (589, 1145), (1015, 1145), (568, 1127), (639, 1136), (994, 1128), (1001, 1144), (561, 1125), (602, 1152), (588, 1160), (582, 1124), (592, 1145), (595, 1154), (575, 1131), (604, 1157), (983, 1141)]
         : compromised: 0.5124, honest: 0.6950
Round 006: test acc mean=0.6283 ± 0.1693 | min=0.4987 max=0.8912
         : test loss mean=nan ± nan
         : individual accs = ['0.891228', '0.508636', '0.888199', '0.528497', '0.522046', '0.514410', '0.889083', '0.503993', '0.562500', '0.876773', '0.889860', '0.498667', '0.522569', '0.506897', '0.517794', '0.517031', '0.515598', '0.508400', '0.522040', '0.881683']
         : correct/total = [(1016, 1140), (589, 1158), (1001, 1127), (612, 1158), (592, 1134), (589, 1145), (1018, 1145), (568, 1127), (639, 1136), (989, 1128), (1018, 1144), (561, 1125), (602, 1152), (588, 1160), (582, 1124), (592, 1145), (595, 1154), (575, 1131), (604, 1157), (1006, 1141)]
         : compromised: 0.5124, honest: 0.7055
Round 007: test acc mean=0.6305 ± 0.1726 | min=0.4987 max=0.9026
         : test loss mean=nan ± nan
         : individual accs = ['0.902632', '0.508636', '0.888199', '0.528497', '0.522046', '0.514410', '0.891703', '0.503993', '0.562500', '0.898936', '0.888112', '0.498667', '0.522569', '0.506897', '0.517794', '0.517031', '0.515598', '0.508400', '0.522040', '0.891323']
         : correct/total = [(1029, 1140), (589, 1158), (1001, 1127), (612, 1158), (592, 1134), (589, 1145), (1021, 1145), (568, 1127), (639, 1136), (1014, 1128), (1016, 1144), (561, 1125), (602, 1152), (588, 1160), (582, 1124), (592, 1145), (595, 1154), (575, 1131), (604, 1157), (1017, 1141)]
         : compromised: 0.5124, honest: 0.7092
Round 008: test acc mean=0.6294 ± 0.1709 | min=0.4987 max=0.9035
         : test loss mean=nan ± nan
         : individual accs = ['0.903509', '0.508636', '0.883762', '0.528497', '0.522046', '0.514410', '0.894323', '0.503993', '0.562500', '0.889184', '0.886364', '0.498667', '0.522569', '0.506897', '0.517794', '0.517031', '0.515598', '0.508400', '0.522040', '0.880806']
         : correct/total = [(1030, 1140), (589, 1158), (996, 1127), (612, 1158), (592, 1134), (589, 1145), (1024, 1145), (568, 1127), (639, 1136), (1003, 1128), (1014, 1144), (561, 1125), (602, 1152), (588, 1160), (582, 1124), (592, 1145), (595, 1154), (575, 1131), (604, 1157), (1005, 1141)]
         : compromised: 0.5124, honest: 0.7073
Round 009: test acc mean=0.6309 ± 0.1733 | min=0.4987 max=0.9043
         : test loss mean=nan ± nan
         : individual accs = ['0.897368', '0.508636', '0.890861', '0.528497', '0.522046', '0.514410', '0.896943', '0.503993', '0.562500', '0.904255', '0.889860', '0.498667', '0.522569', '0.506897', '0.517794', '0.517031', '0.515598', '0.508400', '0.522040', '0.890447']
         : correct/total = [(1023, 1140), (589, 1158), (1004, 1127), (612, 1158), (592, 1134), (589, 1145), (1027, 1145), (568, 1127), (639, 1136), (1020, 1128), (1018, 1144), (561, 1125), (602, 1152), (588, 1160), (582, 1124), (592, 1145), (595, 1154), (575, 1131), (604, 1157), (1016, 1141)]
         : compromised: 0.5124, honest: 0.7099
Round 010: test acc mean=0.6292 ± 0.1706 | min=0.4987 max=0.8961
         : test loss mean=nan ± nan
         : individual accs = ['0.895614', '0.508636', '0.886424', '0.528497', '0.522046', '0.514410', '0.896070', '0.503993', '0.562500', '0.886525', '0.882867', '0.498667', '0.522569', '0.506897', '0.517794', '0.517031', '0.515598', '0.508400', '0.522040', '0.886941']
         : correct/total = [(1021, 1140), (589, 1158), (999, 1127), (612, 1158), (592, 1134), (589, 1145), (1026, 1145), (568, 1127), (639, 1136), (1000, 1128), (1010, 1144), (561, 1125), (602, 1152), (588, 1160), (582, 1124), (592, 1145), (595, 1154), (575, 1131), (604, 1157), (1012, 1141)]
         : compromised: 0.5124, honest: 0.7070

=== FINAL RESULTS ===
Dataset: celeba, Nodes: 20, Graph: erdos, Aggregation: krum
Attack: directed_deviation, 40.0% compromised
Final accuracy - Compromised: 0.5124, Honest: 0.7070
Overall test accuracy: mean=0.6292 ± 0.1706
