Device: cuda
Seed: 987654321
Looking for images in: /home/student.unimelb.edu.au/mrangwala/Projects/Sketchguard/leaf/data/celeba/data/raw/img_align_celeba
Loading 1 LEAF CelebA train files...
LEAF CelebA train: 9343 users (celebrities), 177457 samples
Looking for images in: /home/student.unimelb.edu.au/mrangwala/Projects/Sketchguard/leaf/data/celeba/data/raw/img_align_celeba
Loading 1 LEAF CelebA test files...
LEAF CelebA test: 9343 users (celebrities), 22831 samples
Found 9343 train users, 9343 test users, 9343 common users
User sample counts range: 31 (max) to 4 (min)
Distributed ALL 9343 users across 20 clients
Users per client: 467 (with 3 clients getting +1 user)
Train partition sizes: [8843, 8998, 8728, 9034, 8866, 8946, 8873, 8776, 8816, 8801, 8913, 8656, 9115, 8921, 8699, 8823, 8912, 8766, 9102, 8869]
Test partition sizes: [1140, 1158, 1127, 1158, 1134, 1145, 1145, 1127, 1136, 1128, 1144, 1125, 1152, 1160, 1124, 1145, 1154, 1131, 1157, 1141]
  Client 0: 8843 train samples, 2 unique classes
  Client 1: 8998 train samples, 2 unique classes
  Client 2: 8728 train samples, 2 unique classes
  Client 3: 9034 train samples, 2 unique classes
  Client 4: 8866 train samples, 2 unique classes
  Client 5: 8946 train samples, 2 unique classes
  Client 6: 8873 train samples, 2 unique classes
  Client 7: 8776 train samples, 2 unique classes
  Client 8: 8816 train samples, 2 unique classes
  Client 9: 8801 train samples, 2 unique classes
  Client 10: 8913 train samples, 2 unique classes
  Client 11: 8656 train samples, 2 unique classes
  Client 12: 9115 train samples, 2 unique classes
  Client 13: 8921 train samples, 2 unique classes
  Client 14: 8699 train samples, 2 unique classes
  Client 15: 8823 train samples, 2 unique classes
  Client 16: 8912 train samples, 2 unique classes
  Client 17: 8766 train samples, 2 unique classes
  Client 18: 9102 train samples, 2 unique classes
  Client 19: 8869 train samples, 2 unique classes
Will sample 4500 samples per client per epoch
Graph: erdos, nodes: 20, edges: 48
Degree statistics: avg=4.80, min=2, max=7
Attack: Compromised 10/20 nodes: [1, 2, 5, 11, 12, 13, 14, 15, 17, 18]
Attack type: backdoor, lambda: 1.0
Backdoor target label: 0, trigger size: 8
Model variant: baseline
Model parameters: 2,219,692
UBAR ALGORITHM (Two-Stage Byzantine-resilient)
  - Model dimension: 2,219,692 parameters
  - Rho parameter: 0.5
  - Stage 1: Distance-based filtering (select 50% closest neighbors)
  - Stage 2: Performance-based selection (loss comparison)
  - Complexity: O(deg(i)×d + deg(i)×inference)
Initial test acc across nodes: mean=0.4978 ± 0.0208
Backdoor attack: Created poisoned datasets for 10 compromised nodes
Round 001: test acc mean=0.5726 ± 0.0707 | min=0.4942 max=0.7158
         : test loss mean=2626.4230 ± 3514.0434
         : individual accs = ['0.625439', '0.508636', '0.494232', '0.696028', '0.571429', '0.514410', '0.643668', '0.612245', '0.636444', '0.655142', '0.644231', '0.519111', '0.522569', '0.506897', '0.517794', '0.517031', '0.715771', '0.508400', '0.522040', '0.521472']
         : correct/total = [(713, 1140), (589, 1158), (557, 1127), (806, 1158), (648, 1134), (589, 1145), (737, 1145), (690, 1127), (723, 1136), (739, 1128), (737, 1144), (584, 1125), (602, 1152), (588, 1160), (582, 1124), (592, 1145), (826, 1154), (575, 1131), (604, 1157), (595, 1141)]
         : compromised: 0.5131, honest: 0.6322
         : ubar stats = ['Node 0: s1=0.500, s2=0.333', 'Node 1: s1=0.500, s2=1.000', 'Node 2: s1=0.400, s2=1.000']...
Round 002: test acc mean=0.6218 ± 0.1148 | min=0.4889 max=0.7581
         : test loss mean=nan ± nan
         : individual accs = ['0.737719', '0.506908', '0.490683', '0.705527', '0.690476', '0.509170', '0.758079', '0.747116', '0.757923', '0.757979', '0.735140', '0.488889', '0.521701', '0.506897', '0.517794', '0.517031', '0.727903', '0.506631', '0.516854', '0.735320']
         : correct/total = [(841, 1140), (587, 1158), (553, 1127), (817, 1158), (783, 1134), (583, 1145), (868, 1145), (842, 1127), (861, 1136), (855, 1128), (841, 1144), (550, 1125), (601, 1152), (588, 1160), (582, 1124), (592, 1145), (840, 1154), (573, 1131), (598, 1157), (839, 1141)]
         : compromised: 0.5083, honest: 0.7353
         : ubar stats = ['Node 0: s1=0.500, s2=0.333', 'Node 1: s1=0.500, s2=1.000', 'Node 2: s1=0.400, s2=1.000']...
Round 003: test acc mean=0.6699 ± 0.1594 | min=0.4933 max=0.8470
         : test loss mean=nan ± nan
         : individual accs = ['0.834211', '0.508636', '0.493345', '0.796200', '0.828042', '0.514410', '0.818341', '0.838509', '0.832746', '0.838652', '0.847028', '0.498667', '0.522569', '0.506897', '0.517794', '0.517031', '0.824957', '0.508400', '0.522040', '0.829974']
         : correct/total = [(951, 1140), (589, 1158), (556, 1127), (922, 1158), (939, 1134), (589, 1145), (937, 1145), (945, 1127), (946, 1136), (946, 1128), (969, 1144), (561, 1125), (602, 1152), (588, 1160), (582, 1124), (592, 1145), (952, 1154), (575, 1131), (604, 1157), (947, 1141)]
         : compromised: 0.5110, honest: 0.8289
         : ubar stats = ['Node 0: s1=0.500, s2=0.333', 'Node 1: s1=0.500, s2=0.778', 'Node 2: s1=0.400, s2=0.833']...
Round 004: test acc mean=0.6906 ± 0.1798 | min=0.4933 max=0.8839
         : test loss mean=nan ± nan
         : individual accs = ['0.871930', '0.508636', '0.493345', '0.852332', '0.859788', '0.514410', '0.872489', '0.874002', '0.881162', '0.883865', '0.878497', '0.498667', '0.522569', '0.506897', '0.517794', '0.517031', '0.857019', '0.508400', '0.522040', '0.870289']
         : correct/total = [(994, 1140), (589, 1158), (556, 1127), (987, 1158), (975, 1134), (589, 1145), (999, 1145), (985, 1127), (1001, 1136), (997, 1128), (1005, 1144), (561, 1125), (602, 1152), (588, 1160), (582, 1124), (592, 1145), (989, 1154), (575, 1131), (604, 1157), (993, 1141)]
         : compromised: 0.5110, honest: 0.8701
         : ubar stats = ['Node 0: s1=0.500, s2=0.333', 'Node 1: s1=0.500, s2=0.667', 'Node 2: s1=0.400, s2=0.750']...
Round 005: test acc mean=0.6958 ± 0.1851 | min=0.4933 max=0.8972
         : test loss mean=nan ± nan
         : individual accs = ['0.871053', '0.508636', '0.493345', '0.886874', '0.865961', '0.514410', '0.875983', '0.861579', '0.890845', '0.897163', '0.891608', '0.498667', '0.522569', '0.506897', '0.517794', '0.517031', '0.886482', '0.508400', '0.522040', '0.878177']
         : correct/total = [(993, 1140), (589, 1158), (556, 1127), (1027, 1158), (982, 1134), (589, 1145), (1003, 1145), (971, 1127), (1012, 1136), (1012, 1128), (1020, 1144), (561, 1125), (602, 1152), (588, 1160), (582, 1124), (592, 1145), (1023, 1154), (575, 1131), (604, 1157), (1002, 1141)]
         : compromised: 0.5110, honest: 0.8806
         : ubar stats = ['Node 0: s1=0.500, s2=0.467', 'Node 1: s1=0.500, s2=0.600', 'Node 2: s1=0.400, s2=0.700']...
Round 006: test acc mean=0.7000 ± 0.1892 | min=0.4933 max=0.9005
         : test loss mean=nan ± nan
         : individual accs = ['0.883333', '0.508636', '0.493345', '0.883420', '0.881834', '0.514410', '0.890830', '0.891748', '0.900528', '0.890071', '0.891608', '0.498667', '0.522569', '0.506897', '0.517794', '0.517031', '0.890815', '0.508400', '0.522040', '0.886065']
         : correct/total = [(1007, 1140), (589, 1158), (556, 1127), (1023, 1158), (1000, 1134), (589, 1145), (1020, 1145), (1005, 1127), (1023, 1136), (1004, 1128), (1020, 1144), (561, 1125), (602, 1152), (588, 1160), (582, 1124), (592, 1145), (1028, 1154), (575, 1131), (604, 1157), (1011, 1141)]
         : compromised: 0.5110, honest: 0.8890
         : ubar stats = ['Node 0: s1=0.500, s2=0.444', 'Node 1: s1=0.500, s2=0.556', 'Node 2: s1=0.400, s2=0.667']...
Round 007: test acc mean=0.7034 ± 0.1926 | min=0.4933 max=0.9034
         : test loss mean=nan ± nan
         : individual accs = ['0.898246', '0.508636', '0.493345', '0.898100', '0.880952', '0.514410', '0.899563', '0.892635', '0.889965', '0.903369', '0.902972', '0.498667', '0.522569', '0.506897', '0.517794', '0.517031', '0.902080', '0.508400', '0.522040', '0.890447']
         : correct/total = [(1024, 1140), (589, 1158), (556, 1127), (1040, 1158), (999, 1134), (589, 1145), (1030, 1145), (1006, 1127), (1011, 1136), (1019, 1128), (1033, 1144), (561, 1125), (602, 1152), (588, 1160), (582, 1124), (592, 1145), (1041, 1154), (575, 1131), (604, 1157), (1016, 1141)]
         : compromised: 0.5110, honest: 0.8958
         : ubar stats = ['Node 0: s1=0.500, s2=0.429', 'Node 1: s1=0.500, s2=0.524', 'Node 2: s1=0.400, s2=0.643']...
Round 008: test acc mean=0.7030 ± 0.1921 | min=0.4933 max=0.9021
         : test loss mean=nan ± nan
         : individual accs = ['0.897368', '0.508636', '0.493345', '0.898964', '0.890653', '0.514410', '0.893450', '0.897959', '0.889965', '0.895390', '0.897727', '0.498667', '0.522569', '0.506897', '0.517794', '0.517031', '0.902080', '0.508400', '0.522040', '0.886065']
         : correct/total = [(1023, 1140), (589, 1158), (556, 1127), (1041, 1158), (1010, 1134), (589, 1145), (1023, 1145), (1012, 1127), (1011, 1136), (1010, 1128), (1027, 1144), (561, 1125), (602, 1152), (588, 1160), (582, 1124), (592, 1145), (1041, 1154), (575, 1131), (604, 1157), (1011, 1141)]
         : compromised: 0.5110, honest: 0.8950
         : ubar stats = ['Node 0: s1=0.500, s2=0.417', 'Node 1: s1=0.500, s2=0.500', 'Node 2: s1=0.400, s2=0.625']...
Round 009: test acc mean=0.7061 ± 0.1953 | min=0.4933 max=0.9136
         : test loss mean=nan ± nan
         : individual accs = ['0.903509', '0.508636', '0.493345', '0.913644', '0.900353', '0.514410', '0.896943', '0.899734', '0.903169', '0.901596', '0.898601', '0.498667', '0.522569', '0.506897', '0.517794', '0.517031', '0.905546', '0.508400', '0.522040', '0.889571']
         : correct/total = [(1030, 1140), (589, 1158), (556, 1127), (1058, 1158), (1021, 1134), (589, 1145), (1027, 1145), (1014, 1127), (1026, 1136), (1017, 1128), (1028, 1144), (561, 1125), (602, 1152), (588, 1160), (582, 1124), (592, 1145), (1045, 1154), (575, 1131), (604, 1157), (1015, 1141)]
         : compromised: 0.5110, honest: 0.9013
         : ubar stats = ['Node 0: s1=0.500, s2=0.407', 'Node 1: s1=0.500, s2=0.481', 'Node 2: s1=0.400, s2=0.611']...
Round 010: test acc mean=0.7065 ± 0.1957 | min=0.4933 max=0.9107
         : test loss mean=nan ± nan
         : individual accs = ['0.908772', '0.508636', '0.493345', '0.904145', '0.898589', '0.514410', '0.904803', '0.899734', '0.894366', '0.909574', '0.898601', '0.498667', '0.522569', '0.506897', '0.517794', '0.517031', '0.910745', '0.508400', '0.522040', '0.890447']
         : correct/total = [(1036, 1140), (589, 1158), (556, 1127), (1047, 1158), (1019, 1134), (589, 1145), (1036, 1145), (1014, 1127), (1016, 1136), (1026, 1128), (1028, 1144), (561, 1125), (602, 1152), (588, 1160), (582, 1124), (592, 1145), (1051, 1154), (575, 1131), (604, 1157), (1016, 1141)]
         : compromised: 0.5110, honest: 0.9020
         : ubar stats = ['Node 0: s1=0.500, s2=0.400', 'Node 1: s1=0.500, s2=0.467', 'Node 2: s1=0.400, s2=0.600']...

=== FINAL RESULTS ===
Dataset: celeba, Nodes: 20, Graph: erdos, Aggregation: ubar
Attack: backdoor, 50.0% compromised
Final accuracy - Compromised: 0.5110, Honest: 0.9020
Overall test accuracy: mean=0.7065 ± 0.1957

=== BACKDOOR ATTACK SUCCESS RATE (ASR) ===
Target label: 0
Trigger size: 8x8
Overall ASR: 0.7765 ± 0.2239
Honest nodes ASR: 0.5530 ± 0.0197
Compromised nodes ASR: 1.0000 ± 0.0000
Note: Higher ASR indicates more successful backdoor attack

=== UBAR SUMMARY ===
Node 0: stage1=0.500, stage2=0.400, overall=0.200
Node 1: stage1=0.500, stage2=0.467, overall=0.233
Node 2: stage1=0.400, stage2=0.600, overall=0.240
Node 3: stage1=0.500, stage2=0.650, overall=0.325
Node 4: stage1=0.500, stage2=0.500, overall=0.250
Node 5: stage1=0.400, stage2=0.500, overall=0.200
Node 6: stage1=0.400, stage2=0.550, overall=0.220
Node 7: stage1=0.400, stage2=0.600, overall=0.240
Node 8: stage1=0.500, stage2=1.000, overall=0.500
Node 9: stage1=0.333, stage2=1.000, overall=0.333
Node 10: stage1=0.500, stage2=0.550, overall=0.275
Node 11: stage1=0.429, stage2=0.467, overall=0.200
Node 12: stage1=0.429, stage2=0.467, overall=0.200
Node 13: stage1=0.500, stage2=0.550, overall=0.275
Node 14: stage1=0.429, stage2=0.400, overall=0.171
Node 15: stage1=0.500, stage2=0.400, overall=0.200
Node 16: stage1=0.400, stage2=0.500, overall=0.200
Node 17: stage1=0.400, stage2=0.600, overall=0.240
Node 18: stage1=0.500, stage2=0.600, overall=0.300
Node 19: stage1=0.500, stage2=1.000, overall=0.500

=== PARALLEL EXECUTION TIME (realistic for distributed system) ===
  COMMUNICATION (max across nodes):
    - Full model transfer: 0.000s (0.0%)
  COMPUTATION (max across nodes):
    - Distance computation: 0.017s (8.5%)
    - Loss computation: 0.175s (89.6%)
    - Aggregation: 0.004s (1.9%)
  TOTALS:
    - Total computation: 0.196s (100.0%)
    - Total communication: 0.000s (0.0%)
    - Total parallel time: 0.196s

=== PER-NODE AVERAGE TIME ===
  - Distance computation: 0.013s
  - Loss computation: 0.133s
  - Aggregation: 0.003s
  - Model transfer: 0.000s
  - Total per node: 0.149s

=== TOTAL COMPUTATIONAL WORK (sum across all nodes) ===
  - Total distance computation: 0.254s
  - Total loss computation: 2.666s
  - Total aggregation: 0.055s
  - Total model transfer: 0.000s
  - Grand total: 2.974s
  - Mean Stage 1 acceptance rate: 0.451
  - Mean Stage 2 acceptance rate: 0.590
  - Overall acceptance rate: 0.266

UBAR Algorithm Properties:
  - Model dimension: 2,219,692
  - Rho parameter: 0.5
  - Two-stage approach: Distance filtering + loss evaluation
  - Stage 1 selects: 50% of neighbors
  - Stage 2 uses: Training sample loss comparison
  - Theoretical complexity: O(deg(i)×d + deg(i)×inference)
  - Approach: UBAR paper implementation
