Device: cuda
Seed: 987654321
Looking for images in: /home/student.unimelb.edu.au/mrangwala/Projects/Sketchguard/leaf/data/celeba/data/raw/img_align_celeba
Loading 1 LEAF CelebA train files...
LEAF CelebA train: 9343 users (celebrities), 177457 samples
Looking for images in: /home/student.unimelb.edu.au/mrangwala/Projects/Sketchguard/leaf/data/celeba/data/raw/img_align_celeba
Loading 1 LEAF CelebA test files...
LEAF CelebA test: 9343 users (celebrities), 22831 samples
Found 9343 train users, 9343 test users, 9343 common users
User sample counts range: 31 (max) to 4 (min)
Distributed ALL 9343 users across 20 clients
Users per client: 467 (with 3 clients getting +1 user)
Train partition sizes: [8843, 8998, 8728, 9034, 8866, 8946, 8873, 8776, 8816, 8801, 8913, 8656, 9115, 8921, 8699, 8823, 8912, 8766, 9102, 8869]
Test partition sizes: [1140, 1158, 1127, 1158, 1134, 1145, 1145, 1127, 1136, 1128, 1144, 1125, 1152, 1160, 1124, 1145, 1154, 1131, 1157, 1141]
  Client 0: 8843 train samples, 2 unique classes
  Client 1: 8998 train samples, 2 unique classes
  Client 2: 8728 train samples, 2 unique classes
  Client 3: 9034 train samples, 2 unique classes
  Client 4: 8866 train samples, 2 unique classes
  Client 5: 8946 train samples, 2 unique classes
  Client 6: 8873 train samples, 2 unique classes
  Client 7: 8776 train samples, 2 unique classes
  Client 8: 8816 train samples, 2 unique classes
  Client 9: 8801 train samples, 2 unique classes
  Client 10: 8913 train samples, 2 unique classes
  Client 11: 8656 train samples, 2 unique classes
  Client 12: 9115 train samples, 2 unique classes
  Client 13: 8921 train samples, 2 unique classes
  Client 14: 8699 train samples, 2 unique classes
  Client 15: 8823 train samples, 2 unique classes
  Client 16: 8912 train samples, 2 unique classes
  Client 17: 8766 train samples, 2 unique classes
  Client 18: 9102 train samples, 2 unique classes
  Client 19: 8869 train samples, 2 unique classes
Will sample 4500 samples per client per epoch
Graph: erdos, nodes: 20, edges: 48
Degree statistics: avg=4.80, min=2, max=7
Attack: Compromised 4/20 nodes: [5, 12, 13, 17]
Attack type: krum, lambda: 1.0
Model variant: baseline
Model parameters: 2,219,692
BALANCE algorithm:
Balance Config: BALANCEConfig(gamma=2, kappa=1, alpha=0.5, min_neighbors=1)
  - Model dimension: 2,219,692 parameters
  - Complexity: O(N×d) = O(20×2,219,692)
Initial test acc across nodes: mean=0.4978 ± 0.0208
Round 001: test acc mean=0.6583 ± 0.0494 | min=0.5197 max=0.7200
         : test loss mean=0.6810 ± 0.0038
         : individual accs = ['0.706140', '0.674439', '0.621118', '0.704663', '0.567901', '0.613100', '0.658515', '0.624667', '0.634683', '0.682624', '0.664336', '0.695111', '0.707465', '0.700862', '0.641459', '0.671616', '0.692374', '0.665782', '0.719965', '0.519720']
         : correct/total = [(805, 1140), (781, 1158), (700, 1127), (816, 1158), (644, 1134), (702, 1145), (754, 1145), (704, 1127), (721, 1136), (770, 1128), (760, 1144), (782, 1125), (815, 1152), (813, 1160), (721, 1124), (769, 1145), (799, 1154), (753, 1131), (833, 1157), (593, 1141)]
         : compromised: 0.6718, honest: 0.6550
Round 002: test acc mean=0.6628 ± 0.0527 | min=0.5170 max=0.7333
         : test loss mean=0.6639 ± 0.0131
         : individual accs = ['0.652632', '0.663212', '0.683230', '0.674439', '0.543210', '0.517031', '0.682096', '0.667258', '0.733275', '0.702128', '0.701049', '0.684444', '0.693576', '0.595690', '0.667260', '0.674236', '0.704506', '0.640141', '0.713915', '0.661700']
         : correct/total = [(744, 1140), (768, 1158), (770, 1127), (781, 1158), (616, 1134), (592, 1145), (781, 1145), (752, 1127), (833, 1136), (792, 1128), (802, 1144), (770, 1125), (799, 1152), (691, 1160), (750, 1124), (772, 1145), (813, 1154), (724, 1131), (826, 1157), (755, 1141)]
         : compromised: 0.6116, honest: 0.6755
Round 003: test acc mean=0.7120 ± 0.0459 | min=0.6111 max=0.7826
         : test loss mean=0.6255 ± 0.0319
         : individual accs = ['0.701754', '0.690846', '0.723159', '0.760794', '0.611111', '0.639301', '0.743231', '0.692990', '0.782570', '0.759752', '0.752622', '0.750222', '0.653646', '0.713793', '0.709964', '0.722271', '0.727903', '0.636605', '0.760588', '0.706398']
         : correct/total = [(800, 1140), (800, 1158), (815, 1127), (881, 1158), (693, 1134), (732, 1145), (851, 1145), (781, 1127), (889, 1136), (857, 1128), (861, 1144), (844, 1125), (753, 1152), (828, 1160), (798, 1124), (827, 1145), (840, 1154), (720, 1131), (880, 1157), (806, 1141)]
         : compromised: 0.6608, honest: 0.7248
Round 004: test acc mean=0.7645 ± 0.0350 | min=0.7153 max=0.8319
         : test loss mean=0.5586 ± 0.0491
         : individual accs = ['0.721053', '0.729706', '0.750665', '0.801382', '0.729277', '0.723144', '0.741485', '0.771961', '0.831866', '0.820922', '0.811189', '0.791111', '0.723958', '0.746552', '0.772242', '0.765939', '0.765165', '0.715296', '0.797753', '0.779141']
         : correct/total = [(822, 1140), (845, 1158), (846, 1127), (928, 1158), (827, 1134), (828, 1145), (849, 1145), (870, 1127), (945, 1136), (926, 1128), (928, 1144), (890, 1125), (834, 1152), (866, 1160), (868, 1124), (877, 1145), (883, 1154), (809, 1131), (923, 1157), (889, 1141)]
         : compromised: 0.7272, honest: 0.7738
Round 005: test acc mean=0.8046 ± 0.0329 | min=0.7214 max=0.8599
         : test loss mean=0.4803 ± 0.0501
         : individual accs = ['0.799123', '0.787565', '0.721384', '0.841105', '0.791887', '0.772926', '0.809607', '0.793256', '0.855634', '0.859929', '0.848776', '0.824889', '0.763021', '0.808621', '0.791815', '0.806987', '0.811092', '0.768347', '0.822818', '0.813322']
         : correct/total = [(911, 1140), (912, 1158), (813, 1127), (974, 1158), (898, 1134), (885, 1145), (927, 1145), (894, 1127), (972, 1136), (970, 1128), (971, 1144), (928, 1125), (879, 1152), (938, 1160), (890, 1124), (924, 1145), (936, 1154), (869, 1131), (952, 1157), (928, 1141)]
         : compromised: 0.7782, honest: 0.8112
Round 006: test acc mean=0.8313 ± 0.0261 | min=0.7630 max=0.8759
         : test loss mean=0.4134 ± 0.0365
         : individual accs = ['0.827193', '0.836788', '0.805679', '0.854922', '0.828924', '0.848035', '0.841048', '0.837622', '0.870599', '0.844858', '0.875874', '0.845333', '0.820312', '0.794828', '0.799822', '0.810480', '0.839688', '0.763042', '0.828868', '0.851884']
         : correct/total = [(943, 1140), (969, 1158), (908, 1127), (990, 1158), (940, 1134), (971, 1145), (963, 1145), (944, 1127), (989, 1136), (953, 1128), (1002, 1144), (951, 1125), (945, 1152), (922, 1160), (899, 1124), (928, 1145), (969, 1154), (863, 1131), (959, 1157), (972, 1141)]
         : compromised: 0.8066, honest: 0.8375
Round 007: test acc mean=0.8523 ± 0.0145 | min=0.8253 max=0.8760
         : test loss mean=0.3612 ± 0.0245
         : individual accs = ['0.848246', '0.867012', '0.833185', '0.866149', '0.843915', '0.875983', '0.858515', '0.848270', '0.860915', '0.875887', '0.847902', '0.869333', '0.835069', '0.856897', '0.841637', '0.825328', '0.864818', '0.831123', '0.850475', '0.845749']
         : correct/total = [(967, 1140), (1004, 1158), (939, 1127), (1003, 1158), (957, 1134), (1003, 1145), (983, 1145), (956, 1127), (978, 1136), (988, 1128), (970, 1144), (978, 1125), (962, 1152), (994, 1160), (946, 1124), (945, 1145), (998, 1154), (940, 1131), (984, 1157), (965, 1141)]
         : compromised: 0.8498, honest: 0.8530
Round 008: test acc mean=0.8678 ± 0.0101 | min=0.8488 max=0.8873
         : test loss mean=0.3251 ± 0.0144
         : individual accs = ['0.865789', '0.881693', '0.863354', '0.868739', '0.865079', '0.887336', '0.881223', '0.866903', '0.875000', '0.863475', '0.854021', '0.870222', '0.863715', '0.862931', '0.883452', '0.858515', '0.876083', '0.848806', '0.866033', '0.854514']
         : correct/total = [(987, 1140), (1021, 1158), (973, 1127), (1006, 1158), (981, 1134), (1016, 1145), (1009, 1145), (977, 1127), (994, 1136), (974, 1128), (977, 1144), (979, 1125), (995, 1152), (1001, 1160), (993, 1124), (983, 1145), (1011, 1154), (960, 1131), (1002, 1157), (975, 1141)]
         : compromised: 0.8657, honest: 0.8684
Round 009: test acc mean=0.8723 ± 0.0142 | min=0.8418 max=0.8891
         : test loss mean=0.3055 ± 0.0240
         : individual accs = ['0.883333', '0.886874', '0.842946', '0.886874', '0.865961', '0.889083', '0.881223', '0.873114', '0.883803', '0.885638', '0.875000', '0.880000', '0.869792', '0.872414', '0.870996', '0.861135', '0.880416', '0.845270', '0.841832', '0.870289']
         : correct/total = [(1007, 1140), (1027, 1158), (950, 1127), (1027, 1158), (982, 1134), (1018, 1145), (1009, 1145), (984, 1127), (1004, 1136), (999, 1128), (1001, 1144), (990, 1125), (1002, 1152), (1012, 1160), (979, 1124), (986, 1145), (1016, 1154), (956, 1131), (974, 1157), (993, 1141)]
         : compromised: 0.8691, honest: 0.8731
Round 010: test acc mean=0.8821 ± 0.0103 | min=0.8607 max=0.8963
         : test loss mean=0.2841 ± 0.0144
         : individual accs = ['0.893860', '0.891192', '0.860692', '0.890328', '0.881834', '0.882969', '0.875109', '0.881100', '0.889965', '0.896277', '0.875874', '0.892444', '0.882812', '0.893966', '0.890569', '0.867249', '0.885615', '0.874447', '0.865169', '0.870289']
         : correct/total = [(1019, 1140), (1032, 1158), (970, 1127), (1031, 1158), (1000, 1134), (1011, 1145), (1002, 1145), (993, 1127), (1011, 1136), (1011, 1128), (1002, 1144), (1004, 1125), (1017, 1152), (1037, 1160), (1001, 1124), (993, 1145), (1022, 1154), (989, 1131), (1001, 1157), (993, 1141)]
         : compromised: 0.8835, honest: 0.8817

=== FINAL RESULTS ===
Dataset: celeba, Nodes: 20, Graph: erdos, Aggregation: balance
Attack: krum, 20.0% compromised
Final accuracy - Compromised: 0.8835, Honest: 0.8817
Overall test accuracy: mean=0.8821 ± 0.0103

=== BALANCE SUMMARY ===
Node 0: acceptance=0.833
Node 1: acceptance=1.000
Node 2: acceptance=1.000
Node 3: acceptance=0.750
Node 4: acceptance=0.750
Node 5: acceptance=0.600
Node 6: acceptance=0.800
Node 7: acceptance=0.600
Node 8: acceptance=1.000
Node 9: acceptance=1.000
Node 10: acceptance=0.750
Node 11: acceptance=0.714
Node 12: acceptance=0.857
Node 13: acceptance=1.000
Node 14: acceptance=0.429
Node 15: acceptance=0.667
Node 16: acceptance=0.600
Node 17: acceptance=0.800
Node 18: acceptance=1.000
Node 19: acceptance=1.000

=== PARALLEL EXECUTION TIME (realistic for distributed system) ===
  COMMUNICATION (max across nodes):
    - Full model transfer: 0.000s (0.1%)
  COMPUTATION (max across nodes):
    - Filtering: 0.022s (67.5%)
    - Aggregation: 0.011s (32.5%)
  TOTALS:
    - Total computation: 0.032s (99.9%)
    - Total communication: 0.000s (0.1%)
    - Total parallel time: 0.032s

=== PER-NODE AVERAGE TIME ===
  - Filtering: 0.014s
  - Aggregation: 0.004s
  - Model transfer: 0.000s
  - Total per node: 0.018s

=== TOTAL COMPUTATIONAL WORK (sum across all nodes) ===
  - Total filtering: 0.286s
  - Total aggregation: 0.083s
  - Total model transfer: 0.000s
  - Grand total: 0.369s
  - Mean acceptance rate: 0.807

BALANCE Algorithm Properties:
  - Model dimension: 2,219,692
  - No compression: Full parameter comparison
  - Theoretical complexity: O(deg(i)×d)
  - Approach: Full parameter filtering + averaging
