Device: cuda
Seed: 987654321
Looking for images in: /home/student.unimelb.edu.au/mrangwala/Projects/Sketchguard/leaf/data/celeba/data/raw/img_align_celeba
Loading 1 LEAF CelebA train files...
LEAF CelebA train: 9343 users (celebrities), 177457 samples
Looking for images in: /home/student.unimelb.edu.au/mrangwala/Projects/Sketchguard/leaf/data/celeba/data/raw/img_align_celeba
Loading 1 LEAF CelebA test files...
LEAF CelebA test: 9343 users (celebrities), 22831 samples
Found 9343 train users, 9343 test users, 9343 common users
User sample counts range: 31 (max) to 4 (min)
Distributed ALL 9343 users across 20 clients
Users per client: 467 (with 3 clients getting +1 user)
Train partition sizes: [8843, 8998, 8728, 9034, 8866, 8946, 8873, 8776, 8816, 8801, 8913, 8656, 9115, 8921, 8699, 8823, 8912, 8766, 9102, 8869]
Test partition sizes: [1140, 1158, 1127, 1158, 1134, 1145, 1145, 1127, 1136, 1128, 1144, 1125, 1152, 1160, 1124, 1145, 1154, 1131, 1157, 1141]
  Client 0: 8843 train samples, 2 unique classes
  Client 1: 8998 train samples, 2 unique classes
  Client 2: 8728 train samples, 2 unique classes
  Client 3: 9034 train samples, 2 unique classes
  Client 4: 8866 train samples, 2 unique classes
  Client 5: 8946 train samples, 2 unique classes
  Client 6: 8873 train samples, 2 unique classes
  Client 7: 8776 train samples, 2 unique classes
  Client 8: 8816 train samples, 2 unique classes
  Client 9: 8801 train samples, 2 unique classes
  Client 10: 8913 train samples, 2 unique classes
  Client 11: 8656 train samples, 2 unique classes
  Client 12: 9115 train samples, 2 unique classes
  Client 13: 8921 train samples, 2 unique classes
  Client 14: 8699 train samples, 2 unique classes
  Client 15: 8823 train samples, 2 unique classes
  Client 16: 8912 train samples, 2 unique classes
  Client 17: 8766 train samples, 2 unique classes
  Client 18: 9102 train samples, 2 unique classes
  Client 19: 8869 train samples, 2 unique classes
Will sample 4500 samples per client per epoch
Graph: erdos, nodes: 20, edges: 48
Degree statistics: avg=4.80, min=2, max=7
Attack: Compromised 8/20 nodes: [1, 5, 11, 12, 13, 14, 17, 18]
Attack type: backdoor, lambda: 1.0
Backdoor target label: 0, trigger size: 8
Model variant: baseline
Model parameters: 2,219,692
UBAR ALGORITHM (Two-Stage Byzantine-resilient)
  - Model dimension: 2,219,692 parameters
  - Rho parameter: 0.6
  - Stage 1: Distance-based filtering (select 60% closest neighbors)
  - Stage 2: Performance-based selection (loss comparison)
  - Complexity: O(deg(i)×d + deg(i)×inference)
Initial test acc across nodes: mean=0.4978 ± 0.0208
Backdoor attack: Created poisoned datasets for 8 compromised nodes
Round 001: test acc mean=0.5901 ± 0.0747 | min=0.4987 max=0.7158
         : test loss mean=2060.1599 ± 2664.2414
         : individual accs = ['0.625439', '0.508636', '0.637977', '0.696028', '0.571429', '0.514410', '0.655022', '0.658385', '0.636444', '0.655142', '0.644231', '0.498667', '0.522569', '0.506897', '0.517794', '0.684716', '0.715771', '0.508400', '0.522040', '0.521472']
         : correct/total = [(713, 1140), (589, 1158), (719, 1127), (806, 1158), (648, 1134), (589, 1145), (750, 1145), (742, 1127), (723, 1136), (739, 1128), (737, 1144), (561, 1125), (602, 1152), (588, 1160), (582, 1124), (784, 1145), (826, 1154), (575, 1131), (604, 1157), (595, 1141)]
         : compromised: 0.5124, honest: 0.6418
         : ubar stats = ['Node 0: s1=0.500, s2=0.333', 'Node 1: s1=0.500, s2=1.000', 'Node 2: s1=0.600, s2=0.333']...
Round 002: test acc mean=0.6440 ± 0.1116 | min=0.4987 max=0.7862
         : test loss mean=nan ± nan
         : individual accs = ['0.737719', '0.502591', '0.679681', '0.705527', '0.735450', '0.514410', '0.734498', '0.786158', '0.757923', '0.757979', '0.753497', '0.498667', '0.515625', '0.508621', '0.516904', '0.685590', '0.727903', '0.503979', '0.521175', '0.735320']
         : correct/total = [(841, 1140), (582, 1158), (766, 1127), (817, 1158), (834, 1134), (589, 1145), (841, 1145), (886, 1127), (861, 1136), (855, 1128), (862, 1144), (561, 1125), (594, 1152), (590, 1160), (581, 1124), (785, 1145), (840, 1154), (570, 1131), (603, 1157), (839, 1141)]
         : compromised: 0.5102, honest: 0.7331
         : ubar stats = ['Node 0: s1=0.500, s2=0.333', 'Node 1: s1=0.500, s2=1.000', 'Node 2: s1=0.600, s2=0.333']...
Round 003: test acc mean=0.6926 ± 0.1481 | min=0.4987 max=0.8387
         : test loss mean=nan ± nan
         : individual accs = ['0.828947', '0.508636', '0.758651', '0.792746', '0.814815', '0.514410', '0.800873', '0.804791', '0.832746', '0.838652', '0.824301', '0.498667', '0.522569', '0.506897', '0.517794', '0.820961', '0.824957', '0.508400', '0.522040', '0.809816']
         : correct/total = [(945, 1140), (589, 1158), (855, 1127), (918, 1158), (924, 1134), (589, 1145), (917, 1145), (907, 1127), (946, 1136), (946, 1128), (943, 1144), (561, 1125), (602, 1152), (588, 1160), (582, 1124), (940, 1145), (952, 1154), (575, 1131), (604, 1157), (924, 1141)]
         : compromised: 0.5124, honest: 0.8127
         : ubar stats = ['Node 0: s1=0.500, s2=0.556', 'Node 1: s1=0.500, s2=0.778', 'Node 2: s1=0.600, s2=0.444']...
Round 004: test acc mean=0.7138 ± 0.1668 | min=0.4987 max=0.8839
         : test loss mean=nan ± nan
         : individual accs = ['0.867544', '0.508636', '0.765750', '0.824698', '0.863316', '0.514410', '0.785153', '0.870453', '0.881162', '0.883865', '0.870629', '0.498667', '0.522569', '0.506897', '0.517794', '0.855895', '0.850953', '0.508400', '0.522040', '0.856266']
         : correct/total = [(989, 1140), (589, 1158), (863, 1127), (955, 1158), (979, 1134), (589, 1145), (899, 1145), (981, 1127), (1001, 1136), (997, 1128), (996, 1144), (561, 1125), (602, 1152), (588, 1160), (582, 1124), (980, 1145), (982, 1154), (575, 1131), (604, 1157), (977, 1141)]
         : compromised: 0.5124, honest: 0.8480
         : ubar stats = ['Node 0: s1=0.500, s2=0.500', 'Node 1: s1=0.500, s2=0.667', 'Node 2: s1=0.600, s2=0.500']...
Round 005: test acc mean=0.7285 ± 0.1769 | min=0.4987 max=0.8945
         : test loss mean=nan ± nan
         : individual accs = ['0.873684', '0.508636', '0.836735', '0.880829', '0.870370', '0.514410', '0.862009', '0.870453', '0.887324', '0.894504', '0.882867', '0.498667', '0.522569', '0.506897', '0.517794', '0.852402', '0.881282', '0.508400', '0.522040', '0.878177']
         : correct/total = [(996, 1140), (589, 1158), (943, 1127), (1020, 1158), (987, 1134), (589, 1145), (987, 1145), (981, 1127), (1008, 1136), (1009, 1128), (1010, 1144), (561, 1125), (602, 1152), (588, 1160), (582, 1124), (976, 1145), (1017, 1154), (575, 1131), (604, 1157), (1002, 1141)]
         : compromised: 0.5124, honest: 0.8726
         : ubar stats = ['Node 0: s1=0.500, s2=0.600', 'Node 1: s1=0.500, s2=0.600', 'Node 2: s1=0.600, s2=0.467']...
Round 006: test acc mean=0.7322 ± 0.1800 | min=0.4987 max=0.9005
         : test loss mean=nan ± nan
         : individual accs = ['0.885965', '0.508636', '0.854481', '0.881693', '0.885362', '0.514410', '0.841921', '0.883762', '0.900528', '0.888298', '0.888986', '0.498667', '0.522569', '0.506897', '0.517794', '0.858515', '0.889948', '0.508400', '0.522040', '0.885188']
         : correct/total = [(1010, 1140), (589, 1158), (963, 1127), (1021, 1158), (1004, 1134), (589, 1145), (964, 1145), (996, 1127), (1023, 1136), (1002, 1128), (1017, 1144), (561, 1125), (602, 1152), (588, 1160), (582, 1124), (983, 1145), (1027, 1154), (575, 1131), (604, 1157), (1010, 1141)]
         : compromised: 0.5124, honest: 0.8787
         : ubar stats = ['Node 0: s1=0.500, s2=0.556', 'Node 1: s1=0.500, s2=0.556', 'Node 2: s1=0.600, s2=0.500']...
Round 007: test acc mean=0.7395 ± 0.1856 | min=0.4987 max=0.9034
         : test loss mean=nan ± nan
         : individual accs = ['0.894737', '0.508636', '0.881988', '0.900691', '0.885362', '0.514410', '0.880349', '0.896185', '0.891725', '0.903369', '0.897727', '0.498667', '0.522569', '0.506897', '0.517794', '0.868996', '0.897747', '0.508400', '0.522040', '0.891323']
         : correct/total = [(1020, 1140), (589, 1158), (994, 1127), (1043, 1158), (1004, 1134), (589, 1145), (1008, 1145), (1010, 1127), (1013, 1136), (1019, 1128), (1027, 1144), (561, 1125), (602, 1152), (588, 1160), (582, 1124), (995, 1145), (1036, 1154), (575, 1131), (604, 1157), (1017, 1141)]
         : compromised: 0.5124, honest: 0.8908
         : ubar stats = ['Node 0: s1=0.500, s2=0.571', 'Node 1: s1=0.500, s2=0.524', 'Node 2: s1=0.600, s2=0.476']...
Round 008: test acc mean=0.7364 ± 0.1842 | min=0.4987 max=0.9033
         : test loss mean=nan ± nan
         : individual accs = ['0.899123', '0.508636', '0.797693', '0.900691', '0.893298', '0.514410', '0.896070', '0.903283', '0.890845', '0.897163', '0.889860', '0.498667', '0.522569', '0.506897', '0.517794', '0.877729', '0.899480', '0.508400', '0.522040', '0.884312']
         : correct/total = [(1025, 1140), (589, 1158), (899, 1127), (1043, 1158), (1013, 1134), (589, 1145), (1026, 1145), (1018, 1127), (1012, 1136), (1012, 1128), (1018, 1144), (561, 1125), (602, 1152), (588, 1160), (582, 1124), (1005, 1145), (1038, 1154), (575, 1131), (604, 1157), (1009, 1141)]
         : compromised: 0.5124, honest: 0.8858
         : ubar stats = ['Node 0: s1=0.500, s2=0.542', 'Node 1: s1=0.500, s2=0.500', 'Node 2: s1=0.600, s2=0.458']...
Round 009: test acc mean=0.7380 ± 0.1858 | min=0.4987 max=0.9119
         : test loss mean=nan ± nan
         : individual accs = ['0.906140', '0.508636', '0.838509', '0.911917', '0.899471', '0.514410', '0.806987', '0.909494', '0.901408', '0.903369', '0.898601', '0.498667', '0.522569', '0.506897', '0.517794', '0.884716', '0.906412', '0.508400', '0.522040', '0.893076']
         : correct/total = [(1033, 1140), (589, 1158), (945, 1127), (1056, 1158), (1020, 1134), (589, 1145), (924, 1145), (1025, 1127), (1024, 1136), (1019, 1128), (1028, 1144), (561, 1125), (602, 1152), (588, 1160), (582, 1124), (1013, 1145), (1046, 1154), (575, 1131), (604, 1157), (1019, 1141)]
         : compromised: 0.5124, honest: 0.8883
         : ubar stats = ['Node 0: s1=0.500, s2=0.519', 'Node 1: s1=0.500, s2=0.481', 'Node 2: s1=0.600, s2=0.481']...
Round 010: test acc mean=0.7431 ± 0.1887 | min=0.4987 max=0.9171
         : test loss mean=nan ± nan
         : individual accs = ['0.906140', '0.508636', '0.861579', '0.917098', '0.901235', '0.514410', '0.887336', '0.905945', '0.893486', '0.910461', '0.896853', '0.498667', '0.522569', '0.506897', '0.517794', '0.882096', '0.907279', '0.508400', '0.522040', '0.892200']
         : correct/total = [(1033, 1140), (589, 1158), (971, 1127), (1062, 1158), (1022, 1134), (589, 1145), (1016, 1145), (1021, 1127), (1015, 1136), (1027, 1128), (1026, 1144), (561, 1125), (602, 1152), (588, 1160), (582, 1124), (1010, 1145), (1047, 1154), (575, 1131), (604, 1157), (1018, 1141)]
         : compromised: 0.5124, honest: 0.8968
         : ubar stats = ['Node 0: s1=0.500, s2=0.500', 'Node 1: s1=0.500, s2=0.467', 'Node 2: s1=0.600, s2=0.467']...

=== FINAL RESULTS ===
Dataset: celeba, Nodes: 20, Graph: erdos, Aggregation: ubar
Attack: backdoor, 40.0% compromised
Final accuracy - Compromised: 0.5124, Honest: 0.8968
Overall test accuracy: mean=0.7431 ± 0.1887

=== BACKDOOR ATTACK SUCCESS RATE (ASR) ===
Target label: 0
Trigger size: 8x8
Overall ASR: 0.7330 ± 0.2190
Honest nodes ASR: 0.5550 ± 0.0275
Compromised nodes ASR: 1.0000 ± 0.0000
Note: Higher ASR indicates more successful backdoor attack

=== UBAR SUMMARY ===
Node 0: stage1=0.500, stage2=0.500, overall=0.250
Node 1: stage1=0.500, stage2=0.467, overall=0.233
Node 2: stage1=0.600, stage2=0.467, overall=0.280
Node 3: stage1=0.500, stage2=0.600, overall=0.300
Node 4: stage1=0.500, stage2=0.500, overall=0.250
Node 5: stage1=0.600, stage2=0.367, overall=0.220
Node 6: stage1=0.600, stage2=0.667, overall=0.400
Node 7: stage1=0.600, stage2=0.567, overall=0.340
Node 8: stage1=0.500, stage2=1.000, overall=0.500
Node 9: stage1=0.333, stage2=1.000, overall=0.333
Node 10: stage1=0.500, stage2=0.550, overall=0.275
Node 11: stage1=0.571, stage2=0.325, overall=0.186
Node 12: stage1=0.571, stage2=0.400, overall=0.229
Node 13: stage1=0.500, stage2=0.600, overall=0.300
Node 14: stage1=0.571, stage2=0.375, overall=0.214
Node 15: stage1=0.500, stage2=0.333, overall=0.167
Node 16: stage1=0.600, stage2=0.333, overall=0.200
Node 17: stage1=0.600, stage2=0.467, overall=0.280
Node 18: stage1=0.500, stage2=0.600, overall=0.300
Node 19: stage1=0.500, stage2=1.000, overall=0.500

=== PARALLEL EXECUTION TIME (realistic for distributed system) ===
  COMMUNICATION (max across nodes):
    - Full model transfer: 0.000s (0.0%)
  COMPUTATION (max across nodes):
    - Distance computation: 0.018s (9.0%)
    - Loss computation: 0.174s (88.9%)
    - Aggregation: 0.004s (2.0%)
  TOTALS:
    - Total computation: 0.195s (100.0%)
    - Total communication: 0.000s (0.0%)
    - Total parallel time: 0.195s

=== PER-NODE AVERAGE TIME ===
  - Distance computation: 0.012s
  - Loss computation: 0.135s
  - Aggregation: 0.003s
  - Model transfer: 0.000s
  - Total per node: 0.150s

=== TOTAL COMPUTATIONAL WORK (sum across all nodes) ===
  - Total distance computation: 0.247s
  - Total loss computation: 2.704s
  - Total aggregation: 0.058s
  - Total model transfer: 0.000s
  - Grand total: 3.010s
  - Mean Stage 1 acceptance rate: 0.532
  - Mean Stage 2 acceptance rate: 0.556
  - Overall acceptance rate: 0.296

UBAR Algorithm Properties:
  - Model dimension: 2,219,692
  - Rho parameter: 0.6
  - Two-stage approach: Distance filtering + loss evaluation
  - Stage 1 selects: 60% of neighbors
  - Stage 2 uses: Training sample loss comparison
  - Theoretical complexity: O(deg(i)×d + deg(i)×inference)
  - Approach: UBAR paper implementation
