Device: cuda
Seed: 987654321
Looking for images in: /home/student.unimelb.edu.au/mrangwala/Projects/Sketchguard/leaf/data/celeba/data/raw/img_align_celeba
Loading 1 LEAF CelebA train files...
LEAF CelebA train: 9343 users (celebrities), 177457 samples
Looking for images in: /home/student.unimelb.edu.au/mrangwala/Projects/Sketchguard/leaf/data/celeba/data/raw/img_align_celeba
Loading 1 LEAF CelebA test files...
LEAF CelebA test: 9343 users (celebrities), 22831 samples
Found 9343 train users, 9343 test users, 9343 common users
User sample counts range: 31 (max) to 4 (min)
Distributed ALL 9343 users across 20 clients
Users per client: 467 (with 3 clients getting +1 user)
Train partition sizes: [8843, 8998, 8728, 9034, 8866, 8946, 8873, 8776, 8816, 8801, 8913, 8656, 9115, 8921, 8699, 8823, 8912, 8766, 9102, 8869]
Test partition sizes: [1140, 1158, 1127, 1158, 1134, 1145, 1145, 1127, 1136, 1128, 1144, 1125, 1152, 1160, 1124, 1145, 1154, 1131, 1157, 1141]
  Client 0: 8843 train samples, 2 unique classes
  Client 1: 8998 train samples, 2 unique classes
  Client 2: 8728 train samples, 2 unique classes
  Client 3: 9034 train samples, 2 unique classes
  Client 4: 8866 train samples, 2 unique classes
  Client 5: 8946 train samples, 2 unique classes
  Client 6: 8873 train samples, 2 unique classes
  Client 7: 8776 train samples, 2 unique classes
  Client 8: 8816 train samples, 2 unique classes
  Client 9: 8801 train samples, 2 unique classes
  Client 10: 8913 train samples, 2 unique classes
  Client 11: 8656 train samples, 2 unique classes
  Client 12: 9115 train samples, 2 unique classes
  Client 13: 8921 train samples, 2 unique classes
  Client 14: 8699 train samples, 2 unique classes
  Client 15: 8823 train samples, 2 unique classes
  Client 16: 8912 train samples, 2 unique classes
  Client 17: 8766 train samples, 2 unique classes
  Client 18: 9102 train samples, 2 unique classes
  Client 19: 8869 train samples, 2 unique classes
Will sample 4500 samples per client per epoch
Graph: erdos, nodes: 20, edges: 48
Degree statistics: avg=4.80, min=2, max=7
Attack: Compromised 10/20 nodes: [1, 2, 5, 11, 12, 13, 14, 15, 17, 18]
Attack type: directed_deviation, lambda: 1.0
Model variant: baseline
Model parameters: 2,219,692
UBAR ALGORITHM (Two-Stage Byzantine-resilient)
  - Model dimension: 2,219,692 parameters
  - Rho parameter: 0.5
  - Stage 1: Distance-based filtering (select 50% closest neighbors)
  - Stage 2: Performance-based selection (loss comparison)
  - Complexity: O(deg(i)×d + deg(i)×inference)
Initial test acc across nodes: mean=0.4978 ± 0.0208
Round 001: test acc mean=0.6341 ± 0.0502 | min=0.5215 max=0.7214
         : test loss mean=0.6739 ± 0.0073
         : individual accs = ['0.628070', '0.667530', '0.563443', '0.695164', '0.571429', '0.591266', '0.643668', '0.611358', '0.637324', '0.656915', '0.643357', '0.615111', '0.721354', '0.679310', '0.626335', '0.675109', '0.714905', '0.583554', '0.636128', '0.521472']
         : correct/total = [(716, 1140), (773, 1158), (635, 1127), (805, 1158), (648, 1134), (677, 1145), (737, 1145), (689, 1127), (724, 1136), (741, 1128), (736, 1144), (692, 1125), (831, 1152), (788, 1160), (704, 1124), (773, 1145), (825, 1154), (660, 1131), (736, 1157), (595, 1141)]
         : compromised: 0.6359, honest: 0.6324
         : ubar stats = ['Node 0: s1=0.500, s2=0.333', 'Node 1: s1=0.500, s2=0.667', 'Node 2: s1=0.400, s2=0.500']...
Round 002: test acc mean=0.7261 ± 0.0306 | min=0.6376 max=0.7804
         : test loss mean=0.5966 ± 0.0385
         : individual accs = ['0.736842', '0.713299', '0.689441', '0.705527', '0.690476', '0.715284', '0.757205', '0.747116', '0.757923', '0.757979', '0.735140', '0.780444', '0.710069', '0.743103', '0.713523', '0.637555', '0.726170', '0.737401', '0.732066', '0.735320']
         : correct/total = [(840, 1140), (826, 1158), (777, 1127), (817, 1158), (783, 1134), (819, 1145), (867, 1145), (842, 1127), (861, 1136), (855, 1128), (841, 1144), (878, 1125), (818, 1152), (862, 1160), (802, 1124), (730, 1145), (838, 1154), (834, 1131), (847, 1157), (839, 1141)]
         : compromised: 0.7172, honest: 0.7350
         : ubar stats = ['Node 0: s1=0.500, s2=0.333', 'Node 1: s1=0.500, s2=0.500', 'Node 2: s1=0.400, s2=0.500']...
Round 003: test acc mean=0.8169 ± 0.0242 | min=0.7444 max=0.8550
         : test loss mean=0.4497 ± 0.0642
         : individual accs = ['0.835088', '0.744387', '0.803904', '0.797064', '0.828042', '0.855022', '0.818341', '0.838509', '0.832746', '0.835993', '0.846154', '0.816000', '0.780382', '0.799138', '0.811388', '0.806987', '0.824957', '0.815208', '0.820225', '0.829097']
         : correct/total = [(952, 1140), (862, 1158), (906, 1127), (923, 1158), (939, 1134), (979, 1145), (937, 1145), (945, 1127), (946, 1136), (943, 1128), (968, 1144), (918, 1125), (899, 1152), (927, 1160), (912, 1124), (924, 1145), (952, 1154), (922, 1131), (949, 1157), (946, 1141)]
         : compromised: 0.8053, honest: 0.8286
         : ubar stats = ['Node 0: s1=0.500, s2=0.333', 'Node 1: s1=0.500, s2=0.556', 'Node 2: s1=0.400, s2=0.500']...
Round 004: test acc mean=0.8412 ± 0.0634 | min=0.6454 max=0.8839
         : test loss mean=0.3663 ± 0.0891
         : individual accs = ['0.871053', '0.668394', '0.850932', '0.851468', '0.860670', '0.880349', '0.872489', '0.874889', '0.881162', '0.883865', '0.879371', '0.869333', '0.842882', '0.831897', '0.835409', '0.851528', '0.857886', '0.645447', '0.846154', '0.869413']
         : correct/total = [(993, 1140), (774, 1158), (959, 1127), (986, 1158), (976, 1134), (1008, 1145), (999, 1145), (986, 1127), (1001, 1136), (997, 1128), (1006, 1144), (978, 1125), (971, 1152), (965, 1160), (939, 1124), (975, 1145), (990, 1154), (730, 1131), (979, 1157), (992, 1141)]
         : compromised: 0.8122, honest: 0.8702
         : ubar stats = ['Node 0: s1=0.500, s2=0.333', 'Node 1: s1=0.500, s2=0.583', 'Node 2: s1=0.400, s2=0.500']...
Round 005: test acc mean=0.8634 ± 0.0372 | min=0.7188 max=0.8972
         : test loss mean=0.3291 ± 0.0707
         : individual accs = ['0.871930', '0.847150', '0.867791', '0.886874', '0.865961', '0.819214', '0.875983', '0.862467', '0.890845', '0.897163', '0.889860', '0.877333', '0.875868', '0.868966', '0.863879', '0.718777', '0.886482', '0.860301', '0.860847', '0.879930']
         : correct/total = [(994, 1140), (981, 1158), (978, 1127), (1027, 1158), (982, 1134), (938, 1145), (1003, 1145), (972, 1127), (1012, 1136), (1012, 1128), (1018, 1144), (987, 1125), (1009, 1152), (1008, 1160), (971, 1124), (823, 1145), (1023, 1154), (973, 1131), (996, 1157), (1004, 1141)]
         : compromised: 0.8460, honest: 0.8807
         : ubar stats = ['Node 0: s1=0.500, s2=0.467', 'Node 1: s1=0.500, s2=0.667', 'Node 2: s1=0.400, s2=0.500']...
Round 006: test acc mean=0.8790 ± 0.0241 | min=0.7852 max=0.8996
         : test loss mean=0.2954 ± 0.0575
         : individual accs = ['0.884211', '0.885147', '0.860692', '0.883420', '0.880952', '0.896070', '0.890830', '0.891748', '0.899648', '0.890071', '0.893357', '0.856889', '0.881076', '0.880172', '0.894128', '0.785153', '0.889948', '0.883289', '0.867761', '0.886065']
         : correct/total = [(1008, 1140), (1025, 1158), (970, 1127), (1023, 1158), (999, 1134), (1026, 1145), (1020, 1145), (1005, 1127), (1022, 1136), (1004, 1128), (1022, 1144), (964, 1125), (1015, 1152), (1021, 1160), (1005, 1124), (899, 1145), (1027, 1154), (999, 1131), (1004, 1157), (1011, 1141)]
         : compromised: 0.8690, honest: 0.8890
         : ubar stats = ['Node 0: s1=0.500, s2=0.444', 'Node 1: s1=0.500, s2=0.667', 'Node 2: s1=0.400, s2=0.583']...
Round 007: test acc mean=0.8869 ± 0.0217 | min=0.8314 max=0.9048
         : test loss mean=0.2797 ± 0.0509
         : individual accs = ['0.898246', '0.895509', '0.831411', '0.898100', '0.880071', '0.904803', '0.898690', '0.892635', '0.890845', '0.903369', '0.903846', '0.898667', '0.889757', '0.890517', '0.900356', '0.841048', '0.901213', '0.890363', '0.839239', '0.889571']
         : correct/total = [(1024, 1140), (1037, 1158), (937, 1127), (1040, 1158), (998, 1134), (1036, 1145), (1029, 1145), (1006, 1127), (1012, 1136), (1019, 1128), (1034, 1144), (1011, 1125), (1025, 1152), (1033, 1160), (1012, 1124), (963, 1145), (1040, 1154), (1007, 1131), (971, 1157), (1015, 1141)]
         : compromised: 0.8782, honest: 0.8957
         : ubar stats = ['Node 0: s1=0.500, s2=0.429', 'Node 1: s1=0.500, s2=0.619', 'Node 2: s1=0.400, s2=0.643']...
Round 008: test acc mean=0.8854 ± 0.0274 | min=0.8048 max=0.9084
         : test loss mean=0.2729 ± 0.0583
         : individual accs = ['0.897368', '0.891192', '0.804791', '0.898964', '0.890653', '0.903057', '0.893450', '0.897959', '0.890845', '0.895390', '0.897727', '0.904000', '0.902778', '0.893103', '0.908363', '0.816594', '0.901213', '0.882405', '0.853068', '0.886065']
         : correct/total = [(1023, 1140), (1032, 1158), (907, 1127), (1041, 1158), (1010, 1134), (1034, 1145), (1023, 1145), (1012, 1127), (1012, 1136), (1010, 1128), (1027, 1144), (1017, 1125), (1040, 1152), (1036, 1160), (1021, 1124), (935, 1145), (1040, 1154), (998, 1131), (987, 1157), (1011, 1141)]
         : compromised: 0.8759, honest: 0.8950
         : ubar stats = ['Node 0: s1=0.500, s2=0.417', 'Node 1: s1=0.500, s2=0.583', 'Node 2: s1=0.400, s2=0.688']...
Round 009: test acc mean=0.8891 ± 0.0290 | min=0.8157 max=0.9147
         : test loss mean=0.2633 ± 0.0561
         : individual accs = ['0.902632', '0.896373', '0.828749', '0.913644', '0.899471', '0.903930', '0.904803', '0.899734', '0.904049', '0.902482', '0.898601', '0.914667', '0.895833', '0.905172', '0.897687', '0.815721', '0.905546', '0.880637', '0.822818', '0.889571']
         : correct/total = [(1029, 1140), (1038, 1158), (934, 1127), (1058, 1158), (1020, 1134), (1035, 1145), (1036, 1145), (1014, 1127), (1027, 1136), (1018, 1128), (1028, 1144), (1029, 1125), (1032, 1152), (1050, 1160), (1009, 1124), (934, 1145), (1045, 1154), (996, 1131), (952, 1157), (1015, 1141)]
         : compromised: 0.8762, honest: 0.9021
         : ubar stats = ['Node 0: s1=0.500, s2=0.407', 'Node 1: s1=0.500, s2=0.556', 'Node 2: s1=0.400, s2=0.722']...
Round 010: test acc mean=0.8965 ± 0.0158 | min=0.8428 max=0.9154
         : test loss mean=0.2479 ± 0.0336
         : individual accs = ['0.908772', '0.904145', '0.878438', '0.915371', '0.900353', '0.898690', '0.901310', '0.899734', '0.894366', '0.909574', '0.898601', '0.900444', '0.903646', '0.902586', '0.906584', '0.842795', '0.909879', '0.892131', '0.872947', '0.890447']
         : correct/total = [(1036, 1140), (1047, 1158), (990, 1127), (1060, 1158), (1021, 1134), (1029, 1145), (1032, 1145), (1014, 1127), (1016, 1136), (1026, 1128), (1028, 1144), (1013, 1125), (1041, 1152), (1047, 1160), (1019, 1124), (965, 1145), (1050, 1154), (1009, 1131), (1010, 1157), (1016, 1141)]
         : compromised: 0.8902, honest: 0.9028
         : ubar stats = ['Node 0: s1=0.500, s2=0.400', 'Node 1: s1=0.500, s2=0.533', 'Node 2: s1=0.400, s2=0.700']...

=== FINAL RESULTS ===
Dataset: celeba, Nodes: 20, Graph: erdos, Aggregation: ubar
Attack: directed_deviation, 50.0% compromised
Final accuracy - Compromised: 0.8902, Honest: 0.9028
Overall test accuracy: mean=0.8965 ± 0.0158

=== UBAR SUMMARY ===
Node 0: stage1=0.500, stage2=0.400, overall=0.200
Node 1: stage1=0.500, stage2=0.533, overall=0.267
Node 2: stage1=0.400, stage2=0.700, overall=0.280
Node 3: stage1=0.500, stage2=0.650, overall=0.325
Node 4: stage1=0.500, stage2=0.500, overall=0.250
Node 5: stage1=0.400, stage2=0.500, overall=0.200
Node 6: stage1=0.400, stage2=0.550, overall=0.220
Node 7: stage1=0.400, stage2=0.600, overall=0.240
Node 8: stage1=0.500, stage2=1.000, overall=0.500
Node 9: stage1=0.333, stage2=1.000, overall=0.333
Node 10: stage1=0.500, stage2=0.550, overall=0.275
Node 11: stage1=0.429, stage2=0.500, overall=0.214
Node 12: stage1=0.429, stage2=0.600, overall=0.257
Node 13: stage1=0.500, stage2=0.500, overall=0.250
Node 14: stage1=0.429, stage2=0.333, overall=0.143
Node 15: stage1=0.500, stage2=0.433, overall=0.217
Node 16: stage1=0.400, stage2=0.500, overall=0.200
Node 17: stage1=0.400, stage2=0.550, overall=0.220
Node 18: stage1=0.500, stage2=0.700, overall=0.350
Node 19: stage1=0.500, stage2=1.000, overall=0.500

=== PARALLEL EXECUTION TIME (realistic for distributed system) ===
  COMMUNICATION (max across nodes):
    - Full model transfer: 0.000s (0.0%)
  COMPUTATION (max across nodes):
    - Distance computation: 0.019s (9.6%)
    - Loss computation: 0.178s (88.5%)
    - Aggregation: 0.004s (1.9%)
  TOTALS:
    - Total computation: 0.202s (100.0%)
    - Total communication: 0.000s (0.0%)
    - Total parallel time: 0.202s

=== PER-NODE AVERAGE TIME ===
  - Distance computation: 0.013s
  - Loss computation: 0.140s
  - Aggregation: 0.003s
  - Model transfer: 0.000s
  - Total per node: 0.155s

=== TOTAL COMPUTATIONAL WORK (sum across all nodes) ===
  - Total distance computation: 0.257s
  - Total loss computation: 2.790s
  - Total aggregation: 0.059s
  - Total model transfer: 0.000s
  - Grand total: 3.107s
  - Mean Stage 1 acceptance rate: 0.451
  - Mean Stage 2 acceptance rate: 0.605
  - Overall acceptance rate: 0.273

UBAR Algorithm Properties:
  - Model dimension: 2,219,692
  - Rho parameter: 0.5
  - Two-stage approach: Distance filtering + loss evaluation
  - Stage 1 selects: 50% of neighbors
  - Stage 2 uses: Training sample loss comparison
  - Theoretical complexity: O(deg(i)×d + deg(i)×inference)
  - Approach: UBAR paper implementation
