Device: cuda
Seed: 987654321
Looking for images in: /home/student.unimelb.edu.au/mrangwala/Projects/Sketchguard/leaf/data/celeba/data/raw/img_align_celeba
Loading 1 LEAF CelebA train files...
LEAF CelebA train: 9343 users (celebrities), 177457 samples
Looking for images in: /home/student.unimelb.edu.au/mrangwala/Projects/Sketchguard/leaf/data/celeba/data/raw/img_align_celeba
Loading 1 LEAF CelebA test files...
LEAF CelebA test: 9343 users (celebrities), 22831 samples
Found 9343 train users, 9343 test users, 9343 common users
User sample counts range: 31 (max) to 4 (min)
Distributed ALL 9343 users across 20 clients
Users per client: 467 (with 3 clients getting +1 user)
Train partition sizes: [8843, 8998, 8728, 9034, 8866, 8946, 8873, 8776, 8816, 8801, 8913, 8656, 9115, 8921, 8699, 8823, 8912, 8766, 9102, 8869]
Test partition sizes: [1140, 1158, 1127, 1158, 1134, 1145, 1145, 1127, 1136, 1128, 1144, 1125, 1152, 1160, 1124, 1145, 1154, 1131, 1157, 1141]
  Client 0: 8843 train samples, 2 unique classes
  Client 1: 8998 train samples, 2 unique classes
  Client 2: 8728 train samples, 2 unique classes
  Client 3: 9034 train samples, 2 unique classes
  Client 4: 8866 train samples, 2 unique classes
  Client 5: 8946 train samples, 2 unique classes
  Client 6: 8873 train samples, 2 unique classes
  Client 7: 8776 train samples, 2 unique classes
  Client 8: 8816 train samples, 2 unique classes
  Client 9: 8801 train samples, 2 unique classes
  Client 10: 8913 train samples, 2 unique classes
  Client 11: 8656 train samples, 2 unique classes
  Client 12: 9115 train samples, 2 unique classes
  Client 13: 8921 train samples, 2 unique classes
  Client 14: 8699 train samples, 2 unique classes
  Client 15: 8823 train samples, 2 unique classes
  Client 16: 8912 train samples, 2 unique classes
  Client 17: 8766 train samples, 2 unique classes
  Client 18: 9102 train samples, 2 unique classes
  Client 19: 8869 train samples, 2 unique classes
Will sample 4500 samples per client per epoch
Graph: erdos, nodes: 20, edges: 99
Degree statistics: avg=9.90, min=7, max=14
Attack: Compromised 12/20 nodes: [1, 2, 3, 5, 8, 11, 12, 13, 14, 15, 17, 18]
Attack type: krum, lambda: 1.0
Model variant: baseline
Model parameters: 2,219,692
UBAR ALGORITHM (Two-Stage Byzantine-resilient)
  - Model dimension: 2,219,692 parameters
  - Rho parameter: 0.4
  - Stage 1: Distance-based filtering (select 40% closest neighbors)
  - Stage 2: Performance-based selection (loss comparison)
  - Complexity: O(deg(i)×d + deg(i)×inference)
Initial test acc across nodes: mean=0.4978 ± 0.0208
Round 001: test acc mean=0.6242 ± 0.0569 | min=0.5256 max=0.7222
         : test loss mean=0.6744 ± 0.0096
         : individual accs = ['0.664035', '0.672712', '0.584738', '0.701209', '0.525573', '0.551092', '0.643668', '0.594499', '0.573063', '0.664894', '0.562937', '0.614222', '0.722222', '0.631897', '0.587189', '0.707424', '0.705373', '0.583554', '0.620570', '0.573181']
         : correct/total = [(757, 1140), (779, 1158), (659, 1127), (812, 1158), (596, 1134), (631, 1145), (737, 1145), (670, 1127), (651, 1136), (750, 1128), (644, 1144), (691, 1125), (832, 1152), (733, 1160), (660, 1124), (810, 1145), (814, 1154), (660, 1131), (718, 1157), (654, 1141)]
         : compromised: 0.6292, honest: 0.6168
         : ubar stats = ['Node 0: s1=0.333, s2=0.250', 'Node 1: s1=0.400, s2=0.500', 'Node 2: s1=0.375, s2=0.333']...
Round 002: test acc mean=0.7011 ± 0.0578 | min=0.5694 max=0.7651
         : test loss mean=0.6192 ± 0.0457
         : individual accs = ['0.730702', '0.698618', '0.754215', '0.717617', '0.668430', '0.569432', '0.765066', '0.732919', '0.686620', '0.739362', '0.699301', '0.614222', '0.712674', '0.632759', '0.580961', '0.765066', '0.755633', '0.752431', '0.712187', '0.733567']
         : correct/total = [(833, 1140), (809, 1158), (850, 1127), (831, 1158), (758, 1134), (652, 1145), (876, 1145), (826, 1127), (780, 1136), (834, 1128), (800, 1144), (691, 1125), (821, 1152), (734, 1160), (653, 1124), (876, 1145), (872, 1154), (851, 1131), (824, 1157), (837, 1141)]
         : compromised: 0.6831, honest: 0.7281
         : ubar stats = ['Node 0: s1=0.333, s2=0.250', 'Node 1: s1=0.400, s2=0.625', 'Node 2: s1=0.375, s2=0.333']...
Round 003: test acc mean=0.7968 ± 0.0324 | min=0.7361 max=0.8437
         : test loss mean=0.4951 ± 0.0755
         : individual accs = ['0.842982', '0.808290', '0.828749', '0.788428', '0.800705', '0.752838', '0.843668', '0.816327', '0.749120', '0.837766', '0.785839', '0.765333', '0.736111', '0.780172', '0.772242', '0.809607', '0.841421', '0.819629', '0.768366', '0.788782']
         : correct/total = [(961, 1140), (936, 1158), (934, 1127), (913, 1158), (908, 1134), (862, 1145), (966, 1145), (920, 1127), (851, 1136), (945, 1128), (899, 1144), (861, 1125), (848, 1152), (905, 1160), (868, 1124), (927, 1145), (971, 1154), (927, 1131), (889, 1157), (900, 1141)]
         : compromised: 0.7816, honest: 0.8197
         : ubar stats = ['Node 0: s1=0.333, s2=0.250', 'Node 1: s1=0.400, s2=0.583', 'Node 2: s1=0.375, s2=0.333']...
Round 004: test acc mean=0.8502 ± 0.0130 | min=0.8222 max=0.8713
         : test loss mean=0.3649 ± 0.0458
         : individual accs = ['0.868421', '0.871330', '0.858917', '0.852332', '0.843034', '0.865502', '0.866376', '0.840284', '0.838028', '0.854610', '0.855769', '0.822222', '0.845486', '0.825000', '0.856762', '0.845415', '0.857019', '0.847922', '0.838375', '0.851008']
         : correct/total = [(990, 1140), (1009, 1158), (968, 1127), (987, 1158), (956, 1134), (991, 1145), (992, 1145), (947, 1127), (952, 1136), (964, 1128), (979, 1144), (925, 1125), (974, 1152), (957, 1160), (963, 1124), (968, 1145), (989, 1154), (959, 1131), (970, 1157), (971, 1141)]
         : compromised: 0.8473, honest: 0.8546
         : ubar stats = ['Node 0: s1=0.333, s2=0.250', 'Node 1: s1=0.400, s2=0.625', 'Node 2: s1=0.375, s2=0.333']...
Round 005: test acc mean=0.8679 ± 0.0161 | min=0.8237 max=0.8864
         : test loss mean=0.3109 ± 0.0271
         : individual accs = ['0.855263', '0.883420', '0.862467', '0.884283', '0.879189', '0.836681', '0.878603', '0.861579', '0.871479', '0.873227', '0.886364', '0.865778', '0.869792', '0.872414', '0.881673', '0.862882', '0.880416', '0.849691', '0.823682', '0.879930']
         : correct/total = [(975, 1140), (1023, 1158), (972, 1127), (1024, 1158), (997, 1134), (958, 1145), (1006, 1145), (971, 1127), (990, 1136), (985, 1128), (1014, 1144), (974, 1125), (1002, 1152), (1012, 1160), (991, 1124), (988, 1145), (1016, 1154), (961, 1131), (953, 1157), (1004, 1141)]
         : compromised: 0.8637, honest: 0.8743
         : ubar stats = ['Node 0: s1=0.333, s2=0.350', 'Node 1: s1=0.400, s2=0.600', 'Node 2: s1=0.375, s2=0.333']...
Round 006: test acc mean=0.8855 ± 0.0085 | min=0.8640 max=0.9031
         : test loss mean=0.2793 ± 0.0149
         : individual accs = ['0.891228', '0.888601', '0.881100', '0.889465', '0.883598', '0.903057', '0.879476', '0.888199', '0.889085', '0.888298', '0.894231', '0.864000', '0.875868', '0.882759', '0.890569', '0.873362', '0.896014', '0.885057', '0.878133', '0.886941']
         : correct/total = [(1016, 1140), (1029, 1158), (993, 1127), (1030, 1158), (1002, 1134), (1034, 1145), (1007, 1145), (1001, 1127), (1010, 1136), (1002, 1128), (1023, 1144), (972, 1125), (1009, 1152), (1024, 1160), (1001, 1124), (1000, 1145), (1034, 1154), (1001, 1131), (1016, 1157), (1012, 1141)]
         : compromised: 0.8834, honest: 0.8885
         : ubar stats = ['Node 0: s1=0.333, s2=0.333', 'Node 1: s1=0.400, s2=0.625', 'Node 2: s1=0.375, s2=0.333']...
Round 007: test acc mean=0.8912 ± 0.0070 | min=0.8764 max=0.9013
         : test loss mean=0.2635 ± 0.0129
         : individual accs = ['0.900000', '0.890328', '0.882875', '0.895509', '0.892416', '0.901310', '0.889956', '0.899734', '0.896127', '0.898050', '0.892483', '0.876444', '0.886285', '0.887931', '0.895018', '0.887336', '0.897747', '0.882405', '0.878997', '0.892200']
         : correct/total = [(1026, 1140), (1031, 1158), (995, 1127), (1037, 1158), (1012, 1134), (1032, 1145), (1019, 1145), (1014, 1127), (1018, 1136), (1013, 1128), (1021, 1144), (986, 1125), (1021, 1152), (1030, 1160), (1006, 1124), (1016, 1145), (1036, 1154), (998, 1131), (1017, 1157), (1018, 1141)]
         : compromised: 0.8884, honest: 0.8953
         : ubar stats = ['Node 0: s1=0.333, s2=0.321', 'Node 1: s1=0.400, s2=0.571', 'Node 2: s1=0.375, s2=0.333']...
Round 008: test acc mean=0.8940 ± 0.0080 | min=0.8806 max=0.9075
         : test loss mean=0.2584 ± 0.0158
         : individual accs = ['0.900877', '0.892919', '0.884650', '0.897237', '0.893298', '0.896943', '0.891703', '0.902396', '0.881162', '0.896277', '0.892483', '0.905778', '0.896701', '0.893966', '0.907473', '0.887336', '0.906412', '0.880637', '0.880726', '0.891323']
         : correct/total = [(1027, 1140), (1034, 1158), (997, 1127), (1039, 1158), (1013, 1134), (1027, 1145), (1021, 1145), (1017, 1127), (1001, 1136), (1011, 1128), (1021, 1144), (1019, 1125), (1033, 1152), (1037, 1160), (1020, 1124), (1016, 1145), (1046, 1154), (996, 1131), (1019, 1157), (1017, 1141)]
         : compromised: 0.8921, honest: 0.8968
         : ubar stats = ['Node 0: s1=0.333, s2=0.312', 'Node 1: s1=0.400, s2=0.531', 'Node 2: s1=0.375, s2=0.333']...
Round 009: test acc mean=0.8978 ± 0.0099 | min=0.8669 max=0.9127
         : test loss mean=0.2515 ± 0.0173
         : individual accs = ['0.902632', '0.897237', '0.884650', '0.898964', '0.907407', '0.912664', '0.900437', '0.906832', '0.899648', '0.897163', '0.898601', '0.909333', '0.901042', '0.900000', '0.903025', '0.888210', '0.898614', '0.885942', '0.866897', '0.897458']
         : correct/total = [(1029, 1140), (1039, 1158), (997, 1127), (1041, 1158), (1029, 1134), (1045, 1145), (1031, 1145), (1022, 1127), (1022, 1136), (1012, 1128), (1028, 1144), (1023, 1125), (1038, 1152), (1044, 1160), (1015, 1124), (1017, 1145), (1037, 1154), (1002, 1131), (1003, 1157), (1024, 1141)]
         : compromised: 0.8956, honest: 0.9011
         : ubar stats = ['Node 0: s1=0.333, s2=0.306', 'Node 1: s1=0.400, s2=0.500', 'Node 2: s1=0.375, s2=0.370']...
Round 010: test acc mean=0.9005 ± 0.0066 | min=0.8865 max=0.9122
         : test loss mean=0.2439 ± 0.0150
         : individual accs = ['0.904386', '0.898964', '0.894410', '0.900691', '0.905644', '0.908297', '0.896943', '0.912156', '0.898768', '0.901596', '0.903846', '0.903111', '0.901042', '0.902586', '0.908363', '0.886463', '0.906412', '0.890363', '0.888505', '0.897458']
         : correct/total = [(1031, 1140), (1041, 1158), (1008, 1127), (1043, 1158), (1027, 1134), (1040, 1145), (1027, 1145), (1028, 1127), (1021, 1136), (1017, 1128), (1034, 1144), (1016, 1125), (1038, 1152), (1047, 1160), (1021, 1124), (1015, 1145), (1046, 1154), (1007, 1131), (1028, 1157), (1024, 1141)]
         : compromised: 0.8985, honest: 0.9036
         : ubar stats = ['Node 0: s1=0.333, s2=0.350', 'Node 1: s1=0.400, s2=0.475', 'Node 2: s1=0.375, s2=0.400']...

=== FINAL RESULTS ===
Dataset: celeba, Nodes: 20, Graph: erdos, Aggregation: ubar
Attack: krum, 60.0% compromised
Final accuracy - Compromised: 0.8985, Honest: 0.9036
Overall test accuracy: mean=0.9005 ± 0.0066

=== UBAR SUMMARY ===
Node 0: stage1=0.333, stage2=0.350, overall=0.117
Node 1: stage1=0.400, stage2=0.475, overall=0.190
Node 2: stage1=0.375, stage2=0.400, overall=0.150
Node 3: stage1=0.286, stage2=0.600, overall=0.171
Node 4: stage1=0.333, stage2=0.500, overall=0.167
Node 5: stage1=0.400, stage2=0.625, overall=0.250
Node 6: stage1=0.333, stage2=0.300, overall=0.100
Node 7: stage1=0.364, stage2=0.325, overall=0.118
Node 8: stage1=0.286, stage2=0.700, overall=0.200
Node 9: stage1=0.364, stage2=0.450, overall=0.164
Node 10: stage1=0.375, stage2=0.533, overall=0.200
Node 11: stage1=0.333, stage2=0.450, overall=0.150
Node 12: stage1=0.333, stage2=0.600, overall=0.200
Node 13: stage1=0.333, stage2=0.467, overall=0.156
Node 14: stage1=0.357, stage2=0.560, overall=0.200
Node 15: stage1=0.333, stage2=0.333, overall=0.111
Node 16: stage1=0.286, stage2=0.650, overall=0.186
Node 17: stage1=0.375, stage2=0.333, overall=0.125
Node 18: stage1=0.333, stage2=0.525, overall=0.175
Node 19: stage1=0.400, stage2=0.375, overall=0.150

=== PARALLEL EXECUTION TIME (realistic for distributed system) ===
  COMMUNICATION (max across nodes):
    - Full model transfer: 0.000s (0.0%)
  COMPUTATION (max across nodes):
    - Distance computation: 0.037s (15.7%)
    - Loss computation: 0.192s (82.4%)
    - Aggregation: 0.004s (1.9%)
  TOTALS:
    - Total computation: 0.232s (100.0%)
    - Total communication: 0.000s (0.0%)
    - Total parallel time: 0.232s

=== PER-NODE AVERAGE TIME ===
  - Distance computation: 0.025s
  - Loss computation: 0.145s
  - Aggregation: 0.003s
  - Model transfer: 0.000s
  - Total per node: 0.174s

=== TOTAL COMPUTATIONAL WORK (sum across all nodes) ===
  - Total distance computation: 0.506s
  - Total loss computation: 2.908s
  - Total aggregation: 0.067s
  - Total model transfer: 0.000s
  - Grand total: 3.481s
  - Mean Stage 1 acceptance rate: 0.347
  - Mean Stage 2 acceptance rate: 0.478
  - Overall acceptance rate: 0.166

UBAR Algorithm Properties:
  - Model dimension: 2,219,692
  - Rho parameter: 0.4
  - Two-stage approach: Distance filtering + loss evaluation
  - Stage 1 selects: 40% of neighbors
  - Stage 2 uses: Training sample loss comparison
  - Theoretical complexity: O(deg(i)×d + deg(i)×inference)
  - Approach: UBAR paper implementation
