Device: cuda
Seed: 987654321
Looking for images in: /home/student.unimelb.edu.au/mrangwala/Projects/Sketchguard/leaf/data/celeba/data/raw/img_align_celeba
Loading 1 LEAF CelebA train files...
LEAF CelebA train: 9343 users (celebrities), 177457 samples
Looking for images in: /home/student.unimelb.edu.au/mrangwala/Projects/Sketchguard/leaf/data/celeba/data/raw/img_align_celeba
Loading 1 LEAF CelebA test files...
LEAF CelebA test: 9343 users (celebrities), 22831 samples
Found 9343 train users, 9343 test users, 9343 common users
User sample counts range: 31 (max) to 4 (min)
Distributed ALL 9343 users across 20 clients
Users per client: 467 (with 3 clients getting +1 user)
Train partition sizes: [8843, 8998, 8728, 9034, 8866, 8946, 8873, 8776, 8816, 8801, 8913, 8656, 9115, 8921, 8699, 8823, 8912, 8766, 9102, 8869]
Test partition sizes: [1140, 1158, 1127, 1158, 1134, 1145, 1145, 1127, 1136, 1128, 1144, 1125, 1152, 1160, 1124, 1145, 1154, 1131, 1157, 1141]
  Client 0: 8843 train samples, 2 unique classes
  Client 1: 8998 train samples, 2 unique classes
  Client 2: 8728 train samples, 2 unique classes
  Client 3: 9034 train samples, 2 unique classes
  Client 4: 8866 train samples, 2 unique classes
  Client 5: 8946 train samples, 2 unique classes
  Client 6: 8873 train samples, 2 unique classes
  Client 7: 8776 train samples, 2 unique classes
  Client 8: 8816 train samples, 2 unique classes
  Client 9: 8801 train samples, 2 unique classes
  Client 10: 8913 train samples, 2 unique classes
  Client 11: 8656 train samples, 2 unique classes
  Client 12: 9115 train samples, 2 unique classes
  Client 13: 8921 train samples, 2 unique classes
  Client 14: 8699 train samples, 2 unique classes
  Client 15: 8823 train samples, 2 unique classes
  Client 16: 8912 train samples, 2 unique classes
  Client 17: 8766 train samples, 2 unique classes
  Client 18: 9102 train samples, 2 unique classes
  Client 19: 8869 train samples, 2 unique classes
Will sample 4500 samples per client per epoch
Graph: fully, nodes: 20, edges: 190
Degree statistics: avg=19.00, min=19, max=19
Attack: Compromised 12/20 nodes: [1, 2, 3, 5, 8, 11, 12, 13, 14, 15, 17, 18]
Attack type: directed_deviation, lambda: 1.0
Model variant: baseline
Model parameters: 2,219,692
UBAR ALGORITHM (Two-Stage Byzantine-resilient)
  - Model dimension: 2,219,692 parameters
  - Rho parameter: 0.4
  - Stage 1: Distance-based filtering (select 40% closest neighbors)
  - Stage 2: Performance-based selection (loss comparison)
  - Complexity: O(deg(i)×d + deg(i)×inference)
Initial test acc across nodes: mean=0.4978 ± 0.0208
Round 001: test acc mean=0.6612 ± 0.0403 | min=0.5986 max=0.7292
         : test loss mean=0.6777 ± 0.0069
         : individual accs = ['0.683333', '0.686528', '0.608696', '0.703800', '0.608466', '0.651528', '0.605240', '0.623780', '0.598592', '0.698582', '0.688811', '0.663111', '0.729167', '0.707759', '0.601423', '0.707424', '0.668111', '0.646331', '0.685393', '0.657318']
         : correct/total = [(779, 1140), (795, 1158), (686, 1127), (815, 1158), (690, 1134), (746, 1145), (693, 1145), (703, 1127), (680, 1136), (788, 1128), (788, 1144), (746, 1125), (840, 1152), (821, 1160), (676, 1124), (810, 1145), (771, 1154), (731, 1131), (793, 1157), (750, 1141)]
         : compromised: 0.6658, honest: 0.6542
         : ubar stats = ['Node 0: s1=0.368, s2=0.143', 'Node 1: s1=0.368, s2=0.429', 'Node 2: s1=0.368, s2=0.143']...
Round 002: test acc mean=0.6690 ± 0.0640 | min=0.5222 max=0.7542
         : test loss mean=0.6427 ± 0.0358
         : individual accs = ['0.669298', '0.681347', '0.754215', '0.679620', '0.552910', '0.590393', '0.733624', '0.662822', '0.573063', '0.666667', '0.696678', '0.751111', '0.705729', '0.625862', '0.522242', '0.705677', '0.745234', '0.705570', '0.666379', '0.692375']
         : correct/total = [(763, 1140), (789, 1158), (850, 1127), (787, 1158), (627, 1134), (676, 1145), (840, 1145), (747, 1127), (651, 1136), (752, 1128), (797, 1144), (845, 1125), (813, 1152), (726, 1160), (587, 1124), (808, 1145), (860, 1154), (798, 1131), (771, 1157), (790, 1141)]
         : compromised: 0.6634, honest: 0.6775
         : ubar stats = ['Node 0: s1=0.368, s2=0.143', 'Node 1: s1=0.368, s2=0.500', 'Node 2: s1=0.368, s2=0.143']...
Round 003: test acc mean=0.7545 ± 0.0386 | min=0.6799 max=0.8111
         : test loss mean=0.5488 ± 0.0520
         : individual accs = ['0.806140', '0.759931', '0.788820', '0.758204', '0.679894', '0.731004', '0.793013', '0.739130', '0.713908', '0.781028', '0.779720', '0.792000', '0.709201', '0.710345', '0.681495', '0.750218', '0.811092', '0.777188', '0.747623', '0.779141']
         : correct/total = [(919, 1140), (880, 1158), (889, 1127), (878, 1158), (771, 1134), (837, 1145), (908, 1145), (833, 1127), (811, 1136), (881, 1128), (892, 1144), (891, 1125), (817, 1152), (824, 1160), (766, 1124), (859, 1145), (936, 1154), (879, 1131), (865, 1157), (889, 1141)]
         : compromised: 0.7433, honest: 0.7711
         : ubar stats = ['Node 0: s1=0.368, s2=0.143', 'Node 1: s1=0.368, s2=0.476', 'Node 2: s1=0.368, s2=0.190']...
Round 004: test acc mean=0.8161 ± 0.0221 | min=0.7791 max=0.8498
         : test loss mean=0.4217 ± 0.0372
         : individual accs = ['0.838596', '0.829879', '0.842946', '0.803109', '0.804233', '0.834061', '0.842795', '0.779059', '0.792254', '0.813830', '0.840909', '0.849778', '0.787326', '0.784483', '0.794484', '0.805240', '0.820624', '0.824934', '0.796889', '0.836109']
         : correct/total = [(956, 1140), (961, 1158), (950, 1127), (930, 1158), (912, 1134), (955, 1145), (965, 1145), (878, 1127), (900, 1136), (918, 1128), (962, 1144), (956, 1125), (907, 1152), (910, 1160), (893, 1124), (922, 1145), (947, 1154), (933, 1131), (922, 1157), (954, 1141)]
         : compromised: 0.8121, honest: 0.8220
         : ubar stats = ['Node 0: s1=0.368, s2=0.143', 'Node 1: s1=0.368, s2=0.429', 'Node 2: s1=0.368, s2=0.179']...
Round 005: test acc mean=0.8517 ± 0.0225 | min=0.7978 max=0.8808
         : test loss mean=0.3429 ± 0.0299
         : individual accs = ['0.821930', '0.880829', '0.861579', '0.866149', '0.846561', '0.841048', '0.875983', '0.853594', '0.859155', '0.875000', '0.874126', '0.816000', '0.846354', '0.842241', '0.858541', '0.844541', '0.880416', '0.824050', '0.797753', '0.868536']
         : correct/total = [(937, 1140), (1020, 1158), (971, 1127), (1003, 1158), (960, 1134), (963, 1145), (1003, 1145), (962, 1127), (976, 1136), (987, 1128), (1000, 1144), (918, 1125), (975, 1152), (977, 1160), (965, 1124), (967, 1145), (1016, 1154), (932, 1131), (923, 1157), (991, 1141)]
         : compromised: 0.8449, honest: 0.8620
         : ubar stats = ['Node 0: s1=0.368, s2=0.314', 'Node 1: s1=0.368, s2=0.486', 'Node 2: s1=0.368, s2=0.171']...
Round 006: test acc mean=0.8786 ± 0.0113 | min=0.8531 max=0.8978
         : test loss mean=0.2922 ± 0.0158
         : individual accs = ['0.885965', '0.879965', '0.878438', '0.884283', '0.869489', '0.897817', '0.889083', '0.880213', '0.883803', '0.889184', '0.891608', '0.883556', '0.875000', '0.874138', '0.866548', '0.857642', '0.889081', '0.864721', '0.853068', '0.878177']
         : correct/total = [(1010, 1140), (1019, 1158), (990, 1127), (1024, 1158), (986, 1134), (1028, 1145), (1018, 1145), (992, 1127), (1004, 1136), (1003, 1128), (1020, 1144), (994, 1125), (1008, 1152), (1014, 1160), (974, 1124), (982, 1145), (1026, 1154), (978, 1131), (987, 1157), (1002, 1141)]
         : compromised: 0.8749, honest: 0.8841
         : ubar stats = ['Node 0: s1=0.368, s2=0.286', 'Node 1: s1=0.368, s2=0.571', 'Node 2: s1=0.368, s2=0.167']...
Round 007: test acc mean=0.8896 ± 0.0094 | min=0.8646 max=0.9048
         : test loss mean=0.2721 ± 0.0163
         : individual accs = ['0.898246', '0.897237', '0.892635', '0.889465', '0.884480', '0.904803', '0.890830', '0.895297', '0.895246', '0.897163', '0.895979', '0.896889', '0.880208', '0.886207', '0.887011', '0.864629', '0.896014', '0.878868', '0.872947', '0.887818']
         : correct/total = [(1024, 1140), (1039, 1158), (1006, 1127), (1030, 1158), (1003, 1134), (1036, 1145), (1020, 1145), (1009, 1127), (1017, 1136), (1012, 1128), (1025, 1144), (1009, 1125), (1014, 1152), (1028, 1160), (997, 1124), (990, 1145), (1034, 1154), (994, 1131), (1010, 1157), (1013, 1141)]
         : compromised: 0.8872, honest: 0.8932
         : ubar stats = ['Node 0: s1=0.368, s2=0.286', 'Node 1: s1=0.368, s2=0.551', 'Node 2: s1=0.368, s2=0.163']...
Round 008: test acc mean=0.8926 ± 0.0089 | min=0.8715 max=0.9074
         : test loss mean=0.2625 ± 0.0161
         : individual accs = ['0.900000', '0.895509', '0.891748', '0.890328', '0.894180', '0.907424', '0.895197', '0.901508', '0.871479', '0.898936', '0.894231', '0.898667', '0.892361', '0.889655', '0.905694', '0.881223', '0.897747', '0.879752', '0.880726', '0.885188']
         : correct/total = [(1026, 1140), (1037, 1158), (1005, 1127), (1031, 1158), (1014, 1134), (1039, 1145), (1025, 1145), (1016, 1127), (990, 1136), (1014, 1128), (1023, 1144), (1011, 1125), (1028, 1152), (1032, 1160), (1018, 1124), (1009, 1145), (1036, 1154), (995, 1131), (1019, 1157), (1010, 1141)]
         : compromised: 0.8904, honest: 0.8959
         : ubar stats = ['Node 0: s1=0.368, s2=0.304', 'Node 1: s1=0.368, s2=0.536', 'Node 2: s1=0.368, s2=0.161']...
Round 009: test acc mean=0.8964 ± 0.0098 | min=0.8634 max=0.9109
         : test loss mean=0.2549 ± 0.0173
         : individual accs = ['0.905263', '0.894646', '0.889973', '0.901554', '0.904762', '0.910917', '0.895197', '0.899734', '0.903169', '0.895390', '0.895105', '0.905778', '0.898438', '0.893966', '0.902135', '0.886463', '0.900347', '0.887710', '0.863440', '0.893953']
         : correct/total = [(1032, 1140), (1036, 1158), (1003, 1127), (1044, 1158), (1026, 1134), (1043, 1145), (1025, 1145), (1014, 1127), (1026, 1136), (1010, 1128), (1024, 1144), (1019, 1125), (1035, 1152), (1037, 1160), (1014, 1124), (1015, 1145), (1039, 1154), (1004, 1131), (999, 1157), (1020, 1141)]
         : compromised: 0.8948, honest: 0.8987
         : ubar stats = ['Node 0: s1=0.368, s2=0.286', 'Node 1: s1=0.368, s2=0.492', 'Node 2: s1=0.368, s2=0.190']...
Round 010: test acc mean=0.8996 ± 0.0077 | min=0.8833 max=0.9085
         : test loss mean=0.2465 ± 0.0159
         : individual accs = ['0.907018', '0.900691', '0.897072', '0.908463', '0.899471', '0.908297', '0.896943', '0.905945', '0.897887', '0.900709', '0.902098', '0.897778', '0.905382', '0.897414', '0.908363', '0.884716', '0.906412', '0.883289', '0.883319', '0.900964']
         : correct/total = [(1034, 1140), (1043, 1158), (1011, 1127), (1052, 1158), (1020, 1134), (1040, 1145), (1027, 1145), (1021, 1127), (1020, 1136), (1016, 1128), (1032, 1144), (1010, 1125), (1043, 1152), (1041, 1160), (1021, 1124), (1013, 1145), (1046, 1154), (999, 1131), (1022, 1157), (1028, 1141)]
         : compromised: 0.8977, honest: 0.9024
         : ubar stats = ['Node 0: s1=0.368, s2=0.314', 'Node 1: s1=0.368, s2=0.457', 'Node 2: s1=0.368, s2=0.214']...

=== FINAL RESULTS ===
Dataset: celeba, Nodes: 20, Graph: fully, Aggregation: ubar
Attack: directed_deviation, 60.0% compromised
Final accuracy - Compromised: 0.8977, Honest: 0.9024
Overall test accuracy: mean=0.8996 ± 0.0077

=== UBAR SUMMARY ===
Node 0: stage1=0.368, stage2=0.314, overall=0.116
Node 1: stage1=0.368, stage2=0.457, overall=0.168
Node 2: stage1=0.368, stage2=0.214, overall=0.079
Node 3: stage1=0.368, stage2=0.271, overall=0.100
Node 4: stage1=0.368, stage2=0.429, overall=0.158
Node 5: stage1=0.368, stage2=0.443, overall=0.163
Node 6: stage1=0.368, stage2=0.200, overall=0.074
Node 7: stage1=0.368, stage2=0.586, overall=0.216
Node 8: stage1=0.368, stage2=0.386, overall=0.142
Node 9: stage1=0.368, stage2=0.414, overall=0.153
Node 10: stage1=0.368, stage2=0.329, overall=0.121
Node 11: stage1=0.368, stage2=0.186, overall=0.068
Node 12: stage1=0.368, stage2=0.600, overall=0.221
Node 13: stage1=0.368, stage2=0.543, overall=0.200
Node 14: stage1=0.368, stage2=0.614, overall=0.226
Node 15: stage1=0.368, stage2=0.186, overall=0.068
Node 16: stage1=0.368, stage2=0.286, overall=0.105
Node 17: stage1=0.368, stage2=0.186, overall=0.068
Node 18: stage1=0.368, stage2=0.414, overall=0.153
Node 19: stage1=0.368, stage2=0.400, overall=0.147

=== PARALLEL EXECUTION TIME (realistic for distributed system) ===
  COMMUNICATION (max across nodes):
    - Full model transfer: 0.000s (0.0%)
  COMPUTATION (max across nodes):
    - Distance computation: 0.050s (19.5%)
    - Loss computation: 0.203s (78.3%)
    - Aggregation: 0.006s (2.2%)
  TOTALS:
    - Total computation: 0.259s (100.0%)
    - Total communication: 0.000s (0.0%)
    - Total parallel time: 0.259s

=== PER-NODE AVERAGE TIME ===
  - Distance computation: 0.046s
  - Loss computation: 0.175s
  - Aggregation: 0.004s
  - Model transfer: 0.000s
  - Total per node: 0.225s

=== TOTAL COMPUTATIONAL WORK (sum across all nodes) ===
  - Total distance computation: 0.922s
  - Total loss computation: 3.500s
  - Total aggregation: 0.084s
  - Total model transfer: 0.000s
  - Grand total: 4.506s
  - Mean Stage 1 acceptance rate: 0.368
  - Mean Stage 2 acceptance rate: 0.373
  - Overall acceptance rate: 0.137

UBAR Algorithm Properties:
  - Model dimension: 2,219,692
  - Rho parameter: 0.4
  - Two-stage approach: Distance filtering + loss evaluation
  - Stage 1 selects: 40% of neighbors
  - Stage 2 uses: Training sample loss comparison
  - Theoretical complexity: O(deg(i)×d + deg(i)×inference)
  - Approach: UBAR paper implementation
