Device: cuda
Seed: 987654321
Looking for images in: /home/student.unimelb.edu.au/mrangwala/Projects/Sketchguard/leaf/data/celeba/data/raw/img_align_celeba
Loading 1 LEAF CelebA train files...
LEAF CelebA train: 9343 users (celebrities), 177457 samples
Looking for images in: /home/student.unimelb.edu.au/mrangwala/Projects/Sketchguard/leaf/data/celeba/data/raw/img_align_celeba
Loading 1 LEAF CelebA test files...
LEAF CelebA test: 9343 users (celebrities), 22831 samples
Found 9343 train users, 9343 test users, 9343 common users
User sample counts range: 31 (max) to 4 (min)
Distributed ALL 9343 users across 20 clients
Users per client: 467 (with 3 clients getting +1 user)
Train partition sizes: [8843, 8998, 8728, 9034, 8866, 8946, 8873, 8776, 8816, 8801, 8913, 8656, 9115, 8921, 8699, 8823, 8912, 8766, 9102, 8869]
Test partition sizes: [1140, 1158, 1127, 1158, 1134, 1145, 1145, 1127, 1136, 1128, 1144, 1125, 1152, 1160, 1124, 1145, 1154, 1131, 1157, 1141]
  Client 0: 8843 train samples, 2 unique classes
  Client 1: 8998 train samples, 2 unique classes
  Client 2: 8728 train samples, 2 unique classes
  Client 3: 9034 train samples, 2 unique classes
  Client 4: 8866 train samples, 2 unique classes
  Client 5: 8946 train samples, 2 unique classes
  Client 6: 8873 train samples, 2 unique classes
  Client 7: 8776 train samples, 2 unique classes
  Client 8: 8816 train samples, 2 unique classes
  Client 9: 8801 train samples, 2 unique classes
  Client 10: 8913 train samples, 2 unique classes
  Client 11: 8656 train samples, 2 unique classes
  Client 12: 9115 train samples, 2 unique classes
  Client 13: 8921 train samples, 2 unique classes
  Client 14: 8699 train samples, 2 unique classes
  Client 15: 8823 train samples, 2 unique classes
  Client 16: 8912 train samples, 2 unique classes
  Client 17: 8766 train samples, 2 unique classes
  Client 18: 9102 train samples, 2 unique classes
  Client 19: 8869 train samples, 2 unique classes
Will sample 4500 samples per client per epoch
Graph: erdos, nodes: 20, edges: 99
Degree statistics: avg=9.90, min=7, max=14
Attack: Compromised 4/20 nodes: [5, 12, 13, 17]
Attack type: directed_deviation, lambda: 1.0
Model variant: baseline
Model parameters: 2,219,692
UBAR ALGORITHM (Two-Stage Byzantine-resilient)
  - Model dimension: 2,219,692 parameters
  - Rho parameter: 0.8
  - Stage 1: Distance-based filtering (select 80% closest neighbors)
  - Stage 2: Performance-based selection (loss comparison)
  - Complexity: O(deg(i)×d + deg(i)×inference)
Initial test acc across nodes: mean=0.4978 ± 0.0208
Round 001: test acc mean=0.6367 ± 0.0517 | min=0.5353 max=0.7158
         : test loss mean=0.6774 ± 0.0079
         : individual accs = ['0.648246', '0.659758', '0.563443', '0.684801', '0.535273', '0.654148', '0.585153', '0.566105', '0.624120', '0.655142', '0.644231', '0.551111', '0.711806', '0.700862', '0.663701', '0.620961', '0.715771', '0.678161', '0.646500', '0.624890']
         : correct/total = [(739, 1140), (764, 1158), (635, 1127), (793, 1158), (607, 1134), (749, 1145), (670, 1145), (638, 1127), (709, 1136), (739, 1128), (737, 1144), (620, 1125), (820, 1152), (813, 1160), (746, 1124), (711, 1145), (826, 1154), (767, 1131), (748, 1157), (713, 1141)]
         : compromised: 0.6862, honest: 0.6243
         : ubar stats = ['Node 0: s1=0.750, s2=0.444', 'Node 1: s1=0.800, s2=0.875', 'Node 2: s1=0.750, s2=0.167']...
Round 002: test acc mean=0.6649 ± 0.0809 | min=0.5153 max=0.7920
         : test loss mean=0.6445 ± 0.0448
         : individual accs = ['0.673684', '0.664940', '0.577640', '0.732297', '0.522928', '0.515284', '0.636681', '0.654836', '0.731514', '0.771277', '0.687937', '0.759111', '0.716146', '0.595690', '0.544484', '0.622707', '0.792028', '0.726790', '0.738980', '0.633655']
         : correct/total = [(768, 1140), (770, 1158), (651, 1127), (848, 1158), (593, 1134), (590, 1145), (729, 1145), (738, 1127), (831, 1136), (870, 1128), (787, 1144), (854, 1125), (825, 1152), (691, 1160), (612, 1124), (713, 1145), (914, 1154), (822, 1131), (855, 1157), (723, 1141)]
         : compromised: 0.6385, honest: 0.6715
         : ubar stats = ['Node 0: s1=0.750, s2=0.611', 'Node 1: s1=0.800, s2=0.875', 'Node 2: s1=0.750, s2=0.167']...
Round 003: test acc mean=0.7409 ± 0.0724 | min=0.6050 max=0.8406
         : test loss mean=0.5612 ± 0.0954
         : individual accs = ['0.795614', '0.696028', '0.800355', '0.800518', '0.705467', '0.632314', '0.746725', '0.704525', '0.808099', '0.836879', '0.772727', '0.809778', '0.655382', '0.680172', '0.604982', '0.806987', '0.840555', '0.681698', '0.792567', '0.645925']
         : correct/total = [(907, 1140), (806, 1158), (902, 1127), (927, 1158), (800, 1134), (724, 1145), (855, 1145), (794, 1127), (918, 1136), (944, 1128), (884, 1144), (911, 1125), (755, 1152), (789, 1160), (680, 1124), (924, 1145), (970, 1154), (771, 1131), (917, 1157), (737, 1141)]
         : compromised: 0.6624, honest: 0.7605
         : ubar stats = ['Node 0: s1=0.750, s2=0.556', 'Node 1: s1=0.800, s2=0.875', 'Node 2: s1=0.750, s2=0.167']...
Round 004: test acc mean=0.8251 ± 0.0361 | min=0.7347 max=0.8723
         : test loss mean=0.4397 ± 0.0769
         : individual accs = ['0.857018', '0.780656', '0.858917', '0.858377', '0.805115', '0.795633', '0.800873', '0.830524', '0.858275', '0.872340', '0.850524', '0.863111', '0.797743', '0.778448', '0.823843', '0.842795', '0.862218', '0.734748', '0.833189', '0.798422']
         : correct/total = [(977, 1140), (904, 1158), (968, 1127), (994, 1158), (913, 1134), (911, 1145), (917, 1145), (936, 1127), (975, 1136), (984, 1128), (973, 1144), (971, 1125), (919, 1152), (903, 1160), (926, 1124), (965, 1145), (995, 1154), (831, 1131), (964, 1157), (911, 1141)]
         : compromised: 0.7766, honest: 0.8373
         : ubar stats = ['Node 0: s1=0.750, s2=0.444', 'Node 1: s1=0.800, s2=0.875', 'Node 2: s1=0.750, s2=0.167']...
Round 005: test acc mean=0.8517 ± 0.0210 | min=0.8079 max=0.8865
         : test loss mean=0.3500 ± 0.0297
         : individual accs = ['0.807895', '0.873921', '0.849157', '0.850604', '0.849206', '0.811354', '0.863755', '0.864241', '0.850352', '0.886525', '0.879371', '0.832889', '0.839410', '0.850000', '0.869217', '0.852402', '0.874350', '0.832007', '0.828868', '0.867660']
         : correct/total = [(921, 1140), (1012, 1158), (957, 1127), (985, 1158), (963, 1134), (929, 1145), (989, 1145), (974, 1127), (966, 1136), (1000, 1128), (1006, 1144), (937, 1125), (967, 1152), (986, 1160), (977, 1124), (976, 1145), (1009, 1154), (941, 1131), (959, 1157), (990, 1141)]
         : compromised: 0.8332, honest: 0.8563
         : ubar stats = ['Node 0: s1=0.750, s2=0.378', 'Node 1: s1=0.800, s2=0.775', 'Node 2: s1=0.750, s2=0.167']...
Round 006: test acc mean=0.8762 ± 0.0090 | min=0.8611 max=0.8925
         : test loss mean=0.2980 ± 0.0164
         : individual accs = ['0.879825', '0.874784', '0.867791', '0.883420', '0.865961', '0.883843', '0.875983', '0.874889', '0.883803', '0.882979', '0.892483', '0.878222', '0.866319', '0.873276', '0.884342', '0.861135', '0.890815', '0.862069', '0.865169', '0.877301']
         : correct/total = [(1003, 1140), (1013, 1158), (978, 1127), (1023, 1158), (982, 1134), (1012, 1145), (1003, 1145), (986, 1127), (1004, 1136), (996, 1128), (1021, 1144), (988, 1125), (998, 1152), (1013, 1160), (994, 1124), (986, 1145), (1028, 1154), (975, 1131), (1001, 1157), (1001, 1141)]
         : compromised: 0.8714, honest: 0.8774
         : ubar stats = ['Node 0: s1=0.750, s2=0.333', 'Node 1: s1=0.800, s2=0.812', 'Node 2: s1=0.750, s2=0.278']...
Round 007: test acc mean=0.8863 ± 0.0080 | min=0.8725 max=0.8989
         : test loss mean=0.2772 ± 0.0158
         : individual accs = ['0.888596', '0.890328', '0.874889', '0.886874', '0.880071', '0.896070', '0.889083', '0.879326', '0.890845', '0.898936', '0.896853', '0.894222', '0.875868', '0.880172', '0.887011', '0.872489', '0.891681', '0.880637', '0.876404', '0.894829']
         : correct/total = [(1013, 1140), (1031, 1158), (986, 1127), (1027, 1158), (998, 1134), (1026, 1145), (1018, 1145), (991, 1127), (1012, 1136), (1014, 1128), (1026, 1144), (1006, 1125), (1009, 1152), (1021, 1160), (997, 1124), (999, 1145), (1029, 1154), (996, 1131), (1014, 1157), (1021, 1141)]
         : compromised: 0.8832, honest: 0.8870
         : ubar stats = ['Node 0: s1=0.750, s2=0.302', 'Node 1: s1=0.800, s2=0.714', 'Node 2: s1=0.750, s2=0.262']...
Round 008: test acc mean=0.8894 ± 0.0084 | min=0.8721 max=0.9009
         : test loss mean=0.2672 ± 0.0147
         : individual accs = ['0.900877', '0.891192', '0.879326', '0.891192', '0.891534', '0.897817', '0.892576', '0.890861', '0.875880', '0.890957', '0.897727', '0.900444', '0.884549', '0.889655', '0.897687', '0.875983', '0.898614', '0.884173', '0.872083', '0.885188']
         : correct/total = [(1027, 1140), (1032, 1158), (991, 1127), (1032, 1158), (1011, 1134), (1028, 1145), (1022, 1145), (1004, 1127), (995, 1136), (1005, 1128), (1027, 1144), (1013, 1125), (1019, 1152), (1032, 1160), (1009, 1124), (1003, 1145), (1037, 1154), (1000, 1131), (1009, 1157), (1010, 1141)]
         : compromised: 0.8890, honest: 0.8895
         : ubar stats = ['Node 0: s1=0.750, s2=0.278', 'Node 1: s1=0.800, s2=0.719', 'Node 2: s1=0.750, s2=0.250']...
Round 009: test acc mean=0.8929 ± 0.0108 | min=0.8608 max=0.9049
         : test loss mean=0.2615 ± 0.0184
         : individual accs = ['0.897368', '0.893782', '0.875776', '0.897237', '0.902998', '0.903057', '0.892576', '0.882875', '0.899648', '0.892730', '0.900350', '0.904889', '0.894965', '0.893103', '0.903025', '0.879476', '0.902080', '0.885057', '0.860847', '0.895706']
         : correct/total = [(1023, 1140), (1035, 1158), (987, 1127), (1039, 1158), (1024, 1134), (1034, 1145), (1022, 1145), (995, 1127), (1022, 1136), (1007, 1128), (1030, 1144), (1018, 1125), (1031, 1152), (1036, 1160), (1015, 1124), (1007, 1145), (1041, 1154), (1001, 1131), (996, 1157), (1022, 1141)]
         : compromised: 0.8940, honest: 0.8926
         : ubar stats = ['Node 0: s1=0.750, s2=0.259', 'Node 1: s1=0.800, s2=0.750', 'Node 2: s1=0.750, s2=0.241']...
Round 010: test acc mean=0.8972 ± 0.0087 | min=0.8776 max=0.9084
         : test loss mean=0.2517 ± 0.0145
         : individual accs = ['0.907018', '0.898100', '0.877551', '0.907599', '0.907407', '0.897817', '0.893450', '0.902396', '0.898768', '0.897163', '0.903846', '0.897778', '0.903646', '0.893103', '0.908363', '0.885590', '0.901213', '0.885942', '0.880726', '0.897458']
         : correct/total = [(1034, 1140), (1040, 1158), (989, 1127), (1051, 1158), (1029, 1134), (1028, 1145), (1023, 1145), (1017, 1127), (1021, 1136), (1012, 1128), (1034, 1144), (1010, 1125), (1041, 1152), (1036, 1160), (1021, 1124), (1014, 1145), (1040, 1154), (1002, 1131), (1019, 1157), (1024, 1141)]
         : compromised: 0.8951, honest: 0.8978
         : ubar stats = ['Node 0: s1=0.750, s2=0.244', 'Node 1: s1=0.800, s2=0.688', 'Node 2: s1=0.750, s2=0.233']...

=== FINAL RESULTS ===
Dataset: celeba, Nodes: 20, Graph: erdos, Aggregation: ubar
Attack: directed_deviation, 20.0% compromised
Final accuracy - Compromised: 0.8951, Honest: 0.8978
Overall test accuracy: mean=0.8972 ± 0.0087

=== UBAR SUMMARY ===
Node 0: stage1=0.750, stage2=0.244, overall=0.183
Node 1: stage1=0.800, stage2=0.688, overall=0.550
Node 2: stage1=0.750, stage2=0.233, overall=0.175
Node 3: stage1=0.714, stage2=0.440, overall=0.314
Node 4: stage1=0.778, stage2=0.586, overall=0.456
Node 5: stage1=0.800, stage2=0.625, overall=0.500
Node 6: stage1=0.750, stage2=0.511, overall=0.383
Node 7: stage1=0.727, stage2=0.412, overall=0.300
Node 8: stage1=0.714, stage2=0.240, overall=0.171
Node 9: stage1=0.727, stage2=0.163, overall=0.118
Node 10: stage1=0.750, stage2=0.333, overall=0.250
Node 11: stage1=0.750, stage2=0.244, overall=0.183
Node 12: stage1=0.750, stage2=0.600, overall=0.450
Node 13: stage1=0.778, stage2=0.571, overall=0.444
Node 14: stage1=0.786, stage2=0.527, overall=0.414
Node 15: stage1=0.778, stage2=0.214, overall=0.167
Node 16: stage1=0.714, stage2=0.260, overall=0.186
Node 17: stage1=0.750, stage2=0.233, overall=0.175
Node 18: stage1=0.750, stage2=0.411, overall=0.308
Node 19: stage1=0.800, stage2=0.463, overall=0.370

=== PARALLEL EXECUTION TIME (realistic for distributed system) ===
  COMMUNICATION (max across nodes):
    - Full model transfer: 0.000s (0.0%)
  COMPUTATION (max across nodes):
    - Distance computation: 0.037s (14.9%)
    - Loss computation: 0.202s (82.1%)
    - Aggregation: 0.007s (3.0%)
  TOTALS:
    - Total computation: 0.246s (100.0%)
    - Total communication: 0.000s (0.0%)
    - Total parallel time: 0.246s

=== PER-NODE AVERAGE TIME ===
  - Distance computation: 0.025s
  - Loss computation: 0.160s
  - Aggregation: 0.005s
  - Model transfer: 0.000s
  - Total per node: 0.189s

=== TOTAL COMPUTATIONAL WORK (sum across all nodes) ===
  - Total distance computation: 0.499s
  - Total loss computation: 3.196s
  - Total aggregation: 0.091s
  - Total model transfer: 0.000s
  - Grand total: 3.786s
  - Mean Stage 1 acceptance rate: 0.756
  - Mean Stage 2 acceptance rate: 0.400
  - Overall acceptance rate: 0.302

UBAR Algorithm Properties:
  - Model dimension: 2,219,692
  - Rho parameter: 0.8
  - Two-stage approach: Distance filtering + loss evaluation
  - Stage 1 selects: 80% of neighbors
  - Stage 2 uses: Training sample loss comparison
  - Theoretical complexity: O(deg(i)×d + deg(i)×inference)
  - Approach: UBAR paper implementation
