Device: cuda
Seed: 987654321
Looking for images in: /home/student.unimelb.edu.au/mrangwala/Projects/Sketchguard/leaf/data/celeba/data/raw/img_align_celeba
Loading 1 LEAF CelebA train files...
LEAF CelebA train: 9343 users (celebrities), 177457 samples
Looking for images in: /home/student.unimelb.edu.au/mrangwala/Projects/Sketchguard/leaf/data/celeba/data/raw/img_align_celeba
Loading 1 LEAF CelebA test files...
LEAF CelebA test: 9343 users (celebrities), 22831 samples
Found 9343 train users, 9343 test users, 9343 common users
User sample counts range: 31 (max) to 4 (min)
Distributed ALL 9343 users across 20 clients
Users per client: 467 (with 3 clients getting +1 user)
Train partition sizes: [8843, 8998, 8728, 9034, 8866, 8946, 8873, 8776, 8816, 8801, 8913, 8656, 9115, 8921, 8699, 8823, 8912, 8766, 9102, 8869]
Test partition sizes: [1140, 1158, 1127, 1158, 1134, 1145, 1145, 1127, 1136, 1128, 1144, 1125, 1152, 1160, 1124, 1145, 1154, 1131, 1157, 1141]
  Client 0: 8843 train samples, 2 unique classes
  Client 1: 8998 train samples, 2 unique classes
  Client 2: 8728 train samples, 2 unique classes
  Client 3: 9034 train samples, 2 unique classes
  Client 4: 8866 train samples, 2 unique classes
  Client 5: 8946 train samples, 2 unique classes
  Client 6: 8873 train samples, 2 unique classes
  Client 7: 8776 train samples, 2 unique classes
  Client 8: 8816 train samples, 2 unique classes
  Client 9: 8801 train samples, 2 unique classes
  Client 10: 8913 train samples, 2 unique classes
  Client 11: 8656 train samples, 2 unique classes
  Client 12: 9115 train samples, 2 unique classes
  Client 13: 8921 train samples, 2 unique classes
  Client 14: 8699 train samples, 2 unique classes
  Client 15: 8823 train samples, 2 unique classes
  Client 16: 8912 train samples, 2 unique classes
  Client 17: 8766 train samples, 2 unique classes
  Client 18: 9102 train samples, 2 unique classes
  Client 19: 8869 train samples, 2 unique classes
Will sample 4500 samples per client per epoch
Graph: ring, nodes: 20, edges: 20
Degree statistics: avg=2.00, min=2, max=2
Attack: Compromised 4/20 nodes: [5, 12, 13, 17]
Attack type: backdoor, lambda: 1.0
Backdoor target label: 0, trigger size: 8
Model variant: baseline
Model parameters: 2,219,692
UBAR ALGORITHM (Two-Stage Byzantine-resilient)
  - Model dimension: 2,219,692 parameters
  - Rho parameter: 0.8
  - Stage 1: Distance-based filtering (select 80% closest neighbors)
  - Stage 2: Performance-based selection (loss comparison)
  - Complexity: O(deg(i)×d + deg(i)×inference)
Initial test acc across nodes: mean=0.4978 ± 0.0208
Backdoor attack: Created poisoned datasets for 4 compromised nodes
Round 001: test acc mean=0.6226 ± 0.0633 | min=0.5069 max=0.7185
         : test loss mean=772.0115 ± 1558.7210
         : individual accs = ['0.670175', '0.670121', '0.669033', '0.645078', '0.640212', '0.514410', '0.555459', '0.619343', '0.685739', '0.676418', '0.718531', '0.670222', '0.522569', '0.506897', '0.631673', '0.620961', '0.630849', '0.508400', '0.655143', '0.640666']
         : correct/total = [(764, 1140), (776, 1158), (754, 1127), (747, 1158), (726, 1134), (589, 1145), (636, 1145), (698, 1127), (779, 1136), (763, 1128), (822, 1144), (754, 1125), (602, 1152), (588, 1160), (710, 1124), (711, 1145), (728, 1154), (575, 1131), (758, 1157), (731, 1141)]
         : compromised: 0.5131, honest: 0.6500
         : ubar stats = ['Node 0: s1=0.500, s2=1.000', 'Node 1: s1=0.500, s2=1.000', 'Node 2: s1=0.500, s2=1.000']...
Round 002: test acc mean=0.7041 ± 0.0992 | min=0.5043 max=0.7858
         : test loss mean=93.5752 ± 259.6004
         : individual accs = ['0.720175', '0.730570', '0.743567', '0.737478', '0.693122', '0.510044', '0.732751', '0.767524', '0.772007', '0.776596', '0.785839', '0.752000', '0.520833', '0.504310', '0.771352', '0.772926', '0.756499', '0.506631', '0.760588', '0.767748']
         : correct/total = [(821, 1140), (846, 1158), (838, 1127), (854, 1158), (786, 1134), (584, 1145), (839, 1145), (865, 1127), (877, 1136), (876, 1128), (899, 1144), (846, 1125), (600, 1152), (585, 1160), (867, 1124), (885, 1145), (873, 1154), (573, 1131), (880, 1157), (876, 1141)]
         : compromised: 0.5105, honest: 0.7525
         : ubar stats = ['Node 0: s1=0.500, s2=1.000', 'Node 1: s1=0.500, s2=1.000', 'Node 2: s1=0.500, s2=1.000']...
Round 003: test acc mean=0.7668 ± 0.1397 | min=0.4774 max=0.8776
         : test loss mean=nan ± nan
         : individual accs = ['0.835088', '0.844560', '0.837622', '0.823834', '0.791005', '0.485590', '0.797380', '0.841171', '0.847711', '0.865248', '0.877622', '0.853333', '0.477431', '0.492241', '0.812278', '0.801747', '0.850087', '0.508400', '0.837511', '0.855390']
         : correct/total = [(952, 1140), (978, 1158), (944, 1127), (954, 1158), (897, 1134), (556, 1145), (913, 1145), (948, 1127), (963, 1136), (976, 1128), (1004, 1144), (960, 1125), (550, 1152), (571, 1160), (913, 1124), (918, 1145), (981, 1154), (575, 1131), (969, 1157), (976, 1141)]
         : compromised: 0.4909, honest: 0.8357
         : ubar stats = ['Node 0: s1=0.500, s2=1.000', 'Node 1: s1=0.500, s2=1.000', 'Node 2: s1=0.500, s2=1.000']...
Round 004: test acc mean=0.7984 ± 0.1431 | min=0.5069 max=0.8830
         : test loss mean=nan ± nan
         : individual accs = ['0.864035', '0.879965', '0.881100', '0.873057', '0.849206', '0.514410', '0.873362', '0.874002', '0.870599', '0.882979', '0.882867', '0.876444', '0.522569', '0.506897', '0.861210', '0.855895', '0.862218', '0.508400', '0.849611', '0.879930']
         : correct/total = [(985, 1140), (1019, 1158), (993, 1127), (1011, 1158), (963, 1134), (589, 1145), (1000, 1145), (985, 1127), (989, 1136), (996, 1128), (1010, 1144), (986, 1125), (602, 1152), (588, 1160), (968, 1124), (980, 1145), (995, 1154), (575, 1131), (983, 1157), (1004, 1141)]
         : compromised: 0.5131, honest: 0.8698
         : ubar stats = ['Node 0: s1=0.500, s2=1.000', 'Node 1: s1=0.500, s2=1.000', 'Node 2: s1=0.500, s2=1.000']...
Round 005: test acc mean=0.8018 ± 0.1456 | min=0.5069 max=0.9012
         : test loss mean=nan ± nan
         : individual accs = ['0.848246', '0.844560', '0.874002', '0.886010', '0.873898', '0.514410', '0.878603', '0.889086', '0.882923', '0.895390', '0.901224', '0.896000', '0.522569', '0.506897', '0.885231', '0.856769', '0.887348', '0.508400', '0.821089', '0.863278']
         : correct/total = [(967, 1140), (978, 1158), (985, 1127), (1026, 1158), (991, 1134), (589, 1145), (1006, 1145), (1002, 1127), (1003, 1136), (1010, 1128), (1031, 1144), (1008, 1125), (602, 1152), (588, 1160), (995, 1124), (981, 1145), (1024, 1154), (575, 1131), (950, 1157), (985, 1141)]
         : compromised: 0.5131, honest: 0.8740
         : ubar stats = ['Node 0: s1=0.500, s2=1.000', 'Node 1: s1=0.500, s2=1.000', 'Node 2: s1=0.500, s2=1.000']...
Round 006: test acc mean=0.8136 ± 0.1505 | min=0.5069 max=0.9016
         : test loss mean=nan ± nan
         : individual accs = ['0.892982', '0.895509', '0.888199', '0.901554', '0.897707', '0.514410', '0.899563', '0.881100', '0.880282', '0.886525', '0.891608', '0.896000', '0.522569', '0.506897', '0.886121', '0.869869', '0.890815', '0.508400', '0.872947', '0.889571']
         : correct/total = [(1018, 1140), (1037, 1158), (1001, 1127), (1044, 1158), (1018, 1134), (589, 1145), (1030, 1145), (993, 1127), (1000, 1136), (1000, 1128), (1020, 1144), (1008, 1125), (602, 1152), (588, 1160), (996, 1124), (996, 1145), (1028, 1154), (575, 1131), (1010, 1157), (1015, 1141)]
         : compromised: 0.5131, honest: 0.8888
         : ubar stats = ['Node 0: s1=0.500, s2=1.000', 'Node 1: s1=0.500, s2=1.000', 'Node 2: s1=0.500, s2=1.000']...
Round 007: test acc mean=0.8170 ± 0.1523 | min=0.5069 max=0.9102
         : test loss mean=nan ± nan
         : individual accs = ['0.882456', '0.892919', '0.893523', '0.902418', '0.889771', '0.514410', '0.895197', '0.896185', '0.883803', '0.906028', '0.902972', '0.910222', '0.522569', '0.506897', '0.892349', '0.870742', '0.895147', '0.508400', '0.877269', '0.897458']
         : correct/total = [(1006, 1140), (1034, 1158), (1007, 1127), (1045, 1158), (1009, 1134), (589, 1145), (1025, 1145), (1010, 1127), (1004, 1136), (1022, 1128), (1033, 1144), (1024, 1125), (602, 1152), (588, 1160), (1003, 1124), (997, 1145), (1033, 1154), (575, 1131), (1015, 1157), (1024, 1141)]
         : compromised: 0.5131, honest: 0.8930
         : ubar stats = ['Node 0: s1=0.500, s2=1.000', 'Node 1: s1=0.500, s2=1.000', 'Node 2: s1=0.500, s2=1.000']...
Round 008: test acc mean=0.8190 ± 0.1533 | min=0.5069 max=0.9111
         : test loss mean=nan ± nan
         : individual accs = ['0.899123', '0.898100', '0.893523', '0.906736', '0.900353', '0.514410', '0.900437', '0.892635', '0.877641', '0.895390', '0.895979', '0.911111', '0.522569', '0.506897', '0.905694', '0.882969', '0.896880', '0.508400', '0.873812', '0.898335']
         : correct/total = [(1025, 1140), (1040, 1158), (1007, 1127), (1050, 1158), (1021, 1134), (589, 1145), (1031, 1145), (1006, 1127), (997, 1136), (1010, 1128), (1025, 1144), (1025, 1125), (602, 1152), (588, 1160), (1018, 1124), (1011, 1145), (1035, 1154), (575, 1131), (1011, 1157), (1025, 1141)]
         : compromised: 0.5131, honest: 0.8955
         : ubar stats = ['Node 0: s1=0.500, s2=1.000', 'Node 1: s1=0.500, s2=1.000', 'Node 2: s1=0.500, s2=1.000']...
Round 009: test acc mean=0.8205 ± 0.1540 | min=0.5069 max=0.9102
         : test loss mean=nan ± nan
         : individual accs = ['0.900877', '0.900691', '0.895297', '0.905009', '0.902998', '0.514410', '0.903930', '0.898846', '0.889085', '0.897163', '0.899476', '0.910222', '0.522569', '0.506897', '0.908363', '0.890830', '0.897747', '0.508400', '0.872083', '0.885188']
         : correct/total = [(1027, 1140), (1043, 1158), (1009, 1127), (1048, 1158), (1024, 1134), (589, 1145), (1035, 1145), (1013, 1127), (1010, 1136), (1012, 1128), (1029, 1144), (1024, 1125), (602, 1152), (588, 1160), (1021, 1124), (1020, 1145), (1036, 1154), (575, 1131), (1009, 1157), (1010, 1141)]
         : compromised: 0.5131, honest: 0.8974
         : ubar stats = ['Node 0: s1=0.500, s2=1.000', 'Node 1: s1=0.500, s2=1.000', 'Node 2: s1=0.500, s2=1.000']...
Round 010: test acc mean=0.8221 ± 0.1548 | min=0.5069 max=0.9123
         : test loss mean=nan ± nan
         : individual accs = ['0.912281', '0.905872', '0.890861', '0.909326', '0.900353', '0.514410', '0.896070', '0.906832', '0.882042', '0.899823', '0.906469', '0.909333', '0.522569', '0.506897', '0.908363', '0.884716', '0.896880', '0.508400', '0.882455', '0.898335']
         : correct/total = [(1040, 1140), (1049, 1158), (1004, 1127), (1053, 1158), (1021, 1134), (589, 1145), (1026, 1145), (1022, 1127), (1002, 1136), (1015, 1128), (1037, 1144), (1023, 1125), (602, 1152), (588, 1160), (1021, 1124), (1013, 1145), (1035, 1154), (575, 1131), (1021, 1157), (1025, 1141)]
         : compromised: 0.5131, honest: 0.8994
         : ubar stats = ['Node 0: s1=0.500, s2=1.000', 'Node 1: s1=0.500, s2=1.000', 'Node 2: s1=0.500, s2=1.000']...

=== FINAL RESULTS ===
Dataset: celeba, Nodes: 20, Graph: ring, Aggregation: ubar
Attack: backdoor, 20.0% compromised
Final accuracy - Compromised: 0.5131, Honest: 0.8994
Overall test accuracy: mean=0.8221 ± 0.1548

=== BACKDOOR ATTACK SUCCESS RATE (ASR) ===
Target label: 0
Trigger size: 8x8
Overall ASR: 0.6324 ± 0.1854
Honest nodes ASR: 0.5405 ± 0.0274
Compromised nodes ASR: 1.0000 ± 0.0000
Note: Higher ASR indicates more successful backdoor attack

=== UBAR SUMMARY ===
Node 0: stage1=0.500, stage2=1.000, overall=0.500
Node 1: stage1=0.500, stage2=1.000, overall=0.500
Node 2: stage1=0.500, stage2=1.000, overall=0.500
Node 3: stage1=0.500, stage2=1.000, overall=0.500
Node 4: stage1=0.500, stage2=1.000, overall=0.500
Node 5: stage1=0.500, stage2=1.000, overall=0.500
Node 6: stage1=0.500, stage2=1.000, overall=0.500
Node 7: stage1=0.500, stage2=1.000, overall=0.500
Node 8: stage1=0.500, stage2=1.000, overall=0.500
Node 9: stage1=0.500, stage2=1.000, overall=0.500
Node 10: stage1=0.500, stage2=1.000, overall=0.500
Node 11: stage1=0.500, stage2=1.000, overall=0.500
Node 12: stage1=0.500, stage2=1.000, overall=0.500
Node 13: stage1=0.500, stage2=1.000, overall=0.500
Node 14: stage1=0.500, stage2=1.000, overall=0.500
Node 15: stage1=0.500, stage2=1.000, overall=0.500
Node 16: stage1=0.500, stage2=1.000, overall=0.500
Node 17: stage1=0.500, stage2=1.000, overall=0.500
Node 18: stage1=0.500, stage2=1.000, overall=0.500
Node 19: stage1=0.500, stage2=1.000, overall=0.500

=== PARALLEL EXECUTION TIME (realistic for distributed system) ===
  COMMUNICATION (max across nodes):
    - Full model transfer: 0.000s (0.0%)
  COMPUTATION (max across nodes):
    - Distance computation: 0.011s (6.1%)
    - Loss computation: 0.170s (91.4%)
    - Aggregation: 0.005s (2.5%)
  TOTALS:
    - Total computation: 0.186s (100.0%)
    - Total communication: 0.000s (0.0%)
    - Total parallel time: 0.186s

=== PER-NODE AVERAGE TIME ===
  - Distance computation: 0.006s
  - Loss computation: 0.134s
  - Aggregation: 0.003s
  - Model transfer: 0.000s
  - Total per node: 0.143s

=== TOTAL COMPUTATIONAL WORK (sum across all nodes) ===
  - Total distance computation: 0.115s
  - Total loss computation: 2.689s
  - Total aggregation: 0.058s
  - Total model transfer: 0.000s
  - Grand total: 2.861s
  - Mean Stage 1 acceptance rate: 0.500
  - Mean Stage 2 acceptance rate: 1.000
  - Overall acceptance rate: 0.500

UBAR Algorithm Properties:
  - Model dimension: 2,219,692
  - Rho parameter: 0.8
  - Two-stage approach: Distance filtering + loss evaluation
  - Stage 1 selects: 80% of neighbors
  - Stage 2 uses: Training sample loss comparison
  - Theoretical complexity: O(deg(i)×d + deg(i)×inference)
  - Approach: UBAR paper implementation
