Device: cuda
Seed: 987654321
Looking for images in: /home/student.unimelb.edu.au/mrangwala/Projects/Sketchguard/leaf/data/celeba/data/raw/img_align_celeba
Loading 1 LEAF CelebA train files...
LEAF CelebA train: 9343 users (celebrities), 177457 samples
Looking for images in: /home/student.unimelb.edu.au/mrangwala/Projects/Sketchguard/leaf/data/celeba/data/raw/img_align_celeba
Loading 1 LEAF CelebA test files...
LEAF CelebA test: 9343 users (celebrities), 22831 samples
Found 9343 train users, 9343 test users, 9343 common users
User sample counts range: 31 (max) to 4 (min)
Distributed ALL 9343 users across 20 clients
Users per client: 467 (with 3 clients getting +1 user)
Train partition sizes: [8843, 8998, 8728, 9034, 8866, 8946, 8873, 8776, 8816, 8801, 8913, 8656, 9115, 8921, 8699, 8823, 8912, 8766, 9102, 8869]
Test partition sizes: [1140, 1158, 1127, 1158, 1134, 1145, 1145, 1127, 1136, 1128, 1144, 1125, 1152, 1160, 1124, 1145, 1154, 1131, 1157, 1141]
  Client 0: 8843 train samples, 2 unique classes
  Client 1: 8998 train samples, 2 unique classes
  Client 2: 8728 train samples, 2 unique classes
  Client 3: 9034 train samples, 2 unique classes
  Client 4: 8866 train samples, 2 unique classes
  Client 5: 8946 train samples, 2 unique classes
  Client 6: 8873 train samples, 2 unique classes
  Client 7: 8776 train samples, 2 unique classes
  Client 8: 8816 train samples, 2 unique classes
  Client 9: 8801 train samples, 2 unique classes
  Client 10: 8913 train samples, 2 unique classes
  Client 11: 8656 train samples, 2 unique classes
  Client 12: 9115 train samples, 2 unique classes
  Client 13: 8921 train samples, 2 unique classes
  Client 14: 8699 train samples, 2 unique classes
  Client 15: 8823 train samples, 2 unique classes
  Client 16: 8912 train samples, 2 unique classes
  Client 17: 8766 train samples, 2 unique classes
  Client 18: 9102 train samples, 2 unique classes
  Client 19: 8869 train samples, 2 unique classes
Will sample 4500 samples per client per epoch
Graph: ring, nodes: 20, edges: 20
Degree statistics: avg=2.00, min=2, max=2
Attack: Compromised 14/20 nodes: [1, 2, 3, 5, 6, 8, 11, 12, 13, 14, 15, 17, 18, 19]
Attack type: backdoor, lambda: 1.0
Backdoor target label: 0, trigger size: 8
Model variant: baseline
Model parameters: 2,219,692
UBAR ALGORITHM (Two-Stage Byzantine-resilient)
  - Model dimension: 2,219,692 parameters
  - Rho parameter: 0.30000000000000004
  - Stage 1: Distance-based filtering (select 30% closest neighbors)
  - Stage 2: Performance-based selection (loss comparison)
  - Complexity: O(deg(i)×d + deg(i)×inference)
Initial test acc across nodes: mean=0.4978 ± 0.0208
Backdoor attack: Created poisoned datasets for 14 compromised nodes
Round 001: test acc mean=0.5361 ± 0.0560 | min=0.4933 max=0.7177
         : test loss mean=14667.0084 ± 19512.3987
         : individual accs = ['0.528947', '0.508636', '0.493345', '0.535406', '0.523810', '0.514410', '0.521397', '0.496007', '0.562500', '0.677305', '0.717657', '0.518222', '0.522569', '0.506897', '0.517794', '0.520524', '0.508666', '0.508400', '0.522040', '0.517967']
         : correct/total = [(603, 1140), (589, 1158), (556, 1127), (620, 1158), (594, 1134), (589, 1145), (597, 1145), (559, 1127), (639, 1136), (764, 1128), (821, 1144), (583, 1125), (602, 1152), (588, 1160), (582, 1124), (596, 1145), (587, 1154), (575, 1131), (604, 1157), (591, 1141)]
         : compromised: 0.5193, honest: 0.5754
         : ubar stats = ['Node 0: s1=0.500, s2=1.000', 'Node 1: s1=0.500, s2=1.000', 'Node 2: s1=0.500, s2=1.000']...
Round 002: test acc mean=0.5436 ± 0.0804 | min=0.4933 max=0.7858
         : test loss mean=nan ± nan
         : individual accs = ['0.528947', '0.508636', '0.493345', '0.528497', '0.522046', '0.514410', '0.521397', '0.503993', '0.562500', '0.776596', '0.785839', '0.497778', '0.522569', '0.506897', '0.517794', '0.517031', '0.515598', '0.508400', '0.522040', '0.517967']
         : correct/total = [(603, 1140), (589, 1158), (556, 1127), (612, 1158), (592, 1134), (589, 1145), (597, 1145), (568, 1127), (639, 1136), (876, 1128), (899, 1144), (560, 1125), (602, 1152), (588, 1160), (582, 1124), (592, 1145), (595, 1154), (575, 1131), (604, 1157), (591, 1141)]
         : compromised: 0.5171, honest: 0.6055
         : ubar stats = ['Node 0: s1=0.500, s2=1.000', 'Node 1: s1=0.500, s2=1.000', 'Node 2: s1=0.500, s2=1.000']...
Round 003: test acc mean=0.5528 ± 0.1075 | min=0.4933 max=0.8785
         : test loss mean=nan ± nan
         : individual accs = ['0.528947', '0.508636', '0.493345', '0.528497', '0.522046', '0.514410', '0.521397', '0.503993', '0.562500', '0.867021', '0.878497', '0.498667', '0.522569', '0.506897', '0.517794', '0.517031', '0.515598', '0.508400', '0.522040', '0.517967']
         : correct/total = [(603, 1140), (589, 1158), (556, 1127), (612, 1158), (592, 1134), (589, 1145), (597, 1145), (568, 1127), (639, 1136), (978, 1128), (1005, 1144), (561, 1125), (602, 1152), (588, 1160), (582, 1124), (592, 1145), (595, 1154), (575, 1131), (604, 1157), (591, 1141)]
         : compromised: 0.5172, honest: 0.6360
         : ubar stats = ['Node 0: s1=0.500, s2=1.000', 'Node 1: s1=0.500, s2=1.000', 'Node 2: s1=0.500, s2=1.000']...
Round 004: test acc mean=0.5538 ± 0.1106 | min=0.4933 max=0.8830
         : test loss mean=nan ± nan
         : individual accs = ['0.528947', '0.508636', '0.493345', '0.528497', '0.522046', '0.514410', '0.521397', '0.503993', '0.562500', '0.882979', '0.882867', '0.498667', '0.522569', '0.506897', '0.517794', '0.517031', '0.515598', '0.508400', '0.522040', '0.517967']
         : correct/total = [(603, 1140), (589, 1158), (556, 1127), (612, 1158), (592, 1134), (589, 1145), (597, 1145), (568, 1127), (639, 1136), (996, 1128), (1010, 1144), (561, 1125), (602, 1152), (588, 1160), (582, 1124), (592, 1145), (595, 1154), (575, 1131), (604, 1157), (591, 1141)]
         : compromised: 0.5172, honest: 0.6394
         : ubar stats = ['Node 0: s1=0.500, s2=1.000', 'Node 1: s1=0.500, s2=1.000', 'Node 2: s1=0.500, s2=1.000']...
Round 005: test acc mean=0.5554 ± 0.1153 | min=0.4933 max=0.9003
         : test loss mean=nan ± nan
         : individual accs = ['0.528947', '0.508636', '0.493345', '0.528497', '0.522046', '0.514410', '0.521397', '0.503993', '0.562500', '0.897163', '0.900350', '0.498667', '0.522569', '0.506897', '0.517794', '0.517031', '0.515598', '0.508400', '0.522040', '0.517967']
         : correct/total = [(603, 1140), (589, 1158), (556, 1127), (612, 1158), (592, 1134), (589, 1145), (597, 1145), (568, 1127), (639, 1136), (1012, 1128), (1030, 1144), (561, 1125), (602, 1152), (588, 1160), (582, 1124), (592, 1145), (595, 1154), (575, 1131), (604, 1157), (591, 1141)]
         : compromised: 0.5172, honest: 0.6447
         : ubar stats = ['Node 0: s1=0.500, s2=1.000', 'Node 1: s1=0.500, s2=1.000', 'Node 2: s1=0.500, s2=1.000']...
Round 006: test acc mean=0.5544 ± 0.1121 | min=0.4933 max=0.8916
         : test loss mean=nan ± nan
         : individual accs = ['0.528947', '0.508636', '0.493345', '0.528497', '0.522046', '0.514410', '0.521397', '0.503993', '0.562500', '0.884752', '0.891608', '0.498667', '0.522569', '0.506897', '0.517794', '0.517031', '0.515598', '0.508400', '0.522040', '0.517967']
         : correct/total = [(603, 1140), (589, 1158), (556, 1127), (612, 1158), (592, 1134), (589, 1145), (597, 1145), (568, 1127), (639, 1136), (998, 1128), (1020, 1144), (561, 1125), (602, 1152), (588, 1160), (582, 1124), (592, 1145), (595, 1154), (575, 1131), (604, 1157), (591, 1141)]
         : compromised: 0.5172, honest: 0.6412
         : ubar stats = ['Node 0: s1=0.500, s2=1.000', 'Node 1: s1=0.500, s2=1.000', 'Node 2: s1=0.500, s2=1.000']...
Round 007: test acc mean=0.5561 ± 0.1174 | min=0.4933 max=0.9078
         : test loss mean=nan ± nan
         : individual accs = ['0.528947', '0.508636', '0.493345', '0.528497', '0.522046', '0.514410', '0.521397', '0.503993', '0.562500', '0.907801', '0.903846', '0.498667', '0.522569', '0.506897', '0.517794', '0.517031', '0.515598', '0.508400', '0.522040', '0.517967']
         : correct/total = [(603, 1140), (589, 1158), (556, 1127), (612, 1158), (592, 1134), (589, 1145), (597, 1145), (568, 1127), (639, 1136), (1024, 1128), (1034, 1144), (561, 1125), (602, 1152), (588, 1160), (582, 1124), (592, 1145), (595, 1154), (575, 1131), (604, 1157), (591, 1141)]
         : compromised: 0.5172, honest: 0.6470
         : ubar stats = ['Node 0: s1=0.500, s2=1.000', 'Node 1: s1=0.500, s2=1.000', 'Node 2: s1=0.500, s2=1.000']...
Round 008: test acc mean=0.5551 ± 0.1144 | min=0.4933 max=0.8969
         : test loss mean=nan ± nan
         : individual accs = ['0.528947', '0.508636', '0.493345', '0.528497', '0.522046', '0.514410', '0.521397', '0.503993', '0.562500', '0.894504', '0.896853', '0.498667', '0.522569', '0.506897', '0.517794', '0.517031', '0.515598', '0.508400', '0.522040', '0.517967']
         : correct/total = [(603, 1140), (589, 1158), (556, 1127), (612, 1158), (592, 1134), (589, 1145), (597, 1145), (568, 1127), (639, 1136), (1009, 1128), (1026, 1144), (561, 1125), (602, 1152), (588, 1160), (582, 1124), (592, 1145), (595, 1154), (575, 1131), (604, 1157), (591, 1141)]
         : compromised: 0.5172, honest: 0.6437
         : ubar stats = ['Node 0: s1=0.500, s2=1.000', 'Node 1: s1=0.500, s2=1.000', 'Node 2: s1=0.500, s2=1.000']...
Round 009: test acc mean=0.5555 ± 0.1155 | min=0.4933 max=0.9012
         : test loss mean=nan ± nan
         : individual accs = ['0.528947', '0.508636', '0.493345', '0.528497', '0.522046', '0.514410', '0.521397', '0.503993', '0.562500', '0.898050', '0.901224', '0.498667', '0.522569', '0.506897', '0.517794', '0.517031', '0.515598', '0.508400', '0.522040', '0.517967']
         : correct/total = [(603, 1140), (589, 1158), (556, 1127), (612, 1158), (592, 1134), (589, 1145), (597, 1145), (568, 1127), (639, 1136), (1013, 1128), (1031, 1144), (561, 1125), (602, 1152), (588, 1160), (582, 1124), (592, 1145), (595, 1154), (575, 1131), (604, 1157), (591, 1141)]
         : compromised: 0.5172, honest: 0.6450
         : ubar stats = ['Node 0: s1=0.500, s2=1.000', 'Node 1: s1=0.500, s2=1.000', 'Node 2: s1=0.500, s2=1.000']...
Round 010: test acc mean=0.5558 ± 0.1164 | min=0.4933 max=0.9065
         : test loss mean=nan ± nan
         : individual accs = ['0.528947', '0.508636', '0.493345', '0.528497', '0.522046', '0.514410', '0.521397', '0.503993', '0.562500', '0.898936', '0.906469', '0.498667', '0.522569', '0.506897', '0.517794', '0.517031', '0.515598', '0.508400', '0.522040', '0.517967']
         : correct/total = [(603, 1140), (589, 1158), (556, 1127), (612, 1158), (592, 1134), (589, 1145), (597, 1145), (568, 1127), (639, 1136), (1014, 1128), (1037, 1144), (561, 1125), (602, 1152), (588, 1160), (582, 1124), (592, 1145), (595, 1154), (575, 1131), (604, 1157), (591, 1141)]
         : compromised: 0.5172, honest: 0.6460
         : ubar stats = ['Node 0: s1=0.500, s2=1.000', 'Node 1: s1=0.500, s2=1.000', 'Node 2: s1=0.500, s2=1.000']...

=== FINAL RESULTS ===
Dataset: celeba, Nodes: 20, Graph: ring, Aggregation: ubar
Attack: backdoor, 70.0% compromised
Final accuracy - Compromised: 0.5172, Honest: 0.6460
Overall test accuracy: mean=0.5558 ± 0.1164

=== BACKDOOR ATTACK SUCCESS RATE (ASR) ===
Target label: 0
Trigger size: 8x8
Overall ASR: 0.9535 ± 0.1396
Honest nodes ASR: 0.8449 ± 0.2194
Compromised nodes ASR: 1.0000 ± 0.0000
Note: Higher ASR indicates more successful backdoor attack

=== UBAR SUMMARY ===
Node 0: stage1=0.500, stage2=1.000, overall=0.500
Node 1: stage1=0.500, stage2=1.000, overall=0.500
Node 2: stage1=0.500, stage2=1.000, overall=0.500
Node 3: stage1=0.500, stage2=1.000, overall=0.500
Node 4: stage1=0.500, stage2=1.000, overall=0.500
Node 5: stage1=0.500, stage2=1.000, overall=0.500
Node 6: stage1=0.500, stage2=1.000, overall=0.500
Node 7: stage1=0.500, stage2=1.000, overall=0.500
Node 8: stage1=0.500, stage2=1.000, overall=0.500
Node 9: stage1=0.500, stage2=1.000, overall=0.500
Node 10: stage1=0.500, stage2=1.000, overall=0.500
Node 11: stage1=0.500, stage2=1.000, overall=0.500
Node 12: stage1=0.500, stage2=1.000, overall=0.500
Node 13: stage1=0.500, stage2=1.000, overall=0.500
Node 14: stage1=0.500, stage2=1.000, overall=0.500
Node 15: stage1=0.500, stage2=1.000, overall=0.500
Node 16: stage1=0.500, stage2=1.000, overall=0.500
Node 17: stage1=0.500, stage2=1.000, overall=0.500
Node 18: stage1=0.500, stage2=1.000, overall=0.500
Node 19: stage1=0.500, stage2=1.000, overall=0.500

=== PARALLEL EXECUTION TIME (realistic for distributed system) ===
  COMMUNICATION (max across nodes):
    - Full model transfer: 0.000s (0.0%)
  COMPUTATION (max across nodes):
    - Distance computation: 0.007s (3.9%)
    - Loss computation: 0.181s (93.9%)
    - Aggregation: 0.004s (2.2%)
  TOTALS:
    - Total computation: 0.193s (100.0%)
    - Total communication: 0.000s (0.0%)
    - Total parallel time: 0.193s

=== PER-NODE AVERAGE TIME ===
  - Distance computation: 0.006s
  - Loss computation: 0.149s
  - Aggregation: 0.003s
  - Model transfer: 0.000s
  - Total per node: 0.158s

=== TOTAL COMPUTATIONAL WORK (sum across all nodes) ===
  - Total distance computation: 0.115s
  - Total loss computation: 2.982s
  - Total aggregation: 0.057s
  - Total model transfer: 0.000s
  - Grand total: 3.154s
  - Mean Stage 1 acceptance rate: 0.500
  - Mean Stage 2 acceptance rate: 1.000
  - Overall acceptance rate: 0.500

UBAR Algorithm Properties:
  - Model dimension: 2,219,692
  - Rho parameter: 0.30000000000000004
  - Two-stage approach: Distance filtering + loss evaluation
  - Stage 1 selects: 30% of neighbors
  - Stage 2 uses: Training sample loss comparison
  - Theoretical complexity: O(deg(i)×d + deg(i)×inference)
  - Approach: UBAR paper implementation
