Device: cuda
Seed: 987654321
Looking for images in: /home/student.unimelb.edu.au/mrangwala/Projects/Sketchguard/leaf/data/celeba/data/raw/img_align_celeba
Loading 1 LEAF CelebA train files...
LEAF CelebA train: 9343 users (celebrities), 177457 samples
Looking for images in: /home/student.unimelb.edu.au/mrangwala/Projects/Sketchguard/leaf/data/celeba/data/raw/img_align_celeba
Loading 1 LEAF CelebA test files...
LEAF CelebA test: 9343 users (celebrities), 22831 samples
Found 9343 train users, 9343 test users, 9343 common users
User sample counts range: 31 (max) to 4 (min)
Distributed ALL 9343 users across 20 clients
Users per client: 467 (with 3 clients getting +1 user)
Train partition sizes: [8843, 8998, 8728, 9034, 8866, 8946, 8873, 8776, 8816, 8801, 8913, 8656, 9115, 8921, 8699, 8823, 8912, 8766, 9102, 8869]
Test partition sizes: [1140, 1158, 1127, 1158, 1134, 1145, 1145, 1127, 1136, 1128, 1144, 1125, 1152, 1160, 1124, 1145, 1154, 1131, 1157, 1141]
  Client 0: 8843 train samples, 2 unique classes
  Client 1: 8998 train samples, 2 unique classes
  Client 2: 8728 train samples, 2 unique classes
  Client 3: 9034 train samples, 2 unique classes
  Client 4: 8866 train samples, 2 unique classes
  Client 5: 8946 train samples, 2 unique classes
  Client 6: 8873 train samples, 2 unique classes
  Client 7: 8776 train samples, 2 unique classes
  Client 8: 8816 train samples, 2 unique classes
  Client 9: 8801 train samples, 2 unique classes
  Client 10: 8913 train samples, 2 unique classes
  Client 11: 8656 train samples, 2 unique classes
  Client 12: 9115 train samples, 2 unique classes
  Client 13: 8921 train samples, 2 unique classes
  Client 14: 8699 train samples, 2 unique classes
  Client 15: 8823 train samples, 2 unique classes
  Client 16: 8912 train samples, 2 unique classes
  Client 17: 8766 train samples, 2 unique classes
  Client 18: 9102 train samples, 2 unique classes
  Client 19: 8869 train samples, 2 unique classes
Will sample 4500 samples per client per epoch
Graph: fully, nodes: 20, edges: 190
Degree statistics: avg=19.00, min=19, max=19
Attack: Compromised 10/20 nodes: [1, 2, 5, 11, 12, 13, 14, 15, 17, 18]
Attack type: directed_deviation, lambda: 1.0
Model variant: baseline
Model parameters: 2,219,692
UBAR ALGORITHM (Two-Stage Byzantine-resilient)
  - Model dimension: 2,219,692 parameters
  - Rho parameter: 0.5
  - Stage 1: Distance-based filtering (select 50% closest neighbors)
  - Stage 2: Performance-based selection (loss comparison)
  - Complexity: O(deg(i)×d + deg(i)×inference)
Initial test acc across nodes: mean=0.4978 ± 0.0208
Round 001: test acc mean=0.6496 ± 0.0481 | min=0.5697 max=0.7149
         : test loss mean=0.6765 ± 0.0084
         : individual accs = ['0.628070', '0.667530', '0.608696', '0.620898', '0.597884', '0.657642', '0.699563', '0.623780', '0.573944', '0.699468', '0.686189', '0.615111', '0.712674', '0.698276', '0.640569', '0.709170', '0.714905', '0.583554', '0.685393', '0.569676']
         : correct/total = [(716, 1140), (773, 1158), (686, 1127), (719, 1158), (678, 1134), (753, 1145), (801, 1145), (703, 1127), (652, 1136), (789, 1128), (785, 1144), (692, 1125), (821, 1152), (810, 1160), (720, 1124), (812, 1145), (825, 1154), (660, 1131), (793, 1157), (650, 1141)]
         : compromised: 0.6579, honest: 0.6414
         : ubar stats = ['Node 0: s1=0.474, s2=0.111', 'Node 1: s1=0.474, s2=0.667', 'Node 2: s1=0.474, s2=0.111']...
Round 002: test acc mean=0.6717 ± 0.0672 | min=0.5196 max=0.7617
         : test loss mean=0.6449 ± 0.0431
         : individual accs = ['0.698246', '0.669257', '0.761313', '0.702073', '0.538801', '0.601747', '0.607860', '0.654836', '0.639965', '0.679965', '0.711538', '0.741333', '0.703125', '0.599138', '0.519573', '0.681223', '0.761698', '0.691424', '0.739844', '0.730938']
         : correct/total = [(796, 1140), (775, 1158), (858, 1127), (813, 1158), (611, 1134), (689, 1145), (696, 1145), (738, 1127), (727, 1136), (767, 1128), (814, 1144), (834, 1125), (810, 1152), (695, 1160), (584, 1124), (780, 1145), (879, 1154), (782, 1131), (856, 1157), (834, 1141)]
         : compromised: 0.6708, honest: 0.6726
         : ubar stats = ['Node 0: s1=0.474, s2=0.111', 'Node 1: s1=0.474, s2=0.611', 'Node 2: s1=0.474, s2=0.111']...
Round 003: test acc mean=0.7277 ± 0.0547 | min=0.6263 max=0.7924
         : test loss mean=0.5898 ± 0.0514
         : individual accs = ['0.626316', '0.736615', '0.792369', '0.737478', '0.646384', '0.728384', '0.773799', '0.690328', '0.745599', '0.742908', '0.765734', '0.790222', '0.683160', '0.717241', '0.643238', '0.770306', '0.788562', '0.778073', '0.770095', '0.627520']
         : correct/total = [(714, 1140), (853, 1158), (893, 1127), (854, 1158), (733, 1134), (834, 1145), (886, 1145), (778, 1127), (847, 1136), (838, 1128), (876, 1144), (889, 1125), (787, 1152), (832, 1160), (723, 1124), (882, 1145), (910, 1154), (880, 1131), (891, 1157), (716, 1141)]
         : compromised: 0.7410, honest: 0.7145
         : ubar stats = ['Node 0: s1=0.474, s2=0.111', 'Node 1: s1=0.474, s2=0.630', 'Node 2: s1=0.474, s2=0.111']...
Round 004: test acc mean=0.8090 ± 0.0235 | min=0.7534 max=0.8400
         : test loss mean=0.4603 ± 0.0370
         : individual accs = ['0.823684', '0.810017', '0.838509', '0.812608', '0.790123', '0.821834', '0.823581', '0.779059', '0.835387', '0.781028', '0.840035', '0.819556', '0.784722', '0.753448', '0.786477', '0.798253', '0.824090', '0.823165', '0.795160', '0.838738']
         : correct/total = [(939, 1140), (938, 1158), (945, 1127), (941, 1158), (896, 1134), (941, 1145), (943, 1145), (878, 1127), (949, 1136), (881, 1128), (961, 1144), (922, 1125), (904, 1152), (874, 1160), (884, 1124), (914, 1145), (951, 1154), (931, 1131), (920, 1157), (957, 1141)]
         : compromised: 0.8031, honest: 0.8148
         : ubar stats = ['Node 0: s1=0.474, s2=0.167', 'Node 1: s1=0.474, s2=0.639', 'Node 2: s1=0.474, s2=0.111']...
Round 005: test acc mean=0.8472 ± 0.0199 | min=0.7986 max=0.8759
         : test loss mean=0.3538 ± 0.0292
         : individual accs = ['0.842982', '0.871330', '0.842059', '0.860967', '0.843034', '0.818341', '0.868122', '0.842946', '0.859155', '0.871454', '0.875874', '0.839111', '0.828993', '0.824138', '0.842527', '0.844541', '0.868284', '0.834660', '0.798617', '0.865907']
         : correct/total = [(961, 1140), (1009, 1158), (949, 1127), (997, 1158), (956, 1134), (937, 1145), (994, 1145), (950, 1127), (976, 1136), (983, 1128), (1002, 1144), (944, 1125), (955, 1152), (956, 1160), (947, 1124), (967, 1145), (1002, 1154), (944, 1131), (924, 1157), (988, 1141)]
         : compromised: 0.8344, honest: 0.8599
         : ubar stats = ['Node 0: s1=0.474, s2=0.333', 'Node 1: s1=0.474, s2=0.622', 'Node 2: s1=0.474, s2=0.133']...
Round 006: test acc mean=0.8756 ± 0.0115 | min=0.8470 max=0.8943
         : test loss mean=0.2952 ± 0.0151
         : individual accs = ['0.873684', '0.882556', '0.876664', '0.887737', '0.856261', '0.894323', '0.882969', '0.866903', '0.878521', '0.881206', '0.890734', '0.873778', '0.867188', '0.878448', '0.870107', '0.862009', '0.888215', '0.872679', '0.847018', '0.881683']
         : correct/total = [(996, 1140), (1022, 1158), (988, 1127), (1028, 1158), (971, 1134), (1024, 1145), (1011, 1145), (977, 1127), (998, 1136), (994, 1128), (1019, 1144), (983, 1125), (999, 1152), (1019, 1160), (978, 1124), (987, 1145), (1025, 1154), (987, 1131), (980, 1157), (1006, 1141)]
         : compromised: 0.8725, honest: 0.8788
         : ubar stats = ['Node 0: s1=0.474, s2=0.296', 'Node 1: s1=0.474, s2=0.648', 'Node 2: s1=0.474, s2=0.222']...
Round 007: test acc mean=0.8874 ± 0.0091 | min=0.8638 max=0.8969
         : test loss mean=0.2753 ± 0.0176
         : individual accs = ['0.894737', '0.896373', '0.884650', '0.886874', '0.880952', '0.896943', '0.889083', '0.895297', '0.890845', '0.884752', '0.892483', '0.890667', '0.885417', '0.887931', '0.895907', '0.863755', '0.891681', '0.881521', '0.864304', '0.893953']
         : correct/total = [(1020, 1140), (1038, 1158), (997, 1127), (1027, 1158), (999, 1134), (1027, 1145), (1018, 1145), (1009, 1127), (1012, 1136), (998, 1128), (1021, 1144), (1002, 1125), (1020, 1152), (1030, 1160), (1007, 1124), (989, 1145), (1029, 1154), (997, 1131), (1000, 1157), (1020, 1141)]
         : compromised: 0.8847, honest: 0.8901
         : ubar stats = ['Node 0: s1=0.474, s2=0.349', 'Node 1: s1=0.474, s2=0.667', 'Node 2: s1=0.474, s2=0.254']...
Round 008: test acc mean=0.8882 ± 0.0093 | min=0.8716 max=0.9022
         : test loss mean=0.2694 ± 0.0153
         : individual accs = ['0.892105', '0.893782', '0.881100', '0.886874', '0.891534', '0.902183', '0.879476', '0.900621', '0.881162', '0.896277', '0.887238', '0.896000', '0.886285', '0.871552', '0.900356', '0.872489', '0.896880', '0.879752', '0.874676', '0.893076']
         : correct/total = [(1017, 1140), (1035, 1158), (993, 1127), (1027, 1158), (1011, 1134), (1033, 1145), (1007, 1145), (1015, 1127), (1001, 1136), (1011, 1128), (1015, 1144), (1008, 1125), (1021, 1152), (1011, 1160), (1012, 1124), (999, 1145), (1035, 1154), (995, 1131), (1012, 1157), (1019, 1141)]
         : compromised: 0.8858, honest: 0.8905
         : ubar stats = ['Node 0: s1=0.474, s2=0.319', 'Node 1: s1=0.474, s2=0.653', 'Node 2: s1=0.474, s2=0.333']...
Round 009: test acc mean=0.8933 ± 0.0108 | min=0.8583 max=0.9114
         : test loss mean=0.2582 ± 0.0191
         : individual accs = ['0.911404', '0.892919', '0.881988', '0.902418', '0.895062', '0.909170', '0.896943', '0.898846', '0.893486', '0.897163', '0.895105', '0.893333', '0.890625', '0.894828', '0.898577', '0.882096', '0.895147', '0.885057', '0.858254', '0.893076']
         : correct/total = [(1039, 1140), (1034, 1158), (994, 1127), (1045, 1158), (1015, 1134), (1041, 1145), (1027, 1145), (1013, 1127), (1015, 1136), (1012, 1128), (1024, 1144), (1005, 1125), (1026, 1152), (1038, 1160), (1010, 1124), (1010, 1145), (1033, 1154), (1001, 1131), (993, 1157), (1019, 1141)]
         : compromised: 0.8887, honest: 0.8979
         : ubar stats = ['Node 0: s1=0.474, s2=0.296', 'Node 1: s1=0.474, s2=0.630', 'Node 2: s1=0.474, s2=0.358']...
Round 010: test acc mean=0.8987 ± 0.0087 | min=0.8747 max=0.9111
         : test loss mean=0.2497 ± 0.0167
         : individual accs = ['0.910526', '0.900691', '0.889086', '0.911054', '0.897707', '0.908297', '0.896070', '0.904170', '0.892606', '0.903369', '0.901224', '0.902222', '0.899306', '0.900862', '0.902135', '0.884716', '0.905546', '0.890363', '0.874676', '0.900088']
         : correct/total = [(1038, 1140), (1043, 1158), (1002, 1127), (1055, 1158), (1018, 1134), (1040, 1145), (1026, 1145), (1019, 1127), (1014, 1136), (1019, 1128), (1031, 1144), (1015, 1125), (1036, 1152), (1045, 1160), (1014, 1124), (1013, 1145), (1045, 1154), (1007, 1131), (1012, 1157), (1027, 1141)]
         : compromised: 0.8952, honest: 0.9022
         : ubar stats = ['Node 0: s1=0.474, s2=0.278', 'Node 1: s1=0.474, s2=0.578', 'Node 2: s1=0.474, s2=0.344']...

=== FINAL RESULTS ===
Dataset: celeba, Nodes: 20, Graph: fully, Aggregation: ubar
Attack: directed_deviation, 50.0% compromised
Final accuracy - Compromised: 0.8952, Honest: 0.9022
Overall test accuracy: mean=0.8987 ± 0.0087

=== UBAR SUMMARY ===
Node 0: stage1=0.474, stage2=0.278, overall=0.132
Node 1: stage1=0.474, stage2=0.578, overall=0.274
Node 2: stage1=0.474, stage2=0.344, overall=0.163
Node 3: stage1=0.474, stage2=0.422, overall=0.200
Node 4: stage1=0.474, stage2=0.578, overall=0.274
Node 5: stage1=0.474, stage2=0.456, overall=0.216
Node 6: stage1=0.474, stage2=0.289, overall=0.137
Node 7: stage1=0.474, stage2=0.633, overall=0.300
Node 8: stage1=0.474, stage2=0.344, overall=0.163
Node 9: stage1=0.474, stage2=0.500, overall=0.237
Node 10: stage1=0.474, stage2=0.344, overall=0.163
Node 11: stage1=0.474, stage2=0.256, overall=0.121
Node 12: stage1=0.474, stage2=0.644, overall=0.305
Node 13: stage1=0.474, stage2=0.544, overall=0.258
Node 14: stage1=0.474, stage2=0.500, overall=0.237
Node 15: stage1=0.474, stage2=0.222, overall=0.105
Node 16: stage1=0.474, stage2=0.244, overall=0.116
Node 17: stage1=0.474, stage2=0.189, overall=0.089
Node 18: stage1=0.474, stage2=0.356, overall=0.168
Node 19: stage1=0.474, stage2=0.278, overall=0.132

=== PARALLEL EXECUTION TIME (realistic for distributed system) ===
  COMMUNICATION (max across nodes):
    - Full model transfer: 0.000s (0.0%)
  COMPUTATION (max across nodes):
    - Distance computation: 0.051s (19.0%)
    - Loss computation: 0.211s (78.5%)
    - Aggregation: 0.007s (2.6%)
  TOTALS:
    - Total computation: 0.269s (100.0%)
    - Total communication: 0.000s (0.0%)
    - Total parallel time: 0.269s

=== PER-NODE AVERAGE TIME ===
  - Distance computation: 0.047s
  - Loss computation: 0.185s
  - Aggregation: 0.005s
  - Model transfer: 0.000s
  - Total per node: 0.237s

=== TOTAL COMPUTATIONAL WORK (sum across all nodes) ===
  - Total distance computation: 0.944s
  - Total loss computation: 3.692s
  - Total aggregation: 0.097s
  - Total model transfer: 0.000s
  - Grand total: 4.733s
  - Mean Stage 1 acceptance rate: 0.474
  - Mean Stage 2 acceptance rate: 0.400
  - Overall acceptance rate: 0.189

UBAR Algorithm Properties:
  - Model dimension: 2,219,692
  - Rho parameter: 0.5
  - Two-stage approach: Distance filtering + loss evaluation
  - Stage 1 selects: 50% of neighbors
  - Stage 2 uses: Training sample loss comparison
  - Theoretical complexity: O(deg(i)×d + deg(i)×inference)
  - Approach: UBAR paper implementation
