Device: cuda
Seed: 987654321
Looking for images in: /home/student.unimelb.edu.au/mrangwala/Projects/Sketchguard/leaf/data/celeba/data/raw/img_align_celeba
Loading 1 LEAF CelebA train files...
LEAF CelebA train: 9343 users (celebrities), 177457 samples
Looking for images in: /home/student.unimelb.edu.au/mrangwala/Projects/Sketchguard/leaf/data/celeba/data/raw/img_align_celeba
Loading 1 LEAF CelebA test files...
LEAF CelebA test: 9343 users (celebrities), 22831 samples
Found 9343 train users, 9343 test users, 9343 common users
User sample counts range: 31 (max) to 4 (min)
Distributed ALL 9343 users across 20 clients
Users per client: 467 (with 3 clients getting +1 user)
Train partition sizes: [8843, 8998, 8728, 9034, 8866, 8946, 8873, 8776, 8816, 8801, 8913, 8656, 9115, 8921, 8699, 8823, 8912, 8766, 9102, 8869]
Test partition sizes: [1140, 1158, 1127, 1158, 1134, 1145, 1145, 1127, 1136, 1128, 1144, 1125, 1152, 1160, 1124, 1145, 1154, 1131, 1157, 1141]
  Client 0: 8843 train samples, 2 unique classes
  Client 1: 8998 train samples, 2 unique classes
  Client 2: 8728 train samples, 2 unique classes
  Client 3: 9034 train samples, 2 unique classes
  Client 4: 8866 train samples, 2 unique classes
  Client 5: 8946 train samples, 2 unique classes
  Client 6: 8873 train samples, 2 unique classes
  Client 7: 8776 train samples, 2 unique classes
  Client 8: 8816 train samples, 2 unique classes
  Client 9: 8801 train samples, 2 unique classes
  Client 10: 8913 train samples, 2 unique classes
  Client 11: 8656 train samples, 2 unique classes
  Client 12: 9115 train samples, 2 unique classes
  Client 13: 8921 train samples, 2 unique classes
  Client 14: 8699 train samples, 2 unique classes
  Client 15: 8823 train samples, 2 unique classes
  Client 16: 8912 train samples, 2 unique classes
  Client 17: 8766 train samples, 2 unique classes
  Client 18: 9102 train samples, 2 unique classes
  Client 19: 8869 train samples, 2 unique classes
Will sample 4500 samples per client per epoch
Graph: erdos, nodes: 20, edges: 99
Degree statistics: avg=9.90, min=7, max=14
Attack: Compromised 4/20 nodes: [5, 12, 13, 17]
Attack type: directed_deviation, lambda: 1.0
Model variant: baseline
Model parameters: 2,219,692
Initial test acc across nodes: mean=0.4978 ± 0.0208
Round 001: test acc mean=0.7136 ± 0.0320 | min=0.6615 max=0.7729
         : test loss mean=0.5946 ± 0.0447
         : individual accs = ['0.672807', '0.661485', '0.678793', '0.699482', '0.694004', '0.721397', '0.772926', '0.709849', '0.762324', '0.678191', '0.722028', '0.706667', '0.757812', '0.741379', '0.739324', '0.751965', '0.711438', '0.687003', '0.677615', '0.724803']
         : correct/total = [(767, 1140), (766, 1158), (765, 1127), (810, 1158), (787, 1134), (826, 1145), (885, 1145), (800, 1127), (866, 1136), (765, 1128), (826, 1144), (795, 1125), (873, 1152), (860, 1160), (831, 1124), (861, 1145), (821, 1154), (777, 1131), (784, 1157), (827, 1141)]
         : compromised: 0.7269, honest: 0.7102
Round 002: test acc mean=0.8091 ± 0.0208 | min=0.7544 max=0.8454
         : test loss mean=0.4274 ± 0.0190
         : individual accs = ['0.754386', '0.825561', '0.815439', '0.817789', '0.810406', '0.845415', '0.807860', '0.821650', '0.769366', '0.824468', '0.831294', '0.823111', '0.817708', '0.818966', '0.808719', '0.787773', '0.790295', '0.812555', '0.790838', '0.808063']
         : correct/total = [(860, 1140), (956, 1158), (919, 1127), (947, 1158), (919, 1134), (968, 1145), (925, 1145), (926, 1127), (874, 1136), (930, 1128), (951, 1144), (926, 1125), (942, 1152), (950, 1160), (909, 1124), (902, 1145), (912, 1154), (919, 1131), (915, 1157), (922, 1141)]
         : compromised: 0.8237, honest: 0.8054
Round 003: test acc mean=0.8593 ± 0.0169 | min=0.8245 max=0.8818
         : test loss mean=0.3256 ± 0.0249
         : individual accs = ['0.861404', '0.860967', '0.835847', '0.860967', '0.842152', '0.881223', '0.868996', '0.839397', '0.881162', '0.840426', '0.846154', '0.881778', '0.866319', '0.868966', '0.868327', '0.824454', '0.869151', '0.865606', '0.840968', '0.880806']
         : correct/total = [(982, 1140), (997, 1158), (942, 1127), (997, 1158), (955, 1134), (1009, 1145), (995, 1145), (946, 1127), (1001, 1136), (948, 1128), (968, 1144), (992, 1125), (998, 1152), (1008, 1160), (976, 1124), (944, 1145), (1003, 1154), (979, 1131), (973, 1157), (1005, 1141)]
         : compromised: 0.8705, honest: 0.8564
Round 004: test acc mean=0.8777 ± 0.0137 | min=0.8524 max=0.9031
         : test loss mean=0.2909 ± 0.0227
         : individual accs = ['0.885088', '0.895509', '0.871340', '0.862694', '0.879189', '0.885590', '0.870742', '0.881988', '0.875880', '0.898050', '0.890734', '0.903111', '0.874132', '0.873276', '0.881673', '0.852402', '0.889081', '0.868258', '0.863440', '0.852761']
         : correct/total = [(1009, 1140), (1037, 1158), (982, 1127), (999, 1158), (997, 1134), (1014, 1145), (997, 1145), (994, 1127), (995, 1136), (1013, 1128), (1019, 1144), (1016, 1125), (1007, 1152), (1013, 1160), (991, 1124), (976, 1145), (1026, 1154), (982, 1131), (999, 1157), (973, 1141)]
         : compromised: 0.8753, honest: 0.8784
Round 005: test acc mean=0.8825 ± 0.0139 | min=0.8377 max=0.9031
         : test loss mean=0.2753 ± 0.0210
         : individual accs = ['0.837719', '0.878238', '0.874002', '0.894646', '0.871252', '0.879476', '0.896943', '0.883762', '0.888204', '0.888298', '0.894231', '0.903111', '0.891493', '0.886207', '0.886121', '0.875109', '0.893414', '0.875332', '0.865169', '0.887818']
         : correct/total = [(955, 1140), (1017, 1158), (985, 1127), (1036, 1158), (988, 1134), (1007, 1145), (1027, 1145), (996, 1127), (1009, 1136), (1002, 1128), (1023, 1144), (1016, 1125), (1027, 1152), (1028, 1160), (996, 1124), (1002, 1145), (1031, 1154), (990, 1131), (1001, 1157), (1013, 1141)]
         : compromised: 0.8831, honest: 0.8824
Round 006: test acc mean=0.8888 ± 0.0123 | min=0.8603 max=0.9084
         : test loss mean=0.2670 ± 0.0236
         : individual accs = ['0.897368', '0.889465', '0.881988', '0.898964', '0.886243', '0.901310', '0.889083', '0.880213', '0.889965', '0.864362', '0.902972', '0.903111', '0.894965', '0.886207', '0.908363', '0.860262', '0.883016', '0.890363', '0.872947', '0.894829']
         : correct/total = [(1023, 1140), (1030, 1158), (994, 1127), (1041, 1158), (1005, 1134), (1032, 1145), (1018, 1145), (992, 1127), (1011, 1136), (975, 1128), (1033, 1144), (1016, 1125), (1031, 1152), (1028, 1160), (1021, 1124), (985, 1145), (1019, 1154), (1007, 1131), (1010, 1157), (1021, 1141)]
         : compromised: 0.8932, honest: 0.8877
Round 007: test acc mean=0.8953 ± 0.0096 | min=0.8718 max=0.9091
         : test loss mean=0.2510 ± 0.0152
         : individual accs = ['0.897368', '0.896373', '0.880213', '0.893782', '0.896825', '0.902183', '0.900437', '0.903283', '0.899648', '0.903369', '0.909091', '0.904000', '0.904514', '0.890517', '0.902135', '0.882096', '0.897747', '0.871795', '0.881590', '0.889571']
         : correct/total = [(1023, 1140), (1038, 1158), (992, 1127), (1035, 1158), (1017, 1134), (1033, 1145), (1031, 1145), (1018, 1127), (1022, 1136), (1019, 1128), (1040, 1144), (1017, 1125), (1042, 1152), (1033, 1160), (1014, 1124), (1010, 1145), (1036, 1154), (986, 1131), (1020, 1157), (1015, 1141)]
         : compromised: 0.8923, honest: 0.8961
Round 008: test acc mean=0.8941 ± 0.0123 | min=0.8660 max=0.9126
         : test loss mean=0.2524 ± 0.0218
         : individual accs = ['0.900877', '0.904145', '0.886424', '0.888601', '0.888889', '0.903057', '0.898690', '0.904170', '0.886444', '0.878546', '0.912587', '0.912000', '0.905382', '0.891379', '0.899466', '0.871616', '0.904679', '0.889478', '0.866033', '0.890447']
         : correct/total = [(1027, 1140), (1047, 1158), (999, 1127), (1029, 1158), (1008, 1134), (1034, 1145), (1029, 1145), (1019, 1127), (1007, 1136), (991, 1128), (1044, 1144), (1026, 1125), (1043, 1152), (1034, 1160), (1011, 1124), (998, 1145), (1044, 1154), (1006, 1131), (1002, 1157), (1016, 1141)]
         : compromised: 0.8973, honest: 0.8934
Round 009: test acc mean=0.8888 ± 0.0137 | min=0.8617 max=0.9087
         : test loss mean=0.2639 ± 0.0274
         : individual accs = ['0.889474', '0.879102', '0.877551', '0.907599', '0.879189', '0.908297', '0.881223', '0.881988', '0.896127', '0.908688', '0.905594', '0.896000', '0.896701', '0.875000', '0.900356', '0.871616', '0.889948', '0.870911', '0.861711', '0.899211']
         : correct/total = [(1014, 1140), (1018, 1158), (989, 1127), (1051, 1158), (997, 1134), (1040, 1145), (1009, 1145), (994, 1127), (1018, 1136), (1025, 1128), (1036, 1144), (1008, 1125), (1033, 1152), (1015, 1160), (1012, 1124), (998, 1145), (1027, 1154), (985, 1131), (997, 1157), (1026, 1141)]
         : compromised: 0.8877, honest: 0.8891
Round 010: test acc mean=0.9018 ± 0.0097 | min=0.8755 max=0.9153
         : test loss mean=0.2384 ± 0.0165
         : individual accs = ['0.901754', '0.902418', '0.881988', '0.907599', '0.895062', '0.905677', '0.915284', '0.909494', '0.894366', '0.914894', '0.902098', '0.909333', '0.905382', '0.901724', '0.904804', '0.896070', '0.907279', '0.895668', '0.875540', '0.908852']
         : correct/total = [(1028, 1140), (1045, 1158), (994, 1127), (1051, 1158), (1015, 1134), (1037, 1145), (1048, 1145), (1025, 1127), (1016, 1136), (1032, 1128), (1032, 1144), (1023, 1125), (1043, 1152), (1046, 1160), (1017, 1124), (1026, 1145), (1047, 1154), (1013, 1131), (1013, 1157), (1037, 1141)]
         : compromised: 0.9021, honest: 0.9017

=== FINAL RESULTS ===
Dataset: celeba, Nodes: 20, Graph: erdos, Aggregation: krum
Attack: directed_deviation, 20.0% compromised
Final accuracy - Compromised: 0.9021, Honest: 0.9017
Overall test accuracy: mean=0.9018 ± 0.0097
