Device: cuda
Seed: 987654321
Looking for images in: /home/student.unimelb.edu.au/mrangwala/Projects/Sketchguard/leaf/data/celeba/data/raw/img_align_celeba
Loading 1 LEAF CelebA train files...
LEAF CelebA train: 9343 users (celebrities), 177457 samples
Looking for images in: /home/student.unimelb.edu.au/mrangwala/Projects/Sketchguard/leaf/data/celeba/data/raw/img_align_celeba
Loading 1 LEAF CelebA test files...
LEAF CelebA test: 9343 users (celebrities), 22831 samples
Found 9343 train users, 9343 test users, 9343 common users
User sample counts range: 31 (max) to 4 (min)
Distributed ALL 9343 users across 20 clients
Users per client: 467 (with 3 clients getting +1 user)
Train partition sizes: [8843, 8998, 8728, 9034, 8866, 8946, 8873, 8776, 8816, 8801, 8913, 8656, 9115, 8921, 8699, 8823, 8912, 8766, 9102, 8869]
Test partition sizes: [1140, 1158, 1127, 1158, 1134, 1145, 1145, 1127, 1136, 1128, 1144, 1125, 1152, 1160, 1124, 1145, 1154, 1131, 1157, 1141]
  Client 0: 8843 train samples, 2 unique classes
  Client 1: 8998 train samples, 2 unique classes
  Client 2: 8728 train samples, 2 unique classes
  Client 3: 9034 train samples, 2 unique classes
  Client 4: 8866 train samples, 2 unique classes
  Client 5: 8946 train samples, 2 unique classes
  Client 6: 8873 train samples, 2 unique classes
  Client 7: 8776 train samples, 2 unique classes
  Client 8: 8816 train samples, 2 unique classes
  Client 9: 8801 train samples, 2 unique classes
  Client 10: 8913 train samples, 2 unique classes
  Client 11: 8656 train samples, 2 unique classes
  Client 12: 9115 train samples, 2 unique classes
  Client 13: 8921 train samples, 2 unique classes
  Client 14: 8699 train samples, 2 unique classes
  Client 15: 8823 train samples, 2 unique classes
  Client 16: 8912 train samples, 2 unique classes
  Client 17: 8766 train samples, 2 unique classes
  Client 18: 9102 train samples, 2 unique classes
  Client 19: 8869 train samples, 2 unique classes
Will sample 4500 samples per client per epoch
Graph: ring, nodes: 20, edges: 20
Degree statistics: avg=2.00, min=2, max=2
Attack: Compromised 6/20 nodes: [5, 12, 13, 14, 17, 18]
Attack type: backdoor, lambda: 1.0
Backdoor target label: 0, trigger size: 8
Model variant: baseline
Model parameters: 2,219,692
UBAR ALGORITHM (Two-Stage Byzantine-resilient)
  - Model dimension: 2,219,692 parameters
  - Rho parameter: 0.7
  - Stage 1: Distance-based filtering (select 70% closest neighbors)
  - Stage 2: Performance-based selection (loss comparison)
  - Complexity: O(deg(i)×d + deg(i)×inference)
Initial test acc across nodes: mean=0.4978 ± 0.0208
Backdoor attack: Created poisoned datasets for 6 compromised nodes
Round 001: test acc mean=0.6077 ± 0.0698 | min=0.5069 max=0.7185
         : test loss mean=2550.5847 ± 6804.8007
         : individual accs = ['0.670175', '0.670121', '0.669033', '0.645078', '0.640212', '0.514410', '0.555459', '0.619343', '0.685739', '0.676418', '0.718531', '0.670222', '0.522569', '0.506897', '0.517794', '0.632314', '0.630849', '0.508400', '0.522040', '0.577564']
         : correct/total = [(764, 1140), (776, 1158), (754, 1127), (747, 1158), (726, 1134), (589, 1145), (636, 1145), (698, 1127), (779, 1136), (763, 1128), (822, 1144), (754, 1125), (602, 1152), (588, 1160), (582, 1124), (724, 1145), (728, 1154), (575, 1131), (604, 1157), (659, 1141)]
         : compromised: 0.5154, honest: 0.6472
         : ubar stats = ['Node 0: s1=0.500, s2=1.000', 'Node 1: s1=0.500, s2=1.000', 'Node 2: s1=0.500, s2=1.000']...
Round 002: test acc mean=0.6770 ± 0.1105 | min=0.5066 max=0.7858
         : test loss mean=nan ± nan
         : individual accs = ['0.720175', '0.730570', '0.743567', '0.737478', '0.693122', '0.509170', '0.732751', '0.767524', '0.772007', '0.776596', '0.785839', '0.752000', '0.511285', '0.506897', '0.519573', '0.744978', '0.778163', '0.506631', '0.514261', '0.737949']
         : correct/total = [(821, 1140), (846, 1158), (838, 1127), (854, 1158), (786, 1134), (583, 1145), (839, 1145), (865, 1127), (877, 1136), (876, 1128), (899, 1144), (846, 1125), (589, 1152), (588, 1160), (584, 1124), (853, 1145), (898, 1154), (573, 1131), (595, 1157), (842, 1141)]
         : compromised: 0.5113, honest: 0.7481
         : ubar stats = ['Node 0: s1=0.500, s2=1.000', 'Node 1: s1=0.500, s2=1.000', 'Node 2: s1=0.500, s2=1.000']...
Round 003: test acc mean=0.7404 ± 0.1487 | min=0.5069 max=0.8776
         : test loss mean=nan ± nan
         : individual accs = ['0.835088', '0.844560', '0.837622', '0.823834', '0.791005', '0.514410', '0.797380', '0.841171', '0.847711', '0.865248', '0.877622', '0.853333', '0.522569', '0.506897', '0.517794', '0.819214', '0.860485', '0.508400', '0.522040', '0.822086']
         : correct/total = [(952, 1140), (978, 1158), (944, 1127), (954, 1158), (897, 1134), (589, 1145), (913, 1145), (948, 1127), (963, 1136), (976, 1128), (1004, 1144), (960, 1125), (602, 1152), (588, 1160), (582, 1124), (938, 1145), (993, 1154), (575, 1131), (604, 1157), (938, 1141)]
         : compromised: 0.5154, honest: 0.8369
         : ubar stats = ['Node 0: s1=0.500, s2=1.000', 'Node 1: s1=0.500, s2=1.000', 'Node 2: s1=0.500, s2=1.000']...
Round 004: test acc mean=0.7641 ± 0.1632 | min=0.5069 max=0.8830
         : test loss mean=nan ± nan
         : individual accs = ['0.864035', '0.879965', '0.881100', '0.873057', '0.849206', '0.514410', '0.873362', '0.874002', '0.870599', '0.882979', '0.882867', '0.876444', '0.522569', '0.506897', '0.517794', '0.845415', '0.870884', '0.508400', '0.522040', '0.866784']
         : correct/total = [(985, 1140), (1019, 1158), (993, 1127), (1011, 1158), (963, 1134), (589, 1145), (1000, 1145), (985, 1127), (989, 1136), (996, 1128), (1010, 1144), (986, 1125), (602, 1152), (588, 1160), (582, 1124), (968, 1145), (1005, 1154), (575, 1131), (604, 1157), (989, 1141)]
         : compromised: 0.5154, honest: 0.8708
         : ubar stats = ['Node 0: s1=0.500, s2=1.000', 'Node 1: s1=0.500, s2=1.000', 'Node 2: s1=0.500, s2=1.000']...
Round 005: test acc mean=0.7683 ± 0.1664 | min=0.5069 max=0.9012
         : test loss mean=nan ± nan
         : individual accs = ['0.848246', '0.844560', '0.874002', '0.886010', '0.873898', '0.514410', '0.878603', '0.889086', '0.882923', '0.895390', '0.901224', '0.896000', '0.522569', '0.506897', '0.517794', '0.867249', '0.896014', '0.508400', '0.522040', '0.840491']
         : correct/total = [(967, 1140), (978, 1158), (985, 1127), (1026, 1158), (991, 1134), (589, 1145), (1006, 1145), (1002, 1127), (1003, 1136), (1010, 1128), (1031, 1144), (1008, 1125), (602, 1152), (588, 1160), (582, 1124), (993, 1145), (1034, 1154), (575, 1131), (604, 1157), (959, 1141)]
         : compromised: 0.5154, honest: 0.8767
         : ubar stats = ['Node 0: s1=0.500, s2=1.000', 'Node 1: s1=0.500, s2=1.000', 'Node 2: s1=0.500, s2=1.000']...
Round 006: test acc mean=0.7783 ± 0.1723 | min=0.5069 max=0.9021
         : test loss mean=nan ± nan
         : individual accs = ['0.892982', '0.895509', '0.888199', '0.901554', '0.897707', '0.514410', '0.899563', '0.881100', '0.880282', '0.886525', '0.891608', '0.896000', '0.522569', '0.506897', '0.517794', '0.871616', '0.902080', '0.508400', '0.522040', '0.888694']
         : correct/total = [(1018, 1140), (1037, 1158), (1001, 1127), (1044, 1158), (1018, 1134), (589, 1145), (1030, 1145), (993, 1127), (1000, 1136), (1000, 1128), (1020, 1144), (1008, 1125), (602, 1152), (588, 1160), (582, 1124), (998, 1145), (1041, 1154), (575, 1131), (604, 1157), (1014, 1141)]
         : compromised: 0.5154, honest: 0.8910
         : ubar stats = ['Node 0: s1=0.500, s2=1.000', 'Node 1: s1=0.500, s2=1.000', 'Node 2: s1=0.500, s2=1.000']...
Round 007: test acc mean=0.7811 ± 0.1742 | min=0.5069 max=0.9102
         : test loss mean=nan ± nan
         : individual accs = ['0.882456', '0.892919', '0.893523', '0.902418', '0.889771', '0.514410', '0.895197', '0.896185', '0.883803', '0.906028', '0.902972', '0.910222', '0.522569', '0.506897', '0.517794', '0.882096', '0.896880', '0.508400', '0.522040', '0.895706']
         : correct/total = [(1006, 1140), (1034, 1158), (1007, 1127), (1045, 1158), (1009, 1134), (589, 1145), (1025, 1145), (1010, 1127), (1004, 1136), (1022, 1128), (1033, 1144), (1024, 1125), (602, 1152), (588, 1160), (582, 1124), (1010, 1145), (1035, 1154), (575, 1131), (604, 1157), (1022, 1141)]
         : compromised: 0.5154, honest: 0.8950
         : ubar stats = ['Node 0: s1=0.500, s2=1.000', 'Node 1: s1=0.500, s2=1.000', 'Node 2: s1=0.500, s2=1.000']...
Round 008: test acc mean=0.7825 ± 0.1750 | min=0.5069 max=0.9111
         : test loss mean=nan ± nan
         : individual accs = ['0.899123', '0.898100', '0.893523', '0.906736', '0.900353', '0.514410', '0.900437', '0.892635', '0.877641', '0.895390', '0.895979', '0.911111', '0.522569', '0.506897', '0.517794', '0.882096', '0.906412', '0.508400', '0.522040', '0.897458']
         : correct/total = [(1025, 1140), (1040, 1158), (1007, 1127), (1050, 1158), (1021, 1134), (589, 1145), (1031, 1145), (1006, 1127), (997, 1136), (1010, 1128), (1025, 1144), (1025, 1125), (602, 1152), (588, 1160), (582, 1124), (1010, 1145), (1046, 1154), (575, 1131), (604, 1157), (1024, 1141)]
         : compromised: 0.5154, honest: 0.8969
         : ubar stats = ['Node 0: s1=0.500, s2=1.000', 'Node 1: s1=0.500, s2=1.000', 'Node 2: s1=0.500, s2=1.000']...
Round 009: test acc mean=0.7841 ± 0.1760 | min=0.5069 max=0.9102
         : test loss mean=nan ± nan
         : individual accs = ['0.900877', '0.900691', '0.895297', '0.905009', '0.902998', '0.514410', '0.903930', '0.898846', '0.889085', '0.897163', '0.899476', '0.910222', '0.522569', '0.506897', '0.517794', '0.889083', '0.899480', '0.508400', '0.522040', '0.898335']
         : correct/total = [(1027, 1140), (1043, 1158), (1009, 1127), (1048, 1158), (1024, 1134), (589, 1145), (1035, 1145), (1013, 1127), (1010, 1136), (1012, 1128), (1029, 1144), (1024, 1125), (602, 1152), (588, 1160), (582, 1124), (1018, 1145), (1038, 1154), (575, 1131), (604, 1157), (1025, 1141)]
         : compromised: 0.5154, honest: 0.8993
         : ubar stats = ['Node 0: s1=0.500, s2=1.000', 'Node 1: s1=0.500, s2=1.000', 'Node 2: s1=0.500, s2=1.000']...
Round 010: test acc mean=0.7854 ± 0.1770 | min=0.5069 max=0.9123
         : test loss mean=nan ± nan
         : individual accs = ['0.912281', '0.905872', '0.890861', '0.909326', '0.900353', '0.514410', '0.896070', '0.906832', '0.882042', '0.899823', '0.906469', '0.909333', '0.522569', '0.506897', '0.517794', '0.890830', '0.909012', '0.508400', '0.522040', '0.896582']
         : correct/total = [(1040, 1140), (1049, 1158), (1004, 1127), (1053, 1158), (1021, 1134), (589, 1145), (1026, 1145), (1022, 1127), (1002, 1136), (1015, 1128), (1037, 1144), (1023, 1125), (602, 1152), (588, 1160), (582, 1124), (1020, 1145), (1049, 1154), (575, 1131), (604, 1157), (1023, 1141)]
         : compromised: 0.5154, honest: 0.9011
         : ubar stats = ['Node 0: s1=0.500, s2=1.000', 'Node 1: s1=0.500, s2=1.000', 'Node 2: s1=0.500, s2=1.000']...

=== FINAL RESULTS ===
Dataset: celeba, Nodes: 20, Graph: ring, Aggregation: ubar
Attack: backdoor, 30.0% compromised
Final accuracy - Compromised: 0.5154, Honest: 0.9011
Overall test accuracy: mean=0.7854 ± 0.1770

=== BACKDOOR ATTACK SUCCESS RATE (ASR) ===
Target label: 0
Trigger size: 8x8
Overall ASR: 0.6839 ± 0.2081
Honest nodes ASR: 0.5484 ± 0.0262
Compromised nodes ASR: 1.0000 ± 0.0000
Note: Higher ASR indicates more successful backdoor attack

=== UBAR SUMMARY ===
Node 0: stage1=0.500, stage2=1.000, overall=0.500
Node 1: stage1=0.500, stage2=1.000, overall=0.500
Node 2: stage1=0.500, stage2=1.000, overall=0.500
Node 3: stage1=0.500, stage2=1.000, overall=0.500
Node 4: stage1=0.500, stage2=1.000, overall=0.500
Node 5: stage1=0.500, stage2=1.000, overall=0.500
Node 6: stage1=0.500, stage2=1.000, overall=0.500
Node 7: stage1=0.500, stage2=1.000, overall=0.500
Node 8: stage1=0.500, stage2=1.000, overall=0.500
Node 9: stage1=0.500, stage2=1.000, overall=0.500
Node 10: stage1=0.500, stage2=1.000, overall=0.500
Node 11: stage1=0.500, stage2=1.000, overall=0.500
Node 12: stage1=0.500, stage2=1.000, overall=0.500
Node 13: stage1=0.500, stage2=1.000, overall=0.500
Node 14: stage1=0.500, stage2=1.000, overall=0.500
Node 15: stage1=0.500, stage2=1.000, overall=0.500
Node 16: stage1=0.500, stage2=1.000, overall=0.500
Node 17: stage1=0.500, stage2=1.000, overall=0.500
Node 18: stage1=0.500, stage2=1.000, overall=0.500
Node 19: stage1=0.500, stage2=1.000, overall=0.500

=== PARALLEL EXECUTION TIME (realistic for distributed system) ===
  COMMUNICATION (max across nodes):
    - Full model transfer: 0.000s (0.0%)
  COMPUTATION (max across nodes):
    - Distance computation: 0.008s (4.6%)
    - Loss computation: 0.172s (93.1%)
    - Aggregation: 0.004s (2.3%)
  TOTALS:
    - Total computation: 0.185s (100.0%)
    - Total communication: 0.000s (0.0%)
    - Total parallel time: 0.185s

=== PER-NODE AVERAGE TIME ===
  - Distance computation: 0.006s
  - Loss computation: 0.146s
  - Aggregation: 0.003s
  - Model transfer: 0.000s
  - Total per node: 0.155s

=== TOTAL COMPUTATIONAL WORK (sum across all nodes) ===
  - Total distance computation: 0.113s
  - Total loss computation: 2.926s
  - Total aggregation: 0.056s
  - Total model transfer: 0.000s
  - Grand total: 3.096s
  - Mean Stage 1 acceptance rate: 0.500
  - Mean Stage 2 acceptance rate: 1.000
  - Overall acceptance rate: 0.500

UBAR Algorithm Properties:
  - Model dimension: 2,219,692
  - Rho parameter: 0.7
  - Two-stage approach: Distance filtering + loss evaluation
  - Stage 1 selects: 70% of neighbors
  - Stage 2 uses: Training sample loss comparison
  - Theoretical complexity: O(deg(i)×d + deg(i)×inference)
  - Approach: UBAR paper implementation
