Device: cuda
Seed: 987654321
Looking for images in: /home/student.unimelb.edu.au/mrangwala/Projects/Sketchguard/leaf/data/celeba/data/raw/img_align_celeba
Loading 1 LEAF CelebA train files...
LEAF CelebA train: 9343 users (celebrities), 177457 samples
Looking for images in: /home/student.unimelb.edu.au/mrangwala/Projects/Sketchguard/leaf/data/celeba/data/raw/img_align_celeba
Loading 1 LEAF CelebA test files...
LEAF CelebA test: 9343 users (celebrities), 22831 samples
Found 9343 train users, 9343 test users, 9343 common users
User sample counts range: 31 (max) to 4 (min)
Distributed ALL 9343 users across 20 clients
Users per client: 467 (with 3 clients getting +1 user)
Train partition sizes: [8843, 8998, 8728, 9034, 8866, 8946, 8873, 8776, 8816, 8801, 8913, 8656, 9115, 8921, 8699, 8823, 8912, 8766, 9102, 8869]
Test partition sizes: [1140, 1158, 1127, 1158, 1134, 1145, 1145, 1127, 1136, 1128, 1144, 1125, 1152, 1160, 1124, 1145, 1154, 1131, 1157, 1141]
  Client 0: 8843 train samples, 2 unique classes
  Client 1: 8998 train samples, 2 unique classes
  Client 2: 8728 train samples, 2 unique classes
  Client 3: 9034 train samples, 2 unique classes
  Client 4: 8866 train samples, 2 unique classes
  Client 5: 8946 train samples, 2 unique classes
  Client 6: 8873 train samples, 2 unique classes
  Client 7: 8776 train samples, 2 unique classes
  Client 8: 8816 train samples, 2 unique classes
  Client 9: 8801 train samples, 2 unique classes
  Client 10: 8913 train samples, 2 unique classes
  Client 11: 8656 train samples, 2 unique classes
  Client 12: 9115 train samples, 2 unique classes
  Client 13: 8921 train samples, 2 unique classes
  Client 14: 8699 train samples, 2 unique classes
  Client 15: 8823 train samples, 2 unique classes
  Client 16: 8912 train samples, 2 unique classes
  Client 17: 8766 train samples, 2 unique classes
  Client 18: 9102 train samples, 2 unique classes
  Client 19: 8869 train samples, 2 unique classes
Will sample 4500 samples per client per epoch
Graph: erdos, nodes: 20, edges: 48
Degree statistics: avg=4.80, min=2, max=7
Attack: Compromised 16/20 nodes: [1, 2, 3, 5, 6, 8, 9, 10, 11, 12, 13, 14, 15, 17, 18, 19]
Attack type: backdoor, lambda: 1.0
Backdoor target label: 0, trigger size: 8
Model variant: baseline
Model parameters: 2,219,692
UBAR ALGORITHM (Two-Stage Byzantine-resilient)
  - Model dimension: 2,219,692 parameters
  - Rho parameter: 0.19999999999999996
  - Stage 1: Distance-based filtering (select 20% closest neighbors)
  - Stage 2: Performance-based selection (loss comparison)
  - Complexity: O(deg(i)×d + deg(i)×inference)
Initial test acc across nodes: mean=0.4978 ± 0.0208
Backdoor attack: Created poisoned datasets for 16 compromised nodes
Round 001: test acc mean=0.5401 ± 0.0573 | min=0.4938 max=0.7158
         : test loss mean=9182.5791 ± 14150.6827
         : individual accs = ['0.683333', '0.508636', '0.494232', '0.533679', '0.571429', '0.514410', '0.521397', '0.560781', '0.562500', '0.493794', '0.525350', '0.498667', '0.522569', '0.506897', '0.517794', '0.521397', '0.715771', '0.508400', '0.522040', '0.517967']
         : correct/total = [(779, 1140), (589, 1158), (557, 1127), (618, 1158), (648, 1134), (589, 1145), (597, 1145), (632, 1127), (639, 1136), (557, 1128), (601, 1144), (561, 1125), (602, 1152), (588, 1160), (582, 1124), (597, 1145), (826, 1154), (575, 1131), (604, 1157), (591, 1141)]
         : compromised: 0.5169, honest: 0.6328
         : ubar stats = ['Node 0: s1=0.167, s2=1.000', 'Node 1: s1=0.167, s2=1.000', 'Node 2: s1=0.200, s2=1.000']...
Round 002: test acc mean=0.5498 ± 0.0858 | min=0.4681 max=0.7686
         : test loss mean=nan ± nan
         : individual accs = ['0.735965', '0.493092', '0.491571', '0.528497', '0.666667', '0.514410', '0.516157', '0.685004', '0.539613', '0.475177', '0.520979', '0.498667', '0.509549', '0.506897', '0.523132', '0.468122', '0.768631', '0.507515', '0.528954', '0.517967']
         : correct/total = [(839, 1140), (571, 1158), (554, 1127), (612, 1158), (756, 1134), (589, 1145), (591, 1145), (772, 1127), (613, 1136), (536, 1128), (596, 1144), (561, 1125), (587, 1152), (588, 1160), (588, 1124), (536, 1145), (887, 1154), (574, 1131), (612, 1157), (591, 1141)]
         : compromised: 0.5088, honest: 0.7141
         : ubar stats = ['Node 0: s1=0.167, s2=1.000', 'Node 1: s1=0.167, s2=1.000', 'Node 2: s1=0.200, s2=1.000']...
Round 003: test acc mean=0.5777 ± 0.1244 | min=0.4911 max=0.8421
         : test loss mean=nan ± nan
         : individual accs = ['0.842105', '0.508636', '0.493345', '0.528497', '0.808642', '0.514410', '0.521397', '0.805679', '0.562500', '0.491135', '0.525350', '0.498667', '0.522569', '0.506897', '0.517794', '0.517031', '0.840555', '0.508400', '0.522040', '0.517967']
         : correct/total = [(960, 1140), (589, 1158), (556, 1127), (612, 1158), (917, 1134), (589, 1145), (597, 1145), (908, 1127), (639, 1136), (554, 1128), (601, 1144), (561, 1125), (602, 1152), (588, 1160), (582, 1124), (592, 1145), (970, 1154), (575, 1131), (604, 1157), (591, 1141)]
         : compromised: 0.5160, honest: 0.8242
         : ubar stats = ['Node 0: s1=0.167, s2=1.000', 'Node 1: s1=0.167, s2=1.000', 'Node 2: s1=0.200, s2=1.000']...
Round 004: test acc mean=0.5856 ± 0.1398 | min=0.4911 max=0.8686
         : test loss mean=nan ± nan
         : individual accs = ['0.851754', '0.508636', '0.493345', '0.528497', '0.868607', '0.514410', '0.521397', '0.866903', '0.562500', '0.491135', '0.525350', '0.498667', '0.522569', '0.506897', '0.517794', '0.517031', '0.867418', '0.508400', '0.522040', '0.517967']
         : correct/total = [(971, 1140), (589, 1158), (556, 1127), (612, 1158), (985, 1134), (589, 1145), (597, 1145), (977, 1127), (639, 1136), (554, 1128), (601, 1144), (561, 1125), (602, 1152), (588, 1160), (582, 1124), (592, 1145), (1001, 1154), (575, 1131), (604, 1157), (591, 1141)]
         : compromised: 0.5160, honest: 0.8637
         : ubar stats = ['Node 0: s1=0.167, s2=1.000', 'Node 1: s1=0.167, s2=1.000', 'Node 2: s1=0.200, s2=1.000']...
Round 005: test acc mean=0.5874 ± 0.1434 | min=0.4911 max=0.8847
         : test loss mean=nan ± nan
         : individual accs = ['0.873684', '0.508636', '0.493345', '0.528497', '0.865079', '0.514410', '0.521397', '0.866903', '0.562500', '0.491135', '0.525350', '0.498667', '0.522569', '0.506897', '0.517794', '0.517031', '0.884749', '0.508400', '0.522040', '0.517967']
         : correct/total = [(996, 1140), (589, 1158), (556, 1127), (612, 1158), (981, 1134), (589, 1145), (597, 1145), (977, 1127), (639, 1136), (554, 1128), (601, 1144), (561, 1125), (602, 1152), (588, 1160), (582, 1124), (592, 1145), (1021, 1154), (575, 1131), (604, 1157), (591, 1141)]
         : compromised: 0.5160, honest: 0.8726
         : ubar stats = ['Node 0: s1=0.167, s2=1.000', 'Node 1: s1=0.167, s2=1.000', 'Node 2: s1=0.200, s2=1.000']...
Round 006: test acc mean=0.5911 ± 0.1508 | min=0.4911 max=0.8956
         : test loss mean=nan ± nan
         : individual accs = ['0.895614', '0.508636', '0.493345', '0.528497', '0.885362', '0.514410', '0.521397', '0.890861', '0.562500', '0.491135', '0.525350', '0.498667', '0.522569', '0.506897', '0.517794', '0.517031', '0.893414', '0.508400', '0.522040', '0.517967']
         : correct/total = [(1021, 1140), (589, 1158), (556, 1127), (612, 1158), (1004, 1134), (589, 1145), (597, 1145), (1004, 1127), (639, 1136), (554, 1128), (601, 1144), (561, 1125), (602, 1152), (588, 1160), (582, 1124), (592, 1145), (1031, 1154), (575, 1131), (604, 1157), (591, 1141)]
         : compromised: 0.5160, honest: 0.8913
         : ubar stats = ['Node 0: s1=0.167, s2=1.000', 'Node 1: s1=0.167, s2=1.000', 'Node 2: s1=0.200, s2=1.000']...
Round 007: test acc mean=0.5924 ± 0.1535 | min=0.4911 max=0.9086
         : test loss mean=nan ± nan
         : individual accs = ['0.898246', '0.508636', '0.493345', '0.528497', '0.886243', '0.514410', '0.521397', '0.908607', '0.562500', '0.491135', '0.525350', '0.498667', '0.522569', '0.506897', '0.517794', '0.517031', '0.898614', '0.508400', '0.522040', '0.517967']
         : correct/total = [(1024, 1140), (589, 1158), (556, 1127), (612, 1158), (1005, 1134), (589, 1145), (597, 1145), (1024, 1127), (639, 1136), (554, 1128), (601, 1144), (561, 1125), (602, 1152), (588, 1160), (582, 1124), (592, 1145), (1037, 1154), (575, 1131), (604, 1157), (591, 1141)]
         : compromised: 0.5160, honest: 0.8979
         : ubar stats = ['Node 0: s1=0.167, s2=1.000', 'Node 1: s1=0.167, s2=1.000', 'Node 2: s1=0.200, s2=1.000']...
Round 008: test acc mean=0.5932 ± 0.1549 | min=0.4911 max=0.9095
         : test loss mean=nan ± nan
         : individual accs = ['0.902632', '0.508636', '0.493345', '0.528497', '0.895062', '0.514410', '0.521397', '0.909494', '0.562500', '0.491135', '0.525350', '0.498667', '0.522569', '0.506897', '0.517794', '0.517031', '0.899480', '0.508400', '0.522040', '0.517967']
         : correct/total = [(1029, 1140), (589, 1158), (556, 1127), (612, 1158), (1015, 1134), (589, 1145), (597, 1145), (1025, 1127), (639, 1136), (554, 1128), (601, 1144), (561, 1125), (602, 1152), (588, 1160), (582, 1124), (592, 1145), (1038, 1154), (575, 1131), (604, 1157), (591, 1141)]
         : compromised: 0.5160, honest: 0.9017
         : ubar stats = ['Node 0: s1=0.167, s2=1.000', 'Node 1: s1=0.167, s2=1.000', 'Node 2: s1=0.200, s2=1.000']...
Round 009: test acc mean=0.5941 ± 0.1568 | min=0.4911 max=0.9113
         : test loss mean=nan ± nan
         : individual accs = ['0.904386', '0.508636', '0.493345', '0.528497', '0.902116', '0.514410', '0.521397', '0.911269', '0.562500', '0.491135', '0.525350', '0.498667', '0.522569', '0.506897', '0.517794', '0.517031', '0.907279', '0.508400', '0.522040', '0.517967']
         : correct/total = [(1031, 1140), (589, 1158), (556, 1127), (612, 1158), (1023, 1134), (589, 1145), (597, 1145), (1027, 1127), (639, 1136), (554, 1128), (601, 1144), (561, 1125), (602, 1152), (588, 1160), (582, 1124), (592, 1145), (1047, 1154), (575, 1131), (604, 1157), (591, 1141)]
         : compromised: 0.5160, honest: 0.9063
         : ubar stats = ['Node 0: s1=0.167, s2=1.000', 'Node 1: s1=0.167, s2=1.000', 'Node 2: s1=0.200, s2=1.000']...
Round 010: test acc mean=0.5947 ± 0.1579 | min=0.4911 max=0.9175
         : test loss mean=nan ± nan
         : individual accs = ['0.908772', '0.508636', '0.493345', '0.528497', '0.904762', '0.514410', '0.521397', '0.917480', '0.562500', '0.491135', '0.525350', '0.498667', '0.522569', '0.506897', '0.517794', '0.517031', '0.905546', '0.508400', '0.522040', '0.517967']
         : correct/total = [(1036, 1140), (589, 1158), (556, 1127), (612, 1158), (1026, 1134), (589, 1145), (597, 1145), (1034, 1127), (639, 1136), (554, 1128), (601, 1144), (561, 1125), (602, 1152), (588, 1160), (582, 1124), (592, 1145), (1045, 1154), (575, 1131), (604, 1157), (591, 1141)]
         : compromised: 0.5160, honest: 0.9091
         : ubar stats = ['Node 0: s1=0.167, s2=1.000', 'Node 1: s1=0.167, s2=1.000', 'Node 2: s1=0.200, s2=1.000']...

=== FINAL RESULTS ===
Dataset: celeba, Nodes: 20, Graph: erdos, Aggregation: ubar
Attack: backdoor, 80.0% compromised
Final accuracy - Compromised: 0.5160, Honest: 0.9091
Overall test accuracy: mean=0.5947 ± 0.1579

=== BACKDOOR ATTACK SUCCESS RATE (ASR) ===
Target label: 0
Trigger size: 8x8
Overall ASR: 0.9092 ± 0.1816
Honest nodes ASR: 0.5461 ± 0.0129
Compromised nodes ASR: 1.0000 ± 0.0000
Note: Higher ASR indicates more successful backdoor attack

=== UBAR SUMMARY ===
Node 0: stage1=0.167, stage2=1.000, overall=0.167
Node 1: stage1=0.167, stage2=1.000, overall=0.167
Node 2: stage1=0.200, stage2=1.000, overall=0.200
Node 3: stage1=0.250, stage2=1.000, overall=0.250
Node 4: stage1=0.250, stage2=1.000, overall=0.250
Node 5: stage1=0.200, stage2=1.000, overall=0.200
Node 6: stage1=0.200, stage2=1.000, overall=0.200
Node 7: stage1=0.200, stage2=1.000, overall=0.200
Node 8: stage1=0.500, stage2=1.000, overall=0.500
Node 9: stage1=0.333, stage2=1.000, overall=0.333
Node 10: stage1=0.250, stage2=1.000, overall=0.250
Node 11: stage1=0.143, stage2=1.000, overall=0.143
Node 12: stage1=0.143, stage2=1.000, overall=0.143
Node 13: stage1=0.250, stage2=1.000, overall=0.250
Node 14: stage1=0.143, stage2=1.000, overall=0.143
Node 15: stage1=0.167, stage2=1.000, overall=0.167
Node 16: stage1=0.200, stage2=1.000, overall=0.200
Node 17: stage1=0.200, stage2=1.000, overall=0.200
Node 18: stage1=0.250, stage2=1.000, overall=0.250
Node 19: stage1=0.500, stage2=1.000, overall=0.500

=== PARALLEL EXECUTION TIME (realistic for distributed system) ===
  COMMUNICATION (max across nodes):
    - Full model transfer: 0.000s (0.0%)
  COMPUTATION (max across nodes):
    - Distance computation: 0.017s (9.2%)
    - Loss computation: 0.168s (89.1%)
    - Aggregation: 0.003s (1.7%)
  TOTALS:
    - Total computation: 0.189s (100.0%)
    - Total communication: 0.000s (0.0%)
    - Total parallel time: 0.189s

=== PER-NODE AVERAGE TIME ===
  - Distance computation: 0.012s
  - Loss computation: 0.129s
  - Aggregation: 0.003s
  - Model transfer: 0.000s
  - Total per node: 0.144s

=== TOTAL COMPUTATIONAL WORK (sum across all nodes) ===
  - Total distance computation: 0.247s
  - Total loss computation: 2.583s
  - Total aggregation: 0.054s
  - Total model transfer: 0.000s
  - Grand total: 2.884s
  - Mean Stage 1 acceptance rate: 0.236
  - Mean Stage 2 acceptance rate: 1.000
  - Overall acceptance rate: 0.236

UBAR Algorithm Properties:
  - Model dimension: 2,219,692
  - Rho parameter: 0.19999999999999996
  - Two-stage approach: Distance filtering + loss evaluation
  - Stage 1 selects: 20% of neighbors
  - Stage 2 uses: Training sample loss comparison
  - Theoretical complexity: O(deg(i)×d + deg(i)×inference)
  - Approach: UBAR paper implementation
