Device: cuda
Seed: 987654321
Looking for images in: /home/student.unimelb.edu.au/mrangwala/Projects/Sketchguard/leaf/data/celeba/data/raw/img_align_celeba
Loading 1 LEAF CelebA train files...
LEAF CelebA train: 9343 users (celebrities), 177457 samples
Looking for images in: /home/student.unimelb.edu.au/mrangwala/Projects/Sketchguard/leaf/data/celeba/data/raw/img_align_celeba
Loading 1 LEAF CelebA test files...
LEAF CelebA test: 9343 users (celebrities), 22831 samples
Found 9343 train users, 9343 test users, 9343 common users
User sample counts range: 31 (max) to 4 (min)
Distributed ALL 9343 users across 20 clients
Users per client: 467 (with 3 clients getting +1 user)
Train partition sizes: [8843, 8998, 8728, 9034, 8866, 8946, 8873, 8776, 8816, 8801, 8913, 8656, 9115, 8921, 8699, 8823, 8912, 8766, 9102, 8869]
Test partition sizes: [1140, 1158, 1127, 1158, 1134, 1145, 1145, 1127, 1136, 1128, 1144, 1125, 1152, 1160, 1124, 1145, 1154, 1131, 1157, 1141]
  Client 0: 8843 train samples, 2 unique classes
  Client 1: 8998 train samples, 2 unique classes
  Client 2: 8728 train samples, 2 unique classes
  Client 3: 9034 train samples, 2 unique classes
  Client 4: 8866 train samples, 2 unique classes
  Client 5: 8946 train samples, 2 unique classes
  Client 6: 8873 train samples, 2 unique classes
  Client 7: 8776 train samples, 2 unique classes
  Client 8: 8816 train samples, 2 unique classes
  Client 9: 8801 train samples, 2 unique classes
  Client 10: 8913 train samples, 2 unique classes
  Client 11: 8656 train samples, 2 unique classes
  Client 12: 9115 train samples, 2 unique classes
  Client 13: 8921 train samples, 2 unique classes
  Client 14: 8699 train samples, 2 unique classes
  Client 15: 8823 train samples, 2 unique classes
  Client 16: 8912 train samples, 2 unique classes
  Client 17: 8766 train samples, 2 unique classes
  Client 18: 9102 train samples, 2 unique classes
  Client 19: 8869 train samples, 2 unique classes
Will sample 4500 samples per client per epoch
Graph: fully, nodes: 20, edges: 190
Degree statistics: avg=19.00, min=19, max=19
Attack: Compromised 12/20 nodes: [1, 2, 3, 5, 8, 11, 12, 13, 14, 15, 17, 18]
Attack type: gaussian, lambda: 1.0
Model variant: baseline
Model parameters: 2,219,692
BALANCE algorithm:
Balance Config: BALANCEConfig(gamma=2, kappa=1, alpha=0.5, min_neighbors=1)
  - Model dimension: 2,219,692 parameters
  - Complexity: O(N×d) = O(20×2,219,692)
Initial test acc across nodes: mean=0.4978 ± 0.0208
Round 001: test acc mean=0.6764 ± 0.0336 | min=0.6078 max=0.7170
         : test loss mean=0.6809 ± 0.0034
         : individual accs = ['0.686842', '0.680484', '0.607808', '0.673575', '0.608466', '0.669869', '0.694323', '0.648625', '0.693662', '0.704787', '0.683566', '0.716444', '0.717014', '0.706897', '0.627224', '0.661135', '0.714038', '0.687887', '0.707865', '0.638037']
         : correct/total = [(783, 1140), (788, 1158), (685, 1127), (780, 1158), (690, 1134), (767, 1145), (795, 1145), (731, 1127), (788, 1136), (795, 1128), (782, 1144), (806, 1125), (826, 1152), (820, 1160), (705, 1124), (757, 1145), (824, 1154), (778, 1131), (819, 1157), (728, 1141)]
         : compromised: 0.6792, honest: 0.6723
Round 002: test acc mean=0.6293 ± 0.0534 | min=0.5187 max=0.7049
         : test loss mean=0.6755 ± 0.0061
         : individual accs = ['0.630702', '0.656304', '0.653949', '0.657168', '0.532628', '0.531878', '0.633188', '0.653949', '0.573063', '0.654255', '0.676573', '0.627556', '0.704861', '0.589655', '0.518683', '0.608734', '0.693241', '0.627763', '0.687122', '0.675723']
         : correct/total = [(719, 1140), (760, 1158), (737, 1127), (761, 1158), (604, 1134), (609, 1145), (725, 1145), (737, 1127), (651, 1136), (738, 1128), (774, 1144), (706, 1125), (812, 1152), (684, 1160), (583, 1124), (697, 1145), (800, 1154), (710, 1131), (795, 1157), (771, 1141)]
         : compromised: 0.6197, honest: 0.6438
Round 003: test acc mean=0.6723 ± 0.0299 | min=0.5854 max=0.7158
         : test loss mean=0.6445 ± 0.0129
         : individual accs = ['0.652632', '0.676166', '0.671695', '0.689119', '0.641093', '0.679476', '0.698690', '0.679681', '0.663732', '0.706560', '0.691434', '0.661333', '0.661458', '0.690517', '0.585409', '0.622707', '0.715771', '0.664898', '0.691443', '0.702016']
         : correct/total = [(744, 1140), (783, 1158), (757, 1127), (798, 1158), (727, 1134), (778, 1145), (800, 1145), (766, 1127), (754, 1136), (797, 1128), (791, 1144), (744, 1125), (762, 1152), (801, 1160), (658, 1124), (713, 1145), (826, 1154), (752, 1131), (800, 1157), (801, 1141)]
         : compromised: 0.6632, honest: 0.6860
Round 004: test acc mean=0.7410 ± 0.0155 | min=0.7061 max=0.7653
         : test loss mean=0.5538 ± 0.0165
         : individual accs = ['0.746491', '0.754750', '0.739130', '0.742660', '0.732804', '0.731878', '0.750218', '0.736469', '0.720951', '0.750000', '0.750874', '0.765333', '0.744792', '0.743966', '0.727758', '0.710044', '0.758232', '0.743590', '0.706137', '0.763365']
         : correct/total = [(851, 1140), (874, 1158), (833, 1127), (860, 1158), (831, 1134), (838, 1145), (859, 1145), (830, 1127), (819, 1136), (846, 1128), (859, 1144), (861, 1125), (858, 1152), (863, 1160), (818, 1124), (813, 1145), (875, 1154), (841, 1131), (817, 1157), (871, 1141)]
         : compromised: 0.7359, honest: 0.7486
Round 005: test acc mean=0.7935 ± 0.0161 | min=0.7649 max=0.8351
         : test loss mean=0.4515 ± 0.0183
         : individual accs = ['0.783333', '0.797064', '0.779059', '0.786701', '0.795414', '0.775546', '0.807860', '0.787933', '0.793134', '0.835106', '0.810315', '0.801778', '0.784722', '0.783621', '0.795374', '0.780786', '0.824090', '0.785146', '0.764909', '0.797546']
         : correct/total = [(893, 1140), (923, 1158), (878, 1127), (911, 1158), (902, 1134), (888, 1145), (925, 1145), (888, 1127), (901, 1136), (942, 1128), (927, 1144), (902, 1125), (904, 1152), (909, 1160), (894, 1124), (894, 1145), (951, 1154), (888, 1131), (885, 1157), (910, 1141)]
         : compromised: 0.7857, honest: 0.8052
Round 006: test acc mean=0.8357 ± 0.0175 | min=0.7926 max=0.8627
         : test loss mean=0.3718 ± 0.0188
         : individual accs = ['0.843860', '0.862694', '0.850044', '0.831606', '0.813051', '0.837555', '0.827948', '0.823425', '0.840669', '0.860816', '0.854021', '0.855111', '0.816840', '0.830172', '0.832740', '0.820087', '0.831023', '0.832891', '0.792567', '0.857143']
         : correct/total = [(962, 1140), (999, 1158), (958, 1127), (963, 1158), (922, 1134), (959, 1145), (948, 1145), (928, 1127), (955, 1136), (971, 1128), (977, 1144), (962, 1125), (941, 1152), (963, 1160), (936, 1124), (939, 1145), (959, 1154), (942, 1131), (917, 1157), (978, 1141)]
         : compromised: 0.8336, honest: 0.8389
Round 007: test acc mean=0.8686 ± 0.0131 | min=0.8392 max=0.8903
         : test loss mean=0.3133 ± 0.0162
         : individual accs = ['0.863158', '0.890328', '0.862467', '0.863558', '0.853616', '0.886463', '0.881223', '0.869565', '0.874120', '0.876773', '0.880245', '0.876444', '0.857639', '0.873276', '0.872776', '0.842795', '0.876083', '0.859416', '0.839239', '0.872918']
         : correct/total = [(984, 1140), (1031, 1158), (972, 1127), (1000, 1158), (968, 1134), (1015, 1145), (1009, 1145), (980, 1127), (993, 1136), (989, 1128), (1007, 1144), (986, 1125), (988, 1152), (1013, 1160), (981, 1124), (965, 1145), (1011, 1154), (972, 1131), (971, 1157), (996, 1141)]
         : compromised: 0.8665, honest: 0.8717
Round 008: test acc mean=0.8760 ± 0.0090 | min=0.8583 max=0.8923
         : test loss mean=0.2936 ± 0.0147
         : individual accs = ['0.873684', '0.887737', '0.868678', '0.867876', '0.867725', '0.891703', '0.876856', '0.879326', '0.874120', '0.881206', '0.881119', '0.885333', '0.878472', '0.871552', '0.892349', '0.864629', '0.883016', '0.867374', '0.858254', '0.869413']
         : correct/total = [(996, 1140), (1028, 1158), (979, 1127), (1005, 1158), (984, 1134), (1021, 1145), (1004, 1145), (991, 1127), (993, 1136), (994, 1128), (1008, 1144), (996, 1125), (1012, 1152), (1011, 1160), (1003, 1124), (990, 1145), (1019, 1154), (981, 1131), (993, 1157), (992, 1141)]
         : compromised: 0.8757, honest: 0.8765
Round 009: test acc mean=0.8869 ± 0.0116 | min=0.8505 max=0.9013
         : test loss mean=0.2730 ± 0.0204
         : individual accs = ['0.890351', '0.898964', '0.877551', '0.893782', '0.886243', '0.901310', '0.886463', '0.891748', '0.892606', '0.898936', '0.891608', '0.895111', '0.886285', '0.881897', '0.894128', '0.873362', '0.887348', '0.869142', '0.850475', '0.890447']
         : correct/total = [(1015, 1140), (1041, 1158), (989, 1127), (1035, 1158), (1005, 1134), (1032, 1145), (1015, 1145), (1005, 1127), (1014, 1136), (1014, 1128), (1020, 1144), (1007, 1125), (1021, 1152), (1023, 1160), (1005, 1124), (1000, 1145), (1024, 1154), (983, 1131), (984, 1157), (1016, 1141)]
         : compromised: 0.8846, honest: 0.8904
Round 010: test acc mean=0.8928 ± 0.0084 | min=0.8738 max=0.9060
         : test loss mean=0.2624 ± 0.0161
         : individual accs = ['0.898246', '0.893782', '0.884650', '0.898100', '0.886243', '0.902183', '0.886463', '0.899734', '0.896127', '0.906028', '0.894231', '0.900444', '0.895833', '0.896552', '0.901246', '0.889956', '0.889081', '0.875332', '0.873812', '0.887818']
         : correct/total = [(1024, 1140), (1035, 1158), (997, 1127), (1040, 1158), (1005, 1134), (1033, 1145), (1015, 1145), (1014, 1127), (1018, 1136), (1022, 1128), (1023, 1144), (1013, 1125), (1032, 1152), (1040, 1160), (1013, 1124), (1019, 1145), (1026, 1154), (990, 1131), (1011, 1157), (1013, 1141)]
         : compromised: 0.8923, honest: 0.8935

=== FINAL RESULTS ===
Dataset: celeba, Nodes: 20, Graph: fully, Aggregation: balance
Attack: gaussian, 60.0% compromised
Final accuracy - Compromised: 0.8923, Honest: 0.8935
Overall test accuracy: mean=0.8928 ± 0.0084

=== BALANCE SUMMARY ===
Node 0: acceptance=0.368
Node 1: acceptance=0.421
Node 2: acceptance=0.421
Node 3: acceptance=0.421
Node 4: acceptance=0.368
Node 5: acceptance=0.421
Node 6: acceptance=0.368
Node 7: acceptance=0.368
Node 8: acceptance=0.421
Node 9: acceptance=0.368
Node 10: acceptance=0.368
Node 11: acceptance=0.421
Node 12: acceptance=0.421
Node 13: acceptance=0.421
Node 14: acceptance=0.421
Node 15: acceptance=0.421
Node 16: acceptance=0.368
Node 17: acceptance=0.421
Node 18: acceptance=0.421
Node 19: acceptance=0.368

=== PARALLEL EXECUTION TIME (realistic for distributed system) ===
  COMMUNICATION (max across nodes):
    - Full model transfer: 0.000s (0.0%)
  COMPUTATION (max across nodes):
    - Filtering: 0.057s (82.2%)
    - Aggregation: 0.012s (17.8%)
  TOTALS:
    - Total computation: 0.069s (100.0%)
    - Total communication: 0.000s (0.0%)
    - Total parallel time: 0.069s

=== PER-NODE AVERAGE TIME ===
  - Filtering: 0.049s
  - Aggregation: 0.005s
  - Model transfer: 0.000s
  - Total per node: 0.055s

=== TOTAL COMPUTATIONAL WORK (sum across all nodes) ===
  - Total filtering: 0.983s
  - Total aggregation: 0.109s
  - Total model transfer: 0.000s
  - Grand total: 1.093s
  - Mean acceptance rate: 0.400

BALANCE Algorithm Properties:
  - Model dimension: 2,219,692
  - No compression: Full parameter comparison
  - Theoretical complexity: O(deg(i)×d)
  - Approach: Full parameter filtering + averaging
