Device: cuda
Seed: 987654321
Loading 36 LEAF FEMNIST train files...
LEAF FEMNIST train: 3597 users, 734463 samples
Loading 36 LEAF FEMNIST test files...
LEAF FEMNIST test: 3597 users, 83388 samples
Found 3597 train users, 3597 test users, 3597 common users
User sample counts range: 525 (max) to 17 (min)
Distributed ALL 3597 users across 20 clients
Users per client: 179 (with 17 clients getting +1 user)
Train partition sizes: [36360, 37070, 35957, 38262, 36024, 37732, 36921, 38328, 36867, 37683, 36507, 36915, 36007, 37001, 35681, 35453, 36585, 36801, 35964, 36345]
Test partition sizes: [4128, 4203, 4081, 4333, 4091, 4287, 4193, 4349, 4191, 4277, 4143, 4193, 4093, 4197, 4052, 4029, 4153, 4183, 4084, 4128]
  Client 0: 36360 train samples, 62 unique classes
  Client 1: 37070 train samples, 62 unique classes
  Client 2: 35957 train samples, 62 unique classes
  Client 3: 38262 train samples, 62 unique classes
  Client 4: 36024 train samples, 62 unique classes
  Client 5: 37732 train samples, 62 unique classes
  Client 6: 36921 train samples, 62 unique classes
  Client 7: 38328 train samples, 62 unique classes
  Client 8: 36867 train samples, 62 unique classes
  Client 9: 37683 train samples, 62 unique classes
  Client 10: 36507 train samples, 62 unique classes
  Client 11: 36915 train samples, 62 unique classes
  Client 12: 36007 train samples, 62 unique classes
  Client 13: 37001 train samples, 62 unique classes
  Client 14: 35681 train samples, 62 unique classes
  Client 15: 35453 train samples, 62 unique classes
  Client 16: 36585 train samples, 62 unique classes
  Client 17: 36801 train samples, 62 unique classes
  Client 18: 35964 train samples, 62 unique classes
  Client 19: 36345 train samples, 62 unique classes
Will sample 10000 samples per client per epoch
Graph: ring, nodes: 20, edges: 20
Degree statistics: avg=2.00, min=2, max=2
Attack: Compromised 16/20 nodes: [1, 2, 3, 5, 6, 8, 9, 10, 11, 12, 13, 14, 15, 17, 18, 19]
Attack type: directed_deviation, lambda: 1.0
Model variant: baseline
Model parameters: 6,603,710
Initial test acc across nodes: mean=0.0168 ± 0.0139
Round 001: test acc mean=0.0095 ± 0.0070 | min=0.0020 max=0.0323
         : test loss mean=149045.7785 ± 120594.5986
         : individual accs = ['0.003391', '0.008089', '0.003676', '0.012924', '0.001956', '0.011663', '0.005247', '0.019775', '0.015748', '0.003273', '0.003862', '0.007870', '0.014903', '0.009292', '0.006417', '0.004716', '0.032266', '0.005498', '0.007591', '0.012597']
         : correct/total = [(14, 4128), (34, 4203), (15, 4081), (56, 4333), (8, 4091), (50, 4287), (22, 4193), (86, 4349), (66, 4191), (14, 4277), (16, 4143), (33, 4193), (61, 4093), (39, 4197), (26, 4052), (19, 4029), (134, 4153), (23, 4183), (31, 4084), (52, 4128)]
         : compromised: 0.0083, honest: 0.0143
Round 002: test acc mean=0.0494 ± 0.0041 | min=0.0426 max=0.0578
         : test loss mean=nan ± nan
         : individual accs = ['0.045785', '0.042589', '0.053418', '0.047773', '0.044977', '0.057849', '0.053899', '0.043918', '0.051539', '0.043488', '0.048033', '0.049606', '0.054239', '0.049083', '0.051826', '0.051626', '0.052011', '0.049486', '0.052889', '0.044331']
         : correct/total = [(189, 4128), (179, 4203), (218, 4081), (207, 4333), (184, 4091), (248, 4287), (226, 4193), (191, 4349), (216, 4191), (186, 4277), (199, 4143), (208, 4193), (222, 4093), (206, 4197), (210, 4052), (208, 4029), (216, 4153), (207, 4183), (216, 4084), (183, 4128)]
         : compromised: 0.0501, honest: 0.0467
Round 003: test acc mean=0.0492 ± 0.0036 | min=0.0430 max=0.0542
         : test loss mean=nan ± nan
         : individual accs = ['0.049176', '0.047109', '0.053418', '0.043157', '0.043021', '0.045253', '0.053899', '0.043918', '0.051539', '0.043488', '0.048033', '0.049606', '0.054239', '0.049083', '0.051826', '0.051626', '0.052011', '0.049486', '0.052889', '0.050388']
         : correct/total = [(203, 4128), (198, 4203), (218, 4081), (187, 4333), (176, 4091), (194, 4287), (226, 4193), (191, 4349), (216, 4191), (186, 4277), (199, 4143), (208, 4193), (222, 4093), (206, 4197), (210, 4052), (208, 4029), (216, 4153), (207, 4183), (216, 4084), (208, 4128)]
         : compromised: 0.0497, honest: 0.0470
Round 004: test acc mean=0.0495 ± 0.0038 | min=0.0430 max=0.0545
         : test loss mean=nan ± nan
         : individual accs = ['0.050145', '0.048775', '0.053418', '0.043157', '0.043021', '0.045253', '0.053899', '0.043918', '0.051539', '0.043488', '0.048033', '0.049606', '0.054239', '0.049083', '0.051826', '0.051626', '0.052011', '0.049486', '0.052889', '0.054506']
         : correct/total = [(207, 4128), (205, 4203), (218, 4081), (187, 4333), (176, 4091), (194, 4287), (226, 4193), (191, 4349), (216, 4191), (186, 4277), (199, 4143), (208, 4193), (222, 4093), (206, 4197), (210, 4052), (208, 4029), (216, 4153), (207, 4183), (216, 4084), (225, 4128)]
         : compromised: 0.0501, honest: 0.0473
Round 005: test acc mean=0.0494 ± 0.0034 | min=0.0430 max=0.0545
         : test loss mean=nan ± nan
         : individual accs = ['0.050145', '0.048775', '0.053418', '0.043157', '0.043021', '0.045253', '0.049130', '0.051276', '0.047960', '0.043488', '0.048033', '0.049606', '0.054239', '0.049083', '0.051826', '0.051626', '0.052011', '0.049486', '0.052889', '0.054506']
         : correct/total = [(207, 4128), (205, 4203), (218, 4081), (187, 4333), (176, 4091), (194, 4287), (206, 4193), (223, 4349), (201, 4191), (186, 4277), (199, 4143), (208, 4193), (222, 4093), (206, 4197), (210, 4052), (208, 4029), (216, 4153), (207, 4183), (216, 4084), (225, 4128)]
         : compromised: 0.0495, honest: 0.0491
Round 006: test acc mean=0.0433 ± 0.0135 | min=0.0100 max=0.0542
         : test loss mean=nan ± nan
         : individual accs = ['0.044574', '0.046158', '0.053418', '0.043157', '0.043021', '0.045253', '0.010017', '0.013796', '0.012646', '0.043488', '0.048033', '0.049606', '0.054239', '0.049083', '0.051826', '0.051626', '0.052011', '0.049486', '0.052889', '0.050872']
         : correct/total = [(184, 4128), (194, 4203), (218, 4081), (187, 4333), (176, 4091), (194, 4287), (42, 4193), (60, 4349), (53, 4191), (186, 4277), (199, 4143), (208, 4193), (222, 4093), (206, 4197), (210, 4052), (208, 4029), (216, 4153), (207, 4183), (216, 4084), (210, 4128)]
         : compromised: 0.0445, honest: 0.0384
Round 007: test acc mean=0.0477 ± 0.0043 | min=0.0408 max=0.0542
         : test loss mean=nan ± nan
         : individual accs = ['0.044574', '0.046158', '0.053418', '0.043157', '0.043021', '0.045253', '0.042213', '0.041619', '0.040802', '0.043488', '0.048033', '0.049606', '0.054239', '0.049083', '0.051826', '0.051626', '0.052011', '0.049486', '0.052889', '0.050872']
         : correct/total = [(184, 4128), (194, 4203), (218, 4081), (187, 4333), (176, 4091), (194, 4287), (177, 4193), (181, 4349), (171, 4191), (186, 4277), (199, 4143), (208, 4193), (222, 4093), (206, 4197), (210, 4052), (208, 4029), (216, 4153), (207, 4183), (216, 4084), (210, 4128)]
         : compromised: 0.0483, honest: 0.0453
Round 008: test acc mean=0.0441 ± 0.0133 | min=0.0134 max=0.0545
         : test loss mean=nan ± nan
         : individual accs = ['0.050145', '0.048775', '0.053418', '0.043157', '0.043021', '0.045253', '0.013356', '0.013796', '0.013362', '0.043488', '0.048033', '0.049606', '0.054239', '0.049083', '0.051826', '0.051626', '0.052011', '0.049486', '0.052889', '0.054506']
         : correct/total = [(207, 4128), (205, 4203), (218, 4081), (187, 4333), (176, 4091), (194, 4287), (56, 4193), (60, 4349), (56, 4191), (186, 4277), (199, 4143), (208, 4193), (222, 4093), (206, 4197), (210, 4052), (208, 4029), (216, 4153), (207, 4183), (216, 4084), (225, 4128)]
         : compromised: 0.0451, honest: 0.0397
Round 009: test acc mean=0.0485 ± 0.0037 | min=0.0422 max=0.0542
         : test loss mean=nan ± nan
         : individual accs = ['0.049176', '0.047109', '0.053418', '0.043157', '0.043021', '0.045253', '0.044598', '0.049207', '0.042233', '0.043488', '0.048033', '0.049606', '0.054239', '0.049083', '0.051826', '0.051626', '0.052011', '0.049486', '0.052889', '0.050388']
         : correct/total = [(203, 4128), (198, 4203), (218, 4081), (187, 4333), (176, 4091), (194, 4287), (187, 4193), (214, 4349), (177, 4191), (186, 4277), (199, 4143), (208, 4193), (222, 4093), (206, 4197), (210, 4052), (208, 4029), (216, 4153), (207, 4183), (216, 4084), (208, 4128)]
         : compromised: 0.0485, honest: 0.0484
Round 010: test acc mean=0.0502 ± 0.0044 | min=0.0430 max=0.0596
         : test loss mean=nan ± nan
         : individual accs = ['0.059593', '0.052344', '0.053418', '0.043157', '0.043021', '0.045253', '0.046745', '0.047827', '0.054880', '0.043488', '0.048033', '0.049606', '0.054239', '0.049083', '0.051826', '0.051626', '0.052011', '0.049486', '0.052889', '0.055475']
         : correct/total = [(246, 4128), (220, 4203), (218, 4081), (187, 4333), (176, 4091), (194, 4287), (196, 4193), (208, 4349), (230, 4191), (186, 4277), (199, 4143), (208, 4193), (222, 4093), (206, 4197), (210, 4052), (208, 4029), (216, 4153), (207, 4183), (216, 4084), (229, 4128)]
         : compromised: 0.0501, honest: 0.0506

=== FINAL RESULTS ===
Dataset: femnist, Nodes: 20, Graph: ring, Aggregation: krum
Attack: directed_deviation, 80.0% compromised
Final accuracy - Compromised: 0.0501, Honest: 0.0506
Overall test accuracy: mean=0.0502 ± 0.0044
