Device: cuda
Seed: 987654321
Loading 36 LEAF FEMNIST train files...
LEAF FEMNIST train: 3597 users, 734463 samples
Loading 36 LEAF FEMNIST test files...
LEAF FEMNIST test: 3597 users, 83388 samples
Found 3597 train users, 3597 test users, 3597 common users
User sample counts range: 525 (max) to 17 (min)
Distributed ALL 3597 users across 20 clients
Users per client: 179 (with 17 clients getting +1 user)
Train partition sizes: [36360, 37070, 35957, 38262, 36024, 37732, 36921, 38328, 36867, 37683, 36507, 36915, 36007, 37001, 35681, 35453, 36585, 36801, 35964, 36345]
Test partition sizes: [4128, 4203, 4081, 4333, 4091, 4287, 4193, 4349, 4191, 4277, 4143, 4193, 4093, 4197, 4052, 4029, 4153, 4183, 4084, 4128]
  Client 0: 36360 train samples, 62 unique classes
  Client 1: 37070 train samples, 62 unique classes
  Client 2: 35957 train samples, 62 unique classes
  Client 3: 38262 train samples, 62 unique classes
  Client 4: 36024 train samples, 62 unique classes
  Client 5: 37732 train samples, 62 unique classes
  Client 6: 36921 train samples, 62 unique classes
  Client 7: 38328 train samples, 62 unique classes
  Client 8: 36867 train samples, 62 unique classes
  Client 9: 37683 train samples, 62 unique classes
  Client 10: 36507 train samples, 62 unique classes
  Client 11: 36915 train samples, 62 unique classes
  Client 12: 36007 train samples, 62 unique classes
  Client 13: 37001 train samples, 62 unique classes
  Client 14: 35681 train samples, 62 unique classes
  Client 15: 35453 train samples, 62 unique classes
  Client 16: 36585 train samples, 62 unique classes
  Client 17: 36801 train samples, 62 unique classes
  Client 18: 35964 train samples, 62 unique classes
  Client 19: 36345 train samples, 62 unique classes
Will sample 10000 samples per client per epoch
Graph: erdos, nodes: 20, edges: 48
Degree statistics: avg=4.80, min=2, max=7
Attack: Compromised 6/20 nodes: [5, 12, 13, 14, 17, 18]
Attack type: backdoor, lambda: 1.0
Backdoor target label: 0, trigger size: 4
Model variant: baseline
Model parameters: 6,603,710
Sketchguard Node 0:
  Model dim: 6,603,710 → Sketch size: 1000
  Compression ratio: 6603.7x
  Using model parameters for aggregation, sketches for filtering
Sketchguard Node 1:
  Model dim: 6,603,710 → Sketch size: 1000
  Compression ratio: 6603.7x
  Using model parameters for aggregation, sketches for filtering
Sketchguard Node 2:
  Model dim: 6,603,710 → Sketch size: 1000
  Compression ratio: 6603.7x
  Using model parameters for aggregation, sketches for filtering
Sketchguard Node 3:
  Model dim: 6,603,710 → Sketch size: 1000
  Compression ratio: 6603.7x
  Using model parameters for aggregation, sketches for filtering
Sketchguard Node 4:
  Model dim: 6,603,710 → Sketch size: 1000
  Compression ratio: 6603.7x
  Using model parameters for aggregation, sketches for filtering
Sketchguard Node 5:
  Model dim: 6,603,710 → Sketch size: 1000
  Compression ratio: 6603.7x
  Using model parameters for aggregation, sketches for filtering
Sketchguard Node 6:
  Model dim: 6,603,710 → Sketch size: 1000
  Compression ratio: 6603.7x
  Using model parameters for aggregation, sketches for filtering
Sketchguard Node 7:
  Model dim: 6,603,710 → Sketch size: 1000
  Compression ratio: 6603.7x
  Using model parameters for aggregation, sketches for filtering
Sketchguard Node 8:
  Model dim: 6,603,710 → Sketch size: 1000
  Compression ratio: 6603.7x
  Using model parameters for aggregation, sketches for filtering
Sketchguard Node 9:
  Model dim: 6,603,710 → Sketch size: 1000
  Compression ratio: 6603.7x
  Using model parameters for aggregation, sketches for filtering
Sketchguard Node 10:
  Model dim: 6,603,710 → Sketch size: 1000
  Compression ratio: 6603.7x
  Using model parameters for aggregation, sketches for filtering
Sketchguard Node 11:
  Model dim: 6,603,710 → Sketch size: 1000
  Compression ratio: 6603.7x
  Using model parameters for aggregation, sketches for filtering
Sketchguard Node 12:
  Model dim: 6,603,710 → Sketch size: 1000
  Compression ratio: 6603.7x
  Using model parameters for aggregation, sketches for filtering
Sketchguard Node 13:
  Model dim: 6,603,710 → Sketch size: 1000
  Compression ratio: 6603.7x
  Using model parameters for aggregation, sketches for filtering
Sketchguard Node 14:
  Model dim: 6,603,710 → Sketch size: 1000
  Compression ratio: 6603.7x
  Using model parameters for aggregation, sketches for filtering
Sketchguard Node 15:
  Model dim: 6,603,710 → Sketch size: 1000
  Compression ratio: 6603.7x
  Using model parameters for aggregation, sketches for filtering
Sketchguard Node 16:
  Model dim: 6,603,710 → Sketch size: 1000
  Compression ratio: 6603.7x
  Using model parameters for aggregation, sketches for filtering
Sketchguard Node 17:
  Model dim: 6,603,710 → Sketch size: 1000
  Compression ratio: 6603.7x
  Using model parameters for aggregation, sketches for filtering
Sketchguard Node 18:
  Model dim: 6,603,710 → Sketch size: 1000
  Compression ratio: 6603.7x
  Using model parameters for aggregation, sketches for filtering
Sketchguard Node 19:
  Model dim: 6,603,710 → Sketch size: 1000
  Compression ratio: 6603.7x
  Using model parameters for aggregation, sketches for filtering
Sketchguard ALGORITHM (Sketch-based Filtering + State Aggregation)
  - Model dimension: 6,603,710 parameters
  - Config: SketchguardConfig(gamma=2, kappa=1, alpha=0.5, min_neighbors=1, sketch_size=1000, network_seed=987654321, attack_detection_window=5)
  - Sketch size: 1000
  - Compression ratio: 6603.7x
  - Complexity: O(d + N×k) = O(6,603,710 + 20×1000)
  - Theoretical speedup vs BALANCE: 19.9x
Initial test acc across nodes: mean=0.0162 ± 0.0138
Backdoor attack: Created poisoned datasets for 6 compromised nodes
Round 001: test acc mean=0.3500 ± 0.1576 | min=0.0474 max=0.5223
         : test loss mean=5198.4691 ± 8141.9397
         : individual accs = ['0.522287', '0.478706', '0.487381', '0.419109', '0.446346', '0.169582', '0.454090', '0.429984', '0.413982', '0.417816', '0.397538', '0.521822', '0.047398', '0.047653', '0.167078', '0.482502', '0.406935', '0.179297', '0.109207', '0.402132']
         : correct/total = [(2156, 4128), (2012, 4203), (1989, 4081), (1816, 4333), (1826, 4091), (727, 4287), (1904, 4193), (1870, 4349), (1735, 4191), (1787, 4277), (1647, 4143), (2188, 4193), (194, 4093), (200, 4197), (677, 4052), (1944, 4029), (1690, 4153), (750, 4183), (446, 4084), (1660, 4128)]
         : compromised: 0.1200, honest: 0.4486
         : sketchguard stats = ['Node 0: acc_rate=0.833', 'Node 1: acc_rate=1.000', 'Node 2: acc_rate=0.600']...
Round 002: test acc mean=0.4937 ± 0.2959 | min=0.0036 max=0.7191
         : test loss mean=100008.6585 ± 435354.0913
         : individual accs = ['0.705911', '0.709255', '0.681451', '0.700900', '0.659008', '0.045486', '0.663725', '0.675558', '0.702935', '0.698153', '0.696114', '0.719056', '0.048131', '0.003574', '0.052320', '0.684537', '0.673007', '0.047574', '0.059745', '0.648498']
         : correct/total = [(2914, 4128), (2981, 4203), (2781, 4081), (3037, 4333), (2696, 4091), (195, 4287), (2783, 4193), (2938, 4349), (2946, 4191), (2986, 4277), (2884, 4143), (3015, 4193), (197, 4093), (15, 4197), (212, 4052), (2758, 4029), (2795, 4153), (199, 4183), (244, 4084), (2677, 4128)]
         : compromised: 0.0428, honest: 0.6870
         : sketchguard stats = ['Node 0: acc_rate=0.833', 'Node 1: acc_rate=1.000', 'Node 2: acc_rate=0.600']...
Round 003: test acc mean=0.5340 ± 0.3165 | min=0.0479 max=0.7791
         : test loss mean=nan ± nan
         : individual accs = ['0.765019', '0.747799', '0.733399', '0.741519', '0.708140', '0.052484', '0.740758', '0.724304', '0.779050', '0.725275', '0.733285', '0.748629', '0.048131', '0.053848', '0.047878', '0.713577', '0.752468', '0.052116', '0.051910', '0.759932']
         : correct/total = [(3158, 4128), (3143, 4203), (2993, 4081), (3213, 4333), (2897, 4091), (225, 4287), (3106, 4193), (3150, 4349), (3265, 4191), (3102, 4277), (3038, 4143), (3139, 4193), (197, 4093), (226, 4197), (194, 4052), (2875, 4029), (3125, 4153), (218, 4183), (212, 4084), (3137, 4128)]
         : compromised: 0.0511, honest: 0.7409
         : sketchguard stats = ['Node 0: acc_rate=0.833', 'Node 1: acc_rate=1.000', 'Node 2: acc_rate=0.600']...
Round 004: test acc mean=0.5565 ± 0.3311 | min=0.0474 max=0.8051
         : test loss mean=nan ± nan
         : individual accs = ['0.777616', '0.780157', '0.771380', '0.766444', '0.771450', '0.052484', '0.770093', '0.780179', '0.805058', '0.762684', '0.755008', '0.758884', '0.047398', '0.047653', '0.054788', '0.779102', '0.764989', '0.049247', '0.054358', '0.780766']
         : correct/total = [(3210, 4128), (3279, 4203), (3148, 4081), (3321, 4333), (3156, 4091), (225, 4287), (3229, 4193), (3393, 4349), (3374, 4191), (3262, 4277), (3128, 4143), (3182, 4193), (194, 4093), (200, 4197), (222, 4052), (3139, 4029), (3177, 4153), (206, 4183), (222, 4084), (3223, 4128)]
         : compromised: 0.0510, honest: 0.7731
         : sketchguard stats = ['Node 0: acc_rate=0.833', 'Node 1: acc_rate=1.000', 'Node 2: acc_rate=0.600']...
Round 005: test acc mean=0.5673 ± 0.3382 | min=0.0474 max=0.8201
         : test loss mean=nan ± nan
         : individual accs = ['0.791667', '0.783964', '0.767214', '0.792292', '0.771938', '0.052484', '0.783449', '0.782939', '0.820091', '0.794014', '0.778421', '0.780348', '0.047398', '0.047653', '0.054788', '0.788533', '0.802793', '0.049247', '0.054358', '0.802568']
         : correct/total = [(3268, 4128), (3295, 4203), (3131, 4081), (3433, 4333), (3158, 4091), (225, 4287), (3285, 4193), (3405, 4349), (3437, 4191), (3396, 4277), (3225, 4143), (3272, 4193), (194, 4093), (200, 4197), (222, 4052), (3177, 4029), (3334, 4153), (206, 4183), (222, 4084), (3313, 4128)]
         : compromised: 0.0510, honest: 0.7886
         : sketchguard stats = ['Node 0: acc_rate=0.833', 'Node 1: acc_rate=1.000', 'Node 2: acc_rate=0.600']...
Round 006: test acc mean=0.5798 ± 0.3463 | min=0.0474 max=0.8232
         : test loss mean=nan ± nan
         : individual accs = ['0.791424', '0.803950', '0.790738', '0.812139', '0.798093', '0.052484', '0.810160', '0.810301', '0.823193', '0.812485', '0.799903', '0.802051', '0.047398', '0.047653', '0.054788', '0.813105', '0.819167', '0.049247', '0.054358', '0.803537']
         : correct/total = [(3267, 4128), (3379, 4203), (3227, 4081), (3519, 4333), (3265, 4091), (225, 4287), (3397, 4193), (3524, 4349), (3450, 4191), (3475, 4277), (3314, 4143), (3363, 4193), (194, 4093), (200, 4197), (222, 4052), (3276, 4029), (3402, 4153), (206, 4183), (222, 4084), (3317, 4128)]
         : compromised: 0.0510, honest: 0.8064
         : sketchguard stats = ['Node 0: acc_rate=0.833', 'Node 1: acc_rate=1.000', 'Node 2: acc_rate=0.600']...
Round 007: test acc mean=0.5876 ± 0.3514 | min=0.0474 max=0.8284
         : test loss mean=nan ± nan
         : individual accs = ['0.817587', '0.820366', '0.795393', '0.824371', '0.809338', '0.052484', '0.819223', '0.823638', '0.823431', '0.828384', '0.804972', '0.822561', '0.047398', '0.047653', '0.054788', '0.823778', '0.828076', '0.049247', '0.054358', '0.805233']
         : correct/total = [(3375, 4128), (3448, 4203), (3246, 4081), (3572, 4333), (3311, 4091), (225, 4287), (3435, 4193), (3582, 4349), (3451, 4191), (3543, 4277), (3335, 4143), (3449, 4193), (194, 4093), (200, 4197), (222, 4052), (3319, 4029), (3439, 4153), (206, 4183), (222, 4084), (3324, 4128)]
         : compromised: 0.0510, honest: 0.8176
         : sketchguard stats = ['Node 0: acc_rate=0.833', 'Node 1: acc_rate=1.000', 'Node 2: acc_rate=0.600']...
Round 008: test acc mean=0.5907 ± 0.3534 | min=0.0474 max=0.8324
         : test loss mean=nan ± nan
         : individual accs = ['0.813953', '0.821318', '0.809605', '0.831987', '0.815937', '0.052484', '0.829239', '0.827087', '0.830589', '0.832359', '0.810765', '0.829239', '0.047398', '0.047653', '0.054788', '0.831968', '0.821334', '0.049247', '0.054358', '0.803052']
         : correct/total = [(3360, 4128), (3452, 4203), (3304, 4081), (3605, 4333), (3338, 4091), (225, 4287), (3477, 4193), (3597, 4349), (3481, 4191), (3560, 4277), (3359, 4143), (3477, 4193), (194, 4093), (200, 4197), (222, 4052), (3352, 4029), (3411, 4153), (206, 4183), (222, 4084), (3315, 4128)]
         : compromised: 0.0510, honest: 0.8220
         : sketchguard stats = ['Node 0: acc_rate=0.833', 'Node 1: acc_rate=1.000', 'Node 2: acc_rate=0.600']...
Round 009: test acc mean=0.5975 ± 0.3578 | min=0.0474 max=0.8440
         : test loss mean=nan ± nan
         : individual accs = ['0.821948', '0.837735', '0.826268', '0.835218', '0.826937', '0.052484', '0.838063', '0.834445', '0.842281', '0.844050', '0.823558', '0.831624', '0.047398', '0.047653', '0.054788', '0.833954', '0.823020', '0.049247', '0.054358', '0.825097']
         : correct/total = [(3393, 4128), (3521, 4203), (3372, 4081), (3619, 4333), (3383, 4091), (225, 4287), (3514, 4193), (3629, 4349), (3530, 4191), (3610, 4277), (3412, 4143), (3487, 4193), (194, 4093), (200, 4197), (222, 4052), (3360, 4029), (3418, 4153), (206, 4183), (222, 4084), (3406, 4128)]
         : compromised: 0.0510, honest: 0.8317
         : sketchguard stats = ['Node 0: acc_rate=0.833', 'Node 1: acc_rate=1.000', 'Node 2: acc_rate=0.600']...
Round 010: test acc mean=0.6017 ± 0.3606 | min=0.0474 max=0.8475
         : test loss mean=nan ± nan
         : individual accs = ['0.831395', '0.842969', '0.835334', '0.840295', '0.831826', '0.052484', '0.843549', '0.842263', '0.847530', '0.844517', '0.827178', '0.834248', '0.047398', '0.047653', '0.054788', '0.843137', '0.834818', '0.049247', '0.054358', '0.829700']
         : correct/total = [(3432, 4128), (3543, 4203), (3409, 4081), (3641, 4333), (3403, 4091), (225, 4287), (3537, 4193), (3663, 4349), (3552, 4191), (3612, 4277), (3427, 4143), (3498, 4193), (194, 4093), (200, 4197), (222, 4052), (3397, 4029), (3467, 4153), (206, 4183), (222, 4084), (3425, 4128)]
         : compromised: 0.0510, honest: 0.8378
         : sketchguard stats = ['Node 0: acc_rate=0.833', 'Node 1: acc_rate=1.000', 'Node 2: acc_rate=0.600']...

=== FINAL RESULTS ===
Dataset: femnist, Nodes: 20, Graph: erdos, Aggregation: sketchguard
Attack: backdoor, 30.0% compromised
Final accuracy - Compromised: 0.0510, Honest: 0.8378
Overall test accuracy: mean=0.6017 ± 0.3606

=== BACKDOOR ATTACK SUCCESS RATE (ASR) ===
Target label: 0
Trigger size: 4x4
Overall ASR: 0.3385 ± 0.4331
Honest nodes ASR: 0.0550 ± 0.0036
Compromised nodes ASR: 1.0000 ± 0.0000
Note: Higher ASR indicates more successful backdoor attack

=== Sketchguard SUMMARY ===
Node 0: acceptance=0.833
Node 1: acceptance=1.000
Node 2: acceptance=0.600
Node 3: acceptance=0.750
Node 4: acceptance=0.500
Node 5: acceptance=0.240
Node 6: acceptance=0.800
Node 7: acceptance=0.600
Node 8: acceptance=0.500
Node 9: acceptance=1.000
Node 10: acceptance=0.750
Node 11: acceptance=0.571
Node 12: acceptance=0.271
Node 13: acceptance=0.275
Node 14: acceptance=0.243
Node 15: acceptance=0.500
Node 16: acceptance=0.400
Node 17: acceptance=0.260
Node 18: acceptance=0.300
Node 19: acceptance=1.000

=== PARALLEL EXECUTION TIME (realistic for distributed system) ===
  COMMUNICATION (max across nodes):
    - Sketch transfer: 0.000s (0.0%)
    - Model fetch (accepted): 0.000s (0.0%)
  COMPUTATION (max across nodes):
    - Sketching: 2.489s (99.2%)
    - Filtering: 0.001s (0.0%)
    - Aggregation: 0.018s (0.7%)
  TOTALS:
    - Total computation: 2.508s (100.0%)
    - Total communication: 0.000s (0.0%)
    - Total parallel time: 2.508s

=== PER-NODE AVERAGE TIME ===
  - Sketching: 1.599s
  - Filtering: 0.001s
  - Aggregation: 0.009s
  - Sketch transfer: 0.000s
  - Model fetch: 0.000s
  - Total per node: 1.609s

=== TOTAL COMPUTATIONAL WORK (sum across all nodes) ===
  - Total sketching: 31.972s
  - Total filtering: 0.013s
  - Total aggregation: 0.189s
  - Total sketch transfer: 0.000s
  - Total model fetch: 0.000s
  - Grand total: 32.174s
  - Mean acceptance rate: 0.570

Sketchguard Algorithm Properties:
  - Original dimension: 6,603,710
  - Sketch size: 1000
  - Compression ratio: 19.9x
  - Single repetition: No repetitions needed
  - Theoretical complexity: O(d + N×k)
  - Approach: Sketch filtering + state aggregation
