Device: cuda
Seed: 987654321
Loading 36 LEAF FEMNIST train files...
LEAF FEMNIST train: 3597 users, 734463 samples
Loading 36 LEAF FEMNIST test files...
LEAF FEMNIST test: 3597 users, 83388 samples
Found 3597 train users, 3597 test users, 3597 common users
User sample counts range: 525 (max) to 17 (min)
Distributed ALL 3597 users across 20 clients
Users per client: 179 (with 17 clients getting +1 user)
Train partition sizes: [36360, 37070, 35957, 38262, 36024, 37732, 36921, 38328, 36867, 37683, 36507, 36915, 36007, 37001, 35681, 35453, 36585, 36801, 35964, 36345]
Test partition sizes: [4128, 4203, 4081, 4333, 4091, 4287, 4193, 4349, 4191, 4277, 4143, 4193, 4093, 4197, 4052, 4029, 4153, 4183, 4084, 4128]
  Client 0: 36360 train samples, 62 unique classes
  Client 1: 37070 train samples, 62 unique classes
  Client 2: 35957 train samples, 62 unique classes
  Client 3: 38262 train samples, 62 unique classes
  Client 4: 36024 train samples, 62 unique classes
  Client 5: 37732 train samples, 62 unique classes
  Client 6: 36921 train samples, 62 unique classes
  Client 7: 38328 train samples, 62 unique classes
  Client 8: 36867 train samples, 62 unique classes
  Client 9: 37683 train samples, 62 unique classes
  Client 10: 36507 train samples, 62 unique classes
  Client 11: 36915 train samples, 62 unique classes
  Client 12: 36007 train samples, 62 unique classes
  Client 13: 37001 train samples, 62 unique classes
  Client 14: 35681 train samples, 62 unique classes
  Client 15: 35453 train samples, 62 unique classes
  Client 16: 36585 train samples, 62 unique classes
  Client 17: 36801 train samples, 62 unique classes
  Client 18: 35964 train samples, 62 unique classes
  Client 19: 36345 train samples, 62 unique classes
Will sample 10000 samples per client per epoch
Graph: erdos, nodes: 20, edges: 48
Degree statistics: avg=4.80, min=2, max=7
Attack: Compromised 4/20 nodes: [5, 12, 13, 17]
Attack type: directed_deviation, lambda: 1.0
Model variant: baseline
Model parameters: 6,603,710
Initial test acc across nodes: mean=0.0162 ± 0.0138
Round 001: test acc mean=0.4994 ± 0.1517 | min=0.0399 max=0.5860
         : test loss mean=31276.1811 ± 94096.4635
         : individual accs = ['0.542878', '0.555556', '0.546190', '0.534964', '0.553899', '0.039888', '0.543763', '0.556450', '0.586018', '0.541501', '0.508810', '0.546148', '0.553872', '0.584227', '0.055281', '0.554480', '0.533590', '0.540521', '0.581538', '0.527616']
         : correct/total = [(2241, 4128), (2335, 4203), (2229, 4081), (2318, 4333), (2266, 4091), (171, 4287), (2280, 4193), (2420, 4349), (2456, 4191), (2316, 4277), (2108, 4143), (2290, 4193), (2267, 4093), (2452, 4197), (224, 4052), (2234, 4029), (2216, 4153), (2261, 4183), (2375, 4084), (2178, 4128)]
         : compromised: 0.4296, honest: 0.5168
Round 002: test acc mean=0.6680 ± 0.2085 | min=0.0425 max=0.7548
         : test loss mean=241976106345.7130 ± 1052474882858.9078
         : individual accs = ['0.742248', '0.743517', '0.734624', '0.745442', '0.711806', '0.042454', '0.754591', '0.734882', '0.731806', '0.737667', '0.741974', '0.754829', '0.725873', '0.751489', '0.044669', '0.735666', '0.701180', '0.745876', '0.745103', '0.733527']
         : correct/total = [(3064, 4128), (3125, 4203), (2998, 4081), (3230, 4333), (2912, 4091), (182, 4287), (3164, 4193), (3196, 4349), (3067, 4191), (3155, 4277), (3074, 4143), (3165, 4193), (2971, 4093), (3154, 4197), (181, 4052), (2964, 4029), (2912, 4153), (3120, 4183), (3043, 4084), (3028, 4128)]
         : compromised: 0.5664, honest: 0.6933
Round 003: test acc mean=0.7071 ± 0.2189 | min=0.0491 max=0.7935
         : test loss mean=10663.1737 ± 32087.7877
         : individual accs = ['0.774225', '0.793481', '0.777015', '0.792292', '0.764605', '0.052951', '0.791319', '0.776040', '0.789549', '0.790274', '0.772146', '0.788695', '0.773271', '0.779366', '0.049112', '0.792753', '0.784012', '0.773368', '0.762243', '0.765746']
         : correct/total = [(3196, 4128), (3335, 4203), (3171, 4081), (3433, 4333), (3128, 4091), (227, 4287), (3318, 4193), (3375, 4349), (3309, 4191), (3380, 4277), (3199, 4143), (3307, 4193), (3165, 4093), (3271, 4197), (199, 4052), (3194, 4029), (3256, 4153), (3235, 4183), (3113, 4084), (3161, 4128)]
         : compromised: 0.5947, honest: 0.7352
Round 004: test acc mean=0.7260 ± 0.2252 | min=0.0455 max=0.8146
         : test loss mean=1116878.0377 ± 4856067.6263
         : individual accs = ['0.792393', '0.807043', '0.799069', '0.802446', '0.793693', '0.045486', '0.811591', '0.810991', '0.814603', '0.808978', '0.797248', '0.793942', '0.795260', '0.796283', '0.056269', '0.810375', '0.793884', '0.777193', '0.804848', '0.808866']
         : correct/total = [(3271, 4128), (3392, 4203), (3261, 4081), (3477, 4333), (3247, 4091), (195, 4287), (3403, 4193), (3527, 4349), (3414, 4191), (3460, 4277), (3303, 4143), (3329, 4193), (3255, 4093), (3342, 4197), (228, 4052), (3265, 4029), (3297, 4153), (3251, 4183), (3287, 4084), (3339, 4128)]
         : compromised: 0.6036, honest: 0.7566
Round 005: test acc mean=0.7382 ± 0.2296 | min=0.0485 max=0.8320
         : test loss mean=3970960.9637 ± 17228971.7330
         : individual accs = ['0.810078', '0.814418', '0.813526', '0.814216', '0.808849', '0.048519', '0.819223', '0.821108', '0.832021', '0.810381', '0.816799', '0.804913', '0.815539', '0.809149', '0.050592', '0.810871', '0.811702', '0.815922', '0.821499', '0.813711']
         : correct/total = [(3344, 4128), (3423, 4203), (3320, 4081), (3528, 4333), (3309, 4091), (208, 4287), (3435, 4193), (3571, 4349), (3487, 4191), (3466, 4277), (3384, 4143), (3375, 4193), (3338, 4093), (3396, 4197), (205, 4052), (3267, 4029), (3371, 4153), (3413, 4183), (3355, 4084), (3359, 4128)]
         : compromised: 0.6223, honest: 0.7671
Round 006: test acc mean=0.7456 ± 0.2378 | min=0.0311 max=0.8399
         : test loss mean=462.0481 ± 1387.2926
         : individual accs = ['0.817103', '0.819177', '0.824308', '0.827833', '0.820093', '0.033823', '0.829239', '0.826167', '0.839895', '0.836801', '0.813662', '0.819461', '0.824334', '0.816774', '0.031096', '0.831472', '0.839152', '0.826440', '0.820274', '0.814438']
         : correct/total = [(3373, 4128), (3443, 4203), (3364, 4081), (3587, 4333), (3355, 4091), (145, 4287), (3477, 4193), (3593, 4349), (3520, 4191), (3579, 4277), (3371, 4143), (3436, 4193), (3374, 4093), (3428, 4197), (126, 4052), (3350, 4029), (3485, 4153), (3457, 4183), (3350, 4084), (3362, 4128)]
         : compromised: 0.6253, honest: 0.7756
Round 007: test acc mean=0.7494 ± 0.2391 | min=0.0311 max=0.8432
         : test loss mean=81.1397 ± 242.3887
         : individual accs = ['0.828973', '0.843207', '0.823818', '0.836141', '0.819360', '0.033823', '0.837825', '0.832375', '0.839179', '0.830489', '0.825006', '0.820653', '0.824579', '0.830355', '0.031096', '0.826508', '0.822056', '0.823333', '0.837414', '0.822674']
         : correct/total = [(3422, 4128), (3544, 4203), (3362, 4081), (3623, 4333), (3352, 4091), (145, 4287), (3513, 4193), (3620, 4349), (3517, 4191), (3552, 4277), (3418, 4143), (3441, 4193), (3375, 4093), (3485, 4197), (126, 4052), (3330, 4029), (3414, 4153), (3444, 4183), (3420, 4084), (3396, 4128)]
         : compromised: 0.6280, honest: 0.7798
Round 008: test acc mean=0.7463 ± 0.2427 | min=0.0081 max=0.8412
         : test loss mean=91.4222 ± 365.2492
         : individual accs = ['0.820979', '0.830359', '0.831904', '0.841219', '0.815449', '0.030091', '0.829478', '0.834675', '0.838702', '0.841010', '0.827420', '0.837109', '0.829221', '0.833214', '0.008144', '0.812857', '0.815555', '0.815922', '0.838149', '0.795543']
         : correct/total = [(3389, 4128), (3490, 4203), (3395, 4081), (3645, 4333), (3336, 4091), (129, 4287), (3478, 4193), (3630, 4349), (3515, 4191), (3597, 4277), (3428, 4143), (3510, 4193), (3394, 4093), (3497, 4197), (33, 4052), (3275, 4029), (3387, 4153), (3413, 4183), (3423, 4084), (3284, 4128)]
         : compromised: 0.6271, honest: 0.7762
Round 009: test acc mean=0.7561 ± 0.2334 | min=0.0536 max=0.8439
         : test loss mean=63.7261 ± 217.7180
         : individual accs = ['0.830669', '0.826315', '0.835334', '0.835218', '0.837937', '0.058782', '0.842595', '0.843872', '0.840134', '0.831658', '0.835144', '0.833294', '0.824823', '0.838933', '0.053554', '0.836188', '0.825427', '0.823333', '0.837904', '0.831880']
         : correct/total = [(3429, 4128), (3473, 4203), (3409, 4081), (3619, 4333), (3428, 4091), (252, 4287), (3533, 4193), (3670, 4349), (3521, 4191), (3557, 4277), (3460, 4143), (3494, 4193), (3376, 4093), (3521, 4197), (217, 4052), (3369, 4029), (3428, 4153), (3444, 4183), (3422, 4084), (3434, 4128)]
         : compromised: 0.6365, honest: 0.7861
Round 010: test acc mean=0.7556 ± 0.2333 | min=0.0536 max=0.8487
         : test loss mean=261305.3922 ± 819809.7395
         : individual accs = ['0.815165', '0.848680', '0.834599', '0.842603', '0.818871', '0.058782', '0.840448', '0.838584', '0.841088', '0.837737', '0.828868', '0.827570', '0.823846', '0.835835', '0.053554', '0.842889', '0.838189', '0.824767', '0.836435', '0.824128']
         : correct/total = [(3365, 4128), (3567, 4203), (3406, 4081), (3651, 4333), (3350, 4091), (252, 4287), (3524, 4193), (3647, 4349), (3525, 4191), (3583, 4277), (3434, 4143), (3470, 4193), (3372, 4093), (3508, 4197), (217, 4052), (3396, 4029), (3481, 4153), (3450, 4183), (3416, 4084), (3402, 4128)]
         : compromised: 0.6358, honest: 0.7856

=== FINAL RESULTS ===
Dataset: femnist, Nodes: 20, Graph: erdos, Aggregation: krum
Attack: directed_deviation, 20.0% compromised
Final accuracy - Compromised: 0.6358, Honest: 0.7856
Overall test accuracy: mean=0.7556 ± 0.2333
