Device: cuda
Seed: 987654321
Loading 36 LEAF FEMNIST train files...
LEAF FEMNIST train: 3597 users, 734463 samples
Loading 36 LEAF FEMNIST test files...
LEAF FEMNIST test: 3597 users, 83388 samples
Found 3597 train users, 3597 test users, 3597 common users
User sample counts range: 525 (max) to 17 (min)
Distributed ALL 3597 users across 20 clients
Users per client: 179 (with 17 clients getting +1 user)
Train partition sizes: [36360, 37070, 35957, 38262, 36024, 37732, 36921, 38328, 36867, 37683, 36507, 36915, 36007, 37001, 35681, 35453, 36585, 36801, 35964, 36345]
Test partition sizes: [4128, 4203, 4081, 4333, 4091, 4287, 4193, 4349, 4191, 4277, 4143, 4193, 4093, 4197, 4052, 4029, 4153, 4183, 4084, 4128]
  Client 0: 36360 train samples, 62 unique classes
  Client 1: 37070 train samples, 62 unique classes
  Client 2: 35957 train samples, 62 unique classes
  Client 3: 38262 train samples, 62 unique classes
  Client 4: 36024 train samples, 62 unique classes
  Client 5: 37732 train samples, 62 unique classes
  Client 6: 36921 train samples, 62 unique classes
  Client 7: 38328 train samples, 62 unique classes
  Client 8: 36867 train samples, 62 unique classes
  Client 9: 37683 train samples, 62 unique classes
  Client 10: 36507 train samples, 62 unique classes
  Client 11: 36915 train samples, 62 unique classes
  Client 12: 36007 train samples, 62 unique classes
  Client 13: 37001 train samples, 62 unique classes
  Client 14: 35681 train samples, 62 unique classes
  Client 15: 35453 train samples, 62 unique classes
  Client 16: 36585 train samples, 62 unique classes
  Client 17: 36801 train samples, 62 unique classes
  Client 18: 35964 train samples, 62 unique classes
  Client 19: 36345 train samples, 62 unique classes
Will sample 10000 samples per client per epoch
Graph: fully, nodes: 20, edges: 190
Degree statistics: avg=19.00, min=19, max=19
Attack: Compromised 10/20 nodes: [1, 2, 5, 11, 12, 13, 14, 15, 17, 18]
Attack type: krum, lambda: 1.0
Model variant: baseline
Model parameters: 6,603,710
Sketchguard Node 0:
  Model dim: 6,603,710 → Sketch size: 1000
  Compression ratio: 6603.7x
  Using model parameters for aggregation, sketches for filtering
Sketchguard Node 1:
  Model dim: 6,603,710 → Sketch size: 1000
  Compression ratio: 6603.7x
  Using model parameters for aggregation, sketches for filtering
Sketchguard Node 2:
  Model dim: 6,603,710 → Sketch size: 1000
  Compression ratio: 6603.7x
  Using model parameters for aggregation, sketches for filtering
Sketchguard Node 3:
  Model dim: 6,603,710 → Sketch size: 1000
  Compression ratio: 6603.7x
  Using model parameters for aggregation, sketches for filtering
Sketchguard Node 4:
  Model dim: 6,603,710 → Sketch size: 1000
  Compression ratio: 6603.7x
  Using model parameters for aggregation, sketches for filtering
Sketchguard Node 5:
  Model dim: 6,603,710 → Sketch size: 1000
  Compression ratio: 6603.7x
  Using model parameters for aggregation, sketches for filtering
Sketchguard Node 6:
  Model dim: 6,603,710 → Sketch size: 1000
  Compression ratio: 6603.7x
  Using model parameters for aggregation, sketches for filtering
Sketchguard Node 7:
  Model dim: 6,603,710 → Sketch size: 1000
  Compression ratio: 6603.7x
  Using model parameters for aggregation, sketches for filtering
Sketchguard Node 8:
  Model dim: 6,603,710 → Sketch size: 1000
  Compression ratio: 6603.7x
  Using model parameters for aggregation, sketches for filtering
Sketchguard Node 9:
  Model dim: 6,603,710 → Sketch size: 1000
  Compression ratio: 6603.7x
  Using model parameters for aggregation, sketches for filtering
Sketchguard Node 10:
  Model dim: 6,603,710 → Sketch size: 1000
  Compression ratio: 6603.7x
  Using model parameters for aggregation, sketches for filtering
Sketchguard Node 11:
  Model dim: 6,603,710 → Sketch size: 1000
  Compression ratio: 6603.7x
  Using model parameters for aggregation, sketches for filtering
Sketchguard Node 12:
  Model dim: 6,603,710 → Sketch size: 1000
  Compression ratio: 6603.7x
  Using model parameters for aggregation, sketches for filtering
Sketchguard Node 13:
  Model dim: 6,603,710 → Sketch size: 1000
  Compression ratio: 6603.7x
  Using model parameters for aggregation, sketches for filtering
Sketchguard Node 14:
  Model dim: 6,603,710 → Sketch size: 1000
  Compression ratio: 6603.7x
  Using model parameters for aggregation, sketches for filtering
Sketchguard Node 15:
  Model dim: 6,603,710 → Sketch size: 1000
  Compression ratio: 6603.7x
  Using model parameters for aggregation, sketches for filtering
Sketchguard Node 16:
  Model dim: 6,603,710 → Sketch size: 1000
  Compression ratio: 6603.7x
  Using model parameters for aggregation, sketches for filtering
Sketchguard Node 17:
  Model dim: 6,603,710 → Sketch size: 1000
  Compression ratio: 6603.7x
  Using model parameters for aggregation, sketches for filtering
Sketchguard Node 18:
  Model dim: 6,603,710 → Sketch size: 1000
  Compression ratio: 6603.7x
  Using model parameters for aggregation, sketches for filtering
Sketchguard Node 19:
  Model dim: 6,603,710 → Sketch size: 1000
  Compression ratio: 6603.7x
  Using model parameters for aggregation, sketches for filtering
Sketchguard ALGORITHM (Sketch-based Filtering + State Aggregation)
  - Model dimension: 6,603,710 parameters
  - Config: SketchguardConfig(gamma=2, kappa=1, alpha=0.5, min_neighbors=1, sketch_size=1000, network_seed=987654321, attack_detection_window=5)
  - Sketch size: 1000
  - Compression ratio: 6603.7x
  - Complexity: O(d + N×k) = O(6,603,710 + 20×1000)
  - Theoretical speedup vs BALANCE: 19.9x
Initial test acc across nodes: mean=0.0168 ± 0.0139
Round 001: test acc mean=0.5129 ± 0.0344 | min=0.4510 max=0.5934
         : test loss mean=3.7316 ± 0.0273
         : individual accs = ['0.550872', '0.505829', '0.559667', '0.531272', '0.513322', '0.593422', '0.514906', '0.513681', '0.510141', '0.451017', '0.515327', '0.530885', '0.456389', '0.466524', '0.522211', '0.533631', '0.459427', '0.521874', '0.502449', '0.506056']
         : correct/total = [(2274, 4128), (2126, 4203), (2284, 4081), (2302, 4333), (2100, 4091), (2544, 4287), (2159, 4193), (2234, 4349), (2138, 4191), (1929, 4277), (2135, 4143), (2226, 4193), (1868, 4093), (1958, 4197), (2116, 4052), (2150, 4029), (1908, 4153), (2183, 4183), (2052, 4084), (2089, 4128)]
         : compromised: 0.5193, honest: 0.5066
         : sketchguard stats = ['Node 0: acc_rate=0.474', 'Node 1: acc_rate=0.526', 'Node 2: acc_rate=0.526']...
Round 002: test acc mean=0.6746 ± 0.0161 | min=0.6401 max=0.7021
         : test loss mean=3.4077 ± 0.0733
         : individual accs = ['0.684835', '0.679515', '0.679490', '0.702054', '0.684185', '0.702123', '0.663010', '0.676707', '0.661656', '0.662614', '0.685976', '0.644646', '0.655021', '0.685490', '0.681145', '0.640109', '0.674934', '0.688501', '0.668707', '0.670300']
         : correct/total = [(2827, 4128), (2856, 4203), (2773, 4081), (3042, 4333), (2799, 4091), (3010, 4287), (2780, 4193), (2943, 4349), (2773, 4191), (2834, 4277), (2842, 4143), (2703, 4193), (2681, 4093), (2877, 4197), (2760, 4052), (2579, 4029), (2803, 4153), (2880, 4183), (2731, 4084), (2767, 4128)]
         : compromised: 0.6725, honest: 0.6766
         : sketchguard stats = ['Node 0: acc_rate=0.474', 'Node 1: acc_rate=0.526', 'Node 2: acc_rate=0.526']...
Round 003: test acc mean=0.6739 ± 0.0417 | min=0.5365 max=0.7224
         : test loss mean=2.9766 ± 0.2012
         : individual accs = ['0.705911', '0.665953', '0.654251', '0.722363', '0.718895', '0.672032', '0.690675', '0.718786', '0.691005', '0.706102', '0.691528', '0.606725', '0.660396', '0.651418', '0.670533', '0.683296', '0.665784', '0.536457', '0.667238', '0.698643']
         : correct/total = [(2914, 4128), (2799, 4203), (2670, 4081), (3130, 4333), (2941, 4091), (2881, 4287), (2896, 4193), (3126, 4349), (2896, 4191), (3020, 4277), (2865, 4143), (2544, 4193), (2703, 4093), (2734, 4197), (2717, 4052), (2753, 4029), (2765, 4153), (2244, 4183), (2725, 4084), (2884, 4128)]
         : compromised: 0.6468, honest: 0.7010
         : sketchguard stats = ['Node 0: acc_rate=0.474', 'Node 1: acc_rate=0.526', 'Node 2: acc_rate=0.526']...
Round 004: test acc mean=0.6587 ± 0.0395 | min=0.5898 max=0.7205
         : test loss mean=2.2085 ± 0.2441
         : individual accs = ['0.676841', '0.623126', '0.637834', '0.720517', '0.691762', '0.628178', '0.710231', '0.720395', '0.708423', '0.671265', '0.664977', '0.648223', '0.605424', '0.635454', '0.666831', '0.625465', '0.705033', '0.589768', '0.618266', '0.626938']
         : correct/total = [(2794, 4128), (2619, 4203), (2603, 4081), (3122, 4333), (2830, 4091), (2693, 4287), (2978, 4193), (3133, 4349), (2969, 4191), (2871, 4277), (2755, 4143), (2718, 4193), (2478, 4093), (2667, 4197), (2702, 4052), (2520, 4029), (2928, 4153), (2467, 4183), (2525, 4084), (2588, 4128)]
         : compromised: 0.6279, honest: 0.6896
         : sketchguard stats = ['Node 0: acc_rate=0.474', 'Node 1: acc_rate=0.526', 'Node 2: acc_rate=0.526']...
Round 005: test acc mean=0.7206 ± 0.0345 | min=0.6476 max=0.7783
         : test loss mean=1.2970 ± 0.1703
         : individual accs = ['0.739583', '0.647633', '0.706935', '0.745211', '0.753117', '0.716585', '0.746959', '0.778340', '0.739442', '0.771335', '0.725561', '0.697591', '0.682873', '0.711461', '0.725568', '0.649293', '0.756802', '0.707148', '0.695152', '0.716328']
         : correct/total = [(3053, 4128), (2722, 4203), (2885, 4081), (3229, 4333), (3081, 4091), (3072, 4287), (3132, 4193), (3385, 4349), (3099, 4191), (3299, 4277), (3006, 4143), (2925, 4193), (2795, 4093), (2986, 4197), (2940, 4052), (2616, 4029), (3143, 4153), (2958, 4183), (2839, 4084), (2957, 4128)]
         : compromised: 0.6940, honest: 0.7473
         : sketchguard stats = ['Node 0: acc_rate=0.474', 'Node 1: acc_rate=0.526', 'Node 2: acc_rate=0.526']...
Round 006: test acc mean=0.8007 ± 0.0075 | min=0.7851 max=0.8127
         : test loss mean=0.7119 ± 0.0378
         : individual accs = ['0.805475', '0.804425', '0.803480', '0.806370', '0.807138', '0.804292', '0.804913', '0.811911', '0.801479', '0.812719', '0.794352', '0.792273', '0.791351', '0.791994', '0.804294', '0.785058', '0.807850', '0.798948', '0.795788', '0.790455']
         : correct/total = [(3325, 4128), (3381, 4203), (3279, 4081), (3494, 4333), (3302, 4091), (3448, 4287), (3375, 4193), (3531, 4349), (3359, 4191), (3476, 4277), (3291, 4143), (3322, 4193), (3239, 4093), (3324, 4197), (3259, 4052), (3163, 4029), (3355, 4153), (3342, 4183), (3250, 4084), (3263, 4128)]
         : compromised: 0.7972, honest: 0.8043
         : sketchguard stats = ['Node 0: acc_rate=0.474', 'Node 1: acc_rate=0.526', 'Node 2: acc_rate=0.526']...
Round 007: test acc mean=0.8249 ± 0.0088 | min=0.8111 max=0.8411
         : test loss mean=0.5572 ± 0.0260
         : individual accs = ['0.824855', '0.826552', '0.833374', '0.829910', '0.841115', '0.823886', '0.820415', '0.840193', '0.820568', '0.835866', '0.811731', '0.814214', '0.829221', '0.823445', '0.819348', '0.811119', '0.827595', '0.811618', '0.832517', '0.820252']
         : correct/total = [(3405, 4128), (3474, 4203), (3401, 4081), (3596, 4333), (3441, 4091), (3532, 4287), (3440, 4193), (3654, 4349), (3439, 4191), (3575, 4277), (3363, 4143), (3414, 4193), (3394, 4093), (3456, 4197), (3320, 4052), (3268, 4029), (3437, 4153), (3395, 4183), (3400, 4084), (3386, 4128)]
         : compromised: 0.8225, honest: 0.8272
         : sketchguard stats = ['Node 0: acc_rate=0.474', 'Node 1: acc_rate=0.526', 'Node 2: acc_rate=0.526']...
Round 008: test acc mean=0.8363 ± 0.0072 | min=0.8220 max=0.8497
         : test loss mean=0.5065 ± 0.0234
         : individual accs = ['0.834302', '0.842018', '0.843421', '0.837988', '0.849670', '0.839748', '0.828285', '0.847321', '0.835123', '0.844517', '0.829109', '0.830432', '0.839482', '0.836788', '0.829467', '0.822040', '0.839393', '0.826918', '0.839863', '0.829700']
         : correct/total = [(3444, 4128), (3539, 4203), (3442, 4081), (3631, 4333), (3476, 4091), (3600, 4287), (3473, 4193), (3685, 4349), (3500, 4191), (3612, 4277), (3435, 4143), (3482, 4193), (3436, 4093), (3512, 4197), (3361, 4052), (3312, 4029), (3486, 4153), (3459, 4183), (3430, 4084), (3425, 4128)]
         : compromised: 0.8350, honest: 0.8375
         : sketchguard stats = ['Node 0: acc_rate=0.474', 'Node 1: acc_rate=0.526', 'Node 2: acc_rate=0.526']...
Round 009: test acc mean=0.8424 ± 0.0076 | min=0.8315 max=0.8581
         : test loss mean=0.4787 ± 0.0213
         : individual accs = ['0.833818', '0.851059', '0.852977', '0.845834', '0.850403', '0.845813', '0.833771', '0.858128', '0.837270', '0.850830', '0.832247', '0.833294', '0.843880', '0.842745', '0.837611', '0.831472', '0.848062', '0.838393', '0.843046', '0.837936']
         : correct/total = [(3442, 4128), (3577, 4203), (3481, 4081), (3665, 4333), (3479, 4091), (3626, 4287), (3496, 4193), (3732, 4349), (3509, 4191), (3639, 4277), (3448, 4143), (3494, 4193), (3454, 4093), (3537, 4197), (3394, 4052), (3350, 4029), (3522, 4153), (3507, 4183), (3443, 4084), (3459, 4128)]
         : compromised: 0.8420, honest: 0.8428
         : sketchguard stats = ['Node 0: acc_rate=0.474', 'Node 1: acc_rate=0.526', 'Node 2: acc_rate=0.526']...
Round 010: test acc mean=0.8469 ± 0.0060 | min=0.8354 max=0.8575
         : test loss mean=0.4629 ± 0.0216
         : individual accs = ['0.843023', '0.853438', '0.852487', '0.849527', '0.857492', '0.849778', '0.839017', '0.854679', '0.847292', '0.851999', '0.840454', '0.835440', '0.849988', '0.848940', '0.842300', '0.840903', '0.849988', '0.842219', '0.850147', '0.838905']
         : correct/total = [(3480, 4128), (3587, 4203), (3479, 4081), (3681, 4333), (3508, 4091), (3643, 4287), (3518, 4193), (3717, 4349), (3551, 4191), (3644, 4277), (3482, 4143), (3503, 4193), (3479, 4093), (3563, 4197), (3413, 4052), (3388, 4029), (3530, 4153), (3523, 4183), (3472, 4084), (3463, 4128)]
         : compromised: 0.8466, honest: 0.8472
         : sketchguard stats = ['Node 0: acc_rate=0.474', 'Node 1: acc_rate=0.526', 'Node 2: acc_rate=0.526']...

=== FINAL RESULTS ===
Dataset: femnist, Nodes: 20, Graph: fully, Aggregation: sketchguard
Attack: krum, 50.0% compromised
Final accuracy - Compromised: 0.8466, Honest: 0.8472
Overall test accuracy: mean=0.8469 ± 0.0060

=== Sketchguard SUMMARY ===
Node 0: acceptance=0.474
Node 1: acceptance=0.526
Node 2: acceptance=0.526
Node 3: acceptance=0.474
Node 4: acceptance=0.474
Node 5: acceptance=0.526
Node 6: acceptance=0.474
Node 7: acceptance=0.474
Node 8: acceptance=0.474
Node 9: acceptance=0.474
Node 10: acceptance=0.474
Node 11: acceptance=0.526
Node 12: acceptance=0.526
Node 13: acceptance=0.526
Node 14: acceptance=0.526
Node 15: acceptance=0.526
Node 16: acceptance=0.474
Node 17: acceptance=0.526
Node 18: acceptance=0.526
Node 19: acceptance=0.474

=== PARALLEL EXECUTION TIME (realistic for distributed system) ===
  COMMUNICATION (max across nodes):
    - Sketch transfer: 0.000s (0.0%)
    - Model fetch (accepted): 0.000s (0.0%)
  COMPUTATION (max across nodes):
    - Sketching: 4.300s (99.5%)
    - Filtering: 0.002s (0.0%)
    - Aggregation: 0.021s (0.5%)
  TOTALS:
    - Total computation: 4.324s (100.0%)
    - Total communication: 0.000s (0.0%)
    - Total parallel time: 4.324s

=== PER-NODE AVERAGE TIME ===
  - Sketching: 3.915s
  - Filtering: 0.001s
  - Aggregation: 0.018s
  - Sketch transfer: 0.000s
  - Model fetch: 0.000s
  - Total per node: 3.934s

=== TOTAL COMPUTATIONAL WORK (sum across all nodes) ===
  - Total sketching: 78.302s
  - Total filtering: 0.028s
  - Total aggregation: 0.360s
  - Total sketch transfer: 0.000s
  - Total model fetch: 0.000s
  - Grand total: 78.690s
  - Mean acceptance rate: 0.500

Sketchguard Algorithm Properties:
  - Original dimension: 6,603,710
  - Sketch size: 1000
  - Compression ratio: 19.9x
  - Single repetition: No repetitions needed
  - Theoretical complexity: O(d + N×k)
  - Approach: Sketch filtering + state aggregation
