Device: cuda
Seed: 987654321
Loading 36 LEAF FEMNIST train files...
LEAF FEMNIST train: 3597 users, 734463 samples
Loading 36 LEAF FEMNIST test files...
LEAF FEMNIST test: 3597 users, 83388 samples
Found 3597 train users, 3597 test users, 3597 common users
User sample counts range: 525 (max) to 17 (min)
Distributed ALL 3597 users across 20 clients
Users per client: 179 (with 17 clients getting +1 user)
Train partition sizes: [36360, 37070, 35957, 38262, 36024, 37732, 36921, 38328, 36867, 37683, 36507, 36915, 36007, 37001, 35681, 35453, 36585, 36801, 35964, 36345]
Test partition sizes: [4128, 4203, 4081, 4333, 4091, 4287, 4193, 4349, 4191, 4277, 4143, 4193, 4093, 4197, 4052, 4029, 4153, 4183, 4084, 4128]
  Client 0: 36360 train samples, 62 unique classes
  Client 1: 37070 train samples, 62 unique classes
  Client 2: 35957 train samples, 62 unique classes
  Client 3: 38262 train samples, 62 unique classes
  Client 4: 36024 train samples, 62 unique classes
  Client 5: 37732 train samples, 62 unique classes
  Client 6: 36921 train samples, 62 unique classes
  Client 7: 38328 train samples, 62 unique classes
  Client 8: 36867 train samples, 62 unique classes
  Client 9: 37683 train samples, 62 unique classes
  Client 10: 36507 train samples, 62 unique classes
  Client 11: 36915 train samples, 62 unique classes
  Client 12: 36007 train samples, 62 unique classes
  Client 13: 37001 train samples, 62 unique classes
  Client 14: 35681 train samples, 62 unique classes
  Client 15: 35453 train samples, 62 unique classes
  Client 16: 36585 train samples, 62 unique classes
  Client 17: 36801 train samples, 62 unique classes
  Client 18: 35964 train samples, 62 unique classes
  Client 19: 36345 train samples, 62 unique classes
Will sample 10000 samples per client per epoch
Graph: ring, nodes: 20, edges: 20
Degree statistics: avg=2.00, min=2, max=2
Attack: Compromised 4/20 nodes: [5, 12, 13, 17]
Attack type: backdoor, lambda: 1.0
Backdoor target label: 0, trigger size: 4
Model variant: baseline
Model parameters: 6,603,710
Initial test acc across nodes: mean=0.0168 ± 0.0139
Backdoor attack: Created poisoned datasets for 4 compromised nodes
Round 001: test acc mean=0.1147 ± 0.1222 | min=0.0022 max=0.4123
         : test loss mean=5575.3507 ± 11237.7529
         : individual accs = ['0.247335', '0.256959', '0.262191', '0.164782', '0.002933', '0.004665', '0.005724', '0.412279', '0.130756', '0.104045', '0.183442', '0.036012', '0.003909', '0.005718', '0.005183', '0.275751', '0.002167', '0.003108', '0.015426', '0.171512']
         : correct/total = [(1021, 4128), (1080, 4203), (1070, 4081), (714, 4333), (12, 4091), (20, 4287), (24, 4193), (1793, 4349), (548, 4191), (445, 4277), (760, 4143), (151, 4193), (16, 4093), (24, 4197), (21, 4052), (1111, 4029), (9, 4153), (13, 4183), (63, 4084), (708, 4128)]
         : compromised: 0.0044, honest: 0.1423
Round 002: test acc mean=0.2131 ± 0.2826 | min=0.0420 max=0.7156
         : test loss mean=35597158445319.1016 ± 119406943693296.5469
         : individual accs = ['0.715601', '0.691173', '0.698358', '0.043157', '0.057932', '0.052484', '0.044598', '0.051276', '0.707230', '0.699556', '0.041999', '0.049606', '0.054239', '0.049559', '0.046644', '0.054852', '0.049362', '0.045900', '0.052155', '0.055475']
         : correct/total = [(2954, 4128), (2905, 4203), (2850, 4081), (187, 4333), (237, 4091), (225, 4287), (187, 4193), (223, 4349), (2964, 4191), (2992, 4277), (174, 4143), (208, 4193), (222, 4093), (208, 4197), (189, 4052), (221, 4029), (205, 4153), (192, 4183), (213, 4084), (229, 4128)]
         : compromised: 0.0505, honest: 0.2537
Round 003: test acc mean=0.0890 ± 0.1589 | min=0.0432 max=0.7813
         : test loss mean=31687451359515.2617 ± 138122380603209.5312
         : individual accs = ['0.059593', '0.781347', '0.057584', '0.043157', '0.057932', '0.045253', '0.057000', '0.051276', '0.043188', '0.053776', '0.055998', '0.061770', '0.050818', '0.055278', '0.045656', '0.050633', '0.055141', '0.048291', '0.050930', '0.055475']
         : correct/total = [(246, 4128), (3284, 4203), (235, 4081), (187, 4333), (237, 4091), (194, 4287), (239, 4193), (223, 4349), (181, 4191), (230, 4277), (232, 4143), (259, 4193), (208, 4093), (232, 4197), (185, 4052), (204, 4029), (229, 4153), (202, 4183), (208, 4084), (229, 4128)]
         : compromised: 0.0499, honest: 0.0988
Round 004: test acc mean=0.0506 ± 0.0069 | min=0.0334 max=0.0624
         : test loss mean=188450.6184 ± 594231.4358
         : individual accs = ['0.059593', '0.048775', '0.054889', '0.043157', '0.057932', '0.045253', '0.033389', '0.058174', '0.044619', '0.053075', '0.041999', '0.045314', '0.049597', '0.062426', '0.051579', '0.054852', '0.054418', '0.045900', '0.050930', '0.055475']
         : correct/total = [(246, 4128), (205, 4203), (224, 4081), (187, 4333), (237, 4091), (194, 4287), (140, 4193), (253, 4349), (187, 4191), (227, 4277), (174, 4143), (190, 4193), (203, 4093), (262, 4197), (209, 4052), (221, 4029), (226, 4153), (192, 4183), (208, 4084), (229, 4128)]
         : compromised: 0.0508, honest: 0.0505
Round 005: test acc mean=0.0502 ± 0.0072 | min=0.0323 max=0.0596
         : test loss mean=607405607654853234791546880.0000 ± 2647619654146462702756691968.0000
         : individual accs = ['0.059593', '0.046158', '0.057584', '0.043157', '0.048643', '0.048752', '0.033389', '0.058174', '0.053209', '0.053776', '0.050447', '0.045314', '0.049597', '0.055278', '0.051826', '0.056590', '0.054418', '0.050203', '0.032321', '0.055475']
         : correct/total = [(246, 4128), (194, 4203), (235, 4081), (187, 4333), (199, 4091), (209, 4287), (140, 4193), (253, 4349), (223, 4191), (230, 4277), (209, 4143), (190, 4193), (203, 4093), (232, 4197), (210, 4052), (228, 4029), (226, 4153), (210, 4183), (132, 4084), (229, 4128)]
         : compromised: 0.0510, honest: 0.0500
Round 006: test acc mean=0.0522 ± 0.0045 | min=0.0422 max=0.0596
         : test loss mean=145663226383526502649036800.0000 ± 634930278112936838253510656.0000
         : individual accs = ['0.059593', '0.052344', '0.055134', '0.047773', '0.052554', '0.048752', '0.057000', '0.058174', '0.042233', '0.053776', '0.055998', '0.046983', '0.049841', '0.055278', '0.045656', '0.056590', '0.051047', '0.048291', '0.050930', '0.055475']
         : correct/total = [(246, 4128), (220, 4203), (225, 4081), (207, 4333), (215, 4091), (209, 4287), (239, 4193), (253, 4349), (177, 4191), (230, 4277), (232, 4143), (197, 4193), (204, 4093), (232, 4197), (185, 4052), (228, 4029), (212, 4153), (202, 4183), (208, 4084), (229, 4128)]
         : compromised: 0.0505, honest: 0.0526
Round 007: test acc mean=0.0529 ± 0.0048 | min=0.0422 max=0.0612
         : test loss mean=81883919870086841194512384.0000 ± 356923731804868845965934592.0000
         : individual accs = ['0.059593', '0.048775', '0.053418', '0.052850', '0.057932', '0.048752', '0.049130', '0.058174', '0.042233', '0.053776', '0.055998', '0.049606', '0.050574', '0.046938', '0.061204', '0.056590', '0.058271', '0.048291', '0.050930', '0.055475']
         : correct/total = [(246, 4128), (205, 4203), (218, 4081), (229, 4333), (237, 4091), (209, 4287), (206, 4193), (253, 4349), (177, 4191), (230, 4277), (232, 4143), (208, 4193), (207, 4093), (197, 4197), (248, 4052), (228, 4029), (242, 4153), (202, 4183), (208, 4084), (229, 4128)]
         : compromised: 0.0486, honest: 0.0540
Round 008: test acc mean=0.0537 ± 0.0050 | min=0.0422 max=0.0624
         : test loss mean=49311926291038336630915072.0000 ± 214945703413935444372488192.0000
         : individual accs = ['0.050145', '0.052344', '0.057584', '0.052850', '0.057932', '0.048752', '0.053899', '0.058174', '0.042233', '0.053776', '0.055998', '0.045314', '0.049597', '0.062426', '0.061204', '0.056590', '0.058271', '0.050920', '0.050930', '0.055475']
         : correct/total = [(207, 4128), (220, 4203), (235, 4081), (229, 4333), (237, 4091), (209, 4287), (226, 4193), (253, 4349), (177, 4191), (230, 4277), (232, 4143), (190, 4193), (203, 4093), (262, 4197), (248, 4052), (228, 4029), (242, 4153), (213, 4183), (208, 4084), (229, 4128)]
         : compromised: 0.0529, honest: 0.0539
Round 009: test acc mean=0.0521 ± 0.0058 | min=0.0422 max=0.0624
         : test loss mean=33115197958048463577939968.0000 ± 144345711258755830284025856.0000
         : individual accs = ['0.050145', '0.052344', '0.057584', '0.052850', '0.043021', '0.048752', '0.043883', '0.058174', '0.042233', '0.053776', '0.055998', '0.045314', '0.049597', '0.062426', '0.061204', '0.056590', '0.058271', '0.050920', '0.050930', '0.048692']
         : correct/total = [(207, 4128), (220, 4203), (235, 4081), (229, 4333), (176, 4091), (209, 4287), (184, 4193), (253, 4349), (177, 4191), (230, 4277), (232, 4143), (190, 4193), (203, 4093), (262, 4197), (248, 4052), (228, 4029), (242, 4153), (213, 4183), (208, 4084), (201, 4128)]
         : compromised: 0.0529, honest: 0.0519
Round 010: test acc mean=0.0533 ± 0.0058 | min=0.0422 max=0.0624
         : test loss mean=23129170535507423930613760.0000 ± 100817717012191512910364672.0000
         : individual accs = ['0.059593', '0.052344', '0.057584', '0.052850', '0.057932', '0.048752', '0.043883', '0.058174', '0.042233', '0.053776', '0.055998', '0.045314', '0.049597', '0.062426', '0.061204', '0.056590', '0.058271', '0.050920', '0.052889', '0.045058']
         : correct/total = [(246, 4128), (220, 4203), (235, 4081), (229, 4333), (237, 4091), (209, 4287), (184, 4193), (253, 4349), (177, 4191), (230, 4277), (232, 4143), (190, 4193), (203, 4093), (262, 4197), (248, 4052), (228, 4029), (242, 4153), (213, 4183), (216, 4084), (186, 4128)]
         : compromised: 0.0529, honest: 0.0534

=== FINAL RESULTS ===
Dataset: femnist, Nodes: 20, Graph: ring, Aggregation: d-fedavg
Attack: backdoor, 20.0% compromised
Final accuracy - Compromised: 0.0529, Honest: 0.0534
Overall test accuracy: mean=0.0533 ± 0.0058

=== BACKDOOR ATTACK SUCCESS RATE (ASR) ===
Target label: 0
Trigger size: 4x4
Overall ASR: 0.0500 ± 0.2179
Honest nodes ASR: 0.0625 ± 0.2421
Compromised nodes ASR: 0.0000 ± 0.0000
Note: Higher ASR indicates more successful backdoor attack
