Device: cuda
Seed: 987654321
Loading 36 LEAF FEMNIST train files...
LEAF FEMNIST train: 3597 users, 734463 samples
Loading 36 LEAF FEMNIST test files...
LEAF FEMNIST test: 3597 users, 83388 samples
Found 3597 train users, 3597 test users, 3597 common users
User sample counts range: 525 (max) to 17 (min)
Distributed ALL 3597 users across 20 clients
Users per client: 179 (with 17 clients getting +1 user)
Train partition sizes: [36360, 37070, 35957, 38262, 36024, 37732, 36921, 38328, 36867, 37683, 36507, 36915, 36007, 37001, 35681, 35453, 36585, 36801, 35964, 36345]
Test partition sizes: [4128, 4203, 4081, 4333, 4091, 4287, 4193, 4349, 4191, 4277, 4143, 4193, 4093, 4197, 4052, 4029, 4153, 4183, 4084, 4128]
  Client 0: 36360 train samples, 62 unique classes
  Client 1: 37070 train samples, 62 unique classes
  Client 2: 35957 train samples, 62 unique classes
  Client 3: 38262 train samples, 62 unique classes
  Client 4: 36024 train samples, 62 unique classes
  Client 5: 37732 train samples, 62 unique classes
  Client 6: 36921 train samples, 62 unique classes
  Client 7: 38328 train samples, 62 unique classes
  Client 8: 36867 train samples, 62 unique classes
  Client 9: 37683 train samples, 62 unique classes
  Client 10: 36507 train samples, 62 unique classes
  Client 11: 36915 train samples, 62 unique classes
  Client 12: 36007 train samples, 62 unique classes
  Client 13: 37001 train samples, 62 unique classes
  Client 14: 35681 train samples, 62 unique classes
  Client 15: 35453 train samples, 62 unique classes
  Client 16: 36585 train samples, 62 unique classes
  Client 17: 36801 train samples, 62 unique classes
  Client 18: 35964 train samples, 62 unique classes
  Client 19: 36345 train samples, 62 unique classes
Will sample 10000 samples per client per epoch
Graph: ring, nodes: 20, edges: 20
Degree statistics: avg=2.00, min=2, max=2
Attack: Compromised 4/20 nodes: [5, 12, 13, 17]
Attack type: backdoor, lambda: 1.0
Backdoor target label: 0, trigger size: 4
Model variant: baseline
Model parameters: 6,603,710
Initial test acc across nodes: mean=0.0168 ± 0.0139
Backdoor attack: Created poisoned datasets for 4 compromised nodes
Round 001: test acc mean=0.5147 ± 0.1707 | min=0.0034 max=0.5958
         : test loss mean=19040.5597 ± 58508.7221
         : individual accs = ['0.579942', '0.585534', '0.590296', '0.557812', '0.578832', '0.587357', '0.563320', '0.544033', '0.563350', '0.565583', '0.575428', '0.594562', '0.003420', '0.005718', '0.595755', '0.579796', '0.554057', '0.547693', '0.563173', '0.558140']
         : correct/total = [(2394, 4128), (2461, 4203), (2409, 4081), (2417, 4333), (2368, 4091), (2518, 4287), (2362, 4193), (2366, 4349), (2361, 4191), (2419, 4277), (2384, 4143), (2493, 4193), (14, 4093), (24, 4197), (2414, 4052), (2336, 4029), (2301, 4153), (2291, 4183), (2300, 4084), (2304, 4128)]
         : compromised: 0.2860, honest: 0.5719
Round 002: test acc mean=0.6715 ± 0.2152 | min=0.0267 max=0.7635
         : test loss mean=30935577.2076 ± 94110484.9003
         : individual accs = ['0.754118', '0.748513', '0.744425', '0.725594', '0.754339', '0.763471', '0.727403', '0.721545', '0.735624', '0.754501', '0.736182', '0.747913', '0.027119', '0.026686', '0.744817', '0.745594', '0.753913', '0.736553', '0.752938', '0.729409']
         : correct/total = [(3113, 4128), (3146, 4203), (3038, 4081), (3144, 4333), (3086, 4091), (3273, 4287), (3050, 4193), (3138, 4349), (3083, 4191), (3227, 4277), (3050, 4143), (3136, 4193), (111, 4093), (112, 4197), (3018, 4052), (3004, 4029), (3131, 4153), (3081, 4183), (3075, 4084), (3011, 4128)]
         : compromised: 0.3885, honest: 0.7423
Round 003: test acc mean=0.7089 ± 0.2314 | min=0.0044 max=0.8031
         : test loss mean=17670521.1660 ± 53054186.6979
         : individual accs = ['0.798450', '0.789912', '0.791963', '0.795754', '0.797360', '0.768836', '0.780110', '0.801794', '0.787402', '0.803133', '0.786628', '0.765800', '0.004398', '0.026686', '0.787512', '0.779102', '0.797014', '0.761415', '0.784525', '0.770591']
         : correct/total = [(3296, 4128), (3320, 4203), (3232, 4081), (3448, 4333), (3262, 4091), (3296, 4287), (3271, 4193), (3487, 4349), (3300, 4191), (3435, 4277), (3259, 4143), (3211, 4193), (18, 4093), (112, 4197), (3191, 4052), (3139, 4029), (3310, 4153), (3185, 4183), (3204, 4084), (3181, 4128)]
         : compromised: 0.3903, honest: 0.7886
Round 004: test acc mean=0.7281 ± 0.2362 | min=0.0161 max=0.8233
         : test loss mean=1.0116 ± 1.2147
         : individual accs = ['0.800630', '0.817749', '0.816467', '0.812139', '0.816671', '0.794728', '0.797281', '0.816280', '0.805536', '0.809680', '0.803283', '0.802290', '0.016125', '0.024065', '0.796890', '0.809630', '0.823260', '0.804686', '0.803379', '0.791424']
         : correct/total = [(3305, 4128), (3437, 4203), (3332, 4081), (3519, 4333), (3341, 4091), (3407, 4287), (3343, 4193), (3550, 4349), (3376, 4191), (3463, 4277), (3328, 4143), (3364, 4193), (66, 4093), (101, 4197), (3229, 4052), (3262, 4029), (3419, 4153), (3366, 4183), (3281, 4084), (3267, 4128)]
         : compromised: 0.4099, honest: 0.8077
Round 005: test acc mean=0.7415 ± 0.2302 | min=0.0491 max=0.8431
         : test loss mean=120848386.8501 ± 362545159.5508
         : individual accs = ['0.821705', '0.830597', '0.822838', '0.815140', '0.843070', '0.819454', '0.815884', '0.823408', '0.814126', '0.827917', '0.813179', '0.798951', '0.054239', '0.049083', '0.800839', '0.818069', '0.826872', '0.805642', '0.812929', '0.816618']
         : correct/total = [(3392, 4128), (3491, 4203), (3358, 4081), (3532, 4333), (3449, 4091), (3513, 4287), (3421, 4193), (3581, 4349), (3412, 4191), (3541, 4277), (3369, 4143), (3350, 4193), (222, 4093), (206, 4197), (3245, 4052), (3296, 4029), (3434, 4153), (3370, 4183), (3320, 4084), (3371, 4128)]
         : compromised: 0.4321, honest: 0.8189
Round 006: test acc mean=0.7422 ± 0.2461 | min=0.0039 max=0.8406
         : test loss mean=2748502138.7335 ± 8245506563.4987
         : individual accs = ['0.829942', '0.830835', '0.830189', '0.820448', '0.829137', '0.811290', '0.817553', '0.828696', '0.821045', '0.829553', '0.819937', '0.822561', '0.003909', '0.004765', '0.829714', '0.819806', '0.826631', '0.809706', '0.840597', '0.818314']
         : correct/total = [(3426, 4128), (3492, 4203), (3388, 4081), (3555, 4333), (3392, 4091), (3478, 4287), (3428, 4193), (3604, 4349), (3441, 4191), (3548, 4277), (3397, 4143), (3449, 4193), (16, 4093), (20, 4197), (3362, 4052), (3303, 4029), (3433, 4153), (3387, 4183), (3433, 4084), (3378, 4128)]
         : compromised: 0.4074, honest: 0.8259
Round 007: test acc mean=0.7474 ± 0.2476 | min=0.0049 max=0.8460
         : test loss mean=6615086740.7582 ± 19845281465.4986
         : individual accs = ['0.828973', '0.829883', '0.837785', '0.833833', '0.846003', '0.825986', '0.827331', '0.843642', '0.833214', '0.833528', '0.819455', '0.823754', '0.004886', '0.005004', '0.836377', '0.820055', '0.828558', '0.812336', '0.836435', '0.820252']
         : correct/total = [(3422, 4128), (3488, 4203), (3419, 4081), (3613, 4333), (3461, 4091), (3541, 4287), (3469, 4193), (3669, 4349), (3492, 4191), (3565, 4277), (3395, 4143), (3454, 4193), (20, 4093), (21, 4197), (3389, 4052), (3304, 4029), (3441, 4153), (3398, 4183), (3416, 4084), (3386, 4128)]
         : compromised: 0.4121, honest: 0.8312
Round 008: test acc mean=0.7524 ± 0.2419 | min=0.0261 max=0.8497
         : test loss mean=3171185682.2570 ± 9514037378.3376
         : individual accs = ['0.828731', '0.848204', '0.841215', '0.844219', '0.849670', '0.819921', '0.828762', '0.837664', '0.831067', '0.842647', '0.831282', '0.824231', '0.026142', '0.028354', '0.820336', '0.825267', '0.838912', '0.811618', '0.843046', '0.825824']
         : correct/total = [(3421, 4128), (3565, 4203), (3433, 4081), (3658, 4333), (3476, 4091), (3515, 4287), (3475, 4193), (3643, 4349), (3483, 4191), (3604, 4277), (3444, 4143), (3456, 4193), (107, 4093), (119, 4197), (3324, 4052), (3325, 4029), (3484, 4153), (3395, 4183), (3443, 4084), (3409, 4128)]
         : compromised: 0.4215, honest: 0.8351
Round 009: test acc mean=0.7527 ± 0.2494 | min=0.0039 max=0.8526
         : test loss mean=50.2110 ± 149.1339
         : individual accs = ['0.832607', '0.845349', '0.844891', '0.835910', '0.843803', '0.826685', '0.825900', '0.852610', '0.836077', '0.841711', '0.825730', '0.834963', '0.003909', '0.005480', '0.830454', '0.833457', '0.840116', '0.824528', '0.839128', '0.830911']
         : correct/total = [(3437, 4128), (3553, 4203), (3448, 4081), (3622, 4333), (3452, 4091), (3544, 4287), (3463, 4193), (3708, 4349), (3504, 4191), (3600, 4277), (3421, 4143), (3501, 4193), (16, 4093), (23, 4197), (3365, 4052), (3358, 4029), (3489, 4153), (3449, 4183), (3427, 4084), (3430, 4128)]
         : compromised: 0.4152, honest: 0.8371
Round 010: test acc mean=0.7527 ± 0.2499 | min=0.0024 max=0.8523
         : test loss mean=9.1307 ± 25.8918
         : individual accs = ['0.838421', '0.843207', '0.839745', '0.852296', '0.850403', '0.824353', '0.818746', '0.843642', '0.827726', '0.845219', '0.837799', '0.830432', '0.004398', '0.002383', '0.829714', '0.832713', '0.840597', '0.820703', '0.844270', '0.826308']
         : correct/total = [(3461, 4128), (3544, 4203), (3427, 4081), (3693, 4333), (3479, 4091), (3534, 4287), (3433, 4193), (3669, 4349), (3469, 4191), (3615, 4277), (3471, 4143), (3482, 4193), (18, 4093), (10, 4197), (3362, 4052), (3355, 4029), (3491, 4153), (3433, 4183), (3448, 4084), (3411, 4128)]
         : compromised: 0.4130, honest: 0.8376

=== FINAL RESULTS ===
Dataset: femnist, Nodes: 20, Graph: ring, Aggregation: krum
Attack: backdoor, 20.0% compromised
Final accuracy - Compromised: 0.4130, Honest: 0.8376
Overall test accuracy: mean=0.7527 ± 0.2499

=== BACKDOOR ATTACK SUCCESS RATE (ASR) ===
Target label: 0
Trigger size: 4x4
Overall ASR: 0.0460 ± 0.0171
Honest nodes ASR: 0.0508 ± 0.0083
Compromised nodes ASR: 0.0271 ± 0.0271
Note: Higher ASR indicates more successful backdoor attack
