Device: cuda
Seed: 987654321
Loading 36 LEAF FEMNIST train files...
LEAF FEMNIST train: 3597 users, 734463 samples
Loading 36 LEAF FEMNIST test files...
LEAF FEMNIST test: 3597 users, 83388 samples
Found 3597 train users, 3597 test users, 3597 common users
User sample counts range: 525 (max) to 17 (min)
Distributed ALL 3597 users across 20 clients
Users per client: 179 (with 17 clients getting +1 user)
Train partition sizes: [36360, 37070, 35957, 38262, 36024, 37732, 36921, 38328, 36867, 37683, 36507, 36915, 36007, 37001, 35681, 35453, 36585, 36801, 35964, 36345]
Test partition sizes: [4128, 4203, 4081, 4333, 4091, 4287, 4193, 4349, 4191, 4277, 4143, 4193, 4093, 4197, 4052, 4029, 4153, 4183, 4084, 4128]
  Client 0: 36360 train samples, 62 unique classes
  Client 1: 37070 train samples, 62 unique classes
  Client 2: 35957 train samples, 62 unique classes
  Client 3: 38262 train samples, 62 unique classes
  Client 4: 36024 train samples, 62 unique classes
  Client 5: 37732 train samples, 62 unique classes
  Client 6: 36921 train samples, 62 unique classes
  Client 7: 38328 train samples, 62 unique classes
  Client 8: 36867 train samples, 62 unique classes
  Client 9: 37683 train samples, 62 unique classes
  Client 10: 36507 train samples, 62 unique classes
  Client 11: 36915 train samples, 62 unique classes
  Client 12: 36007 train samples, 62 unique classes
  Client 13: 37001 train samples, 62 unique classes
  Client 14: 35681 train samples, 62 unique classes
  Client 15: 35453 train samples, 62 unique classes
  Client 16: 36585 train samples, 62 unique classes
  Client 17: 36801 train samples, 62 unique classes
  Client 18: 35964 train samples, 62 unique classes
  Client 19: 36345 train samples, 62 unique classes
Will sample 10000 samples per client per epoch
Graph: erdos, nodes: 20, edges: 99
Degree statistics: avg=9.90, min=7, max=14
Attack: Compromised 14/20 nodes: [1, 2, 3, 5, 6, 8, 11, 12, 13, 14, 15, 17, 18, 19]
Attack type: backdoor, lambda: 1.0
Backdoor target label: 0, trigger size: 4
Model variant: baseline
Model parameters: 6,603,710
Sketchguard Node 0:
  Model dim: 6,603,710 → Sketch size: 1000
  Compression ratio: 6603.7x
  Using model parameters for aggregation, sketches for filtering
Sketchguard Node 1:
  Model dim: 6,603,710 → Sketch size: 1000
  Compression ratio: 6603.7x
  Using model parameters for aggregation, sketches for filtering
Sketchguard Node 2:
  Model dim: 6,603,710 → Sketch size: 1000
  Compression ratio: 6603.7x
  Using model parameters for aggregation, sketches for filtering
Sketchguard Node 3:
  Model dim: 6,603,710 → Sketch size: 1000
  Compression ratio: 6603.7x
  Using model parameters for aggregation, sketches for filtering
Sketchguard Node 4:
  Model dim: 6,603,710 → Sketch size: 1000
  Compression ratio: 6603.7x
  Using model parameters for aggregation, sketches for filtering
Sketchguard Node 5:
  Model dim: 6,603,710 → Sketch size: 1000
  Compression ratio: 6603.7x
  Using model parameters for aggregation, sketches for filtering
Sketchguard Node 6:
  Model dim: 6,603,710 → Sketch size: 1000
  Compression ratio: 6603.7x
  Using model parameters for aggregation, sketches for filtering
Sketchguard Node 7:
  Model dim: 6,603,710 → Sketch size: 1000
  Compression ratio: 6603.7x
  Using model parameters for aggregation, sketches for filtering
Sketchguard Node 8:
  Model dim: 6,603,710 → Sketch size: 1000
  Compression ratio: 6603.7x
  Using model parameters for aggregation, sketches for filtering
Sketchguard Node 9:
  Model dim: 6,603,710 → Sketch size: 1000
  Compression ratio: 6603.7x
  Using model parameters for aggregation, sketches for filtering
Sketchguard Node 10:
  Model dim: 6,603,710 → Sketch size: 1000
  Compression ratio: 6603.7x
  Using model parameters for aggregation, sketches for filtering
Sketchguard Node 11:
  Model dim: 6,603,710 → Sketch size: 1000
  Compression ratio: 6603.7x
  Using model parameters for aggregation, sketches for filtering
Sketchguard Node 12:
  Model dim: 6,603,710 → Sketch size: 1000
  Compression ratio: 6603.7x
  Using model parameters for aggregation, sketches for filtering
Sketchguard Node 13:
  Model dim: 6,603,710 → Sketch size: 1000
  Compression ratio: 6603.7x
  Using model parameters for aggregation, sketches for filtering
Sketchguard Node 14:
  Model dim: 6,603,710 → Sketch size: 1000
  Compression ratio: 6603.7x
  Using model parameters for aggregation, sketches for filtering
Sketchguard Node 15:
  Model dim: 6,603,710 → Sketch size: 1000
  Compression ratio: 6603.7x
  Using model parameters for aggregation, sketches for filtering
Sketchguard Node 16:
  Model dim: 6,603,710 → Sketch size: 1000
  Compression ratio: 6603.7x
  Using model parameters for aggregation, sketches for filtering
Sketchguard Node 17:
  Model dim: 6,603,710 → Sketch size: 1000
  Compression ratio: 6603.7x
  Using model parameters for aggregation, sketches for filtering
Sketchguard Node 18:
  Model dim: 6,603,710 → Sketch size: 1000
  Compression ratio: 6603.7x
  Using model parameters for aggregation, sketches for filtering
Sketchguard Node 19:
  Model dim: 6,603,710 → Sketch size: 1000
  Compression ratio: 6603.7x
  Using model parameters for aggregation, sketches for filtering
Sketchguard ALGORITHM (Sketch-based Filtering + State Aggregation)
  - Model dimension: 6,603,710 parameters
  - Config: SketchguardConfig(gamma=2, kappa=1, alpha=0.5, min_neighbors=1, sketch_size=1000, network_seed=987654321, attack_detection_window=5)
  - Sketch size: 1000
  - Compression ratio: 6603.7x
  - Complexity: O(d + N×k) = O(6,603,710 + 20×1000)
  - Theoretical speedup vs BALANCE: 19.9x
Initial test acc across nodes: mean=0.0162 ± 0.0138
Backdoor attack: Created poisoned datasets for 14 compromised nodes
Round 001: test acc mean=0.1951 ± 0.1541 | min=0.0427 max=0.4954
         : test loss mean=12157.4323 ± 8330.9694
         : individual accs = ['0.495397', '0.048775', '0.193335', '0.057928', '0.441701', '0.170049', '0.042690', '0.406530', '0.096874', '0.399579', '0.292542', '0.143573', '0.047398', '0.047653', '0.169546', '0.062795', '0.444739', '0.178341', '0.107982', '0.054990']
         : correct/total = [(2045, 4128), (205, 4203), (789, 4081), (251, 4333), (1807, 4091), (729, 4287), (179, 4193), (1768, 4349), (406, 4191), (1709, 4277), (1212, 4143), (602, 4193), (194, 4093), (200, 4197), (687, 4052), (253, 4029), (1847, 4153), (746, 4183), (441, 4084), (227, 4128)]
         : compromised: 0.1016, honest: 0.4134
         : sketchguard stats = ['Node 0: acc_rate=0.333', 'Node 1: acc_rate=0.400', 'Node 2: acc_rate=0.375']...
Round 002: test acc mean=0.2241 ± 0.2938 | min=0.0033 max=0.6977
         : test loss mean=2052609.8718 ± 6473841.9989
         : individual accs = ['0.695252', '0.050440', '0.046312', '0.047542', '0.664141', '0.052951', '0.004054', '0.651414', '0.003340', '0.697685', '0.650978', '0.050560', '0.005375', '0.003812', '0.050592', '0.006701', '0.671563', '0.046378', '0.038932', '0.043120']
         : correct/total = [(2870, 4128), (212, 4203), (189, 4081), (206, 4333), (2717, 4091), (227, 4287), (17, 4193), (2833, 4349), (14, 4191), (2984, 4277), (2697, 4143), (212, 4193), (22, 4093), (16, 4197), (205, 4052), (27, 4029), (2789, 4153), (194, 4183), (159, 4084), (178, 4128)]
         : compromised: 0.0322, honest: 0.6718
         : sketchguard stats = ['Node 0: acc_rate=0.333', 'Node 1: acc_rate=0.700', 'Node 2: acc_rate=0.688']...
Round 003: test acc mean=0.2469 ± 0.3103 | min=0.0049 max=0.7380
         : test loss mean=1574619711206907802787250176.0000 ± 6255802630492629440915308544.0000
         : individual accs = ['0.727229', '0.048775', '0.006371', '0.046619', '0.712540', '0.058782', '0.041498', '0.726374', '0.051062', '0.726444', '0.691045', '0.048891', '0.047642', '0.047653', '0.004936', '0.054604', '0.738021', '0.049247', '0.054358', '0.054990']
         : correct/total = [(3002, 4128), (205, 4203), (26, 4081), (202, 4333), (2915, 4091), (252, 4287), (174, 4193), (3159, 4349), (214, 4191), (3107, 4277), (2863, 4143), (205, 4193), (195, 4093), (200, 4197), (20, 4052), (220, 4029), (3065, 4153), (206, 4183), (222, 4084), (227, 4128)]
         : compromised: 0.0440, honest: 0.7203
         : sketchguard stats = ['Node 0: acc_rate=0.333', 'Node 1: acc_rate=0.800', 'Node 2: acc_rate=0.792']...
Round 004: test acc mean=0.2693 ± 0.3342 | min=0.0415 max=0.7920
         : test loss mean=nan ± nan
         : individual accs = ['0.779070', '0.048775', '0.049743', '0.046619', '0.777316', '0.052484', '0.041498', '0.791676', '0.057266', '0.785597', '0.752353', '0.048891', '0.047398', '0.047653', '0.054788', '0.054604', '0.791958', '0.049247', '0.054358', '0.054990']
         : correct/total = [(3216, 4128), (205, 4203), (203, 4081), (202, 4333), (3180, 4091), (225, 4287), (174, 4193), (3443, 4349), (240, 4191), (3360, 4277), (3117, 4143), (205, 4193), (194, 4093), (200, 4197), (222, 4052), (220, 4029), (3289, 4153), (206, 4183), (222, 4084), (227, 4128)]
         : compromised: 0.0506, honest: 0.7797
         : sketchguard stats = ['Node 0: acc_rate=0.333', 'Node 1: acc_rate=0.600', 'Node 2: acc_rate=0.594']...
Round 005: test acc mean=0.2760 ± 0.3451 | min=0.0415 max=0.8130
         : test loss mean=nan ± nan
         : individual accs = ['0.801357', '0.048775', '0.049743', '0.046619', '0.793693', '0.052484', '0.041498', '0.810991', '0.051062', '0.812953', '0.788559', '0.048891', '0.047398', '0.047653', '0.054788', '0.054604', '0.810739', '0.049247', '0.054358', '0.054990']
         : correct/total = [(3308, 4128), (205, 4203), (203, 4081), (202, 4333), (3247, 4091), (225, 4287), (174, 4193), (3527, 4349), (214, 4191), (3477, 4277), (3267, 4143), (205, 4193), (194, 4093), (200, 4197), (222, 4052), (220, 4029), (3367, 4153), (206, 4183), (222, 4084), (227, 4128)]
         : compromised: 0.0502, honest: 0.8030
         : sketchguard stats = ['Node 0: acc_rate=0.333', 'Node 1: acc_rate=0.480', 'Node 2: acc_rate=0.475']...
Round 006: test acc mean=0.2812 ± 0.3530 | min=0.0415 max=0.8326
         : test loss mean=nan ± nan
         : individual accs = ['0.814196', '0.048775', '0.049743', '0.046619', '0.813982', '0.052484', '0.041498', '0.832605', '0.051062', '0.823942', '0.809800', '0.048891', '0.047398', '0.047653', '0.054788', '0.054604', '0.827113', '0.049247', '0.054358', '0.054990']
         : correct/total = [(3361, 4128), (205, 4203), (203, 4081), (202, 4333), (3330, 4091), (225, 4287), (174, 4193), (3621, 4349), (214, 4191), (3524, 4277), (3355, 4143), (205, 4193), (194, 4093), (200, 4197), (222, 4052), (220, 4029), (3435, 4153), (206, 4183), (222, 4084), (227, 4128)]
         : compromised: 0.0502, honest: 0.8203
         : sketchguard stats = ['Node 0: acc_rate=0.333', 'Node 1: acc_rate=0.400', 'Node 2: acc_rate=0.396']...
Round 007: test acc mean=0.2849 ± 0.3585 | min=0.0415 max=0.8388
         : test loss mean=nan ± nan
         : individual accs = ['0.827519', '0.048775', '0.049743', '0.046619', '0.827670', '0.052484', '0.041498', '0.838814', '0.051062', '0.838204', '0.824765', '0.048891', '0.047398', '0.047653', '0.054788', '0.054604', '0.837948', '0.049247', '0.054358', '0.054990']
         : correct/total = [(3416, 4128), (205, 4203), (203, 4081), (202, 4333), (3386, 4091), (225, 4287), (174, 4193), (3648, 4349), (214, 4191), (3585, 4277), (3417, 4143), (205, 4193), (194, 4093), (200, 4197), (222, 4052), (220, 4029), (3480, 4153), (206, 4183), (222, 4084), (227, 4128)]
         : compromised: 0.0502, honest: 0.8325
         : sketchguard stats = ['Node 0: acc_rate=0.333', 'Node 1: acc_rate=0.343', 'Node 2: acc_rate=0.339']...
Round 008: test acc mean=0.2858 ± 0.3600 | min=0.0415 max=0.8443
         : test loss mean=nan ± nan
         : individual accs = ['0.829700', '0.048775', '0.049743', '0.046619', '0.835493', '0.052484', '0.041498', '0.844332', '0.051062', '0.843114', '0.825972', '0.048891', '0.047398', '0.047653', '0.054788', '0.054604', '0.835781', '0.049247', '0.054358', '0.054990']
         : correct/total = [(3425, 4128), (205, 4203), (203, 4081), (202, 4333), (3418, 4091), (225, 4287), (174, 4193), (3672, 4349), (214, 4191), (3606, 4277), (3422, 4143), (205, 4193), (194, 4093), (200, 4197), (222, 4052), (220, 4029), (3471, 4153), (206, 4183), (222, 4084), (227, 4128)]
         : compromised: 0.0502, honest: 0.8357
         : sketchguard stats = ['Node 0: acc_rate=0.333', 'Node 1: acc_rate=0.300', 'Node 2: acc_rate=0.297']...
Round 009: test acc mean=0.2873 ± 0.3622 | min=0.0415 max=0.8529
         : test loss mean=nan ± nan
         : individual accs = ['0.835029', '0.048775', '0.049743', '0.046619', '0.832559', '0.052484', '0.041498', '0.849851', '0.051062', '0.852934', '0.837557', '0.048891', '0.047398', '0.047653', '0.054788', '0.054604', '0.835300', '0.049247', '0.054358', '0.054990']
         : correct/total = [(3447, 4128), (205, 4203), (203, 4081), (202, 4333), (3406, 4091), (225, 4287), (174, 4193), (3696, 4349), (214, 4191), (3648, 4277), (3470, 4143), (205, 4193), (194, 4093), (200, 4197), (222, 4052), (220, 4029), (3469, 4153), (206, 4183), (222, 4084), (227, 4128)]
         : compromised: 0.0502, honest: 0.8405
         : sketchguard stats = ['Node 0: acc_rate=0.333', 'Node 1: acc_rate=0.267', 'Node 2: acc_rate=0.264']...
Round 010: test acc mean=0.2887 ± 0.3644 | min=0.0415 max=0.8522
         : test loss mean=nan ± nan
         : individual accs = ['0.843023', '0.048775', '0.049743', '0.046619', '0.840137', '0.052484', '0.041498', '0.849391', '0.051062', '0.852233', '0.839488', '0.048891', '0.047398', '0.047653', '0.054788', '0.054604', '0.848062', '0.049247', '0.054358', '0.054990']
         : correct/total = [(3480, 4128), (205, 4203), (203, 4081), (202, 4333), (3437, 4091), (225, 4287), (174, 4193), (3694, 4349), (214, 4191), (3645, 4277), (3478, 4143), (205, 4193), (194, 4093), (200, 4197), (222, 4052), (220, 4029), (3522, 4153), (206, 4183), (222, 4084), (227, 4128)]
         : compromised: 0.0502, honest: 0.8454
         : sketchguard stats = ['Node 0: acc_rate=0.333', 'Node 1: acc_rate=0.240', 'Node 2: acc_rate=0.237']...

=== FINAL RESULTS ===
Dataset: femnist, Nodes: 20, Graph: erdos, Aggregation: sketchguard
Attack: backdoor, 70.0% compromised
Final accuracy - Compromised: 0.0502, Honest: 0.8454
Overall test accuracy: mean=0.2887 ± 0.3644

=== BACKDOOR ATTACK SUCCESS RATE (ASR) ===
Target label: 0
Trigger size: 4x4
Overall ASR: 0.7159 ± 0.4339
Honest nodes ASR: 0.0531 ± 0.0031
Compromised nodes ASR: 1.0000 ± 0.0000
Note: Higher ASR indicates more successful backdoor attack

=== Sketchguard SUMMARY ===
Node 0: acceptance=0.333
Node 1: acceptance=0.240
Node 2: acceptance=0.237
Node 3: acceptance=0.243
Node 4: acceptance=0.333
Node 5: acceptance=0.220
Node 6: acceptance=0.225
Node 7: acceptance=0.273
Node 8: acceptance=0.314
Node 9: acceptance=0.364
Node 10: acceptance=0.250
Node 11: acceptance=0.225
Node 12: acceptance=0.233
Node 13: acceptance=0.211
Node 14: acceptance=0.229
Node 15: acceptance=0.233
Node 16: acceptance=0.286
Node 17: acceptance=0.250
Node 18: acceptance=0.225
Node 19: acceptance=0.220

=== PARALLEL EXECUTION TIME (realistic for distributed system) ===
  COMMUNICATION (max across nodes):
    - Sketch transfer: 0.000s (0.0%)
    - Model fetch (accepted): 0.000s (0.0%)
  COMPUTATION (max across nodes):
    - Sketching: 2.204s (99.0%)
    - Filtering: 0.001s (0.1%)
    - Aggregation: 0.022s (1.0%)
  TOTALS:
    - Total computation: 2.227s (100.0%)
    - Total communication: 0.000s (0.0%)
    - Total parallel time: 2.227s

=== PER-NODE AVERAGE TIME ===
  - Sketching: 1.829s
  - Filtering: 0.001s
  - Aggregation: 0.012s
  - Sketch transfer: 0.000s
  - Model fetch: 0.000s
  - Total per node: 1.842s

=== TOTAL COMPUTATIONAL WORK (sum across all nodes) ===
  - Total sketching: 36.576s
  - Total filtering: 0.017s
  - Total aggregation: 0.246s
  - Total sketch transfer: 0.000s
  - Total model fetch: 0.000s
  - Grand total: 36.840s
  - Mean acceptance rate: 0.257

Sketchguard Algorithm Properties:
  - Original dimension: 6,603,710
  - Sketch size: 1000
  - Compression ratio: 19.9x
  - Single repetition: No repetitions needed
  - Theoretical complexity: O(d + N×k)
  - Approach: Sketch filtering + state aggregation
