Device: cuda
Seed: 987654321
Loading 36 LEAF FEMNIST train files...
LEAF FEMNIST train: 3597 users, 734463 samples
Loading 36 LEAF FEMNIST test files...
LEAF FEMNIST test: 3597 users, 83388 samples
Found 3597 train users, 3597 test users, 3597 common users
User sample counts range: 525 (max) to 17 (min)
Distributed ALL 3597 users across 20 clients
Users per client: 179 (with 17 clients getting +1 user)
Train partition sizes: [36360, 37070, 35957, 38262, 36024, 37732, 36921, 38328, 36867, 37683, 36507, 36915, 36007, 37001, 35681, 35453, 36585, 36801, 35964, 36345]
Test partition sizes: [4128, 4203, 4081, 4333, 4091, 4287, 4193, 4349, 4191, 4277, 4143, 4193, 4093, 4197, 4052, 4029, 4153, 4183, 4084, 4128]
  Client 0: 36360 train samples, 62 unique classes
  Client 1: 37070 train samples, 62 unique classes
  Client 2: 35957 train samples, 62 unique classes
  Client 3: 38262 train samples, 62 unique classes
  Client 4: 36024 train samples, 62 unique classes
  Client 5: 37732 train samples, 62 unique classes
  Client 6: 36921 train samples, 62 unique classes
  Client 7: 38328 train samples, 62 unique classes
  Client 8: 36867 train samples, 62 unique classes
  Client 9: 37683 train samples, 62 unique classes
  Client 10: 36507 train samples, 62 unique classes
  Client 11: 36915 train samples, 62 unique classes
  Client 12: 36007 train samples, 62 unique classes
  Client 13: 37001 train samples, 62 unique classes
  Client 14: 35681 train samples, 62 unique classes
  Client 15: 35453 train samples, 62 unique classes
  Client 16: 36585 train samples, 62 unique classes
  Client 17: 36801 train samples, 62 unique classes
  Client 18: 35964 train samples, 62 unique classes
  Client 19: 36345 train samples, 62 unique classes
Will sample 10000 samples per client per epoch
Graph: erdos, nodes: 20, edges: 99
Degree statistics: avg=9.90, min=7, max=14
Attack: Compromised 6/20 nodes: [5, 12, 13, 14, 17, 18]
Attack type: backdoor, lambda: 1.0
Backdoor target label: 0, trigger size: 4
Model variant: baseline
Model parameters: 6,603,710
Sketchguard Node 0:
  Model dim: 6,603,710 → Sketch size: 1000
  Compression ratio: 6603.7x
  Using model parameters for aggregation, sketches for filtering
Sketchguard Node 1:
  Model dim: 6,603,710 → Sketch size: 1000
  Compression ratio: 6603.7x
  Using model parameters for aggregation, sketches for filtering
Sketchguard Node 2:
  Model dim: 6,603,710 → Sketch size: 1000
  Compression ratio: 6603.7x
  Using model parameters for aggregation, sketches for filtering
Sketchguard Node 3:
  Model dim: 6,603,710 → Sketch size: 1000
  Compression ratio: 6603.7x
  Using model parameters for aggregation, sketches for filtering
Sketchguard Node 4:
  Model dim: 6,603,710 → Sketch size: 1000
  Compression ratio: 6603.7x
  Using model parameters for aggregation, sketches for filtering
Sketchguard Node 5:
  Model dim: 6,603,710 → Sketch size: 1000
  Compression ratio: 6603.7x
  Using model parameters for aggregation, sketches for filtering
Sketchguard Node 6:
  Model dim: 6,603,710 → Sketch size: 1000
  Compression ratio: 6603.7x
  Using model parameters for aggregation, sketches for filtering
Sketchguard Node 7:
  Model dim: 6,603,710 → Sketch size: 1000
  Compression ratio: 6603.7x
  Using model parameters for aggregation, sketches for filtering
Sketchguard Node 8:
  Model dim: 6,603,710 → Sketch size: 1000
  Compression ratio: 6603.7x
  Using model parameters for aggregation, sketches for filtering
Sketchguard Node 9:
  Model dim: 6,603,710 → Sketch size: 1000
  Compression ratio: 6603.7x
  Using model parameters for aggregation, sketches for filtering
Sketchguard Node 10:
  Model dim: 6,603,710 → Sketch size: 1000
  Compression ratio: 6603.7x
  Using model parameters for aggregation, sketches for filtering
Sketchguard Node 11:
  Model dim: 6,603,710 → Sketch size: 1000
  Compression ratio: 6603.7x
  Using model parameters for aggregation, sketches for filtering
Sketchguard Node 12:
  Model dim: 6,603,710 → Sketch size: 1000
  Compression ratio: 6603.7x
  Using model parameters for aggregation, sketches for filtering
Sketchguard Node 13:
  Model dim: 6,603,710 → Sketch size: 1000
  Compression ratio: 6603.7x
  Using model parameters for aggregation, sketches for filtering
Sketchguard Node 14:
  Model dim: 6,603,710 → Sketch size: 1000
  Compression ratio: 6603.7x
  Using model parameters for aggregation, sketches for filtering
Sketchguard Node 15:
  Model dim: 6,603,710 → Sketch size: 1000
  Compression ratio: 6603.7x
  Using model parameters for aggregation, sketches for filtering
Sketchguard Node 16:
  Model dim: 6,603,710 → Sketch size: 1000
  Compression ratio: 6603.7x
  Using model parameters for aggregation, sketches for filtering
Sketchguard Node 17:
  Model dim: 6,603,710 → Sketch size: 1000
  Compression ratio: 6603.7x
  Using model parameters for aggregation, sketches for filtering
Sketchguard Node 18:
  Model dim: 6,603,710 → Sketch size: 1000
  Compression ratio: 6603.7x
  Using model parameters for aggregation, sketches for filtering
Sketchguard Node 19:
  Model dim: 6,603,710 → Sketch size: 1000
  Compression ratio: 6603.7x
  Using model parameters for aggregation, sketches for filtering
Sketchguard ALGORITHM (Sketch-based Filtering + State Aggregation)
  - Model dimension: 6,603,710 parameters
  - Config: SketchguardConfig(gamma=2, kappa=1, alpha=0.5, min_neighbors=1, sketch_size=1000, network_seed=987654321, attack_detection_window=5)
  - Sketch size: 1000
  - Compression ratio: 6603.7x
  - Complexity: O(d + N×k) = O(6,603,710 + 20×1000)
  - Theoretical speedup vs BALANCE: 19.9x
Initial test acc across nodes: mean=0.0162 ± 0.0138
Backdoor attack: Created poisoned datasets for 6 compromised nodes
Round 001: test acc mean=0.3728 ± 0.1698 | min=0.0474 max=0.5460
         : test loss mean=5186.5736 ± 8123.8367
         : individual accs = ['0.546027', '0.497026', '0.498897', '0.453958', '0.473967', '0.173781', '0.481994', '0.471373', '0.460988', '0.454290', '0.449916', '0.529454', '0.047398', '0.047653', '0.167572', '0.515264', '0.451240', '0.179536', '0.109941', '0.446221']
         : correct/total = [(2254, 4128), (2089, 4203), (2036, 4081), (1967, 4333), (1939, 4091), (745, 4287), (2021, 4193), (2050, 4349), (1932, 4191), (1943, 4277), (1864, 4143), (2220, 4193), (194, 4093), (200, 4197), (679, 4052), (2076, 4029), (1874, 4153), (751, 4183), (449, 4084), (1842, 4128)]
         : compromised: 0.1210, honest: 0.4808
         : sketchguard stats = ['Node 0: acc_rate=0.667', 'Node 1: acc_rate=0.800', 'Node 2: acc_rate=0.750']...
Round 002: test acc mean=0.4901 ± 0.2948 | min=0.0076 max=0.7047
         : test loss mean=14593.7662 ± 63296.9651
         : individual accs = ['0.701066', '0.704735', '0.661848', '0.695823', '0.694696', '0.048519', '0.636060', '0.676937', '0.680029', '0.701192', '0.680183', '0.704269', '0.048131', '0.007624', '0.047384', '0.686275', '0.659523', '0.046378', '0.045544', '0.675630']
         : correct/total = [(2894, 4128), (2962, 4203), (2701, 4081), (3015, 4333), (2842, 4091), (208, 4287), (2667, 4193), (2944, 4349), (2850, 4191), (2999, 4277), (2818, 4143), (2953, 4193), (197, 4093), (32, 4197), (192, 4052), (2765, 4029), (2739, 4153), (194, 4183), (186, 4084), (2789, 4128)]
         : compromised: 0.0406, honest: 0.6827
         : sketchguard stats = ['Node 0: acc_rate=0.667', 'Node 1: acc_rate=0.800', 'Node 2: acc_rate=0.750']...
Round 003: test acc mean=0.5124 ± 0.3026 | min=0.0474 max=0.7396
         : test loss mean=nan ± nan
         : individual accs = ['0.739583', '0.726862', '0.674099', '0.734364', '0.703740', '0.052018', '0.724302', '0.702690', '0.719399', '0.699088', '0.699493', '0.732411', '0.047398', '0.047653', '0.054788', '0.677091', '0.695642', '0.049247', '0.054358', '0.713905']
         : correct/total = [(3053, 4128), (3055, 4203), (2751, 4081), (3182, 4333), (2879, 4091), (223, 4287), (3037, 4193), (3056, 4349), (3015, 4191), (2990, 4277), (2898, 4143), (3071, 4193), (194, 4093), (200, 4197), (222, 4052), (2728, 4029), (2889, 4153), (206, 4183), (222, 4084), (2947, 4128)]
         : compromised: 0.0509, honest: 0.7102
         : sketchguard stats = ['Node 0: acc_rate=0.667', 'Node 1: acc_rate=0.800', 'Node 2: acc_rate=0.750']...
Round 004: test acc mean=0.5219 ± 0.3089 | min=0.0474 max=0.7643
         : test loss mean=nan ± nan
         : individual accs = ['0.730620', '0.738282', '0.703749', '0.724671', '0.747983', '0.052484', '0.739327', '0.705450', '0.764257', '0.712415', '0.665218', '0.734796', '0.047398', '0.047653', '0.054788', '0.722015', '0.712015', '0.049247', '0.054358', '0.731347']
         : correct/total = [(3016, 4128), (3103, 4203), (2872, 4081), (3140, 4333), (3060, 4091), (225, 4287), (3100, 4193), (3068, 4349), (3203, 4191), (3047, 4277), (2756, 4143), (3081, 4193), (194, 4093), (200, 4197), (222, 4052), (2909, 4029), (2957, 4153), (206, 4183), (222, 4084), (3019, 4128)]
         : compromised: 0.0510, honest: 0.7237
         : sketchguard stats = ['Node 0: acc_rate=0.667', 'Node 1: acc_rate=0.800', 'Node 2: acc_rate=0.750']...
Round 005: test acc mean=0.5238 ± 0.3103 | min=0.0474 max=0.7946
         : test loss mean=nan ± nan
         : individual accs = ['0.734738', '0.707590', '0.715756', '0.711747', '0.724517', '0.052484', '0.708562', '0.690044', '0.794560', '0.730652', '0.692252', '0.737896', '0.047398', '0.047653', '0.054788', '0.719037', '0.752227', '0.049247', '0.054358', '0.751453']
         : correct/total = [(3033, 4128), (2974, 4203), (2921, 4081), (3084, 4333), (2964, 4091), (225, 4287), (2971, 4193), (3001, 4349), (3330, 4191), (3125, 4277), (2868, 4143), (3094, 4193), (194, 4093), (200, 4197), (222, 4052), (2897, 4029), (3124, 4153), (206, 4183), (222, 4084), (3102, 4128)]
         : compromised: 0.0510, honest: 0.7265
         : sketchguard stats = ['Node 0: acc_rate=0.667', 'Node 1: acc_rate=0.800', 'Node 2: acc_rate=0.750']...
Round 006: test acc mean=0.5577 ± 0.3318 | min=0.0474 max=0.7977
         : test loss mean=nan ± nan
         : individual accs = ['0.758236', '0.763978', '0.784612', '0.783522', '0.777560', '0.052484', '0.758884', '0.771672', '0.797662', '0.763853', '0.770215', '0.776532', '0.047398', '0.047653', '0.054788', '0.779598', '0.783530', '0.049247', '0.054358', '0.777859']
         : correct/total = [(3130, 4128), (3211, 4203), (3202, 4081), (3395, 4333), (3181, 4091), (225, 4287), (3182, 4193), (3356, 4349), (3343, 4191), (3267, 4277), (3191, 4143), (3256, 4193), (194, 4093), (200, 4197), (222, 4052), (3141, 4029), (3254, 4153), (206, 4183), (222, 4084), (3211, 4128)]
         : compromised: 0.0510, honest: 0.7748
         : sketchguard stats = ['Node 0: acc_rate=0.667', 'Node 1: acc_rate=0.800', 'Node 2: acc_rate=0.750']...
Round 007: test acc mean=0.5808 ± 0.3469 | min=0.0474 max=0.8232
         : test loss mean=nan ± nan
         : individual accs = ['0.799176', '0.803950', '0.805440', '0.816755', '0.797604', '0.052484', '0.808252', '0.814440', '0.823193', '0.807575', '0.797490', '0.810160', '0.047398', '0.047653', '0.054788', '0.811864', '0.814833', '0.049247', '0.054358', '0.799661']
         : correct/total = [(3299, 4128), (3379, 4203), (3287, 4081), (3539, 4333), (3263, 4091), (225, 4287), (3389, 4193), (3542, 4349), (3450, 4191), (3454, 4277), (3304, 4143), (3397, 4193), (194, 4093), (200, 4197), (222, 4052), (3271, 4029), (3384, 4153), (206, 4183), (222, 4084), (3301, 4128)]
         : compromised: 0.0510, honest: 0.8079
         : sketchguard stats = ['Node 0: acc_rate=0.667', 'Node 1: acc_rate=0.800', 'Node 2: acc_rate=0.750']...
Round 008: test acc mean=0.5897 ± 0.3528 | min=0.0474 max=0.8331
         : test loss mean=nan ± nan
         : individual accs = ['0.814680', '0.818701', '0.820387', '0.833141', '0.817160', '0.052484', '0.827331', '0.826857', '0.819613', '0.827215', '0.809076', '0.829955', '0.047398', '0.047653', '0.054788', '0.826260', '0.814833', '0.049247', '0.054358', '0.803779']
         : correct/total = [(3363, 4128), (3441, 4203), (3348, 4081), (3610, 4333), (3343, 4091), (225, 4287), (3469, 4193), (3596, 4349), (3435, 4191), (3538, 4277), (3352, 4143), (3480, 4193), (194, 4093), (200, 4197), (222, 4052), (3329, 4029), (3384, 4153), (206, 4183), (222, 4084), (3318, 4128)]
         : compromised: 0.0510, honest: 0.8206
         : sketchguard stats = ['Node 0: acc_rate=0.667', 'Node 1: acc_rate=0.800', 'Node 2: acc_rate=0.750']...
Round 009: test acc mean=0.6004 ± 0.3597 | min=0.0474 max=0.8440
         : test loss mean=nan ± nan
         : individual accs = ['0.827277', '0.837973', '0.830924', '0.839834', '0.831582', '0.052484', '0.839017', '0.841573', '0.843951', '0.843816', '0.832247', '0.835440', '0.047398', '0.047653', '0.054788', '0.838918', '0.830243', '0.049247', '0.054358', '0.829942']
         : correct/total = [(3415, 4128), (3522, 4203), (3391, 4081), (3639, 4333), (3402, 4091), (225, 4287), (3518, 4193), (3660, 4349), (3537, 4191), (3609, 4277), (3448, 4143), (3503, 4193), (194, 4093), (200, 4197), (222, 4052), (3380, 4029), (3448, 4153), (206, 4183), (222, 4084), (3426, 4128)]
         : compromised: 0.0510, honest: 0.8359
         : sketchguard stats = ['Node 0: acc_rate=0.667', 'Node 1: acc_rate=0.800', 'Node 2: acc_rate=0.750']...
Round 010: test acc mean=0.6046 ± 0.3624 | min=0.0474 max=0.8501
         : test loss mean=nan ± nan
         : individual accs = ['0.834302', '0.850107', '0.841705', '0.846988', '0.834026', '0.052484', '0.848557', '0.845252', '0.844667', '0.844985', '0.832971', '0.836632', '0.047398', '0.047653', '0.054788', '0.847853', '0.841079', '0.049247', '0.054358', '0.835998']
         : correct/total = [(3444, 4128), (3573, 4203), (3435, 4081), (3670, 4333), (3412, 4091), (225, 4287), (3558, 4193), (3676, 4349), (3540, 4191), (3614, 4277), (3451, 4143), (3508, 4193), (194, 4093), (200, 4197), (222, 4052), (3416, 4029), (3493, 4153), (206, 4183), (222, 4084), (3451, 4128)]
         : compromised: 0.0510, honest: 0.8418
         : sketchguard stats = ['Node 0: acc_rate=0.667', 'Node 1: acc_rate=0.800', 'Node 2: acc_rate=0.750']...

=== FINAL RESULTS ===
Dataset: femnist, Nodes: 20, Graph: erdos, Aggregation: sketchguard
Attack: backdoor, 30.0% compromised
Final accuracy - Compromised: 0.0510, Honest: 0.8418
Overall test accuracy: mean=0.6046 ± 0.3624

=== BACKDOOR ATTACK SUCCESS RATE (ASR) ===
Target label: 0
Trigger size: 4x4
Overall ASR: 0.3380 ± 0.4334
Honest nodes ASR: 0.0543 ± 0.0044
Compromised nodes ASR: 1.0000 ± 0.0000
Note: Higher ASR indicates more successful backdoor attack

=== Sketchguard SUMMARY ===
Node 0: acceptance=0.667
Node 1: acceptance=0.800
Node 2: acceptance=0.750
Node 3: acceptance=0.714
Node 4: acceptance=0.667
Node 5: acceptance=0.270
Node 6: acceptance=0.583
Node 7: acceptance=0.545
Node 8: acceptance=0.286
Node 9: acceptance=0.909
Node 10: acceptance=0.750
Node 11: acceptance=0.583
Node 12: acceptance=0.275
Node 13: acceptance=0.278
Node 14: acceptance=0.264
Node 15: acceptance=0.556
Node 16: acceptance=0.571
Node 17: acceptance=0.275
Node 18: acceptance=0.275
Node 19: acceptance=0.600

=== PARALLEL EXECUTION TIME (realistic for distributed system) ===
  COMMUNICATION (max across nodes):
    - Sketch transfer: 0.000s (0.0%)
    - Model fetch (accepted): 0.000s (0.0%)
  COMPUTATION (max across nodes):
    - Sketching: 3.601s (99.4%)
    - Filtering: 0.002s (0.1%)
    - Aggregation: 0.021s (0.6%)
  TOTALS:
    - Total computation: 3.624s (100.0%)
    - Total communication: 0.000s (0.0%)
    - Total parallel time: 3.624s

=== PER-NODE AVERAGE TIME ===
  - Sketching: 2.351s
  - Filtering: 0.001s
  - Aggregation: 0.013s
  - Sketch transfer: 0.000s
  - Model fetch: 0.000s
  - Total per node: 2.365s

=== TOTAL COMPUTATIONAL WORK (sum across all nodes) ===
  - Total sketching: 47.027s
  - Total filtering: 0.019s
  - Total aggregation: 0.253s
  - Total sketch transfer: 0.000s
  - Total model fetch: 0.000s
  - Grand total: 47.300s
  - Mean acceptance rate: 0.531

Sketchguard Algorithm Properties:
  - Original dimension: 6,603,710
  - Sketch size: 1000
  - Compression ratio: 19.9x
  - Single repetition: No repetitions needed
  - Theoretical complexity: O(d + N×k)
  - Approach: Sketch filtering + state aggregation
