Device: cuda
Seed: 987654321
Loading 36 LEAF FEMNIST train files...
LEAF FEMNIST train: 3597 users, 734463 samples
Loading 36 LEAF FEMNIST test files...
LEAF FEMNIST test: 3597 users, 83388 samples
Found 3597 train users, 3597 test users, 3597 common users
User sample counts range: 525 (max) to 17 (min)
Distributed ALL 3597 users across 20 clients
Users per client: 179 (with 17 clients getting +1 user)
Train partition sizes: [36360, 37070, 35957, 38262, 36024, 37732, 36921, 38328, 36867, 37683, 36507, 36915, 36007, 37001, 35681, 35453, 36585, 36801, 35964, 36345]
Test partition sizes: [4128, 4203, 4081, 4333, 4091, 4287, 4193, 4349, 4191, 4277, 4143, 4193, 4093, 4197, 4052, 4029, 4153, 4183, 4084, 4128]
  Client 0: 36360 train samples, 62 unique classes
  Client 1: 37070 train samples, 62 unique classes
  Client 2: 35957 train samples, 62 unique classes
  Client 3: 38262 train samples, 62 unique classes
  Client 4: 36024 train samples, 62 unique classes
  Client 5: 37732 train samples, 62 unique classes
  Client 6: 36921 train samples, 62 unique classes
  Client 7: 38328 train samples, 62 unique classes
  Client 8: 36867 train samples, 62 unique classes
  Client 9: 37683 train samples, 62 unique classes
  Client 10: 36507 train samples, 62 unique classes
  Client 11: 36915 train samples, 62 unique classes
  Client 12: 36007 train samples, 62 unique classes
  Client 13: 37001 train samples, 62 unique classes
  Client 14: 35681 train samples, 62 unique classes
  Client 15: 35453 train samples, 62 unique classes
  Client 16: 36585 train samples, 62 unique classes
  Client 17: 36801 train samples, 62 unique classes
  Client 18: 35964 train samples, 62 unique classes
  Client 19: 36345 train samples, 62 unique classes
Will sample 10000 samples per client per epoch
Graph: erdos, nodes: 20, edges: 48
Degree statistics: avg=4.80, min=2, max=7
Attack: Compromised 14/20 nodes: [1, 2, 3, 5, 6, 8, 11, 12, 13, 14, 15, 17, 18, 19]
Attack type: backdoor, lambda: 1.0
Backdoor target label: 0, trigger size: 4
Model variant: baseline
Model parameters: 6,603,710
Sketchguard Node 0:
  Model dim: 6,603,710 → Sketch size: 1000
  Compression ratio: 6603.7x
  Using model parameters for aggregation, sketches for filtering
Sketchguard Node 1:
  Model dim: 6,603,710 → Sketch size: 1000
  Compression ratio: 6603.7x
  Using model parameters for aggregation, sketches for filtering
Sketchguard Node 2:
  Model dim: 6,603,710 → Sketch size: 1000
  Compression ratio: 6603.7x
  Using model parameters for aggregation, sketches for filtering
Sketchguard Node 3:
  Model dim: 6,603,710 → Sketch size: 1000
  Compression ratio: 6603.7x
  Using model parameters for aggregation, sketches for filtering
Sketchguard Node 4:
  Model dim: 6,603,710 → Sketch size: 1000
  Compression ratio: 6603.7x
  Using model parameters for aggregation, sketches for filtering
Sketchguard Node 5:
  Model dim: 6,603,710 → Sketch size: 1000
  Compression ratio: 6603.7x
  Using model parameters for aggregation, sketches for filtering
Sketchguard Node 6:
  Model dim: 6,603,710 → Sketch size: 1000
  Compression ratio: 6603.7x
  Using model parameters for aggregation, sketches for filtering
Sketchguard Node 7:
  Model dim: 6,603,710 → Sketch size: 1000
  Compression ratio: 6603.7x
  Using model parameters for aggregation, sketches for filtering
Sketchguard Node 8:
  Model dim: 6,603,710 → Sketch size: 1000
  Compression ratio: 6603.7x
  Using model parameters for aggregation, sketches for filtering
Sketchguard Node 9:
  Model dim: 6,603,710 → Sketch size: 1000
  Compression ratio: 6603.7x
  Using model parameters for aggregation, sketches for filtering
Sketchguard Node 10:
  Model dim: 6,603,710 → Sketch size: 1000
  Compression ratio: 6603.7x
  Using model parameters for aggregation, sketches for filtering
Sketchguard Node 11:
  Model dim: 6,603,710 → Sketch size: 1000
  Compression ratio: 6603.7x
  Using model parameters for aggregation, sketches for filtering
Sketchguard Node 12:
  Model dim: 6,603,710 → Sketch size: 1000
  Compression ratio: 6603.7x
  Using model parameters for aggregation, sketches for filtering
Sketchguard Node 13:
  Model dim: 6,603,710 → Sketch size: 1000
  Compression ratio: 6603.7x
  Using model parameters for aggregation, sketches for filtering
Sketchguard Node 14:
  Model dim: 6,603,710 → Sketch size: 1000
  Compression ratio: 6603.7x
  Using model parameters for aggregation, sketches for filtering
Sketchguard Node 15:
  Model dim: 6,603,710 → Sketch size: 1000
  Compression ratio: 6603.7x
  Using model parameters for aggregation, sketches for filtering
Sketchguard Node 16:
  Model dim: 6,603,710 → Sketch size: 1000
  Compression ratio: 6603.7x
  Using model parameters for aggregation, sketches for filtering
Sketchguard Node 17:
  Model dim: 6,603,710 → Sketch size: 1000
  Compression ratio: 6603.7x
  Using model parameters for aggregation, sketches for filtering
Sketchguard Node 18:
  Model dim: 6,603,710 → Sketch size: 1000
  Compression ratio: 6603.7x
  Using model parameters for aggregation, sketches for filtering
Sketchguard Node 19:
  Model dim: 6,603,710 → Sketch size: 1000
  Compression ratio: 6603.7x
  Using model parameters for aggregation, sketches for filtering
Sketchguard ALGORITHM (Sketch-based Filtering + State Aggregation)
  - Model dimension: 6,603,710 parameters
  - Config: SketchguardConfig(gamma=2, kappa=1, alpha=0.5, min_neighbors=1, sketch_size=1000, network_seed=987654321, attack_detection_window=5)
  - Sketch size: 1000
  - Compression ratio: 6603.7x
  - Complexity: O(d + N×k) = O(6,603,710 + 20×1000)
  - Theoretical speedup vs BALANCE: 19.9x
Initial test acc across nodes: mean=0.0162 ± 0.0138
Backdoor attack: Created poisoned datasets for 14 compromised nodes
Round 001: test acc mean=0.1879 ± 0.1528 | min=0.0427 max=0.4940
         : test loss mean=13494.2715 ± 11173.6954
         : individual accs = ['0.435320', '0.048775', '0.196030', '0.057697', '0.494011', '0.169582', '0.042690', '0.386526', '0.096874', '0.428805', '0.150857', '0.141903', '0.047398', '0.047653', '0.168065', '0.060809', '0.442572', '0.179297', '0.108717', '0.054990']
         : correct/total = [(1797, 4128), (205, 4203), (800, 4081), (250, 4333), (2021, 4091), (727, 4287), (179, 4193), (1681, 4349), (406, 4191), (1834, 4277), (625, 4143), (595, 4193), (194, 4093), (200, 4197), (681, 4052), (245, 4029), (1838, 4153), (750, 4183), (444, 4084), (227, 4128)]
         : compromised: 0.1015, honest: 0.3897
         : sketchguard stats = ['Node 0: acc_rate=0.333', 'Node 1: acc_rate=0.333', 'Node 2: acc_rate=0.200']...
Round 002: test acc mean=0.2416 ± 0.3070 | min=0.0031 max=0.7255
         : test loss mean=16939.4730 ± 48788.5308
         : individual accs = ['0.722384', '0.046395', '0.051948', '0.044773', '0.700073', '0.052484', '0.003100', '0.707979', '0.044381', '0.725509', '0.686459', '0.048891', '0.048620', '0.003812', '0.047384', '0.043435', '0.717554', '0.047574', '0.038932', '0.050630']
         : correct/total = [(2982, 4128), (195, 4203), (212, 4081), (194, 4333), (2864, 4091), (225, 4287), (13, 4193), (3079, 4349), (186, 4191), (3103, 4277), (2844, 4143), (205, 4193), (199, 4093), (16, 4197), (192, 4052), (175, 4029), (2980, 4153), (199, 4183), (159, 4084), (209, 4128)]
         : compromised: 0.0409, honest: 0.7100
         : sketchguard stats = ['Node 0: acc_rate=0.333', 'Node 1: acc_rate=0.667', 'Node 2: acc_rate=0.600']...
Round 003: test acc mean=0.2703 ± 0.3356 | min=0.0415 max=0.7967
         : test loss mean=nan ± nan
         : individual accs = ['0.793120', '0.048775', '0.049743', '0.046619', '0.778049', '0.058782', '0.041498', '0.796735', '0.051062', '0.775777', '0.769973', '0.048891', '0.047398', '0.047653', '0.054788', '0.054604', '0.783771', '0.049247', '0.054358', '0.054990']
         : correct/total = [(3274, 4128), (205, 4203), (203, 4081), (202, 4333), (3183, 4091), (252, 4287), (174, 4193), (3465, 4349), (214, 4191), (3318, 4277), (3190, 4143), (205, 4193), (194, 4093), (200, 4197), (222, 4052), (220, 4029), (3255, 4153), (206, 4183), (222, 4084), (227, 4128)]
         : compromised: 0.0506, honest: 0.7829
         : sketchguard stats = ['Node 0: acc_rate=0.333', 'Node 1: acc_rate=0.778', 'Node 2: acc_rate=0.733']...
Round 004: test acc mean=0.2779 ± 0.3480 | min=0.0415 max=0.8259
         : test loss mean=nan ± nan
         : individual accs = ['0.803779', '0.048775', '0.049743', '0.046619', '0.807138', '0.052484', '0.041498', '0.825937', '0.051062', '0.813654', '0.801110', '0.048891', '0.047398', '0.047653', '0.054788', '0.054604', '0.804960', '0.049247', '0.054358', '0.054990']
         : correct/total = [(3318, 4128), (205, 4203), (203, 4081), (202, 4333), (3302, 4091), (225, 4287), (174, 4193), (3592, 4349), (214, 4191), (3480, 4277), (3319, 4143), (205, 4193), (194, 4093), (200, 4197), (222, 4052), (220, 4029), (3343, 4153), (206, 4183), (222, 4084), (227, 4128)]
         : compromised: 0.0502, honest: 0.8094
         : sketchguard stats = ['Node 0: acc_rate=0.333', 'Node 1: acc_rate=0.583', 'Node 2: acc_rate=0.550']...
Round 005: test acc mean=0.2810 ± 0.3527 | min=0.0415 max=0.8315
         : test loss mean=nan ± nan
         : individual accs = ['0.820010', '0.048775', '0.049743', '0.046619', '0.815937', '0.052484', '0.041498', '0.831456', '0.051062', '0.822305', '0.806903', '0.048891', '0.047398', '0.047653', '0.054788', '0.054604', '0.821093', '0.049247', '0.054358', '0.054990']
         : correct/total = [(3385, 4128), (205, 4203), (203, 4081), (202, 4333), (3338, 4091), (225, 4287), (174, 4193), (3616, 4349), (214, 4191), (3517, 4277), (3343, 4143), (205, 4193), (194, 4093), (200, 4197), (222, 4052), (220, 4029), (3410, 4153), (206, 4183), (222, 4084), (227, 4128)]
         : compromised: 0.0502, honest: 0.8196
         : sketchguard stats = ['Node 0: acc_rate=0.333', 'Node 1: acc_rate=0.467', 'Node 2: acc_rate=0.440']...
Round 006: test acc mean=0.2840 ± 0.3572 | min=0.0415 max=0.8425
         : test loss mean=nan ± nan
         : individual accs = ['0.828973', '0.048775', '0.049743', '0.046619', '0.821071', '0.052484', '0.041498', '0.842493', '0.051062', '0.832593', '0.822110', '0.048891', '0.047398', '0.047653', '0.054788', '0.054604', '0.829762', '0.049247', '0.054358', '0.054990']
         : correct/total = [(3422, 4128), (205, 4203), (203, 4081), (202, 4333), (3359, 4091), (225, 4287), (174, 4193), (3664, 4349), (214, 4191), (3561, 4277), (3406, 4143), (205, 4193), (194, 4093), (200, 4197), (222, 4052), (220, 4029), (3446, 4153), (206, 4183), (222, 4084), (227, 4128)]
         : compromised: 0.0502, honest: 0.8295
         : sketchguard stats = ['Node 0: acc_rate=0.333', 'Node 1: acc_rate=0.389', 'Node 2: acc_rate=0.367']...
Round 007: test acc mean=0.2864 ± 0.3610 | min=0.0415 max=0.8499
         : test loss mean=nan ± nan
         : individual accs = ['0.835514', '0.048775', '0.049743', '0.046619', '0.830359', '0.052484', '0.041498', '0.849851', '0.051062', '0.840542', '0.826213', '0.048891', '0.047398', '0.047653', '0.054788', '0.054604', '0.843968', '0.049247', '0.054358', '0.054990']
         : correct/total = [(3449, 4128), (205, 4203), (203, 4081), (202, 4333), (3397, 4091), (225, 4287), (174, 4193), (3696, 4349), (214, 4191), (3595, 4277), (3423, 4143), (205, 4193), (194, 4093), (200, 4197), (222, 4052), (220, 4029), (3505, 4153), (206, 4183), (222, 4084), (227, 4128)]
         : compromised: 0.0502, honest: 0.8377
         : sketchguard stats = ['Node 0: acc_rate=0.333', 'Node 1: acc_rate=0.333', 'Node 2: acc_rate=0.314']...
Round 008: test acc mean=0.2869 ± 0.3617 | min=0.0415 max=0.8508
         : test loss mean=nan ± nan
         : individual accs = ['0.833333', '0.048775', '0.049743', '0.046619', '0.839648', '0.052484', '0.041498', '0.850770', '0.051062', '0.843582', '0.829109', '0.048891', '0.047398', '0.047653', '0.054788', '0.054604', '0.840116', '0.049247', '0.054358', '0.054990']
         : correct/total = [(3440, 4128), (205, 4203), (203, 4081), (202, 4333), (3435, 4091), (225, 4287), (174, 4193), (3700, 4349), (214, 4191), (3608, 4277), (3435, 4143), (205, 4193), (194, 4093), (200, 4197), (222, 4052), (220, 4029), (3489, 4153), (206, 4183), (222, 4084), (227, 4128)]
         : compromised: 0.0502, honest: 0.8394
         : sketchguard stats = ['Node 0: acc_rate=0.333', 'Node 1: acc_rate=0.292', 'Node 2: acc_rate=0.275']...
Round 009: test acc mean=0.2884 ± 0.3639 | min=0.0415 max=0.8556
         : test loss mean=nan ± nan
         : individual accs = ['0.837936', '0.048775', '0.049743', '0.046619', '0.837937', '0.052484', '0.041498', '0.855599', '0.051062', '0.853402', '0.837799', '0.048891', '0.047398', '0.047653', '0.054788', '0.054604', '0.842523', '0.049247', '0.054358', '0.054990']
         : correct/total = [(3459, 4128), (205, 4203), (203, 4081), (202, 4333), (3428, 4091), (225, 4287), (174, 4193), (3721, 4349), (214, 4191), (3650, 4277), (3471, 4143), (205, 4193), (194, 4093), (200, 4197), (222, 4052), (220, 4029), (3499, 4153), (206, 4183), (222, 4084), (227, 4128)]
         : compromised: 0.0502, honest: 0.8442
         : sketchguard stats = ['Node 0: acc_rate=0.333', 'Node 1: acc_rate=0.259', 'Node 2: acc_rate=0.244']...
Round 010: test acc mean=0.2887 ± 0.3645 | min=0.0415 max=0.8569
         : test loss mean=nan ± nan
         : individual accs = ['0.845446', '0.048775', '0.049743', '0.046619', '0.839404', '0.052484', '0.041498', '0.856519', '0.051062', '0.856909', '0.830316', '0.048891', '0.047398', '0.047653', '0.054788', '0.054604', '0.844209', '0.049247', '0.054358', '0.054990']
         : correct/total = [(3490, 4128), (205, 4203), (203, 4081), (202, 4333), (3434, 4091), (225, 4287), (174, 4193), (3725, 4349), (214, 4191), (3665, 4277), (3440, 4143), (205, 4193), (194, 4093), (200, 4197), (222, 4052), (220, 4029), (3506, 4153), (206, 4183), (222, 4084), (227, 4128)]
         : compromised: 0.0502, honest: 0.8455
         : sketchguard stats = ['Node 0: acc_rate=0.333', 'Node 1: acc_rate=0.233', 'Node 2: acc_rate=0.220']...

=== FINAL RESULTS ===
Dataset: femnist, Nodes: 20, Graph: erdos, Aggregation: sketchguard
Attack: backdoor, 70.0% compromised
Final accuracy - Compromised: 0.0502, Honest: 0.8455
Overall test accuracy: mean=0.2887 ± 0.3645

=== BACKDOOR ATTACK SUCCESS RATE (ASR) ===
Target label: 0
Trigger size: 4x4
Overall ASR: 0.7155 ± 0.4346
Honest nodes ASR: 0.0517 ± 0.0035
Compromised nodes ASR: 1.0000 ± 0.0000
Note: Higher ASR indicates more successful backdoor attack

=== Sketchguard SUMMARY ===
Node 0: acceptance=0.333
Node 1: acceptance=0.233
Node 2: acceptance=0.220
Node 3: acceptance=0.200
Node 4: acceptance=0.250
Node 5: acceptance=0.220
Node 6: acceptance=0.220
Node 7: acceptance=0.400
Node 8: acceptance=0.250
Node 9: acceptance=0.333
Node 10: acceptance=0.250
Node 11: acceptance=0.214
Node 12: acceptance=0.243
Node 13: acceptance=0.200
Node 14: acceptance=0.200
Node 15: acceptance=0.200
Node 16: acceptance=0.200
Node 17: acceptance=0.260
Node 18: acceptance=0.225
Node 19: acceptance=0.250

=== PARALLEL EXECUTION TIME (realistic for distributed system) ===
  COMMUNICATION (max across nodes):
    - Sketch transfer: 0.000s (0.0%)
    - Model fetch (accepted): 0.000s (0.0%)
  COMPUTATION (max across nodes):
    - Sketching: 1.704s (99.0%)
    - Filtering: 0.001s (0.1%)
    - Aggregation: 0.016s (0.9%)
  TOTALS:
    - Total computation: 1.720s (100.0%)
    - Total communication: 0.000s (0.0%)
    - Total parallel time: 1.720s

=== PER-NODE AVERAGE TIME ===
  - Sketching: 1.380s
  - Filtering: 0.001s
  - Aggregation: 0.011s
  - Sketch transfer: 0.000s
  - Model fetch: 0.000s
  - Total per node: 1.391s

=== TOTAL COMPUTATIONAL WORK (sum across all nodes) ===
  - Total sketching: 27.593s
  - Total filtering: 0.012s
  - Total aggregation: 0.216s
  - Total sketch transfer: 0.000s
  - Total model fetch: 0.000s
  - Grand total: 27.821s
  - Mean acceptance rate: 0.245

Sketchguard Algorithm Properties:
  - Original dimension: 6,603,710
  - Sketch size: 1000
  - Compression ratio: 19.9x
  - Single repetition: No repetitions needed
  - Theoretical complexity: O(d + N×k)
  - Approach: Sketch filtering + state aggregation
