Device: cuda
Seed: 987654321
Loading 36 LEAF FEMNIST train files...
LEAF FEMNIST train: 3597 users, 734463 samples
Loading 36 LEAF FEMNIST test files...
LEAF FEMNIST test: 3597 users, 83388 samples
Found 3597 train users, 3597 test users, 3597 common users
User sample counts range: 525 (max) to 17 (min)
Distributed ALL 3597 users across 20 clients
Users per client: 179 (with 17 clients getting +1 user)
Train partition sizes: [36360, 37070, 35957, 38262, 36024, 37732, 36921, 38328, 36867, 37683, 36507, 36915, 36007, 37001, 35681, 35453, 36585, 36801, 35964, 36345]
Test partition sizes: [4128, 4203, 4081, 4333, 4091, 4287, 4193, 4349, 4191, 4277, 4143, 4193, 4093, 4197, 4052, 4029, 4153, 4183, 4084, 4128]
  Client 0: 36360 train samples, 62 unique classes
  Client 1: 37070 train samples, 62 unique classes
  Client 2: 35957 train samples, 62 unique classes
  Client 3: 38262 train samples, 62 unique classes
  Client 4: 36024 train samples, 62 unique classes
  Client 5: 37732 train samples, 62 unique classes
  Client 6: 36921 train samples, 62 unique classes
  Client 7: 38328 train samples, 62 unique classes
  Client 8: 36867 train samples, 62 unique classes
  Client 9: 37683 train samples, 62 unique classes
  Client 10: 36507 train samples, 62 unique classes
  Client 11: 36915 train samples, 62 unique classes
  Client 12: 36007 train samples, 62 unique classes
  Client 13: 37001 train samples, 62 unique classes
  Client 14: 35681 train samples, 62 unique classes
  Client 15: 35453 train samples, 62 unique classes
  Client 16: 36585 train samples, 62 unique classes
  Client 17: 36801 train samples, 62 unique classes
  Client 18: 35964 train samples, 62 unique classes
  Client 19: 36345 train samples, 62 unique classes
Will sample 10000 samples per client per epoch
Graph: ring, nodes: 20, edges: 20
Degree statistics: avg=2.00, min=2, max=2
Attack: Compromised 4/20 nodes: [5, 12, 13, 17]
Attack type: krum, lambda: 1.0
Model variant: baseline
Model parameters: 6,603,710
UBAR ALGORITHM (Two-Stage Byzantine-resilient)
  - Model dimension: 6,603,710 parameters
  - Rho parameter: 0.8
  - Stage 1: Distance-based filtering (select 80% closest neighbors)
  - Stage 2: Performance-based selection (loss comparison)
  - Complexity: O(deg(i)×d + deg(i)×inference)
Initial test acc across nodes: mean=0.0168 ± 0.0139
Round 001: test acc mean=0.4411 ± 0.0288 | min=0.3847 max=0.5202
         : test loss mean=3.5514 ± 0.0595
         : individual accs = ['0.436047', '0.436117', '0.442784', '0.439418', '0.461745', '0.444133', '0.520153', '0.473672', '0.452159', '0.418518', '0.416606', '0.447651', '0.441241', '0.421492', '0.465202', '0.458675', '0.452926', '0.412383', '0.395690', '0.384690']
         : correct/total = [(1800, 4128), (1833, 4203), (1807, 4081), (1904, 4333), (1889, 4091), (1904, 4287), (2181, 4193), (2060, 4349), (1895, 4191), (1790, 4277), (1726, 4143), (1877, 4193), (1806, 4093), (1769, 4197), (1885, 4052), (1848, 4029), (1881, 4153), (1725, 4183), (1616, 4084), (1588, 4128)]
         : compromised: 0.4298, honest: 0.4439
         : ubar stats = ['Node 0: s1=0.500, s2=1.000', 'Node 1: s1=0.500, s2=1.000', 'Node 2: s1=0.500, s2=1.000']...
Round 002: test acc mean=0.7273 ± 0.0277 | min=0.6628 max=0.7610
         : test loss mean=1.0917 ± 0.3313
         : individual accs = ['0.751453', '0.744230', '0.662828', '0.744288', '0.755805', '0.709820', '0.669211', '0.739940', '0.732522', '0.752864', '0.732561', '0.725018', '0.728561', '0.705266', '0.684353', '0.746835', '0.748615', '0.712407', '0.761019', '0.738372']
         : correct/total = [(3102, 4128), (3128, 4203), (2705, 4081), (3225, 4333), (3092, 4091), (3043, 4287), (2806, 4193), (3218, 4349), (3070, 4191), (3220, 4277), (3035, 4143), (3040, 4193), (2982, 4093), (2960, 4197), (2773, 4052), (3009, 4029), (3109, 4153), (2980, 4183), (3108, 4084), (3048, 4128)]
         : compromised: 0.7140, honest: 0.7306
         : ubar stats = ['Node 0: s1=0.500, s2=1.000', 'Node 1: s1=0.500, s2=1.000', 'Node 2: s1=0.500, s2=1.000']...
Round 003: test acc mean=0.7906 ± 0.0113 | min=0.7753 max=0.8147
         : test loss mean=0.7128 ± 0.1040
         : individual accs = ['0.802083', '0.802998', '0.798334', '0.790676', '0.814715', '0.780033', '0.780348', '0.799494', '0.786447', '0.808043', '0.792904', '0.778202', '0.787686', '0.775554', '0.775666', '0.782080', '0.794125', '0.775281', '0.798237', '0.789486']
         : correct/total = [(3311, 4128), (3375, 4203), (3258, 4081), (3426, 4333), (3333, 4091), (3344, 4287), (3272, 4193), (3477, 4349), (3296, 4191), (3456, 4277), (3285, 4143), (3263, 4193), (3224, 4093), (3255, 4197), (3143, 4052), (3151, 4029), (3298, 4153), (3243, 4183), (3260, 4084), (3259, 4128)]
         : compromised: 0.7796, honest: 0.7934
         : ubar stats = ['Node 0: s1=0.500, s2=1.000', 'Node 1: s1=0.500, s2=1.000', 'Node 2: s1=0.500, s2=1.000']...
Round 004: test acc mean=0.8134 ± 0.0098 | min=0.7875 max=0.8330
         : test loss mean=0.5998 ± 0.0591
         : individual accs = ['0.818072', '0.819653', '0.820877', '0.819986', '0.833048', '0.807091', '0.806105', '0.821338', '0.807445', '0.825345', '0.807386', '0.809683', '0.810164', '0.787467', '0.809724', '0.813353', '0.826150', '0.808033', '0.815132', '0.802568']
         : correct/total = [(3377, 4128), (3445, 4203), (3350, 4081), (3553, 4333), (3408, 4091), (3460, 4287), (3380, 4193), (3572, 4349), (3384, 4191), (3530, 4277), (3345, 4143), (3395, 4193), (3316, 4093), (3305, 4197), (3281, 4052), (3277, 4029), (3431, 4153), (3380, 4183), (3329, 4084), (3313, 4128)]
         : compromised: 0.8032, honest: 0.8160
         : ubar stats = ['Node 0: s1=0.500, s2=1.000', 'Node 1: s1=0.500, s2=1.000', 'Node 2: s1=0.500, s2=1.000']...
Round 005: test acc mean=0.8262 ± 0.0069 | min=0.8133 max=0.8356
         : test loss mean=0.5419 ± 0.0287
         : individual accs = ['0.827277', '0.835594', '0.833129', '0.827141', '0.834270', '0.825752', '0.826377', '0.834905', '0.823908', '0.834697', '0.818730', '0.820892', '0.827266', '0.826543', '0.816140', '0.816580', '0.828798', '0.813292', '0.834721', '0.818556']
         : correct/total = [(3415, 4128), (3512, 4203), (3400, 4081), (3584, 4333), (3413, 4091), (3540, 4287), (3465, 4193), (3631, 4349), (3453, 4191), (3570, 4277), (3392, 4143), (3442, 4193), (3386, 4093), (3469, 4197), (3307, 4052), (3290, 4029), (3442, 4153), (3402, 4183), (3409, 4084), (3379, 4128)]
         : compromised: 0.8232, honest: 0.8270
         : ubar stats = ['Node 0: s1=0.500, s2=1.000', 'Node 1: s1=0.500, s2=1.000', 'Node 2: s1=0.500, s2=1.000']...
Round 006: test acc mean=0.8350 ± 0.0070 | min=0.8223 max=0.8462
         : test loss mean=0.5085 ± 0.0248
         : individual accs = ['0.830911', '0.842018', '0.842686', '0.835218', '0.846248', '0.830651', '0.822323', '0.841803', '0.831067', '0.839841', '0.827178', '0.829001', '0.842170', '0.831546', '0.834156', '0.823529', '0.844691', '0.832417', '0.841822', '0.829942']
         : correct/total = [(3430, 4128), (3539, 4203), (3439, 4081), (3619, 4333), (3462, 4091), (3561, 4287), (3448, 4193), (3661, 4349), (3483, 4191), (3592, 4277), (3427, 4143), (3476, 4193), (3447, 4093), (3490, 4197), (3380, 4052), (3318, 4029), (3508, 4153), (3482, 4183), (3438, 4084), (3426, 4128)]
         : compromised: 0.8342, honest: 0.8352
         : ubar stats = ['Node 0: s1=0.500, s2=1.000', 'Node 1: s1=0.500, s2=1.000', 'Node 2: s1=0.500, s2=1.000']...
Round 007: test acc mean=0.8401 ± 0.0078 | min=0.8245 max=0.8528
         : test loss mean=0.4869 ± 0.0246
         : individual accs = ['0.842054', '0.845586', '0.847831', '0.843526', '0.852848', '0.843014', '0.835440', '0.848471', '0.839418', '0.844050', '0.828627', '0.828524', '0.845590', '0.838218', '0.839832', '0.825019', '0.840838', '0.824528', '0.847943', '0.840359']
         : correct/total = [(3476, 4128), (3554, 4203), (3460, 4081), (3655, 4333), (3489, 4091), (3614, 4287), (3503, 4193), (3690, 4349), (3518, 4191), (3610, 4277), (3433, 4143), (3474, 4193), (3461, 4093), (3518, 4197), (3403, 4052), (3324, 4029), (3492, 4153), (3449, 4183), (3463, 4084), (3469, 4128)]
         : compromised: 0.8378, honest: 0.8406
         : ubar stats = ['Node 0: s1=0.500, s2=1.000', 'Node 1: s1=0.500, s2=1.000', 'Node 2: s1=0.500, s2=1.000']...
Round 008: test acc mean=0.8442 ± 0.0089 | min=0.8306 max=0.8609
         : test loss mean=0.4712 ± 0.0262
         : individual accs = ['0.838663', '0.848204', '0.855918', '0.853219', '0.860914', '0.850478', '0.832101', '0.855829', '0.840849', '0.847557', '0.835385', '0.839494', '0.851209', '0.830593', '0.835884', '0.831224', '0.844691', '0.838872', '0.852351', '0.840601']
         : correct/total = [(3462, 4128), (3565, 4203), (3493, 4081), (3697, 4333), (3522, 4091), (3646, 4287), (3489, 4193), (3722, 4349), (3524, 4191), (3625, 4277), (3461, 4143), (3520, 4193), (3484, 4093), (3486, 4197), (3387, 4052), (3349, 4029), (3508, 4153), (3509, 4183), (3481, 4084), (3470, 4128)]
         : compromised: 0.8428, honest: 0.8446
         : ubar stats = ['Node 0: s1=0.500, s2=1.000', 'Node 1: s1=0.500, s2=1.000', 'Node 2: s1=0.500, s2=1.000']...
Round 009: test acc mean=0.8484 ± 0.0080 | min=0.8352 max=0.8638
         : test loss mean=0.4566 ± 0.0224
         : individual accs = ['0.844477', '0.853676', '0.856163', '0.854143', '0.863847', '0.851878', '0.841164', '0.856519', '0.843236', '0.861585', '0.847454', '0.835202', '0.839482', '0.845842', '0.838598', '0.840903', '0.858416', '0.841501', '0.849657', '0.845203']
         : correct/total = [(3486, 4128), (3588, 4203), (3494, 4081), (3701, 4333), (3534, 4091), (3652, 4287), (3527, 4193), (3725, 4349), (3534, 4191), (3685, 4277), (3511, 4143), (3502, 4193), (3436, 4093), (3550, 4197), (3398, 4052), (3388, 4029), (3565, 4153), (3520, 4183), (3470, 4084), (3489, 4128)]
         : compromised: 0.8447, honest: 0.8494
         : ubar stats = ['Node 0: s1=0.500, s2=1.000', 'Node 1: s1=0.500, s2=1.000', 'Node 2: s1=0.500, s2=1.000']...
Round 010: test acc mean=0.8494 ± 0.0062 | min=0.8416 max=0.8634
         : test loss mean=0.4531 ± 0.0217
         : individual accs = ['0.845446', '0.851535', '0.856163', '0.856220', '0.863359', '0.843014', '0.844503', '0.853530', '0.847292', '0.858312', '0.846488', '0.844980', '0.854630', '0.846557', '0.843287', '0.841648', '0.853841', '0.842458', '0.853085', '0.842054']
         : correct/total = [(3490, 4128), (3579, 4203), (3494, 4081), (3710, 4333), (3532, 4091), (3614, 4287), (3541, 4193), (3712, 4349), (3551, 4191), (3671, 4277), (3507, 4143), (3543, 4193), (3498, 4093), (3553, 4197), (3417, 4052), (3391, 4029), (3546, 4153), (3524, 4183), (3484, 4084), (3476, 4128)]
         : compromised: 0.8467, honest: 0.8501
         : ubar stats = ['Node 0: s1=0.500, s2=1.000', 'Node 1: s1=0.500, s2=1.000', 'Node 2: s1=0.500, s2=1.000']...

=== FINAL RESULTS ===
Dataset: femnist, Nodes: 20, Graph: ring, Aggregation: ubar
Attack: krum, 20.0% compromised
Final accuracy - Compromised: 0.8467, Honest: 0.8501
Overall test accuracy: mean=0.8494 ± 0.0062

=== UBAR SUMMARY ===
Node 0: stage1=0.500, stage2=1.000, overall=0.500
Node 1: stage1=0.500, stage2=1.000, overall=0.500
Node 2: stage1=0.500, stage2=1.000, overall=0.500
Node 3: stage1=0.500, stage2=1.000, overall=0.500
Node 4: stage1=0.500, stage2=1.000, overall=0.500
Node 5: stage1=0.500, stage2=1.000, overall=0.500
Node 6: stage1=0.500, stage2=1.000, overall=0.500
Node 7: stage1=0.500, stage2=1.000, overall=0.500
Node 8: stage1=0.500, stage2=1.000, overall=0.500
Node 9: stage1=0.500, stage2=1.000, overall=0.500
Node 10: stage1=0.500, stage2=1.000, overall=0.500
Node 11: stage1=0.500, stage2=1.000, overall=0.500
Node 12: stage1=0.500, stage2=1.000, overall=0.500
Node 13: stage1=0.500, stage2=1.000, overall=0.500
Node 14: stage1=0.500, stage2=1.000, overall=0.500
Node 15: stage1=0.500, stage2=1.000, overall=0.500
Node 16: stage1=0.500, stage2=1.000, overall=0.500
Node 17: stage1=0.500, stage2=1.000, overall=0.500
Node 18: stage1=0.500, stage2=1.000, overall=0.500
Node 19: stage1=0.500, stage2=1.000, overall=0.500

=== PARALLEL EXECUTION TIME (realistic for distributed system) ===
  COMMUNICATION (max across nodes):
    - Full model transfer: 0.000s (0.0%)
  COMPUTATION (max across nodes):
    - Distance computation: 0.059s (1.4%)
    - Loss computation: 4.079s (98.3%)
    - Aggregation: 0.011s (0.3%)
  TOTALS:
    - Total computation: 4.150s (100.0%)
    - Total communication: 0.000s (0.0%)
    - Total parallel time: 4.150s

=== PER-NODE AVERAGE TIME ===
  - Distance computation: 0.020s
  - Loss computation: 3.788s
  - Aggregation: 0.005s
  - Model transfer: 0.000s
  - Total per node: 3.813s

=== TOTAL COMPUTATIONAL WORK (sum across all nodes) ===
  - Total distance computation: 0.403s
  - Total loss computation: 75.769s
  - Total aggregation: 0.092s
  - Total model transfer: 0.000s
  - Grand total: 76.265s
  - Mean Stage 1 acceptance rate: 0.500
  - Mean Stage 2 acceptance rate: 1.000
  - Overall acceptance rate: 0.500

UBAR Algorithm Properties:
  - Model dimension: 6,603,710
  - Rho parameter: 0.8
  - Two-stage approach: Distance filtering + loss evaluation
  - Stage 1 selects: 80% of neighbors
  - Stage 2 uses: Training sample loss comparison
  - Theoretical complexity: O(deg(i)×d + deg(i)×inference)
  - Approach: UBAR paper implementation
