Device: cuda
Seed: 987654321
Loading 36 LEAF FEMNIST train files...
LEAF FEMNIST train: 3597 users, 734463 samples
Loading 36 LEAF FEMNIST test files...
LEAF FEMNIST test: 3597 users, 83388 samples
Found 3597 train users, 3597 test users, 3597 common users
User sample counts range: 525 (max) to 17 (min)
Distributed ALL 3597 users across 20 clients
Users per client: 179 (with 17 clients getting +1 user)
Train partition sizes: [36360, 37070, 35957, 38262, 36024, 37732, 36921, 38328, 36867, 37683, 36507, 36915, 36007, 37001, 35681, 35453, 36585, 36801, 35964, 36345]
Test partition sizes: [4128, 4203, 4081, 4333, 4091, 4287, 4193, 4349, 4191, 4277, 4143, 4193, 4093, 4197, 4052, 4029, 4153, 4183, 4084, 4128]
  Client 0: 36360 train samples, 62 unique classes
  Client 1: 37070 train samples, 62 unique classes
  Client 2: 35957 train samples, 62 unique classes
  Client 3: 38262 train samples, 62 unique classes
  Client 4: 36024 train samples, 62 unique classes
  Client 5: 37732 train samples, 62 unique classes
  Client 6: 36921 train samples, 62 unique classes
  Client 7: 38328 train samples, 62 unique classes
  Client 8: 36867 train samples, 62 unique classes
  Client 9: 37683 train samples, 62 unique classes
  Client 10: 36507 train samples, 62 unique classes
  Client 11: 36915 train samples, 62 unique classes
  Client 12: 36007 train samples, 62 unique classes
  Client 13: 37001 train samples, 62 unique classes
  Client 14: 35681 train samples, 62 unique classes
  Client 15: 35453 train samples, 62 unique classes
  Client 16: 36585 train samples, 62 unique classes
  Client 17: 36801 train samples, 62 unique classes
  Client 18: 35964 train samples, 62 unique classes
  Client 19: 36345 train samples, 62 unique classes
Will sample 10000 samples per client per epoch
Graph: ring, nodes: 20, edges: 20
Degree statistics: avg=2.00, min=2, max=2
Attack: Compromised 6/20 nodes: [5, 12, 13, 14, 17, 18]
Attack type: backdoor, lambda: 1.0
Backdoor target label: 0, trigger size: 4
Model variant: baseline
Model parameters: 6,603,710
Initial test acc across nodes: mean=0.0168 ± 0.0139
Backdoor attack: Created poisoned datasets for 6 compromised nodes
Round 001: test acc mean=0.0956 ± 0.1176 | min=0.0026 max=0.4123
         : test loss mean=33603.1506 ± 85130.7025
         : individual accs = ['0.247335', '0.256959', '0.262191', '0.164782', '0.002933', '0.004665', '0.005724', '0.412279', '0.130756', '0.104045', '0.183442', '0.036012', '0.003909', '0.049083', '0.002962', '0.012906', '0.002649', '0.005498', '0.019589', '0.003391']
         : correct/total = [(1021, 4128), (1080, 4203), (1070, 4081), (714, 4333), (12, 4091), (20, 4287), (24, 4193), (1793, 4349), (548, 4191), (445, 4277), (760, 4143), (151, 4193), (16, 4093), (206, 4197), (12, 4052), (52, 4029), (11, 4153), (23, 4183), (80, 4084), (14, 4128)]
         : compromised: 0.0143, honest: 0.1304
Round 002: test acc mean=0.1803 ± 0.2594 | min=0.0420 max=0.7072
         : test loss mean=nan ± nan
         : individual accs = ['0.059593', '0.691173', '0.698358', '0.043157', '0.057932', '0.052484', '0.044598', '0.051276', '0.707230', '0.699556', '0.041999', '0.049606', '0.054239', '0.049083', '0.050346', '0.056590', '0.058271', '0.050920', '0.045788', '0.044331']
         : correct/total = [(246, 4128), (2905, 4203), (2850, 4081), (187, 4333), (237, 4091), (225, 4287), (187, 4193), (223, 4349), (2964, 4191), (2992, 4277), (174, 4143), (208, 4193), (222, 4093), (206, 4197), (204, 4052), (228, 4029), (242, 4153), (213, 4183), (187, 4084), (183, 4128)]
         : compromised: 0.0505, honest: 0.2360
Round 003: test acc mean=0.0520 ± 0.0058 | min=0.0432 max=0.0612
         : test loss mean=nan ± nan
         : individual accs = ['0.059593', '0.052344', '0.057584', '0.043157', '0.057932', '0.045253', '0.057000', '0.051276', '0.043188', '0.053776', '0.055998', '0.045314', '0.050818', '0.049083', '0.061204', '0.056590', '0.058271', '0.050920', '0.045788', '0.044331']
         : correct/total = [(246, 4128), (220, 4203), (235, 4081), (187, 4333), (237, 4091), (194, 4287), (239, 4193), (223, 4349), (181, 4191), (230, 4277), (232, 4143), (190, 4193), (208, 4093), (206, 4197), (248, 4052), (228, 4029), (242, 4153), (213, 4183), (187, 4084), (183, 4128)]
         : compromised: 0.0505, honest: 0.0526
Round 004: test acc mean=0.0500 ± 0.0071 | min=0.0334 max=0.0618
         : test loss mean=nan ± nan
         : individual accs = ['0.050145', '0.042589', '0.050723', '0.043157', '0.044977', '0.045253', '0.033389', '0.058174', '0.044619', '0.053075', '0.055998', '0.061770', '0.050818', '0.049083', '0.061204', '0.056590', '0.058271', '0.050920', '0.045788', '0.044331']
         : correct/total = [(207, 4128), (179, 4203), (207, 4081), (187, 4333), (184, 4091), (194, 4287), (140, 4193), (253, 4349), (187, 4191), (227, 4277), (232, 4143), (259, 4193), (208, 4093), (206, 4197), (248, 4052), (228, 4029), (242, 4153), (213, 4183), (187, 4084), (183, 4128)]
         : compromised: 0.0505, honest: 0.0498
Round 005: test acc mean=0.0499 ± 0.0058 | min=0.0365 max=0.0618
         : test loss mean=nan ± nan
         : individual accs = ['0.059593', '0.049726', '0.053418', '0.036464', '0.044977', '0.048752', '0.043883', '0.058174', '0.053209', '0.044891', '0.047550', '0.061770', '0.050818', '0.049083', '0.045163', '0.050881', '0.051047', '0.051159', '0.052155', '0.044331']
         : correct/total = [(246, 4128), (209, 4203), (218, 4081), (158, 4333), (184, 4091), (209, 4287), (184, 4193), (253, 4349), (223, 4191), (192, 4277), (197, 4143), (259, 4193), (208, 4093), (206, 4197), (183, 4052), (205, 4029), (212, 4153), (214, 4183), (213, 4084), (183, 4128)]
         : compromised: 0.0495, honest: 0.0500
Round 006: test acc mean=0.0502 ± 0.0068 | min=0.0322 max=0.0612
         : test loss mean=nan ± nan
         : individual accs = ['0.050145', '0.050916', '0.057584', '0.036464', '0.042288', '0.045253', '0.050799', '0.058174', '0.053209', '0.053776', '0.055998', '0.049606', '0.053750', '0.049083', '0.061204', '0.050633', '0.050807', '0.050920', '0.052155', '0.032219']
         : correct/total = [(207, 4128), (214, 4203), (235, 4081), (158, 4333), (173, 4091), (194, 4287), (213, 4193), (253, 4349), (223, 4191), (230, 4277), (232, 4143), (208, 4193), (220, 4093), (206, 4197), (248, 4052), (204, 4029), (211, 4153), (213, 4183), (213, 4084), (133, 4128)]
         : compromised: 0.0521, honest: 0.0495
Round 007: test acc mean=0.0495 ± 0.0059 | min=0.0322 max=0.0582
         : test loss mean=nan ± nan
         : individual accs = ['0.050145', '0.052344', '0.057584', '0.052850', '0.042288', '0.038955', '0.049130', '0.058174', '0.053209', '0.053776', '0.048033', '0.049606', '0.054239', '0.049083', '0.045656', '0.050881', '0.051047', '0.048291', '0.052155', '0.032219']
         : correct/total = [(207, 4128), (220, 4203), (235, 4081), (229, 4333), (173, 4091), (167, 4287), (206, 4193), (253, 4349), (223, 4191), (230, 4277), (199, 4143), (208, 4193), (222, 4093), (206, 4197), (185, 4052), (205, 4029), (212, 4153), (202, 4183), (213, 4084), (133, 4128)]
         : compromised: 0.0481, honest: 0.0501
Round 008: test acc mean=0.0504 ± 0.0037 | min=0.0435 max=0.0582
         : test loss mean=nan ± nan
         : individual accs = ['0.050145', '0.052344', '0.057584', '0.052850', '0.048643', '0.048519', '0.044598', '0.058174', '0.053209', '0.043488', '0.048033', '0.049606', '0.054239', '0.049083', '0.045656', '0.050881', '0.051047', '0.048291', '0.052155', '0.050145']
         : correct/total = [(207, 4128), (220, 4203), (235, 4081), (229, 4333), (199, 4091), (208, 4287), (187, 4193), (253, 4349), (223, 4191), (186, 4277), (199, 4143), (208, 4193), (222, 4093), (206, 4197), (185, 4052), (205, 4029), (212, 4153), (202, 4183), (213, 4084), (207, 4128)]
         : compromised: 0.0497, honest: 0.0508
Round 009: test acc mean=0.0485 ± 0.0072 | min=0.0322 max=0.0596
         : test loss mean=nan ± nan
         : individual accs = ['0.059593', '0.052344', '0.057584', '0.052850', '0.042288', '0.038955', '0.033389', '0.058174', '0.049630', '0.043488', '0.048033', '0.049606', '0.054239', '0.049083', '0.047878', '0.050881', '0.051047', '0.046139', '0.052155', '0.032219']
         : correct/total = [(246, 4128), (220, 4203), (235, 4081), (229, 4333), (173, 4091), (167, 4287), (140, 4193), (253, 4349), (208, 4191), (186, 4277), (199, 4143), (208, 4193), (222, 4093), (206, 4197), (194, 4052), (205, 4029), (212, 4153), (193, 4183), (213, 4084), (133, 4128)]
         : compromised: 0.0481, honest: 0.0487
Round 010: test acc mean=0.0508 ± 0.0047 | min=0.0423 max=0.0612
         : test loss mean=nan ± nan
         : individual accs = ['0.059593', '0.052344', '0.057584', '0.052850', '0.042288', '0.047352', '0.048414', '0.045068', '0.049630', '0.043488', '0.048033', '0.049606', '0.054239', '0.049083', '0.061204', '0.050633', '0.051288', '0.050920', '0.052400', '0.050145']
         : correct/total = [(246, 4128), (220, 4203), (235, 4081), (229, 4333), (173, 4091), (203, 4287), (203, 4193), (196, 4349), (208, 4191), (186, 4277), (199, 4143), (208, 4193), (222, 4093), (206, 4197), (248, 4052), (204, 4029), (213, 4153), (213, 4183), (214, 4084), (207, 4128)]
         : compromised: 0.0525, honest: 0.0501

=== FINAL RESULTS ===
Dataset: femnist, Nodes: 20, Graph: ring, Aggregation: d-fedavg
Attack: backdoor, 30.0% compromised
Final accuracy - Compromised: 0.0525, Honest: 0.0501
Overall test accuracy: mean=0.0508 ± 0.0047

=== BACKDOOR ATTACK SUCCESS RATE (ASR) ===
Target label: 0
Trigger size: 4x4
Overall ASR: 0.3500 ± 0.4770
Honest nodes ASR: 0.3571 ± 0.4792
Compromised nodes ASR: 0.3333 ± 0.4714
Note: Higher ASR indicates more successful backdoor attack
