Device: cuda
Seed: 987654321
Loading 36 LEAF FEMNIST train files...
LEAF FEMNIST train: 3597 users, 734463 samples
Loading 36 LEAF FEMNIST test files...
LEAF FEMNIST test: 3597 users, 83388 samples
Found 3597 train users, 3597 test users, 3597 common users
User sample counts range: 525 (max) to 17 (min)
Distributed ALL 3597 users across 20 clients
Users per client: 179 (with 17 clients getting +1 user)
Train partition sizes: [36360, 37070, 35957, 38262, 36024, 37732, 36921, 38328, 36867, 37683, 36507, 36915, 36007, 37001, 35681, 35453, 36585, 36801, 35964, 36345]
Test partition sizes: [4128, 4203, 4081, 4333, 4091, 4287, 4193, 4349, 4191, 4277, 4143, 4193, 4093, 4197, 4052, 4029, 4153, 4183, 4084, 4128]
  Client 0: 36360 train samples, 62 unique classes
  Client 1: 37070 train samples, 62 unique classes
  Client 2: 35957 train samples, 62 unique classes
  Client 3: 38262 train samples, 62 unique classes
  Client 4: 36024 train samples, 62 unique classes
  Client 5: 37732 train samples, 62 unique classes
  Client 6: 36921 train samples, 62 unique classes
  Client 7: 38328 train samples, 62 unique classes
  Client 8: 36867 train samples, 62 unique classes
  Client 9: 37683 train samples, 62 unique classes
  Client 10: 36507 train samples, 62 unique classes
  Client 11: 36915 train samples, 62 unique classes
  Client 12: 36007 train samples, 62 unique classes
  Client 13: 37001 train samples, 62 unique classes
  Client 14: 35681 train samples, 62 unique classes
  Client 15: 35453 train samples, 62 unique classes
  Client 16: 36585 train samples, 62 unique classes
  Client 17: 36801 train samples, 62 unique classes
  Client 18: 35964 train samples, 62 unique classes
  Client 19: 36345 train samples, 62 unique classes
Will sample 10000 samples per client per epoch
Graph: ring, nodes: 20, edges: 20
Degree statistics: avg=2.00, min=2, max=2
Attack: Compromised 4/20 nodes: [5, 12, 13, 17]
Attack type: directed_deviation, lambda: 1.0
Model variant: baseline
Model parameters: 6,603,710
BALANCE algorithm:
Balance Config: BALANCEConfig(gamma=2, kappa=1, alpha=0.5, min_neighbors=1)
  - Model dimension: 6,603,710 parameters
  - Complexity: O(N×d) = O(20×6,603,710)
Initial test acc across nodes: mean=0.0168 ± 0.0139
Round 001: test acc mean=0.4347 ± 0.0521 | min=0.2588 max=0.5202
         : test loss mean=3.6706 ± 0.1050
         : individual accs = ['0.444767', '0.414466', '0.479539', '0.399723', '0.461745', '0.457663', '0.520153', '0.462175', '0.381293', '0.258826', '0.430123', '0.447651', '0.441241', '0.421492', '0.465202', '0.492926', '0.452926', '0.453741', '0.395690', '0.412548']
         : correct/total = [(1836, 4128), (1742, 4203), (1957, 4081), (1732, 4333), (1889, 4091), (1962, 4287), (2181, 4193), (2010, 4349), (1598, 4191), (1107, 4277), (1782, 4143), (1877, 4193), (1806, 4093), (1769, 4197), (1885, 4052), (1986, 4029), (1881, 4153), (1898, 4183), (1616, 4084), (1703, 4128)]
         : compromised: 0.4435, honest: 0.4325
Round 002: test acc mean=0.7077 ± 0.0242 | min=0.6594 max=0.7395
         : test loss mean=1.6849 ± 0.7220
         : individual accs = ['0.674661', '0.695456', '0.667974', '0.735057', '0.737473', '0.659436', '0.700930', '0.710508', '0.697924', '0.688801', '0.711320', '0.729072', '0.728561', '0.705266', '0.727048', '0.718044', '0.736335', '0.673918', '0.739471', '0.716328']
         : correct/total = [(2785, 4128), (2923, 4203), (2726, 4081), (3185, 4333), (3017, 4091), (2827, 4287), (2939, 4193), (3090, 4349), (2925, 4191), (2946, 4277), (2947, 4143), (3057, 4193), (2982, 4093), (2960, 4197), (2946, 4052), (2893, 4029), (3058, 4153), (2819, 4183), (3020, 4084), (2957, 4128)]
         : compromised: 0.6918, honest: 0.7117
Round 003: test acc mean=0.7654 ± 0.0456 | min=0.5871 max=0.7996
         : test loss mean=1.0846 ± 0.5686
         : individual accs = ['0.776647', '0.770878', '0.761333', '0.783522', '0.799560', '0.695825', '0.780587', '0.782479', '0.760439', '0.776011', '0.774559', '0.777963', '0.790129', '0.784608', '0.778381', '0.775875', '0.783771', '0.587138', '0.791136', '0.778101']
         : correct/total = [(3206, 4128), (3240, 4203), (3107, 4081), (3395, 4333), (3271, 4091), (2983, 4287), (3273, 4193), (3403, 4349), (3187, 4191), (3319, 4277), (3209, 4143), (3262, 4193), (3234, 4093), (3293, 4197), (3154, 4052), (3126, 4029), (3255, 4153), (2456, 4183), (3231, 4084), (3212, 4128)]
         : compromised: 0.7144, honest: 0.7782
Round 004: test acc mean=0.7996 ± 0.0150 | min=0.7612 max=0.8269
         : test loss mean=0.8306 ± 0.3878
         : individual accs = ['0.795300', '0.792529', '0.794413', '0.807754', '0.826937', '0.766970', '0.802767', '0.808232', '0.791458', '0.801029', '0.793386', '0.803959', '0.815294', '0.793186', '0.808490', '0.810375', '0.814833', '0.761176', '0.809500', '0.793605']
         : correct/total = [(3283, 4128), (3331, 4203), (3242, 4081), (3500, 4333), (3383, 4091), (3288, 4287), (3366, 4193), (3515, 4349), (3317, 4191), (3426, 4277), (3287, 4143), (3371, 4193), (3337, 4093), (3329, 4197), (3276, 4052), (3265, 4029), (3384, 4153), (3184, 4183), (3306, 4084), (3276, 4128)]
         : compromised: 0.7842, honest: 0.8034
Round 005: test acc mean=0.8167 ± 0.0111 | min=0.7770 max=0.8281
         : test loss mean=0.7065 ± 0.2814
         : individual accs = ['0.814922', '0.808708', '0.814261', '0.820909', '0.825471', '0.808258', '0.821130', '0.827317', '0.812455', '0.821604', '0.813903', '0.812306', '0.824334', '0.827496', '0.817374', '0.822040', '0.828076', '0.776954', '0.824437', '0.811289']
         : correct/total = [(3364, 4128), (3399, 4203), (3323, 4081), (3557, 4333), (3377, 4091), (3465, 4287), (3443, 4193), (3598, 4349), (3405, 4191), (3514, 4277), (3372, 4143), (3406, 4193), (3374, 4093), (3473, 4197), (3312, 4052), (3312, 4029), (3439, 4153), (3250, 4183), (3367, 4084), (3349, 4128)]
         : compromised: 0.8093, honest: 0.8185
Round 006: test acc mean=0.8278 ± 0.0092 | min=0.8044 max=0.8392
         : test loss mean=0.6428 ± 0.2486
         : individual accs = ['0.819767', '0.833928', '0.830679', '0.830372', '0.837204', '0.817588', '0.817076', '0.838124', '0.822954', '0.829553', '0.826213', '0.823754', '0.838749', '0.834406', '0.835143', '0.825515', '0.839152', '0.804447', '0.835700', '0.815407']
         : correct/total = [(3384, 4128), (3505, 4203), (3390, 4081), (3598, 4333), (3425, 4091), (3505, 4287), (3426, 4193), (3645, 4349), (3449, 4191), (3548, 4277), (3423, 4143), (3454, 4193), (3433, 4093), (3502, 4197), (3384, 4052), (3326, 4029), (3485, 4153), (3365, 4183), (3413, 4084), (3366, 4128)]
         : compromised: 0.8238, honest: 0.8288
Round 007: test acc mean=0.8322 ± 0.0118 | min=0.7908 max=0.8446
         : test loss mean=0.6040 ± 0.2392
         : individual accs = ['0.829215', '0.829170', '0.842441', '0.837064', '0.843559', '0.823653', '0.829716', '0.844562', '0.825340', '0.834931', '0.824282', '0.822561', '0.844124', '0.840124', '0.838351', '0.832713', '0.841320', '0.790820', '0.839128', '0.830184']
         : correct/total = [(3423, 4128), (3485, 4203), (3438, 4081), (3627, 4333), (3451, 4091), (3531, 4287), (3479, 4193), (3673, 4349), (3459, 4191), (3571, 4277), (3415, 4143), (3449, 4193), (3455, 4093), (3526, 4197), (3397, 4052), (3355, 4029), (3494, 4153), (3308, 4183), (3427, 4084), (3427, 4128)]
         : compromised: 0.8247, honest: 0.8340
Round 008: test acc mean=0.8376 ± 0.0088 | min=0.8178 max=0.8538
         : test loss mean=0.5162 ± 0.0465
         : individual accs = ['0.831153', '0.840114', '0.849792', '0.846296', '0.851870', '0.831817', '0.822323', '0.853759', '0.831544', '0.839841', '0.833695', '0.834963', '0.843635', '0.834406', '0.834403', '0.838670', '0.841320', '0.817834', '0.841087', '0.833333']
         : correct/total = [(3431, 4128), (3531, 4203), (3468, 4081), (3667, 4333), (3485, 4091), (3566, 4287), (3448, 4193), (3713, 4349), (3485, 4191), (3592, 4277), (3454, 4143), (3501, 4193), (3453, 4093), (3502, 4197), (3381, 4052), (3379, 4029), (3494, 4153), (3421, 4183), (3435, 4084), (3440, 4128)]
         : compromised: 0.8319, honest: 0.8390
Round 009: test acc mean=0.8441 ± 0.0073 | min=0.8302 max=0.8574
         : test loss mean=0.4858 ± 0.0259
         : individual accs = ['0.832364', '0.845349', '0.854447', '0.846988', '0.848692', '0.844180', '0.836871', '0.857438', '0.840849', '0.848492', '0.838040', '0.830193', '0.839238', '0.848225', '0.844768', '0.848349', '0.856248', '0.834808', '0.845984', '0.839874']
         : correct/total = [(3436, 4128), (3553, 4203), (3487, 4081), (3670, 4333), (3472, 4091), (3619, 4287), (3509, 4193), (3729, 4349), (3524, 4191), (3629, 4277), (3472, 4143), (3481, 4193), (3435, 4093), (3560, 4197), (3423, 4052), (3418, 4029), (3556, 4153), (3492, 4183), (3455, 4084), (3467, 4128)]
         : compromised: 0.8416, honest: 0.8447
Round 010: test acc mean=0.8441 ± 0.0061 | min=0.8338 max=0.8532
         : test loss mean=0.4763 ± 0.0223
         : individual accs = ['0.838663', '0.840828', '0.845381', '0.851142', '0.849914', '0.836716', '0.833771', '0.853070', '0.844667', '0.846388', '0.839488', '0.834963', '0.853164', '0.846081', '0.847730', '0.847357', '0.850470', '0.840545', '0.847209', '0.834060']
         : correct/total = [(3462, 4128), (3534, 4203), (3450, 4081), (3688, 4333), (3477, 4091), (3587, 4287), (3496, 4193), (3710, 4349), (3540, 4191), (3620, 4277), (3478, 4143), (3501, 4193), (3492, 4093), (3551, 4197), (3435, 4052), (3414, 4029), (3532, 4153), (3516, 4183), (3460, 4084), (3443, 4128)]
         : compromised: 0.8441, honest: 0.8441

=== FINAL RESULTS ===
Dataset: femnist, Nodes: 20, Graph: ring, Aggregation: balance
Attack: directed_deviation, 20.0% compromised
Final accuracy - Compromised: 0.8441, Honest: 0.8441
Overall test accuracy: mean=0.8441 ± 0.0061

=== BALANCE SUMMARY ===
Node 0: acceptance=1.000
Node 1: acceptance=1.000
Node 2: acceptance=1.000
Node 3: acceptance=1.000
Node 4: acceptance=0.500
Node 5: acceptance=0.850
Node 6: acceptance=0.500
Node 7: acceptance=1.000
Node 8: acceptance=1.000
Node 9: acceptance=1.000
Node 10: acceptance=1.000
Node 11: acceptance=0.500
Node 12: acceptance=0.500
Node 13: acceptance=0.500
Node 14: acceptance=0.500
Node 15: acceptance=1.000
Node 16: acceptance=0.500
Node 17: acceptance=0.800
Node 18: acceptance=0.500
Node 19: acceptance=1.000

=== PARALLEL EXECUTION TIME (realistic for distributed system) ===
  COMMUNICATION (max across nodes):
    - Full model transfer: 0.000s (0.0%)
  COMPUTATION (max across nodes):
    - Filtering: 0.070s (71.9%)
    - Aggregation: 0.027s (28.1%)
  TOTALS:
    - Total computation: 0.097s (100.0%)
    - Total communication: 0.000s (0.0%)
    - Total parallel time: 0.097s

=== PER-NODE AVERAGE TIME ===
  - Filtering: 0.027s
  - Aggregation: 0.009s
  - Model transfer: 0.000s
  - Total per node: 0.035s

=== TOTAL COMPUTATIONAL WORK (sum across all nodes) ===
  - Total filtering: 0.533s
  - Total aggregation: 0.171s
  - Total model transfer: 0.000s
  - Grand total: 0.704s
  - Mean acceptance rate: 0.782

BALANCE Algorithm Properties:
  - Model dimension: 6,603,710
  - No compression: Full parameter comparison
  - Theoretical complexity: O(deg(i)×d)
  - Approach: Full parameter filtering + averaging
