Device: cuda
Seed: 987654321
Loading 36 LEAF FEMNIST train files...
LEAF FEMNIST train: 3597 users, 734463 samples
Loading 36 LEAF FEMNIST test files...
LEAF FEMNIST test: 3597 users, 83388 samples
Found 3597 train users, 3597 test users, 3597 common users
User sample counts range: 525 (max) to 17 (min)
Distributed ALL 3597 users across 20 clients
Users per client: 179 (with 17 clients getting +1 user)
Train partition sizes: [36360, 37070, 35957, 38262, 36024, 37732, 36921, 38328, 36867, 37683, 36507, 36915, 36007, 37001, 35681, 35453, 36585, 36801, 35964, 36345]
Test partition sizes: [4128, 4203, 4081, 4333, 4091, 4287, 4193, 4349, 4191, 4277, 4143, 4193, 4093, 4197, 4052, 4029, 4153, 4183, 4084, 4128]
  Client 0: 36360 train samples, 62 unique classes
  Client 1: 37070 train samples, 62 unique classes
  Client 2: 35957 train samples, 62 unique classes
  Client 3: 38262 train samples, 62 unique classes
  Client 4: 36024 train samples, 62 unique classes
  Client 5: 37732 train samples, 62 unique classes
  Client 6: 36921 train samples, 62 unique classes
  Client 7: 38328 train samples, 62 unique classes
  Client 8: 36867 train samples, 62 unique classes
  Client 9: 37683 train samples, 62 unique classes
  Client 10: 36507 train samples, 62 unique classes
  Client 11: 36915 train samples, 62 unique classes
  Client 12: 36007 train samples, 62 unique classes
  Client 13: 37001 train samples, 62 unique classes
  Client 14: 35681 train samples, 62 unique classes
  Client 15: 35453 train samples, 62 unique classes
  Client 16: 36585 train samples, 62 unique classes
  Client 17: 36801 train samples, 62 unique classes
  Client 18: 35964 train samples, 62 unique classes
  Client 19: 36345 train samples, 62 unique classes
Will sample 10000 samples per client per epoch
Graph: fully, nodes: 20, edges: 190
Degree statistics: avg=19.00, min=19, max=19
Attack: Compromised 4/20 nodes: [5, 12, 13, 17]
Attack type: backdoor, lambda: 1.0
Backdoor target label: 0, trigger size: 4
Model variant: baseline
Model parameters: 6,603,710
Initial test acc across nodes: mean=0.0168 ± 0.0139
Backdoor attack: Created poisoned datasets for 4 compromised nodes
Round 001: test acc mean=0.0156 ± 0.0146 | min=0.0021 max=0.0485
         : test loss mean=549.8934 ± 146.7699
         : individual accs = ['0.003391', '0.002141', '0.027934', '0.005077', '0.003911', '0.003499', '0.034581', '0.003909', '0.025292', '0.003741', '0.039585', '0.030766', '0.005864', '0.011198', '0.003208', '0.008439', '0.015651', '0.002152', '0.048482', '0.032461']
         : correct/total = [(14, 4128), (9, 4203), (114, 4081), (22, 4333), (16, 4091), (15, 4287), (145, 4193), (17, 4349), (106, 4191), (16, 4277), (164, 4143), (129, 4193), (24, 4093), (47, 4197), (13, 4052), (34, 4029), (65, 4153), (9, 4183), (198, 4084), (134, 4128)]
         : compromised: 0.0057, honest: 0.0180
Round 002: test acc mean=0.0514 ± 0.0034 | min=0.0469 max=0.0618
         : test loss mean=606576.2862 ± 22908.1096
         : individual accs = ['0.051599', '0.051630', '0.050723', '0.048465', '0.051088', '0.048052', '0.049130', '0.051276', '0.047960', '0.053075', '0.050447', '0.061770', '0.053750', '0.046938', '0.048124', '0.056342', '0.055141', '0.050203', '0.052889', '0.048450']
         : correct/total = [(213, 4128), (217, 4203), (207, 4081), (210, 4333), (209, 4091), (206, 4287), (206, 4193), (223, 4349), (201, 4191), (227, 4277), (209, 4143), (259, 4193), (220, 4093), (197, 4197), (195, 4052), (227, 4029), (229, 4153), (210, 4183), (216, 4084), (200, 4128)]
         : compromised: 0.0497, honest: 0.0518
Round 003: test acc mean=0.0561 ± 0.0032 | min=0.0506 max=0.0624
         : test loss mean=3.8296 ± 0.0081
         : individual accs = ['0.059593', '0.052344', '0.057584', '0.052850', '0.057932', '0.050618', '0.057000', '0.058174', '0.053209', '0.053776', '0.055998', '0.053899', '0.058637', '0.062426', '0.061204', '0.056590', '0.058271', '0.050920', '0.055583', '0.055475']
         : correct/total = [(246, 4128), (220, 4203), (235, 4081), (229, 4333), (237, 4091), (217, 4287), (239, 4193), (253, 4349), (223, 4191), (230, 4277), (232, 4143), (226, 4193), (240, 4093), (262, 4197), (248, 4052), (228, 4029), (242, 4153), (213, 4183), (227, 4084), (229, 4128)]
         : compromised: 0.0557, honest: 0.0562
Round 004: test acc mean=0.0516 ± 0.0041 | min=0.0439 max=0.0583
         : test loss mean=5.1656 ± 1.0528
         : individual accs = ['0.049176', '0.047109', '0.055134', '0.047773', '0.044977', '0.057849', '0.053899', '0.043918', '0.051539', '0.053776', '0.055274', '0.053184', '0.049841', '0.045747', '0.051579', '0.056590', '0.058271', '0.053311', '0.052155', '0.050388']
         : correct/total = [(203, 4128), (198, 4203), (225, 4081), (207, 4333), (184, 4091), (248, 4287), (226, 4193), (191, 4349), (216, 4191), (230, 4277), (229, 4143), (223, 4193), (204, 4093), (192, 4197), (209, 4052), (228, 4029), (242, 4153), (223, 4183), (213, 4084), (208, 4128)]
         : compromised: 0.0517, honest: 0.0515
Round 005: test acc mean=0.0486 ± 0.0032 | min=0.0432 max=0.0561
         : test loss mean=3.7298 ± 0.0192
         : individual accs = ['0.048934', '0.050202', '0.056114', '0.043157', '0.048643', '0.048519', '0.048414', '0.051276', '0.043188', '0.047229', '0.051653', '0.046745', '0.048620', '0.049559', '0.047878', '0.050385', '0.047195', '0.046139', '0.054358', '0.043847']
         : correct/total = [(202, 4128), (211, 4203), (229, 4081), (187, 4333), (199, 4091), (208, 4287), (203, 4193), (223, 4349), (181, 4191), (202, 4277), (214, 4143), (196, 4193), (199, 4093), (208, 4197), (194, 4052), (203, 4029), (196, 4153), (193, 4183), (222, 4084), (181, 4128)]
         : compromised: 0.0482, honest: 0.0487
Round 006: test acc mean=0.0472 ± 0.0022 | min=0.0445 max=0.0539
         : test loss mean=3.7091 ± 0.0205
         : individual accs = ['0.047238', '0.048775', '0.045087', '0.044773', '0.047421', '0.048752', '0.048891', '0.045528', '0.044619', '0.047697', '0.047309', '0.045314', '0.049597', '0.045747', '0.046397', '0.053860', '0.044546', '0.045900', '0.048482', '0.048692']
         : correct/total = [(195, 4128), (205, 4203), (184, 4081), (194, 4333), (194, 4091), (209, 4287), (205, 4193), (198, 4349), (187, 4191), (204, 4277), (196, 4143), (190, 4193), (203, 4093), (192, 4197), (188, 4052), (217, 4029), (185, 4153), (192, 4183), (198, 4084), (201, 4128)]
         : compromised: 0.0475, honest: 0.0472
Round 007: test acc mean=0.0447 ± 0.0037 | min=0.0365 max=0.0512
         : test loss mean=4.0034 ± 0.0159
         : individual accs = ['0.045785', '0.042589', '0.048763', '0.036464', '0.043266', '0.047352', '0.042213', '0.041619', '0.040802', '0.046528', '0.051171', '0.041736', '0.050818', '0.049559', '0.046644', '0.041698', '0.040693', '0.045900', '0.045788', '0.044331']
         : correct/total = [(189, 4128), (179, 4203), (199, 4081), (158, 4333), (177, 4091), (203, 4287), (177, 4193), (181, 4349), (171, 4191), (199, 4277), (212, 4143), (175, 4193), (208, 4093), (208, 4197), (189, 4052), (168, 4029), (169, 4153), (192, 4183), (187, 4084), (183, 4128)]
         : compromised: 0.0484, honest: 0.0438
Round 008: test acc mean=0.0500 ± 0.0048 | min=0.0420 max=0.0624
         : test loss mean=56.8368 ± 23.0530
         : individual accs = ['0.044574', '0.046158', '0.048272', '0.048234', '0.043021', '0.050618', '0.046745', '0.047827', '0.054880', '0.048398', '0.041999', '0.049606', '0.058637', '0.062426', '0.050346', '0.051378', '0.049362', '0.050920', '0.055583', '0.050872']
         : correct/total = [(184, 4128), (194, 4203), (197, 4081), (209, 4333), (176, 4091), (217, 4287), (196, 4193), (208, 4349), (230, 4191), (207, 4277), (174, 4143), (208, 4193), (240, 4093), (262, 4197), (204, 4052), (207, 4029), (205, 4153), (213, 4183), (227, 4084), (210, 4128)]
         : compromised: 0.0557, honest: 0.0486
Round 009: test acc mean=0.0486 ± 0.0032 | min=0.0432 max=0.0561
         : test loss mean=3.7534 ± 0.0143
         : individual accs = ['0.048934', '0.050202', '0.056114', '0.043157', '0.048643', '0.048519', '0.048414', '0.051276', '0.043188', '0.047229', '0.051653', '0.046745', '0.048620', '0.049559', '0.047878', '0.050385', '0.047195', '0.046139', '0.054358', '0.043847']
         : correct/total = [(202, 4128), (211, 4203), (229, 4081), (187, 4333), (199, 4091), (208, 4287), (203, 4193), (223, 4349), (181, 4191), (202, 4277), (214, 4143), (196, 4193), (199, 4093), (208, 4197), (194, 4052), (203, 4029), (196, 4153), (193, 4183), (222, 4084), (181, 4128)]
         : compromised: 0.0482, honest: 0.0487
Round 010: test acc mean=0.0471 ± 0.0041 | min=0.0365 max=0.0561
         : test loss mean=12.2329 ± 11.4089
         : individual accs = ['0.048934', '0.042589', '0.056114', '0.036464', '0.048643', '0.048519', '0.048414', '0.041619', '0.043188', '0.046528', '0.051171', '0.046745', '0.050818', '0.049559', '0.047878', '0.050385', '0.047195', '0.046139', '0.045788', '0.044331']
         : correct/total = [(202, 4128), (179, 4203), (229, 4081), (158, 4333), (199, 4091), (208, 4287), (203, 4193), (181, 4349), (181, 4191), (199, 4277), (212, 4143), (196, 4193), (208, 4093), (208, 4197), (194, 4052), (203, 4029), (196, 4153), (193, 4183), (187, 4084), (183, 4128)]
         : compromised: 0.0488, honest: 0.0466

=== FINAL RESULTS ===
Dataset: femnist, Nodes: 20, Graph: fully, Aggregation: d-fedavg
Attack: backdoor, 20.0% compromised
Final accuracy - Compromised: 0.0488, Honest: 0.0466
Overall test accuracy: mean=0.0471 ± 0.0041

=== BACKDOOR ATTACK SUCCESS RATE (ASR) ===
Target label: 0
Trigger size: 4x4
Overall ASR: 0.0000 ± 0.0000
Honest nodes ASR: 0.0000 ± 0.0000
Compromised nodes ASR: 0.0000 ± 0.0000
Note: Higher ASR indicates more successful backdoor attack
