Device: cuda
Seed: 987654321
Loading 36 LEAF FEMNIST train files...
LEAF FEMNIST train: 3597 users, 734463 samples
Loading 36 LEAF FEMNIST test files...
LEAF FEMNIST test: 3597 users, 83388 samples
Found 3597 train users, 3597 test users, 3597 common users
User sample counts range: 525 (max) to 17 (min)
Distributed ALL 3597 users across 20 clients
Users per client: 179 (with 17 clients getting +1 user)
Train partition sizes: [36360, 37070, 35957, 38262, 36024, 37732, 36921, 38328, 36867, 37683, 36507, 36915, 36007, 37001, 35681, 35453, 36585, 36801, 35964, 36345]
Test partition sizes: [4128, 4203, 4081, 4333, 4091, 4287, 4193, 4349, 4191, 4277, 4143, 4193, 4093, 4197, 4052, 4029, 4153, 4183, 4084, 4128]
  Client 0: 36360 train samples, 62 unique classes
  Client 1: 37070 train samples, 62 unique classes
  Client 2: 35957 train samples, 62 unique classes
  Client 3: 38262 train samples, 62 unique classes
  Client 4: 36024 train samples, 62 unique classes
  Client 5: 37732 train samples, 62 unique classes
  Client 6: 36921 train samples, 62 unique classes
  Client 7: 38328 train samples, 62 unique classes
  Client 8: 36867 train samples, 62 unique classes
  Client 9: 37683 train samples, 62 unique classes
  Client 10: 36507 train samples, 62 unique classes
  Client 11: 36915 train samples, 62 unique classes
  Client 12: 36007 train samples, 62 unique classes
  Client 13: 37001 train samples, 62 unique classes
  Client 14: 35681 train samples, 62 unique classes
  Client 15: 35453 train samples, 62 unique classes
  Client 16: 36585 train samples, 62 unique classes
  Client 17: 36801 train samples, 62 unique classes
  Client 18: 35964 train samples, 62 unique classes
  Client 19: 36345 train samples, 62 unique classes
Will sample 10000 samples per client per epoch
Graph: erdos, nodes: 20, edges: 48
Degree statistics: avg=4.80, min=2, max=7
Attack: Compromised 14/20 nodes: [1, 2, 3, 5, 6, 8, 11, 12, 13, 14, 15, 17, 18, 19]
Attack type: backdoor, lambda: 1.0
Backdoor target label: 0, trigger size: 4
Model variant: baseline
Model parameters: 6,603,710
UBAR ALGORITHM (Two-Stage Byzantine-resilient)
  - Model dimension: 6,603,710 parameters
  - Rho parameter: 0.30000000000000004
  - Stage 1: Distance-based filtering (select 30% closest neighbors)
  - Stage 2: Performance-based selection (loss comparison)
  - Complexity: O(deg(i)×d + deg(i)×inference)
Initial test acc across nodes: mean=0.0162 ± 0.0138
Backdoor attack: Created poisoned datasets for 14 compromised nodes
Round 001: test acc mean=0.1935 ± 0.1614 | min=0.0427 max=0.4940
         : test loss mean=16432.0821 ± 21957.1946
         : individual accs = ['0.450581', '0.048775', '0.196030', '0.057697', '0.494011', '0.169582', '0.042690', '0.482180', '0.096874', '0.428805', '0.150857', '0.141903', '0.047398', '0.047653', '0.168065', '0.060809', '0.442572', '0.180014', '0.108717', '0.054990']
         : correct/total = [(1860, 4128), (205, 4203), (800, 4081), (250, 4333), (2021, 4091), (727, 4287), (179, 4193), (2097, 4349), (406, 4191), (1834, 4277), (625, 4143), (595, 4193), (194, 4093), (200, 4197), (681, 4052), (245, 4029), (1838, 4153), (753, 4183), (444, 4084), (227, 4128)]
         : compromised: 0.1015, honest: 0.4082
         : ubar stats = ['Node 0: s1=0.167, s2=1.000', 'Node 1: s1=0.167, s2=1.000', 'Node 2: s1=0.200, s2=1.000']...
Round 002: test acc mean=0.2479 ± 0.3073 | min=0.0276 max=0.7457
         : test loss mean=57567.3503 ± 166546.9365
         : individual accs = ['0.737888', '0.027599', '0.049988', '0.039926', '0.730139', '0.052484', '0.050322', '0.745689', '0.043665', '0.711714', '0.650495', '0.051037', '0.051796', '0.048606', '0.053801', '0.047655', '0.723333', '0.046378', '0.045544', '0.050388']
         : correct/total = [(3046, 4128), (116, 4203), (204, 4081), (173, 4333), (2987, 4091), (225, 4287), (211, 4193), (3243, 4349), (183, 4191), (3044, 4277), (2695, 4143), (214, 4193), (212, 4093), (204, 4197), (218, 4052), (192, 4029), (3004, 4153), (194, 4183), (186, 4084), (208, 4128)]
         : compromised: 0.0471, honest: 0.7165
         : ubar stats = ['Node 0: s1=0.167, s2=1.000', 'Node 1: s1=0.167, s2=1.000', 'Node 2: s1=0.200, s2=1.000']...
Round 003: test acc mean=0.2710 ± 0.3366 | min=0.0415 max=0.8009
         : test loss mean=nan ± nan
         : individual accs = ['0.795300', '0.048775', '0.049743', '0.046619', '0.786849', '0.058782', '0.041498', '0.800874', '0.051062', '0.776011', '0.764181', '0.048891', '0.047398', '0.049083', '0.054788', '0.054604', '0.786901', '0.049247', '0.054358', '0.054990']
         : correct/total = [(3283, 4128), (205, 4203), (203, 4081), (202, 4333), (3219, 4091), (252, 4287), (174, 4193), (3483, 4349), (214, 4191), (3319, 4277), (3166, 4143), (205, 4193), (194, 4093), (206, 4197), (222, 4052), (220, 4029), (3268, 4153), (206, 4183), (222, 4084), (227, 4128)]
         : compromised: 0.0507, honest: 0.7850
         : ubar stats = ['Node 0: s1=0.167, s2=1.000', 'Node 1: s1=0.167, s2=1.000', 'Node 2: s1=0.200, s2=1.000']...
Round 004: test acc mean=0.2783 ± 0.3486 | min=0.0415 max=0.8232
         : test loss mean=nan ± nan
         : individual accs = ['0.807413', '0.048775', '0.049743', '0.046619', '0.809826', '0.052484', '0.041498', '0.823178', '0.051062', '0.809680', '0.803765', '0.048891', '0.047398', '0.047653', '0.054788', '0.054604', '0.810980', '0.049247', '0.054358', '0.054990']
         : correct/total = [(3333, 4128), (205, 4203), (203, 4081), (202, 4333), (3313, 4091), (225, 4287), (174, 4193), (3580, 4349), (214, 4191), (3463, 4277), (3330, 4143), (205, 4193), (194, 4093), (200, 4197), (222, 4052), (220, 4029), (3368, 4153), (206, 4183), (222, 4084), (227, 4128)]
         : compromised: 0.0502, honest: 0.8108
         : ubar stats = ['Node 0: s1=0.167, s2=1.000', 'Node 1: s1=0.167, s2=1.000', 'Node 2: s1=0.200, s2=1.000']...
Round 005: test acc mean=0.2822 ± 0.3545 | min=0.0415 max=0.8338
         : test loss mean=nan ± nan
         : individual accs = ['0.819525', '0.048775', '0.049743', '0.046619', '0.826693', '0.052484', '0.041498', '0.833755', '0.051062', '0.824877', '0.814627', '0.048891', '0.047398', '0.047653', '0.054788', '0.054604', '0.822056', '0.049247', '0.054358', '0.054990']
         : correct/total = [(3383, 4128), (205, 4203), (203, 4081), (202, 4333), (3382, 4091), (225, 4287), (174, 4193), (3626, 4349), (214, 4191), (3528, 4277), (3375, 4143), (205, 4193), (194, 4093), (200, 4197), (222, 4052), (220, 4029), (3414, 4153), (206, 4183), (222, 4084), (227, 4128)]
         : compromised: 0.0502, honest: 0.8236
         : ubar stats = ['Node 0: s1=0.167, s2=1.000', 'Node 1: s1=0.167, s2=1.000', 'Node 2: s1=0.200, s2=1.000']...
Round 006: test acc mean=0.2844 ± 0.3578 | min=0.0415 max=0.8387
         : test loss mean=nan ± nan
         : individual accs = ['0.827519', '0.048775', '0.049743', '0.046619', '0.827915', '0.052484', '0.041498', '0.836284', '0.051062', '0.838672', '0.823316', '0.048891', '0.047398', '0.047653', '0.054788', '0.054604', '0.831206', '0.049247', '0.054358', '0.054990']
         : correct/total = [(3416, 4128), (205, 4203), (203, 4081), (202, 4333), (3387, 4091), (225, 4287), (174, 4193), (3637, 4349), (214, 4191), (3587, 4277), (3411, 4143), (205, 4193), (194, 4093), (200, 4197), (222, 4052), (220, 4029), (3452, 4153), (206, 4183), (222, 4084), (227, 4128)]
         : compromised: 0.0502, honest: 0.8308
         : ubar stats = ['Node 0: s1=0.167, s2=1.000', 'Node 1: s1=0.167, s2=1.000', 'Node 2: s1=0.200, s2=1.000']...
Round 007: test acc mean=0.2870 ± 0.3618 | min=0.0415 max=0.8464
         : test loss mean=nan ± nan
         : individual accs = ['0.835998', '0.048775', '0.049743', '0.046619', '0.838181', '0.052484', '0.041498', '0.846401', '0.051062', '0.844050', '0.827902', '0.048891', '0.047398', '0.047653', '0.054788', '0.054604', '0.845654', '0.049247', '0.054358', '0.054990']
         : correct/total = [(3451, 4128), (205, 4203), (203, 4081), (202, 4333), (3429, 4091), (225, 4287), (174, 4193), (3681, 4349), (214, 4191), (3610, 4277), (3430, 4143), (205, 4193), (194, 4093), (200, 4197), (222, 4052), (220, 4029), (3512, 4153), (206, 4183), (222, 4084), (227, 4128)]
         : compromised: 0.0502, honest: 0.8397
         : ubar stats = ['Node 0: s1=0.167, s2=1.000', 'Node 1: s1=0.167, s2=1.000', 'Node 2: s1=0.200, s2=1.000']...
Round 008: test acc mean=0.2870 ± 0.3619 | min=0.0415 max=0.8503
         : test loss mean=nan ± nan
         : individual accs = ['0.828973', '0.048775', '0.049743', '0.046619', '0.841359', '0.052484', '0.041498', '0.850310', '0.051062', '0.846621', '0.830316', '0.048891', '0.047398', '0.047653', '0.054788', '0.054604', '0.840597', '0.049247', '0.054358', '0.054990']
         : correct/total = [(3422, 4128), (205, 4203), (203, 4081), (202, 4333), (3442, 4091), (225, 4287), (174, 4193), (3698, 4349), (214, 4191), (3621, 4277), (3440, 4143), (205, 4193), (194, 4093), (200, 4197), (222, 4052), (220, 4029), (3491, 4153), (206, 4183), (222, 4084), (227, 4128)]
         : compromised: 0.0502, honest: 0.8397
         : ubar stats = ['Node 0: s1=0.167, s2=1.000', 'Node 1: s1=0.167, s2=1.000', 'Node 2: s1=0.200, s2=1.000']...
Round 009: test acc mean=0.2882 ± 0.3636 | min=0.0415 max=0.8549
         : test loss mean=nan ± nan
         : individual accs = ['0.837452', '0.048775', '0.049743', '0.046619', '0.839404', '0.052484', '0.041498', '0.854909', '0.051062', '0.851064', '0.834178', '0.048891', '0.047398', '0.047653', '0.054788', '0.054604', '0.844450', '0.049247', '0.054358', '0.054990']
         : correct/total = [(3457, 4128), (205, 4203), (203, 4081), (202, 4333), (3434, 4091), (225, 4287), (174, 4193), (3718, 4349), (214, 4191), (3640, 4277), (3456, 4143), (205, 4193), (194, 4093), (200, 4197), (222, 4052), (220, 4029), (3507, 4153), (206, 4183), (222, 4084), (227, 4128)]
         : compromised: 0.0502, honest: 0.8436
         : ubar stats = ['Node 0: s1=0.167, s2=1.000', 'Node 1: s1=0.167, s2=1.000', 'Node 2: s1=0.200, s2=1.000']...
Round 010: test acc mean=0.2888 ± 0.3645 | min=0.0415 max=0.8574
         : test loss mean=nan ± nan
         : individual accs = ['0.843023', '0.048775', '0.049743', '0.046619', '0.842581', '0.052484', '0.041498', '0.854219', '0.051062', '0.857377', '0.832006', '0.048891', '0.047398', '0.047653', '0.054788', '0.054604', '0.843968', '0.049247', '0.054358', '0.054990']
         : correct/total = [(3480, 4128), (205, 4203), (203, 4081), (202, 4333), (3447, 4091), (225, 4287), (174, 4193), (3715, 4349), (214, 4191), (3667, 4277), (3447, 4143), (205, 4193), (194, 4093), (200, 4197), (222, 4052), (220, 4029), (3505, 4153), (206, 4183), (222, 4084), (227, 4128)]
         : compromised: 0.0502, honest: 0.8455
         : ubar stats = ['Node 0: s1=0.167, s2=1.000', 'Node 1: s1=0.167, s2=1.000', 'Node 2: s1=0.200, s2=1.000']...

=== FINAL RESULTS ===
Dataset: femnist, Nodes: 20, Graph: erdos, Aggregation: ubar
Attack: backdoor, 70.0% compromised
Final accuracy - Compromised: 0.0502, Honest: 0.8455
Overall test accuracy: mean=0.2888 ± 0.3645

=== BACKDOOR ATTACK SUCCESS RATE (ASR) ===
Target label: 0
Trigger size: 4x4
Overall ASR: 0.7155 ± 0.4346
Honest nodes ASR: 0.0517 ± 0.0042
Compromised nodes ASR: 1.0000 ± 0.0000
Note: Higher ASR indicates more successful backdoor attack

=== UBAR SUMMARY ===
Node 0: stage1=0.167, stage2=1.000, overall=0.167
Node 1: stage1=0.167, stage2=1.000, overall=0.167
Node 2: stage1=0.200, stage2=1.000, overall=0.200
Node 3: stage1=0.250, stage2=1.000, overall=0.250
Node 4: stage1=0.250, stage2=1.000, overall=0.250
Node 5: stage1=0.200, stage2=1.000, overall=0.200
Node 6: stage1=0.200, stage2=1.000, overall=0.200
Node 7: stage1=0.200, stage2=1.000, overall=0.200
Node 8: stage1=0.500, stage2=1.000, overall=0.500
Node 9: stage1=0.333, stage2=1.000, overall=0.333
Node 10: stage1=0.250, stage2=1.000, overall=0.250
Node 11: stage1=0.286, stage2=0.600, overall=0.171
Node 12: stage1=0.286, stage2=0.600, overall=0.171
Node 13: stage1=0.250, stage2=1.000, overall=0.250
Node 14: stage1=0.286, stage2=0.500, overall=0.143
Node 15: stage1=0.167, stage2=1.000, overall=0.167
Node 16: stage1=0.200, stage2=1.000, overall=0.200
Node 17: stage1=0.200, stage2=1.000, overall=0.200
Node 18: stage1=0.250, stage2=1.000, overall=0.250
Node 19: stage1=0.500, stage2=1.000, overall=0.500

=== PARALLEL EXECUTION TIME (realistic for distributed system) ===
  COMMUNICATION (max across nodes):
    - Full model transfer: 0.000s (0.0%)
  COMPUTATION (max across nodes):
    - Distance computation: 0.028s (0.7%)
    - Loss computation: 4.168s (99.2%)
    - Aggregation: 0.006s (0.1%)
  TOTALS:
    - Total computation: 4.202s (100.0%)
    - Total communication: 0.000s (0.0%)
    - Total parallel time: 4.202s

=== PER-NODE AVERAGE TIME ===
  - Distance computation: 0.022s
  - Loss computation: 3.932s
  - Aggregation: 0.004s
  - Model transfer: 0.000s
  - Total per node: 3.958s

=== TOTAL COMPUTATIONAL WORK (sum across all nodes) ===
  - Total distance computation: 0.436s
  - Total loss computation: 78.644s
  - Total aggregation: 0.088s
  - Total model transfer: 0.000s
  - Grand total: 79.169s
  - Mean Stage 1 acceptance rate: 0.257
  - Mean Stage 2 acceptance rate: 0.935
  - Overall acceptance rate: 0.240

UBAR Algorithm Properties:
  - Model dimension: 6,603,710
  - Rho parameter: 0.30000000000000004
  - Two-stage approach: Distance filtering + loss evaluation
  - Stage 1 selects: 30% of neighbors
  - Stage 2 uses: Training sample loss comparison
  - Theoretical complexity: O(deg(i)×d + deg(i)×inference)
  - Approach: UBAR paper implementation
