Device: cuda
Seed: 987654321
Loading 36 LEAF FEMNIST train files...
LEAF FEMNIST train: 3597 users, 734463 samples
Loading 36 LEAF FEMNIST test files...
LEAF FEMNIST test: 3597 users, 83388 samples
Found 3597 train users, 3597 test users, 3597 common users
User sample counts range: 525 (max) to 17 (min)
Distributed ALL 3597 users across 20 clients
Users per client: 179 (with 17 clients getting +1 user)
Train partition sizes: [36360, 37070, 35957, 38262, 36024, 37732, 36921, 38328, 36867, 37683, 36507, 36915, 36007, 37001, 35681, 35453, 36585, 36801, 35964, 36345]
Test partition sizes: [4128, 4203, 4081, 4333, 4091, 4287, 4193, 4349, 4191, 4277, 4143, 4193, 4093, 4197, 4052, 4029, 4153, 4183, 4084, 4128]
  Client 0: 36360 train samples, 62 unique classes
  Client 1: 37070 train samples, 62 unique classes
  Client 2: 35957 train samples, 62 unique classes
  Client 3: 38262 train samples, 62 unique classes
  Client 4: 36024 train samples, 62 unique classes
  Client 5: 37732 train samples, 62 unique classes
  Client 6: 36921 train samples, 62 unique classes
  Client 7: 38328 train samples, 62 unique classes
  Client 8: 36867 train samples, 62 unique classes
  Client 9: 37683 train samples, 62 unique classes
  Client 10: 36507 train samples, 62 unique classes
  Client 11: 36915 train samples, 62 unique classes
  Client 12: 36007 train samples, 62 unique classes
  Client 13: 37001 train samples, 62 unique classes
  Client 14: 35681 train samples, 62 unique classes
  Client 15: 35453 train samples, 62 unique classes
  Client 16: 36585 train samples, 62 unique classes
  Client 17: 36801 train samples, 62 unique classes
  Client 18: 35964 train samples, 62 unique classes
  Client 19: 36345 train samples, 62 unique classes
Will sample 10000 samples per client per epoch
Graph: fully, nodes: 20, edges: 190
Degree statistics: avg=19.00, min=19, max=19
Attack: Compromised 2/20 nodes: [5, 13]
Attack type: backdoor, lambda: 1.0
Backdoor target label: 0, trigger size: 4
Model variant: baseline
Model parameters: 6,603,710
Initial test acc across nodes: mean=0.0168 ± 0.0139
Backdoor attack: Created poisoned datasets for 2 compromised nodes
Round 001: test acc mean=0.0172 ± 0.0165 | min=0.0029 max=0.0589
         : test loss mean=38.5253 ± 11.9274
         : individual accs = ['0.003391', '0.002855', '0.005391', '0.028387', '0.029577', '0.004432', '0.009301', '0.058864', '0.022190', '0.007248', '0.003862', '0.003100', '0.031762', '0.049559', '0.003702', '0.036734', '0.021430', '0.005977', '0.003428', '0.011870']
         : correct/total = [(14, 4128), (12, 4203), (22, 4081), (123, 4333), (121, 4091), (19, 4287), (39, 4193), (256, 4349), (93, 4191), (31, 4277), (16, 4143), (13, 4193), (130, 4093), (208, 4197), (15, 4052), (148, 4029), (89, 4153), (25, 4183), (14, 4084), (49, 4128)]
         : compromised: 0.0270, honest: 0.0161
Round 002: test acc mean=0.0038 ± 0.0007 | min=0.0027 max=0.0053
         : test loss mean=5.6244 ± 0.0301
         : individual accs = ['0.003391', '0.003093', '0.003431', '0.003462', '0.002933', '0.004432', '0.003816', '0.004369', '0.003818', '0.003273', '0.003621', '0.005008', '0.002688', '0.003336', '0.003455', '0.004468', '0.004575', '0.003108', '0.003918', '0.005329']
         : correct/total = [(14, 4128), (13, 4203), (14, 4081), (15, 4333), (12, 4091), (19, 4287), (16, 4193), (19, 4349), (16, 4191), (14, 4277), (15, 4143), (21, 4193), (11, 4093), (14, 4197), (14, 4052), (18, 4029), (19, 4153), (13, 4183), (16, 4084), (22, 4128)]
         : compromised: 0.0039, honest: 0.0038
Round 003: test acc mean=0.0487 ± 0.0031 | min=0.0422 max=0.0527
         : test loss mean=4.3131 ± 0.0171
         : individual accs = ['0.050145', '0.049726', '0.052683', '0.043388', '0.052554', '0.052484', '0.044598', '0.049207', '0.042233', '0.048398', '0.045619', '0.046983', '0.050574', '0.047177', '0.051826', '0.050633', '0.051288', '0.048291', '0.051665', '0.045058']
         : correct/total = [(207, 4128), (209, 4203), (215, 4081), (188, 4333), (215, 4091), (225, 4287), (187, 4193), (214, 4349), (177, 4191), (207, 4277), (189, 4143), (197, 4193), (207, 4093), (198, 4197), (210, 4052), (204, 4029), (213, 4153), (202, 4183), (211, 4084), (186, 4128)]
         : compromised: 0.0498, honest: 0.0486
Round 004: test acc mean=0.0514 ± 0.0034 | min=0.0469 max=0.0618
         : test loss mean=5.4570 ± 0.0413
         : individual accs = ['0.051599', '0.051630', '0.050723', '0.048465', '0.051088', '0.048052', '0.049130', '0.051276', '0.047960', '0.053075', '0.050447', '0.061770', '0.053750', '0.046938', '0.048124', '0.056342', '0.055141', '0.050203', '0.052889', '0.048450']
         : correct/total = [(213, 4128), (217, 4203), (207, 4081), (210, 4333), (209, 4091), (206, 4287), (206, 4193), (223, 4349), (201, 4191), (227, 4277), (209, 4143), (259, 4193), (220, 4093), (197, 4197), (195, 4052), (227, 4029), (229, 4153), (210, 4183), (216, 4084), (200, 4128)]
         : compromised: 0.0475, honest: 0.0518
Round 005: test acc mean=0.0561 ± 0.0032 | min=0.0506 max=0.0624
         : test loss mean=7.6906 ± 0.0565
         : individual accs = ['0.059593', '0.052344', '0.057584', '0.052850', '0.057932', '0.050618', '0.057000', '0.058174', '0.053209', '0.053776', '0.055998', '0.053899', '0.058637', '0.062426', '0.061204', '0.056590', '0.058271', '0.050920', '0.055583', '0.055475']
         : correct/total = [(246, 4128), (220, 4203), (235, 4081), (229, 4333), (237, 4091), (217, 4287), (239, 4193), (253, 4349), (223, 4191), (230, 4277), (232, 4143), (226, 4193), (240, 4093), (262, 4197), (248, 4052), (228, 4029), (242, 4153), (213, 4183), (227, 4084), (229, 4128)]
         : compromised: 0.0565, honest: 0.0561
Round 006: test acc mean=0.0510 ± 0.0038 | min=0.0439 max=0.0578
         : test loss mean=5.0976 ± 0.0252
         : individual accs = ['0.049176', '0.047109', '0.055134', '0.047773', '0.044977', '0.057849', '0.053899', '0.043918', '0.051539', '0.047463', '0.055274', '0.053184', '0.049841', '0.045747', '0.051579', '0.054852', '0.054418', '0.053311', '0.052155', '0.050388']
         : correct/total = [(203, 4128), (198, 4203), (225, 4081), (207, 4333), (184, 4091), (248, 4287), (226, 4193), (191, 4349), (216, 4191), (203, 4277), (229, 4143), (223, 4193), (204, 4093), (192, 4197), (209, 4052), (221, 4029), (226, 4153), (223, 4183), (213, 4084), (208, 4128)]
         : compromised: 0.0518, honest: 0.0509
Round 007: test acc mean=0.0510 ± 0.0038 | min=0.0439 max=0.0578
         : test loss mean=3.8641 ± 0.0204
         : individual accs = ['0.049176', '0.047109', '0.055134', '0.047773', '0.044977', '0.057849', '0.053899', '0.043918', '0.051539', '0.047463', '0.055274', '0.053184', '0.049841', '0.045747', '0.051579', '0.054852', '0.054418', '0.053311', '0.052155', '0.050388']
         : correct/total = [(203, 4128), (198, 4203), (225, 4081), (207, 4333), (184, 4091), (248, 4287), (226, 4193), (191, 4349), (216, 4191), (203, 4277), (229, 4143), (223, 4193), (204, 4093), (192, 4197), (209, 4052), (221, 4029), (226, 4153), (223, 4183), (213, 4084), (208, 4128)]
         : compromised: 0.0518, honest: 0.0509
Round 008: test acc mean=0.0499 ± 0.0033 | min=0.0439 max=0.0553
         : test loss mean=3.7926 ± 0.0188
         : individual accs = ['0.049661', '0.050916', '0.054889', '0.046619', '0.052066', '0.045953', '0.043883', '0.053116', '0.051062', '0.044891', '0.047550', '0.054376', '0.052040', '0.055278', '0.045656', '0.050881', '0.051047', '0.048291', '0.050196', '0.050145']
         : correct/total = [(205, 4128), (214, 4203), (224, 4081), (202, 4333), (213, 4091), (197, 4287), (184, 4193), (231, 4349), (214, 4191), (192, 4277), (197, 4143), (228, 4193), (213, 4093), (232, 4197), (185, 4052), (205, 4029), (212, 4153), (202, 4183), (205, 4084), (207, 4128)]
         : compromised: 0.0506, honest: 0.0498
Round 009: test acc mean=0.0514 ± 0.0034 | min=0.0469 max=0.0618
         : test loss mean=3.8646 ± 0.0186
         : individual accs = ['0.051599', '0.051630', '0.050723', '0.048465', '0.051088', '0.048052', '0.049130', '0.051276', '0.047960', '0.053075', '0.050447', '0.061770', '0.053750', '0.046938', '0.048124', '0.056342', '0.055141', '0.050203', '0.052889', '0.048450']
         : correct/total = [(213, 4128), (217, 4203), (207, 4081), (210, 4333), (209, 4091), (206, 4287), (206, 4193), (223, 4349), (201, 4191), (227, 4277), (209, 4143), (259, 4193), (220, 4093), (197, 4197), (195, 4052), (227, 4029), (229, 4153), (210, 4183), (216, 4084), (200, 4128)]
         : compromised: 0.0475, honest: 0.0518
Round 010: test acc mean=0.0514 ± 0.0034 | min=0.0469 max=0.0618
         : test loss mean=3.8639 ± 0.0159
         : individual accs = ['0.051599', '0.051630', '0.050723', '0.048465', '0.051088', '0.048052', '0.049130', '0.051276', '0.047960', '0.053075', '0.050447', '0.061770', '0.053750', '0.046938', '0.048124', '0.056342', '0.055141', '0.050203', '0.052889', '0.048450']
         : correct/total = [(213, 4128), (217, 4203), (207, 4081), (210, 4333), (209, 4091), (206, 4287), (206, 4193), (223, 4349), (201, 4191), (227, 4277), (209, 4143), (259, 4193), (220, 4093), (197, 4197), (195, 4052), (227, 4029), (229, 4153), (210, 4183), (216, 4084), (200, 4128)]
         : compromised: 0.0475, honest: 0.0518

=== FINAL RESULTS ===
Dataset: femnist, Nodes: 20, Graph: fully, Aggregation: d-fedavg
Attack: backdoor, 10.0% compromised
Final accuracy - Compromised: 0.0475, Honest: 0.0518
Overall test accuracy: mean=0.0514 ± 0.0034

=== BACKDOOR ATTACK SUCCESS RATE (ASR) ===
Target label: 0
Trigger size: 4x4
Overall ASR: 0.0000 ± 0.0000
Honest nodes ASR: 0.0000 ± 0.0000
Compromised nodes ASR: 0.0000 ± 0.0000
Note: Higher ASR indicates more successful backdoor attack
