Device: cuda
Seed: 987654321
Loading 36 LEAF FEMNIST train files...
LEAF FEMNIST train: 3597 users, 734463 samples
Loading 36 LEAF FEMNIST test files...
LEAF FEMNIST test: 3597 users, 83388 samples
Found 3597 train users, 3597 test users, 3597 common users
User sample counts range: 525 (max) to 17 (min)
Distributed ALL 3597 users across 20 clients
Users per client: 179 (with 17 clients getting +1 user)
Train partition sizes: [36360, 37070, 35957, 38262, 36024, 37732, 36921, 38328, 36867, 37683, 36507, 36915, 36007, 37001, 35681, 35453, 36585, 36801, 35964, 36345]
Test partition sizes: [4128, 4203, 4081, 4333, 4091, 4287, 4193, 4349, 4191, 4277, 4143, 4193, 4093, 4197, 4052, 4029, 4153, 4183, 4084, 4128]
  Client 0: 36360 train samples, 62 unique classes
  Client 1: 37070 train samples, 62 unique classes
  Client 2: 35957 train samples, 62 unique classes
  Client 3: 38262 train samples, 62 unique classes
  Client 4: 36024 train samples, 62 unique classes
  Client 5: 37732 train samples, 62 unique classes
  Client 6: 36921 train samples, 62 unique classes
  Client 7: 38328 train samples, 62 unique classes
  Client 8: 36867 train samples, 62 unique classes
  Client 9: 37683 train samples, 62 unique classes
  Client 10: 36507 train samples, 62 unique classes
  Client 11: 36915 train samples, 62 unique classes
  Client 12: 36007 train samples, 62 unique classes
  Client 13: 37001 train samples, 62 unique classes
  Client 14: 35681 train samples, 62 unique classes
  Client 15: 35453 train samples, 62 unique classes
  Client 16: 36585 train samples, 62 unique classes
  Client 17: 36801 train samples, 62 unique classes
  Client 18: 35964 train samples, 62 unique classes
  Client 19: 36345 train samples, 62 unique classes
Will sample 10000 samples per client per epoch
Graph: erdos, nodes: 20, edges: 99
Degree statistics: avg=9.90, min=7, max=14
Attack: Compromised 12/20 nodes: [1, 2, 3, 5, 8, 11, 12, 13, 14, 15, 17, 18]
Attack type: directed_deviation, lambda: 1.0
Model variant: baseline
Model parameters: 6,603,710
Sketchguard Node 0:
  Model dim: 6,603,710 → Sketch size: 1000
  Compression ratio: 6603.7x
  Using model parameters for aggregation, sketches for filtering
Sketchguard Node 1:
  Model dim: 6,603,710 → Sketch size: 1000
  Compression ratio: 6603.7x
  Using model parameters for aggregation, sketches for filtering
Sketchguard Node 2:
  Model dim: 6,603,710 → Sketch size: 1000
  Compression ratio: 6603.7x
  Using model parameters for aggregation, sketches for filtering
Sketchguard Node 3:
  Model dim: 6,603,710 → Sketch size: 1000
  Compression ratio: 6603.7x
  Using model parameters for aggregation, sketches for filtering
Sketchguard Node 4:
  Model dim: 6,603,710 → Sketch size: 1000
  Compression ratio: 6603.7x
  Using model parameters for aggregation, sketches for filtering
Sketchguard Node 5:
  Model dim: 6,603,710 → Sketch size: 1000
  Compression ratio: 6603.7x
  Using model parameters for aggregation, sketches for filtering
Sketchguard Node 6:
  Model dim: 6,603,710 → Sketch size: 1000
  Compression ratio: 6603.7x
  Using model parameters for aggregation, sketches for filtering
Sketchguard Node 7:
  Model dim: 6,603,710 → Sketch size: 1000
  Compression ratio: 6603.7x
  Using model parameters for aggregation, sketches for filtering
Sketchguard Node 8:
  Model dim: 6,603,710 → Sketch size: 1000
  Compression ratio: 6603.7x
  Using model parameters for aggregation, sketches for filtering
Sketchguard Node 9:
  Model dim: 6,603,710 → Sketch size: 1000
  Compression ratio: 6603.7x
  Using model parameters for aggregation, sketches for filtering
Sketchguard Node 10:
  Model dim: 6,603,710 → Sketch size: 1000
  Compression ratio: 6603.7x
  Using model parameters for aggregation, sketches for filtering
Sketchguard Node 11:
  Model dim: 6,603,710 → Sketch size: 1000
  Compression ratio: 6603.7x
  Using model parameters for aggregation, sketches for filtering
Sketchguard Node 12:
  Model dim: 6,603,710 → Sketch size: 1000
  Compression ratio: 6603.7x
  Using model parameters for aggregation, sketches for filtering
Sketchguard Node 13:
  Model dim: 6,603,710 → Sketch size: 1000
  Compression ratio: 6603.7x
  Using model parameters for aggregation, sketches for filtering
Sketchguard Node 14:
  Model dim: 6,603,710 → Sketch size: 1000
  Compression ratio: 6603.7x
  Using model parameters for aggregation, sketches for filtering
Sketchguard Node 15:
  Model dim: 6,603,710 → Sketch size: 1000
  Compression ratio: 6603.7x
  Using model parameters for aggregation, sketches for filtering
Sketchguard Node 16:
  Model dim: 6,603,710 → Sketch size: 1000
  Compression ratio: 6603.7x
  Using model parameters for aggregation, sketches for filtering
Sketchguard Node 17:
  Model dim: 6,603,710 → Sketch size: 1000
  Compression ratio: 6603.7x
  Using model parameters for aggregation, sketches for filtering
Sketchguard Node 18:
  Model dim: 6,603,710 → Sketch size: 1000
  Compression ratio: 6603.7x
  Using model parameters for aggregation, sketches for filtering
Sketchguard Node 19:
  Model dim: 6,603,710 → Sketch size: 1000
  Compression ratio: 6603.7x
  Using model parameters for aggregation, sketches for filtering
Sketchguard ALGORITHM (Sketch-based Filtering + State Aggregation)
  - Model dimension: 6,603,710 parameters
  - Config: SketchguardConfig(gamma=2, kappa=1, alpha=0.5, min_neighbors=1, sketch_size=1000, network_seed=987654321, attack_detection_window=5)
  - Sketch size: 1000
  - Compression ratio: 6603.7x
  - Complexity: O(d + N×k) = O(6,603,710 + 20×1000)
  - Theoretical speedup vs BALANCE: 19.9x
Initial test acc across nodes: mean=0.0162 ± 0.0138
Round 001: test acc mean=0.4523 ± 0.0436 | min=0.3722 max=0.5252
         : test loss mean=3.7670 ± 0.0359
         : individual accs = ['0.510417', '0.473233', '0.484685', '0.451881', '0.441701', '0.523676', '0.424517', '0.406530', '0.460988', '0.413374', '0.396814', '0.508228', '0.431224', '0.402669', '0.459033', '0.492926', '0.444739', '0.525221', '0.372184', '0.421754']
         : correct/total = [(2107, 4128), (1989, 4203), (1978, 4081), (1958, 4333), (1807, 4091), (2245, 4287), (1780, 4193), (1768, 4349), (1932, 4191), (1768, 4277), (1644, 4143), (2131, 4193), (1765, 4093), (1690, 4197), (1860, 4052), (1986, 4029), (1847, 4153), (2197, 4183), (1520, 4084), (1741, 4128)]
         : compromised: 0.4655, honest: 0.4325
         : sketchguard stats = ['Node 0: acc_rate=0.417', 'Node 1: acc_rate=0.500', 'Node 2: acc_rate=0.500']...
Round 002: test acc mean=0.6695 ± 0.0233 | min=0.6144 max=0.7096
         : test loss mean=3.2080 ± 0.2269
         : individual accs = ['0.706153', '0.677373', '0.646900', '0.686591', '0.663652', '0.709587', '0.614357', '0.660612', '0.653305', '0.708207', '0.668839', '0.674934', '0.676521', '0.665714', '0.694719', '0.652271', '0.667469', '0.650729', '0.670666', '0.641715']
         : correct/total = [(2915, 4128), (2847, 4203), (2640, 4081), (2975, 4333), (2715, 4091), (3042, 4287), (2576, 4193), (2873, 4349), (2738, 4191), (3029, 4277), (2771, 4143), (2830, 4193), (2769, 4093), (2794, 4197), (2815, 4052), (2628, 4029), (2772, 4153), (2722, 4183), (2739, 4084), (2649, 4128)]
         : compromised: 0.6716, honest: 0.6664
         : sketchguard stats = ['Node 0: acc_rate=0.417', 'Node 1: acc_rate=0.500', 'Node 2: acc_rate=0.500']...
Round 003: test acc mean=0.6872 ± 0.0321 | min=0.6072 max=0.7253
         : test loss mean=2.5059 ± 0.4114
         : individual accs = ['0.725291', '0.681656', '0.607204', '0.721209', '0.703251', '0.645440', '0.717625', '0.695332', '0.693629', '0.716858', '0.709631', '0.680658', '0.679941', '0.697641', '0.668559', '0.624473', '0.720443', '0.654554', '0.693683', '0.707364']
         : correct/total = [(2994, 4128), (2865, 4203), (2478, 4081), (3125, 4333), (2877, 4091), (2767, 4287), (3009, 4193), (3024, 4349), (2907, 4191), (3066, 4277), (2940, 4143), (2854, 4193), (2783, 4093), (2928, 4197), (2709, 4052), (2516, 4029), (2992, 4153), (2738, 4183), (2833, 4084), (2920, 4128)]
         : compromised: 0.6707, honest: 0.7120
         : sketchguard stats = ['Node 0: acc_rate=0.417', 'Node 1: acc_rate=0.500', 'Node 2: acc_rate=0.500']...
Round 004: test acc mean=0.7330 ± 0.0344 | min=0.6501 max=0.7761
         : test loss mean=1.5891 ± 0.3351
         : individual accs = ['0.752665', '0.699500', '0.686106', '0.706208', '0.771450', '0.689293', '0.764846', '0.768453', '0.767836', '0.763386', '0.731837', '0.715001', '0.650134', '0.767691', '0.724334', '0.714321', '0.776065', '0.715754', '0.743879', '0.750484']
         : correct/total = [(3107, 4128), (2940, 4203), (2800, 4081), (3060, 4333), (3156, 4091), (2955, 4287), (3207, 4193), (3342, 4349), (3218, 4191), (3265, 4277), (3032, 4143), (2998, 4193), (2661, 4093), (3222, 4197), (2935, 4052), (2878, 4029), (3223, 4153), (2994, 4183), (3038, 4084), (3098, 4128)]
         : compromised: 0.7150, honest: 0.7599
         : sketchguard stats = ['Node 0: acc_rate=0.417', 'Node 1: acc_rate=0.500', 'Node 2: acc_rate=0.500']...
Round 005: test acc mean=0.7755 ± 0.0180 | min=0.7435 max=0.8042
         : test loss mean=0.9533 ± 0.1426
         : individual accs = ['0.775194', '0.750892', '0.771135', '0.752596', '0.781960', '0.770702', '0.787980', '0.799494', '0.796946', '0.795885', '0.774318', '0.754352', '0.747374', '0.785561', '0.771471', '0.770911', '0.804238', '0.743486', '0.780118', '0.795543']
         : correct/total = [(3200, 4128), (3156, 4203), (3147, 4081), (3261, 4333), (3199, 4091), (3304, 4287), (3304, 4193), (3477, 4349), (3340, 4191), (3404, 4277), (3208, 4143), (3163, 4193), (3059, 4093), (3297, 4197), (3126, 4052), (3106, 4029), (3340, 4153), (3110, 4183), (3186, 4084), (3284, 4128)]
         : compromised: 0.7663, honest: 0.7893
         : sketchguard stats = ['Node 0: acc_rate=0.417', 'Node 1: acc_rate=0.500', 'Node 2: acc_rate=0.500']...
Round 006: test acc mean=0.8097 ± 0.0070 | min=0.7970 max=0.8240
         : test loss mean=0.6612 ± 0.0403
         : individual accs = ['0.801841', '0.804425', '0.808135', '0.810062', '0.806160', '0.804759', '0.810637', '0.820878', '0.816989', '0.812252', '0.802559', '0.811591', '0.796970', '0.812009', '0.819595', '0.815339', '0.823983', '0.800143', '0.806317', '0.810320']
         : correct/total = [(3310, 4128), (3381, 4203), (3298, 4081), (3510, 4333), (3298, 4091), (3450, 4287), (3399, 4193), (3570, 4349), (3424, 4191), (3474, 4277), (3325, 4143), (3403, 4193), (3262, 4093), (3408, 4197), (3321, 4052), (3285, 4029), (3422, 4153), (3347, 4183), (3293, 4084), (3345, 4128)]
         : compromised: 0.8089, honest: 0.8111
         : sketchguard stats = ['Node 0: acc_rate=0.417', 'Node 1: acc_rate=0.500', 'Node 2: acc_rate=0.500']...
Round 007: test acc mean=0.8266 ± 0.0058 | min=0.8158 max=0.8370
         : test loss mean=0.5591 ± 0.0238
         : individual accs = ['0.819525', '0.837021', '0.825288', '0.829218', '0.818137', '0.826452', '0.828762', '0.836054', '0.831305', '0.831190', '0.815834', '0.824708', '0.818226', '0.828211', '0.832182', '0.826756', '0.832170', '0.822615', '0.826151', '0.821948']
         : correct/total = [(3383, 4128), (3518, 4203), (3368, 4081), (3593, 4333), (3347, 4091), (3543, 4287), (3475, 4193), (3636, 4349), (3484, 4191), (3555, 4277), (3380, 4143), (3458, 4193), (3349, 4093), (3476, 4197), (3372, 4052), (3331, 4029), (3456, 4153), (3441, 4183), (3374, 4084), (3393, 4128)]
         : compromised: 0.8273, honest: 0.8255
         : sketchguard stats = ['Node 0: acc_rate=0.417', 'Node 1: acc_rate=0.500', 'Node 2: acc_rate=0.500']...
Round 008: test acc mean=0.8317 ± 0.0071 | min=0.8137 max=0.8416
         : test loss mean=0.5181 ± 0.0204
         : individual accs = ['0.827035', '0.834642', '0.825778', '0.839603', '0.826448', '0.839282', '0.839256', '0.839273', '0.835123', '0.837737', '0.821868', '0.834725', '0.824334', '0.830117', '0.841560', '0.837180', '0.828558', '0.829787', '0.828599', '0.813711']
         : correct/total = [(3414, 4128), (3508, 4203), (3370, 4081), (3638, 4333), (3381, 4091), (3598, 4287), (3519, 4193), (3650, 4349), (3500, 4191), (3583, 4277), (3405, 4143), (3500, 4193), (3374, 4093), (3484, 4197), (3410, 4052), (3373, 4029), (3441, 4153), (3471, 4183), (3384, 4084), (3359, 4128)]
         : compromised: 0.8334, honest: 0.8292
         : sketchguard stats = ['Node 0: acc_rate=0.417', 'Node 1: acc_rate=0.500', 'Node 2: acc_rate=0.500']...
Round 009: test acc mean=0.8413 ± 0.0053 | min=0.8306 max=0.8490
         : test loss mean=0.4856 ± 0.0170
         : individual accs = ['0.834060', '0.845349', '0.839990', '0.846757', '0.830604', '0.845113', '0.847842', '0.846172', '0.848962', '0.847791', '0.837075', '0.839256', '0.840704', '0.840362', '0.845015', '0.842889', '0.832410', '0.841023', '0.837169', '0.836725']
         : correct/total = [(3443, 4128), (3553, 4203), (3428, 4081), (3669, 4333), (3398, 4091), (3623, 4287), (3555, 4193), (3680, 4349), (3558, 4191), (3626, 4277), (3468, 4143), (3519, 4193), (3441, 4093), (3527, 4197), (3424, 4052), (3396, 4029), (3457, 4153), (3518, 4183), (3419, 4084), (3454, 4128)]
         : compromised: 0.8427, honest: 0.8391
         : sketchguard stats = ['Node 0: acc_rate=0.417', 'Node 1: acc_rate=0.500', 'Node 2: acc_rate=0.500']...
Round 010: test acc mean=0.8466 ± 0.0052 | min=0.8366 max=0.8568
         : test loss mean=0.4680 ± 0.0182
         : individual accs = ['0.843023', '0.856769', '0.841460', '0.850912', '0.838426', '0.848146', '0.851658', '0.851690', '0.850632', '0.848726', '0.836592', '0.841402', '0.841681', '0.849893', '0.848963', '0.852072', '0.841801', '0.847717', '0.846474', '0.843508']
         : correct/total = [(3480, 4128), (3601, 4203), (3434, 4081), (3687, 4333), (3430, 4091), (3636, 4287), (3571, 4193), (3704, 4349), (3565, 4191), (3630, 4277), (3466, 4143), (3528, 4193), (3445, 4093), (3567, 4197), (3440, 4052), (3433, 4029), (3496, 4153), (3546, 4183), (3457, 4084), (3482, 4128)]
         : compromised: 0.8480, honest: 0.8444
         : sketchguard stats = ['Node 0: acc_rate=0.417', 'Node 1: acc_rate=0.500', 'Node 2: acc_rate=0.500']...

=== FINAL RESULTS ===
Dataset: femnist, Nodes: 20, Graph: erdos, Aggregation: sketchguard
Attack: directed_deviation, 60.0% compromised
Final accuracy - Compromised: 0.8480, Honest: 0.8444
Overall test accuracy: mean=0.8466 ± 0.0052

=== Sketchguard SUMMARY ===
Node 0: acceptance=0.417
Node 1: acceptance=0.500
Node 2: acceptance=0.500
Node 3: acceptance=0.571
Node 4: acceptance=0.333
Node 5: acceptance=0.400
Node 6: acceptance=0.333
Node 7: acceptance=0.273
Node 8: acceptance=0.286
Node 9: acceptance=0.545
Node 10: acceptance=0.500
Node 11: acceptance=0.333
Node 12: acceptance=0.500
Node 13: acceptance=0.333
Node 14: acceptance=0.357
Node 15: acceptance=0.444
Node 16: acceptance=0.286
Node 17: acceptance=0.625
Node 18: acceptance=0.333
Node 19: acceptance=0.300

=== PARALLEL EXECUTION TIME (realistic for distributed system) ===
  COMMUNICATION (max across nodes):
    - Sketch transfer: 0.000s (0.0%)
    - Model fetch (accepted): 0.000s (0.0%)
  COMPUTATION (max across nodes):
    - Sketching: 2.873s (99.2%)
    - Filtering: 0.001s (0.0%)
    - Aggregation: 0.021s (0.7%)
  TOTALS:
    - Total computation: 2.896s (100.0%)
    - Total communication: 0.000s (0.0%)
    - Total parallel time: 2.896s

=== PER-NODE AVERAGE TIME ===
  - Sketching: 2.156s
  - Filtering: 0.001s
  - Aggregation: 0.015s
  - Sketch transfer: 0.000s
  - Model fetch: 0.000s
  - Total per node: 2.172s

=== TOTAL COMPUTATIONAL WORK (sum across all nodes) ===
  - Total sketching: 43.130s
  - Total filtering: 0.018s
  - Total aggregation: 0.297s
  - Total sketch transfer: 0.000s
  - Total model fetch: 0.000s
  - Grand total: 43.445s
  - Mean acceptance rate: 0.409

Sketchguard Algorithm Properties:
  - Original dimension: 6,603,710
  - Sketch size: 1000
  - Compression ratio: 19.9x
  - Single repetition: No repetitions needed
  - Theoretical complexity: O(d + N×k)
  - Approach: Sketch filtering + state aggregation
