Device: cuda
Seed: 987654321
Loading 36 LEAF FEMNIST train files...
LEAF FEMNIST train: 3597 users, 734463 samples
Loading 36 LEAF FEMNIST test files...
LEAF FEMNIST test: 3597 users, 83388 samples
Found 3597 train users, 3597 test users, 3597 common users
User sample counts range: 525 (max) to 17 (min)
Distributed ALL 3597 users across 20 clients
Users per client: 179 (with 17 clients getting +1 user)
Train partition sizes: [36360, 37070, 35957, 38262, 36024, 37732, 36921, 38328, 36867, 37683, 36507, 36915, 36007, 37001, 35681, 35453, 36585, 36801, 35964, 36345]
Test partition sizes: [4128, 4203, 4081, 4333, 4091, 4287, 4193, 4349, 4191, 4277, 4143, 4193, 4093, 4197, 4052, 4029, 4153, 4183, 4084, 4128]
  Client 0: 36360 train samples, 62 unique classes
  Client 1: 37070 train samples, 62 unique classes
  Client 2: 35957 train samples, 62 unique classes
  Client 3: 38262 train samples, 62 unique classes
  Client 4: 36024 train samples, 62 unique classes
  Client 5: 37732 train samples, 62 unique classes
  Client 6: 36921 train samples, 62 unique classes
  Client 7: 38328 train samples, 62 unique classes
  Client 8: 36867 train samples, 62 unique classes
  Client 9: 37683 train samples, 62 unique classes
  Client 10: 36507 train samples, 62 unique classes
  Client 11: 36915 train samples, 62 unique classes
  Client 12: 36007 train samples, 62 unique classes
  Client 13: 37001 train samples, 62 unique classes
  Client 14: 35681 train samples, 62 unique classes
  Client 15: 35453 train samples, 62 unique classes
  Client 16: 36585 train samples, 62 unique classes
  Client 17: 36801 train samples, 62 unique classes
  Client 18: 35964 train samples, 62 unique classes
  Client 19: 36345 train samples, 62 unique classes
Will sample 10000 samples per client per epoch
Graph: fully, nodes: 20, edges: 190
Degree statistics: avg=19.00, min=19, max=19
Attack: Compromised 10/20 nodes: [1, 2, 5, 11, 12, 13, 14, 15, 17, 18]
Attack type: backdoor, lambda: 1.0
Backdoor target label: 0, trigger size: 4
Model variant: baseline
Model parameters: 6,603,710
BALANCE algorithm:
Balance Config: BALANCEConfig(gamma=2, kappa=1, alpha=0.5, min_neighbors=1)
  - Model dimension: 6,603,710 parameters
  - Complexity: O(N×d) = O(20×6,603,710)
Initial test acc across nodes: mean=0.0168 ± 0.0139
Backdoor attack: Created poisoned datasets for 10 compromised nodes
Round 001: test acc mean=0.3112 ± 0.2007 | min=0.0488 max=0.5509
         : test loss mean=8315.8919 ± 8662.7475
         : individual accs = ['0.550872', '0.048775', '0.194805', '0.531272', '0.513322', '0.215535', '0.514906', '0.513681', '0.510141', '0.451017', '0.515327', '0.106129', '0.054239', '0.049083', '0.150296', '0.079424', '0.459427', '0.155869', '0.103330', '0.506056']
         : correct/total = [(2274, 4128), (205, 4203), (795, 4081), (2302, 4333), (2100, 4091), (924, 4287), (2159, 4193), (2234, 4349), (2138, 4191), (1929, 4277), (2135, 4143), (445, 4193), (222, 4093), (206, 4197), (609, 4052), (320, 4029), (1908, 4153), (652, 4183), (422, 4084), (2089, 4128)]
         : compromised: 0.1157, honest: 0.5066
Round 002: test acc mean=0.3628 ± 0.3126 | min=0.0461 max=0.6993
         : test loss mean=4317.8753 ± 9119.5757
         : individual accs = ['0.682897', '0.047347', '0.057584', '0.699285', '0.683451', '0.050618', '0.656093', '0.681306', '0.658793', '0.665420', '0.684287', '0.049606', '0.054728', '0.049321', '0.046644', '0.053363', '0.670840', '0.046139', '0.048482', '0.670300']
         : correct/total = [(2819, 4128), (199, 4203), (235, 4081), (3030, 4333), (2796, 4091), (217, 4287), (2751, 4193), (2963, 4349), (2761, 4191), (2846, 4277), (2835, 4143), (208, 4193), (224, 4093), (207, 4197), (189, 4052), (215, 4029), (2786, 4153), (193, 4183), (198, 4084), (2767, 4128)]
         : compromised: 0.0504, honest: 0.6753
Round 003: test acc mean=0.3767 ± 0.3257 | min=0.0488 max=0.7224
         : test loss mean=nan ± nan
         : individual accs = ['0.708333', '0.048775', '0.053418', '0.722363', '0.716451', '0.050618', '0.695445', '0.716946', '0.695061', '0.702829', '0.694424', '0.049606', '0.054239', '0.049083', '0.051826', '0.051626', '0.673971', '0.049486', '0.052889', '0.696221']
         : correct/total = [(2924, 4128), (205, 4203), (218, 4081), (3130, 4333), (2931, 4091), (217, 4287), (2916, 4193), (3118, 4349), (2913, 4191), (3006, 4277), (2877, 4143), (208, 4193), (222, 4093), (206, 4197), (210, 4052), (208, 4029), (2799, 4153), (207, 4183), (216, 4084), (2874, 4128)]
         : compromised: 0.0512, honest: 0.7022
Round 004: test acc mean=0.3697 ± 0.3199 | min=0.0453 max=0.7224
         : test loss mean=nan ± nan
         : individual accs = ['0.675145', '0.048775', '0.053418', '0.722363', '0.692985', '0.045253', '0.712855', '0.719476', '0.709377', '0.674071', '0.661115', '0.049606', '0.054239', '0.049083', '0.051826', '0.051626', '0.705755', '0.049486', '0.052889', '0.614341']
         : correct/total = [(2787, 4128), (205, 4203), (218, 4081), (3130, 4333), (2835, 4091), (194, 4287), (2989, 4193), (3129, 4349), (2973, 4191), (2883, 4277), (2739, 4143), (208, 4193), (222, 4093), (206, 4197), (210, 4052), (208, 4029), (2931, 4153), (207, 4183), (216, 4084), (2536, 4128)]
         : compromised: 0.0506, honest: 0.6887
Round 005: test acc mean=0.3991 ± 0.3487 | min=0.0453 max=0.7772
         : test loss mean=nan ± nan
         : individual accs = ['0.740310', '0.048775', '0.053418', '0.744519', '0.751894', '0.045253', '0.744336', '0.777190', '0.736578', '0.773673', '0.733044', '0.049606', '0.054239', '0.049083', '0.051826', '0.051626', '0.755117', '0.049486', '0.052889', '0.718750']
         : correct/total = [(3056, 4128), (205, 4203), (218, 4081), (3226, 4333), (3076, 4091), (194, 4287), (3121, 4193), (3380, 4349), (3087, 4191), (3309, 4277), (3037, 4143), (208, 4193), (222, 4093), (206, 4197), (210, 4052), (208, 4029), (3136, 4153), (207, 4183), (216, 4084), (2967, 4128)]
         : compromised: 0.0506, honest: 0.7475
Round 006: test acc mean=0.4279 ± 0.3774 | min=0.0453 max=0.8148
         : test loss mean=nan ± nan
         : individual accs = ['0.805959', '0.048775', '0.053418', '0.805908', '0.808360', '0.045253', '0.804674', '0.813750', '0.801957', '0.814823', '0.795076', '0.049606', '0.054239', '0.049083', '0.051826', '0.051626', '0.809054', '0.049486', '0.052889', '0.793120']
         : correct/total = [(3327, 4128), (205, 4203), (218, 4081), (3492, 4333), (3307, 4091), (194, 4287), (3374, 4193), (3539, 4349), (3361, 4191), (3485, 4277), (3294, 4143), (208, 4193), (222, 4093), (206, 4197), (210, 4052), (208, 4029), (3360, 4153), (207, 4183), (216, 4084), (3274, 4128)]
         : compromised: 0.0506, honest: 0.8053
Round 007: test acc mean=0.4387 ± 0.3881 | min=0.0453 max=0.8395
         : test loss mean=nan ± nan
         : individual accs = ['0.824612', '0.048775', '0.053418', '0.828987', '0.838670', '0.045253', '0.819938', '0.839503', '0.820806', '0.835399', '0.809558', '0.049606', '0.054239', '0.049083', '0.051826', '0.051626', '0.828317', '0.049486', '0.052889', '0.821463']
         : correct/total = [(3404, 4128), (205, 4203), (218, 4081), (3592, 4333), (3431, 4091), (194, 4287), (3438, 4193), (3651, 4349), (3440, 4191), (3573, 4277), (3354, 4143), (208, 4193), (222, 4093), (206, 4197), (210, 4052), (208, 4029), (3440, 4153), (207, 4183), (216, 4084), (3391, 4128)]
         : compromised: 0.0506, honest: 0.8267
Round 008: test acc mean=0.4438 ± 0.3932 | min=0.0453 max=0.8497
         : test loss mean=nan ± nan
         : individual accs = ['0.834060', '0.048775', '0.053418', '0.837526', '0.849670', '0.045253', '0.826139', '0.848701', '0.833453', '0.844517', '0.827661', '0.049606', '0.054239', '0.049083', '0.051826', '0.051626', '0.838912', '0.049486', '0.052889', '0.829457']
         : correct/total = [(3443, 4128), (205, 4203), (218, 4081), (3629, 4333), (3476, 4091), (194, 4287), (3464, 4193), (3691, 4349), (3493, 4191), (3612, 4277), (3429, 4143), (208, 4193), (222, 4093), (206, 4197), (210, 4052), (208, 4029), (3484, 4153), (207, 4183), (216, 4084), (3424, 4128)]
         : compromised: 0.0506, honest: 0.8370
Round 009: test acc mean=0.4469 ± 0.3963 | min=0.0453 max=0.8579
         : test loss mean=nan ± nan
         : individual accs = ['0.833818', '0.048775', '0.053418', '0.846296', '0.850159', '0.045253', '0.833532', '0.857898', '0.837748', '0.851531', '0.833213', '0.049606', '0.054239', '0.049083', '0.051826', '0.051626', '0.847821', '0.049486', '0.052889', '0.839147']
         : correct/total = [(3442, 4128), (205, 4203), (218, 4081), (3667, 4333), (3478, 4091), (194, 4287), (3495, 4193), (3731, 4349), (3511, 4191), (3642, 4277), (3452, 4143), (208, 4193), (222, 4093), (206, 4197), (210, 4052), (208, 4029), (3521, 4153), (207, 4183), (216, 4084), (3464, 4128)]
         : compromised: 0.0506, honest: 0.8431
Round 010: test acc mean=0.4488 ± 0.3982 | min=0.0453 max=0.8560
         : test loss mean=nan ± nan
         : individual accs = ['0.843266', '0.048775', '0.053418', '0.848142', '0.856025', '0.045253', '0.840448', '0.855599', '0.845622', '0.851531', '0.840695', '0.049606', '0.054239', '0.049083', '0.051826', '0.051626', '0.849506', '0.049486', '0.052889', '0.838178']
         : correct/total = [(3481, 4128), (205, 4203), (218, 4081), (3675, 4333), (3502, 4091), (194, 4287), (3524, 4193), (3721, 4349), (3544, 4191), (3642, 4277), (3483, 4143), (208, 4193), (222, 4093), (206, 4197), (210, 4052), (208, 4029), (3528, 4153), (207, 4183), (216, 4084), (3460, 4128)]
         : compromised: 0.0506, honest: 0.8469

=== FINAL RESULTS ===
Dataset: femnist, Nodes: 20, Graph: fully, Aggregation: balance
Attack: backdoor, 50.0% compromised
Final accuracy - Compromised: 0.0506, Honest: 0.8469
Overall test accuracy: mean=0.4488 ± 0.3982

=== BACKDOOR ATTACK SUCCESS RATE (ASR) ===
Target label: 0
Trigger size: 4x4
Overall ASR: 0.5247 ± 0.4753
Honest nodes ASR: 0.0495 ± 0.0045
Compromised nodes ASR: 1.0000 ± 0.0000
Note: Higher ASR indicates more successful backdoor attack

=== BALANCE SUMMARY ===
Node 0: acceptance=0.474
Node 1: acceptance=0.253
Node 2: acceptance=0.253
Node 3: acceptance=0.474
Node 4: acceptance=0.474
Node 5: acceptance=0.253
Node 6: acceptance=0.474
Node 7: acceptance=0.474
Node 8: acceptance=0.474
Node 9: acceptance=0.474
Node 10: acceptance=0.474
Node 11: acceptance=0.253
Node 12: acceptance=0.253
Node 13: acceptance=0.253
Node 14: acceptance=0.253
Node 15: acceptance=0.253
Node 16: acceptance=0.474
Node 17: acceptance=0.253
Node 18: acceptance=0.253
Node 19: acceptance=0.474

=== PARALLEL EXECUTION TIME (realistic for distributed system) ===
  COMMUNICATION (max across nodes):
    - Full model transfer: 0.000s (0.0%)
  COMPUTATION (max across nodes):
    - Filtering: 0.183s (86.5%)
    - Aggregation: 0.029s (13.5%)
  TOTALS:
    - Total computation: 0.212s (100.0%)
    - Total communication: 0.000s (0.0%)
    - Total parallel time: 0.212s

=== PER-NODE AVERAGE TIME ===
  - Filtering: 0.172s
  - Aggregation: 0.008s
  - Model transfer: 0.000s
  - Total per node: 0.180s

=== TOTAL COMPUTATIONAL WORK (sum across all nodes) ===
  - Total filtering: 3.437s
  - Total aggregation: 0.161s
  - Total model transfer: 0.000s
  - Grand total: 3.598s
  - Mean acceptance rate: 0.363

BALANCE Algorithm Properties:
  - Model dimension: 6,603,710
  - No compression: Full parameter comparison
  - Theoretical complexity: O(deg(i)×d)
  - Approach: Full parameter filtering + averaging
