Device: cuda
Seed: 987654321
Loading 36 LEAF FEMNIST train files...
LEAF FEMNIST train: 3597 users, 734463 samples
Loading 36 LEAF FEMNIST test files...
LEAF FEMNIST test: 3597 users, 83388 samples
Found 3597 train users, 3597 test users, 3597 common users
User sample counts range: 525 (max) to 17 (min)
Distributed ALL 3597 users across 20 clients
Users per client: 179 (with 17 clients getting +1 user)
Train partition sizes: [36360, 37070, 35957, 38262, 36024, 37732, 36921, 38328, 36867, 37683, 36507, 36915, 36007, 37001, 35681, 35453, 36585, 36801, 35964, 36345]
Test partition sizes: [4128, 4203, 4081, 4333, 4091, 4287, 4193, 4349, 4191, 4277, 4143, 4193, 4093, 4197, 4052, 4029, 4153, 4183, 4084, 4128]
  Client 0: 36360 train samples, 62 unique classes
  Client 1: 37070 train samples, 62 unique classes
  Client 2: 35957 train samples, 62 unique classes
  Client 3: 38262 train samples, 62 unique classes
  Client 4: 36024 train samples, 62 unique classes
  Client 5: 37732 train samples, 62 unique classes
  Client 6: 36921 train samples, 62 unique classes
  Client 7: 38328 train samples, 62 unique classes
  Client 8: 36867 train samples, 62 unique classes
  Client 9: 37683 train samples, 62 unique classes
  Client 10: 36507 train samples, 62 unique classes
  Client 11: 36915 train samples, 62 unique classes
  Client 12: 36007 train samples, 62 unique classes
  Client 13: 37001 train samples, 62 unique classes
  Client 14: 35681 train samples, 62 unique classes
  Client 15: 35453 train samples, 62 unique classes
  Client 16: 36585 train samples, 62 unique classes
  Client 17: 36801 train samples, 62 unique classes
  Client 18: 35964 train samples, 62 unique classes
  Client 19: 36345 train samples, 62 unique classes
Will sample 10000 samples per client per epoch
Graph: ring, nodes: 20, edges: 20
Degree statistics: avg=2.00, min=2, max=2
Attack: Compromised 16/20 nodes: [1, 2, 3, 5, 6, 8, 9, 10, 11, 12, 13, 14, 15, 17, 18, 19]
Attack type: gaussian, lambda: 1.0
Model variant: baseline
Model parameters: 6,603,710
BALANCE algorithm:
Balance Config: BALANCEConfig(gamma=2, kappa=1, alpha=0.5, min_neighbors=1)
  - Model dimension: 6,603,710 parameters
  - Complexity: O(N×d) = O(20×6,603,710)
Initial test acc across nodes: mean=0.0168 ± 0.0139
Round 001: test acc mean=0.1906 ± 0.2144 | min=0.0022 max=0.5202
         : test loss mean=468059726.6966 ± 421415098.3814
         : individual accs = ['0.012597', '0.436117', '0.008821', '0.439418', '0.006844', '0.456030', '0.520153', '0.041619', '0.452159', '0.026654', '0.032585', '0.012640', '0.012705', '0.004289', '0.015054', '0.458675', '0.002167', '0.432943', '0.019833', '0.421512']
         : correct/total = [(52, 4128), (1833, 4203), (36, 4081), (1904, 4333), (28, 4091), (1955, 4287), (2181, 4193), (181, 4349), (1895, 4191), (114, 4277), (135, 4143), (53, 4193), (52, 4093), (18, 4197), (61, 4052), (1848, 4029), (9, 4153), (1811, 4183), (81, 4084), (1740, 4128)]
         : compromised: 0.2343, honest: 0.0158
Round 002: test acc mean=0.0471 ± 0.0091 | min=0.0179 max=0.0549
         : test loss mean=nan ± nan
         : individual accs = ['0.050145', '0.048775', '0.053418', '0.025387', '0.043021', '0.045253', '0.017887', '0.045068', '0.049630', '0.046528', '0.048033', '0.049606', '0.054239', '0.049083', '0.051826', '0.054852', '0.052011', '0.049486', '0.052889', '0.054506']
         : correct/total = [(207, 4128), (205, 4203), (218, 4081), (110, 4333), (176, 4091), (194, 4287), (75, 4193), (196, 4349), (208, 4191), (199, 4277), (199, 4143), (208, 4193), (222, 4093), (206, 4197), (210, 4052), (221, 4029), (216, 4153), (207, 4183), (216, 4084), (225, 4128)]
         : compromised: 0.0470, honest: 0.0476
Round 003: test acc mean=0.0495 ± 0.0033 | min=0.0430 max=0.0545
         : test loss mean=nan ± nan
         : individual accs = ['0.050145', '0.048775', '0.053418', '0.043157', '0.043021', '0.045253', '0.050799', '0.045068', '0.049630', '0.046528', '0.048033', '0.049606', '0.054239', '0.049083', '0.051826', '0.051626', '0.052011', '0.049486', '0.052889', '0.054506']
         : correct/total = [(207, 4128), (205, 4203), (218, 4081), (187, 4333), (176, 4091), (194, 4287), (213, 4193), (196, 4349), (208, 4191), (199, 4277), (199, 4143), (208, 4193), (222, 4093), (206, 4197), (210, 4052), (208, 4029), (216, 4153), (207, 4183), (216, 4084), (225, 4128)]
         : compromised: 0.0499, honest: 0.0476
Round 004: test acc mean=0.0495 ± 0.0033 | min=0.0430 max=0.0545
         : test loss mean=nan ± nan
         : individual accs = ['0.050145', '0.048775', '0.053418', '0.043157', '0.043021', '0.045253', '0.050799', '0.045068', '0.049630', '0.046528', '0.048033', '0.049606', '0.054239', '0.049083', '0.051826', '0.051626', '0.052011', '0.049486', '0.052889', '0.054506']
         : correct/total = [(207, 4128), (205, 4203), (218, 4081), (187, 4333), (176, 4091), (194, 4287), (213, 4193), (196, 4349), (208, 4191), (199, 4277), (199, 4143), (208, 4193), (222, 4093), (206, 4197), (210, 4052), (208, 4029), (216, 4153), (207, 4183), (216, 4084), (225, 4128)]
         : compromised: 0.0499, honest: 0.0476
Round 005: test acc mean=0.0495 ± 0.0033 | min=0.0430 max=0.0545
         : test loss mean=nan ± nan
         : individual accs = ['0.050145', '0.048775', '0.053418', '0.043157', '0.043021', '0.045253', '0.050799', '0.045068', '0.049630', '0.046528', '0.048033', '0.049606', '0.054239', '0.049083', '0.051826', '0.051626', '0.052011', '0.049486', '0.052889', '0.054506']
         : correct/total = [(207, 4128), (205, 4203), (218, 4081), (187, 4333), (176, 4091), (194, 4287), (213, 4193), (196, 4349), (208, 4191), (199, 4277), (199, 4143), (208, 4193), (222, 4093), (206, 4197), (210, 4052), (208, 4029), (216, 4153), (207, 4183), (216, 4084), (225, 4128)]
         : compromised: 0.0499, honest: 0.0476
Round 006: test acc mean=0.0495 ± 0.0033 | min=0.0430 max=0.0545
         : test loss mean=nan ± nan
         : individual accs = ['0.050145', '0.048775', '0.053418', '0.043157', '0.043021', '0.045253', '0.050799', '0.045068', '0.049630', '0.046528', '0.048033', '0.049606', '0.054239', '0.049083', '0.051826', '0.051626', '0.052011', '0.049486', '0.052889', '0.054506']
         : correct/total = [(207, 4128), (205, 4203), (218, 4081), (187, 4333), (176, 4091), (194, 4287), (213, 4193), (196, 4349), (208, 4191), (199, 4277), (199, 4143), (208, 4193), (222, 4093), (206, 4197), (210, 4052), (208, 4029), (216, 4153), (207, 4183), (216, 4084), (225, 4128)]
         : compromised: 0.0499, honest: 0.0476
Round 007: test acc mean=0.0495 ± 0.0033 | min=0.0430 max=0.0545
         : test loss mean=nan ± nan
         : individual accs = ['0.050145', '0.048775', '0.053418', '0.043157', '0.043021', '0.045253', '0.050799', '0.045068', '0.049630', '0.046528', '0.048033', '0.049606', '0.054239', '0.049083', '0.051826', '0.051626', '0.052011', '0.049486', '0.052889', '0.054506']
         : correct/total = [(207, 4128), (205, 4203), (218, 4081), (187, 4333), (176, 4091), (194, 4287), (213, 4193), (196, 4349), (208, 4191), (199, 4277), (199, 4143), (208, 4193), (222, 4093), (206, 4197), (210, 4052), (208, 4029), (216, 4153), (207, 4183), (216, 4084), (225, 4128)]
         : compromised: 0.0499, honest: 0.0476
Round 008: test acc mean=0.0495 ± 0.0033 | min=0.0430 max=0.0545
         : test loss mean=nan ± nan
         : individual accs = ['0.050145', '0.048775', '0.053418', '0.043157', '0.043021', '0.045253', '0.050799', '0.045068', '0.049630', '0.046528', '0.048033', '0.049606', '0.054239', '0.049083', '0.051826', '0.051626', '0.052011', '0.049486', '0.052889', '0.054506']
         : correct/total = [(207, 4128), (205, 4203), (218, 4081), (187, 4333), (176, 4091), (194, 4287), (213, 4193), (196, 4349), (208, 4191), (199, 4277), (199, 4143), (208, 4193), (222, 4093), (206, 4197), (210, 4052), (208, 4029), (216, 4153), (207, 4183), (216, 4084), (225, 4128)]
         : compromised: 0.0499, honest: 0.0476
Round 009: test acc mean=0.0495 ± 0.0033 | min=0.0430 max=0.0545
         : test loss mean=nan ± nan
         : individual accs = ['0.050145', '0.048775', '0.053418', '0.043157', '0.043021', '0.045253', '0.050799', '0.045068', '0.049630', '0.046528', '0.048033', '0.049606', '0.054239', '0.049083', '0.051826', '0.051626', '0.052011', '0.049486', '0.052889', '0.054506']
         : correct/total = [(207, 4128), (205, 4203), (218, 4081), (187, 4333), (176, 4091), (194, 4287), (213, 4193), (196, 4349), (208, 4191), (199, 4277), (199, 4143), (208, 4193), (222, 4093), (206, 4197), (210, 4052), (208, 4029), (216, 4153), (207, 4183), (216, 4084), (225, 4128)]
         : compromised: 0.0499, honest: 0.0476
Round 010: test acc mean=0.0471 ± 0.0106 | min=0.0033 max=0.0545
         : test loss mean=nan ± nan
         : individual accs = ['0.050145', '0.048775', '0.053418', '0.043157', '0.043021', '0.045253', '0.003339', '0.045068', '0.049630', '0.046528', '0.048033', '0.049606', '0.054239', '0.049083', '0.051826', '0.051626', '0.052011', '0.049486', '0.052889', '0.054506']
         : correct/total = [(207, 4128), (205, 4203), (218, 4081), (187, 4333), (176, 4091), (194, 4287), (14, 4193), (196, 4349), (208, 4191), (199, 4277), (199, 4143), (208, 4193), (222, 4093), (206, 4197), (210, 4052), (208, 4029), (216, 4153), (207, 4183), (216, 4084), (225, 4128)]
         : compromised: 0.0470, honest: 0.0476

=== FINAL RESULTS ===
Dataset: femnist, Nodes: 20, Graph: ring, Aggregation: balance
Attack: gaussian, 80.0% compromised
Final accuracy - Compromised: 0.0470, Honest: 0.0476
Overall test accuracy: mean=0.0471 ± 0.0106

=== BALANCE SUMMARY ===
Node 0: acceptance=0.000
Node 1: acceptance=0.050
Node 2: acceptance=0.000
Node 3: acceptance=0.050
Node 4: acceptance=0.000
Node 5: acceptance=0.050
Node 6: acceptance=0.350
Node 7: acceptance=0.000
Node 8: acceptance=0.050
Node 9: acceptance=0.900
Node 10: acceptance=0.000
Node 11: acceptance=0.000
Node 12: acceptance=0.000
Node 13: acceptance=0.000
Node 14: acceptance=0.000
Node 15: acceptance=0.050
Node 16: acceptance=0.000
Node 17: acceptance=0.050
Node 18: acceptance=0.000
Node 19: acceptance=0.050

=== PARALLEL EXECUTION TIME (realistic for distributed system) ===
  COMMUNICATION (max across nodes):
    - Full model transfer: 0.000s (0.0%)
  COMPUTATION (max across nodes):
    - Filtering: 0.050s (66.4%)
    - Aggregation: 0.025s (33.6%)
  TOTALS:
    - Total computation: 0.076s (100.0%)
    - Total communication: 0.000s (0.0%)
    - Total parallel time: 0.076s

=== PER-NODE AVERAGE TIME ===
  - Filtering: 0.025s
  - Aggregation: 0.011s
  - Model transfer: 0.000s
  - Total per node: 0.036s

=== TOTAL COMPUTATIONAL WORK (sum across all nodes) ===
  - Total filtering: 0.504s
  - Total aggregation: 0.224s
  - Total model transfer: 0.000s
  - Grand total: 0.728s
  - Mean acceptance rate: 0.080

BALANCE Algorithm Properties:
  - Model dimension: 6,603,710
  - No compression: Full parameter comparison
  - Theoretical complexity: O(deg(i)×d)
  - Approach: Full parameter filtering + averaging
