Device: cuda
Seed: 987654321
Loading 36 LEAF FEMNIST train files...
LEAF FEMNIST train: 3597 users, 734463 samples
Loading 36 LEAF FEMNIST test files...
LEAF FEMNIST test: 3597 users, 83388 samples
Found 3597 train users, 3597 test users, 3597 common users
User sample counts range: 525 (max) to 17 (min)
Distributed ALL 3597 users across 20 clients
Users per client: 179 (with 17 clients getting +1 user)
Train partition sizes: [36360, 37070, 35957, 38262, 36024, 37732, 36921, 38328, 36867, 37683, 36507, 36915, 36007, 37001, 35681, 35453, 36585, 36801, 35964, 36345]
Test partition sizes: [4128, 4203, 4081, 4333, 4091, 4287, 4193, 4349, 4191, 4277, 4143, 4193, 4093, 4197, 4052, 4029, 4153, 4183, 4084, 4128]
  Client 0: 36360 train samples, 62 unique classes
  Client 1: 37070 train samples, 62 unique classes
  Client 2: 35957 train samples, 62 unique classes
  Client 3: 38262 train samples, 62 unique classes
  Client 4: 36024 train samples, 62 unique classes
  Client 5: 37732 train samples, 62 unique classes
  Client 6: 36921 train samples, 62 unique classes
  Client 7: 38328 train samples, 62 unique classes
  Client 8: 36867 train samples, 62 unique classes
  Client 9: 37683 train samples, 62 unique classes
  Client 10: 36507 train samples, 62 unique classes
  Client 11: 36915 train samples, 62 unique classes
  Client 12: 36007 train samples, 62 unique classes
  Client 13: 37001 train samples, 62 unique classes
  Client 14: 35681 train samples, 62 unique classes
  Client 15: 35453 train samples, 62 unique classes
  Client 16: 36585 train samples, 62 unique classes
  Client 17: 36801 train samples, 62 unique classes
  Client 18: 35964 train samples, 62 unique classes
  Client 19: 36345 train samples, 62 unique classes
Will sample 10000 samples per client per epoch
Graph: erdos, nodes: 20, edges: 126
Degree statistics: avg=12.60, min=8, max=16
Attack: Compromised 4/20 nodes: [5, 12, 13, 17]
Attack type: directed_deviation, lambda: 1.0
Model variant: baseline
Model parameters: 6,603,710
Sketchguard Node 0:
  Model dim: 6,603,710 → Sketch size: 1000
  Compression ratio: 6603.7x
  Using model parameters for aggregation, sketches for filtering
Sketchguard Node 1:
  Model dim: 6,603,710 → Sketch size: 1000
  Compression ratio: 6603.7x
  Using model parameters for aggregation, sketches for filtering
Sketchguard Node 2:
  Model dim: 6,603,710 → Sketch size: 1000
  Compression ratio: 6603.7x
  Using model parameters for aggregation, sketches for filtering
Sketchguard Node 3:
  Model dim: 6,603,710 → Sketch size: 1000
  Compression ratio: 6603.7x
  Using model parameters for aggregation, sketches for filtering
Sketchguard Node 4:
  Model dim: 6,603,710 → Sketch size: 1000
  Compression ratio: 6603.7x
  Using model parameters for aggregation, sketches for filtering
Sketchguard Node 5:
  Model dim: 6,603,710 → Sketch size: 1000
  Compression ratio: 6603.7x
  Using model parameters for aggregation, sketches for filtering
Sketchguard Node 6:
  Model dim: 6,603,710 → Sketch size: 1000
  Compression ratio: 6603.7x
  Using model parameters for aggregation, sketches for filtering
Sketchguard Node 7:
  Model dim: 6,603,710 → Sketch size: 1000
  Compression ratio: 6603.7x
  Using model parameters for aggregation, sketches for filtering
Sketchguard Node 8:
  Model dim: 6,603,710 → Sketch size: 1000
  Compression ratio: 6603.7x
  Using model parameters for aggregation, sketches for filtering
Sketchguard Node 9:
  Model dim: 6,603,710 → Sketch size: 1000
  Compression ratio: 6603.7x
  Using model parameters for aggregation, sketches for filtering
Sketchguard Node 10:
  Model dim: 6,603,710 → Sketch size: 1000
  Compression ratio: 6603.7x
  Using model parameters for aggregation, sketches for filtering
Sketchguard Node 11:
  Model dim: 6,603,710 → Sketch size: 1000
  Compression ratio: 6603.7x
  Using model parameters for aggregation, sketches for filtering
Sketchguard Node 12:
  Model dim: 6,603,710 → Sketch size: 1000
  Compression ratio: 6603.7x
  Using model parameters for aggregation, sketches for filtering
Sketchguard Node 13:
  Model dim: 6,603,710 → Sketch size: 1000
  Compression ratio: 6603.7x
  Using model parameters for aggregation, sketches for filtering
Sketchguard Node 14:
  Model dim: 6,603,710 → Sketch size: 1000
  Compression ratio: 6603.7x
  Using model parameters for aggregation, sketches for filtering
Sketchguard Node 15:
  Model dim: 6,603,710 → Sketch size: 1000
  Compression ratio: 6603.7x
  Using model parameters for aggregation, sketches for filtering
Sketchguard Node 16:
  Model dim: 6,603,710 → Sketch size: 1000
  Compression ratio: 6603.7x
  Using model parameters for aggregation, sketches for filtering
Sketchguard Node 17:
  Model dim: 6,603,710 → Sketch size: 1000
  Compression ratio: 6603.7x
  Using model parameters for aggregation, sketches for filtering
Sketchguard Node 18:
  Model dim: 6,603,710 → Sketch size: 1000
  Compression ratio: 6603.7x
  Using model parameters for aggregation, sketches for filtering
Sketchguard Node 19:
  Model dim: 6,603,710 → Sketch size: 1000
  Compression ratio: 6603.7x
  Using model parameters for aggregation, sketches for filtering
Sketchguard ALGORITHM (Sketch-based Filtering + State Aggregation)
  - Model dimension: 6,603,710 parameters
  - Config: SketchguardConfig(gamma=2, kappa=1, alpha=0.5, min_neighbors=1, sketch_size=1000, network_seed=987654321, attack_detection_window=5)
  - Sketch size: 1000
  - Compression ratio: 6603.7x
  - Complexity: O(d + N×k) = O(6,603,710 + 20×1000)
  - Theoretical speedup vs BALANCE: 19.9x
Initial test acc across nodes: mean=0.0168 ± 0.0139
Round 001: test acc mean=0.5122 ± 0.0325 | min=0.4588 max=0.5948
         : test loss mean=3.7262 ± 0.0278
         : individual accs = ['0.562742', '0.505591', '0.555501', '0.495500', '0.515766', '0.594822', '0.521107', '0.510232', '0.514197', '0.462240', '0.512913', '0.521107', '0.458832', '0.472242', '0.529121', '0.525192', '0.472430', '0.514702', '0.504897', '0.493944']
         : correct/total = [(2323, 4128), (2125, 4203), (2267, 4081), (2147, 4333), (2110, 4091), (2550, 4287), (2185, 4193), (2219, 4349), (2155, 4191), (1977, 4277), (2125, 4143), (2185, 4193), (1878, 4093), (1982, 4197), (2144, 4052), (2116, 4029), (1962, 4153), (2153, 4183), (2062, 4084), (2039, 4128)]
         : compromised: 0.5101, honest: 0.5127
         : sketchguard stats = ['Node 0: acc_rate=0.812', 'Node 1: acc_rate=0.818', 'Node 2: acc_rate=0.833']...
Round 002: test acc mean=0.6843 ± 0.0154 | min=0.6615 max=0.7146
         : test loss mean=3.3910 ± 0.0581
         : individual accs = ['0.695979', '0.680466', '0.688557', '0.697438', '0.702273', '0.713319', '0.663725', '0.686135', '0.666905', '0.669628', '0.690321', '0.672311', '0.665527', '0.684298', '0.694965', '0.661454', '0.674211', '0.714559', '0.688541', '0.675872']
         : correct/total = [(2873, 4128), (2860, 4203), (2810, 4081), (3022, 4333), (2873, 4091), (3058, 4287), (2783, 4193), (2984, 4349), (2795, 4191), (2864, 4277), (2860, 4143), (2819, 4193), (2724, 4093), (2872, 4197), (2816, 4052), (2665, 4029), (2800, 4153), (2989, 4183), (2812, 4084), (2790, 4128)]
         : compromised: 0.6944, honest: 0.6818
         : sketchguard stats = ['Node 0: acc_rate=0.812', 'Node 1: acc_rate=0.818', 'Node 2: acc_rate=0.833']...
Round 003: test acc mean=0.7053 ± 0.0293 | min=0.6063 max=0.7386
         : test loss mean=3.0537 ± 0.1230
         : individual accs = ['0.723353', '0.707828', '0.695173', '0.718901', '0.736739', '0.688360', '0.711185', '0.738561', '0.705798', '0.732289', '0.719768', '0.679227', '0.711947', '0.664522', '0.715449', '0.710350', '0.692752', '0.606263', '0.728208', '0.719961']
         : correct/total = [(2986, 4128), (2975, 4203), (2837, 4081), (3115, 4333), (3014, 4091), (2951, 4287), (2982, 4193), (3212, 4349), (2958, 4191), (3132, 4277), (2982, 4143), (2848, 4193), (2914, 4093), (2789, 4197), (2899, 4052), (2862, 4029), (2877, 4153), (2536, 4183), (2974, 4084), (2972, 4128)]
         : compromised: 0.6678, honest: 0.7147
         : sketchguard stats = ['Node 0: acc_rate=0.812', 'Node 1: acc_rate=0.818', 'Node 2: acc_rate=0.833']...
Round 004: test acc mean=0.6970 ± 0.0309 | min=0.6184 max=0.7414
         : test loss mean=2.5446 ± 0.1594
         : individual accs = ['0.707849', '0.732572', '0.685126', '0.709901', '0.741384', '0.645206', '0.705938', '0.713727', '0.714865', '0.672434', '0.681632', '0.718817', '0.618373', '0.651179', '0.700395', '0.707868', '0.736576', '0.698064', '0.719393', '0.678779']
         : correct/total = [(2922, 4128), (3079, 4203), (2796, 4081), (3076, 4333), (3033, 4091), (2766, 4287), (2960, 4193), (3104, 4349), (2996, 4191), (2876, 4277), (2824, 4143), (3014, 4193), (2531, 4093), (2733, 4197), (2838, 4052), (2852, 4029), (3059, 4153), (2920, 4183), (2938, 4084), (2802, 4128)]
         : compromised: 0.6532, honest: 0.7080
         : sketchguard stats = ['Node 0: acc_rate=0.812', 'Node 1: acc_rate=0.818', 'Node 2: acc_rate=0.833']...
Round 005: test acc mean=0.6717 ± 0.0328 | min=0.5937 max=0.7282
         : test loss mean=1.9092 ± 0.1537
         : individual accs = ['0.686773', '0.692601', '0.651066', '0.677591', '0.714006', '0.639142', '0.660625', '0.728213', '0.647578', '0.687632', '0.680666', '0.682089', '0.593697', '0.607577', '0.674235', '0.646066', '0.695642', '0.691609', '0.708864', '0.668605']
         : correct/total = [(2835, 4128), (2911, 4203), (2657, 4081), (2936, 4333), (2921, 4091), (2740, 4287), (2770, 4193), (3167, 4349), (2714, 4191), (2941, 4277), (2820, 4143), (2860, 4193), (2430, 4093), (2550, 4197), (2732, 4052), (2603, 4029), (2889, 4153), (2893, 4183), (2895, 4084), (2760, 4128)]
         : compromised: 0.6330, honest: 0.6814
         : sketchguard stats = ['Node 0: acc_rate=0.812', 'Node 1: acc_rate=0.818', 'Node 2: acc_rate=0.833']...
Round 006: test acc mean=0.7296 ± 0.0246 | min=0.6698 max=0.7607
         : test loss mean=1.2418 ± 0.0908
         : individual accs = ['0.729651', '0.758030', '0.721637', '0.722363', '0.760694', '0.714486', '0.739566', '0.734192', '0.714388', '0.698854', '0.753802', '0.759361', '0.681407', '0.669764', '0.750247', '0.723256', '0.747412', '0.748267', '0.741185', '0.724322']
         : correct/total = [(3012, 4128), (3186, 4203), (2945, 4081), (3130, 4333), (3112, 4091), (3063, 4287), (3101, 4193), (3193, 4349), (2994, 4191), (2989, 4277), (3123, 4143), (3184, 4193), (2789, 4093), (2811, 4197), (3040, 4052), (2914, 4029), (3104, 4153), (3130, 4183), (3027, 4084), (2990, 4128)]
         : compromised: 0.7035, honest: 0.7362
         : sketchguard stats = ['Node 0: acc_rate=0.812', 'Node 1: acc_rate=0.818', 'Node 2: acc_rate=0.833']...
Round 007: test acc mean=0.7928 ± 0.0099 | min=0.7714 max=0.8150
         : test loss mean=0.7771 ± 0.0382
         : individual accs = ['0.801841', '0.794670', '0.790493', '0.784907', '0.814960', '0.795428', '0.789888', '0.807082', '0.786924', '0.790040', '0.782042', '0.785595', '0.788419', '0.804146', '0.792201', '0.771407', '0.802312', '0.782453', '0.801420', '0.790455']
         : correct/total = [(3310, 4128), (3340, 4203), (3226, 4081), (3401, 4333), (3334, 4091), (3410, 4287), (3312, 4193), (3510, 4349), (3298, 4191), (3379, 4277), (3240, 4143), (3294, 4193), (3227, 4093), (3375, 4197), (3210, 4052), (3108, 4029), (3332, 4153), (3273, 4183), (3273, 4084), (3263, 4128)]
         : compromised: 0.7926, honest: 0.7929
         : sketchguard stats = ['Node 0: acc_rate=0.812', 'Node 1: acc_rate=0.818', 'Node 2: acc_rate=0.833']...
Round 008: test acc mean=0.8218 ± 0.0074 | min=0.8047 max=0.8335
         : test loss mean=0.5799 ± 0.0236
         : individual accs = ['0.823886', '0.828456', '0.827738', '0.824371', '0.828159', '0.823886', '0.818269', '0.833065', '0.819613', '0.833528', '0.812937', '0.821369', '0.821891', '0.821063', '0.809477', '0.804666', '0.822538', '0.813770', '0.829824', '0.818314']
         : correct/total = [(3401, 4128), (3482, 4203), (3378, 4081), (3572, 4333), (3388, 4091), (3532, 4287), (3431, 4193), (3623, 4349), (3435, 4191), (3565, 4277), (3368, 4143), (3444, 4193), (3364, 4093), (3446, 4197), (3280, 4052), (3242, 4029), (3416, 4153), (3404, 4183), (3389, 4084), (3378, 4128)]
         : compromised: 0.8202, honest: 0.8223
         : sketchguard stats = ['Node 0: acc_rate=0.812', 'Node 1: acc_rate=0.818', 'Node 2: acc_rate=0.833']...
Round 009: test acc mean=0.8323 ± 0.0078 | min=0.8221 max=0.8492
         : test loss mean=0.5212 ± 0.0203
         : individual accs = ['0.825339', '0.839638', '0.848321', '0.830833', '0.838426', '0.833450', '0.824469', '0.849161', '0.829635', '0.840309', '0.822110', '0.826854', '0.836306', '0.825351', '0.824284', '0.824770', '0.837226', '0.828114', '0.834721', '0.826793']
         : correct/total = [(3407, 4128), (3529, 4203), (3462, 4081), (3600, 4333), (3430, 4091), (3573, 4287), (3457, 4193), (3693, 4349), (3477, 4191), (3594, 4277), (3406, 4143), (3467, 4193), (3423, 4093), (3464, 4197), (3340, 4052), (3323, 4029), (3477, 4153), (3464, 4183), (3409, 4084), (3413, 4128)]
         : compromised: 0.8308, honest: 0.8327
         : sketchguard stats = ['Node 0: acc_rate=0.812', 'Node 1: acc_rate=0.818', 'Node 2: acc_rate=0.833']...
Round 010: test acc mean=0.8394 ± 0.0066 | min=0.8261 max=0.8494
         : test loss mean=0.4922 ± 0.0212
         : individual accs = ['0.835514', '0.845349', '0.843911', '0.841680', '0.849426', '0.838815', '0.834486', '0.847321', '0.838702', '0.847557', '0.835626', '0.826139', '0.843147', '0.842983', '0.832922', '0.831472', '0.843487', '0.835286', '0.846964', '0.827762']
         : correct/total = [(3449, 4128), (3553, 4203), (3444, 4081), (3647, 4333), (3475, 4091), (3596, 4287), (3499, 4193), (3685, 4349), (3515, 4191), (3625, 4277), (3462, 4143), (3464, 4193), (3451, 4093), (3538, 4197), (3375, 4052), (3350, 4029), (3503, 4153), (3494, 4183), (3459, 4084), (3417, 4128)]
         : compromised: 0.8401, honest: 0.8393
         : sketchguard stats = ['Node 0: acc_rate=0.812', 'Node 1: acc_rate=0.818', 'Node 2: acc_rate=0.833']...

=== FINAL RESULTS ===
Dataset: femnist, Nodes: 20, Graph: erdos, Aggregation: sketchguard
Attack: directed_deviation, 20.0% compromised
Final accuracy - Compromised: 0.8401, Honest: 0.8393
Overall test accuracy: mean=0.8394 ± 0.0066

=== Sketchguard SUMMARY ===
Node 0: acceptance=0.812
Node 1: acceptance=0.818
Node 2: acceptance=0.833
Node 3: acceptance=0.875
Node 4: acceptance=0.818
Node 5: acceptance=0.800
Node 6: acceptance=0.714
Node 7: acceptance=0.786
Node 8: acceptance=0.700
Node 9: acceptance=0.923
Node 10: acceptance=0.667
Node 11: acceptance=0.786
Node 12: acceptance=0.917
Node 13: acceptance=0.923
Node 14: acceptance=0.733
Node 15: acceptance=0.818
Node 16: acceptance=0.769
Node 17: acceptance=0.889
Node 18: acceptance=0.812
Node 19: acceptance=0.750

=== PARALLEL EXECUTION TIME (realistic for distributed system) ===
  COMMUNICATION (max across nodes):
    - Sketch transfer: 0.000s (0.0%)
    - Model fetch (accepted): 0.000s (0.0%)
  COMPUTATION (max across nodes):
    - Sketching: 5.055s (99.5%)
    - Filtering: 0.002s (0.0%)
    - Aggregation: 0.024s (0.5%)
  TOTALS:
    - Total computation: 5.081s (100.0%)
    - Total communication: 0.000s (0.0%)
    - Total parallel time: 5.081s

=== PER-NODE AVERAGE TIME ===
  - Sketching: 3.998s
  - Filtering: 0.001s
  - Aggregation: 0.018s
  - Sketch transfer: 0.000s
  - Model fetch: 0.000s
  - Total per node: 4.017s

=== TOTAL COMPUTATIONAL WORK (sum across all nodes) ===
  - Total sketching: 79.955s
  - Total filtering: 0.022s
  - Total aggregation: 0.357s
  - Total sketch transfer: 0.000s
  - Total model fetch: 0.000s
  - Grand total: 80.334s
  - Mean acceptance rate: 0.807

Sketchguard Algorithm Properties:
  - Original dimension: 6,603,710
  - Sketch size: 1000
  - Compression ratio: 19.9x
  - Single repetition: No repetitions needed
  - Theoretical complexity: O(d + N×k)
  - Approach: Sketch filtering + state aggregation
