Device: cuda
Seed: 987654321
Loading 36 LEAF FEMNIST train files...
LEAF FEMNIST train: 3597 users, 734463 samples
Loading 36 LEAF FEMNIST test files...
LEAF FEMNIST test: 3597 users, 83388 samples
Found 3597 train users, 3597 test users, 3597 common users
User sample counts range: 525 (max) to 17 (min)
Distributed ALL 3597 users across 20 clients
Users per client: 179 (with 17 clients getting +1 user)
Train partition sizes: [36360, 37070, 35957, 38262, 36024, 37732, 36921, 38328, 36867, 37683, 36507, 36915, 36007, 37001, 35681, 35453, 36585, 36801, 35964, 36345]
Test partition sizes: [4128, 4203, 4081, 4333, 4091, 4287, 4193, 4349, 4191, 4277, 4143, 4193, 4093, 4197, 4052, 4029, 4153, 4183, 4084, 4128]
  Client 0: 36360 train samples, 62 unique classes
  Client 1: 37070 train samples, 62 unique classes
  Client 2: 35957 train samples, 62 unique classes
  Client 3: 38262 train samples, 62 unique classes
  Client 4: 36024 train samples, 62 unique classes
  Client 5: 37732 train samples, 62 unique classes
  Client 6: 36921 train samples, 62 unique classes
  Client 7: 38328 train samples, 62 unique classes
  Client 8: 36867 train samples, 62 unique classes
  Client 9: 37683 train samples, 62 unique classes
  Client 10: 36507 train samples, 62 unique classes
  Client 11: 36915 train samples, 62 unique classes
  Client 12: 36007 train samples, 62 unique classes
  Client 13: 37001 train samples, 62 unique classes
  Client 14: 35681 train samples, 62 unique classes
  Client 15: 35453 train samples, 62 unique classes
  Client 16: 36585 train samples, 62 unique classes
  Client 17: 36801 train samples, 62 unique classes
  Client 18: 35964 train samples, 62 unique classes
  Client 19: 36345 train samples, 62 unique classes
Will sample 10000 samples per client per epoch
Graph: erdos, nodes: 20, edges: 126
Degree statistics: avg=12.60, min=8, max=16
Attack: Compromised 4/20 nodes: [5, 12, 13, 17]
Attack type: backdoor, lambda: 1.0
Backdoor target label: 0, trigger size: 4
Model variant: baseline
Model parameters: 6,603,710
Initial test acc across nodes: mean=0.0168 ± 0.0139
Backdoor attack: Created poisoned datasets for 4 compromised nodes
Round 001: test acc mean=0.5377 ± 0.0158 | min=0.5121 max=0.5712
         : test loss mean=1.7417 ± 0.0576
         : individual accs = ['0.533672', '0.533191', '0.571184', '0.514193', '0.531899', '0.553067', '0.555688', '0.544033', '0.540682', '0.526070', '0.522085', '0.540663', '0.534816', '0.553252', '0.532083', '0.524696', '0.569468', '0.525221', '0.535994', '0.512112']
         : correct/total = [(2203, 4128), (2241, 4203), (2331, 4081), (2228, 4333), (2176, 4091), (2371, 4287), (2330, 4193), (2366, 4349), (2266, 4191), (2250, 4277), (2163, 4143), (2267, 4193), (2189, 4093), (2322, 4197), (2156, 4052), (2114, 4029), (2365, 4153), (2197, 4183), (2189, 4084), (2114, 4128)]
         : compromised: 0.5416, honest: 0.5367
Round 002: test acc mean=0.7318 ± 0.0096 | min=0.7100 max=0.7443
         : test loss mean=0.8895 ± 0.0318
         : individual accs = ['0.739583', '0.730906', '0.737074', '0.736210', '0.721095', '0.742711', '0.715001', '0.744309', '0.724887', '0.732055', '0.735457', '0.735989', '0.740777', '0.719323', '0.742103', '0.725490', '0.730556', '0.729620', '0.742899', '0.710029']
         : correct/total = [(3053, 4128), (3072, 4203), (3008, 4081), (3190, 4333), (2950, 4091), (3184, 4287), (2998, 4193), (3237, 4349), (3038, 4191), (3131, 4277), (3047, 4143), (3086, 4193), (3032, 4093), (3019, 4197), (3007, 4052), (2923, 4029), (3034, 4153), (3052, 4183), (3034, 4084), (2931, 4128)]
         : compromised: 0.7331, honest: 0.7315
Round 003: test acc mean=0.7728 ± 0.0100 | min=0.7532 max=0.7931
         : test loss mean=0.7359 ± 0.0323
         : individual accs = ['0.774225', '0.772068', '0.767949', '0.771521', '0.770716', '0.793095', '0.757691', '0.769832', '0.782391', '0.766659', '0.771904', '0.753160', '0.790618', '0.777460', '0.777147', '0.772648', '0.778714', '0.763806', '0.784770', '0.759690']
         : correct/total = [(3196, 4128), (3245, 4203), (3134, 4081), (3343, 4333), (3153, 4091), (3400, 4287), (3177, 4193), (3348, 4349), (3279, 4191), (3279, 4277), (3198, 4143), (3158, 4193), (3236, 4093), (3263, 4197), (3149, 4052), (3113, 4029), (3234, 4153), (3195, 4183), (3205, 4084), (3136, 4128)]
         : compromised: 0.7812, honest: 0.7707
Round 004: test acc mean=0.7951 ± 0.0088 | min=0.7796 max=0.8073
         : test loss mean=0.6401 ± 0.0312
         : individual accs = ['0.793605', '0.800143', '0.806910', '0.783753', '0.802249', '0.801260', '0.788218', '0.807312', '0.804581', '0.802665', '0.780111', '0.779633', '0.802101', '0.793186', '0.787512', '0.791263', '0.800144', '0.786756', '0.803134', '0.787548']
         : correct/total = [(3276, 4128), (3363, 4203), (3293, 4081), (3396, 4333), (3282, 4091), (3435, 4287), (3305, 4193), (3511, 4349), (3372, 4191), (3433, 4277), (3232, 4143), (3269, 4193), (3283, 4093), (3329, 4197), (3191, 4052), (3188, 4029), (3323, 4153), (3291, 4183), (3280, 4084), (3251, 4128)]
         : compromised: 0.7958, honest: 0.7949
Round 005: test acc mean=0.8003 ± 0.0103 | min=0.7851 max=0.8222
         : test loss mean=0.5998 ± 0.0280
         : individual accs = ['0.796027', '0.802284', '0.799804', '0.796215', '0.805671', '0.804992', '0.805628', '0.802483', '0.795276', '0.796119', '0.786869', '0.790842', '0.818226', '0.788420', '0.810711', '0.799454', '0.814592', '0.785082', '0.822233', '0.785853']
         : correct/total = [(3286, 4128), (3372, 4203), (3264, 4081), (3450, 4333), (3296, 4091), (3451, 4287), (3378, 4193), (3490, 4349), (3333, 4191), (3405, 4277), (3260, 4143), (3316, 4193), (3349, 4093), (3309, 4197), (3285, 4052), (3221, 4029), (3383, 4153), (3284, 4183), (3358, 4084), (3244, 4128)]
         : compromised: 0.7992, honest: 0.8006
Round 006: test acc mean=0.8220 ± 0.0067 | min=0.8091 max=0.8324
         : test loss mean=0.5490 ± 0.0288
         : individual accs = ['0.832364', '0.830597', '0.828963', '0.818140', '0.826204', '0.821554', '0.819223', '0.831915', '0.818420', '0.824643', '0.809558', '0.822084', '0.823357', '0.817012', '0.819348', '0.819310', '0.822297', '0.814965', '0.831293', '0.809109']
         : correct/total = [(3436, 4128), (3491, 4203), (3383, 4081), (3545, 4333), (3380, 4091), (3522, 4287), (3435, 4193), (3618, 4349), (3430, 4191), (3527, 4277), (3354, 4143), (3447, 4193), (3370, 4093), (3429, 4197), (3320, 4052), (3301, 4029), (3415, 4153), (3409, 4183), (3395, 4084), (3340, 4128)]
         : compromised: 0.8192, honest: 0.8227
Round 007: test acc mean=0.8274 ± 0.0064 | min=0.8175 max=0.8435
         : test loss mean=0.5312 ± 0.0244
         : individual accs = ['0.827035', '0.829170', '0.830189', '0.829218', '0.828159', '0.831351', '0.826377', '0.832835', '0.825579', '0.835165', '0.817524', '0.819461', '0.834107', '0.831070', '0.820336', '0.819558', '0.825668', '0.821420', '0.843536', '0.819767']
         : correct/total = [(3414, 4128), (3485, 4203), (3388, 4081), (3593, 4333), (3388, 4091), (3564, 4287), (3465, 4193), (3622, 4349), (3460, 4191), (3572, 4277), (3387, 4143), (3436, 4193), (3414, 4093), (3488, 4197), (3324, 4052), (3302, 4029), (3429, 4153), (3436, 4183), (3445, 4084), (3384, 4128)]
         : compromised: 0.8295, honest: 0.8268
Round 008: test acc mean=0.8249 ± 0.0064 | min=0.8151 max=0.8399
         : test loss mean=0.5273 ± 0.0252
         : individual accs = ['0.829700', '0.827504', '0.827003', '0.824833', '0.839892', '0.829951', '0.818507', '0.821798', '0.824147', '0.832125', '0.815110', '0.818507', '0.836550', '0.820110', '0.820829', '0.821544', '0.828076', '0.818551', '0.824927', '0.817345']
         : correct/total = [(3425, 4128), (3478, 4203), (3375, 4081), (3574, 4333), (3436, 4091), (3558, 4287), (3432, 4193), (3574, 4349), (3454, 4191), (3559, 4277), (3377, 4143), (3432, 4193), (3424, 4093), (3442, 4197), (3326, 4052), (3310, 4029), (3439, 4153), (3424, 4183), (3369, 4084), (3374, 4128)]
         : compromised: 0.8263, honest: 0.8245
Round 009: test acc mean=0.8307 ± 0.0069 | min=0.8195 max=0.8426
         : test loss mean=0.5117 ± 0.0267
         : individual accs = ['0.829700', '0.836783', '0.839255', '0.829910', '0.841359', '0.832750', '0.822084', '0.836284', '0.825101', '0.836334', '0.821868', '0.819461', '0.834840', '0.829402', '0.824778', '0.821792', '0.829521', '0.836003', '0.842556', '0.824855']
         : correct/total = [(3425, 4128), (3517, 4203), (3425, 4081), (3596, 4333), (3442, 4091), (3570, 4287), (3447, 4193), (3637, 4349), (3458, 4191), (3577, 4277), (3405, 4143), (3436, 4193), (3417, 4093), (3481, 4197), (3342, 4052), (3311, 4029), (3445, 4153), (3497, 4183), (3441, 4084), (3405, 4128)]
         : compromised: 0.8332, honest: 0.8301
Round 010: test acc mean=0.8305 ± 0.0073 | min=0.8195 max=0.8477
         : test loss mean=0.5064 ± 0.0258
         : individual accs = ['0.835271', '0.831549', '0.838275', '0.831526', '0.839892', '0.829018', '0.822561', '0.835594', '0.829874', '0.837503', '0.825972', '0.819699', '0.830198', '0.834167', '0.824778', '0.821544', '0.832892', '0.822376', '0.847698', '0.819525']
         : correct/total = [(3448, 4128), (3495, 4203), (3421, 4081), (3603, 4333), (3436, 4091), (3554, 4287), (3449, 4193), (3634, 4349), (3478, 4191), (3582, 4277), (3422, 4143), (3437, 4193), (3398, 4093), (3501, 4197), (3342, 4052), (3310, 4029), (3459, 4153), (3440, 4183), (3462, 4084), (3383, 4128)]
         : compromised: 0.8289, honest: 0.8309

=== FINAL RESULTS ===
Dataset: femnist, Nodes: 20, Graph: erdos, Aggregation: krum
Attack: backdoor, 20.0% compromised
Final accuracy - Compromised: 0.8289, Honest: 0.8309
Overall test accuracy: mean=0.8305 ± 0.0073

=== BACKDOOR ATTACK SUCCESS RATE (ASR) ===
Target label: 0
Trigger size: 4x4
Overall ASR: 0.0546 ± 0.0069
Honest nodes ASR: 0.0542 ± 0.0066
Compromised nodes ASR: 0.0561 ± 0.0078
Note: Higher ASR indicates more successful backdoor attack
