Device: cuda
Seed: 987654321
Loading 36 LEAF FEMNIST train files...
LEAF FEMNIST train: 3597 users, 734463 samples
Loading 36 LEAF FEMNIST test files...
LEAF FEMNIST test: 3597 users, 83388 samples
Found 3597 train users, 3597 test users, 3597 common users
User sample counts range: 525 (max) to 17 (min)
Distributed ALL 3597 users across 20 clients
Users per client: 179 (with 17 clients getting +1 user)
Train partition sizes: [36360, 37070, 35957, 38262, 36024, 37732, 36921, 38328, 36867, 37683, 36507, 36915, 36007, 37001, 35681, 35453, 36585, 36801, 35964, 36345]
Test partition sizes: [4128, 4203, 4081, 4333, 4091, 4287, 4193, 4349, 4191, 4277, 4143, 4193, 4093, 4197, 4052, 4029, 4153, 4183, 4084, 4128]
  Client 0: 36360 train samples, 62 unique classes
  Client 1: 37070 train samples, 62 unique classes
  Client 2: 35957 train samples, 62 unique classes
  Client 3: 38262 train samples, 62 unique classes
  Client 4: 36024 train samples, 62 unique classes
  Client 5: 37732 train samples, 62 unique classes
  Client 6: 36921 train samples, 62 unique classes
  Client 7: 38328 train samples, 62 unique classes
  Client 8: 36867 train samples, 62 unique classes
  Client 9: 37683 train samples, 62 unique classes
  Client 10: 36507 train samples, 62 unique classes
  Client 11: 36915 train samples, 62 unique classes
  Client 12: 36007 train samples, 62 unique classes
  Client 13: 37001 train samples, 62 unique classes
  Client 14: 35681 train samples, 62 unique classes
  Client 15: 35453 train samples, 62 unique classes
  Client 16: 36585 train samples, 62 unique classes
  Client 17: 36801 train samples, 62 unique classes
  Client 18: 35964 train samples, 62 unique classes
  Client 19: 36345 train samples, 62 unique classes
Will sample 10000 samples per client per epoch
Graph: fully, nodes: 20, edges: 190
Degree statistics: avg=19.00, min=19, max=19
Attack: Compromised 14/20 nodes: [1, 2, 3, 5, 6, 8, 11, 12, 13, 14, 15, 17, 18, 19]
Attack type: gaussian, lambda: 1.0
Model variant: baseline
Model parameters: 6,603,710
UBAR ALGORITHM (Two-Stage Byzantine-resilient)
  - Model dimension: 6,603,710 parameters
  - Rho parameter: 0.30000000000000004
  - Stage 1: Distance-based filtering (select 30% closest neighbors)
  - Stage 2: Performance-based selection (loss comparison)
  - Complexity: O(deg(i)×d + deg(i)×inference)
Initial test acc across nodes: mean=0.0168 ± 0.0139
Round 001: test acc mean=0.4145 ± 0.0676 | min=0.2811 max=0.5305
         : test loss mean=3.6689 ± 0.1297
         : individual accs = ['0.324855', '0.376636', '0.439598', '0.489730', '0.434124', '0.512246', '0.361316', '0.485169', '0.390838', '0.382745', '0.338161', '0.463868', '0.427071', '0.365499', '0.459033', '0.440804', '0.320010', '0.530481', '0.281097', '0.467054']
         : correct/total = [(1341, 4128), (1583, 4203), (1794, 4081), (2122, 4333), (1776, 4091), (2196, 4287), (1515, 4193), (2110, 4349), (1638, 4191), (1637, 4277), (1401, 4143), (1945, 4193), (1748, 4093), (1534, 4197), (1860, 4052), (1776, 4029), (1329, 4153), (2219, 4183), (1148, 4084), (1928, 4128)]
         : compromised: 0.4289, honest: 0.3808
         : ubar stats = ['Node 0: s1=0.263, s2=0.200', 'Node 1: s1=0.263, s2=0.200', 'Node 2: s1=0.263, s2=0.200']...
Round 002: test acc mean=0.6584 ± 0.0530 | min=0.5599 max=0.7438
         : test loss mean=2.3865 ± 0.8224
         : individual accs = ['0.701308', '0.673329', '0.655232', '0.559889', '0.741872', '0.617215', '0.689005', '0.606346', '0.612503', '0.735329', '0.674632', '0.682089', '0.574151', '0.674053', '0.663870', '0.596674', '0.743800', '0.708821', '0.612390', '0.645107']
         : correct/total = [(2895, 4128), (2830, 4203), (2674, 4081), (2426, 4333), (3035, 4091), (2646, 4287), (2889, 4193), (2637, 4349), (2567, 4191), (3145, 4277), (2795, 4143), (2860, 4193), (2350, 4093), (2829, 4197), (2690, 4052), (2404, 4029), (3089, 4153), (2965, 4183), (2501, 4084), (2663, 4128)]
         : compromised: 0.6403, honest: 0.7005
         : ubar stats = ['Node 0: s1=0.263, s2=0.400', 'Node 1: s1=0.263, s2=0.200', 'Node 2: s1=0.263, s2=0.600']...
Round 003: test acc mean=0.7635 ± 0.0208 | min=0.7185 max=0.7987
         : test loss mean=1.0604 ± 0.3704
         : individual accs = ['0.786337', '0.798715', '0.749326', '0.735518', '0.789294', '0.718451', '0.771285', '0.769372', '0.751849', '0.776946', '0.775284', '0.745767', '0.768141', '0.771503', '0.775666', '0.760238', '0.790754', '0.754721', '0.729432', '0.751938']
         : correct/total = [(3246, 4128), (3357, 4203), (3058, 4081), (3187, 4333), (3229, 4091), (3080, 4287), (3234, 4193), (3346, 4349), (3151, 4191), (3323, 4277), (3212, 4143), (3127, 4193), (3144, 4093), (3238, 4197), (3143, 4052), (3063, 4029), (3284, 4153), (3157, 4183), (2979, 4084), (3104, 4128)]
         : compromised: 0.7559, honest: 0.7813
         : ubar stats = ['Node 0: s1=0.263, s2=0.467', 'Node 1: s1=0.263, s2=0.200', 'Node 2: s1=0.263, s2=0.467']...
Round 004: test acc mean=0.8037 ± 0.0093 | min=0.7886 max=0.8282
         : test loss mean=0.6422 ± 0.0453
         : individual accs = ['0.809109', '0.807518', '0.809605', '0.788599', '0.828159', '0.798227', '0.793942', '0.807542', '0.805297', '0.817395', '0.797490', '0.799428', '0.806988', '0.793900', '0.796397', '0.800447', '0.814351', '0.796797', '0.807542', '0.794574']
         : correct/total = [(3340, 4128), (3394, 4203), (3304, 4081), (3417, 4333), (3388, 4091), (3422, 4287), (3329, 4193), (3512, 4349), (3375, 4191), (3496, 4277), (3304, 4143), (3352, 4193), (3303, 4093), (3332, 4197), (3227, 4052), (3225, 4029), (3382, 4153), (3333, 4183), (3298, 4084), (3280, 4128)]
         : compromised: 0.7999, honest: 0.8123
         : ubar stats = ['Node 0: s1=0.263, s2=0.550', 'Node 1: s1=0.263, s2=0.200', 'Node 2: s1=0.263, s2=0.450']...
Round 005: test acc mean=0.8234 ± 0.0085 | min=0.8086 max=0.8378
         : test loss mean=0.5549 ± 0.0228
         : individual accs = ['0.818072', '0.832501', '0.837785', '0.819986', '0.835493', '0.826452', '0.820176', '0.836974', '0.814603', '0.829553', '0.812696', '0.814691', '0.828976', '0.826305', '0.818608', '0.808637', '0.830484', '0.817834', '0.824927', '0.812984']
         : correct/total = [(3377, 4128), (3499, 4203), (3419, 4081), (3553, 4333), (3418, 4091), (3543, 4287), (3439, 4193), (3640, 4349), (3414, 4191), (3548, 4277), (3367, 4143), (3416, 4193), (3393, 4093), (3468, 4197), (3317, 4052), (3258, 4029), (3449, 4153), (3421, 4183), (3369, 4084), (3356, 4128)]
         : compromised: 0.8217, honest: 0.8272
         : ubar stats = ['Node 0: s1=0.263, s2=0.480', 'Node 1: s1=0.263, s2=0.320', 'Node 2: s1=0.263, s2=0.560']...
Round 006: test acc mean=0.8303 ± 0.0081 | min=0.8185 max=0.8453
         : test loss mean=0.5246 ± 0.0263
         : individual accs = ['0.825339', '0.837735', '0.836560', '0.828987', '0.841604', '0.834850', '0.818507', '0.845252', '0.823908', '0.840542', '0.824041', '0.819461', '0.838260', '0.830593', '0.824038', '0.823281', '0.823020', '0.825962', '0.840597', '0.822674']
         : correct/total = [(3407, 4128), (3521, 4203), (3414, 4081), (3592, 4333), (3443, 4091), (3579, 4287), (3432, 4193), (3676, 4349), (3453, 4191), (3595, 4277), (3414, 4143), (3436, 4193), (3431, 4093), (3486, 4197), (3339, 4052), (3317, 4029), (3418, 4153), (3455, 4183), (3433, 4084), (3396, 4128)]
         : compromised: 0.8290, honest: 0.8333
         : ubar stats = ['Node 0: s1=0.263, s2=0.433', 'Node 1: s1=0.263, s2=0.300', 'Node 2: s1=0.263, s2=0.500']...
Round 007: test acc mean=0.8392 ± 0.0077 | min=0.8260 max=0.8563
         : test loss mean=0.4912 ± 0.0256
         : individual accs = ['0.843750', '0.840352', '0.848812', '0.839603', '0.847226', '0.841614', '0.836394', '0.856289', '0.833930', '0.842647', '0.832006', '0.830909', '0.840459', '0.835597', '0.840326', '0.826011', '0.846376', '0.826440', '0.846474', '0.829457']
         : correct/total = [(3483, 4128), (3532, 4203), (3464, 4081), (3638, 4333), (3466, 4091), (3608, 4287), (3507, 4193), (3724, 4349), (3495, 4191), (3604, 4277), (3447, 4143), (3484, 4193), (3440, 4093), (3507, 4197), (3405, 4052), (3328, 4029), (3515, 4153), (3457, 4183), (3457, 4084), (3424, 4128)]
         : compromised: 0.8369, honest: 0.8447
         : ubar stats = ['Node 0: s1=0.263, s2=0.486', 'Node 1: s1=0.263, s2=0.286', 'Node 2: s1=0.263, s2=0.457']...
Round 008: test acc mean=0.8437 ± 0.0072 | min=0.8307 max=0.8546
         : test loss mean=0.4721 ± 0.0225
         : individual accs = ['0.843023', '0.849393', '0.850527', '0.848835', '0.854559', '0.852578', '0.837109', '0.848241', '0.834884', '0.844985', '0.841902', '0.831863', '0.842903', '0.847034', '0.840819', '0.830727', '0.846617', '0.832895', '0.854554', '0.839632']
         : correct/total = [(3480, 4128), (3570, 4203), (3471, 4081), (3678, 4333), (3496, 4091), (3655, 4287), (3510, 4193), (3689, 4349), (3499, 4191), (3614, 4277), (3488, 4143), (3488, 4193), (3450, 4093), (3555, 4197), (3407, 4052), (3347, 4029), (3516, 4153), (3484, 4183), (3490, 4084), (3466, 4128)]
         : compromised: 0.8424, honest: 0.8466
         : ubar stats = ['Node 0: s1=0.263, s2=0.475', 'Node 1: s1=0.263, s2=0.275', 'Node 2: s1=0.263, s2=0.425']...
Round 009: test acc mean=0.8475 ± 0.0076 | min=0.8353 max=0.8634
         : test loss mean=0.4586 ± 0.0233
         : individual accs = ['0.842539', '0.853438', '0.855918', '0.852296', '0.852603', '0.850478', '0.837586', '0.863417', '0.848246', '0.856441', '0.839730', '0.838302', '0.844857', '0.847510', '0.843781', '0.838918', '0.854563', '0.839589', '0.853820', '0.835271']
         : correct/total = [(3478, 4128), (3587, 4203), (3493, 4081), (3693, 4333), (3488, 4091), (3646, 4287), (3512, 4193), (3755, 4349), (3555, 4191), (3663, 4277), (3479, 4143), (3515, 4193), (3458, 4093), (3557, 4197), (3419, 4052), (3380, 4029), (3549, 4153), (3512, 4183), (3487, 4084), (3448, 4128)]
         : compromised: 0.8457, honest: 0.8515
         : ubar stats = ['Node 0: s1=0.263, s2=0.533', 'Node 1: s1=0.263, s2=0.267', 'Node 2: s1=0.263, s2=0.400']...
Round 010: test acc mean=0.8503 ± 0.0072 | min=0.8379 max=0.8629
         : test loss mean=0.4484 ± 0.0221
         : individual accs = ['0.850775', '0.854152', '0.857878', '0.849065', '0.862870', '0.855843', '0.843072', '0.857898', '0.850632', '0.859247', '0.840212', '0.842595', '0.857317', '0.851084', '0.843287', '0.840159', '0.851433', '0.844131', '0.855779', '0.837936']
         : correct/total = [(3512, 4128), (3590, 4203), (3501, 4081), (3679, 4333), (3530, 4091), (3669, 4287), (3535, 4193), (3731, 4349), (3565, 4191), (3675, 4277), (3481, 4143), (3533, 4193), (3509, 4093), (3572, 4197), (3417, 4052), (3385, 4029), (3536, 4153), (3531, 4183), (3495, 4084), (3459, 4128)]
         : compromised: 0.8488, honest: 0.8537
         : ubar stats = ['Node 0: s1=0.263, s2=0.560', 'Node 1: s1=0.263, s2=0.260', 'Node 2: s1=0.263, s2=0.380']...

=== FINAL RESULTS ===
Dataset: femnist, Nodes: 20, Graph: fully, Aggregation: ubar
Attack: gaussian, 70.0% compromised
Final accuracy - Compromised: 0.8488, Honest: 0.8537
Overall test accuracy: mean=0.8503 ± 0.0072

=== UBAR SUMMARY ===
Node 0: stage1=0.263, stage2=0.560, overall=0.147
Node 1: stage1=0.263, stage2=0.260, overall=0.068
Node 2: stage1=0.263, stage2=0.380, overall=0.100
Node 3: stage1=0.263, stage2=0.340, overall=0.089
Node 4: stage1=0.263, stage2=0.360, overall=0.095
Node 5: stage1=0.263, stage2=0.580, overall=0.153
Node 6: stage1=0.263, stage2=0.380, overall=0.100
Node 7: stage1=0.263, stage2=0.580, overall=0.153
Node 8: stage1=0.263, stage2=0.380, overall=0.100
Node 9: stage1=0.263, stage2=0.340, overall=0.089
Node 10: stage1=0.263, stage2=0.360, overall=0.095
Node 11: stage1=0.263, stage2=0.540, overall=0.142
Node 12: stage1=0.263, stage2=0.520, overall=0.137
Node 13: stage1=0.263, stage2=0.440, overall=0.116
Node 14: stage1=0.263, stage2=0.300, overall=0.079
Node 15: stage1=0.263, stage2=0.440, overall=0.116
Node 16: stage1=0.263, stage2=0.220, overall=0.058
Node 17: stage1=0.263, stage2=0.400, overall=0.105
Node 18: stage1=0.263, stage2=0.440, overall=0.116
Node 19: stage1=0.263, stage2=0.500, overall=0.132

=== PARALLEL EXECUTION TIME (realistic for distributed system) ===
  COMMUNICATION (max across nodes):
    - Full model transfer: 0.000s (0.0%)
  COMPUTATION (max across nodes):
    - Distance computation: 0.191s (4.3%)
    - Loss computation: 4.199s (95.4%)
    - Aggregation: 0.010s (0.2%)
  TOTALS:
    - Total computation: 4.400s (100.0%)
    - Total communication: 0.000s (0.0%)
    - Total parallel time: 4.400s

=== PER-NODE AVERAGE TIME ===
  - Distance computation: 0.116s
  - Loss computation: 3.948s
  - Aggregation: 0.005s
  - Model transfer: 0.000s
  - Total per node: 4.070s

=== TOTAL COMPUTATIONAL WORK (sum across all nodes) ===
  - Total distance computation: 2.324s
  - Total loss computation: 78.966s
  - Total aggregation: 0.103s
  - Total model transfer: 0.000s
  - Grand total: 81.393s
  - Mean Stage 1 acceptance rate: 0.263
  - Mean Stage 2 acceptance rate: 0.416
  - Overall acceptance rate: 0.109

UBAR Algorithm Properties:
  - Model dimension: 6,603,710
  - Rho parameter: 0.30000000000000004
  - Two-stage approach: Distance filtering + loss evaluation
  - Stage 1 selects: 30% of neighbors
  - Stage 2 uses: Training sample loss comparison
  - Theoretical complexity: O(deg(i)×d + deg(i)×inference)
  - Approach: UBAR paper implementation
