Device: cuda
Seed: 987654321
Loading 36 LEAF FEMNIST train files...
LEAF FEMNIST train: 3597 users, 734463 samples
Loading 36 LEAF FEMNIST test files...
LEAF FEMNIST test: 3597 users, 83388 samples
Found 3597 train users, 3597 test users, 3597 common users
User sample counts range: 525 (max) to 17 (min)
Distributed ALL 3597 users across 20 clients
Users per client: 179 (with 17 clients getting +1 user)
Train partition sizes: [36360, 37070, 35957, 38262, 36024, 37732, 36921, 38328, 36867, 37683, 36507, 36915, 36007, 37001, 35681, 35453, 36585, 36801, 35964, 36345]
Test partition sizes: [4128, 4203, 4081, 4333, 4091, 4287, 4193, 4349, 4191, 4277, 4143, 4193, 4093, 4197, 4052, 4029, 4153, 4183, 4084, 4128]
  Client 0: 36360 train samples, 62 unique classes
  Client 1: 37070 train samples, 62 unique classes
  Client 2: 35957 train samples, 62 unique classes
  Client 3: 38262 train samples, 62 unique classes
  Client 4: 36024 train samples, 62 unique classes
  Client 5: 37732 train samples, 62 unique classes
  Client 6: 36921 train samples, 62 unique classes
  Client 7: 38328 train samples, 62 unique classes
  Client 8: 36867 train samples, 62 unique classes
  Client 9: 37683 train samples, 62 unique classes
  Client 10: 36507 train samples, 62 unique classes
  Client 11: 36915 train samples, 62 unique classes
  Client 12: 36007 train samples, 62 unique classes
  Client 13: 37001 train samples, 62 unique classes
  Client 14: 35681 train samples, 62 unique classes
  Client 15: 35453 train samples, 62 unique classes
  Client 16: 36585 train samples, 62 unique classes
  Client 17: 36801 train samples, 62 unique classes
  Client 18: 35964 train samples, 62 unique classes
  Client 19: 36345 train samples, 62 unique classes
Will sample 10000 samples per client per epoch
Graph: fully, nodes: 20, edges: 190
Degree statistics: avg=19.00, min=19, max=19
Attack: Compromised 4/20 nodes: [5, 12, 13, 17]
Attack type: backdoor, lambda: 1.0
Backdoor target label: 0, trigger size: 4
Model variant: baseline
Model parameters: 6,603,710
Initial test acc across nodes: mean=0.0168 ± 0.0139
Backdoor attack: Created poisoned datasets for 4 compromised nodes
Round 001: test acc mean=0.5292 ± 0.0102 | min=0.5121 max=0.5531
         : test loss mean=1.7711 ± 0.0384
         : individual accs = ['0.533672', '0.533191', '0.531732', '0.514193', '0.531899', '0.553067', '0.512521', '0.544033', '0.523026', '0.526070', '0.522085', '0.540663', '0.534816', '0.519419', '0.532083', '0.524696', '0.533349', '0.525221', '0.535994', '0.512112']
         : correct/total = [(2203, 4128), (2241, 4203), (2170, 4081), (2228, 4333), (2176, 4091), (2371, 4287), (2149, 4193), (2366, 4349), (2192, 4191), (2250, 4277), (2163, 4143), (2267, 4193), (2189, 4093), (2180, 4197), (2156, 4052), (2114, 4029), (2215, 4153), (2197, 4183), (2189, 4084), (2114, 4128)]
         : compromised: 0.5331, honest: 0.5282
Round 002: test acc mean=0.7408 ± 0.0076 | min=0.7294 max=0.7552
         : test loss mean=0.8528 ± 0.0280
         : individual accs = ['0.748304', '0.755175', '0.747611', '0.729748', '0.748961', '0.745510', '0.737181', '0.744309', '0.739203', '0.750058', '0.734733', '0.735989', '0.751527', '0.734572', '0.735686', '0.733681', '0.738021', '0.729381', '0.744368', '0.732316']
         : correct/total = [(3089, 4128), (3174, 4203), (3051, 4081), (3162, 4333), (3064, 4091), (3196, 4287), (3091, 4193), (3237, 4349), (3098, 4191), (3208, 4277), (3044, 4143), (3086, 4193), (3076, 4093), (3083, 4197), (2981, 4052), (2956, 4029), (3065, 4153), (3051, 4183), (3040, 4084), (3023, 4128)]
         : compromised: 0.7402, honest: 0.7410
Round 003: test acc mean=0.7747 ± 0.0086 | min=0.7558 max=0.7903
         : test loss mean=0.7241 ± 0.0256
         : individual accs = ['0.772771', '0.774209', '0.776035', '0.770598', '0.780005', '0.790296', '0.761030', '0.774891', '0.781436', '0.783493', '0.767077', '0.761746', '0.786709', '0.775077', '0.772705', '0.769918', '0.776788', '0.779106', '0.785015', '0.755814']
         : correct/total = [(3190, 4128), (3254, 4203), (3167, 4081), (3339, 4333), (3191, 4091), (3388, 4287), (3191, 4193), (3370, 4349), (3275, 4191), (3351, 4277), (3178, 4143), (3194, 4193), (3220, 4093), (3253, 4197), (3131, 4052), (3102, 4029), (3226, 4153), (3259, 4183), (3206, 4084), (3120, 4128)]
         : compromised: 0.7828, honest: 0.7727
Round 004: test acc mean=0.7955 ± 0.0074 | min=0.7842 max=0.8104
         : test loss mean=0.6341 ± 0.0245
         : individual accs = ['0.791667', '0.803474', '0.802989', '0.795523', '0.800049', '0.797527', '0.788934', '0.797425', '0.801718', '0.810381', '0.784214', '0.785357', '0.801124', '0.786514', '0.790721', '0.792008', '0.803756', '0.787473', '0.801910', '0.786822']
         : correct/total = [(3268, 4128), (3377, 4203), (3277, 4081), (3447, 4333), (3273, 4091), (3419, 4287), (3308, 4193), (3468, 4349), (3360, 4191), (3466, 4277), (3249, 4143), (3293, 4193), (3279, 4093), (3301, 4197), (3204, 4052), (3191, 4029), (3338, 4153), (3294, 4183), (3275, 4084), (3248, 4128)]
         : compromised: 0.7932, honest: 0.7961
Round 005: test acc mean=0.8112 ± 0.0069 | min=0.7994 max=0.8212
         : test loss mean=0.5821 ± 0.0260
         : individual accs = ['0.821221', '0.811801', '0.817202', '0.804523', '0.818382', '0.815489', '0.799428', '0.817429', '0.808638', '0.817395', '0.801593', '0.808013', '0.818471', '0.806528', '0.809970', '0.804170', '0.816759', '0.804208', '0.820764', '0.802568']
         : correct/total = [(3390, 4128), (3412, 4203), (3335, 4081), (3486, 4333), (3348, 4091), (3496, 4287), (3352, 4193), (3555, 4349), (3389, 4191), (3496, 4277), (3321, 4143), (3388, 4193), (3350, 4093), (3385, 4197), (3282, 4052), (3240, 4029), (3392, 4153), (3364, 4183), (3352, 4084), (3313, 4128)]
         : compromised: 0.8112, honest: 0.8112
Round 006: test acc mean=0.8198 ± 0.0073 | min=0.8079 max=0.8297
         : test loss mean=0.5557 ± 0.0281
         : individual accs = ['0.828004', '0.829408', '0.829699', '0.815370', '0.824737', '0.819687', '0.813976', '0.828236', '0.810546', '0.824410', '0.809317', '0.818507', '0.825312', '0.815106', '0.817621', '0.812360', '0.825187', '0.811618', '0.829579', '0.807897']
         : correct/total = [(3418, 4128), (3486, 4203), (3386, 4081), (3533, 4333), (3374, 4091), (3514, 4287), (3413, 4193), (3602, 4349), (3397, 4191), (3526, 4277), (3353, 4143), (3432, 4193), (3378, 4093), (3421, 4197), (3313, 4052), (3273, 4029), (3427, 4153), (3395, 4183), (3388, 4084), (3335, 4128)]
         : compromised: 0.8179, honest: 0.8203
Round 007: test acc mean=0.8216 ± 0.0072 | min=0.8086 max=0.8331
         : test loss mean=0.5523 ± 0.0287
         : individual accs = ['0.833091', '0.829170', '0.830434', '0.818371', '0.826937', '0.819221', '0.813260', '0.825477', '0.820806', '0.830489', '0.808593', '0.815407', '0.822868', '0.815344', '0.823050', '0.812360', '0.829280', '0.816161', '0.829089', '0.812016']
         : correct/total = [(3439, 4128), (3485, 4203), (3389, 4081), (3546, 4333), (3383, 4091), (3512, 4287), (3410, 4193), (3590, 4349), (3440, 4191), (3552, 4277), (3350, 4143), (3419, 4193), (3368, 4093), (3422, 4197), (3335, 4052), (3273, 4029), (3444, 4153), (3414, 4183), (3386, 4084), (3352, 4128)]
         : compromised: 0.8184, honest: 0.8224
Round 008: test acc mean=0.8163 ± 0.0077 | min=0.8037 max=0.8326
         : test loss mean=0.5479 ± 0.0282
         : individual accs = ['0.827035', '0.825839', '0.817937', '0.811678', '0.832559', '0.819687', '0.810398', '0.815820', '0.817466', '0.822539', '0.809076', '0.808490', '0.825312', '0.805099', '0.814413', '0.803673', '0.821093', '0.817356', '0.814887', '0.806202']
         : correct/total = [(3414, 4128), (3471, 4203), (3338, 4081), (3517, 4333), (3406, 4091), (3514, 4287), (3398, 4193), (3548, 4349), (3426, 4191), (3518, 4277), (3352, 4143), (3390, 4193), (3378, 4093), (3379, 4197), (3300, 4052), (3238, 4029), (3410, 4153), (3419, 4183), (3328, 4084), (3328, 4128)]
         : compromised: 0.8169, honest: 0.8162
Round 009: test acc mean=0.8219 ± 0.0068 | min=0.8110 max=0.8331
         : test loss mean=0.5367 ± 0.0273
         : individual accs = ['0.831153', '0.831073', '0.828228', '0.813986', '0.826937', '0.827385', '0.812068', '0.822028', '0.821284', '0.833061', '0.811007', '0.817076', '0.822868', '0.819395', '0.819102', '0.812857', '0.827113', '0.816400', '0.828599', '0.815891']
         : correct/total = [(3431, 4128), (3493, 4203), (3380, 4081), (3527, 4333), (3383, 4091), (3547, 4287), (3405, 4193), (3575, 4349), (3442, 4191), (3563, 4277), (3360, 4143), (3426, 4193), (3368, 4093), (3439, 4197), (3319, 4052), (3275, 4029), (3435, 4153), (3415, 4183), (3384, 4084), (3368, 4128)]
         : compromised: 0.8215, honest: 0.8220
Round 010: test acc mean=0.8265 ± 0.0081 | min=0.8130 max=0.8399
         : test loss mean=0.5261 ± 0.0274
         : individual accs = ['0.837209', '0.832501', '0.830434', '0.818140', '0.839892', '0.830184', '0.813022', '0.836284', '0.819852', '0.834931', '0.822351', '0.817553', '0.832885', '0.822016', '0.820336', '0.819558', '0.826150', '0.820464', '0.838149', '0.818556']
         : correct/total = [(3456, 4128), (3499, 4203), (3389, 4081), (3545, 4333), (3436, 4091), (3559, 4287), (3409, 4193), (3637, 4349), (3436, 4191), (3571, 4277), (3407, 4143), (3428, 4193), (3409, 4093), (3450, 4197), (3324, 4052), (3302, 4029), (3431, 4153), (3432, 4183), (3423, 4084), (3379, 4128)]
         : compromised: 0.8264, honest: 0.8266

=== FINAL RESULTS ===
Dataset: femnist, Nodes: 20, Graph: fully, Aggregation: krum
Attack: backdoor, 20.0% compromised
Final accuracy - Compromised: 0.8264, Honest: 0.8266
Overall test accuracy: mean=0.8265 ± 0.0081

=== BACKDOOR ATTACK SUCCESS RATE (ASR) ===
Target label: 0
Trigger size: 4x4
Overall ASR: 0.0457 ± 0.0029
Honest nodes ASR: 0.0453 ± 0.0031
Compromised nodes ASR: 0.0471 ± 0.0010
Note: Higher ASR indicates more successful backdoor attack
