Device: cuda
Seed: 987654321
Loading 36 LEAF FEMNIST train files...
LEAF FEMNIST train: 3597 users, 734463 samples
Loading 36 LEAF FEMNIST test files...
LEAF FEMNIST test: 3597 users, 83388 samples
Found 3597 train users, 3597 test users, 3597 common users
User sample counts range: 525 (max) to 17 (min)
Distributed ALL 3597 users across 20 clients
Users per client: 179 (with 17 clients getting +1 user)
Train partition sizes: [36360, 37070, 35957, 38262, 36024, 37732, 36921, 38328, 36867, 37683, 36507, 36915, 36007, 37001, 35681, 35453, 36585, 36801, 35964, 36345]
Test partition sizes: [4128, 4203, 4081, 4333, 4091, 4287, 4193, 4349, 4191, 4277, 4143, 4193, 4093, 4197, 4052, 4029, 4153, 4183, 4084, 4128]
  Client 0: 36360 train samples, 62 unique classes
  Client 1: 37070 train samples, 62 unique classes
  Client 2: 35957 train samples, 62 unique classes
  Client 3: 38262 train samples, 62 unique classes
  Client 4: 36024 train samples, 62 unique classes
  Client 5: 37732 train samples, 62 unique classes
  Client 6: 36921 train samples, 62 unique classes
  Client 7: 38328 train samples, 62 unique classes
  Client 8: 36867 train samples, 62 unique classes
  Client 9: 37683 train samples, 62 unique classes
  Client 10: 36507 train samples, 62 unique classes
  Client 11: 36915 train samples, 62 unique classes
  Client 12: 36007 train samples, 62 unique classes
  Client 13: 37001 train samples, 62 unique classes
  Client 14: 35681 train samples, 62 unique classes
  Client 15: 35453 train samples, 62 unique classes
  Client 16: 36585 train samples, 62 unique classes
  Client 17: 36801 train samples, 62 unique classes
  Client 18: 35964 train samples, 62 unique classes
  Client 19: 36345 train samples, 62 unique classes
Will sample 10000 samples per client per epoch
Graph: erdos, nodes: 20, edges: 99
Degree statistics: avg=9.90, min=7, max=14
Attack: Compromised 6/20 nodes: [5, 12, 13, 14, 17, 18]
Attack type: directed_deviation, lambda: 1.0
Model variant: baseline
Model parameters: 6,603,710
Initial test acc across nodes: mean=0.0162 ± 0.0138
Round 001: test acc mean=0.0145 ± 0.0145 | min=0.0030 max=0.0523
         : test loss mean=7621.7349 ± 16313.1932
         : individual accs = ['0.005329', '0.023555', '0.017153', '0.050081', '0.004889', '0.006765', '0.004770', '0.007128', '0.005249', '0.003040', '0.006758', '0.005962', '0.010750', '0.035740', '0.052320', '0.007694', '0.006983', '0.020081', '0.006121', '0.010174']
         : correct/total = [(22, 4128), (99, 4203), (70, 4081), (217, 4333), (20, 4091), (29, 4287), (20, 4193), (31, 4349), (22, 4191), (13, 4277), (28, 4143), (25, 4193), (44, 4093), (150, 4197), (212, 4052), (31, 4029), (29, 4153), (84, 4183), (25, 4084), (42, 4128)]
         : compromised: 0.0220, honest: 0.0113
Round 002: test acc mean=0.0471 ± 0.0081 | min=0.0243 max=0.0591
         : test loss mean=4607562415642.2441 ± 12893121901276.8750
         : individual accs = ['0.059109', '0.048775', '0.049253', '0.048004', '0.051821', '0.047352', '0.045314', '0.046907', '0.024338', '0.050736', '0.048274', '0.051037', '0.047398', '0.047653', '0.052320', '0.048151', '0.045750', '0.025102', '0.054358', '0.050630']
         : correct/total = [(244, 4128), (205, 4203), (201, 4081), (208, 4333), (212, 4091), (203, 4287), (190, 4193), (204, 4349), (102, 4191), (217, 4277), (200, 4143), (214, 4193), (194, 4093), (200, 4197), (212, 4052), (194, 4029), (190, 4153), (105, 4183), (222, 4084), (209, 4128)]
         : compromised: 0.0457, honest: 0.0477
Round 003: test acc mean=0.0502 ± 0.0033 | min=0.0415 max=0.0550
         : test loss mean=623736106.5760 ± 2718778264.2607
         : individual accs = ['0.049419', '0.048775', '0.049743', '0.049850', '0.052066', '0.048519', '0.041498', '0.052656', '0.053686', '0.050736', '0.048033', '0.048891', '0.047398', '0.047653', '0.054788', '0.054604', '0.047436', '0.049247', '0.054358', '0.054990']
         : correct/total = [(204, 4128), (205, 4203), (203, 4081), (216, 4333), (213, 4091), (208, 4287), (174, 4193), (229, 4349), (225, 4191), (217, 4277), (199, 4143), (205, 4193), (194, 4093), (200, 4197), (222, 4052), (220, 4029), (197, 4153), (206, 4183), (222, 4084), (227, 4128)]
         : compromised: 0.0503, honest: 0.0502
Round 004: test acc mean=0.0525 ± 0.0092 | min=0.0169 max=0.0623
         : test loss mean=3.8046 ± 0.0414
         : individual accs = ['0.049661', '0.052819', '0.061505', '0.049850', '0.052066', '0.052018', '0.053422', '0.052656', '0.016941', '0.048632', '0.051895', '0.054853', '0.062301', '0.049083', '0.055281', '0.061554', '0.050566', '0.057853', '0.060235', '0.057413']
         : correct/total = [(205, 4128), (222, 4203), (251, 4081), (216, 4333), (213, 4091), (223, 4287), (224, 4193), (229, 4349), (71, 4191), (208, 4277), (215, 4143), (230, 4193), (255, 4093), (206, 4197), (224, 4052), (248, 4029), (210, 4153), (242, 4183), (246, 4084), (237, 4128)]
         : compromised: 0.0561, honest: 0.0510
Round 005: test acc mean=0.0545 ± 0.0043 | min=0.0486 max=0.0623
         : test loss mean=3.7984 ± 0.0471
         : individual accs = ['0.049661', '0.052819', '0.061505', '0.049850', '0.052066', '0.052018', '0.053422', '0.052656', '0.057266', '0.048632', '0.051895', '0.054853', '0.062301', '0.049083', '0.055281', '0.061554', '0.050566', '0.057853', '0.060235', '0.057413']
         : correct/total = [(205, 4128), (222, 4203), (251, 4081), (216, 4333), (213, 4091), (223, 4287), (224, 4193), (229, 4349), (240, 4191), (208, 4277), (215, 4143), (230, 4193), (255, 4093), (206, 4197), (224, 4052), (248, 4029), (210, 4153), (242, 4183), (246, 4084), (237, 4128)]
         : compromised: 0.0561, honest: 0.0539
Round 006: test acc mean=0.0545 ± 0.0043 | min=0.0486 max=0.0623
         : test loss mean=3.7614 ± 0.0316
         : individual accs = ['0.049661', '0.052819', '0.061505', '0.049850', '0.052066', '0.052018', '0.053422', '0.052656', '0.057266', '0.048632', '0.051895', '0.054853', '0.062301', '0.049083', '0.055281', '0.061554', '0.050566', '0.057853', '0.060235', '0.057413']
         : correct/total = [(205, 4128), (222, 4203), (251, 4081), (216, 4333), (213, 4091), (223, 4287), (224, 4193), (229, 4349), (240, 4191), (208, 4277), (215, 4143), (230, 4193), (255, 4093), (206, 4197), (224, 4052), (248, 4029), (210, 4153), (242, 4183), (246, 4084), (237, 4128)]
         : compromised: 0.0561, honest: 0.0539
Round 007: test acc mean=0.0545 ± 0.0043 | min=0.0486 max=0.0623
         : test loss mean=3.7247 ± 0.0189
         : individual accs = ['0.049661', '0.052819', '0.061505', '0.049850', '0.052066', '0.052018', '0.053422', '0.052656', '0.057266', '0.048632', '0.051895', '0.054853', '0.062301', '0.049083', '0.055281', '0.061554', '0.050566', '0.057853', '0.060235', '0.057413']
         : correct/total = [(205, 4128), (222, 4203), (251, 4081), (216, 4333), (213, 4091), (223, 4287), (224, 4193), (229, 4349), (240, 4191), (208, 4277), (215, 4143), (230, 4193), (255, 4093), (206, 4197), (224, 4052), (248, 4029), (210, 4153), (242, 4183), (246, 4084), (237, 4128)]
         : compromised: 0.0561, honest: 0.0539
Round 008: test acc mean=0.0545 ± 0.0043 | min=0.0486 max=0.0623
         : test loss mean=3.7085 ± 0.0158
         : individual accs = ['0.049661', '0.052819', '0.061505', '0.049850', '0.052066', '0.052018', '0.053422', '0.052656', '0.057266', '0.048632', '0.051895', '0.054853', '0.062301', '0.049083', '0.055281', '0.061554', '0.050566', '0.057853', '0.060235', '0.057413']
         : correct/total = [(205, 4128), (222, 4203), (251, 4081), (216, 4333), (213, 4091), (223, 4287), (224, 4193), (229, 4349), (240, 4191), (208, 4277), (215, 4143), (230, 4193), (255, 4093), (206, 4197), (224, 4052), (248, 4029), (210, 4153), (242, 4183), (246, 4084), (237, 4128)]
         : compromised: 0.0561, honest: 0.0539
Round 009: test acc mean=0.0545 ± 0.0043 | min=0.0486 max=0.0623
         : test loss mean=3.7050 ± 0.0177
         : individual accs = ['0.049661', '0.052819', '0.061505', '0.049850', '0.052066', '0.052018', '0.053422', '0.052656', '0.057266', '0.048632', '0.051895', '0.054853', '0.062301', '0.049083', '0.055281', '0.061554', '0.050566', '0.057853', '0.060235', '0.057413']
         : correct/total = [(205, 4128), (222, 4203), (251, 4081), (216, 4333), (213, 4091), (223, 4287), (224, 4193), (229, 4349), (240, 4191), (208, 4277), (215, 4143), (230, 4193), (255, 4093), (206, 4197), (224, 4052), (248, 4029), (210, 4153), (242, 4183), (246, 4084), (237, 4128)]
         : compromised: 0.0561, honest: 0.0539
Round 010: test acc mean=0.0545 ± 0.0043 | min=0.0486 max=0.0623
         : test loss mean=3.7014 ± 0.0162
         : individual accs = ['0.049661', '0.052819', '0.061505', '0.049850', '0.052066', '0.052018', '0.053422', '0.052656', '0.057266', '0.048632', '0.051895', '0.054853', '0.062301', '0.049083', '0.055281', '0.061554', '0.050566', '0.057853', '0.060235', '0.057413']
         : correct/total = [(205, 4128), (222, 4203), (251, 4081), (216, 4333), (213, 4091), (223, 4287), (224, 4193), (229, 4349), (240, 4191), (208, 4277), (215, 4143), (230, 4193), (255, 4093), (206, 4197), (224, 4052), (248, 4029), (210, 4153), (242, 4183), (246, 4084), (237, 4128)]
         : compromised: 0.0561, honest: 0.0539

=== FINAL RESULTS ===
Dataset: femnist, Nodes: 20, Graph: erdos, Aggregation: d-fedavg
Attack: directed_deviation, 30.0% compromised
Final accuracy - Compromised: 0.0561, Honest: 0.0539
Overall test accuracy: mean=0.0545 ± 0.0043
