Device: cuda
Seed: 987654321
Loading 36 LEAF FEMNIST train files...
LEAF FEMNIST train: 3597 users, 734463 samples
Loading 36 LEAF FEMNIST test files...
LEAF FEMNIST test: 3597 users, 83388 samples
Found 3597 train users, 3597 test users, 3597 common users
User sample counts range: 525 (max) to 17 (min)
Distributed ALL 3597 users across 20 clients
Users per client: 179 (with 17 clients getting +1 user)
Train partition sizes: [36360, 37070, 35957, 38262, 36024, 37732, 36921, 38328, 36867, 37683, 36507, 36915, 36007, 37001, 35681, 35453, 36585, 36801, 35964, 36345]
Test partition sizes: [4128, 4203, 4081, 4333, 4091, 4287, 4193, 4349, 4191, 4277, 4143, 4193, 4093, 4197, 4052, 4029, 4153, 4183, 4084, 4128]
  Client 0: 36360 train samples, 62 unique classes
  Client 1: 37070 train samples, 62 unique classes
  Client 2: 35957 train samples, 62 unique classes
  Client 3: 38262 train samples, 62 unique classes
  Client 4: 36024 train samples, 62 unique classes
  Client 5: 37732 train samples, 62 unique classes
  Client 6: 36921 train samples, 62 unique classes
  Client 7: 38328 train samples, 62 unique classes
  Client 8: 36867 train samples, 62 unique classes
  Client 9: 37683 train samples, 62 unique classes
  Client 10: 36507 train samples, 62 unique classes
  Client 11: 36915 train samples, 62 unique classes
  Client 12: 36007 train samples, 62 unique classes
  Client 13: 37001 train samples, 62 unique classes
  Client 14: 35681 train samples, 62 unique classes
  Client 15: 35453 train samples, 62 unique classes
  Client 16: 36585 train samples, 62 unique classes
  Client 17: 36801 train samples, 62 unique classes
  Client 18: 35964 train samples, 62 unique classes
  Client 19: 36345 train samples, 62 unique classes
Will sample 10000 samples per client per epoch
Graph: ring, nodes: 20, edges: 20
Degree statistics: avg=2.00, min=2, max=2
Attack: Compromised 8/20 nodes: [1, 5, 11, 12, 13, 14, 17, 18]
Attack type: backdoor, lambda: 1.0
Backdoor target label: 0, trigger size: 4
Model variant: baseline
Model parameters: 6,603,710
BALANCE algorithm:
Balance Config: BALANCEConfig(gamma=2, kappa=1, alpha=0.5, min_neighbors=1)
  - Model dimension: 6,603,710 parameters
  - Complexity: O(N×d) = O(20×6,603,710)
Initial test acc across nodes: mean=0.0168 ± 0.0139
Backdoor attack: Created poisoned datasets for 8 compromised nodes
Round 001: test acc mean=0.2962 ± 0.1630 | min=0.0488 max=0.5202
         : test loss mean=15960.7215 ± 32459.0578
         : individual accs = ['0.429990', '0.048775', '0.376868', '0.399723', '0.461745', '0.216935', '0.520153', '0.462175', '0.381293', '0.258826', '0.416606', '0.103744', '0.054239', '0.049083', '0.149309', '0.458675', '0.452926', '0.154196', '0.107248', '0.421512']
         : correct/total = [(1775, 4128), (205, 4203), (1538, 4081), (1732, 4333), (1889, 4091), (930, 4287), (2181, 4193), (2010, 4349), (1598, 4191), (1107, 4277), (1726, 4143), (435, 4193), (222, 4093), (206, 4197), (605, 4052), (1848, 4029), (1881, 4153), (645, 4183), (438, 4084), (1740, 4128)]
         : compromised: 0.1104, honest: 0.4200
Round 002: test acc mean=0.4568 ± 0.3321 | min=0.0453 max=0.7548
         : test loss mean=nan ± nan
         : individual accs = ['0.754845', '0.051392', '0.739525', '0.726517', '0.737473', '0.045253', '0.700930', '0.710508', '0.697924', '0.724339', '0.714699', '0.053184', '0.054239', '0.049083', '0.050839', '0.746835', '0.748615', '0.051159', '0.048482', '0.731105']
         : correct/total = [(3116, 4128), (216, 4203), (3018, 4081), (3148, 4333), (3017, 4091), (194, 4287), (2939, 4193), (3090, 4349), (2925, 4191), (3098, 4277), (2961, 4143), (223, 4193), (222, 4093), (206, 4197), (206, 4052), (3009, 4029), (3109, 4153), (214, 4183), (198, 4084), (3018, 4128)]
         : compromised: 0.0505, honest: 0.7278
Round 003: test acc mean=0.4919 ± 0.3608 | min=0.0453 max=0.8015
         : test loss mean=nan ± nan
         : individual accs = ['0.795300', '0.048775', '0.801519', '0.786291', '0.800538', '0.045253', '0.780587', '0.782479', '0.760439', '0.788637', '0.780594', '0.049606', '0.054239', '0.049083', '0.051826', '0.782080', '0.794125', '0.049486', '0.052889', '0.784157']
         : correct/total = [(3283, 4128), (205, 4203), (3271, 4081), (3407, 4333), (3275, 4091), (194, 4287), (3273, 4193), (3403, 4349), (3187, 4191), (3373, 4277), (3234, 4143), (208, 4193), (222, 4093), (206, 4197), (210, 4052), (3151, 4029), (3298, 4153), (207, 4183), (216, 4084), (3237, 4128)]
         : compromised: 0.0501, honest: 0.7864
Round 004: test acc mean=0.5072 ± 0.3733 | min=0.0453 max=0.8294
         : test loss mean=nan ± nan
         : individual accs = ['0.818798', '0.048775', '0.818672', '0.817909', '0.829382', '0.045253', '0.802767', '0.808462', '0.795037', '0.808277', '0.801110', '0.049606', '0.054239', '0.049083', '0.051826', '0.813353', '0.826150', '0.049486', '0.052889', '0.802810']
         : correct/total = [(3380, 4128), (205, 4203), (3341, 4081), (3544, 4333), (3393, 4091), (194, 4287), (3366, 4193), (3516, 4349), (3332, 4191), (3457, 4277), (3319, 4143), (208, 4193), (222, 4093), (206, 4197), (210, 4052), (3277, 4029), (3431, 4153), (207, 4183), (216, 4084), (3314, 4128)]
         : compromised: 0.0501, honest: 0.8119
Round 005: test acc mean=0.5138 ± 0.3786 | min=0.0453 max=0.8317
         : test loss mean=nan ± nan
         : individual accs = ['0.828488', '0.048775', '0.831659', '0.826679', '0.828893', '0.045253', '0.820653', '0.828236', '0.810785', '0.825111', '0.812213', '0.049606', '0.054239', '0.049083', '0.051826', '0.816580', '0.828798', '0.049486', '0.052889', '0.815891']
         : correct/total = [(3420, 4128), (205, 4203), (3394, 4081), (3582, 4333), (3391, 4091), (194, 4287), (3441, 4193), (3602, 4349), (3398, 4191), (3529, 4277), (3365, 4143), (208, 4193), (222, 4093), (206, 4197), (210, 4052), (3290, 4029), (3442, 4153), (207, 4183), (216, 4084), (3368, 4128)]
         : compromised: 0.0501, honest: 0.8228
Round 006: test acc mean=0.5192 ± 0.3830 | min=0.0453 max=0.8447
         : test loss mean=nan ± nan
         : individual accs = ['0.829942', '0.048775', '0.839500', '0.841219', '0.841115', '0.045253', '0.817553', '0.839963', '0.823193', '0.835866', '0.819937', '0.049606', '0.054239', '0.049083', '0.051826', '0.823529', '0.844691', '0.049486', '0.052889', '0.826066']
         : correct/total = [(3426, 4128), (205, 4203), (3426, 4081), (3645, 4333), (3441, 4091), (194, 4287), (3428, 4193), (3653, 4349), (3450, 4191), (3575, 4277), (3397, 4143), (208, 4193), (222, 4093), (206, 4197), (210, 4052), (3318, 4029), (3508, 4153), (207, 4183), (216, 4084), (3410, 4128)]
         : compromised: 0.0501, honest: 0.8319
Round 007: test acc mean=0.5223 ± 0.3856 | min=0.0453 max=0.8470
         : test loss mean=nan ± nan
         : individual accs = ['0.837694', '0.048775', '0.846361', '0.846988', '0.846981', '0.045253', '0.828762', '0.845712', '0.828203', '0.844517', '0.823558', '0.049606', '0.054239', '0.049083', '0.051826', '0.825019', '0.840838', '0.049486', '0.052889', '0.829700']
         : correct/total = [(3458, 4128), (205, 4203), (3454, 4081), (3670, 4333), (3465, 4091), (194, 4287), (3475, 4193), (3678, 4349), (3471, 4191), (3612, 4277), (3412, 4143), (208, 4193), (222, 4093), (206, 4197), (210, 4052), (3324, 4029), (3492, 4153), (207, 4183), (216, 4084), (3425, 4128)]
         : compromised: 0.0501, honest: 0.8370
Round 008: test acc mean=0.5244 ± 0.3873 | min=0.0453 max=0.8575
         : test loss mean=nan ± nan
         : individual accs = ['0.841328', '0.048775', '0.850527', '0.849296', '0.857492', '0.045253', '0.823277', '0.850310', '0.833930', '0.847089', '0.823799', '0.049606', '0.054239', '0.049083', '0.051826', '0.831224', '0.844691', '0.049486', '0.052889', '0.833576']
         : correct/total = [(3473, 4128), (205, 4203), (3471, 4081), (3680, 4333), (3508, 4091), (194, 4287), (3452, 4193), (3698, 4349), (3495, 4191), (3623, 4277), (3413, 4143), (208, 4193), (222, 4093), (206, 4197), (210, 4052), (3349, 4029), (3508, 4153), (207, 4183), (216, 4084), (3441, 4128)]
         : compromised: 0.0501, honest: 0.8405
Round 009: test acc mean=0.5288 ± 0.3909 | min=0.0453 max=0.8591
         : test loss mean=nan ± nan
         : individual accs = ['0.842781', '0.048775', '0.859103', '0.854373', '0.856025', '0.045253', '0.839017', '0.855369', '0.840611', '0.851064', '0.841902', '0.049606', '0.054239', '0.049083', '0.051826', '0.840903', '0.858416', '0.049486', '0.052889', '0.834787']
         : correct/total = [(3479, 4128), (205, 4203), (3506, 4081), (3702, 4333), (3502, 4091), (194, 4287), (3518, 4193), (3720, 4349), (3523, 4191), (3640, 4277), (3488, 4143), (208, 4193), (222, 4093), (206, 4197), (210, 4052), (3388, 4029), (3565, 4153), (207, 4183), (216, 4084), (3446, 4128)]
         : compromised: 0.0501, honest: 0.8479
Round 010: test acc mean=0.5284 ± 0.3905 | min=0.0453 max=0.8567
         : test loss mean=nan ± nan
         : individual accs = ['0.845446', '0.048775', '0.854202', '0.856681', '0.855048', '0.045253', '0.834486', '0.851690', '0.845860', '0.856208', '0.834178', '0.049606', '0.054239', '0.049083', '0.051826', '0.841648', '0.853841', '0.049486', '0.052889', '0.837452']
         : correct/total = [(3490, 4128), (205, 4203), (3486, 4081), (3712, 4333), (3498, 4091), (194, 4287), (3499, 4193), (3704, 4349), (3545, 4191), (3662, 4277), (3456, 4143), (208, 4193), (222, 4093), (206, 4197), (210, 4052), (3391, 4029), (3546, 4153), (207, 4183), (216, 4084), (3457, 4128)]
         : compromised: 0.0501, honest: 0.8472

=== FINAL RESULTS ===
Dataset: femnist, Nodes: 20, Graph: ring, Aggregation: balance
Attack: backdoor, 40.0% compromised
Final accuracy - Compromised: 0.0501, Honest: 0.8472
Overall test accuracy: mean=0.5284 ± 0.3905

=== BACKDOOR ATTACK SUCCESS RATE (ASR) ===
Target label: 0
Trigger size: 4x4
Overall ASR: 0.4299 ± 0.4655
Honest nodes ASR: 0.0499 ± 0.0065
Compromised nodes ASR: 1.0000 ± 0.0000
Note: Higher ASR indicates more successful backdoor attack

=== BALANCE SUMMARY ===
Node 0: acceptance=0.500
Node 1: acceptance=0.200
Node 2: acceptance=0.500
Node 3: acceptance=1.000
Node 4: acceptance=0.500
Node 5: acceptance=0.100
Node 6: acceptance=0.500
Node 7: acceptance=1.000
Node 8: acceptance=1.000
Node 9: acceptance=1.000
Node 10: acceptance=0.500
Node 11: acceptance=0.150
Node 12: acceptance=0.000
Node 13: acceptance=0.000
Node 14: acceptance=0.150
Node 15: acceptance=0.500
Node 16: acceptance=0.500
Node 17: acceptance=0.150
Node 18: acceptance=0.150
Node 19: acceptance=0.500

=== PARALLEL EXECUTION TIME (realistic for distributed system) ===
  COMMUNICATION (max across nodes):
    - Full model transfer: 0.000s (0.0%)
  COMPUTATION (max across nodes):
    - Filtering: 0.044s (65.1%)
    - Aggregation: 0.024s (34.9%)
  TOTALS:
    - Total computation: 0.067s (100.0%)
    - Total communication: 0.000s (0.0%)
    - Total parallel time: 0.067s

=== PER-NODE AVERAGE TIME ===
  - Filtering: 0.032s
  - Aggregation: 0.007s
  - Model transfer: 0.000s
  - Total per node: 0.039s

=== TOTAL COMPUTATIONAL WORK (sum across all nodes) ===
  - Total filtering: 0.631s
  - Total aggregation: 0.141s
  - Total model transfer: 0.000s
  - Grand total: 0.773s
  - Mean acceptance rate: 0.445

BALANCE Algorithm Properties:
  - Model dimension: 6,603,710
  - No compression: Full parameter comparison
  - Theoretical complexity: O(deg(i)×d)
  - Approach: Full parameter filtering + averaging
