Device: cuda
Seed: 987654321
Loading 36 LEAF FEMNIST train files...
LEAF FEMNIST train: 3597 users, 734463 samples
Loading 36 LEAF FEMNIST test files...
LEAF FEMNIST test: 3597 users, 83388 samples
Found 3597 train users, 3597 test users, 3597 common users
User sample counts range: 525 (max) to 17 (min)
Distributed ALL 3597 users across 20 clients
Users per client: 179 (with 17 clients getting +1 user)
Train partition sizes: [36360, 37070, 35957, 38262, 36024, 37732, 36921, 38328, 36867, 37683, 36507, 36915, 36007, 37001, 35681, 35453, 36585, 36801, 35964, 36345]
Test partition sizes: [4128, 4203, 4081, 4333, 4091, 4287, 4193, 4349, 4191, 4277, 4143, 4193, 4093, 4197, 4052, 4029, 4153, 4183, 4084, 4128]
  Client 0: 36360 train samples, 62 unique classes
  Client 1: 37070 train samples, 62 unique classes
  Client 2: 35957 train samples, 62 unique classes
  Client 3: 38262 train samples, 62 unique classes
  Client 4: 36024 train samples, 62 unique classes
  Client 5: 37732 train samples, 62 unique classes
  Client 6: 36921 train samples, 62 unique classes
  Client 7: 38328 train samples, 62 unique classes
  Client 8: 36867 train samples, 62 unique classes
  Client 9: 37683 train samples, 62 unique classes
  Client 10: 36507 train samples, 62 unique classes
  Client 11: 36915 train samples, 62 unique classes
  Client 12: 36007 train samples, 62 unique classes
  Client 13: 37001 train samples, 62 unique classes
  Client 14: 35681 train samples, 62 unique classes
  Client 15: 35453 train samples, 62 unique classes
  Client 16: 36585 train samples, 62 unique classes
  Client 17: 36801 train samples, 62 unique classes
  Client 18: 35964 train samples, 62 unique classes
  Client 19: 36345 train samples, 62 unique classes
Will sample 10000 samples per client per epoch
Graph: erdos, nodes: 20, edges: 126
Degree statistics: avg=12.60, min=8, max=16
Attack: Compromised 10/20 nodes: [1, 2, 5, 11, 12, 13, 14, 15, 17, 18]
Attack type: directed_deviation, lambda: 1.0
Model variant: baseline
Model parameters: 6,603,710
Sketchguard Node 0:
  Model dim: 6,603,710 → Sketch size: 1000
  Compression ratio: 6603.7x
  Using model parameters for aggregation, sketches for filtering
Sketchguard Node 1:
  Model dim: 6,603,710 → Sketch size: 1000
  Compression ratio: 6603.7x
  Using model parameters for aggregation, sketches for filtering
Sketchguard Node 2:
  Model dim: 6,603,710 → Sketch size: 1000
  Compression ratio: 6603.7x
  Using model parameters for aggregation, sketches for filtering
Sketchguard Node 3:
  Model dim: 6,603,710 → Sketch size: 1000
  Compression ratio: 6603.7x
  Using model parameters for aggregation, sketches for filtering
Sketchguard Node 4:
  Model dim: 6,603,710 → Sketch size: 1000
  Compression ratio: 6603.7x
  Using model parameters for aggregation, sketches for filtering
Sketchguard Node 5:
  Model dim: 6,603,710 → Sketch size: 1000
  Compression ratio: 6603.7x
  Using model parameters for aggregation, sketches for filtering
Sketchguard Node 6:
  Model dim: 6,603,710 → Sketch size: 1000
  Compression ratio: 6603.7x
  Using model parameters for aggregation, sketches for filtering
Sketchguard Node 7:
  Model dim: 6,603,710 → Sketch size: 1000
  Compression ratio: 6603.7x
  Using model parameters for aggregation, sketches for filtering
Sketchguard Node 8:
  Model dim: 6,603,710 → Sketch size: 1000
  Compression ratio: 6603.7x
  Using model parameters for aggregation, sketches for filtering
Sketchguard Node 9:
  Model dim: 6,603,710 → Sketch size: 1000
  Compression ratio: 6603.7x
  Using model parameters for aggregation, sketches for filtering
Sketchguard Node 10:
  Model dim: 6,603,710 → Sketch size: 1000
  Compression ratio: 6603.7x
  Using model parameters for aggregation, sketches for filtering
Sketchguard Node 11:
  Model dim: 6,603,710 → Sketch size: 1000
  Compression ratio: 6603.7x
  Using model parameters for aggregation, sketches for filtering
Sketchguard Node 12:
  Model dim: 6,603,710 → Sketch size: 1000
  Compression ratio: 6603.7x
  Using model parameters for aggregation, sketches for filtering
Sketchguard Node 13:
  Model dim: 6,603,710 → Sketch size: 1000
  Compression ratio: 6603.7x
  Using model parameters for aggregation, sketches for filtering
Sketchguard Node 14:
  Model dim: 6,603,710 → Sketch size: 1000
  Compression ratio: 6603.7x
  Using model parameters for aggregation, sketches for filtering
Sketchguard Node 15:
  Model dim: 6,603,710 → Sketch size: 1000
  Compression ratio: 6603.7x
  Using model parameters for aggregation, sketches for filtering
Sketchguard Node 16:
  Model dim: 6,603,710 → Sketch size: 1000
  Compression ratio: 6603.7x
  Using model parameters for aggregation, sketches for filtering
Sketchguard Node 17:
  Model dim: 6,603,710 → Sketch size: 1000
  Compression ratio: 6603.7x
  Using model parameters for aggregation, sketches for filtering
Sketchguard Node 18:
  Model dim: 6,603,710 → Sketch size: 1000
  Compression ratio: 6603.7x
  Using model parameters for aggregation, sketches for filtering
Sketchguard Node 19:
  Model dim: 6,603,710 → Sketch size: 1000
  Compression ratio: 6603.7x
  Using model parameters for aggregation, sketches for filtering
Sketchguard ALGORITHM (Sketch-based Filtering + State Aggregation)
  - Model dimension: 6,603,710 parameters
  - Config: SketchguardConfig(gamma=2, kappa=1, alpha=0.5, min_neighbors=1, sketch_size=1000, network_seed=987654321, attack_detection_window=5)
  - Sketch size: 1000
  - Compression ratio: 6603.7x
  - Complexity: O(d + N×k) = O(6,603,710 + 20×1000)
  - Theoretical speedup vs BALANCE: 19.9x
Initial test acc across nodes: mean=0.0168 ± 0.0139
Round 001: test acc mean=0.4998 ± 0.0354 | min=0.4406 max=0.5941
         : test loss mean=3.7331 ± 0.0273
         : individual accs = ['0.546269', '0.490840', '0.541044', '0.474036', '0.480567', '0.594122', '0.495349', '0.511382', '0.482701', '0.446809', '0.499155', '0.517768', '0.451747', '0.474625', '0.519250', '0.525192', '0.440645', '0.510399', '0.494368', '0.500000']
         : correct/total = [(2255, 4128), (2063, 4203), (2208, 4081), (2054, 4333), (1966, 4091), (2547, 4287), (2077, 4193), (2224, 4349), (2023, 4191), (1911, 4277), (2068, 4143), (2171, 4193), (1849, 4093), (1992, 4197), (2104, 4052), (2116, 4029), (1830, 4153), (2135, 4183), (2019, 4084), (2064, 4128)]
         : compromised: 0.5119, honest: 0.4877
         : sketchguard stats = ['Node 0: acc_rate=0.500', 'Node 1: acc_rate=0.545', 'Node 2: acc_rate=0.417']...
Round 002: test acc mean=0.6727 ± 0.0195 | min=0.6212 max=0.7052
         : test loss mean=3.3314 ± 0.1116
         : individual accs = ['0.687016', '0.678563', '0.652291', '0.703670', '0.684185', '0.705155', '0.654901', '0.672109', '0.675495', '0.671499', '0.679701', '0.641307', '0.655998', '0.680248', '0.675716', '0.621246', '0.683602', '0.688501', '0.665524', '0.677810']
         : correct/total = [(2836, 4128), (2852, 4203), (2662, 4081), (3049, 4333), (2799, 4091), (3023, 4287), (2746, 4193), (2923, 4349), (2831, 4191), (2872, 4277), (2816, 4143), (2689, 4193), (2685, 4093), (2855, 4197), (2738, 4052), (2503, 4029), (2839, 4153), (2880, 4183), (2718, 4084), (2798, 4128)]
         : compromised: 0.6665, honest: 0.6790
         : sketchguard stats = ['Node 0: acc_rate=0.500', 'Node 1: acc_rate=0.545', 'Node 2: acc_rate=0.417']...
Round 003: test acc mean=0.6758 ± 0.0449 | min=0.5606 max=0.7339
         : test loss mean=2.8318 ± 0.2548
         : individual accs = ['0.713178', '0.683321', '0.613820', '0.733903', '0.719628', '0.673898', '0.697353', '0.717406', '0.702935', '0.714052', '0.704079', '0.590269', '0.668214', '0.623541', '0.659427', '0.682552', '0.674934', '0.560602', '0.677277', '0.706153']
         : correct/total = [(2944, 4128), (2872, 4203), (2505, 4081), (3180, 4333), (2944, 4091), (2889, 4287), (2924, 4193), (3120, 4349), (2946, 4191), (3054, 4277), (2917, 4143), (2475, 4193), (2735, 4093), (2617, 4197), (2672, 4052), (2750, 4029), (2803, 4153), (2345, 4183), (2766, 4084), (2915, 4128)]
         : compromised: 0.6433, honest: 0.7084
         : sketchguard stats = ['Node 0: acc_rate=0.500', 'Node 1: acc_rate=0.545', 'Node 2: acc_rate=0.417']...
Round 004: test acc mean=0.6807 ± 0.0369 | min=0.6205 max=0.7452
         : test loss mean=2.0699 ± 0.2642
         : individual accs = ['0.697190', '0.662384', '0.644940', '0.745211', '0.727695', '0.640075', '0.715478', '0.728213', '0.722978', '0.701426', '0.697321', '0.655855', '0.635720', '0.633548', '0.659427', '0.679573', '0.721888', '0.665073', '0.620470', '0.658915']
         : correct/total = [(2878, 4128), (2784, 4203), (2632, 4081), (3229, 4333), (2977, 4091), (2744, 4287), (3000, 4193), (3167, 4349), (3030, 4191), (3000, 4277), (2889, 4143), (2750, 4193), (2602, 4093), (2659, 4197), (2672, 4052), (2738, 4029), (2998, 4153), (2782, 4183), (2534, 4084), (2720, 4128)]
         : compromised: 0.6497, honest: 0.7116
         : sketchguard stats = ['Node 0: acc_rate=0.500', 'Node 1: acc_rate=0.545', 'Node 2: acc_rate=0.417']...
Round 005: test acc mean=0.7296 ± 0.0302 | min=0.6828 max=0.7777
         : test loss mean=1.2769 ± 0.1664
         : individual accs = ['0.742733', '0.691887', '0.730948', '0.768059', '0.771938', '0.724049', '0.738612', '0.777650', '0.737771', '0.773206', '0.741492', '0.682805', '0.698754', '0.689302', '0.727295', '0.693969', '0.755598', '0.735596', '0.683643', '0.726502']
         : correct/total = [(3066, 4128), (2908, 4203), (2983, 4081), (3328, 4333), (3158, 4091), (3104, 4287), (3097, 4193), (3382, 4349), (3092, 4191), (3307, 4277), (3072, 4143), (2863, 4193), (2860, 4093), (2893, 4197), (2947, 4052), (2796, 4029), (3138, 4153), (3077, 4183), (2792, 4084), (2999, 4128)]
         : compromised: 0.7058, honest: 0.7534
         : sketchguard stats = ['Node 0: acc_rate=0.500', 'Node 1: acc_rate=0.545', 'Node 2: acc_rate=0.417']...
Round 006: test acc mean=0.7971 ± 0.0089 | min=0.7806 max=0.8096
         : test loss mean=0.7547 ± 0.0481
         : individual accs = ['0.802326', '0.802760', '0.809605', '0.802446', '0.806893', '0.798227', '0.800859', '0.805932', '0.795514', '0.808043', '0.795076', '0.791557', '0.787931', '0.781272', '0.801086', '0.783569', '0.806646', '0.793450', '0.780607', '0.787306']
         : correct/total = [(3312, 4128), (3374, 4203), (3304, 4081), (3477, 4333), (3301, 4091), (3422, 4287), (3358, 4193), (3505, 4349), (3334, 4191), (3456, 4277), (3294, 4143), (3319, 4193), (3225, 4093), (3279, 4197), (3246, 4052), (3157, 4029), (3350, 4153), (3319, 4183), (3188, 4084), (3250, 4128)]
         : compromised: 0.7930, honest: 0.8011
         : sketchguard stats = ['Node 0: acc_rate=0.500', 'Node 1: acc_rate=0.545', 'Node 2: acc_rate=0.417']...
Round 007: test acc mean=0.8226 ± 0.0094 | min=0.8027 max=0.8397
         : test loss mean=0.5781 ± 0.0265
         : individual accs = ['0.821948', '0.826077', '0.830924', '0.824602', '0.838670', '0.821554', '0.818984', '0.839733', '0.819852', '0.834463', '0.807869', '0.815645', '0.827022', '0.821777', '0.821076', '0.802681', '0.827595', '0.808033', '0.827620', '0.816618']
         : correct/total = [(3393, 4128), (3472, 4203), (3391, 4081), (3573, 4333), (3431, 4091), (3522, 4287), (3434, 4193), (3652, 4349), (3436, 4191), (3569, 4277), (3347, 4143), (3420, 4193), (3385, 4093), (3449, 4197), (3327, 4052), (3234, 4029), (3437, 4153), (3380, 4183), (3380, 4084), (3371, 4128)]
         : compromised: 0.8202, honest: 0.8250
         : sketchguard stats = ['Node 0: acc_rate=0.500', 'Node 1: acc_rate=0.545', 'Node 2: acc_rate=0.417']...
Round 008: test acc mean=0.8336 ± 0.0073 | min=0.8156 max=0.8432
         : test loss mean=0.5182 ± 0.0237
         : individual accs = ['0.832122', '0.839638', '0.843176', '0.836834', '0.842826', '0.834850', '0.831147', '0.842952', '0.835123', '0.842413', '0.824282', '0.827570', '0.838016', '0.834644', '0.826259', '0.815587', '0.835541', '0.824767', '0.837904', '0.827277']
         : correct/total = [(3435, 4128), (3529, 4203), (3441, 4081), (3626, 4333), (3448, 4091), (3579, 4287), (3485, 4193), (3666, 4349), (3500, 4191), (3603, 4277), (3415, 4143), (3470, 4193), (3430, 4093), (3503, 4197), (3348, 4052), (3286, 4029), (3470, 4153), (3450, 4183), (3422, 4084), (3415, 4128)]
         : compromised: 0.8322, honest: 0.8351
         : sketchguard stats = ['Node 0: acc_rate=0.500', 'Node 1: acc_rate=0.545', 'Node 2: acc_rate=0.417']...
Round 009: test acc mean=0.8402 ± 0.0070 | min=0.8302 max=0.8561
         : test loss mean=0.4876 ± 0.0214
         : individual accs = ['0.834545', '0.847728', '0.850282', '0.840526', '0.846492', '0.844880', '0.832817', '0.856059', '0.834407', '0.847791', '0.831282', '0.833055', '0.840948', '0.842030', '0.836624', '0.830231', '0.844691', '0.834090', '0.841087', '0.834787']
         : correct/total = [(3445, 4128), (3563, 4203), (3470, 4081), (3642, 4333), (3463, 4091), (3622, 4287), (3492, 4193), (3723, 4349), (3497, 4191), (3626, 4277), (3444, 4143), (3493, 4193), (3442, 4093), (3534, 4197), (3390, 4052), (3345, 4029), (3508, 4153), (3489, 4183), (3435, 4084), (3446, 4128)]
         : compromised: 0.8401, honest: 0.8403
         : sketchguard stats = ['Node 0: acc_rate=0.500', 'Node 1: acc_rate=0.545', 'Node 2: acc_rate=0.417']...
Round 010: test acc mean=0.8456 ± 0.0071 | min=0.8333 max=0.8577
         : test loss mean=0.4689 ± 0.0213
         : individual accs = ['0.842539', '0.853914', '0.855183', '0.847219', '0.854559', '0.848379', '0.838302', '0.857668', '0.841565', '0.849895', '0.838764', '0.833294', '0.851942', '0.845366', '0.844768', '0.835939', '0.849506', '0.840306', '0.848678', '0.834787']
         : correct/total = [(3478, 4128), (3589, 4203), (3490, 4081), (3671, 4333), (3496, 4091), (3637, 4287), (3515, 4193), (3730, 4349), (3527, 4191), (3635, 4277), (3475, 4143), (3494, 4193), (3487, 4093), (3548, 4197), (3423, 4052), (3368, 4029), (3528, 4153), (3515, 4183), (3466, 4084), (3446, 4128)]
         : compromised: 0.8458, honest: 0.8455
         : sketchguard stats = ['Node 0: acc_rate=0.500', 'Node 1: acc_rate=0.545', 'Node 2: acc_rate=0.417']...

=== FINAL RESULTS ===
Dataset: femnist, Nodes: 20, Graph: erdos, Aggregation: sketchguard
Attack: directed_deviation, 50.0% compromised
Final accuracy - Compromised: 0.8458, Honest: 0.8455
Overall test accuracy: mean=0.8456 ± 0.0071

=== Sketchguard SUMMARY ===
Node 0: acceptance=0.500
Node 1: acceptance=0.545
Node 2: acceptance=0.417
Node 3: acceptance=0.625
Node 4: acceptance=0.455
Node 5: acceptance=0.467
Node 6: acceptance=0.429
Node 7: acceptance=0.429
Node 8: acceptance=0.400
Node 9: acceptance=0.538
Node 10: acceptance=0.556
Node 11: acceptance=0.500
Node 12: acceptance=0.583
Node 13: acceptance=0.538
Node 14: acceptance=0.467
Node 15: acceptance=0.455
Node 16: acceptance=0.385
Node 17: acceptance=0.667
Node 18: acceptance=0.562
Node 19: acceptance=0.438

=== PARALLEL EXECUTION TIME (realistic for distributed system) ===
  COMMUNICATION (max across nodes):
    - Sketch transfer: 0.000s (0.0%)
    - Model fetch (accepted): 0.000s (0.0%)
  COMPUTATION (max across nodes):
    - Sketching: 4.102s (99.5%)
    - Filtering: 0.002s (0.0%)
    - Aggregation: 0.020s (0.5%)
  TOTALS:
    - Total computation: 4.124s (100.0%)
    - Total communication: 0.000s (0.0%)
    - Total parallel time: 4.124s

=== PER-NODE AVERAGE TIME ===
  - Sketching: 2.977s
  - Filtering: 0.001s
  - Aggregation: 0.014s
  - Sketch transfer: 0.000s
  - Model fetch: 0.000s
  - Total per node: 2.992s

=== TOTAL COMPUTATIONAL WORK (sum across all nodes) ===
  - Total sketching: 59.545s
  - Total filtering: 0.022s
  - Total aggregation: 0.278s
  - Total sketch transfer: 0.000s
  - Total model fetch: 0.000s
  - Grand total: 59.846s
  - Mean acceptance rate: 0.498

Sketchguard Algorithm Properties:
  - Original dimension: 6,603,710
  - Sketch size: 1000
  - Compression ratio: 19.9x
  - Single repetition: No repetitions needed
  - Theoretical complexity: O(d + N×k)
  - Approach: Sketch filtering + state aggregation
