Device: cuda
Seed: 987654321
Loading 36 LEAF FEMNIST train files...
LEAF FEMNIST train: 3597 users, 734463 samples
Loading 36 LEAF FEMNIST test files...
LEAF FEMNIST test: 3597 users, 83388 samples
Found 3597 train users, 3597 test users, 3597 common users
User sample counts range: 525 (max) to 17 (min)
Distributed ALL 3597 users across 20 clients
Users per client: 179 (with 17 clients getting +1 user)
Train partition sizes: [36360, 37070, 35957, 38262, 36024, 37732, 36921, 38328, 36867, 37683, 36507, 36915, 36007, 37001, 35681, 35453, 36585, 36801, 35964, 36345]
Test partition sizes: [4128, 4203, 4081, 4333, 4091, 4287, 4193, 4349, 4191, 4277, 4143, 4193, 4093, 4197, 4052, 4029, 4153, 4183, 4084, 4128]
  Client 0: 36360 train samples, 62 unique classes
  Client 1: 37070 train samples, 62 unique classes
  Client 2: 35957 train samples, 62 unique classes
  Client 3: 38262 train samples, 62 unique classes
  Client 4: 36024 train samples, 62 unique classes
  Client 5: 37732 train samples, 62 unique classes
  Client 6: 36921 train samples, 62 unique classes
  Client 7: 38328 train samples, 62 unique classes
  Client 8: 36867 train samples, 62 unique classes
  Client 9: 37683 train samples, 62 unique classes
  Client 10: 36507 train samples, 62 unique classes
  Client 11: 36915 train samples, 62 unique classes
  Client 12: 36007 train samples, 62 unique classes
  Client 13: 37001 train samples, 62 unique classes
  Client 14: 35681 train samples, 62 unique classes
  Client 15: 35453 train samples, 62 unique classes
  Client 16: 36585 train samples, 62 unique classes
  Client 17: 36801 train samples, 62 unique classes
  Client 18: 35964 train samples, 62 unique classes
  Client 19: 36345 train samples, 62 unique classes
Will sample 10000 samples per client per epoch
Graph: fully, nodes: 20, edges: 190
Degree statistics: avg=19.00, min=19, max=19
Attack: Compromised 8/20 nodes: [1, 5, 11, 12, 13, 14, 17, 18]
Attack type: backdoor, lambda: 1.0
Backdoor target label: 0, trigger size: 4
Model variant: baseline
Model parameters: 6,603,710
Sketchguard Node 0:
  Model dim: 6,603,710 → Sketch size: 1000
  Compression ratio: 6603.7x
  Using model parameters for aggregation, sketches for filtering
Sketchguard Node 1:
  Model dim: 6,603,710 → Sketch size: 1000
  Compression ratio: 6603.7x
  Using model parameters for aggregation, sketches for filtering
Sketchguard Node 2:
  Model dim: 6,603,710 → Sketch size: 1000
  Compression ratio: 6603.7x
  Using model parameters for aggregation, sketches for filtering
Sketchguard Node 3:
  Model dim: 6,603,710 → Sketch size: 1000
  Compression ratio: 6603.7x
  Using model parameters for aggregation, sketches for filtering
Sketchguard Node 4:
  Model dim: 6,603,710 → Sketch size: 1000
  Compression ratio: 6603.7x
  Using model parameters for aggregation, sketches for filtering
Sketchguard Node 5:
  Model dim: 6,603,710 → Sketch size: 1000
  Compression ratio: 6603.7x
  Using model parameters for aggregation, sketches for filtering
Sketchguard Node 6:
  Model dim: 6,603,710 → Sketch size: 1000
  Compression ratio: 6603.7x
  Using model parameters for aggregation, sketches for filtering
Sketchguard Node 7:
  Model dim: 6,603,710 → Sketch size: 1000
  Compression ratio: 6603.7x
  Using model parameters for aggregation, sketches for filtering
Sketchguard Node 8:
  Model dim: 6,603,710 → Sketch size: 1000
  Compression ratio: 6603.7x
  Using model parameters for aggregation, sketches for filtering
Sketchguard Node 9:
  Model dim: 6,603,710 → Sketch size: 1000
  Compression ratio: 6603.7x
  Using model parameters for aggregation, sketches for filtering
Sketchguard Node 10:
  Model dim: 6,603,710 → Sketch size: 1000
  Compression ratio: 6603.7x
  Using model parameters for aggregation, sketches for filtering
Sketchguard Node 11:
  Model dim: 6,603,710 → Sketch size: 1000
  Compression ratio: 6603.7x
  Using model parameters for aggregation, sketches for filtering
Sketchguard Node 12:
  Model dim: 6,603,710 → Sketch size: 1000
  Compression ratio: 6603.7x
  Using model parameters for aggregation, sketches for filtering
Sketchguard Node 13:
  Model dim: 6,603,710 → Sketch size: 1000
  Compression ratio: 6603.7x
  Using model parameters for aggregation, sketches for filtering
Sketchguard Node 14:
  Model dim: 6,603,710 → Sketch size: 1000
  Compression ratio: 6603.7x
  Using model parameters for aggregation, sketches for filtering
Sketchguard Node 15:
  Model dim: 6,603,710 → Sketch size: 1000
  Compression ratio: 6603.7x
  Using model parameters for aggregation, sketches for filtering
Sketchguard Node 16:
  Model dim: 6,603,710 → Sketch size: 1000
  Compression ratio: 6603.7x
  Using model parameters for aggregation, sketches for filtering
Sketchguard Node 17:
  Model dim: 6,603,710 → Sketch size: 1000
  Compression ratio: 6603.7x
  Using model parameters for aggregation, sketches for filtering
Sketchguard Node 18:
  Model dim: 6,603,710 → Sketch size: 1000
  Compression ratio: 6603.7x
  Using model parameters for aggregation, sketches for filtering
Sketchguard Node 19:
  Model dim: 6,603,710 → Sketch size: 1000
  Compression ratio: 6603.7x
  Using model parameters for aggregation, sketches for filtering
Sketchguard ALGORITHM (Sketch-based Filtering + State Aggregation)
  - Model dimension: 6,603,710 parameters
  - Config: SketchguardConfig(gamma=2, kappa=1, alpha=0.5, min_neighbors=1, sketch_size=1000, network_seed=987654321, attack_detection_window=5)
  - Sketch size: 1000
  - Compression ratio: 6603.7x
  - Complexity: O(d + N×k) = O(6,603,710 + 20×1000)
  - Theoretical speedup vs BALANCE: 19.9x
Initial test acc across nodes: mean=0.0168 ± 0.0139
Backdoor attack: Created poisoned datasets for 8 compromised nodes
Round 001: test acc mean=0.3546 ± 0.2040 | min=0.0488 max=0.5638
         : test loss mean=6958.6420 ± 8785.6125
         : individual accs = ['0.562258', '0.048775', '0.563832', '0.533118', '0.517722', '0.214136', '0.520391', '0.515981', '0.518253', '0.456161', '0.527154', '0.107083', '0.054239', '0.049083', '0.150049', '0.525441', '0.463039', '0.154913', '0.103330', '0.506298']
         : correct/total = [(2321, 4128), (205, 4203), (2301, 4081), (2310, 4333), (2118, 4091), (918, 4287), (2182, 4193), (2244, 4349), (2172, 4191), (1951, 4277), (2184, 4143), (449, 4193), (222, 4093), (206, 4197), (608, 4052), (2117, 4029), (1923, 4153), (648, 4183), (422, 4084), (2090, 4128)]
         : compromised: 0.1102, honest: 0.5175
         : sketchguard stats = ['Node 0: acc_rate=0.579', 'Node 1: acc_rate=0.632', 'Node 2: acc_rate=0.579']...
Round 002: test acc mean=0.4240 ± 0.3111 | min=0.0057 max=0.7018
         : test loss mean=63772.6435 ± 227870.1793
         : individual accs = ['0.687016', '0.052344', '0.680470', '0.701823', '0.689318', '0.048752', '0.660386', '0.685905', '0.662610', '0.669862', '0.692011', '0.049606', '0.043978', '0.049321', '0.048124', '0.658228', '0.672526', '0.005738', '0.048482', '0.673450']
         : correct/total = [(2836, 4128), (220, 4203), (2777, 4081), (3041, 4333), (2820, 4091), (209, 4287), (2769, 4193), (2983, 4349), (2777, 4191), (2865, 4277), (2867, 4143), (208, 4193), (180, 4093), (207, 4197), (195, 4052), (2652, 4029), (2793, 4153), (24, 4183), (198, 4084), (2780, 4128)]
         : compromised: 0.0433, honest: 0.6778
         : sketchguard stats = ['Node 0: acc_rate=0.579', 'Node 1: acc_rate=0.816', 'Node 2: acc_rate=0.579']...
Round 003: test acc mean=0.4429 ± 0.3208 | min=0.0460 max=0.7272
         : test loss mean=nan ± nan
         : individual accs = ['0.720688', '0.048775', '0.690027', '0.719825', '0.727206', '0.045953', '0.686382', '0.716716', '0.698401', '0.710779', '0.689838', '0.049606', '0.054239', '0.049083', '0.051826', '0.700174', '0.682639', '0.049486', '0.052889', '0.713663']
         : correct/total = [(2975, 4128), (205, 4203), (2816, 4081), (3119, 4333), (2975, 4091), (197, 4287), (2878, 4193), (3117, 4349), (2927, 4191), (3040, 4277), (2858, 4143), (208, 4193), (222, 4093), (206, 4197), (210, 4052), (2821, 4029), (2835, 4153), (207, 4183), (216, 4084), (2946, 4128)]
         : compromised: 0.0502, honest: 0.7047
         : sketchguard stats = ['Node 0: acc_rate=0.579', 'Node 1: acc_rate=0.877', 'Node 2: acc_rate=0.579']...
Round 004: test acc mean=0.4232 ± 0.3053 | min=0.0453 max=0.7085
         : test loss mean=nan ± nan
         : individual accs = ['0.656008', '0.048775', '0.680716', '0.708516', '0.666096', '0.045253', '0.689959', '0.698781', '0.686710', '0.653262', '0.644943', '0.049606', '0.054239', '0.049083', '0.051826', '0.660213', '0.701661', '0.049486', '0.052889', '0.616764']
         : correct/total = [(2708, 4128), (205, 4203), (2778, 4081), (3070, 4333), (2725, 4091), (194, 4287), (2893, 4193), (3039, 4349), (2878, 4191), (2794, 4277), (2672, 4143), (208, 4193), (222, 4093), (206, 4197), (210, 4052), (2660, 4029), (2914, 4153), (207, 4183), (216, 4084), (2546, 4128)]
         : compromised: 0.0501, honest: 0.6720
         : sketchguard stats = ['Node 0: acc_rate=0.579', 'Node 1: acc_rate=0.658', 'Node 2: acc_rate=0.579']...
Round 005: test acc mean=0.4309 ± 0.3117 | min=0.0453 max=0.7347
         : test loss mean=nan ± nan
         : individual accs = ['0.664971', '0.048775', '0.686351', '0.699285', '0.707407', '0.045253', '0.687098', '0.734652', '0.665474', '0.727145', '0.661357', '0.049606', '0.054239', '0.049083', '0.051826', '0.631919', '0.697568', '0.049486', '0.052889', '0.654070']
         : correct/total = [(2745, 4128), (205, 4203), (2801, 4081), (3030, 4333), (2894, 4091), (194, 4287), (2881, 4193), (3195, 4349), (2789, 4191), (3110, 4277), (2740, 4143), (208, 4193), (222, 4093), (206, 4197), (210, 4052), (2546, 4029), (2897, 4153), (207, 4183), (216, 4084), (2700, 4128)]
         : compromised: 0.0501, honest: 0.6848
         : sketchguard stats = ['Node 0: acc_rate=0.579', 'Node 1: acc_rate=0.526', 'Node 2: acc_rate=0.579']...
Round 006: test acc mean=0.4870 ± 0.3568 | min=0.0453 max=0.7896
         : test loss mean=nan ± nan
         : individual accs = ['0.772771', '0.048775', '0.784367', '0.774521', '0.788071', '0.045253', '0.775101', '0.782019', '0.777857', '0.789572', '0.768767', '0.049606', '0.054239', '0.049083', '0.051826', '0.765202', '0.785938', '0.049486', '0.052889', '0.775194']
         : correct/total = [(3190, 4128), (205, 4203), (3201, 4081), (3356, 4333), (3224, 4091), (194, 4287), (3250, 4193), (3401, 4349), (3260, 4191), (3377, 4277), (3185, 4143), (208, 4193), (222, 4093), (206, 4197), (210, 4052), (3083, 4029), (3264, 4153), (207, 4183), (216, 4084), (3200, 4128)]
         : compromised: 0.0501, honest: 0.7783
         : sketchguard stats = ['Node 0: acc_rate=0.579', 'Node 1: acc_rate=0.439', 'Node 2: acc_rate=0.579']...
Round 007: test acc mean=0.5108 ± 0.3762 | min=0.0453 max=0.8321
         : test loss mean=nan ± nan
         : individual accs = ['0.819525', '0.048775', '0.824308', '0.820909', '0.832070', '0.045253', '0.811591', '0.831915', '0.812455', '0.828618', '0.794111', '0.049606', '0.054239', '0.049083', '0.051826', '0.803922', '0.822056', '0.049486', '0.052889', '0.813711']
         : correct/total = [(3383, 4128), (205, 4203), (3364, 4081), (3557, 4333), (3404, 4091), (194, 4287), (3403, 4193), (3618, 4349), (3405, 4191), (3544, 4277), (3290, 4143), (208, 4193), (222, 4093), (206, 4197), (210, 4052), (3239, 4029), (3414, 4153), (207, 4183), (216, 4084), (3359, 4128)]
         : compromised: 0.0501, honest: 0.8179
         : sketchguard stats = ['Node 0: acc_rate=0.579', 'Node 1: acc_rate=0.376', 'Node 2: acc_rate=0.579']...
Round 008: test acc mean=0.5192 ± 0.3831 | min=0.0453 max=0.8423
         : test loss mean=nan ± nan
         : individual accs = ['0.828973', '0.048775', '0.839990', '0.833141', '0.842092', '0.045253', '0.824946', '0.842263', '0.830828', '0.838438', '0.824041', '0.049606', '0.054239', '0.049083', '0.051826', '0.814346', '0.833373', '0.049486', '0.052889', '0.830911']
         : correct/total = [(3422, 4128), (205, 4203), (3428, 4081), (3610, 4333), (3445, 4091), (194, 4287), (3459, 4193), (3663, 4349), (3482, 4191), (3586, 4277), (3414, 4143), (208, 4193), (222, 4093), (206, 4197), (210, 4052), (3281, 4029), (3461, 4153), (207, 4183), (216, 4084), (3430, 4128)]
         : compromised: 0.0501, honest: 0.8319
         : sketchguard stats = ['Node 0: acc_rate=0.579', 'Node 1: acc_rate=0.329', 'Node 2: acc_rate=0.579']...
Round 009: test acc mean=0.5242 ± 0.3871 | min=0.0453 max=0.8544
         : test loss mean=nan ± nan
         : individual accs = ['0.829700', '0.048775', '0.853957', '0.843988', '0.847226', '0.045253', '0.830432', '0.854449', '0.837032', '0.847323', '0.831523', '0.049606', '0.054239', '0.049083', '0.051826', '0.830727', '0.845654', '0.049486', '0.052889', '0.830184']
         : correct/total = [(3425, 4128), (205, 4203), (3485, 4081), (3657, 4333), (3466, 4091), (194, 4287), (3482, 4193), (3716, 4349), (3508, 4191), (3624, 4277), (3445, 4143), (208, 4193), (222, 4093), (206, 4197), (210, 4052), (3347, 4029), (3512, 4153), (207, 4183), (216, 4084), (3427, 4128)]
         : compromised: 0.0501, honest: 0.8402
         : sketchguard stats = ['Node 0: acc_rate=0.579', 'Node 1: acc_rate=0.292', 'Node 2: acc_rate=0.579']...
Round 010: test acc mean=0.5271 ± 0.3895 | min=0.0453 max=0.8550
         : test loss mean=nan ± nan
         : individual accs = ['0.840116', '0.048775', '0.851017', '0.848142', '0.855048', '0.045253', '0.834009', '0.854909', '0.846099', '0.852233', '0.838764', '0.049606', '0.054239', '0.049083', '0.051826', '0.836932', '0.850229', '0.049486', '0.052889', '0.833333']
         : correct/total = [(3468, 4128), (205, 4203), (3473, 4081), (3675, 4333), (3498, 4091), (194, 4287), (3497, 4193), (3718, 4349), (3546, 4191), (3645, 4277), (3475, 4143), (208, 4193), (222, 4093), (206, 4197), (210, 4052), (3372, 4029), (3531, 4153), (207, 4183), (216, 4084), (3440, 4128)]
         : compromised: 0.0501, honest: 0.8451
         : sketchguard stats = ['Node 0: acc_rate=0.579', 'Node 1: acc_rate=0.263', 'Node 2: acc_rate=0.579']...

=== FINAL RESULTS ===
Dataset: femnist, Nodes: 20, Graph: fully, Aggregation: sketchguard
Attack: backdoor, 40.0% compromised
Final accuracy - Compromised: 0.0501, Honest: 0.8451
Overall test accuracy: mean=0.5271 ± 0.3895

=== BACKDOOR ATTACK SUCCESS RATE (ASR) ===
Target label: 0
Trigger size: 4x4
Overall ASR: 0.4302 ± 0.4653
Honest nodes ASR: 0.0503 ± 0.0040
Compromised nodes ASR: 1.0000 ± 0.0000
Note: Higher ASR indicates more successful backdoor attack

=== Sketchguard SUMMARY ===
Node 0: acceptance=0.579
Node 1: acceptance=0.263
Node 2: acceptance=0.579
Node 3: acceptance=0.579
Node 4: acceptance=0.579
Node 5: acceptance=0.263
Node 6: acceptance=0.579
Node 7: acceptance=0.579
Node 8: acceptance=0.579
Node 9: acceptance=0.579
Node 10: acceptance=0.579
Node 11: acceptance=0.263
Node 12: acceptance=0.263
Node 13: acceptance=0.263
Node 14: acceptance=0.263
Node 15: acceptance=0.579
Node 16: acceptance=0.579
Node 17: acceptance=0.263
Node 18: acceptance=0.263
Node 19: acceptance=0.579

=== PARALLEL EXECUTION TIME (realistic for distributed system) ===
  COMMUNICATION (max across nodes):
    - Sketch transfer: 0.000s (0.0%)
    - Model fetch (accepted): 0.000s (0.0%)
  COMPUTATION (max across nodes):
    - Sketching: 4.356s (99.4%)
    - Filtering: 0.002s (0.0%)
    - Aggregation: 0.023s (0.5%)
  TOTALS:
    - Total computation: 4.381s (100.0%)
    - Total communication: 0.000s (0.0%)
    - Total parallel time: 4.381s

=== PER-NODE AVERAGE TIME ===
  - Sketching: 3.683s
  - Filtering: 0.001s
  - Aggregation: 0.017s
  - Sketch transfer: 0.000s
  - Model fetch: 0.000s
  - Total per node: 3.701s

=== TOTAL COMPUTATIONAL WORK (sum across all nodes) ===
  - Total sketching: 73.668s
  - Total filtering: 0.027s
  - Total aggregation: 0.334s
  - Total sketch transfer: 0.000s
  - Total model fetch: 0.000s
  - Grand total: 74.030s
  - Mean acceptance rate: 0.453

Sketchguard Algorithm Properties:
  - Original dimension: 6,603,710
  - Sketch size: 1000
  - Compression ratio: 19.9x
  - Single repetition: No repetitions needed
  - Theoretical complexity: O(d + N×k)
  - Approach: Sketch filtering + state aggregation
