Device: cuda
Seed: 987654321
Loading 36 LEAF FEMNIST train files...
LEAF FEMNIST train: 3597 users, 734463 samples
Loading 36 LEAF FEMNIST test files...
LEAF FEMNIST test: 3597 users, 83388 samples
Found 3597 train users, 3597 test users, 3597 common users
User sample counts range: 525 (max) to 17 (min)
Distributed ALL 3597 users across 20 clients
Users per client: 179 (with 17 clients getting +1 user)
Train partition sizes: [36360, 37070, 35957, 38262, 36024, 37732, 36921, 38328, 36867, 37683, 36507, 36915, 36007, 37001, 35681, 35453, 36585, 36801, 35964, 36345]
Test partition sizes: [4128, 4203, 4081, 4333, 4091, 4287, 4193, 4349, 4191, 4277, 4143, 4193, 4093, 4197, 4052, 4029, 4153, 4183, 4084, 4128]
  Client 0: 36360 train samples, 62 unique classes
  Client 1: 37070 train samples, 62 unique classes
  Client 2: 35957 train samples, 62 unique classes
  Client 3: 38262 train samples, 62 unique classes
  Client 4: 36024 train samples, 62 unique classes
  Client 5: 37732 train samples, 62 unique classes
  Client 6: 36921 train samples, 62 unique classes
  Client 7: 38328 train samples, 62 unique classes
  Client 8: 36867 train samples, 62 unique classes
  Client 9: 37683 train samples, 62 unique classes
  Client 10: 36507 train samples, 62 unique classes
  Client 11: 36915 train samples, 62 unique classes
  Client 12: 36007 train samples, 62 unique classes
  Client 13: 37001 train samples, 62 unique classes
  Client 14: 35681 train samples, 62 unique classes
  Client 15: 35453 train samples, 62 unique classes
  Client 16: 36585 train samples, 62 unique classes
  Client 17: 36801 train samples, 62 unique classes
  Client 18: 35964 train samples, 62 unique classes
  Client 19: 36345 train samples, 62 unique classes
Will sample 10000 samples per client per epoch
Graph: erdos, nodes: 20, edges: 48
Degree statistics: avg=4.80, min=2, max=7
Attack: Compromised 14/20 nodes: [1, 2, 3, 5, 6, 8, 11, 12, 13, 14, 15, 17, 18, 19]
Attack type: backdoor, lambda: 1.0
Backdoor target label: 0, trigger size: 4
Model variant: baseline
Model parameters: 6,603,710
Initial test acc across nodes: mean=0.0162 ± 0.0138
Backdoor attack: Created poisoned datasets for 14 compromised nodes
Round 001: test acc mean=0.0174 ± 0.0169 | min=0.0029 max=0.0520
         : test loss mean=103570.9477 ± 93673.2996
         : individual accs = ['0.005329', '0.021651', '0.049988', '0.006231', '0.036421', '0.004899', '0.002862', '0.017245', '0.018134', '0.004910', '0.004345', '0.003339', '0.052040', '0.047891', '0.004936', '0.002978', '0.003853', '0.010997', '0.012977', '0.037064']
         : correct/total = [(22, 4128), (91, 4203), (204, 4081), (27, 4333), (149, 4091), (21, 4287), (12, 4193), (75, 4349), (76, 4191), (21, 4277), (18, 4143), (14, 4193), (213, 4093), (201, 4197), (20, 4052), (12, 4029), (16, 4153), (46, 4183), (53, 4084), (153, 4128)]
         : compromised: 0.0197, honest: 0.0120
Round 002: test acc mean=0.0483 ± 0.0045 | min=0.0399 max=0.0597
         : test loss mean=nan ± nan
         : individual accs = ['0.049661', '0.045206', '0.043617', '0.039926', '0.045710', '0.052484', '0.045075', '0.049897', '0.044619', '0.043488', '0.048033', '0.048891', '0.047398', '0.047653', '0.044669', '0.054604', '0.050566', '0.049247', '0.059745', '0.054990']
         : correct/total = [(205, 4128), (190, 4203), (178, 4081), (173, 4333), (187, 4091), (225, 4287), (189, 4193), (217, 4349), (187, 4191), (186, 4277), (199, 4143), (205, 4193), (194, 4093), (200, 4197), (181, 4052), (220, 4029), (210, 4153), (206, 4183), (244, 4084), (227, 4128)]
         : compromised: 0.0484, honest: 0.0479
Round 003: test acc mean=0.0514 ± 0.0038 | min=0.0457 max=0.0615
         : test loss mean=nan ± nan
         : individual accs = ['0.049661', '0.048775', '0.061505', '0.049850', '0.045710', '0.052484', '0.053422', '0.049897', '0.057266', '0.048632', '0.048033', '0.048891', '0.047398', '0.047653', '0.055281', '0.054604', '0.050566', '0.049247', '0.054358', '0.054990']
         : correct/total = [(205, 4128), (205, 4203), (251, 4081), (216, 4333), (187, 4091), (225, 4287), (224, 4193), (217, 4349), (240, 4191), (208, 4277), (199, 4143), (205, 4193), (194, 4093), (200, 4197), (224, 4052), (220, 4029), (210, 4153), (206, 4183), (222, 4084), (227, 4128)]
         : compromised: 0.0526, honest: 0.0487
Round 004: test acc mean=0.0478 ± 0.0059 | min=0.0342 max=0.0550
         : test loss mean=nan ± nan
         : individual accs = ['0.034157', '0.048775', '0.035040', '0.049850', '0.045710', '0.052484', '0.038874', '0.049897', '0.053686', '0.050269', '0.048033', '0.048891', '0.047398', '0.047653', '0.050099', '0.054604', '0.041416', '0.049247', '0.054358', '0.054990']
         : correct/total = [(141, 4128), (205, 4203), (143, 4081), (216, 4333), (187, 4091), (225, 4287), (163, 4193), (217, 4349), (225, 4191), (215, 4277), (199, 4143), (205, 4193), (194, 4093), (200, 4197), (203, 4052), (220, 4029), (172, 4153), (206, 4183), (222, 4084), (227, 4128)]
         : compromised: 0.0490, honest: 0.0449
Round 005: test acc mean=0.0514 ± 0.0038 | min=0.0457 max=0.0615
         : test loss mean=nan ± nan
         : individual accs = ['0.049661', '0.048775', '0.061505', '0.049850', '0.045710', '0.052484', '0.053422', '0.049897', '0.057266', '0.048632', '0.048033', '0.048891', '0.047398', '0.047653', '0.055281', '0.054604', '0.050566', '0.049247', '0.054358', '0.054990']
         : correct/total = [(205, 4128), (205, 4203), (251, 4081), (216, 4333), (187, 4091), (225, 4287), (224, 4193), (217, 4349), (240, 4191), (208, 4277), (199, 4143), (205, 4193), (194, 4093), (200, 4197), (224, 4052), (220, 4029), (210, 4153), (206, 4183), (222, 4084), (227, 4128)]
         : compromised: 0.0526, honest: 0.0487
Round 006: test acc mean=0.0514 ± 0.0038 | min=0.0457 max=0.0615
         : test loss mean=nan ± nan
         : individual accs = ['0.049903', '0.048775', '0.061505', '0.049850', '0.045710', '0.052484', '0.053422', '0.049897', '0.057266', '0.048632', '0.048033', '0.048891', '0.047398', '0.047653', '0.055281', '0.054604', '0.050566', '0.049247', '0.054358', '0.054990']
         : correct/total = [(206, 4128), (205, 4203), (251, 4081), (216, 4333), (187, 4091), (225, 4287), (224, 4193), (217, 4349), (240, 4191), (208, 4277), (199, 4143), (205, 4193), (194, 4093), (200, 4197), (224, 4052), (220, 4029), (210, 4153), (206, 4183), (222, 4084), (227, 4128)]
         : compromised: 0.0526, honest: 0.0488
Round 007: test acc mean=0.0514 ± 0.0038 | min=0.0457 max=0.0615
         : test loss mean=nan ± nan
         : individual accs = ['0.049661', '0.048775', '0.061505', '0.049850', '0.045710', '0.052484', '0.053422', '0.049897', '0.057266', '0.048632', '0.048033', '0.048891', '0.047398', '0.047653', '0.055281', '0.054604', '0.050566', '0.049247', '0.054358', '0.054990']
         : correct/total = [(205, 4128), (205, 4203), (251, 4081), (216, 4333), (187, 4091), (225, 4287), (224, 4193), (217, 4349), (240, 4191), (208, 4277), (199, 4143), (205, 4193), (194, 4093), (200, 4197), (224, 4052), (220, 4029), (210, 4153), (206, 4183), (222, 4084), (227, 4128)]
         : compromised: 0.0526, honest: 0.0487
Round 008: test acc mean=0.0514 ± 0.0038 | min=0.0457 max=0.0615
         : test loss mean=nan ± nan
         : individual accs = ['0.049661', '0.048775', '0.061505', '0.049850', '0.045710', '0.052484', '0.053422', '0.049897', '0.057266', '0.048632', '0.048033', '0.048891', '0.047398', '0.047653', '0.055281', '0.054604', '0.050566', '0.049247', '0.054358', '0.054990']
         : correct/total = [(205, 4128), (205, 4203), (251, 4081), (216, 4333), (187, 4091), (225, 4287), (224, 4193), (217, 4349), (240, 4191), (208, 4277), (199, 4143), (205, 4193), (194, 4093), (200, 4197), (224, 4052), (220, 4029), (210, 4153), (206, 4183), (222, 4084), (227, 4128)]
         : compromised: 0.0526, honest: 0.0487
Round 009: test acc mean=0.0479 ± 0.0039 | min=0.0422 max=0.0550
         : test loss mean=nan ± nan
         : individual accs = ['0.049903', '0.048775', '0.046312', '0.042234', '0.045710', '0.052484', '0.044360', '0.049897', '0.042711', '0.043488', '0.048033', '0.048891', '0.047398', '0.047653', '0.044669', '0.054604', '0.042861', '0.049247', '0.054358', '0.054990']
         : correct/total = [(206, 4128), (205, 4203), (189, 4081), (183, 4333), (187, 4091), (225, 4287), (186, 4193), (217, 4349), (179, 4191), (186, 4277), (199, 4143), (205, 4193), (194, 4093), (200, 4197), (181, 4052), (220, 4029), (178, 4153), (206, 4183), (222, 4084), (227, 4128)]
         : compromised: 0.0485, honest: 0.0466
Round 010: test acc mean=0.0497 ± 0.0049 | min=0.0422 max=0.0615
         : test loss mean=nan ± nan
         : individual accs = ['0.049903', '0.048775', '0.061505', '0.042234', '0.045710', '0.052484', '0.053422', '0.049897', '0.042711', '0.043488', '0.048033', '0.048891', '0.047398', '0.047653', '0.055281', '0.054604', '0.042861', '0.049247', '0.054358', '0.054990']
         : correct/total = [(206, 4128), (205, 4203), (251, 4081), (183, 4333), (187, 4091), (225, 4287), (224, 4193), (217, 4349), (179, 4191), (186, 4277), (199, 4143), (205, 4193), (194, 4093), (200, 4197), (224, 4052), (220, 4029), (178, 4153), (206, 4183), (222, 4084), (227, 4128)]
         : compromised: 0.0510, honest: 0.0466

=== FINAL RESULTS ===
Dataset: femnist, Nodes: 20, Graph: erdos, Aggregation: d-fedavg
Attack: backdoor, 70.0% compromised
Final accuracy - Compromised: 0.0510, Honest: 0.0466
Overall test accuracy: mean=0.0497 ± 0.0049

=== BACKDOOR ATTACK SUCCESS RATE (ASR) ===
Target label: 0
Trigger size: 4x4
Overall ASR: 0.6000 ± 0.4899
Honest nodes ASR: 0.5000 ± 0.5000
Compromised nodes ASR: 0.6429 ± 0.4792
Note: Higher ASR indicates more successful backdoor attack
