Device: cuda
Seed: 987654321
Loading 36 LEAF FEMNIST train files...
LEAF FEMNIST train: 3597 users, 734463 samples
Loading 36 LEAF FEMNIST test files...
LEAF FEMNIST test: 3597 users, 83388 samples
Found 3597 train users, 3597 test users, 3597 common users
User sample counts range: 525 (max) to 17 (min)
Distributed ALL 3597 users across 20 clients
Users per client: 179 (with 17 clients getting +1 user)
Train partition sizes: [36360, 37070, 35957, 38262, 36024, 37732, 36921, 38328, 36867, 37683, 36507, 36915, 36007, 37001, 35681, 35453, 36585, 36801, 35964, 36345]
Test partition sizes: [4128, 4203, 4081, 4333, 4091, 4287, 4193, 4349, 4191, 4277, 4143, 4193, 4093, 4197, 4052, 4029, 4153, 4183, 4084, 4128]
  Client 0: 36360 train samples, 62 unique classes
  Client 1: 37070 train samples, 62 unique classes
  Client 2: 35957 train samples, 62 unique classes
  Client 3: 38262 train samples, 62 unique classes
  Client 4: 36024 train samples, 62 unique classes
  Client 5: 37732 train samples, 62 unique classes
  Client 6: 36921 train samples, 62 unique classes
  Client 7: 38328 train samples, 62 unique classes
  Client 8: 36867 train samples, 62 unique classes
  Client 9: 37683 train samples, 62 unique classes
  Client 10: 36507 train samples, 62 unique classes
  Client 11: 36915 train samples, 62 unique classes
  Client 12: 36007 train samples, 62 unique classes
  Client 13: 37001 train samples, 62 unique classes
  Client 14: 35681 train samples, 62 unique classes
  Client 15: 35453 train samples, 62 unique classes
  Client 16: 36585 train samples, 62 unique classes
  Client 17: 36801 train samples, 62 unique classes
  Client 18: 35964 train samples, 62 unique classes
  Client 19: 36345 train samples, 62 unique classes
Will sample 10000 samples per client per epoch
Graph: fully, nodes: 20, edges: 190
Degree statistics: avg=19.00, min=19, max=19
Attack: Compromised 10/20 nodes: [1, 2, 5, 11, 12, 13, 14, 15, 17, 18]
Attack type: backdoor, lambda: 1.0
Backdoor target label: 0, trigger size: 4
Model variant: baseline
Model parameters: 6,603,710
Sketchguard Node 0:
  Model dim: 6,603,710 → Sketch size: 1000
  Compression ratio: 6603.7x
  Using model parameters for aggregation, sketches for filtering
Sketchguard Node 1:
  Model dim: 6,603,710 → Sketch size: 1000
  Compression ratio: 6603.7x
  Using model parameters for aggregation, sketches for filtering
Sketchguard Node 2:
  Model dim: 6,603,710 → Sketch size: 1000
  Compression ratio: 6603.7x
  Using model parameters for aggregation, sketches for filtering
Sketchguard Node 3:
  Model dim: 6,603,710 → Sketch size: 1000
  Compression ratio: 6603.7x
  Using model parameters for aggregation, sketches for filtering
Sketchguard Node 4:
  Model dim: 6,603,710 → Sketch size: 1000
  Compression ratio: 6603.7x
  Using model parameters for aggregation, sketches for filtering
Sketchguard Node 5:
  Model dim: 6,603,710 → Sketch size: 1000
  Compression ratio: 6603.7x
  Using model parameters for aggregation, sketches for filtering
Sketchguard Node 6:
  Model dim: 6,603,710 → Sketch size: 1000
  Compression ratio: 6603.7x
  Using model parameters for aggregation, sketches for filtering
Sketchguard Node 7:
  Model dim: 6,603,710 → Sketch size: 1000
  Compression ratio: 6603.7x
  Using model parameters for aggregation, sketches for filtering
Sketchguard Node 8:
  Model dim: 6,603,710 → Sketch size: 1000
  Compression ratio: 6603.7x
  Using model parameters for aggregation, sketches for filtering
Sketchguard Node 9:
  Model dim: 6,603,710 → Sketch size: 1000
  Compression ratio: 6603.7x
  Using model parameters for aggregation, sketches for filtering
Sketchguard Node 10:
  Model dim: 6,603,710 → Sketch size: 1000
  Compression ratio: 6603.7x
  Using model parameters for aggregation, sketches for filtering
Sketchguard Node 11:
  Model dim: 6,603,710 → Sketch size: 1000
  Compression ratio: 6603.7x
  Using model parameters for aggregation, sketches for filtering
Sketchguard Node 12:
  Model dim: 6,603,710 → Sketch size: 1000
  Compression ratio: 6603.7x
  Using model parameters for aggregation, sketches for filtering
Sketchguard Node 13:
  Model dim: 6,603,710 → Sketch size: 1000
  Compression ratio: 6603.7x
  Using model parameters for aggregation, sketches for filtering
Sketchguard Node 14:
  Model dim: 6,603,710 → Sketch size: 1000
  Compression ratio: 6603.7x
  Using model parameters for aggregation, sketches for filtering
Sketchguard Node 15:
  Model dim: 6,603,710 → Sketch size: 1000
  Compression ratio: 6603.7x
  Using model parameters for aggregation, sketches for filtering
Sketchguard Node 16:
  Model dim: 6,603,710 → Sketch size: 1000
  Compression ratio: 6603.7x
  Using model parameters for aggregation, sketches for filtering
Sketchguard Node 17:
  Model dim: 6,603,710 → Sketch size: 1000
  Compression ratio: 6603.7x
  Using model parameters for aggregation, sketches for filtering
Sketchguard Node 18:
  Model dim: 6,603,710 → Sketch size: 1000
  Compression ratio: 6603.7x
  Using model parameters for aggregation, sketches for filtering
Sketchguard Node 19:
  Model dim: 6,603,710 → Sketch size: 1000
  Compression ratio: 6603.7x
  Using model parameters for aggregation, sketches for filtering
Sketchguard ALGORITHM (Sketch-based Filtering + State Aggregation)
  - Model dimension: 6,603,710 parameters
  - Config: SketchguardConfig(gamma=2, kappa=1, alpha=0.5, min_neighbors=1, sketch_size=1000, network_seed=987654321, attack_detection_window=5)
  - Sketch size: 1000
  - Compression ratio: 6603.7x
  - Complexity: O(d + N×k) = O(6,603,710 + 20×1000)
  - Theoretical speedup vs BALANCE: 19.9x
Initial test acc across nodes: mean=0.0168 ± 0.0139
Backdoor attack: Created poisoned datasets for 10 compromised nodes
Round 001: test acc mean=0.3112 ± 0.2007 | min=0.0488 max=0.5509
         : test loss mean=8315.8920 ± 8662.7476
         : individual accs = ['0.550872', '0.048775', '0.194805', '0.531272', '0.513322', '0.215535', '0.514906', '0.513681', '0.510141', '0.451017', '0.515327', '0.106129', '0.054239', '0.049083', '0.150296', '0.079424', '0.459427', '0.155869', '0.103330', '0.506056']
         : correct/total = [(2274, 4128), (205, 4203), (795, 4081), (2302, 4333), (2100, 4091), (924, 4287), (2159, 4193), (2234, 4349), (2138, 4191), (1929, 4277), (2135, 4143), (445, 4193), (222, 4093), (206, 4197), (609, 4052), (320, 4029), (1908, 4153), (652, 4183), (422, 4084), (2089, 4128)]
         : compromised: 0.1157, honest: 0.5066
         : sketchguard stats = ['Node 0: acc_rate=0.474', 'Node 1: acc_rate=0.526', 'Node 2: acc_rate=0.526']...
Round 002: test acc mean=0.3627 ± 0.3141 | min=0.0453 max=0.7021
         : test loss mean=54089.0863 ± 212359.6620
         : individual accs = ['0.684835', '0.048775', '0.057584', '0.702054', '0.684185', '0.045253', '0.663010', '0.676707', '0.661656', '0.662614', '0.685976', '0.049606', '0.046176', '0.049321', '0.046397', '0.049888', '0.674934', '0.046139', '0.048482', '0.670300']
         : correct/total = [(2827, 4128), (205, 4203), (235, 4081), (3042, 4333), (2799, 4091), (194, 4287), (2780, 4193), (2943, 4349), (2773, 4191), (2834, 4277), (2842, 4143), (208, 4193), (189, 4093), (207, 4197), (188, 4052), (201, 4029), (2803, 4153), (193, 4183), (198, 4084), (2767, 4128)]
         : compromised: 0.0488, honest: 0.6766
         : sketchguard stats = ['Node 0: acc_rate=0.474', 'Node 1: acc_rate=0.763', 'Node 2: acc_rate=0.763']...
Round 003: test acc mean=0.3761 ± 0.3251 | min=0.0488 max=0.7224
         : test loss mean=nan ± nan
         : individual accs = ['0.705911', '0.048775', '0.053418', '0.722363', '0.718895', '0.050618', '0.690675', '0.718786', '0.691005', '0.706102', '0.691528', '0.049606', '0.054239', '0.049083', '0.051826', '0.051626', '0.665784', '0.049486', '0.052889', '0.698643']
         : correct/total = [(2914, 4128), (205, 4203), (218, 4081), (3130, 4333), (2941, 4091), (217, 4287), (2896, 4193), (3126, 4349), (2896, 4191), (3020, 4277), (2865, 4143), (208, 4193), (222, 4093), (206, 4197), (210, 4052), (208, 4029), (2765, 4153), (207, 4183), (216, 4084), (2884, 4128)]
         : compromised: 0.0512, honest: 0.7010
         : sketchguard stats = ['Node 0: acc_rate=0.474', 'Node 1: acc_rate=0.842', 'Node 2: acc_rate=0.842']...
Round 004: test acc mean=0.3701 ± 0.3201 | min=0.0453 max=0.7205
         : test loss mean=nan ± nan
         : individual accs = ['0.676841', '0.048775', '0.053418', '0.720517', '0.691762', '0.045253', '0.710231', '0.720395', '0.708423', '0.671265', '0.664977', '0.049606', '0.054239', '0.049083', '0.051826', '0.051626', '0.705033', '0.049486', '0.052889', '0.626938']
         : correct/total = [(2794, 4128), (205, 4203), (218, 4081), (3122, 4333), (2830, 4091), (194, 4287), (2978, 4193), (3133, 4349), (2969, 4191), (2871, 4277), (2755, 4143), (208, 4193), (222, 4093), (206, 4197), (210, 4052), (208, 4029), (2928, 4153), (207, 4183), (216, 4084), (2588, 4128)]
         : compromised: 0.0506, honest: 0.6896
         : sketchguard stats = ['Node 0: acc_rate=0.474', 'Node 1: acc_rate=0.632', 'Node 2: acc_rate=0.632']...
Round 005: test acc mean=0.3989 ± 0.3486 | min=0.0453 max=0.7783
         : test loss mean=nan ± nan
         : individual accs = ['0.739583', '0.048775', '0.053418', '0.745211', '0.753117', '0.045253', '0.746959', '0.778340', '0.739442', '0.771335', '0.725561', '0.049606', '0.054239', '0.049083', '0.051826', '0.051626', '0.756802', '0.049486', '0.052889', '0.716328']
         : correct/total = [(3053, 4128), (205, 4203), (218, 4081), (3229, 4333), (3081, 4091), (194, 4287), (3132, 4193), (3385, 4349), (3099, 4191), (3299, 4277), (3006, 4143), (208, 4193), (222, 4093), (206, 4197), (210, 4052), (208, 4029), (3143, 4153), (207, 4183), (216, 4084), (2957, 4128)]
         : compromised: 0.0506, honest: 0.7473
         : sketchguard stats = ['Node 0: acc_rate=0.474', 'Node 1: acc_rate=0.505', 'Node 2: acc_rate=0.505']...
Round 006: test acc mean=0.4274 ± 0.3769 | min=0.0453 max=0.8127
         : test loss mean=nan ± nan
         : individual accs = ['0.805475', '0.048775', '0.053418', '0.806370', '0.807138', '0.045253', '0.804913', '0.811911', '0.801479', '0.812719', '0.794352', '0.049606', '0.054239', '0.049083', '0.051826', '0.051626', '0.807850', '0.049486', '0.052889', '0.790455']
         : correct/total = [(3325, 4128), (205, 4203), (218, 4081), (3494, 4333), (3302, 4091), (194, 4287), (3375, 4193), (3531, 4349), (3359, 4191), (3476, 4277), (3291, 4143), (208, 4193), (222, 4093), (206, 4197), (210, 4052), (208, 4029), (3355, 4153), (207, 4183), (216, 4084), (3263, 4128)]
         : compromised: 0.0506, honest: 0.8043
         : sketchguard stats = ['Node 0: acc_rate=0.474', 'Node 1: acc_rate=0.421', 'Node 2: acc_rate=0.421']...
Round 007: test acc mean=0.4389 ± 0.3884 | min=0.0453 max=0.8411
         : test loss mean=nan ± nan
         : individual accs = ['0.824855', '0.048775', '0.053418', '0.829910', '0.841115', '0.045253', '0.820415', '0.840193', '0.820568', '0.835866', '0.811731', '0.049606', '0.054239', '0.049083', '0.051826', '0.051626', '0.827595', '0.049486', '0.052889', '0.820252']
         : correct/total = [(3405, 4128), (205, 4203), (218, 4081), (3596, 4333), (3441, 4091), (194, 4287), (3440, 4193), (3654, 4349), (3439, 4191), (3575, 4277), (3363, 4143), (208, 4193), (222, 4093), (206, 4197), (210, 4052), (208, 4029), (3437, 4153), (207, 4183), (216, 4084), (3386, 4128)]
         : compromised: 0.0506, honest: 0.8272
         : sketchguard stats = ['Node 0: acc_rate=0.474', 'Node 1: acc_rate=0.361', 'Node 2: acc_rate=0.361']...
Round 008: test acc mean=0.4441 ± 0.3935 | min=0.0453 max=0.8497
         : test loss mean=nan ± nan
         : individual accs = ['0.834302', '0.048775', '0.053418', '0.837988', '0.849670', '0.045253', '0.828285', '0.847321', '0.835123', '0.844517', '0.829109', '0.049606', '0.054239', '0.049083', '0.051826', '0.051626', '0.839393', '0.049486', '0.052889', '0.829700']
         : correct/total = [(3444, 4128), (205, 4203), (218, 4081), (3631, 4333), (3476, 4091), (194, 4287), (3473, 4193), (3685, 4349), (3500, 4191), (3612, 4277), (3435, 4143), (208, 4193), (222, 4093), (206, 4197), (210, 4052), (208, 4029), (3486, 4153), (207, 4183), (216, 4084), (3425, 4128)]
         : compromised: 0.0506, honest: 0.8375
         : sketchguard stats = ['Node 0: acc_rate=0.474', 'Node 1: acc_rate=0.316', 'Node 2: acc_rate=0.316']...
Round 009: test acc mean=0.4467 ± 0.3962 | min=0.0453 max=0.8581
         : test loss mean=nan ± nan
         : individual accs = ['0.833818', '0.048775', '0.053418', '0.845834', '0.850403', '0.045253', '0.833771', '0.858128', '0.837270', '0.850830', '0.832247', '0.049606', '0.054239', '0.049083', '0.051826', '0.051626', '0.848062', '0.049486', '0.052889', '0.837936']
         : correct/total = [(3442, 4128), (205, 4203), (218, 4081), (3665, 4333), (3479, 4091), (194, 4287), (3496, 4193), (3732, 4349), (3509, 4191), (3639, 4277), (3448, 4143), (208, 4193), (222, 4093), (206, 4197), (210, 4052), (208, 4029), (3522, 4153), (207, 4183), (216, 4084), (3459, 4128)]
         : compromised: 0.0506, honest: 0.8428
         : sketchguard stats = ['Node 0: acc_rate=0.474', 'Node 1: acc_rate=0.281', 'Node 2: acc_rate=0.281']...
Round 010: test acc mean=0.4489 ± 0.3983 | min=0.0453 max=0.8575
         : test loss mean=nan ± nan
         : individual accs = ['0.843023', '0.048775', '0.053418', '0.849527', '0.857492', '0.045253', '0.839017', '0.854679', '0.847292', '0.851999', '0.840454', '0.049606', '0.054239', '0.049083', '0.051826', '0.051626', '0.849988', '0.049486', '0.052889', '0.838905']
         : correct/total = [(3480, 4128), (205, 4203), (218, 4081), (3681, 4333), (3508, 4091), (194, 4287), (3518, 4193), (3717, 4349), (3551, 4191), (3644, 4277), (3482, 4143), (208, 4193), (222, 4093), (206, 4197), (210, 4052), (208, 4029), (3530, 4153), (207, 4183), (216, 4084), (3463, 4128)]
         : compromised: 0.0506, honest: 0.8472
         : sketchguard stats = ['Node 0: acc_rate=0.474', 'Node 1: acc_rate=0.253', 'Node 2: acc_rate=0.253']...

=== FINAL RESULTS ===
Dataset: femnist, Nodes: 20, Graph: fully, Aggregation: sketchguard
Attack: backdoor, 50.0% compromised
Final accuracy - Compromised: 0.0506, Honest: 0.8472
Overall test accuracy: mean=0.4489 ± 0.3983

=== BACKDOOR ATTACK SUCCESS RATE (ASR) ===
Target label: 0
Trigger size: 4x4
Overall ASR: 0.5248 ± 0.4752
Honest nodes ASR: 0.0495 ± 0.0042
Compromised nodes ASR: 1.0000 ± 0.0000
Note: Higher ASR indicates more successful backdoor attack

=== Sketchguard SUMMARY ===
Node 0: acceptance=0.474
Node 1: acceptance=0.253
Node 2: acceptance=0.253
Node 3: acceptance=0.474
Node 4: acceptance=0.474
Node 5: acceptance=0.253
Node 6: acceptance=0.474
Node 7: acceptance=0.474
Node 8: acceptance=0.474
Node 9: acceptance=0.474
Node 10: acceptance=0.474
Node 11: acceptance=0.253
Node 12: acceptance=0.253
Node 13: acceptance=0.253
Node 14: acceptance=0.253
Node 15: acceptance=0.253
Node 16: acceptance=0.474
Node 17: acceptance=0.253
Node 18: acceptance=0.253
Node 19: acceptance=0.474

=== PARALLEL EXECUTION TIME (realistic for distributed system) ===
  COMMUNICATION (max across nodes):
    - Sketch transfer: 0.001s (0.0%)
    - Model fetch (accepted): 0.000s (0.0%)
  COMPUTATION (max across nodes):
    - Sketching: 3.840s (99.2%)
    - Filtering: 0.004s (0.1%)
    - Aggregation: 0.025s (0.6%)
  TOTALS:
    - Total computation: 3.868s (100.0%)
    - Total communication: 0.001s (0.0%)
    - Total parallel time: 3.869s

=== PER-NODE AVERAGE TIME ===
  - Sketching: 3.269s
  - Filtering: 0.002s
  - Aggregation: 0.016s
  - Sketch transfer: 0.000s
  - Model fetch: 0.000s
  - Total per node: 3.287s

=== TOTAL COMPUTATIONAL WORK (sum across all nodes) ===
  - Total sketching: 65.379s
  - Total filtering: 0.034s
  - Total aggregation: 0.316s
  - Total sketch transfer: 0.002s
  - Total model fetch: 0.000s
  - Grand total: 65.731s
  - Mean acceptance rate: 0.363

Sketchguard Algorithm Properties:
  - Original dimension: 6,603,710
  - Sketch size: 1000
  - Compression ratio: 19.9x
  - Single repetition: No repetitions needed
  - Theoretical complexity: O(d + N×k)
  - Approach: Sketch filtering + state aggregation
