Device: cuda
Seed: 987654321
Loading 36 LEAF FEMNIST train files...
LEAF FEMNIST train: 3597 users, 734463 samples
Loading 36 LEAF FEMNIST test files...
LEAF FEMNIST test: 3597 users, 83388 samples
Found 3597 train users, 3597 test users, 3597 common users
User sample counts range: 525 (max) to 17 (min)
Distributed ALL 3597 users across 20 clients
Users per client: 179 (with 17 clients getting +1 user)
Train partition sizes: [36360, 37070, 35957, 38262, 36024, 37732, 36921, 38328, 36867, 37683, 36507, 36915, 36007, 37001, 35681, 35453, 36585, 36801, 35964, 36345]
Test partition sizes: [4128, 4203, 4081, 4333, 4091, 4287, 4193, 4349, 4191, 4277, 4143, 4193, 4093, 4197, 4052, 4029, 4153, 4183, 4084, 4128]
  Client 0: 36360 train samples, 62 unique classes
  Client 1: 37070 train samples, 62 unique classes
  Client 2: 35957 train samples, 62 unique classes
  Client 3: 38262 train samples, 62 unique classes
  Client 4: 36024 train samples, 62 unique classes
  Client 5: 37732 train samples, 62 unique classes
  Client 6: 36921 train samples, 62 unique classes
  Client 7: 38328 train samples, 62 unique classes
  Client 8: 36867 train samples, 62 unique classes
  Client 9: 37683 train samples, 62 unique classes
  Client 10: 36507 train samples, 62 unique classes
  Client 11: 36915 train samples, 62 unique classes
  Client 12: 36007 train samples, 62 unique classes
  Client 13: 37001 train samples, 62 unique classes
  Client 14: 35681 train samples, 62 unique classes
  Client 15: 35453 train samples, 62 unique classes
  Client 16: 36585 train samples, 62 unique classes
  Client 17: 36801 train samples, 62 unique classes
  Client 18: 35964 train samples, 62 unique classes
  Client 19: 36345 train samples, 62 unique classes
Will sample 10000 samples per client per epoch
Graph: erdos, nodes: 20, edges: 99
Degree statistics: avg=9.90, min=7, max=14
Attack: Compromised 14/20 nodes: [1, 2, 3, 5, 6, 8, 11, 12, 13, 14, 15, 17, 18, 19]
Attack type: backdoor, lambda: 1.0
Backdoor target label: 0, trigger size: 4
Model variant: baseline
Model parameters: 6,603,710
UBAR ALGORITHM (Two-Stage Byzantine-resilient)
  - Model dimension: 6,603,710 parameters
  - Rho parameter: 0.30000000000000004
  - Stage 1: Distance-based filtering (select 30% closest neighbors)
  - Stage 2: Performance-based selection (loss comparison)
  - Complexity: O(deg(i)×d + deg(i)×inference)
Initial test acc across nodes: mean=0.0162 ± 0.0138
Backdoor attack: Created poisoned datasets for 14 compromised nodes
Round 001: test acc mean=0.1835 ± 0.1409 | min=0.0427 max=0.4447
         : test loss mean=12469.5039 ± 8605.7980
         : individual accs = ['0.427568', '0.048775', '0.192355', '0.057928', '0.403324', '0.170049', '0.042690', '0.352495', '0.055834', '0.369418', '0.292542', '0.143573', '0.047398', '0.047653', '0.169546', '0.063539', '0.444739', '0.177863', '0.107982', '0.054990']
         : correct/total = [(1765, 4128), (205, 4203), (785, 4081), (251, 4333), (1650, 4091), (729, 4287), (179, 4193), (1533, 4349), (234, 4191), (1580, 4277), (1212, 4143), (602, 4193), (194, 4093), (200, 4197), (687, 4052), (256, 4029), (1847, 4153), (744, 4183), (441, 4084), (227, 4128)]
         : compromised: 0.0986, honest: 0.3817
         : ubar stats = ['Node 0: s1=0.250, s2=0.333', 'Node 1: s1=0.300, s2=1.000', 'Node 2: s1=0.250, s2=1.000']...
Round 002: test acc mean=0.2364 ± 0.2908 | min=0.0026 max=0.7307
         : test loss mean=1314.6906 ± 4543.1149
         : individual accs = ['0.652132', '0.050440', '0.046802', '0.048927', '0.724762', '0.051318', '0.050322', '0.705679', '0.044619', '0.730652', '0.608496', '0.051514', '0.048131', '0.002621', '0.050592', '0.054604', '0.649892', '0.045422', '0.059745', '0.050388']
         : correct/total = [(2692, 4128), (212, 4203), (191, 4081), (212, 4333), (2965, 4091), (220, 4287), (211, 4193), (3069, 4349), (187, 4191), (3125, 4277), (2521, 4143), (216, 4193), (197, 4093), (11, 4197), (205, 4052), (220, 4029), (2699, 4153), (190, 4183), (244, 4084), (208, 4128)]
         : compromised: 0.0468, honest: 0.6786
         : ubar stats = ['Node 0: s1=0.250, s2=0.500', 'Node 1: s1=0.300, s2=1.000', 'Node 2: s1=0.250, s2=1.000']...
Round 003: test acc mean=0.2629 ± 0.3260 | min=0.0448 max=0.7864
         : test loss mean=nan ± nan
         : individual accs = ['0.774467', '0.052819', '0.051948', '0.044773', '0.780738', '0.046186', '0.048414', '0.786388', '0.051062', '0.760346', '0.722182', '0.051037', '0.048131', '0.048606', '0.047878', '0.052122', '0.738984', '0.052116', '0.051910', '0.047965']
         : correct/total = [(3197, 4128), (222, 4203), (212, 4081), (194, 4333), (3194, 4091), (198, 4287), (203, 4193), (3420, 4349), (214, 4191), (3252, 4277), (2992, 4143), (214, 4193), (197, 4093), (204, 4197), (194, 4052), (210, 4029), (3069, 4153), (218, 4183), (212, 4084), (198, 4128)]
         : compromised: 0.0496, honest: 0.7605
         : ubar stats = ['Node 0: s1=0.250, s2=0.444', 'Node 1: s1=0.300, s2=0.778', 'Node 2: s1=0.250, s2=1.000']...
Round 004: test acc mean=0.2736 ± 0.3415 | min=0.0415 max=0.8128
         : test loss mean=nan ± nan
         : individual accs = ['0.785610', '0.048775', '0.049743', '0.046619', '0.800049', '0.052484', '0.041498', '0.812831', '0.051062', '0.811784', '0.762008', '0.048891', '0.047398', '0.047653', '0.054788', '0.054604', '0.797496', '0.049247', '0.054358', '0.054990']
         : correct/total = [(3243, 4128), (205, 4203), (203, 4081), (202, 4333), (3273, 4091), (225, 4287), (174, 4193), (3535, 4349), (214, 4191), (3472, 4277), (3157, 4143), (205, 4193), (194, 4093), (200, 4197), (222, 4052), (220, 4029), (3312, 4153), (206, 4183), (222, 4084), (227, 4128)]
         : compromised: 0.0502, honest: 0.7950
         : ubar stats = ['Node 0: s1=0.250, s2=0.417', 'Node 1: s1=0.300, s2=0.667', 'Node 2: s1=0.250, s2=0.875']...
Round 005: test acc mean=0.2787 ± 0.3492 | min=0.0415 max=0.8207
         : test loss mean=nan ± nan
         : individual accs = ['0.811531', '0.048775', '0.049743', '0.046619', '0.810071', '0.052484', '0.041498', '0.817429', '0.051062', '0.820669', '0.793869', '0.048891', '0.047398', '0.047653', '0.054788', '0.054604', '0.818926', '0.049247', '0.054358', '0.054990']
         : correct/total = [(3350, 4128), (205, 4203), (203, 4081), (202, 4333), (3314, 4091), (225, 4287), (174, 4193), (3555, 4349), (214, 4191), (3510, 4277), (3289, 4143), (205, 4193), (194, 4093), (200, 4197), (222, 4052), (220, 4029), (3401, 4153), (206, 4183), (222, 4084), (227, 4128)]
         : compromised: 0.0502, honest: 0.8121
         : ubar stats = ['Node 0: s1=0.250, s2=0.400', 'Node 1: s1=0.300, s2=0.600', 'Node 2: s1=0.250, s2=0.800']...
Round 006: test acc mean=0.2834 ± 0.3563 | min=0.0415 max=0.8394
         : test loss mean=nan ± nan
         : individual accs = ['0.821221', '0.048775', '0.049743', '0.046619', '0.826204', '0.052484', '0.041498', '0.831685', '0.051062', '0.839373', '0.814386', '0.048891', '0.047398', '0.047653', '0.054788', '0.054604', '0.832170', '0.049247', '0.054358', '0.054990']
         : correct/total = [(3390, 4128), (205, 4203), (203, 4081), (202, 4333), (3380, 4091), (225, 4287), (174, 4193), (3617, 4349), (214, 4191), (3590, 4277), (3374, 4143), (205, 4193), (194, 4093), (200, 4197), (222, 4052), (220, 4029), (3456, 4153), (206, 4183), (222, 4084), (227, 4128)]
         : compromised: 0.0502, honest: 0.8275
         : ubar stats = ['Node 0: s1=0.250, s2=0.389', 'Node 1: s1=0.300, s2=0.556', 'Node 2: s1=0.250, s2=0.750']...
Round 007: test acc mean=0.2860 ± 0.3603 | min=0.0415 max=0.8454
         : test loss mean=nan ± nan
         : individual accs = ['0.832849', '0.048775', '0.049743', '0.046619', '0.831826', '0.052484', '0.041498', '0.840653', '0.051062', '0.840776', '0.826454', '0.048891', '0.047398', '0.047653', '0.054788', '0.054604', '0.845413', '0.049247', '0.054358', '0.054990']
         : correct/total = [(3438, 4128), (205, 4203), (203, 4081), (202, 4333), (3403, 4091), (225, 4287), (174, 4193), (3656, 4349), (214, 4191), (3596, 4277), (3424, 4143), (205, 4193), (194, 4093), (200, 4197), (222, 4052), (220, 4029), (3511, 4153), (206, 4183), (222, 4084), (227, 4128)]
         : compromised: 0.0502, honest: 0.8363
         : ubar stats = ['Node 0: s1=0.250, s2=0.429', 'Node 1: s1=0.300, s2=0.524', 'Node 2: s1=0.250, s2=0.714']...
Round 008: test acc mean=0.2863 ± 0.3607 | min=0.0415 max=0.8485
         : test loss mean=nan ± nan
         : individual accs = ['0.830426', '0.048775', '0.049743', '0.046619', '0.836959', '0.052484', '0.041498', '0.844332', '0.051062', '0.848492', '0.827902', '0.048891', '0.047398', '0.047653', '0.054788', '0.054604', '0.834818', '0.049247', '0.054358', '0.054990']
         : correct/total = [(3428, 4128), (205, 4203), (203, 4081), (202, 4333), (3424, 4091), (225, 4287), (174, 4193), (3672, 4349), (214, 4191), (3629, 4277), (3430, 4143), (205, 4193), (194, 4093), (200, 4197), (222, 4052), (220, 4029), (3467, 4153), (206, 4183), (222, 4084), (227, 4128)]
         : compromised: 0.0502, honest: 0.8372
         : ubar stats = ['Node 0: s1=0.250, s2=0.417', 'Node 1: s1=0.300, s2=0.500', 'Node 2: s1=0.250, s2=0.688']...
Round 009: test acc mean=0.2874 ± 0.3624 | min=0.0415 max=0.8529
         : test loss mean=nan ± nan
         : individual accs = ['0.834787', '0.048775', '0.049743', '0.046619', '0.837448', '0.052484', '0.041498', '0.850080', '0.051062', '0.852934', '0.832971', '0.048891', '0.047398', '0.047653', '0.054788', '0.054604', '0.837226', '0.049247', '0.054358', '0.054990']
         : correct/total = [(3446, 4128), (205, 4203), (203, 4081), (202, 4333), (3426, 4091), (225, 4287), (174, 4193), (3697, 4349), (214, 4191), (3648, 4277), (3451, 4143), (205, 4193), (194, 4093), (200, 4197), (222, 4052), (220, 4029), (3477, 4153), (206, 4183), (222, 4084), (227, 4128)]
         : compromised: 0.0502, honest: 0.8409
         : ubar stats = ['Node 0: s1=0.250, s2=0.407', 'Node 1: s1=0.300, s2=0.481', 'Node 2: s1=0.250, s2=0.667']...
Round 010: test acc mean=0.2886 ± 0.3642 | min=0.0415 max=0.8492
         : test loss mean=nan ± nan
         : individual accs = ['0.845203', '0.048775', '0.049743', '0.046619', '0.843559', '0.052484', '0.041498', '0.843412', '0.051062', '0.849193', '0.841178', '0.048891', '0.047398', '0.047653', '0.054788', '0.054604', '0.846858', '0.049247', '0.054358', '0.054990']
         : correct/total = [(3489, 4128), (205, 4203), (203, 4081), (202, 4333), (3451, 4091), (225, 4287), (174, 4193), (3668, 4349), (214, 4191), (3632, 4277), (3485, 4143), (205, 4193), (194, 4093), (200, 4197), (222, 4052), (220, 4029), (3517, 4153), (206, 4183), (222, 4084), (227, 4128)]
         : compromised: 0.0502, honest: 0.8449
         : ubar stats = ['Node 0: s1=0.250, s2=0.400', 'Node 1: s1=0.300, s2=0.467', 'Node 2: s1=0.250, s2=0.650']...

=== FINAL RESULTS ===
Dataset: femnist, Nodes: 20, Graph: erdos, Aggregation: ubar
Attack: backdoor, 70.0% compromised
Final accuracy - Compromised: 0.0502, Honest: 0.8449
Overall test accuracy: mean=0.2886 ± 0.3642

=== BACKDOOR ATTACK SUCCESS RATE (ASR) ===
Target label: 0
Trigger size: 4x4
Overall ASR: 0.7160 ± 0.4338
Honest nodes ASR: 0.0533 ± 0.0040
Compromised nodes ASR: 1.0000 ± 0.0000
Note: Higher ASR indicates more successful backdoor attack

=== UBAR SUMMARY ===
Node 0: stage1=0.250, stage2=0.400, overall=0.100
Node 1: stage1=0.300, stage2=0.467, overall=0.140
Node 2: stage1=0.250, stage2=0.650, overall=0.163
Node 3: stage1=0.286, stage2=0.650, overall=0.186
Node 4: stage1=0.222, stage2=0.550, overall=0.122
Node 5: stage1=0.300, stage2=0.467, overall=0.140
Node 6: stage1=0.250, stage2=0.533, overall=0.133
Node 7: stage1=0.273, stage2=0.433, overall=0.118
Node 8: stage1=0.286, stage2=0.600, overall=0.171
Node 9: stage1=0.273, stage2=0.433, overall=0.118
Node 10: stage1=0.250, stage2=0.600, overall=0.150
Node 11: stage1=0.250, stage2=0.533, overall=0.133
Node 12: stage1=0.250, stage2=0.533, overall=0.133
Node 13: stage1=0.222, stage2=0.550, overall=0.122
Node 14: stage1=0.286, stage2=0.475, overall=0.136
Node 15: stage1=0.222, stage2=0.650, overall=0.144
Node 16: stage1=0.286, stage2=0.600, overall=0.171
Node 17: stage1=0.250, stage2=0.650, overall=0.163
Node 18: stage1=0.250, stage2=0.533, overall=0.133
Node 19: stage1=0.300, stage2=0.467, overall=0.140

=== PARALLEL EXECUTION TIME (realistic for distributed system) ===
  COMMUNICATION (max across nodes):
    - Full model transfer: 0.000s (0.0%)
  COMPUTATION (max across nodes):
    - Distance computation: 0.047s (1.1%)
    - Loss computation: 4.183s (98.7%)
    - Aggregation: 0.006s (0.1%)
  TOTALS:
    - Total computation: 4.236s (100.0%)
    - Total communication: 0.000s (0.0%)
    - Total parallel time: 4.236s

=== PER-NODE AVERAGE TIME ===
  - Distance computation: 0.037s
  - Loss computation: 3.946s
  - Aggregation: 0.005s
  - Model transfer: 0.000s
  - Total per node: 3.988s

=== TOTAL COMPUTATIONAL WORK (sum across all nodes) ===
  - Total distance computation: 0.744s
  - Total loss computation: 78.911s
  - Total aggregation: 0.097s
  - Total model transfer: 0.000s
  - Grand total: 79.752s
  - Mean Stage 1 acceptance rate: 0.263
  - Mean Stage 2 acceptance rate: 0.539
  - Overall acceptance rate: 0.142

UBAR Algorithm Properties:
  - Model dimension: 6,603,710
  - Rho parameter: 0.30000000000000004
  - Two-stage approach: Distance filtering + loss evaluation
  - Stage 1 selects: 30% of neighbors
  - Stage 2 uses: Training sample loss comparison
  - Theoretical complexity: O(deg(i)×d + deg(i)×inference)
  - Approach: UBAR paper implementation
