Device: cuda
Seed: 987654321
Loading 36 LEAF FEMNIST train files...
LEAF FEMNIST train: 3597 users, 734463 samples
Loading 36 LEAF FEMNIST test files...
LEAF FEMNIST test: 3597 users, 83388 samples
Found 3597 train users, 3597 test users, 3597 common users
User sample counts range: 525 (max) to 17 (min)
Distributed ALL 3597 users across 20 clients
Users per client: 179 (with 17 clients getting +1 user)
Train partition sizes: [36360, 37070, 35957, 38262, 36024, 37732, 36921, 38328, 36867, 37683, 36507, 36915, 36007, 37001, 35681, 35453, 36585, 36801, 35964, 36345]
Test partition sizes: [4128, 4203, 4081, 4333, 4091, 4287, 4193, 4349, 4191, 4277, 4143, 4193, 4093, 4197, 4052, 4029, 4153, 4183, 4084, 4128]
  Client 0: 36360 train samples, 62 unique classes
  Client 1: 37070 train samples, 62 unique classes
  Client 2: 35957 train samples, 62 unique classes
  Client 3: 38262 train samples, 62 unique classes
  Client 4: 36024 train samples, 62 unique classes
  Client 5: 37732 train samples, 62 unique classes
  Client 6: 36921 train samples, 62 unique classes
  Client 7: 38328 train samples, 62 unique classes
  Client 8: 36867 train samples, 62 unique classes
  Client 9: 37683 train samples, 62 unique classes
  Client 10: 36507 train samples, 62 unique classes
  Client 11: 36915 train samples, 62 unique classes
  Client 12: 36007 train samples, 62 unique classes
  Client 13: 37001 train samples, 62 unique classes
  Client 14: 35681 train samples, 62 unique classes
  Client 15: 35453 train samples, 62 unique classes
  Client 16: 36585 train samples, 62 unique classes
  Client 17: 36801 train samples, 62 unique classes
  Client 18: 35964 train samples, 62 unique classes
  Client 19: 36345 train samples, 62 unique classes
Will sample 10000 samples per client per epoch
Graph: ring, nodes: 20, edges: 20
Degree statistics: avg=2.00, min=2, max=2
Attack: Compromised 2/20 nodes: [5, 13]
Attack type: backdoor, lambda: 1.0
Backdoor target label: 0, trigger size: 4
Model variant: baseline
Model parameters: 6,603,710
Initial test acc across nodes: mean=0.0168 ± 0.0139
Backdoor attack: Created poisoned datasets for 2 compromised nodes
Round 001: test acc mean=0.1666 ± 0.1242 | min=0.0029 max=0.4123
         : test loss mean=1255.6597 ± 1964.2332
         : individual accs = ['0.247335', '0.256959', '0.262191', '0.164782', '0.002933', '0.004665', '0.005724', '0.412279', '0.130756', '0.104045', '0.183442', '0.282375', '0.004398', '0.004527', '0.003208', '0.275751', '0.274982', '0.301458', '0.239226', '0.171512']
         : correct/total = [(1021, 4128), (1080, 4203), (1070, 4081), (714, 4333), (12, 4091), (20, 4287), (24, 4193), (1793, 4349), (548, 4191), (445, 4277), (760, 4143), (1184, 4193), (18, 4093), (19, 4197), (13, 4052), (1111, 4029), (1142, 4153), (1261, 4183), (977, 4084), (708, 4128)]
         : compromised: 0.0046, honest: 0.1846
Round 002: test acc mean=0.3732 ± 0.3237 | min=0.0432 max=0.7167
         : test loss mean=1525146126.7800 ± 6599707400.4415
         : individual accs = ['0.715601', '0.691173', '0.698358', '0.043157', '0.057932', '0.052484', '0.044598', '0.051276', '0.707230', '0.699556', '0.695873', '0.053899', '0.050574', '0.045747', '0.046397', '0.050633', '0.671563', '0.683720', '0.716699', '0.688469']
         : correct/total = [(2954, 4128), (2905, 4203), (2850, 4081), (187, 4333), (237, 4091), (225, 4287), (187, 4193), (223, 4349), (2964, 4191), (2992, 4277), (2883, 4143), (226, 4193), (207, 4093), (192, 4197), (188, 4052), (204, 4029), (2789, 4153), (2860, 4183), (2927, 4084), (2842, 4128)]
         : compromised: 0.0491, honest: 0.4093
Round 003: test acc mean=0.2672 ± 0.3319 | min=0.0430 max=0.7834
         : test loss mean=21183516.5717 ± 89840962.8937
         : individual accs = ['0.783430', '0.781347', '0.057584', '0.052850', '0.043021', '0.045253', '0.048414', '0.051276', '0.043188', '0.778583', '0.045619', '0.053899', '0.050574', '0.046938', '0.046397', '0.056342', '0.058271', '0.766436', '0.774731', '0.760417']
         : correct/total = [(3234, 4128), (3284, 4203), (235, 4081), (229, 4333), (176, 4091), (194, 4287), (203, 4193), (223, 4349), (181, 4191), (3330, 4277), (189, 4143), (226, 4193), (207, 4093), (197, 4197), (188, 4052), (227, 4029), (242, 4153), (3206, 4183), (3164, 4084), (3139, 4128)]
         : compromised: 0.0461, honest: 0.2918
Round 004: test acc mean=0.1629 ± 0.2669 | min=0.0430 max=0.8057
         : test loss mean=14901507.6949 ± 60319896.9917
         : individual accs = ['0.805717', '0.052344', '0.053418', '0.043157', '0.043021', '0.045253', '0.049130', '0.058174', '0.053209', '0.046528', '0.055998', '0.053899', '0.050574', '0.046938', '0.048124', '0.056590', '0.058271', '0.048769', '0.797258', '0.791182']
         : correct/total = [(3326, 4128), (220, 4203), (218, 4081), (187, 4333), (176, 4091), (194, 4287), (206, 4193), (253, 4349), (223, 4191), (199, 4277), (232, 4143), (226, 4193), (207, 4093), (197, 4197), (195, 4052), (228, 4029), (242, 4153), (204, 4183), (3256, 4084), (3266, 4128)]
         : compromised: 0.0461, honest: 0.1759
Round 005: test acc mean=0.0878 ± 0.1646 | min=0.0323 max=0.8047
         : test loss mean=1070762.9203 ± 4178860.6989
         : individual accs = ['0.050145', '0.048775', '0.053418', '0.043157', '0.043021', '0.045953', '0.046745', '0.058174', '0.051539', '0.047463', '0.045619', '0.061770', '0.054239', '0.055278', '0.032330', '0.056590', '0.058271', '0.050920', '0.048482', '0.804748']
         : correct/total = [(207, 4128), (205, 4203), (218, 4081), (187, 4333), (176, 4091), (197, 4287), (196, 4193), (253, 4349), (216, 4191), (203, 4277), (189, 4143), (259, 4193), (222, 4093), (232, 4197), (131, 4052), (228, 4029), (242, 4153), (213, 4183), (198, 4084), (3322, 4128)]
         : compromised: 0.0506, honest: 0.0920
Round 006: test acc mean=0.0499 ± 0.0054 | min=0.0323 max=0.0576
         : test loss mean=nan ± nan
         : individual accs = ['0.050145', '0.052344', '0.057584', '0.048465', '0.043021', '0.048519', '0.048414', '0.043918', '0.053209', '0.053776', '0.051653', '0.049606', '0.048620', '0.049559', '0.032330', '0.054852', '0.055141', '0.049486', '0.052889', '0.054506']
         : correct/total = [(207, 4128), (220, 4203), (235, 4081), (210, 4333), (176, 4091), (208, 4287), (203, 4193), (191, 4349), (223, 4191), (230, 4277), (214, 4143), (208, 4193), (199, 4093), (208, 4197), (131, 4052), (221, 4029), (229, 4153), (207, 4183), (216, 4084), (225, 4128)]
         : compromised: 0.0490, honest: 0.0500
Round 007: test acc mean=0.0493 ± 0.0046 | min=0.0417 max=0.0576
         : test loss mean=nan ± nan
         : individual accs = ['0.050145', '0.052344', '0.057584', '0.052850', '0.043021', '0.045253', '0.048891', '0.043918', '0.042233', '0.053776', '0.055998', '0.046745', '0.050574', '0.045747', '0.046397', '0.041698', '0.052011', '0.049486', '0.052889', '0.054506']
         : correct/total = [(207, 4128), (220, 4203), (235, 4081), (229, 4333), (176, 4091), (194, 4287), (205, 4193), (191, 4349), (177, 4191), (230, 4277), (232, 4143), (196, 4193), (207, 4093), (192, 4197), (188, 4052), (168, 4029), (216, 4153), (207, 4183), (216, 4084), (225, 4128)]
         : compromised: 0.0455, honest: 0.0497
Round 008: test acc mean=0.0500 ± 0.0045 | min=0.0422 max=0.0618
         : test loss mean=nan ± nan
         : individual accs = ['0.050145', '0.048775', '0.054889', '0.052850', '0.043021', '0.045253', '0.048891', '0.045068', '0.042233', '0.053776', '0.050447', '0.061770', '0.050574', '0.045747', '0.046397', '0.051626', '0.052011', '0.049486', '0.052889', '0.054506']
         : correct/total = [(207, 4128), (205, 4203), (224, 4081), (229, 4333), (176, 4091), (194, 4287), (205, 4193), (196, 4349), (177, 4191), (230, 4277), (209, 4143), (259, 4193), (207, 4093), (192, 4197), (188, 4052), (208, 4029), (216, 4153), (207, 4183), (216, 4084), (225, 4128)]
         : compromised: 0.0455, honest: 0.0505
Round 009: test acc mean=0.0501 ± 0.0041 | min=0.0422 max=0.0582
         : test loss mean=nan ± nan
         : individual accs = ['0.050145', '0.048775', '0.053418', '0.048465', '0.043021', '0.045253', '0.044598', '0.058174', '0.042233', '0.053776', '0.055998', '0.049606', '0.048620', '0.047177', '0.051826', '0.051626', '0.052011', '0.049486', '0.052889', '0.054506']
         : correct/total = [(207, 4128), (205, 4203), (218, 4081), (210, 4333), (176, 4091), (194, 4287), (187, 4193), (253, 4349), (177, 4191), (230, 4277), (232, 4143), (208, 4193), (199, 4093), (198, 4197), (210, 4052), (208, 4029), (216, 4153), (207, 4183), (216, 4084), (225, 4128)]
         : compromised: 0.0462, honest: 0.0505
Round 010: test acc mean=0.0497 ± 0.0056 | min=0.0356 max=0.0618
         : test loss mean=nan ± nan
         : individual accs = ['0.050145', '0.048775', '0.053418', '0.043157', '0.043021', '0.045253', '0.048891', '0.035640', '0.042233', '0.053776', '0.055998', '0.061770', '0.050574', '0.049083', '0.051826', '0.051626', '0.052011', '0.049486', '0.052889', '0.054506']
         : correct/total = [(207, 4128), (205, 4203), (218, 4081), (187, 4333), (176, 4091), (194, 4287), (205, 4193), (155, 4349), (177, 4191), (230, 4277), (232, 4143), (259, 4193), (207, 4093), (206, 4197), (210, 4052), (208, 4029), (216, 4153), (207, 4183), (216, 4084), (225, 4128)]
         : compromised: 0.0472, honest: 0.0500

=== FINAL RESULTS ===
Dataset: femnist, Nodes: 20, Graph: ring, Aggregation: d-fedavg
Attack: backdoor, 10.0% compromised
Final accuracy - Compromised: 0.0472, Honest: 0.0500
Overall test accuracy: mean=0.0497 ± 0.0056

=== BACKDOOR ATTACK SUCCESS RATE (ASR) ===
Target label: 0
Trigger size: 4x4
Overall ASR: 0.6500 ± 0.4770
Honest nodes ASR: 0.6111 ± 0.4875
Compromised nodes ASR: 1.0000 ± 0.0000
Note: Higher ASR indicates more successful backdoor attack
