Device: cuda
Seed: 987654321
Loading 36 LEAF FEMNIST train files...
LEAF FEMNIST train: 3597 users, 734463 samples
Loading 36 LEAF FEMNIST test files...
LEAF FEMNIST test: 3597 users, 83388 samples
Found 3597 train users, 3597 test users, 3597 common users
User sample counts range: 525 (max) to 17 (min)
Distributed ALL 3597 users across 20 clients
Users per client: 179 (with 17 clients getting +1 user)
Train partition sizes: [36360, 37070, 35957, 38262, 36024, 37732, 36921, 38328, 36867, 37683, 36507, 36915, 36007, 37001, 35681, 35453, 36585, 36801, 35964, 36345]
Test partition sizes: [4128, 4203, 4081, 4333, 4091, 4287, 4193, 4349, 4191, 4277, 4143, 4193, 4093, 4197, 4052, 4029, 4153, 4183, 4084, 4128]
  Client 0: 36360 train samples, 62 unique classes
  Client 1: 37070 train samples, 62 unique classes
  Client 2: 35957 train samples, 62 unique classes
  Client 3: 38262 train samples, 62 unique classes
  Client 4: 36024 train samples, 62 unique classes
  Client 5: 37732 train samples, 62 unique classes
  Client 6: 36921 train samples, 62 unique classes
  Client 7: 38328 train samples, 62 unique classes
  Client 8: 36867 train samples, 62 unique classes
  Client 9: 37683 train samples, 62 unique classes
  Client 10: 36507 train samples, 62 unique classes
  Client 11: 36915 train samples, 62 unique classes
  Client 12: 36007 train samples, 62 unique classes
  Client 13: 37001 train samples, 62 unique classes
  Client 14: 35681 train samples, 62 unique classes
  Client 15: 35453 train samples, 62 unique classes
  Client 16: 36585 train samples, 62 unique classes
  Client 17: 36801 train samples, 62 unique classes
  Client 18: 35964 train samples, 62 unique classes
  Client 19: 36345 train samples, 62 unique classes
Will sample 10000 samples per client per epoch
Graph: erdos, nodes: 20, edges: 99
Degree statistics: avg=9.90, min=7, max=14
Attack: Compromised 12/20 nodes: [1, 2, 3, 5, 8, 11, 12, 13, 14, 15, 17, 18]
Attack type: directed_deviation, lambda: 1.0
Model variant: baseline
Model parameters: 6,603,710
Initial test acc across nodes: mean=0.0162 ± 0.0138
Round 001: test acc mean=0.0162 ± 0.0156 | min=0.0031 max=0.0518
         : test loss mean=44290.7907 ± 31583.6998
         : individual accs = ['0.005329', '0.045206', '0.007351', '0.039926', '0.006355', '0.003499', '0.010017', '0.020005', '0.006442', '0.005611', '0.005793', '0.051753', '0.030051', '0.010245', '0.008391', '0.013403', '0.004575', '0.003108', '0.005632', '0.042151']
         : correct/total = [(22, 4128), (190, 4203), (30, 4081), (173, 4333), (26, 4091), (15, 4287), (42, 4193), (87, 4349), (27, 4191), (24, 4277), (24, 4143), (217, 4193), (123, 4093), (43, 4197), (34, 4052), (54, 4029), (19, 4153), (13, 4183), (23, 4084), (174, 4128)]
         : compromised: 0.0188, honest: 0.0125
Round 002: test acc mean=0.0497 ± 0.0048 | min=0.0415 max=0.0597
         : test loss mean=5437257727411.1738 ± 11230315165589.7129
         : individual accs = ['0.050630', '0.046395', '0.049743', '0.043850', '0.044243', '0.042454', '0.041498', '0.052656', '0.053686', '0.048632', '0.048033', '0.054853', '0.048375', '0.049083', '0.053801', '0.051874', '0.050807', '0.045422', '0.059745', '0.057413']
         : correct/total = [(209, 4128), (195, 4203), (203, 4081), (190, 4333), (181, 4091), (182, 4287), (174, 4193), (229, 4349), (225, 4191), (208, 4277), (199, 4143), (230, 4193), (198, 4093), (206, 4197), (218, 4052), (209, 4029), (211, 4153), (190, 4183), (244, 4084), (237, 4128)]
         : compromised: 0.0499, honest: 0.0492
Round 003: test acc mean=0.0503 ± 0.0060 | min=0.0389 max=0.0623
         : test loss mean=2836326472.0255 ± 12363260125.7037
         : individual accs = ['0.049661', '0.046395', '0.061505', '0.049850', '0.045466', '0.052018', '0.053422', '0.046907', '0.042711', '0.048632', '0.051895', '0.046983', '0.062301', '0.046938', '0.053801', '0.043435', '0.050807', '0.057853', '0.038932', '0.057413']
         : correct/total = [(205, 4128), (195, 4203), (251, 4081), (216, 4333), (186, 4091), (223, 4287), (224, 4193), (204, 4349), (179, 4191), (208, 4277), (215, 4143), (197, 4193), (255, 4093), (197, 4197), (218, 4052), (175, 4029), (211, 4153), (242, 4183), (159, 4084), (237, 4128)]
         : compromised: 0.0502, honest: 0.0505
Round 004: test acc mean=0.0536 ± 0.0046 | min=0.0469 max=0.0623
         : test loss mean=147.7448 ± 289.7050
         : individual accs = ['0.049661', '0.052819', '0.061505', '0.049850', '0.052066', '0.052018', '0.051991', '0.052656', '0.050823', '0.048632', '0.051895', '0.054853', '0.062301', '0.046938', '0.055281', '0.061554', '0.050566', '0.057853', '0.060235', '0.047965']
         : correct/total = [(205, 4128), (222, 4203), (251, 4081), (216, 4333), (213, 4091), (223, 4287), (218, 4193), (229, 4349), (213, 4191), (208, 4277), (215, 4143), (230, 4193), (255, 4093), (197, 4197), (224, 4052), (248, 4029), (210, 4153), (242, 4183), (246, 4084), (198, 4128)]
         : compromised: 0.0555, honest: 0.0507
Round 005: test acc mean=0.0514 ± 0.0041 | min=0.0446 max=0.0616
         : test loss mean=502.5516 ± 499.6958
         : individual accs = ['0.049661', '0.052819', '0.049253', '0.048004', '0.051821', '0.051318', '0.051753', '0.044608', '0.053686', '0.048632', '0.051171', '0.051037', '0.047642', '0.046938', '0.050099', '0.061554', '0.050566', '0.057853', '0.059745', '0.050630']
         : correct/total = [(205, 4128), (222, 4203), (201, 4081), (208, 4333), (212, 4091), (220, 4287), (217, 4193), (194, 4349), (225, 4191), (208, 4277), (212, 4143), (214, 4193), (195, 4093), (197, 4197), (203, 4052), (248, 4029), (210, 4153), (242, 4183), (244, 4084), (209, 4128)]
         : compromised: 0.0525, honest: 0.0499
Round 006: test acc mean=0.0545 ± 0.0043 | min=0.0486 max=0.0623
         : test loss mean=83.5122 ± 347.9416
         : individual accs = ['0.049661', '0.052819', '0.061505', '0.049850', '0.052066', '0.052018', '0.053422', '0.052656', '0.057266', '0.048632', '0.051895', '0.054853', '0.062301', '0.049083', '0.055281', '0.061554', '0.050084', '0.057853', '0.060235', '0.057413']
         : correct/total = [(205, 4128), (222, 4203), (251, 4081), (216, 4333), (213, 4091), (223, 4287), (224, 4193), (229, 4349), (240, 4191), (208, 4277), (215, 4143), (230, 4193), (255, 4093), (206, 4197), (224, 4052), (248, 4029), (208, 4153), (242, 4183), (246, 4084), (237, 4128)]
         : compromised: 0.0562, honest: 0.0520
Round 007: test acc mean=0.0545 ± 0.0043 | min=0.0486 max=0.0623
         : test loss mean=3.6872 ± 0.0138
         : individual accs = ['0.049661', '0.052819', '0.061505', '0.049850', '0.052066', '0.052018', '0.053422', '0.052656', '0.057266', '0.048632', '0.051895', '0.054853', '0.062301', '0.049083', '0.055281', '0.061554', '0.050566', '0.057853', '0.060235', '0.057413']
         : correct/total = [(205, 4128), (222, 4203), (251, 4081), (216, 4333), (213, 4091), (223, 4287), (224, 4193), (229, 4349), (240, 4191), (208, 4277), (215, 4143), (230, 4193), (255, 4093), (206, 4197), (224, 4052), (248, 4029), (210, 4153), (242, 4183), (246, 4084), (237, 4128)]
         : compromised: 0.0562, honest: 0.0520
Round 008: test acc mean=0.0545 ± 0.0043 | min=0.0486 max=0.0623
         : test loss mean=3.6859 ± 0.0139
         : individual accs = ['0.049661', '0.052819', '0.061505', '0.049850', '0.052066', '0.052018', '0.053422', '0.052656', '0.057266', '0.048632', '0.051895', '0.054853', '0.062301', '0.049083', '0.055281', '0.061554', '0.050566', '0.057853', '0.060235', '0.057413']
         : correct/total = [(205, 4128), (222, 4203), (251, 4081), (216, 4333), (213, 4091), (223, 4287), (224, 4193), (229, 4349), (240, 4191), (208, 4277), (215, 4143), (230, 4193), (255, 4093), (206, 4197), (224, 4052), (248, 4029), (210, 4153), (242, 4183), (246, 4084), (237, 4128)]
         : compromised: 0.0562, honest: 0.0520
Round 009: test acc mean=0.0545 ± 0.0043 | min=0.0486 max=0.0623
         : test loss mean=3.6852 ± 0.0140
         : individual accs = ['0.049661', '0.052819', '0.061505', '0.049850', '0.052066', '0.052018', '0.053422', '0.052656', '0.057266', '0.048632', '0.051895', '0.054853', '0.062301', '0.049083', '0.055281', '0.061554', '0.050566', '0.057853', '0.060235', '0.057413']
         : correct/total = [(205, 4128), (222, 4203), (251, 4081), (216, 4333), (213, 4091), (223, 4287), (224, 4193), (229, 4349), (240, 4191), (208, 4277), (215, 4143), (230, 4193), (255, 4093), (206, 4197), (224, 4052), (248, 4029), (210, 4153), (242, 4183), (246, 4084), (237, 4128)]
         : compromised: 0.0562, honest: 0.0520
Round 010: test acc mean=0.0545 ± 0.0043 | min=0.0486 max=0.0623
         : test loss mean=3.6849 ± 0.0141
         : individual accs = ['0.049661', '0.052819', '0.061505', '0.049850', '0.052066', '0.052018', '0.053422', '0.052656', '0.057266', '0.048632', '0.051895', '0.054853', '0.062301', '0.049083', '0.055281', '0.061554', '0.050566', '0.057853', '0.060235', '0.057413']
         : correct/total = [(205, 4128), (222, 4203), (251, 4081), (216, 4333), (213, 4091), (223, 4287), (224, 4193), (229, 4349), (240, 4191), (208, 4277), (215, 4143), (230, 4193), (255, 4093), (206, 4197), (224, 4052), (248, 4029), (210, 4153), (242, 4183), (246, 4084), (237, 4128)]
         : compromised: 0.0562, honest: 0.0520

=== FINAL RESULTS ===
Dataset: femnist, Nodes: 20, Graph: erdos, Aggregation: d-fedavg
Attack: directed_deviation, 60.0% compromised
Final accuracy - Compromised: 0.0562, Honest: 0.0520
Overall test accuracy: mean=0.0545 ± 0.0043
