Device: cuda
Seed: 987654321
Loading 36 LEAF FEMNIST train files...
LEAF FEMNIST train: 3597 users, 734463 samples
Loading 36 LEAF FEMNIST test files...
LEAF FEMNIST test: 3597 users, 83388 samples
Found 3597 train users, 3597 test users, 3597 common users
User sample counts range: 525 (max) to 17 (min)
Distributed ALL 3597 users across 20 clients
Users per client: 179 (with 17 clients getting +1 user)
Train partition sizes: [36360, 37070, 35957, 38262, 36024, 37732, 36921, 38328, 36867, 37683, 36507, 36915, 36007, 37001, 35681, 35453, 36585, 36801, 35964, 36345]
Test partition sizes: [4128, 4203, 4081, 4333, 4091, 4287, 4193, 4349, 4191, 4277, 4143, 4193, 4093, 4197, 4052, 4029, 4153, 4183, 4084, 4128]
  Client 0: 36360 train samples, 62 unique classes
  Client 1: 37070 train samples, 62 unique classes
  Client 2: 35957 train samples, 62 unique classes
  Client 3: 38262 train samples, 62 unique classes
  Client 4: 36024 train samples, 62 unique classes
  Client 5: 37732 train samples, 62 unique classes
  Client 6: 36921 train samples, 62 unique classes
  Client 7: 38328 train samples, 62 unique classes
  Client 8: 36867 train samples, 62 unique classes
  Client 9: 37683 train samples, 62 unique classes
  Client 10: 36507 train samples, 62 unique classes
  Client 11: 36915 train samples, 62 unique classes
  Client 12: 36007 train samples, 62 unique classes
  Client 13: 37001 train samples, 62 unique classes
  Client 14: 35681 train samples, 62 unique classes
  Client 15: 35453 train samples, 62 unique classes
  Client 16: 36585 train samples, 62 unique classes
  Client 17: 36801 train samples, 62 unique classes
  Client 18: 35964 train samples, 62 unique classes
  Client 19: 36345 train samples, 62 unique classes
Will sample 10000 samples per client per epoch
Graph: erdos, nodes: 20, edges: 99
Degree statistics: avg=9.90, min=7, max=14
Attack: Compromised 4/20 nodes: [5, 12, 13, 17]
Attack type: backdoor, lambda: 1.0
Backdoor target label: 0, trigger size: 4
Model variant: baseline
Model parameters: 6,603,710
Initial test acc across nodes: mean=0.0162 ± 0.0138
Backdoor attack: Created poisoned datasets for 4 compromised nodes
Round 001: test acc mean=0.0210 ± 0.0185 | min=0.0036 max=0.0615
         : test loss mean=1021.3282 ± 1294.2967
         : individual accs = ['0.005329', '0.058292', '0.061505', '0.024925', '0.019311', '0.042920', '0.005008', '0.008508', '0.004056', '0.048632', '0.013034', '0.006439', '0.018813', '0.003574', '0.004689', '0.009183', '0.007705', '0.020798', '0.015916', '0.040940']
         : correct/total = [(22, 4128), (245, 4203), (251, 4081), (108, 4333), (79, 4091), (184, 4287), (21, 4193), (37, 4349), (17, 4191), (208, 4277), (54, 4143), (27, 4193), (77, 4093), (15, 4197), (19, 4052), (37, 4029), (32, 4153), (87, 4183), (65, 4084), (169, 4128)]
         : compromised: 0.0215, honest: 0.0208
Round 002: test acc mean=0.0495 ± 0.0035 | min=0.0446 max=0.0602
         : test loss mean=60687911.2724 ± 243126749.8898
         : individual accs = ['0.048450', '0.048299', '0.049743', '0.048004', '0.045710', '0.051318', '0.052707', '0.046447', '0.044619', '0.050736', '0.053102', '0.049845', '0.047398', '0.047653', '0.052320', '0.048151', '0.045750', '0.052833', '0.060235', '0.046512']
         : correct/total = [(200, 4128), (203, 4203), (203, 4081), (208, 4333), (187, 4091), (220, 4287), (221, 4193), (202, 4349), (187, 4191), (217, 4277), (220, 4143), (209, 4193), (194, 4093), (200, 4197), (212, 4052), (194, 4029), (190, 4153), (221, 4183), (246, 4084), (192, 4128)]
         : compromised: 0.0498, honest: 0.0494
Round 003: test acc mean=0.0493 ± 0.0022 | min=0.0453 max=0.0528
         : test loss mean=1719539.0516 ± 2483457.0802
         : individual accs = ['0.049661', '0.048299', '0.049743', '0.047542', '0.048399', '0.052018', '0.045314', '0.046907', '0.052732', '0.050736', '0.050205', '0.051514', '0.052040', '0.047653', '0.049112', '0.046910', '0.050566', '0.052833', '0.045544', '0.049176']
         : correct/total = [(205, 4128), (203, 4203), (203, 4081), (206, 4333), (198, 4091), (223, 4287), (190, 4193), (204, 4349), (221, 4191), (217, 4277), (208, 4143), (216, 4193), (213, 4093), (200, 4197), (199, 4052), (189, 4029), (210, 4153), (221, 4183), (186, 4084), (203, 4128)]
         : compromised: 0.0511, honest: 0.0489
Round 004: test acc mean=0.0498 ± 0.0097 | min=0.0235 max=0.0623
         : test loss mean=111231.2063 ± 200778.5147
         : individual accs = ['0.049661', '0.048299', '0.061505', '0.049850', '0.052066', '0.052018', '0.053422', '0.052656', '0.024338', '0.048632', '0.051895', '0.054853', '0.062301', '0.045509', '0.055281', '0.048151', '0.050566', '0.052116', '0.060235', '0.023498']
         : correct/total = [(205, 4128), (203, 4203), (251, 4081), (216, 4333), (213, 4091), (223, 4287), (224, 4193), (229, 4349), (102, 4191), (208, 4277), (215, 4143), (230, 4193), (255, 4093), (191, 4197), (224, 4052), (194, 4029), (210, 4153), (218, 4183), (246, 4084), (97, 4128)]
         : compromised: 0.0530, honest: 0.0491
Round 005: test acc mean=0.0545 ± 0.0043 | min=0.0486 max=0.0623
         : test loss mean=3.7059 ± 0.0188
         : individual accs = ['0.049661', '0.052819', '0.061505', '0.049850', '0.052066', '0.052018', '0.053422', '0.052656', '0.057266', '0.048632', '0.051895', '0.054853', '0.062301', '0.049083', '0.055281', '0.061554', '0.050566', '0.057853', '0.060235', '0.057413']
         : correct/total = [(205, 4128), (222, 4203), (251, 4081), (216, 4333), (213, 4091), (223, 4287), (224, 4193), (229, 4349), (240, 4191), (208, 4277), (215, 4143), (230, 4193), (255, 4093), (206, 4197), (224, 4052), (248, 4029), (210, 4153), (242, 4183), (246, 4084), (237, 4128)]
         : compromised: 0.0553, honest: 0.0544
Round 006: test acc mean=0.0523 ± 0.0049 | min=0.0464 max=0.0623
         : test loss mean=135283.9237 ± 589478.8259
         : individual accs = ['0.049661', '0.052819', '0.061505', '0.049850', '0.052066', '0.052951', '0.051276', '0.050586', '0.052732', '0.048632', '0.052860', '0.048653', '0.062301', '0.049083', '0.047384', '0.061554', '0.049362', '0.046378', '0.060235', '0.046512']
         : correct/total = [(205, 4128), (222, 4203), (251, 4081), (216, 4333), (213, 4091), (227, 4287), (215, 4193), (220, 4349), (221, 4191), (208, 4277), (219, 4143), (204, 4193), (255, 4093), (206, 4197), (192, 4052), (248, 4029), (205, 4153), (194, 4183), (246, 4084), (192, 4128)]
         : compromised: 0.0527, honest: 0.0522
Round 007: test acc mean=0.0529 ± 0.0051 | min=0.0438 max=0.0623
         : test loss mean=19176.2581 ± 82824.5182
         : individual accs = ['0.049661', '0.050440', '0.061505', '0.043850', '0.047910', '0.058782', '0.053422', '0.046447', '0.052732', '0.048632', '0.051895', '0.054853', '0.062301', '0.049083', '0.055281', '0.046910', '0.050566', '0.057853', '0.060235', '0.054990']
         : correct/total = [(205, 4128), (212, 4203), (251, 4081), (190, 4333), (196, 4091), (252, 4287), (224, 4193), (202, 4349), (221, 4191), (208, 4277), (215, 4143), (230, 4193), (255, 4093), (206, 4197), (224, 4052), (189, 4029), (210, 4153), (242, 4183), (246, 4084), (227, 4128)]
         : compromised: 0.0570, honest: 0.0518
Round 008: test acc mean=0.0480 ± 0.0075 | min=0.0351 max=0.0623
         : test loss mean=8.6490 ± 9.2139
         : individual accs = ['0.049661', '0.048775', '0.061505', '0.048004', '0.045710', '0.043387', '0.041498', '0.049897', '0.038893', '0.048632', '0.051412', '0.035058', '0.062301', '0.049083', '0.037512', '0.054604', '0.047436', '0.047574', '0.060235', '0.038275']
         : correct/total = [(205, 4128), (205, 4203), (251, 4081), (208, 4333), (187, 4091), (186, 4287), (174, 4193), (217, 4349), (163, 4191), (208, 4277), (213, 4143), (147, 4193), (255, 4093), (206, 4197), (152, 4052), (220, 4029), (197, 4153), (199, 4183), (246, 4084), (158, 4128)]
         : compromised: 0.0506, honest: 0.0473
Round 009: test acc mean=0.0457 ± 0.0087 | min=0.0243 max=0.0615
         : test loss mean=5.9471 ± 4.4101
         : individual accs = ['0.048207', '0.047347', '0.061505', '0.048004', '0.053043', '0.043387', '0.051753', '0.039549', '0.024338', '0.048632', '0.051171', '0.051037', '0.047642', '0.046938', '0.037512', '0.046910', '0.035878', '0.032991', '0.059745', '0.038275']
         : correct/total = [(199, 4128), (199, 4203), (251, 4081), (208, 4333), (217, 4091), (186, 4287), (217, 4193), (172, 4349), (102, 4191), (208, 4277), (212, 4143), (214, 4193), (195, 4093), (197, 4197), (152, 4052), (189, 4029), (149, 4153), (138, 4183), (244, 4084), (158, 4128)]
         : compromised: 0.0427, honest: 0.0464
Round 010: test acc mean=0.0508 ± 0.0053 | min=0.0415 max=0.0615
         : test loss mean=16.0579 ± 38.8237
         : individual accs = ['0.059109', '0.048299', '0.061505', '0.049619', '0.045466', '0.058782', '0.041498', '0.046907', '0.051062', '0.048632', '0.053102', '0.049845', '0.047642', '0.046938', '0.054788', '0.048151', '0.050807', '0.045422', '0.059745', '0.047965']
         : correct/total = [(244, 4128), (203, 4203), (251, 4081), (215, 4333), (186, 4091), (252, 4287), (174, 4193), (204, 4349), (214, 4191), (208, 4277), (220, 4143), (209, 4193), (195, 4093), (197, 4197), (222, 4052), (194, 4029), (211, 4153), (190, 4183), (244, 4084), (198, 4128)]
         : compromised: 0.0497, honest: 0.0510

=== FINAL RESULTS ===
Dataset: femnist, Nodes: 20, Graph: erdos, Aggregation: d-fedavg
Attack: backdoor, 20.0% compromised
Final accuracy - Compromised: 0.0497, Honest: 0.0510
Overall test accuracy: mean=0.0508 ± 0.0053

=== BACKDOOR ATTACK SUCCESS RATE (ASR) ===
Target label: 0
Trigger size: 4x4
Overall ASR: 0.1500 ± 0.3571
Honest nodes ASR: 0.1875 ± 0.3903
Compromised nodes ASR: 0.0000 ± 0.0000
Note: Higher ASR indicates more successful backdoor attack
