Device: cuda
Seed: 987654321
Loading 36 LEAF FEMNIST train files...
LEAF FEMNIST train: 3597 users, 734463 samples
Loading 36 LEAF FEMNIST test files...
LEAF FEMNIST test: 3597 users, 83388 samples
Found 3597 train users, 3597 test users, 3597 common users
User sample counts range: 525 (max) to 17 (min)
Distributed ALL 3597 users across 20 clients
Users per client: 179 (with 17 clients getting +1 user)
Train partition sizes: [36360, 37070, 35957, 38262, 36024, 37732, 36921, 38328, 36867, 37683, 36507, 36915, 36007, 37001, 35681, 35453, 36585, 36801, 35964, 36345]
Test partition sizes: [4128, 4203, 4081, 4333, 4091, 4287, 4193, 4349, 4191, 4277, 4143, 4193, 4093, 4197, 4052, 4029, 4153, 4183, 4084, 4128]
  Client 0: 36360 train samples, 62 unique classes
  Client 1: 37070 train samples, 62 unique classes
  Client 2: 35957 train samples, 62 unique classes
  Client 3: 38262 train samples, 62 unique classes
  Client 4: 36024 train samples, 62 unique classes
  Client 5: 37732 train samples, 62 unique classes
  Client 6: 36921 train samples, 62 unique classes
  Client 7: 38328 train samples, 62 unique classes
  Client 8: 36867 train samples, 62 unique classes
  Client 9: 37683 train samples, 62 unique classes
  Client 10: 36507 train samples, 62 unique classes
  Client 11: 36915 train samples, 62 unique classes
  Client 12: 36007 train samples, 62 unique classes
  Client 13: 37001 train samples, 62 unique classes
  Client 14: 35681 train samples, 62 unique classes
  Client 15: 35453 train samples, 62 unique classes
  Client 16: 36585 train samples, 62 unique classes
  Client 17: 36801 train samples, 62 unique classes
  Client 18: 35964 train samples, 62 unique classes
  Client 19: 36345 train samples, 62 unique classes
Will sample 10000 samples per client per epoch
Graph: erdos, nodes: 20, edges: 99
Degree statistics: avg=9.90, min=7, max=14
Attack: Compromised 8/20 nodes: [1, 5, 11, 12, 13, 14, 17, 18]
Attack type: backdoor, lambda: 1.0
Backdoor target label: 0, trigger size: 4
Model variant: baseline
Model parameters: 6,603,710
Sketchguard Node 0:
  Model dim: 6,603,710 → Sketch size: 1000
  Compression ratio: 6603.7x
  Using model parameters for aggregation, sketches for filtering
Sketchguard Node 1:
  Model dim: 6,603,710 → Sketch size: 1000
  Compression ratio: 6603.7x
  Using model parameters for aggregation, sketches for filtering
Sketchguard Node 2:
  Model dim: 6,603,710 → Sketch size: 1000
  Compression ratio: 6603.7x
  Using model parameters for aggregation, sketches for filtering
Sketchguard Node 3:
  Model dim: 6,603,710 → Sketch size: 1000
  Compression ratio: 6603.7x
  Using model parameters for aggregation, sketches for filtering
Sketchguard Node 4:
  Model dim: 6,603,710 → Sketch size: 1000
  Compression ratio: 6603.7x
  Using model parameters for aggregation, sketches for filtering
Sketchguard Node 5:
  Model dim: 6,603,710 → Sketch size: 1000
  Compression ratio: 6603.7x
  Using model parameters for aggregation, sketches for filtering
Sketchguard Node 6:
  Model dim: 6,603,710 → Sketch size: 1000
  Compression ratio: 6603.7x
  Using model parameters for aggregation, sketches for filtering
Sketchguard Node 7:
  Model dim: 6,603,710 → Sketch size: 1000
  Compression ratio: 6603.7x
  Using model parameters for aggregation, sketches for filtering
Sketchguard Node 8:
  Model dim: 6,603,710 → Sketch size: 1000
  Compression ratio: 6603.7x
  Using model parameters for aggregation, sketches for filtering
Sketchguard Node 9:
  Model dim: 6,603,710 → Sketch size: 1000
  Compression ratio: 6603.7x
  Using model parameters for aggregation, sketches for filtering
Sketchguard Node 10:
  Model dim: 6,603,710 → Sketch size: 1000
  Compression ratio: 6603.7x
  Using model parameters for aggregation, sketches for filtering
Sketchguard Node 11:
  Model dim: 6,603,710 → Sketch size: 1000
  Compression ratio: 6603.7x
  Using model parameters for aggregation, sketches for filtering
Sketchguard Node 12:
  Model dim: 6,603,710 → Sketch size: 1000
  Compression ratio: 6603.7x
  Using model parameters for aggregation, sketches for filtering
Sketchguard Node 13:
  Model dim: 6,603,710 → Sketch size: 1000
  Compression ratio: 6603.7x
  Using model parameters for aggregation, sketches for filtering
Sketchguard Node 14:
  Model dim: 6,603,710 → Sketch size: 1000
  Compression ratio: 6603.7x
  Using model parameters for aggregation, sketches for filtering
Sketchguard Node 15:
  Model dim: 6,603,710 → Sketch size: 1000
  Compression ratio: 6603.7x
  Using model parameters for aggregation, sketches for filtering
Sketchguard Node 16:
  Model dim: 6,603,710 → Sketch size: 1000
  Compression ratio: 6603.7x
  Using model parameters for aggregation, sketches for filtering
Sketchguard Node 17:
  Model dim: 6,603,710 → Sketch size: 1000
  Compression ratio: 6603.7x
  Using model parameters for aggregation, sketches for filtering
Sketchguard Node 18:
  Model dim: 6,603,710 → Sketch size: 1000
  Compression ratio: 6603.7x
  Using model parameters for aggregation, sketches for filtering
Sketchguard Node 19:
  Model dim: 6,603,710 → Sketch size: 1000
  Compression ratio: 6603.7x
  Using model parameters for aggregation, sketches for filtering
Sketchguard ALGORITHM (Sketch-based Filtering + State Aggregation)
  - Model dimension: 6,603,710 parameters
  - Config: SketchguardConfig(gamma=2, kappa=1, alpha=0.5, min_neighbors=1, sketch_size=1000, network_seed=987654321, attack_detection_window=5)
  - Sketch size: 1000
  - Compression ratio: 6603.7x
  - Complexity: O(d + N×k) = O(6,603,710 + 20×1000)
  - Theoretical speedup vs BALANCE: 19.9x
Initial test acc across nodes: mean=0.0162 ± 0.0138
Backdoor attack: Created poisoned datasets for 8 compromised nodes
Round 001: test acc mean=0.3215 ± 0.1737 | min=0.0474 max=0.5383
         : test loss mean=6993.0034 ± 8817.5817
         : individual accs = ['0.538275', '0.048775', '0.484685', '0.451881', '0.430213', '0.174714', '0.461245', '0.437802', '0.460988', '0.448913', '0.419261', '0.146196', '0.047398', '0.047653', '0.168065', '0.492926', '0.434385', '0.179058', '0.110186', '0.446463']
         : correct/total = [(2222, 4128), (205, 4203), (1978, 4081), (1958, 4333), (1760, 4091), (749, 4287), (1934, 4193), (1904, 4349), (1932, 4191), (1920, 4277), (1737, 4143), (613, 4193), (194, 4093), (200, 4197), (681, 4052), (1986, 4029), (1804, 4153), (749, 4183), (450, 4084), (1843, 4128)]
         : compromised: 0.1153, honest: 0.4589
         : sketchguard stats = ['Node 0: acc_rate=0.583', 'Node 1: acc_rate=0.700', 'Node 2: acc_rate=0.500']...
Round 002: test acc mean=0.4246 ± 0.3123 | min=0.0036 max=0.7018
         : test loss mean=nan ± nan
         : individual accs = ['0.701793', '0.052819', '0.671159', '0.700438', '0.685407', '0.052484', '0.635345', '0.688434', '0.675257', '0.700491', '0.678735', '0.051037', '0.048131', '0.003574', '0.047384', '0.681807', '0.659523', '0.047574', '0.038932', '0.672481']
         : correct/total = [(2897, 4128), (222, 4203), (2739, 4081), (3035, 4333), (2804, 4091), (225, 4287), (2664, 4193), (2994, 4349), (2830, 4191), (2996, 4277), (2812, 4143), (214, 4193), (197, 4093), (15, 4197), (192, 4052), (2747, 4029), (2739, 4153), (199, 4183), (159, 4084), (2776, 4128)]
         : compromised: 0.0427, honest: 0.6792
         : sketchguard stats = ['Node 0: acc_rate=0.583', 'Node 1: acc_rate=0.850', 'Node 2: acc_rate=0.500']...
Round 003: test acc mean=0.4462 ± 0.3234 | min=0.0474 max=0.7406
         : test loss mean=nan ± nan
         : individual accs = ['0.731347', '0.048775', '0.683411', '0.740595', '0.691029', '0.052484', '0.728834', '0.712118', '0.718921', '0.703063', '0.705769', '0.048891', '0.047398', '0.047653', '0.054788', '0.694217', '0.691067', '0.049247', '0.054358', '0.719961']
         : correct/total = [(3019, 4128), (205, 4203), (2789, 4081), (3209, 4333), (2827, 4091), (225, 4287), (3056, 4193), (3097, 4349), (3013, 4191), (3007, 4277), (2924, 4143), (205, 4193), (194, 4093), (200, 4197), (222, 4052), (2797, 4029), (2870, 4153), (206, 4183), (222, 4084), (2972, 4128)]
         : compromised: 0.0504, honest: 0.7100
         : sketchguard stats = ['Node 0: acc_rate=0.583', 'Node 1: acc_rate=0.567', 'Node 2: acc_rate=0.500']...
Round 004: test acc mean=0.4614 ± 0.3358 | min=0.0474 max=0.7683
         : test loss mean=nan ± nan
         : individual accs = ['0.738614', '0.048775', '0.721392', '0.745673', '0.748228', '0.052484', '0.739089', '0.738791', '0.768313', '0.732990', '0.688631', '0.048891', '0.047398', '0.047653', '0.054788', '0.746587', '0.731038', '0.049247', '0.054358', '0.724806']
         : correct/total = [(3049, 4128), (205, 4203), (2944, 4081), (3231, 4333), (3061, 4091), (225, 4287), (3099, 4193), (3213, 4349), (3220, 4191), (3135, 4277), (2853, 4143), (205, 4193), (194, 4093), (200, 4197), (222, 4052), (3008, 4029), (3036, 4153), (206, 4183), (222, 4084), (2992, 4128)]
         : compromised: 0.0504, honest: 0.7353
         : sketchguard stats = ['Node 0: acc_rate=0.583', 'Node 1: acc_rate=0.425', 'Node 2: acc_rate=0.500']...
Round 005: test acc mean=0.4752 ± 0.3471 | min=0.0474 max=0.7948
         : test loss mean=nan ± nan
         : individual accs = ['0.734254', '0.048775', '0.754717', '0.758597', '0.750917', '0.052484', '0.737896', '0.764774', '0.794798', '0.771803', '0.729906', '0.048891', '0.047398', '0.047653', '0.054788', '0.769173', '0.777992', '0.049247', '0.054358', '0.754845']
         : correct/total = [(3031, 4128), (205, 4203), (3080, 4081), (3287, 4333), (3072, 4091), (225, 4287), (3094, 4193), (3326, 4349), (3331, 4191), (3301, 4277), (3024, 4143), (205, 4193), (194, 4093), (200, 4197), (222, 4052), (3099, 4029), (3231, 4153), (206, 4183), (222, 4084), (3116, 4128)]
         : compromised: 0.0504, honest: 0.7583
         : sketchguard stats = ['Node 0: acc_rate=0.583', 'Node 1: acc_rate=0.340', 'Node 2: acc_rate=0.500']...
Round 006: test acc mean=0.4969 ± 0.3646 | min=0.0474 max=0.8063
         : test loss mean=nan ± nan
         : individual accs = ['0.772529', '0.048775', '0.793923', '0.806139', '0.786360', '0.052484', '0.783687', '0.805473', '0.806251', '0.797054', '0.788318', '0.048891', '0.047398', '0.047653', '0.054788', '0.801440', '0.805442', '0.049247', '0.054358', '0.788517']
         : correct/total = [(3189, 4128), (205, 4203), (3240, 4081), (3493, 4333), (3217, 4091), (225, 4287), (3286, 4193), (3503, 4349), (3379, 4191), (3409, 4277), (3266, 4143), (205, 4193), (194, 4093), (200, 4197), (222, 4052), (3229, 4029), (3345, 4153), (206, 4183), (222, 4084), (3255, 4128)]
         : compromised: 0.0504, honest: 0.7946
         : sketchguard stats = ['Node 0: acc_rate=0.583', 'Node 1: acc_rate=0.283', 'Node 2: acc_rate=0.500']...
Round 007: test acc mean=0.5102 ± 0.3755 | min=0.0474 max=0.8301
         : test loss mean=nan ± nan
         : individual accs = ['0.805475', '0.048775', '0.813771', '0.823679', '0.809582', '0.052484', '0.817553', '0.822948', '0.830112', '0.820669', '0.806420', '0.048891', '0.047398', '0.047653', '0.054788', '0.823033', '0.823501', '0.049247', '0.054358', '0.804506']
         : correct/total = [(3325, 4128), (205, 4203), (3321, 4081), (3569, 4333), (3312, 4091), (225, 4287), (3428, 4193), (3579, 4349), (3479, 4191), (3510, 4277), (3341, 4143), (205, 4193), (194, 4093), (200, 4197), (222, 4052), (3316, 4029), (3420, 4153), (206, 4183), (222, 4084), (3321, 4128)]
         : compromised: 0.0504, honest: 0.8168
         : sketchguard stats = ['Node 0: acc_rate=0.583', 'Node 1: acc_rate=0.243', 'Node 2: acc_rate=0.500']...
Round 008: test acc mean=0.5136 ± 0.3782 | min=0.0474 max=0.8335
         : test loss mean=nan ± nan
         : individual accs = ['0.814922', '0.048775', '0.819897', '0.832449', '0.819848', '0.052484', '0.825900', '0.833525', '0.824863', '0.832593', '0.815110', '0.048891', '0.047398', '0.047653', '0.054788', '0.825019', '0.817963', '0.049247', '0.054358', '0.806686']
         : correct/total = [(3364, 4128), (205, 4203), (3346, 4081), (3607, 4333), (3354, 4091), (225, 4287), (3463, 4193), (3625, 4349), (3457, 4191), (3561, 4277), (3377, 4143), (205, 4193), (194, 4093), (200, 4197), (222, 4052), (3324, 4029), (3397, 4153), (206, 4183), (222, 4084), (3330, 4128)]
         : compromised: 0.0504, honest: 0.8224
         : sketchguard stats = ['Node 0: acc_rate=0.583', 'Node 1: acc_rate=0.212', 'Node 2: acc_rate=0.500']...
Round 009: test acc mean=0.5226 ± 0.3855 | min=0.0474 max=0.8468
         : test loss mean=nan ± nan
         : individual accs = ['0.829215', '0.048775', '0.833864', '0.841911', '0.830848', '0.052484', '0.840448', '0.840883', '0.846815', '0.843582', '0.834661', '0.048891', '0.047398', '0.047653', '0.054788', '0.840159', '0.832892', '0.049247', '0.054358', '0.833333']
         : correct/total = [(3423, 4128), (205, 4203), (3403, 4081), (3648, 4333), (3399, 4091), (225, 4287), (3524, 4193), (3657, 4349), (3549, 4191), (3608, 4277), (3458, 4143), (205, 4193), (194, 4093), (200, 4197), (222, 4052), (3385, 4029), (3459, 4153), (206, 4183), (222, 4084), (3440, 4128)]
         : compromised: 0.0504, honest: 0.8374
         : sketchguard stats = ['Node 0: acc_rate=0.583', 'Node 1: acc_rate=0.189', 'Node 2: acc_rate=0.500']...
Round 010: test acc mean=0.5256 ± 0.3880 | min=0.0474 max=0.8498
         : test loss mean=nan ± nan
         : individual accs = ['0.836967', '0.048775', '0.839990', '0.849527', '0.835981', '0.052484', '0.846411', '0.846401', '0.845622', '0.847557', '0.832971', '0.048891', '0.047398', '0.047653', '0.054788', '0.849839', '0.841079', '0.049247', '0.054358', '0.836725']
         : correct/total = [(3455, 4128), (205, 4203), (3428, 4081), (3681, 4333), (3420, 4091), (225, 4287), (3549, 4193), (3681, 4349), (3544, 4191), (3625, 4277), (3451, 4143), (205, 4193), (194, 4093), (200, 4197), (222, 4052), (3424, 4029), (3493, 4153), (206, 4183), (222, 4084), (3454, 4128)]
         : compromised: 0.0504, honest: 0.8424
         : sketchguard stats = ['Node 0: acc_rate=0.583', 'Node 1: acc_rate=0.170', 'Node 2: acc_rate=0.500']...

=== FINAL RESULTS ===
Dataset: femnist, Nodes: 20, Graph: erdos, Aggregation: sketchguard
Attack: backdoor, 40.0% compromised
Final accuracy - Compromised: 0.0504, Honest: 0.8424
Overall test accuracy: mean=0.5256 ± 0.3880

=== BACKDOOR ATTACK SUCCESS RATE (ASR) ===
Target label: 0
Trigger size: 4x4
Overall ASR: 0.4325 ± 0.4634
Honest nodes ASR: 0.0541 ± 0.0048
Compromised nodes ASR: 1.0000 ± 0.0000
Note: Higher ASR indicates more successful backdoor attack

=== Sketchguard SUMMARY ===
Node 0: acceptance=0.583
Node 1: acceptance=0.170
Node 2: acceptance=0.500
Node 3: acceptance=0.571
Node 4: acceptance=0.444
Node 5: acceptance=0.050
Node 6: acceptance=0.500
Node 7: acceptance=0.455
Node 8: acceptance=0.286
Node 9: acceptance=0.818
Node 10: acceptance=0.625
Node 11: acceptance=0.150
Node 12: acceptance=0.167
Node 13: acceptance=0.167
Node 14: acceptance=0.157
Node 15: acceptance=0.444
Node 16: acceptance=0.429
Node 17: acceptance=0.163
Node 18: acceptance=0.167
Node 19: acceptance=0.500

=== PARALLEL EXECUTION TIME (realistic for distributed system) ===
  COMMUNICATION (max across nodes):
    - Sketch transfer: 0.000s (0.0%)
    - Model fetch (accepted): 0.000s (0.0%)
  COMPUTATION (max across nodes):
    - Sketching: 3.426s (99.4%)
    - Filtering: 0.001s (0.0%)
    - Aggregation: 0.019s (0.5%)
  TOTALS:
    - Total computation: 3.446s (100.0%)
    - Total communication: 0.000s (0.0%)
    - Total parallel time: 3.446s

=== PER-NODE AVERAGE TIME ===
  - Sketching: 1.974s
  - Filtering: 0.001s
  - Aggregation: 0.011s
  - Sketch transfer: 0.000s
  - Model fetch: 0.000s
  - Total per node: 1.987s

=== TOTAL COMPUTATIONAL WORK (sum across all nodes) ===
  - Total sketching: 39.488s
  - Total filtering: 0.017s
  - Total aggregation: 0.229s
  - Total sketch transfer: 0.000s
  - Total model fetch: 0.000s
  - Grand total: 39.735s
  - Mean acceptance rate: 0.367

Sketchguard Algorithm Properties:
  - Original dimension: 6,603,710
  - Sketch size: 1000
  - Compression ratio: 19.9x
  - Single repetition: No repetitions needed
  - Theoretical complexity: O(d + N×k)
  - Approach: Sketch filtering + state aggregation
