Device: cuda
Seed: 987654321
Loading 36 LEAF FEMNIST train files...
LEAF FEMNIST train: 3597 users, 734463 samples
Loading 36 LEAF FEMNIST test files...
LEAF FEMNIST test: 3597 users, 83388 samples
Found 3597 train users, 3597 test users, 3597 common users
User sample counts range: 525 (max) to 17 (min)
Distributed ALL 3597 users across 20 clients
Users per client: 179 (with 17 clients getting +1 user)
Train partition sizes: [36360, 37070, 35957, 38262, 36024, 37732, 36921, 38328, 36867, 37683, 36507, 36915, 36007, 37001, 35681, 35453, 36585, 36801, 35964, 36345]
Test partition sizes: [4128, 4203, 4081, 4333, 4091, 4287, 4193, 4349, 4191, 4277, 4143, 4193, 4093, 4197, 4052, 4029, 4153, 4183, 4084, 4128]
  Client 0: 36360 train samples, 62 unique classes
  Client 1: 37070 train samples, 62 unique classes
  Client 2: 35957 train samples, 62 unique classes
  Client 3: 38262 train samples, 62 unique classes
  Client 4: 36024 train samples, 62 unique classes
  Client 5: 37732 train samples, 62 unique classes
  Client 6: 36921 train samples, 62 unique classes
  Client 7: 38328 train samples, 62 unique classes
  Client 8: 36867 train samples, 62 unique classes
  Client 9: 37683 train samples, 62 unique classes
  Client 10: 36507 train samples, 62 unique classes
  Client 11: 36915 train samples, 62 unique classes
  Client 12: 36007 train samples, 62 unique classes
  Client 13: 37001 train samples, 62 unique classes
  Client 14: 35681 train samples, 62 unique classes
  Client 15: 35453 train samples, 62 unique classes
  Client 16: 36585 train samples, 62 unique classes
  Client 17: 36801 train samples, 62 unique classes
  Client 18: 35964 train samples, 62 unique classes
  Client 19: 36345 train samples, 62 unique classes
Will sample 10000 samples per client per epoch
Graph: ring, nodes: 20, edges: 20
Degree statistics: avg=2.00, min=2, max=2
Model variant: baseline
Model parameters: 6,603,710
Sketchguard Node 0:
  Model dim: 6,603,710 → Sketch size: 1000
  Compression ratio: 6603.7x
  Using model parameters for aggregation, sketches for filtering
Sketchguard Node 1:
  Model dim: 6,603,710 → Sketch size: 1000
  Compression ratio: 6603.7x
  Using model parameters for aggregation, sketches for filtering
Sketchguard Node 2:
  Model dim: 6,603,710 → Sketch size: 1000
  Compression ratio: 6603.7x
  Using model parameters for aggregation, sketches for filtering
Sketchguard Node 3:
  Model dim: 6,603,710 → Sketch size: 1000
  Compression ratio: 6603.7x
  Using model parameters for aggregation, sketches for filtering
Sketchguard Node 4:
  Model dim: 6,603,710 → Sketch size: 1000
  Compression ratio: 6603.7x
  Using model parameters for aggregation, sketches for filtering
Sketchguard Node 5:
  Model dim: 6,603,710 → Sketch size: 1000
  Compression ratio: 6603.7x
  Using model parameters for aggregation, sketches for filtering
Sketchguard Node 6:
  Model dim: 6,603,710 → Sketch size: 1000
  Compression ratio: 6603.7x
  Using model parameters for aggregation, sketches for filtering
Sketchguard Node 7:
  Model dim: 6,603,710 → Sketch size: 1000
  Compression ratio: 6603.7x
  Using model parameters for aggregation, sketches for filtering
Sketchguard Node 8:
  Model dim: 6,603,710 → Sketch size: 1000
  Compression ratio: 6603.7x
  Using model parameters for aggregation, sketches for filtering
Sketchguard Node 9:
  Model dim: 6,603,710 → Sketch size: 1000
  Compression ratio: 6603.7x
  Using model parameters for aggregation, sketches for filtering
Sketchguard Node 10:
  Model dim: 6,603,710 → Sketch size: 1000
  Compression ratio: 6603.7x
  Using model parameters for aggregation, sketches for filtering
Sketchguard Node 11:
  Model dim: 6,603,710 → Sketch size: 1000
  Compression ratio: 6603.7x
  Using model parameters for aggregation, sketches for filtering
Sketchguard Node 12:
  Model dim: 6,603,710 → Sketch size: 1000
  Compression ratio: 6603.7x
  Using model parameters for aggregation, sketches for filtering
Sketchguard Node 13:
  Model dim: 6,603,710 → Sketch size: 1000
  Compression ratio: 6603.7x
  Using model parameters for aggregation, sketches for filtering
Sketchguard Node 14:
  Model dim: 6,603,710 → Sketch size: 1000
  Compression ratio: 6603.7x
  Using model parameters for aggregation, sketches for filtering
Sketchguard Node 15:
  Model dim: 6,603,710 → Sketch size: 1000
  Compression ratio: 6603.7x
  Using model parameters for aggregation, sketches for filtering
Sketchguard Node 16:
  Model dim: 6,603,710 → Sketch size: 1000
  Compression ratio: 6603.7x
  Using model parameters for aggregation, sketches for filtering
Sketchguard Node 17:
  Model dim: 6,603,710 → Sketch size: 1000
  Compression ratio: 6603.7x
  Using model parameters for aggregation, sketches for filtering
Sketchguard Node 18:
  Model dim: 6,603,710 → Sketch size: 1000
  Compression ratio: 6603.7x
  Using model parameters for aggregation, sketches for filtering
Sketchguard Node 19:
  Model dim: 6,603,710 → Sketch size: 1000
  Compression ratio: 6603.7x
  Using model parameters for aggregation, sketches for filtering
Sketchguard ALGORITHM (Sketch-based Filtering + State Aggregation)
  - Model dimension: 6,603,710 parameters
  - Config: SketchguardConfig(gamma=2, kappa=1, alpha=0.5, min_neighbors=1, sketch_size=1000, network_seed=987654321, attack_detection_window=5)
  - Sketch size: 1000
  - Compression ratio: 6603.7x
  - Complexity: O(d + N×k) = O(6,603,710 + 20×1000)
  - Theoretical speedup vs BALANCE: 19.9x
Initial test acc across nodes: mean=0.0168 ± 0.0139
Round 001: test acc mean=0.4210 ± 0.0524 | min=0.2588 max=0.4929
         : test loss mean=3.7539 ± 0.0441
         : individual accs = ['0.444767', '0.414466', '0.479539', '0.399723', '0.451234', '0.457663', '0.465538', '0.462175', '0.381293', '0.258826', '0.430123', '0.448366', '0.392866', '0.372409', '0.451629', '0.492926', '0.398026', '0.453741', '0.351371', '0.412548']
         : correct/total = [(1836, 4128), (1742, 4203), (1957, 4081), (1732, 4333), (1846, 4091), (1962, 4287), (1952, 4193), (2010, 4349), (1598, 4191), (1107, 4277), (1782, 4143), (1880, 4193), (1608, 4093), (1563, 4197), (1830, 4052), (1986, 4029), (1653, 4153), (1898, 4183), (1435, 4084), (1703, 4128)]
         : sketchguard stats = ['Node 0: acc_rate=1.000', 'Node 1: acc_rate=1.000', 'Node 2: acc_rate=1.000']...
Round 002: test acc mean=0.6930 ± 0.0134 | min=0.6680 max=0.7166
         : test loss mean=2.2851 ± 0.0939
         : individual accs = ['0.674661', '0.695456', '0.667974', '0.711516', '0.700318', '0.716585', '0.683043', '0.695562', '0.697924', '0.688801', '0.687425', '0.699976', '0.694845', '0.689778', '0.710020', '0.681062', '0.676138', '0.715754', '0.693683', '0.679021']
         : correct/total = [(2785, 4128), (2923, 4203), (2726, 4081), (3083, 4333), (2865, 4091), (3072, 4287), (2864, 4193), (3025, 4349), (2925, 4191), (2946, 4277), (2848, 4143), (2935, 4193), (2844, 4093), (2895, 4197), (2877, 4052), (2744, 4029), (2808, 4153), (2994, 4183), (2833, 4084), (2803, 4128)]
         : sketchguard stats = ['Node 0: acc_rate=1.000', 'Node 1: acc_rate=1.000', 'Node 2: acc_rate=1.000']...
Round 003: test acc mean=0.7656 ± 0.0095 | min=0.7460 max=0.7799
         : test loss mean=1.2360 ± 0.0577
         : individual accs = ['0.776647', '0.770878', '0.764273', '0.774521', '0.778783', '0.764871', '0.762700', '0.779949', '0.761393', '0.775310', '0.766594', '0.746005', '0.773516', '0.767453', '0.764067', '0.748821', '0.756802', '0.750657', '0.767385', '0.761386']
         : correct/total = [(3206, 4128), (3240, 4203), (3119, 4081), (3356, 4333), (3186, 4091), (3279, 4287), (3198, 4193), (3392, 4349), (3191, 4191), (3316, 4277), (3176, 4143), (3128, 4193), (3166, 4093), (3221, 4197), (3096, 4052), (3017, 4029), (3143, 4153), (3140, 4183), (3134, 4084), (3143, 4128)]
         : sketchguard stats = ['Node 0: acc_rate=1.000', 'Node 1: acc_rate=1.000', 'Node 2: acc_rate=1.000']...
Round 004: test acc mean=0.7937 ± 0.0078 | min=0.7825 max=0.8115
         : test loss mean=0.8713 ± 0.0345
         : individual accs = ['0.797965', '0.793957', '0.795148', '0.800138', '0.811538', '0.802193', '0.793465', '0.804553', '0.791219', '0.801496', '0.785180', '0.789172', '0.785732', '0.782702', '0.785785', '0.788285', '0.796773', '0.787234', '0.799706', '0.782461']
         : correct/total = [(3294, 4128), (3337, 4203), (3245, 4081), (3467, 4333), (3320, 4091), (3439, 4287), (3327, 4193), (3499, 4349), (3316, 4191), (3428, 4277), (3253, 4143), (3309, 4193), (3216, 4093), (3285, 4197), (3184, 4052), (3176, 4029), (3309, 4153), (3293, 4183), (3266, 4084), (3230, 4128)]
         : sketchguard stats = ['Node 0: acc_rate=1.000', 'Node 1: acc_rate=1.000', 'Node 2: acc_rate=1.000']...
Round 005: test acc mean=0.8108 ± 0.0080 | min=0.7937 max=0.8264
         : test loss mean=0.7237 ± 0.0345
         : individual accs = ['0.812742', '0.810374', '0.810831', '0.810755', '0.826448', '0.819921', '0.810398', '0.825477', '0.810785', '0.819032', '0.807145', '0.793704', '0.811141', '0.811532', '0.804541', '0.798709', '0.817241', '0.804686', '0.807786', '0.802326']
         : correct/total = [(3355, 4128), (3406, 4203), (3309, 4081), (3513, 4333), (3381, 4091), (3515, 4287), (3398, 4193), (3590, 4349), (3398, 4191), (3503, 4277), (3344, 4143), (3328, 4193), (3320, 4093), (3406, 4197), (3260, 4052), (3218, 4029), (3394, 4153), (3366, 4183), (3299, 4084), (3312, 4128)]
         : sketchguard stats = ['Node 0: acc_rate=1.000', 'Node 1: acc_rate=1.000', 'Node 2: acc_rate=1.000']...
Round 006: test acc mean=0.8230 ± 0.0074 | min=0.8079 max=0.8335
         : test loss mean=0.6373 ± 0.0212
         : individual accs = ['0.816860', '0.833214', '0.831414', '0.822756', '0.831826', '0.827385', '0.816599', '0.833525', '0.822477', '0.830489', '0.814144', '0.815407', '0.824334', '0.821301', '0.820336', '0.814098', '0.827354', '0.817834', '0.831538', '0.807897']
         : correct/total = [(3372, 4128), (3502, 4203), (3393, 4081), (3565, 4333), (3403, 4091), (3547, 4287), (3424, 4193), (3625, 4349), (3447, 4191), (3552, 4277), (3373, 4143), (3419, 4193), (3374, 4093), (3447, 4197), (3324, 4052), (3280, 4029), (3436, 4153), (3421, 4183), (3396, 4084), (3335, 4128)]
         : sketchguard stats = ['Node 0: acc_rate=1.000', 'Node 1: acc_rate=1.000', 'Node 2: acc_rate=1.000']...
Round 007: test acc mean=0.8294 ± 0.0083 | min=0.8147 max=0.8409
         : test loss mean=0.5899 ± 0.0244
         : individual accs = ['0.827519', '0.826552', '0.838520', '0.834987', '0.840870', '0.836482', '0.823515', '0.840653', '0.825817', '0.833294', '0.817765', '0.816599', '0.837772', '0.830355', '0.829714', '0.817324', '0.834818', '0.814726', '0.837659', '0.823401']
         : correct/total = [(3416, 4128), (3474, 4203), (3422, 4081), (3618, 4333), (3440, 4091), (3586, 4287), (3453, 4193), (3656, 4349), (3461, 4191), (3564, 4277), (3388, 4143), (3424, 4193), (3429, 4093), (3485, 4197), (3362, 4052), (3293, 4029), (3467, 4153), (3408, 4183), (3421, 4084), (3399, 4128)]
         : sketchguard stats = ['Node 0: acc_rate=1.000', 'Node 1: acc_rate=1.000', 'Node 2: acc_rate=1.000']...
Round 008: test acc mean=0.8342 ± 0.0079 | min=0.8215 max=0.8481
         : test loss mean=0.5543 ± 0.0231
         : individual accs = ['0.828731', '0.839638', '0.848076', '0.840988', '0.843559', '0.837415', '0.825423', '0.847551', '0.827965', '0.840542', '0.826696', '0.828047', '0.838993', '0.828687', '0.825271', '0.821544', '0.837948', '0.828114', '0.840842', '0.828731']
         : correct/total = [(3421, 4128), (3529, 4203), (3461, 4081), (3644, 4333), (3451, 4091), (3590, 4287), (3461, 4193), (3686, 4349), (3470, 4191), (3595, 4277), (3425, 4143), (3472, 4193), (3434, 4093), (3478, 4197), (3344, 4052), (3310, 4029), (3480, 4153), (3464, 4183), (3434, 4084), (3421, 4128)]
         : sketchguard stats = ['Node 0: acc_rate=1.000', 'Node 1: acc_rate=1.000', 'Node 2: acc_rate=1.000']...
Round 009: test acc mean=0.8390 ± 0.0069 | min=0.8308 max=0.8524
         : test loss mean=0.5278 ± 0.0208
         : individual accs = ['0.831638', '0.848442', '0.850037', '0.841219', '0.847959', '0.842547', '0.834009', '0.852380', '0.836316', '0.845920', '0.830799', '0.830909', '0.835084', '0.834882', '0.832675', '0.836436', '0.844691', '0.834090', '0.838639', '0.831153']
         : correct/total = [(3433, 4128), (3566, 4203), (3469, 4081), (3645, 4333), (3469, 4091), (3612, 4287), (3497, 4193), (3707, 4349), (3505, 4191), (3618, 4277), (3442, 4143), (3484, 4193), (3418, 4093), (3504, 4197), (3374, 4052), (3370, 4029), (3508, 4153), (3489, 4183), (3425, 4084), (3431, 4128)]
         : sketchguard stats = ['Node 0: acc_rate=1.000', 'Node 1: acc_rate=1.000', 'Node 2: acc_rate=1.000']...
Round 010: test acc mean=0.8397 ± 0.0061 | min=0.8293 max=0.8478
         : test loss mean=0.5163 ± 0.0189
         : individual accs = ['0.835514', '0.838687', '0.845626', '0.843296', '0.847470', '0.845113', '0.833532', '0.847091', '0.840849', '0.843582', '0.834661', '0.830193', '0.845590', '0.841553', '0.837858', '0.833457', '0.847821', '0.829309', '0.843046', '0.829942']
         : correct/total = [(3449, 4128), (3525, 4203), (3451, 4081), (3654, 4333), (3467, 4091), (3623, 4287), (3495, 4193), (3684, 4349), (3524, 4191), (3608, 4277), (3458, 4143), (3481, 4193), (3461, 4093), (3532, 4197), (3395, 4052), (3358, 4029), (3521, 4153), (3469, 4183), (3443, 4084), (3426, 4128)]
         : sketchguard stats = ['Node 0: acc_rate=1.000', 'Node 1: acc_rate=1.000', 'Node 2: acc_rate=1.000']...

=== FINAL RESULTS ===
Dataset: femnist, Nodes: 20, Graph: ring, Aggregation: sketchguard
Overall test accuracy: mean=0.8397 ± 0.0061

=== Sketchguard SUMMARY ===
Node 0: acceptance=1.000
Node 1: acceptance=1.000
Node 2: acceptance=1.000
Node 3: acceptance=1.000
Node 4: acceptance=1.000
Node 5: acceptance=1.000
Node 6: acceptance=1.000
Node 7: acceptance=1.000
Node 8: acceptance=1.000
Node 9: acceptance=1.000
Node 10: acceptance=1.000
Node 11: acceptance=1.000
Node 12: acceptance=1.000
Node 13: acceptance=1.000
Node 14: acceptance=1.000
Node 15: acceptance=1.000
Node 16: acceptance=1.000
Node 17: acceptance=1.000
Node 18: acceptance=1.000
Node 19: acceptance=1.000

=== PARALLEL EXECUTION TIME (realistic for distributed system) ===
  COMMUNICATION (max across nodes):
    - Sketch transfer: 0.003s (0.2%)
    - Model fetch (accepted): 0.000s (0.0%)
  COMPUTATION (max across nodes):
    - Sketching: 1.564s (98.8%)
    - Filtering: 0.001s (0.1%)
    - Aggregation: 0.015s (1.0%)
  TOTALS:
    - Total computation: 1.580s (99.8%)
    - Total communication: 0.003s (0.2%)
    - Total parallel time: 1.583s

=== PER-NODE AVERAGE TIME ===
  - Sketching: 1.372s
  - Filtering: 0.001s
  - Aggregation: 0.007s
  - Sketch transfer: 0.000s
  - Model fetch: 0.000s
  - Total per node: 1.380s

=== TOTAL COMPUTATIONAL WORK (sum across all nodes) ===
  - Total sketching: 27.446s
  - Total filtering: 0.012s
  - Total aggregation: 0.147s
  - Total sketch transfer: 0.003s
  - Total model fetch: 0.000s
  - Grand total: 27.609s
  - Mean acceptance rate: 1.000

Sketchguard Algorithm Properties:
  - Original dimension: 6,603,710
  - Sketch size: 1000
  - Compression ratio: 19.9x
  - Single repetition: No repetitions needed
  - Theoretical complexity: O(d + N×k)
  - Approach: Sketch filtering + state aggregation
