Device: cuda
Seed: 987654321
Loading 36 LEAF FEMNIST train files...
LEAF FEMNIST train: 3597 users, 734463 samples
Loading 36 LEAF FEMNIST test files...
LEAF FEMNIST test: 3597 users, 83388 samples
Found 3597 train users, 3597 test users, 3597 common users
User sample counts range: 525 (max) to 17 (min)
Distributed ALL 3597 users across 20 clients
Users per client: 179 (with 17 clients getting +1 user)
Train partition sizes: [36360, 37070, 35957, 38262, 36024, 37732, 36921, 38328, 36867, 37683, 36507, 36915, 36007, 37001, 35681, 35453, 36585, 36801, 35964, 36345]
Test partition sizes: [4128, 4203, 4081, 4333, 4091, 4287, 4193, 4349, 4191, 4277, 4143, 4193, 4093, 4197, 4052, 4029, 4153, 4183, 4084, 4128]
  Client 0: 36360 train samples, 62 unique classes
  Client 1: 37070 train samples, 62 unique classes
  Client 2: 35957 train samples, 62 unique classes
  Client 3: 38262 train samples, 62 unique classes
  Client 4: 36024 train samples, 62 unique classes
  Client 5: 37732 train samples, 62 unique classes
  Client 6: 36921 train samples, 62 unique classes
  Client 7: 38328 train samples, 62 unique classes
  Client 8: 36867 train samples, 62 unique classes
  Client 9: 37683 train samples, 62 unique classes
  Client 10: 36507 train samples, 62 unique classes
  Client 11: 36915 train samples, 62 unique classes
  Client 12: 36007 train samples, 62 unique classes
  Client 13: 37001 train samples, 62 unique classes
  Client 14: 35681 train samples, 62 unique classes
  Client 15: 35453 train samples, 62 unique classes
  Client 16: 36585 train samples, 62 unique classes
  Client 17: 36801 train samples, 62 unique classes
  Client 18: 35964 train samples, 62 unique classes
  Client 19: 36345 train samples, 62 unique classes
Will sample 10000 samples per client per epoch
Graph: ring, nodes: 20, edges: 20
Degree statistics: avg=2.00, min=2, max=2
Attack: Compromised 6/20 nodes: [5, 12, 13, 14, 17, 18]
Attack type: krum, lambda: 1.0
Model variant: baseline
Model parameters: 6,603,710
Sketchguard Node 0:
  Model dim: 6,603,710 → Sketch size: 1000
  Compression ratio: 6603.7x
  Using model parameters for aggregation, sketches for filtering
Sketchguard Node 1:
  Model dim: 6,603,710 → Sketch size: 1000
  Compression ratio: 6603.7x
  Using model parameters for aggregation, sketches for filtering
Sketchguard Node 2:
  Model dim: 6,603,710 → Sketch size: 1000
  Compression ratio: 6603.7x
  Using model parameters for aggregation, sketches for filtering
Sketchguard Node 3:
  Model dim: 6,603,710 → Sketch size: 1000
  Compression ratio: 6603.7x
  Using model parameters for aggregation, sketches for filtering
Sketchguard Node 4:
  Model dim: 6,603,710 → Sketch size: 1000
  Compression ratio: 6603.7x
  Using model parameters for aggregation, sketches for filtering
Sketchguard Node 5:
  Model dim: 6,603,710 → Sketch size: 1000
  Compression ratio: 6603.7x
  Using model parameters for aggregation, sketches for filtering
Sketchguard Node 6:
  Model dim: 6,603,710 → Sketch size: 1000
  Compression ratio: 6603.7x
  Using model parameters for aggregation, sketches for filtering
Sketchguard Node 7:
  Model dim: 6,603,710 → Sketch size: 1000
  Compression ratio: 6603.7x
  Using model parameters for aggregation, sketches for filtering
Sketchguard Node 8:
  Model dim: 6,603,710 → Sketch size: 1000
  Compression ratio: 6603.7x
  Using model parameters for aggregation, sketches for filtering
Sketchguard Node 9:
  Model dim: 6,603,710 → Sketch size: 1000
  Compression ratio: 6603.7x
  Using model parameters for aggregation, sketches for filtering
Sketchguard Node 10:
  Model dim: 6,603,710 → Sketch size: 1000
  Compression ratio: 6603.7x
  Using model parameters for aggregation, sketches for filtering
Sketchguard Node 11:
  Model dim: 6,603,710 → Sketch size: 1000
  Compression ratio: 6603.7x
  Using model parameters for aggregation, sketches for filtering
Sketchguard Node 12:
  Model dim: 6,603,710 → Sketch size: 1000
  Compression ratio: 6603.7x
  Using model parameters for aggregation, sketches for filtering
Sketchguard Node 13:
  Model dim: 6,603,710 → Sketch size: 1000
  Compression ratio: 6603.7x
  Using model parameters for aggregation, sketches for filtering
Sketchguard Node 14:
  Model dim: 6,603,710 → Sketch size: 1000
  Compression ratio: 6603.7x
  Using model parameters for aggregation, sketches for filtering
Sketchguard Node 15:
  Model dim: 6,603,710 → Sketch size: 1000
  Compression ratio: 6603.7x
  Using model parameters for aggregation, sketches for filtering
Sketchguard Node 16:
  Model dim: 6,603,710 → Sketch size: 1000
  Compression ratio: 6603.7x
  Using model parameters for aggregation, sketches for filtering
Sketchguard Node 17:
  Model dim: 6,603,710 → Sketch size: 1000
  Compression ratio: 6603.7x
  Using model parameters for aggregation, sketches for filtering
Sketchguard Node 18:
  Model dim: 6,603,710 → Sketch size: 1000
  Compression ratio: 6603.7x
  Using model parameters for aggregation, sketches for filtering
Sketchguard Node 19:
  Model dim: 6,603,710 → Sketch size: 1000
  Compression ratio: 6603.7x
  Using model parameters for aggregation, sketches for filtering
Sketchguard ALGORITHM (Sketch-based Filtering + State Aggregation)
  - Model dimension: 6,603,710 parameters
  - Config: SketchguardConfig(gamma=2, kappa=1, alpha=0.5, min_neighbors=1, sketch_size=1000, network_seed=987654321, attack_detection_window=5)
  - Sketch size: 1000
  - Compression ratio: 6603.7x
  - Complexity: O(d + N×k) = O(6,603,710 + 20×1000)
  - Theoretical speedup vs BALANCE: 19.9x
Initial test acc across nodes: mean=0.0168 ± 0.0139
Round 001: test acc mean=0.4116 ± 0.1059 | min=0.0052 max=0.5202
         : test loss mean=516.8884 ± 2237.1746
         : individual accs = ['0.444767', '0.414466', '0.479539', '0.399723', '0.461745', '0.457663', '0.520153', '0.462175', '0.381293', '0.258826', '0.430123', '0.447651', '0.441241', '0.005242', '0.465202', '0.458675', '0.452926', '0.432943', '0.395690', '0.421512']
         : correct/total = [(1836, 4128), (1742, 4203), (1957, 4081), (1732, 4333), (1889, 4091), (1962, 4287), (2181, 4193), (2010, 4349), (1598, 4191), (1107, 4277), (1782, 4143), (1877, 4193), (1806, 4093), (22, 4197), (1885, 4052), (1848, 4029), (1881, 4153), (1811, 4183), (1616, 4084), (1740, 4128)]
         : compromised: 0.3663, honest: 0.4310
         : sketchguard stats = ['Node 0: acc_rate=1.000', 'Node 1: acc_rate=1.000', 'Node 2: acc_rate=1.000']...
Round 002: test acc mean=0.6751 ± 0.1462 | min=0.0491 max=0.7486
         : test loss mean=nan ± nan
         : individual accs = ['0.709302', '0.695456', '0.667974', '0.735057', '0.737473', '0.659436', '0.700930', '0.710508', '0.697924', '0.688801', '0.711320', '0.729072', '0.728561', '0.049083', '0.684353', '0.746835', '0.748615', '0.650012', '0.721841', '0.729409']
         : correct/total = [(2928, 4128), (2923, 4203), (2726, 4081), (3185, 4333), (3017, 4091), (2827, 4287), (2939, 4193), (3090, 4349), (2925, 4191), (2946, 4277), (2947, 4143), (3057, 4193), (2982, 4093), (206, 4197), (2773, 4052), (3009, 4029), (3109, 4153), (2719, 4183), (2948, 4084), (3011, 4128)]
         : compromised: 0.5822, honest: 0.7149
         : sketchguard stats = ['Node 0: acc_rate=1.000', 'Node 1: acc_rate=1.000', 'Node 2: acc_rate=1.000']...
Round 003: test acc mean=0.7388 ± 0.1596 | min=0.0491 max=0.7996
         : test loss mean=nan ± nan
         : individual accs = ['0.788760', '0.768737', '0.761333', '0.783522', '0.799560', '0.695825', '0.780587', '0.782479', '0.760439', '0.776011', '0.774559', '0.777963', '0.790129', '0.049083', '0.775666', '0.782080', '0.794125', '0.777911', '0.782811', '0.774952']
         : correct/total = [(3256, 4128), (3231, 4203), (3107, 4081), (3395, 4333), (3271, 4091), (2983, 4287), (3273, 4193), (3403, 4349), (3187, 4191), (3319, 4277), (3209, 4143), (3262, 4193), (3234, 4093), (206, 4197), (3143, 4052), (3151, 4029), (3298, 4153), (3254, 4183), (3197, 4084), (3199, 4128)]
         : compromised: 0.6452, honest: 0.7789
         : sketchguard stats = ['Node 0: acc_rate=1.000', 'Node 1: acc_rate=1.000', 'Node 2: acc_rate=1.000']...
Round 004: test acc mean=0.7659 ± 0.1649 | min=0.0491 max=0.8269
         : test loss mean=nan ± nan
         : individual accs = ['0.807655', '0.793005', '0.794168', '0.807754', '0.826937', '0.766970', '0.802767', '0.808232', '0.791458', '0.801029', '0.793386', '0.803959', '0.815294', '0.049083', '0.809724', '0.813353', '0.826150', '0.805403', '0.805338', '0.796754']
         : correct/total = [(3334, 4128), (3333, 4203), (3241, 4081), (3500, 4333), (3383, 4091), (3288, 4287), (3366, 4193), (3515, 4349), (3317, 4191), (3426, 4277), (3287, 4143), (3371, 4193), (3337, 4093), (206, 4197), (3281, 4052), (3277, 4029), (3431, 4153), (3369, 4183), (3289, 4084), (3289, 4128)]
         : compromised: 0.6753, honest: 0.8048
         : sketchguard stats = ['Node 0: acc_rate=1.000', 'Node 1: acc_rate=1.000', 'Node 2: acc_rate=1.000']...
Round 005: test acc mean=0.7798 ± 0.1677 | min=0.0491 max=0.8288
         : test loss mean=nan ± nan
         : individual accs = ['0.820736', '0.810849', '0.813036', '0.821140', '0.825471', '0.808258', '0.821130', '0.827317', '0.812455', '0.821604', '0.813903', '0.812306', '0.824334', '0.049083', '0.816140', '0.816580', '0.828798', '0.819747', '0.819295', '0.813711']
         : correct/total = [(3388, 4128), (3408, 4203), (3318, 4081), (3558, 4333), (3377, 4091), (3465, 4287), (3443, 4193), (3598, 4349), (3405, 4191), (3514, 4277), (3372, 4143), (3406, 4193), (3374, 4093), (206, 4197), (3307, 4052), (3290, 4029), (3442, 4153), (3429, 4183), (3346, 4084), (3359, 4128)]
         : compromised: 0.6895, honest: 0.8185
         : sketchguard stats = ['Node 0: acc_rate=1.000', 'Node 1: acc_rate=1.000', 'Node 2: acc_rate=1.000']...
Round 006: test acc mean=0.7904 ± 0.1702 | min=0.0491 max=0.8447
         : test loss mean=nan ± nan
         : individual accs = ['0.824612', '0.833452', '0.831169', '0.832218', '0.836959', '0.817588', '0.817076', '0.838124', '0.822954', '0.829553', '0.826213', '0.823754', '0.838749', '0.049083', '0.834156', '0.823529', '0.844691', '0.833851', '0.836190', '0.813711']
         : correct/total = [(3404, 4128), (3503, 4203), (3392, 4081), (3606, 4333), (3424, 4091), (3505, 4287), (3426, 4193), (3645, 4349), (3449, 4191), (3548, 4277), (3423, 4143), (3454, 4193), (3433, 4093), (206, 4197), (3380, 4052), (3318, 4029), (3508, 4153), (3488, 4183), (3415, 4084), (3359, 4128)]
         : compromised: 0.7016, honest: 0.8284
         : sketchguard stats = ['Node 0: acc_rate=1.000', 'Node 1: acc_rate=1.000', 'Node 2: acc_rate=1.000']...
Round 007: test acc mean=0.7943 ± 0.1711 | min=0.0491 max=0.8446
         : test loss mean=nan ± nan
         : individual accs = ['0.832607', '0.829408', '0.842441', '0.836834', '0.842581', '0.823886', '0.829716', '0.844562', '0.825340', '0.834931', '0.824282', '0.822561', '0.844124', '0.049083', '0.839832', '0.825019', '0.840838', '0.836481', '0.839618', '0.822674']
         : correct/total = [(3437, 4128), (3486, 4203), (3438, 4081), (3626, 4333), (3447, 4091), (3532, 4287), (3479, 4193), (3673, 4349), (3459, 4191), (3571, 4277), (3415, 4143), (3449, 4193), (3455, 4093), (206, 4197), (3403, 4052), (3324, 4029), (3492, 4153), (3499, 4183), (3429, 4084), (3396, 4128)]
         : compromised: 0.7055, honest: 0.8324
         : sketchguard stats = ['Node 0: acc_rate=1.000', 'Node 1: acc_rate=1.000', 'Node 2: acc_rate=1.000']...
Round 008: test acc mean=0.7997 ± 0.1724 | min=0.0491 max=0.8538
         : test loss mean=nan ± nan
         : individual accs = ['0.835998', '0.842731', '0.849792', '0.846757', '0.850892', '0.833450', '0.822323', '0.853759', '0.831544', '0.839841', '0.833695', '0.834963', '0.843635', '0.049083', '0.835884', '0.831224', '0.844691', '0.844848', '0.840108', '0.828731']
         : correct/total = [(3451, 4128), (3542, 4203), (3468, 4081), (3669, 4333), (3481, 4091), (3573, 4287), (3448, 4193), (3713, 4349), (3485, 4191), (3592, 4277), (3454, 4143), (3501, 4193), (3453, 4093), (206, 4197), (3387, 4052), (3349, 4029), (3508, 4153), (3534, 4183), (3431, 4084), (3421, 4128)]
         : compromised: 0.7078, honest: 0.8391
         : sketchguard stats = ['Node 0: acc_rate=1.000', 'Node 1: acc_rate=1.000', 'Node 2: acc_rate=1.000']...
Round 009: test acc mean=0.8035 ± 0.1732 | min=0.0491 max=0.8584
         : test loss mean=nan ± nan
         : individual accs = ['0.837694', '0.845586', '0.854938', '0.848373', '0.850892', '0.841847', '0.836871', '0.857438', '0.840849', '0.848492', '0.838040', '0.830193', '0.839238', '0.049083', '0.838598', '0.840903', '0.858416', '0.841501', '0.842067', '0.828246']
         : correct/total = [(3458, 4128), (3554, 4203), (3489, 4081), (3676, 4333), (3481, 4091), (3609, 4287), (3509, 4193), (3729, 4349), (3524, 4191), (3629, 4277), (3472, 4143), (3481, 4193), (3435, 4093), (206, 4197), (3398, 4052), (3388, 4029), (3565, 4153), (3520, 4183), (3439, 4084), (3419, 4128)]
         : compromised: 0.7087, honest: 0.8441
         : sketchguard stats = ['Node 0: acc_rate=1.000', 'Node 1: acc_rate=1.000', 'Node 2: acc_rate=1.000']...
Round 010: test acc mean=0.8042 ± 0.1733 | min=0.0491 max=0.8538
         : test loss mean=nan ± nan
         : individual accs = ['0.841570', '0.840352', '0.845871', '0.849065', '0.847470', '0.846279', '0.833771', '0.853070', '0.844667', '0.846388', '0.839488', '0.834963', '0.853164', '0.049083', '0.843287', '0.841648', '0.853841', '0.841501', '0.849167', '0.828973']
         : correct/total = [(3474, 4128), (3532, 4203), (3452, 4081), (3679, 4333), (3467, 4091), (3628, 4287), (3496, 4193), (3710, 4349), (3540, 4191), (3620, 4277), (3478, 4143), (3501, 4193), (3492, 4093), (206, 4197), (3417, 4052), (3391, 4029), (3546, 4153), (3520, 4183), (3468, 4084), (3422, 4128)]
         : compromised: 0.7137, honest: 0.8429
         : sketchguard stats = ['Node 0: acc_rate=1.000', 'Node 1: acc_rate=1.000', 'Node 2: acc_rate=1.000']...

=== FINAL RESULTS ===
Dataset: femnist, Nodes: 20, Graph: ring, Aggregation: sketchguard
Attack: krum, 30.0% compromised
Final accuracy - Compromised: 0.7137, Honest: 0.8429
Overall test accuracy: mean=0.8042 ± 0.1733

=== Sketchguard SUMMARY ===
Node 0: acceptance=1.000
Node 1: acceptance=1.000
Node 2: acceptance=1.000
Node 3: acceptance=1.000
Node 4: acceptance=0.500
Node 5: acceptance=0.800
Node 6: acceptance=0.500
Node 7: acceptance=1.000
Node 8: acceptance=1.000
Node 9: acceptance=1.000
Node 10: acceptance=1.000
Node 11: acceptance=0.500
Node 12: acceptance=0.500
Node 13: acceptance=0.000
Node 14: acceptance=0.500
Node 15: acceptance=0.500
Node 16: acceptance=0.500
Node 17: acceptance=0.500
Node 18: acceptance=0.500
Node 19: acceptance=0.500

=== PARALLEL EXECUTION TIME (realistic for distributed system) ===
  COMMUNICATION (max across nodes):
    - Sketch transfer: 0.000s (0.0%)
    - Model fetch (accepted): 0.000s (0.0%)
  COMPUTATION (max across nodes):
    - Sketching: 1.582s (99.3%)
    - Filtering: 0.001s (0.1%)
    - Aggregation: 0.010s (0.6%)
  TOTALS:
    - Total computation: 1.593s (100.0%)
    - Total communication: 0.000s (0.0%)
    - Total parallel time: 1.593s

=== PER-NODE AVERAGE TIME ===
  - Sketching: 1.210s
  - Filtering: 0.001s
  - Aggregation: 0.007s
  - Sketch transfer: 0.000s
  - Model fetch: 0.000s
  - Total per node: 1.217s

=== TOTAL COMPUTATIONAL WORK (sum across all nodes) ===
  - Total sketching: 24.192s
  - Total filtering: 0.012s
  - Total aggregation: 0.132s
  - Total sketch transfer: 0.000s
  - Total model fetch: 0.000s
  - Grand total: 24.337s
  - Mean acceptance rate: 0.690

Sketchguard Algorithm Properties:
  - Original dimension: 6,603,710
  - Sketch size: 1000
  - Compression ratio: 19.9x
  - Single repetition: No repetitions needed
  - Theoretical complexity: O(d + N×k)
  - Approach: Sketch filtering + state aggregation
