Device: cuda
Seed: 987654321
Loading 36 LEAF FEMNIST train files...
LEAF FEMNIST train: 3597 users, 734463 samples
Loading 36 LEAF FEMNIST test files...
LEAF FEMNIST test: 3597 users, 83388 samples
Found 3597 train users, 3597 test users, 3597 common users
User sample counts range: 525 (max) to 17 (min)
Distributed ALL 3597 users across 20 clients
Users per client: 179 (with 17 clients getting +1 user)
Train partition sizes: [36360, 37070, 35957, 38262, 36024, 37732, 36921, 38328, 36867, 37683, 36507, 36915, 36007, 37001, 35681, 35453, 36585, 36801, 35964, 36345]
Test partition sizes: [4128, 4203, 4081, 4333, 4091, 4287, 4193, 4349, 4191, 4277, 4143, 4193, 4093, 4197, 4052, 4029, 4153, 4183, 4084, 4128]
  Client 0: 36360 train samples, 62 unique classes
  Client 1: 37070 train samples, 62 unique classes
  Client 2: 35957 train samples, 62 unique classes
  Client 3: 38262 train samples, 62 unique classes
  Client 4: 36024 train samples, 62 unique classes
  Client 5: 37732 train samples, 62 unique classes
  Client 6: 36921 train samples, 62 unique classes
  Client 7: 38328 train samples, 62 unique classes
  Client 8: 36867 train samples, 62 unique classes
  Client 9: 37683 train samples, 62 unique classes
  Client 10: 36507 train samples, 62 unique classes
  Client 11: 36915 train samples, 62 unique classes
  Client 12: 36007 train samples, 62 unique classes
  Client 13: 37001 train samples, 62 unique classes
  Client 14: 35681 train samples, 62 unique classes
  Client 15: 35453 train samples, 62 unique classes
  Client 16: 36585 train samples, 62 unique classes
  Client 17: 36801 train samples, 62 unique classes
  Client 18: 35964 train samples, 62 unique classes
  Client 19: 36345 train samples, 62 unique classes
Will sample 10000 samples per client per epoch
Graph: erdos, nodes: 20, edges: 48
Degree statistics: avg=4.80, min=2, max=7
Attack: Compromised 16/20 nodes: [1, 2, 3, 5, 6, 8, 9, 10, 11, 12, 13, 14, 15, 17, 18, 19]
Attack type: gaussian, lambda: 1.0
Model variant: baseline
Model parameters: 6,603,710
Sketchguard Node 0:
  Model dim: 6,603,710 → Sketch size: 1000
  Compression ratio: 6603.7x
  Using model parameters for aggregation, sketches for filtering
Sketchguard Node 1:
  Model dim: 6,603,710 → Sketch size: 1000
  Compression ratio: 6603.7x
  Using model parameters for aggregation, sketches for filtering
Sketchguard Node 2:
  Model dim: 6,603,710 → Sketch size: 1000
  Compression ratio: 6603.7x
  Using model parameters for aggregation, sketches for filtering
Sketchguard Node 3:
  Model dim: 6,603,710 → Sketch size: 1000
  Compression ratio: 6603.7x
  Using model parameters for aggregation, sketches for filtering
Sketchguard Node 4:
  Model dim: 6,603,710 → Sketch size: 1000
  Compression ratio: 6603.7x
  Using model parameters for aggregation, sketches for filtering
Sketchguard Node 5:
  Model dim: 6,603,710 → Sketch size: 1000
  Compression ratio: 6603.7x
  Using model parameters for aggregation, sketches for filtering
Sketchguard Node 6:
  Model dim: 6,603,710 → Sketch size: 1000
  Compression ratio: 6603.7x
  Using model parameters for aggregation, sketches for filtering
Sketchguard Node 7:
  Model dim: 6,603,710 → Sketch size: 1000
  Compression ratio: 6603.7x
  Using model parameters for aggregation, sketches for filtering
Sketchguard Node 8:
  Model dim: 6,603,710 → Sketch size: 1000
  Compression ratio: 6603.7x
  Using model parameters for aggregation, sketches for filtering
Sketchguard Node 9:
  Model dim: 6,603,710 → Sketch size: 1000
  Compression ratio: 6603.7x
  Using model parameters for aggregation, sketches for filtering
Sketchguard Node 10:
  Model dim: 6,603,710 → Sketch size: 1000
  Compression ratio: 6603.7x
  Using model parameters for aggregation, sketches for filtering
Sketchguard Node 11:
  Model dim: 6,603,710 → Sketch size: 1000
  Compression ratio: 6603.7x
  Using model parameters for aggregation, sketches for filtering
Sketchguard Node 12:
  Model dim: 6,603,710 → Sketch size: 1000
  Compression ratio: 6603.7x
  Using model parameters for aggregation, sketches for filtering
Sketchguard Node 13:
  Model dim: 6,603,710 → Sketch size: 1000
  Compression ratio: 6603.7x
  Using model parameters for aggregation, sketches for filtering
Sketchguard Node 14:
  Model dim: 6,603,710 → Sketch size: 1000
  Compression ratio: 6603.7x
  Using model parameters for aggregation, sketches for filtering
Sketchguard Node 15:
  Model dim: 6,603,710 → Sketch size: 1000
  Compression ratio: 6603.7x
  Using model parameters for aggregation, sketches for filtering
Sketchguard Node 16:
  Model dim: 6,603,710 → Sketch size: 1000
  Compression ratio: 6603.7x
  Using model parameters for aggregation, sketches for filtering
Sketchguard Node 17:
  Model dim: 6,603,710 → Sketch size: 1000
  Compression ratio: 6603.7x
  Using model parameters for aggregation, sketches for filtering
Sketchguard Node 18:
  Model dim: 6,603,710 → Sketch size: 1000
  Compression ratio: 6603.7x
  Using model parameters for aggregation, sketches for filtering
Sketchguard Node 19:
  Model dim: 6,603,710 → Sketch size: 1000
  Compression ratio: 6603.7x
  Using model parameters for aggregation, sketches for filtering
Sketchguard ALGORITHM (Sketch-based Filtering + State Aggregation)
  - Model dimension: 6,603,710 parameters
  - Config: SketchguardConfig(gamma=2, kappa=1, alpha=0.5, min_neighbors=1, sketch_size=1000, network_seed=987654321, attack_detection_window=5)
  - Sketch size: 1000
  - Compression ratio: 6603.7x
  - Complexity: O(d + N×k) = O(6,603,710 + 20×1000)
  - Theoretical speedup vs BALANCE: 19.9x
Initial test acc across nodes: mean=0.0162 ± 0.0138
Round 001: test acc mean=0.3169 ± 0.1641 | min=0.0038 max=0.5328
         : test loss mean=192368238.4679 ± 391766985.8380
         : individual accs = ['0.450581', '0.339044', '0.421710', '0.044773', '0.494011', '0.352694', '0.410923', '0.482180', '0.413982', '0.428805', '0.150857', '0.051037', '0.303445', '0.003812', '0.532823', '0.349218', '0.442572', '0.387043', '0.230901', '0.047965']
         : correct/total = [(1860, 4128), (1425, 4203), (1721, 4081), (194, 4333), (2021, 4091), (1512, 4287), (1723, 4193), (2097, 4349), (1735, 4191), (1834, 4277), (625, 4143), (214, 4193), (1242, 4093), (16, 4197), (2159, 4052), (1407, 4029), (1838, 4153), (1619, 4183), (943, 4084), (198, 4128)]
         : compromised: 0.2793, honest: 0.4673
         : sketchguard stats = ['Node 0: acc_rate=0.167', 'Node 1: acc_rate=0.333', 'Node 2: acc_rate=0.200']...
Round 002: test acc mean=0.5702 ± 0.2618 | min=0.0466 max=0.7457
         : test loss mean=nan ± nan
         : individual accs = ['0.737888', '0.679515', '0.702769', '0.046619', '0.730139', '0.677863', '0.732888', '0.745689', '0.679313', '0.711714', '0.650495', '0.048891', '0.689470', '0.047653', '0.695953', '0.674609', '0.723333', '0.638537', '0.735309', '0.054990']
         : correct/total = [(3046, 4128), (2856, 4203), (2868, 4081), (202, 4333), (2987, 4091), (2906, 4287), (3073, 4193), (3243, 4349), (2847, 4191), (3044, 4277), (2695, 4143), (205, 4193), (2822, 4093), (200, 4197), (2820, 4052), (2718, 4029), (3004, 4153), (2671, 4183), (3003, 4084), (227, 4128)]
         : compromised: 0.5292, honest: 0.7343
         : sketchguard stats = ['Node 0: acc_rate=0.167', 'Node 1: acc_rate=0.333', 'Node 2: acc_rate=0.200']...
Round 003: test acc mean=0.6283 ± 0.2907 | min=0.0466 max=0.8009
         : test loss mean=nan ± nan
         : individual accs = ['0.795300', '0.686890', '0.784367', '0.046619', '0.786849', '0.782132', '0.784164', '0.800874', '0.787402', '0.776011', '0.764181', '0.048891', '0.763499', '0.047653', '0.792201', '0.788781', '0.786901', '0.706909', '0.781832', '0.054990']
         : correct/total = [(3283, 4128), (2887, 4203), (3201, 4081), (202, 4333), (3219, 4091), (3353, 4287), (3288, 4193), (3483, 4349), (3300, 4191), (3319, 4277), (3166, 4143), (205, 4193), (3125, 4093), (200, 4197), (3210, 4052), (3178, 4029), (3268, 4153), (2957, 4183), (3193, 4084), (227, 4128)]
         : compromised: 0.5873, honest: 0.7925
         : sketchguard stats = ['Node 0: acc_rate=0.167', 'Node 1: acc_rate=0.333', 'Node 2: acc_rate=0.200']...
Round 004: test acc mean=0.6563 ± 0.3036 | min=0.0466 max=0.8260
         : test loss mean=nan ± nan
         : individual accs = ['0.807413', '0.775161', '0.812056', '0.046619', '0.809826', '0.813856', '0.817553', '0.823178', '0.819613', '0.809680', '0.803765', '0.048891', '0.796237', '0.047653', '0.817127', '0.826011', '0.810980', '0.776237', '0.809011', '0.054990']
         : correct/total = [(3333, 4128), (3258, 4203), (3314, 4081), (202, 4333), (3313, 4091), (3489, 4287), (3428, 4193), (3580, 4349), (3435, 4191), (3463, 4277), (3330, 4143), (205, 4193), (3259, 4093), (200, 4197), (3311, 4052), (3328, 4029), (3368, 4153), (3247, 4183), (3304, 4084), (227, 4128)]
         : compromised: 0.6172, honest: 0.8128
         : sketchguard stats = ['Node 0: acc_rate=0.167', 'Node 1: acc_rate=0.333', 'Node 2: acc_rate=0.200']...
Round 005: test acc mean=0.6659 ± 0.3084 | min=0.0466 max=0.8338
         : test loss mean=nan ± nan
         : individual accs = ['0.819525', '0.791102', '0.819407', '0.046619', '0.826693', '0.825052', '0.822323', '0.833755', '0.832021', '0.824877', '0.814627', '0.048891', '0.822380', '0.047653', '0.829220', '0.817324', '0.822056', '0.790820', '0.829334', '0.054990']
         : correct/total = [(3383, 4128), (3325, 4203), (3344, 4081), (202, 4333), (3382, 4091), (3537, 4287), (3448, 4193), (3626, 4349), (3487, 4191), (3528, 4277), (3375, 4143), (205, 4193), (3366, 4093), (200, 4197), (3360, 4052), (3293, 4029), (3414, 4153), (3308, 4183), (3387, 4084), (227, 4128)]
         : compromised: 0.6260, honest: 0.8255
         : sketchguard stats = ['Node 0: acc_rate=0.167', 'Node 1: acc_rate=0.333', 'Node 2: acc_rate=0.200']...
Round 006: test acc mean=0.6728 ± 0.3117 | min=0.0466 max=0.8387
         : test loss mean=nan ± nan
         : individual accs = ['0.827519', '0.811087', '0.827493', '0.046619', '0.827915', '0.832750', '0.829716', '0.836284', '0.837748', '0.838672', '0.823316', '0.048891', '0.828732', '0.047653', '0.832428', '0.834947', '0.831206', '0.806598', '0.832272', '0.054990']
         : correct/total = [(3416, 4128), (3409, 4203), (3377, 4081), (202, 4333), (3387, 4091), (3570, 4287), (3479, 4193), (3637, 4349), (3511, 4191), (3587, 4277), (3411, 4143), (205, 4193), (3392, 4093), (200, 4197), (3373, 4052), (3364, 4029), (3452, 4153), (3374, 4183), (3399, 4084), (227, 4128)]
         : compromised: 0.6334, honest: 0.8307
         : sketchguard stats = ['Node 0: acc_rate=0.167', 'Node 1: acc_rate=0.333', 'Node 2: acc_rate=0.200']...
Round 007: test acc mean=0.6792 ± 0.3149 | min=0.0466 max=0.8464
         : test loss mean=nan ± nan
         : individual accs = ['0.835998', '0.830359', '0.840725', '0.046619', '0.838181', '0.838582', '0.842833', '0.846401', '0.838702', '0.844050', '0.827902', '0.048891', '0.837039', '0.047653', '0.834403', '0.831472', '0.845654', '0.817595', '0.835455', '0.054990']
         : correct/total = [(3451, 4128), (3490, 4203), (3431, 4081), (202, 4333), (3429, 4091), (3595, 4287), (3534, 4193), (3681, 4349), (3515, 4191), (3610, 4277), (3430, 4143), (205, 4193), (3426, 4093), (200, 4197), (3381, 4052), (3350, 4029), (3512, 4153), (3420, 4183), (3412, 4084), (227, 4128)]
         : compromised: 0.6386, honest: 0.8416
         : sketchguard stats = ['Node 0: acc_rate=0.167', 'Node 1: acc_rate=0.333', 'Node 2: acc_rate=0.200']...
Round 008: test acc mean=0.6825 ± 0.3165 | min=0.0466 max=0.8512
         : test loss mean=nan ± nan
         : individual accs = ['0.828973', '0.830359', '0.840235', '0.046619', '0.841359', '0.847446', '0.851181', '0.850310', '0.844667', '0.846621', '0.830316', '0.048891', '0.840459', '0.047653', '0.841066', '0.838421', '0.840597', '0.832895', '0.845984', '0.054990']
         : correct/total = [(3422, 4128), (3490, 4203), (3429, 4081), (202, 4333), (3442, 4091), (3633, 4287), (3569, 4193), (3698, 4349), (3540, 4191), (3621, 4277), (3440, 4143), (205, 4193), (3440, 4093), (200, 4197), (3408, 4052), (3378, 4029), (3491, 4153), (3484, 4183), (3455, 4084), (227, 4128)]
         : compromised: 0.6430, honest: 0.8403
         : sketchguard stats = ['Node 0: acc_rate=0.167', 'Node 1: acc_rate=0.292', 'Node 2: acc_rate=0.200']...
Round 009: test acc mean=0.6855 ± 0.3180 | min=0.0466 max=0.8549
         : test loss mean=nan ± nan
         : individual accs = ['0.837452', '0.845111', '0.845136', '0.046619', '0.839404', '0.843480', '0.851181', '0.854909', '0.854927', '0.851064', '0.834178', '0.048891', '0.841192', '0.047653', '0.838598', '0.848101', '0.844450', '0.840306', '0.841577', '0.054990']
         : correct/total = [(3457, 4128), (3552, 4203), (3449, 4081), (202, 4333), (3434, 4091), (3616, 4287), (3569, 4193), (3718, 4349), (3583, 4191), (3640, 4277), (3456, 4143), (205, 4193), (3443, 4093), (200, 4197), (3398, 4052), (3417, 4029), (3507, 4153), (3515, 4183), (3437, 4084), (227, 4128)]
         : compromised: 0.6458, honest: 0.8441
         : sketchguard stats = ['Node 0: acc_rate=0.167', 'Node 1: acc_rate=0.278', 'Node 2: acc_rate=0.200']...
Round 010: test acc mean=0.6885 ± 0.3195 | min=0.0466 max=0.8574
         : test loss mean=nan ± nan
         : individual accs = ['0.843023', '0.853676', '0.850037', '0.046619', '0.842581', '0.847679', '0.856666', '0.854219', '0.853257', '0.857377', '0.832006', '0.048891', '0.845834', '0.047653', '0.848717', '0.847108', '0.843968', '0.847239', '0.848923', '0.054990']
         : correct/total = [(3480, 4128), (3588, 4203), (3469, 4081), (202, 4333), (3447, 4091), (3634, 4287), (3592, 4193), (3715, 4349), (3576, 4191), (3667, 4277), (3447, 4143), (205, 4193), (3462, 4093), (200, 4197), (3439, 4052), (3413, 4029), (3505, 4153), (3544, 4183), (3467, 4084), (227, 4128)]
         : compromised: 0.6492, honest: 0.8459
         : sketchguard stats = ['Node 0: acc_rate=0.167', 'Node 1: acc_rate=0.267', 'Node 2: acc_rate=0.200']...

=== FINAL RESULTS ===
Dataset: femnist, Nodes: 20, Graph: erdos, Aggregation: sketchguard
Attack: gaussian, 80.0% compromised
Final accuracy - Compromised: 0.6492, Honest: 0.8459
Overall test accuracy: mean=0.6885 ± 0.3195

=== Sketchguard SUMMARY ===
Node 0: acceptance=0.167
Node 1: acceptance=0.267
Node 2: acceptance=0.200
Node 3: acceptance=0.000
Node 4: acceptance=0.250
Node 5: acceptance=0.200
Node 6: acceptance=0.200
Node 7: acceptance=0.200
Node 8: acceptance=0.500
Node 9: acceptance=0.333
Node 10: acceptance=0.250
Node 11: acceptance=0.000
Node 12: acceptance=0.343
Node 13: acceptance=0.000
Node 14: acceptance=0.143
Node 15: acceptance=0.167
Node 16: acceptance=0.200
Node 17: acceptance=0.320
Node 18: acceptance=0.250
Node 19: acceptance=0.000

=== PARALLEL EXECUTION TIME (realistic for distributed system) ===
  COMMUNICATION (max across nodes):
    - Sketch transfer: 0.000s (0.0%)
    - Model fetch (accepted): 0.000s (0.0%)
  COMPUTATION (max across nodes):
    - Sketching: 1.720s (99.0%)
    - Filtering: 0.001s (0.1%)
    - Aggregation: 0.017s (1.0%)
  TOTALS:
    - Total computation: 1.738s (100.0%)
    - Total communication: 0.000s (0.0%)
    - Total parallel time: 1.738s

=== PER-NODE AVERAGE TIME ===
  - Sketching: 1.253s
  - Filtering: 0.001s
  - Aggregation: 0.012s
  - Sketch transfer: 0.000s
  - Model fetch: 0.000s
  - Total per node: 1.266s

=== TOTAL COMPUTATIONAL WORK (sum across all nodes) ===
  - Total sketching: 25.070s
  - Total filtering: 0.013s
  - Total aggregation: 0.235s
  - Total sketch transfer: 0.000s
  - Total model fetch: 0.000s
  - Grand total: 25.318s
  - Mean acceptance rate: 0.199

Sketchguard Algorithm Properties:
  - Original dimension: 6,603,710
  - Sketch size: 1000
  - Compression ratio: 19.9x
  - Single repetition: No repetitions needed
  - Theoretical complexity: O(d + N×k)
  - Approach: Sketch filtering + state aggregation
