Device: cuda
Seed: 987654321
Loading 36 LEAF FEMNIST train files...
LEAF FEMNIST train: 3597 users, 734463 samples
Loading 36 LEAF FEMNIST test files...
LEAF FEMNIST test: 3597 users, 83388 samples
Found 3597 train users, 3597 test users, 3597 common users
User sample counts range: 525 (max) to 17 (min)
Distributed ALL 3597 users across 20 clients
Users per client: 179 (with 17 clients getting +1 user)
Train partition sizes: [36360, 37070, 35957, 38262, 36024, 37732, 36921, 38328, 36867, 37683, 36507, 36915, 36007, 37001, 35681, 35453, 36585, 36801, 35964, 36345]
Test partition sizes: [4128, 4203, 4081, 4333, 4091, 4287, 4193, 4349, 4191, 4277, 4143, 4193, 4093, 4197, 4052, 4029, 4153, 4183, 4084, 4128]
  Client 0: 36360 train samples, 62 unique classes
  Client 1: 37070 train samples, 62 unique classes
  Client 2: 35957 train samples, 62 unique classes
  Client 3: 38262 train samples, 62 unique classes
  Client 4: 36024 train samples, 62 unique classes
  Client 5: 37732 train samples, 62 unique classes
  Client 6: 36921 train samples, 62 unique classes
  Client 7: 38328 train samples, 62 unique classes
  Client 8: 36867 train samples, 62 unique classes
  Client 9: 37683 train samples, 62 unique classes
  Client 10: 36507 train samples, 62 unique classes
  Client 11: 36915 train samples, 62 unique classes
  Client 12: 36007 train samples, 62 unique classes
  Client 13: 37001 train samples, 62 unique classes
  Client 14: 35681 train samples, 62 unique classes
  Client 15: 35453 train samples, 62 unique classes
  Client 16: 36585 train samples, 62 unique classes
  Client 17: 36801 train samples, 62 unique classes
  Client 18: 35964 train samples, 62 unique classes
  Client 19: 36345 train samples, 62 unique classes
Will sample 10000 samples per client per epoch
Graph: ring, nodes: 20, edges: 20
Degree statistics: avg=2.00, min=2, max=2
Attack: Compromised 8/20 nodes: [1, 5, 11, 12, 13, 14, 17, 18]
Attack type: gaussian, lambda: 1.0
Model variant: baseline
Model parameters: 6,603,710
BALANCE algorithm:
Balance Config: BALANCEConfig(gamma=2, kappa=1, alpha=0.5, min_neighbors=1)
  - Model dimension: 6,603,710 parameters
  - Complexity: O(N×d) = O(20×6,603,710)
Initial test acc across nodes: mean=0.0168 ± 0.0139
Round 001: test acc mean=0.3852 ± 0.1303 | min=0.0044 max=0.5202
         : test loss mean=107698537.7882 ± 324925042.0543
         : individual accs = ['0.429990', '0.414466', '0.376868', '0.399723', '0.461745', '0.457663', '0.520153', '0.462175', '0.381293', '0.258826', '0.416606', '0.447651', '0.004398', '0.045747', '0.465202', '0.458675', '0.452926', '0.432943', '0.395690', '0.421512']
         : correct/total = [(1775, 4128), (1742, 4203), (1538, 4081), (1732, 4333), (1889, 4091), (1962, 4287), (2181, 4193), (2010, 4349), (1598, 4191), (1107, 4277), (1726, 4143), (1877, 4193), (18, 4093), (192, 4197), (1885, 4052), (1848, 4029), (1881, 4153), (1811, 4183), (1616, 4084), (1740, 4128)]
         : compromised: 0.3330, honest: 0.4200
Round 002: test acc mean=0.6459 ± 0.1999 | min=0.0491 max=0.7548
         : test loss mean=nan ± nan
         : individual accs = ['0.754845', '0.636926', '0.739525', '0.726517', '0.737473', '0.659436', '0.700930', '0.710508', '0.697924', '0.724339', '0.714699', '0.725018', '0.058637', '0.049083', '0.684353', '0.746835', '0.748615', '0.650012', '0.721841', '0.731105']
         : correct/total = [(3116, 4128), (2677, 4203), (3018, 4081), (3148, 4333), (3017, 4091), (2827, 4287), (2939, 4193), (3090, 4349), (2925, 4191), (3098, 4277), (2961, 4143), (3040, 4193), (240, 4093), (206, 4197), (2773, 4052), (3009, 4029), (3109, 4153), (2719, 4183), (2948, 4084), (3018, 4128)]
         : compromised: 0.5232, honest: 0.7278
Round 003: test acc mean=0.7023 ± 0.2179 | min=0.0491 max=0.8015
         : test loss mean=nan ± nan
         : individual accs = ['0.795300', '0.696169', '0.801519', '0.786291', '0.800538', '0.695825', '0.780587', '0.782479', '0.760439', '0.788637', '0.780594', '0.770808', '0.058637', '0.049083', '0.775666', '0.782080', '0.794125', '0.777911', '0.784525', '0.784157']
         : correct/total = [(3283, 4128), (2926, 4203), (3271, 4081), (3407, 4333), (3275, 4091), (2983, 4287), (3273, 4193), (3403, 4349), (3187, 4191), (3373, 4277), (3234, 4143), (3232, 4193), (240, 4093), (206, 4197), (3143, 4052), (3151, 4029), (3298, 4153), (3254, 4183), (3204, 4084), (3237, 4128)]
         : compromised: 0.5761, honest: 0.7864
Round 004: test acc mean=0.7302 ± 0.2261 | min=0.0491 max=0.8294
         : test loss mean=nan ± nan
         : individual accs = ['0.818798', '0.754461', '0.818672', '0.817909', '0.829382', '0.768136', '0.802767', '0.808462', '0.795037', '0.808277', '0.801110', '0.801813', '0.058637', '0.049083', '0.809724', '0.813353', '0.826150', '0.805403', '0.814153', '0.802810']
         : correct/total = [(3380, 4128), (3171, 4203), (3341, 4081), (3544, 4333), (3393, 4091), (3293, 4287), (3366, 4193), (3516, 4349), (3332, 4191), (3457, 4277), (3319, 4143), (3362, 4193), (240, 4093), (206, 4197), (3281, 4052), (3277, 4029), (3431, 4153), (3369, 4183), (3325, 4084), (3314, 4128)]
         : compromised: 0.6077, honest: 0.8119
Round 005: test acc mean=0.7429 ± 0.2299 | min=0.0491 max=0.8317
         : test loss mean=nan ± nan
         : individual accs = ['0.828488', '0.793005', '0.831659', '0.826679', '0.828893', '0.807558', '0.820653', '0.828236', '0.810785', '0.825111', '0.812213', '0.814214', '0.058637', '0.049083', '0.816140', '0.816580', '0.828798', '0.819747', '0.825171', '0.815891']
         : correct/total = [(3420, 4128), (3333, 4203), (3394, 4081), (3582, 4333), (3391, 4091), (3462, 4287), (3441, 4193), (3602, 4349), (3398, 4191), (3529, 4277), (3365, 4143), (3414, 4193), (240, 4093), (206, 4197), (3307, 4052), (3290, 4029), (3442, 4153), (3429, 4183), (3370, 4084), (3368, 4128)]
         : compromised: 0.6229, honest: 0.8228
Round 006: test acc mean=0.7532 ± 0.2333 | min=0.0491 max=0.8447
         : test loss mean=nan ± nan
         : individual accs = ['0.829942', '0.823459', '0.839500', '0.841219', '0.841115', '0.817821', '0.817553', '0.839963', '0.823193', '0.835866', '0.819937', '0.822800', '0.058637', '0.049083', '0.834156', '0.823529', '0.844691', '0.833851', '0.840842', '0.826066']
         : correct/total = [(3426, 4128), (3461, 4203), (3426, 4081), (3645, 4333), (3441, 4091), (3506, 4287), (3428, 4193), (3653, 4349), (3450, 4191), (3575, 4277), (3397, 4143), (3450, 4193), (240, 4093), (206, 4197), (3380, 4052), (3318, 4029), (3508, 4153), (3488, 4183), (3434, 4084), (3410, 4128)]
         : compromised: 0.6351, honest: 0.8319
Round 007: test acc mean=0.7568 ± 0.2353 | min=0.0491 max=0.8470
         : test loss mean=nan ± nan
         : individual accs = ['0.837694', '0.817749', '0.846361', '0.846988', '0.846981', '0.826685', '0.828762', '0.845712', '0.828203', '0.844517', '0.823558', '0.825662', '0.053750', '0.049083', '0.839832', '0.825019', '0.840838', '0.836481', '0.843291', '0.829700']
         : correct/total = [(3458, 4128), (3437, 4203), (3454, 4081), (3670, 4333), (3465, 4091), (3544, 4287), (3475, 4193), (3678, 4349), (3471, 4191), (3612, 4277), (3412, 4143), (3462, 4193), (220, 4093), (206, 4197), (3403, 4052), (3324, 4029), (3492, 4153), (3499, 4183), (3444, 4084), (3425, 4128)]
         : compromised: 0.6366, honest: 0.8370
Round 008: test acc mean=0.7599 ± 0.2397 | min=0.0337 max=0.8575
         : test loss mean=nan ± nan
         : individual accs = ['0.841328', '0.832025', '0.850527', '0.849296', '0.857492', '0.832750', '0.823277', '0.850310', '0.833930', '0.847089', '0.823799', '0.839733', '0.033716', '0.049083', '0.835884', '0.831224', '0.844691', '0.844848', '0.843291', '0.833576']
         : correct/total = [(3473, 4128), (3497, 4203), (3471, 4081), (3680, 4333), (3508, 4091), (3570, 4287), (3452, 4193), (3698, 4349), (3495, 4191), (3623, 4277), (3413, 4143), (3521, 4193), (138, 4093), (206, 4197), (3387, 4052), (3349, 4029), (3508, 4153), (3534, 4183), (3444, 4084), (3441, 4128)]
         : compromised: 0.6389, honest: 0.8405
Round 009: test acc mean=0.7669 ± 0.2378 | min=0.0491 max=0.8591
         : test loss mean=nan ± nan
         : individual accs = ['0.842781', '0.847966', '0.859103', '0.854373', '0.856025', '0.844180', '0.839017', '0.855369', '0.840611', '0.851064', '0.841902', '0.834486', '0.058637', '0.049083', '0.838598', '0.840903', '0.858416', '0.841501', '0.849657', '0.834787']
         : correct/total = [(3479, 4128), (3564, 4203), (3506, 4081), (3702, 4333), (3502, 4091), (3619, 4287), (3518, 4193), (3720, 4349), (3523, 4191), (3640, 4277), (3488, 4143), (3499, 4193), (240, 4093), (206, 4197), (3398, 4052), (3388, 4029), (3565, 4153), (3520, 4183), (3470, 4084), (3446, 4128)]
         : compromised: 0.6455, honest: 0.8479
Round 010: test acc mean=0.7668 ± 0.2378 | min=0.0491 max=0.8567
         : test loss mean=nan ± nan
         : individual accs = ['0.845446', '0.850821', '0.854202', '0.856681', '0.855048', '0.835549', '0.834486', '0.851690', '0.845860', '0.856208', '0.834178', '0.839017', '0.058637', '0.049083', '0.843287', '0.841648', '0.853841', '0.841501', '0.852106', '0.837452']
         : correct/total = [(3490, 4128), (3576, 4203), (3486, 4081), (3712, 4333), (3498, 4091), (3582, 4287), (3499, 4193), (3704, 4349), (3545, 4191), (3662, 4277), (3456, 4143), (3518, 4193), (240, 4093), (206, 4197), (3417, 4052), (3391, 4029), (3546, 4153), (3520, 4183), (3480, 4084), (3457, 4128)]
         : compromised: 0.6463, honest: 0.8472

=== FINAL RESULTS ===
Dataset: femnist, Nodes: 20, Graph: ring, Aggregation: balance
Attack: gaussian, 40.0% compromised
Final accuracy - Compromised: 0.6463, Honest: 0.8472
Overall test accuracy: mean=0.7668 ± 0.2378

=== BALANCE SUMMARY ===
Node 0: acceptance=0.500
Node 1: acceptance=0.850
Node 2: acceptance=0.500
Node 3: acceptance=1.000
Node 4: acceptance=0.500
Node 5: acceptance=0.850
Node 6: acceptance=0.500
Node 7: acceptance=1.000
Node 8: acceptance=1.000
Node 9: acceptance=1.000
Node 10: acceptance=0.500
Node 11: acceptance=0.500
Node 12: acceptance=0.900
Node 13: acceptance=0.000
Node 14: acceptance=0.500
Node 15: acceptance=0.500
Node 16: acceptance=0.500
Node 17: acceptance=0.500
Node 18: acceptance=0.500
Node 19: acceptance=0.500

=== PARALLEL EXECUTION TIME (realistic for distributed system) ===
  COMMUNICATION (max across nodes):
    - Full model transfer: 0.000s (0.1%)
  COMPUTATION (max across nodes):
    - Filtering: 0.052s (66.5%)
    - Aggregation: 0.026s (33.5%)
  TOTALS:
    - Total computation: 0.078s (99.9%)
    - Total communication: 0.000s (0.1%)
    - Total parallel time: 0.078s

=== PER-NODE AVERAGE TIME ===
  - Filtering: 0.026s
  - Aggregation: 0.012s
  - Model transfer: 0.000s
  - Total per node: 0.038s

=== TOTAL COMPUTATIONAL WORK (sum across all nodes) ===
  - Total filtering: 0.524s
  - Total aggregation: 0.235s
  - Total model transfer: 0.000s
  - Grand total: 0.759s
  - Mean acceptance rate: 0.630

BALANCE Algorithm Properties:
  - Model dimension: 6,603,710
  - No compression: Full parameter comparison
  - Theoretical complexity: O(deg(i)×d)
  - Approach: Full parameter filtering + averaging
