Device: cuda
Seed: 987654321
Loading 36 LEAF FEMNIST train files...
LEAF FEMNIST train: 3597 users, 734463 samples
Loading 36 LEAF FEMNIST test files...
LEAF FEMNIST test: 3597 users, 83388 samples
Found 3597 train users, 3597 test users, 3597 common users
User sample counts range: 525 (max) to 17 (min)
Distributed ALL 3597 users across 20 clients
Users per client: 179 (with 17 clients getting +1 user)
Train partition sizes: [36360, 37070, 35957, 38262, 36024, 37732, 36921, 38328, 36867, 37683, 36507, 36915, 36007, 37001, 35681, 35453, 36585, 36801, 35964, 36345]
Test partition sizes: [4128, 4203, 4081, 4333, 4091, 4287, 4193, 4349, 4191, 4277, 4143, 4193, 4093, 4197, 4052, 4029, 4153, 4183, 4084, 4128]
  Client 0: 36360 train samples, 62 unique classes
  Client 1: 37070 train samples, 62 unique classes
  Client 2: 35957 train samples, 62 unique classes
  Client 3: 38262 train samples, 62 unique classes
  Client 4: 36024 train samples, 62 unique classes
  Client 5: 37732 train samples, 62 unique classes
  Client 6: 36921 train samples, 62 unique classes
  Client 7: 38328 train samples, 62 unique classes
  Client 8: 36867 train samples, 62 unique classes
  Client 9: 37683 train samples, 62 unique classes
  Client 10: 36507 train samples, 62 unique classes
  Client 11: 36915 train samples, 62 unique classes
  Client 12: 36007 train samples, 62 unique classes
  Client 13: 37001 train samples, 62 unique classes
  Client 14: 35681 train samples, 62 unique classes
  Client 15: 35453 train samples, 62 unique classes
  Client 16: 36585 train samples, 62 unique classes
  Client 17: 36801 train samples, 62 unique classes
  Client 18: 35964 train samples, 62 unique classes
  Client 19: 36345 train samples, 62 unique classes
Will sample 10000 samples per client per epoch
Graph: erdos, nodes: 20, edges: 48
Degree statistics: avg=4.80, min=2, max=7
Attack: Compromised 4/20 nodes: [5, 12, 13, 17]
Attack type: backdoor, lambda: 1.0
Backdoor target label: 0, trigger size: 4
Model variant: baseline
Model parameters: 6,603,710
Initial test acc across nodes: mean=0.0162 ± 0.0138
Backdoor attack: Created poisoned datasets for 4 compromised nodes
Round 001: test acc mean=0.0561 ± 0.0626 | min=0.0036 max=0.2435
         : test loss mean=3009.6058 ± 5911.4700
         : individual accs = ['0.005329', '0.053533', '0.081843', '0.005308', '0.057932', '0.044553', '0.020987', '0.043228', '0.149129', '0.173954', '0.048274', '0.003577', '0.012460', '0.006910', '0.055281', '0.011914', '0.005297', '0.020559', '0.077865', '0.243459']
         : correct/total = [(22, 4128), (225, 4203), (334, 4081), (23, 4333), (237, 4091), (191, 4287), (88, 4193), (188, 4349), (625, 4191), (744, 4277), (200, 4143), (15, 4193), (51, 4093), (29, 4197), (224, 4052), (48, 4029), (22, 4153), (86, 4183), (318, 4084), (1005, 4128)]
         : compromised: 0.0211, honest: 0.0648
Round 002: test acc mean=0.0487 ± 0.0047 | min=0.0353 max=0.0574
         : test loss mean=864213100377.8359 ± 2490847127020.0293
         : individual accs = ['0.049419', '0.048775', '0.046802', '0.049619', '0.053043', '0.048519', '0.045314', '0.050126', '0.050823', '0.035305', '0.051412', '0.050560', '0.051796', '0.048130', '0.044669', '0.055845', '0.042861', '0.044227', '0.048482', '0.057413']
         : correct/total = [(204, 4128), (205, 4203), (191, 4081), (215, 4333), (217, 4091), (208, 4287), (190, 4193), (218, 4349), (213, 4191), (151, 4277), (213, 4143), (212, 4193), (212, 4093), (202, 4197), (181, 4052), (225, 4029), (178, 4153), (185, 4183), (198, 4084), (237, 4128)]
         : compromised: 0.0482, honest: 0.0488
Round 003: test acc mean=0.0508 ± 0.0043 | min=0.0432 max=0.0615
         : test loss mean=134116956173.1435 ± 467567578128.9496
         : individual accs = ['0.048207', '0.052819', '0.061505', '0.049619', '0.053043', '0.048519', '0.048891', '0.043228', '0.045335', '0.050736', '0.051412', '0.050560', '0.045688', '0.054801', '0.050592', '0.050137', '0.048158', '0.052116', '0.060235', '0.050388']
         : correct/total = [(199, 4128), (222, 4203), (251, 4081), (215, 4333), (217, 4091), (208, 4287), (205, 4193), (188, 4349), (190, 4191), (217, 4277), (213, 4143), (212, 4193), (187, 4093), (230, 4197), (205, 4052), (202, 4029), (200, 4153), (218, 4183), (246, 4084), (208, 4128)]
         : compromised: 0.0503, honest: 0.0509
Round 004: test acc mean=0.0519 ± 0.0065 | min=0.0422 max=0.0623
         : test loss mean=118686.1128 ± 288848.8120
         : individual accs = ['0.049661', '0.052819', '0.061505', '0.042234', '0.052066', '0.052018', '0.053422', '0.052656', '0.057266', '0.050736', '0.051895', '0.042213', '0.062301', '0.045509', '0.044669', '0.061554', '0.042861', '0.044227', '0.060235', '0.057413']
         : correct/total = [(205, 4128), (222, 4203), (251, 4081), (183, 4333), (213, 4091), (223, 4287), (224, 4193), (229, 4349), (240, 4191), (217, 4277), (215, 4143), (177, 4193), (255, 4093), (191, 4197), (181, 4052), (248, 4029), (178, 4153), (185, 4183), (246, 4084), (237, 4128)]
         : compromised: 0.0510, honest: 0.0521
Round 005: test acc mean=0.0545 ± 0.0043 | min=0.0486 max=0.0623
         : test loss mean=3.7181 ± 0.0215
         : individual accs = ['0.049661', '0.052819', '0.061505', '0.049850', '0.052066', '0.052018', '0.053422', '0.052656', '0.057266', '0.048632', '0.051895', '0.054853', '0.062301', '0.049083', '0.055281', '0.061554', '0.050566', '0.057853', '0.060235', '0.057413']
         : correct/total = [(205, 4128), (222, 4203), (251, 4081), (216, 4333), (213, 4091), (223, 4287), (224, 4193), (229, 4349), (240, 4191), (208, 4277), (215, 4143), (230, 4193), (255, 4093), (206, 4197), (224, 4052), (248, 4029), (210, 4153), (242, 4183), (246, 4084), (237, 4128)]
         : compromised: 0.0553, honest: 0.0544
Round 006: test acc mean=0.0543 ± 0.0044 | min=0.0486 max=0.0623
         : test loss mean=32452929650.7114 ± 141459040753.1489
         : individual accs = ['0.049661', '0.052819', '0.061505', '0.049850', '0.052066', '0.052018', '0.053422', '0.052656', '0.057266', '0.048632', '0.051895', '0.054853', '0.062301', '0.049083', '0.050592', '0.061554', '0.050566', '0.057853', '0.060235', '0.057413']
         : correct/total = [(205, 4128), (222, 4203), (251, 4081), (216, 4333), (213, 4091), (223, 4287), (224, 4193), (229, 4349), (240, 4191), (208, 4277), (215, 4143), (230, 4193), (255, 4093), (206, 4197), (205, 4052), (248, 4029), (210, 4153), (242, 4183), (246, 4084), (237, 4128)]
         : compromised: 0.0553, honest: 0.0541
Round 007: test acc mean=0.0512 ± 0.0046 | min=0.0453 max=0.0615
         : test loss mean=3.7044 ± 0.0184
         : individual accs = ['0.048450', '0.052819', '0.061505', '0.047542', '0.048399', '0.047352', '0.045314', '0.046907', '0.057266', '0.048632', '0.050205', '0.051514', '0.052040', '0.048844', '0.052320', '0.048151', '0.045750', '0.052833', '0.060235', '0.057413']
         : correct/total = [(200, 4128), (222, 4203), (251, 4081), (206, 4333), (198, 4091), (203, 4287), (190, 4193), (204, 4349), (240, 4191), (208, 4277), (208, 4143), (216, 4193), (213, 4093), (205, 4197), (212, 4052), (194, 4029), (190, 4153), (221, 4183), (246, 4084), (237, 4128)]
         : compromised: 0.0503, honest: 0.0514
Round 008: test acc mean=0.0514 ± 0.0044 | min=0.0453 max=0.0615
         : test loss mean=3.7112 ± 0.0240
         : individual accs = ['0.049419', '0.052819', '0.061505', '0.047542', '0.048399', '0.047352', '0.045314', '0.046907', '0.057266', '0.048632', '0.050205', '0.051514', '0.052040', '0.048844', '0.052320', '0.048151', '0.049362', '0.052833', '0.060235', '0.057413']
         : correct/total = [(204, 4128), (222, 4203), (251, 4081), (206, 4333), (198, 4091), (203, 4287), (190, 4193), (204, 4349), (240, 4191), (208, 4277), (208, 4143), (216, 4193), (213, 4093), (205, 4197), (212, 4052), (194, 4029), (205, 4153), (221, 4183), (246, 4084), (237, 4128)]
         : compromised: 0.0503, honest: 0.0517
Round 009: test acc mean=0.0515 ± 0.0045 | min=0.0455 max=0.0615
         : test loss mean=4814.8421 ± 20971.2467
         : individual accs = ['0.049419', '0.052819', '0.061505', '0.048927', '0.046443', '0.045486', '0.051276', '0.050586', '0.057266', '0.048632', '0.052860', '0.048653', '0.052284', '0.053848', '0.050592', '0.046662', '0.049362', '0.046378', '0.060235', '0.057413']
         : correct/total = [(204, 4128), (222, 4203), (251, 4081), (212, 4333), (190, 4091), (195, 4287), (215, 4193), (220, 4349), (240, 4191), (208, 4277), (219, 4143), (204, 4193), (214, 4093), (226, 4197), (205, 4052), (188, 4029), (205, 4153), (194, 4183), (246, 4084), (237, 4128)]
         : compromised: 0.0495, honest: 0.0520
Round 010: test acc mean=0.0545 ± 0.0043 | min=0.0486 max=0.0623
         : test loss mean=3.6985 ± 0.0151
         : individual accs = ['0.049661', '0.052819', '0.061505', '0.049850', '0.052066', '0.052018', '0.053422', '0.052656', '0.057266', '0.048632', '0.051895', '0.054853', '0.062301', '0.049083', '0.055281', '0.061554', '0.050566', '0.057853', '0.060235', '0.057413']
         : correct/total = [(205, 4128), (222, 4203), (251, 4081), (216, 4333), (213, 4091), (223, 4287), (224, 4193), (229, 4349), (240, 4191), (208, 4277), (215, 4143), (230, 4193), (255, 4093), (206, 4197), (224, 4052), (248, 4029), (210, 4153), (242, 4183), (246, 4084), (237, 4128)]
         : compromised: 0.0553, honest: 0.0544

=== FINAL RESULTS ===
Dataset: femnist, Nodes: 20, Graph: erdos, Aggregation: d-fedavg
Attack: backdoor, 20.0% compromised
Final accuracy - Compromised: 0.0553, Honest: 0.0544
Overall test accuracy: mean=0.0545 ± 0.0043

=== BACKDOOR ATTACK SUCCESS RATE (ASR) ===
Target label: 0
Trigger size: 4x4
Overall ASR: 0.0000 ± 0.0000
Honest nodes ASR: 0.0000 ± 0.0000
Compromised nodes ASR: 0.0000 ± 0.0000
Note: Higher ASR indicates more successful backdoor attack
