Device: cuda
Seed: 987654321
Loading 36 LEAF FEMNIST train files...
LEAF FEMNIST train: 3597 users, 734463 samples
Loading 36 LEAF FEMNIST test files...
LEAF FEMNIST test: 3597 users, 83388 samples
Found 3597 train users, 3597 test users, 3597 common users
User sample counts range: 525 (max) to 17 (min)
Distributed ALL 3597 users across 20 clients
Users per client: 179 (with 17 clients getting +1 user)
Train partition sizes: [36360, 37070, 35957, 38262, 36024, 37732, 36921, 38328, 36867, 37683, 36507, 36915, 36007, 37001, 35681, 35453, 36585, 36801, 35964, 36345]
Test partition sizes: [4128, 4203, 4081, 4333, 4091, 4287, 4193, 4349, 4191, 4277, 4143, 4193, 4093, 4197, 4052, 4029, 4153, 4183, 4084, 4128]
  Client 0: 36360 train samples, 62 unique classes
  Client 1: 37070 train samples, 62 unique classes
  Client 2: 35957 train samples, 62 unique classes
  Client 3: 38262 train samples, 62 unique classes
  Client 4: 36024 train samples, 62 unique classes
  Client 5: 37732 train samples, 62 unique classes
  Client 6: 36921 train samples, 62 unique classes
  Client 7: 38328 train samples, 62 unique classes
  Client 8: 36867 train samples, 62 unique classes
  Client 9: 37683 train samples, 62 unique classes
  Client 10: 36507 train samples, 62 unique classes
  Client 11: 36915 train samples, 62 unique classes
  Client 12: 36007 train samples, 62 unique classes
  Client 13: 37001 train samples, 62 unique classes
  Client 14: 35681 train samples, 62 unique classes
  Client 15: 35453 train samples, 62 unique classes
  Client 16: 36585 train samples, 62 unique classes
  Client 17: 36801 train samples, 62 unique classes
  Client 18: 35964 train samples, 62 unique classes
  Client 19: 36345 train samples, 62 unique classes
Will sample 10000 samples per client per epoch
Graph: erdos, nodes: 20, edges: 126
Degree statistics: avg=12.60, min=8, max=16
Attack: Compromised 8/20 nodes: [1, 5, 11, 12, 13, 14, 17, 18]
Attack type: gaussian, lambda: 1.0
Model variant: baseline
Model parameters: 6,603,710
Sketchguard Node 0:
  Model dim: 6,603,710 → Sketch size: 1000
  Compression ratio: 6603.7x
  Using model parameters for aggregation, sketches for filtering
Sketchguard Node 1:
  Model dim: 6,603,710 → Sketch size: 1000
  Compression ratio: 6603.7x
  Using model parameters for aggregation, sketches for filtering
Sketchguard Node 2:
  Model dim: 6,603,710 → Sketch size: 1000
  Compression ratio: 6603.7x
  Using model parameters for aggregation, sketches for filtering
Sketchguard Node 3:
  Model dim: 6,603,710 → Sketch size: 1000
  Compression ratio: 6603.7x
  Using model parameters for aggregation, sketches for filtering
Sketchguard Node 4:
  Model dim: 6,603,710 → Sketch size: 1000
  Compression ratio: 6603.7x
  Using model parameters for aggregation, sketches for filtering
Sketchguard Node 5:
  Model dim: 6,603,710 → Sketch size: 1000
  Compression ratio: 6603.7x
  Using model parameters for aggregation, sketches for filtering
Sketchguard Node 6:
  Model dim: 6,603,710 → Sketch size: 1000
  Compression ratio: 6603.7x
  Using model parameters for aggregation, sketches for filtering
Sketchguard Node 7:
  Model dim: 6,603,710 → Sketch size: 1000
  Compression ratio: 6603.7x
  Using model parameters for aggregation, sketches for filtering
Sketchguard Node 8:
  Model dim: 6,603,710 → Sketch size: 1000
  Compression ratio: 6603.7x
  Using model parameters for aggregation, sketches for filtering
Sketchguard Node 9:
  Model dim: 6,603,710 → Sketch size: 1000
  Compression ratio: 6603.7x
  Using model parameters for aggregation, sketches for filtering
Sketchguard Node 10:
  Model dim: 6,603,710 → Sketch size: 1000
  Compression ratio: 6603.7x
  Using model parameters for aggregation, sketches for filtering
Sketchguard Node 11:
  Model dim: 6,603,710 → Sketch size: 1000
  Compression ratio: 6603.7x
  Using model parameters for aggregation, sketches for filtering
Sketchguard Node 12:
  Model dim: 6,603,710 → Sketch size: 1000
  Compression ratio: 6603.7x
  Using model parameters for aggregation, sketches for filtering
Sketchguard Node 13:
  Model dim: 6,603,710 → Sketch size: 1000
  Compression ratio: 6603.7x
  Using model parameters for aggregation, sketches for filtering
Sketchguard Node 14:
  Model dim: 6,603,710 → Sketch size: 1000
  Compression ratio: 6603.7x
  Using model parameters for aggregation, sketches for filtering
Sketchguard Node 15:
  Model dim: 6,603,710 → Sketch size: 1000
  Compression ratio: 6603.7x
  Using model parameters for aggregation, sketches for filtering
Sketchguard Node 16:
  Model dim: 6,603,710 → Sketch size: 1000
  Compression ratio: 6603.7x
  Using model parameters for aggregation, sketches for filtering
Sketchguard Node 17:
  Model dim: 6,603,710 → Sketch size: 1000
  Compression ratio: 6603.7x
  Using model parameters for aggregation, sketches for filtering
Sketchguard Node 18:
  Model dim: 6,603,710 → Sketch size: 1000
  Compression ratio: 6603.7x
  Using model parameters for aggregation, sketches for filtering
Sketchguard Node 19:
  Model dim: 6,603,710 → Sketch size: 1000
  Compression ratio: 6603.7x
  Using model parameters for aggregation, sketches for filtering
Sketchguard ALGORITHM (Sketch-based Filtering + State Aggregation)
  - Model dimension: 6,603,710 parameters
  - Config: SketchguardConfig(gamma=2, kappa=1, alpha=0.5, min_neighbors=1, sketch_size=1000, network_seed=987654321, attack_detection_window=5)
  - Sketch size: 1000
  - Compression ratio: 6603.7x
  - Complexity: O(d + N×k) = O(6,603,710 + 20×1000)
  - Theoretical speedup vs BALANCE: 19.9x
Initial test acc across nodes: mean=0.0168 ± 0.0139
Round 001: test acc mean=0.5044 ± 0.0346 | min=0.4477 max=0.5932
         : test loss mean=3.7301 ± 0.0272
         : individual accs = ['0.555475', '0.497978', '0.550110', '0.474036', '0.485945', '0.593189', '0.516337', '0.521499', '0.502744', '0.447744', '0.499155', '0.514190', '0.463230', '0.470574', '0.522952', '0.517746', '0.452444', '0.510399', '0.496817', '0.495155']
         : correct/total = [(2293, 4128), (2093, 4203), (2245, 4081), (2054, 4333), (1988, 4091), (2543, 4287), (2165, 4193), (2268, 4349), (2107, 4191), (1915, 4277), (2068, 4143), (2156, 4193), (1896, 4093), (1975, 4197), (2119, 4052), (2086, 4029), (1879, 4153), (2135, 4183), (2029, 4084), (2044, 4128)]
         : compromised: 0.5087, honest: 0.5015
         : sketchguard stats = ['Node 0: acc_rate=0.562', 'Node 1: acc_rate=0.727', 'Node 2: acc_rate=0.500']...
Round 002: test acc mean=0.6782 ± 0.0153 | min=0.6423 max=0.7068
         : test loss mean=3.3486 ± 0.0921
         : individual accs = ['0.690891', '0.672139', '0.673364', '0.702746', '0.689074', '0.706788', '0.660863', '0.681766', '0.678120', '0.667524', '0.678977', '0.642261', '0.656487', '0.690970', '0.682873', '0.657483', '0.678305', '0.688023', '0.681685', '0.683624']
         : correct/total = [(2852, 4128), (2825, 4203), (2748, 4081), (3045, 4333), (2819, 4091), (3030, 4287), (2771, 4193), (2965, 4349), (2842, 4191), (2855, 4277), (2813, 4143), (2693, 4193), (2687, 4093), (2900, 4197), (2767, 4052), (2649, 4029), (2817, 4153), (2878, 4183), (2784, 4084), (2822, 4128)]
         : compromised: 0.6777, honest: 0.6786
         : sketchguard stats = ['Node 0: acc_rate=0.562', 'Node 1: acc_rate=0.727', 'Node 2: acc_rate=0.500']...
Round 003: test acc mean=0.6872 ± 0.0393 | min=0.5728 max=0.7353
         : test loss mean=2.9200 ± 0.2280
         : individual accs = ['0.717781', '0.683321', '0.663318', '0.730672', '0.735273', '0.673431', '0.701407', '0.720625', '0.705560', '0.716156', '0.709148', '0.605295', '0.677254', '0.656898', '0.680158', '0.705634', '0.684325', '0.572795', '0.689030', '0.715116']
         : correct/total = [(2963, 4128), (2872, 4203), (2707, 4081), (3166, 4333), (3008, 4091), (2887, 4287), (2941, 4193), (3134, 4349), (2957, 4191), (3063, 4277), (2938, 4143), (2538, 4193), (2772, 4093), (2757, 4197), (2756, 4052), (2843, 4029), (2842, 4153), (2396, 4183), (2814, 4084), (2952, 4128)]
         : compromised: 0.6548, honest: 0.7088
         : sketchguard stats = ['Node 0: acc_rate=0.562', 'Node 1: acc_rate=0.727', 'Node 2: acc_rate=0.500']...
Round 004: test acc mean=0.6758 ± 0.0376 | min=0.6179 max=0.7438
         : test loss mean=2.2954 ± 0.2638
         : individual accs = ['0.685320', '0.620509', '0.676550', '0.743826', '0.711073', '0.618614', '0.706654', '0.727294', '0.722501', '0.677344', '0.700217', '0.649416', '0.617884', '0.629736', '0.656960', '0.697195', '0.711534', '0.655271', '0.656954', '0.651647']
         : correct/total = [(2829, 4128), (2608, 4203), (2761, 4081), (3223, 4333), (2909, 4091), (2652, 4287), (2963, 4193), (3163, 4349), (3028, 4191), (2897, 4277), (2901, 4143), (2723, 4193), (2529, 4093), (2643, 4197), (2662, 4052), (2809, 4029), (2955, 4153), (2741, 4183), (2683, 4084), (2690, 4128)]
         : compromised: 0.6382, honest: 0.7009
         : sketchguard stats = ['Node 0: acc_rate=0.562', 'Node 1: acc_rate=0.727', 'Node 2: acc_rate=0.500']...
Round 005: test acc mean=0.6900 ± 0.0424 | min=0.6024 max=0.7521
         : test loss mean=1.5837 ± 0.2177
         : individual accs = ['0.697432', '0.602427', '0.700564', '0.750750', '0.752139', '0.671798', '0.706892', '0.746378', '0.683846', '0.744681', '0.724837', '0.636776', '0.642805', '0.631880', '0.655232', '0.667908', '0.709367', '0.721253', '0.656954', '0.695494']
         : correct/total = [(2879, 4128), (2532, 4203), (2859, 4081), (3253, 4333), (3077, 4091), (2880, 4287), (2964, 4193), (3246, 4349), (2866, 4191), (3185, 4277), (3003, 4143), (2670, 4193), (2631, 4093), (2652, 4197), (2655, 4052), (2691, 4029), (2946, 4153), (3017, 4183), (2683, 4084), (2871, 4128)]
         : compromised: 0.6524, honest: 0.7150
         : sketchguard stats = ['Node 0: acc_rate=0.562', 'Node 1: acc_rate=0.727', 'Node 2: acc_rate=0.500']...
Round 006: test acc mean=0.7714 ± 0.0157 | min=0.7300 max=0.7986
         : test loss mean=0.9471 ± 0.0887
         : individual accs = ['0.782219', '0.763502', '0.787797', '0.787445', '0.798582', '0.771402', '0.773670', '0.776500', '0.768313', '0.785364', '0.781559', '0.766754', '0.743709', '0.730045', '0.770237', '0.760238', '0.781604', '0.775998', '0.751959', '0.772045']
         : correct/total = [(3229, 4128), (3209, 4203), (3215, 4081), (3412, 4333), (3267, 4091), (3307, 4287), (3244, 4193), (3377, 4349), (3220, 4191), (3359, 4277), (3238, 4143), (3215, 4193), (3044, 4093), (3064, 4197), (3121, 4052), (3063, 4029), (3246, 4153), (3246, 4183), (3071, 4084), (3187, 4128)]
         : compromised: 0.7592, honest: 0.7796
         : sketchguard stats = ['Node 0: acc_rate=0.562', 'Node 1: acc_rate=0.727', 'Node 2: acc_rate=0.500']...
Round 007: test acc mean=0.8130 ± 0.0092 | min=0.7935 max=0.8301
         : test loss mean=0.6441 ± 0.0333
         : individual accs = ['0.817345', '0.809422', '0.820387', '0.816755', '0.830115', '0.813156', '0.809921', '0.828006', '0.803865', '0.824176', '0.798214', '0.806105', '0.814561', '0.814153', '0.812685', '0.793497', '0.818926', '0.801339', '0.816846', '0.810562']
         : correct/total = [(3374, 4128), (3402, 4203), (3348, 4081), (3539, 4333), (3396, 4091), (3486, 4287), (3396, 4193), (3601, 4349), (3369, 4191), (3525, 4277), (3307, 4143), (3380, 4193), (3334, 4093), (3417, 4197), (3293, 4052), (3197, 4029), (3401, 4153), (3352, 4183), (3336, 4084), (3346, 4128)]
         : compromised: 0.8110, honest: 0.8143
         : sketchguard stats = ['Node 0: acc_rate=0.562', 'Node 1: acc_rate=0.727', 'Node 2: acc_rate=0.500']...
Round 008: test acc mean=0.8284 ± 0.0072 | min=0.8101 max=0.8379
         : test loss mean=0.5415 ± 0.0239
         : individual accs = ['0.829215', '0.834166', '0.837785', '0.829448', '0.836715', '0.831351', '0.823038', '0.837894', '0.826294', '0.834697', '0.821868', '0.823515', '0.834351', '0.827972', '0.819102', '0.810127', '0.828798', '0.819986', '0.836435', '0.824855']
         : correct/total = [(3423, 4128), (3506, 4203), (3419, 4081), (3594, 4333), (3423, 4091), (3564, 4287), (3451, 4193), (3644, 4349), (3463, 4191), (3570, 4277), (3405, 4143), (3453, 4193), (3415, 4093), (3475, 4197), (3319, 4052), (3264, 4029), (3442, 4153), (3430, 4183), (3416, 4084), (3405, 4128)]
         : compromised: 0.8284, honest: 0.8284
         : sketchguard stats = ['Node 0: acc_rate=0.562', 'Node 1: acc_rate=0.727', 'Node 2: acc_rate=0.500']...
Round 009: test acc mean=0.8372 ± 0.0075 | min=0.8271 max=0.8544
         : test loss mean=0.5008 ± 0.0207
         : individual accs = ['0.829942', '0.845586', '0.850282', '0.837295', '0.845515', '0.840914', '0.827093', '0.854449', '0.833930', '0.842413', '0.828868', '0.834009', '0.837772', '0.833452', '0.831194', '0.828990', '0.843727', '0.831461', '0.837659', '0.830426']
         : correct/total = [(3426, 4128), (3554, 4203), (3470, 4081), (3628, 4333), (3459, 4091), (3605, 4287), (3468, 4193), (3716, 4349), (3495, 4191), (3603, 4277), (3434, 4143), (3497, 4193), (3429, 4093), (3498, 4197), (3368, 4052), (3340, 4029), (3504, 4153), (3478, 4183), (3421, 4084), (3428, 4128)]
         : compromised: 0.8365, honest: 0.8377
         : sketchguard stats = ['Node 0: acc_rate=0.562', 'Node 1: acc_rate=0.727', 'Node 2: acc_rate=0.500']...
Round 010: test acc mean=0.8433 ± 0.0073 | min=0.8297 max=0.8538
         : test loss mean=0.4785 ± 0.0214
         : individual accs = ['0.839390', '0.849393', '0.849547', '0.844680', '0.853825', '0.845813', '0.834486', '0.852610', '0.843236', '0.852233', '0.837316', '0.829716', '0.847789', '0.844889', '0.839092', '0.836188', '0.846135', '0.837915', '0.852595', '0.829942']
         : correct/total = [(3465, 4128), (3570, 4203), (3467, 4081), (3660, 4333), (3493, 4091), (3626, 4287), (3499, 4193), (3708, 4349), (3534, 4191), (3645, 4277), (3469, 4143), (3479, 4193), (3470, 4093), (3546, 4197), (3400, 4052), (3369, 4029), (3514, 4153), (3505, 4183), (3482, 4084), (3426, 4128)]
         : compromised: 0.8434, honest: 0.8433
         : sketchguard stats = ['Node 0: acc_rate=0.562', 'Node 1: acc_rate=0.727', 'Node 2: acc_rate=0.500']...

=== FINAL RESULTS ===
Dataset: femnist, Nodes: 20, Graph: erdos, Aggregation: sketchguard
Attack: gaussian, 40.0% compromised
Final accuracy - Compromised: 0.8434, Honest: 0.8433
Overall test accuracy: mean=0.8433 ± 0.0073

=== Sketchguard SUMMARY ===
Node 0: acceptance=0.562
Node 1: acceptance=0.727
Node 2: acceptance=0.500
Node 3: acceptance=0.625
Node 4: acceptance=0.545
Node 5: acceptance=0.533
Node 6: acceptance=0.500
Node 7: acceptance=0.500
Node 8: acceptance=0.500
Node 9: acceptance=0.692
Node 10: acceptance=0.556
Node 11: acceptance=0.571
Node 12: acceptance=0.667
Node 13: acceptance=0.692
Node 14: acceptance=0.600
Node 15: acceptance=0.545
Node 16: acceptance=0.538
Node 17: acceptance=0.667
Node 18: acceptance=0.688
Node 19: acceptance=0.500

=== PARALLEL EXECUTION TIME (realistic for distributed system) ===
  COMMUNICATION (max across nodes):
    - Sketch transfer: 0.000s (0.0%)
    - Model fetch (accepted): 0.000s (0.0%)
  COMPUTATION (max across nodes):
    - Sketching: 4.681s (99.5%)
    - Filtering: 0.002s (0.0%)
    - Aggregation: 0.023s (0.5%)
  TOTALS:
    - Total computation: 4.706s (100.0%)
    - Total communication: 0.000s (0.0%)
    - Total parallel time: 4.706s

=== PER-NODE AVERAGE TIME ===
  - Sketching: 3.315s
  - Filtering: 0.001s
  - Aggregation: 0.015s
  - Sketch transfer: 0.000s
  - Model fetch: 0.000s
  - Total per node: 3.332s

=== TOTAL COMPUTATIONAL WORK (sum across all nodes) ===
  - Total sketching: 66.307s
  - Total filtering: 0.023s
  - Total aggregation: 0.308s
  - Total sketch transfer: 0.000s
  - Total model fetch: 0.000s
  - Grand total: 66.639s
  - Mean acceptance rate: 0.585

Sketchguard Algorithm Properties:
  - Original dimension: 6,603,710
  - Sketch size: 1000
  - Compression ratio: 19.9x
  - Single repetition: No repetitions needed
  - Theoretical complexity: O(d + N×k)
  - Approach: Sketch filtering + state aggregation
