Device: cuda
Seed: 987654321
Loading 36 LEAF FEMNIST train files...
LEAF FEMNIST train: 3597 users, 734463 samples
Loading 36 LEAF FEMNIST test files...
LEAF FEMNIST test: 3597 users, 83388 samples
Found 3597 train users, 3597 test users, 3597 common users
User sample counts range: 525 (max) to 17 (min)
Distributed ALL 3597 users across 20 clients
Users per client: 179 (with 17 clients getting +1 user)
Train partition sizes: [36360, 37070, 35957, 38262, 36024, 37732, 36921, 38328, 36867, 37683, 36507, 36915, 36007, 37001, 35681, 35453, 36585, 36801, 35964, 36345]
Test partition sizes: [4128, 4203, 4081, 4333, 4091, 4287, 4193, 4349, 4191, 4277, 4143, 4193, 4093, 4197, 4052, 4029, 4153, 4183, 4084, 4128]
  Client 0: 36360 train samples, 62 unique classes
  Client 1: 37070 train samples, 62 unique classes
  Client 2: 35957 train samples, 62 unique classes
  Client 3: 38262 train samples, 62 unique classes
  Client 4: 36024 train samples, 62 unique classes
  Client 5: 37732 train samples, 62 unique classes
  Client 6: 36921 train samples, 62 unique classes
  Client 7: 38328 train samples, 62 unique classes
  Client 8: 36867 train samples, 62 unique classes
  Client 9: 37683 train samples, 62 unique classes
  Client 10: 36507 train samples, 62 unique classes
  Client 11: 36915 train samples, 62 unique classes
  Client 12: 36007 train samples, 62 unique classes
  Client 13: 37001 train samples, 62 unique classes
  Client 14: 35681 train samples, 62 unique classes
  Client 15: 35453 train samples, 62 unique classes
  Client 16: 36585 train samples, 62 unique classes
  Client 17: 36801 train samples, 62 unique classes
  Client 18: 35964 train samples, 62 unique classes
  Client 19: 36345 train samples, 62 unique classes
Will sample 10000 samples per client per epoch
Graph: erdos, nodes: 20, edges: 126
Degree statistics: avg=12.60, min=8, max=16
Attack: Compromised 14/20 nodes: [1, 2, 3, 5, 6, 8, 11, 12, 13, 14, 15, 17, 18, 19]
Attack type: backdoor, lambda: 1.0
Backdoor target label: 0, trigger size: 4
Model variant: baseline
Model parameters: 6,603,710
Sketchguard Node 0:
  Model dim: 6,603,710 → Sketch size: 1000
  Compression ratio: 6603.7x
  Using model parameters for aggregation, sketches for filtering
Sketchguard Node 1:
  Model dim: 6,603,710 → Sketch size: 1000
  Compression ratio: 6603.7x
  Using model parameters for aggregation, sketches for filtering
Sketchguard Node 2:
  Model dim: 6,603,710 → Sketch size: 1000
  Compression ratio: 6603.7x
  Using model parameters for aggregation, sketches for filtering
Sketchguard Node 3:
  Model dim: 6,603,710 → Sketch size: 1000
  Compression ratio: 6603.7x
  Using model parameters for aggregation, sketches for filtering
Sketchguard Node 4:
  Model dim: 6,603,710 → Sketch size: 1000
  Compression ratio: 6603.7x
  Using model parameters for aggregation, sketches for filtering
Sketchguard Node 5:
  Model dim: 6,603,710 → Sketch size: 1000
  Compression ratio: 6603.7x
  Using model parameters for aggregation, sketches for filtering
Sketchguard Node 6:
  Model dim: 6,603,710 → Sketch size: 1000
  Compression ratio: 6603.7x
  Using model parameters for aggregation, sketches for filtering
Sketchguard Node 7:
  Model dim: 6,603,710 → Sketch size: 1000
  Compression ratio: 6603.7x
  Using model parameters for aggregation, sketches for filtering
Sketchguard Node 8:
  Model dim: 6,603,710 → Sketch size: 1000
  Compression ratio: 6603.7x
  Using model parameters for aggregation, sketches for filtering
Sketchguard Node 9:
  Model dim: 6,603,710 → Sketch size: 1000
  Compression ratio: 6603.7x
  Using model parameters for aggregation, sketches for filtering
Sketchguard Node 10:
  Model dim: 6,603,710 → Sketch size: 1000
  Compression ratio: 6603.7x
  Using model parameters for aggregation, sketches for filtering
Sketchguard Node 11:
  Model dim: 6,603,710 → Sketch size: 1000
  Compression ratio: 6603.7x
  Using model parameters for aggregation, sketches for filtering
Sketchguard Node 12:
  Model dim: 6,603,710 → Sketch size: 1000
  Compression ratio: 6603.7x
  Using model parameters for aggregation, sketches for filtering
Sketchguard Node 13:
  Model dim: 6,603,710 → Sketch size: 1000
  Compression ratio: 6603.7x
  Using model parameters for aggregation, sketches for filtering
Sketchguard Node 14:
  Model dim: 6,603,710 → Sketch size: 1000
  Compression ratio: 6603.7x
  Using model parameters for aggregation, sketches for filtering
Sketchguard Node 15:
  Model dim: 6,603,710 → Sketch size: 1000
  Compression ratio: 6603.7x
  Using model parameters for aggregation, sketches for filtering
Sketchguard Node 16:
  Model dim: 6,603,710 → Sketch size: 1000
  Compression ratio: 6603.7x
  Using model parameters for aggregation, sketches for filtering
Sketchguard Node 17:
  Model dim: 6,603,710 → Sketch size: 1000
  Compression ratio: 6603.7x
  Using model parameters for aggregation, sketches for filtering
Sketchguard Node 18:
  Model dim: 6,603,710 → Sketch size: 1000
  Compression ratio: 6603.7x
  Using model parameters for aggregation, sketches for filtering
Sketchguard Node 19:
  Model dim: 6,603,710 → Sketch size: 1000
  Compression ratio: 6603.7x
  Using model parameters for aggregation, sketches for filtering
Sketchguard ALGORITHM (Sketch-based Filtering + State Aggregation)
  - Model dimension: 6,603,710 parameters
  - Config: SketchguardConfig(gamma=2, kappa=1, alpha=0.5, min_neighbors=1, sketch_size=1000, network_seed=987654321, attack_detection_window=5)
  - Sketch size: 1000
  - Compression ratio: 6603.7x
  - Complexity: O(d + N×k) = O(6,603,710 + 20×1000)
  - Theoretical speedup vs BALANCE: 19.9x
Initial test acc across nodes: mean=0.0168 ± 0.0139
Backdoor attack: Created poisoned datasets for 14 compromised nodes
Round 001: test acc mean=0.1989 ± 0.1603 | min=0.0482 max=0.5082
         : test loss mean=12435.0352 ± 8703.9831
         : individual accs = ['0.508236', '0.048775', '0.195785', '0.048234', '0.460279', '0.215535', '0.050799', '0.456427', '0.095681', '0.371288', '0.403572', '0.106368', '0.054239', '0.049083', '0.149062', '0.076694', '0.378522', '0.155152', '0.099902', '0.054506']
         : correct/total = [(2098, 4128), (205, 4203), (799, 4081), (209, 4333), (1883, 4091), (924, 4287), (213, 4193), (1985, 4349), (401, 4191), (1588, 4277), (1672, 4143), (446, 4193), (222, 4093), (206, 4197), (604, 4052), (309, 4029), (1572, 4153), (649, 4183), (408, 4084), (225, 4128)]
         : compromised: 0.1000, honest: 0.4297
         : sketchguard stats = ['Node 0: acc_rate=0.312', 'Node 1: acc_rate=0.364', 'Node 2: acc_rate=0.333']...
Round 002: test acc mean=0.2290 ± 0.2772 | min=0.0429 max=0.6879
         : test loss mean=1849411120.9122 ± 7603127751.8563
         : individual accs = ['0.662548', '0.047347', '0.053418', '0.042926', '0.687851', '0.052484', '0.048414', '0.643826', '0.043188', '0.649755', '0.610669', '0.046745', '0.048375', '0.045747', '0.047878', '0.050385', '0.657597', '0.049486', '0.048482', '0.043605']
         : correct/total = [(2735, 4128), (199, 4203), (218, 4081), (186, 4333), (2814, 4091), (225, 4287), (203, 4193), (2800, 4349), (181, 4191), (2779, 4277), (2530, 4143), (196, 4193), (198, 4093), (192, 4197), (194, 4052), (203, 4029), (2731, 4153), (207, 4183), (198, 4084), (180, 4128)]
         : compromised: 0.0477, honest: 0.6520
         : sketchguard stats = ['Node 0: acc_rate=0.312', 'Node 1: acc_rate=0.682', 'Node 2: acc_rate=0.667']...
Round 003: test acc mean=0.2486 ± 0.3030 | min=0.0432 max=0.7385
         : test loss mean=nan ± nan
         : individual accs = ['0.712694', '0.048775', '0.053418', '0.043157', '0.738450', '0.045253', '0.050799', '0.702690', '0.049630', '0.706570', '0.695148', '0.049606', '0.054239', '0.049083', '0.051826', '0.051626', '0.712256', '0.049486', '0.052889', '0.054506']
         : correct/total = [(2942, 4128), (205, 4203), (218, 4081), (187, 4333), (3021, 4091), (194, 4287), (213, 4193), (3056, 4349), (208, 4191), (3022, 4277), (2880, 4143), (208, 4193), (222, 4093), (206, 4197), (210, 4052), (208, 4029), (2958, 4153), (207, 4183), (216, 4084), (225, 4128)]
         : compromised: 0.0503, honest: 0.7113
         : sketchguard stats = ['Node 0: acc_rate=0.312', 'Node 1: acc_rate=0.788', 'Node 2: acc_rate=0.778']...
Round 004: test acc mean=0.2687 ± 0.3336 | min=0.0432 max=0.7878
         : test loss mean=nan ± nan
         : individual accs = ['0.764777', '0.048775', '0.053418', '0.043157', '0.787827', '0.045253', '0.050799', '0.779030', '0.049630', '0.779986', '0.771422', '0.049606', '0.054239', '0.049083', '0.051826', '0.051626', '0.786419', '0.049486', '0.052889', '0.054506']
         : correct/total = [(3157, 4128), (205, 4203), (218, 4081), (187, 4333), (3223, 4091), (194, 4287), (213, 4193), (3388, 4349), (208, 4191), (3336, 4277), (3196, 4143), (208, 4193), (222, 4093), (206, 4197), (210, 4052), (208, 4029), (3266, 4153), (207, 4183), (216, 4084), (225, 4128)]
         : compromised: 0.0503, honest: 0.7782
         : sketchguard stats = ['Node 0: acc_rate=0.312', 'Node 1: acc_rate=0.591', 'Node 2: acc_rate=0.583']...
Round 005: test acc mean=0.2799 ± 0.3508 | min=0.0432 max=0.8218
         : test loss mean=nan ± nan
         : individual accs = ['0.810320', '0.048775', '0.053418', '0.043157', '0.821804', '0.045253', '0.050799', '0.818579', '0.049630', '0.819266', '0.804007', '0.049606', '0.054239', '0.049083', '0.051826', '0.051626', '0.820371', '0.049486', '0.052889', '0.054506']
         : correct/total = [(3345, 4128), (205, 4203), (218, 4081), (187, 4333), (3362, 4091), (194, 4287), (213, 4193), (3560, 4349), (208, 4191), (3504, 4277), (3331, 4143), (208, 4193), (222, 4093), (206, 4197), (210, 4052), (208, 4029), (3407, 4153), (207, 4183), (216, 4084), (225, 4128)]
         : compromised: 0.0503, honest: 0.8157
         : sketchguard stats = ['Node 0: acc_rate=0.312', 'Node 1: acc_rate=0.473', 'Node 2: acc_rate=0.467']...
Round 006: test acc mean=0.2831 ± 0.3557 | min=0.0432 max=0.8330
         : test loss mean=nan ± nan
         : individual accs = ['0.823401', '0.048775', '0.053418', '0.043157', '0.833048', '0.045253', '0.050799', '0.832375', '0.049630', '0.829320', '0.816558', '0.049606', '0.054239', '0.049083', '0.051826', '0.051626', '0.823501', '0.049486', '0.052889', '0.054506']
         : correct/total = [(3399, 4128), (205, 4203), (218, 4081), (187, 4333), (3408, 4091), (194, 4287), (213, 4193), (3620, 4349), (208, 4191), (3547, 4277), (3383, 4143), (208, 4193), (222, 4093), (206, 4197), (210, 4052), (208, 4029), (3420, 4153), (207, 4183), (216, 4084), (225, 4128)]
         : compromised: 0.0503, honest: 0.8264
         : sketchguard stats = ['Node 0: acc_rate=0.312', 'Node 1: acc_rate=0.394', 'Node 2: acc_rate=0.389']...
Round 007: test acc mean=0.2868 ± 0.3613 | min=0.0432 max=0.8473
         : test loss mean=nan ± nan
         : individual accs = ['0.836725', '0.048775', '0.053418', '0.043157', '0.845759', '0.045253', '0.050799', '0.847321', '0.049630', '0.843348', '0.820179', '0.049606', '0.054239', '0.049083', '0.051826', '0.051626', '0.838671', '0.049486', '0.052889', '0.054506']
         : correct/total = [(3454, 4128), (205, 4203), (218, 4081), (187, 4333), (3460, 4091), (194, 4287), (213, 4193), (3685, 4349), (208, 4191), (3607, 4277), (3398, 4143), (208, 4193), (222, 4093), (206, 4197), (210, 4052), (208, 4029), (3483, 4153), (207, 4183), (216, 4084), (225, 4128)]
         : compromised: 0.0503, honest: 0.8387
         : sketchguard stats = ['Node 0: acc_rate=0.312', 'Node 1: acc_rate=0.338', 'Node 2: acc_rate=0.333']...
Round 008: test acc mean=0.2882 ± 0.3635 | min=0.0432 max=0.8519
         : test loss mean=nan ± nan
         : individual accs = ['0.840843', '0.048775', '0.053418', '0.043157', '0.851870', '0.045253', '0.050799', '0.848471', '0.049630', '0.849895', '0.828385', '0.049606', '0.054239', '0.049083', '0.051826', '0.051626', '0.841079', '0.049486', '0.052889', '0.054506']
         : correct/total = [(3471, 4128), (205, 4203), (218, 4081), (187, 4333), (3485, 4091), (194, 4287), (213, 4193), (3690, 4349), (208, 4191), (3635, 4277), (3432, 4143), (208, 4193), (222, 4093), (206, 4197), (210, 4052), (208, 4029), (3493, 4153), (207, 4183), (216, 4084), (225, 4128)]
         : compromised: 0.0503, honest: 0.8434
         : sketchguard stats = ['Node 0: acc_rate=0.312', 'Node 1: acc_rate=0.295', 'Node 2: acc_rate=0.292']...
Round 009: test acc mean=0.2897 ± 0.3656 | min=0.0432 max=0.8607
         : test loss mean=nan ± nan
         : individual accs = ['0.839632', '0.048775', '0.053418', '0.043157', '0.851626', '0.045253', '0.050799', '0.860658', '0.049630', '0.852700', '0.835868', '0.049606', '0.054239', '0.049083', '0.051826', '0.051626', '0.848302', '0.049486', '0.052889', '0.054506']
         : correct/total = [(3466, 4128), (205, 4203), (218, 4081), (187, 4333), (3484, 4091), (194, 4287), (213, 4193), (3743, 4349), (208, 4191), (3647, 4277), (3463, 4143), (208, 4193), (222, 4093), (206, 4197), (210, 4052), (208, 4029), (3523, 4153), (207, 4183), (216, 4084), (225, 4128)]
         : compromised: 0.0503, honest: 0.8481
         : sketchguard stats = ['Node 0: acc_rate=0.312', 'Node 1: acc_rate=0.263', 'Node 2: acc_rate=0.259']...
Round 010: test acc mean=0.2907 ± 0.3672 | min=0.0432 max=0.8588
         : test loss mean=nan ± nan
         : individual accs = ['0.845203', '0.048775', '0.053418', '0.043157', '0.857492', '0.045253', '0.050799', '0.858818', '0.049630', '0.857610', '0.837316', '0.049606', '0.054239', '0.049083', '0.051826', '0.051626', '0.852877', '0.049486', '0.052889', '0.054506']
         : correct/total = [(3489, 4128), (205, 4203), (218, 4081), (187, 4333), (3508, 4091), (194, 4287), (213, 4193), (3735, 4349), (208, 4191), (3668, 4277), (3469, 4143), (208, 4193), (222, 4093), (206, 4197), (210, 4052), (208, 4029), (3542, 4153), (207, 4183), (216, 4084), (225, 4128)]
         : compromised: 0.0503, honest: 0.8516
         : sketchguard stats = ['Node 0: acc_rate=0.312', 'Node 1: acc_rate=0.236', 'Node 2: acc_rate=0.233']...

=== FINAL RESULTS ===
Dataset: femnist, Nodes: 20, Graph: erdos, Aggregation: sketchguard
Attack: backdoor, 70.0% compromised
Final accuracy - Compromised: 0.0503, Honest: 0.8516
Overall test accuracy: mean=0.2907 ± 0.3672

=== BACKDOOR ATTACK SUCCESS RATE (ASR) ===
Target label: 0
Trigger size: 4x4
Overall ASR: 0.7143 ± 0.4364
Honest nodes ASR: 0.0478 ± 0.0044
Compromised nodes ASR: 1.0000 ± 0.0000
Note: Higher ASR indicates more successful backdoor attack

=== Sketchguard SUMMARY ===
Node 0: acceptance=0.312
Node 1: acceptance=0.236
Node 2: acceptance=0.233
Node 3: acceptance=0.237
Node 4: acceptance=0.364
Node 5: acceptance=0.227
Node 6: acceptance=0.229
Node 7: acceptance=0.286
Node 8: acceptance=0.220
Node 9: acceptance=0.308
Node 10: acceptance=0.222
Node 11: acceptance=0.236
Node 12: acceptance=0.233
Node 13: acceptance=0.223
Node 14: acceptance=0.227
Node 15: acceptance=0.227
Node 16: acceptance=0.231
Node 17: acceptance=0.244
Node 18: acceptance=0.231
Node 19: acceptance=0.231

=== PARALLEL EXECUTION TIME (realistic for distributed system) ===
  COMMUNICATION (max across nodes):
    - Sketch transfer: 0.000s (0.0%)
    - Model fetch (accepted): 0.000s (0.0%)
  COMPUTATION (max across nodes):
    - Sketching: 2.545s (99.3%)
    - Filtering: 0.004s (0.2%)
    - Aggregation: 0.014s (0.6%)
  TOTALS:
    - Total computation: 2.563s (100.0%)
    - Total communication: 0.000s (0.0%)
    - Total parallel time: 2.563s

=== PER-NODE AVERAGE TIME ===
  - Sketching: 2.189s
  - Filtering: 0.001s
  - Aggregation: 0.010s
  - Sketch transfer: 0.000s
  - Model fetch: 0.000s
  - Total per node: 2.201s

=== TOTAL COMPUTATIONAL WORK (sum across all nodes) ===
  - Total sketching: 43.787s
  - Total filtering: 0.027s
  - Total aggregation: 0.199s
  - Total sketch transfer: 0.000s
  - Total model fetch: 0.000s
  - Grand total: 44.013s
  - Mean acceptance rate: 0.248

Sketchguard Algorithm Properties:
  - Original dimension: 6,603,710
  - Sketch size: 1000
  - Compression ratio: 19.9x
  - Single repetition: No repetitions needed
  - Theoretical complexity: O(d + N×k)
  - Approach: Sketch filtering + state aggregation
