Device: cuda
Seed: 987654321
Loading 36 LEAF FEMNIST train files...
LEAF FEMNIST train: 3597 users, 734463 samples
Loading 36 LEAF FEMNIST test files...
LEAF FEMNIST test: 3597 users, 83388 samples
Found 3597 train users, 3597 test users, 3597 common users
User sample counts range: 525 (max) to 17 (min)
Distributed ALL 3597 users across 20 clients
Users per client: 179 (with 17 clients getting +1 user)
Train partition sizes: [36360, 37070, 35957, 38262, 36024, 37732, 36921, 38328, 36867, 37683, 36507, 36915, 36007, 37001, 35681, 35453, 36585, 36801, 35964, 36345]
Test partition sizes: [4128, 4203, 4081, 4333, 4091, 4287, 4193, 4349, 4191, 4277, 4143, 4193, 4093, 4197, 4052, 4029, 4153, 4183, 4084, 4128]
  Client 0: 36360 train samples, 62 unique classes
  Client 1: 37070 train samples, 62 unique classes
  Client 2: 35957 train samples, 62 unique classes
  Client 3: 38262 train samples, 62 unique classes
  Client 4: 36024 train samples, 62 unique classes
  Client 5: 37732 train samples, 62 unique classes
  Client 6: 36921 train samples, 62 unique classes
  Client 7: 38328 train samples, 62 unique classes
  Client 8: 36867 train samples, 62 unique classes
  Client 9: 37683 train samples, 62 unique classes
  Client 10: 36507 train samples, 62 unique classes
  Client 11: 36915 train samples, 62 unique classes
  Client 12: 36007 train samples, 62 unique classes
  Client 13: 37001 train samples, 62 unique classes
  Client 14: 35681 train samples, 62 unique classes
  Client 15: 35453 train samples, 62 unique classes
  Client 16: 36585 train samples, 62 unique classes
  Client 17: 36801 train samples, 62 unique classes
  Client 18: 35964 train samples, 62 unique classes
  Client 19: 36345 train samples, 62 unique classes
Will sample 10000 samples per client per epoch
Graph: ring, nodes: 20, edges: 20
Degree statistics: avg=2.00, min=2, max=2
Attack: Compromised 2/20 nodes: [5, 13]
Attack type: gaussian, lambda: 1.0
Model variant: baseline
Model parameters: 6,603,710
BALANCE algorithm:
Balance Config: BALANCEConfig(gamma=2, kappa=1, alpha=0.5, min_neighbors=1)
  - Model dimension: 6,603,710 parameters
  - Complexity: O(N×d) = O(20×6,603,710)
Initial test acc across nodes: mean=0.0168 ± 0.0139
Round 001: test acc mean=0.4273 ± 0.0563 | min=0.2588 max=0.5202
         : test loss mean=3.7156 ± 0.0864
         : individual accs = ['0.444767', '0.414466', '0.479539', '0.399723', '0.461745', '0.457663', '0.520153', '0.462175', '0.381293', '0.258826', '0.430123', '0.448366', '0.441241', '0.372409', '0.465202', '0.492926', '0.398026', '0.453741', '0.351371', '0.412548']
         : correct/total = [(1836, 4128), (1742, 4203), (1957, 4081), (1732, 4333), (1889, 4091), (1962, 4287), (2181, 4193), (2010, 4349), (1598, 4191), (1107, 4277), (1782, 4143), (1880, 4193), (1806, 4093), (1563, 4197), (1885, 4052), (1986, 4029), (1653, 4153), (1898, 4183), (1435, 4084), (1703, 4128)]
         : compromised: 0.4150, honest: 0.4287
Round 002: test acc mean=0.6989 ± 0.0245 | min=0.6594 max=0.7474
         : test loss mean=1.9656 ± 0.6739
         : individual accs = ['0.674661', '0.695456', '0.667974', '0.735057', '0.737473', '0.659436', '0.700930', '0.710508', '0.697924', '0.688801', '0.687425', '0.720487', '0.747374', '0.670479', '0.727048', '0.692976', '0.676138', '0.715754', '0.693683', '0.679021']
         : correct/total = [(2785, 4128), (2923, 4203), (2726, 4081), (3185, 4333), (3017, 4091), (2827, 4287), (2939, 4193), (3090, 4349), (2925, 4191), (2946, 4277), (2848, 4143), (3021, 4193), (3059, 4093), (2814, 4197), (2946, 4052), (2792, 4029), (2808, 4153), (2994, 4183), (2833, 4084), (2803, 4128)]
         : compromised: 0.6650, honest: 0.7027
Round 003: test acc mean=0.7660 ± 0.0226 | min=0.6958 max=0.7996
         : test loss mean=1.2015 ± 0.5284
         : individual accs = ['0.776647', '0.770878', '0.761333', '0.783522', '0.799560', '0.695825', '0.780587', '0.782479', '0.760439', '0.775310', '0.762974', '0.775101', '0.791107', '0.722183', '0.778875', '0.765699', '0.758729', '0.750657', '0.767385', '0.761386']
         : correct/total = [(3206, 4128), (3240, 4203), (3107, 4081), (3395, 4333), (3271, 4091), (2983, 4287), (3273, 4193), (3403, 4349), (3187, 4191), (3316, 4277), (3161, 4143), (3250, 4193), (3238, 4093), (3031, 4197), (3156, 4052), (3085, 4029), (3151, 4153), (3140, 4183), (3134, 4084), (3143, 4128)]
         : compromised: 0.7090, honest: 0.7724
Round 004: test acc mean=0.7956 ± 0.0172 | min=0.7436 max=0.8269
         : test loss mean=0.8954 ± 0.3843
         : individual accs = ['0.797965', '0.794195', '0.794413', '0.807754', '0.826937', '0.766970', '0.802767', '0.808232', '0.792651', '0.802432', '0.783490', '0.806344', '0.814073', '0.743626', '0.806022', '0.797468', '0.797014', '0.788429', '0.799706', '0.782461']
         : correct/total = [(3294, 4128), (3338, 4203), (3242, 4081), (3500, 4333), (3383, 4091), (3288, 4287), (3366, 4193), (3515, 4349), (3322, 4191), (3432, 4277), (3246, 4143), (3381, 4193), (3332, 4093), (3121, 4197), (3266, 4052), (3213, 4029), (3310, 4153), (3298, 4183), (3266, 4084), (3230, 4128)]
         : compromised: 0.7553, honest: 0.8001
Round 005: test acc mean=0.8122 ± 0.0095 | min=0.7865 max=0.8285
         : test loss mean=0.7483 ± 0.2794
         : individual accs = ['0.812984', '0.810374', '0.814506', '0.820909', '0.825471', '0.808258', '0.821130', '0.828466', '0.811739', '0.818798', '0.805455', '0.806821', '0.825312', '0.786514', '0.810711', '0.808637', '0.815796', '0.802295', '0.807542', '0.802326']
         : correct/total = [(3356, 4128), (3406, 4203), (3324, 4081), (3557, 4333), (3377, 4091), (3465, 4287), (3443, 4193), (3603, 4349), (3402, 4191), (3502, 4277), (3337, 4143), (3383, 4193), (3378, 4093), (3301, 4197), (3285, 4052), (3258, 4029), (3388, 4153), (3356, 4183), (3298, 4084), (3312, 4128)]
         : compromised: 0.7974, honest: 0.8138
Round 006: test acc mean=0.8236 ± 0.0103 | min=0.7965 max=0.8395
         : test loss mean=0.6708 ± 0.2287
         : individual accs = ['0.817587', '0.832739', '0.831659', '0.831295', '0.837204', '0.817588', '0.817076', '0.839503', '0.821522', '0.827449', '0.812455', '0.826854', '0.834351', '0.796521', '0.827986', '0.818069', '0.824223', '0.817117', '0.831538', '0.809109']
         : correct/total = [(3375, 4128), (3500, 4203), (3394, 4081), (3602, 4333), (3425, 4091), (3505, 4287), (3426, 4193), (3651, 4349), (3443, 4191), (3539, 4277), (3366, 4143), (3467, 4193), (3415, 4093), (3343, 4197), (3355, 4052), (3296, 4029), (3423, 4153), (3418, 4183), (3396, 4084), (3340, 4128)]
         : compromised: 0.8071, honest: 0.8254
Round 007: test acc mean=0.8295 ± 0.0099 | min=0.8094 max=0.8450
         : test loss mean=0.6248 ± 0.2117
         : individual accs = ['0.826793', '0.827028', '0.839745', '0.836141', '0.844292', '0.822487', '0.829716', '0.845022', '0.825579', '0.836100', '0.815351', '0.825662', '0.841925', '0.809388', '0.833662', '0.821544', '0.834337', '0.812814', '0.837414', '0.824370']
         : correct/total = [(3413, 4128), (3476, 4203), (3427, 4081), (3623, 4333), (3454, 4091), (3526, 4287), (3479, 4193), (3675, 4349), (3460, 4191), (3576, 4277), (3378, 4143), (3462, 4193), (3446, 4093), (3397, 4197), (3378, 4052), (3310, 4029), (3465, 4153), (3400, 4183), (3420, 4084), (3403, 4128)]
         : compromised: 0.8159, honest: 0.8310
Round 008: test acc mean=0.8360 ± 0.0098 | min=0.8194 max=0.8538
         : test loss mean=0.5349 ± 0.0477
         : individual accs = ['0.828004', '0.841780', '0.851507', '0.847450', '0.849914', '0.831817', '0.823992', '0.853759', '0.831067', '0.839140', '0.829592', '0.838063', '0.845346', '0.819395', '0.826505', '0.828245', '0.837226', '0.825962', '0.841822', '0.829215']
         : correct/total = [(3418, 4128), (3538, 4203), (3475, 4081), (3672, 4333), (3477, 4091), (3566, 4287), (3455, 4193), (3713, 4349), (3483, 4191), (3589, 4277), (3437, 4143), (3514, 4193), (3460, 4093), (3439, 4197), (3349, 4052), (3337, 4029), (3477, 4153), (3455, 4183), (3438, 4084), (3423, 4128)]
         : compromised: 0.8256, honest: 0.8371
Round 009: test acc mean=0.8413 ± 0.0077 | min=0.8304 max=0.8563
         : test loss mean=0.5033 ± 0.0298
         : individual accs = ['0.831395', '0.847490', '0.854447', '0.847911', '0.850403', '0.843247', '0.837586', '0.856289', '0.839895', '0.848492', '0.833454', '0.836394', '0.838260', '0.831070', '0.838845', '0.840903', '0.847821', '0.832895', '0.839373', '0.830426']
         : correct/total = [(3432, 4128), (3562, 4203), (3487, 4081), (3674, 4333), (3479, 4091), (3615, 4287), (3512, 4193), (3724, 4349), (3520, 4191), (3629, 4277), (3453, 4143), (3507, 4193), (3431, 4093), (3488, 4197), (3399, 4052), (3388, 4029), (3521, 4153), (3484, 4183), (3428, 4084), (3428, 4128)]
         : compromised: 0.8372, honest: 0.8418
Round 010: test acc mean=0.8419 ± 0.0066 | min=0.8292 max=0.8524
         : test loss mean=0.4923 ± 0.0276
         : individual accs = ['0.836725', '0.841304', '0.847586', '0.849758', '0.849426', '0.834150', '0.834486', '0.852380', '0.845144', '0.842413', '0.835385', '0.840448', '0.848033', '0.846795', '0.842794', '0.839414', '0.850229', '0.830743', '0.840842', '0.829215']
         : correct/total = [(3454, 4128), (3536, 4203), (3459, 4081), (3682, 4333), (3475, 4091), (3576, 4287), (3499, 4193), (3707, 4349), (3542, 4191), (3603, 4277), (3461, 4143), (3524, 4193), (3471, 4093), (3554, 4197), (3415, 4052), (3382, 4029), (3531, 4153), (3475, 4183), (3434, 4084), (3423, 4128)]
         : compromised: 0.8405, honest: 0.8420

=== FINAL RESULTS ===
Dataset: femnist, Nodes: 20, Graph: ring, Aggregation: balance
Attack: gaussian, 10.0% compromised
Final accuracy - Compromised: 0.8405, Honest: 0.8420
Overall test accuracy: mean=0.8419 ± 0.0066

=== BALANCE SUMMARY ===
Node 0: acceptance=1.000
Node 1: acceptance=1.000
Node 2: acceptance=1.000
Node 3: acceptance=1.000
Node 4: acceptance=0.500
Node 5: acceptance=0.850
Node 6: acceptance=0.500
Node 7: acceptance=1.000
Node 8: acceptance=1.000
Node 9: acceptance=1.000
Node 10: acceptance=1.000
Node 11: acceptance=1.000
Node 12: acceptance=0.500
Node 13: acceptance=0.850
Node 14: acceptance=0.500
Node 15: acceptance=1.000
Node 16: acceptance=1.000
Node 17: acceptance=1.000
Node 18: acceptance=1.000
Node 19: acceptance=1.000

=== PARALLEL EXECUTION TIME (realistic for distributed system) ===
  COMMUNICATION (max across nodes):
    - Full model transfer: 0.000s (0.0%)
  COMPUTATION (max across nodes):
    - Filtering: 0.073s (73.7%)
    - Aggregation: 0.026s (26.2%)
  TOTALS:
    - Total computation: 0.099s (100.0%)
    - Total communication: 0.000s (0.0%)
    - Total parallel time: 0.099s

=== PER-NODE AVERAGE TIME ===
  - Filtering: 0.026s
  - Aggregation: 0.010s
  - Model transfer: 0.000s
  - Total per node: 0.036s

=== TOTAL COMPUTATIONAL WORK (sum across all nodes) ===
  - Total filtering: 0.517s
  - Total aggregation: 0.200s
  - Total model transfer: 0.000s
  - Grand total: 0.718s
  - Mean acceptance rate: 0.885

BALANCE Algorithm Properties:
  - Model dimension: 6,603,710
  - No compression: Full parameter comparison
  - Theoretical complexity: O(deg(i)×d)
  - Approach: Full parameter filtering + averaging
