Device: cuda
Seed: 987654321
Loading 36 LEAF FEMNIST train files...
LEAF FEMNIST train: 3597 users, 734463 samples
Loading 36 LEAF FEMNIST test files...
LEAF FEMNIST test: 3597 users, 83388 samples
Found 3597 train users, 3597 test users, 3597 common users
User sample counts range: 525 (max) to 17 (min)
Distributed ALL 3597 users across 20 clients
Users per client: 179 (with 17 clients getting +1 user)
Train partition sizes: [36360, 37070, 35957, 38262, 36024, 37732, 36921, 38328, 36867, 37683, 36507, 36915, 36007, 37001, 35681, 35453, 36585, 36801, 35964, 36345]
Test partition sizes: [4128, 4203, 4081, 4333, 4091, 4287, 4193, 4349, 4191, 4277, 4143, 4193, 4093, 4197, 4052, 4029, 4153, 4183, 4084, 4128]
  Client 0: 36360 train samples, 62 unique classes
  Client 1: 37070 train samples, 62 unique classes
  Client 2: 35957 train samples, 62 unique classes
  Client 3: 38262 train samples, 62 unique classes
  Client 4: 36024 train samples, 62 unique classes
  Client 5: 37732 train samples, 62 unique classes
  Client 6: 36921 train samples, 62 unique classes
  Client 7: 38328 train samples, 62 unique classes
  Client 8: 36867 train samples, 62 unique classes
  Client 9: 37683 train samples, 62 unique classes
  Client 10: 36507 train samples, 62 unique classes
  Client 11: 36915 train samples, 62 unique classes
  Client 12: 36007 train samples, 62 unique classes
  Client 13: 37001 train samples, 62 unique classes
  Client 14: 35681 train samples, 62 unique classes
  Client 15: 35453 train samples, 62 unique classes
  Client 16: 36585 train samples, 62 unique classes
  Client 17: 36801 train samples, 62 unique classes
  Client 18: 35964 train samples, 62 unique classes
  Client 19: 36345 train samples, 62 unique classes
Will sample 10000 samples per client per epoch
Graph: fully, nodes: 20, edges: 190
Degree statistics: avg=19.00, min=19, max=19
Attack: Compromised 14/20 nodes: [1, 2, 3, 5, 6, 8, 11, 12, 13, 14, 15, 17, 18, 19]
Attack type: backdoor, lambda: 1.0
Backdoor target label: 0, trigger size: 4
Model variant: baseline
Model parameters: 6,603,710
UBAR ALGORITHM (Two-Stage Byzantine-resilient)
  - Model dimension: 6,603,710 parameters
  - Rho parameter: 0.30000000000000004
  - Stage 1: Distance-based filtering (select 30% closest neighbors)
  - Stage 2: Performance-based selection (loss comparison)
  - Complexity: O(deg(i)×d + deg(i)×inference)
Initial test acc across nodes: mean=0.0168 ± 0.0139
Backdoor attack: Created poisoned datasets for 14 compromised nodes
Round 001: test acc mean=0.1844 ± 0.1407 | min=0.0478 max=0.4852
         : test loss mean=12437.9490 ± 8702.6478
         : individual accs = ['0.324855', '0.048775', '0.195050', '0.047773', '0.434124', '0.215069', '0.050799', '0.485169', '0.096397', '0.382745', '0.338161', '0.105414', '0.054239', '0.049083', '0.150049', '0.078183', '0.320010', '0.155869', '0.102351', '0.054506']
         : correct/total = [(1341, 4128), (205, 4203), (796, 4081), (207, 4333), (1776, 4091), (922, 4287), (213, 4193), (2110, 4349), (404, 4191), (1637, 4277), (1401, 4143), (442, 4193), (222, 4093), (206, 4197), (608, 4052), (315, 4029), (1329, 4153), (652, 4183), (418, 4084), (225, 4128)]
         : compromised: 0.1003, honest: 0.3808
         : ubar stats = ['Node 0: s1=0.263, s2=0.200', 'Node 1: s1=0.263, s2=1.000', 'Node 2: s1=0.263, s2=1.000']...
Round 002: test acc mean=0.2446 ± 0.2997 | min=0.0432 max=0.7438
         : test loss mean=605.9472 ± 1447.2967
         : individual accs = ['0.701308', '0.048537', '0.045087', '0.046850', '0.741872', '0.057849', '0.053899', '0.606346', '0.043188', '0.735329', '0.674632', '0.045314', '0.048620', '0.047177', '0.051826', '0.054604', '0.743800', '0.048291', '0.052889', '0.045058']
         : correct/total = [(2895, 4128), (204, 4203), (184, 4081), (203, 4333), (3035, 4091), (248, 4287), (226, 4193), (2637, 4349), (181, 4191), (3145, 4277), (2795, 4143), (190, 4193), (199, 4093), (198, 4197), (210, 4052), (220, 4029), (3089, 4153), (202, 4183), (216, 4084), (186, 4128)]
         : compromised: 0.0492, honest: 0.7005
         : ubar stats = ['Node 0: s1=0.263, s2=0.400', 'Node 1: s1=0.263, s2=1.000', 'Node 2: s1=0.263, s2=1.000']...
Round 003: test acc mean=0.2699 ± 0.3349 | min=0.0432 max=0.7908
         : test loss mean=nan ± nan
         : individual accs = ['0.786337', '0.048775', '0.053418', '0.043157', '0.789294', '0.050618', '0.050799', '0.769372', '0.049630', '0.776946', '0.775284', '0.049606', '0.054239', '0.049083', '0.051826', '0.051626', '0.790754', '0.049486', '0.052889', '0.054506']
         : correct/total = [(3246, 4128), (205, 4203), (218, 4081), (187, 4333), (3229, 4091), (217, 4287), (213, 4193), (3346, 4349), (208, 4191), (3323, 4277), (3212, 4143), (208, 4193), (222, 4093), (206, 4197), (210, 4052), (208, 4029), (3284, 4153), (207, 4183), (216, 4084), (225, 4128)]
         : compromised: 0.0507, honest: 0.7813
         : ubar stats = ['Node 0: s1=0.263, s2=0.467', 'Node 1: s1=0.263, s2=0.733', 'Node 2: s1=0.263, s2=0.733']...
Round 004: test acc mean=0.2789 ± 0.3493 | min=0.0432 max=0.8282
         : test loss mean=nan ± nan
         : individual accs = ['0.809109', '0.048775', '0.053418', '0.043157', '0.828159', '0.045253', '0.050799', '0.807542', '0.049630', '0.817395', '0.797490', '0.049606', '0.054239', '0.049083', '0.051826', '0.051626', '0.814351', '0.049486', '0.052889', '0.054506']
         : correct/total = [(3340, 4128), (205, 4203), (218, 4081), (187, 4333), (3388, 4091), (194, 4287), (213, 4193), (3512, 4349), (208, 4191), (3496, 4277), (3304, 4143), (208, 4193), (222, 4093), (206, 4197), (210, 4052), (208, 4029), (3382, 4153), (207, 4183), (216, 4084), (225, 4128)]
         : compromised: 0.0503, honest: 0.8123
         : ubar stats = ['Node 0: s1=0.263, s2=0.550', 'Node 1: s1=0.263, s2=0.600', 'Node 2: s1=0.263, s2=0.600']...
Round 005: test acc mean=0.2834 ± 0.3561 | min=0.0432 max=0.8370
         : test loss mean=nan ± nan
         : individual accs = ['0.818072', '0.048775', '0.053418', '0.043157', '0.835493', '0.045253', '0.050799', '0.836974', '0.049630', '0.829553', '0.812696', '0.049606', '0.054239', '0.049083', '0.051826', '0.051626', '0.830484', '0.049486', '0.052889', '0.054506']
         : correct/total = [(3377, 4128), (205, 4203), (218, 4081), (187, 4333), (3418, 4091), (194, 4287), (213, 4193), (3640, 4349), (208, 4191), (3548, 4277), (3367, 4143), (208, 4193), (222, 4093), (206, 4197), (210, 4052), (208, 4029), (3449, 4153), (207, 4183), (216, 4084), (225, 4128)]
         : compromised: 0.0503, honest: 0.8272
         : ubar stats = ['Node 0: s1=0.263, s2=0.480', 'Node 1: s1=0.263, s2=0.520', 'Node 2: s1=0.263, s2=0.520']...
Round 006: test acc mean=0.2852 ± 0.3589 | min=0.0432 max=0.8453
         : test loss mean=nan ± nan
         : individual accs = ['0.825339', '0.048775', '0.053418', '0.043157', '0.841604', '0.045253', '0.050799', '0.845252', '0.049630', '0.840542', '0.824041', '0.049606', '0.054239', '0.049083', '0.051826', '0.051626', '0.823020', '0.049486', '0.052889', '0.054506']
         : correct/total = [(3407, 4128), (205, 4203), (218, 4081), (187, 4333), (3443, 4091), (194, 4287), (213, 4193), (3676, 4349), (208, 4191), (3595, 4277), (3414, 4143), (208, 4193), (222, 4093), (206, 4197), (210, 4052), (208, 4029), (3418, 4153), (207, 4183), (216, 4084), (225, 4128)]
         : compromised: 0.0503, honest: 0.8333
         : ubar stats = ['Node 0: s1=0.263, s2=0.433', 'Node 1: s1=0.263, s2=0.467', 'Node 2: s1=0.263, s2=0.467']...
Round 007: test acc mean=0.2886 ± 0.3641 | min=0.0432 max=0.8563
         : test loss mean=nan ± nan
         : individual accs = ['0.843750', '0.048775', '0.053418', '0.043157', '0.847226', '0.045253', '0.050799', '0.856289', '0.049630', '0.842647', '0.832006', '0.049606', '0.054239', '0.049083', '0.051826', '0.051626', '0.846376', '0.049486', '0.052889', '0.054506']
         : correct/total = [(3483, 4128), (205, 4203), (218, 4081), (187, 4333), (3466, 4091), (194, 4287), (213, 4193), (3724, 4349), (208, 4191), (3604, 4277), (3447, 4143), (208, 4193), (222, 4093), (206, 4197), (210, 4052), (208, 4029), (3515, 4153), (207, 4183), (216, 4084), (225, 4128)]
         : compromised: 0.0503, honest: 0.8447
         : ubar stats = ['Node 0: s1=0.263, s2=0.486', 'Node 1: s1=0.263, s2=0.429', 'Node 2: s1=0.263, s2=0.429']...
Round 008: test acc mean=0.2892 ± 0.3649 | min=0.0432 max=0.8546
         : test loss mean=nan ± nan
         : individual accs = ['0.843023', '0.048775', '0.053418', '0.043157', '0.854559', '0.045253', '0.050799', '0.848241', '0.049630', '0.844985', '0.841902', '0.049606', '0.054239', '0.049083', '0.051826', '0.051626', '0.846617', '0.049486', '0.052889', '0.054506']
         : correct/total = [(3480, 4128), (205, 4203), (218, 4081), (187, 4333), (3496, 4091), (194, 4287), (213, 4193), (3689, 4349), (208, 4191), (3614, 4277), (3488, 4143), (208, 4193), (222, 4093), (206, 4197), (210, 4052), (208, 4029), (3516, 4153), (207, 4183), (216, 4084), (225, 4128)]
         : compromised: 0.0503, honest: 0.8466
         : ubar stats = ['Node 0: s1=0.263, s2=0.475', 'Node 1: s1=0.263, s2=0.400', 'Node 2: s1=0.263, s2=0.400']...
Round 009: test acc mean=0.2907 ± 0.3672 | min=0.0432 max=0.8634
         : test loss mean=nan ± nan
         : individual accs = ['0.842539', '0.048775', '0.053418', '0.043157', '0.852603', '0.045253', '0.050799', '0.863417', '0.049630', '0.856441', '0.839730', '0.049606', '0.054239', '0.049083', '0.051826', '0.051626', '0.854563', '0.049486', '0.052889', '0.054506']
         : correct/total = [(3478, 4128), (205, 4203), (218, 4081), (187, 4333), (3488, 4091), (194, 4287), (213, 4193), (3755, 4349), (208, 4191), (3663, 4277), (3479, 4143), (208, 4193), (222, 4093), (206, 4197), (210, 4052), (208, 4029), (3549, 4153), (207, 4183), (216, 4084), (225, 4128)]
         : compromised: 0.0503, honest: 0.8515
         : ubar stats = ['Node 0: s1=0.263, s2=0.533', 'Node 1: s1=0.263, s2=0.378', 'Node 2: s1=0.263, s2=0.378']...
Round 010: test acc mean=0.2913 ± 0.3682 | min=0.0432 max=0.8629
         : test loss mean=nan ± nan
         : individual accs = ['0.850775', '0.048775', '0.053418', '0.043157', '0.862870', '0.045253', '0.050799', '0.857898', '0.049630', '0.859247', '0.840212', '0.049606', '0.054239', '0.049083', '0.051826', '0.051626', '0.851433', '0.049486', '0.052889', '0.054506']
         : correct/total = [(3512, 4128), (205, 4203), (218, 4081), (187, 4333), (3530, 4091), (194, 4287), (213, 4193), (3731, 4349), (208, 4191), (3675, 4277), (3481, 4143), (208, 4193), (222, 4093), (206, 4197), (210, 4052), (208, 4029), (3536, 4153), (207, 4183), (216, 4084), (225, 4128)]
         : compromised: 0.0503, honest: 0.8537
         : ubar stats = ['Node 0: s1=0.263, s2=0.560', 'Node 1: s1=0.263, s2=0.360', 'Node 2: s1=0.263, s2=0.360']...

=== FINAL RESULTS ===
Dataset: femnist, Nodes: 20, Graph: fully, Aggregation: ubar
Attack: backdoor, 70.0% compromised
Final accuracy - Compromised: 0.0503, Honest: 0.8537
Overall test accuracy: mean=0.2913 ± 0.3682

=== BACKDOOR ATTACK SUCCESS RATE (ASR) ===
Target label: 0
Trigger size: 4x4
Overall ASR: 0.7150 ± 0.4354
Honest nodes ASR: 0.0499 ± 0.0032
Compromised nodes ASR: 1.0000 ± 0.0000
Note: Higher ASR indicates more successful backdoor attack

=== UBAR SUMMARY ===
Node 0: stage1=0.263, stage2=0.560, overall=0.147
Node 1: stage1=0.263, stage2=0.360, overall=0.095
Node 2: stage1=0.263, stage2=0.360, overall=0.095
Node 3: stage1=0.263, stage2=0.360, overall=0.095
Node 4: stage1=0.263, stage2=0.360, overall=0.095
Node 5: stage1=0.263, stage2=0.300, overall=0.079
Node 6: stage1=0.263, stage2=0.360, overall=0.095
Node 7: stage1=0.263, stage2=0.580, overall=0.153
Node 8: stage1=0.263, stage2=0.360, overall=0.095
Node 9: stage1=0.263, stage2=0.340, overall=0.089
Node 10: stage1=0.263, stage2=0.360, overall=0.095
Node 11: stage1=0.263, stage2=0.360, overall=0.095
Node 12: stage1=0.263, stage2=0.360, overall=0.095
Node 13: stage1=0.263, stage2=0.360, overall=0.095
Node 14: stage1=0.263, stage2=0.360, overall=0.095
Node 15: stage1=0.263, stage2=0.360, overall=0.095
Node 16: stage1=0.263, stage2=0.220, overall=0.058
Node 17: stage1=0.263, stage2=0.360, overall=0.095
Node 18: stage1=0.263, stage2=0.360, overall=0.095
Node 19: stage1=0.263, stage2=0.360, overall=0.095

=== PARALLEL EXECUTION TIME (realistic for distributed system) ===
  COMMUNICATION (max across nodes):
    - Full model transfer: 0.000s (0.0%)
  COMPUTATION (max across nodes):
    - Distance computation: 0.171s (3.5%)
    - Loss computation: 4.685s (96.3%)
    - Aggregation: 0.009s (0.2%)
  TOTALS:
    - Total computation: 4.866s (100.0%)
    - Total communication: 0.000s (0.0%)
    - Total parallel time: 4.866s

=== PER-NODE AVERAGE TIME ===
  - Distance computation: 0.168s
  - Loss computation: 3.824s
  - Aggregation: 0.005s
  - Model transfer: 0.000s
  - Total per node: 3.996s

=== TOTAL COMPUTATIONAL WORK (sum across all nodes) ===
  - Total distance computation: 3.361s
  - Total loss computation: 76.471s
  - Total aggregation: 0.094s
  - Total model transfer: 0.000s
  - Grand total: 79.927s
  - Mean Stage 1 acceptance rate: 0.263
  - Mean Stage 2 acceptance rate: 0.370
  - Overall acceptance rate: 0.097

UBAR Algorithm Properties:
  - Model dimension: 6,603,710
  - Rho parameter: 0.30000000000000004
  - Two-stage approach: Distance filtering + loss evaluation
  - Stage 1 selects: 30% of neighbors
  - Stage 2 uses: Training sample loss comparison
  - Theoretical complexity: O(deg(i)×d + deg(i)×inference)
  - Approach: UBAR paper implementation
