Device: cuda
Seed: 987654321
Loading 36 LEAF FEMNIST train files...
LEAF FEMNIST train: 3597 users, 734463 samples
Loading 36 LEAF FEMNIST test files...
LEAF FEMNIST test: 3597 users, 83388 samples
Found 3597 train users, 3597 test users, 3597 common users
User sample counts range: 525 (max) to 17 (min)
Distributed ALL 3597 users across 20 clients
Users per client: 179 (with 17 clients getting +1 user)
Train partition sizes: [36360, 37070, 35957, 38262, 36024, 37732, 36921, 38328, 36867, 37683, 36507, 36915, 36007, 37001, 35681, 35453, 36585, 36801, 35964, 36345]
Test partition sizes: [4128, 4203, 4081, 4333, 4091, 4287, 4193, 4349, 4191, 4277, 4143, 4193, 4093, 4197, 4052, 4029, 4153, 4183, 4084, 4128]
  Client 0: 36360 train samples, 62 unique classes
  Client 1: 37070 train samples, 62 unique classes
  Client 2: 35957 train samples, 62 unique classes
  Client 3: 38262 train samples, 62 unique classes
  Client 4: 36024 train samples, 62 unique classes
  Client 5: 37732 train samples, 62 unique classes
  Client 6: 36921 train samples, 62 unique classes
  Client 7: 38328 train samples, 62 unique classes
  Client 8: 36867 train samples, 62 unique classes
  Client 9: 37683 train samples, 62 unique classes
  Client 10: 36507 train samples, 62 unique classes
  Client 11: 36915 train samples, 62 unique classes
  Client 12: 36007 train samples, 62 unique classes
  Client 13: 37001 train samples, 62 unique classes
  Client 14: 35681 train samples, 62 unique classes
  Client 15: 35453 train samples, 62 unique classes
  Client 16: 36585 train samples, 62 unique classes
  Client 17: 36801 train samples, 62 unique classes
  Client 18: 35964 train samples, 62 unique classes
  Client 19: 36345 train samples, 62 unique classes
Will sample 10000 samples per client per epoch
Graph: ring, nodes: 20, edges: 20
Degree statistics: avg=2.00, min=2, max=2
Attack: Compromised 12/20 nodes: [1, 2, 3, 5, 8, 11, 12, 13, 14, 15, 17, 18]
Attack type: directed_deviation, lambda: 1.0
Model variant: baseline
Model parameters: 6,603,710
Initial test acc across nodes: mean=0.0168 ± 0.0139
Round 001: test acc mean=0.0144 ± 0.0134 | min=0.0034 max=0.0504
         : test loss mean=86844.9808 ± 125999.9766
         : individual accs = ['0.003391', '0.017606', '0.043127', '0.006924', '0.008800', '0.004432', '0.013356', '0.009198', '0.004772', '0.017769', '0.050447', '0.003816', '0.008551', '0.028830', '0.033317', '0.008439', '0.006983', '0.007172', '0.006611', '0.004603']
         : correct/total = [(14, 4128), (74, 4203), (176, 4081), (30, 4333), (36, 4091), (19, 4287), (56, 4193), (40, 4349), (20, 4191), (76, 4277), (209, 4143), (16, 4193), (35, 4093), (121, 4197), (135, 4052), (34, 4029), (29, 4153), (30, 4183), (27, 4084), (19, 4128)]
         : compromised: 0.0145, honest: 0.0143
Round 002: test acc mean=0.0484 ± 0.0055 | min=0.0367 max=0.0549
         : test loss mean=nan ± nan
         : individual accs = ['0.045785', '0.048775', '0.053418', '0.048465', '0.051088', '0.045953', '0.050799', '0.045068', '0.049630', '0.036708', '0.039585', '0.036728', '0.054239', '0.049083', '0.051826', '0.054852', '0.054418', '0.053311', '0.054358', '0.044331']
         : correct/total = [(189, 4128), (205, 4203), (218, 4081), (210, 4333), (209, 4091), (197, 4287), (213, 4193), (196, 4349), (208, 4191), (157, 4277), (164, 4143), (154, 4193), (222, 4093), (206, 4197), (210, 4052), (221, 4029), (226, 4153), (223, 4183), (222, 4084), (183, 4128)]
         : compromised: 0.0501, honest: 0.0460
Round 003: test acc mean=0.0496 ± 0.0053 | min=0.0367 max=0.0583
         : test loss mean=nan ± nan
         : individual accs = ['0.048934', '0.050202', '0.053418', '0.048465', '0.051088', '0.045253', '0.050799', '0.045068', '0.049630', '0.036708', '0.039585', '0.053899', '0.054239', '0.049083', '0.051826', '0.056590', '0.058271', '0.050920', '0.054358', '0.043847']
         : correct/total = [(202, 4128), (211, 4203), (218, 4081), (210, 4333), (209, 4091), (194, 4287), (213, 4193), (196, 4349), (208, 4191), (157, 4277), (164, 4143), (226, 4193), (222, 4093), (206, 4197), (210, 4052), (228, 4029), (242, 4153), (213, 4183), (222, 4084), (181, 4128)]
         : compromised: 0.0515, honest: 0.0468
Round 004: test acc mean=0.0432 ± 0.0122 | min=0.0156 max=0.0544
         : test loss mean=nan ± nan
         : individual accs = ['0.048934', '0.050202', '0.053418', '0.036464', '0.043266', '0.045253', '0.050799', '0.045068', '0.049630', '0.047697', '0.047309', '0.045314', '0.054239', '0.049083', '0.051826', '0.015637', '0.015651', '0.016734', '0.054358', '0.043847']
         : correct/total = [(202, 4128), (211, 4203), (218, 4081), (158, 4333), (177, 4091), (194, 4287), (213, 4193), (196, 4349), (208, 4191), (204, 4277), (196, 4143), (190, 4193), (222, 4093), (206, 4197), (210, 4052), (63, 4029), (65, 4153), (70, 4183), (222, 4084), (181, 4128)]
         : compromised: 0.0435, honest: 0.0428
Round 005: test acc mean=0.0471 ± 0.0057 | min=0.0365 max=0.0544
         : test loss mean=nan ± nan
         : individual accs = ['0.048934', '0.050202', '0.053418', '0.036464', '0.043266', '0.045253', '0.050799', '0.045068', '0.049630', '0.036708', '0.039585', '0.036728', '0.054239', '0.049083', '0.051826', '0.051378', '0.049362', '0.051159', '0.054358', '0.043847']
         : correct/total = [(202, 4128), (211, 4203), (218, 4081), (158, 4333), (177, 4091), (194, 4287), (213, 4193), (196, 4349), (208, 4191), (157, 4277), (164, 4143), (154, 4193), (222, 4093), (206, 4197), (210, 4052), (207, 4029), (205, 4153), (214, 4183), (222, 4084), (181, 4128)]
         : compromised: 0.0486, honest: 0.0447
Round 006: test acc mean=0.0486 ± 0.0060 | min=0.0367 max=0.0583
         : test loss mean=nan ± nan
         : individual accs = ['0.048934', '0.050202', '0.053418', '0.043388', '0.052554', '0.045253', '0.050799', '0.045068', '0.049630', '0.036708', '0.039585', '0.036728', '0.054239', '0.049083', '0.051826', '0.056590', '0.058271', '0.050920', '0.054358', '0.043847']
         : correct/total = [(202, 4128), (211, 4203), (218, 4081), (188, 4333), (215, 4091), (194, 4287), (213, 4193), (196, 4349), (208, 4191), (157, 4277), (164, 4143), (154, 4193), (222, 4093), (206, 4197), (210, 4052), (228, 4029), (242, 4153), (213, 4183), (222, 4084), (181, 4128)]
         : compromised: 0.0496, honest: 0.0470
Round 007: test acc mean=0.0484 ± 0.0059 | min=0.0367 max=0.0583
         : test loss mean=nan ± nan
         : individual accs = ['0.048934', '0.050202', '0.053418', '0.047773', '0.044977', '0.045253', '0.050799', '0.045068', '0.049630', '0.036708', '0.039585', '0.036728', '0.054239', '0.049083', '0.051826', '0.056590', '0.058271', '0.050920', '0.054358', '0.043847']
         : correct/total = [(202, 4128), (211, 4203), (218, 4081), (207, 4333), (184, 4091), (194, 4287), (213, 4193), (196, 4349), (208, 4191), (157, 4277), (164, 4143), (154, 4193), (222, 4093), (206, 4197), (210, 4052), (228, 4029), (242, 4153), (213, 4183), (222, 4084), (181, 4128)]
         : compromised: 0.0500, honest: 0.0460
Round 008: test acc mean=0.0490 ± 0.0051 | min=0.0367 max=0.0583
         : test loss mean=nan ± nan
         : individual accs = ['0.048934', '0.050202', '0.053418', '0.043157', '0.043021', '0.045253', '0.050799', '0.045068', '0.049630', '0.047697', '0.047309', '0.036728', '0.054239', '0.049083', '0.051826', '0.056590', '0.058271', '0.050920', '0.054358', '0.043847']
         : correct/total = [(202, 4128), (211, 4203), (218, 4081), (187, 4333), (176, 4091), (194, 4287), (213, 4193), (196, 4349), (208, 4191), (204, 4277), (196, 4143), (154, 4193), (222, 4093), (206, 4197), (210, 4052), (228, 4029), (242, 4153), (213, 4183), (222, 4084), (181, 4128)]
         : compromised: 0.0496, honest: 0.0481
Round 009: test acc mean=0.0471 ± 0.0057 | min=0.0365 max=0.0544
         : test loss mean=nan ± nan
         : individual accs = ['0.048934', '0.050202', '0.053418', '0.036464', '0.043266', '0.045253', '0.050799', '0.045068', '0.049630', '0.036708', '0.039585', '0.036728', '0.054239', '0.049083', '0.051826', '0.051378', '0.049362', '0.051159', '0.054358', '0.043847']
         : correct/total = [(202, 4128), (211, 4203), (218, 4081), (158, 4333), (177, 4091), (194, 4287), (213, 4193), (196, 4349), (208, 4191), (157, 4277), (164, 4143), (154, 4193), (222, 4093), (206, 4197), (210, 4052), (207, 4029), (205, 4153), (214, 4183), (222, 4084), (181, 4128)]
         : compromised: 0.0486, honest: 0.0447
Round 010: test acc mean=0.0477 ± 0.0051 | min=0.0367 max=0.0544
         : test loss mean=nan ± nan
         : individual accs = ['0.048934', '0.050202', '0.053418', '0.047773', '0.044977', '0.045253', '0.050799', '0.045068', '0.049630', '0.036708', '0.039585', '0.036728', '0.054239', '0.049083', '0.051826', '0.051378', '0.049362', '0.051159', '0.054358', '0.043847']
         : correct/total = [(202, 4128), (211, 4203), (218, 4081), (207, 4333), (184, 4091), (194, 4287), (213, 4193), (196, 4349), (208, 4191), (157, 4277), (164, 4143), (154, 4193), (222, 4093), (206, 4197), (210, 4052), (207, 4029), (205, 4153), (214, 4183), (222, 4084), (181, 4128)]
         : compromised: 0.0496, honest: 0.0449

=== FINAL RESULTS ===
Dataset: femnist, Nodes: 20, Graph: ring, Aggregation: krum
Attack: directed_deviation, 60.0% compromised
Final accuracy - Compromised: 0.0496, Honest: 0.0449
Overall test accuracy: mean=0.0477 ± 0.0051
