Device: cuda
Seed: 987654321
Loading 36 LEAF FEMNIST train files...
LEAF FEMNIST train: 3597 users, 734463 samples
Loading 36 LEAF FEMNIST test files...
LEAF FEMNIST test: 3597 users, 83388 samples
Found 3597 train users, 3597 test users, 3597 common users
User sample counts range: 525 (max) to 17 (min)
Distributed ALL 3597 users across 20 clients
Users per client: 179 (with 17 clients getting +1 user)
Train partition sizes: [36360, 37070, 35957, 38262, 36024, 37732, 36921, 38328, 36867, 37683, 36507, 36915, 36007, 37001, 35681, 35453, 36585, 36801, 35964, 36345]
Test partition sizes: [4128, 4203, 4081, 4333, 4091, 4287, 4193, 4349, 4191, 4277, 4143, 4193, 4093, 4197, 4052, 4029, 4153, 4183, 4084, 4128]
  Client 0: 36360 train samples, 62 unique classes
  Client 1: 37070 train samples, 62 unique classes
  Client 2: 35957 train samples, 62 unique classes
  Client 3: 38262 train samples, 62 unique classes
  Client 4: 36024 train samples, 62 unique classes
  Client 5: 37732 train samples, 62 unique classes
  Client 6: 36921 train samples, 62 unique classes
  Client 7: 38328 train samples, 62 unique classes
  Client 8: 36867 train samples, 62 unique classes
  Client 9: 37683 train samples, 62 unique classes
  Client 10: 36507 train samples, 62 unique classes
  Client 11: 36915 train samples, 62 unique classes
  Client 12: 36007 train samples, 62 unique classes
  Client 13: 37001 train samples, 62 unique classes
  Client 14: 35681 train samples, 62 unique classes
  Client 15: 35453 train samples, 62 unique classes
  Client 16: 36585 train samples, 62 unique classes
  Client 17: 36801 train samples, 62 unique classes
  Client 18: 35964 train samples, 62 unique classes
  Client 19: 36345 train samples, 62 unique classes
Will sample 10000 samples per client per epoch
Graph: erdos, nodes: 20, edges: 99
Degree statistics: avg=9.90, min=7, max=14
Attack: Compromised 14/20 nodes: [1, 2, 3, 5, 6, 8, 11, 12, 13, 14, 15, 17, 18, 19]
Attack type: directed_deviation, lambda: 1.0
Model variant: baseline
Model parameters: 6,603,710
Initial test acc across nodes: mean=0.0162 ± 0.0138
Round 001: test acc mean=0.0143 ± 0.0161 | min=0.0029 max=0.0528
         : test loss mean=91631.9141 ± 62472.6810
         : individual accs = ['0.005329', '0.052819', '0.026954', '0.005308', '0.002933', '0.003032', '0.003577', '0.005289', '0.017418', '0.049334', '0.006276', '0.008347', '0.008063', '0.047891', '0.015795', '0.003475', '0.006983', '0.004303', '0.003428', '0.009448']
         : correct/total = [(22, 4128), (222, 4203), (110, 4081), (23, 4333), (12, 4091), (13, 4287), (15, 4193), (23, 4349), (73, 4191), (211, 4277), (26, 4143), (35, 4193), (33, 4093), (201, 4197), (64, 4052), (14, 4029), (29, 4153), (18, 4183), (14, 4084), (39, 4128)]
         : compromised: 0.0150, honest: 0.0127
Round 002: test acc mean=0.0478 ± 0.0074 | min=0.0296 max=0.0615
         : test loss mean=nan ± nan
         : individual accs = ['0.049419', '0.048775', '0.061505', '0.044773', '0.029577', '0.052018', '0.038874', '0.045758', '0.051062', '0.050736', '0.051895', '0.051037', '0.047398', '0.049083', '0.054788', '0.054604', '0.047436', '0.049247', '0.029873', '0.047965']
         : correct/total = [(204, 4128), (205, 4203), (251, 4081), (194, 4333), (121, 4091), (223, 4287), (163, 4193), (199, 4349), (214, 4191), (217, 4277), (215, 4143), (214, 4193), (194, 4093), (206, 4197), (222, 4052), (220, 4029), (197, 4153), (206, 4183), (122, 4084), (198, 4128)]
         : compromised: 0.0486, honest: 0.0458
Round 003: test acc mean=0.0497 ± 0.0033 | min=0.0415 max=0.0550
         : test loss mean=nan ± nan
         : individual accs = ['0.049419', '0.048775', '0.049743', '0.046619', '0.045710', '0.052484', '0.041498', '0.049897', '0.051062', '0.050736', '0.048033', '0.048891', '0.047398', '0.047653', '0.054788', '0.054604', '0.047436', '0.049247', '0.054358', '0.054990']
         : correct/total = [(204, 4128), (205, 4203), (203, 4081), (202, 4333), (187, 4091), (225, 4287), (174, 4193), (217, 4349), (214, 4191), (217, 4277), (199, 4143), (205, 4193), (194, 4093), (200, 4197), (222, 4052), (220, 4029), (197, 4153), (206, 4183), (222, 4084), (227, 4128)]
         : compromised: 0.0502, honest: 0.0485
Round 004: test acc mean=0.0497 ± 0.0033 | min=0.0415 max=0.0550
         : test loss mean=nan ± nan
         : individual accs = ['0.049419', '0.048775', '0.049743', '0.046619', '0.045710', '0.052484', '0.041498', '0.049897', '0.051062', '0.050736', '0.048033', '0.048891', '0.047398', '0.047653', '0.054788', '0.054604', '0.047436', '0.049247', '0.054358', '0.054990']
         : correct/total = [(204, 4128), (205, 4203), (203, 4081), (202, 4333), (187, 4091), (225, 4287), (174, 4193), (217, 4349), (214, 4191), (217, 4277), (199, 4143), (205, 4193), (194, 4093), (200, 4197), (222, 4052), (220, 4029), (197, 4153), (206, 4183), (222, 4084), (227, 4128)]
         : compromised: 0.0502, honest: 0.0485
Round 005: test acc mean=0.0497 ± 0.0033 | min=0.0415 max=0.0550
         : test loss mean=nan ± nan
         : individual accs = ['0.049419', '0.048775', '0.049743', '0.046619', '0.045710', '0.052484', '0.041498', '0.049897', '0.051062', '0.050736', '0.048033', '0.048891', '0.047398', '0.047653', '0.054788', '0.054604', '0.047436', '0.049247', '0.054358', '0.054990']
         : correct/total = [(204, 4128), (205, 4203), (203, 4081), (202, 4333), (187, 4091), (225, 4287), (174, 4193), (217, 4349), (214, 4191), (217, 4277), (199, 4143), (205, 4193), (194, 4093), (200, 4197), (222, 4052), (220, 4029), (197, 4153), (206, 4183), (222, 4084), (227, 4128)]
         : compromised: 0.0502, honest: 0.0485
Round 006: test acc mean=0.0497 ± 0.0033 | min=0.0415 max=0.0550
         : test loss mean=nan ± nan
         : individual accs = ['0.049419', '0.048775', '0.049743', '0.046619', '0.045710', '0.052484', '0.041498', '0.049897', '0.051062', '0.050736', '0.048033', '0.048891', '0.047398', '0.047653', '0.054788', '0.054604', '0.047436', '0.049247', '0.054358', '0.054990']
         : correct/total = [(204, 4128), (205, 4203), (203, 4081), (202, 4333), (187, 4091), (225, 4287), (174, 4193), (217, 4349), (214, 4191), (217, 4277), (199, 4143), (205, 4193), (194, 4093), (200, 4197), (222, 4052), (220, 4029), (197, 4153), (206, 4183), (222, 4084), (227, 4128)]
         : compromised: 0.0502, honest: 0.0485
Round 007: test acc mean=0.0497 ± 0.0033 | min=0.0415 max=0.0550
         : test loss mean=nan ± nan
         : individual accs = ['0.049419', '0.048775', '0.049743', '0.046619', '0.045710', '0.052484', '0.041498', '0.049897', '0.051062', '0.050736', '0.048033', '0.048891', '0.047398', '0.047653', '0.054788', '0.054604', '0.047436', '0.049247', '0.054358', '0.054990']
         : correct/total = [(204, 4128), (205, 4203), (203, 4081), (202, 4333), (187, 4091), (225, 4287), (174, 4193), (217, 4349), (214, 4191), (217, 4277), (199, 4143), (205, 4193), (194, 4093), (200, 4197), (222, 4052), (220, 4029), (197, 4153), (206, 4183), (222, 4084), (227, 4128)]
         : compromised: 0.0502, honest: 0.0485
Round 008: test acc mean=0.0497 ± 0.0033 | min=0.0415 max=0.0550
         : test loss mean=nan ± nan
         : individual accs = ['0.049419', '0.048775', '0.049743', '0.046619', '0.045710', '0.052484', '0.041498', '0.049897', '0.051062', '0.050736', '0.048033', '0.048891', '0.047398', '0.047653', '0.054788', '0.054604', '0.047436', '0.049247', '0.054358', '0.054990']
         : correct/total = [(204, 4128), (205, 4203), (203, 4081), (202, 4333), (187, 4091), (225, 4287), (174, 4193), (217, 4349), (214, 4191), (217, 4277), (199, 4143), (205, 4193), (194, 4093), (200, 4197), (222, 4052), (220, 4029), (197, 4153), (206, 4183), (222, 4084), (227, 4128)]
         : compromised: 0.0502, honest: 0.0485
Round 009: test acc mean=0.0497 ± 0.0033 | min=0.0415 max=0.0550
         : test loss mean=nan ± nan
         : individual accs = ['0.049419', '0.048775', '0.049743', '0.046619', '0.045710', '0.052484', '0.041498', '0.049897', '0.051062', '0.050736', '0.048033', '0.048891', '0.047398', '0.047653', '0.054788', '0.054604', '0.047436', '0.049247', '0.054358', '0.054990']
         : correct/total = [(204, 4128), (205, 4203), (203, 4081), (202, 4333), (187, 4091), (225, 4287), (174, 4193), (217, 4349), (214, 4191), (217, 4277), (199, 4143), (205, 4193), (194, 4093), (200, 4197), (222, 4052), (220, 4029), (197, 4153), (206, 4183), (222, 4084), (227, 4128)]
         : compromised: 0.0502, honest: 0.0485
Round 010: test acc mean=0.0497 ± 0.0033 | min=0.0415 max=0.0550
         : test loss mean=nan ± nan
         : individual accs = ['0.049419', '0.048775', '0.049743', '0.046619', '0.045710', '0.052484', '0.041498', '0.049897', '0.051062', '0.050736', '0.048033', '0.048891', '0.047398', '0.047653', '0.054788', '0.054604', '0.047436', '0.049247', '0.054358', '0.054990']
         : correct/total = [(204, 4128), (205, 4203), (203, 4081), (202, 4333), (187, 4091), (225, 4287), (174, 4193), (217, 4349), (214, 4191), (217, 4277), (199, 4143), (205, 4193), (194, 4093), (200, 4197), (222, 4052), (220, 4029), (197, 4153), (206, 4183), (222, 4084), (227, 4128)]
         : compromised: 0.0502, honest: 0.0485

=== FINAL RESULTS ===
Dataset: femnist, Nodes: 20, Graph: erdos, Aggregation: krum
Attack: directed_deviation, 70.0% compromised
Final accuracy - Compromised: 0.0502, Honest: 0.0485
Overall test accuracy: mean=0.0497 ± 0.0033
