Device: cuda
Seed: 987654321
Loading 36 LEAF FEMNIST train files...
LEAF FEMNIST train: 3597 users, 734463 samples
Loading 36 LEAF FEMNIST test files...
LEAF FEMNIST test: 3597 users, 83388 samples
Found 3597 train users, 3597 test users, 3597 common users
User sample counts range: 525 (max) to 17 (min)
Distributed ALL 3597 users across 20 clients
Users per client: 179 (with 17 clients getting +1 user)
Train partition sizes: [36360, 37070, 35957, 38262, 36024, 37732, 36921, 38328, 36867, 37683, 36507, 36915, 36007, 37001, 35681, 35453, 36585, 36801, 35964, 36345]
Test partition sizes: [4128, 4203, 4081, 4333, 4091, 4287, 4193, 4349, 4191, 4277, 4143, 4193, 4093, 4197, 4052, 4029, 4153, 4183, 4084, 4128]
  Client 0: 36360 train samples, 62 unique classes
  Client 1: 37070 train samples, 62 unique classes
  Client 2: 35957 train samples, 62 unique classes
  Client 3: 38262 train samples, 62 unique classes
  Client 4: 36024 train samples, 62 unique classes
  Client 5: 37732 train samples, 62 unique classes
  Client 6: 36921 train samples, 62 unique classes
  Client 7: 38328 train samples, 62 unique classes
  Client 8: 36867 train samples, 62 unique classes
  Client 9: 37683 train samples, 62 unique classes
  Client 10: 36507 train samples, 62 unique classes
  Client 11: 36915 train samples, 62 unique classes
  Client 12: 36007 train samples, 62 unique classes
  Client 13: 37001 train samples, 62 unique classes
  Client 14: 35681 train samples, 62 unique classes
  Client 15: 35453 train samples, 62 unique classes
  Client 16: 36585 train samples, 62 unique classes
  Client 17: 36801 train samples, 62 unique classes
  Client 18: 35964 train samples, 62 unique classes
  Client 19: 36345 train samples, 62 unique classes
Will sample 10000 samples per client per epoch
Graph: erdos, nodes: 20, edges: 48
Degree statistics: avg=4.80, min=2, max=7
Attack: Compromised 10/20 nodes: [1, 2, 5, 11, 12, 13, 14, 15, 17, 18]
Attack type: backdoor, lambda: 1.0
Backdoor target label: 0, trigger size: 4
Model variant: baseline
Model parameters: 6,603,710
UBAR ALGORITHM (Two-Stage Byzantine-resilient)
  - Model dimension: 6,603,710 parameters
  - Rho parameter: 0.5
  - Stage 1: Distance-based filtering (select 50% closest neighbors)
  - Stage 2: Performance-based selection (loss comparison)
  - Complexity: O(deg(i)×d + deg(i)×inference)
Initial test acc across nodes: mean=0.0162 ± 0.0138
Backdoor attack: Created poisoned datasets for 10 compromised nodes
Round 001: test acc mean=0.2456 ± 0.1569 | min=0.0474 max=0.4940
         : test loss mean=9234.2293 ± 9920.6404
         : individual accs = ['0.408430', '0.048775', '0.197011', '0.417955', '0.494011', '0.169582', '0.410923', '0.163946', '0.413982', '0.420856', '0.150857', '0.144288', '0.047398', '0.047653', '0.168065', '0.054604', '0.442572', '0.177863', '0.108472', '0.424176']
         : correct/total = [(1686, 4128), (205, 4203), (804, 4081), (1811, 4333), (2021, 4091), (727, 4287), (1723, 4193), (713, 4349), (1735, 4191), (1800, 4277), (625, 4143), (605, 4193), (194, 4093), (200, 4197), (681, 4052), (220, 4029), (1838, 4153), (744, 4183), (443, 4084), (1751, 4128)]
         : compromised: 0.1164, honest: 0.3748
         : ubar stats = ['Node 0: s1=0.500, s2=0.333', 'Node 1: s1=0.500, s2=1.000', 'Node 2: s1=0.400, s2=1.000']...
Round 002: test acc mean=0.3711 ± 0.3223 | min=0.0425 max=0.7433
         : test loss mean=122.4126 ± 252.3372
         : individual accs = ['0.686289', '0.045206', '0.049988', '0.743134', '0.661208', '0.042454', '0.615550', '0.676017', '0.743259', '0.732757', '0.695873', '0.051514', '0.052284', '0.048130', '0.050592', '0.048151', '0.663376', '0.051159', '0.059745', '0.704700']
         : correct/total = [(2833, 4128), (190, 4203), (204, 4081), (3220, 4333), (2705, 4091), (182, 4287), (2581, 4193), (2940, 4349), (3115, 4191), (3134, 4277), (2883, 4143), (216, 4193), (214, 4093), (202, 4197), (205, 4052), (194, 4029), (2755, 4153), (214, 4183), (244, 4084), (2909, 4128)]
         : compromised: 0.0499, honest: 0.6922
         : ubar stats = ['Node 0: s1=0.500, s2=0.333', 'Node 1: s1=0.500, s2=1.000', 'Node 2: s1=0.400, s2=1.000']...
Round 003: test acc mean=0.4173 ± 0.3660 | min=0.0474 max=0.7985
         : test loss mean=nan ± nan
         : individual accs = ['0.783430', '0.048775', '0.049743', '0.793446', '0.780983', '0.058782', '0.772001', '0.795125', '0.787879', '0.798457', '0.754526', '0.048891', '0.047398', '0.047653', '0.054788', '0.054604', '0.777269', '0.049247', '0.054358', '0.788760']
         : correct/total = [(3234, 4128), (205, 4203), (203, 4081), (3438, 4333), (3195, 4091), (252, 4287), (3237, 4193), (3458, 4349), (3302, 4191), (3415, 4277), (3126, 4143), (205, 4193), (194, 4093), (200, 4197), (222, 4052), (220, 4029), (3228, 4153), (206, 4183), (222, 4084), (3256, 4128)]
         : compromised: 0.0514, honest: 0.7832
         : ubar stats = ['Node 0: s1=0.500, s2=0.444', 'Node 1: s1=0.500, s2=0.778', 'Node 2: s1=0.400, s2=0.833']...
Round 004: test acc mean=0.4287 ± 0.3780 | min=0.0474 max=0.8218
         : test loss mean=nan ± nan
         : individual accs = ['0.801841', '0.048775', '0.049743', '0.821832', '0.807138', '0.052484', '0.783449', '0.816739', '0.814603', '0.819500', '0.798697', '0.048891', '0.047398', '0.047653', '0.054788', '0.054604', '0.799904', '0.049247', '0.054358', '0.802083']
         : correct/total = [(3310, 4128), (205, 4203), (203, 4081), (3561, 4333), (3302, 4091), (225, 4287), (3285, 4193), (3552, 4349), (3414, 4191), (3505, 4277), (3309, 4143), (205, 4193), (194, 4093), (200, 4197), (222, 4052), (220, 4029), (3322, 4153), (206, 4183), (222, 4084), (3311, 4128)]
         : compromised: 0.0508, honest: 0.8066
         : ubar stats = ['Node 0: s1=0.500, s2=0.500', 'Node 1: s1=0.500, s2=0.667', 'Node 2: s1=0.400, s2=0.750']...
Round 005: test acc mean=0.4347 ± 0.3840 | min=0.0474 max=0.8308
         : test loss mean=nan ± nan
         : individual accs = ['0.814438', '0.048775', '0.049743', '0.828525', '0.820826', '0.052484', '0.794419', '0.830766', '0.829874', '0.827683', '0.808834', '0.048891', '0.047398', '0.047653', '0.054788', '0.054604', '0.818685', '0.049247', '0.054358', '0.812984']
         : correct/total = [(3362, 4128), (205, 4203), (203, 4081), (3590, 4333), (3358, 4091), (225, 4287), (3331, 4193), (3613, 4349), (3478, 4191), (3540, 4277), (3351, 4143), (205, 4193), (194, 4093), (200, 4197), (222, 4052), (220, 4029), (3400, 4153), (206, 4183), (222, 4084), (3356, 4128)]
         : compromised: 0.0508, honest: 0.8187
         : ubar stats = ['Node 0: s1=0.500, s2=0.467', 'Node 1: s1=0.500, s2=0.600', 'Node 2: s1=0.400, s2=0.700']...
Round 006: test acc mean=0.4393 ± 0.3885 | min=0.0474 max=0.8381
         : test loss mean=nan ± nan
         : individual accs = ['0.821221', '0.048775', '0.049743', '0.834526', '0.823026', '0.052484', '0.814214', '0.838124', '0.834884', '0.834463', '0.817524', '0.048891', '0.047398', '0.047653', '0.054788', '0.054604', '0.832892', '0.049247', '0.054358', '0.826793']
         : correct/total = [(3390, 4128), (205, 4203), (203, 4081), (3616, 4333), (3367, 4091), (225, 4287), (3414, 4193), (3645, 4349), (3499, 4191), (3569, 4277), (3387, 4143), (205, 4193), (194, 4093), (200, 4197), (222, 4052), (220, 4029), (3459, 4153), (206, 4183), (222, 4084), (3413, 4128)]
         : compromised: 0.0508, honest: 0.8278
         : ubar stats = ['Node 0: s1=0.500, s2=0.444', 'Node 1: s1=0.500, s2=0.556', 'Node 2: s1=0.400, s2=0.667']...
Round 007: test acc mean=0.4431 ± 0.3924 | min=0.0474 max=0.8492
         : test loss mean=nan ± nan
         : individual accs = ['0.834302', '0.048775', '0.049743', '0.847911', '0.833781', '0.052484', '0.813737', '0.849161', '0.840849', '0.841244', '0.823316', '0.048891', '0.047398', '0.047653', '0.054788', '0.054604', '0.842523', '0.049247', '0.054358', '0.828004']
         : correct/total = [(3444, 4128), (205, 4203), (203, 4081), (3674, 4333), (3411, 4091), (225, 4287), (3412, 4193), (3693, 4349), (3524, 4191), (3598, 4277), (3411, 4143), (205, 4193), (194, 4093), (200, 4197), (222, 4052), (220, 4029), (3499, 4153), (206, 4183), (222, 4084), (3418, 4128)]
         : compromised: 0.0508, honest: 0.8355
         : ubar stats = ['Node 0: s1=0.500, s2=0.429', 'Node 1: s1=0.500, s2=0.524', 'Node 2: s1=0.400, s2=0.643']...
Round 008: test acc mean=0.4438 ± 0.3931 | min=0.0474 max=0.8489
         : test loss mean=nan ± nan
         : individual accs = ['0.828004', '0.048775', '0.049743', '0.847681', '0.840381', '0.052484', '0.822323', '0.848931', '0.842281', '0.848258', '0.826213', '0.048891', '0.047398', '0.047653', '0.054788', '0.054604', '0.837708', '0.049247', '0.054358', '0.826550']
         : correct/total = [(3418, 4128), (205, 4203), (203, 4081), (3673, 4333), (3438, 4091), (225, 4287), (3448, 4193), (3692, 4349), (3530, 4191), (3628, 4277), (3423, 4143), (205, 4193), (194, 4093), (200, 4197), (222, 4052), (220, 4029), (3479, 4153), (206, 4183), (222, 4084), (3412, 4128)]
         : compromised: 0.0508, honest: 0.8368
         : ubar stats = ['Node 0: s1=0.500, s2=0.417', 'Node 1: s1=0.500, s2=0.500', 'Node 2: s1=0.400, s2=0.625']...
Round 009: test acc mean=0.4481 ± 0.3974 | min=0.0474 max=0.8556
         : test loss mean=nan ± nan
         : individual accs = ['0.837452', '0.048775', '0.049743', '0.853681', '0.839648', '0.052484', '0.843549', '0.854219', '0.855643', '0.848726', '0.835385', '0.048891', '0.047398', '0.047653', '0.054788', '0.054604', '0.843968', '0.049247', '0.054358', '0.842539']
         : correct/total = [(3457, 4128), (205, 4203), (203, 4081), (3699, 4333), (3435, 4091), (225, 4287), (3537, 4193), (3715, 4349), (3586, 4191), (3630, 4277), (3461, 4143), (205, 4193), (194, 4093), (200, 4197), (222, 4052), (220, 4029), (3505, 4153), (206, 4183), (222, 4084), (3478, 4128)]
         : compromised: 0.0508, honest: 0.8455
         : ubar stats = ['Node 0: s1=0.500, s2=0.407', 'Node 1: s1=0.500, s2=0.481', 'Node 2: s1=0.400, s2=0.611']...
Round 010: test acc mean=0.4496 ± 0.3988 | min=0.0474 max=0.8588
         : test loss mean=nan ± nan
         : individual accs = ['0.839147', '0.048775', '0.049743', '0.858758', '0.841604', '0.052484', '0.851419', '0.856519', '0.855882', '0.855506', '0.841178', '0.048891', '0.047398', '0.047653', '0.054788', '0.054604', '0.843487', '0.049247', '0.054358', '0.840601']
         : correct/total = [(3464, 4128), (205, 4203), (203, 4081), (3721, 4333), (3443, 4091), (225, 4287), (3570, 4193), (3725, 4349), (3587, 4191), (3659, 4277), (3485, 4143), (205, 4193), (194, 4093), (200, 4197), (222, 4052), (220, 4029), (3503, 4153), (206, 4183), (222, 4084), (3470, 4128)]
         : compromised: 0.0508, honest: 0.8484
         : ubar stats = ['Node 0: s1=0.500, s2=0.400', 'Node 1: s1=0.500, s2=0.467', 'Node 2: s1=0.400, s2=0.600']...

=== FINAL RESULTS ===
Dataset: femnist, Nodes: 20, Graph: erdos, Aggregation: ubar
Attack: backdoor, 50.0% compromised
Final accuracy - Compromised: 0.0508, Honest: 0.8484
Overall test accuracy: mean=0.4496 ± 0.3988

=== BACKDOOR ATTACK SUCCESS RATE (ASR) ===
Target label: 0
Trigger size: 4x4
Overall ASR: 0.5258 ± 0.4742
Honest nodes ASR: 0.0515 ± 0.0039
Compromised nodes ASR: 1.0000 ± 0.0000
Note: Higher ASR indicates more successful backdoor attack

=== UBAR SUMMARY ===
Node 0: stage1=0.500, stage2=0.400, overall=0.200
Node 1: stage1=0.500, stage2=0.467, overall=0.233
Node 2: stage1=0.400, stage2=0.600, overall=0.240
Node 3: stage1=0.500, stage2=0.550, overall=0.275
Node 4: stage1=0.500, stage2=0.500, overall=0.250
Node 5: stage1=0.400, stage2=0.550, overall=0.220
Node 6: stage1=0.400, stage2=0.600, overall=0.240
Node 7: stage1=0.400, stage2=0.550, overall=0.220
Node 8: stage1=0.500, stage2=1.000, overall=0.500
Node 9: stage1=0.333, stage2=1.000, overall=0.333
Node 10: stage1=0.500, stage2=0.500, overall=0.250
Node 11: stage1=0.429, stage2=0.467, overall=0.200
Node 12: stage1=0.429, stage2=0.467, overall=0.200
Node 13: stage1=0.500, stage2=0.550, overall=0.275
Node 14: stage1=0.429, stage2=0.333, overall=0.143
Node 15: stage1=0.500, stage2=0.433, overall=0.217
Node 16: stage1=0.400, stage2=0.500, overall=0.200
Node 17: stage1=0.400, stage2=0.600, overall=0.240
Node 18: stage1=0.500, stage2=0.600, overall=0.300
Node 19: stage1=0.500, stage2=1.000, overall=0.500

=== PARALLEL EXECUTION TIME (realistic for distributed system) ===
  COMMUNICATION (max across nodes):
    - Full model transfer: 0.000s (0.0%)
  COMPUTATION (max across nodes):
    - Distance computation: 0.027s (0.6%)
    - Loss computation: 4.206s (99.2%)
    - Aggregation: 0.006s (0.1%)
  TOTALS:
    - Total computation: 4.239s (100.0%)
    - Total communication: 0.000s (0.0%)
    - Total parallel time: 4.239s

=== PER-NODE AVERAGE TIME ===
  - Distance computation: 0.021s
  - Loss computation: 3.958s
  - Aggregation: 0.005s
  - Model transfer: 0.000s
  - Total per node: 3.983s

=== TOTAL COMPUTATIONAL WORK (sum across all nodes) ===
  - Total distance computation: 0.412s
  - Total loss computation: 79.153s
  - Total aggregation: 0.094s
  - Total model transfer: 0.000s
  - Grand total: 79.660s
  - Mean Stage 1 acceptance rate: 0.451
  - Mean Stage 2 acceptance rate: 0.583
  - Overall acceptance rate: 0.263

UBAR Algorithm Properties:
  - Model dimension: 6,603,710
  - Rho parameter: 0.5
  - Two-stage approach: Distance filtering + loss evaluation
  - Stage 1 selects: 50% of neighbors
  - Stage 2 uses: Training sample loss comparison
  - Theoretical complexity: O(deg(i)×d + deg(i)×inference)
  - Approach: UBAR paper implementation
