Device: cuda
Seed: 987654321
Loading 36 LEAF FEMNIST train files...
LEAF FEMNIST train: 3597 users, 734463 samples
Loading 36 LEAF FEMNIST test files...
LEAF FEMNIST test: 3597 users, 83388 samples
Found 3597 train users, 3597 test users, 3597 common users
User sample counts range: 525 (max) to 17 (min)
Distributed ALL 3597 users across 20 clients
Users per client: 179 (with 17 clients getting +1 user)
Train partition sizes: [36360, 37070, 35957, 38262, 36024, 37732, 36921, 38328, 36867, 37683, 36507, 36915, 36007, 37001, 35681, 35453, 36585, 36801, 35964, 36345]
Test partition sizes: [4128, 4203, 4081, 4333, 4091, 4287, 4193, 4349, 4191, 4277, 4143, 4193, 4093, 4197, 4052, 4029, 4153, 4183, 4084, 4128]
  Client 0: 36360 train samples, 62 unique classes
  Client 1: 37070 train samples, 62 unique classes
  Client 2: 35957 train samples, 62 unique classes
  Client 3: 38262 train samples, 62 unique classes
  Client 4: 36024 train samples, 62 unique classes
  Client 5: 37732 train samples, 62 unique classes
  Client 6: 36921 train samples, 62 unique classes
  Client 7: 38328 train samples, 62 unique classes
  Client 8: 36867 train samples, 62 unique classes
  Client 9: 37683 train samples, 62 unique classes
  Client 10: 36507 train samples, 62 unique classes
  Client 11: 36915 train samples, 62 unique classes
  Client 12: 36007 train samples, 62 unique classes
  Client 13: 37001 train samples, 62 unique classes
  Client 14: 35681 train samples, 62 unique classes
  Client 15: 35453 train samples, 62 unique classes
  Client 16: 36585 train samples, 62 unique classes
  Client 17: 36801 train samples, 62 unique classes
  Client 18: 35964 train samples, 62 unique classes
  Client 19: 36345 train samples, 62 unique classes
Will sample 10000 samples per client per epoch
Graph: erdos, nodes: 20, edges: 99
Degree statistics: avg=9.90, min=7, max=14
Attack: Compromised 10/20 nodes: [1, 2, 5, 11, 12, 13, 14, 15, 17, 18]
Attack type: backdoor, lambda: 1.0
Backdoor target label: 0, trigger size: 4
Model variant: baseline
Model parameters: 6,603,710
Sketchguard Node 0:
  Model dim: 6,603,710 → Sketch size: 1000
  Compression ratio: 6603.7x
  Using model parameters for aggregation, sketches for filtering
Sketchguard Node 1:
  Model dim: 6,603,710 → Sketch size: 1000
  Compression ratio: 6603.7x
  Using model parameters for aggregation, sketches for filtering
Sketchguard Node 2:
  Model dim: 6,603,710 → Sketch size: 1000
  Compression ratio: 6603.7x
  Using model parameters for aggregation, sketches for filtering
Sketchguard Node 3:
  Model dim: 6,603,710 → Sketch size: 1000
  Compression ratio: 6603.7x
  Using model parameters for aggregation, sketches for filtering
Sketchguard Node 4:
  Model dim: 6,603,710 → Sketch size: 1000
  Compression ratio: 6603.7x
  Using model parameters for aggregation, sketches for filtering
Sketchguard Node 5:
  Model dim: 6,603,710 → Sketch size: 1000
  Compression ratio: 6603.7x
  Using model parameters for aggregation, sketches for filtering
Sketchguard Node 6:
  Model dim: 6,603,710 → Sketch size: 1000
  Compression ratio: 6603.7x
  Using model parameters for aggregation, sketches for filtering
Sketchguard Node 7:
  Model dim: 6,603,710 → Sketch size: 1000
  Compression ratio: 6603.7x
  Using model parameters for aggregation, sketches for filtering
Sketchguard Node 8:
  Model dim: 6,603,710 → Sketch size: 1000
  Compression ratio: 6603.7x
  Using model parameters for aggregation, sketches for filtering
Sketchguard Node 9:
  Model dim: 6,603,710 → Sketch size: 1000
  Compression ratio: 6603.7x
  Using model parameters for aggregation, sketches for filtering
Sketchguard Node 10:
  Model dim: 6,603,710 → Sketch size: 1000
  Compression ratio: 6603.7x
  Using model parameters for aggregation, sketches for filtering
Sketchguard Node 11:
  Model dim: 6,603,710 → Sketch size: 1000
  Compression ratio: 6603.7x
  Using model parameters for aggregation, sketches for filtering
Sketchguard Node 12:
  Model dim: 6,603,710 → Sketch size: 1000
  Compression ratio: 6603.7x
  Using model parameters for aggregation, sketches for filtering
Sketchguard Node 13:
  Model dim: 6,603,710 → Sketch size: 1000
  Compression ratio: 6603.7x
  Using model parameters for aggregation, sketches for filtering
Sketchguard Node 14:
  Model dim: 6,603,710 → Sketch size: 1000
  Compression ratio: 6603.7x
  Using model parameters for aggregation, sketches for filtering
Sketchguard Node 15:
  Model dim: 6,603,710 → Sketch size: 1000
  Compression ratio: 6603.7x
  Using model parameters for aggregation, sketches for filtering
Sketchguard Node 16:
  Model dim: 6,603,710 → Sketch size: 1000
  Compression ratio: 6603.7x
  Using model parameters for aggregation, sketches for filtering
Sketchguard Node 17:
  Model dim: 6,603,710 → Sketch size: 1000
  Compression ratio: 6603.7x
  Using model parameters for aggregation, sketches for filtering
Sketchguard Node 18:
  Model dim: 6,603,710 → Sketch size: 1000
  Compression ratio: 6603.7x
  Using model parameters for aggregation, sketches for filtering
Sketchguard Node 19:
  Model dim: 6,603,710 → Sketch size: 1000
  Compression ratio: 6603.7x
  Using model parameters for aggregation, sketches for filtering
Sketchguard ALGORITHM (Sketch-based Filtering + State Aggregation)
  - Model dimension: 6,603,710 parameters
  - Config: SketchguardConfig(gamma=2, kappa=1, alpha=0.5, min_neighbors=1, sketch_size=1000, network_seed=987654321, attack_detection_window=5)
  - Sketch size: 1000
  - Compression ratio: 6603.7x
  - Complexity: O(d + N×k) = O(6,603,710 + 20×1000)
  - Theoretical speedup vs BALANCE: 19.9x
Initial test acc across nodes: mean=0.0162 ± 0.0138
Backdoor attack: Created poisoned datasets for 10 compromised nodes
Round 001: test acc mean=0.2830 ± 0.1712 | min=0.0474 max=0.5332
         : test loss mean=8488.1222 ± 8810.2574
         : individual accs = ['0.533188', '0.048775', '0.194315', '0.451881', '0.441701', '0.174714', '0.423325', '0.420556', '0.460988', '0.429273', '0.419261', '0.147150', '0.047398', '0.047653', '0.168312', '0.065277', '0.444739', '0.179058', '0.110431', '0.452519']
         : correct/total = [(2201, 4128), (205, 4203), (793, 4081), (1958, 4333), (1807, 4091), (749, 4287), (1775, 4193), (1829, 4349), (1932, 4191), (1836, 4277), (1737, 4143), (617, 4193), (194, 4093), (200, 4197), (682, 4052), (263, 4029), (1847, 4153), (749, 4183), (451, 4084), (1868, 4128)]
         : compromised: 0.1183, honest: 0.4477
         : sketchguard stats = ['Node 0: acc_rate=0.500', 'Node 1: acc_rate=0.500', 'Node 2: acc_rate=0.500']...
Round 002: test acc mean=0.3593 ± 0.3147 | min=0.0250 max=0.7066
         : test loss mean=nan ± nan
         : individual accs = ['0.703004', '0.045444', '0.024994', '0.701592', '0.664385', '0.052484', '0.603625', '0.675788', '0.669530', '0.706570', '0.676804', '0.051037', '0.048131', '0.048844', '0.044669', '0.051626', '0.666988', '0.046378', '0.038932', '0.664244']
         : correct/total = [(2902, 4128), (191, 4203), (102, 4081), (3040, 4333), (2718, 4091), (225, 4287), (2531, 4193), (2939, 4349), (2806, 4191), (3022, 4277), (2804, 4143), (214, 4193), (197, 4093), (205, 4197), (181, 4052), (208, 4029), (2770, 4153), (194, 4183), (159, 4084), (2742, 4128)]
         : compromised: 0.0453, honest: 0.6733
         : sketchguard stats = ['Node 0: acc_rate=0.500', 'Node 1: acc_rate=0.750', 'Node 2: acc_rate=0.750']...
Round 003: test acc mean=0.3853 ± 0.3347 | min=0.0474 max=0.7445
         : test loss mean=nan ± nan
         : individual accs = ['0.738614', '0.048775', '0.049743', '0.744519', '0.691274', '0.052484', '0.725972', '0.719016', '0.722501', '0.720599', '0.705527', '0.048891', '0.047398', '0.047653', '0.054788', '0.054604', '0.720202', '0.049247', '0.054358', '0.710756']
         : correct/total = [(3049, 4128), (205, 4203), (203, 4081), (3226, 4333), (2828, 4091), (225, 4287), (3044, 4193), (3127, 4349), (3028, 4191), (3082, 4277), (2923, 4143), (205, 4193), (194, 4093), (200, 4197), (222, 4052), (220, 4029), (2991, 4153), (206, 4183), (222, 4084), (2934, 4128)]
         : compromised: 0.0508, honest: 0.7199
         : sketchguard stats = ['Node 0: acc_rate=0.500', 'Node 1: acc_rate=0.500', 'Node 2: acc_rate=0.500']...
Round 004: test acc mean=0.3999 ± 0.3495 | min=0.0474 max=0.7752
         : test loss mean=nan ± nan
         : individual accs = ['0.749031', '0.048775', '0.049743', '0.748211', '0.762894', '0.052484', '0.746482', '0.759715', '0.775233', '0.754501', '0.700217', '0.048891', '0.047398', '0.047653', '0.054788', '0.054604', '0.768601', '0.049247', '0.054358', '0.726017']
         : correct/total = [(3092, 4128), (205, 4203), (203, 4081), (3242, 4333), (3121, 4091), (225, 4287), (3130, 4193), (3304, 4349), (3249, 4191), (3227, 4277), (2901, 4143), (205, 4193), (194, 4093), (200, 4197), (222, 4052), (220, 4029), (3192, 4153), (206, 4183), (222, 4084), (2997, 4128)]
         : compromised: 0.0508, honest: 0.7491
         : sketchguard stats = ['Node 0: acc_rate=0.500', 'Node 1: acc_rate=0.375', 'Node 2: acc_rate=0.375']...
Round 005: test acc mean=0.4138 ± 0.3632 | min=0.0474 max=0.7991
         : test loss mean=nan ± nan
         : individual accs = ['0.767926', '0.048775', '0.049743', '0.771521', '0.770716', '0.052484', '0.766277', '0.787307', '0.799093', '0.791443', '0.746802', '0.048891', '0.047398', '0.047653', '0.054788', '0.054604', '0.798459', '0.049247', '0.054358', '0.769380']
         : correct/total = [(3170, 4128), (205, 4203), (203, 4081), (3343, 4333), (3153, 4091), (225, 4287), (3213, 4193), (3424, 4349), (3349, 4191), (3385, 4277), (3094, 4143), (205, 4193), (194, 4093), (200, 4197), (222, 4052), (220, 4029), (3316, 4153), (206, 4183), (222, 4084), (3176, 4128)]
         : compromised: 0.0508, honest: 0.7769
         : sketchguard stats = ['Node 0: acc_rate=0.500', 'Node 1: acc_rate=0.300', 'Node 2: acc_rate=0.300']...
Round 006: test acc mean=0.4283 ± 0.3775 | min=0.0474 max=0.8184
         : test loss mean=nan ± nan
         : individual accs = ['0.794089', '0.048775', '0.049743', '0.812601', '0.798827', '0.052484', '0.802290', '0.817889', '0.810308', '0.810849', '0.797007', '0.048891', '0.047398', '0.047653', '0.054788', '0.054604', '0.818444', '0.049247', '0.054358', '0.795300']
         : correct/total = [(3278, 4128), (205, 4203), (203, 4081), (3521, 4333), (3268, 4091), (225, 4287), (3364, 4193), (3557, 4349), (3396, 4191), (3468, 4277), (3302, 4143), (205, 4193), (194, 4093), (200, 4197), (222, 4052), (220, 4029), (3399, 4153), (206, 4183), (222, 4084), (3283, 4128)]
         : compromised: 0.0508, honest: 0.8058
         : sketchguard stats = ['Node 0: acc_rate=0.500', 'Node 1: acc_rate=0.250', 'Node 2: acc_rate=0.250']...
Round 007: test acc mean=0.4367 ± 0.3860 | min=0.0474 max=0.8347
         : test loss mean=nan ± nan
         : individual accs = ['0.814196', '0.048775', '0.049743', '0.828987', '0.813493', '0.052484', '0.823515', '0.834675', '0.830828', '0.822539', '0.813662', '0.048891', '0.047398', '0.047653', '0.054788', '0.054604', '0.830002', '0.049247', '0.054358', '0.814922']
         : correct/total = [(3361, 4128), (205, 4203), (203, 4081), (3592, 4333), (3328, 4091), (225, 4287), (3453, 4193), (3630, 4349), (3482, 4191), (3518, 4277), (3371, 4143), (205, 4193), (194, 4093), (200, 4197), (222, 4052), (220, 4029), (3447, 4153), (206, 4183), (222, 4084), (3364, 4128)]
         : compromised: 0.0508, honest: 0.8227
         : sketchguard stats = ['Node 0: acc_rate=0.500', 'Node 1: acc_rate=0.214', 'Node 2: acc_rate=0.214']...
Round 008: test acc mean=0.4389 ± 0.3881 | min=0.0474 max=0.8374
         : test loss mean=nan ± nan
         : individual accs = ['0.824612', '0.048775', '0.049743', '0.835449', '0.823759', '0.052484', '0.832817', '0.837434', '0.826533', '0.833294', '0.822110', '0.048891', '0.047398', '0.047653', '0.054788', '0.054604', '0.826391', '0.049247', '0.054358', '0.807413']
         : correct/total = [(3404, 4128), (205, 4203), (203, 4081), (3620, 4333), (3370, 4091), (225, 4287), (3492, 4193), (3642, 4349), (3464, 4191), (3564, 4277), (3406, 4143), (205, 4193), (194, 4093), (200, 4197), (222, 4052), (220, 4029), (3432, 4153), (206, 4183), (222, 4084), (3333, 4128)]
         : compromised: 0.0508, honest: 0.8270
         : sketchguard stats = ['Node 0: acc_rate=0.500', 'Node 1: acc_rate=0.188', 'Node 2: acc_rate=0.188']...
Round 009: test acc mean=0.4446 ± 0.3939 | min=0.0474 max=0.8464
         : test loss mean=nan ± nan
         : individual accs = ['0.832122', '0.048775', '0.049743', '0.840526', '0.827670', '0.052484', '0.844264', '0.845022', '0.846337', '0.846388', '0.834902', '0.048891', '0.047398', '0.047653', '0.054788', '0.054604', '0.831447', '0.049247', '0.054358', '0.835756']
         : correct/total = [(3435, 4128), (205, 4203), (203, 4081), (3642, 4333), (3386, 4091), (225, 4287), (3540, 4193), (3675, 4349), (3547, 4191), (3620, 4277), (3459, 4143), (205, 4193), (194, 4093), (200, 4197), (222, 4052), (220, 4029), (3453, 4153), (206, 4183), (222, 4084), (3450, 4128)]
         : compromised: 0.0508, honest: 0.8384
         : sketchguard stats = ['Node 0: acc_rate=0.500', 'Node 1: acc_rate=0.167', 'Node 2: acc_rate=0.167']...
Round 010: test acc mean=0.4475 ± 0.3967 | min=0.0474 max=0.8505
         : test loss mean=nan ± nan
         : individual accs = ['0.839390', '0.048775', '0.049743', '0.850450', '0.835248', '0.052484', '0.849511', '0.848701', '0.849201', '0.848726', '0.836109', '0.048891', '0.047398', '0.047653', '0.054788', '0.054604', '0.841079', '0.049247', '0.054358', '0.842781']
         : correct/total = [(3465, 4128), (205, 4203), (203, 4081), (3685, 4333), (3417, 4091), (225, 4287), (3562, 4193), (3691, 4349), (3559, 4191), (3630, 4277), (3464, 4143), (205, 4193), (194, 4093), (200, 4197), (222, 4052), (220, 4029), (3493, 4153), (206, 4183), (222, 4084), (3479, 4128)]
         : compromised: 0.0508, honest: 0.8441
         : sketchguard stats = ['Node 0: acc_rate=0.500', 'Node 1: acc_rate=0.150', 'Node 2: acc_rate=0.150']...

=== FINAL RESULTS ===
Dataset: femnist, Nodes: 20, Graph: erdos, Aggregation: sketchguard
Attack: backdoor, 50.0% compromised
Final accuracy - Compromised: 0.0508, Honest: 0.8441
Overall test accuracy: mean=0.4475 ± 0.3967

=== BACKDOOR ATTACK SUCCESS RATE (ASR) ===
Target label: 0
Trigger size: 4x4
Overall ASR: 0.5261 ± 0.4739
Honest nodes ASR: 0.0522 ± 0.0038
Compromised nodes ASR: 1.0000 ± 0.0000
Note: Higher ASR indicates more successful backdoor attack

=== Sketchguard SUMMARY ===
Node 0: acceptance=0.500
Node 1: acceptance=0.150
Node 2: acceptance=0.150
Node 3: acceptance=0.571
Node 4: acceptance=0.333
Node 5: acceptance=0.050
Node 6: acceptance=0.417
Node 7: acceptance=0.364
Node 8: acceptance=0.286
Node 9: acceptance=0.636
Node 10: acceptance=0.625
Node 11: acceptance=0.142
Node 12: acceptance=0.158
Node 13: acceptance=0.156
Node 14: acceptance=0.143
Node 15: acceptance=0.144
Node 16: acceptance=0.286
Node 17: acceptance=0.163
Node 18: acceptance=0.150
Node 19: acceptance=0.400

=== PARALLEL EXECUTION TIME (realistic for distributed system) ===
  COMMUNICATION (max across nodes):
    - Sketch transfer: 0.000s (0.0%)
    - Model fetch (accepted): 0.000s (0.0%)
  COMPUTATION (max across nodes):
    - Sketching: 2.948s (99.2%)
    - Filtering: 0.001s (0.0%)
    - Aggregation: 0.024s (0.8%)
  TOTALS:
    - Total computation: 2.973s (100.0%)
    - Total communication: 0.000s (0.0%)
    - Total parallel time: 2.973s

=== PER-NODE AVERAGE TIME ===
  - Sketching: 1.868s
  - Filtering: 0.001s
  - Aggregation: 0.013s
  - Sketch transfer: 0.000s
  - Model fetch: 0.000s
  - Total per node: 1.881s

=== TOTAL COMPUTATIONAL WORK (sum across all nodes) ===
  - Total sketching: 37.352s
  - Total filtering: 0.018s
  - Total aggregation: 0.252s
  - Total sketch transfer: 0.000s
  - Total model fetch: 0.000s
  - Grand total: 37.622s
  - Mean acceptance rate: 0.291

Sketchguard Algorithm Properties:
  - Original dimension: 6,603,710
  - Sketch size: 1000
  - Compression ratio: 19.9x
  - Single repetition: No repetitions needed
  - Theoretical complexity: O(d + N×k)
  - Approach: Sketch filtering + state aggregation
