Device: cuda
Seed: 987654321
Loading 36 LEAF FEMNIST train files...
LEAF FEMNIST train: 3597 users, 734463 samples
Loading 36 LEAF FEMNIST test files...
LEAF FEMNIST test: 3597 users, 83388 samples
Found 3597 train users, 3597 test users, 3597 common users
User sample counts range: 525 (max) to 17 (min)
Distributed ALL 3597 users across 20 clients
Users per client: 179 (with 17 clients getting +1 user)
Train partition sizes: [36360, 37070, 35957, 38262, 36024, 37732, 36921, 38328, 36867, 37683, 36507, 36915, 36007, 37001, 35681, 35453, 36585, 36801, 35964, 36345]
Test partition sizes: [4128, 4203, 4081, 4333, 4091, 4287, 4193, 4349, 4191, 4277, 4143, 4193, 4093, 4197, 4052, 4029, 4153, 4183, 4084, 4128]
  Client 0: 36360 train samples, 62 unique classes
  Client 1: 37070 train samples, 62 unique classes
  Client 2: 35957 train samples, 62 unique classes
  Client 3: 38262 train samples, 62 unique classes
  Client 4: 36024 train samples, 62 unique classes
  Client 5: 37732 train samples, 62 unique classes
  Client 6: 36921 train samples, 62 unique classes
  Client 7: 38328 train samples, 62 unique classes
  Client 8: 36867 train samples, 62 unique classes
  Client 9: 37683 train samples, 62 unique classes
  Client 10: 36507 train samples, 62 unique classes
  Client 11: 36915 train samples, 62 unique classes
  Client 12: 36007 train samples, 62 unique classes
  Client 13: 37001 train samples, 62 unique classes
  Client 14: 35681 train samples, 62 unique classes
  Client 15: 35453 train samples, 62 unique classes
  Client 16: 36585 train samples, 62 unique classes
  Client 17: 36801 train samples, 62 unique classes
  Client 18: 35964 train samples, 62 unique classes
  Client 19: 36345 train samples, 62 unique classes
Will sample 10000 samples per client per epoch
Graph: fully, nodes: 20, edges: 190
Degree statistics: avg=19.00, min=19, max=19
Attack: Compromised 6/20 nodes: [5, 12, 13, 14, 17, 18]
Attack type: krum, lambda: 1.0
Model variant: baseline
Model parameters: 6,603,710
Sketchguard Node 0:
  Model dim: 6,603,710 → Sketch size: 1000
  Compression ratio: 6603.7x
  Using model parameters for aggregation, sketches for filtering
Sketchguard Node 1:
  Model dim: 6,603,710 → Sketch size: 1000
  Compression ratio: 6603.7x
  Using model parameters for aggregation, sketches for filtering
Sketchguard Node 2:
  Model dim: 6,603,710 → Sketch size: 1000
  Compression ratio: 6603.7x
  Using model parameters for aggregation, sketches for filtering
Sketchguard Node 3:
  Model dim: 6,603,710 → Sketch size: 1000
  Compression ratio: 6603.7x
  Using model parameters for aggregation, sketches for filtering
Sketchguard Node 4:
  Model dim: 6,603,710 → Sketch size: 1000
  Compression ratio: 6603.7x
  Using model parameters for aggregation, sketches for filtering
Sketchguard Node 5:
  Model dim: 6,603,710 → Sketch size: 1000
  Compression ratio: 6603.7x
  Using model parameters for aggregation, sketches for filtering
Sketchguard Node 6:
  Model dim: 6,603,710 → Sketch size: 1000
  Compression ratio: 6603.7x
  Using model parameters for aggregation, sketches for filtering
Sketchguard Node 7:
  Model dim: 6,603,710 → Sketch size: 1000
  Compression ratio: 6603.7x
  Using model parameters for aggregation, sketches for filtering
Sketchguard Node 8:
  Model dim: 6,603,710 → Sketch size: 1000
  Compression ratio: 6603.7x
  Using model parameters for aggregation, sketches for filtering
Sketchguard Node 9:
  Model dim: 6,603,710 → Sketch size: 1000
  Compression ratio: 6603.7x
  Using model parameters for aggregation, sketches for filtering
Sketchguard Node 10:
  Model dim: 6,603,710 → Sketch size: 1000
  Compression ratio: 6603.7x
  Using model parameters for aggregation, sketches for filtering
Sketchguard Node 11:
  Model dim: 6,603,710 → Sketch size: 1000
  Compression ratio: 6603.7x
  Using model parameters for aggregation, sketches for filtering
Sketchguard Node 12:
  Model dim: 6,603,710 → Sketch size: 1000
  Compression ratio: 6603.7x
  Using model parameters for aggregation, sketches for filtering
Sketchguard Node 13:
  Model dim: 6,603,710 → Sketch size: 1000
  Compression ratio: 6603.7x
  Using model parameters for aggregation, sketches for filtering
Sketchguard Node 14:
  Model dim: 6,603,710 → Sketch size: 1000
  Compression ratio: 6603.7x
  Using model parameters for aggregation, sketches for filtering
Sketchguard Node 15:
  Model dim: 6,603,710 → Sketch size: 1000
  Compression ratio: 6603.7x
  Using model parameters for aggregation, sketches for filtering
Sketchguard Node 16:
  Model dim: 6,603,710 → Sketch size: 1000
  Compression ratio: 6603.7x
  Using model parameters for aggregation, sketches for filtering
Sketchguard Node 17:
  Model dim: 6,603,710 → Sketch size: 1000
  Compression ratio: 6603.7x
  Using model parameters for aggregation, sketches for filtering
Sketchguard Node 18:
  Model dim: 6,603,710 → Sketch size: 1000
  Compression ratio: 6603.7x
  Using model parameters for aggregation, sketches for filtering
Sketchguard Node 19:
  Model dim: 6,603,710 → Sketch size: 1000
  Compression ratio: 6603.7x
  Using model parameters for aggregation, sketches for filtering
Sketchguard ALGORITHM (Sketch-based Filtering + State Aggregation)
  - Model dimension: 6,603,710 parameters
  - Config: SketchguardConfig(gamma=2, kappa=1, alpha=0.5, min_neighbors=1, sketch_size=1000, network_seed=987654321, attack_detection_window=5)
  - Sketch size: 1000
  - Compression ratio: 6603.7x
  - Complexity: O(d + N×k) = O(6,603,710 + 20×1000)
  - Theoretical speedup vs BALANCE: 19.9x
Initial test acc across nodes: mean=0.0168 ± 0.0139
Round 001: test acc mean=0.5196 ± 0.0345 | min=0.4522 max=0.5953
         : test loss mean=3.7252 ± 0.0274
         : individual accs = ['0.566618', '0.512729', '0.565793', '0.533118', '0.528966', '0.595288', '0.514429', '0.518970', '0.524457', '0.452186', '0.536809', '0.535178', '0.468605', '0.469145', '0.527641', '0.535120', '0.473874', '0.528568', '0.502449', '0.501696']
         : correct/total = [(2339, 4128), (2155, 4203), (2309, 4081), (2310, 4333), (2164, 4091), (2552, 4287), (2157, 4193), (2257, 4349), (2198, 4191), (1934, 4277), (2224, 4143), (2244, 4193), (1918, 4093), (1969, 4197), (2138, 4052), (2156, 4029), (1968, 4153), (2211, 4183), (2052, 4084), (2071, 4128)]
         : compromised: 0.5153, honest: 0.5214
         : sketchguard stats = ['Node 0: acc_rate=0.684', 'Node 1: acc_rate=0.684', 'Node 2: acc_rate=0.684']...
Round 002: test acc mean=0.6810 ± 0.0140 | min=0.6508 max=0.7050
         : test loss mean=3.4305 ± 0.0476
         : individual accs = ['0.681928', '0.680466', '0.683901', '0.697438', '0.695185', '0.701190', '0.661340', '0.688664', '0.666905', '0.669394', '0.705045', '0.671834', '0.666992', '0.680963', '0.688055', '0.650782', '0.682880', '0.698781', '0.674584', '0.672965']
         : correct/total = [(2815, 4128), (2860, 4203), (2791, 4081), (3022, 4333), (2844, 4091), (3006, 4287), (2773, 4193), (2995, 4349), (2795, 4191), (2863, 4277), (2921, 4143), (2817, 4193), (2730, 4093), (2858, 4197), (2788, 4052), (2622, 4029), (2836, 4153), (2923, 4183), (2755, 4084), (2778, 4128)]
         : compromised: 0.6851, honest: 0.6792
         : sketchguard stats = ['Node 0: acc_rate=0.684', 'Node 1: acc_rate=0.684', 'Node 2: acc_rate=0.684']...
Round 003: test acc mean=0.6951 ± 0.0331 | min=0.5718 max=0.7319
         : test loss mean=3.1141 ± 0.1257
         : individual accs = ['0.708576', '0.705924', '0.691252', '0.713593', '0.731850', '0.683228', '0.695206', '0.730053', '0.702935', '0.722469', '0.720492', '0.668495', '0.691424', '0.670717', '0.692251', '0.695954', '0.685769', '0.571838', '0.703232', '0.716085']
         : correct/total = [(2925, 4128), (2967, 4203), (2821, 4081), (3092, 4333), (2994, 4091), (2929, 4287), (2915, 4193), (3175, 4349), (2946, 4191), (3090, 4277), (2985, 4143), (2803, 4193), (2830, 4093), (2815, 4197), (2805, 4052), (2804, 4029), (2848, 4153), (2392, 4183), (2872, 4084), (2956, 4128)]
         : compromised: 0.6688, honest: 0.7063
         : sketchguard stats = ['Node 0: acc_rate=0.684', 'Node 1: acc_rate=0.684', 'Node 2: acc_rate=0.684']...
Round 004: test acc mean=0.6696 ± 0.0351 | min=0.6000 max=0.7233
         : test loss mean=2.5740 ± 0.1628
         : individual accs = ['0.673934', '0.716631', '0.674590', '0.690053', '0.709118', '0.604385', '0.687813', '0.694183', '0.706514', '0.657938', '0.658219', '0.698307', '0.600049', '0.639028', '0.674482', '0.657980', '0.723333', '0.609132', '0.662096', '0.653828']
         : correct/total = [(2782, 4128), (3012, 4203), (2753, 4081), (2990, 4333), (2901, 4091), (2591, 4287), (2884, 4193), (3019, 4349), (2961, 4191), (2814, 4277), (2727, 4143), (2928, 4193), (2456, 4093), (2682, 4197), (2733, 4052), (2651, 4029), (3004, 4153), (2548, 4183), (2704, 4084), (2699, 4128)]
         : compromised: 0.6315, honest: 0.6859
         : sketchguard stats = ['Node 0: acc_rate=0.684', 'Node 1: acc_rate=0.684', 'Node 2: acc_rate=0.684']...
Round 005: test acc mean=0.6535 ± 0.0367 | min=0.5502 max=0.7130
         : test loss mean=1.8480 ± 0.1558
         : individual accs = ['0.662548', '0.664049', '0.638324', '0.643896', '0.702762', '0.616282', '0.666826', '0.713037', '0.662849', '0.698153', '0.664494', '0.683997', '0.550208', '0.630689', '0.633761', '0.606602', '0.691548', '0.632560', '0.657444', '0.650678']
         : correct/total = [(2735, 4128), (2791, 4203), (2605, 4081), (2790, 4333), (2875, 4091), (2642, 4287), (2796, 4193), (3101, 4349), (2778, 4191), (2986, 4277), (2753, 4143), (2868, 4193), (2252, 4093), (2647, 4197), (2568, 4052), (2444, 4029), (2872, 4153), (2646, 4183), (2685, 4084), (2686, 4128)]
         : compromised: 0.6202, honest: 0.6678
         : sketchguard stats = ['Node 0: acc_rate=0.684', 'Node 1: acc_rate=0.684', 'Node 2: acc_rate=0.684']...
Round 006: test acc mean=0.7482 ± 0.0186 | min=0.7032 max=0.7758
         : test loss mean=1.0764 ± 0.0745
         : individual accs = ['0.748062', '0.763502', '0.745160', '0.741288', '0.772672', '0.745743', '0.766754', '0.750747', '0.759962', '0.752397', '0.753560', '0.775817', '0.703152', '0.707887', '0.758885', '0.735666', '0.767156', '0.730098', '0.737267', '0.747578']
         : correct/total = [(3088, 4128), (3209, 4203), (3041, 4081), (3212, 4333), (3161, 4091), (3197, 4287), (3215, 4193), (3265, 4349), (3185, 4191), (3218, 4277), (3122, 4143), (3253, 4193), (2878, 4093), (2971, 4197), (3075, 4052), (2964, 4029), (3186, 4153), (3054, 4183), (3011, 4084), (3086, 4128)]
         : compromised: 0.7305, honest: 0.7557
         : sketchguard stats = ['Node 0: acc_rate=0.684', 'Node 1: acc_rate=0.684', 'Node 2: acc_rate=0.684']...
Round 007: test acc mean=0.8062 ± 0.0100 | min=0.7845 max=0.8262
         : test loss mean=0.6660 ± 0.0320
         : individual accs = ['0.808866', '0.807043', '0.810096', '0.800369', '0.826204', '0.808724', '0.801336', '0.821108', '0.803150', '0.813888', '0.784456', '0.800143', '0.810164', '0.813438', '0.801826', '0.785803', '0.815796', '0.795123', '0.809990', '0.805717']
         : correct/total = [(3339, 4128), (3392, 4203), (3306, 4081), (3468, 4333), (3380, 4091), (3467, 4287), (3360, 4193), (3571, 4349), (3366, 4191), (3481, 4277), (3250, 4143), (3355, 4193), (3316, 4093), (3414, 4197), (3249, 4052), (3166, 4029), (3388, 4153), (3326, 4183), (3308, 4084), (3326, 4128)]
         : compromised: 0.8065, honest: 0.8060
         : sketchguard stats = ['Node 0: acc_rate=0.684', 'Node 1: acc_rate=0.684', 'Node 2: acc_rate=0.684']...
Round 008: test acc mean=0.8278 ± 0.0077 | min=0.8129 max=0.8402
         : test loss mean=0.5419 ± 0.0233
         : individual accs = ['0.827277', '0.836307', '0.833374', '0.831526', '0.838915', '0.830418', '0.820176', '0.840193', '0.824386', '0.838906', '0.818489', '0.823277', '0.829465', '0.827258', '0.816140', '0.812857', '0.828317', '0.821181', '0.834476', '0.823159']
         : correct/total = [(3415, 4128), (3515, 4203), (3401, 4081), (3603, 4333), (3432, 4091), (3560, 4287), (3439, 4193), (3654, 4349), (3455, 4191), (3588, 4277), (3391, 4143), (3452, 4193), (3395, 4093), (3472, 4197), (3307, 4052), (3275, 4029), (3440, 4153), (3435, 4183), (3408, 4084), (3398, 4128)]
         : compromised: 0.8265, honest: 0.8284
         : sketchguard stats = ['Node 0: acc_rate=0.684', 'Node 1: acc_rate=0.684', 'Node 2: acc_rate=0.684']...
Round 009: test acc mean=0.8367 ± 0.0071 | min=0.8274 max=0.8508
         : test loss mean=0.5002 ± 0.0203
         : individual accs = ['0.827519', '0.842969', '0.849792', '0.837757', '0.843559', '0.838348', '0.829478', '0.850770', '0.831782', '0.845452', '0.827420', '0.829478', '0.838749', '0.834167', '0.832182', '0.828742', '0.841560', '0.834090', '0.839618', '0.830669']
         : correct/total = [(3416, 4128), (3543, 4203), (3468, 4081), (3630, 4333), (3451, 4091), (3594, 4287), (3478, 4193), (3700, 4349), (3486, 4191), (3616, 4277), (3428, 4143), (3478, 4193), (3433, 4093), (3501, 4197), (3372, 4052), (3339, 4029), (3495, 4153), (3489, 4183), (3429, 4084), (3429, 4128)]
         : compromised: 0.8362, honest: 0.8369
         : sketchguard stats = ['Node 0: acc_rate=0.684', 'Node 1: acc_rate=0.684', 'Node 2: acc_rate=0.684']...
Round 010: test acc mean=0.8433 ± 0.0067 | min=0.8292 max=0.8555
         : test loss mean=0.4782 ± 0.0211
         : individual accs = ['0.841812', '0.847966', '0.849302', '0.844450', '0.855537', '0.844413', '0.839971', '0.852840', '0.841088', '0.851064', '0.837075', '0.829239', '0.846079', '0.845127', '0.835884', '0.836188', '0.843487', '0.840306', '0.850881', '0.833091']
         : correct/total = [(3475, 4128), (3564, 4203), (3466, 4081), (3659, 4333), (3500, 4091), (3620, 4287), (3522, 4193), (3709, 4349), (3525, 4191), (3640, 4277), (3468, 4143), (3477, 4193), (3463, 4093), (3547, 4197), (3387, 4052), (3369, 4029), (3503, 4153), (3515, 4183), (3475, 4084), (3439, 4128)]
         : compromised: 0.8438, honest: 0.8431
         : sketchguard stats = ['Node 0: acc_rate=0.684', 'Node 1: acc_rate=0.684', 'Node 2: acc_rate=0.684']...

=== FINAL RESULTS ===
Dataset: femnist, Nodes: 20, Graph: fully, Aggregation: sketchguard
Attack: krum, 30.0% compromised
Final accuracy - Compromised: 0.8438, Honest: 0.8431
Overall test accuracy: mean=0.8433 ± 0.0067

=== Sketchguard SUMMARY ===
Node 0: acceptance=0.684
Node 1: acceptance=0.684
Node 2: acceptance=0.684
Node 3: acceptance=0.684
Node 4: acceptance=0.684
Node 5: acceptance=0.737
Node 6: acceptance=0.684
Node 7: acceptance=0.684
Node 8: acceptance=0.684
Node 9: acceptance=0.684
Node 10: acceptance=0.684
Node 11: acceptance=0.684
Node 12: acceptance=0.737
Node 13: acceptance=0.737
Node 14: acceptance=0.737
Node 15: acceptance=0.684
Node 16: acceptance=0.684
Node 17: acceptance=0.737
Node 18: acceptance=0.737
Node 19: acceptance=0.684

=== PARALLEL EXECUTION TIME (realistic for distributed system) ===
  COMMUNICATION (max across nodes):
    - Sketch transfer: 0.000s (0.0%)
    - Model fetch (accepted): 0.000s (0.0%)
  COMPUTATION (max across nodes):
    - Sketching: 5.441s (99.5%)
    - Filtering: 0.002s (0.0%)
    - Aggregation: 0.027s (0.5%)
  TOTALS:
    - Total computation: 5.471s (100.0%)
    - Total communication: 0.000s (0.0%)
    - Total parallel time: 5.471s

=== PER-NODE AVERAGE TIME ===
  - Sketching: 4.934s
  - Filtering: 0.001s
  - Aggregation: 0.022s
  - Sketch transfer: 0.000s
  - Model fetch: 0.000s
  - Total per node: 4.958s

=== TOTAL COMPUTATIONAL WORK (sum across all nodes) ===
  - Total sketching: 98.685s
  - Total filtering: 0.027s
  - Total aggregation: 0.441s
  - Total sketch transfer: 0.000s
  - Total model fetch: 0.000s
  - Grand total: 99.155s
  - Mean acceptance rate: 0.700

Sketchguard Algorithm Properties:
  - Original dimension: 6,603,710
  - Sketch size: 1000
  - Compression ratio: 19.9x
  - Single repetition: No repetitions needed
  - Theoretical complexity: O(d + N×k)
  - Approach: Sketch filtering + state aggregation
