Device: cuda
Seed: 987654321
Loading 36 LEAF FEMNIST train files...
LEAF FEMNIST train: 3597 users, 734463 samples
Loading 36 LEAF FEMNIST test files...
LEAF FEMNIST test: 3597 users, 83388 samples
Found 3597 train users, 3597 test users, 3597 common users
User sample counts range: 525 (max) to 17 (min)
Distributed ALL 3597 users across 20 clients
Users per client: 179 (with 17 clients getting +1 user)
Train partition sizes: [36360, 37070, 35957, 38262, 36024, 37732, 36921, 38328, 36867, 37683, 36507, 36915, 36007, 37001, 35681, 35453, 36585, 36801, 35964, 36345]
Test partition sizes: [4128, 4203, 4081, 4333, 4091, 4287, 4193, 4349, 4191, 4277, 4143, 4193, 4093, 4197, 4052, 4029, 4153, 4183, 4084, 4128]
  Client 0: 36360 train samples, 62 unique classes
  Client 1: 37070 train samples, 62 unique classes
  Client 2: 35957 train samples, 62 unique classes
  Client 3: 38262 train samples, 62 unique classes
  Client 4: 36024 train samples, 62 unique classes
  Client 5: 37732 train samples, 62 unique classes
  Client 6: 36921 train samples, 62 unique classes
  Client 7: 38328 train samples, 62 unique classes
  Client 8: 36867 train samples, 62 unique classes
  Client 9: 37683 train samples, 62 unique classes
  Client 10: 36507 train samples, 62 unique classes
  Client 11: 36915 train samples, 62 unique classes
  Client 12: 36007 train samples, 62 unique classes
  Client 13: 37001 train samples, 62 unique classes
  Client 14: 35681 train samples, 62 unique classes
  Client 15: 35453 train samples, 62 unique classes
  Client 16: 36585 train samples, 62 unique classes
  Client 17: 36801 train samples, 62 unique classes
  Client 18: 35964 train samples, 62 unique classes
  Client 19: 36345 train samples, 62 unique classes
Will sample 10000 samples per client per epoch
Graph: ring, nodes: 20, edges: 20
Degree statistics: avg=2.00, min=2, max=2
Attack: Compromised 8/20 nodes: [1, 5, 11, 12, 13, 14, 17, 18]
Attack type: directed_deviation, lambda: 1.0
Model variant: baseline
Model parameters: 6,603,710
Initial test acc across nodes: mean=0.0168 ± 0.0139
Round 001: test acc mean=0.0495 ± 0.0945 | min=0.0024 max=0.4123
         : test loss mean=40883.2642 ± 91125.5022
         : individual accs = ['0.003391', '0.008327', '0.005146', '0.164782', '0.016866', '0.006998', '0.002623', '0.412279', '0.130756', '0.104045', '0.015206', '0.010494', '0.003909', '0.011675', '0.025420', '0.018367', '0.008668', '0.002391', '0.023506', '0.015746']
         : correct/total = [(14, 4128), (35, 4203), (21, 4081), (714, 4333), (69, 4091), (30, 4287), (11, 4193), (1793, 4349), (548, 4191), (445, 4277), (63, 4143), (44, 4193), (16, 4093), (49, 4197), (103, 4052), (74, 4029), (36, 4153), (10, 4183), (96, 4084), (65, 4128)]
         : compromised: 0.0116, honest: 0.0748
Round 002: test acc mean=0.0835 ± 0.1432 | min=0.0438 max=0.7072
         : test loss mean=2065224686759555891200.0000 ± 8640315806213726011392.0000
         : individual accs = ['0.048934', '0.050202', '0.054889', '0.047773', '0.044977', '0.045953', '0.043883', '0.047827', '0.707230', '0.044891', '0.055274', '0.053184', '0.058637', '0.062426', '0.051579', '0.054852', '0.054418', '0.053311', '0.045788', '0.043847']
         : correct/total = [(202, 4128), (211, 4203), (224, 4081), (207, 4333), (184, 4091), (197, 4287), (184, 4193), (208, 4349), (2964, 4191), (192, 4277), (229, 4143), (223, 4193), (240, 4093), (262, 4197), (209, 4052), (221, 4029), (226, 4153), (223, 4183), (187, 4084), (181, 4128)]
         : compromised: 0.0526, honest: 0.1041
Round 003: test acc mean=0.0485 ± 0.0080 | min=0.0261 max=0.0561
         : test loss mean=16316463814.1042 ± 61374781071.2767
         : individual accs = ['0.045785', '0.050202', '0.056114', '0.052850', '0.048643', '0.050618', '0.043883', '0.047827', '0.051062', '0.053776', '0.055998', '0.053899', '0.026142', '0.028354', '0.051579', '0.054852', '0.054418', '0.053311', '0.045788', '0.044331']
         : correct/total = [(189, 4128), (211, 4203), (229, 4081), (229, 4333), (199, 4091), (217, 4287), (184, 4193), (208, 4349), (214, 4191), (230, 4277), (232, 4143), (226, 4193), (107, 4093), (119, 4197), (209, 4052), (221, 4029), (226, 4153), (223, 4183), (187, 4084), (183, 4128)]
         : compromised: 0.0450, honest: 0.0508
Round 004: test acc mean=0.0488 ± 0.0087 | min=0.0261 max=0.0624
         : test loss mean=2697063126.3262 ± 11590935703.3928
         : individual accs = ['0.048934', '0.050202', '0.057584', '0.052850', '0.057932', '0.043387', '0.043883', '0.045528', '0.053209', '0.044891', '0.048033', '0.049606', '0.058637', '0.062426', '0.051579', '0.026061', '0.030340', '0.053311', '0.054358', '0.043847']
         : correct/total = [(202, 4128), (211, 4203), (235, 4081), (229, 4333), (237, 4091), (186, 4287), (184, 4193), (198, 4349), (223, 4191), (192, 4277), (199, 4143), (208, 4193), (240, 4093), (262, 4197), (209, 4052), (105, 4029), (126, 4153), (223, 4183), (222, 4084), (181, 4128)]
         : compromised: 0.0529, honest: 0.0461
Round 005: test acc mean=0.0415 ± 0.0121 | min=0.0214 max=0.0570
         : test loss mean=70926.7723 ± 308870.9289
         : individual accs = ['0.027132', '0.052344', '0.024994', '0.052850', '0.042288', '0.038955', '0.057000', '0.049207', '0.053209', '0.044891', '0.051171', '0.045314', '0.026142', '0.028354', '0.051579', '0.022834', '0.021430', '0.053311', '0.054358', '0.033430']
         : correct/total = [(112, 4128), (220, 4203), (102, 4081), (229, 4333), (173, 4091), (167, 4287), (239, 4193), (214, 4349), (223, 4191), (192, 4277), (212, 4143), (190, 4193), (107, 4093), (119, 4197), (209, 4052), (92, 4029), (89, 4153), (223, 4183), (222, 4084), (138, 4128)]
         : compromised: 0.0438, honest: 0.0400
Round 006: test acc mean=0.0532 ± 0.0044 | min=0.0446 max=0.0624
         : test loss mean=771572245037.3018 ± 3361993930811.5679
         : individual accs = ['0.044574', '0.052344', '0.057584', '0.052850', '0.057932', '0.048052', '0.057000', '0.045068', '0.053209', '0.053776', '0.047550', '0.054376', '0.058637', '0.062426', '0.051579', '0.054852', '0.054418', '0.053311', '0.054358', '0.050872']
         : correct/total = [(184, 4128), (220, 4203), (235, 4081), (229, 4333), (237, 4091), (206, 4287), (239, 4193), (196, 4349), (223, 4191), (230, 4277), (197, 4143), (228, 4193), (240, 4093), (262, 4197), (209, 4052), (221, 4029), (226, 4153), (223, 4183), (222, 4084), (210, 4128)]
         : compromised: 0.0544, honest: 0.0525
Round 007: test acc mean=0.0399 ± 0.0105 | min=0.0250 max=0.0544
         : test loss mean=15637682353371.0898 ± 42334051234278.8359
         : individual accs = ['0.030523', '0.052344', '0.024994', '0.052850', '0.042288', '0.038955', '0.043883', '0.043918', '0.053209', '0.053776', '0.047550', '0.054376', '0.033716', '0.028592', '0.025913', '0.028295', '0.030821', '0.028927', '0.051665', '0.032219']
         : correct/total = [(126, 4128), (220, 4203), (102, 4081), (229, 4333), (173, 4091), (167, 4287), (184, 4193), (191, 4349), (223, 4191), (230, 4277), (197, 4143), (228, 4193), (138, 4093), (120, 4197), (105, 4052), (114, 4029), (128, 4153), (121, 4183), (211, 4084), (133, 4128)]
         : compromised: 0.0393, honest: 0.0404
Round 008: test acc mean=0.0527 ± 0.0055 | min=0.0422 max=0.0624
         : test loss mean=10920279673.2068 ± 47600395509.4098
         : individual accs = ['0.050145', '0.052344', '0.057584', '0.052850', '0.057932', '0.048052', '0.043883', '0.049207', '0.042233', '0.053776', '0.050447', '0.061770', '0.058637', '0.062426', '0.050346', '0.056590', '0.058271', '0.051159', '0.051665', '0.045058']
         : correct/total = [(207, 4128), (220, 4203), (235, 4081), (229, 4333), (237, 4091), (206, 4287), (184, 4193), (214, 4349), (177, 4191), (230, 4277), (209, 4143), (259, 4193), (240, 4093), (262, 4197), (204, 4052), (228, 4029), (242, 4153), (214, 4183), (211, 4084), (186, 4128)]
         : compromised: 0.0545, honest: 0.0515
Round 009: test acc mean=0.0486 ± 0.0101 | min=0.0281 max=0.0612
         : test loss mean=3.8725 ± 0.2198
         : individual accs = ['0.059593', '0.052344', '0.050723', '0.052850', '0.051088', '0.048052', '0.033389', '0.051276', '0.053209', '0.053776', '0.036688', '0.028142', '0.033716', '0.028592', '0.061204', '0.056590', '0.058271', '0.050920', '0.055583', '0.055475']
         : correct/total = [(246, 4128), (220, 4203), (207, 4081), (229, 4333), (209, 4091), (206, 4287), (140, 4193), (223, 4349), (223, 4191), (230, 4277), (152, 4143), (118, 4193), (138, 4093), (120, 4197), (248, 4052), (228, 4029), (242, 4153), (213, 4183), (227, 4084), (229, 4128)]
         : compromised: 0.0448, honest: 0.0511
Round 010: test acc mean=0.0539 ± 0.0044 | min=0.0439 max=0.0624
         : test loss mean=3.8957 ± 0.3640
         : individual accs = ['0.059593', '0.052344', '0.050723', '0.052850', '0.051088', '0.050618', '0.043883', '0.051276', '0.053209', '0.053776', '0.050447', '0.049606', '0.058637', '0.062426', '0.061204', '0.056590', '0.058271', '0.050920', '0.055583', '0.055475']
         : correct/total = [(246, 4128), (220, 4203), (207, 4081), (229, 4333), (209, 4091), (217, 4287), (184, 4193), (223, 4349), (223, 4191), (230, 4277), (209, 4143), (208, 4193), (240, 4093), (262, 4197), (248, 4052), (228, 4029), (242, 4153), (213, 4183), (227, 4084), (229, 4128)]
         : compromised: 0.0552, honest: 0.0531

=== FINAL RESULTS ===
Dataset: femnist, Nodes: 20, Graph: ring, Aggregation: krum
Attack: directed_deviation, 40.0% compromised
Final accuracy - Compromised: 0.0552, Honest: 0.0531
Overall test accuracy: mean=0.0539 ± 0.0044
