Device: cuda
Seed: 987654321
Loading 36 LEAF FEMNIST train files...
LEAF FEMNIST train: 3597 users, 734463 samples
Loading 36 LEAF FEMNIST test files...
LEAF FEMNIST test: 3597 users, 83388 samples
Found 3597 train users, 3597 test users, 3597 common users
User sample counts range: 525 (max) to 17 (min)
Distributed ALL 3597 users across 20 clients
Users per client: 179 (with 17 clients getting +1 user)
Train partition sizes: [36360, 37070, 35957, 38262, 36024, 37732, 36921, 38328, 36867, 37683, 36507, 36915, 36007, 37001, 35681, 35453, 36585, 36801, 35964, 36345]
Test partition sizes: [4128, 4203, 4081, 4333, 4091, 4287, 4193, 4349, 4191, 4277, 4143, 4193, 4093, 4197, 4052, 4029, 4153, 4183, 4084, 4128]
  Client 0: 36360 train samples, 62 unique classes
  Client 1: 37070 train samples, 62 unique classes
  Client 2: 35957 train samples, 62 unique classes
  Client 3: 38262 train samples, 62 unique classes
  Client 4: 36024 train samples, 62 unique classes
  Client 5: 37732 train samples, 62 unique classes
  Client 6: 36921 train samples, 62 unique classes
  Client 7: 38328 train samples, 62 unique classes
  Client 8: 36867 train samples, 62 unique classes
  Client 9: 37683 train samples, 62 unique classes
  Client 10: 36507 train samples, 62 unique classes
  Client 11: 36915 train samples, 62 unique classes
  Client 12: 36007 train samples, 62 unique classes
  Client 13: 37001 train samples, 62 unique classes
  Client 14: 35681 train samples, 62 unique classes
  Client 15: 35453 train samples, 62 unique classes
  Client 16: 36585 train samples, 62 unique classes
  Client 17: 36801 train samples, 62 unique classes
  Client 18: 35964 train samples, 62 unique classes
  Client 19: 36345 train samples, 62 unique classes
Will sample 10000 samples per client per epoch
Graph: fully, nodes: 20, edges: 190
Degree statistics: avg=19.00, min=19, max=19
Attack: Compromised 4/20 nodes: [5, 12, 13, 17]
Attack type: directed_deviation, lambda: 1.0
Model variant: baseline
Model parameters: 6,603,710
Initial test acc across nodes: mean=0.0168 ± 0.0139
Round 001: test acc mean=0.0156 ± 0.0146 | min=0.0021 max=0.0485
         : test loss mean=549.8934 ± 146.7699
         : individual accs = ['0.003391', '0.002141', '0.027934', '0.005077', '0.003911', '0.003499', '0.034581', '0.003909', '0.025292', '0.003741', '0.039585', '0.030766', '0.005864', '0.011198', '0.003208', '0.008439', '0.015651', '0.002152', '0.048482', '0.032461']
         : correct/total = [(14, 4128), (9, 4203), (114, 4081), (22, 4333), (16, 4091), (15, 4287), (145, 4193), (17, 4349), (106, 4191), (16, 4277), (164, 4143), (129, 4193), (24, 4093), (47, 4197), (13, 4052), (34, 4029), (65, 4153), (9, 4183), (198, 4084), (134, 4128)]
         : compromised: 0.0057, honest: 0.0180
Round 002: test acc mean=0.0514 ± 0.0034 | min=0.0469 max=0.0618
         : test loss mean=606576.5045 ± 22908.1031
         : individual accs = ['0.051599', '0.051630', '0.050723', '0.048465', '0.051088', '0.048052', '0.049130', '0.051276', '0.047960', '0.053075', '0.050447', '0.061770', '0.053750', '0.046938', '0.048124', '0.056342', '0.055141', '0.050203', '0.052889', '0.048450']
         : correct/total = [(213, 4128), (217, 4203), (207, 4081), (210, 4333), (209, 4091), (206, 4287), (206, 4193), (223, 4349), (201, 4191), (227, 4277), (209, 4143), (259, 4193), (220, 4093), (197, 4197), (195, 4052), (227, 4029), (229, 4153), (210, 4183), (216, 4084), (200, 4128)]
         : compromised: 0.0497, honest: 0.0518
Round 003: test acc mean=0.0499 ± 0.0033 | min=0.0439 max=0.0553
         : test loss mean=231763.4327 ± 7477.8447
         : individual accs = ['0.049661', '0.050916', '0.054889', '0.046619', '0.052066', '0.045953', '0.043883', '0.053116', '0.051062', '0.044891', '0.047550', '0.054376', '0.052040', '0.055278', '0.045656', '0.050881', '0.051047', '0.048291', '0.050196', '0.050145']
         : correct/total = [(205, 4128), (214, 4203), (224, 4081), (202, 4333), (213, 4091), (197, 4287), (184, 4193), (231, 4349), (214, 4191), (192, 4277), (197, 4143), (228, 4193), (213, 4093), (232, 4197), (185, 4052), (205, 4029), (212, 4153), (202, 4183), (205, 4084), (207, 4128)]
         : compromised: 0.0504, honest: 0.0498
Round 004: test acc mean=0.0516 ± 0.0041 | min=0.0439 max=0.0583
         : test loss mean=5.0926 ± 0.9515
         : individual accs = ['0.049176', '0.047109', '0.055134', '0.047773', '0.044977', '0.057849', '0.053899', '0.043918', '0.051539', '0.053776', '0.055274', '0.053184', '0.049841', '0.045747', '0.051579', '0.056590', '0.058271', '0.053311', '0.052155', '0.050388']
         : correct/total = [(203, 4128), (198, 4203), (225, 4081), (207, 4333), (184, 4091), (248, 4287), (226, 4193), (191, 4349), (216, 4191), (230, 4277), (229, 4143), (223, 4193), (204, 4093), (192, 4197), (209, 4052), (228, 4029), (242, 4153), (223, 4183), (213, 4084), (208, 4128)]
         : compromised: 0.0517, honest: 0.0515
Round 005: test acc mean=0.0449 ± 0.0041 | min=0.0365 max=0.0525
         : test loss mean=109.9494 ± 42.1694
         : individual accs = ['0.045785', '0.042589', '0.048763', '0.036464', '0.043266', '0.052484', '0.042213', '0.041619', '0.040802', '0.046528', '0.051171', '0.041736', '0.050818', '0.049559', '0.046644', '0.041698', '0.040693', '0.045900', '0.045788', '0.044331']
         : correct/total = [(189, 4128), (179, 4203), (199, 4081), (158, 4333), (177, 4091), (225, 4287), (177, 4193), (181, 4349), (171, 4191), (199, 4277), (212, 4143), (175, 4193), (208, 4093), (208, 4197), (189, 4052), (168, 4029), (169, 4153), (192, 4183), (187, 4084), (183, 4128)]
         : compromised: 0.0497, honest: 0.0438
Round 006: test acc mean=0.0493 ± 0.0035 | min=0.0430 max=0.0545
         : test loss mean=3.7403 ± 0.0147
         : individual accs = ['0.050145', '0.048775', '0.053418', '0.043157', '0.043021', '0.045253', '0.050799', '0.045068', '0.049630', '0.043488', '0.048033', '0.049606', '0.054239', '0.049083', '0.051826', '0.051626', '0.052011', '0.049486', '0.052889', '0.054506']
         : correct/total = [(207, 4128), (205, 4203), (218, 4081), (187, 4333), (176, 4091), (194, 4287), (213, 4193), (196, 4349), (208, 4191), (186, 4277), (199, 4143), (208, 4193), (222, 4093), (206, 4197), (210, 4052), (208, 4029), (216, 4153), (207, 4183), (216, 4084), (225, 4128)]
         : compromised: 0.0495, honest: 0.0492
Round 007: test acc mean=0.0460 ± 0.0053 | min=0.0365 max=0.0586
         : test loss mean=45.5787 ± 35.8921
         : individual accs = ['0.045785', '0.042589', '0.048763', '0.036464', '0.043266', '0.050618', '0.042213', '0.041619', '0.040802', '0.046528', '0.051171', '0.041736', '0.058637', '0.049559', '0.046644', '0.056590', '0.040693', '0.045900', '0.045788', '0.044331']
         : correct/total = [(189, 4128), (179, 4203), (199, 4081), (158, 4333), (177, 4091), (217, 4287), (177, 4193), (181, 4349), (171, 4191), (199, 4277), (212, 4143), (175, 4193), (240, 4093), (208, 4197), (189, 4052), (228, 4029), (169, 4153), (192, 4183), (187, 4084), (183, 4128)]
         : compromised: 0.0512, honest: 0.0447
Round 008: test acc mean=0.0526 ± 0.0042 | min=0.0439 max=0.0596
         : test loss mean=4.7139 ± 2.9675
         : individual accs = ['0.059593', '0.052344', '0.055134', '0.052850', '0.057932', '0.050618', '0.053899', '0.043918', '0.053209', '0.053776', '0.050447', '0.053184', '0.058637', '0.045747', '0.051579', '0.051378', '0.058271', '0.053311', '0.052155', '0.044331']
         : correct/total = [(246, 4128), (220, 4203), (225, 4081), (229, 4333), (237, 4091), (217, 4287), (226, 4193), (191, 4349), (223, 4191), (230, 4277), (209, 4143), (223, 4193), (240, 4093), (192, 4197), (209, 4052), (207, 4029), (242, 4153), (223, 4183), (213, 4084), (183, 4128)]
         : compromised: 0.0521, honest: 0.0527
Round 009: test acc mean=0.0514 ± 0.0034 | min=0.0469 max=0.0618
         : test loss mean=156.8535 ± 81.8374
         : individual accs = ['0.051599', '0.051630', '0.050723', '0.048465', '0.051088', '0.048052', '0.049130', '0.051276', '0.047960', '0.053075', '0.050447', '0.061770', '0.053750', '0.046938', '0.048124', '0.056342', '0.055141', '0.050203', '0.052889', '0.048450']
         : correct/total = [(213, 4128), (217, 4203), (207, 4081), (210, 4333), (209, 4091), (206, 4287), (206, 4193), (223, 4349), (201, 4191), (227, 4277), (209, 4143), (259, 4193), (220, 4093), (197, 4197), (195, 4052), (227, 4029), (229, 4153), (210, 4183), (216, 4084), (200, 4128)]
         : compromised: 0.0497, honest: 0.0518
Round 010: test acc mean=0.0513 ± 0.0066 | min=0.0365 max=0.0612
         : test loss mean=12.2833 ± 11.4804
         : individual accs = ['0.059593', '0.042589', '0.057584', '0.036464', '0.057932', '0.050618', '0.057000', '0.041619', '0.053209', '0.046528', '0.051171', '0.053899', '0.050818', '0.049559', '0.061204', '0.056590', '0.058271', '0.050920', '0.045788', '0.044331']
         : correct/total = [(246, 4128), (179, 4203), (235, 4081), (158, 4333), (237, 4091), (217, 4287), (239, 4193), (181, 4349), (223, 4191), (199, 4277), (212, 4143), (226, 4193), (208, 4093), (208, 4197), (248, 4052), (228, 4029), (242, 4153), (213, 4183), (187, 4084), (183, 4128)]
         : compromised: 0.0505, honest: 0.0515

=== FINAL RESULTS ===
Dataset: femnist, Nodes: 20, Graph: fully, Aggregation: d-fedavg
Attack: directed_deviation, 20.0% compromised
Final accuracy - Compromised: 0.0505, Honest: 0.0515
Overall test accuracy: mean=0.0513 ± 0.0066
