Device: cuda
Seed: 987654321
Loading 36 LEAF FEMNIST train files...
LEAF FEMNIST train: 3597 users, 734463 samples
Loading 36 LEAF FEMNIST test files...
LEAF FEMNIST test: 3597 users, 83388 samples
Found 3597 train users, 3597 test users, 3597 common users
User sample counts range: 525 (max) to 17 (min)
Distributed ALL 3597 users across 20 clients
Users per client: 179 (with 17 clients getting +1 user)
Train partition sizes: [36360, 37070, 35957, 38262, 36024, 37732, 36921, 38328, 36867, 37683, 36507, 36915, 36007, 37001, 35681, 35453, 36585, 36801, 35964, 36345]
Test partition sizes: [4128, 4203, 4081, 4333, 4091, 4287, 4193, 4349, 4191, 4277, 4143, 4193, 4093, 4197, 4052, 4029, 4153, 4183, 4084, 4128]
  Client 0: 36360 train samples, 62 unique classes
  Client 1: 37070 train samples, 62 unique classes
  Client 2: 35957 train samples, 62 unique classes
  Client 3: 38262 train samples, 62 unique classes
  Client 4: 36024 train samples, 62 unique classes
  Client 5: 37732 train samples, 62 unique classes
  Client 6: 36921 train samples, 62 unique classes
  Client 7: 38328 train samples, 62 unique classes
  Client 8: 36867 train samples, 62 unique classes
  Client 9: 37683 train samples, 62 unique classes
  Client 10: 36507 train samples, 62 unique classes
  Client 11: 36915 train samples, 62 unique classes
  Client 12: 36007 train samples, 62 unique classes
  Client 13: 37001 train samples, 62 unique classes
  Client 14: 35681 train samples, 62 unique classes
  Client 15: 35453 train samples, 62 unique classes
  Client 16: 36585 train samples, 62 unique classes
  Client 17: 36801 train samples, 62 unique classes
  Client 18: 35964 train samples, 62 unique classes
  Client 19: 36345 train samples, 62 unique classes
Will sample 10000 samples per client per epoch
Graph: erdos, nodes: 20, edges: 99
Degree statistics: avg=9.90, min=7, max=14
Attack: Compromised 12/20 nodes: [1, 2, 3, 5, 8, 11, 12, 13, 14, 15, 17, 18]
Attack type: gaussian, lambda: 1.0
Model variant: baseline
Model parameters: 6,603,710
BALANCE algorithm:
Balance Config: BALANCEConfig(gamma=2, kappa=1, alpha=0.5, min_neighbors=1)
  - Model dimension: 6,603,710 parameters
  - Complexity: O(N×d) = O(20×6,603,710)
Initial test acc across nodes: mean=0.0162 ± 0.0138
Round 001: test acc mean=0.4523 ± 0.0436 | min=0.3722 max=0.5252
         : test loss mean=3.7670 ± 0.0359
         : individual accs = ['0.510417', '0.473233', '0.484685', '0.451881', '0.441701', '0.523676', '0.424517', '0.406530', '0.460988', '0.413374', '0.396814', '0.508228', '0.431224', '0.402669', '0.459033', '0.492926', '0.444739', '0.525221', '0.372184', '0.421754']
         : correct/total = [(2107, 4128), (1989, 4203), (1978, 4081), (1958, 4333), (1807, 4091), (2245, 4287), (1780, 4193), (1768, 4349), (1932, 4191), (1768, 4277), (1644, 4143), (2131, 4193), (1765, 4093), (1690, 4197), (1860, 4052), (1986, 4029), (1847, 4153), (2197, 4183), (1520, 4084), (1741, 4128)]
         : compromised: 0.4655, honest: 0.4325
Round 002: test acc mean=0.6682 ± 0.0232 | min=0.6129 max=0.7084
         : test loss mean=3.2074 ± 0.2264
         : individual accs = ['0.704942', '0.674994', '0.647880', '0.685207', '0.666830', '0.708421', '0.612926', '0.652104', '0.650680', '0.704700', '0.668839', '0.675888', '0.674811', '0.662378', '0.692004', '0.651526', '0.668914', '0.646665', '0.670911', '0.643169']
         : correct/total = [(2910, 4128), (2837, 4203), (2644, 4081), (2969, 4333), (2728, 4091), (3037, 4287), (2570, 4193), (2836, 4349), (2727, 4191), (3014, 4277), (2771, 4143), (2834, 4193), (2762, 4093), (2780, 4197), (2804, 4052), (2625, 4029), (2778, 4153), (2705, 4183), (2740, 4084), (2655, 4128)]
         : compromised: 0.6701, honest: 0.6653
Round 003: test acc mean=0.6872 ± 0.0317 | min=0.6136 max=0.7267
         : test loss mean=2.5051 ± 0.4133
         : individual accs = ['0.726744', '0.684511', '0.613575', '0.720055', '0.696896', '0.651738', '0.720964', '0.690044', '0.699356', '0.716390', '0.709389', '0.675650', '0.676765', '0.696926', '0.664363', '0.621494', '0.720202', '0.653120', '0.695152', '0.710998']
         : correct/total = [(3000, 4128), (2877, 4203), (2504, 4081), (3120, 4333), (2851, 4091), (2794, 4287), (3023, 4193), (3001, 4349), (2931, 4191), (3064, 4277), (2939, 4143), (2833, 4193), (2770, 4093), (2925, 4197), (2692, 4052), (2504, 4029), (2991, 4153), (2732, 4183), (2839, 4084), (2935, 4128)]
         : compromised: 0.6711, honest: 0.7115
Round 004: test acc mean=0.7316 ± 0.0342 | min=0.6528 max=0.7787
         : test loss mean=1.5867 ± 0.3357
         : individual accs = ['0.745882', '0.694266', '0.686351', '0.703900', '0.770716', '0.683928', '0.764846', '0.766843', '0.762109', '0.762217', '0.729906', '0.716909', '0.652822', '0.767453', '0.724827', '0.716059', '0.778714', '0.714320', '0.740451', '0.749031']
         : correct/total = [(3079, 4128), (2918, 4203), (2801, 4081), (3050, 4333), (3153, 4091), (2932, 4287), (3207, 4193), (3335, 4349), (3194, 4191), (3260, 4277), (3024, 4143), (3006, 4193), (2672, 4093), (3221, 4197), (2937, 4052), (2885, 4029), (3234, 4153), (2988, 4183), (3024, 4084), (3092, 4128)]
         : compromised: 0.7136, honest: 0.7585
Round 005: test acc mean=0.7756 ± 0.0179 | min=0.7432 max=0.8023
         : test loss mean=0.9521 ± 0.1432
         : individual accs = ['0.777132', '0.750416', '0.773830', '0.750981', '0.781960', '0.772568', '0.787980', '0.798804', '0.799571', '0.794014', '0.774559', '0.758168', '0.743220', '0.785085', '0.772705', '0.770414', '0.802312', '0.743964', '0.780607', '0.793605']
         : correct/total = [(3208, 4128), (3154, 4203), (3158, 4081), (3254, 4333), (3199, 4091), (3312, 4287), (3304, 4193), (3474, 4349), (3351, 4191), (3396, 4277), (3209, 4143), (3179, 4193), (3042, 4093), (3295, 4197), (3131, 4052), (3104, 4029), (3332, 4153), (3112, 4183), (3188, 4084), (3276, 4128)]
         : compromised: 0.7668, honest: 0.7888
Round 006: test acc mean=0.8098 ± 0.0079 | min=0.7953 max=0.8261
         : test loss mean=0.6610 ± 0.0400
         : individual accs = ['0.802810', '0.802284', '0.807645', '0.808447', '0.804938', '0.806391', '0.808967', '0.823178', '0.817466', '0.814590', '0.801834', '0.809444', '0.795260', '0.812962', '0.821570', '0.814842', '0.826150', '0.798948', '0.807052', '0.810320']
         : correct/total = [(3314, 4128), (3372, 4203), (3296, 4081), (3503, 4333), (3293, 4091), (3457, 4287), (3392, 4193), (3580, 4349), (3426, 4191), (3484, 4277), (3322, 4143), (3394, 4193), (3255, 4093), (3412, 4197), (3329, 4052), (3283, 4029), (3431, 4153), (3342, 4183), (3296, 4084), (3345, 4128)]
         : compromised: 0.8085, honest: 0.8116
Round 007: test acc mean=0.8265 ± 0.0057 | min=0.8163 max=0.8361
         : test loss mean=0.5598 ± 0.0245
         : individual accs = ['0.818314', '0.836069', '0.826023', '0.831295', '0.817160', '0.826685', '0.830670', '0.835594', '0.829874', '0.830255', '0.816317', '0.825662', '0.818226', '0.827972', '0.832428', '0.827252', '0.830243', '0.822854', '0.826396', '0.821705']
         : correct/total = [(3378, 4128), (3514, 4203), (3371, 4081), (3602, 4333), (3343, 4091), (3544, 4287), (3483, 4193), (3634, 4349), (3478, 4191), (3551, 4277), (3382, 4143), (3462, 4193), (3349, 4093), (3475, 4197), (3373, 4052), (3333, 4029), (3448, 4153), (3442, 4183), (3375, 4084), (3392, 4128)]
         : compromised: 0.8276, honest: 0.8250
Round 008: test acc mean=0.8320 ± 0.0072 | min=0.8123 max=0.8425
         : test loss mean=0.5177 ± 0.0201
         : individual accs = ['0.829700', '0.834404', '0.828718', '0.838911', '0.825959', '0.841381', '0.838779', '0.839733', '0.832975', '0.837737', '0.821627', '0.834725', '0.825556', '0.829878', '0.842547', '0.836188', '0.830002', '0.829070', '0.829334', '0.812258']
         : correct/total = [(3425, 4128), (3507, 4203), (3382, 4081), (3635, 4333), (3379, 4091), (3607, 4287), (3517, 4193), (3652, 4349), (3491, 4191), (3583, 4277), (3404, 4143), (3500, 4193), (3379, 4093), (3483, 4197), (3414, 4052), (3369, 4029), (3447, 4153), (3468, 4183), (3387, 4084), (3353, 4128)]
         : compromised: 0.8336, honest: 0.8295
Round 009: test acc mean=0.8413 ± 0.0057 | min=0.8294 max=0.8506
         : test loss mean=0.4859 ± 0.0171
         : individual accs = ['0.836240', '0.846062', '0.840725', '0.846296', '0.829382', '0.847213', '0.846888', '0.846172', '0.850632', '0.848726', '0.835868', '0.838302', '0.841437', '0.839647', '0.845262', '0.841648', '0.831447', '0.839828', '0.837414', '0.836240']
         : correct/total = [(3452, 4128), (3556, 4203), (3431, 4081), (3667, 4333), (3393, 4091), (3632, 4287), (3551, 4193), (3680, 4349), (3565, 4191), (3630, 4277), (3463, 4143), (3515, 4193), (3444, 4093), (3524, 4197), (3425, 4052), (3391, 4029), (3453, 4153), (3513, 4183), (3420, 4084), (3452, 4128)]
         : compromised: 0.8429, honest: 0.8389
Round 010: test acc mean=0.8470 ± 0.0052 | min=0.8371 max=0.8572
         : test loss mean=0.4676 ± 0.0178
         : individual accs = ['0.842054', '0.857245', '0.842441', '0.850912', '0.838915', '0.847446', '0.854519', '0.851460', '0.851825', '0.848960', '0.837075', '0.842356', '0.843880', '0.849178', '0.850197', '0.851080', '0.841801', '0.848195', '0.847209', '0.844234']
         : correct/total = [(3476, 4128), (3603, 4203), (3438, 4081), (3687, 4333), (3432, 4091), (3633, 4287), (3583, 4193), (3703, 4349), (3570, 4191), (3631, 4277), (3468, 4143), (3532, 4193), (3454, 4093), (3564, 4197), (3445, 4052), (3429, 4029), (3496, 4153), (3548, 4183), (3460, 4084), (3485, 4128)]
         : compromised: 0.8485, honest: 0.8449

=== FINAL RESULTS ===
Dataset: femnist, Nodes: 20, Graph: erdos, Aggregation: balance
Attack: gaussian, 60.0% compromised
Final accuracy - Compromised: 0.8485, Honest: 0.8449
Overall test accuracy: mean=0.8470 ± 0.0052

=== BALANCE SUMMARY ===
Node 0: acceptance=0.417
Node 1: acceptance=0.500
Node 2: acceptance=0.500
Node 3: acceptance=0.571
Node 4: acceptance=0.333
Node 5: acceptance=0.400
Node 6: acceptance=0.333
Node 7: acceptance=0.273
Node 8: acceptance=0.286
Node 9: acceptance=0.545
Node 10: acceptance=0.500
Node 11: acceptance=0.333
Node 12: acceptance=0.500
Node 13: acceptance=0.333
Node 14: acceptance=0.357
Node 15: acceptance=0.444
Node 16: acceptance=0.286
Node 17: acceptance=0.625
Node 18: acceptance=0.333
Node 19: acceptance=0.300

=== PARALLEL EXECUTION TIME (realistic for distributed system) ===
  COMMUNICATION (max across nodes):
    - Full model transfer: 0.000s (0.0%)
  COMPUTATION (max across nodes):
    - Filtering: 0.055s (79.7%)
    - Aggregation: 0.014s (20.3%)
  TOTALS:
    - Total computation: 0.069s (100.0%)
    - Total communication: 0.000s (0.0%)
    - Total parallel time: 0.069s

=== PER-NODE AVERAGE TIME ===
  - Filtering: 0.036s
  - Aggregation: 0.004s
  - Model transfer: 0.000s
  - Total per node: 0.041s

=== TOTAL COMPUTATIONAL WORK (sum across all nodes) ===
  - Total filtering: 0.723s
  - Total aggregation: 0.089s
  - Total model transfer: 0.000s
  - Grand total: 0.812s
  - Mean acceptance rate: 0.409

BALANCE Algorithm Properties:
  - Model dimension: 6,603,710
  - No compression: Full parameter comparison
  - Theoretical complexity: O(deg(i)×d)
  - Approach: Full parameter filtering + averaging
