Device: cuda
Seed: 987654321
Loading 36 LEAF FEMNIST train files...
LEAF FEMNIST train: 3597 users, 734463 samples
Loading 36 LEAF FEMNIST test files...
LEAF FEMNIST test: 3597 users, 83388 samples
Found 3597 train users, 3597 test users, 3597 common users
User sample counts range: 525 (max) to 17 (min)
Distributed ALL 3597 users across 20 clients
Users per client: 179 (with 17 clients getting +1 user)
Train partition sizes: [36360, 37070, 35957, 38262, 36024, 37732, 36921, 38328, 36867, 37683, 36507, 36915, 36007, 37001, 35681, 35453, 36585, 36801, 35964, 36345]
Test partition sizes: [4128, 4203, 4081, 4333, 4091, 4287, 4193, 4349, 4191, 4277, 4143, 4193, 4093, 4197, 4052, 4029, 4153, 4183, 4084, 4128]
  Client 0: 36360 train samples, 62 unique classes
  Client 1: 37070 train samples, 62 unique classes
  Client 2: 35957 train samples, 62 unique classes
  Client 3: 38262 train samples, 62 unique classes
  Client 4: 36024 train samples, 62 unique classes
  Client 5: 37732 train samples, 62 unique classes
  Client 6: 36921 train samples, 62 unique classes
  Client 7: 38328 train samples, 62 unique classes
  Client 8: 36867 train samples, 62 unique classes
  Client 9: 37683 train samples, 62 unique classes
  Client 10: 36507 train samples, 62 unique classes
  Client 11: 36915 train samples, 62 unique classes
  Client 12: 36007 train samples, 62 unique classes
  Client 13: 37001 train samples, 62 unique classes
  Client 14: 35681 train samples, 62 unique classes
  Client 15: 35453 train samples, 62 unique classes
  Client 16: 36585 train samples, 62 unique classes
  Client 17: 36801 train samples, 62 unique classes
  Client 18: 35964 train samples, 62 unique classes
  Client 19: 36345 train samples, 62 unique classes
Will sample 10000 samples per client per epoch
Graph: erdos, nodes: 20, edges: 99
Degree statistics: avg=9.90, min=7, max=14
Attack: Compromised 2/20 nodes: [5, 13]
Attack type: backdoor, lambda: 1.0
Backdoor target label: 0, trigger size: 4
Model variant: baseline
Model parameters: 6,603,710
Initial test acc across nodes: mean=0.0162 ± 0.0138
Backdoor attack: Created poisoned datasets for 2 compromised nodes
Round 001: test acc mean=0.5487 ± 0.0143 | min=0.5257 max=0.5716
         : test loss mean=1.7139 ± 0.0574
         : individual accs = ['0.538275', '0.564121', '0.546190', '0.555504', '0.559032', '0.554934', '0.539232', '0.539204', '0.570031', '0.540566', '0.525706', '0.547579', '0.549230', '0.571599', '0.565400', '0.531646', '0.526848', '0.558929', '0.563173', '0.527616']
         : correct/total = [(2222, 4128), (2371, 4203), (2229, 4081), (2407, 4333), (2287, 4091), (2379, 4287), (2261, 4193), (2345, 4349), (2389, 4191), (2312, 4277), (2178, 4143), (2296, 4193), (2248, 4093), (2399, 4197), (2291, 4052), (2142, 4029), (2188, 4153), (2338, 4183), (2300, 4084), (2178, 4128)]
         : compromised: 0.5633, honest: 0.5471
Round 002: test acc mean=0.7338 ± 0.0070 | min=0.7190 max=0.7441
         : test loss mean=0.8945 ± 0.0281
         : individual accs = ['0.727713', '0.732810', '0.721882', '0.733903', '0.730384', '0.744110', '0.737420', '0.739020', '0.739919', '0.742810', '0.734733', '0.731696', '0.741510', '0.729807', '0.743583', '0.736163', '0.724296', '0.728186', '0.736778', '0.718992']
         : correct/total = [(3004, 4128), (3080, 4203), (2946, 4081), (3180, 4333), (2988, 4091), (3190, 4287), (3092, 4193), (3214, 4349), (3101, 4191), (3177, 4277), (3044, 4143), (3068, 4193), (3035, 4093), (3063, 4197), (3013, 4052), (2966, 4029), (3008, 4153), (3046, 4183), (3009, 4084), (2968, 4128)]
         : compromised: 0.7370, honest: 0.7334
Round 003: test acc mean=0.7651 ± 0.0112 | min=0.7434 max=0.7860
         : test loss mean=0.7440 ± 0.0428
         : individual accs = ['0.750000', '0.778967', '0.743445', '0.766213', '0.752872', '0.773035', '0.768662', '0.754886', '0.785970', '0.785364', '0.761525', '0.752445', '0.762766', '0.761496', '0.764067', '0.759990', '0.776065', '0.774803', '0.764202', '0.765262']
         : correct/total = [(3096, 4128), (3274, 4203), (3034, 4081), (3320, 4333), (3080, 4091), (3314, 4287), (3223, 4193), (3283, 4349), (3294, 4191), (3359, 4277), (3155, 4143), (3155, 4193), (3122, 4093), (3196, 4197), (3096, 4052), (3062, 4029), (3223, 4153), (3241, 4183), (3121, 4084), (3159, 4128)]
         : compromised: 0.7673, honest: 0.7649
Round 004: test acc mean=0.7969 ± 0.0082 | min=0.7829 max=0.8125
         : test loss mean=0.6392 ± 0.0296
         : individual accs = ['0.789729', '0.812515', '0.789267', '0.792753', '0.782938', '0.790763', '0.796566', '0.809381', '0.803388', '0.802198', '0.788559', '0.792034', '0.795993', '0.795092', '0.800839', '0.808637', '0.793884', '0.804686', '0.803869', '0.784884']
         : correct/total = [(3260, 4128), (3415, 4203), (3221, 4081), (3435, 4333), (3203, 4091), (3390, 4287), (3340, 4193), (3520, 4349), (3367, 4191), (3431, 4277), (3267, 4143), (3321, 4193), (3258, 4093), (3337, 4197), (3245, 4052), (3258, 4029), (3297, 4153), (3366, 4183), (3283, 4084), (3240, 4128)]
         : compromised: 0.7929, honest: 0.7973
Round 005: test acc mean=0.8094 ± 0.0076 | min=0.7955 max=0.8268
         : test loss mean=0.5939 ± 0.0232
         : individual accs = ['0.795543', '0.817273', '0.809360', '0.810524', '0.797849', '0.807558', '0.817076', '0.808232', '0.821522', '0.805237', '0.798697', '0.804436', '0.812118', '0.826781', '0.804541', '0.810127', '0.806164', '0.811140', '0.808031', '0.815891']
         : correct/total = [(3284, 4128), (3435, 4203), (3303, 4081), (3512, 4333), (3264, 4091), (3462, 4287), (3426, 4193), (3515, 4349), (3443, 4191), (3444, 4277), (3309, 4143), (3373, 4193), (3324, 4093), (3470, 4197), (3260, 4052), (3264, 4029), (3348, 4153), (3393, 4183), (3300, 4084), (3368, 4128)]
         : compromised: 0.8172, honest: 0.8085
Round 006: test acc mean=0.8101 ± 0.0084 | min=0.7939 max=0.8246
         : test loss mean=0.5816 ± 0.0260
         : individual accs = ['0.814438', '0.820604', '0.812791', '0.810985', '0.793938', '0.818288', '0.805390', '0.809152', '0.824624', '0.819967', '0.797248', '0.803482', '0.805522', '0.808911', '0.820582', '0.801440', '0.805442', '0.816161', '0.814887', '0.798692']
         : correct/total = [(3362, 4128), (3449, 4203), (3317, 4081), (3514, 4333), (3248, 4091), (3508, 4287), (3377, 4193), (3519, 4349), (3456, 4191), (3507, 4277), (3303, 4143), (3369, 4193), (3297, 4093), (3395, 4197), (3325, 4052), (3229, 4029), (3345, 4153), (3414, 4183), (3328, 4084), (3297, 4128)]
         : compromised: 0.8136, honest: 0.8097
Round 007: test acc mean=0.8235 ± 0.0057 | min=0.8144 max=0.8340
         : test loss mean=0.5386 ± 0.0245
         : individual accs = ['0.821705', '0.826077', '0.823573', '0.826910', '0.818137', '0.819687', '0.830193', '0.829846', '0.821761', '0.830021', '0.815110', '0.833532', '0.817493', '0.823445', '0.824778', '0.823529', '0.818685', '0.817356', '0.833986', '0.814438']
         : correct/total = [(3392, 4128), (3472, 4203), (3361, 4081), (3583, 4333), (3347, 4091), (3514, 4287), (3481, 4193), (3609, 4349), (3444, 4191), (3550, 4277), (3377, 4143), (3495, 4193), (3346, 4093), (3456, 4197), (3342, 4052), (3318, 4029), (3400, 4153), (3419, 4183), (3406, 4084), (3362, 4128)]
         : compromised: 0.8216, honest: 0.8237
Round 008: test acc mean=0.8268 ± 0.0086 | min=0.8028 max=0.8446
         : test loss mean=0.5217 ± 0.0269
         : individual accs = ['0.820979', '0.824649', '0.828963', '0.840526', '0.816426', '0.822020', '0.833532', '0.844562', '0.825340', '0.825111', '0.828144', '0.829478', '0.827266', '0.826066', '0.829961', '0.831720', '0.826391', '0.817117', '0.834231', '0.802810']
         : correct/total = [(3389, 4128), (3466, 4203), (3383, 4081), (3642, 4333), (3340, 4091), (3524, 4287), (3495, 4193), (3673, 4349), (3459, 4191), (3529, 4277), (3431, 4143), (3478, 4193), (3386, 4093), (3467, 4197), (3363, 4052), (3351, 4029), (3432, 4153), (3418, 4183), (3407, 4084), (3314, 4128)]
         : compromised: 0.8240, honest: 0.8271
Round 009: test acc mean=0.8287 ± 0.0094 | min=0.8052 max=0.8435
         : test loss mean=0.5174 ± 0.0276
         : individual accs = ['0.824370', '0.833690', '0.829209', '0.843526', '0.832315', '0.825052', '0.839494', '0.843182', '0.835600', '0.835866', '0.815593', '0.830670', '0.827266', '0.821063', '0.831441', '0.816580', '0.819648', '0.835047', '0.828599', '0.805233']
         : correct/total = [(3403, 4128), (3504, 4203), (3384, 4081), (3655, 4333), (3405, 4091), (3537, 4287), (3520, 4193), (3667, 4349), (3502, 4191), (3575, 4277), (3379, 4143), (3483, 4193), (3386, 4093), (3446, 4197), (3369, 4052), (3290, 4029), (3404, 4153), (3493, 4183), (3384, 4084), (3324, 4128)]
         : compromised: 0.8231, honest: 0.8293
Round 010: test acc mean=0.8286 ± 0.0104 | min=0.8103 max=0.8501
         : test loss mean=0.5079 ± 0.0237
         : individual accs = ['0.810320', '0.850107', '0.835580', '0.818371', '0.825471', '0.838348', '0.817315', '0.824787', '0.838702', '0.845920', '0.830558', '0.831624', '0.817493', '0.835597', '0.823791', '0.812112', '0.821334', '0.833612', '0.827130', '0.832849']
         : correct/total = [(3345, 4128), (3573, 4203), (3410, 4081), (3546, 4333), (3377, 4091), (3594, 4287), (3427, 4193), (3587, 4349), (3515, 4191), (3618, 4277), (3441, 4143), (3487, 4193), (3346, 4093), (3507, 4197), (3338, 4052), (3272, 4029), (3411, 4153), (3487, 4183), (3378, 4084), (3438, 4128)]
         : compromised: 0.8370, honest: 0.8276

=== FINAL RESULTS ===
Dataset: femnist, Nodes: 20, Graph: erdos, Aggregation: krum
Attack: backdoor, 10.0% compromised
Final accuracy - Compromised: 0.8370, Honest: 0.8276
Overall test accuracy: mean=0.8286 ± 0.0104

=== BACKDOOR ATTACK SUCCESS RATE (ASR) ===
Target label: 0
Trigger size: 4x4
Overall ASR: 0.0586 ± 0.0130
Honest nodes ASR: 0.0589 ± 0.0136
Compromised nodes ASR: 0.0560 ± 0.0028
Note: Higher ASR indicates more successful backdoor attack
