Device: cuda
Seed: 987654321
Loading 36 LEAF FEMNIST train files...
LEAF FEMNIST train: 3597 users, 734463 samples
Loading 36 LEAF FEMNIST test files...
LEAF FEMNIST test: 3597 users, 83388 samples
Found 3597 train users, 3597 test users, 3597 common users
User sample counts range: 525 (max) to 17 (min)
Distributed ALL 3597 users across 20 clients
Users per client: 179 (with 17 clients getting +1 user)
Train partition sizes: [36360, 37070, 35957, 38262, 36024, 37732, 36921, 38328, 36867, 37683, 36507, 36915, 36007, 37001, 35681, 35453, 36585, 36801, 35964, 36345]
Test partition sizes: [4128, 4203, 4081, 4333, 4091, 4287, 4193, 4349, 4191, 4277, 4143, 4193, 4093, 4197, 4052, 4029, 4153, 4183, 4084, 4128]
  Client 0: 36360 train samples, 62 unique classes
  Client 1: 37070 train samples, 62 unique classes
  Client 2: 35957 train samples, 62 unique classes
  Client 3: 38262 train samples, 62 unique classes
  Client 4: 36024 train samples, 62 unique classes
  Client 5: 37732 train samples, 62 unique classes
  Client 6: 36921 train samples, 62 unique classes
  Client 7: 38328 train samples, 62 unique classes
  Client 8: 36867 train samples, 62 unique classes
  Client 9: 37683 train samples, 62 unique classes
  Client 10: 36507 train samples, 62 unique classes
  Client 11: 36915 train samples, 62 unique classes
  Client 12: 36007 train samples, 62 unique classes
  Client 13: 37001 train samples, 62 unique classes
  Client 14: 35681 train samples, 62 unique classes
  Client 15: 35453 train samples, 62 unique classes
  Client 16: 36585 train samples, 62 unique classes
  Client 17: 36801 train samples, 62 unique classes
  Client 18: 35964 train samples, 62 unique classes
  Client 19: 36345 train samples, 62 unique classes
Will sample 10000 samples per client per epoch
Graph: erdos, nodes: 20, edges: 48
Degree statistics: avg=4.80, min=2, max=7
Attack: Compromised 10/20 nodes: [1, 2, 5, 11, 12, 13, 14, 15, 17, 18]
Attack type: backdoor, lambda: 1.0
Backdoor target label: 0, trigger size: 4
Model variant: baseline
Model parameters: 6,603,710
Initial test acc across nodes: mean=0.0162 ± 0.0138
Backdoor attack: Created poisoned datasets for 10 compromised nodes
Round 001: test acc mean=0.0207 ± 0.0158 | min=0.0042 max=0.0583
         : test loss mean=58724.2772 ± 84300.9004
         : individual accs = ['0.005329', '0.058292', '0.017153', '0.013386', '0.010022', '0.051551', '0.020272', '0.018395', '0.005488', '0.004209', '0.016655', '0.007870', '0.024432', '0.018346', '0.021224', '0.043435', '0.045268', '0.020320', '0.008815', '0.004360']
         : correct/total = [(22, 4128), (245, 4203), (70, 4081), (58, 4333), (41, 4091), (221, 4287), (85, 4193), (80, 4349), (23, 4191), (18, 4277), (69, 4143), (33, 4193), (100, 4093), (77, 4197), (86, 4052), (175, 4029), (188, 4153), (85, 4183), (36, 4084), (18, 4128)]
         : compromised: 0.0271, honest: 0.0143
Round 002: test acc mean=0.0490 ± 0.0061 | min=0.0351 max=0.0602
         : test loss mean=nan ± nan
         : individual accs = ['0.049419', '0.048775', '0.046312', '0.039926', '0.052066', '0.052018', '0.048891', '0.052656', '0.053686', '0.035305', '0.051171', '0.035058', '0.047398', '0.048844', '0.054788', '0.055845', '0.047436', '0.049247', '0.060235', '0.050630']
         : correct/total = [(204, 4128), (205, 4203), (189, 4081), (173, 4333), (213, 4091), (223, 4287), (205, 4193), (229, 4349), (225, 4191), (151, 4277), (212, 4143), (147, 4193), (194, 4093), (205, 4197), (222, 4052), (225, 4029), (197, 4153), (206, 4183), (246, 4084), (209, 4128)]
         : compromised: 0.0499, honest: 0.0481
Round 003: test acc mean=0.0486 ± 0.0074 | min=0.0291 max=0.0616
         : test loss mean=nan ± nan
         : individual accs = ['0.049419', '0.048775', '0.049743', '0.039926', '0.052066', '0.052018', '0.041498', '0.050126', '0.051062', '0.050736', '0.051412', '0.035058', '0.047398', '0.029068', '0.054788', '0.061554', '0.047436', '0.049247', '0.060235', '0.050630']
         : correct/total = [(204, 4128), (205, 4203), (203, 4081), (173, 4333), (213, 4091), (223, 4287), (174, 4193), (218, 4349), (214, 4191), (217, 4277), (213, 4143), (147, 4193), (194, 4093), (122, 4197), (222, 4052), (248, 4029), (197, 4153), (206, 4183), (246, 4084), (209, 4128)]
         : compromised: 0.0488, honest: 0.0484
Round 004: test acc mean=0.0482 ± 0.0056 | min=0.0291 max=0.0548
         : test loss mean=nan ± nan
         : individual accs = ['0.049419', '0.048775', '0.049743', '0.046619', '0.051821', '0.042454', '0.041498', '0.044608', '0.051062', '0.050736', '0.051171', '0.048891', '0.047398', '0.029068', '0.054788', '0.054604', '0.047436', '0.049247', '0.054358', '0.050388']
         : correct/total = [(204, 4128), (205, 4203), (203, 4081), (202, 4333), (212, 4091), (182, 4287), (174, 4193), (194, 4349), (214, 4191), (217, 4277), (212, 4143), (205, 4193), (194, 4093), (122, 4197), (222, 4052), (220, 4029), (197, 4153), (206, 4183), (222, 4084), (208, 4128)]
         : compromised: 0.0479, honest: 0.0485
Round 005: test acc mean=0.0487 ± 0.0037 | min=0.0415 max=0.0548
         : test loss mean=nan ± nan
         : individual accs = ['0.049419', '0.048775', '0.049743', '0.046619', '0.044243', '0.042454', '0.041498', '0.043228', '0.051062', '0.050736', '0.051895', '0.048891', '0.047398', '0.047653', '0.054788', '0.054604', '0.047436', '0.049247', '0.054358', '0.050630']
         : correct/total = [(204, 4128), (205, 4203), (203, 4081), (202, 4333), (181, 4091), (182, 4287), (174, 4193), (188, 4349), (214, 4191), (217, 4277), (215, 4143), (205, 4193), (194, 4093), (200, 4197), (222, 4052), (220, 4029), (197, 4153), (206, 4183), (222, 4084), (209, 4128)]
         : compromised: 0.0498, honest: 0.0477
Round 006: test acc mean=0.0483 ± 0.0037 | min=0.0415 max=0.0548
         : test loss mean=nan ± nan
         : individual accs = ['0.049419', '0.048775', '0.049743', '0.046619', '0.044243', '0.042454', '0.041498', '0.045758', '0.051062', '0.050736', '0.048274', '0.048891', '0.047398', '0.047653', '0.054788', '0.054604', '0.047436', '0.049247', '0.054358', '0.043120']
         : correct/total = [(204, 4128), (205, 4203), (203, 4081), (202, 4333), (181, 4091), (182, 4287), (174, 4193), (199, 4349), (214, 4191), (217, 4277), (200, 4143), (205, 4193), (194, 4093), (200, 4197), (222, 4052), (220, 4029), (197, 4153), (206, 4183), (222, 4084), (178, 4128)]
         : compromised: 0.0498, honest: 0.0468
Round 007: test acc mean=0.0479 ± 0.0040 | min=0.0415 max=0.0548
         : test loss mean=nan ± nan
         : individual accs = ['0.049419', '0.048775', '0.049743', '0.046619', '0.044243', '0.042454', '0.041498', '0.043228', '0.051062', '0.050736', '0.042964', '0.048891', '0.047398', '0.047653', '0.054788', '0.054604', '0.047436', '0.049247', '0.054358', '0.043120']
         : correct/total = [(204, 4128), (205, 4203), (203, 4081), (202, 4333), (181, 4091), (182, 4287), (174, 4193), (188, 4349), (214, 4191), (217, 4277), (178, 4143), (205, 4193), (194, 4093), (200, 4197), (222, 4052), (220, 4029), (197, 4153), (206, 4183), (222, 4084), (178, 4128)]
         : compromised: 0.0498, honest: 0.0460
Round 008: test acc mean=0.0489 ± 0.0035 | min=0.0415 max=0.0548
         : test loss mean=nan ± nan
         : individual accs = ['0.049419', '0.048775', '0.049743', '0.046619', '0.044243', '0.042454', '0.041498', '0.050126', '0.051062', '0.050736', '0.051412', '0.048891', '0.047398', '0.047653', '0.054788', '0.054604', '0.047436', '0.049247', '0.054358', '0.047965']
         : correct/total = [(204, 4128), (205, 4203), (203, 4081), (202, 4333), (181, 4091), (182, 4287), (174, 4193), (218, 4349), (214, 4191), (217, 4277), (213, 4143), (205, 4193), (194, 4093), (200, 4197), (222, 4052), (220, 4029), (197, 4153), (206, 4183), (222, 4084), (198, 4128)]
         : compromised: 0.0498, honest: 0.0481
Round 009: test acc mean=0.0487 ± 0.0037 | min=0.0415 max=0.0548
         : test loss mean=nan ± nan
         : individual accs = ['0.049419', '0.048775', '0.049743', '0.046619', '0.044243', '0.042454', '0.041498', '0.043228', '0.051062', '0.050736', '0.051412', '0.048891', '0.047398', '0.047653', '0.054788', '0.054604', '0.047436', '0.049247', '0.054358', '0.050388']
         : correct/total = [(204, 4128), (205, 4203), (203, 4081), (202, 4333), (181, 4091), (182, 4287), (174, 4193), (188, 4349), (214, 4191), (217, 4277), (213, 4143), (205, 4193), (194, 4093), (200, 4197), (222, 4052), (220, 4029), (197, 4153), (206, 4183), (222, 4084), (208, 4128)]
         : compromised: 0.0498, honest: 0.0476
Round 010: test acc mean=0.0485 ± 0.0042 | min=0.0383 max=0.0548
         : test loss mean=nan ± nan
         : individual accs = ['0.049419', '0.048775', '0.049743', '0.046619', '0.051821', '0.042454', '0.041498', '0.044608', '0.051062', '0.050736', '0.051412', '0.048891', '0.047398', '0.047653', '0.054788', '0.054604', '0.047436', '0.049247', '0.054358', '0.038275']
         : correct/total = [(204, 4128), (205, 4203), (203, 4081), (202, 4333), (212, 4091), (182, 4287), (174, 4193), (194, 4349), (214, 4191), (217, 4277), (213, 4143), (205, 4193), (194, 4093), (200, 4197), (222, 4052), (220, 4029), (197, 4153), (206, 4183), (222, 4084), (158, 4128)]
         : compromised: 0.0498, honest: 0.0473

=== FINAL RESULTS ===
Dataset: femnist, Nodes: 20, Graph: erdos, Aggregation: d-fedavg
Attack: backdoor, 50.0% compromised
Final accuracy - Compromised: 0.0498, Honest: 0.0473
Overall test accuracy: mean=0.0485 ± 0.0042

=== BACKDOOR ATTACK SUCCESS RATE (ASR) ===
Target label: 0
Trigger size: 4x4
Overall ASR: 0.7500 ± 0.4330
Honest nodes ASR: 0.6000 ± 0.4899
Compromised nodes ASR: 0.9000 ± 0.3000
Note: Higher ASR indicates more successful backdoor attack
