Device: cuda
Seed: 987654321
Loading 36 LEAF FEMNIST train files...
LEAF FEMNIST train: 3597 users, 734463 samples
Loading 36 LEAF FEMNIST test files...
LEAF FEMNIST test: 3597 users, 83388 samples
Found 3597 train users, 3597 test users, 3597 common users
User sample counts range: 525 (max) to 17 (min)
Distributed ALL 3597 users across 20 clients
Users per client: 179 (with 17 clients getting +1 user)
Train partition sizes: [36360, 37070, 35957, 38262, 36024, 37732, 36921, 38328, 36867, 37683, 36507, 36915, 36007, 37001, 35681, 35453, 36585, 36801, 35964, 36345]
Test partition sizes: [4128, 4203, 4081, 4333, 4091, 4287, 4193, 4349, 4191, 4277, 4143, 4193, 4093, 4197, 4052, 4029, 4153, 4183, 4084, 4128]
  Client 0: 36360 train samples, 62 unique classes
  Client 1: 37070 train samples, 62 unique classes
  Client 2: 35957 train samples, 62 unique classes
  Client 3: 38262 train samples, 62 unique classes
  Client 4: 36024 train samples, 62 unique classes
  Client 5: 37732 train samples, 62 unique classes
  Client 6: 36921 train samples, 62 unique classes
  Client 7: 38328 train samples, 62 unique classes
  Client 8: 36867 train samples, 62 unique classes
  Client 9: 37683 train samples, 62 unique classes
  Client 10: 36507 train samples, 62 unique classes
  Client 11: 36915 train samples, 62 unique classes
  Client 12: 36007 train samples, 62 unique classes
  Client 13: 37001 train samples, 62 unique classes
  Client 14: 35681 train samples, 62 unique classes
  Client 15: 35453 train samples, 62 unique classes
  Client 16: 36585 train samples, 62 unique classes
  Client 17: 36801 train samples, 62 unique classes
  Client 18: 35964 train samples, 62 unique classes
  Client 19: 36345 train samples, 62 unique classes
Will sample 10000 samples per client per epoch
Graph: ring, nodes: 20, edges: 20
Degree statistics: avg=2.00, min=2, max=2
Attack: Compromised 12/20 nodes: [1, 2, 3, 5, 8, 11, 12, 13, 14, 15, 17, 18]
Attack type: backdoor, lambda: 1.0
Backdoor target label: 0, trigger size: 4
Model variant: baseline
Model parameters: 6,603,710
Initial test acc across nodes: mean=0.0168 ± 0.0139
Backdoor attack: Created poisoned datasets for 12 compromised nodes
Round 001: test acc mean=0.0182 ± 0.0181 | min=0.0034 max=0.0542
         : test loss mean=99948.5550 ± 152725.8426
         : individual accs = ['0.003391', '0.017606', '0.053418', '0.006924', '0.008800', '0.004432', '0.013356', '0.009198', '0.004772', '0.017769', '0.050447', '0.003816', '0.054239', '0.049559', '0.032577', '0.008439', '0.006983', '0.007172', '0.006611', '0.004603']
         : correct/total = [(14, 4128), (74, 4203), (218, 4081), (30, 4333), (36, 4091), (19, 4287), (56, 4193), (40, 4349), (20, 4191), (76, 4277), (209, 4143), (16, 4193), (222, 4093), (208, 4197), (132, 4052), (34, 4029), (29, 4153), (30, 4183), (27, 4084), (19, 4128)]
         : compromised: 0.0208, honest: 0.0143
Round 002: test acc mean=0.0484 ± 0.0055 | min=0.0367 max=0.0549
         : test loss mean=nan ± nan
         : individual accs = ['0.045785', '0.048775', '0.053418', '0.048465', '0.051088', '0.045953', '0.050799', '0.045068', '0.049630', '0.036708', '0.039585', '0.036728', '0.054239', '0.049083', '0.051826', '0.054852', '0.054418', '0.053311', '0.054358', '0.044331']
         : correct/total = [(189, 4128), (205, 4203), (218, 4081), (210, 4333), (209, 4091), (197, 4287), (213, 4193), (196, 4349), (208, 4191), (157, 4277), (164, 4143), (154, 4193), (222, 4093), (206, 4197), (210, 4052), (221, 4029), (226, 4153), (223, 4183), (222, 4084), (183, 4128)]
         : compromised: 0.0501, honest: 0.0460
Round 003: test acc mean=0.0494 ± 0.0055 | min=0.0367 max=0.0583
         : test loss mean=nan ± nan
         : individual accs = ['0.048934', '0.050202', '0.053418', '0.043157', '0.052554', '0.045253', '0.050799', '0.045068', '0.049630', '0.036708', '0.039585', '0.053899', '0.054239', '0.049083', '0.051826', '0.056590', '0.058271', '0.050920', '0.054358', '0.043847']
         : correct/total = [(202, 4128), (211, 4203), (218, 4081), (187, 4333), (215, 4091), (194, 4287), (213, 4193), (196, 4349), (208, 4191), (157, 4277), (164, 4143), (226, 4193), (222, 4093), (206, 4197), (210, 4052), (228, 4029), (242, 4153), (213, 4183), (222, 4084), (181, 4128)]
         : compromised: 0.0510, honest: 0.0470
Round 004: test acc mean=0.0479 ± 0.0035 | min=0.0426 max=0.0542
         : test loss mean=nan ± nan
         : individual accs = ['0.048934', '0.042589', '0.053418', '0.043157', '0.043021', '0.045253', '0.050799', '0.045068', '0.049630', '0.047697', '0.047309', '0.045314', '0.054239', '0.049083', '0.051826', '0.051378', '0.049362', '0.051159', '0.045788', '0.043847']
         : correct/total = [(202, 4128), (179, 4203), (218, 4081), (187, 4333), (176, 4091), (194, 4287), (213, 4193), (196, 4349), (208, 4191), (204, 4277), (196, 4143), (190, 4193), (222, 4093), (206, 4197), (210, 4052), (207, 4029), (205, 4153), (214, 4183), (187, 4084), (181, 4128)]
         : compromised: 0.0486, honest: 0.0470
Round 005: test acc mean=0.0468 ± 0.0063 | min=0.0365 max=0.0583
         : test loss mean=nan ± nan
         : individual accs = ['0.045785', '0.042589', '0.053418', '0.036464', '0.043266', '0.045253', '0.050799', '0.045068', '0.049630', '0.036708', '0.039585', '0.036728', '0.054239', '0.049083', '0.051826', '0.056590', '0.058271', '0.050920', '0.045788', '0.044331']
         : correct/total = [(189, 4128), (179, 4203), (218, 4081), (158, 4333), (177, 4091), (194, 4287), (213, 4193), (196, 4349), (208, 4191), (157, 4277), (164, 4143), (154, 4193), (222, 4093), (206, 4197), (210, 4052), (228, 4029), (242, 4153), (213, 4183), (187, 4084), (183, 4128)]
         : compromised: 0.0477, honest: 0.0455
Round 006: test acc mean=0.0445 ± 0.0129 | min=0.0083 max=0.0583
         : test loss mean=nan ± nan
         : individual accs = ['0.047238', '0.048775', '0.053418', '0.008308', '0.010755', '0.045253', '0.050799', '0.045068', '0.049630', '0.036708', '0.039585', '0.036728', '0.054239', '0.049083', '0.051826', '0.056590', '0.058271', '0.050920', '0.048482', '0.048692']
         : correct/total = [(195, 4128), (205, 4203), (218, 4081), (36, 4333), (44, 4091), (194, 4287), (213, 4193), (196, 4349), (208, 4191), (157, 4277), (164, 4143), (154, 4193), (222, 4093), (206, 4197), (210, 4052), (228, 4029), (242, 4153), (213, 4183), (198, 4084), (201, 4128)]
         : compromised: 0.0461, honest: 0.0421
Round 007: test acc mean=0.0481 ± 0.0058 | min=0.0367 max=0.0583
         : test loss mean=nan ± nan
         : individual accs = ['0.047238', '0.042589', '0.053418', '0.048465', '0.051088', '0.045253', '0.050799', '0.045068', '0.049630', '0.036708', '0.039585', '0.036728', '0.054239', '0.049083', '0.051826', '0.056590', '0.058271', '0.050920', '0.045788', '0.048692']
         : correct/total = [(195, 4128), (179, 4203), (218, 4081), (210, 4333), (209, 4091), (194, 4287), (213, 4193), (196, 4349), (208, 4191), (157, 4277), (164, 4143), (154, 4193), (222, 4093), (206, 4197), (210, 4052), (228, 4029), (242, 4153), (213, 4183), (187, 4084), (201, 4128)]
         : compromised: 0.0487, honest: 0.0472
Round 008: test acc mean=0.0481 ± 0.0051 | min=0.0367 max=0.0583
         : test loss mean=nan ± nan
         : individual accs = ['0.045785', '0.042589', '0.053418', '0.043157', '0.043021', '0.045253', '0.050799', '0.045068', '0.049630', '0.047697', '0.047309', '0.036728', '0.054239', '0.049083', '0.051826', '0.056590', '0.058271', '0.050920', '0.045788', '0.044331']
         : correct/total = [(189, 4128), (179, 4203), (218, 4081), (187, 4333), (176, 4091), (194, 4287), (213, 4193), (196, 4349), (208, 4191), (204, 4277), (196, 4143), (154, 4193), (222, 4093), (206, 4197), (210, 4052), (228, 4029), (242, 4153), (213, 4183), (187, 4084), (183, 4128)]
         : compromised: 0.0483, honest: 0.0478
Round 009: test acc mean=0.0485 ± 0.0061 | min=0.0367 max=0.0583
         : test loss mean=nan ± nan
         : individual accs = ['0.050145', '0.048775', '0.053418', '0.043157', '0.043021', '0.045253', '0.050799', '0.045068', '0.049630', '0.036708', '0.039585', '0.036728', '0.054239', '0.049083', '0.051826', '0.056590', '0.058271', '0.050920', '0.052889', '0.054506']
         : correct/total = [(207, 4128), (205, 4203), (218, 4081), (187, 4333), (176, 4091), (194, 4287), (213, 4193), (196, 4349), (208, 4191), (157, 4277), (164, 4143), (154, 4193), (222, 4093), (206, 4197), (210, 4052), (228, 4029), (242, 4153), (213, 4183), (216, 4084), (225, 4128)]
         : compromised: 0.0494, honest: 0.0473
Round 010: test acc mean=0.0488 ± 0.0059 | min=0.0367 max=0.0583
         : test loss mean=nan ± nan
         : individual accs = ['0.050145', '0.048775', '0.053418', '0.044773', '0.047421', '0.045253', '0.050799', '0.045068', '0.049630', '0.036708', '0.039585', '0.036728', '0.054239', '0.049083', '0.051826', '0.056590', '0.058271', '0.050920', '0.052889', '0.054506']
         : correct/total = [(207, 4128), (205, 4203), (218, 4081), (194, 4333), (194, 4091), (194, 4287), (213, 4193), (196, 4349), (208, 4191), (157, 4277), (164, 4143), (154, 4193), (222, 4093), (206, 4197), (210, 4052), (228, 4029), (242, 4153), (213, 4183), (216, 4084), (225, 4128)]
         : compromised: 0.0495, honest: 0.0478

=== FINAL RESULTS ===
Dataset: femnist, Nodes: 20, Graph: ring, Aggregation: krum
Attack: backdoor, 60.0% compromised
Final accuracy - Compromised: 0.0495, Honest: 0.0478
Overall test accuracy: mean=0.0488 ± 0.0059

=== BACKDOOR ATTACK SUCCESS RATE (ASR) ===
Target label: 0
Trigger size: 4x4
Overall ASR: 0.6000 ± 0.4899
Honest nodes ASR: 0.5000 ± 0.5000
Compromised nodes ASR: 0.6667 ± 0.4714
Note: Higher ASR indicates more successful backdoor attack
