Device: cuda
Seed: 987654321
Loading 36 LEAF FEMNIST train files...
LEAF FEMNIST train: 3597 users, 734463 samples
Loading 36 LEAF FEMNIST test files...
LEAF FEMNIST test: 3597 users, 83388 samples
Found 3597 train users, 3597 test users, 3597 common users
User sample counts range: 525 (max) to 17 (min)
Distributed ALL 3597 users across 20 clients
Users per client: 179 (with 17 clients getting +1 user)
Train partition sizes: [36360, 37070, 35957, 38262, 36024, 37732, 36921, 38328, 36867, 37683, 36507, 36915, 36007, 37001, 35681, 35453, 36585, 36801, 35964, 36345]
Test partition sizes: [4128, 4203, 4081, 4333, 4091, 4287, 4193, 4349, 4191, 4277, 4143, 4193, 4093, 4197, 4052, 4029, 4153, 4183, 4084, 4128]
  Client 0: 36360 train samples, 62 unique classes
  Client 1: 37070 train samples, 62 unique classes
  Client 2: 35957 train samples, 62 unique classes
  Client 3: 38262 train samples, 62 unique classes
  Client 4: 36024 train samples, 62 unique classes
  Client 5: 37732 train samples, 62 unique classes
  Client 6: 36921 train samples, 62 unique classes
  Client 7: 38328 train samples, 62 unique classes
  Client 8: 36867 train samples, 62 unique classes
  Client 9: 37683 train samples, 62 unique classes
  Client 10: 36507 train samples, 62 unique classes
  Client 11: 36915 train samples, 62 unique classes
  Client 12: 36007 train samples, 62 unique classes
  Client 13: 37001 train samples, 62 unique classes
  Client 14: 35681 train samples, 62 unique classes
  Client 15: 35453 train samples, 62 unique classes
  Client 16: 36585 train samples, 62 unique classes
  Client 17: 36801 train samples, 62 unique classes
  Client 18: 35964 train samples, 62 unique classes
  Client 19: 36345 train samples, 62 unique classes
Will sample 10000 samples per client per epoch
Graph: erdos, nodes: 20, edges: 48
Degree statistics: avg=4.80, min=2, max=7
Attack: Compromised 6/20 nodes: [5, 12, 13, 14, 17, 18]
Attack type: directed_deviation, lambda: 1.0
Model variant: baseline
Model parameters: 6,603,710
Initial test acc across nodes: mean=0.0162 ± 0.0138
Round 001: test acc mean=0.0391 ± 0.0594 | min=0.0026 max=0.2435
         : test loss mean=10053.9958 ± 17690.6413
         : individual accs = ['0.005329', '0.053533', '0.005391', '0.047311', '0.029333', '0.025659', '0.006678', '0.042998', '0.008590', '0.173954', '0.020758', '0.020033', '0.034693', '0.006433', '0.017029', '0.005709', '0.015170', '0.002630', '0.016405', '0.243459']
         : correct/total = [(22, 4128), (225, 4203), (22, 4081), (205, 4333), (120, 4091), (110, 4287), (28, 4193), (187, 4349), (36, 4191), (744, 4277), (86, 4143), (84, 4193), (142, 4093), (27, 4197), (69, 4052), (23, 4029), (63, 4153), (11, 4183), (67, 4084), (1005, 4128)]
         : compromised: 0.0171, honest: 0.0484
Round 002: test acc mean=0.0484 ± 0.0040 | min=0.0389 max=0.0531
         : test loss mean=144043750.4262 ± 305371330.6370
         : individual accs = ['0.039486', '0.050440', '0.052928', '0.047542', '0.048399', '0.046186', '0.045314', '0.050126', '0.042711', '0.050736', '0.053102', '0.051514', '0.048131', '0.048844', '0.047878', '0.052122', '0.049362', '0.052833', '0.038932', '0.050630']
         : correct/total = [(163, 4128), (212, 4203), (216, 4081), (206, 4333), (198, 4091), (198, 4287), (190, 4193), (218, 4349), (179, 4191), (217, 4277), (220, 4143), (216, 4193), (197, 4093), (205, 4197), (194, 4052), (210, 4029), (205, 4153), (221, 4183), (159, 4084), (209, 4128)]
         : compromised: 0.0471, honest: 0.0489
Round 003: test acc mean=0.0484 ± 0.0050 | min=0.0299 max=0.0558
         : test loss mean=2435126.5019 ± 7508472.8204
         : individual accs = ['0.049903', '0.052819', '0.052928', '0.047542', '0.046199', '0.048519', '0.048891', '0.045758', '0.045335', '0.048632', '0.051412', '0.051514', '0.047398', '0.048844', '0.047878', '0.055845', '0.047436', '0.051159', '0.029873', '0.050388']
         : correct/total = [(206, 4128), (222, 4203), (216, 4081), (206, 4333), (189, 4091), (208, 4287), (205, 4193), (199, 4349), (190, 4191), (208, 4277), (213, 4143), (216, 4193), (194, 4093), (205, 4197), (194, 4052), (225, 4029), (197, 4153), (214, 4183), (122, 4084), (208, 4128)]
         : compromised: 0.0456, honest: 0.0496
Round 004: test acc mean=0.0515 ± 0.0048 | min=0.0395 max=0.0615
         : test loss mean=1333328.6505 ± 5510489.7683
         : individual accs = ['0.049661', '0.052819', '0.061505', '0.044773', '0.053043', '0.047352', '0.053422', '0.039549', '0.051062', '0.048632', '0.051895', '0.048891', '0.052040', '0.048844', '0.050099', '0.055845', '0.050566', '0.052116', '0.059745', '0.057413']
         : correct/total = [(205, 4128), (222, 4203), (251, 4081), (194, 4333), (217, 4091), (203, 4287), (224, 4193), (172, 4349), (214, 4191), (208, 4277), (215, 4143), (205, 4193), (213, 4093), (205, 4197), (203, 4052), (225, 4029), (210, 4153), (218, 4183), (244, 4084), (237, 4128)]
         : compromised: 0.0517, honest: 0.0514
Round 005: test acc mean=0.0534 ± 0.0046 | min=0.0474 max=0.0623
         : test loss mean=118439.6314 ± 306431.1966
         : individual accs = ['0.049661', '0.052819', '0.061505', '0.049850', '0.052066', '0.048519', '0.053422', '0.052656', '0.052732', '0.048632', '0.051895', '0.051514', '0.062301', '0.054801', '0.050592', '0.061554', '0.047436', '0.049247', '0.060235', '0.057413']
         : correct/total = [(205, 4128), (222, 4203), (251, 4081), (216, 4333), (213, 4091), (208, 4287), (224, 4193), (229, 4349), (221, 4191), (208, 4277), (215, 4143), (216, 4193), (255, 4093), (230, 4197), (205, 4052), (248, 4029), (197, 4153), (206, 4183), (246, 4084), (237, 4128)]
         : compromised: 0.0543, honest: 0.0531
Round 006: test acc mean=0.0508 ± 0.0038 | min=0.0458 max=0.0602
         : test loss mean=253515.0997 ± 370965.5925
         : individual accs = ['0.049661', '0.052819', '0.046802', '0.049850', '0.048399', '0.051318', '0.053422', '0.046907', '0.057266', '0.048632', '0.051895', '0.051037', '0.052040', '0.046938', '0.050592', '0.048151', '0.045750', '0.047574', '0.060235', '0.057413']
         : correct/total = [(205, 4128), (222, 4203), (191, 4081), (216, 4333), (198, 4091), (220, 4287), (224, 4193), (204, 4349), (240, 4191), (208, 4277), (215, 4143), (214, 4193), (213, 4093), (197, 4197), (205, 4052), (194, 4029), (190, 4153), (199, 4183), (246, 4084), (237, 4128)]
         : compromised: 0.0514, honest: 0.0506
Round 007: test acc mean=0.0517 ± 0.0036 | min=0.0446 max=0.0602
         : test loss mean=2717.9697 ± 3986.4529
         : individual accs = ['0.049661', '0.052819', '0.049253', '0.049850', '0.051821', '0.052018', '0.053422', '0.044608', '0.057266', '0.048632', '0.051895', '0.054853', '0.047642', '0.049083', '0.050099', '0.051874', '0.050084', '0.051159', '0.060235', '0.057413']
         : correct/total = [(205, 4128), (222, 4203), (201, 4081), (216, 4333), (212, 4091), (223, 4287), (224, 4193), (194, 4349), (240, 4191), (208, 4277), (215, 4143), (230, 4193), (195, 4093), (206, 4197), (203, 4052), (209, 4029), (208, 4153), (214, 4183), (246, 4084), (237, 4128)]
         : compromised: 0.0517, honest: 0.0517
Round 008: test acc mean=0.0544 ± 0.0043 | min=0.0486 max=0.0623
         : test loss mean=134.7216 ± 571.1665
         : individual accs = ['0.049661', '0.052819', '0.061505', '0.049850', '0.052066', '0.052018', '0.053422', '0.052656', '0.053686', '0.048632', '0.051895', '0.054853', '0.062301', '0.049083', '0.055281', '0.061554', '0.050566', '0.057853', '0.060235', '0.057413']
         : correct/total = [(205, 4128), (222, 4203), (251, 4081), (216, 4333), (213, 4091), (223, 4287), (224, 4193), (229, 4349), (225, 4191), (208, 4277), (215, 4143), (230, 4193), (255, 4093), (206, 4197), (224, 4052), (248, 4029), (210, 4153), (242, 4183), (246, 4084), (237, 4128)]
         : compromised: 0.0561, honest: 0.0536
Round 009: test acc mean=0.0545 ± 0.0043 | min=0.0486 max=0.0623
         : test loss mean=3.6855 ± 0.0140
         : individual accs = ['0.049661', '0.052819', '0.061505', '0.049850', '0.052066', '0.052018', '0.053422', '0.052656', '0.057266', '0.048632', '0.051895', '0.054853', '0.062301', '0.049083', '0.055281', '0.061554', '0.050566', '0.057853', '0.060235', '0.057413']
         : correct/total = [(205, 4128), (222, 4203), (251, 4081), (216, 4333), (213, 4091), (223, 4287), (224, 4193), (229, 4349), (240, 4191), (208, 4277), (215, 4143), (230, 4193), (255, 4093), (206, 4197), (224, 4052), (248, 4029), (210, 4153), (242, 4183), (246, 4084), (237, 4128)]
         : compromised: 0.0561, honest: 0.0539
Round 010: test acc mean=0.0545 ± 0.0043 | min=0.0486 max=0.0623
         : test loss mean=3.6850 ± 0.0142
         : individual accs = ['0.049661', '0.052819', '0.061505', '0.049850', '0.052066', '0.052018', '0.053422', '0.052656', '0.057266', '0.048632', '0.051895', '0.054853', '0.062301', '0.049083', '0.055281', '0.061554', '0.050566', '0.057853', '0.060235', '0.057413']
         : correct/total = [(205, 4128), (222, 4203), (251, 4081), (216, 4333), (213, 4091), (223, 4287), (224, 4193), (229, 4349), (240, 4191), (208, 4277), (215, 4143), (230, 4193), (255, 4093), (206, 4197), (224, 4052), (248, 4029), (210, 4153), (242, 4183), (246, 4084), (237, 4128)]
         : compromised: 0.0561, honest: 0.0539

=== FINAL RESULTS ===
Dataset: femnist, Nodes: 20, Graph: erdos, Aggregation: d-fedavg
Attack: directed_deviation, 30.0% compromised
Final accuracy - Compromised: 0.0561, Honest: 0.0539
Overall test accuracy: mean=0.0545 ± 0.0043
