Device: cuda
Seed: 987654321
Loading 36 LEAF FEMNIST train files...
LEAF FEMNIST train: 3597 users, 734463 samples
Loading 36 LEAF FEMNIST test files...
LEAF FEMNIST test: 3597 users, 83388 samples
Found 3597 train users, 3597 test users, 3597 common users
User sample counts range: 525 (max) to 17 (min)
Distributed ALL 3597 users across 20 clients
Users per client: 179 (with 17 clients getting +1 user)
Train partition sizes: [36360, 37070, 35957, 38262, 36024, 37732, 36921, 38328, 36867, 37683, 36507, 36915, 36007, 37001, 35681, 35453, 36585, 36801, 35964, 36345]
Test partition sizes: [4128, 4203, 4081, 4333, 4091, 4287, 4193, 4349, 4191, 4277, 4143, 4193, 4093, 4197, 4052, 4029, 4153, 4183, 4084, 4128]
  Client 0: 36360 train samples, 62 unique classes
  Client 1: 37070 train samples, 62 unique classes
  Client 2: 35957 train samples, 62 unique classes
  Client 3: 38262 train samples, 62 unique classes
  Client 4: 36024 train samples, 62 unique classes
  Client 5: 37732 train samples, 62 unique classes
  Client 6: 36921 train samples, 62 unique classes
  Client 7: 38328 train samples, 62 unique classes
  Client 8: 36867 train samples, 62 unique classes
  Client 9: 37683 train samples, 62 unique classes
  Client 10: 36507 train samples, 62 unique classes
  Client 11: 36915 train samples, 62 unique classes
  Client 12: 36007 train samples, 62 unique classes
  Client 13: 37001 train samples, 62 unique classes
  Client 14: 35681 train samples, 62 unique classes
  Client 15: 35453 train samples, 62 unique classes
  Client 16: 36585 train samples, 62 unique classes
  Client 17: 36801 train samples, 62 unique classes
  Client 18: 35964 train samples, 62 unique classes
  Client 19: 36345 train samples, 62 unique classes
Will sample 10000 samples per client per epoch
Graph: erdos, nodes: 20, edges: 99
Degree statistics: avg=9.90, min=7, max=14
Attack: Compromised 2/20 nodes: [5, 13]
Attack type: backdoor, lambda: 1.0
Backdoor target label: 0, trigger size: 4
Model variant: baseline
Model parameters: 6,603,710
Initial test acc across nodes: mean=0.0162 ± 0.0138
Backdoor attack: Created poisoned datasets for 2 compromised nodes
Round 001: test acc mean=0.0294 ± 0.0220 | min=0.0036 max=0.0748
         : test loss mean=102.6245 ± 174.1290
         : individual accs = ['0.005329', '0.003569', '0.061505', '0.074775', '0.037888', '0.027525', '0.026711', '0.043228', '0.057504', '0.048632', '0.051895', '0.003577', '0.006597', '0.005480', '0.010365', '0.027550', '0.050566', '0.003586', '0.023017', '0.018653']
         : correct/total = [(22, 4128), (15, 4203), (251, 4081), (324, 4333), (155, 4091), (118, 4287), (112, 4193), (188, 4349), (241, 4191), (208, 4277), (215, 4143), (15, 4193), (27, 4093), (23, 4197), (42, 4052), (111, 4029), (210, 4153), (15, 4183), (94, 4084), (77, 4128)]
         : compromised: 0.0165, honest: 0.0308
Round 002: test acc mean=0.0503 ± 0.0096 | min=0.0249 max=0.0623
         : test loss mean=55.4452 ± 108.9981
         : individual accs = ['0.049419', '0.048775', '0.061505', '0.024925', '0.045710', '0.052018', '0.053422', '0.039549', '0.057266', '0.048632', '0.051895', '0.054853', '0.062301', '0.049083', '0.055281', '0.029288', '0.045750', '0.057853', '0.060235', '0.057413']
         : correct/total = [(204, 4128), (205, 4203), (251, 4081), (108, 4333), (187, 4091), (223, 4287), (224, 4193), (172, 4349), (240, 4191), (208, 4277), (215, 4143), (230, 4193), (255, 4093), (206, 4197), (224, 4052), (118, 4029), (190, 4153), (242, 4183), (246, 4084), (237, 4128)]
         : compromised: 0.0506, honest: 0.0502
Round 003: test acc mean=0.0545 ± 0.0043 | min=0.0486 max=0.0623
         : test loss mean=38.0263 ± 56.4164
         : individual accs = ['0.049661', '0.052819', '0.061505', '0.049850', '0.052066', '0.052018', '0.053422', '0.052656', '0.057266', '0.048632', '0.051895', '0.054853', '0.062301', '0.049083', '0.055281', '0.061554', '0.050566', '0.057853', '0.060235', '0.057413']
         : correct/total = [(205, 4128), (222, 4203), (251, 4081), (216, 4333), (213, 4091), (223, 4287), (224, 4193), (229, 4349), (240, 4191), (208, 4277), (215, 4143), (230, 4193), (255, 4093), (206, 4197), (224, 4052), (248, 4029), (210, 4153), (242, 4183), (246, 4084), (237, 4128)]
         : compromised: 0.0506, honest: 0.0550
Round 004: test acc mean=0.0507 ± 0.0040 | min=0.0438 max=0.0615
         : test loss mean=5.9116 ± 4.9964
         : individual accs = ['0.050630', '0.050440', '0.061505', '0.043850', '0.047910', '0.052951', '0.053422', '0.046447', '0.057266', '0.048632', '0.051895', '0.054853', '0.052040', '0.049083', '0.049112', '0.046910', '0.050566', '0.051159', '0.048482', '0.046512']
         : correct/total = [(209, 4128), (212, 4203), (251, 4081), (190, 4333), (196, 4091), (227, 4287), (224, 4193), (202, 4349), (240, 4191), (208, 4277), (215, 4143), (230, 4193), (213, 4093), (206, 4197), (199, 4052), (189, 4029), (210, 4153), (214, 4183), (198, 4084), (192, 4128)]
         : compromised: 0.0510, honest: 0.0506
Round 005: test acc mean=0.0498 ± 0.0037 | min=0.0438 max=0.0615
         : test loss mean=4.1543 ± 1.1715
         : individual accs = ['0.050630', '0.050440', '0.061505', '0.043850', '0.047910', '0.052951', '0.052707', '0.046447', '0.044619', '0.048632', '0.051895', '0.049845', '0.052040', '0.049083', '0.049112', '0.046910', '0.050566', '0.051159', '0.048482', '0.046512']
         : correct/total = [(209, 4128), (212, 4203), (251, 4081), (190, 4333), (196, 4091), (227, 4287), (221, 4193), (202, 4349), (187, 4191), (208, 4277), (215, 4143), (209, 4193), (213, 4093), (206, 4197), (199, 4052), (189, 4029), (210, 4153), (214, 4183), (198, 4084), (192, 4128)]
         : compromised: 0.0510, honest: 0.0496
Round 006: test acc mean=0.0518 ± 0.0038 | min=0.0464 max=0.0615
         : test loss mean=4.9937 ± 3.2211
         : individual accs = ['0.050630', '0.050440', '0.061505', '0.049850', '0.047910', '0.052018', '0.053422', '0.046447', '0.057266', '0.048632', '0.051895', '0.054853', '0.052040', '0.049083', '0.055281', '0.046910', '0.050566', '0.051159', '0.048482', '0.057413']
         : correct/total = [(209, 4128), (212, 4203), (251, 4081), (216, 4333), (196, 4091), (223, 4287), (224, 4193), (202, 4349), (240, 4191), (208, 4277), (215, 4143), (230, 4193), (213, 4093), (206, 4197), (224, 4052), (189, 4029), (210, 4153), (214, 4183), (198, 4084), (237, 4128)]
         : compromised: 0.0506, honest: 0.0519
Round 007: test acc mean=0.0536 ± 0.0047 | min=0.0433 max=0.0623
         : test loss mean=5.4975 ± 3.6562
         : individual accs = ['0.049661', '0.052819', '0.051948', '0.049850', '0.052066', '0.052018', '0.053422', '0.052656', '0.057266', '0.043255', '0.051171', '0.054853', '0.062301', '0.049083', '0.055281', '0.061554', '0.048158', '0.057853', '0.060235', '0.057413']
         : correct/total = [(205, 4128), (222, 4203), (212, 4081), (216, 4333), (213, 4091), (223, 4287), (224, 4193), (229, 4349), (240, 4191), (185, 4277), (212, 4143), (230, 4193), (255, 4093), (206, 4197), (224, 4052), (248, 4029), (200, 4153), (242, 4183), (246, 4084), (237, 4128)]
         : compromised: 0.0506, honest: 0.0540
Round 008: test acc mean=0.0546 ± 0.0039 | min=0.0491 max=0.0623
         : test loss mean=4.3289 ± 1.2985
         : individual accs = ['0.049661', '0.052819', '0.057339', '0.049850', '0.052066', '0.052018', '0.053422', '0.052656', '0.057266', '0.055413', '0.051171', '0.054853', '0.062301', '0.049083', '0.055281', '0.061554', '0.050566', '0.057853', '0.060235', '0.057413']
         : correct/total = [(205, 4128), (222, 4203), (234, 4081), (216, 4333), (213, 4091), (223, 4287), (224, 4193), (229, 4349), (240, 4191), (237, 4277), (212, 4143), (230, 4193), (255, 4093), (206, 4197), (224, 4052), (248, 4029), (210, 4153), (242, 4183), (246, 4084), (237, 4128)]
         : compromised: 0.0506, honest: 0.0551
Round 009: test acc mean=0.0546 ± 0.0043 | min=0.0491 max=0.0623
         : test loss mean=3.9238 ± 0.5155
         : individual accs = ['0.049661', '0.052819', '0.061505', '0.049850', '0.052066', '0.052018', '0.053422', '0.052656', '0.057266', '0.050736', '0.050205', '0.054853', '0.062301', '0.049083', '0.055281', '0.061554', '0.050566', '0.057853', '0.060235', '0.057413']
         : correct/total = [(205, 4128), (222, 4203), (251, 4081), (216, 4333), (213, 4091), (223, 4287), (224, 4193), (229, 4349), (240, 4191), (217, 4277), (208, 4143), (230, 4193), (255, 4093), (206, 4197), (224, 4052), (248, 4029), (210, 4153), (242, 4183), (246, 4084), (237, 4128)]
         : compromised: 0.0506, honest: 0.0550
Round 010: test acc mean=0.0498 ± 0.0037 | min=0.0438 max=0.0615
         : test loss mean=4.2395 ± 1.2224
         : individual accs = ['0.050630', '0.050440', '0.061505', '0.043850', '0.047910', '0.052951', '0.052707', '0.046447', '0.044619', '0.048632', '0.051895', '0.049845', '0.052040', '0.049083', '0.049112', '0.046910', '0.050566', '0.051159', '0.048482', '0.046512']
         : correct/total = [(209, 4128), (212, 4203), (251, 4081), (190, 4333), (196, 4091), (227, 4287), (221, 4193), (202, 4349), (187, 4191), (208, 4277), (215, 4143), (209, 4193), (213, 4093), (206, 4197), (199, 4052), (189, 4029), (210, 4153), (214, 4183), (198, 4084), (192, 4128)]
         : compromised: 0.0510, honest: 0.0496

=== FINAL RESULTS ===
Dataset: femnist, Nodes: 20, Graph: erdos, Aggregation: d-fedavg
Attack: backdoor, 10.0% compromised
Final accuracy - Compromised: 0.0510, Honest: 0.0496
Overall test accuracy: mean=0.0498 ± 0.0037

=== BACKDOOR ATTACK SUCCESS RATE (ASR) ===
Target label: 0
Trigger size: 4x4
Overall ASR: 0.0000 ± 0.0000
Honest nodes ASR: 0.0000 ± 0.0000
Compromised nodes ASR: 0.0000 ± 0.0000
Note: Higher ASR indicates more successful backdoor attack
