Device: cuda
Seed: 987654321
Loading 36 LEAF FEMNIST train files...
LEAF FEMNIST train: 3597 users, 734463 samples
Loading 36 LEAF FEMNIST test files...
LEAF FEMNIST test: 3597 users, 83388 samples
Found 3597 train users, 3597 test users, 3597 common users
User sample counts range: 525 (max) to 17 (min)
Distributed ALL 3597 users across 20 clients
Users per client: 179 (with 17 clients getting +1 user)
Train partition sizes: [36360, 37070, 35957, 38262, 36024, 37732, 36921, 38328, 36867, 37683, 36507, 36915, 36007, 37001, 35681, 35453, 36585, 36801, 35964, 36345]
Test partition sizes: [4128, 4203, 4081, 4333, 4091, 4287, 4193, 4349, 4191, 4277, 4143, 4193, 4093, 4197, 4052, 4029, 4153, 4183, 4084, 4128]
  Client 0: 36360 train samples, 62 unique classes
  Client 1: 37070 train samples, 62 unique classes
  Client 2: 35957 train samples, 62 unique classes
  Client 3: 38262 train samples, 62 unique classes
  Client 4: 36024 train samples, 62 unique classes
  Client 5: 37732 train samples, 62 unique classes
  Client 6: 36921 train samples, 62 unique classes
  Client 7: 38328 train samples, 62 unique classes
  Client 8: 36867 train samples, 62 unique classes
  Client 9: 37683 train samples, 62 unique classes
  Client 10: 36507 train samples, 62 unique classes
  Client 11: 36915 train samples, 62 unique classes
  Client 12: 36007 train samples, 62 unique classes
  Client 13: 37001 train samples, 62 unique classes
  Client 14: 35681 train samples, 62 unique classes
  Client 15: 35453 train samples, 62 unique classes
  Client 16: 36585 train samples, 62 unique classes
  Client 17: 36801 train samples, 62 unique classes
  Client 18: 35964 train samples, 62 unique classes
  Client 19: 36345 train samples, 62 unique classes
Will sample 10000 samples per client per epoch
Graph: erdos, nodes: 20, edges: 48
Degree statistics: avg=4.80, min=2, max=7
Attack: Compromised 12/20 nodes: [1, 2, 3, 5, 8, 11, 12, 13, 14, 15, 17, 18]
Attack type: backdoor, lambda: 1.0
Backdoor target label: 0, trigger size: 4
Model variant: baseline
Model parameters: 6,603,710
Sketchguard Node 0:
  Model dim: 6,603,710 → Sketch size: 1000
  Compression ratio: 6603.7x
  Using model parameters for aggregation, sketches for filtering
Sketchguard Node 1:
  Model dim: 6,603,710 → Sketch size: 1000
  Compression ratio: 6603.7x
  Using model parameters for aggregation, sketches for filtering
Sketchguard Node 2:
  Model dim: 6,603,710 → Sketch size: 1000
  Compression ratio: 6603.7x
  Using model parameters for aggregation, sketches for filtering
Sketchguard Node 3:
  Model dim: 6,603,710 → Sketch size: 1000
  Compression ratio: 6603.7x
  Using model parameters for aggregation, sketches for filtering
Sketchguard Node 4:
  Model dim: 6,603,710 → Sketch size: 1000
  Compression ratio: 6603.7x
  Using model parameters for aggregation, sketches for filtering
Sketchguard Node 5:
  Model dim: 6,603,710 → Sketch size: 1000
  Compression ratio: 6603.7x
  Using model parameters for aggregation, sketches for filtering
Sketchguard Node 6:
  Model dim: 6,603,710 → Sketch size: 1000
  Compression ratio: 6603.7x
  Using model parameters for aggregation, sketches for filtering
Sketchguard Node 7:
  Model dim: 6,603,710 → Sketch size: 1000
  Compression ratio: 6603.7x
  Using model parameters for aggregation, sketches for filtering
Sketchguard Node 8:
  Model dim: 6,603,710 → Sketch size: 1000
  Compression ratio: 6603.7x
  Using model parameters for aggregation, sketches for filtering
Sketchguard Node 9:
  Model dim: 6,603,710 → Sketch size: 1000
  Compression ratio: 6603.7x
  Using model parameters for aggregation, sketches for filtering
Sketchguard Node 10:
  Model dim: 6,603,710 → Sketch size: 1000
  Compression ratio: 6603.7x
  Using model parameters for aggregation, sketches for filtering
Sketchguard Node 11:
  Model dim: 6,603,710 → Sketch size: 1000
  Compression ratio: 6603.7x
  Using model parameters for aggregation, sketches for filtering
Sketchguard Node 12:
  Model dim: 6,603,710 → Sketch size: 1000
  Compression ratio: 6603.7x
  Using model parameters for aggregation, sketches for filtering
Sketchguard Node 13:
  Model dim: 6,603,710 → Sketch size: 1000
  Compression ratio: 6603.7x
  Using model parameters for aggregation, sketches for filtering
Sketchguard Node 14:
  Model dim: 6,603,710 → Sketch size: 1000
  Compression ratio: 6603.7x
  Using model parameters for aggregation, sketches for filtering
Sketchguard Node 15:
  Model dim: 6,603,710 → Sketch size: 1000
  Compression ratio: 6603.7x
  Using model parameters for aggregation, sketches for filtering
Sketchguard Node 16:
  Model dim: 6,603,710 → Sketch size: 1000
  Compression ratio: 6603.7x
  Using model parameters for aggregation, sketches for filtering
Sketchguard Node 17:
  Model dim: 6,603,710 → Sketch size: 1000
  Compression ratio: 6603.7x
  Using model parameters for aggregation, sketches for filtering
Sketchguard Node 18:
  Model dim: 6,603,710 → Sketch size: 1000
  Compression ratio: 6603.7x
  Using model parameters for aggregation, sketches for filtering
Sketchguard Node 19:
  Model dim: 6,603,710 → Sketch size: 1000
  Compression ratio: 6603.7x
  Using model parameters for aggregation, sketches for filtering
Sketchguard ALGORITHM (Sketch-based Filtering + State Aggregation)
  - Model dimension: 6,603,710 parameters
  - Config: SketchguardConfig(gamma=2, kappa=1, alpha=0.5, min_neighbors=1, sketch_size=1000, network_seed=987654321, attack_detection_window=5)
  - Sketch size: 1000
  - Compression ratio: 6603.7x
  - Complexity: O(d + N×k) = O(6,603,710 + 20×1000)
  - Theoretical speedup vs BALANCE: 19.9x
Initial test acc across nodes: mean=0.0162 ± 0.0138
Backdoor attack: Created poisoned datasets for 12 compromised nodes
Round 001: test acc mean=0.2351 ± 0.1613 | min=0.0474 max=0.4940
         : test loss mean=12028.7527 ± 12954.1340
         : individual accs = ['0.468750', '0.048775', '0.197011', '0.057004', '0.494011', '0.169582', '0.410923', '0.386526', '0.096874', '0.428805', '0.315955', '0.141903', '0.047398', '0.047653', '0.168065', '0.068255', '0.442572', '0.179297', '0.108717', '0.424176']
         : correct/total = [(1935, 4128), (205, 4203), (804, 4081), (247, 4333), (2021, 4091), (727, 4287), (1723, 4193), (1681, 4349), (406, 4191), (1834, 4277), (1309, 4143), (595, 4193), (194, 4093), (200, 4197), (681, 4052), (275, 4029), (1838, 4153), (750, 4183), (444, 4084), (1751, 4128)]
         : compromised: 0.1109, honest: 0.4215
         : sketchguard stats = ['Node 0: acc_rate=0.500', 'Node 1: acc_rate=0.500', 'Node 2: acc_rate=0.400']...
Round 002: test acc mean=0.3150 ± 0.3255 | min=0.0389 max=0.7403
         : test loss mean=8833.9664 ± 27683.0776
         : individual accs = ['0.722384', '0.052819', '0.049988', '0.048927', '0.700073', '0.052018', '0.740281', '0.703610', '0.047483', '0.721534', '0.698286', '0.048891', '0.048375', '0.048606', '0.047384', '0.055845', '0.717313', '0.052116', '0.038932', '0.704215']
         : correct/total = [(2982, 4128), (222, 4203), (204, 4081), (212, 4333), (2864, 4091), (223, 4287), (3104, 4193), (3060, 4349), (199, 4191), (3086, 4277), (2893, 4143), (205, 4193), (198, 4093), (204, 4197), (192, 4052), (225, 4029), (2979, 4153), (218, 4183), (159, 4084), (2907, 4128)]
         : compromised: 0.0493, honest: 0.7135
         : sketchguard stats = ['Node 0: acc_rate=0.500', 'Node 1: acc_rate=0.750', 'Node 2: acc_rate=0.700']...
Round 003: test acc mean=0.3425 ± 0.3578 | min=0.0466 max=0.7934
         : test loss mean=nan ± nan
         : individual accs = ['0.793362', '0.048775', '0.049743', '0.046619', '0.779272', '0.052018', '0.785118', '0.788457', '0.051062', '0.774141', '0.757181', '0.048891', '0.047398', '0.047653', '0.054788', '0.054604', '0.779437', '0.049247', '0.054358', '0.787548']
         : correct/total = [(3275, 4128), (205, 4203), (203, 4081), (202, 4333), (3188, 4091), (223, 4287), (3292, 4193), (3429, 4349), (214, 4191), (3311, 4277), (3137, 4143), (205, 4193), (194, 4093), (200, 4197), (222, 4052), (220, 4029), (3237, 4153), (206, 4183), (222, 4084), (3251, 4128)]
         : compromised: 0.0504, honest: 0.7806
         : sketchguard stats = ['Node 0: acc_rate=0.500', 'Node 1: acc_rate=0.833', 'Node 2: acc_rate=0.800']...
Round 004: test acc mean=0.3525 ± 0.3700 | min=0.0466 max=0.8160
         : test loss mean=nan ± nan
         : individual accs = ['0.804264', '0.048775', '0.049743', '0.046619', '0.801760', '0.052484', '0.815645', '0.816050', '0.051062', '0.808043', '0.789283', '0.048891', '0.047398', '0.047653', '0.054788', '0.054604', '0.804479', '0.049247', '0.054358', '0.804990']
         : correct/total = [(3320, 4128), (205, 4203), (203, 4081), (202, 4333), (3280, 4091), (225, 4287), (3420, 4193), (3549, 4349), (214, 4191), (3456, 4277), (3270, 4143), (205, 4193), (194, 4093), (200, 4197), (222, 4052), (220, 4029), (3341, 4153), (206, 4183), (222, 4084), (3323, 4128)]
         : compromised: 0.0505, honest: 0.8056
         : sketchguard stats = ['Node 0: acc_rate=0.500', 'Node 1: acc_rate=0.625', 'Node 2: acc_rate=0.600']...
Round 005: test acc mean=0.3570 ± 0.3754 | min=0.0466 max=0.8239
         : test loss mean=nan ± nan
         : individual accs = ['0.819283', '0.048775', '0.049743', '0.046619', '0.813982', '0.052484', '0.820892', '0.816969', '0.051062', '0.823942', '0.804972', '0.048891', '0.047398', '0.047653', '0.054788', '0.054604', '0.819408', '0.049247', '0.054358', '0.814922']
         : correct/total = [(3382, 4128), (205, 4203), (203, 4081), (202, 4333), (3330, 4091), (225, 4287), (3442, 4193), (3553, 4349), (214, 4191), (3524, 4277), (3335, 4143), (205, 4193), (194, 4093), (200, 4197), (222, 4052), (220, 4029), (3403, 4153), (206, 4183), (222, 4084), (3364, 4128)]
         : compromised: 0.0505, honest: 0.8168
         : sketchguard stats = ['Node 0: acc_rate=0.500', 'Node 1: acc_rate=0.500', 'Node 2: acc_rate=0.480']...
Round 006: test acc mean=0.3603 ± 0.3794 | min=0.0466 max=0.8354
         : test loss mean=nan ± nan
         : individual accs = ['0.826793', '0.048775', '0.049743', '0.046619', '0.817893', '0.052484', '0.825662', '0.835364', '0.051062', '0.832827', '0.814386', '0.048891', '0.047398', '0.047653', '0.054788', '0.054604', '0.826391', '0.049247', '0.054358', '0.820252']
         : correct/total = [(3413, 4128), (205, 4203), (203, 4081), (202, 4333), (3346, 4091), (225, 4287), (3462, 4193), (3633, 4349), (214, 4191), (3562, 4277), (3374, 4143), (205, 4193), (194, 4093), (200, 4197), (222, 4052), (220, 4029), (3432, 4153), (206, 4183), (222, 4084), (3386, 4128)]
         : compromised: 0.0505, honest: 0.8249
         : sketchguard stats = ['Node 0: acc_rate=0.500', 'Node 1: acc_rate=0.417', 'Node 2: acc_rate=0.400']...
Round 007: test acc mean=0.3641 ± 0.3841 | min=0.0466 max=0.8447
         : test loss mean=nan ± nan
         : individual accs = ['0.836483', '0.048775', '0.049743', '0.046619', '0.827915', '0.052484', '0.839494', '0.843872', '0.051062', '0.841945', '0.819937', '0.048891', '0.047398', '0.047653', '0.054788', '0.054604', '0.844691', '0.049247', '0.054358', '0.821705']
         : correct/total = [(3453, 4128), (205, 4203), (203, 4081), (202, 4333), (3387, 4091), (225, 4287), (3520, 4193), (3670, 4349), (214, 4191), (3601, 4277), (3397, 4143), (205, 4193), (194, 4093), (200, 4197), (222, 4052), (220, 4029), (3508, 4153), (206, 4183), (222, 4084), (3392, 4128)]
         : compromised: 0.0505, honest: 0.8345
         : sketchguard stats = ['Node 0: acc_rate=0.500', 'Node 1: acc_rate=0.357', 'Node 2: acc_rate=0.343']...
Round 008: test acc mean=0.3650 ± 0.3852 | min=0.0466 max=0.8476
         : test loss mean=nan ± nan
         : individual accs = ['0.833818', '0.048775', '0.049743', '0.046619', '0.833293', '0.052484', '0.845695', '0.847551', '0.051062', '0.844517', '0.827178', '0.048891', '0.047398', '0.047653', '0.054788', '0.054604', '0.838189', '0.049247', '0.054358', '0.823159']
         : correct/total = [(3442, 4128), (205, 4203), (203, 4081), (202, 4333), (3409, 4091), (225, 4287), (3546, 4193), (3686, 4349), (214, 4191), (3612, 4277), (3427, 4143), (205, 4193), (194, 4093), (200, 4197), (222, 4052), (220, 4029), (3481, 4153), (206, 4183), (222, 4084), (3398, 4128)]
         : compromised: 0.0505, honest: 0.8367
         : sketchguard stats = ['Node 0: acc_rate=0.500', 'Node 1: acc_rate=0.312', 'Node 2: acc_rate=0.300']...
Round 009: test acc mean=0.3675 ± 0.3883 | min=0.0466 max=0.8521
         : test loss mean=nan ± nan
         : individual accs = ['0.837209', '0.048775', '0.049743', '0.046619', '0.834270', '0.052484', '0.849273', '0.852150', '0.051062', '0.851999', '0.839488', '0.048891', '0.047398', '0.047653', '0.054788', '0.054604', '0.841801', '0.049247', '0.054358', '0.838663']
         : correct/total = [(3456, 4128), (205, 4203), (203, 4081), (202, 4333), (3413, 4091), (225, 4287), (3561, 4193), (3706, 4349), (214, 4191), (3644, 4277), (3478, 4143), (205, 4193), (194, 4093), (200, 4197), (222, 4052), (220, 4029), (3496, 4153), (206, 4183), (222, 4084), (3462, 4128)]
         : compromised: 0.0505, honest: 0.8431
         : sketchguard stats = ['Node 0: acc_rate=0.500', 'Node 1: acc_rate=0.278', 'Node 2: acc_rate=0.267']...
Round 010: test acc mean=0.3684 ± 0.3894 | min=0.0466 max=0.8555
         : test loss mean=nan ± nan
         : individual accs = ['0.846899', '0.048775', '0.049743', '0.046619', '0.836715', '0.052484', '0.854042', '0.851230', '0.051062', '0.855506', '0.835868', '0.048891', '0.047398', '0.047653', '0.054788', '0.054604', '0.842283', '0.049247', '0.054358', '0.839147']
         : correct/total = [(3496, 4128), (205, 4203), (203, 4081), (202, 4333), (3423, 4091), (225, 4287), (3581, 4193), (3702, 4349), (214, 4191), (3659, 4277), (3463, 4143), (205, 4193), (194, 4093), (200, 4197), (222, 4052), (220, 4029), (3498, 4153), (206, 4183), (222, 4084), (3464, 4128)]
         : compromised: 0.0505, honest: 0.8452
         : sketchguard stats = ['Node 0: acc_rate=0.500', 'Node 1: acc_rate=0.250', 'Node 2: acc_rate=0.240']...

=== FINAL RESULTS ===
Dataset: femnist, Nodes: 20, Graph: erdos, Aggregation: sketchguard
Attack: backdoor, 60.0% compromised
Final accuracy - Compromised: 0.0505, Honest: 0.8452
Overall test accuracy: mean=0.3684 ± 0.3894

=== BACKDOOR ATTACK SUCCESS RATE (ASR) ===
Target label: 0
Trigger size: 4x4
Overall ASR: 0.6204 ± 0.4650
Honest nodes ASR: 0.0509 ± 0.0035
Compromised nodes ASR: 1.0000 ± 0.0000
Note: Higher ASR indicates more successful backdoor attack

=== Sketchguard SUMMARY ===
Node 0: acceptance=0.500
Node 1: acceptance=0.250
Node 2: acceptance=0.240
Node 3: acceptance=0.200
Node 4: acceptance=0.250
Node 5: acceptance=0.220
Node 6: acceptance=0.200
Node 7: acceptance=0.400
Node 8: acceptance=0.250
Node 9: acceptance=0.333
Node 10: acceptance=0.500
Node 11: acceptance=0.200
Node 12: acceptance=0.257
Node 13: acceptance=0.200
Node 14: acceptance=0.186
Node 15: acceptance=0.200
Node 16: acceptance=0.200
Node 17: acceptance=0.260
Node 18: acceptance=0.225
Node 19: acceptance=0.500

=== PARALLEL EXECUTION TIME (realistic for distributed system) ===
  COMMUNICATION (max across nodes):
    - Sketch transfer: 0.000s (0.0%)
    - Model fetch (accepted): 0.000s (0.0%)
  COMPUTATION (max across nodes):
    - Sketching: 1.748s (99.0%)
    - Filtering: 0.001s (0.1%)
    - Aggregation: 0.016s (0.9%)
  TOTALS:
    - Total computation: 1.765s (100.0%)
    - Total communication: 0.000s (0.0%)
    - Total parallel time: 1.765s

=== PER-NODE AVERAGE TIME ===
  - Sketching: 1.377s
  - Filtering: 0.001s
  - Aggregation: 0.011s
  - Sketch transfer: 0.000s
  - Model fetch: 0.000s
  - Total per node: 1.388s

=== TOTAL COMPUTATIONAL WORK (sum across all nodes) ===
  - Total sketching: 27.532s
  - Total filtering: 0.012s
  - Total aggregation: 0.210s
  - Total sketch transfer: 0.000s
  - Total model fetch: 0.000s
  - Grand total: 27.756s
  - Mean acceptance rate: 0.279

Sketchguard Algorithm Properties:
  - Original dimension: 6,603,710
  - Sketch size: 1000
  - Compression ratio: 19.9x
  - Single repetition: No repetitions needed
  - Theoretical complexity: O(d + N×k)
  - Approach: Sketch filtering + state aggregation
