Device: cuda
Seed: 987654321
Loading 36 LEAF FEMNIST train files...
LEAF FEMNIST train: 3597 users, 734463 samples
Loading 36 LEAF FEMNIST test files...
LEAF FEMNIST test: 3597 users, 83388 samples
Found 3597 train users, 3597 test users, 3597 common users
User sample counts range: 525 (max) to 17 (min)
Distributed ALL 3597 users across 20 clients
Users per client: 179 (with 17 clients getting +1 user)
Train partition sizes: [36360, 37070, 35957, 38262, 36024, 37732, 36921, 38328, 36867, 37683, 36507, 36915, 36007, 37001, 35681, 35453, 36585, 36801, 35964, 36345]
Test partition sizes: [4128, 4203, 4081, 4333, 4091, 4287, 4193, 4349, 4191, 4277, 4143, 4193, 4093, 4197, 4052, 4029, 4153, 4183, 4084, 4128]
  Client 0: 36360 train samples, 62 unique classes
  Client 1: 37070 train samples, 62 unique classes
  Client 2: 35957 train samples, 62 unique classes
  Client 3: 38262 train samples, 62 unique classes
  Client 4: 36024 train samples, 62 unique classes
  Client 5: 37732 train samples, 62 unique classes
  Client 6: 36921 train samples, 62 unique classes
  Client 7: 38328 train samples, 62 unique classes
  Client 8: 36867 train samples, 62 unique classes
  Client 9: 37683 train samples, 62 unique classes
  Client 10: 36507 train samples, 62 unique classes
  Client 11: 36915 train samples, 62 unique classes
  Client 12: 36007 train samples, 62 unique classes
  Client 13: 37001 train samples, 62 unique classes
  Client 14: 35681 train samples, 62 unique classes
  Client 15: 35453 train samples, 62 unique classes
  Client 16: 36585 train samples, 62 unique classes
  Client 17: 36801 train samples, 62 unique classes
  Client 18: 35964 train samples, 62 unique classes
  Client 19: 36345 train samples, 62 unique classes
Will sample 10000 samples per client per epoch
Graph: erdos, nodes: 20, edges: 99
Degree statistics: avg=9.90, min=7, max=14
Attack: Compromised 2/20 nodes: [5, 13]
Attack type: gaussian, lambda: 1.0
Model variant: baseline
Model parameters: 6,603,710
Sketchguard Node 0:
  Model dim: 6,603,710 → Sketch size: 1000
  Compression ratio: 6603.7x
  Using model parameters for aggregation, sketches for filtering
Sketchguard Node 1:
  Model dim: 6,603,710 → Sketch size: 1000
  Compression ratio: 6603.7x
  Using model parameters for aggregation, sketches for filtering
Sketchguard Node 2:
  Model dim: 6,603,710 → Sketch size: 1000
  Compression ratio: 6603.7x
  Using model parameters for aggregation, sketches for filtering
Sketchguard Node 3:
  Model dim: 6,603,710 → Sketch size: 1000
  Compression ratio: 6603.7x
  Using model parameters for aggregation, sketches for filtering
Sketchguard Node 4:
  Model dim: 6,603,710 → Sketch size: 1000
  Compression ratio: 6603.7x
  Using model parameters for aggregation, sketches for filtering
Sketchguard Node 5:
  Model dim: 6,603,710 → Sketch size: 1000
  Compression ratio: 6603.7x
  Using model parameters for aggregation, sketches for filtering
Sketchguard Node 6:
  Model dim: 6,603,710 → Sketch size: 1000
  Compression ratio: 6603.7x
  Using model parameters for aggregation, sketches for filtering
Sketchguard Node 7:
  Model dim: 6,603,710 → Sketch size: 1000
  Compression ratio: 6603.7x
  Using model parameters for aggregation, sketches for filtering
Sketchguard Node 8:
  Model dim: 6,603,710 → Sketch size: 1000
  Compression ratio: 6603.7x
  Using model parameters for aggregation, sketches for filtering
Sketchguard Node 9:
  Model dim: 6,603,710 → Sketch size: 1000
  Compression ratio: 6603.7x
  Using model parameters for aggregation, sketches for filtering
Sketchguard Node 10:
  Model dim: 6,603,710 → Sketch size: 1000
  Compression ratio: 6603.7x
  Using model parameters for aggregation, sketches for filtering
Sketchguard Node 11:
  Model dim: 6,603,710 → Sketch size: 1000
  Compression ratio: 6603.7x
  Using model parameters for aggregation, sketches for filtering
Sketchguard Node 12:
  Model dim: 6,603,710 → Sketch size: 1000
  Compression ratio: 6603.7x
  Using model parameters for aggregation, sketches for filtering
Sketchguard Node 13:
  Model dim: 6,603,710 → Sketch size: 1000
  Compression ratio: 6603.7x
  Using model parameters for aggregation, sketches for filtering
Sketchguard Node 14:
  Model dim: 6,603,710 → Sketch size: 1000
  Compression ratio: 6603.7x
  Using model parameters for aggregation, sketches for filtering
Sketchguard Node 15:
  Model dim: 6,603,710 → Sketch size: 1000
  Compression ratio: 6603.7x
  Using model parameters for aggregation, sketches for filtering
Sketchguard Node 16:
  Model dim: 6,603,710 → Sketch size: 1000
  Compression ratio: 6603.7x
  Using model parameters for aggregation, sketches for filtering
Sketchguard Node 17:
  Model dim: 6,603,710 → Sketch size: 1000
  Compression ratio: 6603.7x
  Using model parameters for aggregation, sketches for filtering
Sketchguard Node 18:
  Model dim: 6,603,710 → Sketch size: 1000
  Compression ratio: 6603.7x
  Using model parameters for aggregation, sketches for filtering
Sketchguard Node 19:
  Model dim: 6,603,710 → Sketch size: 1000
  Compression ratio: 6603.7x
  Using model parameters for aggregation, sketches for filtering
Sketchguard ALGORITHM (Sketch-based Filtering + State Aggregation)
  - Model dimension: 6,603,710 parameters
  - Config: SketchguardConfig(gamma=2, kappa=1, alpha=0.5, min_neighbors=1, sketch_size=1000, network_seed=987654321, attack_detection_window=5)
  - Sketch size: 1000
  - Compression ratio: 6603.7x
  - Complexity: O(d + N×k) = O(6,603,710 + 20×1000)
  - Theoretical speedup vs BALANCE: 19.9x
Initial test acc across nodes: mean=0.0162 ± 0.0138
Round 001: test acc mean=0.4864 ± 0.0350 | min=0.4336 max=0.5528
         : test loss mean=3.7495 ± 0.0282
         : individual accs = ['0.544574', '0.484892', '0.508209', '0.467344', '0.440724', '0.552834', '0.489626', '0.445390', '0.505369', '0.454057', '0.460053', '0.521822', '0.463230', '0.433643', '0.512340', '0.528915', '0.466891', '0.519723', '0.479432', '0.449612']
         : correct/total = [(2248, 4128), (2038, 4203), (2074, 4081), (2025, 4333), (1803, 4091), (2370, 4287), (2053, 4193), (1937, 4349), (2118, 4191), (1942, 4277), (1906, 4143), (2188, 4193), (1896, 4093), (1820, 4197), (2076, 4052), (2131, 4029), (1939, 4153), (2174, 4183), (1958, 4084), (1856, 4128)]
         : compromised: 0.4932, honest: 0.4857
         : sketchguard stats = ['Node 0: acc_rate=0.917', 'Node 1: acc_rate=0.900', 'Node 2: acc_rate=1.000']...
Round 002: test acc mean=0.6865 ± 0.0180 | min=0.6406 max=0.7068
         : test loss mean=3.3684 ± 0.0505
         : individual accs = ['0.691618', '0.692601', '0.664543', '0.704362', '0.685896', '0.703989', '0.640591', '0.686595', '0.695061', '0.706804', '0.694666', '0.703077', '0.699976', '0.655468', '0.703603', '0.690494', '0.663617', '0.673440', '0.697111', '0.675630']
         : correct/total = [(2855, 4128), (2911, 4203), (2712, 4081), (3052, 4333), (2806, 4091), (3018, 4287), (2686, 4193), (2986, 4349), (2913, 4191), (3023, 4277), (2878, 4143), (2948, 4193), (2865, 4093), (2751, 4197), (2851, 4052), (2782, 4029), (2756, 4153), (2817, 4183), (2847, 4084), (2789, 4128)]
         : compromised: 0.6797, honest: 0.6872
         : sketchguard stats = ['Node 0: acc_rate=0.917', 'Node 1: acc_rate=0.900', 'Node 2: acc_rate=1.000']...
Round 003: test acc mean=0.7110 ± 0.0245 | min=0.6361 max=0.7418
         : test loss mean=3.0428 ± 0.0941
         : individual accs = ['0.741521', '0.720676', '0.675080', '0.729979', '0.709362', '0.636109', '0.720725', '0.730743', '0.720115', '0.689034', '0.702872', '0.734796', '0.741754', '0.692161', '0.731244', '0.718292', '0.700458', '0.715276', '0.709598', '0.699612']
         : correct/total = [(3061, 4128), (3029, 4203), (2755, 4081), (3163, 4333), (2902, 4091), (2727, 4287), (3022, 4193), (3178, 4349), (3018, 4191), (2947, 4277), (2912, 4143), (3081, 4193), (3036, 4093), (2905, 4197), (2963, 4052), (2894, 4029), (2909, 4153), (2992, 4183), (2898, 4084), (2888, 4128)]
         : compromised: 0.6641, honest: 0.7162
         : sketchguard stats = ['Node 0: acc_rate=0.917', 'Node 1: acc_rate=0.900', 'Node 2: acc_rate=1.000']...
Round 004: test acc mean=0.7138 ± 0.0224 | min=0.6566 max=0.7468
         : test loss mean=2.5530 ± 0.1272
         : individual accs = ['0.713421', '0.742327', '0.697378', '0.706208', '0.739672', '0.656636', '0.730742', '0.736951', '0.707468', '0.699322', '0.675597', '0.724064', '0.698998', '0.700024', '0.746792', '0.735418', '0.713701', '0.730098', '0.717679', '0.703488']
         : correct/total = [(2945, 4128), (3120, 4203), (2846, 4081), (3060, 4333), (3026, 4091), (2815, 4287), (3064, 4193), (3205, 4349), (2965, 4191), (2991, 4277), (2799, 4143), (3036, 4193), (2861, 4093), (2938, 4197), (3026, 4052), (2963, 4029), (2964, 4153), (3054, 4183), (2931, 4084), (2904, 4128)]
         : compromised: 0.6783, honest: 0.7177
         : sketchguard stats = ['Node 0: acc_rate=0.917', 'Node 1: acc_rate=0.900', 'Node 2: acc_rate=1.000']...
Round 005: test acc mean=0.7011 ± 0.0247 | min=0.6540 max=0.7439
         : test loss mean=1.9543 ± 0.1343
         : individual accs = ['0.724322', '0.692125', '0.654006', '0.674821', '0.722562', '0.663168', '0.700692', '0.713037', '0.716535', '0.710779', '0.682597', '0.684713', '0.725385', '0.654992', '0.700148', '0.711591', '0.729593', '0.700693', '0.743879', '0.716812']
         : correct/total = [(2990, 4128), (2909, 4203), (2669, 4081), (2924, 4333), (2956, 4091), (2843, 4287), (2938, 4193), (3101, 4349), (3003, 4191), (3040, 4277), (2828, 4143), (2871, 4193), (2969, 4093), (2749, 4197), (2837, 4052), (2867, 4029), (3030, 4153), (2931, 4183), (3038, 4084), (2959, 4128)]
         : compromised: 0.6591, honest: 0.7058
         : sketchguard stats = ['Node 0: acc_rate=0.917', 'Node 1: acc_rate=0.900', 'Node 2: acc_rate=1.000']...
Round 006: test acc mean=0.7427 ± 0.0164 | min=0.6954 max=0.7709
         : test loss mean=1.2959 ± 0.1000
         : individual accs = ['0.719477', '0.733048', '0.751286', '0.739672', '0.746272', '0.695358', '0.744574', '0.760635', '0.751372', '0.719196', '0.738595', '0.742189', '0.750305', '0.745294', '0.746298', '0.770911', '0.751264', '0.748745', '0.762977', '0.735950']
         : correct/total = [(2970, 4128), (3081, 4203), (3066, 4081), (3205, 4333), (3053, 4091), (2981, 4287), (3122, 4193), (3308, 4349), (3149, 4191), (3076, 4277), (3060, 4143), (3112, 4193), (3071, 4093), (3128, 4197), (3024, 4052), (3106, 4029), (3120, 4153), (3132, 4183), (3116, 4084), (3038, 4128)]
         : compromised: 0.7203, honest: 0.7452
         : sketchguard stats = ['Node 0: acc_rate=0.917', 'Node 1: acc_rate=0.900', 'Node 2: acc_rate=1.000']...
Round 007: test acc mean=0.7906 ± 0.0099 | min=0.7727 max=0.8071
         : test loss mean=0.8404 ± 0.0543
         : individual accs = ['0.791667', '0.788009', '0.777996', '0.794830', '0.783183', '0.788897', '0.803959', '0.796965', '0.803627', '0.786065', '0.782283', '0.772716', '0.784999', '0.785799', '0.797137', '0.804170', '0.801589', '0.785322', '0.807052', '0.776405']
         : correct/total = [(3268, 4128), (3312, 4203), (3175, 4081), (3444, 4333), (3204, 4091), (3382, 4287), (3371, 4193), (3466, 4349), (3368, 4191), (3362, 4277), (3241, 4143), (3240, 4193), (3213, 4093), (3298, 4197), (3230, 4052), (3240, 4029), (3329, 4153), (3285, 4183), (3296, 4084), (3205, 4128)]
         : compromised: 0.7873, honest: 0.7910
         : sketchguard stats = ['Node 0: acc_rate=0.917', 'Node 1: acc_rate=0.900', 'Node 2: acc_rate=1.000']...
Round 008: test acc mean=0.8152 ± 0.0087 | min=0.7919 max=0.8243
         : test loss mean=0.6225 ± 0.0319
         : individual accs = ['0.807897', '0.818939', '0.811321', '0.823217', '0.801027', '0.822487', '0.820892', '0.822258', '0.823670', '0.818331', '0.802800', '0.820892', '0.811385', '0.818918', '0.824284', '0.822537', '0.815796', '0.808750', '0.817581', '0.791909']
         : correct/total = [(3335, 4128), (3442, 4203), (3311, 4081), (3567, 4333), (3277, 4091), (3526, 4287), (3442, 4193), (3576, 4349), (3452, 4191), (3500, 4277), (3326, 4143), (3442, 4193), (3321, 4093), (3437, 4197), (3340, 4052), (3314, 4029), (3388, 4153), (3383, 4183), (3339, 4084), (3269, 4128)]
         : compromised: 0.8207, honest: 0.8146
         : sketchguard stats = ['Node 0: acc_rate=0.917', 'Node 1: acc_rate=0.900', 'Node 2: acc_rate=1.000']...
Round 009: test acc mean=0.8310 ± 0.0057 | min=0.8222 max=0.8463
         : test loss mean=0.5368 ± 0.0195
         : individual accs = ['0.823886', '0.831311', '0.827493', '0.836141', '0.826693', '0.832517', '0.832340', '0.831226', '0.846337', '0.838906', '0.825489', '0.830193', '0.828488', '0.832976', '0.836871', '0.835691', '0.830002', '0.823333', '0.828599', '0.822190']
         : correct/total = [(3401, 4128), (3494, 4203), (3377, 4081), (3623, 4333), (3382, 4091), (3569, 4287), (3490, 4193), (3615, 4349), (3547, 4191), (3588, 4277), (3420, 4143), (3481, 4193), (3391, 4093), (3496, 4197), (3391, 4052), (3367, 4029), (3447, 4153), (3444, 4183), (3384, 4084), (3394, 4128)]
         : compromised: 0.8327, honest: 0.8308
         : sketchguard stats = ['Node 0: acc_rate=0.917', 'Node 1: acc_rate=0.900', 'Node 2: acc_rate=1.000']...
Round 010: test acc mean=0.8394 ± 0.0053 | min=0.8286 max=0.8467
         : test loss mean=0.4994 ± 0.0185
         : individual accs = ['0.833333', '0.844635', '0.833619', '0.840526', '0.830115', '0.835783', '0.844980', '0.842033', '0.844190', '0.840542', '0.828627', '0.834009', '0.840459', '0.843460', '0.846742', '0.846612', '0.839875', '0.843892', '0.839373', '0.834787']
         : correct/total = [(3440, 4128), (3550, 4203), (3402, 4081), (3642, 4333), (3396, 4091), (3583, 4287), (3543, 4193), (3662, 4349), (3538, 4191), (3595, 4277), (3433, 4143), (3497, 4193), (3440, 4093), (3540, 4197), (3431, 4052), (3411, 4029), (3488, 4153), (3530, 4183), (3428, 4084), (3446, 4128)]
         : compromised: 0.8396, honest: 0.8394
         : sketchguard stats = ['Node 0: acc_rate=0.917', 'Node 1: acc_rate=0.900', 'Node 2: acc_rate=1.000']...

=== FINAL RESULTS ===
Dataset: femnist, Nodes: 20, Graph: erdos, Aggregation: sketchguard
Attack: gaussian, 10.0% compromised
Final accuracy - Compromised: 0.8396, Honest: 0.8394
Overall test accuracy: mean=0.8394 ± 0.0053

=== Sketchguard SUMMARY ===
Node 0: acceptance=0.917
Node 1: acceptance=0.900
Node 2: acceptance=1.000
Node 3: acceptance=0.857
Node 4: acceptance=0.889
Node 5: acceptance=1.000
Node 6: acceptance=0.833
Node 7: acceptance=0.909
Node 8: acceptance=0.714
Node 9: acceptance=1.000
Node 10: acceptance=1.000
Node 11: acceptance=0.833
Node 12: acceptance=0.917
Node 13: acceptance=1.000
Node 14: acceptance=0.857
Node 15: acceptance=0.889
Node 16: acceptance=1.000
Node 17: acceptance=0.875
Node 18: acceptance=0.917
Node 19: acceptance=0.800

=== PARALLEL EXECUTION TIME (realistic for distributed system) ===
  COMMUNICATION (max across nodes):
    - Sketch transfer: 0.000s (0.0%)
    - Model fetch (accepted): 0.000s (0.0%)
  COMPUTATION (max across nodes):
    - Sketching: 4.346s (99.3%)
    - Filtering: 0.001s (0.0%)
    - Aggregation: 0.027s (0.6%)
  TOTALS:
    - Total computation: 4.375s (100.0%)
    - Total communication: 0.000s (0.0%)
    - Total parallel time: 4.375s

=== PER-NODE AVERAGE TIME ===
  - Sketching: 3.437s
  - Filtering: 0.001s
  - Aggregation: 0.015s
  - Sketch transfer: 0.000s
  - Model fetch: 0.000s
  - Total per node: 3.453s

=== TOTAL COMPUTATIONAL WORK (sum across all nodes) ===
  - Total sketching: 68.746s
  - Total filtering: 0.016s
  - Total aggregation: 0.298s
  - Total sketch transfer: 0.000s
  - Total model fetch: 0.000s
  - Grand total: 69.060s
  - Mean acceptance rate: 0.905

Sketchguard Algorithm Properties:
  - Original dimension: 6,603,710
  - Sketch size: 1000
  - Compression ratio: 19.9x
  - Single repetition: No repetitions needed
  - Theoretical complexity: O(d + N×k)
  - Approach: Sketch filtering + state aggregation
