Device: cuda
Seed: 987654321
Loading 36 LEAF FEMNIST train files...
LEAF FEMNIST train: 3597 users, 734463 samples
Loading 36 LEAF FEMNIST test files...
LEAF FEMNIST test: 3597 users, 83388 samples
Found 3597 train users, 3597 test users, 3597 common users
User sample counts range: 525 (max) to 17 (min)
Distributed ALL 3597 users across 20 clients
Users per client: 179 (with 17 clients getting +1 user)
Train partition sizes: [36360, 37070, 35957, 38262, 36024, 37732, 36921, 38328, 36867, 37683, 36507, 36915, 36007, 37001, 35681, 35453, 36585, 36801, 35964, 36345]
Test partition sizes: [4128, 4203, 4081, 4333, 4091, 4287, 4193, 4349, 4191, 4277, 4143, 4193, 4093, 4197, 4052, 4029, 4153, 4183, 4084, 4128]
  Client 0: 36360 train samples, 62 unique classes
  Client 1: 37070 train samples, 62 unique classes
  Client 2: 35957 train samples, 62 unique classes
  Client 3: 38262 train samples, 62 unique classes
  Client 4: 36024 train samples, 62 unique classes
  Client 5: 37732 train samples, 62 unique classes
  Client 6: 36921 train samples, 62 unique classes
  Client 7: 38328 train samples, 62 unique classes
  Client 8: 36867 train samples, 62 unique classes
  Client 9: 37683 train samples, 62 unique classes
  Client 10: 36507 train samples, 62 unique classes
  Client 11: 36915 train samples, 62 unique classes
  Client 12: 36007 train samples, 62 unique classes
  Client 13: 37001 train samples, 62 unique classes
  Client 14: 35681 train samples, 62 unique classes
  Client 15: 35453 train samples, 62 unique classes
  Client 16: 36585 train samples, 62 unique classes
  Client 17: 36801 train samples, 62 unique classes
  Client 18: 35964 train samples, 62 unique classes
  Client 19: 36345 train samples, 62 unique classes
Will sample 10000 samples per client per epoch
Graph: ring, nodes: 20, edges: 20
Degree statistics: avg=2.00, min=2, max=2
Attack: Compromised 8/20 nodes: [1, 5, 11, 12, 13, 14, 17, 18]
Attack type: backdoor, lambda: 1.0
Backdoor target label: 0, trigger size: 4
Model variant: baseline
Model parameters: 6,603,710
Initial test acc across nodes: mean=0.0168 ± 0.0139
Backdoor attack: Created poisoned datasets for 8 compromised nodes
Round 001: test acc mean=0.0534 ± 0.0936 | min=0.0024 max=0.4123
         : test loss mean=41100.4827 ± 91615.3789
         : individual accs = ['0.003391', '0.008327', '0.005146', '0.164782', '0.016866', '0.006998', '0.002623', '0.412279', '0.130756', '0.104045', '0.015206', '0.010494', '0.050330', '0.041696', '0.025420', '0.018367', '0.008668', '0.002391', '0.023506', '0.015746']
         : correct/total = [(14, 4128), (35, 4203), (21, 4081), (714, 4333), (69, 4091), (30, 4287), (11, 4193), (1793, 4349), (548, 4191), (445, 4277), (63, 4143), (44, 4193), (206, 4093), (175, 4197), (103, 4052), (74, 4029), (36, 4153), (10, 4183), (96, 4084), (65, 4128)]
         : compromised: 0.0211, honest: 0.0748
Round 002: test acc mean=0.0826 ± 0.1434 | min=0.0438 max=0.7072
         : test loss mean=nan ± nan
         : individual accs = ['0.048934', '0.050202', '0.054889', '0.047773', '0.044977', '0.045953', '0.043883', '0.047827', '0.707230', '0.044891', '0.055274', '0.053184', '0.054239', '0.049083', '0.051579', '0.054852', '0.054418', '0.053311', '0.045788', '0.043847']
         : correct/total = [(202, 4128), (211, 4203), (224, 4081), (207, 4333), (184, 4091), (197, 4287), (184, 4193), (208, 4349), (2964, 4191), (192, 4277), (229, 4143), (223, 4193), (222, 4093), (206, 4197), (209, 4052), (221, 4029), (226, 4153), (223, 4183), (187, 4084), (181, 4128)]
         : compromised: 0.0504, honest: 0.1041
Round 003: test acc mean=0.0498 ± 0.0040 | min=0.0439 max=0.0561
         : test loss mean=nan ± nan
         : individual accs = ['0.045785', '0.050202', '0.056114', '0.047773', '0.044977', '0.050618', '0.043883', '0.047827', '0.051062', '0.044891', '0.055998', '0.049606', '0.054239', '0.049083', '0.051579', '0.054852', '0.054418', '0.053311', '0.045788', '0.044331']
         : correct/total = [(189, 4128), (211, 4203), (229, 4081), (207, 4333), (184, 4091), (217, 4287), (184, 4193), (208, 4349), (214, 4191), (192, 4277), (232, 4143), (208, 4193), (222, 4093), (206, 4197), (209, 4052), (221, 4029), (226, 4153), (223, 4183), (187, 4084), (183, 4128)]
         : compromised: 0.0506, honest: 0.0493
Round 004: test acc mean=0.0509 ± 0.0049 | min=0.0408 max=0.0582
         : test loss mean=nan ± nan
         : individual accs = ['0.048934', '0.050202', '0.056114', '0.052850', '0.057932', '0.045953', '0.043883', '0.058174', '0.040802', '0.044891', '0.055998', '0.049606', '0.054239', '0.049083', '0.051579', '0.054852', '0.054418', '0.053311', '0.051665', '0.043847']
         : correct/total = [(202, 4128), (211, 4203), (229, 4081), (229, 4333), (237, 4091), (197, 4287), (184, 4193), (253, 4349), (171, 4191), (192, 4277), (232, 4143), (208, 4193), (222, 4093), (206, 4197), (209, 4052), (221, 4029), (226, 4153), (223, 4183), (211, 4084), (181, 4128)]
         : compromised: 0.0507, honest: 0.0511
Round 005: test acc mean=0.0514 ± 0.0039 | min=0.0434 max=0.0582
         : test loss mean=nan ± nan
         : individual accs = ['0.047723', '0.050202', '0.055134', '0.052850', '0.044977', '0.050618', '0.057000', '0.058174', '0.053209', '0.053776', '0.047550', '0.049606', '0.054239', '0.049083', '0.051579', '0.054852', '0.054418', '0.053311', '0.045788', '0.043362']
         : correct/total = [(197, 4128), (211, 4203), (225, 4081), (229, 4333), (184, 4091), (217, 4287), (239, 4193), (253, 4349), (223, 4191), (230, 4277), (197, 4143), (208, 4193), (222, 4093), (206, 4197), (209, 4052), (221, 4029), (226, 4153), (223, 4183), (187, 4084), (179, 4128)]
         : compromised: 0.0506, honest: 0.0519
Round 006: test acc mean=0.0513 ± 0.0036 | min=0.0450 max=0.0582
         : test loss mean=nan ± nan
         : individual accs = ['0.050145', '0.050202', '0.055134', '0.052850', '0.044977', '0.050618', '0.057000', '0.058174', '0.053209', '0.053776', '0.047550', '0.054376', '0.054239', '0.049083', '0.046397', '0.051626', '0.052011', '0.048291', '0.051665', '0.045058']
         : correct/total = [(207, 4128), (211, 4203), (225, 4081), (229, 4333), (184, 4091), (217, 4287), (239, 4193), (253, 4349), (223, 4191), (230, 4277), (197, 4143), (228, 4193), (222, 4093), (206, 4197), (188, 4052), (208, 4029), (216, 4153), (202, 4183), (211, 4084), (186, 4128)]
         : compromised: 0.0506, honest: 0.0518
Round 007: test acc mean=0.0516 ± 0.0037 | min=0.0445 max=0.0582
         : test loss mean=nan ± nan
         : individual accs = ['0.051599', '0.052344', '0.056114', '0.052850', '0.048643', '0.050618', '0.057000', '0.058174', '0.053209', '0.053776', '0.047550', '0.054376', '0.054239', '0.049083', '0.046397', '0.053860', '0.044546', '0.045900', '0.052889', '0.048450']
         : correct/total = [(213, 4128), (220, 4203), (229, 4081), (229, 4333), (199, 4091), (217, 4287), (239, 4193), (253, 4349), (223, 4191), (230, 4277), (197, 4143), (228, 4193), (222, 4093), (206, 4197), (188, 4052), (217, 4029), (185, 4153), (192, 4183), (216, 4084), (200, 4128)]
         : compromised: 0.0507, honest: 0.0521
Round 008: test acc mean=0.0518 ± 0.0034 | min=0.0445 max=0.0582
         : test loss mean=nan ± nan
         : individual accs = ['0.050145', '0.052344', '0.050723', '0.052850', '0.051088', '0.050618', '0.057000', '0.058174', '0.053209', '0.053776', '0.050447', '0.054376', '0.054239', '0.049083', '0.046397', '0.053860', '0.044546', '0.045900', '0.052889', '0.054506']
         : correct/total = [(207, 4128), (220, 4203), (207, 4081), (229, 4333), (209, 4091), (217, 4287), (239, 4193), (253, 4349), (223, 4191), (230, 4277), (209, 4143), (228, 4193), (222, 4093), (206, 4197), (188, 4052), (217, 4029), (185, 4153), (192, 4183), (216, 4084), (225, 4128)]
         : compromised: 0.0507, honest: 0.0525
Round 009: test acc mean=0.0482 ± 0.0089 | min=0.0281 max=0.0582
         : test loss mean=nan ± nan
         : individual accs = ['0.030523', '0.052344', '0.054889', '0.052850', '0.052066', '0.050618', '0.057000', '0.058174', '0.053209', '0.053776', '0.050447', '0.028142', '0.054239', '0.049083', '0.051826', '0.050633', '0.051288', '0.048291', '0.033301', '0.032219']
         : correct/total = [(126, 4128), (220, 4203), (224, 4081), (229, 4333), (213, 4091), (217, 4287), (239, 4193), (253, 4349), (223, 4191), (230, 4277), (209, 4143), (118, 4193), (222, 4093), (206, 4197), (210, 4052), (204, 4029), (213, 4153), (202, 4183), (136, 4084), (133, 4128)]
         : compromised: 0.0460, honest: 0.0498
Round 010: test acc mean=0.0501 ± 0.0043 | min=0.0430 max=0.0582
         : test loss mean=nan ± nan
         : individual accs = ['0.048934', '0.048775', '0.053418', '0.043157', '0.043021', '0.045253', '0.057000', '0.058174', '0.053209', '0.053776', '0.050447', '0.045314', '0.054239', '0.049083', '0.051826', '0.050633', '0.051288', '0.048291', '0.052889', '0.043847']
         : correct/total = [(202, 4128), (205, 4203), (218, 4081), (187, 4333), (176, 4091), (194, 4287), (239, 4193), (253, 4349), (223, 4191), (230, 4277), (209, 4143), (190, 4193), (222, 4093), (206, 4197), (210, 4052), (204, 4029), (213, 4153), (202, 4183), (216, 4084), (181, 4128)]
         : compromised: 0.0495, honest: 0.0506

=== FINAL RESULTS ===
Dataset: femnist, Nodes: 20, Graph: ring, Aggregation: d-fedavg
Attack: backdoor, 40.0% compromised
Final accuracy - Compromised: 0.0495, Honest: 0.0506
Overall test accuracy: mean=0.0501 ± 0.0043

=== BACKDOOR ATTACK SUCCESS RATE (ASR) ===
Target label: 0
Trigger size: 4x4
Overall ASR: 0.4000 ± 0.4899
Honest nodes ASR: 0.2500 ± 0.4330
Compromised nodes ASR: 0.6250 ± 0.4841
Note: Higher ASR indicates more successful backdoor attack
