Device: cuda
Seed: 987654321
Loading 36 LEAF FEMNIST train files...
LEAF FEMNIST train: 3597 users, 734463 samples
Loading 36 LEAF FEMNIST test files...
LEAF FEMNIST test: 3597 users, 83388 samples
Found 3597 train users, 3597 test users, 3597 common users
User sample counts range: 525 (max) to 17 (min)
Distributed ALL 3597 users across 20 clients
Users per client: 179 (with 17 clients getting +1 user)
Train partition sizes: [36360, 37070, 35957, 38262, 36024, 37732, 36921, 38328, 36867, 37683, 36507, 36915, 36007, 37001, 35681, 35453, 36585, 36801, 35964, 36345]
Test partition sizes: [4128, 4203, 4081, 4333, 4091, 4287, 4193, 4349, 4191, 4277, 4143, 4193, 4093, 4197, 4052, 4029, 4153, 4183, 4084, 4128]
  Client 0: 36360 train samples, 62 unique classes
  Client 1: 37070 train samples, 62 unique classes
  Client 2: 35957 train samples, 62 unique classes
  Client 3: 38262 train samples, 62 unique classes
  Client 4: 36024 train samples, 62 unique classes
  Client 5: 37732 train samples, 62 unique classes
  Client 6: 36921 train samples, 62 unique classes
  Client 7: 38328 train samples, 62 unique classes
  Client 8: 36867 train samples, 62 unique classes
  Client 9: 37683 train samples, 62 unique classes
  Client 10: 36507 train samples, 62 unique classes
  Client 11: 36915 train samples, 62 unique classes
  Client 12: 36007 train samples, 62 unique classes
  Client 13: 37001 train samples, 62 unique classes
  Client 14: 35681 train samples, 62 unique classes
  Client 15: 35453 train samples, 62 unique classes
  Client 16: 36585 train samples, 62 unique classes
  Client 17: 36801 train samples, 62 unique classes
  Client 18: 35964 train samples, 62 unique classes
  Client 19: 36345 train samples, 62 unique classes
Will sample 10000 samples per client per epoch
Graph: erdos, nodes: 20, edges: 48
Degree statistics: avg=4.80, min=2, max=7
Attack: Compromised 8/20 nodes: [1, 5, 11, 12, 13, 14, 17, 18]
Attack type: backdoor, lambda: 1.0
Backdoor target label: 0, trigger size: 4
Model variant: baseline
Model parameters: 6,603,710
UBAR ALGORITHM (Two-Stage Byzantine-resilient)
  - Model dimension: 6,603,710 parameters
  - Rho parameter: 0.6
  - Stage 1: Distance-based filtering (select 60% closest neighbors)
  - Stage 2: Performance-based selection (loss comparison)
  - Complexity: O(deg(i)×d + deg(i)×inference)
Initial test acc across nodes: mean=0.0162 ± 0.0138
Backdoor attack: Created poisoned datasets for 8 compromised nodes
Round 001: test acc mean=0.2866 ± 0.1554 | min=0.0474 max=0.4940
         : test loss mean=7245.3825 ± 9112.8498
         : individual accs = ['0.408430', '0.048775', '0.421710', '0.417955', '0.494011', '0.169582', '0.410684', '0.371120', '0.413982', '0.420856', '0.315955', '0.144288', '0.047398', '0.047653', '0.098223', '0.349218', '0.442572', '0.179297', '0.105289', '0.424176']
         : correct/total = [(1686, 4128), (205, 4203), (1721, 4081), (1811, 4333), (2021, 4091), (727, 4287), (1722, 4193), (1614, 4349), (1735, 4191), (1800, 4277), (1309, 4143), (605, 4193), (194, 4093), (200, 4197), (398, 4052), (1407, 4029), (1838, 4153), (750, 4183), (430, 4084), (1751, 4128)]
         : compromised: 0.1051, honest: 0.4076
         : ubar stats = ['Node 0: s1=0.500, s2=0.333', 'Node 1: s1=0.500, s2=1.000', 'Node 2: s1=0.600, s2=0.333']...
Round 002: test acc mean=0.4411 ± 0.3237 | min=0.0088 max=0.7506
         : test loss mean=2039.7406 ± 6681.2168
         : individual accs = ['0.705911', '0.046395', '0.686596', '0.743134', '0.667074', '0.051318', '0.696399', '0.669349', '0.743259', '0.732757', '0.693217', '0.051514', '0.052040', '0.008816', '0.050099', '0.750558', '0.663376', '0.046378', '0.059745', '0.704215']
         : correct/total = [(2914, 4128), (195, 4203), (2802, 4081), (3220, 4333), (2729, 4091), (220, 4287), (2920, 4193), (2911, 4349), (3115, 4191), (3134, 4277), (2872, 4143), (216, 4193), (213, 4093), (37, 4197), (203, 4052), (3024, 4029), (2755, 4153), (194, 4183), (244, 4084), (2907, 4128)]
         : compromised: 0.0458, honest: 0.7047
         : ubar stats = ['Node 0: s1=0.500, s2=0.333', 'Node 1: s1=0.500, s2=1.000', 'Node 2: s1=0.600, s2=0.333']...
Round 003: test acc mean=0.4783 ± 0.3510 | min=0.0474 max=0.7985
         : test loss mean=nan ± nan
         : individual accs = ['0.783430', '0.048775', '0.783386', '0.793446', '0.774383', '0.058782', '0.632244', '0.789837', '0.782391', '0.798457', '0.664253', '0.048891', '0.047398', '0.047653', '0.054788', '0.786051', '0.778233', '0.049247', '0.054358', '0.790213']
         : correct/total = [(3234, 4128), (205, 4203), (3197, 4081), (3438, 4333), (3168, 4091), (252, 4287), (2651, 4193), (3435, 4349), (3279, 4191), (3415, 4277), (2752, 4143), (205, 4193), (194, 4093), (200, 4197), (222, 4052), (3167, 4029), (3232, 4153), (206, 4183), (222, 4084), (3262, 4128)]
         : compromised: 0.0512, honest: 0.7630
         : ubar stats = ['Node 0: s1=0.500, s2=0.333', 'Node 1: s1=0.500, s2=0.778', 'Node 2: s1=0.600, s2=0.333']...
Round 004: test acc mean=0.4898 ± 0.3629 | min=0.0474 max=0.8238
         : test loss mean=nan ± nan
         : individual accs = ['0.799903', '0.048775', '0.552561', '0.821832', '0.803715', '0.052484', '0.779633', '0.809611', '0.811024', '0.819500', '0.786387', '0.048891', '0.047398', '0.047653', '0.054788', '0.823778', '0.803516', '0.049247', '0.054358', '0.780281']
         : correct/total = [(3302, 4128), (205, 4203), (2255, 4081), (3561, 4333), (3288, 4091), (225, 4287), (3269, 4193), (3521, 4349), (3399, 4191), (3505, 4277), (3258, 4143), (205, 4193), (194, 4093), (200, 4197), (222, 4052), (3319, 4029), (3337, 4153), (206, 4183), (222, 4084), (3221, 4128)]
         : compromised: 0.0504, honest: 0.7826
         : ubar stats = ['Node 0: s1=0.500, s2=0.333', 'Node 1: s1=0.500, s2=0.667', 'Node 2: s1=0.600, s2=0.333']...
Round 005: test acc mean=0.5096 ± 0.3750 | min=0.0474 max=0.8313
         : test loss mean=nan ± nan
         : individual accs = ['0.814922', '0.048775', '0.800049', '0.828525', '0.818382', '0.052484', '0.814930', '0.815590', '0.831305', '0.827683', '0.788800', '0.048891', '0.047398', '0.047653', '0.054788', '0.815835', '0.819648', '0.049247', '0.054358', '0.812984']
         : correct/total = [(3364, 4128), (205, 4203), (3265, 4081), (3590, 4333), (3348, 4091), (225, 4287), (3417, 4193), (3547, 4349), (3484, 4191), (3540, 4277), (3268, 4143), (205, 4193), (194, 4093), (200, 4197), (222, 4052), (3287, 4029), (3404, 4153), (206, 4183), (222, 4084), (3356, 4128)]
         : compromised: 0.0504, honest: 0.8157
         : ubar stats = ['Node 0: s1=0.500, s2=0.333', 'Node 1: s1=0.500, s2=0.600', 'Node 2: s1=0.600, s2=0.333']...
Round 006: test acc mean=0.5107 ± 0.3764 | min=0.0474 max=0.8351
         : test loss mean=nan ± nan
         : individual accs = ['0.820494', '0.048775', '0.813281', '0.834526', '0.821315', '0.052484', '0.732411', '0.831915', '0.835123', '0.834463', '0.812937', '0.048891', '0.047398', '0.047653', '0.054788', '0.829734', '0.826631', '0.049247', '0.054358', '0.817103']
         : correct/total = [(3387, 4128), (205, 4203), (3319, 4081), (3616, 4333), (3360, 4091), (225, 4287), (3071, 4193), (3618, 4349), (3500, 4191), (3569, 4277), (3368, 4143), (205, 4193), (194, 4093), (200, 4197), (222, 4052), (3343, 4029), (3433, 4153), (206, 4183), (222, 4084), (3373, 4128)]
         : compromised: 0.0504, honest: 0.8175
         : ubar stats = ['Node 0: s1=0.500, s2=0.333', 'Node 1: s1=0.500, s2=0.556', 'Node 2: s1=0.600, s2=0.333']...
Round 007: test acc mean=0.5204 ± 0.3838 | min=0.0474 max=0.8470
         : test loss mean=nan ± nan
         : individual accs = ['0.828246', '0.048775', '0.840970', '0.846988', '0.832315', '0.052484', '0.822561', '0.846401', '0.841088', '0.841244', '0.813903', '0.048891', '0.047398', '0.047653', '0.054788', '0.830479', '0.841801', '0.049247', '0.054358', '0.818072']
         : correct/total = [(3419, 4128), (205, 4203), (3432, 4081), (3670, 4333), (3405, 4091), (225, 4287), (3449, 4193), (3681, 4349), (3525, 4191), (3598, 4277), (3372, 4143), (205, 4193), (194, 4093), (200, 4197), (222, 4052), (3346, 4029), (3496, 4153), (206, 4183), (222, 4084), (3377, 4128)]
         : compromised: 0.0504, honest: 0.8337
         : ubar stats = ['Node 0: s1=0.500, s2=0.333', 'Node 1: s1=0.500, s2=0.524', 'Node 2: s1=0.600, s2=0.333']...
Round 008: test acc mean=0.5138 ± 0.3799 | min=0.0474 max=0.8481
         : test loss mean=nan ± nan
         : individual accs = ['0.827277', '0.048775', '0.835580', '0.848142', '0.835248', '0.052484', '0.675888', '0.844792', '0.843951', '0.846388', '0.823799', '0.048891', '0.047398', '0.047653', '0.054788', '0.839662', '0.837226', '0.049247', '0.054358', '0.813953']
         : correct/total = [(3415, 4128), (205, 4203), (3410, 4081), (3675, 4333), (3417, 4091), (225, 4287), (2834, 4193), (3674, 4349), (3537, 4191), (3620, 4277), (3413, 4143), (205, 4193), (194, 4093), (200, 4197), (222, 4052), (3383, 4029), (3477, 4153), (206, 4183), (222, 4084), (3360, 4128)]
         : compromised: 0.0504, honest: 0.8227
         : ubar stats = ['Node 0: s1=0.500, s2=0.333', 'Node 1: s1=0.500, s2=0.500', 'Node 2: s1=0.600, s2=0.333']...
Round 009: test acc mean=0.5256 ± 0.3880 | min=0.0474 max=0.8554
         : test loss mean=nan ± nan
         : individual accs = ['0.836483', '0.048775', '0.845136', '0.853450', '0.835981', '0.052484', '0.835679', '0.844332', '0.855404', '0.849661', '0.832730', '0.048891', '0.047398', '0.047653', '0.054788', '0.843137', '0.842523', '0.049247', '0.054358', '0.834787']
         : correct/total = [(3453, 4128), (205, 4203), (3449, 4081), (3698, 4333), (3420, 4091), (225, 4287), (3504, 4193), (3672, 4349), (3585, 4191), (3634, 4277), (3450, 4143), (205, 4193), (194, 4093), (200, 4197), (222, 4052), (3397, 4029), (3499, 4153), (206, 4183), (222, 4084), (3446, 4128)]
         : compromised: 0.0504, honest: 0.8424
         : ubar stats = ['Node 0: s1=0.500, s2=0.333', 'Node 1: s1=0.500, s2=0.481', 'Node 2: s1=0.600, s2=0.333']...
Round 010: test acc mean=0.5228 ± 0.3864 | min=0.0474 max=0.8573
         : test loss mean=nan ± nan
         : individual accs = ['0.843023', '0.048775', '0.850282', '0.855758', '0.837692', '0.052484', '0.737896', '0.851000', '0.857313', '0.854805', '0.835868', '0.048891', '0.047398', '0.047653', '0.054788', '0.846860', '0.843246', '0.049247', '0.054358', '0.838178']
         : correct/total = [(3480, 4128), (205, 4203), (3470, 4081), (3708, 4333), (3427, 4091), (225, 4287), (3094, 4193), (3701, 4349), (3593, 4191), (3656, 4277), (3463, 4143), (205, 4193), (194, 4093), (200, 4197), (222, 4052), (3412, 4029), (3502, 4153), (206, 4183), (222, 4084), (3460, 4128)]
         : compromised: 0.0504, honest: 0.8377
         : ubar stats = ['Node 0: s1=0.500, s2=0.333', 'Node 1: s1=0.500, s2=0.467', 'Node 2: s1=0.600, s2=0.333']...

=== FINAL RESULTS ===
Dataset: femnist, Nodes: 20, Graph: erdos, Aggregation: ubar
Attack: backdoor, 40.0% compromised
Final accuracy - Compromised: 0.0504, Honest: 0.8377
Overall test accuracy: mean=0.5228 ± 0.3864

=== BACKDOOR ATTACK SUCCESS RATE (ASR) ===
Target label: 0
Trigger size: 4x4
Overall ASR: 0.4320 ± 0.4638
Honest nodes ASR: 0.0534 ± 0.0048
Compromised nodes ASR: 1.0000 ± 0.0000
Note: Higher ASR indicates more successful backdoor attack

=== UBAR SUMMARY ===
Node 0: stage1=0.500, stage2=0.333, overall=0.167
Node 1: stage1=0.500, stage2=0.467, overall=0.233
Node 2: stage1=0.600, stage2=0.333, overall=0.200
Node 3: stage1=0.500, stage2=0.550, overall=0.275
Node 4: stage1=0.500, stage2=0.500, overall=0.250
Node 5: stage1=0.600, stage2=0.400, overall=0.240
Node 6: stage1=0.600, stage2=0.367, overall=0.220
Node 7: stage1=0.600, stage2=0.367, overall=0.220
Node 8: stage1=0.500, stage2=1.000, overall=0.500
Node 9: stage1=0.333, stage2=1.000, overall=0.333
Node 10: stage1=0.500, stage2=0.600, overall=0.300
Node 11: stage1=0.571, stage2=0.350, overall=0.200
Node 12: stage1=0.571, stage2=0.400, overall=0.229
Node 13: stage1=0.500, stage2=0.600, overall=0.300
Node 14: stage1=0.571, stage2=0.375, overall=0.214
Node 15: stage1=0.500, stage2=0.333, overall=0.167
Node 16: stage1=0.600, stage2=0.333, overall=0.200
Node 17: stage1=0.600, stage2=0.467, overall=0.280
Node 18: stage1=0.500, stage2=0.600, overall=0.300
Node 19: stage1=0.500, stage2=1.000, overall=0.500

=== PARALLEL EXECUTION TIME (realistic for distributed system) ===
  COMMUNICATION (max across nodes):
    - Full model transfer: 0.000s (0.0%)
  COMPUTATION (max across nodes):
    - Distance computation: 0.028s (0.7%)
    - Loss computation: 4.137s (99.2%)
    - Aggregation: 0.005s (0.1%)
  TOTALS:
    - Total computation: 4.169s (100.0%)
    - Total communication: 0.000s (0.0%)
    - Total parallel time: 4.169s

=== PER-NODE AVERAGE TIME ===
  - Distance computation: 0.020s
  - Loss computation: 3.910s
  - Aggregation: 0.005s
  - Model transfer: 0.000s
  - Total per node: 3.935s

=== TOTAL COMPUTATIONAL WORK (sum across all nodes) ===
  - Total distance computation: 0.400s
  - Total loss computation: 78.206s
  - Total aggregation: 0.092s
  - Total model transfer: 0.000s
  - Grand total: 78.698s
  - Mean Stage 1 acceptance rate: 0.532
  - Mean Stage 2 acceptance rate: 0.519
  - Overall acceptance rate: 0.276

UBAR Algorithm Properties:
  - Model dimension: 6,603,710
  - Rho parameter: 0.6
  - Two-stage approach: Distance filtering + loss evaluation
  - Stage 1 selects: 60% of neighbors
  - Stage 2 uses: Training sample loss comparison
  - Theoretical complexity: O(deg(i)×d + deg(i)×inference)
  - Approach: UBAR paper implementation
