Device: cuda
Seed: 987654321
Loading 36 LEAF FEMNIST train files...
LEAF FEMNIST train: 3597 users, 734463 samples
Loading 36 LEAF FEMNIST test files...
LEAF FEMNIST test: 3597 users, 83388 samples
Found 3597 train users, 3597 test users, 3597 common users
User sample counts range: 525 (max) to 17 (min)
Distributed ALL 3597 users across 20 clients
Users per client: 179 (with 17 clients getting +1 user)
Train partition sizes: [36360, 37070, 35957, 38262, 36024, 37732, 36921, 38328, 36867, 37683, 36507, 36915, 36007, 37001, 35681, 35453, 36585, 36801, 35964, 36345]
Test partition sizes: [4128, 4203, 4081, 4333, 4091, 4287, 4193, 4349, 4191, 4277, 4143, 4193, 4093, 4197, 4052, 4029, 4153, 4183, 4084, 4128]
  Client 0: 36360 train samples, 62 unique classes
  Client 1: 37070 train samples, 62 unique classes
  Client 2: 35957 train samples, 62 unique classes
  Client 3: 38262 train samples, 62 unique classes
  Client 4: 36024 train samples, 62 unique classes
  Client 5: 37732 train samples, 62 unique classes
  Client 6: 36921 train samples, 62 unique classes
  Client 7: 38328 train samples, 62 unique classes
  Client 8: 36867 train samples, 62 unique classes
  Client 9: 37683 train samples, 62 unique classes
  Client 10: 36507 train samples, 62 unique classes
  Client 11: 36915 train samples, 62 unique classes
  Client 12: 36007 train samples, 62 unique classes
  Client 13: 37001 train samples, 62 unique classes
  Client 14: 35681 train samples, 62 unique classes
  Client 15: 35453 train samples, 62 unique classes
  Client 16: 36585 train samples, 62 unique classes
  Client 17: 36801 train samples, 62 unique classes
  Client 18: 35964 train samples, 62 unique classes
  Client 19: 36345 train samples, 62 unique classes
Will sample 10000 samples per client per epoch
Graph: erdos, nodes: 20, edges: 126
Degree statistics: avg=12.60, min=8, max=16
Attack: Compromised 6/20 nodes: [5, 12, 13, 14, 17, 18]
Attack type: backdoor, lambda: 1.0
Backdoor target label: 0, trigger size: 4
Model variant: baseline
Model parameters: 6,603,710
Initial test acc across nodes: mean=0.0168 ± 0.0139
Backdoor attack: Created poisoned datasets for 6 compromised nodes
Round 001: test acc mean=0.5366 ± 0.0147 | min=0.5121 max=0.5695
         : test loss mean=1.7454 ± 0.0497
         : individual accs = ['0.533672', '0.533191', '0.563587', '0.514193', '0.531899', '0.553067', '0.533270', '0.544033', '0.548318', '0.526070', '0.522085', '0.540663', '0.534816', '0.553252', '0.532083', '0.524696', '0.569468', '0.525221', '0.535994', '0.512112']
         : correct/total = [(2203, 4128), (2241, 4203), (2300, 4081), (2228, 4333), (2176, 4091), (2371, 4287), (2236, 4193), (2366, 4349), (2298, 4191), (2250, 4277), (2163, 4143), (2267, 4193), (2189, 4093), (2322, 4197), (2156, 4052), (2114, 4029), (2365, 4153), (2197, 4183), (2189, 4084), (2114, 4128)]
         : compromised: 0.5391, honest: 0.5355
Round 002: test acc mean=0.7303 ± 0.0115 | min=0.7019 max=0.7502
         : test loss mean=0.8933 ± 0.0389
         : individual accs = ['0.741764', '0.730906', '0.727518', '0.736210', '0.721095', '0.750175', '0.727403', '0.744309', '0.739442', '0.720599', '0.731595', '0.701884', '0.738089', '0.717894', '0.717177', '0.731447', '0.722129', '0.748028', '0.733105', '0.724806']
         : correct/total = [(3062, 4128), (3072, 4203), (2969, 4081), (3190, 4333), (2950, 4091), (3216, 4287), (3050, 4193), (3237, 4349), (3099, 4191), (3082, 4277), (3031, 4143), (2943, 4193), (3021, 4093), (3013, 4197), (2906, 4052), (2947, 4029), (2999, 4153), (3129, 4183), (2994, 4084), (2992, 4128)]
         : compromised: 0.7341, honest: 0.7287
Round 003: test acc mean=0.7791 ± 0.0126 | min=0.7505 max=0.7951
         : test loss mean=0.7099 ± 0.0313
         : individual accs = ['0.792636', '0.795146', '0.790738', '0.773829', '0.792716', '0.763704', '0.761746', '0.791676', '0.784300', '0.787000', '0.770698', '0.771524', '0.781823', '0.773648', '0.750494', '0.782080', '0.794125', '0.770022', '0.788443', '0.764777']
         : correct/total = [(3272, 4128), (3342, 4203), (3227, 4081), (3353, 4333), (3243, 4091), (3274, 4287), (3194, 4193), (3443, 4349), (3287, 4191), (3366, 4277), (3193, 4143), (3235, 4193), (3200, 4093), (3247, 4197), (3041, 4052), (3151, 4029), (3298, 4153), (3221, 4183), (3220, 4084), (3157, 4128)]
         : compromised: 0.7714, honest: 0.7824
Round 004: test acc mean=0.7968 ± 0.0107 | min=0.7707 max=0.8168
         : test loss mean=0.6398 ± 0.0345
         : individual accs = ['0.802326', '0.812039', '0.793188', '0.793676', '0.808360', '0.799160', '0.786549', '0.798115', '0.793367', '0.807108', '0.770698', '0.784641', '0.800391', '0.800095', '0.798124', '0.796972', '0.816759', '0.784604', '0.804848', '0.784157']
         : correct/total = [(3312, 4128), (3413, 4203), (3237, 4081), (3439, 4333), (3307, 4091), (3426, 4287), (3298, 4193), (3471, 4349), (3325, 4191), (3452, 4277), (3193, 4143), (3290, 4193), (3276, 4093), (3358, 4197), (3234, 4052), (3211, 4029), (3392, 4153), (3282, 4183), (3287, 4084), (3237, 4128)]
         : compromised: 0.7979, honest: 0.7963
Round 005: test acc mean=0.8016 ± 0.0070 | min=0.7897 max=0.8156
         : test loss mean=0.6038 ± 0.0243
         : individual accs = ['0.800145', '0.802998', '0.798824', '0.792061', '0.806160', '0.814322', '0.800143', '0.799264', '0.802911', '0.807575', '0.794111', '0.792750', '0.805277', '0.790565', '0.806515', '0.802929', '0.815555', '0.804925', '0.804358', '0.789729']
         : correct/total = [(3303, 4128), (3375, 4203), (3260, 4081), (3432, 4333), (3298, 4091), (3491, 4287), (3355, 4193), (3476, 4349), (3365, 4191), (3454, 4277), (3290, 4143), (3324, 4193), (3296, 4093), (3318, 4197), (3268, 4052), (3235, 4029), (3387, 4153), (3367, 4183), (3285, 4084), (3260, 4128)]
         : compromised: 0.8043, honest: 0.8004
Round 006: test acc mean=0.8215 ± 0.0102 | min=0.8022 max=0.8350
         : test loss mean=0.5515 ± 0.0310
         : individual accs = ['0.828973', '0.832976', '0.834599', '0.802216', '0.821560', '0.818521', '0.820176', '0.828696', '0.823193', '0.833294', '0.807145', '0.821846', '0.824823', '0.830355', '0.817127', '0.810127', '0.826391', '0.807793', '0.834966', '0.804506']
         : correct/total = [(3422, 4128), (3501, 4203), (3406, 4081), (3476, 4333), (3361, 4091), (3509, 4287), (3439, 4193), (3604, 4349), (3450, 4191), (3564, 4277), (3344, 4143), (3446, 4193), (3376, 4093), (3485, 4197), (3311, 4052), (3264, 4029), (3432, 4153), (3379, 4183), (3410, 4084), (3321, 4128)]
         : compromised: 0.8223, honest: 0.8211
Round 007: test acc mean=0.8246 ± 0.0080 | min=0.8104 max=0.8379
         : test loss mean=0.5403 ± 0.0288
         : individual accs = ['0.829700', '0.837259', '0.831169', '0.819755', '0.833781', '0.818055', '0.818746', '0.837894', '0.819375', '0.831892', '0.822592', '0.824469', '0.830687', '0.827019', '0.817374', '0.810375', '0.823260', '0.816161', '0.831538', '0.811047']
         : correct/total = [(3425, 4128), (3519, 4203), (3392, 4081), (3552, 4333), (3411, 4091), (3507, 4287), (3433, 4193), (3644, 4349), (3434, 4191), (3558, 4277), (3408, 4143), (3457, 4193), (3400, 4093), (3471, 4197), (3312, 4052), (3265, 4029), (3419, 4153), (3414, 4183), (3396, 4084), (3348, 4128)]
         : compromised: 0.8235, honest: 0.8251
Round 008: test acc mean=0.8255 ± 0.0072 | min=0.8120 max=0.8425
         : test loss mean=0.5208 ± 0.0265
         : individual accs = ['0.832122', '0.829645', '0.825043', '0.828525', '0.837448', '0.826919', '0.821369', '0.842493', '0.827487', '0.826280', '0.819696', '0.827808', '0.826289', '0.814153', '0.824038', '0.812609', '0.825187', '0.826201', '0.823947', '0.812016']
         : correct/total = [(3435, 4128), (3487, 4203), (3367, 4081), (3590, 4333), (3426, 4091), (3545, 4287), (3444, 4193), (3664, 4349), (3468, 4191), (3534, 4277), (3396, 4143), (3471, 4193), (3382, 4093), (3417, 4197), (3339, 4052), (3274, 4029), (3427, 4153), (3456, 4183), (3365, 4084), (3352, 4128)]
         : compromised: 0.8236, honest: 0.8263
Round 009: test acc mean=0.8320 ± 0.0086 | min=0.8084 max=0.8475
         : test loss mean=0.5120 ± 0.0296
         : individual accs = ['0.831638', '0.847490', '0.828718', '0.829218', '0.839159', '0.839048', '0.834725', '0.840193', '0.831067', '0.836568', '0.829109', '0.818269', '0.844613', '0.836312', '0.828480', '0.830975', '0.823501', '0.828592', '0.833986', '0.808382']
         : correct/total = [(3433, 4128), (3562, 4203), (3382, 4081), (3593, 4333), (3433, 4091), (3597, 4287), (3500, 4193), (3654, 4349), (3483, 4191), (3578, 4277), (3435, 4143), (3431, 4193), (3457, 4093), (3510, 4197), (3357, 4052), (3348, 4029), (3420, 4153), (3466, 4183), (3406, 4084), (3337, 4128)]
         : compromised: 0.8352, honest: 0.8306
Round 010: test acc mean=0.8375 ± 0.0085 | min=0.8218 max=0.8497
         : test loss mean=0.4937 ± 0.0294
         : individual accs = ['0.847141', '0.848442', '0.846361', '0.833833', '0.846492', '0.832983', '0.821846', '0.846631', '0.827487', '0.845219', '0.832006', '0.840448', '0.840459', '0.836073', '0.829220', '0.825515', '0.836263', '0.838872', '0.849657', '0.825824']
         : correct/total = [(3497, 4128), (3566, 4203), (3454, 4081), (3613, 4333), (3463, 4091), (3571, 4287), (3446, 4193), (3682, 4349), (3468, 4191), (3615, 4277), (3447, 4143), (3524, 4193), (3440, 4093), (3509, 4197), (3360, 4052), (3326, 4029), (3473, 4153), (3509, 4183), (3470, 4084), (3409, 4128)]
         : compromised: 0.8379, honest: 0.8374

=== FINAL RESULTS ===
Dataset: femnist, Nodes: 20, Graph: erdos, Aggregation: krum
Attack: backdoor, 30.0% compromised
Final accuracy - Compromised: 0.8379, Honest: 0.8374
Overall test accuracy: mean=0.8375 ± 0.0085

=== BACKDOOR ATTACK SUCCESS RATE (ASR) ===
Target label: 0
Trigger size: 4x4
Overall ASR: 0.0555 ± 0.0063
Honest nodes ASR: 0.0551 ± 0.0059
Compromised nodes ASR: 0.0565 ± 0.0070
Note: Higher ASR indicates more successful backdoor attack
