Device: cuda
Seed: 987654321
Loading 36 LEAF FEMNIST train files...
LEAF FEMNIST train: 3597 users, 734463 samples
Loading 36 LEAF FEMNIST test files...
LEAF FEMNIST test: 3597 users, 83388 samples
Found 3597 train users, 3597 test users, 3597 common users
User sample counts range: 525 (max) to 17 (min)
Distributed ALL 3597 users across 20 clients
Users per client: 179 (with 17 clients getting +1 user)
Train partition sizes: [36360, 37070, 35957, 38262, 36024, 37732, 36921, 38328, 36867, 37683, 36507, 36915, 36007, 37001, 35681, 35453, 36585, 36801, 35964, 36345]
Test partition sizes: [4128, 4203, 4081, 4333, 4091, 4287, 4193, 4349, 4191, 4277, 4143, 4193, 4093, 4197, 4052, 4029, 4153, 4183, 4084, 4128]
  Client 0: 36360 train samples, 62 unique classes
  Client 1: 37070 train samples, 62 unique classes
  Client 2: 35957 train samples, 62 unique classes
  Client 3: 38262 train samples, 62 unique classes
  Client 4: 36024 train samples, 62 unique classes
  Client 5: 37732 train samples, 62 unique classes
  Client 6: 36921 train samples, 62 unique classes
  Client 7: 38328 train samples, 62 unique classes
  Client 8: 36867 train samples, 62 unique classes
  Client 9: 37683 train samples, 62 unique classes
  Client 10: 36507 train samples, 62 unique classes
  Client 11: 36915 train samples, 62 unique classes
  Client 12: 36007 train samples, 62 unique classes
  Client 13: 37001 train samples, 62 unique classes
  Client 14: 35681 train samples, 62 unique classes
  Client 15: 35453 train samples, 62 unique classes
  Client 16: 36585 train samples, 62 unique classes
  Client 17: 36801 train samples, 62 unique classes
  Client 18: 35964 train samples, 62 unique classes
  Client 19: 36345 train samples, 62 unique classes
Will sample 10000 samples per client per epoch
Graph: erdos, nodes: 20, edges: 126
Degree statistics: avg=12.60, min=8, max=16
Attack: Compromised 6/20 nodes: [5, 12, 13, 14, 17, 18]
Attack type: gaussian, lambda: 1.0
Model variant: baseline
Model parameters: 6,603,710
Sketchguard Node 0:
  Model dim: 6,603,710 → Sketch size: 1000
  Compression ratio: 6603.7x
  Using model parameters for aggregation, sketches for filtering
Sketchguard Node 1:
  Model dim: 6,603,710 → Sketch size: 1000
  Compression ratio: 6603.7x
  Using model parameters for aggregation, sketches for filtering
Sketchguard Node 2:
  Model dim: 6,603,710 → Sketch size: 1000
  Compression ratio: 6603.7x
  Using model parameters for aggregation, sketches for filtering
Sketchguard Node 3:
  Model dim: 6,603,710 → Sketch size: 1000
  Compression ratio: 6603.7x
  Using model parameters for aggregation, sketches for filtering
Sketchguard Node 4:
  Model dim: 6,603,710 → Sketch size: 1000
  Compression ratio: 6603.7x
  Using model parameters for aggregation, sketches for filtering
Sketchguard Node 5:
  Model dim: 6,603,710 → Sketch size: 1000
  Compression ratio: 6603.7x
  Using model parameters for aggregation, sketches for filtering
Sketchguard Node 6:
  Model dim: 6,603,710 → Sketch size: 1000
  Compression ratio: 6603.7x
  Using model parameters for aggregation, sketches for filtering
Sketchguard Node 7:
  Model dim: 6,603,710 → Sketch size: 1000
  Compression ratio: 6603.7x
  Using model parameters for aggregation, sketches for filtering
Sketchguard Node 8:
  Model dim: 6,603,710 → Sketch size: 1000
  Compression ratio: 6603.7x
  Using model parameters for aggregation, sketches for filtering
Sketchguard Node 9:
  Model dim: 6,603,710 → Sketch size: 1000
  Compression ratio: 6603.7x
  Using model parameters for aggregation, sketches for filtering
Sketchguard Node 10:
  Model dim: 6,603,710 → Sketch size: 1000
  Compression ratio: 6603.7x
  Using model parameters for aggregation, sketches for filtering
Sketchguard Node 11:
  Model dim: 6,603,710 → Sketch size: 1000
  Compression ratio: 6603.7x
  Using model parameters for aggregation, sketches for filtering
Sketchguard Node 12:
  Model dim: 6,603,710 → Sketch size: 1000
  Compression ratio: 6603.7x
  Using model parameters for aggregation, sketches for filtering
Sketchguard Node 13:
  Model dim: 6,603,710 → Sketch size: 1000
  Compression ratio: 6603.7x
  Using model parameters for aggregation, sketches for filtering
Sketchguard Node 14:
  Model dim: 6,603,710 → Sketch size: 1000
  Compression ratio: 6603.7x
  Using model parameters for aggregation, sketches for filtering
Sketchguard Node 15:
  Model dim: 6,603,710 → Sketch size: 1000
  Compression ratio: 6603.7x
  Using model parameters for aggregation, sketches for filtering
Sketchguard Node 16:
  Model dim: 6,603,710 → Sketch size: 1000
  Compression ratio: 6603.7x
  Using model parameters for aggregation, sketches for filtering
Sketchguard Node 17:
  Model dim: 6,603,710 → Sketch size: 1000
  Compression ratio: 6603.7x
  Using model parameters for aggregation, sketches for filtering
Sketchguard Node 18:
  Model dim: 6,603,710 → Sketch size: 1000
  Compression ratio: 6603.7x
  Using model parameters for aggregation, sketches for filtering
Sketchguard Node 19:
  Model dim: 6,603,710 → Sketch size: 1000
  Compression ratio: 6603.7x
  Using model parameters for aggregation, sketches for filtering
Sketchguard ALGORITHM (Sketch-based Filtering + State Aggregation)
  - Model dimension: 6,603,710 parameters
  - Config: SketchguardConfig(gamma=2, kappa=1, alpha=0.5, min_neighbors=1, sketch_size=1000, network_seed=987654321, attack_detection_window=5)
  - Sketch size: 1000
  - Compression ratio: 6603.7x
  - Complexity: O(d + N×k) = O(6,603,710 + 20×1000)
  - Theoretical speedup vs BALANCE: 19.9x
Initial test acc across nodes: mean=0.0168 ± 0.0139
Round 001: test acc mean=0.5098 ± 0.0351 | min=0.4527 max=0.5993
         : test loss mean=3.7281 ± 0.0281
         : individual accs = ['0.563711', '0.505591', '0.553541', '0.480037', '0.520900', '0.599254', '0.515621', '0.526098', '0.502744', '0.452654', '0.512913', '0.524207', '0.464940', '0.468430', '0.522705', '0.522710', '0.461835', '0.513507', '0.490940', '0.494186']
         : correct/total = [(2327, 4128), (2125, 4203), (2259, 4081), (2080, 4333), (2131, 4091), (2569, 4287), (2162, 4193), (2288, 4349), (2107, 4191), (1936, 4277), (2125, 4143), (2198, 4193), (1903, 4093), (1966, 4197), (2118, 4052), (2106, 4029), (1918, 4153), (2148, 4183), (2005, 4084), (2040, 4128)]
         : compromised: 0.5100, honest: 0.5098
         : sketchguard stats = ['Node 0: acc_rate=0.688', 'Node 1: acc_rate=0.818', 'Node 2: acc_rate=0.667']...
Round 002: test acc mean=0.6817 ± 0.0141 | min=0.6443 max=0.7068
         : test loss mean=3.3688 ± 0.0751
         : individual accs = ['0.680959', '0.682132', '0.676550', '0.699746', '0.697385', '0.706788', '0.667303', '0.685905', '0.673109', '0.672434', '0.689838', '0.680897', '0.662839', '0.680963', '0.685587', '0.644329', '0.685288', '0.704040', '0.679726', '0.678779']
         : correct/total = [(2811, 4128), (2867, 4203), (2761, 4081), (3032, 4333), (2853, 4091), (3030, 4287), (2798, 4193), (2983, 4349), (2821, 4191), (2876, 4277), (2858, 4143), (2855, 4193), (2713, 4093), (2858, 4197), (2778, 4052), (2596, 4029), (2846, 4153), (2945, 4183), (2776, 4084), (2802, 4128)]
         : compromised: 0.6867, honest: 0.6796
         : sketchguard stats = ['Node 0: acc_rate=0.688', 'Node 1: acc_rate=0.818', 'Node 2: acc_rate=0.667']...
Round 003: test acc mean=0.6961 ± 0.0358 | min=0.5706 max=0.7389
         : test loss mean=2.9956 ± 0.1787
         : individual accs = ['0.707364', '0.711397', '0.676305', '0.725825', '0.738939', '0.673665', '0.703554', '0.724764', '0.706037', '0.730419', '0.715424', '0.685190', '0.694356', '0.649512', '0.683366', '0.697940', '0.698050', '0.570643', '0.703722', '0.725533']
         : correct/total = [(2920, 4128), (2990, 4203), (2760, 4081), (3145, 4333), (3023, 4091), (2888, 4287), (2950, 4193), (3152, 4349), (2959, 4191), (3124, 4277), (2964, 4143), (2873, 4193), (2842, 4093), (2726, 4197), (2769, 4052), (2812, 4029), (2899, 4153), (2387, 4183), (2874, 4084), (2995, 4128)]
         : compromised: 0.6625, honest: 0.7105
         : sketchguard stats = ['Node 0: acc_rate=0.688', 'Node 1: acc_rate=0.818', 'Node 2: acc_rate=0.667']...
Round 004: test acc mean=0.6887 ± 0.0353 | min=0.6125 max=0.7407
         : test loss mean=2.4339 ± 0.2101
         : individual accs = ['0.703731', '0.734475', '0.690272', '0.726056', '0.740650', '0.628411', '0.700930', '0.700161', '0.715820', '0.681085', '0.687425', '0.720248', '0.612509', '0.631165', '0.667325', '0.676346', '0.732723', '0.684915', '0.655485', '0.684835']
         : correct/total = [(2905, 4128), (3087, 4203), (2817, 4081), (3146, 4333), (3030, 4091), (2694, 4287), (2939, 4193), (3045, 4349), (3000, 4191), (2913, 4277), (2848, 4143), (3020, 4193), (2507, 4093), (2649, 4197), (2704, 4052), (2725, 4029), (3043, 4153), (2865, 4183), (2677, 4084), (2827, 4128)]
         : compromised: 0.6466, honest: 0.7068
         : sketchguard stats = ['Node 0: acc_rate=0.688', 'Node 1: acc_rate=0.818', 'Node 2: acc_rate=0.667']...
Round 005: test acc mean=0.6827 ± 0.0377 | min=0.6069 max=0.7394
         : test loss mean=1.7537 ± 0.1999
         : individual accs = ['0.708576', '0.709493', '0.673364', '0.717055', '0.739428', '0.658736', '0.671357', '0.729363', '0.672870', '0.711714', '0.699010', '0.713093', '0.606890', '0.633786', '0.626604', '0.622239', '0.701180', '0.711212', '0.647894', '0.699612']
         : correct/total = [(2925, 4128), (2982, 4203), (2748, 4081), (3107, 4333), (3025, 4091), (2824, 4287), (2815, 4193), (3172, 4349), (2820, 4191), (3044, 4277), (2896, 4143), (2990, 4193), (2484, 4093), (2660, 4197), (2539, 4052), (2507, 4029), (2912, 4153), (2975, 4183), (2646, 4084), (2888, 4128)]
         : compromised: 0.6475, honest: 0.6977
         : sketchguard stats = ['Node 0: acc_rate=0.688', 'Node 1: acc_rate=0.818', 'Node 2: acc_rate=0.667']...
Round 006: test acc mean=0.7512 ± 0.0233 | min=0.6988 max=0.7820
         : test loss mean=1.0952 ± 0.1069
         : individual accs = ['0.765019', '0.775874', '0.766969', '0.758135', '0.781960', '0.749942', '0.758645', '0.757186', '0.744452', '0.742109', '0.770698', '0.780110', '0.709260', '0.698832', '0.747038', '0.719533', '0.755839', '0.772890', '0.714985', '0.754603']
         : correct/total = [(3158, 4128), (3261, 4203), (3130, 4081), (3285, 4333), (3199, 4091), (3215, 4287), (3181, 4193), (3293, 4349), (3120, 4191), (3174, 4277), (3193, 4143), (3271, 4193), (2903, 4093), (2933, 4197), (3027, 4052), (2899, 4029), (3139, 4153), (3233, 4183), (2920, 4084), (3115, 4128)]
         : compromised: 0.7322, honest: 0.7594
         : sketchguard stats = ['Node 0: acc_rate=0.688', 'Node 1: acc_rate=0.818', 'Node 2: acc_rate=0.667']...
Round 007: test acc mean=0.8023 ± 0.0108 | min=0.7717 max=0.8240
         : test loss mean=0.7118 ± 0.0466
         : individual accs = ['0.809593', '0.804663', '0.808625', '0.795754', '0.824004', '0.807324', '0.799189', '0.820878', '0.791935', '0.807108', '0.793628', '0.797997', '0.801613', '0.808435', '0.795656', '0.771655', '0.808813', '0.794884', '0.801175', '0.802568']
         : correct/total = [(3342, 4128), (3382, 4203), (3300, 4081), (3448, 4333), (3371, 4091), (3461, 4287), (3351, 4193), (3570, 4349), (3319, 4191), (3452, 4277), (3288, 4143), (3346, 4193), (3281, 4093), (3393, 4197), (3224, 4052), (3109, 4029), (3359, 4153), (3325, 4183), (3272, 4084), (3313, 4128)]
         : compromised: 0.8015, honest: 0.8026
         : sketchguard stats = ['Node 0: acc_rate=0.688', 'Node 1: acc_rate=0.818', 'Node 2: acc_rate=0.667']...
Round 008: test acc mean=0.8251 ± 0.0083 | min=0.8069 max=0.8365
         : test loss mean=0.5614 ± 0.0249
         : individual accs = ['0.826066', '0.832976', '0.833864', '0.830141', '0.835737', '0.831117', '0.818984', '0.836514', '0.821045', '0.836334', '0.817765', '0.821130', '0.826777', '0.822731', '0.810464', '0.806900', '0.822056', '0.819029', '0.833252', '0.820010']
         : correct/total = [(3410, 4128), (3501, 4203), (3403, 4081), (3597, 4333), (3419, 4091), (3563, 4287), (3434, 4193), (3638, 4349), (3441, 4191), (3577, 4277), (3388, 4143), (3443, 4193), (3384, 4093), (3453, 4197), (3284, 4052), (3251, 4029), (3414, 4153), (3426, 4183), (3403, 4084), (3385, 4128)]
         : compromised: 0.8239, honest: 0.8257
         : sketchguard stats = ['Node 0: acc_rate=0.688', 'Node 1: acc_rate=0.818', 'Node 2: acc_rate=0.667']...
Round 009: test acc mean=0.8346 ± 0.0073 | min=0.8233 max=0.8492
         : test loss mean=0.5116 ± 0.0203
         : individual accs = ['0.828004', '0.843445', '0.847586', '0.832679', '0.842092', '0.838115', '0.827093', '0.849161', '0.829396', '0.842413', '0.825489', '0.829239', '0.834596', '0.831546', '0.827986', '0.823281', '0.839875', '0.832178', '0.835945', '0.830911']
         : correct/total = [(3418, 4128), (3545, 4203), (3459, 4081), (3608, 4333), (3445, 4091), (3593, 4287), (3468, 4193), (3693, 4349), (3476, 4191), (3603, 4277), (3420, 4143), (3477, 4193), (3416, 4093), (3490, 4197), (3355, 4052), (3317, 4029), (3488, 4153), (3481, 4183), (3414, 4084), (3430, 4128)]
         : compromised: 0.8334, honest: 0.8350
         : sketchguard stats = ['Node 0: acc_rate=0.688', 'Node 1: acc_rate=0.818', 'Node 2: acc_rate=0.667']...
Round 010: test acc mean=0.8408 ± 0.0065 | min=0.8276 max=0.8499
         : test loss mean=0.4855 ± 0.0212
         : individual accs = ['0.840116', '0.846538', '0.845871', '0.838680', '0.849914', '0.843014', '0.838302', '0.849161', '0.841088', '0.849193', '0.833213', '0.827570', '0.844613', '0.844651', '0.834896', '0.831720', '0.843005', '0.837915', '0.846474', '0.829942']
         : correct/total = [(3468, 4128), (3558, 4203), (3452, 4081), (3634, 4333), (3477, 4091), (3614, 4287), (3515, 4193), (3693, 4349), (3525, 4191), (3632, 4277), (3452, 4143), (3470, 4193), (3457, 4093), (3545, 4197), (3383, 4052), (3351, 4029), (3501, 4153), (3505, 4183), (3457, 4084), (3426, 4128)]
         : compromised: 0.8419, honest: 0.8403
         : sketchguard stats = ['Node 0: acc_rate=0.688', 'Node 1: acc_rate=0.818', 'Node 2: acc_rate=0.667']...

=== FINAL RESULTS ===
Dataset: femnist, Nodes: 20, Graph: erdos, Aggregation: sketchguard
Attack: gaussian, 30.0% compromised
Final accuracy - Compromised: 0.8419, Honest: 0.8403
Overall test accuracy: mean=0.8408 ± 0.0065

=== Sketchguard SUMMARY ===
Node 0: acceptance=0.688
Node 1: acceptance=0.818
Node 2: acceptance=0.667
Node 3: acceptance=0.750
Node 4: acceptance=0.727
Node 5: acceptance=0.667
Node 6: acceptance=0.571
Node 7: acceptance=0.643
Node 8: acceptance=0.500
Node 9: acceptance=0.769
Node 10: acceptance=0.667
Node 11: acceptance=0.643
Node 12: acceptance=0.750
Node 13: acceptance=0.769
Node 14: acceptance=0.667
Node 15: acceptance=0.636
Node 16: acceptance=0.615
Node 17: acceptance=0.778
Node 18: acceptance=0.750
Node 19: acceptance=0.625

=== PARALLEL EXECUTION TIME (realistic for distributed system) ===
  COMMUNICATION (max across nodes):
    - Sketch transfer: 0.000s (0.0%)
    - Model fetch (accepted): 0.000s (0.0%)
  COMPUTATION (max across nodes):
    - Sketching: 4.948s (99.4%)
    - Filtering: 0.002s (0.0%)
    - Aggregation: 0.028s (0.6%)
  TOTALS:
    - Total computation: 4.979s (100.0%)
    - Total communication: 0.000s (0.0%)
    - Total parallel time: 4.979s

=== PER-NODE AVERAGE TIME ===
  - Sketching: 3.656s
  - Filtering: 0.001s
  - Aggregation: 0.017s
  - Sketch transfer: 0.000s
  - Model fetch: 0.000s
  - Total per node: 3.674s

=== TOTAL COMPUTATIONAL WORK (sum across all nodes) ===
  - Total sketching: 73.118s
  - Total filtering: 0.024s
  - Total aggregation: 0.340s
  - Total sketch transfer: 0.000s
  - Total model fetch: 0.000s
  - Grand total: 73.481s
  - Mean acceptance rate: 0.685

Sketchguard Algorithm Properties:
  - Original dimension: 6,603,710
  - Sketch size: 1000
  - Compression ratio: 19.9x
  - Single repetition: No repetitions needed
  - Theoretical complexity: O(d + N×k)
  - Approach: Sketch filtering + state aggregation
