Device: cuda
Seed: 987654321
Loading 36 LEAF FEMNIST train files...
LEAF FEMNIST train: 3597 users, 734463 samples
Loading 36 LEAF FEMNIST test files...
LEAF FEMNIST test: 3597 users, 83388 samples
Found 3597 train users, 3597 test users, 3597 common users
User sample counts range: 525 (max) to 17 (min)
Distributed ALL 3597 users across 20 clients
Users per client: 179 (with 17 clients getting +1 user)
Train partition sizes: [36360, 37070, 35957, 38262, 36024, 37732, 36921, 38328, 36867, 37683, 36507, 36915, 36007, 37001, 35681, 35453, 36585, 36801, 35964, 36345]
Test partition sizes: [4128, 4203, 4081, 4333, 4091, 4287, 4193, 4349, 4191, 4277, 4143, 4193, 4093, 4197, 4052, 4029, 4153, 4183, 4084, 4128]
  Client 0: 36360 train samples, 62 unique classes
  Client 1: 37070 train samples, 62 unique classes
  Client 2: 35957 train samples, 62 unique classes
  Client 3: 38262 train samples, 62 unique classes
  Client 4: 36024 train samples, 62 unique classes
  Client 5: 37732 train samples, 62 unique classes
  Client 6: 36921 train samples, 62 unique classes
  Client 7: 38328 train samples, 62 unique classes
  Client 8: 36867 train samples, 62 unique classes
  Client 9: 37683 train samples, 62 unique classes
  Client 10: 36507 train samples, 62 unique classes
  Client 11: 36915 train samples, 62 unique classes
  Client 12: 36007 train samples, 62 unique classes
  Client 13: 37001 train samples, 62 unique classes
  Client 14: 35681 train samples, 62 unique classes
  Client 15: 35453 train samples, 62 unique classes
  Client 16: 36585 train samples, 62 unique classes
  Client 17: 36801 train samples, 62 unique classes
  Client 18: 35964 train samples, 62 unique classes
  Client 19: 36345 train samples, 62 unique classes
Will sample 10000 samples per client per epoch
Graph: erdos, nodes: 20, edges: 126
Degree statistics: avg=12.60, min=8, max=16
Attack: Compromised 2/20 nodes: [5, 13]
Attack type: directed_deviation, lambda: 1.0
Model variant: baseline
Model parameters: 6,603,710
Initial test acc across nodes: mean=0.0168 ± 0.0139
Round 001: test acc mean=0.0202 ± 0.0182 | min=0.0025 max=0.0558
         : test loss mean=70.2330 ± 70.5078
         : individual accs = ['0.003391', '0.002855', '0.027689', '0.002539', '0.021511', '0.016328', '0.004054', '0.011497', '0.007158', '0.054477', '0.016655', '0.010255', '0.016369', '0.005242', '0.047878', '0.055845', '0.030340', '0.011953', '0.054358', '0.004118']
         : correct/total = [(14, 4128), (12, 4203), (113, 4081), (11, 4333), (88, 4091), (70, 4287), (17, 4193), (50, 4349), (30, 4191), (233, 4277), (69, 4143), (43, 4193), (67, 4093), (22, 4197), (194, 4052), (225, 4029), (126, 4153), (50, 4183), (222, 4084), (17, 4128)]
         : compromised: 0.0108, honest: 0.0213
Round 002: test acc mean=0.0469 ± 0.0104 | min=0.0033 max=0.0527
         : test loss mean=20.9107 ± 13.2299
         : individual accs = ['0.050145', '0.049726', '0.052683', '0.048465', '0.052554', '0.052484', '0.003339', '0.049207', '0.042233', '0.048398', '0.045619', '0.046983', '0.050574', '0.047177', '0.051826', '0.050633', '0.051288', '0.048291', '0.051665', '0.045058']
         : correct/total = [(207, 4128), (209, 4203), (215, 4081), (210, 4333), (215, 4091), (225, 4287), (14, 4193), (214, 4349), (177, 4191), (207, 4277), (189, 4143), (197, 4193), (207, 4093), (198, 4197), (210, 4052), (204, 4029), (213, 4153), (202, 4183), (211, 4084), (186, 4128)]
         : compromised: 0.0498, honest: 0.0466
Round 003: test acc mean=0.0514 ± 0.0034 | min=0.0469 max=0.0618
         : test loss mean=7.5286 ± 3.4491
         : individual accs = ['0.051599', '0.051630', '0.050723', '0.048465', '0.051088', '0.048052', '0.049130', '0.051276', '0.047960', '0.053075', '0.050447', '0.061770', '0.053750', '0.046938', '0.048124', '0.056342', '0.055141', '0.050203', '0.052889', '0.048450']
         : correct/total = [(213, 4128), (217, 4203), (207, 4081), (210, 4333), (209, 4091), (206, 4287), (206, 4193), (223, 4349), (201, 4191), (227, 4277), (209, 4143), (259, 4193), (220, 4093), (197, 4197), (195, 4052), (227, 4029), (229, 4153), (210, 4183), (216, 4084), (200, 4128)]
         : compromised: 0.0475, honest: 0.0518
Round 004: test acc mean=0.0494 ± 0.0047 | min=0.0446 max=0.0586
         : test loss mean=4.0393 ± 0.9181
         : individual accs = ['0.047238', '0.048775', '0.045087', '0.044773', '0.047421', '0.048752', '0.048891', '0.058174', '0.044619', '0.053776', '0.047309', '0.045314', '0.058637', '0.045747', '0.046397', '0.056590', '0.058271', '0.045900', '0.048482', '0.048692']
         : correct/total = [(195, 4128), (205, 4203), (184, 4081), (194, 4333), (194, 4091), (209, 4287), (205, 4193), (253, 4349), (187, 4191), (230, 4277), (196, 4143), (190, 4193), (240, 4093), (192, 4197), (188, 4052), (228, 4029), (242, 4153), (192, 4183), (198, 4084), (201, 4128)]
         : compromised: 0.0472, honest: 0.0497
Round 005: test acc mean=0.0493 ± 0.0037 | min=0.0420 max=0.0618
         : test loss mean=3.8221 ± 0.4170
         : individual accs = ['0.050145', '0.046158', '0.050723', '0.048234', '0.045710', '0.048052', '0.049130', '0.047827', '0.047960', '0.050503', '0.041999', '0.061770', '0.045688', '0.046938', '0.051826', '0.051378', '0.049362', '0.050203', '0.051665', '0.050872']
         : correct/total = [(207, 4128), (194, 4203), (207, 4081), (209, 4333), (187, 4091), (206, 4287), (206, 4193), (208, 4349), (201, 4191), (216, 4277), (174, 4143), (259, 4193), (187, 4093), (197, 4197), (210, 4052), (207, 4029), (205, 4153), (210, 4183), (211, 4084), (210, 4128)]
         : compromised: 0.0475, honest: 0.0495
Round 006: test acc mean=0.0501 ± 0.0050 | min=0.0446 max=0.0586
         : test loss mean=3.8513 ± 0.5561
         : individual accs = ['0.047238', '0.052344', '0.045087', '0.044773', '0.057932', '0.048752', '0.048891', '0.058174', '0.044619', '0.053776', '0.047309', '0.045314', '0.058637', '0.045747', '0.046397', '0.056590', '0.058271', '0.045900', '0.048482', '0.048692']
         : correct/total = [(195, 4128), (220, 4203), (184, 4081), (194, 4333), (237, 4091), (209, 4287), (205, 4193), (253, 4349), (187, 4191), (230, 4277), (196, 4143), (190, 4193), (240, 4093), (192, 4197), (188, 4052), (228, 4029), (242, 4153), (192, 4183), (198, 4084), (201, 4128)]
         : compromised: 0.0472, honest: 0.0505
Round 007: test acc mean=0.0491 ± 0.0039 | min=0.0420 max=0.0618
         : test loss mean=3.8003 ± 0.3999
         : individual accs = ['0.050145', '0.046158', '0.050723', '0.048234', '0.045710', '0.052484', '0.049130', '0.047827', '0.047960', '0.050503', '0.041999', '0.061770', '0.045688', '0.046938', '0.051826', '0.051378', '0.049362', '0.048291', '0.051665', '0.045058']
         : correct/total = [(207, 4128), (194, 4203), (207, 4081), (209, 4333), (187, 4091), (225, 4287), (206, 4193), (208, 4349), (201, 4191), (216, 4277), (174, 4143), (259, 4193), (187, 4093), (197, 4197), (210, 4052), (207, 4029), (205, 4153), (202, 4183), (211, 4084), (186, 4128)]
         : compromised: 0.0497, honest: 0.0491
Round 008: test acc mean=0.0529 ± 0.0053 | min=0.0446 max=0.0612
         : test loss mean=3.8383 ± 0.5857
         : individual accs = ['0.059593', '0.052344', '0.045087', '0.052850', '0.057932', '0.050618', '0.048891', '0.058174', '0.044619', '0.053776', '0.047309', '0.045314', '0.058637', '0.045747', '0.061204', '0.056590', '0.058271', '0.050920', '0.055583', '0.055475']
         : correct/total = [(246, 4128), (220, 4203), (184, 4081), (229, 4333), (237, 4091), (217, 4287), (205, 4193), (253, 4349), (187, 4191), (230, 4277), (196, 4143), (190, 4193), (240, 4093), (192, 4197), (248, 4052), (228, 4029), (242, 4153), (213, 4183), (227, 4084), (229, 4128)]
         : compromised: 0.0482, honest: 0.0535
Round 009: test acc mean=0.0528 ± 0.0045 | min=0.0451 max=0.0618
         : test loss mean=3.7867 ± 0.3758
         : individual accs = ['0.050145', '0.052344', '0.050723', '0.048234', '0.057932', '0.052484', '0.049130', '0.058174', '0.047960', '0.053776', '0.055998', '0.061770', '0.058637', '0.046938', '0.051826', '0.056590', '0.058271', '0.048291', '0.051665', '0.045058']
         : correct/total = [(207, 4128), (220, 4203), (207, 4081), (209, 4333), (237, 4091), (225, 4287), (206, 4193), (253, 4349), (201, 4191), (230, 4277), (232, 4143), (259, 4193), (240, 4093), (197, 4197), (210, 4052), (228, 4029), (242, 4153), (202, 4183), (211, 4084), (186, 4128)]
         : compromised: 0.0497, honest: 0.0531
Round 010: test acc mean=0.0525 ± 0.0053 | min=0.0446 max=0.0612
         : test loss mean=3.8230 ± 0.5570
         : individual accs = ['0.047238', '0.052344', '0.045087', '0.052850', '0.057932', '0.050618', '0.048891', '0.058174', '0.044619', '0.053776', '0.055998', '0.045314', '0.058637', '0.045747', '0.061204', '0.056590', '0.058271', '0.045900', '0.055583', '0.055475']
         : correct/total = [(195, 4128), (220, 4203), (184, 4081), (229, 4333), (237, 4091), (217, 4287), (205, 4193), (253, 4349), (187, 4191), (230, 4277), (232, 4143), (190, 4193), (240, 4093), (192, 4197), (248, 4052), (228, 4029), (242, 4153), (192, 4183), (227, 4084), (229, 4128)]
         : compromised: 0.0482, honest: 0.0530

=== FINAL RESULTS ===
Dataset: femnist, Nodes: 20, Graph: erdos, Aggregation: d-fedavg
Attack: directed_deviation, 10.0% compromised
Final accuracy - Compromised: 0.0482, Honest: 0.0530
Overall test accuracy: mean=0.0525 ± 0.0053
