Device: cuda
Seed: 987654321
Loading 36 LEAF FEMNIST train files...
LEAF FEMNIST train: 3597 users, 734463 samples
Loading 36 LEAF FEMNIST test files...
LEAF FEMNIST test: 3597 users, 83388 samples
Found 3597 train users, 3597 test users, 3597 common users
User sample counts range: 525 (max) to 17 (min)
Distributed ALL 3597 users across 20 clients
Users per client: 179 (with 17 clients getting +1 user)
Train partition sizes: [36360, 37070, 35957, 38262, 36024, 37732, 36921, 38328, 36867, 37683, 36507, 36915, 36007, 37001, 35681, 35453, 36585, 36801, 35964, 36345]
Test partition sizes: [4128, 4203, 4081, 4333, 4091, 4287, 4193, 4349, 4191, 4277, 4143, 4193, 4093, 4197, 4052, 4029, 4153, 4183, 4084, 4128]
  Client 0: 36360 train samples, 62 unique classes
  Client 1: 37070 train samples, 62 unique classes
  Client 2: 35957 train samples, 62 unique classes
  Client 3: 38262 train samples, 62 unique classes
  Client 4: 36024 train samples, 62 unique classes
  Client 5: 37732 train samples, 62 unique classes
  Client 6: 36921 train samples, 62 unique classes
  Client 7: 38328 train samples, 62 unique classes
  Client 8: 36867 train samples, 62 unique classes
  Client 9: 37683 train samples, 62 unique classes
  Client 10: 36507 train samples, 62 unique classes
  Client 11: 36915 train samples, 62 unique classes
  Client 12: 36007 train samples, 62 unique classes
  Client 13: 37001 train samples, 62 unique classes
  Client 14: 35681 train samples, 62 unique classes
  Client 15: 35453 train samples, 62 unique classes
  Client 16: 36585 train samples, 62 unique classes
  Client 17: 36801 train samples, 62 unique classes
  Client 18: 35964 train samples, 62 unique classes
  Client 19: 36345 train samples, 62 unique classes
Will sample 10000 samples per client per epoch
Graph: erdos, nodes: 20, edges: 126
Degree statistics: avg=12.60, min=8, max=16
Model variant: baseline
Model parameters: 6,603,710
Sketchguard Node 0:
  Model dim: 6,603,710 → Sketch size: 1000
  Compression ratio: 6603.7x
  Using model parameters for aggregation, sketches for filtering
Sketchguard Node 1:
  Model dim: 6,603,710 → Sketch size: 1000
  Compression ratio: 6603.7x
  Using model parameters for aggregation, sketches for filtering
Sketchguard Node 2:
  Model dim: 6,603,710 → Sketch size: 1000
  Compression ratio: 6603.7x
  Using model parameters for aggregation, sketches for filtering
Sketchguard Node 3:
  Model dim: 6,603,710 → Sketch size: 1000
  Compression ratio: 6603.7x
  Using model parameters for aggregation, sketches for filtering
Sketchguard Node 4:
  Model dim: 6,603,710 → Sketch size: 1000
  Compression ratio: 6603.7x
  Using model parameters for aggregation, sketches for filtering
Sketchguard Node 5:
  Model dim: 6,603,710 → Sketch size: 1000
  Compression ratio: 6603.7x
  Using model parameters for aggregation, sketches for filtering
Sketchguard Node 6:
  Model dim: 6,603,710 → Sketch size: 1000
  Compression ratio: 6603.7x
  Using model parameters for aggregation, sketches for filtering
Sketchguard Node 7:
  Model dim: 6,603,710 → Sketch size: 1000
  Compression ratio: 6603.7x
  Using model parameters for aggregation, sketches for filtering
Sketchguard Node 8:
  Model dim: 6,603,710 → Sketch size: 1000
  Compression ratio: 6603.7x
  Using model parameters for aggregation, sketches for filtering
Sketchguard Node 9:
  Model dim: 6,603,710 → Sketch size: 1000
  Compression ratio: 6603.7x
  Using model parameters for aggregation, sketches for filtering
Sketchguard Node 10:
  Model dim: 6,603,710 → Sketch size: 1000
  Compression ratio: 6603.7x
  Using model parameters for aggregation, sketches for filtering
Sketchguard Node 11:
  Model dim: 6,603,710 → Sketch size: 1000
  Compression ratio: 6603.7x
  Using model parameters for aggregation, sketches for filtering
Sketchguard Node 12:
  Model dim: 6,603,710 → Sketch size: 1000
  Compression ratio: 6603.7x
  Using model parameters for aggregation, sketches for filtering
Sketchguard Node 13:
  Model dim: 6,603,710 → Sketch size: 1000
  Compression ratio: 6603.7x
  Using model parameters for aggregation, sketches for filtering
Sketchguard Node 14:
  Model dim: 6,603,710 → Sketch size: 1000
  Compression ratio: 6603.7x
  Using model parameters for aggregation, sketches for filtering
Sketchguard Node 15:
  Model dim: 6,603,710 → Sketch size: 1000
  Compression ratio: 6603.7x
  Using model parameters for aggregation, sketches for filtering
Sketchguard Node 16:
  Model dim: 6,603,710 → Sketch size: 1000
  Compression ratio: 6603.7x
  Using model parameters for aggregation, sketches for filtering
Sketchguard Node 17:
  Model dim: 6,603,710 → Sketch size: 1000
  Compression ratio: 6603.7x
  Using model parameters for aggregation, sketches for filtering
Sketchguard Node 18:
  Model dim: 6,603,710 → Sketch size: 1000
  Compression ratio: 6603.7x
  Using model parameters for aggregation, sketches for filtering
Sketchguard Node 19:
  Model dim: 6,603,710 → Sketch size: 1000
  Compression ratio: 6603.7x
  Using model parameters for aggregation, sketches for filtering
Sketchguard ALGORITHM (Sketch-based Filtering + State Aggregation)
  - Model dimension: 6,603,710 parameters
  - Config: SketchguardConfig(gamma=2, kappa=1, alpha=0.5, min_neighbors=1, sketch_size=1000, network_seed=987654321, attack_detection_window=5)
  - Sketch size: 1000
  - Compression ratio: 6603.7x
  - Complexity: O(d + N×k) = O(6,603,710 + 20×1000)
  - Theoretical speedup vs BALANCE: 19.9x
Initial test acc across nodes: mean=0.0168 ± 0.0139
Round 001: test acc mean=0.5153 ± 0.0315 | min=0.4611 max=0.5948
         : test loss mean=3.7223 ± 0.0285
         : individual accs = ['0.565891', '0.505591', '0.553541', '0.497808', '0.510878', '0.594822', '0.523492', '0.512762', '0.518253', '0.461071', '0.524258', '0.525161', '0.462741', '0.476769', '0.539733', '0.518243', '0.488562', '0.520440', '0.504652', '0.500727']
         : correct/total = [(2336, 4128), (2125, 4203), (2259, 4081), (2157, 4333), (2090, 4091), (2550, 4287), (2195, 4193), (2230, 4349), (2172, 4191), (1972, 4277), (2172, 4143), (2202, 4193), (1894, 4093), (2001, 4197), (2187, 4052), (2088, 4029), (2029, 4153), (2177, 4183), (2061, 4084), (2067, 4128)]
         : sketchguard stats = ['Node 0: acc_rate=1.000', 'Node 1: acc_rate=1.000', 'Node 2: acc_rate=1.000']...
Round 002: test acc mean=0.6875 ± 0.0156 | min=0.6642 max=0.7257
         : test loss mean=3.4026 ± 0.0364
         : individual accs = ['0.695010', '0.690935', '0.687577', '0.690515', '0.700073', '0.725682', '0.665395', '0.684295', '0.690766', '0.665653', '0.689597', '0.686859', '0.673345', '0.683822', '0.694225', '0.664185', '0.673007', '0.720536', '0.689030', '0.678779']
         : correct/total = [(2869, 4128), (2904, 4203), (2806, 4081), (2992, 4333), (2864, 4091), (3111, 4287), (2790, 4193), (2976, 4349), (2895, 4191), (2847, 4277), (2857, 4143), (2880, 4193), (2756, 4093), (2870, 4197), (2813, 4052), (2676, 4029), (2795, 4153), (3014, 4183), (2814, 4084), (2802, 4128)]
         : sketchguard stats = ['Node 0: acc_rate=1.000', 'Node 1: acc_rate=1.000', 'Node 2: acc_rate=1.000']...
Round 003: test acc mean=0.7150 ± 0.0205 | min=0.6479 max=0.7402
         : test loss mean=3.1082 ± 0.0448
         : individual accs = ['0.723595', '0.705686', '0.712080', '0.714286', '0.735028', '0.720317', '0.710470', '0.740170', '0.709854', '0.737433', '0.734009', '0.687575', '0.728317', '0.698594', '0.714709', '0.713328', '0.706718', '0.647860', '0.733595', '0.725775']
         : correct/total = [(2987, 4128), (2966, 4203), (2906, 4081), (3095, 4333), (3007, 4091), (3088, 4287), (2979, 4193), (3219, 4349), (2975, 4191), (3154, 4277), (3041, 4143), (2883, 4193), (2981, 4093), (2932, 4197), (2896, 4052), (2874, 4029), (2935, 4153), (2710, 4183), (2996, 4084), (2996, 4128)]
         : sketchguard stats = ['Node 0: acc_rate=1.000', 'Node 1: acc_rate=1.000', 'Node 2: acc_rate=1.000']...
Round 004: test acc mean=0.7085 ± 0.0217 | min=0.6589 max=0.7467
         : test loss mean=2.6855 ± 0.0491
         : individual accs = ['0.712936', '0.738996', '0.691987', '0.690053', '0.737473', '0.705622', '0.711424', '0.723385', '0.717490', '0.684826', '0.690321', '0.723825', '0.674322', '0.699071', '0.706811', '0.711343', '0.746689', '0.726273', '0.717434', '0.658915']
         : correct/total = [(2943, 4128), (3106, 4203), (2824, 4081), (2990, 4333), (3017, 4091), (3025, 4287), (2983, 4193), (3146, 4349), (3007, 4191), (2929, 4277), (2860, 4143), (3035, 4193), (2760, 4093), (2934, 4197), (2864, 4052), (2866, 4029), (3101, 4153), (3038, 4183), (2930, 4084), (2720, 4128)]
         : sketchguard stats = ['Node 0: acc_rate=1.000', 'Node 1: acc_rate=1.000', 'Node 2: acc_rate=1.000']...
Round 005: test acc mean=0.6816 ± 0.0220 | min=0.6377 max=0.7238
         : test loss mean=2.1140 ± 0.0771
         : individual accs = ['0.689680', '0.687842', '0.655232', '0.637664', '0.713273', '0.699790', '0.672549', '0.723845', '0.658077', '0.691139', '0.668115', '0.665872', '0.664549', '0.683107', '0.672014', '0.665922', '0.696123', '0.706909', '0.713026', '0.666667']
         : correct/total = [(2847, 4128), (2891, 4203), (2674, 4081), (2763, 4333), (2918, 4091), (3000, 4287), (2820, 4193), (3148, 4349), (2758, 4191), (2956, 4277), (2768, 4143), (2792, 4193), (2720, 4093), (2867, 4197), (2723, 4052), (2683, 4029), (2891, 4153), (2957, 4183), (2912, 4084), (2752, 4128)]
         : sketchguard stats = ['Node 0: acc_rate=1.000', 'Node 1: acc_rate=1.000', 'Node 2: acc_rate=1.000']...
Round 006: test acc mean=0.7154 ± 0.0208 | min=0.6664 max=0.7416
         : test loss mean=1.4461 ± 0.0616
         : individual accs = ['0.709545', '0.732810', '0.693703', '0.671359', '0.738206', '0.741078', '0.725733', '0.703840', '0.709854', '0.666355', '0.713493', '0.725972', '0.697288', '0.705980', '0.739141', '0.718789', '0.721888', '0.741573', '0.730167', '0.720930']
         : correct/total = [(2929, 4128), (3080, 4203), (2831, 4081), (2909, 4333), (3020, 4091), (3177, 4287), (3043, 4193), (3061, 4349), (2975, 4191), (2850, 4277), (2956, 4143), (3044, 4193), (2854, 4093), (2963, 4197), (2995, 4052), (2896, 4029), (2998, 4153), (3102, 4183), (2982, 4084), (2976, 4128)]
         : sketchguard stats = ['Node 0: acc_rate=1.000', 'Node 1: acc_rate=1.000', 'Node 2: acc_rate=1.000']...
Round 007: test acc mean=0.7824 ± 0.0111 | min=0.7632 max=0.8027
         : test loss mean=0.8851 ± 0.0389
         : individual accs = ['0.787306', '0.781109', '0.768929', '0.770367', '0.802738', '0.792629', '0.773432', '0.792826', '0.784061', '0.775777', '0.764663', '0.777248', '0.793306', '0.798427', '0.784057', '0.763217', '0.790272', '0.773368', '0.794319', '0.780766']
         : correct/total = [(3250, 4128), (3283, 4203), (3138, 4081), (3338, 4333), (3284, 4091), (3398, 4287), (3243, 4193), (3448, 4349), (3286, 4191), (3318, 4277), (3168, 4143), (3259, 4193), (3247, 4093), (3351, 4197), (3177, 4052), (3075, 4029), (3282, 4153), (3235, 4183), (3244, 4084), (3223, 4128)]
         : sketchguard stats = ['Node 0: acc_rate=1.000', 'Node 1: acc_rate=1.000', 'Node 2: acc_rate=1.000']...
Round 008: test acc mean=0.8175 ± 0.0073 | min=0.8033 max=0.8326
         : test loss mean=0.6094 ± 0.0233
         : individual accs = ['0.816860', '0.825125', '0.822593', '0.814909', '0.821315', '0.820854', '0.813976', '0.832605', '0.815080', '0.826748', '0.808351', '0.815645', '0.822624', '0.818680', '0.803307', '0.804666', '0.817241', '0.808033', '0.824927', '0.816376']
         : correct/total = [(3372, 4128), (3468, 4203), (3357, 4081), (3531, 4333), (3360, 4091), (3519, 4287), (3413, 4193), (3621, 4349), (3416, 4191), (3536, 4277), (3349, 4143), (3420, 4193), (3367, 4093), (3436, 4197), (3255, 4052), (3242, 4029), (3394, 4153), (3380, 4183), (3369, 4084), (3370, 4128)]
         : sketchguard stats = ['Node 0: acc_rate=1.000', 'Node 1: acc_rate=1.000', 'Node 2: acc_rate=1.000']...
Round 009: test acc mean=0.8300 ± 0.0069 | min=0.8214 max=0.8436
         : test loss mean=0.5315 ± 0.0211
         : individual accs = ['0.823401', '0.835594', '0.843176', '0.826217', '0.837692', '0.831584', '0.822561', '0.843642', '0.826294', '0.839841', '0.821385', '0.824469', '0.833863', '0.827972', '0.824038', '0.823281', '0.834818', '0.826440', '0.830803', '0.823643']
         : correct/total = [(3399, 4128), (3512, 4203), (3441, 4081), (3580, 4333), (3427, 4091), (3565, 4287), (3449, 4193), (3669, 4349), (3463, 4191), (3592, 4277), (3403, 4143), (3457, 4193), (3413, 4093), (3475, 4197), (3339, 4052), (3317, 4029), (3467, 4153), (3457, 4183), (3393, 4084), (3400, 4128)]
         : sketchguard stats = ['Node 0: acc_rate=1.000', 'Node 1: acc_rate=1.000', 'Node 2: acc_rate=1.000']...
Round 010: test acc mean=0.8374 ± 0.0067 | min=0.8222 max=0.8469
         : test loss mean=0.4977 ± 0.0206
         : individual accs = ['0.837209', '0.840828', '0.844156', '0.833833', '0.845515', '0.835549', '0.832578', '0.846861', '0.833214', '0.845686', '0.833213', '0.826377', '0.839726', '0.841553', '0.833662', '0.831720', '0.846376', '0.834329', '0.843291', '0.822190']
         : correct/total = [(3456, 4128), (3534, 4203), (3445, 4081), (3613, 4333), (3459, 4091), (3582, 4287), (3491, 4193), (3683, 4349), (3492, 4191), (3617, 4277), (3452, 4143), (3465, 4193), (3437, 4093), (3532, 4197), (3378, 4052), (3351, 4029), (3515, 4153), (3490, 4183), (3444, 4084), (3394, 4128)]
         : sketchguard stats = ['Node 0: acc_rate=1.000', 'Node 1: acc_rate=1.000', 'Node 2: acc_rate=1.000']...

=== FINAL RESULTS ===
Dataset: femnist, Nodes: 20, Graph: erdos, Aggregation: sketchguard
Overall test accuracy: mean=0.8374 ± 0.0067

=== Sketchguard SUMMARY ===
Node 0: acceptance=1.000
Node 1: acceptance=1.000
Node 2: acceptance=1.000
Node 3: acceptance=1.000
Node 4: acceptance=1.000
Node 5: acceptance=1.000
Node 6: acceptance=1.000
Node 7: acceptance=1.000
Node 8: acceptance=1.000
Node 9: acceptance=1.000
Node 10: acceptance=1.000
Node 11: acceptance=1.000
Node 12: acceptance=1.000
Node 13: acceptance=1.000
Node 14: acceptance=1.000
Node 15: acceptance=1.000
Node 16: acceptance=1.000
Node 17: acceptance=1.000
Node 18: acceptance=1.000
Node 19: acceptance=1.000

=== PARALLEL EXECUTION TIME (realistic for distributed system) ===
  COMMUNICATION (max across nodes):
    - Sketch transfer: 0.000s (0.0%)
    - Model fetch (accepted): 0.000s (0.0%)
  COMPUTATION (max across nodes):
    - Sketching: 6.116s (99.4%)
    - Filtering: 0.002s (0.0%)
    - Aggregation: 0.033s (0.5%)
  TOTALS:
    - Total computation: 6.151s (100.0%)
    - Total communication: 0.000s (0.0%)
    - Total parallel time: 6.151s

=== PER-NODE AVERAGE TIME ===
  - Sketching: 4.845s
  - Filtering: 0.001s
  - Aggregation: 0.021s
  - Sketch transfer: 0.000s
  - Model fetch: 0.000s
  - Total per node: 4.867s

=== TOTAL COMPUTATIONAL WORK (sum across all nodes) ===
  - Total sketching: 96.903s
  - Total filtering: 0.022s
  - Total aggregation: 0.414s
  - Total sketch transfer: 0.000s
  - Total model fetch: 0.000s
  - Grand total: 97.339s
  - Mean acceptance rate: 1.000

Sketchguard Algorithm Properties:
  - Original dimension: 6,603,710
  - Sketch size: 1000
  - Compression ratio: 19.9x
  - Single repetition: No repetitions needed
  - Theoretical complexity: O(d + N×k)
  - Approach: Sketch filtering + state aggregation
