Device: cuda
Seed: 987654321
Loading 36 LEAF FEMNIST train files...
LEAF FEMNIST train: 3597 users, 734463 samples
Loading 36 LEAF FEMNIST test files...
LEAF FEMNIST test: 3597 users, 83388 samples
Found 3597 train users, 3597 test users, 3597 common users
User sample counts range: 525 (max) to 17 (min)
Distributed ALL 3597 users across 20 clients
Users per client: 179 (with 17 clients getting +1 user)
Train partition sizes: [36360, 37070, 35957, 38262, 36024, 37732, 36921, 38328, 36867, 37683, 36507, 36915, 36007, 37001, 35681, 35453, 36585, 36801, 35964, 36345]
Test partition sizes: [4128, 4203, 4081, 4333, 4091, 4287, 4193, 4349, 4191, 4277, 4143, 4193, 4093, 4197, 4052, 4029, 4153, 4183, 4084, 4128]
  Client 0: 36360 train samples, 62 unique classes
  Client 1: 37070 train samples, 62 unique classes
  Client 2: 35957 train samples, 62 unique classes
  Client 3: 38262 train samples, 62 unique classes
  Client 4: 36024 train samples, 62 unique classes
  Client 5: 37732 train samples, 62 unique classes
  Client 6: 36921 train samples, 62 unique classes
  Client 7: 38328 train samples, 62 unique classes
  Client 8: 36867 train samples, 62 unique classes
  Client 9: 37683 train samples, 62 unique classes
  Client 10: 36507 train samples, 62 unique classes
  Client 11: 36915 train samples, 62 unique classes
  Client 12: 36007 train samples, 62 unique classes
  Client 13: 37001 train samples, 62 unique classes
  Client 14: 35681 train samples, 62 unique classes
  Client 15: 35453 train samples, 62 unique classes
  Client 16: 36585 train samples, 62 unique classes
  Client 17: 36801 train samples, 62 unique classes
  Client 18: 35964 train samples, 62 unique classes
  Client 19: 36345 train samples, 62 unique classes
Will sample 10000 samples per client per epoch
Graph: erdos, nodes: 20, edges: 126
Degree statistics: avg=12.60, min=8, max=16
Attack: Compromised 2/20 nodes: [5, 13]
Attack type: backdoor, lambda: 1.0
Backdoor target label: 0, trigger size: 4
Model variant: baseline
Model parameters: 6,603,710
Initial test acc across nodes: mean=0.0168 ± 0.0139
Backdoor attack: Created poisoned datasets for 2 compromised nodes
Round 001: test acc mean=0.5251 ± 0.0150 | min=0.4965 max=0.5636
         : test loss mean=1.7991 ± 0.0552
         : individual accs = ['0.521802', '0.533191', '0.563587', '0.514193', '0.531899', '0.528341', '0.496542', '0.525868', '0.506323', '0.526070', '0.514603', '0.518722', '0.533594', '0.553252', '0.527887', '0.527674', '0.519624', '0.525221', '0.532076', '0.502422']
         : correct/total = [(2154, 4128), (2241, 4203), (2300, 4081), (2228, 4333), (2176, 4091), (2265, 4287), (2082, 4193), (2287, 4349), (2122, 4191), (2250, 4277), (2132, 4143), (2175, 4193), (2184, 4093), (2322, 4197), (2139, 4052), (2126, 4029), (2158, 4153), (2197, 4183), (2173, 4084), (2074, 4128)]
         : compromised: 0.5408, honest: 0.5234
Round 002: test acc mean=0.7299 ± 0.0096 | min=0.7110 max=0.7454
         : test loss mean=0.8923 ± 0.0271
         : individual accs = ['0.745397', '0.726624', '0.740260', '0.720748', '0.732339', '0.745276', '0.717386', '0.738561', '0.726080', '0.730652', '0.727734', '0.722871', '0.715368', '0.724803', '0.743830', '0.729710', '0.731760', '0.729142', '0.737757', '0.710998']
         : correct/total = [(3077, 4128), (3054, 4203), (3021, 4081), (3123, 4333), (2996, 4091), (3195, 4287), (3008, 4193), (3212, 4349), (3043, 4191), (3125, 4277), (3015, 4143), (3031, 4193), (2928, 4093), (3042, 4197), (3014, 4052), (2940, 4029), (3039, 4153), (3050, 4183), (3013, 4084), (2935, 4128)]
         : compromised: 0.7350, honest: 0.7293
Round 003: test acc mean=0.7743 ± 0.0103 | min=0.7567 max=0.7936
         : test loss mean=0.7317 ± 0.0353
         : individual accs = ['0.776405', '0.774447', '0.771625', '0.772675', '0.770472', '0.793562', '0.756737', '0.772361', '0.783107', '0.772270', '0.761767', '0.758168', '0.790862', '0.777937', '0.778134', '0.772648', '0.781122', '0.767870', '0.792360', '0.760659']
         : correct/total = [(3205, 4128), (3255, 4203), (3149, 4081), (3348, 4333), (3152, 4091), (3402, 4287), (3173, 4193), (3359, 4349), (3282, 4191), (3303, 4277), (3156, 4143), (3179, 4193), (3237, 4093), (3265, 4197), (3153, 4052), (3113, 4029), (3244, 4153), (3212, 4183), (3236, 4084), (3140, 4128)]
         : compromised: 0.7857, honest: 0.7730
Round 004: test acc mean=0.7943 ± 0.0075 | min=0.7808 max=0.8089
         : test loss mean=0.6403 ± 0.0245
         : individual accs = ['0.789002', '0.796812', '0.808870', '0.780752', '0.793449', '0.799627', '0.787980', '0.806852', '0.798139', '0.800795', '0.798697', '0.783687', '0.798436', '0.790326', '0.792448', '0.790022', '0.795810', '0.782214', '0.802644', '0.789729']
         : correct/total = [(3257, 4128), (3349, 4203), (3301, 4081), (3383, 4333), (3246, 4091), (3428, 4287), (3304, 4193), (3509, 4349), (3345, 4191), (3425, 4277), (3309, 4143), (3286, 4193), (3268, 4093), (3317, 4197), (3211, 4052), (3183, 4029), (3305, 4153), (3272, 4183), (3278, 4084), (3260, 4128)]
         : compromised: 0.7950, honest: 0.7942
Round 005: test acc mean=0.8087 ± 0.0107 | min=0.7901 max=0.8279
         : test loss mean=0.5882 ± 0.0310
         : individual accs = ['0.807413', '0.815132', '0.819897', '0.804754', '0.817404', '0.816888', '0.790126', '0.824327', '0.807683', '0.801730', '0.790249', '0.801813', '0.818715', '0.809626', '0.808983', '0.796724', '0.818204', '0.801339', '0.827865', '0.794816']
         : correct/total = [(3333, 4128), (3426, 4203), (3346, 4081), (3487, 4333), (3344, 4091), (3502, 4287), (3313, 4193), (3585, 4349), (3385, 4191), (3429, 4277), (3274, 4143), (3362, 4193), (3351, 4093), (3398, 4197), (3278, 4052), (3210, 4029), (3398, 4153), (3352, 4183), (3381, 4084), (3281, 4128)]
         : compromised: 0.8133, honest: 0.8082
Round 006: test acc mean=0.8215 ± 0.0091 | min=0.8035 max=0.8411
         : test loss mean=0.5498 ± 0.0289
         : individual accs = ['0.829457', '0.830359', '0.829944', '0.813293', '0.818137', '0.822487', '0.814691', '0.835594', '0.817943', '0.823241', '0.806903', '0.821607', '0.826289', '0.819633', '0.817127', '0.812609', '0.827835', '0.819029', '0.841087', '0.803537']
         : correct/total = [(3424, 4128), (3490, 4203), (3387, 4081), (3524, 4333), (3347, 4091), (3526, 4287), (3416, 4193), (3634, 4349), (3428, 4191), (3521, 4277), (3343, 4143), (3445, 4193), (3382, 4093), (3440, 4197), (3311, 4052), (3274, 4029), (3438, 4153), (3426, 4183), (3435, 4084), (3317, 4128)]
         : compromised: 0.8211, honest: 0.8216
Round 007: test acc mean=0.8243 ± 0.0079 | min=0.8106 max=0.8370
         : test loss mean=0.5396 ± 0.0273
         : individual accs = ['0.833091', '0.827742', '0.829209', '0.814909', '0.831337', '0.825986', '0.821846', '0.836744', '0.837032', '0.828852', '0.816317', '0.821607', '0.825067', '0.810579', '0.816634', '0.822785', '0.826150', '0.813770', '0.832762', '0.812742']
         : correct/total = [(3439, 4128), (3479, 4203), (3384, 4081), (3531, 4333), (3401, 4091), (3541, 4287), (3446, 4193), (3639, 4349), (3508, 4191), (3545, 4277), (3382, 4143), (3445, 4193), (3377, 4093), (3402, 4197), (3309, 4052), (3315, 4029), (3431, 4153), (3404, 4183), (3401, 4084), (3355, 4128)]
         : compromised: 0.8183, honest: 0.8249
Round 008: test acc mean=0.8327 ± 0.0069 | min=0.8213 max=0.8455
         : test loss mean=0.5091 ± 0.0247
         : individual accs = ['0.830426', '0.832976', '0.845381', '0.830602', '0.838426', '0.835083', '0.830670', '0.842722', '0.829158', '0.832359', '0.823558', '0.826377', '0.839726', '0.830355', '0.833909', '0.821296', '0.837708', '0.824528', '0.845495', '0.824128']
         : correct/total = [(3428, 4128), (3501, 4203), (3450, 4081), (3599, 4333), (3430, 4091), (3580, 4287), (3483, 4193), (3665, 4349), (3475, 4191), (3560, 4277), (3412, 4143), (3465, 4193), (3437, 4093), (3485, 4197), (3379, 4052), (3309, 4029), (3479, 4153), (3449, 4183), (3453, 4084), (3402, 4128)]
         : compromised: 0.8327, honest: 0.8327
Round 009: test acc mean=0.8327 ± 0.0085 | min=0.8196 max=0.8528
         : test loss mean=0.5055 ± 0.0310
         : individual accs = ['0.837694', '0.838925', '0.836070', '0.832910', '0.843070', '0.842081', '0.823277', '0.852840', '0.820806', '0.837035', '0.830316', '0.832578', '0.832641', '0.823922', '0.824284', '0.819558', '0.827835', '0.835525', '0.840597', '0.822190']
         : correct/total = [(3458, 4128), (3526, 4203), (3412, 4081), (3609, 4333), (3449, 4091), (3610, 4287), (3452, 4193), (3709, 4349), (3440, 4191), (3580, 4277), (3440, 4143), (3491, 4193), (3408, 4093), (3458, 4197), (3340, 4052), (3302, 4029), (3438, 4153), (3495, 4183), (3433, 4084), (3394, 4128)]
         : compromised: 0.8330, honest: 0.8327
Round 010: test acc mean=0.8335 ± 0.0087 | min=0.8153 max=0.8485
         : test loss mean=0.4985 ± 0.0284
         : individual accs = ['0.838178', '0.844873', '0.840725', '0.833833', '0.841604', '0.839515', '0.819938', '0.848471', '0.834884', '0.842647', '0.825247', '0.833055', '0.824334', '0.825590', '0.826259', '0.815339', '0.834577', '0.835525', '0.840597', '0.824612']
         : correct/total = [(3460, 4128), (3551, 4203), (3431, 4081), (3613, 4333), (3443, 4091), (3599, 4287), (3438, 4193), (3690, 4349), (3499, 4191), (3604, 4277), (3419, 4143), (3493, 4193), (3374, 4093), (3465, 4197), (3348, 4052), (3285, 4029), (3466, 4153), (3495, 4183), (3433, 4084), (3404, 4128)]
         : compromised: 0.8326, honest: 0.8336

=== FINAL RESULTS ===
Dataset: femnist, Nodes: 20, Graph: erdos, Aggregation: krum
Attack: backdoor, 10.0% compromised
Final accuracy - Compromised: 0.8326, Honest: 0.8336
Overall test accuracy: mean=0.8335 ± 0.0087

=== BACKDOOR ATTACK SUCCESS RATE (ASR) ===
Target label: 0
Trigger size: 4x4
Overall ASR: 0.0522 ± 0.0047
Honest nodes ASR: 0.0522 ± 0.0046
Compromised nodes ASR: 0.0516 ± 0.0051
Note: Higher ASR indicates more successful backdoor attack
