Device: cuda
Seed: 987654321
Loading 36 LEAF FEMNIST train files...
LEAF FEMNIST train: 3597 users, 734463 samples
Loading 36 LEAF FEMNIST test files...
LEAF FEMNIST test: 3597 users, 83388 samples
Found 3597 train users, 3597 test users, 3597 common users
User sample counts range: 525 (max) to 17 (min)
Distributed ALL 3597 users across 20 clients
Users per client: 179 (with 17 clients getting +1 user)
Train partition sizes: [36360, 37070, 35957, 38262, 36024, 37732, 36921, 38328, 36867, 37683, 36507, 36915, 36007, 37001, 35681, 35453, 36585, 36801, 35964, 36345]
Test partition sizes: [4128, 4203, 4081, 4333, 4091, 4287, 4193, 4349, 4191, 4277, 4143, 4193, 4093, 4197, 4052, 4029, 4153, 4183, 4084, 4128]
  Client 0: 36360 train samples, 62 unique classes
  Client 1: 37070 train samples, 62 unique classes
  Client 2: 35957 train samples, 62 unique classes
  Client 3: 38262 train samples, 62 unique classes
  Client 4: 36024 train samples, 62 unique classes
  Client 5: 37732 train samples, 62 unique classes
  Client 6: 36921 train samples, 62 unique classes
  Client 7: 38328 train samples, 62 unique classes
  Client 8: 36867 train samples, 62 unique classes
  Client 9: 37683 train samples, 62 unique classes
  Client 10: 36507 train samples, 62 unique classes
  Client 11: 36915 train samples, 62 unique classes
  Client 12: 36007 train samples, 62 unique classes
  Client 13: 37001 train samples, 62 unique classes
  Client 14: 35681 train samples, 62 unique classes
  Client 15: 35453 train samples, 62 unique classes
  Client 16: 36585 train samples, 62 unique classes
  Client 17: 36801 train samples, 62 unique classes
  Client 18: 35964 train samples, 62 unique classes
  Client 19: 36345 train samples, 62 unique classes
Will sample 10000 samples per client per epoch
Graph: ring, nodes: 20, edges: 20
Degree statistics: avg=2.00, min=2, max=2
Attack: Compromised 14/20 nodes: [1, 2, 3, 5, 6, 8, 11, 12, 13, 14, 15, 17, 18, 19]
Attack type: directed_deviation, lambda: 1.0
Model variant: baseline
Model parameters: 6,603,710
Initial test acc across nodes: mean=0.0168 ± 0.0139
Round 001: test acc mean=0.0089 ± 0.0080 | min=0.0020 max=0.0359
         : test loss mean=115194.4301 ± 127638.4194
         : individual accs = ['0.003391', '0.008089', '0.003676', '0.012924', '0.001956', '0.011663', '0.005247', '0.019775', '0.020043', '0.003273', '0.002896', '0.004054', '0.003909', '0.007148', '0.009625', '0.009680', '0.006261', '0.002869', '0.006121', '0.035853']
         : correct/total = [(14, 4128), (34, 4203), (15, 4081), (56, 4333), (8, 4091), (50, 4287), (22, 4193), (86, 4349), (84, 4191), (14, 4277), (12, 4143), (17, 4193), (16, 4093), (30, 4197), (39, 4052), (39, 4029), (26, 4153), (12, 4183), (25, 4084), (148, 4128)]
         : compromised: 0.0101, honest: 0.0063
Round 002: test acc mean=0.0487 ± 0.0049 | min=0.0367 max=0.0578
         : test loss mean=nan ± nan
         : individual accs = ['0.045785', '0.042589', '0.053418', '0.047773', '0.044977', '0.057849', '0.053899', '0.043918', '0.049630', '0.043488', '0.048033', '0.036728', '0.054239', '0.049083', '0.051826', '0.051626', '0.052011', '0.049486', '0.052889', '0.044331']
         : correct/total = [(189, 4128), (179, 4203), (218, 4081), (207, 4333), (184, 4091), (248, 4287), (226, 4193), (191, 4349), (208, 4191), (186, 4277), (199, 4143), (154, 4193), (222, 4093), (206, 4197), (210, 4052), (208, 4029), (216, 4153), (207, 4183), (216, 4084), (183, 4128)]
         : compromised: 0.0497, honest: 0.0464
Round 003: test acc mean=0.0491 ± 0.0036 | min=0.0430 max=0.0542
         : test loss mean=nan ± nan
         : individual accs = ['0.049176', '0.047109', '0.053418', '0.043157', '0.043021', '0.045253', '0.053899', '0.043918', '0.049630', '0.043488', '0.048033', '0.049606', '0.054239', '0.049083', '0.051826', '0.051626', '0.052011', '0.049486', '0.052889', '0.050388']
         : correct/total = [(203, 4128), (198, 4203), (218, 4081), (187, 4333), (176, 4091), (194, 4287), (226, 4193), (191, 4349), (208, 4191), (186, 4277), (199, 4143), (208, 4193), (222, 4093), (206, 4197), (210, 4052), (208, 4029), (216, 4153), (207, 4183), (216, 4084), (208, 4128)]
         : compromised: 0.0501, honest: 0.0466
Round 004: test acc mean=0.0494 ± 0.0037 | min=0.0430 max=0.0545
         : test loss mean=nan ± nan
         : individual accs = ['0.050145', '0.048775', '0.053418', '0.043157', '0.043021', '0.045253', '0.053899', '0.043918', '0.049630', '0.043488', '0.048033', '0.049606', '0.054239', '0.049083', '0.051826', '0.051626', '0.052011', '0.049486', '0.052889', '0.054506']
         : correct/total = [(207, 4128), (205, 4203), (218, 4081), (187, 4333), (176, 4091), (194, 4287), (226, 4193), (191, 4349), (208, 4191), (186, 4277), (199, 4143), (208, 4193), (222, 4093), (206, 4197), (210, 4052), (208, 4029), (216, 4153), (207, 4183), (216, 4084), (225, 4128)]
         : compromised: 0.0505, honest: 0.0468
Round 005: test acc mean=0.0495 ± 0.0034 | min=0.0430 max=0.0545
         : test loss mean=nan ± nan
         : individual accs = ['0.050145', '0.048775', '0.053418', '0.043157', '0.043021', '0.045253', '0.049130', '0.051046', '0.049630', '0.043488', '0.048033', '0.049606', '0.054239', '0.049083', '0.051826', '0.051626', '0.052011', '0.049486', '0.052889', '0.054506']
         : correct/total = [(207, 4128), (205, 4203), (218, 4081), (187, 4333), (176, 4091), (194, 4287), (206, 4193), (222, 4349), (208, 4191), (186, 4277), (199, 4143), (208, 4193), (222, 4093), (206, 4197), (210, 4052), (208, 4029), (216, 4153), (207, 4183), (216, 4084), (225, 4128)]
         : compromised: 0.0502, honest: 0.0480
Round 006: test acc mean=0.0457 ± 0.0118 | min=0.0100 max=0.0545
         : test loss mean=nan ± nan
         : individual accs = ['0.050388', '0.048775', '0.053418', '0.043157', '0.043021', '0.045253', '0.010017', '0.013796', '0.049630', '0.043488', '0.048033', '0.049606', '0.054239', '0.049083', '0.051826', '0.051626', '0.052011', '0.049486', '0.052889', '0.054506']
         : correct/total = [(208, 4128), (205, 4203), (218, 4081), (187, 4333), (176, 4091), (194, 4287), (42, 4193), (60, 4349), (208, 4191), (186, 4277), (199, 4143), (208, 4193), (222, 4093), (206, 4197), (210, 4052), (208, 4029), (216, 4153), (207, 4183), (216, 4084), (225, 4128)]
         : compromised: 0.0474, honest: 0.0418
Round 007: test acc mean=0.0481 ± 0.0040 | min=0.0416 max=0.0542
         : test loss mean=nan ± nan
         : individual accs = ['0.044574', '0.046158', '0.053418', '0.043157', '0.043021', '0.045253', '0.042213', '0.041619', '0.049630', '0.043488', '0.048033', '0.049606', '0.054239', '0.049083', '0.051826', '0.051626', '0.052011', '0.049486', '0.052889', '0.050872']
         : correct/total = [(184, 4128), (194, 4203), (218, 4081), (187, 4333), (176, 4091), (194, 4287), (177, 4193), (181, 4349), (208, 4191), (186, 4277), (199, 4143), (208, 4193), (222, 4093), (206, 4197), (210, 4052), (208, 4029), (216, 4153), (207, 4183), (216, 4084), (210, 4128)]
         : compromised: 0.0492, honest: 0.0455
Round 008: test acc mean=0.0466 ± 0.0117 | min=0.0134 max=0.0596
         : test loss mean=nan ± nan
         : individual accs = ['0.059593', '0.052344', '0.053418', '0.043157', '0.043021', '0.045253', '0.013356', '0.013796', '0.049630', '0.043488', '0.048033', '0.049606', '0.054239', '0.049083', '0.051826', '0.051626', '0.052011', '0.049486', '0.052889', '0.055475']
         : correct/total = [(246, 4128), (220, 4203), (218, 4081), (187, 4333), (176, 4091), (194, 4287), (56, 4193), (60, 4349), (208, 4191), (186, 4277), (199, 4143), (208, 4193), (222, 4093), (206, 4197), (210, 4052), (208, 4029), (216, 4153), (207, 4183), (216, 4084), (229, 4128)]
         : compromised: 0.0480, honest: 0.0433
Round 009: test acc mean=0.0492 ± 0.0036 | min=0.0430 max=0.0545
         : test loss mean=nan ± nan
         : individual accs = ['0.050145', '0.048775', '0.053418', '0.043157', '0.043021', '0.045253', '0.044598', '0.049207', '0.049630', '0.043488', '0.048033', '0.049606', '0.054239', '0.049083', '0.051826', '0.051626', '0.052011', '0.049486', '0.052889', '0.054506']
         : correct/total = [(207, 4128), (205, 4203), (218, 4081), (187, 4333), (176, 4091), (194, 4287), (187, 4193), (214, 4349), (208, 4191), (186, 4277), (199, 4143), (208, 4193), (222, 4093), (206, 4197), (210, 4052), (208, 4029), (216, 4153), (207, 4183), (216, 4084), (225, 4128)]
         : compromised: 0.0499, honest: 0.0477
Round 010: test acc mean=0.0492 ± 0.0035 | min=0.0430 max=0.0545
         : test loss mean=nan ± nan
         : individual accs = ['0.050145', '0.048775', '0.053418', '0.043157', '0.043021', '0.045253', '0.046745', '0.047827', '0.049630', '0.043488', '0.048033', '0.049606', '0.054239', '0.049083', '0.051826', '0.051626', '0.052011', '0.049486', '0.052889', '0.054506']
         : correct/total = [(207, 4128), (205, 4203), (218, 4081), (187, 4333), (176, 4091), (194, 4287), (196, 4193), (208, 4349), (208, 4191), (186, 4277), (199, 4143), (208, 4193), (222, 4093), (206, 4197), (210, 4052), (208, 4029), (216, 4153), (207, 4183), (216, 4084), (225, 4128)]
         : compromised: 0.0500, honest: 0.0474

=== FINAL RESULTS ===
Dataset: femnist, Nodes: 20, Graph: ring, Aggregation: krum
Attack: directed_deviation, 70.0% compromised
Final accuracy - Compromised: 0.0500, Honest: 0.0474
Overall test accuracy: mean=0.0492 ± 0.0035
