Device: cuda
Seed: 987654321
Loading 36 LEAF FEMNIST train files...
LEAF FEMNIST train: 3597 users, 734463 samples
Loading 36 LEAF FEMNIST test files...
LEAF FEMNIST test: 3597 users, 83388 samples
Found 3597 train users, 3597 test users, 3597 common users
User sample counts range: 525 (max) to 17 (min)
Distributed ALL 3597 users across 20 clients
Users per client: 179 (with 17 clients getting +1 user)
Train partition sizes: [36360, 37070, 35957, 38262, 36024, 37732, 36921, 38328, 36867, 37683, 36507, 36915, 36007, 37001, 35681, 35453, 36585, 36801, 35964, 36345]
Test partition sizes: [4128, 4203, 4081, 4333, 4091, 4287, 4193, 4349, 4191, 4277, 4143, 4193, 4093, 4197, 4052, 4029, 4153, 4183, 4084, 4128]
  Client 0: 36360 train samples, 62 unique classes
  Client 1: 37070 train samples, 62 unique classes
  Client 2: 35957 train samples, 62 unique classes
  Client 3: 38262 train samples, 62 unique classes
  Client 4: 36024 train samples, 62 unique classes
  Client 5: 37732 train samples, 62 unique classes
  Client 6: 36921 train samples, 62 unique classes
  Client 7: 38328 train samples, 62 unique classes
  Client 8: 36867 train samples, 62 unique classes
  Client 9: 37683 train samples, 62 unique classes
  Client 10: 36507 train samples, 62 unique classes
  Client 11: 36915 train samples, 62 unique classes
  Client 12: 36007 train samples, 62 unique classes
  Client 13: 37001 train samples, 62 unique classes
  Client 14: 35681 train samples, 62 unique classes
  Client 15: 35453 train samples, 62 unique classes
  Client 16: 36585 train samples, 62 unique classes
  Client 17: 36801 train samples, 62 unique classes
  Client 18: 35964 train samples, 62 unique classes
  Client 19: 36345 train samples, 62 unique classes
Will sample 10000 samples per client per epoch
Graph: ring, nodes: 20, edges: 20
Degree statistics: avg=2.00, min=2, max=2
Attack: Compromised 6/20 nodes: [5, 12, 13, 14, 17, 18]
Attack type: directed_deviation, lambda: 1.0
Model variant: baseline
Model parameters: 6,603,710
Initial test acc across nodes: mean=0.0168 ± 0.0139
Round 001: test acc mean=0.0934 ± 0.1188 | min=0.0026 max=0.4123
         : test loss mean=22036.3416 ± 40335.9384
         : individual accs = ['0.247335', '0.256959', '0.262191', '0.164782', '0.002933', '0.004665', '0.005724', '0.412279', '0.130756', '0.104045', '0.183442', '0.036012', '0.003909', '0.005957', '0.002962', '0.012906', '0.002649', '0.005498', '0.019589', '0.003391']
         : correct/total = [(1021, 4128), (1080, 4203), (1070, 4081), (714, 4333), (12, 4091), (20, 4287), (24, 4193), (1793, 4349), (548, 4191), (445, 4277), (760, 4143), (151, 4193), (16, 4093), (25, 4197), (12, 4052), (52, 4029), (11, 4153), (23, 4183), (80, 4084), (14, 4128)]
         : compromised: 0.0071, honest: 0.1304
Round 002: test acc mean=0.1803 ± 0.2594 | min=0.0420 max=0.7072
         : test loss mean=nan ± nan
         : individual accs = ['0.059593', '0.691173', '0.698358', '0.043157', '0.057932', '0.052484', '0.044598', '0.051276', '0.707230', '0.699556', '0.041999', '0.049606', '0.054239', '0.049083', '0.050346', '0.056590', '0.058271', '0.050920', '0.045788', '0.044331']
         : correct/total = [(246, 4128), (2905, 4203), (2850, 4081), (187, 4333), (237, 4091), (225, 4287), (187, 4193), (223, 4349), (2964, 4191), (2992, 4277), (174, 4143), (208, 4193), (222, 4093), (206, 4197), (204, 4052), (228, 4029), (242, 4153), (213, 4183), (187, 4084), (183, 4128)]
         : compromised: 0.0505, honest: 0.2360
Round 003: test acc mean=0.0528 ± 0.0059 | min=0.0432 max=0.0618
         : test loss mean=nan ± nan
         : individual accs = ['0.059593', '0.052344', '0.057584', '0.043157', '0.057932', '0.045253', '0.057000', '0.051276', '0.043188', '0.053776', '0.055998', '0.061770', '0.050818', '0.049083', '0.061204', '0.056590', '0.058271', '0.050920', '0.045788', '0.044331']
         : correct/total = [(246, 4128), (220, 4203), (235, 4081), (187, 4333), (237, 4091), (194, 4287), (239, 4193), (223, 4349), (181, 4191), (230, 4277), (232, 4143), (259, 4193), (208, 4093), (206, 4197), (248, 4052), (228, 4029), (242, 4153), (213, 4183), (187, 4084), (183, 4128)]
         : compromised: 0.0505, honest: 0.0538
Round 004: test acc mean=0.0485 ± 0.0066 | min=0.0334 max=0.0612
         : test loss mean=nan ± nan
         : individual accs = ['0.050145', '0.042589', '0.050723', '0.043157', '0.044977', '0.045253', '0.033389', '0.058174', '0.044619', '0.053075', '0.041999', '0.045314', '0.050818', '0.049083', '0.061204', '0.056590', '0.058271', '0.050920', '0.045788', '0.044331']
         : correct/total = [(207, 4128), (179, 4203), (207, 4081), (187, 4333), (184, 4091), (194, 4287), (140, 4193), (253, 4349), (187, 4191), (227, 4277), (174, 4143), (190, 4193), (208, 4093), (206, 4197), (248, 4052), (228, 4029), (242, 4153), (213, 4183), (187, 4084), (183, 4128)]
         : compromised: 0.0505, honest: 0.0477
Round 005: test acc mean=0.0498 ± 0.0058 | min=0.0365 max=0.0612
         : test loss mean=nan ± nan
         : individual accs = ['0.059593', '0.049726', '0.053418', '0.036464', '0.044977', '0.048752', '0.043883', '0.058174', '0.053209', '0.053776', '0.045619', '0.045314', '0.050818', '0.049083', '0.061204', '0.050881', '0.051047', '0.050920', '0.045788', '0.044331']
         : correct/total = [(246, 4128), (209, 4203), (218, 4081), (158, 4333), (184, 4091), (209, 4287), (184, 4193), (253, 4349), (223, 4191), (230, 4277), (189, 4143), (190, 4193), (208, 4093), (206, 4197), (248, 4052), (205, 4029), (212, 4153), (213, 4183), (187, 4084), (183, 4128)]
         : compromised: 0.0511, honest: 0.0493
Round 006: test acc mean=0.0492 ± 0.0082 | min=0.0322 max=0.0612
         : test loss mean=nan ± nan
         : individual accs = ['0.050145', '0.050916', '0.057584', '0.036464', '0.042288', '0.045253', '0.050799', '0.058174', '0.042233', '0.053776', '0.055998', '0.046983', '0.050818', '0.049083', '0.061204', '0.056590', '0.058271', '0.050920', '0.033301', '0.032219']
         : correct/total = [(207, 4128), (214, 4203), (235, 4081), (158, 4333), (173, 4091), (194, 4287), (213, 4193), (253, 4349), (177, 4191), (230, 4277), (232, 4143), (197, 4193), (208, 4093), (206, 4197), (248, 4052), (228, 4029), (242, 4153), (213, 4183), (136, 4084), (133, 4128)]
         : compromised: 0.0484, honest: 0.0495
Round 007: test acc mean=0.0499 ± 0.0080 | min=0.0322 max=0.0612
         : test loss mean=nan ± nan
         : individual accs = ['0.050145', '0.052344', '0.057584', '0.052850', '0.042288', '0.038955', '0.049130', '0.058174', '0.053209', '0.053776', '0.055998', '0.041736', '0.050818', '0.049083', '0.061204', '0.056590', '0.058271', '0.050920', '0.033301', '0.032219']
         : correct/total = [(207, 4128), (220, 4203), (235, 4081), (229, 4333), (173, 4091), (167, 4287), (206, 4193), (253, 4349), (223, 4191), (230, 4277), (232, 4143), (175, 4193), (208, 4093), (206, 4197), (248, 4052), (228, 4029), (242, 4153), (213, 4183), (136, 4084), (133, 4128)]
         : compromised: 0.0474, honest: 0.0510
Round 008: test acc mean=0.0513 ± 0.0064 | min=0.0333 max=0.0612
         : test loss mean=nan ± nan
         : individual accs = ['0.050145', '0.052344', '0.057584', '0.052850', '0.048643', '0.048519', '0.042213', '0.058174', '0.053209', '0.053776', '0.055998', '0.041736', '0.050574', '0.049083', '0.061204', '0.056590', '0.058271', '0.050920', '0.033301', '0.050145']
         : correct/total = [(207, 4128), (220, 4203), (235, 4081), (229, 4333), (199, 4091), (208, 4287), (177, 4193), (253, 4349), (223, 4191), (230, 4277), (232, 4143), (175, 4193), (207, 4093), (206, 4197), (248, 4052), (228, 4029), (242, 4153), (213, 4183), (136, 4084), (207, 4128)]
         : compromised: 0.0489, honest: 0.0523
Round 009: test acc mean=0.0495 ± 0.0091 | min=0.0322 max=0.0612
         : test loss mean=nan ± nan
         : individual accs = ['0.059593', '0.052344', '0.057584', '0.052850', '0.042288', '0.038955', '0.033389', '0.058174', '0.053209', '0.053776', '0.055998', '0.041736', '0.048620', '0.049083', '0.061204', '0.056590', '0.058271', '0.050920', '0.033301', '0.032219']
         : correct/total = [(246, 4128), (220, 4203), (235, 4081), (229, 4333), (173, 4091), (167, 4287), (140, 4193), (253, 4349), (223, 4191), (230, 4277), (232, 4143), (175, 4193), (199, 4093), (206, 4197), (248, 4052), (228, 4029), (242, 4153), (213, 4183), (136, 4084), (133, 4128)]
         : compromised: 0.0470, honest: 0.0506
Round 010: test acc mean=0.0525 ± 0.0052 | min=0.0417 max=0.0612
         : test loss mean=nan ± nan
         : individual accs = ['0.059593', '0.052344', '0.057584', '0.052850', '0.042288', '0.047352', '0.049130', '0.058174', '0.053209', '0.053776', '0.055998', '0.041736', '0.048620', '0.049083', '0.061204', '0.056590', '0.058271', '0.050920', '0.050196', '0.050145']
         : correct/total = [(246, 4128), (220, 4203), (235, 4081), (229, 4333), (173, 4091), (203, 4287), (206, 4193), (253, 4349), (223, 4191), (230, 4277), (232, 4143), (175, 4193), (199, 4093), (206, 4197), (248, 4052), (228, 4029), (242, 4153), (213, 4183), (205, 4084), (207, 4128)]
         : compromised: 0.0512, honest: 0.0530

=== FINAL RESULTS ===
Dataset: femnist, Nodes: 20, Graph: ring, Aggregation: d-fedavg
Attack: directed_deviation, 30.0% compromised
Final accuracy - Compromised: 0.0512, Honest: 0.0530
Overall test accuracy: mean=0.0525 ± 0.0052
