Device: cuda
Seed: 987654321
Loading 36 LEAF FEMNIST train files...
LEAF FEMNIST train: 3597 users, 734463 samples
Loading 36 LEAF FEMNIST test files...
LEAF FEMNIST test: 3597 users, 83388 samples
Found 3597 train users, 3597 test users, 3597 common users
User sample counts range: 525 (max) to 17 (min)
Distributed ALL 3597 users across 20 clients
Users per client: 179 (with 17 clients getting +1 user)
Train partition sizes: [36360, 37070, 35957, 38262, 36024, 37732, 36921, 38328, 36867, 37683, 36507, 36915, 36007, 37001, 35681, 35453, 36585, 36801, 35964, 36345]
Test partition sizes: [4128, 4203, 4081, 4333, 4091, 4287, 4193, 4349, 4191, 4277, 4143, 4193, 4093, 4197, 4052, 4029, 4153, 4183, 4084, 4128]
  Client 0: 36360 train samples, 62 unique classes
  Client 1: 37070 train samples, 62 unique classes
  Client 2: 35957 train samples, 62 unique classes
  Client 3: 38262 train samples, 62 unique classes
  Client 4: 36024 train samples, 62 unique classes
  Client 5: 37732 train samples, 62 unique classes
  Client 6: 36921 train samples, 62 unique classes
  Client 7: 38328 train samples, 62 unique classes
  Client 8: 36867 train samples, 62 unique classes
  Client 9: 37683 train samples, 62 unique classes
  Client 10: 36507 train samples, 62 unique classes
  Client 11: 36915 train samples, 62 unique classes
  Client 12: 36007 train samples, 62 unique classes
  Client 13: 37001 train samples, 62 unique classes
  Client 14: 35681 train samples, 62 unique classes
  Client 15: 35453 train samples, 62 unique classes
  Client 16: 36585 train samples, 62 unique classes
  Client 17: 36801 train samples, 62 unique classes
  Client 18: 35964 train samples, 62 unique classes
  Client 19: 36345 train samples, 62 unique classes
Will sample 10000 samples per client per epoch
Graph: erdos, nodes: 20, edges: 48
Degree statistics: avg=4.80, min=2, max=7
Attack: Compromised 12/20 nodes: [1, 2, 3, 5, 8, 11, 12, 13, 14, 15, 17, 18]
Attack type: backdoor, lambda: 1.0
Backdoor target label: 0, trigger size: 4
Model variant: baseline
Model parameters: 6,603,710
UBAR ALGORITHM (Two-Stage Byzantine-resilient)
  - Model dimension: 6,603,710 parameters
  - Rho parameter: 0.4
  - Stage 1: Distance-based filtering (select 40% closest neighbors)
  - Stage 2: Performance-based selection (loss comparison)
  - Complexity: O(deg(i)×d + deg(i)×inference)
Initial test acc across nodes: mean=0.0162 ± 0.0138
Backdoor attack: Created poisoned datasets for 12 compromised nodes
Round 001: test acc mean=0.2208 ± 0.1623 | min=0.0474 max=0.4940
         : test loss mean=15407.3085 ± 22683.5787
         : individual accs = ['0.427568', '0.048775', '0.197011', '0.056081', '0.494011', '0.064381', '0.410923', '0.163946', '0.096874', '0.428805', '0.401641', '0.141903', '0.047398', '0.047653', '0.168065', '0.068255', '0.442572', '0.177863', '0.108717', '0.424176']
         : correct/total = [(1765, 4128), (205, 4203), (804, 4081), (243, 4333), (2021, 4091), (276, 4287), (1723, 4193), (713, 4349), (406, 4191), (1834, 4277), (1664, 4143), (595, 4193), (194, 4093), (200, 4197), (681, 4052), (275, 4029), (1838, 4153), (744, 4183), (444, 4084), (1751, 4128)]
         : compromised: 0.1019, honest: 0.3992
         : ubar stats = ['Node 0: s1=0.333, s2=0.500', 'Node 1: s1=0.333, s2=1.000', 'Node 2: s1=0.400, s2=1.000']...
Round 002: test acc mean=0.3125 ± 0.3238 | min=0.0389 max=0.7425
         : test loss mean=6039.9195 ± 25218.2915
         : individual accs = ['0.742490', '0.050440', '0.049988', '0.049158', '0.661208', '0.058782', '0.701646', '0.676017', '0.044858', '0.738368', '0.728699', '0.051514', '0.049108', '0.047653', '0.047878', '0.048151', '0.690104', '0.046378', '0.038932', '0.728682']
         : correct/total = [(3065, 4128), (212, 4203), (204, 4081), (213, 4333), (2705, 4091), (252, 4287), (2942, 4193), (2940, 4349), (188, 4191), (3158, 4277), (3019, 4143), (216, 4193), (201, 4093), (200, 4197), (194, 4052), (194, 4029), (2866, 4153), (194, 4183), (159, 4084), (3008, 4128)]
         : compromised: 0.0486, honest: 0.7084
         : ubar stats = ['Node 0: s1=0.333, s2=0.500', 'Node 1: s1=0.333, s2=1.000', 'Node 2: s1=0.400, s2=1.000']...
Round 003: test acc mean=0.3433 ± 0.3639 | min=0.0422 max=0.7975
         : test loss mean=nan ± nan
         : individual accs = ['0.796027', '0.045206', '0.046312', '0.042234', '0.780983', '0.052018', '0.786311', '0.795125', '0.042711', '0.784896', '0.789283', '0.042213', '0.045688', '0.045509', '0.044669', '0.050137', '0.781363', '0.044227', '0.052644', '0.797481']
         : correct/total = [(3286, 4128), (190, 4203), (189, 4081), (183, 4333), (3195, 4091), (223, 4287), (3297, 4193), (3458, 4349), (179, 4191), (3357, 4277), (3270, 4143), (177, 4193), (187, 4093), (191, 4197), (181, 4052), (202, 4029), (3245, 4153), (185, 4183), (215, 4084), (3292, 4128)]
         : compromised: 0.0461, honest: 0.7889
         : ubar stats = ['Node 0: s1=0.333, s2=0.667', 'Node 1: s1=0.333, s2=0.833', 'Node 2: s1=0.400, s2=0.833']...
Round 004: test acc mean=0.3499 ± 0.3672 | min=0.0466 max=0.8160
         : test loss mean=nan ± nan
         : individual accs = ['0.805233', '0.048775', '0.049743', '0.046619', '0.807138', '0.052484', '0.815884', '0.723615', '0.051062', '0.815993', '0.807627', '0.048891', '0.047398', '0.047653', '0.054788', '0.054604', '0.809294', '0.049247', '0.054358', '0.808382']
         : correct/total = [(3324, 4128), (205, 4203), (203, 4081), (202, 4333), (3302, 4091), (225, 4287), (3421, 4193), (3147, 4349), (214, 4191), (3490, 4277), (3346, 4143), (205, 4193), (194, 4093), (200, 4197), (222, 4052), (220, 4029), (3361, 4153), (206, 4183), (222, 4084), (3337, 4128)]
         : compromised: 0.0505, honest: 0.7991
         : ubar stats = ['Node 0: s1=0.333, s2=0.625', 'Node 1: s1=0.333, s2=0.750', 'Node 2: s1=0.400, s2=0.750']...
Round 005: test acc mean=0.3579 ± 0.3765 | min=0.0466 max=0.8239
         : test loss mean=nan ± nan
         : individual accs = ['0.817345', '0.048775', '0.049743', '0.046619', '0.810560', '0.052484', '0.821607', '0.816050', '0.051062', '0.821838', '0.818248', '0.048891', '0.047398', '0.047653', '0.054788', '0.054604', '0.822297', '0.049247', '0.054358', '0.823886']
         : correct/total = [(3374, 4128), (205, 4203), (203, 4081), (202, 4333), (3316, 4091), (225, 4287), (3445, 4193), (3549, 4349), (214, 4191), (3515, 4277), (3390, 4143), (205, 4193), (194, 4093), (200, 4197), (222, 4052), (220, 4029), (3415, 4153), (206, 4183), (222, 4084), (3401, 4128)]
         : compromised: 0.0505, honest: 0.8190
         : ubar stats = ['Node 0: s1=0.333, s2=0.600', 'Node 1: s1=0.333, s2=0.700', 'Node 2: s1=0.400, s2=0.700']...
Round 006: test acc mean=0.3607 ± 0.3800 | min=0.0466 max=0.8331
         : test loss mean=nan ± nan
         : individual accs = ['0.826550', '0.048775', '0.049743', '0.046619', '0.809093', '0.052484', '0.828285', '0.825017', '0.051062', '0.833061', '0.822592', '0.048891', '0.047398', '0.047653', '0.054788', '0.054604', '0.832410', '0.049247', '0.054358', '0.831638']
         : correct/total = [(3412, 4128), (205, 4203), (203, 4081), (202, 4333), (3310, 4091), (225, 4287), (3473, 4193), (3588, 4349), (214, 4191), (3563, 4277), (3408, 4143), (205, 4193), (194, 4093), (200, 4197), (222, 4052), (220, 4029), (3457, 4153), (206, 4183), (222, 4084), (3433, 4128)]
         : compromised: 0.0505, honest: 0.8261
         : ubar stats = ['Node 0: s1=0.333, s2=0.667', 'Node 1: s1=0.333, s2=0.667', 'Node 2: s1=0.400, s2=0.667']...
Round 007: test acc mean=0.3646 ± 0.3848 | min=0.0466 max=0.8464
         : test loss mean=nan ± nan
         : individual accs = ['0.833818', '0.048775', '0.049743', '0.046619', '0.828404', '0.052484', '0.839494', '0.830306', '0.051062', '0.844050', '0.831764', '0.048891', '0.047398', '0.047653', '0.054788', '0.054604', '0.846376', '0.049247', '0.054358', '0.832849']
         : correct/total = [(3442, 4128), (205, 4203), (203, 4081), (202, 4333), (3389, 4091), (225, 4287), (3520, 4193), (3611, 4349), (214, 4191), (3610, 4277), (3446, 4143), (205, 4193), (194, 4093), (200, 4197), (222, 4052), (220, 4029), (3515, 4153), (206, 4183), (222, 4084), (3438, 4128)]
         : compromised: 0.0505, honest: 0.8359
         : ubar stats = ['Node 0: s1=0.333, s2=0.643', 'Node 1: s1=0.333, s2=0.643', 'Node 2: s1=0.400, s2=0.643']...
Round 008: test acc mean=0.3647 ± 0.3849 | min=0.0466 max=0.8476
         : test loss mean=nan ± nan
         : individual accs = ['0.832607', '0.048775', '0.049743', '0.046619', '0.825226', '0.052484', '0.847603', '0.838124', '0.051062', '0.845920', '0.832247', '0.048891', '0.047398', '0.047653', '0.054788', '0.054604', '0.837948', '0.049247', '0.054358', '0.828731']
         : correct/total = [(3437, 4128), (205, 4203), (203, 4081), (202, 4333), (3376, 4091), (225, 4287), (3554, 4193), (3645, 4349), (214, 4191), (3618, 4277), (3448, 4143), (205, 4193), (194, 4093), (200, 4197), (222, 4052), (220, 4029), (3480, 4153), (206, 4183), (222, 4084), (3421, 4128)]
         : compromised: 0.0505, honest: 0.8361
         : ubar stats = ['Node 0: s1=0.333, s2=0.625', 'Node 1: s1=0.333, s2=0.625', 'Node 2: s1=0.400, s2=0.625']...
Round 009: test acc mean=0.3677 ± 0.3886 | min=0.0466 max=0.8529
         : test loss mean=nan ± nan
         : individual accs = ['0.838663', '0.048775', '0.049743', '0.046619', '0.830604', '0.052484', '0.849988', '0.848701', '0.051062', '0.852934', '0.841661', '0.048891', '0.047398', '0.047653', '0.054788', '0.054604', '0.843727', '0.049247', '0.054358', '0.843023']
         : correct/total = [(3462, 4128), (205, 4203), (203, 4081), (202, 4333), (3398, 4091), (225, 4287), (3564, 4193), (3691, 4349), (214, 4191), (3648, 4277), (3487, 4143), (205, 4193), (194, 4093), (200, 4197), (222, 4052), (220, 4029), (3504, 4153), (206, 4183), (222, 4084), (3480, 4128)]
         : compromised: 0.0505, honest: 0.8437
         : ubar stats = ['Node 0: s1=0.333, s2=0.611', 'Node 1: s1=0.333, s2=0.611', 'Node 2: s1=0.400, s2=0.611']...
Round 010: test acc mean=0.3682 ± 0.3892 | min=0.0466 max=0.8579
         : test loss mean=nan ± nan
         : individual accs = ['0.845446', '0.048775', '0.049743', '0.046619', '0.834026', '0.052484', '0.857858', '0.843642', '0.051062', '0.856208', '0.837316', '0.048891', '0.047398', '0.047653', '0.054788', '0.054604', '0.842523', '0.049247', '0.054358', '0.841570']
         : correct/total = [(3490, 4128), (205, 4203), (203, 4081), (202, 4333), (3412, 4091), (225, 4287), (3597, 4193), (3669, 4349), (214, 4191), (3662, 4277), (3469, 4143), (205, 4193), (194, 4093), (200, 4197), (222, 4052), (220, 4029), (3499, 4153), (206, 4183), (222, 4084), (3474, 4128)]
         : compromised: 0.0505, honest: 0.8448
         : ubar stats = ['Node 0: s1=0.333, s2=0.600', 'Node 1: s1=0.333, s2=0.600', 'Node 2: s1=0.400, s2=0.600']...

=== FINAL RESULTS ===
Dataset: femnist, Nodes: 20, Graph: erdos, Aggregation: ubar
Attack: backdoor, 60.0% compromised
Final accuracy - Compromised: 0.0505, Honest: 0.8448
Overall test accuracy: mean=0.3682 ± 0.3892

=== BACKDOOR ATTACK SUCCESS RATE (ASR) ===
Target label: 0
Trigger size: 4x4
Overall ASR: 0.6202 ± 0.4652
Honest nodes ASR: 0.0504 ± 0.0042
Compromised nodes ASR: 1.0000 ± 0.0000
Note: Higher ASR indicates more successful backdoor attack

=== UBAR SUMMARY ===
Node 0: stage1=0.333, stage2=0.600, overall=0.200
Node 1: stage1=0.333, stage2=0.600, overall=0.200
Node 2: stage1=0.400, stage2=0.600, overall=0.240
Node 3: stage1=0.250, stage2=1.000, overall=0.250
Node 4: stage1=0.250, stage2=1.000, overall=0.250
Node 5: stage1=0.400, stage2=0.550, overall=0.220
Node 6: stage1=0.400, stage2=0.500, overall=0.200
Node 7: stage1=0.400, stage2=0.550, overall=0.220
Node 8: stage1=0.500, stage2=1.000, overall=0.500
Node 9: stage1=0.333, stage2=1.000, overall=0.333
Node 10: stage1=0.250, stage2=1.000, overall=0.250
Node 11: stage1=0.286, stage2=0.600, overall=0.171
Node 12: stage1=0.286, stage2=0.600, overall=0.171
Node 13: stage1=0.250, stage2=1.000, overall=0.250
Node 14: stage1=0.286, stage2=0.500, overall=0.143
Node 15: stage1=0.333, stage2=0.600, overall=0.200
Node 16: stage1=0.400, stage2=0.500, overall=0.200
Node 17: stage1=0.400, stage2=0.600, overall=0.240
Node 18: stage1=0.250, stage2=1.000, overall=0.250
Node 19: stage1=0.500, stage2=1.000, overall=0.500

=== PARALLEL EXECUTION TIME (realistic for distributed system) ===
  COMMUNICATION (max across nodes):
    - Full model transfer: 0.000s (0.0%)
  COMPUTATION (max across nodes):
    - Distance computation: 0.028s (0.7%)
    - Loss computation: 4.132s (99.2%)
    - Aggregation: 0.006s (0.2%)
  TOTALS:
    - Total computation: 4.166s (100.0%)
    - Total communication: 0.000s (0.0%)
    - Total parallel time: 4.166s

=== PER-NODE AVERAGE TIME ===
  - Distance computation: 0.022s
  - Loss computation: 3.899s
  - Aggregation: 0.005s
  - Model transfer: 0.000s
  - Total per node: 3.925s

=== TOTAL COMPUTATIONAL WORK (sum across all nodes) ===
  - Total distance computation: 0.431s
  - Total loss computation: 77.976s
  - Total aggregation: 0.091s
  - Total model transfer: 0.000s
  - Grand total: 78.498s
  - Mean Stage 1 acceptance rate: 0.342
  - Mean Stage 2 acceptance rate: 0.740
  - Overall acceptance rate: 0.253

UBAR Algorithm Properties:
  - Model dimension: 6,603,710
  - Rho parameter: 0.4
  - Two-stage approach: Distance filtering + loss evaluation
  - Stage 1 selects: 40% of neighbors
  - Stage 2 uses: Training sample loss comparison
  - Theoretical complexity: O(deg(i)×d + deg(i)×inference)
  - Approach: UBAR paper implementation
