Device: cuda
Seed: 987654321
Loading 36 LEAF FEMNIST train files...
LEAF FEMNIST train: 3597 users, 734463 samples
Loading 36 LEAF FEMNIST test files...
LEAF FEMNIST test: 3597 users, 83388 samples
Found 3597 train users, 3597 test users, 3597 common users
User sample counts range: 525 (max) to 17 (min)
Distributed ALL 3597 users across 20 clients
Users per client: 179 (with 17 clients getting +1 user)
Train partition sizes: [36360, 37070, 35957, 38262, 36024, 37732, 36921, 38328, 36867, 37683, 36507, 36915, 36007, 37001, 35681, 35453, 36585, 36801, 35964, 36345]
Test partition sizes: [4128, 4203, 4081, 4333, 4091, 4287, 4193, 4349, 4191, 4277, 4143, 4193, 4093, 4197, 4052, 4029, 4153, 4183, 4084, 4128]
  Client 0: 36360 train samples, 62 unique classes
  Client 1: 37070 train samples, 62 unique classes
  Client 2: 35957 train samples, 62 unique classes
  Client 3: 38262 train samples, 62 unique classes
  Client 4: 36024 train samples, 62 unique classes
  Client 5: 37732 train samples, 62 unique classes
  Client 6: 36921 train samples, 62 unique classes
  Client 7: 38328 train samples, 62 unique classes
  Client 8: 36867 train samples, 62 unique classes
  Client 9: 37683 train samples, 62 unique classes
  Client 10: 36507 train samples, 62 unique classes
  Client 11: 36915 train samples, 62 unique classes
  Client 12: 36007 train samples, 62 unique classes
  Client 13: 37001 train samples, 62 unique classes
  Client 14: 35681 train samples, 62 unique classes
  Client 15: 35453 train samples, 62 unique classes
  Client 16: 36585 train samples, 62 unique classes
  Client 17: 36801 train samples, 62 unique classes
  Client 18: 35964 train samples, 62 unique classes
  Client 19: 36345 train samples, 62 unique classes
Will sample 10000 samples per client per epoch
Graph: fully, nodes: 20, edges: 190
Degree statistics: avg=19.00, min=19, max=19
Attack: Compromised 14/20 nodes: [1, 2, 3, 5, 6, 8, 11, 12, 13, 14, 15, 17, 18, 19]
Attack type: backdoor, lambda: 1.0
Backdoor target label: 0, trigger size: 4
Model variant: baseline
Model parameters: 6,603,710
Initial test acc across nodes: mean=0.0168 ± 0.0139
Backdoor attack: Created poisoned datasets for 14 compromised nodes
Round 001: test acc mean=0.0190 ± 0.0159 | min=0.0031 max=0.0536
         : test loss mean=75375.2156 ± 22103.3456
         : individual accs = ['0.004360', '0.012372', '0.005391', '0.043388', '0.004400', '0.003732', '0.010494', '0.016096', '0.024815', '0.006313', '0.025585', '0.044360', '0.009773', '0.022873', '0.047878', '0.053611', '0.021430', '0.004303', '0.015671', '0.003149']
         : correct/total = [(18, 4128), (52, 4203), (22, 4081), (188, 4333), (18, 4091), (16, 4287), (44, 4193), (70, 4349), (104, 4191), (27, 4277), (106, 4143), (186, 4193), (40, 4093), (96, 4197), (194, 4052), (216, 4029), (89, 4153), (18, 4183), (64, 4084), (13, 4128)]
         : compromised: 0.0216, honest: 0.0130
Round 002: test acc mean=0.0514 ± 0.0034 | min=0.0469 max=0.0618
         : test loss mean=1146367931710.1895 ± 37261828770.3651
         : individual accs = ['0.051599', '0.051630', '0.050723', '0.048465', '0.051088', '0.048052', '0.049130', '0.051276', '0.047960', '0.053075', '0.050447', '0.061770', '0.053750', '0.046938', '0.048124', '0.056342', '0.055141', '0.050203', '0.052889', '0.048450']
         : correct/total = [(213, 4128), (217, 4203), (207, 4081), (210, 4333), (209, 4091), (206, 4287), (206, 4193), (223, 4349), (201, 4191), (227, 4277), (209, 4143), (259, 4193), (220, 4093), (197, 4197), (195, 4052), (227, 4029), (229, 4153), (210, 4183), (216, 4084), (200, 4128)]
         : compromised: 0.0510, honest: 0.0521
Round 003: test acc mean=0.0514 ± 0.0034 | min=0.0469 max=0.0618
         : test loss mean=3565943976391.4282 ± 121980439576.8535
         : individual accs = ['0.051599', '0.051630', '0.050723', '0.048465', '0.051088', '0.048052', '0.049130', '0.051276', '0.047960', '0.053075', '0.050447', '0.061770', '0.053750', '0.046938', '0.048124', '0.056342', '0.055141', '0.050203', '0.052889', '0.048450']
         : correct/total = [(213, 4128), (217, 4203), (207, 4081), (210, 4333), (209, 4091), (206, 4287), (206, 4193), (223, 4349), (201, 4191), (227, 4277), (209, 4143), (259, 4193), (220, 4093), (197, 4197), (195, 4052), (227, 4029), (229, 4153), (210, 4183), (216, 4084), (200, 4128)]
         : compromised: 0.0510, honest: 0.0521
Round 004: test acc mean=0.0561 ± 0.0032 | min=0.0506 max=0.0624
         : test loss mean=4.1740 ± 0.0456
         : individual accs = ['0.059593', '0.052344', '0.057584', '0.052850', '0.057932', '0.050618', '0.057000', '0.058174', '0.053209', '0.053776', '0.055998', '0.053899', '0.058637', '0.062426', '0.061204', '0.056590', '0.058271', '0.050920', '0.055583', '0.055475']
         : correct/total = [(246, 4128), (220, 4203), (235, 4081), (229, 4333), (237, 4091), (217, 4287), (239, 4193), (253, 4349), (223, 4191), (230, 4277), (232, 4143), (226, 4193), (240, 4093), (262, 4197), (248, 4052), (228, 4029), (242, 4153), (213, 4183), (227, 4084), (229, 4128)]
         : compromised: 0.0556, honest: 0.0573
Round 005: test acc mean=0.0522 ± 0.0035 | min=0.0469 max=0.0612
         : test loss mean=860937635.2251 ± 671898149.7131
         : individual accs = ['0.051599', '0.051630', '0.050723', '0.048465', '0.051088', '0.048052', '0.049130', '0.058174', '0.053209', '0.053075', '0.050447', '0.053899', '0.053750', '0.046938', '0.061204', '0.056342', '0.055141', '0.050203', '0.052889', '0.048450']
         : correct/total = [(213, 4128), (217, 4203), (207, 4081), (210, 4333), (209, 4091), (206, 4287), (206, 4193), (253, 4349), (223, 4191), (227, 4277), (209, 4143), (226, 4193), (220, 4093), (197, 4197), (248, 4052), (227, 4029), (229, 4153), (210, 4183), (216, 4084), (200, 4128)]
         : compromised: 0.0518, honest: 0.0533
Round 006: test acc mean=0.0561 ± 0.0032 | min=0.0506 max=0.0624
         : test loss mean=4.0736 ± 0.0362
         : individual accs = ['0.059593', '0.052344', '0.057584', '0.052850', '0.057932', '0.050618', '0.057000', '0.058174', '0.053209', '0.053776', '0.055998', '0.053899', '0.058637', '0.062426', '0.061204', '0.056590', '0.058271', '0.050920', '0.055583', '0.055475']
         : correct/total = [(246, 4128), (220, 4203), (235, 4081), (229, 4333), (237, 4091), (217, 4287), (239, 4193), (253, 4349), (223, 4191), (230, 4277), (232, 4143), (226, 4193), (240, 4093), (262, 4197), (248, 4052), (228, 4029), (242, 4153), (213, 4183), (227, 4084), (229, 4128)]
         : compromised: 0.0556, honest: 0.0573
Round 007: test acc mean=0.0561 ± 0.0032 | min=0.0506 max=0.0624
         : test loss mean=4.0182 ± 0.0327
         : individual accs = ['0.059593', '0.052344', '0.057584', '0.052850', '0.057932', '0.050618', '0.057000', '0.058174', '0.053209', '0.053776', '0.055998', '0.053899', '0.058637', '0.062426', '0.061204', '0.056590', '0.058271', '0.050920', '0.055583', '0.055475']
         : correct/total = [(246, 4128), (220, 4203), (235, 4081), (229, 4333), (237, 4091), (217, 4287), (239, 4193), (253, 4349), (223, 4191), (230, 4277), (232, 4143), (226, 4193), (240, 4093), (262, 4197), (248, 4052), (228, 4029), (242, 4153), (213, 4183), (227, 4084), (229, 4128)]
         : compromised: 0.0556, honest: 0.0573
Round 008: test acc mean=0.0222 ± 0.0026 | min=0.0164 max=0.0257
         : test loss mean=3.9006 ± 0.0198
         : individual accs = ['0.020349', '0.024030', '0.019358', '0.024694', '0.020777', '0.022160', '0.019795', '0.025063', '0.025292', '0.024082', '0.019792', '0.025042', '0.016369', '0.024065', '0.023198', '0.022834', '0.021430', '0.021516', '0.017630', '0.025678']
         : correct/total = [(84, 4128), (101, 4203), (79, 4081), (107, 4333), (85, 4091), (95, 4287), (83, 4193), (109, 4349), (106, 4191), (103, 4277), (82, 4143), (105, 4193), (67, 4093), (101, 4197), (94, 4052), (92, 4029), (89, 4153), (90, 4183), (72, 4084), (106, 4128)]
         : compromised: 0.0223, honest: 0.0219
Round 009: test acc mean=0.0222 ± 0.0026 | min=0.0164 max=0.0257
         : test loss mean=3.9945 ± 0.0113
         : individual accs = ['0.020349', '0.024030', '0.019358', '0.024694', '0.020777', '0.022160', '0.019795', '0.025063', '0.025292', '0.024082', '0.019792', '0.025042', '0.016369', '0.024065', '0.023198', '0.022834', '0.021430', '0.021516', '0.017630', '0.025678']
         : correct/total = [(84, 4128), (101, 4203), (79, 4081), (107, 4333), (85, 4091), (95, 4287), (83, 4193), (109, 4349), (106, 4191), (103, 4277), (82, 4143), (105, 4193), (67, 4093), (101, 4197), (94, 4052), (92, 4029), (89, 4153), (90, 4183), (72, 4084), (106, 4128)]
         : compromised: 0.0223, honest: 0.0219
Round 010: test acc mean=0.0138 ± 0.0011 | min=0.0118 max=0.0157
         : test loss mean=4.1081 ± 0.0065
         : individual accs = ['0.015746', '0.012372', '0.013722', '0.015232', '0.015400', '0.013063', '0.013356', '0.015406', '0.012646', '0.013795', '0.011827', '0.013594', '0.013682', '0.013105', '0.012833', '0.013899', '0.013243', '0.014583', '0.014691', '0.014777']
         : correct/total = [(65, 4128), (52, 4203), (56, 4081), (66, 4333), (63, 4091), (56, 4287), (56, 4193), (67, 4349), (53, 4191), (59, 4277), (49, 4143), (57, 4193), (56, 4093), (55, 4197), (52, 4052), (56, 4029), (55, 4153), (61, 4183), (60, 4084), (61, 4128)]
         : compromised: 0.0137, honest: 0.0142

=== FINAL RESULTS ===
Dataset: femnist, Nodes: 20, Graph: fully, Aggregation: d-fedavg
Attack: backdoor, 70.0% compromised
Final accuracy - Compromised: 0.0137, Honest: 0.0142
Overall test accuracy: mean=0.0138 ± 0.0011

=== BACKDOOR ATTACK SUCCESS RATE (ASR) ===
Target label: 0
Trigger size: 4x4
Overall ASR: 0.0000 ± 0.0000
Honest nodes ASR: 0.0000 ± 0.0000
Compromised nodes ASR: 0.0000 ± 0.0000
Note: Higher ASR indicates more successful backdoor attack
