Device: cuda
Seed: 987654321
Loading 36 LEAF FEMNIST train files...
LEAF FEMNIST train: 3597 users, 734463 samples
Loading 36 LEAF FEMNIST test files...
LEAF FEMNIST test: 3597 users, 83388 samples
Found 3597 train users, 3597 test users, 3597 common users
User sample counts range: 525 (max) to 17 (min)
Distributed ALL 3597 users across 20 clients
Users per client: 179 (with 17 clients getting +1 user)
Train partition sizes: [36360, 37070, 35957, 38262, 36024, 37732, 36921, 38328, 36867, 37683, 36507, 36915, 36007, 37001, 35681, 35453, 36585, 36801, 35964, 36345]
Test partition sizes: [4128, 4203, 4081, 4333, 4091, 4287, 4193, 4349, 4191, 4277, 4143, 4193, 4093, 4197, 4052, 4029, 4153, 4183, 4084, 4128]
  Client 0: 36360 train samples, 62 unique classes
  Client 1: 37070 train samples, 62 unique classes
  Client 2: 35957 train samples, 62 unique classes
  Client 3: 38262 train samples, 62 unique classes
  Client 4: 36024 train samples, 62 unique classes
  Client 5: 37732 train samples, 62 unique classes
  Client 6: 36921 train samples, 62 unique classes
  Client 7: 38328 train samples, 62 unique classes
  Client 8: 36867 train samples, 62 unique classes
  Client 9: 37683 train samples, 62 unique classes
  Client 10: 36507 train samples, 62 unique classes
  Client 11: 36915 train samples, 62 unique classes
  Client 12: 36007 train samples, 62 unique classes
  Client 13: 37001 train samples, 62 unique classes
  Client 14: 35681 train samples, 62 unique classes
  Client 15: 35453 train samples, 62 unique classes
  Client 16: 36585 train samples, 62 unique classes
  Client 17: 36801 train samples, 62 unique classes
  Client 18: 35964 train samples, 62 unique classes
  Client 19: 36345 train samples, 62 unique classes
Will sample 10000 samples per client per epoch
Graph: erdos, nodes: 20, edges: 99
Degree statistics: avg=9.90, min=7, max=14
Attack: Compromised 16/20 nodes: [1, 2, 3, 5, 6, 8, 9, 10, 11, 12, 13, 14, 15, 17, 18, 19]
Attack type: directed_deviation, lambda: 1.0
Model variant: baseline
Model parameters: 6,603,710
Initial test acc across nodes: mean=0.0162 ± 0.0138
Round 001: test acc mean=0.0127 ± 0.0113 | min=0.0029 max=0.0453
         : test loss mean=127697.1659 ± 70347.2162
         : individual accs = ['0.005329', '0.004045', '0.010047', '0.014770', '0.005378', '0.003266', '0.045314', '0.011727', '0.006204', '0.018237', '0.011586', '0.002862', '0.026387', '0.004527', '0.015795', '0.037230', '0.013484', '0.003825', '0.004897', '0.008963']
         : correct/total = [(22, 4128), (17, 4203), (41, 4081), (64, 4333), (22, 4091), (14, 4287), (190, 4193), (51, 4349), (26, 4191), (78, 4277), (48, 4143), (12, 4193), (108, 4093), (19, 4197), (64, 4052), (150, 4029), (56, 4153), (16, 4183), (20, 4084), (37, 4128)]
         : compromised: 0.0136, honest: 0.0090
Round 002: test acc mean=0.0494 ± 0.0031 | min=0.0415 max=0.0550
         : test loss mean=nan ± nan
         : individual accs = ['0.049419', '0.048775', '0.049743', '0.048004', '0.045710', '0.052484', '0.041498', '0.049897', '0.051062', '0.050736', '0.048033', '0.048891', '0.047398', '0.047653', '0.054788', '0.046910', '0.047436', '0.049247', '0.054358', '0.054990']
         : correct/total = [(204, 4128), (205, 4203), (203, 4081), (208, 4333), (187, 4091), (225, 4287), (174, 4193), (217, 4349), (214, 4191), (217, 4277), (199, 4143), (205, 4193), (194, 4093), (200, 4197), (222, 4052), (189, 4029), (197, 4153), (206, 4183), (222, 4084), (227, 4128)]
         : compromised: 0.0497, honest: 0.0481
Round 003: test acc mean=0.0497 ± 0.0033 | min=0.0415 max=0.0550
         : test loss mean=nan ± nan
         : individual accs = ['0.049419', '0.048775', '0.049743', '0.046619', '0.045710', '0.052484', '0.041498', '0.049897', '0.051062', '0.050736', '0.048033', '0.048891', '0.047398', '0.047653', '0.054788', '0.054604', '0.047436', '0.049247', '0.054358', '0.054990']
         : correct/total = [(204, 4128), (205, 4203), (203, 4081), (202, 4333), (187, 4091), (225, 4287), (174, 4193), (217, 4349), (214, 4191), (217, 4277), (199, 4143), (205, 4193), (194, 4093), (200, 4197), (222, 4052), (220, 4029), (197, 4153), (206, 4183), (222, 4084), (227, 4128)]
         : compromised: 0.0501, honest: 0.0481
Round 004: test acc mean=0.0497 ± 0.0033 | min=0.0415 max=0.0550
         : test loss mean=nan ± nan
         : individual accs = ['0.049419', '0.048775', '0.049743', '0.046619', '0.045710', '0.052484', '0.041498', '0.049897', '0.051062', '0.050736', '0.048033', '0.048891', '0.047398', '0.047653', '0.054788', '0.054604', '0.047436', '0.049247', '0.054358', '0.054990']
         : correct/total = [(204, 4128), (205, 4203), (203, 4081), (202, 4333), (187, 4091), (225, 4287), (174, 4193), (217, 4349), (214, 4191), (217, 4277), (199, 4143), (205, 4193), (194, 4093), (200, 4197), (222, 4052), (220, 4029), (197, 4153), (206, 4183), (222, 4084), (227, 4128)]
         : compromised: 0.0501, honest: 0.0481
Round 005: test acc mean=0.0497 ± 0.0033 | min=0.0415 max=0.0550
         : test loss mean=nan ± nan
         : individual accs = ['0.049419', '0.048775', '0.049743', '0.046619', '0.045710', '0.052484', '0.041498', '0.049897', '0.051062', '0.050736', '0.048033', '0.048891', '0.047398', '0.047653', '0.054788', '0.054604', '0.047436', '0.049247', '0.054358', '0.054990']
         : correct/total = [(204, 4128), (205, 4203), (203, 4081), (202, 4333), (187, 4091), (225, 4287), (174, 4193), (217, 4349), (214, 4191), (217, 4277), (199, 4143), (205, 4193), (194, 4093), (200, 4197), (222, 4052), (220, 4029), (197, 4153), (206, 4183), (222, 4084), (227, 4128)]
         : compromised: 0.0501, honest: 0.0481
Round 006: test acc mean=0.0497 ± 0.0033 | min=0.0415 max=0.0550
         : test loss mean=nan ± nan
         : individual accs = ['0.049419', '0.048775', '0.049743', '0.046619', '0.045710', '0.052484', '0.041498', '0.049897', '0.051062', '0.050736', '0.048033', '0.048891', '0.047398', '0.047653', '0.054788', '0.054604', '0.047436', '0.049247', '0.054358', '0.054990']
         : correct/total = [(204, 4128), (205, 4203), (203, 4081), (202, 4333), (187, 4091), (225, 4287), (174, 4193), (217, 4349), (214, 4191), (217, 4277), (199, 4143), (205, 4193), (194, 4093), (200, 4197), (222, 4052), (220, 4029), (197, 4153), (206, 4183), (222, 4084), (227, 4128)]
         : compromised: 0.0501, honest: 0.0481
Round 007: test acc mean=0.0497 ± 0.0033 | min=0.0415 max=0.0550
         : test loss mean=nan ± nan
         : individual accs = ['0.049419', '0.048775', '0.049743', '0.046619', '0.045710', '0.052484', '0.041498', '0.049897', '0.051062', '0.050736', '0.048033', '0.048891', '0.047398', '0.047653', '0.054788', '0.054604', '0.047436', '0.049247', '0.054358', '0.054990']
         : correct/total = [(204, 4128), (205, 4203), (203, 4081), (202, 4333), (187, 4091), (225, 4287), (174, 4193), (217, 4349), (214, 4191), (217, 4277), (199, 4143), (205, 4193), (194, 4093), (200, 4197), (222, 4052), (220, 4029), (197, 4153), (206, 4183), (222, 4084), (227, 4128)]
         : compromised: 0.0501, honest: 0.0481
Round 008: test acc mean=0.0497 ± 0.0033 | min=0.0415 max=0.0550
         : test loss mean=nan ± nan
         : individual accs = ['0.049419', '0.048775', '0.049743', '0.046619', '0.045710', '0.052484', '0.041498', '0.049897', '0.051062', '0.050736', '0.048033', '0.048891', '0.047398', '0.047653', '0.054788', '0.054604', '0.047436', '0.049247', '0.054358', '0.054990']
         : correct/total = [(204, 4128), (205, 4203), (203, 4081), (202, 4333), (187, 4091), (225, 4287), (174, 4193), (217, 4349), (214, 4191), (217, 4277), (199, 4143), (205, 4193), (194, 4093), (200, 4197), (222, 4052), (220, 4029), (197, 4153), (206, 4183), (222, 4084), (227, 4128)]
         : compromised: 0.0501, honest: 0.0481
Round 009: test acc mean=0.0497 ± 0.0033 | min=0.0415 max=0.0550
         : test loss mean=nan ± nan
         : individual accs = ['0.049419', '0.048775', '0.049743', '0.046619', '0.045710', '0.052484', '0.041498', '0.049897', '0.051062', '0.050736', '0.048033', '0.048891', '0.047398', '0.047653', '0.054788', '0.054604', '0.047436', '0.049247', '0.054358', '0.054990']
         : correct/total = [(204, 4128), (205, 4203), (203, 4081), (202, 4333), (187, 4091), (225, 4287), (174, 4193), (217, 4349), (214, 4191), (217, 4277), (199, 4143), (205, 4193), (194, 4093), (200, 4197), (222, 4052), (220, 4029), (197, 4153), (206, 4183), (222, 4084), (227, 4128)]
         : compromised: 0.0501, honest: 0.0481
Round 010: test acc mean=0.0497 ± 0.0033 | min=0.0415 max=0.0550
         : test loss mean=nan ± nan
         : individual accs = ['0.049419', '0.048775', '0.049743', '0.046619', '0.045710', '0.052484', '0.041498', '0.049897', '0.051062', '0.050736', '0.048033', '0.048891', '0.047398', '0.047653', '0.054788', '0.054604', '0.047436', '0.049247', '0.054358', '0.054990']
         : correct/total = [(204, 4128), (205, 4203), (203, 4081), (202, 4333), (187, 4091), (225, 4287), (174, 4193), (217, 4349), (214, 4191), (217, 4277), (199, 4143), (205, 4193), (194, 4093), (200, 4197), (222, 4052), (220, 4029), (197, 4153), (206, 4183), (222, 4084), (227, 4128)]
         : compromised: 0.0501, honest: 0.0481

=== FINAL RESULTS ===
Dataset: femnist, Nodes: 20, Graph: erdos, Aggregation: krum
Attack: directed_deviation, 80.0% compromised
Final accuracy - Compromised: 0.0501, Honest: 0.0481
Overall test accuracy: mean=0.0497 ± 0.0033
