Device: cuda
Seed: 987654321
Loading 36 LEAF FEMNIST train files...
LEAF FEMNIST train: 3597 users, 734463 samples
Loading 36 LEAF FEMNIST test files...
LEAF FEMNIST test: 3597 users, 83388 samples
Found 3597 train users, 3597 test users, 3597 common users
User sample counts range: 525 (max) to 17 (min)
Distributed ALL 3597 users across 20 clients
Users per client: 179 (with 17 clients getting +1 user)
Train partition sizes: [36360, 37070, 35957, 38262, 36024, 37732, 36921, 38328, 36867, 37683, 36507, 36915, 36007, 37001, 35681, 35453, 36585, 36801, 35964, 36345]
Test partition sizes: [4128, 4203, 4081, 4333, 4091, 4287, 4193, 4349, 4191, 4277, 4143, 4193, 4093, 4197, 4052, 4029, 4153, 4183, 4084, 4128]
  Client 0: 36360 train samples, 62 unique classes
  Client 1: 37070 train samples, 62 unique classes
  Client 2: 35957 train samples, 62 unique classes
  Client 3: 38262 train samples, 62 unique classes
  Client 4: 36024 train samples, 62 unique classes
  Client 5: 37732 train samples, 62 unique classes
  Client 6: 36921 train samples, 62 unique classes
  Client 7: 38328 train samples, 62 unique classes
  Client 8: 36867 train samples, 62 unique classes
  Client 9: 37683 train samples, 62 unique classes
  Client 10: 36507 train samples, 62 unique classes
  Client 11: 36915 train samples, 62 unique classes
  Client 12: 36007 train samples, 62 unique classes
  Client 13: 37001 train samples, 62 unique classes
  Client 14: 35681 train samples, 62 unique classes
  Client 15: 35453 train samples, 62 unique classes
  Client 16: 36585 train samples, 62 unique classes
  Client 17: 36801 train samples, 62 unique classes
  Client 18: 35964 train samples, 62 unique classes
  Client 19: 36345 train samples, 62 unique classes
Will sample 10000 samples per client per epoch
Graph: ring, nodes: 20, edges: 20
Degree statistics: avg=2.00, min=2, max=2
Attack: Compromised 16/20 nodes: [1, 2, 3, 5, 6, 8, 9, 10, 11, 12, 13, 14, 15, 17, 18, 19]
Attack type: gaussian, lambda: 1.0
Model variant: baseline
Model parameters: 6,603,710
Sketchguard Node 0:
  Model dim: 6,603,710 → Sketch size: 1000
  Compression ratio: 6603.7x
  Using model parameters for aggregation, sketches for filtering
Sketchguard Node 1:
  Model dim: 6,603,710 → Sketch size: 1000
  Compression ratio: 6603.7x
  Using model parameters for aggregation, sketches for filtering
Sketchguard Node 2:
  Model dim: 6,603,710 → Sketch size: 1000
  Compression ratio: 6603.7x
  Using model parameters for aggregation, sketches for filtering
Sketchguard Node 3:
  Model dim: 6,603,710 → Sketch size: 1000
  Compression ratio: 6603.7x
  Using model parameters for aggregation, sketches for filtering
Sketchguard Node 4:
  Model dim: 6,603,710 → Sketch size: 1000
  Compression ratio: 6603.7x
  Using model parameters for aggregation, sketches for filtering
Sketchguard Node 5:
  Model dim: 6,603,710 → Sketch size: 1000
  Compression ratio: 6603.7x
  Using model parameters for aggregation, sketches for filtering
Sketchguard Node 6:
  Model dim: 6,603,710 → Sketch size: 1000
  Compression ratio: 6603.7x
  Using model parameters for aggregation, sketches for filtering
Sketchguard Node 7:
  Model dim: 6,603,710 → Sketch size: 1000
  Compression ratio: 6603.7x
  Using model parameters for aggregation, sketches for filtering
Sketchguard Node 8:
  Model dim: 6,603,710 → Sketch size: 1000
  Compression ratio: 6603.7x
  Using model parameters for aggregation, sketches for filtering
Sketchguard Node 9:
  Model dim: 6,603,710 → Sketch size: 1000
  Compression ratio: 6603.7x
  Using model parameters for aggregation, sketches for filtering
Sketchguard Node 10:
  Model dim: 6,603,710 → Sketch size: 1000
  Compression ratio: 6603.7x
  Using model parameters for aggregation, sketches for filtering
Sketchguard Node 11:
  Model dim: 6,603,710 → Sketch size: 1000
  Compression ratio: 6603.7x
  Using model parameters for aggregation, sketches for filtering
Sketchguard Node 12:
  Model dim: 6,603,710 → Sketch size: 1000
  Compression ratio: 6603.7x
  Using model parameters for aggregation, sketches for filtering
Sketchguard Node 13:
  Model dim: 6,603,710 → Sketch size: 1000
  Compression ratio: 6603.7x
  Using model parameters for aggregation, sketches for filtering
Sketchguard Node 14:
  Model dim: 6,603,710 → Sketch size: 1000
  Compression ratio: 6603.7x
  Using model parameters for aggregation, sketches for filtering
Sketchguard Node 15:
  Model dim: 6,603,710 → Sketch size: 1000
  Compression ratio: 6603.7x
  Using model parameters for aggregation, sketches for filtering
Sketchguard Node 16:
  Model dim: 6,603,710 → Sketch size: 1000
  Compression ratio: 6603.7x
  Using model parameters for aggregation, sketches for filtering
Sketchguard Node 17:
  Model dim: 6,603,710 → Sketch size: 1000
  Compression ratio: 6603.7x
  Using model parameters for aggregation, sketches for filtering
Sketchguard Node 18:
  Model dim: 6,603,710 → Sketch size: 1000
  Compression ratio: 6603.7x
  Using model parameters for aggregation, sketches for filtering
Sketchguard Node 19:
  Model dim: 6,603,710 → Sketch size: 1000
  Compression ratio: 6603.7x
  Using model parameters for aggregation, sketches for filtering
Sketchguard ALGORITHM (Sketch-based Filtering + State Aggregation)
  - Model dimension: 6,603,710 parameters
  - Config: SketchguardConfig(gamma=2, kappa=1, alpha=0.5, min_neighbors=1, sketch_size=1000, network_seed=987654321, attack_detection_window=5)
  - Sketch size: 1000
  - Compression ratio: 6603.7x
  - Complexity: O(d + N×k) = O(6,603,710 + 20×1000)
  - Theoretical speedup vs BALANCE: 19.9x
Initial test acc across nodes: mean=0.0168 ± 0.0139
Round 001: test acc mean=0.1908 ± 0.2146 | min=0.0029 max=0.5202
         : test loss mean=522441037.0669 ± 447105803.0147
         : individual accs = ['0.003876', '0.436117', '0.002940', '0.439418', '0.006355', '0.456030', '0.520153', '0.048977', '0.452159', '0.047697', '0.005793', '0.004054', '0.016858', '0.004527', '0.004195', '0.458675', '0.004575', '0.432943', '0.049951', '0.421512']
         : correct/total = [(16, 4128), (1833, 4203), (12, 4081), (1904, 4333), (26, 4091), (1955, 4287), (2181, 4193), (213, 4349), (1895, 4191), (204, 4277), (24, 4143), (17, 4193), (69, 4093), (19, 4197), (17, 4052), (1848, 4029), (19, 4153), (1811, 4183), (204, 4084), (1740, 4128)]
         : compromised: 0.2346, honest: 0.0159
         : sketchguard stats = ['Node 0: acc_rate=0.000', 'Node 1: acc_rate=0.500', 'Node 2: acc_rate=0.000']...
WARNING: Node 5 rejected model from 4 - sketch verification failed!
WARNING: Node 8 rejected model from 7 - sketch verification failed!
WARNING: Node 17 rejected model from 16 - sketch verification failed!
Round 002: test acc mean=0.1436 ± 0.2467 | min=0.0026 max=0.7567
         : test loss mean=nan ± nan
         : individual accs = ['0.047238', '0.014751', '0.054889', '0.013155', '0.043021', '0.756706', '0.002623', '0.045068', '0.701980', '0.043488', '0.048033', '0.049606', '0.054239', '0.049083', '0.061204', '0.015637', '0.052011', '0.729381', '0.052889', '0.037306']
         : correct/total = [(195, 4128), (62, 4203), (224, 4081), (57, 4333), (176, 4091), (3244, 4287), (11, 4193), (196, 4349), (2942, 4191), (186, 4277), (199, 4143), (208, 4193), (222, 4093), (206, 4197), (248, 4052), (63, 4029), (216, 4153), (3051, 4183), (216, 4084), (154, 4128)]
         : compromised: 0.1678, honest: 0.0468
         : sketchguard stats = ['Node 0: acc_rate=0.500', 'Node 1: acc_rate=0.250', 'Node 2: acc_rate=0.500']...
WARNING: Node 5 rejected model from 4 - sketch verification failed!
WARNING: Node 8 rejected model from 7 - sketch verification failed!
WARNING: Node 17 rejected model from 16 - sketch verification failed!
Round 003: test acc mean=0.1567 ± 0.2592 | min=0.0334 max=0.7859
         : test loss mean=nan ± nan
         : individual accs = ['0.047238', '0.048775', '0.054889', '0.043157', '0.043021', '0.785864', '0.050799', '0.045068', '0.775471', '0.043488', '0.048033', '0.049606', '0.054239', '0.049083', '0.045656', '0.051626', '0.052011', '0.759503', '0.052889', '0.033430']
         : correct/total = [(195, 4128), (205, 4203), (224, 4081), (187, 4333), (176, 4091), (3369, 4287), (213, 4193), (196, 4349), (3250, 4191), (186, 4277), (199, 4143), (208, 4193), (222, 4093), (206, 4197), (185, 4052), (208, 4029), (216, 4153), (3177, 4183), (216, 4084), (138, 4128)]
         : compromised: 0.1842, honest: 0.0468
         : sketchguard stats = ['Node 0: acc_rate=0.667', 'Node 1: acc_rate=0.167', 'Node 2: acc_rate=0.667']...
WARNING: Node 5 rejected model from 4 - sketch verification failed!
WARNING: Node 8 rejected model from 7 - sketch verification failed!
WARNING: Node 17 rejected model from 16 - sketch verification failed!
Round 004: test acc mean=0.1610 ± 0.2694 | min=0.0334 max=0.8111
         : test loss mean=nan ± nan
         : individual accs = ['0.047238', '0.048775', '0.054889', '0.043157', '0.043021', '0.811057', '0.050799', '0.045068', '0.796230', '0.043488', '0.048033', '0.049606', '0.054239', '0.049083', '0.045656', '0.051626', '0.052011', '0.799187', '0.052889', '0.033430']
         : correct/total = [(195, 4128), (205, 4203), (224, 4081), (187, 4333), (176, 4091), (3477, 4287), (213, 4193), (196, 4349), (3337, 4191), (186, 4277), (199, 4143), (208, 4193), (222, 4093), (206, 4197), (185, 4052), (208, 4029), (216, 4153), (3343, 4183), (216, 4084), (138, 4128)]
         : compromised: 0.1895, honest: 0.0468
         : sketchguard stats = ['Node 0: acc_rate=0.750', 'Node 1: acc_rate=0.125', 'Node 2: acc_rate=0.750']...
WARNING: Node 5 rejected model from 4 - sketch verification failed!
WARNING: Node 8 rejected model from 7 - sketch verification failed!
WARNING: Node 17 rejected model from 16 - sketch verification failed!
Round 005: test acc mean=0.1637 ± 0.2736 | min=0.0430 max=0.8216
         : test loss mean=nan ± nan
         : individual accs = ['0.047238', '0.048775', '0.054889', '0.043157', '0.043021', '0.821554', '0.050799', '0.045068', '0.816273', '0.043488', '0.048033', '0.049606', '0.054239', '0.049083', '0.045656', '0.051626', '0.052011', '0.806837', '0.052889', '0.050388']
         : correct/total = [(195, 4128), (205, 4203), (224, 4081), (187, 4333), (176, 4091), (3522, 4287), (213, 4193), (196, 4349), (3421, 4191), (186, 4277), (199, 4143), (208, 4193), (222, 4093), (206, 4197), (185, 4052), (208, 4029), (216, 4153), (3375, 4183), (216, 4084), (208, 4128)]
         : compromised: 0.1930, honest: 0.0468
         : sketchguard stats = ['Node 0: acc_rate=0.800', 'Node 1: acc_rate=0.100', 'Node 2: acc_rate=0.800']...
WARNING: Node 5 rejected model from 4 - sketch verification failed!
WARNING: Node 8 rejected model from 7 - sketch verification failed!
WARNING: Node 17 rejected model from 16 - sketch verification failed!
Round 006: test acc mean=0.1643 ± 0.2748 | min=0.0430 max=0.8225
         : test loss mean=nan ± nan
         : individual accs = ['0.047238', '0.048775', '0.054889', '0.043157', '0.043021', '0.822487', '0.050799', '0.045068', '0.817705', '0.043488', '0.048033', '0.049606', '0.054239', '0.049083', '0.045656', '0.051626', '0.052011', '0.814965', '0.052889', '0.050388']
         : correct/total = [(195, 4128), (205, 4203), (224, 4081), (187, 4333), (176, 4091), (3526, 4287), (213, 4193), (196, 4349), (3427, 4191), (186, 4277), (199, 4143), (208, 4193), (222, 4093), (206, 4197), (185, 4052), (208, 4029), (216, 4153), (3409, 4183), (216, 4084), (208, 4128)]
         : compromised: 0.1936, honest: 0.0468
         : sketchguard stats = ['Node 0: acc_rate=0.833', 'Node 1: acc_rate=0.083', 'Node 2: acc_rate=0.833']...
WARNING: Node 5 rejected model from 4 - sketch verification failed!
WARNING: Node 8 rejected model from 7 - sketch verification failed!
WARNING: Node 17 rejected model from 16 - sketch verification failed!
Round 007: test acc mean=0.1634 ± 0.2794 | min=0.0039 max=0.8356
         : test loss mean=nan ± nan
         : individual accs = ['0.047238', '0.048775', '0.054889', '0.043157', '0.043021', '0.835316', '0.050799', '0.045068', '0.835600', '0.043488', '0.048033', '0.049606', '0.054239', '0.049083', '0.045656', '0.051626', '0.052011', '0.813292', '0.052889', '0.003876']
         : correct/total = [(195, 4128), (205, 4203), (224, 4081), (187, 4333), (176, 4091), (3581, 4287), (213, 4193), (196, 4349), (3502, 4191), (186, 4277), (199, 4143), (208, 4193), (222, 4093), (206, 4197), (185, 4052), (208, 4029), (216, 4153), (3402, 4183), (216, 4084), (16, 4128)]
         : compromised: 0.1925, honest: 0.0468
         : sketchguard stats = ['Node 0: acc_rate=0.714', 'Node 1: acc_rate=0.071', 'Node 2: acc_rate=0.714']...
WARNING: Node 5 rejected model from 4 - sketch verification failed!
WARNING: Node 8 rejected model from 7 - sketch verification failed!
WARNING: Node 17 rejected model from 16 - sketch verification failed!
Round 008: test acc mean=0.1641 ± 0.2807 | min=0.0063 max=0.8428
         : test loss mean=nan ± nan
         : individual accs = ['0.047238', '0.048775', '0.054889', '0.043157', '0.043021', '0.842780', '0.050799', '0.045068', '0.828442', '0.043488', '0.048033', '0.049606', '0.054239', '0.049083', '0.045656', '0.051626', '0.052011', '0.824528', '0.052889', '0.006298']
         : correct/total = [(195, 4128), (205, 4203), (224, 4081), (187, 4333), (176, 4091), (3613, 4287), (213, 4193), (196, 4349), (3472, 4191), (186, 4277), (199, 4143), (208, 4193), (222, 4093), (206, 4197), (185, 4052), (208, 4029), (216, 4153), (3449, 4183), (216, 4084), (26, 4128)]
         : compromised: 0.1934, honest: 0.0468
         : sketchguard stats = ['Node 0: acc_rate=0.625', 'Node 1: acc_rate=0.062', 'Node 2: acc_rate=0.625']...
WARNING: Node 5 rejected model from 4 - sketch verification failed!
WARNING: Node 8 rejected model from 7 - sketch verification failed!
WARNING: Node 17 rejected model from 16 - sketch verification failed!
Round 009: test acc mean=0.1674 ± 0.2814 | min=0.0430 max=0.8453
         : test loss mean=nan ± nan
         : individual accs = ['0.048934', '0.048775', '0.054889', '0.043157', '0.043021', '0.845346', '0.050799', '0.045068', '0.836793', '0.043488', '0.048033', '0.049606', '0.054239', '0.049083', '0.051579', '0.051626', '0.052011', '0.829309', '0.052889', '0.048692']
         : correct/total = [(202, 4128), (205, 4203), (224, 4081), (187, 4333), (176, 4091), (3624, 4287), (213, 4193), (196, 4349), (3507, 4191), (186, 4277), (199, 4143), (208, 4193), (222, 4093), (206, 4197), (209, 4052), (208, 4029), (216, 4153), (3469, 4183), (216, 4084), (201, 4128)]
         : compromised: 0.1974, honest: 0.0473
         : sketchguard stats = ['Node 0: acc_rate=0.556', 'Node 1: acc_rate=0.056', 'Node 2: acc_rate=0.556']...
WARNING: Node 5 rejected model from 4 - sketch verification failed!
WARNING: Node 8 rejected model from 7 - sketch verification failed!
WARNING: Node 17 rejected model from 16 - sketch verification failed!
Round 010: test acc mean=0.1661 ± 0.2779 | min=0.0430 max=0.8281
         : test loss mean=nan ± nan
         : individual accs = ['0.051599', '0.048775', '0.054889', '0.043157', '0.043021', '0.828085', '0.050799', '0.045068', '0.827487', '0.043488', '0.048033', '0.049606', '0.054239', '0.049083', '0.051579', '0.051626', '0.052011', '0.827397', '0.052889', '0.048692']
         : correct/total = [(213, 4128), (205, 4203), (224, 4081), (187, 4333), (176, 4091), (3550, 4287), (213, 4193), (196, 4349), (3468, 4191), (186, 4277), (199, 4143), (208, 4193), (222, 4093), (206, 4197), (209, 4052), (208, 4029), (216, 4153), (3461, 4183), (216, 4084), (201, 4128)]
         : compromised: 0.1956, honest: 0.0479
         : sketchguard stats = ['Node 0: acc_rate=0.500', 'Node 1: acc_rate=0.050', 'Node 2: acc_rate=0.500']...

=== FINAL RESULTS ===
Dataset: femnist, Nodes: 20, Graph: ring, Aggregation: sketchguard
Attack: gaussian, 80.0% compromised
Final accuracy - Compromised: 0.1956, Honest: 0.0479
Overall test accuracy: mean=0.1661 ± 0.2779

=== Sketchguard SUMMARY ===
Node 0: acceptance=0.500
Node 1: acceptance=0.050
Node 2: acceptance=0.500
Node 3: acceptance=0.050
Node 4: acceptance=0.000
Node 5: acceptance=0.050
Node 6: acceptance=0.050
Node 7: acceptance=0.000
Node 8: acceptance=0.050
Node 9: acceptance=0.000
Node 10: acceptance=0.000
Node 11: acceptance=0.000
Node 12: acceptance=0.000
Node 13: acceptance=0.000
Node 14: acceptance=0.500
Node 15: acceptance=0.050
Node 16: acceptance=0.000
Node 17: acceptance=0.050
Node 18: acceptance=0.000
Node 19: acceptance=0.450

=== PARALLEL EXECUTION TIME (realistic for distributed system) ===
  COMMUNICATION (max across nodes):
    - Sketch transfer: 0.000s (0.0%)
    - Model fetch (accepted): 0.000s (0.0%)
  COMPUTATION (max across nodes):
    - Sketching: 1.472s (99.2%)
    - Filtering: 0.001s (0.1%)
    - Aggregation: 0.010s (0.7%)
  TOTALS:
    - Total computation: 1.483s (100.0%)
    - Total communication: 0.000s (0.0%)
    - Total parallel time: 1.483s

=== PER-NODE AVERAGE TIME ===
  - Sketching: 1.256s
  - Filtering: 0.001s
  - Aggregation: 0.007s
  - Sketch transfer: 0.000s
  - Model fetch: 0.000s
  - Total per node: 1.264s

=== TOTAL COMPUTATIONAL WORK (sum across all nodes) ===
  - Total sketching: 25.123s
  - Total filtering: 0.011s
  - Total aggregation: 0.136s
  - Total sketch transfer: 0.000s
  - Total model fetch: 0.000s
  - Grand total: 25.271s
  - Mean acceptance rate: 0.115

Sketchguard Algorithm Properties:
  - Original dimension: 6,603,710
  - Sketch size: 1000
  - Compression ratio: 19.9x
  - Single repetition: No repetitions needed
  - Theoretical complexity: O(d + N×k)
  - Approach: Sketch filtering + state aggregation
