Device: cuda
Seed: 987654321
Loading 36 LEAF FEMNIST train files...
LEAF FEMNIST train: 3597 users, 734463 samples
Loading 36 LEAF FEMNIST test files...
LEAF FEMNIST test: 3597 users, 83388 samples
Found 3597 train users, 3597 test users, 3597 common users
User sample counts range: 525 (max) to 17 (min)
Distributed ALL 3597 users across 20 clients
Users per client: 179 (with 17 clients getting +1 user)
Train partition sizes: [36360, 37070, 35957, 38262, 36024, 37732, 36921, 38328, 36867, 37683, 36507, 36915, 36007, 37001, 35681, 35453, 36585, 36801, 35964, 36345]
Test partition sizes: [4128, 4203, 4081, 4333, 4091, 4287, 4193, 4349, 4191, 4277, 4143, 4193, 4093, 4197, 4052, 4029, 4153, 4183, 4084, 4128]
  Client 0: 36360 train samples, 62 unique classes
  Client 1: 37070 train samples, 62 unique classes
  Client 2: 35957 train samples, 62 unique classes
  Client 3: 38262 train samples, 62 unique classes
  Client 4: 36024 train samples, 62 unique classes
  Client 5: 37732 train samples, 62 unique classes
  Client 6: 36921 train samples, 62 unique classes
  Client 7: 38328 train samples, 62 unique classes
  Client 8: 36867 train samples, 62 unique classes
  Client 9: 37683 train samples, 62 unique classes
  Client 10: 36507 train samples, 62 unique classes
  Client 11: 36915 train samples, 62 unique classes
  Client 12: 36007 train samples, 62 unique classes
  Client 13: 37001 train samples, 62 unique classes
  Client 14: 35681 train samples, 62 unique classes
  Client 15: 35453 train samples, 62 unique classes
  Client 16: 36585 train samples, 62 unique classes
  Client 17: 36801 train samples, 62 unique classes
  Client 18: 35964 train samples, 62 unique classes
  Client 19: 36345 train samples, 62 unique classes
Will sample 10000 samples per client per epoch
Graph: erdos, nodes: 20, edges: 99
Degree statistics: avg=9.90, min=7, max=14
Attack: Compromised 4/20 nodes: [5, 12, 13, 17]
Attack type: backdoor, lambda: 1.0
Backdoor target label: 0, trigger size: 4
Model variant: baseline
Model parameters: 6,603,710
Sketchguard Node 0:
  Model dim: 6,603,710 → Sketch size: 1000
  Compression ratio: 6603.7x
  Using model parameters for aggregation, sketches for filtering
Sketchguard Node 1:
  Model dim: 6,603,710 → Sketch size: 1000
  Compression ratio: 6603.7x
  Using model parameters for aggregation, sketches for filtering
Sketchguard Node 2:
  Model dim: 6,603,710 → Sketch size: 1000
  Compression ratio: 6603.7x
  Using model parameters for aggregation, sketches for filtering
Sketchguard Node 3:
  Model dim: 6,603,710 → Sketch size: 1000
  Compression ratio: 6603.7x
  Using model parameters for aggregation, sketches for filtering
Sketchguard Node 4:
  Model dim: 6,603,710 → Sketch size: 1000
  Compression ratio: 6603.7x
  Using model parameters for aggregation, sketches for filtering
Sketchguard Node 5:
  Model dim: 6,603,710 → Sketch size: 1000
  Compression ratio: 6603.7x
  Using model parameters for aggregation, sketches for filtering
Sketchguard Node 6:
  Model dim: 6,603,710 → Sketch size: 1000
  Compression ratio: 6603.7x
  Using model parameters for aggregation, sketches for filtering
Sketchguard Node 7:
  Model dim: 6,603,710 → Sketch size: 1000
  Compression ratio: 6603.7x
  Using model parameters for aggregation, sketches for filtering
Sketchguard Node 8:
  Model dim: 6,603,710 → Sketch size: 1000
  Compression ratio: 6603.7x
  Using model parameters for aggregation, sketches for filtering
Sketchguard Node 9:
  Model dim: 6,603,710 → Sketch size: 1000
  Compression ratio: 6603.7x
  Using model parameters for aggregation, sketches for filtering
Sketchguard Node 10:
  Model dim: 6,603,710 → Sketch size: 1000
  Compression ratio: 6603.7x
  Using model parameters for aggregation, sketches for filtering
Sketchguard Node 11:
  Model dim: 6,603,710 → Sketch size: 1000
  Compression ratio: 6603.7x
  Using model parameters for aggregation, sketches for filtering
Sketchguard Node 12:
  Model dim: 6,603,710 → Sketch size: 1000
  Compression ratio: 6603.7x
  Using model parameters for aggregation, sketches for filtering
Sketchguard Node 13:
  Model dim: 6,603,710 → Sketch size: 1000
  Compression ratio: 6603.7x
  Using model parameters for aggregation, sketches for filtering
Sketchguard Node 14:
  Model dim: 6,603,710 → Sketch size: 1000
  Compression ratio: 6603.7x
  Using model parameters for aggregation, sketches for filtering
Sketchguard Node 15:
  Model dim: 6,603,710 → Sketch size: 1000
  Compression ratio: 6603.7x
  Using model parameters for aggregation, sketches for filtering
Sketchguard Node 16:
  Model dim: 6,603,710 → Sketch size: 1000
  Compression ratio: 6603.7x
  Using model parameters for aggregation, sketches for filtering
Sketchguard Node 17:
  Model dim: 6,603,710 → Sketch size: 1000
  Compression ratio: 6603.7x
  Using model parameters for aggregation, sketches for filtering
Sketchguard Node 18:
  Model dim: 6,603,710 → Sketch size: 1000
  Compression ratio: 6603.7x
  Using model parameters for aggregation, sketches for filtering
Sketchguard Node 19:
  Model dim: 6,603,710 → Sketch size: 1000
  Compression ratio: 6603.7x
  Using model parameters for aggregation, sketches for filtering
Sketchguard ALGORITHM (Sketch-based Filtering + State Aggregation)
  - Model dimension: 6,603,710 parameters
  - Config: SketchguardConfig(gamma=2, kappa=1, alpha=0.5, min_neighbors=1, sketch_size=1000, network_seed=987654321, attack_detection_window=5)
  - Sketch size: 1000
  - Compression ratio: 6603.7x
  - Complexity: O(d + N×k) = O(6,603,710 + 20×1000)
  - Theoretical speedup vs BALANCE: 19.9x
Initial test acc across nodes: mean=0.0162 ± 0.0138
Backdoor attack: Created poisoned datasets for 4 compromised nodes
Round 001: test acc mean=0.4094 ± 0.1535 | min=0.0474 max=0.5409
         : test loss mean=3609.0708 ± 7415.4205
         : individual accs = ['0.540940', '0.497026', '0.508209', '0.467344', '0.453679', '0.174248', '0.481517', '0.449299', '0.507039', '0.454057', '0.449916', '0.518960', '0.047398', '0.047653', '0.497779', '0.518243', '0.467855', '0.179775', '0.480901', '0.446221']
         : correct/total = [(2233, 4128), (2089, 4203), (2074, 4081), (2025, 4333), (1856, 4091), (747, 4287), (2019, 4193), (1954, 4349), (2125, 4191), (1942, 4277), (1864, 4143), (2176, 4193), (194, 4093), (200, 4197), (2017, 4052), (2088, 4029), (1943, 4153), (752, 4183), (1964, 4084), (1842, 4128)]
         : compromised: 0.1123, honest: 0.4837
         : sketchguard stats = ['Node 0: acc_rate=0.833', 'Node 1: acc_rate=0.800', 'Node 2: acc_rate=1.000']...
Round 002: test acc mean=0.5580 ± 0.2595 | min=0.0119 max=0.7090
         : test loss mean=nan ± nan
         : individual accs = ['0.695010', '0.698549', '0.668219', '0.703208', '0.692740', '0.052484', '0.645123', '0.681766', '0.679313', '0.707505', '0.683804', '0.706177', '0.048131', '0.011913', '0.709033', '0.696451', '0.667229', '0.047574', '0.695642', '0.669816']
         : correct/total = [(2869, 4128), (2936, 4203), (2727, 4081), (3047, 4333), (2834, 4091), (225, 4287), (2705, 4193), (2965, 4349), (2847, 4191), (3026, 4277), (2833, 4143), (2961, 4193), (197, 4093), (50, 4197), (2873, 4052), (2806, 4029), (2771, 4153), (199, 4183), (2841, 4084), (2765, 4128)]
         : compromised: 0.0400, honest: 0.6875
         : sketchguard stats = ['Node 0: acc_rate=0.833', 'Node 1: acc_rate=0.800', 'Node 2: acc_rate=1.000']...
Round 003: test acc mean=0.5815 ± 0.2665 | min=0.0474 max=0.7338
         : test loss mean=nan ± nan
         : individual accs = ['0.733769', '0.719962', '0.681206', '0.727671', '0.715229', '0.052484', '0.729072', '0.727983', '0.711525', '0.702595', '0.700217', '0.732888', '0.047398', '0.047653', '0.726802', '0.716803', '0.696123', '0.049247', '0.706170', '0.704942']
         : correct/total = [(3029, 4128), (3026, 4203), (2780, 4081), (3153, 4333), (2926, 4091), (225, 4287), (3057, 4193), (3166, 4349), (2982, 4191), (3005, 4277), (2901, 4143), (3073, 4193), (194, 4093), (200, 4197), (2945, 4052), (2888, 4029), (2891, 4153), (206, 4183), (2884, 4084), (2910, 4128)]
         : compromised: 0.0492, honest: 0.7146
         : sketchguard stats = ['Node 0: acc_rate=0.833', 'Node 1: acc_rate=0.800', 'Node 2: acc_rate=1.000']...
Round 004: test acc mean=0.5820 ± 0.2669 | min=0.0474 max=0.7419
         : test loss mean=nan ± nan
         : individual accs = ['0.714874', '0.723293', '0.695908', '0.709208', '0.741872', '0.052484', '0.737420', '0.730743', '0.710809', '0.707505', '0.673184', '0.720725', '0.047398', '0.047653', '0.735933', '0.729461', '0.691067', '0.049247', '0.720372', '0.701308']
         : correct/total = [(2951, 4128), (3040, 4203), (2840, 4081), (3073, 4333), (3035, 4091), (225, 4287), (3092, 4193), (3178, 4349), (2979, 4191), (3026, 4277), (2789, 4143), (3022, 4193), (194, 4093), (200, 4197), (2982, 4052), (2939, 4029), (2870, 4153), (206, 4183), (2942, 4084), (2895, 4128)]
         : compromised: 0.0492, honest: 0.7152
         : sketchguard stats = ['Node 0: acc_rate=0.833', 'Node 1: acc_rate=0.800', 'Node 2: acc_rate=1.000']...
Round 005: test acc mean=0.5750 ± 0.2634 | min=0.0474 max=0.7387
         : test loss mean=nan ± nan
         : individual accs = ['0.718023', '0.688080', '0.671404', '0.696054', '0.717917', '0.052484', '0.697591', '0.711198', '0.710809', '0.714753', '0.678977', '0.703077', '0.047398', '0.047653', '0.695212', '0.703897', '0.735131', '0.049247', '0.738737', '0.722384']
         : correct/total = [(2964, 4128), (2892, 4203), (2740, 4081), (3016, 4333), (2937, 4091), (225, 4287), (2925, 4193), (3093, 4349), (2979, 4191), (3057, 4277), (2813, 4143), (2948, 4193), (194, 4093), (200, 4197), (2817, 4052), (2836, 4029), (3053, 4153), (206, 4183), (3017, 4084), (2982, 4128)]
         : compromised: 0.0492, honest: 0.7065
         : sketchguard stats = ['Node 0: acc_rate=0.833', 'Node 1: acc_rate=0.800', 'Node 2: acc_rate=1.000']...
Round 006: test acc mean=0.6101 ± 0.2807 | min=0.0474 max=0.7657
         : test loss mean=nan ± nan
         : individual accs = ['0.721657', '0.740899', '0.763783', '0.759289', '0.756783', '0.052484', '0.747675', '0.761324', '0.731568', '0.730185', '0.749698', '0.752683', '0.047398', '0.047653', '0.754689', '0.765699', '0.763063', '0.049247', '0.760774', '0.746124']
         : correct/total = [(2979, 4128), (3114, 4203), (3117, 4081), (3290, 4333), (3096, 4091), (225, 4287), (3135, 4193), (3311, 4349), (3066, 4191), (3123, 4277), (3106, 4143), (3156, 4193), (194, 4093), (200, 4197), (3058, 4052), (3085, 4029), (3169, 4153), (206, 4183), (3107, 4084), (3080, 4128)]
         : compromised: 0.0492, honest: 0.7504
         : sketchguard stats = ['Node 0: acc_rate=0.833', 'Node 1: acc_rate=0.800', 'Node 2: acc_rate=1.000']...
Round 007: test acc mean=0.6481 ± 0.2995 | min=0.0474 max=0.8078
         : test loss mean=nan ± nan
         : individual accs = ['0.789244', '0.797050', '0.787797', '0.807754', '0.790760', '0.052484', '0.805390', '0.804323', '0.803627', '0.795184', '0.787594', '0.796089', '0.047398', '0.047653', '0.802813', '0.804418', '0.804719', '0.049247', '0.806317', '0.781250']
         : correct/total = [(3258, 4128), (3350, 4203), (3215, 4081), (3500, 4333), (3235, 4091), (225, 4287), (3377, 4193), (3498, 4349), (3368, 4191), (3401, 4277), (3263, 4143), (3338, 4193), (194, 4093), (200, 4197), (3253, 4052), (3241, 4029), (3342, 4153), (206, 4183), (3293, 4084), (3225, 4128)]
         : compromised: 0.0492, honest: 0.7978
         : sketchguard stats = ['Node 0: acc_rate=0.833', 'Node 1: acc_rate=0.800', 'Node 2: acc_rate=1.000']...
Round 008: test acc mean=0.6639 ± 0.3074 | min=0.0474 max=0.8276
         : test loss mean=nan ± nan
         : individual accs = ['0.809109', '0.815132', '0.814996', '0.827141', '0.808360', '0.052484', '0.826854', '0.823868', '0.823193', '0.821370', '0.803765', '0.827570', '0.047398', '0.047653', '0.824778', '0.826260', '0.812666', '0.049247', '0.816357', '0.799419']
         : correct/total = [(3340, 4128), (3426, 4203), (3326, 4081), (3584, 4333), (3307, 4091), (225, 4287), (3467, 4193), (3583, 4349), (3450, 4191), (3513, 4277), (3330, 4143), (3470, 4193), (194, 4093), (200, 4197), (3342, 4052), (3329, 4029), (3375, 4153), (206, 4183), (3334, 4084), (3300, 4128)]
         : compromised: 0.0492, honest: 0.8176
         : sketchguard stats = ['Node 0: acc_rate=0.833', 'Node 1: acc_rate=0.800', 'Node 2: acc_rate=1.000']...
Round 009: test acc mean=0.6759 ± 0.3134 | min=0.0474 max=0.8466
         : test loss mean=nan ± nan
         : individual accs = ['0.824370', '0.833452', '0.830189', '0.837988', '0.826448', '0.052484', '0.837348', '0.832375', '0.846576', '0.838906', '0.830316', '0.832340', '0.047398', '0.047653', '0.836130', '0.834450', '0.826872', '0.049247', '0.829824', '0.824370']
         : correct/total = [(3403, 4128), (3503, 4203), (3388, 4081), (3631, 4333), (3381, 4091), (225, 4287), (3511, 4193), (3620, 4349), (3548, 4191), (3588, 4277), (3440, 4143), (3490, 4193), (194, 4093), (200, 4197), (3388, 4052), (3362, 4029), (3434, 4153), (206, 4183), (3389, 4084), (3403, 4128)]
         : compromised: 0.0492, honest: 0.8326
         : sketchguard stats = ['Node 0: acc_rate=0.833', 'Node 1: acc_rate=0.800', 'Node 2: acc_rate=1.000']...
Round 010: test acc mean=0.6826 ± 0.3167 | min=0.0474 max=0.8478
         : test loss mean=nan ± nan
         : individual accs = ['0.834302', '0.847252', '0.837050', '0.842372', '0.831337', '0.052484', '0.844980', '0.842493', '0.847769', '0.843582', '0.833454', '0.837348', '0.047398', '0.047653', '0.844521', '0.846116', '0.842042', '0.049247', '0.844515', '0.836240']
         : correct/total = [(3444, 4128), (3561, 4203), (3416, 4081), (3650, 4333), (3401, 4091), (225, 4287), (3543, 4193), (3664, 4349), (3553, 4191), (3608, 4277), (3453, 4143), (3511, 4193), (194, 4093), (200, 4197), (3422, 4052), (3409, 4029), (3497, 4153), (206, 4183), (3449, 4084), (3452, 4128)]
         : compromised: 0.0492, honest: 0.8410
         : sketchguard stats = ['Node 0: acc_rate=0.833', 'Node 1: acc_rate=0.800', 'Node 2: acc_rate=1.000']...

=== FINAL RESULTS ===
Dataset: femnist, Nodes: 20, Graph: erdos, Aggregation: sketchguard
Attack: backdoor, 20.0% compromised
Final accuracy - Compromised: 0.0492, Honest: 0.8410
Overall test accuracy: mean=0.6826 ± 0.3167

=== BACKDOOR ATTACK SUCCESS RATE (ASR) ===
Target label: 0
Trigger size: 4x4
Overall ASR: 0.2443 ± 0.3779
Honest nodes ASR: 0.0554 ± 0.0047
Compromised nodes ASR: 1.0000 ± 0.0000
Note: Higher ASR indicates more successful backdoor attack

=== Sketchguard SUMMARY ===
Node 0: acceptance=0.833
Node 1: acceptance=0.800
Node 2: acceptance=1.000
Node 3: acceptance=0.857
Node 4: acceptance=0.778
Node 5: acceptance=0.080
Node 6: acceptance=0.750
Node 7: acceptance=0.727
Node 8: acceptance=0.571
Node 9: acceptance=1.000
Node 10: acceptance=0.750
Node 11: acceptance=0.750
Node 12: acceptance=0.192
Node 13: acceptance=0.200
Node 14: acceptance=0.714
Node 15: acceptance=0.778
Node 16: acceptance=0.714
Node 17: acceptance=0.188
Node 18: acceptance=0.833
Node 19: acceptance=0.600

=== PARALLEL EXECUTION TIME (realistic for distributed system) ===
  COMMUNICATION (max across nodes):
    - Sketch transfer: 0.000s (0.0%)
    - Model fetch (accepted): 0.000s (0.0%)
  COMPUTATION (max across nodes):
    - Sketching: 3.980s (99.4%)
    - Filtering: 0.001s (0.0%)
    - Aggregation: 0.023s (0.6%)
  TOTALS:
    - Total computation: 4.005s (100.0%)
    - Total communication: 0.000s (0.0%)
    - Total parallel time: 4.005s

=== PER-NODE AVERAGE TIME ===
  - Sketching: 2.736s
  - Filtering: 0.001s
  - Aggregation: 0.013s
  - Sketch transfer: 0.000s
  - Model fetch: 0.000s
  - Total per node: 2.750s

=== TOTAL COMPUTATIONAL WORK (sum across all nodes) ===
  - Total sketching: 54.726s
  - Total filtering: 0.017s
  - Total aggregation: 0.263s
  - Total sketch transfer: 0.000s
  - Total model fetch: 0.000s
  - Grand total: 55.006s
  - Mean acceptance rate: 0.656

Sketchguard Algorithm Properties:
  - Original dimension: 6,603,710
  - Sketch size: 1000
  - Compression ratio: 19.9x
  - Single repetition: No repetitions needed
  - Theoretical complexity: O(d + N×k)
  - Approach: Sketch filtering + state aggregation
