Device: cuda
Seed: 987654321
Loading 1 LEAF Sent140 train files...
LEAF Sent140 train: 254555 users, 908652 samples
Building vocabulary (max_size=10000)...
Vocabulary size: 10000
Loading 1 LEAF Sent140 test files...
LEAF Sent140 test: 254555 users, 286281 samples
Found 254555 train users, 254555 test users, 254555 common users
User sample counts range: 494 (max) to 1 (min)
Distributed ALL 254555 users across 20 clients
Users per client: 12727 (with 15 clients getting +1 user)
Train partition sizes: [44353, 44290, 44657, 44907, 44696, 45843, 45801, 45619, 45069, 45639, 45821, 45311, 45779, 46056, 45625, 45984, 46428, 44737, 45540, 46497]
Test partition sizes: [14232, 14235, 14266, 14217, 14238, 14373, 14346, 14334, 14294, 14373, 14344, 14302, 14354, 14362, 14320, 14395, 14389, 14257, 14251, 14399]
  Client 0: 44353 train samples, 2 unique classes
  Client 1: 44290 train samples, 2 unique classes
  Client 2: 44657 train samples, 2 unique classes
  Client 3: 44907 train samples, 2 unique classes
  Client 4: 44696 train samples, 2 unique classes
  Client 5: 45843 train samples, 2 unique classes
  Client 6: 45801 train samples, 2 unique classes
  Client 7: 45619 train samples, 2 unique classes
  Client 8: 45069 train samples, 2 unique classes
  Client 9: 45639 train samples, 2 unique classes
  Client 10: 45821 train samples, 2 unique classes
  Client 11: 45311 train samples, 2 unique classes
  Client 12: 45779 train samples, 2 unique classes
  Client 13: 46056 train samples, 2 unique classes
  Client 14: 45625 train samples, 2 unique classes
  Client 15: 45984 train samples, 2 unique classes
  Client 16: 46428 train samples, 2 unique classes
  Client 17: 44737 train samples, 2 unique classes
  Client 18: 45540 train samples, 2 unique classes
  Client 19: 46497 train samples, 2 unique classes
Will sample 4500 samples per client per epoch
Graph: fully, nodes: 20, edges: 190
Degree statistics: avg=19.00, min=19, max=19
Attack: Compromised 6/20 nodes: [5, 12, 13, 14, 17, 18]
Attack type: directed_deviation, lambda: 1.0
Model variant: baseline
Model parameters: 1,174,986
Initial test acc across nodes: mean=0.4953 ± 0.0174
Round 001: test acc mean=0.4980 ± 0.0059 | min=0.4875 max=0.5089
         : test loss mean=22.8048 ± 6.0464
         : individual accs = ['0.508853', '0.494415', '0.493271', '0.494549', '0.505478', '0.500244', '0.495818', '0.504744', '0.498181', '0.491060', '0.500279', '0.502867', '0.487530', '0.496031', '0.491830', '0.502397', '0.505039', '0.497089', '0.502140', '0.487534']
         : correct/total = [(7242, 14232), (7038, 14235), (7037, 14266), (7031, 14217), (7197, 14238), (7190, 14373), (7113, 14346), (7235, 14334), (7121, 14294), (7058, 14373), (7176, 14344), (7192, 14302), (6998, 14354), (7124, 14362), (7043, 14320), (7232, 14395), (7267, 14389), (7087, 14257), (7156, 14251), (7020, 14399)]
         : compromised: 0.4958, honest: 0.4989
Round 002: test acc mean=0.5039 ± 0.0044 | min=0.4966 max=0.5133
         : test loss mean=12.2239 ± 0.2141
         : individual accs = ['0.506183', '0.508254', '0.506940', '0.508968', '0.501264', '0.501009', '0.502091', '0.504116', '0.498601', '0.500452', '0.508784', '0.499231', '0.500906', '0.501462', '0.508520', '0.507121', '0.505664', '0.497650', '0.513297', '0.496632']
         : correct/total = [(7204, 14232), (7235, 14235), (7232, 14266), (7236, 14217), (7137, 14238), (7201, 14373), (7203, 14346), (7226, 14334), (7127, 14294), (7193, 14373), (7298, 14344), (7140, 14302), (7190, 14354), (7202, 14362), (7282, 14320), (7300, 14395), (7276, 14389), (7095, 14257), (7315, 14251), (7151, 14399)]
         : compromised: 0.5038, honest: 0.5039
Round 003: test acc mean=0.5018 ± 0.0055 | min=0.4900 max=0.5132
         : test loss mean=1.2611 ± 0.0124
         : individual accs = ['0.506464', '0.513172', '0.510304', '0.510727', '0.502037', '0.500731', '0.496027', '0.505163', '0.499580', '0.499130', '0.499024', '0.503985', '0.493451', '0.489974', '0.501676', '0.498854', '0.503023', '0.500596', '0.504175', '0.498368']
         : correct/total = [(7208, 14232), (7305, 14235), (7280, 14266), (7261, 14217), (7148, 14238), (7197, 14373), (7116, 14346), (7241, 14334), (7141, 14294), (7174, 14373), (7158, 14344), (7208, 14302), (7083, 14354), (7037, 14362), (7184, 14320), (7181, 14395), (7238, 14389), (7137, 14257), (7185, 14251), (7176, 14399)]
         : compromised: 0.4984, honest: 0.5033
Round 004: test acc mean=0.5030 ± 0.0056 | min=0.4925 max=0.5151
         : test loss mean=1.0352 ± 0.0098
         : individual accs = ['0.502811', '0.513664', '0.508482', '0.515088', '0.507304', '0.504627', '0.497769', '0.504325', '0.498741', '0.499478', '0.502301', '0.503076', '0.493939', '0.492480', '0.506494', '0.498576', '0.501564', '0.504945', '0.505859', '0.497673']
         : correct/total = [(7156, 14232), (7312, 14235), (7254, 14266), (7323, 14217), (7223, 14238), (7253, 14373), (7141, 14346), (7229, 14334), (7129, 14294), (7179, 14373), (7205, 14344), (7195, 14302), (7090, 14354), (7073, 14362), (7253, 14320), (7177, 14395), (7217, 14389), (7199, 14257), (7209, 14251), (7166, 14399)]
         : compromised: 0.5014, honest: 0.5036
Round 005: test acc mean=0.5043 ± 0.0055 | min=0.4916 max=0.5153
         : test loss mean=0.9102 ± 0.0074
         : individual accs = ['0.505691', '0.515279', '0.514089', '0.514595', '0.504706', '0.502539', '0.499721', '0.506349', '0.501819', '0.503583', '0.501534', '0.504545', '0.497144', '0.491575', '0.506494', '0.501216', '0.506568', '0.503542', '0.503333', '0.501076']
         : correct/total = [(7197, 14232), (7335, 14235), (7334, 14266), (7316, 14217), (7186, 14238), (7223, 14373), (7169, 14346), (7258, 14334), (7173, 14294), (7238, 14373), (7194, 14344), (7216, 14302), (7136, 14354), (7060, 14362), (7253, 14320), (7215, 14395), (7289, 14389), (7179, 14257), (7173, 14251), (7215, 14399)]
         : compromised: 0.5008, honest: 0.5058
Round 006: test acc mean=0.5110 ± 0.0037 | min=0.5057 max=0.5183
         : test loss mean=0.7189 ± 0.0025
         : individual accs = ['0.506464', '0.505655', '0.509814', '0.511711', '0.514749', '0.517846', '0.510177', '0.506139', '0.510914', '0.512071', '0.515337', '0.512865', '0.518322', '0.506336', '0.507821', '0.511844', '0.513656', '0.511959', '0.509017', '0.507952']
         : correct/total = [(7208, 14232), (7198, 14235), (7273, 14266), (7275, 14217), (7329, 14238), (7443, 14373), (7319, 14346), (7255, 14334), (7303, 14294), (7360, 14373), (7392, 14344), (7335, 14302), (7440, 14354), (7272, 14362), (7272, 14320), (7368, 14395), (7391, 14389), (7299, 14257), (7254, 14251), (7314, 14399)]
         : compromised: 0.5119, honest: 0.5107
Round 007: test acc mean=0.5018 ± 0.0049 | min=0.4900 max=0.5093
         : test loss mean=0.7504 ± 0.0031
         : individual accs = ['0.502108', '0.491324', '0.497617', '0.489977', '0.500913', '0.504905', '0.507946', '0.499581', '0.506017', '0.497669', '0.498327', '0.503076', '0.505364', '0.509261', '0.500628', '0.505940', '0.503579', '0.502700', '0.506350', '0.501840']
         : correct/total = [(7146, 14232), (6994, 14235), (7099, 14266), (6966, 14217), (7132, 14238), (7257, 14373), (7287, 14346), (7161, 14334), (7233, 14294), (7153, 14373), (7148, 14344), (7195, 14302), (7254, 14354), (7314, 14362), (7169, 14320), (7283, 14395), (7246, 14389), (7167, 14257), (7216, 14251), (7226, 14399)]
         : compromised: 0.5049, honest: 0.5004
Round 008: test acc mean=0.5054 ± 0.0045 | min=0.4947 max=0.5119
         : test loss mean=0.7127 ± 0.0017
         : individual accs = ['0.499368', '0.502213', '0.498318', '0.494689', '0.511940', '0.502261', '0.508853', '0.508023', '0.504967', '0.509427', '0.508854', '0.499371', '0.505852', '0.508912', '0.504190', '0.507051', '0.506915', '0.509364', '0.506561', '0.510869']
         : correct/total = [(7107, 14232), (7149, 14235), (7109, 14266), (7033, 14217), (7289, 14238), (7219, 14373), (7300, 14346), (7282, 14334), (7218, 14294), (7322, 14373), (7299, 14344), (7142, 14302), (7261, 14354), (7309, 14362), (7220, 14320), (7299, 14395), (7294, 14389), (7262, 14257), (7219, 14251), (7356, 14399)]
         : compromised: 0.5062, honest: 0.5051
Round 009: test acc mean=0.5172 ± 0.0041 | min=0.5092 max=0.5240
         : test loss mean=0.7001 ± 0.0015
         : individual accs = ['0.514896', '0.513523', '0.520608', '0.511500', '0.516856', '0.516385', '0.519030', '0.518697', '0.517700', '0.522925', '0.509202', '0.515382', '0.521806', '0.512115', '0.512709', '0.521084', '0.524011', '0.517851', '0.514701', '0.523022']
         : correct/total = [(7328, 14232), (7310, 14235), (7427, 14266), (7272, 14217), (7359, 14238), (7422, 14373), (7446, 14346), (7435, 14334), (7400, 14294), (7516, 14373), (7304, 14344), (7371, 14302), (7490, 14354), (7355, 14362), (7342, 14320), (7501, 14395), (7540, 14389), (7383, 14257), (7335, 14251), (7531, 14399)]
         : compromised: 0.5159, honest: 0.5177
Round 010: test acc mean=0.5173 ± 0.0039 | min=0.5122 max=0.5267
         : test loss mean=0.7087 ± 0.0016
         : individual accs = ['0.512366', '0.517527', '0.515071', '0.526693', '0.520930', '0.512210', '0.513593', '0.523859', '0.515111', '0.520629', '0.515616', '0.515103', '0.512679', '0.512603', '0.517109', '0.519278', '0.520120', '0.517570', '0.517578', '0.520244']
         : correct/total = [(7292, 14232), (7367, 14235), (7348, 14266), (7488, 14217), (7417, 14238), (7362, 14373), (7368, 14346), (7509, 14334), (7363, 14294), (7483, 14373), (7396, 14344), (7367, 14302), (7359, 14354), (7362, 14362), (7405, 14320), (7475, 14395), (7484, 14389), (7379, 14257), (7376, 14251), (7491, 14399)]
         : compromised: 0.5150, honest: 0.5183

=== FINAL RESULTS ===
Dataset: sent140, Nodes: 20, Graph: fully, Aggregation: krum
Attack: directed_deviation, 30.0% compromised
Final accuracy - Compromised: 0.5150, Honest: 0.5183
Overall test accuracy: mean=0.5173 ± 0.0039
