Device: cuda
Seed: 987654321
Loading 1 LEAF Sent140 train files...
LEAF Sent140 train: 254555 users, 908652 samples
Building vocabulary (max_size=10000)...
Vocabulary size: 10000
Loading 1 LEAF Sent140 test files...
LEAF Sent140 test: 254555 users, 286281 samples
Found 254555 train users, 254555 test users, 254555 common users
User sample counts range: 494 (max) to 1 (min)
Distributed ALL 254555 users across 20 clients
Users per client: 12727 (with 15 clients getting +1 user)
Train partition sizes: [44353, 44290, 44657, 44907, 44696, 45843, 45801, 45619, 45069, 45639, 45821, 45311, 45779, 46056, 45625, 45984, 46428, 44737, 45540, 46497]
Test partition sizes: [14232, 14235, 14266, 14217, 14238, 14373, 14346, 14334, 14294, 14373, 14344, 14302, 14354, 14362, 14320, 14395, 14389, 14257, 14251, 14399]
  Client 0: 44353 train samples, 2 unique classes
  Client 1: 44290 train samples, 2 unique classes
  Client 2: 44657 train samples, 2 unique classes
  Client 3: 44907 train samples, 2 unique classes
  Client 4: 44696 train samples, 2 unique classes
  Client 5: 45843 train samples, 2 unique classes
  Client 6: 45801 train samples, 2 unique classes
  Client 7: 45619 train samples, 2 unique classes
  Client 8: 45069 train samples, 2 unique classes
  Client 9: 45639 train samples, 2 unique classes
  Client 10: 45821 train samples, 2 unique classes
  Client 11: 45311 train samples, 2 unique classes
  Client 12: 45779 train samples, 2 unique classes
  Client 13: 46056 train samples, 2 unique classes
  Client 14: 45625 train samples, 2 unique classes
  Client 15: 45984 train samples, 2 unique classes
  Client 16: 46428 train samples, 2 unique classes
  Client 17: 44737 train samples, 2 unique classes
  Client 18: 45540 train samples, 2 unique classes
  Client 19: 46497 train samples, 2 unique classes
Will sample 4500 samples per client per epoch
Graph: erdos, nodes: 20, edges: 99
Degree statistics: avg=9.90, min=7, max=14
Model variant: baseline
Model parameters: 1,174,986
UBAR ALGORITHM (Two-Stage Byzantine-resilient)
  - Model dimension: 1,174,986 parameters
  - Rho parameter: 1.0
  - Stage 1: Distance-based filtering (select 100% closest neighbors)
  - Stage 2: Performance-based selection (loss comparison)
  - Complexity: O(deg(i)×d + deg(i)×inference)
Initial test acc across nodes: mean=0.4953 ± 0.0174
Round 001: test acc mean=0.5553 ± 0.0355 | min=0.4962 max=0.6291
         : test loss mean=0.6895 ± 0.0018
         : individual accs = ['0.552487', '0.591078', '0.551311', '0.496237', '0.565599', '0.565922', '0.629095', '0.615390', '0.575906', '0.506297', '0.534509', '0.523703', '0.615647', '0.537669', '0.542737', '0.526572', '0.516089', '0.553623', '0.566908', '0.540038']
         : correct/total = [(7863, 14232), (8414, 14235), (7865, 14266), (7055, 14217), (8053, 14238), (8134, 14373), (9025, 14346), (8821, 14334), (8232, 14294), (7277, 14373), (7667, 14344), (7490, 14302), (8837, 14354), (7722, 14362), (7772, 14320), (7580, 14395), (7426, 14389), (7893, 14257), (8079, 14251), (7776, 14399)]
         : ubar stats = ['Node 0: s1=1.000, s2=0.833', 'Node 1: s1=1.000, s2=0.100', 'Node 2: s1=1.000, s2=0.125']...
Round 002: test acc mean=0.5616 ± 0.0487 | min=0.5029 max=0.6440
         : test loss mean=0.6867 ± 0.0125
         : individual accs = ['0.600759', '0.544152', '0.548928', '0.515088', '0.587583', '0.515828', '0.521191', '0.620134', '0.616063', '0.643985', '0.524749', '0.595092', '0.502856', '0.593720', '0.512570', '0.616811', '0.509973', '0.515817', '0.508666', '0.637058']
         : correct/total = [(8550, 14232), (7746, 14235), (7831, 14266), (7323, 14217), (8366, 14238), (7414, 14373), (7477, 14346), (8889, 14334), (8806, 14294), (9256, 14373), (7527, 14344), (8511, 14302), (7218, 14354), (8527, 14362), (7340, 14320), (8879, 14395), (7338, 14389), (7354, 14257), (7249, 14251), (9173, 14399)]
         : ubar stats = ['Node 0: s1=1.000, s2=0.625', 'Node 1: s1=1.000, s2=0.200', 'Node 2: s1=1.000, s2=0.375']...
Round 003: test acc mean=0.5454 ± 0.0496 | min=0.4926 max=0.6343
         : test loss mean=0.6845 ± 0.0120
         : individual accs = ['0.492622', '0.496733', '0.500421', '0.634311', '0.558224', '0.580255', '0.501115', '0.518627', '0.619001', '0.627287', '0.589933', '0.585582', '0.507803', '0.506893', '0.521997', '0.611462', '0.492668', '0.558182', '0.507333', '0.498090']
         : correct/total = [(7011, 14232), (7071, 14235), (7139, 14266), (9018, 14217), (7948, 14238), (8340, 14373), (7189, 14346), (7434, 14334), (8848, 14294), (9016, 14373), (8462, 14344), (8375, 14302), (7289, 14354), (7280, 14362), (7475, 14320), (8802, 14395), (7089, 14389), (7958, 14257), (7230, 14251), (7172, 14399)]
         : ubar stats = ['Node 0: s1=1.000, s2=0.750', 'Node 1: s1=1.000, s2=0.167', 'Node 2: s1=1.000, s2=0.417']...
Round 004: test acc mean=0.5766 ± 0.0445 | min=0.4973 max=0.6349
         : test loss mean=0.6792 ± 0.0128
         : individual accs = ['0.497330', '0.609273', '0.559092', '0.634874', '0.554923', '0.609059', '0.608114', '0.521627', '0.615923', '0.566201', '0.500000', '0.626696', '0.582346', '0.529522', '0.519623', '0.633623', '0.544861', '0.625728', '0.589011', '0.603861']
         : correct/total = [(7078, 14232), (8673, 14235), (7976, 14266), (9026, 14217), (7901, 14238), (8754, 14373), (8724, 14346), (7477, 14334), (8804, 14294), (8138, 14373), (7172, 14344), (8963, 14302), (8359, 14354), (7605, 14362), (7441, 14320), (9121, 14395), (7840, 14389), (8921, 14257), (8394, 14251), (8695, 14399)]
         : ubar stats = ['Node 0: s1=1.000, s2=0.729', 'Node 1: s1=1.000, s2=0.200', 'Node 2: s1=1.000, s2=0.344']...
Round 005: test acc mean=0.6172 ± 0.0210 | min=0.5588 max=0.6466
         : test loss mean=0.6731 ± 0.0140
         : individual accs = ['0.618395', '0.636459', '0.612786', '0.635014', '0.624947', '0.633549', '0.632162', '0.610227', '0.646565', '0.589578', '0.620050', '0.635156', '0.629302', '0.558836', '0.627165', '0.601389', '0.615957', '0.610647', '0.578486', '0.627196']
         : correct/total = [(8801, 14232), (9060, 14235), (8742, 14266), (9028, 14217), (8898, 14238), (9106, 14373), (9069, 14346), (8747, 14334), (9242, 14294), (8474, 14373), (8894, 14344), (9084, 14302), (9033, 14354), (8026, 14362), (8981, 14320), (8657, 14395), (8863, 14389), (8706, 14257), (8244, 14251), (9031, 14399)]
         : ubar stats = ['Node 0: s1=1.000, s2=0.667', 'Node 1: s1=1.000, s2=0.180', 'Node 2: s1=1.000, s2=0.425']...
Round 006: test acc mean=0.6258 ± 0.0152 | min=0.5912 max=0.6432
         : test loss mean=0.6631 ± 0.0120
         : individual accs = ['0.632167', '0.639621', '0.628908', '0.642541', '0.634359', '0.622556', '0.643246', '0.606809', '0.642787', '0.632297', '0.618516', '0.631730', '0.610144', '0.608690', '0.627235', '0.618062', '0.642296', '0.591218', '0.601221', '0.641295']
         : correct/total = [(8997, 14232), (9105, 14235), (8972, 14266), (9135, 14217), (9032, 14238), (8948, 14373), (9228, 14346), (8698, 14334), (9188, 14294), (9088, 14373), (8872, 14344), (9035, 14302), (8758, 14354), (8742, 14362), (8982, 14320), (8897, 14395), (9242, 14389), (8429, 14257), (8568, 14251), (9234, 14399)]
         : ubar stats = ['Node 0: s1=1.000, s2=0.639', 'Node 1: s1=1.000, s2=0.167', 'Node 2: s1=1.000, s2=0.417']...
Round 007: test acc mean=0.6322 ± 0.0126 | min=0.6014 max=0.6455
         : test loss mean=0.6489 ± 0.0090
         : individual accs = ['0.636523', '0.645522', '0.626875', '0.644580', '0.635412', '0.636819', '0.630908', '0.640296', '0.639009', '0.638628', '0.610639', '0.638442', '0.637732', '0.601448', '0.640642', '0.640153', '0.634860', '0.634916', '0.601361', '0.628516']
         : correct/total = [(9059, 14232), (9189, 14235), (8943, 14266), (9164, 14217), (9047, 14238), (9153, 14373), (9051, 14346), (9178, 14334), (9134, 14294), (9179, 14373), (8759, 14344), (9131, 14302), (9154, 14354), (8638, 14362), (9174, 14320), (9215, 14395), (9135, 14389), (9052, 14257), (8570, 14251), (9050, 14399)]
         : ubar stats = ['Node 0: s1=1.000, s2=0.619', 'Node 1: s1=1.000, s2=0.157', 'Node 2: s1=1.000, s2=0.482']...
Round 008: test acc mean=0.6397 ± 0.0076 | min=0.6222 max=0.6512
         : test loss mean=0.6390 ± 0.0046
         : individual accs = ['0.637648', '0.641307', '0.624912', '0.641204', '0.646580', '0.643777', '0.643176', '0.641970', '0.647335', '0.645864', '0.641383', '0.640610', '0.629650', '0.645175', '0.622207', '0.646961', '0.638404', '0.629515', '0.635324', '0.651226']
         : correct/total = [(9075, 14232), (9129, 14235), (8915, 14266), (9116, 14217), (9206, 14238), (9253, 14373), (9227, 14346), (9202, 14334), (9253, 14294), (9283, 14373), (9200, 14344), (9162, 14302), (9038, 14354), (9266, 14362), (8910, 14320), (9313, 14395), (9186, 14389), (8975, 14257), (9054, 14251), (9377, 14399)]
         : ubar stats = ['Node 0: s1=1.000, s2=0.552', 'Node 1: s1=1.000, s2=0.150', 'Node 2: s1=1.000, s2=0.531']...
Round 009: test acc mean=0.6464 ± 0.0055 | min=0.6343 max=0.6577
         : test loss mean=0.6333 ± 0.0043
         : individual accs = ['0.634345', '0.656621', '0.641876', '0.640360', '0.644613', '0.645725', '0.647916', '0.646993', '0.647544', '0.640854', '0.650725', '0.642218', '0.640936', '0.645593', '0.647765', '0.648281', '0.653972', '0.645437', '0.649288', '0.657685']
         : correct/total = [(9028, 14232), (9347, 14235), (9157, 14266), (9104, 14217), (9178, 14238), (9281, 14373), (9295, 14346), (9274, 14334), (9256, 14294), (9211, 14373), (9334, 14344), (9185, 14302), (9200, 14354), (9272, 14362), (9276, 14320), (9332, 14395), (9410, 14389), (9202, 14257), (9253, 14251), (9470, 14399)]
         : ubar stats = ['Node 0: s1=1.000, s2=0.602', 'Node 1: s1=1.000, s2=0.144', 'Node 2: s1=1.000, s2=0.514']...
Round 010: test acc mean=0.6514 ± 0.0070 | min=0.6354 max=0.6609
         : test loss mean=0.6277 ± 0.0059
         : individual accs = ['0.649874', '0.642782', '0.635427', '0.653302', '0.652971', '0.654282', '0.656838', '0.660946', '0.660627', '0.639393', '0.651631', '0.652706', '0.659955', '0.656872', '0.656425', '0.647100', '0.654458', '0.653153', '0.641990', '0.646503']
         : correct/total = [(9249, 14232), (9150, 14235), (9065, 14266), (9288, 14217), (9297, 14238), (9404, 14373), (9423, 14346), (9474, 14334), (9443, 14294), (9190, 14373), (9347, 14344), (9335, 14302), (9473, 14354), (9434, 14362), (9400, 14320), (9315, 14395), (9417, 14389), (9312, 14257), (9149, 14251), (9309, 14399)]
         : ubar stats = ['Node 0: s1=1.000, s2=0.567', 'Node 1: s1=1.000, s2=0.140', 'Node 2: s1=1.000, s2=0.562']...

=== FINAL RESULTS ===
Dataset: sent140, Nodes: 20, Graph: erdos, Aggregation: ubar
Overall test accuracy: mean=0.6514 ± 0.0070

=== UBAR SUMMARY ===
Node 0: stage1=1.000, stage2=0.567, overall=0.567
Node 1: stage1=1.000, stage2=0.140, overall=0.140
Node 2: stage1=1.000, stage2=0.562, overall=0.562
Node 3: stage1=1.000, stage2=0.171, overall=0.171
Node 4: stage1=1.000, stage2=0.456, overall=0.456
Node 5: stage1=1.000, stage2=0.540, overall=0.540
Node 6: stage1=1.000, stage2=0.325, overall=0.325
Node 7: stage1=1.000, stage2=0.464, overall=0.464
Node 8: stage1=1.000, stage2=0.200, overall=0.200
Node 9: stage1=1.000, stage2=0.409, overall=0.409
Node 10: stage1=1.000, stage2=0.475, overall=0.475
Node 11: stage1=1.000, stage2=0.283, overall=0.283
Node 12: stage1=1.000, stage2=0.283, overall=0.283
Node 13: stage1=1.000, stage2=0.756, overall=0.756
Node 14: stage1=1.000, stage2=0.614, overall=0.614
Node 15: stage1=1.000, stage2=0.411, overall=0.411
Node 16: stage1=1.000, stage2=0.500, overall=0.500
Node 17: stage1=1.000, stage2=0.625, overall=0.625
Node 18: stage1=1.000, stage2=0.417, overall=0.417
Node 19: stage1=1.000, stage2=0.620, overall=0.620

=== PARALLEL EXECUTION TIME (realistic for distributed system) ===
  COMMUNICATION (max across nodes):
    - Full model transfer: 0.000s (0.0%)
  COMPUTATION (max across nodes):
    - Distance computation: 0.059s (50.2%)
    - Loss computation: 0.044s (37.6%)
    - Aggregation: 0.014s (12.1%)
  TOTALS:
    - Total computation: 0.117s (100.0%)
    - Total communication: 0.000s (0.0%)
    - Total parallel time: 0.117s

=== PER-NODE AVERAGE TIME ===
  - Distance computation: 0.038s
  - Loss computation: 0.033s
  - Aggregation: 0.008s
  - Model transfer: 0.000s
  - Total per node: 0.079s

=== TOTAL COMPUTATIONAL WORK (sum across all nodes) ===
  - Total distance computation: 0.757s
  - Total loss computation: 0.666s
  - Total aggregation: 0.159s
  - Total model transfer: 0.000s
  - Grand total: 1.583s
  - Mean Stage 1 acceptance rate: 1.000
  - Mean Stage 2 acceptance rate: 0.441
  - Overall acceptance rate: 0.441

UBAR Algorithm Properties:
  - Model dimension: 1,174,986
  - Rho parameter: 1.0
  - Two-stage approach: Distance filtering + loss evaluation
  - Stage 1 selects: 100% of neighbors
  - Stage 2 uses: Training sample loss comparison
  - Theoretical complexity: O(deg(i)×d + deg(i)×inference)
  - Approach: UBAR paper implementation
