Device: cuda
Seed: 987654321
Loading 1 LEAF Sent140 train files...
LEAF Sent140 train: 254555 users, 908652 samples
Building vocabulary (max_size=10000)...
Vocabulary size: 10000
Loading 1 LEAF Sent140 test files...
LEAF Sent140 test: 254555 users, 286281 samples
Found 254555 train users, 254555 test users, 254555 common users
User sample counts range: 494 (max) to 1 (min)
Distributed ALL 254555 users across 20 clients
Users per client: 12727 (with 15 clients getting +1 user)
Train partition sizes: [44353, 44290, 44657, 44907, 44696, 45843, 45801, 45619, 45069, 45639, 45821, 45311, 45779, 46056, 45625, 45984, 46428, 44737, 45540, 46497]
Test partition sizes: [14232, 14235, 14266, 14217, 14238, 14373, 14346, 14334, 14294, 14373, 14344, 14302, 14354, 14362, 14320, 14395, 14389, 14257, 14251, 14399]
  Client 0: 44353 train samples, 2 unique classes
  Client 1: 44290 train samples, 2 unique classes
  Client 2: 44657 train samples, 2 unique classes
  Client 3: 44907 train samples, 2 unique classes
  Client 4: 44696 train samples, 2 unique classes
  Client 5: 45843 train samples, 2 unique classes
  Client 6: 45801 train samples, 2 unique classes
  Client 7: 45619 train samples, 2 unique classes
  Client 8: 45069 train samples, 2 unique classes
  Client 9: 45639 train samples, 2 unique classes
  Client 10: 45821 train samples, 2 unique classes
  Client 11: 45311 train samples, 2 unique classes
  Client 12: 45779 train samples, 2 unique classes
  Client 13: 46056 train samples, 2 unique classes
  Client 14: 45625 train samples, 2 unique classes
  Client 15: 45984 train samples, 2 unique classes
  Client 16: 46428 train samples, 2 unique classes
  Client 17: 44737 train samples, 2 unique classes
  Client 18: 45540 train samples, 2 unique classes
  Client 19: 46497 train samples, 2 unique classes
Will sample 4500 samples per client per epoch
Graph: erdos, nodes: 20, edges: 99
Degree statistics: avg=9.90, min=7, max=14
Attack: Compromised 12/20 nodes: [1, 2, 3, 5, 8, 11, 12, 13, 14, 15, 17, 18]
Attack type: backdoor, lambda: 1.0
Backdoor target label: 1, trigger size: 3
Model variant: baseline
Model parameters: 1,174,986
Initial test acc across nodes: mean=0.4953 ± 0.0174
Backdoor attack: Created poisoned datasets for 12 compromised nodes
Round 001: test acc mean=0.5019 ± 0.0056 | min=0.4931 max=0.5130
         : test loss mean=7.5201 ± 2.3803
         : individual accs = ['0.512999', '0.505444', '0.511636', '0.497292', '0.504987', '0.502609', '0.493099', '0.502302', '0.500140', '0.502331', '0.505020', '0.497483', '0.506479', '0.495892', '0.505447', '0.498506', '0.494058', '0.498913', '0.494842', '0.509202']
         : correct/total = [(7301, 14232), (7195, 14235), (7299, 14266), (7070, 14217), (7190, 14238), (7224, 14373), (7074, 14346), (7200, 14334), (7149, 14294), (7220, 14373), (7244, 14344), (7115, 14302), (7270, 14354), (7122, 14362), (7238, 14320), (7176, 14395), (7109, 14389), (7113, 14257), (7052, 14251), (7332, 14399)]
         : compromised: 0.5012, honest: 0.5030
Round 002: test acc mean=0.4981 ± 0.0083 | min=0.4852 max=0.5187
         : test loss mean=9.8373 ± 3.5112
         : individual accs = ['0.518690', '0.496382', '0.496776', '0.497995', '0.504565', '0.492382', '0.505367', '0.493024', '0.492165', '0.486746', '0.499721', '0.498741', '0.485161', '0.514274', '0.491830', '0.502744', '0.488359', '0.493582', '0.502070', '0.501910']
         : correct/total = [(7382, 14232), (7066, 14235), (7087, 14266), (7080, 14217), (7184, 14238), (7077, 14373), (7250, 14346), (7067, 14334), (7035, 14294), (6996, 14373), (7168, 14344), (7133, 14302), (6964, 14354), (7386, 14362), (7043, 14320), (7237, 14395), (7027, 14389), (7037, 14257), (7155, 14251), (7227, 14399)]
         : compromised: 0.4970, honest: 0.4998
Round 003: test acc mean=0.4960 ± 0.0053 | min=0.4839 max=0.5051
         : test loss mean=7.4880 ± 2.4275
         : individual accs = ['0.495854', '0.490903', '0.486752', '0.483928', '0.496137', '0.496208', '0.502440', '0.492675', '0.497761', '0.493356', '0.500837', '0.492658', '0.505086', '0.502785', '0.492179', '0.497534', '0.496699', '0.497791', '0.495825', '0.503577']
         : correct/total = [(7057, 14232), (6988, 14235), (6944, 14266), (6880, 14217), (7064, 14238), (7132, 14373), (7208, 14346), (7062, 14334), (7115, 14294), (7091, 14373), (7184, 14344), (7046, 14302), (7250, 14354), (7221, 14362), (7048, 14320), (7162, 14395), (7147, 14389), (7097, 14257), (7066, 14251), (7251, 14399)]
         : compromised: 0.4950, honest: 0.4977
Round 004: test acc mean=0.5001 ± 0.0063 | min=0.4913 max=0.5180
         : test loss mean=6.7269 ± 1.6060
         : individual accs = ['0.504918', '0.501440', '0.498177', '0.517971', '0.491291', '0.493773', '0.505995', '0.497209', '0.495732', '0.493216', '0.496514', '0.506782', '0.497213', '0.498190', '0.505307', '0.493991', '0.493085', '0.503332', '0.505298', '0.502743']
         : correct/total = [(7186, 14232), (7138, 14235), (7107, 14266), (7364, 14217), (6995, 14238), (7097, 14373), (7259, 14346), (7127, 14334), (7086, 14294), (7089, 14373), (7122, 14344), (7248, 14302), (7137, 14354), (7155, 14362), (7236, 14320), (7111, 14395), (7095, 14389), (7176, 14257), (7201, 14251), (7239, 14399)]
         : compromised: 0.5014, honest: 0.4981
Round 005: test acc mean=0.5053 ± 0.0062 | min=0.4975 max=0.5155
         : test loss mean=8.5255 ± 1.7624
         : individual accs = ['0.509767', '0.513031', '0.497547', '0.515510', '0.502669', '0.498365', '0.507807', '0.514511', '0.499230', '0.499409', '0.499861', '0.509160', '0.499094', '0.500975', '0.500908', '0.515318', '0.498714', '0.504735', '0.509929', '0.510383']
         : correct/total = [(7255, 14232), (7303, 14235), (7098, 14266), (7329, 14217), (7157, 14238), (7163, 14373), (7285, 14346), (7375, 14334), (7136, 14294), (7178, 14373), (7170, 14344), (7282, 14302), (7164, 14354), (7195, 14362), (7173, 14320), (7418, 14395), (7176, 14389), (7196, 14257), (7267, 14251), (7349, 14399)]
         : compromised: 0.5053, honest: 0.5054
Round 006: test acc mean=0.5037 ± 0.0061 | min=0.4924 max=0.5167
         : test loss mean=21.5795 ± 6.6304
         : individual accs = ['0.508221', '0.516684', '0.505608', '0.513892', '0.506321', '0.499269', '0.496515', '0.499721', '0.512243', '0.504488', '0.501603', '0.502447', '0.496586', '0.492411', '0.509497', '0.503161', '0.502120', '0.504805', '0.499333', '0.498229']
         : correct/total = [(7233, 14232), (7355, 14235), (7213, 14266), (7306, 14217), (7209, 14238), (7176, 14373), (7123, 14346), (7163, 14334), (7322, 14294), (7251, 14373), (7195, 14344), (7186, 14302), (7128, 14354), (7072, 14362), (7296, 14320), (7243, 14395), (7225, 14389), (7197, 14257), (7116, 14251), (7174, 14399)]
         : compromised: 0.5047, honest: 0.5022
Round 007: test acc mean=0.5036 ± 0.0058 | min=0.4928 max=0.5149
         : test loss mean=26.4388 ± 7.7360
         : individual accs = ['0.503513', '0.514296', '0.512898', '0.514947', '0.505338', '0.504001', '0.499791', '0.506907', '0.501679', '0.505114', '0.501603', '0.505664', '0.495541', '0.492759', '0.503980', '0.496700', '0.496421', '0.505436', '0.504175', '0.501771']
         : correct/total = [(7166, 14232), (7321, 14235), (7317, 14266), (7321, 14217), (7195, 14238), (7244, 14373), (7170, 14346), (7266, 14334), (7171, 14294), (7260, 14373), (7195, 14344), (7232, 14302), (7113, 14354), (7077, 14362), (7217, 14320), (7150, 14395), (7143, 14389), (7206, 14257), (7185, 14251), (7225, 14399)]
         : compromised: 0.5043, honest: 0.5026
Round 008: test acc mean=0.5050 ± 0.0057 | min=0.4908 max=0.5172
         : test loss mean=17.7900 ± 15.0370
         : individual accs = ['0.506816', '0.517246', '0.511987', '0.515228', '0.503793', '0.502818', '0.500488', '0.506767', '0.502379', '0.504696', '0.501603', '0.506922', '0.497004', '0.490809', '0.507682', '0.502675', '0.506290', '0.504594', '0.505719', '0.505174']
         : correct/total = [(7213, 14232), (7363, 14235), (7304, 14266), (7325, 14217), (7173, 14238), (7227, 14373), (7180, 14346), (7264, 14334), (7181, 14294), (7254, 14373), (7195, 14344), (7250, 14302), (7134, 14354), (7049, 14362), (7270, 14320), (7236, 14395), (7285, 14389), (7194, 14257), (7207, 14251), (7274, 14399)]
         : compromised: 0.5054, honest: 0.5045
Round 009: test acc mean=0.5049 ± 0.0052 | min=0.4935 max=0.5144
         : test loss mean=3.4510 ± 2.5843
         : individual accs = ['0.506675', '0.513172', '0.512267', '0.514384', '0.505338', '0.503374', '0.500279', '0.507186', '0.501889', '0.504209', '0.503277', '0.505803', '0.495332', '0.493455', '0.506774', '0.501563', '0.507401', '0.509504', '0.503473', '0.501979']
         : correct/total = [(7211, 14232), (7305, 14235), (7308, 14266), (7313, 14217), (7195, 14238), (7235, 14373), (7177, 14346), (7270, 14334), (7174, 14294), (7247, 14373), (7219, 14344), (7234, 14302), (7110, 14354), (7087, 14362), (7257, 14320), (7220, 14395), (7301, 14389), (7264, 14257), (7175, 14251), (7228, 14399)]
         : compromised: 0.5051, honest: 0.5045
Round 010: test acc mean=0.5030 ± 0.0065 | min=0.4891 max=0.5147
         : test loss mean=2.3556 ± 1.0078
         : individual accs = ['0.507097', '0.514155', '0.514720', '0.508757', '0.506672', '0.500313', '0.500697', '0.506349', '0.500909', '0.492034', '0.489055', '0.505664', '0.497074', '0.493664', '0.506145', '0.498715', '0.507610', '0.503051', '0.504807', '0.501563']
         : correct/total = [(7217, 14232), (7319, 14235), (7343, 14266), (7233, 14217), (7214, 14238), (7191, 14373), (7183, 14346), (7258, 14334), (7160, 14294), (7072, 14373), (7015, 14344), (7232, 14302), (7135, 14354), (7090, 14362), (7248, 14320), (7179, 14395), (7304, 14389), (7172, 14257), (7194, 14251), (7222, 14399)]
         : compromised: 0.5040, honest: 0.5014

=== FINAL RESULTS ===
Dataset: sent140, Nodes: 20, Graph: erdos, Aggregation: krum
Attack: backdoor, 60.0% compromised
Final accuracy - Compromised: 0.5040, Honest: 0.5014
Overall test accuracy: mean=0.5030 ± 0.0065

=== BACKDOOR ATTACK SUCCESS RATE (ASR) ===
Target label: 1
Trigger size: 3x3
Overall ASR: 0.1005 ± 0.1794
Honest nodes ASR: 0.1359 ± 0.2335
Compromised nodes ASR: 0.0769 ± 0.1261
Note: Higher ASR indicates more successful backdoor attack
