Device: cuda
Seed: 987654321
Loading 1 LEAF Sent140 train files...
LEAF Sent140 train: 254555 users, 908652 samples
Building vocabulary (max_size=10000)...
Vocabulary size: 10000
Loading 1 LEAF Sent140 test files...
LEAF Sent140 test: 254555 users, 286281 samples
Found 254555 train users, 254555 test users, 254555 common users
User sample counts range: 494 (max) to 1 (min)
Distributed ALL 254555 users across 20 clients
Users per client: 12727 (with 15 clients getting +1 user)
Train partition sizes: [44353, 44290, 44657, 44907, 44696, 45843, 45801, 45619, 45069, 45639, 45821, 45311, 45779, 46056, 45625, 45984, 46428, 44737, 45540, 46497]
Test partition sizes: [14232, 14235, 14266, 14217, 14238, 14373, 14346, 14334, 14294, 14373, 14344, 14302, 14354, 14362, 14320, 14395, 14389, 14257, 14251, 14399]
  Client 0: 44353 train samples, 2 unique classes
  Client 1: 44290 train samples, 2 unique classes
  Client 2: 44657 train samples, 2 unique classes
  Client 3: 44907 train samples, 2 unique classes
  Client 4: 44696 train samples, 2 unique classes
  Client 5: 45843 train samples, 2 unique classes
  Client 6: 45801 train samples, 2 unique classes
  Client 7: 45619 train samples, 2 unique classes
  Client 8: 45069 train samples, 2 unique classes
  Client 9: 45639 train samples, 2 unique classes
  Client 10: 45821 train samples, 2 unique classes
  Client 11: 45311 train samples, 2 unique classes
  Client 12: 45779 train samples, 2 unique classes
  Client 13: 46056 train samples, 2 unique classes
  Client 14: 45625 train samples, 2 unique classes
  Client 15: 45984 train samples, 2 unique classes
  Client 16: 46428 train samples, 2 unique classes
  Client 17: 44737 train samples, 2 unique classes
  Client 18: 45540 train samples, 2 unique classes
  Client 19: 46497 train samples, 2 unique classes
Will sample 4500 samples per client per epoch
Graph: fully, nodes: 20, edges: 190
Degree statistics: avg=19.00, min=19, max=19
Attack: Compromised 16/20 nodes: [1, 2, 3, 5, 6, 8, 9, 10, 11, 12, 13, 14, 15, 17, 18, 19]
Attack type: krum, lambda: 1.0
Model variant: baseline
Model parameters: 1,174,986
Sketchguard Node 0:
  Model dim: 1,174,986 → Sketch size: 180
  Compression ratio: 6527.7x
  Using model parameters for aggregation, sketches for filtering
Sketchguard Node 1:
  Model dim: 1,174,986 → Sketch size: 180
  Compression ratio: 6527.7x
  Using model parameters for aggregation, sketches for filtering
Sketchguard Node 2:
  Model dim: 1,174,986 → Sketch size: 180
  Compression ratio: 6527.7x
  Using model parameters for aggregation, sketches for filtering
Sketchguard Node 3:
  Model dim: 1,174,986 → Sketch size: 180
  Compression ratio: 6527.7x
  Using model parameters for aggregation, sketches for filtering
Sketchguard Node 4:
  Model dim: 1,174,986 → Sketch size: 180
  Compression ratio: 6527.7x
  Using model parameters for aggregation, sketches for filtering
Sketchguard Node 5:
  Model dim: 1,174,986 → Sketch size: 180
  Compression ratio: 6527.7x
  Using model parameters for aggregation, sketches for filtering
Sketchguard Node 6:
  Model dim: 1,174,986 → Sketch size: 180
  Compression ratio: 6527.7x
  Using model parameters for aggregation, sketches for filtering
Sketchguard Node 7:
  Model dim: 1,174,986 → Sketch size: 180
  Compression ratio: 6527.7x
  Using model parameters for aggregation, sketches for filtering
Sketchguard Node 8:
  Model dim: 1,174,986 → Sketch size: 180
  Compression ratio: 6527.7x
  Using model parameters for aggregation, sketches for filtering
Sketchguard Node 9:
  Model dim: 1,174,986 → Sketch size: 180
  Compression ratio: 6527.7x
  Using model parameters for aggregation, sketches for filtering
Sketchguard Node 10:
  Model dim: 1,174,986 → Sketch size: 180
  Compression ratio: 6527.7x
  Using model parameters for aggregation, sketches for filtering
Sketchguard Node 11:
  Model dim: 1,174,986 → Sketch size: 180
  Compression ratio: 6527.7x
  Using model parameters for aggregation, sketches for filtering
Sketchguard Node 12:
  Model dim: 1,174,986 → Sketch size: 180
  Compression ratio: 6527.7x
  Using model parameters for aggregation, sketches for filtering
Sketchguard Node 13:
  Model dim: 1,174,986 → Sketch size: 180
  Compression ratio: 6527.7x
  Using model parameters for aggregation, sketches for filtering
Sketchguard Node 14:
  Model dim: 1,174,986 → Sketch size: 180
  Compression ratio: 6527.7x
  Using model parameters for aggregation, sketches for filtering
Sketchguard Node 15:
  Model dim: 1,174,986 → Sketch size: 180
  Compression ratio: 6527.7x
  Using model parameters for aggregation, sketches for filtering
Sketchguard Node 16:
  Model dim: 1,174,986 → Sketch size: 180
  Compression ratio: 6527.7x
  Using model parameters for aggregation, sketches for filtering
Sketchguard Node 17:
  Model dim: 1,174,986 → Sketch size: 180
  Compression ratio: 6527.7x
  Using model parameters for aggregation, sketches for filtering
Sketchguard Node 18:
  Model dim: 1,174,986 → Sketch size: 180
  Compression ratio: 6527.7x
  Using model parameters for aggregation, sketches for filtering
Sketchguard Node 19:
  Model dim: 1,174,986 → Sketch size: 180
  Compression ratio: 6527.7x
  Using model parameters for aggregation, sketches for filtering
Sketchguard ALGORITHM (Sketch-based Filtering + State Aggregation)
  - Model dimension: 1,174,986 parameters
  - Config: SketchguardConfig(gamma=2, kappa=1, alpha=0.5, min_neighbors=1, sketch_size=180, network_seed=987654321, attack_detection_window=5)
  - Sketch size: 180
  - Compression ratio: 6527.7x
  - Complexity: O(d + N×k) = O(1,174,986 + 20×180)
  - Theoretical speedup vs BALANCE: 19.9x
Initial test acc across nodes: mean=0.4953 ± 0.0174
Round 001: test acc mean=0.4976 ± 0.0091 | min=0.4841 max=0.5146
         : test loss mean=0.7280 ± 0.0220
         : individual accs = ['0.488266', '0.492448', '0.510374', '0.484139', '0.488762', '0.491825', '0.498536', '0.486815', '0.501749', '0.493564', '0.506623', '0.486925', '0.489620', '0.498259', '0.514595', '0.504689', '0.495170', '0.507610', '0.499474', '0.513091']
         : correct/total = [(6949, 14232), (7010, 14235), (7281, 14266), (6883, 14217), (6959, 14238), (7069, 14373), (7152, 14346), (6978, 14334), (7172, 14294), (7094, 14373), (7267, 14344), (6964, 14302), (7028, 14354), (7156, 14362), (7369, 14320), (7265, 14395), (7125, 14389), (7237, 14257), (7118, 14251), (7388, 14399)]
         : compromised: 0.4996, honest: 0.4898
         : sketchguard stats = ['Node 0: acc_rate=1.000', 'Node 1: acc_rate=1.000', 'Node 2: acc_rate=1.000']...
Round 002: test acc mean=0.5580 ± 0.0258 | min=0.5040 max=0.5891
         : test loss mean=0.8807 ± 0.4840
         : individual accs = ['0.585441', '0.570776', '0.569886', '0.513751', '0.589057', '0.557017', '0.569148', '0.585461', '0.557856', '0.570792', '0.551311', '0.572018', '0.504041', '0.507938', '0.537011', '0.576520', '0.584057', '0.562461', '0.525577', '0.569831']
         : correct/total = [(8332, 14232), (8125, 14235), (8130, 14266), (7304, 14217), (8387, 14238), (8006, 14373), (8165, 14346), (8392, 14334), (7974, 14294), (8204, 14373), (7908, 14344), (8181, 14302), (7235, 14354), (7295, 14362), (7690, 14320), (8299, 14395), (8404, 14389), (8019, 14257), (7490, 14251), (8205, 14399)]
         : compromised: 0.5510, honest: 0.5860
         : sketchguard stats = ['Node 0: acc_rate=0.579', 'Node 1: acc_rate=0.605', 'Node 2: acc_rate=0.605']...
Round 003: test acc mean=0.5983 ± 0.0348 | min=0.5029 max=0.6305
         : test loss mean=0.6618 ± 0.0144
         : individual accs = ['0.611790', '0.602529', '0.610192', '0.516283', '0.626773', '0.599457', '0.622891', '0.614064', '0.615503', '0.627009', '0.604434', '0.630541', '0.502856', '0.546233', '0.589874', '0.611601', '0.612621', '0.620046', '0.616167', '0.585596']
         : correct/total = [(8707, 14232), (8577, 14235), (8705, 14266), (7340, 14217), (8924, 14238), (8616, 14373), (8936, 14346), (8802, 14334), (8798, 14294), (9012, 14373), (8670, 14344), (9018, 14302), (7218, 14354), (7845, 14362), (8447, 14320), (8804, 14395), (8815, 14389), (8840, 14257), (8781, 14251), (8432, 14399)]
         : compromised: 0.5938, honest: 0.6163
         : sketchguard stats = ['Node 0: acc_rate=0.439', 'Node 1: acc_rate=0.474', 'Node 2: acc_rate=0.474']...
Round 004: test acc mean=0.6153 ± 0.0540 | min=0.4630 max=0.6500
         : test loss mean=0.6435 ± 0.0230
         : individual accs = ['0.642285', '0.616860', '0.632974', '0.462967', '0.643208', '0.644611', '0.638575', '0.638970', '0.649993', '0.637097', '0.631972', '0.632779', '0.502578', '0.506963', '0.601187', '0.645710', '0.649246', '0.644315', '0.639043', '0.645600']
         : correct/total = [(9141, 14232), (8781, 14235), (9030, 14266), (6582, 14217), (9158, 14238), (9265, 14373), (9161, 14346), (9159, 14334), (9291, 14294), (9157, 14373), (9065, 14344), (9050, 14302), (7214, 14354), (7281, 14362), (8609, 14320), (9295, 14395), (9342, 14389), (9186, 14257), (9107, 14251), (9296, 14399)]
         : compromised: 0.6083, honest: 0.6434
         : sketchguard stats = ['Node 0: acc_rate=0.368', 'Node 1: acc_rate=0.408', 'Node 2: acc_rate=0.408']...
Round 005: test acc mean=0.6514 ± 0.0092 | min=0.6278 max=0.6636
         : test loss mean=0.6230 ± 0.0096
         : individual accs = ['0.655214', '0.652828', '0.650357', '0.640360', '0.658730', '0.659709', '0.654189', '0.661923', '0.661466', '0.651708', '0.648146', '0.652846', '0.631044', '0.627837', '0.645182', '0.653630', '0.663632', '0.654415', '0.649849', '0.654004']
         : correct/total = [(9325, 14232), (9293, 14235), (9278, 14266), (9104, 14217), (9379, 14238), (9482, 14373), (9385, 14346), (9488, 14334), (9455, 14294), (9367, 14373), (9297, 14344), (9337, 14302), (9058, 14354), (9017, 14362), (9239, 14320), (9409, 14395), (9549, 14389), (9330, 14257), (9261, 14251), (9417, 14399)]
         : compromised: 0.6492, honest: 0.6599
         : sketchguard stats = ['Node 0: acc_rate=0.326', 'Node 1: acc_rate=0.368', 'Node 2: acc_rate=0.368']...
Round 006: test acc mean=0.6623 ± 0.0039 | min=0.6565 max=0.6684
         : test loss mean=0.6112 ± 0.0028
         : individual accs = ['0.660202', '0.664910', '0.657577', '0.656468', '0.665754', '0.668406', '0.656978', '0.667783', '0.666364', '0.661449', '0.664180', '0.660327', '0.661140', '0.657986', '0.660126', '0.659326', '0.666759', '0.667882', '0.659041', '0.664282']
         : correct/total = [(9396, 14232), (9465, 14235), (9381, 14266), (9333, 14217), (9479, 14238), (9607, 14373), (9425, 14346), (9572, 14334), (9525, 14294), (9507, 14373), (9527, 14344), (9444, 14302), (9490, 14354), (9450, 14362), (9453, 14320), (9491, 14395), (9594, 14389), (9522, 14257), (9392, 14251), (9565, 14399)]
         : compromised: 0.6617, honest: 0.6651
         : sketchguard stats = ['Node 0: acc_rate=0.298', 'Node 1: acc_rate=0.342', 'Node 2: acc_rate=0.342']...
Round 007: test acc mean=0.6685 ± 0.0070 | min=0.6441 max=0.6769
         : test loss mean=0.6039 ± 0.0059
         : individual accs = ['0.668845', '0.673832', '0.644119', '0.669480', '0.676148', '0.676894', '0.667015', '0.663667', '0.675878', '0.663675', '0.668851', '0.666480', '0.669709', '0.667456', '0.666690', '0.670094', '0.675238', '0.672161', '0.662410', '0.670741']
         : correct/total = [(9519, 14232), (9592, 14235), (9189, 14266), (9518, 14217), (9627, 14238), (9729, 14373), (9569, 14346), (9513, 14334), (9661, 14294), (9539, 14373), (9594, 14344), (9532, 14302), (9613, 14354), (9586, 14362), (9547, 14320), (9646, 14395), (9716, 14389), (9583, 14257), (9440, 14251), (9658, 14399)]
         : compromised: 0.6678, honest: 0.6710
         : sketchguard stats = ['Node 0: acc_rate=0.278', 'Node 1: acc_rate=0.323', 'Node 2: acc_rate=0.323']...
Round 008: test acc mean=0.6732 ± 0.0044 | min=0.6646 max=0.6826
         : test loss mean=0.5989 ± 0.0043
         : individual accs = ['0.671374', '0.671303', '0.665779', '0.671942', '0.676570', '0.682599', '0.675519', '0.676294', '0.680705', '0.672233', '0.673452', '0.666970', '0.672635', '0.675115', '0.669553', '0.673220', '0.677184', '0.673353', '0.664585', '0.674491']
         : correct/total = [(9555, 14232), (9556, 14235), (9498, 14266), (9553, 14217), (9633, 14238), (9811, 14373), (9691, 14346), (9694, 14334), (9730, 14294), (9662, 14373), (9660, 14344), (9539, 14302), (9655, 14354), (9696, 14362), (9588, 14320), (9691, 14395), (9744, 14389), (9600, 14257), (9471, 14251), (9712, 14399)]
         : compromised: 0.6727, honest: 0.6754
         : sketchguard stats = ['Node 0: acc_rate=0.263', 'Node 1: acc_rate=0.309', 'Node 2: acc_rate=0.309']...
Round 009: test acc mean=0.6765 ± 0.0073 | min=0.6544 max=0.6858
         : test loss mean=0.5967 ± 0.0059
         : individual accs = ['0.654441', '0.683597', '0.671387', '0.671168', '0.681556', '0.682112', '0.667782', '0.676922', '0.684833', '0.674250', '0.679099', '0.673193', '0.683155', '0.685768', '0.671578', '0.672734', '0.685454', '0.676299', '0.677496', '0.676922']
         : correct/total = [(9314, 14232), (9731, 14235), (9578, 14266), (9542, 14217), (9704, 14238), (9804, 14373), (9580, 14346), (9703, 14334), (9789, 14294), (9691, 14373), (9741, 14344), (9628, 14302), (9806, 14354), (9849, 14362), (9617, 14320), (9684, 14395), (9863, 14389), (9642, 14257), (9655, 14251), (9747, 14399)]
         : compromised: 0.6770, honest: 0.6746
         : sketchguard stats = ['Node 0: acc_rate=0.251', 'Node 1: acc_rate=0.298', 'Node 2: acc_rate=0.298']...
Round 010: test acc mean=0.6843 ± 0.0049 | min=0.6715 max=0.6915
         : test loss mean=0.5875 ± 0.0040
         : individual accs = ['0.681492', '0.686969', '0.671457', '0.683478', '0.688791', '0.691296', '0.683675', '0.685573', '0.689100', '0.681277', '0.684328', '0.682911', '0.688171', '0.691478', '0.677374', '0.679125', '0.687122', '0.687873', '0.678619', '0.685117']
         : correct/total = [(9699, 14232), (9779, 14235), (9579, 14266), (9717, 14217), (9807, 14238), (9936, 14373), (9808, 14346), (9827, 14334), (9850, 14294), (9792, 14373), (9816, 14344), (9767, 14302), (9878, 14354), (9931, 14362), (9700, 14320), (9776, 14395), (9887, 14389), (9807, 14257), (9671, 14251), (9865, 14399)]
         : compromised: 0.6839, honest: 0.6857
         : sketchguard stats = ['Node 0: acc_rate=0.242', 'Node 1: acc_rate=0.289', 'Node 2: acc_rate=0.289']...

=== FINAL RESULTS ===
Dataset: sent140, Nodes: 20, Graph: fully, Aggregation: sketchguard
Attack: krum, 80.0% compromised
Final accuracy - Compromised: 0.6839, Honest: 0.6857
Overall test accuracy: mean=0.6843 ± 0.0049

=== Sketchguard SUMMARY ===
Node 0: acceptance=0.242
Node 1: acceptance=0.289
Node 2: acceptance=0.289
Node 3: acceptance=0.368
Node 4: acceptance=0.242
Node 5: acceptance=0.289
Node 6: acceptance=0.289
Node 7: acceptance=0.242
Node 8: acceptance=0.289
Node 9: acceptance=0.289
Node 10: acceptance=0.289
Node 11: acceptance=0.289
Node 12: acceptance=0.368
Node 13: acceptance=0.368
Node 14: acceptance=0.289
Node 15: acceptance=0.289
Node 16: acceptance=0.242
Node 17: acceptance=0.289
Node 18: acceptance=0.289
Node 19: acceptance=0.289

=== PARALLEL EXECUTION TIME (realistic for distributed system) ===
  COMMUNICATION (max across nodes):
    - Sketch transfer: 0.000s (0.0%)
    - Model fetch (accepted): 0.000s (0.0%)
  COMPUTATION (max across nodes):
    - Sketching: 0.350s (95.6%)
    - Filtering: 0.001s (0.3%)
    - Aggregation: 0.015s (4.0%)
  TOTALS:
    - Total computation: 0.366s (100.0%)
    - Total communication: 0.000s (0.0%)
    - Total parallel time: 0.366s

=== PER-NODE AVERAGE TIME ===
  - Sketching: 0.299s
  - Filtering: 0.001s
  - Aggregation: 0.012s
  - Sketch transfer: 0.000s
  - Model fetch: 0.000s
  - Total per node: 0.312s

=== TOTAL COMPUTATIONAL WORK (sum across all nodes) ===
  - Total sketching: 5.987s
  - Total filtering: 0.016s
  - Total aggregation: 0.232s
  - Total sketch transfer: 0.000s
  - Total model fetch: 0.000s
  - Grand total: 6.234s
  - Mean acceptance rate: 0.292

Sketchguard Algorithm Properties:
  - Original dimension: 1,174,986
  - Sketch size: 180
  - Compression ratio: 19.9x
  - Single repetition: No repetitions needed
  - Theoretical complexity: O(d + N×k)
  - Approach: Sketch filtering + state aggregation
