Device: cuda
Seed: 987654321
Loading 1 LEAF Sent140 train files...
LEAF Sent140 train: 254555 users, 908652 samples
Building vocabulary (max_size=10000)...
Vocabulary size: 10000
Loading 1 LEAF Sent140 test files...
LEAF Sent140 test: 254555 users, 286281 samples
Found 254555 train users, 254555 test users, 254555 common users
User sample counts range: 494 (max) to 1 (min)
Distributed ALL 254555 users across 20 clients
Users per client: 12727 (with 15 clients getting +1 user)
Train partition sizes: [44353, 44290, 44657, 44907, 44696, 45843, 45801, 45619, 45069, 45639, 45821, 45311, 45779, 46056, 45625, 45984, 46428, 44737, 45540, 46497]
Test partition sizes: [14232, 14235, 14266, 14217, 14238, 14373, 14346, 14334, 14294, 14373, 14344, 14302, 14354, 14362, 14320, 14395, 14389, 14257, 14251, 14399]
  Client 0: 44353 train samples, 2 unique classes
  Client 1: 44290 train samples, 2 unique classes
  Client 2: 44657 train samples, 2 unique classes
  Client 3: 44907 train samples, 2 unique classes
  Client 4: 44696 train samples, 2 unique classes
  Client 5: 45843 train samples, 2 unique classes
  Client 6: 45801 train samples, 2 unique classes
  Client 7: 45619 train samples, 2 unique classes
  Client 8: 45069 train samples, 2 unique classes
  Client 9: 45639 train samples, 2 unique classes
  Client 10: 45821 train samples, 2 unique classes
  Client 11: 45311 train samples, 2 unique classes
  Client 12: 45779 train samples, 2 unique classes
  Client 13: 46056 train samples, 2 unique classes
  Client 14: 45625 train samples, 2 unique classes
  Client 15: 45984 train samples, 2 unique classes
  Client 16: 46428 train samples, 2 unique classes
  Client 17: 44737 train samples, 2 unique classes
  Client 18: 45540 train samples, 2 unique classes
  Client 19: 46497 train samples, 2 unique classes
Will sample 4500 samples per client per epoch
Graph: ring, nodes: 20, edges: 20
Degree statistics: avg=2.00, min=2, max=2
Attack: Compromised 4/20 nodes: [5, 12, 13, 17]
Attack type: directed_deviation, lambda: 1.0
Model variant: baseline
Model parameters: 1,174,986
UBAR ALGORITHM (Two-Stage Byzantine-resilient)
  - Model dimension: 1,174,986 parameters
  - Rho parameter: 0.8
  - Stage 1: Distance-based filtering (select 80% closest neighbors)
  - Stage 2: Performance-based selection (loss comparison)
  - Complexity: O(deg(i)×d + deg(i)×inference)
Initial test acc across nodes: mean=0.4953 ± 0.0174
Round 001: test acc mean=0.5517 ± 0.0281 | min=0.5114 max=0.5940
         : test loss mean=0.6883 ± 0.0023
         : individual accs = ['0.583263', '0.593818', '0.580331', '0.565942', '0.566021', '0.511375', '0.590687', '0.593972', '0.550091', '0.547763', '0.513246', '0.516291', '0.532395', '0.535580', '0.529050', '0.526572', '0.558621', '0.526408', '0.528594', '0.584902']
         : correct/total = [(8301, 14232), (8453, 14235), (8279, 14266), (8046, 14217), (8059, 14238), (7350, 14373), (8474, 14346), (8514, 14334), (7863, 14294), (7873, 14373), (7362, 14344), (7384, 14302), (7642, 14354), (7692, 14362), (7576, 14320), (7580, 14395), (8038, 14389), (7505, 14257), (7533, 14251), (8422, 14399)]
         : compromised: 0.5264, honest: 0.5581
         : ubar stats = ['Node 0: s1=0.500, s2=1.000', 'Node 1: s1=0.500, s2=1.000', 'Node 2: s1=0.500, s2=1.000']...
Round 002: test acc mean=0.6343 ± 0.0090 | min=0.6101 max=0.6474
         : test loss mean=0.6499 ± 0.0144
         : individual accs = ['0.641161', '0.630980', '0.636408', '0.638742', '0.644964', '0.633479', '0.639063', '0.647412', '0.628515', '0.616573', '0.635388', '0.641938', '0.639195', '0.636193', '0.634637', '0.630427', '0.610119', '0.625587', '0.630272', '0.644003']
         : correct/total = [(9125, 14232), (8982, 14235), (9079, 14266), (9081, 14217), (9183, 14238), (9105, 14373), (9168, 14346), (9280, 14334), (8984, 14294), (8862, 14373), (9114, 14344), (9181, 14302), (9175, 14354), (9137, 14362), (9088, 14320), (9075, 14395), (8779, 14389), (8919, 14257), (8982, 14251), (9273, 14399)]
         : compromised: 0.6336, honest: 0.6344
         : ubar stats = ['Node 0: s1=0.500, s2=1.000', 'Node 1: s1=0.500, s2=1.000', 'Node 2: s1=0.500, s2=1.000']...
Round 003: test acc mean=0.6366 ± 0.0096 | min=0.6204 max=0.6544
         : test loss mean=0.6396 ± 0.0096
         : individual accs = ['0.628724', '0.634492', '0.620426', '0.648379', '0.651145', '0.646907', '0.622613', '0.633668', '0.632503', '0.643916', '0.645845', '0.654384', '0.640867', '0.642320', '0.630796', '0.635012', '0.636111', '0.623413', '0.626693', '0.634141']
         : correct/total = [(8948, 14232), (9032, 14235), (8851, 14266), (9218, 14217), (9271, 14238), (9298, 14373), (8932, 14346), (9083, 14334), (9041, 14294), (9255, 14373), (9264, 14344), (9359, 14302), (9199, 14354), (9225, 14362), (9033, 14320), (9141, 14395), (9153, 14389), (8888, 14257), (8931, 14251), (9131, 14399)]
         : compromised: 0.6384, honest: 0.6362
         : ubar stats = ['Node 0: s1=0.500, s2=1.000', 'Node 1: s1=0.500, s2=1.000', 'Node 2: s1=0.500, s2=1.000']...
Round 004: test acc mean=0.6478 ± 0.0067 | min=0.6368 max=0.6591
         : test loss mean=0.6277 ± 0.0071
         : individual accs = ['0.653457', '0.638216', '0.647343', '0.649434', '0.656061', '0.656439', '0.644221', '0.654109', '0.638030', '0.636819', '0.651562', '0.659069', '0.650481', '0.645175', '0.642807', '0.643418', '0.646327', '0.643193', '0.642271', '0.657754']
         : correct/total = [(9300, 14232), (9085, 14235), (9235, 14266), (9233, 14217), (9341, 14238), (9435, 14373), (9242, 14346), (9376, 14334), (9120, 14294), (9153, 14373), (9346, 14344), (9426, 14302), (9337, 14354), (9266, 14362), (9205, 14320), (9262, 14395), (9300, 14389), (9170, 14257), (9153, 14251), (9471, 14399)]
         : compromised: 0.6488, honest: 0.6476
         : ubar stats = ['Node 0: s1=0.500, s2=1.000', 'Node 1: s1=0.500, s2=1.000', 'Node 2: s1=0.500, s2=1.000']...
Round 005: test acc mean=0.6532 ± 0.0051 | min=0.6443 max=0.6641
         : test loss mean=0.6217 ± 0.0055
         : individual accs = ['0.649522', '0.654654', '0.644329', '0.658507', '0.664138', '0.653656', '0.649101', '0.657946', '0.654540', '0.657552', '0.653095', '0.660327', '0.657656', '0.651789', '0.648673', '0.654116', '0.645980', '0.645998', '0.649709', '0.651781']
         : correct/total = [(9244, 14232), (9319, 14235), (9192, 14266), (9362, 14217), (9456, 14238), (9395, 14373), (9312, 14346), (9431, 14334), (9356, 14294), (9451, 14373), (9368, 14344), (9444, 14302), (9440, 14354), (9361, 14362), (9289, 14320), (9416, 14395), (9295, 14389), (9210, 14257), (9259, 14251), (9385, 14399)]
         : compromised: 0.6523, honest: 0.6534
         : ubar stats = ['Node 0: s1=0.500, s2=1.000', 'Node 1: s1=0.500, s2=1.000', 'Node 2: s1=0.500, s2=1.000']...
Round 006: test acc mean=0.6588 ± 0.0054 | min=0.6424 max=0.6676
         : test loss mean=0.6156 ± 0.0052
         : individual accs = ['0.656057', '0.657675', '0.642437', '0.655202', '0.662453', '0.666806', '0.661927', '0.667574', '0.656499', '0.658874', '0.660346', '0.663264', '0.661558', '0.664531', '0.655796', '0.657728', '0.655084', '0.654065', '0.656164', '0.661574']
         : correct/total = [(9337, 14232), (9362, 14235), (9165, 14266), (9315, 14217), (9432, 14238), (9584, 14373), (9496, 14346), (9569, 14334), (9384, 14294), (9470, 14373), (9472, 14344), (9486, 14302), (9496, 14354), (9544, 14362), (9391, 14320), (9468, 14395), (9426, 14389), (9325, 14257), (9351, 14251), (9526, 14399)]
         : compromised: 0.6617, honest: 0.6580
         : ubar stats = ['Node 0: s1=0.500, s2=1.000', 'Node 1: s1=0.500, s2=1.000', 'Node 2: s1=0.500, s2=1.000']...
Round 007: test acc mean=0.6625 ± 0.0085 | min=0.6401 max=0.6739
         : test loss mean=0.6120 ± 0.0074
         : individual accs = ['0.660975', '0.663857', '0.640053', '0.664134', '0.671724', '0.673902', '0.669176', '0.673783', '0.664545', '0.669171', '0.657278', '0.662495', '0.665180', '0.669545', '0.650070', '0.655575', '0.662589', '0.653013', '0.654130', '0.668727']
         : correct/total = [(9407, 14232), (9450, 14235), (9131, 14266), (9442, 14217), (9564, 14238), (9686, 14373), (9600, 14346), (9658, 14334), (9499, 14294), (9618, 14373), (9428, 14344), (9475, 14302), (9548, 14354), (9616, 14362), (9309, 14320), (9437, 14395), (9534, 14389), (9310, 14257), (9322, 14251), (9629, 14399)]
         : compromised: 0.6654, honest: 0.6618
         : ubar stats = ['Node 0: s1=0.500, s2=1.000', 'Node 1: s1=0.500, s2=1.000', 'Node 2: s1=0.500, s2=1.000']...
Round 008: test acc mean=0.6661 ± 0.0077 | min=0.6515 max=0.6784
         : test loss mean=0.6079 ± 0.0062
         : individual accs = ['0.668142', '0.652828', '0.651479', '0.654287', '0.666386', '0.674111', '0.665760', '0.672248', '0.663355', '0.672998', '0.669479', '0.678367', '0.677233', '0.657360', '0.664455', '0.666551', '0.673431', '0.658694', '0.663673', '0.671019']
         : correct/total = [(9509, 14232), (9293, 14235), (9294, 14266), (9302, 14217), (9488, 14238), (9689, 14373), (9551, 14346), (9636, 14334), (9482, 14294), (9673, 14373), (9603, 14344), (9702, 14302), (9721, 14354), (9441, 14362), (9515, 14320), (9595, 14395), (9690, 14389), (9391, 14257), (9458, 14251), (9662, 14399)]
         : compromised: 0.6668, honest: 0.6659
         : ubar stats = ['Node 0: s1=0.500, s2=1.000', 'Node 1: s1=0.500, s2=1.000', 'Node 2: s1=0.500, s2=1.000']...
Round 009: test acc mean=0.6666 ± 0.0102 | min=0.6437 max=0.6786
         : test loss mean=0.6061 ± 0.0087
         : individual accs = ['0.643690', '0.650299', '0.658629', '0.670606', '0.678607', '0.673624', '0.648822', '0.660876', '0.664894', '0.671398', '0.674707', '0.677458', '0.673401', '0.677691', '0.666690', '0.666342', '0.674265', '0.674756', '0.670339', '0.654420']
         : correct/total = [(9161, 14232), (9257, 14235), (9396, 14266), (9534, 14217), (9662, 14238), (9682, 14373), (9308, 14346), (9473, 14334), (9504, 14294), (9650, 14373), (9678, 14344), (9689, 14302), (9666, 14354), (9733, 14362), (9547, 14320), (9592, 14395), (9702, 14389), (9620, 14257), (9553, 14251), (9423, 14399)]
         : compromised: 0.6749, honest: 0.6645
         : ubar stats = ['Node 0: s1=0.500, s2=1.000', 'Node 1: s1=0.500, s2=1.000', 'Node 2: s1=0.500, s2=1.000']...
Round 010: test acc mean=0.6808 ± 0.0077 | min=0.6621 max=0.6935
         : test loss mean=0.5921 ± 0.0072
         : individual accs = ['0.673763', '0.674113', '0.662134', '0.678835', '0.690476', '0.690600', '0.684720', '0.693456', '0.676438', '0.682043', '0.684258', '0.687806', '0.691654', '0.679710', '0.674511', '0.681139', '0.680867', '0.676790', '0.670690', '0.681575']
         : correct/total = [(9589, 14232), (9596, 14235), (9446, 14266), (9651, 14217), (9831, 14238), (9926, 14373), (9823, 14346), (9940, 14334), (9669, 14294), (9803, 14373), (9815, 14344), (9837, 14302), (9928, 14354), (9762, 14362), (9659, 14320), (9805, 14395), (9797, 14389), (9649, 14257), (9558, 14251), (9814, 14399)]
         : compromised: 0.6847, honest: 0.6798
         : ubar stats = ['Node 0: s1=0.500, s2=1.000', 'Node 1: s1=0.500, s2=1.000', 'Node 2: s1=0.500, s2=1.000']...

=== FINAL RESULTS ===
Dataset: sent140, Nodes: 20, Graph: ring, Aggregation: ubar
Attack: directed_deviation, 20.0% compromised
Final accuracy - Compromised: 0.6847, Honest: 0.6798
Overall test accuracy: mean=0.6808 ± 0.0077

=== UBAR SUMMARY ===
Node 0: stage1=0.500, stage2=1.000, overall=0.500
Node 1: stage1=0.500, stage2=1.000, overall=0.500
Node 2: stage1=0.500, stage2=1.000, overall=0.500
Node 3: stage1=0.500, stage2=1.000, overall=0.500
Node 4: stage1=0.500, stage2=1.000, overall=0.500
Node 5: stage1=0.500, stage2=1.000, overall=0.500
Node 6: stage1=0.500, stage2=1.000, overall=0.500
Node 7: stage1=0.500, stage2=1.000, overall=0.500
Node 8: stage1=0.500, stage2=1.000, overall=0.500
Node 9: stage1=0.500, stage2=1.000, overall=0.500
Node 10: stage1=0.500, stage2=1.000, overall=0.500
Node 11: stage1=0.500, stage2=1.000, overall=0.500
Node 12: stage1=0.500, stage2=1.000, overall=0.500
Node 13: stage1=0.500, stage2=1.000, overall=0.500
Node 14: stage1=0.500, stage2=1.000, overall=0.500
Node 15: stage1=0.500, stage2=1.000, overall=0.500
Node 16: stage1=0.500, stage2=1.000, overall=0.500
Node 17: stage1=0.500, stage2=1.000, overall=0.500
Node 18: stage1=0.500, stage2=1.000, overall=0.500
Node 19: stage1=0.500, stage2=1.000, overall=0.500

=== PARALLEL EXECUTION TIME (realistic for distributed system) ===
  COMMUNICATION (max across nodes):
    - Full model transfer: 0.000s (0.0%)
  COMPUTATION (max across nodes):
    - Distance computation: 0.025s (63.0%)
    - Loss computation: 0.011s (27.8%)
    - Aggregation: 0.004s (9.2%)
  TOTALS:
    - Total computation: 0.040s (100.0%)
    - Total communication: 0.000s (0.0%)
    - Total parallel time: 0.040s

=== PER-NODE AVERAGE TIME ===
  - Distance computation: 0.009s
  - Loss computation: 0.008s
  - Aggregation: 0.003s
  - Model transfer: 0.000s
  - Total per node: 0.020s

=== TOTAL COMPUTATIONAL WORK (sum across all nodes) ===
  - Total distance computation: 0.175s
  - Total loss computation: 0.163s
  - Total aggregation: 0.065s
  - Total model transfer: 0.000s
  - Grand total: 0.402s
  - Mean Stage 1 acceptance rate: 0.500
  - Mean Stage 2 acceptance rate: 1.000
  - Overall acceptance rate: 0.500

UBAR Algorithm Properties:
  - Model dimension: 1,174,986
  - Rho parameter: 0.8
  - Two-stage approach: Distance filtering + loss evaluation
  - Stage 1 selects: 80% of neighbors
  - Stage 2 uses: Training sample loss comparison
  - Theoretical complexity: O(deg(i)×d + deg(i)×inference)
  - Approach: UBAR paper implementation
