Device: cuda
Seed: 987654321
Loading 1 LEAF Sent140 train files...
LEAF Sent140 train: 254555 users, 908652 samples
Building vocabulary (max_size=10000)...
Vocabulary size: 10000
Loading 1 LEAF Sent140 test files...
LEAF Sent140 test: 254555 users, 286281 samples
Found 254555 train users, 254555 test users, 254555 common users
User sample counts range: 494 (max) to 1 (min)
Distributed ALL 254555 users across 20 clients
Users per client: 12727 (with 15 clients getting +1 user)
Train partition sizes: [44353, 44290, 44657, 44907, 44696, 45843, 45801, 45619, 45069, 45639, 45821, 45311, 45779, 46056, 45625, 45984, 46428, 44737, 45540, 46497]
Test partition sizes: [14232, 14235, 14266, 14217, 14238, 14373, 14346, 14334, 14294, 14373, 14344, 14302, 14354, 14362, 14320, 14395, 14389, 14257, 14251, 14399]
  Client 0: 44353 train samples, 2 unique classes
  Client 1: 44290 train samples, 2 unique classes
  Client 2: 44657 train samples, 2 unique classes
  Client 3: 44907 train samples, 2 unique classes
  Client 4: 44696 train samples, 2 unique classes
  Client 5: 45843 train samples, 2 unique classes
  Client 6: 45801 train samples, 2 unique classes
  Client 7: 45619 train samples, 2 unique classes
  Client 8: 45069 train samples, 2 unique classes
  Client 9: 45639 train samples, 2 unique classes
  Client 10: 45821 train samples, 2 unique classes
  Client 11: 45311 train samples, 2 unique classes
  Client 12: 45779 train samples, 2 unique classes
  Client 13: 46056 train samples, 2 unique classes
  Client 14: 45625 train samples, 2 unique classes
  Client 15: 45984 train samples, 2 unique classes
  Client 16: 46428 train samples, 2 unique classes
  Client 17: 44737 train samples, 2 unique classes
  Client 18: 45540 train samples, 2 unique classes
  Client 19: 46497 train samples, 2 unique classes
Will sample 4500 samples per client per epoch
Graph: erdos, nodes: 20, edges: 99
Degree statistics: avg=9.90, min=7, max=14
Attack: Compromised 6/20 nodes: [5, 12, 13, 14, 17, 18]
Attack type: directed_deviation, lambda: 1.0
Model variant: baseline
Model parameters: 1,174,986
Initial test acc across nodes: mean=0.4953 ± 0.0174
Round 001: test acc mean=0.4975 ± 0.0066 | min=0.4879 max=0.5096
         : test loss mean=2.9792 ± 2.2448
         : individual accs = ['0.509556', '0.488374', '0.487873', '0.494689', '0.490097', '0.499478', '0.499233', '0.501814', '0.498041', '0.504070', '0.492889', '0.487904', '0.506688', '0.489695', '0.505587', '0.502675', '0.503579', '0.499334', '0.495404', '0.492465']
         : correct/total = [(7252, 14232), (6952, 14235), (6960, 14266), (7033, 14217), (6978, 14238), (7179, 14373), (7162, 14346), (7193, 14334), (7119, 14294), (7245, 14373), (7070, 14344), (6978, 14302), (7273, 14354), (7033, 14362), (7240, 14320), (7236, 14395), (7246, 14389), (7119, 14257), (7060, 14251), (7091, 14399)]
         : compromised: 0.4994, honest: 0.4967
Round 002: test acc mean=0.4914 ± 0.0075 | min=0.4765 max=0.5097
         : test loss mean=2.4564 ± 1.2197
         : individual accs = ['0.490163', '0.476502', '0.494252', '0.492228', '0.479843', '0.492103', '0.489753', '0.492396', '0.502239', '0.509706', '0.489891', '0.495315', '0.488226', '0.501044', '0.487570', '0.483918', '0.494197', '0.496388', '0.482001', '0.489826']
         : correct/total = [(6976, 14232), (6783, 14235), (7051, 14266), (6998, 14217), (6832, 14238), (7073, 14373), (7026, 14346), (7058, 14334), (7179, 14294), (7326, 14373), (7027, 14344), (7084, 14302), (7008, 14354), (7196, 14362), (6982, 14320), (6966, 14395), (7111, 14389), (7077, 14257), (6869, 14251), (7053, 14399)]
         : compromised: 0.4912, honest: 0.4914
Round 003: test acc mean=0.4957 ± 0.0134 | min=0.4595 max=0.5143
         : test loss mean=0.8098 ± 0.2309
         : individual accs = ['0.497189', '0.514296', '0.513038', '0.484912', '0.505549', '0.495443', '0.494214', '0.490373', '0.474535', '0.512976', '0.498327', '0.485596', '0.499373', '0.506754', '0.478631', '0.501910', '0.501355', '0.502981', '0.497790', '0.459546']
         : correct/total = [(7076, 14232), (7321, 14235), (7319, 14266), (6894, 14217), (7198, 14238), (7121, 14373), (7090, 14346), (7029, 14334), (6783, 14294), (7373, 14373), (7148, 14344), (6945, 14302), (7168, 14354), (7278, 14362), (6854, 14320), (7225, 14395), (7214, 14389), (7171, 14257), (7094, 14251), (6617, 14399)]
         : compromised: 0.4968, honest: 0.4953
Round 004: test acc mean=0.4994 ± 0.0115 | min=0.4728 max=0.5158
         : test loss mean=0.9865 ± 0.3994
         : individual accs = ['0.495222', '0.510994', '0.502313', '0.515791', '0.509411', '0.504209', '0.511362', '0.500209', '0.499650', '0.494886', '0.485708', '0.510278', '0.472760', '0.490461', '0.492598', '0.511428', '0.510529', '0.500175', '0.477370', '0.492673']
         : correct/total = [(7048, 14232), (7274, 14235), (7166, 14266), (7333, 14217), (7253, 14238), (7247, 14373), (7336, 14346), (7170, 14334), (7142, 14294), (7113, 14373), (6967, 14344), (7298, 14302), (6786, 14354), (7044, 14362), (7054, 14320), (7362, 14395), (7346, 14389), (7131, 14257), (6803, 14251), (7094, 14399)]
         : compromised: 0.4896, honest: 0.5036
Round 005: test acc mean=0.5080 ± 0.0136 | min=0.4822 max=0.5451
         : test loss mean=0.7884 ± 0.2574
         : individual accs = ['0.506183', '0.482192', '0.530282', '0.515369', '0.495435', '0.504001', '0.516520', '0.498326', '0.509864', '0.493634', '0.498397', '0.507272', '0.502647', '0.508146', '0.545112', '0.521917', '0.517201', '0.507751', '0.495825', '0.504479']
         : correct/total = [(7204, 14232), (6864, 14235), (7565, 14266), (7327, 14217), (7054, 14238), (7244, 14373), (7410, 14346), (7143, 14334), (7288, 14294), (7095, 14373), (7149, 14344), (7255, 14302), (7215, 14354), (7298, 14362), (7806, 14320), (7513, 14395), (7442, 14389), (7239, 14257), (7066, 14251), (7264, 14399)]
         : compromised: 0.5106, honest: 0.5069
Round 006: test acc mean=0.5070 ± 0.0110 | min=0.4942 max=0.5447
         : test loss mean=0.7948 ± 0.2278
         : individual accs = ['0.496417', '0.509238', '0.494182', '0.522332', '0.509622', '0.500383', '0.501673', '0.501046', '0.497132', '0.544702', '0.504950', '0.510418', '0.502229', '0.517546', '0.503631', '0.504481', '0.504344', '0.501157', '0.502561', '0.512397']
         : correct/total = [(7065, 14232), (7249, 14235), (7050, 14266), (7426, 14217), (7256, 14238), (7192, 14373), (7197, 14346), (7182, 14334), (7106, 14294), (7829, 14373), (7243, 14344), (7300, 14302), (7209, 14354), (7433, 14362), (7212, 14320), (7262, 14395), (7257, 14389), (7145, 14257), (7162, 14251), (7378, 14399)]
         : compromised: 0.5046, honest: 0.5081
Round 007: test acc mean=0.5092 ± 0.0137 | min=0.4849 max=0.5377
         : test loss mean=0.7369 ± 0.1290
         : individual accs = ['0.537662', '0.488795', '0.503715', '0.484912', '0.525425', '0.495860', '0.513035', '0.498465', '0.514202', '0.522647', '0.498397', '0.503146', '0.502856', '0.506197', '0.509567', '0.525530', '0.519633', '0.528021', '0.495614', '0.509966']
         : correct/total = [(7652, 14232), (6958, 14235), (7186, 14266), (6894, 14217), (7481, 14238), (7127, 14373), (7360, 14346), (7145, 14334), (7350, 14294), (7512, 14373), (7149, 14344), (7196, 14302), (7218, 14354), (7270, 14362), (7297, 14320), (7565, 14395), (7477, 14389), (7528, 14257), (7063, 14251), (7343, 14399)]
         : compromised: 0.5064, honest: 0.5104
Round 008: test acc mean=0.5243 ± 0.0200 | min=0.4871 max=0.5585
         : test loss mean=0.7400 ± 0.1362
         : individual accs = ['0.554314', '0.487109', '0.554535', '0.544559', '0.558505', '0.545676', '0.511641', '0.513744', '0.495523', '0.504209', '0.523006', '0.512166', '0.519158', '0.500696', '0.537849', '0.523585', '0.517062', '0.522550', '0.518209', '0.541079']
         : correct/total = [(7889, 14232), (6934, 14235), (7911, 14266), (7742, 14217), (7952, 14238), (7843, 14373), (7340, 14346), (7364, 14334), (7083, 14294), (7247, 14373), (7502, 14344), (7325, 14302), (7452, 14354), (7191, 14362), (7702, 14320), (7537, 14395), (7440, 14389), (7450, 14257), (7385, 14251), (7791, 14399)]
         : compromised: 0.5240, honest: 0.5244
Round 009: test acc mean=0.5167 ± 0.0270 | min=0.4875 max=0.6009
         : test loss mean=0.7161 ± 0.0887
         : individual accs = ['0.550871', '0.487460', '0.489135', '0.489695', '0.600927', '0.496139', '0.525303', '0.522045', '0.498811', '0.521533', '0.499094', '0.525101', '0.502856', '0.506824', '0.495601', '0.536297', '0.521857', '0.517570', '0.495614', '0.550802']
         : correct/total = [(7840, 14232), (6939, 14235), (6978, 14266), (6962, 14217), (8556, 14238), (7131, 14373), (7536, 14346), (7483, 14334), (7130, 14294), (7496, 14373), (7159, 14344), (7510, 14302), (7218, 14354), (7279, 14362), (7097, 14320), (7720, 14395), (7509, 14389), (7379, 14257), (7063, 14251), (7931, 14399)]
         : compromised: 0.5024, honest: 0.5228
Round 010: test acc mean=0.5459 ± 0.0235 | min=0.5024 max=0.5852
         : test loss mean=0.7049 ± 0.0585
         : individual accs = ['0.584387', '0.552160', '0.553624', '0.569529', '0.566091', '0.573158', '0.533110', '0.519115', '0.502449', '0.504348', '0.531790', '0.529087', '0.532186', '0.540036', '0.570950', '0.547412', '0.532699', '0.555727', '0.534840', '0.585180']
         : correct/total = [(8317, 14232), (7860, 14235), (7898, 14266), (8097, 14217), (8060, 14238), (8238, 14373), (7648, 14346), (7441, 14334), (7182, 14294), (7249, 14373), (7628, 14344), (7567, 14302), (7639, 14354), (7756, 14362), (8176, 14320), (7880, 14395), (7665, 14389), (7923, 14257), (7622, 14251), (8426, 14399)]
         : compromised: 0.5511, honest: 0.5436

=== FINAL RESULTS ===
Dataset: sent140, Nodes: 20, Graph: erdos, Aggregation: d-fedavg
Attack: directed_deviation, 30.0% compromised
Final accuracy - Compromised: 0.5511, Honest: 0.5436
Overall test accuracy: mean=0.5459 ± 0.0235
