Device: cuda
Seed: 987654321
Loading 1 LEAF Sent140 train files...
LEAF Sent140 train: 254555 users, 908652 samples
Building vocabulary (max_size=10000)...
Vocabulary size: 10000
Loading 1 LEAF Sent140 test files...
LEAF Sent140 test: 254555 users, 286281 samples
Found 254555 train users, 254555 test users, 254555 common users
User sample counts range: 494 (max) to 1 (min)
Distributed ALL 254555 users across 20 clients
Users per client: 12727 (with 15 clients getting +1 user)
Train partition sizes: [44353, 44290, 44657, 44907, 44696, 45843, 45801, 45619, 45069, 45639, 45821, 45311, 45779, 46056, 45625, 45984, 46428, 44737, 45540, 46497]
Test partition sizes: [14232, 14235, 14266, 14217, 14238, 14373, 14346, 14334, 14294, 14373, 14344, 14302, 14354, 14362, 14320, 14395, 14389, 14257, 14251, 14399]
  Client 0: 44353 train samples, 2 unique classes
  Client 1: 44290 train samples, 2 unique classes
  Client 2: 44657 train samples, 2 unique classes
  Client 3: 44907 train samples, 2 unique classes
  Client 4: 44696 train samples, 2 unique classes
  Client 5: 45843 train samples, 2 unique classes
  Client 6: 45801 train samples, 2 unique classes
  Client 7: 45619 train samples, 2 unique classes
  Client 8: 45069 train samples, 2 unique classes
  Client 9: 45639 train samples, 2 unique classes
  Client 10: 45821 train samples, 2 unique classes
  Client 11: 45311 train samples, 2 unique classes
  Client 12: 45779 train samples, 2 unique classes
  Client 13: 46056 train samples, 2 unique classes
  Client 14: 45625 train samples, 2 unique classes
  Client 15: 45984 train samples, 2 unique classes
  Client 16: 46428 train samples, 2 unique classes
  Client 17: 44737 train samples, 2 unique classes
  Client 18: 45540 train samples, 2 unique classes
  Client 19: 46497 train samples, 2 unique classes
Will sample 4500 samples per client per epoch
Graph: erdos, nodes: 20, edges: 48
Degree statistics: avg=4.80, min=2, max=7
Attack: Compromised 4/20 nodes: [5, 12, 13, 17]
Attack type: directed_deviation, lambda: 1.0
Model variant: baseline
Model parameters: 1,174,986
Initial test acc across nodes: mean=0.4953 ± 0.0174
Round 001: test acc mean=0.5027 ± 0.0098 | min=0.4852 max=0.5180
         : test loss mean=2.1082 ± 2.7852
         : individual accs = ['0.508010', '0.485213', '0.513038', '0.515580', '0.517980', '0.502122', '0.501115', '0.502651', '0.504687', '0.514367', '0.490449', '0.509579', '0.501115', '0.492411', '0.493645', '0.505175', '0.485857', '0.492320', '0.504386', '0.514272']
         : correct/total = [(7230, 14232), (6907, 14235), (7319, 14266), (7330, 14217), (7375, 14238), (7217, 14373), (7189, 14346), (7205, 14334), (7214, 14294), (7393, 14373), (7035, 14344), (7288, 14302), (7193, 14354), (7072, 14362), (7069, 14320), (7272, 14395), (6991, 14389), (7019, 14257), (7188, 14251), (7405, 14399)]
         : compromised: 0.4970, honest: 0.5041
Round 002: test acc mean=0.5015 ± 0.0121 | min=0.4854 max=0.5309
         : test loss mean=1.3942 ± 1.0241
         : individual accs = ['0.518690', '0.530875', '0.513038', '0.485405', '0.494451', '0.502192', '0.497630', '0.496721', '0.502868', '0.491755', '0.524191', '0.496644', '0.504737', '0.487258', '0.489176', '0.497048', '0.495170', '0.501508', '0.489931', '0.510591']
         : correct/total = [(7382, 14232), (7557, 14235), (7319, 14266), (6901, 14217), (7040, 14238), (7218, 14373), (7139, 14346), (7120, 14334), (7188, 14294), (7068, 14373), (7519, 14344), (7103, 14302), (7245, 14354), (6998, 14362), (7005, 14320), (7155, 14395), (7125, 14389), (7150, 14257), (6982, 14251), (7352, 14399)]
         : compromised: 0.4989, honest: 0.5021
Round 003: test acc mean=0.5028 ± 0.0110 | min=0.4787 max=0.5273
         : test loss mean=0.7726 ± 0.2314
         : individual accs = ['0.492271', '0.519986', '0.513108', '0.494197', '0.505268', '0.508523', '0.500349', '0.519255', '0.500210', '0.506575', '0.497072', '0.527339', '0.498467', '0.495683', '0.493645', '0.478708', '0.503927', '0.495265', '0.508105', '0.498090']
         : correct/total = [(7006, 14232), (7402, 14235), (7320, 14266), (7026, 14217), (7194, 14238), (7309, 14373), (7178, 14346), (7443, 14334), (7150, 14294), (7281, 14373), (7130, 14344), (7542, 14302), (7155, 14354), (7119, 14362), (7069, 14320), (6891, 14395), (7251, 14389), (7061, 14257), (7241, 14251), (7172, 14399)]
         : compromised: 0.4995, honest: 0.5036
Round 004: test acc mean=0.5078 ± 0.0124 | min=0.4830 max=0.5445
         : test loss mean=0.8253 ± 0.2623
         : individual accs = ['0.518620', '0.483035', '0.504907', '0.518956', '0.513415', '0.502818', '0.511780', '0.503279', '0.544494', '0.496904', '0.504880', '0.508041', '0.520761', '0.507032', '0.500698', '0.497742', '0.512753', '0.512169', '0.495755', '0.497048']
         : correct/total = [(7381, 14232), (6876, 14235), (7203, 14266), (7378, 14217), (7310, 14238), (7227, 14373), (7342, 14346), (7214, 14334), (7783, 14294), (7142, 14373), (7242, 14344), (7266, 14302), (7475, 14354), (7282, 14362), (7170, 14320), (7165, 14395), (7378, 14389), (7302, 14257), (7065, 14251), (7157, 14399)]
         : compromised: 0.5107, honest: 0.5070
Round 005: test acc mean=0.5221 ± 0.0229 | min=0.4976 max=0.5936
         : test loss mean=0.7405 ± 0.1391
         : individual accs = ['0.513983', '0.522655', '0.519627', '0.534782', '0.539472', '0.531065', '0.499930', '0.551416', '0.593606', '0.504835', '0.501603', '0.528667', '0.497631', '0.509052', '0.515223', '0.502049', '0.508513', '0.498773', '0.547962', '0.521217']
         : correct/total = [(7315, 14232), (7440, 14235), (7413, 14266), (7603, 14217), (7681, 14238), (7633, 14373), (7172, 14346), (7904, 14334), (8485, 14294), (7256, 14373), (7195, 14344), (7561, 14302), (7143, 14354), (7311, 14362), (7378, 14320), (7227, 14395), (7317, 14389), (7111, 14257), (7809, 14251), (7505, 14399)]
         : compromised: 0.5091, honest: 0.5253
Round 006: test acc mean=0.5318 ± 0.0223 | min=0.4976 max=0.5726
         : test loss mean=0.7563 ± 0.1595
         : individual accs = ['0.564573', '0.531296', '0.518225', '0.560948', '0.546917', '0.499548', '0.569706', '0.514023', '0.544284', '0.542823', '0.538971', '0.525031', '0.520900', '0.506824', '0.497626', '0.531643', '0.521996', '0.504524', '0.524454', '0.572609']
         : correct/total = [(8035, 14232), (7563, 14235), (7393, 14266), (7975, 14217), (7787, 14238), (7180, 14373), (8173, 14346), (7368, 14334), (7780, 14294), (7802, 14373), (7731, 14344), (7509, 14302), (7477, 14354), (7279, 14362), (7126, 14320), (7653, 14395), (7511, 14389), (7193, 14257), (7474, 14251), (8245, 14399)]
         : compromised: 0.5079, honest: 0.5378
Round 007: test acc mean=0.5679 ± 0.0380 | min=0.5017 max=0.6275
         : test loss mean=0.7243 ± 0.1430
         : individual accs = ['0.599986', '0.574359', '0.572550', '0.604347', '0.586669', '0.520142', '0.612714', '0.575136', '0.620470', '0.608850', '0.501743', '0.547965', '0.550996', '0.524927', '0.507263', '0.572490', '0.545347', '0.519184', '0.585643', '0.627474']
         : correct/total = [(8539, 14232), (8176, 14235), (8168, 14266), (8592, 14217), (8353, 14238), (7476, 14373), (8790, 14346), (8244, 14334), (8869, 14294), (8751, 14373), (7197, 14344), (7837, 14302), (7909, 14354), (7539, 14362), (7264, 14320), (8241, 14395), (7847, 14389), (7402, 14257), (8346, 14251), (9035, 14399)]
         : compromised: 0.5288, honest: 0.5777
Round 008: test acc mean=0.5623 ± 0.0396 | min=0.4993 max=0.6307
         : test loss mean=0.7156 ± 0.1000
         : individual accs = ['0.590430', '0.606393', '0.526917', '0.600619', '0.574519', '0.508036', '0.599191', '0.524138', '0.626697', '0.602936', '0.552566', '0.529996', '0.549673', '0.506545', '0.499302', '0.570893', '0.532351', '0.548783', '0.564452', '0.630669']
         : correct/total = [(8403, 14232), (8632, 14235), (7517, 14266), (8539, 14217), (8180, 14238), (7302, 14373), (8596, 14346), (7513, 14334), (8958, 14294), (8666, 14373), (7926, 14344), (7580, 14302), (7890, 14354), (7275, 14362), (7150, 14320), (8218, 14395), (7660, 14389), (7824, 14257), (8044, 14251), (9081, 14399)]
         : compromised: 0.5283, honest: 0.5708
Round 009: test acc mean=0.5788 ± 0.0460 | min=0.4983 max=0.6358
         : test loss mean=0.7014 ± 0.0942
         : individual accs = ['0.603288', '0.608219', '0.564559', '0.625519', '0.618977', '0.524943', '0.627910', '0.585880', '0.632853', '0.605441', '0.624930', '0.555587', '0.498258', '0.566077', '0.514944', '0.529767', '0.532699', '0.505296', '0.615536', '0.635808']
         : correct/total = [(8586, 14232), (8658, 14235), (8054, 14266), (8893, 14217), (8813, 14238), (7545, 14373), (9008, 14346), (8398, 14334), (9046, 14294), (8702, 14373), (8964, 14344), (7946, 14302), (7152, 14354), (8130, 14362), (7374, 14320), (7626, 14395), (7665, 14389), (7204, 14257), (8772, 14251), (9155, 14399)]
         : compromised: 0.5236, honest: 0.5926
Round 010: test acc mean=0.5873 ± 0.0389 | min=0.4980 max=0.6391
         : test loss mean=0.6991 ± 0.0917
         : individual accs = ['0.609893', '0.629083', '0.595682', '0.619470', '0.598328', '0.518263', '0.618988', '0.539417', '0.630474', '0.632227', '0.606804', '0.555866', '0.581371', '0.554797', '0.498045', '0.586593', '0.551671', '0.574034', '0.604940', '0.639142']
         : correct/total = [(8680, 14232), (8955, 14235), (8498, 14266), (8807, 14217), (8519, 14238), (7449, 14373), (8880, 14346), (7732, 14334), (9012, 14294), (9087, 14373), (8704, 14344), (7950, 14302), (8345, 14354), (7968, 14362), (7132, 14320), (8444, 14395), (7938, 14389), (8184, 14257), (8621, 14251), (9203, 14399)]
         : compromised: 0.5571, honest: 0.5948

=== FINAL RESULTS ===
Dataset: sent140, Nodes: 20, Graph: erdos, Aggregation: d-fedavg
Attack: directed_deviation, 20.0% compromised
Final accuracy - Compromised: 0.5571, Honest: 0.5948
Overall test accuracy: mean=0.5873 ± 0.0389
