Device: cuda
Seed: 987654321
Loading 1 LEAF Sent140 train files...
LEAF Sent140 train: 254555 users, 908652 samples
Building vocabulary (max_size=10000)...
Vocabulary size: 10000
Loading 1 LEAF Sent140 test files...
LEAF Sent140 test: 254555 users, 286281 samples
Found 254555 train users, 254555 test users, 254555 common users
User sample counts range: 494 (max) to 1 (min)
Distributed ALL 254555 users across 20 clients
Users per client: 12727 (with 15 clients getting +1 user)
Train partition sizes: [44353, 44290, 44657, 44907, 44696, 45843, 45801, 45619, 45069, 45639, 45821, 45311, 45779, 46056, 45625, 45984, 46428, 44737, 45540, 46497]
Test partition sizes: [14232, 14235, 14266, 14217, 14238, 14373, 14346, 14334, 14294, 14373, 14344, 14302, 14354, 14362, 14320, 14395, 14389, 14257, 14251, 14399]
  Client 0: 44353 train samples, 2 unique classes
  Client 1: 44290 train samples, 2 unique classes
  Client 2: 44657 train samples, 2 unique classes
  Client 3: 44907 train samples, 2 unique classes
  Client 4: 44696 train samples, 2 unique classes
  Client 5: 45843 train samples, 2 unique classes
  Client 6: 45801 train samples, 2 unique classes
  Client 7: 45619 train samples, 2 unique classes
  Client 8: 45069 train samples, 2 unique classes
  Client 9: 45639 train samples, 2 unique classes
  Client 10: 45821 train samples, 2 unique classes
  Client 11: 45311 train samples, 2 unique classes
  Client 12: 45779 train samples, 2 unique classes
  Client 13: 46056 train samples, 2 unique classes
  Client 14: 45625 train samples, 2 unique classes
  Client 15: 45984 train samples, 2 unique classes
  Client 16: 46428 train samples, 2 unique classes
  Client 17: 44737 train samples, 2 unique classes
  Client 18: 45540 train samples, 2 unique classes
  Client 19: 46497 train samples, 2 unique classes
Will sample 4500 samples per client per epoch
Graph: erdos, nodes: 20, edges: 48
Degree statistics: avg=4.80, min=2, max=7
Attack: Compromised 2/20 nodes: [5, 13]
Attack type: backdoor, lambda: 1.0
Backdoor target label: 1, trigger size: 3
Model variant: baseline
Model parameters: 1,174,986
Initial test acc across nodes: mean=0.4953 ± 0.0174
Backdoor attack: Created poisoned datasets for 2 compromised nodes
Round 001: test acc mean=0.5048 ± 0.0080 | min=0.4852 max=0.5157
         : test loss mean=0.9056 ± 0.3742
         : individual accs = ['0.493255', '0.485213', '0.513038', '0.510375', '0.507164', '0.503931', '0.502161', '0.506069', '0.504687', '0.514367', '0.500906', '0.501678', '0.515745', '0.507729', '0.503701', '0.511150', '0.508027', '0.488602', '0.504386', '0.514272']
         : correct/total = [(7020, 14232), (6907, 14235), (7319, 14266), (7256, 14217), (7221, 14238), (7243, 14373), (7204, 14346), (7254, 14334), (7214, 14294), (7393, 14373), (7185, 14344), (7175, 14302), (7403, 14354), (7292, 14362), (7213, 14320), (7358, 14395), (7310, 14389), (6966, 14257), (7188, 14251), (7405, 14399)]
         : compromised: 0.5058, honest: 0.5047
Round 002: test acc mean=0.5066 ± 0.0119 | min=0.4839 max=0.5337
         : test loss mean=0.8242 ± 0.2186
         : individual accs = ['0.492622', '0.516965', '0.516403', '0.483928', '0.496207', '0.528560', '0.504322', '0.509418', '0.533720', '0.495721', '0.507111', '0.503286', '0.512331', '0.502576', '0.515782', '0.507676', '0.492529', '0.509925', '0.496527', '0.506424']
         : correct/total = [(7011, 14232), (7359, 14235), (7367, 14266), (6880, 14217), (7065, 14238), (7597, 14373), (7235, 14346), (7302, 14334), (7629, 14294), (7125, 14373), (7274, 14344), (7198, 14302), (7354, 14354), (7218, 14362), (7386, 14320), (7308, 14395), (7087, 14389), (7270, 14257), (7076, 14251), (7292, 14399)]
         : compromised: 0.5156, honest: 0.5056
Round 003: test acc mean=0.5054 ± 0.0197 | min=0.4828 max=0.5735
         : test loss mean=0.7025 ± 0.0249
         : individual accs = ['0.492622', '0.482824', '0.486962', '0.518886', '0.497120', '0.495791', '0.527394', '0.506837', '0.573457', '0.511306', '0.506623', '0.510348', '0.496656', '0.510026', '0.514385', '0.485933', '0.484398', '0.513642', '0.495544', '0.498090']
         : correct/total = [(7011, 14232), (6873, 14235), (6947, 14266), (7377, 14217), (7078, 14238), (7126, 14373), (7566, 14346), (7265, 14334), (8197, 14294), (7349, 14373), (7267, 14344), (7299, 14302), (7129, 14354), (7325, 14362), (7366, 14320), (6995, 14395), (6970, 14389), (7323, 14257), (7062, 14251), (7172, 14399)]
         : compromised: 0.5029, honest: 0.5057
Round 004: test acc mean=0.5084 ± 0.0282 | min=0.4737 max=0.5976
         : test loss mean=0.7554 ± 0.1330
         : individual accs = ['0.492482', '0.483035', '0.505187', '0.473658', '0.494522', '0.500452', '0.499791', '0.491698', '0.558766', '0.504905', '0.597602', '0.488883', '0.529957', '0.497563', '0.491830', '0.526016', '0.492529', '0.505085', '0.536804', '0.498090']
         : correct/total = [(7009, 14232), (6876, 14235), (7207, 14266), (6734, 14217), (7041, 14238), (7193, 14373), (7170, 14346), (7048, 14334), (7987, 14294), (7257, 14373), (8572, 14344), (6992, 14302), (7607, 14354), (7146, 14362), (7043, 14320), (7572, 14395), (7087, 14389), (7201, 14257), (7650, 14251), (7172, 14399)]
         : compromised: 0.4990, honest: 0.5095
Round 005: test acc mean=0.5424 ± 0.0425 | min=0.4963 max=0.6223
         : test loss mean=0.8188 ± 0.1779
         : individual accs = ['0.503021', '0.571970', '0.609631', '0.525287', '0.605352', '0.531622', '0.600516', '0.503698', '0.622289', '0.502818', '0.526143', '0.533072', '0.523269', '0.515249', '0.534288', '0.528378', '0.611787', '0.500877', '0.496316', '0.501424']
         : correct/total = [(7159, 14232), (8142, 14235), (8697, 14266), (7468, 14217), (8619, 14238), (7641, 14373), (8615, 14346), (7220, 14334), (8895, 14294), (7227, 14373), (7547, 14344), (7624, 14302), (7511, 14354), (7400, 14362), (7651, 14320), (7606, 14395), (8803, 14389), (7141, 14257), (7073, 14251), (7220, 14399)]
         : compromised: 0.5234, honest: 0.5445
Round 006: test acc mean=0.5278 ± 0.0446 | min=0.4847 max=0.6337
         : test loss mean=1.3702 ± 1.4787
         : individual accs = ['0.620363', '0.529399', '0.502664', '0.484701', '0.528024', '0.503861', '0.521191', '0.492954', '0.633692', '0.509358', '0.539459', '0.493637', '0.525010', '0.492759', '0.491899', '0.522473', '0.495100', '0.495195', '0.553786', '0.620738']
         : correct/total = [(8829, 14232), (7536, 14235), (7171, 14266), (6891, 14217), (7518, 14238), (7242, 14373), (7477, 14346), (7066, 14334), (9058, 14294), (7321, 14373), (7738, 14344), (7060, 14302), (7536, 14354), (7077, 14362), (7044, 14320), (7521, 14395), (7124, 14389), (7060, 14257), (7892, 14251), (8938, 14399)]
         : compromised: 0.4983, honest: 0.5311
Round 007: test acc mean=0.5394 ± 0.0460 | min=0.4934 max=0.6327
         : test loss mean=0.9571 ± 0.4886
         : individual accs = ['0.618957', '0.558412', '0.602271', '0.518956', '0.506181', '0.504001', '0.580301', '0.523301', '0.632713', '0.504766', '0.501603', '0.521605', '0.497353', '0.493385', '0.512221', '0.502188', '0.507679', '0.516518', '0.559189', '0.625599']
         : correct/total = [(8809, 14232), (7949, 14235), (8592, 14266), (7378, 14217), (7207, 14238), (7244, 14373), (8325, 14346), (7501, 14334), (9044, 14294), (7255, 14373), (7195, 14344), (7460, 14302), (7139, 14354), (7086, 14362), (7335, 14320), (7229, 14395), (7305, 14389), (7364, 14257), (7969, 14251), (9008, 14399)]
         : compromised: 0.4987, honest: 0.5439
Round 008: test acc mean=0.5538 ± 0.0482 | min=0.4974 max=0.6427
         : test loss mean=0.8499 ± 0.2976
         : individual accs = ['0.606380', '0.586653', '0.618183', '0.514736', '0.564897', '0.497878', '0.554371', '0.500000', '0.642717', '0.570027', '0.607432', '0.506992', '0.506967', '0.497424', '0.504120', '0.512331', '0.603656', '0.502630', '0.602133', '0.575804']
         : correct/total = [(8630, 14232), (8351, 14235), (8819, 14266), (7318, 14217), (8043, 14238), (7156, 14373), (7953, 14346), (7167, 14334), (9187, 14294), (8193, 14373), (8713, 14344), (7251, 14302), (7277, 14354), (7144, 14362), (7219, 14320), (7375, 14395), (8686, 14389), (7166, 14257), (8581, 14251), (8291, 14399)]
         : compromised: 0.4977, honest: 0.5600
Round 009: test acc mean=0.5212 ± 0.0454 | min=0.4849 max=0.6489
         : test loss mean=0.7449 ± 0.0733
         : individual accs = ['0.580593', '0.518440', '0.511075', '0.484912', '0.504916', '0.512697', '0.502509', '0.492745', '0.648944', '0.495721', '0.532697', '0.493567', '0.502856', '0.524509', '0.492598', '0.497951', '0.498575', '0.495336', '0.496737', '0.637336']
         : correct/total = [(8263, 14232), (7380, 14235), (7291, 14266), (6894, 14217), (7189, 14238), (7369, 14373), (7209, 14346), (7063, 14334), (9276, 14294), (7125, 14373), (7641, 14344), (7059, 14302), (7218, 14354), (7533, 14362), (7054, 14320), (7168, 14395), (7174, 14389), (7062, 14257), (7079, 14251), (9177, 14399)]
         : compromised: 0.5186, honest: 0.5215
Round 010: test acc mean=0.5483 ± 0.0526 | min=0.4923 max=0.6611
         : test loss mean=0.8724 ± 0.3629
         : individual accs = ['0.629567', '0.596488', '0.607388', '0.499402', '0.569111', '0.504070', '0.589851', '0.510395', '0.661117', '0.495373', '0.499094', '0.499021', '0.558451', '0.492411', '0.492318', '0.547551', '0.522065', '0.510556', '0.555891', '0.626155']
         : correct/total = [(8960, 14232), (8491, 14235), (8665, 14266), (7100, 14217), (8103, 14238), (7245, 14373), (8462, 14346), (7316, 14334), (9450, 14294), (7120, 14373), (7159, 14344), (7137, 14302), (8016, 14354), (7072, 14362), (7050, 14320), (7882, 14395), (7512, 14389), (7279, 14257), (7922, 14251), (9016, 14399)]
         : compromised: 0.4982, honest: 0.5539

=== FINAL RESULTS ===
Dataset: sent140, Nodes: 20, Graph: erdos, Aggregation: d-fedavg
Attack: backdoor, 10.0% compromised
Final accuracy - Compromised: 0.4982, Honest: 0.5539
Overall test accuracy: mean=0.5483 ± 0.0526

=== BACKDOOR ATTACK SUCCESS RATE (ASR) ===
Target label: 1
Trigger size: 3x3
Overall ASR: 0.7024 ± 0.3203
Honest nodes ASR: 0.7734 ± 0.2520
Compromised nodes ASR: 0.0634 ± 0.0211
Note: Higher ASR indicates more successful backdoor attack
