Device: cuda
Seed: 987654321
Loading 1 LEAF Sent140 train files...
LEAF Sent140 train: 254555 users, 908652 samples
Building vocabulary (max_size=10000)...
Vocabulary size: 10000
Loading 1 LEAF Sent140 test files...
LEAF Sent140 test: 254555 users, 286281 samples
Found 254555 train users, 254555 test users, 254555 common users
User sample counts range: 494 (max) to 1 (min)
Distributed ALL 254555 users across 20 clients
Users per client: 12727 (with 15 clients getting +1 user)
Train partition sizes: [44353, 44290, 44657, 44907, 44696, 45843, 45801, 45619, 45069, 45639, 45821, 45311, 45779, 46056, 45625, 45984, 46428, 44737, 45540, 46497]
Test partition sizes: [14232, 14235, 14266, 14217, 14238, 14373, 14346, 14334, 14294, 14373, 14344, 14302, 14354, 14362, 14320, 14395, 14389, 14257, 14251, 14399]
  Client 0: 44353 train samples, 2 unique classes
  Client 1: 44290 train samples, 2 unique classes
  Client 2: 44657 train samples, 2 unique classes
  Client 3: 44907 train samples, 2 unique classes
  Client 4: 44696 train samples, 2 unique classes
  Client 5: 45843 train samples, 2 unique classes
  Client 6: 45801 train samples, 2 unique classes
  Client 7: 45619 train samples, 2 unique classes
  Client 8: 45069 train samples, 2 unique classes
  Client 9: 45639 train samples, 2 unique classes
  Client 10: 45821 train samples, 2 unique classes
  Client 11: 45311 train samples, 2 unique classes
  Client 12: 45779 train samples, 2 unique classes
  Client 13: 46056 train samples, 2 unique classes
  Client 14: 45625 train samples, 2 unique classes
  Client 15: 45984 train samples, 2 unique classes
  Client 16: 46428 train samples, 2 unique classes
  Client 17: 44737 train samples, 2 unique classes
  Client 18: 45540 train samples, 2 unique classes
  Client 19: 46497 train samples, 2 unique classes
Will sample 4500 samples per client per epoch
Graph: erdos, nodes: 20, edges: 48
Degree statistics: avg=4.80, min=2, max=7
Attack: Compromised 12/20 nodes: [1, 2, 3, 5, 8, 11, 12, 13, 14, 15, 17, 18]
Attack type: gaussian, lambda: 1.0
Model variant: baseline
Model parameters: 1,174,986
Sketchguard Node 0:
  Model dim: 1,174,986 → Sketch size: 180
  Compression ratio: 6527.7x
  Using model parameters for aggregation, sketches for filtering
Sketchguard Node 1:
  Model dim: 1,174,986 → Sketch size: 180
  Compression ratio: 6527.7x
  Using model parameters for aggregation, sketches for filtering
Sketchguard Node 2:
  Model dim: 1,174,986 → Sketch size: 180
  Compression ratio: 6527.7x
  Using model parameters for aggregation, sketches for filtering
Sketchguard Node 3:
  Model dim: 1,174,986 → Sketch size: 180
  Compression ratio: 6527.7x
  Using model parameters for aggregation, sketches for filtering
Sketchguard Node 4:
  Model dim: 1,174,986 → Sketch size: 180
  Compression ratio: 6527.7x
  Using model parameters for aggregation, sketches for filtering
Sketchguard Node 5:
  Model dim: 1,174,986 → Sketch size: 180
  Compression ratio: 6527.7x
  Using model parameters for aggregation, sketches for filtering
Sketchguard Node 6:
  Model dim: 1,174,986 → Sketch size: 180
  Compression ratio: 6527.7x
  Using model parameters for aggregation, sketches for filtering
Sketchguard Node 7:
  Model dim: 1,174,986 → Sketch size: 180
  Compression ratio: 6527.7x
  Using model parameters for aggregation, sketches for filtering
Sketchguard Node 8:
  Model dim: 1,174,986 → Sketch size: 180
  Compression ratio: 6527.7x
  Using model parameters for aggregation, sketches for filtering
Sketchguard Node 9:
  Model dim: 1,174,986 → Sketch size: 180
  Compression ratio: 6527.7x
  Using model parameters for aggregation, sketches for filtering
Sketchguard Node 10:
  Model dim: 1,174,986 → Sketch size: 180
  Compression ratio: 6527.7x
  Using model parameters for aggregation, sketches for filtering
Sketchguard Node 11:
  Model dim: 1,174,986 → Sketch size: 180
  Compression ratio: 6527.7x
  Using model parameters for aggregation, sketches for filtering
Sketchguard Node 12:
  Model dim: 1,174,986 → Sketch size: 180
  Compression ratio: 6527.7x
  Using model parameters for aggregation, sketches for filtering
Sketchguard Node 13:
  Model dim: 1,174,986 → Sketch size: 180
  Compression ratio: 6527.7x
  Using model parameters for aggregation, sketches for filtering
Sketchguard Node 14:
  Model dim: 1,174,986 → Sketch size: 180
  Compression ratio: 6527.7x
  Using model parameters for aggregation, sketches for filtering
Sketchguard Node 15:
  Model dim: 1,174,986 → Sketch size: 180
  Compression ratio: 6527.7x
  Using model parameters for aggregation, sketches for filtering
Sketchguard Node 16:
  Model dim: 1,174,986 → Sketch size: 180
  Compression ratio: 6527.7x
  Using model parameters for aggregation, sketches for filtering
Sketchguard Node 17:
  Model dim: 1,174,986 → Sketch size: 180
  Compression ratio: 6527.7x
  Using model parameters for aggregation, sketches for filtering
Sketchguard Node 18:
  Model dim: 1,174,986 → Sketch size: 180
  Compression ratio: 6527.7x
  Using model parameters for aggregation, sketches for filtering
Sketchguard Node 19:
  Model dim: 1,174,986 → Sketch size: 180
  Compression ratio: 6527.7x
  Using model parameters for aggregation, sketches for filtering
Sketchguard ALGORITHM (Sketch-based Filtering + State Aggregation)
  - Model dimension: 1,174,986 parameters
  - Config: SketchguardConfig(gamma=2, kappa=1, alpha=0.5, min_neighbors=1, sketch_size=180, network_seed=987654321, attack_detection_window=5)
  - Sketch size: 180
  - Compression ratio: 6527.7x
  - Complexity: O(d + N×k) = O(1,174,986 + 20×180)
  - Theoretical speedup vs BALANCE: 19.9x
Initial test acc across nodes: mean=0.4953 ± 0.0174
Round 001: test acc mean=0.5559 ± 0.0352 | min=0.4889 max=0.6225
         : test loss mean=54.9341 ± 236.4484
         : individual accs = ['0.570334', '0.535090', '0.521169', '0.499543', '0.597907', '0.569749', '0.533389', '0.594112', '0.554289', '0.591526', '0.552705', '0.527758', '0.622475', '0.488859', '0.527025', '0.603960', '0.572938', '0.581188', '0.533647', '0.540038']
         : correct/total = [(8117, 14232), (7617, 14235), (7435, 14266), (7102, 14217), (8513, 14238), (8189, 14373), (7652, 14346), (8516, 14334), (7923, 14294), (8502, 14373), (7928, 14344), (7548, 14302), (8935, 14354), (7021, 14362), (7547, 14320), (8694, 14395), (8244, 14389), (8286, 14257), (7605, 14251), (7776, 14399)]
         : compromised: 0.5471, honest: 0.5691
         : sketchguard stats = ['Node 0: acc_rate=0.500', 'Node 1: acc_rate=0.500', 'Node 2: acc_rate=0.400']...
Round 002: test acc mean=0.6048 ± 0.0435 | min=0.4937 max=0.6519
         : test loss mean=12.8146 ± 52.9502
         : individual accs = ['0.629005', '0.578223', '0.587060', '0.592882', '0.637941', '0.633827', '0.632232', '0.642249', '0.616552', '0.628679', '0.632878', '0.542512', '0.575380', '0.493733', '0.631075', '0.620285', '0.635624', '0.510206', '0.624237', '0.651851']
         : correct/total = [(8952, 14232), (8231, 14235), (8375, 14266), (8429, 14217), (9083, 14238), (9110, 14373), (9070, 14346), (9206, 14334), (8813, 14294), (9036, 14373), (9078, 14344), (7759, 14302), (8259, 14354), (7091, 14362), (9037, 14320), (8929, 14395), (9146, 14389), (7274, 14257), (8896, 14251), (9386, 14399)]
         : compromised: 0.5838, honest: 0.6363
         : sketchguard stats = ['Node 0: acc_rate=0.500', 'Node 1: acc_rate=0.500', 'Node 2: acc_rate=0.400']...
Round 003: test acc mean=0.6127 ± 0.0371 | min=0.5019 max=0.6400
         : test loss mean=19.9514 ± 84.1065
         : individual accs = ['0.631324', '0.620864', '0.631291', '0.633115', '0.639837', '0.628887', '0.618082', '0.636808', '0.639989', '0.637584', '0.616007', '0.548385', '0.604500', '0.501950', '0.636034', '0.544008', '0.631663', '0.589184', '0.631324', '0.633447']
         : correct/total = [(8985, 14232), (8838, 14235), (9006, 14266), (9001, 14217), (9110, 14238), (9039, 14373), (8867, 14346), (9128, 14334), (9148, 14294), (9164, 14373), (8836, 14344), (7843, 14302), (8677, 14354), (7209, 14362), (9108, 14320), (7831, 14395), (9089, 14389), (8400, 14257), (8997, 14251), (9121, 14399)]
         : compromised: 0.6008, honest: 0.6306
         : sketchguard stats = ['Node 0: acc_rate=0.500', 'Node 1: acc_rate=0.444', 'Node 2: acc_rate=0.400']...
Round 004: test acc mean=0.6340 ± 0.0319 | min=0.5045 max=0.6533
         : test loss mean=14.8568 ± 61.9660
         : individual accs = ['0.643831', '0.638778', '0.594490', '0.639657', '0.639205', '0.643568', '0.646940', '0.651877', '0.649363', '0.643707', '0.645427', '0.641239', '0.641912', '0.504526', '0.632542', '0.641334', '0.644451', '0.648664', '0.635043', '0.653309']
         : correct/total = [(9163, 14232), (9093, 14235), (8481, 14266), (9094, 14217), (9101, 14238), (9250, 14373), (9281, 14346), (9344, 14334), (9282, 14294), (9252, 14373), (9258, 14344), (9171, 14302), (9214, 14354), (7246, 14362), (9058, 14320), (9232, 14395), (9273, 14389), (9248, 14257), (9050, 14251), (9407, 14399)]
         : compromised: 0.6259, honest: 0.6461
         : sketchguard stats = ['Node 0: acc_rate=0.500', 'Node 1: acc_rate=0.417', 'Node 2: acc_rate=0.400']...
Round 005: test acc mean=0.6397 ± 0.0338 | min=0.4942 max=0.6551
         : test loss mean=13.1151 ± 54.4097
         : individual accs = ['0.645517', '0.649034', '0.634656', '0.644088', '0.651215', '0.647534', '0.640597', '0.653760', '0.653841', '0.646629', '0.651562', '0.643966', '0.648112', '0.494151', '0.647346', '0.642862', '0.651122', '0.651049', '0.641709', '0.655115']
         : correct/total = [(9187, 14232), (9239, 14235), (9054, 14266), (9157, 14217), (9272, 14238), (9307, 14373), (9190, 14346), (9371, 14334), (9346, 14294), (9294, 14373), (9346, 14344), (9210, 14302), (9303, 14354), (7097, 14362), (9270, 14320), (9254, 14395), (9369, 14389), (9282, 14257), (9145, 14251), (9433, 14399)]
         : compromised: 0.6332, honest: 0.6494
         : sketchguard stats = ['Node 0: acc_rate=0.500', 'Node 1: acc_rate=0.400', 'Node 2: acc_rate=0.400']...
Round 006: test acc mean=0.6409 ± 0.0326 | min=0.5183 max=0.6592
         : test loss mean=9.7834 ± 39.9056
         : individual accs = ['0.653457', '0.656481', '0.635217', '0.649574', '0.648335', '0.650804', '0.646382', '0.659202', '0.659018', '0.650595', '0.653165', '0.580268', '0.659189', '0.518312', '0.653073', '0.645919', '0.646744', '0.654696', '0.641218', '0.655948']
         : correct/total = [(9300, 14232), (9345, 14235), (9062, 14266), (9235, 14217), (9231, 14238), (9354, 14373), (9273, 14346), (9449, 14334), (9420, 14294), (9351, 14373), (9369, 14344), (8299, 14302), (9462, 14354), (7444, 14362), (9352, 14320), (9298, 14395), (9306, 14389), (9334, 14257), (9138, 14251), (9445, 14399)]
         : compromised: 0.6336, honest: 0.6517
         : sketchguard stats = ['Node 0: acc_rate=0.500', 'Node 1: acc_rate=0.389', 'Node 2: acc_rate=0.400']...
Round 007: test acc mean=0.6428 ± 0.0323 | min=0.5086 max=0.6615
         : test loss mean=85.5813 ± 370.3213
         : individual accs = ['0.654441', '0.661538', '0.623651', '0.652458', '0.649389', '0.647116', '0.648822', '0.655714', '0.660767', '0.648021', '0.655047', '0.623969', '0.655148', '0.508634', '0.655098', '0.649601', '0.655292', '0.651820', '0.644095', '0.655601']
         : correct/total = [(9314, 14232), (9417, 14235), (8897, 14266), (9276, 14217), (9246, 14238), (9301, 14373), (9308, 14346), (9399, 14334), (9445, 14294), (9314, 14373), (9396, 14344), (8924, 14302), (9404, 14354), (7305, 14362), (9381, 14320), (9351, 14395), (9429, 14389), (9293, 14257), (9179, 14251), (9440, 14399)]
         : compromised: 0.6362, honest: 0.6528
         : sketchguard stats = ['Node 0: acc_rate=0.500', 'Node 1: acc_rate=0.381', 'Node 2: acc_rate=0.371']...
Round 008: test acc mean=0.6504 ± 0.0336 | min=0.5081 max=0.6662
         : test loss mean=60.3793 ± 260.4908
         : individual accs = ['0.662802', '0.665051', '0.653021', '0.661813', '0.656342', '0.662701', '0.661927', '0.666178', '0.663845', '0.653865', '0.659161', '0.651867', '0.665111', '0.508146', '0.657402', '0.652935', '0.657169', '0.658764', '0.628798', '0.661296']
         : correct/total = [(9433, 14232), (9467, 14235), (9316, 14266), (9409, 14217), (9345, 14238), (9525, 14373), (9496, 14346), (9549, 14334), (9489, 14294), (9398, 14373), (9455, 14344), (9323, 14302), (9547, 14354), (7298, 14362), (9414, 14320), (9399, 14395), (9456, 14389), (9392, 14257), (8961, 14251), (9522, 14399)]
         : compromised: 0.6441, honest: 0.6598
         : sketchguard stats = ['Node 0: acc_rate=0.500', 'Node 1: acc_rate=0.375', 'Node 2: acc_rate=0.350']...
Round 009: test acc mean=0.6467 ± 0.0366 | min=0.4924 max=0.6699
         : test loss mean=111.8773 ± 484.9632
         : individual accs = ['0.646150', '0.669898', '0.651970', '0.651685', '0.657747', '0.666458', '0.634881', '0.659411', '0.645166', '0.632714', '0.653235', '0.658999', '0.662603', '0.492411', '0.666411', '0.658493', '0.658906', '0.655327', '0.653358', '0.658865']
         : correct/total = [(9196, 14232), (9536, 14235), (9301, 14266), (9265, 14217), (9365, 14238), (9579, 14373), (9108, 14346), (9452, 14334), (9222, 14294), (9094, 14373), (9370, 14344), (9425, 14302), (9511, 14354), (7072, 14362), (9543, 14320), (9479, 14395), (9481, 14389), (9343, 14257), (9311, 14251), (9487, 14399)]
         : compromised: 0.6444, honest: 0.6502
         : sketchguard stats = ['Node 0: acc_rate=0.500', 'Node 1: acc_rate=0.370', 'Node 2: acc_rate=0.333']...
Round 010: test acc mean=0.6580 ± 0.0328 | min=0.5172 max=0.6742
         : test loss mean=63.8758 ± 275.7710
         : individual accs = ['0.668423', '0.672778', '0.652601', '0.663290', '0.665754', '0.666667', '0.666458', '0.670783', '0.673080', '0.664579', '0.663065', '0.665641', '0.674167', '0.517198', '0.666690', '0.663494', '0.666829', '0.662692', '0.650551', '0.666227']
         : correct/total = [(9513, 14232), (9577, 14235), (9310, 14266), (9430, 14217), (9479, 14238), (9582, 14373), (9561, 14346), (9615, 14334), (9621, 14294), (9552, 14373), (9511, 14344), (9520, 14302), (9677, 14354), (7428, 14362), (9547, 14320), (9551, 14395), (9595, 14389), (9448, 14257), (9271, 14251), (9593, 14399)]
         : compromised: 0.6524, honest: 0.6665
         : sketchguard stats = ['Node 0: acc_rate=0.500', 'Node 1: acc_rate=0.367', 'Node 2: acc_rate=0.320']...

=== FINAL RESULTS ===
Dataset: sent140, Nodes: 20, Graph: erdos, Aggregation: sketchguard
Attack: gaussian, 60.0% compromised
Final accuracy - Compromised: 0.6524, Honest: 0.6665
Overall test accuracy: mean=0.6580 ± 0.0328

=== Sketchguard SUMMARY ===
Node 0: acceptance=0.500
Node 1: acceptance=0.367
Node 2: acceptance=0.320
Node 3: acceptance=0.500
Node 4: acceptance=0.250
Node 5: acceptance=0.200
Node 6: acceptance=0.200
Node 7: acceptance=0.400
Node 8: acceptance=0.500
Node 9: acceptance=0.333
Node 10: acceptance=0.500
Node 11: acceptance=0.229
Node 12: acceptance=0.471
Node 13: acceptance=0.500
Node 14: acceptance=0.143
Node 15: acceptance=0.217
Node 16: acceptance=0.200
Node 17: acceptance=0.440
Node 18: acceptance=0.250
Node 19: acceptance=0.500

=== PARALLEL EXECUTION TIME (realistic for distributed system) ===
  COMMUNICATION (max across nodes):
    - Sketch transfer: 0.000s (0.0%)
    - Model fetch (accepted): 0.000s (0.0%)
  COMPUTATION (max across nodes):
    - Sketching: 0.239s (94.0%)
    - Filtering: 0.001s (0.3%)
    - Aggregation: 0.014s (5.7%)
  TOTALS:
    - Total computation: 0.254s (100.0%)
    - Total communication: 0.000s (0.0%)
    - Total parallel time: 0.255s

=== PER-NODE AVERAGE TIME ===
  - Sketching: 0.174s
  - Filtering: 0.000s
  - Aggregation: 0.007s
  - Sketch transfer: 0.000s
  - Model fetch: 0.000s
  - Total per node: 0.181s

=== TOTAL COMPUTATIONAL WORK (sum across all nodes) ===
  - Total sketching: 3.482s
  - Total filtering: 0.008s
  - Total aggregation: 0.135s
  - Total sketch transfer: 0.000s
  - Total model fetch: 0.000s
  - Grand total: 3.625s
  - Mean acceptance rate: 0.351

Sketchguard Algorithm Properties:
  - Original dimension: 1,174,986
  - Sketch size: 180
  - Compression ratio: 19.9x
  - Single repetition: No repetitions needed
  - Theoretical complexity: O(d + N×k)
  - Approach: Sketch filtering + state aggregation
