Device: cuda
Seed: 987654321
Loading 1 LEAF Sent140 train files...
LEAF Sent140 train: 254555 users, 908652 samples
Building vocabulary (max_size=10000)...
Vocabulary size: 10000
Loading 1 LEAF Sent140 test files...
LEAF Sent140 test: 254555 users, 286281 samples
Found 254555 train users, 254555 test users, 254555 common users
User sample counts range: 494 (max) to 1 (min)
Distributed ALL 254555 users across 20 clients
Users per client: 12727 (with 15 clients getting +1 user)
Train partition sizes: [44353, 44290, 44657, 44907, 44696, 45843, 45801, 45619, 45069, 45639, 45821, 45311, 45779, 46056, 45625, 45984, 46428, 44737, 45540, 46497]
Test partition sizes: [14232, 14235, 14266, 14217, 14238, 14373, 14346, 14334, 14294, 14373, 14344, 14302, 14354, 14362, 14320, 14395, 14389, 14257, 14251, 14399]
  Client 0: 44353 train samples, 2 unique classes
  Client 1: 44290 train samples, 2 unique classes
  Client 2: 44657 train samples, 2 unique classes
  Client 3: 44907 train samples, 2 unique classes
  Client 4: 44696 train samples, 2 unique classes
  Client 5: 45843 train samples, 2 unique classes
  Client 6: 45801 train samples, 2 unique classes
  Client 7: 45619 train samples, 2 unique classes
  Client 8: 45069 train samples, 2 unique classes
  Client 9: 45639 train samples, 2 unique classes
  Client 10: 45821 train samples, 2 unique classes
  Client 11: 45311 train samples, 2 unique classes
  Client 12: 45779 train samples, 2 unique classes
  Client 13: 46056 train samples, 2 unique classes
  Client 14: 45625 train samples, 2 unique classes
  Client 15: 45984 train samples, 2 unique classes
  Client 16: 46428 train samples, 2 unique classes
  Client 17: 44737 train samples, 2 unique classes
  Client 18: 45540 train samples, 2 unique classes
  Client 19: 46497 train samples, 2 unique classes
Will sample 4500 samples per client per epoch
Graph: erdos, nodes: 20, edges: 48
Degree statistics: avg=4.80, min=2, max=7
Model variant: baseline
Model parameters: 1,174,986
BALANCE algorithm:
Balance Config: BALANCEConfig(gamma=2, kappa=1, alpha=0.5, min_neighbors=1)
  - Model dimension: 1,174,986 parameters
  - Complexity: O(N×d) = O(20×1,174,986)
Initial test acc across nodes: mean=0.4953 ± 0.0174
Round 001: test acc mean=0.5624 ± 0.0370 | min=0.4898 max=0.6301
         : test loss mean=0.6899 ± 0.0008
         : individual accs = ['0.549607', '0.589533', '0.516262', '0.489766', '0.600927', '0.572462', '0.594870', '0.620483', '0.558626', '0.537536', '0.539041', '0.564746', '0.630068', '0.533979', '0.510265', '0.609448', '0.546390', '0.571298', '0.533506', '0.580179']
         : correct/total = [(7822, 14232), (8392, 14235), (7365, 14266), (6963, 14217), (8556, 14238), (8228, 14373), (8534, 14346), (8894, 14334), (7985, 14294), (7726, 14373), (7732, 14344), (8077, 14302), (9044, 14354), (7669, 14362), (7307, 14320), (8773, 14395), (7862, 14389), (8145, 14257), (7603, 14251), (8354, 14399)]
Round 002: test acc mean=0.5836 ± 0.0408 | min=0.4952 max=0.6250
         : test loss mean=0.6874 ± 0.0015
         : individual accs = ['0.589868', '0.617984', '0.600869', '0.600478', '0.596502', '0.618521', '0.622543', '0.624808', '0.591437', '0.548668', '0.622211', '0.536778', '0.506688', '0.567957', '0.495182', '0.598194', '0.514768', '0.624956', '0.574907', '0.618098']
         : correct/total = [(8395, 14232), (8797, 14235), (8572, 14266), (8537, 14217), (8493, 14238), (8890, 14373), (8931, 14346), (8956, 14334), (8454, 14294), (7886, 14373), (8925, 14344), (7677, 14302), (7273, 14354), (8157, 14362), (7091, 14320), (8611, 14395), (7407, 14389), (8910, 14257), (8193, 14251), (8900, 14399)]
Round 003: test acc mean=0.5762 ± 0.0491 | min=0.4953 max=0.6398
         : test loss mean=0.6850 ± 0.0038
         : individual accs = ['0.495292', '0.567685', '0.622739', '0.599634', '0.628529', '0.632088', '0.500000', '0.527836', '0.639779', '0.625130', '0.626813', '0.525521', '0.511286', '0.624565', '0.544344', '0.513373', '0.576065', '0.612611', '0.558627', '0.591291']
         : correct/total = [(7049, 14232), (8081, 14235), (8884, 14266), (8525, 14217), (8949, 14238), (9085, 14373), (7173, 14346), (7566, 14334), (9145, 14294), (8985, 14373), (8991, 14344), (7516, 14302), (7339, 14354), (8970, 14362), (7795, 14320), (7390, 14395), (8289, 14389), (8734, 14257), (7961, 14251), (8514, 14399)]
Round 004: test acc mean=0.6025 ± 0.0302 | min=0.5293 max=0.6404
         : test loss mean=0.6806 ± 0.0048
         : individual accs = ['0.630762', '0.627749', '0.582013', '0.627629', '0.552325', '0.636054', '0.581207', '0.571090', '0.609137', '0.570653', '0.635178', '0.622990', '0.529330', '0.596505', '0.588897', '0.590969', '0.625825', '0.611068', '0.620448', '0.640392']
         : correct/total = [(8977, 14232), (8936, 14235), (8303, 14266), (8923, 14217), (7864, 14238), (9142, 14373), (8338, 14346), (8186, 14334), (8707, 14294), (8202, 14373), (9111, 14344), (8910, 14302), (7598, 14354), (8567, 14362), (8433, 14320), (8507, 14395), (9005, 14389), (8712, 14257), (8842, 14251), (9221, 14399)]
Round 005: test acc mean=0.6230 ± 0.0156 | min=0.5838 max=0.6498
         : test loss mean=0.6744 ± 0.0064
         : individual accs = ['0.613266', '0.635757', '0.633885', '0.618063', '0.609425', '0.625409', '0.635369', '0.626622', '0.643277', '0.599736', '0.608268', '0.637254', '0.613139', '0.622824', '0.635684', '0.622022', '0.583779', '0.634215', '0.612448', '0.649767']
         : correct/total = [(8728, 14232), (9050, 14235), (9043, 14266), (8787, 14217), (8677, 14238), (8989, 14373), (9115, 14346), (8982, 14334), (9195, 14294), (8620, 14373), (8725, 14344), (9114, 14302), (8801, 14354), (8945, 14362), (9103, 14320), (8954, 14395), (8400, 14389), (9042, 14257), (8728, 14251), (9356, 14399)]
Round 006: test acc mean=0.6335 ± 0.0147 | min=0.6032 max=0.6512
         : test loss mean=0.6628 ± 0.0071
         : individual accs = ['0.637156', '0.641658', '0.633885', '0.637758', '0.648827', '0.649690', '0.610205', '0.620901', '0.649433', '0.626244', '0.610290', '0.603202', '0.643514', '0.638421', '0.643017', '0.609656', '0.634860', '0.646840', '0.633219', '0.651156']
         : correct/total = [(9068, 14232), (9134, 14235), (9043, 14266), (9067, 14217), (9238, 14238), (9338, 14373), (8754, 14346), (8900, 14334), (9283, 14294), (9001, 14373), (8754, 14344), (8627, 14302), (9237, 14354), (9169, 14362), (9208, 14320), (8776, 14395), (9135, 14389), (9222, 14257), (9024, 14251), (9376, 14399)]
Round 007: test acc mean=0.6341 ± 0.0202 | min=0.5723 max=0.6542
         : test loss mean=0.6517 ± 0.0084
         : individual accs = ['0.643409', '0.637583', '0.646292', '0.627418', '0.648195', '0.654213', '0.640178', '0.633738', '0.644186', '0.647534', '0.647727', '0.592644', '0.652571', '0.572344', '0.648673', '0.617228', '0.637292', '0.636600', '0.615255', '0.639558']
         : correct/total = [(9157, 14232), (9076, 14235), (9220, 14266), (8920, 14217), (9229, 14238), (9403, 14373), (9184, 14346), (9084, 14334), (9208, 14294), (9307, 14373), (9291, 14344), (8476, 14302), (9367, 14354), (8220, 14362), (9289, 14320), (8885, 14395), (9170, 14389), (9076, 14257), (8768, 14251), (9209, 14399)]
Round 008: test acc mean=0.6468 ± 0.0099 | min=0.6192 max=0.6596
         : test loss mean=0.6387 ± 0.0059
         : individual accs = ['0.641091', '0.619248', '0.639703', '0.655694', '0.648687', '0.647464', '0.652725', '0.641831', '0.658528', '0.651360', '0.656372', '0.654244', '0.642399', '0.629021', '0.651397', '0.648003', '0.651331', '0.650487', '0.636447', '0.659629']
         : correct/total = [(9124, 14232), (8815, 14235), (9126, 14266), (9322, 14217), (9236, 14238), (9306, 14373), (9364, 14346), (9200, 14334), (9413, 14294), (9362, 14373), (9415, 14344), (9357, 14302), (9221, 14354), (9034, 14362), (9328, 14320), (9328, 14395), (9372, 14389), (9274, 14257), (9070, 14251), (9498, 14399)]
Round 009: test acc mean=0.6571 ± 0.0101 | min=0.6249 max=0.6684
         : test loss mean=0.6292 ± 0.0069
         : individual accs = ['0.624859', '0.661890', '0.657017', '0.658437', '0.664138', '0.664162', '0.661648', '0.668411', '0.653911', '0.637167', '0.657069', '0.654454', '0.662533', '0.657360', '0.663059', '0.647516', '0.666134', '0.663744', '0.654621', '0.663657']
         : correct/total = [(8893, 14232), (9422, 14235), (9373, 14266), (9361, 14217), (9456, 14238), (9546, 14373), (9492, 14346), (9581, 14334), (9347, 14294), (9158, 14373), (9425, 14344), (9360, 14302), (9510, 14354), (9441, 14362), (9495, 14320), (9321, 14395), (9585, 14389), (9463, 14257), (9329, 14251), (9556, 14399)]
Round 010: test acc mean=0.6635 ± 0.0097 | min=0.6380 max=0.6743
         : test loss mean=0.6199 ± 0.0064
         : individual accs = ['0.661046', '0.672216', '0.641245', '0.665190', '0.672075', '0.674181', '0.669106', '0.674341', '0.664615', '0.656439', '0.667666', '0.664662', '0.669569', '0.657917', '0.669483', '0.660368', '0.669192', '0.668514', '0.654270', '0.637961']
         : correct/total = [(9408, 14232), (9569, 14235), (9148, 14266), (9457, 14217), (9569, 14238), (9690, 14373), (9599, 14346), (9666, 14334), (9500, 14294), (9435, 14373), (9577, 14344), (9506, 14302), (9611, 14354), (9449, 14362), (9587, 14320), (9506, 14395), (9629, 14389), (9531, 14257), (9324, 14251), (9186, 14399)]

=== FINAL RESULTS ===
Dataset: sent140, Nodes: 20, Graph: erdos, Aggregation: balance
Overall test accuracy: mean=0.6635 ± 0.0097

=== BALANCE SUMMARY ===
Node 0: acceptance=1.000
Node 1: acceptance=1.000
Node 2: acceptance=1.000
Node 3: acceptance=1.000
Node 4: acceptance=1.000
Node 5: acceptance=1.000
Node 6: acceptance=1.000
Node 7: acceptance=1.000
Node 8: acceptance=1.000
Node 9: acceptance=1.000
Node 10: acceptance=1.000
Node 11: acceptance=1.000
Node 12: acceptance=1.000
Node 13: acceptance=1.000
Node 14: acceptance=1.000
Node 15: acceptance=1.000
Node 16: acceptance=1.000
Node 17: acceptance=1.000
Node 18: acceptance=1.000
Node 19: acceptance=1.000

=== PARALLEL EXECUTION TIME (realistic for distributed system) ===
  COMMUNICATION (max across nodes):
    - Full model transfer: 0.000s (0.0%)
  COMPUTATION (max across nodes):
    - Filtering: 0.040s (75.1%)
    - Aggregation: 0.013s (24.9%)
  TOTALS:
    - Total computation: 0.053s (100.0%)
    - Total communication: 0.000s (0.0%)
    - Total parallel time: 0.053s

=== PER-NODE AVERAGE TIME ===
  - Filtering: 0.022s
  - Aggregation: 0.007s
  - Model transfer: 0.000s
  - Total per node: 0.029s

=== TOTAL COMPUTATIONAL WORK (sum across all nodes) ===
  - Total filtering: 0.435s
  - Total aggregation: 0.137s
  - Total model transfer: 0.000s
  - Grand total: 0.573s
  - Mean acceptance rate: 1.000

BALANCE Algorithm Properties:
  - Model dimension: 1,174,986
  - No compression: Full parameter comparison
  - Theoretical complexity: O(deg(i)×d)
  - Approach: Full parameter filtering + averaging
