Device: cuda
Seed: 987654321
Loading 1 LEAF Sent140 train files...
LEAF Sent140 train: 254555 users, 908652 samples
Building vocabulary (max_size=10000)...
Vocabulary size: 10000
Loading 1 LEAF Sent140 test files...
LEAF Sent140 test: 254555 users, 286281 samples
Found 254555 train users, 254555 test users, 254555 common users
User sample counts range: 494 (max) to 1 (min)
Distributed ALL 254555 users across 20 clients
Users per client: 12727 (with 15 clients getting +1 user)
Train partition sizes: [44353, 44290, 44657, 44907, 44696, 45843, 45801, 45619, 45069, 45639, 45821, 45311, 45779, 46056, 45625, 45984, 46428, 44737, 45540, 46497]
Test partition sizes: [14232, 14235, 14266, 14217, 14238, 14373, 14346, 14334, 14294, 14373, 14344, 14302, 14354, 14362, 14320, 14395, 14389, 14257, 14251, 14399]
  Client 0: 44353 train samples, 2 unique classes
  Client 1: 44290 train samples, 2 unique classes
  Client 2: 44657 train samples, 2 unique classes
  Client 3: 44907 train samples, 2 unique classes
  Client 4: 44696 train samples, 2 unique classes
  Client 5: 45843 train samples, 2 unique classes
  Client 6: 45801 train samples, 2 unique classes
  Client 7: 45619 train samples, 2 unique classes
  Client 8: 45069 train samples, 2 unique classes
  Client 9: 45639 train samples, 2 unique classes
  Client 10: 45821 train samples, 2 unique classes
  Client 11: 45311 train samples, 2 unique classes
  Client 12: 45779 train samples, 2 unique classes
  Client 13: 46056 train samples, 2 unique classes
  Client 14: 45625 train samples, 2 unique classes
  Client 15: 45984 train samples, 2 unique classes
  Client 16: 46428 train samples, 2 unique classes
  Client 17: 44737 train samples, 2 unique classes
  Client 18: 45540 train samples, 2 unique classes
  Client 19: 46497 train samples, 2 unique classes
Will sample 4500 samples per client per epoch
Graph: erdos, nodes: 20, edges: 126
Degree statistics: avg=12.60, min=8, max=16
Attack: Compromised 4/20 nodes: [5, 12, 13, 17]
Attack type: backdoor, lambda: 1.0
Backdoor target label: 1, trigger size: 3
Model variant: baseline
Model parameters: 1,174,986
Initial test acc across nodes: mean=0.4953 ± 0.0174
Backdoor attack: Created poisoned datasets for 4 compromised nodes
Round 001: test acc mean=0.5007 ± 0.0082 | min=0.4865 max=0.5172
         : test loss mean=1.2509 ± 0.7039
         : individual accs = ['0.508783', '0.500246', '0.517244', '0.516705', '0.486515', '0.488625', '0.500000', '0.506697', '0.504058', '0.495234', '0.500906', '0.490631', '0.499373', '0.490391', '0.500838', '0.502744', '0.494683', '0.501789', '0.509227', '0.498785']
         : correct/total = [(7241, 14232), (7121, 14235), (7379, 14266), (7346, 14217), (6927, 14238), (7023, 14373), (7173, 14346), (7263, 14334), (7205, 14294), (7118, 14373), (7185, 14344), (7017, 14302), (7168, 14354), (7043, 14362), (7172, 14320), (7237, 14395), (7118, 14389), (7154, 14257), (7257, 14251), (7182, 14399)]
         : compromised: 0.4950, honest: 0.5021
Round 002: test acc mean=0.4904 ± 0.0086 | min=0.4770 max=0.5073
         : test loss mean=1.0282 ± 0.2816
         : individual accs = ['0.482434', '0.485002', '0.487383', '0.486038', '0.482722', '0.487163', '0.481946', '0.486536', '0.493494', '0.501705', '0.498466', '0.483709', '0.498537', '0.507311', '0.491341', '0.494825', '0.477031', '0.499895', '0.503263', '0.478575']
         : correct/total = [(6866, 14232), (6904, 14235), (6953, 14266), (6910, 14217), (6873, 14238), (7002, 14373), (6914, 14346), (6974, 14334), (7054, 14294), (7211, 14373), (7150, 14344), (6918, 14302), (7156, 14354), (7286, 14362), (7036, 14320), (7123, 14395), (6864, 14389), (7127, 14257), (7172, 14251), (6891, 14399)]
         : compromised: 0.4982, honest: 0.4884
Round 003: test acc mean=0.4973 ± 0.0091 | min=0.4792 max=0.5106
         : test loss mean=0.8151 ± 0.0655
         : individual accs = ['0.496206', '0.503969', '0.479181', '0.487445', '0.487007', '0.510610', '0.498885', '0.507116', '0.496222', '0.503583', '0.495608', '0.504964', '0.479657', '0.488372', '0.505587', '0.488920', '0.506081', '0.503051', '0.499474', '0.503577']
         : correct/total = [(7062, 14232), (7174, 14235), (6836, 14266), (6930, 14217), (6934, 14238), (7339, 14373), (7157, 14346), (7269, 14334), (7093, 14294), (7238, 14373), (7109, 14344), (7222, 14302), (6885, 14354), (7014, 14362), (7240, 14320), (7038, 14395), (7282, 14389), (7172, 14257), (7118, 14251), (7251, 14399)]
         : compromised: 0.4954, honest: 0.4977
Round 004: test acc mean=0.5056 ± 0.0068 | min=0.4928 max=0.5173
         : test loss mean=1.1315 ± 0.2621
         : individual accs = ['0.508502', '0.501791', '0.513388', '0.499754', '0.510254', '0.492799', '0.497072', '0.499093', '0.502519', '0.506088', '0.507041', '0.503007', '0.517277', '0.516641', '0.497137', '0.510594', '0.500174', '0.515466', '0.508736', '0.505174']
         : correct/total = [(7237, 14232), (7143, 14235), (7324, 14266), (7105, 14217), (7265, 14238), (7083, 14373), (7131, 14346), (7154, 14334), (7183, 14294), (7274, 14373), (7273, 14344), (7194, 14302), (7425, 14354), (7420, 14362), (7119, 14320), (7350, 14395), (7197, 14389), (7349, 14257), (7250, 14251), (7274, 14399)]
         : compromised: 0.5105, honest: 0.5044
Round 005: test acc mean=0.4980 ± 0.0139 | min=0.4739 max=0.5217
         : test loss mean=0.7404 ± 0.0545
         : individual accs = ['0.517215', '0.515068', '0.473924', '0.484701', '0.506532', '0.489459', '0.499512', '0.485908', '0.477123', '0.498435', '0.498815', '0.483569', '0.503414', '0.507868', '0.482682', '0.521709', '0.487873', '0.515536', '0.511192', '0.498646']
         : correct/total = [(7361, 14232), (7332, 14235), (6761, 14266), (6891, 14217), (7212, 14238), (7035, 14373), (7166, 14346), (6965, 14334), (6820, 14294), (7164, 14373), (7155, 14344), (6916, 14302), (7226, 14354), (7294, 14362), (6912, 14320), (7510, 14395), (7020, 14389), (7350, 14257), (7285, 14251), (7180, 14399)]
         : compromised: 0.5041, honest: 0.4964
Round 006: test acc mean=0.4947 ± 0.0049 | min=0.4830 max=0.5022
         : test loss mean=2.0713 ± 0.6284
         : individual accs = ['0.492341', '0.483035', '0.486892', '0.484912', '0.494241', '0.496626', '0.499721', '0.493163', '0.497132', '0.500661', '0.498885', '0.493777', '0.496865', '0.502158', '0.492877', '0.497881', '0.492668', '0.496318', '0.495965', '0.498229']
         : correct/total = [(7007, 14232), (6876, 14235), (6946, 14266), (6894, 14217), (7037, 14238), (7138, 14373), (7169, 14346), (7069, 14334), (7106, 14294), (7196, 14373), (7156, 14344), (7062, 14302), (7132, 14354), (7212, 14362), (7058, 14320), (7167, 14395), (7089, 14389), (7076, 14257), (7068, 14251), (7174, 14399)]
         : compromised: 0.4980, honest: 0.4939
Round 007: test acc mean=0.4950 ± 0.0053 | min=0.4831 max=0.5068
         : test loss mean=1.2976 ± 0.5867
         : individual accs = ['0.492693', '0.483105', '0.490116', '0.484842', '0.496207', '0.495860', '0.499791', '0.492396', '0.498181', '0.493564', '0.498397', '0.494057', '0.502856', '0.506824', '0.492598', '0.497742', '0.492529', '0.495055', '0.495614', '0.498090']
         : correct/total = [(7012, 14232), (6877, 14235), (6992, 14266), (6893, 14217), (7065, 14238), (7127, 14373), (7170, 14346), (7058, 14334), (7121, 14294), (7094, 14373), (7149, 14344), (7066, 14302), (7218, 14354), (7279, 14362), (7054, 14320), (7165, 14395), (7087, 14389), (7058, 14257), (7063, 14251), (7172, 14399)]
         : compromised: 0.5001, honest: 0.4937
Round 008: test acc mean=0.5038 ± 0.0068 | min=0.4932 max=0.5151
         : test loss mean=1.2371 ± 0.3047
         : individual accs = ['0.503162', '0.514577', '0.512617', '0.515088', '0.505197', '0.500383', '0.496027', '0.510883', '0.496502', '0.504766', '0.499024', '0.507342', '0.495541', '0.493176', '0.505377', '0.499132', '0.512475', '0.509224', '0.498562', '0.496493']
         : correct/total = [(7161, 14232), (7325, 14235), (7313, 14266), (7323, 14217), (7193, 14238), (7192, 14373), (7116, 14346), (7323, 14334), (7097, 14294), (7255, 14373), (7158, 14344), (7256, 14302), (7113, 14354), (7083, 14362), (7237, 14320), (7185, 14395), (7374, 14389), (7260, 14257), (7105, 14251), (7149, 14399)]
         : compromised: 0.4996, honest: 0.5048
Round 009: test acc mean=0.5051 ± 0.0055 | min=0.4932 max=0.5170
         : test loss mean=2.1320 ± 0.4988
         : individual accs = ['0.507378', '0.516965', '0.513038', '0.515088', '0.505478', '0.504140', '0.500209', '0.507255', '0.501819', '0.504766', '0.501603', '0.506153', '0.497144', '0.493176', '0.507402', '0.502258', '0.507471', '0.504664', '0.504386', '0.501910']
         : correct/total = [(7221, 14232), (7359, 14235), (7319, 14266), (7323, 14217), (7197, 14238), (7246, 14373), (7176, 14346), (7271, 14334), (7173, 14294), (7255, 14373), (7195, 14344), (7239, 14302), (7136, 14354), (7083, 14362), (7266, 14320), (7230, 14395), (7302, 14389), (7195, 14257), (7188, 14251), (7227, 14399)]
         : compromised: 0.4998, honest: 0.5064
Round 010: test acc mean=0.5051 ± 0.0055 | min=0.4932 max=0.5170
         : test loss mean=3.5938 ± 1.6058
         : individual accs = ['0.507378', '0.516965', '0.513038', '0.515088', '0.504846', '0.503305', '0.501324', '0.508302', '0.502379', '0.504766', '0.500697', '0.506642', '0.497144', '0.493176', '0.506355', '0.502327', '0.507123', '0.504945', '0.504666', '0.501979']
         : correct/total = [(7221, 14232), (7359, 14235), (7319, 14266), (7323, 14217), (7188, 14238), (7234, 14373), (7192, 14346), (7286, 14334), (7181, 14294), (7255, 14373), (7182, 14344), (7246, 14302), (7136, 14354), (7083, 14362), (7251, 14320), (7231, 14395), (7297, 14389), (7199, 14257), (7192, 14251), (7228, 14399)]
         : compromised: 0.4996, honest: 0.5065

=== FINAL RESULTS ===
Dataset: sent140, Nodes: 20, Graph: erdos, Aggregation: d-fedavg
Attack: backdoor, 20.0% compromised
Final accuracy - Compromised: 0.4996, Honest: 0.5065
Overall test accuracy: mean=0.5051 ± 0.0055

=== BACKDOOR ATTACK SUCCESS RATE (ASR) ===
Target label: 1
Trigger size: 3x3
Overall ASR: 0.0060 ± 0.0121
Honest nodes ASR: 0.0071 ± 0.0132
Compromised nodes ASR: 0.0016 ± 0.0026
Note: Higher ASR indicates more successful backdoor attack
