Device: cuda
Seed: 987654321
Loading 1 LEAF Sent140 train files...
LEAF Sent140 train: 254555 users, 908652 samples
Building vocabulary (max_size=10000)...
Vocabulary size: 10000
Loading 1 LEAF Sent140 test files...
LEAF Sent140 test: 254555 users, 286281 samples
Found 254555 train users, 254555 test users, 254555 common users
User sample counts range: 494 (max) to 1 (min)
Distributed ALL 254555 users across 20 clients
Users per client: 12727 (with 15 clients getting +1 user)
Train partition sizes: [44353, 44290, 44657, 44907, 44696, 45843, 45801, 45619, 45069, 45639, 45821, 45311, 45779, 46056, 45625, 45984, 46428, 44737, 45540, 46497]
Test partition sizes: [14232, 14235, 14266, 14217, 14238, 14373, 14346, 14334, 14294, 14373, 14344, 14302, 14354, 14362, 14320, 14395, 14389, 14257, 14251, 14399]
  Client 0: 44353 train samples, 2 unique classes
  Client 1: 44290 train samples, 2 unique classes
  Client 2: 44657 train samples, 2 unique classes
  Client 3: 44907 train samples, 2 unique classes
  Client 4: 44696 train samples, 2 unique classes
  Client 5: 45843 train samples, 2 unique classes
  Client 6: 45801 train samples, 2 unique classes
  Client 7: 45619 train samples, 2 unique classes
  Client 8: 45069 train samples, 2 unique classes
  Client 9: 45639 train samples, 2 unique classes
  Client 10: 45821 train samples, 2 unique classes
  Client 11: 45311 train samples, 2 unique classes
  Client 12: 45779 train samples, 2 unique classes
  Client 13: 46056 train samples, 2 unique classes
  Client 14: 45625 train samples, 2 unique classes
  Client 15: 45984 train samples, 2 unique classes
  Client 16: 46428 train samples, 2 unique classes
  Client 17: 44737 train samples, 2 unique classes
  Client 18: 45540 train samples, 2 unique classes
  Client 19: 46497 train samples, 2 unique classes
Will sample 4500 samples per client per epoch
Graph: ring, nodes: 20, edges: 20
Degree statistics: avg=2.00, min=2, max=2
Attack: Compromised 16/20 nodes: [1, 2, 3, 5, 6, 8, 9, 10, 11, 12, 13, 14, 15, 17, 18, 19]
Attack type: backdoor, lambda: 1.0
Backdoor target label: 1, trigger size: 3
Model variant: baseline
Model parameters: 1,174,986
BALANCE algorithm:
Balance Config: BALANCEConfig(gamma=2, kappa=1, alpha=0.5, min_neighbors=1)
  - Model dimension: 1,174,986 parameters
  - Complexity: O(N×d) = O(20×1,174,986)
Initial test acc across nodes: mean=0.4953 ± 0.0174
Backdoor attack: Created poisoned datasets for 16 compromised nodes
Round 001: test acc mean=0.5006 ± 0.0078 | min=0.4888 max=0.5142
         : test loss mean=49.7196 ± 28.7778
         : individual accs = ['0.494519', '0.501791', '0.488785', '0.513399', '0.494522', '0.514158', '0.510316', '0.492745', '0.509864', '0.499269', '0.502719', '0.489302', '0.502996', '0.510792', '0.497067', '0.498645', '0.492182', '0.497159', '0.495334', '0.506910']
         : correct/total = [(7038, 14232), (7143, 14235), (6973, 14266), (7299, 14217), (7041, 14238), (7390, 14373), (7321, 14346), (7063, 14334), (7288, 14294), (7176, 14373), (7211, 14344), (6998, 14302), (7220, 14354), (7336, 14362), (7118, 14320), (7178, 14395), (7082, 14389), (7088, 14257), (7059, 14251), (7299, 14399)]
         : compromised: 0.5024, honest: 0.4935
Round 002: test acc mean=0.5049 ± 0.0055 | min=0.4934 max=0.5156
         : test loss mean=1821.4080 ± 1046.5063
         : individual accs = ['0.507237', '0.515560', '0.513038', '0.515228', '0.505478', '0.504766', '0.500209', '0.507465', '0.501679', '0.504766', '0.501534', '0.506153', '0.497144', '0.493385', '0.507402', '0.499410', '0.507471', '0.504314', '0.504386', '0.500799']
         : correct/total = [(7219, 14232), (7339, 14235), (7319, 14266), (7325, 14217), (7197, 14238), (7255, 14373), (7176, 14346), (7274, 14334), (7171, 14294), (7255, 14373), (7194, 14344), (7239, 14302), (7136, 14354), (7086, 14362), (7266, 14320), (7189, 14395), (7302, 14389), (7190, 14257), (7188, 14251), (7211, 14399)]
         : compromised: 0.5044, honest: 0.5069
Round 003: test acc mean=0.4953 ± 0.0054 | min=0.4830 max=0.5068
         : test loss mean=207108.9900 ± 198814.7984
         : individual accs = ['0.494028', '0.483035', '0.486962', '0.485194', '0.494662', '0.497600', '0.499861', '0.494489', '0.498111', '0.494747', '0.497002', '0.494197', '0.502856', '0.506824', '0.492179', '0.497603', '0.495865', '0.495265', '0.497018', '0.498090']
         : correct/total = [(7031, 14232), (6876, 14235), (6947, 14266), (6898, 14217), (7043, 14238), (7152, 14373), (7171, 14346), (7088, 14334), (7120, 14294), (7111, 14373), (7129, 14344), (7068, 14302), (7218, 14354), (7279, 14362), (7048, 14320), (7163, 14395), (7135, 14389), (7061, 14257), (7083, 14251), (7172, 14399)]
         : compromised: 0.4954, honest: 0.4948
Round 004: test acc mean=0.5022 ± 0.0070 | min=0.4924 max=0.5170
         : test loss mean=22260452.6638 ± 13997693.4726
         : individual accs = ['0.492622', '0.517035', '0.510374', '0.515088', '0.494381', '0.504140', '0.500209', '0.492675', '0.502588', '0.504766', '0.501603', '0.506013', '0.497144', '0.492411', '0.507402', '0.502258', '0.492529', '0.504664', '0.504386', '0.501910']
         : correct/total = [(7011, 14232), (7360, 14235), (7281, 14266), (7323, 14217), (7039, 14238), (7246, 14373), (7176, 14346), (7062, 14334), (7184, 14294), (7255, 14373), (7195, 14344), (7237, 14302), (7136, 14354), (7072, 14362), (7266, 14320), (7230, 14395), (7087, 14389), (7195, 14257), (7188, 14251), (7227, 14399)]
         : compromised: 0.5045, honest: 0.4931
Round 005: test acc mean=0.4950 ± 0.0054 | min=0.4830 max=0.5068
         : test loss mean=1893657693.8292 ± 1168648437.4684
         : individual accs = ['0.492552', '0.483035', '0.486962', '0.484912', '0.495013', '0.495860', '0.499791', '0.493582', '0.498181', '0.495234', '0.498397', '0.493847', '0.502856', '0.506824', '0.492598', '0.497742', '0.493780', '0.495336', '0.495614', '0.498090']
         : correct/total = [(7010, 14232), (6876, 14235), (6947, 14266), (6894, 14217), (7048, 14238), (7127, 14373), (7170, 14346), (7075, 14334), (7121, 14294), (7118, 14373), (7149, 14344), (7063, 14302), (7218, 14354), (7279, 14362), (7054, 14320), (7165, 14395), (7105, 14389), (7062, 14257), (7063, 14251), (7172, 14399)]
         : compromised: 0.4953, honest: 0.4937
Round 006: test acc mean=0.5049 ± 0.0054 | min=0.4932 max=0.5170
         : test loss mean=210368302136.9748 ± 116581536035.2770
         : individual accs = ['0.506816', '0.516965', '0.513038', '0.515088', '0.504214', '0.504140', '0.500209', '0.506139', '0.501819', '0.504766', '0.501603', '0.506153', '0.497144', '0.493176', '0.507402', '0.502258', '0.506081', '0.504664', '0.504386', '0.501910']
         : correct/total = [(7213, 14232), (7359, 14235), (7319, 14266), (7323, 14217), (7179, 14238), (7246, 14373), (7176, 14346), (7255, 14334), (7173, 14294), (7255, 14373), (7195, 14344), (7239, 14302), (7136, 14354), (7083, 14362), (7266, 14320), (7230, 14395), (7282, 14389), (7195, 14257), (7188, 14251), (7227, 14399)]
         : compromised: 0.5047, honest: 0.5058
Round 007: test acc mean=0.4949 ± 0.0055 | min=0.4830 max=0.5068
         : test loss mean=16706401118875.0508 ± 7886406268295.8154
         : individual accs = ['0.492974', '0.483035', '0.486962', '0.484912', '0.494311', '0.495860', '0.499791', '0.493024', '0.498181', '0.495234', '0.498327', '0.493847', '0.502856', '0.506824', '0.492598', '0.497742', '0.492182', '0.495336', '0.495614', '0.498090']
         : correct/total = [(7016, 14232), (6876, 14235), (6947, 14266), (6894, 14217), (7038, 14238), (7127, 14373), (7170, 14346), (7067, 14334), (7121, 14294), (7118, 14373), (7148, 14344), (7063, 14302), (7218, 14354), (7279, 14362), (7054, 14320), (7165, 14395), (7082, 14389), (7062, 14257), (7063, 14251), (7172, 14399)]
         : compromised: 0.4953, honest: 0.4931
Round 008: test acc mean=0.5049 ± 0.0055 | min=0.4932 max=0.5170
         : test loss mean=1768055387426164.5000 ± 938182277484967.1250
         : individual accs = ['0.507940', '0.516965', '0.513038', '0.515088', '0.503863', '0.504140', '0.500209', '0.507255', '0.501819', '0.504627', '0.501534', '0.506013', '0.497144', '0.493176', '0.507402', '0.502258', '0.505456', '0.504664', '0.504386', '0.501910']
         : correct/total = [(7229, 14232), (7359, 14235), (7319, 14266), (7323, 14217), (7174, 14238), (7246, 14373), (7176, 14346), (7271, 14334), (7173, 14294), (7253, 14373), (7194, 14344), (7237, 14302), (7136, 14354), (7083, 14362), (7266, 14320), (7230, 14395), (7273, 14389), (7195, 14257), (7188, 14251), (7227, 14399)]
         : compromised: 0.5046, honest: 0.5061
Round 009: test acc mean=0.4949 ± 0.0054 | min=0.4830 max=0.5069
         : test loss mean=136926974542224304.0000 ± 74238673451340320.0000
         : individual accs = ['0.492763', '0.483035', '0.487172', '0.484912', '0.494873', '0.495860', '0.499791', '0.493024', '0.498181', '0.495165', '0.498397', '0.493707', '0.502856', '0.506893', '0.492807', '0.497742', '0.492807', '0.495336', '0.495544', '0.498090']
         : correct/total = [(7013, 14232), (6876, 14235), (6950, 14266), (6894, 14217), (7046, 14238), (7127, 14373), (7170, 14346), (7067, 14334), (7121, 14294), (7117, 14373), (7149, 14344), (7061, 14302), (7218, 14354), (7280, 14362), (7057, 14320), (7165, 14395), (7091, 14389), (7062, 14257), (7062, 14251), (7172, 14399)]
         : compromised: 0.4953, honest: 0.4934
Round 010: test acc mean=0.5066 ± 0.0065 | min=0.4942 max=0.5185
         : test loss mean=13172238648896796672.0000 ± 9879386238745384960.0000
         : individual accs = ['0.509064', '0.516965', '0.513599', '0.515088', '0.515381', '0.504140', '0.500209', '0.507814', '0.501819', '0.504975', '0.501534', '0.511117', '0.498328', '0.494221', '0.507193', '0.502258', '0.518452', '0.504664', '0.504105', '0.501910']
         : correct/total = [(7245, 14232), (7359, 14235), (7327, 14266), (7323, 14217), (7338, 14238), (7246, 14373), (7176, 14346), (7279, 14334), (7173, 14294), (7258, 14373), (7194, 14344), (7310, 14302), (7153, 14354), (7098, 14362), (7263, 14320), (7230, 14395), (7460, 14389), (7195, 14257), (7184, 14251), (7227, 14399)]
         : compromised: 0.5051, honest: 0.5127

=== FINAL RESULTS ===
Dataset: sent140, Nodes: 20, Graph: ring, Aggregation: balance
Attack: backdoor, 80.0% compromised
Final accuracy - Compromised: 0.5051, Honest: 0.5127
Overall test accuracy: mean=0.5066 ± 0.0065

=== BACKDOOR ATTACK SUCCESS RATE (ASR) ===
Target label: 1
Trigger size: 3x3
Overall ASR: 0.1848 ± 0.2168
Honest nodes ASR: 0.3177 ± 0.0064
Compromised nodes ASR: 0.1516 ± 0.2307
Note: Higher ASR indicates more successful backdoor attack

=== BALANCE SUMMARY ===
Node 0: acceptance=0.400
Node 1: acceptance=0.600
Node 2: acceptance=0.400
Node 3: acceptance=0.600
Node 4: acceptance=0.400
Node 5: acceptance=0.600
Node 6: acceptance=0.700
Node 7: acceptance=0.400
Node 8: acceptance=0.600
Node 9: acceptance=0.400
Node 10: acceptance=0.400
Node 11: acceptance=0.400
Node 12: acceptance=0.400
Node 13: acceptance=0.400
Node 14: acceptance=0.400
Node 15: acceptance=0.600
Node 16: acceptance=0.400
Node 17: acceptance=0.600
Node 18: acceptance=0.400
Node 19: acceptance=0.600

=== PARALLEL EXECUTION TIME (realistic for distributed system) ===
  COMMUNICATION (max across nodes):
    - Full model transfer: 0.000s (0.1%)
  COMPUTATION (max across nodes):
    - Filtering: 0.012s (52.7%)
    - Aggregation: 0.011s (47.2%)
  TOTALS:
    - Total computation: 0.022s (99.9%)
    - Total communication: 0.000s (0.1%)
    - Total parallel time: 0.023s

=== PER-NODE AVERAGE TIME ===
  - Filtering: 0.011s
  - Aggregation: 0.005s
  - Model transfer: 0.000s
  - Total per node: 0.016s

=== TOTAL COMPUTATIONAL WORK (sum across all nodes) ===
  - Total filtering: 0.218s
  - Total aggregation: 0.097s
  - Total model transfer: 0.000s
  - Grand total: 0.315s
  - Mean acceptance rate: 0.485

BALANCE Algorithm Properties:
  - Model dimension: 1,174,986
  - No compression: Full parameter comparison
  - Theoretical complexity: O(deg(i)×d)
  - Approach: Full parameter filtering + averaging
