Device: cuda
Seed: 987654321
Loading 1 LEAF Sent140 train files...
LEAF Sent140 train: 254555 users, 908652 samples
Building vocabulary (max_size=10000)...
Vocabulary size: 10000
Loading 1 LEAF Sent140 test files...
LEAF Sent140 test: 254555 users, 286281 samples
Found 254555 train users, 254555 test users, 254555 common users
User sample counts range: 494 (max) to 1 (min)
Distributed ALL 254555 users across 20 clients
Users per client: 12727 (with 15 clients getting +1 user)
Train partition sizes: [44353, 44290, 44657, 44907, 44696, 45843, 45801, 45619, 45069, 45639, 45821, 45311, 45779, 46056, 45625, 45984, 46428, 44737, 45540, 46497]
Test partition sizes: [14232, 14235, 14266, 14217, 14238, 14373, 14346, 14334, 14294, 14373, 14344, 14302, 14354, 14362, 14320, 14395, 14389, 14257, 14251, 14399]
  Client 0: 44353 train samples, 2 unique classes
  Client 1: 44290 train samples, 2 unique classes
  Client 2: 44657 train samples, 2 unique classes
  Client 3: 44907 train samples, 2 unique classes
  Client 4: 44696 train samples, 2 unique classes
  Client 5: 45843 train samples, 2 unique classes
  Client 6: 45801 train samples, 2 unique classes
  Client 7: 45619 train samples, 2 unique classes
  Client 8: 45069 train samples, 2 unique classes
  Client 9: 45639 train samples, 2 unique classes
  Client 10: 45821 train samples, 2 unique classes
  Client 11: 45311 train samples, 2 unique classes
  Client 12: 45779 train samples, 2 unique classes
  Client 13: 46056 train samples, 2 unique classes
  Client 14: 45625 train samples, 2 unique classes
  Client 15: 45984 train samples, 2 unique classes
  Client 16: 46428 train samples, 2 unique classes
  Client 17: 44737 train samples, 2 unique classes
  Client 18: 45540 train samples, 2 unique classes
  Client 19: 46497 train samples, 2 unique classes
Will sample 4500 samples per client per epoch
Graph: erdos, nodes: 20, edges: 126
Degree statistics: avg=12.60, min=8, max=16
Attack: Compromised 16/20 nodes: [1, 2, 3, 5, 6, 8, 9, 10, 11, 12, 13, 14, 15, 17, 18, 19]
Attack type: backdoor, lambda: 1.0
Backdoor target label: 1, trigger size: 3
Model variant: baseline
Model parameters: 1,174,986
BALANCE algorithm:
Balance Config: BALANCEConfig(gamma=2, kappa=1, alpha=0.5, min_neighbors=1)
  - Model dimension: 1,174,986 parameters
  - Complexity: O(N×d) = O(20×1,174,986)
Initial test acc across nodes: mean=0.4953 ± 0.0174
Backdoor attack: Created poisoned datasets for 16 compromised nodes
Round 001: test acc mean=0.5007 ± 0.0062 | min=0.4910 max=0.5139
         : test loss mean=39.1481 ± 20.5616
         : individual accs = ['0.501897', '0.510221', '0.491518', '0.496518', '0.491010', '0.500731', '0.491705', '0.501186', '0.498951', '0.500800', '0.504322', '0.500839', '0.511286', '0.513856', '0.492668', '0.500729', '0.501911', '0.499474', '0.499544', '0.505521']
         : correct/total = [(7143, 14232), (7263, 14235), (7012, 14266), (7059, 14217), (6991, 14238), (7197, 14373), (7054, 14346), (7184, 14334), (7132, 14294), (7198, 14373), (7234, 14344), (7163, 14302), (7339, 14354), (7380, 14362), (7055, 14320), (7208, 14395), (7222, 14389), (7121, 14257), (7119, 14251), (7279, 14399)]
         : compromised: 0.5012, honest: 0.4990
Round 002: test acc mean=0.5045 ± 0.0070 | min=0.4903 max=0.5168
         : test loss mean=818.5923 ± 451.2118
         : individual accs = ['0.515037', '0.516754', '0.513949', '0.513399', '0.490308', '0.502957', '0.500139', '0.513674', '0.500420', '0.505114', '0.501673', '0.504545', '0.497422', '0.494708', '0.502863', '0.502049', '0.510668', '0.505015', '0.500105', '0.500174']
         : correct/total = [(7330, 14232), (7356, 14235), (7332, 14266), (7299, 14217), (6981, 14238), (7229, 14373), (7175, 14346), (7363, 14334), (7153, 14294), (7260, 14373), (7196, 14344), (7216, 14302), (7140, 14354), (7105, 14362), (7201, 14320), (7227, 14395), (7348, 14389), (7200, 14257), (7127, 14251), (7202, 14399)]
         : compromised: 0.5038, honest: 0.5074
Round 003: test acc mean=0.4996 ± 0.0101 | min=0.4867 max=0.5314
         : test loss mean=22209.7804 ± 14962.6546
         : individual accs = ['0.516301', '0.489568', '0.494252', '0.487867', '0.497050', '0.496278', '0.499373', '0.489675', '0.506856', '0.503931', '0.501882', '0.503146', '0.501602', '0.501184', '0.486732', '0.499479', '0.531448', '0.494494', '0.491965', '0.498854']
         : correct/total = [(7348, 14232), (6969, 14235), (7051, 14266), (6936, 14217), (7077, 14238), (7133, 14373), (7164, 14346), (7019, 14334), (7245, 14294), (7243, 14373), (7199, 14344), (7196, 14302), (7200, 14354), (7198, 14362), (6970, 14320), (7190, 14395), (7647, 14389), (7050, 14257), (7011, 14251), (7183, 14399)]
         : compromised: 0.4973, honest: 0.5086
Round 004: test acc mean=0.5159 ± 0.0305 | min=0.4889 max=0.5827
         : test loss mean=6302424.9248 ± 4709312.2705
         : individual accs = ['0.570194', '0.514787', '0.514440', '0.490751', '0.582385', '0.494330', '0.501255', '0.563276', '0.496502', '0.504627', '0.500488', '0.498042', '0.515257', '0.488859', '0.496578', '0.498576', '0.582737', '0.510276', '0.501649', '0.492743']
         : correct/total = [(8115, 14232), (7328, 14235), (7339, 14266), (6977, 14217), (8292, 14238), (7105, 14373), (7191, 14346), (8074, 14334), (7097, 14294), (7253, 14373), (7179, 14344), (7123, 14302), (7396, 14354), (7021, 14362), (7111, 14320), (7177, 14395), (8385, 14389), (7275, 14257), (7149, 14251), (7095, 14399)]
         : compromised: 0.5012, honest: 0.5746
Round 005: test acc mean=0.5210 ± 0.0457 | min=0.4848 max=0.6175
         : test loss mean=96686571.1384 ± 70827971.4343
         : individual accs = ['0.608980', '0.495118', '0.493131', '0.484772', '0.617502', '0.495304', '0.501115', '0.614623', '0.502379', '0.503235', '0.508575', '0.504265', '0.495402', '0.498468', '0.506355', '0.499757', '0.605393', '0.498211', '0.496106', '0.490867']
         : correct/total = [(8667, 14232), (7048, 14235), (7035, 14266), (6892, 14217), (8792, 14238), (7119, 14373), (7189, 14346), (8810, 14334), (7181, 14294), (7233, 14373), (7295, 14344), (7212, 14302), (7111, 14354), (7159, 14362), (7251, 14320), (7194, 14395), (8711, 14389), (7103, 14257), (7070, 14251), (7068, 14399)]
         : compromised: 0.4983, honest: 0.6116
Round 006: test acc mean=0.5267 ± 0.0471 | min=0.4927 max=0.6292
         : test loss mean=14227277242.9212 ± 9746694668.7114
         : individual accs = ['0.617130', '0.519073', '0.513459', '0.511922', '0.627827', '0.499826', '0.501255', '0.629203', '0.502519', '0.503722', '0.501464', '0.512096', '0.493521', '0.493176', '0.502654', '0.492741', '0.604142', '0.503472', '0.503193', '0.501076']
         : correct/total = [(8783, 14232), (7389, 14235), (7325, 14266), (7278, 14217), (8939, 14238), (7184, 14373), (7191, 14346), (9019, 14334), (7183, 14294), (7240, 14373), (7193, 14344), (7324, 14302), (7084, 14354), (7083, 14362), (7198, 14320), (7093, 14395), (8693, 14389), (7178, 14257), (7171, 14251), (7215, 14399)]
         : compromised: 0.5034, honest: 0.6196
Round 007: test acc mean=0.5290 ± 0.0566 | min=0.4842 max=0.6432
         : test loss mean=794807727740.9231 ± 526282482541.1243
         : individual accs = ['0.639193', '0.484159', '0.507781', '0.504326', '0.640469', '0.504279', '0.502370', '0.643226', '0.501679', '0.498295', '0.507878', '0.505733', '0.507106', '0.507381', '0.490084', '0.502188', '0.642852', '0.496879', '0.506561', '0.487256']
         : correct/total = [(9097, 14232), (6892, 14235), (7244, 14266), (7170, 14217), (9119, 14238), (7248, 14373), (7207, 14346), (9220, 14334), (7171, 14294), (7162, 14373), (7285, 14344), (7233, 14302), (7279, 14354), (7287, 14362), (7018, 14320), (7229, 14395), (9250, 14389), (7084, 14257), (7219, 14251), (7016, 14399)]
         : compromised: 0.5009, honest: 0.6414
Round 008: test acc mean=0.5291 ± 0.0542 | min=0.4890 max=0.6433
         : test loss mean=87125507352775.7500 ± 52528875340092.6797
         : individual accs = ['0.635329', '0.515982', '0.494673', '0.513821', '0.637379', '0.500174', '0.494842', '0.643296', '0.502379', '0.505810', '0.488985', '0.508041', '0.497562', '0.491227', '0.514106', '0.506495', '0.630134', '0.504384', '0.502561', '0.495382']
         : correct/total = [(9042, 14232), (7345, 14235), (7057, 14266), (7305, 14217), (9075, 14238), (7189, 14373), (7099, 14346), (9221, 14334), (7181, 14294), (7270, 14373), (7014, 14344), (7266, 14302), (7142, 14354), (7055, 14362), (7362, 14320), (7291, 14395), (9067, 14389), (7191, 14257), (7162, 14251), (7133, 14399)]
         : compromised: 0.5023, honest: 0.6365
Round 009: test acc mean=0.5319 ± 0.0638 | min=0.4869 max=0.6618
         : test loss mean=5051631152642902.0000 ± 3003441226020528.0000
         : individual accs = ['0.655284', '0.489849', '0.506028', '0.497011', '0.660626', '0.494260', '0.498257', '0.657109', '0.502519', '0.490016', '0.498954', '0.517061', '0.508360', '0.501114', '0.503701', '0.512956', '0.661756', '0.496388', '0.499474', '0.486909']
         : correct/total = [(9326, 14232), (6973, 14235), (7219, 14266), (7066, 14217), (9406, 14238), (7104, 14373), (7148, 14346), (9419, 14334), (7183, 14294), (7043, 14373), (7157, 14344), (7395, 14302), (7297, 14354), (7197, 14362), (7213, 14320), (7384, 14395), (9522, 14389), (7077, 14257), (7118, 14251), (7011, 14399)]
         : compromised: 0.5002, honest: 0.6587
Round 010: test acc mean=0.5359 ± 0.0647 | min=0.4948 max=0.6718
         : test loss mean=551771866561850368.0000 ± 345398952120946240.0000
         : individual accs = ['0.661397', '0.520337', '0.499369', '0.497292', '0.666807', '0.501009', '0.503764', '0.671829', '0.494823', '0.508662', '0.498118', '0.513425', '0.508221', '0.499443', '0.507402', '0.498576', '0.658698', '0.504384', '0.504245', '0.500313']
         : correct/total = [(9413, 14232), (7407, 14235), (7124, 14266), (7070, 14217), (9494, 14238), (7201, 14373), (7227, 14346), (9630, 14334), (7073, 14294), (7311, 14373), (7145, 14344), (7343, 14302), (7295, 14354), (7173, 14362), (7266, 14320), (7177, 14395), (9478, 14389), (7191, 14257), (7186, 14251), (7204, 14399)]
         : compromised: 0.5037, honest: 0.6647

=== FINAL RESULTS ===
Dataset: sent140, Nodes: 20, Graph: erdos, Aggregation: balance
Attack: backdoor, 80.0% compromised
Final accuracy - Compromised: 0.5037, Honest: 0.6647
Overall test accuracy: mean=0.5359 ± 0.0647

=== BACKDOOR ATTACK SUCCESS RATE (ASR) ===
Target label: 1
Trigger size: 3x3
Overall ASR: 0.8094 ± 0.2108
Honest nodes ASR: 0.5339 ± 0.0389
Compromised nodes ASR: 0.8782 ± 0.1773
Note: Higher ASR indicates more successful backdoor attack

=== BALANCE SUMMARY ===
Node 0: acceptance=0.269
Node 1: acceptance=0.600
Node 2: acceptance=0.600
Node 3: acceptance=0.600
Node 4: acceptance=0.345
Node 5: acceptance=0.600
Node 6: acceptance=0.600
Node 7: acceptance=0.229
Node 8: acceptance=0.600
Node 9: acceptance=0.600
Node 10: acceptance=0.600
Node 11: acceptance=0.600
Node 12: acceptance=0.600
Node 13: acceptance=0.600
Node 14: acceptance=0.600
Node 15: acceptance=0.600
Node 16: acceptance=0.238
Node 17: acceptance=0.600
Node 18: acceptance=0.600
Node 19: acceptance=0.600

=== PARALLEL EXECUTION TIME (realistic for distributed system) ===
  COMMUNICATION (max across nodes):
    - Full model transfer: 0.000s (0.0%)
  COMPUTATION (max across nodes):
    - Filtering: 0.065s (83.4%)
    - Aggregation: 0.013s (16.6%)
  TOTALS:
    - Total computation: 0.078s (100.0%)
    - Total communication: 0.000s (0.0%)
    - Total parallel time: 0.078s

=== PER-NODE AVERAGE TIME ===
  - Filtering: 0.051s
  - Aggregation: 0.008s
  - Model transfer: 0.000s
  - Total per node: 0.059s

=== TOTAL COMPUTATIONAL WORK (sum across all nodes) ===
  - Total filtering: 1.018s
  - Total aggregation: 0.161s
  - Total model transfer: 0.000s
  - Grand total: 1.179s
  - Mean acceptance rate: 0.534

BALANCE Algorithm Properties:
  - Model dimension: 1,174,986
  - No compression: Full parameter comparison
  - Theoretical complexity: O(deg(i)×d)
  - Approach: Full parameter filtering + averaging
