Device: cuda
Seed: 987654321
Loading 1 LEAF Sent140 train files...
LEAF Sent140 train: 254555 users, 908652 samples
Building vocabulary (max_size=10000)...
Vocabulary size: 10000
Loading 1 LEAF Sent140 test files...
LEAF Sent140 test: 254555 users, 286281 samples
Found 254555 train users, 254555 test users, 254555 common users
User sample counts range: 494 (max) to 1 (min)
Distributed ALL 254555 users across 20 clients
Users per client: 12727 (with 15 clients getting +1 user)
Train partition sizes: [44353, 44290, 44657, 44907, 44696, 45843, 45801, 45619, 45069, 45639, 45821, 45311, 45779, 46056, 45625, 45984, 46428, 44737, 45540, 46497]
Test partition sizes: [14232, 14235, 14266, 14217, 14238, 14373, 14346, 14334, 14294, 14373, 14344, 14302, 14354, 14362, 14320, 14395, 14389, 14257, 14251, 14399]
  Client 0: 44353 train samples, 2 unique classes
  Client 1: 44290 train samples, 2 unique classes
  Client 2: 44657 train samples, 2 unique classes
  Client 3: 44907 train samples, 2 unique classes
  Client 4: 44696 train samples, 2 unique classes
  Client 5: 45843 train samples, 2 unique classes
  Client 6: 45801 train samples, 2 unique classes
  Client 7: 45619 train samples, 2 unique classes
  Client 8: 45069 train samples, 2 unique classes
  Client 9: 45639 train samples, 2 unique classes
  Client 10: 45821 train samples, 2 unique classes
  Client 11: 45311 train samples, 2 unique classes
  Client 12: 45779 train samples, 2 unique classes
  Client 13: 46056 train samples, 2 unique classes
  Client 14: 45625 train samples, 2 unique classes
  Client 15: 45984 train samples, 2 unique classes
  Client 16: 46428 train samples, 2 unique classes
  Client 17: 44737 train samples, 2 unique classes
  Client 18: 45540 train samples, 2 unique classes
  Client 19: 46497 train samples, 2 unique classes
Will sample 4500 samples per client per epoch
Graph: erdos, nodes: 20, edges: 126
Degree statistics: avg=12.60, min=8, max=16
Attack: Compromised 14/20 nodes: [1, 2, 3, 5, 6, 8, 11, 12, 13, 14, 15, 17, 18, 19]
Attack type: directed_deviation, lambda: 1.0
Model variant: baseline
Model parameters: 1,174,986
Initial test acc across nodes: mean=0.4953 ± 0.0174
Round 001: test acc mean=0.5001 ± 0.0073 | min=0.4882 max=0.5140
         : test loss mean=11.1868 ± 4.2108
         : individual accs = ['0.511313', '0.514015', '0.500350', '0.499261', '0.488201', '0.495443', '0.499373', '0.492186', '0.494123', '0.503235', '0.492192', '0.496854', '0.495611', '0.510723', '0.494413', '0.494338', '0.496838', '0.503612', '0.507263', '0.511702']
         : correct/total = [(7277, 14232), (7317, 14235), (7138, 14266), (7098, 14217), (6951, 14238), (7121, 14373), (7164, 14346), (7055, 14334), (7063, 14294), (7233, 14373), (7060, 14344), (7106, 14302), (7114, 14354), (7335, 14362), (7080, 14320), (7116, 14395), (7149, 14389), (7180, 14257), (7229, 14251), (7368, 14399)]
         : compromised: 0.5012, honest: 0.4973
Round 002: test acc mean=0.5029 ± 0.0059 | min=0.4886 max=0.5157
         : test loss mean=7.5319 ± 1.8785
         : individual accs = ['0.507518', '0.503196', '0.501332', '0.488640', '0.505549', '0.503514', '0.504322', '0.505860', '0.493983', '0.501705', '0.499721', '0.497343', '0.500627', '0.515666', '0.496578', '0.506426', '0.511015', '0.505927', '0.501298', '0.508160']
         : correct/total = [(7223, 14232), (7163, 14235), (7152, 14266), (6947, 14217), (7198, 14238), (7237, 14373), (7235, 14346), (7251, 14334), (7061, 14294), (7211, 14373), (7168, 14344), (7113, 14302), (7186, 14354), (7406, 14362), (7111, 14320), (7290, 14395), (7353, 14389), (7213, 14257), (7144, 14251), (7317, 14399)]
         : compromised: 0.5019, honest: 0.5052
Round 003: test acc mean=0.5049 ± 0.0073 | min=0.4862 max=0.5192
         : test loss mean=2.9585 ± 1.1148
         : individual accs = ['0.505902', '0.516965', '0.514370', '0.519167', '0.505549', '0.504209', '0.500767', '0.513325', '0.502588', '0.504835', '0.486196', '0.505803', '0.497631', '0.496379', '0.507891', '0.499965', '0.507818', '0.503682', '0.504105', '0.500382']
         : correct/total = [(7200, 14232), (7359, 14235), (7338, 14266), (7381, 14217), (7198, 14238), (7247, 14373), (7184, 14346), (7358, 14334), (7184, 14294), (7256, 14373), (6974, 14344), (7234, 14302), (7143, 14354), (7129, 14362), (7273, 14320), (7197, 14395), (7307, 14389), (7181, 14257), (7184, 14251), (7205, 14399)]
         : compromised: 0.5053, honest: 0.5039
Round 004: test acc mean=0.4957 ± 0.0055 | min=0.4827 max=0.5067
         : test loss mean=4.1166 ± 1.7447
         : individual accs = ['0.493536', '0.482684', '0.487312', '0.487937', '0.495505', '0.494538', '0.502719', '0.496721', '0.498671', '0.495512', '0.498187', '0.494127', '0.503483', '0.506684', '0.492947', '0.498229', '0.492807', '0.495265', '0.496106', '0.500174']
         : correct/total = [(7024, 14232), (6871, 14235), (6952, 14266), (6937, 14217), (7055, 14238), (7108, 14373), (7212, 14346), (7120, 14334), (7128, 14294), (7122, 14373), (7146, 14344), (7067, 14302), (7227, 14354), (7277, 14362), (7059, 14320), (7172, 14395), (7091, 14389), (7061, 14257), (7070, 14251), (7202, 14399)]
         : compromised: 0.4958, honest: 0.4954
Round 005: test acc mean=0.4991 ± 0.0059 | min=0.4887 max=0.5102
         : test loss mean=1.0050 ± 0.4047
         : individual accs = ['0.492763', '0.502494', '0.506239', '0.496518', '0.490729', '0.496973', '0.501464', '0.496372', '0.503498', '0.492938', '0.492889', '0.507621', '0.499443', '0.488720', '0.499022', '0.500521', '0.501425', '0.493793', '0.507684', '0.510244']
         : correct/total = [(7013, 14232), (7153, 14235), (7222, 14266), (7059, 14217), (6987, 14238), (7143, 14373), (7194, 14346), (7115, 14334), (7197, 14294), (7085, 14373), (7070, 14344), (7260, 14302), (7169, 14354), (7019, 14362), (7146, 14320), (7205, 14395), (7215, 14389), (7040, 14257), (7235, 14251), (7347, 14399)]
         : compromised: 0.5010, honest: 0.4945
Round 006: test acc mean=0.4975 ± 0.0060 | min=0.4798 max=0.5091
         : test loss mean=1.1766 ± 0.4868
         : individual accs = ['0.491076', '0.497717', '0.494603', '0.479778', '0.500773', '0.495373', '0.501812', '0.492954', '0.499930', '0.500104', '0.493098', '0.493427', '0.499373', '0.509121', '0.497975', '0.495936', '0.503857', '0.506207', '0.498281', '0.497882']
         : correct/total = [(6989, 14232), (7085, 14235), (7056, 14266), (6821, 14217), (7130, 14238), (7120, 14373), (7199, 14346), (7066, 14334), (7146, 14294), (7188, 14373), (7073, 14344), (7057, 14302), (7168, 14354), (7312, 14362), (7131, 14320), (7139, 14395), (7250, 14389), (7217, 14257), (7101, 14251), (7169, 14399)]
         : compromised: 0.4977, honest: 0.4970
Round 007: test acc mean=0.4994 ± 0.0076 | min=0.4872 max=0.5205
         : test loss mean=0.7612 ± 0.1409
         : individual accs = ['0.493255', '0.487250', '0.498248', '0.489133', '0.495013', '0.506575', '0.503485', '0.500279', '0.497342', '0.497600', '0.505996', '0.497763', '0.503832', '0.488581', '0.508240', '0.520528', '0.498297', '0.492320', '0.502912', '0.501354']
         : correct/total = [(7020, 14232), (6936, 14235), (7108, 14266), (6954, 14217), (7048, 14238), (7281, 14373), (7223, 14346), (7171, 14334), (7109, 14294), (7152, 14373), (7258, 14344), (7119, 14302), (7232, 14354), (7017, 14362), (7278, 14320), (7493, 14395), (7170, 14389), (7019, 14257), (7167, 14251), (7219, 14399)]
         : compromised: 0.4998, honest: 0.4984
Round 008: test acc mean=0.4977 ± 0.0052 | min=0.4874 max=0.5100
         : test loss mean=1.0245 ± 0.4239
         : individual accs = ['0.491076', '0.487390', '0.488294', '0.498277', '0.496067', '0.498991', '0.500627', '0.500349', '0.498811', '0.495721', '0.500070', '0.495665', '0.505155', '0.510026', '0.493506', '0.499479', '0.495726', '0.500456', '0.496456', '0.502327']
         : correct/total = [(6989, 14232), (6938, 14235), (6966, 14266), (7084, 14217), (7063, 14238), (7172, 14373), (7182, 14346), (7172, 14334), (7130, 14294), (7125, 14373), (7173, 14344), (7089, 14302), (7251, 14354), (7325, 14362), (7067, 14320), (7190, 14395), (7133, 14389), (7135, 14257), (7075, 14251), (7233, 14399)]
         : compromised: 0.4982, honest: 0.4965
Round 009: test acc mean=0.4969 ± 0.0058 | min=0.4852 max=0.5053
         : test loss mean=0.7228 ± 0.0680
         : individual accs = ['0.496276', '0.492448', '0.489766', '0.486741', '0.490729', '0.503583', '0.501115', '0.493582', '0.498321', '0.496904', '0.496584', '0.494966', '0.504877', '0.485239', '0.499302', '0.505314', '0.500521', '0.496458', '0.505228', '0.501007']
         : correct/total = [(7063, 14232), (7010, 14235), (6987, 14266), (6920, 14217), (6987, 14238), (7238, 14373), (7189, 14346), (7075, 14334), (7123, 14294), (7142, 14373), (7123, 14344), (7079, 14302), (7247, 14354), (6969, 14362), (7150, 14320), (7274, 14395), (7202, 14389), (7078, 14257), (7200, 14251), (7214, 14399)]
         : compromised: 0.4975, honest: 0.4958
Round 010: test acc mean=0.5018 ± 0.0052 | min=0.4907 max=0.5112
         : test loss mean=0.9232 ± 0.3060
         : individual accs = ['0.490725', '0.497295', '0.493411', '0.499754', '0.498595', '0.501078', '0.503764', '0.504814', '0.499370', '0.506227', '0.502301', '0.505873', '0.509266', '0.511210', '0.497835', '0.504133', '0.499757', '0.498141', '0.503403', '0.509688']
         : correct/total = [(6984, 14232), (7079, 14235), (7039, 14266), (7105, 14217), (7099, 14238), (7202, 14373), (7227, 14346), (7236, 14334), (7138, 14294), (7276, 14373), (7205, 14344), (7235, 14302), (7310, 14354), (7342, 14362), (7129, 14320), (7257, 14395), (7191, 14389), (7102, 14257), (7174, 14251), (7339, 14399)]
         : compromised: 0.5024, honest: 0.5004

=== FINAL RESULTS ===
Dataset: sent140, Nodes: 20, Graph: erdos, Aggregation: krum
Attack: directed_deviation, 70.0% compromised
Final accuracy - Compromised: 0.5024, Honest: 0.5004
Overall test accuracy: mean=0.5018 ± 0.0052
