Device: cuda
Seed: 987654321
Loading 1 LEAF Sent140 train files...
LEAF Sent140 train: 254555 users, 908652 samples
Building vocabulary (max_size=10000)...
Vocabulary size: 10000
Loading 1 LEAF Sent140 test files...
LEAF Sent140 test: 254555 users, 286281 samples
Found 254555 train users, 254555 test users, 254555 common users
User sample counts range: 494 (max) to 1 (min)
Distributed ALL 254555 users across 20 clients
Users per client: 12727 (with 15 clients getting +1 user)
Train partition sizes: [44353, 44290, 44657, 44907, 44696, 45843, 45801, 45619, 45069, 45639, 45821, 45311, 45779, 46056, 45625, 45984, 46428, 44737, 45540, 46497]
Test partition sizes: [14232, 14235, 14266, 14217, 14238, 14373, 14346, 14334, 14294, 14373, 14344, 14302, 14354, 14362, 14320, 14395, 14389, 14257, 14251, 14399]
  Client 0: 44353 train samples, 2 unique classes
  Client 1: 44290 train samples, 2 unique classes
  Client 2: 44657 train samples, 2 unique classes
  Client 3: 44907 train samples, 2 unique classes
  Client 4: 44696 train samples, 2 unique classes
  Client 5: 45843 train samples, 2 unique classes
  Client 6: 45801 train samples, 2 unique classes
  Client 7: 45619 train samples, 2 unique classes
  Client 8: 45069 train samples, 2 unique classes
  Client 9: 45639 train samples, 2 unique classes
  Client 10: 45821 train samples, 2 unique classes
  Client 11: 45311 train samples, 2 unique classes
  Client 12: 45779 train samples, 2 unique classes
  Client 13: 46056 train samples, 2 unique classes
  Client 14: 45625 train samples, 2 unique classes
  Client 15: 45984 train samples, 2 unique classes
  Client 16: 46428 train samples, 2 unique classes
  Client 17: 44737 train samples, 2 unique classes
  Client 18: 45540 train samples, 2 unique classes
  Client 19: 46497 train samples, 2 unique classes
Will sample 4500 samples per client per epoch
Graph: erdos, nodes: 20, edges: 99
Degree statistics: avg=9.90, min=7, max=14
Attack: Compromised 12/20 nodes: [1, 2, 3, 5, 8, 11, 12, 13, 14, 15, 17, 18]
Attack type: directed_deviation, lambda: 1.0
Model variant: baseline
Model parameters: 1,174,986
Initial test acc across nodes: mean=0.4953 ± 0.0174
Round 001: test acc mean=0.5019 ± 0.0056 | min=0.4931 max=0.5130
         : test loss mean=7.5201 ± 2.3803
         : individual accs = ['0.512999', '0.505444', '0.511636', '0.497292', '0.504987', '0.502609', '0.493099', '0.502302', '0.500140', '0.502331', '0.505020', '0.497483', '0.506479', '0.495892', '0.505447', '0.498506', '0.494058', '0.498913', '0.494842', '0.509202']
         : correct/total = [(7301, 14232), (7195, 14235), (7299, 14266), (7070, 14217), (7190, 14238), (7224, 14373), (7074, 14346), (7200, 14334), (7149, 14294), (7220, 14373), (7244, 14344), (7115, 14302), (7270, 14354), (7122, 14362), (7238, 14320), (7176, 14395), (7109, 14389), (7113, 14257), (7052, 14251), (7332, 14399)]
         : compromised: 0.5012, honest: 0.5030
Round 002: test acc mean=0.4978 ± 0.0072 | min=0.4834 max=0.5119
         : test loss mean=6.2133 ± 2.1916
         : individual accs = ['0.511875', '0.499122', '0.506869', '0.496096', '0.493819', '0.483406', '0.505855', '0.495954', '0.497342', '0.493912', '0.505368', '0.501049', '0.501881', '0.501114', '0.496578', '0.485377', '0.502189', '0.485586', '0.492878', '0.499549']
         : correct/total = [(7285, 14232), (7105, 14235), (7231, 14266), (7053, 14217), (7031, 14238), (6948, 14373), (7257, 14346), (7109, 14334), (7109, 14294), (7099, 14373), (7249, 14344), (7166, 14302), (7204, 14354), (7197, 14362), (7111, 14320), (6987, 14395), (7226, 14389), (6923, 14257), (7024, 14251), (7193, 14399)]
         : compromised: 0.4956, honest: 0.5011
Round 003: test acc mean=0.4996 ± 0.0086 | min=0.4834 max=0.5139
         : test loss mean=1.0574 ± 0.2177
         : individual accs = ['0.490936', '0.485002', '0.513879', '0.508757', '0.497612', '0.495373', '0.500488', '0.495535', '0.488527', '0.494886', '0.509412', '0.483429', '0.510032', '0.504387', '0.510615', '0.503856', '0.506568', '0.500456', '0.492808', '0.498507']
         : correct/total = [(6987, 14232), (6904, 14235), (7331, 14266), (7233, 14217), (7085, 14238), (7120, 14373), (7180, 14346), (7103, 14334), (6983, 14294), (7113, 14373), (7307, 14344), (6914, 14302), (7321, 14354), (7244, 14362), (7312, 14320), (7253, 14395), (7289, 14389), (7135, 14257), (7023, 14251), (7178, 14399)]
         : compromised: 0.4998, honest: 0.4992
Round 004: test acc mean=0.4957 ± 0.0051 | min=0.4866 max=0.5043
         : test loss mean=1.4957 ± 0.6002
         : individual accs = ['0.495854', '0.493432', '0.504346', '0.490258', '0.501334', '0.495860', '0.502719', '0.496861', '0.486568', '0.497182', '0.486824', '0.497063', '0.499791', '0.497842', '0.498254', '0.490656', '0.501147', '0.486849', '0.493720', '0.496840']
         : correct/total = [(7057, 14232), (7024, 14235), (7195, 14266), (6970, 14217), (7138, 14238), (7127, 14373), (7212, 14346), (7122, 14334), (6955, 14294), (7146, 14373), (6983, 14344), (7109, 14302), (7174, 14354), (7150, 14362), (7135, 14320), (7063, 14395), (7211, 14389), (6941, 14257), (7036, 14251), (7154, 14399)]
         : compromised: 0.4946, honest: 0.4973
Round 005: test acc mean=0.5002 ± 0.0090 | min=0.4800 max=0.5150
         : test loss mean=0.9772 ± 0.1971
         : individual accs = ['0.495854', '0.507341', '0.510164', '0.505381', '0.510816', '0.511375', '0.502649', '0.491000', '0.502938', '0.497878', '0.500139', '0.483079', '0.514978', '0.492480', '0.496020', '0.507468', '0.480019', '0.497650', '0.494632', '0.501563']
         : correct/total = [(7057, 14232), (7222, 14235), (7278, 14266), (7185, 14217), (7273, 14238), (7350, 14373), (7211, 14346), (7038, 14334), (7189, 14294), (7156, 14373), (7174, 14344), (6909, 14302), (7392, 14354), (7073, 14362), (7103, 14320), (7305, 14395), (6907, 14389), (7095, 14257), (7049, 14251), (7222, 14399)]
         : compromised: 0.5020, honest: 0.4975
Round 006: test acc mean=0.4985 ± 0.0064 | min=0.4869 max=0.5152
         : test loss mean=1.0052 ± 0.3352
         : individual accs = ['0.502670', '0.494415', '0.505327', '0.515228', '0.502809', '0.496626', '0.504601', '0.501046', '0.493494', '0.493912', '0.498536', '0.497763', '0.506688', '0.486910', '0.492668', '0.491768', '0.496421', '0.501087', '0.490702', '0.496910']
         : correct/total = [(7154, 14232), (7038, 14235), (7209, 14266), (7325, 14217), (7159, 14238), (7138, 14373), (7239, 14346), (7182, 14334), (7054, 14294), (7099, 14373), (7151, 14344), (7119, 14302), (7273, 14354), (6993, 14362), (7055, 14320), (7079, 14395), (7143, 14389), (7144, 14257), (6993, 14251), (7155, 14399)]
         : compromised: 0.4977, honest: 0.4996
Round 007: test acc mean=0.4957 ± 0.0076 | min=0.4811 max=0.5101
         : test loss mean=0.7557 ± 0.1015
         : individual accs = ['0.496908', '0.481068', '0.496986', '0.485123', '0.503933', '0.497113', '0.498397', '0.489745', '0.483699', '0.497808', '0.505159', '0.494616', '0.505295', '0.510096', '0.486592', '0.489684', '0.501147', '0.499123', '0.494492', '0.496284']
         : correct/total = [(7072, 14232), (6848, 14235), (7090, 14266), (6897, 14217), (7175, 14238), (7145, 14373), (7150, 14346), (7020, 14334), (6914, 14294), (7155, 14373), (7246, 14344), (7074, 14302), (7253, 14354), (7326, 14362), (6968, 14320), (7049, 14395), (7211, 14389), (7116, 14257), (7047, 14251), (7146, 14399)]
         : compromised: 0.4937, honest: 0.4987
Round 008: test acc mean=0.5031 ± 0.0082 | min=0.4915 max=0.5196
         : test loss mean=0.8690 ± 0.2154
         : individual accs = ['0.502178', '0.501370', '0.519627', '0.511922', '0.505829', '0.518124', '0.501812', '0.496302', '0.496642', '0.497252', '0.502161', '0.496644', '0.515466', '0.491505', '0.498115', '0.513859', '0.497672', '0.501157', '0.502912', '0.492326']
         : correct/total = [(7147, 14232), (7137, 14235), (7413, 14266), (7278, 14217), (7202, 14238), (7447, 14373), (7199, 14346), (7114, 14334), (7099, 14294), (7147, 14373), (7203, 14344), (7103, 14302), (7399, 14354), (7059, 14362), (7133, 14320), (7397, 14395), (7161, 14389), (7145, 14257), (7167, 14251), (7089, 14399)]
         : compromised: 0.5056, honest: 0.4994
Round 009: test acc mean=0.5016 ± 0.0051 | min=0.4932 max=0.5123
         : test loss mean=0.7131 ± 0.0491
         : individual accs = ['0.496206', '0.497787', '0.493201', '0.497573', '0.499930', '0.498922', '0.501743', '0.501884', '0.501889', '0.499130', '0.509063', '0.493288', '0.512261', '0.511558', '0.498813', '0.502605', '0.505108', '0.505085', '0.505017', '0.500660']
         : correct/total = [(7062, 14232), (7086, 14235), (7036, 14266), (7074, 14217), (7118, 14238), (7171, 14373), (7198, 14346), (7194, 14334), (7174, 14294), (7174, 14373), (7302, 14344), (7055, 14302), (7353, 14354), (7347, 14362), (7143, 14320), (7235, 14395), (7268, 14389), (7201, 14257), (7197, 14251), (7209, 14399)]
         : compromised: 0.5015, honest: 0.5017
Round 010: test acc mean=0.5009 ± 0.0053 | min=0.4931 max=0.5148
         : test loss mean=0.8231 ± 0.1311
         : individual accs = ['0.500913', '0.493080', '0.505117', '0.496096', '0.500351', '0.503931', '0.494702', '0.503767', '0.495872', '0.501913', '0.501534', '0.493148', '0.509823', '0.501393', '0.502793', '0.514762', '0.500660', '0.504454', '0.495123', '0.498993']
         : correct/total = [(7129, 14232), (7019, 14235), (7206, 14266), (7053, 14217), (7124, 14238), (7243, 14373), (7097, 14346), (7221, 14334), (7088, 14294), (7214, 14373), (7194, 14344), (7053, 14302), (7318, 14354), (7201, 14362), (7200, 14320), (7410, 14395), (7204, 14389), (7192, 14257), (7056, 14251), (7185, 14399)]
         : compromised: 0.5013, honest: 0.5004

=== FINAL RESULTS ===
Dataset: sent140, Nodes: 20, Graph: erdos, Aggregation: krum
Attack: directed_deviation, 60.0% compromised
Final accuracy - Compromised: 0.5013, Honest: 0.5004
Overall test accuracy: mean=0.5009 ± 0.0053
