Device: cuda
Seed: 987654321
Loading 1 LEAF Sent140 train files...
LEAF Sent140 train: 254555 users, 908652 samples
Building vocabulary (max_size=10000)...
Vocabulary size: 10000
Loading 1 LEAF Sent140 test files...
LEAF Sent140 test: 254555 users, 286281 samples
Found 254555 train users, 254555 test users, 254555 common users
User sample counts range: 494 (max) to 1 (min)
Distributed ALL 254555 users across 20 clients
Users per client: 12727 (with 15 clients getting +1 user)
Train partition sizes: [44353, 44290, 44657, 44907, 44696, 45843, 45801, 45619, 45069, 45639, 45821, 45311, 45779, 46056, 45625, 45984, 46428, 44737, 45540, 46497]
Test partition sizes: [14232, 14235, 14266, 14217, 14238, 14373, 14346, 14334, 14294, 14373, 14344, 14302, 14354, 14362, 14320, 14395, 14389, 14257, 14251, 14399]
  Client 0: 44353 train samples, 2 unique classes
  Client 1: 44290 train samples, 2 unique classes
  Client 2: 44657 train samples, 2 unique classes
  Client 3: 44907 train samples, 2 unique classes
  Client 4: 44696 train samples, 2 unique classes
  Client 5: 45843 train samples, 2 unique classes
  Client 6: 45801 train samples, 2 unique classes
  Client 7: 45619 train samples, 2 unique classes
  Client 8: 45069 train samples, 2 unique classes
  Client 9: 45639 train samples, 2 unique classes
  Client 10: 45821 train samples, 2 unique classes
  Client 11: 45311 train samples, 2 unique classes
  Client 12: 45779 train samples, 2 unique classes
  Client 13: 46056 train samples, 2 unique classes
  Client 14: 45625 train samples, 2 unique classes
  Client 15: 45984 train samples, 2 unique classes
  Client 16: 46428 train samples, 2 unique classes
  Client 17: 44737 train samples, 2 unique classes
  Client 18: 45540 train samples, 2 unique classes
  Client 19: 46497 train samples, 2 unique classes
Will sample 4500 samples per client per epoch
Graph: erdos, nodes: 20, edges: 48
Degree statistics: avg=4.80, min=2, max=7
Attack: Compromised 10/20 nodes: [1, 2, 5, 11, 12, 13, 14, 15, 17, 18]
Attack type: directed_deviation, lambda: 1.0
Model variant: baseline
Model parameters: 1,174,986
Initial test acc across nodes: mean=0.4953 ± 0.0174
Round 001: test acc mean=0.4995 ± 0.0065 | min=0.4870 max=0.5141
         : test loss mean=8.4580 ± 7.6120
         : individual accs = ['0.508713', '0.514085', '0.486962', '0.498628', '0.493257', '0.497391', '0.504949', '0.496093', '0.497132', '0.494260', '0.504113', '0.499301', '0.503832', '0.492480', '0.499092', '0.505870', '0.506012', '0.490917', '0.500596', '0.495521']
         : correct/total = [(7240, 14232), (7318, 14235), (6947, 14266), (7089, 14217), (7023, 14238), (7149, 14373), (7244, 14346), (7111, 14334), (7106, 14294), (7104, 14373), (7231, 14344), (7141, 14302), (7232, 14354), (7073, 14362), (7147, 14320), (7282, 14395), (7281, 14389), (6999, 14257), (7134, 14251), (7135, 14399)]
         : compromised: 0.4991, honest: 0.4999
Round 002: test acc mean=0.5006 ± 0.0080 | min=0.4877 max=0.5179
         : test loss mean=4.8714 ± 2.8864
         : individual accs = ['0.492130', '0.503196', '0.491518', '0.487726', '0.493890', '0.500174', '0.499442', '0.494210', '0.492584', '0.502400', '0.508017', '0.489302', '0.507245', '0.510583', '0.517877', '0.505592', '0.510807', '0.503963', '0.497860', '0.503924']
         : correct/total = [(7004, 14232), (7163, 14235), (7012, 14266), (6934, 14217), (7032, 14238), (7189, 14373), (7165, 14346), (7084, 14334), (7041, 14294), (7221, 14373), (7287, 14344), (6998, 14302), (7281, 14354), (7333, 14362), (7416, 14320), (7278, 14395), (7350, 14389), (7185, 14257), (7095, 14251), (7256, 14399)]
         : compromised: 0.5027, honest: 0.4985
Round 003: test acc mean=0.5012 ± 0.0097 | min=0.4767 max=0.5249
         : test loss mean=1.8449 ± 1.4567
         : individual accs = ['0.500211', '0.493923', '0.508832', '0.524935', '0.504916', '0.502957', '0.498466', '0.506767', '0.496782', '0.503861', '0.500837', '0.502587', '0.476731', '0.490600', '0.516899', '0.501980', '0.490931', '0.495616', '0.504315', '0.502743']
         : correct/total = [(7119, 14232), (7031, 14235), (7259, 14266), (7463, 14217), (7189, 14238), (7229, 14373), (7151, 14346), (7264, 14334), (7101, 14294), (7242, 14373), (7184, 14344), (7188, 14302), (6843, 14354), (7046, 14362), (7402, 14320), (7226, 14395), (7064, 14389), (7066, 14257), (7187, 14251), (7239, 14399)]
         : compromised: 0.4994, honest: 0.5030
Round 004: test acc mean=0.4978 ± 0.0064 | min=0.4902 max=0.5137
         : test loss mean=2.2542 ± 1.7425
         : individual accs = ['0.491147', '0.490200', '0.490537', '0.494689', '0.495786', '0.491616', '0.498745', '0.490721', '0.513712', '0.502539', '0.500139', '0.495665', '0.504319', '0.507868', '0.494902', '0.498159', '0.496490', '0.502630', '0.490422', '0.505243']
         : correct/total = [(6990, 14232), (6978, 14235), (6998, 14266), (7033, 14217), (7059, 14238), (7066, 14373), (7155, 14346), (7034, 14334), (7343, 14294), (7223, 14373), (7174, 14344), (7089, 14302), (7239, 14354), (7294, 14362), (7087, 14320), (7171, 14395), (7144, 14389), (7166, 14257), (6989, 14251), (7275, 14399)]
         : compromised: 0.4966, honest: 0.4989
Round 005: test acc mean=0.5084 ± 0.0078 | min=0.4983 max=0.5261
         : test loss mean=1.5304 ± 1.2801
         : individual accs = ['0.508572', '0.516895', '0.520118', '0.512766', '0.523248', '0.499200', '0.503067', '0.506488', '0.506926', '0.507131', '0.502789', '0.507062', '0.498258', '0.503760', '0.526117', '0.499340', '0.511988', '0.510135', '0.502561', '0.501979']
         : correct/total = [(7238, 14232), (7358, 14235), (7420, 14266), (7290, 14217), (7450, 14238), (7175, 14373), (7217, 14346), (7260, 14334), (7246, 14294), (7289, 14373), (7212, 14344), (7252, 14302), (7152, 14354), (7235, 14362), (7534, 14320), (7188, 14395), (7367, 14389), (7273, 14257), (7162, 14251), (7228, 14399)]
         : compromised: 0.5083, honest: 0.5085
Round 006: test acc mean=0.4980 ± 0.0076 | min=0.4847 max=0.5119
         : test loss mean=1.6337 ± 1.1551
         : individual accs = ['0.491779', '0.484651', '0.490677', '0.486460', '0.493609', '0.495721', '0.504670', '0.492117', '0.505667', '0.511932', '0.498885', '0.490141', '0.508778', '0.508495', '0.499372', '0.493088', '0.501425', '0.495336', '0.502912', '0.505105']
         : correct/total = [(6999, 14232), (6899, 14235), (7000, 14266), (6916, 14217), (7028, 14238), (7125, 14373), (7240, 14346), (7054, 14334), (7228, 14294), (7358, 14373), (7156, 14344), (7010, 14302), (7303, 14354), (7303, 14362), (7151, 14320), (7098, 14395), (7215, 14389), (7062, 14257), (7167, 14251), (7273, 14399)]
         : compromised: 0.4969, honest: 0.4992
Round 007: test acc mean=0.5064 ± 0.0103 | min=0.4951 max=0.5460
         : test loss mean=1.5245 ± 1.3642
         : individual accs = ['0.501194', '0.510362', '0.512617', '0.517409', '0.505970', '0.502261', '0.501673', '0.507465', '0.503708', '0.546024', '0.501673', '0.505873', '0.495054', '0.500627', '0.501676', '0.498229', '0.504900', '0.504805', '0.503684', '0.502049']
         : correct/total = [(7133, 14232), (7265, 14235), (7313, 14266), (7356, 14217), (7204, 14238), (7219, 14373), (7197, 14346), (7274, 14334), (7200, 14294), (7848, 14373), (7196, 14344), (7235, 14302), (7106, 14354), (7190, 14362), (7184, 14320), (7172, 14395), (7265, 14389), (7197, 14257), (7178, 14251), (7229, 14399)]
         : compromised: 0.5035, honest: 0.5092
Round 008: test acc mean=0.4982 ± 0.0075 | min=0.4830 max=0.5162
         : test loss mean=1.5298 ± 1.0353
         : individual accs = ['0.493817', '0.483035', '0.494813', '0.484350', '0.499508', '0.501148', '0.502300', '0.495047', '0.507346', '0.516246', '0.499373', '0.491470', '0.499164', '0.504317', '0.496508', '0.499757', '0.500799', '0.495476', '0.491685', '0.507119']
         : correct/total = [(7028, 14232), (6876, 14235), (7059, 14266), (6886, 14217), (7112, 14238), (7203, 14373), (7206, 14346), (7096, 14334), (7252, 14294), (7420, 14373), (7163, 14344), (7029, 14302), (7165, 14354), (7243, 14362), (7110, 14320), (7194, 14395), (7206, 14389), (7064, 14257), (7007, 14251), (7302, 14399)]
         : compromised: 0.4957, honest: 0.5006
Round 009: test acc mean=0.5078 ± 0.0122 | min=0.4933 max=0.5517
         : test loss mean=1.3936 ± 1.1620
         : individual accs = ['0.512015', '0.515068', '0.510164', '0.516143', '0.506110', '0.503931', '0.501952', '0.507395', '0.500770', '0.551729', '0.501673', '0.504825', '0.497144', '0.493316', '0.502444', '0.498437', '0.500104', '0.504735', '0.504526', '0.523231']
         : correct/total = [(7287, 14232), (7332, 14235), (7278, 14266), (7338, 14217), (7206, 14238), (7243, 14373), (7201, 14346), (7273, 14334), (7158, 14294), (7930, 14373), (7196, 14344), (7220, 14302), (7136, 14354), (7085, 14362), (7195, 14320), (7175, 14395), (7196, 14389), (7196, 14257), (7190, 14251), (7534, 14399)]
         : compromised: 0.5035, honest: 0.5121
Round 010: test acc mean=0.5011 ± 0.0096 | min=0.4829 max=0.5208
         : test loss mean=1.4086 ± 1.0392
         : individual accs = ['0.500492', '0.482894', '0.493831', '0.490821', '0.516365', '0.503027', '0.505646', '0.495884', '0.517840', '0.520768', '0.501813', '0.493567', '0.507942', '0.511767', '0.490852', '0.496770', '0.498297', '0.495336', '0.495404', '0.502813']
         : correct/total = [(7123, 14232), (6874, 14235), (7045, 14266), (6978, 14217), (7352, 14238), (7230, 14373), (7254, 14346), (7108, 14334), (7402, 14294), (7485, 14373), (7198, 14344), (7059, 14302), (7291, 14354), (7350, 14362), (7029, 14320), (7151, 14395), (7170, 14389), (7062, 14257), (7060, 14251), (7240, 14399)]
         : compromised: 0.4971, honest: 0.5051

=== FINAL RESULTS ===
Dataset: sent140, Nodes: 20, Graph: erdos, Aggregation: d-fedavg
Attack: directed_deviation, 50.0% compromised
Final accuracy - Compromised: 0.4971, Honest: 0.5051
Overall test accuracy: mean=0.5011 ± 0.0096
