Device: cuda
Seed: 987654321
Loading 1 LEAF Sent140 train files...
LEAF Sent140 train: 254555 users, 908652 samples
Building vocabulary (max_size=10000)...
Vocabulary size: 10000
Loading 1 LEAF Sent140 test files...
LEAF Sent140 test: 254555 users, 286281 samples
Found 254555 train users, 254555 test users, 254555 common users
User sample counts range: 494 (max) to 1 (min)
Distributed ALL 254555 users across 20 clients
Users per client: 12727 (with 15 clients getting +1 user)
Train partition sizes: [44353, 44290, 44657, 44907, 44696, 45843, 45801, 45619, 45069, 45639, 45821, 45311, 45779, 46056, 45625, 45984, 46428, 44737, 45540, 46497]
Test partition sizes: [14232, 14235, 14266, 14217, 14238, 14373, 14346, 14334, 14294, 14373, 14344, 14302, 14354, 14362, 14320, 14395, 14389, 14257, 14251, 14399]
  Client 0: 44353 train samples, 2 unique classes
  Client 1: 44290 train samples, 2 unique classes
  Client 2: 44657 train samples, 2 unique classes
  Client 3: 44907 train samples, 2 unique classes
  Client 4: 44696 train samples, 2 unique classes
  Client 5: 45843 train samples, 2 unique classes
  Client 6: 45801 train samples, 2 unique classes
  Client 7: 45619 train samples, 2 unique classes
  Client 8: 45069 train samples, 2 unique classes
  Client 9: 45639 train samples, 2 unique classes
  Client 10: 45821 train samples, 2 unique classes
  Client 11: 45311 train samples, 2 unique classes
  Client 12: 45779 train samples, 2 unique classes
  Client 13: 46056 train samples, 2 unique classes
  Client 14: 45625 train samples, 2 unique classes
  Client 15: 45984 train samples, 2 unique classes
  Client 16: 46428 train samples, 2 unique classes
  Client 17: 44737 train samples, 2 unique classes
  Client 18: 45540 train samples, 2 unique classes
  Client 19: 46497 train samples, 2 unique classes
Will sample 4500 samples per client per epoch
Graph: ring, nodes: 20, edges: 20
Degree statistics: avg=2.00, min=2, max=2
Attack: Compromised 4/20 nodes: [5, 12, 13, 17]
Attack type: gaussian, lambda: 1.0
Model variant: baseline
Model parameters: 1,174,986
Sketchguard Node 0:
  Model dim: 1,174,986 → Sketch size: 180
  Compression ratio: 6527.7x
  Using model parameters for aggregation, sketches for filtering
Sketchguard Node 1:
  Model dim: 1,174,986 → Sketch size: 180
  Compression ratio: 6527.7x
  Using model parameters for aggregation, sketches for filtering
Sketchguard Node 2:
  Model dim: 1,174,986 → Sketch size: 180
  Compression ratio: 6527.7x
  Using model parameters for aggregation, sketches for filtering
Sketchguard Node 3:
  Model dim: 1,174,986 → Sketch size: 180
  Compression ratio: 6527.7x
  Using model parameters for aggregation, sketches for filtering
Sketchguard Node 4:
  Model dim: 1,174,986 → Sketch size: 180
  Compression ratio: 6527.7x
  Using model parameters for aggregation, sketches for filtering
Sketchguard Node 5:
  Model dim: 1,174,986 → Sketch size: 180
  Compression ratio: 6527.7x
  Using model parameters for aggregation, sketches for filtering
Sketchguard Node 6:
  Model dim: 1,174,986 → Sketch size: 180
  Compression ratio: 6527.7x
  Using model parameters for aggregation, sketches for filtering
Sketchguard Node 7:
  Model dim: 1,174,986 → Sketch size: 180
  Compression ratio: 6527.7x
  Using model parameters for aggregation, sketches for filtering
Sketchguard Node 8:
  Model dim: 1,174,986 → Sketch size: 180
  Compression ratio: 6527.7x
  Using model parameters for aggregation, sketches for filtering
Sketchguard Node 9:
  Model dim: 1,174,986 → Sketch size: 180
  Compression ratio: 6527.7x
  Using model parameters for aggregation, sketches for filtering
Sketchguard Node 10:
  Model dim: 1,174,986 → Sketch size: 180
  Compression ratio: 6527.7x
  Using model parameters for aggregation, sketches for filtering
Sketchguard Node 11:
  Model dim: 1,174,986 → Sketch size: 180
  Compression ratio: 6527.7x
  Using model parameters for aggregation, sketches for filtering
Sketchguard Node 12:
  Model dim: 1,174,986 → Sketch size: 180
  Compression ratio: 6527.7x
  Using model parameters for aggregation, sketches for filtering
Sketchguard Node 13:
  Model dim: 1,174,986 → Sketch size: 180
  Compression ratio: 6527.7x
  Using model parameters for aggregation, sketches for filtering
Sketchguard Node 14:
  Model dim: 1,174,986 → Sketch size: 180
  Compression ratio: 6527.7x
  Using model parameters for aggregation, sketches for filtering
Sketchguard Node 15:
  Model dim: 1,174,986 → Sketch size: 180
  Compression ratio: 6527.7x
  Using model parameters for aggregation, sketches for filtering
Sketchguard Node 16:
  Model dim: 1,174,986 → Sketch size: 180
  Compression ratio: 6527.7x
  Using model parameters for aggregation, sketches for filtering
Sketchguard Node 17:
  Model dim: 1,174,986 → Sketch size: 180
  Compression ratio: 6527.7x
  Using model parameters for aggregation, sketches for filtering
Sketchguard Node 18:
  Model dim: 1,174,986 → Sketch size: 180
  Compression ratio: 6527.7x
  Using model parameters for aggregation, sketches for filtering
Sketchguard Node 19:
  Model dim: 1,174,986 → Sketch size: 180
  Compression ratio: 6527.7x
  Using model parameters for aggregation, sketches for filtering
Sketchguard ALGORITHM (Sketch-based Filtering + State Aggregation)
  - Model dimension: 1,174,986 parameters
  - Config: SketchguardConfig(gamma=2, kappa=1, alpha=0.5, min_neighbors=1, sketch_size=180, network_seed=987654321, attack_detection_window=5)
  - Sketch size: 180
  - Compression ratio: 6527.7x
  - Complexity: O(d + N×k) = O(1,174,986 + 20×180)
  - Theoretical speedup vs BALANCE: 19.9x
Initial test acc across nodes: mean=0.4953 ± 0.0174
Round 001: test acc mean=0.5510 ± 0.0326 | min=0.5012 max=0.6236
         : test loss mean=0.6894 ± 0.0019
         : individual accs = ['0.583263', '0.623604', '0.535118', '0.566575', '0.566021', '0.508592', '0.590687', '0.576531', '0.501189', '0.572254', '0.509481', '0.516291', '0.532395', '0.535580', '0.529050', '0.527405', '0.558621', '0.595778', '0.528594', '0.563650']
         : correct/total = [(8301, 14232), (8877, 14235), (7634, 14266), (8055, 14217), (8059, 14238), (7310, 14373), (8474, 14346), (8264, 14334), (7164, 14294), (8225, 14373), (7308, 14344), (7384, 14302), (7642, 14354), (7692, 14362), (7576, 14320), (7592, 14395), (8038, 14389), (8494, 14257), (7533, 14251), (8116, 14399)]
         : compromised: 0.5431, honest: 0.5530
         : sketchguard stats = ['Node 0: acc_rate=1.000', 'Node 1: acc_rate=1.000', 'Node 2: acc_rate=1.000']...
Round 002: test acc mean=0.6246 ± 0.0246 | min=0.5221 max=0.6428
         : test loss mean=0.6633 ± 0.0145
         : individual accs = ['0.624087', '0.642782', '0.635988', '0.627418', '0.637730', '0.617268', '0.630420', '0.626622', '0.624178', '0.613720', '0.627510', '0.637254', '0.641285', '0.632154', '0.627514', '0.628968', '0.630273', '0.522059', '0.633850', '0.631711']
         : correct/total = [(8882, 14232), (9150, 14235), (9073, 14266), (8920, 14217), (9080, 14238), (8872, 14373), (9044, 14346), (8982, 14334), (8922, 14294), (8821, 14373), (9001, 14344), (9114, 14302), (9205, 14354), (9079, 14362), (8986, 14320), (9054, 14395), (9069, 14389), (7443, 14257), (9033, 14251), (9096, 14399)]
         : compromised: 0.6032, honest: 0.6300
         : sketchguard stats = ['Node 0: acc_rate=1.000', 'Node 1: acc_rate=1.000', 'Node 2: acc_rate=1.000']...
Round 003: test acc mean=0.6258 ± 0.0249 | min=0.5281 max=0.6459
         : test loss mean=0.6525 ± 0.0146
         : individual accs = ['0.596684', '0.633860', '0.630730', '0.638109', '0.638573', '0.639602', '0.621079', '0.630250', '0.625297', '0.636471', '0.636433', '0.645924', '0.635572', '0.641206', '0.626117', '0.639805', '0.635555', '0.528091', '0.618904', '0.617335']
         : correct/total = [(8492, 14232), (9023, 14235), (8998, 14266), (9072, 14217), (9092, 14238), (9193, 14373), (8910, 14346), (9034, 14334), (8938, 14294), (9148, 14373), (9129, 14344), (9238, 14302), (9123, 14354), (9209, 14362), (8966, 14320), (9210, 14395), (9145, 14389), (7529, 14257), (8820, 14251), (8889, 14399)]
         : compromised: 0.6111, honest: 0.6294
         : sketchguard stats = ['Node 0: acc_rate=1.000', 'Node 1: acc_rate=1.000', 'Node 2: acc_rate=1.000']...
Round 004: test acc mean=0.6397 ± 0.0070 | min=0.6209 max=0.6486
         : test loss mean=0.6446 ± 0.0132
         : individual accs = ['0.639545', '0.639340', '0.644890', '0.646761', '0.648616', '0.643846', '0.642827', '0.643296', '0.631384', '0.620886', '0.638246', '0.647881', '0.644559', '0.638978', '0.630168', '0.641403', '0.637223', '0.630217', '0.636306', '0.648170']
         : correct/total = [(9102, 14232), (9101, 14235), (9200, 14266), (9195, 14217), (9235, 14238), (9254, 14373), (9222, 14346), (9221, 14334), (9025, 14294), (8924, 14373), (9155, 14344), (9266, 14302), (9252, 14354), (9177, 14362), (9024, 14320), (9233, 14395), (9169, 14389), (8985, 14257), (9068, 14251), (9333, 14399)]
         : compromised: 0.6394, honest: 0.6398
         : sketchguard stats = ['Node 0: acc_rate=1.000', 'Node 1: acc_rate=1.000', 'Node 2: acc_rate=1.000']...
Round 005: test acc mean=0.6426 ± 0.0076 | min=0.6234 max=0.6530
         : test loss mean=0.6401 ± 0.0124
         : individual accs = ['0.638842', '0.651282', '0.644469', '0.646691', '0.653041', '0.623391', '0.639621', '0.640156', '0.639289', '0.646142', '0.631762', '0.639071', '0.651874', '0.648378', '0.646648', '0.652310', '0.644034', '0.629796', '0.639745', '0.644836']
         : correct/total = [(9092, 14232), (9271, 14235), (9194, 14266), (9194, 14217), (9298, 14238), (8960, 14373), (9176, 14346), (9176, 14334), (9138, 14294), (9287, 14373), (9062, 14344), (9140, 14302), (9357, 14354), (9312, 14362), (9260, 14320), (9390, 14395), (9267, 14389), (8979, 14257), (9117, 14251), (9285, 14399)]
         : compromised: 0.6384, honest: 0.6436
         : sketchguard stats = ['Node 0: acc_rate=1.000', 'Node 1: acc_rate=1.000', 'Node 2: acc_rate=1.000']...
Round 006: test acc mean=0.6451 ± 0.0108 | min=0.6049 max=0.6566
         : test loss mean=0.6348 ± 0.0133
         : individual accs = ['0.647133', '0.647418', '0.645381', '0.653302', '0.656623', '0.641759', '0.646591', '0.649923', '0.639849', '0.639463', '0.639989', '0.639561', '0.641633', '0.656246', '0.652444', '0.654533', '0.649593', '0.604896', '0.642271', '0.653170']
         : correct/total = [(9210, 14232), (9216, 14235), (9207, 14266), (9288, 14217), (9349, 14238), (9224, 14373), (9276, 14346), (9316, 14334), (9146, 14294), (9191, 14373), (9180, 14344), (9147, 14302), (9210, 14354), (9425, 14362), (9343, 14320), (9422, 14395), (9347, 14389), (8624, 14257), (9153, 14251), (9405, 14399)]
         : compromised: 0.6361, honest: 0.6473
         : sketchguard stats = ['Node 0: acc_rate=1.000', 'Node 1: acc_rate=1.000', 'Node 2: acc_rate=1.000']...
Round 007: test acc mean=0.6486 ± 0.0080 | min=0.6272 max=0.6613
         : test loss mean=0.6313 ± 0.0121
         : individual accs = ['0.650927', '0.649877', '0.627226', '0.657101', '0.661259', '0.650456', '0.651540', '0.644691', '0.644606', '0.651917', '0.640477', '0.644945', '0.654452', '0.660075', '0.643855', '0.653282', '0.653972', '0.642632', '0.636096', '0.652962']
         : correct/total = [(9264, 14232), (9251, 14235), (8948, 14266), (9342, 14217), (9415, 14238), (9349, 14373), (9347, 14346), (9241, 14334), (9214, 14294), (9370, 14373), (9187, 14344), (9224, 14302), (9394, 14354), (9480, 14362), (9220, 14320), (9404, 14395), (9410, 14389), (9162, 14257), (9065, 14251), (9402, 14399)]
         : compromised: 0.6519, honest: 0.6478
         : sketchguard stats = ['Node 0: acc_rate=1.000', 'Node 1: acc_rate=1.000', 'Node 2: acc_rate=1.000']...
Round 008: test acc mean=0.6504 ± 0.0092 | min=0.6224 max=0.6629
         : test loss mean=0.6270 ± 0.0085
         : individual accs = ['0.648749', '0.645732', '0.655685', '0.649996', '0.645245', '0.650108', '0.643246', '0.640575', '0.646845', '0.651430', '0.648424', '0.653755', '0.660025', '0.661189', '0.659078', '0.662939', '0.661408', '0.622361', '0.644586', '0.657060']
         : correct/total = [(9233, 14232), (9192, 14235), (9354, 14266), (9241, 14217), (9187, 14238), (9344, 14373), (9228, 14346), (9182, 14334), (9246, 14294), (9363, 14373), (9301, 14344), (9350, 14302), (9474, 14354), (9496, 14362), (9438, 14320), (9543, 14395), (9517, 14389), (8873, 14257), (9186, 14251), (9461, 14399)]
         : compromised: 0.6484, honest: 0.6509
         : sketchguard stats = ['Node 0: acc_rate=1.000', 'Node 1: acc_rate=1.000', 'Node 2: acc_rate=1.000']...
Round 009: test acc mean=0.6535 ± 0.0120 | min=0.6184 max=0.6692
         : test loss mean=0.6225 ± 0.0093
         : individual accs = ['0.632026', '0.657323', '0.660311', '0.661321', '0.662804', '0.666110', '0.618361', '0.640435', '0.642088', '0.648786', '0.651143', '0.656342', '0.656820', '0.669196', '0.657123', '0.665370', '0.661964', '0.655538', '0.654480', '0.652893']
         : correct/total = [(8995, 14232), (9357, 14235), (9420, 14266), (9402, 14217), (9437, 14238), (9574, 14373), (8871, 14346), (9180, 14334), (9178, 14294), (9325, 14373), (9340, 14344), (9387, 14302), (9428, 14354), (9611, 14362), (9410, 14320), (9578, 14395), (9525, 14389), (9346, 14257), (9327, 14251), (9401, 14399)]
         : compromised: 0.6619, honest: 0.6514
         : sketchguard stats = ['Node 0: acc_rate=1.000', 'Node 1: acc_rate=1.000', 'Node 2: acc_rate=1.000']...
Round 010: test acc mean=0.6606 ± 0.0052 | min=0.6504 max=0.6702
         : test loss mean=0.6155 ± 0.0067
         : individual accs = ['0.658516', '0.661468', '0.660311', '0.664979', '0.670178', '0.665971', '0.654468', '0.657109', '0.654261', '0.650386', '0.658882', '0.657810', '0.662045', '0.666620', '0.662011', '0.668496', '0.665578', '0.659816', '0.653358', '0.658935']
         : correct/total = [(9372, 14232), (9416, 14235), (9420, 14266), (9454, 14217), (9542, 14238), (9572, 14373), (9389, 14346), (9419, 14334), (9352, 14294), (9348, 14373), (9451, 14344), (9408, 14302), (9503, 14354), (9574, 14362), (9480, 14320), (9623, 14395), (9577, 14389), (9407, 14257), (9311, 14251), (9488, 14399)]
         : compromised: 0.6636, honest: 0.6598
         : sketchguard stats = ['Node 0: acc_rate=1.000', 'Node 1: acc_rate=1.000', 'Node 2: acc_rate=1.000']...

=== FINAL RESULTS ===
Dataset: sent140, Nodes: 20, Graph: ring, Aggregation: sketchguard
Attack: gaussian, 20.0% compromised
Final accuracy - Compromised: 0.6636, Honest: 0.6598
Overall test accuracy: mean=0.6606 ± 0.0052

=== Sketchguard SUMMARY ===
Node 0: acceptance=1.000
Node 1: acceptance=1.000
Node 2: acceptance=1.000
Node 3: acceptance=1.000
Node 4: acceptance=0.500
Node 5: acceptance=0.750
Node 6: acceptance=0.500
Node 7: acceptance=1.000
Node 8: acceptance=1.000
Node 9: acceptance=1.000
Node 10: acceptance=1.000
Node 11: acceptance=0.500
Node 12: acceptance=0.500
Node 13: acceptance=0.500
Node 14: acceptance=0.500
Node 15: acceptance=1.000
Node 16: acceptance=0.500
Node 17: acceptance=0.800
Node 18: acceptance=0.500
Node 19: acceptance=1.000

=== PARALLEL EXECUTION TIME (realistic for distributed system) ===
  COMMUNICATION (max across nodes):
    - Sketch transfer: 0.000s (0.0%)
    - Model fetch (accepted): 0.000s (0.0%)
  COMPUTATION (max across nodes):
    - Sketching: 0.218s (95.6%)
    - Filtering: 0.001s (0.3%)
    - Aggregation: 0.009s (4.0%)
  TOTALS:
    - Total computation: 0.228s (100.0%)
    - Total communication: 0.000s (0.0%)
    - Total parallel time: 0.228s

=== PER-NODE AVERAGE TIME ===
  - Sketching: 0.164s
  - Filtering: 0.000s
  - Aggregation: 0.006s
  - Sketch transfer: 0.000s
  - Model fetch: 0.000s
  - Total per node: 0.170s

=== TOTAL COMPUTATIONAL WORK (sum across all nodes) ===
  - Total sketching: 3.273s
  - Total filtering: 0.006s
  - Total aggregation: 0.117s
  - Total sketch transfer: 0.000s
  - Total model fetch: 0.000s
  - Grand total: 3.396s
  - Mean acceptance rate: 0.778

Sketchguard Algorithm Properties:
  - Original dimension: 1,174,986
  - Sketch size: 180
  - Compression ratio: 19.9x
  - Single repetition: No repetitions needed
  - Theoretical complexity: O(d + N×k)
  - Approach: Sketch filtering + state aggregation
