Device: cuda
Seed: 987654321
Loading 1 LEAF Sent140 train files...
LEAF Sent140 train: 254555 users, 908652 samples
Building vocabulary (max_size=10000)...
Vocabulary size: 10000
Loading 1 LEAF Sent140 test files...
LEAF Sent140 test: 254555 users, 286281 samples
Found 254555 train users, 254555 test users, 254555 common users
User sample counts range: 494 (max) to 1 (min)
Distributed ALL 254555 users across 20 clients
Users per client: 12727 (with 15 clients getting +1 user)
Train partition sizes: [44353, 44290, 44657, 44907, 44696, 45843, 45801, 45619, 45069, 45639, 45821, 45311, 45779, 46056, 45625, 45984, 46428, 44737, 45540, 46497]
Test partition sizes: [14232, 14235, 14266, 14217, 14238, 14373, 14346, 14334, 14294, 14373, 14344, 14302, 14354, 14362, 14320, 14395, 14389, 14257, 14251, 14399]
  Client 0: 44353 train samples, 2 unique classes
  Client 1: 44290 train samples, 2 unique classes
  Client 2: 44657 train samples, 2 unique classes
  Client 3: 44907 train samples, 2 unique classes
  Client 4: 44696 train samples, 2 unique classes
  Client 5: 45843 train samples, 2 unique classes
  Client 6: 45801 train samples, 2 unique classes
  Client 7: 45619 train samples, 2 unique classes
  Client 8: 45069 train samples, 2 unique classes
  Client 9: 45639 train samples, 2 unique classes
  Client 10: 45821 train samples, 2 unique classes
  Client 11: 45311 train samples, 2 unique classes
  Client 12: 45779 train samples, 2 unique classes
  Client 13: 46056 train samples, 2 unique classes
  Client 14: 45625 train samples, 2 unique classes
  Client 15: 45984 train samples, 2 unique classes
  Client 16: 46428 train samples, 2 unique classes
  Client 17: 44737 train samples, 2 unique classes
  Client 18: 45540 train samples, 2 unique classes
  Client 19: 46497 train samples, 2 unique classes
Will sample 4500 samples per client per epoch
Graph: ring, nodes: 20, edges: 20
Degree statistics: avg=2.00, min=2, max=2
Attack: Compromised 8/20 nodes: [1, 5, 11, 12, 13, 14, 17, 18]
Attack type: directed_deviation, lambda: 1.0
Model variant: baseline
Model parameters: 1,174,986
BALANCE algorithm:
Balance Config: BALANCEConfig(gamma=2, kappa=1, alpha=0.5, min_neighbors=1)
  - Model dimension: 1,174,986 parameters
  - Complexity: O(N×d) = O(20×1,174,986)
Initial test acc across nodes: mean=0.4953 ± 0.0174
Round 001: test acc mean=0.5183 ± 0.0360 | min=0.4806 max=0.6236
         : test loss mean=1.8314 ± 1.4660
         : individual accs = ['0.480607', '0.623604', '0.515491', '0.566575', '0.502458', '0.508592', '0.507946', '0.576531', '0.501189', '0.572254', '0.509830', '0.504335', '0.492755', '0.495544', '0.492388', '0.497673', '0.489749', '0.524093', '0.508245', '0.495243']
         : correct/total = [(6840, 14232), (8877, 14235), (7354, 14266), (8055, 14217), (7154, 14238), (7310, 14373), (7287, 14346), (8264, 14334), (7164, 14294), (8225, 14373), (7313, 14344), (7213, 14302), (7073, 14354), (7117, 14362), (7051, 14320), (7164, 14395), (7047, 14389), (7472, 14257), (7243, 14251), (7131, 14399)]
         : compromised: 0.5187, honest: 0.5180
Round 002: test acc mean=0.5107 ± 0.0264 | min=0.4876 max=0.6218
         : test loss mean=1.2154 ± 0.7675
         : individual accs = ['0.505059', '0.515911', '0.487593', '0.513892', '0.504425', '0.498017', '0.504113', '0.505930', '0.621799', '0.504766', '0.519241', '0.495106', '0.505852', '0.504595', '0.507472', '0.504550', '0.511641', '0.503402', '0.505579', '0.495521']
         : correct/total = [(7188, 14232), (7344, 14235), (6956, 14266), (7306, 14217), (7182, 14238), (7158, 14373), (7232, 14346), (7252, 14334), (8888, 14294), (7255, 14373), (7448, 14344), (7081, 14302), (7261, 14354), (7247, 14362), (7267, 14320), (7263, 14395), (7362, 14389), (7177, 14257), (7205, 14251), (7135, 14399)]
         : compromised: 0.5045, honest: 0.5149
Round 003: test acc mean=0.5165 ± 0.0296 | min=0.4906 max=0.6170
         : test loss mean=0.8073 ± 0.3252
         : individual accs = ['0.510329', '0.503899', '0.513599', '0.513962', '0.505057', '0.509010', '0.512408', '0.508581', '0.616972', '0.576985', '0.546082', '0.512026', '0.494705', '0.500209', '0.509148', '0.497812', '0.490583', '0.504735', '0.499474', '0.504341']
         : correct/total = [(7263, 14232), (7173, 14235), (7327, 14266), (7307, 14217), (7191, 14238), (7316, 14373), (7351, 14346), (7290, 14334), (8819, 14294), (8293, 14373), (7833, 14344), (7323, 14302), (7101, 14354), (7184, 14362), (7291, 14320), (7166, 14395), (7059, 14389), (7196, 14257), (7118, 14251), (7262, 14399)]
         : compromised: 0.5042, honest: 0.5247
Round 004: test acc mean=0.5714 ± 0.0343 | min=0.5004 max=0.6193
         : test loss mean=0.7909 ± 0.3690
         : individual accs = ['0.551082', '0.545486', '0.594280', '0.599494', '0.603596', '0.590065', '0.577861', '0.607367', '0.604939', '0.619286', '0.613079', '0.604671', '0.507036', '0.500418', '0.554190', '0.563321', '0.565084', '0.539875', '0.536454', '0.551219']
         : correct/total = [(7843, 14232), (7765, 14235), (8478, 14266), (8523, 14217), (8594, 14238), (8481, 14373), (8290, 14346), (8706, 14334), (8647, 14294), (8901, 14373), (8794, 14344), (8648, 14302), (7278, 14354), (7187, 14362), (7936, 14320), (8109, 14395), (8131, 14389), (7697, 14257), (7645, 14251), (7937, 14399)]
         : compromised: 0.5473, honest: 0.5876
Round 005: test acc mean=0.5924 ± 0.0433 | min=0.4866 max=0.6369
         : test loss mean=0.7215 ± 0.1993
         : individual accs = ['0.571248', '0.553495', '0.621197', '0.626152', '0.632111', '0.610798', '0.632302', '0.632831', '0.626067', '0.636889', '0.633157', '0.627185', '0.496656', '0.486631', '0.559986', '0.573949', '0.588088', '0.591850', '0.570556', '0.576151']
         : correct/total = [(8130, 14232), (7879, 14235), (8862, 14266), (8902, 14217), (9000, 14238), (8779, 14373), (9071, 14346), (9071, 14334), (8949, 14294), (9154, 14373), (9082, 14344), (8970, 14302), (7129, 14354), (6989, 14362), (8019, 14320), (8262, 14395), (8462, 14389), (8438, 14257), (8131, 14251), (8296, 14399)]
         : compromised: 0.5621, honest: 0.6125
Round 006: test acc mean=0.6064 ± 0.0429 | min=0.4954 max=0.6472
         : test loss mean=0.7361 ± 0.2632
         : individual accs = ['0.590852', '0.553073', '0.638862', '0.641626', '0.643911', '0.618590', '0.645616', '0.647202', '0.635791', '0.644194', '0.640686', '0.641309', '0.512052', '0.495405', '0.591620', '0.599861', '0.605115', '0.596198', '0.590134', '0.596361']
         : correct/total = [(8409, 14232), (7873, 14235), (9114, 14266), (9122, 14217), (9168, 14238), (8891, 14373), (9262, 14346), (9277, 14334), (9088, 14294), (9259, 14373), (9190, 14344), (9172, 14302), (7350, 14354), (7115, 14362), (8472, 14320), (8635, 14395), (8707, 14389), (8500, 14257), (8410, 14251), (8587, 14399)]
         : compromised: 0.5748, honest: 0.6275
Round 007: test acc mean=0.6141 ± 0.0477 | min=0.4785 max=0.6551
         : test loss mean=0.6616 ± 0.0626
         : individual accs = ['0.604272', '0.579276', '0.648956', '0.655061', '0.652409', '0.644681', '0.649380', '0.639807', '0.647125', '0.648299', '0.645915', '0.643407', '0.478543', '0.495544', '0.613757', '0.610559', '0.614289', '0.603774', '0.601853', '0.605737']
         : correct/total = [(8600, 14232), (8246, 14235), (9258, 14266), (9313, 14217), (9289, 14238), (9266, 14373), (9316, 14346), (9171, 14334), (9250, 14294), (9318, 14373), (9265, 14344), (9202, 14302), (6869, 14354), (7117, 14362), (8789, 14320), (8789, 14395), (8839, 14389), (8608, 14257), (8577, 14251), (8722, 14399)]
         : compromised: 0.5826, honest: 0.6352
Round 008: test acc mean=0.6262 ± 0.0427 | min=0.5104 max=0.6634
         : test loss mean=0.7132 ± 0.2382
         : individual accs = ['0.614812', '0.651985', '0.663395', '0.660758', '0.662312', '0.656857', '0.640806', '0.639807', '0.651952', '0.656439', '0.653723', '0.655083', '0.511843', '0.510375', '0.616341', '0.613477', '0.622628', '0.619906', '0.612659', '0.607959']
         : correct/total = [(8750, 14232), (9281, 14235), (9464, 14266), (9394, 14217), (9430, 14238), (9441, 14373), (9193, 14346), (9171, 14334), (9319, 14294), (9435, 14373), (9377, 14344), (9369, 14302), (7347, 14354), (7330, 14362), (8826, 14320), (8831, 14395), (8959, 14389), (8838, 14257), (8731, 14251), (8754, 14399)]
         : compromised: 0.6044, honest: 0.6407
Round 009: test acc mean=0.6252 ± 0.0449 | min=0.4977 max=0.6728
         : test loss mean=0.6668 ± 0.1090
         : individual accs = ['0.621135', '0.659009', '0.665568', '0.658789', '0.672847', '0.651569', '0.610553', '0.625227', '0.636631', '0.649760', '0.647030', '0.649490', '0.497701', '0.502855', '0.629469', '0.622716', '0.632567', '0.629866', '0.619325', '0.621085']
         : correct/total = [(8840, 14232), (9381, 14235), (9495, 14266), (9366, 14217), (9580, 14238), (9365, 14373), (8759, 14346), (8962, 14334), (9100, 14294), (9339, 14373), (9281, 14344), (9289, 14302), (7144, 14354), (7222, 14362), (9014, 14320), (8964, 14395), (9102, 14389), (8980, 14257), (8826, 14251), (8943, 14399)]
         : compromised: 0.6049, honest: 0.6387
Round 010: test acc mean=0.6383 ± 0.0457 | min=0.5117 max=0.6790
         : test loss mean=0.6817 ± 0.1873
         : individual accs = ['0.626476', '0.678890', '0.663045', '0.664275', '0.678958', '0.670354', '0.667085', '0.670364', '0.655800', '0.660405', '0.657627', '0.661166', '0.511704', '0.511767', '0.631564', '0.627232', '0.640628', '0.632672', '0.626903', '0.628933']
         : correct/total = [(8916, 14232), (9664, 14235), (9459, 14266), (9444, 14217), (9667, 14238), (9635, 14373), (9570, 14346), (9609, 14334), (9374, 14294), (9492, 14373), (9433, 14344), (9456, 14302), (7345, 14354), (7350, 14362), (9044, 14320), (9029, 14395), (9218, 14389), (9020, 14257), (8934, 14251), (9056, 14399)]
         : compromised: 0.6156, honest: 0.6534

=== FINAL RESULTS ===
Dataset: sent140, Nodes: 20, Graph: ring, Aggregation: balance
Attack: directed_deviation, 40.0% compromised
Final accuracy - Compromised: 0.6156, Honest: 0.6534
Overall test accuracy: mean=0.6383 ± 0.0457

=== BALANCE SUMMARY ===
Node 0: acceptance=0.600
Node 1: acceptance=0.750
Node 2: acceptance=0.600
Node 3: acceptance=1.000
Node 4: acceptance=0.600
Node 5: acceptance=0.800
Node 6: acceptance=0.600
Node 7: acceptance=1.000
Node 8: acceptance=1.000
Node 9: acceptance=1.000
Node 10: acceptance=0.600
Node 11: acceptance=0.550
Node 12: acceptance=0.200
Node 13: acceptance=0.200
Node 14: acceptance=0.550
Node 15: acceptance=0.600
Node 16: acceptance=0.600
Node 17: acceptance=0.550
Node 18: acceptance=0.550
Node 19: acceptance=0.600

=== PARALLEL EXECUTION TIME (realistic for distributed system) ===
  COMMUNICATION (max across nodes):
    - Full model transfer: 0.000s (0.0%)
  COMPUTATION (max across nodes):
    - Filtering: 0.012s (53.9%)
    - Aggregation: 0.010s (46.1%)
  TOTALS:
    - Total computation: 0.022s (100.0%)
    - Total communication: 0.000s (0.0%)
    - Total parallel time: 0.022s

=== PER-NODE AVERAGE TIME ===
  - Filtering: 0.011s
  - Aggregation: 0.005s
  - Model transfer: 0.000s
  - Total per node: 0.016s

=== TOTAL COMPUTATIONAL WORK (sum across all nodes) ===
  - Total filtering: 0.218s
  - Total aggregation: 0.098s
  - Total model transfer: 0.000s
  - Grand total: 0.316s
  - Mean acceptance rate: 0.647

BALANCE Algorithm Properties:
  - Model dimension: 1,174,986
  - No compression: Full parameter comparison
  - Theoretical complexity: O(deg(i)×d)
  - Approach: Full parameter filtering + averaging
