Device: cuda
Seed: 987654321
Loading 1 LEAF Sent140 train files...
LEAF Sent140 train: 254555 users, 908652 samples
Building vocabulary (max_size=10000)...
Vocabulary size: 10000
Loading 1 LEAF Sent140 test files...
LEAF Sent140 test: 254555 users, 286281 samples
Found 254555 train users, 254555 test users, 254555 common users
User sample counts range: 494 (max) to 1 (min)
Distributed ALL 254555 users across 20 clients
Users per client: 12727 (with 15 clients getting +1 user)
Train partition sizes: [44353, 44290, 44657, 44907, 44696, 45843, 45801, 45619, 45069, 45639, 45821, 45311, 45779, 46056, 45625, 45984, 46428, 44737, 45540, 46497]
Test partition sizes: [14232, 14235, 14266, 14217, 14238, 14373, 14346, 14334, 14294, 14373, 14344, 14302, 14354, 14362, 14320, 14395, 14389, 14257, 14251, 14399]
  Client 0: 44353 train samples, 2 unique classes
  Client 1: 44290 train samples, 2 unique classes
  Client 2: 44657 train samples, 2 unique classes
  Client 3: 44907 train samples, 2 unique classes
  Client 4: 44696 train samples, 2 unique classes
  Client 5: 45843 train samples, 2 unique classes
  Client 6: 45801 train samples, 2 unique classes
  Client 7: 45619 train samples, 2 unique classes
  Client 8: 45069 train samples, 2 unique classes
  Client 9: 45639 train samples, 2 unique classes
  Client 10: 45821 train samples, 2 unique classes
  Client 11: 45311 train samples, 2 unique classes
  Client 12: 45779 train samples, 2 unique classes
  Client 13: 46056 train samples, 2 unique classes
  Client 14: 45625 train samples, 2 unique classes
  Client 15: 45984 train samples, 2 unique classes
  Client 16: 46428 train samples, 2 unique classes
  Client 17: 44737 train samples, 2 unique classes
  Client 18: 45540 train samples, 2 unique classes
  Client 19: 46497 train samples, 2 unique classes
Will sample 4500 samples per client per epoch
Graph: erdos, nodes: 20, edges: 48
Degree statistics: avg=4.80, min=2, max=7
Attack: Compromised 14/20 nodes: [1, 2, 3, 5, 6, 8, 11, 12, 13, 14, 15, 17, 18, 19]
Attack type: directed_deviation, lambda: 1.0
Model variant: baseline
Model parameters: 1,174,986
Initial test acc across nodes: mean=0.4953 ± 0.0174
Round 001: test acc mean=0.4980 ± 0.0068 | min=0.4865 max=0.5149
         : test loss mean=12.5642 ± 7.8947
         : individual accs = ['0.507940', '0.486477', '0.492640', '0.514877', '0.500421', '0.496834', '0.498885', '0.488070', '0.491255', '0.499200', '0.499233', '0.492588', '0.495959', '0.497215', '0.504190', '0.501702', '0.504413', '0.488602', '0.499404', '0.499687']
         : correct/total = [(7229, 14232), (6925, 14235), (7028, 14266), (7320, 14217), (7125, 14238), (7141, 14373), (7157, 14346), (6996, 14334), (7022, 14294), (7175, 14373), (7161, 14344), (7045, 14302), (7119, 14354), (7141, 14362), (7220, 14320), (7222, 14395), (7258, 14389), (6966, 14257), (7117, 14251), (7195, 14399)]
         : compromised: 0.4972, honest: 0.4999
Round 002: test acc mean=0.5047 ± 0.0074 | min=0.4899 max=0.5173
         : test loss mean=11.1245 ± 6.0089
         : individual accs = ['0.505270', '0.511556', '0.508762', '0.515510', '0.511799', '0.504488', '0.498815', '0.514441', '0.496782', '0.500244', '0.489891', '0.503286', '0.500557', '0.491505', '0.511592', '0.504550', '0.505386', '0.503051', '0.517297', '0.498229']
         : correct/total = [(7191, 14232), (7282, 14235), (7258, 14266), (7329, 14217), (7287, 14238), (7251, 14373), (7156, 14346), (7374, 14334), (7101, 14294), (7190, 14373), (7027, 14344), (7198, 14302), (7185, 14354), (7059, 14362), (7326, 14320), (7263, 14395), (7272, 14389), (7172, 14257), (7372, 14251), (7174, 14399)]
         : compromised: 0.5047, honest: 0.5045
Round 003: test acc mean=0.4965 ± 0.0079 | min=0.4828 max=0.5096
         : test loss mean=3.0762 ± 1.4440
         : individual accs = ['0.488406', '0.485283', '0.489485', '0.489133', '0.497893', '0.505949', '0.501324', '0.509558', '0.496642', '0.482850', '0.497630', '0.496015', '0.507245', '0.504178', '0.495531', '0.505384', '0.504900', '0.495476', '0.493790', '0.484200']
         : correct/total = [(6951, 14232), (6908, 14235), (6983, 14266), (6954, 14217), (7089, 14238), (7272, 14373), (7192, 14346), (7304, 14334), (7099, 14294), (6940, 14373), (7138, 14344), (7094, 14302), (7281, 14354), (7241, 14362), (7096, 14320), (7275, 14395), (7265, 14389), (7064, 14257), (7037, 14251), (6972, 14399)]
         : compromised: 0.4964, honest: 0.4969
Round 004: test acc mean=0.5003 ± 0.0064 | min=0.4865 max=0.5092
         : test loss mean=3.9031 ± 2.9995
         : individual accs = ['0.495152', '0.492940', '0.502453', '0.508124', '0.507445', '0.498087', '0.507110', '0.492326', '0.503638', '0.506227', '0.493098', '0.509160', '0.506618', '0.499095', '0.507751', '0.486488', '0.494127', '0.498632', '0.499263', '0.498924']
         : correct/total = [(7047, 14232), (7017, 14235), (7168, 14266), (7224, 14217), (7225, 14238), (7159, 14373), (7275, 14346), (7057, 14334), (7199, 14294), (7276, 14373), (7073, 14344), (7282, 14302), (7272, 14354), (7168, 14362), (7271, 14320), (7003, 14395), (7110, 14389), (7109, 14257), (7115, 14251), (7184, 14399)]
         : compromised: 0.5013, honest: 0.4981
Round 005: test acc mean=0.4980 ± 0.0061 | min=0.4894 max=0.5111
         : test loss mean=2.2327 ± 1.4376
         : individual accs = ['0.495433', '0.508957', '0.489415', '0.492157', '0.506953', '0.495373', '0.500697', '0.500628', '0.499720', '0.493356', '0.498536', '0.489792', '0.492476', '0.496867', '0.501187', '0.502883', '0.489749', '0.499264', '0.511052', '0.495798']
         : correct/total = [(7051, 14232), (7245, 14235), (6982, 14266), (6997, 14217), (7218, 14238), (7120, 14373), (7183, 14346), (7176, 14334), (7143, 14294), (7091, 14373), (7151, 14344), (7005, 14302), (7069, 14354), (7136, 14362), (7177, 14320), (7239, 14395), (7047, 14389), (7118, 14257), (7283, 14251), (7139, 14399)]
         : compromised: 0.4983, honest: 0.4974
Round 006: test acc mean=0.4979 ± 0.0043 | min=0.4909 max=0.5057
         : test loss mean=2.0971 ± 1.7217
         : individual accs = ['0.503092', '0.497717', '0.499579', '0.490891', '0.491572', '0.496486', '0.499164', '0.494837', '0.498461', '0.499687', '0.504183', '0.499021', '0.494078', '0.505222', '0.498324', '0.492185', '0.505734', '0.492951', '0.496106', '0.499410']
         : correct/total = [(7160, 14232), (7085, 14235), (7127, 14266), (6979, 14217), (6999, 14238), (7136, 14373), (7161, 14346), (7093, 14334), (7125, 14294), (7182, 14373), (7232, 14344), (7137, 14302), (7092, 14354), (7256, 14362), (7136, 14320), (7085, 14395), (7277, 14389), (7028, 14257), (7070, 14251), (7191, 14399)]
         : compromised: 0.4971, honest: 0.4999
Round 007: test acc mean=0.4960 ± 0.0116 | min=0.4762 max=0.5247
         : test loss mean=1.6822 ± 0.9999
         : individual accs = ['0.500703', '0.502915', '0.490607', '0.488992', '0.497893', '0.482641', '0.491705', '0.497698', '0.493634', '0.524734', '0.510388', '0.499231', '0.477707', '0.476187', '0.500978', '0.481348', '0.498367', '0.501438', '0.490492', '0.512397']
         : correct/total = [(7126, 14232), (7159, 14235), (6999, 14266), (6952, 14217), (7089, 14238), (6937, 14373), (7054, 14346), (7134, 14334), (7056, 14294), (7542, 14373), (7321, 14344), (7140, 14302), (6857, 14354), (6839, 14362), (7174, 14320), (6929, 14395), (7171, 14389), (7149, 14257), (6990, 14251), (7378, 14399)]
         : compromised: 0.4922, honest: 0.5050
Round 008: test acc mean=0.5022 ± 0.0093 | min=0.4918 max=0.5336
         : test loss mean=1.9095 ± 1.7480
         : individual accs = ['0.507097', '0.500597', '0.504066', '0.509742', '0.498033', '0.497321', '0.500209', '0.533557', '0.501819', '0.512350', '0.493726', '0.504615', '0.495402', '0.502507', '0.499511', '0.491768', '0.509764', '0.493372', '0.492527', '0.495798']
         : correct/total = [(7217, 14232), (7126, 14235), (7191, 14266), (7247, 14217), (7091, 14238), (7148, 14373), (7176, 14346), (7648, 14334), (7173, 14294), (7364, 14373), (7082, 14344), (7217, 14302), (7111, 14354), (7217, 14362), (7153, 14320), (7079, 14395), (7335, 14389), (7034, 14257), (7019, 14251), (7139, 14399)]
         : compromised: 0.4992, honest: 0.5091
Round 009: test acc mean=0.4978 ± 0.0117 | min=0.4687 max=0.5314
         : test loss mean=1.4238 ± 0.8588
         : individual accs = ['0.494098', '0.507903', '0.507641', '0.489766', '0.506462', '0.493216', '0.494284', '0.531394', '0.490136', '0.500244', '0.497909', '0.486645', '0.468720', '0.503969', '0.502863', '0.495589', '0.498575', '0.487971', '0.503894', '0.495243']
         : correct/total = [(7032, 14232), (7230, 14235), (7242, 14266), (6963, 14217), (7211, 14238), (7089, 14373), (7091, 14346), (7617, 14334), (7006, 14294), (7190, 14373), (7142, 14344), (6960, 14302), (6728, 14354), (7238, 14362), (7201, 14320), (7134, 14395), (7174, 14389), (6957, 14257), (7181, 14251), (7131, 14399)]
         : compromised: 0.4948, honest: 0.5048
Round 010: test acc mean=0.5050 ± 0.0075 | min=0.4877 max=0.5199
         : test loss mean=1.7938 ± 1.5674
         : individual accs = ['0.508994', '0.505515', '0.510374', '0.514103', '0.519876', '0.494121', '0.500627', '0.508232', '0.504827', '0.509845', '0.510597', '0.508251', '0.496099', '0.507520', '0.510615', '0.487739', '0.503788', '0.499123', '0.493930', '0.506702']
         : correct/total = [(7244, 14232), (7196, 14235), (7281, 14266), (7309, 14217), (7402, 14238), (7102, 14373), (7182, 14346), (7285, 14334), (7216, 14294), (7328, 14373), (7324, 14344), (7269, 14302), (7121, 14354), (7289, 14362), (7312, 14320), (7021, 14395), (7249, 14389), (7116, 14257), (7039, 14251), (7296, 14399)]
         : compromised: 0.5028, honest: 0.5102

=== FINAL RESULTS ===
Dataset: sent140, Nodes: 20, Graph: erdos, Aggregation: krum
Attack: directed_deviation, 70.0% compromised
Final accuracy - Compromised: 0.5028, Honest: 0.5102
Overall test accuracy: mean=0.5050 ± 0.0075
