Device: cuda
Seed: 987654321
Loading 1 LEAF Sent140 train files...
LEAF Sent140 train: 254555 users, 908652 samples
Building vocabulary (max_size=10000)...
Vocabulary size: 10000
Loading 1 LEAF Sent140 test files...
LEAF Sent140 test: 254555 users, 286281 samples
Found 254555 train users, 254555 test users, 254555 common users
User sample counts range: 494 (max) to 1 (min)
Distributed ALL 254555 users across 20 clients
Users per client: 12727 (with 15 clients getting +1 user)
Train partition sizes: [44353, 44290, 44657, 44907, 44696, 45843, 45801, 45619, 45069, 45639, 45821, 45311, 45779, 46056, 45625, 45984, 46428, 44737, 45540, 46497]
Test partition sizes: [14232, 14235, 14266, 14217, 14238, 14373, 14346, 14334, 14294, 14373, 14344, 14302, 14354, 14362, 14320, 14395, 14389, 14257, 14251, 14399]
  Client 0: 44353 train samples, 2 unique classes
  Client 1: 44290 train samples, 2 unique classes
  Client 2: 44657 train samples, 2 unique classes
  Client 3: 44907 train samples, 2 unique classes
  Client 4: 44696 train samples, 2 unique classes
  Client 5: 45843 train samples, 2 unique classes
  Client 6: 45801 train samples, 2 unique classes
  Client 7: 45619 train samples, 2 unique classes
  Client 8: 45069 train samples, 2 unique classes
  Client 9: 45639 train samples, 2 unique classes
  Client 10: 45821 train samples, 2 unique classes
  Client 11: 45311 train samples, 2 unique classes
  Client 12: 45779 train samples, 2 unique classes
  Client 13: 46056 train samples, 2 unique classes
  Client 14: 45625 train samples, 2 unique classes
  Client 15: 45984 train samples, 2 unique classes
  Client 16: 46428 train samples, 2 unique classes
  Client 17: 44737 train samples, 2 unique classes
  Client 18: 45540 train samples, 2 unique classes
  Client 19: 46497 train samples, 2 unique classes
Will sample 4500 samples per client per epoch
Graph: ring, nodes: 20, edges: 20
Degree statistics: avg=2.00, min=2, max=2
Attack: Compromised 4/20 nodes: [5, 12, 13, 17]
Attack type: backdoor, lambda: 1.0
Backdoor target label: 1, trigger size: 3
Model variant: baseline
Model parameters: 1,174,986
Initial test acc across nodes: mean=0.4953 ± 0.0174
Backdoor attack: Created poisoned datasets for 4 compromised nodes
Round 001: test acc mean=0.5967 ± 0.0643 | min=0.4922 max=0.6506
         : test loss mean=8.5843 ± 13.2035
         : individual accs = ['0.650646', '0.644468', '0.649236', '0.630794', '0.635483', '0.498782', '0.649937', '0.639877', '0.636911', '0.619286', '0.613009', '0.643197', '0.503901', '0.504456', '0.494832', '0.636332', '0.637501', '0.492179', '0.503614', '0.649906']
         : correct/total = [(9260, 14232), (9174, 14235), (9262, 14266), (8968, 14217), (9048, 14238), (7169, 14373), (9324, 14346), (9172, 14334), (9104, 14294), (8901, 14373), (8793, 14344), (9199, 14302), (7233, 14354), (7245, 14362), (7086, 14320), (9160, 14395), (9173, 14389), (7017, 14257), (7177, 14251), (9358, 14399)]
         : compromised: 0.4998, honest: 0.6209
Round 002: test acc mean=0.6028 ± 0.0676 | min=0.4982 max=0.6712
         : test loss mean=4.4627 ± 5.9307
         : individual accs = ['0.658165', '0.637373', '0.630100', '0.671239', '0.654797', '0.514785', '0.515475', '0.661016', '0.640479', '0.638837', '0.661601', '0.656342', '0.514560', '0.502994', '0.529539', '0.653282', '0.643547', '0.508101', '0.498211', '0.666088']
         : correct/total = [(9367, 14232), (9073, 14235), (8989, 14266), (9543, 14217), (9323, 14238), (7399, 14373), (7395, 14346), (9475, 14334), (9155, 14294), (9182, 14373), (9490, 14344), (9387, 14302), (7386, 14354), (7224, 14362), (7583, 14320), (9404, 14395), (9260, 14389), (7244, 14257), (7100, 14251), (9591, 14399)]
         : compromised: 0.5101, honest: 0.6260
Round 003: test acc mean=0.6045 ± 0.0831 | min=0.4711 max=0.6830
         : test loss mean=3.2593 ± 4.3647
         : individual accs = ['0.658938', '0.677485', '0.678116', '0.682985', '0.659573', '0.502261', '0.499930', '0.666736', '0.674059', '0.666875', '0.654629', '0.674241', '0.490038', '0.510862', '0.483520', '0.654463', '0.652790', '0.471137', '0.489790', '0.642197']
         : correct/total = [(9378, 14232), (9644, 14235), (9674, 14266), (9710, 14217), (9391, 14238), (7219, 14373), (7172, 14346), (9557, 14334), (9635, 14294), (9585, 14373), (9390, 14344), (9643, 14302), (7034, 14354), (7337, 14362), (6924, 14320), (9421, 14395), (9393, 14389), (6717, 14257), (6980, 14251), (9247, 14399)]
         : compromised: 0.4936, honest: 0.6323
Round 004: test acc mean=0.6153 ± 0.0846 | min=0.4902 max=0.6930
         : test loss mean=1.8646 ± 2.8526
         : individual accs = ['0.687605', '0.685002', '0.685616', '0.689878', '0.693005', '0.490155', '0.491635', '0.649086', '0.672240', '0.658874', '0.674359', '0.654244', '0.495332', '0.492480', '0.531425', '0.673498', '0.683508', '0.503051', '0.506631', '0.687826']
         : correct/total = [(9786, 14232), (9751, 14235), (9781, 14266), (9808, 14217), (9867, 14238), (7045, 14373), (7053, 14346), (9304, 14334), (9609, 14294), (9470, 14373), (9673, 14344), (9357, 14302), (7110, 14354), (7073, 14362), (7610, 14320), (9695, 14395), (9835, 14389), (7172, 14257), (7220, 14251), (9904, 14399)]
         : compromised: 0.4953, honest: 0.6453
Round 005: test acc mean=0.6224 ± 0.0894 | min=0.4916 max=0.7045
         : test loss mean=2.4856 ± 3.4495
         : individual accs = ['0.695897', '0.690200', '0.697673', '0.676092', '0.704453', '0.497530', '0.496375', '0.660318', '0.694137', '0.646420', '0.690811', '0.685918', '0.495681', '0.507520', '0.491620', '0.694755', '0.699145', '0.509785', '0.515753', '0.697062']
         : correct/total = [(9904, 14232), (9825, 14235), (9953, 14266), (9612, 14217), (10030, 14238), (7151, 14373), (7121, 14346), (9465, 14334), (9922, 14294), (9291, 14373), (9909, 14344), (9810, 14302), (7115, 14354), (7289, 14362), (7040, 14320), (10001, 14395), (10060, 14389), (7268, 14257), (7350, 14251), (10037, 14399)]
         : compromised: 0.5026, honest: 0.6523
Round 006: test acc mean=0.6297 ± 0.0946 | min=0.4886 max=0.7111
         : test loss mean=2.9463 ± 4.1241
         : individual accs = ['0.691751', '0.705304', '0.695009', '0.703805', '0.711055', '0.504488', '0.514290', '0.690038', '0.701623', '0.695540', '0.688302', '0.687456', '0.488644', '0.499373', '0.497765', '0.707468', '0.703941', '0.501999', '0.501088', '0.704285']
         : correct/total = [(9845, 14232), (10040, 14235), (9915, 14266), (10006, 14217), (10124, 14238), (7251, 14373), (7378, 14346), (9891, 14334), (10029, 14294), (9997, 14373), (9873, 14344), (9832, 14302), (7014, 14354), (7172, 14362), (7128, 14320), (10184, 14395), (10129, 14389), (7157, 14257), (7141, 14251), (10141, 14399)]
         : compromised: 0.4986, honest: 0.6624
Round 007: test acc mean=0.6288 ± 0.0956 | min=0.4927 max=0.7191
         : test loss mean=2.8022 ± 3.5989
         : individual accs = ['0.700745', '0.712118', '0.692065', '0.706548', '0.719132', '0.501705', '0.494005', '0.673643', '0.706590', '0.700550', '0.705312', '0.707104', '0.501672', '0.492689', '0.505517', '0.655228', '0.702134', '0.501859', '0.501298', '0.696784']
         : correct/total = [(9973, 14232), (10137, 14235), (9873, 14266), (10045, 14217), (10239, 14238), (7211, 14373), (7087, 14346), (9656, 14334), (10100, 14294), (10069, 14373), (10117, 14344), (10113, 14302), (7201, 14354), (7076, 14362), (7239, 14320), (9432, 14395), (10103, 14389), (7155, 14257), (7144, 14251), (10033, 14399)]
         : compromised: 0.4995, honest: 0.6612
Round 008: test acc mean=0.6329 ± 0.1004 | min=0.4905 max=0.7179
         : test loss mean=2.9315 ± 3.7140
         : individual accs = ['0.711636', '0.712750', '0.678396', '0.714286', '0.689493', '0.499130', '0.498118', '0.704897', '0.713726', '0.712656', '0.694088', '0.704167', '0.506618', '0.490461', '0.501257', '0.708371', '0.717910', '0.490776', '0.490632', '0.717828']
         : correct/total = [(10128, 14232), (10146, 14235), (9678, 14266), (10155, 14217), (9817, 14238), (7174, 14373), (7146, 14346), (10104, 14334), (10202, 14294), (10243, 14373), (9956, 14344), (10071, 14302), (7272, 14354), (7044, 14362), (7178, 14320), (10197, 14395), (10330, 14389), (6997, 14257), (6992, 14251), (10336, 14399)]
         : compromised: 0.4967, honest: 0.6669
Round 009: test acc mean=0.6422 ± 0.1003 | min=0.5009 max=0.7255
         : test loss mean=3.7094 ± 6.0587
         : individual accs = ['0.706015', '0.725465', '0.721365', '0.722515', '0.721169', '0.516594', '0.513941', '0.724710', '0.714356', '0.695192', '0.713608', '0.706964', '0.501254', '0.503969', '0.501536', '0.708857', '0.722913', '0.503472', '0.500877', '0.718592']
         : correct/total = [(10048, 14232), (10327, 14235), (10291, 14266), (10272, 14217), (10268, 14238), (7425, 14373), (7373, 14346), (10388, 14334), (10211, 14294), (9992, 14373), (10236, 14344), (10111, 14302), (7195, 14354), (7238, 14362), (7182, 14320), (10204, 14395), (10402, 14389), (7178, 14257), (7138, 14251), (10347, 14399)]
         : compromised: 0.5063, honest: 0.6761
Round 010: test acc mean=0.6401 ± 0.1030 | min=0.4909 max=0.7332
         : test loss mean=2.9447 ± 3.5531
         : individual accs = ['0.712268', '0.721321', '0.704122', '0.729479', '0.733249', '0.497182', '0.497839', '0.721153', '0.716384', '0.698810', '0.711517', '0.713816', '0.502229', '0.504038', '0.490922', '0.725113', '0.699076', '0.511608', '0.497790', '0.713452']
         : correct/total = [(10137, 14232), (10268, 14235), (10045, 14266), (10371, 14217), (10440, 14238), (7146, 14373), (7142, 14346), (10337, 14334), (10240, 14294), (10044, 14373), (10206, 14344), (10209, 14302), (7209, 14354), (7239, 14362), (7030, 14320), (10438, 14395), (10059, 14389), (7294, 14257), (7094, 14251), (10273, 14399)]
         : compromised: 0.5038, honest: 0.6741

=== FINAL RESULTS ===
Dataset: sent140, Nodes: 20, Graph: ring, Aggregation: krum
Attack: backdoor, 20.0% compromised
Final accuracy - Compromised: 0.5038, Honest: 0.6741
Overall test accuracy: mean=0.6401 ± 0.1030

=== BACKDOOR ATTACK SUCCESS RATE (ASR) ===
Target label: 1
Trigger size: 3x3
Overall ASR: 0.5560 ± 0.1847
Honest nodes ASR: 0.5025 ± 0.1507
Compromised nodes ASR: 0.7701 ± 0.1494
Note: Higher ASR indicates more successful backdoor attack
