Device: cuda
Seed: 987654321
Loading 1 LEAF Sent140 train files...
LEAF Sent140 train: 254555 users, 908652 samples
Building vocabulary (max_size=10000)...
Vocabulary size: 10000
Loading 1 LEAF Sent140 test files...
LEAF Sent140 test: 254555 users, 286281 samples
Found 254555 train users, 254555 test users, 254555 common users
User sample counts range: 494 (max) to 1 (min)
Distributed ALL 254555 users across 20 clients
Users per client: 12727 (with 15 clients getting +1 user)
Train partition sizes: [44353, 44290, 44657, 44907, 44696, 45843, 45801, 45619, 45069, 45639, 45821, 45311, 45779, 46056, 45625, 45984, 46428, 44737, 45540, 46497]
Test partition sizes: [14232, 14235, 14266, 14217, 14238, 14373, 14346, 14334, 14294, 14373, 14344, 14302, 14354, 14362, 14320, 14395, 14389, 14257, 14251, 14399]
  Client 0: 44353 train samples, 2 unique classes
  Client 1: 44290 train samples, 2 unique classes
  Client 2: 44657 train samples, 2 unique classes
  Client 3: 44907 train samples, 2 unique classes
  Client 4: 44696 train samples, 2 unique classes
  Client 5: 45843 train samples, 2 unique classes
  Client 6: 45801 train samples, 2 unique classes
  Client 7: 45619 train samples, 2 unique classes
  Client 8: 45069 train samples, 2 unique classes
  Client 9: 45639 train samples, 2 unique classes
  Client 10: 45821 train samples, 2 unique classes
  Client 11: 45311 train samples, 2 unique classes
  Client 12: 45779 train samples, 2 unique classes
  Client 13: 46056 train samples, 2 unique classes
  Client 14: 45625 train samples, 2 unique classes
  Client 15: 45984 train samples, 2 unique classes
  Client 16: 46428 train samples, 2 unique classes
  Client 17: 44737 train samples, 2 unique classes
  Client 18: 45540 train samples, 2 unique classes
  Client 19: 46497 train samples, 2 unique classes
Will sample 4500 samples per client per epoch
Graph: erdos, nodes: 20, edges: 48
Degree statistics: avg=4.80, min=2, max=7
Attack: Compromised 6/20 nodes: [5, 12, 13, 14, 17, 18]
Attack type: backdoor, lambda: 1.0
Backdoor target label: 1, trigger size: 3
Model variant: baseline
Model parameters: 1,174,986
Initial test acc across nodes: mean=0.4953 ± 0.0174
Backdoor attack: Created poisoned datasets for 6 compromised nodes
Round 001: test acc mean=0.5262 ± 0.0548 | min=0.4889 max=0.6475
         : test loss mean=18.7074 ± 14.4899
         : individual accs = ['0.612493', '0.647489', '0.512688', '0.494830', '0.491502', '0.493216', '0.488986', '0.498116', '0.646005', '0.514367', '0.501743', '0.494336', '0.502578', '0.504387', '0.494763', '0.507259', '0.497116', '0.502139', '0.488948', '0.630738']
         : correct/total = [(8717, 14232), (9217, 14235), (7314, 14266), (7035, 14217), (6998, 14238), (7089, 14373), (7015, 14346), (7140, 14334), (9234, 14294), (7393, 14373), (7197, 14344), (7070, 14302), (7214, 14354), (7244, 14362), (7085, 14320), (7302, 14395), (7153, 14389), (7159, 14257), (6968, 14251), (9082, 14399)]
         : compromised: 0.4977, honest: 0.5384
Round 002: test acc mean=0.5724 ± 0.0758 | min=0.4873 max=0.6654
         : test loss mean=8.9903 ± 9.9161
         : individual accs = ['0.612774', '0.649034', '0.647554', '0.613421', '0.490378', '0.492590', '0.651471', '0.487303', '0.657619', '0.497669', '0.660067', '0.497273', '0.657378', '0.509191', '0.493017', '0.491699', '0.523664', '0.496598', '0.653287', '0.665393']
         : correct/total = [(8721, 14232), (9239, 14235), (9238, 14266), (8721, 14217), (6982, 14238), (7080, 14373), (9346, 14346), (6985, 14334), (9400, 14294), (7153, 14373), (9468, 14344), (7112, 14302), (9436, 14354), (7313, 14362), (7060, 14320), (7078, 14395), (7535, 14389), (7080, 14257), (9310, 14251), (9581, 14399)]
         : compromised: 0.5503, honest: 0.5818
Round 003: test acc mean=0.5925 ± 0.0744 | min=0.4922 max=0.6733
         : test loss mean=2.3872 ± 3.2752
         : individual accs = ['0.667369', '0.660976', '0.588883', '0.632904', '0.505478', '0.504905', '0.636345', '0.666039', '0.673289', '0.511236', '0.658603', '0.636834', '0.666434', '0.499930', '0.510754', '0.502536', '0.506012', '0.492249', '0.664795', '0.665255']
         : correct/total = [(9498, 14232), (9409, 14235), (8401, 14266), (8998, 14217), (7197, 14238), (7257, 14373), (9129, 14346), (9547, 14334), (9624, 14294), (7348, 14373), (9447, 14344), (9108, 14302), (9566, 14354), (7180, 14362), (7314, 14320), (7234, 14395), (7281, 14389), (7018, 14257), (9474, 14251), (9579, 14399)]
         : compromised: 0.5565, honest: 0.6080
Round 004: test acc mean=0.5859 ± 0.0738 | min=0.4937 max=0.6914
         : test loss mean=4.0125 ± 5.5059
         : individual accs = ['0.629848', '0.614542', '0.671387', '0.643244', '0.500632', '0.496278', '0.641294', '0.652574', '0.671960', '0.495582', '0.642987', '0.619424', '0.502787', '0.638490', '0.493715', '0.498229', '0.500313', '0.498632', '0.613852', '0.691367']
         : correct/total = [(8964, 14232), (8748, 14235), (9578, 14266), (9145, 14217), (7128, 14238), (7133, 14373), (9200, 14346), (9354, 14334), (9605, 14294), (7123, 14373), (9223, 14344), (8859, 14302), (7217, 14354), (9170, 14362), (7070, 14320), (7172, 14395), (7199, 14389), (7109, 14257), (8748, 14251), (9955, 14399)]
         : compromised: 0.5406, honest: 0.6052
Round 005: test acc mean=0.5961 ± 0.0820 | min=0.4860 max=0.7015
         : test loss mean=2.3371 ± 2.7514
         : individual accs = ['0.634275', '0.645662', '0.640334', '0.638531', '0.497120', '0.499756', '0.642479', '0.687108', '0.686792', '0.503861', '0.687674', '0.641099', '0.485997', '0.647194', '0.498813', '0.504203', '0.500452', '0.497300', '0.682408', '0.701507']
         : correct/total = [(9027, 14232), (9191, 14235), (9135, 14266), (9078, 14217), (7078, 14238), (7183, 14373), (9217, 14346), (9849, 14334), (9817, 14294), (7242, 14373), (9864, 14344), (9169, 14302), (6976, 14354), (9295, 14362), (7143, 14320), (7258, 14395), (7201, 14389), (7090, 14257), (9725, 14251), (10101, 14399)]
         : compromised: 0.5519, honest: 0.6151
Round 006: test acc mean=0.5918 ± 0.0778 | min=0.4946 max=0.7007
         : test loss mean=5.2001 ± 7.5766
         : individual accs = ['0.636945', '0.647629', '0.645311', '0.648871', '0.498174', '0.504279', '0.651471', '0.503070', '0.698895', '0.571210', '0.678681', '0.648790', '0.494566', '0.652764', '0.507193', '0.502188', '0.503440', '0.499474', '0.642551', '0.700743']
         : correct/total = [(9065, 14232), (9219, 14235), (9206, 14266), (9225, 14217), (7093, 14238), (7248, 14373), (9346, 14346), (7211, 14334), (9990, 14294), (8210, 14373), (9735, 14344), (9279, 14302), (7099, 14354), (9375, 14362), (7263, 14320), (7229, 14395), (7244, 14389), (7121, 14257), (9157, 14251), (10090, 14399)]
         : compromised: 0.5501, honest: 0.6097
Round 007: test acc mean=0.5932 ± 0.0766 | min=0.4916 max=0.7108
         : test loss mean=1.7808 ± 1.5447
         : individual accs = ['0.613898', '0.646154', '0.610332', '0.646339', '0.501194', '0.498087', '0.649728', '0.522325', '0.701623', '0.631949', '0.710750', '0.645015', '0.499164', '0.650188', '0.496229', '0.534422', '0.491556', '0.492881', '0.641569', '0.681506']
         : correct/total = [(8737, 14232), (9198, 14235), (8707, 14266), (9189, 14217), (7136, 14238), (7159, 14373), (9321, 14346), (7487, 14334), (10029, 14294), (9083, 14373), (10195, 14344), (9225, 14302), (7165, 14354), (9338, 14362), (7106, 14320), (7693, 14395), (7073, 14389), (7027, 14257), (9143, 14251), (9813, 14399)]
         : compromised: 0.5464, honest: 0.6133
Round 008: test acc mean=0.5983 ± 0.0878 | min=0.4796 max=0.7142
         : test loss mean=5.2159 ± 5.9799
         : individual accs = ['0.656759', '0.659501', '0.656596', '0.650067', '0.488552', '0.501913', '0.657814', '0.479559', '0.712397', '0.642176', '0.710192', '0.649769', '0.501393', '0.657151', '0.493017', '0.497673', '0.492599', '0.495055', '0.649709', '0.714216']
         : correct/total = [(9347, 14232), (9388, 14235), (9367, 14266), (9242, 14217), (6956, 14238), (7214, 14373), (9437, 14346), (6874, 14334), (10183, 14294), (9230, 14373), (10187, 14344), (9293, 14302), (7197, 14354), (9438, 14362), (7060, 14320), (7164, 14395), (7088, 14389), (7058, 14257), (9259, 14251), (10284, 14399)]
         : compromised: 0.5497, honest: 0.6191
Round 009: test acc mean=0.6024 ± 0.0871 | min=0.4900 max=0.7241
         : test loss mean=1.9736 ± 2.0989
         : individual accs = ['0.626124', '0.660976', '0.649516', '0.663150', '0.490027', '0.502539', '0.664227', '0.493861', '0.715055', '0.649343', '0.716955', '0.658439', '0.517068', '0.664810', '0.490014', '0.495589', '0.500799', '0.506979', '0.658480', '0.724148']
         : correct/total = [(8911, 14232), (9409, 14235), (9266, 14266), (9428, 14217), (6977, 14238), (7223, 14373), (9529, 14346), (7079, 14334), (10221, 14294), (9333, 14373), (10284, 14344), (9417, 14302), (7422, 14354), (9548, 14362), (7017, 14320), (7134, 14395), (7206, 14389), (7228, 14257), (9384, 14251), (10427, 14399)]
         : compromised: 0.5566, honest: 0.6220
Round 010: test acc mean=0.6071 ± 0.0849 | min=0.4931 max=0.7239
         : test loss mean=1.9594 ± 1.9029
         : individual accs = ['0.646571', '0.667439', '0.663886', '0.662235', '0.509903', '0.508105', '0.659138', '0.505093', '0.718203', '0.651847', '0.723857', '0.656482', '0.527449', '0.665715', '0.493087', '0.502675', '0.510598', '0.497089', '0.652866', '0.720467']
         : correct/total = [(9202, 14232), (9501, 14235), (9471, 14266), (9415, 14217), (7260, 14238), (7303, 14373), (9456, 14346), (7240, 14334), (10266, 14294), (9369, 14373), (10383, 14344), (9389, 14302), (7571, 14354), (9561, 14362), (7061, 14320), (7236, 14395), (7347, 14389), (7087, 14257), (9304, 14251), (10374, 14399)]
         : compromised: 0.5574, honest: 0.6285

=== FINAL RESULTS ===
Dataset: sent140, Nodes: 20, Graph: erdos, Aggregation: krum
Attack: backdoor, 30.0% compromised
Final accuracy - Compromised: 0.5574, Honest: 0.6285
Overall test accuracy: mean=0.6071 ± 0.0849

=== BACKDOOR ATTACK SUCCESS RATE (ASR) ===
Target label: 1
Trigger size: 3x3
Overall ASR: 0.4964 ± 0.1465
Honest nodes ASR: 0.4822 ± 0.0736
Compromised nodes ASR: 0.5297 ± 0.2394
Note: Higher ASR indicates more successful backdoor attack
