Device: cuda
Seed: 987654321
Loading 1 LEAF Sent140 train files...
LEAF Sent140 train: 254555 users, 908652 samples
Building vocabulary (max_size=10000)...
Vocabulary size: 10000
Loading 1 LEAF Sent140 test files...
LEAF Sent140 test: 254555 users, 286281 samples
Found 254555 train users, 254555 test users, 254555 common users
User sample counts range: 494 (max) to 1 (min)
Distributed ALL 254555 users across 20 clients
Users per client: 12727 (with 15 clients getting +1 user)
Train partition sizes: [44353, 44290, 44657, 44907, 44696, 45843, 45801, 45619, 45069, 45639, 45821, 45311, 45779, 46056, 45625, 45984, 46428, 44737, 45540, 46497]
Test partition sizes: [14232, 14235, 14266, 14217, 14238, 14373, 14346, 14334, 14294, 14373, 14344, 14302, 14354, 14362, 14320, 14395, 14389, 14257, 14251, 14399]
  Client 0: 44353 train samples, 2 unique classes
  Client 1: 44290 train samples, 2 unique classes
  Client 2: 44657 train samples, 2 unique classes
  Client 3: 44907 train samples, 2 unique classes
  Client 4: 44696 train samples, 2 unique classes
  Client 5: 45843 train samples, 2 unique classes
  Client 6: 45801 train samples, 2 unique classes
  Client 7: 45619 train samples, 2 unique classes
  Client 8: 45069 train samples, 2 unique classes
  Client 9: 45639 train samples, 2 unique classes
  Client 10: 45821 train samples, 2 unique classes
  Client 11: 45311 train samples, 2 unique classes
  Client 12: 45779 train samples, 2 unique classes
  Client 13: 46056 train samples, 2 unique classes
  Client 14: 45625 train samples, 2 unique classes
  Client 15: 45984 train samples, 2 unique classes
  Client 16: 46428 train samples, 2 unique classes
  Client 17: 44737 train samples, 2 unique classes
  Client 18: 45540 train samples, 2 unique classes
  Client 19: 46497 train samples, 2 unique classes
Will sample 4500 samples per client per epoch
Graph: ring, nodes: 20, edges: 20
Degree statistics: avg=2.00, min=2, max=2
Attack: Compromised 2/20 nodes: [5, 13]
Attack type: gaussian, lambda: 1.0
Model variant: baseline
Model parameters: 1,174,986
Sketchguard Node 0:
  Model dim: 1,174,986 → Sketch size: 180
  Compression ratio: 6527.7x
  Using model parameters for aggregation, sketches for filtering
Sketchguard Node 1:
  Model dim: 1,174,986 → Sketch size: 180
  Compression ratio: 6527.7x
  Using model parameters for aggregation, sketches for filtering
Sketchguard Node 2:
  Model dim: 1,174,986 → Sketch size: 180
  Compression ratio: 6527.7x
  Using model parameters for aggregation, sketches for filtering
Sketchguard Node 3:
  Model dim: 1,174,986 → Sketch size: 180
  Compression ratio: 6527.7x
  Using model parameters for aggregation, sketches for filtering
Sketchguard Node 4:
  Model dim: 1,174,986 → Sketch size: 180
  Compression ratio: 6527.7x
  Using model parameters for aggregation, sketches for filtering
Sketchguard Node 5:
  Model dim: 1,174,986 → Sketch size: 180
  Compression ratio: 6527.7x
  Using model parameters for aggregation, sketches for filtering
Sketchguard Node 6:
  Model dim: 1,174,986 → Sketch size: 180
  Compression ratio: 6527.7x
  Using model parameters for aggregation, sketches for filtering
Sketchguard Node 7:
  Model dim: 1,174,986 → Sketch size: 180
  Compression ratio: 6527.7x
  Using model parameters for aggregation, sketches for filtering
Sketchguard Node 8:
  Model dim: 1,174,986 → Sketch size: 180
  Compression ratio: 6527.7x
  Using model parameters for aggregation, sketches for filtering
Sketchguard Node 9:
  Model dim: 1,174,986 → Sketch size: 180
  Compression ratio: 6527.7x
  Using model parameters for aggregation, sketches for filtering
Sketchguard Node 10:
  Model dim: 1,174,986 → Sketch size: 180
  Compression ratio: 6527.7x
  Using model parameters for aggregation, sketches for filtering
Sketchguard Node 11:
  Model dim: 1,174,986 → Sketch size: 180
  Compression ratio: 6527.7x
  Using model parameters for aggregation, sketches for filtering
Sketchguard Node 12:
  Model dim: 1,174,986 → Sketch size: 180
  Compression ratio: 6527.7x
  Using model parameters for aggregation, sketches for filtering
Sketchguard Node 13:
  Model dim: 1,174,986 → Sketch size: 180
  Compression ratio: 6527.7x
  Using model parameters for aggregation, sketches for filtering
Sketchguard Node 14:
  Model dim: 1,174,986 → Sketch size: 180
  Compression ratio: 6527.7x
  Using model parameters for aggregation, sketches for filtering
Sketchguard Node 15:
  Model dim: 1,174,986 → Sketch size: 180
  Compression ratio: 6527.7x
  Using model parameters for aggregation, sketches for filtering
Sketchguard Node 16:
  Model dim: 1,174,986 → Sketch size: 180
  Compression ratio: 6527.7x
  Using model parameters for aggregation, sketches for filtering
Sketchguard Node 17:
  Model dim: 1,174,986 → Sketch size: 180
  Compression ratio: 6527.7x
  Using model parameters for aggregation, sketches for filtering
Sketchguard Node 18:
  Model dim: 1,174,986 → Sketch size: 180
  Compression ratio: 6527.7x
  Using model parameters for aggregation, sketches for filtering
Sketchguard Node 19:
  Model dim: 1,174,986 → Sketch size: 180
  Compression ratio: 6527.7x
  Using model parameters for aggregation, sketches for filtering
Sketchguard ALGORITHM (Sketch-based Filtering + State Aggregation)
  - Model dimension: 1,174,986 parameters
  - Config: SketchguardConfig(gamma=2, kappa=1, alpha=0.5, min_neighbors=1, sketch_size=180, network_seed=987654321, attack_detection_window=5)
  - Sketch size: 180
  - Compression ratio: 6527.7x
  - Complexity: O(d + N×k) = O(1,174,986 + 20×180)
  - Theoretical speedup vs BALANCE: 19.9x
Initial test acc across nodes: mean=0.4953 ± 0.0174
Round 001: test acc mean=0.5505 ± 0.0327 | min=0.5012 max=0.6236
         : test loss mean=0.6895 ± 0.0020
         : individual accs = ['0.583263', '0.623604', '0.535118', '0.566575', '0.566021', '0.508592', '0.590687', '0.576531', '0.501189', '0.572254', '0.509481', '0.553419', '0.532395', '0.527712', '0.529050', '0.527405', '0.526583', '0.595778', '0.520525', '0.563650']
         : correct/total = [(8301, 14232), (8877, 14235), (7634, 14266), (8055, 14217), (8059, 14238), (7310, 14373), (8474, 14346), (8264, 14334), (7164, 14294), (8225, 14373), (7308, 14344), (7915, 14302), (7642, 14354), (7579, 14362), (7576, 14320), (7592, 14395), (7577, 14389), (8494, 14257), (7418, 14251), (8116, 14399)]
         : compromised: 0.5182, honest: 0.5541
         : sketchguard stats = ['Node 0: acc_rate=1.000', 'Node 1: acc_rate=1.000', 'Node 2: acc_rate=1.000']...
Round 002: test acc mean=0.6094 ± 0.0331 | min=0.5400 max=0.6443
         : test loss mean=0.6696 ± 0.0145
         : individual accs = ['0.637366', '0.632034', '0.634235', '0.626926', '0.638151', '0.592917', '0.628119', '0.626343', '0.622289', '0.612746', '0.603249', '0.631170', '0.644280', '0.557861', '0.628422', '0.623619', '0.542289', '0.550116', '0.540032', '0.615390']
         : correct/total = [(9071, 14232), (8997, 14235), (9048, 14266), (8913, 14217), (9086, 14238), (8522, 14373), (9011, 14346), (8978, 14334), (8895, 14294), (8807, 14373), (8653, 14344), (9027, 14302), (9248, 14354), (8012, 14362), (8999, 14320), (8977, 14395), (7803, 14389), (7843, 14257), (7696, 14251), (8861, 14399)]
         : compromised: 0.5754, honest: 0.6132
         : sketchguard stats = ['Node 0: acc_rate=1.000', 'Node 1: acc_rate=1.000', 'Node 2: acc_rate=1.000']...
Round 003: test acc mean=0.6230 ± 0.0155 | min=0.5857 max=0.6423
         : test loss mean=0.6593 ± 0.0128
         : individual accs = ['0.585722', '0.642290', '0.635918', '0.639727', '0.640610', '0.598831', '0.619197', '0.626482', '0.609696', '0.635080', '0.637340', '0.626486', '0.630138', '0.617811', '0.626327', '0.634179', '0.622281', '0.599214', '0.627605', '0.605042']
         : correct/total = [(8336, 14232), (9143, 14235), (9072, 14266), (9095, 14217), (9121, 14238), (8607, 14373), (8883, 14346), (8980, 14334), (8715, 14294), (9128, 14373), (9142, 14344), (8960, 14302), (9045, 14354), (8873, 14362), (8969, 14320), (9129, 14395), (8954, 14389), (8543, 14257), (8944, 14251), (8712, 14399)]
         : compromised: 0.6083, honest: 0.6246
         : sketchguard stats = ['Node 0: acc_rate=1.000', 'Node 1: acc_rate=1.000', 'Node 2: acc_rate=1.000']...
Round 004: test acc mean=0.6386 ± 0.0073 | min=0.6261 max=0.6492
         : test loss mean=0.6498 ± 0.0132
         : individual accs = ['0.638069', '0.642431', '0.645871', '0.645424', '0.649248', '0.643777', '0.641224', '0.642249', '0.632293', '0.627844', '0.638037', '0.646903', '0.649157', '0.626097', '0.628561', '0.633414', '0.637084', '0.632181', '0.628798', '0.644142']
         : correct/total = [(9081, 14232), (9145, 14235), (9214, 14266), (9176, 14217), (9244, 14238), (9253, 14373), (9199, 14346), (9206, 14334), (9038, 14294), (9024, 14373), (9152, 14344), (9252, 14302), (9318, 14354), (8992, 14362), (9001, 14320), (9118, 14395), (9167, 14389), (9013, 14257), (8961, 14251), (9275, 14399)]
         : compromised: 0.6349, honest: 0.6391
         : sketchguard stats = ['Node 0: acc_rate=1.000', 'Node 1: acc_rate=1.000', 'Node 2: acc_rate=1.000']...
Round 005: test acc mean=0.6408 ± 0.0077 | min=0.6240 max=0.6536
         : test loss mean=0.6454 ± 0.0130
         : individual accs = ['0.644112', '0.648683', '0.645030', '0.648027', '0.653603', '0.634941', '0.641363', '0.645737', '0.640059', '0.643707', '0.636364', '0.649420', '0.652083', '0.624008', '0.638827', '0.640083', '0.628814', '0.631479', '0.636517', '0.632822']
         : correct/total = [(9167, 14232), (9234, 14235), (9202, 14266), (9213, 14217), (9306, 14238), (9126, 14373), (9201, 14346), (9256, 14334), (9149, 14294), (9252, 14373), (9128, 14344), (9288, 14302), (9360, 14354), (8962, 14362), (9148, 14320), (9214, 14395), (9048, 14389), (9003, 14257), (9071, 14251), (9112, 14399)]
         : compromised: 0.6295, honest: 0.6420
         : sketchguard stats = ['Node 0: acc_rate=1.000', 'Node 1: acc_rate=1.000', 'Node 2: acc_rate=1.000']...
Round 006: test acc mean=0.6434 ± 0.0069 | min=0.6276 max=0.6564
         : test loss mean=0.6413 ± 0.0125
         : individual accs = ['0.645166', '0.646365', '0.644539', '0.654146', '0.656412', '0.641063', '0.647567', '0.650272', '0.640758', '0.638141', '0.627649', '0.637743', '0.653267', '0.633408', '0.642598', '0.643001', '0.639030', '0.639475', '0.639955', '0.648031']
         : correct/total = [(9182, 14232), (9201, 14235), (9195, 14266), (9300, 14217), (9346, 14238), (9214, 14373), (9290, 14346), (9321, 14334), (9159, 14294), (9172, 14373), (9003, 14344), (9121, 14302), (9377, 14354), (9097, 14362), (9202, 14320), (9256, 14395), (9195, 14389), (9117, 14257), (9120, 14251), (9331, 14399)]
         : compromised: 0.6372, honest: 0.6441
         : sketchguard stats = ['Node 0: acc_rate=1.000', 'Node 1: acc_rate=1.000', 'Node 2: acc_rate=1.000']...
Round 007: test acc mean=0.6449 ± 0.0088 | min=0.6274 max=0.6617
         : test loss mean=0.6367 ± 0.0105
         : individual accs = ['0.651560', '0.650580', '0.627366', '0.655624', '0.661680', '0.647673', '0.650983', '0.647900', '0.645166', '0.649690', '0.635248', '0.651098', '0.650341', '0.630692', '0.634218', '0.643626', '0.644034', '0.637511', '0.633078', '0.649490']
         : correct/total = [(9273, 14232), (9261, 14235), (8950, 14266), (9321, 14217), (9421, 14238), (9309, 14373), (9339, 14346), (9287, 14334), (9222, 14294), (9338, 14373), (9112, 14344), (9312, 14302), (9335, 14354), (9058, 14362), (9082, 14320), (9265, 14395), (9267, 14389), (9089, 14257), (9022, 14251), (9352, 14399)]
         : compromised: 0.6392, honest: 0.6455
         : sketchguard stats = ['Node 0: acc_rate=1.000', 'Node 1: acc_rate=1.000', 'Node 2: acc_rate=1.000']...
Round 008: test acc mean=0.6478 ± 0.0061 | min=0.6342 max=0.6562
         : test loss mean=0.6321 ± 0.0055
         : individual accs = ['0.643690', '0.643976', '0.655895', '0.654850', '0.655640', '0.652821', '0.638854', '0.634226', '0.645166', '0.652473', '0.650725', '0.656202', '0.651386', '0.642390', '0.640992', '0.648906', '0.646814', '0.646630', '0.642271', '0.652754']
         : correct/total = [(9161, 14232), (9167, 14235), (9357, 14266), (9310, 14217), (9335, 14238), (9383, 14373), (9165, 14346), (9091, 14334), (9222, 14294), (9378, 14373), (9334, 14344), (9385, 14302), (9350, 14354), (9226, 14362), (9179, 14320), (9341, 14395), (9307, 14389), (9219, 14257), (9153, 14251), (9399, 14399)]
         : compromised: 0.6476, honest: 0.6479
         : sketchguard stats = ['Node 0: acc_rate=1.000', 'Node 1: acc_rate=1.000', 'Node 2: acc_rate=1.000']...
Round 009: test acc mean=0.6499 ± 0.0111 | min=0.6207 max=0.6662
         : test loss mean=0.6281 ± 0.0078
         : individual accs = ['0.629637', '0.655005', '0.659610', '0.662306', '0.663014', '0.666249', '0.620731', '0.642807', '0.641528', '0.639324', '0.650376', '0.658369', '0.653616', '0.654157', '0.643575', '0.651685', '0.645285', '0.652031', '0.648867', '0.659768']
         : correct/total = [(8961, 14232), (9324, 14235), (9410, 14266), (9416, 14217), (9440, 14238), (9576, 14373), (8905, 14346), (9214, 14334), (9170, 14294), (9189, 14373), (9329, 14344), (9416, 14302), (9382, 14354), (9395, 14362), (9216, 14320), (9381, 14395), (9285, 14389), (9296, 14257), (9247, 14251), (9500, 14399)]
         : compromised: 0.6602, honest: 0.6488
         : sketchguard stats = ['Node 0: acc_rate=1.000', 'Node 1: acc_rate=1.000', 'Node 2: acc_rate=1.000']...
Round 010: test acc mean=0.6578 ± 0.0069 | min=0.6427 max=0.6689
         : test loss mean=0.6212 ± 0.0065
         : individual accs = ['0.661397', '0.661538', '0.660522', '0.664768', '0.668914', '0.663605', '0.657814', '0.661713', '0.655100', '0.651638', '0.660346', '0.661306', '0.667061', '0.653321', '0.642668', '0.643765', '0.649663', '0.654977', '0.653779', '0.661296']
         : correct/total = [(9413, 14232), (9417, 14235), (9423, 14266), (9451, 14217), (9524, 14238), (9538, 14373), (9437, 14346), (9485, 14334), (9364, 14294), (9366, 14373), (9472, 14344), (9458, 14302), (9575, 14354), (9383, 14362), (9203, 14320), (9267, 14395), (9348, 14389), (9338, 14257), (9317, 14251), (9522, 14399)]
         : compromised: 0.6585, honest: 0.6577
         : sketchguard stats = ['Node 0: acc_rate=1.000', 'Node 1: acc_rate=1.000', 'Node 2: acc_rate=1.000']...

=== FINAL RESULTS ===
Dataset: sent140, Nodes: 20, Graph: ring, Aggregation: sketchguard
Attack: gaussian, 10.0% compromised
Final accuracy - Compromised: 0.6585, Honest: 0.6577
Overall test accuracy: mean=0.6578 ± 0.0069

=== Sketchguard SUMMARY ===
Node 0: acceptance=1.000
Node 1: acceptance=1.000
Node 2: acceptance=1.000
Node 3: acceptance=1.000
Node 4: acceptance=0.500
Node 5: acceptance=0.750
Node 6: acceptance=0.500
Node 7: acceptance=1.000
Node 8: acceptance=1.000
Node 9: acceptance=1.000
Node 10: acceptance=1.000
Node 11: acceptance=1.000
Node 12: acceptance=0.500
Node 13: acceptance=0.800
Node 14: acceptance=0.500
Node 15: acceptance=1.000
Node 16: acceptance=1.000
Node 17: acceptance=1.000
Node 18: acceptance=1.000
Node 19: acceptance=1.000

=== PARALLEL EXECUTION TIME (realistic for distributed system) ===
  COMMUNICATION (max across nodes):
    - Sketch transfer: 0.000s (0.0%)
    - Model fetch (accepted): 0.000s (0.0%)
  COMPUTATION (max across nodes):
    - Sketching: 0.218s (94.5%)
    - Filtering: 0.001s (0.3%)
    - Aggregation: 0.012s (5.2%)
  TOTALS:
    - Total computation: 0.231s (100.0%)
    - Total communication: 0.000s (0.0%)
    - Total parallel time: 0.231s

=== PER-NODE AVERAGE TIME ===
  - Sketching: 0.164s
  - Filtering: 0.000s
  - Aggregation: 0.006s
  - Sketch transfer: 0.000s
  - Model fetch: 0.000s
  - Total per node: 0.171s

=== TOTAL COMPUTATIONAL WORK (sum across all nodes) ===
  - Total sketching: 3.289s
  - Total filtering: 0.006s
  - Total aggregation: 0.122s
  - Total sketch transfer: 0.000s
  - Total model fetch: 0.000s
  - Grand total: 3.417s
  - Mean acceptance rate: 0.878

Sketchguard Algorithm Properties:
  - Original dimension: 1,174,986
  - Sketch size: 180
  - Compression ratio: 19.9x
  - Single repetition: No repetitions needed
  - Theoretical complexity: O(d + N×k)
  - Approach: Sketch filtering + state aggregation
