Device: cuda
Seed: 987654321
Loading 1 LEAF Sent140 train files...
LEAF Sent140 train: 254555 users, 908652 samples
Building vocabulary (max_size=10000)...
Vocabulary size: 10000
Loading 1 LEAF Sent140 test files...
LEAF Sent140 test: 254555 users, 286281 samples
Found 254555 train users, 254555 test users, 254555 common users
User sample counts range: 494 (max) to 1 (min)
Distributed ALL 254555 users across 20 clients
Users per client: 12727 (with 15 clients getting +1 user)
Train partition sizes: [44353, 44290, 44657, 44907, 44696, 45843, 45801, 45619, 45069, 45639, 45821, 45311, 45779, 46056, 45625, 45984, 46428, 44737, 45540, 46497]
Test partition sizes: [14232, 14235, 14266, 14217, 14238, 14373, 14346, 14334, 14294, 14373, 14344, 14302, 14354, 14362, 14320, 14395, 14389, 14257, 14251, 14399]
  Client 0: 44353 train samples, 2 unique classes
  Client 1: 44290 train samples, 2 unique classes
  Client 2: 44657 train samples, 2 unique classes
  Client 3: 44907 train samples, 2 unique classes
  Client 4: 44696 train samples, 2 unique classes
  Client 5: 45843 train samples, 2 unique classes
  Client 6: 45801 train samples, 2 unique classes
  Client 7: 45619 train samples, 2 unique classes
  Client 8: 45069 train samples, 2 unique classes
  Client 9: 45639 train samples, 2 unique classes
  Client 10: 45821 train samples, 2 unique classes
  Client 11: 45311 train samples, 2 unique classes
  Client 12: 45779 train samples, 2 unique classes
  Client 13: 46056 train samples, 2 unique classes
  Client 14: 45625 train samples, 2 unique classes
  Client 15: 45984 train samples, 2 unique classes
  Client 16: 46428 train samples, 2 unique classes
  Client 17: 44737 train samples, 2 unique classes
  Client 18: 45540 train samples, 2 unique classes
  Client 19: 46497 train samples, 2 unique classes
Will sample 4500 samples per client per epoch
Graph: erdos, nodes: 20, edges: 48
Degree statistics: avg=4.80, min=2, max=7
Attack: Compromised 6/20 nodes: [5, 12, 13, 14, 17, 18]
Attack type: directed_deviation, lambda: 1.0
Model variant: baseline
Model parameters: 1,174,986
Initial test acc across nodes: mean=0.4953 ± 0.0174
Round 001: test acc mean=0.5262 ± 0.0548 | min=0.4889 max=0.6475
         : test loss mean=18.7074 ± 14.4899
         : individual accs = ['0.612493', '0.647489', '0.512688', '0.494830', '0.491502', '0.493216', '0.488986', '0.498116', '0.646005', '0.514367', '0.501743', '0.494336', '0.502578', '0.504387', '0.494763', '0.507259', '0.497116', '0.502139', '0.488948', '0.630738']
         : correct/total = [(8717, 14232), (9217, 14235), (7314, 14266), (7035, 14217), (6998, 14238), (7089, 14373), (7015, 14346), (7140, 14334), (9234, 14294), (7393, 14373), (7197, 14344), (7070, 14302), (7214, 14354), (7244, 14362), (7085, 14320), (7302, 14395), (7153, 14389), (7159, 14257), (6968, 14251), (9082, 14399)]
         : compromised: 0.4977, honest: 0.5384
Round 002: test acc mean=0.5745 ± 0.0735 | min=0.4935 max=0.6654
         : test loss mean=12.1307 ± 14.4345
         : individual accs = ['0.612774', '0.649034', '0.647554', '0.613421', '0.503371', '0.504140', '0.651471', '0.507255', '0.657619', '0.497669', '0.660067', '0.503286', '0.657378', '0.493455', '0.507263', '0.504203', '0.503649', '0.497089', '0.653287', '0.665393']
         : correct/total = [(8721, 14232), (9239, 14235), (9238, 14266), (8721, 14217), (7167, 14238), (7246, 14373), (9346, 14346), (7271, 14334), (9400, 14294), (7153, 14373), (9468, 14344), (7198, 14302), (9436, 14354), (7087, 14362), (7264, 14320), (7258, 14395), (7247, 14389), (7087, 14257), (9310, 14251), (9581, 14399)]
         : compromised: 0.5521, honest: 0.5841
Round 003: test acc mean=0.5692 ± 0.0764 | min=0.4800 max=0.6734
         : test loss mean=1.9146 ± 1.5974
         : individual accs = ['0.667369', '0.673411', '0.588883', '0.632904', '0.504987', '0.503931', '0.636345', '0.480047', '0.673289', '0.502470', '0.660694', '0.501189', '0.498189', '0.505710', '0.505098', '0.511011', '0.516228', '0.495967', '0.661708', '0.665255']
         : correct/total = [(9498, 14232), (9586, 14235), (8401, 14266), (8998, 14217), (7190, 14238), (7243, 14373), (9129, 14346), (6881, 14334), (9624, 14294), (7222, 14373), (9477, 14344), (7168, 14302), (7151, 14354), (7263, 14362), (7233, 14320), (7356, 14395), (7428, 14389), (7071, 14257), (9430, 14251), (9579, 14399)]
         : compromised: 0.5284, honest: 0.5867
Round 004: test acc mean=0.5622 ± 0.0807 | min=0.4846 max=0.6914
         : test loss mean=2.3640 ± 3.1111
         : individual accs = ['0.629848', '0.639902', '0.671387', '0.484631', '0.498595', '0.491616', '0.641294', '0.499023', '0.671960', '0.513463', '0.689557', '0.506083', '0.492824', '0.499861', '0.484986', '0.486627', '0.506359', '0.508943', '0.636166', '0.691367']
         : correct/total = [(8964, 14232), (9109, 14235), (9578, 14266), (6890, 14217), (7099, 14238), (7066, 14373), (9200, 14346), (7153, 14334), (9605, 14294), (7380, 14373), (9891, 14344), (7238, 14302), (7074, 14354), (7179, 14362), (6945, 14320), (7005, 14395), (7286, 14389), (7256, 14257), (9066, 14251), (9955, 14399)]
         : compromised: 0.5191, honest: 0.5807
Round 005: test acc mean=0.5630 ± 0.0847 | min=0.4882 max=0.7015
         : test loss mean=2.3138 ± 2.4573
         : individual accs = ['0.634275', '0.641939', '0.631151', '0.507561', '0.491080', '0.492590', '0.635578', '0.488489', '0.686792', '0.502957', '0.699526', '0.497133', '0.488226', '0.496310', '0.492807', '0.494755', '0.497880', '0.496738', '0.682408', '0.701507']
         : correct/total = [(9027, 14232), (9138, 14235), (9004, 14266), (7216, 14217), (6992, 14238), (7080, 14373), (9118, 14346), (7002, 14334), (9817, 14294), (7229, 14373), (10034, 14344), (7110, 14302), (7008, 14354), (7128, 14362), (7057, 14320), (7122, 14395), (7164, 14389), (7082, 14257), (9725, 14251), (10101, 14399)]
         : compromised: 0.5248, honest: 0.5793
Round 006: test acc mean=0.5666 ± 0.0824 | min=0.4853 max=0.7007
         : test loss mean=1.7546 ± 1.8885
         : individual accs = ['0.636945', '0.644819', '0.644820', '0.485334', '0.512361', '0.492590', '0.651959', '0.514023', '0.698895', '0.505114', '0.700014', '0.496364', '0.496168', '0.511280', '0.511522', '0.498993', '0.499896', '0.490145', '0.640937', '0.700743']
         : correct/total = [(9065, 14232), (9179, 14235), (9199, 14266), (6900, 14217), (7295, 14238), (7080, 14373), (9353, 14346), (7368, 14334), (9990, 14294), (7260, 14373), (10041, 14344), (7099, 14302), (7122, 14354), (7343, 14362), (7325, 14320), (7183, 14395), (7193, 14389), (6988, 14257), (9134, 14251), (10090, 14399)]
         : compromised: 0.5238, honest: 0.5850
Round 007: test acc mean=0.5636 ± 0.0778 | min=0.4840 max=0.7100
         : test loss mean=3.3129 ± 4.5614
         : individual accs = ['0.610455', '0.653881', '0.605145', '0.525357', '0.498455', '0.500800', '0.654259', '0.491000', '0.701623', '0.520838', '0.709983', '0.504335', '0.501184', '0.493525', '0.484008', '0.515735', '0.509000', '0.502841', '0.609010', '0.681506']
         : correct/total = [(8688, 14232), (9308, 14235), (8633, 14266), (7469, 14217), (7097, 14238), (7198, 14373), (9386, 14346), (7038, 14334), (10029, 14294), (7486, 14373), (10184, 14344), (7213, 14302), (7194, 14354), (7088, 14362), (6931, 14320), (7424, 14395), (7324, 14389), (7169, 14257), (8679, 14251), (9813, 14399)]
         : compromised: 0.5152, honest: 0.5844
Round 008: test acc mean=0.5731 ± 0.0859 | min=0.4859 max=0.7164
         : test loss mean=1.6723 ± 1.7035
         : individual accs = ['0.643761', '0.652687', '0.659120', '0.523880', '0.514328', '0.498922', '0.648195', '0.512488', '0.712397', '0.501218', '0.716397', '0.485876', '0.501254', '0.503969', '0.507332', '0.506565', '0.498297', '0.505296', '0.655042', '0.714216']
         : correct/total = [(9162, 14232), (9291, 14235), (9403, 14266), (7448, 14217), (7323, 14238), (7171, 14373), (9299, 14346), (7346, 14334), (10183, 14294), (7204, 14373), (10276, 14344), (6949, 14302), (7195, 14354), (7238, 14362), (7265, 14320), (7292, 14395), (7170, 14389), (7204, 14257), (9335, 14251), (10284, 14399)]
         : compromised: 0.5286, honest: 0.5921
Round 009: test acc mean=0.5676 ± 0.0839 | min=0.4899 max=0.7241
         : test loss mean=1.8233 ± 1.7556
         : individual accs = ['0.617201', '0.619810', '0.649586', '0.507069', '0.507234', '0.493912', '0.623310', '0.503349', '0.715055', '0.489877', '0.713887', '0.514054', '0.509126', '0.500000', '0.505936', '0.498159', '0.501564', '0.505085', '0.654130', '0.724148']
         : correct/total = [(8784, 14232), (8823, 14235), (9267, 14266), (7209, 14217), (7222, 14238), (7099, 14373), (8942, 14346), (7215, 14334), (10221, 14294), (7041, 14373), (10240, 14344), (7352, 14302), (7308, 14354), (7181, 14362), (7245, 14320), (7171, 14395), (7217, 14389), (7201, 14257), (9322, 14251), (10427, 14399)]
         : compromised: 0.5280, honest: 0.5846
Round 010: test acc mean=0.5728 ± 0.0924 | min=0.4816 max=0.7205
         : test loss mean=1.9555 ± 1.8232
         : individual accs = ['0.657322', '0.662522', '0.662905', '0.546810', '0.498314', '0.487233', '0.661160', '0.491977', '0.718203', '0.495165', '0.719883', '0.481611', '0.490107', '0.493525', '0.506844', '0.490726', '0.505873', '0.505155', '0.659322', '0.720467']
         : correct/total = [(9355, 14232), (9431, 14235), (9457, 14266), (7774, 14217), (7095, 14238), (7003, 14373), (9485, 14346), (7052, 14334), (10266, 14294), (7117, 14373), (10326, 14344), (6888, 14302), (7035, 14354), (7088, 14362), (7258, 14320), (7064, 14395), (7279, 14389), (7202, 14257), (9396, 14251), (10374, 14399)]
         : compromised: 0.5237, honest: 0.5938

=== FINAL RESULTS ===
Dataset: sent140, Nodes: 20, Graph: erdos, Aggregation: krum
Attack: directed_deviation, 30.0% compromised
Final accuracy - Compromised: 0.5237, Honest: 0.5938
Overall test accuracy: mean=0.5728 ± 0.0924
