Device: cuda
Seed: 987654321
Loading 1 LEAF Sent140 train files...
LEAF Sent140 train: 254555 users, 908652 samples
Building vocabulary (max_size=10000)...
Vocabulary size: 10000
Loading 1 LEAF Sent140 test files...
LEAF Sent140 test: 254555 users, 286281 samples
Found 254555 train users, 254555 test users, 254555 common users
User sample counts range: 494 (max) to 1 (min)
Distributed ALL 254555 users across 20 clients
Users per client: 12727 (with 15 clients getting +1 user)
Train partition sizes: [44353, 44290, 44657, 44907, 44696, 45843, 45801, 45619, 45069, 45639, 45821, 45311, 45779, 46056, 45625, 45984, 46428, 44737, 45540, 46497]
Test partition sizes: [14232, 14235, 14266, 14217, 14238, 14373, 14346, 14334, 14294, 14373, 14344, 14302, 14354, 14362, 14320, 14395, 14389, 14257, 14251, 14399]
  Client 0: 44353 train samples, 2 unique classes
  Client 1: 44290 train samples, 2 unique classes
  Client 2: 44657 train samples, 2 unique classes
  Client 3: 44907 train samples, 2 unique classes
  Client 4: 44696 train samples, 2 unique classes
  Client 5: 45843 train samples, 2 unique classes
  Client 6: 45801 train samples, 2 unique classes
  Client 7: 45619 train samples, 2 unique classes
  Client 8: 45069 train samples, 2 unique classes
  Client 9: 45639 train samples, 2 unique classes
  Client 10: 45821 train samples, 2 unique classes
  Client 11: 45311 train samples, 2 unique classes
  Client 12: 45779 train samples, 2 unique classes
  Client 13: 46056 train samples, 2 unique classes
  Client 14: 45625 train samples, 2 unique classes
  Client 15: 45984 train samples, 2 unique classes
  Client 16: 46428 train samples, 2 unique classes
  Client 17: 44737 train samples, 2 unique classes
  Client 18: 45540 train samples, 2 unique classes
  Client 19: 46497 train samples, 2 unique classes
Will sample 4500 samples per client per epoch
Graph: ring, nodes: 20, edges: 20
Degree statistics: avg=2.00, min=2, max=2
Attack: Compromised 2/20 nodes: [5, 13]
Attack type: backdoor, lambda: 1.0
Backdoor target label: 1, trigger size: 3
Model variant: baseline
Model parameters: 1,174,986
Sketchguard Node 0:
  Model dim: 1,174,986 → Sketch size: 180
  Compression ratio: 6527.7x
  Using model parameters for aggregation, sketches for filtering
Sketchguard Node 1:
  Model dim: 1,174,986 → Sketch size: 180
  Compression ratio: 6527.7x
  Using model parameters for aggregation, sketches for filtering
Sketchguard Node 2:
  Model dim: 1,174,986 → Sketch size: 180
  Compression ratio: 6527.7x
  Using model parameters for aggregation, sketches for filtering
Sketchguard Node 3:
  Model dim: 1,174,986 → Sketch size: 180
  Compression ratio: 6527.7x
  Using model parameters for aggregation, sketches for filtering
Sketchguard Node 4:
  Model dim: 1,174,986 → Sketch size: 180
  Compression ratio: 6527.7x
  Using model parameters for aggregation, sketches for filtering
Sketchguard Node 5:
  Model dim: 1,174,986 → Sketch size: 180
  Compression ratio: 6527.7x
  Using model parameters for aggregation, sketches for filtering
Sketchguard Node 6:
  Model dim: 1,174,986 → Sketch size: 180
  Compression ratio: 6527.7x
  Using model parameters for aggregation, sketches for filtering
Sketchguard Node 7:
  Model dim: 1,174,986 → Sketch size: 180
  Compression ratio: 6527.7x
  Using model parameters for aggregation, sketches for filtering
Sketchguard Node 8:
  Model dim: 1,174,986 → Sketch size: 180
  Compression ratio: 6527.7x
  Using model parameters for aggregation, sketches for filtering
Sketchguard Node 9:
  Model dim: 1,174,986 → Sketch size: 180
  Compression ratio: 6527.7x
  Using model parameters for aggregation, sketches for filtering
Sketchguard Node 10:
  Model dim: 1,174,986 → Sketch size: 180
  Compression ratio: 6527.7x
  Using model parameters for aggregation, sketches for filtering
Sketchguard Node 11:
  Model dim: 1,174,986 → Sketch size: 180
  Compression ratio: 6527.7x
  Using model parameters for aggregation, sketches for filtering
Sketchguard Node 12:
  Model dim: 1,174,986 → Sketch size: 180
  Compression ratio: 6527.7x
  Using model parameters for aggregation, sketches for filtering
Sketchguard Node 13:
  Model dim: 1,174,986 → Sketch size: 180
  Compression ratio: 6527.7x
  Using model parameters for aggregation, sketches for filtering
Sketchguard Node 14:
  Model dim: 1,174,986 → Sketch size: 180
  Compression ratio: 6527.7x
  Using model parameters for aggregation, sketches for filtering
Sketchguard Node 15:
  Model dim: 1,174,986 → Sketch size: 180
  Compression ratio: 6527.7x
  Using model parameters for aggregation, sketches for filtering
Sketchguard Node 16:
  Model dim: 1,174,986 → Sketch size: 180
  Compression ratio: 6527.7x
  Using model parameters for aggregation, sketches for filtering
Sketchguard Node 17:
  Model dim: 1,174,986 → Sketch size: 180
  Compression ratio: 6527.7x
  Using model parameters for aggregation, sketches for filtering
Sketchguard Node 18:
  Model dim: 1,174,986 → Sketch size: 180
  Compression ratio: 6527.7x
  Using model parameters for aggregation, sketches for filtering
Sketchguard Node 19:
  Model dim: 1,174,986 → Sketch size: 180
  Compression ratio: 6527.7x
  Using model parameters for aggregation, sketches for filtering
Sketchguard ALGORITHM (Sketch-based Filtering + State Aggregation)
  - Model dimension: 1,174,986 parameters
  - Config: SketchguardConfig(gamma=2, kappa=1, alpha=0.5, min_neighbors=1, sketch_size=180, network_seed=987654321, attack_detection_window=5)
  - Sketch size: 180
  - Compression ratio: 6527.7x
  - Complexity: O(d + N×k) = O(1,174,986 + 20×180)
  - Theoretical speedup vs BALANCE: 19.9x
Initial test acc across nodes: mean=0.4953 ± 0.0174
Backdoor attack: Created poisoned datasets for 2 compromised nodes
Round 001: test acc mean=0.5393 ± 0.0369 | min=0.4878 max=0.6236
         : test loss mean=4.8287 ± 11.5589
         : individual accs = ['0.583263', '0.623604', '0.535118', '0.566575', '0.507375', '0.518890', '0.499024', '0.576531', '0.501189', '0.572254', '0.509481', '0.553419', '0.494496', '0.522699', '0.487779', '0.527405', '0.526583', '0.595778', '0.520525', '0.563650']
         : correct/total = [(8301, 14232), (8877, 14235), (7634, 14266), (8055, 14217), (7224, 14238), (7458, 14373), (7159, 14346), (8264, 14334), (7164, 14294), (8225, 14373), (7308, 14344), (7915, 14302), (7098, 14354), (7507, 14362), (6985, 14320), (7592, 14395), (7577, 14389), (8494, 14257), (7418, 14251), (8116, 14399)]
         : compromised: 0.5208, honest: 0.5413
         : sketchguard stats = ['Node 0: acc_rate=1.000', 'Node 1: acc_rate=1.000', 'Node 2: acc_rate=1.000']...
Round 002: test acc mean=0.5520 ± 0.0544 | min=0.4890 max=0.6374
         : test loss mean=21.3561 ± 62.1322
         : individual accs = ['0.637366', '0.632034', '0.634235', '0.514314', '0.492836', '0.507271', '0.529276', '0.488977', '0.622289', '0.612746', '0.603249', '0.501748', '0.502578', '0.503551', '0.507193', '0.502258', '0.542289', '0.550116', '0.540032', '0.615390']
         : correct/total = [(9071, 14232), (8997, 14235), (9048, 14266), (7312, 14217), (7017, 14238), (7291, 14373), (7593, 14346), (7009, 14334), (8895, 14294), (8807, 14373), (8653, 14344), (7176, 14302), (7214, 14354), (7232, 14362), (7263, 14320), (7230, 14395), (7803, 14389), (7843, 14257), (7696, 14251), (8861, 14399)]
         : compromised: 0.5054, honest: 0.5572
         : sketchguard stats = ['Node 0: acc_rate=1.000', 'Node 1: acc_rate=1.000', 'Node 2: acc_rate=1.000']...
Round 003: test acc mean=0.5805 ± 0.0461 | min=0.4908 max=0.6358
         : test loss mean=1426.4136 ± 4321.1047
         : individual accs = ['0.593873', '0.630910', '0.626665', '0.510445', '0.536943', '0.512280', '0.574725', '0.584903', '0.591297', '0.635775', '0.604016', '0.532653', '0.490804', '0.508912', '0.609567', '0.602084', '0.629022', '0.596830', '0.614203', '0.624488']
         : correct/total = [(8452, 14232), (8981, 14235), (8940, 14266), (7257, 14217), (7645, 14238), (7363, 14373), (8245, 14346), (8384, 14334), (8452, 14294), (9138, 14373), (8664, 14344), (7618, 14302), (7045, 14354), (7309, 14362), (8729, 14320), (8667, 14395), (9051, 14389), (8509, 14257), (8753, 14251), (8992, 14399)]
         : compromised: 0.5106, honest: 0.5883
         : sketchguard stats = ['Node 0: acc_rate=1.000', 'Node 1: acc_rate=1.000', 'Node 2: acc_rate=1.000']...
Round 004: test acc mean=0.6021 ± 0.0511 | min=0.4920 max=0.6417
         : test loss mean=244968.9531 ± 762433.7443
         : individual accs = ['0.639193', '0.637092', '0.636198', '0.609060', '0.603034', '0.498365', '0.635160', '0.641691', '0.624598', '0.623600', '0.616774', '0.506223', '0.491988', '0.512046', '0.620740', '0.620771', '0.630690', '0.633584', '0.623465', '0.638447']
         : correct/total = [(9097, 14232), (9069, 14235), (9076, 14266), (8659, 14217), (8586, 14238), (7163, 14373), (9112, 14346), (9198, 14334), (8928, 14294), (8963, 14373), (8847, 14344), (7240, 14302), (7062, 14354), (7354, 14362), (8889, 14320), (8936, 14395), (9075, 14389), (9033, 14257), (8885, 14251), (9193, 14399)]
         : compromised: 0.5052, honest: 0.6129
         : sketchguard stats = ['Node 0: acc_rate=1.000', 'Node 1: acc_rate=1.000', 'Node 2: acc_rate=1.000']...
Round 005: test acc mean=0.6072 ± 0.0538 | min=0.4940 max=0.6489
         : test loss mean=8080383.4835 ± 26457375.8061
         : individual accs = ['0.642847', '0.648894', '0.640123', '0.631920', '0.626141', '0.503305', '0.627492', '0.627738', '0.638799', '0.640994', '0.620538', '0.509859', '0.495193', '0.494012', '0.635196', '0.630149', '0.626590', '0.630147', '0.636447', '0.638030']
         : correct/total = [(9149, 14232), (9237, 14235), (9132, 14266), (8984, 14217), (8915, 14238), (7234, 14373), (9002, 14346), (8998, 14334), (9131, 14294), (9213, 14373), (8901, 14344), (7292, 14302), (7108, 14354), (7095, 14362), (9096, 14320), (9071, 14395), (9016, 14389), (8984, 14257), (9070, 14251), (9187, 14399)]
         : compromised: 0.4987, honest: 0.6193
         : sketchguard stats = ['Node 0: acc_rate=1.000', 'Node 1: acc_rate=1.000', 'Node 2: acc_rate=1.000']...
Round 006: test acc mean=0.6175 ± 0.0508 | min=0.4962 max=0.6547
         : test loss mean=555045195.5945 ± 1672351171.6482
         : individual accs = ['0.647414', '0.648472', '0.644610', '0.642119', '0.641663', '0.525708', '0.646243', '0.654667', '0.640828', '0.642385', '0.623187', '0.537058', '0.496238', '0.511280', '0.643994', '0.640500', '0.638752', '0.639405', '0.638201', '0.647962']
         : correct/total = [(9214, 14232), (9231, 14235), (9196, 14266), (9129, 14217), (9136, 14238), (7556, 14373), (9271, 14346), (9384, 14334), (9160, 14294), (9233, 14373), (8939, 14344), (7681, 14302), (7123, 14354), (7343, 14362), (9222, 14320), (9220, 14395), (9191, 14389), (9116, 14257), (9095, 14251), (9330, 14399)]
         : compromised: 0.5185, honest: 0.6285
         : sketchguard stats = ['Node 0: acc_rate=1.000', 'Node 1: acc_rate=1.000', 'Node 2: acc_rate=1.000']...
Round 007: test acc mean=0.6127 ± 0.0566 | min=0.4812 max=0.6567
         : test loss mean=36294956809.7718 ± 110621464212.3586
         : individual accs = ['0.651349', '0.656691', '0.650217', '0.652669', '0.653884', '0.514854', '0.650634', '0.640993', '0.645096', '0.626244', '0.602342', '0.510348', '0.504459', '0.481200', '0.633799', '0.632720', '0.629300', '0.633794', '0.634692', '0.649351']
         : correct/total = [(9270, 14232), (9348, 14235), (9276, 14266), (9279, 14217), (9310, 14238), (7400, 14373), (9334, 14346), (9188, 14334), (9221, 14294), (9001, 14373), (8640, 14344), (7299, 14302), (7241, 14354), (6911, 14362), (9076, 14320), (9108, 14395), (9055, 14389), (9036, 14257), (9045, 14251), (9350, 14399)]
         : compromised: 0.4980, honest: 0.6255
         : sketchguard stats = ['Node 0: acc_rate=1.000', 'Node 1: acc_rate=1.000', 'Node 2: acc_rate=1.000']...
Round 008: test acc mean=0.6121 ± 0.0571 | min=0.4954 max=0.6547
         : test loss mean=4134946693422.1826 ± 12797175077391.8594
         : individual accs = ['0.646782', '0.630839', '0.635777', '0.648168', '0.654657', '0.498365', '0.636136', '0.633180', '0.640339', '0.638976', '0.572783', '0.521815', '0.495402', '0.496936', '0.650559', '0.649253', '0.648342', '0.648243', '0.642692', '0.652337']
         : correct/total = [(9205, 14232), (8980, 14235), (9070, 14266), (9215, 14217), (9321, 14238), (7163, 14373), (9126, 14346), (9076, 14334), (9153, 14294), (9184, 14373), (8216, 14344), (7463, 14302), (7111, 14354), (7137, 14362), (9316, 14320), (9346, 14395), (9329, 14389), (9242, 14257), (9159, 14251), (9393, 14399)]
         : compromised: 0.4977, honest: 0.6248
         : sketchguard stats = ['Node 0: acc_rate=1.000', 'Node 1: acc_rate=1.000', 'Node 2: acc_rate=1.000']...
Round 009: test acc mean=0.6162 ± 0.0571 | min=0.4946 max=0.6660
         : test loss mean=315910007446295.6875 ± 994359363658457.8750
         : individual accs = ['0.637858', '0.649737', '0.653231', '0.661813', '0.665964', '0.500731', '0.628677', '0.648109', '0.644326', '0.635428', '0.571807', '0.540554', '0.494636', '0.501601', '0.634497', '0.649045', '0.646814', '0.652802', '0.647814', '0.658587']
         : correct/total = [(9078, 14232), (9249, 14235), (9319, 14266), (9409, 14217), (9482, 14238), (7197, 14373), (9019, 14346), (9290, 14334), (9210, 14294), (9133, 14373), (8202, 14344), (7731, 14302), (7100, 14354), (7204, 14362), (9086, 14320), (9343, 14395), (9307, 14389), (9307, 14257), (9232, 14251), (9483, 14399)]
         : compromised: 0.5012, honest: 0.6290
         : sketchguard stats = ['Node 0: acc_rate=1.000', 'Node 1: acc_rate=1.000', 'Node 2: acc_rate=1.000']...
Round 010: test acc mean=0.6302 ± 0.0533 | min=0.4971 max=0.6738
         : test loss mean=25543427589616840.0000 ± 76724601701762864.0000
         : individual accs = ['0.661537', '0.655427', '0.644399', '0.664768', '0.673760', '0.518959', '0.663112', '0.666876', '0.652372', '0.635010', '0.627231', '0.613760', '0.507245', '0.497145', '0.648534', '0.652101', '0.654597', '0.655187', '0.651253', '0.661713']
         : correct/total = [(9415, 14232), (9330, 14235), (9193, 14266), (9451, 14217), (9593, 14238), (7459, 14373), (9513, 14346), (9559, 14334), (9325, 14294), (9127, 14373), (8997, 14344), (8778, 14302), (7281, 14354), (7140, 14362), (9287, 14320), (9387, 14395), (9419, 14389), (9341, 14257), (9281, 14251), (9528, 14399)]
         : compromised: 0.5081, honest: 0.6438
         : sketchguard stats = ['Node 0: acc_rate=1.000', 'Node 1: acc_rate=1.000', 'Node 2: acc_rate=1.000']...

=== FINAL RESULTS ===
Dataset: sent140, Nodes: 20, Graph: ring, Aggregation: sketchguard
Attack: backdoor, 10.0% compromised
Final accuracy - Compromised: 0.5081, Honest: 0.6438
Overall test accuracy: mean=0.6302 ± 0.0533

=== BACKDOOR ATTACK SUCCESS RATE (ASR) ===
Target label: 1
Trigger size: 3x3
Overall ASR: 0.5315 ± 0.1635
Honest nodes ASR: 0.4910 ± 0.1103
Compromised nodes ASR: 0.8963 ± 0.0997
Note: Higher ASR indicates more successful backdoor attack

=== Sketchguard SUMMARY ===
Node 0: acceptance=1.000
Node 1: acceptance=1.000
Node 2: acceptance=1.000
Node 3: acceptance=1.000
Node 4: acceptance=0.600
Node 5: acceptance=0.600
Node 6: acceptance=0.550
Node 7: acceptance=1.000
Node 8: acceptance=1.000
Node 9: acceptance=1.000
Node 10: acceptance=1.000
Node 11: acceptance=0.900
Node 12: acceptance=1.000
Node 13: acceptance=0.600
Node 14: acceptance=0.550
Node 15: acceptance=1.000
Node 16: acceptance=1.000
Node 17: acceptance=1.000
Node 18: acceptance=1.000
Node 19: acceptance=1.000

=== PARALLEL EXECUTION TIME (realistic for distributed system) ===
  COMMUNICATION (max across nodes):
    - Sketch transfer: 0.000s (0.0%)
    - Model fetch (accepted): 0.000s (0.0%)
  COMPUTATION (max across nodes):
    - Sketching: 0.207s (95.2%)
    - Filtering: 0.001s (0.3%)
    - Aggregation: 0.010s (4.5%)
  TOTALS:
    - Total computation: 0.217s (100.0%)
    - Total communication: 0.000s (0.0%)
    - Total parallel time: 0.217s

=== PER-NODE AVERAGE TIME ===
  - Sketching: 0.160s
  - Filtering: 0.000s
  - Aggregation: 0.006s
  - Sketch transfer: 0.000s
  - Model fetch: 0.000s
  - Total per node: 0.166s

=== TOTAL COMPUTATIONAL WORK (sum across all nodes) ===
  - Total sketching: 3.198s
  - Total filtering: 0.006s
  - Total aggregation: 0.118s
  - Total sketch transfer: 0.000s
  - Total model fetch: 0.000s
  - Grand total: 3.323s
  - Mean acceptance rate: 0.890

Sketchguard Algorithm Properties:
  - Original dimension: 1,174,986
  - Sketch size: 180
  - Compression ratio: 19.9x
  - Single repetition: No repetitions needed
  - Theoretical complexity: O(d + N×k)
  - Approach: Sketch filtering + state aggregation
