Device: cuda
Seed: 987654321
Loading 1 LEAF Sent140 train files...
LEAF Sent140 train: 254555 users, 908652 samples
Building vocabulary (max_size=10000)...
Vocabulary size: 10000
Loading 1 LEAF Sent140 test files...
LEAF Sent140 test: 254555 users, 286281 samples
Found 254555 train users, 254555 test users, 254555 common users
User sample counts range: 494 (max) to 1 (min)
Distributed ALL 254555 users across 20 clients
Users per client: 12727 (with 15 clients getting +1 user)
Train partition sizes: [44353, 44290, 44657, 44907, 44696, 45843, 45801, 45619, 45069, 45639, 45821, 45311, 45779, 46056, 45625, 45984, 46428, 44737, 45540, 46497]
Test partition sizes: [14232, 14235, 14266, 14217, 14238, 14373, 14346, 14334, 14294, 14373, 14344, 14302, 14354, 14362, 14320, 14395, 14389, 14257, 14251, 14399]
  Client 0: 44353 train samples, 2 unique classes
  Client 1: 44290 train samples, 2 unique classes
  Client 2: 44657 train samples, 2 unique classes
  Client 3: 44907 train samples, 2 unique classes
  Client 4: 44696 train samples, 2 unique classes
  Client 5: 45843 train samples, 2 unique classes
  Client 6: 45801 train samples, 2 unique classes
  Client 7: 45619 train samples, 2 unique classes
  Client 8: 45069 train samples, 2 unique classes
  Client 9: 45639 train samples, 2 unique classes
  Client 10: 45821 train samples, 2 unique classes
  Client 11: 45311 train samples, 2 unique classes
  Client 12: 45779 train samples, 2 unique classes
  Client 13: 46056 train samples, 2 unique classes
  Client 14: 45625 train samples, 2 unique classes
  Client 15: 45984 train samples, 2 unique classes
  Client 16: 46428 train samples, 2 unique classes
  Client 17: 44737 train samples, 2 unique classes
  Client 18: 45540 train samples, 2 unique classes
  Client 19: 46497 train samples, 2 unique classes
Will sample 4500 samples per client per epoch
Graph: erdos, nodes: 20, edges: 126
Degree statistics: avg=12.60, min=8, max=16
Attack: Compromised 8/20 nodes: [1, 5, 11, 12, 13, 14, 17, 18]
Attack type: directed_deviation, lambda: 1.0
Model variant: baseline
Model parameters: 1,174,986
Initial test acc across nodes: mean=0.4953 ± 0.0174
Round 001: test acc mean=0.5030 ± 0.0079 | min=0.4883 max=0.5200
         : test loss mean=3.8999 ± 1.2049
         : individual accs = ['0.506816', '0.504742', '0.507010', '0.520011', '0.507937', '0.505740', '0.505089', '0.488349', '0.496292', '0.517707', '0.501603', '0.506433', '0.498049', '0.494012', '0.497346', '0.494130', '0.512753', '0.500736', '0.499684', '0.494618']
         : correct/total = [(7213, 14232), (7185, 14235), (7233, 14266), (7393, 14217), (7232, 14238), (7269, 14373), (7246, 14346), (7000, 14334), (7094, 14294), (7441, 14373), (7195, 14344), (7243, 14302), (7149, 14354), (7095, 14362), (7122, 14320), (7113, 14395), (7378, 14389), (7139, 14257), (7121, 14251), (7122, 14399)]
         : compromised: 0.5008, honest: 0.5044
Round 002: test acc mean=0.5024 ± 0.0059 | min=0.4900 max=0.5127
         : test loss mean=2.1662 ± 0.4492
         : individual accs = ['0.498243', '0.510713', '0.503505', '0.503974', '0.512712', '0.497321', '0.501812', '0.502232', '0.505877', '0.510054', '0.497351', '0.510418', '0.490038', '0.502507', '0.505377', '0.504203', '0.496768', '0.497019', '0.504245', '0.493090']
         : correct/total = [(7091, 14232), (7270, 14235), (7183, 14266), (7165, 14217), (7300, 14238), (7148, 14373), (7199, 14346), (7199, 14334), (7231, 14294), (7331, 14373), (7134, 14344), (7300, 14302), (7034, 14354), (7217, 14362), (7237, 14320), (7258, 14395), (7148, 14389), (7086, 14257), (7186, 14251), (7100, 14399)]
         : compromised: 0.5022, honest: 0.5025
Round 003: test acc mean=0.4962 ± 0.0107 | min=0.4740 max=0.5246
         : test loss mean=0.7240 ± 0.0257
         : individual accs = ['0.486298', '0.484721', '0.491308', '0.483646', '0.493047', '0.498435', '0.524606', '0.504256', '0.503498', '0.503931', '0.492680', '0.510628', '0.474014', '0.504595', '0.494763', '0.499410', '0.493849', '0.492670', '0.487755', '0.499826']
         : correct/total = [(6921, 14232), (6900, 14235), (7009, 14266), (6876, 14217), (7020, 14238), (7164, 14373), (7526, 14346), (7228, 14334), (7197, 14294), (7243, 14373), (7067, 14344), (7303, 14302), (6804, 14354), (7247, 14362), (7085, 14320), (7189, 14395), (7106, 14389), (7024, 14257), (6951, 14251), (7197, 14399)]
         : compromised: 0.4934, honest: 0.4980
Round 004: test acc mean=0.5044 ± 0.0065 | min=0.4880 max=0.5156
         : test loss mean=0.8774 ± 0.1264
         : individual accs = ['0.497822', '0.513874', '0.497336', '0.515580', '0.507023', '0.502052', '0.503206', '0.499860', '0.508535', '0.505810', '0.507390', '0.487974', '0.508151', '0.501323', '0.506774', '0.509969', '0.511641', '0.498001', '0.506842', '0.498090']
         : correct/total = [(7085, 14232), (7315, 14235), (7095, 14266), (7330, 14217), (7219, 14238), (7216, 14373), (7219, 14346), (7165, 14334), (7269, 14294), (7270, 14373), (7278, 14344), (6979, 14302), (7294, 14354), (7200, 14362), (7257, 14320), (7341, 14395), (7362, 14389), (7100, 14257), (7223, 14251), (7172, 14399)]
         : compromised: 0.5031, honest: 0.5052
Round 005: test acc mean=0.5080 ± 0.0152 | min=0.4765 max=0.5326
         : test loss mean=0.7002 ± 0.0080
         : individual accs = ['0.476532', '0.507130', '0.527548', '0.489555', '0.499438', '0.511306', '0.529904', '0.509418', '0.520918', '0.503444', '0.531233', '0.526430', '0.505504', '0.493246', '0.493506', '0.497812', '0.503440', '0.500807', '0.500316', '0.532606']
         : correct/total = [(6782, 14232), (7219, 14235), (7526, 14266), (6960, 14217), (7111, 14238), (7349, 14373), (7602, 14346), (7302, 14334), (7446, 14294), (7236, 14373), (7620, 14344), (7529, 14302), (7256, 14354), (7084, 14362), (7067, 14320), (7166, 14395), (7244, 14389), (7140, 14257), (7130, 14251), (7669, 14399)]
         : compromised: 0.5048, honest: 0.5102
Round 006: test acc mean=0.5145 ± 0.0093 | min=0.4947 max=0.5384
         : test loss mean=0.7133 ± 0.0153
         : individual accs = ['0.510750', '0.517457', '0.507921', '0.538440', '0.514328', '0.513463', '0.514429', '0.505930', '0.512383', '0.509706', '0.524749', '0.517130', '0.508917', '0.494708', '0.517737', '0.531851', '0.513726', '0.504594', '0.512245', '0.520453']
         : correct/total = [(7269, 14232), (7366, 14235), (7246, 14266), (7655, 14217), (7323, 14238), (7380, 14373), (7380, 14346), (7252, 14334), (7324, 14294), (7326, 14373), (7527, 14344), (7396, 14302), (7305, 14354), (7105, 14362), (7414, 14320), (7656, 14395), (7392, 14389), (7194, 14257), (7300, 14251), (7494, 14399)]
         : compromised: 0.5108, honest: 0.5171
Round 007: test acc mean=0.5129 ± 0.0173 | min=0.4873 max=0.5451
         : test loss mean=0.6915 ± 0.0020
         : individual accs = ['0.492763', '0.487320', '0.531824', '0.503271', '0.497120', '0.518750', '0.545100', '0.538370', '0.523017', '0.522229', '0.506553', '0.535659', '0.519785', '0.522768', '0.492807', '0.501285', '0.490444', '0.495546', '0.528033', '0.506285']
         : correct/total = [(7013, 14232), (6937, 14235), (7587, 14266), (7155, 14217), (7078, 14238), (7456, 14373), (7820, 14346), (7717, 14334), (7476, 14294), (7506, 14373), (7266, 14344), (7661, 14302), (7461, 14354), (7508, 14362), (7057, 14320), (7216, 14395), (7057, 14389), (7065, 14257), (7525, 14251), (7290, 14399)]
         : compromised: 0.5126, honest: 0.5132
Round 008: test acc mean=0.5194 ± 0.0094 | min=0.5003 max=0.5368
         : test loss mean=0.7134 ± 0.0089
         : individual accs = ['0.516301', '0.519002', '0.520468', '0.536752', '0.526759', '0.521742', '0.522585', '0.520371', '0.518050', '0.515550', '0.519172', '0.536219', '0.501393', '0.500348', '0.517458', '0.519208', '0.521579', '0.506067', '0.515894', '0.533787']
         : correct/total = [(7348, 14232), (7388, 14235), (7425, 14266), (7631, 14217), (7500, 14238), (7499, 14373), (7497, 14346), (7459, 14334), (7405, 14294), (7410, 14373), (7447, 14344), (7669, 14302), (7197, 14354), (7186, 14362), (7410, 14320), (7474, 14395), (7505, 14389), (7215, 14257), (7352, 14251), (7686, 14399)]
         : compromised: 0.5148, honest: 0.5225
Round 009: test acc mean=0.5040 ± 0.0157 | min=0.4830 max=0.5375
         : test loss mean=0.6906 ± 0.0030
         : individual accs = ['0.492622', '0.483035', '0.508412', '0.485053', '0.494522', '0.532039', '0.535829', '0.537533', '0.517630', '0.495234', '0.498397', '0.517690', '0.502856', '0.506824', '0.492598', '0.497742', '0.492460', '0.495336', '0.495614', '0.497951']
         : correct/total = [(7011, 14232), (6876, 14235), (7253, 14266), (6896, 14217), (7041, 14238), (7647, 14373), (7687, 14346), (7705, 14334), (7399, 14294), (7118, 14373), (7149, 14344), (7404, 14302), (7218, 14354), (7279, 14362), (7054, 14320), (7165, 14395), (7086, 14389), (7062, 14257), (7063, 14251), (7170, 14399)]
         : compromised: 0.5032, honest: 0.5044
Round 010: test acc mean=0.5262 ± 0.0088 | min=0.5015 max=0.5378
         : test loss mean=0.7038 ± 0.0060
         : individual accs = ['0.523539', '0.524693', '0.523903', '0.537666', '0.530271', '0.535796', '0.533947', '0.530417', '0.521548', '0.520559', '0.523006', '0.535310', '0.511077', '0.501532', '0.527235', '0.531782', '0.530753', '0.519675', '0.522911', '0.537815']
         : correct/total = [(7451, 14232), (7469, 14235), (7474, 14266), (7644, 14217), (7550, 14238), (7701, 14373), (7660, 14346), (7603, 14334), (7455, 14294), (7482, 14373), (7502, 14344), (7656, 14302), (7336, 14354), (7203, 14362), (7550, 14320), (7655, 14395), (7637, 14389), (7409, 14257), (7452, 14251), (7744, 14399)]
         : compromised: 0.5223, honest: 0.5288

=== FINAL RESULTS ===
Dataset: sent140, Nodes: 20, Graph: erdos, Aggregation: d-fedavg
Attack: directed_deviation, 40.0% compromised
Final accuracy - Compromised: 0.5223, Honest: 0.5288
Overall test accuracy: mean=0.5262 ± 0.0088
