Device: cuda
Seed: 987654321
Loading 1 LEAF Sent140 train files...
LEAF Sent140 train: 254555 users, 908652 samples
Building vocabulary (max_size=10000)...
Vocabulary size: 10000
Loading 1 LEAF Sent140 test files...
LEAF Sent140 test: 254555 users, 286281 samples
Found 254555 train users, 254555 test users, 254555 common users
User sample counts range: 494 (max) to 1 (min)
Distributed ALL 254555 users across 20 clients
Users per client: 12727 (with 15 clients getting +1 user)
Train partition sizes: [44353, 44290, 44657, 44907, 44696, 45843, 45801, 45619, 45069, 45639, 45821, 45311, 45779, 46056, 45625, 45984, 46428, 44737, 45540, 46497]
Test partition sizes: [14232, 14235, 14266, 14217, 14238, 14373, 14346, 14334, 14294, 14373, 14344, 14302, 14354, 14362, 14320, 14395, 14389, 14257, 14251, 14399]
  Client 0: 44353 train samples, 2 unique classes
  Client 1: 44290 train samples, 2 unique classes
  Client 2: 44657 train samples, 2 unique classes
  Client 3: 44907 train samples, 2 unique classes
  Client 4: 44696 train samples, 2 unique classes
  Client 5: 45843 train samples, 2 unique classes
  Client 6: 45801 train samples, 2 unique classes
  Client 7: 45619 train samples, 2 unique classes
  Client 8: 45069 train samples, 2 unique classes
  Client 9: 45639 train samples, 2 unique classes
  Client 10: 45821 train samples, 2 unique classes
  Client 11: 45311 train samples, 2 unique classes
  Client 12: 45779 train samples, 2 unique classes
  Client 13: 46056 train samples, 2 unique classes
  Client 14: 45625 train samples, 2 unique classes
  Client 15: 45984 train samples, 2 unique classes
  Client 16: 46428 train samples, 2 unique classes
  Client 17: 44737 train samples, 2 unique classes
  Client 18: 45540 train samples, 2 unique classes
  Client 19: 46497 train samples, 2 unique classes
Will sample 4500 samples per client per epoch
Graph: fully, nodes: 20, edges: 190
Degree statistics: avg=19.00, min=19, max=19
Attack: Compromised 6/20 nodes: [5, 12, 13, 14, 17, 18]
Attack type: directed_deviation, lambda: 1.0
Model variant: baseline
Model parameters: 1,174,986
Initial test acc across nodes: mean=0.4953 ± 0.0174
Round 001: test acc mean=0.4963 ± 0.0066 | min=0.4842 max=0.5101
         : test loss mean=2.1358 ± 0.6956
         : individual accs = ['0.508994', '0.484159', '0.496004', '0.488781', '0.492906', '0.492869', '0.492681', '0.510116', '0.499720', '0.497391', '0.498675', '0.503007', '0.496726', '0.492132', '0.500070', '0.502327', '0.487317', '0.497791', '0.488597', '0.495451']
         : correct/total = [(7244, 14232), (6892, 14235), (7076, 14266), (6949, 14217), (7018, 14238), (7084, 14373), (7068, 14346), (7312, 14334), (7143, 14294), (7149, 14373), (7153, 14344), (7194, 14302), (7130, 14354), (7068, 14362), (7161, 14320), (7231, 14395), (7012, 14389), (7097, 14257), (6963, 14251), (7134, 14399)]
         : compromised: 0.4947, honest: 0.4970
Round 002: test acc mean=0.4859 ± 0.0038 | min=0.4789 max=0.4931
         : test loss mean=1.4367 ± 0.0111
         : individual accs = ['0.483137', '0.489146', '0.478901', '0.491102', '0.483706', '0.484450', '0.485641', '0.489954', '0.483420', '0.487094', '0.479573', '0.493148', '0.482932', '0.490322', '0.489525', '0.482529', '0.488498', '0.484955', '0.485580', '0.483575']
         : correct/total = [(6876, 14232), (6963, 14235), (6832, 14266), (6982, 14217), (6887, 14238), (6963, 14373), (6967, 14346), (7023, 14334), (6910, 14294), (7001, 14373), (6879, 14344), (7053, 14302), (6932, 14354), (7042, 14362), (7010, 14320), (6946, 14395), (7029, 14389), (6914, 14257), (6920, 14251), (6963, 14399)]
         : compromised: 0.4863, honest: 0.4857
Round 003: test acc mean=0.4988 ± 0.0048 | min=0.4906 max=0.5103
         : test loss mean=0.6932 ± 0.0004
         : individual accs = ['0.498665', '0.506358', '0.510304', '0.505240', '0.497120', '0.499130', '0.498745', '0.498047', '0.500490', '0.495234', '0.502579', '0.499161', '0.490595', '0.490600', '0.498464', '0.498020', '0.499409', '0.500175', '0.495755', '0.492187']
         : correct/total = [(7097, 14232), (7208, 14235), (7280, 14266), (7183, 14217), (7078, 14238), (7174, 14373), (7155, 14346), (7139, 14334), (7154, 14294), (7118, 14373), (7209, 14344), (7139, 14302), (7042, 14354), (7046, 14362), (7138, 14320), (7169, 14395), (7186, 14389), (7131, 14257), (7065, 14251), (7087, 14399)]
         : compromised: 0.4958, honest: 0.5001
Round 004: test acc mean=0.5045 ± 0.0034 | min=0.4993 max=0.5110
         : test loss mean=0.7620 ± 0.0033
         : individual accs = ['0.503513', '0.510994', '0.510585', '0.504889', '0.506672', '0.510332', '0.500279', '0.501535', '0.502379', '0.502261', '0.501464', '0.503916', '0.499303', '0.500348', '0.504469', '0.507815', '0.507123', '0.502280', '0.504035', '0.506146']
         : correct/total = [(7166, 14232), (7274, 14235), (7284, 14266), (7178, 14217), (7214, 14238), (7335, 14373), (7177, 14346), (7189, 14334), (7181, 14294), (7219, 14373), (7193, 14344), (7207, 14302), (7167, 14354), (7186, 14362), (7224, 14320), (7310, 14395), (7297, 14389), (7161, 14257), (7183, 14251), (7288, 14399)]
         : compromised: 0.5035, honest: 0.5050
Round 005: test acc mean=0.6188 ± 0.0036 | min=0.6108 max=0.6246
         : test loss mean=0.6566 ± 0.0017
         : individual accs = ['0.616709', '0.621777', '0.610823', '0.619399', '0.622489', '0.617547', '0.616200', '0.621250', '0.624598', '0.618243', '0.616286', '0.620543', '0.617110', '0.619203', '0.617877', '0.620076', '0.624505', '0.618503', '0.610834', '0.622752']
         : correct/total = [(8777, 14232), (8851, 14235), (8714, 14266), (8806, 14217), (8863, 14238), (8876, 14373), (8840, 14346), (8905, 14334), (8928, 14294), (8886, 14373), (8840, 14344), (8875, 14302), (8858, 14354), (8893, 14362), (8848, 14320), (8926, 14395), (8986, 14389), (8818, 14257), (8705, 14251), (8967, 14399)]
         : compromised: 0.6168, honest: 0.6197
Round 006: test acc mean=0.5259 ± 0.0039 | min=0.5161 max=0.5314
         : test loss mean=0.6924 ± 0.0010
         : individual accs = ['0.527473', '0.531437', '0.516122', '0.528804', '0.527321', '0.526265', '0.519866', '0.523720', '0.528054', '0.521325', '0.523703', '0.527339', '0.531211', '0.528826', '0.523534', '0.525182', '0.529432', '0.530617', '0.524384', '0.523717']
         : correct/total = [(7507, 14232), (7565, 14235), (7363, 14266), (7518, 14217), (7508, 14238), (7564, 14373), (7458, 14346), (7507, 14334), (7548, 14294), (7493, 14373), (7512, 14344), (7542, 14302), (7625, 14354), (7595, 14362), (7497, 14320), (7560, 14395), (7618, 14389), (7565, 14257), (7473, 14251), (7541, 14399)]
         : compromised: 0.5275, honest: 0.5252
Round 007: test acc mean=0.6297 ± 0.0029 | min=0.6224 max=0.6342
         : test loss mean=0.6437 ± 0.0016
         : individual accs = ['0.629778', '0.629083', '0.622389', '0.630864', '0.628529', '0.628331', '0.628328', '0.634157', '0.631174', '0.631601', '0.626534', '0.629702', '0.631601', '0.631249', '0.632402', '0.629663', '0.632845', '0.628042', '0.624026', '0.633725']
         : correct/total = [(8963, 14232), (8955, 14235), (8879, 14266), (8969, 14217), (8949, 14238), (9031, 14373), (9014, 14346), (9090, 14334), (9022, 14294), (9078, 14373), (8987, 14344), (9006, 14302), (9066, 14354), (9066, 14362), (9056, 14320), (9064, 14395), (9106, 14389), (8954, 14257), (8893, 14251), (9125, 14399)]
         : compromised: 0.6293, honest: 0.6299
Round 008: test acc mean=0.5848 ± 0.0044 | min=0.5782 max=0.5977
         : test loss mean=0.6734 ± 0.0015
         : individual accs = ['0.584879', '0.585739', '0.580822', '0.581768', '0.584633', '0.584707', '0.581556', '0.584136', '0.578215', '0.582829', '0.581567', '0.590757', '0.584297', '0.586617', '0.583729', '0.585898', '0.597679', '0.582381', '0.580450', '0.592680']
         : correct/total = [(8324, 14232), (8338, 14235), (8286, 14266), (8271, 14217), (8324, 14238), (8404, 14373), (8343, 14346), (8373, 14334), (8265, 14294), (8377, 14373), (8342, 14344), (8449, 14302), (8387, 14354), (8425, 14362), (8359, 14320), (8434, 14395), (8600, 14389), (8303, 14257), (8272, 14251), (8534, 14399)]
         : compromised: 0.5837, honest: 0.5852
Round 009: test acc mean=0.6376 ± 0.0033 | min=0.6317 max=0.6437
         : test loss mean=0.6366 ± 0.0018
         : individual accs = ['0.633080', '0.634563', '0.634586', '0.637617', '0.638924', '0.636541', '0.639481', '0.643714', '0.637820', '0.640576', '0.633087', '0.638372', '0.640379', '0.639187', '0.640712', '0.633831', '0.640698', '0.634986', '0.631745', '0.642197']
         : correct/total = [(9010, 14232), (9033, 14235), (9053, 14266), (9065, 14217), (9097, 14238), (9149, 14373), (9174, 14346), (9227, 14334), (9117, 14294), (9207, 14373), (9081, 14344), (9130, 14302), (9192, 14354), (9180, 14362), (9175, 14320), (9124, 14395), (9219, 14389), (9053, 14257), (9003, 14251), (9247, 14399)]
         : compromised: 0.6373, honest: 0.6378
Round 010: test acc mean=0.6015 ± 0.0041 | min=0.5927 max=0.6078
         : test loss mean=0.6624 ± 0.0018
         : individual accs = ['0.601321', '0.604566', '0.595402', '0.592741', '0.604088', '0.605580', '0.599331', '0.601088', '0.596544', '0.601962', '0.596347', '0.605999', '0.602341', '0.606810', '0.602933', '0.602292', '0.607756', '0.597531', '0.598625', '0.606084']
         : correct/total = [(8558, 14232), (8606, 14235), (8494, 14266), (8427, 14217), (8601, 14238), (8704, 14373), (8598, 14346), (8616, 14334), (8527, 14294), (8652, 14373), (8554, 14344), (8667, 14302), (8646, 14354), (8715, 14362), (8634, 14320), (8670, 14395), (8745, 14389), (8519, 14257), (8531, 14251), (8727, 14399)]
         : compromised: 0.6023, honest: 0.6011

=== FINAL RESULTS ===
Dataset: sent140, Nodes: 20, Graph: fully, Aggregation: d-fedavg
Attack: directed_deviation, 30.0% compromised
Final accuracy - Compromised: 0.6023, Honest: 0.6011
Overall test accuracy: mean=0.6015 ± 0.0041
