Device: cuda
Seed: 987654321
Loading 1 LEAF Sent140 train files...
LEAF Sent140 train: 254555 users, 908652 samples
Building vocabulary (max_size=10000)...
Vocabulary size: 10000
Loading 1 LEAF Sent140 test files...
LEAF Sent140 test: 254555 users, 286281 samples
Found 254555 train users, 254555 test users, 254555 common users
User sample counts range: 494 (max) to 1 (min)
Distributed ALL 254555 users across 20 clients
Users per client: 12727 (with 15 clients getting +1 user)
Train partition sizes: [44353, 44290, 44657, 44907, 44696, 45843, 45801, 45619, 45069, 45639, 45821, 45311, 45779, 46056, 45625, 45984, 46428, 44737, 45540, 46497]
Test partition sizes: [14232, 14235, 14266, 14217, 14238, 14373, 14346, 14334, 14294, 14373, 14344, 14302, 14354, 14362, 14320, 14395, 14389, 14257, 14251, 14399]
  Client 0: 44353 train samples, 2 unique classes
  Client 1: 44290 train samples, 2 unique classes
  Client 2: 44657 train samples, 2 unique classes
  Client 3: 44907 train samples, 2 unique classes
  Client 4: 44696 train samples, 2 unique classes
  Client 5: 45843 train samples, 2 unique classes
  Client 6: 45801 train samples, 2 unique classes
  Client 7: 45619 train samples, 2 unique classes
  Client 8: 45069 train samples, 2 unique classes
  Client 9: 45639 train samples, 2 unique classes
  Client 10: 45821 train samples, 2 unique classes
  Client 11: 45311 train samples, 2 unique classes
  Client 12: 45779 train samples, 2 unique classes
  Client 13: 46056 train samples, 2 unique classes
  Client 14: 45625 train samples, 2 unique classes
  Client 15: 45984 train samples, 2 unique classes
  Client 16: 46428 train samples, 2 unique classes
  Client 17: 44737 train samples, 2 unique classes
  Client 18: 45540 train samples, 2 unique classes
  Client 19: 46497 train samples, 2 unique classes
Will sample 4500 samples per client per epoch
Graph: erdos, nodes: 20, edges: 126
Degree statistics: avg=12.60, min=8, max=16
Attack: Compromised 4/20 nodes: [5, 12, 13, 17]
Attack type: krum, lambda: 1.0
Model variant: baseline
Model parameters: 1,174,986
BALANCE algorithm:
Balance Config: BALANCEConfig(gamma=2, kappa=1, alpha=0.5, min_neighbors=1)
  - Model dimension: 1,174,986 parameters
  - Complexity: O(N×d) = O(20×1,174,986)
Initial test acc across nodes: mean=0.4953 ± 0.0174
Round 001: test acc mean=0.4985 ± 0.0184 | min=0.4583 max=0.5269
         : test loss mean=0.7445 ± 0.0748
         : individual accs = ['0.471402', '0.473411', '0.486191', '0.511078', '0.494381', '0.483754', '0.496654', '0.515348', '0.512453', '0.497252', '0.519520', '0.490631', '0.526891', '0.522072', '0.488478', '0.524279', '0.489888', '0.458301', '0.506771', '0.501840']
         : correct/total = [(6709, 14232), (6739, 14235), (6936, 14266), (7266, 14217), (7039, 14238), (6953, 14373), (7125, 14346), (7387, 14334), (7325, 14294), (7147, 14373), (7452, 14344), (7017, 14302), (7563, 14354), (7498, 14362), (6995, 14320), (7547, 14395), (7049, 14389), (6534, 14257), (7222, 14251), (7226, 14399)]
         : compromised: 0.4978, honest: 0.4987
Round 002: test acc mean=0.5521 ± 0.0328 | min=0.4891 max=0.6038
         : test loss mean=0.6885 ± 0.0019
         : individual accs = ['0.567735', '0.564032', '0.510865', '0.489133', '0.535328', '0.577124', '0.585599', '0.540324', '0.543655', '0.533918', '0.517568', '0.603832', '0.580814', '0.512603', '0.571089', '0.587148', '0.574953', '0.505226', '0.541155', '0.599486']
         : correct/total = [(8080, 14232), (8029, 14235), (7288, 14266), (6954, 14217), (7622, 14238), (8295, 14373), (8401, 14346), (7745, 14334), (7771, 14294), (7674, 14373), (7424, 14344), (8636, 14302), (8337, 14354), (7362, 14362), (8178, 14320), (8452, 14395), (8273, 14389), (7203, 14257), (7712, 14251), (8632, 14399)]
         : compromised: 0.5439, honest: 0.5541
Round 003: test acc mean=0.5579 ± 0.0370 | min=0.4981 max=0.6195
         : test loss mean=0.6890 ± 0.0016
         : individual accs = ['0.544547', '0.577520', '0.560143', '0.503341', '0.610339', '0.536075', '0.543915', '0.551067', '0.543305', '0.517776', '0.606735', '0.619494', '0.607636', '0.521376', '0.550419', '0.557694', '0.604907', '0.515186', '0.587889', '0.498090']
         : correct/total = [(7750, 14232), (8221, 14235), (7991, 14266), (7156, 14217), (8690, 14238), (7705, 14373), (7803, 14346), (7899, 14334), (7766, 14294), (7442, 14373), (8703, 14344), (8860, 14302), (8722, 14354), (7488, 14362), (7882, 14320), (8028, 14395), (8704, 14389), (7345, 14257), (8378, 14251), (7172, 14399)]
         : compromised: 0.5451, honest: 0.5611
Round 004: test acc mean=0.5909 ± 0.0310 | min=0.5204 max=0.6289
         : test loss mean=0.6866 ± 0.0014
         : individual accs = ['0.611439', '0.628872', '0.599537', '0.588732', '0.615817', '0.595979', '0.616757', '0.520371', '0.610676', '0.593961', '0.573201', '0.559153', '0.551345', '0.541568', '0.617528', '0.620007', '0.585030', '0.547941', '0.611326', '0.628863']
         : correct/total = [(8702, 14232), (8952, 14235), (8553, 14266), (8370, 14217), (8768, 14238), (8566, 14373), (8848, 14346), (7459, 14334), (8729, 14294), (8537, 14373), (8222, 14344), (7997, 14302), (7914, 14354), (7778, 14362), (8843, 14320), (8925, 14395), (8418, 14389), (7812, 14257), (8712, 14251), (9055, 14399)]
         : compromised: 0.5592, honest: 0.5988
Round 005: test acc mean=0.6142 ± 0.0201 | min=0.5595 max=0.6389
         : test loss mean=0.6793 ± 0.0025
         : individual accs = ['0.626686', '0.628451', '0.601430', '0.615601', '0.619890', '0.582411', '0.631883', '0.597949', '0.637540', '0.604606', '0.592164', '0.629982', '0.629372', '0.559462', '0.628701', '0.611462', '0.631107', '0.616609', '0.599747', '0.638933']
         : correct/total = [(8919, 14232), (8946, 14235), (8580, 14266), (8752, 14217), (8826, 14238), (8371, 14373), (9065, 14346), (8571, 14334), (9113, 14294), (8690, 14373), (8494, 14344), (9010, 14302), (9034, 14354), (8035, 14362), (9003, 14320), (8802, 14395), (9081, 14389), (8791, 14257), (8547, 14251), (9200, 14399)]
         : compromised: 0.5970, honest: 0.6185
Round 006: test acc mean=0.6362 ± 0.0063 | min=0.6250 max=0.6462
         : test loss mean=0.6589 ± 0.0031
         : individual accs = ['0.637577', '0.642501', '0.626945', '0.630935', '0.638643', '0.641202', '0.640248', '0.631296', '0.645725', '0.638211', '0.627649', '0.630821', '0.646161', '0.628394', '0.643575', '0.640431', '0.637153', '0.624956', '0.633570', '0.638100']
         : correct/total = [(9074, 14232), (9146, 14235), (8944, 14266), (8970, 14217), (9093, 14238), (9216, 14373), (9185, 14346), (9049, 14334), (9230, 14294), (9173, 14373), (9003, 14344), (9022, 14302), (9275, 14354), (9025, 14362), (9216, 14320), (9219, 14395), (9168, 14389), (8910, 14257), (9029, 14251), (9188, 14399)]
         : compromised: 0.6352, honest: 0.6365
Round 007: test acc mean=0.6392 ± 0.0091 | min=0.6136 max=0.6516
         : test loss mean=0.6413 ± 0.0051
         : individual accs = ['0.644252', '0.648753', '0.641035', '0.640782', '0.643208', '0.651569', '0.642339', '0.613576', '0.647894', '0.642663', '0.634621', '0.630891', '0.648112', '0.625261', '0.648883', '0.627926', '0.642922', '0.638493', '0.635885', '0.634975']
         : correct/total = [(9169, 14232), (9235, 14235), (9145, 14266), (9110, 14217), (9158, 14238), (9365, 14373), (9215, 14346), (8795, 14334), (9261, 14294), (9237, 14373), (9103, 14344), (9023, 14302), (9303, 14354), (8980, 14362), (9292, 14320), (9039, 14395), (9251, 14389), (9103, 14257), (9062, 14251), (9143, 14399)]
         : compromised: 0.6409, honest: 0.6388
Round 008: test acc mean=0.6467 ± 0.0069 | min=0.6274 max=0.6588
         : test loss mean=0.6317 ± 0.0043
         : individual accs = ['0.647555', '0.642431', '0.627436', '0.651052', '0.649178', '0.658805', '0.651053', '0.637575', '0.650133', '0.650177', '0.643963', '0.657251', '0.647067', '0.649283', '0.640223', '0.648767', '0.650844', '0.643053', '0.639674', '0.649212']
         : correct/total = [(9216, 14232), (9145, 14235), (8951, 14266), (9256, 14217), (9243, 14238), (9469, 14373), (9340, 14346), (9139, 14334), (9293, 14294), (9345, 14373), (9237, 14344), (9400, 14302), (9288, 14354), (9325, 14362), (9168, 14320), (9339, 14395), (9365, 14389), (9168, 14257), (9116, 14251), (9348, 14399)]
         : compromised: 0.6496, honest: 0.6460
Round 009: test acc mean=0.6537 ± 0.0074 | min=0.6253 max=0.6591
         : test loss mean=0.6258 ± 0.0061
         : individual accs = ['0.625281', '0.659150', '0.654143', '0.655835', '0.656483', '0.656578', '0.649031', '0.658574', '0.658178', '0.655604', '0.644939', '0.655013', '0.655079', '0.655340', '0.658520', '0.651962', '0.658489', '0.652101', '0.654901', '0.658449']
         : correct/total = [(8899, 14232), (9383, 14235), (9332, 14266), (9324, 14217), (9347, 14238), (9437, 14373), (9311, 14346), (9440, 14334), (9408, 14294), (9423, 14373), (9251, 14344), (9368, 14302), (9403, 14354), (9412, 14362), (9430, 14320), (9385, 14395), (9475, 14389), (9297, 14257), (9333, 14251), (9481, 14399)]
         : compromised: 0.6548, honest: 0.6534
Round 010: test acc mean=0.6608 ± 0.0084 | min=0.6340 max=0.6718
         : test loss mean=0.6179 ± 0.0063
         : individual accs = ['0.658235', '0.664840', '0.634025', '0.662024', '0.664349', '0.665066', '0.665342', '0.671829', '0.669162', '0.656022', '0.653514', '0.667040', '0.668942', '0.660563', '0.666760', '0.650226', '0.663840', '0.659325', '0.652516', '0.662824']
         : correct/total = [(9368, 14232), (9464, 14235), (9045, 14266), (9412, 14217), (9459, 14238), (9559, 14373), (9545, 14346), (9630, 14334), (9565, 14294), (9429, 14373), (9374, 14344), (9540, 14302), (9602, 14354), (9487, 14362), (9548, 14320), (9360, 14395), (9552, 14389), (9400, 14257), (9299, 14251), (9544, 14399)]
         : compromised: 0.6635, honest: 0.6602

=== FINAL RESULTS ===
Dataset: sent140, Nodes: 20, Graph: erdos, Aggregation: balance
Attack: krum, 20.0% compromised
Final accuracy - Compromised: 0.6635, Honest: 0.6602
Overall test accuracy: mean=0.6608 ± 0.0084

=== BALANCE SUMMARY ===
Node 0: acceptance=0.831
Node 1: acceptance=0.836
Node 2: acceptance=0.850
Node 3: acceptance=0.887
Node 4: acceptance=0.836
Node 5: acceptance=0.820
Node 6: acceptance=0.743
Node 7: acceptance=0.807
Node 8: acceptance=0.730
Node 9: acceptance=0.931
Node 10: acceptance=0.700
Node 11: acceptance=0.807
Node 12: acceptance=0.925
Node 13: acceptance=0.931
Node 14: acceptance=0.760
Node 15: acceptance=0.836
Node 16: acceptance=0.792
Node 17: acceptance=0.900
Node 18: acceptance=0.831
Node 19: acceptance=0.775

=== PARALLEL EXECUTION TIME (realistic for distributed system) ===
  COMMUNICATION (max across nodes):
    - Full model transfer: 0.000s (0.0%)
  COMPUTATION (max across nodes):
    - Filtering: 0.065s (79.2%)
    - Aggregation: 0.017s (20.7%)
  TOTALS:
    - Total computation: 0.082s (100.0%)
    - Total communication: 0.000s (0.0%)
    - Total parallel time: 0.082s

=== PER-NODE AVERAGE TIME ===
  - Filtering: 0.051s
  - Aggregation: 0.010s
  - Model transfer: 0.000s
  - Total per node: 0.060s

=== TOTAL COMPUTATIONAL WORK (sum across all nodes) ===
  - Total filtering: 1.011s
  - Total aggregation: 0.194s
  - Total model transfer: 0.000s
  - Grand total: 1.205s
  - Mean acceptance rate: 0.827

BALANCE Algorithm Properties:
  - Model dimension: 1,174,986
  - No compression: Full parameter comparison
  - Theoretical complexity: O(deg(i)×d)
  - Approach: Full parameter filtering + averaging
