Device: cuda
Seed: 987654321
Loading 1 LEAF Sent140 train files...
LEAF Sent140 train: 254555 users, 908652 samples
Building vocabulary (max_size=10000)...
Vocabulary size: 10000
Loading 1 LEAF Sent140 test files...
LEAF Sent140 test: 254555 users, 286281 samples
Found 254555 train users, 254555 test users, 254555 common users
User sample counts range: 494 (max) to 1 (min)
Distributed ALL 254555 users across 20 clients
Users per client: 12727 (with 15 clients getting +1 user)
Train partition sizes: [44353, 44290, 44657, 44907, 44696, 45843, 45801, 45619, 45069, 45639, 45821, 45311, 45779, 46056, 45625, 45984, 46428, 44737, 45540, 46497]
Test partition sizes: [14232, 14235, 14266, 14217, 14238, 14373, 14346, 14334, 14294, 14373, 14344, 14302, 14354, 14362, 14320, 14395, 14389, 14257, 14251, 14399]
  Client 0: 44353 train samples, 2 unique classes
  Client 1: 44290 train samples, 2 unique classes
  Client 2: 44657 train samples, 2 unique classes
  Client 3: 44907 train samples, 2 unique classes
  Client 4: 44696 train samples, 2 unique classes
  Client 5: 45843 train samples, 2 unique classes
  Client 6: 45801 train samples, 2 unique classes
  Client 7: 45619 train samples, 2 unique classes
  Client 8: 45069 train samples, 2 unique classes
  Client 9: 45639 train samples, 2 unique classes
  Client 10: 45821 train samples, 2 unique classes
  Client 11: 45311 train samples, 2 unique classes
  Client 12: 45779 train samples, 2 unique classes
  Client 13: 46056 train samples, 2 unique classes
  Client 14: 45625 train samples, 2 unique classes
  Client 15: 45984 train samples, 2 unique classes
  Client 16: 46428 train samples, 2 unique classes
  Client 17: 44737 train samples, 2 unique classes
  Client 18: 45540 train samples, 2 unique classes
  Client 19: 46497 train samples, 2 unique classes
Will sample 4500 samples per client per epoch
Graph: erdos, nodes: 20, edges: 126
Degree statistics: avg=12.60, min=8, max=16
Attack: Compromised 14/20 nodes: [1, 2, 3, 5, 6, 8, 11, 12, 13, 14, 15, 17, 18, 19]
Attack type: gaussian, lambda: 1.0
Model variant: baseline
Model parameters: 1,174,986
Sketchguard Node 0:
  Model dim: 1,174,986 → Sketch size: 180
  Compression ratio: 6527.7x
  Using model parameters for aggregation, sketches for filtering
Sketchguard Node 1:
  Model dim: 1,174,986 → Sketch size: 180
  Compression ratio: 6527.7x
  Using model parameters for aggregation, sketches for filtering
Sketchguard Node 2:
  Model dim: 1,174,986 → Sketch size: 180
  Compression ratio: 6527.7x
  Using model parameters for aggregation, sketches for filtering
Sketchguard Node 3:
  Model dim: 1,174,986 → Sketch size: 180
  Compression ratio: 6527.7x
  Using model parameters for aggregation, sketches for filtering
Sketchguard Node 4:
  Model dim: 1,174,986 → Sketch size: 180
  Compression ratio: 6527.7x
  Using model parameters for aggregation, sketches for filtering
Sketchguard Node 5:
  Model dim: 1,174,986 → Sketch size: 180
  Compression ratio: 6527.7x
  Using model parameters for aggregation, sketches for filtering
Sketchguard Node 6:
  Model dim: 1,174,986 → Sketch size: 180
  Compression ratio: 6527.7x
  Using model parameters for aggregation, sketches for filtering
Sketchguard Node 7:
  Model dim: 1,174,986 → Sketch size: 180
  Compression ratio: 6527.7x
  Using model parameters for aggregation, sketches for filtering
Sketchguard Node 8:
  Model dim: 1,174,986 → Sketch size: 180
  Compression ratio: 6527.7x
  Using model parameters for aggregation, sketches for filtering
Sketchguard Node 9:
  Model dim: 1,174,986 → Sketch size: 180
  Compression ratio: 6527.7x
  Using model parameters for aggregation, sketches for filtering
Sketchguard Node 10:
  Model dim: 1,174,986 → Sketch size: 180
  Compression ratio: 6527.7x
  Using model parameters for aggregation, sketches for filtering
Sketchguard Node 11:
  Model dim: 1,174,986 → Sketch size: 180
  Compression ratio: 6527.7x
  Using model parameters for aggregation, sketches for filtering
Sketchguard Node 12:
  Model dim: 1,174,986 → Sketch size: 180
  Compression ratio: 6527.7x
  Using model parameters for aggregation, sketches for filtering
Sketchguard Node 13:
  Model dim: 1,174,986 → Sketch size: 180
  Compression ratio: 6527.7x
  Using model parameters for aggregation, sketches for filtering
Sketchguard Node 14:
  Model dim: 1,174,986 → Sketch size: 180
  Compression ratio: 6527.7x
  Using model parameters for aggregation, sketches for filtering
Sketchguard Node 15:
  Model dim: 1,174,986 → Sketch size: 180
  Compression ratio: 6527.7x
  Using model parameters for aggregation, sketches for filtering
Sketchguard Node 16:
  Model dim: 1,174,986 → Sketch size: 180
  Compression ratio: 6527.7x
  Using model parameters for aggregation, sketches for filtering
Sketchguard Node 17:
  Model dim: 1,174,986 → Sketch size: 180
  Compression ratio: 6527.7x
  Using model parameters for aggregation, sketches for filtering
Sketchguard Node 18:
  Model dim: 1,174,986 → Sketch size: 180
  Compression ratio: 6527.7x
  Using model parameters for aggregation, sketches for filtering
Sketchguard Node 19:
  Model dim: 1,174,986 → Sketch size: 180
  Compression ratio: 6527.7x
  Using model parameters for aggregation, sketches for filtering
Sketchguard ALGORITHM (Sketch-based Filtering + State Aggregation)
  - Model dimension: 1,174,986 parameters
  - Config: SketchguardConfig(gamma=2, kappa=1, alpha=0.5, min_neighbors=1, sketch_size=180, network_seed=987654321, attack_detection_window=5)
  - Sketch size: 180
  - Compression ratio: 6527.7x
  - Complexity: O(d + N×k) = O(1,174,986 + 20×180)
  - Theoretical speedup vs BALANCE: 19.9x
Initial test acc across nodes: mean=0.4953 ± 0.0174
Round 001: test acc mean=0.5636 ± 0.0343 | min=0.5053 max=0.6189
         : test loss mean=0.6899 ± 0.0009
         : individual accs = ['0.589587', '0.561925', '0.533016', '0.505311', '0.618345', '0.576985', '0.598843', '0.618948', '0.521058', '0.600849', '0.512479', '0.525241', '0.572732', '0.563083', '0.555307', '0.565752', '0.521787', '0.584064', '0.549014', '0.598653']
         : correct/total = [(8391, 14232), (7999, 14235), (7604, 14266), (7184, 14217), (8804, 14238), (8293, 14373), (8591, 14346), (8872, 14334), (7448, 14294), (8636, 14373), (7351, 14344), (7512, 14302), (8221, 14354), (8087, 14362), (7952, 14320), (8144, 14395), (7508, 14389), (8327, 14257), (7824, 14251), (8620, 14399)]
         : compromised: 0.5579, honest: 0.5770
         : sketchguard stats = ['Node 0: acc_rate=0.312', 'Node 1: acc_rate=0.364', 'Node 2: acc_rate=0.333']...
Round 002: test acc mean=0.5872 ± 0.0396 | min=0.4926 max=0.6307
         : test loss mean=0.6868 ± 0.0032
         : individual accs = ['0.626827', '0.532771', '0.587130', '0.627137', '0.597696', '0.611355', '0.512547', '0.630738', '0.600672', '0.622000', '0.626115', '0.625157', '0.540825', '0.613424', '0.492598', '0.594165', '0.583779', '0.580276', '0.578135', '0.559692']
         : correct/total = [(8921, 14232), (7584, 14235), (8376, 14266), (8916, 14217), (8510, 14238), (8787, 14373), (7353, 14346), (9041, 14334), (8586, 14294), (8940, 14373), (8981, 14344), (8941, 14302), (7763, 14354), (8810, 14362), (7054, 14320), (8553, 14395), (8400, 14389), (8273, 14257), (8239, 14251), (8059, 14399)]
         : compromised: 0.5754, honest: 0.6145
         : sketchguard stats = ['Node 0: acc_rate=0.312', 'Node 1: acc_rate=0.364', 'Node 2: acc_rate=0.333']...
Round 003: test acc mean=0.6009 ± 0.0317 | min=0.5125 max=0.6448
         : test loss mean=0.6738 ± 0.0073
         : individual accs = ['0.582701', '0.585037', '0.576686', '0.585496', '0.630707', '0.612259', '0.554510', '0.614064', '0.644816', '0.636541', '0.594743', '0.618515', '0.578166', '0.612937', '0.588897', '0.593123', '0.641462', '0.628954', '0.626482', '0.512466']
         : correct/total = [(8293, 14232), (8328, 14235), (8227, 14266), (8324, 14217), (8980, 14238), (8800, 14373), (7955, 14346), (8802, 14334), (9217, 14294), (9149, 14373), (8531, 14344), (8846, 14302), (8299, 14354), (8803, 14362), (8433, 14320), (8538, 14395), (9230, 14389), (8967, 14257), (8928, 14251), (7379, 14399)]
         : compromised: 0.5942, honest: 0.6167
         : sketchguard stats = ['Node 0: acc_rate=0.312', 'Node 1: acc_rate=0.364', 'Node 2: acc_rate=0.333']...
Round 004: test acc mean=0.6401 ± 0.0055 | min=0.6321 max=0.6528
         : test loss mean=0.6493 ± 0.0041
         : individual accs = ['0.642847', '0.632455', '0.632132', '0.639727', '0.644121', '0.652752', '0.637042', '0.647621', '0.648314', '0.635497', '0.636364', '0.633618', '0.643096', '0.635914', '0.639874', '0.639528', '0.644034', '0.635688', '0.637078', '0.644975']
         : correct/total = [(9149, 14232), (9003, 14235), (9018, 14266), (9095, 14217), (9171, 14238), (9382, 14373), (9139, 14346), (9283, 14334), (9267, 14294), (9134, 14373), (9128, 14344), (9062, 14302), (9231, 14354), (9133, 14362), (9163, 14320), (9206, 14395), (9267, 14389), (9063, 14257), (9079, 14251), (9287, 14399)]
         : compromised: 0.6394, honest: 0.6417
         : sketchguard stats = ['Node 0: acc_rate=0.312', 'Node 1: acc_rate=0.364', 'Node 2: acc_rate=0.333']...
Round 005: test acc mean=0.6440 ± 0.0050 | min=0.6330 max=0.6515
         : test loss mean=0.6367 ± 0.0032
         : individual accs = ['0.643761', '0.648894', '0.640684', '0.640993', '0.650794', '0.650177', '0.638157', '0.648249', '0.651462', '0.645098', '0.643684', '0.638093', '0.647067', '0.639605', '0.633031', '0.638208', '0.648273', '0.645227', '0.640095', '0.648170']
         : correct/total = [(9162, 14232), (9237, 14235), (9140, 14266), (9113, 14217), (9266, 14238), (9345, 14373), (9155, 14346), (9292, 14334), (9312, 14294), (9272, 14373), (9233, 14344), (9126, 14302), (9288, 14354), (9186, 14362), (9065, 14320), (9187, 14395), (9328, 14389), (9199, 14257), (9122, 14251), (9333, 14399)]
         : compromised: 0.6428, honest: 0.6466
         : sketchguard stats = ['Node 0: acc_rate=0.312', 'Node 1: acc_rate=0.364', 'Node 2: acc_rate=0.333']...
Round 006: test acc mean=0.6495 ± 0.0052 | min=0.6413 max=0.6600
         : test loss mean=0.6297 ± 0.0030
         : individual accs = ['0.650295', '0.653881', '0.642927', '0.647675', '0.655499', '0.659987', '0.649031', '0.654458', '0.647335', '0.650734', '0.648564', '0.645924', '0.655148', '0.647542', '0.650140', '0.649462', '0.641393', '0.642071', '0.641288', '0.657407']
         : correct/total = [(9255, 14232), (9308, 14235), (9172, 14266), (9208, 14217), (9333, 14238), (9486, 14373), (9311, 14346), (9381, 14334), (9253, 14294), (9353, 14373), (9303, 14344), (9238, 14302), (9404, 14354), (9300, 14362), (9310, 14320), (9349, 14395), (9229, 14389), (9154, 14257), (9139, 14251), (9466, 14399)]
         : compromised: 0.6493, honest: 0.6502
         : sketchguard stats = ['Node 0: acc_rate=0.312', 'Node 1: acc_rate=0.364', 'Node 2: acc_rate=0.333']...
Round 007: test acc mean=0.6544 ± 0.0059 | min=0.6360 max=0.6642
         : test loss mean=0.6248 ± 0.0048
         : individual accs = ['0.652263', '0.661047', '0.635988', '0.648590', '0.661680', '0.664162', '0.651540', '0.652435', '0.656219', '0.656370', '0.653862', '0.651238', '0.661000', '0.651998', '0.654330', '0.654880', '0.656543', '0.656590', '0.648656', '0.658101']
         : correct/total = [(9283, 14232), (9410, 14235), (9073, 14266), (9221, 14217), (9421, 14238), (9546, 14373), (9347, 14346), (9352, 14334), (9380, 14294), (9434, 14373), (9379, 14344), (9314, 14302), (9488, 14354), (9364, 14362), (9370, 14320), (9427, 14395), (9447, 14389), (9361, 14257), (9244, 14251), (9476, 14399)]
         : compromised: 0.6539, honest: 0.6555
         : sketchguard stats = ['Node 0: acc_rate=0.312', 'Node 1: acc_rate=0.364', 'Node 2: acc_rate=0.333']...
Round 008: test acc mean=0.6558 ± 0.0078 | min=0.6372 max=0.6691
         : test loss mean=0.6220 ± 0.0058
         : individual accs = ['0.651630', '0.657604', '0.637249', '0.656468', '0.648687', '0.669102', '0.657814', '0.656411', '0.658738', '0.656230', '0.656302', '0.655992', '0.666713', '0.657569', '0.654609', '0.658631', '0.646675', '0.661149', '0.641359', '0.667824']
         : correct/total = [(9274, 14232), (9361, 14235), (9091, 14266), (9333, 14217), (9236, 14238), (9617, 14373), (9437, 14346), (9409, 14334), (9416, 14294), (9432, 14373), (9414, 14344), (9382, 14302), (9570, 14354), (9444, 14362), (9374, 14320), (9481, 14395), (9305, 14389), (9426, 14257), (9140, 14251), (9616, 14399)]
         : compromised: 0.6572, honest: 0.6527
         : sketchguard stats = ['Node 0: acc_rate=0.312', 'Node 1: acc_rate=0.364', 'Node 2: acc_rate=0.333']...
Round 009: test acc mean=0.6571 ± 0.0083 | min=0.6355 max=0.6727
         : test loss mean=0.6203 ± 0.0061
         : individual accs = ['0.639685', '0.667510', '0.653161', '0.653584', '0.655991', '0.672650', '0.635508', '0.659341', '0.662026', '0.651151', '0.655326', '0.654314', '0.663648', '0.662164', '0.656634', '0.659743', '0.660713', '0.654906', '0.659533', '0.665185']
         : correct/total = [(9104, 14232), (9502, 14235), (9318, 14266), (9292, 14217), (9340, 14238), (9668, 14373), (9117, 14346), (9451, 14334), (9463, 14294), (9359, 14373), (9400, 14344), (9358, 14302), (9526, 14354), (9510, 14362), (9403, 14320), (9497, 14395), (9507, 14389), (9337, 14257), (9399, 14251), (9578, 14399)]
         : compromised: 0.6586, honest: 0.6537
         : sketchguard stats = ['Node 0: acc_rate=0.312', 'Node 1: acc_rate=0.364', 'Node 2: acc_rate=0.333']...
Round 010: test acc mean=0.6628 ± 0.0064 | min=0.6453 max=0.6731
         : test loss mean=0.6127 ± 0.0044
         : individual accs = ['0.662099', '0.671303', '0.645311', '0.657804', '0.664138', '0.673137', '0.664297', '0.670225', '0.668672', '0.658039', '0.663553', '0.663613', '0.666295', '0.663069', '0.659148', '0.654672', '0.661617', '0.666550', '0.655533', '0.667616']
         : correct/total = [(9423, 14232), (9556, 14235), (9206, 14266), (9352, 14217), (9456, 14238), (9675, 14373), (9530, 14346), (9607, 14334), (9558, 14294), (9458, 14373), (9518, 14344), (9491, 14302), (9564, 14354), (9523, 14362), (9439, 14320), (9424, 14395), (9520, 14389), (9503, 14257), (9342, 14251), (9613, 14399)]
         : compromised: 0.6626, honest: 0.6633
         : sketchguard stats = ['Node 0: acc_rate=0.312', 'Node 1: acc_rate=0.364', 'Node 2: acc_rate=0.333']...

=== FINAL RESULTS ===
Dataset: sent140, Nodes: 20, Graph: erdos, Aggregation: sketchguard
Attack: gaussian, 70.0% compromised
Final accuracy - Compromised: 0.6626, Honest: 0.6633
Overall test accuracy: mean=0.6628 ± 0.0064

=== Sketchguard SUMMARY ===
Node 0: acceptance=0.312
Node 1: acceptance=0.364
Node 2: acceptance=0.333
Node 3: acceptance=0.375
Node 4: acceptance=0.364
Node 5: acceptance=0.267
Node 6: acceptance=0.286
Node 7: acceptance=0.286
Node 8: acceptance=0.200
Node 9: acceptance=0.308
Node 10: acceptance=0.222
Node 11: acceptance=0.357
Node 12: acceptance=0.333
Node 13: acceptance=0.231
Node 14: acceptance=0.267
Node 15: acceptance=0.273
Node 16: acceptance=0.231
Node 17: acceptance=0.444
Node 18: acceptance=0.312
Node 19: acceptance=0.312

=== PARALLEL EXECUTION TIME (realistic for distributed system) ===
  COMMUNICATION (max across nodes):
    - Sketch transfer: 0.000s (0.0%)
    - Model fetch (accepted): 0.000s (0.0%)
  COMPUTATION (max across nodes):
    - Sketching: 0.294s (95.3%)
    - Filtering: 0.001s (0.4%)
    - Aggregation: 0.013s (4.3%)
  TOTALS:
    - Total computation: 0.308s (100.0%)
    - Total communication: 0.000s (0.0%)
    - Total parallel time: 0.308s

=== PER-NODE AVERAGE TIME ===
  - Sketching: 0.243s
  - Filtering: 0.001s
  - Aggregation: 0.010s
  - Sketch transfer: 0.000s
  - Model fetch: 0.000s
  - Total per node: 0.254s

=== TOTAL COMPUTATIONAL WORK (sum across all nodes) ===
  - Total sketching: 4.862s
  - Total filtering: 0.012s
  - Total aggregation: 0.198s
  - Total sketch transfer: 0.000s
  - Total model fetch: 0.000s
  - Grand total: 5.072s
  - Mean acceptance rate: 0.304

Sketchguard Algorithm Properties:
  - Original dimension: 1,174,986
  - Sketch size: 180
  - Compression ratio: 19.9x
  - Single repetition: No repetitions needed
  - Theoretical complexity: O(d + N×k)
  - Approach: Sketch filtering + state aggregation
