Device: cuda
Seed: 987654321
Loading 1 LEAF Sent140 train files...
LEAF Sent140 train: 254555 users, 908652 samples
Building vocabulary (max_size=10000)...
Vocabulary size: 10000
Loading 1 LEAF Sent140 test files...
LEAF Sent140 test: 254555 users, 286281 samples
Found 254555 train users, 254555 test users, 254555 common users
User sample counts range: 494 (max) to 1 (min)
Distributed ALL 254555 users across 20 clients
Users per client: 12727 (with 15 clients getting +1 user)
Train partition sizes: [44353, 44290, 44657, 44907, 44696, 45843, 45801, 45619, 45069, 45639, 45821, 45311, 45779, 46056, 45625, 45984, 46428, 44737, 45540, 46497]
Test partition sizes: [14232, 14235, 14266, 14217, 14238, 14373, 14346, 14334, 14294, 14373, 14344, 14302, 14354, 14362, 14320, 14395, 14389, 14257, 14251, 14399]
  Client 0: 44353 train samples, 2 unique classes
  Client 1: 44290 train samples, 2 unique classes
  Client 2: 44657 train samples, 2 unique classes
  Client 3: 44907 train samples, 2 unique classes
  Client 4: 44696 train samples, 2 unique classes
  Client 5: 45843 train samples, 2 unique classes
  Client 6: 45801 train samples, 2 unique classes
  Client 7: 45619 train samples, 2 unique classes
  Client 8: 45069 train samples, 2 unique classes
  Client 9: 45639 train samples, 2 unique classes
  Client 10: 45821 train samples, 2 unique classes
  Client 11: 45311 train samples, 2 unique classes
  Client 12: 45779 train samples, 2 unique classes
  Client 13: 46056 train samples, 2 unique classes
  Client 14: 45625 train samples, 2 unique classes
  Client 15: 45984 train samples, 2 unique classes
  Client 16: 46428 train samples, 2 unique classes
  Client 17: 44737 train samples, 2 unique classes
  Client 18: 45540 train samples, 2 unique classes
  Client 19: 46497 train samples, 2 unique classes
Will sample 4500 samples per client per epoch
Graph: erdos, nodes: 20, edges: 99
Degree statistics: avg=9.90, min=7, max=14
Attack: Compromised 8/20 nodes: [1, 5, 11, 12, 13, 14, 17, 18]
Attack type: directed_deviation, lambda: 1.0
Model variant: baseline
Model parameters: 1,174,986
Initial test acc across nodes: mean=0.4953 ± 0.0174
Round 001: test acc mean=0.5017 ± 0.0060 | min=0.4938 max=0.5141
         : test loss mean=4.9368 ± 2.5938
         : individual accs = ['0.507167', '0.498771', '0.493831', '0.512204', '0.501826', '0.496973', '0.502300', '0.512627', '0.503848', '0.507479', '0.499582', '0.494546', '0.514142', '0.494569', '0.502444', '0.501563', '0.496977', '0.496247', '0.498351', '0.498298']
         : correct/total = [(7218, 14232), (7100, 14235), (7045, 14266), (7282, 14217), (7145, 14238), (7143, 14373), (7206, 14346), (7348, 14334), (7202, 14294), (7294, 14373), (7166, 14344), (7073, 14302), (7380, 14354), (7103, 14362), (7195, 14320), (7220, 14395), (7151, 14389), (7075, 14257), (7102, 14251), (7175, 14399)]
         : compromised: 0.4995, honest: 0.5031
Round 002: test acc mean=0.4987 ± 0.0052 | min=0.4887 max=0.5071
         : test loss mean=3.2732 ± 1.1587
         : individual accs = ['0.489952', '0.500667', '0.490397', '0.507069', '0.495154', '0.501705', '0.499582', '0.496163', '0.504407', '0.498713', '0.493795', '0.499371', '0.499164', '0.488720', '0.502654', '0.494199', '0.501842', '0.506348', '0.502281', '0.501979']
         : correct/total = [(6973, 14232), (7127, 14235), (6996, 14266), (7209, 14217), (7050, 14238), (7211, 14373), (7167, 14346), (7112, 14334), (7210, 14294), (7168, 14373), (7083, 14344), (7142, 14302), (7165, 14354), (7019, 14362), (7198, 14320), (7114, 14395), (7221, 14389), (7219, 14257), (7158, 14251), (7228, 14399)]
         : compromised: 0.5001, honest: 0.4978
Round 003: test acc mean=0.4902 ± 0.0151 | min=0.4692 max=0.5229
         : test loss mean=0.9103 ± 0.2203
         : individual accs = ['0.476321', '0.509308', '0.508201', '0.484983', '0.479281', '0.522855', '0.482713', '0.479350', '0.504337', '0.502818', '0.484314', '0.470913', '0.469207', '0.481549', '0.507612', '0.476276', '0.480019', '0.486428', '0.486983', '0.510313']
         : correct/total = [(6779, 14232), (7250, 14235), (7250, 14266), (6895, 14217), (6824, 14238), (7515, 14373), (6925, 14346), (6871, 14334), (7209, 14294), (7227, 14373), (6947, 14344), (6735, 14302), (6735, 14354), (6916, 14362), (7269, 14320), (6856, 14395), (6907, 14389), (6935, 14257), (6940, 14251), (7348, 14399)]
         : compromised: 0.4919, honest: 0.4891
Round 004: test acc mean=0.5033 ± 0.0088 | min=0.4832 max=0.5150
         : test loss mean=1.0545 ± 0.3521
         : individual accs = ['0.514966', '0.483246', '0.508342', '0.493001', '0.503722', '0.493008', '0.510177', '0.509627', '0.495523', '0.501705', '0.505717', '0.498741', '0.507385', '0.506127', '0.512011', '0.514970', '0.492460', '0.511047', '0.511754', '0.492743']
         : correct/total = [(7329, 14232), (6879, 14235), (7252, 14266), (7009, 14217), (7172, 14238), (7086, 14373), (7319, 14346), (7305, 14334), (7083, 14294), (7211, 14373), (7254, 14344), (7133, 14302), (7283, 14354), (7269, 14362), (7332, 14320), (7413, 14395), (7086, 14389), (7286, 14257), (7293, 14251), (7095, 14399)]
         : compromised: 0.5029, honest: 0.5036
Round 005: test acc mean=0.4946 ± 0.0133 | min=0.4691 max=0.5191
         : test loss mean=0.8327 ± 0.1949
         : individual accs = ['0.500211', '0.519143', '0.501262', '0.513540', '0.488552', '0.488764', '0.469051', '0.470490', '0.487477', '0.515063', '0.501603', '0.477695', '0.497353', '0.492828', '0.494344', '0.484057', '0.485093', '0.500456', '0.502491', '0.502882']
         : correct/total = [(7119, 14232), (7390, 14235), (7151, 14266), (7301, 14217), (6956, 14238), (7025, 14373), (6729, 14346), (6744, 14334), (6968, 14294), (7403, 14373), (7195, 14344), (6832, 14302), (7139, 14354), (7078, 14362), (7079, 14320), (6968, 14395), (6980, 14389), (7135, 14257), (7161, 14251), (7241, 14399)]
         : compromised: 0.4966, honest: 0.4933
Round 006: test acc mean=0.5008 ± 0.0057 | min=0.4918 max=0.5120
         : test loss mean=0.8058 ± 0.0998
         : individual accs = ['0.493887', '0.494064', '0.499579', '0.492650', '0.508358', '0.498226', '0.502928', '0.501814', '0.491815', '0.502887', '0.502719', '0.512026', '0.504180', '0.509052', '0.495391', '0.497117', '0.506290', '0.495336', '0.501509', '0.505452']
         : correct/total = [(7029, 14232), (7033, 14235), (7127, 14266), (7004, 14217), (7238, 14238), (7161, 14373), (7215, 14346), (7193, 14334), (7030, 14294), (7228, 14373), (7211, 14344), (7323, 14302), (7237, 14354), (7311, 14362), (7094, 14320), (7156, 14395), (7285, 14389), (7062, 14257), (7147, 14251), (7278, 14399)]
         : compromised: 0.5012, honest: 0.5005
Round 007: test acc mean=0.5207 ± 0.0198 | min=0.4813 max=0.5542
         : test loss mean=0.7217 ± 0.0754
         : individual accs = ['0.515388', '0.538391', '0.518365', '0.550819', '0.514187', '0.517707', '0.554231', '0.516046', '0.512663', '0.536353', '0.522658', '0.481331', '0.549255', '0.488929', '0.540782', '0.516916', '0.488012', '0.527180', '0.509087', '0.516008']
         : correct/total = [(7335, 14232), (7664, 14235), (7395, 14266), (7831, 14217), (7321, 14238), (7441, 14373), (7951, 14346), (7397, 14334), (7328, 14294), (7709, 14373), (7497, 14344), (6884, 14302), (7884, 14354), (7022, 14362), (7744, 14320), (7441, 14395), (7022, 14389), (7516, 14257), (7255, 14251), (7430, 14399)]
         : compromised: 0.5191, honest: 0.5218
Round 008: test acc mean=0.5070 ± 0.0082 | min=0.4937 max=0.5194
         : test loss mean=0.7663 ± 0.0613
         : individual accs = ['0.499789', '0.493713', '0.500841', '0.494056', '0.515241', '0.505879', '0.517775', '0.514511', '0.511963', '0.502122', '0.507948', '0.513774', '0.509057', '0.513090', '0.494204', '0.513928', '0.512127', '0.495827', '0.505017', '0.519411']
         : correct/total = [(7113, 14232), (7028, 14235), (7145, 14266), (7024, 14217), (7336, 14238), (7271, 14373), (7428, 14346), (7375, 14334), (7318, 14294), (7217, 14373), (7286, 14344), (7348, 14302), (7307, 14354), (7369, 14362), (7077, 14320), (7398, 14395), (7369, 14389), (7069, 14257), (7197, 14251), (7479, 14399)]
         : compromised: 0.5038, honest: 0.5091
Round 009: test acc mean=0.5219 ± 0.0204 | min=0.4759 max=0.5709
         : test loss mean=0.7071 ± 0.0462
         : individual accs = ['0.548904', '0.522023', '0.528179', '0.570866', '0.529147', '0.512210', '0.530531', '0.537882', '0.533021', '0.530300', '0.514292', '0.510558', '0.475895', '0.494987', '0.510754', '0.504967', '0.530753', '0.542681', '0.503965', '0.506216']
         : correct/total = [(7812, 14232), (7431, 14235), (7535, 14266), (8116, 14217), (7534, 14238), (7362, 14373), (7611, 14346), (7710, 14334), (7619, 14294), (7622, 14373), (7377, 14344), (7302, 14302), (6831, 14354), (7109, 14362), (7314, 14320), (7269, 14395), (7637, 14389), (7737, 14257), (7182, 14251), (7289, 14399)]
         : compromised: 0.5091, honest: 0.5304
Round 010: test acc mean=0.5112 ± 0.0077 | min=0.4940 max=0.5234
         : test loss mean=0.7317 ± 0.0425
         : individual accs = ['0.504497', '0.493994', '0.516963', '0.506225', '0.515241', '0.512489', '0.519169', '0.519813', '0.513012', '0.495930', '0.512479', '0.514194', '0.509753', '0.514622', '0.502793', '0.523446', '0.513170', '0.503542', '0.511333', '0.520522']
         : correct/total = [(7180, 14232), (7032, 14235), (7375, 14266), (7197, 14217), (7336, 14238), (7366, 14373), (7448, 14346), (7451, 14334), (7333, 14294), (7128, 14373), (7351, 14344), (7354, 14302), (7317, 14354), (7391, 14362), (7200, 14320), (7535, 14395), (7384, 14389), (7179, 14257), (7287, 14251), (7495, 14399)]
         : compromised: 0.5078, honest: 0.5134

=== FINAL RESULTS ===
Dataset: sent140, Nodes: 20, Graph: erdos, Aggregation: d-fedavg
Attack: directed_deviation, 40.0% compromised
Final accuracy - Compromised: 0.5078, Honest: 0.5134
Overall test accuracy: mean=0.5112 ± 0.0077
