Device: cuda
Seed: 987654321
Loading 1 LEAF Sent140 train files...
LEAF Sent140 train: 254555 users, 908652 samples
Building vocabulary (max_size=10000)...
Vocabulary size: 10000
Loading 1 LEAF Sent140 test files...
LEAF Sent140 test: 254555 users, 286281 samples
Found 254555 train users, 254555 test users, 254555 common users
User sample counts range: 494 (max) to 1 (min)
Distributed ALL 254555 users across 20 clients
Users per client: 12727 (with 15 clients getting +1 user)
Train partition sizes: [44353, 44290, 44657, 44907, 44696, 45843, 45801, 45619, 45069, 45639, 45821, 45311, 45779, 46056, 45625, 45984, 46428, 44737, 45540, 46497]
Test partition sizes: [14232, 14235, 14266, 14217, 14238, 14373, 14346, 14334, 14294, 14373, 14344, 14302, 14354, 14362, 14320, 14395, 14389, 14257, 14251, 14399]
  Client 0: 44353 train samples, 2 unique classes
  Client 1: 44290 train samples, 2 unique classes
  Client 2: 44657 train samples, 2 unique classes
  Client 3: 44907 train samples, 2 unique classes
  Client 4: 44696 train samples, 2 unique classes
  Client 5: 45843 train samples, 2 unique classes
  Client 6: 45801 train samples, 2 unique classes
  Client 7: 45619 train samples, 2 unique classes
  Client 8: 45069 train samples, 2 unique classes
  Client 9: 45639 train samples, 2 unique classes
  Client 10: 45821 train samples, 2 unique classes
  Client 11: 45311 train samples, 2 unique classes
  Client 12: 45779 train samples, 2 unique classes
  Client 13: 46056 train samples, 2 unique classes
  Client 14: 45625 train samples, 2 unique classes
  Client 15: 45984 train samples, 2 unique classes
  Client 16: 46428 train samples, 2 unique classes
  Client 17: 44737 train samples, 2 unique classes
  Client 18: 45540 train samples, 2 unique classes
  Client 19: 46497 train samples, 2 unique classes
Will sample 4500 samples per client per epoch
Graph: erdos, nodes: 20, edges: 48
Degree statistics: avg=4.80, min=2, max=7
Attack: Compromised 6/20 nodes: [5, 12, 13, 14, 17, 18]
Attack type: backdoor, lambda: 1.0
Backdoor target label: 1, trigger size: 3
Model variant: baseline
Model parameters: 1,174,986
Sketchguard Node 0:
  Model dim: 1,174,986 → Sketch size: 180
  Compression ratio: 6527.7x
  Using model parameters for aggregation, sketches for filtering
Sketchguard Node 1:
  Model dim: 1,174,986 → Sketch size: 180
  Compression ratio: 6527.7x
  Using model parameters for aggregation, sketches for filtering
Sketchguard Node 2:
  Model dim: 1,174,986 → Sketch size: 180
  Compression ratio: 6527.7x
  Using model parameters for aggregation, sketches for filtering
Sketchguard Node 3:
  Model dim: 1,174,986 → Sketch size: 180
  Compression ratio: 6527.7x
  Using model parameters for aggregation, sketches for filtering
Sketchguard Node 4:
  Model dim: 1,174,986 → Sketch size: 180
  Compression ratio: 6527.7x
  Using model parameters for aggregation, sketches for filtering
Sketchguard Node 5:
  Model dim: 1,174,986 → Sketch size: 180
  Compression ratio: 6527.7x
  Using model parameters for aggregation, sketches for filtering
Sketchguard Node 6:
  Model dim: 1,174,986 → Sketch size: 180
  Compression ratio: 6527.7x
  Using model parameters for aggregation, sketches for filtering
Sketchguard Node 7:
  Model dim: 1,174,986 → Sketch size: 180
  Compression ratio: 6527.7x
  Using model parameters for aggregation, sketches for filtering
Sketchguard Node 8:
  Model dim: 1,174,986 → Sketch size: 180
  Compression ratio: 6527.7x
  Using model parameters for aggregation, sketches for filtering
Sketchguard Node 9:
  Model dim: 1,174,986 → Sketch size: 180
  Compression ratio: 6527.7x
  Using model parameters for aggregation, sketches for filtering
Sketchguard Node 10:
  Model dim: 1,174,986 → Sketch size: 180
  Compression ratio: 6527.7x
  Using model parameters for aggregation, sketches for filtering
Sketchguard Node 11:
  Model dim: 1,174,986 → Sketch size: 180
  Compression ratio: 6527.7x
  Using model parameters for aggregation, sketches for filtering
Sketchguard Node 12:
  Model dim: 1,174,986 → Sketch size: 180
  Compression ratio: 6527.7x
  Using model parameters for aggregation, sketches for filtering
Sketchguard Node 13:
  Model dim: 1,174,986 → Sketch size: 180
  Compression ratio: 6527.7x
  Using model parameters for aggregation, sketches for filtering
Sketchguard Node 14:
  Model dim: 1,174,986 → Sketch size: 180
  Compression ratio: 6527.7x
  Using model parameters for aggregation, sketches for filtering
Sketchguard Node 15:
  Model dim: 1,174,986 → Sketch size: 180
  Compression ratio: 6527.7x
  Using model parameters for aggregation, sketches for filtering
Sketchguard Node 16:
  Model dim: 1,174,986 → Sketch size: 180
  Compression ratio: 6527.7x
  Using model parameters for aggregation, sketches for filtering
Sketchguard Node 17:
  Model dim: 1,174,986 → Sketch size: 180
  Compression ratio: 6527.7x
  Using model parameters for aggregation, sketches for filtering
Sketchguard Node 18:
  Model dim: 1,174,986 → Sketch size: 180
  Compression ratio: 6527.7x
  Using model parameters for aggregation, sketches for filtering
Sketchguard Node 19:
  Model dim: 1,174,986 → Sketch size: 180
  Compression ratio: 6527.7x
  Using model parameters for aggregation, sketches for filtering
Sketchguard ALGORITHM (Sketch-based Filtering + State Aggregation)
  - Model dimension: 1,174,986 parameters
  - Config: SketchguardConfig(gamma=2, kappa=1, alpha=0.5, min_neighbors=1, sketch_size=180, network_seed=987654321, attack_detection_window=5)
  - Sketch size: 180
  - Compression ratio: 6527.7x
  - Complexity: O(d + N×k) = O(1,174,986 + 20×180)
  - Theoretical speedup vs BALANCE: 19.9x
Initial test acc across nodes: mean=0.4953 ± 0.0174
Backdoor attack: Created poisoned datasets for 6 compromised nodes
Round 001: test acc mean=0.5158 ± 0.0258 | min=0.4901 max=0.5895
         : test loss mean=13.4013 ± 19.6638
         : individual accs = ['0.497260', '0.589533', '0.490116', '0.503200', '0.517067', '0.504835', '0.501882', '0.495675', '0.506296', '0.537536', '0.499930', '0.509649', '0.520691', '0.516363', '0.527584', '0.490587', '0.506151', '0.518412', '0.503754', '0.580179']
         : correct/total = [(7077, 14232), (8392, 14235), (6992, 14266), (7154, 14217), (7362, 14238), (7256, 14373), (7200, 14346), (7105, 14334), (7237, 14294), (7726, 14373), (7171, 14344), (7289, 14302), (7474, 14354), (7416, 14362), (7555, 14320), (7062, 14395), (7283, 14389), (7391, 14257), (7179, 14251), (8354, 14399)]
         : compromised: 0.5153, honest: 0.5161
         : sketchguard stats = ['Node 0: acc_rate=1.000', 'Node 1: acc_rate=1.000', 'Node 2: acc_rate=1.000']...
Round 002: test acc mean=0.5211 ± 0.0247 | min=0.4911 max=0.5803
         : test loss mean=190.0216 ± 310.2724
         : individual accs = ['0.518269', '0.519143', '0.516262', '0.548780', '0.506110', '0.502122', '0.580301', '0.515069', '0.516930', '0.506784', '0.538274', '0.560831', '0.497422', '0.491088', '0.511522', '0.571657', '0.507471', '0.499264', '0.508105', '0.506285']
         : correct/total = [(7376, 14232), (7390, 14235), (7365, 14266), (7802, 14217), (7206, 14238), (7217, 14373), (8325, 14346), (7383, 14334), (7389, 14294), (7284, 14373), (7721, 14344), (8021, 14302), (7140, 14354), (7053, 14362), (7325, 14320), (8229, 14395), (7302, 14389), (7118, 14257), (7241, 14251), (7290, 14399)]
         : compromised: 0.5016, honest: 0.5294
         : sketchguard stats = ['Node 0: acc_rate=0.917', 'Node 1: acc_rate=1.000', 'Node 2: acc_rate=0.800']...
Round 003: test acc mean=0.5711 ± 0.0501 | min=0.4890 max=0.6275
         : test loss mean=7293.0336 ± 12607.2846
         : individual accs = ['0.618114', '0.627538', '0.611664', '0.598368', '0.588074', '0.499687', '0.625261', '0.620832', '0.551210', '0.612677', '0.581288', '0.621591', '0.501602', '0.488999', '0.505028', '0.574852', '0.596636', '0.508803', '0.495123', '0.595111']
         : correct/total = [(8797, 14232), (8933, 14235), (8726, 14266), (8507, 14217), (8373, 14238), (7182, 14373), (8970, 14346), (8899, 14334), (7879, 14294), (8806, 14373), (8338, 14344), (8890, 14302), (7200, 14354), (7023, 14362), (7232, 14320), (8275, 14395), (8585, 14389), (7254, 14257), (7056, 14251), (8569, 14399)]
         : compromised: 0.4999, honest: 0.6017
         : sketchguard stats = ['Node 0: acc_rate=0.889', 'Node 1: acc_rate=1.000', 'Node 2: acc_rate=0.733']...
Round 004: test acc mean=0.5935 ± 0.0589 | min=0.4961 max=0.6425
         : test loss mean=1931751.0299 ± 3439327.3489
         : individual accs = ['0.630340', '0.640604', '0.629889', '0.626222', '0.638222', '0.496139', '0.634323', '0.642458', '0.618581', '0.614485', '0.624861', '0.632918', '0.501811', '0.509121', '0.510615', '0.636818', '0.633053', '0.507330', '0.500596', '0.642475']
         : correct/total = [(8971, 14232), (9119, 14235), (8986, 14266), (8903, 14217), (9087, 14238), (7131, 14373), (9100, 14346), (9209, 14334), (8842, 14294), (8832, 14373), (8963, 14344), (9052, 14302), (7203, 14354), (7312, 14362), (7312, 14320), (9167, 14395), (9109, 14389), (7233, 14257), (7134, 14251), (9251, 14399)]
         : compromised: 0.5043, honest: 0.6318
         : sketchguard stats = ['Node 0: acc_rate=0.875', 'Node 1: acc_rate=1.000', 'Node 2: acc_rate=0.700']...
Round 005: test acc mean=0.5983 ± 0.0648 | min=0.4938 max=0.6517
         : test loss mean=43264331.2346 ± 72131047.1284
         : individual accs = ['0.641161', '0.643203', '0.637740', '0.639094', '0.651707', '0.493773', '0.641573', '0.640854', '0.646705', '0.610172', '0.637270', '0.638792', '0.497562', '0.495474', '0.503142', '0.639805', '0.645563', '0.504314', '0.506842', '0.651365']
         : correct/total = [(9125, 14232), (9156, 14235), (9098, 14266), (9086, 14217), (9279, 14238), (7097, 14373), (9204, 14346), (9186, 14334), (9244, 14294), (8770, 14373), (9141, 14344), (9136, 14302), (7142, 14354), (7116, 14362), (7205, 14320), (9210, 14395), (9289, 14389), (7190, 14257), (7223, 14251), (9379, 14399)]
         : compromised: 0.5002, honest: 0.6404
         : sketchguard stats = ['Node 0: acc_rate=0.867', 'Node 1: acc_rate=1.000', 'Node 2: acc_rate=0.680']...
Round 006: test acc mean=0.6028 ± 0.0663 | min=0.4880 max=0.6578
         : test loss mean=2434054847.4548 ± 4217672633.9237
         : individual accs = ['0.646501', '0.650509', '0.643488', '0.652810', '0.653603', '0.501496', '0.647846', '0.657807', '0.653701', '0.633479', '0.634133', '0.614879', '0.508151', '0.487954', '0.498534', '0.653838', '0.654528', '0.509855', '0.510140', '0.642058']
         : correct/total = [(9201, 14232), (9260, 14235), (9180, 14266), (9281, 14217), (9306, 14238), (7208, 14373), (9294, 14346), (9429, 14334), (9344, 14294), (9105, 14373), (9096, 14344), (8794, 14302), (7294, 14354), (7008, 14362), (7139, 14320), (9412, 14395), (9418, 14389), (7269, 14257), (7270, 14251), (9245, 14399)]
         : compromised: 0.5027, honest: 0.6457
         : sketchguard stats = ['Node 0: acc_rate=0.861', 'Node 1: acc_rate=1.000', 'Node 2: acc_rate=0.667']...
Round 007: test acc mean=0.6074 ± 0.0692 | min=0.4954 max=0.6613
         : test loss mean=258993674981.0042 ± 431796629446.2617
         : individual accs = ['0.651138', '0.661257', '0.648325', '0.643736', '0.660275', '0.506853', '0.651680', '0.641621', '0.655800', '0.651847', '0.649888', '0.650189', '0.506200', '0.495405', '0.499092', '0.655853', '0.657586', '0.500596', '0.503684', '0.656018']
         : correct/total = [(9267, 14232), (9413, 14235), (9249, 14266), (9152, 14217), (9401, 14238), (7285, 14373), (9349, 14346), (9197, 14334), (9374, 14294), (9369, 14373), (9322, 14344), (9299, 14302), (7266, 14354), (7115, 14362), (7147, 14320), (9441, 14395), (9462, 14389), (7137, 14257), (7178, 14251), (9446, 14399)]
         : compromised: 0.5020, honest: 0.6525
         : sketchguard stats = ['Node 0: acc_rate=0.857', 'Node 1: acc_rate=1.000', 'Node 2: acc_rate=0.657']...
Round 008: test acc mean=0.6110 ± 0.0702 | min=0.5006 max=0.6637
         : test loss mean=17837314372527.8555 ± 28710433151544.7344
         : individual accs = ['0.658094', '0.646505', '0.625403', '0.663712', '0.662593', '0.500591', '0.658441', '0.659620', '0.658248', '0.659013', '0.658394', '0.657880', '0.508987', '0.507659', '0.507053', '0.662452', '0.660922', '0.501438', '0.501228', '0.661226']
         : correct/total = [(9366, 14232), (9203, 14235), (8922, 14266), (9436, 14217), (9434, 14238), (7195, 14373), (9446, 14346), (9455, 14334), (9409, 14294), (9472, 14373), (9444, 14344), (9409, 14302), (7306, 14354), (7291, 14362), (7261, 14320), (9536, 14395), (9510, 14389), (7149, 14257), (7143, 14251), (9521, 14399)]
         : compromised: 0.5045, honest: 0.6566
         : sketchguard stats = ['Node 0: acc_rate=0.854', 'Node 1: acc_rate=1.000', 'Node 2: acc_rate=0.650']...
Round 009: test acc mean=0.6111 ± 0.0714 | min=0.4960 max=0.6714
         : test loss mean=1736073047802652.5000 ± 3019709097960577.0000
         : individual accs = ['0.637366', '0.671373', '0.662554', '0.668425', '0.662172', '0.503444', '0.661020', '0.645947', '0.642158', '0.658805', '0.640407', '0.662075', '0.515396', '0.495962', '0.498045', '0.652796', '0.667871', '0.508662', '0.497439', '0.669560']
         : correct/total = [(9071, 14232), (9557, 14235), (9452, 14266), (9503, 14217), (9428, 14238), (7236, 14373), (9483, 14346), (9259, 14334), (9179, 14294), (9469, 14373), (9186, 14344), (9469, 14302), (7398, 14354), (7123, 14362), (7132, 14320), (9397, 14395), (9610, 14389), (7252, 14257), (7089, 14251), (9641, 14399)]
         : compromised: 0.5032, honest: 0.6573
         : sketchguard stats = ['Node 0: acc_rate=0.852', 'Node 1: acc_rate=1.000', 'Node 2: acc_rate=0.644']...
Round 010: test acc mean=0.6220 ± 0.0752 | min=0.4948 max=0.6786
         : test loss mean=124508075957532800.0000 ± 197533932130187584.0000
         : individual accs = ['0.665753', '0.676431', '0.664377', '0.670184', '0.675938', '0.519585', '0.672592', '0.678596', '0.672380', '0.670006', '0.668433', '0.669697', '0.517277', '0.503621', '0.495601', '0.672317', '0.668010', '0.494845', '0.514631', '0.670463']
         : correct/total = [(9475, 14232), (9629, 14235), (9478, 14266), (9528, 14217), (9624, 14238), (7468, 14373), (9649, 14346), (9727, 14334), (9611, 14294), (9630, 14373), (9588, 14344), (9578, 14302), (7425, 14354), (7233, 14362), (7097, 14320), (9678, 14395), (9612, 14389), (7055, 14257), (7334, 14251), (9654, 14399)]
         : compromised: 0.5076, honest: 0.6711
         : sketchguard stats = ['Node 0: acc_rate=0.850', 'Node 1: acc_rate=1.000', 'Node 2: acc_rate=0.640']...

=== FINAL RESULTS ===
Dataset: sent140, Nodes: 20, Graph: erdos, Aggregation: sketchguard
Attack: backdoor, 30.0% compromised
Final accuracy - Compromised: 0.5076, Honest: 0.6711
Overall test accuracy: mean=0.6220 ± 0.0752

=== BACKDOOR ATTACK SUCCESS RATE (ASR) ===
Target label: 1
Trigger size: 3x3
Overall ASR: 0.6328 ± 0.2284
Honest nodes ASR: 0.4867 ± 0.0561
Compromised nodes ASR: 0.9735 ± 0.0248
Note: Higher ASR indicates more successful backdoor attack

=== Sketchguard SUMMARY ===
Node 0: acceptance=0.850
Node 1: acceptance=1.000
Node 2: acceptance=0.640
Node 3: acceptance=0.775
Node 4: acceptance=0.550
Node 5: acceptance=0.600
Node 6: acceptance=0.820
Node 7: acceptance=0.640
Node 8: acceptance=0.550
Node 9: acceptance=1.000
Node 10: acceptance=0.775
Node 11: acceptance=0.614
Node 12: acceptance=0.600
Node 13: acceptance=0.600
Node 14: acceptance=0.600
Node 15: acceptance=0.550
Node 16: acceptance=0.460
Node 17: acceptance=0.600
Node 18: acceptance=0.600
Node 19: acceptance=1.000

=== PARALLEL EXECUTION TIME (realistic for distributed system) ===
  COMMUNICATION (max across nodes):
    - Sketch transfer: 0.000s (0.0%)
    - Model fetch (accepted): 0.000s (0.0%)
  COMPUTATION (max across nodes):
    - Sketching: 0.279s (94.3%)
    - Filtering: 0.001s (0.3%)
    - Aggregation: 0.016s (5.5%)
  TOTALS:
    - Total computation: 0.296s (100.0%)
    - Total communication: 0.000s (0.0%)
    - Total parallel time: 0.296s

=== PER-NODE AVERAGE TIME ===
  - Sketching: 0.214s
  - Filtering: 0.000s
  - Aggregation: 0.009s
  - Sketch transfer: 0.000s
  - Model fetch: 0.000s
  - Total per node: 0.223s

=== TOTAL COMPUTATIONAL WORK (sum across all nodes) ===
  - Total sketching: 4.272s
  - Total filtering: 0.008s
  - Total aggregation: 0.173s
  - Total sketch transfer: 0.000s
  - Total model fetch: 0.000s
  - Grand total: 4.453s
  - Mean acceptance rate: 0.691

Sketchguard Algorithm Properties:
  - Original dimension: 1,174,986
  - Sketch size: 180
  - Compression ratio: 19.9x
  - Single repetition: No repetitions needed
  - Theoretical complexity: O(d + N×k)
  - Approach: Sketch filtering + state aggregation
