Device: cuda
Seed: 987654321
Loading 1 LEAF Sent140 train files...
LEAF Sent140 train: 254555 users, 908652 samples
Building vocabulary (max_size=10000)...
Vocabulary size: 10000
Loading 1 LEAF Sent140 test files...
LEAF Sent140 test: 254555 users, 286281 samples
Found 254555 train users, 254555 test users, 254555 common users
User sample counts range: 494 (max) to 1 (min)
Distributed ALL 254555 users across 20 clients
Users per client: 12727 (with 15 clients getting +1 user)
Train partition sizes: [44353, 44290, 44657, 44907, 44696, 45843, 45801, 45619, 45069, 45639, 45821, 45311, 45779, 46056, 45625, 45984, 46428, 44737, 45540, 46497]
Test partition sizes: [14232, 14235, 14266, 14217, 14238, 14373, 14346, 14334, 14294, 14373, 14344, 14302, 14354, 14362, 14320, 14395, 14389, 14257, 14251, 14399]
  Client 0: 44353 train samples, 2 unique classes
  Client 1: 44290 train samples, 2 unique classes
  Client 2: 44657 train samples, 2 unique classes
  Client 3: 44907 train samples, 2 unique classes
  Client 4: 44696 train samples, 2 unique classes
  Client 5: 45843 train samples, 2 unique classes
  Client 6: 45801 train samples, 2 unique classes
  Client 7: 45619 train samples, 2 unique classes
  Client 8: 45069 train samples, 2 unique classes
  Client 9: 45639 train samples, 2 unique classes
  Client 10: 45821 train samples, 2 unique classes
  Client 11: 45311 train samples, 2 unique classes
  Client 12: 45779 train samples, 2 unique classes
  Client 13: 46056 train samples, 2 unique classes
  Client 14: 45625 train samples, 2 unique classes
  Client 15: 45984 train samples, 2 unique classes
  Client 16: 46428 train samples, 2 unique classes
  Client 17: 44737 train samples, 2 unique classes
  Client 18: 45540 train samples, 2 unique classes
  Client 19: 46497 train samples, 2 unique classes
Will sample 4500 samples per client per epoch
Graph: ring, nodes: 20, edges: 20
Degree statistics: avg=2.00, min=2, max=2
Attack: Compromised 14/20 nodes: [1, 2, 3, 5, 6, 8, 11, 12, 13, 14, 15, 17, 18, 19]
Attack type: backdoor, lambda: 1.0
Backdoor target label: 1, trigger size: 3
Model variant: baseline
Model parameters: 1,174,986
BALANCE algorithm:
Balance Config: BALANCEConfig(gamma=2, kappa=1, alpha=0.5, min_neighbors=1)
  - Model dimension: 1,174,986 parameters
  - Complexity: O(N×d) = O(20×1,174,986)
Initial test acc across nodes: mean=0.4953 ± 0.0174
Backdoor attack: Created poisoned datasets for 14 compromised nodes
Round 001: test acc mean=0.5016 ± 0.0103 | min=0.4885 max=0.5276
         : test loss mean=46.2124 ± 40.4703
         : individual accs = ['0.494238', '0.501791', '0.488504', '0.513399', '0.494241', '0.514158', '0.510316', '0.492675', '0.527564', '0.518959', '0.489891', '0.501538', '0.502229', '0.507868', '0.496089', '0.498159', '0.492529', '0.497300', '0.495755', '0.494062']
         : correct/total = [(7034, 14232), (7143, 14235), (6969, 14266), (7299, 14217), (7037, 14238), (7390, 14373), (7321, 14346), (7062, 14334), (7541, 14294), (7459, 14373), (7027, 14344), (7173, 14302), (7209, 14354), (7294, 14362), (7104, 14320), (7171, 14395), (7087, 14389), (7090, 14257), (7065, 14251), (7114, 14399)]
         : compromised: 0.5035, honest: 0.4971
Round 002: test acc mean=0.5043 ± 0.0061 | min=0.4932 max=0.5176
         : test loss mean=1166.8181 ± 844.2305
         : individual accs = ['0.507378', '0.517597', '0.513038', '0.514314', '0.505478', '0.505044', '0.500209', '0.507255', '0.501679', '0.494747', '0.497699', '0.504894', '0.497422', '0.493176', '0.507332', '0.500521', '0.507957', '0.504735', '0.503824', '0.501424']
         : correct/total = [(7221, 14232), (7368, 14235), (7319, 14266), (7312, 14217), (7197, 14238), (7259, 14373), (7176, 14346), (7271, 14334), (7171, 14294), (7111, 14373), (7139, 14344), (7221, 14302), (7140, 14354), (7083, 14362), (7265, 14320), (7205, 14395), (7309, 14389), (7196, 14257), (7180, 14251), (7220, 14399)]
         : compromised: 0.5047, honest: 0.5034
Round 003: test acc mean=0.4963 ± 0.0065 | min=0.4833 max=0.5070
         : test loss mean=145438.4513 ± 190960.6242
         : individual accs = ['0.492060', '0.483316', '0.487102', '0.483295', '0.494732', '0.496278', '0.499930', '0.492814', '0.498531', '0.504766', '0.501603', '0.494127', '0.502856', '0.506963', '0.492598', '0.498923', '0.495239', '0.496458', '0.505649', '0.498021']
         : correct/total = [(7003, 14232), (6880, 14235), (6949, 14266), (6871, 14217), (7044, 14238), (7133, 14373), (7172, 14346), (7064, 14334), (7126, 14294), (7255, 14373), (7195, 14344), (7067, 14302), (7218, 14354), (7281, 14362), (7054, 14320), (7182, 14395), (7126, 14389), (7078, 14257), (7206, 14251), (7171, 14399)]
         : compromised: 0.4960, honest: 0.4969
Round 004: test acc mean=0.5006 ± 0.0059 | min=0.4923 max=0.5130
         : test loss mean=12918620.9839 ± 10160800.1967
         : individual accs = ['0.492693', '0.499965', '0.513038', '0.510586', '0.494592', '0.504140', '0.500976', '0.492326', '0.501959', '0.495930', '0.499233', '0.506782', '0.497144', '0.493176', '0.507332', '0.498437', '0.493015', '0.504103', '0.504386', '0.501979']
         : correct/total = [(7012, 14232), (7117, 14235), (7319, 14266), (7259, 14217), (7042, 14238), (7246, 14373), (7187, 14346), (7057, 14334), (7175, 14294), (7128, 14373), (7161, 14344), (7248, 14302), (7136, 14354), (7083, 14362), (7265, 14320), (7175, 14395), (7094, 14389), (7187, 14257), (7188, 14251), (7228, 14399)]
         : compromised: 0.5031, honest: 0.4946
Round 005: test acc mean=0.4953 ± 0.0061 | min=0.4830 max=0.5068
         : test loss mean=1155709938.9416 ± 1126780772.5753
         : individual accs = ['0.491147', '0.483035', '0.486962', '0.484912', '0.493047', '0.495791', '0.499861', '0.493721', '0.498181', '0.504905', '0.501255', '0.493847', '0.502856', '0.506824', '0.492598', '0.497742', '0.489888', '0.495336', '0.495614', '0.498090']
         : correct/total = [(6990, 14232), (6876, 14235), (6947, 14266), (6894, 14217), (7020, 14238), (7126, 14373), (7171, 14346), (7077, 14334), (7121, 14294), (7257, 14373), (7190, 14344), (7063, 14302), (7218, 14354), (7279, 14362), (7054, 14320), (7165, 14395), (7049, 14389), (7062, 14257), (7063, 14251), (7172, 14399)]
         : compromised: 0.4951, honest: 0.4957
Round 006: test acc mean=0.5024 ± 0.0067 | min=0.4923 max=0.5170
         : test loss mean=105027731046.8126 ± 80656093118.7737
         : individual accs = ['0.498876', '0.516965', '0.513038', '0.515088', '0.492274', '0.504140', '0.500209', '0.495884', '0.501819', '0.495234', '0.498397', '0.506153', '0.497144', '0.493176', '0.507402', '0.502258', '0.498158', '0.504664', '0.504386', '0.501910']
         : correct/total = [(7100, 14232), (7359, 14235), (7319, 14266), (7323, 14217), (7009, 14238), (7246, 14373), (7176, 14346), (7108, 14334), (7173, 14294), (7118, 14373), (7149, 14344), (7239, 14302), (7136, 14354), (7083, 14362), (7266, 14320), (7230, 14395), (7168, 14389), (7195, 14257), (7188, 14251), (7227, 14399)]
         : compromised: 0.5049, honest: 0.4965
Round 007: test acc mean=0.4959 ± 0.0067 | min=0.4830 max=0.5079
         : test loss mean=7121710294020.0967 ± 5041220431613.5635
         : individual accs = ['0.491358', '0.483035', '0.486962', '0.484912', '0.494381', '0.495860', '0.499791', '0.492954', '0.498181', '0.507201', '0.507948', '0.493847', '0.502856', '0.506824', '0.492598', '0.497742', '0.493154', '0.495336', '0.495614', '0.498090']
         : correct/total = [(6993, 14232), (6876, 14235), (6947, 14266), (6894, 14217), (7039, 14238), (7127, 14373), (7170, 14346), (7066, 14334), (7121, 14294), (7290, 14373), (7286, 14344), (7063, 14302), (7218, 14354), (7279, 14362), (7054, 14320), (7165, 14395), (7096, 14389), (7062, 14257), (7063, 14251), (7172, 14399)]
         : compromised: 0.4951, honest: 0.4978
Round 008: test acc mean=0.5034 ± 0.0060 | min=0.4932 max=0.5170
         : test loss mean=710149545402576.2500 ± 472558978781536.8750
         : individual accs = ['0.502670', '0.516965', '0.513038', '0.515088', '0.502318', '0.504140', '0.500209', '0.499791', '0.501819', '0.495234', '0.498397', '0.506153', '0.497144', '0.493176', '0.507402', '0.502258', '0.501147', '0.504664', '0.504386', '0.501910']
         : correct/total = [(7154, 14232), (7359, 14235), (7319, 14266), (7323, 14217), (7152, 14238), (7246, 14373), (7176, 14346), (7164, 14334), (7173, 14294), (7118, 14373), (7149, 14344), (7239, 14302), (7136, 14354), (7083, 14362), (7266, 14320), (7230, 14395), (7211, 14389), (7195, 14257), (7188, 14251), (7227, 14399)]
         : compromised: 0.5049, honest: 0.4999
Round 009: test acc mean=0.4955 ± 0.0060 | min=0.4830 max=0.5068
         : test loss mean=56461425216905976.0000 ± 36411877704640072.0000
         : individual accs = ['0.491428', '0.483035', '0.486962', '0.484912', '0.494171', '0.495860', '0.499791', '0.492465', '0.498181', '0.504627', '0.501882', '0.493847', '0.502856', '0.506824', '0.492737', '0.497742', '0.492877', '0.495336', '0.495614', '0.498090']
         : correct/total = [(6994, 14232), (6876, 14235), (6947, 14266), (6894, 14217), (7036, 14238), (7127, 14373), (7170, 14346), (7059, 14334), (7121, 14294), (7253, 14373), (7199, 14344), (7063, 14302), (7218, 14354), (7279, 14362), (7056, 14320), (7165, 14395), (7092, 14389), (7062, 14257), (7063, 14251), (7172, 14399)]
         : compromised: 0.4951, honest: 0.4962
Round 010: test acc mean=0.5038 ± 0.0058 | min=0.4933 max=0.5170
         : test loss mean=5820712395711641600.0000 ± 4022637675056075264.0000
         : individual accs = ['0.502740', '0.516965', '0.513038', '0.515088', '0.506321', '0.504140', '0.500209', '0.500907', '0.501819', '0.497321', '0.499861', '0.506153', '0.497213', '0.493316', '0.507263', '0.502258', '0.499340', '0.504664', '0.504526', '0.501910']
         : correct/total = [(7155, 14232), (7359, 14235), (7319, 14266), (7323, 14217), (7209, 14238), (7246, 14373), (7176, 14346), (7180, 14334), (7173, 14294), (7148, 14373), (7170, 14344), (7239, 14302), (7137, 14354), (7085, 14362), (7264, 14320), (7230, 14395), (7185, 14389), (7195, 14257), (7190, 14251), (7227, 14399)]
         : compromised: 0.5049, honest: 0.5011

=== FINAL RESULTS ===
Dataset: sent140, Nodes: 20, Graph: ring, Aggregation: balance
Attack: backdoor, 70.0% compromised
Final accuracy - Compromised: 0.5049, Honest: 0.5011
Overall test accuracy: mean=0.5038 ± 0.0058

=== BACKDOOR ATTACK SUCCESS RATE (ASR) ===
Target label: 1
Trigger size: 3x3
Overall ASR: 0.1808 ± 0.3159
Honest nodes ASR: 0.6025 ± 0.2803
Compromised nodes ASR: 0.0000 ± 0.0000
Note: Higher ASR indicates more successful backdoor attack

=== BALANCE SUMMARY ===
Node 0: acceptance=0.000
Node 1: acceptance=0.600
Node 2: acceptance=0.300
Node 3: acceptance=0.600
Node 4: acceptance=0.000
Node 5: acceptance=0.600
Node 6: acceptance=0.600
Node 7: acceptance=0.000
Node 8: acceptance=0.600
Node 9: acceptance=0.900
Node 10: acceptance=0.900
Node 11: acceptance=0.600
Node 12: acceptance=0.300
Node 13: acceptance=0.300
Node 14: acceptance=0.300
Node 15: acceptance=0.600
Node 16: acceptance=0.000
Node 17: acceptance=0.600
Node 18: acceptance=0.300
Node 19: acceptance=0.600

=== PARALLEL EXECUTION TIME (realistic for distributed system) ===
  COMMUNICATION (max across nodes):
    - Full model transfer: 0.000s (0.0%)
  COMPUTATION (max across nodes):
    - Filtering: 0.012s (53.9%)
    - Aggregation: 0.010s (46.0%)
  TOTALS:
    - Total computation: 0.023s (100.0%)
    - Total communication: 0.000s (0.0%)
    - Total parallel time: 0.023s

=== PER-NODE AVERAGE TIME ===
  - Filtering: 0.011s
  - Aggregation: 0.005s
  - Model transfer: 0.000s
  - Total per node: 0.016s

=== TOTAL COMPUTATIONAL WORK (sum across all nodes) ===
  - Total filtering: 0.221s
  - Total aggregation: 0.100s
  - Total model transfer: 0.000s
  - Grand total: 0.321s
  - Mean acceptance rate: 0.435

BALANCE Algorithm Properties:
  - Model dimension: 1,174,986
  - No compression: Full parameter comparison
  - Theoretical complexity: O(deg(i)×d)
  - Approach: Full parameter filtering + averaging
