Device: cuda
Seed: 987654321
Loading 1 LEAF Sent140 train files...
LEAF Sent140 train: 254555 users, 908652 samples
Building vocabulary (max_size=10000)...
Vocabulary size: 10000
Loading 1 LEAF Sent140 test files...
LEAF Sent140 test: 254555 users, 286281 samples
Found 254555 train users, 254555 test users, 254555 common users
User sample counts range: 494 (max) to 1 (min)
Distributed ALL 254555 users across 20 clients
Users per client: 12727 (with 15 clients getting +1 user)
Train partition sizes: [44353, 44290, 44657, 44907, 44696, 45843, 45801, 45619, 45069, 45639, 45821, 45311, 45779, 46056, 45625, 45984, 46428, 44737, 45540, 46497]
Test partition sizes: [14232, 14235, 14266, 14217, 14238, 14373, 14346, 14334, 14294, 14373, 14344, 14302, 14354, 14362, 14320, 14395, 14389, 14257, 14251, 14399]
  Client 0: 44353 train samples, 2 unique classes
  Client 1: 44290 train samples, 2 unique classes
  Client 2: 44657 train samples, 2 unique classes
  Client 3: 44907 train samples, 2 unique classes
  Client 4: 44696 train samples, 2 unique classes
  Client 5: 45843 train samples, 2 unique classes
  Client 6: 45801 train samples, 2 unique classes
  Client 7: 45619 train samples, 2 unique classes
  Client 8: 45069 train samples, 2 unique classes
  Client 9: 45639 train samples, 2 unique classes
  Client 10: 45821 train samples, 2 unique classes
  Client 11: 45311 train samples, 2 unique classes
  Client 12: 45779 train samples, 2 unique classes
  Client 13: 46056 train samples, 2 unique classes
  Client 14: 45625 train samples, 2 unique classes
  Client 15: 45984 train samples, 2 unique classes
  Client 16: 46428 train samples, 2 unique classes
  Client 17: 44737 train samples, 2 unique classes
  Client 18: 45540 train samples, 2 unique classes
  Client 19: 46497 train samples, 2 unique classes
Will sample 4500 samples per client per epoch
Graph: ring, nodes: 20, edges: 20
Degree statistics: avg=2.00, min=2, max=2
Attack: Compromised 4/20 nodes: [5, 12, 13, 17]
Attack type: backdoor, lambda: 1.0
Backdoor target label: 1, trigger size: 3
Model variant: baseline
Model parameters: 1,174,986
Initial test acc across nodes: mean=0.4953 ± 0.0174
Backdoor attack: Created poisoned datasets for 4 compromised nodes
Round 001: test acc mean=0.5100 ± 0.0174 | min=0.4882 max=0.5652
         : test loss mean=2.5642 ± 3.0076
         : individual accs = ['0.534992', '0.565227', '0.488224', '0.512415', '0.510395', '0.505183', '0.506483', '0.524766', '0.502169', '0.533779', '0.502022', '0.508880', '0.504180', '0.497215', '0.495321', '0.507815', '0.493363', '0.496668', '0.500246', '0.510035']
         : correct/total = [(7614, 14232), (8046, 14235), (6965, 14266), (7285, 14217), (7267, 14238), (7261, 14373), (7266, 14346), (7522, 14334), (7178, 14294), (7672, 14373), (7201, 14344), (7278, 14302), (7237, 14354), (7141, 14362), (7093, 14320), (7310, 14395), (7099, 14389), (7081, 14257), (7129, 14251), (7344, 14399)]
         : compromised: 0.5008, honest: 0.5123
Round 002: test acc mean=0.5251 ± 0.0527 | min=0.4703 max=0.6388
         : test loss mean=2.1844 ± 2.2470
         : individual accs = ['0.626616', '0.638848', '0.626104', '0.498769', '0.511659', '0.503027', '0.492193', '0.507255', '0.511613', '0.622904', '0.470301', '0.499091', '0.494984', '0.498259', '0.486173', '0.505245', '0.498992', '0.492249', '0.501930', '0.515661']
         : correct/total = [(8918, 14232), (9094, 14235), (8932, 14266), (7091, 14217), (7285, 14238), (7230, 14373), (7061, 14346), (7271, 14334), (7313, 14294), (8953, 14373), (6746, 14344), (7138, 14302), (7105, 14354), (7156, 14362), (6962, 14320), (7273, 14395), (7180, 14389), (7018, 14257), (7153, 14251), (7425, 14399)]
         : compromised: 0.4971, honest: 0.5321
Round 003: test acc mean=0.5156 ± 0.0307 | min=0.4897 max=0.6242
         : test loss mean=1.1802 ± 0.7955
         : individual accs = ['0.574691', '0.624236', '0.514300', '0.515017', '0.505900', '0.502192', '0.496584', '0.509697', '0.538688', '0.495304', '0.509412', '0.489652', '0.500418', '0.500766', '0.517249', '0.506287', '0.506151', '0.504594', '0.503894', '0.496562']
         : correct/total = [(8179, 14232), (8886, 14235), (7337, 14266), (7322, 14217), (7203, 14238), (7218, 14373), (7124, 14346), (7306, 14334), (7700, 14294), (7119, 14373), (7307, 14344), (7003, 14302), (7183, 14354), (7192, 14362), (7407, 14320), (7288, 14395), (7283, 14389), (7194, 14257), (7181, 14251), (7150, 14399)]
         : compromised: 0.5020, honest: 0.5190
Round 004: test acc mean=0.5231 ± 0.0416 | min=0.4871 max=0.6361
         : test loss mean=1.3479 ± 1.1811
         : individual accs = ['0.583544', '0.636108', '0.583345', '0.487093', '0.494803', '0.496139', '0.501673', '0.507255', '0.579754', '0.568844', '0.498397', '0.490351', '0.499930', '0.505640', '0.498673', '0.503647', '0.497811', '0.496177', '0.496386', '0.535940']
         : correct/total = [(8305, 14232), (9055, 14235), (8322, 14266), (6925, 14217), (7045, 14238), (7131, 14373), (7197, 14346), (7271, 14334), (8287, 14294), (8176, 14373), (7149, 14344), (7013, 14302), (7176, 14354), (7262, 14362), (7141, 14320), (7250, 14395), (7163, 14389), (7074, 14257), (7074, 14251), (7717, 14399)]
         : compromised: 0.4995, honest: 0.5290
Round 005: test acc mean=0.5372 ± 0.0460 | min=0.4936 max=0.6334
         : test loss mean=0.9443 ± 0.5891
         : individual accs = ['0.591343', '0.633439', '0.618463', '0.518182', '0.506532', '0.502052', '0.501743', '0.518208', '0.597314', '0.622278', '0.526422', '0.502307', '0.493591', '0.493942', '0.527025', '0.495867', '0.538189', '0.508101', '0.510771', '0.538857']
         : correct/total = [(8416, 14232), (9017, 14235), (8823, 14266), (7367, 14217), (7212, 14238), (7216, 14373), (7198, 14346), (7428, 14334), (8538, 14294), (8944, 14373), (7551, 14344), (7184, 14302), (7085, 14354), (7094, 14362), (7547, 14320), (7138, 14395), (7744, 14389), (7244, 14257), (7279, 14251), (7759, 14399)]
         : compromised: 0.4994, honest: 0.5467
Round 006: test acc mean=0.5419 ± 0.0521 | min=0.4950 max=0.6322
         : test loss mean=0.9856 ± 0.6510
         : individual accs = ['0.594857', '0.632174', '0.631922', '0.561441', '0.497401', '0.501635', '0.506901', '0.613088', '0.627536', '0.592082', '0.562465', '0.495036', '0.500070', '0.508216', '0.497975', '0.504133', '0.503649', '0.497159', '0.508245', '0.501910']
         : correct/total = [(8466, 14232), (8999, 14235), (9015, 14266), (7982, 14217), (7082, 14238), (7210, 14373), (7272, 14346), (8788, 14334), (8970, 14294), (8510, 14373), (8068, 14344), (7080, 14302), (7178, 14354), (7299, 14362), (7131, 14320), (7257, 14395), (7247, 14389), (7088, 14257), (7243, 14251), (7227, 14399)]
         : compromised: 0.5018, honest: 0.5519
Round 007: test acc mean=0.5587 ± 0.0524 | min=0.4958 max=0.6406
         : test loss mean=0.8450 ± 0.4460
         : individual accs = ['0.628021', '0.635054', '0.626595', '0.571147', '0.513204', '0.504140', '0.513174', '0.605344', '0.630264', '0.640646', '0.594953', '0.521885', '0.495750', '0.497285', '0.523324', '0.544425', '0.531726', '0.505646', '0.510350', '0.582054']
         : correct/total = [(8938, 14232), (9040, 14235), (8939, 14266), (8120, 14217), (7307, 14238), (7246, 14373), (7362, 14346), (8677, 14334), (9009, 14294), (9208, 14373), (8534, 14344), (7464, 14302), (7116, 14354), (7142, 14362), (7494, 14320), (7837, 14395), (7651, 14389), (7209, 14257), (7273, 14251), (8381, 14399)]
         : compromised: 0.5007, honest: 0.5733
Round 008: test acc mean=0.5508 ± 0.0585 | min=0.4950 max=0.6491
         : test loss mean=0.9638 ± 0.6658
         : individual accs = ['0.641442', '0.649104', '0.637460', '0.621580', '0.500070', '0.520559', '0.503206', '0.551486', '0.634462', '0.631183', '0.554727', '0.494966', '0.501742', '0.504456', '0.503422', '0.551858', '0.505525', '0.495546', '0.504737', '0.509202']
         : correct/total = [(9129, 14232), (9240, 14235), (9094, 14266), (8837, 14217), (7120, 14238), (7482, 14373), (7219, 14346), (7905, 14334), (9069, 14294), (9072, 14373), (7957, 14344), (7079, 14302), (7202, 14354), (7245, 14362), (7209, 14320), (7944, 14395), (7274, 14389), (7065, 14257), (7193, 14251), (7332, 14399)]
         : compromised: 0.5056, honest: 0.5622
Round 009: test acc mean=0.5776 ± 0.0526 | min=0.4933 max=0.6565
         : test loss mean=0.8060 ± 0.4152
         : individual accs = ['0.649101', '0.656481', '0.653021', '0.618766', '0.537927', '0.539484', '0.545936', '0.591600', '0.645306', '0.647047', '0.562535', '0.537547', '0.493312', '0.503203', '0.555098', '0.575964', '0.572660', '0.513362', '0.533647', '0.620668']
         : correct/total = [(9238, 14232), (9345, 14235), (9316, 14266), (8797, 14217), (7659, 14238), (7754, 14373), (7832, 14346), (8480, 14334), (9224, 14294), (9300, 14373), (8069, 14344), (7688, 14302), (7081, 14354), (7227, 14362), (7949, 14320), (8291, 14395), (8240, 14389), (7319, 14257), (7605, 14251), (8937, 14399)]
         : compromised: 0.5123, honest: 0.5940
Round 010: test acc mean=0.5679 ± 0.0641 | min=0.4964 max=0.6620
         : test loss mean=0.8783 ± 0.4889
         : individual accs = ['0.648328', '0.662030', '0.643138', '0.638250', '0.496418', '0.537049', '0.500418', '0.635412', '0.647964', '0.646907', '0.620678', '0.497623', '0.501672', '0.501950', '0.531006', '0.573671', '0.529363', '0.507680', '0.500246', '0.537607']
         : correct/total = [(9227, 14232), (9424, 14235), (9175, 14266), (9074, 14217), (7068, 14238), (7719, 14373), (7179, 14346), (9108, 14334), (9262, 14294), (9298, 14373), (8903, 14344), (7117, 14302), (7201, 14354), (7209, 14362), (7604, 14320), (8258, 14395), (7617, 14389), (7238, 14257), (7129, 14251), (7741, 14399)]
         : compromised: 0.5121, honest: 0.5818

=== FINAL RESULTS ===
Dataset: sent140, Nodes: 20, Graph: ring, Aggregation: d-fedavg
Attack: backdoor, 20.0% compromised
Final accuracy - Compromised: 0.5121, Honest: 0.5818
Overall test accuracy: mean=0.5679 ± 0.0641

=== BACKDOOR ATTACK SUCCESS RATE (ASR) ===
Target label: 1
Trigger size: 3x3
Overall ASR: 0.6485 ± 0.2174
Honest nodes ASR: 0.6444 ± 0.2293
Compromised nodes ASR: 0.6650 ± 0.1597
Note: Higher ASR indicates more successful backdoor attack
