Device: cuda
Seed: 987654321
Loading 1 LEAF Sent140 train files...
LEAF Sent140 train: 254555 users, 908652 samples
Building vocabulary (max_size=10000)...
Vocabulary size: 10000
Loading 1 LEAF Sent140 test files...
LEAF Sent140 test: 254555 users, 286281 samples
Found 254555 train users, 254555 test users, 254555 common users
User sample counts range: 494 (max) to 1 (min)
Distributed ALL 254555 users across 20 clients
Users per client: 12727 (with 15 clients getting +1 user)
Train partition sizes: [44353, 44290, 44657, 44907, 44696, 45843, 45801, 45619, 45069, 45639, 45821, 45311, 45779, 46056, 45625, 45984, 46428, 44737, 45540, 46497]
Test partition sizes: [14232, 14235, 14266, 14217, 14238, 14373, 14346, 14334, 14294, 14373, 14344, 14302, 14354, 14362, 14320, 14395, 14389, 14257, 14251, 14399]
  Client 0: 44353 train samples, 2 unique classes
  Client 1: 44290 train samples, 2 unique classes
  Client 2: 44657 train samples, 2 unique classes
  Client 3: 44907 train samples, 2 unique classes
  Client 4: 44696 train samples, 2 unique classes
  Client 5: 45843 train samples, 2 unique classes
  Client 6: 45801 train samples, 2 unique classes
  Client 7: 45619 train samples, 2 unique classes
  Client 8: 45069 train samples, 2 unique classes
  Client 9: 45639 train samples, 2 unique classes
  Client 10: 45821 train samples, 2 unique classes
  Client 11: 45311 train samples, 2 unique classes
  Client 12: 45779 train samples, 2 unique classes
  Client 13: 46056 train samples, 2 unique classes
  Client 14: 45625 train samples, 2 unique classes
  Client 15: 45984 train samples, 2 unique classes
  Client 16: 46428 train samples, 2 unique classes
  Client 17: 44737 train samples, 2 unique classes
  Client 18: 45540 train samples, 2 unique classes
  Client 19: 46497 train samples, 2 unique classes
Will sample 4500 samples per client per epoch
Graph: erdos, nodes: 20, edges: 99
Degree statistics: avg=9.90, min=7, max=14
Attack: Compromised 14/20 nodes: [1, 2, 3, 5, 6, 8, 11, 12, 13, 14, 15, 17, 18, 19]
Attack type: backdoor, lambda: 1.0
Backdoor target label: 1, trigger size: 3
Model variant: baseline
Model parameters: 1,174,986
Initial test acc across nodes: mean=0.4953 ± 0.0174
Backdoor attack: Created poisoned datasets for 14 compromised nodes
Round 001: test acc mean=0.5006 ± 0.0066 | min=0.4870 max=0.5117
         : test loss mean=12.6695 ± 6.0869
         : individual accs = ['0.511664', '0.486969', '0.487733', '0.500739', '0.503161', '0.510958', '0.500209', '0.496582', '0.496992', '0.505879', '0.502579', '0.508950', '0.502090', '0.495962', '0.498324', '0.504064', '0.509000', '0.494845', '0.497719', '0.497604']
         : correct/total = [(7282, 14232), (6932, 14235), (6958, 14266), (7119, 14217), (7164, 14238), (7344, 14373), (7176, 14346), (7118, 14334), (7104, 14294), (7271, 14373), (7209, 14344), (7279, 14302), (7207, 14354), (7123, 14362), (7136, 14320), (7256, 14395), (7324, 14389), (7055, 14257), (7093, 14251), (7165, 14399)]
         : compromised: 0.4988, honest: 0.5048
Round 002: test acc mean=0.5048 ± 0.0056 | min=0.4923 max=0.5164
         : test loss mean=34.8191 ± 10.6889
         : individual accs = ['0.507237', '0.513945', '0.512267', '0.516354', '0.505268', '0.503722', '0.499651', '0.507883', '0.500490', '0.506227', '0.501394', '0.505873', '0.496935', '0.492341', '0.509148', '0.501355', '0.507123', '0.503472', '0.504105', '0.500660']
         : correct/total = [(7219, 14232), (7316, 14235), (7308, 14266), (7341, 14217), (7194, 14238), (7240, 14373), (7168, 14346), (7280, 14334), (7154, 14294), (7276, 14373), (7192, 14344), (7235, 14302), (7133, 14354), (7071, 14362), (7291, 14320), (7217, 14395), (7297, 14389), (7178, 14257), (7184, 14251), (7209, 14399)]
         : compromised: 0.5043, honest: 0.5059
Round 003: test acc mean=0.5051 ± 0.0055 | min=0.4932 max=0.5170
         : test loss mean=24.4891 ± 6.4129
         : individual accs = ['0.507378', '0.516965', '0.513038', '0.515088', '0.505408', '0.504140', '0.500209', '0.507255', '0.501819', '0.504696', '0.501603', '0.506153', '0.497144', '0.493176', '0.507402', '0.502258', '0.507471', '0.504664', '0.504386', '0.501910']
         : correct/total = [(7221, 14232), (7359, 14235), (7319, 14266), (7323, 14217), (7196, 14238), (7246, 14373), (7176, 14346), (7271, 14334), (7173, 14294), (7254, 14373), (7195, 14344), (7239, 14302), (7136, 14354), (7083, 14362), (7266, 14320), (7230, 14395), (7302, 14389), (7195, 14257), (7188, 14251), (7227, 14399)]
         : compromised: 0.5049, honest: 0.5056
Round 004: test acc mean=0.4949 ± 0.0055 | min=0.4830 max=0.5068
         : test loss mean=41.9868 ± 14.2909
         : individual accs = ['0.492622', '0.483035', '0.486962', '0.484912', '0.494522', '0.495860', '0.499791', '0.492745', '0.498181', '0.495234', '0.498397', '0.493847', '0.502856', '0.506824', '0.492598', '0.497742', '0.492529', '0.495336', '0.495614', '0.498090']
         : correct/total = [(7011, 14232), (6876, 14235), (6947, 14266), (6894, 14217), (7041, 14238), (7127, 14373), (7170, 14346), (7063, 14334), (7121, 14294), (7118, 14373), (7149, 14344), (7063, 14302), (7218, 14354), (7279, 14362), (7054, 14320), (7165, 14395), (7087, 14389), (7062, 14257), (7063, 14251), (7172, 14399)]
         : compromised: 0.4951, honest: 0.4943
Round 005: test acc mean=0.4952 ± 0.0057 | min=0.4830 max=0.5066
         : test loss mean=9.0023 ± 1.8512
         : individual accs = ['0.492482', '0.483035', '0.486752', '0.484912', '0.494522', '0.497043', '0.501673', '0.492884', '0.498601', '0.495165', '0.498536', '0.495385', '0.503205', '0.506615', '0.492039', '0.496978', '0.492807', '0.495336', '0.495685', '0.500451']
         : correct/total = [(7009, 14232), (6876, 14235), (6944, 14266), (6894, 14217), (7041, 14238), (7144, 14373), (7197, 14346), (7065, 14334), (7127, 14294), (7117, 14373), (7151, 14344), (7085, 14302), (7223, 14354), (7276, 14362), (7046, 14320), (7154, 14395), (7091, 14389), (7062, 14257), (7064, 14251), (7206, 14399)]
         : compromised: 0.4956, honest: 0.4944
Round 006: test acc mean=0.5026 ± 0.0057 | min=0.4899 max=0.5131
         : test loss mean=16.5509 ± 13.2506
         : individual accs = ['0.506324', '0.512750', '0.513108', '0.500035', '0.503020', '0.504001', '0.500209', '0.506139', '0.501889', '0.489946', '0.506135', '0.506153', '0.496029', '0.493176', '0.506075', '0.502327', '0.503440', '0.495195', '0.504877', '0.501910']
         : correct/total = [(7206, 14232), (7299, 14235), (7320, 14266), (7109, 14217), (7162, 14238), (7244, 14373), (7176, 14346), (7255, 14334), (7174, 14294), (7042, 14373), (7260, 14344), (7239, 14302), (7120, 14354), (7083, 14362), (7247, 14320), (7231, 14395), (7244, 14389), (7060, 14257), (7195, 14251), (7227, 14399)]
         : compromised: 0.5027, honest: 0.5025
Round 007: test acc mean=0.5045 ± 0.0055 | min=0.4909 max=0.5147
         : test loss mean=3.9492 ± 1.3443
         : individual accs = ['0.507589', '0.514366', '0.512688', '0.514666', '0.502528', '0.505392', '0.500209', '0.509209', '0.501259', '0.503931', '0.499373', '0.505314', '0.499303', '0.490948', '0.505866', '0.499757', '0.506012', '0.504664', '0.504807', '0.502604']
         : correct/total = [(7224, 14232), (7322, 14235), (7314, 14266), (7317, 14217), (7155, 14238), (7264, 14373), (7176, 14346), (7299, 14334), (7165, 14294), (7243, 14373), (7163, 14344), (7227, 14302), (7167, 14354), (7051, 14362), (7244, 14320), (7194, 14395), (7281, 14389), (7195, 14257), (7194, 14251), (7237, 14399)]
         : compromised: 0.5044, honest: 0.5048
Round 008: test acc mean=0.4975 ± 0.0071 | min=0.4813 max=0.5111
         : test loss mean=9.6342 ± 8.4484
         : individual accs = ['0.507518', '0.501581', '0.494532', '0.511149', '0.500140', '0.495721', '0.499791', '0.496791', '0.498181', '0.502539', '0.496096', '0.493847', '0.495332', '0.504595', '0.487570', '0.485377', '0.481340', '0.505506', '0.495334', '0.498021']
         : correct/total = [(7223, 14232), (7140, 14235), (7055, 14266), (7267, 14217), (7121, 14238), (7125, 14373), (7170, 14346), (7121, 14334), (7121, 14294), (7223, 14373), (7116, 14344), (7063, 14302), (7110, 14354), (7247, 14362), (6982, 14320), (6987, 14395), (6926, 14389), (7207, 14257), (7059, 14251), (7171, 14399)]
         : compromised: 0.4976, honest: 0.4974
Round 009: test acc mean=0.4974 ± 0.0050 | min=0.4895 max=0.5080
         : test loss mean=1.1349 ± 0.4630
         : individual accs = ['0.489460', '0.491956', '0.498107', '0.490328', '0.495997', '0.497113', '0.493169', '0.494837', '0.500070', '0.497739', '0.495887', '0.499161', '0.502856', '0.498607', '0.504399', '0.507954', '0.492390', '0.496879', '0.506771', '0.494826']
         : correct/total = [(6966, 14232), (7003, 14235), (7106, 14266), (6971, 14217), (7062, 14238), (7145, 14373), (7075, 14346), (7093, 14334), (7148, 14294), (7154, 14373), (7113, 14344), (7139, 14302), (7218, 14354), (7161, 14362), (7223, 14320), (7312, 14395), (7085, 14389), (7084, 14257), (7222, 14251), (7125, 14399)]
         : compromised: 0.4987, honest: 0.4944
Round 010: test acc mean=0.5030 ± 0.0050 | min=0.4932 max=0.5159
         : test loss mean=8.1639 ± 7.7219
         : individual accs = ['0.505691', '0.500386', '0.510515', '0.500598', '0.503371', '0.504209', '0.500418', '0.501256', '0.501819', '0.504279', '0.505438', '0.505454', '0.496517', '0.493176', '0.507332', '0.501702', '0.515950', '0.495265', '0.504456', '0.502465']
         : correct/total = [(7197, 14232), (7123, 14235), (7283, 14266), (7117, 14217), (7167, 14238), (7247, 14373), (7179, 14346), (7185, 14334), (7173, 14294), (7248, 14373), (7250, 14344), (7229, 14302), (7127, 14354), (7083, 14362), (7265, 14320), (7222, 14395), (7424, 14389), (7061, 14257), (7189, 14251), (7235, 14399)]
         : compromised: 0.5017, honest: 0.5060

=== FINAL RESULTS ===
Dataset: sent140, Nodes: 20, Graph: erdos, Aggregation: d-fedavg
Attack: backdoor, 70.0% compromised
Final accuracy - Compromised: 0.5017, Honest: 0.5060
Overall test accuracy: mean=0.5030 ± 0.0050

=== BACKDOOR ATTACK SUCCESS RATE (ASR) ===
Target label: 1
Trigger size: 3x3
Overall ASR: 0.1914 ± 0.2790
Honest nodes ASR: 0.3300 ± 0.2196
Compromised nodes ASR: 0.1320 ± 0.2806
Note: Higher ASR indicates more successful backdoor attack
