Device: cuda
Seed: 987654321
Loading 1 LEAF Sent140 train files...
LEAF Sent140 train: 254555 users, 908652 samples
Building vocabulary (max_size=10000)...
Vocabulary size: 10000
Loading 1 LEAF Sent140 test files...
LEAF Sent140 test: 254555 users, 286281 samples
Found 254555 train users, 254555 test users, 254555 common users
User sample counts range: 494 (max) to 1 (min)
Distributed ALL 254555 users across 20 clients
Users per client: 12727 (with 15 clients getting +1 user)
Train partition sizes: [44353, 44290, 44657, 44907, 44696, 45843, 45801, 45619, 45069, 45639, 45821, 45311, 45779, 46056, 45625, 45984, 46428, 44737, 45540, 46497]
Test partition sizes: [14232, 14235, 14266, 14217, 14238, 14373, 14346, 14334, 14294, 14373, 14344, 14302, 14354, 14362, 14320, 14395, 14389, 14257, 14251, 14399]
  Client 0: 44353 train samples, 2 unique classes
  Client 1: 44290 train samples, 2 unique classes
  Client 2: 44657 train samples, 2 unique classes
  Client 3: 44907 train samples, 2 unique classes
  Client 4: 44696 train samples, 2 unique classes
  Client 5: 45843 train samples, 2 unique classes
  Client 6: 45801 train samples, 2 unique classes
  Client 7: 45619 train samples, 2 unique classes
  Client 8: 45069 train samples, 2 unique classes
  Client 9: 45639 train samples, 2 unique classes
  Client 10: 45821 train samples, 2 unique classes
  Client 11: 45311 train samples, 2 unique classes
  Client 12: 45779 train samples, 2 unique classes
  Client 13: 46056 train samples, 2 unique classes
  Client 14: 45625 train samples, 2 unique classes
  Client 15: 45984 train samples, 2 unique classes
  Client 16: 46428 train samples, 2 unique classes
  Client 17: 44737 train samples, 2 unique classes
  Client 18: 45540 train samples, 2 unique classes
  Client 19: 46497 train samples, 2 unique classes
Will sample 4500 samples per client per epoch
Graph: fully, nodes: 20, edges: 190
Degree statistics: avg=19.00, min=19, max=19
Attack: Compromised 14/20 nodes: [1, 2, 3, 5, 6, 8, 11, 12, 13, 14, 15, 17, 18, 19]
Attack type: backdoor, lambda: 1.0
Backdoor target label: 1, trigger size: 3
Model variant: baseline
Model parameters: 1,174,986
BALANCE algorithm:
Balance Config: BALANCEConfig(gamma=2, kappa=1, alpha=0.5, min_neighbors=1)
  - Model dimension: 1,174,986 parameters
  - Complexity: O(N×d) = O(20×1,174,986)
Initial test acc across nodes: mean=0.4953 ± 0.0174
Backdoor attack: Created poisoned datasets for 14 compromised nodes
Round 001: test acc mean=0.5056 ± 0.0074 | min=0.4922 max=0.5179
         : test loss mean=33.5442 ± 24.8091
         : individual accs = ['0.502740', '0.510783', '0.503996', '0.514244', '0.509271', '0.504418', '0.511223', '0.505163', '0.492235', '0.493286', '0.512479', '0.499720', '0.508917', '0.514204', '0.517877', '0.497951', '0.514838', '0.496247', '0.498000', '0.504827']
         : correct/total = [(7155, 14232), (7271, 14235), (7190, 14266), (7311, 14217), (7251, 14238), (7250, 14373), (7334, 14346), (7241, 14334), (7036, 14294), (7090, 14373), (7351, 14344), (7147, 14302), (7305, 14354), (7385, 14362), (7416, 14320), (7168, 14395), (7408, 14389), (7075, 14257), (7097, 14251), (7269, 14399)]
         : compromised: 0.5053, honest: 0.5063
Round 002: test acc mean=0.5055 ± 0.0057 | min=0.4944 max=0.5142
         : test loss mean=529.0156 ± 383.7055
         : individual accs = ['0.507378', '0.512048', '0.514230', '0.513470', '0.505408', '0.500661', '0.500627', '0.498535', '0.502798', '0.514228', '0.510248', '0.502867', '0.496308', '0.494360', '0.508031', '0.502883', '0.507332', '0.503823', '0.504175', '0.509897']
         : correct/total = [(7221, 14232), (7289, 14235), (7336, 14266), (7300, 14217), (7196, 14238), (7196, 14373), (7182, 14346), (7146, 14334), (7187, 14294), (7391, 14373), (7319, 14344), (7192, 14302), (7124, 14354), (7100, 14362), (7275, 14320), (7239, 14395), (7300, 14389), (7183, 14257), (7185, 14251), (7342, 14399)]
         : compromised: 0.5047, honest: 0.5072
Round 003: test acc mean=0.5022 ± 0.0119 | min=0.4854 max=0.5348
         : test loss mean=23899.3401 ± 18659.1574
         : individual accs = ['0.485526', '0.485353', '0.491588', '0.490258', '0.526268', '0.497600', '0.501115', '0.511162', '0.496992', '0.508245', '0.507460', '0.496924', '0.505016', '0.505710', '0.493087', '0.496631', '0.534784', '0.504244', '0.499614', '0.505730']
         : correct/total = [(6910, 14232), (6909, 14235), (7013, 14266), (6970, 14217), (7493, 14238), (7152, 14373), (7189, 14346), (7327, 14334), (7104, 14294), (7305, 14373), (7279, 14344), (7107, 14302), (7249, 14354), (7263, 14362), (7061, 14320), (7149, 14395), (7695, 14389), (7189, 14257), (7120, 14251), (7282, 14399)]
         : compromised: 0.4978, honest: 0.5122
Round 004: test acc mean=0.5234 ± 0.0351 | min=0.4845 max=0.5945
         : test loss mean=4953712.9013 ± 3714348.6095
         : individual accs = ['0.567454', '0.516263', '0.518155', '0.503411', '0.561596', '0.490433', '0.513035', '0.594530', '0.501609', '0.588952', '0.582613', '0.484478', '0.487878', '0.499861', '0.500419', '0.504411', '0.547710', '0.497510', '0.502000', '0.504896']
         : correct/total = [(8076, 14232), (7349, 14235), (7392, 14266), (7157, 14217), (7996, 14238), (7049, 14373), (7360, 14346), (8522, 14334), (7170, 14294), (8465, 14373), (8357, 14344), (6929, 14302), (7003, 14354), (7179, 14362), (7166, 14320), (7261, 14395), (7881, 14389), (7093, 14257), (7154, 14251), (7270, 14399)]
         : compromised: 0.5017, honest: 0.5738
Round 005: test acc mean=0.5355 ± 0.0525 | min=0.4882 max=0.6233
         : test loss mean=85708492.0586 ± 70022507.4394
         : individual accs = ['0.609893', '0.516754', '0.509673', '0.500246', '0.616028', '0.509427', '0.510386', '0.618041', '0.502728', '0.623252', '0.612312', '0.498042', '0.495193', '0.492271', '0.497277', '0.488156', '0.609285', '0.512871', '0.495965', '0.492326']
         : correct/total = [(8680, 14232), (7356, 14235), (7271, 14266), (7112, 14217), (8771, 14238), (7322, 14373), (7322, 14346), (8859, 14334), (7186, 14294), (8958, 14373), (8783, 14344), (7123, 14302), (7108, 14354), (7070, 14362), (7121, 14320), (7027, 14395), (8767, 14389), (7312, 14257), (7068, 14251), (7089, 14399)]
         : compromised: 0.5015, honest: 0.6148
Round 006: test acc mean=0.5405 ± 0.0571 | min=0.4793 max=0.6356
         : test loss mean=11529927344.6920 ± 9849177694.4379
         : individual accs = ['0.616639', '0.513312', '0.509113', '0.515088', '0.633165', '0.503374', '0.495818', '0.631366', '0.500140', '0.635567', '0.632878', '0.509719', '0.512958', '0.495753', '0.502095', '0.479333', '0.609632', '0.508452', '0.503754', '0.502257']
         : correct/total = [(8776, 14232), (7307, 14235), (7263, 14266), (7323, 14217), (9015, 14238), (7235, 14373), (7113, 14346), (9050, 14334), (7149, 14294), (9135, 14373), (9078, 14344), (7290, 14302), (7363, 14354), (7120, 14362), (7190, 14320), (6900, 14395), (8772, 14389), (7249, 14257), (7179, 14251), (7232, 14399)]
         : compromised: 0.5037, honest: 0.6265
Round 007: test acc mean=0.5468 ± 0.0650 | min=0.4910 max=0.6492
         : test loss mean=634345969672.0414 ± 484000427930.5975
         : individual accs = ['0.644182', '0.510783', '0.513879', '0.508194', '0.647493', '0.501426', '0.506761', '0.641133', '0.493214', '0.647742', '0.644730', '0.505034', '0.503414', '0.491018', '0.516201', '0.502119', '0.649246', '0.501087', '0.503263', '0.505730']
         : correct/total = [(9168, 14232), (7271, 14235), (7331, 14266), (7225, 14217), (9219, 14238), (7207, 14373), (7270, 14346), (9190, 14334), (7050, 14294), (9310, 14373), (9248, 14344), (7223, 14302), (7226, 14354), (7052, 14362), (7392, 14320), (7228, 14395), (9342, 14389), (7144, 14257), (7172, 14251), (7282, 14399)]
         : compromised: 0.5044, honest: 0.6458
Round 008: test acc mean=0.5481 ± 0.0683 | min=0.4880 max=0.6570
         : test loss mean=68059991290348.0781 ± 54541004898564.3984
         : individual accs = ['0.650927', '0.516754', '0.510725', '0.515650', '0.640610', '0.497182', '0.488011', '0.656969', '0.495313', '0.656996', '0.651422', '0.503706', '0.492894', '0.504665', '0.513128', '0.502466', '0.653972', '0.506769', '0.503333', '0.499618']
         : correct/total = [(9264, 14232), (7356, 14235), (7286, 14266), (7331, 14217), (9121, 14238), (7146, 14373), (7001, 14346), (9417, 14334), (7080, 14294), (9443, 14373), (9344, 14344), (7204, 14302), (7075, 14354), (7248, 14362), (7348, 14320), (7233, 14395), (9410, 14389), (7225, 14257), (7173, 14251), (7194, 14399)]
         : compromised: 0.5036, honest: 0.6518
Round 009: test acc mean=0.5491 ± 0.0713 | min=0.4870 max=0.6659
         : test loss mean=5300592583158931.0000 ± 4189567820714856.0000
         : individual accs = ['0.650857', '0.519775', '0.509533', '0.503974', '0.662734', '0.505044', '0.500767', '0.652156', '0.494473', '0.654978', '0.658045', '0.508251', '0.500209', '0.511698', '0.487011', '0.504064', '0.665925', '0.502560', '0.490702', '0.499687']
         : correct/total = [(9263, 14232), (7399, 14235), (7269, 14266), (7165, 14217), (9436, 14238), (7259, 14373), (7184, 14346), (9348, 14334), (7068, 14294), (9414, 14373), (9439, 14344), (7269, 14302), (7180, 14354), (7349, 14362), (6974, 14320), (7256, 14395), (9582, 14389), (7165, 14257), (6993, 14251), (7195, 14399)]
         : compromised: 0.5027, honest: 0.6574
Round 010: test acc mean=0.5522 ± 0.0755 | min=0.4938 max=0.6685
         : test loss mean=523803510658181504.0000 ± 402755829809529728.0000
         : individual accs = ['0.667018', '0.502353', '0.503014', '0.493845', '0.667861', '0.502192', '0.500627', '0.665620', '0.512033', '0.666667', '0.668503', '0.505594', '0.508221', '0.504387', '0.499511', '0.503300', '0.668080', '0.494494', '0.510490', '0.500035']
         : correct/total = [(9493, 14232), (7151, 14235), (7176, 14266), (7021, 14217), (9509, 14238), (7218, 14373), (7182, 14346), (9541, 14334), (7319, 14294), (9582, 14373), (9589, 14344), (7231, 14302), (7295, 14354), (7244, 14362), (7153, 14320), (7245, 14395), (9613, 14389), (7050, 14257), (7275, 14251), (7200, 14399)]
         : compromised: 0.5029, honest: 0.6673

=== FINAL RESULTS ===
Dataset: sent140, Nodes: 20, Graph: fully, Aggregation: balance
Attack: backdoor, 70.0% compromised
Final accuracy - Compromised: 0.5029, Honest: 0.6673
Overall test accuracy: mean=0.5522 ± 0.0755

=== BACKDOOR ATTACK SUCCESS RATE (ASR) ===
Target label: 1
Trigger size: 3x3
Overall ASR: 0.7319 ± 0.1989
Honest nodes ASR: 0.5165 ± 0.0295
Compromised nodes ASR: 0.8242 ± 0.1664
Note: Higher ASR indicates more successful backdoor attack

=== BALANCE SUMMARY ===
Node 0: acceptance=0.337
Node 1: acceptance=0.600
Node 2: acceptance=0.600
Node 3: acceptance=0.600
Node 4: acceptance=0.337
Node 5: acceptance=0.600
Node 6: acceptance=0.600
Node 7: acceptance=0.337
Node 8: acceptance=0.600
Node 9: acceptance=0.337
Node 10: acceptance=0.337
Node 11: acceptance=0.600
Node 12: acceptance=0.600
Node 13: acceptance=0.600
Node 14: acceptance=0.600
Node 15: acceptance=0.600
Node 16: acceptance=0.337
Node 17: acceptance=0.600
Node 18: acceptance=0.600
Node 19: acceptance=0.600

=== PARALLEL EXECUTION TIME (realistic for distributed system) ===
  COMMUNICATION (max across nodes):
    - Full model transfer: 0.000s (0.0%)
  COMPUTATION (max across nodes):
    - Filtering: 0.076s (85.1%)
    - Aggregation: 0.013s (14.9%)
  TOTALS:
    - Total computation: 0.089s (100.0%)
    - Total communication: 0.000s (0.0%)
    - Total parallel time: 0.089s

=== PER-NODE AVERAGE TIME ===
  - Filtering: 0.075s
  - Aggregation: 0.010s
  - Model transfer: 0.000s
  - Total per node: 0.084s

=== TOTAL COMPUTATIONAL WORK (sum across all nodes) ===
  - Total filtering: 1.492s
  - Total aggregation: 0.191s
  - Total model transfer: 0.000s
  - Grand total: 1.683s
  - Mean acceptance rate: 0.521

BALANCE Algorithm Properties:
  - Model dimension: 1,174,986
  - No compression: Full parameter comparison
  - Theoretical complexity: O(deg(i)×d)
  - Approach: Full parameter filtering + averaging
