Device: cuda
Seed: 987654321
Loading 1 LEAF Sent140 train files...
LEAF Sent140 train: 254555 users, 908652 samples
Building vocabulary (max_size=10000)...
Vocabulary size: 10000
Loading 1 LEAF Sent140 test files...
LEAF Sent140 test: 254555 users, 286281 samples
Found 254555 train users, 254555 test users, 254555 common users
User sample counts range: 494 (max) to 1 (min)
Distributed ALL 254555 users across 20 clients
Users per client: 12727 (with 15 clients getting +1 user)
Train partition sizes: [44353, 44290, 44657, 44907, 44696, 45843, 45801, 45619, 45069, 45639, 45821, 45311, 45779, 46056, 45625, 45984, 46428, 44737, 45540, 46497]
Test partition sizes: [14232, 14235, 14266, 14217, 14238, 14373, 14346, 14334, 14294, 14373, 14344, 14302, 14354, 14362, 14320, 14395, 14389, 14257, 14251, 14399]
  Client 0: 44353 train samples, 2 unique classes
  Client 1: 44290 train samples, 2 unique classes
  Client 2: 44657 train samples, 2 unique classes
  Client 3: 44907 train samples, 2 unique classes
  Client 4: 44696 train samples, 2 unique classes
  Client 5: 45843 train samples, 2 unique classes
  Client 6: 45801 train samples, 2 unique classes
  Client 7: 45619 train samples, 2 unique classes
  Client 8: 45069 train samples, 2 unique classes
  Client 9: 45639 train samples, 2 unique classes
  Client 10: 45821 train samples, 2 unique classes
  Client 11: 45311 train samples, 2 unique classes
  Client 12: 45779 train samples, 2 unique classes
  Client 13: 46056 train samples, 2 unique classes
  Client 14: 45625 train samples, 2 unique classes
  Client 15: 45984 train samples, 2 unique classes
  Client 16: 46428 train samples, 2 unique classes
  Client 17: 44737 train samples, 2 unique classes
  Client 18: 45540 train samples, 2 unique classes
  Client 19: 46497 train samples, 2 unique classes
Will sample 4500 samples per client per epoch
Graph: erdos, nodes: 20, edges: 99
Degree statistics: avg=9.90, min=7, max=14
Attack: Compromised 12/20 nodes: [1, 2, 3, 5, 8, 11, 12, 13, 14, 15, 17, 18]
Attack type: gaussian, lambda: 1.0
Model variant: baseline
Model parameters: 1,174,986
Sketchguard Node 0:
  Model dim: 1,174,986 → Sketch size: 180
  Compression ratio: 6527.7x
  Using model parameters for aggregation, sketches for filtering
Sketchguard Node 1:
  Model dim: 1,174,986 → Sketch size: 180
  Compression ratio: 6527.7x
  Using model parameters for aggregation, sketches for filtering
Sketchguard Node 2:
  Model dim: 1,174,986 → Sketch size: 180
  Compression ratio: 6527.7x
  Using model parameters for aggregation, sketches for filtering
Sketchguard Node 3:
  Model dim: 1,174,986 → Sketch size: 180
  Compression ratio: 6527.7x
  Using model parameters for aggregation, sketches for filtering
Sketchguard Node 4:
  Model dim: 1,174,986 → Sketch size: 180
  Compression ratio: 6527.7x
  Using model parameters for aggregation, sketches for filtering
Sketchguard Node 5:
  Model dim: 1,174,986 → Sketch size: 180
  Compression ratio: 6527.7x
  Using model parameters for aggregation, sketches for filtering
Sketchguard Node 6:
  Model dim: 1,174,986 → Sketch size: 180
  Compression ratio: 6527.7x
  Using model parameters for aggregation, sketches for filtering
Sketchguard Node 7:
  Model dim: 1,174,986 → Sketch size: 180
  Compression ratio: 6527.7x
  Using model parameters for aggregation, sketches for filtering
Sketchguard Node 8:
  Model dim: 1,174,986 → Sketch size: 180
  Compression ratio: 6527.7x
  Using model parameters for aggregation, sketches for filtering
Sketchguard Node 9:
  Model dim: 1,174,986 → Sketch size: 180
  Compression ratio: 6527.7x
  Using model parameters for aggregation, sketches for filtering
Sketchguard Node 10:
  Model dim: 1,174,986 → Sketch size: 180
  Compression ratio: 6527.7x
  Using model parameters for aggregation, sketches for filtering
Sketchguard Node 11:
  Model dim: 1,174,986 → Sketch size: 180
  Compression ratio: 6527.7x
  Using model parameters for aggregation, sketches for filtering
Sketchguard Node 12:
  Model dim: 1,174,986 → Sketch size: 180
  Compression ratio: 6527.7x
  Using model parameters for aggregation, sketches for filtering
Sketchguard Node 13:
  Model dim: 1,174,986 → Sketch size: 180
  Compression ratio: 6527.7x
  Using model parameters for aggregation, sketches for filtering
Sketchguard Node 14:
  Model dim: 1,174,986 → Sketch size: 180
  Compression ratio: 6527.7x
  Using model parameters for aggregation, sketches for filtering
Sketchguard Node 15:
  Model dim: 1,174,986 → Sketch size: 180
  Compression ratio: 6527.7x
  Using model parameters for aggregation, sketches for filtering
Sketchguard Node 16:
  Model dim: 1,174,986 → Sketch size: 180
  Compression ratio: 6527.7x
  Using model parameters for aggregation, sketches for filtering
Sketchguard Node 17:
  Model dim: 1,174,986 → Sketch size: 180
  Compression ratio: 6527.7x
  Using model parameters for aggregation, sketches for filtering
Sketchguard Node 18:
  Model dim: 1,174,986 → Sketch size: 180
  Compression ratio: 6527.7x
  Using model parameters for aggregation, sketches for filtering
Sketchguard Node 19:
  Model dim: 1,174,986 → Sketch size: 180
  Compression ratio: 6527.7x
  Using model parameters for aggregation, sketches for filtering
Sketchguard ALGORITHM (Sketch-based Filtering + State Aggregation)
  - Model dimension: 1,174,986 parameters
  - Config: SketchguardConfig(gamma=2, kappa=1, alpha=0.5, min_neighbors=1, sketch_size=180, network_seed=987654321, attack_detection_window=5)
  - Sketch size: 180
  - Compression ratio: 6527.7x
  - Complexity: O(d + N×k) = O(1,174,986 + 20×180)
  - Theoretical speedup vs BALANCE: 19.9x
Initial test acc across nodes: mean=0.4953 ± 0.0174
Round 001: test acc mean=0.5624 ± 0.0331 | min=0.5013 max=0.6161
         : test loss mean=0.6899 ± 0.0007
         : individual accs = ['0.553331', '0.545627', '0.520538', '0.501301', '0.613920', '0.542128', '0.606998', '0.609460', '0.580243', '0.575384', '0.538204', '0.566075', '0.616135', '0.545398', '0.530866', '0.559291', '0.535687', '0.579645', '0.528524', '0.599694']
         : correct/total = [(7875, 14232), (7767, 14235), (7426, 14266), (7127, 14217), (8741, 14238), (7792, 14373), (8708, 14346), (8736, 14334), (8294, 14294), (8270, 14373), (7720, 14344), (8096, 14302), (8844, 14354), (7833, 14362), (7602, 14320), (8051, 14395), (7708, 14389), (8264, 14257), (7532, 14251), (8635, 14399)]
         : compromised: 0.5513, honest: 0.5791
         : sketchguard stats = ['Node 0: acc_rate=0.417', 'Node 1: acc_rate=0.500', 'Node 2: acc_rate=0.500']...
Round 002: test acc mean=0.5854 ± 0.0452 | min=0.4924 max=0.6360
         : test loss mean=0.6878 ± 0.0032
         : individual accs = ['0.627248', '0.492378', '0.590355', '0.586129', '0.630496', '0.583803', '0.621149', '0.635970', '0.589478', '0.634593', '0.623118', '0.543141', '0.502926', '0.618229', '0.492598', '0.603612', '0.598374', '0.550957', '0.572872', '0.609695']
         : correct/total = [(8927, 14232), (7009, 14235), (8422, 14266), (8333, 14217), (8977, 14238), (8391, 14373), (8911, 14346), (9116, 14334), (8426, 14294), (9121, 14373), (8938, 14344), (7768, 14302), (7219, 14354), (8879, 14362), (7054, 14320), (8689, 14395), (8610, 14389), (7855, 14257), (8164, 14251), (8779, 14399)]
         : compromised: 0.5605, honest: 0.6226
         : sketchguard stats = ['Node 0: acc_rate=0.417', 'Node 1: acc_rate=0.500', 'Node 2: acc_rate=0.500']...
Round 003: test acc mean=0.5640 ± 0.0432 | min=0.4894 max=0.6398
         : test loss mean=0.6818 ± 0.0073
         : individual accs = ['0.535975', '0.489427', '0.525235', '0.578181', '0.637028', '0.549711', '0.526349', '0.608065', '0.588429', '0.635636', '0.555284', '0.572228', '0.516232', '0.535023', '0.511034', '0.527753', '0.639794', '0.588483', '0.595186', '0.565248']
         : correct/total = [(7628, 14232), (6967, 14235), (7493, 14266), (8220, 14217), (9070, 14238), (7901, 14373), (7551, 14346), (8716, 14334), (8411, 14294), (9136, 14373), (7965, 14344), (8184, 14302), (7410, 14354), (7684, 14362), (7318, 14320), (7597, 14395), (9206, 14389), (8390, 14257), (8482, 14251), (8139, 14399)]
         : compromised: 0.5481, honest: 0.5879
         : sketchguard stats = ['Node 0: acc_rate=0.417', 'Node 1: acc_rate=0.500', 'Node 2: acc_rate=0.500']...
Round 004: test acc mean=0.6313 ± 0.0144 | min=0.5878 max=0.6483
         : test loss mean=0.6662 ± 0.0071
         : individual accs = ['0.641723', '0.598806', '0.634866', '0.635155', '0.641593', '0.628331', '0.639203', '0.648319', '0.639009', '0.616642', '0.630089', '0.643057', '0.587780', '0.630414', '0.637011', '0.635915', '0.635624', '0.627060', '0.634482', '0.640044']
         : correct/total = [(9133, 14232), (8524, 14235), (9057, 14266), (9030, 14217), (9135, 14238), (9031, 14373), (9170, 14346), (9293, 14334), (9134, 14294), (8863, 14373), (9038, 14344), (9197, 14302), (8437, 14354), (9054, 14362), (9122, 14320), (9154, 14395), (9146, 14389), (8940, 14257), (9042, 14251), (9216, 14399)]
         : compromised: 0.6277, honest: 0.6367
         : sketchguard stats = ['Node 0: acc_rate=0.417', 'Node 1: acc_rate=0.500', 'Node 2: acc_rate=0.500']...
Round 005: test acc mean=0.6403 ± 0.0071 | min=0.6182 max=0.6509
         : test loss mean=0.6488 ± 0.0054
         : individual accs = ['0.644533', '0.643555', '0.636969', '0.642752', '0.640610', '0.649482', '0.643664', '0.650900', '0.641388', '0.638976', '0.618168', '0.646693', '0.629093', '0.641136', '0.639735', '0.635846', '0.644868', '0.637020', '0.635745', '0.645461']
         : correct/total = [(9173, 14232), (9161, 14235), (9087, 14266), (9138, 14217), (9121, 14238), (9335, 14373), (9234, 14346), (9330, 14334), (9168, 14294), (9184, 14373), (8867, 14344), (9249, 14302), (9030, 14354), (9208, 14362), (9161, 14320), (9153, 14395), (9279, 14389), (9082, 14257), (9060, 14251), (9294, 14399)]
         : compromised: 0.6400, honest: 0.6409
         : sketchguard stats = ['Node 0: acc_rate=0.417', 'Node 1: acc_rate=0.500', 'Node 2: acc_rate=0.500']...
Round 006: test acc mean=0.6456 ± 0.0056 | min=0.6346 max=0.6537
         : test loss mean=0.6356 ± 0.0031
         : individual accs = ['0.648890', '0.650931', '0.634586', '0.650067', '0.653673', '0.651291', '0.650355', '0.651807', '0.639359', '0.642594', '0.640407', '0.639841', '0.647555', '0.644409', '0.649791', '0.645085', '0.642366', '0.637441', '0.639674', '0.651781']
         : correct/total = [(9235, 14232), (9266, 14235), (9053, 14266), (9242, 14217), (9307, 14238), (9361, 14373), (9330, 14346), (9343, 14334), (9139, 14294), (9236, 14373), (9186, 14344), (9151, 14302), (9295, 14354), (9255, 14362), (9305, 14320), (9286, 14395), (9243, 14389), (9088, 14257), (9116, 14251), (9385, 14399)]
         : compromised: 0.6442, honest: 0.6477
         : sketchguard stats = ['Node 0: acc_rate=0.417', 'Node 1: acc_rate=0.500', 'Node 2: acc_rate=0.500']...
Round 007: test acc mean=0.6496 ± 0.0061 | min=0.6328 max=0.6592
         : test loss mean=0.6297 ± 0.0045
         : individual accs = ['0.649311', '0.659220', '0.635217', '0.648308', '0.652058', '0.657483', '0.650843', '0.649714', '0.650203', '0.651430', '0.647658', '0.651308', '0.656472', '0.647542', '0.653352', '0.632789', '0.649385', '0.646840', '0.649639', '0.652962']
         : correct/total = [(9241, 14232), (9384, 14235), (9062, 14266), (9217, 14217), (9284, 14238), (9450, 14373), (9337, 14346), (9313, 14334), (9294, 14294), (9363, 14373), (9290, 14344), (9315, 14302), (9423, 14354), (9300, 14362), (9356, 14320), (9109, 14395), (9344, 14389), (9222, 14257), (9258, 14251), (9402, 14399)]
         : compromised: 0.6490, honest: 0.6504
         : sketchguard stats = ['Node 0: acc_rate=0.417', 'Node 1: acc_rate=0.500', 'Node 2: acc_rate=0.500']...
Round 008: test acc mean=0.6538 ± 0.0074 | min=0.6278 max=0.6650
         : test loss mean=0.6260 ± 0.0057
         : individual accs = ['0.651630', '0.658799', '0.627786', '0.662235', '0.651075', '0.664997', '0.659348', '0.660388', '0.655030', '0.654282', '0.651562', '0.647182', '0.655288', '0.654366', '0.653561', '0.658562', '0.652999', '0.650768', '0.649358', '0.656434']
         : correct/total = [(9274, 14232), (9378, 14235), (8956, 14266), (9415, 14217), (9270, 14238), (9558, 14373), (9459, 14346), (9466, 14334), (9363, 14294), (9404, 14373), (9346, 14344), (9256, 14302), (9406, 14354), (9398, 14362), (9359, 14320), (9480, 14395), (9396, 14389), (9278, 14257), (9254, 14251), (9452, 14399)]
         : compromised: 0.6532, honest: 0.6547
         : sketchguard stats = ['Node 0: acc_rate=0.417', 'Node 1: acc_rate=0.500', 'Node 2: acc_rate=0.500']...
Round 009: test acc mean=0.6534 ± 0.0087 | min=0.6291 max=0.6681
         : test loss mean=0.6255 ± 0.0063
         : individual accs = ['0.629146', '0.654935', '0.649306', '0.656890', '0.648897', '0.668058', '0.642339', '0.656551', '0.640968', '0.646281', '0.657906', '0.656691', '0.658632', '0.658822', '0.647277', '0.655089', '0.657794', '0.658764', '0.661357', '0.661713']
         : correct/total = [(8954, 14232), (9323, 14235), (9263, 14266), (9339, 14217), (9239, 14238), (9602, 14373), (9215, 14346), (9411, 14334), (9162, 14294), (9289, 14373), (9437, 14344), (9392, 14302), (9454, 14354), (9462, 14362), (9269, 14320), (9430, 14395), (9465, 14389), (9392, 14257), (9425, 14251), (9528, 14399)]
         : compromised: 0.6556, honest: 0.6501
         : sketchguard stats = ['Node 0: acc_rate=0.417', 'Node 1: acc_rate=0.500', 'Node 2: acc_rate=0.500']...
Round 010: test acc mean=0.6638 ± 0.0064 | min=0.6405 max=0.6723
         : test loss mean=0.6162 ± 0.0050
         : individual accs = ['0.667299', '0.670741', '0.640544', '0.667862', '0.665683', '0.665762', '0.668967', '0.667434', '0.662306', '0.657692', '0.662368', '0.663054', '0.672286', '0.664671', '0.662011', '0.660577', '0.665439', '0.665498', '0.661217', '0.665393']
         : correct/total = [(9497, 14232), (9548, 14235), (9138, 14266), (9495, 14217), (9478, 14238), (9569, 14373), (9597, 14346), (9567, 14334), (9467, 14294), (9453, 14373), (9501, 14344), (9483, 14302), (9650, 14354), (9546, 14362), (9480, 14320), (9509, 14395), (9575, 14389), (9488, 14257), (9423, 14251), (9581, 14399)]
         : compromised: 0.6630, honest: 0.6650
         : sketchguard stats = ['Node 0: acc_rate=0.417', 'Node 1: acc_rate=0.500', 'Node 2: acc_rate=0.500']...

=== FINAL RESULTS ===
Dataset: sent140, Nodes: 20, Graph: erdos, Aggregation: sketchguard
Attack: gaussian, 60.0% compromised
Final accuracy - Compromised: 0.6630, Honest: 0.6650
Overall test accuracy: mean=0.6638 ± 0.0064

=== Sketchguard SUMMARY ===
Node 0: acceptance=0.417
Node 1: acceptance=0.500
Node 2: acceptance=0.500
Node 3: acceptance=0.571
Node 4: acceptance=0.333
Node 5: acceptance=0.400
Node 6: acceptance=0.333
Node 7: acceptance=0.273
Node 8: acceptance=0.286
Node 9: acceptance=0.545
Node 10: acceptance=0.500
Node 11: acceptance=0.333
Node 12: acceptance=0.500
Node 13: acceptance=0.333
Node 14: acceptance=0.357
Node 15: acceptance=0.444
Node 16: acceptance=0.286
Node 17: acceptance=0.625
Node 18: acceptance=0.333
Node 19: acceptance=0.300

=== PARALLEL EXECUTION TIME (realistic for distributed system) ===
  COMMUNICATION (max across nodes):
    - Sketch transfer: 0.000s (0.0%)
    - Model fetch (accepted): 0.000s (0.0%)
  COMPUTATION (max across nodes):
    - Sketching: 0.330s (94.5%)
    - Filtering: 0.001s (0.3%)
    - Aggregation: 0.018s (5.2%)
  TOTALS:
    - Total computation: 0.349s (100.0%)
    - Total communication: 0.000s (0.0%)
    - Total parallel time: 0.349s

=== PER-NODE AVERAGE TIME ===
  - Sketching: 0.253s
  - Filtering: 0.001s
  - Aggregation: 0.011s
  - Sketch transfer: 0.000s
  - Model fetch: 0.000s
  - Total per node: 0.265s

=== TOTAL COMPUTATIONAL WORK (sum across all nodes) ===
  - Total sketching: 5.065s
  - Total filtering: 0.012s
  - Total aggregation: 0.217s
  - Total sketch transfer: 0.000s
  - Total model fetch: 0.000s
  - Grand total: 5.294s
  - Mean acceptance rate: 0.409

Sketchguard Algorithm Properties:
  - Original dimension: 1,174,986
  - Sketch size: 180
  - Compression ratio: 19.9x
  - Single repetition: No repetitions needed
  - Theoretical complexity: O(d + N×k)
  - Approach: Sketch filtering + state aggregation
