Device: cuda
Seed: 987654321
Loading 1 LEAF Sent140 train files...
LEAF Sent140 train: 254555 users, 908652 samples
Building vocabulary (max_size=10000)...
Vocabulary size: 10000
Loading 1 LEAF Sent140 test files...
LEAF Sent140 test: 254555 users, 286281 samples
Found 254555 train users, 254555 test users, 254555 common users
User sample counts range: 494 (max) to 1 (min)
Distributed ALL 254555 users across 20 clients
Users per client: 12727 (with 15 clients getting +1 user)
Train partition sizes: [44353, 44290, 44657, 44907, 44696, 45843, 45801, 45619, 45069, 45639, 45821, 45311, 45779, 46056, 45625, 45984, 46428, 44737, 45540, 46497]
Test partition sizes: [14232, 14235, 14266, 14217, 14238, 14373, 14346, 14334, 14294, 14373, 14344, 14302, 14354, 14362, 14320, 14395, 14389, 14257, 14251, 14399]
  Client 0: 44353 train samples, 2 unique classes
  Client 1: 44290 train samples, 2 unique classes
  Client 2: 44657 train samples, 2 unique classes
  Client 3: 44907 train samples, 2 unique classes
  Client 4: 44696 train samples, 2 unique classes
  Client 5: 45843 train samples, 2 unique classes
  Client 6: 45801 train samples, 2 unique classes
  Client 7: 45619 train samples, 2 unique classes
  Client 8: 45069 train samples, 2 unique classes
  Client 9: 45639 train samples, 2 unique classes
  Client 10: 45821 train samples, 2 unique classes
  Client 11: 45311 train samples, 2 unique classes
  Client 12: 45779 train samples, 2 unique classes
  Client 13: 46056 train samples, 2 unique classes
  Client 14: 45625 train samples, 2 unique classes
  Client 15: 45984 train samples, 2 unique classes
  Client 16: 46428 train samples, 2 unique classes
  Client 17: 44737 train samples, 2 unique classes
  Client 18: 45540 train samples, 2 unique classes
  Client 19: 46497 train samples, 2 unique classes
Will sample 4500 samples per client per epoch
Graph: erdos, nodes: 20, edges: 48
Degree statistics: avg=4.80, min=2, max=7
Attack: Compromised 8/20 nodes: [1, 5, 11, 12, 13, 14, 17, 18]
Attack type: backdoor, lambda: 1.0
Backdoor target label: 1, trigger size: 3
Model variant: baseline
Model parameters: 1,174,986
Initial test acc across nodes: mean=0.4953 ± 0.0174
Backdoor attack: Created poisoned datasets for 8 compromised nodes
Round 001: test acc mean=0.5063 ± 0.0253 | min=0.4925 max=0.6125
         : test loss mean=6.8916 ± 6.4271
         : individual accs = ['0.612493', '0.515209', '0.493761', '0.492509', '0.495575', '0.499269', '0.505019', '0.498395', '0.498321', '0.508871', '0.501743', '0.496924', '0.496377', '0.502158', '0.495042', '0.492463', '0.501633', '0.513222', '0.493509', '0.514272']
         : correct/total = [(8717, 14232), (7334, 14235), (7044, 14266), (7002, 14217), (7056, 14238), (7176, 14373), (7245, 14346), (7144, 14334), (7123, 14294), (7314, 14373), (7197, 14344), (7107, 14302), (7125, 14354), (7212, 14362), (7089, 14320), (7089, 14395), (7218, 14389), (7317, 14257), (7033, 14251), (7405, 14399)]
         : compromised: 0.5015, honest: 0.5096
Round 002: test acc mean=0.5096 ± 0.0180 | min=0.4933 max=0.5758
         : test loss mean=12.4616 ± 11.7505
         : individual accs = ['0.575815', '0.542747', '0.508482', '0.515650', '0.505689', '0.502609', '0.500349', '0.507255', '0.503008', '0.504557', '0.501046', '0.507831', '0.497144', '0.493316', '0.507402', '0.502119', '0.507471', '0.504875', '0.506561', '0.498715']
         : correct/total = [(8195, 14232), (7726, 14235), (7254, 14266), (7331, 14217), (7200, 14238), (7224, 14373), (7178, 14346), (7271, 14334), (7190, 14294), (7252, 14373), (7187, 14344), (7263, 14302), (7136, 14354), (7085, 14362), (7266, 14320), (7228, 14395), (7302, 14389), (7198, 14257), (7219, 14251), (7181, 14399)]
         : compromised: 0.5078, honest: 0.5108
Round 003: test acc mean=0.5044 ± 0.0162 | min=0.4851 max=0.5651
         : test loss mean=2.9922 ± 3.0256
         : individual accs = ['0.565065', '0.511907', '0.512127', '0.485123', '0.491712', '0.496208', '0.499164', '0.491559', '0.498391', '0.490155', '0.500627', '0.501328', '0.502647', '0.506824', '0.493715', '0.497812', '0.507193', '0.515045', '0.506280', '0.515036']
         : correct/total = [(8042, 14232), (7287, 14235), (7306, 14266), (6897, 14217), (7001, 14238), (7132, 14373), (7161, 14346), (7046, 14334), (7124, 14294), (7045, 14373), (7181, 14344), (7170, 14302), (7215, 14354), (7279, 14362), (7070, 14320), (7166, 14395), (7298, 14389), (7343, 14257), (7215, 14251), (7416, 14399)]
         : compromised: 0.5042, honest: 0.5045
Round 004: test acc mean=0.4982 ± 0.0133 | min=0.4868 max=0.5513
         : test loss mean=5.8440 ± 5.3429
         : individual accs = ['0.551293', '0.490551', '0.486822', '0.487445', '0.495645', '0.491477', '0.500209', '0.489326', '0.498321', '0.495234', '0.497978', '0.491679', '0.501881', '0.498816', '0.492179', '0.506704', '0.492529', '0.495125', '0.495614', '0.504271']
         : correct/total = [(7846, 14232), (6983, 14235), (6945, 14266), (6930, 14217), (7057, 14238), (7064, 14373), (7176, 14346), (7014, 14334), (7123, 14294), (7118, 14373), (7143, 14344), (7032, 14302), (7204, 14354), (7164, 14362), (7048, 14320), (7294, 14395), (7087, 14389), (7059, 14257), (7063, 14251), (7261, 14399)]
         : compromised: 0.4947, honest: 0.5005
Round 005: test acc mean=0.4995 ± 0.0087 | min=0.4849 max=0.5264
         : test loss mean=23.4994 ± 23.4680
         : individual accs = ['0.507448', '0.526379', '0.491869', '0.484912', '0.494522', '0.495373', '0.499791', '0.492745', '0.504827', '0.495234', '0.498397', '0.493497', '0.502856', '0.506824', '0.492598', '0.497742', '0.503857', '0.495336', '0.495614', '0.511008']
         : correct/total = [(7222, 14232), (7493, 14235), (7017, 14266), (6894, 14217), (7041, 14238), (7120, 14373), (7170, 14346), (7063, 14334), (7216, 14294), (7118, 14373), (7149, 14344), (7058, 14302), (7218, 14354), (7279, 14362), (7054, 14320), (7165, 14395), (7250, 14389), (7062, 14257), (7063, 14251), (7358, 14399)]
         : compromised: 0.5011, honest: 0.4985
Round 006: test acc mean=0.4985 ± 0.0099 | min=0.4849 max=0.5327
         : test loss mean=23.6779 ± 18.4543
         : individual accs = ['0.532673', '0.513312', '0.486962', '0.484912', '0.494522', '0.495860', '0.499791', '0.492745', '0.498391', '0.495234', '0.498397', '0.493847', '0.502856', '0.506824', '0.492598', '0.497742', '0.494336', '0.495336', '0.495614', '0.498229']
         : correct/total = [(7581, 14232), (7307, 14235), (6947, 14266), (6894, 14217), (7041, 14238), (7127, 14373), (7170, 14346), (7063, 14334), (7124, 14294), (7118, 14373), (7149, 14344), (7063, 14302), (7218, 14354), (7279, 14362), (7054, 14320), (7165, 14395), (7113, 14389), (7062, 14257), (7063, 14251), (7174, 14399)]
         : compromised: 0.4995, honest: 0.4978
Round 007: test acc mean=0.4982 ± 0.0057 | min=0.4857 max=0.5082
         : test loss mean=15.9520 ± 12.4142
         : individual accs = ['0.505972', '0.508184', '0.495093', '0.485686', '0.495365', '0.502331', '0.499791', '0.492675', '0.503148', '0.494886', '0.498675', '0.493078', '0.502926', '0.506754', '0.492109', '0.497951', '0.494058', '0.495686', '0.495614', '0.504202']
         : correct/total = [(7201, 14232), (7234, 14235), (7063, 14266), (6905, 14217), (7053, 14238), (7220, 14373), (7170, 14346), (7062, 14334), (7192, 14294), (7113, 14373), (7153, 14344), (7052, 14302), (7219, 14354), (7278, 14362), (7047, 14320), (7168, 14395), (7109, 14389), (7067, 14257), (7063, 14251), (7260, 14399)]
         : compromised: 0.4996, honest: 0.4973
Round 008: test acc mean=0.5047 ± 0.0082 | min=0.4924 max=0.5253
         : test loss mean=5.8637 ± 5.1231
         : individual accs = ['0.525295', '0.515701', '0.500701', '0.506155', '0.492415', '0.503583', '0.500418', '0.518976', '0.506086', '0.495791', '0.506832', '0.504195', '0.496308', '0.493873', '0.506844', '0.502258', '0.502467', '0.511749', '0.505859', '0.497535']
         : correct/total = [(7476, 14232), (7341, 14235), (7143, 14266), (7196, 14217), (7011, 14238), (7238, 14373), (7179, 14346), (7439, 14334), (7234, 14294), (7126, 14373), (7270, 14344), (7211, 14302), (7124, 14354), (7093, 14362), (7258, 14320), (7230, 14395), (7230, 14389), (7296, 14257), (7209, 14251), (7164, 14399)]
         : compromised: 0.5048, honest: 0.5046
Round 009: test acc mean=0.5070 ± 0.0107 | min=0.4935 max=0.5374
         : test loss mean=9.4753 ± 7.5094
         : individual accs = ['0.533797', '0.537408', '0.512758', '0.515088', '0.504916', '0.504001', '0.500349', '0.507325', '0.501959', '0.509427', '0.501673', '0.507272', '0.497562', '0.493455', '0.507263', '0.501980', '0.502120', '0.500386', '0.502351', '0.498924']
         : correct/total = [(7597, 14232), (7650, 14235), (7315, 14266), (7323, 14217), (7189, 14238), (7244, 14373), (7178, 14346), (7272, 14334), (7175, 14294), (7322, 14373), (7196, 14344), (7255, 14302), (7142, 14354), (7087, 14362), (7264, 14320), (7226, 14395), (7225, 14389), (7134, 14257), (7159, 14251), (7184, 14399)]
         : compromised: 0.5062, honest: 0.5075
Round 010: test acc mean=0.5019 ± 0.0064 | min=0.4862 max=0.5130
         : test loss mean=7.5391 ± 5.3138
         : individual accs = ['0.501265', '0.486196', '0.513038', '0.494267', '0.496418', '0.506992', '0.507389', '0.501465', '0.500840', '0.507549', '0.498327', '0.505733', '0.506688', '0.498956', '0.502654', '0.492741', '0.507262', '0.500456', '0.497860', '0.511424']
         : correct/total = [(7134, 14232), (6921, 14235), (7319, 14266), (7027, 14217), (7068, 14238), (7287, 14373), (7279, 14346), (7188, 14334), (7159, 14294), (7295, 14373), (7148, 14344), (7233, 14302), (7273, 14354), (7166, 14362), (7198, 14320), (7093, 14395), (7299, 14389), (7135, 14257), (7095, 14251), (7364, 14399)]
         : compromised: 0.5007, honest: 0.5027

=== FINAL RESULTS ===
Dataset: sent140, Nodes: 20, Graph: erdos, Aggregation: krum
Attack: backdoor, 40.0% compromised
Final accuracy - Compromised: 0.5007, Honest: 0.5027
Overall test accuracy: mean=0.5019 ± 0.0064

=== BACKDOOR ATTACK SUCCESS RATE (ASR) ===
Target label: 1
Trigger size: 3x3
Overall ASR: 0.2620 ± 0.2720
Honest nodes ASR: 0.2428 ± 0.2425
Compromised nodes ASR: 0.2907 ± 0.3089
Note: Higher ASR indicates more successful backdoor attack
