Device: cuda
Seed: 987654321
Loading 1 LEAF Sent140 train files...
LEAF Sent140 train: 254555 users, 908652 samples
Building vocabulary (max_size=10000)...
Vocabulary size: 10000
Loading 1 LEAF Sent140 test files...
LEAF Sent140 test: 254555 users, 286281 samples
Found 254555 train users, 254555 test users, 254555 common users
User sample counts range: 494 (max) to 1 (min)
Distributed ALL 254555 users across 20 clients
Users per client: 12727 (with 15 clients getting +1 user)
Train partition sizes: [44353, 44290, 44657, 44907, 44696, 45843, 45801, 45619, 45069, 45639, 45821, 45311, 45779, 46056, 45625, 45984, 46428, 44737, 45540, 46497]
Test partition sizes: [14232, 14235, 14266, 14217, 14238, 14373, 14346, 14334, 14294, 14373, 14344, 14302, 14354, 14362, 14320, 14395, 14389, 14257, 14251, 14399]
  Client 0: 44353 train samples, 2 unique classes
  Client 1: 44290 train samples, 2 unique classes
  Client 2: 44657 train samples, 2 unique classes
  Client 3: 44907 train samples, 2 unique classes
  Client 4: 44696 train samples, 2 unique classes
  Client 5: 45843 train samples, 2 unique classes
  Client 6: 45801 train samples, 2 unique classes
  Client 7: 45619 train samples, 2 unique classes
  Client 8: 45069 train samples, 2 unique classes
  Client 9: 45639 train samples, 2 unique classes
  Client 10: 45821 train samples, 2 unique classes
  Client 11: 45311 train samples, 2 unique classes
  Client 12: 45779 train samples, 2 unique classes
  Client 13: 46056 train samples, 2 unique classes
  Client 14: 45625 train samples, 2 unique classes
  Client 15: 45984 train samples, 2 unique classes
  Client 16: 46428 train samples, 2 unique classes
  Client 17: 44737 train samples, 2 unique classes
  Client 18: 45540 train samples, 2 unique classes
  Client 19: 46497 train samples, 2 unique classes
Will sample 4500 samples per client per epoch
Graph: erdos, nodes: 20, edges: 48
Degree statistics: avg=4.80, min=2, max=7
Attack: Compromised 6/20 nodes: [5, 12, 13, 14, 17, 18]
Attack type: gaussian, lambda: 1.0
Model variant: baseline
Model parameters: 1,174,986
Sketchguard Node 0:
  Model dim: 1,174,986 → Sketch size: 180
  Compression ratio: 6527.7x
  Using model parameters for aggregation, sketches for filtering
Sketchguard Node 1:
  Model dim: 1,174,986 → Sketch size: 180
  Compression ratio: 6527.7x
  Using model parameters for aggregation, sketches for filtering
Sketchguard Node 2:
  Model dim: 1,174,986 → Sketch size: 180
  Compression ratio: 6527.7x
  Using model parameters for aggregation, sketches for filtering
Sketchguard Node 3:
  Model dim: 1,174,986 → Sketch size: 180
  Compression ratio: 6527.7x
  Using model parameters for aggregation, sketches for filtering
Sketchguard Node 4:
  Model dim: 1,174,986 → Sketch size: 180
  Compression ratio: 6527.7x
  Using model parameters for aggregation, sketches for filtering
Sketchguard Node 5:
  Model dim: 1,174,986 → Sketch size: 180
  Compression ratio: 6527.7x
  Using model parameters for aggregation, sketches for filtering
Sketchguard Node 6:
  Model dim: 1,174,986 → Sketch size: 180
  Compression ratio: 6527.7x
  Using model parameters for aggregation, sketches for filtering
Sketchguard Node 7:
  Model dim: 1,174,986 → Sketch size: 180
  Compression ratio: 6527.7x
  Using model parameters for aggregation, sketches for filtering
Sketchguard Node 8:
  Model dim: 1,174,986 → Sketch size: 180
  Compression ratio: 6527.7x
  Using model parameters for aggregation, sketches for filtering
Sketchguard Node 9:
  Model dim: 1,174,986 → Sketch size: 180
  Compression ratio: 6527.7x
  Using model parameters for aggregation, sketches for filtering
Sketchguard Node 10:
  Model dim: 1,174,986 → Sketch size: 180
  Compression ratio: 6527.7x
  Using model parameters for aggregation, sketches for filtering
Sketchguard Node 11:
  Model dim: 1,174,986 → Sketch size: 180
  Compression ratio: 6527.7x
  Using model parameters for aggregation, sketches for filtering
Sketchguard Node 12:
  Model dim: 1,174,986 → Sketch size: 180
  Compression ratio: 6527.7x
  Using model parameters for aggregation, sketches for filtering
Sketchguard Node 13:
  Model dim: 1,174,986 → Sketch size: 180
  Compression ratio: 6527.7x
  Using model parameters for aggregation, sketches for filtering
Sketchguard Node 14:
  Model dim: 1,174,986 → Sketch size: 180
  Compression ratio: 6527.7x
  Using model parameters for aggregation, sketches for filtering
Sketchguard Node 15:
  Model dim: 1,174,986 → Sketch size: 180
  Compression ratio: 6527.7x
  Using model parameters for aggregation, sketches for filtering
Sketchguard Node 16:
  Model dim: 1,174,986 → Sketch size: 180
  Compression ratio: 6527.7x
  Using model parameters for aggregation, sketches for filtering
Sketchguard Node 17:
  Model dim: 1,174,986 → Sketch size: 180
  Compression ratio: 6527.7x
  Using model parameters for aggregation, sketches for filtering
Sketchguard Node 18:
  Model dim: 1,174,986 → Sketch size: 180
  Compression ratio: 6527.7x
  Using model parameters for aggregation, sketches for filtering
Sketchguard Node 19:
  Model dim: 1,174,986 → Sketch size: 180
  Compression ratio: 6527.7x
  Using model parameters for aggregation, sketches for filtering
Sketchguard ALGORITHM (Sketch-based Filtering + State Aggregation)
  - Model dimension: 1,174,986 parameters
  - Config: SketchguardConfig(gamma=2, kappa=1, alpha=0.5, min_neighbors=1, sketch_size=180, network_seed=987654321, attack_detection_window=5)
  - Sketch size: 180
  - Compression ratio: 6527.7x
  - Complexity: O(d + N×k) = O(1,174,986 + 20×180)
  - Theoretical speedup vs BALANCE: 19.9x
Initial test acc across nodes: mean=0.4953 ± 0.0174
Round 001: test acc mean=0.5589 ± 0.0356 | min=0.5023 max=0.6279
         : test loss mean=0.6898 ± 0.0010
         : individual accs = ['0.554666', '0.589533', '0.519417', '0.502286', '0.544880', '0.576915', '0.570124', '0.611902', '0.554289', '0.537536', '0.532069', '0.557055', '0.627351', '0.547208', '0.520880', '0.627857', '0.509834', '0.581188', '0.533506', '0.580179']
         : correct/total = [(7894, 14232), (8392, 14235), (7410, 14266), (7141, 14217), (7758, 14238), (8292, 14373), (8179, 14346), (8771, 14334), (7923, 14294), (7726, 14373), (7632, 14344), (7967, 14302), (9005, 14354), (7859, 14362), (7459, 14320), (9038, 14395), (7336, 14389), (8286, 14257), (7603, 14251), (8354, 14399)]
         : compromised: 0.5645, honest: 0.5565
         : sketchguard stats = ['Node 0: acc_rate=0.833', 'Node 1: acc_rate=1.000', 'Node 2: acc_rate=0.600']...
Round 002: test acc mean=0.5797 ± 0.0442 | min=0.4975 max=0.6378
         : test loss mean=0.6843 ± 0.0079
         : individual accs = ['0.605256', '0.624025', '0.625894', '0.555602', '0.617151', '0.603284', '0.592848', '0.637017', '0.618931', '0.554234', '0.554308', '0.576143', '0.519855', '0.566634', '0.497486', '0.637791', '0.530822', '0.514975', '0.531191', '0.631294']
         : correct/total = [(8614, 14232), (8883, 14235), (8929, 14266), (7899, 14217), (8787, 14238), (8671, 14373), (8505, 14346), (9131, 14334), (8847, 14294), (7966, 14373), (7951, 14344), (8240, 14302), (7462, 14354), (8138, 14362), (7124, 14320), (9181, 14395), (7638, 14389), (7342, 14257), (7570, 14251), (9090, 14399)]
         : compromised: 0.5389, honest: 0.5972
         : sketchguard stats = ['Node 0: acc_rate=0.833', 'Node 1: acc_rate=1.000', 'Node 2: acc_rate=0.600']...
Round 003: test acc mean=0.5900 ± 0.0365 | min=0.5064 max=0.6393
         : test loss mean=0.6788 ± 0.0105
         : individual accs = ['0.554103', '0.589603', '0.639282', '0.622705', '0.612867', '0.630209', '0.530322', '0.559927', '0.638030', '0.631879', '0.627858', '0.577751', '0.506409', '0.592814', '0.569064', '0.573741', '0.600945', '0.562531', '0.567609', '0.612056']
         : correct/total = [(7886, 14232), (8393, 14235), (9120, 14266), (8853, 14217), (8726, 14238), (9058, 14373), (7608, 14346), (8026, 14334), (9120, 14294), (9082, 14373), (9006, 14344), (8263, 14302), (7269, 14354), (8514, 14362), (8149, 14320), (8259, 14395), (8647, 14389), (8020, 14257), (8089, 14251), (8813, 14399)]
         : compromised: 0.5714, honest: 0.5979
         : sketchguard stats = ['Node 0: acc_rate=0.833', 'Node 1: acc_rate=1.000', 'Node 2: acc_rate=0.600']...
Round 004: test acc mean=0.6235 ± 0.0290 | min=0.5238 max=0.6485
         : test loss mean=0.6700 ± 0.0116
         : individual accs = ['0.637226', '0.626765', '0.617132', '0.633959', '0.621717', '0.641063', '0.635857', '0.634226', '0.645935', '0.598762', '0.642011', '0.640190', '0.523826', '0.571926', '0.629469', '0.640292', '0.646188', '0.620187', '0.614694', '0.648517']
         : correct/total = [(9069, 14232), (8922, 14235), (8804, 14266), (9013, 14217), (8852, 14238), (9214, 14373), (9122, 14346), (9091, 14334), (9233, 14294), (8606, 14373), (9209, 14344), (9156, 14302), (7519, 14354), (8214, 14362), (9014, 14320), (9217, 14395), (9298, 14389), (8842, 14257), (8760, 14251), (9338, 14399)]
         : compromised: 0.6002, honest: 0.6335
         : sketchguard stats = ['Node 0: acc_rate=0.833', 'Node 1: acc_rate=1.000', 'Node 2: acc_rate=0.600']...
Round 005: test acc mean=0.6374 ± 0.0149 | min=0.6066 max=0.6564
         : test loss mean=0.6623 ± 0.0101
         : individual accs = ['0.638420', '0.647278', '0.649166', '0.639094', '0.650021', '0.606554', '0.646731', '0.652853', '0.639499', '0.620956', '0.645775', '0.640540', '0.620176', '0.613564', '0.627025', '0.646891', '0.654528', '0.641159', '0.611396', '0.656365']
         : correct/total = [(9086, 14232), (9214, 14235), (9261, 14266), (9086, 14217), (9255, 14238), (8718, 14373), (9278, 14346), (9358, 14334), (9141, 14294), (8925, 14373), (9263, 14344), (9161, 14302), (8902, 14354), (8812, 14362), (8979, 14320), (9312, 14395), (9418, 14389), (9141, 14257), (8713, 14251), (9451, 14399)]
         : compromised: 0.6200, honest: 0.6449
         : sketchguard stats = ['Node 0: acc_rate=0.833', 'Node 1: acc_rate=1.000', 'Node 2: acc_rate=0.600']...
Round 006: test acc mean=0.6442 ± 0.0155 | min=0.5940 max=0.6596
         : test loss mean=0.6490 ± 0.0089
         : individual accs = ['0.647906', '0.652828', '0.649727', '0.643596', '0.653673', '0.649482', '0.646173', '0.659620', '0.651602', '0.646560', '0.621514', '0.593973', '0.652501', '0.641902', '0.652025', '0.651476', '0.655570', '0.617100', '0.639885', '0.655948']
         : correct/total = [(9221, 14232), (9293, 14235), (9269, 14266), (9150, 14217), (9307, 14238), (9335, 14373), (9270, 14346), (9455, 14334), (9314, 14294), (9293, 14373), (8915, 14344), (8495, 14302), (9366, 14354), (9219, 14362), (9337, 14320), (9378, 14395), (9433, 14389), (8798, 14257), (9119, 14251), (9445, 14399)]
         : compromised: 0.6421, honest: 0.6450
         : sketchguard stats = ['Node 0: acc_rate=0.833', 'Node 1: acc_rate=1.000', 'Node 2: acc_rate=0.600']...
Round 007: test acc mean=0.6461 ± 0.0121 | min=0.6071 max=0.6591
         : test loss mean=0.6419 ± 0.0074
         : individual accs = ['0.650155', '0.659150', '0.635497', '0.645143', '0.657677', '0.652265', '0.653144', '0.629273', '0.652302', '0.644124', '0.651840', '0.639071', '0.652640', '0.607088', '0.653561', '0.653143', '0.657377', '0.633934', '0.641990', '0.651990']
         : correct/total = [(9253, 14232), (9383, 14235), (9066, 14266), (9172, 14217), (9364, 14238), (9375, 14373), (9370, 14346), (9020, 14334), (9324, 14294), (9258, 14373), (9350, 14344), (9140, 14302), (9368, 14354), (8719, 14362), (9359, 14320), (9402, 14395), (9459, 14389), (9038, 14257), (9149, 14251), (9388, 14399)]
         : compromised: 0.6402, honest: 0.6486
         : sketchguard stats = ['Node 0: acc_rate=0.833', 'Node 1: acc_rate=1.000', 'Node 2: acc_rate=0.600']...
Round 008: test acc mean=0.6498 ± 0.0101 | min=0.6297 max=0.6642
         : test loss mean=0.6346 ± 0.0071
         : individual accs = ['0.652403', '0.632455', '0.638161', '0.657804', '0.649740', '0.664232', '0.659138', '0.656202', '0.657619', '0.660614', '0.645218', '0.658439', '0.638150', '0.644339', '0.652095', '0.656895', '0.639933', '0.629726', '0.642271', '0.661226']
         : correct/total = [(9285, 14232), (9003, 14235), (9104, 14266), (9352, 14217), (9251, 14238), (9547, 14373), (9456, 14346), (9406, 14334), (9400, 14294), (9495, 14373), (9255, 14344), (9417, 14302), (9160, 14354), (9254, 14362), (9338, 14320), (9456, 14395), (9208, 14389), (8978, 14257), (9153, 14251), (9521, 14399)]
         : compromised: 0.6451, honest: 0.6518
         : sketchguard stats = ['Node 0: acc_rate=0.833', 'Node 1: acc_rate=1.000', 'Node 2: acc_rate=0.600']...
Round 009: test acc mean=0.6584 ± 0.0071 | min=0.6432 max=0.6675
         : test loss mean=0.6278 ± 0.0047
         : individual accs = ['0.643409', '0.666667', '0.661503', '0.661391', '0.661399', '0.667502', '0.660533', '0.658434', '0.643907', '0.643220', '0.658742', '0.653475', '0.661418', '0.661746', '0.658799', '0.658006', '0.665508', '0.658273', '0.659533', '0.665532']
         : correct/total = [(9157, 14232), (9490, 14235), (9437, 14266), (9403, 14217), (9417, 14238), (9594, 14373), (9476, 14346), (9438, 14334), (9204, 14294), (9245, 14373), (9449, 14344), (9346, 14302), (9494, 14354), (9504, 14362), (9434, 14320), (9472, 14395), (9576, 14389), (9385, 14257), (9399, 14251), (9583, 14399)]
         : compromised: 0.6612, honest: 0.6573
         : sketchguard stats = ['Node 0: acc_rate=0.833', 'Node 1: acc_rate=1.000', 'Node 2: acc_rate=0.600']...
Round 010: test acc mean=0.6650 ± 0.0067 | min=0.6480 max=0.6746
         : test loss mean=0.6180 ± 0.0058
         : individual accs = ['0.661959', '0.669828', '0.647974', '0.665893', '0.674112', '0.673485', '0.667503', '0.674620', '0.666643', '0.666736', '0.666202', '0.665781', '0.668942', '0.661468', '0.665433', '0.664675', '0.670165', '0.658203', '0.652235', '0.658935']
         : correct/total = [(9421, 14232), (9535, 14235), (9244, 14266), (9467, 14217), (9598, 14238), (9680, 14373), (9576, 14346), (9670, 14334), (9529, 14294), (9583, 14373), (9556, 14344), (9522, 14302), (9602, 14354), (9500, 14362), (9529, 14320), (9568, 14395), (9643, 14389), (9384, 14257), (9295, 14251), (9488, 14399)]
         : compromised: 0.6633, honest: 0.6658
         : sketchguard stats = ['Node 0: acc_rate=0.833', 'Node 1: acc_rate=1.000', 'Node 2: acc_rate=0.600']...

=== FINAL RESULTS ===
Dataset: sent140, Nodes: 20, Graph: erdos, Aggregation: sketchguard
Attack: gaussian, 30.0% compromised
Final accuracy - Compromised: 0.6633, Honest: 0.6658
Overall test accuracy: mean=0.6650 ± 0.0067

=== Sketchguard SUMMARY ===
Node 0: acceptance=0.833
Node 1: acceptance=1.000
Node 2: acceptance=0.600
Node 3: acceptance=0.750
Node 4: acceptance=0.500
Node 5: acceptance=0.400
Node 6: acceptance=0.800
Node 7: acceptance=0.600
Node 8: acceptance=0.500
Node 9: acceptance=1.000
Node 10: acceptance=0.750
Node 11: acceptance=0.571
Node 12: acceptance=0.714
Node 13: acceptance=0.750
Node 14: acceptance=0.429
Node 15: acceptance=0.500
Node 16: acceptance=0.400
Node 17: acceptance=0.600
Node 18: acceptance=0.900
Node 19: acceptance=1.000

=== PARALLEL EXECUTION TIME (realistic for distributed system) ===
  COMMUNICATION (max across nodes):
    - Sketch transfer: 0.000s (0.0%)
    - Model fetch (accepted): 0.000s (0.0%)
  COMPUTATION (max across nodes):
    - Sketching: 0.295s (94.7%)
    - Filtering: 0.001s (0.3%)
    - Aggregation: 0.016s (5.0%)
  TOTALS:
    - Total computation: 0.312s (100.0%)
    - Total communication: 0.000s (0.0%)
    - Total parallel time: 0.312s

=== PER-NODE AVERAGE TIME ===
  - Sketching: 0.209s
  - Filtering: 0.000s
  - Aggregation: 0.008s
  - Sketch transfer: 0.000s
  - Model fetch: 0.000s
  - Total per node: 0.217s

=== TOTAL COMPUTATIONAL WORK (sum across all nodes) ===
  - Total sketching: 4.171s
  - Total filtering: 0.008s
  - Total aggregation: 0.167s
  - Total sketch transfer: 0.000s
  - Total model fetch: 0.000s
  - Grand total: 4.346s
  - Mean acceptance rate: 0.680

Sketchguard Algorithm Properties:
  - Original dimension: 1,174,986
  - Sketch size: 180
  - Compression ratio: 19.9x
  - Single repetition: No repetitions needed
  - Theoretical complexity: O(d + N×k)
  - Approach: Sketch filtering + state aggregation
