Device: cuda
Seed: 987654321
Loading 1 LEAF Sent140 train files...
LEAF Sent140 train: 254555 users, 908652 samples
Building vocabulary (max_size=10000)...
Vocabulary size: 10000
Loading 1 LEAF Sent140 test files...
LEAF Sent140 test: 254555 users, 286281 samples
Found 254555 train users, 254555 test users, 254555 common users
User sample counts range: 494 (max) to 1 (min)
Distributed ALL 254555 users across 20 clients
Users per client: 12727 (with 15 clients getting +1 user)
Train partition sizes: [44353, 44290, 44657, 44907, 44696, 45843, 45801, 45619, 45069, 45639, 45821, 45311, 45779, 46056, 45625, 45984, 46428, 44737, 45540, 46497]
Test partition sizes: [14232, 14235, 14266, 14217, 14238, 14373, 14346, 14334, 14294, 14373, 14344, 14302, 14354, 14362, 14320, 14395, 14389, 14257, 14251, 14399]
  Client 0: 44353 train samples, 2 unique classes
  Client 1: 44290 train samples, 2 unique classes
  Client 2: 44657 train samples, 2 unique classes
  Client 3: 44907 train samples, 2 unique classes
  Client 4: 44696 train samples, 2 unique classes
  Client 5: 45843 train samples, 2 unique classes
  Client 6: 45801 train samples, 2 unique classes
  Client 7: 45619 train samples, 2 unique classes
  Client 8: 45069 train samples, 2 unique classes
  Client 9: 45639 train samples, 2 unique classes
  Client 10: 45821 train samples, 2 unique classes
  Client 11: 45311 train samples, 2 unique classes
  Client 12: 45779 train samples, 2 unique classes
  Client 13: 46056 train samples, 2 unique classes
  Client 14: 45625 train samples, 2 unique classes
  Client 15: 45984 train samples, 2 unique classes
  Client 16: 46428 train samples, 2 unique classes
  Client 17: 44737 train samples, 2 unique classes
  Client 18: 45540 train samples, 2 unique classes
  Client 19: 46497 train samples, 2 unique classes
Will sample 4500 samples per client per epoch
Graph: fully, nodes: 20, edges: 190
Degree statistics: avg=19.00, min=19, max=19
Attack: Compromised 2/20 nodes: [5, 13]
Attack type: directed_deviation, lambda: 1.0
Model variant: baseline
Model parameters: 1,174,986
Initial test acc across nodes: mean=0.4953 ± 0.0174
Round 001: test acc mean=0.5026 ± 0.0108 | min=0.4843 max=0.5196
         : test loss mean=0.7215 ± 0.0304
         : individual accs = ['0.501686', '0.517035', '0.486401', '0.484912', '0.506672', '0.517498', '0.508434', '0.507255', '0.492235', '0.516941', '0.507390', '0.500489', '0.502856', '0.489347', '0.507053', '0.519625', '0.507401', '0.493302', '0.500596', '0.484339']
         : correct/total = [(7140, 14232), (7360, 14235), (6939, 14266), (6894, 14217), (7214, 14238), (7438, 14373), (7294, 14346), (7271, 14334), (7036, 14294), (7430, 14373), (7278, 14344), (7158, 14302), (7218, 14354), (7028, 14362), (7261, 14320), (7480, 14395), (7301, 14389), (7033, 14257), (7134, 14251), (6974, 14399)]
         : compromised: 0.5034, honest: 0.5025
Round 002: test acc mean=0.5004 ± 0.0047 | min=0.4912 max=0.5104
         : test loss mean=0.7036 ± 0.0013
         : individual accs = ['0.494800', '0.494837', '0.491238', '0.494338', '0.510395', '0.501635', '0.499930', '0.497977', '0.500840', '0.501078', '0.497699', '0.503706', '0.509893', '0.506475', '0.498464', '0.503091', '0.499409', '0.500386', '0.501158', '0.501146']
         : correct/total = [(7042, 14232), (7044, 14235), (7008, 14266), (7028, 14217), (7267, 14238), (7210, 14373), (7172, 14346), (7138, 14334), (7159, 14294), (7202, 14373), (7139, 14344), (7204, 14302), (7319, 14354), (7274, 14362), (7138, 14320), (7242, 14395), (7186, 14389), (7134, 14257), (7142, 14251), (7216, 14399)]
         : compromised: 0.5041, honest: 0.5000
Round 003: test acc mean=0.4949 ± 0.0055 | min=0.4830 max=0.5068
         : test loss mean=0.6933 ± 0.0001
         : individual accs = ['0.492622', '0.483035', '0.486962', '0.484912', '0.494592', '0.495860', '0.499791', '0.492745', '0.498181', '0.495234', '0.498397', '0.493847', '0.502856', '0.506824', '0.492598', '0.497742', '0.492460', '0.495336', '0.495544', '0.498090']
         : correct/total = [(7011, 14232), (6876, 14235), (6947, 14266), (6894, 14217), (7042, 14238), (7127, 14373), (7170, 14346), (7063, 14334), (7121, 14294), (7118, 14373), (7149, 14344), (7063, 14302), (7218, 14354), (7279, 14362), (7054, 14320), (7165, 14395), (7086, 14389), (7062, 14257), (7062, 14251), (7172, 14399)]
         : compromised: 0.5013, honest: 0.4942
Round 004: test acc mean=0.6175 ± 0.0030 | min=0.6115 max=0.6218
         : test loss mean=0.6584 ± 0.0021
         : individual accs = ['0.618536', '0.619319', '0.611454', '0.617359', '0.617502', '0.620469', '0.618082', '0.621808', '0.618231', '0.618243', '0.611754', '0.619284', '0.616901', '0.613494', '0.620182', '0.621118', '0.614011', '0.615347', '0.614624', '0.621293']
         : correct/total = [(8803, 14232), (8816, 14235), (8723, 14266), (8777, 14217), (8792, 14238), (8918, 14373), (8867, 14346), (8913, 14334), (8837, 14294), (8886, 14373), (8775, 14344), (8857, 14302), (8855, 14354), (8811, 14362), (8881, 14320), (8941, 14395), (8835, 14389), (8773, 14257), (8759, 14251), (8946, 14399)]
         : compromised: 0.6170, honest: 0.6175
Round 005: test acc mean=0.4966 ± 0.0054 | min=0.4852 max=0.5084
         : test loss mean=0.6909 ± 0.0003
         : individual accs = ['0.494309', '0.485213', '0.489065', '0.486741', '0.495716', '0.497669', '0.501673', '0.494279', '0.499300', '0.496834', '0.499651', '0.495385', '0.504041', '0.508355', '0.494832', '0.499757', '0.493293', '0.496738', '0.498000', '0.500521']
         : correct/total = [(7035, 14232), (6907, 14235), (6977, 14266), (6920, 14217), (7058, 14238), (7153, 14373), (7197, 14346), (7085, 14334), (7137, 14294), (7141, 14373), (7167, 14344), (7085, 14302), (7235, 14354), (7301, 14362), (7086, 14320), (7194, 14395), (7098, 14389), (7082, 14257), (7097, 14251), (7207, 14399)]
         : compromised: 0.5030, honest: 0.4959
Round 006: test acc mean=0.6220 ± 0.0032 | min=0.6138 max=0.6266
         : test loss mean=0.6774 ± 0.0028
         : individual accs = ['0.625000', '0.621496', '0.613837', '0.621087', '0.624175', '0.626522', '0.624216', '0.626552', '0.624038', '0.623391', '0.616355', '0.622850', '0.621917', '0.620457', '0.625838', '0.620563', '0.620335', '0.620678', '0.618483', '0.622543']
         : correct/total = [(8895, 14232), (8847, 14235), (8757, 14266), (8830, 14217), (8887, 14238), (9005, 14373), (8955, 14346), (8981, 14334), (8920, 14294), (8960, 14373), (8841, 14344), (8908, 14302), (8927, 14354), (8911, 14362), (8962, 14320), (8933, 14395), (8926, 14389), (8849, 14257), (8814, 14251), (8964, 14399)]
         : compromised: 0.6235, honest: 0.6219
Round 007: test acc mean=0.6326 ± 0.0038 | min=0.6248 max=0.6389
         : test loss mean=0.6517 ± 0.0012
         : individual accs = ['0.630270', '0.632736', '0.625683', '0.638250', '0.635834', '0.632645', '0.638436', '0.635273', '0.638939', '0.628748', '0.632878', '0.632779', '0.632089', '0.624774', '0.633240', '0.633901', '0.634721', '0.628042', '0.629219', '0.634002']
         : correct/total = [(8970, 14232), (9007, 14235), (8926, 14266), (9074, 14217), (9053, 14238), (9093, 14373), (9159, 14346), (9106, 14334), (9133, 14294), (9037, 14373), (9078, 14344), (9050, 14302), (9073, 14354), (8973, 14362), (9068, 14320), (9125, 14395), (9133, 14389), (8954, 14257), (8967, 14251), (9129, 14399)]
         : compromised: 0.6287, honest: 0.6331
Round 008: test acc mean=0.6329 ± 0.0038 | min=0.6275 max=0.6422
         : test loss mean=0.6476 ± 0.0032
         : individual accs = ['0.633080', '0.629926', '0.627506', '0.627559', '0.637168', '0.634175', '0.633556', '0.642249', '0.635371', '0.635567', '0.627998', '0.635925', '0.632785', '0.634174', '0.635475', '0.628691', '0.628119', '0.628954', '0.632657', '0.636225']
         : correct/total = [(9010, 14232), (8967, 14235), (8952, 14266), (8922, 14217), (9072, 14238), (9115, 14373), (9089, 14346), (9206, 14334), (9082, 14294), (9135, 14373), (9008, 14344), (9095, 14302), (9083, 14354), (9108, 14362), (9100, 14320), (9050, 14395), (9038, 14389), (8967, 14257), (9016, 14251), (9161, 14399)]
         : compromised: 0.6342, honest: 0.6327
Round 009: test acc mean=0.6549 ± 0.0040 | min=0.6458 max=0.6609
         : test loss mean=0.6313 ± 0.0017
         : individual accs = ['0.653457', '0.654654', '0.645801', '0.660899', '0.656904', '0.657135', '0.660672', '0.659481', '0.655870', '0.653378', '0.654071', '0.653195', '0.653755', '0.650954', '0.656494', '0.653282', '0.659393', '0.650487', '0.648656', '0.659490']
         : correct/total = [(9300, 14232), (9319, 14235), (9213, 14266), (9396, 14217), (9353, 14238), (9445, 14373), (9478, 14346), (9453, 14334), (9375, 14294), (9391, 14373), (9382, 14344), (9342, 14302), (9384, 14354), (9349, 14362), (9401, 14320), (9404, 14395), (9488, 14389), (9274, 14257), (9244, 14251), (9496, 14399)]
         : compromised: 0.6540, honest: 0.6550
Round 010: test acc mean=0.6496 ± 0.0036 | min=0.6422 max=0.6568
         : test loss mean=0.6284 ± 0.0035
         : individual accs = ['0.648398', '0.647137', '0.642927', '0.647113', '0.653744', '0.653934', '0.650843', '0.656830', '0.651952', '0.650804', '0.642220', '0.650888', '0.651735', '0.648726', '0.652514', '0.646613', '0.645493', '0.649435', '0.648165', '0.651712']
         : correct/total = [(9228, 14232), (9212, 14235), (9172, 14266), (9200, 14217), (9308, 14238), (9399, 14373), (9337, 14346), (9415, 14334), (9319, 14294), (9354, 14373), (9212, 14344), (9309, 14302), (9355, 14354), (9317, 14362), (9344, 14320), (9308, 14395), (9288, 14389), (9259, 14257), (9237, 14251), (9384, 14399)]
         : compromised: 0.6513, honest: 0.6494

=== FINAL RESULTS ===
Dataset: sent140, Nodes: 20, Graph: fully, Aggregation: d-fedavg
Attack: directed_deviation, 10.0% compromised
Final accuracy - Compromised: 0.6513, Honest: 0.6494
Overall test accuracy: mean=0.6496 ± 0.0036
