Device: cuda
Seed: 987654321
Loading 1 LEAF Sent140 train files...
LEAF Sent140 train: 254555 users, 908652 samples
Building vocabulary (max_size=10000)...
Vocabulary size: 10000
Loading 1 LEAF Sent140 test files...
LEAF Sent140 test: 254555 users, 286281 samples
Found 254555 train users, 254555 test users, 254555 common users
User sample counts range: 494 (max) to 1 (min)
Distributed ALL 254555 users across 20 clients
Users per client: 12727 (with 15 clients getting +1 user)
Train partition sizes: [44353, 44290, 44657, 44907, 44696, 45843, 45801, 45619, 45069, 45639, 45821, 45311, 45779, 46056, 45625, 45984, 46428, 44737, 45540, 46497]
Test partition sizes: [14232, 14235, 14266, 14217, 14238, 14373, 14346, 14334, 14294, 14373, 14344, 14302, 14354, 14362, 14320, 14395, 14389, 14257, 14251, 14399]
  Client 0: 44353 train samples, 2 unique classes
  Client 1: 44290 train samples, 2 unique classes
  Client 2: 44657 train samples, 2 unique classes
  Client 3: 44907 train samples, 2 unique classes
  Client 4: 44696 train samples, 2 unique classes
  Client 5: 45843 train samples, 2 unique classes
  Client 6: 45801 train samples, 2 unique classes
  Client 7: 45619 train samples, 2 unique classes
  Client 8: 45069 train samples, 2 unique classes
  Client 9: 45639 train samples, 2 unique classes
  Client 10: 45821 train samples, 2 unique classes
  Client 11: 45311 train samples, 2 unique classes
  Client 12: 45779 train samples, 2 unique classes
  Client 13: 46056 train samples, 2 unique classes
  Client 14: 45625 train samples, 2 unique classes
  Client 15: 45984 train samples, 2 unique classes
  Client 16: 46428 train samples, 2 unique classes
  Client 17: 44737 train samples, 2 unique classes
  Client 18: 45540 train samples, 2 unique classes
  Client 19: 46497 train samples, 2 unique classes
Will sample 4500 samples per client per epoch
Graph: erdos, nodes: 20, edges: 99
Degree statistics: avg=9.90, min=7, max=14
Attack: Compromised 16/20 nodes: [1, 2, 3, 5, 6, 8, 9, 10, 11, 12, 13, 14, 15, 17, 18, 19]
Attack type: backdoor, lambda: 1.0
Backdoor target label: 1, trigger size: 3
Model variant: baseline
Model parameters: 1,174,986
Initial test acc across nodes: mean=0.4953 ± 0.0174
Backdoor attack: Created poisoned datasets for 16 compromised nodes
Round 001: test acc mean=0.4984 ± 0.0063 | min=0.4858 max=0.5103
         : test loss mean=16.6234 ± 12.2489
         : individual accs = ['0.510329', '0.506498', '0.505117', '0.490117', '0.495084', '0.497948', '0.505995', '0.491977', '0.501259', '0.493634', '0.498466', '0.505594', '0.497701', '0.488790', '0.495950', '0.485794', '0.495865', '0.501438', '0.501438', '0.498298']
         : correct/total = [(7263, 14232), (7210, 14235), (7206, 14266), (6968, 14217), (7049, 14238), (7157, 14373), (7259, 14346), (7052, 14334), (7165, 14294), (7095, 14373), (7150, 14344), (7231, 14302), (7144, 14354), (7020, 14362), (7102, 14320), (6993, 14395), (7135, 14389), (7149, 14257), (7146, 14251), (7175, 14399)]
         : compromised: 0.4984, honest: 0.4983
Round 002: test acc mean=0.5013 ± 0.0073 | min=0.4845 max=0.5227
         : test loss mean=26.2765 ± 11.6821
         : individual accs = ['0.504918', '0.507411', '0.505538', '0.507350', '0.503231', '0.501705', '0.497769', '0.503279', '0.499580', '0.496695', '0.500209', '0.494686', '0.484464', '0.507589', '0.493785', '0.497742', '0.522691', '0.498562', '0.500667', '0.498646']
         : correct/total = [(7186, 14232), (7223, 14235), (7212, 14266), (7213, 14217), (7165, 14238), (7211, 14373), (7141, 14346), (7214, 14334), (7141, 14294), (7139, 14373), (7175, 14344), (7075, 14302), (6954, 14354), (7290, 14362), (7071, 14320), (7165, 14395), (7521, 14389), (7108, 14257), (7135, 14251), (7180, 14399)]
         : compromised: 0.4995, honest: 0.5085
Round 003: test acc mean=0.5006 ± 0.0089 | min=0.4811 max=0.5148
         : test loss mean=17.8576 ± 17.9369
         : individual accs = ['0.494238', '0.495680', '0.511566', '0.514736', '0.504284', '0.514785', '0.492681', '0.508721', '0.503708', '0.503653', '0.503067', '0.506153', '0.483350', '0.493107', '0.481075', '0.498506', '0.505039', '0.501789', '0.501930', '0.494270']
         : correct/total = [(7034, 14232), (7056, 14235), (7298, 14266), (7318, 14217), (7180, 14238), (7399, 14373), (7068, 14346), (7292, 14334), (7200, 14294), (7239, 14373), (7216, 14344), (7239, 14302), (6938, 14354), (7082, 14362), (6889, 14320), (7176, 14395), (7267, 14389), (7154, 14257), (7153, 14251), (7117, 14399)]
         : compromised: 0.5000, honest: 0.5031
Round 004: test acc mean=0.4992 ± 0.0082 | min=0.4858 max=0.5184
         : test loss mean=18.2450 ± 12.2137
         : individual accs = ['0.504427', '0.518370', '0.489766', '0.490610', '0.485813', '0.490712', '0.505019', '0.494419', '0.496712', '0.504418', '0.496096', '0.494896', '0.496586', '0.505779', '0.508799', '0.511567', '0.501981', '0.501087', '0.488667', '0.498437']
         : correct/total = [(7179, 14232), (7379, 14235), (6987, 14266), (6975, 14217), (6917, 14238), (7053, 14373), (7245, 14346), (7087, 14334), (7100, 14294), (7250, 14373), (7116, 14344), (7078, 14302), (7128, 14354), (7264, 14362), (7286, 14320), (7364, 14395), (7223, 14389), (7144, 14257), (6964, 14251), (7177, 14399)]
         : compromised: 0.4998, honest: 0.4967
Round 005: test acc mean=0.5026 ± 0.0079 | min=0.4867 max=0.5155
         : test loss mean=35.3703 ± 10.2596
         : individual accs = ['0.505762', '0.508044', '0.515491', '0.489344', '0.514258', '0.502539', '0.510804', '0.491698', '0.504407', '0.497600', '0.506484', '0.492519', '0.493660', '0.486701', '0.506634', '0.501633', '0.509486', '0.504454', '0.504947', '0.504757']
         : correct/total = [(7198, 14232), (7232, 14235), (7354, 14266), (6957, 14217), (7322, 14238), (7223, 14373), (7328, 14346), (7048, 14334), (7210, 14294), (7152, 14373), (7265, 14344), (7044, 14302), (7086, 14354), (6990, 14362), (7255, 14320), (7221, 14395), (7331, 14389), (7192, 14257), (7196, 14251), (7268, 14399)]
         : compromised: 0.5019, honest: 0.5053
Round 006: test acc mean=0.5037 ± 0.0055 | min=0.4932 max=0.5159
         : test loss mean=113.6753 ± 58.4477
         : individual accs = ['0.506745', '0.515911', '0.509253', '0.499683', '0.505759', '0.505253', '0.498327', '0.507186', '0.496922', '0.504835', '0.500558', '0.506153', '0.493591', '0.493176', '0.506075', '0.502258', '0.501355', '0.504805', '0.503894', '0.511772']
         : correct/total = [(7212, 14232), (7344, 14235), (7265, 14266), (7104, 14217), (7201, 14238), (7262, 14373), (7149, 14346), (7270, 14334), (7103, 14294), (7256, 14373), (7180, 14344), (7239, 14302), (7085, 14354), (7083, 14362), (7247, 14320), (7230, 14395), (7214, 14389), (7197, 14257), (7181, 14251), (7369, 14399)]
         : compromised: 0.5033, honest: 0.5053
Round 007: test acc mean=0.5050 ± 0.0060 | min=0.4911 max=0.5146
         : test loss mean=117.9733 ± 48.9782
         : individual accs = ['0.504567', '0.512891', '0.512127', '0.514384', '0.506181', '0.504488', '0.503346', '0.506697', '0.505807', '0.504905', '0.501952', '0.505524', '0.499443', '0.491854', '0.508101', '0.501771', '0.514629', '0.505716', '0.504456', '0.491076']
         : correct/total = [(7181, 14232), (7301, 14235), (7306, 14266), (7313, 14217), (7207, 14238), (7251, 14373), (7221, 14346), (7263, 14334), (7230, 14294), (7257, 14373), (7200, 14344), (7230, 14302), (7169, 14354), (7064, 14362), (7276, 14320), (7223, 14395), (7405, 14389), (7210, 14257), (7189, 14251), (7071, 14399)]
         : compromised: 0.5042, honest: 0.5080
Round 008: test acc mean=0.5061 ± 0.0078 | min=0.4948 max=0.5220
         : test loss mean=95.5153 ± 68.0795
         : individual accs = ['0.521993', '0.520688', '0.508552', '0.515299', '0.512361', '0.496904', '0.500627', '0.504325', '0.500840', '0.515898', '0.502231', '0.508530', '0.509544', '0.496310', '0.502444', '0.499548', '0.494753', '0.501789', '0.509719', '0.500313']
         : correct/total = [(7429, 14232), (7412, 14235), (7255, 14266), (7326, 14217), (7295, 14238), (7142, 14373), (7182, 14346), (7229, 14334), (7159, 14294), (7415, 14373), (7204, 14344), (7273, 14302), (7314, 14354), (7128, 14362), (7195, 14320), (7191, 14395), (7119, 14389), (7154, 14257), (7264, 14251), (7204, 14399)]
         : compromised: 0.5056, honest: 0.5084
Round 009: test acc mean=0.4964 ± 0.0065 | min=0.4835 max=0.5113
         : test loss mean=63.1463 ± 25.2896
         : individual accs = ['0.498173', '0.483456', '0.493131', '0.485545', '0.496067', '0.498226', '0.511292', '0.492954', '0.509724', '0.495652', '0.499651', '0.492658', '0.502926', '0.491018', '0.493017', '0.497881', '0.500799', '0.495336', '0.495965', '0.494479']
         : correct/total = [(7090, 14232), (6882, 14235), (7035, 14266), (6903, 14217), (7063, 14238), (7161, 14373), (7335, 14346), (7066, 14334), (7286, 14294), (7124, 14373), (7167, 14344), (7046, 14302), (7219, 14354), (7052, 14362), (7060, 14320), (7167, 14395), (7206, 14389), (7062, 14257), (7068, 14251), (7120, 14399)]
         : compromised: 0.4962, honest: 0.4970
Round 010: test acc mean=0.5048 ± 0.0066 | min=0.4944 max=0.5195
         : test loss mean=65.0398 ± 25.0873
         : individual accs = ['0.519463', '0.512821', '0.504416', '0.515088', '0.510816', '0.503722', '0.500558', '0.503698', '0.504967', '0.503166', '0.501603', '0.497553', '0.495123', '0.494430', '0.506844', '0.502675', '0.513170', '0.504875', '0.505579', '0.495798']
         : correct/total = [(7393, 14232), (7300, 14235), (7196, 14266), (7323, 14217), (7273, 14238), (7240, 14373), (7181, 14346), (7220, 14334), (7218, 14294), (7232, 14373), (7195, 14344), (7116, 14302), (7107, 14354), (7101, 14362), (7258, 14320), (7236, 14395), (7384, 14389), (7198, 14257), (7205, 14251), (7139, 14399)]
         : compromised: 0.5031, honest: 0.5118

=== FINAL RESULTS ===
Dataset: sent140, Nodes: 20, Graph: erdos, Aggregation: krum
Attack: backdoor, 80.0% compromised
Final accuracy - Compromised: 0.5031, Honest: 0.5118
Overall test accuracy: mean=0.5048 ± 0.0066

=== BACKDOOR ATTACK SUCCESS RATE (ASR) ===
Target label: 1
Trigger size: 3x3
Overall ASR: 0.1104 ± 0.1598
Honest nodes ASR: 0.1195 ± 0.1038
Compromised nodes ASR: 0.1082 ± 0.1709
Note: Higher ASR indicates more successful backdoor attack
