Device: cuda
Seed: 987654321
Loading 1 LEAF Sent140 train files...
LEAF Sent140 train: 254555 users, 908652 samples
Building vocabulary (max_size=10000)...
Vocabulary size: 10000
Loading 1 LEAF Sent140 test files...
LEAF Sent140 test: 254555 users, 286281 samples
Found 254555 train users, 254555 test users, 254555 common users
User sample counts range: 494 (max) to 1 (min)
Distributed ALL 254555 users across 20 clients
Users per client: 12727 (with 15 clients getting +1 user)
Train partition sizes: [44353, 44290, 44657, 44907, 44696, 45843, 45801, 45619, 45069, 45639, 45821, 45311, 45779, 46056, 45625, 45984, 46428, 44737, 45540, 46497]
Test partition sizes: [14232, 14235, 14266, 14217, 14238, 14373, 14346, 14334, 14294, 14373, 14344, 14302, 14354, 14362, 14320, 14395, 14389, 14257, 14251, 14399]
  Client 0: 44353 train samples, 2 unique classes
  Client 1: 44290 train samples, 2 unique classes
  Client 2: 44657 train samples, 2 unique classes
  Client 3: 44907 train samples, 2 unique classes
  Client 4: 44696 train samples, 2 unique classes
  Client 5: 45843 train samples, 2 unique classes
  Client 6: 45801 train samples, 2 unique classes
  Client 7: 45619 train samples, 2 unique classes
  Client 8: 45069 train samples, 2 unique classes
  Client 9: 45639 train samples, 2 unique classes
  Client 10: 45821 train samples, 2 unique classes
  Client 11: 45311 train samples, 2 unique classes
  Client 12: 45779 train samples, 2 unique classes
  Client 13: 46056 train samples, 2 unique classes
  Client 14: 45625 train samples, 2 unique classes
  Client 15: 45984 train samples, 2 unique classes
  Client 16: 46428 train samples, 2 unique classes
  Client 17: 44737 train samples, 2 unique classes
  Client 18: 45540 train samples, 2 unique classes
  Client 19: 46497 train samples, 2 unique classes
Will sample 4500 samples per client per epoch
Graph: erdos, nodes: 20, edges: 48
Degree statistics: avg=4.80, min=2, max=7
Attack: Compromised 14/20 nodes: [1, 2, 3, 5, 6, 8, 11, 12, 13, 14, 15, 17, 18, 19]
Attack type: gaussian, lambda: 1.0
Model variant: baseline
Model parameters: 1,174,986
Sketchguard Node 0:
  Model dim: 1,174,986 → Sketch size: 180
  Compression ratio: 6527.7x
  Using model parameters for aggregation, sketches for filtering
Sketchguard Node 1:
  Model dim: 1,174,986 → Sketch size: 180
  Compression ratio: 6527.7x
  Using model parameters for aggregation, sketches for filtering
Sketchguard Node 2:
  Model dim: 1,174,986 → Sketch size: 180
  Compression ratio: 6527.7x
  Using model parameters for aggregation, sketches for filtering
Sketchguard Node 3:
  Model dim: 1,174,986 → Sketch size: 180
  Compression ratio: 6527.7x
  Using model parameters for aggregation, sketches for filtering
Sketchguard Node 4:
  Model dim: 1,174,986 → Sketch size: 180
  Compression ratio: 6527.7x
  Using model parameters for aggregation, sketches for filtering
Sketchguard Node 5:
  Model dim: 1,174,986 → Sketch size: 180
  Compression ratio: 6527.7x
  Using model parameters for aggregation, sketches for filtering
Sketchguard Node 6:
  Model dim: 1,174,986 → Sketch size: 180
  Compression ratio: 6527.7x
  Using model parameters for aggregation, sketches for filtering
Sketchguard Node 7:
  Model dim: 1,174,986 → Sketch size: 180
  Compression ratio: 6527.7x
  Using model parameters for aggregation, sketches for filtering
Sketchguard Node 8:
  Model dim: 1,174,986 → Sketch size: 180
  Compression ratio: 6527.7x
  Using model parameters for aggregation, sketches for filtering
Sketchguard Node 9:
  Model dim: 1,174,986 → Sketch size: 180
  Compression ratio: 6527.7x
  Using model parameters for aggregation, sketches for filtering
Sketchguard Node 10:
  Model dim: 1,174,986 → Sketch size: 180
  Compression ratio: 6527.7x
  Using model parameters for aggregation, sketches for filtering
Sketchguard Node 11:
  Model dim: 1,174,986 → Sketch size: 180
  Compression ratio: 6527.7x
  Using model parameters for aggregation, sketches for filtering
Sketchguard Node 12:
  Model dim: 1,174,986 → Sketch size: 180
  Compression ratio: 6527.7x
  Using model parameters for aggregation, sketches for filtering
Sketchguard Node 13:
  Model dim: 1,174,986 → Sketch size: 180
  Compression ratio: 6527.7x
  Using model parameters for aggregation, sketches for filtering
Sketchguard Node 14:
  Model dim: 1,174,986 → Sketch size: 180
  Compression ratio: 6527.7x
  Using model parameters for aggregation, sketches for filtering
Sketchguard Node 15:
  Model dim: 1,174,986 → Sketch size: 180
  Compression ratio: 6527.7x
  Using model parameters for aggregation, sketches for filtering
Sketchguard Node 16:
  Model dim: 1,174,986 → Sketch size: 180
  Compression ratio: 6527.7x
  Using model parameters for aggregation, sketches for filtering
Sketchguard Node 17:
  Model dim: 1,174,986 → Sketch size: 180
  Compression ratio: 6527.7x
  Using model parameters for aggregation, sketches for filtering
Sketchguard Node 18:
  Model dim: 1,174,986 → Sketch size: 180
  Compression ratio: 6527.7x
  Using model parameters for aggregation, sketches for filtering
Sketchguard Node 19:
  Model dim: 1,174,986 → Sketch size: 180
  Compression ratio: 6527.7x
  Using model parameters for aggregation, sketches for filtering
Sketchguard ALGORITHM (Sketch-based Filtering + State Aggregation)
  - Model dimension: 1,174,986 parameters
  - Config: SketchguardConfig(gamma=2, kappa=1, alpha=0.5, min_neighbors=1, sketch_size=180, network_seed=987654321, attack_detection_window=5)
  - Sketch size: 180
  - Compression ratio: 6527.7x
  - Complexity: O(d + N×k) = O(1,174,986 + 20×180)
  - Theoretical speedup vs BALANCE: 19.9x
Initial test acc across nodes: mean=0.4953 ± 0.0174
Round 001: test acc mean=0.5584 ± 0.0335 | min=0.4901 max=0.6145
         : test loss mean=107.8222 ± 466.9842
         : individual accs = ['0.578415', '0.533685', '0.571008', '0.496237', '0.597907', '0.569749', '0.533389', '0.594112', '0.554289', '0.591526', '0.567973', '0.527758', '0.593214', '0.490113', '0.527025', '0.614519', '0.572938', '0.581188', '0.533647', '0.540038']
         : correct/total = [(8232, 14232), (7597, 14235), (8146, 14266), (7055, 14217), (8513, 14238), (8189, 14373), (7652, 14346), (8516, 14334), (7923, 14294), (8502, 14373), (8147, 14344), (7548, 14302), (8515, 14354), (7039, 14362), (7547, 14320), (8846, 14395), (8244, 14389), (8286, 14257), (7605, 14251), (7776, 14399)]
         : compromised: 0.5476, honest: 0.5838
         : sketchguard stats = ['Node 0: acc_rate=0.333', 'Node 1: acc_rate=0.333', 'Node 2: acc_rate=0.200']...
Round 002: test acc mean=0.6060 ± 0.0459 | min=0.4871 max=0.6434
         : test loss mean=21.4676 ± 90.6917
         : individual accs = ['0.627670', '0.513945', '0.627226', '0.631709', '0.639135', '0.636123', '0.623240', '0.640226', '0.602980', '0.632714', '0.636154', '0.542581', '0.575798', '0.487119', '0.630168', '0.633901', '0.630273', '0.541278', '0.623886', '0.643378']
         : correct/total = [(8933, 14232), (7316, 14235), (8948, 14266), (8981, 14217), (9100, 14238), (9143, 14373), (8941, 14346), (9177, 14334), (8619, 14294), (9094, 14373), (9125, 14344), (7760, 14302), (8265, 14354), (6996, 14362), (9024, 14320), (9125, 14395), (9069, 14389), (7717, 14257), (8891, 14251), (9264, 14399)]
         : compromised: 0.5938, honest: 0.6344
         : sketchguard stats = ['Node 0: acc_rate=0.333', 'Node 1: acc_rate=0.333', 'Node 2: acc_rate=0.200']...
Round 003: test acc mean=0.6174 ± 0.0383 | min=0.4922 max=0.6427
         : test loss mean=20.7733 ± 87.7165
         : individual accs = ['0.639896', '0.532069', '0.627646', '0.635225', '0.641874', '0.634662', '0.624076', '0.642668', '0.639429', '0.639324', '0.623466', '0.583974', '0.602062', '0.492202', '0.641201', '0.627718', '0.636180', '0.617802', '0.631956', '0.634766']
         : correct/total = [(9107, 14232), (7574, 14235), (8954, 14266), (9031, 14217), (9139, 14238), (9122, 14373), (8953, 14346), (9212, 14334), (9140, 14294), (9189, 14373), (8943, 14344), (8352, 14302), (8642, 14354), (7069, 14362), (9182, 14320), (9036, 14395), (9154, 14389), (8808, 14257), (9006, 14251), (9140, 14399)]
         : compromised: 0.6089, honest: 0.6372
         : sketchguard stats = ['Node 0: acc_rate=0.333', 'Node 1: acc_rate=0.333', 'Node 2: acc_rate=0.200']...
Round 004: test acc mean=0.6354 ± 0.0307 | min=0.5079 max=0.6526
         : test loss mean=27.3921 ± 116.6188
         : individual accs = ['0.652614', '0.610186', '0.636829', '0.640219', '0.641593', '0.646072', '0.644082', '0.652156', '0.650763', '0.644751', '0.648634', '0.633827', '0.637383', '0.507868', '0.639036', '0.642167', '0.646466', '0.649506', '0.633850', '0.649351']
         : correct/total = [(9288, 14232), (8686, 14235), (9085, 14266), (9102, 14217), (9135, 14238), (9286, 14373), (9240, 14346), (9348, 14334), (9302, 14294), (9267, 14373), (9304, 14344), (9065, 14302), (9149, 14354), (7294, 14362), (9151, 14320), (9244, 14395), (9302, 14389), (9260, 14257), (9033, 14251), (9350, 14399)]
         : compromised: 0.6301, honest: 0.6477
         : sketchguard stats = ['Node 0: acc_rate=0.333', 'Node 1: acc_rate=0.333', 'Node 2: acc_rate=0.200']...
Round 005: test acc mean=0.6412 ± 0.0302 | min=0.5110 max=0.6553
         : test loss mean=18.2936 ± 76.9975
         : individual accs = ['0.654089', '0.648823', '0.646923', '0.647324', '0.654657', '0.648995', '0.649380', '0.653970', '0.655310', '0.644890', '0.643335', '0.635995', '0.646858', '0.511001', '0.648394', '0.643974', '0.649524', '0.648874', '0.641078', '0.649906']
         : correct/total = [(9309, 14232), (9236, 14235), (9229, 14266), (9203, 14217), (9321, 14238), (9328, 14373), (9316, 14346), (9374, 14334), (9367, 14294), (9269, 14373), (9228, 14344), (9096, 14302), (9285, 14354), (7339, 14362), (9285, 14320), (9270, 14395), (9346, 14389), (9251, 14257), (9136, 14251), (9358, 14399)]
         : compromised: 0.6373, honest: 0.6501
         : sketchguard stats = ['Node 0: acc_rate=0.333', 'Node 1: acc_rate=0.300', 'Node 2: acc_rate=0.200']...
Round 006: test acc mean=0.6434 ± 0.0337 | min=0.5060 max=0.6616
         : test loss mean=23.7138 ± 100.6492
         : individual accs = ['0.660062', '0.655286', '0.648044', '0.645073', '0.655570', '0.654769', '0.654468', '0.655853', '0.661606', '0.654769', '0.651771', '0.603692', '0.657726', '0.505988', '0.657542', '0.641334', '0.652999', '0.653854', '0.644376', '0.653031']
         : correct/total = [(9394, 14232), (9328, 14235), (9245, 14266), (9171, 14217), (9334, 14238), (9411, 14373), (9389, 14346), (9401, 14334), (9457, 14294), (9411, 14373), (9349, 14344), (8634, 14302), (9441, 14354), (7267, 14362), (9416, 14320), (9232, 14395), (9396, 14389), (9322, 14257), (9183, 14251), (9403, 14399)]
         : compromised: 0.6383, honest: 0.6552
         : sketchguard stats = ['Node 0: acc_rate=0.333', 'Node 1: acc_rate=0.278', 'Node 2: acc_rate=0.200']...
Round 007: test acc mean=0.6452 ± 0.0311 | min=0.5136 max=0.6623
         : test loss mean=36.2500 ± 155.3064
         : individual accs = ['0.662310', '0.658307', '0.649166', '0.653232', '0.644543', '0.639324', '0.647916', '0.649086', '0.659507', '0.658248', '0.653723', '0.636764', '0.661000', '0.513647', '0.659008', '0.641542', '0.656196', '0.659746', '0.644727', '0.656087']
         : correct/total = [(9426, 14232), (9371, 14235), (9261, 14266), (9287, 14217), (9177, 14238), (9189, 14373), (9295, 14346), (9304, 14334), (9427, 14294), (9461, 14373), (9377, 14344), (9107, 14302), (9488, 14354), (7377, 14362), (9437, 14320), (9235, 14395), (9442, 14389), (9406, 14257), (9188, 14251), (9447, 14399)]
         : compromised: 0.6414, honest: 0.6540
         : sketchguard stats = ['Node 0: acc_rate=0.333', 'Node 1: acc_rate=0.262', 'Node 2: acc_rate=0.200']...
Round 008: test acc mean=0.6503 ± 0.0328 | min=0.5111 max=0.6650
         : test loss mean=97.1483 ± 420.7684
         : individual accs = ['0.661889', '0.651423', '0.655264', '0.658859', '0.653673', '0.664440', '0.660672', '0.663039', '0.664475', '0.660822', '0.658324', '0.656412', '0.665041', '0.511141', '0.659637', '0.658423', '0.656057', '0.657922', '0.628307', '0.659699']
         : correct/total = [(9420, 14232), (9273, 14235), (9348, 14266), (9367, 14217), (9307, 14238), (9550, 14373), (9478, 14346), (9504, 14334), (9498, 14294), (9498, 14373), (9443, 14344), (9388, 14302), (9546, 14354), (7341, 14362), (9446, 14320), (9478, 14395), (9440, 14389), (9380, 14257), (8954, 14251), (9499, 14399)]
         : compromised: 0.6466, honest: 0.6590
         : sketchguard stats = ['Node 0: acc_rate=0.333', 'Node 1: acc_rate=0.250', 'Node 2: acc_rate=0.200']...
Round 009: test acc mean=0.6488 ± 0.0334 | min=0.5078 max=0.6683
         : test loss mean=103.4956 ± 448.4414
         : individual accs = ['0.651981', '0.666245', '0.644119', '0.657804', '0.660275', '0.666736', '0.633766', '0.665132', '0.648524', '0.645029', '0.657487', '0.655293', '0.665180', '0.507798', '0.668296', '0.657103', '0.658420', '0.654766', '0.655322', '0.656643']
         : correct/total = [(9279, 14232), (9484, 14235), (9189, 14266), (9352, 14217), (9401, 14238), (9583, 14373), (9092, 14346), (9534, 14334), (9270, 14294), (9271, 14373), (9431, 14344), (9372, 14302), (9548, 14354), (7293, 14362), (9570, 14320), (9459, 14395), (9474, 14389), (9335, 14257), (9339, 14251), (9455, 14399)]
         : compromised: 0.6455, honest: 0.6564
         : sketchguard stats = ['Node 0: acc_rate=0.333', 'Node 1: acc_rate=0.241', 'Node 2: acc_rate=0.200']...
Round 010: test acc mean=0.6578 ± 0.0384 | min=0.4930 max=0.6760
         : test loss mean=124.5802 ± 540.3860
         : individual accs = ['0.675520', '0.669687', '0.664447', '0.659844', '0.671934', '0.669032', '0.670013', '0.666736', '0.671960', '0.669450', '0.659788', '0.664173', '0.675979', '0.492968', '0.671508', '0.661619', '0.668149', '0.661429', '0.646551', '0.665463']
         : correct/total = [(9614, 14232), (9533, 14235), (9479, 14266), (9381, 14217), (9567, 14238), (9616, 14373), (9612, 14346), (9557, 14334), (9605, 14294), (9622, 14373), (9464, 14344), (9499, 14302), (9703, 14354), (7080, 14362), (9616, 14320), (9524, 14395), (9614, 14389), (9430, 14257), (9214, 14251), (9582, 14399)]
         : compromised: 0.6532, honest: 0.6686
         : sketchguard stats = ['Node 0: acc_rate=0.333', 'Node 1: acc_rate=0.233', 'Node 2: acc_rate=0.200']...

=== FINAL RESULTS ===
Dataset: sent140, Nodes: 20, Graph: erdos, Aggregation: sketchguard
Attack: gaussian, 70.0% compromised
Final accuracy - Compromised: 0.6532, Honest: 0.6686
Overall test accuracy: mean=0.6578 ± 0.0384

=== Sketchguard SUMMARY ===
Node 0: acceptance=0.333
Node 1: acceptance=0.233
Node 2: acceptance=0.200
Node 3: acceptance=0.250
Node 4: acceptance=0.250
Node 5: acceptance=0.200
Node 6: acceptance=0.200
Node 7: acceptance=0.400
Node 8: acceptance=0.500
Node 9: acceptance=0.333
Node 10: acceptance=0.250
Node 11: acceptance=0.214
Node 12: acceptance=0.343
Node 13: acceptance=0.500
Node 14: acceptance=0.143
Node 15: acceptance=0.167
Node 16: acceptance=0.200
Node 17: acceptance=0.440
Node 18: acceptance=0.250
Node 19: acceptance=0.500

=== PARALLEL EXECUTION TIME (realistic for distributed system) ===
  COMMUNICATION (max across nodes):
    - Sketch transfer: 0.000s (0.0%)
    - Model fetch (accepted): 0.000s (0.0%)
  COMPUTATION (max across nodes):
    - Sketching: 0.218s (95.4%)
    - Filtering: 0.001s (0.4%)
    - Aggregation: 0.010s (4.2%)
  TOTALS:
    - Total computation: 0.229s (100.0%)
    - Total communication: 0.000s (0.0%)
    - Total parallel time: 0.229s

=== PER-NODE AVERAGE TIME ===
  - Sketching: 0.171s
  - Filtering: 0.000s
  - Aggregation: 0.007s
  - Sketch transfer: 0.000s
  - Model fetch: 0.000s
  - Total per node: 0.178s

=== TOTAL COMPUTATIONAL WORK (sum across all nodes) ===
  - Total sketching: 3.413s
  - Total filtering: 0.008s
  - Total aggregation: 0.131s
  - Total sketch transfer: 0.000s
  - Total model fetch: 0.000s
  - Grand total: 3.552s
  - Mean acceptance rate: 0.295

Sketchguard Algorithm Properties:
  - Original dimension: 1,174,986
  - Sketch size: 180
  - Compression ratio: 19.9x
  - Single repetition: No repetitions needed
  - Theoretical complexity: O(d + N×k)
  - Approach: Sketch filtering + state aggregation
