Device: cuda
Seed: 987654321
Loading 1 LEAF Sent140 train files...
LEAF Sent140 train: 254555 users, 908652 samples
Building vocabulary (max_size=10000)...
Vocabulary size: 10000
Loading 1 LEAF Sent140 test files...
LEAF Sent140 test: 254555 users, 286281 samples
Found 254555 train users, 254555 test users, 254555 common users
User sample counts range: 494 (max) to 1 (min)
Distributed ALL 254555 users across 20 clients
Users per client: 12727 (with 15 clients getting +1 user)
Train partition sizes: [44353, 44290, 44657, 44907, 44696, 45843, 45801, 45619, 45069, 45639, 45821, 45311, 45779, 46056, 45625, 45984, 46428, 44737, 45540, 46497]
Test partition sizes: [14232, 14235, 14266, 14217, 14238, 14373, 14346, 14334, 14294, 14373, 14344, 14302, 14354, 14362, 14320, 14395, 14389, 14257, 14251, 14399]
  Client 0: 44353 train samples, 2 unique classes
  Client 1: 44290 train samples, 2 unique classes
  Client 2: 44657 train samples, 2 unique classes
  Client 3: 44907 train samples, 2 unique classes
  Client 4: 44696 train samples, 2 unique classes
  Client 5: 45843 train samples, 2 unique classes
  Client 6: 45801 train samples, 2 unique classes
  Client 7: 45619 train samples, 2 unique classes
  Client 8: 45069 train samples, 2 unique classes
  Client 9: 45639 train samples, 2 unique classes
  Client 10: 45821 train samples, 2 unique classes
  Client 11: 45311 train samples, 2 unique classes
  Client 12: 45779 train samples, 2 unique classes
  Client 13: 46056 train samples, 2 unique classes
  Client 14: 45625 train samples, 2 unique classes
  Client 15: 45984 train samples, 2 unique classes
  Client 16: 46428 train samples, 2 unique classes
  Client 17: 44737 train samples, 2 unique classes
  Client 18: 45540 train samples, 2 unique classes
  Client 19: 46497 train samples, 2 unique classes
Will sample 4500 samples per client per epoch
Graph: erdos, nodes: 20, edges: 48
Degree statistics: avg=4.80, min=2, max=7
Attack: Compromised 12/20 nodes: [1, 2, 3, 5, 8, 11, 12, 13, 14, 15, 17, 18]
Attack type: backdoor, lambda: 1.0
Backdoor target label: 1, trigger size: 3
Model variant: baseline
Model parameters: 1,174,986
Initial test acc across nodes: mean=0.4953 ± 0.0174
Backdoor attack: Created poisoned datasets for 12 compromised nodes
Round 001: test acc mean=0.5004 ± 0.0062 | min=0.4890 max=0.5154
         : test loss mean=10.9036 ± 10.6983
         : individual accs = ['0.510259', '0.499473', '0.498528', '0.515439', '0.504706', '0.504348', '0.500558', '0.489047', '0.501679', '0.496695', '0.492262', '0.496084', '0.502160', '0.507241', '0.497975', '0.496700', '0.504483', '0.492179', '0.502070', '0.495729']
         : correct/total = [(7262, 14232), (7110, 14235), (7112, 14266), (7328, 14217), (7186, 14238), (7249, 14373), (7181, 14346), (7010, 14334), (7171, 14294), (7139, 14373), (7061, 14344), (7095, 14302), (7208, 14354), (7285, 14362), (7131, 14320), (7150, 14395), (7259, 14389), (7017, 14257), (7155, 14251), (7138, 14399)]
         : compromised: 0.5012, honest: 0.4992
Round 002: test acc mean=0.5057 ± 0.0046 | min=0.4975 max=0.5158
         : test loss mean=26.7516 ± 36.3827
         : individual accs = ['0.504848', '0.515771', '0.512898', '0.512063', '0.503652', '0.504279', '0.500697', '0.506279', '0.503638', '0.508175', '0.501185', '0.511187', '0.497492', '0.506824', '0.508170', '0.502327', '0.506498', '0.502841', '0.504807', '0.499757']
         : correct/total = [(7185, 14232), (7342, 14235), (7317, 14266), (7280, 14217), (7171, 14238), (7248, 14373), (7183, 14346), (7257, 14334), (7199, 14294), (7304, 14373), (7189, 14344), (7311, 14302), (7141, 14354), (7279, 14362), (7277, 14320), (7231, 14395), (7288, 14389), (7169, 14257), (7194, 14251), (7196, 14399)]
         : compromised: 0.5069, honest: 0.5039
Round 003: test acc mean=0.5063 ± 0.0046 | min=0.5001 max=0.5171
         : test loss mean=29.5572 ± 76.6956
         : individual accs = ['0.511031', '0.517106', '0.512758', '0.515369', '0.506040', '0.504209', '0.500139', '0.507465', '0.501819', '0.504905', '0.501603', '0.506642', '0.501254', '0.507589', '0.507402', '0.502188', '0.507401', '0.504664', '0.503894', '0.501979']
         : correct/total = [(7273, 14232), (7361, 14235), (7315, 14266), (7327, 14217), (7205, 14238), (7247, 14373), (7175, 14346), (7274, 14334), (7173, 14294), (7257, 14373), (7195, 14344), (7246, 14302), (7195, 14354), (7290, 14362), (7266, 14320), (7229, 14395), (7301, 14389), (7195, 14257), (7181, 14251), (7228, 14399)]
         : compromised: 0.5071, honest: 0.5051
Round 004: test acc mean=0.5057 ± 0.0048 | min=0.4971 max=0.5170
         : test loss mean=28.1557 ± 11.5244
         : individual accs = ['0.507378', '0.516965', '0.513108', '0.515088', '0.505478', '0.504140', '0.500139', '0.507255', '0.501749', '0.504696', '0.501603', '0.506013', '0.497144', '0.504108', '0.507402', '0.502188', '0.507610', '0.504664', '0.504386', '0.501910']
         : correct/total = [(7221, 14232), (7359, 14235), (7320, 14266), (7323, 14217), (7197, 14238), (7246, 14373), (7175, 14346), (7271, 14334), (7172, 14294), (7254, 14373), (7195, 14344), (7237, 14302), (7136, 14354), (7240, 14362), (7266, 14320), (7229, 14395), (7304, 14389), (7195, 14257), (7188, 14251), (7227, 14399)]
         : compromised: 0.5064, honest: 0.5045
Round 005: test acc mean=0.5056 ± 0.0048 | min=0.4971 max=0.5170
         : test loss mean=15.2069 ± 4.6180
         : individual accs = ['0.507307', '0.516965', '0.513178', '0.515017', '0.503652', '0.502331', '0.500697', '0.507186', '0.501749', '0.504766', '0.501534', '0.506153', '0.497144', '0.504735', '0.507961', '0.502536', '0.507123', '0.504664', '0.505228', '0.501840']
         : correct/total = [(7220, 14232), (7359, 14235), (7321, 14266), (7322, 14217), (7171, 14238), (7220, 14373), (7183, 14346), (7270, 14334), (7172, 14294), (7255, 14373), (7194, 14344), (7239, 14302), (7136, 14354), (7249, 14362), (7274, 14320), (7234, 14395), (7297, 14389), (7195, 14257), (7200, 14251), (7226, 14399)]
         : compromised: 0.5065, honest: 0.5043
Round 006: test acc mean=0.5054 ± 0.0050 | min=0.4971 max=0.5170
         : test loss mean=44.9563 ± 25.1924
         : individual accs = ['0.507378', '0.516965', '0.512968', '0.515088', '0.505478', '0.504418', '0.500209', '0.507255', '0.500630', '0.505392', '0.501673', '0.505733', '0.497144', '0.498607', '0.507402', '0.502258', '0.507471', '0.504664', '0.504386', '0.502118']
         : correct/total = [(7221, 14232), (7359, 14235), (7318, 14266), (7323, 14217), (7197, 14238), (7250, 14373), (7176, 14346), (7271, 14334), (7156, 14294), (7264, 14373), (7196, 14344), (7233, 14302), (7136, 14354), (7161, 14362), (7266, 14320), (7230, 14395), (7302, 14389), (7195, 14257), (7188, 14251), (7230, 14399)]
         : compromised: 0.5059, honest: 0.5046
Round 007: test acc mean=0.5057 ± 0.0048 | min=0.4971 max=0.5170
         : test loss mean=20.9175 ± 22.5910
         : individual accs = ['0.507378', '0.516965', '0.513248', '0.515088', '0.505057', '0.503374', '0.500209', '0.506767', '0.502379', '0.504766', '0.501394', '0.506293', '0.497144', '0.506058', '0.507402', '0.502258', '0.507610', '0.504524', '0.504315', '0.501910']
         : correct/total = [(7221, 14232), (7359, 14235), (7322, 14266), (7323, 14217), (7191, 14238), (7235, 14373), (7176, 14346), (7264, 14334), (7181, 14294), (7255, 14373), (7192, 14344), (7241, 14302), (7136, 14354), (7268, 14362), (7266, 14320), (7230, 14395), (7304, 14389), (7193, 14257), (7187, 14251), (7227, 14399)]
         : compromised: 0.5066, honest: 0.5044
Round 008: test acc mean=0.4972 ± 0.0091 | min=0.4756 max=0.5168
         : test loss mean=21.0456 ± 14.6371
         : individual accs = ['0.475618', '0.516754', '0.487242', '0.495252', '0.494451', '0.495860', '0.499721', '0.491070', '0.498181', '0.495373', '0.497421', '0.493707', '0.511216', '0.503551', '0.492458', '0.499896', '0.492599', '0.510486', '0.487685', '0.505313']
         : correct/total = [(6769, 14232), (7356, 14235), (6951, 14266), (7041, 14217), (7040, 14238), (7127, 14373), (7169, 14346), (7039, 14334), (7121, 14294), (7120, 14373), (7135, 14344), (7061, 14302), (7338, 14354), (7232, 14362), (7052, 14320), (7196, 14395), (7088, 14389), (7278, 14257), (6950, 14251), (7276, 14399)]
         : compromised: 0.4994, honest: 0.4939
Round 009: test acc mean=0.4943 ± 0.0048 | min=0.4829 max=0.5029
         : test loss mean=10.6656 ± 6.3965
         : individual accs = ['0.492622', '0.482894', '0.486822', '0.485475', '0.494522', '0.496695', '0.499791', '0.492745', '0.498251', '0.495234', '0.498745', '0.494197', '0.502856', '0.492271', '0.492598', '0.497673', '0.492529', '0.495406', '0.495895', '0.498576']
         : correct/total = [(7011, 14232), (6874, 14235), (6945, 14266), (6902, 14217), (7041, 14238), (7139, 14373), (7170, 14346), (7063, 14334), (7122, 14294), (7118, 14373), (7154, 14344), (7068, 14302), (7218, 14354), (7070, 14362), (7054, 14320), (7164, 14395), (7087, 14389), (7063, 14257), (7067, 14251), (7179, 14399)]
         : compromised: 0.4934, honest: 0.4956
Round 010: test acc mean=0.4950 ± 0.0050 | min=0.4830 max=0.5031
         : test loss mean=19.5534 ± 11.4685
         : individual accs = ['0.492622', '0.483035', '0.491729', '0.484912', '0.494522', '0.494608', '0.499721', '0.492745', '0.500700', '0.495791', '0.499303', '0.493847', '0.502856', '0.503133', '0.492668', '0.497603', '0.492043', '0.495336', '0.495544', '0.496840']
         : correct/total = [(7011, 14232), (6876, 14235), (7015, 14266), (6894, 14217), (7041, 14238), (7109, 14373), (7169, 14346), (7063, 14334), (7157, 14294), (7126, 14373), (7162, 14344), (7063, 14302), (7218, 14354), (7226, 14362), (7055, 14320), (7163, 14395), (7080, 14389), (7062, 14257), (7062, 14251), (7154, 14399)]
         : compromised: 0.4947, honest: 0.4954

=== FINAL RESULTS ===
Dataset: sent140, Nodes: 20, Graph: erdos, Aggregation: krum
Attack: backdoor, 60.0% compromised
Final accuracy - Compromised: 0.4947, Honest: 0.4954
Overall test accuracy: mean=0.4950 ± 0.0050

=== BACKDOOR ATTACK SUCCESS RATE (ASR) ===
Target label: 1
Trigger size: 3x3
Overall ASR: 0.9583 ± 0.1011
Honest nodes ASR: 0.9863 ± 0.0316
Compromised nodes ASR: 0.9396 ± 0.1245
Note: Higher ASR indicates more successful backdoor attack
