Device: cuda
Seed: 987654321
Loading 1 LEAF Sent140 train files...
LEAF Sent140 train: 254555 users, 908652 samples
Building vocabulary (max_size=10000)...
Vocabulary size: 10000
Loading 1 LEAF Sent140 test files...
LEAF Sent140 test: 254555 users, 286281 samples
Found 254555 train users, 254555 test users, 254555 common users
User sample counts range: 494 (max) to 1 (min)
Distributed ALL 254555 users across 20 clients
Users per client: 12727 (with 15 clients getting +1 user)
Train partition sizes: [44353, 44290, 44657, 44907, 44696, 45843, 45801, 45619, 45069, 45639, 45821, 45311, 45779, 46056, 45625, 45984, 46428, 44737, 45540, 46497]
Test partition sizes: [14232, 14235, 14266, 14217, 14238, 14373, 14346, 14334, 14294, 14373, 14344, 14302, 14354, 14362, 14320, 14395, 14389, 14257, 14251, 14399]
  Client 0: 44353 train samples, 2 unique classes
  Client 1: 44290 train samples, 2 unique classes
  Client 2: 44657 train samples, 2 unique classes
  Client 3: 44907 train samples, 2 unique classes
  Client 4: 44696 train samples, 2 unique classes
  Client 5: 45843 train samples, 2 unique classes
  Client 6: 45801 train samples, 2 unique classes
  Client 7: 45619 train samples, 2 unique classes
  Client 8: 45069 train samples, 2 unique classes
  Client 9: 45639 train samples, 2 unique classes
  Client 10: 45821 train samples, 2 unique classes
  Client 11: 45311 train samples, 2 unique classes
  Client 12: 45779 train samples, 2 unique classes
  Client 13: 46056 train samples, 2 unique classes
  Client 14: 45625 train samples, 2 unique classes
  Client 15: 45984 train samples, 2 unique classes
  Client 16: 46428 train samples, 2 unique classes
  Client 17: 44737 train samples, 2 unique classes
  Client 18: 45540 train samples, 2 unique classes
  Client 19: 46497 train samples, 2 unique classes
Will sample 4500 samples per client per epoch
Graph: erdos, nodes: 20, edges: 126
Degree statistics: avg=12.60, min=8, max=16
Attack: Compromised 8/20 nodes: [1, 5, 11, 12, 13, 14, 17, 18]
Attack type: backdoor, lambda: 1.0
Backdoor target label: 1, trigger size: 3
Model variant: baseline
Model parameters: 1,174,986
Initial test acc across nodes: mean=0.4953 ± 0.0174
Backdoor attack: Created poisoned datasets for 8 compromised nodes
Round 001: test acc mean=0.5030 ± 0.0079 | min=0.4883 max=0.5200
         : test loss mean=3.8999 ± 1.2049
         : individual accs = ['0.506816', '0.504742', '0.507010', '0.520011', '0.507937', '0.505740', '0.505089', '0.488349', '0.496292', '0.517707', '0.501603', '0.506433', '0.498049', '0.494012', '0.497346', '0.494130', '0.512753', '0.500736', '0.499684', '0.494618']
         : correct/total = [(7213, 14232), (7185, 14235), (7233, 14266), (7393, 14217), (7232, 14238), (7269, 14373), (7246, 14346), (7000, 14334), (7094, 14294), (7441, 14373), (7195, 14344), (7243, 14302), (7149, 14354), (7095, 14362), (7122, 14320), (7113, 14395), (7378, 14389), (7139, 14257), (7121, 14251), (7122, 14399)]
         : compromised: 0.5008, honest: 0.5044
Round 002: test acc mean=0.4983 ± 0.0062 | min=0.4883 max=0.5069
         : test loss mean=2.7537 ± 0.5570
         : individual accs = ['0.506886', '0.488303', '0.489415', '0.488992', '0.498033', '0.500522', '0.500976', '0.488628', '0.505457', '0.497739', '0.498466', '0.490281', '0.505225', '0.505222', '0.494344', '0.504411', '0.504552', '0.501087', '0.499825', '0.498298']
         : correct/total = [(7214, 14232), (6951, 14235), (6982, 14266), (6952, 14217), (7091, 14238), (7194, 14373), (7187, 14346), (7004, 14334), (7225, 14294), (7154, 14373), (7150, 14344), (7012, 14302), (7252, 14354), (7256, 14362), (7079, 14320), (7261, 14395), (7260, 14389), (7144, 14257), (7123, 14251), (7175, 14399)]
         : compromised: 0.4981, honest: 0.4985
Round 003: test acc mean=0.5030 ± 0.0105 | min=0.4799 max=0.5192
         : test loss mean=2.2992 ± 0.3904
         : individual accs = ['0.491779', '0.506990', '0.511005', '0.485686', '0.479913', '0.502122', '0.519169', '0.504604', '0.513992', '0.493286', '0.498536', '0.504615', '0.519228', '0.503203', '0.502514', '0.494130', '0.516992', '0.506698', '0.495755', '0.509410']
         : correct/total = [(6999, 14232), (7217, 14235), (7290, 14266), (6905, 14217), (6833, 14238), (7217, 14373), (7448, 14346), (7233, 14334), (7347, 14294), (7090, 14373), (7151, 14344), (7217, 14302), (7453, 14354), (7227, 14362), (7196, 14320), (7113, 14395), (7439, 14389), (7224, 14257), (7065, 14251), (7335, 14399)]
         : compromised: 0.5051, honest: 0.5015
Round 004: test acc mean=0.5067 ± 0.0059 | min=0.4888 max=0.5145
         : test loss mean=2.8738 ± 0.4665
         : individual accs = ['0.506254', '0.506639', '0.514019', '0.511500', '0.514539', '0.512906', '0.510595', '0.507046', '0.504617', '0.488833', '0.505508', '0.509299', '0.497144', '0.501671', '0.510335', '0.504064', '0.507471', '0.508171', '0.502491', '0.511424']
         : correct/total = [(7205, 14232), (7212, 14235), (7333, 14266), (7272, 14217), (7326, 14238), (7372, 14373), (7325, 14346), (7268, 14334), (7213, 14294), (7026, 14373), (7251, 14344), (7284, 14302), (7136, 14354), (7205, 14362), (7308, 14320), (7256, 14395), (7302, 14389), (7245, 14257), (7161, 14251), (7364, 14399)]
         : compromised: 0.5061, honest: 0.5072
Round 005: test acc mean=0.5072 ± 0.0054 | min=0.4957 max=0.5169
         : test loss mean=18.8523 ± 3.5761
         : individual accs = ['0.507940', '0.516895', '0.515982', '0.514525', '0.504003', '0.506923', '0.507459', '0.512697', '0.503568', '0.512697', '0.501046', '0.502587', '0.499582', '0.495683', '0.509637', '0.504481', '0.509000', '0.508312', '0.505508', '0.505660']
         : correct/total = [(7229, 14232), (7358, 14235), (7361, 14266), (7315, 14217), (7176, 14238), (7286, 14373), (7280, 14346), (7349, 14334), (7198, 14294), (7369, 14373), (7187, 14344), (7188, 14302), (7171, 14354), (7119, 14362), (7298, 14320), (7262, 14395), (7324, 14389), (7247, 14257), (7204, 14251), (7281, 14399)]
         : compromised: 0.5056, honest: 0.5083
Round 006: test acc mean=0.5051 ± 0.0055 | min=0.4932 max=0.5170
         : test loss mean=156.3042 ± 30.0598
         : individual accs = ['0.507378', '0.516965', '0.513038', '0.515088', '0.505478', '0.504140', '0.500209', '0.507255', '0.501819', '0.504766', '0.501603', '0.506153', '0.497144', '0.493176', '0.507402', '0.502327', '0.507471', '0.504664', '0.504386', '0.501910']
         : correct/total = [(7221, 14232), (7359, 14235), (7319, 14266), (7323, 14217), (7197, 14238), (7246, 14373), (7176, 14346), (7271, 14334), (7173, 14294), (7255, 14373), (7195, 14344), (7239, 14302), (7136, 14354), (7083, 14362), (7266, 14320), (7231, 14395), (7302, 14389), (7195, 14257), (7188, 14251), (7227, 14399)]
         : compromised: 0.5043, honest: 0.5057
Round 007: test acc mean=0.5051 ± 0.0056 | min=0.4932 max=0.5170
         : test loss mean=146.6033 ± 30.8338
         : individual accs = ['0.507378', '0.516965', '0.513669', '0.515299', '0.505478', '0.503096', '0.499721', '0.506349', '0.501679', '0.504766', '0.501603', '0.506642', '0.497144', '0.493246', '0.507402', '0.502327', '0.507401', '0.504664', '0.504456', '0.501840']
         : correct/total = [(7221, 14232), (7359, 14235), (7328, 14266), (7326, 14217), (7197, 14238), (7231, 14373), (7169, 14346), (7258, 14334), (7171, 14294), (7255, 14373), (7195, 14344), (7246, 14302), (7136, 14354), (7084, 14362), (7266, 14320), (7231, 14395), (7301, 14389), (7195, 14257), (7189, 14251), (7226, 14399)]
         : compromised: 0.5042, honest: 0.5056
Round 008: test acc mean=0.4951 ± 0.0053 | min=0.4869 max=0.5030
         : test loss mean=21.9362 ± 11.2266
         : individual accs = ['0.497470', '0.498279', '0.494112', '0.502989', '0.501405', '0.497530', '0.491775', '0.488001', '0.497272', '0.501009', '0.486893', '0.488253', '0.489062', '0.501044', '0.499930', '0.487183', '0.490444', '0.495055', '0.501579', '0.493437']
         : correct/total = [(7080, 14232), (7093, 14235), (7049, 14266), (7151, 14217), (7139, 14238), (7151, 14373), (7055, 14346), (6995, 14334), (7108, 14294), (7201, 14373), (6984, 14344), (6983, 14302), (7020, 14354), (7196, 14362), (7159, 14320), (7013, 14395), (7057, 14389), (7058, 14257), (7148, 14251), (7105, 14399)]
         : compromised: 0.4963, honest: 0.4943
Round 009: test acc mean=0.4961 ± 0.0052 | min=0.4844 max=0.5073
         : test loss mean=28.6449 ± 9.5186
         : individual accs = ['0.492833', '0.484440', '0.487873', '0.489344', '0.495294', '0.496904', '0.499721', '0.492186', '0.500280', '0.496626', '0.500349', '0.495245', '0.503344', '0.507311', '0.496020', '0.500868', '0.492807', '0.495756', '0.496316', '0.499132']
         : correct/total = [(7014, 14232), (6896, 14235), (6960, 14266), (6957, 14217), (7052, 14238), (7142, 14373), (7169, 14346), (7055, 14334), (7151, 14294), (7138, 14373), (7177, 14344), (7083, 14302), (7225, 14354), (7286, 14362), (7103, 14320), (7210, 14395), (7091, 14389), (7068, 14257), (7073, 14251), (7187, 14399)]
         : compromised: 0.4969, honest: 0.4956
Round 010: test acc mean=0.4937 ± 0.0061 | min=0.4831 max=0.5073
         : test loss mean=26.0274 ± 7.1277
         : individual accs = ['0.491849', '0.483105', '0.483878', '0.484842', '0.492906', '0.494886', '0.499512', '0.485070', '0.493983', '0.495582', '0.495538', '0.490701', '0.502856', '0.507311', '0.493087', '0.497812', '0.491278', '0.495406', '0.495614', '0.499201']
         : correct/total = [(7000, 14232), (6877, 14235), (6903, 14266), (6893, 14217), (7018, 14238), (7113, 14373), (7166, 14346), (6953, 14334), (7061, 14294), (7123, 14373), (7108, 14344), (7018, 14302), (7218, 14354), (7286, 14362), (7061, 14320), (7166, 14395), (7069, 14389), (7063, 14257), (7063, 14251), (7188, 14399)]
         : compromised: 0.4954, honest: 0.4926

=== FINAL RESULTS ===
Dataset: sent140, Nodes: 20, Graph: erdos, Aggregation: d-fedavg
Attack: backdoor, 40.0% compromised
Final accuracy - Compromised: 0.4954, Honest: 0.4926
Overall test accuracy: mean=0.4937 ± 0.0061

=== BACKDOOR ATTACK SUCCESS RATE (ASR) ===
Target label: 1
Trigger size: 3x3
Overall ASR: 0.9580 ± 0.0266
Honest nodes ASR: 0.9571 ± 0.0195
Compromised nodes ASR: 0.9592 ± 0.0346
Note: Higher ASR indicates more successful backdoor attack
