Device: cuda
Seed: 987654321
Loading 1 LEAF Sent140 train files...
LEAF Sent140 train: 254555 users, 908652 samples
Building vocabulary (max_size=10000)...
Vocabulary size: 10000
Loading 1 LEAF Sent140 test files...
LEAF Sent140 test: 254555 users, 286281 samples
Found 254555 train users, 254555 test users, 254555 common users
User sample counts range: 494 (max) to 1 (min)
Distributed ALL 254555 users across 20 clients
Users per client: 12727 (with 15 clients getting +1 user)
Train partition sizes: [44353, 44290, 44657, 44907, 44696, 45843, 45801, 45619, 45069, 45639, 45821, 45311, 45779, 46056, 45625, 45984, 46428, 44737, 45540, 46497]
Test partition sizes: [14232, 14235, 14266, 14217, 14238, 14373, 14346, 14334, 14294, 14373, 14344, 14302, 14354, 14362, 14320, 14395, 14389, 14257, 14251, 14399]
  Client 0: 44353 train samples, 2 unique classes
  Client 1: 44290 train samples, 2 unique classes
  Client 2: 44657 train samples, 2 unique classes
  Client 3: 44907 train samples, 2 unique classes
  Client 4: 44696 train samples, 2 unique classes
  Client 5: 45843 train samples, 2 unique classes
  Client 6: 45801 train samples, 2 unique classes
  Client 7: 45619 train samples, 2 unique classes
  Client 8: 45069 train samples, 2 unique classes
  Client 9: 45639 train samples, 2 unique classes
  Client 10: 45821 train samples, 2 unique classes
  Client 11: 45311 train samples, 2 unique classes
  Client 12: 45779 train samples, 2 unique classes
  Client 13: 46056 train samples, 2 unique classes
  Client 14: 45625 train samples, 2 unique classes
  Client 15: 45984 train samples, 2 unique classes
  Client 16: 46428 train samples, 2 unique classes
  Client 17: 44737 train samples, 2 unique classes
  Client 18: 45540 train samples, 2 unique classes
  Client 19: 46497 train samples, 2 unique classes
Will sample 4500 samples per client per epoch
Graph: fully, nodes: 20, edges: 190
Degree statistics: avg=19.00, min=19, max=19
Attack: Compromised 8/20 nodes: [1, 5, 11, 12, 13, 14, 17, 18]
Attack type: backdoor, lambda: 1.0
Backdoor target label: 1, trigger size: 3
Model variant: baseline
Model parameters: 1,174,986
Initial test acc across nodes: mean=0.4953 ± 0.0174
Backdoor attack: Created poisoned datasets for 8 compromised nodes
Round 001: test acc mean=0.5000 ± 0.0058 | min=0.4870 max=0.5077
         : test loss mean=25.0444 ± 8.3757
         : individual accs = ['0.506464', '0.487039', '0.492990', '0.499121', '0.502669', '0.493077', '0.500418', '0.492814', '0.500979', '0.507062', '0.501394', '0.503985', '0.507733', '0.496449', '0.495670', '0.506704', '0.507540', '0.497861', '0.495474', '0.505105']
         : correct/total = [(7208, 14232), (6933, 14235), (7033, 14266), (7096, 14217), (7157, 14238), (7087, 14373), (7179, 14346), (7064, 14334), (7161, 14294), (7288, 14373), (7192, 14344), (7208, 14302), (7288, 14354), (7130, 14362), (7098, 14320), (7294, 14395), (7303, 14389), (7098, 14257), (7061, 14251), (7273, 14399)]
         : compromised: 0.4972, honest: 0.5019
Round 002: test acc mean=0.5053 ± 0.0047 | min=0.4980 max=0.5154
         : test loss mean=1.0439 ± 0.0085
         : individual accs = ['0.502178', '0.514436', '0.510444', '0.515439', '0.506181', '0.502887', '0.498118', '0.505093', '0.501119', '0.510471', '0.501952', '0.506642', '0.498049', '0.499513', '0.502933', '0.505940', '0.507610', '0.505716', '0.507964', '0.503785']
         : correct/total = [(7147, 14232), (7323, 14235), (7282, 14266), (7328, 14217), (7207, 14238), (7228, 14373), (7146, 14346), (7240, 14334), (7163, 14294), (7337, 14373), (7200, 14344), (7246, 14302), (7149, 14354), (7174, 14362), (7202, 14320), (7283, 14395), (7304, 14389), (7210, 14257), (7239, 14251), (7254, 14399)]
         : compromised: 0.5048, honest: 0.5057
Round 003: test acc mean=0.4949 ± 0.0055 | min=0.4831 max=0.5068
         : test loss mean=61.8803 ± 0.6535
         : individual accs = ['0.492622', '0.483105', '0.486962', '0.484912', '0.494522', '0.495860', '0.499791', '0.492745', '0.498251', '0.495234', '0.498397', '0.493847', '0.502856', '0.506824', '0.492598', '0.497742', '0.492529', '0.495336', '0.495614', '0.498090']
         : correct/total = [(7011, 14232), (6877, 14235), (6947, 14266), (6894, 14217), (7041, 14238), (7127, 14373), (7170, 14346), (7063, 14334), (7122, 14294), (7118, 14373), (7149, 14344), (7063, 14302), (7218, 14354), (7279, 14362), (7054, 14320), (7165, 14395), (7087, 14389), (7062, 14257), (7063, 14251), (7172, 14399)]
         : compromised: 0.4958, honest: 0.4943
Round 004: test acc mean=0.4949 ± 0.0055 | min=0.4830 max=0.5068
         : test loss mean=488.8690 ± 5.4186
         : individual accs = ['0.492622', '0.483035', '0.486962', '0.484912', '0.494522', '0.495860', '0.499791', '0.492745', '0.498181', '0.495234', '0.498397', '0.493847', '0.502856', '0.506824', '0.492598', '0.497742', '0.492529', '0.495336', '0.495614', '0.498090']
         : correct/total = [(7011, 14232), (6876, 14235), (6947, 14266), (6894, 14217), (7041, 14238), (7127, 14373), (7170, 14346), (7063, 14334), (7121, 14294), (7118, 14373), (7149, 14344), (7063, 14302), (7218, 14354), (7279, 14362), (7054, 14320), (7165, 14395), (7087, 14389), (7062, 14257), (7063, 14251), (7172, 14399)]
         : compromised: 0.4957, honest: 0.4943
Round 005: test acc mean=0.4949 ± 0.0055 | min=0.4830 max=0.5068
         : test loss mean=731.8896 ± 7.7417
         : individual accs = ['0.492622', '0.483035', '0.486962', '0.484912', '0.494522', '0.495860', '0.499791', '0.492745', '0.498181', '0.495234', '0.498397', '0.493847', '0.502856', '0.506824', '0.492598', '0.497742', '0.492529', '0.495336', '0.495614', '0.498090']
         : correct/total = [(7011, 14232), (6876, 14235), (6947, 14266), (6894, 14217), (7041, 14238), (7127, 14373), (7170, 14346), (7063, 14334), (7121, 14294), (7118, 14373), (7149, 14344), (7063, 14302), (7218, 14354), (7279, 14362), (7054, 14320), (7165, 14395), (7087, 14389), (7062, 14257), (7063, 14251), (7172, 14399)]
         : compromised: 0.4957, honest: 0.4943
Round 006: test acc mean=0.5011 ± 0.0032 | min=0.4937 max=0.5067
         : test loss mean=71.5141 ± 0.7838
         : individual accs = ['0.499438', '0.496874', '0.501472', '0.493705', '0.501756', '0.498991', '0.502858', '0.499372', '0.501189', '0.503583', '0.502649', '0.497763', '0.505573', '0.506684', '0.498115', '0.501771', '0.505803', '0.498492', '0.504175', '0.500868']
         : correct/total = [(7108, 14232), (7073, 14235), (7154, 14266), (7019, 14217), (7144, 14238), (7172, 14373), (7214, 14346), (7158, 14334), (7164, 14294), (7238, 14373), (7210, 14344), (7119, 14302), (7257, 14354), (7277, 14362), (7133, 14320), (7223, 14395), (7278, 14389), (7107, 14257), (7185, 14251), (7212, 14399)]
         : compromised: 0.5008, honest: 0.5012
Round 007: test acc mean=0.5046 ± 0.0054 | min=0.4924 max=0.5164
         : test loss mean=95.4401 ± 1.1213
         : individual accs = ['0.507870', '0.516403', '0.512267', '0.514525', '0.504144', '0.502539', '0.500488', '0.507325', '0.500210', '0.504627', '0.500627', '0.507551', '0.498049', '0.492411', '0.505936', '0.501633', '0.505525', '0.503051', '0.504105', '0.503160']
         : correct/total = [(7228, 14232), (7351, 14235), (7308, 14266), (7315, 14217), (7178, 14238), (7223, 14373), (7180, 14346), (7272, 14334), (7150, 14294), (7253, 14373), (7181, 14344), (7259, 14302), (7149, 14354), (7072, 14362), (7245, 14320), (7221, 14395), (7274, 14389), (7172, 14257), (7184, 14251), (7245, 14399)]
         : compromised: 0.5038, honest: 0.5052
Round 008: test acc mean=0.5041 ± 0.0052 | min=0.4939 max=0.5152
         : test loss mean=142.5730 ± 1.9182
         : individual accs = ['0.505551', '0.515209', '0.511426', '0.513399', '0.504565', '0.503096', '0.499582', '0.506418', '0.500909', '0.504140', '0.499442', '0.504545', '0.495681', '0.493942', '0.507332', '0.500452', '0.507818', '0.503682', '0.503193', '0.501771']
         : correct/total = [(7195, 14232), (7334, 14235), (7296, 14266), (7299, 14217), (7184, 14238), (7231, 14373), (7167, 14346), (7259, 14334), (7160, 14294), (7246, 14373), (7164, 14344), (7216, 14302), (7115, 14354), (7094, 14362), (7265, 14320), (7204, 14395), (7307, 14389), (7181, 14257), (7171, 14251), (7225, 14399)]
         : compromised: 0.5033, honest: 0.5046
Round 009: test acc mean=0.5024 ± 0.0058 | min=0.4894 max=0.5130
         : test loss mean=196.5476 ± 2.4737
         : individual accs = ['0.506183', '0.513031', '0.511075', '0.512063', '0.501686', '0.500383', '0.495609', '0.507255', '0.498741', '0.502470', '0.500209', '0.505034', '0.493242', '0.489417', '0.504330', '0.501007', '0.504344', '0.501438', '0.501158', '0.499410']
         : correct/total = [(7204, 14232), (7303, 14235), (7291, 14266), (7280, 14217), (7143, 14238), (7192, 14373), (7110, 14346), (7271, 14334), (7129, 14294), (7222, 14373), (7175, 14344), (7223, 14302), (7080, 14354), (7029, 14362), (7222, 14320), (7212, 14395), (7257, 14389), (7149, 14257), (7142, 14251), (7191, 14399)]
         : compromised: 0.5010, honest: 0.5033
Round 010: test acc mean=0.5052 ± 0.0053 | min=0.4927 max=0.5166
         : test loss mean=260.6291 ± 2.9330
         : individual accs = ['0.507448', '0.516614', '0.513038', '0.514314', '0.505549', '0.504418', '0.499512', '0.506628', '0.502449', '0.505601', '0.501185', '0.506083', '0.498398', '0.492689', '0.506704', '0.502327', '0.507540', '0.505296', '0.504245', '0.503507']
         : correct/total = [(7222, 14232), (7354, 14235), (7319, 14266), (7312, 14217), (7198, 14238), (7250, 14373), (7166, 14346), (7262, 14334), (7182, 14294), (7267, 14373), (7189, 14344), (7238, 14302), (7154, 14354), (7076, 14362), (7256, 14320), (7231, 14395), (7303, 14389), (7204, 14257), (7186, 14251), (7250, 14399)]
         : compromised: 0.5043, honest: 0.5058

=== FINAL RESULTS ===
Dataset: sent140, Nodes: 20, Graph: fully, Aggregation: krum
Attack: backdoor, 40.0% compromised
Final accuracy - Compromised: 0.5043, Honest: 0.5058
Overall test accuracy: mean=0.5052 ± 0.0053

=== BACKDOOR ATTACK SUCCESS RATE (ASR) ===
Target label: 1
Trigger size: 3x3
Overall ASR: 0.0004 ± 0.0001
Honest nodes ASR: 0.0004 ± 0.0001
Compromised nodes ASR: 0.0004 ± 0.0001
Note: Higher ASR indicates more successful backdoor attack
