Device: cuda
Seed: 987654321
Loading 1 LEAF Sent140 train files...
LEAF Sent140 train: 254555 users, 908652 samples
Building vocabulary (max_size=10000)...
Vocabulary size: 10000
Loading 1 LEAF Sent140 test files...
LEAF Sent140 test: 254555 users, 286281 samples
Found 254555 train users, 254555 test users, 254555 common users
User sample counts range: 494 (max) to 1 (min)
Distributed ALL 254555 users across 20 clients
Users per client: 12727 (with 15 clients getting +1 user)
Train partition sizes: [44353, 44290, 44657, 44907, 44696, 45843, 45801, 45619, 45069, 45639, 45821, 45311, 45779, 46056, 45625, 45984, 46428, 44737, 45540, 46497]
Test partition sizes: [14232, 14235, 14266, 14217, 14238, 14373, 14346, 14334, 14294, 14373, 14344, 14302, 14354, 14362, 14320, 14395, 14389, 14257, 14251, 14399]
  Client 0: 44353 train samples, 2 unique classes
  Client 1: 44290 train samples, 2 unique classes
  Client 2: 44657 train samples, 2 unique classes
  Client 3: 44907 train samples, 2 unique classes
  Client 4: 44696 train samples, 2 unique classes
  Client 5: 45843 train samples, 2 unique classes
  Client 6: 45801 train samples, 2 unique classes
  Client 7: 45619 train samples, 2 unique classes
  Client 8: 45069 train samples, 2 unique classes
  Client 9: 45639 train samples, 2 unique classes
  Client 10: 45821 train samples, 2 unique classes
  Client 11: 45311 train samples, 2 unique classes
  Client 12: 45779 train samples, 2 unique classes
  Client 13: 46056 train samples, 2 unique classes
  Client 14: 45625 train samples, 2 unique classes
  Client 15: 45984 train samples, 2 unique classes
  Client 16: 46428 train samples, 2 unique classes
  Client 17: 44737 train samples, 2 unique classes
  Client 18: 45540 train samples, 2 unique classes
  Client 19: 46497 train samples, 2 unique classes
Will sample 4500 samples per client per epoch
Graph: fully, nodes: 20, edges: 190
Degree statistics: avg=19.00, min=19, max=19
Attack: Compromised 12/20 nodes: [1, 2, 3, 5, 8, 11, 12, 13, 14, 15, 17, 18]
Attack type: krum, lambda: 1.0
Model variant: baseline
Model parameters: 1,174,986
Sketchguard Node 0:
  Model dim: 1,174,986 → Sketch size: 180
  Compression ratio: 6527.7x
  Using model parameters for aggregation, sketches for filtering
Sketchguard Node 1:
  Model dim: 1,174,986 → Sketch size: 180
  Compression ratio: 6527.7x
  Using model parameters for aggregation, sketches for filtering
Sketchguard Node 2:
  Model dim: 1,174,986 → Sketch size: 180
  Compression ratio: 6527.7x
  Using model parameters for aggregation, sketches for filtering
Sketchguard Node 3:
  Model dim: 1,174,986 → Sketch size: 180
  Compression ratio: 6527.7x
  Using model parameters for aggregation, sketches for filtering
Sketchguard Node 4:
  Model dim: 1,174,986 → Sketch size: 180
  Compression ratio: 6527.7x
  Using model parameters for aggregation, sketches for filtering
Sketchguard Node 5:
  Model dim: 1,174,986 → Sketch size: 180
  Compression ratio: 6527.7x
  Using model parameters for aggregation, sketches for filtering
Sketchguard Node 6:
  Model dim: 1,174,986 → Sketch size: 180
  Compression ratio: 6527.7x
  Using model parameters for aggregation, sketches for filtering
Sketchguard Node 7:
  Model dim: 1,174,986 → Sketch size: 180
  Compression ratio: 6527.7x
  Using model parameters for aggregation, sketches for filtering
Sketchguard Node 8:
  Model dim: 1,174,986 → Sketch size: 180
  Compression ratio: 6527.7x
  Using model parameters for aggregation, sketches for filtering
Sketchguard Node 9:
  Model dim: 1,174,986 → Sketch size: 180
  Compression ratio: 6527.7x
  Using model parameters for aggregation, sketches for filtering
Sketchguard Node 10:
  Model dim: 1,174,986 → Sketch size: 180
  Compression ratio: 6527.7x
  Using model parameters for aggregation, sketches for filtering
Sketchguard Node 11:
  Model dim: 1,174,986 → Sketch size: 180
  Compression ratio: 6527.7x
  Using model parameters for aggregation, sketches for filtering
Sketchguard Node 12:
  Model dim: 1,174,986 → Sketch size: 180
  Compression ratio: 6527.7x
  Using model parameters for aggregation, sketches for filtering
Sketchguard Node 13:
  Model dim: 1,174,986 → Sketch size: 180
  Compression ratio: 6527.7x
  Using model parameters for aggregation, sketches for filtering
Sketchguard Node 14:
  Model dim: 1,174,986 → Sketch size: 180
  Compression ratio: 6527.7x
  Using model parameters for aggregation, sketches for filtering
Sketchguard Node 15:
  Model dim: 1,174,986 → Sketch size: 180
  Compression ratio: 6527.7x
  Using model parameters for aggregation, sketches for filtering
Sketchguard Node 16:
  Model dim: 1,174,986 → Sketch size: 180
  Compression ratio: 6527.7x
  Using model parameters for aggregation, sketches for filtering
Sketchguard Node 17:
  Model dim: 1,174,986 → Sketch size: 180
  Compression ratio: 6527.7x
  Using model parameters for aggregation, sketches for filtering
Sketchguard Node 18:
  Model dim: 1,174,986 → Sketch size: 180
  Compression ratio: 6527.7x
  Using model parameters for aggregation, sketches for filtering
Sketchguard Node 19:
  Model dim: 1,174,986 → Sketch size: 180
  Compression ratio: 6527.7x
  Using model parameters for aggregation, sketches for filtering
Sketchguard ALGORITHM (Sketch-based Filtering + State Aggregation)
  - Model dimension: 1,174,986 parameters
  - Config: SketchguardConfig(gamma=2, kappa=1, alpha=0.5, min_neighbors=1, sketch_size=180, network_seed=987654321, attack_detection_window=5)
  - Sketch size: 180
  - Compression ratio: 6527.7x
  - Complexity: O(d + N×k) = O(1,174,986 + 20×180)
  - Theoretical speedup vs BALANCE: 19.9x
Initial test acc across nodes: mean=0.4953 ± 0.0174
Round 001: test acc mean=0.5035 ± 0.0118 | min=0.4815 max=0.5314
         : test loss mean=0.7229 ± 0.0216
         : individual accs = ['0.494941', '0.514226', '0.508972', '0.531406', '0.499438', '0.503583', '0.500627', '0.507255', '0.494263', '0.502261', '0.496305', '0.507831', '0.498885', '0.489904', '0.511802', '0.505731', '0.481479', '0.506839', '0.526910', '0.487048']
         : correct/total = [(7044, 14232), (7320, 14235), (7261, 14266), (7555, 14217), (7111, 14238), (7238, 14373), (7182, 14346), (7271, 14334), (7065, 14294), (7219, 14373), (7119, 14344), (7263, 14302), (7161, 14354), (7036, 14362), (7329, 14320), (7280, 14395), (6928, 14389), (7226, 14257), (7509, 14251), (7013, 14399)]
         : compromised: 0.5084, honest: 0.4962
         : sketchguard stats = ['Node 0: acc_rate=1.000', 'Node 1: acc_rate=1.000', 'Node 2: acc_rate=1.000']...
Round 002: test acc mean=0.5810 ± 0.0280 | min=0.5013 max=0.6134
         : test loss mean=0.7303 ± 0.2489
         : individual accs = ['0.597035', '0.529891', '0.567363', '0.577900', '0.567355', '0.566270', '0.581765', '0.610716', '0.580733', '0.613372', '0.607850', '0.597609', '0.501324', '0.592745', '0.559008', '0.596666', '0.608798', '0.561198', '0.602414', '0.600806']
         : correct/total = [(8497, 14232), (7543, 14235), (8094, 14266), (8216, 14217), (8078, 14238), (8139, 14373), (8346, 14346), (8754, 14334), (8301, 14294), (8816, 14373), (8719, 14344), (8547, 14302), (7196, 14354), (8513, 14362), (8005, 14320), (8589, 14395), (8760, 14389), (8001, 14257), (8585, 14251), (8651, 14399)]
         : compromised: 0.5694, honest: 0.5985
         : sketchguard stats = ['Node 0: acc_rate=0.684', 'Node 1: acc_rate=0.711', 'Node 2: acc_rate=0.711']...
Round 003: test acc mean=0.6072 ± 0.0363 | min=0.4643 max=0.6294
         : test loss mean=0.6585 ± 0.0117
         : individual accs = ['0.618114', '0.564875', '0.592738', '0.618696', '0.627757', '0.626035', '0.609438', '0.608274', '0.629355', '0.626800', '0.624094', '0.626626', '0.464331', '0.624217', '0.593296', '0.623828', '0.627076', '0.609806', '0.618413', '0.610459']
         : correct/total = [(8797, 14232), (8041, 14235), (8456, 14266), (8796, 14217), (8938, 14238), (8998, 14373), (8743, 14346), (8719, 14334), (8996, 14294), (9009, 14373), (8952, 14344), (8962, 14302), (6665, 14354), (8965, 14362), (8496, 14320), (8980, 14395), (9023, 14389), (8694, 14257), (8813, 14251), (8790, 14399)]
         : compromised: 0.5994, honest: 0.6190
         : sketchguard stats = ['Node 0: acc_rate=0.579', 'Node 1: acc_rate=0.614', 'Node 2: acc_rate=0.614']...
Round 004: test acc mean=0.6315 ± 0.0225 | min=0.5352 max=0.6455
         : test loss mean=0.6396 ± 0.0123
         : individual accs = ['0.633783', '0.632244', '0.635918', '0.633748', '0.634148', '0.633132', '0.639551', '0.629622', '0.643137', '0.638211', '0.635248', '0.630821', '0.535182', '0.637933', '0.636243', '0.637513', '0.644798', '0.638844', '0.634903', '0.645461']
         : correct/total = [(9020, 14232), (9000, 14235), (9072, 14266), (9010, 14217), (9029, 14238), (9100, 14373), (9175, 14346), (9025, 14334), (9193, 14294), (9173, 14373), (9112, 14344), (9022, 14302), (7682, 14354), (9162, 14362), (9111, 14320), (9177, 14395), (9278, 14389), (9108, 14257), (9048, 14251), (9294, 14399)]
         : compromised: 0.6275, honest: 0.6376
         : sketchguard stats = ['Node 0: acc_rate=0.526', 'Node 1: acc_rate=0.566', 'Node 2: acc_rate=0.566']...
Round 005: test acc mean=0.6482 ± 0.0044 | min=0.6413 max=0.6572
         : test loss mean=0.6255 ± 0.0043
         : individual accs = ['0.647203', '0.650299', '0.641315', '0.648871', '0.650583', '0.656996', '0.652586', '0.657179', '0.648314', '0.645168', '0.641801', '0.649140', '0.645256', '0.649770', '0.648743', '0.642445', '0.650636', '0.646770', '0.641639', '0.650253']
         : correct/total = [(9211, 14232), (9257, 14235), (9149, 14266), (9225, 14217), (9263, 14238), (9443, 14373), (9362, 14346), (9420, 14334), (9267, 14294), (9273, 14373), (9206, 14344), (9284, 14302), (9262, 14354), (9332, 14362), (9290, 14320), (9248, 14395), (9362, 14389), (9221, 14257), (9144, 14251), (9363, 14399)]
         : compromised: 0.6475, honest: 0.6494
         : sketchguard stats = ['Node 0: acc_rate=0.495', 'Node 1: acc_rate=0.537', 'Node 2: acc_rate=0.537']...
Round 006: test acc mean=0.6571 ± 0.0046 | min=0.6482 max=0.6655
         : test loss mean=0.6168 ± 0.0034
         : individual accs = ['0.656900', '0.662803', '0.648184', '0.660899', '0.663225', '0.660475', '0.660742', '0.665481', '0.654680', '0.654282', '0.650655', '0.652986', '0.653546', '0.657638', '0.654958', '0.657034', '0.658628', '0.654065', '0.651744', '0.662754']
         : correct/total = [(9349, 14232), (9435, 14235), (9247, 14266), (9396, 14217), (9443, 14238), (9493, 14373), (9479, 14346), (9539, 14334), (9358, 14294), (9404, 14373), (9333, 14344), (9339, 14302), (9381, 14354), (9445, 14362), (9379, 14320), (9458, 14395), (9477, 14389), (9325, 14257), (9288, 14251), (9543, 14399)]
         : compromised: 0.6558, honest: 0.6591
         : sketchguard stats = ['Node 0: acc_rate=0.474', 'Node 1: acc_rate=0.518', 'Node 2: acc_rate=0.518']...
Round 007: test acc mean=0.6622 ± 0.0051 | min=0.6506 max=0.6699
         : test loss mean=0.6108 ± 0.0046
         : individual accs = ['0.659781', '0.669898', '0.650568', '0.668777', '0.664981', '0.667293', '0.664227', '0.656760', '0.661606', '0.658596', '0.657418', '0.663124', '0.667828', '0.664392', '0.661872', '0.656617', '0.669192', '0.665498', '0.658270', '0.657546']
         : correct/total = [(9390, 14232), (9536, 14235), (9281, 14266), (9508, 14217), (9468, 14238), (9591, 14373), (9529, 14346), (9414, 14334), (9457, 14294), (9466, 14373), (9430, 14344), (9484, 14302), (9586, 14354), (9542, 14362), (9478, 14320), (9452, 14395), (9629, 14389), (9488, 14257), (9381, 14251), (9468, 14399)]
         : compromised: 0.6630, honest: 0.6611
         : sketchguard stats = ['Node 0: acc_rate=0.459', 'Node 1: acc_rate=0.504', 'Node 2: acc_rate=0.504']...
Round 008: test acc mean=0.6676 ± 0.0051 | min=0.6552 max=0.6752
         : test loss mean=0.6055 ± 0.0040
         : individual accs = ['0.665191', '0.667158', '0.655194', '0.669129', '0.670319', '0.674807', '0.672173', '0.670992', '0.669232', '0.666667', '0.668015', '0.663264', '0.666643', '0.668431', '0.660196', '0.670511', '0.668149', '0.673353', '0.658270', '0.675186']
         : correct/total = [(9467, 14232), (9497, 14235), (9347, 14266), (9513, 14217), (9544, 14238), (9699, 14373), (9643, 14346), (9618, 14334), (9566, 14294), (9582, 14373), (9582, 14344), (9486, 14302), (9569, 14354), (9600, 14362), (9454, 14320), (9652, 14395), (9614, 14389), (9600, 14257), (9381, 14251), (9722, 14399)]
         : compromised: 0.6663, honest: 0.6696
         : sketchguard stats = ['Node 0: acc_rate=0.447', 'Node 1: acc_rate=0.493', 'Node 2: acc_rate=0.493']...
Round 009: test acc mean=0.6654 ± 0.0097 | min=0.6430 max=0.6802
         : test loss mean=0.6055 ± 0.0075
         : individual accs = ['0.642988', '0.680225', '0.655194', '0.673982', '0.660205', '0.679608', '0.651680', '0.658714', '0.672940', '0.657135', '0.661461', '0.654524', '0.674655', '0.671076', '0.665712', '0.669608', '0.667663', '0.675949', '0.670199', '0.663935']
         : correct/total = [(9151, 14232), (9683, 14235), (9347, 14266), (9582, 14217), (9400, 14238), (9768, 14373), (9349, 14346), (9442, 14334), (9619, 14294), (9445, 14373), (9488, 14344), (9361, 14302), (9684, 14354), (9638, 14362), (9533, 14320), (9639, 14395), (9607, 14389), (9637, 14257), (9551, 14251), (9560, 14399)]
         : compromised: 0.6703, honest: 0.6580
         : sketchguard stats = ['Node 0: acc_rate=0.439', 'Node 1: acc_rate=0.485', 'Node 2: acc_rate=0.485']...
Round 010: test acc mean=0.6763 ± 0.0085 | min=0.6504 max=0.6852
         : test loss mean=0.5949 ± 0.0056
         : individual accs = ['0.674677', '0.685213', '0.650428', '0.682633', '0.683031', '0.684617', '0.684442', '0.682712', '0.674199', '0.669032', '0.674149', '0.673472', '0.683573', '0.681660', '0.673813', '0.662869', '0.680311', '0.682261', '0.670690', '0.672547']
         : correct/total = [(9602, 14232), (9754, 14235), (9279, 14266), (9705, 14217), (9725, 14238), (9840, 14373), (9819, 14346), (9786, 14334), (9637, 14294), (9616, 14373), (9670, 14344), (9632, 14302), (9812, 14354), (9790, 14362), (9649, 14320), (9542, 14395), (9789, 14389), (9727, 14257), (9558, 14251), (9684, 14399)]
         : compromised: 0.6755, honest: 0.6776
         : sketchguard stats = ['Node 0: acc_rate=0.432', 'Node 1: acc_rate=0.479', 'Node 2: acc_rate=0.479']...

=== FINAL RESULTS ===
Dataset: sent140, Nodes: 20, Graph: fully, Aggregation: sketchguard
Attack: krum, 60.0% compromised
Final accuracy - Compromised: 0.6755, Honest: 0.6776
Overall test accuracy: mean=0.6763 ± 0.0085

=== Sketchguard SUMMARY ===
Node 0: acceptance=0.432
Node 1: acceptance=0.479
Node 2: acceptance=0.479
Node 3: acceptance=0.479
Node 4: acceptance=0.432
Node 5: acceptance=0.479
Node 6: acceptance=0.432
Node 7: acceptance=0.432
Node 8: acceptance=0.479
Node 9: acceptance=0.432
Node 10: acceptance=0.432
Node 11: acceptance=0.479
Node 12: acceptance=0.537
Node 13: acceptance=0.479
Node 14: acceptance=0.479
Node 15: acceptance=0.479
Node 16: acceptance=0.432
Node 17: acceptance=0.479
Node 18: acceptance=0.479
Node 19: acceptance=0.432

=== PARALLEL EXECUTION TIME (realistic for distributed system) ===
  COMMUNICATION (max across nodes):
    - Sketch transfer: 0.000s (0.0%)
    - Model fetch (accepted): 0.000s (0.0%)
  COMPUTATION (max across nodes):
    - Sketching: 0.440s (94.6%)
    - Filtering: 0.001s (0.3%)
    - Aggregation: 0.024s (5.2%)
  TOTALS:
    - Total computation: 0.465s (100.0%)
    - Total communication: 0.000s (0.0%)
    - Total parallel time: 0.465s

=== PER-NODE AVERAGE TIME ===
  - Sketching: 0.384s
  - Filtering: 0.001s
  - Aggregation: 0.017s
  - Sketch transfer: 0.000s
  - Model fetch: 0.000s
  - Total per node: 0.402s

=== TOTAL COMPUTATIONAL WORK (sum across all nodes) ===
  - Total sketching: 7.679s
  - Total filtering: 0.016s
  - Total aggregation: 0.337s
  - Total sketch transfer: 0.000s
  - Total model fetch: 0.000s
  - Grand total: 8.032s
  - Mean acceptance rate: 0.463

Sketchguard Algorithm Properties:
  - Original dimension: 1,174,986
  - Sketch size: 180
  - Compression ratio: 19.9x
  - Single repetition: No repetitions needed
  - Theoretical complexity: O(d + N×k)
  - Approach: Sketch filtering + state aggregation
