Device: cuda
Seed: 987654321
Loading 1 LEAF Sent140 train files...
LEAF Sent140 train: 254555 users, 908652 samples
Building vocabulary (max_size=10000)...
Vocabulary size: 10000
Loading 1 LEAF Sent140 test files...
LEAF Sent140 test: 254555 users, 286281 samples
Found 254555 train users, 254555 test users, 254555 common users
User sample counts range: 494 (max) to 1 (min)
Distributed ALL 254555 users across 20 clients
Users per client: 12727 (with 15 clients getting +1 user)
Train partition sizes: [44353, 44290, 44657, 44907, 44696, 45843, 45801, 45619, 45069, 45639, 45821, 45311, 45779, 46056, 45625, 45984, 46428, 44737, 45540, 46497]
Test partition sizes: [14232, 14235, 14266, 14217, 14238, 14373, 14346, 14334, 14294, 14373, 14344, 14302, 14354, 14362, 14320, 14395, 14389, 14257, 14251, 14399]
  Client 0: 44353 train samples, 2 unique classes
  Client 1: 44290 train samples, 2 unique classes
  Client 2: 44657 train samples, 2 unique classes
  Client 3: 44907 train samples, 2 unique classes
  Client 4: 44696 train samples, 2 unique classes
  Client 5: 45843 train samples, 2 unique classes
  Client 6: 45801 train samples, 2 unique classes
  Client 7: 45619 train samples, 2 unique classes
  Client 8: 45069 train samples, 2 unique classes
  Client 9: 45639 train samples, 2 unique classes
  Client 10: 45821 train samples, 2 unique classes
  Client 11: 45311 train samples, 2 unique classes
  Client 12: 45779 train samples, 2 unique classes
  Client 13: 46056 train samples, 2 unique classes
  Client 14: 45625 train samples, 2 unique classes
  Client 15: 45984 train samples, 2 unique classes
  Client 16: 46428 train samples, 2 unique classes
  Client 17: 44737 train samples, 2 unique classes
  Client 18: 45540 train samples, 2 unique classes
  Client 19: 46497 train samples, 2 unique classes
Will sample 4500 samples per client per epoch
Graph: erdos, nodes: 20, edges: 48
Degree statistics: avg=4.80, min=2, max=7
Attack: Compromised 2/20 nodes: [5, 13]
Attack type: directed_deviation, lambda: 1.0
Model variant: baseline
Model parameters: 1,174,986
Initial test acc across nodes: mean=0.4953 ± 0.0174
Round 001: test acc mean=0.5048 ± 0.0080 | min=0.4852 max=0.5157
         : test loss mean=0.9056 ± 0.3742
         : individual accs = ['0.493255', '0.485213', '0.513038', '0.510375', '0.507164', '0.503931', '0.502161', '0.506069', '0.504687', '0.514367', '0.500906', '0.501678', '0.515745', '0.507729', '0.503701', '0.511150', '0.508027', '0.488602', '0.504386', '0.514272']
         : correct/total = [(7020, 14232), (6907, 14235), (7319, 14266), (7256, 14217), (7221, 14238), (7243, 14373), (7204, 14346), (7254, 14334), (7214, 14294), (7393, 14373), (7185, 14344), (7175, 14302), (7403, 14354), (7292, 14362), (7213, 14320), (7358, 14395), (7310, 14389), (6966, 14257), (7188, 14251), (7405, 14399)]
         : compromised: 0.5058, honest: 0.5047
Round 002: test acc mean=0.5018 ± 0.0118 | min=0.4803 max=0.5337
         : test loss mean=0.7876 ± 0.1559
         : individual accs = ['0.492622', '0.516965', '0.516403', '0.480270', '0.496207', '0.504348', '0.504322', '0.517790', '0.533720', '0.495721', '0.507111', '0.492239', '0.494566', '0.490113', '0.499581', '0.499687', '0.492529', '0.499053', '0.496527', '0.506424']
         : correct/total = [(7011, 14232), (7359, 14235), (7367, 14266), (6828, 14217), (7065, 14238), (7249, 14373), (7235, 14346), (7422, 14334), (7629, 14294), (7125, 14373), (7274, 14344), (7040, 14302), (7099, 14354), (7039, 14362), (7154, 14320), (7193, 14395), (7087, 14389), (7115, 14257), (7076, 14251), (7292, 14399)]
         : compromised: 0.4972, honest: 0.5023
Round 003: test acc mean=0.5088 ± 0.0178 | min=0.4926 max=0.5735
         : test loss mean=0.7219 ± 0.0799
         : individual accs = ['0.492622', '0.502002', '0.508271', '0.515228', '0.505408', '0.504140', '0.538478', '0.506697', '0.573457', '0.509219', '0.506414', '0.504615', '0.494009', '0.493176', '0.514246', '0.501146', '0.507818', '0.504384', '0.495614', '0.498090']
         : correct/total = [(7011, 14232), (7146, 14235), (7251, 14266), (7325, 14217), (7196, 14238), (7246, 14373), (7725, 14346), (7263, 14334), (8197, 14294), (7319, 14373), (7264, 14344), (7217, 14302), (7091, 14354), (7083, 14362), (7364, 14320), (7214, 14395), (7307, 14389), (7191, 14257), (7063, 14251), (7172, 14399)]
         : compromised: 0.4987, honest: 0.5099
Round 004: test acc mean=0.5151 ± 0.0289 | min=0.4830 max=0.6059
         : test loss mean=0.7383 ± 0.1339
         : individual accs = ['0.493325', '0.483035', '0.486962', '0.505240', '0.494522', '0.501565', '0.499791', '0.525603', '0.605919', '0.498435', '0.509063', '0.499511', '0.561028', '0.533839', '0.509707', '0.554568', '0.504205', '0.519675', '0.495614', '0.520314']
         : correct/total = [(7021, 14232), (6876, 14235), (6947, 14266), (7183, 14217), (7041, 14238), (7209, 14373), (7170, 14346), (7534, 14334), (8661, 14294), (7164, 14373), (7302, 14344), (7144, 14302), (8053, 14354), (7667, 14362), (7299, 14320), (7983, 14395), (7255, 14389), (7409, 14257), (7063, 14251), (7492, 14399)]
         : compromised: 0.5177, honest: 0.5148
Round 005: test acc mean=0.5477 ± 0.0396 | min=0.4926 max=0.6203
         : test loss mean=0.6949 ± 0.0273
         : individual accs = ['0.492622', '0.577590', '0.546755', '0.541675', '0.578171', '0.495652', '0.605326', '0.556788', '0.620260', '0.543658', '0.560653', '0.511327', '0.503762', '0.511280', '0.519204', '0.497812', '0.607478', '0.556779', '0.601221', '0.526773']
         : correct/total = [(7011, 14232), (8222, 14235), (7800, 14266), (7701, 14217), (8232, 14238), (7124, 14373), (8684, 14346), (7981, 14334), (8866, 14294), (7814, 14373), (8042, 14344), (7313, 14302), (7231, 14354), (7343, 14362), (7435, 14320), (7166, 14395), (8741, 14389), (7938, 14257), (8568, 14251), (7585, 14399)]
         : compromised: 0.5035, honest: 0.5527
Round 006: test acc mean=0.5680 ± 0.0479 | min=0.4945 max=0.6351
         : test loss mean=0.7093 ± 0.0867
         : individual accs = ['0.622892', '0.635054', '0.519697', '0.531336', '0.494522', '0.575176', '0.622125', '0.587763', '0.624668', '0.497182', '0.536252', '0.514683', '0.611049', '0.590308', '0.553771', '0.610976', '0.507610', '0.588483', '0.517087', '0.620043']
         : correct/total = [(8865, 14232), (9040, 14235), (7414, 14266), (7554, 14217), (7041, 14238), (8267, 14373), (8925, 14346), (8425, 14334), (8929, 14294), (7146, 14373), (7692, 14344), (7361, 14302), (8771, 14354), (8478, 14362), (7930, 14320), (8795, 14395), (7304, 14389), (8390, 14257), (7369, 14251), (8928, 14399)]
         : compromised: 0.5827, honest: 0.5664
Round 007: test acc mean=0.5801 ± 0.0411 | min=0.4962 max=0.6352
         : test loss mean=0.6762 ± 0.0233
         : individual accs = ['0.635188', '0.602388', '0.609281', '0.541816', '0.590041', '0.504975', '0.609438', '0.593554', '0.627606', '0.605302', '0.528305', '0.524542', '0.587153', '0.496240', '0.544763', '0.577562', '0.621516', '0.601108', '0.623956', '0.577193']
         : correct/total = [(9040, 14232), (8575, 14235), (8692, 14266), (7703, 14217), (8401, 14238), (7258, 14373), (8743, 14346), (8508, 14334), (8971, 14294), (8700, 14373), (7578, 14344), (7502, 14302), (8428, 14354), (7127, 14362), (7801, 14320), (8314, 14395), (8943, 14389), (8570, 14257), (8892, 14251), (8311, 14399)]
         : compromised: 0.5006, honest: 0.5889
Round 008: test acc mean=0.5829 ± 0.0466 | min=0.4952 max=0.6453
         : test loss mean=0.6928 ± 0.0689
         : individual accs = ['0.642847', '0.623253', '0.585658', '0.599564', '0.544950', '0.504140', '0.577513', '0.610786', '0.645306', '0.495234', '0.564417', '0.544260', '0.632367', '0.523534', '0.573254', '0.627301', '0.520537', '0.608052', '0.594064', '0.641572']
         : correct/total = [(9149, 14232), (8872, 14235), (8355, 14266), (8524, 14217), (7759, 14238), (7246, 14373), (8285, 14346), (8755, 14334), (9224, 14294), (7118, 14373), (8096, 14344), (7784, 14302), (9077, 14354), (7519, 14362), (8209, 14320), (9030, 14395), (7490, 14389), (8669, 14257), (8466, 14251), (9238, 14399)]
         : compromised: 0.5138, honest: 0.5906
Round 009: test acc mean=0.5984 ± 0.0449 | min=0.5247 max=0.6515
         : test loss mean=0.6719 ± 0.0358
         : individual accs = ['0.648749', '0.642712', '0.621758', '0.578955', '0.636466', '0.620191', '0.647846', '0.541370', '0.651532', '0.609546', '0.591327', '0.528597', '0.556848', '0.524718', '0.547207', '0.535047', '0.634234', '0.571649', '0.628868', '0.649906']
         : correct/total = [(9233, 14232), (9149, 14235), (8870, 14266), (8231, 14217), (9062, 14238), (8914, 14373), (9294, 14346), (7760, 14334), (9313, 14294), (8761, 14373), (8482, 14344), (7560, 14302), (7993, 14354), (7536, 14362), (7836, 14320), (7702, 14395), (9126, 14389), (8150, 14257), (8962, 14251), (9358, 14399)]
         : compromised: 0.5725, honest: 0.6013
Round 010: test acc mean=0.6109 ± 0.0323 | min=0.5485 max=0.6530
         : test loss mean=0.6832 ± 0.0766
         : individual accs = ['0.650436', '0.643765', '0.599047', '0.606316', '0.574940', '0.639254', '0.628119', '0.612041', '0.649993', '0.569540', '0.596417', '0.548525', '0.645325', '0.611057', '0.571508', '0.639458', '0.606366', '0.615347', '0.556733', '0.653031']
         : correct/total = [(9257, 14232), (9164, 14235), (8546, 14266), (8620, 14217), (8186, 14238), (9188, 14373), (9011, 14346), (8773, 14334), (9291, 14294), (8186, 14373), (8555, 14344), (7845, 14302), (9263, 14354), (8776, 14362), (8184, 14320), (9205, 14395), (8725, 14389), (8773, 14257), (7934, 14251), (9403, 14399)]
         : compromised: 0.6252, honest: 0.6093

=== FINAL RESULTS ===
Dataset: sent140, Nodes: 20, Graph: erdos, Aggregation: d-fedavg
Attack: directed_deviation, 10.0% compromised
Final accuracy - Compromised: 0.6252, Honest: 0.6093
Overall test accuracy: mean=0.6109 ± 0.0323
