Device: cuda
Seed: 987654321
Loading 1 LEAF Sent140 train files...
LEAF Sent140 train: 254555 users, 908652 samples
Building vocabulary (max_size=10000)...
Vocabulary size: 10000
Loading 1 LEAF Sent140 test files...
LEAF Sent140 test: 254555 users, 286281 samples
Found 254555 train users, 254555 test users, 254555 common users
User sample counts range: 494 (max) to 1 (min)
Distributed ALL 254555 users across 20 clients
Users per client: 12727 (with 15 clients getting +1 user)
Train partition sizes: [44353, 44290, 44657, 44907, 44696, 45843, 45801, 45619, 45069, 45639, 45821, 45311, 45779, 46056, 45625, 45984, 46428, 44737, 45540, 46497]
Test partition sizes: [14232, 14235, 14266, 14217, 14238, 14373, 14346, 14334, 14294, 14373, 14344, 14302, 14354, 14362, 14320, 14395, 14389, 14257, 14251, 14399]
  Client 0: 44353 train samples, 2 unique classes
  Client 1: 44290 train samples, 2 unique classes
  Client 2: 44657 train samples, 2 unique classes
  Client 3: 44907 train samples, 2 unique classes
  Client 4: 44696 train samples, 2 unique classes
  Client 5: 45843 train samples, 2 unique classes
  Client 6: 45801 train samples, 2 unique classes
  Client 7: 45619 train samples, 2 unique classes
  Client 8: 45069 train samples, 2 unique classes
  Client 9: 45639 train samples, 2 unique classes
  Client 10: 45821 train samples, 2 unique classes
  Client 11: 45311 train samples, 2 unique classes
  Client 12: 45779 train samples, 2 unique classes
  Client 13: 46056 train samples, 2 unique classes
  Client 14: 45625 train samples, 2 unique classes
  Client 15: 45984 train samples, 2 unique classes
  Client 16: 46428 train samples, 2 unique classes
  Client 17: 44737 train samples, 2 unique classes
  Client 18: 45540 train samples, 2 unique classes
  Client 19: 46497 train samples, 2 unique classes
Will sample 4500 samples per client per epoch
Graph: erdos, nodes: 20, edges: 99
Degree statistics: avg=9.90, min=7, max=14
Attack: Compromised 16/20 nodes: [1, 2, 3, 5, 6, 8, 9, 10, 11, 12, 13, 14, 15, 17, 18, 19]
Attack type: krum, lambda: 1.0
Model variant: baseline
Model parameters: 1,174,986
BALANCE algorithm:
Balance Config: BALANCEConfig(gamma=2, kappa=1, alpha=0.5, min_neighbors=1)
  - Model dimension: 1,174,986 parameters
  - Complexity: O(N×d) = O(20×1,174,986)
Initial test acc across nodes: mean=0.4953 ± 0.0174
Round 001: test acc mean=0.4993 ± 0.0072 | min=0.4890 max=0.5149
         : test loss mean=3.7722 ± 1.3416
         : individual accs = ['0.504075', '0.514858', '0.502243', '0.492509', '0.488973', '0.497739', '0.504252', '0.505163', '0.497971', '0.500383', '0.500558', '0.511187', '0.496586', '0.491575', '0.493017', '0.492879', '0.495587', '0.490145', '0.510982', '0.495521']
         : correct/total = [(7174, 14232), (7329, 14235), (7165, 14266), (7002, 14217), (6962, 14238), (7154, 14373), (7234, 14346), (7241, 14334), (7118, 14294), (7192, 14373), (7180, 14344), (7311, 14302), (7128, 14354), (7060, 14362), (7060, 14320), (7095, 14395), (7131, 14389), (6988, 14257), (7282, 14251), (7135, 14399)]
         : compromised: 0.4995, honest: 0.4984
Round 002: test acc mean=0.5034 ± 0.0104 | min=0.4757 max=0.5252
         : test loss mean=2.0096 ± 1.5130
         : individual accs = ['0.498946', '0.475729', '0.525165', '0.515510', '0.508428', '0.509219', '0.501673', '0.513185', '0.492095', '0.504975', '0.487172', '0.499091', '0.499094', '0.503203', '0.506564', '0.503230', '0.497880', '0.506909', '0.512596', '0.508299']
         : correct/total = [(7101, 14232), (6772, 14235), (7492, 14266), (7329, 14217), (7239, 14238), (7319, 14373), (7197, 14346), (7356, 14334), (7034, 14294), (7258, 14373), (6988, 14344), (7138, 14302), (7164, 14354), (7227, 14362), (7254, 14320), (7244, 14395), (7164, 14389), (7227, 14257), (7305, 14251), (7319, 14399)]
         : compromised: 0.5032, honest: 0.5046
Round 003: test acc mean=0.5024 ± 0.0087 | min=0.4877 max=0.5221
         : test loss mean=0.8186 ± 0.3398
         : individual accs = ['0.500000', '0.520618', '0.500280', '0.503833', '0.503020', '0.507966', '0.498536', '0.509976', '0.502309', '0.497252', '0.487800', '0.503146', '0.491640', '0.487745', '0.502165', '0.501702', '0.506359', '0.507751', '0.522139', '0.493854']
         : correct/total = [(7116, 14232), (7411, 14235), (7137, 14266), (7163, 14217), (7162, 14238), (7301, 14373), (7152, 14346), (7310, 14334), (7180, 14294), (7147, 14373), (6997, 14344), (7196, 14302), (7057, 14354), (7005, 14362), (7191, 14320), (7222, 14395), (7286, 14389), (7239, 14257), (7441, 14251), (7111, 14399)]
         : compromised: 0.5018, honest: 0.5048
Round 004: test acc mean=0.5264 ± 0.0185 | min=0.5009 max=0.5662
         : test loss mean=0.8121 ± 0.5056
         : individual accs = ['0.518550', '0.519494', '0.529160', '0.502778', '0.566161', '0.517220', '0.530740', '0.533278', '0.509375', '0.514854', '0.553054', '0.500909', '0.527797', '0.532586', '0.506983', '0.519069', '0.524637', '0.554044', '0.559680', '0.507813']
         : correct/total = [(7380, 14232), (7395, 14235), (7549, 14266), (7148, 14217), (8061, 14238), (7434, 14373), (7614, 14346), (7644, 14334), (7281, 14294), (7400, 14373), (7933, 14344), (7164, 14302), (7576, 14354), (7649, 14362), (7260, 14320), (7472, 14395), (7549, 14389), (7899, 14257), (7976, 14251), (7312, 14399)]
         : compromised: 0.5241, honest: 0.5357
Round 005: test acc mean=0.5615 ± 0.0225 | min=0.4996 max=0.5896
         : test loss mean=0.8045 ± 0.5373
         : individual accs = ['0.555017', '0.565016', '0.545423', '0.568685', '0.577469', '0.573854', '0.567196', '0.584973', '0.575276', '0.535448', '0.572434', '0.543770', '0.545911', '0.575964', '0.559777', '0.525391', '0.581625', '0.588062', '0.589643', '0.499618']
         : correct/total = [(7899, 14232), (8043, 14235), (7781, 14266), (8085, 14217), (8222, 14238), (8248, 14373), (8137, 14346), (8385, 14334), (8223, 14294), (7696, 14373), (8211, 14344), (7777, 14302), (7836, 14354), (8272, 14362), (8016, 14320), (7563, 14395), (8369, 14389), (8384, 14257), (8403, 14251), (7194, 14399)]
         : compromised: 0.5582, honest: 0.5748
Round 006: test acc mean=0.5731 ± 0.0258 | min=0.4981 max=0.6047
         : test loss mean=0.9290 ± 1.1091
         : individual accs = ['0.539137', '0.557710', '0.580121', '0.575860', '0.592078', '0.581229', '0.586923', '0.604577', '0.570939', '0.534961', '0.588469', '0.604671', '0.568065', '0.604303', '0.570182', '0.558388', '0.567447', '0.580206', '0.597783', '0.498090']
         : correct/total = [(7673, 14232), (7939, 14235), (8276, 14266), (8187, 14217), (8430, 14238), (8354, 14373), (8420, 14346), (8666, 14334), (8161, 14294), (7689, 14373), (8441, 14344), (8648, 14302), (8154, 14354), (8679, 14362), (8165, 14320), (8038, 14395), (8165, 14389), (8272, 14257), (8519, 14251), (7172, 14399)]
         : compromised: 0.5724, honest: 0.5758
Round 007: test acc mean=0.5937 ± 0.0240 | min=0.5008 max=0.6160
         : test loss mean=0.7164 ± 0.2255
         : individual accs = ['0.582701', '0.598876', '0.577457', '0.592741', '0.602683', '0.596535', '0.605465', '0.611134', '0.610396', '0.597370', '0.592861', '0.613061', '0.595931', '0.612032', '0.594204', '0.575200', '0.616026', '0.599635', '0.598905', '0.500799']
         : correct/total = [(8293, 14232), (8525, 14235), (8238, 14266), (8427, 14217), (8581, 14238), (8574, 14373), (8686, 14346), (8760, 14334), (8725, 14294), (8586, 14373), (8504, 14344), (8768, 14302), (8554, 14354), (8790, 14362), (8509, 14320), (8280, 14395), (8864, 14389), (8549, 14257), (8535, 14251), (7211, 14399)]
         : compromised: 0.5913, honest: 0.6031
Round 008: test acc mean=0.5998 ± 0.0249 | min=0.5020 max=0.6204
         : test loss mean=0.9091 ± 1.0790
         : individual accs = ['0.587549', '0.603793', '0.581733', '0.613702', '0.592007', '0.607667', '0.618988', '0.614832', '0.611166', '0.601962', '0.602552', '0.609495', '0.608402', '0.616418', '0.588128', '0.600139', '0.620404', '0.616469', '0.599116', '0.502049']
         : correct/total = [(8362, 14232), (8595, 14235), (8299, 14266), (8725, 14217), (8429, 14238), (8734, 14373), (8880, 14346), (8813, 14334), (8736, 14294), (8652, 14373), (8643, 14344), (8717, 14302), (8733, 14354), (8853, 14362), (8422, 14320), (8639, 14395), (8927, 14389), (8789, 14257), (8538, 14251), (7229, 14399)]
         : compromised: 0.5989, honest: 0.6037
Round 009: test acc mean=0.6119 ± 0.0275 | min=0.4995 max=0.6297
         : test loss mean=0.6923 ± 0.1708
         : individual accs = ['0.615022', '0.613769', '0.604094', '0.622002', '0.620101', '0.623739', '0.619964', '0.621250', '0.627326', '0.606484', '0.616286', '0.629702', '0.611398', '0.628394', '0.590293', '0.615005', '0.629161', '0.628113', '0.617150', '0.499479']
         : correct/total = [(8753, 14232), (8737, 14235), (8618, 14266), (8843, 14217), (8829, 14238), (8965, 14373), (8894, 14346), (8905, 14334), (8967, 14294), (8717, 14373), (8840, 14344), (9006, 14302), (8776, 14354), (9025, 14362), (8453, 14320), (8853, 14395), (9053, 14389), (8955, 14257), (8795, 14251), (7192, 14399)]
         : compromised: 0.6096, honest: 0.6214
Round 010: test acc mean=0.6231 ± 0.0289 | min=0.4991 max=0.6357
         : test loss mean=0.6674 ± 0.1034
         : individual accs = ['0.627670', '0.626203', '0.620286', '0.635366', '0.631760', '0.634941', '0.630698', '0.635482', '0.635651', '0.630696', '0.621514', '0.618795', '0.630277', '0.630971', '0.626327', '0.625842', '0.634304', '0.635688', '0.630272', '0.499062']
         : correct/total = [(8933, 14232), (8914, 14235), (8849, 14266), (9033, 14217), (8995, 14238), (9126, 14373), (9048, 14346), (9109, 14334), (9086, 14294), (9065, 14373), (8915, 14344), (8850, 14302), (9047, 14354), (9062, 14362), (8969, 14320), (9009, 14395), (9127, 14389), (9063, 14257), (8982, 14251), (7186, 14399)]
         : compromised: 0.6208, honest: 0.6323

=== FINAL RESULTS ===
Dataset: sent140, Nodes: 20, Graph: erdos, Aggregation: balance
Attack: krum, 80.0% compromised
Final accuracy - Compromised: 0.6208, Honest: 0.6323
Overall test accuracy: mean=0.6231 ± 0.0289

=== BALANCE SUMMARY ===
Node 0: acceptance=0.250
Node 1: acceptance=0.460
Node 2: acceptance=0.400
Node 3: acceptance=0.314
Node 4: acceptance=0.300
Node 5: acceptance=0.280
Node 6: acceptance=0.267
Node 7: acceptance=0.273
Node 8: acceptance=0.314
Node 9: acceptance=0.427
Node 10: acceptance=0.325
Node 11: acceptance=0.267
Node 12: acceptance=0.325
Node 13: acceptance=0.289
Node 14: acceptance=0.293
Node 15: acceptance=0.300
Node 16: acceptance=0.314
Node 17: acceptance=0.425
Node 18: acceptance=0.325
Node 19: acceptance=0.200

=== PARALLEL EXECUTION TIME (realistic for distributed system) ===
  COMMUNICATION (max across nodes):
    - Full model transfer: 0.000s (0.0%)
  COMPUTATION (max across nodes):
    - Filtering: 0.056s (83.1%)
    - Aggregation: 0.011s (16.9%)
  TOTALS:
    - Total computation: 0.067s (100.0%)
    - Total communication: 0.000s (0.0%)
    - Total parallel time: 0.067s

=== PER-NODE AVERAGE TIME ===
  - Filtering: 0.040s
  - Aggregation: 0.006s
  - Model transfer: 0.000s
  - Total per node: 0.046s

=== TOTAL COMPUTATIONAL WORK (sum across all nodes) ===
  - Total filtering: 0.810s
  - Total aggregation: 0.117s
  - Total model transfer: 0.000s
  - Grand total: 0.927s
  - Mean acceptance rate: 0.317

BALANCE Algorithm Properties:
  - Model dimension: 1,174,986
  - No compression: Full parameter comparison
  - Theoretical complexity: O(deg(i)×d)
  - Approach: Full parameter filtering + averaging
