Device: cuda
Seed: 987654321
Loading 1 LEAF Sent140 train files...
LEAF Sent140 train: 254555 users, 908652 samples
Building vocabulary (max_size=10000)...
Vocabulary size: 10000
Loading 1 LEAF Sent140 test files...
LEAF Sent140 test: 254555 users, 286281 samples
Found 254555 train users, 254555 test users, 254555 common users
User sample counts range: 494 (max) to 1 (min)
Distributed ALL 254555 users across 20 clients
Users per client: 12727 (with 15 clients getting +1 user)
Train partition sizes: [44353, 44290, 44657, 44907, 44696, 45843, 45801, 45619, 45069, 45639, 45821, 45311, 45779, 46056, 45625, 45984, 46428, 44737, 45540, 46497]
Test partition sizes: [14232, 14235, 14266, 14217, 14238, 14373, 14346, 14334, 14294, 14373, 14344, 14302, 14354, 14362, 14320, 14395, 14389, 14257, 14251, 14399]
  Client 0: 44353 train samples, 2 unique classes
  Client 1: 44290 train samples, 2 unique classes
  Client 2: 44657 train samples, 2 unique classes
  Client 3: 44907 train samples, 2 unique classes
  Client 4: 44696 train samples, 2 unique classes
  Client 5: 45843 train samples, 2 unique classes
  Client 6: 45801 train samples, 2 unique classes
  Client 7: 45619 train samples, 2 unique classes
  Client 8: 45069 train samples, 2 unique classes
  Client 9: 45639 train samples, 2 unique classes
  Client 10: 45821 train samples, 2 unique classes
  Client 11: 45311 train samples, 2 unique classes
  Client 12: 45779 train samples, 2 unique classes
  Client 13: 46056 train samples, 2 unique classes
  Client 14: 45625 train samples, 2 unique classes
  Client 15: 45984 train samples, 2 unique classes
  Client 16: 46428 train samples, 2 unique classes
  Client 17: 44737 train samples, 2 unique classes
  Client 18: 45540 train samples, 2 unique classes
  Client 19: 46497 train samples, 2 unique classes
Will sample 4500 samples per client per epoch
Graph: erdos, nodes: 20, edges: 48
Degree statistics: avg=4.80, min=2, max=7
Attack: Compromised 10/20 nodes: [1, 2, 5, 11, 12, 13, 14, 15, 17, 18]
Attack type: backdoor, lambda: 1.0
Backdoor target label: 1, trigger size: 3
Model variant: baseline
Model parameters: 1,174,986
Initial test acc across nodes: mean=0.4953 ± 0.0174
Backdoor attack: Created poisoned datasets for 10 compromised nodes
Round 001: test acc mean=0.4995 ± 0.0065 | min=0.4870 max=0.5141
         : test loss mean=8.4580 ± 7.6120
         : individual accs = ['0.508713', '0.514085', '0.486962', '0.498628', '0.493257', '0.497391', '0.504949', '0.496093', '0.497132', '0.494260', '0.504113', '0.499301', '0.503832', '0.492480', '0.499092', '0.505870', '0.506012', '0.490917', '0.500596', '0.495521']
         : correct/total = [(7240, 14232), (7318, 14235), (6947, 14266), (7089, 14217), (7023, 14238), (7149, 14373), (7244, 14346), (7111, 14334), (7106, 14294), (7104, 14373), (7231, 14344), (7141, 14302), (7232, 14354), (7073, 14362), (7147, 14320), (7282, 14395), (7281, 14389), (6999, 14257), (7134, 14251), (7135, 14399)]
         : compromised: 0.4991, honest: 0.4999
Round 002: test acc mean=0.4980 ± 0.0065 | min=0.4891 max=0.5150
         : test loss mean=7.1708 ± 3.9977
         : individual accs = ['0.493255', '0.498560', '0.508972', '0.493072', '0.501896', '0.493982', '0.501464', '0.497698', '0.503148', '0.491338', '0.491076', '0.500070', '0.503623', '0.489974', '0.489106', '0.493157', '0.494197', '0.515045', '0.502070', '0.498160']
         : correct/total = [(7020, 14232), (7097, 14235), (7261, 14266), (7010, 14217), (7146, 14238), (7100, 14373), (7194, 14346), (7134, 14334), (7192, 14294), (7062, 14373), (7044, 14344), (7152, 14302), (7229, 14354), (7037, 14362), (7004, 14320), (7099, 14395), (7111, 14389), (7343, 14257), (7155, 14251), (7173, 14399)]
         : compromised: 0.4995, honest: 0.4965
Round 003: test acc mean=0.4976 ± 0.0063 | min=0.4895 max=0.5083
         : test loss mean=2.6493 ± 1.6751
         : individual accs = ['0.506675', '0.492659', '0.500210', '0.491595', '0.492415', '0.507131', '0.495399', '0.490652', '0.503848', '0.501635', '0.507738', '0.496574', '0.489480', '0.500905', '0.493226', '0.496492', '0.492043', '0.496177', '0.489650', '0.508299']
         : correct/total = [(7211, 14232), (7013, 14235), (7136, 14266), (6989, 14217), (7011, 14238), (7289, 14373), (7107, 14346), (7033, 14334), (7202, 14294), (7210, 14373), (7283, 14344), (7102, 14302), (7026, 14354), (7194, 14362), (7063, 14320), (7147, 14395), (7080, 14389), (7074, 14257), (6978, 14251), (7319, 14399)]
         : compromised: 0.4963, honest: 0.4990
Round 004: test acc mean=0.5004 ± 0.0063 | min=0.4862 max=0.5118
         : test loss mean=1.8445 ± 1.3093
         : individual accs = ['0.486228', '0.494766', '0.511846', '0.495323', '0.499508', '0.503583', '0.505367', '0.498605', '0.497971', '0.493077', '0.498187', '0.511607', '0.502717', '0.496240', '0.510964', '0.505662', '0.500869', '0.497019', '0.497228', '0.501493']
         : correct/total = [(6920, 14232), (7043, 14235), (7302, 14266), (7042, 14217), (7112, 14238), (7238, 14373), (7250, 14346), (7147, 14334), (7118, 14294), (7087, 14373), (7146, 14344), (7317, 14302), (7216, 14354), (7127, 14362), (7317, 14320), (7279, 14395), (7207, 14389), (7086, 14257), (7086, 14251), (7221, 14399)]
         : compromised: 0.5032, honest: 0.4977
Round 005: test acc mean=0.4962 ± 0.0067 | min=0.4809 max=0.5118
         : test loss mean=1.4071 ± 1.1542
         : individual accs = ['0.494168', '0.492448', '0.490958', '0.495041', '0.498385', '0.504418', '0.497630', '0.494070', '0.486638', '0.497530', '0.493586', '0.497413', '0.511774', '0.505988', '0.496020', '0.492324', '0.502120', '0.480887', '0.501649', '0.491215']
         : correct/total = [(7033, 14232), (7010, 14235), (7004, 14266), (7038, 14217), (7096, 14238), (7250, 14373), (7139, 14346), (7082, 14334), (6956, 14294), (7151, 14373), (7080, 14344), (7114, 14302), (7346, 14354), (7267, 14362), (7103, 14320), (7087, 14395), (7225, 14389), (6856, 14257), (7149, 14251), (7073, 14399)]
         : compromised: 0.4974, honest: 0.4950
Round 006: test acc mean=0.5032 ± 0.0080 | min=0.4842 max=0.5171
         : test loss mean=2.2526 ± 2.3639
         : individual accs = ['0.501335', '0.484229', '0.513879', '0.509953', '0.508498', '0.502400', '0.506831', '0.500419', '0.498391', '0.501148', '0.499163', '0.508880', '0.494148', '0.491784', '0.515922', '0.504689', '0.517131', '0.494915', '0.505158', '0.505313']
         : correct/total = [(7135, 14232), (6893, 14235), (7331, 14266), (7250, 14217), (7240, 14238), (7221, 14373), (7271, 14346), (7173, 14334), (7124, 14294), (7203, 14373), (7160, 14344), (7278, 14302), (7093, 14354), (7063, 14362), (7388, 14320), (7265, 14395), (7441, 14389), (7056, 14257), (7199, 14251), (7276, 14399)]
         : compromised: 0.5016, honest: 0.5048
Round 007: test acc mean=0.5015 ± 0.0081 | min=0.4855 max=0.5142
         : test loss mean=1.2611 ± 1.0627
         : individual accs = ['0.509064', '0.512891', '0.497336', '0.507280', '0.512642', '0.501844', '0.492402', '0.508162', '0.502029', '0.507758', '0.501185', '0.496364', '0.497353', '0.485517', '0.493226', '0.489128', '0.492668', '0.514204', '0.505649', '0.503368']
         : correct/total = [(7245, 14232), (7301, 14235), (7095, 14266), (7212, 14217), (7299, 14238), (7213, 14373), (7064, 14346), (7284, 14334), (7176, 14294), (7298, 14373), (7189, 14344), (7099, 14302), (7139, 14354), (6973, 14362), (7063, 14320), (7041, 14395), (7089, 14389), (7331, 14257), (7206, 14251), (7248, 14399)]
         : compromised: 0.4994, honest: 0.5037
Round 008: test acc mean=0.4966 ± 0.0069 | min=0.4789 max=0.5052
         : test loss mean=2.3641 ± 1.4276
         : individual accs = ['0.505059', '0.488655', '0.502664', '0.500879', '0.501756', '0.504209', '0.486059', '0.503070', '0.498321', '0.498852', '0.496026', '0.492379', '0.478891', '0.495265', '0.488827', '0.495936', '0.491556', '0.500105', '0.497930', '0.505174']
         : correct/total = [(7188, 14232), (6956, 14235), (7171, 14266), (7121, 14217), (7144, 14238), (7247, 14373), (6973, 14346), (7211, 14334), (7123, 14294), (7170, 14373), (7115, 14344), (7042, 14302), (6874, 14354), (7113, 14362), (7000, 14320), (7139, 14395), (7073, 14389), (7130, 14257), (7096, 14251), (7274, 14399)]
         : compromised: 0.4945, honest: 0.4987
Round 009: test acc mean=0.5020 ± 0.0075 | min=0.4878 max=0.5172
         : test loss mean=1.3241 ± 1.1241
         : individual accs = ['0.505621', '0.517246', '0.493621', '0.514947', '0.503231', '0.492382', '0.500349', '0.508302', '0.501679', '0.512071', '0.503207', '0.494406', '0.497144', '0.487815', '0.500628', '0.492324', '0.505039', '0.504945', '0.500526', '0.503785']
         : correct/total = [(7196, 14232), (7363, 14235), (7042, 14266), (7321, 14217), (7165, 14238), (7077, 14373), (7178, 14346), (7286, 14334), (7171, 14294), (7360, 14373), (7218, 14344), (7071, 14302), (7136, 14354), (7006, 14362), (7169, 14320), (7087, 14395), (7267, 14389), (7199, 14257), (7133, 14251), (7254, 14399)]
         : compromised: 0.4981, honest: 0.5058
Round 010: test acc mean=0.4975 ± 0.0094 | min=0.4750 max=0.5189
         : test loss mean=2.5080 ± 1.5674
         : individual accs = ['0.504497', '0.493572', '0.502944', '0.503763', '0.497542', '0.494678', '0.500558', '0.493931', '0.493774', '0.518890', '0.474972', '0.506782', '0.490386', '0.505431', '0.500140', '0.490518', '0.479185', '0.496458', '0.496877', '0.504479']
         : correct/total = [(7180, 14232), (7026, 14235), (7175, 14266), (7162, 14217), (7084, 14238), (7110, 14373), (7181, 14346), (7080, 14334), (7058, 14294), (7458, 14373), (6813, 14344), (7248, 14302), (7039, 14354), (7259, 14362), (7162, 14320), (7061, 14395), (6895, 14389), (7078, 14257), (7081, 14251), (7264, 14399)]
         : compromised: 0.4978, honest: 0.4972

=== FINAL RESULTS ===
Dataset: sent140, Nodes: 20, Graph: erdos, Aggregation: krum
Attack: backdoor, 50.0% compromised
Final accuracy - Compromised: 0.4978, Honest: 0.4972
Overall test accuracy: mean=0.4975 ± 0.0094

=== BACKDOOR ATTACK SUCCESS RATE (ASR) ===
Target label: 1
Trigger size: 3x3
Overall ASR: 0.5403 ± 0.1914
Honest nodes ASR: 0.5272 ± 0.2306
Compromised nodes ASR: 0.5535 ± 0.1405
Note: Higher ASR indicates more successful backdoor attack
