Device: cuda
Seed: 987654321
Loading 1 LEAF Sent140 train files...
LEAF Sent140 train: 254555 users, 908652 samples
Building vocabulary (max_size=10000)...
Vocabulary size: 10000
Loading 1 LEAF Sent140 test files...
LEAF Sent140 test: 254555 users, 286281 samples
Found 254555 train users, 254555 test users, 254555 common users
User sample counts range: 494 (max) to 1 (min)
Distributed ALL 254555 users across 20 clients
Users per client: 12727 (with 15 clients getting +1 user)
Train partition sizes: [44353, 44290, 44657, 44907, 44696, 45843, 45801, 45619, 45069, 45639, 45821, 45311, 45779, 46056, 45625, 45984, 46428, 44737, 45540, 46497]
Test partition sizes: [14232, 14235, 14266, 14217, 14238, 14373, 14346, 14334, 14294, 14373, 14344, 14302, 14354, 14362, 14320, 14395, 14389, 14257, 14251, 14399]
  Client 0: 44353 train samples, 2 unique classes
  Client 1: 44290 train samples, 2 unique classes
  Client 2: 44657 train samples, 2 unique classes
  Client 3: 44907 train samples, 2 unique classes
  Client 4: 44696 train samples, 2 unique classes
  Client 5: 45843 train samples, 2 unique classes
  Client 6: 45801 train samples, 2 unique classes
  Client 7: 45619 train samples, 2 unique classes
  Client 8: 45069 train samples, 2 unique classes
  Client 9: 45639 train samples, 2 unique classes
  Client 10: 45821 train samples, 2 unique classes
  Client 11: 45311 train samples, 2 unique classes
  Client 12: 45779 train samples, 2 unique classes
  Client 13: 46056 train samples, 2 unique classes
  Client 14: 45625 train samples, 2 unique classes
  Client 15: 45984 train samples, 2 unique classes
  Client 16: 46428 train samples, 2 unique classes
  Client 17: 44737 train samples, 2 unique classes
  Client 18: 45540 train samples, 2 unique classes
  Client 19: 46497 train samples, 2 unique classes
Will sample 4500 samples per client per epoch
Graph: erdos, nodes: 20, edges: 126
Degree statistics: avg=12.60, min=8, max=16
Attack: Compromised 2/20 nodes: [5, 13]
Attack type: backdoor, lambda: 1.0
Backdoor target label: 1, trigger size: 3
Model variant: baseline
Model parameters: 1,174,986
Initial test acc across nodes: mean=0.4953 ± 0.0174
Backdoor attack: Created poisoned datasets for 2 compromised nodes
Round 001: test acc mean=0.5032 ± 0.0106 | min=0.4830 max=0.5291
         : test loss mean=0.7403 ± 0.0648
         : individual accs = ['0.519815', '0.516965', '0.498949', '0.529085', '0.495716', '0.500870', '0.506831', '0.501605', '0.507066', '0.504557', '0.501394', '0.510138', '0.497771', '0.488720', '0.483031', '0.499340', '0.492529', '0.513642', '0.494632', '0.501354']
         : correct/total = [(7398, 14232), (7359, 14235), (7118, 14266), (7522, 14217), (7058, 14238), (7199, 14373), (7271, 14346), (7190, 14334), (7248, 14294), (7252, 14373), (7192, 14344), (7296, 14302), (7145, 14354), (7019, 14362), (6917, 14320), (7188, 14395), (7087, 14389), (7323, 14257), (7049, 14251), (7219, 14399)]
         : compromised: 0.4948, honest: 0.5041
Round 002: test acc mean=0.5094 ± 0.0088 | min=0.4938 max=0.5319
         : test loss mean=0.7282 ± 0.0368
         : individual accs = ['0.520236', '0.514787', '0.503014', '0.531898', '0.505619', '0.522647', '0.499512', '0.511162', '0.509794', '0.503305', '0.505786', '0.512306', '0.511774', '0.498329', '0.512989', '0.502327', '0.507401', '0.493793', '0.505158', '0.515800']
         : correct/total = [(7404, 14232), (7328, 14235), (7176, 14266), (7562, 14217), (7199, 14238), (7512, 14373), (7166, 14346), (7327, 14334), (7287, 14294), (7234, 14373), (7255, 14344), (7327, 14302), (7346, 14354), (7157, 14362), (7346, 14320), (7231, 14395), (7301, 14389), (7040, 14257), (7199, 14251), (7427, 14399)]
         : compromised: 0.5105, honest: 0.5093
Round 003: test acc mean=0.4947 ± 0.0073 | min=0.4830 max=0.5109
         : test loss mean=0.6978 ± 0.0143
         : individual accs = ['0.489671', '0.482965', '0.487242', '0.507983', '0.488833', '0.492521', '0.500139', '0.488070', '0.498181', '0.486259', '0.498187', '0.487764', '0.510868', '0.503064', '0.498045', '0.497603', '0.487317', '0.495055', '0.499053', '0.495521']
         : correct/total = [(6969, 14232), (6875, 14235), (6951, 14266), (7222, 14217), (6960, 14238), (7079, 14373), (7175, 14346), (6996, 14334), (7121, 14294), (6989, 14373), (7146, 14344), (6976, 14302), (7333, 14354), (7225, 14362), (7132, 14320), (7163, 14395), (7012, 14389), (7058, 14257), (7112, 14251), (7135, 14399)]
         : compromised: 0.4978, honest: 0.4944
Round 004: test acc mean=0.5858 ± 0.0119 | min=0.5602 max=0.6046
         : test loss mean=0.6942 ± 0.0383
         : individual accs = ['0.588744', '0.594802', '0.572410', '0.579517', '0.604650', '0.581020', '0.579465', '0.600879', '0.560235', '0.600988', '0.572713', '0.575514', '0.600390', '0.580212', '0.583031', '0.597360', '0.600598', '0.581749', '0.576661', '0.584485']
         : correct/total = [(8379, 14232), (8467, 14235), (8166, 14266), (8239, 14217), (8609, 14238), (8351, 14373), (8313, 14346), (8613, 14334), (8008, 14294), (8638, 14373), (8215, 14344), (8231, 14302), (8618, 14354), (8333, 14362), (8349, 14320), (8599, 14395), (8642, 14389), (8294, 14257), (8218, 14251), (8416, 14399)]
         : compromised: 0.5806, honest: 0.5863
Round 005: test acc mean=0.5838 ± 0.0426 | min=0.4874 max=0.6326
         : test loss mean=0.6829 ± 0.0226
         : individual accs = ['0.574480', '0.632596', '0.487383', '0.622987', '0.619188', '0.575593', '0.544054', '0.597670', '0.497971', '0.595144', '0.624512', '0.541533', '0.624843', '0.552082', '0.558310', '0.621605', '0.625269', '0.626078', '0.559119', '0.595597']
         : correct/total = [(8176, 14232), (9005, 14235), (6953, 14266), (8857, 14217), (8816, 14238), (8273, 14373), (7805, 14346), (8567, 14334), (7118, 14294), (8554, 14373), (8958, 14344), (7745, 14302), (8969, 14354), (7929, 14362), (7995, 14320), (8948, 14395), (8997, 14389), (8926, 14257), (7968, 14251), (8576, 14399)]
         : compromised: 0.5638, honest: 0.5860
Round 006: test acc mean=0.6028 ± 0.0148 | min=0.5778 max=0.6326
         : test loss mean=0.6601 ± 0.0134
         : individual accs = ['0.590571', '0.611802', '0.590565', '0.590842', '0.611533', '0.596118', '0.596821', '0.632552', '0.577795', '0.622208', '0.599066', '0.597189', '0.625540', '0.605556', '0.589944', '0.608475', '0.629509', '0.596549', '0.587397', '0.595389']
         : correct/total = [(8405, 14232), (8709, 14235), (8425, 14266), (8400, 14217), (8707, 14238), (8568, 14373), (8562, 14346), (9067, 14334), (8259, 14294), (8943, 14373), (8593, 14344), (8541, 14302), (8979, 14354), (8697, 14362), (8448, 14320), (8759, 14395), (9058, 14389), (8505, 14257), (8371, 14251), (8573, 14399)]
         : compromised: 0.6008, honest: 0.6030
Round 007: test acc mean=0.5943 ± 0.0148 | min=0.5571 max=0.6251
         : test loss mean=0.6618 ± 0.0076
         : individual accs = ['0.593732', '0.604074', '0.594350', '0.593655', '0.591516', '0.592152', '0.586366', '0.615390', '0.557087', '0.602658', '0.591676', '0.574535', '0.620106', '0.580629', '0.591969', '0.595971', '0.625061', '0.584415', '0.594555', '0.597055']
         : correct/total = [(8450, 14232), (8599, 14235), (8479, 14266), (8440, 14217), (8422, 14238), (8511, 14373), (8412, 14346), (8821, 14334), (7963, 14294), (8662, 14373), (8487, 14344), (8217, 14302), (8901, 14354), (8339, 14362), (8477, 14320), (8579, 14395), (8994, 14389), (8332, 14257), (8473, 14251), (8597, 14399)]
         : compromised: 0.5864, honest: 0.5952
Round 008: test acc mean=0.6483 ± 0.0121 | min=0.6069 max=0.6608
         : test loss mean=0.6297 ± 0.0144
         : individual accs = ['0.644182', '0.654373', '0.625193', '0.657171', '0.660837', '0.652473', '0.646452', '0.658295', '0.606898', '0.647116', '0.651074', '0.646203', '0.650690', '0.646776', '0.652165', '0.655228', '0.659740', '0.651610', '0.645288', '0.654837']
         : correct/total = [(9168, 14232), (9315, 14235), (8919, 14266), (9343, 14217), (9409, 14238), (9378, 14373), (9274, 14346), (9436, 14334), (8675, 14294), (9301, 14373), (9339, 14344), (9242, 14302), (9340, 14354), (9289, 14362), (9339, 14320), (9432, 14395), (9493, 14389), (9290, 14257), (9196, 14251), (9429, 14399)]
         : compromised: 0.6496, honest: 0.6482
Round 009: test acc mean=0.6215 ± 0.0419 | min=0.5080 max=0.6643
         : test loss mean=0.6534 ± 0.0497
         : individual accs = ['0.615163', '0.655848', '0.531824', '0.647324', '0.657255', '0.616921', '0.587411', '0.664295', '0.507975', '0.653656', '0.635527', '0.582366', '0.659607', '0.599708', '0.611592', '0.656478', '0.662242', '0.640598', '0.622132', '0.621779']
         : correct/total = [(8755, 14232), (9336, 14235), (7587, 14266), (9203, 14217), (9358, 14238), (8867, 14373), (8427, 14346), (9522, 14334), (7261, 14294), (9395, 14373), (9116, 14344), (8329, 14302), (9468, 14354), (8613, 14362), (8758, 14320), (9450, 14395), (9529, 14389), (9133, 14257), (8866, 14251), (8953, 14399)]
         : compromised: 0.6083, honest: 0.6229
Round 010: test acc mean=0.6466 ± 0.0143 | min=0.6268 max=0.6724
         : test loss mean=0.6306 ± 0.0173
         : individual accs = ['0.634486', '0.664278', '0.633815', '0.633608', '0.662312', '0.637584', '0.638436', '0.672387', '0.626836', '0.657831', '0.645287', '0.638023', '0.667897', '0.641206', '0.636103', '0.660021', '0.669817', '0.641018', '0.629851', '0.641572']
         : correct/total = [(9030, 14232), (9456, 14235), (9042, 14266), (9008, 14217), (9430, 14238), (9164, 14373), (9159, 14346), (9638, 14334), (8960, 14294), (9455, 14373), (9256, 14344), (9125, 14302), (9587, 14354), (9209, 14362), (9109, 14320), (9501, 14395), (9638, 14389), (9139, 14257), (8976, 14251), (9238, 14399)]
         : compromised: 0.6394, honest: 0.6474

=== FINAL RESULTS ===
Dataset: sent140, Nodes: 20, Graph: erdos, Aggregation: d-fedavg
Attack: backdoor, 10.0% compromised
Final accuracy - Compromised: 0.6394, Honest: 0.6474
Overall test accuracy: mean=0.6466 ± 0.0143

=== BACKDOOR ATTACK SUCCESS RATE (ASR) ===
Target label: 1
Trigger size: 3x3
Overall ASR: 0.6653 ± 0.0867
Honest nodes ASR: 0.6586 ± 0.0889
Compromised nodes ASR: 0.7252 ± 0.0012
Note: Higher ASR indicates more successful backdoor attack
