Device: cuda
Seed: 987654321
Loading 1 LEAF Sent140 train files...
LEAF Sent140 train: 254555 users, 908652 samples
Building vocabulary (max_size=10000)...
Vocabulary size: 10000
Loading 1 LEAF Sent140 test files...
LEAF Sent140 test: 254555 users, 286281 samples
Found 254555 train users, 254555 test users, 254555 common users
User sample counts range: 494 (max) to 1 (min)
Distributed ALL 254555 users across 20 clients
Users per client: 12727 (with 15 clients getting +1 user)
Train partition sizes: [44353, 44290, 44657, 44907, 44696, 45843, 45801, 45619, 45069, 45639, 45821, 45311, 45779, 46056, 45625, 45984, 46428, 44737, 45540, 46497]
Test partition sizes: [14232, 14235, 14266, 14217, 14238, 14373, 14346, 14334, 14294, 14373, 14344, 14302, 14354, 14362, 14320, 14395, 14389, 14257, 14251, 14399]
  Client 0: 44353 train samples, 2 unique classes
  Client 1: 44290 train samples, 2 unique classes
  Client 2: 44657 train samples, 2 unique classes
  Client 3: 44907 train samples, 2 unique classes
  Client 4: 44696 train samples, 2 unique classes
  Client 5: 45843 train samples, 2 unique classes
  Client 6: 45801 train samples, 2 unique classes
  Client 7: 45619 train samples, 2 unique classes
  Client 8: 45069 train samples, 2 unique classes
  Client 9: 45639 train samples, 2 unique classes
  Client 10: 45821 train samples, 2 unique classes
  Client 11: 45311 train samples, 2 unique classes
  Client 12: 45779 train samples, 2 unique classes
  Client 13: 46056 train samples, 2 unique classes
  Client 14: 45625 train samples, 2 unique classes
  Client 15: 45984 train samples, 2 unique classes
  Client 16: 46428 train samples, 2 unique classes
  Client 17: 44737 train samples, 2 unique classes
  Client 18: 45540 train samples, 2 unique classes
  Client 19: 46497 train samples, 2 unique classes
Will sample 4500 samples per client per epoch
Graph: erdos, nodes: 20, edges: 48
Degree statistics: avg=4.80, min=2, max=7
Attack: Compromised 10/20 nodes: [1, 2, 5, 11, 12, 13, 14, 15, 17, 18]
Attack type: gaussian, lambda: 1.0
Model variant: baseline
Model parameters: 1,174,986
Sketchguard Node 0:
  Model dim: 1,174,986 → Sketch size: 180
  Compression ratio: 6527.7x
  Using model parameters for aggregation, sketches for filtering
Sketchguard Node 1:
  Model dim: 1,174,986 → Sketch size: 180
  Compression ratio: 6527.7x
  Using model parameters for aggregation, sketches for filtering
Sketchguard Node 2:
  Model dim: 1,174,986 → Sketch size: 180
  Compression ratio: 6527.7x
  Using model parameters for aggregation, sketches for filtering
Sketchguard Node 3:
  Model dim: 1,174,986 → Sketch size: 180
  Compression ratio: 6527.7x
  Using model parameters for aggregation, sketches for filtering
Sketchguard Node 4:
  Model dim: 1,174,986 → Sketch size: 180
  Compression ratio: 6527.7x
  Using model parameters for aggregation, sketches for filtering
Sketchguard Node 5:
  Model dim: 1,174,986 → Sketch size: 180
  Compression ratio: 6527.7x
  Using model parameters for aggregation, sketches for filtering
Sketchguard Node 6:
  Model dim: 1,174,986 → Sketch size: 180
  Compression ratio: 6527.7x
  Using model parameters for aggregation, sketches for filtering
Sketchguard Node 7:
  Model dim: 1,174,986 → Sketch size: 180
  Compression ratio: 6527.7x
  Using model parameters for aggregation, sketches for filtering
Sketchguard Node 8:
  Model dim: 1,174,986 → Sketch size: 180
  Compression ratio: 6527.7x
  Using model parameters for aggregation, sketches for filtering
Sketchguard Node 9:
  Model dim: 1,174,986 → Sketch size: 180
  Compression ratio: 6527.7x
  Using model parameters for aggregation, sketches for filtering
Sketchguard Node 10:
  Model dim: 1,174,986 → Sketch size: 180
  Compression ratio: 6527.7x
  Using model parameters for aggregation, sketches for filtering
Sketchguard Node 11:
  Model dim: 1,174,986 → Sketch size: 180
  Compression ratio: 6527.7x
  Using model parameters for aggregation, sketches for filtering
Sketchguard Node 12:
  Model dim: 1,174,986 → Sketch size: 180
  Compression ratio: 6527.7x
  Using model parameters for aggregation, sketches for filtering
Sketchguard Node 13:
  Model dim: 1,174,986 → Sketch size: 180
  Compression ratio: 6527.7x
  Using model parameters for aggregation, sketches for filtering
Sketchguard Node 14:
  Model dim: 1,174,986 → Sketch size: 180
  Compression ratio: 6527.7x
  Using model parameters for aggregation, sketches for filtering
Sketchguard Node 15:
  Model dim: 1,174,986 → Sketch size: 180
  Compression ratio: 6527.7x
  Using model parameters for aggregation, sketches for filtering
Sketchguard Node 16:
  Model dim: 1,174,986 → Sketch size: 180
  Compression ratio: 6527.7x
  Using model parameters for aggregation, sketches for filtering
Sketchguard Node 17:
  Model dim: 1,174,986 → Sketch size: 180
  Compression ratio: 6527.7x
  Using model parameters for aggregation, sketches for filtering
Sketchguard Node 18:
  Model dim: 1,174,986 → Sketch size: 180
  Compression ratio: 6527.7x
  Using model parameters for aggregation, sketches for filtering
Sketchguard Node 19:
  Model dim: 1,174,986 → Sketch size: 180
  Compression ratio: 6527.7x
  Using model parameters for aggregation, sketches for filtering
Sketchguard ALGORITHM (Sketch-based Filtering + State Aggregation)
  - Model dimension: 1,174,986 parameters
  - Config: SketchguardConfig(gamma=2, kappa=1, alpha=0.5, min_neighbors=1, sketch_size=180, network_seed=987654321, attack_detection_window=5)
  - Sketch size: 180
  - Compression ratio: 6527.7x
  - Complexity: O(d + N×k) = O(1,174,986 + 20×180)
  - Theoretical speedup vs BALANCE: 19.9x
Initial test acc across nodes: mean=0.4953 ± 0.0174
Round 001: test acc mean=0.5541 ± 0.0336 | min=0.4995 max=0.6225
         : test loss mean=0.6893 ± 0.0017
         : individual accs = ['0.563308', '0.535090', '0.521169', '0.499543', '0.597907', '0.569749', '0.522306', '0.594112', '0.554289', '0.505462', '0.552705', '0.535659', '0.622475', '0.565102', '0.527025', '0.603960', '0.572938', '0.581188', '0.518350', '0.540038']
         : correct/total = [(8017, 14232), (7617, 14235), (7435, 14266), (7102, 14217), (8513, 14238), (8189, 14373), (7493, 14346), (8516, 14334), (7923, 14294), (7265, 14373), (7928, 14344), (7661, 14302), (8935, 14354), (8116, 14362), (7547, 14320), (8694, 14395), (8244, 14389), (8286, 14257), (7387, 14251), (7776, 14399)]
         : compromised: 0.5580, honest: 0.5503
         : sketchguard stats = ['Node 0: acc_rate=0.667', 'Node 1: acc_rate=0.500', 'Node 2: acc_rate=0.400']...
Round 002: test acc mean=0.6035 ± 0.0436 | min=0.5073 max=0.6517
         : test loss mean=0.6713 ± 0.0171
         : individual accs = ['0.614601', '0.507271', '0.620636', '0.624464', '0.638432', '0.636471', '0.599122', '0.638063', '0.614524', '0.585403', '0.632250', '0.514753', '0.556221', '0.620248', '0.632263', '0.629802', '0.631941', '0.513572', '0.608449', '0.651712']
         : correct/total = [(8747, 14232), (7221, 14235), (8854, 14266), (8878, 14217), (9090, 14238), (9148, 14373), (8595, 14346), (9146, 14334), (8784, 14294), (8414, 14373), (9069, 14344), (7362, 14302), (7984, 14354), (8908, 14362), (9054, 14320), (9066, 14395), (9093, 14389), (7322, 14257), (8671, 14251), (9384, 14399)]
         : compromised: 0.5840, honest: 0.6231
         : sketchguard stats = ['Node 0: acc_rate=0.667', 'Node 1: acc_rate=0.500', 'Node 2: acc_rate=0.400']...
Round 003: test acc mean=0.6074 ± 0.0383 | min=0.5241 max=0.6422
         : test loss mean=0.6619 ± 0.0181
         : individual accs = ['0.611580', '0.580892', '0.599047', '0.627348', '0.641101', '0.628470', '0.588596', '0.642249', '0.638380', '0.634384', '0.623187', '0.524123', '0.529190', '0.637933', '0.639525', '0.525391', '0.626173', '0.597321', '0.619255', '0.633238']
         : correct/total = [(8704, 14232), (8269, 14235), (8546, 14266), (8919, 14217), (9128, 14238), (9033, 14373), (8444, 14346), (9206, 14334), (9125, 14294), (9118, 14373), (8939, 14344), (7496, 14302), (7596, 14354), (9162, 14362), (9158, 14320), (7563, 14395), (9010, 14389), (8516, 14257), (8825, 14251), (9118, 14399)]
         : compromised: 0.5881, honest: 0.6266
         : sketchguard stats = ['Node 0: acc_rate=0.667', 'Node 1: acc_rate=0.389', 'Node 2: acc_rate=0.400']...
Round 004: test acc mean=0.6373 ± 0.0114 | min=0.6109 max=0.6537
         : test loss mean=0.6502 ± 0.0159
         : individual accs = ['0.639896', '0.611310', '0.627436', '0.640290', '0.641593', '0.644124', '0.636902', '0.652993', '0.645795', '0.632853', '0.645218', '0.634107', '0.627282', '0.630344', '0.637221', '0.640431', '0.643269', '0.649996', '0.610904', '0.653657']
         : correct/total = [(9107, 14232), (8702, 14235), (8951, 14266), (9103, 14217), (9135, 14238), (9258, 14373), (9137, 14346), (9360, 14334), (9231, 14294), (9096, 14373), (9255, 14344), (9069, 14302), (9004, 14354), (9053, 14362), (9125, 14320), (9219, 14395), (9256, 14389), (9267, 14257), (8706, 14251), (9412, 14399)]
         : compromised: 0.6313, honest: 0.6432
         : sketchguard stats = ['Node 0: acc_rate=0.667', 'Node 1: acc_rate=0.375', 'Node 2: acc_rate=0.400']...
Round 005: test acc mean=0.6403 ± 0.0120 | min=0.6052 max=0.6561
         : test loss mean=0.6422 ± 0.0170
         : individual accs = ['0.635680', '0.640745', '0.621197', '0.644369', '0.652269', '0.647325', '0.634393', '0.655435', '0.641248', '0.628122', '0.652050', '0.634387', '0.638637', '0.643643', '0.645950', '0.633623', '0.645980', '0.650698', '0.605151', '0.656087']
         : correct/total = [(9047, 14232), (9121, 14235), (8862, 14266), (9161, 14217), (9287, 14238), (9304, 14373), (9101, 14346), (9395, 14334), (9166, 14294), (9028, 14373), (9353, 14344), (9073, 14302), (9167, 14354), (9244, 14362), (9250, 14320), (9121, 14395), (9295, 14389), (9277, 14257), (8624, 14251), (9447, 14399)]
         : compromised: 0.6361, honest: 0.6446
         : sketchguard stats = ['Node 0: acc_rate=0.667', 'Node 1: acc_rate=0.367', 'Node 2: acc_rate=0.400']...
Round 006: test acc mean=0.6464 ± 0.0075 | min=0.6263 max=0.6601
         : test loss mean=0.6346 ± 0.0136
         : individual accs = ['0.639474', '0.651001', '0.626314', '0.647746', '0.649529', '0.652891', '0.645337', '0.660109', '0.647474', '0.641968', '0.653026', '0.643057', '0.644768', '0.649770', '0.648743', '0.644668', '0.637640', '0.652732', '0.636166', '0.656087']
         : correct/total = [(9101, 14232), (9267, 14235), (8935, 14266), (9209, 14217), (9248, 14238), (9384, 14373), (9258, 14346), (9462, 14334), (9255, 14294), (9227, 14373), (9367, 14344), (9197, 14302), (9255, 14354), (9332, 14362), (9290, 14320), (9280, 14395), (9175, 14389), (9306, 14257), (9066, 14251), (9447, 14399)]
         : compromised: 0.6450, honest: 0.6478
         : sketchguard stats = ['Node 0: acc_rate=0.667', 'Node 1: acc_rate=0.361', 'Node 2: acc_rate=0.400']...
Round 007: test acc mean=0.6465 ± 0.0146 | min=0.5871 max=0.6562
         : test loss mean=0.6286 ± 0.0116
         : individual accs = ['0.649733', '0.655989', '0.587060', '0.643174', '0.646790', '0.644959', '0.650565', '0.655574', '0.655730', '0.642663', '0.656233', '0.642288', '0.651177', '0.641972', '0.649302', '0.652588', '0.650844', '0.655818', '0.642902', '0.655393']
         : correct/total = [(9247, 14232), (9338, 14235), (8375, 14266), (9144, 14217), (9209, 14238), (9270, 14373), (9333, 14346), (9397, 14334), (9373, 14294), (9237, 14373), (9413, 14344), (9186, 14302), (9347, 14354), (9220, 14362), (9298, 14320), (9394, 14395), (9365, 14389), (9350, 14257), (9162, 14251), (9437, 14399)]
         : compromised: 0.6424, honest: 0.6507
         : sketchguard stats = ['Node 0: acc_rate=0.667', 'Node 1: acc_rate=0.357', 'Node 2: acc_rate=0.400']...
Round 008: test acc mean=0.6505 ± 0.0127 | min=0.6048 max=0.6660
         : test loss mean=0.6239 ± 0.0099
         : individual accs = ['0.644112', '0.653109', '0.604795', '0.653232', '0.657536', '0.661518', '0.654120', '0.665969', '0.657759', '0.636541', '0.658324', '0.641099', '0.654730', '0.649561', '0.650908', '0.649809', '0.643269', '0.658554', '0.653919', '0.661713']
         : correct/total = [(9167, 14232), (9297, 14235), (8628, 14266), (9287, 14217), (9362, 14238), (9508, 14373), (9384, 14346), (9546, 14334), (9402, 14294), (9149, 14373), (9443, 14344), (9169, 14302), (9398, 14354), (9329, 14362), (9321, 14320), (9354, 14395), (9256, 14389), (9389, 14257), (9319, 14251), (9528, 14399)]
         : compromised: 0.6478, honest: 0.6533
         : sketchguard stats = ['Node 0: acc_rate=0.667', 'Node 1: acc_rate=0.354', 'Node 2: acc_rate=0.350']...
Round 009: test acc mean=0.6504 ± 0.0132 | min=0.6242 max=0.6662
         : test loss mean=0.6220 ± 0.0080
         : individual accs = ['0.624157', '0.664348', '0.628628', '0.644018', '0.657536', '0.666249', '0.624355', '0.661434', '0.635861', '0.634453', '0.656999', '0.651168', '0.649227', '0.660563', '0.659986', '0.657103', '0.655640', '0.656169', '0.658129', '0.661921']
         : correct/total = [(8883, 14232), (9457, 14235), (8968, 14266), (9156, 14217), (9362, 14238), (9576, 14373), (8957, 14346), (9481, 14334), (9089, 14294), (9119, 14373), (9424, 14344), (9313, 14302), (9319, 14354), (9487, 14362), (9451, 14320), (9459, 14395), (9434, 14389), (9355, 14257), (9379, 14251), (9531, 14399)]
         : compromised: 0.6552, honest: 0.6456
         : sketchguard stats = ['Node 0: acc_rate=0.667', 'Node 1: acc_rate=0.352', 'Node 2: acc_rate=0.333']...
Round 010: test acc mean=0.6605 ± 0.0068 | min=0.6430 max=0.6716
         : test loss mean=0.6141 ± 0.0049
         : individual accs = ['0.657603', '0.662873', '0.642997', '0.656397', '0.666105', '0.668476', '0.658720', '0.671620', '0.666154', '0.648577', '0.664808', '0.651867', '0.661558', '0.663139', '0.660196', '0.663147', '0.662867', '0.661079', '0.654340', '0.666921']
         : correct/total = [(9359, 14232), (9436, 14235), (9173, 14266), (9332, 14217), (9484, 14238), (9608, 14373), (9450, 14346), (9627, 14334), (9522, 14294), (9322, 14373), (9536, 14344), (9323, 14302), (9496, 14354), (9524, 14362), (9454, 14320), (9546, 14395), (9538, 14389), (9425, 14257), (9325, 14251), (9603, 14399)]
         : compromised: 0.6590, honest: 0.6620
         : sketchguard stats = ['Node 0: acc_rate=0.667', 'Node 1: acc_rate=0.350', 'Node 2: acc_rate=0.320']...

=== FINAL RESULTS ===
Dataset: sent140, Nodes: 20, Graph: erdos, Aggregation: sketchguard
Attack: gaussian, 50.0% compromised
Final accuracy - Compromised: 0.6590, Honest: 0.6620
Overall test accuracy: mean=0.6605 ± 0.0068

=== Sketchguard SUMMARY ===
Node 0: acceptance=0.667
Node 1: acceptance=0.350
Node 2: acceptance=0.320
Node 3: acceptance=0.500
Node 4: acceptance=0.250
Node 5: acceptance=0.200
Node 6: acceptance=0.400
Node 7: acceptance=0.400
Node 8: acceptance=0.500
Node 9: acceptance=0.667
Node 10: acceptance=0.500
Node 11: acceptance=0.357
Node 12: acceptance=0.471
Node 13: acceptance=0.250
Node 14: acceptance=0.143
Node 15: acceptance=0.250
Node 16: acceptance=0.200
Node 17: acceptance=0.440
Node 18: acceptance=0.375
Node 19: acceptance=0.500

=== PARALLEL EXECUTION TIME (realistic for distributed system) ===
  COMMUNICATION (max across nodes):
    - Sketch transfer: 0.000s (0.0%)
    - Model fetch (accepted): 0.000s (0.0%)
  COMPUTATION (max across nodes):
    - Sketching: 0.241s (95.2%)
    - Filtering: 0.001s (0.3%)
    - Aggregation: 0.011s (4.5%)
  TOTALS:
    - Total computation: 0.254s (100.0%)
    - Total communication: 0.000s (0.0%)
    - Total parallel time: 0.254s

=== PER-NODE AVERAGE TIME ===
  - Sketching: 0.178s
  - Filtering: 0.000s
  - Aggregation: 0.007s
  - Sketch transfer: 0.000s
  - Model fetch: 0.000s
  - Total per node: 0.185s

=== TOTAL COMPUTATIONAL WORK (sum across all nodes) ===
  - Total sketching: 3.562s
  - Total filtering: 0.008s
  - Total aggregation: 0.137s
  - Total sketch transfer: 0.000s
  - Total model fetch: 0.000s
  - Grand total: 3.707s
  - Mean acceptance rate: 0.387

Sketchguard Algorithm Properties:
  - Original dimension: 1,174,986
  - Sketch size: 180
  - Compression ratio: 19.9x
  - Single repetition: No repetitions needed
  - Theoretical complexity: O(d + N×k)
  - Approach: Sketch filtering + state aggregation
