Device: cuda
Seed: 987654321
Loading 1 LEAF Sent140 train files...
LEAF Sent140 train: 254555 users, 908652 samples
Building vocabulary (max_size=10000)...
Vocabulary size: 10000
Loading 1 LEAF Sent140 test files...
LEAF Sent140 test: 254555 users, 286281 samples
Found 254555 train users, 254555 test users, 254555 common users
User sample counts range: 494 (max) to 1 (min)
Distributed ALL 254555 users across 20 clients
Users per client: 12727 (with 15 clients getting +1 user)
Train partition sizes: [44353, 44290, 44657, 44907, 44696, 45843, 45801, 45619, 45069, 45639, 45821, 45311, 45779, 46056, 45625, 45984, 46428, 44737, 45540, 46497]
Test partition sizes: [14232, 14235, 14266, 14217, 14238, 14373, 14346, 14334, 14294, 14373, 14344, 14302, 14354, 14362, 14320, 14395, 14389, 14257, 14251, 14399]
  Client 0: 44353 train samples, 2 unique classes
  Client 1: 44290 train samples, 2 unique classes
  Client 2: 44657 train samples, 2 unique classes
  Client 3: 44907 train samples, 2 unique classes
  Client 4: 44696 train samples, 2 unique classes
  Client 5: 45843 train samples, 2 unique classes
  Client 6: 45801 train samples, 2 unique classes
  Client 7: 45619 train samples, 2 unique classes
  Client 8: 45069 train samples, 2 unique classes
  Client 9: 45639 train samples, 2 unique classes
  Client 10: 45821 train samples, 2 unique classes
  Client 11: 45311 train samples, 2 unique classes
  Client 12: 45779 train samples, 2 unique classes
  Client 13: 46056 train samples, 2 unique classes
  Client 14: 45625 train samples, 2 unique classes
  Client 15: 45984 train samples, 2 unique classes
  Client 16: 46428 train samples, 2 unique classes
  Client 17: 44737 train samples, 2 unique classes
  Client 18: 45540 train samples, 2 unique classes
  Client 19: 46497 train samples, 2 unique classes
Will sample 4500 samples per client per epoch
Graph: erdos, nodes: 20, edges: 48
Degree statistics: avg=4.80, min=2, max=7
Model variant: baseline
Model parameters: 1,174,986
Sketchguard Node 0:
  Model dim: 1,174,986 → Sketch size: 180
  Compression ratio: 6527.7x
  Using model parameters for aggregation, sketches for filtering
Sketchguard Node 1:
  Model dim: 1,174,986 → Sketch size: 180
  Compression ratio: 6527.7x
  Using model parameters for aggregation, sketches for filtering
Sketchguard Node 2:
  Model dim: 1,174,986 → Sketch size: 180
  Compression ratio: 6527.7x
  Using model parameters for aggregation, sketches for filtering
Sketchguard Node 3:
  Model dim: 1,174,986 → Sketch size: 180
  Compression ratio: 6527.7x
  Using model parameters for aggregation, sketches for filtering
Sketchguard Node 4:
  Model dim: 1,174,986 → Sketch size: 180
  Compression ratio: 6527.7x
  Using model parameters for aggregation, sketches for filtering
Sketchguard Node 5:
  Model dim: 1,174,986 → Sketch size: 180
  Compression ratio: 6527.7x
  Using model parameters for aggregation, sketches for filtering
Sketchguard Node 6:
  Model dim: 1,174,986 → Sketch size: 180
  Compression ratio: 6527.7x
  Using model parameters for aggregation, sketches for filtering
Sketchguard Node 7:
  Model dim: 1,174,986 → Sketch size: 180
  Compression ratio: 6527.7x
  Using model parameters for aggregation, sketches for filtering
Sketchguard Node 8:
  Model dim: 1,174,986 → Sketch size: 180
  Compression ratio: 6527.7x
  Using model parameters for aggregation, sketches for filtering
Sketchguard Node 9:
  Model dim: 1,174,986 → Sketch size: 180
  Compression ratio: 6527.7x
  Using model parameters for aggregation, sketches for filtering
Sketchguard Node 10:
  Model dim: 1,174,986 → Sketch size: 180
  Compression ratio: 6527.7x
  Using model parameters for aggregation, sketches for filtering
Sketchguard Node 11:
  Model dim: 1,174,986 → Sketch size: 180
  Compression ratio: 6527.7x
  Using model parameters for aggregation, sketches for filtering
Sketchguard Node 12:
  Model dim: 1,174,986 → Sketch size: 180
  Compression ratio: 6527.7x
  Using model parameters for aggregation, sketches for filtering
Sketchguard Node 13:
  Model dim: 1,174,986 → Sketch size: 180
  Compression ratio: 6527.7x
  Using model parameters for aggregation, sketches for filtering
Sketchguard Node 14:
  Model dim: 1,174,986 → Sketch size: 180
  Compression ratio: 6527.7x
  Using model parameters for aggregation, sketches for filtering
Sketchguard Node 15:
  Model dim: 1,174,986 → Sketch size: 180
  Compression ratio: 6527.7x
  Using model parameters for aggregation, sketches for filtering
Sketchguard Node 16:
  Model dim: 1,174,986 → Sketch size: 180
  Compression ratio: 6527.7x
  Using model parameters for aggregation, sketches for filtering
Sketchguard Node 17:
  Model dim: 1,174,986 → Sketch size: 180
  Compression ratio: 6527.7x
  Using model parameters for aggregation, sketches for filtering
Sketchguard Node 18:
  Model dim: 1,174,986 → Sketch size: 180
  Compression ratio: 6527.7x
  Using model parameters for aggregation, sketches for filtering
Sketchguard Node 19:
  Model dim: 1,174,986 → Sketch size: 180
  Compression ratio: 6527.7x
  Using model parameters for aggregation, sketches for filtering
Sketchguard ALGORITHM (Sketch-based Filtering + State Aggregation)
  - Model dimension: 1,174,986 parameters
  - Config: SketchguardConfig(gamma=2, kappa=1, alpha=0.5, min_neighbors=1, sketch_size=180, network_seed=987654321, attack_detection_window=5)
  - Sketch size: 180
  - Compression ratio: 6527.7x
  - Complexity: O(d + N×k) = O(1,174,986 + 20×180)
  - Theoretical speedup vs BALANCE: 19.9x
Initial test acc across nodes: mean=0.4953 ± 0.0174
Round 001: test acc mean=0.5624 ± 0.0370 | min=0.4898 max=0.6301
         : test loss mean=0.6899 ± 0.0008
         : individual accs = ['0.549607', '0.589533', '0.516262', '0.489766', '0.600927', '0.572462', '0.594870', '0.620483', '0.558626', '0.537536', '0.539041', '0.564746', '0.630068', '0.533979', '0.510265', '0.609448', '0.546390', '0.571298', '0.533506', '0.580179']
         : correct/total = [(7822, 14232), (8392, 14235), (7365, 14266), (6963, 14217), (8556, 14238), (8228, 14373), (8534, 14346), (8894, 14334), (7985, 14294), (7726, 14373), (7732, 14344), (8077, 14302), (9044, 14354), (7669, 14362), (7307, 14320), (8773, 14395), (7862, 14389), (8145, 14257), (7603, 14251), (8354, 14399)]
         : sketchguard stats = ['Node 0: acc_rate=1.000', 'Node 1: acc_rate=1.000', 'Node 2: acc_rate=1.000']...
Round 002: test acc mean=0.5832 ± 0.0411 | min=0.4956 max=0.6262
         : test loss mean=0.6874 ± 0.0015
         : individual accs = ['0.592187', '0.618054', '0.602201', '0.598438', '0.596221', '0.615112', '0.626237', '0.624878', '0.589128', '0.546441', '0.621026', '0.533282', '0.506340', '0.567539', '0.495601', '0.598889', '0.514212', '0.624185', '0.574135', '0.619210']
         : correct/total = [(8428, 14232), (8798, 14235), (8591, 14266), (8508, 14217), (8489, 14238), (8841, 14373), (8984, 14346), (8957, 14334), (8421, 14294), (7854, 14373), (8908, 14344), (7627, 14302), (7268, 14354), (8151, 14362), (7097, 14320), (8621, 14395), (7399, 14389), (8899, 14257), (8182, 14251), (8916, 14399)]
         : sketchguard stats = ['Node 0: acc_rate=1.000', 'Node 1: acc_rate=1.000', 'Node 2: acc_rate=1.000']...
Round 003: test acc mean=0.5759 ± 0.0491 | min=0.4951 max=0.6400
         : test loss mean=0.6850 ± 0.0038
         : individual accs = ['0.495082', '0.567896', '0.621758', '0.602799', '0.625369', '0.631601', '0.500000', '0.526022', '0.639989', '0.625270', '0.627231', '0.524962', '0.510868', '0.624426', '0.545531', '0.512122', '0.576204', '0.609525', '0.559961', '0.590944']
         : correct/total = [(7046, 14232), (8084, 14235), (8870, 14266), (8570, 14217), (8904, 14238), (9078, 14373), (7173, 14346), (7540, 14334), (9148, 14294), (8987, 14373), (8997, 14344), (7508, 14302), (7333, 14354), (8968, 14362), (7812, 14320), (7372, 14395), (8291, 14389), (8690, 14257), (7980, 14251), (8509, 14399)]
         : sketchguard stats = ['Node 0: acc_rate=1.000', 'Node 1: acc_rate=1.000', 'Node 2: acc_rate=1.000']...
Round 004: test acc mean=0.6038 ± 0.0283 | min=0.5314 max=0.6391
         : test loss mean=0.6805 ± 0.0048
         : individual accs = ['0.632589', '0.629013', '0.577247', '0.628051', '0.564405', '0.638002', '0.576398', '0.589926', '0.609417', '0.573367', '0.634760', '0.623269', '0.531350', '0.598942', '0.591690', '0.591872', '0.613316', '0.611910', '0.621711', '0.639072']
         : correct/total = [(9003, 14232), (8954, 14235), (8235, 14266), (8929, 14217), (8036, 14238), (9170, 14373), (8269, 14346), (8456, 14334), (8711, 14294), (8241, 14373), (9105, 14344), (8914, 14302), (7627, 14354), (8602, 14362), (8473, 14320), (8520, 14395), (8825, 14389), (8724, 14257), (8860, 14251), (9202, 14399)]
         : sketchguard stats = ['Node 0: acc_rate=1.000', 'Node 1: acc_rate=1.000', 'Node 2: acc_rate=1.000']...
Round 005: test acc mean=0.6227 ± 0.0172 | min=0.5749 max=0.6494
         : test loss mean=0.6743 ± 0.0066
         : individual accs = ['0.610385', '0.634492', '0.623791', '0.618274', '0.604017', '0.624783', '0.634184', '0.625506', '0.643347', '0.597788', '0.632390', '0.634387', '0.609865', '0.623033', '0.635545', '0.634387', '0.574884', '0.634916', '0.607817', '0.649351']
         : correct/total = [(8687, 14232), (9032, 14235), (8899, 14266), (8790, 14217), (8600, 14238), (8980, 14373), (9098, 14346), (8966, 14334), (9196, 14294), (8592, 14373), (9071, 14344), (9073, 14302), (8754, 14354), (8948, 14362), (9101, 14320), (9132, 14395), (8272, 14389), (9052, 14257), (8662, 14251), (9350, 14399)]
         : sketchguard stats = ['Node 0: acc_rate=1.000', 'Node 1: acc_rate=1.000', 'Node 2: acc_rate=1.000']...
Round 006: test acc mean=0.6335 ± 0.0143 | min=0.6084 max=0.6509
         : test loss mean=0.6629 ± 0.0071
         : individual accs = ['0.637577', '0.642641', '0.633254', '0.638109', '0.648827', '0.648716', '0.609229', '0.615460', '0.649293', '0.626731', '0.614334', '0.608446', '0.643862', '0.638351', '0.643156', '0.609795', '0.632775', '0.647401', '0.632026', '0.650948']
         : correct/total = [(9074, 14232), (9148, 14235), (9034, 14266), (9072, 14217), (9238, 14238), (9324, 14373), (8740, 14346), (8822, 14334), (9281, 14294), (9008, 14373), (8812, 14344), (8702, 14302), (9242, 14354), (9168, 14362), (9210, 14320), (8778, 14395), (9105, 14389), (9230, 14257), (9007, 14251), (9373, 14399)]
         : sketchguard stats = ['Node 0: acc_rate=1.000', 'Node 1: acc_rate=1.000', 'Node 2: acc_rate=1.000']...
Round 007: test acc mean=0.6328 ± 0.0224 | min=0.5696 max=0.6532
         : test loss mean=0.6520 ± 0.0089
         : individual accs = ['0.643479', '0.636319', '0.646011', '0.624182', '0.647422', '0.653169', '0.641085', '0.635901', '0.644116', '0.645585', '0.647518', '0.578031', '0.652640', '0.569628', '0.648324', '0.617159', '0.638057', '0.636670', '0.611396', '0.638933']
         : correct/total = [(9158, 14232), (9058, 14235), (9216, 14266), (8874, 14217), (9218, 14238), (9388, 14373), (9197, 14346), (9115, 14334), (9207, 14294), (9279, 14373), (9288, 14344), (8267, 14302), (9368, 14354), (8181, 14362), (9284, 14320), (8884, 14395), (9181, 14389), (9077, 14257), (8713, 14251), (9200, 14399)]
         : sketchguard stats = ['Node 0: acc_rate=1.000', 'Node 1: acc_rate=1.000', 'Node 2: acc_rate=1.000']...
Round 008: test acc mean=0.6467 ± 0.0098 | min=0.6185 max=0.6591
         : test loss mean=0.6388 ± 0.0058
         : individual accs = ['0.641442', '0.618546', '0.640053', '0.656327', '0.648897', '0.645655', '0.652447', '0.641552', '0.658458', '0.650386', '0.655605', '0.654244', '0.641981', '0.629439', '0.652584', '0.648420', '0.650775', '0.649435', '0.639183', '0.659074']
         : correct/total = [(9129, 14232), (8805, 14235), (9131, 14266), (9331, 14217), (9239, 14238), (9280, 14373), (9360, 14346), (9196, 14334), (9412, 14294), (9348, 14373), (9404, 14344), (9357, 14302), (9215, 14354), (9040, 14362), (9345, 14320), (9334, 14395), (9364, 14389), (9259, 14257), (9109, 14251), (9490, 14399)]
         : sketchguard stats = ['Node 0: acc_rate=1.000', 'Node 1: acc_rate=1.000', 'Node 2: acc_rate=1.000']...
Round 009: test acc mean=0.6568 ± 0.0104 | min=0.6248 max=0.6685
         : test loss mean=0.6293 ± 0.0071
         : individual accs = ['0.624789', '0.662452', '0.656316', '0.657874', '0.663928', '0.664023', '0.661996', '0.668481', '0.653631', '0.634662', '0.655605', '0.653964', '0.662742', '0.656803', '0.662919', '0.647586', '0.665925', '0.664025', '0.655042', '0.664004']
         : correct/total = [(8892, 14232), (9430, 14235), (9363, 14266), (9353, 14217), (9453, 14238), (9544, 14373), (9497, 14346), (9582, 14334), (9343, 14294), (9122, 14373), (9404, 14344), (9353, 14302), (9513, 14354), (9433, 14362), (9493, 14320), (9322, 14395), (9582, 14389), (9467, 14257), (9335, 14251), (9561, 14399)]
         : sketchguard stats = ['Node 0: acc_rate=1.000', 'Node 1: acc_rate=1.000', 'Node 2: acc_rate=1.000']...
Round 010: test acc mean=0.6634 ± 0.0100 | min=0.6359 max=0.6739
         : test loss mean=0.6199 ± 0.0065
         : individual accs = ['0.661889', '0.672287', '0.640824', '0.664979', '0.672566', '0.673902', '0.668967', '0.673573', '0.664545', '0.656300', '0.667666', '0.664732', '0.670196', '0.658822', '0.669413', '0.660716', '0.668914', '0.668233', '0.654270', '0.635947']
         : correct/total = [(9420, 14232), (9570, 14235), (9142, 14266), (9454, 14217), (9576, 14238), (9686, 14373), (9597, 14346), (9655, 14334), (9499, 14294), (9433, 14373), (9577, 14344), (9507, 14302), (9620, 14354), (9462, 14362), (9586, 14320), (9511, 14395), (9625, 14389), (9527, 14257), (9324, 14251), (9157, 14399)]
         : sketchguard stats = ['Node 0: acc_rate=1.000', 'Node 1: acc_rate=1.000', 'Node 2: acc_rate=1.000']...

=== FINAL RESULTS ===
Dataset: sent140, Nodes: 20, Graph: erdos, Aggregation: sketchguard
Overall test accuracy: mean=0.6634 ± 0.0100

=== Sketchguard SUMMARY ===
Node 0: acceptance=1.000
Node 1: acceptance=1.000
Node 2: acceptance=1.000
Node 3: acceptance=1.000
Node 4: acceptance=1.000
Node 5: acceptance=1.000
Node 6: acceptance=1.000
Node 7: acceptance=1.000
Node 8: acceptance=1.000
Node 9: acceptance=1.000
Node 10: acceptance=1.000
Node 11: acceptance=1.000
Node 12: acceptance=1.000
Node 13: acceptance=1.000
Node 14: acceptance=1.000
Node 15: acceptance=1.000
Node 16: acceptance=1.000
Node 17: acceptance=1.000
Node 18: acceptance=1.000
Node 19: acceptance=1.000

=== PARALLEL EXECUTION TIME (realistic for distributed system) ===
  COMMUNICATION (max across nodes):
    - Sketch transfer: 0.000s (0.0%)
    - Model fetch (accepted): 0.000s (0.0%)
  COMPUTATION (max across nodes):
    - Sketching: 0.308s (94.1%)
    - Filtering: 0.001s (0.2%)
    - Aggregation: 0.018s (5.6%)
  TOTALS:
    - Total computation: 0.327s (100.0%)
    - Total communication: 0.000s (0.0%)
    - Total parallel time: 0.327s

=== PER-NODE AVERAGE TIME ===
  - Sketching: 0.243s
  - Filtering: 0.000s
  - Aggregation: 0.010s
  - Sketch transfer: 0.000s
  - Model fetch: 0.000s
  - Total per node: 0.254s

=== TOTAL COMPUTATIONAL WORK (sum across all nodes) ===
  - Total sketching: 4.861s
  - Total filtering: 0.008s
  - Total aggregation: 0.203s
  - Total sketch transfer: 0.000s
  - Total model fetch: 0.000s
  - Grand total: 5.072s
  - Mean acceptance rate: 1.000

Sketchguard Algorithm Properties:
  - Original dimension: 1,174,986
  - Sketch size: 180
  - Compression ratio: 19.9x
  - Single repetition: No repetitions needed
  - Theoretical complexity: O(d + N×k)
  - Approach: Sketch filtering + state aggregation
