Device: cuda
Seed: 987654321
Loading 1 LEAF Sent140 train files...
LEAF Sent140 train: 254555 users, 908652 samples
Building vocabulary (max_size=10000)...
Vocabulary size: 10000
Loading 1 LEAF Sent140 test files...
LEAF Sent140 test: 254555 users, 286281 samples
Found 254555 train users, 254555 test users, 254555 common users
User sample counts range: 494 (max) to 1 (min)
Distributed ALL 254555 users across 20 clients
Users per client: 12727 (with 15 clients getting +1 user)
Train partition sizes: [44353, 44290, 44657, 44907, 44696, 45843, 45801, 45619, 45069, 45639, 45821, 45311, 45779, 46056, 45625, 45984, 46428, 44737, 45540, 46497]
Test partition sizes: [14232, 14235, 14266, 14217, 14238, 14373, 14346, 14334, 14294, 14373, 14344, 14302, 14354, 14362, 14320, 14395, 14389, 14257, 14251, 14399]
  Client 0: 44353 train samples, 2 unique classes
  Client 1: 44290 train samples, 2 unique classes
  Client 2: 44657 train samples, 2 unique classes
  Client 3: 44907 train samples, 2 unique classes
  Client 4: 44696 train samples, 2 unique classes
  Client 5: 45843 train samples, 2 unique classes
  Client 6: 45801 train samples, 2 unique classes
  Client 7: 45619 train samples, 2 unique classes
  Client 8: 45069 train samples, 2 unique classes
  Client 9: 45639 train samples, 2 unique classes
  Client 10: 45821 train samples, 2 unique classes
  Client 11: 45311 train samples, 2 unique classes
  Client 12: 45779 train samples, 2 unique classes
  Client 13: 46056 train samples, 2 unique classes
  Client 14: 45625 train samples, 2 unique classes
  Client 15: 45984 train samples, 2 unique classes
  Client 16: 46428 train samples, 2 unique classes
  Client 17: 44737 train samples, 2 unique classes
  Client 18: 45540 train samples, 2 unique classes
  Client 19: 46497 train samples, 2 unique classes
Will sample 4500 samples per client per epoch
Graph: erdos, nodes: 20, edges: 126
Degree statistics: avg=12.60, min=8, max=16
Attack: Compromised 8/20 nodes: [1, 5, 11, 12, 13, 14, 17, 18]
Attack type: krum, lambda: 1.0
Model variant: baseline
Model parameters: 1,174,986
BALANCE algorithm:
Balance Config: BALANCEConfig(gamma=2, kappa=1, alpha=0.5, min_neighbors=1)
  - Model dimension: 1,174,986 parameters
  - Complexity: O(N×d) = O(20×1,174,986)
Initial test acc across nodes: mean=0.4953 ± 0.0174
Round 001: test acc mean=0.5027 ± 0.0109 | min=0.4798 max=0.5254
         : test loss mean=1.2159 ± 0.3029
         : individual accs = ['0.491709', '0.492308', '0.513669', '0.525357', '0.503371', '0.489112', '0.504879', '0.511093', '0.502938', '0.523969', '0.503695', '0.503916', '0.508569', '0.493037', '0.498115', '0.501285', '0.509486', '0.503542', '0.479756', '0.493784']
         : correct/total = [(6998, 14232), (7008, 14235), (7328, 14266), (7469, 14217), (7167, 14238), (7030, 14373), (7243, 14346), (7326, 14334), (7189, 14294), (7531, 14373), (7225, 14344), (7207, 14302), (7300, 14354), (7081, 14362), (7133, 14320), (7216, 14395), (7331, 14389), (7179, 14257), (6837, 14251), (7110, 14399)]
         : compromised: 0.4960, honest: 0.5071
Round 002: test acc mean=0.5173 ± 0.0223 | min=0.4879 max=0.5660
         : test loss mean=0.6944 ± 0.0061
         : individual accs = ['0.501335', '0.529540', '0.487943', '0.490821', '0.565950', '0.495999', '0.505228', '0.528743', '0.501959', '0.506505', '0.537577', '0.520696', '0.497144', '0.553057', '0.550419', '0.509899', '0.507471', '0.504524', '0.546769', '0.503993']
         : correct/total = [(7135, 14232), (7538, 14235), (6961, 14266), (6978, 14217), (8058, 14238), (7129, 14373), (7248, 14346), (7579, 14334), (7175, 14294), (7280, 14373), (7711, 14344), (7447, 14302), (7136, 14354), (7943, 14362), (7882, 14320), (7340, 14395), (7302, 14389), (7193, 14257), (7792, 14251), (7257, 14399)]
         : compromised: 0.5248, honest: 0.5123
Round 003: test acc mean=0.5368 ± 0.0271 | min=0.4959 max=0.5891
         : test loss mean=0.6885 ± 0.0038
         : individual accs = ['0.538083', '0.528556', '0.525305', '0.538159', '0.580840', '0.495930', '0.589084', '0.522185', '0.502728', '0.533848', '0.540017', '0.509439', '0.497074', '0.567470', '0.550838', '0.538242', '0.579192', '0.540506', '0.555049', '0.503160']
         : correct/total = [(7658, 14232), (7524, 14235), (7494, 14266), (7651, 14217), (8270, 14238), (7128, 14373), (8451, 14346), (7485, 14334), (7186, 14294), (7673, 14373), (7746, 14344), (7286, 14302), (7135, 14354), (8150, 14362), (7888, 14320), (7748, 14395), (8334, 14389), (7706, 14257), (7910, 14251), (7245, 14399)]
         : compromised: 0.5306, honest: 0.5409
Round 004: test acc mean=0.5924 ± 0.0245 | min=0.5257 max=0.6244
         : test loss mean=0.6810 ± 0.0052
         : individual accs = ['0.568437', '0.620724', '0.611874', '0.597665', '0.624385', '0.600640', '0.592918', '0.608762', '0.559466', '0.616016', '0.601576', '0.615858', '0.605754', '0.572483', '0.562849', '0.584925', '0.575718', '0.525707', '0.592309', '0.610181']
         : correct/total = [(8090, 14232), (8836, 14235), (8729, 14266), (8497, 14217), (8890, 14238), (8633, 14373), (8506, 14346), (8726, 14334), (7997, 14294), (8854, 14373), (8629, 14344), (8808, 14302), (8695, 14354), (8222, 14362), (8060, 14320), (8420, 14395), (8284, 14389), (7495, 14257), (8441, 14251), (8786, 14399)]
         : compromised: 0.5870, honest: 0.5960
Round 005: test acc mean=0.6238 ± 0.0133 | min=0.5796 max=0.6393
         : test loss mean=0.6666 ± 0.0049
         : individual accs = ['0.621557', '0.637373', '0.627506', '0.631920', '0.639275', '0.633340', '0.631186', '0.613925', '0.627676', '0.626174', '0.602342', '0.626206', '0.632507', '0.610361', '0.631285', '0.627579', '0.627980', '0.579645', '0.622202', '0.626849']
         : correct/total = [(8846, 14232), (9073, 14235), (8952, 14266), (8984, 14217), (9102, 14238), (9103, 14373), (9055, 14346), (8800, 14334), (8972, 14294), (9000, 14373), (8640, 14344), (8956, 14302), (9079, 14354), (8766, 14362), (9040, 14320), (9034, 14395), (9036, 14389), (8264, 14257), (8867, 14251), (9026, 14399)]
         : compromised: 0.6216, honest: 0.6253
Round 006: test acc mean=0.6397 ± 0.0063 | min=0.6247 max=0.6477
         : test loss mean=0.6463 ± 0.0046
         : individual accs = ['0.631675', '0.646716', '0.637249', '0.645284', '0.645034', '0.647673', '0.642827', '0.638901', '0.643697', '0.640367', '0.632599', '0.624668', '0.633900', '0.644827', '0.642458', '0.637999', '0.647717', '0.639335', '0.629640', '0.642197']
         : correct/total = [(8990, 14232), (9206, 14235), (9091, 14266), (9174, 14217), (9184, 14238), (9309, 14373), (9222, 14346), (9158, 14334), (9201, 14294), (9204, 14373), (9074, 14344), (8934, 14302), (9099, 14354), (9261, 14362), (9200, 14320), (9184, 14395), (9320, 14389), (9115, 14257), (8973, 14251), (9247, 14399)]
         : compromised: 0.6387, honest: 0.6405
Round 007: test acc mean=0.6480 ± 0.0049 | min=0.6375 max=0.6587
         : test loss mean=0.6310 ± 0.0043
         : individual accs = ['0.649944', '0.658658', '0.646011', '0.645143', '0.651917', '0.654213', '0.645964', '0.643644', '0.649573', '0.650177', '0.642011', '0.649420', '0.651386', '0.637516', '0.652235', '0.643209', '0.652026', '0.645998', '0.641429', '0.649281']
         : correct/total = [(9250, 14232), (9376, 14235), (9216, 14266), (9172, 14217), (9282, 14238), (9403, 14373), (9267, 14346), (9226, 14334), (9285, 14294), (9345, 14373), (9209, 14344), (9288, 14302), (9350, 14354), (9156, 14362), (9340, 14320), (9259, 14395), (9382, 14389), (9210, 14257), (9141, 14251), (9349, 14399)]
         : compromised: 0.6489, honest: 0.6474
Round 008: test acc mean=0.6556 ± 0.0049 | min=0.6444 max=0.6642
         : test loss mean=0.6206 ± 0.0041
         : individual accs = ['0.654933', '0.655427', '0.644399', '0.660055', '0.657677', '0.664232', '0.659487', '0.659690', '0.658878', '0.655117', '0.649819', '0.650608', '0.653616', '0.658613', '0.647556', '0.653491', '0.660852', '0.657852', '0.650691', '0.658101']
         : correct/total = [(9321, 14232), (9330, 14235), (9193, 14266), (9384, 14217), (9364, 14238), (9547, 14373), (9461, 14346), (9456, 14334), (9418, 14294), (9416, 14373), (9321, 14344), (9305, 14302), (9382, 14354), (9459, 14362), (9273, 14320), (9407, 14395), (9509, 14389), (9379, 14257), (9273, 14251), (9476, 14399)]
         : compromised: 0.6548, honest: 0.6560
Round 009: test acc mean=0.6553 ± 0.0087 | min=0.6339 max=0.6691
         : test loss mean=0.6173 ± 0.0065
         : individual accs = ['0.633853', '0.667791', '0.651900', '0.660758', '0.652058', '0.665345', '0.644779', '0.647900', '0.663845', '0.657622', '0.648146', '0.648720', '0.661000', '0.662025', '0.656704', '0.644877', '0.669122', '0.655327', '0.659322', '0.654976']
         : correct/total = [(9021, 14232), (9506, 14235), (9300, 14266), (9394, 14217), (9284, 14238), (9563, 14373), (9250, 14346), (9287, 14334), (9489, 14294), (9452, 14373), (9297, 14344), (9278, 14302), (9488, 14354), (9508, 14362), (9404, 14320), (9283, 14395), (9628, 14389), (9343, 14257), (9396, 14251), (9431, 14399)]
         : compromised: 0.6595, honest: 0.6525
Round 010: test acc mean=0.6663 ± 0.0091 | min=0.6358 max=0.6753
         : test loss mean=0.6064 ± 0.0066
         : individual accs = ['0.669618', '0.667158', '0.635847', '0.670957', '0.675306', '0.669311', '0.672313', '0.673294', '0.672100', '0.666319', '0.664180', '0.665571', '0.675073', '0.671494', '0.665503', '0.653560', '0.674821', '0.667672', '0.658901', '0.657476']
         : correct/total = [(9530, 14232), (9497, 14235), (9071, 14266), (9539, 14217), (9615, 14238), (9620, 14373), (9645, 14346), (9651, 14334), (9607, 14294), (9577, 14373), (9527, 14344), (9519, 14302), (9690, 14354), (9644, 14362), (9530, 14320), (9408, 14395), (9710, 14389), (9519, 14257), (9390, 14251), (9467, 14399)]
         : compromised: 0.6676, honest: 0.6655

=== FINAL RESULTS ===
Dataset: sent140, Nodes: 20, Graph: erdos, Aggregation: balance
Attack: krum, 40.0% compromised
Final accuracy - Compromised: 0.6676, Honest: 0.6655
Overall test accuracy: mean=0.6663 ± 0.0091

=== BALANCE SUMMARY ===
Node 0: acceptance=0.606
Node 1: acceptance=0.755
Node 2: acceptance=0.550
Node 3: acceptance=0.662
Node 4: acceptance=0.591
Node 5: acceptance=0.580
Node 6: acceptance=0.550
Node 7: acceptance=0.550
Node 8: acceptance=0.550
Node 9: acceptance=0.723
Node 10: acceptance=0.600
Node 11: acceptance=0.614
Node 12: acceptance=0.700
Node 13: acceptance=0.723
Node 14: acceptance=0.640
Node 15: acceptance=0.591
Node 16: acceptance=0.585
Node 17: acceptance=0.700
Node 18: acceptance=0.719
Node 19: acceptance=0.550

=== PARALLEL EXECUTION TIME (realistic for distributed system) ===
  COMMUNICATION (max across nodes):
    - Full model transfer: 0.000s (0.0%)
  COMPUTATION (max across nodes):
    - Filtering: 0.065s (81.1%)
    - Aggregation: 0.015s (18.9%)
  TOTALS:
    - Total computation: 0.080s (100.0%)
    - Total communication: 0.000s (0.0%)
    - Total parallel time: 0.080s

=== PER-NODE AVERAGE TIME ===
  - Filtering: 0.051s
  - Aggregation: 0.008s
  - Model transfer: 0.000s
  - Total per node: 0.059s

=== TOTAL COMPUTATIONAL WORK (sum across all nodes) ===
  - Total filtering: 1.016s
  - Total aggregation: 0.169s
  - Total model transfer: 0.000s
  - Grand total: 1.185s
  - Mean acceptance rate: 0.627

BALANCE Algorithm Properties:
  - Model dimension: 1,174,986
  - No compression: Full parameter comparison
  - Theoretical complexity: O(deg(i)×d)
  - Approach: Full parameter filtering + averaging
