Device: cuda
Seed: 987654321
Loading 1 LEAF Sent140 train files...
LEAF Sent140 train: 254555 users, 908652 samples
Building vocabulary (max_size=10000)...
Vocabulary size: 10000
Loading 1 LEAF Sent140 test files...
LEAF Sent140 test: 254555 users, 286281 samples
Found 254555 train users, 254555 test users, 254555 common users
User sample counts range: 494 (max) to 1 (min)
Distributed ALL 254555 users across 20 clients
Users per client: 12727 (with 15 clients getting +1 user)
Train partition sizes: [44353, 44290, 44657, 44907, 44696, 45843, 45801, 45619, 45069, 45639, 45821, 45311, 45779, 46056, 45625, 45984, 46428, 44737, 45540, 46497]
Test partition sizes: [14232, 14235, 14266, 14217, 14238, 14373, 14346, 14334, 14294, 14373, 14344, 14302, 14354, 14362, 14320, 14395, 14389, 14257, 14251, 14399]
  Client 0: 44353 train samples, 2 unique classes
  Client 1: 44290 train samples, 2 unique classes
  Client 2: 44657 train samples, 2 unique classes
  Client 3: 44907 train samples, 2 unique classes
  Client 4: 44696 train samples, 2 unique classes
  Client 5: 45843 train samples, 2 unique classes
  Client 6: 45801 train samples, 2 unique classes
  Client 7: 45619 train samples, 2 unique classes
  Client 8: 45069 train samples, 2 unique classes
  Client 9: 45639 train samples, 2 unique classes
  Client 10: 45821 train samples, 2 unique classes
  Client 11: 45311 train samples, 2 unique classes
  Client 12: 45779 train samples, 2 unique classes
  Client 13: 46056 train samples, 2 unique classes
  Client 14: 45625 train samples, 2 unique classes
  Client 15: 45984 train samples, 2 unique classes
  Client 16: 46428 train samples, 2 unique classes
  Client 17: 44737 train samples, 2 unique classes
  Client 18: 45540 train samples, 2 unique classes
  Client 19: 46497 train samples, 2 unique classes
Will sample 4500 samples per client per epoch
Graph: fully, nodes: 20, edges: 190
Degree statistics: avg=19.00, min=19, max=19
Attack: Compromised 10/20 nodes: [1, 2, 5, 11, 12, 13, 14, 15, 17, 18]
Attack type: backdoor, lambda: 1.0
Backdoor target label: 1, trigger size: 3
Model variant: baseline
Model parameters: 1,174,986
BALANCE algorithm:
Balance Config: BALANCEConfig(gamma=2, kappa=1, alpha=0.5, min_neighbors=1)
  - Model dimension: 1,174,986 parameters
  - Complexity: O(N×d) = O(20×1,174,986)
Initial test acc across nodes: mean=0.4953 ± 0.0174
Backdoor attack: Created poisoned datasets for 10 compromised nodes
Round 001: test acc mean=0.5021 ± 0.0083 | min=0.4832 max=0.5186
         : test loss mean=25.7186 ± 27.0928
         : individual accs = ['0.483207', '0.504742', '0.500210', '0.500035', '0.496980', '0.504070', '0.498536', '0.518557', '0.498601', '0.497252', '0.488776', '0.505524', '0.509475', '0.510026', '0.501816', '0.497048', '0.512336', '0.499755', '0.498842', '0.516078']
         : correct/total = [(6877, 14232), (7185, 14235), (7136, 14266), (7109, 14217), (7076, 14238), (7245, 14373), (7152, 14346), (7433, 14334), (7127, 14294), (7147, 14373), (7011, 14344), (7230, 14302), (7313, 14354), (7325, 14362), (7186, 14320), (7155, 14395), (7372, 14389), (7125, 14257), (7109, 14251), (7431, 14399)]
         : compromised: 0.5032, honest: 0.5010
Round 002: test acc mean=0.5087 ± 0.0104 | min=0.4895 max=0.5393
         : test loss mean=352.4777 ± 367.8743
         : individual accs = ['0.507378', '0.516403', '0.509884', '0.515017', '0.505689', '0.500731', '0.513732', '0.539277', '0.515391', '0.503931', '0.501743', '0.508530', '0.494148', '0.489486', '0.503142', '0.520389', '0.507471', '0.500035', '0.503544', '0.517189']
         : correct/total = [(7221, 14232), (7351, 14235), (7274, 14266), (7322, 14217), (7200, 14238), (7197, 14373), (7370, 14346), (7730, 14334), (7367, 14294), (7243, 14373), (7197, 14344), (7273, 14302), (7093, 14354), (7030, 14362), (7205, 14320), (7491, 14395), (7302, 14389), (7129, 14257), (7176, 14251), (7447, 14399)]
         : compromised: 0.5046, honest: 0.5127
Round 003: test acc mean=0.5163 ± 0.0246 | min=0.4752 max=0.5783
         : test loss mean=9551.2971 ± 10500.2151
         : individual accs = ['0.559162', '0.499543', '0.506519', '0.517409', '0.553308', '0.497878', '0.475185', '0.539626', '0.530222', '0.505114', '0.578291', '0.497133', '0.495193', '0.506684', '0.507682', '0.503717', '0.530544', '0.515957', '0.512525', '0.495173']
         : correct/total = [(7958, 14232), (7111, 14235), (7226, 14266), (7356, 14217), (7878, 14238), (7156, 14373), (6817, 14346), (7735, 14334), (7579, 14294), (7260, 14373), (8295, 14344), (7110, 14302), (7108, 14354), (7277, 14362), (7270, 14320), (7251, 14395), (7634, 14389), (7356, 14257), (7304, 14251), (7130, 14399)]
         : compromised: 0.5043, honest: 0.5284
Round 004: test acc mean=0.5478 ± 0.0510 | min=0.4858 max=0.6198
         : test loss mean=2239871.1893 ± 2925942.0351
         : individual accs = ['0.603850', '0.507201', '0.485840', '0.605332', '0.615325', '0.504279', '0.593963', '0.603879', '0.598503', '0.535657', '0.560443', '0.503076', '0.495054', '0.506893', '0.496508', '0.498367', '0.615957', '0.506488', '0.499193', '0.619835']
         : correct/total = [(8594, 14232), (7220, 14235), (6931, 14266), (8606, 14217), (8761, 14238), (7248, 14373), (8521, 14346), (8656, 14334), (8555, 14294), (7699, 14373), (8039, 14344), (7195, 14302), (7106, 14354), (7280, 14362), (7110, 14320), (7174, 14395), (8863, 14389), (7221, 14257), (7114, 14251), (8925, 14399)]
         : compromised: 0.5003, honest: 0.5953
Round 005: test acc mean=0.5664 ± 0.0673 | min=0.4860 max=0.6401
         : test loss mean=65694966.7884 ± 76889640.7558
         : individual accs = ['0.636102', '0.515911', '0.485981', '0.635999', '0.637168', '0.494956', '0.632999', '0.632971', '0.633762', '0.623739', '0.623606', '0.499371', '0.497283', '0.494987', '0.506634', '0.498437', '0.637362', '0.496458', '0.504315', '0.640114']
         : correct/total = [(9053, 14232), (7344, 14235), (6933, 14266), (9042, 14217), (9072, 14238), (7114, 14373), (9081, 14346), (9073, 14334), (9059, 14294), (8965, 14373), (8945, 14344), (7142, 14302), (7138, 14354), (7109, 14362), (7255, 14320), (7175, 14395), (9171, 14389), (7078, 14257), (7187, 14251), (9217, 14399)]
         : compromised: 0.4994, honest: 0.6334
Round 006: test acc mean=0.5750 ± 0.0717 | min=0.4932 max=0.6516
         : test loss mean=4053950605.2626 ± 4784812466.7455
         : individual accs = ['0.645236', '0.513383', '0.511496', '0.648308', '0.646861', '0.495512', '0.649031', '0.647761', '0.649223', '0.641620', '0.637758', '0.507621', '0.493173', '0.505501', '0.500559', '0.499340', '0.651609', '0.506278', '0.502000', '0.646781']
         : correct/total = [(9183, 14232), (7308, 14235), (7297, 14266), (9217, 14217), (9210, 14238), (7122, 14373), (9311, 14346), (9285, 14334), (9280, 14294), (9222, 14373), (9148, 14344), (7260, 14302), (7079, 14354), (7260, 14362), (7168, 14320), (7188, 14395), (9376, 14389), (7218, 14257), (7154, 14251), (9313, 14399)]
         : compromised: 0.5035, honest: 0.6464
Round 007: test acc mean=0.5762 ± 0.0765 | min=0.4918 max=0.6597
         : test loss mean=415911885324.5114 ± 453519923633.2134
         : individual accs = ['0.652825', '0.502283', '0.492359', '0.655202', '0.657606', '0.508384', '0.655793', '0.641900', '0.657339', '0.647255', '0.644032', '0.497553', '0.497353', '0.497981', '0.496508', '0.510524', '0.659671', '0.491758', '0.504807', '0.653379']
         : correct/total = [(9291, 14232), (7150, 14235), (7024, 14266), (9315, 14217), (9363, 14238), (7307, 14373), (9408, 14346), (9201, 14334), (9396, 14294), (9303, 14373), (9238, 14344), (7116, 14302), (7139, 14354), (7152, 14362), (7110, 14320), (7349, 14395), (9492, 14389), (7011, 14257), (7194, 14251), (9408, 14399)]
         : compromised: 0.5000, honest: 0.6525
Round 008: test acc mean=0.5804 ± 0.0806 | min=0.4899 max=0.6684
         : test loss mean=30222532748529.4883 ± 32710591615457.7852
         : individual accs = ['0.656549', '0.505093', '0.506309', '0.660547', '0.656483', '0.497739', '0.661787', '0.658086', '0.664055', '0.662631', '0.656302', '0.496993', '0.493451', '0.506406', '0.489944', '0.500382', '0.668427', '0.501368', '0.501649', '0.663449']
         : correct/total = [(9344, 14232), (7190, 14235), (7223, 14266), (9391, 14217), (9347, 14238), (7154, 14373), (9494, 14346), (9433, 14334), (9492, 14294), (9524, 14373), (9414, 14344), (7108, 14302), (7083, 14354), (7273, 14362), (7016, 14320), (7203, 14395), (9618, 14389), (7148, 14257), (7149, 14251), (9553, 14399)]
         : compromised: 0.4999, honest: 0.6608
Round 009: test acc mean=0.5798 ± 0.0807 | min=0.4859 max=0.6700
         : test loss mean=2803696767019838.0000 ± 3089755880270006.5000
         : individual accs = ['0.643339', '0.502353', '0.510585', '0.664416', '0.663366', '0.489668', '0.649310', '0.667922', '0.664824', '0.661240', '0.653165', '0.497553', '0.485927', '0.504526', '0.504609', '0.498229', '0.670026', '0.506278', '0.494913', '0.663866']
         : correct/total = [(9156, 14232), (7151, 14235), (7284, 14266), (9446, 14217), (9445, 14238), (7038, 14373), (9315, 14346), (9574, 14334), (9503, 14294), (9504, 14373), (9369, 14344), (7116, 14302), (6975, 14354), (7246, 14362), (7226, 14320), (7172, 14395), (9641, 14389), (7218, 14257), (7053, 14251), (9559, 14399)]
         : compromised: 0.4995, honest: 0.6601
Round 010: test acc mean=0.5900 ± 0.0849 | min=0.4952 max=0.6810
         : test loss mean=311235920159992256.0000 ± 368229954612915968.0000
         : individual accs = ['0.670883', '0.514155', '0.513038', '0.674474', '0.678255', '0.501078', '0.677959', '0.681038', '0.672940', '0.668615', '0.674219', '0.505384', '0.514630', '0.511419', '0.497207', '0.500382', '0.676072', '0.495195', '0.500526', '0.672477']
         : correct/total = [(9548, 14232), (7319, 14235), (7319, 14266), (9589, 14217), (9657, 14238), (7202, 14373), (9726, 14346), (9762, 14334), (9619, 14294), (9610, 14373), (9671, 14344), (7228, 14302), (7387, 14354), (7345, 14362), (7120, 14320), (7203, 14395), (9728, 14389), (7060, 14257), (7133, 14251), (9683, 14399)]
         : compromised: 0.5053, honest: 0.6747

=== FINAL RESULTS ===
Dataset: sent140, Nodes: 20, Graph: fully, Aggregation: balance
Attack: backdoor, 50.0% compromised
Final accuracy - Compromised: 0.5053, Honest: 0.6747
Overall test accuracy: mean=0.5900 ± 0.0849

=== BACKDOOR ATTACK SUCCESS RATE (ASR) ===
Target label: 1
Trigger size: 3x3
Overall ASR: 0.6736 ± 0.2309
Honest nodes ASR: 0.4757 ± 0.0450
Compromised nodes ASR: 0.8714 ± 0.1624
Note: Higher ASR indicates more successful backdoor attack

=== BALANCE SUMMARY ===
Node 0: acceptance=0.526
Node 1: acceptance=0.600
Node 2: acceptance=0.600
Node 3: acceptance=0.526
Node 4: acceptance=0.526
Node 5: acceptance=0.600
Node 6: acceptance=0.526
Node 7: acceptance=0.526
Node 8: acceptance=0.526
Node 9: acceptance=0.526
Node 10: acceptance=0.526
Node 11: acceptance=0.600
Node 12: acceptance=0.600
Node 13: acceptance=0.600
Node 14: acceptance=0.600
Node 15: acceptance=0.600
Node 16: acceptance=0.526
Node 17: acceptance=0.600
Node 18: acceptance=0.600
Node 19: acceptance=0.526

=== PARALLEL EXECUTION TIME (realistic for distributed system) ===
  COMMUNICATION (max across nodes):
    - Full model transfer: 0.000s (0.0%)
  COMPUTATION (max across nodes):
    - Filtering: 0.076s (83.3%)
    - Aggregation: 0.015s (16.7%)
  TOTALS:
    - Total computation: 0.091s (100.0%)
    - Total communication: 0.000s (0.0%)
    - Total parallel time: 0.091s

=== PER-NODE AVERAGE TIME ===
  - Filtering: 0.074s
  - Aggregation: 0.010s
  - Model transfer: 0.000s
  - Total per node: 0.084s

=== TOTAL COMPUTATIONAL WORK (sum across all nodes) ===
  - Total filtering: 1.488s
  - Total aggregation: 0.198s
  - Total model transfer: 0.000s
  - Grand total: 1.687s
  - Mean acceptance rate: 0.563

BALANCE Algorithm Properties:
  - Model dimension: 1,174,986
  - No compression: Full parameter comparison
  - Theoretical complexity: O(deg(i)×d)
  - Approach: Full parameter filtering + averaging
