Device: cuda
Seed: 987654321
Loading 1 LEAF Sent140 train files...
LEAF Sent140 train: 254555 users, 908652 samples
Building vocabulary (max_size=10000)...
Vocabulary size: 10000
Loading 1 LEAF Sent140 test files...
LEAF Sent140 test: 254555 users, 286281 samples
Found 254555 train users, 254555 test users, 254555 common users
User sample counts range: 494 (max) to 1 (min)
Distributed ALL 254555 users across 20 clients
Users per client: 12727 (with 15 clients getting +1 user)
Train partition sizes: [44353, 44290, 44657, 44907, 44696, 45843, 45801, 45619, 45069, 45639, 45821, 45311, 45779, 46056, 45625, 45984, 46428, 44737, 45540, 46497]
Test partition sizes: [14232, 14235, 14266, 14217, 14238, 14373, 14346, 14334, 14294, 14373, 14344, 14302, 14354, 14362, 14320, 14395, 14389, 14257, 14251, 14399]
  Client 0: 44353 train samples, 2 unique classes
  Client 1: 44290 train samples, 2 unique classes
  Client 2: 44657 train samples, 2 unique classes
  Client 3: 44907 train samples, 2 unique classes
  Client 4: 44696 train samples, 2 unique classes
  Client 5: 45843 train samples, 2 unique classes
  Client 6: 45801 train samples, 2 unique classes
  Client 7: 45619 train samples, 2 unique classes
  Client 8: 45069 train samples, 2 unique classes
  Client 9: 45639 train samples, 2 unique classes
  Client 10: 45821 train samples, 2 unique classes
  Client 11: 45311 train samples, 2 unique classes
  Client 12: 45779 train samples, 2 unique classes
  Client 13: 46056 train samples, 2 unique classes
  Client 14: 45625 train samples, 2 unique classes
  Client 15: 45984 train samples, 2 unique classes
  Client 16: 46428 train samples, 2 unique classes
  Client 17: 44737 train samples, 2 unique classes
  Client 18: 45540 train samples, 2 unique classes
  Client 19: 46497 train samples, 2 unique classes
Will sample 4500 samples per client per epoch
Graph: fully, nodes: 20, edges: 190
Degree statistics: avg=19.00, min=19, max=19
Model variant: baseline
Model parameters: 1,174,986
Sketchguard Node 0:
  Model dim: 1,174,986 → Sketch size: 180
  Compression ratio: 6527.7x
  Using model parameters for aggregation, sketches for filtering
Sketchguard Node 1:
  Model dim: 1,174,986 → Sketch size: 180
  Compression ratio: 6527.7x
  Using model parameters for aggregation, sketches for filtering
Sketchguard Node 2:
  Model dim: 1,174,986 → Sketch size: 180
  Compression ratio: 6527.7x
  Using model parameters for aggregation, sketches for filtering
Sketchguard Node 3:
  Model dim: 1,174,986 → Sketch size: 180
  Compression ratio: 6527.7x
  Using model parameters for aggregation, sketches for filtering
Sketchguard Node 4:
  Model dim: 1,174,986 → Sketch size: 180
  Compression ratio: 6527.7x
  Using model parameters for aggregation, sketches for filtering
Sketchguard Node 5:
  Model dim: 1,174,986 → Sketch size: 180
  Compression ratio: 6527.7x
  Using model parameters for aggregation, sketches for filtering
Sketchguard Node 6:
  Model dim: 1,174,986 → Sketch size: 180
  Compression ratio: 6527.7x
  Using model parameters for aggregation, sketches for filtering
Sketchguard Node 7:
  Model dim: 1,174,986 → Sketch size: 180
  Compression ratio: 6527.7x
  Using model parameters for aggregation, sketches for filtering
Sketchguard Node 8:
  Model dim: 1,174,986 → Sketch size: 180
  Compression ratio: 6527.7x
  Using model parameters for aggregation, sketches for filtering
Sketchguard Node 9:
  Model dim: 1,174,986 → Sketch size: 180
  Compression ratio: 6527.7x
  Using model parameters for aggregation, sketches for filtering
Sketchguard Node 10:
  Model dim: 1,174,986 → Sketch size: 180
  Compression ratio: 6527.7x
  Using model parameters for aggregation, sketches for filtering
Sketchguard Node 11:
  Model dim: 1,174,986 → Sketch size: 180
  Compression ratio: 6527.7x
  Using model parameters for aggregation, sketches for filtering
Sketchguard Node 12:
  Model dim: 1,174,986 → Sketch size: 180
  Compression ratio: 6527.7x
  Using model parameters for aggregation, sketches for filtering
Sketchguard Node 13:
  Model dim: 1,174,986 → Sketch size: 180
  Compression ratio: 6527.7x
  Using model parameters for aggregation, sketches for filtering
Sketchguard Node 14:
  Model dim: 1,174,986 → Sketch size: 180
  Compression ratio: 6527.7x
  Using model parameters for aggregation, sketches for filtering
Sketchguard Node 15:
  Model dim: 1,174,986 → Sketch size: 180
  Compression ratio: 6527.7x
  Using model parameters for aggregation, sketches for filtering
Sketchguard Node 16:
  Model dim: 1,174,986 → Sketch size: 180
  Compression ratio: 6527.7x
  Using model parameters for aggregation, sketches for filtering
Sketchguard Node 17:
  Model dim: 1,174,986 → Sketch size: 180
  Compression ratio: 6527.7x
  Using model parameters for aggregation, sketches for filtering
Sketchguard Node 18:
  Model dim: 1,174,986 → Sketch size: 180
  Compression ratio: 6527.7x
  Using model parameters for aggregation, sketches for filtering
Sketchguard Node 19:
  Model dim: 1,174,986 → Sketch size: 180
  Compression ratio: 6527.7x
  Using model parameters for aggregation, sketches for filtering
Sketchguard ALGORITHM (Sketch-based Filtering + State Aggregation)
  - Model dimension: 1,174,986 parameters
  - Config: SketchguardConfig(gamma=2, kappa=1, alpha=0.5, min_neighbors=1, sketch_size=180, network_seed=987654321, attack_detection_window=5)
  - Sketch size: 180
  - Compression ratio: 6527.7x
  - Complexity: O(d + N×k) = O(1,174,986 + 20×180)
  - Theoretical speedup vs BALANCE: 19.9x
Initial test acc across nodes: mean=0.4953 ± 0.0174
Round 001: test acc mean=0.5618 ± 0.0424 | min=0.5021 max=0.6314
         : test loss mean=0.6897 ± 0.0007
         : individual accs = ['0.554174', '0.585037', '0.514790', '0.521277', '0.623543', '0.546302', '0.629304', '0.620692', '0.518050', '0.561956', '0.512758', '0.546357', '0.631392', '0.541359', '0.528701', '0.564710', '0.502120', '0.566038', '0.538980', '0.628585']
         : correct/total = [(7887, 14232), (8328, 14235), (7344, 14266), (7411, 14217), (8878, 14238), (7852, 14373), (9028, 14346), (8897, 14334), (7405, 14294), (8077, 14373), (7355, 14344), (7814, 14302), (9063, 14354), (7775, 14362), (7571, 14320), (8129, 14395), (7225, 14389), (8070, 14257), (7681, 14251), (9051, 14399)]
         : sketchguard stats = ['Node 0: acc_rate=1.000', 'Node 1: acc_rate=1.000', 'Node 2: acc_rate=1.000']...
Round 002: test acc mean=0.5552 ± 0.0528 | min=0.4926 max=0.6277
         : test loss mean=0.6909 ± 0.0006
         : individual accs = ['0.615725', '0.515841', '0.528529', '0.601604', '0.494522', '0.507827', '0.500976', '0.617413', '0.627676', '0.613998', '0.500906', '0.620263', '0.502856', '0.613355', '0.492598', '0.565752', '0.512336', '0.554394', '0.618272', '0.499271']
         : correct/total = [(8763, 14232), (7343, 14235), (7540, 14266), (8553, 14217), (7041, 14238), (7299, 14373), (7187, 14346), (8850, 14334), (8972, 14294), (8825, 14373), (7185, 14344), (8871, 14302), (7218, 14354), (8809, 14362), (7054, 14320), (8144, 14395), (7372, 14389), (7904, 14257), (8811, 14251), (7189, 14399)]
         : sketchguard stats = ['Node 0: acc_rate=1.000', 'Node 1: acc_rate=1.000', 'Node 2: acc_rate=1.000']...
Round 003: test acc mean=0.5150 ± 0.0366 | min=0.4842 max=0.6148
         : test loss mean=0.6913 ± 0.0010
         : individual accs = ['0.492622', '0.484229', '0.486962', '0.488711', '0.495575', '0.550129', '0.499791', '0.492745', '0.523157', '0.495234', '0.498397', '0.614809', '0.502926', '0.509121', '0.495042', '0.497881', '0.506081', '0.571930', '0.595046', '0.498785']
         : correct/total = [(7011, 14232), (6893, 14235), (6947, 14266), (6948, 14217), (7056, 14238), (7907, 14373), (7170, 14346), (7063, 14334), (7478, 14294), (7118, 14373), (7149, 14344), (8793, 14302), (7219, 14354), (7312, 14362), (7089, 14320), (7167, 14395), (7282, 14389), (8154, 14257), (8480, 14251), (7182, 14399)]
         : sketchguard stats = ['Node 0: acc_rate=1.000', 'Node 1: acc_rate=1.000', 'Node 2: acc_rate=1.000']...
Round 004: test acc mean=0.5254 ± 0.0423 | min=0.4852 max=0.6234
         : test loss mean=0.6901 ± 0.0014
         : individual accs = ['0.497189', '0.623393', '0.526146', '0.485194', '0.494522', '0.517289', '0.507807', '0.524208', '0.503078', '0.623322', '0.498397', '0.519158', '0.502996', '0.597340', '0.492598', '0.507746', '0.503927', '0.495546', '0.579047', '0.509063']
         : correct/total = [(7076, 14232), (8874, 14235), (7506, 14266), (6898, 14217), (7041, 14238), (7435, 14373), (7285, 14346), (7514, 14334), (7191, 14294), (8959, 14373), (7149, 14344), (7425, 14302), (7220, 14354), (8579, 14362), (7054, 14320), (7309, 14395), (7251, 14389), (7065, 14257), (8252, 14251), (7330, 14399)]
         : sketchguard stats = ['Node 0: acc_rate=1.000', 'Node 1: acc_rate=1.000', 'Node 2: acc_rate=1.000']...
Round 005: test acc mean=0.5942 ± 0.0368 | min=0.5164 max=0.6428
         : test loss mean=0.6852 ± 0.0021
         : individual accs = ['0.594997', '0.630558', '0.583135', '0.522684', '0.586529', '0.636958', '0.576886', '0.642807', '0.617952', '0.582342', '0.588190', '0.524612', '0.516441', '0.577078', '0.592388', '0.628135', '0.632358', '0.617171', '0.616027', '0.616362']
         : correct/total = [(8468, 14232), (8976, 14235), (8319, 14266), (7431, 14217), (8351, 14238), (9155, 14373), (8276, 14346), (9214, 14334), (8833, 14294), (8370, 14373), (8437, 14344), (7503, 14302), (7413, 14354), (8288, 14362), (8483, 14320), (9042, 14395), (9099, 14389), (8799, 14257), (8779, 14251), (8875, 14399)]
         : sketchguard stats = ['Node 0: acc_rate=1.000', 'Node 1: acc_rate=1.000', 'Node 2: acc_rate=1.000']...
Round 006: test acc mean=0.6276 ± 0.0106 | min=0.5915 max=0.6412
         : test loss mean=0.6700 ± 0.0033
         : individual accs = ['0.632097', '0.635897', '0.626595', '0.634944', '0.634359', '0.634314', '0.626098', '0.623483', '0.631943', '0.633827', '0.611615', '0.591526', '0.633203', '0.633199', '0.620810', '0.619521', '0.641184', '0.632461', '0.629219', '0.625807']
         : correct/total = [(8996, 14232), (9052, 14235), (8939, 14266), (9027, 14217), (9032, 14238), (9117, 14373), (8982, 14346), (8937, 14334), (9033, 14294), (9110, 14373), (8773, 14344), (8460, 14302), (9089, 14354), (9094, 14362), (8890, 14320), (8918, 14395), (9226, 14389), (9017, 14257), (8967, 14251), (9011, 14399)]
         : sketchguard stats = ['Node 0: acc_rate=1.000', 'Node 1: acc_rate=1.000', 'Node 2: acc_rate=1.000']...
Round 007: test acc mean=0.6330 ± 0.0125 | min=0.5987 max=0.6463
         : test loss mean=0.6475 ± 0.0049
         : individual accs = ['0.636734', '0.646294', '0.622319', '0.642119', '0.643349', '0.641272', '0.639969', '0.598716', '0.641878', '0.641481', '0.624651', '0.625787', '0.642817', '0.608341', '0.643296', '0.620771', '0.640628', '0.637091', '0.628237', '0.635044']
         : correct/total = [(9062, 14232), (9200, 14235), (8878, 14266), (9129, 14217), (9160, 14238), (9217, 14373), (9181, 14346), (8582, 14334), (9175, 14294), (9220, 14373), (8960, 14344), (8950, 14302), (9227, 14354), (8737, 14362), (9212, 14320), (8936, 14395), (9218, 14389), (9083, 14257), (8953, 14251), (9144, 14399)]
         : sketchguard stats = ['Node 0: acc_rate=1.000', 'Node 1: acc_rate=1.000', 'Node 2: acc_rate=1.000']...
Round 008: test acc mean=0.6452 ± 0.0075 | min=0.6292 max=0.6541
         : test loss mean=0.6342 ± 0.0050
         : individual accs = ['0.646993', '0.646013', '0.629188', '0.654146', '0.645737', '0.632505', '0.652795', '0.635970', '0.653281', '0.651986', '0.648424', '0.653825', '0.636756', '0.643086', '0.646439', '0.642723', '0.651400', '0.636319', '0.641709', '0.653726']
         : correct/total = [(9208, 14232), (9196, 14235), (8976, 14266), (9300, 14217), (9194, 14238), (9091, 14373), (9365, 14346), (9116, 14334), (9338, 14294), (9371, 14373), (9301, 14344), (9351, 14302), (9140, 14354), (9236, 14362), (9257, 14320), (9252, 14395), (9373, 14389), (9072, 14257), (9145, 14251), (9413, 14399)]
         : sketchguard stats = ['Node 0: acc_rate=1.000', 'Node 1: acc_rate=1.000', 'Node 2: acc_rate=1.000']...
Round 009: test acc mean=0.6542 ± 0.0108 | min=0.6114 max=0.6646
         : test loss mean=0.6270 ± 0.0076
         : individual accs = ['0.611439', '0.658518', '0.650498', '0.663220', '0.655499', '0.657204', '0.658441', '0.664574', '0.657129', '0.649969', '0.649400', '0.655712', '0.658910', '0.657429', '0.656704', '0.649392', '0.664535', '0.655748', '0.649358', '0.659421']
         : correct/total = [(8702, 14232), (9374, 14235), (9280, 14266), (9429, 14217), (9333, 14238), (9446, 14373), (9446, 14346), (9526, 14334), (9393, 14294), (9342, 14373), (9315, 14344), (9378, 14302), (9458, 14354), (9442, 14362), (9404, 14320), (9348, 14395), (9562, 14389), (9349, 14257), (9254, 14251), (9495, 14399)]
         : sketchguard stats = ['Node 0: acc_rate=1.000', 'Node 1: acc_rate=1.000', 'Node 2: acc_rate=1.000']...
Round 010: test acc mean=0.6629 ± 0.0077 | min=0.6394 max=0.6746
         : test loss mean=0.6185 ± 0.0058
         : individual accs = ['0.661678', '0.668142', '0.639352', '0.667440', '0.670530', '0.664927', '0.665273', '0.674550', '0.665454', '0.655743', '0.663344', '0.667949', '0.669082', '0.662094', '0.665014', '0.655714', '0.670095', '0.653504', '0.655393', '0.661921']
         : correct/total = [(9417, 14232), (9511, 14235), (9121, 14266), (9489, 14217), (9547, 14238), (9557, 14373), (9544, 14346), (9669, 14334), (9512, 14294), (9425, 14373), (9515, 14344), (9553, 14302), (9604, 14354), (9509, 14362), (9523, 14320), (9439, 14395), (9642, 14389), (9317, 14257), (9340, 14251), (9531, 14399)]
         : sketchguard stats = ['Node 0: acc_rate=1.000', 'Node 1: acc_rate=1.000', 'Node 2: acc_rate=1.000']...

=== FINAL RESULTS ===
Dataset: sent140, Nodes: 20, Graph: fully, Aggregation: sketchguard
Overall test accuracy: mean=0.6629 ± 0.0077

=== Sketchguard SUMMARY ===
Node 0: acceptance=1.000
Node 1: acceptance=1.000
Node 2: acceptance=1.000
Node 3: acceptance=1.000
Node 4: acceptance=1.000
Node 5: acceptance=1.000
Node 6: acceptance=1.000
Node 7: acceptance=1.000
Node 8: acceptance=1.000
Node 9: acceptance=1.000
Node 10: acceptance=1.000
Node 11: acceptance=1.000
Node 12: acceptance=1.000
Node 13: acceptance=1.000
Node 14: acceptance=1.000
Node 15: acceptance=1.000
Node 16: acceptance=1.000
Node 17: acceptance=1.000
Node 18: acceptance=1.000
Node 19: acceptance=1.000

=== PARALLEL EXECUTION TIME (realistic for distributed system) ===
  COMMUNICATION (max across nodes):
    - Sketch transfer: 0.000s (0.0%)
    - Model fetch (accepted): 0.000s (0.0%)
  COMPUTATION (max across nodes):
    - Sketching: 0.678s (94.6%)
    - Filtering: 0.001s (0.2%)
    - Aggregation: 0.037s (5.2%)
  TOTALS:
    - Total computation: 0.716s (100.0%)
    - Total communication: 0.000s (0.0%)
    - Total parallel time: 0.716s

=== PER-NODE AVERAGE TIME ===
  - Sketching: 0.658s
  - Filtering: 0.001s
  - Aggregation: 0.030s
  - Sketch transfer: 0.000s
  - Model fetch: 0.000s
  - Total per node: 0.689s

=== TOTAL COMPUTATIONAL WORK (sum across all nodes) ===
  - Total sketching: 13.163s
  - Total filtering: 0.016s
  - Total aggregation: 0.603s
  - Total sketch transfer: 0.000s
  - Total model fetch: 0.000s
  - Grand total: 13.783s
  - Mean acceptance rate: 1.000

Sketchguard Algorithm Properties:
  - Original dimension: 1,174,986
  - Sketch size: 180
  - Compression ratio: 19.9x
  - Single repetition: No repetitions needed
  - Theoretical complexity: O(d + N×k)
  - Approach: Sketch filtering + state aggregation
