Device: cuda
Seed: 987654321
Loading 1 LEAF Sent140 train files...
LEAF Sent140 train: 254555 users, 908652 samples
Building vocabulary (max_size=10000)...
Vocabulary size: 10000
Loading 1 LEAF Sent140 test files...
LEAF Sent140 test: 254555 users, 286281 samples
Found 254555 train users, 254555 test users, 254555 common users
User sample counts range: 494 (max) to 1 (min)
Distributed ALL 254555 users across 20 clients
Users per client: 12727 (with 15 clients getting +1 user)
Train partition sizes: [44353, 44290, 44657, 44907, 44696, 45843, 45801, 45619, 45069, 45639, 45821, 45311, 45779, 46056, 45625, 45984, 46428, 44737, 45540, 46497]
Test partition sizes: [14232, 14235, 14266, 14217, 14238, 14373, 14346, 14334, 14294, 14373, 14344, 14302, 14354, 14362, 14320, 14395, 14389, 14257, 14251, 14399]
  Client 0: 44353 train samples, 2 unique classes
  Client 1: 44290 train samples, 2 unique classes
  Client 2: 44657 train samples, 2 unique classes
  Client 3: 44907 train samples, 2 unique classes
  Client 4: 44696 train samples, 2 unique classes
  Client 5: 45843 train samples, 2 unique classes
  Client 6: 45801 train samples, 2 unique classes
  Client 7: 45619 train samples, 2 unique classes
  Client 8: 45069 train samples, 2 unique classes
  Client 9: 45639 train samples, 2 unique classes
  Client 10: 45821 train samples, 2 unique classes
  Client 11: 45311 train samples, 2 unique classes
  Client 12: 45779 train samples, 2 unique classes
  Client 13: 46056 train samples, 2 unique classes
  Client 14: 45625 train samples, 2 unique classes
  Client 15: 45984 train samples, 2 unique classes
  Client 16: 46428 train samples, 2 unique classes
  Client 17: 44737 train samples, 2 unique classes
  Client 18: 45540 train samples, 2 unique classes
  Client 19: 46497 train samples, 2 unique classes
Will sample 4500 samples per client per epoch
Graph: fully, nodes: 20, edges: 190
Degree statistics: avg=19.00, min=19, max=19
Attack: Compromised 16/20 nodes: [1, 2, 3, 5, 6, 8, 9, 10, 11, 12, 13, 14, 15, 17, 18, 19]
Attack type: directed_deviation, lambda: 1.0
Model variant: baseline
Model parameters: 1,174,986
Initial test acc across nodes: mean=0.4953 ± 0.0174
Round 001: test acc mean=0.4997 ± 0.0063 | min=0.4859 max=0.5117
         : test loss mean=14.2477 ± 4.0547
         : individual accs = ['0.507518', '0.490762', '0.510865', '0.511711', '0.502248', '0.500035', '0.495190', '0.500279', '0.500210', '0.501844', '0.502719', '0.492658', '0.501463', '0.485865', '0.500838', '0.491699', '0.498575', '0.504173', '0.496035', '0.499410']
         : correct/total = [(7223, 14232), (6986, 14235), (7288, 14266), (7275, 14217), (7151, 14238), (7187, 14373), (7104, 14346), (7171, 14334), (7150, 14294), (7213, 14373), (7211, 14344), (7046, 14302), (7198, 14354), (6978, 14362), (7172, 14320), (7078, 14395), (7174, 14389), (7188, 14257), (7069, 14251), (7191, 14399)]
         : compromised: 0.4991, honest: 0.5022
Round 002: test acc mean=0.5117 ± 0.0048 | min=0.5036 max=0.5246
         : test loss mean=10.3842 ± 0.1385
         : individual accs = ['0.507307', '0.507973', '0.508552', '0.514455', '0.511589', '0.515202', '0.509689', '0.510255', '0.515951', '0.506784', '0.508714', '0.507272', '0.511495', '0.517755', '0.510964', '0.513928', '0.517757', '0.503612', '0.509227', '0.524620']
         : correct/total = [(7220, 14232), (7231, 14235), (7255, 14266), (7314, 14217), (7284, 14238), (7405, 14373), (7312, 14346), (7314, 14334), (7375, 14294), (7284, 14373), (7297, 14344), (7255, 14302), (7342, 14354), (7436, 14362), (7317, 14320), (7398, 14395), (7450, 14389), (7180, 14257), (7257, 14251), (7554, 14399)]
         : compromised: 0.5116, honest: 0.5117
Round 003: test acc mean=0.4957 ± 0.0042 | min=0.4890 max=0.5041
         : test loss mean=1.2507 ± 0.0130
         : individual accs = ['0.498033', '0.492940', '0.494953', '0.498980', '0.501475', '0.495930', '0.491356', '0.489256', '0.491535', '0.496069', '0.496863', '0.488953', '0.498328', '0.494848', '0.504120', '0.496770', '0.500521', '0.490215', '0.501158', '0.492326']
         : correct/total = [(7088, 14232), (7017, 14235), (7061, 14266), (7094, 14217), (7140, 14238), (7128, 14373), (7049, 14346), (7013, 14334), (7026, 14294), (7130, 14373), (7127, 14344), (6993, 14302), (7153, 14354), (7107, 14362), (7219, 14320), (7151, 14395), (7202, 14389), (6989, 14257), (7142, 14251), (7089, 14399)]
         : compromised: 0.4953, honest: 0.4973
Round 004: test acc mean=0.4964 ± 0.0046 | min=0.4844 max=0.5056
         : test loss mean=1.8949 ± 0.0234
         : individual accs = ['0.496838', '0.497576', '0.484368', '0.492017', '0.503722', '0.494538', '0.498327', '0.492186', '0.491255', '0.494190', '0.496375', '0.498951', '0.501463', '0.496310', '0.497626', '0.505592', '0.492390', '0.500105', '0.497298', '0.497326']
         : correct/total = [(7071, 14232), (7083, 14235), (6910, 14266), (6995, 14217), (7172, 14238), (7108, 14373), (7149, 14346), (7055, 14334), (7022, 14294), (7103, 14373), (7120, 14344), (7136, 14302), (7198, 14354), (7128, 14362), (7126, 14320), (7278, 14395), (7085, 14389), (7130, 14257), (7087, 14251), (7161, 14399)]
         : compromised: 0.4965, honest: 0.4963
Round 005: test acc mean=0.4941 ± 0.0037 | min=0.4873 max=0.5017
         : test loss mean=0.7392 ± 0.0030
         : individual accs = ['0.494590', '0.490060', '0.490537', '0.491313', '0.490167', '0.496069', '0.496375', '0.492326', '0.501679', '0.490294', '0.493865', '0.487275', '0.500766', '0.497076', '0.491341', '0.496144', '0.495795', '0.493302', '0.494421', '0.498021']
         : correct/total = [(7039, 14232), (6976, 14235), (6998, 14266), (6985, 14217), (6979, 14238), (7130, 14373), (7121, 14346), (7057, 14334), (7171, 14294), (7047, 14373), (7084, 14344), (6969, 14302), (7188, 14354), (7139, 14362), (7036, 14320), (7142, 14395), (7134, 14389), (7033, 14257), (7046, 14251), (7171, 14399)]
         : compromised: 0.4943, honest: 0.4932
Round 006: test acc mean=0.5049 ± 0.0053 | min=0.4935 max=0.5165
         : test loss mean=1.0399 ± 0.0188
         : individual accs = ['0.506464', '0.516473', '0.512688', '0.514806', '0.504916', '0.503792', '0.499791', '0.506488', '0.501889', '0.504488', '0.502231', '0.506433', '0.497422', '0.493525', '0.506704', '0.502466', '0.507471', '0.504173', '0.504245', '0.501840']
         : correct/total = [(7208, 14232), (7352, 14235), (7314, 14266), (7319, 14217), (7189, 14238), (7241, 14373), (7170, 14346), (7260, 14334), (7174, 14294), (7251, 14373), (7204, 14344), (7243, 14302), (7140, 14354), (7088, 14362), (7256, 14320), (7233, 14395), (7302, 14389), (7188, 14257), (7186, 14251), (7226, 14399)]
         : compromised: 0.5046, honest: 0.5063
Round 007: test acc mean=0.4950 ± 0.0055 | min=0.4831 max=0.5074
         : test loss mean=0.7167 ± 0.0025
         : individual accs = ['0.491920', '0.483105', '0.487663', '0.485756', '0.495926', '0.495582', '0.499582', '0.492117', '0.498671', '0.495373', '0.498397', '0.493637', '0.502787', '0.507381', '0.491969', '0.497673', '0.493224', '0.494774', '0.495474', '0.498646']
         : correct/total = [(7001, 14232), (6877, 14235), (6957, 14266), (6906, 14217), (7061, 14238), (7123, 14373), (7167, 14346), (7054, 14334), (7128, 14294), (7120, 14373), (7149, 14344), (7060, 14302), (7217, 14354), (7287, 14362), (7045, 14320), (7164, 14395), (7097, 14389), (7054, 14257), (7061, 14251), (7180, 14399)]
         : compromised: 0.4954, honest: 0.4933
Round 008: test acc mean=0.5051 ± 0.0054 | min=0.4933 max=0.5168
         : test loss mean=0.9643 ± 0.0132
         : individual accs = ['0.507026', '0.516754', '0.512828', '0.515228', '0.505549', '0.504209', '0.500349', '0.507116', '0.501889', '0.504905', '0.501952', '0.506153', '0.497213', '0.493316', '0.507263', '0.502188', '0.507540', '0.504524', '0.504105', '0.501702']
         : correct/total = [(7216, 14232), (7356, 14235), (7316, 14266), (7325, 14217), (7198, 14238), (7247, 14373), (7178, 14346), (7269, 14334), (7174, 14294), (7257, 14373), (7200, 14344), (7239, 14302), (7137, 14354), (7085, 14362), (7264, 14320), (7229, 14395), (7303, 14389), (7193, 14257), (7184, 14251), (7224, 14399)]
         : compromised: 0.5047, honest: 0.5068
Round 009: test acc mean=0.4948 ± 0.0055 | min=0.4830 max=0.5071
         : test loss mean=0.7224 ± 0.0025
         : individual accs = ['0.492693', '0.483035', '0.487453', '0.484420', '0.494381', '0.495791', '0.499651', '0.492605', '0.497901', '0.495791', '0.498257', '0.493427', '0.502578', '0.507102', '0.492458', '0.496909', '0.492112', '0.494634', '0.495755', '0.498437']
         : correct/total = [(7012, 14232), (6876, 14235), (6954, 14266), (6887, 14217), (7039, 14238), (7126, 14373), (7168, 14346), (7061, 14334), (7117, 14294), (7126, 14373), (7147, 14344), (7057, 14302), (7214, 14354), (7283, 14362), (7052, 14320), (7153, 14395), (7081, 14389), (7052, 14257), (7065, 14251), (7177, 14399)]
         : compromised: 0.4952, honest: 0.4929
Round 010: test acc mean=0.5053 ± 0.0054 | min=0.4933 max=0.5166
         : test loss mean=0.8303 ± 0.0102
         : individual accs = ['0.507378', '0.516614', '0.512828', '0.515510', '0.505829', '0.504488', '0.500279', '0.507953', '0.502029', '0.505322', '0.501394', '0.506153', '0.497562', '0.493316', '0.507472', '0.502327', '0.507679', '0.505155', '0.504666', '0.502257']
         : correct/total = [(7221, 14232), (7354, 14235), (7316, 14266), (7329, 14217), (7202, 14238), (7251, 14373), (7177, 14346), (7281, 14334), (7176, 14294), (7263, 14373), (7192, 14344), (7239, 14302), (7142, 14354), (7085, 14362), (7267, 14320), (7231, 14395), (7305, 14389), (7202, 14257), (7192, 14251), (7232, 14399)]
         : compromised: 0.5048, honest: 0.5072

=== FINAL RESULTS ===
Dataset: sent140, Nodes: 20, Graph: fully, Aggregation: d-fedavg
Attack: directed_deviation, 80.0% compromised
Final accuracy - Compromised: 0.5048, Honest: 0.5072
Overall test accuracy: mean=0.5053 ± 0.0054
