Device: cuda
Seed: 987654321
Loading 1 LEAF Sent140 train files...
LEAF Sent140 train: 254555 users, 908652 samples
Building vocabulary (max_size=10000)...
Vocabulary size: 10000
Loading 1 LEAF Sent140 test files...
LEAF Sent140 test: 254555 users, 286281 samples
Found 254555 train users, 254555 test users, 254555 common users
User sample counts range: 494 (max) to 1 (min)
Distributed ALL 254555 users across 20 clients
Users per client: 12727 (with 15 clients getting +1 user)
Train partition sizes: [44353, 44290, 44657, 44907, 44696, 45843, 45801, 45619, 45069, 45639, 45821, 45311, 45779, 46056, 45625, 45984, 46428, 44737, 45540, 46497]
Test partition sizes: [14232, 14235, 14266, 14217, 14238, 14373, 14346, 14334, 14294, 14373, 14344, 14302, 14354, 14362, 14320, 14395, 14389, 14257, 14251, 14399]
  Client 0: 44353 train samples, 2 unique classes
  Client 1: 44290 train samples, 2 unique classes
  Client 2: 44657 train samples, 2 unique classes
  Client 3: 44907 train samples, 2 unique classes
  Client 4: 44696 train samples, 2 unique classes
  Client 5: 45843 train samples, 2 unique classes
  Client 6: 45801 train samples, 2 unique classes
  Client 7: 45619 train samples, 2 unique classes
  Client 8: 45069 train samples, 2 unique classes
  Client 9: 45639 train samples, 2 unique classes
  Client 10: 45821 train samples, 2 unique classes
  Client 11: 45311 train samples, 2 unique classes
  Client 12: 45779 train samples, 2 unique classes
  Client 13: 46056 train samples, 2 unique classes
  Client 14: 45625 train samples, 2 unique classes
  Client 15: 45984 train samples, 2 unique classes
  Client 16: 46428 train samples, 2 unique classes
  Client 17: 44737 train samples, 2 unique classes
  Client 18: 45540 train samples, 2 unique classes
  Client 19: 46497 train samples, 2 unique classes
Will sample 4500 samples per client per epoch
Graph: erdos, nodes: 20, edges: 48
Degree statistics: avg=4.80, min=2, max=7
Attack: Compromised 8/20 nodes: [1, 5, 11, 12, 13, 14, 17, 18]
Attack type: krum, lambda: 1.0
Model variant: baseline
Model parameters: 1,174,986
UBAR ALGORITHM (Two-Stage Byzantine-resilient)
  - Model dimension: 1,174,986 parameters
  - Rho parameter: 0.6
  - Stage 1: Distance-based filtering (select 60% closest neighbors)
  - Stage 2: Performance-based selection (loss comparison)
  - Complexity: O(deg(i)×d + deg(i)×inference)
Initial test acc across nodes: mean=0.4953 ± 0.0174
Round 001: test acc mean=0.5628 ± 0.0295 | min=0.4962 max=0.6059
         : test loss mean=0.6883 ± 0.0022
         : individual accs = ['0.533867', '0.591078', '0.553344', '0.496237', '0.597907', '0.569749', '0.579674', '0.594112', '0.554289', '0.591526', '0.567973', '0.522305', '0.605894', '0.597340', '0.545182', '0.579437', '0.572938', '0.530055', '0.533647', '0.540038']
         : correct/total = [(7598, 14232), (8414, 14235), (7894, 14266), (7055, 14217), (8513, 14238), (8189, 14373), (8316, 14346), (8516, 14334), (7923, 14294), (8502, 14373), (8147, 14344), (7470, 14302), (8697, 14354), (8579, 14362), (7807, 14320), (8341, 14395), (8244, 14389), (7557, 14257), (7605, 14251), (7776, 14399)]
         : compromised: 0.5619, honest: 0.5634
         : ubar stats = ['Node 0: s1=0.500, s2=0.333', 'Node 1: s1=0.500, s2=0.333', 'Node 2: s1=0.600, s2=0.333']...
Round 002: test acc mean=0.6135 ± 0.0372 | min=0.5047 max=0.6409
         : test loss mean=0.6678 ± 0.0182
         : individual accs = ['0.616217', '0.635054', '0.639843', '0.515088', '0.638994', '0.634801', '0.605674', '0.640924', '0.626627', '0.609824', '0.635318', '0.615299', '0.629929', '0.625331', '0.600908', '0.639736', '0.624296', '0.504664', '0.592660', '0.637892']
         : correct/total = [(8770, 14232), (9040, 14235), (9128, 14266), (7323, 14217), (9098, 14238), (9124, 14373), (8689, 14346), (9187, 14334), (8957, 14294), (8765, 14373), (9113, 14344), (8800, 14302), (9042, 14354), (8981, 14362), (8605, 14320), (9209, 14395), (8983, 14389), (7195, 14257), (8446, 14251), (9185, 14399)]
         : compromised: 0.6048, honest: 0.6192
         : ubar stats = ['Node 0: s1=0.500, s2=0.500', 'Node 1: s1=0.500, s2=0.333', 'Node 2: s1=0.600, s2=0.333']...
Round 003: test acc mean=0.6169 ± 0.0253 | min=0.5414 max=0.6431
         : test loss mean=0.6584 ± 0.0182
         : individual accs = ['0.633572', '0.638286', '0.611033', '0.625097', '0.643138', '0.632923', '0.627701', '0.626831', '0.639359', '0.637654', '0.622699', '0.596560', '0.578445', '0.624634', '0.609358', '0.576311', '0.633123', '0.541418', '0.610904', '0.628516']
         : correct/total = [(9017, 14232), (9086, 14235), (8717, 14266), (8887, 14217), (9157, 14238), (9097, 14373), (9005, 14346), (8985, 14334), (9139, 14294), (9165, 14373), (8932, 14344), (8532, 14302), (8303, 14354), (8971, 14362), (8726, 14320), (8296, 14395), (9110, 14389), (7719, 14257), (8706, 14251), (9050, 14399)]
         : compromised: 0.6041, honest: 0.6254
         : ubar stats = ['Node 0: s1=0.500, s2=0.667', 'Node 1: s1=0.500, s2=0.333', 'Node 2: s1=0.600, s2=0.333']...
Round 004: test acc mean=0.6364 ± 0.0271 | min=0.5226 max=0.6582
         : test loss mean=0.6466 ± 0.0194
         : individual accs = ['0.640880', '0.643133', '0.522571', '0.633397', '0.639064', '0.646420', '0.643176', '0.651109', '0.651532', '0.644124', '0.646612', '0.642218', '0.637662', '0.624774', '0.644064', '0.644182', '0.646466', '0.635828', '0.632166', '0.658240']
         : correct/total = [(9121, 14232), (9155, 14235), (7455, 14266), (9005, 14217), (9099, 14238), (9291, 14373), (9227, 14346), (9333, 14334), (9313, 14294), (9258, 14373), (9275, 14344), (9185, 14302), (9153, 14354), (8973, 14362), (9223, 14320), (9273, 14395), (9302, 14389), (9065, 14257), (9009, 14251), (9478, 14399)]
         : compromised: 0.6383, honest: 0.6351
         : ubar stats = ['Node 0: s1=0.500, s2=0.583', 'Node 1: s1=0.500, s2=0.333', 'Node 2: s1=0.600, s2=0.333']...
Round 005: test acc mean=0.6430 ± 0.0069 | min=0.6287 max=0.6554
         : test loss mean=0.6454 ± 0.0178
         : individual accs = ['0.639404', '0.647418', '0.639492', '0.633678', '0.654305', '0.647603', '0.648683', '0.651039', '0.655450', '0.640367', '0.640337', '0.640540', '0.633970', '0.636680', '0.628701', '0.646961', '0.647717', '0.637652', '0.644797', '0.645878']
         : correct/total = [(9100, 14232), (9216, 14235), (9123, 14266), (9009, 14217), (9316, 14238), (9308, 14373), (9306, 14346), (9332, 14334), (9369, 14294), (9204, 14373), (9185, 14344), (9161, 14302), (9100, 14354), (9144, 14362), (9003, 14320), (9313, 14395), (9320, 14389), (9091, 14257), (9189, 14251), (9300, 14399)]
         : compromised: 0.6397, honest: 0.6453
         : ubar stats = ['Node 0: s1=0.500, s2=0.533', 'Node 1: s1=0.500, s2=0.333', 'Node 2: s1=0.600, s2=0.333']...
Round 006: test acc mean=0.6451 ± 0.0118 | min=0.6136 max=0.6605
         : test loss mean=0.6403 ± 0.0199
         : individual accs = ['0.645306', '0.643836', '0.646222', '0.654498', '0.647984', '0.653239', '0.651262', '0.653970', '0.660487', '0.649899', '0.634690', '0.613551', '0.635990', '0.648935', '0.648743', '0.654950', '0.648412', '0.618784', '0.635815', '0.656226']
         : correct/total = [(9184, 14232), (9165, 14235), (9219, 14266), (9305, 14217), (9226, 14238), (9389, 14373), (9343, 14346), (9374, 14334), (9441, 14294), (9341, 14373), (9104, 14344), (8775, 14302), (9129, 14354), (9320, 14362), (9290, 14320), (9428, 14395), (9330, 14389), (8822, 14257), (9061, 14251), (9449, 14399)]
         : compromised: 0.6374, honest: 0.6503
         : ubar stats = ['Node 0: s1=0.500, s2=0.500', 'Node 1: s1=0.500, s2=0.333', 'Node 2: s1=0.600, s2=0.333']...
Round 007: test acc mean=0.6465 ± 0.0100 | min=0.6140 max=0.6604
         : test loss mean=0.6363 ± 0.0153
         : individual accs = ['0.646712', '0.658518', '0.614047', '0.648027', '0.643981', '0.635497', '0.648543', '0.641063', '0.660417', '0.650038', '0.650795', '0.632219', '0.654243', '0.643295', '0.648813', '0.651337', '0.655570', '0.649926', '0.647463', '0.649003']
         : correct/total = [(9204, 14232), (9374, 14235), (8760, 14266), (9213, 14217), (9169, 14238), (9134, 14373), (9304, 14346), (9189, 14334), (9440, 14294), (9343, 14373), (9335, 14344), (9042, 14302), (9391, 14354), (9239, 14362), (9291, 14320), (9376, 14395), (9433, 14389), (9266, 14257), (9227, 14251), (9345, 14399)]
         : compromised: 0.6462, honest: 0.6466
         : ubar stats = ['Node 0: s1=0.500, s2=0.476', 'Node 1: s1=0.500, s2=0.381', 'Node 2: s1=0.600, s2=0.381']...
Round 008: test acc mean=0.6528 ± 0.0086 | min=0.6337 max=0.6650
         : test loss mean=0.6287 ± 0.0145
         : individual accs = ['0.657673', '0.662452', '0.650007', '0.660688', '0.660065', '0.659570', '0.653283', '0.633668', '0.664964', '0.653169', '0.649888', '0.644106', '0.657099', '0.645314', '0.649092', '0.648072', '0.657377', '0.649435', '0.635043', '0.664074']
         : correct/total = [(9360, 14232), (9430, 14235), (9273, 14266), (9393, 14217), (9398, 14238), (9480, 14373), (9372, 14346), (9083, 14334), (9505, 14294), (9388, 14373), (9322, 14344), (9212, 14302), (9432, 14354), (9268, 14362), (9295, 14320), (9329, 14395), (9459, 14389), (9259, 14257), (9050, 14251), (9562, 14399)]
         : compromised: 0.6503, honest: 0.6544
         : ubar stats = ['Node 0: s1=0.500, s2=0.500', 'Node 1: s1=0.500, s2=0.375', 'Node 2: s1=0.600, s2=0.375']...
Round 009: test acc mean=0.6500 ± 0.0116 | min=0.6255 max=0.6669
         : test loss mean=0.6355 ± 0.0189
         : individual accs = ['0.630902', '0.666877', '0.641525', '0.650137', '0.650934', '0.661379', '0.652447', '0.658155', '0.648034', '0.625478', '0.648773', '0.626835', '0.648530', '0.665088', '0.646439', '0.651962', '0.661895', '0.645788', '0.656515', '0.662407']
         : correct/total = [(8979, 14232), (9493, 14235), (9152, 14266), (9243, 14217), (9268, 14238), (9506, 14373), (9360, 14346), (9434, 14334), (9263, 14294), (8990, 14373), (9306, 14344), (8965, 14302), (9309, 14354), (9552, 14362), (9257, 14320), (9385, 14395), (9524, 14389), (9207, 14257), (9356, 14251), (9538, 14399)]
         : compromised: 0.6522, honest: 0.6486
         : ubar stats = ['Node 0: s1=0.500, s2=0.481', 'Node 1: s1=0.500, s2=0.370', 'Node 2: s1=0.600, s2=0.407']...
Round 010: test acc mean=0.6607 ± 0.0069 | min=0.6438 max=0.6715
         : test loss mean=0.6227 ± 0.0151
         : individual accs = ['0.666877', '0.671514', '0.643838', '0.664768', '0.653744', '0.657135', '0.662833', '0.663178', '0.671471', '0.662214', '0.657766', '0.659278', '0.659259', '0.669057', '0.657332', '0.656408', '0.665369', '0.660728', '0.648235', '0.662546']
         : correct/total = [(9491, 14232), (9559, 14235), (9185, 14266), (9451, 14217), (9308, 14238), (9445, 14373), (9509, 14346), (9506, 14334), (9598, 14294), (9518, 14373), (9435, 14344), (9429, 14302), (9463, 14354), (9609, 14362), (9413, 14320), (9449, 14395), (9574, 14389), (9420, 14257), (9238, 14251), (9540, 14399)]
         : compromised: 0.6603, honest: 0.6609
         : ubar stats = ['Node 0: s1=0.500, s2=0.500', 'Node 1: s1=0.500, s2=0.367', 'Node 2: s1=0.600, s2=0.400']...

=== FINAL RESULTS ===
Dataset: sent140, Nodes: 20, Graph: erdos, Aggregation: ubar
Attack: krum, 40.0% compromised
Final accuracy - Compromised: 0.6603, Honest: 0.6609
Overall test accuracy: mean=0.6607 ± 0.0069

=== UBAR SUMMARY ===
Node 0: stage1=0.500, stage2=0.500, overall=0.250
Node 1: stage1=0.500, stage2=0.367, overall=0.183
Node 2: stage1=0.600, stage2=0.400, overall=0.240
Node 3: stage1=0.500, stage2=0.600, overall=0.300
Node 4: stage1=0.500, stage2=0.500, overall=0.250
Node 5: stage1=0.600, stage2=0.333, overall=0.200
Node 6: stage1=0.600, stage2=0.400, overall=0.240
Node 7: stage1=0.600, stage2=0.600, overall=0.360
Node 8: stage1=0.500, stage2=1.000, overall=0.500
Node 9: stage1=0.333, stage2=1.000, overall=0.333
Node 10: stage1=0.500, stage2=0.800, overall=0.400
Node 11: stage1=0.571, stage2=0.625, overall=0.357
Node 12: stage1=0.571, stage2=0.375, overall=0.214
Node 13: stage1=0.500, stage2=0.550, overall=0.275
Node 14: stage1=0.571, stage2=0.375, overall=0.214
Node 15: stage1=0.500, stage2=0.367, overall=0.183
Node 16: stage1=0.600, stage2=0.333, overall=0.200
Node 17: stage1=0.600, stage2=0.600, overall=0.360
Node 18: stage1=0.500, stage2=0.600, overall=0.300
Node 19: stage1=0.500, stage2=1.000, overall=0.500

=== PARALLEL EXECUTION TIME (realistic for distributed system) ===
  COMMUNICATION (max across nodes):
    - Full model transfer: 0.000s (0.0%)
  COMPUTATION (max across nodes):
    - Distance computation: 0.027s (52.1%)
    - Loss computation: 0.019s (37.6%)
    - Aggregation: 0.005s (10.3%)
  TOTALS:
    - Total computation: 0.051s (100.0%)
    - Total communication: 0.000s (0.0%)
    - Total parallel time: 0.051s

=== PER-NODE AVERAGE TIME ===
  - Distance computation: 0.018s
  - Loss computation: 0.013s
  - Aggregation: 0.004s
  - Model transfer: 0.000s
  - Total per node: 0.035s

=== TOTAL COMPUTATIONAL WORK (sum across all nodes) ===
  - Total distance computation: 0.366s
  - Total loss computation: 0.253s
  - Total aggregation: 0.072s
  - Total model transfer: 0.000s
  - Grand total: 0.691s
  - Mean Stage 1 acceptance rate: 0.532
  - Mean Stage 2 acceptance rate: 0.566
  - Overall acceptance rate: 0.301

UBAR Algorithm Properties:
  - Model dimension: 1,174,986
  - Rho parameter: 0.6
  - Two-stage approach: Distance filtering + loss evaluation
  - Stage 1 selects: 60% of neighbors
  - Stage 2 uses: Training sample loss comparison
  - Theoretical complexity: O(deg(i)×d + deg(i)×inference)
  - Approach: UBAR paper implementation
