Device: cuda
Seed: 987654321
Loading 1 LEAF Sent140 train files...
LEAF Sent140 train: 254555 users, 908652 samples
Building vocabulary (max_size=10000)...
Vocabulary size: 10000
Loading 1 LEAF Sent140 test files...
LEAF Sent140 test: 254555 users, 286281 samples
Found 254555 train users, 254555 test users, 254555 common users
User sample counts range: 494 (max) to 1 (min)
Distributed ALL 254555 users across 20 clients
Users per client: 12727 (with 15 clients getting +1 user)
Train partition sizes: [44353, 44290, 44657, 44907, 44696, 45843, 45801, 45619, 45069, 45639, 45821, 45311, 45779, 46056, 45625, 45984, 46428, 44737, 45540, 46497]
Test partition sizes: [14232, 14235, 14266, 14217, 14238, 14373, 14346, 14334, 14294, 14373, 14344, 14302, 14354, 14362, 14320, 14395, 14389, 14257, 14251, 14399]
  Client 0: 44353 train samples, 2 unique classes
  Client 1: 44290 train samples, 2 unique classes
  Client 2: 44657 train samples, 2 unique classes
  Client 3: 44907 train samples, 2 unique classes
  Client 4: 44696 train samples, 2 unique classes
  Client 5: 45843 train samples, 2 unique classes
  Client 6: 45801 train samples, 2 unique classes
  Client 7: 45619 train samples, 2 unique classes
  Client 8: 45069 train samples, 2 unique classes
  Client 9: 45639 train samples, 2 unique classes
  Client 10: 45821 train samples, 2 unique classes
  Client 11: 45311 train samples, 2 unique classes
  Client 12: 45779 train samples, 2 unique classes
  Client 13: 46056 train samples, 2 unique classes
  Client 14: 45625 train samples, 2 unique classes
  Client 15: 45984 train samples, 2 unique classes
  Client 16: 46428 train samples, 2 unique classes
  Client 17: 44737 train samples, 2 unique classes
  Client 18: 45540 train samples, 2 unique classes
  Client 19: 46497 train samples, 2 unique classes
Will sample 4500 samples per client per epoch
Graph: ring, nodes: 20, edges: 20
Degree statistics: avg=2.00, min=2, max=2
Attack: Compromised 8/20 nodes: [1, 5, 11, 12, 13, 14, 17, 18]
Attack type: backdoor, lambda: 1.0
Backdoor target label: 1, trigger size: 3
Model variant: baseline
Model parameters: 1,174,986
Initial test acc across nodes: mean=0.4953 ± 0.0174
Backdoor attack: Created poisoned datasets for 8 compromised nodes
Round 001: test acc mean=0.5073 ± 0.0107 | min=0.4861 max=0.5338
         : test loss mean=12.4126 ± 24.3746
         : individual accs = ['0.499227', '0.511978', '0.506869', '0.512415', '0.501896', '0.502331', '0.519727', '0.524766', '0.502169', '0.533779', '0.497142', '0.506293', '0.503205', '0.506893', '0.494204', '0.520250', '0.486135', '0.509504', '0.506561', '0.501424']
         : correct/total = [(7105, 14232), (7288, 14235), (7231, 14266), (7285, 14217), (7146, 14238), (7220, 14373), (7456, 14346), (7522, 14334), (7178, 14294), (7672, 14373), (7131, 14344), (7241, 14302), (7223, 14354), (7280, 14362), (7077, 14320), (7489, 14395), (6995, 14389), (7264, 14257), (7219, 14251), (7220, 14399)]
         : compromised: 0.5051, honest: 0.5088
Round 002: test acc mean=0.4993 ± 0.0117 | min=0.4869 max=0.5393
         : test loss mean=11.0772 ± 12.2657
         : individual accs = ['0.493465', '0.487671', '0.486892', '0.516846', '0.494522', '0.496347', '0.500488', '0.492465', '0.539317', '0.516246', '0.498397', '0.494406', '0.499164', '0.493664', '0.493226', '0.498437', '0.493432', '0.495125', '0.495895', '0.500660']
         : correct/total = [(7023, 14232), (6942, 14235), (6946, 14266), (7348, 14217), (7041, 14238), (7134, 14373), (7180, 14346), (7059, 14334), (7709, 14294), (7420, 14373), (7149, 14344), (7071, 14302), (7165, 14354), (7090, 14362), (7063, 14320), (7175, 14395), (7100, 14389), (7059, 14257), (7067, 14251), (7209, 14399)]
         : compromised: 0.4944, honest: 0.5026
Round 003: test acc mean=0.4992 ± 0.0189 | min=0.4834 max=0.5781
         : test loss mean=66.0976 ± 168.5761
         : individual accs = ['0.491428', '0.483386', '0.486892', '0.485545', '0.494732', '0.495582', '0.499930', '0.506349', '0.578145', '0.504766', '0.499512', '0.494406', '0.497422', '0.493107', '0.491899', '0.498229', '0.492738', '0.495686', '0.495755', '0.499062']
         : correct/total = [(6994, 14232), (6881, 14235), (6946, 14266), (6903, 14217), (7044, 14238), (7123, 14373), (7172, 14346), (7258, 14334), (8264, 14294), (7255, 14373), (7165, 14344), (7071, 14302), (7140, 14354), (7082, 14362), (7044, 14320), (7172, 14395), (7090, 14389), (7067, 14257), (7065, 14251), (7186, 14399)]
         : compromised: 0.4934, honest: 0.5031
Round 004: test acc mean=0.5060 ± 0.0077 | min=0.4941 max=0.5250
         : test loss mean=57.5876 ± 155.6647
         : individual accs = ['0.507799', '0.513312', '0.514440', '0.512837', '0.509060', '0.517916', '0.504531', '0.498744', '0.505667', '0.525012', '0.500488', '0.504685', '0.494078', '0.494917', '0.507612', '0.498715', '0.506985', '0.499895', '0.502772', '0.500799']
         : correct/total = [(7227, 14232), (7307, 14235), (7339, 14266), (7291, 14217), (7248, 14238), (7444, 14373), (7238, 14346), (7149, 14334), (7228, 14294), (7546, 14373), (7179, 14344), (7218, 14302), (7092, 14354), (7108, 14362), (7269, 14320), (7179, 14395), (7295, 14389), (7127, 14257), (7165, 14251), (7211, 14399)]
         : compromised: 0.5044, honest: 0.5071
Round 005: test acc mean=0.5089 ± 0.0085 | min=0.4969 max=0.5341
         : test loss mean=384.0948 ± 1132.8633
         : individual accs = ['0.508994', '0.516895', '0.515491', '0.512907', '0.504776', '0.496973', '0.496933', '0.509000', '0.534070', '0.520420', '0.505508', '0.503846', '0.502856', '0.505431', '0.503422', '0.500521', '0.508722', '0.504314', '0.510631', '0.515939']
         : correct/total = [(7244, 14232), (7358, 14235), (7354, 14266), (7292, 14217), (7187, 14238), (7143, 14373), (7129, 14346), (7296, 14334), (7634, 14294), (7480, 14373), (7251, 14344), (7206, 14302), (7218, 14354), (7259, 14362), (7209, 14320), (7205, 14395), (7320, 14389), (7190, 14257), (7277, 14251), (7429, 14399)]
         : compromised: 0.5055, honest: 0.5111
Round 006: test acc mean=0.5019 ± 0.0132 | min=0.4844 max=0.5496
         : test loss mean=1207.7475 ± 3603.4553
         : individual accs = ['0.493817', '0.484440', '0.497967', '0.509601', '0.501896', '0.495860', '0.501673', '0.517790', '0.549601', '0.509427', '0.499861', '0.491190', '0.504528', '0.492968', '0.494553', '0.497742', '0.491626', '0.505997', '0.499123', '0.499271']
         : correct/total = [(7028, 14232), (6896, 14235), (7104, 14266), (7245, 14217), (7146, 14238), (7127, 14373), (7197, 14346), (7422, 14334), (7856, 14294), (7322, 14373), (7170, 14344), (7025, 14302), (7242, 14354), (7080, 14362), (7082, 14320), (7165, 14395), (7074, 14389), (7214, 14257), (7113, 14251), (7189, 14399)]
         : compromised: 0.4961, honest: 0.5059
Round 007: test acc mean=0.5053 ± 0.0096 | min=0.4935 max=0.5376
         : test loss mean=14816.8432 ± 44437.1467
         : individual accs = ['0.500070', '0.517527', '0.513248', '0.500176', '0.507094', '0.508245', '0.494911', '0.507883', '0.537568', '0.507966', '0.499442', '0.506433', '0.501254', '0.506127', '0.507332', '0.496909', '0.499201', '0.493512', '0.504245', '0.495937']
         : correct/total = [(7117, 14232), (7367, 14235), (7322, 14266), (7111, 14217), (7220, 14238), (7305, 14373), (7100, 14346), (7280, 14334), (7684, 14294), (7301, 14373), (7164, 14344), (7243, 14302), (7195, 14354), (7269, 14362), (7265, 14320), (7153, 14395), (7183, 14389), (7036, 14257), (7186, 14251), (7141, 14399)]
         : compromised: 0.5056, honest: 0.5050
Round 008: test acc mean=0.5032 ± 0.0060 | min=0.4909 max=0.5172
         : test loss mean=65200.4100 ± 195588.7720
         : individual accs = ['0.507448', '0.517176', '0.508832', '0.490891', '0.504987', '0.502679', '0.504043', '0.506767', '0.509654', '0.506853', '0.494004', '0.501049', '0.502229', '0.493037', '0.503561', '0.497395', '0.499479', '0.506558', '0.506140', '0.502188']
         : correct/total = [(7222, 14232), (7362, 14235), (7259, 14266), (6979, 14217), (7190, 14238), (7225, 14373), (7231, 14346), (7264, 14334), (7285, 14294), (7285, 14373), (7086, 14344), (7166, 14302), (7209, 14354), (7081, 14362), (7211, 14320), (7160, 14395), (7187, 14389), (7222, 14257), (7213, 14251), (7231, 14399)]
         : compromised: 0.5041, honest: 0.5027
Round 009: test acc mean=0.5049 ± 0.0079 | min=0.4939 max=0.5167
         : test loss mean=525915.5356 ± 1577728.5197
         : individual accs = ['0.506464', '0.515771', '0.513108', '0.514103', '0.498525', '0.497808', '0.494284', '0.494489', '0.511403', '0.494051', '0.516662', '0.516152', '0.497771', '0.500766', '0.507821', '0.505245', '0.510668', '0.507049', '0.502491', '0.493854']
         : correct/total = [(7208, 14232), (7342, 14235), (7320, 14266), (7309, 14217), (7098, 14238), (7155, 14373), (7091, 14346), (7088, 14334), (7310, 14294), (7101, 14373), (7411, 14344), (7382, 14302), (7145, 14354), (7192, 14362), (7272, 14320), (7273, 14395), (7348, 14389), (7229, 14257), (7161, 14251), (7111, 14399)]
         : compromised: 0.5057, honest: 0.5044
Round 010: test acc mean=0.5055 ± 0.0058 | min=0.4965 max=0.5166
         : test loss mean=2879259.9499 ± 8637831.8635
         : individual accs = ['0.506464', '0.516614', '0.512758', '0.504255', '0.498525', '0.496486', '0.508434', '0.500070', '0.499510', '0.503374', '0.501952', '0.506782', '0.503205', '0.505988', '0.502304', '0.516638', '0.508861', '0.514484', '0.502772', '0.500382']
         : correct/total = [(7208, 14232), (7354, 14235), (7315, 14266), (7169, 14217), (7098, 14238), (7136, 14373), (7294, 14346), (7168, 14334), (7140, 14294), (7235, 14373), (7200, 14344), (7248, 14302), (7223, 14354), (7267, 14362), (7193, 14320), (7437, 14395), (7322, 14389), (7335, 14257), (7165, 14251), (7205, 14399)]
         : compromised: 0.5061, honest: 0.5051

=== FINAL RESULTS ===
Dataset: sent140, Nodes: 20, Graph: ring, Aggregation: krum
Attack: backdoor, 40.0% compromised
Final accuracy - Compromised: 0.5061, Honest: 0.5051
Overall test accuracy: mean=0.5055 ± 0.0058

=== BACKDOOR ATTACK SUCCESS RATE (ASR) ===
Target label: 1
Trigger size: 3x3
Overall ASR: 0.3271 ± 0.3592
Honest nodes ASR: 0.2461 ± 0.2596
Compromised nodes ASR: 0.4486 ± 0.4436
Note: Higher ASR indicates more successful backdoor attack
