Device: cuda
Seed: 987654321
Loading 1 LEAF Sent140 train files...
LEAF Sent140 train: 254555 users, 908652 samples
Building vocabulary (max_size=10000)...
Vocabulary size: 10000
Loading 1 LEAF Sent140 test files...
LEAF Sent140 test: 254555 users, 286281 samples
Found 254555 train users, 254555 test users, 254555 common users
User sample counts range: 494 (max) to 1 (min)
Distributed ALL 254555 users across 20 clients
Users per client: 12727 (with 15 clients getting +1 user)
Train partition sizes: [44353, 44290, 44657, 44907, 44696, 45843, 45801, 45619, 45069, 45639, 45821, 45311, 45779, 46056, 45625, 45984, 46428, 44737, 45540, 46497]
Test partition sizes: [14232, 14235, 14266, 14217, 14238, 14373, 14346, 14334, 14294, 14373, 14344, 14302, 14354, 14362, 14320, 14395, 14389, 14257, 14251, 14399]
  Client 0: 44353 train samples, 2 unique classes
  Client 1: 44290 train samples, 2 unique classes
  Client 2: 44657 train samples, 2 unique classes
  Client 3: 44907 train samples, 2 unique classes
  Client 4: 44696 train samples, 2 unique classes
  Client 5: 45843 train samples, 2 unique classes
  Client 6: 45801 train samples, 2 unique classes
  Client 7: 45619 train samples, 2 unique classes
  Client 8: 45069 train samples, 2 unique classes
  Client 9: 45639 train samples, 2 unique classes
  Client 10: 45821 train samples, 2 unique classes
  Client 11: 45311 train samples, 2 unique classes
  Client 12: 45779 train samples, 2 unique classes
  Client 13: 46056 train samples, 2 unique classes
  Client 14: 45625 train samples, 2 unique classes
  Client 15: 45984 train samples, 2 unique classes
  Client 16: 46428 train samples, 2 unique classes
  Client 17: 44737 train samples, 2 unique classes
  Client 18: 45540 train samples, 2 unique classes
  Client 19: 46497 train samples, 2 unique classes
Will sample 4500 samples per client per epoch
Graph: ring, nodes: 20, edges: 20
Degree statistics: avg=2.00, min=2, max=2
Attack: Compromised 16/20 nodes: [1, 2, 3, 5, 6, 8, 9, 10, 11, 12, 13, 14, 15, 17, 18, 19]
Attack type: gaussian, lambda: 1.0
Model variant: baseline
Model parameters: 1,174,986
Sketchguard Node 0:
  Model dim: 1,174,986 → Sketch size: 180
  Compression ratio: 6527.7x
  Using model parameters for aggregation, sketches for filtering
Sketchguard Node 1:
  Model dim: 1,174,986 → Sketch size: 180
  Compression ratio: 6527.7x
  Using model parameters for aggregation, sketches for filtering
Sketchguard Node 2:
  Model dim: 1,174,986 → Sketch size: 180
  Compression ratio: 6527.7x
  Using model parameters for aggregation, sketches for filtering
Sketchguard Node 3:
  Model dim: 1,174,986 → Sketch size: 180
  Compression ratio: 6527.7x
  Using model parameters for aggregation, sketches for filtering
Sketchguard Node 4:
  Model dim: 1,174,986 → Sketch size: 180
  Compression ratio: 6527.7x
  Using model parameters for aggregation, sketches for filtering
Sketchguard Node 5:
  Model dim: 1,174,986 → Sketch size: 180
  Compression ratio: 6527.7x
  Using model parameters for aggregation, sketches for filtering
Sketchguard Node 6:
  Model dim: 1,174,986 → Sketch size: 180
  Compression ratio: 6527.7x
  Using model parameters for aggregation, sketches for filtering
Sketchguard Node 7:
  Model dim: 1,174,986 → Sketch size: 180
  Compression ratio: 6527.7x
  Using model parameters for aggregation, sketches for filtering
Sketchguard Node 8:
  Model dim: 1,174,986 → Sketch size: 180
  Compression ratio: 6527.7x
  Using model parameters for aggregation, sketches for filtering
Sketchguard Node 9:
  Model dim: 1,174,986 → Sketch size: 180
  Compression ratio: 6527.7x
  Using model parameters for aggregation, sketches for filtering
Sketchguard Node 10:
  Model dim: 1,174,986 → Sketch size: 180
  Compression ratio: 6527.7x
  Using model parameters for aggregation, sketches for filtering
Sketchguard Node 11:
  Model dim: 1,174,986 → Sketch size: 180
  Compression ratio: 6527.7x
  Using model parameters for aggregation, sketches for filtering
Sketchguard Node 12:
  Model dim: 1,174,986 → Sketch size: 180
  Compression ratio: 6527.7x
  Using model parameters for aggregation, sketches for filtering
Sketchguard Node 13:
  Model dim: 1,174,986 → Sketch size: 180
  Compression ratio: 6527.7x
  Using model parameters for aggregation, sketches for filtering
Sketchguard Node 14:
  Model dim: 1,174,986 → Sketch size: 180
  Compression ratio: 6527.7x
  Using model parameters for aggregation, sketches for filtering
Sketchguard Node 15:
  Model dim: 1,174,986 → Sketch size: 180
  Compression ratio: 6527.7x
  Using model parameters for aggregation, sketches for filtering
Sketchguard Node 16:
  Model dim: 1,174,986 → Sketch size: 180
  Compression ratio: 6527.7x
  Using model parameters for aggregation, sketches for filtering
Sketchguard Node 17:
  Model dim: 1,174,986 → Sketch size: 180
  Compression ratio: 6527.7x
  Using model parameters for aggregation, sketches for filtering
Sketchguard Node 18:
  Model dim: 1,174,986 → Sketch size: 180
  Compression ratio: 6527.7x
  Using model parameters for aggregation, sketches for filtering
Sketchguard Node 19:
  Model dim: 1,174,986 → Sketch size: 180
  Compression ratio: 6527.7x
  Using model parameters for aggregation, sketches for filtering
Sketchguard ALGORITHM (Sketch-based Filtering + State Aggregation)
  - Model dimension: 1,174,986 parameters
  - Config: SketchguardConfig(gamma=2, kappa=1, alpha=0.5, min_neighbors=1, sketch_size=180, network_seed=987654321, attack_detection_window=5)
  - Sketch size: 180
  - Compression ratio: 6527.7x
  - Complexity: O(d + N×k) = O(1,174,986 + 20×180)
  - Theoretical speedup vs BALANCE: 19.9x
Initial test acc across nodes: mean=0.4953 ± 0.0174
Round 001: test acc mean=0.5286 ± 0.0348 | min=0.4902 max=0.5938
         : test loss mean=650.3127 ± 581.2248
         : individual accs = ['0.505691', '0.593818', '0.490186', '0.565942', '0.504003', '0.555138', '0.590687', '0.501535', '0.550091', '0.493216', '0.501115', '0.506083', '0.500766', '0.497911', '0.506075', '0.546440', '0.506707', '0.561408', '0.509438', '0.584902']
         : correct/total = [(7197, 14232), (8453, 14235), (6993, 14266), (8046, 14217), (7176, 14238), (7979, 14373), (8474, 14346), (7189, 14334), (7863, 14294), (7089, 14373), (7188, 14344), (7238, 14302), (7188, 14354), (7151, 14362), (7247, 14320), (7866, 14395), (7291, 14389), (8004, 14257), (7260, 14251), (8422, 14399)]
         : compromised: 0.5346, honest: 0.5045
         : sketchguard stats = ['Node 0: acc_rate=0.000', 'Node 1: acc_rate=0.500', 'Node 2: acc_rate=0.000']...
Round 002: test acc mean=0.4962 ± 0.0063 | min=0.4842 max=0.5055
         : test loss mean=740.4871 ± 198.3015
         : individual accs = ['0.503935', '0.501089', '0.496004', '0.498488', '0.505197', '0.501913', '0.499164', '0.492186', '0.487477', '0.495512', '0.505508', '0.502727', '0.486485', '0.493594', '0.491760', '0.498367', '0.489471', '0.484183', '0.499754', '0.491145']
         : correct/total = [(7172, 14232), (7133, 14235), (7076, 14266), (7087, 14217), (7193, 14238), (7214, 14373), (7161, 14346), (7055, 14334), (6968, 14294), (7122, 14373), (7251, 14344), (7190, 14302), (6983, 14354), (7089, 14362), (7042, 14320), (7174, 14395), (7043, 14389), (6903, 14257), (7122, 14251), (7072, 14399)]
         : compromised: 0.4958, honest: 0.4977
         : sketchguard stats = ['Node 0: acc_rate=0.500', 'Node 1: acc_rate=0.250', 'Node 2: acc_rate=0.500']...
Round 003: test acc mean=0.4996 ± 0.0076 | min=0.4870 max=0.5142
         : test loss mean=564.6234 ± 233.5070
         : individual accs = ['0.488477', '0.487039', '0.506729', '0.491595', '0.499298', '0.501496', '0.496654', '0.509139', '0.498951', '0.494886', '0.502370', '0.493008', '0.493173', '0.511141', '0.496997', '0.502675', '0.497880', '0.514204', '0.511894', '0.494757']
         : correct/total = [(6952, 14232), (6933, 14235), (7229, 14266), (6989, 14217), (7109, 14238), (7208, 14373), (7125, 14346), (7298, 14334), (7132, 14294), (7113, 14373), (7206, 14344), (7051, 14302), (7079, 14354), (7341, 14362), (7117, 14320), (7236, 14395), (7164, 14389), (7331, 14257), (7295, 14251), (7124, 14399)]
         : compromised: 0.4998, honest: 0.4987
         : sketchguard stats = ['Node 0: acc_rate=0.667', 'Node 1: acc_rate=0.333', 'Node 2: acc_rate=0.667']...
Round 004: test acc mean=0.4988 ± 0.0068 | min=0.4886 max=0.5181
         : test loss mean=566.5283 ± 307.6384
         : individual accs = ['0.494238', '0.493713', '0.493831', '0.488640', '0.500000', '0.497391', '0.500279', '0.489326', '0.492235', '0.497113', '0.502719', '0.493218', '0.506131', '0.494499', '0.499092', '0.518097', '0.502398', '0.505646', '0.501158', '0.505521']
         : correct/total = [(7034, 14232), (7028, 14235), (7045, 14266), (6947, 14217), (7119, 14238), (7149, 14373), (7177, 14346), (7014, 14334), (7036, 14294), (7145, 14373), (7211, 14344), (7054, 14302), (7265, 14354), (7102, 14362), (7147, 14320), (7458, 14395), (7229, 14389), (7209, 14257), (7142, 14251), (7279, 14399)]
         : compromised: 0.4993, honest: 0.4965
         : sketchguard stats = ['Node 0: acc_rate=0.750', 'Node 1: acc_rate=0.375', 'Node 2: acc_rate=0.750']...
Round 005: test acc mean=0.5005 ± 0.0077 | min=0.4832 max=0.5129
         : test loss mean=624.4232 ± 373.0477
         : individual accs = ['0.495433', '0.499824', '0.483247', '0.512907', '0.487779', '0.506505', '0.499094', '0.512767', '0.505667', '0.504905', '0.504532', '0.499930', '0.498258', '0.495683', '0.509218', '0.496700', '0.502954', '0.494073', '0.493088', '0.508299']
         : correct/total = [(7051, 14232), (7115, 14235), (6894, 14266), (7292, 14217), (6945, 14238), (7280, 14373), (7160, 14346), (7350, 14334), (7228, 14294), (7257, 14373), (7237, 14344), (7150, 14302), (7152, 14354), (7119, 14362), (7292, 14320), (7150, 14395), (7237, 14389), (7044, 14257), (7027, 14251), (7319, 14399)]
         : compromised: 0.5007, honest: 0.4997
         : sketchguard stats = ['Node 0: acc_rate=0.800', 'Node 1: acc_rate=0.400', 'Node 2: acc_rate=0.800']...
Round 006: test acc mean=0.5010 ± 0.0100 | min=0.4845 max=0.5224
         : test loss mean=567.7025 ± 405.0602
         : individual accs = ['0.484823', '0.517597', '0.495864', '0.514244', '0.505970', '0.507688', '0.497769', '0.492256', '0.501889', '0.484450', '0.493586', '0.502517', '0.504041', '0.491018', '0.522416', '0.494199', '0.512753', '0.497229', '0.500035', '0.499965']
         : correct/total = [(6900, 14232), (7368, 14235), (7074, 14266), (7311, 14217), (7204, 14238), (7297, 14373), (7141, 14346), (7056, 14334), (7174, 14294), (6963, 14373), (7080, 14344), (7187, 14302), (7235, 14354), (7052, 14362), (7481, 14320), (7114, 14395), (7378, 14389), (7089, 14257), (7126, 14251), (7199, 14399)]
         : compromised: 0.5015, honest: 0.4990
         : sketchguard stats = ['Node 0: acc_rate=0.833', 'Node 1: acc_rate=0.417', 'Node 2: acc_rate=0.833']...
Round 007: test acc mean=0.5020 ± 0.0083 | min=0.4876 max=0.5201
         : test loss mean=1005.1401 ± 613.4125
         : individual accs = ['0.492411', '0.520056', '0.487593', '0.510234', '0.506743', '0.503027', '0.491078', '0.504465', '0.502169', '0.505601', '0.500767', '0.506083', '0.517765', '0.490461', '0.497486', '0.498993', '0.494058', '0.500947', '0.504035', '0.505521']
         : correct/total = [(7008, 14232), (7403, 14235), (6956, 14266), (7254, 14217), (7215, 14238), (7230, 14373), (7045, 14346), (7231, 14334), (7178, 14294), (7267, 14373), (7183, 14344), (7238, 14302), (7432, 14354), (7044, 14362), (7124, 14320), (7183, 14395), (7109, 14389), (7142, 14257), (7183, 14251), (7279, 14399)]
         : compromised: 0.5026, honest: 0.4994
         : sketchguard stats = ['Node 0: acc_rate=0.714', 'Node 1: acc_rate=0.357', 'Node 2: acc_rate=0.714']...
Round 008: test acc mean=0.5019 ± 0.0087 | min=0.4787 max=0.5114
         : test loss mean=896.4902 ± 549.1651
         : individual accs = ['0.511383', '0.478750', '0.507430', '0.486530', '0.508358', '0.499409', '0.507668', '0.498814', '0.489506', '0.501913', '0.504671', '0.507342', '0.493312', '0.510444', '0.510964', '0.506565', '0.508166', '0.497019', '0.501860', '0.508160']
         : correct/total = [(7278, 14232), (6815, 14235), (7239, 14266), (6917, 14217), (7238, 14238), (7178, 14373), (7283, 14346), (7150, 14334), (6997, 14294), (7214, 14373), (7239, 14344), (7256, 14302), (7081, 14354), (7331, 14362), (7317, 14320), (7292, 14395), (7312, 14389), (7086, 14257), (7152, 14251), (7317, 14399)]
         : compromised: 0.5007, honest: 0.5067
         : sketchguard stats = ['Node 0: acc_rate=0.625', 'Node 1: acc_rate=0.312', 'Node 2: acc_rate=0.625']...
Round 009: test acc mean=0.4976 ± 0.0077 | min=0.4804 max=0.5135
         : test loss mean=918.3999 ± 619.8752
         : individual accs = ['0.505762', '0.513453', '0.488855', '0.495674', '0.492063', '0.495999', '0.503904', '0.506488', '0.496992', '0.497391', '0.495538', '0.507132', '0.490386', '0.487885', '0.505028', '0.499271', '0.480436', '0.493091', '0.494913', '0.502257']
         : correct/total = [(7198, 14232), (7309, 14235), (6974, 14266), (7047, 14217), (7006, 14238), (7129, 14373), (7229, 14346), (7260, 14334), (7104, 14294), (7149, 14373), (7108, 14344), (7253, 14302), (7039, 14354), (7007, 14362), (7232, 14320), (7187, 14395), (6913, 14389), (7030, 14257), (7053, 14251), (7232, 14399)]
         : compromised: 0.4980, honest: 0.4962
         : sketchguard stats = ['Node 0: acc_rate=0.556', 'Node 1: acc_rate=0.278', 'Node 2: acc_rate=0.556']...
Round 010: test acc mean=0.4995 ± 0.0088 | min=0.4810 max=0.5138
         : test loss mean=840.0144 ± 457.6098
         : individual accs = ['0.508361', '0.513804', '0.510655', '0.498347', '0.510886', '0.496765', '0.498536', '0.495186', '0.502099', '0.501913', '0.492540', '0.488953', '0.497074', '0.507381', '0.506844', '0.508857', '0.491417', '0.493442', '0.481019', '0.486562']
         : correct/total = [(7235, 14232), (7314, 14235), (7285, 14266), (7085, 14217), (7274, 14238), (7140, 14373), (7152, 14346), (7098, 14334), (7177, 14294), (7214, 14373), (7065, 14344), (6993, 14302), (7135, 14354), (7287, 14362), (7258, 14320), (7325, 14395), (7071, 14389), (7035, 14257), (6855, 14251), (7006, 14399)]
         : compromised: 0.4990, honest: 0.5015
         : sketchguard stats = ['Node 0: acc_rate=0.500', 'Node 1: acc_rate=0.250', 'Node 2: acc_rate=0.500']...

=== FINAL RESULTS ===
Dataset: sent140, Nodes: 20, Graph: ring, Aggregation: sketchguard
Attack: gaussian, 80.0% compromised
Final accuracy - Compromised: 0.4990, Honest: 0.5015
Overall test accuracy: mean=0.4995 ± 0.0088

=== Sketchguard SUMMARY ===
Node 0: acceptance=0.500
Node 1: acceptance=0.250
Node 2: acceptance=0.500
Node 3: acceptance=0.550
Node 4: acceptance=0.500
Node 5: acceptance=0.450
Node 6: acceptance=0.250
Node 7: acceptance=0.500
Node 8: acceptance=0.500
Node 9: acceptance=0.500
Node 10: acceptance=0.500
Node 11: acceptance=0.500
Node 12: acceptance=0.500
Node 13: acceptance=0.500
Node 14: acceptance=0.500
Node 15: acceptance=0.600
Node 16: acceptance=0.500
Node 17: acceptance=0.250
Node 18: acceptance=0.500
Node 19: acceptance=0.550

=== PARALLEL EXECUTION TIME (realistic for distributed system) ===
  COMMUNICATION (max across nodes):
    - Sketch transfer: 0.000s (0.0%)
    - Model fetch (accepted): 0.000s (0.0%)
  COMPUTATION (max across nodes):
    - Sketching: 0.194s (95.2%)
    - Filtering: 0.001s (0.3%)
    - Aggregation: 0.009s (4.4%)
  TOTALS:
    - Total computation: 0.204s (100.0%)
    - Total communication: 0.000s (0.0%)
    - Total parallel time: 0.204s

=== PER-NODE AVERAGE TIME ===
  - Sketching: 0.179s
  - Filtering: 0.000s
  - Aggregation: 0.007s
  - Sketch transfer: 0.000s
  - Model fetch: 0.000s
  - Total per node: 0.186s

=== TOTAL COMPUTATIONAL WORK (sum across all nodes) ===
  - Total sketching: 3.579s
  - Total filtering: 0.006s
  - Total aggregation: 0.141s
  - Total sketch transfer: 0.000s
  - Total model fetch: 0.000s
  - Grand total: 3.727s
  - Mean acceptance rate: 0.470

Sketchguard Algorithm Properties:
  - Original dimension: 1,174,986
  - Sketch size: 180
  - Compression ratio: 19.9x
  - Single repetition: No repetitions needed
  - Theoretical complexity: O(d + N×k)
  - Approach: Sketch filtering + state aggregation
