Device: cuda
Seed: 987654321
Loading 1 LEAF Sent140 train files...
LEAF Sent140 train: 254555 users, 908652 samples
Building vocabulary (max_size=10000)...
Vocabulary size: 10000
Loading 1 LEAF Sent140 test files...
LEAF Sent140 test: 254555 users, 286281 samples
Found 254555 train users, 254555 test users, 254555 common users
User sample counts range: 494 (max) to 1 (min)
Distributed ALL 254555 users across 20 clients
Users per client: 12727 (with 15 clients getting +1 user)
Train partition sizes: [44353, 44290, 44657, 44907, 44696, 45843, 45801, 45619, 45069, 45639, 45821, 45311, 45779, 46056, 45625, 45984, 46428, 44737, 45540, 46497]
Test partition sizes: [14232, 14235, 14266, 14217, 14238, 14373, 14346, 14334, 14294, 14373, 14344, 14302, 14354, 14362, 14320, 14395, 14389, 14257, 14251, 14399]
  Client 0: 44353 train samples, 2 unique classes
  Client 1: 44290 train samples, 2 unique classes
  Client 2: 44657 train samples, 2 unique classes
  Client 3: 44907 train samples, 2 unique classes
  Client 4: 44696 train samples, 2 unique classes
  Client 5: 45843 train samples, 2 unique classes
  Client 6: 45801 train samples, 2 unique classes
  Client 7: 45619 train samples, 2 unique classes
  Client 8: 45069 train samples, 2 unique classes
  Client 9: 45639 train samples, 2 unique classes
  Client 10: 45821 train samples, 2 unique classes
  Client 11: 45311 train samples, 2 unique classes
  Client 12: 45779 train samples, 2 unique classes
  Client 13: 46056 train samples, 2 unique classes
  Client 14: 45625 train samples, 2 unique classes
  Client 15: 45984 train samples, 2 unique classes
  Client 16: 46428 train samples, 2 unique classes
  Client 17: 44737 train samples, 2 unique classes
  Client 18: 45540 train samples, 2 unique classes
  Client 19: 46497 train samples, 2 unique classes
Will sample 4500 samples per client per epoch
Graph: ring, nodes: 20, edges: 20
Degree statistics: avg=2.00, min=2, max=2
Attack: Compromised 2/20 nodes: [5, 13]
Attack type: gaussian, lambda: 1.0
Model variant: baseline
Model parameters: 1,174,986
UBAR ALGORITHM (Two-Stage Byzantine-resilient)
  - Model dimension: 1,174,986 parameters
  - Rho parameter: 0.9
  - Stage 1: Distance-based filtering (select 90% closest neighbors)
  - Stage 2: Performance-based selection (loss comparison)
  - Complexity: O(deg(i)×d + deg(i)×inference)
Initial test acc across nodes: mean=0.4953 ± 0.0174
Round 001: test acc mean=0.5530 ± 0.0279 | min=0.5114 max=0.5940
         : test loss mean=0.6880 ± 0.0022
         : individual accs = ['0.583263', '0.593818', '0.580331', '0.565942', '0.566021', '0.511375', '0.590687', '0.593972', '0.550091', '0.547763', '0.513246', '0.516291', '0.532395', '0.535580', '0.529050', '0.526572', '0.569671', '0.526408', '0.541646', '0.584902']
         : correct/total = [(8301, 14232), (8453, 14235), (8279, 14266), (8046, 14217), (8059, 14238), (7350, 14373), (8474, 14346), (8514, 14334), (7863, 14294), (7873, 14373), (7362, 14344), (7384, 14302), (7642, 14354), (7692, 14362), (7576, 14320), (7580, 14395), (8197, 14389), (7505, 14257), (7719, 14251), (8422, 14399)]
         : compromised: 0.5235, honest: 0.5562
         : ubar stats = ['Node 0: s1=0.500, s2=1.000', 'Node 1: s1=0.500, s2=1.000', 'Node 2: s1=0.500, s2=1.000']...
Round 002: test acc mean=0.6352 ± 0.0104 | min=0.5987 max=0.6471
         : test loss mean=0.6467 ± 0.0136
         : individual accs = ['0.640950', '0.632947', '0.637950', '0.641626', '0.646580', '0.630905', '0.639830', '0.647133', '0.627326', '0.622974', '0.635039', '0.640819', '0.640309', '0.635636', '0.632123', '0.632164', '0.598721', '0.634004', '0.645849', '0.641989']
         : correct/total = [(9122, 14232), (9010, 14235), (9101, 14266), (9122, 14217), (9206, 14238), (9068, 14373), (9179, 14346), (9276, 14334), (8967, 14294), (8954, 14373), (9109, 14344), (9165, 14302), (9191, 14354), (9129, 14362), (9052, 14320), (9100, 14395), (8615, 14389), (9039, 14257), (9204, 14251), (9244, 14399)]
         : compromised: 0.6333, honest: 0.6355
         : ubar stats = ['Node 0: s1=0.500, s2=1.000', 'Node 1: s1=0.500, s2=1.000', 'Node 2: s1=0.500, s2=1.000']...
Round 003: test acc mean=0.6379 ± 0.0092 | min=0.6204 max=0.6524
         : test loss mean=0.6380 ± 0.0092
         : individual accs = ['0.633853', '0.626765', '0.621548', '0.646339', '0.650162', '0.646351', '0.620382', '0.632412', '0.631943', '0.643985', '0.644520', '0.652356', '0.641424', '0.642738', '0.625978', '0.630705', '0.638335', '0.643123', '0.646200', '0.638517']
         : correct/total = [(9021, 14232), (8922, 14235), (8867, 14266), (9189, 14217), (9257, 14238), (9290, 14373), (8900, 14346), (9065, 14334), (9033, 14294), (9256, 14373), (9245, 14344), (9330, 14302), (9207, 14354), (9231, 14362), (8964, 14320), (9079, 14395), (9185, 14389), (9169, 14257), (9209, 14251), (9194, 14399)]
         : compromised: 0.6445, honest: 0.6371
         : ubar stats = ['Node 0: s1=0.500, s2=1.000', 'Node 1: s1=0.500, s2=1.000', 'Node 2: s1=0.500, s2=1.000']...
Round 004: test acc mean=0.6488 ± 0.0068 | min=0.6365 max=0.6585
         : test loss mean=0.6262 ± 0.0060
         : individual accs = ['0.655073', '0.640042', '0.646222', '0.647605', '0.657045', '0.656996', '0.642897', '0.654528', '0.638100', '0.636471', '0.650586', '0.658509', '0.652571', '0.642111', '0.644204', '0.642167', '0.650497', '0.649155', '0.655814', '0.655879']
         : correct/total = [(9323, 14232), (9111, 14235), (9219, 14266), (9207, 14217), (9355, 14238), (9443, 14373), (9223, 14346), (9382, 14334), (9121, 14294), (9148, 14373), (9332, 14344), (9418, 14302), (9367, 14354), (9222, 14362), (9225, 14320), (9244, 14395), (9360, 14389), (9255, 14257), (9346, 14251), (9444, 14399)]
         : compromised: 0.6496, honest: 0.6487
         : ubar stats = ['Node 0: s1=0.500, s2=1.000', 'Node 1: s1=0.500, s2=1.000', 'Node 2: s1=0.500, s2=1.000']...
Round 005: test acc mean=0.6544 ± 0.0048 | min=0.6436 max=0.6639
         : test loss mean=0.6206 ± 0.0051
         : individual accs = ['0.649030', '0.653319', '0.643628', '0.660336', '0.663928', '0.657831', '0.650425', '0.658783', '0.655800', '0.656787', '0.651143', '0.657391', '0.658144', '0.656385', '0.646299', '0.652518', '0.652999', '0.655047', '0.657989', '0.650601']
         : correct/total = [(9237, 14232), (9300, 14235), (9182, 14266), (9388, 14217), (9453, 14238), (9455, 14373), (9331, 14346), (9443, 14334), (9374, 14294), (9440, 14373), (9340, 14344), (9402, 14302), (9447, 14354), (9427, 14362), (9255, 14320), (9393, 14395), (9396, 14389), (9339, 14257), (9377, 14251), (9368, 14399)]
         : compromised: 0.6571, honest: 0.6541
         : ubar stats = ['Node 0: s1=0.500, s2=1.000', 'Node 1: s1=0.500, s2=1.000', 'Node 2: s1=0.500, s2=1.000']...
Round 006: test acc mean=0.6588 ± 0.0051 | min=0.6419 max=0.6669
         : test loss mean=0.6153 ± 0.0046
         : individual accs = ['0.656408', '0.660274', '0.641946', '0.653162', '0.661188', '0.666945', '0.661439', '0.666597', '0.656219', '0.658318', '0.657418', '0.659768', '0.659607', '0.664810', '0.658240', '0.656964', '0.658837', '0.657852', '0.658691', '0.661157']
         : correct/total = [(9342, 14232), (9399, 14235), (9158, 14266), (9286, 14217), (9414, 14238), (9586, 14373), (9489, 14346), (9555, 14334), (9380, 14294), (9462, 14373), (9430, 14344), (9436, 14302), (9468, 14354), (9548, 14362), (9426, 14320), (9457, 14395), (9480, 14389), (9379, 14257), (9387, 14251), (9520, 14399)]
         : compromised: 0.6659, honest: 0.6580
         : ubar stats = ['Node 0: s1=0.500, s2=1.000', 'Node 1: s1=0.500, s2=1.000', 'Node 2: s1=0.500, s2=1.000']...
Round 007: test acc mean=0.6620 ± 0.0092 | min=0.6438 max=0.6747
         : test loss mean=0.6122 ± 0.0071
         : individual accs = ['0.663786', '0.662662', '0.643838', '0.667370', '0.674744', '0.674389', '0.670152', '0.673294', '0.663005', '0.667989', '0.655535', '0.660887', '0.665111', '0.668222', '0.649721', '0.653977', '0.660018', '0.647612', '0.647674', '0.669144']
         : correct/total = [(9447, 14232), (9433, 14235), (9185, 14266), (9488, 14217), (9607, 14238), (9693, 14373), (9614, 14346), (9651, 14334), (9477, 14294), (9601, 14373), (9403, 14344), (9452, 14302), (9547, 14354), (9597, 14362), (9304, 14320), (9414, 14395), (9497, 14389), (9233, 14257), (9230, 14251), (9635, 14399)]
         : compromised: 0.6713, honest: 0.6609
         : ubar stats = ['Node 0: s1=0.500, s2=1.000', 'Node 1: s1=0.500, s2=1.000', 'Node 2: s1=0.500, s2=1.000']...
Round 008: test acc mean=0.6671 ± 0.0074 | min=0.6506 max=0.6780
         : test loss mean=0.6067 ± 0.0063
         : individual accs = ['0.669196', '0.651352', '0.650638', '0.656608', '0.666596', '0.676755', '0.662903', '0.669108', '0.665804', '0.671189', '0.668293', '0.678017', '0.677651', '0.659588', '0.667528', '0.668288', '0.668775', '0.672231', '0.669848', '0.670810']
         : correct/total = [(9524, 14232), (9272, 14235), (9282, 14266), (9335, 14217), (9491, 14238), (9727, 14373), (9510, 14346), (9591, 14334), (9517, 14294), (9647, 14373), (9586, 14344), (9697, 14302), (9727, 14354), (9473, 14362), (9559, 14320), (9620, 14395), (9623, 14389), (9584, 14257), (9546, 14251), (9659, 14399)]
         : compromised: 0.6682, honest: 0.6669
         : ubar stats = ['Node 0: s1=0.500, s2=1.000', 'Node 1: s1=0.500, s2=1.000', 'Node 2: s1=0.500, s2=1.000']...
Round 009: test acc mean=0.6665 ± 0.0108 | min=0.6414 max=0.6798
         : test loss mean=0.6058 ± 0.0088
         : individual accs = ['0.641442', '0.646294', '0.659750', '0.665330', '0.676148', '0.675642', '0.657675', '0.670155', '0.665944', '0.668267', '0.675404', '0.677388', '0.679811', '0.677691', '0.660684', '0.662313', '0.669887', '0.674335', '0.675461', '0.650531']
         : correct/total = [(9129, 14232), (9200, 14235), (9412, 14266), (9459, 14217), (9627, 14238), (9711, 14373), (9435, 14346), (9606, 14334), (9519, 14294), (9605, 14373), (9688, 14344), (9688, 14302), (9758, 14354), (9733, 14362), (9461, 14320), (9534, 14395), (9639, 14389), (9614, 14257), (9626, 14251), (9367, 14399)]
         : compromised: 0.6767, honest: 0.6654
         : ubar stats = ['Node 0: s1=0.500, s2=1.000', 'Node 1: s1=0.500, s2=1.000', 'Node 2: s1=0.500, s2=1.000']...
Round 010: test acc mean=0.6802 ± 0.0079 | min=0.6615 max=0.6932
         : test loss mean=0.5920 ± 0.0066
         : individual accs = ['0.671164', '0.672708', '0.661503', '0.677991', '0.689423', '0.691296', '0.682769', '0.693177', '0.678187', '0.681625', '0.683770', '0.687736', '0.691933', '0.683331', '0.672207', '0.679264', '0.674891', '0.675879', '0.674549', '0.680533']
         : correct/total = [(9552, 14232), (9576, 14235), (9437, 14266), (9639, 14217), (9816, 14238), (9936, 14373), (9795, 14346), (9936, 14334), (9694, 14294), (9797, 14373), (9808, 14344), (9836, 14302), (9932, 14354), (9814, 14362), (9626, 14320), (9778, 14395), (9711, 14389), (9636, 14257), (9613, 14251), (9799, 14399)]
         : compromised: 0.6873, honest: 0.6794
         : ubar stats = ['Node 0: s1=0.500, s2=1.000', 'Node 1: s1=0.500, s2=1.000', 'Node 2: s1=0.500, s2=1.000']...

=== FINAL RESULTS ===
Dataset: sent140, Nodes: 20, Graph: ring, Aggregation: ubar
Attack: gaussian, 10.0% compromised
Final accuracy - Compromised: 0.6873, Honest: 0.6794
Overall test accuracy: mean=0.6802 ± 0.0079

=== UBAR SUMMARY ===
Node 0: stage1=0.500, stage2=1.000, overall=0.500
Node 1: stage1=0.500, stage2=1.000, overall=0.500
Node 2: stage1=0.500, stage2=1.000, overall=0.500
Node 3: stage1=0.500, stage2=1.000, overall=0.500
Node 4: stage1=0.500, stage2=1.000, overall=0.500
Node 5: stage1=0.500, stage2=1.000, overall=0.500
Node 6: stage1=0.500, stage2=1.000, overall=0.500
Node 7: stage1=0.500, stage2=1.000, overall=0.500
Node 8: stage1=0.500, stage2=1.000, overall=0.500
Node 9: stage1=0.500, stage2=1.000, overall=0.500
Node 10: stage1=0.500, stage2=1.000, overall=0.500
Node 11: stage1=0.500, stage2=1.000, overall=0.500
Node 12: stage1=0.500, stage2=1.000, overall=0.500
Node 13: stage1=0.500, stage2=1.000, overall=0.500
Node 14: stage1=0.500, stage2=1.000, overall=0.500
Node 15: stage1=0.500, stage2=1.000, overall=0.500
Node 16: stage1=0.500, stage2=1.000, overall=0.500
Node 17: stage1=0.500, stage2=1.000, overall=0.500
Node 18: stage1=0.500, stage2=1.000, overall=0.500
Node 19: stage1=0.500, stage2=1.000, overall=0.500

=== PARALLEL EXECUTION TIME (realistic for distributed system) ===
  COMMUNICATION (max across nodes):
    - Full model transfer: 0.000s (0.1%)
  COMPUTATION (max across nodes):
    - Distance computation: 0.021s (60.6%)
    - Loss computation: 0.010s (29.7%)
    - Aggregation: 0.003s (9.6%)
  TOTALS:
    - Total computation: 0.035s (99.9%)
    - Total communication: 0.000s (0.1%)
    - Total parallel time: 0.035s

=== PER-NODE AVERAGE TIME ===
  - Distance computation: 0.009s
  - Loss computation: 0.008s
  - Aggregation: 0.003s
  - Model transfer: 0.000s
  - Total per node: 0.020s

=== TOTAL COMPUTATIONAL WORK (sum across all nodes) ===
  - Total distance computation: 0.171s
  - Total loss computation: 0.158s
  - Total aggregation: 0.064s
  - Total model transfer: 0.000s
  - Grand total: 0.393s
  - Mean Stage 1 acceptance rate: 0.500
  - Mean Stage 2 acceptance rate: 1.000
  - Overall acceptance rate: 0.500

UBAR Algorithm Properties:
  - Model dimension: 1,174,986
  - Rho parameter: 0.9
  - Two-stage approach: Distance filtering + loss evaluation
  - Stage 1 selects: 90% of neighbors
  - Stage 2 uses: Training sample loss comparison
  - Theoretical complexity: O(deg(i)×d + deg(i)×inference)
  - Approach: UBAR paper implementation
