Device: cuda
Seed: 987654321
Loading 1 LEAF Sent140 train files...
LEAF Sent140 train: 254555 users, 908652 samples
Building vocabulary (max_size=10000)...
Vocabulary size: 10000
Loading 1 LEAF Sent140 test files...
LEAF Sent140 test: 254555 users, 286281 samples
Found 254555 train users, 254555 test users, 254555 common users
User sample counts range: 494 (max) to 1 (min)
Distributed ALL 254555 users across 20 clients
Users per client: 12727 (with 15 clients getting +1 user)
Train partition sizes: [44353, 44290, 44657, 44907, 44696, 45843, 45801, 45619, 45069, 45639, 45821, 45311, 45779, 46056, 45625, 45984, 46428, 44737, 45540, 46497]
Test partition sizes: [14232, 14235, 14266, 14217, 14238, 14373, 14346, 14334, 14294, 14373, 14344, 14302, 14354, 14362, 14320, 14395, 14389, 14257, 14251, 14399]
  Client 0: 44353 train samples, 2 unique classes
  Client 1: 44290 train samples, 2 unique classes
  Client 2: 44657 train samples, 2 unique classes
  Client 3: 44907 train samples, 2 unique classes
  Client 4: 44696 train samples, 2 unique classes
  Client 5: 45843 train samples, 2 unique classes
  Client 6: 45801 train samples, 2 unique classes
  Client 7: 45619 train samples, 2 unique classes
  Client 8: 45069 train samples, 2 unique classes
  Client 9: 45639 train samples, 2 unique classes
  Client 10: 45821 train samples, 2 unique classes
  Client 11: 45311 train samples, 2 unique classes
  Client 12: 45779 train samples, 2 unique classes
  Client 13: 46056 train samples, 2 unique classes
  Client 14: 45625 train samples, 2 unique classes
  Client 15: 45984 train samples, 2 unique classes
  Client 16: 46428 train samples, 2 unique classes
  Client 17: 44737 train samples, 2 unique classes
  Client 18: 45540 train samples, 2 unique classes
  Client 19: 46497 train samples, 2 unique classes
Will sample 4500 samples per client per epoch
Graph: erdos, nodes: 20, edges: 48
Degree statistics: avg=4.80, min=2, max=7
Attack: Compromised 16/20 nodes: [1, 2, 3, 5, 6, 8, 9, 10, 11, 12, 13, 14, 15, 17, 18, 19]
Attack type: directed_deviation, lambda: 1.0
Model variant: baseline
Model parameters: 1,174,986
Initial test acc across nodes: mean=0.4953 ± 0.0174
Round 001: test acc mean=0.5009 ± 0.0082 | min=0.4855 max=0.5144
         : test loss mean=13.7452 ± 9.0365
         : individual accs = ['0.507307', '0.514366', '0.509253', '0.485545', '0.505619', '0.495582', '0.504252', '0.494419', '0.492934', '0.509636', '0.510109', '0.499161', '0.485927', '0.505570', '0.501885', '0.506912', '0.493015', '0.492179', '0.507614', '0.497118']
         : correct/total = [(7220, 14232), (7322, 14235), (7265, 14266), (6903, 14217), (7199, 14238), (7123, 14373), (7234, 14346), (7087, 14334), (7046, 14294), (7325, 14373), (7317, 14344), (7139, 14302), (6975, 14354), (7261, 14362), (7187, 14320), (7297, 14395), (7094, 14389), (7017, 14257), (7234, 14251), (7158, 14399)]
         : compromised: 0.5011, honest: 0.5001
Round 002: test acc mean=0.4959 ± 0.0078 | min=0.4812 max=0.5149
         : test loss mean=11.0791 ± 3.5417
         : individual accs = ['0.486790', '0.500105', '0.490817', '0.481184', '0.493890', '0.506018', '0.495748', '0.496023', '0.499580', '0.495791', '0.499512', '0.490910', '0.502508', '0.500139', '0.514944', '0.503856', '0.486413', '0.498211', '0.486703', '0.489687']
         : correct/total = [(6928, 14232), (7119, 14235), (7002, 14266), (6841, 14217), (7032, 14238), (7273, 14373), (7112, 14346), (7110, 14334), (7141, 14294), (7126, 14373), (7165, 14344), (7021, 14302), (7213, 14354), (7183, 14362), (7374, 14320), (7253, 14395), (6999, 14389), (7103, 14257), (6936, 14251), (7051, 14399)]
         : compromised: 0.4972, honest: 0.4908
Round 003: test acc mean=0.5039 ± 0.0081 | min=0.4907 max=0.5183
         : test loss mean=3.0793 ± 1.2905
         : individual accs = ['0.491920', '0.516825', '0.515281', '0.498488', '0.505759', '0.501844', '0.511292', '0.501535', '0.518329', '0.512558', '0.501673', '0.500839', '0.514351', '0.495683', '0.495670', '0.500035', '0.490722', '0.504103', '0.503824', '0.496354']
         : correct/total = [(7001, 14232), (7357, 14235), (7351, 14266), (7087, 14217), (7201, 14238), (7213, 14373), (7335, 14346), (7189, 14334), (7409, 14294), (7367, 14373), (7196, 14344), (7163, 14302), (7383, 14354), (7119, 14362), (7098, 14320), (7198, 14395), (7061, 14389), (7187, 14257), (7180, 14251), (7147, 14399)]
         : compromised: 0.5054, honest: 0.4975
Round 004: test acc mean=0.5002 ± 0.0083 | min=0.4852 max=0.5133
         : test loss mean=3.1135 ± 1.2686
         : individual accs = ['0.493676', '0.485213', '0.499369', '0.497925', '0.506743', '0.513254', '0.508365', '0.495605', '0.499930', '0.512628', '0.507041', '0.499091', '0.488157', '0.506475', '0.487989', '0.504828', '0.488012', '0.496458', '0.503894', '0.509341']
         : correct/total = [(7026, 14232), (6907, 14235), (7124, 14266), (7079, 14217), (7215, 14238), (7377, 14373), (7293, 14346), (7104, 14334), (7146, 14294), (7368, 14373), (7273, 14344), (7138, 14302), (7007, 14354), (7274, 14362), (6988, 14320), (7267, 14395), (7022, 14389), (7078, 14257), (7181, 14251), (7334, 14399)]
         : compromised: 0.5012, honest: 0.4960
Round 005: test acc mean=0.4989 ± 0.0109 | min=0.4763 max=0.5152
         : test loss mean=1.3518 ± 0.5312
         : individual accs = ['0.514193', '0.513242', '0.487383', '0.488851', '0.495786', '0.499617', '0.485989', '0.502721', '0.493983', '0.496626', '0.501952', '0.488603', '0.510032', '0.485726', '0.515223', '0.505175', '0.513378', '0.497791', '0.505438', '0.476283']
         : correct/total = [(7318, 14232), (7306, 14235), (6953, 14266), (6950, 14217), (7059, 14238), (7181, 14373), (6972, 14346), (7206, 14334), (7061, 14294), (7138, 14373), (7200, 14344), (6988, 14302), (7321, 14354), (6976, 14362), (7378, 14320), (7272, 14395), (7387, 14389), (7097, 14257), (7203, 14251), (6858, 14399)]
         : compromised: 0.4970, honest: 0.5065
Round 006: test acc mean=0.5057 ± 0.0117 | min=0.4884 max=0.5275
         : test loss mean=1.5673 ± 0.9102
         : individual accs = ['0.521782', '0.491254', '0.501122', '0.488429', '0.503441', '0.502748', '0.518193', '0.498535', '0.526794', '0.517498', '0.499373', '0.495175', '0.492267', '0.511141', '0.516760', '0.506704', '0.527486', '0.497650', '0.499825', '0.497257']
         : correct/total = [(7426, 14232), (6993, 14235), (7149, 14266), (6944, 14217), (7168, 14238), (7226, 14373), (7434, 14346), (7146, 14334), (7530, 14294), (7438, 14373), (7163, 14344), (7082, 14302), (7066, 14354), (7341, 14362), (7400, 14320), (7294, 14395), (7590, 14389), (7095, 14257), (7123, 14251), (7160, 14399)]
         : compromised: 0.5039, honest: 0.5128
Round 007: test acc mean=0.5052 ± 0.0064 | min=0.4955 max=0.5229
         : test loss mean=1.7848 ± 1.6007
         : individual accs = ['0.506254', '0.505936', '0.522922', '0.512274', '0.495926', '0.509845', '0.509619', '0.505651', '0.507765', '0.499687', '0.506762', '0.505384', '0.510171', '0.495474', '0.506844', '0.500729', '0.505386', '0.495686', '0.502351', '0.498576']
         : correct/total = [(7205, 14232), (7202, 14235), (7460, 14266), (7283, 14217), (7061, 14238), (7328, 14373), (7311, 14346), (7248, 14334), (7258, 14294), (7182, 14373), (7269, 14344), (7228, 14302), (7323, 14354), (7116, 14362), (7258, 14320), (7208, 14395), (7272, 14389), (7067, 14257), (7159, 14251), (7179, 14399)]
         : compromised: 0.5056, honest: 0.5033
Round 008: test acc mean=0.5084 ± 0.0116 | min=0.4946 max=0.5323
         : test loss mean=1.3793 ± 0.8953
         : individual accs = ['0.532322', '0.496944', '0.520328', '0.495674', '0.499438', '0.501565', '0.515266', '0.506279', '0.518399', '0.527934', '0.495120', '0.499021', '0.494636', '0.510653', '0.517179', '0.499340', '0.525193', '0.502490', '0.499684', '0.510105']
         : correct/total = [(7576, 14232), (7074, 14235), (7423, 14266), (7047, 14217), (7111, 14238), (7209, 14373), (7392, 14346), (7257, 14334), (7410, 14294), (7588, 14373), (7102, 14344), (7137, 14302), (7100, 14354), (7334, 14362), (7406, 14320), (7188, 14395), (7557, 14389), (7164, 14257), (7121, 14251), (7345, 14399)]
         : compromised: 0.5065, honest: 0.5158
Round 009: test acc mean=0.5026 ± 0.0079 | min=0.4901 max=0.5264
         : test loss mean=1.1657 ± 0.6157
         : individual accs = ['0.508291', '0.500808', '0.510865', '0.500598', '0.497050', '0.503722', '0.499861', '0.496930', '0.503078', '0.505114', '0.505368', '0.501119', '0.526404', '0.493316', '0.494972', '0.503647', '0.513309', '0.490145', '0.503333', '0.494409']
         : correct/total = [(7234, 14232), (7129, 14235), (7288, 14266), (7117, 14217), (7077, 14238), (7240, 14373), (7171, 14346), (7123, 14334), (7191, 14294), (7260, 14373), (7249, 14344), (7167, 14302), (7556, 14354), (7085, 14362), (7088, 14320), (7250, 14395), (7386, 14389), (6988, 14257), (7173, 14251), (7119, 14399)]
         : compromised: 0.5023, honest: 0.5039
Round 010: test acc mean=0.5091 ± 0.0115 | min=0.4921 max=0.5321
         : test loss mean=1.2421 ± 0.7491
         : individual accs = ['0.532111', '0.497436', '0.523973', '0.492087', '0.505408', '0.499339', '0.523351', '0.504395', '0.508675', '0.522299', '0.502440', '0.505174', '0.492337', '0.515527', '0.519693', '0.500243', '0.524220', '0.510907', '0.497158', '0.504618']
         : correct/total = [(7573, 14232), (7081, 14235), (7475, 14266), (6996, 14217), (7196, 14238), (7177, 14373), (7508, 14346), (7230, 14334), (7271, 14294), (7507, 14373), (7207, 14344), (7225, 14302), (7067, 14354), (7404, 14362), (7442, 14320), (7201, 14395), (7543, 14389), (7284, 14257), (7085, 14251), (7266, 14399)]
         : compromised: 0.5072, honest: 0.5165

=== FINAL RESULTS ===
Dataset: sent140, Nodes: 20, Graph: erdos, Aggregation: d-fedavg
Attack: directed_deviation, 80.0% compromised
Final accuracy - Compromised: 0.5072, Honest: 0.5165
Overall test accuracy: mean=0.5091 ± 0.0115
