Device: cuda
Seed: 987654321
Loading 1 LEAF Sent140 train files...
LEAF Sent140 train: 254555 users, 908652 samples
Building vocabulary (max_size=10000)...
Vocabulary size: 10000
Loading 1 LEAF Sent140 test files...
LEAF Sent140 test: 254555 users, 286281 samples
Found 254555 train users, 254555 test users, 254555 common users
User sample counts range: 494 (max) to 1 (min)
Distributed ALL 254555 users across 20 clients
Users per client: 12727 (with 15 clients getting +1 user)
Train partition sizes: [44353, 44290, 44657, 44907, 44696, 45843, 45801, 45619, 45069, 45639, 45821, 45311, 45779, 46056, 45625, 45984, 46428, 44737, 45540, 46497]
Test partition sizes: [14232, 14235, 14266, 14217, 14238, 14373, 14346, 14334, 14294, 14373, 14344, 14302, 14354, 14362, 14320, 14395, 14389, 14257, 14251, 14399]
  Client 0: 44353 train samples, 2 unique classes
  Client 1: 44290 train samples, 2 unique classes
  Client 2: 44657 train samples, 2 unique classes
  Client 3: 44907 train samples, 2 unique classes
  Client 4: 44696 train samples, 2 unique classes
  Client 5: 45843 train samples, 2 unique classes
  Client 6: 45801 train samples, 2 unique classes
  Client 7: 45619 train samples, 2 unique classes
  Client 8: 45069 train samples, 2 unique classes
  Client 9: 45639 train samples, 2 unique classes
  Client 10: 45821 train samples, 2 unique classes
  Client 11: 45311 train samples, 2 unique classes
  Client 12: 45779 train samples, 2 unique classes
  Client 13: 46056 train samples, 2 unique classes
  Client 14: 45625 train samples, 2 unique classes
  Client 15: 45984 train samples, 2 unique classes
  Client 16: 46428 train samples, 2 unique classes
  Client 17: 44737 train samples, 2 unique classes
  Client 18: 45540 train samples, 2 unique classes
  Client 19: 46497 train samples, 2 unique classes
Will sample 4500 samples per client per epoch
Graph: erdos, nodes: 20, edges: 48
Degree statistics: avg=4.80, min=2, max=7
Attack: Compromised 8/20 nodes: [1, 5, 11, 12, 13, 14, 17, 18]
Attack type: gaussian, lambda: 1.0
Model variant: baseline
Model parameters: 1,174,986
Sketchguard Node 0:
  Model dim: 1,174,986 → Sketch size: 180
  Compression ratio: 6527.7x
  Using model parameters for aggregation, sketches for filtering
Sketchguard Node 1:
  Model dim: 1,174,986 → Sketch size: 180
  Compression ratio: 6527.7x
  Using model parameters for aggregation, sketches for filtering
Sketchguard Node 2:
  Model dim: 1,174,986 → Sketch size: 180
  Compression ratio: 6527.7x
  Using model parameters for aggregation, sketches for filtering
Sketchguard Node 3:
  Model dim: 1,174,986 → Sketch size: 180
  Compression ratio: 6527.7x
  Using model parameters for aggregation, sketches for filtering
Sketchguard Node 4:
  Model dim: 1,174,986 → Sketch size: 180
  Compression ratio: 6527.7x
  Using model parameters for aggregation, sketches for filtering
Sketchguard Node 5:
  Model dim: 1,174,986 → Sketch size: 180
  Compression ratio: 6527.7x
  Using model parameters for aggregation, sketches for filtering
Sketchguard Node 6:
  Model dim: 1,174,986 → Sketch size: 180
  Compression ratio: 6527.7x
  Using model parameters for aggregation, sketches for filtering
Sketchguard Node 7:
  Model dim: 1,174,986 → Sketch size: 180
  Compression ratio: 6527.7x
  Using model parameters for aggregation, sketches for filtering
Sketchguard Node 8:
  Model dim: 1,174,986 → Sketch size: 180
  Compression ratio: 6527.7x
  Using model parameters for aggregation, sketches for filtering
Sketchguard Node 9:
  Model dim: 1,174,986 → Sketch size: 180
  Compression ratio: 6527.7x
  Using model parameters for aggregation, sketches for filtering
Sketchguard Node 10:
  Model dim: 1,174,986 → Sketch size: 180
  Compression ratio: 6527.7x
  Using model parameters for aggregation, sketches for filtering
Sketchguard Node 11:
  Model dim: 1,174,986 → Sketch size: 180
  Compression ratio: 6527.7x
  Using model parameters for aggregation, sketches for filtering
Sketchguard Node 12:
  Model dim: 1,174,986 → Sketch size: 180
  Compression ratio: 6527.7x
  Using model parameters for aggregation, sketches for filtering
Sketchguard Node 13:
  Model dim: 1,174,986 → Sketch size: 180
  Compression ratio: 6527.7x
  Using model parameters for aggregation, sketches for filtering
Sketchguard Node 14:
  Model dim: 1,174,986 → Sketch size: 180
  Compression ratio: 6527.7x
  Using model parameters for aggregation, sketches for filtering
Sketchguard Node 15:
  Model dim: 1,174,986 → Sketch size: 180
  Compression ratio: 6527.7x
  Using model parameters for aggregation, sketches for filtering
Sketchguard Node 16:
  Model dim: 1,174,986 → Sketch size: 180
  Compression ratio: 6527.7x
  Using model parameters for aggregation, sketches for filtering
Sketchguard Node 17:
  Model dim: 1,174,986 → Sketch size: 180
  Compression ratio: 6527.7x
  Using model parameters for aggregation, sketches for filtering
Sketchguard Node 18:
  Model dim: 1,174,986 → Sketch size: 180
  Compression ratio: 6527.7x
  Using model parameters for aggregation, sketches for filtering
Sketchguard Node 19:
  Model dim: 1,174,986 → Sketch size: 180
  Compression ratio: 6527.7x
  Using model parameters for aggregation, sketches for filtering
Sketchguard ALGORITHM (Sketch-based Filtering + State Aggregation)
  - Model dimension: 1,174,986 parameters
  - Config: SketchguardConfig(gamma=2, kappa=1, alpha=0.5, min_neighbors=1, sketch_size=180, network_seed=987654321, attack_detection_window=5)
  - Sketch size: 180
  - Compression ratio: 6527.7x
  - Complexity: O(d + N×k) = O(1,174,986 + 20×180)
  - Theoretical speedup vs BALANCE: 19.9x
Initial test acc across nodes: mean=0.4953 ± 0.0174
Round 001: test acc mean=0.5618 ± 0.0356 | min=0.4995 max=0.6274
         : test loss mean=0.6892 ± 0.0016
         : individual accs = ['0.554666', '0.562346', '0.521169', '0.499543', '0.597907', '0.569749', '0.568172', '0.611902', '0.554289', '0.505462', '0.552705', '0.535659', '0.627351', '0.597340', '0.520880', '0.603960', '0.572938', '0.581188', '0.517788', '0.580179']
         : correct/total = [(7894, 14232), (8005, 14235), (7435, 14266), (7102, 14217), (8513, 14238), (8189, 14373), (8151, 14346), (8771, 14334), (7923, 14294), (7265, 14373), (7928, 14344), (7661, 14302), (9005, 14354), (8579, 14362), (7459, 14320), (8694, 14395), (8244, 14389), (8286, 14257), (7379, 14251), (8354, 14399)]
         : compromised: 0.5640, honest: 0.5602
         : sketchguard stats = ['Node 0: acc_rate=0.833', 'Node 1: acc_rate=0.833', 'Node 2: acc_rate=0.400']...
Round 002: test acc mean=0.5863 ± 0.0523 | min=0.4931 max=0.6386
         : test loss mean=0.6763 ± 0.0150
         : individual accs = ['0.623314', '0.506428', '0.621688', '0.585215', '0.638292', '0.636610', '0.616060', '0.632761', '0.625297', '0.568357', '0.598090', '0.521815', '0.511007', '0.623590', '0.493087', '0.638555', '0.630343', '0.511117', '0.522700', '0.621710']
         : correct/total = [(8871, 14232), (7209, 14235), (8869, 14266), (8320, 14217), (9088, 14238), (9150, 14373), (8838, 14346), (9070, 14334), (8938, 14294), (8169, 14373), (8579, 14344), (7463, 14302), (7335, 14354), (8956, 14362), (7061, 14320), (9192, 14395), (9070, 14389), (7287, 14257), (7449, 14251), (8952, 14399)]
         : compromised: 0.5408, honest: 0.6166
         : sketchguard stats = ['Node 0: acc_rate=0.833', 'Node 1: acc_rate=0.750', 'Node 2: acc_rate=0.400']...
Round 003: test acc mean=0.5960 ± 0.0423 | min=0.5026 max=0.6372
         : test loss mean=0.6697 ± 0.0160
         : individual accs = ['0.595840', '0.502564', '0.630941', '0.632482', '0.637168', '0.624991', '0.527952', '0.628785', '0.635371', '0.635915', '0.612033', '0.539435', '0.524314', '0.627071', '0.574232', '0.587218', '0.624991', '0.582451', '0.567329', '0.629002']
         : correct/total = [(8480, 14232), (7154, 14235), (9001, 14266), (8992, 14217), (9072, 14238), (8983, 14373), (7574, 14346), (9013, 14334), (9082, 14294), (9140, 14373), (8779, 14344), (7715, 14302), (7526, 14354), (9006, 14362), (8223, 14320), (8453, 14395), (8993, 14389), (8304, 14257), (8085, 14251), (9057, 14399)]
         : compromised: 0.5678, honest: 0.6148
         : sketchguard stats = ['Node 0: acc_rate=0.833', 'Node 1: acc_rate=0.667', 'Node 2: acc_rate=0.400']...
Round 004: test acc mean=0.6333 ± 0.0180 | min=0.5708 max=0.6511
         : test loss mean=0.6583 ± 0.0165
         : individual accs = ['0.642144', '0.604988', '0.630240', '0.638391', '0.638503', '0.647325', '0.634741', '0.651109', '0.646915', '0.631323', '0.642080', '0.632639', '0.570782', '0.626584', '0.617249', '0.647933', '0.642018', '0.646770', '0.634131', '0.639628']
         : correct/total = [(9139, 14232), (8612, 14235), (8991, 14266), (9076, 14217), (9091, 14238), (9304, 14373), (9106, 14346), (9333, 14334), (9247, 14294), (9074, 14373), (9210, 14344), (9048, 14302), (8193, 14354), (8999, 14362), (8839, 14320), (9327, 14395), (9238, 14389), (9221, 14257), (9037, 14251), (9210, 14399)]
         : compromised: 0.6226, honest: 0.6404
         : sketchguard stats = ['Node 0: acc_rate=0.833', 'Node 1: acc_rate=0.625', 'Node 2: acc_rate=0.400']...
Round 005: test acc mean=0.6385 ± 0.0108 | min=0.6157 max=0.6535
         : test loss mean=0.6515 ± 0.0139
         : individual accs = ['0.639545', '0.637864', '0.641806', '0.645213', '0.650021', '0.647186', '0.638087', '0.653481', '0.643557', '0.625617', '0.645566', '0.633478', '0.616065', '0.628464', '0.625768', '0.638833', '0.646814', '0.649155', '0.615746', '0.648726']
         : correct/total = [(9102, 14232), (9080, 14235), (9156, 14266), (9173, 14217), (9255, 14238), (9302, 14373), (9154, 14346), (9367, 14334), (9199, 14294), (8992, 14373), (9260, 14344), (9060, 14302), (8843, 14354), (9026, 14362), (8961, 14320), (9196, 14395), (9307, 14389), (9255, 14257), (8775, 14251), (9341, 14399)]
         : compromised: 0.6317, honest: 0.6431
         : sketchguard stats = ['Node 0: acc_rate=0.833', 'Node 1: acc_rate=0.600', 'Node 2: acc_rate=0.400']...
Round 006: test acc mean=0.6455 ± 0.0092 | min=0.6218 max=0.6570
         : test loss mean=0.6438 ± 0.0124
         : individual accs = ['0.647695', '0.621777', '0.641595', '0.649856', '0.650934', '0.656648', '0.652238', '0.657039', '0.655800', '0.645933', '0.640547', '0.642078', '0.650411', '0.649352', '0.634078', '0.650573', '0.646675', '0.635898', '0.629079', '0.652615']
         : correct/total = [(9218, 14232), (8851, 14235), (9153, 14266), (9239, 14217), (9268, 14238), (9438, 14373), (9357, 14346), (9418, 14334), (9374, 14294), (9284, 14373), (9188, 14344), (9183, 14302), (9336, 14354), (9326, 14362), (9080, 14320), (9365, 14395), (9305, 14389), (9066, 14257), (8965, 14251), (9397, 14399)]
         : compromised: 0.6399, honest: 0.6493
         : sketchguard stats = ['Node 0: acc_rate=0.833', 'Node 1: acc_rate=0.611', 'Node 2: acc_rate=0.400']...
Round 007: test acc mean=0.6476 ± 0.0101 | min=0.6170 max=0.6582
         : test loss mean=0.6379 ± 0.0105
         : individual accs = ['0.650014', '0.655567', '0.634726', '0.648590', '0.651496', '0.651986', '0.642967', '0.655574', '0.658248', '0.638141', '0.651701', '0.616977', '0.655706', '0.630831', '0.649721', '0.652588', '0.650497', '0.654766', '0.645709', '0.656157']
         : correct/total = [(9251, 14232), (9332, 14235), (9055, 14266), (9221, 14217), (9276, 14238), (9371, 14373), (9224, 14346), (9397, 14334), (9409, 14294), (9172, 14373), (9348, 14344), (8824, 14302), (9412, 14354), (9060, 14362), (9304, 14320), (9394, 14395), (9360, 14389), (9335, 14257), (9202, 14251), (9448, 14399)]
         : compromised: 0.6452, honest: 0.6492
         : sketchguard stats = ['Node 0: acc_rate=0.833', 'Node 1: acc_rate=0.619', 'Node 2: acc_rate=0.400']...
Round 008: test acc mean=0.6489 ± 0.0081 | min=0.6316 max=0.6623
         : test loss mean=0.6339 ± 0.0101
         : individual accs = ['0.648749', '0.644257', '0.631642', '0.662306', '0.653954', '0.642385', '0.657396', '0.643435', '0.659787', '0.650386', '0.641523', '0.649350', '0.634248', '0.653182', '0.650628', '0.646336', '0.646536', '0.658484', '0.644376', '0.659907']
         : correct/total = [(9233, 14232), (9171, 14235), (9011, 14266), (9416, 14217), (9311, 14238), (9233, 14373), (9431, 14346), (9223, 14334), (9431, 14294), (9348, 14373), (9202, 14344), (9287, 14302), (9104, 14354), (9381, 14362), (9317, 14320), (9304, 14395), (9303, 14389), (9388, 14257), (9183, 14251), (9502, 14399)]
         : compromised: 0.6471, honest: 0.6502
         : sketchguard stats = ['Node 0: acc_rate=0.833', 'Node 1: acc_rate=0.625', 'Node 2: acc_rate=0.400']...
Round 009: test acc mean=0.6497 ± 0.0102 | min=0.6292 max=0.6673
         : test loss mean=0.6330 ± 0.0090
         : individual accs = ['0.634978', '0.652195', '0.646222', '0.652810', '0.642366', '0.665345', '0.629165', '0.652435', '0.639289', '0.643777', '0.653862', '0.634876', '0.654591', '0.660284', '0.651536', '0.639805', '0.657516', '0.657361', '0.658340', '0.667338']
         : correct/total = [(9037, 14232), (9284, 14235), (9219, 14266), (9281, 14217), (9146, 14238), (9563, 14373), (9026, 14346), (9352, 14334), (9138, 14294), (9253, 14373), (9379, 14344), (9080, 14302), (9396, 14354), (9483, 14362), (9330, 14320), (9210, 14395), (9461, 14389), (9372, 14257), (9382, 14251), (9609, 14399)]
         : compromised: 0.6543, honest: 0.6466
         : sketchguard stats = ['Node 0: acc_rate=0.833', 'Node 1: acc_rate=0.630', 'Node 2: acc_rate=0.400']...
Round 010: test acc mean=0.6628 ± 0.0081 | min=0.6389 max=0.6723
         : test loss mean=0.6222 ± 0.0085
         : individual accs = ['0.662732', '0.667158', '0.638862', '0.669340', '0.661610', '0.668267', '0.666109', '0.671271', '0.670841', '0.660614', '0.663971', '0.663613', '0.672286', '0.664601', '0.661313', '0.651546', '0.664118', '0.669496', '0.647604', '0.660115']
         : correct/total = [(9432, 14232), (9497, 14235), (9114, 14266), (9516, 14217), (9420, 14238), (9605, 14373), (9556, 14346), (9622, 14334), (9589, 14294), (9495, 14373), (9524, 14344), (9491, 14302), (9650, 14354), (9545, 14362), (9470, 14320), (9379, 14395), (9556, 14389), (9545, 14257), (9229, 14251), (9505, 14399)]
         : compromised: 0.6643, honest: 0.6618
         : sketchguard stats = ['Node 0: acc_rate=0.833', 'Node 1: acc_rate=0.633', 'Node 2: acc_rate=0.400']...

=== FINAL RESULTS ===
Dataset: sent140, Nodes: 20, Graph: erdos, Aggregation: sketchguard
Attack: gaussian, 40.0% compromised
Final accuracy - Compromised: 0.6643, Honest: 0.6618
Overall test accuracy: mean=0.6628 ± 0.0081

=== Sketchguard SUMMARY ===
Node 0: acceptance=0.833
Node 1: acceptance=0.633
Node 2: acceptance=0.400
Node 3: acceptance=0.500
Node 4: acceptance=0.250
Node 5: acceptance=0.200
Node 6: acceptance=0.600
Node 7: acceptance=0.600
Node 8: acceptance=0.500
Node 9: acceptance=0.667
Node 10: acceptance=0.500
Node 11: acceptance=0.429
Node 12: acceptance=0.714
Node 13: acceptance=0.500
Node 14: acceptance=0.429
Node 15: acceptance=0.333
Node 16: acceptance=0.200
Node 17: acceptance=0.440
Node 18: acceptance=0.600
Node 19: acceptance=1.000

=== PARALLEL EXECUTION TIME (realistic for distributed system) ===
  COMMUNICATION (max across nodes):
    - Sketch transfer: 0.000s (0.0%)
    - Model fetch (accepted): 0.000s (0.0%)
  COMPUTATION (max across nodes):
    - Sketching: 0.293s (95.6%)
    - Filtering: 0.001s (0.3%)
    - Aggregation: 0.013s (4.2%)
  TOTALS:
    - Total computation: 0.307s (100.0%)
    - Total communication: 0.000s (0.0%)
    - Total parallel time: 0.307s

=== PER-NODE AVERAGE TIME ===
  - Sketching: 0.193s
  - Filtering: 0.000s
  - Aggregation: 0.008s
  - Sketch transfer: 0.000s
  - Model fetch: 0.000s
  - Total per node: 0.201s

=== TOTAL COMPUTATIONAL WORK (sum across all nodes) ===
  - Total sketching: 3.854s
  - Total filtering: 0.008s
  - Total aggregation: 0.153s
  - Total sketch transfer: 0.000s
  - Total model fetch: 0.000s
  - Grand total: 4.016s
  - Mean acceptance rate: 0.516

Sketchguard Algorithm Properties:
  - Original dimension: 1,174,986
  - Sketch size: 180
  - Compression ratio: 19.9x
  - Single repetition: No repetitions needed
  - Theoretical complexity: O(d + N×k)
  - Approach: Sketch filtering + state aggregation
