Device: cuda
Seed: 987654321
Loading 1 LEAF Sent140 train files...
LEAF Sent140 train: 254555 users, 908652 samples
Building vocabulary (max_size=10000)...
Vocabulary size: 10000
Loading 1 LEAF Sent140 test files...
LEAF Sent140 test: 254555 users, 286281 samples
Found 254555 train users, 254555 test users, 254555 common users
User sample counts range: 494 (max) to 1 (min)
Distributed ALL 254555 users across 20 clients
Users per client: 12727 (with 15 clients getting +1 user)
Train partition sizes: [44353, 44290, 44657, 44907, 44696, 45843, 45801, 45619, 45069, 45639, 45821, 45311, 45779, 46056, 45625, 45984, 46428, 44737, 45540, 46497]
Test partition sizes: [14232, 14235, 14266, 14217, 14238, 14373, 14346, 14334, 14294, 14373, 14344, 14302, 14354, 14362, 14320, 14395, 14389, 14257, 14251, 14399]
  Client 0: 44353 train samples, 2 unique classes
  Client 1: 44290 train samples, 2 unique classes
  Client 2: 44657 train samples, 2 unique classes
  Client 3: 44907 train samples, 2 unique classes
  Client 4: 44696 train samples, 2 unique classes
  Client 5: 45843 train samples, 2 unique classes
  Client 6: 45801 train samples, 2 unique classes
  Client 7: 45619 train samples, 2 unique classes
  Client 8: 45069 train samples, 2 unique classes
  Client 9: 45639 train samples, 2 unique classes
  Client 10: 45821 train samples, 2 unique classes
  Client 11: 45311 train samples, 2 unique classes
  Client 12: 45779 train samples, 2 unique classes
  Client 13: 46056 train samples, 2 unique classes
  Client 14: 45625 train samples, 2 unique classes
  Client 15: 45984 train samples, 2 unique classes
  Client 16: 46428 train samples, 2 unique classes
  Client 17: 44737 train samples, 2 unique classes
  Client 18: 45540 train samples, 2 unique classes
  Client 19: 46497 train samples, 2 unique classes
Will sample 4500 samples per client per epoch
Graph: erdos, nodes: 20, edges: 126
Degree statistics: avg=12.60, min=8, max=16
Attack: Compromised 6/20 nodes: [5, 12, 13, 14, 17, 18]
Attack type: krum, lambda: 1.0
Model variant: baseline
Model parameters: 1,174,986
BALANCE algorithm:
Balance Config: BALANCEConfig(gamma=2, kappa=1, alpha=0.5, min_neighbors=1)
  - Model dimension: 1,174,986 parameters
  - Complexity: O(N×d) = O(20×1,174,986)
Initial test acc across nodes: mean=0.4953 ± 0.0174
Round 001: test acc mean=0.4963 ± 0.0087 | min=0.4838 max=0.5180
         : test loss mean=0.9864 ± 0.2698
         : individual accs = ['0.484191', '0.493642', '0.494112', '0.491032', '0.506181', '0.495791', '0.492123', '0.512139', '0.502029', '0.484937', '0.498815', '0.489792', '0.500209', '0.518034', '0.487151', '0.497464', '0.483772', '0.497300', '0.498562', '0.498924']
         : correct/total = [(6891, 14232), (7027, 14235), (7049, 14266), (6981, 14217), (7207, 14238), (7126, 14373), (7060, 14346), (7341, 14334), (7176, 14294), (6970, 14373), (7155, 14344), (7005, 14302), (7180, 14354), (7440, 14362), (6976, 14320), (7161, 14395), (6961, 14389), (7090, 14257), (7105, 14251), (7184, 14399)]
         : compromised: 0.4995, honest: 0.4949
Round 002: test acc mean=0.5316 ± 0.0299 | min=0.4851 max=0.5926
         : test loss mean=0.6902 ± 0.0036
         : individual accs = ['0.521220', '0.592554', '0.531193', '0.485123', '0.514609', '0.504766', '0.503764', '0.541719', '0.534700', '0.509984', '0.560374', '0.541533', '0.572175', '0.570046', '0.494204', '0.502397', '0.509973', '0.570316', '0.510210', '0.560386']
         : correct/total = [(7418, 14232), (8435, 14235), (7578, 14266), (6897, 14217), (7327, 14238), (7255, 14373), (7227, 14346), (7765, 14334), (7643, 14294), (7330, 14373), (8038, 14344), (7745, 14302), (8213, 14354), (8187, 14362), (7077, 14320), (7232, 14395), (7338, 14389), (8131, 14257), (7271, 14251), (8069, 14399)]
         : compromised: 0.5370, honest: 0.5293
Round 003: test acc mean=0.5435 ± 0.0379 | min=0.4903 max=0.6122
         : test loss mean=0.6878 ± 0.0025
         : individual accs = ['0.531759', '0.490270', '0.603743', '0.566294', '0.577258', '0.496208', '0.500070', '0.612181', '0.568350', '0.566131', '0.579057', '0.518948', '0.517765', '0.594834', '0.562779', '0.498090', '0.535548', '0.499123', '0.515052', '0.537121']
         : correct/total = [(7568, 14232), (6979, 14235), (8613, 14266), (8051, 14217), (8219, 14238), (7132, 14373), (7174, 14346), (8775, 14334), (8124, 14294), (8137, 14373), (8306, 14344), (7422, 14302), (7432, 14354), (8543, 14362), (8059, 14320), (7170, 14395), (7706, 14389), (7116, 14257), (7340, 14251), (7734, 14399)]
         : compromised: 0.5310, honest: 0.5489
Round 004: test acc mean=0.5901 ± 0.0406 | min=0.4997 max=0.6316
         : test loss mean=0.6826 ± 0.0032
         : individual accs = ['0.591835', '0.623604', '0.625613', '0.617852', '0.554291', '0.593543', '0.520075', '0.630110', '0.553099', '0.625617', '0.618795', '0.604531', '0.522293', '0.602910', '0.547696', '0.622647', '0.615818', '0.499684', '0.600589', '0.631641']
         : correct/total = [(8423, 14232), (8877, 14235), (8925, 14266), (8784, 14217), (7892, 14238), (8531, 14373), (7461, 14346), (9032, 14334), (7906, 14294), (8992, 14373), (8876, 14344), (8646, 14302), (7497, 14354), (8659, 14362), (7843, 14320), (8963, 14395), (8861, 14389), (7124, 14257), (8559, 14251), (9095, 14399)]
         : compromised: 0.5611, honest: 0.6025
Round 005: test acc mean=0.6295 ± 0.0101 | min=0.6024 max=0.6417
         : test loss mean=0.6679 ± 0.0033
         : individual accs = ['0.637015', '0.637162', '0.629539', '0.635225', '0.640329', '0.630279', '0.638087', '0.602414', '0.641668', '0.614138', '0.630717', '0.634387', '0.635084', '0.633059', '0.631215', '0.630844', '0.628814', '0.624395', '0.607466', '0.628030']
         : correct/total = [(9066, 14232), (9070, 14235), (8981, 14266), (9031, 14217), (9117, 14238), (9059, 14373), (9154, 14346), (8635, 14334), (9172, 14294), (8827, 14373), (9047, 14344), (9073, 14302), (9116, 14354), (9092, 14362), (9039, 14320), (9081, 14395), (9048, 14389), (8902, 14257), (8657, 14251), (9043, 14399)]
         : compromised: 0.6269, honest: 0.6306
Round 006: test acc mean=0.6441 ± 0.0064 | min=0.6317 max=0.6530
         : test loss mean=0.6437 ± 0.0037
         : individual accs = ['0.648609', '0.648964', '0.640193', '0.640782', '0.645175', '0.653030', '0.643315', '0.651458', '0.646915', '0.644751', '0.635736', '0.631730', '0.636129', '0.645036', '0.646369', '0.648211', '0.651887', '0.636950', '0.633570', '0.652962']
         : correct/total = [(9231, 14232), (9238, 14235), (9133, 14266), (9110, 14217), (9186, 14238), (9386, 14373), (9229, 14346), (9338, 14334), (9247, 14294), (9267, 14373), (9119, 14344), (9035, 14302), (9131, 14354), (9264, 14362), (9256, 14320), (9331, 14395), (9380, 14389), (9081, 14257), (9029, 14251), (9402, 14399)]
         : compromised: 0.6418, honest: 0.6450
Round 007: test acc mean=0.6486 ± 0.0086 | min=0.6240 max=0.6604
         : test loss mean=0.6308 ± 0.0052
         : individual accs = ['0.655705', '0.656762', '0.650638', '0.648941', '0.655640', '0.660405', '0.651331', '0.623971', '0.650343', '0.655535', '0.636991', '0.650119', '0.650132', '0.632711', '0.653352', '0.644946', '0.652929', '0.647822', '0.641218', '0.652893']
         : correct/total = [(9332, 14232), (9349, 14235), (9282, 14266), (9226, 14217), (9335, 14238), (9492, 14373), (9344, 14346), (8944, 14334), (9296, 14294), (9422, 14373), (9137, 14344), (9298, 14302), (9332, 14354), (9087, 14362), (9356, 14320), (9284, 14395), (9395, 14389), (9236, 14257), (9138, 14251), (9401, 14399)]
         : compromised: 0.6476, honest: 0.6491
Round 008: test acc mean=0.6563 ± 0.0082 | min=0.6283 max=0.6656
         : test loss mean=0.6216 ± 0.0049
         : individual accs = ['0.660835', '0.651282', '0.628277', '0.662165', '0.650021', '0.665553', '0.663809', '0.657667', '0.663215', '0.661796', '0.656581', '0.656202', '0.649366', '0.658474', '0.653911', '0.660090', '0.659115', '0.653854', '0.649218', '0.664907']
         : correct/total = [(9405, 14232), (9271, 14235), (8963, 14266), (9414, 14217), (9255, 14238), (9566, 14373), (9523, 14346), (9427, 14334), (9480, 14294), (9512, 14373), (9418, 14344), (9385, 14302), (9321, 14354), (9457, 14362), (9364, 14320), (9502, 14395), (9484, 14389), (9322, 14257), (9252, 14251), (9574, 14399)]
         : compromised: 0.6551, honest: 0.6569
Round 009: test acc mean=0.6576 ± 0.0099 | min=0.6237 max=0.6693
         : test loss mean=0.6176 ± 0.0066
         : individual accs = ['0.623665', '0.668774', '0.660592', '0.662517', '0.657887', '0.669311', '0.655235', '0.654318', '0.654960', '0.659640', '0.645984', '0.652636', '0.660582', '0.656246', '0.661592', '0.649045', '0.668844', '0.661570', '0.663743', '0.664421']
         : correct/total = [(8876, 14232), (9520, 14235), (9424, 14266), (9419, 14217), (9367, 14238), (9620, 14373), (9400, 14346), (9379, 14334), (9362, 14294), (9481, 14373), (9266, 14344), (9334, 14302), (9482, 14354), (9425, 14362), (9474, 14320), (9343, 14395), (9624, 14389), (9432, 14257), (9459, 14251), (9567, 14399)]
         : compromised: 0.6622, honest: 0.6556
Round 010: test acc mean=0.6701 ± 0.0068 | min=0.6509 max=0.6790
         : test loss mean=0.6066 ± 0.0058
         : individual accs = ['0.672218', '0.674535', '0.650918', '0.676233', '0.679028', '0.671885', '0.673289', '0.676085', '0.665944', '0.669589', '0.674219', '0.671305', '0.675491', '0.672399', '0.669483', '0.662452', '0.671833', '0.667532', '0.654972', '0.671783']
         : correct/total = [(9567, 14232), (9602, 14235), (9286, 14266), (9614, 14217), (9668, 14238), (9657, 14373), (9659, 14346), (9691, 14334), (9519, 14294), (9624, 14373), (9671, 14344), (9601, 14302), (9696, 14354), (9657, 14362), (9587, 14320), (9536, 14395), (9667, 14389), (9517, 14257), (9334, 14251), (9673, 14399)]
         : compromised: 0.6686, honest: 0.6707

=== FINAL RESULTS ===
Dataset: sent140, Nodes: 20, Graph: erdos, Aggregation: balance
Attack: krum, 30.0% compromised
Final accuracy - Compromised: 0.6686, Honest: 0.6707
Overall test accuracy: mean=0.6701 ± 0.0068

=== BALANCE SUMMARY ===
Node 0: acceptance=0.719
Node 1: acceptance=0.836
Node 2: acceptance=0.700
Node 3: acceptance=0.775
Node 4: acceptance=0.755
Node 5: acceptance=0.700
Node 6: acceptance=0.614
Node 7: acceptance=0.679
Node 8: acceptance=0.550
Node 9: acceptance=0.792
Node 10: acceptance=0.700
Node 11: acceptance=0.679
Node 12: acceptance=0.775
Node 13: acceptance=0.792
Node 14: acceptance=0.700
Node 15: acceptance=0.673
Node 16: acceptance=0.654
Node 17: acceptance=0.800
Node 18: acceptance=0.775
Node 19: acceptance=0.662

=== PARALLEL EXECUTION TIME (realistic for distributed system) ===
  COMMUNICATION (max across nodes):
    - Full model transfer: 0.000s (0.0%)
  COMPUTATION (max across nodes):
    - Filtering: 0.065s (80.4%)
    - Aggregation: 0.016s (19.6%)
  TOTALS:
    - Total computation: 0.081s (100.0%)
    - Total communication: 0.000s (0.0%)
    - Total parallel time: 0.081s

=== PER-NODE AVERAGE TIME ===
  - Filtering: 0.051s
  - Aggregation: 0.009s
  - Model transfer: 0.000s
  - Total per node: 0.060s

=== TOTAL COMPUTATIONAL WORK (sum across all nodes) ===
  - Total filtering: 1.015s
  - Total aggregation: 0.178s
  - Total model transfer: 0.000s
  - Grand total: 1.193s
  - Mean acceptance rate: 0.716

BALANCE Algorithm Properties:
  - Model dimension: 1,174,986
  - No compression: Full parameter comparison
  - Theoretical complexity: O(deg(i)×d)
  - Approach: Full parameter filtering + averaging
