Device: cuda
Seed: 987654321
Loading 1 LEAF Sent140 train files...
LEAF Sent140 train: 254555 users, 908652 samples
Building vocabulary (max_size=10000)...
Vocabulary size: 10000
Loading 1 LEAF Sent140 test files...
LEAF Sent140 test: 254555 users, 286281 samples
Found 254555 train users, 254555 test users, 254555 common users
User sample counts range: 494 (max) to 1 (min)
Distributed ALL 254555 users across 20 clients
Users per client: 12727 (with 15 clients getting +1 user)
Train partition sizes: [44353, 44290, 44657, 44907, 44696, 45843, 45801, 45619, 45069, 45639, 45821, 45311, 45779, 46056, 45625, 45984, 46428, 44737, 45540, 46497]
Test partition sizes: [14232, 14235, 14266, 14217, 14238, 14373, 14346, 14334, 14294, 14373, 14344, 14302, 14354, 14362, 14320, 14395, 14389, 14257, 14251, 14399]
  Client 0: 44353 train samples, 2 unique classes
  Client 1: 44290 train samples, 2 unique classes
  Client 2: 44657 train samples, 2 unique classes
  Client 3: 44907 train samples, 2 unique classes
  Client 4: 44696 train samples, 2 unique classes
  Client 5: 45843 train samples, 2 unique classes
  Client 6: 45801 train samples, 2 unique classes
  Client 7: 45619 train samples, 2 unique classes
  Client 8: 45069 train samples, 2 unique classes
  Client 9: 45639 train samples, 2 unique classes
  Client 10: 45821 train samples, 2 unique classes
  Client 11: 45311 train samples, 2 unique classes
  Client 12: 45779 train samples, 2 unique classes
  Client 13: 46056 train samples, 2 unique classes
  Client 14: 45625 train samples, 2 unique classes
  Client 15: 45984 train samples, 2 unique classes
  Client 16: 46428 train samples, 2 unique classes
  Client 17: 44737 train samples, 2 unique classes
  Client 18: 45540 train samples, 2 unique classes
  Client 19: 46497 train samples, 2 unique classes
Will sample 4500 samples per client per epoch
Graph: erdos, nodes: 20, edges: 99
Degree statistics: avg=9.90, min=7, max=14
Attack: Compromised 4/20 nodes: [5, 12, 13, 17]
Attack type: backdoor, lambda: 1.0
Backdoor target label: 1, trigger size: 3
Model variant: baseline
Model parameters: 1,174,986
Initial test acc across nodes: mean=0.4953 ± 0.0174
Backdoor attack: Created poisoned datasets for 4 compromised nodes
Round 001: test acc mean=0.5008 ± 0.0125 | min=0.4801 max=0.5365
         : test loss mean=1.4305 ± 0.8990
         : individual accs = ['0.521150', '0.512680', '0.513038', '0.487796', '0.536522', '0.499409', '0.480064', '0.496512', '0.500770', '0.495234', '0.498466', '0.496784', '0.507176', '0.497215', '0.488268', '0.501216', '0.503301', '0.493161', '0.486352', '0.500451']
         : correct/total = [(7417, 14232), (7298, 14235), (7319, 14266), (6935, 14217), (7639, 14238), (7178, 14373), (6887, 14346), (7117, 14334), (7158, 14294), (7118, 14373), (7150, 14344), (7105, 14302), (7280, 14354), (7141, 14362), (6992, 14320), (7215, 14395), (7242, 14389), (7031, 14257), (6931, 14251), (7206, 14399)]
         : compromised: 0.4992, honest: 0.5012
Round 002: test acc mean=0.4890 ± 0.0111 | min=0.4678 max=0.5147
         : test loss mean=1.3182 ± 0.5475
         : individual accs = ['0.482785', '0.495680', '0.514650', '0.473025', '0.492977', '0.483128', '0.498676', '0.491349', '0.503988', '0.495165', '0.492401', '0.502168', '0.467814', '0.479599', '0.484358', '0.486766', '0.490583', '0.487550', '0.471827', '0.485867']
         : correct/total = [(6871, 14232), (7056, 14235), (7342, 14266), (6725, 14217), (7019, 14238), (6944, 14373), (7154, 14346), (7043, 14334), (7204, 14294), (7117, 14373), (7063, 14344), (7182, 14302), (6715, 14354), (6888, 14362), (6936, 14320), (7007, 14395), (7059, 14389), (6951, 14257), (6724, 14251), (6996, 14399)]
         : compromised: 0.4795, honest: 0.4914
Round 003: test acc mean=0.5082 ± 0.0105 | min=0.4919 max=0.5390
         : test loss mean=1.2262 ± 0.6620
         : individual accs = ['0.507589', '0.507692', '0.528740', '0.539003', '0.501054', '0.491895', '0.497700', '0.506488', '0.498671', '0.505253', '0.507111', '0.506013', '0.514630', '0.508216', '0.500978', '0.510872', '0.506637', '0.505787', '0.519402', '0.500660']
         : correct/total = [(7224, 14232), (7227, 14235), (7543, 14266), (7663, 14217), (7134, 14238), (7070, 14373), (7140, 14346), (7260, 14334), (7128, 14294), (7262, 14373), (7274, 14344), (7237, 14302), (7387, 14354), (7299, 14362), (7174, 14320), (7354, 14395), (7290, 14389), (7211, 14257), (7402, 14251), (7209, 14399)]
         : compromised: 0.5051, honest: 0.5090
Round 004: test acc mean=0.5035 ± 0.0108 | min=0.4860 max=0.5184
         : test loss mean=1.1673 ± 0.5761
         : individual accs = ['0.503092', '0.492027', '0.516333', '0.494408', '0.518401', '0.487372', '0.512408', '0.510395', '0.487127', '0.509636', '0.498675', '0.518319', '0.515048', '0.513508', '0.509078', '0.503578', '0.500591', '0.486007', '0.504175', '0.488992']
         : correct/total = [(7160, 14232), (7004, 14235), (7366, 14266), (7029, 14217), (7381, 14238), (7005, 14373), (7351, 14346), (7316, 14334), (6963, 14294), (7325, 14373), (7153, 14344), (7413, 14302), (7393, 14354), (7375, 14362), (7290, 14320), (7249, 14395), (7203, 14389), (6929, 14257), (7185, 14251), (7041, 14399)]
         : compromised: 0.5005, honest: 0.5042
Round 005: test acc mean=0.5086 ± 0.0146 | min=0.4830 max=0.5429
         : test loss mean=0.7360 ± 0.1064
         : individual accs = ['0.492974', '0.483035', '0.527758', '0.542942', '0.494522', '0.515689', '0.500976', '0.514023', '0.499440', '0.524734', '0.520636', '0.493008', '0.500836', '0.490809', '0.515154', '0.497742', '0.515463', '0.510416', '0.510069', '0.520800']
         : correct/total = [(7016, 14232), (6876, 14235), (7529, 14266), (7719, 14217), (7041, 14238), (7412, 14373), (7187, 14346), (7368, 14334), (7139, 14294), (7542, 14373), (7468, 14344), (7051, 14302), (7189, 14354), (7049, 14362), (7377, 14320), (7165, 14395), (7417, 14389), (7277, 14257), (7269, 14251), (7499, 14399)]
         : compromised: 0.5044, honest: 0.5096
Round 006: test acc mean=0.5065 ± 0.0195 | min=0.4870 max=0.5800
         : test loss mean=1.1785 ± 0.6991
         : individual accs = ['0.507589', '0.504391', '0.486962', '0.534149', '0.511308', '0.490086', '0.502370', '0.503488', '0.495523', '0.579976', '0.494214', '0.510418', '0.500000', '0.494221', '0.497346', '0.508024', '0.499201', '0.498632', '0.511613', '0.500729']
         : correct/total = [(7224, 14232), (7180, 14235), (6947, 14266), (7594, 14217), (7280, 14238), (7044, 14373), (7207, 14346), (7217, 14334), (7083, 14294), (8336, 14373), (7089, 14344), (7300, 14302), (7177, 14354), (7098, 14362), (7122, 14320), (7313, 14395), (7183, 14389), (7109, 14257), (7291, 14251), (7210, 14399)]
         : compromised: 0.4957, honest: 0.5092
Round 007: test acc mean=0.5105 ± 0.0102 | min=0.4849 max=0.5278
         : test loss mean=0.7925 ± 0.1429
         : individual accs = ['0.514193', '0.514717', '0.522641', '0.484912', '0.520438', '0.509010', '0.505298', '0.511581', '0.497831', '0.527795', '0.514292', '0.511327', '0.496586', '0.507102', '0.510684', '0.499896', '0.518035', '0.504735', '0.526139', '0.512674']
         : correct/total = [(7318, 14232), (7327, 14235), (7456, 14266), (6894, 14217), (7410, 14238), (7316, 14373), (7249, 14346), (7333, 14334), (7116, 14294), (7586, 14373), (7377, 14344), (7313, 14302), (7128, 14354), (7283, 14362), (7313, 14320), (7196, 14395), (7454, 14389), (7196, 14257), (7498, 14251), (7382, 14399)]
         : compromised: 0.5044, honest: 0.5120
Round 008: test acc mean=0.4968 ± 0.0139 | min=0.4748 max=0.5381
         : test loss mean=1.4372 ± 0.9039
         : individual accs = ['0.474845', '0.484932', '0.538063', '0.486601', '0.494662', '0.496556', '0.500418', '0.493861', '0.500560', '0.510610', '0.498327', '0.493847', '0.480424', '0.518382', '0.494693', '0.498854', '0.493363', '0.498422', '0.476388', '0.501285']
         : correct/total = [(6758, 14232), (6903, 14235), (7676, 14266), (6918, 14217), (7043, 14238), (7137, 14373), (7179, 14346), (7079, 14334), (7155, 14294), (7339, 14373), (7148, 14344), (7063, 14302), (6896, 14354), (7445, 14362), (7084, 14320), (7181, 14395), (7099, 14389), (7106, 14257), (6789, 14251), (7218, 14399)]
         : compromised: 0.4984, honest: 0.4963
Round 009: test acc mean=0.5029 ± 0.0198 | min=0.4830 max=0.5578
         : test loss mean=0.7775 ± 0.1078
         : individual accs = ['0.492622', '0.483035', '0.557830', '0.484912', '0.494522', '0.495860', '0.499791', '0.492745', '0.496502', '0.536005', '0.498397', '0.493847', '0.507176', '0.549157', '0.492737', '0.497742', '0.492529', '0.495336', '0.495614', '0.501771']
         : correct/total = [(7011, 14232), (6876, 14235), (7958, 14266), (6894, 14217), (7041, 14238), (7127, 14373), (7170, 14346), (7063, 14334), (7097, 14294), (7704, 14373), (7149, 14344), (7063, 14302), (7280, 14354), (7887, 14362), (7056, 14320), (7165, 14395), (7087, 14389), (7062, 14257), (7063, 14251), (7225, 14399)]
         : compromised: 0.5119, honest: 0.5007
Round 010: test acc mean=0.4997 ± 0.0086 | min=0.4849 max=0.5134
         : test loss mean=1.0535 ± 0.5597
         : individual accs = ['0.492622', '0.487812', '0.486962', '0.484912', '0.494451', '0.511793', '0.503973', '0.489884', '0.506017', '0.495234', '0.510876', '0.499371', '0.503483', '0.506824', '0.499302', '0.500799', '0.498506', '0.513432', '0.495263', '0.512327']
         : correct/total = [(7011, 14232), (6944, 14235), (6947, 14266), (6894, 14217), (7040, 14238), (7356, 14373), (7230, 14346), (7022, 14334), (7233, 14294), (7118, 14373), (7328, 14344), (7142, 14302), (7227, 14354), (7279, 14362), (7150, 14320), (7209, 14395), (7173, 14389), (7320, 14257), (7058, 14251), (7377, 14399)]
         : compromised: 0.5089, honest: 0.4974

=== FINAL RESULTS ===
Dataset: sent140, Nodes: 20, Graph: erdos, Aggregation: d-fedavg
Attack: backdoor, 20.0% compromised
Final accuracy - Compromised: 0.5089, Honest: 0.4974
Overall test accuracy: mean=0.4997 ± 0.0086

=== BACKDOOR ATTACK SUCCESS RATE (ASR) ===
Target label: 1
Trigger size: 3x3
Overall ASR: 0.8467 ± 0.1399
Honest nodes ASR: 0.8370 ± 0.1436
Compromised nodes ASR: 0.8855 ± 0.1160
Note: Higher ASR indicates more successful backdoor attack
