Device: cuda
Seed: 987654321
Loading 1 LEAF Sent140 train files...
LEAF Sent140 train: 254555 users, 908652 samples
Building vocabulary (max_size=10000)...
Vocabulary size: 10000
Loading 1 LEAF Sent140 test files...
LEAF Sent140 test: 254555 users, 286281 samples
Found 254555 train users, 254555 test users, 254555 common users
User sample counts range: 494 (max) to 1 (min)
Distributed ALL 254555 users across 20 clients
Users per client: 12727 (with 15 clients getting +1 user)
Train partition sizes: [44353, 44290, 44657, 44907, 44696, 45843, 45801, 45619, 45069, 45639, 45821, 45311, 45779, 46056, 45625, 45984, 46428, 44737, 45540, 46497]
Test partition sizes: [14232, 14235, 14266, 14217, 14238, 14373, 14346, 14334, 14294, 14373, 14344, 14302, 14354, 14362, 14320, 14395, 14389, 14257, 14251, 14399]
  Client 0: 44353 train samples, 2 unique classes
  Client 1: 44290 train samples, 2 unique classes
  Client 2: 44657 train samples, 2 unique classes
  Client 3: 44907 train samples, 2 unique classes
  Client 4: 44696 train samples, 2 unique classes
  Client 5: 45843 train samples, 2 unique classes
  Client 6: 45801 train samples, 2 unique classes
  Client 7: 45619 train samples, 2 unique classes
  Client 8: 45069 train samples, 2 unique classes
  Client 9: 45639 train samples, 2 unique classes
  Client 10: 45821 train samples, 2 unique classes
  Client 11: 45311 train samples, 2 unique classes
  Client 12: 45779 train samples, 2 unique classes
  Client 13: 46056 train samples, 2 unique classes
  Client 14: 45625 train samples, 2 unique classes
  Client 15: 45984 train samples, 2 unique classes
  Client 16: 46428 train samples, 2 unique classes
  Client 17: 44737 train samples, 2 unique classes
  Client 18: 45540 train samples, 2 unique classes
  Client 19: 46497 train samples, 2 unique classes
Will sample 4500 samples per client per epoch
Graph: ring, nodes: 20, edges: 20
Degree statistics: avg=2.00, min=2, max=2
Attack: Compromised 16/20 nodes: [1, 2, 3, 5, 6, 8, 9, 10, 11, 12, 13, 14, 15, 17, 18, 19]
Attack type: gaussian, lambda: 1.0
Model variant: baseline
Model parameters: 1,174,986
BALANCE algorithm:
Balance Config: BALANCEConfig(gamma=2, kappa=1, alpha=0.5, min_neighbors=1)
  - Model dimension: 1,174,986 parameters
  - Complexity: O(N×d) = O(20×1,174,986)
Initial test acc across nodes: mean=0.4953 ± 0.0174
Round 001: test acc mean=0.5290 ± 0.0345 | min=0.4866 max=0.5938
         : test loss mean=778.7012 ± 728.2184
         : individual accs = ['0.486650', '0.593818', '0.510935', '0.565942', '0.504916', '0.555138', '0.590687', '0.507604', '0.550091', '0.503931', '0.503137', '0.501119', '0.505643', '0.508007', '0.505517', '0.546440', '0.492321', '0.561408', '0.501438', '0.584902']
         : correct/total = [(6926, 14232), (8453, 14235), (7289, 14266), (8046, 14217), (7189, 14238), (7979, 14373), (8474, 14346), (7276, 14334), (7863, 14294), (7243, 14373), (7217, 14344), (7167, 14302), (7258, 14354), (7296, 14362), (7239, 14320), (7866, 14395), (7084, 14389), (8004, 14257), (7146, 14251), (8422, 14399)]
         : compromised: 0.5368, honest: 0.4979
Round 002: test acc mean=0.4999 ± 0.0055 | min=0.4875 max=0.5119
         : test loss mean=830.4226 ± 344.6972
         : individual accs = ['0.504286', '0.500527', '0.491028', '0.511852', '0.502669', '0.499896', '0.504879', '0.504046', '0.491115', '0.497739', '0.501952', '0.498741', '0.502996', '0.501253', '0.501955', '0.502536', '0.487525', '0.493652', '0.503123', '0.496840']
         : correct/total = [(7177, 14232), (7125, 14235), (7005, 14266), (7277, 14217), (7157, 14238), (7185, 14373), (7243, 14346), (7225, 14334), (7020, 14294), (7154, 14373), (7200, 14344), (7133, 14302), (7220, 14354), (7199, 14362), (7188, 14320), (7234, 14395), (7015, 14389), (7038, 14257), (7170, 14251), (7154, 14399)]
         : compromised: 0.5000, honest: 0.4996
Round 003: test acc mean=0.5018 ± 0.0093 | min=0.4835 max=0.5225
         : test loss mean=722.3239 ± 647.1141
         : individual accs = ['0.495644', '0.510783', '0.498878', '0.505029', '0.496278', '0.494121', '0.500209', '0.498186', '0.500700', '0.483546', '0.500558', '0.499161', '0.513655', '0.494778', '0.520880', '0.522543', '0.498019', '0.510696', '0.498632', '0.494618']
         : correct/total = [(7054, 14232), (7271, 14235), (7117, 14266), (7180, 14217), (7066, 14238), (7102, 14373), (7176, 14346), (7141, 14334), (7157, 14294), (6950, 14373), (7180, 14344), (7139, 14302), (7373, 14354), (7106, 14362), (7459, 14320), (7522, 14395), (7166, 14389), (7281, 14257), (7106, 14251), (7122, 14399)]
         : compromised: 0.5030, honest: 0.4970
Round 004: test acc mean=0.5009 ± 0.0084 | min=0.4857 max=0.5166
         : test loss mean=566.3405 ± 326.5155
         : individual accs = ['0.494660', '0.485704', '0.516613', '0.496448', '0.514258', '0.500174', '0.500279', '0.507604', '0.500350', '0.496208', '0.496654', '0.503566', '0.509196', '0.495405', '0.489385', '0.507537', '0.497463', '0.488672', '0.502842', '0.514063']
         : correct/total = [(7040, 14232), (6914, 14235), (7370, 14266), (7058, 14217), (7322, 14238), (7189, 14373), (7177, 14346), (7276, 14334), (7152, 14294), (7132, 14373), (7124, 14344), (7202, 14302), (7309, 14354), (7115, 14362), (7008, 14320), (7306, 14395), (7158, 14389), (6967, 14257), (7166, 14251), (7402, 14399)]
         : compromised: 0.5002, honest: 0.5035
Round 005: test acc mean=0.5004 ± 0.0096 | min=0.4795 max=0.5202
         : test loss mean=515.8035 ± 176.2295
         : individual accs = ['0.503794', '0.520197', '0.479532', '0.519027', '0.501054', '0.496208', '0.500209', '0.485070', '0.506716', '0.507410', '0.499651', '0.495245', '0.501324', '0.495196', '0.500698', '0.499201', '0.488359', '0.504875', '0.508245', '0.496493']
         : correct/total = [(7170, 14232), (7405, 14235), (6841, 14266), (7379, 14217), (7134, 14238), (7132, 14373), (7176, 14346), (6953, 14334), (7243, 14294), (7293, 14373), (7167, 14344), (7083, 14302), (7196, 14354), (7112, 14362), (7170, 14320), (7186, 14395), (7027, 14389), (7198, 14257), (7243, 14251), (7149, 14399)]
         : compromised: 0.5019, honest: 0.4946
Round 006: test acc mean=0.5002 ± 0.0078 | min=0.4851 max=0.5155
         : test loss mean=695.5744 ± 592.4872
         : individual accs = ['0.489671', '0.485072', '0.499019', '0.496659', '0.489746', '0.509706', '0.500349', '0.504116', '0.500490', '0.504696', '0.499721', '0.485317', '0.503762', '0.503830', '0.507123', '0.508093', '0.515533', '0.504173', '0.497509', '0.498437']
         : correct/total = [(6969, 14232), (6905, 14235), (7119, 14266), (7061, 14217), (6973, 14238), (7326, 14373), (7178, 14346), (7226, 14334), (7154, 14294), (7254, 14373), (7168, 14344), (6941, 14302), (7231, 14354), (7236, 14362), (7262, 14320), (7314, 14395), (7418, 14389), (7188, 14257), (7090, 14251), (7177, 14399)]
         : compromised: 0.5002, honest: 0.4998
Round 007: test acc mean=0.4998 ± 0.0095 | min=0.4810 max=0.5205
         : test loss mean=721.3438 ± 506.6272
         : individual accs = ['0.506394', '0.509027', '0.497196', '0.497573', '0.481037', '0.515689', '0.499442', '0.483187', '0.494543', '0.503931', '0.497421', '0.504055', '0.496377', '0.501950', '0.499302', '0.520458', '0.486135', '0.495616', '0.508035', '0.498785']
         : correct/total = [(7207, 14232), (7246, 14235), (7093, 14266), (7074, 14217), (6849, 14238), (7412, 14373), (7165, 14346), (6926, 14334), (7069, 14294), (7243, 14373), (7135, 14344), (7209, 14302), (7125, 14354), (7209, 14362), (7150, 14320), (7492, 14395), (6995, 14389), (7066, 14257), (7240, 14251), (7182, 14399)]
         : compromised: 0.5025, honest: 0.4892
Round 008: test acc mean=0.4994 ± 0.0077 | min=0.4761 max=0.5092
         : test loss mean=658.1169 ± 442.7537
         : individual accs = ['0.504075', '0.508465', '0.503435', '0.487937', '0.497401', '0.495930', '0.493657', '0.493861', '0.497551', '0.501009', '0.494144', '0.503916', '0.509196', '0.507450', '0.506494', '0.498854', '0.476058', '0.500596', '0.504245', '0.504618']
         : correct/total = [(7174, 14232), (7238, 14235), (7182, 14266), (6937, 14217), (7082, 14238), (7128, 14373), (7082, 14346), (7079, 14334), (7112, 14294), (7201, 14373), (7088, 14344), (7207, 14302), (7309, 14354), (7288, 14362), (7253, 14320), (7181, 14395), (6850, 14389), (7137, 14257), (7186, 14251), (7266, 14399)]
         : compromised: 0.5011, honest: 0.4928
Round 009: test acc mean=0.5018 ± 0.0088 | min=0.4915 max=0.5262
         : test loss mean=732.8641 ± 485.3936
         : individual accs = ['0.502600', '0.491465', '0.516963', '0.498206', '0.492766', '0.492312', '0.502440', '0.497000', '0.505457', '0.503444', '0.501255', '0.498741', '0.491501', '0.505988', '0.513687', '0.496283', '0.526235', '0.493302', '0.501509', '0.503854']
         : correct/total = [(7153, 14232), (6996, 14235), (7375, 14266), (7083, 14217), (7016, 14238), (7076, 14373), (7208, 14346), (7124, 14334), (7225, 14294), (7236, 14373), (7190, 14344), (7133, 14302), (7055, 14354), (7267, 14362), (7356, 14320), (7144, 14395), (7572, 14389), (7033, 14257), (7147, 14251), (7255, 14399)]
         : compromised: 0.5010, honest: 0.5047
Round 010: test acc mean=0.4995 ± 0.0077 | min=0.4813 max=0.5146
         : test loss mean=773.9636 ± 534.4861
         : individual accs = ['0.500281', '0.499192', '0.497126', '0.514595', '0.494030', '0.506505', '0.500488', '0.504395', '0.499510', '0.496765', '0.506553', '0.501328', '0.495750', '0.496310', '0.481285', '0.513303', '0.493641', '0.497019', '0.506140', '0.486562']
         : correct/total = [(7120, 14232), (7106, 14235), (7092, 14266), (7316, 14217), (7034, 14238), (7280, 14373), (7180, 14346), (7230, 14334), (7140, 14294), (7140, 14373), (7266, 14344), (7170, 14302), (7116, 14354), (7128, 14362), (6892, 14320), (7389, 14395), (7103, 14389), (7086, 14257), (7213, 14251), (7006, 14399)]
         : compromised: 0.4999, honest: 0.4981

=== FINAL RESULTS ===
Dataset: sent140, Nodes: 20, Graph: ring, Aggregation: balance
Attack: gaussian, 80.0% compromised
Final accuracy - Compromised: 0.4999, Honest: 0.4981
Overall test accuracy: mean=0.4995 ± 0.0077

=== BALANCE SUMMARY ===
Node 0: acceptance=0.500
Node 1: acceptance=0.550
Node 2: acceptance=0.500
Node 3: acceptance=0.250
Node 4: acceptance=0.500
Node 5: acceptance=0.600
Node 6: acceptance=0.250
Node 7: acceptance=0.500
Node 8: acceptance=0.450
Node 9: acceptance=0.500
Node 10: acceptance=0.500
Node 11: acceptance=0.500
Node 12: acceptance=0.500
Node 13: acceptance=0.500
Node 14: acceptance=0.500
Node 15: acceptance=0.500
Node 16: acceptance=0.500
Node 17: acceptance=0.600
Node 18: acceptance=0.500
Node 19: acceptance=0.600

=== PARALLEL EXECUTION TIME (realistic for distributed system) ===
  COMMUNICATION (max across nodes):
    - Full model transfer: 0.000s (0.1%)
  COMPUTATION (max across nodes):
    - Filtering: 0.020s (63.1%)
    - Aggregation: 0.011s (36.9%)
  TOTALS:
    - Total computation: 0.031s (99.9%)
    - Total communication: 0.000s (0.1%)
    - Total parallel time: 0.031s

=== PER-NODE AVERAGE TIME ===
  - Filtering: 0.011s
  - Aggregation: 0.005s
  - Model transfer: 0.000s
  - Total per node: 0.017s

=== TOTAL COMPUTATIONAL WORK (sum across all nodes) ===
  - Total filtering: 0.228s
  - Total aggregation: 0.105s
  - Total model transfer: 0.000s
  - Grand total: 0.334s
  - Mean acceptance rate: 0.490

BALANCE Algorithm Properties:
  - Model dimension: 1,174,986
  - No compression: Full parameter comparison
  - Theoretical complexity: O(deg(i)×d)
  - Approach: Full parameter filtering + averaging
