Device: cuda
Seed: 987654321
Loading 1 LEAF Sent140 train files...
LEAF Sent140 train: 254555 users, 908652 samples
Building vocabulary (max_size=10000)...
Vocabulary size: 10000
Loading 1 LEAF Sent140 test files...
LEAF Sent140 test: 254555 users, 286281 samples
Found 254555 train users, 254555 test users, 254555 common users
User sample counts range: 494 (max) to 1 (min)
Distributed ALL 254555 users across 20 clients
Users per client: 12727 (with 15 clients getting +1 user)
Train partition sizes: [44353, 44290, 44657, 44907, 44696, 45843, 45801, 45619, 45069, 45639, 45821, 45311, 45779, 46056, 45625, 45984, 46428, 44737, 45540, 46497]
Test partition sizes: [14232, 14235, 14266, 14217, 14238, 14373, 14346, 14334, 14294, 14373, 14344, 14302, 14354, 14362, 14320, 14395, 14389, 14257, 14251, 14399]
  Client 0: 44353 train samples, 2 unique classes
  Client 1: 44290 train samples, 2 unique classes
  Client 2: 44657 train samples, 2 unique classes
  Client 3: 44907 train samples, 2 unique classes
  Client 4: 44696 train samples, 2 unique classes
  Client 5: 45843 train samples, 2 unique classes
  Client 6: 45801 train samples, 2 unique classes
  Client 7: 45619 train samples, 2 unique classes
  Client 8: 45069 train samples, 2 unique classes
  Client 9: 45639 train samples, 2 unique classes
  Client 10: 45821 train samples, 2 unique classes
  Client 11: 45311 train samples, 2 unique classes
  Client 12: 45779 train samples, 2 unique classes
  Client 13: 46056 train samples, 2 unique classes
  Client 14: 45625 train samples, 2 unique classes
  Client 15: 45984 train samples, 2 unique classes
  Client 16: 46428 train samples, 2 unique classes
  Client 17: 44737 train samples, 2 unique classes
  Client 18: 45540 train samples, 2 unique classes
  Client 19: 46497 train samples, 2 unique classes
Will sample 4500 samples per client per epoch
Graph: erdos, nodes: 20, edges: 99
Degree statistics: avg=9.90, min=7, max=14
Attack: Compromised 2/20 nodes: [5, 13]
Attack type: backdoor, lambda: 1.0
Backdoor target label: 1, trigger size: 3
Model variant: baseline
Model parameters: 1,174,986
Initial test acc across nodes: mean=0.4953 ± 0.0174
Backdoor attack: Created poisoned datasets for 2 compromised nodes
Round 001: test acc mean=0.5044 ± 0.0107 | min=0.4888 max=0.5356
         : test loss mean=0.8006 ± 0.2500
         : individual accs = ['0.510259', '0.514366', '0.513038', '0.512555', '0.500281', '0.490851', '0.535620', '0.500070', '0.490486', '0.495234', '0.503974', '0.506922', '0.505155', '0.492619', '0.504818', '0.488781', '0.506220', '0.514765', '0.505859', '0.496632']
         : correct/total = [(7262, 14232), (7322, 14235), (7319, 14266), (7287, 14217), (7123, 14238), (7055, 14373), (7684, 14346), (7168, 14334), (7011, 14294), (7118, 14373), (7229, 14344), (7250, 14302), (7251, 14354), (7075, 14362), (7229, 14320), (7036, 14395), (7284, 14389), (7339, 14257), (7209, 14251), (7151, 14399)]
         : compromised: 0.4917, honest: 0.5058
Round 002: test acc mean=0.5057 ± 0.0137 | min=0.4832 max=0.5355
         : test loss mean=0.7861 ± 0.2340
         : individual accs = ['0.508010', '0.509800', '0.486962', '0.517338', '0.508428', '0.503235', '0.484177', '0.535510', '0.505947', '0.495234', '0.498397', '0.492868', '0.529190', '0.511767', '0.508520', '0.515109', '0.492529', '0.507540', '0.519613', '0.483228']
         : correct/total = [(7230, 14232), (7257, 14235), (6947, 14266), (7355, 14217), (7239, 14238), (7233, 14373), (6946, 14346), (7676, 14334), (7232, 14294), (7118, 14373), (7149, 14344), (7049, 14302), (7596, 14354), (7350, 14362), (7282, 14320), (7415, 14395), (7087, 14389), (7236, 14257), (7405, 14251), (6958, 14399)]
         : compromised: 0.5075, honest: 0.5055
Round 003: test acc mean=0.5049 ± 0.0221 | min=0.4753 max=0.5757
         : test loss mean=0.7225 ± 0.0694
         : individual accs = ['0.497470', '0.506006', '0.575704', '0.482732', '0.494381', '0.508384', '0.494493', '0.492745', '0.498531', '0.550337', '0.522727', '0.475318', '0.500348', '0.500905', '0.492807', '0.497881', '0.511710', '0.498983', '0.505719', '0.490937']
         : correct/total = [(7080, 14232), (7203, 14235), (8213, 14266), (6863, 14217), (7039, 14238), (7307, 14373), (7094, 14346), (7063, 14334), (7126, 14294), (7910, 14373), (7498, 14344), (6798, 14302), (7182, 14354), (7194, 14362), (7057, 14320), (7167, 14395), (7363, 14389), (7114, 14257), (7207, 14251), (7069, 14399)]
         : compromised: 0.5046, honest: 0.5049
Round 004: test acc mean=0.5072 ± 0.0286 | min=0.4830 max=0.6192
         : test loss mean=0.7863 ± 0.1426
         : individual accs = ['0.492622', '0.483035', '0.541007', '0.484561', '0.494592', '0.495999', '0.499721', '0.492814', '0.511403', '0.518055', '0.512758', '0.496015', '0.502856', '0.511628', '0.493575', '0.497812', '0.619154', '0.495616', '0.495614', '0.504341']
         : correct/total = [(7011, 14232), (6876, 14235), (7718, 14266), (6889, 14217), (7042, 14238), (7129, 14373), (7169, 14346), (7064, 14334), (7310, 14294), (7446, 14373), (7355, 14344), (7094, 14302), (7218, 14354), (7348, 14362), (7068, 14320), (7166, 14395), (8909, 14389), (7066, 14257), (7063, 14251), (7262, 14399)]
         : compromised: 0.5038, honest: 0.5075
Round 005: test acc mean=0.5320 ± 0.0369 | min=0.4905 max=0.6154
         : test loss mean=0.6992 ± 0.0329
         : individual accs = ['0.503654', '0.490481', '0.599047', '0.544489', '0.528445', '0.504209', '0.527882', '0.496163', '0.506366', '0.589856', '0.588539', '0.517270', '0.500697', '0.493037', '0.538827', '0.545259', '0.615401', '0.523602', '0.505158', '0.521286']
         : correct/total = [(7168, 14232), (6982, 14235), (8546, 14266), (7741, 14217), (7524, 14238), (7247, 14373), (7573, 14346), (7112, 14334), (7238, 14294), (8478, 14373), (8442, 14344), (7398, 14302), (7187, 14354), (7081, 14362), (7716, 14320), (7849, 14395), (8855, 14389), (7465, 14257), (7199, 14251), (7506, 14399)]
         : compromised: 0.4986, honest: 0.5357
Round 006: test acc mean=0.5317 ± 0.0458 | min=0.5001 max=0.6370
         : test loss mean=0.9738 ± 0.4873
         : individual accs = ['0.507378', '0.518300', '0.593509', '0.515088', '0.505549', '0.519029', '0.500139', '0.507465', '0.502938', '0.628122', '0.625000', '0.506153', '0.520830', '0.502298', '0.507472', '0.502258', '0.637014', '0.504735', '0.529366', '0.501979']
         : correct/total = [(7221, 14232), (7378, 14235), (8467, 14266), (7323, 14217), (7198, 14238), (7460, 14373), (7175, 14346), (7274, 14334), (7189, 14294), (9028, 14373), (8965, 14344), (7239, 14302), (7476, 14354), (7214, 14362), (7267, 14320), (7230, 14395), (9166, 14389), (7196, 14257), (7544, 14251), (7228, 14399)]
         : compromised: 0.5107, honest: 0.5341
Round 007: test acc mean=0.5210 ± 0.0363 | min=0.4923 max=0.6267
         : test loss mean=0.9670 ± 0.4508
         : individual accs = ['0.507378', '0.516965', '0.586149', '0.514877', '0.505478', '0.503861', '0.499721', '0.507255', '0.494893', '0.570445', '0.576966', '0.505314', '0.496447', '0.492341', '0.506704', '0.502327', '0.626659', '0.504664', '0.504105', '0.498090']
         : correct/total = [(7221, 14232), (7359, 14235), (8362, 14266), (7320, 14217), (7197, 14238), (7242, 14373), (7169, 14346), (7271, 14334), (7074, 14294), (8199, 14373), (8276, 14344), (7227, 14302), (7126, 14354), (7071, 14362), (7256, 14320), (7231, 14395), (9017, 14389), (7195, 14257), (7184, 14251), (7172, 14399)]
         : compromised: 0.4981, honest: 0.5236
Round 008: test acc mean=0.5489 ± 0.0401 | min=0.5034 max=0.6314
         : test loss mean=0.8325 ± 0.2629
         : individual accs = ['0.512507', '0.543379', '0.618043', '0.541746', '0.547408', '0.503374', '0.552210', '0.541091', '0.503498', '0.625687', '0.613218', '0.559852', '0.510729', '0.514204', '0.544693', '0.539007', '0.631385', '0.539033', '0.512034', '0.524064']
         : correct/total = [(7294, 14232), (7735, 14235), (8817, 14266), (7702, 14217), (7794, 14238), (7235, 14373), (7922, 14346), (7756, 14334), (7197, 14294), (8993, 14373), (8796, 14344), (8007, 14302), (7331, 14354), (7385, 14362), (7800, 14320), (7759, 14395), (9085, 14389), (7685, 14257), (7297, 14251), (7546, 14399)]
         : compromised: 0.5088, honest: 0.5533
Round 009: test acc mean=0.5426 ± 0.0427 | min=0.4906 max=0.6378
         : test loss mean=0.8837 ± 0.4144
         : individual accs = ['0.564784', '0.546400', '0.602411', '0.503130', '0.518542', '0.556808', '0.491147', '0.545835', '0.494893', '0.600501', '0.594743', '0.490631', '0.573150', '0.535093', '0.506844', '0.510594', '0.637848', '0.513011', '0.570767', '0.495382']
         : correct/total = [(8038, 14232), (7778, 14235), (8594, 14266), (7153, 14217), (7383, 14238), (8003, 14373), (7046, 14346), (7824, 14334), (7074, 14294), (8631, 14373), (8531, 14344), (7017, 14302), (8227, 14354), (7685, 14362), (7258, 14320), (7350, 14395), (9178, 14389), (7314, 14257), (8134, 14251), (7133, 14399)]
         : compromised: 0.5460, honest: 0.5423
Round 010: test acc mean=0.5519 ± 0.0332 | min=0.5048 max=0.6160
         : test loss mean=0.7673 ± 0.0586
         : individual accs = ['0.568367', '0.574640', '0.574513', '0.547654', '0.557030', '0.511863', '0.507040', '0.577648', '0.518609', '0.604536', '0.609523', '0.509859', '0.539362', '0.528130', '0.537779', '0.561723', '0.615957', '0.539945', '0.549786', '0.504827']
         : correct/total = [(8089, 14232), (8180, 14235), (8196, 14266), (7786, 14217), (7931, 14238), (7357, 14373), (7274, 14346), (8280, 14334), (7413, 14294), (8689, 14373), (8743, 14344), (7292, 14302), (7742, 14354), (7585, 14362), (7701, 14320), (8086, 14395), (8863, 14389), (7698, 14257), (7835, 14251), (7269, 14399)]
         : compromised: 0.5200, honest: 0.5555

=== FINAL RESULTS ===
Dataset: sent140, Nodes: 20, Graph: erdos, Aggregation: d-fedavg
Attack: backdoor, 10.0% compromised
Final accuracy - Compromised: 0.5200, Honest: 0.5555
Overall test accuracy: mean=0.5519 ± 0.0332

=== BACKDOOR ATTACK SUCCESS RATE (ASR) ===
Target label: 1
Trigger size: 3x3
Overall ASR: 0.4635 ± 0.1876
Honest nodes ASR: 0.4709 ± 0.1933
Compromised nodes ASR: 0.3973 ± 0.1025
Note: Higher ASR indicates more successful backdoor attack
