Device: cuda
Seed: 987654321
Loading 1 LEAF Sent140 train files...
LEAF Sent140 train: 254555 users, 908652 samples
Building vocabulary (max_size=10000)...
Vocabulary size: 10000
Loading 1 LEAF Sent140 test files...
LEAF Sent140 test: 254555 users, 286281 samples
Found 254555 train users, 254555 test users, 254555 common users
User sample counts range: 494 (max) to 1 (min)
Distributed ALL 254555 users across 20 clients
Users per client: 12727 (with 15 clients getting +1 user)
Train partition sizes: [44353, 44290, 44657, 44907, 44696, 45843, 45801, 45619, 45069, 45639, 45821, 45311, 45779, 46056, 45625, 45984, 46428, 44737, 45540, 46497]
Test partition sizes: [14232, 14235, 14266, 14217, 14238, 14373, 14346, 14334, 14294, 14373, 14344, 14302, 14354, 14362, 14320, 14395, 14389, 14257, 14251, 14399]
  Client 0: 44353 train samples, 2 unique classes
  Client 1: 44290 train samples, 2 unique classes
  Client 2: 44657 train samples, 2 unique classes
  Client 3: 44907 train samples, 2 unique classes
  Client 4: 44696 train samples, 2 unique classes
  Client 5: 45843 train samples, 2 unique classes
  Client 6: 45801 train samples, 2 unique classes
  Client 7: 45619 train samples, 2 unique classes
  Client 8: 45069 train samples, 2 unique classes
  Client 9: 45639 train samples, 2 unique classes
  Client 10: 45821 train samples, 2 unique classes
  Client 11: 45311 train samples, 2 unique classes
  Client 12: 45779 train samples, 2 unique classes
  Client 13: 46056 train samples, 2 unique classes
  Client 14: 45625 train samples, 2 unique classes
  Client 15: 45984 train samples, 2 unique classes
  Client 16: 46428 train samples, 2 unique classes
  Client 17: 44737 train samples, 2 unique classes
  Client 18: 45540 train samples, 2 unique classes
  Client 19: 46497 train samples, 2 unique classes
Will sample 4500 samples per client per epoch
Graph: fully, nodes: 20, edges: 190
Degree statistics: avg=19.00, min=19, max=19
Attack: Compromised 8/20 nodes: [1, 5, 11, 12, 13, 14, 17, 18]
Attack type: backdoor, lambda: 1.0
Backdoor target label: 1, trigger size: 3
Model variant: baseline
Model parameters: 1,174,986
Initial test acc across nodes: mean=0.4953 ± 0.0174
Backdoor attack: Created poisoned datasets for 8 compromised nodes
Round 001: test acc mean=0.4998 ± 0.0073 | min=0.4858 max=0.5159
         : test loss mean=3.9637 ± 1.1056
         : individual accs = ['0.511383', '0.485774', '0.490046', '0.486390', '0.505970', '0.495721', '0.497351', '0.502930', '0.500140', '0.506923', '0.499303', '0.503636', '0.497910', '0.498747', '0.494972', '0.503230', '0.515950', '0.495827', '0.501158', '0.501840']
         : correct/total = [(7278, 14232), (6915, 14235), (6991, 14266), (6915, 14217), (7204, 14238), (7125, 14373), (7135, 14346), (7209, 14334), (7149, 14294), (7286, 14373), (7162, 14344), (7203, 14302), (7147, 14354), (7163, 14362), (7088, 14320), (7244, 14395), (7424, 14389), (7069, 14257), (7142, 14251), (7226, 14399)]
         : compromised: 0.4967, honest: 0.5018
Round 002: test acc mean=0.4937 ± 0.0038 | min=0.4867 max=0.5002
         : test loss mean=3.5225 ± 0.0269
         : individual accs = ['0.494379', '0.491324', '0.487102', '0.486671', '0.499930', '0.490642', '0.497003', '0.492186', '0.495593', '0.491060', '0.493516', '0.500210', '0.496029', '0.498607', '0.492179', '0.493574', '0.492668', '0.490145', '0.491474', '0.498715']
         : correct/total = [(7036, 14232), (6994, 14235), (6949, 14266), (6919, 14217), (7118, 14238), (7052, 14373), (7130, 14346), (7055, 14334), (7084, 14294), (7058, 14373), (7079, 14344), (7154, 14302), (7120, 14354), (7161, 14362), (7048, 14320), (7105, 14395), (7089, 14389), (6988, 14257), (7004, 14251), (7181, 14399)]
         : compromised: 0.4938, honest: 0.4935
Round 003: test acc mean=0.5022 ± 0.0044 | min=0.4967 max=0.5124
         : test loss mean=1.1786 ± 0.0195
         : individual accs = ['0.497119', '0.498138', '0.497547', '0.496800', '0.501826', '0.506018', '0.500627', '0.501884', '0.499860', '0.497321', '0.512409', '0.502517', '0.506200', '0.505361', '0.496718', '0.501077', '0.510251', '0.502841', '0.505298', '0.504063']
         : correct/total = [(7075, 14232), (7091, 14235), (7098, 14266), (7063, 14217), (7145, 14238), (7273, 14373), (7182, 14346), (7194, 14334), (7145, 14294), (7148, 14373), (7350, 14344), (7187, 14302), (7266, 14354), (7258, 14362), (7113, 14320), (7213, 14395), (7342, 14389), (7169, 14257), (7201, 14251), (7258, 14399)]
         : compromised: 0.5029, honest: 0.5017
Round 004: test acc mean=0.5008 ± 0.0037 | min=0.4924 max=0.5075
         : test loss mean=1.2307 ± 0.0136
         : individual accs = ['0.494660', '0.500808', '0.502804', '0.497995', '0.505829', '0.501078', '0.497560', '0.496302', '0.502868', '0.505392', '0.499582', '0.499371', '0.502996', '0.507450', '0.492388', '0.501771', '0.504761', '0.501718', '0.500596', '0.499826']
         : correct/total = [(7040, 14232), (7129, 14235), (7173, 14266), (7080, 14217), (7202, 14238), (7202, 14373), (7138, 14346), (7114, 14334), (7188, 14294), (7264, 14373), (7166, 14344), (7142, 14302), (7220, 14354), (7288, 14362), (7051, 14320), (7223, 14395), (7263, 14389), (7153, 14257), (7134, 14251), (7197, 14399)]
         : compromised: 0.5008, honest: 0.5008
Round 005: test acc mean=0.5050 ± 0.0055 | min=0.4928 max=0.5168
         : test loss mean=6.7349 ± 0.0872
         : individual accs = ['0.507729', '0.516825', '0.513038', '0.515088', '0.505127', '0.503861', '0.500139', '0.507395', '0.501819', '0.504766', '0.501603', '0.505803', '0.496935', '0.492759', '0.507472', '0.501910', '0.507123', '0.504524', '0.504035', '0.501979']
         : correct/total = [(7226, 14232), (7357, 14235), (7319, 14266), (7323, 14217), (7192, 14238), (7242, 14373), (7175, 14346), (7273, 14334), (7173, 14294), (7255, 14373), (7195, 14344), (7234, 14302), (7133, 14354), (7077, 14362), (7267, 14320), (7225, 14395), (7297, 14389), (7193, 14257), (7183, 14251), (7228, 14399)]
         : compromised: 0.5040, honest: 0.5056
Round 006: test acc mean=0.5051 ± 0.0055 | min=0.4932 max=0.5169
         : test loss mean=4.2321 ± 0.0643
         : individual accs = ['0.507378', '0.516895', '0.513388', '0.515158', '0.505549', '0.503583', '0.499651', '0.507395', '0.501959', '0.504766', '0.501394', '0.506433', '0.497213', '0.493246', '0.507682', '0.502536', '0.507540', '0.504384', '0.504526', '0.501910']
         : correct/total = [(7221, 14232), (7358, 14235), (7324, 14266), (7324, 14217), (7198, 14238), (7238, 14373), (7168, 14346), (7273, 14334), (7175, 14294), (7255, 14373), (7192, 14344), (7243, 14302), (7137, 14354), (7084, 14362), (7270, 14320), (7234, 14395), (7303, 14389), (7191, 14257), (7190, 14251), (7227, 14399)]
         : compromised: 0.5042, honest: 0.5057
Round 007: test acc mean=0.5070 ± 0.0056 | min=0.4953 max=0.5191
         : test loss mean=1.6088 ± 0.0279
         : individual accs = ['0.508010', '0.519073', '0.511987', '0.518604', '0.507515', '0.507618', '0.503973', '0.506488', '0.500630', '0.506157', '0.502998', '0.509929', '0.500000', '0.495335', '0.510126', '0.503578', '0.509903', '0.508733', '0.506701', '0.502465']
         : correct/total = [(7230, 14232), (7389, 14235), (7304, 14266), (7373, 14217), (7226, 14238), (7296, 14373), (7230, 14346), (7260, 14334), (7156, 14294), (7275, 14373), (7215, 14344), (7293, 14302), (7177, 14354), (7114, 14362), (7305, 14320), (7249, 14395), (7337, 14389), (7253, 14257), (7221, 14251), (7235, 14399)]
         : compromised: 0.5072, honest: 0.5069
Round 008: test acc mean=0.5013 ± 0.0055 | min=0.4909 max=0.5142
         : test loss mean=1.3393 ± 0.0155
         : individual accs = ['0.497049', '0.492659', '0.493551', '0.490891', '0.502177', '0.504140', '0.505437', '0.498395', '0.506646', '0.499130', '0.502858', '0.495665', '0.505643', '0.514204', '0.498045', '0.506217', '0.501633', '0.503893', '0.502351', '0.505868']
         : correct/total = [(7074, 14232), (7013, 14235), (7041, 14266), (6979, 14217), (7150, 14238), (7246, 14373), (7251, 14346), (7144, 14334), (7242, 14294), (7174, 14373), (7213, 14344), (7089, 14302), (7258, 14354), (7385, 14362), (7132, 14320), (7287, 14395), (7218, 14389), (7184, 14257), (7159, 14251), (7284, 14399)]
         : compromised: 0.5021, honest: 0.5008
Round 009: test acc mean=0.4949 ± 0.0054 | min=0.4830 max=0.5068
         : test loss mean=1.9355 ± 0.0213
         : individual accs = ['0.492622', '0.483035', '0.486962', '0.484912', '0.494522', '0.495860', '0.499721', '0.492675', '0.498111', '0.495095', '0.498397', '0.493847', '0.502787', '0.506754', '0.492598', '0.497673', '0.492529', '0.495406', '0.495614', '0.498090']
         : correct/total = [(7011, 14232), (6876, 14235), (6947, 14266), (6894, 14217), (7041, 14238), (7127, 14373), (7169, 14346), (7062, 14334), (7120, 14294), (7116, 14373), (7149, 14344), (7063, 14302), (7217, 14354), (7278, 14362), (7054, 14320), (7164, 14395), (7087, 14389), (7063, 14257), (7063, 14251), (7172, 14399)]
         : compromised: 0.4957, honest: 0.4943
Round 010: test acc mean=0.4949 ± 0.0055 | min=0.4830 max=0.5068
         : test loss mean=0.8146 ± 0.0054
         : individual accs = ['0.492622', '0.483035', '0.486962', '0.484912', '0.494522', '0.495860', '0.499791', '0.492745', '0.498181', '0.495234', '0.498397', '0.493847', '0.502856', '0.506824', '0.492598', '0.497742', '0.492529', '0.495336', '0.495614', '0.498090']
         : correct/total = [(7011, 14232), (6876, 14235), (6947, 14266), (6894, 14217), (7041, 14238), (7127, 14373), (7170, 14346), (7063, 14334), (7121, 14294), (7118, 14373), (7149, 14344), (7063, 14302), (7218, 14354), (7279, 14362), (7054, 14320), (7165, 14395), (7087, 14389), (7062, 14257), (7063, 14251), (7172, 14399)]
         : compromised: 0.4957, honest: 0.4943

=== FINAL RESULTS ===
Dataset: sent140, Nodes: 20, Graph: fully, Aggregation: d-fedavg
Attack: backdoor, 40.0% compromised
Final accuracy - Compromised: 0.4957, Honest: 0.4943
Overall test accuracy: mean=0.4949 ± 0.0055

=== BACKDOOR ATTACK SUCCESS RATE (ASR) ===
Target label: 1
Trigger size: 3x3
Overall ASR: 1.0000 ± 0.0000
Honest nodes ASR: 1.0000 ± 0.0000
Compromised nodes ASR: 1.0000 ± 0.0000
Note: Higher ASR indicates more successful backdoor attack
