Device: cuda
Seed: 987654321
Loading 1 LEAF Sent140 train files...
LEAF Sent140 train: 254555 users, 908652 samples
Building vocabulary (max_size=10000)...
Vocabulary size: 10000
Loading 1 LEAF Sent140 test files...
LEAF Sent140 test: 254555 users, 286281 samples
Found 254555 train users, 254555 test users, 254555 common users
User sample counts range: 494 (max) to 1 (min)
Distributed ALL 254555 users across 20 clients
Users per client: 12727 (with 15 clients getting +1 user)
Train partition sizes: [44353, 44290, 44657, 44907, 44696, 45843, 45801, 45619, 45069, 45639, 45821, 45311, 45779, 46056, 45625, 45984, 46428, 44737, 45540, 46497]
Test partition sizes: [14232, 14235, 14266, 14217, 14238, 14373, 14346, 14334, 14294, 14373, 14344, 14302, 14354, 14362, 14320, 14395, 14389, 14257, 14251, 14399]
  Client 0: 44353 train samples, 2 unique classes
  Client 1: 44290 train samples, 2 unique classes
  Client 2: 44657 train samples, 2 unique classes
  Client 3: 44907 train samples, 2 unique classes
  Client 4: 44696 train samples, 2 unique classes
  Client 5: 45843 train samples, 2 unique classes
  Client 6: 45801 train samples, 2 unique classes
  Client 7: 45619 train samples, 2 unique classes
  Client 8: 45069 train samples, 2 unique classes
  Client 9: 45639 train samples, 2 unique classes
  Client 10: 45821 train samples, 2 unique classes
  Client 11: 45311 train samples, 2 unique classes
  Client 12: 45779 train samples, 2 unique classes
  Client 13: 46056 train samples, 2 unique classes
  Client 14: 45625 train samples, 2 unique classes
  Client 15: 45984 train samples, 2 unique classes
  Client 16: 46428 train samples, 2 unique classes
  Client 17: 44737 train samples, 2 unique classes
  Client 18: 45540 train samples, 2 unique classes
  Client 19: 46497 train samples, 2 unique classes
Will sample 4500 samples per client per epoch
Graph: erdos, nodes: 20, edges: 99
Degree statistics: avg=9.90, min=7, max=14
Attack: Compromised 14/20 nodes: [1, 2, 3, 5, 6, 8, 11, 12, 13, 14, 15, 17, 18, 19]
Attack type: gaussian, lambda: 1.0
Model variant: baseline
Model parameters: 1,174,986
Sketchguard Node 0:
  Model dim: 1,174,986 → Sketch size: 180
  Compression ratio: 6527.7x
  Using model parameters for aggregation, sketches for filtering
Sketchguard Node 1:
  Model dim: 1,174,986 → Sketch size: 180
  Compression ratio: 6527.7x
  Using model parameters for aggregation, sketches for filtering
Sketchguard Node 2:
  Model dim: 1,174,986 → Sketch size: 180
  Compression ratio: 6527.7x
  Using model parameters for aggregation, sketches for filtering
Sketchguard Node 3:
  Model dim: 1,174,986 → Sketch size: 180
  Compression ratio: 6527.7x
  Using model parameters for aggregation, sketches for filtering
Sketchguard Node 4:
  Model dim: 1,174,986 → Sketch size: 180
  Compression ratio: 6527.7x
  Using model parameters for aggregation, sketches for filtering
Sketchguard Node 5:
  Model dim: 1,174,986 → Sketch size: 180
  Compression ratio: 6527.7x
  Using model parameters for aggregation, sketches for filtering
Sketchguard Node 6:
  Model dim: 1,174,986 → Sketch size: 180
  Compression ratio: 6527.7x
  Using model parameters for aggregation, sketches for filtering
Sketchguard Node 7:
  Model dim: 1,174,986 → Sketch size: 180
  Compression ratio: 6527.7x
  Using model parameters for aggregation, sketches for filtering
Sketchguard Node 8:
  Model dim: 1,174,986 → Sketch size: 180
  Compression ratio: 6527.7x
  Using model parameters for aggregation, sketches for filtering
Sketchguard Node 9:
  Model dim: 1,174,986 → Sketch size: 180
  Compression ratio: 6527.7x
  Using model parameters for aggregation, sketches for filtering
Sketchguard Node 10:
  Model dim: 1,174,986 → Sketch size: 180
  Compression ratio: 6527.7x
  Using model parameters for aggregation, sketches for filtering
Sketchguard Node 11:
  Model dim: 1,174,986 → Sketch size: 180
  Compression ratio: 6527.7x
  Using model parameters for aggregation, sketches for filtering
Sketchguard Node 12:
  Model dim: 1,174,986 → Sketch size: 180
  Compression ratio: 6527.7x
  Using model parameters for aggregation, sketches for filtering
Sketchguard Node 13:
  Model dim: 1,174,986 → Sketch size: 180
  Compression ratio: 6527.7x
  Using model parameters for aggregation, sketches for filtering
Sketchguard Node 14:
  Model dim: 1,174,986 → Sketch size: 180
  Compression ratio: 6527.7x
  Using model parameters for aggregation, sketches for filtering
Sketchguard Node 15:
  Model dim: 1,174,986 → Sketch size: 180
  Compression ratio: 6527.7x
  Using model parameters for aggregation, sketches for filtering
Sketchguard Node 16:
  Model dim: 1,174,986 → Sketch size: 180
  Compression ratio: 6527.7x
  Using model parameters for aggregation, sketches for filtering
Sketchguard Node 17:
  Model dim: 1,174,986 → Sketch size: 180
  Compression ratio: 6527.7x
  Using model parameters for aggregation, sketches for filtering
Sketchguard Node 18:
  Model dim: 1,174,986 → Sketch size: 180
  Compression ratio: 6527.7x
  Using model parameters for aggregation, sketches for filtering
Sketchguard Node 19:
  Model dim: 1,174,986 → Sketch size: 180
  Compression ratio: 6527.7x
  Using model parameters for aggregation, sketches for filtering
Sketchguard ALGORITHM (Sketch-based Filtering + State Aggregation)
  - Model dimension: 1,174,986 parameters
  - Config: SketchguardConfig(gamma=2, kappa=1, alpha=0.5, min_neighbors=1, sketch_size=180, network_seed=987654321, attack_detection_window=5)
  - Sketch size: 180
  - Compression ratio: 6527.7x
  - Complexity: O(d + N×k) = O(1,174,986 + 20×180)
  - Theoretical speedup vs BALANCE: 19.9x
Initial test acc across nodes: mean=0.4953 ± 0.0174
Round 001: test acc mean=0.5609 ± 0.0315 | min=0.5053 max=0.6139
         : test loss mean=0.6897 ± 0.0010
         : individual accs = ['0.563449', '0.561925', '0.526637', '0.505311', '0.613920', '0.549781', '0.598843', '0.609460', '0.554289', '0.600849', '0.512479', '0.541533', '0.572732', '0.543796', '0.555307', '0.565752', '0.535687', '0.584064', '0.523051', '0.598583']
         : correct/total = [(8019, 14232), (7999, 14235), (7513, 14266), (7184, 14217), (8741, 14238), (7902, 14373), (8591, 14346), (8736, 14334), (7923, 14294), (8636, 14373), (7351, 14344), (7745, 14302), (8221, 14354), (7810, 14362), (7952, 14320), (8144, 14395), (7708, 14389), (8327, 14257), (7454, 14251), (8619, 14399)]
         : compromised: 0.5558, honest: 0.5726
         : sketchguard stats = ['Node 0: acc_rate=0.333', 'Node 1: acc_rate=0.400', 'Node 2: acc_rate=0.375']...
Round 002: test acc mean=0.5911 ± 0.0395 | min=0.4941 max=0.6397
         : test loss mean=0.6831 ± 0.0093
         : individual accs = ['0.626827', '0.523288', '0.561054', '0.603784', '0.598328', '0.626452', '0.566151', '0.639668', '0.620190', '0.630836', '0.623048', '0.550343', '0.538596', '0.627907', '0.494064', '0.600695', '0.600806', '0.570457', '0.613290', '0.605875']
         : correct/total = [(8921, 14232), (7449, 14235), (8004, 14266), (8584, 14217), (8519, 14238), (9004, 14373), (8122, 14346), (9169, 14334), (8865, 14294), (9067, 14373), (8937, 14344), (7871, 14302), (7731, 14354), (9018, 14362), (7075, 14320), (8647, 14395), (8645, 14389), (8133, 14257), (8740, 14251), (8724, 14399)]
         : compromised: 0.5787, honest: 0.6199
         : sketchguard stats = ['Node 0: acc_rate=0.333', 'Node 1: acc_rate=0.400', 'Node 2: acc_rate=0.375']...
Round 003: test acc mean=0.6038 ± 0.0287 | min=0.5313 max=0.6419
         : test loss mean=0.6702 ± 0.0115
         : individual accs = ['0.580663', '0.531296', '0.592317', '0.605121', '0.639275', '0.598692', '0.557228', '0.630808', '0.626976', '0.641898', '0.604085', '0.586212', '0.588616', '0.633199', '0.593645', '0.619382', '0.638543', '0.624395', '0.610975', '0.572470']
         : correct/total = [(8264, 14232), (7563, 14235), (8450, 14266), (8603, 14217), (9102, 14238), (8605, 14373), (7994, 14346), (9042, 14334), (8962, 14294), (9226, 14373), (8665, 14344), (8384, 14302), (8449, 14354), (9094, 14362), (8501, 14320), (8916, 14395), (9188, 14389), (8902, 14257), (8707, 14251), (8243, 14399)]
         : compromised: 0.5958, honest: 0.6225
         : sketchguard stats = ['Node 0: acc_rate=0.333', 'Node 1: acc_rate=0.400', 'Node 2: acc_rate=0.375']...
Round 004: test acc mean=0.6398 ± 0.0053 | min=0.6303 max=0.6514
         : test loss mean=0.6491 ± 0.0060
         : individual accs = ['0.642144', '0.631331', '0.636478', '0.641486', '0.646720', '0.651360', '0.637042', '0.648877', '0.642787', '0.637306', '0.630298', '0.637044', '0.640797', '0.641067', '0.642598', '0.637166', '0.640072', '0.634565', '0.634762', '0.642267']
         : correct/total = [(9139, 14232), (8987, 14235), (9080, 14266), (9120, 14217), (9208, 14238), (9362, 14373), (9139, 14346), (9301, 14334), (9188, 14294), (9160, 14373), (9041, 14344), (9111, 14302), (9198, 14354), (9207, 14362), (9202, 14320), (9172, 14395), (9210, 14389), (9047, 14257), (9046, 14251), (9248, 14399)]
         : compromised: 0.6393, honest: 0.6409
         : sketchguard stats = ['Node 0: acc_rate=0.333', 'Node 1: acc_rate=0.400', 'Node 2: acc_rate=0.375']...
Round 005: test acc mean=0.6434 ± 0.0041 | min=0.6347 max=0.6501
         : test loss mean=0.6369 ± 0.0030
         : individual accs = ['0.644463', '0.650088', '0.641385', '0.639094', '0.647071', '0.643011', '0.634741', '0.649644', '0.643627', '0.640507', '0.645008', '0.639211', '0.647903', '0.644687', '0.641271', '0.637999', '0.646744', '0.644666', '0.638482', '0.648101']
         : correct/total = [(9172, 14232), (9254, 14235), (9150, 14266), (9086, 14217), (9213, 14238), (9242, 14373), (9106, 14346), (9312, 14334), (9200, 14294), (9206, 14373), (9252, 14344), (9142, 14302), (9300, 14354), (9259, 14362), (9183, 14320), (9184, 14395), (9306, 14389), (9191, 14257), (9099, 14251), (9332, 14399)]
         : compromised: 0.6424, honest: 0.6456
         : sketchguard stats = ['Node 0: acc_rate=0.333', 'Node 1: acc_rate=0.400', 'Node 2: acc_rate=0.375']...
Round 006: test acc mean=0.6499 ± 0.0050 | min=0.6418 max=0.6572
         : test loss mean=0.6299 ± 0.0026
         : individual accs = ['0.649663', '0.655427', '0.642717', '0.649996', '0.655991', '0.657204', '0.651053', '0.654249', '0.653141', '0.654074', '0.647100', '0.645294', '0.656890', '0.648587', '0.648254', '0.647378', '0.642783', '0.641790', '0.642832', '0.654212']
         : correct/total = [(9246, 14232), (9330, 14235), (9169, 14266), (9241, 14217), (9340, 14238), (9446, 14373), (9340, 14346), (9378, 14334), (9336, 14294), (9401, 14373), (9282, 14344), (9229, 14302), (9429, 14354), (9315, 14362), (9283, 14320), (9319, 14395), (9249, 14389), (9150, 14257), (9161, 14251), (9420, 14399)]
         : compromised: 0.6496, honest: 0.6506
         : sketchguard stats = ['Node 0: acc_rate=0.333', 'Node 1: acc_rate=0.400', 'Node 2: acc_rate=0.375']...
Round 007: test acc mean=0.6535 ± 0.0056 | min=0.6389 max=0.6635
         : test loss mean=0.6248 ± 0.0042
         : individual accs = ['0.649944', '0.658588', '0.638932', '0.652247', '0.659994', '0.659153', '0.651262', '0.646993', '0.656919', '0.657135', '0.651840', '0.647252', '0.661349', '0.653600', '0.652933', '0.652101', '0.652582', '0.653223', '0.649639', '0.663518']
         : correct/total = [(9250, 14232), (9375, 14235), (9115, 14266), (9273, 14217), (9397, 14238), (9474, 14373), (9343, 14346), (9274, 14334), (9390, 14294), (9445, 14373), (9350, 14344), (9257, 14302), (9493, 14354), (9387, 14362), (9350, 14320), (9387, 14395), (9390, 14389), (9313, 14257), (9258, 14251), (9554, 14399)]
         : compromised: 0.6536, honest: 0.6531
         : sketchguard stats = ['Node 0: acc_rate=0.333', 'Node 1: acc_rate=0.400', 'Node 2: acc_rate=0.375']...
Round 008: test acc mean=0.6561 ± 0.0073 | min=0.6377 max=0.6683
         : test loss mean=0.6220 ± 0.0055
         : individual accs = ['0.645868', '0.659361', '0.637670', '0.657241', '0.655289', '0.668267', '0.658929', '0.657458', '0.659927', '0.656857', '0.655675', '0.651517', '0.664971', '0.661329', '0.655587', '0.658354', '0.650775', '0.655958', '0.643464', '0.666852']
         : correct/total = [(9192, 14232), (9386, 14235), (9097, 14266), (9344, 14217), (9330, 14238), (9605, 14373), (9453, 14346), (9424, 14334), (9433, 14294), (9441, 14373), (9405, 14344), (9318, 14302), (9545, 14354), (9498, 14362), (9388, 14320), (9477, 14395), (9364, 14389), (9352, 14257), (9170, 14251), (9602, 14399)]
         : compromised: 0.6571, honest: 0.6537
         : sketchguard stats = ['Node 0: acc_rate=0.333', 'Node 1: acc_rate=0.400', 'Node 2: acc_rate=0.375']...
Round 009: test acc mean=0.6570 ± 0.0081 | min=0.6367 max=0.6724
         : test loss mean=0.6197 ± 0.0054
         : individual accs = ['0.642074', '0.663014', '0.650848', '0.655202', '0.656483', '0.672441', '0.636693', '0.664155', '0.650273', '0.649690', '0.658603', '0.655293', '0.664135', '0.664114', '0.655168', '0.657867', '0.660227', '0.657291', '0.659884', '0.665949']
         : correct/total = [(9138, 14232), (9438, 14235), (9285, 14266), (9315, 14217), (9347, 14238), (9665, 14373), (9134, 14346), (9520, 14334), (9295, 14294), (9338, 14373), (9447, 14344), (9372, 14302), (9533, 14354), (9538, 14362), (9382, 14320), (9470, 14395), (9500, 14389), (9371, 14257), (9404, 14251), (9589, 14399)]
         : compromised: 0.6577, honest: 0.6552
         : sketchguard stats = ['Node 0: acc_rate=0.333', 'Node 1: acc_rate=0.400', 'Node 2: acc_rate=0.375']...
Round 010: test acc mean=0.6626 ± 0.0064 | min=0.6438 max=0.6742
         : test loss mean=0.6127 ± 0.0046
         : individual accs = ['0.661256', '0.670109', '0.643838', '0.658718', '0.665402', '0.674181', '0.666527', '0.670783', '0.661816', '0.657900', '0.664180', '0.661166', '0.668664', '0.665367', '0.661522', '0.654324', '0.660644', '0.664375', '0.657357', '0.663032']
         : correct/total = [(9411, 14232), (9539, 14235), (9185, 14266), (9365, 14217), (9474, 14238), (9690, 14373), (9562, 14346), (9615, 14334), (9460, 14294), (9456, 14373), (9527, 14344), (9456, 14302), (9598, 14354), (9556, 14362), (9473, 14320), (9419, 14395), (9506, 14389), (9472, 14257), (9368, 14251), (9547, 14399)]
         : compromised: 0.6622, honest: 0.6634
         : sketchguard stats = ['Node 0: acc_rate=0.333', 'Node 1: acc_rate=0.400', 'Node 2: acc_rate=0.375']...

=== FINAL RESULTS ===
Dataset: sent140, Nodes: 20, Graph: erdos, Aggregation: sketchguard
Attack: gaussian, 70.0% compromised
Final accuracy - Compromised: 0.6622, Honest: 0.6634
Overall test accuracy: mean=0.6626 ± 0.0064

=== Sketchguard SUMMARY ===
Node 0: acceptance=0.333
Node 1: acceptance=0.400
Node 2: acceptance=0.375
Node 3: acceptance=0.429
Node 4: acceptance=0.333
Node 5: acceptance=0.200
Node 6: acceptance=0.250
Node 7: acceptance=0.273
Node 8: acceptance=0.143
Node 9: acceptance=0.364
Node 10: acceptance=0.250
Node 11: acceptance=0.250
Node 12: acceptance=0.333
Node 13: acceptance=0.111
Node 14: acceptance=0.286
Node 15: acceptance=0.333
Node 16: acceptance=0.286
Node 17: acceptance=0.500
Node 18: acceptance=0.250
Node 19: acceptance=0.200

=== PARALLEL EXECUTION TIME (realistic for distributed system) ===
  COMMUNICATION (max across nodes):
    - Sketch transfer: 0.000s (0.0%)
    - Model fetch (accepted): 0.000s (0.0%)
  COMPUTATION (max across nodes):
    - Sketching: 0.288s (95.7%)
    - Filtering: 0.001s (0.3%)
    - Aggregation: 0.012s (3.9%)
  TOTALS:
    - Total computation: 0.301s (100.0%)
    - Total communication: 0.000s (0.0%)
    - Total parallel time: 0.301s

=== PER-NODE AVERAGE TIME ===
  - Sketching: 0.226s
  - Filtering: 0.001s
  - Aggregation: 0.009s
  - Sketch transfer: 0.000s
  - Model fetch: 0.000s
  - Total per node: 0.236s

=== TOTAL COMPUTATIONAL WORK (sum across all nodes) ===
  - Total sketching: 4.529s
  - Total filtering: 0.011s
  - Total aggregation: 0.181s
  - Total sketch transfer: 0.000s
  - Total model fetch: 0.000s
  - Grand total: 4.721s
  - Mean acceptance rate: 0.295

Sketchguard Algorithm Properties:
  - Original dimension: 1,174,986
  - Sketch size: 180
  - Compression ratio: 19.9x
  - Single repetition: No repetitions needed
  - Theoretical complexity: O(d + N×k)
  - Approach: Sketch filtering + state aggregation
