Device: cuda
Seed: 987654321
Loading 1 LEAF Sent140 train files...
LEAF Sent140 train: 254555 users, 908652 samples
Building vocabulary (max_size=10000)...
Vocabulary size: 10000
Loading 1 LEAF Sent140 test files...
LEAF Sent140 test: 254555 users, 286281 samples
Found 254555 train users, 254555 test users, 254555 common users
User sample counts range: 494 (max) to 1 (min)
Distributed ALL 254555 users across 20 clients
Users per client: 12727 (with 15 clients getting +1 user)
Train partition sizes: [44353, 44290, 44657, 44907, 44696, 45843, 45801, 45619, 45069, 45639, 45821, 45311, 45779, 46056, 45625, 45984, 46428, 44737, 45540, 46497]
Test partition sizes: [14232, 14235, 14266, 14217, 14238, 14373, 14346, 14334, 14294, 14373, 14344, 14302, 14354, 14362, 14320, 14395, 14389, 14257, 14251, 14399]
  Client 0: 44353 train samples, 2 unique classes
  Client 1: 44290 train samples, 2 unique classes
  Client 2: 44657 train samples, 2 unique classes
  Client 3: 44907 train samples, 2 unique classes
  Client 4: 44696 train samples, 2 unique classes
  Client 5: 45843 train samples, 2 unique classes
  Client 6: 45801 train samples, 2 unique classes
  Client 7: 45619 train samples, 2 unique classes
  Client 8: 45069 train samples, 2 unique classes
  Client 9: 45639 train samples, 2 unique classes
  Client 10: 45821 train samples, 2 unique classes
  Client 11: 45311 train samples, 2 unique classes
  Client 12: 45779 train samples, 2 unique classes
  Client 13: 46056 train samples, 2 unique classes
  Client 14: 45625 train samples, 2 unique classes
  Client 15: 45984 train samples, 2 unique classes
  Client 16: 46428 train samples, 2 unique classes
  Client 17: 44737 train samples, 2 unique classes
  Client 18: 45540 train samples, 2 unique classes
  Client 19: 46497 train samples, 2 unique classes
Will sample 4500 samples per client per epoch
Graph: erdos, nodes: 20, edges: 126
Degree statistics: avg=12.60, min=8, max=16
Attack: Compromised 16/20 nodes: [1, 2, 3, 5, 6, 8, 9, 10, 11, 12, 13, 14, 15, 17, 18, 19]
Attack type: directed_deviation, lambda: 1.0
Model variant: baseline
Model parameters: 1,174,986
Initial test acc across nodes: mean=0.4953 ± 0.0174
Round 001: test acc mean=0.5003 ± 0.0068 | min=0.4898 max=0.5194
         : test loss mean=14.5387 ± 3.9059
         : individual accs = ['0.505972', '0.519354', '0.492149', '0.489766', '0.503652', '0.501635', '0.500836', '0.495465', '0.495173', '0.498504', '0.492122', '0.506153', '0.497562', '0.496519', '0.505377', '0.491768', '0.507332', '0.501789', '0.502140', '0.503438']
         : correct/total = [(7201, 14232), (7393, 14235), (7021, 14266), (6963, 14217), (7171, 14238), (7210, 14373), (7185, 14346), (7102, 14334), (7078, 14294), (7165, 14373), (7059, 14344), (7239, 14302), (7142, 14354), (7131, 14362), (7237, 14320), (7079, 14395), (7300, 14389), (7154, 14257), (7156, 14251), (7249, 14399)]
         : compromised: 0.4996, honest: 0.5031
Round 002: test acc mean=0.5009 ± 0.0063 | min=0.4918 max=0.5137
         : test loss mean=10.1073 ± 3.7002
         : individual accs = ['0.495784', '0.501862', '0.493761', '0.491806', '0.503863', '0.506227', '0.492193', '0.510186', '0.500560', '0.499130', '0.505089', '0.513704', '0.502647', '0.508355', '0.501117', '0.505523', '0.494197', '0.491758', '0.503544', '0.495937']
         : correct/total = [(7056, 14232), (7144, 14235), (7044, 14266), (6992, 14217), (7174, 14238), (7276, 14373), (7061, 14346), (7313, 14334), (7155, 14294), (7174, 14373), (7245, 14344), (7347, 14302), (7215, 14354), (7301, 14362), (7176, 14320), (7277, 14395), (7111, 14389), (7011, 14257), (7176, 14251), (7141, 14399)]
         : compromised: 0.5008, honest: 0.5010
Round 003: test acc mean=0.5068 ± 0.0101 | min=0.4884 max=0.5295
         : test loss mean=2.0260 ± 0.8588
         : individual accs = ['0.501546', '0.507833', '0.507290', '0.512696', '0.499579', '0.503583', '0.500279', '0.507535', '0.502309', '0.488416', '0.502510', '0.506992', '0.513376', '0.505779', '0.529469', '0.527683', '0.506359', '0.493863', '0.497088', '0.521703']
         : correct/total = [(7138, 14232), (7229, 14235), (7237, 14266), (7289, 14217), (7113, 14238), (7238, 14373), (7177, 14346), (7275, 14334), (7180, 14294), (7020, 14373), (7208, 14344), (7251, 14302), (7369, 14354), (7264, 14362), (7582, 14320), (7596, 14395), (7286, 14389), (7041, 14257), (7084, 14251), (7512, 14399)]
         : compromised: 0.5076, honest: 0.5038
Round 004: test acc mean=0.5074 ± 0.0050 | min=0.4991 max=0.5182
         : test loss mean=3.5554 ± 1.1220
         : individual accs = ['0.502951', '0.518230', '0.505047', '0.515369', '0.511238', '0.501705', '0.510107', '0.514999', '0.505527', '0.502818', '0.502998', '0.509090', '0.501393', '0.506963', '0.509078', '0.509413', '0.509973', '0.503262', '0.507824', '0.499062']
         : correct/total = [(7158, 14232), (7377, 14235), (7205, 14266), (7327, 14217), (7279, 14238), (7211, 14373), (7318, 14346), (7382, 14334), (7226, 14294), (7227, 14373), (7215, 14344), (7281, 14302), (7197, 14354), (7281, 14362), (7290, 14320), (7333, 14395), (7338, 14389), (7175, 14257), (7237, 14251), (7186, 14399)]
         : compromised: 0.5067, honest: 0.5098
Round 005: test acc mean=0.4941 ± 0.0066 | min=0.4831 max=0.5035
         : test loss mean=1.1784 ± 0.7988
         : individual accs = ['0.486017', '0.487320', '0.488644', '0.486319', '0.498385', '0.502609', '0.503485', '0.496442', '0.499091', '0.492451', '0.501115', '0.500489', '0.498746', '0.501184', '0.483101', '0.497673', '0.493085', '0.494985', '0.487475', '0.483367']
         : correct/total = [(6917, 14232), (6937, 14235), (6971, 14266), (6914, 14217), (7096, 14238), (7224, 14373), (7223, 14346), (7116, 14334), (7134, 14294), (7078, 14373), (7188, 14344), (7158, 14302), (7159, 14354), (7198, 14362), (6918, 14320), (7164, 14395), (7095, 14389), (7057, 14257), (6947, 14251), (6960, 14399)]
         : compromised: 0.4943, honest: 0.4935
Round 006: test acc mean=0.5050 ± 0.0057 | min=0.4923 max=0.5173
         : test loss mean=1.7116 ± 0.5073
         : individual accs = ['0.507378', '0.517316', '0.512828', '0.515228', '0.505689', '0.504488', '0.498954', '0.507604', '0.501469', '0.504766', '0.501882', '0.506223', '0.497074', '0.492271', '0.507472', '0.502188', '0.506637', '0.504805', '0.504526', '0.502049']
         : correct/total = [(7221, 14232), (7364, 14235), (7316, 14266), (7325, 14217), (7200, 14238), (7251, 14373), (7158, 14346), (7276, 14334), (7168, 14294), (7255, 14373), (7199, 14344), (7240, 14302), (7135, 14354), (7070, 14362), (7267, 14320), (7229, 14395), (7290, 14389), (7197, 14257), (7190, 14251), (7229, 14399)]
         : compromised: 0.5046, honest: 0.5068
Round 007: test acc mean=0.5056 ± 0.0094 | min=0.4870 max=0.5304
         : test loss mean=1.4244 ± 0.4533
         : individual accs = ['0.511594', '0.513874', '0.486962', '0.519941', '0.502599', '0.530369', '0.504531', '0.500907', '0.498321', '0.501983', '0.513107', '0.502867', '0.503274', '0.506684', '0.509916', '0.510455', '0.492599', '0.504454', '0.496246', '0.501840']
         : correct/total = [(7281, 14232), (7315, 14235), (6947, 14266), (7392, 14217), (7156, 14238), (7623, 14373), (7238, 14346), (7180, 14334), (7123, 14294), (7215, 14373), (7360, 14344), (7192, 14302), (7224, 14354), (7277, 14362), (7302, 14320), (7348, 14395), (7088, 14389), (7192, 14257), (7072, 14251), (7226, 14399)]
         : compromised: 0.5066, honest: 0.5019
Round 008: test acc mean=0.5053 ± 0.0066 | min=0.4920 max=0.5189
         : test loss mean=1.1944 ± 0.4192
         : individual accs = ['0.502178', '0.518862', '0.511286', '0.511430', '0.515241', '0.503305', '0.495260', '0.504744', '0.491955', '0.505392', '0.498885', '0.503636', '0.507942', '0.498399', '0.509986', '0.500799', '0.502954', '0.514133', '0.504315', '0.505035']
         : correct/total = [(7147, 14232), (7386, 14235), (7294, 14266), (7271, 14217), (7336, 14238), (7234, 14373), (7105, 14346), (7235, 14334), (7032, 14294), (7264, 14373), (7156, 14344), (7203, 14302), (7291, 14354), (7158, 14362), (7303, 14320), (7209, 14395), (7237, 14389), (7330, 14257), (7187, 14251), (7272, 14399)]
         : compromised: 0.5050, honest: 0.5063
Round 009: test acc mean=0.4994 ± 0.0065 | min=0.4855 max=0.5097
         : test loss mean=0.7168 ± 0.0179
         : individual accs = ['0.501546', '0.495258', '0.509393', '0.485475', '0.503231', '0.495165', '0.505158', '0.500349', '0.496362', '0.500591', '0.498954', '0.497553', '0.507106', '0.487397', '0.499162', '0.509205', '0.496560', '0.495546', '0.509719', '0.494409']
         : correct/total = [(7138, 14232), (7050, 14235), (7267, 14266), (6902, 14217), (7165, 14238), (7117, 14373), (7247, 14346), (7172, 14334), (7095, 14294), (7195, 14373), (7157, 14344), (7116, 14302), (7279, 14354), (7000, 14362), (7148, 14320), (7330, 14395), (7145, 14389), (7065, 14257), (7264, 14251), (7119, 14399)]
         : compromised: 0.4992, honest: 0.5004
Round 010: test acc mean=0.5047 ± 0.0040 | min=0.4955 max=0.5118
         : test loss mean=0.9855 ± 0.2977
         : individual accs = ['0.507307', '0.500527', '0.511776', '0.508968', '0.505127', '0.503096', '0.501324', '0.507046', '0.504128', '0.499130', '0.499721', '0.505314', '0.505713', '0.495544', '0.508939', '0.503439', '0.509486', '0.508943', '0.504666', '0.503854']
         : correct/total = [(7220, 14232), (7125, 14235), (7301, 14266), (7236, 14217), (7192, 14238), (7231, 14373), (7192, 14346), (7268, 14334), (7206, 14294), (7174, 14373), (7168, 14344), (7227, 14302), (7259, 14354), (7117, 14362), (7288, 14320), (7247, 14395), (7331, 14389), (7256, 14257), (7192, 14251), (7255, 14399)]
         : compromised: 0.5041, honest: 0.5072

=== FINAL RESULTS ===
Dataset: sent140, Nodes: 20, Graph: erdos, Aggregation: krum
Attack: directed_deviation, 80.0% compromised
Final accuracy - Compromised: 0.5041, Honest: 0.5072
Overall test accuracy: mean=0.5047 ± 0.0040
