Device: cuda
Seed: 987654321
Loading 1 LEAF Sent140 train files...
LEAF Sent140 train: 254555 users, 908652 samples
Building vocabulary (max_size=10000)...
Vocabulary size: 10000
Loading 1 LEAF Sent140 test files...
LEAF Sent140 test: 254555 users, 286281 samples
Found 254555 train users, 254555 test users, 254555 common users
User sample counts range: 494 (max) to 1 (min)
Distributed ALL 254555 users across 20 clients
Users per client: 12727 (with 15 clients getting +1 user)
Train partition sizes: [44353, 44290, 44657, 44907, 44696, 45843, 45801, 45619, 45069, 45639, 45821, 45311, 45779, 46056, 45625, 45984, 46428, 44737, 45540, 46497]
Test partition sizes: [14232, 14235, 14266, 14217, 14238, 14373, 14346, 14334, 14294, 14373, 14344, 14302, 14354, 14362, 14320, 14395, 14389, 14257, 14251, 14399]
  Client 0: 44353 train samples, 2 unique classes
  Client 1: 44290 train samples, 2 unique classes
  Client 2: 44657 train samples, 2 unique classes
  Client 3: 44907 train samples, 2 unique classes
  Client 4: 44696 train samples, 2 unique classes
  Client 5: 45843 train samples, 2 unique classes
  Client 6: 45801 train samples, 2 unique classes
  Client 7: 45619 train samples, 2 unique classes
  Client 8: 45069 train samples, 2 unique classes
  Client 9: 45639 train samples, 2 unique classes
  Client 10: 45821 train samples, 2 unique classes
  Client 11: 45311 train samples, 2 unique classes
  Client 12: 45779 train samples, 2 unique classes
  Client 13: 46056 train samples, 2 unique classes
  Client 14: 45625 train samples, 2 unique classes
  Client 15: 45984 train samples, 2 unique classes
  Client 16: 46428 train samples, 2 unique classes
  Client 17: 44737 train samples, 2 unique classes
  Client 18: 45540 train samples, 2 unique classes
  Client 19: 46497 train samples, 2 unique classes
Will sample 4500 samples per client per epoch
Graph: ring, nodes: 20, edges: 20
Degree statistics: avg=2.00, min=2, max=2
Attack: Compromised 2/20 nodes: [5, 13]
Attack type: directed_deviation, lambda: 1.0
Model variant: baseline
Model parameters: 1,174,986
Initial test acc across nodes: mean=0.4953 ± 0.0174
Round 001: test acc mean=0.5142 ± 0.0165 | min=0.4882 max=0.5652
         : test loss mean=1.3028 ± 1.0056
         : individual accs = ['0.534992', '0.565227', '0.488224', '0.512415', '0.510395', '0.505183', '0.506483', '0.524766', '0.502169', '0.533779', '0.502022', '0.511677', '0.502926', '0.502367', '0.499860', '0.507815', '0.518313', '0.529564', '0.515753', '0.510035']
         : correct/total = [(7614, 14232), (8046, 14235), (6965, 14266), (7285, 14217), (7267, 14238), (7261, 14373), (7266, 14346), (7522, 14334), (7178, 14294), (7672, 14373), (7201, 14344), (7318, 14302), (7219, 14354), (7215, 14362), (7158, 14320), (7310, 14395), (7458, 14389), (7550, 14257), (7350, 14251), (7344, 14399)]
         : compromised: 0.5038, honest: 0.5154
Round 002: test acc mean=0.5513 ± 0.0555 | min=0.4915 max=0.6377
         : test loss mean=1.2359 ± 0.8975
         : individual accs = ['0.607223', '0.637654', '0.627085', '0.491524', '0.500421', '0.505253', '0.501324', '0.507255', '0.539807', '0.627079', '0.623048', '0.493078', '0.494636', '0.501601', '0.496858', '0.500729', '0.593092', '0.593673', '0.582906', '0.601083']
         : correct/total = [(8642, 14232), (9077, 14235), (8946, 14266), (6988, 14217), (7125, 14238), (7262, 14373), (7192, 14346), (7271, 14334), (7716, 14294), (9013, 14373), (8937, 14344), (7052, 14302), (7100, 14354), (7204, 14362), (7115, 14320), (7208, 14395), (8534, 14389), (8464, 14257), (8307, 14251), (8655, 14399)]
         : compromised: 0.5034, honest: 0.5566
Round 003: test acc mean=0.5502 ± 0.0536 | min=0.4850 max=0.6273
         : test loss mean=0.7468 ± 0.1258
         : individual accs = ['0.593170', '0.619951', '0.590004', '0.484983', '0.499227', '0.499896', '0.492472', '0.504046', '0.571429', '0.623391', '0.549080', '0.506852', '0.510450', '0.485935', '0.513897', '0.503230', '0.614080', '0.627271', '0.627324', '0.587194']
         : correct/total = [(8442, 14232), (8825, 14235), (8417, 14266), (6895, 14217), (7108, 14238), (7185, 14373), (7065, 14346), (7225, 14334), (8168, 14294), (8960, 14373), (7876, 14344), (7249, 14302), (7327, 14354), (6979, 14362), (7359, 14320), (7244, 14395), (8836, 14389), (8943, 14257), (8940, 14251), (8455, 14399)]
         : compromised: 0.4929, honest: 0.5566
Round 004: test acc mean=0.5620 ± 0.0591 | min=0.4857 max=0.6420
         : test loss mean=0.7900 ± 0.2635
         : individual accs = ['0.639545', '0.642009', '0.496004', '0.485686', '0.504635', '0.508314', '0.504670', '0.537812', '0.592137', '0.634175', '0.607780', '0.532163', '0.502438', '0.502785', '0.496788', '0.559222', '0.586976', '0.631199', '0.634201', '0.640739']
         : correct/total = [(9102, 14232), (9139, 14235), (7076, 14266), (6905, 14217), (7185, 14238), (7306, 14373), (7240, 14346), (7709, 14334), (8464, 14294), (9115, 14373), (8718, 14344), (7611, 14302), (7212, 14354), (7221, 14362), (7114, 14320), (8050, 14395), (8446, 14389), (8999, 14257), (9038, 14251), (9226, 14399)]
         : compromised: 0.5055, honest: 0.5682
Round 005: test acc mean=0.5734 ± 0.0628 | min=0.4910 max=0.6453
         : test loss mean=0.6925 ± 0.0518
         : individual accs = ['0.640528', '0.645311', '0.636829', '0.502216', '0.500492', '0.500174', '0.520145', '0.535161', '0.633203', '0.642942', '0.622560', '0.510208', '0.526891', '0.491018', '0.500628', '0.529698', '0.626520', '0.627201', '0.635043', '0.640669']
         : correct/total = [(9116, 14232), (9186, 14235), (9085, 14266), (7140, 14217), (7126, 14238), (7189, 14373), (7462, 14346), (7671, 14334), (9051, 14294), (9241, 14373), (8930, 14344), (7297, 14302), (7563, 14354), (7052, 14362), (7169, 14320), (7625, 14395), (9015, 14389), (8942, 14257), (9050, 14251), (9225, 14399)]
         : compromised: 0.4956, honest: 0.5820
Round 006: test acc mean=0.5890 ± 0.0553 | min=0.5025 max=0.6502
         : test loss mean=0.6982 ± 0.0923
         : individual accs = ['0.644533', '0.650158', '0.623861', '0.563129', '0.512010', '0.505392', '0.503764', '0.569834', '0.630404', '0.631183', '0.629253', '0.621941', '0.502508', '0.521794', '0.529539', '0.583536', '0.633331', '0.640247', '0.634131', '0.648587']
         : correct/total = [(9173, 14232), (9255, 14235), (8900, 14266), (8006, 14217), (7290, 14238), (7264, 14373), (7227, 14346), (8168, 14334), (9011, 14294), (9072, 14373), (9026, 14344), (8895, 14302), (7213, 14354), (7494, 14362), (7583, 14320), (8400, 14395), (9113, 14389), (9128, 14257), (9037, 14251), (9339, 14399)]
         : compromised: 0.5136, honest: 0.5973
Round 007: test acc mean=0.5855 ± 0.0610 | min=0.4967 max=0.6514
         : test loss mean=0.6758 ± 0.0445
         : individual accs = ['0.651419', '0.648753', '0.648325', '0.508616', '0.511378', '0.524595', '0.513523', '0.555811', '0.641108', '0.646768', '0.636782', '0.544539', '0.521736', '0.496658', '0.507682', '0.594581', '0.636597', '0.639405', '0.634973', '0.646712']
         : correct/total = [(9271, 14232), (9235, 14235), (9249, 14266), (7231, 14217), (7281, 14238), (7540, 14373), (7367, 14346), (7967, 14334), (9164, 14294), (9296, 14373), (9134, 14344), (7788, 14302), (7489, 14354), (7133, 14362), (7270, 14320), (8559, 14395), (9160, 14389), (9116, 14257), (9049, 14251), (9312, 14399)]
         : compromised: 0.5106, honest: 0.5938
Round 008: test acc mean=0.6028 ± 0.0524 | min=0.5127 max=0.6540
         : test loss mean=0.6764 ± 0.0605
         : individual accs = ['0.654019', '0.639480', '0.639422', '0.596399', '0.519455', '0.520559', '0.535480', '0.633459', '0.632083', '0.646629', '0.620747', '0.639841', '0.526264', '0.512742', '0.536941', '0.620841', '0.640559', '0.644876', '0.646621', '0.648587']
         : correct/total = [(9308, 14232), (9103, 14235), (9122, 14266), (8479, 14217), (7396, 14238), (7482, 14373), (7682, 14346), (9080, 14334), (9035, 14294), (9294, 14373), (8904, 14344), (9151, 14302), (7554, 14354), (7364, 14362), (7689, 14320), (8937, 14395), (9217, 14389), (9194, 14257), (9215, 14251), (9339, 14399)]
         : compromised: 0.5167, honest: 0.6123
Round 009: test acc mean=0.5944 ± 0.0562 | min=0.4951 max=0.6554
         : test loss mean=0.6662 ± 0.0407
         : individual accs = ['0.642566', '0.651985', '0.655404', '0.587888', '0.553589', '0.534544', '0.513035', '0.542486', '0.634952', '0.644124', '0.638804', '0.556076', '0.538108', '0.511280', '0.495112', '0.594095', '0.644034', '0.646630', '0.650551', '0.652962']
         : correct/total = [(9145, 14232), (9281, 14235), (9350, 14266), (8358, 14217), (7882, 14238), (7683, 14373), (7360, 14346), (7776, 14334), (9076, 14294), (9258, 14373), (9163, 14344), (7953, 14302), (7724, 14354), (7343, 14362), (7090, 14320), (8552, 14395), (9267, 14389), (9219, 14257), (9271, 14251), (9402, 14399)]
         : compromised: 0.5229, honest: 0.6024
Round 010: test acc mean=0.6125 ± 0.0510 | min=0.5181 max=0.6642
         : test loss mean=0.6659 ± 0.0579
         : individual accs = ['0.661959', '0.658728', '0.648815', '0.635507', '0.518121', '0.530230', '0.553813', '0.627808', '0.634042', '0.654282', '0.627649', '0.632849', '0.536924', '0.547835', '0.536103', '0.623689', '0.647925', '0.653153', '0.656024', '0.664213']
         : correct/total = [(9421, 14232), (9377, 14235), (9256, 14266), (9035, 14217), (7377, 14238), (7621, 14373), (7945, 14346), (8999, 14334), (9063, 14294), (9404, 14373), (9003, 14344), (9051, 14302), (7707, 14354), (7868, 14362), (7677, 14320), (8978, 14395), (9323, 14389), (9312, 14257), (9349, 14251), (9564, 14399)]
         : compromised: 0.5390, honest: 0.6206

=== FINAL RESULTS ===
Dataset: sent140, Nodes: 20, Graph: ring, Aggregation: d-fedavg
Attack: directed_deviation, 10.0% compromised
Final accuracy - Compromised: 0.5390, Honest: 0.6206
Overall test accuracy: mean=0.6125 ± 0.0510
