Device: cuda
Seed: 987654321
Loading 1 LEAF Sent140 train files...
LEAF Sent140 train: 254555 users, 908652 samples
Building vocabulary (max_size=10000)...
Vocabulary size: 10000
Loading 1 LEAF Sent140 test files...
LEAF Sent140 test: 254555 users, 286281 samples
Found 254555 train users, 254555 test users, 254555 common users
User sample counts range: 494 (max) to 1 (min)
Distributed ALL 254555 users across 20 clients
Users per client: 12727 (with 15 clients getting +1 user)
Train partition sizes: [44353, 44290, 44657, 44907, 44696, 45843, 45801, 45619, 45069, 45639, 45821, 45311, 45779, 46056, 45625, 45984, 46428, 44737, 45540, 46497]
Test partition sizes: [14232, 14235, 14266, 14217, 14238, 14373, 14346, 14334, 14294, 14373, 14344, 14302, 14354, 14362, 14320, 14395, 14389, 14257, 14251, 14399]
  Client 0: 44353 train samples, 2 unique classes
  Client 1: 44290 train samples, 2 unique classes
  Client 2: 44657 train samples, 2 unique classes
  Client 3: 44907 train samples, 2 unique classes
  Client 4: 44696 train samples, 2 unique classes
  Client 5: 45843 train samples, 2 unique classes
  Client 6: 45801 train samples, 2 unique classes
  Client 7: 45619 train samples, 2 unique classes
  Client 8: 45069 train samples, 2 unique classes
  Client 9: 45639 train samples, 2 unique classes
  Client 10: 45821 train samples, 2 unique classes
  Client 11: 45311 train samples, 2 unique classes
  Client 12: 45779 train samples, 2 unique classes
  Client 13: 46056 train samples, 2 unique classes
  Client 14: 45625 train samples, 2 unique classes
  Client 15: 45984 train samples, 2 unique classes
  Client 16: 46428 train samples, 2 unique classes
  Client 17: 44737 train samples, 2 unique classes
  Client 18: 45540 train samples, 2 unique classes
  Client 19: 46497 train samples, 2 unique classes
Will sample 4500 samples per client per epoch
Graph: ring, nodes: 20, edges: 20
Degree statistics: avg=2.00, min=2, max=2
Attack: Compromised 6/20 nodes: [5, 12, 13, 14, 17, 18]
Attack type: backdoor, lambda: 1.0
Backdoor target label: 1, trigger size: 3
Model variant: baseline
Model parameters: 1,174,986
BALANCE algorithm:
Balance Config: BALANCEConfig(gamma=2, kappa=1, alpha=0.5, min_neighbors=1)
  - Model dimension: 1,174,986 parameters
  - Complexity: O(N×d) = O(20×1,174,986)
Initial test acc across nodes: mean=0.4953 ± 0.0174
Backdoor attack: Created poisoned datasets for 6 compromised nodes
Round 001: test acc mean=0.5263 ± 0.0364 | min=0.4923 max=0.6236
         : test loss mean=19.4127 ± 30.1547
         : individual accs = ['0.583263', '0.623604', '0.535118', '0.566575', '0.522686', '0.518890', '0.505855', '0.576531', '0.501189', '0.572254', '0.509481', '0.497203', '0.493660', '0.506754', '0.502304', '0.492254', '0.506081', '0.511959', '0.497228', '0.502674']
         : correct/total = [(8301, 14232), (8877, 14235), (7634, 14266), (8055, 14217), (7442, 14238), (7458, 14373), (7257, 14346), (8264, 14334), (7164, 14294), (8225, 14373), (7308, 14344), (7111, 14302), (7086, 14354), (7278, 14362), (7193, 14320), (7086, 14395), (7282, 14389), (7299, 14257), (7086, 14251), (7238, 14399)]
         : compromised: 0.5051, honest: 0.5353
Round 002: test acc mean=0.5255 ± 0.0515 | min=0.4874 max=0.6426
         : test loss mean=152.1800 ± 251.8652
         : individual accs = ['0.507729', '0.642571', '0.632062', '0.493353', '0.506251', '0.503653', '0.505298', '0.493024', '0.623548', '0.609685', '0.501603', '0.516781', '0.492685', '0.493594', '0.505656', '0.487391', '0.491139', '0.495125', '0.497649', '0.511216']
         : correct/total = [(7226, 14232), (9147, 14235), (9017, 14266), (7014, 14217), (7208, 14238), (7239, 14373), (7249, 14346), (7067, 14334), (8913, 14294), (8763, 14373), (7195, 14344), (7391, 14302), (7072, 14354), (7089, 14362), (7241, 14320), (7016, 14395), (7067, 14389), (7059, 14257), (7092, 14251), (7361, 14399)]
         : compromised: 0.4981, honest: 0.5373
Round 003: test acc mean=0.5261 ± 0.0464 | min=0.4819 max=0.6374
         : test loss mean=19314.0080 ± 56405.7356
         : individual accs = ['0.507378', '0.637373', '0.627997', '0.515017', '0.504846', '0.481876', '0.503764', '0.516255', '0.565692', '0.623878', '0.515825', '0.502168', '0.483071', '0.500975', '0.509427', '0.503578', '0.506985', '0.501157', '0.501298', '0.513786']
         : correct/total = [(7221, 14232), (9073, 14235), (8959, 14266), (7322, 14217), (7188, 14238), (6926, 14373), (7227, 14346), (7400, 14334), (8086, 14294), (8967, 14373), (7399, 14344), (7182, 14302), (6934, 14354), (7195, 14362), (7295, 14320), (7249, 14395), (7295, 14389), (7145, 14257), (7144, 14251), (7398, 14399)]
         : compromised: 0.4963, honest: 0.5389
Round 004: test acc mean=0.5273 ± 0.0499 | min=0.4864 max=0.6490
         : test loss mean=1303874.1913 ± 2896113.1113
         : individual accs = ['0.535483', '0.649034', '0.642507', '0.519589', '0.505759', '0.491825', '0.498188', '0.495744', '0.551070', '0.629722', '0.522867', '0.505664', '0.502369', '0.499164', '0.505098', '0.503369', '0.507262', '0.486358', '0.492246', '0.502049']
         : correct/total = [(7621, 14232), (9239, 14235), (9166, 14266), (7387, 14217), (7201, 14238), (7069, 14373), (7147, 14346), (7106, 14334), (7877, 14294), (9051, 14373), (7500, 14344), (7232, 14302), (7211, 14354), (7169, 14362), (7233, 14320), (7246, 14395), (7299, 14389), (6934, 14257), (7015, 14251), (7229, 14399)]
         : compromised: 0.4962, honest: 0.5406
Round 005: test acc mean=0.5332 ± 0.0505 | min=0.4937 max=0.6421
         : test loss mean=62065481.8817 ± 101106131.0028
         : individual accs = ['0.522203', '0.638918', '0.642086', '0.493705', '0.504284', '0.501496', '0.496375', '0.533766', '0.610816', '0.626870', '0.554727', '0.498951', '0.497980', '0.515736', '0.507542', '0.500174', '0.498575', '0.508803', '0.515473', '0.496493']
         : correct/total = [(7432, 14232), (9095, 14235), (9160, 14266), (7019, 14217), (7180, 14238), (7208, 14373), (7121, 14346), (7651, 14334), (8731, 14294), (9010, 14373), (7957, 14344), (7136, 14302), (7148, 14354), (7407, 14362), (7268, 14320), (7200, 14395), (7174, 14389), (7254, 14257), (7346, 14251), (7149, 14399)]
         : compromised: 0.5078, honest: 0.5441
Round 006: test acc mean=0.5320 ± 0.0485 | min=0.4855 max=0.6489
         : test loss mean=3697401554.2072 ± 7227779958.3783
         : individual accs = ['0.548131', '0.648894', '0.612015', '0.515580', '0.505619', '0.504001', '0.510177', '0.518418', '0.594095', '0.634871', '0.548104', '0.509649', '0.503692', '0.491784', '0.503492', '0.496492', '0.497880', '0.506558', '0.485510', '0.505035']
         : correct/total = [(7801, 14232), (9237, 14235), (8731, 14266), (7330, 14217), (7199, 14238), (7244, 14373), (7319, 14346), (7431, 14334), (8492, 14294), (9125, 14373), (7862, 14344), (7289, 14302), (7230, 14354), (7063, 14362), (7210, 14320), (7147, 14395), (7164, 14389), (7222, 14257), (6919, 14251), (7272, 14399)]
         : compromised: 0.4992, honest: 0.5461
Round 007: test acc mean=0.5366 ± 0.0478 | min=0.4984 max=0.6448
         : test loss mean=337201962181.1053 ± 584371881864.7965
         : individual accs = ['0.532603', '0.644819', '0.620777', '0.554055', '0.509201', '0.499130', '0.512408', '0.527906', '0.623898', '0.616086', '0.553542', '0.504545', '0.505295', '0.510932', '0.503631', '0.498367', '0.506985', '0.501718', '0.502000', '0.503577']
         : correct/total = [(7580, 14232), (9179, 14235), (8856, 14266), (7877, 14217), (7250, 14238), (7174, 14373), (7351, 14346), (7567, 14334), (8918, 14294), (8855, 14373), (7940, 14344), (7216, 14302), (7253, 14354), (7338, 14362), (7212, 14320), (7174, 14395), (7295, 14389), (7153, 14257), (7154, 14251), (7251, 14399)]
         : compromised: 0.5038, honest: 0.5506
Round 008: test acc mean=0.5332 ± 0.0461 | min=0.4948 max=0.6385
         : test loss mean=25475477324808.6016 ± 48445202209914.4062
         : individual accs = ['0.552487', '0.638497', '0.595121', '0.525427', '0.516084', '0.504209', '0.497351', '0.527069', '0.618651', '0.621234', '0.553960', '0.504475', '0.504250', '0.500000', '0.498464', '0.506426', '0.497811', '0.494845', '0.498421', '0.509688']
         : correct/total = [(7863, 14232), (9089, 14235), (8490, 14266), (7470, 14217), (7348, 14238), (7247, 14373), (7135, 14346), (7555, 14334), (8843, 14294), (8929, 14373), (7946, 14344), (7215, 14302), (7238, 14354), (7181, 14362), (7138, 14320), (7290, 14395), (7163, 14389), (7055, 14257), (7103, 14251), (7339, 14399)]
         : compromised: 0.5000, honest: 0.5474
Round 009: test acc mean=0.5298 ± 0.0367 | min=0.4968 max=0.6330
         : test loss mean=3154763319143178.5000 ± 6076000855927808.0000
         : individual accs = ['0.544829', '0.633017', '0.582153', '0.523669', '0.499789', '0.496834', '0.507110', '0.538301', '0.584791', '0.587977', '0.520078', '0.514194', '0.504528', '0.506615', '0.508799', '0.502188', '0.507401', '0.517079', '0.505158', '0.512327']
         : correct/total = [(7754, 14232), (9011, 14235), (8305, 14266), (7445, 14217), (7116, 14238), (7141, 14373), (7275, 14346), (7716, 14334), (8359, 14294), (8451, 14373), (7460, 14344), (7354, 14302), (7242, 14354), (7276, 14362), (7286, 14320), (7229, 14395), (7301, 14389), (7372, 14257), (7199, 14251), (7377, 14399)]
         : compromised: 0.5065, honest: 0.5398
Round 010: test acc mean=0.5231 ± 0.0370 | min=0.4872 max=0.6122
         : test loss mean=279288802818956640.0000 ± 505777493677734912.0000
         : individual accs = ['0.527544', '0.595223', '0.564699', '0.500387', '0.499789', '0.508940', '0.502370', '0.519674', '0.599902', '0.612190', '0.520218', '0.506223', '0.487181', '0.510026', '0.487570', '0.502258', '0.507540', '0.504173', '0.506210', '0.499410']
         : correct/total = [(7508, 14232), (8473, 14235), (8056, 14266), (7114, 14217), (7116, 14238), (7315, 14373), (7207, 14346), (7449, 14334), (8575, 14294), (8799, 14373), (7462, 14344), (7240, 14302), (6993, 14354), (7325, 14362), (6982, 14320), (7230, 14395), (7303, 14389), (7188, 14257), (7214, 14251), (7191, 14399)]
         : compromised: 0.5007, honest: 0.5327

=== FINAL RESULTS ===
Dataset: sent140, Nodes: 20, Graph: ring, Aggregation: balance
Attack: backdoor, 30.0% compromised
Final accuracy - Compromised: 0.5007, Honest: 0.5327
Overall test accuracy: mean=0.5231 ± 0.0370

=== BACKDOOR ATTACK SUCCESS RATE (ASR) ===
Target label: 1
Trigger size: 3x3
Overall ASR: 0.4035 ± 0.3375
Honest nodes ASR: 0.2190 ± 0.2080
Compromised nodes ASR: 0.8340 ± 0.1186
Note: Higher ASR indicates more successful backdoor attack

=== BALANCE SUMMARY ===
Node 0: acceptance=1.000
Node 1: acceptance=1.000
Node 2: acceptance=1.000
Node 3: acceptance=1.000
Node 4: acceptance=1.000
Node 5: acceptance=0.600
Node 6: acceptance=1.000
Node 7: acceptance=1.000
Node 8: acceptance=1.000
Node 9: acceptance=1.000
Node 10: acceptance=1.000
Node 11: acceptance=1.000
Node 12: acceptance=0.600
Node 13: acceptance=0.700
Node 14: acceptance=0.600
Node 15: acceptance=0.900
Node 16: acceptance=0.750
Node 17: acceptance=0.600
Node 18: acceptance=0.600
Node 19: acceptance=1.000

=== PARALLEL EXECUTION TIME (realistic for distributed system) ===
  COMMUNICATION (max across nodes):
    - Full model transfer: 0.000s (0.1%)
  COMPUTATION (max across nodes):
    - Filtering: 0.012s (50.5%)
    - Aggregation: 0.012s (49.4%)
  TOTALS:
    - Total computation: 0.024s (99.9%)
    - Total communication: 0.000s (0.1%)
    - Total parallel time: 0.024s

=== PER-NODE AVERAGE TIME ===
  - Filtering: 0.011s
  - Aggregation: 0.005s
  - Model transfer: 0.000s
  - Total per node: 0.016s

=== TOTAL COMPUTATIONAL WORK (sum across all nodes) ===
  - Total filtering: 0.217s
  - Total aggregation: 0.105s
  - Total model transfer: 0.000s
  - Grand total: 0.323s
  - Mean acceptance rate: 0.868

BALANCE Algorithm Properties:
  - Model dimension: 1,174,986
  - No compression: Full parameter comparison
  - Theoretical complexity: O(deg(i)×d)
  - Approach: Full parameter filtering + averaging
