Device: cuda
Seed: 987654321
Loading 1 LEAF Sent140 train files...
LEAF Sent140 train: 254555 users, 908652 samples
Building vocabulary (max_size=10000)...
Vocabulary size: 10000
Loading 1 LEAF Sent140 test files...
LEAF Sent140 test: 254555 users, 286281 samples
Found 254555 train users, 254555 test users, 254555 common users
User sample counts range: 494 (max) to 1 (min)
Distributed ALL 254555 users across 20 clients
Users per client: 12727 (with 15 clients getting +1 user)
Train partition sizes: [44353, 44290, 44657, 44907, 44696, 45843, 45801, 45619, 45069, 45639, 45821, 45311, 45779, 46056, 45625, 45984, 46428, 44737, 45540, 46497]
Test partition sizes: [14232, 14235, 14266, 14217, 14238, 14373, 14346, 14334, 14294, 14373, 14344, 14302, 14354, 14362, 14320, 14395, 14389, 14257, 14251, 14399]
  Client 0: 44353 train samples, 2 unique classes
  Client 1: 44290 train samples, 2 unique classes
  Client 2: 44657 train samples, 2 unique classes
  Client 3: 44907 train samples, 2 unique classes
  Client 4: 44696 train samples, 2 unique classes
  Client 5: 45843 train samples, 2 unique classes
  Client 6: 45801 train samples, 2 unique classes
  Client 7: 45619 train samples, 2 unique classes
  Client 8: 45069 train samples, 2 unique classes
  Client 9: 45639 train samples, 2 unique classes
  Client 10: 45821 train samples, 2 unique classes
  Client 11: 45311 train samples, 2 unique classes
  Client 12: 45779 train samples, 2 unique classes
  Client 13: 46056 train samples, 2 unique classes
  Client 14: 45625 train samples, 2 unique classes
  Client 15: 45984 train samples, 2 unique classes
  Client 16: 46428 train samples, 2 unique classes
  Client 17: 44737 train samples, 2 unique classes
  Client 18: 45540 train samples, 2 unique classes
  Client 19: 46497 train samples, 2 unique classes
Will sample 4500 samples per client per epoch
Graph: fully, nodes: 20, edges: 190
Degree statistics: avg=19.00, min=19, max=19
Attack: Compromised 6/20 nodes: [5, 12, 13, 14, 17, 18]
Attack type: backdoor, lambda: 1.0
Backdoor target label: 1, trigger size: 3
Model variant: baseline
Model parameters: 1,174,986
BALANCE algorithm:
Balance Config: BALANCEConfig(gamma=2, kappa=1, alpha=0.5, min_neighbors=1)
  - Model dimension: 1,174,986 parameters
  - Complexity: O(N×d) = O(20×1,174,986)
Initial test acc across nodes: mean=0.4953 ± 0.0174
Backdoor attack: Created poisoned datasets for 6 compromised nodes
Round 001: test acc mean=0.5023 ± 0.0097 | min=0.4842 max=0.5171
         : test loss mean=12.9606 ± 19.8074
         : individual accs = ['0.485947', '0.487882', '0.484228', '0.497503', '0.494873', '0.516733', '0.510316', '0.515209', '0.499440', '0.504348', '0.503486', '0.493777', '0.517068', '0.510653', '0.510475', '0.506356', '0.505595', '0.506137', '0.503333', '0.493437']
         : correct/total = [(6916, 14232), (6945, 14235), (6908, 14266), (7073, 14217), (7046, 14238), (7427, 14373), (7321, 14346), (7385, 14334), (7139, 14294), (7249, 14373), (7222, 14344), (7062, 14302), (7422, 14354), (7334, 14362), (7310, 14320), (7289, 14395), (7275, 14389), (7216, 14257), (7173, 14251), (7105, 14399)]
         : compromised: 0.5107, honest: 0.4987
Round 002: test acc mean=0.5184 ± 0.0236 | min=0.4933 max=0.5796
         : test loss mean=139.9519 ± 219.7172
         : individual accs = ['0.510469', '0.547945', '0.513669', '0.515088', '0.568830', '0.503096', '0.519099', '0.509418', '0.501819', '0.507897', '0.579615', '0.524892', '0.496377', '0.493316', '0.499511', '0.531087', '0.542428', '0.502280', '0.499333', '0.501910']
         : correct/total = [(7265, 14232), (7800, 14235), (7328, 14266), (7323, 14217), (8099, 14238), (7231, 14373), (7447, 14346), (7302, 14334), (7173, 14294), (7300, 14373), (8314, 14344), (7507, 14302), (7125, 14354), (7085, 14362), (7153, 14320), (7645, 14395), (7805, 14389), (7161, 14257), (7116, 14251), (7227, 14399)]
         : compromised: 0.4990, honest: 0.5267
Round 003: test acc mean=0.5501 ± 0.0475 | min=0.4859 max=0.6124
         : test loss mean=5716.8873 ± 9480.3478
         : individual accs = ['0.599494', '0.597331', '0.598065', '0.601744', '0.508147', '0.507758', '0.505228', '0.608762', '0.502029', '0.612398', '0.569088', '0.571319', '0.495611', '0.487537', '0.485894', '0.570962', '0.592188', '0.505576', '0.495544', '0.586360']
         : correct/total = [(8532, 14232), (8503, 14235), (8532, 14266), (8555, 14217), (7235, 14238), (7298, 14373), (7248, 14346), (8726, 14334), (7176, 14294), (8802, 14373), (8163, 14344), (8171, 14302), (7114, 14354), (7002, 14362), (6958, 14320), (8219, 14395), (8521, 14389), (7208, 14257), (7062, 14251), (8443, 14399)]
         : compromised: 0.4963, honest: 0.5731
Round 004: test acc mean=0.5656 ± 0.0488 | min=0.4934 max=0.6296
         : test loss mean=1938645.4380 ± 3600335.2218
         : individual accs = ['0.613969', '0.596839', '0.587691', '0.616867', '0.602472', '0.498017', '0.629583', '0.578973', '0.559605', '0.528421', '0.586517', '0.620053', '0.505782', '0.500279', '0.506494', '0.627162', '0.594343', '0.494634', '0.493439', '0.571081']
         : correct/total = [(8738, 14232), (8496, 14235), (8384, 14266), (8770, 14217), (8578, 14238), (7158, 14373), (9032, 14346), (8299, 14334), (7999, 14294), (7595, 14373), (8413, 14344), (8868, 14302), (7260, 14354), (7185, 14362), (7253, 14320), (9028, 14395), (8552, 14389), (7052, 14257), (7032, 14251), (8223, 14399)]
         : compromised: 0.4998, honest: 0.5938
Round 005: test acc mean=0.5890 ± 0.0602 | min=0.4932 max=0.6445
         : test loss mean=45696024.6774 ± 73741656.2605
         : individual accs = ['0.623103', '0.606884', '0.632623', '0.640149', '0.642366', '0.505392', '0.639900', '0.598368', '0.644536', '0.579281', '0.637131', '0.641029', '0.493173', '0.493594', '0.507263', '0.636124', '0.643617', '0.501508', '0.502140', '0.611223']
         : correct/total = [(8868, 14232), (8639, 14235), (9025, 14266), (9101, 14217), (9146, 14238), (7264, 14373), (9180, 14346), (8577, 14334), (9213, 14294), (8326, 14373), (9139, 14344), (9168, 14302), (7079, 14354), (7089, 14362), (7264, 14320), (9157, 14395), (9261, 14389), (7150, 14257), (7156, 14251), (8801, 14399)]
         : compromised: 0.5005, honest: 0.6269
Round 006: test acc mean=0.5991 ± 0.0669 | min=0.4834 max=0.6533
         : test loss mean=2575816092.9246 ± 4468954632.4612
         : individual accs = ['0.635680', '0.648613', '0.642997', '0.643385', '0.638081', '0.502400', '0.648822', '0.649226', '0.648594', '0.648577', '0.628207', '0.627884', '0.483419', '0.492202', '0.500140', '0.633484', '0.653277', '0.503682', '0.503473', '0.649490']
         : correct/total = [(9047, 14232), (9233, 14235), (9173, 14266), (9147, 14217), (9085, 14238), (7221, 14373), (9308, 14346), (9306, 14334), (9271, 14294), (9322, 14373), (9011, 14344), (8980, 14302), (6939, 14354), (7069, 14362), (7162, 14320), (9119, 14395), (9400, 14389), (7181, 14257), (7175, 14251), (9352, 14399)]
         : compromised: 0.4976, honest: 0.6426
Round 007: test acc mean=0.6061 ± 0.0664 | min=0.5008 max=0.6592
         : test loss mean=215929003344.7605 ± 359750596185.2625
         : individual accs = ['0.649592', '0.658799', '0.648885', '0.650419', '0.659152', '0.500800', '0.651680', '0.631157', '0.650273', '0.658666', '0.634900', '0.648581', '0.512958', '0.500836', '0.509707', '0.649531', '0.649454', '0.500807', '0.505789', '0.649767']
         : correct/total = [(9245, 14232), (9378, 14235), (9257, 14266), (9247, 14217), (9385, 14238), (7198, 14373), (9349, 14346), (9047, 14334), (9295, 14294), (9467, 14373), (9107, 14344), (9276, 14302), (7363, 14354), (7193, 14362), (7299, 14320), (9350, 14395), (9345, 14389), (7140, 14257), (7208, 14251), (9356, 14399)]
         : compromised: 0.5051, honest: 0.6493
Round 008: test acc mean=0.6105 ± 0.0718 | min=0.4923 max=0.6640
         : test loss mean=26490362805820.5977 ± 46326536994926.4688
         : individual accs = ['0.655776', '0.652687', '0.640824', '0.662657', '0.656693', '0.500313', '0.664018', '0.649016', '0.662866', '0.662423', '0.653932', '0.659139', '0.502717', '0.492271', '0.508799', '0.657381', '0.663076', '0.498773', '0.504456', '0.662685']
         : correct/total = [(9333, 14232), (9291, 14235), (9142, 14266), (9421, 14217), (9350, 14238), (7191, 14373), (9526, 14346), (9303, 14334), (9475, 14294), (9521, 14373), (9380, 14344), (9427, 14302), (7216, 14354), (7070, 14362), (7286, 14320), (9463, 14395), (9541, 14389), (7111, 14257), (7189, 14251), (9542, 14399)]
         : compromised: 0.5012, honest: 0.6574
Round 009: test acc mean=0.6127 ± 0.0709 | min=0.4968 max=0.6693
         : test loss mean=1324348082576582.0000 ± 2084765586535632.0000
         : individual accs = ['0.636242', '0.669336', '0.662064', '0.664697', '0.659081', '0.501357', '0.658372', '0.657876', '0.660627', '0.663745', '0.654211', '0.656482', '0.506200', '0.511698', '0.508869', '0.645919', '0.666620', '0.504875', '0.496807', '0.668380']
         : correct/total = [(9055, 14232), (9528, 14235), (9445, 14266), (9450, 14217), (9384, 14238), (7206, 14373), (9445, 14346), (9430, 14334), (9443, 14294), (9540, 14373), (9384, 14344), (9389, 14302), (7266, 14354), (7349, 14362), (7287, 14320), (9298, 14395), (9592, 14389), (7198, 14257), (7080, 14251), (9624, 14399)]
         : compromised: 0.5050, honest: 0.6588
Round 010: test acc mean=0.6206 ± 0.0760 | min=0.4993 max=0.6764
         : test loss mean=176699612217649632.0000 ± 315091287207650176.0000
         : individual accs = ['0.668423', '0.676431', '0.659260', '0.671239', '0.675516', '0.503305', '0.674334', '0.672597', '0.671331', '0.666597', '0.671152', '0.674102', '0.507872', '0.499861', '0.516969', '0.661271', '0.671972', '0.499264', '0.501719', '0.669630']
         : correct/total = [(9513, 14232), (9629, 14235), (9405, 14266), (9543, 14217), (9618, 14238), (7234, 14373), (9674, 14346), (9641, 14334), (9596, 14294), (9581, 14373), (9627, 14344), (9641, 14302), (7290, 14354), (7179, 14362), (7403, 14320), (9519, 14395), (9669, 14389), (7118, 14257), (7150, 14251), (9642, 14399)]
         : compromised: 0.5048, honest: 0.6703

=== FINAL RESULTS ===
Dataset: sent140, Nodes: 20, Graph: fully, Aggregation: balance
Attack: backdoor, 30.0% compromised
Final accuracy - Compromised: 0.5048, Honest: 0.6703
Overall test accuracy: mean=0.6206 ± 0.0760

=== BACKDOOR ATTACK SUCCESS RATE (ASR) ===
Target label: 1
Trigger size: 3x3
Overall ASR: 0.6189 ± 0.2051
Honest nodes ASR: 0.4958 ± 0.0525
Compromised nodes ASR: 0.9061 ± 0.1265
Note: Higher ASR indicates more successful backdoor attack

=== BALANCE SUMMARY ===
Node 0: acceptance=0.716
Node 1: acceptance=0.716
Node 2: acceptance=0.716
Node 3: acceptance=0.716
Node 4: acceptance=0.716
Node 5: acceptance=0.600
Node 6: acceptance=0.716
Node 7: acceptance=0.716
Node 8: acceptance=0.716
Node 9: acceptance=0.716
Node 10: acceptance=0.716
Node 11: acceptance=0.716
Node 12: acceptance=0.600
Node 13: acceptance=0.600
Node 14: acceptance=0.600
Node 15: acceptance=0.716
Node 16: acceptance=0.716
Node 17: acceptance=0.600
Node 18: acceptance=0.600
Node 19: acceptance=0.716

=== PARALLEL EXECUTION TIME (realistic for distributed system) ===
  COMMUNICATION (max across nodes):
    - Full model transfer: 0.000s (0.0%)
  COMPUTATION (max across nodes):
    - Filtering: 0.076s (81.5%)
    - Aggregation: 0.017s (18.5%)
  TOTALS:
    - Total computation: 0.093s (100.0%)
    - Total communication: 0.000s (0.0%)
    - Total parallel time: 0.093s

=== PER-NODE AVERAGE TIME ===
  - Filtering: 0.074s
  - Aggregation: 0.011s
  - Model transfer: 0.000s
  - Total per node: 0.086s

=== TOTAL COMPUTATIONAL WORK (sum across all nodes) ===
  - Total filtering: 1.487s
  - Total aggregation: 0.223s
  - Total model transfer: 0.000s
  - Grand total: 1.710s
  - Mean acceptance rate: 0.681

BALANCE Algorithm Properties:
  - Model dimension: 1,174,986
  - No compression: Full parameter comparison
  - Theoretical complexity: O(deg(i)×d)
  - Approach: Full parameter filtering + averaging
