Device: cuda
Seed: 987654321
Loading 1 LEAF Sent140 train files...
LEAF Sent140 train: 254555 users, 908652 samples
Building vocabulary (max_size=10000)...
Vocabulary size: 10000
Loading 1 LEAF Sent140 test files...
LEAF Sent140 test: 254555 users, 286281 samples
Found 254555 train users, 254555 test users, 254555 common users
User sample counts range: 494 (max) to 1 (min)
Distributed ALL 254555 users across 20 clients
Users per client: 12727 (with 15 clients getting +1 user)
Train partition sizes: [44353, 44290, 44657, 44907, 44696, 45843, 45801, 45619, 45069, 45639, 45821, 45311, 45779, 46056, 45625, 45984, 46428, 44737, 45540, 46497]
Test partition sizes: [14232, 14235, 14266, 14217, 14238, 14373, 14346, 14334, 14294, 14373, 14344, 14302, 14354, 14362, 14320, 14395, 14389, 14257, 14251, 14399]
  Client 0: 44353 train samples, 2 unique classes
  Client 1: 44290 train samples, 2 unique classes
  Client 2: 44657 train samples, 2 unique classes
  Client 3: 44907 train samples, 2 unique classes
  Client 4: 44696 train samples, 2 unique classes
  Client 5: 45843 train samples, 2 unique classes
  Client 6: 45801 train samples, 2 unique classes
  Client 7: 45619 train samples, 2 unique classes
  Client 8: 45069 train samples, 2 unique classes
  Client 9: 45639 train samples, 2 unique classes
  Client 10: 45821 train samples, 2 unique classes
  Client 11: 45311 train samples, 2 unique classes
  Client 12: 45779 train samples, 2 unique classes
  Client 13: 46056 train samples, 2 unique classes
  Client 14: 45625 train samples, 2 unique classes
  Client 15: 45984 train samples, 2 unique classes
  Client 16: 46428 train samples, 2 unique classes
  Client 17: 44737 train samples, 2 unique classes
  Client 18: 45540 train samples, 2 unique classes
  Client 19: 46497 train samples, 2 unique classes
Will sample 4500 samples per client per epoch
Graph: erdos, nodes: 20, edges: 126
Degree statistics: avg=12.60, min=8, max=16
Attack: Compromised 8/20 nodes: [1, 5, 11, 12, 13, 14, 17, 18]
Attack type: gaussian, lambda: 1.0
Model variant: baseline
Model parameters: 1,174,986
BALANCE algorithm:
Balance Config: BALANCEConfig(gamma=2, kappa=1, alpha=0.5, min_neighbors=1)
  - Model dimension: 1,174,986 parameters
  - Complexity: O(N×d) = O(20×1,174,986)
Initial test acc across nodes: mean=0.4953 ± 0.0174
Round 001: test acc mean=0.5654 ± 0.0398 | min=0.5032 max=0.6298
         : test loss mean=0.6897 ± 0.0009
         : individual accs = ['0.572723', '0.584194', '0.523553', '0.503904', '0.615255', '0.538997', '0.620800', '0.624250', '0.524136', '0.547763', '0.527677', '0.533911', '0.629790', '0.571717', '0.566131', '0.559430', '0.503232', '0.591218', '0.552733', '0.617473']
         : correct/total = [(8151, 14232), (8316, 14235), (7469, 14266), (7164, 14217), (8760, 14238), (7747, 14373), (8906, 14346), (8948, 14334), (7492, 14294), (7873, 14373), (7569, 14344), (7636, 14302), (9040, 14354), (8211, 14362), (8107, 14320), (8053, 14395), (7241, 14389), (8429, 14257), (7877, 14251), (8891, 14399)]
         : compromised: 0.5711, honest: 0.5617
Round 002: test acc mean=0.5676 ± 0.0480 | min=0.4926 max=0.6322
         : test loss mean=0.6898 ± 0.0014
         : individual accs = ['0.623384', '0.527924', '0.603883', '0.541957', '0.525004', '0.514228', '0.516939', '0.632203', '0.533301', '0.627287', '0.591746', '0.598448', '0.502856', '0.625888', '0.492598', '0.591664', '0.570366', '0.612401', '0.614413', '0.505730']
         : correct/total = [(8872, 14232), (7515, 14235), (8615, 14266), (7705, 14217), (7475, 14238), (7391, 14373), (7416, 14346), (9062, 14334), (7623, 14294), (9016, 14373), (8488, 14344), (8559, 14302), (7218, 14354), (8989, 14362), (7054, 14320), (8517, 14395), (8207, 14389), (8731, 14257), (8756, 14251), (7282, 14399)]
         : compromised: 0.5611, honest: 0.5720
Round 003: test acc mean=0.5226 ± 0.0287 | min=0.4860 max=0.5984
         : test loss mean=0.6890 ± 0.0018
         : individual accs = ['0.517496', '0.485985', '0.503224', '0.541957', '0.565669', '0.555138', '0.501394', '0.502721', '0.519379', '0.557086', '0.515756', '0.598448', '0.502856', '0.528687', '0.492598', '0.498298', '0.522621', '0.499053', '0.545997', '0.498090']
         : correct/total = [(7365, 14232), (6918, 14235), (7179, 14266), (7705, 14217), (8054, 14238), (7979, 14373), (7193, 14346), (7206, 14334), (7424, 14294), (8007, 14373), (7398, 14344), (8559, 14302), (7218, 14354), (7593, 14362), (7054, 14320), (7173, 14395), (7520, 14389), (7115, 14257), (7781, 14251), (7172, 14399)]
         : compromised: 0.5261, honest: 0.5203
Round 004: test acc mean=0.5755 ± 0.0385 | min=0.5038 max=0.6258
         : test loss mean=0.6839 ± 0.0028
         : individual accs = ['0.558881', '0.570917', '0.623370', '0.588169', '0.572482', '0.603075', '0.625819', '0.598368', '0.503778', '0.611285', '0.595719', '0.588379', '0.503971', '0.539827', '0.513059', '0.526850', '0.599833', '0.565968', '0.598554', '0.621779']
         : correct/total = [(7954, 14232), (8127, 14235), (8893, 14266), (8362, 14217), (8151, 14238), (8668, 14373), (8978, 14346), (8577, 14334), (7201, 14294), (8786, 14373), (8545, 14344), (8415, 14302), (7234, 14354), (7753, 14362), (7347, 14320), (7584, 14395), (8631, 14389), (8069, 14257), (8530, 14251), (8953, 14399)]
         : compromised: 0.5605, honest: 0.5855
Round 005: test acc mean=0.6273 ± 0.0201 | min=0.5625 max=0.6452
         : test loss mean=0.6713 ± 0.0041
         : individual accs = ['0.639193', '0.639129', '0.627997', '0.637125', '0.645245', '0.628609', '0.640945', '0.634087', '0.629985', '0.603841', '0.639152', '0.639141', '0.590706', '0.562526', '0.618785', '0.643696', '0.617277', '0.639195', '0.628026', '0.641781']
         : correct/total = [(9097, 14232), (9098, 14235), (8959, 14266), (9058, 14217), (9187, 14238), (9035, 14373), (9195, 14346), (9089, 14334), (9005, 14294), (8679, 14373), (9168, 14344), (9141, 14302), (8479, 14354), (8079, 14362), (8861, 14320), (9266, 14395), (8882, 14389), (9113, 14257), (8950, 14251), (9241, 14399)]
         : compromised: 0.6183, honest: 0.6334
Round 006: test acc mean=0.6445 ± 0.0056 | min=0.6297 max=0.6526
         : test loss mean=0.6479 ± 0.0034
         : individual accs = ['0.646220', '0.650650', '0.629749', '0.647394', '0.647984', '0.649412', '0.646243', '0.650691', '0.641388', '0.646977', '0.632529', '0.643826', '0.652640', '0.643991', '0.645601', '0.643765', '0.645493', '0.640738', '0.638692', '0.646364']
         : correct/total = [(9197, 14232), (9262, 14235), (8984, 14266), (9204, 14217), (9226, 14238), (9334, 14373), (9271, 14346), (9327, 14334), (9168, 14294), (9299, 14373), (9073, 14344), (9208, 14302), (9368, 14354), (9249, 14362), (9245, 14320), (9267, 14395), (9288, 14389), (9135, 14257), (9102, 14251), (9307, 14399)]
         : compromised: 0.6457, honest: 0.6437
Round 007: test acc mean=0.6467 ± 0.0086 | min=0.6248 max=0.6588
         : test loss mean=0.6345 ± 0.0049
         : individual accs = ['0.652052', '0.658799', '0.624772', '0.647253', '0.645034', '0.658179', '0.650843', '0.634296', '0.644046', '0.653169', '0.639571', '0.648301', '0.655775', '0.638978', '0.653003', '0.635846', '0.653346', '0.650838', '0.640516', '0.648656']
         : correct/total = [(9280, 14232), (9378, 14235), (8913, 14266), (9202, 14217), (9184, 14238), (9460, 14373), (9337, 14346), (9092, 14334), (9206, 14294), (9388, 14373), (9174, 14344), (9272, 14302), (9413, 14354), (9177, 14362), (9351, 14320), (9153, 14395), (9401, 14389), (9279, 14257), (9128, 14251), (9340, 14399)]
         : compromised: 0.6505, honest: 0.6441
Round 008: test acc mean=0.6543 ± 0.0077 | min=0.6319 max=0.6644
         : test loss mean=0.6263 ± 0.0054
         : individual accs = ['0.656268', '0.650931', '0.631852', '0.658367', '0.653322', '0.664371', '0.657047', '0.643226', '0.661047', '0.662005', '0.650725', '0.659488', '0.652989', '0.657151', '0.648743', '0.661827', '0.656821', '0.658203', '0.643253', '0.658449']
         : correct/total = [(9340, 14232), (9266, 14235), (9014, 14266), (9360, 14217), (9302, 14238), (9549, 14373), (9426, 14346), (9220, 14334), (9449, 14294), (9515, 14373), (9334, 14344), (9432, 14302), (9373, 14354), (9438, 14362), (9290, 14320), (9527, 14395), (9451, 14389), (9384, 14257), (9167, 14251), (9481, 14399)]
         : compromised: 0.6544, honest: 0.6542
Round 009: test acc mean=0.6578 ± 0.0092 | min=0.6255 max=0.6693
         : test loss mean=0.6227 ± 0.0075
         : individual accs = ['0.625492', '0.666245', '0.653932', '0.661180', '0.659573', '0.669311', '0.652307', '0.658365', '0.653841', '0.662770', '0.657348', '0.650748', '0.662603', '0.662651', '0.651257', '0.651893', '0.667941', '0.662482', '0.662971', '0.663727']
         : correct/total = [(8902, 14232), (9484, 14235), (9329, 14266), (9400, 14217), (9391, 14238), (9620, 14373), (9358, 14346), (9437, 14334), (9346, 14294), (9526, 14373), (9429, 14344), (9307, 14302), (9511, 14354), (9517, 14362), (9326, 14320), (9384, 14395), (9611, 14389), (9445, 14257), (9448, 14251), (9557, 14399)]
         : compromised: 0.6610, honest: 0.6557
Round 010: test acc mean=0.6659 ± 0.0091 | min=0.6360 max=0.6753
         : test loss mean=0.6149 ± 0.0082
         : individual accs = ['0.668704', '0.671725', '0.635988', '0.671661', '0.674463', '0.668963', '0.670291', '0.675317', '0.666923', '0.662770', '0.661182', '0.668788', '0.674237', '0.668431', '0.664316', '0.650087', '0.670443', '0.672371', '0.658059', '0.662754']
         : correct/total = [(9517, 14232), (9562, 14235), (9073, 14266), (9549, 14217), (9603, 14238), (9615, 14373), (9616, 14346), (9680, 14334), (9533, 14294), (9526, 14373), (9484, 14344), (9565, 14302), (9678, 14354), (9600, 14362), (9513, 14320), (9358, 14395), (9647, 14389), (9586, 14257), (9378, 14251), (9543, 14399)]
         : compromised: 0.6684, honest: 0.6642

=== FINAL RESULTS ===
Dataset: sent140, Nodes: 20, Graph: erdos, Aggregation: balance
Attack: gaussian, 40.0% compromised
Final accuracy - Compromised: 0.6684, Honest: 0.6642
Overall test accuracy: mean=0.6659 ± 0.0091

=== BALANCE SUMMARY ===
Node 0: acceptance=0.562
Node 1: acceptance=0.727
Node 2: acceptance=0.500
Node 3: acceptance=0.625
Node 4: acceptance=0.545
Node 5: acceptance=0.533
Node 6: acceptance=0.500
Node 7: acceptance=0.500
Node 8: acceptance=0.500
Node 9: acceptance=0.692
Node 10: acceptance=0.556
Node 11: acceptance=0.571
Node 12: acceptance=0.667
Node 13: acceptance=0.692
Node 14: acceptance=0.600
Node 15: acceptance=0.545
Node 16: acceptance=0.538
Node 17: acceptance=0.667
Node 18: acceptance=0.688
Node 19: acceptance=0.500

=== PARALLEL EXECUTION TIME (realistic for distributed system) ===
  COMMUNICATION (max across nodes):
    - Full model transfer: 0.000s (0.0%)
  COMPUTATION (max across nodes):
    - Filtering: 0.072s (82.3%)
    - Aggregation: 0.016s (17.7%)
  TOTALS:
    - Total computation: 0.088s (100.0%)
    - Total communication: 0.000s (0.0%)
    - Total parallel time: 0.088s

=== PER-NODE AVERAGE TIME ===
  - Filtering: 0.051s
  - Aggregation: 0.008s
  - Model transfer: 0.000s
  - Total per node: 0.059s

=== TOTAL COMPUTATIONAL WORK (sum across all nodes) ===
  - Total filtering: 1.014s
  - Total aggregation: 0.162s
  - Total model transfer: 0.000s
  - Grand total: 1.176s
  - Mean acceptance rate: 0.585

BALANCE Algorithm Properties:
  - Model dimension: 1,174,986
  - No compression: Full parameter comparison
  - Theoretical complexity: O(deg(i)×d)
  - Approach: Full parameter filtering + averaging
