Device: cuda
Seed: 987654321
Loading 1 LEAF Sent140 train files...
LEAF Sent140 train: 254555 users, 908652 samples
Building vocabulary (max_size=10000)...
Vocabulary size: 10000
Loading 1 LEAF Sent140 test files...
LEAF Sent140 test: 254555 users, 286281 samples
Found 254555 train users, 254555 test users, 254555 common users
User sample counts range: 494 (max) to 1 (min)
Distributed ALL 254555 users across 20 clients
Users per client: 12727 (with 15 clients getting +1 user)
Train partition sizes: [44353, 44290, 44657, 44907, 44696, 45843, 45801, 45619, 45069, 45639, 45821, 45311, 45779, 46056, 45625, 45984, 46428, 44737, 45540, 46497]
Test partition sizes: [14232, 14235, 14266, 14217, 14238, 14373, 14346, 14334, 14294, 14373, 14344, 14302, 14354, 14362, 14320, 14395, 14389, 14257, 14251, 14399]
  Client 0: 44353 train samples, 2 unique classes
  Client 1: 44290 train samples, 2 unique classes
  Client 2: 44657 train samples, 2 unique classes
  Client 3: 44907 train samples, 2 unique classes
  Client 4: 44696 train samples, 2 unique classes
  Client 5: 45843 train samples, 2 unique classes
  Client 6: 45801 train samples, 2 unique classes
  Client 7: 45619 train samples, 2 unique classes
  Client 8: 45069 train samples, 2 unique classes
  Client 9: 45639 train samples, 2 unique classes
  Client 10: 45821 train samples, 2 unique classes
  Client 11: 45311 train samples, 2 unique classes
  Client 12: 45779 train samples, 2 unique classes
  Client 13: 46056 train samples, 2 unique classes
  Client 14: 45625 train samples, 2 unique classes
  Client 15: 45984 train samples, 2 unique classes
  Client 16: 46428 train samples, 2 unique classes
  Client 17: 44737 train samples, 2 unique classes
  Client 18: 45540 train samples, 2 unique classes
  Client 19: 46497 train samples, 2 unique classes
Will sample 4500 samples per client per epoch
Graph: ring, nodes: 20, edges: 20
Degree statistics: avg=2.00, min=2, max=2
Attack: Compromised 10/20 nodes: [1, 2, 5, 11, 12, 13, 14, 15, 17, 18]
Attack type: krum, lambda: 1.0
Model variant: baseline
Model parameters: 1,174,986
BALANCE algorithm:
Balance Config: BALANCEConfig(gamma=2, kappa=1, alpha=0.5, min_neighbors=1)
  - Model dimension: 1,174,986 parameters
  - Complexity: O(N×d) = O(20×1,174,986)
Initial test acc across nodes: mean=0.4953 ± 0.0174
Round 001: test acc mean=0.5063 ± 0.0252 | min=0.4806 max=0.5765
         : test loss mean=2.5946 ± 2.9621
         : individual accs = ['0.480607', '0.515982', '0.494953', '0.519378', '0.497682', '0.508592', '0.500139', '0.576531', '0.501189', '0.572254', '0.482641', '0.507272', '0.490456', '0.492898', '0.516550', '0.485446', '0.508096', '0.490847', '0.491895', '0.491909']
         : correct/total = [(6840, 14232), (7345, 14235), (7061, 14266), (7384, 14217), (7086, 14238), (7310, 14373), (7175, 14346), (8264, 14334), (7164, 14294), (8225, 14373), (6923, 14344), (7255, 14302), (7040, 14354), (7079, 14362), (7397, 14320), (6988, 14395), (7311, 14389), (6998, 14257), (7010, 14251), (7083, 14399)]
         : compromised: 0.4995, honest: 0.5130
Round 002: test acc mean=0.5059 ± 0.0285 | min=0.4764 max=0.6241
         : test loss mean=1.5022 ± 1.1851
         : individual accs = ['0.505551', '0.502424', '0.505187', '0.502778', '0.512361', '0.504557', '0.476370', '0.493024', '0.624108', '0.508105', '0.503207', '0.497763', '0.489898', '0.494082', '0.497835', '0.511567', '0.483355', '0.504244', '0.503544', '0.497118']
         : correct/total = [(7195, 14232), (7152, 14235), (7207, 14266), (7148, 14217), (7295, 14238), (7252, 14373), (6834, 14346), (7067, 14334), (8921, 14294), (7303, 14373), (7218, 14344), (7119, 14302), (7032, 14354), (7096, 14362), (7129, 14320), (7364, 14395), (6955, 14389), (7189, 14257), (7176, 14251), (7158, 14399)]
         : compromised: 0.5011, honest: 0.5106
Round 003: test acc mean=0.5065 ± 0.0178 | min=0.4814 max=0.5519
         : test loss mean=0.9331 ± 0.4124
         : individual accs = ['0.518198', '0.494064', '0.488084', '0.504818', '0.506532', '0.482502', '0.513593', '0.524766', '0.542465', '0.551938', '0.511712', '0.505454', '0.505852', '0.500418', '0.508729', '0.499201', '0.493919', '0.485937', '0.481370', '0.510244']
         : correct/total = [(7375, 14232), (7033, 14235), (6963, 14266), (7177, 14217), (7212, 14238), (6935, 14373), (7368, 14346), (7522, 14334), (7754, 14294), (7933, 14373), (7340, 14344), (7229, 14302), (7261, 14354), (7187, 14362), (7285, 14320), (7186, 14395), (7107, 14389), (6928, 14257), (6860, 14251), (7347, 14399)]
         : compromised: 0.4952, honest: 0.5178
Round 004: test acc mean=0.5551 ± 0.0447 | min=0.4929 max=0.6243
         : test loss mean=0.9980 ± 0.6420
         : individual accs = ['0.573848', '0.573446', '0.550119', '0.548709', '0.558014', '0.559660', '0.609020', '0.624250', '0.600532', '0.619843', '0.604713', '0.590057', '0.497004', '0.497424', '0.501536', '0.498923', '0.506081', '0.492881', '0.512736', '0.583096']
         : correct/total = [(8167, 14232), (8163, 14235), (7848, 14266), (7801, 14217), (7945, 14238), (8044, 14373), (8737, 14346), (8948, 14334), (8584, 14294), (8909, 14373), (8674, 14344), (8439, 14302), (7134, 14354), (7144, 14362), (7182, 14320), (7182, 14395), (7282, 14389), (7027, 14257), (7307, 14251), (8396, 14399)]
         : compromised: 0.5274, honest: 0.5828
Round 005: test acc mean=0.5755 ± 0.0494 | min=0.4756 max=0.6406
         : test loss mean=0.8292 ± 0.2836
         : individual accs = ['0.588041', '0.594380', '0.581452', '0.568896', '0.577118', '0.601058', '0.632023', '0.628296', '0.623129', '0.640646', '0.633993', '0.624878', '0.517277', '0.475561', '0.521858', '0.507329', '0.523038', '0.502209', '0.580170', '0.589346']
         : correct/total = [(8369, 14232), (8461, 14235), (8295, 14266), (8088, 14217), (8217, 14238), (8639, 14373), (9067, 14346), (9006, 14334), (8907, 14294), (9208, 14373), (9094, 14344), (8937, 14302), (7425, 14354), (6830, 14362), (7473, 14320), (7303, 14395), (7526, 14389), (7160, 14257), (8268, 14251), (8486, 14399)]
         : compromised: 0.5506, honest: 0.6005
Round 006: test acc mean=0.5849 ± 0.0547 | min=0.4969 max=0.6504
         : test loss mean=0.9187 ± 0.5273
         : individual accs = ['0.602164', '0.605901', '0.601150', '0.591616', '0.599874', '0.589717', '0.648613', '0.650412', '0.637400', '0.640854', '0.641035', '0.641169', '0.496865', '0.507868', '0.507053', '0.518374', '0.498992', '0.509644', '0.603958', '0.605667']
         : correct/total = [(8570, 14232), (8625, 14235), (8576, 14266), (8411, 14217), (8541, 14238), (8476, 14373), (9305, 14346), (9323, 14334), (9111, 14294), (9211, 14373), (9195, 14344), (9170, 14302), (7132, 14354), (7294, 14362), (7261, 14320), (7462, 14395), (7180, 14389), (7266, 14257), (8607, 14251), (8721, 14399)]
         : compromised: 0.5582, honest: 0.6117
Round 007: test acc mean=0.5913 ± 0.0539 | min=0.5031 max=0.6537
         : test loss mean=0.7787 ± 0.2526
         : individual accs = ['0.611369', '0.611942', '0.601220', '0.609482', '0.611954', '0.565226', '0.653701', '0.646086', '0.644046', '0.651082', '0.646821', '0.649490', '0.506967', '0.520192', '0.503142', '0.518652', '0.521093', '0.522831', '0.611676', '0.619418']
         : correct/total = [(8701, 14232), (8711, 14235), (8577, 14266), (8665, 14217), (8713, 14238), (8124, 14373), (9378, 14346), (9261, 14334), (9206, 14294), (9358, 14373), (9278, 14344), (9289, 14302), (7277, 14354), (7471, 14362), (7205, 14320), (7466, 14395), (7498, 14389), (7454, 14257), (8717, 14251), (8919, 14399)]
         : compromised: 0.5611, honest: 0.6215
Round 008: test acc mean=0.5948 ± 0.0608 | min=0.4973 max=0.6568
         : test loss mean=0.8848 ± 0.4737
         : individual accs = ['0.618606', '0.621005', '0.614818', '0.608638', '0.615114', '0.656091', '0.640736', '0.638482', '0.646005', '0.654561', '0.656023', '0.656761', '0.509475', '0.505501', '0.502304', '0.501146', '0.512892', '0.497300', '0.617360', '0.623932']
         : correct/total = [(8804, 14232), (8840, 14235), (8771, 14266), (8653, 14217), (8758, 14238), (9430, 14373), (9192, 14346), (9152, 14334), (9234, 14294), (9408, 14373), (9410, 14344), (9393, 14302), (7313, 14354), (7260, 14362), (7193, 14320), (7214, 14395), (7380, 14389), (7090, 14257), (8798, 14251), (8984, 14399)]
         : compromised: 0.5682, honest: 0.6215
Round 009: test acc mean=0.5923 ± 0.0627 | min=0.4852 max=0.6581
         : test loss mean=0.8190 ± 0.3169
         : individual accs = ['0.627530', '0.622058', '0.619305', '0.620454', '0.622208', '0.658109', '0.624425', '0.637994', '0.632923', '0.636680', '0.636573', '0.656272', '0.510171', '0.485169', '0.499930', '0.489337', '0.495934', '0.507680', '0.630622', '0.632613']
         : correct/total = [(8931, 14232), (8855, 14235), (8835, 14266), (8821, 14217), (8859, 14238), (9459, 14373), (8958, 14346), (9145, 14334), (9047, 14294), (9151, 14373), (9131, 14344), (9386, 14302), (7323, 14354), (6968, 14362), (7159, 14320), (7044, 14395), (7136, 14389), (7238, 14257), (8987, 14251), (9109, 14399)]
         : compromised: 0.5679, honest: 0.6167
Round 010: test acc mean=0.6050 ± 0.0652 | min=0.4987 max=0.6715
         : test loss mean=0.8957 ± 0.5258
         : individual accs = ['0.633713', '0.634352', '0.622809', '0.619681', '0.625790', '0.671467', '0.666318', '0.666806', '0.652162', '0.657552', '0.659858', '0.663054', '0.516232', '0.502019', '0.505377', '0.498715', '0.508791', '0.516799', '0.635675', '0.642058']
         : correct/total = [(9019, 14232), (9030, 14235), (8885, 14266), (8810, 14217), (8910, 14238), (9651, 14373), (9559, 14346), (9558, 14334), (9322, 14294), (9451, 14373), (9465, 14344), (9483, 14302), (7410, 14354), (7210, 14362), (7237, 14320), (7179, 14395), (7321, 14389), (7368, 14257), (9059, 14251), (9245, 14399)]
         : compromised: 0.5766, honest: 0.6333

=== FINAL RESULTS ===
Dataset: sent140, Nodes: 20, Graph: ring, Aggregation: balance
Attack: krum, 50.0% compromised
Final accuracy - Compromised: 0.5766, Honest: 0.6333
Overall test accuracy: mean=0.6050 ± 0.0652

=== BALANCE SUMMARY ===
Node 0: acceptance=0.600
Node 1: acceptance=0.550
Node 2: acceptance=0.550
Node 3: acceptance=0.600
Node 4: acceptance=0.600
Node 5: acceptance=0.800
Node 6: acceptance=0.600
Node 7: acceptance=1.000
Node 8: acceptance=1.000
Node 9: acceptance=1.000
Node 10: acceptance=0.600
Node 11: acceptance=0.550
Node 12: acceptance=0.200
Node 13: acceptance=0.200
Node 14: acceptance=0.200
Node 15: acceptance=0.600
Node 16: acceptance=0.100
Node 17: acceptance=0.600
Node 18: acceptance=0.600
Node 19: acceptance=0.600

=== PARALLEL EXECUTION TIME (realistic for distributed system) ===
  COMMUNICATION (max across nodes):
    - Full model transfer: 0.000s (0.1%)
  COMPUTATION (max across nodes):
    - Filtering: 0.012s (52.4%)
    - Aggregation: 0.011s (47.5%)
  TOTALS:
    - Total computation: 0.023s (99.9%)
    - Total communication: 0.000s (0.1%)
    - Total parallel time: 0.023s

=== PER-NODE AVERAGE TIME ===
  - Filtering: 0.011s
  - Aggregation: 0.005s
  - Model transfer: 0.000s
  - Total per node: 0.016s

=== TOTAL COMPUTATIONAL WORK (sum across all nodes) ===
  - Total filtering: 0.218s
  - Total aggregation: 0.098s
  - Total model transfer: 0.000s
  - Grand total: 0.316s
  - Mean acceptance rate: 0.577

BALANCE Algorithm Properties:
  - Model dimension: 1,174,986
  - No compression: Full parameter comparison
  - Theoretical complexity: O(deg(i)×d)
  - Approach: Full parameter filtering + averaging
