Device: cuda
Seed: 987654321
Loading 1 LEAF Sent140 train files...
LEAF Sent140 train: 254555 users, 908652 samples
Building vocabulary (max_size=10000)...
Vocabulary size: 10000
Loading 1 LEAF Sent140 test files...
LEAF Sent140 test: 254555 users, 286281 samples
Found 254555 train users, 254555 test users, 254555 common users
User sample counts range: 494 (max) to 1 (min)
Distributed ALL 254555 users across 20 clients
Users per client: 12727 (with 15 clients getting +1 user)
Train partition sizes: [44353, 44290, 44657, 44907, 44696, 45843, 45801, 45619, 45069, 45639, 45821, 45311, 45779, 46056, 45625, 45984, 46428, 44737, 45540, 46497]
Test partition sizes: [14232, 14235, 14266, 14217, 14238, 14373, 14346, 14334, 14294, 14373, 14344, 14302, 14354, 14362, 14320, 14395, 14389, 14257, 14251, 14399]
  Client 0: 44353 train samples, 2 unique classes
  Client 1: 44290 train samples, 2 unique classes
  Client 2: 44657 train samples, 2 unique classes
  Client 3: 44907 train samples, 2 unique classes
  Client 4: 44696 train samples, 2 unique classes
  Client 5: 45843 train samples, 2 unique classes
  Client 6: 45801 train samples, 2 unique classes
  Client 7: 45619 train samples, 2 unique classes
  Client 8: 45069 train samples, 2 unique classes
  Client 9: 45639 train samples, 2 unique classes
  Client 10: 45821 train samples, 2 unique classes
  Client 11: 45311 train samples, 2 unique classes
  Client 12: 45779 train samples, 2 unique classes
  Client 13: 46056 train samples, 2 unique classes
  Client 14: 45625 train samples, 2 unique classes
  Client 15: 45984 train samples, 2 unique classes
  Client 16: 46428 train samples, 2 unique classes
  Client 17: 44737 train samples, 2 unique classes
  Client 18: 45540 train samples, 2 unique classes
  Client 19: 46497 train samples, 2 unique classes
Will sample 4500 samples per client per epoch
Graph: erdos, nodes: 20, edges: 126
Degree statistics: avg=12.60, min=8, max=16
Attack: Compromised 12/20 nodes: [1, 2, 3, 5, 8, 11, 12, 13, 14, 15, 17, 18]
Attack type: gaussian, lambda: 1.0
Model variant: baseline
Model parameters: 1,174,986
BALANCE algorithm:
Balance Config: BALANCEConfig(gamma=2, kappa=1, alpha=0.5, min_neighbors=1)
  - Model dimension: 1,174,986 parameters
  - Complexity: O(N×d) = O(20×1,174,986)
Initial test acc across nodes: mean=0.4953 ± 0.0174
Round 001: test acc mean=0.5633 ± 0.0362 | min=0.5013 max=0.6238
         : test loss mean=0.6898 ± 0.0008
         : individual accs = ['0.582279', '0.567896', '0.523132', '0.501301', '0.623753', '0.553677', '0.602956', '0.613158', '0.517910', '0.575384', '0.538204', '0.536778', '0.616135', '0.557374', '0.553841', '0.559291', '0.509695', '0.591218', '0.537436', '0.604973']
         : correct/total = [(8287, 14232), (8084, 14235), (7463, 14266), (7127, 14217), (8881, 14238), (7958, 14373), (8650, 14346), (8789, 14334), (7403, 14294), (8270, 14373), (7720, 14344), (7677, 14302), (8844, 14354), (8005, 14362), (7931, 14320), (8051, 14395), (7334, 14389), (8429, 14257), (7659, 14251), (8711, 14399)]
         : compromised: 0.5513, honest: 0.5813
Round 002: test acc mean=0.5677 ± 0.0430 | min=0.4926 max=0.6292
         : test loss mean=0.6891 ± 0.0017
         : individual accs = ['0.622189', '0.493010', '0.584537', '0.608427', '0.517418', '0.549572', '0.523909', '0.610367', '0.594305', '0.629166', '0.616216', '0.574815', '0.503274', '0.613076', '0.492598', '0.577909', '0.574675', '0.540787', '0.575609', '0.553094']
         : correct/total = [(8855, 14232), (7018, 14235), (8339, 14266), (8650, 14217), (7367, 14238), (7899, 14373), (7516, 14346), (8749, 14334), (8495, 14294), (9043, 14373), (8839, 14344), (8221, 14302), (7224, 14354), (8805, 14362), (7054, 14320), (8319, 14395), (8269, 14389), (7710, 14257), (8203, 14251), (7964, 14399)]
         : compromised: 0.5590, honest: 0.5809
Round 003: test acc mean=0.5495 ± 0.0517 | min=0.4876 max=0.6365
         : test loss mean=0.6852 ± 0.0037
         : individual accs = ['0.534289', '0.487601', '0.495864', '0.541535', '0.626914', '0.553538', '0.512129', '0.528952', '0.624878', '0.626870', '0.505159', '0.602993', '0.514839', '0.549088', '0.494204', '0.500799', '0.636528', '0.525987', '0.622904', '0.504202']
         : correct/total = [(7604, 14232), (6941, 14235), (7074, 14266), (7699, 14217), (8926, 14238), (7956, 14373), (7347, 14346), (7582, 14334), (8932, 14294), (9010, 14373), (7246, 14344), (8624, 14302), (7390, 14354), (7886, 14362), (7077, 14320), (7209, 14395), (9159, 14389), (7499, 14257), (8877, 14251), (7260, 14399)]
         : compromised: 0.5429, honest: 0.5594
Round 004: test acc mean=0.6300 ± 0.0114 | min=0.6039 max=0.6449
         : test loss mean=0.6689 ± 0.0041
         : individual accs = ['0.637648', '0.626344', '0.613767', '0.635929', '0.637730', '0.639393', '0.637808', '0.631994', '0.622289', '0.615251', '0.634621', '0.636764', '0.603873', '0.635079', '0.636872', '0.636540', '0.644173', '0.614645', '0.614764', '0.644906']
         : correct/total = [(9075, 14232), (8916, 14235), (8756, 14266), (9041, 14217), (9080, 14238), (9190, 14373), (9150, 14346), (9059, 14334), (8895, 14294), (8843, 14373), (9103, 14344), (9107, 14302), (8668, 14354), (9121, 14362), (9120, 14320), (9163, 14395), (9269, 14389), (8763, 14257), (8761, 14251), (9286, 14399)]
         : compromised: 0.6264, honest: 0.6355
Round 005: test acc mean=0.6424 ± 0.0036 | min=0.6361 max=0.6483
         : test loss mean=0.6468 ± 0.0034
         : individual accs = ['0.643620', '0.643063', '0.636408', '0.640993', '0.647071', '0.648299', '0.643106', '0.647482', '0.643557', '0.636054', '0.640059', '0.644246', '0.641563', '0.640231', '0.640782', '0.639736', '0.647925', '0.641369', '0.636587', '0.645600']
         : correct/total = [(9160, 14232), (9154, 14235), (9079, 14266), (9113, 14217), (9213, 14238), (9318, 14373), (9226, 14346), (9281, 14334), (9199, 14294), (9142, 14373), (9181, 14344), (9214, 14302), (9209, 14354), (9195, 14362), (9176, 14320), (9209, 14395), (9323, 14389), (9144, 14257), (9072, 14251), (9296, 14399)]
         : compromised: 0.6414, honest: 0.6439
Round 006: test acc mean=0.6476 ± 0.0044 | min=0.6393 max=0.6525
         : test loss mean=0.6330 ± 0.0025
         : individual accs = ['0.650225', '0.650861', '0.639282', '0.650278', '0.650864', '0.652126', '0.649868', '0.651737', '0.643697', '0.644959', '0.639361', '0.640819', '0.648739', '0.649352', '0.648534', '0.646266', '0.651817', '0.649435', '0.641078', '0.652545']
         : correct/total = [(9254, 14232), (9265, 14235), (9120, 14266), (9245, 14217), (9267, 14238), (9373, 14373), (9323, 14346), (9342, 14334), (9201, 14294), (9270, 14373), (9171, 14344), (9165, 14302), (9312, 14354), (9326, 14362), (9287, 14320), (9303, 14395), (9379, 14389), (9259, 14257), (9136, 14251), (9396, 14399)]
         : compromised: 0.6467, honest: 0.6489
Round 007: test acc mean=0.6504 ± 0.0075 | min=0.6314 max=0.6597
         : test loss mean=0.6282 ± 0.0057
         : individual accs = ['0.653457', '0.655076', '0.634446', '0.651825', '0.655429', '0.659500', '0.652168', '0.636947', '0.652931', '0.654143', '0.648912', '0.652986', '0.659677', '0.647612', '0.652304', '0.631400', '0.656821', '0.651119', '0.646972', '0.654212']
         : correct/total = [(9300, 14232), (9325, 14235), (9051, 14266), (9267, 14217), (9332, 14238), (9479, 14373), (9356, 14346), (9130, 14334), (9333, 14294), (9402, 14373), (9308, 14344), (9339, 14302), (9469, 14354), (9301, 14362), (9341, 14320), (9089, 14395), (9451, 14389), (9283, 14257), (9220, 14251), (9420, 14399)]
         : compromised: 0.6497, honest: 0.6515
Round 008: test acc mean=0.6559 ± 0.0062 | min=0.6344 max=0.6644
         : test loss mean=0.6238 ± 0.0051
         : individual accs = ['0.656478', '0.658939', '0.634446', '0.660547', '0.648546', '0.664440', '0.660114', '0.660248', '0.658038', '0.657900', '0.650307', '0.652776', '0.660791', '0.654783', '0.655307', '0.655297', '0.656960', '0.657922', '0.652305', '0.660949']
         : correct/total = [(9343, 14232), (9380, 14235), (9051, 14266), (9391, 14217), (9234, 14238), (9550, 14373), (9470, 14346), (9464, 14334), (9406, 14294), (9456, 14373), (9328, 14344), (9336, 14302), (9485, 14354), (9404, 14362), (9384, 14320), (9433, 14395), (9453, 14389), (9380, 14257), (9296, 14251), (9517, 14399)]
         : compromised: 0.6555, honest: 0.6564
Round 009: test acc mean=0.6565 ± 0.0070 | min=0.6384 max=0.6662
         : test loss mean=0.6227 ± 0.0062
         : individual accs = ['0.638420', '0.663365', '0.654423', '0.656397', '0.657115', '0.666249', '0.647707', '0.654388', '0.654051', '0.648229', '0.658463', '0.649140', '0.665807', '0.663208', '0.650559', '0.655644', '0.664535', '0.662201', '0.659182', '0.661296']
         : correct/total = [(9086, 14232), (9443, 14235), (9336, 14266), (9332, 14217), (9356, 14238), (9576, 14373), (9292, 14346), (9380, 14334), (9349, 14294), (9317, 14373), (9445, 14344), (9284, 14302), (9557, 14354), (9525, 14362), (9316, 14320), (9438, 14395), (9562, 14389), (9441, 14257), (9394, 14251), (9522, 14399)]
         : compromised: 0.6584, honest: 0.6538
Round 010: test acc mean=0.6660 ± 0.0062 | min=0.6443 max=0.6739
         : test loss mean=0.6139 ± 0.0048
         : individual accs = ['0.665823', '0.668985', '0.644259', '0.669058', '0.670600', '0.669519', '0.671407', '0.672945', '0.667133', '0.663953', '0.663622', '0.665082', '0.673889', '0.662860', '0.663687', '0.661202', '0.667941', '0.670969', '0.660445', '0.667199']
         : correct/total = [(9476, 14232), (9523, 14235), (9191, 14266), (9512, 14217), (9548, 14238), (9623, 14373), (9632, 14346), (9646, 14334), (9536, 14294), (9543, 14373), (9519, 14344), (9512, 14302), (9673, 14354), (9520, 14362), (9504, 14320), (9518, 14395), (9611, 14389), (9566, 14257), (9412, 14251), (9607, 14399)]
         : compromised: 0.6648, honest: 0.6679

=== FINAL RESULTS ===
Dataset: sent140, Nodes: 20, Graph: erdos, Aggregation: balance
Attack: gaussian, 60.0% compromised
Final accuracy - Compromised: 0.6648, Honest: 0.6679
Overall test accuracy: mean=0.6660 ± 0.0062

=== BALANCE SUMMARY ===
Node 0: acceptance=0.438
Node 1: acceptance=0.545
Node 2: acceptance=0.417
Node 3: acceptance=0.500
Node 4: acceptance=0.455
Node 5: acceptance=0.400
Node 6: acceptance=0.357
Node 7: acceptance=0.357
Node 8: acceptance=0.300
Node 9: acceptance=0.462
Node 10: acceptance=0.444
Node 11: acceptance=0.429
Node 12: acceptance=0.500
Node 13: acceptance=0.385
Node 14: acceptance=0.400
Node 15: acceptance=0.364
Node 16: acceptance=0.308
Node 17: acceptance=0.667
Node 18: acceptance=0.438
Node 19: acceptance=0.375

=== PARALLEL EXECUTION TIME (realistic for distributed system) ===
  COMMUNICATION (max across nodes):
    - Full model transfer: 0.000s (0.0%)
  COMPUTATION (max across nodes):
    - Filtering: 0.073s (83.9%)
    - Aggregation: 0.014s (16.0%)
  TOTALS:
    - Total computation: 0.087s (100.0%)
    - Total communication: 0.000s (0.0%)
    - Total parallel time: 0.087s

=== PER-NODE AVERAGE TIME ===
  - Filtering: 0.051s
  - Aggregation: 0.007s
  - Model transfer: 0.000s
  - Total per node: 0.058s

=== TOTAL COMPUTATIONAL WORK (sum across all nodes) ===
  - Total filtering: 1.026s
  - Total aggregation: 0.141s
  - Total model transfer: 0.000s
  - Grand total: 1.167s
  - Mean acceptance rate: 0.427

BALANCE Algorithm Properties:
  - Model dimension: 1,174,986
  - No compression: Full parameter comparison
  - Theoretical complexity: O(deg(i)×d)
  - Approach: Full parameter filtering + averaging
