Device: cuda
Seed: 987654321
Loading 1 LEAF Sent140 train files...
LEAF Sent140 train: 254555 users, 908652 samples
Building vocabulary (max_size=10000)...
Vocabulary size: 10000
Loading 1 LEAF Sent140 test files...
LEAF Sent140 test: 254555 users, 286281 samples
Found 254555 train users, 254555 test users, 254555 common users
User sample counts range: 494 (max) to 1 (min)
Distributed ALL 254555 users across 20 clients
Users per client: 12727 (with 15 clients getting +1 user)
Train partition sizes: [44353, 44290, 44657, 44907, 44696, 45843, 45801, 45619, 45069, 45639, 45821, 45311, 45779, 46056, 45625, 45984, 46428, 44737, 45540, 46497]
Test partition sizes: [14232, 14235, 14266, 14217, 14238, 14373, 14346, 14334, 14294, 14373, 14344, 14302, 14354, 14362, 14320, 14395, 14389, 14257, 14251, 14399]
  Client 0: 44353 train samples, 2 unique classes
  Client 1: 44290 train samples, 2 unique classes
  Client 2: 44657 train samples, 2 unique classes
  Client 3: 44907 train samples, 2 unique classes
  Client 4: 44696 train samples, 2 unique classes
  Client 5: 45843 train samples, 2 unique classes
  Client 6: 45801 train samples, 2 unique classes
  Client 7: 45619 train samples, 2 unique classes
  Client 8: 45069 train samples, 2 unique classes
  Client 9: 45639 train samples, 2 unique classes
  Client 10: 45821 train samples, 2 unique classes
  Client 11: 45311 train samples, 2 unique classes
  Client 12: 45779 train samples, 2 unique classes
  Client 13: 46056 train samples, 2 unique classes
  Client 14: 45625 train samples, 2 unique classes
  Client 15: 45984 train samples, 2 unique classes
  Client 16: 46428 train samples, 2 unique classes
  Client 17: 44737 train samples, 2 unique classes
  Client 18: 45540 train samples, 2 unique classes
  Client 19: 46497 train samples, 2 unique classes
Will sample 4500 samples per client per epoch
Graph: fully, nodes: 20, edges: 190
Degree statistics: avg=19.00, min=19, max=19
Attack: Compromised 4/20 nodes: [5, 12, 13, 17]
Attack type: backdoor, lambda: 1.0
Backdoor target label: 1, trigger size: 3
Model variant: baseline
Model parameters: 1,174,986
Initial test acc across nodes: mean=0.4953 ± 0.0174
Backdoor attack: Created poisoned datasets for 4 compromised nodes
Round 001: test acc mean=0.4984 ± 0.0063 | min=0.4842 max=0.5086
         : test loss mean=1.0910 ± 0.2320
         : individual accs = ['0.503373', '0.489498', '0.484158', '0.489273', '0.491150', '0.505740', '0.499094', '0.498186', '0.497272', '0.499269', '0.501673', '0.490071', '0.496099', '0.508564', '0.501746', '0.501494', '0.503788', '0.499053', '0.503123', '0.504618']
         : correct/total = [(7164, 14232), (6968, 14235), (6907, 14266), (6956, 14217), (6993, 14238), (7269, 14373), (7160, 14346), (7141, 14334), (7108, 14294), (7176, 14373), (7196, 14344), (7009, 14302), (7121, 14354), (7304, 14362), (7185, 14320), (7219, 14395), (7249, 14389), (7115, 14257), (7170, 14251), (7266, 14399)]
         : compromised: 0.5024, honest: 0.4974
Round 002: test acc mean=0.4841 ± 0.0042 | min=0.4754 max=0.4948
         : test loss mean=1.0211 ± 0.0056
         : individual accs = ['0.486580', '0.475378', '0.480233', '0.494830', '0.483144', '0.483546', '0.482922', '0.480675', '0.482790', '0.478397', '0.480340', '0.487275', '0.485022', '0.486353', '0.486522', '0.488781', '0.486344', '0.480396', '0.488246', '0.483297']
         : correct/total = [(6925, 14232), (6767, 14235), (6851, 14266), (7035, 14217), (6879, 14238), (6950, 14373), (6928, 14346), (6890, 14334), (6901, 14294), (6876, 14373), (6890, 14344), (6969, 14302), (6962, 14354), (6985, 14362), (6967, 14320), (7036, 14395), (6998, 14389), (6849, 14257), (6958, 14251), (6959, 14399)]
         : compromised: 0.4838, honest: 0.4841
Round 003: test acc mean=0.4942 ± 0.0052 | min=0.4856 max=0.5093
         : test loss mean=0.7506 ± 0.0038
         : individual accs = ['0.490866', '0.485634', '0.493902', '0.488992', '0.489886', '0.494121', '0.501394', '0.488070', '0.501399', '0.492034', '0.494074', '0.491120', '0.498467', '0.509261', '0.495112', '0.494199', '0.493085', '0.491548', '0.496035', '0.495312']
         : correct/total = [(6986, 14232), (6913, 14235), (7046, 14266), (6952, 14217), (6975, 14238), (7102, 14373), (7193, 14346), (6996, 14334), (7167, 14294), (7072, 14373), (7087, 14344), (7024, 14302), (7155, 14354), (7314, 14362), (7090, 14320), (7114, 14395), (7095, 14389), (7008, 14257), (7069, 14251), (7132, 14399)]
         : compromised: 0.4983, honest: 0.4932
Round 004: test acc mean=0.4949 ± 0.0055 | min=0.4831 max=0.5068
         : test loss mean=1.1772 ± 0.0121
         : individual accs = ['0.492622', '0.483105', '0.486962', '0.484983', '0.494522', '0.495860', '0.499791', '0.492745', '0.498181', '0.495234', '0.498397', '0.493847', '0.502856', '0.506824', '0.492598', '0.497742', '0.492529', '0.495336', '0.495685', '0.498090']
         : correct/total = [(7011, 14232), (6877, 14235), (6947, 14266), (6895, 14217), (7041, 14238), (7127, 14373), (7170, 14346), (7063, 14334), (7121, 14294), (7118, 14373), (7149, 14344), (7063, 14302), (7218, 14354), (7279, 14362), (7054, 14320), (7165, 14395), (7087, 14389), (7062, 14257), (7064, 14251), (7172, 14399)]
         : compromised: 0.5002, honest: 0.4936
Round 005: test acc mean=0.4949 ± 0.0055 | min=0.4830 max=0.5068
         : test loss mean=2.6776 ± 0.0392
         : individual accs = ['0.492622', '0.483035', '0.486962', '0.484912', '0.494522', '0.495860', '0.499791', '0.492745', '0.498181', '0.495234', '0.498397', '0.493847', '0.502856', '0.506824', '0.492598', '0.497742', '0.492529', '0.495336', '0.495614', '0.498090']
         : correct/total = [(7011, 14232), (6876, 14235), (6947, 14266), (6894, 14217), (7041, 14238), (7127, 14373), (7170, 14346), (7063, 14334), (7121, 14294), (7118, 14373), (7149, 14344), (7063, 14302), (7218, 14354), (7279, 14362), (7054, 14320), (7165, 14395), (7087, 14389), (7062, 14257), (7063, 14251), (7172, 14399)]
         : compromised: 0.5002, honest: 0.4936
Round 006: test acc mean=0.4949 ± 0.0055 | min=0.4830 max=0.5069
         : test loss mean=1.0502 ± 0.0110
         : individual accs = ['0.492763', '0.483035', '0.487032', '0.484842', '0.494662', '0.495930', '0.499930', '0.492954', '0.498461', '0.495234', '0.498606', '0.493847', '0.502787', '0.506893', '0.492668', '0.497603', '0.492460', '0.495336', '0.495614', '0.498160']
         : correct/total = [(7013, 14232), (6876, 14235), (6948, 14266), (6893, 14217), (7043, 14238), (7128, 14373), (7172, 14346), (7066, 14334), (7125, 14294), (7118, 14373), (7152, 14344), (7063, 14302), (7217, 14354), (7280, 14362), (7055, 14320), (7163, 14395), (7086, 14389), (7062, 14257), (7063, 14251), (7173, 14399)]
         : compromised: 0.5002, honest: 0.4936
Round 007: test acc mean=0.4949 ± 0.0055 | min=0.4830 max=0.5068
         : test loss mean=0.8128 ± 0.0064
         : individual accs = ['0.492622', '0.483035', '0.486962', '0.484912', '0.494522', '0.495860', '0.499791', '0.492745', '0.498181', '0.495234', '0.498397', '0.493847', '0.502856', '0.506824', '0.492598', '0.497742', '0.492529', '0.495336', '0.495614', '0.498090']
         : correct/total = [(7011, 14232), (6876, 14235), (6947, 14266), (6894, 14217), (7041, 14238), (7127, 14373), (7170, 14346), (7063, 14334), (7121, 14294), (7118, 14373), (7149, 14344), (7063, 14302), (7218, 14354), (7279, 14362), (7054, 14320), (7165, 14395), (7087, 14389), (7062, 14257), (7063, 14251), (7172, 14399)]
         : compromised: 0.5002, honest: 0.4936
Round 008: test acc mean=0.4949 ± 0.0055 | min=0.4830 max=0.5068
         : test loss mean=0.7680 ± 0.0041
         : individual accs = ['0.492622', '0.483035', '0.486962', '0.484912', '0.494522', '0.495860', '0.499791', '0.492745', '0.498181', '0.495234', '0.498397', '0.493847', '0.502856', '0.506824', '0.492598', '0.497742', '0.492529', '0.495336', '0.495614', '0.498090']
         : correct/total = [(7011, 14232), (6876, 14235), (6947, 14266), (6894, 14217), (7041, 14238), (7127, 14373), (7170, 14346), (7063, 14334), (7121, 14294), (7118, 14373), (7149, 14344), (7063, 14302), (7218, 14354), (7279, 14362), (7054, 14320), (7165, 14395), (7087, 14389), (7062, 14257), (7063, 14251), (7172, 14399)]
         : compromised: 0.5002, honest: 0.4936
Round 009: test acc mean=0.4949 ± 0.0055 | min=0.4830 max=0.5068
         : test loss mean=0.8740 ± 0.0060
         : individual accs = ['0.492622', '0.483035', '0.486962', '0.484912', '0.494522', '0.495860', '0.499791', '0.492745', '0.498181', '0.495234', '0.498397', '0.493847', '0.502856', '0.506824', '0.492598', '0.497742', '0.492529', '0.495336', '0.495614', '0.498090']
         : correct/total = [(7011, 14232), (6876, 14235), (6947, 14266), (6894, 14217), (7041, 14238), (7127, 14373), (7170, 14346), (7063, 14334), (7121, 14294), (7118, 14373), (7149, 14344), (7063, 14302), (7218, 14354), (7279, 14362), (7054, 14320), (7165, 14395), (7087, 14389), (7062, 14257), (7063, 14251), (7172, 14399)]
         : compromised: 0.5002, honest: 0.4936
Round 010: test acc mean=0.4958 ± 0.0051 | min=0.4854 max=0.5064
         : test loss mean=0.8173 ± 0.0051
         : individual accs = ['0.495011', '0.485423', '0.488294', '0.485686', '0.495505', '0.496695', '0.498327', '0.493861', '0.498951', '0.497669', '0.499442', '0.495595', '0.504180', '0.506406', '0.493017', '0.498159', '0.493363', '0.496668', '0.495825', '0.497951']
         : correct/total = [(7045, 14232), (6910, 14235), (6966, 14266), (6905, 14217), (7055, 14238), (7139, 14373), (7149, 14346), (7079, 14334), (7132, 14294), (7153, 14373), (7164, 14344), (7088, 14302), (7237, 14354), (7273, 14362), (7060, 14320), (7171, 14395), (7099, 14389), (7081, 14257), (7066, 14251), (7170, 14399)]
         : compromised: 0.5010, honest: 0.4945

=== FINAL RESULTS ===
Dataset: sent140, Nodes: 20, Graph: fully, Aggregation: d-fedavg
Attack: backdoor, 20.0% compromised
Final accuracy - Compromised: 0.5010, Honest: 0.4945
Overall test accuracy: mean=0.4958 ± 0.0051

=== BACKDOOR ATTACK SUCCESS RATE (ASR) ===
Target label: 1
Trigger size: 3x3
Overall ASR: 1.0000 ± 0.0000
Honest nodes ASR: 1.0000 ± 0.0000
Compromised nodes ASR: 1.0000 ± 0.0000
Note: Higher ASR indicates more successful backdoor attack
