Device: cuda
Seed: 987654321
Loading 1 LEAF Sent140 train files...
LEAF Sent140 train: 254555 users, 908652 samples
Building vocabulary (max_size=10000)...
Vocabulary size: 10000
Loading 1 LEAF Sent140 test files...
LEAF Sent140 test: 254555 users, 286281 samples
Found 254555 train users, 254555 test users, 254555 common users
User sample counts range: 494 (max) to 1 (min)
Distributed ALL 254555 users across 20 clients
Users per client: 12727 (with 15 clients getting +1 user)
Train partition sizes: [44353, 44290, 44657, 44907, 44696, 45843, 45801, 45619, 45069, 45639, 45821, 45311, 45779, 46056, 45625, 45984, 46428, 44737, 45540, 46497]
Test partition sizes: [14232, 14235, 14266, 14217, 14238, 14373, 14346, 14334, 14294, 14373, 14344, 14302, 14354, 14362, 14320, 14395, 14389, 14257, 14251, 14399]
  Client 0: 44353 train samples, 2 unique classes
  Client 1: 44290 train samples, 2 unique classes
  Client 2: 44657 train samples, 2 unique classes
  Client 3: 44907 train samples, 2 unique classes
  Client 4: 44696 train samples, 2 unique classes
  Client 5: 45843 train samples, 2 unique classes
  Client 6: 45801 train samples, 2 unique classes
  Client 7: 45619 train samples, 2 unique classes
  Client 8: 45069 train samples, 2 unique classes
  Client 9: 45639 train samples, 2 unique classes
  Client 10: 45821 train samples, 2 unique classes
  Client 11: 45311 train samples, 2 unique classes
  Client 12: 45779 train samples, 2 unique classes
  Client 13: 46056 train samples, 2 unique classes
  Client 14: 45625 train samples, 2 unique classes
  Client 15: 45984 train samples, 2 unique classes
  Client 16: 46428 train samples, 2 unique classes
  Client 17: 44737 train samples, 2 unique classes
  Client 18: 45540 train samples, 2 unique classes
  Client 19: 46497 train samples, 2 unique classes
Will sample 4500 samples per client per epoch
Graph: ring, nodes: 20, edges: 20
Degree statistics: avg=2.00, min=2, max=2
Attack: Compromised 6/20 nodes: [5, 12, 13, 14, 17, 18]
Attack type: directed_deviation, lambda: 1.0
Model variant: baseline
Model parameters: 1,174,986
Initial test acc across nodes: mean=0.4953 ± 0.0174
Round 001: test acc mean=0.5905 ± 0.0664 | min=0.4952 max=0.6524
         : test loss mean=9.7359 ± 13.9439
         : individual accs = ['0.650646', '0.644468', '0.649236', '0.630794', '0.635483', '0.498782', '0.649937', '0.639877', '0.636911', '0.619286', '0.613009', '0.643197', '0.503901', '0.499582', '0.501746', '0.495241', '0.637501', '0.509013', '0.498070', '0.652406']
         : correct/total = [(9260, 14232), (9174, 14235), (9262, 14266), (8968, 14217), (9048, 14238), (7169, 14373), (9324, 14346), (9172, 14334), (9104, 14294), (8901, 14373), (8793, 14344), (9199, 14302), (7233, 14354), (7175, 14362), (7185, 14320), (7129, 14395), (9173, 14389), (7257, 14257), (7098, 14251), (9394, 14399)]
         : compromised: 0.5018, honest: 0.6284
Round 002: test acc mean=0.5838 ± 0.0750 | min=0.4948 max=0.6753
         : test loss mean=8.9434 ± 12.0729
         : individual accs = ['0.634415', '0.631893', '0.628838', '0.672294', '0.666596', '0.494817', '0.498466', '0.659900', '0.635232', '0.634106', '0.660625', '0.657251', '0.501115', '0.509469', '0.507263', '0.509482', '0.507054', '0.495476', '0.495544', '0.675255']
         : correct/total = [(9029, 14232), (8995, 14235), (8971, 14266), (9558, 14217), (9491, 14238), (7112, 14373), (7151, 14346), (9459, 14334), (9080, 14294), (9114, 14373), (9476, 14344), (9400, 14302), (7193, 14354), (7317, 14362), (7264, 14320), (7334, 14395), (7296, 14389), (7064, 14257), (7062, 14251), (9723, 14399)]
         : compromised: 0.5006, honest: 0.6194
Round 003: test acc mean=0.5925 ± 0.0804 | min=0.4955 max=0.6780
         : test loss mean=4.6225 ± 6.4590
         : individual accs = ['0.650646', '0.650228', '0.678046', '0.664627', '0.666948', '0.504209', '0.500139', '0.660039', '0.672660', '0.665832', '0.666760', '0.671375', '0.505434', '0.495474', '0.503003', '0.511705', '0.512058', '0.495546', '0.507684', '0.667477']
         : correct/total = [(9260, 14232), (9256, 14235), (9673, 14266), (9449, 14217), (9496, 14238), (7247, 14373), (7175, 14346), (9461, 14334), (9615, 14294), (9570, 14373), (9564, 14344), (9602, 14302), (7255, 14354), (7116, 14362), (7203, 14320), (7366, 14395), (7368, 14389), (7065, 14257), (7235, 14251), (9611, 14399)]
         : compromised: 0.5019, honest: 0.6313
Round 004: test acc mean=0.6006 ± 0.0857 | min=0.4985 max=0.6941
         : test loss mean=4.5973 ± 7.5817
         : individual accs = ['0.680298', '0.681208', '0.683864', '0.690230', '0.688088', '0.506714', '0.515266', '0.661434', '0.681545', '0.664927', '0.677426', '0.650049', '0.498467', '0.507450', '0.505377', '0.508024', '0.514838', '0.503823', '0.498983', '0.694076']
         : correct/total = [(9682, 14232), (9697, 14235), (9756, 14266), (9813, 14217), (9797, 14238), (7283, 14373), (7392, 14346), (9481, 14334), (9742, 14294), (9557, 14373), (9717, 14344), (9297, 14302), (7155, 14354), (7288, 14362), (7237, 14320), (7313, 14395), (7408, 14389), (7183, 14257), (7111, 14251), (9994, 14399)]
         : compromised: 0.5035, honest: 0.6422
Round 005: test acc mean=0.6026 ± 0.0928 | min=0.4857 max=0.7012
         : test loss mean=3.6595 ± 5.1868
         : individual accs = ['0.696669', '0.692589', '0.682322', '0.682844', '0.701222', '0.504140', '0.500209', '0.657039', '0.695677', '0.650595', '0.696737', '0.684450', '0.496795', '0.485726', '0.503561', '0.524557', '0.495031', '0.501368', '0.498562', '0.701090']
         : correct/total = [(9915, 14232), (9859, 14235), (9734, 14266), (9708, 14217), (9984, 14238), (7246, 14373), (7176, 14346), (9418, 14334), (9944, 14294), (9351, 14373), (9994, 14344), (9789, 14302), (7131, 14354), (6976, 14362), (7211, 14320), (7551, 14395), (7123, 14389), (7148, 14257), (7105, 14251), (10095, 14399)]
         : compromised: 0.4984, honest: 0.6472
Round 006: test acc mean=0.6118 ± 0.0946 | min=0.4960 max=0.7122
         : test loss mean=3.9990 ± 5.7322
         : individual accs = ['0.692313', '0.698349', '0.693467', '0.701062', '0.712249', '0.504488', '0.521748', '0.691154', '0.701903', '0.694497', '0.689487', '0.689414', '0.495959', '0.497842', '0.504679', '0.516429', '0.507957', '0.510065', '0.508456', '0.704980']
         : correct/total = [(9853, 14232), (9941, 14235), (9893, 14266), (9967, 14217), (10141, 14238), (7251, 14373), (7485, 14346), (9907, 14334), (10033, 14294), (9982, 14373), (9890, 14344), (9860, 14302), (7119, 14354), (7150, 14362), (7227, 14320), (7434, 14395), (7309, 14389), (7272, 14257), (7246, 14251), (10151, 14399)]
         : compromised: 0.5036, honest: 0.6582
Round 007: test acc mean=0.6164 ± 0.0968 | min=0.4955 max=0.7100
         : test loss mean=3.5340 ± 5.0977
         : individual accs = ['0.699199', '0.709378', '0.693467', '0.707815', '0.707332', '0.504140', '0.549421', '0.692479', '0.706800', '0.698880', '0.709983', '0.705636', '0.497422', '0.495474', '0.503561', '0.506704', '0.531587', '0.499544', '0.504456', '0.705049']
         : correct/total = [(9951, 14232), (10098, 14235), (9893, 14266), (10063, 14217), (10071, 14238), (7246, 14373), (7882, 14346), (9926, 14334), (10103, 14294), (10045, 14373), (10184, 14344), (10092, 14302), (7140, 14354), (7116, 14362), (7211, 14320), (7294, 14395), (7649, 14389), (7122, 14257), (7189, 14251), (10152, 14399)]
         : compromised: 0.5008, honest: 0.6660
Round 008: test acc mean=0.6174 ± 0.1001 | min=0.4962 max=0.7193
         : test loss mean=4.6202 ± 7.6307
         : individual accs = ['0.714446', '0.706849', '0.676433', '0.719280', '0.704945', '0.496208', '0.556531', '0.706223', '0.715195', '0.708899', '0.698410', '0.706824', '0.498328', '0.509400', '0.499302', '0.506495', '0.504274', '0.503262', '0.498140', '0.719147']
         : correct/total = [(10168, 14232), (10062, 14235), (9650, 14266), (10226, 14217), (10037, 14238), (7132, 14373), (7984, 14346), (10123, 14334), (10223, 14294), (10189, 14373), (10018, 14344), (10109, 14302), (7153, 14354), (7316, 14362), (7150, 14320), (7291, 14395), (7256, 14389), (7175, 14257), (7099, 14251), (10355, 14399)]
         : compromised: 0.5008, honest: 0.6674
Round 009: test acc mean=0.6201 ± 0.1042 | min=0.4949 max=0.7223
         : test loss mean=3.7105 ± 5.6142
         : individual accs = ['0.711003', '0.718370', '0.717370', '0.712387', '0.720888', '0.504001', '0.508504', '0.722338', '0.714076', '0.697906', '0.709983', '0.710670', '0.494914', '0.507241', '0.502793', '0.508163', '0.512336', '0.503753', '0.504666', '0.721439']
         : correct/total = [(10119, 14232), (10226, 14235), (10234, 14266), (10128, 14217), (10264, 14238), (7244, 14373), (7295, 14346), (10354, 14334), (10207, 14294), (10031, 14373), (10184, 14344), (10164, 14302), (7104, 14354), (7285, 14362), (7200, 14320), (7315, 14395), (7372, 14389), (7182, 14257), (7192, 14251), (10388, 14399)]
         : compromised: 0.5029, honest: 0.6704
Round 010: test acc mean=0.6241 ± 0.1018 | min=0.4908 max=0.7328
         : test loss mean=4.0152 ± 6.1138
         : individual accs = ['0.713182', '0.720478', '0.702720', '0.720968', '0.732757', '0.498574', '0.556392', '0.722199', '0.722051', '0.697419', '0.712075', '0.713187', '0.490804', '0.495683', '0.504469', '0.516846', '0.530266', '0.525987', '0.496948', '0.708869']
         : correct/total = [(10150, 14232), (10256, 14235), (10025, 14266), (10250, 14217), (10433, 14238), (7166, 14373), (7982, 14346), (10352, 14334), (10321, 14294), (10024, 14373), (10214, 14344), (10200, 14302), (7045, 14354), (7119, 14362), (7224, 14320), (7440, 14395), (7630, 14389), (7499, 14257), (7082, 14251), (10207, 14399)]
         : compromised: 0.5021, honest: 0.6764

=== FINAL RESULTS ===
Dataset: sent140, Nodes: 20, Graph: ring, Aggregation: krum
Attack: directed_deviation, 30.0% compromised
Final accuracy - Compromised: 0.5021, Honest: 0.6764
Overall test accuracy: mean=0.6241 ± 0.1018
