Device: cuda
Seed: 987654321
Loading 1 LEAF Sent140 train files...
LEAF Sent140 train: 254555 users, 908652 samples
Building vocabulary (max_size=10000)...
Vocabulary size: 10000
Loading 1 LEAF Sent140 test files...
LEAF Sent140 test: 254555 users, 286281 samples
Found 254555 train users, 254555 test users, 254555 common users
User sample counts range: 494 (max) to 1 (min)
Distributed ALL 254555 users across 20 clients
Users per client: 12727 (with 15 clients getting +1 user)
Train partition sizes: [44353, 44290, 44657, 44907, 44696, 45843, 45801, 45619, 45069, 45639, 45821, 45311, 45779, 46056, 45625, 45984, 46428, 44737, 45540, 46497]
Test partition sizes: [14232, 14235, 14266, 14217, 14238, 14373, 14346, 14334, 14294, 14373, 14344, 14302, 14354, 14362, 14320, 14395, 14389, 14257, 14251, 14399]
  Client 0: 44353 train samples, 2 unique classes
  Client 1: 44290 train samples, 2 unique classes
  Client 2: 44657 train samples, 2 unique classes
  Client 3: 44907 train samples, 2 unique classes
  Client 4: 44696 train samples, 2 unique classes
  Client 5: 45843 train samples, 2 unique classes
  Client 6: 45801 train samples, 2 unique classes
  Client 7: 45619 train samples, 2 unique classes
  Client 8: 45069 train samples, 2 unique classes
  Client 9: 45639 train samples, 2 unique classes
  Client 10: 45821 train samples, 2 unique classes
  Client 11: 45311 train samples, 2 unique classes
  Client 12: 45779 train samples, 2 unique classes
  Client 13: 46056 train samples, 2 unique classes
  Client 14: 45625 train samples, 2 unique classes
  Client 15: 45984 train samples, 2 unique classes
  Client 16: 46428 train samples, 2 unique classes
  Client 17: 44737 train samples, 2 unique classes
  Client 18: 45540 train samples, 2 unique classes
  Client 19: 46497 train samples, 2 unique classes
Will sample 4500 samples per client per epoch
Graph: erdos, nodes: 20, edges: 48
Degree statistics: avg=4.80, min=2, max=7
Attack: Compromised 12/20 nodes: [1, 2, 3, 5, 8, 11, 12, 13, 14, 15, 17, 18]
Attack type: directed_deviation, lambda: 1.0
Model variant: baseline
Model parameters: 1,174,986
Sketchguard Node 0:
  Model dim: 1,174,986 → Sketch size: 180
  Compression ratio: 6527.7x
  Using model parameters for aggregation, sketches for filtering
Sketchguard Node 1:
  Model dim: 1,174,986 → Sketch size: 180
  Compression ratio: 6527.7x
  Using model parameters for aggregation, sketches for filtering
Sketchguard Node 2:
  Model dim: 1,174,986 → Sketch size: 180
  Compression ratio: 6527.7x
  Using model parameters for aggregation, sketches for filtering
Sketchguard Node 3:
  Model dim: 1,174,986 → Sketch size: 180
  Compression ratio: 6527.7x
  Using model parameters for aggregation, sketches for filtering
Sketchguard Node 4:
  Model dim: 1,174,986 → Sketch size: 180
  Compression ratio: 6527.7x
  Using model parameters for aggregation, sketches for filtering
Sketchguard Node 5:
  Model dim: 1,174,986 → Sketch size: 180
  Compression ratio: 6527.7x
  Using model parameters for aggregation, sketches for filtering
Sketchguard Node 6:
  Model dim: 1,174,986 → Sketch size: 180
  Compression ratio: 6527.7x
  Using model parameters for aggregation, sketches for filtering
Sketchguard Node 7:
  Model dim: 1,174,986 → Sketch size: 180
  Compression ratio: 6527.7x
  Using model parameters for aggregation, sketches for filtering
Sketchguard Node 8:
  Model dim: 1,174,986 → Sketch size: 180
  Compression ratio: 6527.7x
  Using model parameters for aggregation, sketches for filtering
Sketchguard Node 9:
  Model dim: 1,174,986 → Sketch size: 180
  Compression ratio: 6527.7x
  Using model parameters for aggregation, sketches for filtering
Sketchguard Node 10:
  Model dim: 1,174,986 → Sketch size: 180
  Compression ratio: 6527.7x
  Using model parameters for aggregation, sketches for filtering
Sketchguard Node 11:
  Model dim: 1,174,986 → Sketch size: 180
  Compression ratio: 6527.7x
  Using model parameters for aggregation, sketches for filtering
Sketchguard Node 12:
  Model dim: 1,174,986 → Sketch size: 180
  Compression ratio: 6527.7x
  Using model parameters for aggregation, sketches for filtering
Sketchguard Node 13:
  Model dim: 1,174,986 → Sketch size: 180
  Compression ratio: 6527.7x
  Using model parameters for aggregation, sketches for filtering
Sketchguard Node 14:
  Model dim: 1,174,986 → Sketch size: 180
  Compression ratio: 6527.7x
  Using model parameters for aggregation, sketches for filtering
Sketchguard Node 15:
  Model dim: 1,174,986 → Sketch size: 180
  Compression ratio: 6527.7x
  Using model parameters for aggregation, sketches for filtering
Sketchguard Node 16:
  Model dim: 1,174,986 → Sketch size: 180
  Compression ratio: 6527.7x
  Using model parameters for aggregation, sketches for filtering
Sketchguard Node 17:
  Model dim: 1,174,986 → Sketch size: 180
  Compression ratio: 6527.7x
  Using model parameters for aggregation, sketches for filtering
Sketchguard Node 18:
  Model dim: 1,174,986 → Sketch size: 180
  Compression ratio: 6527.7x
  Using model parameters for aggregation, sketches for filtering
Sketchguard Node 19:
  Model dim: 1,174,986 → Sketch size: 180
  Compression ratio: 6527.7x
  Using model parameters for aggregation, sketches for filtering
Sketchguard ALGORITHM (Sketch-based Filtering + State Aggregation)
  - Model dimension: 1,174,986 parameters
  - Config: SketchguardConfig(gamma=2, kappa=1, alpha=0.5, min_neighbors=1, sketch_size=180, network_seed=987654321, attack_detection_window=5)
  - Sketch size: 180
  - Compression ratio: 6527.7x
  - Complexity: O(d + N×k) = O(1,174,986 + 20×180)
  - Theoretical speedup vs BALANCE: 19.9x
Initial test acc across nodes: mean=0.4953 ± 0.0174
Round 001: test acc mean=0.5049 ± 0.0161 | min=0.4835 max=0.5543
         : test loss mean=1.1343 ± 0.3924
         : individual accs = ['0.492411', '0.500808', '0.511566', '0.496026', '0.504706', '0.497391', '0.489823', '0.511093', '0.554289', '0.484450', '0.497281', '0.494127', '0.521666', '0.483498', '0.504399', '0.506982', '0.508444', '0.532580', '0.504666', '0.501285']
         : correct/total = [(7008, 14232), (7129, 14235), (7298, 14266), (7052, 14217), (7186, 14238), (7149, 14373), (7027, 14346), (7326, 14334), (7923, 14294), (6963, 14373), (7133, 14344), (7067, 14302), (7488, 14354), (6944, 14362), (7223, 14320), (7298, 14395), (7316, 14389), (7593, 14257), (7192, 14251), (7218, 14399)]
         : compromised: 0.5090, honest: 0.4987
         : sketchguard stats = ['Node 0: acc_rate=1.000', 'Node 1: acc_rate=1.000', 'Node 2: acc_rate=1.000']...
Round 002: test acc mean=0.5074 ± 0.0158 | min=0.4856 max=0.5551
         : test loss mean=0.9960 ± 0.6018
         : individual accs = ['0.492903', '0.496523', '0.514019', '0.513399', '0.500632', '0.510749', '0.499512', '0.502232', '0.555058', '0.499200', '0.505438', '0.509160', '0.509335', '0.493176', '0.524930', '0.507259', '0.485579', '0.535597', '0.503684', '0.489548']
         : correct/total = [(7015, 14232), (7068, 14235), (7333, 14266), (7299, 14217), (7128, 14238), (7341, 14373), (7166, 14346), (7199, 14334), (7934, 14294), (7175, 14373), (7250, 14344), (7282, 14302), (7311, 14354), (7083, 14362), (7517, 14320), (7302, 14395), (6987, 14389), (7636, 14257), (7178, 14251), (7049, 14399)]
         : compromised: 0.5144, honest: 0.4969
         : sketchguard stats = ['Node 0: acc_rate=0.833', 'Node 1: acc_rate=0.667', 'Node 2: acc_rate=0.700']...
Round 003: test acc mean=0.5175 ± 0.0315 | min=0.4799 max=0.6121
         : test loss mean=0.7650 ± 0.2933
         : individual accs = ['0.497330', '0.504601', '0.513108', '0.514525', '0.496067', '0.589021', '0.541405', '0.525603', '0.612075', '0.496278', '0.531233', '0.507272', '0.479936', '0.498607', '0.499511', '0.530462', '0.493015', '0.498492', '0.505228', '0.517119']
         : correct/total = [(7078, 14232), (7183, 14235), (7320, 14266), (7315, 14217), (7063, 14238), (8466, 14373), (7767, 14346), (7534, 14334), (8749, 14294), (7133, 14373), (7620, 14344), (7255, 14302), (6889, 14354), (7161, 14362), (7153, 14320), (7636, 14395), (7094, 14389), (7107, 14257), (7200, 14251), (7446, 14399)]
         : compromised: 0.5211, honest: 0.5123
         : sketchguard stats = ['Node 0: acc_rate=0.722', 'Node 1: acc_rate=0.556', 'Node 2: acc_rate=0.600']...
Round 004: test acc mean=0.5573 ± 0.0324 | min=0.4987 max=0.5994
         : test loss mean=0.8225 ± 0.6139
         : individual accs = ['0.575183', '0.579206', '0.533997', '0.544278', '0.581683', '0.534266', '0.598634', '0.599274', '0.593256', '0.508801', '0.599414', '0.558104', '0.507942', '0.504247', '0.572626', '0.498715', '0.554590', '0.562040', '0.560452', '0.579137']
         : correct/total = [(8186, 14232), (8245, 14235), (7618, 14266), (7738, 14217), (8282, 14238), (7679, 14373), (8588, 14346), (8590, 14334), (8480, 14294), (7313, 14373), (8598, 14344), (7982, 14302), (7291, 14354), (7242, 14362), (8200, 14320), (7179, 14395), (7980, 14389), (8013, 14257), (7987, 14251), (8339, 14399)]
         : compromised: 0.5458, honest: 0.5746
         : sketchguard stats = ['Node 0: acc_rate=0.667', 'Node 1: acc_rate=0.500', 'Node 2: acc_rate=0.550']...
Round 005: test acc mean=0.5923 ± 0.0360 | min=0.4987 max=0.6224
         : test loss mean=0.9886 ± 1.4137
         : individual accs = ['0.610315', '0.555111', '0.556919', '0.597243', '0.621155', '0.621860', '0.614596', '0.611553', '0.617952', '0.605510', '0.620956', '0.584604', '0.598579', '0.498747', '0.594832', '0.502049', '0.614497', '0.589745', '0.607817', '0.622404']
         : correct/total = [(8686, 14232), (7902, 14235), (7945, 14266), (8491, 14217), (8844, 14238), (8938, 14373), (8817, 14346), (8766, 14334), (8833, 14294), (8703, 14373), (8907, 14344), (8361, 14302), (8592, 14354), (7163, 14362), (8518, 14320), (7227, 14395), (8842, 14389), (8408, 14257), (8662, 14251), (8962, 14399)]
         : compromised: 0.5771, honest: 0.6151
         : sketchguard stats = ['Node 0: acc_rate=0.633', 'Node 1: acc_rate=0.500', 'Node 2: acc_rate=0.520']...
Round 006: test acc mean=0.6111 ± 0.0302 | min=0.4930 max=0.6364
         : test loss mean=1.3159 ± 2.8980
         : individual accs = ['0.621698', '0.611451', '0.593649', '0.617500', '0.628670', '0.626731', '0.626795', '0.629273', '0.616273', '0.626939', '0.628416', '0.611313', '0.625470', '0.493037', '0.609148', '0.594651', '0.614845', '0.583292', '0.626833', '0.636433']
         : correct/total = [(8848, 14232), (8704, 14235), (8469, 14266), (8779, 14217), (8951, 14238), (9008, 14373), (8992, 14346), (9020, 14334), (8809, 14294), (9011, 14373), (9014, 14344), (8743, 14302), (8978, 14354), (7081, 14362), (8723, 14320), (8560, 14395), (8847, 14389), (8316, 14257), (8933, 14251), (9164, 14399)]
         : compromised: 0.6008, honest: 0.6266
         : sketchguard stats = ['Node 0: acc_rate=0.611', 'Node 1: acc_rate=0.500', 'Node 2: acc_rate=0.500']...
Round 007: test acc mean=0.6250 ± 0.0301 | min=0.5164 max=0.6455
         : test loss mean=0.6684 ± 0.1234
         : individual accs = ['0.639545', '0.633930', '0.575144', '0.636069', '0.632954', '0.643150', '0.640945', '0.629482', '0.641248', '0.642942', '0.634690', '0.592155', '0.639404', '0.516432', '0.629958', '0.631400', '0.637640', '0.635056', '0.622132', '0.645531']
         : correct/total = [(9102, 14232), (9024, 14235), (8205, 14266), (9043, 14217), (9012, 14238), (9244, 14373), (9195, 14346), (9023, 14334), (9166, 14294), (9241, 14373), (9104, 14344), (8469, 14302), (9178, 14354), (7417, 14362), (9021, 14320), (9089, 14395), (9175, 14389), (9054, 14257), (8866, 14251), (9295, 14399)]
         : compromised: 0.6163, honest: 0.6380
         : sketchguard stats = ['Node 0: acc_rate=0.595', 'Node 1: acc_rate=0.476', 'Node 2: acc_rate=0.486']...
Round 008: test acc mean=0.6351 ± 0.0342 | min=0.4893 max=0.6524
         : test loss mean=0.7208 ± 0.3874
         : individual accs = ['0.647063', '0.641236', '0.628137', '0.650841', '0.646088', '0.643220', '0.649937', '0.639110', '0.644536', '0.646003', '0.648355', '0.633198', '0.648251', '0.489347', '0.637989', '0.636888', '0.647648', '0.646069', '0.625079', '0.652406']
         : correct/total = [(9209, 14232), (9128, 14235), (8961, 14266), (9253, 14217), (9199, 14238), (9245, 14373), (9324, 14346), (9161, 14334), (9213, 14294), (9285, 14373), (9300, 14344), (9056, 14302), (9305, 14354), (7028, 14362), (9136, 14320), (9168, 14395), (9319, 14389), (9211, 14257), (8908, 14251), (9394, 14399)]
         : compromised: 0.6271, honest: 0.6471
         : sketchguard stats = ['Node 0: acc_rate=0.583', 'Node 1: acc_rate=0.458', 'Node 2: acc_rate=0.475']...
Round 009: test acc mean=0.6369 ± 0.0296 | min=0.5137 max=0.6540
         : test loss mean=0.6429 ± 0.0599
         : individual accs = ['0.638420', '0.653671', '0.631712', '0.643525', '0.636536', '0.654004', '0.630489', '0.646575', '0.645446', '0.628400', '0.649191', '0.627325', '0.652292', '0.513717', '0.645880', '0.636124', '0.653277', '0.649295', '0.650481', '0.650948']
         : correct/total = [(9086, 14232), (9305, 14235), (9012, 14266), (9149, 14217), (9063, 14238), (9400, 14373), (9045, 14346), (9268, 14334), (9226, 14294), (9032, 14373), (9312, 14344), (8972, 14302), (9363, 14354), (7378, 14362), (9249, 14320), (9157, 14395), (9400, 14389), (9257, 14257), (9270, 14251), (9373, 14399)]
         : compromised: 0.6336, honest: 0.6417
         : sketchguard stats = ['Node 0: acc_rate=0.574', 'Node 1: acc_rate=0.444', 'Node 2: acc_rate=0.467']...
Round 010: test acc mean=0.6511 ± 0.0322 | min=0.5136 max=0.6699
         : test loss mean=0.6304 ± 0.0664
         : individual accs = ['0.656268', '0.662381', '0.644119', '0.659140', '0.657536', '0.662492', '0.664366', '0.662341', '0.666154', '0.656787', '0.657836', '0.645574', '0.669918', '0.513577', '0.652654', '0.651824', '0.657377', '0.666690', '0.656235', '0.659629']
         : correct/total = [(9340, 14232), (9429, 14235), (9189, 14266), (9371, 14217), (9362, 14238), (9522, 14373), (9531, 14346), (9494, 14334), (9522, 14294), (9440, 14373), (9436, 14344), (9233, 14302), (9616, 14354), (7376, 14362), (9346, 14320), (9383, 14395), (9459, 14389), (9505, 14257), (9352, 14251), (9498, 14399)]
         : compromised: 0.6459, honest: 0.6590
         : sketchguard stats = ['Node 0: acc_rate=0.567', 'Node 1: acc_rate=0.433', 'Node 2: acc_rate=0.420']...

=== FINAL RESULTS ===
Dataset: sent140, Nodes: 20, Graph: erdos, Aggregation: sketchguard
Attack: directed_deviation, 60.0% compromised
Final accuracy - Compromised: 0.6459, Honest: 0.6590
Overall test accuracy: mean=0.6511 ± 0.0322

=== Sketchguard SUMMARY ===
Node 0: acceptance=0.567
Node 1: acceptance=0.433
Node 2: acceptance=0.420
Node 3: acceptance=0.575
Node 4: acceptance=0.400
Node 5: acceptance=0.260
Node 6: acceptance=0.300
Node 7: acceptance=0.460
Node 8: acceptance=0.500
Node 9: acceptance=0.467
Node 10: acceptance=0.575
Node 11: acceptance=0.314
Node 12: acceptance=0.543
Node 13: acceptance=0.075
Node 14: acceptance=0.214
Node 15: acceptance=0.350
Node 16: acceptance=0.300
Node 17: acceptance=0.520
Node 18: acceptance=0.275
Node 19: acceptance=0.600

=== PARALLEL EXECUTION TIME (realistic for distributed system) ===
  COMMUNICATION (max across nodes):
    - Sketch transfer: 0.000s (0.0%)
    - Model fetch (accepted): 0.000s (0.0%)
  COMPUTATION (max across nodes):
    - Sketching: 0.263s (93.1%)
    - Filtering: 0.002s (0.7%)
    - Aggregation: 0.017s (6.2%)
  TOTALS:
    - Total computation: 0.282s (100.0%)
    - Total communication: 0.000s (0.0%)
    - Total parallel time: 0.282s

=== PER-NODE AVERAGE TIME ===
  - Sketching: 0.190s
  - Filtering: 0.000s
  - Aggregation: 0.007s
  - Sketch transfer: 0.000s
  - Model fetch: 0.000s
  - Total per node: 0.198s

=== TOTAL COMPUTATIONAL WORK (sum across all nodes) ===
  - Total sketching: 3.795s
  - Total filtering: 0.009s
  - Total aggregation: 0.148s
  - Total sketch transfer: 0.000s
  - Total model fetch: 0.000s
  - Grand total: 3.953s
  - Mean acceptance rate: 0.407

Sketchguard Algorithm Properties:
  - Original dimension: 1,174,986
  - Sketch size: 180
  - Compression ratio: 19.9x
  - Single repetition: No repetitions needed
  - Theoretical complexity: O(d + N×k)
  - Approach: Sketch filtering + state aggregation
