Device: cuda
Seed: 987654321
Loading 1 LEAF Sent140 train files...
LEAF Sent140 train: 254555 users, 908652 samples
Building vocabulary (max_size=10000)...
Vocabulary size: 10000
Loading 1 LEAF Sent140 test files...
LEAF Sent140 test: 254555 users, 286281 samples
Found 254555 train users, 254555 test users, 254555 common users
User sample counts range: 494 (max) to 1 (min)
Distributed ALL 254555 users across 20 clients
Users per client: 12727 (with 15 clients getting +1 user)
Train partition sizes: [44353, 44290, 44657, 44907, 44696, 45843, 45801, 45619, 45069, 45639, 45821, 45311, 45779, 46056, 45625, 45984, 46428, 44737, 45540, 46497]
Test partition sizes: [14232, 14235, 14266, 14217, 14238, 14373, 14346, 14334, 14294, 14373, 14344, 14302, 14354, 14362, 14320, 14395, 14389, 14257, 14251, 14399]
  Client 0: 44353 train samples, 2 unique classes
  Client 1: 44290 train samples, 2 unique classes
  Client 2: 44657 train samples, 2 unique classes
  Client 3: 44907 train samples, 2 unique classes
  Client 4: 44696 train samples, 2 unique classes
  Client 5: 45843 train samples, 2 unique classes
  Client 6: 45801 train samples, 2 unique classes
  Client 7: 45619 train samples, 2 unique classes
  Client 8: 45069 train samples, 2 unique classes
  Client 9: 45639 train samples, 2 unique classes
  Client 10: 45821 train samples, 2 unique classes
  Client 11: 45311 train samples, 2 unique classes
  Client 12: 45779 train samples, 2 unique classes
  Client 13: 46056 train samples, 2 unique classes
  Client 14: 45625 train samples, 2 unique classes
  Client 15: 45984 train samples, 2 unique classes
  Client 16: 46428 train samples, 2 unique classes
  Client 17: 44737 train samples, 2 unique classes
  Client 18: 45540 train samples, 2 unique classes
  Client 19: 46497 train samples, 2 unique classes
Will sample 4500 samples per client per epoch
Graph: erdos, nodes: 20, edges: 48
Degree statistics: avg=4.80, min=2, max=7
Attack: Compromised 14/20 nodes: [1, 2, 3, 5, 6, 8, 11, 12, 13, 14, 15, 17, 18, 19]
Attack type: directed_deviation, lambda: 1.0
Model variant: baseline
Model parameters: 1,174,986
Sketchguard Node 0:
  Model dim: 1,174,986 → Sketch size: 180
  Compression ratio: 6527.7x
  Using model parameters for aggregation, sketches for filtering
Sketchguard Node 1:
  Model dim: 1,174,986 → Sketch size: 180
  Compression ratio: 6527.7x
  Using model parameters for aggregation, sketches for filtering
Sketchguard Node 2:
  Model dim: 1,174,986 → Sketch size: 180
  Compression ratio: 6527.7x
  Using model parameters for aggregation, sketches for filtering
Sketchguard Node 3:
  Model dim: 1,174,986 → Sketch size: 180
  Compression ratio: 6527.7x
  Using model parameters for aggregation, sketches for filtering
Sketchguard Node 4:
  Model dim: 1,174,986 → Sketch size: 180
  Compression ratio: 6527.7x
  Using model parameters for aggregation, sketches for filtering
Sketchguard Node 5:
  Model dim: 1,174,986 → Sketch size: 180
  Compression ratio: 6527.7x
  Using model parameters for aggregation, sketches for filtering
Sketchguard Node 6:
  Model dim: 1,174,986 → Sketch size: 180
  Compression ratio: 6527.7x
  Using model parameters for aggregation, sketches for filtering
Sketchguard Node 7:
  Model dim: 1,174,986 → Sketch size: 180
  Compression ratio: 6527.7x
  Using model parameters for aggregation, sketches for filtering
Sketchguard Node 8:
  Model dim: 1,174,986 → Sketch size: 180
  Compression ratio: 6527.7x
  Using model parameters for aggregation, sketches for filtering
Sketchguard Node 9:
  Model dim: 1,174,986 → Sketch size: 180
  Compression ratio: 6527.7x
  Using model parameters for aggregation, sketches for filtering
Sketchguard Node 10:
  Model dim: 1,174,986 → Sketch size: 180
  Compression ratio: 6527.7x
  Using model parameters for aggregation, sketches for filtering
Sketchguard Node 11:
  Model dim: 1,174,986 → Sketch size: 180
  Compression ratio: 6527.7x
  Using model parameters for aggregation, sketches for filtering
Sketchguard Node 12:
  Model dim: 1,174,986 → Sketch size: 180
  Compression ratio: 6527.7x
  Using model parameters for aggregation, sketches for filtering
Sketchguard Node 13:
  Model dim: 1,174,986 → Sketch size: 180
  Compression ratio: 6527.7x
  Using model parameters for aggregation, sketches for filtering
Sketchguard Node 14:
  Model dim: 1,174,986 → Sketch size: 180
  Compression ratio: 6527.7x
  Using model parameters for aggregation, sketches for filtering
Sketchguard Node 15:
  Model dim: 1,174,986 → Sketch size: 180
  Compression ratio: 6527.7x
  Using model parameters for aggregation, sketches for filtering
Sketchguard Node 16:
  Model dim: 1,174,986 → Sketch size: 180
  Compression ratio: 6527.7x
  Using model parameters for aggregation, sketches for filtering
Sketchguard Node 17:
  Model dim: 1,174,986 → Sketch size: 180
  Compression ratio: 6527.7x
  Using model parameters for aggregation, sketches for filtering
Sketchguard Node 18:
  Model dim: 1,174,986 → Sketch size: 180
  Compression ratio: 6527.7x
  Using model parameters for aggregation, sketches for filtering
Sketchguard Node 19:
  Model dim: 1,174,986 → Sketch size: 180
  Compression ratio: 6527.7x
  Using model parameters for aggregation, sketches for filtering
Sketchguard ALGORITHM (Sketch-based Filtering + State Aggregation)
  - Model dimension: 1,174,986 parameters
  - Config: SketchguardConfig(gamma=2, kappa=1, alpha=0.5, min_neighbors=1, sketch_size=180, network_seed=987654321, attack_detection_window=5)
  - Sketch size: 180
  - Compression ratio: 6527.7x
  - Complexity: O(d + N×k) = O(1,174,986 + 20×180)
  - Theoretical speedup vs BALANCE: 19.9x
Initial test acc across nodes: mean=0.4953 ± 0.0174
Round 001: test acc mean=0.5033 ± 0.0136 | min=0.4836 max=0.5543
         : test loss mean=1.3036 ± 0.4983
         : individual accs = ['0.502038', '0.492589', '0.509463', '0.500457', '0.505338', '0.504140', '0.501255', '0.505930', '0.554289', '0.506297', '0.493168', '0.499441', '0.490804', '0.483637', '0.510265', '0.499687', '0.511085', '0.496037', '0.494983', '0.505521']
         : correct/total = [(7145, 14232), (7012, 14235), (7268, 14266), (7115, 14217), (7195, 14238), (7246, 14373), (7191, 14346), (7252, 14334), (7923, 14294), (7277, 14373), (7074, 14344), (7143, 14302), (7045, 14354), (6946, 14362), (7307, 14320), (7193, 14395), (7354, 14389), (7072, 14257), (7054, 14251), (7279, 14399)]
         : compromised: 0.5030, honest: 0.5040
         : sketchguard stats = ['Node 0: acc_rate=1.000', 'Node 1: acc_rate=1.000', 'Node 2: acc_rate=1.000']...
Round 002: test acc mean=0.5032 ± 0.0222 | min=0.4743 max=0.5779
         : test loss mean=1.2487 ± 0.9337
         : individual accs = ['0.513842', '0.483597', '0.495514', '0.490328', '0.505689', '0.526752', '0.520494', '0.503907', '0.577865', '0.488972', '0.500000', '0.501049', '0.503274', '0.495892', '0.479888', '0.481765', '0.498506', '0.496247', '0.525577', '0.474338']
         : correct/total = [(7313, 14232), (6884, 14235), (7069, 14266), (6971, 14217), (7200, 14238), (7571, 14373), (7467, 14346), (7223, 14334), (8260, 14294), (7028, 14373), (7172, 14344), (7166, 14302), (7224, 14354), (7122, 14362), (6872, 14320), (6935, 14395), (7173, 14389), (7075, 14257), (7490, 14251), (6830, 14399)]
         : compromised: 0.5038, honest: 0.5018
         : sketchguard stats = ['Node 0: acc_rate=1.000', 'Node 1: acc_rate=0.667', 'Node 2: acc_rate=0.600']...
Round 003: test acc mean=0.5099 ± 0.0313 | min=0.4859 max=0.6087
         : test loss mean=0.8211 ± 0.5155
         : individual accs = ['0.506886', '0.498349', '0.487593', '0.495393', '0.505408', '0.608711', '0.488359', '0.498674', '0.498531', '0.499061', '0.497351', '0.485946', '0.503344', '0.501601', '0.506494', '0.593192', '0.505664', '0.493161', '0.513227', '0.510105']
         : correct/total = [(7214, 14232), (7094, 14235), (6956, 14266), (7043, 14217), (7196, 14238), (8749, 14373), (7006, 14346), (7148, 14334), (7126, 14294), (7173, 14373), (7134, 14344), (6950, 14302), (7225, 14354), (7204, 14362), (7253, 14320), (8539, 14395), (7276, 14389), (7031, 14257), (7314, 14251), (7345, 14399)]
         : compromised: 0.5131, honest: 0.5022
         : sketchguard stats = ['Node 0: acc_rate=0.778', 'Node 1: acc_rate=0.556', 'Node 2: acc_rate=0.467']...
Round 004: test acc mean=0.5445 ± 0.0301 | min=0.4994 max=0.6019
         : test loss mean=0.7814 ± 0.4178
         : individual accs = ['0.519533', '0.569512', '0.540236', '0.517690', '0.586810', '0.513602', '0.534086', '0.594182', '0.527844', '0.508801', '0.562535', '0.539994', '0.522851', '0.499443', '0.533799', '0.526919', '0.537563', '0.593743', '0.601853', '0.559275']
         : correct/total = [(7394, 14232), (8107, 14235), (7707, 14266), (7360, 14217), (8355, 14238), (7382, 14373), (7662, 14346), (8517, 14334), (7545, 14294), (7313, 14373), (8069, 14344), (7723, 14302), (7505, 14354), (7173, 14362), (7644, 14320), (7585, 14395), (7735, 14389), (8465, 14257), (8577, 14251), (8053, 14399)]
         : compromised: 0.5415, honest: 0.5516
         : sketchguard stats = ['Node 0: acc_rate=0.667', 'Node 1: acc_rate=0.500', 'Node 2: acc_rate=0.400']...
Round 005: test acc mean=0.5850 ± 0.0318 | min=0.5002 max=0.6282
         : test loss mean=0.7902 ± 0.5247
         : individual accs = ['0.573707', '0.576466', '0.563858', '0.564676', '0.626844', '0.606137', '0.576886', '0.628227', '0.584511', '0.570584', '0.616146', '0.572647', '0.557057', '0.500209', '0.553631', '0.601459', '0.563764', '0.622571', '0.625149', '0.616362']
         : correct/total = [(8165, 14232), (8206, 14235), (8044, 14266), (8028, 14217), (8925, 14238), (8712, 14373), (8276, 14346), (9005, 14334), (8355, 14294), (8201, 14373), (8838, 14344), (8190, 14302), (7996, 14354), (7184, 14362), (7928, 14320), (8658, 14395), (8112, 14389), (8876, 14257), (8909, 14251), (8875, 14399)]
         : compromised: 0.5801, honest: 0.5965
         : sketchguard stats = ['Node 0: acc_rate=0.600', 'Node 1: acc_rate=0.467', 'Node 2: acc_rate=0.360']...
Round 006: test acc mean=0.6005 ± 0.0356 | min=0.5092 max=0.6448
         : test loss mean=0.7923 ± 0.5844
         : individual accs = ['0.587409', '0.573235', '0.582504', '0.589154', '0.635061', '0.644751', '0.591036', '0.644063', '0.595984', '0.592639', '0.637409', '0.562788', '0.590637', '0.509191', '0.562779', '0.632859', '0.567378', '0.639966', '0.635464', '0.635044']
         : correct/total = [(8360, 14232), (8160, 14235), (8310, 14266), (8376, 14217), (9042, 14238), (9267, 14373), (8479, 14346), (9232, 14334), (8519, 14294), (8518, 14373), (9143, 14344), (8049, 14302), (8478, 14354), (7313, 14362), (8059, 14320), (9110, 14395), (8164, 14389), (9124, 14257), (9056, 14251), (9144, 14399)]
         : compromised: 0.5961, honest: 0.6107
         : sketchguard stats = ['Node 0: acc_rate=0.556', 'Node 1: acc_rate=0.444', 'Node 2: acc_rate=0.333']...
Round 007: test acc mean=0.6172 ± 0.0333 | min=0.4940 max=0.6502
         : test loss mean=1.0632 ± 1.8189
         : individual accs = ['0.600689', '0.630488', '0.603323', '0.603081', '0.642646', '0.641411', '0.602049', '0.644551', '0.609347', '0.603980', '0.639013', '0.621242', '0.611119', '0.494012', '0.606425', '0.641820', '0.611231', '0.650207', '0.641429', '0.645323']
         : correct/total = [(8549, 14232), (8975, 14235), (8607, 14266), (8574, 14217), (9150, 14238), (9219, 14373), (8637, 14346), (9239, 14334), (8710, 14294), (8681, 14373), (9166, 14344), (8885, 14302), (8772, 14354), (7095, 14362), (8684, 14320), (9239, 14395), (8795, 14389), (9270, 14257), (9141, 14251), (9292, 14399)]
         : compromised: 0.6144, honest: 0.6237
         : sketchguard stats = ['Node 0: acc_rate=0.524', 'Node 1: acc_rate=0.381', 'Node 2: acc_rate=0.314']...
Round 008: test acc mean=0.6242 ± 0.0344 | min=0.5086 max=0.6607
         : test loss mean=0.7477 ± 0.4702
         : individual accs = ['0.602234', '0.643203', '0.604094', '0.593093', '0.657887', '0.655604', '0.616688', '0.659760', '0.617462', '0.602936', '0.646054', '0.652007', '0.620176', '0.508634', '0.607682', '0.638347', '0.614914', '0.660658', '0.625851', '0.656851']
         : correct/total = [(8571, 14232), (9156, 14235), (8618, 14266), (8432, 14217), (9367, 14238), (9423, 14373), (8847, 14346), (9457, 14334), (8826, 14294), (8666, 14373), (9267, 14344), (9325, 14302), (8902, 14354), (7305, 14362), (8702, 14320), (9189, 14395), (8848, 14389), (9419, 14257), (8919, 14251), (9458, 14399)]
         : compromised: 0.6215, honest: 0.6306
         : sketchguard stats = ['Node 0: acc_rate=0.500', 'Node 1: acc_rate=0.354', 'Node 2: acc_rate=0.300']...
Round 009: test acc mean=0.6345 ± 0.0390 | min=0.4912 max=0.6695
         : test loss mean=0.6398 ± 0.0454
         : individual accs = ['0.619028', '0.654162', '0.616851', '0.605332', '0.658168', '0.668754', '0.621776', '0.669457', '0.635232', '0.611007', '0.662019', '0.655852', '0.629999', '0.491227', '0.621927', '0.665509', '0.625339', '0.662762', '0.657989', '0.658379']
         : correct/total = [(8810, 14232), (9312, 14235), (8800, 14266), (8606, 14217), (9371, 14238), (9612, 14373), (8920, 14346), (9596, 14334), (9080, 14294), (8782, 14373), (9496, 14344), (9380, 14302), (9043, 14354), (7055, 14362), (8906, 14320), (9580, 14395), (8998, 14389), (9449, 14257), (9377, 14251), (9480, 14399)]
         : compromised: 0.6318, honest: 0.6408
         : sketchguard stats = ['Node 0: acc_rate=0.481', 'Node 1: acc_rate=0.333', 'Node 2: acc_rate=0.289']...
Round 010: test acc mean=0.6440 ± 0.0391 | min=0.4952 max=0.6745
         : test loss mean=0.6888 ± 0.2981
         : individual accs = ['0.633291', '0.670952', '0.626244', '0.628262', '0.667299', '0.670980', '0.638296', '0.672666', '0.644186', '0.626661', '0.668921', '0.670606', '0.630068', '0.495196', '0.629609', '0.674470', '0.631246', '0.673704', '0.658340', '0.669005']
         : correct/total = [(9013, 14232), (9551, 14235), (8934, 14266), (8932, 14217), (9501, 14238), (9644, 14373), (9157, 14346), (9642, 14334), (9208, 14294), (9007, 14373), (9595, 14344), (9591, 14302), (9044, 14354), (7112, 14362), (9016, 14320), (9709, 14395), (9083, 14389), (9605, 14257), (9382, 14251), (9633, 14399)]
         : compromised: 0.6414, honest: 0.6500
         : sketchguard stats = ['Node 0: acc_rate=0.467', 'Node 1: acc_rate=0.317', 'Node 2: acc_rate=0.280']...

=== FINAL RESULTS ===
Dataset: sent140, Nodes: 20, Graph: erdos, Aggregation: sketchguard
Attack: directed_deviation, 70.0% compromised
Final accuracy - Compromised: 0.6414, Honest: 0.6500
Overall test accuracy: mean=0.6440 ± 0.0391

=== Sketchguard SUMMARY ===
Node 0: acceptance=0.467
Node 1: acceptance=0.317
Node 2: acceptance=0.280
Node 3: acceptance=0.325
Node 4: acceptance=0.375
Node 5: acceptance=0.240
Node 6: acceptance=0.280
Node 7: acceptance=0.460
Node 8: acceptance=0.500
Node 9: acceptance=0.467
Node 10: acceptance=0.400
Node 11: acceptance=0.271
Node 12: acceptance=0.400
Node 13: acceptance=0.100
Node 14: acceptance=0.214
Node 15: acceptance=0.233
Node 16: acceptance=0.320
Node 17: acceptance=0.440
Node 18: acceptance=0.275
Node 19: acceptance=0.550

=== PARALLEL EXECUTION TIME (realistic for distributed system) ===
  COMMUNICATION (max across nodes):
    - Sketch transfer: 0.000s (0.0%)
    - Model fetch (accepted): 0.000s (0.0%)
  COMPUTATION (max across nodes):
    - Sketching: 0.229s (95.3%)
    - Filtering: 0.001s (0.3%)
    - Aggregation: 0.010s (4.3%)
  TOTALS:
    - Total computation: 0.240s (100.0%)
    - Total communication: 0.000s (0.0%)
    - Total parallel time: 0.240s

=== PER-NODE AVERAGE TIME ===
  - Sketching: 0.182s
  - Filtering: 0.000s
  - Aggregation: 0.007s
  - Sketch transfer: 0.000s
  - Model fetch: 0.000s
  - Total per node: 0.189s

=== TOTAL COMPUTATIONAL WORK (sum across all nodes) ===
  - Total sketching: 3.637s
  - Total filtering: 0.008s
  - Total aggregation: 0.135s
  - Total sketch transfer: 0.000s
  - Total model fetch: 0.000s
  - Grand total: 3.780s
  - Mean acceptance rate: 0.346

Sketchguard Algorithm Properties:
  - Original dimension: 1,174,986
  - Sketch size: 180
  - Compression ratio: 19.9x
  - Single repetition: No repetitions needed
  - Theoretical complexity: O(d + N×k)
  - Approach: Sketch filtering + state aggregation
