Device: cuda
Seed: 987654321
Loading 1 LEAF Sent140 train files...
LEAF Sent140 train: 254555 users, 908652 samples
Building vocabulary (max_size=10000)...
Vocabulary size: 10000
Loading 1 LEAF Sent140 test files...
LEAF Sent140 test: 254555 users, 286281 samples
Found 254555 train users, 254555 test users, 254555 common users
User sample counts range: 494 (max) to 1 (min)
Distributed ALL 254555 users across 20 clients
Users per client: 12727 (with 15 clients getting +1 user)
Train partition sizes: [44353, 44290, 44657, 44907, 44696, 45843, 45801, 45619, 45069, 45639, 45821, 45311, 45779, 46056, 45625, 45984, 46428, 44737, 45540, 46497]
Test partition sizes: [14232, 14235, 14266, 14217, 14238, 14373, 14346, 14334, 14294, 14373, 14344, 14302, 14354, 14362, 14320, 14395, 14389, 14257, 14251, 14399]
  Client 0: 44353 train samples, 2 unique classes
  Client 1: 44290 train samples, 2 unique classes
  Client 2: 44657 train samples, 2 unique classes
  Client 3: 44907 train samples, 2 unique classes
  Client 4: 44696 train samples, 2 unique classes
  Client 5: 45843 train samples, 2 unique classes
  Client 6: 45801 train samples, 2 unique classes
  Client 7: 45619 train samples, 2 unique classes
  Client 8: 45069 train samples, 2 unique classes
  Client 9: 45639 train samples, 2 unique classes
  Client 10: 45821 train samples, 2 unique classes
  Client 11: 45311 train samples, 2 unique classes
  Client 12: 45779 train samples, 2 unique classes
  Client 13: 46056 train samples, 2 unique classes
  Client 14: 45625 train samples, 2 unique classes
  Client 15: 45984 train samples, 2 unique classes
  Client 16: 46428 train samples, 2 unique classes
  Client 17: 44737 train samples, 2 unique classes
  Client 18: 45540 train samples, 2 unique classes
  Client 19: 46497 train samples, 2 unique classes
Will sample 4500 samples per client per epoch
Graph: erdos, nodes: 20, edges: 99
Degree statistics: avg=9.90, min=7, max=14
Attack: Compromised 2/20 nodes: [5, 13]
Attack type: backdoor, lambda: 1.0
Backdoor target label: 1, trigger size: 3
Model variant: baseline
Model parameters: 1,174,986
Sketchguard Node 0:
  Model dim: 1,174,986 → Sketch size: 180
  Compression ratio: 6527.7x
  Using model parameters for aggregation, sketches for filtering
Sketchguard Node 1:
  Model dim: 1,174,986 → Sketch size: 180
  Compression ratio: 6527.7x
  Using model parameters for aggregation, sketches for filtering
Sketchguard Node 2:
  Model dim: 1,174,986 → Sketch size: 180
  Compression ratio: 6527.7x
  Using model parameters for aggregation, sketches for filtering
Sketchguard Node 3:
  Model dim: 1,174,986 → Sketch size: 180
  Compression ratio: 6527.7x
  Using model parameters for aggregation, sketches for filtering
Sketchguard Node 4:
  Model dim: 1,174,986 → Sketch size: 180
  Compression ratio: 6527.7x
  Using model parameters for aggregation, sketches for filtering
Sketchguard Node 5:
  Model dim: 1,174,986 → Sketch size: 180
  Compression ratio: 6527.7x
  Using model parameters for aggregation, sketches for filtering
Sketchguard Node 6:
  Model dim: 1,174,986 → Sketch size: 180
  Compression ratio: 6527.7x
  Using model parameters for aggregation, sketches for filtering
Sketchguard Node 7:
  Model dim: 1,174,986 → Sketch size: 180
  Compression ratio: 6527.7x
  Using model parameters for aggregation, sketches for filtering
Sketchguard Node 8:
  Model dim: 1,174,986 → Sketch size: 180
  Compression ratio: 6527.7x
  Using model parameters for aggregation, sketches for filtering
Sketchguard Node 9:
  Model dim: 1,174,986 → Sketch size: 180
  Compression ratio: 6527.7x
  Using model parameters for aggregation, sketches for filtering
Sketchguard Node 10:
  Model dim: 1,174,986 → Sketch size: 180
  Compression ratio: 6527.7x
  Using model parameters for aggregation, sketches for filtering
Sketchguard Node 11:
  Model dim: 1,174,986 → Sketch size: 180
  Compression ratio: 6527.7x
  Using model parameters for aggregation, sketches for filtering
Sketchguard Node 12:
  Model dim: 1,174,986 → Sketch size: 180
  Compression ratio: 6527.7x
  Using model parameters for aggregation, sketches for filtering
Sketchguard Node 13:
  Model dim: 1,174,986 → Sketch size: 180
  Compression ratio: 6527.7x
  Using model parameters for aggregation, sketches for filtering
Sketchguard Node 14:
  Model dim: 1,174,986 → Sketch size: 180
  Compression ratio: 6527.7x
  Using model parameters for aggregation, sketches for filtering
Sketchguard Node 15:
  Model dim: 1,174,986 → Sketch size: 180
  Compression ratio: 6527.7x
  Using model parameters for aggregation, sketches for filtering
Sketchguard Node 16:
  Model dim: 1,174,986 → Sketch size: 180
  Compression ratio: 6527.7x
  Using model parameters for aggregation, sketches for filtering
Sketchguard Node 17:
  Model dim: 1,174,986 → Sketch size: 180
  Compression ratio: 6527.7x
  Using model parameters for aggregation, sketches for filtering
Sketchguard Node 18:
  Model dim: 1,174,986 → Sketch size: 180
  Compression ratio: 6527.7x
  Using model parameters for aggregation, sketches for filtering
Sketchguard Node 19:
  Model dim: 1,174,986 → Sketch size: 180
  Compression ratio: 6527.7x
  Using model parameters for aggregation, sketches for filtering
Sketchguard ALGORITHM (Sketch-based Filtering + State Aggregation)
  - Model dimension: 1,174,986 parameters
  - Config: SketchguardConfig(gamma=2, kappa=1, alpha=0.5, min_neighbors=1, sketch_size=180, network_seed=987654321, attack_detection_window=5)
  - Sketch size: 180
  - Compression ratio: 6527.7x
  - Complexity: O(d + N×k) = O(1,174,986 + 20×180)
  - Theoretical speedup vs BALANCE: 19.9x
Initial test acc across nodes: mean=0.4953 ± 0.0174
Backdoor attack: Created poisoned datasets for 2 compromised nodes
Round 001: test acc mean=0.5148 ± 0.0185 | min=0.4879 max=0.5559
         : test loss mean=4.5473 ± 11.5192
         : individual accs = ['0.541526', '0.515349', '0.517314', '0.487937', '0.520017', '0.523342', '0.498676', '0.507814', '0.501749', '0.554373', '0.522518', '0.510138', '0.497353', '0.518660', '0.507402', '0.488781', '0.523247', '0.504735', '0.555891', '0.499062']
         : correct/total = [(7707, 14232), (7336, 14235), (7380, 14266), (6937, 14217), (7404, 14238), (7522, 14373), (7154, 14346), (7279, 14334), (7172, 14294), (7968, 14373), (7495, 14344), (7296, 14302), (7139, 14354), (7449, 14362), (7266, 14320), (7036, 14395), (7529, 14389), (7196, 14257), (7922, 14251), (7186, 14399)]
         : compromised: 0.5210, honest: 0.5141
         : sketchguard stats = ['Node 0: acc_rate=1.000', 'Node 1: acc_rate=1.000', 'Node 2: acc_rate=1.000']...
Round 002: test acc mean=0.5706 ± 0.0442 | min=0.4977 max=0.6300
         : test loss mean=47.5720 ± 141.3960
         : individual accs = ['0.609963', '0.624517', '0.559652', '0.591967', '0.630004', '0.512489', '0.609159', '0.616646', '0.593396', '0.500522', '0.567694', '0.611872', '0.504041', '0.497702', '0.540503', '0.563529', '0.510390', '0.564074', '0.606694', '0.596639']
         : correct/total = [(8681, 14232), (8890, 14235), (7984, 14266), (8416, 14217), (8970, 14238), (7366, 14373), (8739, 14346), (8839, 14334), (8482, 14294), (7194, 14373), (8143, 14344), (8751, 14302), (7235, 14354), (7148, 14362), (7740, 14320), (8112, 14395), (7344, 14389), (8042, 14257), (8646, 14251), (8591, 14399)]
         : compromised: 0.5051, honest: 0.5778
         : sketchguard stats = ['Node 0: acc_rate=0.958', 'Node 1: acc_rate=0.950', 'Node 2: acc_rate=1.000']...
Round 003: test acc mean=0.5642 ± 0.0446 | min=0.4943 max=0.6228
         : test loss mean=2111.8872 ± 6348.8032
         : individual accs = ['0.556282', '0.597331', '0.515421', '0.603784', '0.622840', '0.497252', '0.561690', '0.543533', '0.622079', '0.524943', '0.546152', '0.600056', '0.597394', '0.494290', '0.606285', '0.525738', '0.523942', '0.621028', '0.615045', '0.508577']
         : correct/total = [(7917, 14232), (8503, 14235), (7353, 14266), (8584, 14217), (8868, 14238), (7147, 14373), (8058, 14346), (7791, 14334), (8892, 14294), (7545, 14373), (7834, 14344), (8582, 14302), (8575, 14354), (7099, 14362), (8682, 14320), (7568, 14395), (7539, 14389), (8854, 14257), (8765, 14251), (7323, 14399)]
         : compromised: 0.4958, honest: 0.5718
         : sketchguard stats = ['Node 0: acc_rate=0.944', 'Node 1: acc_rate=0.933', 'Node 2: acc_rate=1.000']...
Round 004: test acc mean=0.6073 ± 0.0376 | min=0.4983 max=0.6372
         : test loss mean=89606.3529 ± 270769.6979
         : individual accs = ['0.622822', '0.637232', '0.608790', '0.634452', '0.627757', '0.502192', '0.624146', '0.631087', '0.636911', '0.606554', '0.598020', '0.605440', '0.604500', '0.498259', '0.620251', '0.617714', '0.612968', '0.601249', '0.629008', '0.626571']
         : correct/total = [(8864, 14232), (9071, 14235), (8685, 14266), (9020, 14217), (8938, 14238), (7218, 14373), (8954, 14346), (9046, 14334), (9104, 14294), (8718, 14373), (8578, 14344), (8659, 14302), (8677, 14354), (7156, 14362), (8882, 14320), (8892, 14395), (8820, 14389), (8572, 14257), (8964, 14251), (9022, 14399)]
         : compromised: 0.5002, honest: 0.6192
         : sketchguard stats = ['Node 0: acc_rate=0.937', 'Node 1: acc_rate=0.925', 'Node 2: acc_rate=1.000']...
Round 005: test acc mean=0.6186 ± 0.0412 | min=0.4953 max=0.6427
         : test loss mean=7726307.2334 ± 23301262.6822
         : individual accs = ['0.633221', '0.641307', '0.624141', '0.635085', '0.640750', '0.502679', '0.634184', '0.634366', '0.642717', '0.631601', '0.630577', '0.634806', '0.634875', '0.495265', '0.640782', '0.594720', '0.621864', '0.633163', '0.623395', '0.641503']
         : correct/total = [(9012, 14232), (9129, 14235), (8904, 14266), (9029, 14217), (9123, 14238), (7225, 14373), (9098, 14346), (9093, 14334), (9187, 14294), (9078, 14373), (9045, 14344), (9079, 14302), (9113, 14354), (7113, 14362), (9176, 14320), (8561, 14395), (8948, 14389), (9027, 14257), (8884, 14251), (9237, 14399)]
         : compromised: 0.4990, honest: 0.6318
         : sketchguard stats = ['Node 0: acc_rate=0.933', 'Node 1: acc_rate=0.920', 'Node 2: acc_rate=1.000']...
Round 006: test acc mean=0.6280 ± 0.0423 | min=0.5011 max=0.6494
         : test loss mean=479470322.5117 ± 1439437642.7674
         : individual accs = ['0.643269', '0.648964', '0.636829', '0.643877', '0.643911', '0.502539', '0.639621', '0.647970', '0.649433', '0.639115', '0.633784', '0.637813', '0.642817', '0.501114', '0.645321', '0.642515', '0.646814', '0.634916', '0.635955', '0.642475']
         : correct/total = [(9155, 14232), (9238, 14235), (9085, 14266), (9154, 14217), (9168, 14238), (7223, 14373), (9176, 14346), (9288, 14334), (9283, 14294), (9186, 14373), (9091, 14344), (9122, 14302), (9227, 14354), (7197, 14362), (9241, 14320), (9249, 14395), (9307, 14389), (9052, 14257), (9063, 14251), (9251, 14399)]
         : compromised: 0.5018, honest: 0.6420
         : sketchguard stats = ['Node 0: acc_rate=0.931', 'Node 1: acc_rate=0.917', 'Node 2: acc_rate=1.000']...
Round 007: test acc mean=0.6318 ± 0.0424 | min=0.4994 max=0.6580
         : test loss mean=50852611550.1820 ± 179704661407.1429
         : individual accs = ['0.650506', '0.657956', '0.640474', '0.646620', '0.657958', '0.513671', '0.641991', '0.631296', '0.655660', '0.644959', '0.633854', '0.644106', '0.649087', '0.499373', '0.651187', '0.635846', '0.646119', '0.645087', '0.640446', '0.649281']
         : correct/total = [(9258, 14232), (9366, 14235), (9137, 14266), (9193, 14217), (9368, 14238), (7383, 14373), (9210, 14346), (9049, 14334), (9372, 14294), (9270, 14373), (9092, 14344), (9212, 14302), (9317, 14354), (7172, 14362), (9325, 14320), (9153, 14395), (9297, 14389), (9197, 14257), (9127, 14251), (9349, 14399)]
         : compromised: 0.5065, honest: 0.6457
         : sketchguard stats = ['Node 0: acc_rate=0.929', 'Node 1: acc_rate=0.914', 'Node 2: acc_rate=1.000']...
Round 008: test acc mean=0.6378 ± 0.0460 | min=0.5012 max=0.6622
         : test loss mean=4399948001180.8740 ± 13545540373566.7676
         : individual accs = ['0.653738', '0.647208', '0.629399', '0.662165', '0.647422', '0.501218', '0.657256', '0.657318', '0.662096', '0.654143', '0.654838', '0.657530', '0.649923', '0.501950', '0.658031', '0.652935', '0.656126', '0.647401', '0.646621', '0.658935']
         : correct/total = [(9304, 14232), (9213, 14235), (8979, 14266), (9414, 14217), (9218, 14238), (7204, 14373), (9429, 14346), (9422, 14334), (9464, 14294), (9402, 14373), (9393, 14344), (9404, 14302), (9329, 14354), (7209, 14362), (9423, 14320), (9399, 14395), (9441, 14389), (9230, 14257), (9215, 14251), (9488, 14399)]
         : compromised: 0.5016, honest: 0.6529
         : sketchguard stats = ['Node 0: acc_rate=0.927', 'Node 1: acc_rate=0.913', 'Node 2: acc_rate=1.000']...
Round 009: test acc mean=0.6405 ± 0.0510 | min=0.4892 max=0.6688
         : test loss mean=302622096276198.2500 ± 992121542074700.1250
         : individual accs = ['0.617341', '0.668844', '0.657087', '0.663642', '0.655078', '0.489181', '0.655165', '0.657807', '0.667483', '0.657761', '0.641523', '0.655433', '0.657865', '0.492759', '0.661732', '0.658840', '0.665578', '0.660938', '0.659252', '0.666227']
         : correct/total = [(8786, 14232), (9521, 14235), (9374, 14266), (9435, 14217), (9327, 14238), (7031, 14373), (9399, 14346), (9429, 14334), (9541, 14294), (9454, 14373), (9202, 14344), (9374, 14302), (9443, 14354), (7077, 14362), (9476, 14320), (9484, 14395), (9577, 14389), (9423, 14257), (9395, 14251), (9593, 14399)]
         : compromised: 0.4910, honest: 0.6571
         : sketchguard stats = ['Node 0: acc_rate=0.926', 'Node 1: acc_rate=0.911', 'Node 2: acc_rate=1.000']...
Round 010: test acc mean=0.6506 ± 0.0508 | min=0.4889 max=0.6775
         : test loss mean=23598107528562792.0000 ± 73595238280551552.0000
         : individual accs = ['0.667931', '0.675729', '0.644329', '0.670887', '0.676078', '0.511654', '0.670291', '0.677550', '0.672170', '0.656996', '0.661182', '0.669487', '0.671102', '0.488929', '0.670950', '0.664189', '0.670651', '0.666690', '0.660024', '0.665393']
         : correct/total = [(9506, 14232), (9619, 14235), (9192, 14266), (9538, 14217), (9626, 14238), (7354, 14373), (9616, 14346), (9712, 14334), (9608, 14294), (9443, 14373), (9484, 14344), (9575, 14302), (9633, 14354), (7022, 14362), (9608, 14320), (9561, 14395), (9650, 14389), (9505, 14257), (9406, 14251), (9581, 14399)]
         : compromised: 0.5003, honest: 0.6673
         : sketchguard stats = ['Node 0: acc_rate=0.925', 'Node 1: acc_rate=0.910', 'Node 2: acc_rate=1.000']...

=== FINAL RESULTS ===
Dataset: sent140, Nodes: 20, Graph: erdos, Aggregation: sketchguard
Attack: backdoor, 10.0% compromised
Final accuracy - Compromised: 0.5003, Honest: 0.6673
Overall test accuracy: mean=0.6506 ± 0.0508

=== BACKDOOR ATTACK SUCCESS RATE (ASR) ===
Target label: 1
Trigger size: 3x3
Overall ASR: 0.5638 ± 0.1490
Honest nodes ASR: 0.5185 ± 0.0643
Compromised nodes ASR: 0.9716 ± 0.0082
Note: Higher ASR indicates more successful backdoor attack

=== Sketchguard SUMMARY ===
Node 0: acceptance=0.925
Node 1: acceptance=0.910
Node 2: acceptance=1.000
Node 3: acceptance=0.871
Node 4: acceptance=0.900
Node 5: acceptance=0.600
Node 6: acceptance=0.850
Node 7: acceptance=0.918
Node 8: acceptance=0.743
Node 9: acceptance=1.000
Node 10: acceptance=1.000
Node 11: acceptance=0.850
Node 12: acceptance=0.925
Node 13: acceptance=0.600
Node 14: acceptance=0.871
Node 15: acceptance=0.900
Node 16: acceptance=1.000
Node 17: acceptance=0.887
Node 18: acceptance=0.925
Node 19: acceptance=0.820

=== PARALLEL EXECUTION TIME (realistic for distributed system) ===
  COMMUNICATION (max across nodes):
    - Sketch transfer: 0.000s (0.0%)
    - Model fetch (accepted): 0.000s (0.0%)
  COMPUTATION (max across nodes):
    - Sketching: 0.452s (95.0%)
    - Filtering: 0.001s (0.2%)
    - Aggregation: 0.023s (4.7%)
  TOTALS:
    - Total computation: 0.476s (100.0%)
    - Total communication: 0.000s (0.0%)
    - Total parallel time: 0.476s

=== PER-NODE AVERAGE TIME ===
  - Sketching: 0.362s
  - Filtering: 0.001s
  - Aggregation: 0.016s
  - Sketch transfer: 0.000s
  - Model fetch: 0.000s
  - Total per node: 0.378s

=== TOTAL COMPUTATIONAL WORK (sum across all nodes) ===
  - Total sketching: 7.232s
  - Total filtering: 0.012s
  - Total aggregation: 0.326s
  - Total sketch transfer: 0.000s
  - Total model fetch: 0.000s
  - Grand total: 7.569s
  - Mean acceptance rate: 0.875

Sketchguard Algorithm Properties:
  - Original dimension: 1,174,986
  - Sketch size: 180
  - Compression ratio: 19.9x
  - Single repetition: No repetitions needed
  - Theoretical complexity: O(d + N×k)
  - Approach: Sketch filtering + state aggregation
