Device: cuda
Seed: 987654321
Loading 1 LEAF Sent140 train files...
LEAF Sent140 train: 254555 users, 908652 samples
Building vocabulary (max_size=10000)...
Vocabulary size: 10000
Loading 1 LEAF Sent140 test files...
LEAF Sent140 test: 254555 users, 286281 samples
Found 254555 train users, 254555 test users, 254555 common users
User sample counts range: 494 (max) to 1 (min)
Distributed ALL 254555 users across 20 clients
Users per client: 12727 (with 15 clients getting +1 user)
Train partition sizes: [44353, 44290, 44657, 44907, 44696, 45843, 45801, 45619, 45069, 45639, 45821, 45311, 45779, 46056, 45625, 45984, 46428, 44737, 45540, 46497]
Test partition sizes: [14232, 14235, 14266, 14217, 14238, 14373, 14346, 14334, 14294, 14373, 14344, 14302, 14354, 14362, 14320, 14395, 14389, 14257, 14251, 14399]
  Client 0: 44353 train samples, 2 unique classes
  Client 1: 44290 train samples, 2 unique classes
  Client 2: 44657 train samples, 2 unique classes
  Client 3: 44907 train samples, 2 unique classes
  Client 4: 44696 train samples, 2 unique classes
  Client 5: 45843 train samples, 2 unique classes
  Client 6: 45801 train samples, 2 unique classes
  Client 7: 45619 train samples, 2 unique classes
  Client 8: 45069 train samples, 2 unique classes
  Client 9: 45639 train samples, 2 unique classes
  Client 10: 45821 train samples, 2 unique classes
  Client 11: 45311 train samples, 2 unique classes
  Client 12: 45779 train samples, 2 unique classes
  Client 13: 46056 train samples, 2 unique classes
  Client 14: 45625 train samples, 2 unique classes
  Client 15: 45984 train samples, 2 unique classes
  Client 16: 46428 train samples, 2 unique classes
  Client 17: 44737 train samples, 2 unique classes
  Client 18: 45540 train samples, 2 unique classes
  Client 19: 46497 train samples, 2 unique classes
Will sample 4500 samples per client per epoch
Graph: erdos, nodes: 20, edges: 126
Degree statistics: avg=12.60, min=8, max=16
Attack: Compromised 10/20 nodes: [1, 2, 5, 11, 12, 13, 14, 15, 17, 18]
Attack type: directed_deviation, lambda: 1.0
Model variant: baseline
Model parameters: 1,174,986
Initial test acc across nodes: mean=0.4953 ± 0.0174
Round 001: test acc mean=0.5040 ± 0.0075 | min=0.4902 max=0.5188
         : test loss mean=5.9440 ± 3.7153
         : individual accs = ['0.509345', '0.490200', '0.513318', '0.514384', '0.498033', '0.501218', '0.500488', '0.502302', '0.496362', '0.508662', '0.509133', '0.506153', '0.504389', '0.509887', '0.506774', '0.495728', '0.503788', '0.490426', '0.518771', '0.500035']
         : correct/total = [(7249, 14232), (6978, 14235), (7323, 14266), (7313, 14217), (7091, 14238), (7204, 14373), (7180, 14346), (7200, 14334), (7095, 14294), (7311, 14373), (7303, 14344), (7239, 14302), (7240, 14354), (7323, 14362), (7257, 14320), (7136, 14395), (7249, 14389), (6992, 14257), (7393, 14251), (7200, 14399)]
         : compromised: 0.5037, honest: 0.5043
Round 002: test acc mean=0.5026 ± 0.0053 | min=0.4946 max=0.5191
         : test loss mean=4.0382 ± 1.0138
         : individual accs = ['0.494590', '0.502213', '0.506869', '0.519097', '0.498736', '0.504627', '0.501812', '0.504604', '0.501049', '0.505322', '0.496305', '0.498182', '0.501742', '0.495892', '0.502374', '0.503786', '0.497741', '0.508592', '0.506771', '0.502604']
         : correct/total = [(7039, 14232), (7149, 14235), (7231, 14266), (7380, 14217), (7101, 14238), (7253, 14373), (7199, 14346), (7233, 14334), (7162, 14294), (7263, 14373), (7119, 14344), (7125, 14302), (7202, 14354), (7122, 14362), (7194, 14320), (7252, 14395), (7162, 14389), (7251, 14257), (7222, 14251), (7237, 14399)]
         : compromised: 0.5031, honest: 0.5022
Round 003: test acc mean=0.4997 ± 0.0094 | min=0.4758 max=0.5176
         : test loss mean=0.9893 ± 0.1741
         : individual accs = ['0.492201', '0.483246', '0.508131', '0.504115', '0.503020', '0.508592', '0.475812', '0.504535', '0.505037', '0.495373', '0.498466', '0.505873', '0.502299', '0.505083', '0.499441', '0.501285', '0.517618', '0.495265', '0.486492', '0.502327']
         : correct/total = [(7005, 14232), (6879, 14235), (7249, 14266), (7167, 14217), (7162, 14238), (7310, 14373), (6826, 14346), (7232, 14334), (7219, 14294), (7120, 14373), (7150, 14344), (7235, 14302), (7210, 14354), (7254, 14362), (7152, 14320), (7216, 14395), (7448, 14389), (7061, 14257), (6933, 14251), (7233, 14399)]
         : compromised: 0.4996, honest: 0.4999
Round 004: test acc mean=0.4977 ± 0.0070 | min=0.4884 max=0.5185
         : test loss mean=1.1615 ± 0.2894
         : individual accs = ['0.493676', '0.496031', '0.495514', '0.518464', '0.503231', '0.494817', '0.493029', '0.502023', '0.502379', '0.489042', '0.505159', '0.488393', '0.505086', '0.495613', '0.500628', '0.497534', '0.488915', '0.498001', '0.489510', '0.497326']
         : correct/total = [(7026, 14232), (7061, 14235), (7069, 14266), (7371, 14217), (7165, 14238), (7112, 14373), (7073, 14346), (7196, 14334), (7181, 14294), (7029, 14373), (7246, 14344), (6985, 14302), (7250, 14354), (7118, 14362), (7169, 14320), (7162, 14395), (7035, 14389), (7100, 14257), (6976, 14251), (7161, 14399)]
         : compromised: 0.4961, honest: 0.4993
Round 005: test acc mean=0.4986 ± 0.0109 | min=0.4702 max=0.5178
         : test loss mean=0.8442 ± 0.1437
         : individual accs = ['0.500773', '0.502283', '0.511145', '0.485827', '0.501967', '0.490920', '0.506134', '0.505023', '0.500770', '0.495304', '0.499094', '0.505454', '0.503623', '0.517755', '0.475698', '0.503300', '0.503996', '0.495195', '0.498351', '0.470172']
         : correct/total = [(7127, 14232), (7150, 14235), (7292, 14266), (6907, 14217), (7147, 14238), (7056, 14373), (7261, 14346), (7239, 14334), (7158, 14294), (7119, 14373), (7159, 14344), (7229, 14302), (7229, 14354), (7436, 14362), (6812, 14320), (7245, 14395), (7252, 14389), (7060, 14257), (7102, 14251), (6770, 14399)]
         : compromised: 0.5004, honest: 0.4969
Round 006: test acc mean=0.5046 ± 0.0058 | min=0.4960 max=0.5195
         : test loss mean=0.8309 ± 0.0663
         : individual accs = ['0.508010', '0.519494', '0.501752', '0.516072', '0.503863', '0.498922', '0.502300', '0.498954', '0.500000', '0.505253', '0.503904', '0.501119', '0.498955', '0.495962', '0.512430', '0.502883', '0.508583', '0.505015', '0.505438', '0.503229']
         : correct/total = [(7230, 14232), (7395, 14235), (7158, 14266), (7337, 14217), (7174, 14238), (7171, 14373), (7206, 14346), (7152, 14334), (7147, 14294), (7262, 14373), (7228, 14344), (7167, 14302), (7162, 14354), (7123, 14362), (7338, 14320), (7239, 14395), (7318, 14389), (7200, 14257), (7203, 14251), (7246, 14399)]
         : compromised: 0.5042, honest: 0.5050
Round 007: test acc mean=0.4991 ± 0.0079 | min=0.4835 max=0.5237
         : test loss mean=0.7234 ± 0.0455
         : individual accs = ['0.493676', '0.483456', '0.523693', '0.487656', '0.495224', '0.498713', '0.506831', '0.503209', '0.503008', '0.495512', '0.497909', '0.500629', '0.503344', '0.507102', '0.496369', '0.495380', '0.500382', '0.496458', '0.495825', '0.498160']
         : correct/total = [(7026, 14232), (6882, 14235), (7471, 14266), (6933, 14217), (7051, 14238), (7168, 14373), (7271, 14346), (7213, 14334), (7190, 14294), (7122, 14373), (7142, 14344), (7160, 14302), (7225, 14354), (7283, 14362), (7108, 14320), (7131, 14395), (7200, 14389), (7078, 14257), (7066, 14251), (7173, 14399)]
         : compromised: 0.5001, honest: 0.4982
Round 008: test acc mean=0.5069 ± 0.0068 | min=0.4974 max=0.5212
         : test loss mean=0.7688 ± 0.0512
         : individual accs = ['0.513420', '0.521180', '0.497406', '0.516354', '0.511659', '0.502470', '0.503764', '0.504395', '0.502169', '0.513671', '0.508854', '0.500979', '0.505016', '0.498607', '0.505377', '0.504898', '0.501425', '0.519184', '0.509508', '0.498368']
         : correct/total = [(7307, 14232), (7419, 14235), (7096, 14266), (7341, 14217), (7285, 14238), (7222, 14373), (7227, 14346), (7230, 14334), (7178, 14294), (7383, 14373), (7299, 14344), (7165, 14302), (7249, 14354), (7161, 14362), (7237, 14320), (7268, 14395), (7215, 14389), (7402, 14257), (7261, 14251), (7176, 14399)]
         : compromised: 0.5065, honest: 0.5074
Round 009: test acc mean=0.4977 ± 0.0090 | min=0.4830 max=0.5301
         : test loss mean=0.7238 ± 0.0328
         : individual accs = ['0.492622', '0.483035', '0.530142', '0.486179', '0.494522', '0.498713', '0.501534', '0.494907', '0.498181', '0.495234', '0.498397', '0.496364', '0.502787', '0.506754', '0.493017', '0.497742', '0.494961', '0.494985', '0.495614', '0.498090']
         : correct/total = [(7011, 14232), (6876, 14235), (7563, 14266), (6912, 14217), (7041, 14238), (7168, 14373), (7195, 14346), (7094, 14334), (7121, 14294), (7118, 14373), (7149, 14344), (7099, 14302), (7217, 14354), (7278, 14362), (7060, 14320), (7165, 14395), (7122, 14389), (7057, 14257), (7063, 14251), (7172, 14399)]
         : compromised: 0.4999, honest: 0.4955
Round 010: test acc mean=0.5092 ± 0.0090 | min=0.4958 max=0.5345
         : test loss mean=0.7694 ± 0.0462
         : individual accs = ['0.512015', '0.522164', '0.506169', '0.534501', '0.508077', '0.505740', '0.503834', '0.502721', '0.507975', '0.514993', '0.516453', '0.498602', '0.504110', '0.495822', '0.506913', '0.503369', '0.511432', '0.521218', '0.508736', '0.498785']
         : correct/total = [(7287, 14232), (7433, 14235), (7221, 14266), (7599, 14217), (7234, 14238), (7269, 14373), (7228, 14346), (7206, 14334), (7261, 14294), (7402, 14373), (7408, 14344), (7131, 14302), (7236, 14354), (7121, 14362), (7259, 14320), (7246, 14395), (7359, 14389), (7431, 14257), (7250, 14251), (7182, 14399)]
         : compromised: 0.5073, honest: 0.5111

=== FINAL RESULTS ===
Dataset: sent140, Nodes: 20, Graph: erdos, Aggregation: krum
Attack: directed_deviation, 50.0% compromised
Final accuracy - Compromised: 0.5073, Honest: 0.5111
Overall test accuracy: mean=0.5092 ± 0.0090
