Device: cuda
Seed: 987654321
Loading 1 LEAF Sent140 train files...
LEAF Sent140 train: 254555 users, 908652 samples
Building vocabulary (max_size=10000)...
Vocabulary size: 10000
Loading 1 LEAF Sent140 test files...
LEAF Sent140 test: 254555 users, 286281 samples
Found 254555 train users, 254555 test users, 254555 common users
User sample counts range: 494 (max) to 1 (min)
Distributed ALL 254555 users across 20 clients
Users per client: 12727 (with 15 clients getting +1 user)
Train partition sizes: [44353, 44290, 44657, 44907, 44696, 45843, 45801, 45619, 45069, 45639, 45821, 45311, 45779, 46056, 45625, 45984, 46428, 44737, 45540, 46497]
Test partition sizes: [14232, 14235, 14266, 14217, 14238, 14373, 14346, 14334, 14294, 14373, 14344, 14302, 14354, 14362, 14320, 14395, 14389, 14257, 14251, 14399]
  Client 0: 44353 train samples, 2 unique classes
  Client 1: 44290 train samples, 2 unique classes
  Client 2: 44657 train samples, 2 unique classes
  Client 3: 44907 train samples, 2 unique classes
  Client 4: 44696 train samples, 2 unique classes
  Client 5: 45843 train samples, 2 unique classes
  Client 6: 45801 train samples, 2 unique classes
  Client 7: 45619 train samples, 2 unique classes
  Client 8: 45069 train samples, 2 unique classes
  Client 9: 45639 train samples, 2 unique classes
  Client 10: 45821 train samples, 2 unique classes
  Client 11: 45311 train samples, 2 unique classes
  Client 12: 45779 train samples, 2 unique classes
  Client 13: 46056 train samples, 2 unique classes
  Client 14: 45625 train samples, 2 unique classes
  Client 15: 45984 train samples, 2 unique classes
  Client 16: 46428 train samples, 2 unique classes
  Client 17: 44737 train samples, 2 unique classes
  Client 18: 45540 train samples, 2 unique classes
  Client 19: 46497 train samples, 2 unique classes
Will sample 4500 samples per client per epoch
Graph: erdos, nodes: 20, edges: 48
Degree statistics: avg=4.80, min=2, max=7
Attack: Compromised 14/20 nodes: [1, 2, 3, 5, 6, 8, 11, 12, 13, 14, 15, 17, 18, 19]
Attack type: backdoor, lambda: 1.0
Backdoor target label: 1, trigger size: 3
Model variant: baseline
Model parameters: 1,174,986
Initial test acc across nodes: mean=0.4953 ± 0.0174
Backdoor attack: Created poisoned datasets for 14 compromised nodes
Round 001: test acc mean=0.4984 ± 0.0070 | min=0.4865 max=0.5149
         : test loss mean=14.5955 ± 12.5081
         : individual accs = ['0.507940', '0.486477', '0.492640', '0.514877', '0.500421', '0.496834', '0.498885', '0.488070', '0.491255', '0.499200', '0.499233', '0.492588', '0.495959', '0.506267', '0.504190', '0.501702', '0.504413', '0.488602', '0.499404', '0.499687']
         : correct/total = [(7229, 14232), (6925, 14235), (7028, 14266), (7320, 14217), (7125, 14238), (7141, 14373), (7157, 14346), (6996, 14334), (7022, 14294), (7175, 14373), (7161, 14344), (7045, 14302), (7119, 14354), (7271, 14362), (7220, 14320), (7222, 14395), (7258, 14389), (6966, 14257), (7117, 14251), (7195, 14399)]
         : compromised: 0.4978, honest: 0.4999
Round 002: test acc mean=0.4962 ± 0.0063 | min=0.4890 max=0.5113
         : test loss mean=18.8440 ± 7.0967
         : individual accs = ['0.491568', '0.490200', '0.490327', '0.491384', '0.497120', '0.494190', '0.498606', '0.497837', '0.495732', '0.489042', '0.490937', '0.498811', '0.506618', '0.511349', '0.490503', '0.501007', '0.489888', '0.506067', '0.501228', '0.491840']
         : correct/total = [(6996, 14232), (6978, 14235), (6995, 14266), (6986, 14217), (7078, 14238), (7103, 14373), (7153, 14346), (7136, 14334), (7086, 14294), (7029, 14373), (7042, 14344), (7134, 14302), (7272, 14354), (7344, 14362), (7024, 14320), (7212, 14395), (7049, 14389), (7215, 14257), (7143, 14251), (7082, 14399)]
         : compromised: 0.4977, honest: 0.4927
Round 003: test acc mean=0.4973 ± 0.0080 | min=0.4865 max=0.5228
         : test loss mean=13.9330 ± 36.4421
         : individual accs = ['0.494941', '0.486477', '0.488013', '0.492720', '0.522826', '0.508662', '0.502161', '0.500000', '0.491255', '0.504140', '0.502022', '0.494966', '0.489829', '0.494848', '0.492737', '0.493922', '0.500035', '0.496107', '0.497439', '0.492256']
         : correct/total = [(7044, 14232), (6925, 14235), (6962, 14266), (7005, 14217), (7444, 14238), (7311, 14373), (7204, 14346), (7167, 14334), (7022, 14294), (7246, 14373), (7201, 14344), (7079, 14302), (7031, 14354), (7107, 14362), (7056, 14320), (7110, 14395), (7195, 14389), (7073, 14257), (7089, 14251), (7088, 14399)]
         : compromised: 0.4944, honest: 0.5040
Round 004: test acc mean=0.5044 ± 0.0065 | min=0.4929 max=0.5165
         : test loss mean=6.0128 ± 4.0994
         : individual accs = ['0.507659', '0.503267', '0.510655', '0.514736', '0.508077', '0.492869', '0.501952', '0.514999', '0.499440', '0.500104', '0.501255', '0.516501', '0.507663', '0.506058', '0.493506', '0.498090', '0.496838', '0.504244', '0.504807', '0.504618']
         : correct/total = [(7225, 14232), (7164, 14235), (7285, 14266), (7318, 14217), (7234, 14238), (7084, 14373), (7201, 14346), (7382, 14334), (7139, 14294), (7188, 14373), (7190, 14344), (7387, 14302), (7287, 14354), (7268, 14362), (7067, 14320), (7170, 14395), (7149, 14389), (7189, 14257), (7194, 14251), (7266, 14399)]
         : compromised: 0.5042, honest: 0.5048
Round 005: test acc mean=0.5015 ± 0.0075 | min=0.4825 max=0.5135
         : test loss mean=2.5691 ± 1.2903
         : individual accs = ['0.494800', '0.509659', '0.492850', '0.495534', '0.507094', '0.500244', '0.498606', '0.506976', '0.496992', '0.482502', '0.506484', '0.509789', '0.504528', '0.503969', '0.497765', '0.495589', '0.513517', '0.499474', '0.501088', '0.513300']
         : correct/total = [(7042, 14232), (7255, 14235), (7031, 14266), (7045, 14217), (7220, 14238), (7190, 14373), (7153, 14346), (7267, 14334), (7104, 14294), (6935, 14373), (7265, 14344), (7291, 14302), (7242, 14354), (7238, 14362), (7128, 14320), (7134, 14395), (7389, 14389), (7121, 14257), (7141, 14251), (7391, 14399)]
         : compromised: 0.5014, honest: 0.5019
Round 006: test acc mean=0.5047 ± 0.0059 | min=0.4952 max=0.5153
         : test loss mean=17.6708 ± 7.2014
         : individual accs = ['0.509275', '0.515349', '0.512197', '0.510938', '0.506813', '0.498087', '0.497491', '0.500070', '0.495173', '0.503374', '0.502091', '0.505664', '0.498119', '0.506893', '0.514665', '0.496700', '0.505386', '0.502981', '0.510140', '0.502327']
         : correct/total = [(7248, 14232), (7336, 14235), (7307, 14266), (7264, 14217), (7216, 14238), (7159, 14373), (7137, 14346), (7168, 14334), (7078, 14294), (7235, 14373), (7202, 14344), (7232, 14302), (7150, 14354), (7280, 14362), (7370, 14320), (7150, 14395), (7272, 14389), (7171, 14257), (7270, 14251), (7233, 14399)]
         : compromised: 0.5048, honest: 0.5045
Round 007: test acc mean=0.5057 ± 0.0050 | min=0.4958 max=0.5172
         : test loss mean=11.4254 ± 16.4998
         : individual accs = ['0.507237', '0.517246', '0.512898', '0.513681', '0.505619', '0.504140', '0.500697', '0.509488', '0.502519', '0.505044', '0.501255', '0.506642', '0.495820', '0.507032', '0.508799', '0.501285', '0.507401', '0.504384', '0.502842', '0.499896']
         : correct/total = [(7219, 14232), (7363, 14235), (7317, 14266), (7303, 14217), (7199, 14238), (7246, 14373), (7183, 14346), (7303, 14334), (7183, 14294), (7259, 14373), (7190, 14344), (7246, 14302), (7117, 14354), (7282, 14362), (7286, 14320), (7216, 14395), (7301, 14389), (7191, 14257), (7166, 14251), (7198, 14399)]
         : compromised: 0.5056, honest: 0.5060
Round 008: test acc mean=0.4947 ± 0.0064 | min=0.4825 max=0.5077
         : test loss mean=10.5377 ± 6.9238
         : individual accs = ['0.494590', '0.482473', '0.485210', '0.484912', '0.495505', '0.495860', '0.497560', '0.497349', '0.498531', '0.498226', '0.498118', '0.495665', '0.502438', '0.507659', '0.492598', '0.497742', '0.483981', '0.489865', '0.495614', '0.500729']
         : correct/total = [(7039, 14232), (6868, 14235), (6922, 14266), (6894, 14217), (7055, 14238), (7127, 14373), (7138, 14346), (7129, 14334), (7126, 14294), (7161, 14373), (7145, 14344), (7089, 14302), (7212, 14354), (7291, 14362), (7054, 14320), (7165, 14395), (6964, 14389), (6984, 14257), (7063, 14251), (7210, 14399)]
         : compromised: 0.4948, honest: 0.4946
Round 009: test acc mean=0.4967 ± 0.0054 | min=0.4861 max=0.5062
         : test loss mean=2.8743 ± 2.7008
         : individual accs = ['0.494800', '0.486828', '0.497687', '0.490328', '0.505338', '0.495930', '0.493308', '0.493861', '0.498741', '0.501078', '0.500558', '0.495175', '0.506200', '0.486144', '0.492807', '0.497812', '0.502954', '0.495967', '0.495334', '0.504132']
         : correct/total = [(7042, 14232), (6930, 14235), (7100, 14266), (6971, 14217), (7195, 14238), (7128, 14373), (7077, 14346), (7079, 14334), (7129, 14294), (7202, 14373), (7180, 14344), (7082, 14302), (7266, 14354), (6982, 14362), (7057, 14320), (7166, 14395), (7237, 14389), (7071, 14257), (7059, 14251), (7259, 14399)]
         : compromised: 0.4955, honest: 0.4998
Round 010: test acc mean=0.4981 ± 0.0055 | min=0.4831 max=0.5063
         : test loss mean=10.6912 ± 6.7601
         : individual accs = ['0.499227', '0.483105', '0.506309', '0.495674', '0.496067', '0.497252', '0.502579', '0.492745', '0.501399', '0.501913', '0.498815', '0.490631', '0.503135', '0.505013', '0.492109', '0.503925', '0.497741', '0.495406', '0.495685', '0.502952']
         : correct/total = [(7105, 14232), (6877, 14235), (7223, 14266), (7047, 14217), (7063, 14238), (7147, 14373), (7210, 14346), (7063, 14334), (7167, 14294), (7214, 14373), (7155, 14344), (7017, 14302), (7222, 14354), (7253, 14362), (7047, 14320), (7254, 14395), (7162, 14389), (7063, 14257), (7064, 14251), (7242, 14399)]
         : compromised: 0.4982, honest: 0.4978

=== FINAL RESULTS ===
Dataset: sent140, Nodes: 20, Graph: erdos, Aggregation: d-fedavg
Attack: backdoor, 70.0% compromised
Final accuracy - Compromised: 0.4982, Honest: 0.4978
Overall test accuracy: mean=0.4981 ± 0.0055

=== BACKDOOR ATTACK SUCCESS RATE (ASR) ===
Target label: 1
Trigger size: 3x3
Overall ASR: 0.8063 ± 0.2938
Honest nodes ASR: 0.8824 ± 0.1068
Compromised nodes ASR: 0.7737 ± 0.3389
Note: Higher ASR indicates more successful backdoor attack
