Device: cuda
Seed: 987654321
Loading 1 LEAF Sent140 train files...
LEAF Sent140 train: 254555 users, 908652 samples
Building vocabulary (max_size=10000)...
Vocabulary size: 10000
Loading 1 LEAF Sent140 test files...
LEAF Sent140 test: 254555 users, 286281 samples
Found 254555 train users, 254555 test users, 254555 common users
User sample counts range: 494 (max) to 1 (min)
Distributed ALL 254555 users across 20 clients
Users per client: 12727 (with 15 clients getting +1 user)
Train partition sizes: [44353, 44290, 44657, 44907, 44696, 45843, 45801, 45619, 45069, 45639, 45821, 45311, 45779, 46056, 45625, 45984, 46428, 44737, 45540, 46497]
Test partition sizes: [14232, 14235, 14266, 14217, 14238, 14373, 14346, 14334, 14294, 14373, 14344, 14302, 14354, 14362, 14320, 14395, 14389, 14257, 14251, 14399]
  Client 0: 44353 train samples, 2 unique classes
  Client 1: 44290 train samples, 2 unique classes
  Client 2: 44657 train samples, 2 unique classes
  Client 3: 44907 train samples, 2 unique classes
  Client 4: 44696 train samples, 2 unique classes
  Client 5: 45843 train samples, 2 unique classes
  Client 6: 45801 train samples, 2 unique classes
  Client 7: 45619 train samples, 2 unique classes
  Client 8: 45069 train samples, 2 unique classes
  Client 9: 45639 train samples, 2 unique classes
  Client 10: 45821 train samples, 2 unique classes
  Client 11: 45311 train samples, 2 unique classes
  Client 12: 45779 train samples, 2 unique classes
  Client 13: 46056 train samples, 2 unique classes
  Client 14: 45625 train samples, 2 unique classes
  Client 15: 45984 train samples, 2 unique classes
  Client 16: 46428 train samples, 2 unique classes
  Client 17: 44737 train samples, 2 unique classes
  Client 18: 45540 train samples, 2 unique classes
  Client 19: 46497 train samples, 2 unique classes
Will sample 4500 samples per client per epoch
Graph: ring, nodes: 20, edges: 20
Degree statistics: avg=2.00, min=2, max=2
Attack: Compromised 8/20 nodes: [1, 5, 11, 12, 13, 14, 17, 18]
Attack type: directed_deviation, lambda: 1.0
Model variant: baseline
Model parameters: 1,174,986
Initial test acc across nodes: mean=0.4953 ± 0.0174
Round 001: test acc mean=0.5074 ± 0.0107 | min=0.4861 max=0.5338
         : test loss mean=5.9257 ± 6.7520
         : individual accs = ['0.499227', '0.511978', '0.506869', '0.512415', '0.501896', '0.502331', '0.519727', '0.524766', '0.502169', '0.533779', '0.497142', '0.506293', '0.505713', '0.505431', '0.494204', '0.520250', '0.486135', '0.509504', '0.506561', '0.501424']
         : correct/total = [(7105, 14232), (7288, 14235), (7231, 14266), (7285, 14217), (7146, 14238), (7220, 14373), (7456, 14346), (7522, 14334), (7178, 14294), (7672, 14373), (7131, 14344), (7241, 14302), (7259, 14354), (7259, 14362), (7077, 14320), (7489, 14395), (6995, 14389), (7264, 14257), (7219, 14251), (7220, 14399)]
         : compromised: 0.5053, honest: 0.5088
Round 002: test acc mean=0.5038 ± 0.0125 | min=0.4804 max=0.5393
         : test loss mean=3.7448 ± 3.9600
         : individual accs = ['0.499930', '0.493853', '0.480373', '0.516846', '0.507726', '0.507758', '0.507807', '0.492465', '0.539317', '0.516246', '0.504671', '0.494336', '0.499303', '0.494987', '0.502723', '0.496492', '0.491695', '0.518552', '0.511754', '0.498646']
         : correct/total = [(7115, 14232), (7030, 14235), (6853, 14266), (7348, 14217), (7229, 14238), (7298, 14373), (7285, 14346), (7059, 14334), (7709, 14294), (7420, 14373), (7239, 14344), (7070, 14302), (7167, 14354), (7109, 14362), (7199, 14320), (7147, 14395), (7075, 14389), (7393, 14257), (7293, 14251), (7180, 14399)]
         : compromised: 0.5029, honest: 0.5044
Round 003: test acc mean=0.5073 ± 0.0215 | min=0.4789 max=0.5781
         : test loss mean=2.1980 ± 2.2122
         : individual accs = ['0.501265', '0.516895', '0.510655', '0.502567', '0.507304', '0.496973', '0.499233', '0.521976', '0.578145', '0.548807', '0.501115', '0.505174', '0.497283', '0.493176', '0.506983', '0.478916', '0.483633', '0.493231', '0.503824', '0.498715']
         : correct/total = [(7134, 14232), (7358, 14235), (7285, 14266), (7145, 14217), (7223, 14238), (7143, 14373), (7162, 14346), (7482, 14334), (8264, 14294), (7888, 14373), (7188, 14344), (7225, 14302), (7138, 14354), (7083, 14362), (7260, 14320), (6894, 14395), (6959, 14389), (7032, 14257), (7180, 14251), (7181, 14399)]
         : compromised: 0.5017, honest: 0.5110
Round 004: test acc mean=0.5039 ± 0.0184 | min=0.4902 max=0.5735
         : test loss mean=1.6708 ± 1.2390
         : individual accs = ['0.491358', '0.494766', '0.495444', '0.527186', '0.502809', '0.494608', '0.490241', '0.573531', '0.506156', '0.520907', '0.494423', '0.497273', '0.500418', '0.495265', '0.502444', '0.504967', '0.492807', '0.497720', '0.502842', '0.493576']
         : correct/total = [(6993, 14232), (7043, 14235), (7068, 14266), (7495, 14217), (7159, 14238), (7109, 14373), (7033, 14346), (8221, 14334), (7235, 14294), (7487, 14373), (7092, 14344), (7112, 14302), (7183, 14354), (7113, 14362), (7195, 14320), (7269, 14395), (7091, 14389), (7096, 14257), (7166, 14251), (7107, 14399)]
         : compromised: 0.4982, honest: 0.5078
Round 005: test acc mean=0.5069 ± 0.0279 | min=0.4817 max=0.6207
         : test loss mean=1.5863 ± 1.4109
         : individual accs = ['0.487493', '0.493572', '0.492079', '0.498699', '0.505970', '0.481737', '0.494214', '0.498884', '0.620680', '0.497043', '0.501603', '0.503356', '0.508430', '0.512463', '0.510545', '0.522404', '0.512892', '0.507540', '0.502631', '0.486145']
         : correct/total = [(6938, 14232), (7026, 14235), (7020, 14266), (7090, 14217), (7204, 14238), (6924, 14373), (7090, 14346), (7151, 14334), (8872, 14294), (7144, 14373), (7195, 14344), (7199, 14302), (7298, 14354), (7360, 14362), (7311, 14320), (7520, 14395), (7380, 14389), (7236, 14257), (7163, 14251), (7000, 14399)]
         : compromised: 0.5025, honest: 0.5098
Round 006: test acc mean=0.5089 ± 0.0194 | min=0.4927 max=0.5721
         : test loss mean=1.5889 ± 1.3581
         : individual accs = ['0.495152', '0.494626', '0.494322', '0.529437', '0.505127', '0.513324', '0.503137', '0.492675', '0.572058', '0.548041', '0.513525', '0.497832', '0.503414', '0.501462', '0.506425', '0.497951', '0.493710', '0.506067', '0.500316', '0.509202']
         : correct/total = [(7047, 14232), (7041, 14235), (7052, 14266), (7527, 14217), (7192, 14238), (7378, 14373), (7218, 14346), (7062, 14334), (8177, 14294), (7877, 14373), (7366, 14344), (7120, 14302), (7226, 14354), (7202, 14362), (7252, 14320), (7168, 14395), (7104, 14389), (7215, 14257), (7130, 14251), (7332, 14399)]
         : compromised: 0.5029, honest: 0.5129
Round 007: test acc mean=0.5194 ± 0.0256 | min=0.4920 max=0.6006
         : test loss mean=1.3300 ± 1.0128
         : individual accs = ['0.507307', '0.495188', '0.526146', '0.519589', '0.525425', '0.524038', '0.531437', '0.543463', '0.600602', '0.544145', '0.516104', '0.495385', '0.500697', '0.499443', '0.493156', '0.537756', '0.537355', '0.495265', '0.492036', '0.502674']
         : correct/total = [(7220, 14232), (7049, 14235), (7506, 14266), (7387, 14217), (7481, 14238), (7532, 14373), (7624, 14346), (7790, 14334), (8585, 14294), (7821, 14373), (7403, 14344), (7085, 14302), (7187, 14354), (7173, 14362), (7062, 14320), (7741, 14395), (7732, 14389), (7061, 14257), (7012, 14251), (7238, 14399)]
         : compromised: 0.4994, honest: 0.5327
Round 008: test acc mean=0.5177 ± 0.0351 | min=0.4850 max=0.6266
         : test loss mean=1.4822 ± 1.3260
         : individual accs = ['0.504356', '0.485002', '0.499790', '0.555673', '0.496488', '0.495930', '0.513035', '0.531952', '0.626627', '0.598205', '0.515895', '0.502587', '0.507733', '0.509261', '0.496858', '0.502327', '0.499965', '0.503332', '0.494281', '0.515452']
         : correct/total = [(7178, 14232), (6904, 14235), (7130, 14266), (7900, 14217), (7069, 14238), (7128, 14373), (7360, 14346), (7625, 14334), (8957, 14294), (8598, 14373), (7400, 14344), (7188, 14302), (7288, 14354), (7314, 14362), (7115, 14320), (7231, 14395), (7194, 14389), (7176, 14257), (7044, 14251), (7422, 14399)]
         : compromised: 0.4994, honest: 0.5300
Round 009: test acc mean=0.5298 ± 0.0366 | min=0.4873 max=0.6035
         : test loss mean=1.3988 ± 1.2810
         : individual accs = ['0.522485', '0.515841', '0.564279', '0.553633', '0.581683', '0.539414', '0.539314', '0.602972', '0.603540', '0.560356', '0.534649', '0.497273', '0.494009', '0.494499', '0.487360', '0.501563', '0.508305', '0.487269', '0.491685', '0.515105']
         : correct/total = [(7436, 14232), (7343, 14235), (8050, 14266), (7871, 14217), (8282, 14238), (7753, 14373), (7737, 14346), (8643, 14334), (8627, 14294), (8054, 14373), (7669, 14344), (7112, 14302), (7091, 14354), (7102, 14362), (6979, 14320), (7220, 14395), (7314, 14389), (6947, 14257), (7007, 14251), (7417, 14399)]
         : compromised: 0.5009, honest: 0.5490
Round 010: test acc mean=0.5306 ± 0.0494 | min=0.4931 max=0.6431
         : test loss mean=1.3864 ± 1.1750
         : individual accs = ['0.499087', '0.499754', '0.495654', '0.595977', '0.500211', '0.496904', '0.523909', '0.633180', '0.643137', '0.628748', '0.511364', '0.500909', '0.501393', '0.505361', '0.493087', '0.534144', '0.537077', '0.498702', '0.497649', '0.515452']
         : correct/total = [(7103, 14232), (7114, 14235), (7071, 14266), (8473, 14217), (7122, 14238), (7142, 14373), (7516, 14346), (9076, 14334), (9193, 14294), (9037, 14373), (7335, 14344), (7164, 14302), (7197, 14354), (7258, 14362), (7061, 14320), (7689, 14395), (7728, 14389), (7110, 14257), (7092, 14251), (7422, 14399)]
         : compromised: 0.4992, honest: 0.5515

=== FINAL RESULTS ===
Dataset: sent140, Nodes: 20, Graph: ring, Aggregation: krum
Attack: directed_deviation, 40.0% compromised
Final accuracy - Compromised: 0.4992, Honest: 0.5515
Overall test accuracy: mean=0.5306 ± 0.0494
