Device: cuda
Seed: 987654321
Loading 1 LEAF Sent140 train files...
LEAF Sent140 train: 254555 users, 908652 samples
Building vocabulary (max_size=10000)...
Vocabulary size: 10000
Loading 1 LEAF Sent140 test files...
LEAF Sent140 test: 254555 users, 286281 samples
Found 254555 train users, 254555 test users, 254555 common users
User sample counts range: 494 (max) to 1 (min)
Distributed ALL 254555 users across 20 clients
Users per client: 12727 (with 15 clients getting +1 user)
Train partition sizes: [44353, 44290, 44657, 44907, 44696, 45843, 45801, 45619, 45069, 45639, 45821, 45311, 45779, 46056, 45625, 45984, 46428, 44737, 45540, 46497]
Test partition sizes: [14232, 14235, 14266, 14217, 14238, 14373, 14346, 14334, 14294, 14373, 14344, 14302, 14354, 14362, 14320, 14395, 14389, 14257, 14251, 14399]
  Client 0: 44353 train samples, 2 unique classes
  Client 1: 44290 train samples, 2 unique classes
  Client 2: 44657 train samples, 2 unique classes
  Client 3: 44907 train samples, 2 unique classes
  Client 4: 44696 train samples, 2 unique classes
  Client 5: 45843 train samples, 2 unique classes
  Client 6: 45801 train samples, 2 unique classes
  Client 7: 45619 train samples, 2 unique classes
  Client 8: 45069 train samples, 2 unique classes
  Client 9: 45639 train samples, 2 unique classes
  Client 10: 45821 train samples, 2 unique classes
  Client 11: 45311 train samples, 2 unique classes
  Client 12: 45779 train samples, 2 unique classes
  Client 13: 46056 train samples, 2 unique classes
  Client 14: 45625 train samples, 2 unique classes
  Client 15: 45984 train samples, 2 unique classes
  Client 16: 46428 train samples, 2 unique classes
  Client 17: 44737 train samples, 2 unique classes
  Client 18: 45540 train samples, 2 unique classes
  Client 19: 46497 train samples, 2 unique classes
Will sample 4500 samples per client per epoch
Graph: erdos, nodes: 20, edges: 126
Degree statistics: avg=12.60, min=8, max=16
Attack: Compromised 2/20 nodes: [5, 13]
Attack type: backdoor, lambda: 1.0
Backdoor target label: 1, trigger size: 3
Model variant: baseline
Model parameters: 1,174,986
BALANCE algorithm:
Balance Config: BALANCEConfig(gamma=2, kappa=1, alpha=0.5, min_neighbors=1)
  - Model dimension: 1,174,986 parameters
  - Complexity: O(N×d) = O(20×1,174,986)
Initial test acc across nodes: mean=0.4953 ± 0.0174
Backdoor attack: Created poisoned datasets for 2 compromised nodes
Round 001: test acc mean=0.5090 ± 0.0160 | min=0.4765 max=0.5378
         : test loss mean=4.5219 ± 11.4898
         : individual accs = ['0.476461', '0.517035', '0.491658', '0.527256', '0.492555', '0.522438', '0.500139', '0.494698', '0.514831', '0.537466', '0.509830', '0.506642', '0.497910', '0.515040', '0.499511', '0.532129', '0.537841', '0.504033', '0.496737', '0.505174']
         : correct/total = [(6781, 14232), (7360, 14235), (7014, 14266), (7496, 14217), (7013, 14238), (7509, 14373), (7175, 14346), (7091, 14334), (7359, 14294), (7725, 14373), (7313, 14344), (7246, 14302), (7147, 14354), (7397, 14362), (7153, 14320), (7660, 14395), (7739, 14389), (7186, 14257), (7079, 14251), (7274, 14399)]
         : compromised: 0.5187, honest: 0.5079
Round 002: test acc mean=0.5492 ± 0.0393 | min=0.4926 max=0.6224
         : test loss mean=34.6860 ± 106.7193
         : individual accs = ['0.586847', '0.531437', '0.532315', '0.553914', '0.543897', '0.510610', '0.561759', '0.494349', '0.603120', '0.603423', '0.502440', '0.612012', '0.560332', '0.509121', '0.492598', '0.544703', '0.538745', '0.511749', '0.567258', '0.622404']
         : correct/total = [(8352, 14232), (7565, 14235), (7594, 14266), (7875, 14217), (7744, 14238), (7339, 14373), (8059, 14346), (7086, 14334), (8621, 14294), (8673, 14373), (7207, 14344), (8753, 14302), (8043, 14354), (7312, 14362), (7054, 14320), (7841, 14395), (7752, 14389), (7296, 14257), (8084, 14251), (8962, 14399)]
         : compromised: 0.5099, honest: 0.5535
Round 003: test acc mean=0.5558 ± 0.0402 | min=0.4929 max=0.6244
         : test loss mean=1985.2046 ± 6882.3998
         : individual accs = ['0.624368', '0.532420', '0.611524', '0.566716', '0.571148', '0.505322', '0.544124', '0.492884', '0.618651', '0.516385', '0.586587', '0.554398', '0.536157', '0.498886', '0.576047', '0.531643', '0.496490', '0.589605', '0.583538', '0.578512']
         : correct/total = [(8886, 14232), (7579, 14235), (8724, 14266), (8057, 14217), (8132, 14238), (7263, 14373), (7806, 14346), (7065, 14334), (8843, 14294), (7422, 14373), (8414, 14344), (7929, 14302), (7696, 14354), (7165, 14362), (8249, 14320), (7653, 14395), (7144, 14389), (8406, 14257), (8316, 14251), (8330, 14399)]
         : compromised: 0.5021, honest: 0.5617
Round 004: test acc mean=0.5790 ± 0.0469 | min=0.4923 max=0.6297
         : test loss mean=92596.0457 ± 278545.9586
         : individual accs = ['0.629708', '0.623112', '0.579420', '0.498980', '0.613710', '0.499826', '0.613690', '0.508372', '0.563803', '0.598205', '0.618656', '0.560761', '0.539641', '0.492271', '0.618785', '0.575894', '0.625825', '0.572771', '0.619255', '0.627196']
         : correct/total = [(8962, 14232), (8870, 14235), (8266, 14266), (7094, 14217), (8738, 14238), (7184, 14373), (8804, 14346), (7287, 14334), (8059, 14294), (8598, 14373), (8874, 14344), (8020, 14302), (7746, 14354), (7070, 14362), (8861, 14320), (8290, 14395), (9005, 14389), (8166, 14257), (8825, 14251), (9031, 14399)]
         : compromised: 0.4960, honest: 0.5882
Round 005: test acc mean=0.6049 ± 0.0386 | min=0.4888 max=0.6379
         : test loss mean=8251962.6934 ± 24755887.0548
         : individual accs = ['0.637858', '0.619459', '0.621408', '0.592389', '0.629934', '0.488764', '0.633975', '0.626482', '0.619281', '0.585334', '0.632181', '0.612012', '0.600181', '0.510932', '0.624302', '0.634665', '0.634790', '0.593743', '0.593502', '0.606987']
         : correct/total = [(9078, 14232), (8818, 14235), (8865, 14266), (8422, 14217), (8969, 14238), (7025, 14373), (9095, 14346), (8980, 14334), (8852, 14294), (8413, 14373), (9068, 14344), (8753, 14302), (8615, 14354), (7338, 14362), (8940, 14320), (9136, 14395), (9134, 14389), (8465, 14257), (8458, 14251), (8740, 14399)]
         : compromised: 0.4998, honest: 0.6166
Round 006: test acc mean=0.6196 ± 0.0408 | min=0.4999 max=0.6425
         : test loss mean=576157103.6434 ± 1766395914.8659
         : individual accs = ['0.640809', '0.640885', '0.624211', '0.641837', '0.640188', '0.499896', '0.634393', '0.605344', '0.635581', '0.637097', '0.629322', '0.634946', '0.642190', '0.500139', '0.642528', '0.635915', '0.622142', '0.631970', '0.628377', '0.623516']
         : correct/total = [(9120, 14232), (9123, 14235), (8905, 14266), (9125, 14217), (9115, 14238), (7185, 14373), (9101, 14346), (8677, 14334), (9085, 14294), (9157, 14373), (9027, 14344), (9081, 14302), (9218, 14354), (7183, 14362), (9201, 14320), (9154, 14395), (8952, 14389), (9010, 14257), (8955, 14251), (8978, 14399)]
         : compromised: 0.5000, honest: 0.6328
Round 007: test acc mean=0.6242 ± 0.0398 | min=0.5048 max=0.6478
         : test loss mean=60349450527.7610 ± 191251053525.6546
         : individual accs = ['0.642285', '0.646716', '0.638091', '0.633537', '0.647493', '0.504766', '0.641573', '0.638482', '0.637680', '0.641620', '0.624442', '0.619773', '0.647624', '0.511976', '0.644274', '0.611254', '0.640767', '0.637511', '0.627044', '0.647753']
         : correct/total = [(9141, 14232), (9206, 14235), (9103, 14266), (9007, 14217), (9219, 14238), (7255, 14373), (9204, 14346), (9152, 14334), (9115, 14294), (9222, 14373), (8957, 14344), (8864, 14302), (9296, 14354), (7353, 14362), (9226, 14320), (8799, 14395), (9220, 14389), (9089, 14257), (8936, 14251), (9327, 14399)]
         : compromised: 0.5084, honest: 0.6371
Round 008: test acc mean=0.6320 ± 0.0445 | min=0.4937 max=0.6557
         : test loss mean=3596820216166.4990 ± 11031502319453.7910
         : individual accs = ['0.649030', '0.633368', '0.626384', '0.654991', '0.648265', '0.507897', '0.654189', '0.649226', '0.655660', '0.649134', '0.648564', '0.651937', '0.643305', '0.493664', '0.649511', '0.646058', '0.651748', '0.640948', '0.631394', '0.654143']
         : correct/total = [(9237, 14232), (9016, 14235), (8936, 14266), (9312, 14217), (9230, 14238), (7300, 14373), (9385, 14346), (9306, 14334), (9372, 14294), (9330, 14373), (9303, 14344), (9324, 14302), (9234, 14354), (7090, 14362), (9301, 14320), (9300, 14395), (9378, 14389), (9138, 14257), (8998, 14251), (9419, 14399)]
         : compromised: 0.5008, honest: 0.6465
Round 009: test acc mean=0.6359 ± 0.0466 | min=0.4975 max=0.6636
         : test loss mean=457066903507605.3125 ± 1414473089097079.0000
         : individual accs = ['0.617833', '0.661749', '0.651129', '0.658718', '0.645034', '0.497530', '0.646313', '0.653063', '0.658528', '0.652265', '0.640756', '0.649210', '0.650620', '0.500418', '0.654888', '0.650643', '0.663562', '0.653223', '0.652796', '0.658796']
         : correct/total = [(8793, 14232), (9420, 14235), (9289, 14266), (9365, 14217), (9184, 14238), (7151, 14373), (9272, 14346), (9361, 14334), (9413, 14294), (9375, 14373), (9191, 14344), (9285, 14302), (9339, 14354), (7187, 14362), (9378, 14320), (9366, 14395), (9548, 14389), (9313, 14257), (9303, 14251), (9486, 14399)]
         : compromised: 0.4990, honest: 0.6511
Round 010: test acc mean=0.6441 ± 0.0497 | min=0.4916 max=0.6726
         : test loss mean=41649860306651224.0000 ± 136265124330463760.0000
         : individual accs = ['0.661467', '0.665683', '0.629469', '0.666104', '0.668844', '0.503792', '0.666179', '0.672597', '0.662866', '0.650108', '0.658394', '0.664383', '0.668942', '0.491645', '0.665084', '0.649601', '0.666064', '0.660027', '0.652235', '0.658518']
         : correct/total = [(9414, 14232), (9476, 14235), (8980, 14266), (9470, 14217), (9523, 14238), (7241, 14373), (9557, 14346), (9641, 14334), (9475, 14294), (9344, 14373), (9444, 14344), (9502, 14302), (9602, 14354), (7061, 14362), (9524, 14320), (9351, 14395), (9584, 14389), (9410, 14257), (9295, 14251), (9482, 14399)]
         : compromised: 0.4977, honest: 0.6604

=== FINAL RESULTS ===
Dataset: sent140, Nodes: 20, Graph: erdos, Aggregation: balance
Attack: backdoor, 10.0% compromised
Final accuracy - Compromised: 0.4977, Honest: 0.6604
Overall test accuracy: mean=0.6441 ± 0.0497

=== BACKDOOR ATTACK SUCCESS RATE (ASR) ===
Target label: 1
Trigger size: 3x3
Overall ASR: 0.5469 ± 0.1216
Honest nodes ASR: 0.5230 ± 0.0692
Compromised nodes ASR: 0.7615 ± 0.2316
Note: Higher ASR indicates more successful backdoor attack

=== BALANCE SUMMARY ===
Node 0: acceptance=0.887
Node 1: acceptance=0.918
Node 2: acceptance=0.850
Node 3: acceptance=0.887
Node 4: acceptance=0.918
Node 5: acceptance=0.600
Node 6: acceptance=0.871
Node 7: acceptance=0.936
Node 8: acceptance=0.820
Node 9: acceptance=0.931
Node 10: acceptance=0.900
Node 11: acceptance=0.871
Node 12: acceptance=0.925
Node 13: acceptance=0.600
Node 14: acceptance=0.880
Node 15: acceptance=0.918
Node 16: acceptance=0.931
Node 17: acceptance=0.900
Node 18: acceptance=0.887
Node 19: acceptance=0.887

=== PARALLEL EXECUTION TIME (realistic for distributed system) ===
  COMMUNICATION (max across nodes):
    - Full model transfer: 0.000s (0.0%)
  COMPUTATION (max across nodes):
    - Filtering: 0.065s (78.0%)
    - Aggregation: 0.018s (22.0%)
  TOTALS:
    - Total computation: 0.084s (100.0%)
    - Total communication: 0.000s (0.0%)
    - Total parallel time: 0.084s

=== PER-NODE AVERAGE TIME ===
  - Filtering: 0.051s
  - Aggregation: 0.010s
  - Model transfer: 0.000s
  - Total per node: 0.061s

=== TOTAL COMPUTATIONAL WORK (sum across all nodes) ===
  - Total filtering: 1.018s
  - Total aggregation: 0.202s
  - Total model transfer: 0.000s
  - Grand total: 1.221s
  - Mean acceptance rate: 0.866

BALANCE Algorithm Properties:
  - Model dimension: 1,174,986
  - No compression: Full parameter comparison
  - Theoretical complexity: O(deg(i)×d)
  - Approach: Full parameter filtering + averaging
