Device: cuda
Seed: 987654321
Loading 1 LEAF Sent140 train files...
LEAF Sent140 train: 254555 users, 908652 samples
Building vocabulary (max_size=10000)...
Vocabulary size: 10000
Loading 1 LEAF Sent140 test files...
LEAF Sent140 test: 254555 users, 286281 samples
Found 254555 train users, 254555 test users, 254555 common users
User sample counts range: 494 (max) to 1 (min)
Distributed ALL 254555 users across 20 clients
Users per client: 12727 (with 15 clients getting +1 user)
Train partition sizes: [44353, 44290, 44657, 44907, 44696, 45843, 45801, 45619, 45069, 45639, 45821, 45311, 45779, 46056, 45625, 45984, 46428, 44737, 45540, 46497]
Test partition sizes: [14232, 14235, 14266, 14217, 14238, 14373, 14346, 14334, 14294, 14373, 14344, 14302, 14354, 14362, 14320, 14395, 14389, 14257, 14251, 14399]
  Client 0: 44353 train samples, 2 unique classes
  Client 1: 44290 train samples, 2 unique classes
  Client 2: 44657 train samples, 2 unique classes
  Client 3: 44907 train samples, 2 unique classes
  Client 4: 44696 train samples, 2 unique classes
  Client 5: 45843 train samples, 2 unique classes
  Client 6: 45801 train samples, 2 unique classes
  Client 7: 45619 train samples, 2 unique classes
  Client 8: 45069 train samples, 2 unique classes
  Client 9: 45639 train samples, 2 unique classes
  Client 10: 45821 train samples, 2 unique classes
  Client 11: 45311 train samples, 2 unique classes
  Client 12: 45779 train samples, 2 unique classes
  Client 13: 46056 train samples, 2 unique classes
  Client 14: 45625 train samples, 2 unique classes
  Client 15: 45984 train samples, 2 unique classes
  Client 16: 46428 train samples, 2 unique classes
  Client 17: 44737 train samples, 2 unique classes
  Client 18: 45540 train samples, 2 unique classes
  Client 19: 46497 train samples, 2 unique classes
Will sample 4500 samples per client per epoch
Graph: fully, nodes: 20, edges: 190
Degree statistics: avg=19.00, min=19, max=19
Model variant: baseline
Model parameters: 1,174,986
BALANCE algorithm:
Balance Config: BALANCEConfig(gamma=2, kappa=1, alpha=0.5, min_neighbors=1)
  - Model dimension: 1,174,986 parameters
  - Complexity: O(N×d) = O(20×1,174,986)
Initial test acc across nodes: mean=0.4953 ± 0.0174
Round 001: test acc mean=0.5618 ± 0.0424 | min=0.5021 max=0.6314
         : test loss mean=0.6897 ± 0.0007
         : individual accs = ['0.554174', '0.585037', '0.514790', '0.521277', '0.623543', '0.546302', '0.629304', '0.620692', '0.518050', '0.561956', '0.512758', '0.546357', '0.631392', '0.541359', '0.528701', '0.564710', '0.502120', '0.566038', '0.538980', '0.628585']
         : correct/total = [(7887, 14232), (8328, 14235), (7344, 14266), (7411, 14217), (8878, 14238), (7852, 14373), (9028, 14346), (8897, 14334), (7405, 14294), (8077, 14373), (7355, 14344), (7814, 14302), (9063, 14354), (7775, 14362), (7571, 14320), (8129, 14395), (7225, 14389), (8070, 14257), (7681, 14251), (9051, 14399)]
Round 002: test acc mean=0.5551 ± 0.0524 | min=0.4926 max=0.6282
         : test loss mean=0.6909 ± 0.0006
         : individual accs = ['0.609191', '0.516614', '0.529160', '0.602166', '0.494522', '0.507688', '0.501185', '0.607855', '0.628166', '0.619634', '0.500906', '0.621102', '0.502856', '0.613424', '0.492598', '0.570545', '0.512614', '0.554464', '0.618413', '0.499340']
         : correct/total = [(8670, 14232), (7354, 14235), (7549, 14266), (8561, 14217), (7041, 14238), (7297, 14373), (7190, 14346), (8713, 14334), (8979, 14294), (8906, 14373), (7185, 14344), (8883, 14302), (7218, 14354), (8810, 14362), (7054, 14320), (8213, 14395), (7376, 14389), (7905, 14257), (8813, 14251), (7190, 14399)]
Round 003: test acc mean=0.5147 ± 0.0362 | min=0.4840 max=0.6129
         : test loss mean=0.6913 ± 0.0010
         : individual accs = ['0.492622', '0.484018', '0.486962', '0.489273', '0.495575', '0.546580', '0.499791', '0.492745', '0.523296', '0.495234', '0.498397', '0.612921', '0.502926', '0.508982', '0.494693', '0.497881', '0.506846', '0.570386', '0.596239', '0.498715']
         : correct/total = [(7011, 14232), (6890, 14235), (6947, 14266), (6956, 14217), (7056, 14238), (7856, 14373), (7170, 14346), (7063, 14334), (7480, 14294), (7118, 14373), (7149, 14344), (8766, 14302), (7219, 14354), (7310, 14362), (7084, 14320), (7167, 14395), (7293, 14389), (8132, 14257), (8497, 14251), (7181, 14399)]
Round 004: test acc mean=0.5242 ± 0.0412 | min=0.4852 max=0.6230
         : test loss mean=0.6901 ± 0.0014
         : individual accs = ['0.496557', '0.620653', '0.526637', '0.485194', '0.494522', '0.516663', '0.506274', '0.518488', '0.503078', '0.622974', '0.498397', '0.518529', '0.502996', '0.584250', '0.492598', '0.506426', '0.504691', '0.495546', '0.581714', '0.508577']
         : correct/total = [(7067, 14232), (8835, 14235), (7513, 14266), (6898, 14217), (7041, 14238), (7426, 14373), (7263, 14346), (7432, 14334), (7191, 14294), (8954, 14373), (7149, 14344), (7416, 14302), (7220, 14354), (8391, 14362), (7054, 14320), (7290, 14395), (7262, 14389), (7065, 14257), (8290, 14251), (7323, 14399)]
Round 005: test acc mean=0.5917 ± 0.0374 | min=0.5165 max=0.6425
         : test loss mean=0.6853 ± 0.0021
         : individual accs = ['0.585371', '0.629575', '0.579770', '0.518253', '0.588215', '0.632923', '0.576258', '0.642528', '0.610396', '0.586099', '0.585541', '0.516851', '0.516511', '0.574224', '0.591271', '0.629594', '0.632358', '0.615557', '0.609571', '0.612751']
         : correct/total = [(8331, 14232), (8962, 14235), (8271, 14266), (7368, 14217), (8375, 14238), (9097, 14373), (8267, 14346), (9210, 14334), (8725, 14294), (8424, 14373), (8399, 14344), (7392, 14302), (7414, 14354), (8247, 14362), (8467, 14320), (9063, 14395), (9099, 14389), (8776, 14257), (8687, 14251), (8823, 14399)]
Round 006: test acc mean=0.6288 ± 0.0088 | min=0.6022 max=0.6413
         : test loss mean=0.6699 ± 0.0030
         : individual accs = ['0.631324', '0.636389', '0.627366', '0.634663', '0.632884', '0.628540', '0.624773', '0.634994', '0.632573', '0.634036', '0.611475', '0.602223', '0.632925', '0.633268', '0.620112', '0.623203', '0.641323', '0.632602', '0.629289', '0.632822']
         : correct/total = [(8985, 14232), (9059, 14235), (8950, 14266), (9023, 14217), (9011, 14238), (9034, 14373), (8963, 14346), (9102, 14334), (9042, 14294), (9113, 14373), (8771, 14344), (8613, 14302), (9085, 14354), (9095, 14362), (8880, 14320), (8971, 14395), (9228, 14389), (9019, 14257), (8968, 14251), (9112, 14399)]
Round 007: test acc mean=0.6328 ± 0.0120 | min=0.6046 max=0.6462
         : test loss mean=0.6477 ± 0.0049
         : individual accs = ['0.636102', '0.646224', '0.622179', '0.642470', '0.643138', '0.641202', '0.640876', '0.604577', '0.642507', '0.641341', '0.624373', '0.623689', '0.641912', '0.607088', '0.643855', '0.619868', '0.640142', '0.636459', '0.628096', '0.630460']
         : correct/total = [(9053, 14232), (9199, 14235), (8876, 14266), (9134, 14217), (9157, 14238), (9216, 14373), (9194, 14346), (8666, 14334), (9184, 14294), (9218, 14373), (8956, 14344), (8920, 14302), (9214, 14354), (8719, 14362), (9220, 14320), (8923, 14395), (9211, 14389), (9074, 14257), (8951, 14251), (9078, 14399)]
Round 008: test acc mean=0.6448 ± 0.0076 | min=0.6290 max=0.6537
         : test loss mean=0.6343 ± 0.0051
         : individual accs = ['0.646641', '0.644046', '0.628978', '0.653724', '0.644964', '0.631253', '0.652725', '0.636738', '0.653421', '0.651708', '0.648146', '0.652986', '0.635990', '0.642877', '0.647067', '0.643001', '0.651887', '0.635477', '0.641920', '0.653448']
         : correct/total = [(9203, 14232), (9168, 14235), (8973, 14266), (9294, 14217), (9183, 14238), (9073, 14373), (9364, 14346), (9127, 14334), (9340, 14294), (9367, 14373), (9297, 14344), (9339, 14302), (9129, 14354), (9233, 14362), (9266, 14320), (9256, 14395), (9380, 14389), (9060, 14257), (9148, 14251), (9409, 14399)]
Round 009: test acc mean=0.6542 ± 0.0109 | min=0.6115 max=0.6660
         : test loss mean=0.6269 ± 0.0076
         : individual accs = ['0.611509', '0.658728', '0.650498', '0.663361', '0.656272', '0.657761', '0.658511', '0.666039', '0.657059', '0.649899', '0.648843', '0.655643', '0.658562', '0.656455', '0.656425', '0.649948', '0.664674', '0.655257', '0.650060', '0.659212']
         : correct/total = [(8703, 14232), (9377, 14235), (9280, 14266), (9431, 14217), (9344, 14238), (9454, 14373), (9447, 14346), (9547, 14334), (9392, 14294), (9341, 14373), (9307, 14344), (9377, 14302), (9453, 14354), (9428, 14362), (9400, 14320), (9356, 14395), (9564, 14389), (9342, 14257), (9264, 14251), (9492, 14399)]
Round 010: test acc mean=0.6628 ± 0.0076 | min=0.6396 max=0.6745
         : test loss mean=0.6185 ± 0.0058
         : individual accs = ['0.661608', '0.667299', '0.639563', '0.666878', '0.670600', '0.664649', '0.665203', '0.674480', '0.665594', '0.656022', '0.663832', '0.668228', '0.669012', '0.662373', '0.665014', '0.655853', '0.670026', '0.653644', '0.654761', '0.661713']
         : correct/total = [(9416, 14232), (9499, 14235), (9124, 14266), (9481, 14217), (9548, 14238), (9553, 14373), (9543, 14346), (9668, 14334), (9514, 14294), (9429, 14373), (9522, 14344), (9557, 14302), (9603, 14354), (9513, 14362), (9523, 14320), (9441, 14395), (9641, 14389), (9319, 14257), (9331, 14251), (9528, 14399)]

=== FINAL RESULTS ===
Dataset: sent140, Nodes: 20, Graph: fully, Aggregation: balance
Overall test accuracy: mean=0.6628 ± 0.0076

=== BALANCE SUMMARY ===
Node 0: acceptance=1.000
Node 1: acceptance=1.000
Node 2: acceptance=1.000
Node 3: acceptance=1.000
Node 4: acceptance=1.000
Node 5: acceptance=1.000
Node 6: acceptance=1.000
Node 7: acceptance=1.000
Node 8: acceptance=1.000
Node 9: acceptance=1.000
Node 10: acceptance=1.000
Node 11: acceptance=1.000
Node 12: acceptance=1.000
Node 13: acceptance=1.000
Node 14: acceptance=1.000
Node 15: acceptance=1.000
Node 16: acceptance=1.000
Node 17: acceptance=1.000
Node 18: acceptance=1.000
Node 19: acceptance=1.000

=== PARALLEL EXECUTION TIME (realistic for distributed system) ===
  COMMUNICATION (max across nodes):
    - Full model transfer: 0.000s (0.0%)
  COMPUTATION (max across nodes):
    - Filtering: 0.089s (81.5%)
    - Aggregation: 0.020s (18.5%)
  TOTALS:
    - Total computation: 0.109s (100.0%)
    - Total communication: 0.000s (0.0%)
    - Total parallel time: 0.109s

=== PER-NODE AVERAGE TIME ===
  - Filtering: 0.075s
  - Aggregation: 0.014s
  - Model transfer: 0.000s
  - Total per node: 0.089s

=== TOTAL COMPUTATIONAL WORK (sum across all nodes) ===
  - Total filtering: 1.500s
  - Total aggregation: 0.286s
  - Total model transfer: 0.000s
  - Grand total: 1.787s
  - Mean acceptance rate: 1.000

BALANCE Algorithm Properties:
  - Model dimension: 1,174,986
  - No compression: Full parameter comparison
  - Theoretical complexity: O(deg(i)×d)
  - Approach: Full parameter filtering + averaging
