Device: cuda
Seed: 987654321
Loading 1 LEAF Sent140 train files...
LEAF Sent140 train: 254555 users, 908652 samples
Building vocabulary (max_size=10000)...
Vocabulary size: 10000
Loading 1 LEAF Sent140 test files...
LEAF Sent140 test: 254555 users, 286281 samples
Found 254555 train users, 254555 test users, 254555 common users
User sample counts range: 494 (max) to 1 (min)
Distributed ALL 254555 users across 20 clients
Users per client: 12727 (with 15 clients getting +1 user)
Train partition sizes: [44353, 44290, 44657, 44907, 44696, 45843, 45801, 45619, 45069, 45639, 45821, 45311, 45779, 46056, 45625, 45984, 46428, 44737, 45540, 46497]
Test partition sizes: [14232, 14235, 14266, 14217, 14238, 14373, 14346, 14334, 14294, 14373, 14344, 14302, 14354, 14362, 14320, 14395, 14389, 14257, 14251, 14399]
  Client 0: 44353 train samples, 2 unique classes
  Client 1: 44290 train samples, 2 unique classes
  Client 2: 44657 train samples, 2 unique classes
  Client 3: 44907 train samples, 2 unique classes
  Client 4: 44696 train samples, 2 unique classes
  Client 5: 45843 train samples, 2 unique classes
  Client 6: 45801 train samples, 2 unique classes
  Client 7: 45619 train samples, 2 unique classes
  Client 8: 45069 train samples, 2 unique classes
  Client 9: 45639 train samples, 2 unique classes
  Client 10: 45821 train samples, 2 unique classes
  Client 11: 45311 train samples, 2 unique classes
  Client 12: 45779 train samples, 2 unique classes
  Client 13: 46056 train samples, 2 unique classes
  Client 14: 45625 train samples, 2 unique classes
  Client 15: 45984 train samples, 2 unique classes
  Client 16: 46428 train samples, 2 unique classes
  Client 17: 44737 train samples, 2 unique classes
  Client 18: 45540 train samples, 2 unique classes
  Client 19: 46497 train samples, 2 unique classes
Will sample 4500 samples per client per epoch
Graph: erdos, nodes: 20, edges: 48
Degree statistics: avg=4.80, min=2, max=7
Attack: Compromised 10/20 nodes: [1, 2, 5, 11, 12, 13, 14, 15, 17, 18]
Attack type: krum, lambda: 1.0
Model variant: baseline
Model parameters: 1,174,986
Sketchguard Node 0:
  Model dim: 1,174,986 → Sketch size: 180
  Compression ratio: 6527.7x
  Using model parameters for aggregation, sketches for filtering
Sketchguard Node 1:
  Model dim: 1,174,986 → Sketch size: 180
  Compression ratio: 6527.7x
  Using model parameters for aggregation, sketches for filtering
Sketchguard Node 2:
  Model dim: 1,174,986 → Sketch size: 180
  Compression ratio: 6527.7x
  Using model parameters for aggregation, sketches for filtering
Sketchguard Node 3:
  Model dim: 1,174,986 → Sketch size: 180
  Compression ratio: 6527.7x
  Using model parameters for aggregation, sketches for filtering
Sketchguard Node 4:
  Model dim: 1,174,986 → Sketch size: 180
  Compression ratio: 6527.7x
  Using model parameters for aggregation, sketches for filtering
Sketchguard Node 5:
  Model dim: 1,174,986 → Sketch size: 180
  Compression ratio: 6527.7x
  Using model parameters for aggregation, sketches for filtering
Sketchguard Node 6:
  Model dim: 1,174,986 → Sketch size: 180
  Compression ratio: 6527.7x
  Using model parameters for aggregation, sketches for filtering
Sketchguard Node 7:
  Model dim: 1,174,986 → Sketch size: 180
  Compression ratio: 6527.7x
  Using model parameters for aggregation, sketches for filtering
Sketchguard Node 8:
  Model dim: 1,174,986 → Sketch size: 180
  Compression ratio: 6527.7x
  Using model parameters for aggregation, sketches for filtering
Sketchguard Node 9:
  Model dim: 1,174,986 → Sketch size: 180
  Compression ratio: 6527.7x
  Using model parameters for aggregation, sketches for filtering
Sketchguard Node 10:
  Model dim: 1,174,986 → Sketch size: 180
  Compression ratio: 6527.7x
  Using model parameters for aggregation, sketches for filtering
Sketchguard Node 11:
  Model dim: 1,174,986 → Sketch size: 180
  Compression ratio: 6527.7x
  Using model parameters for aggregation, sketches for filtering
Sketchguard Node 12:
  Model dim: 1,174,986 → Sketch size: 180
  Compression ratio: 6527.7x
  Using model parameters for aggregation, sketches for filtering
Sketchguard Node 13:
  Model dim: 1,174,986 → Sketch size: 180
  Compression ratio: 6527.7x
  Using model parameters for aggregation, sketches for filtering
Sketchguard Node 14:
  Model dim: 1,174,986 → Sketch size: 180
  Compression ratio: 6527.7x
  Using model parameters for aggregation, sketches for filtering
Sketchguard Node 15:
  Model dim: 1,174,986 → Sketch size: 180
  Compression ratio: 6527.7x
  Using model parameters for aggregation, sketches for filtering
Sketchguard Node 16:
  Model dim: 1,174,986 → Sketch size: 180
  Compression ratio: 6527.7x
  Using model parameters for aggregation, sketches for filtering
Sketchguard Node 17:
  Model dim: 1,174,986 → Sketch size: 180
  Compression ratio: 6527.7x
  Using model parameters for aggregation, sketches for filtering
Sketchguard Node 18:
  Model dim: 1,174,986 → Sketch size: 180
  Compression ratio: 6527.7x
  Using model parameters for aggregation, sketches for filtering
Sketchguard Node 19:
  Model dim: 1,174,986 → Sketch size: 180
  Compression ratio: 6527.7x
  Using model parameters for aggregation, sketches for filtering
Sketchguard ALGORITHM (Sketch-based Filtering + State Aggregation)
  - Model dimension: 1,174,986 parameters
  - Config: SketchguardConfig(gamma=2, kappa=1, alpha=0.5, min_neighbors=1, sketch_size=180, network_seed=987654321, attack_detection_window=5)
  - Sketch size: 180
  - Compression ratio: 6527.7x
  - Complexity: O(d + N×k) = O(1,174,986 + 20×180)
  - Theoretical speedup vs BALANCE: 19.9x
Initial test acc across nodes: mean=0.4953 ± 0.0174
Round 001: test acc mean=0.4992 ± 0.0104 | min=0.4823 max=0.5212
         : test loss mean=1.1162 ± 0.4229
         : individual accs = ['0.487774', '0.498068', '0.486401', '0.512063', '0.505619', '0.497391', '0.482295', '0.492745', '0.497272', '0.495095', '0.509690', '0.521186', '0.508081', '0.516432', '0.492039', '0.483223', '0.494475', '0.499053', '0.504105', '0.501285']
         : correct/total = [(6942, 14232), (7090, 14235), (6939, 14266), (7280, 14217), (7199, 14238), (7149, 14373), (6919, 14346), (7063, 14334), (7108, 14294), (7116, 14373), (7311, 14344), (7454, 14302), (7293, 14354), (7417, 14362), (7046, 14320), (6956, 14395), (7115, 14389), (7115, 14257), (7184, 14251), (7218, 14399)]
         : compromised: 0.5006, honest: 0.4978
         : sketchguard stats = ['Node 0: acc_rate=1.000', 'Node 1: acc_rate=1.000', 'Node 2: acc_rate=1.000']...
Round 002: test acc mean=0.5127 ± 0.0194 | min=0.4859 max=0.5728
         : test loss mean=0.8663 ± 0.3173
         : individual accs = ['0.509345', '0.496804', '0.489906', '0.506788', '0.509411', '0.512280', '0.506413', '0.509907', '0.489226', '0.499478', '0.524261', '0.505803', '0.572802', '0.523813', '0.525349', '0.527753', '0.511502', '0.542120', '0.505508', '0.485937']
         : correct/total = [(7249, 14232), (7072, 14235), (6989, 14266), (7205, 14217), (7253, 14238), (7363, 14373), (7265, 14346), (7309, 14334), (6993, 14294), (7179, 14373), (7520, 14344), (7234, 14302), (8222, 14354), (7523, 14362), (7523, 14320), (7597, 14395), (7360, 14389), (7729, 14257), (7204, 14251), (6997, 14399)]
         : compromised: 0.5202, honest: 0.5052
         : sketchguard stats = ['Node 0: acc_rate=0.833', 'Node 1: acc_rate=0.667', 'Node 2: acc_rate=0.700']...
Round 003: test acc mean=0.5415 ± 0.0358 | min=0.4943 max=0.6072
         : test loss mean=0.6876 ± 0.0122
         : individual accs = ['0.494309', '0.596207', '0.518015', '0.520504', '0.574940', '0.582411', '0.506134', '0.607158', '0.506017', '0.561191', '0.565393', '0.549713', '0.543124', '0.495892', '0.510894', '0.586245', '0.507401', '0.572701', '0.503333', '0.527606']
         : correct/total = [(7035, 14232), (8487, 14235), (7390, 14266), (7400, 14217), (8186, 14238), (8371, 14373), (7261, 14346), (8703, 14334), (7233, 14294), (8066, 14373), (8110, 14344), (7862, 14302), (7796, 14354), (7122, 14362), (7316, 14320), (8439, 14395), (7301, 14389), (8165, 14257), (7173, 14251), (7597, 14399)]
         : compromised: 0.5459, honest: 0.5371
         : sketchguard stats = ['Node 0: acc_rate=0.778', 'Node 1: acc_rate=0.556', 'Node 2: acc_rate=0.600']...
Round 004: test acc mean=0.5937 ± 0.0236 | min=0.5523 max=0.6313
         : test loss mean=0.6716 ± 0.0117
         : individual accs = ['0.603569', '0.584756', '0.558040', '0.608356', '0.631339', '0.626939', '0.601561', '0.606390', '0.600742', '0.570862', '0.607780', '0.580618', '0.585551', '0.573806', '0.554818', '0.619034', '0.624574', '0.608263', '0.575609', '0.552261']
         : correct/total = [(8590, 14232), (8324, 14235), (7961, 14266), (8649, 14217), (8989, 14238), (9011, 14373), (8630, 14346), (8692, 14334), (8587, 14294), (8205, 14373), (8718, 14344), (8304, 14302), (8405, 14354), (8241, 14362), (7945, 14320), (8911, 14395), (8987, 14389), (8672, 14257), (8203, 14251), (7952, 14399)]
         : compromised: 0.5867, honest: 0.6007
         : sketchguard stats = ['Node 0: acc_rate=0.750', 'Node 1: acc_rate=0.500', 'Node 2: acc_rate=0.550']...
Round 005: test acc mean=0.6207 ± 0.0243 | min=0.5300 max=0.6433
         : test loss mean=0.6545 ± 0.0157
         : individual accs = ['0.624438', '0.624658', '0.606898', '0.625237', '0.643349', '0.642455', '0.623379', '0.643226', '0.640828', '0.620260', '0.623397', '0.603202', '0.615229', '0.611753', '0.634288', '0.530045', '0.638821', '0.609946', '0.613010', '0.640183']
         : correct/total = [(8887, 14232), (8892, 14235), (8658, 14266), (8889, 14217), (9160, 14238), (9234, 14373), (8943, 14346), (9220, 14334), (9160, 14294), (8915, 14373), (8942, 14344), (8627, 14302), (8831, 14354), (8786, 14362), (9083, 14320), (7630, 14395), (9192, 14389), (8696, 14257), (8736, 14251), (9218, 14399)]
         : compromised: 0.6091, honest: 0.6323
         : sketchguard stats = ['Node 0: acc_rate=0.733', 'Node 1: acc_rate=0.467', 'Node 2: acc_rate=0.520']...
Round 006: test acc mean=0.6337 ± 0.0182 | min=0.5781 max=0.6571
         : test loss mean=0.6438 ± 0.0166
         : individual accs = ['0.634978', '0.607376', '0.620777', '0.627277', '0.651707', '0.657065', '0.633626', '0.656969', '0.645516', '0.633897', '0.643963', '0.623689', '0.636687', '0.632015', '0.646089', '0.634456', '0.645007', '0.578102', '0.616378', '0.649351']
         : correct/total = [(9037, 14232), (8646, 14235), (8856, 14266), (8918, 14217), (9279, 14238), (9444, 14373), (9090, 14346), (9417, 14334), (9227, 14294), (9111, 14373), (9237, 14344), (8920, 14302), (9139, 14354), (9077, 14362), (9252, 14320), (9133, 14395), (9281, 14389), (8242, 14257), (8784, 14251), (9350, 14399)]
         : compromised: 0.6253, honest: 0.6422
         : sketchguard stats = ['Node 0: acc_rate=0.722', 'Node 1: acc_rate=0.472', 'Node 2: acc_rate=0.500']...
Round 007: test acc mean=0.6425 ± 0.0123 | min=0.6149 max=0.6572
         : test loss mean=0.6350 ± 0.0173
         : individual accs = ['0.641723', '0.623744', '0.614889', '0.639797', '0.653182', '0.657204', '0.644570', '0.657249', '0.656149', '0.636749', '0.645915', '0.616837', '0.650341', '0.638769', '0.648254', '0.637513', '0.653763', '0.650558', '0.633289', '0.650045']
         : correct/total = [(9133, 14232), (8879, 14235), (8772, 14266), (9096, 14217), (9300, 14238), (9446, 14373), (9247, 14346), (9421, 14334), (9379, 14294), (9152, 14373), (9265, 14344), (8822, 14302), (9335, 14354), (9174, 14362), (9283, 14320), (9177, 14395), (9407, 14389), (9275, 14257), (9025, 14251), (9360, 14399)]
         : compromised: 0.6371, honest: 0.6479
         : sketchguard stats = ['Node 0: acc_rate=0.714', 'Node 1: acc_rate=0.452', 'Node 2: acc_rate=0.486']...
Round 008: test acc mean=0.6502 ± 0.0152 | min=0.6078 max=0.6714
         : test loss mean=0.6261 ± 0.0187
         : individual accs = ['0.648960', '0.650088', '0.617833', '0.659351', '0.663225', '0.671398', '0.657326', '0.664434', '0.656919', '0.646072', '0.659091', '0.634946', '0.654034', '0.652416', '0.645880', '0.607780', '0.657864', '0.659466', '0.637710', '0.659143']
         : correct/total = [(9236, 14232), (9254, 14235), (8814, 14266), (9374, 14217), (9443, 14238), (9650, 14373), (9430, 14346), (9524, 14334), (9390, 14294), (9286, 14373), (9454, 14344), (9081, 14302), (9388, 14354), (9370, 14362), (9249, 14320), (8749, 14395), (9466, 14389), (9402, 14257), (9088, 14251), (9491, 14399)]
         : compromised: 0.6432, honest: 0.6572
         : sketchguard stats = ['Node 0: acc_rate=0.708', 'Node 1: acc_rate=0.438', 'Node 2: acc_rate=0.475']...
Round 009: test acc mean=0.6529 ± 0.0102 | min=0.6328 max=0.6738
         : test loss mean=0.6235 ± 0.0125
         : individual accs = ['0.633924', '0.662030', '0.632833', '0.656186', '0.650653', '0.673833', '0.636693', '0.659969', '0.638660', '0.650943', '0.652328', '0.652216', '0.654312', '0.662512', '0.662430', '0.655783', '0.651678', '0.659676', '0.654059', '0.657129']
         : correct/total = [(9022, 14232), (9424, 14235), (9028, 14266), (9329, 14217), (9264, 14238), (9685, 14373), (9134, 14346), (9460, 14334), (9129, 14294), (9356, 14373), (9357, 14344), (9328, 14302), (9392, 14354), (9515, 14362), (9486, 14320), (9440, 14395), (9377, 14389), (9405, 14257), (9321, 14251), (9462, 14399)]
         : compromised: 0.6570, honest: 0.6488
         : sketchguard stats = ['Node 0: acc_rate=0.704', 'Node 1: acc_rate=0.426', 'Node 2: acc_rate=0.467']...
Round 010: test acc mean=0.6645 ± 0.0077 | min=0.6471 max=0.6765
         : test loss mean=0.6094 ± 0.0086
         : individual accs = ['0.660413', '0.665262', '0.647063', '0.661884', '0.668001', '0.676546', '0.665760', '0.676085', '0.664055', '0.654769', '0.669688', '0.658300', '0.667828', '0.666829', '0.663268', '0.665648', '0.668149', '0.672792', '0.648165', '0.670463']
         : correct/total = [(9399, 14232), (9470, 14235), (9231, 14266), (9410, 14217), (9511, 14238), (9724, 14373), (9551, 14346), (9691, 14334), (9492, 14294), (9411, 14373), (9606, 14344), (9415, 14302), (9586, 14354), (9577, 14362), (9498, 14320), (9582, 14395), (9614, 14389), (9592, 14257), (9237, 14251), (9654, 14399)]
         : compromised: 0.6632, honest: 0.6659
         : sketchguard stats = ['Node 0: acc_rate=0.700', 'Node 1: acc_rate=0.417', 'Node 2: acc_rate=0.420']...

=== FINAL RESULTS ===
Dataset: sent140, Nodes: 20, Graph: erdos, Aggregation: sketchguard
Attack: krum, 50.0% compromised
Final accuracy - Compromised: 0.6632, Honest: 0.6659
Overall test accuracy: mean=0.6645 ± 0.0077

=== Sketchguard SUMMARY ===
Node 0: acceptance=0.700
Node 1: acceptance=0.417
Node 2: acceptance=0.420
Node 3: acceptance=0.600
Node 4: acceptance=0.325
Node 5: acceptance=0.240
Node 6: acceptance=0.460
Node 7: acceptance=0.460
Node 8: acceptance=0.600
Node 9: acceptance=0.733
Node 10: acceptance=0.550
Node 11: acceptance=0.429
Node 12: acceptance=0.529
Node 13: acceptance=0.325
Node 14: acceptance=0.200
Node 15: acceptance=0.350
Node 16: acceptance=0.300
Node 17: acceptance=0.540
Node 18: acceptance=0.450
Node 19: acceptance=0.600

=== PARALLEL EXECUTION TIME (realistic for distributed system) ===
  COMMUNICATION (max across nodes):
    - Sketch transfer: 0.000s (0.0%)
    - Model fetch (accepted): 0.000s (0.0%)
  COMPUTATION (max across nodes):
    - Sketching: 0.258s (95.6%)
    - Filtering: 0.001s (0.3%)
    - Aggregation: 0.011s (4.1%)
  TOTALS:
    - Total computation: 0.270s (100.0%)
    - Total communication: 0.000s (0.0%)
    - Total parallel time: 0.270s

=== PER-NODE AVERAGE TIME ===
  - Sketching: 0.189s
  - Filtering: 0.000s
  - Aggregation: 0.007s
  - Sketch transfer: 0.000s
  - Model fetch: 0.000s
  - Total per node: 0.196s

=== TOTAL COMPUTATIONAL WORK (sum across all nodes) ===
  - Total sketching: 3.771s
  - Total filtering: 0.008s
  - Total aggregation: 0.144s
  - Total sketch transfer: 0.000s
  - Total model fetch: 0.000s
  - Grand total: 3.924s
  - Mean acceptance rate: 0.461

Sketchguard Algorithm Properties:
  - Original dimension: 1,174,986
  - Sketch size: 180
  - Compression ratio: 19.9x
  - Single repetition: No repetitions needed
  - Theoretical complexity: O(d + N×k)
  - Approach: Sketch filtering + state aggregation
