Device: cuda
Seed: 987654321
Loading 1 LEAF Sent140 train files...
LEAF Sent140 train: 254555 users, 908652 samples
Building vocabulary (max_size=10000)...
Vocabulary size: 10000
Loading 1 LEAF Sent140 test files...
LEAF Sent140 test: 254555 users, 286281 samples
Found 254555 train users, 254555 test users, 254555 common users
User sample counts range: 494 (max) to 1 (min)
Distributed ALL 254555 users across 20 clients
Users per client: 12727 (with 15 clients getting +1 user)
Train partition sizes: [44353, 44290, 44657, 44907, 44696, 45843, 45801, 45619, 45069, 45639, 45821, 45311, 45779, 46056, 45625, 45984, 46428, 44737, 45540, 46497]
Test partition sizes: [14232, 14235, 14266, 14217, 14238, 14373, 14346, 14334, 14294, 14373, 14344, 14302, 14354, 14362, 14320, 14395, 14389, 14257, 14251, 14399]
  Client 0: 44353 train samples, 2 unique classes
  Client 1: 44290 train samples, 2 unique classes
  Client 2: 44657 train samples, 2 unique classes
  Client 3: 44907 train samples, 2 unique classes
  Client 4: 44696 train samples, 2 unique classes
  Client 5: 45843 train samples, 2 unique classes
  Client 6: 45801 train samples, 2 unique classes
  Client 7: 45619 train samples, 2 unique classes
  Client 8: 45069 train samples, 2 unique classes
  Client 9: 45639 train samples, 2 unique classes
  Client 10: 45821 train samples, 2 unique classes
  Client 11: 45311 train samples, 2 unique classes
  Client 12: 45779 train samples, 2 unique classes
  Client 13: 46056 train samples, 2 unique classes
  Client 14: 45625 train samples, 2 unique classes
  Client 15: 45984 train samples, 2 unique classes
  Client 16: 46428 train samples, 2 unique classes
  Client 17: 44737 train samples, 2 unique classes
  Client 18: 45540 train samples, 2 unique classes
  Client 19: 46497 train samples, 2 unique classes
Will sample 4500 samples per client per epoch
Graph: fully, nodes: 20, edges: 190
Degree statistics: avg=19.00, min=19, max=19
Attack: Compromised 14/20 nodes: [1, 2, 3, 5, 6, 8, 11, 12, 13, 14, 15, 17, 18, 19]
Attack type: gaussian, lambda: 1.0
Model variant: baseline
Model parameters: 1,174,986
Sketchguard Node 0:
  Model dim: 1,174,986 → Sketch size: 180
  Compression ratio: 6527.7x
  Using model parameters for aggregation, sketches for filtering
Sketchguard Node 1:
  Model dim: 1,174,986 → Sketch size: 180
  Compression ratio: 6527.7x
  Using model parameters for aggregation, sketches for filtering
Sketchguard Node 2:
  Model dim: 1,174,986 → Sketch size: 180
  Compression ratio: 6527.7x
  Using model parameters for aggregation, sketches for filtering
Sketchguard Node 3:
  Model dim: 1,174,986 → Sketch size: 180
  Compression ratio: 6527.7x
  Using model parameters for aggregation, sketches for filtering
Sketchguard Node 4:
  Model dim: 1,174,986 → Sketch size: 180
  Compression ratio: 6527.7x
  Using model parameters for aggregation, sketches for filtering
Sketchguard Node 5:
  Model dim: 1,174,986 → Sketch size: 180
  Compression ratio: 6527.7x
  Using model parameters for aggregation, sketches for filtering
Sketchguard Node 6:
  Model dim: 1,174,986 → Sketch size: 180
  Compression ratio: 6527.7x
  Using model parameters for aggregation, sketches for filtering
Sketchguard Node 7:
  Model dim: 1,174,986 → Sketch size: 180
  Compression ratio: 6527.7x
  Using model parameters for aggregation, sketches for filtering
Sketchguard Node 8:
  Model dim: 1,174,986 → Sketch size: 180
  Compression ratio: 6527.7x
  Using model parameters for aggregation, sketches for filtering
Sketchguard Node 9:
  Model dim: 1,174,986 → Sketch size: 180
  Compression ratio: 6527.7x
  Using model parameters for aggregation, sketches for filtering
Sketchguard Node 10:
  Model dim: 1,174,986 → Sketch size: 180
  Compression ratio: 6527.7x
  Using model parameters for aggregation, sketches for filtering
Sketchguard Node 11:
  Model dim: 1,174,986 → Sketch size: 180
  Compression ratio: 6527.7x
  Using model parameters for aggregation, sketches for filtering
Sketchguard Node 12:
  Model dim: 1,174,986 → Sketch size: 180
  Compression ratio: 6527.7x
  Using model parameters for aggregation, sketches for filtering
Sketchguard Node 13:
  Model dim: 1,174,986 → Sketch size: 180
  Compression ratio: 6527.7x
  Using model parameters for aggregation, sketches for filtering
Sketchguard Node 14:
  Model dim: 1,174,986 → Sketch size: 180
  Compression ratio: 6527.7x
  Using model parameters for aggregation, sketches for filtering
Sketchguard Node 15:
  Model dim: 1,174,986 → Sketch size: 180
  Compression ratio: 6527.7x
  Using model parameters for aggregation, sketches for filtering
Sketchguard Node 16:
  Model dim: 1,174,986 → Sketch size: 180
  Compression ratio: 6527.7x
  Using model parameters for aggregation, sketches for filtering
Sketchguard Node 17:
  Model dim: 1,174,986 → Sketch size: 180
  Compression ratio: 6527.7x
  Using model parameters for aggregation, sketches for filtering
Sketchguard Node 18:
  Model dim: 1,174,986 → Sketch size: 180
  Compression ratio: 6527.7x
  Using model parameters for aggregation, sketches for filtering
Sketchguard Node 19:
  Model dim: 1,174,986 → Sketch size: 180
  Compression ratio: 6527.7x
  Using model parameters for aggregation, sketches for filtering
Sketchguard ALGORITHM (Sketch-based Filtering + State Aggregation)
  - Model dimension: 1,174,986 parameters
  - Config: SketchguardConfig(gamma=2, kappa=1, alpha=0.5, min_neighbors=1, sketch_size=180, network_seed=987654321, attack_detection_window=5)
  - Sketch size: 180
  - Compression ratio: 6527.7x
  - Complexity: O(d + N×k) = O(1,174,986 + 20×180)
  - Theoretical speedup vs BALANCE: 19.9x
Initial test acc across nodes: mean=0.4953 ± 0.0174
Round 001: test acc mean=0.5661 ± 0.0399 | min=0.5056 max=0.6252
         : test loss mean=0.6897 ± 0.0009
         : individual accs = ['0.589587', '0.557499', '0.523342', '0.543082', '0.623753', '0.591387', '0.615293', '0.625227', '0.505597', '0.609685', '0.512619', '0.536988', '0.605685', '0.511349', '0.533450', '0.559778', '0.523942', '0.601249', '0.556522', '0.595666']
         : correct/total = [(8391, 14232), (7936, 14235), (7466, 14266), (7721, 14217), (8881, 14238), (8500, 14373), (8827, 14346), (8962, 14334), (7227, 14294), (8763, 14373), (7353, 14344), (7680, 14302), (8694, 14354), (7344, 14362), (7639, 14320), (8058, 14395), (7539, 14389), (8572, 14257), (7931, 14251), (8577, 14399)]
         : compromised: 0.5598, honest: 0.5808
         : sketchguard stats = ['Node 0: acc_rate=0.263', 'Node 1: acc_rate=0.316', 'Node 2: acc_rate=0.316']...
Round 002: test acc mean=0.5613 ± 0.0484 | min=0.4926 max=0.6331
         : test loss mean=0.6889 ± 0.0022
         : individual accs = ['0.605326', '0.522234', '0.535609', '0.602659', '0.515733', '0.620747', '0.499791', '0.625366', '0.517280', '0.633062', '0.601157', '0.580688', '0.502787', '0.534953', '0.492598', '0.523168', '0.616999', '0.579505', '0.606484', '0.509688']
         : correct/total = [(8615, 14232), (7434, 14235), (7641, 14266), (8568, 14217), (7343, 14238), (8922, 14373), (7170, 14346), (8964, 14334), (7394, 14294), (9099, 14373), (8623, 14344), (8305, 14302), (7217, 14354), (7683, 14362), (7054, 14320), (7531, 14395), (8878, 14389), (8262, 14257), (8643, 14251), (7339, 14399)]
         : compromised: 0.5449, honest: 0.5996
         : sketchguard stats = ['Node 0: acc_rate=0.263', 'Node 1: acc_rate=0.316', 'Node 2: acc_rate=0.316']...
Round 003: test acc mean=0.5813 ± 0.0418 | min=0.5063 max=0.6380
         : test loss mean=0.6798 ± 0.0058
         : individual accs = ['0.542580', '0.563962', '0.530212', '0.614616', '0.634569', '0.565157', '0.506343', '0.590624', '0.581922', '0.638002', '0.608617', '0.626835', '0.559565', '0.546442', '0.581145', '0.529767', '0.632845', '0.627622', '0.624026', '0.520522']
         : correct/total = [(7722, 14232), (8028, 14235), (7564, 14266), (8738, 14217), (9035, 14238), (8123, 14373), (7264, 14346), (8466, 14334), (8318, 14294), (9170, 14373), (8730, 14344), (8965, 14302), (8032, 14354), (7848, 14362), (8322, 14320), (7626, 14395), (9106, 14389), (8948, 14257), (8893, 14251), (7495, 14399)]
         : compromised: 0.5699, honest: 0.6079
         : sketchguard stats = ['Node 0: acc_rate=0.263', 'Node 1: acc_rate=0.316', 'Node 2: acc_rate=0.316']...
Round 004: test acc mean=0.6379 ± 0.0056 | min=0.6263 max=0.6486
         : test loss mean=0.6526 ± 0.0041
         : individual accs = ['0.643620', '0.626273', '0.629889', '0.640501', '0.641242', '0.648647', '0.636205', '0.643854', '0.634672', '0.634036', '0.634900', '0.632569', '0.643235', '0.635427', '0.636453', '0.636888', '0.644034', '0.634074', '0.635534', '0.645531']
         : correct/total = [(9160, 14232), (8915, 14235), (8986, 14266), (9106, 14217), (9130, 14238), (9323, 14373), (9127, 14346), (9229, 14334), (9072, 14294), (9113, 14373), (9107, 14344), (9047, 14302), (9233, 14354), (9126, 14362), (9114, 14320), (9168, 14395), (9267, 14389), (9040, 14257), (9057, 14251), (9295, 14399)]
         : compromised: 0.6368, honest: 0.6403
         : sketchguard stats = ['Node 0: acc_rate=0.263', 'Node 1: acc_rate=0.316', 'Node 2: acc_rate=0.316']...
Round 005: test acc mean=0.6440 ± 0.0063 | min=0.6276 max=0.6566
         : test loss mean=0.6364 ± 0.0034
         : individual accs = ['0.645728', '0.642220', '0.642296', '0.635577', '0.645807', '0.656578', '0.640736', '0.650063', '0.653001', '0.648090', '0.640965', '0.644665', '0.645395', '0.643225', '0.646927', '0.627579', '0.644659', '0.642842', '0.634833', '0.649559']
         : correct/total = [(9190, 14232), (9142, 14235), (9163, 14266), (9036, 14217), (9195, 14238), (9437, 14373), (9192, 14346), (9318, 14334), (9334, 14294), (9315, 14373), (9194, 14344), (9220, 14302), (9264, 14354), (9238, 14362), (9264, 14320), (9034, 14395), (9276, 14389), (9165, 14257), (9047, 14251), (9353, 14399)]
         : compromised: 0.6432, honest: 0.6459
         : sketchguard stats = ['Node 0: acc_rate=0.263', 'Node 1: acc_rate=0.316', 'Node 2: acc_rate=0.316']...
Round 006: test acc mean=0.6497 ± 0.0040 | min=0.6426 max=0.6591
         : test loss mean=0.6295 ± 0.0029
         : individual accs = ['0.648890', '0.654795', '0.644119', '0.647113', '0.652269', '0.659083', '0.649380', '0.650342', '0.654330', '0.650595', '0.645148', '0.650399', '0.653685', '0.650327', '0.651117', '0.650295', '0.645146', '0.642632', '0.644657', '0.650184']
         : correct/total = [(9235, 14232), (9321, 14235), (9189, 14266), (9200, 14217), (9287, 14238), (9473, 14373), (9316, 14346), (9322, 14334), (9353, 14294), (9351, 14373), (9254, 14344), (9302, 14302), (9383, 14354), (9340, 14362), (9324, 14320), (9361, 14395), (9283, 14389), (9162, 14257), (9187, 14251), (9362, 14399)]
         : compromised: 0.6502, honest: 0.6487
         : sketchguard stats = ['Node 0: acc_rate=0.263', 'Node 1: acc_rate=0.316', 'Node 2: acc_rate=0.316']...
Round 007: test acc mean=0.6530 ± 0.0062 | min=0.6321 max=0.6616
         : test loss mean=0.6256 ± 0.0049
         : individual accs = ['0.654441', '0.660766', '0.632132', '0.651896', '0.656272', '0.661588', '0.654398', '0.647900', '0.657619', '0.655604', '0.648982', '0.649629', '0.658632', '0.656663', '0.655168', '0.647725', '0.655987', '0.652381', '0.649007', '0.653031']
         : correct/total = [(9314, 14232), (9406, 14235), (9018, 14266), (9268, 14217), (9344, 14238), (9509, 14373), (9388, 14346), (9287, 14334), (9400, 14294), (9423, 14373), (9309, 14344), (9291, 14302), (9454, 14354), (9431, 14362), (9382, 14320), (9324, 14395), (9439, 14389), (9301, 14257), (9249, 14251), (9403, 14399)]
         : compromised: 0.6529, honest: 0.6532
         : sketchguard stats = ['Node 0: acc_rate=0.263', 'Node 1: acc_rate=0.316', 'Node 2: acc_rate=0.316']...
Round 008: test acc mean=0.6560 ± 0.0050 | min=0.6431 max=0.6667
         : test loss mean=0.6227 ± 0.0040
         : individual accs = ['0.656408', '0.659431', '0.649166', '0.654498', '0.650864', '0.666667', '0.659835', '0.658434', '0.662516', '0.655952', '0.654769', '0.653685', '0.655775', '0.653112', '0.654539', '0.659465', '0.653138', '0.657361', '0.643113', '0.662129']
         : correct/total = [(9342, 14232), (9387, 14235), (9261, 14266), (9305, 14217), (9267, 14238), (9582, 14373), (9466, 14346), (9438, 14334), (9470, 14294), (9428, 14373), (9392, 14344), (9349, 14302), (9413, 14354), (9380, 14362), (9373, 14320), (9493, 14395), (9398, 14389), (9372, 14257), (9165, 14251), (9534, 14399)]
         : compromised: 0.6565, honest: 0.6549
         : sketchguard stats = ['Node 0: acc_rate=0.263', 'Node 1: acc_rate=0.316', 'Node 2: acc_rate=0.316']...
Round 009: test acc mean=0.6568 ± 0.0073 | min=0.6341 max=0.6713
         : test loss mean=0.6213 ± 0.0055
         : individual accs = ['0.634134', '0.664700', '0.656246', '0.655975', '0.657887', '0.671259', '0.647010', '0.658434', '0.660627', '0.651012', '0.656233', '0.655153', '0.661209', '0.664253', '0.654958', '0.656756', '0.661547', '0.652031', '0.661006', '0.656296']
         : correct/total = [(9025, 14232), (9462, 14235), (9362, 14266), (9326, 14217), (9367, 14238), (9648, 14373), (9282, 14346), (9438, 14334), (9443, 14294), (9357, 14373), (9413, 14344), (9370, 14302), (9491, 14354), (9540, 14362), (9379, 14320), (9454, 14395), (9519, 14389), (9296, 14257), (9420, 14251), (9450, 14399)]
         : compromised: 0.6584, honest: 0.6532
         : sketchguard stats = ['Node 0: acc_rate=0.263', 'Node 1: acc_rate=0.316', 'Node 2: acc_rate=0.316']...
Round 010: test acc mean=0.6643 ± 0.0043 | min=0.6562 max=0.6727
         : test loss mean=0.6139 ± 0.0033
         : individual accs = ['0.665332', '0.669687', '0.656246', '0.662587', '0.666877', '0.672650', '0.667085', '0.667992', '0.669022', '0.660057', '0.664598', '0.661096', '0.670405', '0.663835', '0.663198', '0.656617', '0.662311', '0.664866', '0.659673', '0.662199']
         : correct/total = [(9469, 14232), (9533, 14235), (9362, 14266), (9420, 14217), (9495, 14238), (9668, 14373), (9570, 14346), (9575, 14334), (9563, 14294), (9487, 14373), (9533, 14344), (9455, 14302), (9623, 14354), (9534, 14362), (9497, 14320), (9452, 14395), (9530, 14389), (9479, 14257), (9401, 14251), (9535, 14399)]
         : compromised: 0.6642, honest: 0.6645
         : sketchguard stats = ['Node 0: acc_rate=0.263', 'Node 1: acc_rate=0.316', 'Node 2: acc_rate=0.316']...

=== FINAL RESULTS ===
Dataset: sent140, Nodes: 20, Graph: fully, Aggregation: sketchguard
Attack: gaussian, 70.0% compromised
Final accuracy - Compromised: 0.6642, Honest: 0.6645
Overall test accuracy: mean=0.6643 ± 0.0043

=== Sketchguard SUMMARY ===
Node 0: acceptance=0.263
Node 1: acceptance=0.316
Node 2: acceptance=0.316
Node 3: acceptance=0.316
Node 4: acceptance=0.263
Node 5: acceptance=0.316
Node 6: acceptance=0.316
Node 7: acceptance=0.263
Node 8: acceptance=0.316
Node 9: acceptance=0.263
Node 10: acceptance=0.263
Node 11: acceptance=0.316
Node 12: acceptance=0.316
Node 13: acceptance=0.316
Node 14: acceptance=0.316
Node 15: acceptance=0.316
Node 16: acceptance=0.263
Node 17: acceptance=0.316
Node 18: acceptance=0.316
Node 19: acceptance=0.316

=== PARALLEL EXECUTION TIME (realistic for distributed system) ===
  COMMUNICATION (max across nodes):
    - Sketch transfer: 0.000s (0.0%)
    - Model fetch (accepted): 0.000s (0.0%)
  COMPUTATION (max across nodes):
    - Sketching: 0.344s (95.4%)
    - Filtering: 0.001s (0.3%)
    - Aggregation: 0.015s (4.2%)
  TOTALS:
    - Total computation: 0.361s (100.0%)
    - Total communication: 0.000s (0.0%)
    - Total parallel time: 0.361s

=== PER-NODE AVERAGE TIME ===
  - Sketching: 0.301s
  - Filtering: 0.001s
  - Aggregation: 0.013s
  - Sketch transfer: 0.000s
  - Model fetch: 0.000s
  - Total per node: 0.315s

=== TOTAL COMPUTATIONAL WORK (sum across all nodes) ===
  - Total sketching: 6.027s
  - Total filtering: 0.017s
  - Total aggregation: 0.253s
  - Total sketch transfer: 0.000s
  - Total model fetch: 0.000s
  - Grand total: 6.297s
  - Mean acceptance rate: 0.300

Sketchguard Algorithm Properties:
  - Original dimension: 1,174,986
  - Sketch size: 180
  - Compression ratio: 19.9x
  - Single repetition: No repetitions needed
  - Theoretical complexity: O(d + N×k)
  - Approach: Sketch filtering + state aggregation
