Device: cuda
Seed: 987654321
Loading 1 LEAF Sent140 train files...
LEAF Sent140 train: 254555 users, 908652 samples
Building vocabulary (max_size=10000)...
Vocabulary size: 10000
Loading 1 LEAF Sent140 test files...
LEAF Sent140 test: 254555 users, 286281 samples
Found 254555 train users, 254555 test users, 254555 common users
User sample counts range: 494 (max) to 1 (min)
Distributed ALL 254555 users across 20 clients
Users per client: 12727 (with 15 clients getting +1 user)
Train partition sizes: [44353, 44290, 44657, 44907, 44696, 45843, 45801, 45619, 45069, 45639, 45821, 45311, 45779, 46056, 45625, 45984, 46428, 44737, 45540, 46497]
Test partition sizes: [14232, 14235, 14266, 14217, 14238, 14373, 14346, 14334, 14294, 14373, 14344, 14302, 14354, 14362, 14320, 14395, 14389, 14257, 14251, 14399]
  Client 0: 44353 train samples, 2 unique classes
  Client 1: 44290 train samples, 2 unique classes
  Client 2: 44657 train samples, 2 unique classes
  Client 3: 44907 train samples, 2 unique classes
  Client 4: 44696 train samples, 2 unique classes
  Client 5: 45843 train samples, 2 unique classes
  Client 6: 45801 train samples, 2 unique classes
  Client 7: 45619 train samples, 2 unique classes
  Client 8: 45069 train samples, 2 unique classes
  Client 9: 45639 train samples, 2 unique classes
  Client 10: 45821 train samples, 2 unique classes
  Client 11: 45311 train samples, 2 unique classes
  Client 12: 45779 train samples, 2 unique classes
  Client 13: 46056 train samples, 2 unique classes
  Client 14: 45625 train samples, 2 unique classes
  Client 15: 45984 train samples, 2 unique classes
  Client 16: 46428 train samples, 2 unique classes
  Client 17: 44737 train samples, 2 unique classes
  Client 18: 45540 train samples, 2 unique classes
  Client 19: 46497 train samples, 2 unique classes
Will sample 4500 samples per client per epoch
Graph: erdos, nodes: 20, edges: 48
Degree statistics: avg=4.80, min=2, max=7
Attack: Compromised 8/20 nodes: [1, 5, 11, 12, 13, 14, 17, 18]
Attack type: directed_deviation, lambda: 1.0
Model variant: baseline
Model parameters: 1,174,986
Initial test acc across nodes: mean=0.4953 ± 0.0174
Round 001: test acc mean=0.5063 ± 0.0253 | min=0.4925 max=0.6125
         : test loss mean=6.8916 ± 6.4271
         : individual accs = ['0.612493', '0.515209', '0.493761', '0.492509', '0.495575', '0.499269', '0.505019', '0.498395', '0.498321', '0.508871', '0.501743', '0.496924', '0.496377', '0.502158', '0.495042', '0.492463', '0.501633', '0.513222', '0.493509', '0.514272']
         : correct/total = [(8717, 14232), (7334, 14235), (7044, 14266), (7002, 14217), (7056, 14238), (7176, 14373), (7245, 14346), (7144, 14334), (7123, 14294), (7314, 14373), (7197, 14344), (7107, 14302), (7125, 14354), (7212, 14362), (7089, 14320), (7089, 14395), (7218, 14389), (7317, 14257), (7033, 14251), (7405, 14399)]
         : compromised: 0.5015, honest: 0.5096
Round 002: test acc mean=0.5073 ± 0.0193 | min=0.4900 max=0.5758
         : test loss mean=3.6726 ± 2.8113
         : individual accs = ['0.575815', '0.542747', '0.498949', '0.497222', '0.510816', '0.502192', '0.497769', '0.496930', '0.505597', '0.509845', '0.507529', '0.511956', '0.490595', '0.490043', '0.505796', '0.491560', '0.511502', '0.498282', '0.501158', '0.498715']
         : correct/total = [(8195, 14232), (7726, 14235), (7118, 14266), (7069, 14217), (7273, 14238), (7218, 14373), (7141, 14346), (7123, 14334), (7227, 14294), (7328, 14373), (7280, 14344), (7322, 14302), (7042, 14354), (7038, 14362), (7243, 14320), (7076, 14395), (7360, 14389), (7104, 14257), (7142, 14251), (7181, 14399)]
         : compromised: 0.5053, honest: 0.5085
Round 003: test acc mean=0.5014 ± 0.0117 | min=0.4849 max=0.5253
         : test loss mean=1.6619 ± 1.3456
         : individual accs = ['0.525295', '0.516895', '0.488785', '0.484912', '0.491572', '0.495999', '0.524815', '0.515209', '0.497971', '0.495373', '0.498118', '0.490211', '0.501393', '0.491366', '0.498813', '0.498229', '0.502398', '0.502280', '0.491685', '0.517119']
         : correct/total = [(7476, 14232), (7358, 14235), (6973, 14266), (6894, 14217), (6999, 14238), (7129, 14373), (7529, 14346), (7385, 14334), (7118, 14294), (7120, 14373), (7145, 14344), (7011, 14302), (7197, 14354), (7057, 14362), (7143, 14320), (7172, 14395), (7229, 14389), (7161, 14257), (7007, 14251), (7446, 14399)]
         : compromised: 0.4986, honest: 0.5033
Round 004: test acc mean=0.5035 ± 0.0170 | min=0.4813 max=0.5694
         : test loss mean=1.6992 ± 1.2462
         : individual accs = ['0.569421', '0.500878', '0.509954', '0.502356', '0.495013', '0.486537', '0.504879', '0.509348', '0.496502', '0.495721', '0.493865', '0.498322', '0.503692', '0.493316', '0.507612', '0.481278', '0.502884', '0.512590', '0.507052', '0.498368']
         : correct/total = [(8104, 14232), (7130, 14235), (7275, 14266), (7142, 14217), (7048, 14238), (6993, 14373), (7243, 14346), (7301, 14334), (7097, 14294), (7125, 14373), (7084, 14344), (7127, 14302), (7230, 14354), (7085, 14362), (7269, 14320), (6928, 14395), (7236, 14389), (7308, 14257), (7226, 14251), (7176, 14399)]
         : compromised: 0.5012, honest: 0.5050
Round 005: test acc mean=0.5034 ± 0.0121 | min=0.4864 max=0.5289
         : test loss mean=1.5875 ± 1.8350
         : individual accs = ['0.528879', '0.522304', '0.490327', '0.523950', '0.498876', '0.499339', '0.500418', '0.523790', '0.494263', '0.501565', '0.500767', '0.489092', '0.501115', '0.493664', '0.502304', '0.500035', '0.493432', '0.486428', '0.505228', '0.512188']
         : correct/total = [(7527, 14232), (7435, 14235), (6995, 14266), (7449, 14217), (7103, 14238), (7177, 14373), (7179, 14346), (7508, 14334), (7065, 14294), (7209, 14373), (7183, 14344), (6995, 14302), (7193, 14354), (7090, 14362), (7193, 14320), (7198, 14395), (7100, 14389), (6935, 14257), (7200, 14251), (7375, 14399)]
         : compromised: 0.4999, honest: 0.5057
Round 006: test acc mean=0.5067 ± 0.0194 | min=0.4791 max=0.5663
         : test loss mean=1.1756 ± 0.8463
         : individual accs = ['0.549325', '0.566280', '0.496215', '0.512274', '0.504987', '0.483546', '0.501046', '0.507604', '0.518539', '0.498017', '0.493168', '0.503706', '0.496447', '0.493455', '0.507402', '0.479055', '0.507332', '0.502280', '0.504386', '0.508021']
         : correct/total = [(7818, 14232), (8061, 14235), (7079, 14266), (7283, 14217), (7190, 14238), (6950, 14373), (7188, 14346), (7276, 14334), (7412, 14294), (7158, 14373), (7074, 14344), (7204, 14302), (7126, 14354), (7087, 14362), (7266, 14320), (6896, 14395), (7300, 14389), (7161, 14257), (7188, 14251), (7315, 14399)]
         : compromised: 0.5072, honest: 0.5063
Round 007: test acc mean=0.5070 ± 0.0164 | min=0.4868 max=0.5593
         : test loss mean=1.6749 ± 1.9680
         : individual accs = ['0.510118', '0.559255', '0.486822', '0.489414', '0.521351', '0.494260', '0.501324', '0.527975', '0.507835', '0.505253', '0.511224', '0.498392', '0.495681', '0.492968', '0.504888', '0.498506', '0.490236', '0.515396', '0.507614', '0.522189']
         : correct/total = [(7260, 14232), (7961, 14235), (6945, 14266), (6958, 14217), (7423, 14238), (7104, 14373), (7192, 14346), (7568, 14334), (7259, 14294), (7262, 14373), (7333, 14344), (7128, 14302), (7115, 14354), (7080, 14362), (7230, 14320), (7176, 14395), (7054, 14389), (7348, 14257), (7234, 14251), (7519, 14399)]
         : compromised: 0.5086, honest: 0.5060
Round 008: test acc mean=0.5107 ± 0.0126 | min=0.4902 max=0.5333
         : test loss mean=1.0300 ± 0.6026
         : individual accs = ['0.502881', '0.522585', '0.502103', '0.517268', '0.501545', '0.490155', '0.518890', '0.533347', '0.495243', '0.505462', '0.505996', '0.500000', '0.527100', '0.533004', '0.507402', '0.496770', '0.503927', '0.509855', '0.510561', '0.529273']
         : correct/total = [(7157, 14232), (7439, 14235), (7163, 14266), (7354, 14217), (7141, 14238), (7045, 14373), (7444, 14346), (7645, 14334), (7079, 14294), (7265, 14373), (7258, 14344), (7151, 14302), (7566, 14354), (7655, 14362), (7266, 14320), (7151, 14395), (7251, 14389), (7269, 14257), (7276, 14251), (7621, 14399)]
         : compromised: 0.5126, honest: 0.5094
Round 009: test acc mean=0.5011 ± 0.0088 | min=0.4857 max=0.5181
         : test loss mean=1.3698 ± 1.4661
         : individual accs = ['0.506183', '0.499403', '0.487102', '0.504537', '0.509482', '0.494260', '0.500349', '0.509279', '0.498321', '0.500939', '0.518056', '0.490281', '0.500348', '0.510932', '0.506634', '0.498645', '0.485857', '0.504945', '0.485720', '0.511008']
         : correct/total = [(7204, 14232), (7109, 14235), (6949, 14266), (7173, 14217), (7254, 14238), (7104, 14373), (7178, 14346), (7300, 14334), (7123, 14294), (7200, 14373), (7431, 14344), (7012, 14302), (7182, 14354), (7338, 14362), (7255, 14320), (7178, 14395), (6991, 14389), (7199, 14257), (6922, 14251), (7358, 14399)]
         : compromised: 0.4991, honest: 0.5025
Round 010: test acc mean=0.5127 ± 0.0152 | min=0.4850 max=0.5375
         : test loss mean=0.9945 ± 0.6643
         : individual accs = ['0.536748', '0.531015', '0.509042', '0.529859', '0.518612', '0.488625', '0.537502', '0.530766', '0.501679', '0.505810', '0.504253', '0.498252', '0.509335', '0.512046', '0.503561', '0.484960', '0.506429', '0.520516', '0.497369', '0.527467']
         : correct/total = [(7639, 14232), (7559, 14235), (7262, 14266), (7533, 14217), (7384, 14238), (7023, 14373), (7711, 14346), (7608, 14334), (7171, 14294), (7270, 14373), (7233, 14344), (7126, 14302), (7311, 14354), (7354, 14362), (7211, 14320), (6981, 14395), (7287, 14389), (7421, 14257), (7088, 14251), (7595, 14399)]
         : compromised: 0.5076, honest: 0.5161

=== FINAL RESULTS ===
Dataset: sent140, Nodes: 20, Graph: erdos, Aggregation: krum
Attack: directed_deviation, 40.0% compromised
Final accuracy - Compromised: 0.5076, Honest: 0.5161
Overall test accuracy: mean=0.5127 ± 0.0152
