Device: cuda
Seed: 987654321
Loading 1 LEAF Sent140 train files...
LEAF Sent140 train: 254555 users, 908652 samples
Building vocabulary (max_size=10000)...
Vocabulary size: 10000
Loading 1 LEAF Sent140 test files...
LEAF Sent140 test: 254555 users, 286281 samples
Found 254555 train users, 254555 test users, 254555 common users
User sample counts range: 494 (max) to 1 (min)
Distributed ALL 254555 users across 20 clients
Users per client: 12727 (with 15 clients getting +1 user)
Train partition sizes: [44353, 44290, 44657, 44907, 44696, 45843, 45801, 45619, 45069, 45639, 45821, 45311, 45779, 46056, 45625, 45984, 46428, 44737, 45540, 46497]
Test partition sizes: [14232, 14235, 14266, 14217, 14238, 14373, 14346, 14334, 14294, 14373, 14344, 14302, 14354, 14362, 14320, 14395, 14389, 14257, 14251, 14399]
  Client 0: 44353 train samples, 2 unique classes
  Client 1: 44290 train samples, 2 unique classes
  Client 2: 44657 train samples, 2 unique classes
  Client 3: 44907 train samples, 2 unique classes
  Client 4: 44696 train samples, 2 unique classes
  Client 5: 45843 train samples, 2 unique classes
  Client 6: 45801 train samples, 2 unique classes
  Client 7: 45619 train samples, 2 unique classes
  Client 8: 45069 train samples, 2 unique classes
  Client 9: 45639 train samples, 2 unique classes
  Client 10: 45821 train samples, 2 unique classes
  Client 11: 45311 train samples, 2 unique classes
  Client 12: 45779 train samples, 2 unique classes
  Client 13: 46056 train samples, 2 unique classes
  Client 14: 45625 train samples, 2 unique classes
  Client 15: 45984 train samples, 2 unique classes
  Client 16: 46428 train samples, 2 unique classes
  Client 17: 44737 train samples, 2 unique classes
  Client 18: 45540 train samples, 2 unique classes
  Client 19: 46497 train samples, 2 unique classes
Will sample 4500 samples per client per epoch
Graph: fully, nodes: 20, edges: 190
Degree statistics: avg=19.00, min=19, max=19
Attack: Compromised 8/20 nodes: [1, 5, 11, 12, 13, 14, 17, 18]
Attack type: krum, lambda: 1.0
Model variant: baseline
Model parameters: 1,174,986
Sketchguard Node 0:
  Model dim: 1,174,986 → Sketch size: 180
  Compression ratio: 6527.7x
  Using model parameters for aggregation, sketches for filtering
Sketchguard Node 1:
  Model dim: 1,174,986 → Sketch size: 180
  Compression ratio: 6527.7x
  Using model parameters for aggregation, sketches for filtering
Sketchguard Node 2:
  Model dim: 1,174,986 → Sketch size: 180
  Compression ratio: 6527.7x
  Using model parameters for aggregation, sketches for filtering
Sketchguard Node 3:
  Model dim: 1,174,986 → Sketch size: 180
  Compression ratio: 6527.7x
  Using model parameters for aggregation, sketches for filtering
Sketchguard Node 4:
  Model dim: 1,174,986 → Sketch size: 180
  Compression ratio: 6527.7x
  Using model parameters for aggregation, sketches for filtering
Sketchguard Node 5:
  Model dim: 1,174,986 → Sketch size: 180
  Compression ratio: 6527.7x
  Using model parameters for aggregation, sketches for filtering
Sketchguard Node 6:
  Model dim: 1,174,986 → Sketch size: 180
  Compression ratio: 6527.7x
  Using model parameters for aggregation, sketches for filtering
Sketchguard Node 7:
  Model dim: 1,174,986 → Sketch size: 180
  Compression ratio: 6527.7x
  Using model parameters for aggregation, sketches for filtering
Sketchguard Node 8:
  Model dim: 1,174,986 → Sketch size: 180
  Compression ratio: 6527.7x
  Using model parameters for aggregation, sketches for filtering
Sketchguard Node 9:
  Model dim: 1,174,986 → Sketch size: 180
  Compression ratio: 6527.7x
  Using model parameters for aggregation, sketches for filtering
Sketchguard Node 10:
  Model dim: 1,174,986 → Sketch size: 180
  Compression ratio: 6527.7x
  Using model parameters for aggregation, sketches for filtering
Sketchguard Node 11:
  Model dim: 1,174,986 → Sketch size: 180
  Compression ratio: 6527.7x
  Using model parameters for aggregation, sketches for filtering
Sketchguard Node 12:
  Model dim: 1,174,986 → Sketch size: 180
  Compression ratio: 6527.7x
  Using model parameters for aggregation, sketches for filtering
Sketchguard Node 13:
  Model dim: 1,174,986 → Sketch size: 180
  Compression ratio: 6527.7x
  Using model parameters for aggregation, sketches for filtering
Sketchguard Node 14:
  Model dim: 1,174,986 → Sketch size: 180
  Compression ratio: 6527.7x
  Using model parameters for aggregation, sketches for filtering
Sketchguard Node 15:
  Model dim: 1,174,986 → Sketch size: 180
  Compression ratio: 6527.7x
  Using model parameters for aggregation, sketches for filtering
Sketchguard Node 16:
  Model dim: 1,174,986 → Sketch size: 180
  Compression ratio: 6527.7x
  Using model parameters for aggregation, sketches for filtering
Sketchguard Node 17:
  Model dim: 1,174,986 → Sketch size: 180
  Compression ratio: 6527.7x
  Using model parameters for aggregation, sketches for filtering
Sketchguard Node 18:
  Model dim: 1,174,986 → Sketch size: 180
  Compression ratio: 6527.7x
  Using model parameters for aggregation, sketches for filtering
Sketchguard Node 19:
  Model dim: 1,174,986 → Sketch size: 180
  Compression ratio: 6527.7x
  Using model parameters for aggregation, sketches for filtering
Sketchguard ALGORITHM (Sketch-based Filtering + State Aggregation)
  - Model dimension: 1,174,986 parameters
  - Config: SketchguardConfig(gamma=2, kappa=1, alpha=0.5, min_neighbors=1, sketch_size=180, network_seed=987654321, attack_detection_window=5)
  - Sketch size: 180
  - Compression ratio: 6527.7x
  - Complexity: O(d + N×k) = O(1,174,986 + 20×180)
  - Theoretical speedup vs BALANCE: 19.9x
Initial test acc across nodes: mean=0.4953 ± 0.0174
Round 001: test acc mean=0.5053 ± 0.0072 | min=0.4958 max=0.5236
         : test loss mean=0.7160 ± 0.0203
         : individual accs = ['0.509486', '0.523639', '0.513038', '0.514595', '0.514187', '0.498435', '0.499791', '0.506976', '0.510564', '0.502192', '0.500000', '0.504545', '0.497422', '0.495962', '0.508031', '0.497951', '0.503996', '0.507119', '0.495755', '0.503160']
         : correct/total = [(7251, 14232), (7454, 14235), (7319, 14266), (7316, 14217), (7321, 14238), (7164, 14373), (7170, 14346), (7267, 14334), (7298, 14294), (7218, 14373), (7172, 14344), (7216, 14302), (7140, 14354), (7123, 14362), (7275, 14320), (7168, 14395), (7252, 14389), (7230, 14257), (7065, 14251), (7245, 14399)]
         : compromised: 0.5039, honest: 0.5063
         : sketchguard stats = ['Node 0: acc_rate=1.000', 'Node 1: acc_rate=1.000', 'Node 2: acc_rate=1.000']...
Round 002: test acc mean=0.5884 ± 0.0299 | min=0.5128 max=0.6201
         : test loss mean=0.6747 ± 0.0066
         : individual accs = ['0.611017', '0.617141', '0.590705', '0.615531', '0.602051', '0.593752', '0.593894', '0.610367', '0.597384', '0.542615', '0.604922', '0.597679', '0.598091', '0.591909', '0.512849', '0.604377', '0.578497', '0.566809', '0.518350', '0.620113']
         : correct/total = [(8696, 14232), (8785, 14235), (8427, 14266), (8751, 14217), (8572, 14238), (8534, 14373), (8520, 14346), (8749, 14334), (8539, 14294), (7799, 14373), (8677, 14344), (8548, 14302), (8585, 14354), (8501, 14362), (7344, 14320), (8700, 14395), (8324, 14389), (8081, 14257), (7387, 14251), (8929, 14399)]
         : compromised: 0.5746, honest: 0.5976
         : sketchguard stats = ['Node 0: acc_rate=0.789', 'Node 1: acc_rate=0.816', 'Node 2: acc_rate=0.789']...
Round 003: test acc mean=0.6172 ± 0.0100 | min=0.5950 max=0.6309
         : test loss mean=0.6597 ± 0.0045
         : individual accs = ['0.609472', '0.621777', '0.612435', '0.613491', '0.627406', '0.621095', '0.613830', '0.620901', '0.626836', '0.624087', '0.609593', '0.625297', '0.627630', '0.623172', '0.594972', '0.621466', '0.630899', '0.597671', '0.620167', '0.601083']
         : correct/total = [(8674, 14232), (8851, 14235), (8737, 14266), (8722, 14217), (8933, 14238), (8927, 14373), (8806, 14346), (8900, 14334), (8960, 14294), (8970, 14373), (8744, 14344), (8943, 14302), (9009, 14354), (8950, 14362), (8520, 14320), (8946, 14395), (9078, 14389), (8521, 14257), (8838, 14251), (8655, 14399)]
         : compromised: 0.6165, honest: 0.6176
         : sketchguard stats = ['Node 0: acc_rate=0.719', 'Node 1: acc_rate=0.754', 'Node 2: acc_rate=0.719']...
Round 004: test acc mean=0.6380 ± 0.0060 | min=0.6219 max=0.6450
         : test loss mean=0.6389 ± 0.0033
         : individual accs = ['0.638702', '0.637373', '0.624211', '0.642048', '0.641452', '0.637515', '0.643385', '0.644970', '0.637960', '0.633062', '0.633017', '0.637393', '0.643305', '0.635845', '0.639944', '0.641334', '0.643547', '0.637722', '0.621851', '0.644767']
         : correct/total = [(9090, 14232), (9073, 14235), (8905, 14266), (9128, 14217), (9133, 14238), (9163, 14373), (9230, 14346), (9245, 14334), (9119, 14294), (9099, 14373), (9080, 14344), (9116, 14302), (9234, 14354), (9132, 14362), (9164, 14320), (9232, 14395), (9260, 14389), (9092, 14257), (8862, 14251), (9284, 14399)]
         : compromised: 0.6364, honest: 0.6390
         : sketchguard stats = ['Node 0: acc_rate=0.684', 'Node 1: acc_rate=0.724', 'Node 2: acc_rate=0.684']...
Round 005: test acc mean=0.6472 ± 0.0064 | min=0.6351 max=0.6580
         : test loss mean=0.6268 ± 0.0048
         : individual accs = ['0.648187', '0.655989', '0.639563', '0.651333', '0.653392', '0.652195', '0.648543', '0.639319', '0.650203', '0.635080', '0.638664', '0.643826', '0.650063', '0.648726', '0.650559', '0.637444', '0.658003', '0.644946', '0.643885', '0.653240']
         : correct/total = [(9225, 14232), (9338, 14235), (9124, 14266), (9260, 14217), (9303, 14238), (9374, 14373), (9304, 14346), (9164, 14334), (9294, 14294), (9128, 14373), (9161, 14344), (9208, 14302), (9331, 14354), (9317, 14362), (9316, 14320), (9176, 14395), (9468, 14389), (9195, 14257), (9176, 14251), (9406, 14399)]
         : compromised: 0.6488, honest: 0.6461
         : sketchguard stats = ['Node 0: acc_rate=0.663', 'Node 1: acc_rate=0.705', 'Node 2: acc_rate=0.663']...
Round 006: test acc mean=0.6554 ± 0.0057 | min=0.6466 max=0.6650
         : test loss mean=0.6179 ± 0.0039
         : individual accs = ['0.655354', '0.664981', '0.646572', '0.660829', '0.649951', '0.660962', '0.661090', '0.661016', '0.658388', '0.656161', '0.647518', '0.648860', '0.651526', '0.655828', '0.655028', '0.657659', '0.661756', '0.647191', '0.648165', '0.660115']
         : correct/total = [(9327, 14232), (9466, 14235), (9224, 14266), (9395, 14217), (9254, 14238), (9500, 14373), (9484, 14346), (9475, 14334), (9411, 14294), (9431, 14373), (9288, 14344), (9280, 14302), (9352, 14354), (9419, 14362), (9380, 14320), (9467, 14395), (9522, 14389), (9227, 14257), (9237, 14251), (9505, 14399)]
         : compromised: 0.6541, honest: 0.6564
         : sketchguard stats = ['Node 0: acc_rate=0.649', 'Node 1: acc_rate=0.693', 'Node 2: acc_rate=0.649']...
Round 007: test acc mean=0.6623 ± 0.0050 | min=0.6530 max=0.6731
         : test loss mean=0.6107 ± 0.0042
         : individual accs = ['0.664488', '0.673059', '0.656386', '0.662306', '0.666667', '0.669311', '0.658581', '0.660597', '0.663355', '0.665832', '0.653026', '0.661656', '0.664971', '0.663278', '0.666061', '0.653143', '0.661895', '0.662902', '0.654831', '0.664491']
         : correct/total = [(9457, 14232), (9581, 14235), (9364, 14266), (9416, 14217), (9492, 14238), (9620, 14373), (9448, 14346), (9469, 14334), (9482, 14294), (9570, 14373), (9367, 14344), (9463, 14302), (9545, 14354), (9526, 14362), (9538, 14320), (9402, 14395), (9524, 14389), (9451, 14257), (9332, 14251), (9568, 14399)]
         : compromised: 0.6645, honest: 0.6609
         : sketchguard stats = ['Node 0: acc_rate=0.639', 'Node 1: acc_rate=0.684', 'Node 2: acc_rate=0.639']...
Round 008: test acc mean=0.6685 ± 0.0047 | min=0.6588 max=0.6762
         : test loss mean=0.6051 ± 0.0040
         : individual accs = ['0.667721', '0.669547', '0.658769', '0.672716', '0.667299', '0.676198', '0.671964', '0.660597', '0.672100', '0.671328', '0.664668', '0.663613', '0.669430', '0.669684', '0.666201', '0.667801', '0.675308', '0.674756', '0.662059', '0.667963']
         : correct/total = [(9503, 14232), (9531, 14235), (9398, 14266), (9564, 14217), (9501, 14238), (9719, 14373), (9640, 14346), (9469, 14334), (9607, 14294), (9649, 14373), (9534, 14344), (9491, 14302), (9609, 14354), (9618, 14362), (9540, 14320), (9613, 14395), (9717, 14389), (9620, 14257), (9435, 14251), (9618, 14399)]
         : compromised: 0.6689, honest: 0.6682
         : sketchguard stats = ['Node 0: acc_rate=0.632', 'Node 1: acc_rate=0.678', 'Node 2: acc_rate=0.632']...
Round 009: test acc mean=0.6690 ± 0.0084 | min=0.6438 max=0.6829
         : test loss mean=0.6034 ± 0.0079
         : individual accs = ['0.643831', '0.680365', '0.664447', '0.671590', '0.668703', '0.682947', '0.661299', '0.669527', '0.669302', '0.659918', '0.659021', '0.665921', '0.675421', '0.675393', '0.672416', '0.665856', '0.673084', '0.674055', '0.674900', '0.671644']
         : correct/total = [(9163, 14232), (9685, 14235), (9479, 14266), (9548, 14217), (9521, 14238), (9816, 14373), (9487, 14346), (9597, 14334), (9567, 14294), (9485, 14373), (9453, 14344), (9524, 14302), (9695, 14354), (9700, 14362), (9629, 14320), (9585, 14395), (9685, 14389), (9610, 14257), (9618, 14251), (9671, 14399)]
         : compromised: 0.6752, honest: 0.6649
         : sketchguard stats = ['Node 0: acc_rate=0.626', 'Node 1: acc_rate=0.673', 'Node 2: acc_rate=0.626']...
Round 010: test acc mean=0.6791 ± 0.0073 | min=0.6548 max=0.6873
         : test loss mean=0.5928 ± 0.0057
         : individual accs = ['0.676293', '0.687109', '0.654844', '0.680805', '0.684717', '0.686008', '0.683745', '0.679713', '0.686302', '0.677172', '0.679518', '0.679905', '0.687265', '0.680267', '0.674302', '0.671483', '0.683300', '0.683664', '0.672655', '0.673866']
         : correct/total = [(9625, 14232), (9781, 14235), (9342, 14266), (9679, 14217), (9749, 14238), (9860, 14373), (9809, 14346), (9743, 14334), (9810, 14294), (9733, 14373), (9747, 14344), (9724, 14302), (9865, 14354), (9770, 14362), (9656, 14320), (9666, 14395), (9832, 14389), (9747, 14257), (9586, 14251), (9703, 14399)]
         : compromised: 0.6814, honest: 0.6776
         : sketchguard stats = ['Node 0: acc_rate=0.621', 'Node 1: acc_rate=0.668', 'Node 2: acc_rate=0.621']...

=== FINAL RESULTS ===
Dataset: sent140, Nodes: 20, Graph: fully, Aggregation: sketchguard
Attack: krum, 40.0% compromised
Final accuracy - Compromised: 0.6814, Honest: 0.6776
Overall test accuracy: mean=0.6791 ± 0.0073

=== Sketchguard SUMMARY ===
Node 0: acceptance=0.621
Node 1: acceptance=0.668
Node 2: acceptance=0.621
Node 3: acceptance=0.621
Node 4: acceptance=0.621
Node 5: acceptance=0.668
Node 6: acceptance=0.621
Node 7: acceptance=0.621
Node 8: acceptance=0.621
Node 9: acceptance=0.621
Node 10: acceptance=0.621
Node 11: acceptance=0.668
Node 12: acceptance=0.668
Node 13: acceptance=0.668
Node 14: acceptance=0.668
Node 15: acceptance=0.621
Node 16: acceptance=0.621
Node 17: acceptance=0.668
Node 18: acceptance=0.668
Node 19: acceptance=0.621

=== PARALLEL EXECUTION TIME (realistic for distributed system) ===
  COMMUNICATION (max across nodes):
    - Sketch transfer: 0.000s (0.0%)
    - Model fetch (accepted): 0.000s (0.0%)
  COMPUTATION (max across nodes):
    - Sketching: 0.534s (95.0%)
    - Filtering: 0.002s (0.3%)
    - Aggregation: 0.026s (4.7%)
  TOTALS:
    - Total computation: 0.562s (100.0%)
    - Total communication: 0.000s (0.0%)
    - Total parallel time: 0.562s

=== PER-NODE AVERAGE TIME ===
  - Sketching: 0.473s
  - Filtering: 0.001s
  - Aggregation: 0.022s
  - Sketch transfer: 0.000s
  - Model fetch: 0.000s
  - Total per node: 0.496s

=== TOTAL COMPUTATIONAL WORK (sum across all nodes) ===
  - Total sketching: 9.469s
  - Total filtering: 0.017s
  - Total aggregation: 0.441s
  - Total sketch transfer: 0.000s
  - Total model fetch: 0.000s
  - Grand total: 9.927s
  - Mean acceptance rate: 0.640

Sketchguard Algorithm Properties:
  - Original dimension: 1,174,986
  - Sketch size: 180
  - Compression ratio: 19.9x
  - Single repetition: No repetitions needed
  - Theoretical complexity: O(d + N×k)
  - Approach: Sketch filtering + state aggregation
