Device: cuda
Seed: 987654321
Loading 1 LEAF Sent140 train files...
LEAF Sent140 train: 254555 users, 908652 samples
Building vocabulary (max_size=10000)...
Vocabulary size: 10000
Loading 1 LEAF Sent140 test files...
LEAF Sent140 test: 254555 users, 286281 samples
Found 254555 train users, 254555 test users, 254555 common users
User sample counts range: 494 (max) to 1 (min)
Distributed ALL 254555 users across 20 clients
Users per client: 12727 (with 15 clients getting +1 user)
Train partition sizes: [44353, 44290, 44657, 44907, 44696, 45843, 45801, 45619, 45069, 45639, 45821, 45311, 45779, 46056, 45625, 45984, 46428, 44737, 45540, 46497]
Test partition sizes: [14232, 14235, 14266, 14217, 14238, 14373, 14346, 14334, 14294, 14373, 14344, 14302, 14354, 14362, 14320, 14395, 14389, 14257, 14251, 14399]
  Client 0: 44353 train samples, 2 unique classes
  Client 1: 44290 train samples, 2 unique classes
  Client 2: 44657 train samples, 2 unique classes
  Client 3: 44907 train samples, 2 unique classes
  Client 4: 44696 train samples, 2 unique classes
  Client 5: 45843 train samples, 2 unique classes
  Client 6: 45801 train samples, 2 unique classes
  Client 7: 45619 train samples, 2 unique classes
  Client 8: 45069 train samples, 2 unique classes
  Client 9: 45639 train samples, 2 unique classes
  Client 10: 45821 train samples, 2 unique classes
  Client 11: 45311 train samples, 2 unique classes
  Client 12: 45779 train samples, 2 unique classes
  Client 13: 46056 train samples, 2 unique classes
  Client 14: 45625 train samples, 2 unique classes
  Client 15: 45984 train samples, 2 unique classes
  Client 16: 46428 train samples, 2 unique classes
  Client 17: 44737 train samples, 2 unique classes
  Client 18: 45540 train samples, 2 unique classes
  Client 19: 46497 train samples, 2 unique classes
Will sample 4500 samples per client per epoch
Graph: erdos, nodes: 20, edges: 126
Degree statistics: avg=12.60, min=8, max=16
Attack: Compromised 6/20 nodes: [5, 12, 13, 14, 17, 18]
Attack type: directed_deviation, lambda: 1.0
Model variant: baseline
Model parameters: 1,174,986
BALANCE algorithm:
Balance Config: BALANCEConfig(gamma=2, kappa=1, alpha=0.5, min_neighbors=1)
  - Model dimension: 1,174,986 parameters
  - Complexity: O(N×d) = O(20×1,174,986)
Initial test acc across nodes: mean=0.4953 ± 0.0174
Round 001: test acc mean=0.4962 ± 0.0088 | min=0.4827 max=0.5171
         : test loss mean=0.9868 ± 0.2700
         : individual accs = ['0.482715', '0.494064', '0.495163', '0.490821', '0.505970', '0.494330', '0.491844', '0.513046', '0.502868', '0.485563', '0.498815', '0.489722', '0.499791', '0.517129', '0.487011', '0.497812', '0.482938', '0.497159', '0.498491', '0.499062']
         : correct/total = [(6870, 14232), (7033, 14235), (7064, 14266), (6978, 14217), (7204, 14238), (7105, 14373), (7056, 14346), (7354, 14334), (7188, 14294), (6979, 14373), (7155, 14344), (7004, 14302), (7174, 14354), (7427, 14362), (6974, 14320), (7166, 14395), (6949, 14389), (7088, 14257), (7104, 14251), (7186, 14399)]
         : compromised: 0.4990, honest: 0.4950
Round 002: test acc mean=0.5383 ± 0.0324 | min=0.4851 max=0.5985
         : test loss mean=0.6899 ± 0.0031
         : individual accs = ['0.508010', '0.598525', '0.525235', '0.485053', '0.577960', '0.530022', '0.523212', '0.525394', '0.493564', '0.515341', '0.520706', '0.568452', '0.550160', '0.587174', '0.558170', '0.503856', '0.507471', '0.538402', '0.573363', '0.575248']
         : correct/total = [(7230, 14232), (8520, 14235), (7493, 14266), (6896, 14217), (8229, 14238), (7618, 14373), (7506, 14346), (7531, 14334), (7055, 14294), (7407, 14373), (7469, 14344), (8130, 14302), (7897, 14354), (8433, 14362), (7993, 14320), (7253, 14395), (7302, 14389), (7676, 14257), (8171, 14251), (8283, 14399)]
         : compromised: 0.5562, honest: 0.5306
Round 003: test acc mean=0.5551 ± 0.0367 | min=0.4957 max=0.6104
         : test loss mean=0.6873 ± 0.0021
         : individual accs = ['0.594224', '0.495680', '0.594911', '0.545614', '0.610409', '0.601892', '0.528231', '0.510255', '0.569610', '0.527795', '0.597044', '0.584953', '0.581928', '0.550689', '0.499511', '0.505314', '0.586698', '0.553132', '0.522419', '0.542052']
         : correct/total = [(8457, 14232), (7056, 14235), (8487, 14266), (7757, 14217), (8691, 14238), (8651, 14373), (7578, 14346), (7314, 14334), (8142, 14294), (7586, 14373), (8564, 14344), (8366, 14302), (8353, 14354), (7909, 14362), (7153, 14320), (7274, 14395), (8442, 14389), (7886, 14257), (7445, 14251), (7805, 14399)]
         : compromised: 0.5516, honest: 0.5566
Round 004: test acc mean=0.5897 ± 0.0393 | min=0.5085 max=0.6301
         : test loss mean=0.6832 ± 0.0026
         : individual accs = ['0.589727', '0.624166', '0.601079', '0.613983', '0.553659', '0.573297', '0.508504', '0.628227', '0.515181', '0.616225', '0.617680', '0.625157', '0.549115', '0.617463', '0.568366', '0.624036', '0.630065', '0.526408', '0.584871', '0.626849']
         : correct/total = [(8393, 14232), (8885, 14235), (8575, 14266), (8729, 14217), (7883, 14238), (8240, 14373), (7295, 14346), (9005, 14334), (7364, 14294), (8857, 14373), (8860, 14344), (8941, 14302), (7882, 14354), (8868, 14362), (8139, 14320), (8983, 14395), (9066, 14389), (7505, 14257), (8335, 14251), (9026, 14399)]
         : compromised: 0.5699, honest: 0.5982
Round 005: test acc mean=0.6243 ± 0.0168 | min=0.5674 max=0.6409
         : test loss mean=0.6713 ± 0.0036
         : individual accs = ['0.628443', '0.636670', '0.633534', '0.637687', '0.631830', '0.615112', '0.628328', '0.567392', '0.640898', '0.600292', '0.605549', '0.633408', '0.635363', '0.623033', '0.634358', '0.626259', '0.639238', '0.629585', '0.616027', '0.623793']
         : correct/total = [(8944, 14232), (9063, 14235), (9038, 14266), (9066, 14217), (8996, 14238), (8841, 14373), (9014, 14346), (8133, 14334), (9161, 14294), (8628, 14373), (8686, 14344), (9059, 14302), (9120, 14354), (8948, 14362), (9084, 14320), (9015, 14395), (9198, 14389), (8976, 14257), (8779, 14251), (8982, 14399)]
         : compromised: 0.6256, honest: 0.6238
Round 006: test acc mean=0.6413 ± 0.0082 | min=0.6260 max=0.6509
         : test loss mean=0.6479 ± 0.0041
         : individual accs = ['0.648468', '0.649104', '0.638721', '0.636632', '0.643770', '0.650177', '0.644570', '0.645668', '0.646565', '0.643220', '0.627510', '0.626066', '0.628745', '0.644478', '0.646858', '0.644321', '0.649454', '0.626008', '0.634412', '0.650948']
         : correct/total = [(9229, 14232), (9240, 14235), (9112, 14266), (9051, 14217), (9166, 14238), (9345, 14373), (9247, 14346), (9255, 14334), (9242, 14294), (9245, 14373), (9001, 14344), (8954, 14302), (9025, 14354), (9256, 14362), (9263, 14320), (9275, 14395), (9345, 14389), (8925, 14257), (9041, 14251), (9373, 14399)]
         : compromised: 0.6384, honest: 0.6425
Round 007: test acc mean=0.6483 ± 0.0088 | min=0.6215 max=0.6590
         : test loss mean=0.6325 ± 0.0051
         : individual accs = ['0.653879', '0.655567', '0.649586', '0.649082', '0.655078', '0.659013', '0.651331', '0.621529', '0.652861', '0.652195', '0.638316', '0.649280', '0.652222', '0.630344', '0.652374', '0.649253', '0.652165', '0.647822', '0.641850', '0.652476']
         : correct/total = [(9306, 14232), (9332, 14235), (9267, 14266), (9228, 14217), (9327, 14238), (9472, 14373), (9344, 14346), (8909, 14334), (9332, 14294), (9374, 14373), (9156, 14344), (9286, 14302), (9362, 14354), (9053, 14362), (9342, 14320), (9346, 14395), (9384, 14389), (9236, 14257), (9147, 14251), (9395, 14399)]
         : compromised: 0.6473, honest: 0.6488
Round 008: test acc mean=0.6549 ± 0.0086 | min=0.6260 max=0.6652
         : test loss mean=0.6232 ± 0.0051
         : individual accs = ['0.658727', '0.650509', '0.626034', '0.660547', '0.648968', '0.665206', '0.663739', '0.653900', '0.662376', '0.659500', '0.656721', '0.654454', '0.648391', '0.657986', '0.652095', '0.659535', '0.655779', '0.652592', '0.645148', '0.665185']
         : correct/total = [(9375, 14232), (9260, 14235), (8931, 14266), (9391, 14217), (9240, 14238), (9561, 14373), (9522, 14346), (9373, 14334), (9468, 14294), (9479, 14373), (9420, 14344), (9360, 14302), (9307, 14354), (9450, 14362), (9338, 14320), (9494, 14395), (9436, 14389), (9304, 14257), (9194, 14251), (9578, 14399)]
         : compromised: 0.6536, honest: 0.6554
Round 009: test acc mean=0.6573 ± 0.0106 | min=0.6189 max=0.6693
         : test loss mean=0.6184 ± 0.0067
         : individual accs = ['0.618887', '0.668353', '0.658278', '0.665893', '0.657396', '0.669311', '0.654677', '0.657388', '0.653141', '0.661379', '0.644241', '0.652216', '0.659050', '0.656106', '0.662500', '0.655505', '0.667871', '0.660167', '0.662761', '0.661643']
         : correct/total = [(8808, 14232), (9514, 14235), (9391, 14266), (9467, 14217), (9360, 14238), (9620, 14373), (9392, 14346), (9423, 14334), (9336, 14294), (9506, 14373), (9241, 14344), (9328, 14302), (9460, 14354), (9423, 14362), (9487, 14320), (9436, 14395), (9610, 14389), (9412, 14257), (9445, 14251), (9527, 14399)]
         : compromised: 0.6616, honest: 0.6555
Round 010: test acc mean=0.6694 ± 0.0068 | min=0.6500 max=0.6778
         : test loss mean=0.6075 ± 0.0057
         : individual accs = ['0.671655', '0.674113', '0.650007', '0.674756', '0.677834', '0.670354', '0.673010', '0.675108', '0.665034', '0.668267', '0.674568', '0.671514', '0.674098', '0.670937', '0.669064', '0.660577', '0.671346', '0.667672', '0.655042', '0.672130']
         : correct/total = [(9559, 14232), (9596, 14235), (9273, 14266), (9593, 14217), (9651, 14238), (9635, 14373), (9655, 14346), (9677, 14334), (9506, 14294), (9605, 14373), (9676, 14344), (9604, 14302), (9676, 14354), (9636, 14362), (9581, 14320), (9509, 14395), (9660, 14389), (9519, 14257), (9335, 14251), (9678, 14399)]
         : compromised: 0.6679, honest: 0.6700

=== FINAL RESULTS ===
Dataset: sent140, Nodes: 20, Graph: erdos, Aggregation: balance
Attack: directed_deviation, 30.0% compromised
Final accuracy - Compromised: 0.6679, Honest: 0.6700
Overall test accuracy: mean=0.6694 ± 0.0068

=== BALANCE SUMMARY ===
Node 0: acceptance=0.719
Node 1: acceptance=0.836
Node 2: acceptance=0.700
Node 3: acceptance=0.775
Node 4: acceptance=0.755
Node 5: acceptance=0.700
Node 6: acceptance=0.614
Node 7: acceptance=0.679
Node 8: acceptance=0.550
Node 9: acceptance=0.792
Node 10: acceptance=0.700
Node 11: acceptance=0.679
Node 12: acceptance=0.775
Node 13: acceptance=0.792
Node 14: acceptance=0.700
Node 15: acceptance=0.673
Node 16: acceptance=0.654
Node 17: acceptance=0.800
Node 18: acceptance=0.775
Node 19: acceptance=0.662

=== PARALLEL EXECUTION TIME (realistic for distributed system) ===
  COMMUNICATION (max across nodes):
    - Full model transfer: 0.000s (0.0%)
  COMPUTATION (max across nodes):
    - Filtering: 0.065s (80.2%)
    - Aggregation: 0.016s (19.7%)
  TOTALS:
    - Total computation: 0.081s (100.0%)
    - Total communication: 0.000s (0.0%)
    - Total parallel time: 0.081s

=== PER-NODE AVERAGE TIME ===
  - Filtering: 0.051s
  - Aggregation: 0.009s
  - Model transfer: 0.000s
  - Total per node: 0.060s

=== TOTAL COMPUTATIONAL WORK (sum across all nodes) ===
  - Total filtering: 1.017s
  - Total aggregation: 0.178s
  - Total model transfer: 0.000s
  - Grand total: 1.195s
  - Mean acceptance rate: 0.716

BALANCE Algorithm Properties:
  - Model dimension: 1,174,986
  - No compression: Full parameter comparison
  - Theoretical complexity: O(deg(i)×d)
  - Approach: Full parameter filtering + averaging
