Device: cuda
Seed: 987654321
Loading 1 LEAF Sent140 train files...
LEAF Sent140 train: 254555 users, 908652 samples
Building vocabulary (max_size=10000)...
Vocabulary size: 10000
Loading 1 LEAF Sent140 test files...
LEAF Sent140 test: 254555 users, 286281 samples
Found 254555 train users, 254555 test users, 254555 common users
User sample counts range: 494 (max) to 1 (min)
Distributed ALL 254555 users across 20 clients
Users per client: 12727 (with 15 clients getting +1 user)
Train partition sizes: [44353, 44290, 44657, 44907, 44696, 45843, 45801, 45619, 45069, 45639, 45821, 45311, 45779, 46056, 45625, 45984, 46428, 44737, 45540, 46497]
Test partition sizes: [14232, 14235, 14266, 14217, 14238, 14373, 14346, 14334, 14294, 14373, 14344, 14302, 14354, 14362, 14320, 14395, 14389, 14257, 14251, 14399]
  Client 0: 44353 train samples, 2 unique classes
  Client 1: 44290 train samples, 2 unique classes
  Client 2: 44657 train samples, 2 unique classes
  Client 3: 44907 train samples, 2 unique classes
  Client 4: 44696 train samples, 2 unique classes
  Client 5: 45843 train samples, 2 unique classes
  Client 6: 45801 train samples, 2 unique classes
  Client 7: 45619 train samples, 2 unique classes
  Client 8: 45069 train samples, 2 unique classes
  Client 9: 45639 train samples, 2 unique classes
  Client 10: 45821 train samples, 2 unique classes
  Client 11: 45311 train samples, 2 unique classes
  Client 12: 45779 train samples, 2 unique classes
  Client 13: 46056 train samples, 2 unique classes
  Client 14: 45625 train samples, 2 unique classes
  Client 15: 45984 train samples, 2 unique classes
  Client 16: 46428 train samples, 2 unique classes
  Client 17: 44737 train samples, 2 unique classes
  Client 18: 45540 train samples, 2 unique classes
  Client 19: 46497 train samples, 2 unique classes
Will sample 4500 samples per client per epoch
Graph: fully, nodes: 20, edges: 190
Degree statistics: avg=19.00, min=19, max=19
Attack: Compromised 2/20 nodes: [5, 13]
Attack type: backdoor, lambda: 1.0
Backdoor target label: 1, trigger size: 3
Model variant: baseline
Model parameters: 1,174,986
Initial test acc across nodes: mean=0.4953 ± 0.0174
Backdoor attack: Created poisoned datasets for 2 compromised nodes
Round 001: test acc mean=0.5026 ± 0.0108 | min=0.4843 max=0.5196
         : test loss mean=0.7215 ± 0.0304
         : individual accs = ['0.501686', '0.517035', '0.486401', '0.484912', '0.506672', '0.517498', '0.508434', '0.507255', '0.492235', '0.516941', '0.507390', '0.500489', '0.502856', '0.489347', '0.507053', '0.519625', '0.507401', '0.493302', '0.500596', '0.484339']
         : correct/total = [(7140, 14232), (7360, 14235), (6939, 14266), (6894, 14217), (7214, 14238), (7438, 14373), (7294, 14346), (7271, 14334), (7036, 14294), (7430, 14373), (7278, 14344), (7158, 14302), (7218, 14354), (7028, 14362), (7261, 14320), (7480, 14395), (7301, 14389), (7033, 14257), (7134, 14251), (6974, 14399)]
         : compromised: 0.5034, honest: 0.5025
Round 002: test acc mean=0.4919 ± 0.0062 | min=0.4796 max=0.5074
         : test loss mean=0.7120 ± 0.0023
         : individual accs = ['0.488125', '0.479593', '0.489556', '0.487445', '0.490237', '0.490364', '0.507389', '0.492047', '0.493424', '0.489112', '0.496863', '0.497972', '0.498885', '0.500905', '0.483310', '0.485794', '0.488290', '0.495546', '0.490422', '0.493020']
         : correct/total = [(6947, 14232), (6827, 14235), (6984, 14266), (6930, 14217), (6980, 14238), (7048, 14373), (7279, 14346), (7053, 14334), (7053, 14294), (7030, 14373), (7127, 14344), (7122, 14302), (7161, 14354), (7194, 14362), (6921, 14320), (6993, 14395), (7026, 14389), (7065, 14257), (6989, 14251), (7099, 14399)]
         : compromised: 0.4956, honest: 0.4915
Round 003: test acc mean=0.5263 ± 0.0054 | min=0.5169 max=0.5361
         : test loss mean=0.6917 ± 0.0004
         : individual accs = ['0.530565', '0.523920', '0.517314', '0.532531', '0.520789', '0.532039', '0.527046', '0.526999', '0.520428', '0.528421', '0.525237', '0.529646', '0.536088', '0.516920', '0.527793', '0.517819', '0.526791', '0.525146', '0.525296', '0.534412']
         : correct/total = [(7551, 14232), (7458, 14235), (7380, 14266), (7571, 14217), (7415, 14238), (7647, 14373), (7561, 14346), (7554, 14334), (7439, 14294), (7595, 14373), (7534, 14344), (7575, 14302), (7695, 14354), (7424, 14362), (7558, 14320), (7454, 14395), (7580, 14389), (7487, 14257), (7486, 14251), (7695, 14399)]
         : compromised: 0.5245, honest: 0.5265
Round 004: test acc mean=0.4776 ± 0.0050 | min=0.4663 max=0.4876
         : test loss mean=0.7631 ± 0.0031
         : individual accs = ['0.478288', '0.467018', '0.472102', '0.466343', '0.476120', '0.479301', '0.481110', '0.476420', '0.477263', '0.481180', '0.479155', '0.476087', '0.483977', '0.487606', '0.473743', '0.482807', '0.481409', '0.478291', '0.475756', '0.478228']
         : correct/total = [(6807, 14232), (6648, 14235), (6735, 14266), (6630, 14217), (6779, 14238), (6889, 14373), (6902, 14346), (6829, 14334), (6822, 14294), (6916, 14373), (6873, 14344), (6809, 14302), (6947, 14354), (7003, 14362), (6784, 14320), (6950, 14395), (6927, 14389), (6819, 14257), (6780, 14251), (6886, 14399)]
         : compromised: 0.4835, honest: 0.4770
Round 005: test acc mean=0.5005 ± 0.0054 | min=0.4897 max=0.5123
         : test loss mean=0.6968 ± 0.0009
         : individual accs = ['0.504005', '0.512259', '0.507851', '0.510938', '0.500773', '0.498017', '0.494354', '0.501744', '0.497481', '0.501078', '0.498397', '0.500070', '0.494636', '0.489695', '0.505726', '0.498229', '0.502120', '0.499193', '0.497018', '0.496146']
         : correct/total = [(7173, 14232), (7292, 14235), (7245, 14266), (7264, 14217), (7130, 14238), (7158, 14373), (7092, 14346), (7192, 14334), (7111, 14294), (7202, 14373), (7149, 14344), (7152, 14302), (7100, 14354), (7033, 14362), (7242, 14320), (7172, 14395), (7225, 14389), (7117, 14257), (7083, 14251), (7144, 14399)]
         : compromised: 0.4939, honest: 0.5012
Round 006: test acc mean=0.5068 ± 0.0052 | min=0.4939 max=0.5177
         : test loss mean=0.7066 ± 0.0013
         : individual accs = ['0.508010', '0.517738', '0.515772', '0.513610', '0.507937', '0.505183', '0.503137', '0.507744', '0.502519', '0.508732', '0.502789', '0.509929', '0.500697', '0.493942', '0.504749', '0.505175', '0.509347', '0.506979', '0.507263', '0.505521']
         : correct/total = [(7230, 14232), (7370, 14235), (7358, 14266), (7302, 14217), (7232, 14238), (7261, 14373), (7218, 14346), (7278, 14334), (7183, 14294), (7312, 14373), (7212, 14344), (7293, 14302), (7187, 14354), (7094, 14362), (7228, 14320), (7272, 14395), (7329, 14389), (7228, 14257), (7229, 14251), (7279, 14399)]
         : compromised: 0.4996, honest: 0.5076
Round 007: test acc mean=0.5049 ± 0.0055 | min=0.4928 max=0.5172
         : test loss mean=0.8411 ± 0.0064
         : individual accs = ['0.507237', '0.517176', '0.512828', '0.514947', '0.505338', '0.503861', '0.499651', '0.506488', '0.501609', '0.504766', '0.501325', '0.505314', '0.496795', '0.492828', '0.507053', '0.502188', '0.507262', '0.504454', '0.504175', '0.501771']
         : correct/total = [(7219, 14232), (7362, 14235), (7316, 14266), (7321, 14217), (7195, 14238), (7242, 14373), (7168, 14346), (7260, 14334), (7170, 14294), (7255, 14373), (7191, 14344), (7227, 14302), (7131, 14354), (7078, 14362), (7261, 14320), (7229, 14395), (7299, 14389), (7192, 14257), (7185, 14251), (7225, 14399)]
         : compromised: 0.4983, honest: 0.5056
Round 008: test acc mean=0.4949 ± 0.0055 | min=0.4830 max=0.5068
         : test loss mean=1.2910 ± 0.0137
         : individual accs = ['0.492693', '0.483035', '0.486962', '0.484912', '0.494662', '0.495930', '0.499791', '0.492745', '0.498251', '0.495165', '0.498466', '0.493847', '0.502996', '0.506824', '0.492668', '0.497812', '0.492529', '0.495406', '0.495544', '0.498160']
         : correct/total = [(7012, 14232), (6876, 14235), (6947, 14266), (6894, 14217), (7043, 14238), (7128, 14373), (7170, 14346), (7063, 14334), (7122, 14294), (7117, 14373), (7150, 14344), (7063, 14302), (7220, 14354), (7279, 14362), (7055, 14320), (7166, 14395), (7087, 14389), (7063, 14257), (7062, 14251), (7173, 14399)]
         : compromised: 0.5014, honest: 0.4942
Round 009: test acc mean=0.4948 ± 0.0054 | min=0.4830 max=0.5066
         : test loss mean=0.9050 ± 0.0062
         : individual accs = ['0.492482', '0.483035', '0.486962', '0.484842', '0.494662', '0.495860', '0.499512', '0.492675', '0.498181', '0.495304', '0.498466', '0.493777', '0.502856', '0.506615', '0.492528', '0.497742', '0.492599', '0.495195', '0.495474', '0.497951']
         : correct/total = [(7009, 14232), (6876, 14235), (6947, 14266), (6893, 14217), (7043, 14238), (7127, 14373), (7166, 14346), (7062, 14334), (7121, 14294), (7119, 14373), (7150, 14344), (7062, 14302), (7218, 14354), (7276, 14362), (7053, 14320), (7165, 14395), (7088, 14389), (7060, 14257), (7061, 14251), (7170, 14399)]
         : compromised: 0.5012, honest: 0.4941
Round 010: test acc mean=0.6125 ± 0.0040 | min=0.6037 max=0.6185
         : test loss mean=0.6615 ± 0.0020
         : individual accs = ['0.610104', '0.618405', '0.606898', '0.615038', '0.610339', '0.614277', '0.613272', '0.614692', '0.613684', '0.617268', '0.609663', '0.610404', '0.615020', '0.603676', '0.610335', '0.605696', '0.618528', '0.614505', '0.611466', '0.615807']
         : correct/total = [(8683, 14232), (8803, 14235), (8658, 14266), (8744, 14217), (8690, 14238), (8829, 14373), (8798, 14346), (8811, 14334), (8772, 14294), (8872, 14373), (8745, 14344), (8730, 14302), (8828, 14354), (8670, 14362), (8740, 14320), (8719, 14395), (8900, 14389), (8761, 14257), (8714, 14251), (8867, 14399)]
         : compromised: 0.6090, honest: 0.6128

=== FINAL RESULTS ===
Dataset: sent140, Nodes: 20, Graph: fully, Aggregation: d-fedavg
Attack: backdoor, 10.0% compromised
Final accuracy - Compromised: 0.6090, Honest: 0.6128
Overall test accuracy: mean=0.6125 ± 0.0040

=== BACKDOOR ATTACK SUCCESS RATE (ASR) ===
Target label: 1
Trigger size: 3x3
Overall ASR: 0.8599 ± 0.0035
Honest nodes ASR: 0.8602 ± 0.0035
Compromised nodes ASR: 0.8564 ± 0.0013
Note: Higher ASR indicates more successful backdoor attack
