Device: cuda
Seed: 987654321
Loading 1 LEAF Sent140 train files...
LEAF Sent140 train: 254555 users, 908652 samples
Building vocabulary (max_size=10000)...
Vocabulary size: 10000
Loading 1 LEAF Sent140 test files...
LEAF Sent140 test: 254555 users, 286281 samples
Found 254555 train users, 254555 test users, 254555 common users
User sample counts range: 494 (max) to 1 (min)
Distributed ALL 254555 users across 20 clients
Users per client: 12727 (with 15 clients getting +1 user)
Train partition sizes: [44353, 44290, 44657, 44907, 44696, 45843, 45801, 45619, 45069, 45639, 45821, 45311, 45779, 46056, 45625, 45984, 46428, 44737, 45540, 46497]
Test partition sizes: [14232, 14235, 14266, 14217, 14238, 14373, 14346, 14334, 14294, 14373, 14344, 14302, 14354, 14362, 14320, 14395, 14389, 14257, 14251, 14399]
  Client 0: 44353 train samples, 2 unique classes
  Client 1: 44290 train samples, 2 unique classes
  Client 2: 44657 train samples, 2 unique classes
  Client 3: 44907 train samples, 2 unique classes
  Client 4: 44696 train samples, 2 unique classes
  Client 5: 45843 train samples, 2 unique classes
  Client 6: 45801 train samples, 2 unique classes
  Client 7: 45619 train samples, 2 unique classes
  Client 8: 45069 train samples, 2 unique classes
  Client 9: 45639 train samples, 2 unique classes
  Client 10: 45821 train samples, 2 unique classes
  Client 11: 45311 train samples, 2 unique classes
  Client 12: 45779 train samples, 2 unique classes
  Client 13: 46056 train samples, 2 unique classes
  Client 14: 45625 train samples, 2 unique classes
  Client 15: 45984 train samples, 2 unique classes
  Client 16: 46428 train samples, 2 unique classes
  Client 17: 44737 train samples, 2 unique classes
  Client 18: 45540 train samples, 2 unique classes
  Client 19: 46497 train samples, 2 unique classes
Will sample 4500 samples per client per epoch
Graph: erdos, nodes: 20, edges: 48
Degree statistics: avg=4.80, min=2, max=7
Attack: Compromised 4/20 nodes: [5, 12, 13, 17]
Attack type: backdoor, lambda: 1.0
Backdoor target label: 1, trigger size: 3
Model variant: baseline
Model parameters: 1,174,986
Initial test acc across nodes: mean=0.4953 ± 0.0174
Backdoor attack: Created poisoned datasets for 4 compromised nodes
Round 001: test acc mean=0.5476 ± 0.0630 | min=0.4928 max=0.6475
         : test loss mean=16.8678 ± 15.8547
         : individual accs = ['0.612493', '0.647489', '0.624912', '0.514244', '0.496910', '0.495721', '0.495469', '0.501116', '0.630125', '0.641272', '0.507738', '0.505034', '0.499234', '0.492828', '0.493994', '0.520181', '0.499826', '0.502209', '0.641429', '0.630738']
         : correct/total = [(8717, 14232), (9217, 14235), (8915, 14266), (7311, 14217), (7075, 14238), (7125, 14373), (7108, 14346), (7183, 14334), (9007, 14294), (9217, 14373), (7283, 14344), (7223, 14302), (7166, 14354), (7078, 14362), (7074, 14320), (7488, 14395), (7192, 14389), (7160, 14257), (9141, 14251), (9082, 14399)]
         : compromised: 0.4975, honest: 0.5602
Round 002: test acc mean=0.6171 ± 0.0665 | min=0.4935 max=0.6674
         : test loss mean=3.9637 ± 8.0452
         : individual accs = ['0.648890', '0.667369', '0.639633', '0.662798', '0.651496', '0.494817', '0.646801', '0.506000', '0.658458', '0.659570', '0.661949', '0.648930', '0.657796', '0.493525', '0.515782', '0.645849', '0.655779', '0.503542', '0.657919', '0.665532']
         : correct/total = [(9235, 14232), (9500, 14235), (9125, 14266), (9423, 14217), (9276, 14238), (7112, 14373), (9279, 14346), (7253, 14334), (9412, 14294), (9480, 14373), (9495, 14344), (9281, 14302), (9442, 14354), (7088, 14362), (7386, 14320), (9297, 14395), (9436, 14389), (7179, 14257), (9376, 14251), (9583, 14399)]
         : compromised: 0.5374, honest: 0.6370
Round 003: test acc mean=0.6425 ± 0.0524 | min=0.4891 max=0.6752
         : test loss mean=1.4524 ± 2.6610
         : individual accs = ['0.675169', '0.629013', '0.655475', '0.672997', '0.670038', '0.489112', '0.662833', '0.634645', '0.673709', '0.663536', '0.664459', '0.662355', '0.634039', '0.642529', '0.492598', '0.675096', '0.671277', '0.647401', '0.668304', '0.664699']
         : correct/total = [(9609, 14232), (8954, 14235), (9351, 14266), (9568, 14217), (9540, 14238), (7030, 14373), (9509, 14346), (9097, 14334), (9630, 14294), (9537, 14373), (9531, 14344), (9473, 14302), (9101, 14354), (9228, 14362), (7054, 14320), (9718, 14395), (9659, 14389), (9230, 14257), (9524, 14251), (9571, 14399)]
         : compromised: 0.6033, honest: 0.6523
Round 004: test acc mean=0.6536 ± 0.0621 | min=0.5039 max=0.6899
         : test loss mean=2.8419 ± 5.3593
         : individual accs = ['0.679455', '0.678469', '0.678957', '0.674263', '0.674884', '0.503931', '0.682769', '0.508860', '0.684693', '0.662492', '0.689905', '0.688925', '0.673331', '0.685350', '0.507263', '0.667385', '0.672041', '0.683664', '0.685215', '0.689770']
         : correct/total = [(9670, 14232), (9658, 14235), (9686, 14266), (9586, 14217), (9609, 14238), (7243, 14373), (9795, 14346), (7294, 14334), (9787, 14294), (9522, 14373), (9896, 14344), (9853, 14302), (9665, 14354), (9843, 14362), (7264, 14320), (9607, 14395), (9670, 14389), (9747, 14257), (9765, 14251), (9932, 14399)]
         : compromised: 0.6366, honest: 0.6578
Round 005: test acc mean=0.6644 ± 0.0589 | min=0.4927 max=0.6993
         : test loss mean=1.5170 ± 3.3325
         : individual accs = ['0.695897', '0.698490', '0.689121', '0.685799', '0.691600', '0.498713', '0.693922', '0.644063', '0.691339', '0.689139', '0.694576', '0.687386', '0.645883', '0.694054', '0.492668', '0.638555', '0.687539', '0.685768', '0.683461', '0.699285']
         : correct/total = [(9904, 14232), (9943, 14235), (9831, 14266), (9750, 14217), (9847, 14238), (7168, 14373), (9955, 14346), (9232, 14334), (9882, 14294), (9905, 14373), (9963, 14344), (9831, 14302), (9271, 14354), (9968, 14362), (7055, 14320), (9192, 14395), (9893, 14389), (9777, 14257), (9740, 14251), (10069, 14399)]
         : compromised: 0.6311, honest: 0.6727
Round 006: test acc mean=0.6782 ± 0.0601 | min=0.4957 max=0.7088
         : test loss mean=1.0704 ± 1.5394
         : individual accs = ['0.701588', '0.707341', '0.693327', '0.701695', '0.689844', '0.495652', '0.698313', '0.683201', '0.700714', '0.699297', '0.692973', '0.703678', '0.708792', '0.691756', '0.503142', '0.705662', '0.700327', '0.700428', '0.680233', '0.705466']
         : correct/total = [(9985, 14232), (10069, 14235), (9891, 14266), (9976, 14217), (9822, 14238), (7124, 14373), (10018, 14346), (9793, 14334), (10016, 14294), (10051, 14373), (9940, 14344), (10064, 14302), (10174, 14354), (9935, 14362), (7205, 14320), (10158, 14395), (10077, 14389), (9986, 14257), (9694, 14251), (10158, 14399)]
         : compromised: 0.6492, honest: 0.6854
Round 007: test acc mean=0.6786 ± 0.0617 | min=0.4998 max=0.7135
         : test loss mean=1.4088 ± 2.5514
         : individual accs = ['0.700042', '0.705655', '0.700266', '0.707463', '0.701643', '0.499826', '0.704726', '0.654388', '0.706870', '0.701872', '0.652189', '0.712907', '0.707190', '0.713480', '0.501397', '0.706356', '0.711377', '0.712983', '0.693144', '0.678936']
         : correct/total = [(9963, 14232), (10045, 14235), (9990, 14266), (10058, 14217), (9990, 14238), (7184, 14373), (10110, 14346), (9380, 14334), (10104, 14294), (10088, 14373), (9355, 14344), (10196, 14302), (10151, 14354), (10247, 14362), (7180, 14320), (10168, 14395), (10236, 14389), (10165, 14257), (9878, 14251), (9776, 14399)]
         : compromised: 0.6584, honest: 0.6837
Round 008: test acc mean=0.6888 ± 0.0621 | min=0.5039 max=0.7224
         : test loss mean=2.8842 ± 6.9864
         : individual accs = ['0.708123', '0.720969', '0.702019', '0.722445', '0.699536', '0.503931', '0.717970', '0.704479', '0.707710', '0.712099', '0.704336', '0.722207', '0.718685', '0.717658', '0.505866', '0.710247', '0.705678', '0.716560', '0.682268', '0.694145']
         : correct/total = [(10078, 14232), (10263, 14235), (10015, 14266), (10271, 14217), (9960, 14238), (7243, 14373), (10300, 14346), (10098, 14334), (10116, 14294), (10235, 14373), (10103, 14344), (10329, 14302), (10316, 14354), (10307, 14362), (7244, 14320), (10224, 14395), (10154, 14389), (10216, 14257), (9723, 14251), (9995, 14399)]
         : compromised: 0.6642, honest: 0.6950
Round 009: test acc mean=0.6881 ± 0.0659 | min=0.4911 max=0.7275
         : test loss mean=1.1363 ± 1.7372
         : individual accs = ['0.719365', '0.700105', '0.714776', '0.720898', '0.727490', '0.491129', '0.701659', '0.702386', '0.695607', '0.716343', '0.702036', '0.725563', '0.701477', '0.720234', '0.494274', '0.701494', '0.692682', '0.706951', '0.711038', '0.717480']
         : correct/total = [(10238, 14232), (9966, 14235), (10197, 14266), (10249, 14217), (10358, 14238), (7059, 14373), (10066, 14346), (10068, 14334), (9943, 14294), (10296, 14373), (10070, 14344), (10377, 14302), (10069, 14354), (10344, 14362), (7078, 14320), (10098, 14395), (9967, 14389), (10079, 14257), (10133, 14251), (10331, 14399)]
         : compromised: 0.6549, honest: 0.6964
Round 010: test acc mean=0.6930 ± 0.0652 | min=0.4980 max=0.7275
         : test loss mean=1.2233 ± 2.0314
         : individual accs = ['0.727515', '0.714436', '0.672508', '0.716396', '0.725313', '0.502679', '0.713439', '0.721850', '0.720162', '0.713351', '0.719465', '0.715914', '0.714087', '0.714037', '0.498045', '0.714415', '0.699284', '0.724837', '0.717213', '0.714772']
         : correct/total = [(10354, 14232), (10170, 14235), (9594, 14266), (10185, 14217), (10327, 14238), (7225, 14373), (10235, 14346), (10347, 14334), (10294, 14294), (10253, 14373), (10320, 14344), (10239, 14302), (10250, 14354), (10255, 14362), (7132, 14320), (10284, 14395), (10062, 14389), (10334, 14257), (10221, 14251), (10292, 14399)]
         : compromised: 0.6639, honest: 0.7003

=== FINAL RESULTS ===
Dataset: sent140, Nodes: 20, Graph: erdos, Aggregation: krum
Attack: backdoor, 20.0% compromised
Final accuracy - Compromised: 0.6639, Honest: 0.7003
Overall test accuracy: mean=0.6930 ± 0.0652

=== BACKDOOR ATTACK SUCCESS RATE (ASR) ===
Target label: 1
Trigger size: 3x3
Overall ASR: 0.4754 ± 0.1102
Honest nodes ASR: 0.4844 ± 0.1027
Compromised nodes ASR: 0.4394 ± 0.1298
Note: Higher ASR indicates more successful backdoor attack
