Device: cuda
Seed: 987654321
Loading 1 LEAF Sent140 train files...
LEAF Sent140 train: 254555 users, 908652 samples
Building vocabulary (max_size=10000)...
Vocabulary size: 10000
Loading 1 LEAF Sent140 test files...
LEAF Sent140 test: 254555 users, 286281 samples
Found 254555 train users, 254555 test users, 254555 common users
User sample counts range: 494 (max) to 1 (min)
Distributed ALL 254555 users across 20 clients
Users per client: 12727 (with 15 clients getting +1 user)
Train partition sizes: [44353, 44290, 44657, 44907, 44696, 45843, 45801, 45619, 45069, 45639, 45821, 45311, 45779, 46056, 45625, 45984, 46428, 44737, 45540, 46497]
Test partition sizes: [14232, 14235, 14266, 14217, 14238, 14373, 14346, 14334, 14294, 14373, 14344, 14302, 14354, 14362, 14320, 14395, 14389, 14257, 14251, 14399]
  Client 0: 44353 train samples, 2 unique classes
  Client 1: 44290 train samples, 2 unique classes
  Client 2: 44657 train samples, 2 unique classes
  Client 3: 44907 train samples, 2 unique classes
  Client 4: 44696 train samples, 2 unique classes
  Client 5: 45843 train samples, 2 unique classes
  Client 6: 45801 train samples, 2 unique classes
  Client 7: 45619 train samples, 2 unique classes
  Client 8: 45069 train samples, 2 unique classes
  Client 9: 45639 train samples, 2 unique classes
  Client 10: 45821 train samples, 2 unique classes
  Client 11: 45311 train samples, 2 unique classes
  Client 12: 45779 train samples, 2 unique classes
  Client 13: 46056 train samples, 2 unique classes
  Client 14: 45625 train samples, 2 unique classes
  Client 15: 45984 train samples, 2 unique classes
  Client 16: 46428 train samples, 2 unique classes
  Client 17: 44737 train samples, 2 unique classes
  Client 18: 45540 train samples, 2 unique classes
  Client 19: 46497 train samples, 2 unique classes
Will sample 4500 samples per client per epoch
Graph: erdos, nodes: 20, edges: 126
Degree statistics: avg=12.60, min=8, max=16
Attack: Compromised 12/20 nodes: [1, 2, 3, 5, 8, 11, 12, 13, 14, 15, 17, 18]
Attack type: directed_deviation, lambda: 1.0
Model variant: baseline
Model parameters: 1,174,986
BALANCE algorithm:
Balance Config: BALANCEConfig(gamma=2, kappa=1, alpha=0.5, min_neighbors=1)
  - Model dimension: 1,174,986 parameters
  - Complexity: O(N×d) = O(20×1,174,986)
Initial test acc across nodes: mean=0.4953 ± 0.0174
Round 001: test acc mean=0.4968 ± 0.0089 | min=0.4833 max=0.5156
         : test loss mean=2.0179 ± 0.9940
         : individual accs = ['0.486650', '0.499403', '0.489556', '0.496659', '0.500632', '0.506157', '0.484804', '0.501326', '0.505107', '0.483337', '0.491634', '0.503286', '0.515605', '0.490809', '0.496578', '0.496700', '0.510668', '0.489023', '0.485019', '0.503229']
         : correct/total = [(6926, 14232), (7109, 14235), (6984, 14266), (7061, 14217), (7128, 14238), (7275, 14373), (6955, 14346), (7186, 14334), (7220, 14294), (6947, 14373), (7052, 14344), (7198, 14302), (7401, 14354), (7049, 14362), (7111, 14320), (7150, 14395), (7348, 14389), (6972, 14257), (6912, 14251), (7246, 14399)]
         : compromised: 0.4978, honest: 0.4953
Round 002: test acc mean=0.5097 ± 0.0106 | min=0.4932 max=0.5426
         : test loss mean=0.7137 ± 0.0412
         : individual accs = ['0.520306', '0.517597', '0.510304', '0.510375', '0.512010', '0.542615', '0.504879', '0.510604', '0.501819', '0.503792', '0.501603', '0.514474', '0.493173', '0.525832', '0.508869', '0.505731', '0.503927', '0.499684', '0.504386', '0.501910']
         : correct/total = [(7405, 14232), (7368, 14235), (7280, 14266), (7256, 14217), (7290, 14238), (7799, 14373), (7243, 14346), (7319, 14334), (7173, 14294), (7241, 14373), (7195, 14344), (7358, 14302), (7079, 14354), (7552, 14362), (7287, 14320), (7280, 14395), (7251, 14389), (7124, 14257), (7188, 14251), (7227, 14399)]
         : compromised: 0.5112, honest: 0.5074
Round 003: test acc mean=0.5150 ± 0.0191 | min=0.4784 max=0.5535
         : test loss mean=0.6966 ± 0.0074
         : individual accs = ['0.511453', '0.537267', '0.512898', '0.553492', '0.544880', '0.497530', '0.509968', '0.525394', '0.501889', '0.526821', '0.510666', '0.506293', '0.496865', '0.538922', '0.507472', '0.478361', '0.536938', '0.509995', '0.491194', '0.502049']
         : correct/total = [(7279, 14232), (7648, 14235), (7317, 14266), (7869, 14217), (7758, 14238), (7151, 14373), (7316, 14346), (7531, 14334), (7174, 14294), (7572, 14373), (7325, 14344), (7241, 14302), (7132, 14354), (7740, 14362), (7267, 14320), (6886, 14395), (7726, 14389), (7271, 14257), (7000, 14251), (7229, 14399)]
         : compromised: 0.5110, honest: 0.5210
Round 004: test acc mean=0.5646 ± 0.0233 | min=0.5169 max=0.6028
         : test loss mean=0.6825 ± 0.0051
         : individual accs = ['0.539699', '0.585248', '0.561545', '0.583949', '0.575362', '0.546163', '0.540220', '0.588321', '0.538478', '0.580394', '0.558631', '0.569850', '0.516929', '0.583066', '0.580307', '0.527961', '0.544930', '0.579926', '0.587538', '0.602820']
         : correct/total = [(7681, 14232), (8331, 14235), (8011, 14266), (8302, 14217), (8192, 14238), (7850, 14373), (7750, 14346), (8433, 14334), (7697, 14294), (8342, 14373), (8013, 14344), (8150, 14302), (7420, 14354), (8374, 14362), (8310, 14320), (7600, 14395), (7841, 14389), (8268, 14257), (8373, 14251), (8680, 14399)]
         : compromised: 0.5634, honest: 0.5663
Round 005: test acc mean=0.6086 ± 0.0212 | min=0.5481 max=0.6294
         : test loss mean=0.6632 ± 0.0065
         : individual accs = ['0.625562', '0.622761', '0.609491', '0.595344', '0.617573', '0.617686', '0.616897', '0.622436', '0.617322', '0.614764', '0.577803', '0.606209', '0.548140', '0.617950', '0.619483', '0.561514', '0.629439', '0.615277', '0.611606', '0.624349']
         : correct/total = [(8903, 14232), (8865, 14235), (8695, 14266), (8464, 14217), (8793, 14238), (8878, 14373), (8850, 14346), (8922, 14334), (8824, 14294), (8836, 14373), (8288, 14344), (8670, 14302), (7868, 14354), (8875, 14362), (8871, 14320), (8083, 14395), (9057, 14389), (8772, 14257), (8716, 14251), (8990, 14399)]
         : compromised: 0.6036, honest: 0.6161
Round 006: test acc mean=0.6359 ± 0.0048 | min=0.6246 max=0.6439
         : test loss mean=0.6400 ± 0.0034
         : individual accs = ['0.641020', '0.639410', '0.624632', '0.630302', '0.643630', '0.640089', '0.637042', '0.628436', '0.637051', '0.636958', '0.632041', '0.633688', '0.636269', '0.637794', '0.633380', '0.636818', '0.643895', '0.637862', '0.631394', '0.636016']
         : correct/total = [(9123, 14232), (9102, 14235), (8911, 14266), (8961, 14217), (9164, 14238), (9200, 14373), (9139, 14346), (9008, 14334), (9106, 14294), (9155, 14373), (9066, 14344), (9063, 14302), (9133, 14354), (9160, 14362), (9070, 14320), (9167, 14395), (9265, 14389), (9094, 14257), (8998, 14251), (9158, 14399)]
         : compromised: 0.6349, honest: 0.6374
Round 007: test acc mean=0.6472 ± 0.0055 | min=0.6340 max=0.6555
         : test loss mean=0.6281 ± 0.0049
         : individual accs = ['0.649874', '0.651985', '0.634025', '0.636562', '0.649319', '0.655535', '0.652168', '0.648319', '0.647754', '0.648160', '0.640547', '0.642078', '0.650759', '0.650327', '0.646159', '0.640917', '0.649107', '0.651049', '0.645920', '0.653448']
         : correct/total = [(9249, 14232), (9281, 14235), (9045, 14266), (9050, 14217), (9245, 14238), (9422, 14373), (9356, 14346), (9293, 14334), (9259, 14294), (9316, 14373), (9188, 14344), (9183, 14302), (9341, 14354), (9340, 14362), (9253, 14320), (9226, 14395), (9340, 14389), (9282, 14257), (9205, 14251), (9409, 14399)]
         : compromised: 0.6461, honest: 0.6489
Round 008: test acc mean=0.6539 ± 0.0062 | min=0.6365 max=0.6623
         : test loss mean=0.6207 ± 0.0050
         : individual accs = ['0.652403', '0.651633', '0.636478', '0.659070', '0.654727', '0.660614', '0.658023', '0.654318', '0.656149', '0.657135', '0.647448', '0.649909', '0.658423', '0.656803', '0.640852', '0.652449', '0.658698', '0.655117', '0.654691', '0.662338']
         : correct/total = [(9285, 14232), (9276, 14235), (9080, 14266), (9370, 14217), (9322, 14238), (9495, 14373), (9440, 14346), (9379, 14334), (9379, 14294), (9445, 14373), (9287, 14344), (9295, 14302), (9451, 14354), (9433, 14362), (9177, 14320), (9392, 14395), (9478, 14389), (9340, 14257), (9330, 14251), (9537, 14399)]
         : compromised: 0.6527, honest: 0.6556
Round 009: test acc mean=0.6549 ± 0.0087 | min=0.6384 max=0.6690
         : test loss mean=0.6193 ± 0.0086
         : individual accs = ['0.640318', '0.663786', '0.654353', '0.667651', '0.657466', '0.668963', '0.638366', '0.648737', '0.648944', '0.655187', '0.651143', '0.645434', '0.651247', '0.661955', '0.649162', '0.652796', '0.667524', '0.662692', '0.662550', '0.649559']
         : correct/total = [(9113, 14232), (9449, 14235), (9335, 14266), (9492, 14217), (9361, 14238), (9615, 14373), (9158, 14346), (9299, 14334), (9276, 14294), (9417, 14373), (9340, 14344), (9231, 14302), (9348, 14354), (9507, 14362), (9296, 14320), (9397, 14395), (9605, 14389), (9448, 14257), (9442, 14251), (9353, 14399)]
         : compromised: 0.6575, honest: 0.6510
Round 010: test acc mean=0.6651 ± 0.0070 | min=0.6428 max=0.6762
         : test loss mean=0.6079 ± 0.0061
         : individual accs = ['0.665964', '0.672427', '0.642787', '0.669551', '0.670389', '0.669937', '0.666458', '0.665271', '0.663845', '0.659918', '0.664041', '0.663823', '0.673471', '0.668291', '0.662221', '0.660993', '0.676211', '0.669355', '0.660094', '0.657337']
         : correct/total = [(9478, 14232), (9572, 14235), (9170, 14266), (9519, 14217), (9545, 14238), (9629, 14373), (9561, 14346), (9536, 14334), (9489, 14294), (9485, 14373), (9525, 14344), (9494, 14302), (9667, 14354), (9598, 14362), (9483, 14320), (9515, 14395), (9730, 14389), (9543, 14257), (9407, 14251), (9465, 14399)]
         : compromised: 0.6647, honest: 0.6657

=== FINAL RESULTS ===
Dataset: sent140, Nodes: 20, Graph: erdos, Aggregation: balance
Attack: directed_deviation, 60.0% compromised
Final accuracy - Compromised: 0.6647, Honest: 0.6657
Overall test accuracy: mean=0.6651 ± 0.0070

=== BALANCE SUMMARY ===
Node 0: acceptance=0.494
Node 1: acceptance=0.591
Node 2: acceptance=0.475
Node 3: acceptance=0.550
Node 4: acceptance=0.509
Node 5: acceptance=0.460
Node 6: acceptance=0.421
Node 7: acceptance=0.421
Node 8: acceptance=0.370
Node 9: acceptance=0.515
Node 10: acceptance=0.500
Node 11: acceptance=0.486
Node 12: acceptance=0.550
Node 13: acceptance=0.446
Node 14: acceptance=0.460
Node 15: acceptance=0.427
Node 16: acceptance=0.377
Node 17: acceptance=0.700
Node 18: acceptance=0.494
Node 19: acceptance=0.438

=== PARALLEL EXECUTION TIME (realistic for distributed system) ===
  COMMUNICATION (max across nodes):
    - Full model transfer: 0.000s (0.0%)
  COMPUTATION (max across nodes):
    - Filtering: 0.065s (81.9%)
    - Aggregation: 0.014s (18.0%)
  TOTALS:
    - Total computation: 0.079s (100.0%)
    - Total communication: 0.000s (0.0%)
    - Total parallel time: 0.079s

=== PER-NODE AVERAGE TIME ===
  - Filtering: 0.051s
  - Aggregation: 0.007s
  - Model transfer: 0.000s
  - Total per node: 0.058s

=== TOTAL COMPUTATIONAL WORK (sum across all nodes) ===
  - Total filtering: 1.014s
  - Total aggregation: 0.148s
  - Total model transfer: 0.000s
  - Grand total: 1.162s
  - Mean acceptance rate: 0.484

BALANCE Algorithm Properties:
  - Model dimension: 1,174,986
  - No compression: Full parameter comparison
  - Theoretical complexity: O(deg(i)×d)
  - Approach: Full parameter filtering + averaging
