Device: cuda
Seed: 987654321
Loading 1 LEAF Sent140 train files...
LEAF Sent140 train: 254555 users, 908652 samples
Building vocabulary (max_size=10000)...
Vocabulary size: 10000
Loading 1 LEAF Sent140 test files...
LEAF Sent140 test: 254555 users, 286281 samples
Found 254555 train users, 254555 test users, 254555 common users
User sample counts range: 494 (max) to 1 (min)
Distributed ALL 254555 users across 20 clients
Users per client: 12727 (with 15 clients getting +1 user)
Train partition sizes: [44353, 44290, 44657, 44907, 44696, 45843, 45801, 45619, 45069, 45639, 45821, 45311, 45779, 46056, 45625, 45984, 46428, 44737, 45540, 46497]
Test partition sizes: [14232, 14235, 14266, 14217, 14238, 14373, 14346, 14334, 14294, 14373, 14344, 14302, 14354, 14362, 14320, 14395, 14389, 14257, 14251, 14399]
  Client 0: 44353 train samples, 2 unique classes
  Client 1: 44290 train samples, 2 unique classes
  Client 2: 44657 train samples, 2 unique classes
  Client 3: 44907 train samples, 2 unique classes
  Client 4: 44696 train samples, 2 unique classes
  Client 5: 45843 train samples, 2 unique classes
  Client 6: 45801 train samples, 2 unique classes
  Client 7: 45619 train samples, 2 unique classes
  Client 8: 45069 train samples, 2 unique classes
  Client 9: 45639 train samples, 2 unique classes
  Client 10: 45821 train samples, 2 unique classes
  Client 11: 45311 train samples, 2 unique classes
  Client 12: 45779 train samples, 2 unique classes
  Client 13: 46056 train samples, 2 unique classes
  Client 14: 45625 train samples, 2 unique classes
  Client 15: 45984 train samples, 2 unique classes
  Client 16: 46428 train samples, 2 unique classes
  Client 17: 44737 train samples, 2 unique classes
  Client 18: 45540 train samples, 2 unique classes
  Client 19: 46497 train samples, 2 unique classes
Will sample 4500 samples per client per epoch
Graph: erdos, nodes: 20, edges: 48
Degree statistics: avg=4.80, min=2, max=7
Attack: Compromised 6/20 nodes: [5, 12, 13, 14, 17, 18]
Attack type: gaussian, lambda: 1.0
Model variant: baseline
Model parameters: 1,174,986
BALANCE algorithm:
Balance Config: BALANCEConfig(gamma=2, kappa=1, alpha=0.5, min_neighbors=1)
  - Model dimension: 1,174,986 parameters
  - Complexity: O(N×d) = O(20×1,174,986)
Initial test acc across nodes: mean=0.4953 ± 0.0174
Round 001: test acc mean=0.5589 ± 0.0356 | min=0.5023 max=0.6279
         : test loss mean=0.6898 ± 0.0010
         : individual accs = ['0.554666', '0.589533', '0.519417', '0.502286', '0.544880', '0.576915', '0.570124', '0.611902', '0.554289', '0.537536', '0.532069', '0.557055', '0.627351', '0.547208', '0.520880', '0.627857', '0.509834', '0.581188', '0.533506', '0.580179']
         : correct/total = [(7894, 14232), (8392, 14235), (7410, 14266), (7141, 14217), (7758, 14238), (8292, 14373), (8179, 14346), (8771, 14334), (7923, 14294), (7726, 14373), (7632, 14344), (7967, 14302), (9005, 14354), (7859, 14362), (7459, 14320), (9038, 14395), (7336, 14389), (8286, 14257), (7603, 14251), (8354, 14399)]
         : compromised: 0.5645, honest: 0.5565
Round 002: test acc mean=0.5902 ± 0.0447 | min=0.4953 max=0.6422
         : test loss mean=0.6840 ± 0.0081
         : individual accs = ['0.605326', '0.618265', '0.629469', '0.578603', '0.619680', '0.608154', '0.606232', '0.638063', '0.623898', '0.560774', '0.613846', '0.597049', '0.514212', '0.618159', '0.495321', '0.637513', '0.547710', '0.523182', '0.525717', '0.642197']
         : correct/total = [(8615, 14232), (8801, 14235), (8980, 14266), (8226, 14217), (8823, 14238), (8741, 14373), (8697, 14346), (9146, 14334), (8918, 14294), (8060, 14373), (8805, 14344), (8539, 14302), (7381, 14354), (8878, 14362), (7093, 14320), (9177, 14395), (7881, 14389), (7459, 14257), (7492, 14251), (9247, 14399)]
         : compromised: 0.5475, honest: 0.6085
Round 003: test acc mean=0.5892 ± 0.0386 | min=0.5038 max=0.6382
         : test loss mean=0.6793 ± 0.0090
         : individual accs = ['0.531900', '0.616790', '0.638161', '0.630794', '0.620874', '0.629583', '0.523630', '0.572555', '0.623758', '0.631323', '0.610708', '0.569431', '0.503832', '0.579098', '0.601816', '0.570059', '0.614150', '0.556358', '0.559259', '0.600181']
         : correct/total = [(7570, 14232), (8780, 14235), (9104, 14266), (8968, 14217), (8840, 14238), (9049, 14373), (7512, 14346), (8207, 14334), (8916, 14294), (9074, 14373), (8760, 14344), (8144, 14302), (7232, 14354), (8317, 14362), (8618, 14320), (8206, 14395), (8837, 14389), (7932, 14257), (7970, 14251), (8642, 14399)]
         : compromised: 0.5717, honest: 0.5967
Round 004: test acc mean=0.6217 ± 0.0295 | min=0.5143 max=0.6490
         : test loss mean=0.6702 ± 0.0112
         : individual accs = ['0.633221', '0.628170', '0.613206', '0.630935', '0.617011', '0.641898', '0.630211', '0.629134', '0.642507', '0.607598', '0.640965', '0.639980', '0.514282', '0.582370', '0.633799', '0.634387', '0.647300', '0.614786', '0.602554', '0.649003']
         : correct/total = [(9012, 14232), (8942, 14235), (8748, 14266), (8970, 14217), (8785, 14238), (9226, 14373), (9041, 14346), (9018, 14334), (9184, 14294), (8733, 14373), (9194, 14344), (9153, 14302), (7382, 14354), (8364, 14362), (9076, 14320), (9132, 14395), (9314, 14389), (8765, 14257), (8587, 14251), (9345, 14399)]
         : compromised: 0.5983, honest: 0.6317
Round 005: test acc mean=0.6333 ± 0.0201 | min=0.5859 max=0.6570
         : test loss mean=0.6625 ± 0.0095
         : individual accs = ['0.627459', '0.646575', '0.645311', '0.640853', '0.650864', '0.600223', '0.643943', '0.657039', '0.634812', '0.621930', '0.648703', '0.639631', '0.593841', '0.610778', '0.629260', '0.649184', '0.652790', '0.640738', '0.585854', '0.646295']
         : correct/total = [(8930, 14232), (9204, 14235), (9206, 14266), (9111, 14217), (9267, 14238), (8627, 14373), (9238, 14346), (9418, 14334), (9074, 14294), (8939, 14373), (9305, 14344), (9148, 14302), (8524, 14354), (8772, 14362), (9011, 14320), (9345, 14395), (9393, 14389), (9135, 14257), (8349, 14251), (9306, 14399)]
         : compromised: 0.6101, honest: 0.6432
Round 006: test acc mean=0.6450 ± 0.0142 | min=0.5982 max=0.6587
         : test loss mean=0.6489 ± 0.0086
         : individual accs = ['0.647344', '0.653530', '0.647133', '0.642822', '0.653603', '0.651499', '0.650146', '0.658714', '0.651042', '0.647255', '0.629322', '0.598168', '0.651665', '0.644827', '0.649791', '0.653074', '0.655987', '0.617521', '0.640937', '0.655323']
         : correct/total = [(9213, 14232), (9303, 14235), (9232, 14266), (9139, 14217), (9306, 14238), (9364, 14373), (9327, 14346), (9442, 14334), (9306, 14294), (9303, 14373), (9027, 14344), (8555, 14302), (9354, 14354), (9261, 14362), (9305, 14320), (9401, 14395), (9439, 14389), (8804, 14257), (9134, 14251), (9436, 14399)]
         : compromised: 0.6427, honest: 0.6460
Round 007: test acc mean=0.6465 ± 0.0109 | min=0.6163 max=0.6588
         : test loss mean=0.6418 ± 0.0072
         : individual accs = ['0.650646', '0.658799', '0.627927', '0.649293', '0.657677', '0.652473', '0.652168', '0.631994', '0.654121', '0.644055', '0.650446', '0.640330', '0.653267', '0.616279', '0.653073', '0.653769', '0.656196', '0.634285', '0.642130', '0.650184']
         : correct/total = [(9260, 14232), (9378, 14235), (8958, 14266), (9231, 14217), (9364, 14238), (9378, 14373), (9356, 14346), (9059, 14334), (9350, 14294), (9257, 14373), (9330, 14344), (9158, 14302), (9377, 14354), (8851, 14362), (9352, 14320), (9411, 14395), (9442, 14389), (9043, 14257), (9151, 14251), (9362, 14399)]
         : compromised: 0.6419, honest: 0.6484
Round 008: test acc mean=0.6513 ± 0.0087 | min=0.6321 max=0.6644
         : test loss mean=0.6336 ± 0.0066
         : individual accs = ['0.653035', '0.632104', '0.638091', '0.658296', '0.650232', '0.664371', '0.659835', '0.652923', '0.658318', '0.661031', '0.645078', '0.659069', '0.644141', '0.645314', '0.653701', '0.658145', '0.652165', '0.639545', '0.641639', '0.659004']
         : correct/total = [(9294, 14232), (8998, 14235), (9103, 14266), (9359, 14217), (9258, 14238), (9549, 14373), (9466, 14346), (9359, 14334), (9410, 14294), (9501, 14373), (9253, 14344), (9426, 14302), (9246, 14354), (9268, 14362), (9361, 14320), (9474, 14395), (9384, 14389), (9118, 14257), (9144, 14251), (9489, 14399)]
         : compromised: 0.6481, honest: 0.6527
Round 009: test acc mean=0.6588 ± 0.0082 | min=0.6399 max=0.6681
         : test loss mean=0.6276 ± 0.0052
         : individual accs = ['0.639896', '0.667229', '0.662344', '0.659211', '0.662242', '0.668058', '0.660114', '0.661365', '0.642507', '0.640437', '0.659439', '0.653545', '0.664205', '0.661398', '0.661941', '0.658354', '0.666203', '0.661920', '0.660094', '0.665602']
         : correct/total = [(9107, 14232), (9498, 14235), (9449, 14266), (9372, 14217), (9429, 14238), (9602, 14373), (9470, 14346), (9480, 14334), (9184, 14294), (9205, 14373), (9459, 14344), (9347, 14302), (9534, 14354), (9499, 14362), (9479, 14320), (9477, 14395), (9586, 14389), (9437, 14257), (9407, 14251), (9584, 14399)]
         : compromised: 0.6629, honest: 0.6570
Round 010: test acc mean=0.6653 ± 0.0075 | min=0.6419 max=0.6772
         : test loss mean=0.6180 ± 0.0061
         : individual accs = ['0.661678', '0.670671', '0.641876', '0.668566', '0.673058', '0.670911', '0.669455', '0.677201', '0.665734', '0.665762', '0.669688', '0.667389', '0.668594', '0.662303', '0.665922', '0.663772', '0.670860', '0.660027', '0.656936', '0.654768']
         : correct/total = [(9417, 14232), (9547, 14235), (9157, 14266), (9505, 14217), (9583, 14238), (9643, 14373), (9604, 14346), (9707, 14334), (9516, 14294), (9569, 14373), (9606, 14344), (9545, 14302), (9597, 14354), (9512, 14362), (9536, 14320), (9555, 14395), (9653, 14389), (9410, 14257), (9362, 14251), (9428, 14399)]
         : compromised: 0.6641, honest: 0.6657

=== FINAL RESULTS ===
Dataset: sent140, Nodes: 20, Graph: erdos, Aggregation: balance
Attack: gaussian, 30.0% compromised
Final accuracy - Compromised: 0.6641, Honest: 0.6657
Overall test accuracy: mean=0.6653 ± 0.0075

=== BALANCE SUMMARY ===
Node 0: acceptance=0.833
Node 1: acceptance=1.000
Node 2: acceptance=0.600
Node 3: acceptance=0.750
Node 4: acceptance=0.500
Node 5: acceptance=0.400
Node 6: acceptance=0.800
Node 7: acceptance=0.600
Node 8: acceptance=0.500
Node 9: acceptance=1.000
Node 10: acceptance=0.750
Node 11: acceptance=0.571
Node 12: acceptance=0.714
Node 13: acceptance=0.750
Node 14: acceptance=0.429
Node 15: acceptance=0.500
Node 16: acceptance=0.400
Node 17: acceptance=0.600
Node 18: acceptance=0.900
Node 19: acceptance=1.000

=== PARALLEL EXECUTION TIME (realistic for distributed system) ===
  COMMUNICATION (max across nodes):
    - Full model transfer: 0.000s (0.0%)
  COMPUTATION (max across nodes):
    - Filtering: 0.035s (72.3%)
    - Aggregation: 0.013s (27.7%)
  TOTALS:
    - Total computation: 0.048s (100.0%)
    - Total communication: 0.000s (0.0%)
    - Total parallel time: 0.048s

=== PER-NODE AVERAGE TIME ===
  - Filtering: 0.022s
  - Aggregation: 0.006s
  - Model transfer: 0.000s
  - Total per node: 0.028s

=== TOTAL COMPUTATIONAL WORK (sum across all nodes) ===
  - Total filtering: 0.434s
  - Total aggregation: 0.125s
  - Total model transfer: 0.000s
  - Grand total: 0.559s
  - Mean acceptance rate: 0.680

BALANCE Algorithm Properties:
  - Model dimension: 1,174,986
  - No compression: Full parameter comparison
  - Theoretical complexity: O(deg(i)×d)
  - Approach: Full parameter filtering + averaging
