Device: cuda
Seed: 987654321
Loading 1 LEAF Sent140 train files...
LEAF Sent140 train: 254555 users, 908652 samples
Building vocabulary (max_size=10000)...
Vocabulary size: 10000
Loading 1 LEAF Sent140 test files...
LEAF Sent140 test: 254555 users, 286281 samples
Found 254555 train users, 254555 test users, 254555 common users
User sample counts range: 494 (max) to 1 (min)
Distributed ALL 254555 users across 20 clients
Users per client: 12727 (with 15 clients getting +1 user)
Train partition sizes: [44353, 44290, 44657, 44907, 44696, 45843, 45801, 45619, 45069, 45639, 45821, 45311, 45779, 46056, 45625, 45984, 46428, 44737, 45540, 46497]
Test partition sizes: [14232, 14235, 14266, 14217, 14238, 14373, 14346, 14334, 14294, 14373, 14344, 14302, 14354, 14362, 14320, 14395, 14389, 14257, 14251, 14399]
  Client 0: 44353 train samples, 2 unique classes
  Client 1: 44290 train samples, 2 unique classes
  Client 2: 44657 train samples, 2 unique classes
  Client 3: 44907 train samples, 2 unique classes
  Client 4: 44696 train samples, 2 unique classes
  Client 5: 45843 train samples, 2 unique classes
  Client 6: 45801 train samples, 2 unique classes
  Client 7: 45619 train samples, 2 unique classes
  Client 8: 45069 train samples, 2 unique classes
  Client 9: 45639 train samples, 2 unique classes
  Client 10: 45821 train samples, 2 unique classes
  Client 11: 45311 train samples, 2 unique classes
  Client 12: 45779 train samples, 2 unique classes
  Client 13: 46056 train samples, 2 unique classes
  Client 14: 45625 train samples, 2 unique classes
  Client 15: 45984 train samples, 2 unique classes
  Client 16: 46428 train samples, 2 unique classes
  Client 17: 44737 train samples, 2 unique classes
  Client 18: 45540 train samples, 2 unique classes
  Client 19: 46497 train samples, 2 unique classes
Will sample 4500 samples per client per epoch
Graph: fully, nodes: 20, edges: 190
Degree statistics: avg=19.00, min=19, max=19
Attack: Compromised 10/20 nodes: [1, 2, 5, 11, 12, 13, 14, 15, 17, 18]
Attack type: krum, lambda: 1.0
Model variant: baseline
Model parameters: 1,174,986
Sketchguard Node 0:
  Model dim: 1,174,986 → Sketch size: 180
  Compression ratio: 6527.7x
  Using model parameters for aggregation, sketches for filtering
Sketchguard Node 1:
  Model dim: 1,174,986 → Sketch size: 180
  Compression ratio: 6527.7x
  Using model parameters for aggregation, sketches for filtering
Sketchguard Node 2:
  Model dim: 1,174,986 → Sketch size: 180
  Compression ratio: 6527.7x
  Using model parameters for aggregation, sketches for filtering
Sketchguard Node 3:
  Model dim: 1,174,986 → Sketch size: 180
  Compression ratio: 6527.7x
  Using model parameters for aggregation, sketches for filtering
Sketchguard Node 4:
  Model dim: 1,174,986 → Sketch size: 180
  Compression ratio: 6527.7x
  Using model parameters for aggregation, sketches for filtering
Sketchguard Node 5:
  Model dim: 1,174,986 → Sketch size: 180
  Compression ratio: 6527.7x
  Using model parameters for aggregation, sketches for filtering
Sketchguard Node 6:
  Model dim: 1,174,986 → Sketch size: 180
  Compression ratio: 6527.7x
  Using model parameters for aggregation, sketches for filtering
Sketchguard Node 7:
  Model dim: 1,174,986 → Sketch size: 180
  Compression ratio: 6527.7x
  Using model parameters for aggregation, sketches for filtering
Sketchguard Node 8:
  Model dim: 1,174,986 → Sketch size: 180
  Compression ratio: 6527.7x
  Using model parameters for aggregation, sketches for filtering
Sketchguard Node 9:
  Model dim: 1,174,986 → Sketch size: 180
  Compression ratio: 6527.7x
  Using model parameters for aggregation, sketches for filtering
Sketchguard Node 10:
  Model dim: 1,174,986 → Sketch size: 180
  Compression ratio: 6527.7x
  Using model parameters for aggregation, sketches for filtering
Sketchguard Node 11:
  Model dim: 1,174,986 → Sketch size: 180
  Compression ratio: 6527.7x
  Using model parameters for aggregation, sketches for filtering
Sketchguard Node 12:
  Model dim: 1,174,986 → Sketch size: 180
  Compression ratio: 6527.7x
  Using model parameters for aggregation, sketches for filtering
Sketchguard Node 13:
  Model dim: 1,174,986 → Sketch size: 180
  Compression ratio: 6527.7x
  Using model parameters for aggregation, sketches for filtering
Sketchguard Node 14:
  Model dim: 1,174,986 → Sketch size: 180
  Compression ratio: 6527.7x
  Using model parameters for aggregation, sketches for filtering
Sketchguard Node 15:
  Model dim: 1,174,986 → Sketch size: 180
  Compression ratio: 6527.7x
  Using model parameters for aggregation, sketches for filtering
Sketchguard Node 16:
  Model dim: 1,174,986 → Sketch size: 180
  Compression ratio: 6527.7x
  Using model parameters for aggregation, sketches for filtering
Sketchguard Node 17:
  Model dim: 1,174,986 → Sketch size: 180
  Compression ratio: 6527.7x
  Using model parameters for aggregation, sketches for filtering
Sketchguard Node 18:
  Model dim: 1,174,986 → Sketch size: 180
  Compression ratio: 6527.7x
  Using model parameters for aggregation, sketches for filtering
Sketchguard Node 19:
  Model dim: 1,174,986 → Sketch size: 180
  Compression ratio: 6527.7x
  Using model parameters for aggregation, sketches for filtering
Sketchguard ALGORITHM (Sketch-based Filtering + State Aggregation)
  - Model dimension: 1,174,986 parameters
  - Config: SketchguardConfig(gamma=2, kappa=1, alpha=0.5, min_neighbors=1, sketch_size=180, network_seed=987654321, attack_detection_window=5)
  - Sketch size: 180
  - Compression ratio: 6527.7x
  - Complexity: O(d + N×k) = O(1,174,986 + 20×180)
  - Theoretical speedup vs BALANCE: 19.9x
Initial test acc across nodes: mean=0.4953 ± 0.0174
Round 001: test acc mean=0.4961 ± 0.0085 | min=0.4855 max=0.5160
         : test loss mean=0.7084 ± 0.0087
         : individual accs = ['0.493606', '0.489427', '0.487312', '0.516002', '0.496278', '0.497043', '0.486756', '0.498605', '0.509514', '0.501078', '0.485499', '0.501468', '0.486206', '0.497493', '0.491690', '0.509274', '0.486344', '0.489584', '0.494351', '0.503993']
         : correct/total = [(7025, 14232), (6967, 14235), (6952, 14266), (7336, 14217), (7066, 14238), (7144, 14373), (6983, 14346), (7147, 14334), (7283, 14294), (7202, 14373), (6964, 14344), (7172, 14302), (6979, 14354), (7145, 14362), (7041, 14320), (7331, 14395), (6998, 14389), (6980, 14257), (7045, 14251), (7257, 14399)]
         : compromised: 0.4944, honest: 0.4978
         : sketchguard stats = ['Node 0: acc_rate=1.000', 'Node 1: acc_rate=1.000', 'Node 2: acc_rate=1.000']...
Round 002: test acc mean=0.5853 ± 0.0187 | min=0.5406 max=0.6099
         : test loss mean=0.6755 ± 0.0049
         : individual accs = ['0.579539', '0.571479', '0.586429', '0.573398', '0.609636', '0.559591', '0.600446', '0.586717', '0.594655', '0.605023', '0.609941', '0.609635', '0.560750', '0.597688', '0.573534', '0.573810', '0.592675', '0.540647', '0.602554', '0.577679']
         : correct/total = [(8248, 14232), (8135, 14235), (8366, 14266), (8152, 14217), (8680, 14238), (8043, 14373), (8614, 14346), (8410, 14334), (8500, 14294), (8696, 14373), (8749, 14344), (8719, 14302), (8049, 14354), (8584, 14362), (8213, 14320), (8260, 14395), (8528, 14389), (7708, 14257), (8587, 14251), (8318, 14399)]
         : compromised: 0.5776, honest: 0.5930
         : sketchguard stats = ['Node 0: acc_rate=0.737', 'Node 1: acc_rate=0.763', 'Node 2: acc_rate=0.763']...
Round 003: test acc mean=0.6004 ± 0.0163 | min=0.5604 max=0.6226
         : test loss mean=0.6679 ± 0.0049
         : individual accs = ['0.560427', '0.604847', '0.603673', '0.588028', '0.622559', '0.590204', '0.591036', '0.561811', '0.606968', '0.605441', '0.597323', '0.618165', '0.614184', '0.613912', '0.595601', '0.599583', '0.600528', '0.600898', '0.619886', '0.613098']
         : correct/total = [(7976, 14232), (8610, 14235), (8612, 14266), (8360, 14217), (8864, 14238), (8483, 14373), (8479, 14346), (8053, 14334), (8676, 14294), (8702, 14373), (8568, 14344), (8841, 14302), (8816, 14354), (8817, 14362), (8529, 14320), (8631, 14395), (8641, 14389), (8567, 14257), (8834, 14251), (8828, 14399)]
         : compromised: 0.6061, honest: 0.5947
         : sketchguard stats = ['Node 0: acc_rate=0.649', 'Node 1: acc_rate=0.684', 'Node 2: acc_rate=0.684']...
Round 004: test acc mean=0.6299 ± 0.0081 | min=0.6047 max=0.6440
         : test loss mean=0.6469 ± 0.0050
         : individual accs = ['0.623946', '0.626554', '0.624772', '0.621017', '0.636536', '0.628818', '0.634672', '0.636529', '0.631384', '0.635497', '0.630926', '0.636345', '0.625540', '0.629648', '0.604749', '0.638486', '0.624852', '0.635407', '0.628728', '0.644003']
         : correct/total = [(8880, 14232), (8919, 14235), (8913, 14266), (8829, 14217), (9063, 14238), (9038, 14373), (9105, 14346), (9124, 14334), (9025, 14294), (9134, 14373), (9050, 14344), (9101, 14302), (8979, 14354), (9043, 14362), (8660, 14320), (9191, 14395), (8991, 14389), (9059, 14257), (8960, 14251), (9273, 14399)]
         : compromised: 0.6279, honest: 0.6319
         : sketchguard stats = ['Node 0: acc_rate=0.605', 'Node 1: acc_rate=0.645', 'Node 2: acc_rate=0.645']...
Round 005: test acc mean=0.6442 ± 0.0064 | min=0.6318 max=0.6552
         : test loss mean=0.6293 ± 0.0045
         : individual accs = ['0.644182', '0.649666', '0.636759', '0.640641', '0.647352', '0.647394', '0.646103', '0.644761', '0.655170', '0.636332', '0.631832', '0.645155', '0.649854', '0.643573', '0.649162', '0.637374', '0.653555', '0.645578', '0.631956', '0.648309']
         : correct/total = [(9168, 14232), (9248, 14235), (9084, 14266), (9108, 14217), (9217, 14238), (9305, 14373), (9269, 14346), (9242, 14334), (9365, 14294), (9146, 14373), (9063, 14344), (9227, 14302), (9328, 14354), (9243, 14362), (9296, 14320), (9175, 14395), (9404, 14389), (9204, 14257), (9006, 14251), (9335, 14399)]
         : compromised: 0.6436, honest: 0.6448
         : sketchguard stats = ['Node 0: acc_rate=0.579', 'Node 1: acc_rate=0.621', 'Node 2: acc_rate=0.621']...
Round 006: test acc mean=0.6546 ± 0.0046 | min=0.6413 max=0.6600
         : test loss mean=0.6179 ± 0.0035
         : individual accs = ['0.650717', '0.658026', '0.641315', '0.652107', '0.657466', '0.656578', '0.657814', '0.659551', '0.655170', '0.649899', '0.656093', '0.657740', '0.659607', '0.655201', '0.659986', '0.655505', '0.655779', '0.648664', '0.649218', '0.656434']
         : correct/total = [(9261, 14232), (9367, 14235), (9149, 14266), (9271, 14217), (9361, 14238), (9437, 14373), (9437, 14346), (9454, 14334), (9365, 14294), (9341, 14373), (9411, 14344), (9407, 14302), (9468, 14354), (9410, 14362), (9451, 14320), (9436, 14395), (9436, 14389), (9248, 14257), (9252, 14251), (9452, 14399)]
         : compromised: 0.6542, honest: 0.6551
         : sketchguard stats = ['Node 0: acc_rate=0.561', 'Node 1: acc_rate=0.605', 'Node 2: acc_rate=0.605']...
Round 007: test acc mean=0.6621 ± 0.0044 | min=0.6529 max=0.6698
         : test loss mean=0.6105 ± 0.0041
         : individual accs = ['0.661327', '0.666526', '0.652881', '0.663501', '0.664700', '0.668197', '0.666179', '0.656132', '0.664335', '0.663118', '0.658254', '0.662215', '0.669778', '0.660841', '0.666969', '0.655714', '0.664466', '0.659325', '0.657989', '0.659629']
         : correct/total = [(9412, 14232), (9488, 14235), (9314, 14266), (9433, 14217), (9464, 14238), (9604, 14373), (9557, 14346), (9405, 14334), (9496, 14294), (9531, 14373), (9442, 14344), (9471, 14302), (9614, 14354), (9491, 14362), (9551, 14320), (9439, 14395), (9561, 14389), (9400, 14257), (9377, 14251), (9498, 14399)]
         : compromised: 0.6620, honest: 0.6622
         : sketchguard stats = ['Node 0: acc_rate=0.549', 'Node 1: acc_rate=0.594', 'Node 2: acc_rate=0.594']...
Round 008: test acc mean=0.6692 ± 0.0041 | min=0.6601 max=0.6744
         : test loss mean=0.6038 ± 0.0038
         : individual accs = ['0.664559', '0.672568', '0.660101', '0.671168', '0.668423', '0.672441', '0.667991', '0.661644', '0.671820', '0.670493', '0.668781', '0.668158', '0.668733', '0.674419', '0.670321', '0.669260', '0.673431', '0.674335', '0.662550', '0.672825']
         : correct/total = [(9458, 14232), (9574, 14235), (9417, 14266), (9542, 14217), (9517, 14238), (9665, 14373), (9583, 14346), (9484, 14334), (9603, 14294), (9637, 14373), (9593, 14344), (9556, 14302), (9599, 14354), (9686, 14362), (9599, 14320), (9634, 14395), (9690, 14389), (9614, 14257), (9442, 14251), (9688, 14399)]
         : compromised: 0.6693, honest: 0.6691
         : sketchguard stats = ['Node 0: acc_rate=0.539', 'Node 1: acc_rate=0.586', 'Node 2: acc_rate=0.586']...
Round 009: test acc mean=0.6663 ± 0.0085 | min=0.6412 max=0.6796
         : test loss mean=0.6053 ± 0.0085
         : individual accs = ['0.641161', '0.679593', '0.665498', '0.664697', '0.663366', '0.673346', '0.650216', '0.666039', '0.670841', '0.663257', '0.659927', '0.665082', '0.674655', '0.675533', '0.668436', '0.668843', '0.672597', '0.665848', '0.671181', '0.666644']
         : correct/total = [(9125, 14232), (9674, 14235), (9494, 14266), (9450, 14217), (9445, 14238), (9678, 14373), (9328, 14346), (9547, 14334), (9589, 14294), (9533, 14373), (9466, 14344), (9512, 14302), (9684, 14354), (9702, 14362), (9572, 14320), (9628, 14395), (9678, 14389), (9493, 14257), (9565, 14251), (9599, 14399)]
         : compromised: 0.6708, honest: 0.6619
         : sketchguard stats = ['Node 0: acc_rate=0.532', 'Node 1: acc_rate=0.579', 'Node 2: acc_rate=0.579']...
Round 010: test acc mean=0.6800 ± 0.0065 | min=0.6574 max=0.6875
         : test loss mean=0.5929 ± 0.0055
         : individual accs = ['0.677277', '0.685213', '0.657437', '0.681789', '0.686403', '0.681973', '0.684023', '0.687526', '0.679936', '0.671606', '0.682655', '0.679765', '0.684130', '0.684863', '0.679749', '0.674401', '0.681632', '0.684436', '0.676444', '0.679283']
         : correct/total = [(9639, 14232), (9754, 14235), (9379, 14266), (9693, 14217), (9773, 14238), (9802, 14373), (9813, 14346), (9855, 14334), (9719, 14294), (9653, 14373), (9792, 14344), (9722, 14302), (9820, 14354), (9836, 14362), (9734, 14320), (9708, 14395), (9808, 14389), (9758, 14257), (9640, 14251), (9781, 14399)]
         : compromised: 0.6788, honest: 0.6812
         : sketchguard stats = ['Node 0: acc_rate=0.526', 'Node 1: acc_rate=0.574', 'Node 2: acc_rate=0.574']...

=== FINAL RESULTS ===
Dataset: sent140, Nodes: 20, Graph: fully, Aggregation: sketchguard
Attack: krum, 50.0% compromised
Final accuracy - Compromised: 0.6788, Honest: 0.6812
Overall test accuracy: mean=0.6800 ± 0.0065

=== Sketchguard SUMMARY ===
Node 0: acceptance=0.526
Node 1: acceptance=0.574
Node 2: acceptance=0.574
Node 3: acceptance=0.526
Node 4: acceptance=0.526
Node 5: acceptance=0.574
Node 6: acceptance=0.526
Node 7: acceptance=0.526
Node 8: acceptance=0.526
Node 9: acceptance=0.526
Node 10: acceptance=0.526
Node 11: acceptance=0.574
Node 12: acceptance=0.574
Node 13: acceptance=0.574
Node 14: acceptance=0.574
Node 15: acceptance=0.574
Node 16: acceptance=0.526
Node 17: acceptance=0.574
Node 18: acceptance=0.574
Node 19: acceptance=0.526

=== PARALLEL EXECUTION TIME (realistic for distributed system) ===
  COMMUNICATION (max across nodes):
    - Sketch transfer: 0.000s (0.0%)
    - Model fetch (accepted): 0.000s (0.0%)
  COMPUTATION (max across nodes):
    - Sketching: 0.471s (94.9%)
    - Filtering: 0.001s (0.2%)
    - Aggregation: 0.024s (4.8%)
  TOTALS:
    - Total computation: 0.496s (100.0%)
    - Total communication: 0.000s (0.0%)
    - Total parallel time: 0.496s

=== PER-NODE AVERAGE TIME ===
  - Sketching: 0.419s
  - Filtering: 0.001s
  - Aggregation: 0.020s
  - Sketch transfer: 0.000s
  - Model fetch: 0.000s
  - Total per node: 0.439s

=== TOTAL COMPUTATIONAL WORK (sum across all nodes) ===
  - Total sketching: 8.380s
  - Total filtering: 0.015s
  - Total aggregation: 0.392s
  - Total sketch transfer: 0.000s
  - Total model fetch: 0.000s
  - Grand total: 8.788s
  - Mean acceptance rate: 0.550

Sketchguard Algorithm Properties:
  - Original dimension: 1,174,986
  - Sketch size: 180
  - Compression ratio: 19.9x
  - Single repetition: No repetitions needed
  - Theoretical complexity: O(d + N×k)
  - Approach: Sketch filtering + state aggregation
