Device: cuda
Seed: 987654321
Looking for images in: /home/student.unimelb.edu.au/mrangwala/Projects/Sketchguard/leaf/data/celeba/data/raw/img_align_celeba
Loading 1 LEAF CelebA train files...
LEAF CelebA train: 9343 users (celebrities), 177457 samples
Looking for images in: /home/student.unimelb.edu.au/mrangwala/Projects/Sketchguard/leaf/data/celeba/data/raw/img_align_celeba
Loading 1 LEAF CelebA test files...
LEAF CelebA test: 9343 users (celebrities), 22831 samples
Found 9343 train users, 9343 test users, 9343 common users
User sample counts range: 31 (max) to 4 (min)
Distributed ALL 9343 users across 20 clients
Users per client: 467 (with 3 clients getting +1 user)
Train partition sizes: [8843, 8998, 8728, 9034, 8866, 8946, 8873, 8776, 8816, 8801, 8913, 8656, 9115, 8921, 8699, 8823, 8912, 8766, 9102, 8869]
Test partition sizes: [1140, 1158, 1127, 1158, 1134, 1145, 1145, 1127, 1136, 1128, 1144, 1125, 1152, 1160, 1124, 1145, 1154, 1131, 1157, 1141]
  Client 0: 8843 train samples, 2 unique classes
  Client 1: 8998 train samples, 2 unique classes
  Client 2: 8728 train samples, 2 unique classes
  Client 3: 9034 train samples, 2 unique classes
  Client 4: 8866 train samples, 2 unique classes
  Client 5: 8946 train samples, 2 unique classes
  Client 6: 8873 train samples, 2 unique classes
  Client 7: 8776 train samples, 2 unique classes
  Client 8: 8816 train samples, 2 unique classes
  Client 9: 8801 train samples, 2 unique classes
  Client 10: 8913 train samples, 2 unique classes
  Client 11: 8656 train samples, 2 unique classes
  Client 12: 9115 train samples, 2 unique classes
  Client 13: 8921 train samples, 2 unique classes
  Client 14: 8699 train samples, 2 unique classes
  Client 15: 8823 train samples, 2 unique classes
  Client 16: 8912 train samples, 2 unique classes
  Client 17: 8766 train samples, 2 unique classes
  Client 18: 9102 train samples, 2 unique classes
  Client 19: 8869 train samples, 2 unique classes
Will sample 4500 samples per client per epoch
Graph: erdos, nodes: 20, edges: 99
Degree statistics: avg=9.90, min=7, max=14
Attack: Compromised 14/20 nodes: [1, 2, 3, 5, 6, 8, 11, 12, 13, 14, 15, 17, 18, 19]
Attack type: gaussian, lambda: 1.0
Model variant: baseline
Model parameters: 2,219,692
BALANCE algorithm:
Balance Config: BALANCEConfig(gamma=2, kappa=1, alpha=0.5, min_neighbors=1)
  - Model dimension: 2,219,692 parameters
  - Complexity: O(N×d) = O(20×2,219,692)
Initial test acc across nodes: mean=0.4978 ± 0.0208
Round 001: test acc mean=0.6334 ± 0.0651 | min=0.5256 max=0.7120
         : test loss mean=0.6808 ± 0.0046
         : individual accs = ['0.702632', '0.666667', '0.538598', '0.694301', '0.525573', '0.537991', '0.614847', '0.624667', '0.636444', '0.709220', '0.625000', '0.712000', '0.688368', '0.680172', '0.530249', '0.603493', '0.688042', '0.650752', '0.699222', '0.540754']
         : correct/total = [(801, 1140), (772, 1158), (607, 1127), (804, 1158), (596, 1134), (616, 1145), (704, 1145), (704, 1127), (723, 1136), (800, 1128), (715, 1144), (801, 1125), (793, 1152), (789, 1160), (596, 1124), (691, 1145), (794, 1154), (736, 1131), (809, 1157), (617, 1141)]
         : compromised: 0.6281, honest: 0.6459
Round 002: test acc mean=0.6628 ± 0.0496 | min=0.5400 max=0.7418
         : test loss mean=0.6592 ± 0.0220
         : individual accs = ['0.675439', '0.670121', '0.607808', '0.708117', '0.608466', '0.630568', '0.614847', '0.685004', '0.735035', '0.704787', '0.712413', '0.592889', '0.684896', '0.668966', '0.540036', '0.657642', '0.741768', '0.658709', '0.691443', '0.666082']
         : correct/total = [(770, 1140), (776, 1158), (685, 1127), (820, 1158), (690, 1134), (722, 1145), (704, 1145), (772, 1127), (835, 1136), (795, 1128), (815, 1144), (667, 1125), (789, 1152), (776, 1160), (607, 1124), (753, 1145), (856, 1154), (745, 1131), (800, 1157), (760, 1141)]
         : compromised: 0.6519, honest: 0.6880
Round 003: test acc mean=0.7324 ± 0.0313 | min=0.6755 max=0.8011
         : test loss mean=0.5921 ± 0.0386
         : individual accs = ['0.753509', '0.704663', '0.729370', '0.736615', '0.706349', '0.720524', '0.754585', '0.712511', '0.801056', '0.761525', '0.763112', '0.700444', '0.697917', '0.730172', '0.721530', '0.720524', '0.798094', '0.675508', '0.724287', '0.735320']
         : correct/total = [(859, 1140), (816, 1158), (822, 1127), (853, 1158), (801, 1134), (825, 1145), (864, 1145), (803, 1127), (910, 1136), (859, 1128), (873, 1144), (788, 1125), (804, 1152), (847, 1160), (811, 1124), (825, 1145), (921, 1154), (764, 1131), (838, 1157), (839, 1141)]
         : compromised: 0.7252, honest: 0.7492
Round 004: test acc mean=0.8086 ± 0.0213 | min=0.7590 max=0.8460
         : test loss mean=0.4489 ± 0.0296
         : individual accs = ['0.825439', '0.807427', '0.817214', '0.791883', '0.806878', '0.828821', '0.820961', '0.798580', '0.845951', '0.824468', '0.842657', '0.818667', '0.787326', '0.806034', '0.803381', '0.758952', '0.792028', '0.793988', '0.775281', '0.826468']
         : correct/total = [(941, 1140), (935, 1158), (921, 1127), (917, 1158), (915, 1134), (949, 1145), (940, 1145), (900, 1127), (961, 1136), (930, 1128), (964, 1144), (921, 1125), (907, 1152), (935, 1160), (903, 1124), (869, 1145), (914, 1154), (898, 1131), (897, 1157), (943, 1141)]
         : compromised: 0.8059, honest: 0.8150
Round 005: test acc mean=0.8498 ± 0.0218 | min=0.7917 max=0.8778
         : test loss mean=0.3498 ± 0.0275
         : individual accs = ['0.840351', '0.875648', '0.847382', '0.867012', '0.841270', '0.802620', '0.859389', '0.854481', '0.873239', '0.867021', '0.858392', '0.845333', '0.850694', '0.831897', '0.856762', '0.836681', '0.877816', '0.850575', '0.791703', '0.868536']
         : correct/total = [(958, 1140), (1014, 1158), (955, 1127), (1004, 1158), (954, 1134), (919, 1145), (984, 1145), (963, 1127), (992, 1136), (978, 1128), (982, 1144), (951, 1125), (980, 1152), (965, 1160), (963, 1124), (958, 1145), (1013, 1154), (962, 1131), (916, 1157), (991, 1141)]
         : compromised: 0.8470, honest: 0.8566
Round 006: test acc mean=0.8713 ± 0.0117 | min=0.8392 max=0.8891
         : test loss mean=0.3020 ± 0.0155
         : individual accs = ['0.876316', '0.879102', '0.865129', '0.885147', '0.863316', '0.889083', '0.877729', '0.866016', '0.879401', '0.880319', '0.882867', '0.872889', '0.867188', '0.860345', '0.865658', '0.856769', '0.883882', '0.860301', '0.839239', '0.875548']
         : correct/total = [(999, 1140), (1018, 1158), (975, 1127), (1025, 1158), (979, 1134), (1018, 1145), (1005, 1145), (976, 1127), (999, 1136), (993, 1128), (1010, 1144), (982, 1125), (999, 1152), (998, 1160), (973, 1124), (981, 1145), (1020, 1154), (973, 1131), (971, 1157), (999, 1141)]
         : compromised: 0.8695, honest: 0.8755
Round 007: test acc mean=0.8857 ± 0.0071 | min=0.8681 max=0.8955
         : test loss mean=0.2794 ± 0.0135
         : individual accs = ['0.885965', '0.895509', '0.882875', '0.883420', '0.885362', '0.895197', '0.892576', '0.888199', '0.889085', '0.895390', '0.888986', '0.889778', '0.878472', '0.874138', '0.887900', '0.868122', '0.889081', '0.885057', '0.874676', '0.884312']
         : correct/total = [(1010, 1140), (1037, 1158), (995, 1127), (1023, 1158), (1004, 1134), (1025, 1145), (1022, 1145), (1001, 1127), (1010, 1136), (1010, 1128), (1017, 1144), (1001, 1125), (1012, 1152), (1014, 1160), (998, 1124), (994, 1145), (1026, 1154), (1001, 1131), (1012, 1157), (1009, 1141)]
         : compromised: 0.8844, honest: 0.8888
Round 008: test acc mean=0.8892 ± 0.0082 | min=0.8738 max=0.9030
         : test loss mean=0.2703 ± 0.0143
         : individual accs = ['0.899123', '0.895509', '0.875776', '0.887737', '0.890653', '0.900437', '0.890830', '0.895297', '0.887324', '0.892730', '0.888986', '0.897778', '0.887153', '0.882759', '0.903025', '0.875109', '0.893414', '0.880637', '0.873812', '0.885188']
         : correct/total = [(1025, 1140), (1037, 1158), (987, 1127), (1028, 1158), (1010, 1134), (1031, 1145), (1020, 1145), (1009, 1127), (1008, 1136), (1007, 1128), (1017, 1144), (1010, 1125), (1022, 1152), (1024, 1160), (1015, 1124), (1002, 1145), (1031, 1154), (996, 1131), (1011, 1157), (1010, 1141)]
         : compromised: 0.8874, honest: 0.8934
Round 009: test acc mean=0.8933 ± 0.0097 | min=0.8626 max=0.9058
         : test loss mean=0.2603 ± 0.0182
         : individual accs = ['0.900000', '0.891192', '0.884650', '0.900691', '0.897707', '0.905677', '0.894323', '0.903283', '0.896127', '0.890071', '0.893357', '0.905778', '0.898438', '0.890517', '0.895018', '0.883843', '0.898614', '0.881521', '0.862576', '0.893076']
         : correct/total = [(1026, 1140), (1032, 1158), (997, 1127), (1043, 1158), (1018, 1134), (1037, 1145), (1024, 1145), (1018, 1127), (1018, 1136), (1004, 1128), (1022, 1144), (1019, 1125), (1035, 1152), (1033, 1160), (1006, 1124), (1012, 1145), (1037, 1154), (997, 1131), (998, 1157), (1019, 1141)]
         : compromised: 0.8917, honest: 0.8972
Round 010: test acc mean=0.8966 ± 0.0080 | min=0.8755 max=0.9075
         : test loss mean=0.2512 ± 0.0140
         : individual accs = ['0.900877', '0.896373', '0.885537', '0.906736', '0.898589', '0.905677', '0.899563', '0.902396', '0.892606', '0.900709', '0.895105', '0.900444', '0.901910', '0.900000', '0.907473', '0.889083', '0.897747', '0.883289', '0.875540', '0.893076']
         : correct/total = [(1027, 1140), (1038, 1158), (998, 1127), (1050, 1158), (1019, 1134), (1037, 1145), (1030, 1145), (1017, 1127), (1014, 1136), (1016, 1128), (1024, 1144), (1013, 1125), (1039, 1152), (1044, 1160), (1020, 1124), (1018, 1145), (1036, 1154), (999, 1131), (1013, 1157), (1019, 1141)]
         : compromised: 0.8955, honest: 0.8992

=== FINAL RESULTS ===
Dataset: celeba, Nodes: 20, Graph: erdos, Aggregation: balance
Attack: gaussian, 70.0% compromised
Final accuracy - Compromised: 0.8955, Honest: 0.8992
Overall test accuracy: mean=0.8966 ± 0.0080

=== BALANCE SUMMARY ===
Node 0: acceptance=0.333
Node 1: acceptance=0.400
Node 2: acceptance=0.375
Node 3: acceptance=0.429
Node 4: acceptance=0.333
Node 5: acceptance=0.200
Node 6: acceptance=0.250
Node 7: acceptance=0.273
Node 8: acceptance=0.143
Node 9: acceptance=0.364
Node 10: acceptance=0.250
Node 11: acceptance=0.250
Node 12: acceptance=0.333
Node 13: acceptance=0.111
Node 14: acceptance=0.286
Node 15: acceptance=0.333
Node 16: acceptance=0.286
Node 17: acceptance=0.500
Node 18: acceptance=0.250
Node 19: acceptance=0.200

=== PARALLEL EXECUTION TIME (realistic for distributed system) ===
  COMMUNICATION (max across nodes):
    - Full model transfer: 0.000s (0.0%)
  COMPUTATION (max across nodes):
    - Filtering: 0.038s (76.9%)
    - Aggregation: 0.011s (23.0%)
  TOTALS:
    - Total computation: 0.049s (100.0%)
    - Total communication: 0.000s (0.0%)
    - Total parallel time: 0.049s

=== PER-NODE AVERAGE TIME ===
  - Filtering: 0.027s
  - Aggregation: 0.004s
  - Model transfer: 0.000s
  - Total per node: 0.031s

=== TOTAL COMPUTATIONAL WORK (sum across all nodes) ===
  - Total filtering: 0.539s
  - Total aggregation: 0.077s
  - Total model transfer: 0.000s
  - Grand total: 0.617s
  - Mean acceptance rate: 0.295

BALANCE Algorithm Properties:
  - Model dimension: 2,219,692
  - No compression: Full parameter comparison
  - Theoretical complexity: O(deg(i)×d)
  - Approach: Full parameter filtering + averaging
