Device: cuda
Seed: 987654321
Looking for images in: /home/student.unimelb.edu.au/mrangwala/Projects/Sketchguard/leaf/data/celeba/data/raw/img_align_celeba
Loading 1 LEAF CelebA train files...
LEAF CelebA train: 9343 users (celebrities), 177457 samples
Looking for images in: /home/student.unimelb.edu.au/mrangwala/Projects/Sketchguard/leaf/data/celeba/data/raw/img_align_celeba
Loading 1 LEAF CelebA test files...
LEAF CelebA test: 9343 users (celebrities), 22831 samples
Found 9343 train users, 9343 test users, 9343 common users
User sample counts range: 31 (max) to 4 (min)
Distributed ALL 9343 users across 20 clients
Users per client: 467 (with 3 clients getting +1 user)
Train partition sizes: [8843, 8998, 8728, 9034, 8866, 8946, 8873, 8776, 8816, 8801, 8913, 8656, 9115, 8921, 8699, 8823, 8912, 8766, 9102, 8869]
Test partition sizes: [1140, 1158, 1127, 1158, 1134, 1145, 1145, 1127, 1136, 1128, 1144, 1125, 1152, 1160, 1124, 1145, 1154, 1131, 1157, 1141]
  Client 0: 8843 train samples, 2 unique classes
  Client 1: 8998 train samples, 2 unique classes
  Client 2: 8728 train samples, 2 unique classes
  Client 3: 9034 train samples, 2 unique classes
  Client 4: 8866 train samples, 2 unique classes
  Client 5: 8946 train samples, 2 unique classes
  Client 6: 8873 train samples, 2 unique classes
  Client 7: 8776 train samples, 2 unique classes
  Client 8: 8816 train samples, 2 unique classes
  Client 9: 8801 train samples, 2 unique classes
  Client 10: 8913 train samples, 2 unique classes
  Client 11: 8656 train samples, 2 unique classes
  Client 12: 9115 train samples, 2 unique classes
  Client 13: 8921 train samples, 2 unique classes
  Client 14: 8699 train samples, 2 unique classes
  Client 15: 8823 train samples, 2 unique classes
  Client 16: 8912 train samples, 2 unique classes
  Client 17: 8766 train samples, 2 unique classes
  Client 18: 9102 train samples, 2 unique classes
  Client 19: 8869 train samples, 2 unique classes
Will sample 4500 samples per client per epoch
Graph: fully, nodes: 20, edges: 190
Degree statistics: avg=19.00, min=19, max=19
Attack: Compromised 14/20 nodes: [1, 2, 3, 5, 6, 8, 11, 12, 13, 14, 15, 17, 18, 19]
Attack type: krum, lambda: 1.0
Model variant: baseline
Model parameters: 2,219,692
Sketchguard Node 0:
  Model dim: 2,219,692 → Sketch size: 350
  Compression ratio: 6342.0x
  Using model parameters for aggregation, sketches for filtering
Sketchguard Node 1:
  Model dim: 2,219,692 → Sketch size: 350
  Compression ratio: 6342.0x
  Using model parameters for aggregation, sketches for filtering
Sketchguard Node 2:
  Model dim: 2,219,692 → Sketch size: 350
  Compression ratio: 6342.0x
  Using model parameters for aggregation, sketches for filtering
Sketchguard Node 3:
  Model dim: 2,219,692 → Sketch size: 350
  Compression ratio: 6342.0x
  Using model parameters for aggregation, sketches for filtering
Sketchguard Node 4:
  Model dim: 2,219,692 → Sketch size: 350
  Compression ratio: 6342.0x
  Using model parameters for aggregation, sketches for filtering
Sketchguard Node 5:
  Model dim: 2,219,692 → Sketch size: 350
  Compression ratio: 6342.0x
  Using model parameters for aggregation, sketches for filtering
Sketchguard Node 6:
  Model dim: 2,219,692 → Sketch size: 350
  Compression ratio: 6342.0x
  Using model parameters for aggregation, sketches for filtering
Sketchguard Node 7:
  Model dim: 2,219,692 → Sketch size: 350
  Compression ratio: 6342.0x
  Using model parameters for aggregation, sketches for filtering
Sketchguard Node 8:
  Model dim: 2,219,692 → Sketch size: 350
  Compression ratio: 6342.0x
  Using model parameters for aggregation, sketches for filtering
Sketchguard Node 9:
  Model dim: 2,219,692 → Sketch size: 350
  Compression ratio: 6342.0x
  Using model parameters for aggregation, sketches for filtering
Sketchguard Node 10:
  Model dim: 2,219,692 → Sketch size: 350
  Compression ratio: 6342.0x
  Using model parameters for aggregation, sketches for filtering
Sketchguard Node 11:
  Model dim: 2,219,692 → Sketch size: 350
  Compression ratio: 6342.0x
  Using model parameters for aggregation, sketches for filtering
Sketchguard Node 12:
  Model dim: 2,219,692 → Sketch size: 350
  Compression ratio: 6342.0x
  Using model parameters for aggregation, sketches for filtering
Sketchguard Node 13:
  Model dim: 2,219,692 → Sketch size: 350
  Compression ratio: 6342.0x
  Using model parameters for aggregation, sketches for filtering
Sketchguard Node 14:
  Model dim: 2,219,692 → Sketch size: 350
  Compression ratio: 6342.0x
  Using model parameters for aggregation, sketches for filtering
Sketchguard Node 15:
  Model dim: 2,219,692 → Sketch size: 350
  Compression ratio: 6342.0x
  Using model parameters for aggregation, sketches for filtering
Sketchguard Node 16:
  Model dim: 2,219,692 → Sketch size: 350
  Compression ratio: 6342.0x
  Using model parameters for aggregation, sketches for filtering
Sketchguard Node 17:
  Model dim: 2,219,692 → Sketch size: 350
  Compression ratio: 6342.0x
  Using model parameters for aggregation, sketches for filtering
Sketchguard Node 18:
  Model dim: 2,219,692 → Sketch size: 350
  Compression ratio: 6342.0x
  Using model parameters for aggregation, sketches for filtering
Sketchguard Node 19:
  Model dim: 2,219,692 → Sketch size: 350
  Compression ratio: 6342.0x
  Using model parameters for aggregation, sketches for filtering
Sketchguard ALGORITHM (Sketch-based Filtering + State Aggregation)
  - Model dimension: 2,219,692 parameters
  - Config: SketchguardConfig(gamma=2, kappa=1, alpha=0.5, min_neighbors=1, sketch_size=350, network_seed=987654321, attack_detection_window=5)
  - Sketch size: 350
  - Compression ratio: 6342.0x
  - Complexity: O(d + N×k) = O(2,219,692 + 20×350)
  - Theoretical speedup vs BALANCE: 19.9x
Initial test acc across nodes: mean=0.4978 ± 0.0208
Round 001: test acc mean=0.6682 ± 0.0471 | min=0.5838 max=0.7368
         : test loss mean=0.6813 ± 0.0035
         : individual accs = ['0.707018', '0.642487', '0.604259', '0.665803', '0.583774', '0.675983', '0.683843', '0.606034', '0.736796', '0.714539', '0.698427', '0.720000', '0.681424', '0.712069', '0.596975', '0.630568', '0.714905', '0.685234', '0.701815', '0.602980']
         : correct/total = [(806, 1140), (744, 1158), (681, 1127), (771, 1158), (662, 1134), (774, 1145), (783, 1145), (683, 1127), (837, 1136), (806, 1128), (799, 1144), (810, 1125), (785, 1152), (826, 1160), (671, 1124), (722, 1145), (825, 1154), (775, 1131), (812, 1157), (688, 1141)]
         : compromised: 0.6672, honest: 0.6708
         : sketchguard stats = ['Node 0: acc_rate=0.263', 'Node 1: acc_rate=0.316', 'Node 2: acc_rate=0.316']...
Round 002: test acc mean=0.6324 ± 0.0482 | min=0.5258 max=0.7019
         : test loss mean=0.6731 ± 0.0070
         : individual accs = ['0.648246', '0.645078', '0.642413', '0.664940', '0.580247', '0.547598', '0.613974', '0.642413', '0.578345', '0.665780', '0.684441', '0.633778', '0.686632', '0.612069', '0.525801', '0.570306', '0.701906', '0.649867', '0.683665', '0.670465']
         : correct/total = [(739, 1140), (747, 1158), (724, 1127), (770, 1158), (658, 1134), (627, 1145), (703, 1145), (724, 1127), (657, 1136), (751, 1128), (783, 1144), (713, 1125), (791, 1152), (710, 1160), (591, 1124), (653, 1145), (810, 1154), (735, 1131), (791, 1157), (765, 1141)]
         : compromised: 0.6232, honest: 0.6538
         : sketchguard stats = ['Node 0: acc_rate=0.263', 'Node 1: acc_rate=0.316', 'Node 2: acc_rate=0.316']...
Round 003: test acc mean=0.6904 ± 0.0256 | min=0.6335 max=0.7409
         : test loss mean=0.6254 ± 0.0161
         : individual accs = ['0.678947', '0.692573', '0.696539', '0.701209', '0.668430', '0.709170', '0.703930', '0.692990', '0.704225', '0.738475', '0.701923', '0.685333', '0.660590', '0.698276', '0.633452', '0.646288', '0.740901', '0.671972', '0.700086', '0.683611']
         : correct/total = [(774, 1140), (802, 1158), (785, 1127), (812, 1158), (758, 1134), (812, 1145), (806, 1145), (781, 1127), (800, 1136), (833, 1128), (803, 1144), (771, 1125), (761, 1152), (810, 1160), (712, 1124), (740, 1145), (855, 1154), (760, 1131), (810, 1157), (780, 1141)]
         : compromised: 0.6848, honest: 0.7036
         : sketchguard stats = ['Node 0: acc_rate=0.263', 'Node 1: acc_rate=0.316', 'Node 2: acc_rate=0.316']...
Round 004: test acc mean=0.7771 ± 0.0128 | min=0.7407 max=0.7988
         : test loss mean=0.4981 ± 0.0186
         : individual accs = ['0.786842', '0.781520', '0.779947', '0.774611', '0.789242', '0.776419', '0.767686', '0.766637', '0.764965', '0.798759', '0.798077', '0.790222', '0.776910', '0.773276', '0.777580', '0.765066', '0.783362', '0.771883', '0.740709', '0.777388']
         : correct/total = [(897, 1140), (905, 1158), (879, 1127), (897, 1158), (895, 1134), (889, 1145), (879, 1145), (864, 1127), (869, 1136), (901, 1128), (913, 1144), (889, 1125), (895, 1152), (897, 1160), (874, 1124), (876, 1145), (904, 1154), (873, 1131), (857, 1157), (887, 1141)]
         : compromised: 0.7727, honest: 0.7872
         : sketchguard stats = ['Node 0: acc_rate=0.263', 'Node 1: acc_rate=0.316', 'Node 2: acc_rate=0.316']...
Round 005: test acc mean=0.8303 ± 0.0204 | min=0.7831 max=0.8644
         : test loss mean=0.3812 ± 0.0229
         : individual accs = ['0.819298', '0.854922', '0.828749', '0.831606', '0.820988', '0.786900', '0.842795', '0.832298', '0.841549', '0.864362', '0.842657', '0.816889', '0.830729', '0.822414', '0.836299', '0.808734', '0.845754', '0.838196', '0.783060', '0.857143']
         : correct/total = [(934, 1140), (990, 1158), (934, 1127), (963, 1158), (931, 1134), (901, 1145), (965, 1145), (938, 1127), (956, 1136), (975, 1128), (964, 1144), (919, 1125), (957, 1152), (954, 1160), (940, 1124), (926, 1145), (976, 1154), (948, 1131), (906, 1157), (978, 1141)]
         : compromised: 0.8271, honest: 0.8376
         : sketchguard stats = ['Node 0: acc_rate=0.263', 'Node 1: acc_rate=0.316', 'Node 2: acc_rate=0.316']...
Round 006: test acc mean=0.8637 ± 0.0139 | min=0.8237 max=0.8837
         : test loss mean=0.3163 ± 0.0162
         : individual accs = ['0.869298', '0.871330', '0.860692', '0.874784', '0.844797', '0.879476', '0.859389', '0.860692', '0.871479', '0.876773', '0.883741', '0.872000', '0.855903', '0.859483', '0.865658', '0.845415', '0.873484', '0.853227', '0.823682', '0.872042']
         : correct/total = [(991, 1140), (1009, 1158), (970, 1127), (1013, 1158), (958, 1134), (1007, 1145), (984, 1145), (970, 1127), (990, 1136), (989, 1128), (1011, 1144), (981, 1125), (986, 1152), (997, 1160), (973, 1124), (968, 1145), (1008, 1154), (965, 1131), (953, 1157), (995, 1141)]
         : compromised: 0.8618, honest: 0.8681
         : sketchguard stats = ['Node 0: acc_rate=0.263', 'Node 1: acc_rate=0.316', 'Node 2: acc_rate=0.316']...
Round 007: test acc mean=0.8817 ± 0.0091 | min=0.8594 max=0.8969
         : test loss mean=0.2871 ± 0.0153
         : individual accs = ['0.878070', '0.891192', '0.878438', '0.878238', '0.870370', '0.896943', '0.888210', '0.884650', '0.887324', '0.886525', '0.892483', '0.883556', '0.876736', '0.881034', '0.886121', '0.859389', '0.887348', '0.875332', '0.864304', '0.886941']
         : correct/total = [(1001, 1140), (1032, 1158), (990, 1127), (1017, 1158), (987, 1134), (1027, 1145), (1017, 1145), (997, 1127), (1008, 1136), (1000, 1128), (1021, 1144), (994, 1125), (1010, 1152), (1022, 1160), (996, 1124), (984, 1145), (1024, 1154), (990, 1131), (1000, 1157), (1012, 1141)]
         : compromised: 0.8810, honest: 0.8832
         : sketchguard stats = ['Node 0: acc_rate=0.263', 'Node 1: acc_rate=0.316', 'Node 2: acc_rate=0.316']...
Round 008: test acc mean=0.8854 ± 0.0087 | min=0.8696 max=0.8986
         : test loss mean=0.2774 ± 0.0150
         : individual accs = ['0.892982', '0.894646', '0.869565', '0.886010', '0.877425', '0.897817', '0.890830', '0.894410', '0.876761', '0.888298', '0.888112', '0.893333', '0.886285', '0.880172', '0.898577', '0.870742', '0.887348', '0.880637', '0.871219', '0.883436']
         : correct/total = [(1018, 1140), (1036, 1158), (980, 1127), (1026, 1158), (995, 1134), (1028, 1145), (1020, 1145), (1008, 1127), (996, 1136), (1002, 1128), (1016, 1144), (1005, 1125), (1021, 1152), (1021, 1160), (1010, 1124), (997, 1145), (1024, 1154), (996, 1131), (1008, 1157), (1008, 1141)]
         : compromised: 0.8843, honest: 0.8881
         : sketchguard stats = ['Node 0: acc_rate=0.263', 'Node 1: acc_rate=0.316', 'Node 2: acc_rate=0.316']...
Round 009: test acc mean=0.8916 ± 0.0110 | min=0.8522 max=0.9033
         : test loss mean=0.2643 ± 0.0191
         : individual accs = ['0.900877', '0.896373', '0.881988', '0.900691', '0.890653', '0.900437', '0.895197', '0.903283', '0.891725', '0.894504', '0.892483', '0.900444', '0.892361', '0.891379', '0.896797', '0.880349', '0.893414', '0.881521', '0.852204', '0.894829']
         : correct/total = [(1027, 1140), (1038, 1158), (994, 1127), (1043, 1158), (1010, 1134), (1031, 1145), (1025, 1145), (1018, 1127), (1013, 1136), (1009, 1128), (1021, 1144), (1013, 1125), (1028, 1152), (1034, 1160), (1008, 1124), (1008, 1145), (1031, 1154), (997, 1131), (986, 1157), (1021, 1141)]
         : compromised: 0.8897, honest: 0.8959
         : sketchguard stats = ['Node 0: acc_rate=0.263', 'Node 1: acc_rate=0.316', 'Node 2: acc_rate=0.316']...
Round 010: test acc mean=0.8970 ± 0.0071 | min=0.8799 max=0.9061
         : test loss mean=0.2531 ± 0.0151
         : individual accs = ['0.906140', '0.898100', '0.886424', '0.904145', '0.895062', '0.902183', '0.898690', '0.902396', '0.897007', '0.901596', '0.901224', '0.900444', '0.899306', '0.894828', '0.905694', '0.888210', '0.901213', '0.885057', '0.879862', '0.892200']
         : correct/total = [(1033, 1140), (1040, 1158), (999, 1127), (1047, 1158), (1015, 1134), (1033, 1145), (1029, 1145), (1017, 1127), (1019, 1136), (1017, 1128), (1031, 1144), (1013, 1125), (1036, 1152), (1038, 1160), (1018, 1124), (1017, 1145), (1040, 1154), (1001, 1131), (1018, 1157), (1018, 1141)]
         : compromised: 0.8952, honest: 0.9013
         : sketchguard stats = ['Node 0: acc_rate=0.263', 'Node 1: acc_rate=0.316', 'Node 2: acc_rate=0.316']...

=== FINAL RESULTS ===
Dataset: celeba, Nodes: 20, Graph: fully, Aggregation: sketchguard
Attack: krum, 70.0% compromised
Final accuracy - Compromised: 0.8952, Honest: 0.9013
Overall test accuracy: mean=0.8970 ± 0.0071

=== Sketchguard SUMMARY ===
Node 0: acceptance=0.263
Node 1: acceptance=0.316
Node 2: acceptance=0.316
Node 3: acceptance=0.316
Node 4: acceptance=0.263
Node 5: acceptance=0.316
Node 6: acceptance=0.316
Node 7: acceptance=0.263
Node 8: acceptance=0.316
Node 9: acceptance=0.263
Node 10: acceptance=0.263
Node 11: acceptance=0.316
Node 12: acceptance=0.316
Node 13: acceptance=0.316
Node 14: acceptance=0.316
Node 15: acceptance=0.316
Node 16: acceptance=0.263
Node 17: acceptance=0.316
Node 18: acceptance=0.316
Node 19: acceptance=0.316

=== PARALLEL EXECUTION TIME (realistic for distributed system) ===
  COMMUNICATION (max across nodes):
    - Sketch transfer: 0.000s (0.0%)
    - Model fetch (accepted): 0.000s (0.0%)
  COMPUTATION (max across nodes):
    - Sketching: 0.747s (97.3%)
    - Filtering: 0.001s (0.2%)
    - Aggregation: 0.019s (2.5%)
  TOTALS:
    - Total computation: 0.768s (100.0%)
    - Total communication: 0.000s (0.0%)
    - Total parallel time: 0.768s

=== PER-NODE AVERAGE TIME ===
  - Sketching: 0.670s
  - Filtering: 0.001s
  - Aggregation: 0.009s
  - Sketch transfer: 0.000s
  - Model fetch: 0.000s
  - Total per node: 0.681s

=== TOTAL COMPUTATIONAL WORK (sum across all nodes) ===
  - Total sketching: 13.406s
  - Total filtering: 0.020s
  - Total aggregation: 0.188s
  - Total sketch transfer: 0.000s
  - Total model fetch: 0.000s
  - Grand total: 13.614s
  - Mean acceptance rate: 0.300

Sketchguard Algorithm Properties:
  - Original dimension: 2,219,692
  - Sketch size: 350
  - Compression ratio: 19.9x
  - Single repetition: No repetitions needed
  - Theoretical complexity: O(d + N×k)
  - Approach: Sketch filtering + state aggregation
