Device: cuda
Seed: 987654321
Looking for images in: /home/student.unimelb.edu.au/mrangwala/Projects/Sketchguard/leaf/data/celeba/data/raw/img_align_celeba
Loading 1 LEAF CelebA train files...
LEAF CelebA train: 9343 users (celebrities), 177457 samples
Looking for images in: /home/student.unimelb.edu.au/mrangwala/Projects/Sketchguard/leaf/data/celeba/data/raw/img_align_celeba
Loading 1 LEAF CelebA test files...
LEAF CelebA test: 9343 users (celebrities), 22831 samples
Found 9343 train users, 9343 test users, 9343 common users
User sample counts range: 31 (max) to 4 (min)
Distributed ALL 9343 users across 20 clients
Users per client: 467 (with 3 clients getting +1 user)
Train partition sizes: [8843, 8998, 8728, 9034, 8866, 8946, 8873, 8776, 8816, 8801, 8913, 8656, 9115, 8921, 8699, 8823, 8912, 8766, 9102, 8869]
Test partition sizes: [1140, 1158, 1127, 1158, 1134, 1145, 1145, 1127, 1136, 1128, 1144, 1125, 1152, 1160, 1124, 1145, 1154, 1131, 1157, 1141]
  Client 0: 8843 train samples, 2 unique classes
  Client 1: 8998 train samples, 2 unique classes
  Client 2: 8728 train samples, 2 unique classes
  Client 3: 9034 train samples, 2 unique classes
  Client 4: 8866 train samples, 2 unique classes
  Client 5: 8946 train samples, 2 unique classes
  Client 6: 8873 train samples, 2 unique classes
  Client 7: 8776 train samples, 2 unique classes
  Client 8: 8816 train samples, 2 unique classes
  Client 9: 8801 train samples, 2 unique classes
  Client 10: 8913 train samples, 2 unique classes
  Client 11: 8656 train samples, 2 unique classes
  Client 12: 9115 train samples, 2 unique classes
  Client 13: 8921 train samples, 2 unique classes
  Client 14: 8699 train samples, 2 unique classes
  Client 15: 8823 train samples, 2 unique classes
  Client 16: 8912 train samples, 2 unique classes
  Client 17: 8766 train samples, 2 unique classes
  Client 18: 9102 train samples, 2 unique classes
  Client 19: 8869 train samples, 2 unique classes
Will sample 4500 samples per client per epoch
Graph: erdos, nodes: 20, edges: 99
Degree statistics: avg=9.90, min=7, max=14
Attack: Compromised 6/20 nodes: [5, 12, 13, 14, 17, 18]
Attack type: backdoor, lambda: 1.0
Backdoor target label: 0, trigger size: 8
Model variant: baseline
Model parameters: 2,219,692
Initial test acc across nodes: mean=0.4978 ± 0.0208
Backdoor attack: Created poisoned datasets for 6 compromised nodes
Round 001: test acc mean=0.7026 ± 0.0634 | min=0.4551 max=0.7616
         : test loss mean=1907.3493 ± 8311.3908
         : individual accs = ['0.671930', '0.661485', '0.678793', '0.721071', '0.693122', '0.761572', '0.732751', '0.723159', '0.455106', '0.679078', '0.727273', '0.713778', '0.756944', '0.739655', '0.722420', '0.752838', '0.711438', '0.686118', '0.738980', '0.723926']
         : correct/total = [(766, 1140), (766, 1158), (765, 1127), (835, 1158), (786, 1134), (872, 1145), (839, 1145), (815, 1127), (517, 1136), (766, 1128), (832, 1144), (803, 1125), (872, 1152), (858, 1160), (812, 1124), (862, 1145), (821, 1154), (776, 1131), (855, 1157), (826, 1141)]
         : compromised: 0.7343, honest: 0.6890
Round 002: test acc mean=0.7184 ± 0.1296 | min=0.5069 max=0.8715
         : test loss mean=nan ± nan
         : individual accs = ['0.754386', '0.768566', '0.787933', '0.848014', '0.791887', '0.514410', '0.807860', '0.803904', '0.562500', '0.793440', '0.871503', '0.816889', '0.522569', '0.506897', '0.517794', '0.805240', '0.790295', '0.791335', '0.522040', '0.789658']
         : correct/total = [(860, 1140), (890, 1158), (888, 1127), (982, 1158), (898, 1134), (589, 1145), (925, 1145), (906, 1127), (639, 1136), (895, 1128), (997, 1144), (919, 1125), (602, 1152), (588, 1160), (582, 1124), (922, 1145), (912, 1154), (895, 1131), (604, 1157), (901, 1141)]
         : compromised: 0.5625, honest: 0.7851
Round 003: test acc mean=0.7549 ± 0.1518 | min=0.5069 max=0.8777
         : test loss mean=nan ± nan
         : individual accs = ['0.817544', '0.870466', '0.833185', '0.842832', '0.849206', '0.514410', '0.877729', '0.861579', '0.562500', '0.867021', '0.863636', '0.848000', '0.522569', '0.506897', '0.517794', '0.843668', '0.855286', '0.847922', '0.522040', '0.872918']
         : correct/total = [(932, 1140), (1008, 1158), (939, 1127), (976, 1158), (963, 1134), (589, 1145), (1005, 1145), (971, 1127), (639, 1136), (978, 1128), (988, 1144), (954, 1125), (602, 1152), (588, 1160), (582, 1124), (966, 1145), (987, 1154), (959, 1131), (604, 1157), (996, 1141)]
         : compromised: 0.5719, honest: 0.8333
Round 004: test acc mean=0.7700 ± 0.1614 | min=0.5069 max=0.8925
         : test loss mean=nan ± nan
         : individual accs = ['0.877193', '0.875648', '0.866016', '0.875648', '0.882716', '0.514410', '0.887336', '0.872227', '0.562500', '0.858156', '0.892483', '0.890667', '0.522569', '0.506897', '0.517794', '0.850655', '0.868284', '0.870911', '0.522040', '0.885188']
         : correct/total = [(1000, 1140), (1014, 1158), (976, 1127), (1014, 1158), (1001, 1134), (589, 1145), (1016, 1145), (983, 1127), (639, 1136), (968, 1128), (1021, 1144), (1002, 1125), (602, 1152), (588, 1160), (582, 1124), (974, 1145), (1002, 1154), (985, 1131), (604, 1157), (1010, 1141)]
         : compromised: 0.5758, honest: 0.8532
Round 005: test acc mean=0.7758 ± 0.1657 | min=0.5069 max=0.9033
         : test loss mean=nan ± nan
         : individual accs = ['0.820175', '0.894646', '0.878438', '0.903282', '0.888889', '0.514410', '0.894323', '0.891748', '0.562500', '0.890957', '0.891608', '0.896889', '0.522569', '0.506897', '0.517794', '0.870742', '0.885615', '0.878868', '0.522040', '0.883436']
         : correct/total = [(935, 1140), (1036, 1158), (990, 1127), (1046, 1158), (1008, 1134), (589, 1145), (1024, 1145), (1005, 1127), (639, 1136), (1005, 1128), (1020, 1144), (1009, 1125), (602, 1152), (588, 1160), (582, 1124), (997, 1145), (1022, 1154), (994, 1131), (604, 1157), (1008, 1141)]
         : compromised: 0.5771, honest: 0.8609
Round 006: test acc mean=0.7805 ± 0.1681 | min=0.5069 max=0.9073
         : test loss mean=nan ± nan
         : individual accs = ['0.891228', '0.892919', '0.876664', '0.899827', '0.884480', '0.514410', '0.888210', '0.897072', '0.562500', '0.892730', '0.907343', '0.890667', '0.522569', '0.506897', '0.517794', '0.877729', '0.892548', '0.885057', '0.522040', '0.886941']
         : correct/total = [(1016, 1140), (1034, 1158), (988, 1127), (1042, 1158), (1003, 1134), (589, 1145), (1017, 1145), (1011, 1127), (639, 1136), (1007, 1128), (1038, 1144), (1002, 1125), (602, 1152), (588, 1160), (582, 1124), (1005, 1145), (1030, 1154), (1001, 1131), (604, 1157), (1012, 1141)]
         : compromised: 0.5781, honest: 0.8672
Round 007: test acc mean=0.7858 ± 0.1716 | min=0.5069 max=0.9111
         : test loss mean=nan ± nan
         : individual accs = ['0.902632', '0.897237', '0.894410', '0.902418', '0.901235', '0.514410', '0.896070', '0.903283', '0.562500', '0.906915', '0.902972', '0.911111', '0.522569', '0.506897', '0.517794', '0.875983', '0.896880', '0.889478', '0.522040', '0.889571']
         : correct/total = [(1029, 1140), (1039, 1158), (1008, 1127), (1045, 1158), (1022, 1134), (589, 1145), (1026, 1145), (1018, 1127), (639, 1136), (1023, 1128), (1033, 1144), (1025, 1125), (602, 1152), (588, 1160), (582, 1124), (1003, 1145), (1035, 1154), (1006, 1131), (604, 1157), (1015, 1141)]
         : compromised: 0.5789, honest: 0.8745
Round 008: test acc mean=0.7868 ± 0.1723 | min=0.5069 max=0.9143
         : test loss mean=nan ± nan
         : individual accs = ['0.903509', '0.907599', '0.893523', '0.903282', '0.895944', '0.514410', '0.905677', '0.905945', '0.562500', '0.907801', '0.914336', '0.906667', '0.522569', '0.506897', '0.517794', '0.876856', '0.902080', '0.880637', '0.522040', '0.886065']
         : correct/total = [(1030, 1140), (1051, 1158), (1007, 1127), (1046, 1158), (1016, 1134), (589, 1145), (1037, 1145), (1021, 1127), (639, 1136), (1024, 1128), (1046, 1144), (1020, 1125), (602, 1152), (588, 1160), (582, 1124), (1004, 1145), (1041, 1154), (996, 1131), (604, 1157), (1011, 1141)]
         : compromised: 0.5774, honest: 0.8766
Round 009: test acc mean=0.7844 ± 0.1707 | min=0.5069 max=0.9104
         : test loss mean=nan ± nan
         : individual accs = ['0.897368', '0.905872', '0.887311', '0.905009', '0.900353', '0.514410', '0.894323', '0.910382', '0.562500', '0.897163', '0.901224', '0.906667', '0.522569', '0.506897', '0.517794', '0.882096', '0.887348', '0.871795', '0.522040', '0.893953']
         : correct/total = [(1023, 1140), (1049, 1158), (1000, 1127), (1048, 1158), (1021, 1134), (589, 1145), (1024, 1145), (1026, 1127), (639, 1136), (1012, 1128), (1031, 1144), (1020, 1125), (602, 1152), (588, 1160), (582, 1124), (1010, 1145), (1024, 1154), (986, 1131), (604, 1157), (1020, 1141)]
         : compromised: 0.5759, honest: 0.8737
Round 010: test acc mean=0.7876 ± 0.1728 | min=0.5069 max=0.9200
         : test loss mean=nan ± nan
         : individual accs = ['0.895614', '0.898100', '0.886424', '0.899827', '0.895062', '0.514410', '0.904803', '0.912156', '0.562500', '0.901596', '0.905594', '0.920000', '0.522569', '0.506897', '0.517794', '0.895197', '0.905546', '0.890363', '0.522040', '0.895706']
         : correct/total = [(1021, 1140), (1040, 1158), (999, 1127), (1042, 1158), (1015, 1134), (589, 1145), (1036, 1145), (1028, 1127), (639, 1136), (1017, 1128), (1036, 1144), (1035, 1125), (602, 1152), (588, 1160), (582, 1124), (1025, 1145), (1045, 1154), (1007, 1131), (604, 1157), (1022, 1141)]
         : compromised: 0.5790, honest: 0.8770

=== FINAL RESULTS ===
Dataset: celeba, Nodes: 20, Graph: erdos, Aggregation: krum
Attack: backdoor, 30.0% compromised
Final accuracy - Compromised: 0.5790, Honest: 0.8770
Overall test accuracy: mean=0.7876 ± 0.1728

=== BACKDOOR ATTACK SUCCESS RATE (ASR) ===
Target label: 0
Trigger size: 8x8
Overall ASR: 0.6803 ± 0.2101
Honest nodes ASR: 0.5747 ± 0.1198
Compromised nodes ASR: 0.9268 ± 0.1638
Note: Higher ASR indicates more successful backdoor attack
