Device: cuda
Seed: 987654321
Looking for images in: /home/student.unimelb.edu.au/mrangwala/Projects/Sketchguard/leaf/data/celeba/data/raw/img_align_celeba
Loading 1 LEAF CelebA train files...
LEAF CelebA train: 9343 users (celebrities), 177457 samples
Looking for images in: /home/student.unimelb.edu.au/mrangwala/Projects/Sketchguard/leaf/data/celeba/data/raw/img_align_celeba
Loading 1 LEAF CelebA test files...
LEAF CelebA test: 9343 users (celebrities), 22831 samples
Found 9343 train users, 9343 test users, 9343 common users
User sample counts range: 31 (max) to 4 (min)
Distributed ALL 9343 users across 20 clients
Users per client: 467 (with 3 clients getting +1 user)
Train partition sizes: [8843, 8998, 8728, 9034, 8866, 8946, 8873, 8776, 8816, 8801, 8913, 8656, 9115, 8921, 8699, 8823, 8912, 8766, 9102, 8869]
Test partition sizes: [1140, 1158, 1127, 1158, 1134, 1145, 1145, 1127, 1136, 1128, 1144, 1125, 1152, 1160, 1124, 1145, 1154, 1131, 1157, 1141]
  Client 0: 8843 train samples, 2 unique classes
  Client 1: 8998 train samples, 2 unique classes
  Client 2: 8728 train samples, 2 unique classes
  Client 3: 9034 train samples, 2 unique classes
  Client 4: 8866 train samples, 2 unique classes
  Client 5: 8946 train samples, 2 unique classes
  Client 6: 8873 train samples, 2 unique classes
  Client 7: 8776 train samples, 2 unique classes
  Client 8: 8816 train samples, 2 unique classes
  Client 9: 8801 train samples, 2 unique classes
  Client 10: 8913 train samples, 2 unique classes
  Client 11: 8656 train samples, 2 unique classes
  Client 12: 9115 train samples, 2 unique classes
  Client 13: 8921 train samples, 2 unique classes
  Client 14: 8699 train samples, 2 unique classes
  Client 15: 8823 train samples, 2 unique classes
  Client 16: 8912 train samples, 2 unique classes
  Client 17: 8766 train samples, 2 unique classes
  Client 18: 9102 train samples, 2 unique classes
  Client 19: 8869 train samples, 2 unique classes
Will sample 4500 samples per client per epoch
Graph: ring, nodes: 20, edges: 20
Degree statistics: avg=2.00, min=2, max=2
Attack: Compromised 4/20 nodes: [5, 12, 13, 17]
Attack type: directed_deviation, lambda: 1.0
Model variant: baseline
Model parameters: 2,219,692
BALANCE algorithm:
Balance Config: BALANCEConfig(gamma=2, kappa=1, alpha=0.5, min_neighbors=1)
  - Model dimension: 2,219,692 parameters
  - Complexity: O(N×d) = O(20×2,219,692)
Initial test acc across nodes: mean=0.4978 ± 0.0208
Round 001: test acc mean=0.6380 ± 0.0480 | min=0.5404 max=0.7127
         : test loss mean=0.6780 ± 0.0067
         : individual accs = ['0.605263', '0.677893', '0.663709', '0.607945', '0.640212', '0.551092', '0.555459', '0.540373', '0.712148', '0.658688', '0.680070', '0.672889', '0.712674', '0.657759', '0.630783', '0.644541', '0.629983', '0.666667', '0.656007', '0.596845']
         : correct/total = [(690, 1140), (785, 1158), (748, 1127), (704, 1158), (726, 1134), (631, 1145), (636, 1145), (609, 1127), (809, 1136), (743, 1128), (778, 1144), (757, 1125), (821, 1152), (763, 1160), (709, 1124), (738, 1145), (727, 1154), (754, 1131), (759, 1157), (681, 1141)]
         : compromised: 0.6470, honest: 0.6358
Round 002: test acc mean=0.7224 ± 0.0345 | min=0.6507 max=0.7704
         : test loss mean=0.6028 ± 0.0439
         : individual accs = ['0.692982', '0.679620', '0.691216', '0.690846', '0.698413', '0.650655', '0.727511', '0.689441', '0.745599', '0.700355', '0.756119', '0.754667', '0.768229', '0.762931', '0.764235', '0.747598', '0.770364', '0.709991', '0.740709', '0.707274']
         : correct/total = [(790, 1140), (787, 1158), (779, 1127), (800, 1158), (792, 1134), (745, 1145), (833, 1145), (777, 1127), (847, 1136), (790, 1128), (865, 1144), (849, 1125), (885, 1152), (885, 1160), (859, 1124), (856, 1145), (889, 1154), (803, 1131), (857, 1157), (807, 1141)]
         : compromised: 0.7230, honest: 0.7223
Round 003: test acc mean=0.7884 ± 0.0384 | min=0.7188 max=0.8458
         : test loss mean=0.4841 ± 0.0803
         : individual accs = ['0.744737', '0.739206', '0.747116', '0.759067', '0.778660', '0.728384', '0.799127', '0.777285', '0.799296', '0.809397', '0.845280', '0.835556', '0.835938', '0.766379', '0.807829', '0.813100', '0.845754', '0.718833', '0.806396', '0.810692']
         : correct/total = [(849, 1140), (856, 1158), (842, 1127), (879, 1158), (883, 1134), (834, 1145), (915, 1145), (876, 1127), (908, 1136), (913, 1128), (967, 1144), (940, 1125), (963, 1152), (889, 1160), (908, 1124), (931, 1145), (976, 1154), (813, 1131), (933, 1157), (925, 1141)]
         : compromised: 0.7624, honest: 0.7949
Round 004: test acc mean=0.8358 ± 0.0329 | min=0.7462 max=0.8733
         : test loss mean=0.3915 ± 0.0785
         : individual accs = ['0.809649', '0.808290', '0.746229', '0.814335', '0.824515', '0.826201', '0.855895', '0.839397', '0.847711', '0.861702', '0.873252', '0.869333', '0.863715', '0.852586', '0.867438', '0.851528', '0.855286', '0.765694', '0.834054', '0.849255']
         : correct/total = [(923, 1140), (936, 1158), (841, 1127), (943, 1158), (935, 1134), (946, 1145), (980, 1145), (946, 1127), (963, 1136), (972, 1128), (999, 1144), (978, 1125), (995, 1152), (989, 1160), (975, 1124), (975, 1145), (987, 1154), (866, 1131), (965, 1157), (969, 1141)]
         : compromised: 0.8270, honest: 0.8380
Round 005: test acc mean=0.8531 ± 0.0253 | min=0.7950 max=0.8934
         : test loss mean=0.3494 ± 0.0617
         : individual accs = ['0.821053', '0.854059', '0.795031', '0.854059', '0.850970', '0.834934', '0.869869', '0.867791', '0.832746', '0.843085', '0.893357', '0.870222', '0.877604', '0.872414', '0.877224', '0.862882', '0.888215', '0.827586', '0.813310', '0.856266']
         : correct/total = [(936, 1140), (989, 1158), (896, 1127), (989, 1158), (965, 1134), (956, 1145), (996, 1145), (978, 1127), (946, 1136), (951, 1128), (1022, 1144), (979, 1125), (1011, 1152), (1012, 1160), (986, 1124), (988, 1145), (1025, 1154), (936, 1131), (941, 1157), (977, 1141)]
         : compromised: 0.8531, honest: 0.8531
Round 006: test acc mean=0.8761 ± 0.0159 | min=0.8214 max=0.8943
         : test loss mean=0.3096 ± 0.0490
         : individual accs = ['0.864035', '0.878238', '0.864241', '0.881693', '0.873898', '0.878603', '0.882096', '0.880213', '0.882923', '0.866135', '0.890734', '0.890667', '0.883681', '0.887931', '0.892349', '0.870742', '0.894281', '0.821397', '0.859983', '0.877301']
         : correct/total = [(985, 1140), (1017, 1158), (974, 1127), (1021, 1158), (991, 1134), (1006, 1145), (1010, 1145), (992, 1127), (1003, 1136), (977, 1128), (1019, 1144), (1002, 1125), (1018, 1152), (1030, 1160), (1003, 1124), (997, 1145), (1032, 1154), (929, 1131), (995, 1157), (1001, 1141)]
         : compromised: 0.8679, honest: 0.8781
Round 007: test acc mean=0.8852 ± 0.0117 | min=0.8532 max=0.9111
         : test loss mean=0.2882 ± 0.0348
         : individual accs = ['0.871930', '0.887737', '0.874002', '0.891192', '0.874780', '0.882096', '0.888210', '0.888199', '0.885563', '0.890957', '0.896853', '0.911111', '0.890625', '0.887931', '0.895018', '0.878603', '0.892548', '0.853227', '0.872947', '0.889571']
         : correct/total = [(994, 1140), (1028, 1158), (985, 1127), (1032, 1158), (992, 1134), (1010, 1145), (1017, 1145), (1001, 1127), (1006, 1136), (1005, 1128), (1026, 1144), (1025, 1125), (1026, 1152), (1030, 1160), (1006, 1124), (1006, 1145), (1030, 1154), (965, 1131), (1010, 1157), (1015, 1141)]
         : compromised: 0.8785, honest: 0.8868
Round 008: test acc mean=0.8872 ± 0.0103 | min=0.8706 max=0.9058
         : test loss mean=0.2731 ± 0.0206
         : individual accs = ['0.885965', '0.887737', '0.879326', '0.879102', '0.879189', '0.898690', '0.889083', '0.889086', '0.870599', '0.870567', '0.893357', '0.905778', '0.889757', '0.894828', '0.903025', '0.887336', '0.902946', '0.882405', '0.872083', '0.882559']
         : correct/total = [(1010, 1140), (1028, 1158), (991, 1127), (1018, 1158), (997, 1134), (1029, 1145), (1018, 1145), (1002, 1127), (989, 1136), (982, 1128), (1022, 1144), (1019, 1125), (1025, 1152), (1038, 1160), (1015, 1124), (1016, 1145), (1042, 1154), (998, 1131), (1009, 1157), (1007, 1141)]
         : compromised: 0.8914, honest: 0.8861
Round 009: test acc mean=0.8932 ± 0.0108 | min=0.8638 max=0.9057
         : test loss mean=0.2619 ± 0.0210
         : individual accs = ['0.891228', '0.898964', '0.889086', '0.900691', '0.890653', '0.905677', '0.896070', '0.901508', '0.888204', '0.893617', '0.895105', '0.903111', '0.897569', '0.900000', '0.904804', '0.890830', '0.897747', '0.863837', '0.866033', '0.889571']
         : correct/total = [(1016, 1140), (1041, 1158), (1002, 1127), (1043, 1158), (1010, 1134), (1037, 1145), (1026, 1145), (1016, 1127), (1009, 1136), (1008, 1128), (1024, 1144), (1016, 1125), (1034, 1152), (1044, 1160), (1017, 1124), (1020, 1145), (1036, 1154), (977, 1131), (1002, 1157), (1015, 1141)]
         : compromised: 0.8918, honest: 0.8936
Round 010: test acc mean=0.8973 ± 0.0082 | min=0.8846 max=0.9128
         : test loss mean=0.2548 ± 0.0175
         : individual accs = ['0.896491', '0.890328', '0.884650', '0.912781', '0.893298', '0.904803', '0.887336', '0.903283', '0.899648', '0.898936', '0.902098', '0.910222', '0.900174', '0.896552', '0.906584', '0.888210', '0.903813', '0.885942', '0.885912', '0.894829']
         : correct/total = [(1022, 1140), (1031, 1158), (997, 1127), (1057, 1158), (1013, 1134), (1036, 1145), (1016, 1145), (1018, 1127), (1022, 1136), (1014, 1128), (1032, 1144), (1024, 1125), (1037, 1152), (1040, 1160), (1019, 1124), (1017, 1145), (1043, 1154), (1002, 1131), (1025, 1157), (1021, 1141)]
         : compromised: 0.8969, honest: 0.8974

=== FINAL RESULTS ===
Dataset: celeba, Nodes: 20, Graph: ring, Aggregation: balance
Attack: directed_deviation, 20.0% compromised
Final accuracy - Compromised: 0.8969, Honest: 0.8974
Overall test accuracy: mean=0.8973 ± 0.0082

=== BALANCE SUMMARY ===
Node 0: acceptance=1.000
Node 1: acceptance=1.000
Node 2: acceptance=1.000
Node 3: acceptance=1.000
Node 4: acceptance=0.500
Node 5: acceptance=0.800
Node 6: acceptance=0.500
Node 7: acceptance=1.000
Node 8: acceptance=1.000
Node 9: acceptance=1.000
Node 10: acceptance=1.000
Node 11: acceptance=0.500
Node 12: acceptance=0.500
Node 13: acceptance=0.500
Node 14: acceptance=0.500
Node 15: acceptance=1.000
Node 16: acceptance=0.500
Node 17: acceptance=0.800
Node 18: acceptance=0.500
Node 19: acceptance=1.000

=== PARALLEL EXECUTION TIME (realistic for distributed system) ===
  COMMUNICATION (max across nodes):
    - Full model transfer: 0.000s (0.1%)
  COMPUTATION (max across nodes):
    - Filtering: 0.022s (65.6%)
    - Aggregation: 0.012s (34.3%)
  TOTALS:
    - Total computation: 0.034s (99.9%)
    - Total communication: 0.000s (0.1%)
    - Total parallel time: 0.034s

=== PER-NODE AVERAGE TIME ===
  - Filtering: 0.008s
  - Aggregation: 0.004s
  - Model transfer: 0.000s
  - Total per node: 0.012s

=== TOTAL COMPUTATIONAL WORK (sum across all nodes) ===
  - Total filtering: 0.156s
  - Total aggregation: 0.075s
  - Total model transfer: 0.000s
  - Grand total: 0.231s
  - Mean acceptance rate: 0.780

BALANCE Algorithm Properties:
  - Model dimension: 2,219,692
  - No compression: Full parameter comparison
  - Theoretical complexity: O(deg(i)×d)
  - Approach: Full parameter filtering + averaging
