Device: cuda
Seed: 987654321
Looking for images in: /home/student.unimelb.edu.au/mrangwala/Projects/Sketchguard/leaf/data/celeba/data/raw/img_align_celeba
Loading 1 LEAF CelebA train files...
LEAF CelebA train: 9343 users (celebrities), 177457 samples
Looking for images in: /home/student.unimelb.edu.au/mrangwala/Projects/Sketchguard/leaf/data/celeba/data/raw/img_align_celeba
Loading 1 LEAF CelebA test files...
LEAF CelebA test: 9343 users (celebrities), 22831 samples
Found 9343 train users, 9343 test users, 9343 common users
User sample counts range: 31 (max) to 4 (min)
Distributed ALL 9343 users across 20 clients
Users per client: 467 (with 3 clients getting +1 user)
Train partition sizes: [8843, 8998, 8728, 9034, 8866, 8946, 8873, 8776, 8816, 8801, 8913, 8656, 9115, 8921, 8699, 8823, 8912, 8766, 9102, 8869]
Test partition sizes: [1140, 1158, 1127, 1158, 1134, 1145, 1145, 1127, 1136, 1128, 1144, 1125, 1152, 1160, 1124, 1145, 1154, 1131, 1157, 1141]
  Client 0: 8843 train samples, 2 unique classes
  Client 1: 8998 train samples, 2 unique classes
  Client 2: 8728 train samples, 2 unique classes
  Client 3: 9034 train samples, 2 unique classes
  Client 4: 8866 train samples, 2 unique classes
  Client 5: 8946 train samples, 2 unique classes
  Client 6: 8873 train samples, 2 unique classes
  Client 7: 8776 train samples, 2 unique classes
  Client 8: 8816 train samples, 2 unique classes
  Client 9: 8801 train samples, 2 unique classes
  Client 10: 8913 train samples, 2 unique classes
  Client 11: 8656 train samples, 2 unique classes
  Client 12: 9115 train samples, 2 unique classes
  Client 13: 8921 train samples, 2 unique classes
  Client 14: 8699 train samples, 2 unique classes
  Client 15: 8823 train samples, 2 unique classes
  Client 16: 8912 train samples, 2 unique classes
  Client 17: 8766 train samples, 2 unique classes
  Client 18: 9102 train samples, 2 unique classes
  Client 19: 8869 train samples, 2 unique classes
Will sample 4500 samples per client per epoch
Graph: fully, nodes: 20, edges: 190
Degree statistics: avg=19.00, min=19, max=19
Attack: Compromised 8/20 nodes: [1, 5, 11, 12, 13, 14, 17, 18]
Attack type: directed_deviation, lambda: 1.0
Model variant: baseline
Model parameters: 2,219,692
Initial test acc across nodes: mean=0.4978 ± 0.0208
Round 001: test acc mean=0.6938 ± 0.0140 | min=0.6615 max=0.7150
         : test loss mean=0.6409 ± 0.0037
         : individual accs = ['0.671930', '0.661485', '0.678793', '0.699482', '0.693122', '0.705677', '0.701310', '0.710736', '0.709507', '0.679078', '0.715035', '0.705778', '0.706597', '0.703448', '0.689502', '0.690830', '0.694107', '0.686118', '0.677615', '0.695004']
         : correct/total = [(766, 1140), (766, 1158), (765, 1127), (810, 1158), (786, 1134), (808, 1145), (803, 1145), (801, 1127), (806, 1136), (766, 1128), (818, 1144), (794, 1125), (814, 1152), (816, 1160), (775, 1124), (791, 1145), (801, 1154), (776, 1131), (784, 1157), (793, 1141)]
         : compromised: 0.6920, honest: 0.6949
Round 002: test acc mean=0.8231 ± 0.0115 | min=0.8003 max=0.8479
         : test loss mean=0.4136 ± 0.0113
         : individual accs = ['0.820175', '0.832470', '0.819876', '0.824698', '0.817460', '0.827074', '0.834061', '0.811890', '0.837148', '0.835993', '0.847902', '0.832889', '0.811632', '0.813793', '0.814057', '0.807860', '0.832756', '0.818744', '0.800346', '0.820333']
         : correct/total = [(935, 1140), (964, 1158), (924, 1127), (955, 1158), (927, 1134), (947, 1145), (955, 1145), (915, 1127), (951, 1136), (943, 1128), (970, 1144), (937, 1125), (935, 1152), (944, 1160), (915, 1124), (925, 1145), (961, 1154), (926, 1131), (926, 1157), (936, 1141)]
         : compromised: 0.8189, honest: 0.8258
Round 003: test acc mean=0.8480 ± 0.0111 | min=0.8220 max=0.8644
         : test loss mean=0.3425 ± 0.0130
         : individual accs = ['0.831579', '0.853195', '0.850044', '0.846287', '0.852734', '0.844541', '0.862009', '0.841171', '0.838908', '0.864362', '0.861014', '0.858667', '0.852431', '0.840517', '0.851423', '0.829694', '0.859619', '0.848806', '0.821953', '0.850131']
         : correct/total = [(948, 1140), (988, 1158), (958, 1127), (980, 1158), (967, 1134), (967, 1145), (987, 1145), (948, 1127), (953, 1136), (975, 1128), (985, 1144), (966, 1125), (982, 1152), (975, 1160), (957, 1124), (950, 1145), (992, 1154), (960, 1131), (951, 1157), (970, 1141)]
         : compromised: 0.8464, honest: 0.8490
Round 004: test acc mean=0.8521 ± 0.0082 | min=0.8358 max=0.8679
         : test loss mean=0.3297 ± 0.0178
         : individual accs = ['0.843860', '0.843696', '0.845608', '0.855786', '0.849206', '0.856769', '0.867249', '0.849157', '0.843310', '0.867908', '0.861888', '0.853333', '0.853299', '0.846552', '0.850534', '0.848908', '0.862218', '0.848806', '0.835782', '0.858019']
         : correct/total = [(962, 1140), (977, 1158), (953, 1127), (991, 1158), (963, 1134), (981, 1145), (993, 1145), (957, 1127), (958, 1136), (979, 1128), (986, 1144), (960, 1125), (983, 1152), (982, 1160), (956, 1124), (972, 1145), (995, 1154), (960, 1131), (967, 1157), (979, 1141)]
         : compromised: 0.8486, honest: 0.8544
Round 005: test acc mean=0.8814 ± 0.0088 | min=0.8651 max=0.8933
         : test loss mean=0.2795 ± 0.0161
         : individual accs = ['0.875439', '0.888601', '0.865129', '0.883420', '0.873898', '0.891703', '0.884716', '0.889973', '0.888204', '0.885638', '0.889860', '0.893333', '0.882812', '0.866379', '0.884342', '0.868122', '0.889948', '0.874447', '0.870354', '0.882559']
         : correct/total = [(998, 1140), (1029, 1158), (975, 1127), (1023, 1158), (991, 1134), (1021, 1145), (1013, 1145), (1003, 1127), (1009, 1136), (999, 1128), (1018, 1144), (1005, 1125), (1017, 1152), (1005, 1160), (994, 1124), (994, 1145), (1027, 1154), (989, 1131), (1007, 1157), (1007, 1141)]
         : compromised: 0.8815, honest: 0.8814
Round 006: test acc mean=0.8758 ± 0.0087 | min=0.8583 max=0.8906
         : test loss mean=0.2867 ± 0.0181
         : individual accs = ['0.858772', '0.868739', '0.872227', '0.874784', '0.874780', '0.869869', '0.885590', '0.881100', '0.871479', '0.888298', '0.888112', '0.873778', '0.890625', '0.877586', '0.877224', '0.866376', '0.883016', '0.877984', '0.858254', '0.876424']
         : correct/total = [(979, 1140), (1006, 1158), (983, 1127), (1013, 1158), (992, 1134), (996, 1145), (1014, 1145), (993, 1127), (990, 1136), (1002, 1128), (1016, 1144), (983, 1125), (1026, 1152), (1018, 1160), (986, 1124), (992, 1145), (1019, 1154), (993, 1131), (993, 1157), (1000, 1141)]
         : compromised: 0.8743, honest: 0.8767
Round 007: test acc mean=0.8936 ± 0.0072 | min=0.8790 max=0.9057
         : test loss mean=0.2514 ± 0.0144
         : individual accs = ['0.891228', '0.893782', '0.885537', '0.894646', '0.896825', '0.898690', '0.905677', '0.904170', '0.892606', '0.901596', '0.898601', '0.900444', '0.891493', '0.887931', '0.897687', '0.879476', '0.895147', '0.885057', '0.878997', '0.892200']
         : correct/total = [(1016, 1140), (1035, 1158), (998, 1127), (1036, 1158), (1017, 1134), (1029, 1145), (1037, 1145), (1019, 1127), (1014, 1136), (1017, 1128), (1028, 1144), (1013, 1125), (1027, 1152), (1030, 1160), (1009, 1124), (1007, 1145), (1033, 1154), (1001, 1131), (1017, 1157), (1018, 1141)]
         : compromised: 0.8918, honest: 0.8948
Round 008: test acc mean=0.8977 ± 0.0081 | min=0.8825 max=0.9111
         : test loss mean=0.2453 ± 0.0155
         : individual accs = ['0.892105', '0.898100', '0.888199', '0.905872', '0.901235', '0.900437', '0.909170', '0.904170', '0.891725', '0.906915', '0.903846', '0.911111', '0.901042', '0.893966', '0.902135', '0.892576', '0.898614', '0.885942', '0.882455', '0.885188']
         : correct/total = [(1017, 1140), (1040, 1158), (1001, 1127), (1049, 1158), (1022, 1134), (1031, 1145), (1041, 1145), (1019, 1127), (1013, 1136), (1023, 1128), (1034, 1144), (1025, 1125), (1038, 1152), (1037, 1160), (1014, 1124), (1022, 1145), (1037, 1154), (1002, 1131), (1021, 1157), (1010, 1141)]
         : compromised: 0.8969, honest: 0.8983
Round 009: test acc mean=0.8990 ± 0.0081 | min=0.8781 max=0.9164
         : test loss mean=0.2423 ± 0.0162
         : individual accs = ['0.901754', '0.893782', '0.892635', '0.908463', '0.905644', '0.903057', '0.906550', '0.905058', '0.896127', '0.902482', '0.901224', '0.916444', '0.900174', '0.899138', '0.899466', '0.895197', '0.895147', '0.885942', '0.878133', '0.893953']
         : correct/total = [(1028, 1140), (1035, 1158), (1006, 1127), (1052, 1158), (1027, 1134), (1034, 1145), (1038, 1145), (1020, 1127), (1018, 1136), (1018, 1128), (1031, 1144), (1031, 1125), (1037, 1152), (1043, 1160), (1011, 1124), (1025, 1145), (1033, 1154), (1002, 1131), (1016, 1157), (1020, 1141)]
         : compromised: 0.8970, honest: 0.9004
Round 010: test acc mean=0.8992 ± 0.0091 | min=0.8755 max=0.9129
         : test loss mean=0.2457 ± 0.0170
         : individual accs = ['0.904386', '0.890328', '0.891748', '0.909326', '0.900353', '0.899563', '0.911790', '0.911269', '0.892606', '0.904255', '0.900350', '0.912889', '0.902778', '0.902586', '0.903025', '0.887336', '0.897747', '0.889478', '0.875540', '0.896582']
         : correct/total = [(1031, 1140), (1031, 1158), (1005, 1127), (1053, 1158), (1021, 1134), (1030, 1145), (1044, 1145), (1027, 1127), (1014, 1136), (1020, 1128), (1030, 1144), (1027, 1125), (1040, 1152), (1047, 1160), (1015, 1124), (1016, 1145), (1036, 1154), (1006, 1131), (1013, 1157), (1023, 1141)]
         : compromised: 0.8970, honest: 0.9006

=== FINAL RESULTS ===
Dataset: celeba, Nodes: 20, Graph: fully, Aggregation: krum
Attack: directed_deviation, 40.0% compromised
Final accuracy - Compromised: 0.8970, Honest: 0.9006
Overall test accuracy: mean=0.8992 ± 0.0091
