Device: cuda
Seed: 987654321
Looking for images in: /home/student.unimelb.edu.au/mrangwala/Projects/Sketchguard/leaf/data/celeba/data/raw/img_align_celeba
Loading 1 LEAF CelebA train files...
LEAF CelebA train: 9343 users (celebrities), 177457 samples
Looking for images in: /home/student.unimelb.edu.au/mrangwala/Projects/Sketchguard/leaf/data/celeba/data/raw/img_align_celeba
Loading 1 LEAF CelebA test files...
LEAF CelebA test: 9343 users (celebrities), 22831 samples
Found 9343 train users, 9343 test users, 9343 common users
User sample counts range: 31 (max) to 4 (min)
Distributed ALL 9343 users across 20 clients
Users per client: 467 (with 3 clients getting +1 user)
Train partition sizes: [8843, 8998, 8728, 9034, 8866, 8946, 8873, 8776, 8816, 8801, 8913, 8656, 9115, 8921, 8699, 8823, 8912, 8766, 9102, 8869]
Test partition sizes: [1140, 1158, 1127, 1158, 1134, 1145, 1145, 1127, 1136, 1128, 1144, 1125, 1152, 1160, 1124, 1145, 1154, 1131, 1157, 1141]
  Client 0: 8843 train samples, 2 unique classes
  Client 1: 8998 train samples, 2 unique classes
  Client 2: 8728 train samples, 2 unique classes
  Client 3: 9034 train samples, 2 unique classes
  Client 4: 8866 train samples, 2 unique classes
  Client 5: 8946 train samples, 2 unique classes
  Client 6: 8873 train samples, 2 unique classes
  Client 7: 8776 train samples, 2 unique classes
  Client 8: 8816 train samples, 2 unique classes
  Client 9: 8801 train samples, 2 unique classes
  Client 10: 8913 train samples, 2 unique classes
  Client 11: 8656 train samples, 2 unique classes
  Client 12: 9115 train samples, 2 unique classes
  Client 13: 8921 train samples, 2 unique classes
  Client 14: 8699 train samples, 2 unique classes
  Client 15: 8823 train samples, 2 unique classes
  Client 16: 8912 train samples, 2 unique classes
  Client 17: 8766 train samples, 2 unique classes
  Client 18: 9102 train samples, 2 unique classes
  Client 19: 8869 train samples, 2 unique classes
Will sample 4500 samples per client per epoch
Graph: erdos, nodes: 20, edges: 126
Degree statistics: avg=12.60, min=8, max=16
Attack: Compromised 6/20 nodes: [5, 12, 13, 14, 17, 18]
Attack type: krum, lambda: 1.0
Model variant: baseline
Model parameters: 2,219,692
BALANCE algorithm:
Balance Config: BALANCEConfig(gamma=2, kappa=1, alpha=0.5, min_neighbors=1)
  - Model dimension: 2,219,692 parameters
  - Complexity: O(N×d) = O(20×2,219,692)
Initial test acc across nodes: mean=0.4978 ± 0.0208
Round 001: test acc mean=0.6833 ± 0.0432 | min=0.5794 max=0.7284
         : test loss mean=0.6806 ± 0.0035
         : individual accs = ['0.708772', '0.678756', '0.625555', '0.717617', '0.579365', '0.703057', '0.699563', '0.600710', '0.627641', '0.709220', '0.667832', '0.720000', '0.723090', '0.705172', '0.661032', '0.728384', '0.719237', '0.701149', '0.726880', '0.663453']
         : correct/total = [(808, 1140), (786, 1158), (705, 1127), (831, 1158), (657, 1134), (805, 1145), (801, 1145), (677, 1127), (713, 1136), (800, 1128), (764, 1144), (810, 1125), (833, 1152), (818, 1160), (743, 1124), (834, 1145), (830, 1154), (793, 1131), (841, 1157), (757, 1141)]
         : compromised: 0.7034, honest: 0.6747
Round 002: test acc mean=0.6476 ± 0.0540 | min=0.5214 max=0.7188
         : test loss mean=0.6756 ± 0.0065
         : individual accs = ['0.647368', '0.658895', '0.662822', '0.638169', '0.530864', '0.533624', '0.662009', '0.646850', '0.673415', '0.644504', '0.671329', '0.658667', '0.718750', '0.652586', '0.521352', '0.690830', '0.699307', '0.656057', '0.702679', '0.680982']
         : correct/total = [(738, 1140), (763, 1158), (747, 1127), (739, 1158), (602, 1134), (611, 1145), (758, 1145), (729, 1127), (765, 1136), (727, 1128), (768, 1144), (741, 1125), (828, 1152), (757, 1160), (586, 1124), (791, 1145), (807, 1154), (742, 1131), (813, 1157), (777, 1141)]
         : compromised: 0.6308, honest: 0.6547
Round 003: test acc mean=0.6626 ± 0.0444 | min=0.5178 max=0.7132
         : test loss mean=0.6586 ± 0.0114
         : individual accs = ['0.635088', '0.672712', '0.690328', '0.695164', '0.635802', '0.581659', '0.650655', '0.669920', '0.712148', '0.692376', '0.672203', '0.683556', '0.650174', '0.682759', '0.517794', '0.683843', '0.713172', '0.651636', '0.684529', '0.675723']
         : correct/total = [(724, 1140), (779, 1158), (778, 1127), (805, 1158), (721, 1134), (666, 1145), (745, 1145), (755, 1127), (809, 1136), (781, 1128), (769, 1144), (769, 1125), (749, 1152), (792, 1160), (582, 1124), (783, 1145), (823, 1154), (737, 1131), (792, 1157), (771, 1141)]
         : compromised: 0.6281, honest: 0.6773
Round 004: test acc mean=0.7101 ± 0.0244 | min=0.6557 max=0.7461
         : test loss mean=0.6066 ± 0.0150
         : individual accs = ['0.700877', '0.709845', '0.719610', '0.737478', '0.690476', '0.701310', '0.719651', '0.683230', '0.720070', '0.727837', '0.743007', '0.744889', '0.696181', '0.715517', '0.655694', '0.726638', '0.746101', '0.709991', '0.683665', '0.670465']
         : correct/total = [(799, 1140), (822, 1158), (811, 1127), (854, 1158), (783, 1134), (803, 1145), (824, 1145), (770, 1127), (818, 1136), (821, 1128), (850, 1144), (838, 1125), (802, 1152), (830, 1160), (737, 1124), (832, 1145), (861, 1154), (803, 1131), (791, 1157), (765, 1141)]
         : compromised: 0.6937, honest: 0.7172
Round 005: test acc mean=0.7594 ± 0.0158 | min=0.7214 max=0.7837
         : test loss mean=0.5244 ± 0.0177
         : individual accs = ['0.752632', '0.768566', '0.721384', '0.763385', '0.762787', '0.758952', '0.779039', '0.750665', '0.758803', '0.783688', '0.778846', '0.782222', '0.743056', '0.757759', '0.750890', '0.759825', '0.774697', '0.763042', '0.738980', '0.738826']
         : correct/total = [(858, 1140), (890, 1158), (813, 1127), (884, 1158), (865, 1134), (869, 1145), (892, 1145), (846, 1127), (862, 1136), (884, 1128), (891, 1144), (880, 1125), (856, 1152), (879, 1160), (844, 1124), (870, 1145), (894, 1154), (863, 1131), (855, 1157), (843, 1141)]
         : compromised: 0.7521, honest: 0.7625
Round 006: test acc mean=0.7960 ± 0.0167 | min=0.7678 max=0.8260
         : test loss mean=0.4528 ± 0.0189
         : individual accs = ['0.778947', '0.820380', '0.806566', '0.800518', '0.788360', '0.816594', '0.793886', '0.770186', '0.797535', '0.821809', '0.826049', '0.810667', '0.793403', '0.788793', '0.767794', '0.791266', '0.789428', '0.792219', '0.770095', '0.794917']
         : correct/total = [(888, 1140), (950, 1158), (909, 1127), (927, 1158), (894, 1134), (935, 1145), (909, 1145), (868, 1127), (906, 1136), (927, 1128), (945, 1144), (912, 1125), (914, 1152), (915, 1160), (863, 1124), (906, 1145), (911, 1154), (896, 1131), (891, 1157), (907, 1141)]
         : compromised: 0.7881, honest: 0.7993
Round 007: test acc mean=0.8353 ± 0.0148 | min=0.8012 max=0.8590
         : test loss mean=0.3794 ± 0.0170
         : individual accs = ['0.835088', '0.855786', '0.839397', '0.827288', '0.827160', '0.841921', '0.841048', '0.827862', '0.840669', '0.859043', '0.856643', '0.851556', '0.816840', '0.834483', '0.824733', '0.813974', '0.841421', '0.823165', '0.801210', '0.845749']
         : correct/total = [(952, 1140), (991, 1158), (946, 1127), (958, 1158), (938, 1134), (964, 1145), (963, 1145), (933, 1127), (955, 1136), (969, 1128), (980, 1144), (958, 1125), (941, 1152), (968, 1160), (927, 1124), (932, 1145), (971, 1154), (931, 1131), (927, 1157), (965, 1141)]
         : compromised: 0.8237, honest: 0.8402
Round 008: test acc mean=0.8606 ± 0.0131 | min=0.8315 max=0.8827
         : test loss mean=0.3302 ± 0.0166
         : individual accs = ['0.853509', '0.881693', '0.866016', '0.848877', '0.847443', '0.877729', '0.861135', '0.859805', '0.855634', '0.869681', '0.862762', '0.882667', '0.855903', '0.869828', '0.872776', '0.846288', '0.870017', '0.843501', '0.831461', '0.855390']
         : correct/total = [(973, 1140), (1021, 1158), (976, 1127), (983, 1158), (961, 1134), (1005, 1145), (986, 1145), (969, 1127), (972, 1136), (981, 1128), (987, 1144), (993, 1125), (986, 1152), (1009, 1160), (981, 1124), (969, 1145), (1004, 1154), (954, 1131), (962, 1157), (976, 1141)]
         : compromised: 0.8585, honest: 0.8615
Round 009: test acc mean=0.8754 ± 0.0127 | min=0.8418 max=0.8924
         : test loss mean=0.2983 ± 0.0195
         : individual accs = ['0.871930', '0.891192', '0.866016', '0.881693', '0.862434', '0.885590', '0.885590', '0.878438', '0.875880', '0.886525', '0.891608', '0.892444', '0.870660', '0.871552', '0.879893', '0.862009', '0.876950', '0.855880', '0.841832', '0.880806']
         : correct/total = [(994, 1140), (1032, 1158), (976, 1127), (1021, 1158), (978, 1134), (1014, 1145), (1014, 1145), (990, 1127), (995, 1136), (1000, 1128), (1020, 1144), (1004, 1125), (1003, 1152), (1011, 1160), (989, 1124), (987, 1145), (1012, 1154), (968, 1131), (974, 1157), (1005, 1141)]
         : compromised: 0.8676, honest: 0.8788
Round 010: test acc mean=0.8852 ± 0.0092 | min=0.8652 max=0.8998
         : test loss mean=0.2783 ± 0.0155
         : individual accs = ['0.879825', '0.888601', '0.878438', '0.892055', '0.880071', '0.895197', '0.891703', '0.889086', '0.881162', '0.899823', '0.887238', '0.895111', '0.880208', '0.893966', '0.892349', '0.868122', '0.887348', '0.871795', '0.865169', '0.886065']
         : correct/total = [(1003, 1140), (1029, 1158), (990, 1127), (1033, 1158), (998, 1134), (1025, 1145), (1021, 1145), (1002, 1127), (1001, 1136), (1015, 1128), (1015, 1144), (1007, 1125), (1014, 1152), (1037, 1160), (1003, 1124), (994, 1145), (1024, 1154), (986, 1131), (1001, 1157), (1011, 1141)]
         : compromised: 0.8831, honest: 0.8860

=== FINAL RESULTS ===
Dataset: celeba, Nodes: 20, Graph: erdos, Aggregation: balance
Attack: krum, 30.0% compromised
Final accuracy - Compromised: 0.8831, Honest: 0.8860
Overall test accuracy: mean=0.8852 ± 0.0092

=== BALANCE SUMMARY ===
Node 0: acceptance=0.688
Node 1: acceptance=0.818
Node 2: acceptance=0.667
Node 3: acceptance=0.750
Node 4: acceptance=0.727
Node 5: acceptance=0.667
Node 6: acceptance=0.571
Node 7: acceptance=0.643
Node 8: acceptance=0.500
Node 9: acceptance=0.769
Node 10: acceptance=0.667
Node 11: acceptance=0.643
Node 12: acceptance=0.750
Node 13: acceptance=0.769
Node 14: acceptance=0.667
Node 15: acceptance=0.636
Node 16: acceptance=0.615
Node 17: acceptance=0.778
Node 18: acceptance=0.750
Node 19: acceptance=0.625

=== PARALLEL EXECUTION TIME (realistic for distributed system) ===
  COMMUNICATION (max across nodes):
    - Full model transfer: 0.000s (0.0%)
  COMPUTATION (max across nodes):
    - Filtering: 0.047s (78.2%)
    - Aggregation: 0.013s (21.8%)
  TOTALS:
    - Total computation: 0.060s (100.0%)
    - Total communication: 0.000s (0.0%)
    - Total parallel time: 0.060s

=== PER-NODE AVERAGE TIME ===
  - Filtering: 0.034s
  - Aggregation: 0.006s
  - Model transfer: 0.000s
  - Total per node: 0.040s

=== TOTAL COMPUTATIONAL WORK (sum across all nodes) ===
  - Total filtering: 0.678s
  - Total aggregation: 0.117s
  - Total model transfer: 0.000s
  - Grand total: 0.796s
  - Mean acceptance rate: 0.685

BALANCE Algorithm Properties:
  - Model dimension: 2,219,692
  - No compression: Full parameter comparison
  - Theoretical complexity: O(deg(i)×d)
  - Approach: Full parameter filtering + averaging
