Device: cuda
Seed: 987654321
Looking for images in: /home/student.unimelb.edu.au/mrangwala/Projects/Sketchguard/leaf/data/celeba/data/raw/img_align_celeba
Loading 1 LEAF CelebA train files...
LEAF CelebA train: 9343 users (celebrities), 177457 samples
Looking for images in: /home/student.unimelb.edu.au/mrangwala/Projects/Sketchguard/leaf/data/celeba/data/raw/img_align_celeba
Loading 1 LEAF CelebA test files...
LEAF CelebA test: 9343 users (celebrities), 22831 samples
Found 9343 train users, 9343 test users, 9343 common users
User sample counts range: 31 (max) to 4 (min)
Distributed ALL 9343 users across 20 clients
Users per client: 467 (with 3 clients getting +1 user)
Train partition sizes: [8843, 8998, 8728, 9034, 8866, 8946, 8873, 8776, 8816, 8801, 8913, 8656, 9115, 8921, 8699, 8823, 8912, 8766, 9102, 8869]
Test partition sizes: [1140, 1158, 1127, 1158, 1134, 1145, 1145, 1127, 1136, 1128, 1144, 1125, 1152, 1160, 1124, 1145, 1154, 1131, 1157, 1141]
  Client 0: 8843 train samples, 2 unique classes
  Client 1: 8998 train samples, 2 unique classes
  Client 2: 8728 train samples, 2 unique classes
  Client 3: 9034 train samples, 2 unique classes
  Client 4: 8866 train samples, 2 unique classes
  Client 5: 8946 train samples, 2 unique classes
  Client 6: 8873 train samples, 2 unique classes
  Client 7: 8776 train samples, 2 unique classes
  Client 8: 8816 train samples, 2 unique classes
  Client 9: 8801 train samples, 2 unique classes
  Client 10: 8913 train samples, 2 unique classes
  Client 11: 8656 train samples, 2 unique classes
  Client 12: 9115 train samples, 2 unique classes
  Client 13: 8921 train samples, 2 unique classes
  Client 14: 8699 train samples, 2 unique classes
  Client 15: 8823 train samples, 2 unique classes
  Client 16: 8912 train samples, 2 unique classes
  Client 17: 8766 train samples, 2 unique classes
  Client 18: 9102 train samples, 2 unique classes
  Client 19: 8869 train samples, 2 unique classes
Will sample 4500 samples per client per epoch
Graph: erdos, nodes: 20, edges: 48
Degree statistics: avg=4.80, min=2, max=7
Attack: Compromised 16/20 nodes: [1, 2, 3, 5, 6, 8, 9, 10, 11, 12, 13, 14, 15, 17, 18, 19]
Attack type: backdoor, lambda: 1.0
Backdoor target label: 0, trigger size: 8
Model variant: baseline
Model parameters: 2,219,692
BALANCE algorithm:
Balance Config: BALANCEConfig(gamma=2, kappa=1, alpha=0.5, min_neighbors=1)
  - Model dimension: 2,219,692 parameters
  - Complexity: O(N×d) = O(20×2,219,692)
Initial test acc across nodes: mean=0.4978 ± 0.0208
Backdoor attack: Created poisoned datasets for 16 compromised nodes
Round 001: test acc mean=0.5401 ± 0.0573 | min=0.4938 max=0.7158
         : test loss mean=9187.9780 ± 14148.7663
         : individual accs = ['0.683333', '0.508636', '0.494232', '0.533679', '0.571429', '0.514410', '0.521397', '0.560781', '0.562500', '0.493794', '0.525350', '0.498667', '0.522569', '0.506897', '0.517794', '0.521397', '0.715771', '0.508400', '0.522040', '0.517967']
         : correct/total = [(779, 1140), (589, 1158), (557, 1127), (618, 1158), (648, 1134), (589, 1145), (597, 1145), (632, 1127), (639, 1136), (557, 1128), (601, 1144), (561, 1125), (602, 1152), (588, 1160), (582, 1124), (597, 1145), (826, 1154), (575, 1131), (604, 1157), (591, 1141)]
         : compromised: 0.5169, honest: 0.6328
Round 002: test acc mean=0.5355 ± 0.0930 | min=0.4375 max=0.7686
         : test loss mean=nan ± nan
         : individual accs = ['0.735965', '0.497409', '0.506655', '0.528497', '0.666667', '0.485590', '0.478603', '0.685004', '0.437500', '0.508865', '0.474650', '0.498667', '0.477431', '0.506897', '0.482206', '0.482969', '0.768631', '0.491600', '0.477960', '0.517967']
         : correct/total = [(839, 1140), (576, 1158), (571, 1127), (612, 1158), (756, 1134), (556, 1145), (548, 1145), (772, 1127), (497, 1136), (574, 1128), (543, 1144), (561, 1125), (550, 1152), (588, 1160), (542, 1124), (553, 1145), (887, 1154), (556, 1131), (553, 1157), (591, 1141)]
         : compromised: 0.4908, honest: 0.7141
Round 003: test acc mean=0.5777 ± 0.1244 | min=0.4911 max=0.8421
         : test loss mean=nan ± nan
         : individual accs = ['0.842105', '0.508636', '0.493345', '0.528497', '0.808642', '0.514410', '0.521397', '0.805679', '0.562500', '0.491135', '0.525350', '0.498667', '0.522569', '0.506897', '0.517794', '0.517031', '0.840555', '0.508400', '0.522040', '0.517967']
         : correct/total = [(960, 1140), (589, 1158), (556, 1127), (612, 1158), (917, 1134), (589, 1145), (597, 1145), (908, 1127), (639, 1136), (554, 1128), (601, 1144), (561, 1125), (602, 1152), (588, 1160), (582, 1124), (592, 1145), (970, 1154), (575, 1131), (604, 1157), (591, 1141)]
         : compromised: 0.5160, honest: 0.8242
Round 004: test acc mean=0.5856 ± 0.1398 | min=0.4911 max=0.8686
         : test loss mean=nan ± nan
         : individual accs = ['0.851754', '0.508636', '0.493345', '0.528497', '0.868607', '0.514410', '0.521397', '0.866903', '0.562500', '0.491135', '0.525350', '0.498667', '0.522569', '0.506897', '0.517794', '0.517031', '0.867418', '0.508400', '0.522040', '0.517967']
         : correct/total = [(971, 1140), (589, 1158), (556, 1127), (612, 1158), (985, 1134), (589, 1145), (597, 1145), (977, 1127), (639, 1136), (554, 1128), (601, 1144), (561, 1125), (602, 1152), (588, 1160), (582, 1124), (592, 1145), (1001, 1154), (575, 1131), (604, 1157), (591, 1141)]
         : compromised: 0.5160, honest: 0.8637
Round 005: test acc mean=0.5874 ± 0.1434 | min=0.4911 max=0.8847
         : test loss mean=nan ± nan
         : individual accs = ['0.873684', '0.508636', '0.493345', '0.528497', '0.865079', '0.514410', '0.521397', '0.866903', '0.562500', '0.491135', '0.525350', '0.498667', '0.522569', '0.506897', '0.517794', '0.517031', '0.884749', '0.508400', '0.522040', '0.517967']
         : correct/total = [(996, 1140), (589, 1158), (556, 1127), (612, 1158), (981, 1134), (589, 1145), (597, 1145), (977, 1127), (639, 1136), (554, 1128), (601, 1144), (561, 1125), (602, 1152), (588, 1160), (582, 1124), (592, 1145), (1021, 1154), (575, 1131), (604, 1157), (591, 1141)]
         : compromised: 0.5160, honest: 0.8726
Round 006: test acc mean=0.5911 ± 0.1508 | min=0.4911 max=0.8956
         : test loss mean=nan ± nan
         : individual accs = ['0.895614', '0.508636', '0.493345', '0.528497', '0.885362', '0.514410', '0.521397', '0.890861', '0.562500', '0.491135', '0.525350', '0.498667', '0.522569', '0.506897', '0.517794', '0.517031', '0.893414', '0.508400', '0.522040', '0.517967']
         : correct/total = [(1021, 1140), (589, 1158), (556, 1127), (612, 1158), (1004, 1134), (589, 1145), (597, 1145), (1004, 1127), (639, 1136), (554, 1128), (601, 1144), (561, 1125), (602, 1152), (588, 1160), (582, 1124), (592, 1145), (1031, 1154), (575, 1131), (604, 1157), (591, 1141)]
         : compromised: 0.5160, honest: 0.8913
Round 007: test acc mean=0.5924 ± 0.1535 | min=0.4911 max=0.9086
         : test loss mean=nan ± nan
         : individual accs = ['0.898246', '0.508636', '0.493345', '0.528497', '0.886243', '0.514410', '0.521397', '0.908607', '0.562500', '0.491135', '0.525350', '0.498667', '0.522569', '0.506897', '0.517794', '0.517031', '0.898614', '0.508400', '0.522040', '0.517967']
         : correct/total = [(1024, 1140), (589, 1158), (556, 1127), (612, 1158), (1005, 1134), (589, 1145), (597, 1145), (1024, 1127), (639, 1136), (554, 1128), (601, 1144), (561, 1125), (602, 1152), (588, 1160), (582, 1124), (592, 1145), (1037, 1154), (575, 1131), (604, 1157), (591, 1141)]
         : compromised: 0.5160, honest: 0.8979
Round 008: test acc mean=0.5932 ± 0.1549 | min=0.4911 max=0.9095
         : test loss mean=nan ± nan
         : individual accs = ['0.902632', '0.508636', '0.493345', '0.528497', '0.895062', '0.514410', '0.521397', '0.909494', '0.562500', '0.491135', '0.525350', '0.498667', '0.522569', '0.506897', '0.517794', '0.517031', '0.899480', '0.508400', '0.522040', '0.517967']
         : correct/total = [(1029, 1140), (589, 1158), (556, 1127), (612, 1158), (1015, 1134), (589, 1145), (597, 1145), (1025, 1127), (639, 1136), (554, 1128), (601, 1144), (561, 1125), (602, 1152), (588, 1160), (582, 1124), (592, 1145), (1038, 1154), (575, 1131), (604, 1157), (591, 1141)]
         : compromised: 0.5160, honest: 0.9017
Round 009: test acc mean=0.5941 ± 0.1568 | min=0.4911 max=0.9113
         : test loss mean=nan ± nan
         : individual accs = ['0.904386', '0.508636', '0.493345', '0.528497', '0.902116', '0.514410', '0.521397', '0.911269', '0.562500', '0.491135', '0.525350', '0.498667', '0.522569', '0.506897', '0.517794', '0.517031', '0.907279', '0.508400', '0.522040', '0.517967']
         : correct/total = [(1031, 1140), (589, 1158), (556, 1127), (612, 1158), (1023, 1134), (589, 1145), (597, 1145), (1027, 1127), (639, 1136), (554, 1128), (601, 1144), (561, 1125), (602, 1152), (588, 1160), (582, 1124), (592, 1145), (1047, 1154), (575, 1131), (604, 1157), (591, 1141)]
         : compromised: 0.5160, honest: 0.9063
Round 010: test acc mean=0.5947 ± 0.1579 | min=0.4911 max=0.9175
         : test loss mean=nan ± nan
         : individual accs = ['0.908772', '0.508636', '0.493345', '0.528497', '0.904762', '0.514410', '0.521397', '0.917480', '0.562500', '0.491135', '0.525350', '0.498667', '0.522569', '0.506897', '0.517794', '0.517031', '0.905546', '0.508400', '0.522040', '0.517967']
         : correct/total = [(1036, 1140), (589, 1158), (556, 1127), (612, 1158), (1026, 1134), (589, 1145), (597, 1145), (1034, 1127), (639, 1136), (554, 1128), (601, 1144), (561, 1125), (602, 1152), (588, 1160), (582, 1124), (592, 1145), (1045, 1154), (575, 1131), (604, 1157), (591, 1141)]
         : compromised: 0.5160, honest: 0.9091

=== FINAL RESULTS ===
Dataset: celeba, Nodes: 20, Graph: erdos, Aggregation: balance
Attack: backdoor, 80.0% compromised
Final accuracy - Compromised: 0.5160, Honest: 0.9091
Overall test accuracy: mean=0.5947 ± 0.1579

=== BACKDOOR ATTACK SUCCESS RATE (ASR) ===
Target label: 0
Trigger size: 8x8
Overall ASR: 0.9092 ± 0.1816
Honest nodes ASR: 0.5461 ± 0.0129
Compromised nodes ASR: 1.0000 ± 0.0000
Note: Higher ASR indicates more successful backdoor attack

=== BALANCE SUMMARY ===
Node 0: acceptance=0.167
Node 1: acceptance=0.133
Node 2: acceptance=0.120
Node 3: acceptance=0.000
Node 4: acceptance=0.250
Node 5: acceptance=0.120
Node 6: acceptance=0.120
Node 7: acceptance=0.200
Node 8: acceptance=0.150
Node 9: acceptance=0.133
Node 10: acceptance=0.125
Node 11: acceptance=0.000
Node 12: acceptance=0.143
Node 13: acceptance=0.000
Node 14: acceptance=0.114
Node 15: acceptance=0.117
Node 16: acceptance=0.200
Node 17: acceptance=0.140
Node 18: acceptance=0.125
Node 19: acceptance=0.000

=== PARALLEL EXECUTION TIME (realistic for distributed system) ===
  COMMUNICATION (max across nodes):
    - Full model transfer: 0.000s (0.0%)
  COMPUTATION (max across nodes):
    - Filtering: 0.021s (67.8%)
    - Aggregation: 0.010s (32.2%)
  TOTALS:
    - Total computation: 0.030s (100.0%)
    - Total communication: 0.000s (0.0%)
    - Total parallel time: 0.030s

=== PER-NODE AVERAGE TIME ===
  - Filtering: 0.015s
  - Aggregation: 0.003s
  - Model transfer: 0.000s
  - Total per node: 0.018s

=== TOTAL COMPUTATIONAL WORK (sum across all nodes) ===
  - Total filtering: 0.296s
  - Total aggregation: 0.066s
  - Total model transfer: 0.000s
  - Grand total: 0.362s
  - Mean acceptance rate: 0.118

BALANCE Algorithm Properties:
  - Model dimension: 2,219,692
  - No compression: Full parameter comparison
  - Theoretical complexity: O(deg(i)×d)
  - Approach: Full parameter filtering + averaging
