Device: cuda
Seed: 987654321
Looking for images in: /home/student.unimelb.edu.au/mrangwala/Projects/Sketchguard/leaf/data/celeba/data/raw/img_align_celeba
Loading 1 LEAF CelebA train files...
LEAF CelebA train: 9343 users (celebrities), 177457 samples
Looking for images in: /home/student.unimelb.edu.au/mrangwala/Projects/Sketchguard/leaf/data/celeba/data/raw/img_align_celeba
Loading 1 LEAF CelebA test files...
LEAF CelebA test: 9343 users (celebrities), 22831 samples
Found 9343 train users, 9343 test users, 9343 common users
User sample counts range: 31 (max) to 4 (min)
Distributed ALL 9343 users across 20 clients
Users per client: 467 (with 3 clients getting +1 user)
Train partition sizes: [8843, 8998, 8728, 9034, 8866, 8946, 8873, 8776, 8816, 8801, 8913, 8656, 9115, 8921, 8699, 8823, 8912, 8766, 9102, 8869]
Test partition sizes: [1140, 1158, 1127, 1158, 1134, 1145, 1145, 1127, 1136, 1128, 1144, 1125, 1152, 1160, 1124, 1145, 1154, 1131, 1157, 1141]
  Client 0: 8843 train samples, 2 unique classes
  Client 1: 8998 train samples, 2 unique classes
  Client 2: 8728 train samples, 2 unique classes
  Client 3: 9034 train samples, 2 unique classes
  Client 4: 8866 train samples, 2 unique classes
  Client 5: 8946 train samples, 2 unique classes
  Client 6: 8873 train samples, 2 unique classes
  Client 7: 8776 train samples, 2 unique classes
  Client 8: 8816 train samples, 2 unique classes
  Client 9: 8801 train samples, 2 unique classes
  Client 10: 8913 train samples, 2 unique classes
  Client 11: 8656 train samples, 2 unique classes
  Client 12: 9115 train samples, 2 unique classes
  Client 13: 8921 train samples, 2 unique classes
  Client 14: 8699 train samples, 2 unique classes
  Client 15: 8823 train samples, 2 unique classes
  Client 16: 8912 train samples, 2 unique classes
  Client 17: 8766 train samples, 2 unique classes
  Client 18: 9102 train samples, 2 unique classes
  Client 19: 8869 train samples, 2 unique classes
Will sample 4500 samples per client per epoch
Graph: erdos, nodes: 20, edges: 126
Degree statistics: avg=12.60, min=8, max=16
Attack: Compromised 8/20 nodes: [1, 5, 11, 12, 13, 14, 17, 18]
Attack type: directed_deviation, lambda: 1.0
Model variant: baseline
Model parameters: 2,219,692
Initial test acc across nodes: mean=0.4978 ± 0.0208
Round 001: test acc mean=0.6793 ± 0.0740 | min=0.4781 max=0.7578
         : test loss mean=1385.7792 ± 5835.4194
         : individual accs = ['0.672807', '0.661485', '0.678793', '0.721071', '0.694004', '0.547598', '0.702183', '0.709849', '0.724472', '0.678191', '0.478147', '0.706667', '0.757812', '0.741379', '0.739324', '0.751965', '0.694974', '0.524315', '0.677615', '0.723926']
         : correct/total = [(767, 1140), (766, 1158), (765, 1127), (835, 1158), (787, 1134), (627, 1145), (804, 1145), (800, 1127), (823, 1136), (765, 1128), (547, 1144), (795, 1125), (873, 1152), (860, 1160), (831, 1124), (861, 1145), (802, 1154), (593, 1131), (784, 1157), (826, 1141)]
         : compromised: 0.6695, honest: 0.6859
Round 002: test acc mean=0.7628 ± 0.1050 | min=0.5084 max=0.8364
         : test loss mean=15563227.7780 ± 58625161.9036
         : individual accs = ['0.822807', '0.825561', '0.787045', '0.817789', '0.816578', '0.514410', '0.807860', '0.821650', '0.777289', '0.824468', '0.525350', '0.836444', '0.817708', '0.799138', '0.808719', '0.787773', '0.790295', '0.508400', '0.790838', '0.776512']
         : correct/total = [(938, 1140), (956, 1158), (887, 1127), (947, 1158), (926, 1134), (589, 1145), (925, 1145), (926, 1127), (883, 1136), (930, 1128), (601, 1144), (941, 1125), (942, 1152), (927, 1160), (909, 1124), (902, 1145), (912, 1154), (575, 1131), (915, 1157), (886, 1141)]
         : compromised: 0.7377, honest: 0.7796
Round 003: test acc mean=0.7863 ± 0.1187 | min=0.4873 max=0.8667
         : test loss mean=25480176.7589 ± 111065513.7918
         : individual accs = ['0.840351', '0.838515', '0.813665', '0.847150', '0.823633', '0.487336', '0.865502', '0.844720', '0.838028', '0.810284', '0.525350', '0.866667', '0.821181', '0.850862', '0.815836', '0.836681', '0.828423', '0.508400', '0.806396', '0.857143']
         : correct/total = [(958, 1140), (971, 1158), (917, 1127), (981, 1158), (934, 1134), (558, 1145), (991, 1145), (952, 1127), (952, 1136), (914, 1128), (601, 1144), (975, 1125), (946, 1152), (987, 1160), (917, 1124), (958, 1145), (956, 1154), (575, 1131), (933, 1157), (978, 1141)]
         : compromised: 0.7494, honest: 0.8109
Round 004: test acc mean=0.8069 ± 0.1352 | min=0.4755 max=0.8776
         : test loss mean=19210628.4978 ± 61609762.1747
         : individual accs = ['0.873684', '0.852332', '0.852706', '0.866149', '0.877425', '0.487336', '0.863755', '0.872227', '0.853873', '0.875000', '0.475524', '0.877333', '0.877604', '0.855172', '0.855872', '0.852402', '0.868284', '0.495137', '0.839239', '0.867660']
         : correct/total = [(996, 1140), (987, 1158), (961, 1127), (1003, 1158), (995, 1134), (558, 1145), (989, 1145), (983, 1127), (970, 1136), (987, 1128), (544, 1144), (987, 1125), (1011, 1152), (992, 1160), (962, 1124), (976, 1145), (1002, 1154), (560, 1131), (971, 1157), (990, 1141)]
         : compromised: 0.7675, honest: 0.8332
Round 005: test acc mean=0.8265 ± 0.1307 | min=0.5084 max=0.8990
         : test loss mean=0.3403 ± 0.1488
         : individual accs = ['0.876316', '0.864421', '0.869565', '0.898964', '0.887125', '0.514410', '0.891703', '0.886424', '0.881162', '0.890071', '0.525350', '0.880889', '0.880208', '0.881897', '0.878114', '0.867249', '0.891681', '0.508400', '0.870354', '0.885188']
         : correct/total = [(999, 1140), (1001, 1158), (980, 1127), (1041, 1158), (1006, 1134), (589, 1145), (1021, 1145), (999, 1127), (1001, 1136), (1004, 1128), (601, 1144), (991, 1125), (1014, 1152), (1023, 1160), (987, 1124), (993, 1145), (1029, 1154), (575, 1131), (1007, 1157), (1010, 1141)]
         : compromised: 0.7848, honest: 0.8542
Round 006: test acc mean=0.8256 ± 0.1305 | min=0.5084 max=0.8963
         : test loss mean=0.3432 ± 0.1483
         : individual accs = ['0.892105', '0.883420', '0.873114', '0.882556', '0.872134', '0.514410', '0.889083', '0.893523', '0.875000', '0.896277', '0.525350', '0.869333', '0.884549', '0.868103', '0.884342', '0.862882', '0.883882', '0.508400', '0.860847', '0.893076']
         : correct/total = [(1017, 1140), (1023, 1158), (984, 1127), (1022, 1158), (989, 1134), (589, 1145), (1018, 1145), (1007, 1127), (994, 1136), (1011, 1128), (601, 1144), (978, 1125), (1019, 1152), (1007, 1160), (994, 1124), (988, 1145), (1020, 1154), (575, 1131), (996, 1157), (1019, 1141)]
         : compromised: 0.7842, honest: 0.8532
Round 007: test acc mean=0.8365 ± 0.1349 | min=0.5084 max=0.9140
         : test loss mean=0.3229 ± 0.1561
         : individual accs = ['0.898246', '0.901554', '0.890861', '0.889465', '0.880071', '0.514410', '0.896943', '0.900621', '0.888204', '0.914007', '0.525350', '0.899556', '0.896701', '0.887931', '0.895018', '0.882969', '0.896880', '0.508400', '0.876404', '0.886941']
         : correct/total = [(1024, 1140), (1044, 1158), (1004, 1127), (1030, 1158), (998, 1134), (589, 1145), (1027, 1145), (1015, 1127), (1009, 1136), (1031, 1128), (601, 1144), (1012, 1125), (1033, 1152), (1030, 1160), (1006, 1124), (1011, 1145), (1035, 1154), (575, 1131), (1014, 1157), (1012, 1141)]
         : compromised: 0.7975, honest: 0.8625
Round 008: test acc mean=0.8403 ± 0.1364 | min=0.5084 max=0.9087
         : test loss mean=0.3146 ± 0.1596
         : individual accs = ['0.901754', '0.905009', '0.889086', '0.900691', '0.901235', '0.514410', '0.904803', '0.891748', '0.889965', '0.908688', '0.525350', '0.892444', '0.885417', '0.900862', '0.902135', '0.888210', '0.904679', '0.508400', '0.885912', '0.904470']
         : correct/total = [(1028, 1140), (1048, 1158), (1002, 1127), (1043, 1158), (1022, 1134), (589, 1145), (1036, 1145), (1005, 1127), (1011, 1136), (1025, 1128), (601, 1144), (1004, 1125), (1020, 1152), (1045, 1160), (1014, 1124), (1017, 1145), (1044, 1154), (575, 1131), (1025, 1157), (1032, 1141)]
         : compromised: 0.7993, honest: 0.8676
Round 009: test acc mean=0.8377 ± 0.1495 | min=0.4694 max=0.9111
         : test loss mean=7261.8742 ± 31561.9385
         : individual accs = ['0.905263', '0.897237', '0.896185', '0.911054', '0.901235', '0.485590', '0.898690', '0.905945', '0.897887', '0.906915', '0.469406', '0.909333', '0.902778', '0.900862', '0.902135', '0.887336', '0.904679', '0.491600', '0.882455', '0.896582']
         : correct/total = [(1032, 1140), (1039, 1158), (1010, 1127), (1055, 1158), (1022, 1134), (556, 1145), (1029, 1145), (1021, 1127), (1020, 1136), (1023, 1128), (537, 1144), (1023, 1125), (1040, 1152), (1045, 1160), (1014, 1124), (1016, 1145), (1044, 1154), (556, 1131), (1021, 1157), (1023, 1141)]
         : compromised: 0.7965, honest: 0.8651
Round 010: test acc mean=0.8403 ± 0.1460 | min=0.4860 max=0.9142
         : test loss mean=119371.5928 ± 514854.0957
         : individual accs = ['0.908772', '0.903282', '0.892635', '0.909326', '0.896825', '0.496070', '0.900437', '0.909494', '0.903169', '0.906028', '0.486014', '0.910222', '0.901042', '0.900000', '0.895018', '0.889956', '0.914211', '0.497790', '0.885912', '0.900088']
         : correct/total = [(1036, 1140), (1046, 1158), (1006, 1127), (1053, 1158), (1017, 1134), (568, 1145), (1031, 1145), (1025, 1127), (1026, 1136), (1022, 1128), (556, 1144), (1024, 1125), (1038, 1152), (1044, 1160), (1006, 1124), (1019, 1145), (1055, 1154), (563, 1131), (1025, 1157), (1027, 1141)]
         : compromised: 0.7987, honest: 0.8681

=== FINAL RESULTS ===
Dataset: celeba, Nodes: 20, Graph: erdos, Aggregation: krum
Attack: directed_deviation, 40.0% compromised
Final accuracy - Compromised: 0.7987, Honest: 0.8681
Overall test accuracy: mean=0.8403 ± 0.1460
