Device: cuda
Seed: 987654321
Looking for images in: /home/student.unimelb.edu.au/mrangwala/Projects/Sketchguard/leaf/data/celeba/data/raw/img_align_celeba
Loading 1 LEAF CelebA train files...
LEAF CelebA train: 9343 users (celebrities), 177457 samples
Looking for images in: /home/student.unimelb.edu.au/mrangwala/Projects/Sketchguard/leaf/data/celeba/data/raw/img_align_celeba
Loading 1 LEAF CelebA test files...
LEAF CelebA test: 9343 users (celebrities), 22831 samples
Found 9343 train users, 9343 test users, 9343 common users
User sample counts range: 31 (max) to 4 (min)
Distributed ALL 9343 users across 20 clients
Users per client: 467 (with 3 clients getting +1 user)
Train partition sizes: [8843, 8998, 8728, 9034, 8866, 8946, 8873, 8776, 8816, 8801, 8913, 8656, 9115, 8921, 8699, 8823, 8912, 8766, 9102, 8869]
Test partition sizes: [1140, 1158, 1127, 1158, 1134, 1145, 1145, 1127, 1136, 1128, 1144, 1125, 1152, 1160, 1124, 1145, 1154, 1131, 1157, 1141]
  Client 0: 8843 train samples, 2 unique classes
  Client 1: 8998 train samples, 2 unique classes
  Client 2: 8728 train samples, 2 unique classes
  Client 3: 9034 train samples, 2 unique classes
  Client 4: 8866 train samples, 2 unique classes
  Client 5: 8946 train samples, 2 unique classes
  Client 6: 8873 train samples, 2 unique classes
  Client 7: 8776 train samples, 2 unique classes
  Client 8: 8816 train samples, 2 unique classes
  Client 9: 8801 train samples, 2 unique classes
  Client 10: 8913 train samples, 2 unique classes
  Client 11: 8656 train samples, 2 unique classes
  Client 12: 9115 train samples, 2 unique classes
  Client 13: 8921 train samples, 2 unique classes
  Client 14: 8699 train samples, 2 unique classes
  Client 15: 8823 train samples, 2 unique classes
  Client 16: 8912 train samples, 2 unique classes
  Client 17: 8766 train samples, 2 unique classes
  Client 18: 9102 train samples, 2 unique classes
  Client 19: 8869 train samples, 2 unique classes
Will sample 4500 samples per client per epoch
Graph: erdos, nodes: 20, edges: 126
Degree statistics: avg=12.60, min=8, max=16
Attack: Compromised 12/20 nodes: [1, 2, 3, 5, 8, 11, 12, 13, 14, 15, 17, 18]
Attack type: gaussian, lambda: 1.0
Model variant: baseline
Model parameters: 2,219,692
BALANCE algorithm:
Balance Config: BALANCEConfig(gamma=2, kappa=1, alpha=0.5, min_neighbors=1)
  - Model dimension: 2,219,692 parameters
  - Complexity: O(N×d) = O(20×2,219,692)
Initial test acc across nodes: mean=0.4978 ± 0.0208
Round 001: test acc mean=0.6637 ± 0.0467 | min=0.5643 max=0.7274
         : test loss mean=0.6808 ± 0.0034
         : individual accs = ['0.686842', '0.691710', '0.564330', '0.710708', '0.617284', '0.651528', '0.681223', '0.643301', '0.582746', '0.702128', '0.619755', '0.706667', '0.727431', '0.700000', '0.601423', '0.666376', '0.709705', '0.661362', '0.718237', '0.631025']
         : correct/total = [(783, 1140), (801, 1158), (636, 1127), (823, 1158), (700, 1134), (746, 1145), (780, 1145), (725, 1127), (662, 1136), (792, 1128), (709, 1144), (795, 1125), (838, 1152), (812, 1160), (676, 1124), (763, 1145), (819, 1154), (748, 1131), (831, 1157), (720, 1141)]
         : compromised: 0.6652, honest: 0.6614
Round 002: test acc mean=0.6364 ± 0.0482 | min=0.5187 max=0.6993
         : test loss mean=0.6715 ± 0.0076
         : individual accs = ['0.636842', '0.666667', '0.626442', '0.654577', '0.596120', '0.525764', '0.628821', '0.667258', '0.632923', '0.658688', '0.684441', '0.606222', '0.691840', '0.595690', '0.518683', '0.651528', '0.699307', '0.629531', '0.689715', '0.666959']
         : correct/total = [(726, 1140), (772, 1158), (706, 1127), (758, 1158), (676, 1134), (602, 1145), (720, 1145), (752, 1127), (719, 1136), (743, 1128), (783, 1144), (682, 1125), (797, 1152), (691, 1160), (583, 1124), (746, 1145), (807, 1154), (712, 1131), (798, 1157), (761, 1141)]
         : compromised: 0.6241, honest: 0.6548
Round 003: test acc mean=0.6908 ± 0.0242 | min=0.6370 max=0.7400
         : test loss mean=0.6324 ± 0.0143
         : individual accs = ['0.662281', '0.683074', '0.702751', '0.714162', '0.668430', '0.675109', '0.703057', '0.684117', '0.712148', '0.721631', '0.715035', '0.656000', '0.674479', '0.703448', '0.637011', '0.695197', '0.740035', '0.677277', '0.700951', '0.688869']
         : correct/total = [(755, 1140), (791, 1158), (792, 1127), (827, 1158), (758, 1134), (773, 1145), (805, 1145), (771, 1127), (809, 1136), (814, 1128), (818, 1144), (738, 1125), (777, 1152), (816, 1160), (716, 1124), (796, 1145), (854, 1154), (766, 1131), (811, 1157), (786, 1141)]
         : compromised: 0.6860, honest: 0.6979
Round 004: test acc mean=0.7600 ± 0.0134 | min=0.7226 max=0.7791
         : test loss mean=0.5353 ± 0.0162
         : individual accs = ['0.763158', '0.751295', '0.764862', '0.757340', '0.778660', '0.756332', '0.765939', '0.759539', '0.757923', '0.762411', '0.776224', '0.769778', '0.764757', '0.748276', '0.757117', '0.736245', '0.772964', '0.755084', '0.722558', '0.779141']
         : correct/total = [(870, 1140), (870, 1158), (862, 1127), (877, 1158), (883, 1134), (866, 1145), (877, 1145), (856, 1127), (861, 1136), (860, 1128), (888, 1144), (866, 1125), (881, 1152), (868, 1160), (851, 1124), (843, 1145), (892, 1154), (854, 1131), (836, 1157), (889, 1141)]
         : compromised: 0.7535, honest: 0.7698
Round 005: test acc mean=0.8063 ± 0.0197 | min=0.7686 max=0.8449
         : test loss mean=0.4314 ± 0.0212
         : individual accs = ['0.805263', '0.816062', '0.803017', '0.785838', '0.807760', '0.768559', '0.817467', '0.802130', '0.825704', '0.844858', '0.823427', '0.813333', '0.795139', '0.781897', '0.809609', '0.786900', '0.842288', '0.793103', '0.781331', '0.822962']
         : correct/total = [(918, 1140), (945, 1158), (905, 1127), (910, 1158), (916, 1134), (880, 1145), (936, 1145), (904, 1127), (938, 1136), (953, 1128), (942, 1144), (915, 1125), (916, 1152), (907, 1160), (910, 1124), (901, 1145), (972, 1154), (897, 1131), (904, 1157), (939, 1141)]
         : compromised: 0.7967, honest: 0.8208
Round 006: test acc mean=0.8497 ± 0.0182 | min=0.8047 max=0.8739
         : test loss mean=0.3486 ± 0.0192
         : individual accs = ['0.858772', '0.873921', '0.858030', '0.854059', '0.816578', '0.858515', '0.852402', '0.840284', '0.872359', '0.864362', '0.872378', '0.865778', '0.824653', '0.836207', '0.849644', '0.841048', '0.855286', '0.839080', '0.804667', '0.855390']
         : correct/total = [(979, 1140), (1012, 1158), (967, 1127), (989, 1158), (926, 1134), (983, 1145), (976, 1145), (947, 1127), (991, 1136), (975, 1128), (998, 1144), (974, 1125), (950, 1152), (970, 1160), (955, 1124), (963, 1145), (987, 1154), (949, 1131), (931, 1157), (976, 1141)]
         : compromised: 0.8482, honest: 0.8519
Round 007: test acc mean=0.8745 ± 0.0113 | min=0.8507 max=0.8938
         : test loss mean=0.3004 ± 0.0144
         : individual accs = ['0.864912', '0.893782', '0.874889', '0.869603', '0.861552', '0.889956', '0.880349', '0.881100', '0.877641', '0.886525', '0.881993', '0.878222', '0.865451', '0.877586', '0.876335', '0.850655', '0.887348', '0.863837', '0.853933', '0.873795']
         : correct/total = [(986, 1140), (1035, 1158), (986, 1127), (1007, 1158), (977, 1134), (1019, 1145), (1008, 1145), (993, 1127), (997, 1136), (1000, 1128), (1009, 1144), (988, 1125), (997, 1152), (1018, 1160), (985, 1124), (974, 1145), (1024, 1154), (977, 1131), (988, 1157), (997, 1141)]
         : compromised: 0.8727, honest: 0.8772
Round 008: test acc mean=0.8794 ± 0.0093 | min=0.8643 max=0.8987
         : test loss mean=0.2874 ± 0.0150
         : individual accs = ['0.883333', '0.887737', '0.867791', '0.869603', '0.874780', '0.898690', '0.880349', '0.885537', '0.872359', '0.879433', '0.886364', '0.891556', '0.881944', '0.872414', '0.895018', '0.871616', '0.883016', '0.868258', '0.864304', '0.874671']
         : correct/total = [(1007, 1140), (1028, 1158), (978, 1127), (1007, 1158), (992, 1134), (1029, 1145), (1008, 1145), (998, 1127), (991, 1136), (992, 1128), (1014, 1144), (1003, 1125), (1016, 1152), (1012, 1160), (1006, 1124), (998, 1145), (1019, 1154), (982, 1131), (1000, 1157), (998, 1141)]
         : compromised: 0.8784, honest: 0.8809
Round 009: test acc mean=0.8896 ± 0.0108 | min=0.8522 max=0.9039
         : test loss mean=0.2688 ± 0.0199
         : individual accs = ['0.893860', '0.897237', '0.879326', '0.898100', '0.888007', '0.903930', '0.891703', '0.897959', '0.894366', '0.893617', '0.894231', '0.896889', '0.891493', '0.890517', '0.892349', '0.879476', '0.889948', '0.876216', '0.852204', '0.891323']
         : correct/total = [(1019, 1140), (1039, 1158), (991, 1127), (1040, 1158), (1007, 1134), (1035, 1145), (1021, 1145), (1012, 1127), (1016, 1136), (1008, 1128), (1023, 1144), (1009, 1125), (1027, 1152), (1033, 1160), (1003, 1124), (1007, 1145), (1027, 1154), (991, 1131), (986, 1157), (1017, 1141)]
         : compromised: 0.8877, honest: 0.8926
Round 010: test acc mean=0.8949 ± 0.0081 | min=0.8762 max=0.9066
         : test loss mean=0.2582 ± 0.0154
         : individual accs = ['0.900000', '0.895509', '0.889086', '0.897237', '0.891534', '0.904803', '0.890830', '0.905058', '0.899648', '0.905142', '0.894231', '0.898667', '0.896701', '0.896552', '0.906584', '0.889083', '0.896014', '0.876216', '0.877269', '0.887818']
         : correct/total = [(1026, 1140), (1037, 1158), (1002, 1127), (1039, 1158), (1011, 1134), (1036, 1145), (1020, 1145), (1020, 1127), (1022, 1136), (1021, 1128), (1023, 1144), (1011, 1125), (1033, 1152), (1040, 1160), (1019, 1124), (1018, 1145), (1034, 1154), (991, 1131), (1015, 1157), (1013, 1141)]
         : compromised: 0.8939, honest: 0.8963

=== FINAL RESULTS ===
Dataset: celeba, Nodes: 20, Graph: erdos, Aggregation: balance
Attack: gaussian, 60.0% compromised
Final accuracy - Compromised: 0.8939, Honest: 0.8963
Overall test accuracy: mean=0.8949 ± 0.0081

=== BALANCE SUMMARY ===
Node 0: acceptance=0.438
Node 1: acceptance=0.545
Node 2: acceptance=0.417
Node 3: acceptance=0.500
Node 4: acceptance=0.455
Node 5: acceptance=0.400
Node 6: acceptance=0.357
Node 7: acceptance=0.357
Node 8: acceptance=0.300
Node 9: acceptance=0.462
Node 10: acceptance=0.444
Node 11: acceptance=0.429
Node 12: acceptance=0.500
Node 13: acceptance=0.385
Node 14: acceptance=0.400
Node 15: acceptance=0.364
Node 16: acceptance=0.308
Node 17: acceptance=0.667
Node 18: acceptance=0.438
Node 19: acceptance=0.375

=== PARALLEL EXECUTION TIME (realistic for distributed system) ===
  COMMUNICATION (max across nodes):
    - Full model transfer: 0.000s (0.0%)
  COMPUTATION (max across nodes):
    - Filtering: 0.050s (80.3%)
    - Aggregation: 0.012s (19.7%)
  TOTALS:
    - Total computation: 0.062s (100.0%)
    - Total communication: 0.000s (0.0%)
    - Total parallel time: 0.062s

=== PER-NODE AVERAGE TIME ===
  - Filtering: 0.034s
  - Aggregation: 0.005s
  - Model transfer: 0.000s
  - Total per node: 0.038s

=== TOTAL COMPUTATIONAL WORK (sum across all nodes) ===
  - Total filtering: 0.674s
  - Total aggregation: 0.094s
  - Total model transfer: 0.000s
  - Grand total: 0.768s
  - Mean acceptance rate: 0.427

BALANCE Algorithm Properties:
  - Model dimension: 2,219,692
  - No compression: Full parameter comparison
  - Theoretical complexity: O(deg(i)×d)
  - Approach: Full parameter filtering + averaging
