Device: cuda
Seed: 987654321
Looking for images in: /home/student.unimelb.edu.au/mrangwala/Projects/Sketchguard/leaf/data/celeba/data/raw/img_align_celeba
Loading 1 LEAF CelebA train files...
LEAF CelebA train: 9343 users (celebrities), 177457 samples
Looking for images in: /home/student.unimelb.edu.au/mrangwala/Projects/Sketchguard/leaf/data/celeba/data/raw/img_align_celeba
Loading 1 LEAF CelebA test files...
LEAF CelebA test: 9343 users (celebrities), 22831 samples
Found 9343 train users, 9343 test users, 9343 common users
User sample counts range: 31 (max) to 4 (min)
Distributed ALL 9343 users across 20 clients
Users per client: 467 (with 3 clients getting +1 user)
Train partition sizes: [8843, 8998, 8728, 9034, 8866, 8946, 8873, 8776, 8816, 8801, 8913, 8656, 9115, 8921, 8699, 8823, 8912, 8766, 9102, 8869]
Test partition sizes: [1140, 1158, 1127, 1158, 1134, 1145, 1145, 1127, 1136, 1128, 1144, 1125, 1152, 1160, 1124, 1145, 1154, 1131, 1157, 1141]
  Client 0: 8843 train samples, 2 unique classes
  Client 1: 8998 train samples, 2 unique classes
  Client 2: 8728 train samples, 2 unique classes
  Client 3: 9034 train samples, 2 unique classes
  Client 4: 8866 train samples, 2 unique classes
  Client 5: 8946 train samples, 2 unique classes
  Client 6: 8873 train samples, 2 unique classes
  Client 7: 8776 train samples, 2 unique classes
  Client 8: 8816 train samples, 2 unique classes
  Client 9: 8801 train samples, 2 unique classes
  Client 10: 8913 train samples, 2 unique classes
  Client 11: 8656 train samples, 2 unique classes
  Client 12: 9115 train samples, 2 unique classes
  Client 13: 8921 train samples, 2 unique classes
  Client 14: 8699 train samples, 2 unique classes
  Client 15: 8823 train samples, 2 unique classes
  Client 16: 8912 train samples, 2 unique classes
  Client 17: 8766 train samples, 2 unique classes
  Client 18: 9102 train samples, 2 unique classes
  Client 19: 8869 train samples, 2 unique classes
Will sample 4500 samples per client per epoch
Graph: erdos, nodes: 20, edges: 48
Degree statistics: avg=4.80, min=2, max=7
Attack: Compromised 2/20 nodes: [5, 13]
Attack type: backdoor, lambda: 1.0
Backdoor target label: 0, trigger size: 8
Model variant: baseline
Model parameters: 2,219,692
Initial test acc across nodes: mean=0.4978 ± 0.0208
Backdoor attack: Created poisoned datasets for 2 compromised nodes
Round 001: test acc mean=0.5369 ± 0.0573 | min=0.4714 max=0.6743
         : test loss mean=35.7101 ± 77.6683
         : individual accs = ['0.592982', '0.508636', '0.595386', '0.493955', '0.524691', '0.513537', '0.606987', '0.488021', '0.674296', '0.656028', '0.525350', '0.496000', '0.471354', '0.497414', '0.486655', '0.480349', '0.561525', '0.505747', '0.541054', '0.517967']
         : correct/total = [(676, 1140), (589, 1158), (671, 1127), (572, 1158), (595, 1134), (588, 1145), (695, 1145), (550, 1127), (766, 1136), (740, 1128), (601, 1144), (558, 1125), (543, 1152), (577, 1160), (547, 1124), (550, 1145), (648, 1154), (572, 1131), (626, 1157), (591, 1141)]
         : compromised: 0.5055, honest: 0.5404
Round 002: test acc mean=0.5053 ± 0.0247 | min=0.4715 max=0.5739
         : test loss mean=209.4958 ± 386.0659
         : individual accs = ['0.528070', '0.508636', '0.506655', '0.471503', '0.521164', '0.485590', '0.521397', '0.496007', '0.573944', '0.496454', '0.508741', '0.501333', '0.477431', '0.493103', '0.482206', '0.482969', '0.487868', '0.491600', '0.522040', '0.549518']
         : correct/total = [(602, 1140), (589, 1158), (571, 1127), (546, 1158), (591, 1134), (556, 1145), (597, 1145), (559, 1127), (652, 1136), (560, 1128), (582, 1144), (564, 1125), (550, 1152), (572, 1160), (542, 1124), (553, 1145), (563, 1154), (556, 1131), (604, 1157), (627, 1141)]
         : compromised: 0.4893, honest: 0.5071
Round 003: test acc mean=0.5087 ± 0.0210 | min=0.4739 max=0.5616
         : test loss mean=2.3114 ± 4.7660
         : individual accs = ['0.542105', '0.506908', '0.493345', '0.510363', '0.520282', '0.517031', '0.491703', '0.493345', '0.561620', '0.503546', '0.500874', '0.500444', '0.524306', '0.502586', '0.508007', '0.518777', '0.491334', '0.473917', '0.476232', '0.537248']
         : correct/total = [(618, 1140), (587, 1158), (556, 1127), (591, 1158), (590, 1134), (592, 1145), (563, 1145), (556, 1127), (638, 1136), (568, 1128), (573, 1144), (563, 1125), (604, 1152), (583, 1160), (571, 1124), (594, 1145), (567, 1154), (536, 1131), (551, 1157), (613, 1141)]
         : compromised: 0.5098, honest: 0.5086
Round 004: test acc mean=0.5150 ± 0.0161 | min=0.4914 max=0.5616
         : test loss mean=23.8538 ± 62.0146
         : individual accs = ['0.520175', '0.502591', '0.494232', '0.532815', '0.517637', '0.515284', '0.522271', '0.501331', '0.561620', '0.493794', '0.527098', '0.497778', '0.529514', '0.491379', '0.517794', '0.516157', '0.516464', '0.504863', '0.522040', '0.515337']
         : correct/total = [(593, 1140), (582, 1158), (557, 1127), (617, 1158), (587, 1134), (590, 1145), (598, 1145), (565, 1127), (638, 1136), (557, 1128), (603, 1144), (560, 1125), (610, 1152), (570, 1160), (582, 1124), (591, 1145), (596, 1154), (571, 1131), (604, 1157), (588, 1141)]
         : compromised: 0.5033, honest: 0.5163
Round 005: test acc mean=0.5091 ± 0.0189 | min=0.4676 max=0.5599
         : test loss mean=1.9019 ± 2.4758
         : individual accs = ['0.528947', '0.508636', '0.467613', '0.525043', '0.481481', '0.514410', '0.503057', '0.504880', '0.559859', '0.491135', '0.487762', '0.497778', '0.519097', '0.506897', '0.511566', '0.516157', '0.505199', '0.511052', '0.520311', '0.520596']
         : correct/total = [(603, 1140), (589, 1158), (527, 1127), (608, 1158), (546, 1134), (589, 1145), (576, 1145), (569, 1127), (636, 1136), (554, 1128), (558, 1144), (560, 1125), (598, 1152), (588, 1160), (575, 1124), (591, 1145), (583, 1154), (578, 1131), (602, 1157), (594, 1141)]
         : compromised: 0.5107, honest: 0.5089
Round 006: test acc mean=0.5145 ± 0.0222 | min=0.4657 max=0.5843
         : test loss mean=2652.9135 ± 7995.6256
         : individual accs = ['0.529825', '0.508636', '0.493345', '0.528497', '0.522046', '0.584279', '0.521397', '0.503993', '0.465669', '0.491135', '0.527972', '0.498667', '0.524306', '0.497414', '0.517794', '0.517031', '0.515598', '0.508400', '0.522040', '0.512708']
         : correct/total = [(604, 1140), (589, 1158), (556, 1127), (612, 1158), (592, 1134), (669, 1145), (597, 1145), (568, 1127), (529, 1136), (554, 1128), (604, 1144), (561, 1125), (604, 1152), (577, 1160), (582, 1124), (592, 1145), (595, 1154), (575, 1131), (604, 1157), (585, 1141)]
         : compromised: 0.5408, honest: 0.5116
Round 007: test acc mean=0.4907 ± 0.0222 | min=0.4375 max=0.5298
         : test loss mean=2635977.9318 ± 8968873.3328
         : individual accs = ['0.529825', '0.492228', '0.500444', '0.471503', '0.477954', '0.518777', '0.478603', '0.465839', '0.437500', '0.507979', '0.474650', '0.501333', '0.476562', '0.518103', '0.482206', '0.482969', '0.484402', '0.516357', '0.477960', '0.517967']
         : correct/total = [(604, 1140), (570, 1158), (564, 1127), (546, 1158), (542, 1134), (594, 1145), (548, 1145), (525, 1127), (497, 1136), (573, 1128), (543, 1144), (564, 1125), (549, 1152), (601, 1160), (542, 1124), (553, 1145), (559, 1154), (584, 1131), (553, 1157), (591, 1141)]
         : compromised: 0.5184, honest: 0.4876
Round 008: test acc mean=0.5135 ± 0.0109 | min=0.4911 max=0.5285
         : test loss mean=nan ± nan
         : individual accs = ['0.516667', '0.508636', '0.493345', '0.528497', '0.522046', '0.514410', '0.520524', '0.496007', '0.525528', '0.491135', '0.525350', '0.498667', '0.522569', '0.506897', '0.517794', '0.517031', '0.515598', '0.508400', '0.522040', '0.518843']
         : correct/total = [(589, 1140), (589, 1158), (556, 1127), (612, 1158), (592, 1134), (589, 1145), (596, 1145), (559, 1127), (597, 1136), (554, 1128), (601, 1144), (561, 1125), (602, 1152), (588, 1160), (582, 1124), (592, 1145), (595, 1154), (575, 1131), (604, 1157), (592, 1141)]
         : compromised: 0.5107, honest: 0.5138
Round 009: test acc mean=0.5164 ± 0.0150 | min=0.4911 max=0.5625
         : test loss mean=nan ± nan
         : individual accs = ['0.528947', '0.508636', '0.493345', '0.528497', '0.522046', '0.514410', '0.521397', '0.503993', '0.562500', '0.491135', '0.525350', '0.498667', '0.522569', '0.506897', '0.517794', '0.517031', '0.515598', '0.508400', '0.522040', '0.517967']
         : correct/total = [(603, 1140), (589, 1158), (556, 1127), (612, 1158), (592, 1134), (589, 1145), (597, 1145), (568, 1127), (639, 1136), (554, 1128), (601, 1144), (561, 1125), (602, 1152), (588, 1160), (582, 1124), (592, 1145), (595, 1154), (575, 1131), (604, 1157), (591, 1141)]
         : compromised: 0.5107, honest: 0.5170
Round 010: test acc mean=0.5164 ± 0.0150 | min=0.4911 max=0.5625
         : test loss mean=nan ± nan
         : individual accs = ['0.528947', '0.508636', '0.493345', '0.528497', '0.522046', '0.514410', '0.521397', '0.503993', '0.562500', '0.491135', '0.525350', '0.498667', '0.522569', '0.506897', '0.517794', '0.517031', '0.515598', '0.508400', '0.522040', '0.517967']
         : correct/total = [(603, 1140), (589, 1158), (556, 1127), (612, 1158), (592, 1134), (589, 1145), (597, 1145), (568, 1127), (639, 1136), (554, 1128), (601, 1144), (561, 1125), (602, 1152), (588, 1160), (582, 1124), (592, 1145), (595, 1154), (575, 1131), (604, 1157), (591, 1141)]
         : compromised: 0.5107, honest: 0.5170

=== FINAL RESULTS ===
Dataset: celeba, Nodes: 20, Graph: erdos, Aggregation: d-fedavg
Attack: backdoor, 10.0% compromised
Final accuracy - Compromised: 0.5107, Honest: 0.5170
Overall test accuracy: mean=0.5164 ± 0.0150

=== BACKDOOR ATTACK SUCCESS RATE (ASR) ===
Target label: 0
Trigger size: 8x8
Overall ASR: 1.0000 ± 0.0000
Honest nodes ASR: 1.0000 ± 0.0000
Compromised nodes ASR: 1.0000 ± 0.0000
Note: Higher ASR indicates more successful backdoor attack
