Device: cuda
Seed: 987654321
Looking for images in: /home/student.unimelb.edu.au/mrangwala/Projects/Sketchguard/leaf/data/celeba/data/raw/img_align_celeba
Loading 1 LEAF CelebA train files...
LEAF CelebA train: 9343 users (celebrities), 177457 samples
Looking for images in: /home/student.unimelb.edu.au/mrangwala/Projects/Sketchguard/leaf/data/celeba/data/raw/img_align_celeba
Loading 1 LEAF CelebA test files...
LEAF CelebA test: 9343 users (celebrities), 22831 samples
Found 9343 train users, 9343 test users, 9343 common users
User sample counts range: 31 (max) to 4 (min)
Distributed ALL 9343 users across 20 clients
Users per client: 467 (with 3 clients getting +1 user)
Train partition sizes: [8843, 8998, 8728, 9034, 8866, 8946, 8873, 8776, 8816, 8801, 8913, 8656, 9115, 8921, 8699, 8823, 8912, 8766, 9102, 8869]
Test partition sizes: [1140, 1158, 1127, 1158, 1134, 1145, 1145, 1127, 1136, 1128, 1144, 1125, 1152, 1160, 1124, 1145, 1154, 1131, 1157, 1141]
  Client 0: 8843 train samples, 2 unique classes
  Client 1: 8998 train samples, 2 unique classes
  Client 2: 8728 train samples, 2 unique classes
  Client 3: 9034 train samples, 2 unique classes
  Client 4: 8866 train samples, 2 unique classes
  Client 5: 8946 train samples, 2 unique classes
  Client 6: 8873 train samples, 2 unique classes
  Client 7: 8776 train samples, 2 unique classes
  Client 8: 8816 train samples, 2 unique classes
  Client 9: 8801 train samples, 2 unique classes
  Client 10: 8913 train samples, 2 unique classes
  Client 11: 8656 train samples, 2 unique classes
  Client 12: 9115 train samples, 2 unique classes
  Client 13: 8921 train samples, 2 unique classes
  Client 14: 8699 train samples, 2 unique classes
  Client 15: 8823 train samples, 2 unique classes
  Client 16: 8912 train samples, 2 unique classes
  Client 17: 8766 train samples, 2 unique classes
  Client 18: 9102 train samples, 2 unique classes
  Client 19: 8869 train samples, 2 unique classes
Will sample 4500 samples per client per epoch
Graph: fully, nodes: 20, edges: 190
Degree statistics: avg=19.00, min=19, max=19
Attack: Compromised 14/20 nodes: [1, 2, 3, 5, 6, 8, 11, 12, 13, 14, 15, 17, 18, 19]
Attack type: backdoor, lambda: 1.0
Backdoor target label: 0, trigger size: 8
Model variant: baseline
Model parameters: 2,219,692
BALANCE algorithm:
Balance Config: BALANCEConfig(gamma=2, kappa=1, alpha=0.5, min_neighbors=1)
  - Model dimension: 2,219,692 parameters
  - Complexity: O(N×d) = O(20×2,219,692)
Initial test acc across nodes: mean=0.4978 ± 0.0208
Backdoor attack: Created poisoned datasets for 14 compromised nodes
Round 001: test acc mean=0.5648 ± 0.0763 | min=0.4942 max=0.7158
         : test loss mean=2752.5701 ± 1866.8272
         : individual accs = ['0.705263', '0.508636', '0.494232', '0.534542', '0.583774', '0.514410', '0.521397', '0.605146', '0.562500', '0.713652', '0.698427', '0.521778', '0.522569', '0.506897', '0.517794', '0.521397', '0.715771', '0.508400', '0.522040', '0.517967']
         : correct/total = [(804, 1140), (589, 1158), (557, 1127), (619, 1158), (662, 1134), (589, 1145), (597, 1145), (682, 1127), (639, 1136), (805, 1128), (799, 1144), (587, 1125), (602, 1152), (588, 1160), (582, 1124), (597, 1145), (826, 1154), (575, 1131), (604, 1157), (591, 1141)]
         : compromised: 0.5196, honest: 0.6703
Round 002: test acc mean=0.5376 ± 0.0805 | min=0.4375 max=0.7019
         : test loss mean=404048490.1489 ± 399110674.8845
         : individual accs = ['0.645614', '0.488774', '0.506655', '0.528497', '0.580247', '0.485590', '0.478603', '0.642413', '0.437500', '0.665780', '0.684441', '0.516444', '0.477431', '0.493103', '0.482206', '0.484716', '0.701906', '0.491600', '0.477960', '0.482033']
         : correct/total = [(736, 1140), (566, 1158), (571, 1127), (612, 1158), (658, 1134), (556, 1145), (548, 1145), (724, 1127), (497, 1136), (751, 1128), (783, 1144), (581, 1125), (550, 1152), (572, 1160), (542, 1124), (555, 1145), (810, 1154), (556, 1131), (553, 1157), (550, 1141)]
         : compromised: 0.4879, honest: 0.6534
Round 003: test acc mean=0.5730 ± 0.0877 | min=0.4933 max=0.7409
         : test loss mean=nan ± nan
         : individual accs = ['0.679825', '0.508636', '0.493345', '0.528497', '0.668430', '0.514410', '0.521397', '0.691216', '0.562500', '0.738475', '0.701923', '0.498667', '0.522569', '0.506897', '0.517794', '0.517031', '0.740901', '0.508400', '0.522040', '0.517967']
         : correct/total = [(775, 1140), (589, 1158), (556, 1127), (612, 1158), (758, 1134), (589, 1145), (597, 1145), (779, 1127), (639, 1136), (833, 1128), (803, 1144), (561, 1125), (602, 1152), (588, 1160), (582, 1124), (592, 1145), (855, 1154), (575, 1131), (604, 1157), (591, 1141)]
         : compromised: 0.5172, honest: 0.7035
Round 004: test acc mean=0.5982 ± 0.1246 | min=0.4933 max=0.7981
         : test loss mean=nan ± nan
         : individual accs = ['0.786842', '0.508636', '0.493345', '0.528497', '0.790123', '0.514410', '0.521397', '0.766637', '0.562500', '0.797872', '0.798077', '0.498667', '0.522569', '0.506897', '0.517794', '0.517031', '0.783362', '0.508400', '0.522040', '0.517967']
         : correct/total = [(897, 1140), (589, 1158), (556, 1127), (612, 1158), (896, 1134), (589, 1145), (597, 1145), (864, 1127), (639, 1136), (900, 1128), (913, 1144), (561, 1125), (602, 1152), (588, 1160), (582, 1124), (592, 1145), (904, 1154), (575, 1131), (604, 1157), (591, 1141)]
         : compromised: 0.5172, honest: 0.7872
Round 005: test acc mean=0.6133 ± 0.1477 | min=0.4933 max=0.8644
         : test loss mean=nan ± nan
         : individual accs = ['0.819298', '0.508636', '0.493345', '0.528497', '0.820988', '0.514410', '0.521397', '0.833185', '0.562500', '0.864362', '0.842657', '0.498667', '0.522569', '0.506897', '0.517794', '0.517031', '0.845754', '0.508400', '0.522040', '0.517967']
         : correct/total = [(934, 1140), (589, 1158), (556, 1127), (612, 1158), (931, 1134), (589, 1145), (597, 1145), (939, 1127), (639, 1136), (975, 1128), (964, 1144), (561, 1125), (602, 1152), (588, 1160), (582, 1124), (592, 1145), (976, 1154), (575, 1131), (604, 1157), (591, 1141)]
         : compromised: 0.5172, honest: 0.8377
Round 006: test acc mean=0.6224 ± 0.1614 | min=0.4933 max=0.8837
         : test loss mean=nan ± nan
         : individual accs = ['0.869298', '0.508636', '0.493345', '0.528497', '0.844797', '0.514410', '0.521397', '0.860692', '0.562500', '0.876773', '0.883741', '0.498667', '0.522569', '0.506897', '0.517794', '0.517031', '0.872617', '0.508400', '0.522040', '0.517967']
         : correct/total = [(991, 1140), (589, 1158), (556, 1127), (612, 1158), (958, 1134), (589, 1145), (597, 1145), (970, 1127), (639, 1136), (989, 1128), (1011, 1144), (561, 1125), (602, 1152), (588, 1160), (582, 1124), (592, 1145), (1007, 1154), (575, 1131), (604, 1157), (591, 1141)]
         : compromised: 0.5172, honest: 0.8680
Round 007: test acc mean=0.6271 ± 0.1685 | min=0.4933 max=0.8925
         : test loss mean=nan ± nan
         : individual accs = ['0.878947', '0.508636', '0.493345', '0.528497', '0.870370', '0.514410', '0.521397', '0.884650', '0.562500', '0.887411', '0.892483', '0.498667', '0.522569', '0.506897', '0.517794', '0.517031', '0.887348', '0.508400', '0.522040', '0.517967']
         : correct/total = [(1002, 1140), (589, 1158), (556, 1127), (612, 1158), (987, 1134), (589, 1145), (597, 1145), (997, 1127), (639, 1136), (1001, 1128), (1021, 1144), (561, 1125), (602, 1152), (588, 1160), (582, 1124), (592, 1145), (1024, 1154), (575, 1131), (604, 1157), (591, 1141)]
         : compromised: 0.5172, honest: 0.8835
Round 008: test acc mean=0.6284 ± 0.1704 | min=0.4933 max=0.8944
         : test loss mean=nan ± nan
         : individual accs = ['0.892105', '0.508636', '0.493345', '0.528497', '0.877425', '0.514410', '0.521397', '0.894410', '0.562500', '0.888298', '0.888112', '0.498667', '0.522569', '0.506897', '0.517794', '0.517031', '0.887348', '0.508400', '0.522040', '0.517967']
         : correct/total = [(1017, 1140), (589, 1158), (556, 1127), (612, 1158), (995, 1134), (589, 1145), (597, 1145), (1008, 1127), (639, 1136), (1002, 1128), (1016, 1144), (561, 1125), (602, 1152), (588, 1160), (582, 1124), (592, 1145), (1024, 1154), (575, 1131), (604, 1157), (591, 1141)]
         : compromised: 0.5172, honest: 0.8879
Round 009: test acc mean=0.6307 ± 0.1740 | min=0.4933 max=0.9033
         : test loss mean=nan ± nan
         : individual accs = ['0.900877', '0.508636', '0.493345', '0.528497', '0.889771', '0.514410', '0.521397', '0.903283', '0.562500', '0.894504', '0.892483', '0.498667', '0.522569', '0.506897', '0.517794', '0.517031', '0.893414', '0.508400', '0.522040', '0.517967']
         : correct/total = [(1027, 1140), (589, 1158), (556, 1127), (612, 1158), (1009, 1134), (589, 1145), (597, 1145), (1018, 1127), (639, 1136), (1009, 1128), (1021, 1144), (561, 1125), (602, 1152), (588, 1160), (582, 1124), (592, 1145), (1031, 1154), (575, 1131), (604, 1157), (591, 1141)]
         : compromised: 0.5172, honest: 0.8957
Round 010: test acc mean=0.6324 ± 0.1766 | min=0.4933 max=0.9061
         : test loss mean=nan ± nan
         : individual accs = ['0.906140', '0.508636', '0.493345', '0.528497', '0.895944', '0.514410', '0.521397', '0.902396', '0.562500', '0.901596', '0.901224', '0.498667', '0.522569', '0.506897', '0.517794', '0.517031', '0.901213', '0.508400', '0.522040', '0.517967']
         : correct/total = [(1033, 1140), (589, 1158), (556, 1127), (612, 1158), (1016, 1134), (589, 1145), (597, 1145), (1017, 1127), (639, 1136), (1017, 1128), (1031, 1144), (561, 1125), (602, 1152), (588, 1160), (582, 1124), (592, 1145), (1040, 1154), (575, 1131), (604, 1157), (591, 1141)]
         : compromised: 0.5172, honest: 0.9014

=== FINAL RESULTS ===
Dataset: celeba, Nodes: 20, Graph: fully, Aggregation: balance
Attack: backdoor, 70.0% compromised
Final accuracy - Compromised: 0.5172, Honest: 0.9014
Overall test accuracy: mean=0.6324 ± 0.1766

=== BACKDOOR ATTACK SUCCESS RATE (ASR) ===
Target label: 0
Trigger size: 8x8
Overall ASR: 0.8611 ± 0.2124
Honest nodes ASR: 0.5371 ± 0.0198
Compromised nodes ASR: 1.0000 ± 0.0000
Note: Higher ASR indicates more successful backdoor attack

=== BALANCE SUMMARY ===
Node 0: acceptance=0.263
Node 1: acceptance=0.132
Node 2: acceptance=0.132
Node 3: acceptance=0.132
Node 4: acceptance=0.263
Node 5: acceptance=0.132
Node 6: acceptance=0.132
Node 7: acceptance=0.263
Node 8: acceptance=0.132
Node 9: acceptance=0.263
Node 10: acceptance=0.263
Node 11: acceptance=0.132
Node 12: acceptance=0.132
Node 13: acceptance=0.132
Node 14: acceptance=0.132
Node 15: acceptance=0.132
Node 16: acceptance=0.263
Node 17: acceptance=0.232
Node 18: acceptance=0.132
Node 19: acceptance=0.132

=== PARALLEL EXECUTION TIME (realistic for distributed system) ===
  COMMUNICATION (max across nodes):
    - Full model transfer: 0.000s (0.0%)
  COMPUTATION (max across nodes):
    - Filtering: 0.054s (83.0%)
    - Aggregation: 0.011s (17.0%)
  TOTALS:
    - Total computation: 0.065s (100.0%)
    - Total communication: 0.000s (0.0%)
    - Total parallel time: 0.065s

=== PER-NODE AVERAGE TIME ===
  - Filtering: 0.050s
  - Aggregation: 0.004s
  - Model transfer: 0.000s
  - Total per node: 0.054s

=== TOTAL COMPUTATIONAL WORK (sum across all nodes) ===
  - Total filtering: 0.994s
  - Total aggregation: 0.086s
  - Total model transfer: 0.000s
  - Grand total: 1.079s
  - Mean acceptance rate: 0.176

BALANCE Algorithm Properties:
  - Model dimension: 2,219,692
  - No compression: Full parameter comparison
  - Theoretical complexity: O(deg(i)×d)
  - Approach: Full parameter filtering + averaging
