Device: cuda
Seed: 987654321
Looking for images in: /home/student.unimelb.edu.au/mrangwala/Projects/Sketchguard/leaf/data/celeba/data/raw/img_align_celeba
Loading 1 LEAF CelebA train files...
LEAF CelebA train: 9343 users (celebrities), 177457 samples
Looking for images in: /home/student.unimelb.edu.au/mrangwala/Projects/Sketchguard/leaf/data/celeba/data/raw/img_align_celeba
Loading 1 LEAF CelebA test files...
LEAF CelebA test: 9343 users (celebrities), 22831 samples
Found 9343 train users, 9343 test users, 9343 common users
User sample counts range: 31 (max) to 4 (min)
Distributed ALL 9343 users across 20 clients
Users per client: 467 (with 3 clients getting +1 user)
Train partition sizes: [8843, 8998, 8728, 9034, 8866, 8946, 8873, 8776, 8816, 8801, 8913, 8656, 9115, 8921, 8699, 8823, 8912, 8766, 9102, 8869]
Test partition sizes: [1140, 1158, 1127, 1158, 1134, 1145, 1145, 1127, 1136, 1128, 1144, 1125, 1152, 1160, 1124, 1145, 1154, 1131, 1157, 1141]
  Client 0: 8843 train samples, 2 unique classes
  Client 1: 8998 train samples, 2 unique classes
  Client 2: 8728 train samples, 2 unique classes
  Client 3: 9034 train samples, 2 unique classes
  Client 4: 8866 train samples, 2 unique classes
  Client 5: 8946 train samples, 2 unique classes
  Client 6: 8873 train samples, 2 unique classes
  Client 7: 8776 train samples, 2 unique classes
  Client 8: 8816 train samples, 2 unique classes
  Client 9: 8801 train samples, 2 unique classes
  Client 10: 8913 train samples, 2 unique classes
  Client 11: 8656 train samples, 2 unique classes
  Client 12: 9115 train samples, 2 unique classes
  Client 13: 8921 train samples, 2 unique classes
  Client 14: 8699 train samples, 2 unique classes
  Client 15: 8823 train samples, 2 unique classes
  Client 16: 8912 train samples, 2 unique classes
  Client 17: 8766 train samples, 2 unique classes
  Client 18: 9102 train samples, 2 unique classes
  Client 19: 8869 train samples, 2 unique classes
Will sample 4500 samples per client per epoch
Graph: erdos, nodes: 20, edges: 126
Degree statistics: avg=12.60, min=8, max=16
Attack: Compromised 14/20 nodes: [1, 2, 3, 5, 6, 8, 11, 12, 13, 14, 15, 17, 18, 19]
Attack type: directed_deviation, lambda: 1.0
Model variant: baseline
Model parameters: 2,219,692
UBAR ALGORITHM (Two-Stage Byzantine-resilient)
  - Model dimension: 2,219,692 parameters
  - Rho parameter: 0.30000000000000004
  - Stage 1: Distance-based filtering (select 30% closest neighbors)
  - Stage 2: Performance-based selection (loss comparison)
  - Complexity: O(deg(i)×d + deg(i)×inference)
Initial test acc across nodes: mean=0.4978 ± 0.0208
Round 001: test acc mean=0.6166 ± 0.0558 | min=0.5240 max=0.7196
         : test loss mean=0.6753 ± 0.0073
         : individual accs = ['0.664035', '0.561313', '0.608696', '0.639896', '0.604938', '0.616594', '0.524017', '0.597161', '0.563380', '0.699468', '0.579545', '0.614222', '0.719618', '0.621552', '0.530249', '0.632314', '0.715771', '0.583554', '0.685393', '0.570552']
         : correct/total = [(757, 1140), (650, 1158), (686, 1127), (741, 1158), (686, 1134), (706, 1145), (600, 1145), (673, 1127), (640, 1136), (789, 1128), (663, 1144), (691, 1125), (829, 1152), (721, 1160), (596, 1124), (724, 1145), (826, 1154), (660, 1131), (793, 1157), (651, 1141)]
         : compromised: 0.6051, honest: 0.6435
         : ubar stats = ['Node 0: s1=0.250, s2=0.250', 'Node 1: s1=0.273, s2=0.667', 'Node 2: s1=0.250, s2=0.333']...
Round 002: test acc mean=0.7237 ± 0.0480 | min=0.5507 max=0.7695
         : test loss mean=0.6152 ± 0.0407
         : individual accs = ['0.754386', '0.720207', '0.749778', '0.708981', '0.660494', '0.737991', '0.731878', '0.686779', '0.734155', '0.744681', '0.769231', '0.755556', '0.709201', '0.749138', '0.550712', '0.715284', '0.769497', '0.737401', '0.765774', '0.722174']
         : correct/total = [(860, 1140), (834, 1158), (845, 1127), (821, 1158), (749, 1134), (845, 1145), (838, 1145), (774, 1127), (834, 1136), (840, 1128), (880, 1144), (850, 1125), (817, 1152), (869, 1160), (619, 1124), (819, 1145), (888, 1154), (834, 1131), (886, 1157), (824, 1141)]
         : compromised: 0.7206, honest: 0.7308
         : ubar stats = ['Node 0: s1=0.250, s2=0.250', 'Node 1: s1=0.273, s2=0.500', 'Node 2: s1=0.250, s2=0.333']...
Round 003: test acc mean=0.8117 ± 0.0259 | min=0.7682 max=0.8611
         : test loss mean=0.4659 ± 0.0517
         : individual accs = ['0.841228', '0.808290', '0.811890', '0.776339', '0.773369', '0.861135', '0.810480', '0.811890', '0.807218', '0.837766', '0.854021', '0.827556', '0.768229', '0.816379', '0.777580', '0.796507', '0.840555', '0.816092', '0.808124', '0.789658']
         : correct/total = [(959, 1140), (936, 1158), (915, 1127), (899, 1158), (877, 1134), (986, 1145), (928, 1145), (915, 1127), (917, 1136), (945, 1128), (977, 1144), (931, 1125), (885, 1152), (947, 1160), (874, 1124), (912, 1145), (970, 1154), (923, 1131), (935, 1157), (901, 1141)]
         : compromised: 0.8054, honest: 0.8265
         : ubar stats = ['Node 0: s1=0.250, s2=0.333', 'Node 1: s1=0.273, s2=0.444', 'Node 2: s1=0.250, s2=0.444']...
Round 004: test acc mean=0.8591 ± 0.0129 | min=0.8366 max=0.8838
         : test loss mean=0.3417 ± 0.0223
         : individual accs = ['0.864035', '0.867012', '0.856256', '0.852332', '0.841270', '0.883843', '0.862882', '0.854481', '0.869718', '0.875887', '0.878497', '0.864000', '0.855035', '0.860345', '0.856762', '0.838428', '0.862218', '0.838196', '0.836646', '0.863278']
         : correct/total = [(985, 1140), (1004, 1158), (965, 1127), (987, 1158), (954, 1134), (1012, 1145), (988, 1145), (963, 1127), (988, 1136), (988, 1128), (1005, 1144), (972, 1125), (985, 1152), (998, 1160), (963, 1124), (960, 1145), (995, 1154), (948, 1131), (968, 1157), (985, 1141)]
         : compromised: 0.8575, honest: 0.8627
         : ubar stats = ['Node 0: s1=0.250, s2=0.312', 'Node 1: s1=0.273, s2=0.417', 'Node 2: s1=0.250, s2=0.417']...
Round 005: test acc mean=0.8601 ± 0.0182 | min=0.8220 max=0.8892
         : test loss mean=0.3180 ± 0.0255
         : individual accs = ['0.828070', '0.875648', '0.851819', '0.860967', '0.862434', '0.827074', '0.875983', '0.858917', '0.881162', '0.889184', '0.867133', '0.856000', '0.857639', '0.851724', '0.868327', '0.864629', '0.878683', '0.844385', '0.821953', '0.879930']
         : correct/total = [(944, 1140), (1014, 1158), (960, 1127), (997, 1158), (978, 1134), (947, 1145), (1003, 1145), (968, 1127), (1001, 1136), (1003, 1128), (992, 1144), (963, 1125), (988, 1152), (988, 1160), (976, 1124), (990, 1145), (1014, 1154), (955, 1131), (951, 1157), (1004, 1141)]
         : compromised: 0.8584, honest: 0.8641
         : ubar stats = ['Node 0: s1=0.250, s2=0.450', 'Node 1: s1=0.273, s2=0.400', 'Node 2: s1=0.250, s2=0.467']...
Round 006: test acc mean=0.8837 ± 0.0083 | min=0.8686 max=0.8952
         : test loss mean=0.2802 ± 0.0145
         : individual accs = ['0.886842', '0.885147', '0.874889', '0.879102', '0.870370', '0.895197', '0.881223', '0.883762', '0.890845', '0.880319', '0.894231', '0.892444', '0.874132', '0.885345', '0.893238', '0.872489', '0.895147', '0.881521', '0.868626', '0.888694']
         : correct/total = [(1011, 1140), (1025, 1158), (986, 1127), (1018, 1158), (987, 1134), (1025, 1145), (1009, 1145), (996, 1127), (1012, 1136), (993, 1128), (1023, 1144), (1004, 1125), (1007, 1152), (1027, 1160), (1004, 1124), (999, 1145), (1033, 1154), (997, 1131), (1005, 1157), (1014, 1141)]
         : compromised: 0.8831, honest: 0.8851
         : ubar stats = ['Node 0: s1=0.250, s2=0.417', 'Node 1: s1=0.273, s2=0.389', 'Node 2: s1=0.250, s2=0.444']...
Round 007: test acc mean=0.8905 ± 0.0085 | min=0.8747 max=0.9022
         : test loss mean=0.2664 ± 0.0138
         : individual accs = ['0.900000', '0.896373', '0.885537', '0.882556', '0.889771', '0.902183', '0.890830', '0.895297', '0.901408', '0.900709', '0.895105', '0.896000', '0.884549', '0.886207', '0.892349', '0.876856', '0.899480', '0.877100', '0.874676', '0.883436']
         : correct/total = [(1026, 1140), (1038, 1158), (998, 1127), (1022, 1158), (1009, 1134), (1033, 1145), (1020, 1145), (1009, 1127), (1024, 1136), (1016, 1128), (1024, 1144), (1008, 1125), (1019, 1152), (1028, 1160), (1003, 1124), (1004, 1145), (1038, 1154), (992, 1131), (1012, 1157), (1008, 1141)]
         : compromised: 0.8879, honest: 0.8967
         : ubar stats = ['Node 0: s1=0.250, s2=0.393', 'Node 1: s1=0.273, s2=0.381', 'Node 2: s1=0.250, s2=0.429']...
Round 008: test acc mean=0.8921 ± 0.0071 | min=0.8755 max=0.9049
         : test loss mean=0.2591 ± 0.0138
         : individual accs = ['0.901754', '0.892055', '0.889086', '0.889465', '0.890653', '0.897817', '0.890830', '0.896185', '0.897007', '0.889184', '0.896853', '0.904889', '0.889757', '0.893966', '0.901246', '0.878603', '0.893414', '0.883289', '0.875540', '0.889571']
         : correct/total = [(1028, 1140), (1033, 1158), (1002, 1127), (1030, 1158), (1010, 1134), (1028, 1145), (1020, 1145), (1010, 1127), (1019, 1136), (1003, 1128), (1026, 1144), (1018, 1125), (1025, 1152), (1037, 1160), (1013, 1124), (1006, 1145), (1031, 1154), (999, 1131), (1013, 1157), (1015, 1141)]
         : compromised: 0.8909, honest: 0.8947
         : ubar stats = ['Node 0: s1=0.250, s2=0.375', 'Node 1: s1=0.273, s2=0.375', 'Node 2: s1=0.250, s2=0.500']...
Round 009: test acc mean=0.8970 ± 0.0110 | min=0.8643 max=0.9138
         : test loss mean=0.2536 ± 0.0176
         : individual accs = ['0.905263', '0.895509', '0.881988', '0.902418', '0.904762', '0.911790', '0.901310', '0.901508', '0.896127', '0.897163', '0.897727', '0.913778', '0.901042', '0.895690', '0.906584', '0.883843', '0.898614', '0.885057', '0.864304', '0.894829']
         : correct/total = [(1032, 1140), (1037, 1158), (994, 1127), (1045, 1158), (1026, 1134), (1044, 1145), (1032, 1145), (1016, 1127), (1018, 1136), (1012, 1128), (1027, 1144), (1028, 1125), (1038, 1152), (1039, 1160), (1019, 1124), (1012, 1145), (1037, 1154), (1001, 1131), (1000, 1157), (1021, 1141)]
         : compromised: 0.8953, honest: 0.9008
         : ubar stats = ['Node 0: s1=0.250, s2=0.361', 'Node 1: s1=0.273, s2=0.444', 'Node 2: s1=0.250, s2=0.481']...
Round 010: test acc mean=0.8979 ± 0.0077 | min=0.8773 max=0.9084
         : test loss mean=0.2482 ± 0.0154
         : individual accs = ['0.903509', '0.900691', '0.890861', '0.904145', '0.898589', '0.896070', '0.896943', '0.900621', '0.903169', '0.903369', '0.901224', '0.904889', '0.902778', '0.897414', '0.908363', '0.887336', '0.902080', '0.882405', '0.877269', '0.895706']
         : correct/total = [(1030, 1140), (1043, 1158), (1004, 1127), (1047, 1158), (1019, 1134), (1026, 1145), (1027, 1145), (1015, 1127), (1026, 1136), (1019, 1128), (1031, 1144), (1018, 1125), (1040, 1152), (1041, 1160), (1021, 1124), (1016, 1145), (1041, 1154), (998, 1131), (1015, 1157), (1022, 1141)]
         : compromised: 0.8963, honest: 0.9016
         : ubar stats = ['Node 0: s1=0.250, s2=0.375', 'Node 1: s1=0.273, s2=0.433', 'Node 2: s1=0.250, s2=0.533']...

=== FINAL RESULTS ===
Dataset: celeba, Nodes: 20, Graph: erdos, Aggregation: ubar
Attack: directed_deviation, 70.0% compromised
Final accuracy - Compromised: 0.8963, Honest: 0.9016
Overall test accuracy: mean=0.8979 ± 0.0077

=== UBAR SUMMARY ===
Node 0: stage1=0.250, stage2=0.375, overall=0.094
Node 1: stage1=0.273, stage2=0.433, overall=0.118
Node 2: stage1=0.250, stage2=0.533, overall=0.133
Node 3: stage1=0.250, stage2=0.650, overall=0.163
Node 4: stage1=0.273, stage2=0.600, overall=0.164
Node 5: stage1=0.267, stage2=0.425, overall=0.113
Node 6: stage1=0.286, stage2=0.375, overall=0.107
Node 7: stage1=0.286, stage2=0.475, overall=0.136
Node 8: stage1=0.300, stage2=0.433, overall=0.130
Node 9: stage1=0.231, stage2=0.567, overall=0.131
Node 10: stage1=0.222, stage2=0.500, overall=0.111
Node 11: stage1=0.286, stage2=0.275, overall=0.079
Node 12: stage1=0.250, stage2=0.600, overall=0.150
Node 13: stage1=0.231, stage2=0.500, overall=0.115
Node 14: stage1=0.267, stage2=0.550, overall=0.147
Node 15: stage1=0.273, stage2=0.400, overall=0.109
Node 16: stage1=0.231, stage2=0.467, overall=0.108
Node 17: stage1=0.222, stage2=0.500, overall=0.111
Node 18: stage1=0.250, stage2=0.450, overall=0.113
Node 19: stage1=0.250, stage2=0.575, overall=0.144

=== PARALLEL EXECUTION TIME (realistic for distributed system) ===
  COMMUNICATION (max across nodes):
    - Full model transfer: 0.000s (0.0%)
  COMPUTATION (max across nodes):
    - Distance computation: 0.046s (15.0%)
    - Loss computation: 0.253s (83.3%)
    - Aggregation: 0.005s (1.8%)
  TOTALS:
    - Total computation: 0.304s (100.0%)
    - Total communication: 0.000s (0.0%)
    - Total parallel time: 0.304s

=== PER-NODE AVERAGE TIME ===
  - Distance computation: 0.033s
  - Loss computation: 0.204s
  - Aggregation: 0.003s
  - Model transfer: 0.000s
  - Total per node: 0.240s

=== TOTAL COMPUTATIONAL WORK (sum across all nodes) ===
  - Total distance computation: 0.653s
  - Total loss computation: 4.082s
  - Total aggregation: 0.066s
  - Total model transfer: 0.000s
  - Grand total: 4.802s
  - Mean Stage 1 acceptance rate: 0.257
  - Mean Stage 2 acceptance rate: 0.484
  - Overall acceptance rate: 0.125

UBAR Algorithm Properties:
  - Model dimension: 2,219,692
  - Rho parameter: 0.30000000000000004
  - Two-stage approach: Distance filtering + loss evaluation
  - Stage 1 selects: 30% of neighbors
  - Stage 2 uses: Training sample loss comparison
  - Theoretical complexity: O(deg(i)×d + deg(i)×inference)
  - Approach: UBAR paper implementation
