Device: cuda
Seed: 987654321
Looking for images in: /home/student.unimelb.edu.au/mrangwala/Projects/Sketchguard/leaf/data/celeba/data/raw/img_align_celeba
Loading 1 LEAF CelebA train files...
LEAF CelebA train: 9343 users (celebrities), 177457 samples
Looking for images in: /home/student.unimelb.edu.au/mrangwala/Projects/Sketchguard/leaf/data/celeba/data/raw/img_align_celeba
Loading 1 LEAF CelebA test files...
LEAF CelebA test: 9343 users (celebrities), 22831 samples
Found 9343 train users, 9343 test users, 9343 common users
User sample counts range: 31 (max) to 4 (min)
Distributed ALL 9343 users across 20 clients
Users per client: 467 (with 3 clients getting +1 user)
Train partition sizes: [8843, 8998, 8728, 9034, 8866, 8946, 8873, 8776, 8816, 8801, 8913, 8656, 9115, 8921, 8699, 8823, 8912, 8766, 9102, 8869]
Test partition sizes: [1140, 1158, 1127, 1158, 1134, 1145, 1145, 1127, 1136, 1128, 1144, 1125, 1152, 1160, 1124, 1145, 1154, 1131, 1157, 1141]
  Client 0: 8843 train samples, 2 unique classes
  Client 1: 8998 train samples, 2 unique classes
  Client 2: 8728 train samples, 2 unique classes
  Client 3: 9034 train samples, 2 unique classes
  Client 4: 8866 train samples, 2 unique classes
  Client 5: 8946 train samples, 2 unique classes
  Client 6: 8873 train samples, 2 unique classes
  Client 7: 8776 train samples, 2 unique classes
  Client 8: 8816 train samples, 2 unique classes
  Client 9: 8801 train samples, 2 unique classes
  Client 10: 8913 train samples, 2 unique classes
  Client 11: 8656 train samples, 2 unique classes
  Client 12: 9115 train samples, 2 unique classes
  Client 13: 8921 train samples, 2 unique classes
  Client 14: 8699 train samples, 2 unique classes
  Client 15: 8823 train samples, 2 unique classes
  Client 16: 8912 train samples, 2 unique classes
  Client 17: 8766 train samples, 2 unique classes
  Client 18: 9102 train samples, 2 unique classes
  Client 19: 8869 train samples, 2 unique classes
Will sample 4500 samples per client per epoch
Graph: erdos, nodes: 20, edges: 99
Degree statistics: avg=9.90, min=7, max=14
Attack: Compromised 2/20 nodes: [5, 13]
Attack type: backdoor, lambda: 1.0
Backdoor target label: 0, trigger size: 8
Model variant: baseline
Model parameters: 2,219,692
BALANCE algorithm:
Balance Config: BALANCEConfig(gamma=2, kappa=1, alpha=0.5, min_neighbors=1)
  - Model dimension: 2,219,692 parameters
  - Complexity: O(N×d) = O(20×2,219,692)
Initial test acc across nodes: mean=0.4978 ± 0.0208
Backdoor attack: Created poisoned datasets for 2 compromised nodes
Round 001: test acc mean=0.6636 ± 0.0664 | min=0.5069 max=0.7254
         : test loss mean=366.3611 ± 1110.3461
         : individual accs = ['0.702632', '0.664940', '0.621118', '0.717617', '0.548501', '0.514410', '0.686463', '0.618456', '0.725352', '0.710993', '0.680070', '0.722667', '0.712674', '0.506897', '0.678826', '0.671616', '0.707106', '0.705570', '0.719965', '0.655565']
         : correct/total = [(801, 1140), (770, 1158), (700, 1127), (831, 1158), (622, 1134), (589, 1145), (786, 1145), (697, 1127), (824, 1136), (802, 1128), (778, 1144), (813, 1125), (821, 1152), (588, 1160), (763, 1124), (769, 1145), (816, 1154), (798, 1131), (833, 1157), (748, 1141)]
         : compromised: 0.5107, honest: 0.6806
Round 002: test acc mean=0.6405 ± 0.0583 | min=0.5052 max=0.7083
         : test loss mean=18.8520 ± 77.3549
         : individual accs = ['0.649123', '0.664076', '0.652174', '0.632988', '0.529101', '0.516157', '0.636681', '0.671695', '0.690141', '0.641844', '0.691434', '0.684444', '0.708333', '0.505172', '0.584520', '0.658515', '0.668111', '0.655172', '0.691443', '0.678352']
         : correct/total = [(740, 1140), (769, 1158), (735, 1127), (733, 1158), (600, 1134), (591, 1145), (729, 1145), (757, 1127), (784, 1136), (724, 1128), (791, 1144), (770, 1125), (816, 1152), (586, 1160), (657, 1124), (754, 1145), (771, 1154), (741, 1131), (800, 1157), (774, 1141)]
         : compromised: 0.5107, honest: 0.6549
Round 003: test acc mean=0.6353 ± 0.0641 | min=0.4856 max=0.7227
         : test loss mean=41000273957.6673 ± 178703681002.3261
         : individual accs = ['0.607018', '0.668394', '0.666371', '0.696891', '0.574074', '0.485590', '0.613100', '0.641526', '0.722711', '0.679965', '0.674825', '0.674667', '0.653646', '0.509483', '0.530249', '0.653275', '0.673310', '0.614500', '0.715644', '0.650307']
         : correct/total = [(692, 1140), (774, 1158), (751, 1127), (807, 1158), (651, 1134), (556, 1145), (702, 1145), (723, 1127), (821, 1136), (767, 1128), (772, 1144), (759, 1125), (753, 1152), (591, 1160), (596, 1124), (748, 1145), (777, 1154), (695, 1131), (828, 1157), (742, 1141)]
         : compromised: 0.4975, honest: 0.6506
Round 004: test acc mean=0.6724 ± 0.0612 | min=0.5069 max=0.7305
         : test loss mean=nan ± nan
         : individual accs = ['0.686842', '0.700345', '0.677906', '0.722798', '0.655203', '0.514410', '0.675109', '0.645963', '0.721831', '0.698582', '0.705420', '0.725333', '0.690972', '0.506897', '0.658363', '0.705677', '0.730503', '0.691424', '0.719965', '0.614373']
         : correct/total = [(783, 1140), (811, 1158), (764, 1127), (837, 1158), (743, 1134), (589, 1145), (773, 1145), (728, 1127), (820, 1136), (788, 1128), (807, 1144), (816, 1125), (796, 1152), (588, 1160), (740, 1124), (808, 1145), (843, 1154), (782, 1131), (833, 1157), (701, 1141)]
         : compromised: 0.5107, honest: 0.6904
Round 005: test acc mean=0.7282 ± 0.0761 | min=0.5069 max=0.7867
         : test loss mean=nan ± nan
         : individual accs = ['0.755263', '0.765976', '0.701863', '0.767703', '0.745150', '0.514410', '0.772052', '0.732919', '0.779930', '0.754433', '0.786713', '0.768000', '0.730903', '0.506897', '0.719751', '0.775546', '0.762565', '0.761273', '0.759723', '0.702016']
         : correct/total = [(861, 1140), (887, 1158), (791, 1127), (889, 1158), (845, 1134), (589, 1145), (884, 1145), (826, 1127), (886, 1136), (851, 1128), (900, 1144), (864, 1125), (842, 1152), (588, 1160), (809, 1124), (888, 1145), (880, 1154), (861, 1131), (879, 1157), (801, 1141)]
         : compromised: 0.5107, honest: 0.7523
Round 006: test acc mean=0.7622 ± 0.0859 | min=0.5069 max=0.8248
         : test loss mean=nan ± nan
         : individual accs = ['0.775439', '0.807427', '0.788820', '0.809154', '0.778660', '0.514410', '0.788646', '0.766637', '0.824824', '0.781915', '0.815559', '0.794667', '0.807292', '0.506897', '0.787367', '0.798253', '0.802426', '0.744474', '0.786517', '0.765118']
         : correct/total = [(884, 1140), (935, 1158), (889, 1127), (937, 1158), (883, 1134), (589, 1145), (903, 1145), (864, 1127), (937, 1136), (882, 1128), (933, 1144), (894, 1125), (930, 1152), (588, 1160), (885, 1124), (914, 1145), (926, 1154), (842, 1131), (910, 1157), (873, 1141)]
         : compromised: 0.5107, honest: 0.7902
Round 007: test acc mean=0.8037 ± 0.0983 | min=0.5069 max=0.8566
         : test loss mean=nan ± nan
         : individual accs = ['0.833333', '0.856649', '0.837622', '0.838515', '0.823633', '0.514410', '0.852402', '0.825200', '0.841549', '0.851950', '0.843531', '0.856000', '0.830729', '0.506897', '0.825623', '0.827074', '0.831889', '0.824050', '0.820225', '0.833479']
         : correct/total = [(950, 1140), (992, 1158), (944, 1127), (971, 1158), (934, 1134), (589, 1145), (976, 1145), (930, 1127), (956, 1136), (961, 1128), (965, 1144), (963, 1125), (957, 1152), (588, 1160), (928, 1124), (947, 1145), (960, 1154), (932, 1131), (949, 1157), (951, 1141)]
         : compromised: 0.5107, honest: 0.8363
Round 008: test acc mean=0.8270 ± 0.1059 | min=0.5069 max=0.8782
         : test loss mean=nan ± nan
         : individual accs = ['0.860526', '0.874784', '0.863354', '0.866149', '0.854497', '0.514410', '0.868122', '0.865129', '0.865317', '0.867021', '0.871503', '0.878222', '0.853299', '0.506897', '0.871886', '0.853275', '0.863951', '0.842617', '0.841832', '0.858019']
         : correct/total = [(981, 1140), (1013, 1158), (973, 1127), (1003, 1158), (969, 1134), (589, 1145), (994, 1145), (975, 1127), (983, 1136), (978, 1128), (997, 1144), (988, 1125), (983, 1152), (588, 1160), (980, 1124), (977, 1145), (997, 1154), (953, 1131), (974, 1157), (979, 1141)]
         : compromised: 0.5107, honest: 0.8622
Round 009: test acc mean=0.8360 ± 0.1092 | min=0.5069 max=0.8912
         : test loss mean=nan ± nan
         : individual accs = ['0.879825', '0.891192', '0.855368', '0.879102', '0.863316', '0.514410', '0.886463', '0.876664', '0.875880', '0.879433', '0.884615', '0.887111', '0.868056', '0.506897', '0.868327', '0.857642', '0.873484', '0.854996', '0.840968', '0.876424']
         : correct/total = [(1003, 1140), (1032, 1158), (964, 1127), (1018, 1158), (979, 1134), (589, 1145), (1015, 1145), (988, 1127), (995, 1136), (992, 1128), (1012, 1144), (998, 1125), (1000, 1152), (588, 1160), (976, 1124), (982, 1145), (1008, 1154), (967, 1131), (973, 1157), (1000, 1141)]
         : compromised: 0.5107, honest: 0.8722
Round 010: test acc mean=0.8475 ± 0.1126 | min=0.5069 max=0.8998
         : test loss mean=nan ± nan
         : individual accs = ['0.892982', '0.886010', '0.877551', '0.892919', '0.876543', '0.514410', '0.883843', '0.886424', '0.889085', '0.899823', '0.890734', '0.887111', '0.883681', '0.506897', '0.893238', '0.871616', '0.888215', '0.875332', '0.866033', '0.886941']
         : correct/total = [(1018, 1140), (1026, 1158), (989, 1127), (1034, 1158), (994, 1134), (589, 1145), (1012, 1145), (999, 1127), (1010, 1136), (1015, 1128), (1019, 1144), (998, 1125), (1018, 1152), (588, 1160), (1004, 1124), (998, 1145), (1025, 1154), (990, 1131), (1002, 1157), (1012, 1141)]
         : compromised: 0.5107, honest: 0.8849

=== FINAL RESULTS ===
Dataset: celeba, Nodes: 20, Graph: erdos, Aggregation: balance
Attack: backdoor, 10.0% compromised
Final accuracy - Compromised: 0.5107, Honest: 0.8849
Overall test accuracy: mean=0.8475 ± 0.1126

=== BACKDOOR ATTACK SUCCESS RATE (ASR) ===
Target label: 0
Trigger size: 8x8
Overall ASR: 0.5886 ± 0.1388
Honest nodes ASR: 0.5429 ± 0.0227
Compromised nodes ASR: 1.0000 ± 0.0000
Note: Higher ASR indicates more successful backdoor attack

=== BALANCE SUMMARY ===
Node 0: acceptance=0.917
Node 1: acceptance=0.900
Node 2: acceptance=1.000
Node 3: acceptance=0.857
Node 4: acceptance=0.889
Node 5: acceptance=0.300
Node 6: acceptance=0.833
Node 7: acceptance=0.909
Node 8: acceptance=0.714
Node 9: acceptance=1.000
Node 10: acceptance=1.000
Node 11: acceptance=0.833
Node 12: acceptance=0.917
Node 13: acceptance=0.300
Node 14: acceptance=0.857
Node 15: acceptance=0.889
Node 16: acceptance=1.000
Node 17: acceptance=0.875
Node 18: acceptance=0.917
Node 19: acceptance=0.800

=== PARALLEL EXECUTION TIME (realistic for distributed system) ===
  COMMUNICATION (max across nodes):
    - Full model transfer: 0.000s (0.0%)
  COMPUTATION (max across nodes):
    - Filtering: 0.041s (74.4%)
    - Aggregation: 0.014s (25.6%)
  TOTALS:
    - Total computation: 0.055s (100.0%)
    - Total communication: 0.000s (0.0%)
    - Total parallel time: 0.055s

=== PER-NODE AVERAGE TIME ===
  - Filtering: 0.027s
  - Aggregation: 0.006s
  - Model transfer: 0.000s
  - Total per node: 0.033s

=== TOTAL COMPUTATIONAL WORK (sum across all nodes) ===
  - Total filtering: 0.542s
  - Total aggregation: 0.118s
  - Total model transfer: 0.000s
  - Grand total: 0.661s
  - Mean acceptance rate: 0.835

BALANCE Algorithm Properties:
  - Model dimension: 2,219,692
  - No compression: Full parameter comparison
  - Theoretical complexity: O(deg(i)×d)
  - Approach: Full parameter filtering + averaging
