Device: cuda
Seed: 987654321
Looking for images in: /home/student.unimelb.edu.au/mrangwala/Projects/Sketchguard/leaf/data/celeba/data/raw/img_align_celeba
Loading 1 LEAF CelebA train files...
LEAF CelebA train: 9343 users (celebrities), 177457 samples
Looking for images in: /home/student.unimelb.edu.au/mrangwala/Projects/Sketchguard/leaf/data/celeba/data/raw/img_align_celeba
Loading 1 LEAF CelebA test files...
LEAF CelebA test: 9343 users (celebrities), 22831 samples
Found 9343 train users, 9343 test users, 9343 common users
User sample counts range: 31 (max) to 4 (min)
Distributed ALL 9343 users across 20 clients
Users per client: 467 (with 3 clients getting +1 user)
Train partition sizes: [8843, 8998, 8728, 9034, 8866, 8946, 8873, 8776, 8816, 8801, 8913, 8656, 9115, 8921, 8699, 8823, 8912, 8766, 9102, 8869]
Test partition sizes: [1140, 1158, 1127, 1158, 1134, 1145, 1145, 1127, 1136, 1128, 1144, 1125, 1152, 1160, 1124, 1145, 1154, 1131, 1157, 1141]
  Client 0: 8843 train samples, 2 unique classes
  Client 1: 8998 train samples, 2 unique classes
  Client 2: 8728 train samples, 2 unique classes
  Client 3: 9034 train samples, 2 unique classes
  Client 4: 8866 train samples, 2 unique classes
  Client 5: 8946 train samples, 2 unique classes
  Client 6: 8873 train samples, 2 unique classes
  Client 7: 8776 train samples, 2 unique classes
  Client 8: 8816 train samples, 2 unique classes
  Client 9: 8801 train samples, 2 unique classes
  Client 10: 8913 train samples, 2 unique classes
  Client 11: 8656 train samples, 2 unique classes
  Client 12: 9115 train samples, 2 unique classes
  Client 13: 8921 train samples, 2 unique classes
  Client 14: 8699 train samples, 2 unique classes
  Client 15: 8823 train samples, 2 unique classes
  Client 16: 8912 train samples, 2 unique classes
  Client 17: 8766 train samples, 2 unique classes
  Client 18: 9102 train samples, 2 unique classes
  Client 19: 8869 train samples, 2 unique classes
Will sample 4500 samples per client per epoch
Graph: erdos, nodes: 20, edges: 126
Degree statistics: avg=12.60, min=8, max=16
Attack: Compromised 10/20 nodes: [1, 2, 5, 11, 12, 13, 14, 15, 17, 18]
Attack type: backdoor, lambda: 1.0
Backdoor target label: 0, trigger size: 8
Model variant: baseline
Model parameters: 2,219,692
UBAR ALGORITHM (Two-Stage Byzantine-resilient)
  - Model dimension: 2,219,692 parameters
  - Rho parameter: 0.5
  - Stage 1: Distance-based filtering (select 50% closest neighbors)
  - Stage 2: Performance-based selection (loss comparison)
  - Complexity: O(deg(i)×d + deg(i)×inference)
Initial test acc across nodes: mean=0.4978 ± 0.0208
Backdoor attack: Created poisoned datasets for 10 compromised nodes
Round 001: test acc mean=0.5701 ± 0.0669 | min=0.4942 max=0.7158
         : test loss mean=1942.9262 ± 1996.6472
         : individual accs = ['0.625439', '0.508636', '0.494232', '0.696028', '0.617284', '0.514410', '0.599127', '0.624667', '0.562500', '0.673759', '0.579545', '0.520889', '0.522569', '0.506897', '0.517794', '0.521397', '0.715771', '0.508400', '0.522040', '0.570552']
         : correct/total = [(713, 1140), (589, 1158), (557, 1127), (806, 1158), (700, 1134), (589, 1145), (686, 1145), (704, 1127), (639, 1136), (760, 1128), (663, 1144), (586, 1125), (602, 1152), (588, 1160), (582, 1124), (597, 1145), (826, 1154), (575, 1131), (604, 1157), (651, 1141)]
         : compromised: 0.5137, honest: 0.6265
         : ubar stats = ['Node 0: s1=0.500, s2=0.125', 'Node 1: s1=0.455, s2=1.000', 'Node 2: s1=0.500, s2=0.833']...
Round 002: test acc mean=0.6027 ± 0.1056 | min=0.4777 max=0.7657
         : test loss mean=484.7039 ± 1095.0925
         : individual accs = ['0.700877', '0.505181', '0.493345', '0.730570', '0.576720', '0.510917', '0.728384', '0.682343', '0.696303', '0.692376', '0.765734', '0.491556', '0.516493', '0.494828', '0.517794', '0.477729', '0.727903', '0.508400', '0.514261', '0.723050']
         : correct/total = [(799, 1140), (585, 1158), (556, 1127), (846, 1158), (654, 1134), (585, 1145), (834, 1145), (769, 1127), (791, 1136), (781, 1128), (876, 1144), (553, 1125), (595, 1152), (574, 1160), (582, 1124), (547, 1145), (840, 1154), (575, 1131), (595, 1157), (825, 1141)]
         : compromised: 0.5031, honest: 0.7024
         : ubar stats = ['Node 0: s1=0.500, s2=0.125', 'Node 1: s1=0.455, s2=1.000', 'Node 2: s1=0.500, s2=0.833']...
Round 003: test acc mean=0.6240 ± 0.1362 | min=0.4774 max=0.8260
         : test loss mean=nan ± nan
         : individual accs = ['0.804386', '0.491364', '0.506655', '0.793610', '0.649912', '0.485590', '0.752838', '0.716060', '0.739437', '0.738475', '0.826049', '0.502222', '0.477431', '0.493103', '0.482206', '0.517031', '0.794627', '0.491600', '0.477960', '0.738826']
         : correct/total = [(917, 1140), (569, 1158), (571, 1127), (919, 1158), (737, 1134), (556, 1145), (862, 1145), (807, 1127), (840, 1136), (833, 1128), (945, 1144), (565, 1125), (550, 1152), (572, 1160), (542, 1124), (592, 1145), (917, 1154), (556, 1131), (553, 1157), (843, 1141)]
         : compromised: 0.4925, honest: 0.7554
         : ubar stats = ['Node 0: s1=0.500, s2=0.167', 'Node 1: s1=0.455, s2=1.000', 'Node 2: s1=0.500, s2=0.889']...
Round 004: test acc mean=0.6573 ± 0.1489 | min=0.4933 max=0.8514
         : test loss mean=nan ± nan
         : individual accs = ['0.850000', '0.508636', '0.493345', '0.803972', '0.761905', '0.514410', '0.736245', '0.781721', '0.828345', '0.770390', '0.851399', '0.498667', '0.522569', '0.506897', '0.517794', '0.517031', '0.815425', '0.508400', '0.522040', '0.836985']
         : correct/total = [(969, 1140), (589, 1158), (556, 1127), (931, 1158), (864, 1134), (589, 1145), (843, 1145), (881, 1127), (941, 1136), (869, 1128), (974, 1144), (561, 1125), (602, 1152), (588, 1160), (582, 1124), (592, 1145), (941, 1154), (575, 1131), (604, 1157), (955, 1141)]
         : compromised: 0.5110, honest: 0.8036
         : ubar stats = ['Node 0: s1=0.500, s2=0.156', 'Node 1: s1=0.455, s2=0.800', 'Node 2: s1=0.500, s2=0.708']...
Round 005: test acc mean=0.6830 ± 0.1725 | min=0.4933 max=0.8759
         : test loss mean=nan ± nan
         : individual accs = ['0.838596', '0.508636', '0.493345', '0.839378', '0.840388', '0.514410', '0.857642', '0.826974', '0.867077', '0.867908', '0.875874', '0.498667', '0.522569', '0.506897', '0.517794', '0.517031', '0.867418', '0.508400', '0.522040', '0.868536']
         : correct/total = [(956, 1140), (589, 1158), (556, 1127), (972, 1158), (953, 1134), (589, 1145), (982, 1145), (932, 1127), (985, 1136), (979, 1128), (1002, 1144), (561, 1125), (602, 1152), (588, 1160), (582, 1124), (592, 1145), (1001, 1154), (575, 1131), (604, 1157), (991, 1141)]
         : compromised: 0.5110, honest: 0.8550
         : ubar stats = ['Node 0: s1=0.500, s2=0.300', 'Node 1: s1=0.455, s2=0.680', 'Node 2: s1=0.500, s2=0.600']...
Round 006: test acc mean=0.6936 ± 0.1829 | min=0.4933 max=0.8916
         : test loss mean=nan ± nan
         : individual accs = ['0.870175', '0.508636', '0.493345', '0.873057', '0.853616', '0.514410', '0.877729', '0.866016', '0.885563', '0.879433', '0.891608', '0.498667', '0.522569', '0.506897', '0.517794', '0.517031', '0.882149', '0.508400', '0.522040', '0.882559']
         : correct/total = [(992, 1140), (589, 1158), (556, 1127), (1011, 1158), (968, 1134), (589, 1145), (1005, 1145), (976, 1127), (1006, 1136), (992, 1128), (1020, 1144), (561, 1125), (602, 1152), (588, 1160), (582, 1124), (592, 1145), (1018, 1154), (575, 1131), (604, 1157), (1007, 1141)]
         : compromised: 0.5110, honest: 0.8762
         : ubar stats = ['Node 0: s1=0.500, s2=0.271', 'Node 1: s1=0.455, s2=0.600', 'Node 2: s1=0.500, s2=0.528']...
Round 007: test acc mean=0.6982 ± 0.1874 | min=0.4933 max=0.8926
         : test loss mean=nan ± nan
         : individual accs = ['0.885965', '0.508636', '0.493345', '0.866149', '0.873898', '0.514410', '0.882096', '0.892635', '0.889965', '0.890957', '0.889860', '0.498667', '0.522569', '0.506897', '0.517794', '0.517031', '0.892548', '0.508400', '0.522040', '0.890447']
         : correct/total = [(1010, 1140), (589, 1158), (556, 1127), (1003, 1158), (991, 1134), (589, 1145), (1010, 1145), (1006, 1127), (1011, 1136), (1005, 1128), (1018, 1144), (561, 1125), (602, 1152), (588, 1160), (582, 1124), (592, 1145), (1030, 1154), (575, 1131), (604, 1157), (1016, 1141)]
         : compromised: 0.5110, honest: 0.8855
         : ubar stats = ['Node 0: s1=0.500, s2=0.286', 'Node 1: s1=0.455, s2=0.543', 'Node 2: s1=0.500, s2=0.476']...
Round 008: test acc mean=0.7001 ± 0.1893 | min=0.4933 max=0.8969
         : test loss mean=nan ± nan
         : individual accs = ['0.887719', '0.508636', '0.493345', '0.879102', '0.886243', '0.514410', '0.890830', '0.893523', '0.885563', '0.892730', '0.896853', '0.498667', '0.522569', '0.506897', '0.517794', '0.517031', '0.894281', '0.508400', '0.522040', '0.885188']
         : correct/total = [(1012, 1140), (589, 1158), (556, 1127), (1018, 1158), (1005, 1134), (589, 1145), (1020, 1145), (1007, 1127), (1006, 1136), (1007, 1128), (1026, 1144), (561, 1125), (602, 1152), (588, 1160), (582, 1124), (592, 1145), (1032, 1154), (575, 1131), (604, 1157), (1010, 1141)]
         : compromised: 0.5110, honest: 0.8892
         : ubar stats = ['Node 0: s1=0.500, s2=0.266', 'Node 1: s1=0.455, s2=0.500', 'Node 2: s1=0.500, s2=0.438']...
Round 009: test acc mean=0.7044 ± 0.1936 | min=0.4933 max=0.9035
         : test loss mean=nan ± nan
         : individual accs = ['0.903509', '0.508636', '0.493345', '0.896373', '0.896825', '0.514410', '0.896943', '0.902396', '0.902289', '0.894504', '0.901224', '0.498667', '0.522569', '0.506897', '0.517794', '0.517031', '0.889081', '0.508400', '0.522040', '0.895706']
         : correct/total = [(1030, 1140), (589, 1158), (556, 1127), (1038, 1158), (1017, 1134), (589, 1145), (1027, 1145), (1017, 1127), (1025, 1136), (1009, 1128), (1031, 1144), (561, 1125), (602, 1152), (588, 1160), (582, 1124), (592, 1145), (1026, 1154), (575, 1131), (604, 1157), (1022, 1141)]
         : compromised: 0.5110, honest: 0.8979
         : ubar stats = ['Node 0: s1=0.500, s2=0.250', 'Node 1: s1=0.455, s2=0.467', 'Node 2: s1=0.500, s2=0.407']...
Round 010: test acc mean=0.7059 ± 0.1950 | min=0.4933 max=0.9096
         : test loss mean=nan ± nan
         : individual accs = ['0.903509', '0.508636', '0.493345', '0.908463', '0.894180', '0.514410', '0.894323', '0.902396', '0.896127', '0.909574', '0.902972', '0.498667', '0.522569', '0.506897', '0.517794', '0.517031', '0.902080', '0.508400', '0.522040', '0.893953']
         : correct/total = [(1030, 1140), (589, 1158), (556, 1127), (1052, 1158), (1014, 1134), (589, 1145), (1024, 1145), (1017, 1127), (1018, 1136), (1026, 1128), (1033, 1144), (561, 1125), (602, 1152), (588, 1160), (582, 1124), (592, 1145), (1041, 1154), (575, 1131), (604, 1157), (1020, 1141)]
         : compromised: 0.5110, honest: 0.9008
         : ubar stats = ['Node 0: s1=0.500, s2=0.237', 'Node 1: s1=0.455, s2=0.440', 'Node 2: s1=0.500, s2=0.383']...

=== FINAL RESULTS ===
Dataset: celeba, Nodes: 20, Graph: erdos, Aggregation: ubar
Attack: backdoor, 50.0% compromised
Final accuracy - Compromised: 0.5110, Honest: 0.9008
Overall test accuracy: mean=0.7059 ± 0.1950

=== BACKDOOR ATTACK SUCCESS RATE (ASR) ===
Target label: 0
Trigger size: 8x8
Overall ASR: 0.7736 ± 0.2269
Honest nodes ASR: 0.5472 ± 0.0208
Compromised nodes ASR: 1.0000 ± 0.0000
Note: Higher ASR indicates more successful backdoor attack

=== UBAR SUMMARY ===
Node 0: stage1=0.500, stage2=0.237, overall=0.119
Node 1: stage1=0.455, stage2=0.440, overall=0.200
Node 2: stage1=0.500, stage2=0.383, overall=0.192
Node 3: stage1=0.500, stage2=0.400, overall=0.200
Node 4: stage1=0.455, stage2=0.560, overall=0.255
Node 5: stage1=0.467, stage2=0.400, overall=0.187
Node 6: stage1=0.500, stage2=0.286, overall=0.143
Node 7: stage1=0.500, stage2=0.557, overall=0.279
Node 8: stage1=0.500, stage2=0.400, overall=0.200
Node 9: stage1=0.462, stage2=0.500, overall=0.231
Node 10: stage1=0.444, stage2=0.300, overall=0.133
Node 11: stage1=0.500, stage2=0.400, overall=0.200
Node 12: stage1=0.500, stage2=0.417, overall=0.208
Node 13: stage1=0.462, stage2=0.417, overall=0.192
Node 14: stage1=0.467, stage2=0.400, overall=0.187
Node 15: stage1=0.455, stage2=0.360, overall=0.164
Node 16: stage1=0.462, stage2=0.250, overall=0.115
Node 17: stage1=0.444, stage2=0.475, overall=0.211
Node 18: stage1=0.500, stage2=0.388, overall=0.194
Node 19: stage1=0.500, stage2=0.250, overall=0.125

=== PARALLEL EXECUTION TIME (realistic for distributed system) ===
  COMMUNICATION (max across nodes):
    - Full model transfer: 0.000s (0.0%)
  COMPUTATION (max across nodes):
    - Distance computation: 0.040s (16.0%)
    - Loss computation: 0.203s (81.9%)
    - Aggregation: 0.005s (2.0%)
  TOTALS:
    - Total computation: 0.248s (100.0%)
    - Total communication: 0.000s (0.0%)
    - Total parallel time: 0.248s

=== PER-NODE AVERAGE TIME ===
  - Distance computation: 0.032s
  - Loss computation: 0.174s
  - Aggregation: 0.004s
  - Model transfer: 0.000s
  - Total per node: 0.210s

=== TOTAL COMPUTATIONAL WORK (sum across all nodes) ===
  - Total distance computation: 0.642s
  - Total loss computation: 3.474s
  - Total aggregation: 0.077s
  - Total model transfer: 0.000s
  - Grand total: 4.192s
  - Mean Stage 1 acceptance rate: 0.479
  - Mean Stage 2 acceptance rate: 0.391
  - Overall acceptance rate: 0.187

UBAR Algorithm Properties:
  - Model dimension: 2,219,692
  - Rho parameter: 0.5
  - Two-stage approach: Distance filtering + loss evaluation
  - Stage 1 selects: 50% of neighbors
  - Stage 2 uses: Training sample loss comparison
  - Theoretical complexity: O(deg(i)×d + deg(i)×inference)
  - Approach: UBAR paper implementation
