Device: cuda
Seed: 987654321
Looking for images in: /home/student.unimelb.edu.au/mrangwala/Projects/Sketchguard/leaf/data/celeba/data/raw/img_align_celeba
Loading 1 LEAF CelebA train files...
LEAF CelebA train: 9343 users (celebrities), 177457 samples
Looking for images in: /home/student.unimelb.edu.au/mrangwala/Projects/Sketchguard/leaf/data/celeba/data/raw/img_align_celeba
Loading 1 LEAF CelebA test files...
LEAF CelebA test: 9343 users (celebrities), 22831 samples
Found 9343 train users, 9343 test users, 9343 common users
User sample counts range: 31 (max) to 4 (min)
Distributed ALL 9343 users across 20 clients
Users per client: 467 (with 3 clients getting +1 user)
Train partition sizes: [8843, 8998, 8728, 9034, 8866, 8946, 8873, 8776, 8816, 8801, 8913, 8656, 9115, 8921, 8699, 8823, 8912, 8766, 9102, 8869]
Test partition sizes: [1140, 1158, 1127, 1158, 1134, 1145, 1145, 1127, 1136, 1128, 1144, 1125, 1152, 1160, 1124, 1145, 1154, 1131, 1157, 1141]
  Client 0: 8843 train samples, 2 unique classes
  Client 1: 8998 train samples, 2 unique classes
  Client 2: 8728 train samples, 2 unique classes
  Client 3: 9034 train samples, 2 unique classes
  Client 4: 8866 train samples, 2 unique classes
  Client 5: 8946 train samples, 2 unique classes
  Client 6: 8873 train samples, 2 unique classes
  Client 7: 8776 train samples, 2 unique classes
  Client 8: 8816 train samples, 2 unique classes
  Client 9: 8801 train samples, 2 unique classes
  Client 10: 8913 train samples, 2 unique classes
  Client 11: 8656 train samples, 2 unique classes
  Client 12: 9115 train samples, 2 unique classes
  Client 13: 8921 train samples, 2 unique classes
  Client 14: 8699 train samples, 2 unique classes
  Client 15: 8823 train samples, 2 unique classes
  Client 16: 8912 train samples, 2 unique classes
  Client 17: 8766 train samples, 2 unique classes
  Client 18: 9102 train samples, 2 unique classes
  Client 19: 8869 train samples, 2 unique classes
Will sample 4500 samples per client per epoch
Graph: fully, nodes: 20, edges: 190
Degree statistics: avg=19.00, min=19, max=19
Attack: Compromised 2/20 nodes: [5, 13]
Attack type: backdoor, lambda: 1.0
Backdoor target label: 0, trigger size: 8
Model variant: baseline
Model parameters: 2,219,692
Initial test acc across nodes: mean=0.4978 ± 0.0208
Backdoor attack: Created poisoned datasets for 2 compromised nodes
Round 001: test acc mean=0.5026 ± 0.0217 | min=0.4542 max=0.5386
         : test loss mean=4.1244 ± 2.0782
         : individual accs = ['0.481579', '0.510363', '0.538598', '0.493092', '0.534392', '0.517031', '0.521397', '0.503993', '0.454225', '0.521277', '0.471154', '0.488000', '0.489583', '0.507759', '0.515125', '0.487336', '0.477470', '0.519010', '0.525497', '0.494303']
         : correct/total = [(549, 1140), (591, 1158), (607, 1127), (571, 1158), (606, 1134), (592, 1145), (597, 1145), (568, 1127), (516, 1136), (588, 1128), (539, 1144), (549, 1125), (564, 1152), (589, 1160), (579, 1124), (558, 1145), (551, 1154), (587, 1131), (608, 1157), (564, 1141)]
         : compromised: 0.5124, honest: 0.5015
Round 002: test acc mean=0.5164 ± 0.0150 | min=0.4911 max=0.5625
         : test loss mean=14.5717 ± 0.4469
         : individual accs = ['0.528947', '0.508636', '0.493345', '0.528497', '0.522046', '0.514410', '0.521397', '0.503993', '0.562500', '0.491135', '0.525350', '0.498667', '0.522569', '0.506897', '0.517794', '0.517031', '0.515598', '0.508400', '0.522040', '0.517967']
         : correct/total = [(603, 1140), (589, 1158), (556, 1127), (612, 1158), (592, 1134), (589, 1145), (597, 1145), (568, 1127), (639, 1136), (554, 1128), (601, 1144), (561, 1125), (602, 1152), (588, 1160), (582, 1124), (592, 1145), (595, 1154), (575, 1131), (604, 1157), (591, 1141)]
         : compromised: 0.5107, honest: 0.5170
Round 003: test acc mean=0.5275 ± 0.0137 | min=0.5040 max=0.5561
         : test loss mean=0.7990 ± 0.0161
         : individual accs = ['0.556140', '0.515544', '0.503993', '0.543178', '0.507055', '0.533624', '0.531004', '0.527063', '0.542254', '0.516844', '0.520105', '0.517333', '0.542535', '0.538793', '0.528470', '0.543231', '0.520797', '0.507515', '0.528954', '0.524978']
         : correct/total = [(634, 1140), (597, 1158), (568, 1127), (629, 1158), (575, 1134), (611, 1145), (608, 1145), (594, 1127), (616, 1136), (583, 1128), (595, 1144), (582, 1125), (625, 1152), (625, 1160), (594, 1124), (622, 1145), (601, 1154), (574, 1131), (612, 1157), (599, 1141)]
         : compromised: 0.5362, honest: 0.5265
Round 004: test acc mean=0.4984 ± 0.0135 | min=0.4648 max=0.5232
         : test loss mean=8.4737 ± 0.3426
         : individual accs = ['0.502632', '0.507772', '0.503106', '0.501727', '0.479718', '0.516157', '0.488210', '0.496894', '0.464789', '0.485816', '0.479021', '0.512000', '0.495660', '0.503448', '0.506228', '0.509170', '0.501733', '0.491600', '0.499568', '0.523225']
         : correct/total = [(573, 1140), (588, 1158), (567, 1127), (581, 1158), (544, 1134), (591, 1145), (559, 1145), (560, 1127), (528, 1136), (548, 1128), (548, 1144), (576, 1125), (571, 1152), (584, 1160), (569, 1124), (583, 1145), (579, 1154), (556, 1131), (578, 1157), (597, 1141)]
         : compromised: 0.5098, honest: 0.4972
Round 005: test acc mean=0.4843 ± 0.0149 | min=0.4401 max=0.5098
         : test loss mean=438.3264 ± 13.7189
         : individual accs = ['0.468421', '0.491364', '0.506655', '0.473230', '0.477072', '0.485590', '0.480349', '0.496894', '0.440141', '0.509752', '0.475524', '0.503111', '0.480035', '0.492241', '0.479537', '0.484716', '0.483536', '0.494253', '0.477096', '0.485539']
         : correct/total = [(534, 1140), (569, 1158), (571, 1127), (548, 1158), (541, 1134), (556, 1145), (550, 1145), (560, 1127), (500, 1136), (575, 1128), (544, 1144), (566, 1125), (553, 1152), (571, 1160), (539, 1124), (555, 1145), (558, 1154), (559, 1131), (552, 1157), (554, 1141)]
         : compromised: 0.4889, honest: 0.4837
Round 006: test acc mean=0.5164 ± 0.0150 | min=0.4911 max=0.5625
         : test loss mean=4326791.0676 ± 137040.2485
         : individual accs = ['0.528947', '0.508636', '0.493345', '0.528497', '0.522046', '0.514410', '0.521397', '0.503993', '0.562500', '0.491135', '0.525350', '0.498667', '0.522569', '0.506897', '0.517794', '0.517031', '0.515598', '0.508400', '0.522040', '0.517967']
         : correct/total = [(603, 1140), (589, 1158), (556, 1127), (612, 1158), (592, 1134), (589, 1145), (597, 1145), (568, 1127), (639, 1136), (554, 1128), (601, 1144), (561, 1125), (602, 1152), (588, 1160), (582, 1124), (592, 1145), (595, 1154), (575, 1131), (604, 1157), (591, 1141)]
         : compromised: 0.5107, honest: 0.5170
Round 007: test acc mean=0.5164 ± 0.0150 | min=0.4911 max=0.5625
         : test loss mean=nan ± nan
         : individual accs = ['0.528947', '0.508636', '0.493345', '0.528497', '0.522046', '0.514410', '0.521397', '0.503993', '0.562500', '0.491135', '0.525350', '0.498667', '0.522569', '0.506897', '0.517794', '0.517031', '0.515598', '0.508400', '0.522040', '0.517967']
         : correct/total = [(603, 1140), (589, 1158), (556, 1127), (612, 1158), (592, 1134), (589, 1145), (597, 1145), (568, 1127), (639, 1136), (554, 1128), (601, 1144), (561, 1125), (602, 1152), (588, 1160), (582, 1124), (592, 1145), (595, 1154), (575, 1131), (604, 1157), (591, 1141)]
         : compromised: 0.5107, honest: 0.5170
Round 008: test acc mean=0.5164 ± 0.0150 | min=0.4911 max=0.5625
         : test loss mean=nan ± nan
         : individual accs = ['0.528947', '0.508636', '0.493345', '0.528497', '0.522046', '0.514410', '0.521397', '0.503993', '0.562500', '0.491135', '0.525350', '0.498667', '0.522569', '0.506897', '0.517794', '0.517031', '0.515598', '0.508400', '0.522040', '0.517967']
         : correct/total = [(603, 1140), (589, 1158), (556, 1127), (612, 1158), (592, 1134), (589, 1145), (597, 1145), (568, 1127), (639, 1136), (554, 1128), (601, 1144), (561, 1125), (602, 1152), (588, 1160), (582, 1124), (592, 1145), (595, 1154), (575, 1131), (604, 1157), (591, 1141)]
         : compromised: 0.5107, honest: 0.5170
Round 009: test acc mean=0.5164 ± 0.0150 | min=0.4911 max=0.5625
         : test loss mean=nan ± nan
         : individual accs = ['0.528947', '0.508636', '0.493345', '0.528497', '0.522046', '0.514410', '0.521397', '0.503993', '0.562500', '0.491135', '0.525350', '0.498667', '0.522569', '0.506897', '0.517794', '0.517031', '0.515598', '0.508400', '0.522040', '0.517967']
         : correct/total = [(603, 1140), (589, 1158), (556, 1127), (612, 1158), (592, 1134), (589, 1145), (597, 1145), (568, 1127), (639, 1136), (554, 1128), (601, 1144), (561, 1125), (602, 1152), (588, 1160), (582, 1124), (592, 1145), (595, 1154), (575, 1131), (604, 1157), (591, 1141)]
         : compromised: 0.5107, honest: 0.5170
Round 010: test acc mean=0.5164 ± 0.0150 | min=0.4911 max=0.5625
         : test loss mean=nan ± nan
         : individual accs = ['0.528947', '0.508636', '0.493345', '0.528497', '0.522046', '0.514410', '0.521397', '0.503993', '0.562500', '0.491135', '0.525350', '0.498667', '0.522569', '0.506897', '0.517794', '0.517031', '0.515598', '0.508400', '0.522040', '0.517967']
         : correct/total = [(603, 1140), (589, 1158), (556, 1127), (612, 1158), (592, 1134), (589, 1145), (597, 1145), (568, 1127), (639, 1136), (554, 1128), (601, 1144), (561, 1125), (602, 1152), (588, 1160), (582, 1124), (592, 1145), (595, 1154), (575, 1131), (604, 1157), (591, 1141)]
         : compromised: 0.5107, honest: 0.5170

=== FINAL RESULTS ===
Dataset: celeba, Nodes: 20, Graph: fully, Aggregation: d-fedavg
Attack: backdoor, 10.0% compromised
Final accuracy - Compromised: 0.5107, Honest: 0.5170
Overall test accuracy: mean=0.5164 ± 0.0150

=== BACKDOOR ATTACK SUCCESS RATE (ASR) ===
Target label: 0
Trigger size: 8x8
Overall ASR: 1.0000 ± 0.0000
Honest nodes ASR: 1.0000 ± 0.0000
Compromised nodes ASR: 1.0000 ± 0.0000
Note: Higher ASR indicates more successful backdoor attack
