Device: cuda
Seed: 987654321
Looking for images in: /home/student.unimelb.edu.au/mrangwala/Projects/Sketchguard/leaf/data/celeba/data/raw/img_align_celeba
Loading 1 LEAF CelebA train files...
LEAF CelebA train: 9343 users (celebrities), 177457 samples
Looking for images in: /home/student.unimelb.edu.au/mrangwala/Projects/Sketchguard/leaf/data/celeba/data/raw/img_align_celeba
Loading 1 LEAF CelebA test files...
LEAF CelebA test: 9343 users (celebrities), 22831 samples
Found 9343 train users, 9343 test users, 9343 common users
User sample counts range: 31 (max) to 4 (min)
Distributed ALL 9343 users across 20 clients
Users per client: 467 (with 3 clients getting +1 user)
Train partition sizes: [8843, 8998, 8728, 9034, 8866, 8946, 8873, 8776, 8816, 8801, 8913, 8656, 9115, 8921, 8699, 8823, 8912, 8766, 9102, 8869]
Test partition sizes: [1140, 1158, 1127, 1158, 1134, 1145, 1145, 1127, 1136, 1128, 1144, 1125, 1152, 1160, 1124, 1145, 1154, 1131, 1157, 1141]
  Client 0: 8843 train samples, 2 unique classes
  Client 1: 8998 train samples, 2 unique classes
  Client 2: 8728 train samples, 2 unique classes
  Client 3: 9034 train samples, 2 unique classes
  Client 4: 8866 train samples, 2 unique classes
  Client 5: 8946 train samples, 2 unique classes
  Client 6: 8873 train samples, 2 unique classes
  Client 7: 8776 train samples, 2 unique classes
  Client 8: 8816 train samples, 2 unique classes
  Client 9: 8801 train samples, 2 unique classes
  Client 10: 8913 train samples, 2 unique classes
  Client 11: 8656 train samples, 2 unique classes
  Client 12: 9115 train samples, 2 unique classes
  Client 13: 8921 train samples, 2 unique classes
  Client 14: 8699 train samples, 2 unique classes
  Client 15: 8823 train samples, 2 unique classes
  Client 16: 8912 train samples, 2 unique classes
  Client 17: 8766 train samples, 2 unique classes
  Client 18: 9102 train samples, 2 unique classes
  Client 19: 8869 train samples, 2 unique classes
Will sample 4500 samples per client per epoch
Graph: erdos, nodes: 20, edges: 126
Degree statistics: avg=12.60, min=8, max=16
Attack: Compromised 12/20 nodes: [1, 2, 3, 5, 8, 11, 12, 13, 14, 15, 17, 18]
Attack type: krum, lambda: 1.0
Model variant: baseline
Model parameters: 2,219,692
UBAR ALGORITHM (Two-Stage Byzantine-resilient)
  - Model dimension: 2,219,692 parameters
  - Rho parameter: 0.4
  - Stage 1: Distance-based filtering (select 40% closest neighbors)
  - Stage 2: Performance-based selection (loss comparison)
  - Complexity: O(deg(i)×d + deg(i)×inference)
Initial test acc across nodes: mean=0.4978 ± 0.0208
Round 001: test acc mean=0.6399 ± 0.0450 | min=0.5629 max=0.7222
         : test loss mean=0.6762 ± 0.0079
         : individual accs = ['0.683333', '0.670121', '0.608696', '0.701209', '0.601411', '0.650655', '0.643668', '0.624667', '0.582746', '0.655142', '0.562937', '0.614222', '0.722222', '0.650862', '0.601423', '0.707424', '0.590121', '0.583554', '0.685393', '0.657318']
         : correct/total = [(779, 1140), (776, 1158), (686, 1127), (812, 1158), (682, 1134), (745, 1145), (737, 1145), (704, 1127), (662, 1136), (739, 1128), (644, 1144), (691, 1125), (832, 1152), (755, 1160), (676, 1124), (810, 1145), (681, 1154), (660, 1131), (793, 1157), (750, 1141)]
         : compromised: 0.6482, honest: 0.6273
         : ubar stats = ['Node 0: s1=0.375, s2=0.167', 'Node 1: s1=0.364, s2=0.250', 'Node 2: s1=0.333, s2=0.250']...
Round 002: test acc mean=0.6850 ± 0.0634 | min=0.5285 max=0.7542
         : test loss mean=0.6298 ± 0.0394
         : individual accs = ['0.686842', '0.707254', '0.754215', '0.717617', '0.657848', '0.530131', '0.743231', '0.664596', '0.649648', '0.687943', '0.735140', '0.624000', '0.706597', '0.652586', '0.528470', '0.740611', '0.748700', '0.732980', '0.735523', '0.695881']
         : correct/total = [(783, 1140), (819, 1158), (850, 1127), (831, 1158), (746, 1134), (607, 1145), (851, 1145), (749, 1127), (738, 1136), (776, 1128), (841, 1144), (702, 1125), (814, 1152), (757, 1160), (594, 1124), (848, 1145), (864, 1154), (829, 1131), (851, 1157), (794, 1141)]
         : compromised: 0.6733, honest: 0.7025
         : ubar stats = ['Node 0: s1=0.375, s2=0.167', 'Node 1: s1=0.364, s2=0.375', 'Node 2: s1=0.333, s2=0.250']...
Round 003: test acc mean=0.7687 ± 0.0337 | min=0.7011 max=0.8111
         : test loss mean=0.5327 ± 0.0557
         : individual accs = ['0.796491', '0.808290', '0.799468', '0.773748', '0.738095', '0.733624', '0.807860', '0.729370', '0.772007', '0.796986', '0.803322', '0.756444', '0.753472', '0.733621', '0.701068', '0.711790', '0.811092', '0.798408', '0.777874', '0.770377']
         : correct/total = [(908, 1140), (936, 1158), (901, 1127), (896, 1158), (837, 1134), (840, 1145), (925, 1145), (822, 1127), (877, 1136), (899, 1128), (919, 1144), (851, 1125), (868, 1152), (851, 1160), (788, 1124), (815, 1145), (936, 1154), (903, 1131), (900, 1157), (879, 1141)]
         : compromised: 0.7600, honest: 0.7817
         : ubar stats = ['Node 0: s1=0.375, s2=0.222', 'Node 1: s1=0.364, s2=0.333', 'Node 2: s1=0.333, s2=0.250']...
Round 004: test acc mean=0.8277 ± 0.0207 | min=0.7969 max=0.8671
         : test loss mean=0.4073 ± 0.0332
         : individual accs = ['0.842982', '0.858377', '0.840284', '0.836788', '0.804233', '0.843668', '0.857642', '0.802130', '0.841549', '0.807624', '0.867133', '0.820444', '0.796875', '0.822414', '0.803381', '0.816594', '0.810225', '0.828470', '0.809853', '0.843996']
         : correct/total = [(961, 1140), (994, 1158), (947, 1127), (969, 1158), (912, 1134), (966, 1145), (982, 1145), (904, 1127), (956, 1136), (911, 1128), (992, 1144), (923, 1125), (918, 1152), (954, 1160), (903, 1124), (935, 1145), (935, 1154), (937, 1131), (937, 1157), (963, 1141)]
         : compromised: 0.8266, honest: 0.8295
         : ubar stats = ['Node 0: s1=0.375, s2=0.208', 'Node 1: s1=0.364, s2=0.312', 'Node 2: s1=0.333, s2=0.250']...
Round 005: test acc mean=0.8574 ± 0.0188 | min=0.8090 max=0.8851
         : test loss mean=0.3348 ± 0.0268
         : individual accs = ['0.828070', '0.885147', '0.848270', '0.875648', '0.858025', '0.843668', '0.866376', '0.855368', '0.850352', '0.881206', '0.875874', '0.837333', '0.852431', '0.872414', '0.862989', '0.854148', '0.876950', '0.843501', '0.808989', '0.872042']
         : correct/total = [(944, 1140), (1025, 1158), (956, 1127), (1014, 1158), (973, 1134), (966, 1145), (992, 1145), (964, 1127), (966, 1136), (994, 1128), (1002, 1144), (942, 1125), (982, 1152), (1012, 1160), (970, 1124), (978, 1145), (1012, 1154), (954, 1131), (936, 1157), (995, 1141)]
         : compromised: 0.8529, honest: 0.8642
         : ubar stats = ['Node 0: s1=0.375, s2=0.367', 'Node 1: s1=0.364, s2=0.350', 'Node 2: s1=0.333, s2=0.250']...
Round 006: test acc mean=0.8780 ± 0.0102 | min=0.8585 max=0.8969
         : test loss mean=0.2944 ± 0.0163
         : individual accs = ['0.882456', '0.883420', '0.874002', '0.886010', '0.871252', '0.896943', '0.884716', '0.878438', '0.888204', '0.882092', '0.889860', '0.860444', '0.881076', '0.879310', '0.866548', '0.858515', '0.881282', '0.872679', '0.859118', '0.883436']
         : correct/total = [(1006, 1140), (1023, 1158), (985, 1127), (1026, 1158), (988, 1134), (1027, 1145), (1013, 1145), (990, 1127), (1009, 1136), (995, 1128), (1018, 1144), (968, 1125), (1015, 1152), (1020, 1160), (974, 1124), (983, 1145), (1017, 1154), (987, 1131), (994, 1157), (1008, 1141)]
         : compromised: 0.8755, honest: 0.8817
         : ubar stats = ['Node 0: s1=0.375, s2=0.333', 'Node 1: s1=0.364, s2=0.458', 'Node 2: s1=0.333, s2=0.250']...
Round 007: test acc mean=0.8891 ± 0.0088 | min=0.8664 max=0.9039
         : test loss mean=0.2732 ± 0.0153
         : individual accs = ['0.896491', '0.898964', '0.887311', '0.892055', '0.880071', '0.903930', '0.885590', '0.893523', '0.897007', '0.897163', '0.893357', '0.882667', '0.881944', '0.887069', '0.895907', '0.866376', '0.894281', '0.884173', '0.875540', '0.888694']
         : correct/total = [(1022, 1140), (1041, 1158), (1000, 1127), (1033, 1158), (998, 1134), (1035, 1145), (1014, 1145), (1007, 1127), (1019, 1136), (1012, 1128), (1022, 1144), (993, 1125), (1016, 1152), (1029, 1160), (1007, 1124), (992, 1145), (1032, 1154), (1000, 1131), (1013, 1157), (1014, 1141)]
         : compromised: 0.8877, honest: 0.8911
         : ubar stats = ['Node 0: s1=0.375, s2=0.333', 'Node 1: s1=0.364, s2=0.500', 'Node 2: s1=0.333, s2=0.250']...
Round 008: test acc mean=0.8907 ± 0.0092 | min=0.8671 max=0.9057
         : test loss mean=0.2665 ± 0.0160
         : individual accs = ['0.900877', '0.894646', '0.882875', '0.888601', '0.889771', '0.898690', '0.894323', '0.897072', '0.867077', '0.893617', '0.894231', '0.901333', '0.897569', '0.890517', '0.905694', '0.881223', '0.893414', '0.877100', '0.878997', '0.886065']
         : correct/total = [(1027, 1140), (1036, 1158), (995, 1127), (1029, 1158), (1009, 1134), (1029, 1145), (1024, 1145), (1011, 1127), (985, 1136), (1008, 1128), (1023, 1144), (1014, 1125), (1034, 1152), (1033, 1160), (1018, 1124), (1009, 1145), (1031, 1154), (992, 1131), (1017, 1157), (1011, 1141)]
         : compromised: 0.8887, honest: 0.8937
         : ubar stats = ['Node 0: s1=0.375, s2=0.333', 'Node 1: s1=0.364, s2=0.500', 'Node 2: s1=0.333, s2=0.250']...
Round 009: test acc mean=0.8957 ± 0.0111 | min=0.8608 max=0.9135
         : test loss mean=0.2568 ± 0.0179
         : individual accs = ['0.904386', '0.888601', '0.885537', '0.899827', '0.896825', '0.913537', '0.901310', '0.902396', '0.902289', '0.893617', '0.902098', '0.905778', '0.904514', '0.899138', '0.900356', '0.884716', '0.890815', '0.882405', '0.860847', '0.894829']
         : correct/total = [(1031, 1140), (1029, 1158), (998, 1127), (1042, 1158), (1017, 1134), (1046, 1145), (1032, 1145), (1017, 1127), (1025, 1136), (1008, 1128), (1032, 1144), (1019, 1125), (1042, 1152), (1043, 1160), (1012, 1124), (1013, 1145), (1028, 1154), (998, 1131), (996, 1157), (1021, 1141)]
         : compromised: 0.8940, honest: 0.8983
         : ubar stats = ['Node 0: s1=0.375, s2=0.315', 'Node 1: s1=0.364, s2=0.472', 'Node 2: s1=0.333, s2=0.278']...
Round 010: test acc mean=0.8975 ± 0.0088 | min=0.8781 max=0.9127
         : test loss mean=0.2487 ± 0.0156
         : individual accs = ['0.903509', '0.898100', '0.887311', '0.898100', '0.894180', '0.912664', '0.895197', '0.905945', '0.907570', '0.903369', '0.899476', '0.898667', '0.905382', '0.893103', '0.905694', '0.883843', '0.903813', '0.885057', '0.878133', '0.890447']
         : correct/total = [(1030, 1140), (1040, 1158), (1000, 1127), (1040, 1158), (1014, 1134), (1045, 1145), (1025, 1145), (1021, 1127), (1031, 1136), (1019, 1128), (1029, 1144), (1011, 1125), (1043, 1152), (1036, 1160), (1018, 1124), (1012, 1145), (1043, 1154), (1001, 1131), (1016, 1157), (1016, 1141)]
         : compromised: 0.8961, honest: 0.8995
         : ubar stats = ['Node 0: s1=0.375, s2=0.350', 'Node 1: s1=0.364, s2=0.450', 'Node 2: s1=0.333, s2=0.300']...

=== FINAL RESULTS ===
Dataset: celeba, Nodes: 20, Graph: erdos, Aggregation: ubar
Attack: krum, 60.0% compromised
Final accuracy - Compromised: 0.8961, Honest: 0.8995
Overall test accuracy: mean=0.8975 ± 0.0088

=== UBAR SUMMARY ===
Node 0: stage1=0.375, stage2=0.350, overall=0.131
Node 1: stage1=0.364, stage2=0.450, overall=0.164
Node 2: stage1=0.333, stage2=0.300, overall=0.100
Node 3: stage1=0.375, stage2=0.467, overall=0.175
Node 4: stage1=0.364, stage2=0.500, overall=0.182
Node 5: stage1=0.400, stage2=0.483, overall=0.193
Node 6: stage1=0.357, stage2=0.200, overall=0.071
Node 7: stage1=0.357, stage2=0.600, overall=0.214
Node 8: stage1=0.400, stage2=0.350, overall=0.140
Node 9: stage1=0.385, stage2=0.440, overall=0.169
Node 10: stage1=0.333, stage2=0.400, overall=0.133
Node 11: stage1=0.357, stage2=0.400, overall=0.143
Node 12: stage1=0.333, stage2=0.650, overall=0.217
Node 13: stage1=0.385, stage2=0.520, overall=0.200
Node 14: stage1=0.400, stage2=0.650, overall=0.260
Node 15: stage1=0.364, stage2=0.300, overall=0.109
Node 16: stage1=0.385, stage2=0.300, overall=0.115
Node 17: stage1=0.333, stage2=0.333, overall=0.111
Node 18: stage1=0.375, stage2=0.383, overall=0.144
Node 19: stage1=0.375, stage2=0.450, overall=0.169

=== PARALLEL EXECUTION TIME (realistic for distributed system) ===
  COMMUNICATION (max across nodes):
    - Full model transfer: 0.000s (0.0%)
  COMPUTATION (max across nodes):
    - Distance computation: 0.042s (17.4%)
    - Loss computation: 0.194s (80.5%)
    - Aggregation: 0.005s (2.1%)
  TOTALS:
    - Total computation: 0.241s (100.0%)
    - Total communication: 0.000s (0.0%)
    - Total parallel time: 0.241s

=== PER-NODE AVERAGE TIME ===
  - Distance computation: 0.032s
  - Loss computation: 0.164s
  - Aggregation: 0.004s
  - Model transfer: 0.000s
  - Total per node: 0.200s

=== TOTAL COMPUTATIONAL WORK (sum across all nodes) ===
  - Total distance computation: 0.646s
  - Total loss computation: 3.280s
  - Total aggregation: 0.074s
  - Total model transfer: 0.000s
  - Grand total: 4.001s
  - Mean Stage 1 acceptance rate: 0.367
  - Mean Stage 2 acceptance rate: 0.426
  - Overall acceptance rate: 0.157

UBAR Algorithm Properties:
  - Model dimension: 2,219,692
  - Rho parameter: 0.4
  - Two-stage approach: Distance filtering + loss evaluation
  - Stage 1 selects: 40% of neighbors
  - Stage 2 uses: Training sample loss comparison
  - Theoretical complexity: O(deg(i)×d + deg(i)×inference)
  - Approach: UBAR paper implementation
