Device: cuda
Seed: 987654321
Looking for images in: /home/student.unimelb.edu.au/mrangwala/Projects/Sketchguard/leaf/data/celeba/data/raw/img_align_celeba
Loading 1 LEAF CelebA train files...
LEAF CelebA train: 9343 users (celebrities), 177457 samples
Looking for images in: /home/student.unimelb.edu.au/mrangwala/Projects/Sketchguard/leaf/data/celeba/data/raw/img_align_celeba
Loading 1 LEAF CelebA test files...
LEAF CelebA test: 9343 users (celebrities), 22831 samples
Found 9343 train users, 9343 test users, 9343 common users
User sample counts range: 31 (max) to 4 (min)
Distributed ALL 9343 users across 20 clients
Users per client: 467 (with 3 clients getting +1 user)
Train partition sizes: [8843, 8998, 8728, 9034, 8866, 8946, 8873, 8776, 8816, 8801, 8913, 8656, 9115, 8921, 8699, 8823, 8912, 8766, 9102, 8869]
Test partition sizes: [1140, 1158, 1127, 1158, 1134, 1145, 1145, 1127, 1136, 1128, 1144, 1125, 1152, 1160, 1124, 1145, 1154, 1131, 1157, 1141]
  Client 0: 8843 train samples, 2 unique classes
  Client 1: 8998 train samples, 2 unique classes
  Client 2: 8728 train samples, 2 unique classes
  Client 3: 9034 train samples, 2 unique classes
  Client 4: 8866 train samples, 2 unique classes
  Client 5: 8946 train samples, 2 unique classes
  Client 6: 8873 train samples, 2 unique classes
  Client 7: 8776 train samples, 2 unique classes
  Client 8: 8816 train samples, 2 unique classes
  Client 9: 8801 train samples, 2 unique classes
  Client 10: 8913 train samples, 2 unique classes
  Client 11: 8656 train samples, 2 unique classes
  Client 12: 9115 train samples, 2 unique classes
  Client 13: 8921 train samples, 2 unique classes
  Client 14: 8699 train samples, 2 unique classes
  Client 15: 8823 train samples, 2 unique classes
  Client 16: 8912 train samples, 2 unique classes
  Client 17: 8766 train samples, 2 unique classes
  Client 18: 9102 train samples, 2 unique classes
  Client 19: 8869 train samples, 2 unique classes
Will sample 4500 samples per client per epoch
Graph: erdos, nodes: 20, edges: 126
Degree statistics: avg=12.60, min=8, max=16
Attack: Compromised 16/20 nodes: [1, 2, 3, 5, 6, 8, 9, 10, 11, 12, 13, 14, 15, 17, 18, 19]
Attack type: backdoor, lambda: 1.0
Backdoor target label: 0, trigger size: 8
Model variant: baseline
Model parameters: 2,219,692
UBAR ALGORITHM (Two-Stage Byzantine-resilient)
  - Model dimension: 2,219,692 parameters
  - Rho parameter: 0.19999999999999996
  - Stage 1: Distance-based filtering (select 20% closest neighbors)
  - Stage 2: Performance-based selection (loss comparison)
  - Complexity: O(deg(i)×d + deg(i)×inference)
Initial test acc across nodes: mean=0.4978 ± 0.0208
Backdoor attack: Created poisoned datasets for 16 compromised nodes
Round 001: test acc mean=0.5497 ± 0.0652 | min=0.4938 max=0.7158
         : test loss mean=3106.8939 ± 1639.2320
         : individual accs = ['0.683333', '0.508636', '0.494232', '0.536269', '0.635802', '0.514410', '0.521397', '0.662822', '0.562500', '0.493794', '0.525350', '0.523556', '0.522569', '0.506897', '0.517794', '0.521397', '0.715771', '0.508400', '0.522040', '0.517967']
         : correct/total = [(779, 1140), (589, 1158), (557, 1127), (621, 1158), (721, 1134), (589, 1145), (597, 1145), (747, 1127), (639, 1136), (557, 1128), (601, 1144), (589, 1125), (602, 1152), (588, 1160), (582, 1124), (597, 1145), (826, 1154), (575, 1131), (604, 1157), (591, 1141)]
         : compromised: 0.5186, honest: 0.6744
         : ubar stats = ['Node 0: s1=0.188, s2=0.333', 'Node 1: s1=0.182, s2=1.000', 'Node 2: s1=0.167, s2=1.000']...
Round 002: test acc mean=0.5543 ± 0.0915 | min=0.4725 max=0.7686
         : test loss mean=1067.4876 ± 1883.1527
         : individual accs = ['0.733333', '0.500864', '0.491571', '0.528497', '0.686949', '0.510917', '0.517031', '0.740905', '0.557218', '0.495567', '0.520979', '0.498667', '0.514757', '0.498276', '0.518683', '0.472489', '0.768631', '0.504863', '0.518583', '0.507450']
         : correct/total = [(836, 1140), (580, 1158), (554, 1127), (612, 1158), (779, 1134), (585, 1145), (592, 1145), (835, 1127), (633, 1136), (559, 1128), (596, 1144), (561, 1125), (593, 1152), (578, 1160), (583, 1124), (541, 1145), (887, 1154), (571, 1131), (600, 1157), (579, 1141)]
         : compromised: 0.5098, honest: 0.7325
         : ubar stats = ['Node 0: s1=0.188, s2=0.333', 'Node 1: s1=0.182, s2=1.000', 'Node 2: s1=0.167, s2=1.000']...
Round 003: test acc mean=0.5531 ± 0.1351 | min=0.4375 max=0.8423
         : test loss mean=nan ± nan
         : individual accs = ['0.833333', '0.491364', '0.506655', '0.471503', '0.796296', '0.485590', '0.478603', '0.811890', '0.437500', '0.508865', '0.474650', '0.501333', '0.477431', '0.493103', '0.482206', '0.517031', '0.842288', '0.491600', '0.477960', '0.482033']
         : correct/total = [(950, 1140), (569, 1158), (571, 1127), (546, 1158), (903, 1134), (556, 1145), (548, 1145), (915, 1127), (497, 1136), (574, 1128), (543, 1144), (564, 1125), (550, 1152), (572, 1160), (542, 1124), (592, 1145), (972, 1154), (556, 1131), (553, 1157), (550, 1141)]
         : compromised: 0.4861, honest: 0.8210
         : ubar stats = ['Node 0: s1=0.188, s2=0.333', 'Node 1: s1=0.182, s2=1.000', 'Node 2: s1=0.167, s2=1.000']...
Round 004: test acc mean=0.5838 ± 0.1363 | min=0.4911 max=0.8596
         : test loss mean=nan ± nan
         : individual accs = ['0.857895', '0.508636', '0.493345', '0.528497', '0.850088', '0.514410', '0.521397', '0.851819', '0.562500', '0.491135', '0.525350', '0.498667', '0.522569', '0.506897', '0.517794', '0.517031', '0.859619', '0.508400', '0.522040', '0.517967']
         : correct/total = [(978, 1140), (589, 1158), (556, 1127), (612, 1158), (964, 1134), (589, 1145), (597, 1145), (960, 1127), (639, 1136), (554, 1128), (601, 1144), (561, 1125), (602, 1152), (588, 1160), (582, 1124), (592, 1145), (992, 1154), (575, 1131), (604, 1157), (591, 1141)]
         : compromised: 0.5160, honest: 0.8549
         : ubar stats = ['Node 0: s1=0.188, s2=0.333', 'Node 1: s1=0.182, s2=0.875', 'Node 2: s1=0.167, s2=0.875']...
Round 005: test acc mean=0.5843 ± 0.1375 | min=0.4911 max=0.8856
         : test loss mean=nan ± nan
         : individual accs = ['0.834211', '0.508636', '0.493345', '0.528497', '0.857143', '0.514410', '0.521397', '0.851819', '0.562500', '0.491135', '0.525350', '0.498667', '0.522569', '0.506897', '0.517794', '0.517031', '0.885615', '0.508400', '0.522040', '0.517967']
         : correct/total = [(951, 1140), (589, 1158), (556, 1127), (612, 1158), (972, 1134), (589, 1145), (597, 1145), (960, 1127), (639, 1136), (554, 1128), (601, 1144), (561, 1125), (602, 1152), (588, 1160), (582, 1124), (592, 1145), (1022, 1154), (575, 1131), (604, 1157), (591, 1141)]
         : compromised: 0.5160, honest: 0.8572
         : ubar stats = ['Node 0: s1=0.188, s2=0.467', 'Node 1: s1=0.182, s2=0.800', 'Node 2: s1=0.167, s2=0.800']...
Round 006: test acc mean=0.5899 ± 0.1485 | min=0.4911 max=0.8934
         : test loss mean=nan ± nan
         : individual accs = ['0.888596', '0.508636', '0.493345', '0.528497', '0.875661', '0.514410', '0.521397', '0.884650', '0.562500', '0.491135', '0.525350', '0.498667', '0.522569', '0.506897', '0.517794', '0.517031', '0.893414', '0.508400', '0.522040', '0.517967']
         : correct/total = [(1013, 1140), (589, 1158), (556, 1127), (612, 1158), (993, 1134), (589, 1145), (597, 1145), (997, 1127), (639, 1136), (554, 1128), (601, 1144), (561, 1125), (602, 1152), (588, 1160), (582, 1124), (592, 1145), (1031, 1154), (575, 1131), (604, 1157), (591, 1141)]
         : compromised: 0.5160, honest: 0.8856
         : ubar stats = ['Node 0: s1=0.188, s2=0.444', 'Node 1: s1=0.182, s2=0.750', 'Node 2: s1=0.167, s2=0.750']...
Round 007: test acc mean=0.5921 ± 0.1528 | min=0.4911 max=0.9026
         : test loss mean=nan ± nan
         : individual accs = ['0.902632', '0.508636', '0.493345', '0.528497', '0.884480', '0.514410', '0.521397', '0.898846', '0.562500', '0.491135', '0.525350', '0.498667', '0.522569', '0.506897', '0.517794', '0.517031', '0.898614', '0.508400', '0.522040', '0.517967']
         : correct/total = [(1029, 1140), (589, 1158), (556, 1127), (612, 1158), (1003, 1134), (589, 1145), (597, 1145), (1013, 1127), (639, 1136), (554, 1128), (601, 1144), (561, 1125), (602, 1152), (588, 1160), (582, 1124), (592, 1145), (1037, 1154), (575, 1131), (604, 1157), (591, 1141)]
         : compromised: 0.5160, honest: 0.8961
         : ubar stats = ['Node 0: s1=0.188, s2=0.429', 'Node 1: s1=0.182, s2=0.714', 'Node 2: s1=0.167, s2=0.714']...
Round 008: test acc mean=0.5922 ± 0.1529 | min=0.4911 max=0.9018
         : test loss mean=nan ± nan
         : individual accs = ['0.901754', '0.508636', '0.493345', '0.528497', '0.888889', '0.514410', '0.521397', '0.899734', '0.562500', '0.491135', '0.525350', '0.498667', '0.522569', '0.506897', '0.517794', '0.517031', '0.896014', '0.508400', '0.522040', '0.517967']
         : correct/total = [(1028, 1140), (589, 1158), (556, 1127), (612, 1158), (1008, 1134), (589, 1145), (597, 1145), (1014, 1127), (639, 1136), (554, 1128), (601, 1144), (561, 1125), (602, 1152), (588, 1160), (582, 1124), (592, 1145), (1034, 1154), (575, 1131), (604, 1157), (591, 1141)]
         : compromised: 0.5160, honest: 0.8966
         : ubar stats = ['Node 0: s1=0.188, s2=0.417', 'Node 1: s1=0.182, s2=0.688', 'Node 2: s1=0.167, s2=0.688']...
Round 009: test acc mean=0.5933 ± 0.1553 | min=0.4911 max=0.9086
         : test loss mean=nan ± nan
         : individual accs = ['0.903509', '0.508636', '0.493345', '0.528497', '0.898589', '0.514410', '0.521397', '0.908607', '0.562500', '0.491135', '0.525350', '0.498667', '0.522569', '0.506897', '0.517794', '0.517031', '0.899480', '0.508400', '0.522040', '0.517967']
         : correct/total = [(1030, 1140), (589, 1158), (556, 1127), (612, 1158), (1019, 1134), (589, 1145), (597, 1145), (1024, 1127), (639, 1136), (554, 1128), (601, 1144), (561, 1125), (602, 1152), (588, 1160), (582, 1124), (592, 1145), (1038, 1154), (575, 1131), (604, 1157), (591, 1141)]
         : compromised: 0.5160, honest: 0.9025
         : ubar stats = ['Node 0: s1=0.188, s2=0.407', 'Node 1: s1=0.182, s2=0.667', 'Node 2: s1=0.167, s2=0.667']...
Round 010: test acc mean=0.5934 ± 0.1555 | min=0.4911 max=0.9132
         : test loss mean=nan ± nan
         : individual accs = ['0.913158', '0.508636', '0.493345', '0.528497', '0.892416', '0.514410', '0.521397', '0.907720', '0.562500', '0.491135', '0.525350', '0.498667', '0.522569', '0.506897', '0.517794', '0.517031', '0.898614', '0.508400', '0.522040', '0.517967']
         : correct/total = [(1041, 1140), (589, 1158), (556, 1127), (612, 1158), (1012, 1134), (589, 1145), (597, 1145), (1023, 1127), (639, 1136), (554, 1128), (601, 1144), (561, 1125), (602, 1152), (588, 1160), (582, 1124), (592, 1145), (1037, 1154), (575, 1131), (604, 1157), (591, 1141)]
         : compromised: 0.5160, honest: 0.9030
         : ubar stats = ['Node 0: s1=0.188, s2=0.467', 'Node 1: s1=0.182, s2=0.650', 'Node 2: s1=0.167, s2=0.650']...

=== FINAL RESULTS ===
Dataset: celeba, Nodes: 20, Graph: erdos, Aggregation: ubar
Attack: backdoor, 80.0% compromised
Final accuracy - Compromised: 0.5160, Honest: 0.9030
Overall test accuracy: mean=0.5934 ± 0.1555

=== BACKDOOR ATTACK SUCCESS RATE (ASR) ===
Target label: 0
Trigger size: 8x8
Overall ASR: 0.9102 ± 0.1797
Honest nodes ASR: 0.5510 ± 0.0109
Compromised nodes ASR: 1.0000 ± 0.0000
Note: Higher ASR indicates more successful backdoor attack

=== UBAR SUMMARY ===
Node 0: stage1=0.188, stage2=0.467, overall=0.087
Node 1: stage1=0.182, stage2=0.650, overall=0.118
Node 2: stage1=0.167, stage2=0.650, overall=0.108
Node 3: stage1=0.125, stage2=1.000, overall=0.125
Node 4: stage1=0.182, stage2=0.700, overall=0.127
Node 5: stage1=0.133, stage2=0.650, overall=0.087
Node 6: stage1=0.143, stage2=0.650, overall=0.093
Node 7: stage1=0.143, stage2=0.550, overall=0.079
Node 8: stage1=0.100, stage2=1.000, overall=0.100
Node 9: stage1=0.154, stage2=0.650, overall=0.100
Node 10: stage1=0.111, stage2=1.000, overall=0.111
Node 11: stage1=0.143, stage2=0.650, overall=0.093
Node 12: stage1=0.167, stage2=0.650, overall=0.108
Node 13: stage1=0.154, stage2=0.650, overall=0.100
Node 14: stage1=0.133, stage2=0.650, overall=0.087
Node 15: stage1=0.182, stage2=0.600, overall=0.109
Node 16: stage1=0.154, stage2=0.550, overall=0.085
Node 17: stage1=0.111, stage2=1.000, overall=0.111
Node 18: stage1=0.188, stage2=0.533, overall=0.100
Node 19: stage1=0.188, stage2=0.533, overall=0.100

=== PARALLEL EXECUTION TIME (realistic for distributed system) ===
  COMMUNICATION (max across nodes):
    - Full model transfer: 0.000s (0.0%)
  COMPUTATION (max across nodes):
    - Distance computation: 0.044s (19.3%)
    - Loss computation: 0.182s (79.2%)
    - Aggregation: 0.004s (1.5%)
  TOTALS:
    - Total computation: 0.230s (100.0%)
    - Total communication: 0.000s (0.0%)
    - Total parallel time: 0.230s

=== PER-NODE AVERAGE TIME ===
  - Distance computation: 0.032s
  - Loss computation: 0.166s
  - Aggregation: 0.003s
  - Model transfer: 0.000s
  - Total per node: 0.201s

=== TOTAL COMPUTATIONAL WORK (sum across all nodes) ===
  - Total distance computation: 0.639s
  - Total loss computation: 3.319s
  - Total aggregation: 0.056s
  - Total model transfer: 0.000s
  - Grand total: 4.014s
  - Mean Stage 1 acceptance rate: 0.152
  - Mean Stage 2 acceptance rate: 0.689
  - Overall acceptance rate: 0.105

UBAR Algorithm Properties:
  - Model dimension: 2,219,692
  - Rho parameter: 0.19999999999999996
  - Two-stage approach: Distance filtering + loss evaluation
  - Stage 1 selects: 20% of neighbors
  - Stage 2 uses: Training sample loss comparison
  - Theoretical complexity: O(deg(i)×d + deg(i)×inference)
  - Approach: UBAR paper implementation
