Device: cuda
Seed: 987654321
Looking for images in: /home/student.unimelb.edu.au/mrangwala/Projects/Sketchguard/leaf/data/celeba/data/raw/img_align_celeba
Loading 1 LEAF CelebA train files...
LEAF CelebA train: 9343 users (celebrities), 177457 samples
Looking for images in: /home/student.unimelb.edu.au/mrangwala/Projects/Sketchguard/leaf/data/celeba/data/raw/img_align_celeba
Loading 1 LEAF CelebA test files...
LEAF CelebA test: 9343 users (celebrities), 22831 samples
Found 9343 train users, 9343 test users, 9343 common users
User sample counts range: 31 (max) to 4 (min)
Distributed ALL 9343 users across 20 clients
Users per client: 467 (with 3 clients getting +1 user)
Train partition sizes: [8843, 8998, 8728, 9034, 8866, 8946, 8873, 8776, 8816, 8801, 8913, 8656, 9115, 8921, 8699, 8823, 8912, 8766, 9102, 8869]
Test partition sizes: [1140, 1158, 1127, 1158, 1134, 1145, 1145, 1127, 1136, 1128, 1144, 1125, 1152, 1160, 1124, 1145, 1154, 1131, 1157, 1141]
  Client 0: 8843 train samples, 2 unique classes
  Client 1: 8998 train samples, 2 unique classes
  Client 2: 8728 train samples, 2 unique classes
  Client 3: 9034 train samples, 2 unique classes
  Client 4: 8866 train samples, 2 unique classes
  Client 5: 8946 train samples, 2 unique classes
  Client 6: 8873 train samples, 2 unique classes
  Client 7: 8776 train samples, 2 unique classes
  Client 8: 8816 train samples, 2 unique classes
  Client 9: 8801 train samples, 2 unique classes
  Client 10: 8913 train samples, 2 unique classes
  Client 11: 8656 train samples, 2 unique classes
  Client 12: 9115 train samples, 2 unique classes
  Client 13: 8921 train samples, 2 unique classes
  Client 14: 8699 train samples, 2 unique classes
  Client 15: 8823 train samples, 2 unique classes
  Client 16: 8912 train samples, 2 unique classes
  Client 17: 8766 train samples, 2 unique classes
  Client 18: 9102 train samples, 2 unique classes
  Client 19: 8869 train samples, 2 unique classes
Will sample 4500 samples per client per epoch
Graph: erdos, nodes: 20, edges: 48
Degree statistics: avg=4.80, min=2, max=7
Attack: Compromised 2/20 nodes: [5, 13]
Attack type: directed_deviation, lambda: 1.0
Model variant: baseline
Model parameters: 2,219,692
Initial test acc across nodes: mean=0.4978 ± 0.0208
Round 001: test acc mean=0.7241 ± 0.0216 | min=0.6861 max=0.7729
         : test loss mean=0.5740 ± 0.0311
         : individual accs = ['0.698246', '0.726252', '0.711624', '0.699482', '0.693122', '0.732751', '0.772926', '0.710736', '0.749120', '0.720745', '0.722028', '0.728889', '0.743924', '0.732759', '0.739324', '0.752838', '0.740901', '0.686118', '0.713051', '0.708151']
         : correct/total = [(796, 1140), (841, 1158), (802, 1127), (810, 1158), (786, 1134), (839, 1145), (885, 1145), (801, 1127), (851, 1136), (813, 1128), (826, 1144), (820, 1125), (857, 1152), (850, 1160), (831, 1124), (862, 1145), (855, 1154), (776, 1131), (825, 1157), (808, 1141)]
         : compromised: 0.7328, honest: 0.7232
Round 002: test acc mean=0.8332 ± 0.0190 | min=0.7870 max=0.8622
         : test loss mean=0.3876 ± 0.0389
         : individual accs = ['0.836842', '0.851468', '0.848270', '0.850604', '0.811287', '0.845415', '0.860262', '0.821650', '0.786972', '0.838652', '0.831294', '0.862222', '0.827257', '0.837069', '0.837189', '0.827948', '0.846620', '0.824050', '0.796889', '0.821209']
         : correct/total = [(954, 1140), (986, 1158), (956, 1127), (985, 1158), (920, 1134), (968, 1145), (985, 1145), (926, 1127), (894, 1136), (946, 1128), (951, 1144), (970, 1125), (953, 1152), (971, 1160), (941, 1124), (948, 1145), (977, 1154), (932, 1131), (922, 1157), (937, 1141)]
         : compromised: 0.8412, honest: 0.8323
Round 003: test acc mean=0.8586 ± 0.0170 | min=0.8213 max=0.8882
         : test loss mean=0.3240 ± 0.0318
         : individual accs = ['0.862281', '0.865285', '0.868678', '0.852332', '0.841270', '0.845415', '0.888210', '0.839397', '0.821303', '0.864362', '0.855769', '0.881778', '0.871528', '0.864655', '0.864769', '0.859389', '0.875217', '0.839965', '0.833189', '0.877301']
         : correct/total = [(983, 1140), (1002, 1158), (979, 1127), (987, 1158), (954, 1134), (968, 1145), (1017, 1145), (946, 1127), (933, 1136), (975, 1128), (979, 1144), (992, 1125), (1004, 1152), (1003, 1160), (972, 1124), (984, 1145), (1010, 1154), (950, 1131), (964, 1157), (1001, 1141)]
         : compromised: 0.8550, honest: 0.8590
Round 004: test acc mean=0.8761 ± 0.0111 | min=0.8470 max=0.8891
         : test loss mean=0.2907 ± 0.0163
         : individual accs = ['0.886842', '0.886010', '0.869565', '0.882556', '0.865961', '0.889083', '0.885590', '0.868678', '0.885563', '0.885638', '0.875000', '0.875556', '0.880208', '0.884483', '0.868327', '0.872489', '0.886482', '0.847038', '0.855661', '0.872042']
         : correct/total = [(1011, 1140), (1026, 1158), (980, 1127), (1022, 1158), (982, 1134), (1018, 1145), (1014, 1145), (979, 1127), (1006, 1136), (999, 1128), (1001, 1144), (985, 1125), (1014, 1152), (1026, 1160), (976, 1124), (999, 1145), (1023, 1154), (958, 1131), (990, 1157), (995, 1141)]
         : compromised: 0.8868, honest: 0.8750
Round 005: test acc mean=0.8835 ± 0.0104 | min=0.8579 max=0.9047
         : test loss mean=0.2749 ± 0.0188
         : individual accs = ['0.857895', '0.894646', '0.884650', '0.892055', '0.880071', '0.882096', '0.878603', '0.880213', '0.873239', '0.890957', '0.904720', '0.891556', '0.866319', '0.882759', '0.889680', '0.875983', '0.896014', '0.881521', '0.880726', '0.886941']
         : correct/total = [(978, 1140), (1036, 1158), (997, 1127), (1033, 1158), (998, 1134), (1010, 1145), (1006, 1145), (992, 1127), (992, 1136), (1005, 1128), (1035, 1144), (1003, 1125), (998, 1152), (1024, 1160), (1000, 1124), (1003, 1145), (1034, 1154), (997, 1131), (1019, 1157), (1012, 1141)]
         : compromised: 0.8824, honest: 0.8837
Round 006: test acc mean=0.8903 ± 0.0103 | min=0.8739 max=0.9067
         : test loss mean=0.2618 ± 0.0191
         : individual accs = ['0.906140', '0.892055', '0.886424', '0.901554', '0.873898', '0.891703', '0.899563', '0.882875', '0.883803', '0.898050', '0.905594', '0.906667', '0.888021', '0.890517', '0.897687', '0.876856', '0.891681', '0.879752', '0.876404', '0.877301']
         : correct/total = [(1033, 1140), (1033, 1158), (999, 1127), (1044, 1158), (991, 1134), (1021, 1145), (1030, 1145), (995, 1127), (1004, 1136), (1013, 1128), (1036, 1144), (1020, 1125), (1023, 1152), (1033, 1160), (1009, 1124), (1004, 1145), (1029, 1154), (995, 1131), (1014, 1157), (1001, 1141)]
         : compromised: 0.8911, honest: 0.8902
Round 007: test acc mean=0.8963 ± 0.0075 | min=0.8812 max=0.9138
         : test loss mean=0.2527 ± 0.0158
         : individual accs = ['0.896491', '0.892055', '0.889973', '0.905009', '0.894180', '0.903057', '0.899563', '0.900621', '0.885563', '0.901596', '0.896853', '0.913778', '0.894097', '0.897414', '0.903915', '0.881223', '0.897747', '0.889478', '0.885912', '0.896582']
         : correct/total = [(1022, 1140), (1033, 1158), (1003, 1127), (1048, 1158), (1014, 1134), (1034, 1145), (1030, 1145), (1015, 1127), (1006, 1136), (1017, 1128), (1026, 1144), (1028, 1125), (1030, 1152), (1041, 1160), (1016, 1124), (1009, 1145), (1036, 1154), (1006, 1131), (1025, 1157), (1023, 1141)]
         : compromised: 0.9002, honest: 0.8958
Round 008: test acc mean=0.8942 ± 0.0088 | min=0.8773 max=0.9059
         : test loss mean=0.2529 ± 0.0183
         : individual accs = ['0.900877', '0.886874', '0.881988', '0.905872', '0.890653', '0.895197', '0.902183', '0.899734', '0.880282', '0.899823', '0.904720', '0.905778', '0.896701', '0.894828', '0.903025', '0.890830', '0.898614', '0.887710', '0.881590', '0.877301']
         : correct/total = [(1027, 1140), (1027, 1158), (994, 1127), (1049, 1158), (1010, 1134), (1025, 1145), (1033, 1145), (1014, 1127), (1000, 1136), (1015, 1128), (1035, 1144), (1019, 1125), (1033, 1152), (1038, 1160), (1015, 1124), (1020, 1145), (1037, 1154), (1004, 1131), (1020, 1157), (1001, 1141)]
         : compromised: 0.8950, honest: 0.8941
Round 009: test acc mean=0.8978 ± 0.0116 | min=0.8591 max=0.9130
         : test loss mean=0.2475 ± 0.0221
         : individual accs = ['0.907895', '0.887737', '0.900621', '0.908463', '0.899471', '0.903930', '0.897817', '0.913043', '0.879401', '0.903369', '0.899476', '0.907556', '0.895833', '0.898276', '0.897687', '0.898690', '0.907279', '0.891247', '0.859118', '0.899211']
         : correct/total = [(1035, 1140), (1028, 1158), (1015, 1127), (1052, 1158), (1020, 1134), (1035, 1145), (1028, 1145), (1029, 1127), (999, 1136), (1019, 1128), (1029, 1144), (1021, 1125), (1032, 1152), (1042, 1160), (1009, 1124), (1029, 1145), (1047, 1154), (1008, 1131), (994, 1157), (1026, 1141)]
         : compromised: 0.9011, honest: 0.8974
Round 010: test acc mean=0.9021 ± 0.0078 | min=0.8825 max=0.9162
         : test loss mean=0.2423 ± 0.0178
         : individual accs = ['0.907018', '0.904145', '0.897072', '0.916235', '0.902116', '0.907424', '0.903057', '0.909494', '0.902289', '0.900709', '0.903846', '0.904889', '0.907118', '0.903448', '0.902135', '0.892576', '0.911612', '0.886826', '0.882455', '0.896582']
         : correct/total = [(1034, 1140), (1047, 1158), (1011, 1127), (1061, 1158), (1023, 1134), (1039, 1145), (1034, 1145), (1025, 1127), (1025, 1136), (1016, 1128), (1034, 1144), (1018, 1125), (1045, 1152), (1048, 1160), (1014, 1124), (1022, 1145), (1052, 1154), (1003, 1131), (1021, 1157), (1023, 1141)]
         : compromised: 0.9054, honest: 0.9017

=== FINAL RESULTS ===
Dataset: celeba, Nodes: 20, Graph: erdos, Aggregation: krum
Attack: directed_deviation, 10.0% compromised
Final accuracy - Compromised: 0.9054, Honest: 0.9017
Overall test accuracy: mean=0.9021 ± 0.0078
