Device: cuda
Seed: 987654321
Looking for images in: /home/student.unimelb.edu.au/mrangwala/Projects/Sketchguard/leaf/data/celeba/data/raw/img_align_celeba
Loading 1 LEAF CelebA train files...
LEAF CelebA train: 9343 users (celebrities), 177457 samples
Looking for images in: /home/student.unimelb.edu.au/mrangwala/Projects/Sketchguard/leaf/data/celeba/data/raw/img_align_celeba
Loading 1 LEAF CelebA test files...
LEAF CelebA test: 9343 users (celebrities), 22831 samples
Found 9343 train users, 9343 test users, 9343 common users
User sample counts range: 31 (max) to 4 (min)
Distributed ALL 9343 users across 20 clients
Users per client: 467 (with 3 clients getting +1 user)
Train partition sizes: [8843, 8998, 8728, 9034, 8866, 8946, 8873, 8776, 8816, 8801, 8913, 8656, 9115, 8921, 8699, 8823, 8912, 8766, 9102, 8869]
Test partition sizes: [1140, 1158, 1127, 1158, 1134, 1145, 1145, 1127, 1136, 1128, 1144, 1125, 1152, 1160, 1124, 1145, 1154, 1131, 1157, 1141]
  Client 0: 8843 train samples, 2 unique classes
  Client 1: 8998 train samples, 2 unique classes
  Client 2: 8728 train samples, 2 unique classes
  Client 3: 9034 train samples, 2 unique classes
  Client 4: 8866 train samples, 2 unique classes
  Client 5: 8946 train samples, 2 unique classes
  Client 6: 8873 train samples, 2 unique classes
  Client 7: 8776 train samples, 2 unique classes
  Client 8: 8816 train samples, 2 unique classes
  Client 9: 8801 train samples, 2 unique classes
  Client 10: 8913 train samples, 2 unique classes
  Client 11: 8656 train samples, 2 unique classes
  Client 12: 9115 train samples, 2 unique classes
  Client 13: 8921 train samples, 2 unique classes
  Client 14: 8699 train samples, 2 unique classes
  Client 15: 8823 train samples, 2 unique classes
  Client 16: 8912 train samples, 2 unique classes
  Client 17: 8766 train samples, 2 unique classes
  Client 18: 9102 train samples, 2 unique classes
  Client 19: 8869 train samples, 2 unique classes
Will sample 4500 samples per client per epoch
Graph: fully, nodes: 20, edges: 190
Degree statistics: avg=19.00, min=19, max=19
Attack: Compromised 6/20 nodes: [5, 12, 13, 14, 17, 18]
Attack type: krum, lambda: 1.0
Model variant: baseline
Model parameters: 2,219,692
BALANCE algorithm:
Balance Config: BALANCEConfig(gamma=2, kappa=1, alpha=0.5, min_neighbors=1)
  - Model dimension: 2,219,692 parameters
  - Complexity: O(N×d) = O(20×2,219,692)
Initial test acc across nodes: mean=0.4978 ± 0.0208
Round 001: test acc mean=0.6926 ± 0.0319 | min=0.5882 max=0.7226
         : test loss mean=0.6809 ± 0.0034
         : individual accs = ['0.712281', '0.679620', '0.670807', '0.697755', '0.588183', '0.717904', '0.696070', '0.640639', '0.713028', '0.712766', '0.690559', '0.718222', '0.717014', '0.708621', '0.664591', '0.703057', '0.715771', '0.704686', '0.722558', '0.677476']
         : correct/total = [(812, 1140), (787, 1158), (756, 1127), (808, 1158), (667, 1134), (822, 1145), (797, 1145), (722, 1127), (810, 1136), (804, 1128), (790, 1144), (808, 1125), (826, 1152), (822, 1160), (747, 1124), (805, 1145), (826, 1154), (797, 1131), (836, 1157), (773, 1141)]
         : compromised: 0.7059, honest: 0.6869
Round 002: test acc mean=0.6477 ± 0.0516 | min=0.5220 max=0.7092
         : test loss mean=0.6788 ± 0.0050
         : individual accs = ['0.647368', '0.654577', '0.691216', '0.653713', '0.522046', '0.553712', '0.661135', '0.658385', '0.633803', '0.651596', '0.692308', '0.650667', '0.709201', '0.654310', '0.534698', '0.680349', '0.697574', '0.627763', '0.694036', '0.685364']
         : correct/total = [(738, 1140), (758, 1158), (779, 1127), (757, 1158), (592, 1134), (634, 1145), (757, 1145), (742, 1127), (720, 1136), (735, 1128), (792, 1144), (732, 1125), (817, 1152), (759, 1160), (601, 1124), (779, 1145), (805, 1154), (710, 1131), (803, 1157), (782, 1141)]
         : compromised: 0.6290, honest: 0.6557
Round 003: test acc mean=0.6413 ± 0.0473 | min=0.5178 max=0.7036
         : test loss mean=0.6669 ± 0.0085
         : individual accs = ['0.611404', '0.663212', '0.675244', '0.660622', '0.537919', '0.577293', '0.629694', '0.641526', '0.688380', '0.679078', '0.639860', '0.657778', '0.654514', '0.683621', '0.517794', '0.637555', '0.703640', '0.626879', '0.677615', '0.662577']
         : correct/total = [(697, 1140), (768, 1158), (761, 1127), (765, 1158), (610, 1134), (661, 1145), (721, 1145), (723, 1127), (782, 1136), (766, 1128), (732, 1144), (740, 1125), (754, 1152), (793, 1160), (582, 1124), (730, 1145), (812, 1154), (709, 1131), (784, 1157), (756, 1141)]
         : compromised: 0.6230, honest: 0.6492
Round 004: test acc mean=0.6918 ± 0.0251 | min=0.6308 max=0.7316
         : test loss mean=0.6222 ± 0.0118
         : individual accs = ['0.687719', '0.694301', '0.701863', '0.702936', '0.663139', '0.687336', '0.698690', '0.665484', '0.708627', '0.703901', '0.714161', '0.731556', '0.710069', '0.706897', '0.630783', '0.654148', '0.730503', '0.700265', '0.681936', '0.661700']
         : correct/total = [(784, 1140), (804, 1158), (791, 1127), (814, 1158), (752, 1134), (787, 1145), (800, 1145), (750, 1127), (805, 1136), (794, 1128), (817, 1144), (823, 1125), (818, 1152), (820, 1160), (709, 1124), (749, 1145), (843, 1154), (792, 1131), (789, 1157), (755, 1141)]
         : compromised: 0.6862, honest: 0.6942
Round 005: test acc mean=0.7491 ± 0.0183 | min=0.7174 max=0.7782
         : test loss mean=0.5392 ± 0.0183
         : individual accs = ['0.722807', '0.761658', '0.724046', '0.749568', '0.735450', '0.773799', '0.764192', '0.738243', '0.744718', '0.774823', '0.756119', '0.775111', '0.730903', '0.739655', '0.733096', '0.746725', '0.778163', '0.755084', '0.717373', '0.759860']
         : correct/total = [(824, 1140), (882, 1158), (816, 1127), (868, 1158), (834, 1134), (886, 1145), (875, 1145), (832, 1127), (846, 1136), (874, 1128), (865, 1144), (872, 1125), (842, 1152), (858, 1160), (824, 1124), (855, 1145), (898, 1154), (854, 1131), (830, 1157), (867, 1141)]
         : compromised: 0.7417, honest: 0.7522
Round 006: test acc mean=0.7864 ± 0.0159 | min=0.7622 max=0.8133
         : test loss mean=0.4660 ± 0.0180
         : individual accs = ['0.771930', '0.806563', '0.805679', '0.787565', '0.783069', '0.800873', '0.776419', '0.774623', '0.787852', '0.804965', '0.812063', '0.813333', '0.790799', '0.780172', '0.766014', '0.774672', '0.774697', '0.762157', '0.764045', '0.790535']
         : correct/total = [(880, 1140), (934, 1158), (908, 1127), (912, 1158), (888, 1134), (917, 1145), (889, 1145), (873, 1127), (895, 1136), (908, 1128), (929, 1144), (915, 1125), (911, 1152), (905, 1160), (861, 1124), (887, 1145), (894, 1154), (862, 1131), (884, 1157), (902, 1141)]
         : compromised: 0.7773, honest: 0.7903
Round 007: test acc mean=0.8270 ± 0.0154 | min=0.7952 max=0.8489
         : test loss mean=0.3931 ± 0.0178
         : individual accs = ['0.822807', '0.848877', '0.828749', '0.820380', '0.816578', '0.840175', '0.836681', '0.821650', '0.838028', '0.847518', '0.846154', '0.848000', '0.805556', '0.827586', '0.816726', '0.803493', '0.821490', '0.815208', '0.795160', '0.838738']
         : correct/total = [(938, 1140), (983, 1158), (934, 1127), (950, 1158), (926, 1134), (962, 1145), (958, 1145), (926, 1127), (952, 1136), (956, 1128), (968, 1144), (954, 1125), (928, 1152), (960, 1160), (918, 1124), (920, 1145), (948, 1154), (922, 1131), (920, 1157), (957, 1141)]
         : compromised: 0.8167, honest: 0.8314
Round 008: test acc mean=0.8537 ± 0.0133 | min=0.8168 max=0.8748
         : test loss mean=0.3412 ± 0.0167
         : individual accs = ['0.840351', '0.874784', '0.854481', '0.846287', '0.846561', '0.868122', '0.859389', '0.852706', '0.849472', '0.862589', '0.865385', '0.872889', '0.849826', '0.861207', '0.860320', '0.837555', '0.859619', '0.839965', '0.816768', '0.856266']
         : correct/total = [(958, 1140), (1013, 1158), (963, 1127), (980, 1158), (960, 1134), (994, 1145), (984, 1145), (961, 1127), (965, 1136), (973, 1128), (990, 1144), (982, 1125), (979, 1152), (999, 1160), (967, 1124), (959, 1145), (992, 1154), (950, 1131), (945, 1157), (977, 1141)]
         : compromised: 0.8494, honest: 0.8556
Round 009: test acc mean=0.8716 ± 0.0128 | min=0.8392 max=0.8903
         : test loss mean=0.3071 ± 0.0197
         : individual accs = ['0.869298', '0.890328', '0.863354', '0.876511', '0.862434', '0.882096', '0.888210', '0.876664', '0.867077', '0.878546', '0.882867', '0.888889', '0.868056', '0.869828', '0.872776', '0.852402', '0.873484', '0.852343', '0.839239', '0.878177']
         : correct/total = [(991, 1140), (1031, 1158), (973, 1127), (1015, 1158), (978, 1134), (1010, 1145), (1017, 1145), (988, 1127), (985, 1136), (991, 1128), (1010, 1144), (1000, 1125), (1000, 1152), (1009, 1160), (981, 1124), (976, 1145), (1008, 1154), (964, 1131), (971, 1157), (1002, 1141)]
         : compromised: 0.8641, honest: 0.8749
Round 010: test acc mean=0.8830 ± 0.0100 | min=0.8600 max=0.8963
         : test loss mean=0.2838 ± 0.0155
         : individual accs = ['0.878070', '0.889465', '0.876664', '0.888601', '0.878307', '0.890830', '0.891703', '0.886424', '0.882042', '0.896277', '0.885490', '0.895111', '0.881076', '0.891379', '0.889680', '0.861135', '0.886482', '0.868258', '0.859983', '0.882559']
         : correct/total = [(1001, 1140), (1030, 1158), (988, 1127), (1029, 1158), (996, 1134), (1020, 1145), (1021, 1145), (999, 1127), (1002, 1136), (1011, 1128), (1013, 1144), (1007, 1125), (1015, 1152), (1034, 1160), (1000, 1124), (986, 1145), (1023, 1154), (982, 1131), (995, 1157), (1007, 1141)]
         : compromised: 0.8802, honest: 0.8842

=== FINAL RESULTS ===
Dataset: celeba, Nodes: 20, Graph: fully, Aggregation: balance
Attack: krum, 30.0% compromised
Final accuracy - Compromised: 0.8802, Honest: 0.8842
Overall test accuracy: mean=0.8830 ± 0.0100

=== BALANCE SUMMARY ===
Node 0: acceptance=0.684
Node 1: acceptance=0.684
Node 2: acceptance=0.684
Node 3: acceptance=0.684
Node 4: acceptance=0.684
Node 5: acceptance=0.737
Node 6: acceptance=0.684
Node 7: acceptance=0.684
Node 8: acceptance=0.684
Node 9: acceptance=0.684
Node 10: acceptance=0.684
Node 11: acceptance=0.684
Node 12: acceptance=0.737
Node 13: acceptance=0.737
Node 14: acceptance=0.737
Node 15: acceptance=0.684
Node 16: acceptance=0.684
Node 17: acceptance=0.737
Node 18: acceptance=0.737
Node 19: acceptance=0.684

=== PARALLEL EXECUTION TIME (realistic for distributed system) ===
  COMMUNICATION (max across nodes):
    - Full model transfer: 0.000s (0.0%)
  COMPUTATION (max across nodes):
    - Filtering: 0.053s (80.3%)
    - Aggregation: 0.013s (19.7%)
  TOTALS:
    - Total computation: 0.066s (100.0%)
    - Total communication: 0.000s (0.0%)
    - Total parallel time: 0.066s

=== PER-NODE AVERAGE TIME ===
  - Filtering: 0.049s
  - Aggregation: 0.007s
  - Model transfer: 0.000s
  - Total per node: 0.056s

=== TOTAL COMPUTATIONAL WORK (sum across all nodes) ===
  - Total filtering: 0.975s
  - Total aggregation: 0.147s
  - Total model transfer: 0.000s
  - Grand total: 1.122s
  - Mean acceptance rate: 0.700

BALANCE Algorithm Properties:
  - Model dimension: 2,219,692
  - No compression: Full parameter comparison
  - Theoretical complexity: O(deg(i)×d)
  - Approach: Full parameter filtering + averaging
