Device: cuda
Seed: 987654321
Looking for images in: /home/student.unimelb.edu.au/mrangwala/Projects/Sketchguard/leaf/data/celeba/data/raw/img_align_celeba
Loading 1 LEAF CelebA train files...
LEAF CelebA train: 9343 users (celebrities), 177457 samples
Looking for images in: /home/student.unimelb.edu.au/mrangwala/Projects/Sketchguard/leaf/data/celeba/data/raw/img_align_celeba
Loading 1 LEAF CelebA test files...
LEAF CelebA test: 9343 users (celebrities), 22831 samples
Found 9343 train users, 9343 test users, 9343 common users
User sample counts range: 31 (max) to 4 (min)
Distributed ALL 9343 users across 20 clients
Users per client: 467 (with 3 clients getting +1 user)
Train partition sizes: [8843, 8998, 8728, 9034, 8866, 8946, 8873, 8776, 8816, 8801, 8913, 8656, 9115, 8921, 8699, 8823, 8912, 8766, 9102, 8869]
Test partition sizes: [1140, 1158, 1127, 1158, 1134, 1145, 1145, 1127, 1136, 1128, 1144, 1125, 1152, 1160, 1124, 1145, 1154, 1131, 1157, 1141]
  Client 0: 8843 train samples, 2 unique classes
  Client 1: 8998 train samples, 2 unique classes
  Client 2: 8728 train samples, 2 unique classes
  Client 3: 9034 train samples, 2 unique classes
  Client 4: 8866 train samples, 2 unique classes
  Client 5: 8946 train samples, 2 unique classes
  Client 6: 8873 train samples, 2 unique classes
  Client 7: 8776 train samples, 2 unique classes
  Client 8: 8816 train samples, 2 unique classes
  Client 9: 8801 train samples, 2 unique classes
  Client 10: 8913 train samples, 2 unique classes
  Client 11: 8656 train samples, 2 unique classes
  Client 12: 9115 train samples, 2 unique classes
  Client 13: 8921 train samples, 2 unique classes
  Client 14: 8699 train samples, 2 unique classes
  Client 15: 8823 train samples, 2 unique classes
  Client 16: 8912 train samples, 2 unique classes
  Client 17: 8766 train samples, 2 unique classes
  Client 18: 9102 train samples, 2 unique classes
  Client 19: 8869 train samples, 2 unique classes
Will sample 4500 samples per client per epoch
Graph: ring, nodes: 20, edges: 20
Degree statistics: avg=2.00, min=2, max=2
Attack: Compromised 8/20 nodes: [1, 5, 11, 12, 13, 14, 17, 18]
Attack type: backdoor, lambda: 1.0
Backdoor target label: 0, trigger size: 8
Model variant: baseline
Model parameters: 2,219,692
BALANCE algorithm:
Balance Config: BALANCEConfig(gamma=2, kappa=1, alpha=0.5, min_neighbors=1)
  - Model dimension: 2,219,692 parameters
  - Complexity: O(N×d) = O(20×2,219,692)
Initial test acc across nodes: mean=0.4978 ± 0.0208
Backdoor attack: Created poisoned datasets for 8 compromised nodes
Round 001: test acc mean=0.5818 ± 0.0696 | min=0.5069 max=0.7185
         : test loss mean=5318.8481 ± 12303.3296
         : individual accs = ['0.578070', '0.508636', '0.669033', '0.607945', '0.640212', '0.514410', '0.555459', '0.536823', '0.711268', '0.658688', '0.718531', '0.518222', '0.522569', '0.506897', '0.517794', '0.632314', '0.630849', '0.508400', '0.522040', '0.577564']
         : correct/total = [(659, 1140), (589, 1158), (754, 1127), (704, 1158), (726, 1134), (589, 1145), (636, 1145), (605, 1127), (808, 1136), (743, 1128), (822, 1144), (583, 1125), (602, 1152), (588, 1160), (582, 1124), (724, 1145), (728, 1154), (575, 1131), (604, 1157), (659, 1141)]
         : compromised: 0.5149, honest: 0.6264
Round 002: test acc mean=0.6405 ± 0.1173 | min=0.4780 max=0.7782
         : test loss mean=nan ± nan
         : individual accs = ['0.742105', '0.495682', '0.718722', '0.707254', '0.700176', '0.504803', '0.728384', '0.686779', '0.746479', '0.726064', '0.772727', '0.480000', '0.522569', '0.506897', '0.517794', '0.744978', '0.778163', '0.491600', '0.477960', '0.760736']
         : correct/total = [(846, 1140), (574, 1158), (810, 1127), (819, 1158), (794, 1134), (578, 1145), (834, 1145), (774, 1127), (848, 1136), (819, 1128), (884, 1144), (540, 1125), (602, 1152), (588, 1160), (582, 1124), (853, 1145), (898, 1154), (556, 1131), (553, 1157), (868, 1141)]
         : compromised: 0.4997, honest: 0.7344
Round 003: test acc mean=0.6960 ± 0.1513 | min=0.4987 max=0.8619
         : test loss mean=nan ± nan
         : individual accs = ['0.835088', '0.508636', '0.808341', '0.800518', '0.785714', '0.514410', '0.799127', '0.777285', '0.802817', '0.837766', '0.861888', '0.498667', '0.522569', '0.506897', '0.517794', '0.819214', '0.860485', '0.508400', '0.522040', '0.831727']
         : correct/total = [(952, 1140), (589, 1158), (911, 1127), (927, 1158), (891, 1134), (589, 1145), (915, 1145), (876, 1127), (912, 1136), (945, 1128), (986, 1144), (561, 1125), (602, 1152), (588, 1160), (582, 1124), (938, 1145), (993, 1154), (575, 1131), (604, 1157), (949, 1141)]
         : compromised: 0.5124, honest: 0.8183
Round 004: test acc mean=0.7184 ± 0.1685 | min=0.4987 max=0.8723
         : test loss mean=nan ± nan
         : individual accs = ['0.864912', '0.508636', '0.862467', '0.839378', '0.834215', '0.514410', '0.855022', '0.839397', '0.847711', '0.872340', '0.868007', '0.498667', '0.522569', '0.506897', '0.517794', '0.845415', '0.870884', '0.508400', '0.522040', '0.868536']
         : correct/total = [(986, 1140), (589, 1158), (972, 1127), (972, 1158), (946, 1134), (589, 1145), (979, 1145), (946, 1127), (963, 1136), (984, 1128), (993, 1144), (561, 1125), (602, 1152), (588, 1160), (582, 1124), (968, 1145), (1005, 1154), (575, 1131), (604, 1157), (991, 1141)]
         : compromised: 0.5124, honest: 0.8557
Round 005: test acc mean=0.7247 ± 0.1739 | min=0.4987 max=0.8960
         : test loss mean=nan ± nan
         : individual accs = ['0.838596', '0.508636', '0.871340', '0.883420', '0.864198', '0.514410', '0.869869', '0.866903', '0.833627', '0.851064', '0.890734', '0.498667', '0.522569', '0.506897', '0.517794', '0.867249', '0.896014', '0.508400', '0.522040', '0.860649']
         : correct/total = [(956, 1140), (589, 1158), (982, 1127), (1023, 1158), (980, 1134), (589, 1145), (996, 1145), (977, 1127), (947, 1136), (960, 1128), (1019, 1144), (561, 1125), (602, 1152), (588, 1160), (582, 1124), (993, 1145), (1034, 1154), (575, 1131), (604, 1157), (982, 1141)]
         : compromised: 0.5124, honest: 0.8661
Round 006: test acc mean=0.7362 ± 0.1829 | min=0.4987 max=0.9021
         : test loss mean=nan ± nan
         : individual accs = ['0.890351', '0.508636', '0.889086', '0.896373', '0.887125', '0.514410', '0.882969', '0.880213', '0.882042', '0.867908', '0.890734', '0.498667', '0.522569', '0.506897', '0.517794', '0.871616', '0.902080', '0.508400', '0.522040', '0.884312']
         : correct/total = [(1015, 1140), (589, 1158), (1002, 1127), (1038, 1158), (1006, 1134), (589, 1145), (1011, 1145), (992, 1127), (1002, 1136), (979, 1128), (1019, 1144), (561, 1125), (602, 1152), (588, 1160), (582, 1124), (998, 1145), (1041, 1154), (575, 1131), (604, 1157), (1009, 1141)]
         : compromised: 0.5124, honest: 0.8854
Round 007: test acc mean=0.7400 ± 0.1859 | min=0.4987 max=0.9007
         : test loss mean=nan ± nan
         : individual accs = ['0.896491', '0.508636', '0.887311', '0.900691', '0.885362', '0.514410', '0.888210', '0.888199', '0.883803', '0.897163', '0.897727', '0.498667', '0.522569', '0.506897', '0.517794', '0.882096', '0.896880', '0.508400', '0.522040', '0.896582']
         : correct/total = [(1022, 1140), (589, 1158), (1000, 1127), (1043, 1158), (1004, 1134), (589, 1145), (1017, 1145), (1001, 1127), (1004, 1136), (1012, 1128), (1027, 1144), (561, 1125), (602, 1152), (588, 1160), (582, 1124), (1010, 1145), (1035, 1154), (575, 1131), (604, 1157), (1023, 1141)]
         : compromised: 0.5124, honest: 0.8917
Round 008: test acc mean=0.7392 ± 0.1854 | min=0.4987 max=0.9085
         : test loss mean=nan ± nan
         : individual accs = ['0.892105', '0.508636', '0.892635', '0.908463', '0.896825', '0.514410', '0.889956', '0.888199', '0.869718', '0.877660', '0.895105', '0.498667', '0.522569', '0.506897', '0.517794', '0.882096', '0.906412', '0.508400', '0.522040', '0.886065']
         : correct/total = [(1017, 1140), (589, 1158), (1006, 1127), (1052, 1158), (1017, 1134), (589, 1145), (1019, 1145), (1001, 1127), (988, 1136), (990, 1128), (1024, 1144), (561, 1125), (602, 1152), (588, 1160), (582, 1124), (1010, 1145), (1046, 1154), (575, 1131), (604, 1157), (1011, 1141)]
         : compromised: 0.5124, honest: 0.8904
Round 009: test acc mean=0.7427 ± 0.1882 | min=0.4987 max=0.9076
         : test loss mean=nan ± nan
         : individual accs = ['0.901754', '0.508636', '0.893523', '0.907599', '0.898589', '0.514410', '0.896070', '0.901508', '0.882042', '0.891844', '0.897727', '0.498667', '0.522569', '0.506897', '0.517794', '0.889083', '0.899480', '0.508400', '0.522040', '0.895706']
         : correct/total = [(1028, 1140), (589, 1158), (1007, 1127), (1051, 1158), (1019, 1134), (589, 1145), (1026, 1145), (1016, 1127), (1002, 1136), (1006, 1128), (1027, 1144), (561, 1125), (602, 1152), (588, 1160), (582, 1124), (1018, 1145), (1038, 1154), (575, 1131), (604, 1157), (1022, 1141)]
         : compromised: 0.5124, honest: 0.8962
Round 010: test acc mean=0.7443 ± 0.1895 | min=0.4987 max=0.9136
         : test loss mean=nan ± nan
         : individual accs = ['0.900000', '0.508636', '0.889973', '0.913644', '0.901235', '0.514410', '0.884716', '0.900621', '0.897007', '0.899823', '0.898601', '0.498667', '0.522569', '0.506897', '0.517794', '0.890830', '0.909012', '0.508400', '0.522040', '0.901840']
         : correct/total = [(1026, 1140), (589, 1158), (1003, 1127), (1058, 1158), (1022, 1134), (589, 1145), (1013, 1145), (1015, 1127), (1019, 1136), (1015, 1128), (1028, 1144), (561, 1125), (602, 1152), (588, 1160), (582, 1124), (1020, 1145), (1049, 1154), (575, 1131), (604, 1157), (1029, 1141)]
         : compromised: 0.5124, honest: 0.8989

=== FINAL RESULTS ===
Dataset: celeba, Nodes: 20, Graph: ring, Aggregation: balance
Attack: backdoor, 40.0% compromised
Final accuracy - Compromised: 0.5124, Honest: 0.8989
Overall test accuracy: mean=0.7443 ± 0.1895

=== BACKDOOR ATTACK SUCCESS RATE (ASR) ===
Target label: 0
Trigger size: 8x8
Overall ASR: 0.7257 ± 0.2247
Honest nodes ASR: 0.5429 ± 0.0236
Compromised nodes ASR: 1.0000 ± 0.0000
Note: Higher ASR indicates more successful backdoor attack

=== BALANCE SUMMARY ===
Node 0: acceptance=0.500
Node 1: acceptance=0.200
Node 2: acceptance=0.500
Node 3: acceptance=1.000
Node 4: acceptance=0.500
Node 5: acceptance=0.200
Node 6: acceptance=0.500
Node 7: acceptance=1.000
Node 8: acceptance=1.000
Node 9: acceptance=1.000
Node 10: acceptance=0.500
Node 11: acceptance=0.150
Node 12: acceptance=0.000
Node 13: acceptance=0.000
Node 14: acceptance=0.150
Node 15: acceptance=0.500
Node 16: acceptance=0.500
Node 17: acceptance=0.150
Node 18: acceptance=0.150
Node 19: acceptance=0.500

=== PARALLEL EXECUTION TIME (realistic for distributed system) ===
  COMMUNICATION (max across nodes):
    - Full model transfer: 0.000s (0.0%)
  COMPUTATION (max across nodes):
    - Filtering: 0.012s (53.5%)
    - Aggregation: 0.010s (46.5%)
  TOTALS:
    - Total computation: 0.022s (100.0%)
    - Total communication: 0.000s (0.0%)
    - Total parallel time: 0.022s

=== PER-NODE AVERAGE TIME ===
  - Filtering: 0.008s
  - Aggregation: 0.003s
  - Model transfer: 0.000s
  - Total per node: 0.011s

=== TOTAL COMPUTATIONAL WORK (sum across all nodes) ===
  - Total filtering: 0.153s
  - Total aggregation: 0.069s
  - Total model transfer: 0.000s
  - Grand total: 0.222s
  - Mean acceptance rate: 0.450

BALANCE Algorithm Properties:
  - Model dimension: 2,219,692
  - No compression: Full parameter comparison
  - Theoretical complexity: O(deg(i)×d)
  - Approach: Full parameter filtering + averaging
