Device: cuda
Seed: 987654321
Looking for images in: /home/student.unimelb.edu.au/mrangwala/Projects/Sketchguard/leaf/data/celeba/data/raw/img_align_celeba
Loading 1 LEAF CelebA train files...
LEAF CelebA train: 9343 users (celebrities), 177457 samples
Looking for images in: /home/student.unimelb.edu.au/mrangwala/Projects/Sketchguard/leaf/data/celeba/data/raw/img_align_celeba
Loading 1 LEAF CelebA test files...
LEAF CelebA test: 9343 users (celebrities), 22831 samples
Found 9343 train users, 9343 test users, 9343 common users
User sample counts range: 31 (max) to 4 (min)
Distributed ALL 9343 users across 20 clients
Users per client: 467 (with 3 clients getting +1 user)
Train partition sizes: [8843, 8998, 8728, 9034, 8866, 8946, 8873, 8776, 8816, 8801, 8913, 8656, 9115, 8921, 8699, 8823, 8912, 8766, 9102, 8869]
Test partition sizes: [1140, 1158, 1127, 1158, 1134, 1145, 1145, 1127, 1136, 1128, 1144, 1125, 1152, 1160, 1124, 1145, 1154, 1131, 1157, 1141]
  Client 0: 8843 train samples, 2 unique classes
  Client 1: 8998 train samples, 2 unique classes
  Client 2: 8728 train samples, 2 unique classes
  Client 3: 9034 train samples, 2 unique classes
  Client 4: 8866 train samples, 2 unique classes
  Client 5: 8946 train samples, 2 unique classes
  Client 6: 8873 train samples, 2 unique classes
  Client 7: 8776 train samples, 2 unique classes
  Client 8: 8816 train samples, 2 unique classes
  Client 9: 8801 train samples, 2 unique classes
  Client 10: 8913 train samples, 2 unique classes
  Client 11: 8656 train samples, 2 unique classes
  Client 12: 9115 train samples, 2 unique classes
  Client 13: 8921 train samples, 2 unique classes
  Client 14: 8699 train samples, 2 unique classes
  Client 15: 8823 train samples, 2 unique classes
  Client 16: 8912 train samples, 2 unique classes
  Client 17: 8766 train samples, 2 unique classes
  Client 18: 9102 train samples, 2 unique classes
  Client 19: 8869 train samples, 2 unique classes
Will sample 4500 samples per client per epoch
Graph: fully, nodes: 20, edges: 190
Degree statistics: avg=19.00, min=19, max=19
Attack: Compromised 2/20 nodes: [5, 13]
Attack type: backdoor, lambda: 1.0
Backdoor target label: 0, trigger size: 8
Model variant: baseline
Model parameters: 2,219,692
BALANCE algorithm:
Balance Config: BALANCEConfig(gamma=2, kappa=1, alpha=0.5, min_neighbors=1)
  - Model dimension: 2,219,692 parameters
  - Complexity: O(N×d) = O(20×2,219,692)
Initial test acc across nodes: mean=0.4978 ± 0.0208
Backdoor attack: Created poisoned datasets for 2 compromised nodes
Round 001: test acc mean=0.6743 ± 0.0634 | min=0.5069 max=0.7324
         : test loss mean=366.8274 ± 1111.8221
         : individual accs = ['0.712281', '0.666667', '0.658385', '0.702073', '0.597002', '0.514410', '0.710917', '0.640639', '0.732394', '0.721631', '0.692308', '0.718222', '0.717014', '0.506897', '0.675267', '0.700437', '0.716638', '0.705570', '0.726880', '0.669588']
         : correct/total = [(812, 1140), (772, 1158), (742, 1127), (813, 1158), (677, 1134), (589, 1145), (814, 1145), (722, 1127), (832, 1136), (814, 1128), (792, 1144), (808, 1125), (826, 1152), (588, 1160), (759, 1124), (802, 1145), (827, 1154), (798, 1131), (841, 1157), (764, 1141)]
         : compromised: 0.5107, honest: 0.6924
Round 002: test acc mean=0.6408 ± 0.0599 | min=0.5078 max=0.7161
         : test loss mean=24.7815 ± 72.9312
         : individual accs = ['0.657895', '0.650259', '0.677019', '0.658895', '0.522928', '0.513537', '0.660262', '0.654836', '0.665493', '0.645390', '0.694056', '0.656889', '0.716146', '0.507759', '0.572064', '0.664629', '0.686308', '0.636605', '0.685393', '0.690622']
         : correct/total = [(750, 1140), (753, 1158), (763, 1127), (763, 1158), (593, 1134), (588, 1145), (756, 1145), (738, 1127), (756, 1136), (728, 1128), (794, 1144), (739, 1125), (825, 1152), (589, 1160), (643, 1124), (761, 1145), (792, 1154), (720, 1131), (793, 1157), (788, 1141)]
         : compromised: 0.5106, honest: 0.6553
Round 003: test acc mean=0.6187 ± 0.0593 | min=0.5052 max=0.6901
         : test loss mean=nan ± nan
         : individual accs = ['0.594737', '0.653713', '0.665484', '0.658895', '0.522046', '0.514410', '0.593013', '0.604259', '0.690141', '0.669326', '0.628497', '0.654222', '0.662326', '0.505172', '0.518683', '0.631441', '0.681976', '0.592396', '0.676750', '0.657318']
         : correct/total = [(678, 1140), (757, 1158), (750, 1127), (763, 1158), (592, 1134), (589, 1145), (679, 1145), (681, 1127), (784, 1136), (755, 1128), (719, 1144), (736, 1125), (763, 1152), (586, 1160), (583, 1124), (723, 1145), (787, 1154), (670, 1131), (783, 1157), (750, 1141)]
         : compromised: 0.5098, honest: 0.6308
Round 004: test acc mean=0.6595 ± 0.0583 | min=0.5069 max=0.7227
         : test loss mean=nan ± nan
         : individual accs = ['0.674561', '0.683074', '0.674357', '0.698618', '0.636684', '0.514410', '0.653275', '0.641526', '0.701585', '0.689716', '0.706294', '0.722667', '0.707465', '0.506897', '0.604982', '0.634061', '0.714038', '0.678161', '0.702679', '0.644172']
         : correct/total = [(769, 1140), (791, 1158), (760, 1127), (809, 1158), (722, 1134), (589, 1145), (748, 1145), (723, 1127), (797, 1136), (778, 1128), (808, 1144), (813, 1125), (815, 1152), (588, 1160), (680, 1124), (726, 1145), (824, 1154), (767, 1131), (813, 1157), (735, 1141)]
         : compromised: 0.5107, honest: 0.6760
Round 005: test acc mean=0.7174 ± 0.0704 | min=0.5069 max=0.7631
         : test loss mean=nan ± nan
         : individual accs = ['0.719298', '0.754750', '0.707187', '0.741796', '0.726631', '0.514410', '0.758079', '0.733807', '0.735035', '0.748227', '0.763112', '0.758222', '0.730035', '0.506897', '0.732206', '0.748472', '0.741768', '0.756852', '0.720830', '0.750219']
         : correct/total = [(820, 1140), (874, 1158), (797, 1127), (859, 1158), (824, 1134), (589, 1145), (868, 1145), (827, 1127), (835, 1136), (844, 1128), (873, 1144), (853, 1125), (841, 1152), (588, 1160), (823, 1124), (857, 1145), (856, 1154), (856, 1131), (834, 1157), (856, 1141)]
         : compromised: 0.5107, honest: 0.7404
Round 006: test acc mean=0.7522 ± 0.0820 | min=0.5069 max=0.8156
         : test loss mean=nan ± nan
         : individual accs = ['0.752632', '0.799655', '0.789707', '0.782383', '0.780423', '0.514410', '0.781659', '0.758651', '0.786092', '0.788121', '0.815559', '0.799111', '0.782118', '0.506897', '0.769573', '0.769432', '0.772964', '0.751547', '0.767502', '0.775635']
         : correct/total = [(858, 1140), (926, 1158), (890, 1127), (906, 1158), (885, 1134), (589, 1145), (895, 1145), (855, 1127), (893, 1136), (889, 1128), (933, 1144), (899, 1125), (901, 1152), (588, 1160), (865, 1124), (881, 1145), (892, 1154), (850, 1131), (888, 1157), (885, 1141)]
         : compromised: 0.5107, honest: 0.7790
Round 007: test acc mean=0.7910 ± 0.0944 | min=0.5069 max=0.8453
         : test loss mean=nan ± nan
         : individual accs = ['0.816667', '0.841105', '0.828749', '0.817789', '0.809524', '0.514410', '0.830568', '0.816327', '0.830986', '0.840426', '0.843531', '0.845333', '0.810764', '0.506897', '0.814947', '0.800873', '0.801560', '0.816092', '0.802939', '0.829974']
         : correct/total = [(931, 1140), (974, 1158), (934, 1127), (947, 1158), (918, 1134), (589, 1145), (951, 1145), (920, 1127), (944, 1136), (948, 1128), (965, 1144), (951, 1125), (934, 1152), (588, 1160), (916, 1124), (917, 1145), (925, 1154), (923, 1131), (929, 1157), (947, 1141)]
         : compromised: 0.5107, honest: 0.8221
Round 008: test acc mean=0.8183 ± 0.1032 | min=0.5069 max=0.8720
         : test loss mean=nan ± nan
         : individual accs = ['0.844737', '0.869603', '0.858917', '0.851468', '0.843915', '0.514410', '0.855022', '0.850044', '0.857394', '0.860816', '0.866259', '0.872000', '0.844618', '0.506897', '0.860320', '0.841048', '0.859619', '0.833775', '0.822818', '0.851884']
         : correct/total = [(963, 1140), (1007, 1158), (968, 1127), (986, 1158), (957, 1134), (589, 1145), (979, 1145), (958, 1127), (974, 1136), (971, 1128), (991, 1144), (981, 1125), (973, 1152), (588, 1160), (967, 1124), (963, 1145), (992, 1154), (943, 1131), (952, 1157), (972, 1141)]
         : compromised: 0.5107, honest: 0.8525
Round 009: test acc mean=0.8319 ± 0.1080 | min=0.5069 max=0.8903
         : test loss mean=nan ± nan
         : individual accs = ['0.870175', '0.890328', '0.848270', '0.873057', '0.855379', '0.514410', '0.878603', '0.874002', '0.866197', '0.877660', '0.886364', '0.883556', '0.864583', '0.506897', '0.867438', '0.845415', '0.870884', '0.847922', '0.837511', '0.879053']
         : correct/total = [(992, 1140), (1031, 1158), (956, 1127), (1011, 1158), (970, 1134), (589, 1145), (1006, 1145), (985, 1127), (984, 1136), (990, 1128), (1014, 1144), (994, 1125), (996, 1152), (588, 1160), (975, 1124), (968, 1145), (1005, 1154), (959, 1131), (969, 1157), (1003, 1141)]
         : compromised: 0.5107, honest: 0.8676
Round 010: test acc mean=0.8446 ± 0.1116 | min=0.5069 max=0.8972
         : test loss mean=nan ± nan
         : individual accs = ['0.880702', '0.887737', '0.876664', '0.887737', '0.873898', '0.514410', '0.882969', '0.884650', '0.886444', '0.897163', '0.888112', '0.886222', '0.884549', '0.506897', '0.889680', '0.868996', '0.883882', '0.870027', '0.859118', '0.882559']
         : correct/total = [(1004, 1140), (1028, 1158), (988, 1127), (1028, 1158), (991, 1134), (589, 1145), (1011, 1145), (997, 1127), (1007, 1136), (1012, 1128), (1016, 1144), (997, 1125), (1019, 1152), (588, 1160), (1000, 1124), (995, 1145), (1020, 1154), (984, 1131), (994, 1157), (1007, 1141)]
         : compromised: 0.5107, honest: 0.8817

=== FINAL RESULTS ===
Dataset: celeba, Nodes: 20, Graph: fully, Aggregation: balance
Attack: backdoor, 10.0% compromised
Final accuracy - Compromised: 0.5107, Honest: 0.8817
Overall test accuracy: mean=0.8446 ± 0.1116

=== BACKDOOR ATTACK SUCCESS RATE (ASR) ===
Target label: 0
Trigger size: 8x8
Overall ASR: 0.5867 ± 0.1390
Honest nodes ASR: 0.5408 ± 0.0194
Compromised nodes ASR: 1.0000 ± 0.0000
Note: Higher ASR indicates more successful backdoor attack

=== BALANCE SUMMARY ===
Node 0: acceptance=0.895
Node 1: acceptance=0.895
Node 2: acceptance=0.895
Node 3: acceptance=0.895
Node 4: acceptance=0.895
Node 5: acceptance=0.195
Node 6: acceptance=0.895
Node 7: acceptance=0.895
Node 8: acceptance=0.895
Node 9: acceptance=0.895
Node 10: acceptance=0.895
Node 11: acceptance=0.895
Node 12: acceptance=0.895
Node 13: acceptance=0.295
Node 14: acceptance=0.895
Node 15: acceptance=0.895
Node 16: acceptance=0.895
Node 17: acceptance=0.895
Node 18: acceptance=0.895
Node 19: acceptance=0.895

=== PARALLEL EXECUTION TIME (realistic for distributed system) ===
  COMMUNICATION (max across nodes):
    - Full model transfer: 0.000s (0.0%)
  COMPUTATION (max across nodes):
    - Filtering: 0.054s (77.4%)
    - Aggregation: 0.016s (22.6%)
  TOTALS:
    - Total computation: 0.069s (100.0%)
    - Total communication: 0.000s (0.0%)
    - Total parallel time: 0.069s

=== PER-NODE AVERAGE TIME ===
  - Filtering: 0.050s
  - Aggregation: 0.008s
  - Model transfer: 0.000s
  - Total per node: 0.058s

=== TOTAL COMPUTATIONAL WORK (sum across all nodes) ===
  - Total filtering: 0.991s
  - Total aggregation: 0.165s
  - Total model transfer: 0.000s
  - Grand total: 1.157s
  - Mean acceptance rate: 0.830

BALANCE Algorithm Properties:
  - Model dimension: 2,219,692
  - No compression: Full parameter comparison
  - Theoretical complexity: O(deg(i)×d)
  - Approach: Full parameter filtering + averaging
