Device: cuda
Seed: 987654321
Looking for images in: /home/student.unimelb.edu.au/mrangwala/Projects/Sketchguard/leaf/data/celeba/data/raw/img_align_celeba
Loading 1 LEAF CelebA train files...
LEAF CelebA train: 9343 users (celebrities), 177457 samples
Looking for images in: /home/student.unimelb.edu.au/mrangwala/Projects/Sketchguard/leaf/data/celeba/data/raw/img_align_celeba
Loading 1 LEAF CelebA test files...
LEAF CelebA test: 9343 users (celebrities), 22831 samples
Found 9343 train users, 9343 test users, 9343 common users
User sample counts range: 31 (max) to 4 (min)
Distributed ALL 9343 users across 20 clients
Users per client: 467 (with 3 clients getting +1 user)
Train partition sizes: [8843, 8998, 8728, 9034, 8866, 8946, 8873, 8776, 8816, 8801, 8913, 8656, 9115, 8921, 8699, 8823, 8912, 8766, 9102, 8869]
Test partition sizes: [1140, 1158, 1127, 1158, 1134, 1145, 1145, 1127, 1136, 1128, 1144, 1125, 1152, 1160, 1124, 1145, 1154, 1131, 1157, 1141]
  Client 0: 8843 train samples, 2 unique classes
  Client 1: 8998 train samples, 2 unique classes
  Client 2: 8728 train samples, 2 unique classes
  Client 3: 9034 train samples, 2 unique classes
  Client 4: 8866 train samples, 2 unique classes
  Client 5: 8946 train samples, 2 unique classes
  Client 6: 8873 train samples, 2 unique classes
  Client 7: 8776 train samples, 2 unique classes
  Client 8: 8816 train samples, 2 unique classes
  Client 9: 8801 train samples, 2 unique classes
  Client 10: 8913 train samples, 2 unique classes
  Client 11: 8656 train samples, 2 unique classes
  Client 12: 9115 train samples, 2 unique classes
  Client 13: 8921 train samples, 2 unique classes
  Client 14: 8699 train samples, 2 unique classes
  Client 15: 8823 train samples, 2 unique classes
  Client 16: 8912 train samples, 2 unique classes
  Client 17: 8766 train samples, 2 unique classes
  Client 18: 9102 train samples, 2 unique classes
  Client 19: 8869 train samples, 2 unique classes
Will sample 4500 samples per client per epoch
Graph: erdos, nodes: 20, edges: 48
Degree statistics: avg=4.80, min=2, max=7
Attack: Compromised 6/20 nodes: [5, 12, 13, 14, 17, 18]
Attack type: directed_deviation, lambda: 1.0
Model variant: baseline
Model parameters: 2,219,692
BALANCE algorithm:
Balance Config: BALANCEConfig(gamma=2, kappa=1, alpha=0.5, min_neighbors=1)
  - Model dimension: 2,219,692 parameters
  - Complexity: O(N×d) = O(20×2,219,692)
Initial test acc across nodes: mean=0.4978 ± 0.0208
Round 001: test acc mean=0.6457 ± 0.0583 | min=0.5197 max=0.7208
         : test loss mean=0.6806 ± 0.0042
         : individual accs = ['0.706140', '0.673575', '0.600710', '0.704663', '0.537919', '0.531004', '0.658515', '0.624667', '0.637324', '0.683511', '0.666958', '0.697778', '0.704861', '0.658621', '0.641459', '0.652402', '0.684575', '0.609195', '0.720830', '0.519720']
         : correct/total = [(805, 1140), (780, 1158), (677, 1127), (816, 1158), (610, 1134), (608, 1145), (754, 1145), (704, 1127), (724, 1136), (771, 1128), (763, 1144), (785, 1125), (812, 1152), (764, 1160), (721, 1124), (747, 1145), (790, 1154), (689, 1131), (834, 1157), (593, 1141)]
         : compromised: 0.6443, honest: 0.6463
Round 002: test acc mean=0.6721 ± 0.0382 | min=0.5677 max=0.7342
         : test loss mean=0.6579 ± 0.0213
         : individual accs = ['0.667544', '0.666667', '0.685892', '0.675302', '0.600529', '0.567686', '0.678603', '0.667258', '0.734155', '0.699468', '0.708916', '0.689778', '0.697917', '0.639655', '0.648577', '0.653275', '0.723570', '0.657825', '0.706137', '0.673094']
         : correct/total = [(761, 1140), (772, 1158), (773, 1127), (782, 1158), (681, 1134), (650, 1145), (777, 1145), (752, 1127), (834, 1136), (789, 1128), (811, 1144), (776, 1125), (804, 1152), (742, 1160), (729, 1124), (748, 1145), (835, 1154), (744, 1131), (817, 1157), (768, 1141)]
         : compromised: 0.6530, honest: 0.6803
Round 003: test acc mean=0.7207 ± 0.0364 | min=0.6508 max=0.7958
         : test loss mean=0.6110 ± 0.0395
         : individual accs = ['0.737719', '0.703800', '0.716060', '0.763385', '0.650794', '0.720524', '0.740611', '0.682343', '0.795775', '0.767730', '0.763112', '0.764444', '0.670139', '0.719828', '0.691281', '0.714410', '0.706239', '0.676393', '0.710458', '0.719544']
         : correct/total = [(841, 1140), (815, 1158), (807, 1127), (884, 1158), (738, 1134), (825, 1145), (848, 1145), (769, 1127), (904, 1136), (866, 1128), (873, 1144), (860, 1125), (772, 1152), (835, 1160), (777, 1124), (818, 1145), (815, 1154), (765, 1131), (822, 1157), (821, 1141)]
         : compromised: 0.6981, honest: 0.7304
Round 004: test acc mean=0.7768 ± 0.0294 | min=0.7165 max=0.8248
         : test loss mean=0.5362 ± 0.0488
         : individual accs = ['0.773684', '0.749568', '0.769299', '0.807427', '0.753968', '0.800000', '0.749345', '0.783496', '0.824824', '0.821809', '0.813811', '0.817778', '0.741319', '0.790517', '0.755338', '0.772926', '0.759965', '0.755084', '0.716508', '0.780018']
         : correct/total = [(882, 1140), (868, 1158), (867, 1127), (935, 1158), (855, 1134), (916, 1145), (858, 1145), (883, 1127), (937, 1136), (927, 1128), (931, 1144), (920, 1125), (854, 1152), (917, 1160), (849, 1124), (885, 1145), (877, 1154), (854, 1131), (829, 1157), (890, 1141)]
         : compromised: 0.7598, honest: 0.7841
Round 005: test acc mean=0.8061 ± 0.0303 | min=0.7445 max=0.8652
         : test loss mean=0.4610 ± 0.0510
         : individual accs = ['0.819298', '0.802245', '0.744454', '0.844560', '0.791005', '0.761572', '0.812227', '0.811890', '0.849472', '0.865248', '0.840909', '0.828444', '0.772569', '0.807759', '0.782918', '0.797380', '0.819757', '0.790451', '0.769231', '0.809816']
         : correct/total = [(934, 1140), (929, 1158), (839, 1127), (978, 1158), (897, 1134), (872, 1145), (930, 1145), (915, 1127), (965, 1136), (976, 1128), (962, 1144), (932, 1125), (890, 1152), (937, 1160), (880, 1124), (913, 1145), (946, 1154), (894, 1131), (890, 1157), (924, 1141)]
         : compromised: 0.7807, honest: 0.8169
Round 006: test acc mean=0.8426 ± 0.0233 | min=0.7857 max=0.8785
         : test loss mean=0.3934 ± 0.0378
         : individual accs = ['0.842982', '0.848014', '0.814552', '0.860967', '0.831570', '0.860262', '0.841921', '0.845608', '0.872359', '0.853723', '0.878497', '0.869333', '0.828993', '0.862069', '0.807829', '0.818341', '0.849220', '0.823165', '0.785653', '0.857143']
         : correct/total = [(961, 1140), (982, 1158), (918, 1127), (997, 1158), (943, 1134), (985, 1145), (964, 1145), (953, 1127), (991, 1136), (963, 1128), (1005, 1144), (978, 1125), (955, 1152), (1000, 1160), (908, 1124), (937, 1145), (980, 1154), (931, 1131), (909, 1157), (978, 1141)]
         : compromised: 0.8280, honest: 0.8489
Round 007: test acc mean=0.8569 ± 0.0178 | min=0.8249 max=0.8786
         : test loss mean=0.3520 ± 0.0325
         : individual accs = ['0.863158', '0.868739', '0.828749', '0.870466', '0.853616', '0.878603', '0.862009', '0.864241', '0.870599', '0.876773', '0.854895', '0.877333', '0.841146', '0.872414', '0.843416', '0.826201', '0.875217', '0.824934', '0.831461', '0.854514']
         : correct/total = [(984, 1140), (1006, 1158), (934, 1127), (1008, 1158), (968, 1134), (1006, 1145), (987, 1145), (974, 1127), (989, 1136), (989, 1128), (978, 1144), (987, 1125), (969, 1152), (1012, 1160), (948, 1124), (946, 1145), (1010, 1154), (933, 1131), (962, 1157), (975, 1141)]
         : compromised: 0.8487, honest: 0.8605
Round 008: test acc mean=0.8710 ± 0.0098 | min=0.8527 max=0.8870
         : test loss mean=0.3185 ± 0.0174
         : individual accs = ['0.874561', '0.885147', '0.852706', '0.866149', '0.863316', '0.882969', '0.881223', '0.879326', '0.875000', '0.875000', '0.857517', '0.874667', '0.865451', '0.876724', '0.887011', '0.863755', '0.876083', '0.862069', '0.854797', '0.866784']
         : correct/total = [(997, 1140), (1025, 1158), (961, 1127), (1003, 1158), (979, 1134), (1011, 1145), (1009, 1145), (991, 1127), (994, 1136), (987, 1128), (981, 1144), (984, 1125), (997, 1152), (1017, 1160), (997, 1124), (989, 1145), (1011, 1154), (975, 1131), (989, 1157), (989, 1141)]
         : compromised: 0.8715, honest: 0.8708
Round 009: test acc mean=0.8786 ± 0.0161 | min=0.8358 max=0.8939
         : test loss mean=0.2951 ± 0.0256
         : individual accs = ['0.893860', '0.886010', '0.863354', '0.888601', '0.880071', '0.889956', '0.884716', '0.887311', '0.885563', '0.889184', '0.887238', '0.891556', '0.869792', '0.886207', '0.877224', '0.867249', '0.883016', '0.837312', '0.835782', '0.888694']
         : correct/total = [(1019, 1140), (1026, 1158), (973, 1127), (1029, 1158), (998, 1134), (1019, 1145), (1013, 1145), (1000, 1127), (1006, 1136), (1003, 1128), (1015, 1144), (1003, 1125), (1002, 1152), (1028, 1160), (986, 1124), (993, 1145), (1019, 1154), (947, 1131), (967, 1157), (1014, 1141)]
         : compromised: 0.8660, honest: 0.8840
Round 010: test acc mean=0.8877 ± 0.0100 | min=0.8626 max=0.8991
         : test loss mean=0.2762 ± 0.0164
         : individual accs = ['0.899123', '0.894646', '0.870453', '0.896373', '0.882716', '0.897817', '0.882969', '0.894410', '0.893486', '0.898050', '0.881993', '0.896000', '0.892361', '0.892241', '0.893238', '0.875109', '0.885615', '0.876216', '0.862576', '0.888694']
         : correct/total = [(1025, 1140), (1036, 1158), (981, 1127), (1038, 1158), (1001, 1134), (1028, 1145), (1011, 1145), (1008, 1127), (1015, 1136), (1013, 1128), (1009, 1144), (1008, 1125), (1028, 1152), (1035, 1160), (1004, 1124), (1002, 1145), (1022, 1154), (991, 1131), (998, 1157), (1014, 1141)]
         : compromised: 0.8857, honest: 0.8885

=== FINAL RESULTS ===
Dataset: celeba, Nodes: 20, Graph: erdos, Aggregation: balance
Attack: directed_deviation, 30.0% compromised
Final accuracy - Compromised: 0.8857, Honest: 0.8885
Overall test accuracy: mean=0.8877 ± 0.0100

=== BALANCE SUMMARY ===
Node 0: acceptance=0.833
Node 1: acceptance=1.000
Node 2: acceptance=0.600
Node 3: acceptance=0.750
Node 4: acceptance=0.500
Node 5: acceptance=0.400
Node 6: acceptance=0.800
Node 7: acceptance=0.600
Node 8: acceptance=0.500
Node 9: acceptance=1.000
Node 10: acceptance=0.750
Node 11: acceptance=0.571
Node 12: acceptance=0.714
Node 13: acceptance=0.750
Node 14: acceptance=0.429
Node 15: acceptance=0.500
Node 16: acceptance=0.400
Node 17: acceptance=0.600
Node 18: acceptance=0.900
Node 19: acceptance=1.000

=== PARALLEL EXECUTION TIME (realistic for distributed system) ===
  COMMUNICATION (max across nodes):
    - Full model transfer: 0.000s (0.0%)
  COMPUTATION (max across nodes):
    - Filtering: 0.023s (63.9%)
    - Aggregation: 0.013s (36.1%)
  TOTALS:
    - Total computation: 0.036s (100.0%)
    - Total communication: 0.000s (0.0%)
    - Total parallel time: 0.036s

=== PER-NODE AVERAGE TIME ===
  - Filtering: 0.014s
  - Aggregation: 0.004s
  - Model transfer: 0.000s
  - Total per node: 0.018s

=== TOTAL COMPUTATIONAL WORK (sum across all nodes) ===
  - Total filtering: 0.284s
  - Total aggregation: 0.080s
  - Total model transfer: 0.000s
  - Grand total: 0.365s
  - Mean acceptance rate: 0.680

BALANCE Algorithm Properties:
  - Model dimension: 2,219,692
  - No compression: Full parameter comparison
  - Theoretical complexity: O(deg(i)×d)
  - Approach: Full parameter filtering + averaging
