Device: cuda
Seed: 987654321
Looking for images in: /home/student.unimelb.edu.au/mrangwala/Projects/Sketchguard/leaf/data/celeba/data/raw/img_align_celeba
Loading 1 LEAF CelebA train files...
LEAF CelebA train: 9343 users (celebrities), 177457 samples
Looking for images in: /home/student.unimelb.edu.au/mrangwala/Projects/Sketchguard/leaf/data/celeba/data/raw/img_align_celeba
Loading 1 LEAF CelebA test files...
LEAF CelebA test: 9343 users (celebrities), 22831 samples
Found 9343 train users, 9343 test users, 9343 common users
User sample counts range: 31 (max) to 4 (min)
Distributed ALL 9343 users across 20 clients
Users per client: 467 (with 3 clients getting +1 user)
Train partition sizes: [8843, 8998, 8728, 9034, 8866, 8946, 8873, 8776, 8816, 8801, 8913, 8656, 9115, 8921, 8699, 8823, 8912, 8766, 9102, 8869]
Test partition sizes: [1140, 1158, 1127, 1158, 1134, 1145, 1145, 1127, 1136, 1128, 1144, 1125, 1152, 1160, 1124, 1145, 1154, 1131, 1157, 1141]
  Client 0: 8843 train samples, 2 unique classes
  Client 1: 8998 train samples, 2 unique classes
  Client 2: 8728 train samples, 2 unique classes
  Client 3: 9034 train samples, 2 unique classes
  Client 4: 8866 train samples, 2 unique classes
  Client 5: 8946 train samples, 2 unique classes
  Client 6: 8873 train samples, 2 unique classes
  Client 7: 8776 train samples, 2 unique classes
  Client 8: 8816 train samples, 2 unique classes
  Client 9: 8801 train samples, 2 unique classes
  Client 10: 8913 train samples, 2 unique classes
  Client 11: 8656 train samples, 2 unique classes
  Client 12: 9115 train samples, 2 unique classes
  Client 13: 8921 train samples, 2 unique classes
  Client 14: 8699 train samples, 2 unique classes
  Client 15: 8823 train samples, 2 unique classes
  Client 16: 8912 train samples, 2 unique classes
  Client 17: 8766 train samples, 2 unique classes
  Client 18: 9102 train samples, 2 unique classes
  Client 19: 8869 train samples, 2 unique classes
Will sample 4500 samples per client per epoch
Graph: erdos, nodes: 20, edges: 99
Degree statistics: avg=9.90, min=7, max=14
Attack: Compromised 6/20 nodes: [5, 12, 13, 14, 17, 18]
Attack type: directed_deviation, lambda: 1.0
Model variant: baseline
Model parameters: 2,219,692
BALANCE algorithm:
Balance Config: BALANCEConfig(gamma=2, kappa=1, alpha=0.5, min_neighbors=1)
  - Model dimension: 2,219,692 parameters
  - Complexity: O(N×d) = O(20×2,219,692)
Initial test acc across nodes: mean=0.4978 ± 0.0208
Round 001: test acc mean=0.6643 ± 0.0516 | min=0.5291 max=0.7236
         : test loss mean=0.6807 ± 0.0038
         : individual accs = ['0.708772', '0.676166', '0.614907', '0.706390', '0.529101', '0.650655', '0.684716', '0.595386', '0.573063', '0.709220', '0.667832', '0.723556', '0.723090', '0.689655', '0.663701', '0.662882', '0.669844', '0.694960', '0.717373', '0.624890']
         : correct/total = [(808, 1140), (783, 1158), (693, 1127), (818, 1158), (600, 1134), (745, 1145), (784, 1145), (671, 1127), (651, 1136), (800, 1128), (764, 1144), (814, 1125), (833, 1152), (800, 1160), (746, 1124), (759, 1145), (773, 1154), (786, 1131), (830, 1157), (713, 1141)]
         : compromised: 0.6899, honest: 0.6533
Round 002: test acc mean=0.6452 ± 0.0551 | min=0.5229 max=0.7196
         : test loss mean=0.6727 ± 0.0096
         : individual accs = ['0.649123', '0.664076', '0.643301', '0.633851', '0.522928', '0.530131', '0.649782', '0.655723', '0.703345', '0.658688', '0.678322', '0.661333', '0.719618', '0.631897', '0.523132', '0.662009', '0.704506', '0.659593', '0.688850', '0.664330']
         : correct/total = [(740, 1140), (769, 1158), (725, 1127), (734, 1158), (593, 1134), (607, 1145), (744, 1145), (739, 1127), (799, 1136), (743, 1128), (776, 1144), (744, 1125), (829, 1152), (733, 1160), (588, 1124), (758, 1145), (813, 1154), (746, 1131), (797, 1157), (758, 1141)]
         : compromised: 0.6255, honest: 0.6537
Round 003: test acc mean=0.6714 ± 0.0437 | min=0.5196 max=0.7244
         : test loss mean=0.6507 ± 0.0193
         : individual accs = ['0.648246', '0.682211', '0.677906', '0.699482', '0.637566', '0.614847', '0.683843', '0.677019', '0.721831', '0.696809', '0.687063', '0.702222', '0.655382', '0.698276', '0.519573', '0.689083', '0.724437', '0.655172', '0.688850', '0.668712']
         : correct/total = [(739, 1140), (790, 1158), (764, 1127), (810, 1158), (723, 1134), (704, 1145), (783, 1145), (763, 1127), (820, 1136), (786, 1128), (786, 1144), (790, 1125), (755, 1152), (810, 1160), (584, 1124), (789, 1145), (836, 1154), (741, 1131), (797, 1157), (763, 1141)]
         : compromised: 0.6387, honest: 0.6855
Round 004: test acc mean=0.7243 ± 0.0244 | min=0.6806 max=0.7596
         : test loss mean=0.5942 ± 0.0258
         : individual accs = ['0.716667', '0.727116', '0.721384', '0.749568', '0.698413', '0.707424', '0.732751', '0.708962', '0.758803', '0.739362', '0.759615', '0.755556', '0.706597', '0.718103', '0.680605', '0.751092', '0.755633', '0.717065', '0.685393', '0.695881']
         : correct/total = [(817, 1140), (842, 1158), (813, 1127), (868, 1158), (792, 1134), (810, 1145), (839, 1145), (799, 1127), (862, 1136), (834, 1128), (869, 1144), (850, 1125), (814, 1152), (833, 1160), (765, 1124), (860, 1145), (872, 1154), (811, 1131), (793, 1157), (794, 1141)]
         : compromised: 0.7025, honest: 0.7336
Round 005: test acc mean=0.7683 ± 0.0229 | min=0.7169 max=0.8120
         : test loss mean=0.5124 ± 0.0272
         : individual accs = ['0.774561', '0.772884', '0.732919', '0.772021', '0.769841', '0.752838', '0.785153', '0.752440', '0.779049', '0.798759', '0.791084', '0.792889', '0.744792', '0.760345', '0.769573', '0.782533', '0.811958', '0.765694', '0.739844', '0.716915']
         : correct/total = [(883, 1140), (895, 1158), (826, 1127), (894, 1158), (873, 1134), (862, 1145), (899, 1145), (848, 1127), (885, 1136), (901, 1128), (905, 1144), (892, 1125), (858, 1152), (882, 1160), (865, 1124), (896, 1145), (937, 1154), (866, 1131), (856, 1157), (818, 1141)]
         : compromised: 0.7555, honest: 0.7738
Round 006: test acc mean=0.8099 ± 0.0183 | min=0.7736 max=0.8418
         : test loss mean=0.4340 ± 0.0224
         : individual accs = ['0.805263', '0.832470', '0.818988', '0.823834', '0.798942', '0.821834', '0.800873', '0.792369', '0.818662', '0.830674', '0.841783', '0.830222', '0.799479', '0.795690', '0.784698', '0.809607', '0.830156', '0.786914', '0.773552', '0.801052']
         : correct/total = [(918, 1140), (964, 1158), (923, 1127), (954, 1158), (906, 1134), (941, 1145), (917, 1145), (893, 1127), (930, 1136), (937, 1128), (963, 1144), (934, 1125), (921, 1152), (923, 1160), (882, 1124), (927, 1145), (958, 1154), (890, 1131), (895, 1157), (914, 1141)]
         : compromised: 0.7937, honest: 0.8168
Round 007: test acc mean=0.8499 ± 0.0157 | min=0.8099 max=0.8715
         : test loss mean=0.3583 ± 0.0176
         : individual accs = ['0.848246', '0.869603', '0.853594', '0.854059', '0.841270', '0.850655', '0.863755', '0.849157', '0.849472', '0.871454', '0.862762', '0.871111', '0.828125', '0.850000', '0.840747', '0.831441', '0.867418', '0.831123', '0.809853', '0.853637']
         : correct/total = [(967, 1140), (1007, 1158), (962, 1127), (989, 1158), (954, 1134), (974, 1145), (989, 1145), (957, 1127), (965, 1136), (983, 1128), (987, 1144), (980, 1125), (954, 1152), (986, 1160), (945, 1124), (952, 1145), (1001, 1154), (940, 1131), (937, 1157), (974, 1141)]
         : compromised: 0.8351, honest: 0.8562
Round 008: test acc mean=0.8688 ± 0.0103 | min=0.8444 max=0.8836
         : test loss mean=0.3153 ± 0.0139
         : individual accs = ['0.863158', '0.883420', '0.870453', '0.867876', '0.858025', '0.879476', '0.866376', '0.873114', '0.866197', '0.877660', '0.873252', '0.883556', '0.862847', '0.874138', '0.881673', '0.860262', '0.875217', '0.850575', '0.844425', '0.865031']
         : correct/total = [(984, 1140), (1023, 1158), (981, 1127), (1005, 1158), (973, 1134), (1007, 1145), (992, 1145), (984, 1127), (984, 1136), (990, 1128), (999, 1144), (994, 1125), (994, 1152), (1014, 1160), (991, 1124), (985, 1145), (1010, 1154), (962, 1131), (977, 1157), (987, 1141)]
         : compromised: 0.8655, honest: 0.8703
Round 009: test acc mean=0.8798 ± 0.0130 | min=0.8462 max=0.8969
         : test loss mean=0.2887 ± 0.0206
         : individual accs = ['0.876316', '0.894646', '0.869565', '0.888601', '0.876543', '0.896070', '0.884716', '0.888199', '0.885563', '0.890071', '0.887238', '0.896889', '0.874132', '0.876724', '0.882562', '0.866376', '0.880416', '0.852343', '0.846154', '0.883436']
         : correct/total = [(999, 1140), (1036, 1158), (980, 1127), (1029, 1158), (994, 1134), (1026, 1145), (1013, 1145), (1001, 1127), (1006, 1136), (1004, 1128), (1015, 1144), (1009, 1125), (1007, 1152), (1017, 1160), (992, 1124), (992, 1145), (1016, 1154), (964, 1131), (979, 1157), (1008, 1141)]
         : compromised: 0.8713, honest: 0.8835
Round 010: test acc mean=0.8894 ± 0.0083 | min=0.8704 max=0.9043
         : test loss mean=0.2711 ± 0.0158
         : individual accs = ['0.892105', '0.892055', '0.884650', '0.891192', '0.888007', '0.896943', '0.888210', '0.896185', '0.895246', '0.904255', '0.888986', '0.894222', '0.885417', '0.891379', '0.899466', '0.876856', '0.889948', '0.871795', '0.870354', '0.890447']
         : correct/total = [(1017, 1140), (1033, 1158), (997, 1127), (1032, 1158), (1007, 1134), (1027, 1145), (1017, 1145), (1010, 1127), (1017, 1136), (1020, 1128), (1017, 1144), (1006, 1125), (1020, 1152), (1034, 1160), (1011, 1124), (1004, 1145), (1027, 1154), (986, 1131), (1007, 1157), (1016, 1141)]
         : compromised: 0.8859, honest: 0.8909

=== FINAL RESULTS ===
Dataset: celeba, Nodes: 20, Graph: erdos, Aggregation: balance
Attack: directed_deviation, 30.0% compromised
Final accuracy - Compromised: 0.8859, Honest: 0.8909
Overall test accuracy: mean=0.8894 ± 0.0083

=== BALANCE SUMMARY ===
Node 0: acceptance=0.667
Node 1: acceptance=0.800
Node 2: acceptance=0.750
Node 3: acceptance=0.714
Node 4: acceptance=0.667
Node 5: acceptance=0.700
Node 6: acceptance=0.583
Node 7: acceptance=0.545
Node 8: acceptance=0.286
Node 9: acceptance=0.909
Node 10: acceptance=0.750
Node 11: acceptance=0.583
Node 12: acceptance=0.750
Node 13: acceptance=0.778
Node 14: acceptance=0.643
Node 15: acceptance=0.556
Node 16: acceptance=0.571
Node 17: acceptance=0.750
Node 18: acceptance=0.750
Node 19: acceptance=0.600

=== PARALLEL EXECUTION TIME (realistic for distributed system) ===
  COMMUNICATION (max across nodes):
    - Full model transfer: 0.000s (0.0%)
  COMPUTATION (max across nodes):
    - Filtering: 0.037s (76.0%)
    - Aggregation: 0.012s (23.9%)
  TOTALS:
    - Total computation: 0.049s (100.0%)
    - Total communication: 0.000s (0.0%)
    - Total parallel time: 0.049s

=== PER-NODE AVERAGE TIME ===
  - Filtering: 0.027s
  - Aggregation: 0.005s
  - Model transfer: 0.000s
  - Total per node: 0.032s

=== TOTAL COMPUTATIONAL WORK (sum across all nodes) ===
  - Total filtering: 0.540s
  - Total aggregation: 0.102s
  - Total model transfer: 0.000s
  - Grand total: 0.642s
  - Mean acceptance rate: 0.668

BALANCE Algorithm Properties:
  - Model dimension: 2,219,692
  - No compression: Full parameter comparison
  - Theoretical complexity: O(deg(i)×d)
  - Approach: Full parameter filtering + averaging
