Device: cuda
Seed: 987654321
Looking for images in: /home/student.unimelb.edu.au/mrangwala/Projects/Sketchguard/leaf/data/celeba/data/raw/img_align_celeba
Loading 1 LEAF CelebA train files...
LEAF CelebA train: 9343 users (celebrities), 177457 samples
Looking for images in: /home/student.unimelb.edu.au/mrangwala/Projects/Sketchguard/leaf/data/celeba/data/raw/img_align_celeba
Loading 1 LEAF CelebA test files...
LEAF CelebA test: 9343 users (celebrities), 22831 samples
Found 9343 train users, 9343 test users, 9343 common users
User sample counts range: 31 (max) to 4 (min)
Distributed ALL 9343 users across 20 clients
Users per client: 467 (with 3 clients getting +1 user)
Train partition sizes: [8843, 8998, 8728, 9034, 8866, 8946, 8873, 8776, 8816, 8801, 8913, 8656, 9115, 8921, 8699, 8823, 8912, 8766, 9102, 8869]
Test partition sizes: [1140, 1158, 1127, 1158, 1134, 1145, 1145, 1127, 1136, 1128, 1144, 1125, 1152, 1160, 1124, 1145, 1154, 1131, 1157, 1141]
  Client 0: 8843 train samples, 2 unique classes
  Client 1: 8998 train samples, 2 unique classes
  Client 2: 8728 train samples, 2 unique classes
  Client 3: 9034 train samples, 2 unique classes
  Client 4: 8866 train samples, 2 unique classes
  Client 5: 8946 train samples, 2 unique classes
  Client 6: 8873 train samples, 2 unique classes
  Client 7: 8776 train samples, 2 unique classes
  Client 8: 8816 train samples, 2 unique classes
  Client 9: 8801 train samples, 2 unique classes
  Client 10: 8913 train samples, 2 unique classes
  Client 11: 8656 train samples, 2 unique classes
  Client 12: 9115 train samples, 2 unique classes
  Client 13: 8921 train samples, 2 unique classes
  Client 14: 8699 train samples, 2 unique classes
  Client 15: 8823 train samples, 2 unique classes
  Client 16: 8912 train samples, 2 unique classes
  Client 17: 8766 train samples, 2 unique classes
  Client 18: 9102 train samples, 2 unique classes
  Client 19: 8869 train samples, 2 unique classes
Will sample 4500 samples per client per epoch
Graph: erdos, nodes: 20, edges: 126
Degree statistics: avg=12.60, min=8, max=16
Attack: Compromised 6/20 nodes: [5, 12, 13, 14, 17, 18]
Attack type: backdoor, lambda: 1.0
Backdoor target label: 0, trigger size: 8
Model variant: baseline
Model parameters: 2,219,692
Initial test acc across nodes: mean=0.4978 ± 0.0208
Backdoor attack: Created poisoned datasets for 6 compromised nodes
Round 001: test acc mean=0.7099 ± 0.0284 | min=0.6615 max=0.7569
         : test loss mean=0.6006 ± 0.0421
         : individual accs = ['0.671930', '0.661485', '0.678793', '0.712435', '0.693122', '0.732751', '0.737991', '0.710736', '0.749120', '0.679078', '0.727273', '0.705778', '0.756944', '0.739655', '0.707295', '0.752838', '0.694107', '0.686118', '0.677615', '0.723926']
         : correct/total = [(766, 1140), (766, 1158), (765, 1127), (825, 1158), (786, 1134), (839, 1145), (845, 1145), (801, 1127), (851, 1136), (766, 1128), (832, 1144), (794, 1125), (872, 1152), (858, 1160), (795, 1124), (862, 1145), (801, 1154), (776, 1131), (784, 1157), (826, 1141)]
         : compromised: 0.7167, honest: 0.7070
Round 002: test acc mean=0.8100 ± 0.0199 | min=0.7705 max=0.8454
         : test loss mean=0.4299 ± 0.0181
         : individual accs = ['0.822807', '0.826425', '0.787933', '0.817789', '0.811287', '0.845415', '0.807860', '0.821650', '0.777289', '0.825355', '0.831294', '0.835556', '0.817708', '0.799138', '0.770463', '0.786900', '0.790295', '0.813439', '0.791703', '0.819457']
         : correct/total = [(938, 1140), (957, 1158), (888, 1127), (947, 1158), (920, 1134), (968, 1145), (925, 1145), (926, 1127), (883, 1136), (931, 1128), (951, 1144), (940, 1125), (942, 1152), (927, 1160), (866, 1124), (901, 1145), (912, 1154), (920, 1131), (916, 1157), (935, 1141)]
         : compromised: 0.8063, honest: 0.8116
Round 003: test acc mean=0.8392 ± 0.0203 | min=0.8034 max=0.8777
         : test loss mean=0.3651 ± 0.0371
         : individual accs = ['0.832456', '0.838515', '0.813665', '0.844560', '0.823633', '0.877729', '0.871616', '0.839397', '0.865317', '0.839539', '0.854021', '0.838222', '0.820312', '0.803448', '0.870107', '0.843668', '0.828423', '0.839965', '0.807260', '0.831727']
         : correct/total = [(949, 1140), (971, 1158), (917, 1127), (978, 1158), (934, 1134), (1005, 1145), (998, 1145), (946, 1127), (983, 1136), (947, 1128), (977, 1144), (943, 1125), (945, 1152), (932, 1160), (978, 1124), (966, 1145), (956, 1154), (950, 1131), (934, 1157), (949, 1141)]
         : compromised: 0.8365, honest: 0.8403
Round 004: test acc mean=0.8737 ± 0.0154 | min=0.8392 max=0.8978
         : test loss mean=0.2965 ± 0.0234
         : individual accs = ['0.886842', '0.852332', '0.872227', '0.873057', '0.878307', '0.884716', '0.875109', '0.897072', '0.853873', '0.875000', '0.891608', '0.897778', '0.866319', '0.866379', '0.887011', '0.851528', '0.878683', '0.864721', '0.839239', '0.882559']
         : correct/total = [(1011, 1140), (987, 1158), (983, 1127), (1011, 1158), (996, 1134), (1013, 1145), (1002, 1145), (1011, 1127), (970, 1136), (987, 1128), (1020, 1144), (1010, 1125), (998, 1152), (1005, 1160), (997, 1124), (975, 1145), (1014, 1154), (978, 1131), (971, 1157), (1007, 1141)]
         : compromised: 0.8681, honest: 0.8761
Round 005: test acc mean=0.8848 ± 0.0085 | min=0.8705 max=0.8986
         : test loss mean=0.2717 ± 0.0130
         : individual accs = ['0.875439', '0.893782', '0.870453', '0.891192', '0.881834', '0.889083', '0.889083', '0.889086', '0.889965', '0.892730', '0.895979', '0.887111', '0.875000', '0.887069', '0.891459', '0.872489', '0.898614', '0.874447', '0.876404', '0.875548']
         : correct/total = [(998, 1140), (1035, 1158), (981, 1127), (1032, 1158), (1000, 1134), (1018, 1145), (1018, 1145), (1002, 1127), (1011, 1136), (1007, 1128), (1025, 1144), (998, 1125), (1008, 1152), (1029, 1160), (1002, 1124), (999, 1145), (1037, 1154), (989, 1131), (1014, 1157), (999, 1141)]
         : compromised: 0.8822, honest: 0.8860
Round 006: test acc mean=0.8854 ± 0.0117 | min=0.8642 max=0.9040
         : test loss mean=0.2740 ± 0.0234
         : individual accs = ['0.892982', '0.892055', '0.864241', '0.879102', '0.892416', '0.898690', '0.880349', '0.887311', '0.882042', '0.872340', '0.902098', '0.904000', '0.894097', '0.873276', '0.890569', '0.865502', '0.885615', '0.888594', '0.867761', '0.895706']
         : correct/total = [(1018, 1140), (1033, 1158), (974, 1127), (1018, 1158), (1012, 1134), (1029, 1145), (1008, 1145), (1000, 1127), (1002, 1136), (984, 1128), (1032, 1144), (1017, 1125), (1030, 1152), (1013, 1160), (1001, 1124), (991, 1145), (1022, 1154), (1005, 1131), (1004, 1157), (1022, 1141)]
         : compromised: 0.8855, honest: 0.8854
Round 007: test acc mean=0.8897 ± 0.0106 | min=0.8704 max=0.9113
         : test loss mean=0.2597 ± 0.0167
         : individual accs = ['0.878070', '0.898964', '0.874002', '0.892919', '0.882716', '0.890830', '0.884716', '0.902396', '0.891725', '0.911348', '0.896853', '0.904889', '0.895833', '0.887069', '0.887011', '0.881223', '0.900347', '0.885942', '0.870354', '0.877301']
         : correct/total = [(1001, 1140), (1041, 1158), (985, 1127), (1034, 1158), (1001, 1134), (1020, 1145), (1013, 1145), (1017, 1127), (1013, 1136), (1028, 1128), (1026, 1144), (1018, 1125), (1032, 1152), (1029, 1160), (997, 1124), (1009, 1145), (1039, 1154), (1002, 1131), (1007, 1157), (1001, 1141)]
         : compromised: 0.8862, honest: 0.8912
Round 008: test acc mean=0.8979 ± 0.0095 | min=0.8780 max=0.9126
         : test loss mean=0.2476 ± 0.0168
         : individual accs = ['0.899123', '0.895509', '0.887311', '0.906736', '0.900353', '0.899563', '0.904803', '0.905945', '0.892606', '0.910461', '0.912587', '0.909333', '0.904514', '0.886207', '0.903025', '0.888210', '0.891681', '0.877984', '0.883319', '0.899211']
         : correct/total = [(1025, 1140), (1037, 1158), (1000, 1127), (1050, 1158), (1021, 1134), (1030, 1145), (1036, 1145), (1021, 1127), (1014, 1136), (1027, 1128), (1044, 1144), (1023, 1125), (1042, 1152), (1028, 1160), (1015, 1124), (1017, 1145), (1029, 1154), (993, 1131), (1022, 1157), (1026, 1141)]
         : compromised: 0.8924, honest: 0.9003
Round 009: test acc mean=0.8958 ± 0.0110 | min=0.8693 max=0.9111
         : test loss mean=0.2486 ± 0.0195
         : individual accs = ['0.869298', '0.897237', '0.886424', '0.911054', '0.901235', '0.909170', '0.890830', '0.904170', '0.903169', '0.903369', '0.903846', '0.911111', '0.901042', '0.889655', '0.896797', '0.886463', '0.898614', '0.875332', '0.888505', '0.889571']
         : correct/total = [(991, 1140), (1039, 1158), (999, 1127), (1055, 1158), (1022, 1134), (1041, 1145), (1020, 1145), (1019, 1127), (1026, 1136), (1019, 1128), (1034, 1144), (1025, 1125), (1038, 1152), (1032, 1160), (1008, 1124), (1015, 1145), (1037, 1154), (990, 1131), (1028, 1157), (1015, 1141)]
         : compromised: 0.8934, honest: 0.8969
Round 010: test acc mean=0.9032 ± 0.0083 | min=0.8868 max=0.9145
         : test loss mean=0.2382 ± 0.0141
         : individual accs = ['0.907895', '0.909326', '0.887311', '0.914508', '0.910935', '0.910044', '0.910044', '0.905945', '0.896127', '0.906028', '0.902972', '0.912000', '0.910590', '0.896552', '0.903025', '0.891703', '0.907279', '0.886826', '0.891962', '0.903593']
         : correct/total = [(1035, 1140), (1053, 1158), (1000, 1127), (1059, 1158), (1033, 1134), (1042, 1145), (1042, 1145), (1021, 1127), (1018, 1136), (1022, 1128), (1033, 1144), (1026, 1125), (1049, 1152), (1040, 1160), (1015, 1124), (1021, 1145), (1047, 1154), (1003, 1131), (1032, 1157), (1031, 1141)]
         : compromised: 0.8998, honest: 0.9047

=== FINAL RESULTS ===
Dataset: celeba, Nodes: 20, Graph: erdos, Aggregation: krum
Attack: backdoor, 30.0% compromised
Final accuracy - Compromised: 0.8998, Honest: 0.9047
Overall test accuracy: mean=0.9032 ± 0.0083

=== BACKDOOR ATTACK SUCCESS RATE (ASR) ===
Target label: 0
Trigger size: 8x8
Overall ASR: 0.5432 ± 0.0169
Honest nodes ASR: 0.5484 ± 0.0153
Compromised nodes ASR: 0.5312 ± 0.0143
Note: Higher ASR indicates more successful backdoor attack
