Device: cuda
Seed: 987654321
Looking for images in: /home/student.unimelb.edu.au/mrangwala/Projects/Sketchguard/leaf/data/celeba/data/raw/img_align_celeba
Loading 1 LEAF CelebA train files...
LEAF CelebA train: 9343 users (celebrities), 177457 samples
Looking for images in: /home/student.unimelb.edu.au/mrangwala/Projects/Sketchguard/leaf/data/celeba/data/raw/img_align_celeba
Loading 1 LEAF CelebA test files...
LEAF CelebA test: 9343 users (celebrities), 22831 samples
Found 9343 train users, 9343 test users, 9343 common users
User sample counts range: 31 (max) to 4 (min)
Distributed ALL 9343 users across 20 clients
Users per client: 467 (with 3 clients getting +1 user)
Train partition sizes: [8843, 8998, 8728, 9034, 8866, 8946, 8873, 8776, 8816, 8801, 8913, 8656, 9115, 8921, 8699, 8823, 8912, 8766, 9102, 8869]
Test partition sizes: [1140, 1158, 1127, 1158, 1134, 1145, 1145, 1127, 1136, 1128, 1144, 1125, 1152, 1160, 1124, 1145, 1154, 1131, 1157, 1141]
  Client 0: 8843 train samples, 2 unique classes
  Client 1: 8998 train samples, 2 unique classes
  Client 2: 8728 train samples, 2 unique classes
  Client 3: 9034 train samples, 2 unique classes
  Client 4: 8866 train samples, 2 unique classes
  Client 5: 8946 train samples, 2 unique classes
  Client 6: 8873 train samples, 2 unique classes
  Client 7: 8776 train samples, 2 unique classes
  Client 8: 8816 train samples, 2 unique classes
  Client 9: 8801 train samples, 2 unique classes
  Client 10: 8913 train samples, 2 unique classes
  Client 11: 8656 train samples, 2 unique classes
  Client 12: 9115 train samples, 2 unique classes
  Client 13: 8921 train samples, 2 unique classes
  Client 14: 8699 train samples, 2 unique classes
  Client 15: 8823 train samples, 2 unique classes
  Client 16: 8912 train samples, 2 unique classes
  Client 17: 8766 train samples, 2 unique classes
  Client 18: 9102 train samples, 2 unique classes
  Client 19: 8869 train samples, 2 unique classes
Will sample 4500 samples per client per epoch
Graph: fully, nodes: 20, edges: 190
Degree statistics: avg=19.00, min=19, max=19
Attack: Compromised 8/20 nodes: [1, 5, 11, 12, 13, 14, 17, 18]
Attack type: backdoor, lambda: 1.0
Backdoor target label: 0, trigger size: 8
Model variant: baseline
Model parameters: 2,219,692
BALANCE algorithm:
Balance Config: BALANCEConfig(gamma=2, kappa=1, alpha=0.5, min_neighbors=1)
  - Model dimension: 2,219,692 parameters
  - Complexity: O(N×d) = O(20×2,219,692)
Initial test acc across nodes: mean=0.4978 ± 0.0208
Backdoor attack: Created poisoned datasets for 8 compromised nodes
Round 001: test acc mean=0.6171 ± 0.0880 | min=0.5069 max=0.7240
         : test loss mean=1600.5818 ± 1994.6460
         : individual accs = ['0.702632', '0.508636', '0.662822', '0.671848', '0.587302', '0.514410', '0.711790', '0.655723', '0.714789', '0.712766', '0.683566', '0.520889', '0.522569', '0.506897', '0.517794', '0.724017', '0.716638', '0.508400', '0.522040', '0.675723']
         : correct/total = [(801, 1140), (589, 1158), (747, 1127), (778, 1158), (666, 1134), (589, 1145), (815, 1145), (739, 1127), (812, 1136), (804, 1128), (782, 1144), (586, 1125), (602, 1152), (588, 1160), (582, 1124), (829, 1145), (827, 1154), (575, 1131), (604, 1157), (771, 1141)]
         : compromised: 0.5152, honest: 0.6850
Round 002: test acc mean=0.5981 ± 0.0826 | min=0.4774 max=0.6908
         : test loss mean=8354855.4511 ± 14250674.2833
         : individual accs = ['0.645614', '0.508636', '0.683230', '0.667530', '0.522046', '0.485590', '0.673362', '0.671695', '0.648768', '0.648050', '0.680944', '0.504889', '0.477431', '0.533621', '0.517794', '0.690830', '0.685442', '0.491600', '0.539326', '0.686240']
         : correct/total = [(736, 1140), (589, 1158), (770, 1127), (773, 1158), (592, 1134), (556, 1145), (771, 1145), (757, 1127), (737, 1136), (731, 1128), (779, 1144), (568, 1125), (550, 1152), (619, 1160), (582, 1124), (791, 1145), (791, 1154), (556, 1131), (624, 1157), (783, 1141)]
         : compromised: 0.5074, honest: 0.6586
Round 003: test acc mean=0.5977 ± 0.0805 | min=0.4822 max=0.7088
         : test loss mean=nan ± nan
         : individual accs = ['0.617544', '0.491364', '0.675244', '0.683938', '0.574956', '0.514410', '0.638428', '0.651287', '0.705986', '0.679078', '0.652972', '0.498667', '0.522569', '0.506897', '0.482206', '0.649782', '0.708839', '0.508400', '0.522040', '0.669588']
         : correct/total = [(704, 1140), (569, 1158), (761, 1127), (792, 1158), (652, 1134), (589, 1145), (731, 1145), (734, 1127), (802, 1136), (766, 1128), (747, 1144), (561, 1125), (602, 1152), (588, 1160), (542, 1124), (744, 1145), (818, 1154), (575, 1131), (604, 1157), (764, 1141)]
         : compromised: 0.5058, honest: 0.6590
Round 004: test acc mean=0.6270 ± 0.0949 | min=0.4987 max=0.7331
         : test loss mean=nan ± nan
         : individual accs = ['0.698246', '0.508636', '0.709849', '0.713299', '0.686067', '0.514410', '0.717904', '0.678793', '0.717430', '0.706560', '0.726399', '0.498667', '0.522569', '0.506897', '0.517794', '0.681223', '0.733102', '0.508400', '0.522040', '0.672217']
         : correct/total = [(796, 1140), (589, 1158), (800, 1127), (826, 1158), (778, 1134), (589, 1145), (822, 1145), (765, 1127), (815, 1136), (797, 1128), (831, 1144), (561, 1125), (602, 1152), (588, 1160), (582, 1124), (780, 1145), (846, 1154), (575, 1131), (604, 1157), (767, 1141)]
         : compromised: 0.5124, honest: 0.7034
Round 005: test acc mean=0.6638 ± 0.1242 | min=0.4987 max=0.7828
         : test loss mean=nan ± nan
         : individual accs = ['0.759649', '0.508636', '0.735581', '0.759067', '0.759259', '0.514410', '0.782533', '0.750665', '0.767606', '0.782801', '0.777098', '0.498667', '0.522569', '0.506897', '0.517794', '0.759825', '0.782496', '0.508400', '0.522040', '0.760736']
         : correct/total = [(866, 1140), (589, 1158), (829, 1127), (879, 1158), (861, 1134), (589, 1145), (896, 1145), (846, 1127), (872, 1136), (883, 1128), (889, 1144), (561, 1125), (602, 1152), (588, 1160), (582, 1124), (870, 1145), (903, 1154), (575, 1131), (604, 1157), (868, 1141)]
         : compromised: 0.5124, honest: 0.7648
Round 006: test acc mean=0.6870 ± 0.1431 | min=0.4987 max=0.8357
         : test loss mean=nan ± nan
         : individual accs = ['0.790351', '0.508636', '0.817214', '0.800518', '0.792769', '0.514410', '0.794760', '0.793256', '0.800176', '0.827128', '0.835664', '0.498667', '0.522569', '0.506897', '0.517794', '0.793886', '0.785095', '0.508400', '0.522040', '0.809816']
         : correct/total = [(901, 1140), (589, 1158), (921, 1127), (927, 1158), (899, 1134), (589, 1145), (910, 1145), (894, 1127), (909, 1136), (933, 1128), (956, 1144), (561, 1125), (602, 1152), (588, 1160), (582, 1124), (909, 1145), (906, 1154), (575, 1131), (604, 1157), (924, 1141)]
         : compromised: 0.5124, honest: 0.8034
Round 007: test acc mean=0.7126 ± 0.1637 | min=0.4987 max=0.8644
         : test loss mean=nan ± nan
         : individual accs = ['0.842105', '0.508636', '0.840284', '0.839378', '0.837743', '0.514410', '0.852402', '0.834960', '0.853873', '0.864362', '0.859266', '0.498667', '0.522569', '0.506897', '0.517794', '0.822707', '0.844887', '0.508400', '0.522040', '0.859772']
         : correct/total = [(960, 1140), (589, 1158), (947, 1127), (972, 1158), (950, 1134), (589, 1145), (976, 1145), (941, 1127), (970, 1136), (975, 1128), (983, 1144), (561, 1125), (602, 1152), (588, 1160), (582, 1124), (942, 1145), (975, 1154), (575, 1131), (604, 1157), (981, 1141)]
         : compromised: 0.5124, honest: 0.8460
Round 008: test acc mean=0.7224 ± 0.1716 | min=0.4987 max=0.8715
         : test loss mean=nan ± nan
         : individual accs = ['0.857895', '0.508636', '0.866016', '0.858377', '0.850088', '0.514410', '0.864629', '0.867791', '0.859155', '0.871454', '0.869755', '0.498667', '0.522569', '0.506897', '0.517794', '0.848908', '0.870017', '0.508400', '0.522040', '0.865031']
         : correct/total = [(978, 1140), (589, 1158), (976, 1127), (994, 1158), (964, 1134), (589, 1145), (990, 1145), (978, 1127), (976, 1136), (983, 1128), (995, 1144), (561, 1125), (602, 1152), (588, 1160), (582, 1124), (972, 1145), (1004, 1154), (575, 1131), (604, 1157), (987, 1141)]
         : compromised: 0.5124, honest: 0.8624
Round 009: test acc mean=0.7321 ± 0.1796 | min=0.4987 max=0.8916
         : test loss mean=nan ± nan
         : individual accs = ['0.875439', '0.508636', '0.872227', '0.887737', '0.868607', '0.514410', '0.888210', '0.881988', '0.875000', '0.889184', '0.891608', '0.498667', '0.522569', '0.506897', '0.517794', '0.855895', '0.876950', '0.508400', '0.522040', '0.879930']
         : correct/total = [(998, 1140), (589, 1158), (983, 1127), (1028, 1158), (985, 1134), (589, 1145), (1017, 1145), (994, 1127), (994, 1136), (1003, 1128), (1020, 1144), (561, 1125), (602, 1152), (588, 1160), (582, 1124), (980, 1145), (1012, 1154), (575, 1131), (604, 1157), (1004, 1141)]
         : compromised: 0.5124, honest: 0.8786
Round 010: test acc mean=0.7371 ± 0.1836 | min=0.4987 max=0.8981
         : test loss mean=nan ± nan
         : individual accs = ['0.881579', '0.508636', '0.880213', '0.898100', '0.880952', '0.514410', '0.889956', '0.890861', '0.889965', '0.896277', '0.892483', '0.498667', '0.522569', '0.506897', '0.517794', '0.869869', '0.885615', '0.508400', '0.522040', '0.886065']
         : correct/total = [(1005, 1140), (589, 1158), (992, 1127), (1040, 1158), (999, 1134), (589, 1145), (1019, 1145), (1004, 1127), (1011, 1136), (1011, 1128), (1021, 1144), (561, 1125), (602, 1152), (588, 1160), (582, 1124), (996, 1145), (1022, 1154), (575, 1131), (604, 1157), (1011, 1141)]
         : compromised: 0.5124, honest: 0.8868

=== FINAL RESULTS ===
Dataset: celeba, Nodes: 20, Graph: fully, Aggregation: balance
Attack: backdoor, 40.0% compromised
Final accuracy - Compromised: 0.5124, Honest: 0.8868
Overall test accuracy: mean=0.7371 ± 0.1836

=== BACKDOOR ATTACK SUCCESS RATE (ASR) ===
Target label: 0
Trigger size: 8x8
Overall ASR: 0.7296 ± 0.2210
Honest nodes ASR: 0.5493 ± 0.0119
Compromised nodes ASR: 1.0000 ± 0.0000
Note: Higher ASR indicates more successful backdoor attack

=== BALANCE SUMMARY ===
Node 0: acceptance=0.579
Node 1: acceptance=0.263
Node 2: acceptance=0.579
Node 3: acceptance=0.579
Node 4: acceptance=0.579
Node 5: acceptance=0.163
Node 6: acceptance=0.579
Node 7: acceptance=0.579
Node 8: acceptance=0.579
Node 9: acceptance=0.579
Node 10: acceptance=0.579
Node 11: acceptance=0.163
Node 12: acceptance=0.163
Node 13: acceptance=0.163
Node 14: acceptance=0.263
Node 15: acceptance=0.579
Node 16: acceptance=0.579
Node 17: acceptance=0.163
Node 18: acceptance=0.263
Node 19: acceptance=0.579

=== PARALLEL EXECUTION TIME (realistic for distributed system) ===
  COMMUNICATION (max across nodes):
    - Full model transfer: 0.000s (0.0%)
  COMPUTATION (max across nodes):
    - Filtering: 0.054s (80.5%)
    - Aggregation: 0.013s (19.5%)
  TOTALS:
    - Total computation: 0.067s (100.0%)
    - Total communication: 0.000s (0.0%)
    - Total parallel time: 0.067s

=== PER-NODE AVERAGE TIME ===
  - Filtering: 0.050s
  - Aggregation: 0.006s
  - Model transfer: 0.000s
  - Total per node: 0.056s

=== TOTAL COMPUTATIONAL WORK (sum across all nodes) ===
  - Total filtering: 0.994s
  - Total aggregation: 0.117s
  - Total model transfer: 0.000s
  - Grand total: 1.111s
  - Mean acceptance rate: 0.428

BALANCE Algorithm Properties:
  - Model dimension: 2,219,692
  - No compression: Full parameter comparison
  - Theoretical complexity: O(deg(i)×d)
  - Approach: Full parameter filtering + averaging
