Device: cuda
Seed: 987654321
Looking for images in: /home/student.unimelb.edu.au/mrangwala/Projects/Sketchguard/leaf/data/celeba/data/raw/img_align_celeba
Loading 1 LEAF CelebA train files...
LEAF CelebA train: 9343 users (celebrities), 177457 samples
Looking for images in: /home/student.unimelb.edu.au/mrangwala/Projects/Sketchguard/leaf/data/celeba/data/raw/img_align_celeba
Loading 1 LEAF CelebA test files...
LEAF CelebA test: 9343 users (celebrities), 22831 samples
Found 9343 train users, 9343 test users, 9343 common users
User sample counts range: 31 (max) to 4 (min)
Distributed ALL 9343 users across 20 clients
Users per client: 467 (with 3 clients getting +1 user)
Train partition sizes: [8843, 8998, 8728, 9034, 8866, 8946, 8873, 8776, 8816, 8801, 8913, 8656, 9115, 8921, 8699, 8823, 8912, 8766, 9102, 8869]
Test partition sizes: [1140, 1158, 1127, 1158, 1134, 1145, 1145, 1127, 1136, 1128, 1144, 1125, 1152, 1160, 1124, 1145, 1154, 1131, 1157, 1141]
  Client 0: 8843 train samples, 2 unique classes
  Client 1: 8998 train samples, 2 unique classes
  Client 2: 8728 train samples, 2 unique classes
  Client 3: 9034 train samples, 2 unique classes
  Client 4: 8866 train samples, 2 unique classes
  Client 5: 8946 train samples, 2 unique classes
  Client 6: 8873 train samples, 2 unique classes
  Client 7: 8776 train samples, 2 unique classes
  Client 8: 8816 train samples, 2 unique classes
  Client 9: 8801 train samples, 2 unique classes
  Client 10: 8913 train samples, 2 unique classes
  Client 11: 8656 train samples, 2 unique classes
  Client 12: 9115 train samples, 2 unique classes
  Client 13: 8921 train samples, 2 unique classes
  Client 14: 8699 train samples, 2 unique classes
  Client 15: 8823 train samples, 2 unique classes
  Client 16: 8912 train samples, 2 unique classes
  Client 17: 8766 train samples, 2 unique classes
  Client 18: 9102 train samples, 2 unique classes
  Client 19: 8869 train samples, 2 unique classes
Will sample 4500 samples per client per epoch
Graph: fully, nodes: 20, edges: 190
Degree statistics: avg=19.00, min=19, max=19
Attack: Compromised 6/20 nodes: [5, 12, 13, 14, 17, 18]
Attack type: backdoor, lambda: 1.0
Backdoor target label: 0, trigger size: 8
Model variant: baseline
Model parameters: 2,219,692
Initial test acc across nodes: mean=0.4978 ± 0.0208
Backdoor attack: Created poisoned datasets for 6 compromised nodes
Round 001: test acc mean=0.5052 ± 0.0205 | min=0.4794 max=0.5537
         : test loss mean=284.9291 ± 154.9606
         : individual accs = ['0.490351', '0.491364', '0.493345', '0.484456', '0.514109', '0.487336', '0.535371', '0.535049', '0.500880', '0.490248', '0.480769', '0.511111', '0.491319', '0.511207', '0.519573', '0.517904', '0.553726', '0.489832', '0.527226', '0.479404']
         : correct/total = [(559, 1140), (569, 1158), (556, 1127), (561, 1158), (583, 1134), (558, 1145), (613, 1145), (603, 1127), (569, 1136), (553, 1128), (550, 1144), (575, 1125), (566, 1152), (593, 1160), (584, 1124), (593, 1145), (639, 1154), (554, 1131), (610, 1157), (547, 1141)]
         : compromised: 0.5044, honest: 0.5056
Round 002: test acc mean=0.4836 ± 0.0150 | min=0.4375 max=0.5089
         : test loss mean=248571.4386 ± 8239.7511
         : individual accs = ['0.471053', '0.491364', '0.506655', '0.471503', '0.477954', '0.485590', '0.478603', '0.496007', '0.437500', '0.508865', '0.474650', '0.501333', '0.477431', '0.493103', '0.482206', '0.482969', '0.484402', '0.491600', '0.477960', '0.482033']
         : correct/total = [(537, 1140), (569, 1158), (571, 1127), (546, 1158), (542, 1134), (556, 1145), (548, 1145), (559, 1127), (497, 1136), (574, 1128), (543, 1144), (564, 1125), (550, 1152), (572, 1160), (542, 1124), (553, 1145), (559, 1154), (556, 1131), (553, 1157), (550, 1141)]
         : compromised: 0.4846, honest: 0.4832
Round 003: test acc mean=0.5164 ± 0.0150 | min=0.4911 max=0.5625
         : test loss mean=5154.6524 ± 189.5507
         : individual accs = ['0.528947', '0.508636', '0.493345', '0.528497', '0.522046', '0.514410', '0.521397', '0.503993', '0.562500', '0.491135', '0.525350', '0.498667', '0.522569', '0.506897', '0.517794', '0.517031', '0.515598', '0.508400', '0.522040', '0.517967']
         : correct/total = [(603, 1140), (589, 1158), (556, 1127), (612, 1158), (592, 1134), (589, 1145), (597, 1145), (568, 1127), (639, 1136), (554, 1128), (601, 1144), (561, 1125), (602, 1152), (588, 1160), (582, 1124), (592, 1145), (595, 1154), (575, 1131), (604, 1157), (591, 1141)]
         : compromised: 0.5154, honest: 0.5168
Round 004: test acc mean=0.5164 ± 0.0150 | min=0.4911 max=0.5625
         : test loss mean=3.0125 ± 0.0959
         : individual accs = ['0.528947', '0.508636', '0.493345', '0.528497', '0.522046', '0.514410', '0.521397', '0.503993', '0.562500', '0.491135', '0.525350', '0.498667', '0.522569', '0.506897', '0.517794', '0.517031', '0.515598', '0.508400', '0.522040', '0.517967']
         : correct/total = [(603, 1140), (589, 1158), (556, 1127), (612, 1158), (592, 1134), (589, 1145), (597, 1145), (568, 1127), (639, 1136), (554, 1128), (601, 1144), (561, 1125), (602, 1152), (588, 1160), (582, 1124), (592, 1145), (595, 1154), (575, 1131), (604, 1157), (591, 1141)]
         : compromised: 0.5154, honest: 0.5168
Round 005: test acc mean=0.4836 ± 0.0150 | min=0.4375 max=0.5089
         : test loss mean=0.7721 ± 0.0111
         : individual accs = ['0.471053', '0.491364', '0.506655', '0.471503', '0.477954', '0.485590', '0.478603', '0.496007', '0.437500', '0.508865', '0.474650', '0.501333', '0.477431', '0.493103', '0.482206', '0.482969', '0.484402', '0.491600', '0.477960', '0.482033']
         : correct/total = [(537, 1140), (569, 1158), (571, 1127), (546, 1158), (542, 1134), (556, 1145), (548, 1145), (559, 1127), (497, 1136), (574, 1128), (543, 1144), (564, 1125), (550, 1152), (572, 1160), (542, 1124), (553, 1145), (559, 1154), (556, 1131), (553, 1157), (550, 1141)]
         : compromised: 0.4846, honest: 0.4832
Round 006: test acc mean=0.4836 ± 0.0150 | min=0.4375 max=0.5089
         : test loss mean=0.7867 ± 0.0122
         : individual accs = ['0.471053', '0.491364', '0.506655', '0.471503', '0.477954', '0.485590', '0.478603', '0.496007', '0.437500', '0.508865', '0.474650', '0.501333', '0.477431', '0.493103', '0.482206', '0.482969', '0.484402', '0.491600', '0.477960', '0.482033']
         : correct/total = [(537, 1140), (569, 1158), (571, 1127), (546, 1158), (542, 1134), (556, 1145), (548, 1145), (559, 1127), (497, 1136), (574, 1128), (543, 1144), (564, 1125), (550, 1152), (572, 1160), (542, 1124), (553, 1145), (559, 1154), (556, 1131), (553, 1157), (550, 1141)]
         : compromised: 0.4846, honest: 0.4832
Round 007: test acc mean=0.4836 ± 0.0150 | min=0.4375 max=0.5089
         : test loss mean=0.7929 ± 0.0126
         : individual accs = ['0.471053', '0.491364', '0.506655', '0.471503', '0.477954', '0.485590', '0.478603', '0.496007', '0.437500', '0.508865', '0.474650', '0.501333', '0.477431', '0.493103', '0.482206', '0.482969', '0.484402', '0.491600', '0.477960', '0.482033']
         : correct/total = [(537, 1140), (569, 1158), (571, 1127), (546, 1158), (542, 1134), (556, 1145), (548, 1145), (559, 1127), (497, 1136), (574, 1128), (543, 1144), (564, 1125), (550, 1152), (572, 1160), (542, 1124), (553, 1145), (559, 1154), (556, 1131), (553, 1157), (550, 1141)]
         : compromised: 0.4846, honest: 0.4832
Round 008: test acc mean=0.4836 ± 0.0150 | min=0.4375 max=0.5089
         : test loss mean=0.7939 ± 0.0126
         : individual accs = ['0.471053', '0.491364', '0.506655', '0.471503', '0.477954', '0.485590', '0.478603', '0.496007', '0.437500', '0.508865', '0.474650', '0.501333', '0.477431', '0.493103', '0.482206', '0.482969', '0.484402', '0.491600', '0.477960', '0.482033']
         : correct/total = [(537, 1140), (569, 1158), (571, 1127), (546, 1158), (542, 1134), (556, 1145), (548, 1145), (559, 1127), (497, 1136), (574, 1128), (543, 1144), (564, 1125), (550, 1152), (572, 1160), (542, 1124), (553, 1145), (559, 1154), (556, 1131), (553, 1157), (550, 1141)]
         : compromised: 0.4846, honest: 0.4832
Round 009: test acc mean=0.4836 ± 0.0150 | min=0.4375 max=0.5089
         : test loss mean=0.7948 ± 0.0127
         : individual accs = ['0.471053', '0.491364', '0.506655', '0.471503', '0.477954', '0.485590', '0.478603', '0.496007', '0.437500', '0.508865', '0.474650', '0.501333', '0.477431', '0.493103', '0.482206', '0.482969', '0.484402', '0.491600', '0.477960', '0.482033']
         : correct/total = [(537, 1140), (569, 1158), (571, 1127), (546, 1158), (542, 1134), (556, 1145), (548, 1145), (559, 1127), (497, 1136), (574, 1128), (543, 1144), (564, 1125), (550, 1152), (572, 1160), (542, 1124), (553, 1145), (559, 1154), (556, 1131), (553, 1157), (550, 1141)]
         : compromised: 0.4846, honest: 0.4832
Round 010: test acc mean=0.4836 ± 0.0150 | min=0.4375 max=0.5089
         : test loss mean=0.7956 ± 0.0128
         : individual accs = ['0.471053', '0.491364', '0.506655', '0.471503', '0.477954', '0.485590', '0.478603', '0.496007', '0.437500', '0.508865', '0.474650', '0.501333', '0.477431', '0.493103', '0.482206', '0.482969', '0.484402', '0.491600', '0.477960', '0.482033']
         : correct/total = [(537, 1140), (569, 1158), (571, 1127), (546, 1158), (542, 1134), (556, 1145), (548, 1145), (559, 1127), (497, 1136), (574, 1128), (543, 1144), (564, 1125), (550, 1152), (572, 1160), (542, 1124), (553, 1145), (559, 1154), (556, 1131), (553, 1157), (550, 1141)]
         : compromised: 0.4846, honest: 0.4832

=== FINAL RESULTS ===
Dataset: celeba, Nodes: 20, Graph: fully, Aggregation: d-fedavg
Attack: backdoor, 30.0% compromised
Final accuracy - Compromised: 0.4846, Honest: 0.4832
Overall test accuracy: mean=0.4836 ± 0.0150

=== BACKDOOR ATTACK SUCCESS RATE (ASR) ===
Target label: 0
Trigger size: 8x8
Overall ASR: 0.0000 ± 0.0000
Honest nodes ASR: 0.0000 ± 0.0000
Compromised nodes ASR: 0.0000 ± 0.0000
Note: Higher ASR indicates more successful backdoor attack
