Device: cuda
Seed: 987654321
Looking for images in: /home/student.unimelb.edu.au/mrangwala/Projects/Sketchguard/leaf/data/celeba/data/raw/img_align_celeba
Loading 1 LEAF CelebA train files...
LEAF CelebA train: 9343 users (celebrities), 177457 samples
Looking for images in: /home/student.unimelb.edu.au/mrangwala/Projects/Sketchguard/leaf/data/celeba/data/raw/img_align_celeba
Loading 1 LEAF CelebA test files...
LEAF CelebA test: 9343 users (celebrities), 22831 samples
Found 9343 train users, 9343 test users, 9343 common users
User sample counts range: 31 (max) to 4 (min)
Distributed ALL 9343 users across 20 clients
Users per client: 467 (with 3 clients getting +1 user)
Train partition sizes: [8843, 8998, 8728, 9034, 8866, 8946, 8873, 8776, 8816, 8801, 8913, 8656, 9115, 8921, 8699, 8823, 8912, 8766, 9102, 8869]
Test partition sizes: [1140, 1158, 1127, 1158, 1134, 1145, 1145, 1127, 1136, 1128, 1144, 1125, 1152, 1160, 1124, 1145, 1154, 1131, 1157, 1141]
  Client 0: 8843 train samples, 2 unique classes
  Client 1: 8998 train samples, 2 unique classes
  Client 2: 8728 train samples, 2 unique classes
  Client 3: 9034 train samples, 2 unique classes
  Client 4: 8866 train samples, 2 unique classes
  Client 5: 8946 train samples, 2 unique classes
  Client 6: 8873 train samples, 2 unique classes
  Client 7: 8776 train samples, 2 unique classes
  Client 8: 8816 train samples, 2 unique classes
  Client 9: 8801 train samples, 2 unique classes
  Client 10: 8913 train samples, 2 unique classes
  Client 11: 8656 train samples, 2 unique classes
  Client 12: 9115 train samples, 2 unique classes
  Client 13: 8921 train samples, 2 unique classes
  Client 14: 8699 train samples, 2 unique classes
  Client 15: 8823 train samples, 2 unique classes
  Client 16: 8912 train samples, 2 unique classes
  Client 17: 8766 train samples, 2 unique classes
  Client 18: 9102 train samples, 2 unique classes
  Client 19: 8869 train samples, 2 unique classes
Will sample 4500 samples per client per epoch
Graph: fully, nodes: 20, edges: 190
Degree statistics: avg=19.00, min=19, max=19
Attack: Compromised 12/20 nodes: [1, 2, 3, 5, 8, 11, 12, 13, 14, 15, 17, 18]
Attack type: backdoor, lambda: 1.0
Backdoor target label: 0, trigger size: 8
Model variant: baseline
Model parameters: 2,219,692
BALANCE algorithm:
Balance Config: BALANCEConfig(gamma=2, kappa=1, alpha=0.5, min_neighbors=1)
  - Model dimension: 2,219,692 parameters
  - Complexity: O(N×d) = O(20×2,219,692)
Initial test acc across nodes: mean=0.4978 ± 0.0208
Backdoor attack: Created poisoned datasets for 12 compromised nodes
Round 001: test acc mean=0.5806 ± 0.0790 | min=0.4942 max=0.7140
         : test loss mean=2327.9561 ± 1957.7799
         : individual accs = ['0.686842', '0.508636', '0.494232', '0.534542', '0.608466', '0.514410', '0.694323', '0.648625', '0.562500', '0.704787', '0.683566', '0.520889', '0.522569', '0.506897', '0.517794', '0.521397', '0.714038', '0.508400', '0.522040', '0.638037']
         : correct/total = [(783, 1140), (589, 1158), (557, 1127), (619, 1158), (690, 1134), (589, 1145), (795, 1145), (731, 1127), (639, 1136), (795, 1128), (782, 1144), (586, 1125), (602, 1152), (588, 1160), (582, 1124), (597, 1145), (824, 1154), (575, 1131), (604, 1157), (728, 1141)]
         : compromised: 0.5195, honest: 0.6723
Round 002: test acc mean=0.5514 ± 0.0826 | min=0.4375 max=0.6932
         : test loss mean=179087968.0783 ± 223059195.4444
         : individual accs = ['0.630702', '0.492228', '0.506655', '0.528497', '0.532628', '0.485590', '0.633188', '0.653949', '0.437500', '0.654255', '0.676573', '0.498667', '0.477431', '0.493103', '0.482206', '0.505677', '0.693241', '0.491600', '0.477960', '0.675723']
         : correct/total = [(719, 1140), (570, 1158), (571, 1127), (612, 1158), (604, 1134), (556, 1145), (725, 1145), (737, 1127), (497, 1136), (738, 1128), (774, 1144), (561, 1125), (550, 1152), (572, 1160), (542, 1124), (579, 1145), (800, 1154), (556, 1131), (553, 1157), (771, 1141)]
         : compromised: 0.4898, honest: 0.6438
Round 003: test acc mean=0.5813 ± 0.0883 | min=0.4774 max=0.7158
         : test loss mean=nan ± nan
         : individual accs = ['0.652632', '0.508636', '0.493345', '0.528497', '0.641093', '0.514410', '0.698690', '0.679681', '0.562500', '0.706560', '0.691434', '0.498667', '0.477431', '0.506897', '0.517794', '0.517031', '0.715771', '0.491600', '0.522040', '0.702016']
         : correct/total = [(744, 1140), (589, 1158), (556, 1127), (612, 1158), (727, 1134), (589, 1145), (800, 1145), (766, 1127), (639, 1136), (797, 1128), (791, 1144), (561, 1125), (550, 1152), (588, 1160), (582, 1124), (592, 1145), (826, 1154), (556, 1131), (604, 1157), (801, 1141)]
         : compromised: 0.5116, honest: 0.6860
Round 004: test acc mean=0.6095 ± 0.1145 | min=0.4933 max=0.7634
         : test loss mean=nan ± nan
         : individual accs = ['0.746491', '0.508636', '0.493345', '0.528497', '0.732804', '0.514410', '0.750218', '0.736469', '0.562500', '0.750000', '0.750874', '0.498667', '0.522569', '0.506897', '0.517794', '0.517031', '0.758232', '0.508400', '0.522040', '0.763365']
         : correct/total = [(851, 1140), (589, 1158), (556, 1127), (612, 1158), (831, 1134), (589, 1145), (859, 1145), (830, 1127), (639, 1136), (846, 1128), (859, 1144), (561, 1125), (602, 1152), (588, 1160), (582, 1124), (592, 1145), (875, 1154), (575, 1131), (604, 1157), (871, 1141)]
         : compromised: 0.5167, honest: 0.7486
Round 005: test acc mean=0.6321 ± 0.1423 | min=0.4933 max=0.8351
         : test loss mean=nan ± nan
         : individual accs = ['0.783333', '0.508636', '0.493345', '0.528497', '0.795414', '0.514410', '0.807860', '0.787933', '0.562500', '0.835106', '0.810315', '0.498667', '0.522569', '0.506897', '0.517794', '0.517031', '0.824090', '0.508400', '0.522040', '0.797546']
         : correct/total = [(893, 1140), (589, 1158), (556, 1127), (612, 1158), (902, 1134), (589, 1145), (925, 1145), (888, 1127), (639, 1136), (942, 1128), (927, 1144), (561, 1125), (602, 1152), (588, 1160), (582, 1124), (592, 1145), (951, 1154), (575, 1131), (604, 1157), (910, 1141)]
         : compromised: 0.5167, honest: 0.8052
Round 006: test acc mean=0.6456 ± 0.1587 | min=0.4933 max=0.8608
         : test loss mean=nan ± nan
         : individual accs = ['0.843860', '0.508636', '0.493345', '0.528497', '0.813051', '0.514410', '0.827948', '0.823425', '0.562500', '0.860816', '0.854021', '0.498667', '0.522569', '0.506897', '0.517794', '0.517031', '0.831023', '0.508400', '0.522040', '0.857143']
         : correct/total = [(962, 1140), (589, 1158), (556, 1127), (612, 1158), (922, 1134), (589, 1145), (948, 1145), (928, 1127), (639, 1136), (971, 1128), (977, 1144), (561, 1125), (602, 1152), (588, 1160), (582, 1124), (592, 1145), (959, 1154), (575, 1131), (604, 1157), (978, 1141)]
         : compromised: 0.5167, honest: 0.8389
Round 007: test acc mean=0.6587 ± 0.1745 | min=0.4933 max=0.8812
         : test loss mean=nan ± nan
         : individual accs = ['0.863158', '0.508636', '0.493345', '0.528497', '0.853616', '0.514410', '0.881223', '0.869565', '0.562500', '0.876773', '0.880245', '0.498667', '0.522569', '0.506897', '0.517794', '0.517031', '0.876083', '0.508400', '0.522040', '0.872918']
         : correct/total = [(984, 1140), (589, 1158), (556, 1127), (612, 1158), (968, 1134), (589, 1145), (1009, 1145), (980, 1127), (639, 1136), (989, 1128), (1007, 1144), (561, 1125), (602, 1152), (588, 1160), (582, 1124), (592, 1145), (1011, 1154), (575, 1131), (604, 1157), (996, 1141)]
         : compromised: 0.5167, honest: 0.8717
Round 008: test acc mean=0.6607 ± 0.1768 | min=0.4933 max=0.8830
         : test loss mean=nan ± nan
         : individual accs = ['0.873684', '0.508636', '0.493345', '0.528497', '0.867725', '0.514410', '0.876856', '0.879326', '0.562500', '0.881206', '0.881119', '0.498667', '0.522569', '0.506897', '0.517794', '0.517031', '0.883016', '0.508400', '0.522040', '0.869413']
         : correct/total = [(996, 1140), (589, 1158), (556, 1127), (612, 1158), (984, 1134), (589, 1145), (1004, 1145), (991, 1127), (639, 1136), (994, 1128), (1008, 1144), (561, 1125), (602, 1152), (588, 1160), (582, 1124), (592, 1145), (1019, 1154), (575, 1131), (604, 1157), (992, 1141)]
         : compromised: 0.5167, honest: 0.8765
Round 009: test acc mean=0.6662 ± 0.1835 | min=0.4933 max=0.8989
         : test loss mean=nan ± nan
         : individual accs = ['0.890351', '0.508636', '0.493345', '0.528497', '0.886243', '0.514410', '0.886463', '0.891748', '0.562500', '0.898936', '0.891608', '0.498667', '0.522569', '0.506897', '0.517794', '0.517031', '0.887348', '0.508400', '0.522040', '0.890447']
         : correct/total = [(1015, 1140), (589, 1158), (556, 1127), (612, 1158), (1005, 1134), (589, 1145), (1015, 1145), (1005, 1127), (639, 1136), (1014, 1128), (1020, 1144), (561, 1125), (602, 1152), (588, 1160), (582, 1124), (592, 1145), (1024, 1154), (575, 1131), (604, 1157), (1016, 1141)]
         : compromised: 0.5167, honest: 0.8904
Round 010: test acc mean=0.6674 ± 0.1851 | min=0.4933 max=0.9060
         : test loss mean=nan ± nan
         : individual accs = ['0.898246', '0.508636', '0.493345', '0.528497', '0.886243', '0.514410', '0.886463', '0.899734', '0.562500', '0.906028', '0.894231', '0.498667', '0.522569', '0.506897', '0.517794', '0.517031', '0.889081', '0.508400', '0.522040', '0.887818']
         : correct/total = [(1024, 1140), (589, 1158), (556, 1127), (612, 1158), (1005, 1134), (589, 1145), (1015, 1145), (1014, 1127), (639, 1136), (1022, 1128), (1023, 1144), (561, 1125), (602, 1152), (588, 1160), (582, 1124), (592, 1145), (1026, 1154), (575, 1131), (604, 1157), (1013, 1141)]
         : compromised: 0.5167, honest: 0.8935

=== FINAL RESULTS ===
Dataset: celeba, Nodes: 20, Graph: fully, Aggregation: balance
Attack: backdoor, 60.0% compromised
Final accuracy - Compromised: 0.5167, Honest: 0.8935
Overall test accuracy: mean=0.6674 ± 0.1851

=== BACKDOOR ATTACK SUCCESS RATE (ASR) ===
Target label: 0
Trigger size: 8x8
Overall ASR: 0.8219 ± 0.2184
Honest nodes ASR: 0.5547 ± 0.0174
Compromised nodes ASR: 1.0000 ± 0.0000
Note: Higher ASR indicates more successful backdoor attack

=== BALANCE SUMMARY ===
Node 0: acceptance=0.368
Node 1: acceptance=0.142
Node 2: acceptance=0.142
Node 3: acceptance=0.142
Node 4: acceptance=0.368
Node 5: acceptance=0.142
Node 6: acceptance=0.368
Node 7: acceptance=0.368
Node 8: acceptance=0.142
Node 9: acceptance=0.368
Node 10: acceptance=0.368
Node 11: acceptance=0.142
Node 12: acceptance=0.242
Node 13: acceptance=0.142
Node 14: acceptance=0.142
Node 15: acceptance=0.142
Node 16: acceptance=0.368
Node 17: acceptance=0.242
Node 18: acceptance=0.142
Node 19: acceptance=0.368

=== PARALLEL EXECUTION TIME (realistic for distributed system) ===
  COMMUNICATION (max across nodes):
    - Full model transfer: 0.000s (0.0%)
  COMPUTATION (max across nodes):
    - Filtering: 0.055s (82.3%)
    - Aggregation: 0.012s (17.7%)
  TOTALS:
    - Total computation: 0.066s (100.0%)
    - Total communication: 0.000s (0.0%)
    - Total parallel time: 0.066s

=== PER-NODE AVERAGE TIME ===
  - Filtering: 0.050s
  - Aggregation: 0.005s
  - Model transfer: 0.000s
  - Total per node: 0.054s

=== TOTAL COMPUTATIONAL WORK (sum across all nodes) ===
  - Total filtering: 0.991s
  - Total aggregation: 0.093s
  - Total model transfer: 0.000s
  - Grand total: 1.084s
  - Mean acceptance rate: 0.243

BALANCE Algorithm Properties:
  - Model dimension: 2,219,692
  - No compression: Full parameter comparison
  - Theoretical complexity: O(deg(i)×d)
  - Approach: Full parameter filtering + averaging
