Device: cuda
Seed: 987654321
Looking for images in: /home/student.unimelb.edu.au/mrangwala/Projects/Sketchguard/leaf/data/celeba/data/raw/img_align_celeba
Loading 1 LEAF CelebA train files...
LEAF CelebA train: 9343 users (celebrities), 177457 samples
Looking for images in: /home/student.unimelb.edu.au/mrangwala/Projects/Sketchguard/leaf/data/celeba/data/raw/img_align_celeba
Loading 1 LEAF CelebA test files...
LEAF CelebA test: 9343 users (celebrities), 22831 samples
Found 9343 train users, 9343 test users, 9343 common users
User sample counts range: 31 (max) to 4 (min)
Distributed ALL 9343 users across 20 clients
Users per client: 467 (with 3 clients getting +1 user)
Train partition sizes: [8843, 8998, 8728, 9034, 8866, 8946, 8873, 8776, 8816, 8801, 8913, 8656, 9115, 8921, 8699, 8823, 8912, 8766, 9102, 8869]
Test partition sizes: [1140, 1158, 1127, 1158, 1134, 1145, 1145, 1127, 1136, 1128, 1144, 1125, 1152, 1160, 1124, 1145, 1154, 1131, 1157, 1141]
  Client 0: 8843 train samples, 2 unique classes
  Client 1: 8998 train samples, 2 unique classes
  Client 2: 8728 train samples, 2 unique classes
  Client 3: 9034 train samples, 2 unique classes
  Client 4: 8866 train samples, 2 unique classes
  Client 5: 8946 train samples, 2 unique classes
  Client 6: 8873 train samples, 2 unique classes
  Client 7: 8776 train samples, 2 unique classes
  Client 8: 8816 train samples, 2 unique classes
  Client 9: 8801 train samples, 2 unique classes
  Client 10: 8913 train samples, 2 unique classes
  Client 11: 8656 train samples, 2 unique classes
  Client 12: 9115 train samples, 2 unique classes
  Client 13: 8921 train samples, 2 unique classes
  Client 14: 8699 train samples, 2 unique classes
  Client 15: 8823 train samples, 2 unique classes
  Client 16: 8912 train samples, 2 unique classes
  Client 17: 8766 train samples, 2 unique classes
  Client 18: 9102 train samples, 2 unique classes
  Client 19: 8869 train samples, 2 unique classes
Will sample 4500 samples per client per epoch
Graph: fully, nodes: 20, edges: 190
Degree statistics: avg=19.00, min=19, max=19
Attack: Compromised 14/20 nodes: [1, 2, 3, 5, 6, 8, 11, 12, 13, 14, 15, 17, 18, 19]
Attack type: backdoor, lambda: 1.0
Backdoor target label: 0, trigger size: 8
Model variant: baseline
Model parameters: 2,219,692
UBAR ALGORITHM (Two-Stage Byzantine-resilient)
  - Model dimension: 2,219,692 parameters
  - Rho parameter: 0.30000000000000004
  - Stage 1: Distance-based filtering (select 30% closest neighbors)
  - Stage 2: Performance-based selection (loss comparison)
  - Complexity: O(deg(i)×d + deg(i)×inference)
Initial test acc across nodes: mean=0.4978 ± 0.0208
Backdoor attack: Created poisoned datasets for 14 compromised nodes
Round 001: test acc mean=0.5635 ± 0.0736 | min=0.4942 max=0.7158
         : test loss mean=2757.6000 ± 1870.9983
         : individual accs = ['0.683333', '0.508636', '0.494232', '0.534542', '0.611993', '0.514410', '0.521397', '0.582964', '0.562500', '0.699468', '0.702797', '0.521778', '0.522569', '0.506897', '0.517794', '0.521397', '0.715771', '0.508400', '0.522040', '0.517967']
         : correct/total = [(779, 1140), (589, 1158), (557, 1127), (619, 1158), (694, 1134), (589, 1145), (597, 1145), (657, 1127), (639, 1136), (789, 1128), (804, 1144), (587, 1125), (602, 1152), (588, 1160), (582, 1124), (597, 1145), (826, 1154), (575, 1131), (604, 1157), (591, 1141)]
         : compromised: 0.5196, honest: 0.6661
         : ubar stats = ['Node 0: s1=0.263, s2=0.200', 'Node 1: s1=0.263, s2=1.000', 'Node 2: s1=0.263, s2=1.000']...
Round 002: test acc mean=0.5678 ± 0.0965 | min=0.4472 max=0.7686
         : test loss mean=1265.1753 ± 3249.9765
         : individual accs = ['0.735965', '0.506045', '0.495120', '0.526770', '0.618166', '0.511790', '0.521397', '0.657498', '0.554577', '0.727837', '0.727273', '0.497778', '0.513021', '0.502586', '0.519573', '0.447162', '0.768631', '0.507515', '0.509939', '0.507450']
         : correct/total = [(839, 1140), (586, 1158), (558, 1127), (610, 1158), (701, 1134), (586, 1145), (597, 1145), (741, 1127), (630, 1136), (821, 1128), (832, 1144), (560, 1125), (591, 1152), (583, 1160), (584, 1124), (512, 1145), (887, 1154), (574, 1131), (590, 1157), (579, 1141)]
         : compromised: 0.5086, honest: 0.7059
         : ubar stats = ['Node 0: s1=0.263, s2=0.200', 'Node 1: s1=0.263, s2=1.000', 'Node 2: s1=0.263, s2=1.000']...
Round 003: test acc mean=0.5825 ± 0.1520 | min=0.4375 max=0.8421
         : test loss mean=nan ± nan
         : individual accs = ['0.842105', '0.491364', '0.493345', '0.471503', '0.753968', '0.485590', '0.478603', '0.786158', '0.437500', '0.834220', '0.815559', '0.498667', '0.477431', '0.493103', '0.482206', '0.517031', '0.840555', '0.491600', '0.477960', '0.482033']
         : correct/total = [(960, 1140), (569, 1158), (556, 1127), (546, 1158), (855, 1134), (556, 1145), (548, 1145), (886, 1127), (497, 1136), (941, 1128), (933, 1144), (561, 1125), (550, 1152), (572, 1160), (542, 1124), (592, 1145), (970, 1154), (556, 1131), (553, 1157), (550, 1141)]
         : compromised: 0.4841, honest: 0.8121
         : ubar stats = ['Node 0: s1=0.263, s2=0.200', 'Node 1: s1=0.263, s2=1.000', 'Node 2: s1=0.263, s2=0.733']...
Round 004: test acc mean=0.6199 ± 0.1576 | min=0.4933 max=0.8811
         : test loss mean=nan ± nan
         : individual accs = ['0.866667', '0.508636', '0.493345', '0.528497', '0.849206', '0.514410', '0.521397', '0.838509', '0.562500', '0.869681', '0.881119', '0.498667', '0.522569', '0.506897', '0.517794', '0.517031', '0.851820', '0.508400', '0.522040', '0.517967']
         : correct/total = [(988, 1140), (589, 1158), (556, 1127), (612, 1158), (963, 1134), (589, 1145), (597, 1145), (945, 1127), (639, 1136), (981, 1128), (1008, 1144), (561, 1125), (602, 1152), (588, 1160), (582, 1124), (592, 1145), (983, 1154), (575, 1131), (604, 1157), (591, 1141)]
         : compromised: 0.5172, honest: 0.8595
         : ubar stats = ['Node 0: s1=0.263, s2=0.200', 'Node 1: s1=0.263, s2=0.800', 'Node 2: s1=0.263, s2=0.600']...
Round 005: test acc mean=0.6234 ± 0.1630 | min=0.4933 max=0.8892
         : test loss mean=nan ± nan
         : individual accs = ['0.846491', '0.508636', '0.493345', '0.528497', '0.870370', '0.514410', '0.521397', '0.853594', '0.562500', '0.889184', '0.888112', '0.498667', '0.522569', '0.506897', '0.517794', '0.517031', '0.879549', '0.508400', '0.522040', '0.517967']
         : correct/total = [(965, 1140), (589, 1158), (556, 1127), (612, 1158), (987, 1134), (589, 1145), (597, 1145), (962, 1127), (639, 1136), (1003, 1128), (1016, 1144), (561, 1125), (602, 1152), (588, 1160), (582, 1124), (592, 1145), (1015, 1154), (575, 1131), (604, 1157), (591, 1141)]
         : compromised: 0.5172, honest: 0.8712
         : ubar stats = ['Node 0: s1=0.263, s2=0.360', 'Node 1: s1=0.263, s2=0.680', 'Node 2: s1=0.263, s2=0.520']...
Round 006: test acc mean=0.6290 ± 0.1714 | min=0.4933 max=0.8977
         : test loss mean=nan ± nan
         : individual accs = ['0.892982', '0.508636', '0.493345', '0.528497', '0.879189', '0.514410', '0.521397', '0.891748', '0.562500', '0.882979', '0.895105', '0.498667', '0.522569', '0.506897', '0.517794', '0.517031', '0.897747', '0.508400', '0.522040', '0.517967']
         : correct/total = [(1018, 1140), (589, 1158), (556, 1127), (612, 1158), (997, 1134), (589, 1145), (597, 1145), (1005, 1127), (639, 1136), (996, 1128), (1024, 1144), (561, 1125), (602, 1152), (588, 1160), (582, 1124), (592, 1145), (1036, 1154), (575, 1131), (604, 1157), (591, 1141)]
         : compromised: 0.5172, honest: 0.8900
         : ubar stats = ['Node 0: s1=0.263, s2=0.333', 'Node 1: s1=0.263, s2=0.600', 'Node 2: s1=0.263, s2=0.467']...
Round 007: test acc mean=0.6319 ± 0.1759 | min=0.4933 max=0.9079
         : test loss mean=nan ± nan
         : individual accs = ['0.907895', '0.508636', '0.493345', '0.528497', '0.887125', '0.514410', '0.521397', '0.899734', '0.562500', '0.901596', '0.900350', '0.498667', '0.522569', '0.506897', '0.517794', '0.517031', '0.902080', '0.508400', '0.522040', '0.517967']
         : correct/total = [(1035, 1140), (589, 1158), (556, 1127), (612, 1158), (1006, 1134), (589, 1145), (597, 1145), (1014, 1127), (639, 1136), (1017, 1128), (1030, 1144), (561, 1125), (602, 1152), (588, 1160), (582, 1124), (592, 1145), (1041, 1154), (575, 1131), (604, 1157), (591, 1141)]
         : compromised: 0.5172, honest: 0.8998
         : ubar stats = ['Node 0: s1=0.263, s2=0.314', 'Node 1: s1=0.263, s2=0.543', 'Node 2: s1=0.263, s2=0.429']...
Round 008: test acc mean=0.6320 ± 0.1759 | min=0.4933 max=0.9044
         : test loss mean=nan ± nan
         : individual accs = ['0.904386', '0.508636', '0.493345', '0.528497', '0.894180', '0.514410', '0.521397', '0.898846', '0.562500', '0.900709', '0.903846', '0.498667', '0.522569', '0.506897', '0.517794', '0.517031', '0.897747', '0.508400', '0.522040', '0.517967']
         : correct/total = [(1031, 1140), (589, 1158), (556, 1127), (612, 1158), (1014, 1134), (589, 1145), (597, 1145), (1013, 1127), (639, 1136), (1016, 1128), (1034, 1144), (561, 1125), (602, 1152), (588, 1160), (582, 1124), (592, 1145), (1036, 1154), (575, 1131), (604, 1157), (591, 1141)]
         : compromised: 0.5172, honest: 0.9000
         : ubar stats = ['Node 0: s1=0.263, s2=0.300', 'Node 1: s1=0.263, s2=0.500', 'Node 2: s1=0.263, s2=0.400']...
Round 009: test acc mean=0.6327 ± 0.1770 | min=0.4933 max=0.9132
         : test loss mean=nan ± nan
         : individual accs = ['0.913158', '0.508636', '0.493345', '0.528497', '0.902998', '0.514410', '0.521397', '0.901508', '0.562500', '0.890957', '0.904720', '0.498667', '0.522569', '0.506897', '0.517794', '0.517031', '0.900347', '0.508400', '0.522040', '0.517967']
         : correct/total = [(1041, 1140), (589, 1158), (556, 1127), (612, 1158), (1024, 1134), (589, 1145), (597, 1145), (1016, 1127), (639, 1136), (1005, 1128), (1035, 1144), (561, 1125), (602, 1152), (588, 1160), (582, 1124), (592, 1145), (1039, 1154), (575, 1131), (604, 1157), (591, 1141)]
         : compromised: 0.5172, honest: 0.9023
         : ubar stats = ['Node 0: s1=0.263, s2=0.289', 'Node 1: s1=0.263, s2=0.467', 'Node 2: s1=0.263, s2=0.378']...
Round 010: test acc mean=0.6338 ± 0.1787 | min=0.4933 max=0.9132
         : test loss mean=nan ± nan
         : individual accs = ['0.913158', '0.508636', '0.493345', '0.528497', '0.900353', '0.514410', '0.521397', '0.907720', '0.562500', '0.903369', '0.906469', '0.498667', '0.522569', '0.506897', '0.517794', '0.517031', '0.904679', '0.508400', '0.522040', '0.517967']
         : correct/total = [(1041, 1140), (589, 1158), (556, 1127), (612, 1158), (1021, 1134), (589, 1145), (597, 1145), (1023, 1127), (639, 1136), (1019, 1128), (1037, 1144), (561, 1125), (602, 1152), (588, 1160), (582, 1124), (592, 1145), (1044, 1154), (575, 1131), (604, 1157), (591, 1141)]
         : compromised: 0.5172, honest: 0.9060
         : ubar stats = ['Node 0: s1=0.263, s2=0.300', 'Node 1: s1=0.263, s2=0.440', 'Node 2: s1=0.263, s2=0.360']...

=== FINAL RESULTS ===
Dataset: celeba, Nodes: 20, Graph: fully, Aggregation: ubar
Attack: backdoor, 70.0% compromised
Final accuracy - Compromised: 0.5172, Honest: 0.9060
Overall test accuracy: mean=0.6338 ± 0.1787

=== BACKDOOR ATTACK SUCCESS RATE (ASR) ===
Target label: 0
Trigger size: 8x8
Overall ASR: 0.8601 ± 0.2141
Honest nodes ASR: 0.5338 ± 0.0255
Compromised nodes ASR: 1.0000 ± 0.0000
Note: Higher ASR indicates more successful backdoor attack

=== UBAR SUMMARY ===
Node 0: stage1=0.263, stage2=0.300, overall=0.079
Node 1: stage1=0.263, stage2=0.440, overall=0.116
Node 2: stage1=0.263, stage2=0.360, overall=0.095
Node 3: stage1=0.263, stage2=0.440, overall=0.116
Node 4: stage1=0.263, stage2=0.520, overall=0.137
Node 5: stage1=0.263, stage2=0.440, overall=0.116
Node 6: stage1=0.263, stage2=0.440, overall=0.116
Node 7: stage1=0.263, stage2=0.520, overall=0.137
Node 8: stage1=0.263, stage2=0.440, overall=0.116
Node 9: stage1=0.263, stage2=0.420, overall=0.111
Node 10: stage1=0.263, stage2=0.300, overall=0.079
Node 11: stage1=0.263, stage2=0.360, overall=0.095
Node 12: stage1=0.263, stage2=0.440, overall=0.116
Node 13: stage1=0.263, stage2=0.440, overall=0.116
Node 14: stage1=0.263, stage2=0.440, overall=0.116
Node 15: stage1=0.263, stage2=0.360, overall=0.095
Node 16: stage1=0.263, stage2=0.360, overall=0.095
Node 17: stage1=0.263, stage2=0.440, overall=0.116
Node 18: stage1=0.263, stage2=0.440, overall=0.116
Node 19: stage1=0.263, stage2=0.440, overall=0.116

=== PARALLEL EXECUTION TIME (realistic for distributed system) ===
  COMMUNICATION (max across nodes):
    - Full model transfer: 0.000s (0.0%)
  COMPUTATION (max across nodes):
    - Distance computation: 0.050s (19.8%)
    - Loss computation: 0.200s (78.6%)
    - Aggregation: 0.004s (1.6%)
  TOTALS:
    - Total computation: 0.254s (100.0%)
    - Total communication: 0.000s (0.0%)
    - Total parallel time: 0.254s

=== PER-NODE AVERAGE TIME ===
  - Distance computation: 0.046s
  - Loss computation: 0.159s
  - Aggregation: 0.003s
  - Model transfer: 0.000s
  - Total per node: 0.208s

=== TOTAL COMPUTATIONAL WORK (sum across all nodes) ===
  - Total distance computation: 0.926s
  - Total loss computation: 3.174s
  - Total aggregation: 0.069s
  - Total model transfer: 0.000s
  - Grand total: 4.169s
  - Mean Stage 1 acceptance rate: 0.263
  - Mean Stage 2 acceptance rate: 0.417
  - Overall acceptance rate: 0.110

UBAR Algorithm Properties:
  - Model dimension: 2,219,692
  - Rho parameter: 0.30000000000000004
  - Two-stage approach: Distance filtering + loss evaluation
  - Stage 1 selects: 30% of neighbors
  - Stage 2 uses: Training sample loss comparison
  - Theoretical complexity: O(deg(i)×d + deg(i)×inference)
  - Approach: UBAR paper implementation
