Device: cuda
Seed: 987654321
Looking for images in: /home/student.unimelb.edu.au/mrangwala/Projects/Sketchguard/leaf/data/celeba/data/raw/img_align_celeba
Loading 1 LEAF CelebA train files...
LEAF CelebA train: 9343 users (celebrities), 177457 samples
Looking for images in: /home/student.unimelb.edu.au/mrangwala/Projects/Sketchguard/leaf/data/celeba/data/raw/img_align_celeba
Loading 1 LEAF CelebA test files...
LEAF CelebA test: 9343 users (celebrities), 22831 samples
Found 9343 train users, 9343 test users, 9343 common users
User sample counts range: 31 (max) to 4 (min)
Distributed ALL 9343 users across 20 clients
Users per client: 467 (with 3 clients getting +1 user)
Train partition sizes: [8843, 8998, 8728, 9034, 8866, 8946, 8873, 8776, 8816, 8801, 8913, 8656, 9115, 8921, 8699, 8823, 8912, 8766, 9102, 8869]
Test partition sizes: [1140, 1158, 1127, 1158, 1134, 1145, 1145, 1127, 1136, 1128, 1144, 1125, 1152, 1160, 1124, 1145, 1154, 1131, 1157, 1141]
  Client 0: 8843 train samples, 2 unique classes
  Client 1: 8998 train samples, 2 unique classes
  Client 2: 8728 train samples, 2 unique classes
  Client 3: 9034 train samples, 2 unique classes
  Client 4: 8866 train samples, 2 unique classes
  Client 5: 8946 train samples, 2 unique classes
  Client 6: 8873 train samples, 2 unique classes
  Client 7: 8776 train samples, 2 unique classes
  Client 8: 8816 train samples, 2 unique classes
  Client 9: 8801 train samples, 2 unique classes
  Client 10: 8913 train samples, 2 unique classes
  Client 11: 8656 train samples, 2 unique classes
  Client 12: 9115 train samples, 2 unique classes
  Client 13: 8921 train samples, 2 unique classes
  Client 14: 8699 train samples, 2 unique classes
  Client 15: 8823 train samples, 2 unique classes
  Client 16: 8912 train samples, 2 unique classes
  Client 17: 8766 train samples, 2 unique classes
  Client 18: 9102 train samples, 2 unique classes
  Client 19: 8869 train samples, 2 unique classes
Will sample 4500 samples per client per epoch
Graph: fully, nodes: 20, edges: 190
Degree statistics: avg=19.00, min=19, max=19
Attack: Compromised 6/20 nodes: [5, 12, 13, 14, 17, 18]
Attack type: backdoor, lambda: 1.0
Backdoor target label: 0, trigger size: 8
Model variant: baseline
Model parameters: 2,219,692
BALANCE algorithm:
Balance Config: BALANCEConfig(gamma=2, kappa=1, alpha=0.5, min_neighbors=1)
  - Model dimension: 2,219,692 parameters
  - Complexity: O(N×d) = O(20×2,219,692)
Initial test acc across nodes: mean=0.4978 ± 0.0208
Backdoor attack: Created poisoned datasets for 6 compromised nodes
Round 001: test acc mean=0.6356 ± 0.0840 | min=0.5069 max=0.7191
         : test loss mean=1183.6642 ± 1823.4069
         : individual accs = ['0.712281', '0.679620', '0.671695', '0.699482', '0.587302', '0.514410', '0.696070', '0.640639', '0.713028', '0.712766', '0.689685', '0.719111', '0.522569', '0.506897', '0.517794', '0.703930', '0.715771', '0.508400', '0.522040', '0.678352']
         : correct/total = [(812, 1140), (787, 1158), (757, 1127), (810, 1158), (666, 1134), (589, 1145), (797, 1145), (722, 1127), (810, 1136), (804, 1128), (789, 1144), (809, 1125), (602, 1152), (588, 1160), (582, 1124), (806, 1145), (826, 1154), (575, 1131), (604, 1157), (774, 1141)]
         : compromised: 0.5154, honest: 0.6871
Round 002: test acc mean=0.6089 ± 0.0802 | min=0.4774 max=0.6976
         : test loss mean=1002555.9828 ± 1929994.4477
         : individual accs = ['0.647368', '0.655440', '0.691216', '0.653713', '0.522046', '0.501310', '0.661135', '0.658385', '0.633803', '0.651596', '0.691434', '0.650667', '0.477431', '0.505172', '0.534698', '0.680349', '0.697574', '0.491600', '0.487468', '0.685364']
         : correct/total = [(738, 1140), (759, 1158), (779, 1127), (757, 1158), (592, 1134), (574, 1145), (757, 1145), (742, 1127), (720, 1136), (735, 1128), (791, 1144), (732, 1125), (550, 1152), (586, 1160), (601, 1124), (779, 1145), (805, 1154), (556, 1131), (564, 1157), (782, 1141)]
         : compromised: 0.4996, honest: 0.6557
Round 003: test acc mean=0.6073 ± 0.0722 | min=0.4822 max=0.7036
         : test loss mean=nan ± nan
         : individual accs = ['0.612281', '0.663212', '0.675244', '0.662349', '0.537919', '0.514410', '0.629694', '0.641526', '0.688380', '0.678191', '0.639860', '0.657778', '0.522569', '0.506897', '0.482206', '0.637555', '0.703640', '0.508400', '0.522040', '0.662577']
         : correct/total = [(698, 1140), (768, 1158), (761, 1127), (767, 1158), (610, 1134), (589, 1145), (721, 1145), (723, 1127), (782, 1136), (765, 1128), (732, 1144), (740, 1125), (602, 1152), (588, 1160), (542, 1124), (730, 1145), (812, 1154), (575, 1131), (604, 1157), (756, 1141)]
         : compromised: 0.5094, honest: 0.6493
Round 004: test acc mean=0.6408 ± 0.0846 | min=0.5069 max=0.7324
         : test loss mean=nan ± nan
         : individual accs = ['0.686842', '0.694301', '0.702751', '0.702936', '0.663139', '0.514410', '0.699563', '0.665484', '0.710387', '0.703901', '0.715035', '0.732444', '0.522569', '0.506897', '0.517794', '0.654148', '0.730503', '0.508400', '0.522040', '0.661700']
         : correct/total = [(783, 1140), (804, 1158), (792, 1127), (814, 1158), (752, 1134), (589, 1145), (801, 1145), (750, 1127), (807, 1136), (794, 1128), (818, 1144), (824, 1125), (602, 1152), (588, 1160), (582, 1124), (749, 1145), (843, 1154), (575, 1131), (604, 1157), (755, 1141)]
         : compromised: 0.5154, honest: 0.6945
Round 005: test acc mean=0.6810 ± 0.1095 | min=0.5069 max=0.7799
         : test loss mean=nan ± nan
         : individual accs = ['0.722807', '0.761658', '0.723159', '0.749568', '0.735450', '0.514410', '0.764192', '0.738243', '0.743838', '0.773936', '0.754371', '0.775111', '0.522569', '0.506897', '0.517794', '0.746725', '0.779896', '0.508400', '0.522040', '0.759860']
         : correct/total = [(824, 1140), (882, 1158), (815, 1127), (868, 1158), (834, 1134), (589, 1145), (875, 1145), (832, 1127), (845, 1136), (873, 1128), (863, 1144), (872, 1125), (602, 1152), (588, 1160), (582, 1124), (855, 1145), (900, 1154), (575, 1131), (604, 1157), (867, 1141)]
         : compromised: 0.5154, honest: 0.7521
Round 006: test acc mean=0.7078 ± 0.1267 | min=0.5069 max=0.8129
         : test loss mean=nan ± nan
         : individual accs = ['0.771930', '0.805699', '0.805679', '0.788428', '0.783951', '0.514410', '0.772052', '0.776398', '0.787852', '0.806738', '0.812937', '0.812444', '0.522569', '0.506897', '0.517794', '0.775546', '0.774697', '0.508400', '0.522040', '0.789658']
         : correct/total = [(880, 1140), (933, 1158), (908, 1127), (913, 1158), (889, 1134), (589, 1145), (884, 1145), (875, 1127), (895, 1136), (910, 1128), (930, 1144), (914, 1125), (602, 1152), (588, 1160), (582, 1124), (888, 1145), (894, 1154), (575, 1131), (604, 1157), (901, 1141)]
         : compromised: 0.5154, honest: 0.7903
Round 007: test acc mean=0.7366 ± 0.1453 | min=0.5069 max=0.8489
         : test loss mean=nan ± nan
         : individual accs = ['0.822807', '0.848877', '0.828749', '0.820380', '0.816578', '0.514410', '0.834934', '0.822538', '0.838908', '0.847518', '0.846154', '0.848000', '0.522569', '0.506897', '0.517794', '0.803493', '0.821490', '0.508400', '0.522040', '0.838738']
         : correct/total = [(938, 1140), (983, 1158), (934, 1127), (950, 1158), (926, 1134), (589, 1145), (956, 1145), (927, 1127), (953, 1136), (956, 1128), (968, 1144), (954, 1125), (602, 1152), (588, 1160), (582, 1124), (920, 1145), (948, 1154), (575, 1131), (604, 1157), (957, 1141)]
         : compromised: 0.5154, honest: 0.8314
Round 008: test acc mean=0.7537 ± 0.1563 | min=0.5069 max=0.8748
         : test loss mean=nan ± nan
         : individual accs = ['0.841228', '0.874784', '0.854481', '0.846287', '0.847443', '0.514410', '0.859389', '0.852706', '0.849472', '0.863475', '0.865385', '0.872889', '0.522569', '0.506897', '0.517794', '0.837555', '0.859619', '0.508400', '0.522040', '0.856266']
         : correct/total = [(959, 1140), (1013, 1158), (963, 1127), (980, 1158), (961, 1134), (589, 1145), (984, 1145), (961, 1127), (965, 1136), (974, 1128), (990, 1144), (982, 1125), (602, 1152), (588, 1160), (582, 1124), (959, 1145), (992, 1154), (575, 1131), (604, 1157), (977, 1141)]
         : compromised: 0.5154, honest: 0.8558
Round 009: test acc mean=0.7670 ± 0.1650 | min=0.5069 max=0.8903
         : test loss mean=nan ± nan
         : individual accs = ['0.869298', '0.890328', '0.863354', '0.877375', '0.862434', '0.514410', '0.887336', '0.876664', '0.867077', '0.878546', '0.882867', '0.888889', '0.522569', '0.506897', '0.517794', '0.851528', '0.873484', '0.508400', '0.522040', '0.878177']
         : correct/total = [(991, 1140), (1031, 1158), (973, 1127), (1016, 1158), (978, 1134), (589, 1145), (1016, 1145), (988, 1127), (985, 1136), (991, 1128), (1010, 1144), (1000, 1125), (602, 1152), (588, 1160), (582, 1124), (975, 1145), (1008, 1154), (575, 1131), (604, 1157), (1002, 1141)]
         : compromised: 0.5154, honest: 0.8748
Round 010: test acc mean=0.7735 ± 0.1692 | min=0.5069 max=0.8963
         : test loss mean=nan ± nan
         : individual accs = ['0.878070', '0.889465', '0.876664', '0.888601', '0.878307', '0.514410', '0.891703', '0.886424', '0.882042', '0.896277', '0.885490', '0.895111', '0.522569', '0.506897', '0.517794', '0.861135', '0.886482', '0.508400', '0.522040', '0.882559']
         : correct/total = [(1001, 1140), (1030, 1158), (988, 1127), (1029, 1158), (996, 1134), (589, 1145), (1021, 1145), (999, 1127), (1002, 1136), (1011, 1128), (1013, 1144), (1007, 1125), (602, 1152), (588, 1160), (582, 1124), (986, 1145), (1023, 1154), (575, 1131), (604, 1157), (1007, 1141)]
         : compromised: 0.5154, honest: 0.8842

=== FINAL RESULTS ===
Dataset: celeba, Nodes: 20, Graph: fully, Aggregation: balance
Attack: backdoor, 30.0% compromised
Final accuracy - Compromised: 0.5154, Honest: 0.8842
Overall test accuracy: mean=0.7735 ± 0.1692

=== BACKDOOR ATTACK SUCCESS RATE (ASR) ===
Target label: 0
Trigger size: 8x8
Overall ASR: 0.6797 ± 0.2102
Honest nodes ASR: 0.5424 ± 0.0164
Compromised nodes ASR: 1.0000 ± 0.0000
Note: Higher ASR indicates more successful backdoor attack

=== BALANCE SUMMARY ===
Node 0: acceptance=0.684
Node 1: acceptance=0.684
Node 2: acceptance=0.684
Node 3: acceptance=0.684
Node 4: acceptance=0.684
Node 5: acceptance=0.174
Node 6: acceptance=0.684
Node 7: acceptance=0.684
Node 8: acceptance=0.684
Node 9: acceptance=0.684
Node 10: acceptance=0.684
Node 11: acceptance=0.684
Node 12: acceptance=0.174
Node 13: acceptance=0.174
Node 14: acceptance=0.274
Node 15: acceptance=0.684
Node 16: acceptance=0.684
Node 17: acceptance=0.174
Node 18: acceptance=0.174
Node 19: acceptance=0.684

=== PARALLEL EXECUTION TIME (realistic for distributed system) ===
  COMMUNICATION (max across nodes):
    - Full model transfer: 0.000s (0.0%)
  COMPUTATION (max across nodes):
    - Filtering: 0.056s (80.3%)
    - Aggregation: 0.014s (19.7%)
  TOTALS:
    - Total computation: 0.070s (100.0%)
    - Total communication: 0.000s (0.0%)
    - Total parallel time: 0.070s

=== PER-NODE AVERAGE TIME ===
  - Filtering: 0.049s
  - Aggregation: 0.006s
  - Model transfer: 0.000s
  - Total per node: 0.056s

=== TOTAL COMPUTATIONAL WORK (sum across all nodes) ===
  - Total filtering: 0.986s
  - Total aggregation: 0.129s
  - Total model transfer: 0.000s
  - Grand total: 1.115s
  - Mean acceptance rate: 0.536

BALANCE Algorithm Properties:
  - Model dimension: 2,219,692
  - No compression: Full parameter comparison
  - Theoretical complexity: O(deg(i)×d)
  - Approach: Full parameter filtering + averaging
