Device: cuda
Seed: 987654321
Looking for images in: /home/student.unimelb.edu.au/mrangwala/Projects/Sketchguard/leaf/data/celeba/data/raw/img_align_celeba
Loading 1 LEAF CelebA train files...
LEAF CelebA train: 9343 users (celebrities), 177457 samples
Looking for images in: /home/student.unimelb.edu.au/mrangwala/Projects/Sketchguard/leaf/data/celeba/data/raw/img_align_celeba
Loading 1 LEAF CelebA test files...
LEAF CelebA test: 9343 users (celebrities), 22831 samples
Found 9343 train users, 9343 test users, 9343 common users
User sample counts range: 31 (max) to 4 (min)
Distributed ALL 9343 users across 20 clients
Users per client: 467 (with 3 clients getting +1 user)
Train partition sizes: [8843, 8998, 8728, 9034, 8866, 8946, 8873, 8776, 8816, 8801, 8913, 8656, 9115, 8921, 8699, 8823, 8912, 8766, 9102, 8869]
Test partition sizes: [1140, 1158, 1127, 1158, 1134, 1145, 1145, 1127, 1136, 1128, 1144, 1125, 1152, 1160, 1124, 1145, 1154, 1131, 1157, 1141]
  Client 0: 8843 train samples, 2 unique classes
  Client 1: 8998 train samples, 2 unique classes
  Client 2: 8728 train samples, 2 unique classes
  Client 3: 9034 train samples, 2 unique classes
  Client 4: 8866 train samples, 2 unique classes
  Client 5: 8946 train samples, 2 unique classes
  Client 6: 8873 train samples, 2 unique classes
  Client 7: 8776 train samples, 2 unique classes
  Client 8: 8816 train samples, 2 unique classes
  Client 9: 8801 train samples, 2 unique classes
  Client 10: 8913 train samples, 2 unique classes
  Client 11: 8656 train samples, 2 unique classes
  Client 12: 9115 train samples, 2 unique classes
  Client 13: 8921 train samples, 2 unique classes
  Client 14: 8699 train samples, 2 unique classes
  Client 15: 8823 train samples, 2 unique classes
  Client 16: 8912 train samples, 2 unique classes
  Client 17: 8766 train samples, 2 unique classes
  Client 18: 9102 train samples, 2 unique classes
  Client 19: 8869 train samples, 2 unique classes
Will sample 4500 samples per client per epoch
Graph: erdos, nodes: 20, edges: 48
Degree statistics: avg=4.80, min=2, max=7
Attack: Compromised 12/20 nodes: [1, 2, 3, 5, 8, 11, 12, 13, 14, 15, 17, 18]
Attack type: directed_deviation, lambda: 1.0
Model variant: baseline
Model parameters: 2,219,692
UBAR ALGORITHM (Two-Stage Byzantine-resilient)
  - Model dimension: 2,219,692 parameters
  - Rho parameter: 0.4
  - Stage 1: Distance-based filtering (select 40% closest neighbors)
  - Stage 2: Performance-based selection (loss comparison)
  - Complexity: O(deg(i)×d + deg(i)×inference)
Initial test acc across nodes: mean=0.4978 ± 0.0208
Round 001: test acc mean=0.6192 ± 0.0549 | min=0.5164 max=0.7158
         : test loss mean=43.6727 ± 187.4308
         : individual accs = ['0.664035', '0.590674', '0.637977', '0.684801', '0.571429', '0.592140', '0.643668', '0.612245', '0.636444', '0.655142', '0.530594', '0.614222', '0.687500', '0.516379', '0.626335', '0.684716', '0.715771', '0.583554', '0.615385', '0.521472']
         : correct/total = [(757, 1140), (684, 1158), (719, 1127), (793, 1158), (648, 1134), (678, 1145), (737, 1145), (690, 1127), (723, 1136), (739, 1128), (607, 1144), (691, 1125), (792, 1152), (599, 1160), (704, 1124), (784, 1145), (826, 1154), (660, 1131), (712, 1157), (595, 1141)]
         : compromised: 0.6225, honest: 0.6143
         : ubar stats = ['Node 0: s1=0.333, s2=0.500', 'Node 1: s1=0.333, s2=0.500', 'Node 2: s1=0.400, s2=0.500']...
Round 002: test acc mean=0.7266 ± 0.0580 | min=0.5069 max=0.7828
         : test loss mean=nan ± nan
         : individual accs = ['0.750000', '0.728843', '0.685004', '0.745250', '0.690476', '0.715284', '0.765066', '0.736469', '0.753521', '0.782801', '0.771853', '0.778667', '0.734375', '0.506897', '0.712633', '0.704803', '0.769497', '0.737401', '0.700951', '0.762489']
         : correct/total = [(855, 1140), (844, 1158), (772, 1127), (863, 1158), (783, 1134), (819, 1145), (876, 1145), (830, 1127), (856, 1136), (883, 1128), (883, 1144), (876, 1125), (846, 1152), (588, 1160), (801, 1124), (807, 1145), (888, 1154), (834, 1131), (811, 1157), (870, 1141)]
         : compromised: 0.7086, honest: 0.7536
         : ubar stats = ['Node 0: s1=0.333, s2=0.500', 'Node 1: s1=0.333, s2=0.500', 'Node 2: s1=0.400, s2=0.750']...
Round 003: test acc mean=0.8060 ± 0.0775 | min=0.5069 max=0.8593
         : test loss mean=nan ± nan
         : individual accs = ['0.854386', '0.824698', '0.708075', '0.848877', '0.804233', '0.815721', '0.847162', '0.815439', '0.856514', '0.854610', '0.859266', '0.848000', '0.806424', '0.506897', '0.815836', '0.782533', '0.842288', '0.816092', '0.768366', '0.844873']
         : correct/total = [(974, 1140), (955, 1158), (798, 1127), (983, 1158), (912, 1134), (934, 1145), (970, 1145), (919, 1127), (973, 1136), (964, 1128), (983, 1144), (954, 1125), (929, 1152), (588, 1160), (917, 1124), (896, 1145), (972, 1154), (923, 1131), (889, 1157), (964, 1141)]
         : compromised: 0.7832, honest: 0.8403
         : ubar stats = ['Node 0: s1=0.333, s2=0.500', 'Node 1: s1=0.333, s2=0.500', 'Node 2: s1=0.400, s2=0.833']...
Round 004: test acc mean=0.8259 ± 0.0911 | min=0.5069 max=0.8864
         : test loss mean=nan ± nan
         : individual accs = ['0.871930', '0.870466', '0.750665', '0.873921', '0.847443', '0.867249', '0.869869', '0.857143', '0.876761', '0.881206', '0.886364', '0.805333', '0.860243', '0.506897', '0.858541', '0.807860', '0.875217', '0.652520', '0.824546', '0.872918']
         : correct/total = [(994, 1140), (1008, 1158), (846, 1127), (1012, 1158), (961, 1134), (993, 1145), (996, 1145), (966, 1127), (996, 1136), (994, 1128), (1014, 1144), (906, 1125), (991, 1152), (588, 1160), (965, 1124), (925, 1145), (1010, 1154), (738, 1131), (954, 1157), (996, 1141)]
         : compromised: 0.7963, honest: 0.8703
         : ubar stats = ['Node 0: s1=0.333, s2=0.500', 'Node 1: s1=0.333, s2=0.500', 'Node 2: s1=0.400, s2=0.875']...
Round 005: test acc mean=0.8468 ± 0.0822 | min=0.5069 max=0.8903
         : test loss mean=nan ± nan
         : individual accs = ['0.864035', '0.890328', '0.796806', '0.887737', '0.859788', '0.824454', '0.877729', '0.865129', '0.888204', '0.890071', '0.889860', '0.882667', '0.875868', '0.506897', '0.862989', '0.833188', '0.886482', '0.855880', '0.821089', '0.877301']
         : correct/total = [(985, 1140), (1031, 1158), (898, 1127), (1028, 1158), (975, 1134), (944, 1145), (1005, 1145), (975, 1127), (1009, 1136), (1004, 1128), (1018, 1144), (993, 1125), (1009, 1152), (588, 1160), (970, 1124), (954, 1145), (1023, 1154), (968, 1131), (950, 1157), (1001, 1141)]
         : compromised: 0.8272, honest: 0.8763
         : ubar stats = ['Node 0: s1=0.333, s2=0.500', 'Node 1: s1=0.333, s2=0.600', 'Node 2: s1=0.400, s2=0.800']...
Round 006: test acc mean=0.8529 ± 0.0870 | min=0.5069 max=0.8996
         : test loss mean=nan ± nan
         : individual accs = ['0.894737', '0.891192', '0.844720', '0.883420', '0.873898', '0.897817', '0.895197', '0.889086', '0.899648', '0.890957', '0.892483', '0.779556', '0.877604', '0.506897', '0.896797', '0.777293', '0.890815', '0.856764', '0.833189', '0.885188']
         : correct/total = [(1020, 1140), (1032, 1158), (952, 1127), (1023, 1158), (991, 1134), (1028, 1145), (1025, 1145), (1002, 1127), (1022, 1136), (1005, 1128), (1021, 1144), (877, 1125), (1011, 1152), (588, 1160), (1008, 1124), (890, 1145), (1028, 1154), (969, 1131), (964, 1157), (1010, 1141)]
         : compromised: 0.8287, honest: 0.8890
         : ubar stats = ['Node 0: s1=0.333, s2=0.500', 'Node 1: s1=0.333, s2=0.583', 'Node 2: s1=0.400, s2=0.833']...
Round 007: test acc mean=0.8713 ± 0.0847 | min=0.5069 max=0.9067
         : test loss mean=nan ± nan
         : individual accs = ['0.900877', '0.898100', '0.884650', '0.906736', '0.875661', '0.898690', '0.896070', '0.891748', '0.895246', '0.898936', '0.900350', '0.886222', '0.892361', '0.506897', '0.895018', '0.843668', '0.898614', '0.890363', '0.873812', '0.892200']
         : correct/total = [(1027, 1140), (1040, 1158), (997, 1127), (1050, 1158), (993, 1134), (1029, 1145), (1026, 1145), (1005, 1127), (1017, 1136), (1014, 1128), (1030, 1144), (997, 1125), (1028, 1152), (588, 1160), (1006, 1124), (966, 1145), (1037, 1154), (1007, 1131), (1011, 1157), (1018, 1141)]
         : compromised: 0.8560, honest: 0.8943
         : ubar stats = ['Node 0: s1=0.333, s2=0.500', 'Node 1: s1=0.333, s2=0.571', 'Node 2: s1=0.400, s2=0.786']...
Round 008: test acc mean=0.8638 ± 0.0890 | min=0.5069 max=0.9066
         : test loss mean=nan ± nan
         : individual accs = ['0.900877', '0.898964', '0.790594', '0.903282', '0.885362', '0.901310', '0.898690', '0.896185', '0.895246', '0.894504', '0.890734', '0.894222', '0.894965', '0.506897', '0.906584', '0.771179', '0.896880', '0.884173', '0.878133', '0.886941']
         : correct/total = [(1027, 1140), (1041, 1158), (891, 1127), (1046, 1158), (1004, 1134), (1032, 1145), (1029, 1145), (1010, 1127), (1017, 1136), (1009, 1128), (1019, 1144), (1006, 1125), (1031, 1152), (588, 1160), (1019, 1124), (883, 1145), (1035, 1154), (1000, 1131), (1016, 1157), (1012, 1141)]
         : compromised: 0.8438, honest: 0.8938
         : ubar stats = ['Node 0: s1=0.333, s2=0.500', 'Node 1: s1=0.333, s2=0.562', 'Node 2: s1=0.400, s2=0.750']...
Round 009: test acc mean=0.8686 ± 0.0863 | min=0.5069 max=0.9081
         : test loss mean=nan ± nan
         : individual accs = ['0.900000', '0.892919', '0.812777', '0.900691', '0.895062', '0.903930', '0.897817', '0.905058', '0.904049', '0.889184', '0.904720', '0.874667', '0.894965', '0.506897', '0.897687', '0.834061', '0.908146', '0.890363', '0.869490', '0.890447']
         : correct/total = [(1026, 1140), (1034, 1158), (916, 1127), (1043, 1158), (1015, 1134), (1035, 1145), (1028, 1145), (1020, 1127), (1027, 1136), (1003, 1128), (1035, 1144), (984, 1125), (1031, 1152), (588, 1160), (1009, 1124), (955, 1145), (1048, 1154), (1007, 1131), (1006, 1157), (1016, 1141)]
         : compromised: 0.8485, honest: 0.8988
         : ubar stats = ['Node 0: s1=0.333, s2=0.500', 'Node 1: s1=0.333, s2=0.556', 'Node 2: s1=0.400, s2=0.778']...
Round 010: test acc mean=0.8771 ± 0.0857 | min=0.5069 max=0.9119
         : test loss mean=nan ± nan
         : individual accs = ['0.906140', '0.902418', '0.881988', '0.911917', '0.896825', '0.901310', '0.900437', '0.901508', '0.897887', '0.902482', '0.904720', '0.892444', '0.903646', '0.506897', '0.907473', '0.865502', '0.907279', '0.883289', '0.875540', '0.892200']
         : correct/total = [(1033, 1140), (1045, 1158), (994, 1127), (1056, 1158), (1017, 1134), (1032, 1145), (1031, 1145), (1016, 1127), (1020, 1136), (1018, 1128), (1035, 1144), (1004, 1125), (1041, 1152), (588, 1160), (1020, 1124), (991, 1145), (1047, 1154), (999, 1131), (1013, 1157), (1018, 1141)]
         : compromised: 0.8609, honest: 0.9014
         : ubar stats = ['Node 0: s1=0.333, s2=0.500', 'Node 1: s1=0.333, s2=0.550', 'Node 2: s1=0.400, s2=0.750']...

=== FINAL RESULTS ===
Dataset: celeba, Nodes: 20, Graph: erdos, Aggregation: ubar
Attack: directed_deviation, 60.0% compromised
Final accuracy - Compromised: 0.8609, Honest: 0.9014
Overall test accuracy: mean=0.8771 ± 0.0857

=== UBAR SUMMARY ===
Node 0: stage1=0.333, stage2=0.500, overall=0.167
Node 1: stage1=0.333, stage2=0.550, overall=0.183
Node 2: stage1=0.400, stage2=0.750, overall=0.300
Node 3: stage1=0.250, stage2=1.000, overall=0.250
Node 4: stage1=0.250, stage2=1.000, overall=0.250
Node 5: stage1=0.400, stage2=0.500, overall=0.200
Node 6: stage1=0.400, stage2=0.500, overall=0.200
Node 7: stage1=0.400, stage2=0.650, overall=0.260
Node 8: stage1=0.500, stage2=1.000, overall=0.500
Node 9: stage1=0.333, stage2=1.000, overall=0.333
Node 10: stage1=0.250, stage2=1.000, overall=0.250
Node 11: stage1=0.286, stage2=0.700, overall=0.200
Node 12: stage1=0.286, stage2=0.700, overall=0.200
Node 13: stage1=0.250, stage2=1.000, overall=0.250
Node 14: stage1=0.286, stage2=0.500, overall=0.143
Node 15: stage1=0.333, stage2=0.650, overall=0.217
Node 16: stage1=0.400, stage2=0.500, overall=0.200
Node 17: stage1=0.400, stage2=0.500, overall=0.200
Node 18: stage1=0.250, stage2=1.000, overall=0.250
Node 19: stage1=0.500, stage2=1.000, overall=0.500

=== PARALLEL EXECUTION TIME (realistic for distributed system) ===
  COMMUNICATION (max across nodes):
    - Full model transfer: 0.000s (0.0%)
  COMPUTATION (max across nodes):
    - Distance computation: 0.018s (9.1%)
    - Loss computation: 0.177s (89.1%)
    - Aggregation: 0.004s (1.8%)
  TOTALS:
    - Total computation: 0.198s (100.0%)
    - Total communication: 0.000s (0.0%)
    - Total parallel time: 0.198s

=== PER-NODE AVERAGE TIME ===
  - Distance computation: 0.013s
  - Loss computation: 0.133s
  - Aggregation: 0.003s
  - Model transfer: 0.000s
  - Total per node: 0.148s

=== TOTAL COMPUTATIONAL WORK (sum across all nodes) ===
  - Total distance computation: 0.253s
  - Total loss computation: 2.664s
  - Total aggregation: 0.053s
  - Total model transfer: 0.000s
  - Grand total: 2.970s
  - Mean Stage 1 acceptance rate: 0.342
  - Mean Stage 2 acceptance rate: 0.750
  - Overall acceptance rate: 0.257

UBAR Algorithm Properties:
  - Model dimension: 2,219,692
  - Rho parameter: 0.4
  - Two-stage approach: Distance filtering + loss evaluation
  - Stage 1 selects: 40% of neighbors
  - Stage 2 uses: Training sample loss comparison
  - Theoretical complexity: O(deg(i)×d + deg(i)×inference)
  - Approach: UBAR paper implementation
