Device: cuda
Seed: 987654321
Looking for images in: /home/student.unimelb.edu.au/mrangwala/Projects/Sketchguard/leaf/data/celeba/data/raw/img_align_celeba
Loading 1 LEAF CelebA train files...
LEAF CelebA train: 9343 users (celebrities), 177457 samples
Looking for images in: /home/student.unimelb.edu.au/mrangwala/Projects/Sketchguard/leaf/data/celeba/data/raw/img_align_celeba
Loading 1 LEAF CelebA test files...
LEAF CelebA test: 9343 users (celebrities), 22831 samples
Found 9343 train users, 9343 test users, 9343 common users
User sample counts range: 31 (max) to 4 (min)
Distributed ALL 9343 users across 20 clients
Users per client: 467 (with 3 clients getting +1 user)
Train partition sizes: [8843, 8998, 8728, 9034, 8866, 8946, 8873, 8776, 8816, 8801, 8913, 8656, 9115, 8921, 8699, 8823, 8912, 8766, 9102, 8869]
Test partition sizes: [1140, 1158, 1127, 1158, 1134, 1145, 1145, 1127, 1136, 1128, 1144, 1125, 1152, 1160, 1124, 1145, 1154, 1131, 1157, 1141]
  Client 0: 8843 train samples, 2 unique classes
  Client 1: 8998 train samples, 2 unique classes
  Client 2: 8728 train samples, 2 unique classes
  Client 3: 9034 train samples, 2 unique classes
  Client 4: 8866 train samples, 2 unique classes
  Client 5: 8946 train samples, 2 unique classes
  Client 6: 8873 train samples, 2 unique classes
  Client 7: 8776 train samples, 2 unique classes
  Client 8: 8816 train samples, 2 unique classes
  Client 9: 8801 train samples, 2 unique classes
  Client 10: 8913 train samples, 2 unique classes
  Client 11: 8656 train samples, 2 unique classes
  Client 12: 9115 train samples, 2 unique classes
  Client 13: 8921 train samples, 2 unique classes
  Client 14: 8699 train samples, 2 unique classes
  Client 15: 8823 train samples, 2 unique classes
  Client 16: 8912 train samples, 2 unique classes
  Client 17: 8766 train samples, 2 unique classes
  Client 18: 9102 train samples, 2 unique classes
  Client 19: 8869 train samples, 2 unique classes
Will sample 4500 samples per client per epoch
Graph: erdos, nodes: 20, edges: 48
Degree statistics: avg=4.80, min=2, max=7
Attack: Compromised 2/20 nodes: [5, 13]
Attack type: backdoor, lambda: 1.0
Backdoor target label: 0, trigger size: 8
Model variant: baseline
Model parameters: 2,219,692
Initial test acc across nodes: mean=0.4978 ± 0.0208
Backdoor attack: Created poisoned datasets for 2 compromised nodes
Round 001: test acc mean=0.7241 ± 0.0216 | min=0.6861 max=0.7729
         : test loss mean=0.5740 ± 0.0311
         : individual accs = ['0.698246', '0.726252', '0.711624', '0.699482', '0.693122', '0.732751', '0.772926', '0.710736', '0.749120', '0.720745', '0.722028', '0.728889', '0.743924', '0.732759', '0.739324', '0.752838', '0.740901', '0.686118', '0.713051', '0.708151']
         : correct/total = [(796, 1140), (841, 1158), (802, 1127), (810, 1158), (786, 1134), (839, 1145), (885, 1145), (801, 1127), (851, 1136), (813, 1128), (826, 1144), (820, 1125), (857, 1152), (850, 1160), (831, 1124), (862, 1145), (855, 1154), (776, 1131), (825, 1157), (808, 1141)]
         : compromised: 0.7328, honest: 0.7232
Round 002: test acc mean=0.8324 ± 0.0181 | min=0.7870 max=0.8603
         : test loss mean=0.3885 ± 0.0379
         : individual accs = ['0.836842', '0.851468', '0.848270', '0.850604', '0.811287', '0.845415', '0.860262', '0.821650', '0.786972', '0.838652', '0.831294', '0.848000', '0.827257', '0.837069', '0.837189', '0.827948', '0.846620', '0.824050', '0.796889', '0.821209']
         : correct/total = [(954, 1140), (986, 1158), (956, 1127), (985, 1158), (920, 1134), (968, 1145), (985, 1145), (926, 1127), (894, 1136), (946, 1128), (951, 1144), (954, 1125), (953, 1152), (971, 1160), (941, 1124), (948, 1145), (977, 1154), (932, 1131), (922, 1157), (937, 1141)]
         : compromised: 0.8412, honest: 0.8315
Round 003: test acc mean=0.8586 ± 0.0189 | min=0.8213 max=0.8900
         : test loss mean=0.3242 ± 0.0323
         : individual accs = ['0.862281', '0.835924', '0.868678', '0.862694', '0.841270', '0.889956', '0.888210', '0.839397', '0.821303', '0.843972', '0.855769', '0.881778', '0.871528', '0.859483', '0.864769', '0.859389', '0.875217', '0.839965', '0.833189', '0.877301']
         : correct/total = [(983, 1140), (968, 1158), (979, 1127), (999, 1158), (954, 1134), (1019, 1145), (1017, 1145), (946, 1127), (933, 1136), (952, 1128), (979, 1144), (992, 1125), (1004, 1152), (997, 1160), (972, 1124), (984, 1145), (1010, 1154), (950, 1131), (964, 1157), (1001, 1141)]
         : compromised: 0.8747, honest: 0.8568
Round 004: test acc mean=0.8759 ± 0.0113 | min=0.8470 max=0.8941
         : test loss mean=0.2911 ± 0.0157
         : individual accs = ['0.886842', '0.862694', '0.878438', '0.882556', '0.865961', '0.889083', '0.876856', '0.868678', '0.885563', '0.885638', '0.875000', '0.875556', '0.880208', '0.881034', '0.894128', '0.872489', '0.882149', '0.847038', '0.855661', '0.872042']
         : correct/total = [(1011, 1140), (999, 1158), (990, 1127), (1022, 1158), (982, 1134), (1018, 1145), (1004, 1145), (979, 1127), (1006, 1136), (999, 1128), (1001, 1144), (985, 1125), (1014, 1152), (1022, 1160), (1005, 1124), (999, 1145), (1018, 1154), (958, 1131), (990, 1157), (995, 1141)]
         : compromised: 0.8851, honest: 0.8749
Round 005: test acc mean=0.8836 ± 0.0110 | min=0.8579 max=0.9047
         : test loss mean=0.2730 ± 0.0188
         : individual accs = ['0.857895', '0.886010', '0.863354', '0.892055', '0.880071', '0.896943', '0.896943', '0.880213', '0.873239', '0.890957', '0.904720', '0.888889', '0.885417', '0.890517', '0.887011', '0.875983', '0.872617', '0.881521', '0.880726', '0.886941']
         : correct/total = [(978, 1140), (1026, 1158), (973, 1127), (1033, 1158), (998, 1134), (1027, 1145), (1027, 1145), (992, 1127), (992, 1136), (1005, 1128), (1035, 1144), (1000, 1125), (1020, 1152), (1033, 1160), (997, 1124), (1003, 1145), (1007, 1154), (997, 1131), (1019, 1157), (1012, 1141)]
         : compromised: 0.8937, honest: 0.8825
Round 006: test acc mean=0.8842 ± 0.0190 | min=0.8366 max=0.9056
         : test loss mean=0.2725 ± 0.0340
         : individual accs = ['0.839474', '0.886874', '0.866016', '0.901554', '0.873898', '0.900437', '0.897817', '0.882875', '0.883803', '0.898050', '0.905594', '0.903111', '0.889757', '0.887069', '0.899466', '0.873362', '0.900347', '0.879752', '0.836646', '0.877301']
         : correct/total = [(957, 1140), (1027, 1158), (976, 1127), (1044, 1158), (991, 1134), (1031, 1145), (1028, 1145), (995, 1127), (1004, 1136), (1013, 1128), (1036, 1144), (1016, 1125), (1025, 1152), (1029, 1160), (1011, 1124), (1000, 1145), (1039, 1154), (995, 1131), (968, 1157), (1001, 1141)]
         : compromised: 0.8938, honest: 0.8831
Round 007: test acc mean=0.8953 ± 0.0078 | min=0.8751 max=0.9138
         : test loss mean=0.2534 ± 0.0138
         : individual accs = ['0.900000', '0.894646', '0.889086', '0.905009', '0.894180', '0.892576', '0.897817', '0.900621', '0.887324', '0.890071', '0.896853', '0.913778', '0.897569', '0.894828', '0.903915', '0.875109', '0.899480', '0.889478', '0.887640', '0.896582']
         : correct/total = [(1026, 1140), (1036, 1158), (1002, 1127), (1048, 1158), (1014, 1134), (1022, 1145), (1028, 1145), (1015, 1127), (1008, 1136), (1004, 1128), (1026, 1144), (1028, 1125), (1034, 1152), (1038, 1160), (1016, 1124), (1002, 1145), (1038, 1154), (1006, 1131), (1027, 1157), (1023, 1141)]
         : compromised: 0.8937, honest: 0.8955
Round 008: test acc mean=0.8963 ± 0.0083 | min=0.8773 max=0.9076
         : test loss mean=0.2510 ± 0.0175
         : individual accs = ['0.900000', '0.897237', '0.882875', '0.907599', '0.890653', '0.895197', '0.906550', '0.899734', '0.895246', '0.898936', '0.904720', '0.907556', '0.899306', '0.894828', '0.900356', '0.887336', '0.905546', '0.887710', '0.887640', '0.877301']
         : correct/total = [(1026, 1140), (1039, 1158), (995, 1127), (1051, 1158), (1010, 1134), (1025, 1145), (1038, 1145), (1014, 1127), (1017, 1136), (1014, 1128), (1035, 1144), (1021, 1125), (1036, 1152), (1038, 1160), (1012, 1124), (1016, 1145), (1045, 1154), (1004, 1131), (1027, 1157), (1001, 1141)]
         : compromised: 0.8950, honest: 0.8965
Round 009: test acc mean=0.8953 ± 0.0130 | min=0.8574 max=0.9130
         : test loss mean=0.2534 ± 0.0268
         : individual accs = ['0.905263', '0.878238', '0.875776', '0.905872', '0.899471', '0.905677', '0.895197', '0.913043', '0.902289', '0.898050', '0.907343', '0.888000', '0.896701', '0.900862', '0.904804', '0.887336', '0.901213', '0.885057', '0.857390', '0.899211']
         : correct/total = [(1032, 1140), (1017, 1158), (987, 1127), (1049, 1158), (1020, 1134), (1037, 1145), (1025, 1145), (1029, 1127), (1025, 1136), (1013, 1128), (1038, 1144), (999, 1125), (1033, 1152), (1045, 1160), (1017, 1124), (1016, 1145), (1040, 1154), (1001, 1131), (992, 1157), (1026, 1141)]
         : compromised: 0.9033, honest: 0.8945
Round 010: test acc mean=0.9004 ± 0.0080 | min=0.8799 max=0.9136
         : test loss mean=0.2425 ± 0.0165
         : individual accs = ['0.907895', '0.889465', '0.895297', '0.913644', '0.895062', '0.899563', '0.902183', '0.909494', '0.900528', '0.908688', '0.903846', '0.900444', '0.901910', '0.904310', '0.901246', '0.897817', '0.911612', '0.889478', '0.879862', '0.896582']
         : correct/total = [(1035, 1140), (1030, 1158), (1009, 1127), (1058, 1158), (1015, 1134), (1030, 1145), (1033, 1145), (1025, 1127), (1023, 1136), (1025, 1128), (1034, 1144), (1013, 1125), (1039, 1152), (1049, 1160), (1013, 1124), (1028, 1145), (1052, 1154), (1006, 1131), (1018, 1157), (1023, 1141)]
         : compromised: 0.9019, honest: 0.9003

=== FINAL RESULTS ===
Dataset: celeba, Nodes: 20, Graph: erdos, Aggregation: krum
Attack: backdoor, 10.0% compromised
Final accuracy - Compromised: 0.9019, Honest: 0.9003
Overall test accuracy: mean=0.9004 ± 0.0080

=== BACKDOOR ATTACK SUCCESS RATE (ASR) ===
Target label: 0
Trigger size: 8x8
Overall ASR: 0.5423 ± 0.0256
Honest nodes ASR: 0.5453 ± 0.0252
Compromised nodes ASR: 0.5149 ± 0.0049
Note: Higher ASR indicates more successful backdoor attack
