Device: cuda
Seed: 987654321
Looking for images in: /home/student.unimelb.edu.au/mrangwala/Projects/Sketchguard/leaf/data/celeba/data/raw/img_align_celeba
Loading 1 LEAF CelebA train files...
LEAF CelebA train: 9343 users (celebrities), 177457 samples
Looking for images in: /home/student.unimelb.edu.au/mrangwala/Projects/Sketchguard/leaf/data/celeba/data/raw/img_align_celeba
Loading 1 LEAF CelebA test files...
LEAF CelebA test: 9343 users (celebrities), 22831 samples
Found 9343 train users, 9343 test users, 9343 common users
User sample counts range: 31 (max) to 4 (min)
Distributed ALL 9343 users across 20 clients
Users per client: 467 (with 3 clients getting +1 user)
Train partition sizes: [8843, 8998, 8728, 9034, 8866, 8946, 8873, 8776, 8816, 8801, 8913, 8656, 9115, 8921, 8699, 8823, 8912, 8766, 9102, 8869]
Test partition sizes: [1140, 1158, 1127, 1158, 1134, 1145, 1145, 1127, 1136, 1128, 1144, 1125, 1152, 1160, 1124, 1145, 1154, 1131, 1157, 1141]
  Client 0: 8843 train samples, 2 unique classes
  Client 1: 8998 train samples, 2 unique classes
  Client 2: 8728 train samples, 2 unique classes
  Client 3: 9034 train samples, 2 unique classes
  Client 4: 8866 train samples, 2 unique classes
  Client 5: 8946 train samples, 2 unique classes
  Client 6: 8873 train samples, 2 unique classes
  Client 7: 8776 train samples, 2 unique classes
  Client 8: 8816 train samples, 2 unique classes
  Client 9: 8801 train samples, 2 unique classes
  Client 10: 8913 train samples, 2 unique classes
  Client 11: 8656 train samples, 2 unique classes
  Client 12: 9115 train samples, 2 unique classes
  Client 13: 8921 train samples, 2 unique classes
  Client 14: 8699 train samples, 2 unique classes
  Client 15: 8823 train samples, 2 unique classes
  Client 16: 8912 train samples, 2 unique classes
  Client 17: 8766 train samples, 2 unique classes
  Client 18: 9102 train samples, 2 unique classes
  Client 19: 8869 train samples, 2 unique classes
Will sample 4500 samples per client per epoch
Graph: ring, nodes: 20, edges: 20
Degree statistics: avg=2.00, min=2, max=2
Attack: Compromised 6/20 nodes: [5, 12, 13, 14, 17, 18]
Attack type: directed_deviation, lambda: 1.0
Model variant: baseline
Model parameters: 2,219,692
BALANCE algorithm:
Balance Config: BALANCEConfig(gamma=2, kappa=1, alpha=0.5, min_neighbors=1)
  - Model dimension: 2,219,692 parameters
  - Complexity: O(N×d) = O(20×2,219,692)
Initial test acc across nodes: mean=0.4978 ± 0.0208
Round 001: test acc mean=0.6231 ± 0.0595 | min=0.4802 max=0.7144
         : test loss mean=90.8842 ± 393.2072
         : individual accs = ['0.606140', '0.677029', '0.661934', '0.607945', '0.640212', '0.550218', '0.555459', '0.536823', '0.711268', '0.658688', '0.680070', '0.670222', '0.714410', '0.480172', '0.631673', '0.632314', '0.630849', '0.583554', '0.655143', '0.577564']
         : correct/total = [(691, 1140), (784, 1158), (746, 1127), (704, 1158), (726, 1134), (630, 1145), (636, 1145), (605, 1127), (808, 1136), (743, 1128), (778, 1144), (754, 1125), (823, 1152), (557, 1160), (710, 1124), (724, 1145), (728, 1154), (660, 1131), (758, 1157), (659, 1141)]
         : compromised: 0.6025, honest: 0.6319
Round 002: test acc mean=0.7130 ± 0.0576 | min=0.5069 max=0.7782
         : test loss mean=nan ± nan
         : individual accs = ['0.702632', '0.680484', '0.691216', '0.692573', '0.700176', '0.650655', '0.728384', '0.686779', '0.746479', '0.701241', '0.756119', '0.754667', '0.768229', '0.506897', '0.751779', '0.744978', '0.778163', '0.745358', '0.743302', '0.730061']
         : correct/total = [(801, 1140), (788, 1158), (779, 1127), (802, 1158), (794, 1134), (745, 1145), (834, 1145), (774, 1127), (848, 1136), (791, 1128), (865, 1144), (849, 1125), (885, 1152), (588, 1160), (845, 1124), (853, 1145), (898, 1154), (843, 1131), (860, 1157), (833, 1141)]
         : compromised: 0.6944, honest: 0.7210
Round 003: test acc mean=0.7844 ± 0.0728 | min=0.5069 max=0.8605
         : test loss mean=nan ± nan
         : individual accs = ['0.785088', '0.742660', '0.747116', '0.757340', '0.776896', '0.728384', '0.799127', '0.777285', '0.798415', '0.809397', '0.845280', '0.835556', '0.835938', '0.506897', '0.838078', '0.819214', '0.860485', '0.819629', '0.793431', '0.812445']
         : correct/total = [(895, 1140), (860, 1158), (842, 1127), (877, 1158), (881, 1134), (834, 1145), (915, 1145), (876, 1127), (907, 1136), (913, 1128), (967, 1144), (940, 1125), (963, 1152), (588, 1160), (942, 1124), (938, 1145), (993, 1154), (927, 1131), (918, 1157), (927, 1141)]
         : compromised: 0.7537, honest: 0.7976
Round 004: test acc mean=0.8236 ± 0.0782 | min=0.5069 max=0.8737
         : test loss mean=nan ± nan
         : individual accs = ['0.829825', '0.809154', '0.746229', '0.814335', '0.825397', '0.823581', '0.855022', '0.839397', '0.848592', '0.861702', '0.873252', '0.868444', '0.862847', '0.506897', '0.873665', '0.845415', '0.870884', '0.847922', '0.820225', '0.848379']
         : correct/total = [(946, 1140), (937, 1158), (841, 1127), (943, 1158), (936, 1134), (943, 1145), (979, 1145), (946, 1127), (964, 1136), (972, 1128), (999, 1144), (977, 1125), (994, 1152), (588, 1160), (982, 1124), (968, 1145), (1005, 1154), (959, 1131), (949, 1157), (968, 1141)]
         : compromised: 0.7892, honest: 0.8383
Round 005: test acc mean=0.8387 ± 0.0803 | min=0.5069 max=0.8960
         : test loss mean=nan ± nan
         : individual accs = ['0.824561', '0.858377', '0.797693', '0.854922', '0.850970', '0.837555', '0.869869', '0.868678', '0.832746', '0.842199', '0.892483', '0.869333', '0.877604', '0.506897', '0.888790', '0.867249', '0.896014', '0.877984', '0.812446', '0.848379']
         : correct/total = [(940, 1140), (994, 1158), (899, 1127), (990, 1158), (965, 1134), (959, 1145), (996, 1145), (979, 1127), (946, 1136), (950, 1128), (1021, 1144), (978, 1125), (1011, 1152), (588, 1160), (999, 1124), (993, 1145), (1034, 1154), (993, 1131), (940, 1157), (968, 1141)]
         : compromised: 0.8002, honest: 0.8552
Round 006: test acc mean=0.8606 ± 0.0817 | min=0.5069 max=0.9021
         : test loss mean=nan ± nan
         : individual accs = ['0.873684', '0.876511', '0.864241', '0.879965', '0.873016', '0.878603', '0.882096', '0.880213', '0.882923', '0.866135', '0.890734', '0.890667', '0.883681', '0.506897', '0.886121', '0.871616', '0.902080', '0.885942', '0.860847', '0.876424']
         : correct/total = [(996, 1140), (1015, 1158), (974, 1127), (1019, 1158), (990, 1134), (1006, 1145), (1010, 1145), (992, 1127), (1003, 1136), (977, 1128), (1019, 1144), (1002, 1125), (1018, 1152), (588, 1160), (996, 1124), (998, 1145), (1041, 1154), (1002, 1131), (996, 1157), (1000, 1141)]
         : compromised: 0.8170, honest: 0.8793
Round 007: test acc mean=0.8689 ± 0.0835 | min=0.5069 max=0.9111
         : test loss mean=nan ± nan
         : individual accs = ['0.874561', '0.892919', '0.881988', '0.892055', '0.873898', '0.882096', '0.888210', '0.887311', '0.885563', '0.890957', '0.896853', '0.911111', '0.889757', '0.506897', '0.895907', '0.882096', '0.896880', '0.888594', '0.872947', '0.887818']
         : correct/total = [(997, 1140), (1034, 1158), (994, 1127), (1033, 1158), (991, 1134), (1010, 1145), (1017, 1145), (1000, 1127), (1006, 1136), (1005, 1128), (1026, 1144), (1025, 1125), (1025, 1152), (588, 1160), (1007, 1124), (1010, 1145), (1035, 1154), (1005, 1131), (1010, 1157), (1013, 1141)]
         : compromised: 0.8227, honest: 0.8887
Round 008: test acc mean=0.8687 ± 0.0837 | min=0.5069 max=0.9064
         : test loss mean=nan ± nan
         : individual accs = ['0.891228', '0.893782', '0.877551', '0.879965', '0.879189', '0.898690', '0.889083', '0.889973', '0.870599', '0.869681', '0.894231', '0.905778', '0.889757', '0.506897', '0.904804', '0.882096', '0.906412', '0.892131', '0.868626', '0.882559']
         : correct/total = [(1016, 1140), (1035, 1158), (989, 1127), (1019, 1158), (997, 1134), (1029, 1145), (1018, 1145), (1003, 1127), (989, 1136), (981, 1128), (1023, 1144), (1019, 1125), (1025, 1152), (588, 1160), (1017, 1124), (1010, 1145), (1046, 1154), (1009, 1131), (1005, 1157), (1007, 1141)]
         : compromised: 0.8268, honest: 0.8866
Round 009: test acc mean=0.8741 ± 0.0848 | min=0.5069 max=0.9057
         : test loss mean=nan ± nan
         : individual accs = ['0.896491', '0.896373', '0.888199', '0.902418', '0.891534', '0.905677', '0.896070', '0.900621', '0.888204', '0.893617', '0.895105', '0.903111', '0.897569', '0.506897', '0.902135', '0.889083', '0.899480', '0.883289', '0.858254', '0.886941']
         : correct/total = [(1022, 1140), (1038, 1158), (1001, 1127), (1045, 1158), (1011, 1134), (1037, 1145), (1026, 1145), (1015, 1127), (1009, 1136), (1008, 1128), (1024, 1144), (1016, 1125), (1034, 1152), (588, 1160), (1014, 1124), (1018, 1145), (1038, 1154), (999, 1131), (993, 1157), (1012, 1141)]
         : compromised: 0.8256, honest: 0.8948
Round 010: test acc mean=0.8770 ± 0.0854 | min=0.5069 max=0.9120
         : test loss mean=nan ± nan
         : individual accs = ['0.895614', '0.892055', '0.884650', '0.911054', '0.893298', '0.904803', '0.886463', '0.902396', '0.898768', '0.898936', '0.902098', '0.912000', '0.900174', '0.506897', '0.902135', '0.890830', '0.909012', '0.883289', '0.877269', '0.888694']
         : correct/total = [(1021, 1140), (1033, 1158), (997, 1127), (1055, 1158), (1013, 1134), (1036, 1145), (1015, 1145), (1017, 1127), (1021, 1136), (1014, 1128), (1032, 1144), (1026, 1125), (1037, 1152), (588, 1160), (1014, 1124), (1020, 1145), (1049, 1154), (999, 1131), (1015, 1157), (1014, 1141)]
         : compromised: 0.8291, honest: 0.8976

=== FINAL RESULTS ===
Dataset: celeba, Nodes: 20, Graph: ring, Aggregation: balance
Attack: directed_deviation, 30.0% compromised
Final accuracy - Compromised: 0.8291, Honest: 0.8976
Overall test accuracy: mean=0.8770 ± 0.0854

=== BALANCE SUMMARY ===
Node 0: acceptance=1.000
Node 1: acceptance=1.000
Node 2: acceptance=1.000
Node 3: acceptance=1.000
Node 4: acceptance=0.500
Node 5: acceptance=0.800
Node 6: acceptance=0.500
Node 7: acceptance=1.000
Node 8: acceptance=1.000
Node 9: acceptance=1.000
Node 10: acceptance=1.000
Node 11: acceptance=0.500
Node 12: acceptance=0.500
Node 13: acceptance=0.000
Node 14: acceptance=0.500
Node 15: acceptance=0.500
Node 16: acceptance=0.500
Node 17: acceptance=0.500
Node 18: acceptance=0.500
Node 19: acceptance=0.500

=== PARALLEL EXECUTION TIME (realistic for distributed system) ===
  COMMUNICATION (max across nodes):
    - Full model transfer: 0.000s (0.0%)
  COMPUTATION (max across nodes):
    - Filtering: 0.023s (68.0%)
    - Aggregation: 0.011s (32.0%)
  TOTALS:
    - Total computation: 0.035s (100.0%)
    - Total communication: 0.000s (0.0%)
    - Total parallel time: 0.035s

=== PER-NODE AVERAGE TIME ===
  - Filtering: 0.008s
  - Aggregation: 0.004s
  - Model transfer: 0.000s
  - Total per node: 0.012s

=== TOTAL COMPUTATIONAL WORK (sum across all nodes) ===
  - Total filtering: 0.166s
  - Total aggregation: 0.073s
  - Total model transfer: 0.000s
  - Grand total: 0.240s
  - Mean acceptance rate: 0.690

BALANCE Algorithm Properties:
  - Model dimension: 2,219,692
  - No compression: Full parameter comparison
  - Theoretical complexity: O(deg(i)×d)
  - Approach: Full parameter filtering + averaging
