Device: cuda
Seed: 987654321
Looking for images in: /home/student.unimelb.edu.au/mrangwala/Projects/Sketchguard/leaf/data/celeba/data/raw/img_align_celeba
Loading 1 LEAF CelebA train files...
LEAF CelebA train: 9343 users (celebrities), 177457 samples
Looking for images in: /home/student.unimelb.edu.au/mrangwala/Projects/Sketchguard/leaf/data/celeba/data/raw/img_align_celeba
Loading 1 LEAF CelebA test files...
LEAF CelebA test: 9343 users (celebrities), 22831 samples
Found 9343 train users, 9343 test users, 9343 common users
User sample counts range: 31 (max) to 4 (min)
Distributed ALL 9343 users across 20 clients
Users per client: 467 (with 3 clients getting +1 user)
Train partition sizes: [8843, 8998, 8728, 9034, 8866, 8946, 8873, 8776, 8816, 8801, 8913, 8656, 9115, 8921, 8699, 8823, 8912, 8766, 9102, 8869]
Test partition sizes: [1140, 1158, 1127, 1158, 1134, 1145, 1145, 1127, 1136, 1128, 1144, 1125, 1152, 1160, 1124, 1145, 1154, 1131, 1157, 1141]
  Client 0: 8843 train samples, 2 unique classes
  Client 1: 8998 train samples, 2 unique classes
  Client 2: 8728 train samples, 2 unique classes
  Client 3: 9034 train samples, 2 unique classes
  Client 4: 8866 train samples, 2 unique classes
  Client 5: 8946 train samples, 2 unique classes
  Client 6: 8873 train samples, 2 unique classes
  Client 7: 8776 train samples, 2 unique classes
  Client 8: 8816 train samples, 2 unique classes
  Client 9: 8801 train samples, 2 unique classes
  Client 10: 8913 train samples, 2 unique classes
  Client 11: 8656 train samples, 2 unique classes
  Client 12: 9115 train samples, 2 unique classes
  Client 13: 8921 train samples, 2 unique classes
  Client 14: 8699 train samples, 2 unique classes
  Client 15: 8823 train samples, 2 unique classes
  Client 16: 8912 train samples, 2 unique classes
  Client 17: 8766 train samples, 2 unique classes
  Client 18: 9102 train samples, 2 unique classes
  Client 19: 8869 train samples, 2 unique classes
Will sample 4500 samples per client per epoch
Graph: erdos, nodes: 20, edges: 126
Degree statistics: avg=12.60, min=8, max=16
Attack: Compromised 14/20 nodes: [1, 2, 3, 5, 6, 8, 11, 12, 13, 14, 15, 17, 18, 19]
Attack type: krum, lambda: 1.0
Model variant: baseline
Model parameters: 2,219,692
Sketchguard Node 0:
  Model dim: 2,219,692 → Sketch size: 350
  Compression ratio: 6342.0x
  Using model parameters for aggregation, sketches for filtering
Sketchguard Node 1:
  Model dim: 2,219,692 → Sketch size: 350
  Compression ratio: 6342.0x
  Using model parameters for aggregation, sketches for filtering
Sketchguard Node 2:
  Model dim: 2,219,692 → Sketch size: 350
  Compression ratio: 6342.0x
  Using model parameters for aggregation, sketches for filtering
Sketchguard Node 3:
  Model dim: 2,219,692 → Sketch size: 350
  Compression ratio: 6342.0x
  Using model parameters for aggregation, sketches for filtering
Sketchguard Node 4:
  Model dim: 2,219,692 → Sketch size: 350
  Compression ratio: 6342.0x
  Using model parameters for aggregation, sketches for filtering
Sketchguard Node 5:
  Model dim: 2,219,692 → Sketch size: 350
  Compression ratio: 6342.0x
  Using model parameters for aggregation, sketches for filtering
Sketchguard Node 6:
  Model dim: 2,219,692 → Sketch size: 350
  Compression ratio: 6342.0x
  Using model parameters for aggregation, sketches for filtering
Sketchguard Node 7:
  Model dim: 2,219,692 → Sketch size: 350
  Compression ratio: 6342.0x
  Using model parameters for aggregation, sketches for filtering
Sketchguard Node 8:
  Model dim: 2,219,692 → Sketch size: 350
  Compression ratio: 6342.0x
  Using model parameters for aggregation, sketches for filtering
Sketchguard Node 9:
  Model dim: 2,219,692 → Sketch size: 350
  Compression ratio: 6342.0x
  Using model parameters for aggregation, sketches for filtering
Sketchguard Node 10:
  Model dim: 2,219,692 → Sketch size: 350
  Compression ratio: 6342.0x
  Using model parameters for aggregation, sketches for filtering
Sketchguard Node 11:
  Model dim: 2,219,692 → Sketch size: 350
  Compression ratio: 6342.0x
  Using model parameters for aggregation, sketches for filtering
Sketchguard Node 12:
  Model dim: 2,219,692 → Sketch size: 350
  Compression ratio: 6342.0x
  Using model parameters for aggregation, sketches for filtering
Sketchguard Node 13:
  Model dim: 2,219,692 → Sketch size: 350
  Compression ratio: 6342.0x
  Using model parameters for aggregation, sketches for filtering
Sketchguard Node 14:
  Model dim: 2,219,692 → Sketch size: 350
  Compression ratio: 6342.0x
  Using model parameters for aggregation, sketches for filtering
Sketchguard Node 15:
  Model dim: 2,219,692 → Sketch size: 350
  Compression ratio: 6342.0x
  Using model parameters for aggregation, sketches for filtering
Sketchguard Node 16:
  Model dim: 2,219,692 → Sketch size: 350
  Compression ratio: 6342.0x
  Using model parameters for aggregation, sketches for filtering
Sketchguard Node 17:
  Model dim: 2,219,692 → Sketch size: 350
  Compression ratio: 6342.0x
  Using model parameters for aggregation, sketches for filtering
Sketchguard Node 18:
  Model dim: 2,219,692 → Sketch size: 350
  Compression ratio: 6342.0x
  Using model parameters for aggregation, sketches for filtering
Sketchguard Node 19:
  Model dim: 2,219,692 → Sketch size: 350
  Compression ratio: 6342.0x
  Using model parameters for aggregation, sketches for filtering
Sketchguard ALGORITHM (Sketch-based Filtering + State Aggregation)
  - Model dimension: 2,219,692 parameters
  - Config: SketchguardConfig(gamma=2, kappa=1, alpha=0.5, min_neighbors=1, sketch_size=350, network_seed=987654321, attack_detection_window=5)
  - Sketch size: 350
  - Compression ratio: 6342.0x
  - Complexity: O(d + N×k) = O(2,219,692 + 20×350)
  - Theoretical speedup vs BALANCE: 19.9x
Initial test acc across nodes: mean=0.4978 ± 0.0208
Round 001: test acc mean=0.6488 ± 0.0581 | min=0.5302 max=0.7314
         : test loss mean=0.6810 ± 0.0037
         : individual accs = ['0.707018', '0.666667', '0.567879', '0.694301', '0.601411', '0.639301', '0.675983', '0.610470', '0.563380', '0.709220', '0.625000', '0.704000', '0.688368', '0.700862', '0.530249', '0.603493', '0.731369', '0.650752', '0.719965', '0.587204']
         : correct/total = [(806, 1140), (772, 1158), (640, 1127), (804, 1158), (682, 1134), (732, 1145), (774, 1145), (688, 1127), (640, 1136), (800, 1128), (715, 1144), (792, 1125), (793, 1152), (813, 1160), (596, 1124), (691, 1145), (844, 1154), (736, 1131), (833, 1157), (670, 1141)]
         : compromised: 0.6423, honest: 0.6641
         : sketchguard stats = ['Node 0: acc_rate=0.312', 'Node 1: acc_rate=0.364', 'Node 2: acc_rate=0.333']...
Round 002: test acc mean=0.6540 ± 0.0499 | min=0.5320 max=0.7210
         : test loss mean=0.6653 ± 0.0109
         : individual accs = ['0.671053', '0.667530', '0.660160', '0.709845', '0.637566', '0.533624', '0.614847', '0.669033', '0.675176', '0.686170', '0.716783', '0.609778', '0.684896', '0.645690', '0.532028', '0.638428', '0.720971', '0.658709', '0.694901', '0.653812']
         : correct/total = [(765, 1140), (773, 1158), (744, 1127), (822, 1158), (723, 1134), (611, 1145), (704, 1145), (754, 1127), (767, 1136), (774, 1128), (820, 1144), (686, 1125), (789, 1152), (749, 1160), (598, 1124), (731, 1145), (832, 1154), (745, 1131), (804, 1157), (746, 1141)]
         : compromised: 0.6414, honest: 0.6836
         : sketchguard stats = ['Node 0: acc_rate=0.312', 'Node 1: acc_rate=0.364', 'Node 2: acc_rate=0.333']...
Round 003: test acc mean=0.7197 ± 0.0209 | min=0.6809 max=0.7614
         : test loss mean=0.6022 ± 0.0216
         : individual accs = ['0.724561', '0.705527', '0.736469', '0.740933', '0.715168', '0.711790', '0.714410', '0.703638', '0.735915', '0.756206', '0.761364', '0.680889', '0.692708', '0.714655', '0.709075', '0.725764', '0.745234', '0.706454', '0.723423', '0.690622']
         : correct/total = [(826, 1140), (817, 1158), (830, 1127), (858, 1158), (811, 1134), (815, 1145), (818, 1145), (793, 1127), (836, 1136), (853, 1128), (871, 1144), (766, 1125), (798, 1152), (829, 1160), (797, 1124), (831, 1145), (860, 1154), (799, 1131), (837, 1157), (788, 1141)]
         : compromised: 0.7135, honest: 0.7344
         : sketchguard stats = ['Node 0: acc_rate=0.312', 'Node 1: acc_rate=0.364', 'Node 2: acc_rate=0.333']...
Round 004: test acc mean=0.7979 ± 0.0212 | min=0.7424 max=0.8444
         : test loss mean=0.4632 ± 0.0245
         : individual accs = ['0.813158', '0.797064', '0.801242', '0.800518', '0.797178', '0.820961', '0.796507', '0.804791', '0.795775', '0.810284', '0.844406', '0.810667', '0.782986', '0.788793', '0.802491', '0.742358', '0.794627', '0.784262', '0.755402', '0.814198']
         : correct/total = [(927, 1140), (923, 1158), (903, 1127), (927, 1158), (904, 1134), (940, 1145), (912, 1145), (907, 1127), (904, 1136), (914, 1128), (966, 1144), (912, 1125), (902, 1152), (915, 1160), (902, 1124), (850, 1145), (917, 1154), (887, 1131), (874, 1157), (929, 1141)]
         : compromised: 0.7924, honest: 0.8107
         : sketchguard stats = ['Node 0: acc_rate=0.312', 'Node 1: acc_rate=0.364', 'Node 2: acc_rate=0.333']...
Round 005: test acc mean=0.8476 ± 0.0186 | min=0.7952 max=0.8731
         : test loss mean=0.3547 ± 0.0209
         : individual accs = ['0.842105', '0.873057', '0.834073', '0.863558', '0.839506', '0.819214', '0.853275', '0.845608', '0.860915', '0.867021', '0.864510', '0.830222', '0.848958', '0.843966', '0.854093', '0.833188', '0.866551', '0.850575', '0.795160', '0.866784']
         : correct/total = [(960, 1140), (1011, 1158), (940, 1127), (1000, 1158), (952, 1134), (938, 1145), (977, 1145), (953, 1127), (978, 1136), (978, 1128), (989, 1144), (934, 1125), (978, 1152), (979, 1160), (960, 1124), (954, 1145), (1000, 1154), (962, 1131), (920, 1157), (989, 1141)]
         : compromised: 0.8448, honest: 0.8542
         : sketchguard stats = ['Node 0: acc_rate=0.312', 'Node 1: acc_rate=0.364', 'Node 2: acc_rate=0.333']...
Round 006: test acc mean=0.8693 ± 0.0130 | min=0.8349 max=0.8900
         : test loss mean=0.3059 ± 0.0158
         : individual accs = ['0.876316', '0.879102', '0.861579', '0.885147', '0.851852', '0.889956', '0.870742', '0.867791', '0.883803', '0.878546', '0.878497', '0.871111', '0.863715', '0.864655', '0.861210', '0.852402', '0.878683', '0.860301', '0.834918', '0.875548']
         : correct/total = [(999, 1140), (1018, 1158), (971, 1127), (1025, 1158), (966, 1134), (1019, 1145), (997, 1145), (978, 1127), (1004, 1136), (991, 1128), (1005, 1144), (980, 1125), (995, 1152), (1003, 1160), (968, 1124), (976, 1145), (1014, 1154), (973, 1131), (966, 1157), (999, 1141)]
         : compromised: 0.8682, honest: 0.8719
         : sketchguard stats = ['Node 0: acc_rate=0.312', 'Node 1: acc_rate=0.364', 'Node 2: acc_rate=0.333']...
Round 007: test acc mean=0.8842 ± 0.0089 | min=0.8646 max=0.8960
         : test loss mean=0.2820 ± 0.0140
         : individual accs = ['0.887719', '0.895509', '0.880213', '0.881693', '0.880952', '0.895197', '0.890830', '0.888199', '0.892606', '0.892730', '0.888986', '0.882667', '0.876736', '0.875862', '0.885231', '0.864629', '0.896014', '0.877984', '0.865169', '0.886065']
         : correct/total = [(1012, 1140), (1037, 1158), (992, 1127), (1021, 1158), (999, 1134), (1025, 1145), (1020, 1145), (1001, 1127), (1014, 1136), (1007, 1128), (1017, 1144), (993, 1125), (1010, 1152), (1016, 1160), (995, 1124), (990, 1145), (1034, 1154), (993, 1131), (1001, 1157), (1011, 1141)]
         : compromised: 0.8822, honest: 0.8891
         : sketchguard stats = ['Node 0: acc_rate=0.312', 'Node 1: acc_rate=0.364', 'Node 2: acc_rate=0.333']...
Round 008: test acc mean=0.8885 ± 0.0083 | min=0.8707 max=0.9012
         : test loss mean=0.2725 ± 0.0148
         : individual accs = ['0.897368', '0.893782', '0.871340', '0.887737', '0.888889', '0.897817', '0.892576', '0.892635', '0.884683', '0.890957', '0.892483', '0.898667', '0.887153', '0.887931', '0.901246', '0.870742', '0.891681', '0.880637', '0.876404', '0.884312']
         : correct/total = [(1023, 1140), (1035, 1158), (982, 1127), (1028, 1158), (1008, 1134), (1028, 1145), (1022, 1145), (1006, 1127), (1005, 1136), (1005, 1128), (1021, 1144), (1011, 1125), (1022, 1152), (1030, 1160), (1013, 1124), (997, 1145), (1029, 1154), (996, 1131), (1014, 1157), (1009, 1141)]
         : compromised: 0.8868, honest: 0.8923
         : sketchguard stats = ['Node 0: acc_rate=0.312', 'Node 1: acc_rate=0.364', 'Node 2: acc_rate=0.333']...
Round 009: test acc mean=0.8919 ± 0.0112 | min=0.8565 max=0.9066
         : test loss mean=0.2628 ± 0.0190
         : individual accs = ['0.900877', '0.892919', '0.876664', '0.900691', '0.893298', '0.906550', '0.891703', '0.902396', '0.898768', '0.890071', '0.895105', '0.905778', '0.894097', '0.889655', '0.895018', '0.882096', '0.893414', '0.878868', '0.856525', '0.893953']
         : correct/total = [(1027, 1140), (1034, 1158), (988, 1127), (1043, 1158), (1013, 1134), (1038, 1145), (1021, 1145), (1017, 1127), (1021, 1136), (1004, 1128), (1024, 1144), (1019, 1125), (1030, 1152), (1032, 1160), (1006, 1124), (1010, 1145), (1031, 1154), (994, 1131), (991, 1157), (1020, 1141)]
         : compromised: 0.8902, honest: 0.8959
         : sketchguard stats = ['Node 0: acc_rate=0.312', 'Node 1: acc_rate=0.364', 'Node 2: acc_rate=0.333']...
Round 010: test acc mean=0.8972 ± 0.0082 | min=0.8781 max=0.9093
         : test loss mean=0.2524 ± 0.0147
         : individual accs = ['0.904386', '0.898100', '0.886424', '0.906736', '0.900353', '0.905677', '0.896070', '0.899734', '0.897007', '0.901596', '0.895979', '0.909333', '0.901910', '0.900000', '0.903915', '0.890830', '0.897747', '0.879752', '0.878133', '0.889571']
         : correct/total = [(1031, 1140), (1040, 1158), (999, 1127), (1050, 1158), (1021, 1134), (1037, 1145), (1026, 1145), (1014, 1127), (1019, 1136), (1017, 1128), (1025, 1144), (1023, 1125), (1039, 1152), (1044, 1160), (1016, 1124), (1020, 1145), (1036, 1154), (995, 1131), (1016, 1157), (1015, 1141)]
         : compromised: 0.8960, honest: 0.9000
         : sketchguard stats = ['Node 0: acc_rate=0.312', 'Node 1: acc_rate=0.364', 'Node 2: acc_rate=0.333']...

=== FINAL RESULTS ===
Dataset: celeba, Nodes: 20, Graph: erdos, Aggregation: sketchguard
Attack: krum, 70.0% compromised
Final accuracy - Compromised: 0.8960, Honest: 0.9000
Overall test accuracy: mean=0.8972 ± 0.0082

=== Sketchguard SUMMARY ===
Node 0: acceptance=0.312
Node 1: acceptance=0.364
Node 2: acceptance=0.333
Node 3: acceptance=0.375
Node 4: acceptance=0.364
Node 5: acceptance=0.267
Node 6: acceptance=0.286
Node 7: acceptance=0.286
Node 8: acceptance=0.200
Node 9: acceptance=0.308
Node 10: acceptance=0.222
Node 11: acceptance=0.357
Node 12: acceptance=0.333
Node 13: acceptance=0.231
Node 14: acceptance=0.267
Node 15: acceptance=0.273
Node 16: acceptance=0.231
Node 17: acceptance=0.444
Node 18: acceptance=0.312
Node 19: acceptance=0.312

=== PARALLEL EXECUTION TIME (realistic for distributed system) ===
  COMMUNICATION (max across nodes):
    - Sketch transfer: 0.000s (0.0%)
    - Model fetch (accepted): 0.000s (0.0%)
  COMPUTATION (max across nodes):
    - Sketching: 0.610s (97.3%)
    - Filtering: 0.001s (0.2%)
    - Aggregation: 0.016s (2.5%)
  TOTALS:
    - Total computation: 0.627s (100.0%)
    - Total communication: 0.000s (0.0%)
    - Total parallel time: 0.627s

=== PER-NODE AVERAGE TIME ===
  - Sketching: 0.508s
  - Filtering: 0.001s
  - Aggregation: 0.008s
  - Sketch transfer: 0.000s
  - Model fetch: 0.000s
  - Total per node: 0.517s

=== TOTAL COMPUTATIONAL WORK (sum across all nodes) ===
  - Total sketching: 10.164s
  - Total filtering: 0.015s
  - Total aggregation: 0.156s
  - Total sketch transfer: 0.000s
  - Total model fetch: 0.000s
  - Grand total: 10.335s
  - Mean acceptance rate: 0.304

Sketchguard Algorithm Properties:
  - Original dimension: 2,219,692
  - Sketch size: 350
  - Compression ratio: 19.9x
  - Single repetition: No repetitions needed
  - Theoretical complexity: O(d + N×k)
  - Approach: Sketch filtering + state aggregation
