Device: cuda
Seed: 987654321
Looking for images in: /home/student.unimelb.edu.au/mrangwala/Projects/Sketchguard/leaf/data/celeba/data/raw/img_align_celeba
Loading 1 LEAF CelebA train files...
LEAF CelebA train: 9343 users (celebrities), 177457 samples
Looking for images in: /home/student.unimelb.edu.au/mrangwala/Projects/Sketchguard/leaf/data/celeba/data/raw/img_align_celeba
Loading 1 LEAF CelebA test files...
LEAF CelebA test: 9343 users (celebrities), 22831 samples
Found 9343 train users, 9343 test users, 9343 common users
User sample counts range: 31 (max) to 4 (min)
Distributed ALL 9343 users across 20 clients
Users per client: 467 (with 3 clients getting +1 user)
Train partition sizes: [8843, 8998, 8728, 9034, 8866, 8946, 8873, 8776, 8816, 8801, 8913, 8656, 9115, 8921, 8699, 8823, 8912, 8766, 9102, 8869]
Test partition sizes: [1140, 1158, 1127, 1158, 1134, 1145, 1145, 1127, 1136, 1128, 1144, 1125, 1152, 1160, 1124, 1145, 1154, 1131, 1157, 1141]
  Client 0: 8843 train samples, 2 unique classes
  Client 1: 8998 train samples, 2 unique classes
  Client 2: 8728 train samples, 2 unique classes
  Client 3: 9034 train samples, 2 unique classes
  Client 4: 8866 train samples, 2 unique classes
  Client 5: 8946 train samples, 2 unique classes
  Client 6: 8873 train samples, 2 unique classes
  Client 7: 8776 train samples, 2 unique classes
  Client 8: 8816 train samples, 2 unique classes
  Client 9: 8801 train samples, 2 unique classes
  Client 10: 8913 train samples, 2 unique classes
  Client 11: 8656 train samples, 2 unique classes
  Client 12: 9115 train samples, 2 unique classes
  Client 13: 8921 train samples, 2 unique classes
  Client 14: 8699 train samples, 2 unique classes
  Client 15: 8823 train samples, 2 unique classes
  Client 16: 8912 train samples, 2 unique classes
  Client 17: 8766 train samples, 2 unique classes
  Client 18: 9102 train samples, 2 unique classes
  Client 19: 8869 train samples, 2 unique classes
Will sample 4500 samples per client per epoch
Graph: erdos, nodes: 20, edges: 99
Degree statistics: avg=9.90, min=7, max=14
Attack: Compromised 14/20 nodes: [1, 2, 3, 5, 6, 8, 11, 12, 13, 14, 15, 17, 18, 19]
Attack type: gaussian, lambda: 1.0
Model variant: baseline
Model parameters: 2,219,692
UBAR ALGORITHM (Two-Stage Byzantine-resilient)
  - Model dimension: 2,219,692 parameters
  - Rho parameter: 0.30000000000000004
  - Stage 1: Distance-based filtering (select 30% closest neighbors)
  - Stage 2: Performance-based selection (loss comparison)
  - Complexity: O(deg(i)×d + deg(i)×inference)
Initial test acc across nodes: mean=0.4978 ± 0.0208
Round 001: test acc mean=0.6166 ± 0.0610 | min=0.5229 max=0.7214
         : test loss mean=0.6746 ± 0.0082
         : individual accs = ['0.664035', '0.561313', '0.585626', '0.639896', '0.522928', '0.590393', '0.524017', '0.575865', '0.637324', '0.699468', '0.579545', '0.615111', '0.721354', '0.678448', '0.530249', '0.680349', '0.714905', '0.583554', '0.645635', '0.581069']
         : correct/total = [(757, 1140), (650, 1158), (660, 1127), (741, 1158), (593, 1134), (676, 1145), (600, 1145), (649, 1127), (724, 1136), (789, 1128), (663, 1144), (692, 1125), (831, 1152), (787, 1160), (596, 1124), (779, 1145), (825, 1154), (660, 1131), (747, 1157), (663, 1141)]
         : compromised: 0.6125, honest: 0.6261
         : ubar stats = ['Node 0: s1=0.250, s2=0.333', 'Node 1: s1=0.300, s2=0.667', 'Node 2: s1=0.250, s2=0.500']...
Round 002: test acc mean=0.7223 ± 0.0501 | min=0.5525 max=0.7782
         : test loss mean=0.6183 ± 0.0442
         : individual accs = ['0.754386', '0.721071', '0.755102', '0.711572', '0.664903', '0.778166', '0.732751', '0.685892', '0.754401', '0.742908', '0.768357', '0.752000', '0.710069', '0.685345', '0.552491', '0.709170', '0.769497', '0.737401', '0.765774', '0.694128']
         : correct/total = [(860, 1140), (835, 1158), (851, 1127), (824, 1158), (754, 1134), (891, 1145), (839, 1145), (773, 1127), (857, 1136), (838, 1128), (879, 1144), (846, 1125), (818, 1152), (795, 1160), (621, 1124), (812, 1145), (888, 1154), (834, 1131), (886, 1157), (792, 1141)]
         : compromised: 0.7185, honest: 0.7310
         : ubar stats = ['Node 0: s1=0.250, s2=0.333', 'Node 1: s1=0.300, s2=0.500', 'Node 2: s1=0.250, s2=0.500']...
Round 003: test acc mean=0.8081 ± 0.0333 | min=0.7371 max=0.8681
         : test loss mean=0.4714 ± 0.0675
         : individual accs = ['0.839474', '0.808290', '0.821650', '0.769430', '0.769841', '0.868122', '0.809607', '0.807453', '0.845951', '0.836879', '0.838287', '0.808889', '0.754340', '0.737069', '0.768683', '0.787773', '0.842288', '0.816976', '0.817632', '0.812445']
         : correct/total = [(957, 1140), (936, 1158), (926, 1127), (891, 1158), (873, 1134), (994, 1145), (927, 1145), (910, 1127), (961, 1136), (944, 1128), (959, 1144), (910, 1125), (869, 1152), (855, 1160), (864, 1124), (902, 1145), (972, 1154), (924, 1131), (946, 1157), (927, 1141)]
         : compromised: 0.8019, honest: 0.8224
         : ubar stats = ['Node 0: s1=0.250, s2=0.444', 'Node 1: s1=0.300, s2=0.444', 'Node 2: s1=0.250, s2=0.500']...
Round 004: test acc mean=0.8546 ± 0.0192 | min=0.8034 max=0.8830
         : test loss mean=0.3457 ± 0.0362
         : individual accs = ['0.864912', '0.876511', '0.856256', '0.840242', '0.831570', '0.882969', '0.862009', '0.842059', '0.875880', '0.875887', '0.877622', '0.861333', '0.836806', '0.803448', '0.854982', '0.845415', '0.859619', '0.838196', '0.841832', '0.864154']
         : correct/total = [(986, 1140), (1015, 1158), (965, 1127), (973, 1158), (943, 1134), (1011, 1145), (987, 1145), (949, 1127), (995, 1136), (988, 1128), (1004, 1144), (969, 1125), (964, 1152), (932, 1160), (961, 1124), (968, 1145), (992, 1154), (948, 1131), (974, 1157), (986, 1141)]
         : compromised: 0.8529, honest: 0.8586
         : ubar stats = ['Node 0: s1=0.250, s2=0.417', 'Node 1: s1=0.300, s2=0.417', 'Node 2: s1=0.250, s2=0.500']...
Round 005: test acc mean=0.8637 ± 0.0178 | min=0.8140 max=0.8848
         : test loss mean=0.3157 ± 0.0286
         : individual accs = ['0.855263', '0.873921', '0.858030', '0.865285', '0.874780', '0.813974', '0.876856', '0.856256', '0.883803', '0.884752', '0.873252', '0.881778', '0.858507', '0.856034', '0.860320', '0.867249', '0.877816', '0.855880', '0.824546', '0.876424']
         : correct/total = [(975, 1140), (1012, 1158), (967, 1127), (1002, 1158), (992, 1134), (932, 1145), (1004, 1145), (965, 1127), (1004, 1136), (998, 1128), (999, 1144), (992, 1125), (989, 1152), (993, 1160), (967, 1124), (993, 1145), (1013, 1154), (968, 1131), (954, 1157), (1000, 1141)]
         : compromised: 0.8609, honest: 0.8704
         : ubar stats = ['Node 0: s1=0.250, s2=0.533', 'Node 1: s1=0.300, s2=0.400', 'Node 2: s1=0.250, s2=0.500']...
Round 006: test acc mean=0.8832 ± 0.0090 | min=0.8686 max=0.9022
         : test loss mean=0.2809 ± 0.0155
         : individual accs = ['0.879825', '0.884283', '0.876664', '0.877375', '0.878307', '0.902183', '0.881223', '0.881988', '0.896127', '0.885638', '0.892483', '0.882667', '0.873264', '0.873276', '0.896797', '0.872489', '0.895147', '0.877984', '0.868626', '0.886941']
         : correct/total = [(1003, 1140), (1024, 1158), (988, 1127), (1016, 1158), (996, 1134), (1033, 1145), (1009, 1145), (994, 1127), (1018, 1136), (999, 1128), (1021, 1144), (993, 1125), (1006, 1152), (1013, 1160), (1008, 1124), (999, 1145), (1033, 1154), (993, 1131), (1005, 1157), (1012, 1141)]
         : compromised: 0.8821, honest: 0.8856
         : ubar stats = ['Node 0: s1=0.250, s2=0.500', 'Node 1: s1=0.300, s2=0.389', 'Node 2: s1=0.250, s2=0.500']...
Round 007: test acc mean=0.8888 ± 0.0079 | min=0.8718 max=0.9013
         : test loss mean=0.2672 ± 0.0137
         : individual accs = ['0.892105', '0.894646', '0.885537', '0.883420', '0.891534', '0.901310', '0.889083', '0.894410', '0.891725', '0.899823', '0.895979', '0.880889', '0.883681', '0.885345', '0.897687', '0.881223', '0.896014', '0.871795', '0.874676', '0.884312']
         : correct/total = [(1017, 1140), (1036, 1158), (998, 1127), (1023, 1158), (1011, 1134), (1032, 1145), (1018, 1145), (1008, 1127), (1013, 1136), (1015, 1128), (1025, 1144), (991, 1125), (1018, 1152), (1027, 1160), (1009, 1124), (1009, 1145), (1034, 1154), (986, 1131), (1012, 1157), (1009, 1141)]
         : compromised: 0.8861, honest: 0.8950
         : ubar stats = ['Node 0: s1=0.250, s2=0.476', 'Node 1: s1=0.300, s2=0.381', 'Node 2: s1=0.250, s2=0.500']...
Round 008: test acc mean=0.8937 ± 0.0087 | min=0.8755 max=0.9120
         : test loss mean=0.2577 ± 0.0140
         : individual accs = ['0.904386', '0.892055', '0.891748', '0.890328', '0.891534', '0.899563', '0.895197', '0.903283', '0.890845', '0.891844', '0.896853', '0.912000', '0.894097', '0.893103', '0.905694', '0.882096', '0.896880', '0.877984', '0.875540', '0.889571']
         : correct/total = [(1031, 1140), (1033, 1158), (1005, 1127), (1031, 1158), (1011, 1134), (1030, 1145), (1025, 1145), (1018, 1127), (1012, 1136), (1006, 1128), (1026, 1144), (1026, 1125), (1030, 1152), (1036, 1160), (1018, 1124), (1010, 1145), (1035, 1154), (993, 1131), (1013, 1157), (1015, 1141)]
         : compromised: 0.8921, honest: 0.8975
         : ubar stats = ['Node 0: s1=0.250, s2=0.458', 'Node 1: s1=0.300, s2=0.375', 'Node 2: s1=0.250, s2=0.562']...
Round 009: test acc mean=0.8970 ± 0.0099 | min=0.8660 max=0.9092
         : test loss mean=0.2521 ± 0.0164
         : individual accs = ['0.900877', '0.897237', '0.885537', '0.903282', '0.904762', '0.909170', '0.903057', '0.907720', '0.899648', '0.888298', '0.898601', '0.905778', '0.901910', '0.894828', '0.899466', '0.889083', '0.902946', '0.884173', '0.866033', '0.897458']
         : correct/total = [(1027, 1140), (1039, 1158), (998, 1127), (1046, 1158), (1026, 1134), (1041, 1145), (1034, 1145), (1023, 1127), (1022, 1136), (1002, 1128), (1028, 1144), (1019, 1125), (1039, 1152), (1038, 1160), (1011, 1124), (1018, 1145), (1042, 1154), (1000, 1131), (1002, 1157), (1024, 1141)]
         : compromised: 0.8955, honest: 0.9005
         : ubar stats = ['Node 0: s1=0.250, s2=0.444', 'Node 1: s1=0.300, s2=0.444', 'Node 2: s1=0.250, s2=0.556']...
Round 010: test acc mean=0.8990 ± 0.0082 | min=0.8816 max=0.9102
         : test loss mean=0.2468 ± 0.0140
         : individual accs = ['0.902632', '0.900691', '0.886424', '0.910190', '0.902116', '0.907424', '0.897817', '0.902396', '0.896127', '0.900709', '0.896853', '0.905778', '0.902778', '0.902586', '0.908363', '0.888210', '0.909012', '0.884173', '0.881590', '0.893953']
         : correct/total = [(1029, 1140), (1043, 1158), (999, 1127), (1054, 1158), (1023, 1134), (1039, 1145), (1028, 1145), (1017, 1127), (1018, 1136), (1016, 1128), (1026, 1144), (1019, 1125), (1040, 1152), (1047, 1160), (1021, 1124), (1017, 1145), (1049, 1154), (1000, 1131), (1020, 1157), (1020, 1141)]
         : compromised: 0.8976, honest: 0.9023
         : ubar stats = ['Node 0: s1=0.250, s2=0.433', 'Node 1: s1=0.300, s2=0.433', 'Node 2: s1=0.250, s2=0.600']...

=== FINAL RESULTS ===
Dataset: celeba, Nodes: 20, Graph: erdos, Aggregation: ubar
Attack: gaussian, 70.0% compromised
Final accuracy - Compromised: 0.8976, Honest: 0.9023
Overall test accuracy: mean=0.8990 ± 0.0082

=== UBAR SUMMARY ===
Node 0: stage1=0.250, stage2=0.433, overall=0.108
Node 1: stage1=0.300, stage2=0.433, overall=0.130
Node 2: stage1=0.250, stage2=0.600, overall=0.150
Node 3: stage1=0.286, stage2=0.650, overall=0.186
Node 4: stage1=0.222, stage2=0.700, overall=0.156
Node 5: stage1=0.300, stage2=0.367, overall=0.110
Node 6: stage1=0.250, stage2=0.467, overall=0.117
Node 7: stage1=0.273, stage2=0.567, overall=0.155
Node 8: stage1=0.286, stage2=0.500, overall=0.143
Node 9: stage1=0.273, stage2=0.500, overall=0.136
Node 10: stage1=0.250, stage2=0.500, overall=0.125
Node 11: stage1=0.250, stage2=0.400, overall=0.100
Node 12: stage1=0.250, stage2=0.600, overall=0.150
Node 13: stage1=0.222, stage2=0.500, overall=0.111
Node 14: stage1=0.286, stage2=0.550, overall=0.157
Node 15: stage1=0.222, stage2=0.500, overall=0.111
Node 16: stage1=0.286, stage2=0.650, overall=0.186
Node 17: stage1=0.250, stage2=0.500, overall=0.125
Node 18: stage1=0.250, stage2=0.533, overall=0.133
Node 19: stage1=0.300, stage2=0.467, overall=0.140

=== PARALLEL EXECUTION TIME (realistic for distributed system) ===
  COMMUNICATION (max across nodes):
    - Full model transfer: 0.000s (0.0%)
  COMPUTATION (max across nodes):
    - Distance computation: 0.035s (15.8%)
    - Loss computation: 0.184s (82.3%)
    - Aggregation: 0.004s (1.8%)
  TOTALS:
    - Total computation: 0.223s (100.0%)
    - Total communication: 0.000s (0.0%)
    - Total parallel time: 0.223s

=== PER-NODE AVERAGE TIME ===
  - Distance computation: 0.025s
  - Loss computation: 0.141s
  - Aggregation: 0.003s
  - Model transfer: 0.000s
  - Total per node: 0.169s

=== TOTAL COMPUTATIONAL WORK (sum across all nodes) ===
  - Total distance computation: 0.509s
  - Total loss computation: 2.813s
  - Total aggregation: 0.058s
  - Total model transfer: 0.000s
  - Grand total: 3.380s
  - Mean Stage 1 acceptance rate: 0.263
  - Mean Stage 2 acceptance rate: 0.521
  - Overall acceptance rate: 0.137

UBAR Algorithm Properties:
  - Model dimension: 2,219,692
  - Rho parameter: 0.30000000000000004
  - Two-stage approach: Distance filtering + loss evaluation
  - Stage 1 selects: 30% of neighbors
  - Stage 2 uses: Training sample loss comparison
  - Theoretical complexity: O(deg(i)×d + deg(i)×inference)
  - Approach: UBAR paper implementation
