Device: cuda
Seed: 987654321
Looking for images in: /home/student.unimelb.edu.au/mrangwala/Projects/Sketchguard/leaf/data/celeba/data/raw/img_align_celeba
Loading 1 LEAF CelebA train files...
LEAF CelebA train: 9343 users (celebrities), 177457 samples
Looking for images in: /home/student.unimelb.edu.au/mrangwala/Projects/Sketchguard/leaf/data/celeba/data/raw/img_align_celeba
Loading 1 LEAF CelebA test files...
LEAF CelebA test: 9343 users (celebrities), 22831 samples
Found 9343 train users, 9343 test users, 9343 common users
User sample counts range: 31 (max) to 4 (min)
Distributed ALL 9343 users across 20 clients
Users per client: 467 (with 3 clients getting +1 user)
Train partition sizes: [8843, 8998, 8728, 9034, 8866, 8946, 8873, 8776, 8816, 8801, 8913, 8656, 9115, 8921, 8699, 8823, 8912, 8766, 9102, 8869]
Test partition sizes: [1140, 1158, 1127, 1158, 1134, 1145, 1145, 1127, 1136, 1128, 1144, 1125, 1152, 1160, 1124, 1145, 1154, 1131, 1157, 1141]
  Client 0: 8843 train samples, 2 unique classes
  Client 1: 8998 train samples, 2 unique classes
  Client 2: 8728 train samples, 2 unique classes
  Client 3: 9034 train samples, 2 unique classes
  Client 4: 8866 train samples, 2 unique classes
  Client 5: 8946 train samples, 2 unique classes
  Client 6: 8873 train samples, 2 unique classes
  Client 7: 8776 train samples, 2 unique classes
  Client 8: 8816 train samples, 2 unique classes
  Client 9: 8801 train samples, 2 unique classes
  Client 10: 8913 train samples, 2 unique classes
  Client 11: 8656 train samples, 2 unique classes
  Client 12: 9115 train samples, 2 unique classes
  Client 13: 8921 train samples, 2 unique classes
  Client 14: 8699 train samples, 2 unique classes
  Client 15: 8823 train samples, 2 unique classes
  Client 16: 8912 train samples, 2 unique classes
  Client 17: 8766 train samples, 2 unique classes
  Client 18: 9102 train samples, 2 unique classes
  Client 19: 8869 train samples, 2 unique classes
Will sample 4500 samples per client per epoch
Graph: erdos, nodes: 20, edges: 48
Degree statistics: avg=4.80, min=2, max=7
Attack: Compromised 6/20 nodes: [5, 12, 13, 14, 17, 18]
Attack type: krum, lambda: 1.0
Model variant: baseline
Model parameters: 2,219,692
BALANCE algorithm:
Balance Config: BALANCEConfig(gamma=2, kappa=1, alpha=0.5, min_neighbors=1)
  - Model dimension: 2,219,692 parameters
  - Complexity: O(N×d) = O(20×2,219,692)
Initial test acc across nodes: mean=0.4978 ± 0.0208
Round 001: test acc mean=0.6457 ± 0.0584 | min=0.5197 max=0.7200
         : test loss mean=0.6806 ± 0.0042
         : individual accs = ['0.706140', '0.674439', '0.600710', '0.704663', '0.537919', '0.530131', '0.658515', '0.624667', '0.636444', '0.682624', '0.664336', '0.696000', '0.706597', '0.658621', '0.641459', '0.655895', '0.686308', '0.609195', '0.719965', '0.519720']
         : correct/total = [(805, 1140), (781, 1158), (677, 1127), (816, 1158), (610, 1134), (607, 1145), (754, 1145), (704, 1127), (723, 1136), (770, 1128), (760, 1144), (783, 1125), (814, 1152), (764, 1160), (721, 1124), (751, 1145), (792, 1154), (689, 1131), (833, 1157), (593, 1141)]
         : compromised: 0.6443, honest: 0.6463
Round 002: test acc mean=0.6721 ± 0.0379 | min=0.5694 max=0.7342
         : test loss mean=0.6579 ± 0.0213
         : individual accs = ['0.669298', '0.666667', '0.685004', '0.674439', '0.601411', '0.569432', '0.678603', '0.666371', '0.734155', '0.699468', '0.708916', '0.688889', '0.697049', '0.637931', '0.648577', '0.654148', '0.723570', '0.658709', '0.706137', '0.673094']
         : correct/total = [(763, 1140), (772, 1158), (772, 1127), (781, 1158), (682, 1134), (652, 1145), (777, 1145), (751, 1127), (834, 1136), (789, 1128), (811, 1144), (775, 1125), (803, 1152), (740, 1160), (729, 1124), (749, 1145), (835, 1154), (745, 1131), (817, 1157), (768, 1141)]
         : compromised: 0.6530, honest: 0.6803
Round 003: test acc mean=0.7206 ± 0.0366 | min=0.6508 max=0.7958
         : test loss mean=0.6110 ± 0.0395
         : individual accs = ['0.737719', '0.703800', '0.716060', '0.764249', '0.650794', '0.720524', '0.740611', '0.680568', '0.795775', '0.768617', '0.763112', '0.764444', '0.671007', '0.718103', '0.690391', '0.715284', '0.706239', '0.676393', '0.710458', '0.716915']
         : correct/total = [(841, 1140), (815, 1158), (807, 1127), (885, 1158), (738, 1134), (825, 1145), (848, 1145), (767, 1127), (904, 1136), (867, 1128), (873, 1144), (860, 1125), (773, 1152), (833, 1160), (776, 1124), (819, 1145), (815, 1154), (765, 1131), (822, 1157), (818, 1141)]
         : compromised: 0.6978, honest: 0.7303
Round 004: test acc mean=0.7770 ± 0.0297 | min=0.7165 max=0.8248
         : test loss mean=0.5362 ± 0.0488
         : individual accs = ['0.773684', '0.749568', '0.765750', '0.808290', '0.753968', '0.803493', '0.749345', '0.782609', '0.824824', '0.821809', '0.813811', '0.817778', '0.742188', '0.791379', '0.755338', '0.773799', '0.759965', '0.754200', '0.716508', '0.780894']
         : correct/total = [(882, 1140), (868, 1158), (863, 1127), (936, 1158), (855, 1134), (920, 1145), (858, 1145), (882, 1127), (937, 1136), (927, 1128), (931, 1144), (920, 1125), (855, 1152), (918, 1160), (849, 1124), (886, 1145), (877, 1154), (853, 1131), (829, 1157), (891, 1141)]
         : compromised: 0.7605, honest: 0.7840
Round 005: test acc mean=0.8062 ± 0.0301 | min=0.7453 max=0.8652
         : test loss mean=0.4609 ± 0.0509
         : individual accs = ['0.821053', '0.800518', '0.745342', '0.843696', '0.791005', '0.761572', '0.812227', '0.812777', '0.848592', '0.865248', '0.840909', '0.826667', '0.772569', '0.808621', '0.784698', '0.797380', '0.819757', '0.792219', '0.768366', '0.809816']
         : correct/total = [(936, 1140), (927, 1158), (840, 1127), (977, 1158), (897, 1134), (872, 1145), (930, 1145), (916, 1127), (964, 1136), (976, 1128), (962, 1144), (930, 1125), (890, 1152), (938, 1160), (882, 1124), (913, 1145), (946, 1154), (896, 1131), (889, 1157), (924, 1141)]
         : compromised: 0.7813, honest: 0.8168
Round 006: test acc mean=0.8424 ± 0.0236 | min=0.7857 max=0.8794
         : test loss mean=0.3934 ± 0.0379
         : individual accs = ['0.842982', '0.847150', '0.810115', '0.860104', '0.831570', '0.860262', '0.841048', '0.845608', '0.872359', '0.854610', '0.879371', '0.869333', '0.828993', '0.862931', '0.807829', '0.818341', '0.850087', '0.823165', '0.785653', '0.856266']
         : correct/total = [(961, 1140), (981, 1158), (913, 1127), (996, 1158), (943, 1134), (985, 1145), (963, 1145), (953, 1127), (991, 1136), (964, 1128), (1006, 1144), (978, 1125), (955, 1152), (1001, 1160), (908, 1124), (937, 1145), (981, 1154), (931, 1131), (909, 1157), (977, 1141)]
         : compromised: 0.8281, honest: 0.8485
Round 007: test acc mean=0.8573 ± 0.0177 | min=0.8258 max=0.8795
         : test loss mean=0.3519 ± 0.0324
         : individual accs = ['0.863158', '0.868739', '0.829636', '0.870466', '0.853616', '0.879476', '0.862009', '0.864241', '0.870599', '0.876773', '0.854895', '0.878222', '0.842014', '0.873276', '0.843416', '0.827074', '0.875217', '0.825818', '0.831461', '0.855390']
         : correct/total = [(984, 1140), (1006, 1158), (935, 1127), (1008, 1158), (968, 1134), (1007, 1145), (987, 1145), (974, 1127), (989, 1136), (989, 1128), (978, 1144), (988, 1125), (970, 1152), (1013, 1160), (948, 1124), (947, 1145), (1010, 1154), (934, 1131), (962, 1157), (976, 1141)]
         : compromised: 0.8492, honest: 0.8607
Round 008: test acc mean=0.8709 ± 0.0099 | min=0.8509 max=0.8870
         : test loss mean=0.3185 ± 0.0174
         : individual accs = ['0.873684', '0.884283', '0.850932', '0.866149', '0.864198', '0.884716', '0.880349', '0.879326', '0.875000', '0.875000', '0.857517', '0.874667', '0.865451', '0.876724', '0.887011', '0.863755', '0.876083', '0.862069', '0.855661', '0.865907']
         : correct/total = [(996, 1140), (1024, 1158), (959, 1127), (1003, 1158), (980, 1134), (1013, 1145), (1008, 1145), (991, 1127), (994, 1136), (987, 1128), (981, 1144), (984, 1125), (997, 1152), (1017, 1160), (997, 1124), (989, 1145), (1011, 1154), (975, 1131), (990, 1157), (988, 1141)]
         : compromised: 0.8719, honest: 0.8705
Round 009: test acc mean=0.8787 ± 0.0161 | min=0.8358 max=0.8939
         : test loss mean=0.2951 ± 0.0256
         : individual accs = ['0.893860', '0.886010', '0.863354', '0.888601', '0.880071', '0.889083', '0.886463', '0.887311', '0.885563', '0.889184', '0.888112', '0.890667', '0.870660', '0.886207', '0.877224', '0.867249', '0.882149', '0.837312', '0.835782', '0.888694']
         : correct/total = [(1019, 1140), (1026, 1158), (973, 1127), (1029, 1158), (998, 1134), (1018, 1145), (1015, 1145), (1000, 1127), (1006, 1136), (1003, 1128), (1016, 1144), (1002, 1125), (1003, 1152), (1028, 1160), (986, 1124), (993, 1145), (1018, 1154), (947, 1131), (967, 1157), (1014, 1141)]
         : compromised: 0.8660, honest: 0.8841
Round 010: test acc mean=0.8878 ± 0.0101 | min=0.8626 max=0.8998
         : test loss mean=0.2763 ± 0.0164
         : individual accs = ['0.899123', '0.894646', '0.870453', '0.896373', '0.882716', '0.897817', '0.882096', '0.894410', '0.893486', '0.899823', '0.882867', '0.896000', '0.892361', '0.892241', '0.893238', '0.875109', '0.885615', '0.876216', '0.862576', '0.888694']
         : correct/total = [(1025, 1140), (1036, 1158), (981, 1127), (1038, 1158), (1001, 1134), (1028, 1145), (1010, 1145), (1008, 1127), (1015, 1136), (1015, 1128), (1010, 1144), (1008, 1125), (1028, 1152), (1035, 1160), (1004, 1124), (1002, 1145), (1022, 1154), (991, 1131), (998, 1157), (1014, 1141)]
         : compromised: 0.8857, honest: 0.8887

=== FINAL RESULTS ===
Dataset: celeba, Nodes: 20, Graph: erdos, Aggregation: balance
Attack: krum, 30.0% compromised
Final accuracy - Compromised: 0.8857, Honest: 0.8887
Overall test accuracy: mean=0.8878 ± 0.0101

=== BALANCE SUMMARY ===
Node 0: acceptance=0.833
Node 1: acceptance=1.000
Node 2: acceptance=0.600
Node 3: acceptance=0.750
Node 4: acceptance=0.500
Node 5: acceptance=0.400
Node 6: acceptance=0.800
Node 7: acceptance=0.600
Node 8: acceptance=0.500
Node 9: acceptance=1.000
Node 10: acceptance=0.750
Node 11: acceptance=0.571
Node 12: acceptance=0.714
Node 13: acceptance=0.750
Node 14: acceptance=0.429
Node 15: acceptance=0.500
Node 16: acceptance=0.400
Node 17: acceptance=0.600
Node 18: acceptance=0.900
Node 19: acceptance=1.000

=== PARALLEL EXECUTION TIME (realistic for distributed system) ===
  COMMUNICATION (max across nodes):
    - Full model transfer: 0.000s (0.1%)
  COMPUTATION (max across nodes):
    - Filtering: 0.023s (69.2%)
    - Aggregation: 0.010s (30.8%)
  TOTALS:
    - Total computation: 0.034s (99.9%)
    - Total communication: 0.000s (0.1%)
    - Total parallel time: 0.034s

=== PER-NODE AVERAGE TIME ===
  - Filtering: 0.015s
  - Aggregation: 0.004s
  - Model transfer: 0.000s
  - Total per node: 0.019s

=== TOTAL COMPUTATIONAL WORK (sum across all nodes) ===
  - Total filtering: 0.292s
  - Total aggregation: 0.078s
  - Total model transfer: 0.000s
  - Grand total: 0.371s
  - Mean acceptance rate: 0.680

BALANCE Algorithm Properties:
  - Model dimension: 2,219,692
  - No compression: Full parameter comparison
  - Theoretical complexity: O(deg(i)×d)
  - Approach: Full parameter filtering + averaging
