Device: cuda
Seed: 987654321
Loading 36 LEAF FEMNIST train files...
LEAF FEMNIST train: 3597 users, 734463 samples
Loading 36 LEAF FEMNIST test files...
LEAF FEMNIST test: 3597 users, 83388 samples
Found 3597 train users, 3597 test users, 3597 common users
User sample counts range: 525 (max) to 17 (min)
Distributed ALL 3597 users across 20 clients
Users per client: 179 (with 17 clients getting +1 user)
Train partition sizes: [36360, 37070, 35957, 38262, 36024, 37732, 36921, 38328, 36867, 37683, 36507, 36915, 36007, 37001, 35681, 35453, 36585, 36801, 35964, 36345]
Test partition sizes: [4128, 4203, 4081, 4333, 4091, 4287, 4193, 4349, 4191, 4277, 4143, 4193, 4093, 4197, 4052, 4029, 4153, 4183, 4084, 4128]
  Client 0: 36360 train samples, 62 unique classes
  Client 1: 37070 train samples, 62 unique classes
  Client 2: 35957 train samples, 62 unique classes
  Client 3: 38262 train samples, 62 unique classes
  Client 4: 36024 train samples, 62 unique classes
  Client 5: 37732 train samples, 62 unique classes
  Client 6: 36921 train samples, 62 unique classes
  Client 7: 38328 train samples, 62 unique classes
  Client 8: 36867 train samples, 62 unique classes
  Client 9: 37683 train samples, 62 unique classes
  Client 10: 36507 train samples, 62 unique classes
  Client 11: 36915 train samples, 62 unique classes
  Client 12: 36007 train samples, 62 unique classes
  Client 13: 37001 train samples, 62 unique classes
  Client 14: 35681 train samples, 62 unique classes
  Client 15: 35453 train samples, 62 unique classes
  Client 16: 36585 train samples, 62 unique classes
  Client 17: 36801 train samples, 62 unique classes
  Client 18: 35964 train samples, 62 unique classes
  Client 19: 36345 train samples, 62 unique classes
Will sample 4500 samples per client per epoch
Graph: erdos, nodes: 20, edges: 48
Degree statistics: avg=4.80, min=2, max=7
Attack: Compromised 8/20 nodes: [1, 5, 11, 12, 13, 14, 17, 18]
Attack type: directed_deviation, lambda: 1.0
Model variant: baseline
Model parameters: 6,603,710
Initial test acc across nodes: mean=0.0168 ± 0.0139
Round 001: test acc mean=0.0202 ± 0.0174 | min=0.0039 max=0.0582
         : test loss mean=22149.5125 ± 29947.8469
         : individual accs = ['0.040698', '0.004283', '0.015927', '0.024694', '0.058176', '0.021693', '0.006201', '0.041389', '0.014078', '0.009586', '0.010138', '0.018841', '0.003909', '0.004765', '0.045410', '0.009432', '0.004093', '0.011475', '0.003918', '0.054506']
         : correct/total = [(168, 4128), (18, 4203), (65, 4081), (107, 4333), (238, 4091), (93, 4287), (26, 4193), (180, 4349), (59, 4191), (41, 4277), (42, 4143), (79, 4193), (16, 4093), (20, 4197), (184, 4052), (38, 4029), (17, 4153), (48, 4183), (16, 4084), (225, 4128)]
         : compromised: 0.0143, honest: 0.0241
Round 002: test acc mean=0.0373 ± 0.0198 | min=0.0024 max=0.0576
         : test loss mean=638206057637133.7500 ± 2781873929747937.0000
         : individual accs = ['0.003391', '0.002379', '0.057584', '0.044773', '0.044977', '0.048752', '0.048891', '0.043918', '0.047960', '0.047697', '0.047309', '0.046983', '0.004398', '0.047177', '0.003702', '0.053860', '0.051288', '0.003586', '0.052155', '0.045058']
         : correct/total = [(14, 4128), (10, 4203), (235, 4081), (194, 4333), (184, 4091), (209, 4287), (205, 4193), (191, 4349), (201, 4191), (204, 4277), (196, 4143), (197, 4193), (18, 4093), (198, 4197), (15, 4052), (217, 4029), (213, 4153), (15, 4183), (213, 4084), (186, 4128)]
         : compromised: 0.0261, honest: 0.0447
Round 003: test acc mean=0.0426 ± 0.0155 | min=0.0026 max=0.0582
         : test loss mean=211026116.2530 ± 911731576.2749
         : individual accs = ['0.045785', '0.042589', '0.056114', '0.047773', '0.051088', '0.048052', '0.002623', '0.058174', '0.043188', '0.003741', '0.045619', '0.046983', '0.050574', '0.047177', '0.046644', '0.050633', '0.047195', '0.048291', '0.054358', '0.014777']
         : correct/total = [(189, 4128), (179, 4203), (229, 4081), (207, 4333), (209, 4091), (206, 4287), (11, 4193), (253, 4349), (181, 4191), (16, 4277), (189, 4143), (197, 4193), (207, 4093), (198, 4197), (189, 4052), (204, 4029), (196, 4153), (202, 4183), (222, 4084), (61, 4128)]
         : compromised: 0.0481, honest: 0.0389
Round 004: test acc mean=0.0460 ± 0.0117 | min=0.0047 max=0.0618
         : test loss mean=15746374.3299 ± 64765136.8226
         : individual accs = ['0.045785', '0.036878', '0.056114', '0.043157', '0.052554', '0.052484', '0.053899', '0.049207', '0.043188', '0.043488', '0.055998', '0.061770', '0.050574', '0.047177', '0.051579', '0.050633', '0.030340', '0.046139', '0.004652', '0.043847']
         : correct/total = [(189, 4128), (155, 4203), (229, 4081), (187, 4333), (215, 4091), (225, 4287), (226, 4193), (214, 4349), (181, 4191), (186, 4277), (232, 4143), (259, 4193), (207, 4093), (198, 4197), (209, 4052), (204, 4029), (126, 4153), (193, 4183), (19, 4084), (181, 4128)]
         : compromised: 0.0439, honest: 0.0474
Round 005: test acc mean=0.0485 ± 0.0043 | min=0.0422 max=0.0582
         : test loss mean=316204.8126 ± 845312.1055
         : individual accs = ['0.045785', '0.042589', '0.056114', '0.043157', '0.052554', '0.052484', '0.042213', '0.058174', '0.043188', '0.046528', '0.051653', '0.046745', '0.048620', '0.049559', '0.047878', '0.050385', '0.047195', '0.050920', '0.050196', '0.043847']
         : correct/total = [(189, 4128), (179, 4203), (229, 4081), (187, 4333), (215, 4091), (225, 4287), (177, 4193), (253, 4349), (181, 4191), (199, 4277), (214, 4143), (196, 4193), (199, 4093), (208, 4197), (194, 4052), (203, 4029), (196, 4153), (213, 4183), (205, 4084), (181, 4128)]
         : compromised: 0.0486, honest: 0.0484
Round 006: test acc mean=0.0445 ± 0.0117 | min=0.0033 max=0.0582
         : test loss mean=104325.8563 ± 227256.0603
         : individual accs = ['0.045785', '0.042589', '0.056114', '0.036464', '0.048643', '0.003266', '0.042213', '0.058174', '0.043188', '0.046528', '0.055998', '0.036728', '0.050818', '0.046462', '0.046644', '0.050633', '0.030340', '0.050920', '0.054358', '0.043847']
         : correct/total = [(189, 4128), (179, 4203), (229, 4081), (158, 4333), (199, 4091), (14, 4287), (177, 4193), (253, 4349), (181, 4191), (199, 4277), (232, 4143), (154, 4193), (208, 4093), (195, 4197), (189, 4052), (204, 4029), (126, 4153), (213, 4183), (222, 4084), (181, 4128)]
         : compromised: 0.0415, honest: 0.0465
Round 007: test acc mean=0.0429 ± 0.0144 | min=0.0033 max=0.0582
         : test loss mean=905.4835 ± 2948.5765
         : individual accs = ['0.045785', '0.042589', '0.048763', '0.036464', '0.003667', '0.003266', '0.042213', '0.058174', '0.040802', '0.046528', '0.055998', '0.041736', '0.050818', '0.049559', '0.046644', '0.041698', '0.040693', '0.050920', '0.055583', '0.055475']
         : correct/total = [(189, 4128), (179, 4203), (199, 4081), (158, 4333), (15, 4091), (14, 4287), (177, 4193), (253, 4349), (171, 4191), (199, 4277), (232, 4143), (175, 4193), (208, 4093), (208, 4197), (189, 4052), (168, 4029), (169, 4153), (213, 4183), (227, 4084), (229, 4128)]
         : compromised: 0.0426, honest: 0.0430
Round 008: test acc mean=0.0488 ± 0.0064 | min=0.0365 max=0.0582
         : test loss mean=305.8670 ± 1315.9986
         : individual accs = ['0.045785', '0.042589', '0.048763', '0.036464', '0.057932', '0.052484', '0.042213', '0.058174', '0.040802', '0.046528', '0.055998', '0.041736', '0.050818', '0.049559', '0.046644', '0.056590', '0.040693', '0.050920', '0.055583', '0.055475']
         : correct/total = [(189, 4128), (179, 4203), (199, 4081), (158, 4333), (237, 4091), (225, 4287), (177, 4193), (253, 4349), (171, 4191), (199, 4277), (232, 4143), (175, 4193), (208, 4093), (208, 4197), (189, 4052), (228, 4029), (169, 4153), (213, 4183), (227, 4084), (229, 4128)]
         : compromised: 0.0488, honest: 0.0488
Round 009: test acc mean=0.0487 ± 0.0064 | min=0.0365 max=0.0582
         : test loss mean=3.9351 ± 0.0071
         : individual accs = ['0.045785', '0.042589', '0.048763', '0.036464', '0.057932', '0.050618', '0.042213', '0.058174', '0.040802', '0.046528', '0.055998', '0.041736', '0.050818', '0.049559', '0.046644', '0.056590', '0.040693', '0.050920', '0.055583', '0.055475']
         : correct/total = [(189, 4128), (179, 4203), (199, 4081), (158, 4333), (237, 4091), (217, 4287), (177, 4193), (253, 4349), (171, 4191), (199, 4277), (232, 4143), (175, 4193), (208, 4093), (208, 4197), (189, 4052), (228, 4029), (169, 4153), (213, 4183), (227, 4084), (229, 4128)]
         : compromised: 0.0486, honest: 0.0488
Round 010: test acc mean=0.0498 ± 0.0060 | min=0.0365 max=0.0582
         : test loss mean=296.2870 ± 1274.2231
         : individual accs = ['0.045785', '0.052344', '0.048763', '0.036464', '0.057932', '0.052484', '0.042213', '0.058174', '0.040802', '0.046528', '0.055998', '0.041736', '0.050818', '0.049559', '0.046644', '0.056590', '0.051047', '0.050920', '0.055583', '0.055475']
         : correct/total = [(189, 4128), (220, 4203), (199, 4081), (158, 4333), (237, 4091), (225, 4287), (177, 4193), (253, 4349), (171, 4191), (199, 4277), (232, 4143), (175, 4193), (208, 4093), (208, 4197), (189, 4052), (228, 4029), (212, 4153), (213, 4183), (227, 4084), (229, 4128)]
         : compromised: 0.0500, honest: 0.0496

=== FINAL RESULTS ===
Dataset: femnist, Nodes: 20, Graph: erdos, Aggregation: d-fedavg
Attack: directed_deviation, 40.0% compromised
Final accuracy - Compromised: 0.0500, Honest: 0.0496
Overall test accuracy: mean=0.0498 ± 0.0060
