Device: cuda
Seed: 987654321
Loading 36 LEAF FEMNIST train files...
LEAF FEMNIST train: 3597 users, 734463 samples
Loading 36 LEAF FEMNIST test files...
LEAF FEMNIST test: 3597 users, 83388 samples
Found 3597 train users, 3597 test users, 3597 common users
User sample counts range: 525 (max) to 17 (min)
Distributed ALL 3597 users across 20 clients
Users per client: 179 (with 17 clients getting +1 user)
Train partition sizes: [36360, 37070, 35957, 38262, 36024, 37732, 36921, 38328, 36867, 37683, 36507, 36915, 36007, 37001, 35681, 35453, 36585, 36801, 35964, 36345]
Test partition sizes: [4128, 4203, 4081, 4333, 4091, 4287, 4193, 4349, 4191, 4277, 4143, 4193, 4093, 4197, 4052, 4029, 4153, 4183, 4084, 4128]
  Client 0: 36360 train samples, 62 unique classes
  Client 1: 37070 train samples, 62 unique classes
  Client 2: 35957 train samples, 62 unique classes
  Client 3: 38262 train samples, 62 unique classes
  Client 4: 36024 train samples, 62 unique classes
  Client 5: 37732 train samples, 62 unique classes
  Client 6: 36921 train samples, 62 unique classes
  Client 7: 38328 train samples, 62 unique classes
  Client 8: 36867 train samples, 62 unique classes
  Client 9: 37683 train samples, 62 unique classes
  Client 10: 36507 train samples, 62 unique classes
  Client 11: 36915 train samples, 62 unique classes
  Client 12: 36007 train samples, 62 unique classes
  Client 13: 37001 train samples, 62 unique classes
  Client 14: 35681 train samples, 62 unique classes
  Client 15: 35453 train samples, 62 unique classes
  Client 16: 36585 train samples, 62 unique classes
  Client 17: 36801 train samples, 62 unique classes
  Client 18: 35964 train samples, 62 unique classes
  Client 19: 36345 train samples, 62 unique classes
Will sample 4500 samples per client per epoch
Graph: erdos, nodes: 20, edges: 99
Degree statistics: avg=9.90, min=7, max=14
Attack: Compromised 12/20 nodes: [1, 2, 3, 5, 8, 11, 12, 13, 14, 15, 17, 18]
Attack type: gaussian, lambda: 1.0
Model variant: baseline
Model parameters: 6,603,710
UBAR ALGORITHM (Two-Stage Byzantine-resilient)
  - Model dimension: 6,603,710 parameters
  - Rho parameter: 0.4
  - Stage 1: Distance-based filtering (select 40% closest neighbors)
  - Stage 2: Performance-based selection (loss comparison)
  - Complexity: O(deg(i)×d + deg(i)×inference)
Initial test acc across nodes: mean=0.0168 ± 0.0139
Round 001: test acc mean=0.0532 ± 0.0049 | min=0.0466 max=0.0677
         : test loss mean=4.0049 ± 0.0330
         : individual accs = ['0.049176', '0.052344', '0.054153', '0.046619', '0.057932', '0.059715', '0.057000', '0.051276', '0.053209', '0.053075', '0.050447', '0.067732', '0.050818', '0.049083', '0.048124', '0.050633', '0.058271', '0.049486', '0.055583', '0.049903']
         : correct/total = [(203, 4128), (220, 4203), (221, 4081), (202, 4333), (237, 4091), (256, 4287), (239, 4193), (223, 4349), (223, 4191), (227, 4277), (209, 4143), (284, 4193), (208, 4093), (206, 4197), (195, 4052), (204, 4029), (242, 4153), (207, 4183), (227, 4084), (206, 4128)]
         : compromised: 0.0531, honest: 0.0534
         : ubar stats = ['Node 0: s1=0.333, s2=0.250', 'Node 1: s1=0.400, s2=0.500', 'Node 2: s1=0.375, s2=0.333']...
Round 002: test acc mean=0.0524 ± 0.0044 | min=0.0420 max=0.0582
         : test loss mean=3.8679 ± 0.0647
         : individual accs = ['0.044574', '0.046158', '0.053418', '0.052850', '0.057932', '0.056916', '0.057000', '0.058174', '0.053209', '0.053776', '0.041999', '0.053899', '0.049597', '0.046938', '0.050346', '0.053860', '0.054418', '0.050920', '0.055583', '0.055475']
         : correct/total = [(184, 4128), (194, 4203), (218, 4081), (229, 4333), (237, 4091), (244, 4287), (239, 4193), (253, 4349), (223, 4191), (230, 4277), (174, 4143), (226, 4193), (203, 4093), (197, 4197), (204, 4052), (217, 4029), (226, 4153), (213, 4183), (227, 4084), (229, 4128)]
         : compromised: 0.0520, honest: 0.0529
         : ubar stats = ['Node 0: s1=0.333, s2=0.500', 'Node 1: s1=0.400, s2=0.375', 'Node 2: s1=0.375, s2=0.333']...
Round 003: test acc mean=0.0538 ± 0.0054 | min=0.0451 max=0.0630
         : test loss mean=3.7521 ± 0.0533
         : individual accs = ['0.059593', '0.050916', '0.045087', '0.048234', '0.057932', '0.048052', '0.057000', '0.051276', '0.059413', '0.047463', '0.055998', '0.053899', '0.058637', '0.045747', '0.061204', '0.056342', '0.054418', '0.045900', '0.055583', '0.062984']
         : correct/total = [(246, 4128), (214, 4203), (184, 4081), (209, 4333), (237, 4091), (206, 4287), (239, 4193), (223, 4349), (249, 4191), (203, 4277), (232, 4143), (226, 4193), (240, 4093), (192, 4197), (248, 4052), (227, 4029), (226, 4153), (192, 4183), (227, 4084), (260, 4128)]
         : compromised: 0.0524, honest: 0.0558
         : ubar stats = ['Node 0: s1=0.333, s2=0.667', 'Node 1: s1=0.400, s2=0.333', 'Node 2: s1=0.375, s2=0.333']...
Round 004: test acc mean=0.0548 ± 0.0063 | min=0.0435 max=0.0694
         : test loss mean=3.7011 ± 0.0222
         : individual accs = ['0.059593', '0.052344', '0.057584', '0.052850', '0.057932', '0.050618', '0.069401', '0.061853', '0.053209', '0.043488', '0.045619', '0.053899', '0.054239', '0.062426', '0.061204', '0.054852', '0.058271', '0.048291', '0.052889', '0.045058']
         : correct/total = [(246, 4128), (220, 4203), (235, 4081), (229, 4333), (237, 4091), (217, 4287), (291, 4193), (269, 4349), (223, 4191), (186, 4277), (189, 4143), (226, 4193), (222, 4093), (262, 4197), (248, 4052), (221, 4029), (242, 4153), (202, 4183), (216, 4084), (186, 4128)]
         : compromised: 0.0545, honest: 0.0552
         : ubar stats = ['Node 0: s1=0.333, s2=0.688', 'Node 1: s1=0.400, s2=0.312', 'Node 2: s1=0.375, s2=0.500']...
Round 005: test acc mean=0.0538 ± 0.0043 | min=0.0462 max=0.0596
         : test loss mean=3.6860 ± 0.0180
         : individual accs = ['0.059593', '0.046158', '0.057584', '0.057928', '0.057932', '0.050618', '0.057000', '0.047827', '0.051062', '0.054010', '0.055998', '0.046745', '0.058637', '0.046938', '0.051826', '0.054852', '0.058271', '0.051877', '0.055583', '0.055475']
         : correct/total = [(246, 4128), (194, 4203), (235, 4081), (251, 4333), (237, 4091), (217, 4287), (239, 4193), (208, 4349), (214, 4191), (231, 4277), (232, 4143), (196, 4193), (240, 4093), (197, 4197), (210, 4052), (221, 4029), (242, 4153), (217, 4183), (227, 4084), (229, 4128)]
         : compromised: 0.0525, honest: 0.0558
         : ubar stats = ['Node 0: s1=0.333, s2=0.700', 'Node 1: s1=0.400, s2=0.300', 'Node 2: s1=0.375, s2=0.467']...
Round 006: test acc mean=0.0536 ± 0.0042 | min=0.0446 max=0.0624
         : test loss mean=3.6825 ± 0.0166
         : individual accs = ['0.044574', '0.050916', '0.057584', '0.048465', '0.051821', '0.050618', '0.057000', '0.051276', '0.053209', '0.053776', '0.050447', '0.061770', '0.053750', '0.062426', '0.051826', '0.051378', '0.058271', '0.050920', '0.055583', '0.055475']
         : correct/total = [(184, 4128), (214, 4203), (235, 4081), (210, 4333), (212, 4091), (217, 4287), (239, 4193), (223, 4349), (223, 4191), (230, 4277), (209, 4143), (259, 4193), (220, 4093), (262, 4197), (210, 4052), (207, 4029), (242, 4153), (213, 4183), (227, 4084), (229, 4128)]
         : compromised: 0.0540, honest: 0.0528
         : ubar stats = ['Node 0: s1=0.333, s2=0.750', 'Node 1: s1=0.400, s2=0.292', 'Node 2: s1=0.375, s2=0.556']...
Round 007: test acc mean=0.0537 ± 0.0040 | min=0.0448 max=0.0596
         : test loss mean=3.6819 ± 0.0166
         : individual accs = ['0.059593', '0.052344', '0.057584', '0.044773', '0.047421', '0.050618', '0.057477', '0.058174', '0.053209', '0.053776', '0.055998', '0.053899', '0.058637', '0.046938', '0.051826', '0.056590', '0.052011', '0.050920', '0.055828', '0.055475']
         : correct/total = [(246, 4128), (220, 4203), (235, 4081), (194, 4333), (194, 4091), (217, 4287), (241, 4193), (253, 4349), (223, 4191), (230, 4277), (232, 4143), (226, 4193), (240, 4093), (197, 4197), (210, 4052), (228, 4029), (216, 4153), (213, 4183), (228, 4084), (229, 4128)]
         : compromised: 0.0528, honest: 0.0550
         : ubar stats = ['Node 0: s1=0.333, s2=0.750', 'Node 1: s1=0.400, s2=0.393', 'Node 2: s1=0.375, s2=0.571']...
Round 008: test acc mean=0.0588 ± 0.0150 | min=0.0422 max=0.0946
         : test loss mean=3.6809 ± 0.0170
         : individual accs = ['0.051599', '0.056388', '0.050723', '0.043157', '0.083109', '0.050618', '0.050560', '0.051276', '0.042233', '0.053075', '0.094617', '0.053899', '0.094307', '0.074101', '0.048124', '0.056342', '0.055141', '0.050203', '0.055583', '0.060320']
         : correct/total = [(213, 4128), (237, 4203), (207, 4081), (187, 4333), (340, 4091), (217, 4287), (212, 4193), (223, 4349), (177, 4191), (227, 4277), (392, 4143), (226, 4193), (386, 4093), (311, 4197), (195, 4052), (227, 4029), (229, 4153), (210, 4183), (227, 4084), (249, 4128)]
         : compromised: 0.0563, honest: 0.0625
         : ubar stats = ['Node 0: s1=0.333, s2=0.719', 'Node 1: s1=0.400, s2=0.438', 'Node 2: s1=0.375, s2=0.542']...
Round 009: test acc mean=0.0576 ± 0.0208 | min=0.0407 max=0.1454
         : test loss mean=3.6797 ± 0.0171
         : individual accs = ['0.050145', '0.050916', '0.052683', '0.052850', '0.044977', '0.050618', '0.051514', '0.058174', '0.053209', '0.048398', '0.064205', '0.053899', '0.058637', '0.062426', '0.051579', '0.145446', '0.040693', '0.050920', '0.052889', '0.057897']
         : correct/total = [(207, 4128), (214, 4203), (215, 4081), (229, 4333), (184, 4091), (217, 4287), (216, 4193), (253, 4349), (223, 4191), (207, 4277), (266, 4143), (226, 4193), (240, 4093), (262, 4197), (209, 4052), (586, 4029), (169, 4153), (213, 4183), (216, 4084), (239, 4128)]
         : compromised: 0.0613, honest: 0.0520
         : ubar stats = ['Node 0: s1=0.333, s2=0.667', 'Node 1: s1=0.400, s2=0.417', 'Node 2: s1=0.375, s2=0.556']...
Round 010: test acc mean=0.0606 ± 0.0162 | min=0.0422 max=0.1092
         : test loss mean=3.6794 ± 0.0174
         : individual accs = ['0.106105', '0.052344', '0.057584', '0.052850', '0.057932', '0.050618', '0.057000', '0.058174', '0.042233', '0.053776', '0.055998', '0.053899', '0.109211', '0.062426', '0.061204', '0.056342', '0.058271', '0.052594', '0.057786', '0.055475']
         : correct/total = [(438, 4128), (220, 4203), (235, 4081), (229, 4333), (237, 4091), (217, 4287), (239, 4193), (253, 4349), (177, 4191), (230, 4277), (232, 4143), (226, 4193), (447, 4093), (262, 4197), (248, 4052), (227, 4029), (242, 4153), (220, 4183), (236, 4084), (229, 4128)]
         : compromised: 0.0591, honest: 0.0628
         : ubar stats = ['Node 0: s1=0.333, s2=0.675', 'Node 1: s1=0.400, s2=0.400', 'Node 2: s1=0.375, s2=0.567']...

=== FINAL RESULTS ===
Dataset: femnist, Nodes: 20, Graph: erdos, Aggregation: ubar
Attack: gaussian, 60.0% compromised
Final accuracy - Compromised: 0.0591, Honest: 0.0628
Overall test accuracy: mean=0.0606 ± 0.0162

=== UBAR SUMMARY ===
Node 0: stage1=0.333, stage2=0.675, overall=0.225
Node 1: stage1=0.400, stage2=0.400, overall=0.160
Node 2: stage1=0.375, stage2=0.567, overall=0.212
Node 3: stage1=0.286, stage2=0.750, overall=0.214
Node 4: stage1=0.333, stage2=0.567, overall=0.189
Node 5: stage1=0.400, stage2=0.450, overall=0.180
Node 6: stage1=0.333, stage2=0.475, overall=0.158
Node 7: stage1=0.364, stage2=0.500, overall=0.182
Node 8: stage1=0.286, stage2=0.700, overall=0.200
Node 9: stage1=0.364, stage2=0.375, overall=0.136
Node 10: stage1=0.375, stage2=0.433, overall=0.162
Node 11: stage1=0.333, stage2=0.475, overall=0.158
Node 12: stage1=0.333, stage2=0.500, overall=0.167
Node 13: stage1=0.333, stage2=0.633, overall=0.211
Node 14: stage1=0.357, stage2=0.580, overall=0.207
Node 15: stage1=0.333, stage2=0.700, overall=0.233
Node 16: stage1=0.286, stage2=0.550, overall=0.157
Node 17: stage1=0.375, stage2=0.500, overall=0.188
Node 18: stage1=0.333, stage2=0.675, overall=0.225
Node 19: stage1=0.400, stage2=0.425, overall=0.170

=== PARALLEL EXECUTION TIME (realistic for distributed system) ===
  COMMUNICATION (max across nodes):
    - Full model transfer: 0.000s (0.0%)
  COMPUTATION (max across nodes):
    - Distance computation: 0.060s (1.0%)
    - Loss computation: 5.848s (98.8%)
    - Aggregation: 0.009s (0.1%)
  TOTALS:
    - Total computation: 5.917s (100.0%)
    - Total communication: 0.000s (0.0%)
    - Total parallel time: 5.917s

=== PER-NODE AVERAGE TIME ===
  - Distance computation: 0.037s
  - Loss computation: 5.443s
  - Aggregation: 0.005s
  - Model transfer: 0.000s
  - Total per node: 5.485s

=== TOTAL COMPUTATIONAL WORK (sum across all nodes) ===
  - Total distance computation: 0.745s
  - Total loss computation: 108.851s
  - Total aggregation: 0.109s
  - Total model transfer: 0.000s
  - Grand total: 109.705s
  - Mean Stage 1 acceptance rate: 0.347
  - Mean Stage 2 acceptance rate: 0.547
  - Overall acceptance rate: 0.189

UBAR Algorithm Properties:
  - Model dimension: 6,603,710
  - Rho parameter: 0.4
  - Two-stage approach: Distance filtering + loss evaluation
  - Stage 1 selects: 40% of neighbors
  - Stage 2 uses: Training sample loss comparison
  - Theoretical complexity: O(deg(i)×d + deg(i)×inference)
  - Approach: UBAR paper implementation
