Device: cuda
Seed: 987654321
Loading 36 LEAF FEMNIST train files...
LEAF FEMNIST train: 3597 users, 734463 samples
Loading 36 LEAF FEMNIST test files...
LEAF FEMNIST test: 3597 users, 83388 samples
Found 3597 train users, 3597 test users, 3597 common users
User sample counts range: 525 (max) to 17 (min)
Distributed ALL 3597 users across 20 clients
Users per client: 179 (with 17 clients getting +1 user)
Train partition sizes: [36360, 37070, 35957, 38262, 36024, 37732, 36921, 38328, 36867, 37683, 36507, 36915, 36007, 37001, 35681, 35453, 36585, 36801, 35964, 36345]
Test partition sizes: [4128, 4203, 4081, 4333, 4091, 4287, 4193, 4349, 4191, 4277, 4143, 4193, 4093, 4197, 4052, 4029, 4153, 4183, 4084, 4128]
  Client 0: 36360 train samples, 62 unique classes
  Client 1: 37070 train samples, 62 unique classes
  Client 2: 35957 train samples, 62 unique classes
  Client 3: 38262 train samples, 62 unique classes
  Client 4: 36024 train samples, 62 unique classes
  Client 5: 37732 train samples, 62 unique classes
  Client 6: 36921 train samples, 62 unique classes
  Client 7: 38328 train samples, 62 unique classes
  Client 8: 36867 train samples, 62 unique classes
  Client 9: 37683 train samples, 62 unique classes
  Client 10: 36507 train samples, 62 unique classes
  Client 11: 36915 train samples, 62 unique classes
  Client 12: 36007 train samples, 62 unique classes
  Client 13: 37001 train samples, 62 unique classes
  Client 14: 35681 train samples, 62 unique classes
  Client 15: 35453 train samples, 62 unique classes
  Client 16: 36585 train samples, 62 unique classes
  Client 17: 36801 train samples, 62 unique classes
  Client 18: 35964 train samples, 62 unique classes
  Client 19: 36345 train samples, 62 unique classes
Will sample 10000 samples per client per epoch
Graph: erdos, nodes: 20, edges: 48
Degree statistics: avg=4.80, min=2, max=7
Attack: Compromised 2/20 nodes: [5, 13]
Attack type: backdoor, lambda: 1.0
Backdoor target label: 0, trigger size: 4
Model variant: baseline
Model parameters: 6,603,710
Initial test acc across nodes: mean=0.0162 ± 0.0138
Backdoor attack: Created poisoned datasets for 2 compromised nodes
Round 001: test acc mean=0.0754 ± 0.0577 | min=0.0039 max=0.2435
         : test loss mean=225.9899 ± 362.7979
         : individual accs = ['0.089147', '0.053533', '0.081843', '0.003923', '0.065510', '0.005365', '0.086334', '0.076569', '0.149129', '0.173954', '0.114893', '0.051514', '0.045932', '0.022873', '0.044669', '0.045669', '0.067662', '0.007650', '0.077865', '0.243459']
         : correct/total = [(368, 4128), (225, 4203), (334, 4081), (17, 4333), (268, 4091), (23, 4287), (362, 4193), (333, 4349), (625, 4191), (744, 4277), (476, 4143), (216, 4193), (188, 4093), (96, 4197), (181, 4052), (184, 4029), (281, 4153), (32, 4183), (318, 4084), (1005, 4128)]
         : compromised: 0.0141, honest: 0.0822
Round 002: test acc mean=0.1101 ± 0.1806 | min=0.0422 max=0.6590
         : test loss mean=895535.0472 ± 3903063.6160
         : individual accs = ['0.049419', '0.046395', '0.061505', '0.048004', '0.046199', '0.047352', '0.045314', '0.050126', '0.659031', '0.048632', '0.048274', '0.042213', '0.047398', '0.048844', '0.054788', '0.054604', '0.050566', '0.049247', '0.060235', '0.644138']
         : correct/total = [(204, 4128), (195, 4203), (251, 4081), (208, 4333), (189, 4091), (203, 4287), (190, 4193), (218, 4349), (2762, 4191), (208, 4277), (200, 4143), (177, 4193), (194, 4093), (205, 4197), (222, 4052), (220, 4029), (210, 4153), (206, 4183), (246, 4084), (2659, 4128)]
         : compromised: 0.0481, honest: 0.1170
Round 003: test acc mean=0.0496 ± 0.0037 | min=0.0429 max=0.0615
         : test loss mean=3251.5473 ± 11186.4235
         : individual accs = ['0.049903', '0.052819', '0.061505', '0.048927', '0.052066', '0.052018', '0.045314', '0.045758', '0.048437', '0.048632', '0.048274', '0.048653', '0.051796', '0.049083', '0.050592', '0.052122', '0.042861', '0.049247', '0.045544', '0.049176']
         : correct/total = [(206, 4128), (222, 4203), (251, 4081), (212, 4333), (213, 4091), (223, 4287), (190, 4193), (199, 4349), (203, 4191), (208, 4277), (200, 4143), (204, 4193), (212, 4093), (206, 4197), (205, 4052), (210, 4029), (178, 4153), (206, 4183), (186, 4084), (203, 4128)]
         : compromised: 0.0506, honest: 0.0495
Round 004: test acc mean=0.0521 ± 0.0041 | min=0.0455 max=0.0615
         : test loss mean=1442.6096 ± 2463.5689
         : individual accs = ['0.049419', '0.052819', '0.061505', '0.049850', '0.052066', '0.045486', '0.051276', '0.050586', '0.052732', '0.048632', '0.051412', '0.054853', '0.051796', '0.053848', '0.055281', '0.046662', '0.050566', '0.046378', '0.060235', '0.057413']
         : correct/total = [(204, 4128), (222, 4203), (251, 4081), (216, 4333), (213, 4091), (195, 4287), (215, 4193), (220, 4349), (221, 4191), (208, 4277), (213, 4143), (230, 4193), (212, 4093), (226, 4197), (224, 4052), (188, 4029), (210, 4153), (194, 4183), (246, 4084), (237, 4128)]
         : compromised: 0.0497, honest: 0.0524
Round 005: test acc mean=0.0512 ± 0.0039 | min=0.0455 max=0.0597
         : test loss mean=1503.9946 ± 4120.5461
         : individual accs = ['0.059109', '0.058292', '0.049253', '0.048927', '0.053043', '0.045486', '0.053422', '0.050586', '0.053686', '0.050736', '0.050205', '0.048653', '0.047642', '0.049083', '0.047384', '0.051874', '0.050566', '0.046378', '0.059745', '0.050388']
         : correct/total = [(244, 4128), (245, 4203), (201, 4081), (212, 4333), (217, 4091), (195, 4287), (224, 4193), (220, 4349), (225, 4191), (217, 4277), (208, 4143), (204, 4193), (195, 4093), (206, 4197), (192, 4052), (209, 4029), (210, 4153), (194, 4183), (244, 4084), (208, 4128)]
         : compromised: 0.0473, honest: 0.0517
Round 006: test acc mean=0.0507 ± 0.0033 | min=0.0453 max=0.0597
         : test loss mean=6.6018 ± 10.5792
         : individual accs = ['0.048207', '0.052819', '0.049988', '0.048004', '0.047910', '0.052951', '0.053422', '0.046907', '0.045335', '0.048632', '0.051171', '0.054853', '0.052040', '0.046938', '0.053801', '0.048151', '0.050566', '0.052833', '0.059745', '0.050630']
         : correct/total = [(199, 4128), (222, 4203), (204, 4081), (208, 4333), (196, 4091), (227, 4287), (224, 4193), (204, 4349), (190, 4191), (208, 4277), (212, 4143), (230, 4193), (213, 4093), (197, 4197), (218, 4052), (194, 4029), (210, 4153), (221, 4183), (244, 4084), (209, 4128)]
         : compromised: 0.0499, honest: 0.0508
Round 007: test acc mean=0.0512 ± 0.0040 | min=0.0425 max=0.0591
         : test loss mean=6.7603 ± 12.4572
         : individual accs = ['0.059109', '0.052819', '0.049253', '0.049619', '0.052066', '0.042454', '0.053422', '0.050126', '0.045335', '0.055413', '0.051895', '0.054853', '0.051796', '0.045509', '0.055281', '0.050137', '0.050566', '0.047574', '0.050196', '0.057413']
         : correct/total = [(244, 4128), (222, 4203), (201, 4081), (215, 4333), (213, 4091), (182, 4287), (224, 4193), (218, 4349), (190, 4191), (237, 4277), (215, 4143), (230, 4193), (212, 4093), (191, 4197), (224, 4052), (202, 4029), (210, 4153), (199, 4183), (205, 4084), (237, 4128)]
         : compromised: 0.0440, honest: 0.0520
Round 008: test acc mean=0.0519 ± 0.0047 | min=0.0434 max=0.0615
         : test loss mean=4.5647 ± 2.6074
         : individual accs = ['0.049661', '0.052819', '0.061505', '0.048004', '0.052066', '0.052951', '0.053422', '0.046907', '0.057266', '0.048632', '0.051895', '0.054853', '0.048375', '0.048130', '0.053801', '0.043435', '0.050566', '0.045422', '0.060235', '0.057413']
         : correct/total = [(205, 4128), (222, 4203), (251, 4081), (208, 4333), (213, 4091), (227, 4287), (224, 4193), (204, 4349), (240, 4191), (208, 4277), (215, 4143), (230, 4193), (198, 4093), (202, 4197), (218, 4052), (175, 4029), (210, 4153), (190, 4183), (246, 4084), (237, 4128)]
         : compromised: 0.0505, honest: 0.0520
Round 009: test acc mean=0.0510 ± 0.0038 | min=0.0446 max=0.0602
         : test loss mean=12.2652 ± 30.0843
         : individual accs = ['0.049661', '0.050440', '0.049988', '0.048004', '0.052066', '0.051318', '0.053422', '0.044608', '0.057266', '0.048632', '0.048274', '0.046983', '0.047642', '0.053848', '0.047384', '0.051874', '0.050566', '0.051159', '0.060235', '0.057413']
         : correct/total = [(205, 4128), (212, 4203), (204, 4081), (208, 4333), (213, 4091), (220, 4287), (224, 4193), (194, 4349), (240, 4191), (208, 4277), (200, 4143), (197, 4193), (195, 4093), (226, 4197), (192, 4052), (209, 4029), (210, 4153), (214, 4183), (246, 4084), (237, 4128)]
         : compromised: 0.0526, honest: 0.0509
Round 010: test acc mean=0.0524 ± 0.0039 | min=0.0469 max=0.0615
         : test loss mean=34.5473 ± 112.6882
         : individual accs = ['0.049661', '0.052819', '0.061505', '0.048927', '0.052066', '0.052018', '0.053422', '0.046907', '0.057266', '0.048632', '0.051895', '0.048653', '0.052040', '0.049083', '0.053801', '0.048151', '0.050566', '0.052833', '0.060235', '0.057413']
         : correct/total = [(205, 4128), (222, 4203), (251, 4081), (212, 4333), (213, 4091), (223, 4287), (224, 4193), (204, 4349), (240, 4191), (208, 4277), (215, 4143), (204, 4193), (213, 4093), (206, 4197), (218, 4052), (194, 4029), (210, 4153), (221, 4183), (246, 4084), (237, 4128)]
         : compromised: 0.0506, honest: 0.0526

=== FINAL RESULTS ===
Dataset: femnist, Nodes: 20, Graph: erdos, Aggregation: d-fedavg
Attack: backdoor, 10.0% compromised
Final accuracy - Compromised: 0.0506, Honest: 0.0526
Overall test accuracy: mean=0.0524 ± 0.0039

=== BACKDOOR ATTACK SUCCESS RATE (ASR) ===
Target label: 0
Trigger size: 4x4
Overall ASR: 0.0000 ± 0.0000
Honest nodes ASR: 0.0000 ± 0.0000
Compromised nodes ASR: 0.0000 ± 0.0000
Note: Higher ASR indicates more successful backdoor attack
