Device: cuda
Seed: 987654321
Loading 36 LEAF FEMNIST train files...
LEAF FEMNIST train: 3597 users, 734463 samples
Loading 36 LEAF FEMNIST test files...
LEAF FEMNIST test: 3597 users, 83388 samples
Found 3597 train users, 3597 test users, 3597 common users
User sample counts range: 525 (max) to 17 (min)
Distributed ALL 3597 users across 20 clients
Users per client: 179 (with 17 clients getting +1 user)
Train partition sizes: [36360, 37070, 35957, 38262, 36024, 37732, 36921, 38328, 36867, 37683, 36507, 36915, 36007, 37001, 35681, 35453, 36585, 36801, 35964, 36345]
Test partition sizes: [4128, 4203, 4081, 4333, 4091, 4287, 4193, 4349, 4191, 4277, 4143, 4193, 4093, 4197, 4052, 4029, 4153, 4183, 4084, 4128]
  Client 0: 36360 train samples, 62 unique classes
  Client 1: 37070 train samples, 62 unique classes
  Client 2: 35957 train samples, 62 unique classes
  Client 3: 38262 train samples, 62 unique classes
  Client 4: 36024 train samples, 62 unique classes
  Client 5: 37732 train samples, 62 unique classes
  Client 6: 36921 train samples, 62 unique classes
  Client 7: 38328 train samples, 62 unique classes
  Client 8: 36867 train samples, 62 unique classes
  Client 9: 37683 train samples, 62 unique classes
  Client 10: 36507 train samples, 62 unique classes
  Client 11: 36915 train samples, 62 unique classes
  Client 12: 36007 train samples, 62 unique classes
  Client 13: 37001 train samples, 62 unique classes
  Client 14: 35681 train samples, 62 unique classes
  Client 15: 35453 train samples, 62 unique classes
  Client 16: 36585 train samples, 62 unique classes
  Client 17: 36801 train samples, 62 unique classes
  Client 18: 35964 train samples, 62 unique classes
  Client 19: 36345 train samples, 62 unique classes
Will sample 10000 samples per client per epoch
Graph: erdos, nodes: 20, edges: 99
Degree statistics: avg=9.90, min=7, max=14
Attack: Compromised 10/20 nodes: [1, 2, 5, 11, 12, 13, 14, 15, 17, 18]
Attack type: directed_deviation, lambda: 1.0
Model variant: baseline
Model parameters: 6,603,710
Initial test acc across nodes: mean=0.0162 ± 0.0138
Round 001: test acc mean=0.0146 ± 0.0149 | min=0.0024 max=0.0520
         : test loss mean=27303.7479 ± 17518.3656
         : individual accs = ['0.005329', '0.019034', '0.012252', '0.003000', '0.010022', '0.003266', '0.004054', '0.039319', '0.012885', '0.008651', '0.019792', '0.015741', '0.052040', '0.002383', '0.009131', '0.003971', '0.051288', '0.008606', '0.007591', '0.004118']
         : correct/total = [(22, 4128), (80, 4203), (50, 4081), (13, 4333), (41, 4091), (14, 4287), (17, 4193), (171, 4349), (54, 4191), (37, 4277), (82, 4143), (66, 4193), (213, 4093), (10, 4197), (37, 4052), (16, 4029), (213, 4153), (36, 4183), (31, 4084), (17, 4128)]
         : compromised: 0.0134, honest: 0.0158
Round 002: test acc mean=0.0493 ± 0.0036 | min=0.0415 max=0.0550
         : test loss mean=nan ± nan
         : individual accs = ['0.049419', '0.048775', '0.049743', '0.046619', '0.045466', '0.052484', '0.041498', '0.043228', '0.051062', '0.050736', '0.048033', '0.048891', '0.047398', '0.047653', '0.054788', '0.054604', '0.047436', '0.049247', '0.054358', '0.054990']
         : correct/total = [(204, 4128), (205, 4203), (203, 4081), (202, 4333), (186, 4091), (225, 4287), (174, 4193), (188, 4349), (214, 4191), (217, 4277), (199, 4143), (205, 4193), (194, 4093), (200, 4197), (222, 4052), (220, 4029), (197, 4153), (206, 4183), (222, 4084), (227, 4128)]
         : compromised: 0.0508, honest: 0.0478
Round 003: test acc mean=0.0497 ± 0.0033 | min=0.0415 max=0.0550
         : test loss mean=nan ± nan
         : individual accs = ['0.049419', '0.048775', '0.049743', '0.046619', '0.045710', '0.052484', '0.041498', '0.049897', '0.051062', '0.050736', '0.048033', '0.048891', '0.047398', '0.047653', '0.054788', '0.054604', '0.047436', '0.049247', '0.054358', '0.054990']
         : correct/total = [(204, 4128), (205, 4203), (203, 4081), (202, 4333), (187, 4091), (225, 4287), (174, 4193), (217, 4349), (214, 4191), (217, 4277), (199, 4143), (205, 4193), (194, 4093), (200, 4197), (222, 4052), (220, 4029), (197, 4153), (206, 4183), (222, 4084), (227, 4128)]
         : compromised: 0.0508, honest: 0.0485
Round 004: test acc mean=0.0497 ± 0.0033 | min=0.0415 max=0.0550
         : test loss mean=nan ± nan
         : individual accs = ['0.049419', '0.048775', '0.049743', '0.046619', '0.045710', '0.052484', '0.041498', '0.049897', '0.051062', '0.050736', '0.048033', '0.048891', '0.047398', '0.047653', '0.054788', '0.054604', '0.047436', '0.049247', '0.054358', '0.054990']
         : correct/total = [(204, 4128), (205, 4203), (203, 4081), (202, 4333), (187, 4091), (225, 4287), (174, 4193), (217, 4349), (214, 4191), (217, 4277), (199, 4143), (205, 4193), (194, 4093), (200, 4197), (222, 4052), (220, 4029), (197, 4153), (206, 4183), (222, 4084), (227, 4128)]
         : compromised: 0.0508, honest: 0.0485
Round 005: test acc mean=0.0497 ± 0.0033 | min=0.0415 max=0.0550
         : test loss mean=nan ± nan
         : individual accs = ['0.049419', '0.048775', '0.049743', '0.046619', '0.045710', '0.052484', '0.041498', '0.049897', '0.051062', '0.050736', '0.048033', '0.048891', '0.047398', '0.047653', '0.054788', '0.054604', '0.047436', '0.049247', '0.054358', '0.054990']
         : correct/total = [(204, 4128), (205, 4203), (203, 4081), (202, 4333), (187, 4091), (225, 4287), (174, 4193), (217, 4349), (214, 4191), (217, 4277), (199, 4143), (205, 4193), (194, 4093), (200, 4197), (222, 4052), (220, 4029), (197, 4153), (206, 4183), (222, 4084), (227, 4128)]
         : compromised: 0.0508, honest: 0.0485
Round 006: test acc mean=0.0497 ± 0.0033 | min=0.0415 max=0.0550
         : test loss mean=nan ± nan
         : individual accs = ['0.049419', '0.048775', '0.049743', '0.046619', '0.045710', '0.052484', '0.041498', '0.049897', '0.051062', '0.050736', '0.048033', '0.048891', '0.047398', '0.047653', '0.054788', '0.054604', '0.047436', '0.049247', '0.054358', '0.054990']
         : correct/total = [(204, 4128), (205, 4203), (203, 4081), (202, 4333), (187, 4091), (225, 4287), (174, 4193), (217, 4349), (214, 4191), (217, 4277), (199, 4143), (205, 4193), (194, 4093), (200, 4197), (222, 4052), (220, 4029), (197, 4153), (206, 4183), (222, 4084), (227, 4128)]
         : compromised: 0.0508, honest: 0.0485
Round 007: test acc mean=0.0497 ± 0.0033 | min=0.0415 max=0.0550
         : test loss mean=nan ± nan
         : individual accs = ['0.049419', '0.048775', '0.049743', '0.046619', '0.045710', '0.052484', '0.041498', '0.049897', '0.051062', '0.050736', '0.048033', '0.048891', '0.047398', '0.047653', '0.054788', '0.054604', '0.047436', '0.049247', '0.054358', '0.054990']
         : correct/total = [(204, 4128), (205, 4203), (203, 4081), (202, 4333), (187, 4091), (225, 4287), (174, 4193), (217, 4349), (214, 4191), (217, 4277), (199, 4143), (205, 4193), (194, 4093), (200, 4197), (222, 4052), (220, 4029), (197, 4153), (206, 4183), (222, 4084), (227, 4128)]
         : compromised: 0.0508, honest: 0.0485
Round 008: test acc mean=0.0497 ± 0.0033 | min=0.0415 max=0.0550
         : test loss mean=nan ± nan
         : individual accs = ['0.049419', '0.048775', '0.049743', '0.046619', '0.045710', '0.052484', '0.041498', '0.049897', '0.051062', '0.050736', '0.048033', '0.048891', '0.047398', '0.047653', '0.054788', '0.054604', '0.047436', '0.049247', '0.054358', '0.054990']
         : correct/total = [(204, 4128), (205, 4203), (203, 4081), (202, 4333), (187, 4091), (225, 4287), (174, 4193), (217, 4349), (214, 4191), (217, 4277), (199, 4143), (205, 4193), (194, 4093), (200, 4197), (222, 4052), (220, 4029), (197, 4153), (206, 4183), (222, 4084), (227, 4128)]
         : compromised: 0.0508, honest: 0.0485
Round 009: test acc mean=0.0497 ± 0.0033 | min=0.0415 max=0.0550
         : test loss mean=nan ± nan
         : individual accs = ['0.049419', '0.048775', '0.049743', '0.046619', '0.045710', '0.052484', '0.041498', '0.049897', '0.051062', '0.050736', '0.048033', '0.048891', '0.047398', '0.047653', '0.054788', '0.054604', '0.047436', '0.049247', '0.054358', '0.054990']
         : correct/total = [(204, 4128), (205, 4203), (203, 4081), (202, 4333), (187, 4091), (225, 4287), (174, 4193), (217, 4349), (214, 4191), (217, 4277), (199, 4143), (205, 4193), (194, 4093), (200, 4197), (222, 4052), (220, 4029), (197, 4153), (206, 4183), (222, 4084), (227, 4128)]
         : compromised: 0.0508, honest: 0.0485
Round 010: test acc mean=0.0497 ± 0.0033 | min=0.0415 max=0.0550
         : test loss mean=nan ± nan
         : individual accs = ['0.049419', '0.048775', '0.049743', '0.046619', '0.045710', '0.052484', '0.041498', '0.049897', '0.051062', '0.050736', '0.048033', '0.048891', '0.047398', '0.047653', '0.054788', '0.054604', '0.047436', '0.049247', '0.054358', '0.054990']
         : correct/total = [(204, 4128), (205, 4203), (203, 4081), (202, 4333), (187, 4091), (225, 4287), (174, 4193), (217, 4349), (214, 4191), (217, 4277), (199, 4143), (205, 4193), (194, 4093), (200, 4197), (222, 4052), (220, 4029), (197, 4153), (206, 4183), (222, 4084), (227, 4128)]
         : compromised: 0.0508, honest: 0.0485

=== FINAL RESULTS ===
Dataset: femnist, Nodes: 20, Graph: erdos, Aggregation: d-fedavg
Attack: directed_deviation, 50.0% compromised
Final accuracy - Compromised: 0.0508, Honest: 0.0485
Overall test accuracy: mean=0.0497 ± 0.0033
