Device: cuda
Seed: 987654321
Loading 36 LEAF FEMNIST train files...
LEAF FEMNIST train: 3597 users, 734463 samples
Loading 36 LEAF FEMNIST test files...
LEAF FEMNIST test: 3597 users, 83388 samples
Found 3597 train users, 3597 test users, 3597 common users
User sample counts range: 525 (max) to 17 (min)
Distributed ALL 3597 users across 20 clients
Users per client: 179 (with 17 clients getting +1 user)
Train partition sizes: [36360, 37070, 35957, 38262, 36024, 37732, 36921, 38328, 36867, 37683, 36507, 36915, 36007, 37001, 35681, 35453, 36585, 36801, 35964, 36345]
Test partition sizes: [4128, 4203, 4081, 4333, 4091, 4287, 4193, 4349, 4191, 4277, 4143, 4193, 4093, 4197, 4052, 4029, 4153, 4183, 4084, 4128]
  Client 0: 36360 train samples, 62 unique classes
  Client 1: 37070 train samples, 62 unique classes
  Client 2: 35957 train samples, 62 unique classes
  Client 3: 38262 train samples, 62 unique classes
  Client 4: 36024 train samples, 62 unique classes
  Client 5: 37732 train samples, 62 unique classes
  Client 6: 36921 train samples, 62 unique classes
  Client 7: 38328 train samples, 62 unique classes
  Client 8: 36867 train samples, 62 unique classes
  Client 9: 37683 train samples, 62 unique classes
  Client 10: 36507 train samples, 62 unique classes
  Client 11: 36915 train samples, 62 unique classes
  Client 12: 36007 train samples, 62 unique classes
  Client 13: 37001 train samples, 62 unique classes
  Client 14: 35681 train samples, 62 unique classes
  Client 15: 35453 train samples, 62 unique classes
  Client 16: 36585 train samples, 62 unique classes
  Client 17: 36801 train samples, 62 unique classes
  Client 18: 35964 train samples, 62 unique classes
  Client 19: 36345 train samples, 62 unique classes
Will sample 4500 samples per client per epoch
Graph: erdos, nodes: 20, edges: 99
Degree statistics: avg=9.90, min=7, max=14
Attack: Compromised 16/20 nodes: [1, 2, 3, 5, 6, 8, 9, 10, 11, 12, 13, 14, 15, 17, 18, 19]
Attack type: backdoor, lambda: 1.0
Backdoor target label: 0, trigger size: 4
Model variant: baseline
Model parameters: 6,603,710
BALANCE algorithm:
Balance Config: BALANCEConfig(gamma=2, kappa=1, alpha=0.5, min_neighbors=1)
  - Model dimension: 6,603,710 parameters
  - Complexity: O(N×d) = O(20×6,603,710)
Initial test acc across nodes: mean=0.0168 ± 0.0139
Backdoor attack: Created poisoned datasets for 16 compromised nodes
Round 001: test acc mean=0.0514 ± 0.0045 | min=0.0432 max=0.0596
         : test loss mean=29496.6870 ± 24268.0082
         : individual accs = ['0.059593', '0.048775', '0.053418', '0.043157', '0.057932', '0.045253', '0.050799', '0.056105', '0.049630', '0.043488', '0.048033', '0.049606', '0.054239', '0.049083', '0.051826', '0.051626', '0.058271', '0.049486', '0.052889', '0.054506']
         : correct/total = [(246, 4128), (205, 4203), (218, 4081), (187, 4333), (237, 4091), (194, 4287), (213, 4193), (244, 4349), (208, 4191), (186, 4277), (199, 4143), (208, 4193), (222, 4093), (206, 4197), (210, 4052), (208, 4029), (242, 4153), (207, 4183), (216, 4084), (225, 4128)]
         : compromised: 0.0497, honest: 0.0580
Round 002: test acc mean=0.0214 ± 0.0230 | min=0.0017 max=0.0596
         : test loss mean=708343.8054 ± 669526.3284
         : individual accs = ['0.059593', '0.001665', '0.002450', '0.010616', '0.057932', '0.004432', '0.004293', '0.058174', '0.005727', '0.006547', '0.004827', '0.002623', '0.003420', '0.005004', '0.005429', '0.050385', '0.049362', '0.045900', '0.004897', '0.045058']
         : correct/total = [(246, 4128), (7, 4203), (10, 4081), (46, 4333), (237, 4091), (19, 4287), (18, 4193), (253, 4349), (24, 4191), (28, 4277), (20, 4143), (11, 4193), (14, 4093), (21, 4197), (22, 4052), (203, 4029), (205, 4153), (192, 4183), (20, 4084), (186, 4128)]
         : compromised: 0.0127, honest: 0.0563
Round 003: test acc mean=0.0521 ± 0.0049 | min=0.0432 max=0.0596
         : test loss mean=nan ± nan
         : individual accs = ['0.059593', '0.048775', '0.057584', '0.043157', '0.057932', '0.045253', '0.050799', '0.058174', '0.051062', '0.044891', '0.047550', '0.054376', '0.054239', '0.049083', '0.047878', '0.056590', '0.058271', '0.049486', '0.052889', '0.054506']
         : correct/total = [(246, 4128), (205, 4203), (235, 4081), (187, 4333), (237, 4091), (194, 4287), (213, 4193), (253, 4349), (214, 4191), (192, 4277), (197, 4143), (228, 4193), (222, 4093), (206, 4197), (194, 4052), (228, 4029), (242, 4153), (207, 4183), (216, 4084), (225, 4128)]
         : compromised: 0.0505, honest: 0.0585
Round 004: test acc mean=0.0515 ± 0.0047 | min=0.0432 max=0.0596
         : test loss mean=nan ± nan
         : individual accs = ['0.059593', '0.048775', '0.053418', '0.043157', '0.057932', '0.045253', '0.050799', '0.058634', '0.049630', '0.043488', '0.048033', '0.049606', '0.054239', '0.049083', '0.051826', '0.051626', '0.058271', '0.049486', '0.052889', '0.054506']
         : correct/total = [(246, 4128), (205, 4203), (218, 4081), (187, 4333), (237, 4091), (194, 4287), (213, 4193), (255, 4349), (208, 4191), (186, 4277), (199, 4143), (208, 4193), (222, 4093), (206, 4197), (210, 4052), (208, 4029), (242, 4153), (207, 4183), (216, 4084), (225, 4128)]
         : compromised: 0.0497, honest: 0.0586
Round 005: test acc mean=0.0530 ± 0.0112 | min=0.0432 max=0.0983
         : test loss mean=nan ± nan
         : individual accs = ['0.059593', '0.048775', '0.053418', '0.043157', '0.098264', '0.045253', '0.050799', '0.047827', '0.049630', '0.043488', '0.048033', '0.049606', '0.054239', '0.049083', '0.051826', '0.051626', '0.058271', '0.049486', '0.052889', '0.054506']
         : correct/total = [(246, 4128), (205, 4203), (218, 4081), (187, 4333), (402, 4091), (194, 4287), (213, 4193), (208, 4349), (208, 4191), (186, 4277), (199, 4143), (208, 4193), (222, 4093), (206, 4197), (210, 4052), (208, 4029), (242, 4153), (207, 4183), (216, 4084), (225, 4128)]
         : compromised: 0.0497, honest: 0.0660
Round 006: test acc mean=0.0509 ± 0.0069 | min=0.0432 max=0.0775
         : test loss mean=nan ± nan
         : individual accs = ['0.044574', '0.048775', '0.053418', '0.043157', '0.077487', '0.045253', '0.050799', '0.051276', '0.049630', '0.043488', '0.048033', '0.049606', '0.054239', '0.049083', '0.051826', '0.051626', '0.049362', '0.049486', '0.052889', '0.054506']
         : correct/total = [(184, 4128), (205, 4203), (218, 4081), (187, 4333), (317, 4091), (194, 4287), (213, 4193), (223, 4349), (208, 4191), (186, 4277), (199, 4143), (208, 4193), (222, 4093), (206, 4197), (210, 4052), (208, 4029), (205, 4153), (207, 4183), (216, 4084), (225, 4128)]
         : compromised: 0.0497, honest: 0.0557
Round 007: test acc mean=0.0520 ± 0.0096 | min=0.0432 max=0.0901
         : test loss mean=nan ± nan
         : individual accs = ['0.090116', '0.048775', '0.053418', '0.043157', '0.047421', '0.045253', '0.050799', '0.045528', '0.049630', '0.043488', '0.048033', '0.049606', '0.054239', '0.049083', '0.051826', '0.051626', '0.060197', '0.049486', '0.052889', '0.054506']
         : correct/total = [(372, 4128), (205, 4203), (218, 4081), (187, 4333), (194, 4091), (194, 4287), (213, 4193), (198, 4349), (208, 4191), (186, 4277), (199, 4143), (208, 4193), (222, 4093), (206, 4197), (210, 4052), (208, 4029), (250, 4153), (207, 4183), (216, 4084), (225, 4128)]
         : compromised: 0.0497, honest: 0.0608
Round 008: test acc mean=0.0500 ± 0.0035 | min=0.0432 max=0.0551
         : test loss mean=nan ± nan
         : individual accs = ['0.051599', '0.048775', '0.053418', '0.043157', '0.052066', '0.045253', '0.050799', '0.045068', '0.049630', '0.043488', '0.048033', '0.049606', '0.054239', '0.049083', '0.051826', '0.051626', '0.055141', '0.049486', '0.052889', '0.054506']
         : correct/total = [(213, 4128), (205, 4203), (218, 4081), (187, 4333), (213, 4091), (194, 4287), (213, 4193), (196, 4349), (208, 4191), (186, 4277), (199, 4143), (208, 4193), (222, 4093), (206, 4197), (210, 4052), (208, 4029), (229, 4153), (207, 4183), (216, 4084), (225, 4128)]
         : compromised: 0.0497, honest: 0.0510
Round 009: test acc mean=0.0538 ± 0.0133 | min=0.0432 max=0.0981
         : test loss mean=nan ± nan
         : individual accs = ['0.098110', '0.048775', '0.053418', '0.043157', '0.085554', '0.045253', '0.050799', '0.043918', '0.049630', '0.043488', '0.048033', '0.049606', '0.054239', '0.049083', '0.051826', '0.051626', '0.052011', '0.049486', '0.052889', '0.054506']
         : correct/total = [(405, 4128), (205, 4203), (218, 4081), (187, 4333), (350, 4091), (194, 4287), (213, 4193), (191, 4349), (208, 4191), (186, 4277), (199, 4143), (208, 4193), (222, 4093), (206, 4197), (210, 4052), (208, 4029), (216, 4153), (207, 4183), (216, 4084), (225, 4128)]
         : compromised: 0.0497, honest: 0.0699
Round 010: test acc mean=0.0516 ± 0.0049 | min=0.0432 max=0.0610
         : test loss mean=nan ± nan
         : individual accs = ['0.061047', '0.048775', '0.053418', '0.043157', '0.057932', '0.045253', '0.050799', '0.058404', '0.049630', '0.043488', '0.048033', '0.049606', '0.054239', '0.049083', '0.051826', '0.051626', '0.059716', '0.049486', '0.052889', '0.054506']
         : correct/total = [(252, 4128), (205, 4203), (218, 4081), (187, 4333), (237, 4091), (194, 4287), (213, 4193), (254, 4349), (208, 4191), (186, 4277), (199, 4143), (208, 4193), (222, 4093), (206, 4197), (210, 4052), (208, 4029), (248, 4153), (207, 4183), (216, 4084), (225, 4128)]
         : compromised: 0.0497, honest: 0.0593

=== FINAL RESULTS ===
Dataset: femnist, Nodes: 20, Graph: erdos, Aggregation: balance
Attack: backdoor, 80.0% compromised
Final accuracy - Compromised: 0.0497, Honest: 0.0593
Overall test accuracy: mean=0.0516 ± 0.0049

=== BACKDOOR ATTACK SUCCESS RATE (ASR) ===
Target label: 0
Trigger size: 4x4
Overall ASR: 0.8000 ± 0.4000
Honest nodes ASR: 0.0000 ± 0.0000
Compromised nodes ASR: 1.0000 ± 0.0000
Note: Higher ASR indicates more successful backdoor attack

=== BALANCE SUMMARY ===
Node 0: acceptance=0.167
Node 1: acceptance=0.240
Node 2: acceptance=0.225
Node 3: acceptance=0.214
Node 4: acceptance=0.222
Node 5: acceptance=0.120
Node 6: acceptance=0.208
Node 7: acceptance=0.091
Node 8: acceptance=0.214
Node 9: acceptance=0.236
Node 10: acceptance=0.225
Node 11: acceptance=0.208
Node 12: acceptance=0.225
Node 13: acceptance=0.111
Node 14: acceptance=0.221
Node 15: acceptance=0.222
Node 16: acceptance=0.143
Node 17: acceptance=0.237
Node 18: acceptance=0.225
Node 19: acceptance=0.100

=== PARALLEL EXECUTION TIME (realistic for distributed system) ===
  COMMUNICATION (max across nodes):
    - Full model transfer: 0.000s (0.0%)
  COMPUTATION (max across nodes):
    - Filtering: 0.051s (79.6%)
    - Aggregation: 0.013s (20.4%)
  TOTALS:
    - Total computation: 0.064s (100.0%)
    - Total communication: 0.000s (0.0%)
    - Total parallel time: 0.065s

=== PER-NODE AVERAGE TIME ===
  - Filtering: 0.041s
  - Aggregation: 0.004s
  - Model transfer: 0.000s
  - Total per node: 0.045s

=== TOTAL COMPUTATIONAL WORK (sum across all nodes) ===
  - Total filtering: 0.828s
  - Total aggregation: 0.080s
  - Total model transfer: 0.000s
  - Grand total: 0.908s
  - Mean acceptance rate: 0.193

BALANCE Algorithm Properties:
  - Model dimension: 6,603,710
  - No compression: Full parameter comparison
  - Theoretical complexity: O(deg(i)×d)
  - Approach: Full parameter filtering + averaging
