Device: cuda
Seed: 987654321
Loading 36 LEAF FEMNIST train files...
LEAF FEMNIST train: 3597 users, 734463 samples
Loading 36 LEAF FEMNIST test files...
LEAF FEMNIST test: 3597 users, 83388 samples
Found 3597 train users, 3597 test users, 3597 common users
User sample counts range: 525 (max) to 17 (min)
Distributed ALL 3597 users across 20 clients
Users per client: 179 (with 17 clients getting +1 user)
Train partition sizes: [36360, 37070, 35957, 38262, 36024, 37732, 36921, 38328, 36867, 37683, 36507, 36915, 36007, 37001, 35681, 35453, 36585, 36801, 35964, 36345]
Test partition sizes: [4128, 4203, 4081, 4333, 4091, 4287, 4193, 4349, 4191, 4277, 4143, 4193, 4093, 4197, 4052, 4029, 4153, 4183, 4084, 4128]
  Client 0: 36360 train samples, 62 unique classes
  Client 1: 37070 train samples, 62 unique classes
  Client 2: 35957 train samples, 62 unique classes
  Client 3: 38262 train samples, 62 unique classes
  Client 4: 36024 train samples, 62 unique classes
  Client 5: 37732 train samples, 62 unique classes
  Client 6: 36921 train samples, 62 unique classes
  Client 7: 38328 train samples, 62 unique classes
  Client 8: 36867 train samples, 62 unique classes
  Client 9: 37683 train samples, 62 unique classes
  Client 10: 36507 train samples, 62 unique classes
  Client 11: 36915 train samples, 62 unique classes
  Client 12: 36007 train samples, 62 unique classes
  Client 13: 37001 train samples, 62 unique classes
  Client 14: 35681 train samples, 62 unique classes
  Client 15: 35453 train samples, 62 unique classes
  Client 16: 36585 train samples, 62 unique classes
  Client 17: 36801 train samples, 62 unique classes
  Client 18: 35964 train samples, 62 unique classes
  Client 19: 36345 train samples, 62 unique classes
Will sample 4500 samples per client per epoch
Graph: erdos, nodes: 20, edges: 48
Degree statistics: avg=4.80, min=2, max=7
Attack: Compromised 14/20 nodes: [1, 2, 3, 5, 6, 8, 11, 12, 13, 14, 15, 17, 18, 19]
Attack type: directed_deviation, lambda: 1.0
Model variant: baseline
Model parameters: 6,603,710
Initial test acc across nodes: mean=0.0168 ± 0.0139
Round 001: test acc mean=0.0164 ± 0.0172 | min=0.0026 max=0.0527
         : test loss mean=99376.6955 ± 82142.3737
         : individual accs = ['0.009205', '0.021889', '0.052683', '0.007154', '0.042288', '0.005598', '0.005247', '0.045298', '0.006204', '0.003975', '0.004827', '0.003339', '0.049597', '0.004527', '0.006170', '0.005212', '0.002649', '0.007650', '0.010529', '0.034884']
         : correct/total = [(38, 4128), (92, 4203), (215, 4081), (31, 4333), (173, 4091), (24, 4287), (22, 4193), (197, 4349), (26, 4191), (17, 4277), (20, 4143), (14, 4193), (203, 4093), (19, 4197), (25, 4052), (21, 4029), (11, 4153), (32, 4183), (43, 4084), (144, 4128)]
         : compromised: 0.0158, honest: 0.0180
Round 002: test acc mean=0.0492 ± 0.0053 | min=0.0393 max=0.0618
         : test loss mean=nan ± nan
         : individual accs = ['0.047238', '0.046158', '0.057584', '0.048465', '0.043021', '0.045253', '0.057000', '0.045068', '0.053209', '0.039280', '0.045619', '0.061770', '0.049597', '0.049083', '0.050346', '0.051626', '0.044546', '0.051159', '0.052889', '0.045058']
         : correct/total = [(195, 4128), (194, 4203), (235, 4081), (210, 4333), (176, 4091), (194, 4287), (239, 4193), (196, 4349), (223, 4191), (168, 4277), (189, 4143), (259, 4193), (203, 4093), (206, 4197), (204, 4052), (208, 4029), (185, 4153), (214, 4183), (216, 4084), (186, 4128)]
         : compromised: 0.0514, honest: 0.0441
Round 003: test acc mean=0.0455 ± 0.0068 | min=0.0281 max=0.0549
         : test loss mean=nan ± nan
         : individual accs = ['0.048934', '0.049726', '0.048272', '0.048465', '0.037644', '0.038955', '0.046745', '0.045528', '0.054880', '0.050503', '0.036688', '0.028142', '0.048620', '0.049083', '0.047878', '0.032266', '0.047195', '0.048291', '0.052889', '0.048692']
         : correct/total = [(202, 4128), (209, 4203), (197, 4081), (210, 4333), (154, 4091), (167, 4287), (196, 4193), (198, 4349), (230, 4191), (216, 4277), (152, 4143), (118, 4193), (199, 4093), (206, 4197), (194, 4052), (130, 4029), (196, 4153), (202, 4183), (216, 4084), (201, 4128)]
         : compromised: 0.0459, honest: 0.0444
Round 004: test acc mean=0.0467 ± 0.0056 | min=0.0322 max=0.0561
         : test loss mean=nan ± nan
         : individual accs = ['0.048934', '0.050916', '0.056114', '0.043157', '0.047421', '0.048752', '0.048414', '0.045528', '0.043188', '0.047229', '0.047309', '0.046745', '0.048620', '0.049083', '0.047878', '0.053860', '0.047195', '0.048291', '0.032321', '0.032219']
         : correct/total = [(202, 4128), (214, 4203), (229, 4081), (187, 4333), (194, 4091), (209, 4287), (203, 4193), (198, 4349), (181, 4191), (202, 4277), (196, 4143), (196, 4193), (199, 4093), (206, 4197), (194, 4052), (217, 4029), (196, 4153), (202, 4183), (132, 4084), (133, 4128)]
         : compromised: 0.0464, honest: 0.0473
Round 005: test acc mean=0.0465 ± 0.0046 | min=0.0323 max=0.0561
         : test loss mean=nan ± nan
         : individual accs = ['0.048934', '0.050202', '0.056114', '0.043157', '0.047421', '0.038955', '0.048414', '0.045528', '0.043188', '0.047229', '0.047309', '0.045314', '0.048620', '0.049083', '0.047878', '0.032266', '0.047195', '0.045900', '0.048482', '0.048692']
         : correct/total = [(202, 4128), (211, 4203), (229, 4081), (187, 4333), (194, 4091), (167, 4287), (203, 4193), (198, 4349), (181, 4191), (202, 4277), (196, 4143), (190, 4193), (199, 4093), (206, 4197), (194, 4052), (130, 4029), (196, 4153), (192, 4183), (198, 4084), (201, 4128)]
         : compromised: 0.0462, honest: 0.0473
Round 006: test acc mean=0.0456 ± 0.0062 | min=0.0322 max=0.0561
         : test loss mean=nan ± nan
         : individual accs = ['0.049661', '0.050916', '0.056114', '0.043157', '0.047421', '0.038955', '0.048414', '0.045528', '0.043188', '0.044891', '0.036688', '0.045314', '0.052040', '0.049083', '0.047878', '0.032266', '0.051047', '0.048291', '0.048482', '0.032219']
         : correct/total = [(205, 4128), (214, 4203), (229, 4081), (187, 4333), (194, 4091), (167, 4287), (203, 4193), (198, 4349), (181, 4191), (192, 4277), (152, 4143), (190, 4193), (213, 4093), (206, 4197), (194, 4052), (130, 4029), (212, 4153), (202, 4183), (198, 4084), (133, 4128)]
         : compromised: 0.0455, honest: 0.0459
Round 007: test acc mean=0.0459 ± 0.0050 | min=0.0323 max=0.0561
         : test loss mean=nan ± nan
         : individual accs = ['0.048934', '0.036878', '0.056114', '0.043157', '0.047421', '0.038955', '0.048414', '0.045528', '0.043188', '0.047229', '0.047309', '0.046745', '0.048620', '0.049083', '0.047878', '0.032266', '0.047195', '0.045900', '0.048482', '0.048692']
         : correct/total = [(202, 4128), (155, 4203), (229, 4081), (187, 4333), (194, 4091), (167, 4287), (203, 4193), (198, 4349), (181, 4191), (202, 4277), (196, 4143), (196, 4193), (199, 4093), (206, 4197), (194, 4052), (130, 4029), (196, 4153), (192, 4183), (198, 4084), (201, 4128)]
         : compromised: 0.0453, honest: 0.0473
Round 008: test acc mean=0.0464 ± 0.0046 | min=0.0323 max=0.0561
         : test loss mean=nan ± nan
         : individual accs = ['0.048934', '0.048775', '0.056114', '0.043157', '0.047421', '0.038955', '0.048414', '0.045528', '0.043188', '0.047229', '0.047309', '0.045314', '0.048620', '0.049083', '0.047878', '0.032266', '0.047195', '0.045900', '0.048482', '0.048692']
         : correct/total = [(202, 4128), (205, 4203), (229, 4081), (187, 4333), (194, 4091), (167, 4287), (203, 4193), (198, 4349), (181, 4191), (202, 4277), (196, 4143), (190, 4193), (199, 4093), (206, 4197), (194, 4052), (130, 4029), (196, 4153), (192, 4183), (198, 4084), (201, 4128)]
         : compromised: 0.0461, honest: 0.0473
Round 009: test acc mean=0.0444 ± 0.0063 | min=0.0322 max=0.0561
         : test loss mean=nan ± nan
         : individual accs = ['0.048934', '0.048775', '0.056114', '0.043157', '0.047421', '0.038955', '0.048414', '0.045528', '0.043188', '0.047229', '0.036688', '0.045314', '0.049597', '0.049083', '0.047878', '0.032266', '0.047195', '0.045900', '0.033301', '0.032219']
         : correct/total = [(202, 4128), (205, 4203), (229, 4081), (187, 4333), (194, 4091), (167, 4287), (203, 4193), (198, 4349), (181, 4191), (202, 4277), (152, 4143), (190, 4193), (203, 4093), (206, 4197), (194, 4052), (130, 4029), (196, 4153), (192, 4183), (136, 4084), (133, 4128)]
         : compromised: 0.0439, honest: 0.0455
Round 010: test acc mean=0.0449 ± 0.0061 | min=0.0322 max=0.0561
         : test loss mean=nan ± nan
         : individual accs = ['0.048934', '0.048775', '0.056114', '0.043157', '0.047421', '0.038955', '0.048414', '0.045528', '0.043188', '0.047229', '0.047309', '0.046745', '0.048620', '0.049083', '0.047878', '0.032266', '0.047195', '0.045900', '0.033301', '0.032219']
         : correct/total = [(202, 4128), (205, 4203), (229, 4081), (187, 4333), (194, 4091), (167, 4287), (203, 4193), (198, 4349), (181, 4191), (202, 4277), (196, 4143), (196, 4193), (199, 4093), (206, 4197), (194, 4052), (130, 4029), (196, 4153), (192, 4183), (136, 4084), (133, 4128)]
         : compromised: 0.0439, honest: 0.0473

=== FINAL RESULTS ===
Dataset: femnist, Nodes: 20, Graph: erdos, Aggregation: d-fedavg
Attack: directed_deviation, 70.0% compromised
Final accuracy - Compromised: 0.0439, Honest: 0.0473
Overall test accuracy: mean=0.0449 ± 0.0061
