Device: cuda
Seed: 987654321
Loading 36 LEAF FEMNIST train files...
LEAF FEMNIST train: 3597 users, 734463 samples
Loading 36 LEAF FEMNIST test files...
LEAF FEMNIST test: 3597 users, 83388 samples
Found 3597 train users, 3597 test users, 3597 common users
User sample counts range: 525 (max) to 17 (min)
Distributed ALL 3597 users across 20 clients
Users per client: 179 (with 17 clients getting +1 user)
Train partition sizes: [36360, 37070, 35957, 38262, 36024, 37732, 36921, 38328, 36867, 37683, 36507, 36915, 36007, 37001, 35681, 35453, 36585, 36801, 35964, 36345]
Test partition sizes: [4128, 4203, 4081, 4333, 4091, 4287, 4193, 4349, 4191, 4277, 4143, 4193, 4093, 4197, 4052, 4029, 4153, 4183, 4084, 4128]
  Client 0: 36360 train samples, 62 unique classes
  Client 1: 37070 train samples, 62 unique classes
  Client 2: 35957 train samples, 62 unique classes
  Client 3: 38262 train samples, 62 unique classes
  Client 4: 36024 train samples, 62 unique classes
  Client 5: 37732 train samples, 62 unique classes
  Client 6: 36921 train samples, 62 unique classes
  Client 7: 38328 train samples, 62 unique classes
  Client 8: 36867 train samples, 62 unique classes
  Client 9: 37683 train samples, 62 unique classes
  Client 10: 36507 train samples, 62 unique classes
  Client 11: 36915 train samples, 62 unique classes
  Client 12: 36007 train samples, 62 unique classes
  Client 13: 37001 train samples, 62 unique classes
  Client 14: 35681 train samples, 62 unique classes
  Client 15: 35453 train samples, 62 unique classes
  Client 16: 36585 train samples, 62 unique classes
  Client 17: 36801 train samples, 62 unique classes
  Client 18: 35964 train samples, 62 unique classes
  Client 19: 36345 train samples, 62 unique classes
Will sample 4500 samples per client per epoch
Graph: erdos, nodes: 20, edges: 48
Degree statistics: avg=4.80, min=2, max=7
Attack: Compromised 4/20 nodes: [5, 12, 13, 17]
Attack type: backdoor, lambda: 1.0
Backdoor target label: 0, trigger size: 4
Model variant: baseline
Model parameters: 6,603,710
Initial test acc across nodes: mean=0.0168 ± 0.0139
Backdoor attack: Created poisoned datasets for 4 compromised nodes
Round 001: test acc mean=0.0358 ± 0.0204 | min=0.0032 max=0.0621
         : test loss mean=2951.0001 ± 5803.8673
         : individual accs = ['0.040698', '0.052344', '0.054889', '0.003231', '0.062088', '0.045953', '0.019795', '0.041619', '0.053209', '0.053776', '0.045619', '0.012879', '0.012460', '0.011198', '0.061204', '0.013899', '0.006742', '0.015300', '0.055583', '0.054506']
         : correct/total = [(168, 4128), (220, 4203), (224, 4081), (14, 4333), (254, 4091), (197, 4287), (83, 4193), (181, 4349), (223, 4191), (230, 4277), (189, 4143), (54, 4193), (51, 4093), (47, 4197), (248, 4052), (56, 4029), (28, 4153), (64, 4183), (227, 4084), (225, 4128)]
         : compromised: 0.0212, honest: 0.0395
Round 002: test acc mean=0.0376 ± 0.0152 | min=0.0153 max=0.0555
         : test loss mean=64371.6206 ± 162326.9559
         : individual accs = ['0.049176', '0.049726', '0.045087', '0.047773', '0.047421', '0.018661', '0.048891', '0.045528', '0.043188', '0.047697', '0.047309', '0.053184', '0.016858', '0.017632', '0.015301', '0.016629', '0.019745', '0.015778', '0.051665', '0.055475']
         : correct/total = [(203, 4128), (209, 4203), (184, 4081), (207, 4333), (194, 4091), (80, 4287), (205, 4193), (198, 4349), (181, 4191), (204, 4277), (196, 4143), (223, 4193), (69, 4093), (74, 4197), (62, 4052), (67, 4029), (82, 4153), (66, 4183), (211, 4084), (229, 4128)]
         : compromised: 0.0172, honest: 0.0427
Round 003: test acc mean=0.0494 ± 0.0037 | min=0.0422 max=0.0560
         : test loss mean=1296743.3151 ± 5651236.5610
         : individual accs = ['0.050145', '0.048775', '0.052683', '0.044773', '0.048643', '0.045953', '0.044598', '0.049207', '0.042233', '0.047697', '0.055998', '0.054376', '0.054239', '0.045747', '0.051826', '0.051626', '0.052011', '0.049486', '0.052889', '0.045058']
         : correct/total = [(207, 4128), (205, 4203), (215, 4081), (194, 4333), (199, 4091), (197, 4287), (187, 4193), (214, 4349), (177, 4191), (204, 4277), (232, 4143), (228, 4193), (222, 4093), (192, 4197), (210, 4052), (208, 4029), (216, 4153), (207, 4183), (216, 4084), (186, 4128)]
         : compromised: 0.0489, honest: 0.0495
Round 004: test acc mean=0.0489 ± 0.0036 | min=0.0435 max=0.0553
         : test loss mean=277.2235 ± 290.2982
         : individual accs = ['0.047238', '0.052344', '0.045087', '0.046619', '0.052066', '0.045953', '0.043883', '0.053116', '0.053209', '0.043488', '0.047550', '0.054376', '0.045688', '0.055278', '0.050346', '0.050881', '0.044546', '0.048291', '0.048482', '0.048692']
         : correct/total = [(195, 4128), (220, 4203), (184, 4081), (202, 4333), (213, 4091), (197, 4287), (184, 4193), (231, 4349), (223, 4191), (186, 4277), (197, 4143), (228, 4193), (187, 4093), (232, 4197), (204, 4052), (205, 4029), (185, 4153), (202, 4183), (198, 4084), (201, 4128)]
         : compromised: 0.0488, honest: 0.0489
Round 005: test acc mean=0.0492 ± 0.0097 | min=0.0133 max=0.0612
         : test loss mean=913.8132 ± 3284.9029
         : individual accs = ['0.050145', '0.013324', '0.057584', '0.046619', '0.057932', '0.045953', '0.043883', '0.053116', '0.042233', '0.048398', '0.047550', '0.054376', '0.052040', '0.055278', '0.061204', '0.050881', '0.058271', '0.048291', '0.051665', '0.045058']
         : correct/total = [(207, 4128), (56, 4203), (235, 4081), (202, 4333), (237, 4091), (197, 4287), (184, 4193), (231, 4349), (177, 4191), (207, 4277), (197, 4143), (228, 4193), (213, 4093), (232, 4197), (248, 4052), (205, 4029), (242, 4153), (202, 4183), (211, 4084), (186, 4128)]
         : compromised: 0.0504, honest: 0.0489
Round 006: test acc mean=0.0507 ± 0.0043 | min=0.0422 max=0.0624
         : test loss mean=28.9507 ± 41.0257
         : individual accs = ['0.049661', '0.051630', '0.054889', '0.052850', '0.052066', '0.045953', '0.048891', '0.053116', '0.042233', '0.053075', '0.047309', '0.053899', '0.052040', '0.062426', '0.045656', '0.050881', '0.051047', '0.048291', '0.052889', '0.045058']
         : correct/total = [(205, 4128), (217, 4203), (224, 4081), (229, 4333), (213, 4091), (197, 4287), (205, 4193), (231, 4349), (177, 4191), (227, 4277), (196, 4143), (226, 4193), (213, 4093), (262, 4197), (185, 4052), (205, 4029), (212, 4153), (202, 4183), (216, 4084), (186, 4128)]
         : compromised: 0.0522, honest: 0.0503
Round 007: test acc mean=0.0538 ± 0.0050 | min=0.0422 max=0.0624
         : test loss mean=10.5439 ± 16.4750
         : individual accs = ['0.059593', '0.049726', '0.054889', '0.052850', '0.057932', '0.050618', '0.057000', '0.058174', '0.042233', '0.048398', '0.055998', '0.053899', '0.058637', '0.062426', '0.051826', '0.056590', '0.058271', '0.050920', '0.051665', '0.045058']
         : correct/total = [(246, 4128), (209, 4203), (224, 4081), (229, 4333), (237, 4091), (217, 4287), (239, 4193), (253, 4349), (177, 4191), (207, 4277), (232, 4143), (226, 4193), (240, 4093), (262, 4197), (210, 4052), (228, 4029), (242, 4153), (213, 4183), (211, 4084), (186, 4128)]
         : compromised: 0.0557, honest: 0.0534
Round 008: test acc mean=0.0492 ± 0.0041 | min=0.0422 max=0.0582
         : test loss mean=9.4653 ± 16.9056
         : individual accs = ['0.047238', '0.047109', '0.054889', '0.044773', '0.047421', '0.050618', '0.048891', '0.058174', '0.042233', '0.053075', '0.047309', '0.053899', '0.049597', '0.045747', '0.051826', '0.053860', '0.044546', '0.045900', '0.051665', '0.045058']
         : correct/total = [(195, 4128), (198, 4203), (224, 4081), (194, 4333), (194, 4091), (217, 4287), (205, 4193), (253, 4349), (177, 4191), (227, 4277), (196, 4143), (226, 4193), (203, 4093), (192, 4197), (210, 4052), (217, 4029), (185, 4153), (192, 4183), (211, 4084), (186, 4128)]
         : compromised: 0.0480, honest: 0.0495
Round 009: test acc mean=0.0509 ± 0.0047 | min=0.0422 max=0.0596
         : test loss mean=9.2105 ± 20.7571
         : individual accs = ['0.059593', '0.048775', '0.052683', '0.052850', '0.057932', '0.045253', '0.057000', '0.045068', '0.042233', '0.047697', '0.055998', '0.049606', '0.049841', '0.045747', '0.051826', '0.056590', '0.052011', '0.050920', '0.051665', '0.045058']
         : correct/total = [(246, 4128), (205, 4203), (215, 4081), (229, 4333), (237, 4091), (194, 4287), (239, 4193), (196, 4349), (177, 4191), (204, 4277), (232, 4143), (208, 4193), (204, 4093), (192, 4197), (210, 4052), (228, 4029), (216, 4153), (213, 4183), (211, 4084), (186, 4128)]
         : compromised: 0.0479, honest: 0.0517
Round 010: test acc mean=0.0482 ± 0.0036 | min=0.0422 max=0.0553
         : test loss mean=8.4152 ± 16.9596
         : individual accs = ['0.047238', '0.047109', '0.054889', '0.044773', '0.047421', '0.045253', '0.048891', '0.045068', '0.042233', '0.047463', '0.047309', '0.049606', '0.049597', '0.055278', '0.051826', '0.053860', '0.044546', '0.045900', '0.051665', '0.045058']
         : correct/total = [(195, 4128), (198, 4203), (224, 4081), (194, 4333), (194, 4091), (194, 4287), (205, 4193), (196, 4349), (177, 4191), (203, 4277), (196, 4143), (208, 4193), (203, 4093), (232, 4197), (210, 4052), (217, 4029), (185, 4153), (192, 4183), (211, 4084), (186, 4128)]
         : compromised: 0.0490, honest: 0.0481

=== FINAL RESULTS ===
Dataset: femnist, Nodes: 20, Graph: erdos, Aggregation: d-fedavg
Attack: backdoor, 20.0% compromised
Final accuracy - Compromised: 0.0490, Honest: 0.0481
Overall test accuracy: mean=0.0482 ± 0.0036

=== BACKDOOR ATTACK SUCCESS RATE (ASR) ===
Target label: 0
Trigger size: 4x4
Overall ASR: 0.2000 ± 0.4000
Honest nodes ASR: 0.1875 ± 0.3903
Compromised nodes ASR: 0.2500 ± 0.4330
Note: Higher ASR indicates more successful backdoor attack
