Device: cuda
Seed: 987654321
Loading 36 LEAF FEMNIST train files...
LEAF FEMNIST train: 3597 users, 734463 samples
Loading 36 LEAF FEMNIST test files...
LEAF FEMNIST test: 3597 users, 83388 samples
Found 3597 train users, 3597 test users, 3597 common users
User sample counts range: 525 (max) to 17 (min)
Distributed ALL 3597 users across 20 clients
Users per client: 179 (with 17 clients getting +1 user)
Train partition sizes: [36360, 37070, 35957, 38262, 36024, 37732, 36921, 38328, 36867, 37683, 36507, 36915, 36007, 37001, 35681, 35453, 36585, 36801, 35964, 36345]
Test partition sizes: [4128, 4203, 4081, 4333, 4091, 4287, 4193, 4349, 4191, 4277, 4143, 4193, 4093, 4197, 4052, 4029, 4153, 4183, 4084, 4128]
  Client 0: 36360 train samples, 62 unique classes
  Client 1: 37070 train samples, 62 unique classes
  Client 2: 35957 train samples, 62 unique classes
  Client 3: 38262 train samples, 62 unique classes
  Client 4: 36024 train samples, 62 unique classes
  Client 5: 37732 train samples, 62 unique classes
  Client 6: 36921 train samples, 62 unique classes
  Client 7: 38328 train samples, 62 unique classes
  Client 8: 36867 train samples, 62 unique classes
  Client 9: 37683 train samples, 62 unique classes
  Client 10: 36507 train samples, 62 unique classes
  Client 11: 36915 train samples, 62 unique classes
  Client 12: 36007 train samples, 62 unique classes
  Client 13: 37001 train samples, 62 unique classes
  Client 14: 35681 train samples, 62 unique classes
  Client 15: 35453 train samples, 62 unique classes
  Client 16: 36585 train samples, 62 unique classes
  Client 17: 36801 train samples, 62 unique classes
  Client 18: 35964 train samples, 62 unique classes
  Client 19: 36345 train samples, 62 unique classes
Will sample 4500 samples per client per epoch
Graph: erdos, nodes: 20, edges: 48
Degree statistics: avg=4.80, min=2, max=7
Attack: Compromised 12/20 nodes: [1, 2, 3, 5, 8, 11, 12, 13, 14, 15, 17, 18]
Attack type: backdoor, lambda: 1.0
Backdoor target label: 0, trigger size: 4
Model variant: baseline
Model parameters: 6,603,710
Initial test acc across nodes: mean=0.0168 ± 0.0139
Backdoor attack: Created poisoned datasets for 12 compromised nodes
Round 001: test acc mean=0.0176 ± 0.0178 | min=0.0032 max=0.0503
         : test loss mean=63788.2825 ± 85575.5561
         : individual accs = ['0.004845', '0.023793', '0.048763', '0.048234', '0.007089', '0.007231', '0.006439', '0.003219', '0.004295', '0.045125', '0.005793', '0.011925', '0.003420', '0.007148', '0.050346', '0.008439', '0.008187', '0.044466', '0.005632', '0.006783']
         : correct/total = [(20, 4128), (100, 4203), (199, 4081), (209, 4333), (29, 4091), (31, 4287), (27, 4193), (14, 4349), (18, 4191), (193, 4277), (24, 4143), (50, 4193), (14, 4093), (30, 4197), (204, 4052), (34, 4029), (34, 4153), (186, 4183), (23, 4084), (28, 4128)]
         : compromised: 0.0220, honest: 0.0109
Round 002: test acc mean=0.0436 ± 0.0165 | min=0.0037 max=0.0545
         : test loss mean=nan ± nan
         : individual accs = ['0.051599', '0.051630', '0.053418', '0.003693', '0.052066', '0.045253', '0.005962', '0.053116', '0.044619', '0.044891', '0.048033', '0.054376', '0.053750', '0.049083', '0.046644', '0.005460', '0.054418', '0.048291', '0.050196', '0.054506']
         : correct/total = [(213, 4128), (217, 4203), (218, 4081), (16, 4333), (213, 4091), (194, 4287), (25, 4193), (231, 4349), (187, 4191), (192, 4277), (199, 4143), (228, 4193), (220, 4093), (206, 4197), (189, 4052), (22, 4029), (226, 4153), (202, 4183), (205, 4084), (225, 4128)]
         : compromised: 0.0422, honest: 0.0456
Round 003: test acc mean=0.0329 ± 0.0204 | min=0.0042 max=0.0545
         : test loss mean=nan ± nan
         : individual accs = ['0.045785', '0.006900', '0.004166', '0.036464', '0.052066', '0.045953', '0.005962', '0.053116', '0.005488', '0.046528', '0.051653', '0.041736', '0.005864', '0.049083', '0.046397', '0.005460', '0.005057', '0.045900', '0.050196', '0.054506']
         : correct/total = [(189, 4128), (29, 4203), (17, 4081), (158, 4333), (213, 4091), (197, 4287), (25, 4193), (231, 4349), (23, 4191), (199, 4277), (214, 4143), (175, 4193), (24, 4093), (206, 4197), (188, 4052), (22, 4029), (21, 4153), (192, 4183), (205, 4084), (225, 4128)]
         : compromised: 0.0286, honest: 0.0393
Round 004: test acc mean=0.0466 ± 0.0046 | min=0.0365 max=0.0529
         : test loss mean=nan ± nan
         : individual accs = ['0.045785', '0.051630', '0.048763', '0.036464', '0.051088', '0.047352', '0.042213', '0.051276', '0.040802', '0.046528', '0.051171', '0.041736', '0.050818', '0.049083', '0.048124', '0.041698', '0.040693', '0.050203', '0.052889', '0.043847']
         : correct/total = [(189, 4128), (217, 4203), (199, 4081), (158, 4333), (209, 4091), (203, 4287), (177, 4193), (223, 4349), (171, 4191), (199, 4277), (212, 4143), (175, 4193), (208, 4093), (206, 4197), (195, 4052), (168, 4029), (169, 4153), (210, 4183), (216, 4084), (181, 4128)]
         : compromised: 0.0466, honest: 0.0466
Round 005: test acc mean=0.0459 ± 0.0043 | min=0.0365 max=0.0529
         : test loss mean=nan ± nan
         : individual accs = ['0.045785', '0.042589', '0.048763', '0.036464', '0.051088', '0.048052', '0.042213', '0.051276', '0.040802', '0.046528', '0.050447', '0.041736', '0.050818', '0.049083', '0.046644', '0.041698', '0.040693', '0.045900', '0.052889', '0.044331']
         : correct/total = [(189, 4128), (179, 4203), (199, 4081), (158, 4333), (209, 4091), (206, 4287), (177, 4193), (223, 4349), (171, 4191), (199, 4277), (209, 4143), (175, 4193), (208, 4093), (206, 4197), (189, 4052), (168, 4029), (169, 4153), (192, 4183), (216, 4084), (183, 4128)]
         : compromised: 0.0455, honest: 0.0465
Round 006: test acc mean=0.0459 ± 0.0043 | min=0.0365 max=0.0529
         : test loss mean=nan ± nan
         : individual accs = ['0.045785', '0.042589', '0.048763', '0.036464', '0.051088', '0.048052', '0.042213', '0.051276', '0.040802', '0.046528', '0.050447', '0.041736', '0.050818', '0.049083', '0.046644', '0.041698', '0.040693', '0.045900', '0.052889', '0.044331']
         : correct/total = [(189, 4128), (179, 4203), (199, 4081), (158, 4333), (209, 4091), (206, 4287), (177, 4193), (223, 4349), (171, 4191), (199, 4277), (209, 4143), (175, 4193), (208, 4093), (206, 4197), (189, 4052), (168, 4029), (169, 4153), (192, 4183), (216, 4084), (183, 4128)]
         : compromised: 0.0455, honest: 0.0465
Round 007: test acc mean=0.0459 ± 0.0044 | min=0.0365 max=0.0529
         : test loss mean=nan ± nan
         : individual accs = ['0.045785', '0.042589', '0.048763', '0.036464', '0.051088', '0.048052', '0.042213', '0.051276', '0.040802', '0.046528', '0.051171', '0.041736', '0.050818', '0.049083', '0.046644', '0.041698', '0.040693', '0.045900', '0.052889', '0.044331']
         : correct/total = [(189, 4128), (179, 4203), (199, 4081), (158, 4333), (209, 4091), (206, 4287), (177, 4193), (223, 4349), (171, 4191), (199, 4277), (212, 4143), (175, 4193), (208, 4093), (206, 4197), (189, 4052), (168, 4029), (169, 4153), (192, 4183), (216, 4084), (183, 4128)]
         : compromised: 0.0455, honest: 0.0466
Round 008: test acc mean=0.0454 ± 0.0043 | min=0.0365 max=0.0529
         : test loss mean=nan ± nan
         : individual accs = ['0.045785', '0.042589', '0.048763', '0.036464', '0.051088', '0.047352', '0.042213', '0.041619', '0.040802', '0.046528', '0.051171', '0.041736', '0.050818', '0.049083', '0.046644', '0.041698', '0.040693', '0.045900', '0.052889', '0.044331']
         : correct/total = [(189, 4128), (179, 4203), (199, 4081), (158, 4333), (209, 4091), (203, 4287), (177, 4193), (181, 4349), (171, 4191), (199, 4277), (212, 4143), (175, 4193), (208, 4093), (206, 4197), (189, 4052), (168, 4029), (169, 4153), (192, 4183), (216, 4084), (183, 4128)]
         : compromised: 0.0454, honest: 0.0454
Round 009: test acc mean=0.0454 ± 0.0043 | min=0.0365 max=0.0529
         : test loss mean=nan ± nan
         : individual accs = ['0.045785', '0.042589', '0.048763', '0.036464', '0.051088', '0.047352', '0.042213', '0.041619', '0.040802', '0.046528', '0.051171', '0.041736', '0.050818', '0.049083', '0.046644', '0.041698', '0.040693', '0.045900', '0.052889', '0.044331']
         : correct/total = [(189, 4128), (179, 4203), (199, 4081), (158, 4333), (209, 4091), (203, 4287), (177, 4193), (181, 4349), (171, 4191), (199, 4277), (212, 4143), (175, 4193), (208, 4093), (206, 4197), (189, 4052), (168, 4029), (169, 4153), (192, 4183), (216, 4084), (183, 4128)]
         : compromised: 0.0454, honest: 0.0454
Round 010: test acc mean=0.0447 ± 0.0037 | min=0.0365 max=0.0512
         : test loss mean=nan ± nan
         : individual accs = ['0.045785', '0.042589', '0.048763', '0.036464', '0.043266', '0.047352', '0.042213', '0.041619', '0.040802', '0.046528', '0.051171', '0.041736', '0.050818', '0.049083', '0.046644', '0.041698', '0.040693', '0.045900', '0.045788', '0.044331']
         : correct/total = [(189, 4128), (179, 4203), (199, 4081), (158, 4333), (177, 4091), (203, 4287), (177, 4193), (181, 4349), (171, 4191), (199, 4277), (212, 4143), (175, 4193), (208, 4093), (206, 4197), (189, 4052), (168, 4029), (169, 4153), (192, 4183), (187, 4084), (183, 4128)]
         : compromised: 0.0448, honest: 0.0445

=== FINAL RESULTS ===
Dataset: femnist, Nodes: 20, Graph: erdos, Aggregation: d-fedavg
Attack: backdoor, 60.0% compromised
Final accuracy - Compromised: 0.0448, Honest: 0.0445
Overall test accuracy: mean=0.0447 ± 0.0037

=== BACKDOOR ATTACK SUCCESS RATE (ASR) ===
Target label: 0
Trigger size: 4x4
Overall ASR: 0.0500 ± 0.2179
Honest nodes ASR: 0.0000 ± 0.0000
Compromised nodes ASR: 0.0833 ± 0.2764
Note: Higher ASR indicates more successful backdoor attack
