Device: cuda
Seed: 987654321
Loading 36 LEAF FEMNIST train files...
LEAF FEMNIST train: 3597 users, 734463 samples
Loading 36 LEAF FEMNIST test files...
LEAF FEMNIST test: 3597 users, 83388 samples
Found 3597 train users, 3597 test users, 3597 common users
User sample counts range: 525 (max) to 17 (min)
Distributed ALL 3597 users across 20 clients
Users per client: 179 (with 17 clients getting +1 user)
Train partition sizes: [36360, 37070, 35957, 38262, 36024, 37732, 36921, 38328, 36867, 37683, 36507, 36915, 36007, 37001, 35681, 35453, 36585, 36801, 35964, 36345]
Test partition sizes: [4128, 4203, 4081, 4333, 4091, 4287, 4193, 4349, 4191, 4277, 4143, 4193, 4093, 4197, 4052, 4029, 4153, 4183, 4084, 4128]
  Client 0: 36360 train samples, 62 unique classes
  Client 1: 37070 train samples, 62 unique classes
  Client 2: 35957 train samples, 62 unique classes
  Client 3: 38262 train samples, 62 unique classes
  Client 4: 36024 train samples, 62 unique classes
  Client 5: 37732 train samples, 62 unique classes
  Client 6: 36921 train samples, 62 unique classes
  Client 7: 38328 train samples, 62 unique classes
  Client 8: 36867 train samples, 62 unique classes
  Client 9: 37683 train samples, 62 unique classes
  Client 10: 36507 train samples, 62 unique classes
  Client 11: 36915 train samples, 62 unique classes
  Client 12: 36007 train samples, 62 unique classes
  Client 13: 37001 train samples, 62 unique classes
  Client 14: 35681 train samples, 62 unique classes
  Client 15: 35453 train samples, 62 unique classes
  Client 16: 36585 train samples, 62 unique classes
  Client 17: 36801 train samples, 62 unique classes
  Client 18: 35964 train samples, 62 unique classes
  Client 19: 36345 train samples, 62 unique classes
Will sample 10000 samples per client per epoch
Graph: erdos, nodes: 20, edges: 126
Degree statistics: avg=12.60, min=8, max=16
Attack: Compromised 2/20 nodes: [5, 13]
Attack type: directed_deviation, lambda: 1.0
Model variant: baseline
Model parameters: 6,603,710
Sketchguard Node 0:
  Model dim: 6,603,710 → Sketch size: 1000
  Compression ratio: 6603.7x
  Using model parameters for aggregation, sketches for filtering
Sketchguard Node 1:
  Model dim: 6,603,710 → Sketch size: 1000
  Compression ratio: 6603.7x
  Using model parameters for aggregation, sketches for filtering
Sketchguard Node 2:
  Model dim: 6,603,710 → Sketch size: 1000
  Compression ratio: 6603.7x
  Using model parameters for aggregation, sketches for filtering
Sketchguard Node 3:
  Model dim: 6,603,710 → Sketch size: 1000
  Compression ratio: 6603.7x
  Using model parameters for aggregation, sketches for filtering
Sketchguard Node 4:
  Model dim: 6,603,710 → Sketch size: 1000
  Compression ratio: 6603.7x
  Using model parameters for aggregation, sketches for filtering
Sketchguard Node 5:
  Model dim: 6,603,710 → Sketch size: 1000
  Compression ratio: 6603.7x
  Using model parameters for aggregation, sketches for filtering
Sketchguard Node 6:
  Model dim: 6,603,710 → Sketch size: 1000
  Compression ratio: 6603.7x
  Using model parameters for aggregation, sketches for filtering
Sketchguard Node 7:
  Model dim: 6,603,710 → Sketch size: 1000
  Compression ratio: 6603.7x
  Using model parameters for aggregation, sketches for filtering
Sketchguard Node 8:
  Model dim: 6,603,710 → Sketch size: 1000
  Compression ratio: 6603.7x
  Using model parameters for aggregation, sketches for filtering
Sketchguard Node 9:
  Model dim: 6,603,710 → Sketch size: 1000
  Compression ratio: 6603.7x
  Using model parameters for aggregation, sketches for filtering
Sketchguard Node 10:
  Model dim: 6,603,710 → Sketch size: 1000
  Compression ratio: 6603.7x
  Using model parameters for aggregation, sketches for filtering
Sketchguard Node 11:
  Model dim: 6,603,710 → Sketch size: 1000
  Compression ratio: 6603.7x
  Using model parameters for aggregation, sketches for filtering
Sketchguard Node 12:
  Model dim: 6,603,710 → Sketch size: 1000
  Compression ratio: 6603.7x
  Using model parameters for aggregation, sketches for filtering
Sketchguard Node 13:
  Model dim: 6,603,710 → Sketch size: 1000
  Compression ratio: 6603.7x
  Using model parameters for aggregation, sketches for filtering
Sketchguard Node 14:
  Model dim: 6,603,710 → Sketch size: 1000
  Compression ratio: 6603.7x
  Using model parameters for aggregation, sketches for filtering
Sketchguard Node 15:
  Model dim: 6,603,710 → Sketch size: 1000
  Compression ratio: 6603.7x
  Using model parameters for aggregation, sketches for filtering
Sketchguard Node 16:
  Model dim: 6,603,710 → Sketch size: 1000
  Compression ratio: 6603.7x
  Using model parameters for aggregation, sketches for filtering
Sketchguard Node 17:
  Model dim: 6,603,710 → Sketch size: 1000
  Compression ratio: 6603.7x
  Using model parameters for aggregation, sketches for filtering
Sketchguard Node 18:
  Model dim: 6,603,710 → Sketch size: 1000
  Compression ratio: 6603.7x
  Using model parameters for aggregation, sketches for filtering
Sketchguard Node 19:
  Model dim: 6,603,710 → Sketch size: 1000
  Compression ratio: 6603.7x
  Using model parameters for aggregation, sketches for filtering
Sketchguard ALGORITHM (Sketch-based Filtering + State Aggregation)
  - Model dimension: 6,603,710 parameters
  - Config: SketchguardConfig(gamma=2, kappa=1, alpha=0.5, min_neighbors=1, sketch_size=1000, network_seed=987654321, attack_detection_window=5)
  - Sketch size: 1000
  - Compression ratio: 6603.7x
  - Complexity: O(d + N×k) = O(6,603,710 + 20×1000)
  - Theoretical speedup vs BALANCE: 19.9x
Initial test acc across nodes: mean=0.0168 ± 0.0139
Round 001: test acc mean=0.5136 ± 0.0321 | min=0.4588 max=0.5925
         : test loss mean=3.7236 ± 0.0285
         : individual accs = ['0.562984', '0.501784', '0.555501', '0.495500', '0.509900', '0.592489', '0.523253', '0.508163', '0.515390', '0.462240', '0.524982', '0.521107', '0.458832', '0.472242', '0.542201', '0.521966', '0.483265', '0.514702', '0.503183', '0.501453']
         : correct/total = [(2324, 4128), (2109, 4203), (2267, 4081), (2147, 4333), (2086, 4091), (2540, 4287), (2194, 4193), (2210, 4349), (2160, 4191), (1977, 4277), (2175, 4143), (2185, 4193), (1878, 4093), (1982, 4197), (2197, 4052), (2103, 4029), (2007, 4153), (2153, 4183), (2055, 4084), (2070, 4128)]
         : compromised: 0.5324, honest: 0.5115
         : sketchguard stats = ['Node 0: acc_rate=0.875', 'Node 1: acc_rate=0.909', 'Node 2: acc_rate=0.833']...
Round 002: test acc mean=0.6869 ± 0.0145 | min=0.6632 max=0.7189
         : test loss mean=3.3938 ± 0.0483
         : individual accs = ['0.698886', '0.689507', '0.688557', '0.696977', '0.697629', '0.718684', '0.663248', '0.681536', '0.680983', '0.670563', '0.689114', '0.683759', '0.677010', '0.684775', '0.692744', '0.664185', '0.674693', '0.718862', '0.689520', '0.677568']
         : correct/total = [(2885, 4128), (2898, 4203), (2810, 4081), (3020, 4333), (2854, 4091), (3081, 4287), (2781, 4193), (2964, 4349), (2854, 4191), (2868, 4277), (2855, 4143), (2867, 4193), (2771, 4093), (2874, 4197), (2807, 4052), (2676, 4029), (2802, 4153), (3007, 4183), (2816, 4084), (2797, 4128)]
         : compromised: 0.7017, honest: 0.6853
         : sketchguard stats = ['Node 0: acc_rate=0.875', 'Node 1: acc_rate=0.909', 'Node 2: acc_rate=0.833']...
Round 003: test acc mean=0.7109 ± 0.0228 | min=0.6462 max=0.7429
         : test loss mean=3.0820 ± 0.0845
         : individual accs = ['0.726986', '0.715917', '0.698113', '0.719825', '0.731362', '0.690460', '0.706892', '0.742929', '0.713434', '0.732055', '0.727009', '0.683520', '0.728317', '0.675244', '0.719398', '0.709357', '0.697086', '0.646187', '0.730411', '0.723595']
         : correct/total = [(3001, 4128), (3009, 4203), (2849, 4081), (3119, 4333), (2992, 4091), (2960, 4287), (2964, 4193), (3231, 4349), (2990, 4191), (3131, 4277), (3012, 4143), (2866, 4193), (2981, 4093), (2834, 4197), (2915, 4052), (2858, 4029), (2895, 4153), (2703, 4183), (2983, 4084), (2987, 4128)]
         : compromised: 0.6829, honest: 0.7140
         : sketchguard stats = ['Node 0: acc_rate=0.875', 'Node 1: acc_rate=0.909', 'Node 2: acc_rate=0.833']...
Round 004: test acc mean=0.7046 ± 0.0264 | min=0.6473 max=0.7449
         : test loss mean=2.6243 ± 0.1207
         : individual accs = ['0.716085', '0.744944', '0.687086', '0.708054', '0.742117', '0.647306', '0.716432', '0.719016', '0.713672', '0.684124', '0.681873', '0.716909', '0.674322', '0.662140', '0.707799', '0.714321', '0.742596', '0.721492', '0.718168', '0.674419']
         : correct/total = [(2956, 4128), (3131, 4203), (2804, 4081), (3068, 4333), (3036, 4091), (2775, 4287), (3004, 4193), (3127, 4349), (2991, 4191), (2926, 4277), (2825, 4143), (3006, 4193), (2760, 4093), (2779, 4197), (2868, 4052), (2878, 4029), (3084, 4153), (3018, 4183), (2933, 4084), (2784, 4128)]
         : compromised: 0.6547, honest: 0.7102
         : sketchguard stats = ['Node 0: acc_rate=0.875', 'Node 1: acc_rate=0.909', 'Node 2: acc_rate=0.833']...
Round 005: test acc mean=0.6820 ± 0.0304 | min=0.6200 max=0.7312
         : test loss mean=2.0246 ± 0.1356
         : individual accs = ['0.697432', '0.702355', '0.648125', '0.663974', '0.720606', '0.628645', '0.683997', '0.731203', '0.652589', '0.695347', '0.679218', '0.681135', '0.671879', '0.619967', '0.675716', '0.669149', '0.712979', '0.726512', '0.715720', '0.664244']
         : correct/total = [(2879, 4128), (2952, 4203), (2645, 4081), (2877, 4333), (2948, 4091), (2695, 4287), (2868, 4193), (3180, 4349), (2735, 4191), (2974, 4277), (2814, 4143), (2856, 4193), (2750, 4093), (2602, 4197), (2738, 4052), (2696, 4029), (2961, 4153), (3039, 4183), (2923, 4084), (2742, 4128)]
         : compromised: 0.6243, honest: 0.6885
         : sketchguard stats = ['Node 0: acc_rate=0.875', 'Node 1: acc_rate=0.909', 'Node 2: acc_rate=0.833']...
Round 006: test acc mean=0.7258 ± 0.0244 | min=0.6745 max=0.7588
         : test loss mean=1.3511 ± 0.0957
         : individual accs = ['0.733527', '0.751130', '0.710610', '0.685899', '0.753850', '0.684395', '0.737896', '0.717176', '0.727989', '0.689970', '0.738112', '0.742428', '0.725385', '0.674529', '0.744817', '0.728220', '0.747893', '0.758786', '0.745103', '0.718992']
         : correct/total = [(3028, 4128), (3157, 4203), (2900, 4081), (2972, 4333), (3084, 4091), (2934, 4287), (3094, 4193), (3119, 4349), (3051, 4191), (2951, 4277), (3058, 4143), (3113, 4193), (2969, 4093), (2831, 4197), (3018, 4052), (2934, 4029), (3106, 4153), (3174, 4183), (3043, 4084), (2968, 4128)]
         : compromised: 0.6795, honest: 0.7310
         : sketchguard stats = ['Node 0: acc_rate=0.875', 'Node 1: acc_rate=0.909', 'Node 2: acc_rate=0.833']...
Round 007: test acc mean=0.7882 ± 0.0102 | min=0.7702 max=0.8091
         : test loss mean=0.8327 ± 0.0365
         : individual accs = ['0.797238', '0.789674', '0.777996', '0.779368', '0.809093', '0.783998', '0.784403', '0.798804', '0.788117', '0.783493', '0.771422', '0.777248', '0.797459', '0.801763', '0.788746', '0.770166', '0.795329', '0.785082', '0.799951', '0.785126']
         : correct/total = [(3291, 4128), (3319, 4203), (3175, 4081), (3377, 4333), (3310, 4091), (3361, 4287), (3289, 4193), (3474, 4349), (3303, 4191), (3351, 4277), (3196, 4143), (3259, 4193), (3264, 4093), (3365, 4197), (3196, 4052), (3103, 4029), (3303, 4153), (3284, 4183), (3267, 4084), (3241, 4128)]
         : compromised: 0.7929, honest: 0.7877
         : sketchguard stats = ['Node 0: acc_rate=0.875', 'Node 1: acc_rate=0.909', 'Node 2: acc_rate=0.833']...
Round 008: test acc mean=0.8190 ± 0.0075 | min=0.8039 max=0.8335
         : test loss mean=0.5965 ± 0.0239
         : individual accs = ['0.819041', '0.827980', '0.827003', '0.819755', '0.824737', '0.821787', '0.813260', '0.833525', '0.815796', '0.827917', '0.811007', '0.816599', '0.822380', '0.819157', '0.805775', '0.803922', '0.818444', '0.810662', '0.825661', '0.814922']
         : correct/total = [(3381, 4128), (3480, 4203), (3375, 4081), (3552, 4333), (3374, 4091), (3523, 4287), (3410, 4193), (3625, 4349), (3419, 4191), (3541, 4277), (3360, 4143), (3424, 4193), (3366, 4093), (3438, 4197), (3265, 4052), (3239, 4029), (3399, 4153), (3391, 4183), (3372, 4084), (3364, 4128)]
         : compromised: 0.8205, honest: 0.8188
         : sketchguard stats = ['Node 0: acc_rate=0.875', 'Node 1: acc_rate=0.909', 'Node 2: acc_rate=0.833']...
Round 009: test acc mean=0.8304 ± 0.0073 | min=0.8215 max=0.8469
         : test loss mean=0.5294 ± 0.0210
         : individual accs = ['0.824855', '0.835594', '0.843911', '0.830372', '0.835737', '0.832750', '0.823515', '0.846861', '0.827726', '0.837269', '0.823316', '0.826139', '0.834840', '0.824637', '0.824284', '0.821544', '0.839875', '0.823572', '0.828355', '0.823159']
         : correct/total = [(3405, 4128), (3512, 4203), (3444, 4081), (3598, 4333), (3419, 4091), (3570, 4287), (3453, 4193), (3683, 4349), (3469, 4191), (3581, 4277), (3411, 4143), (3464, 4193), (3417, 4093), (3461, 4197), (3340, 4052), (3310, 4029), (3488, 4153), (3445, 4183), (3383, 4084), (3398, 4128)]
         : compromised: 0.8287, honest: 0.8306
         : sketchguard stats = ['Node 0: acc_rate=0.875', 'Node 1: acc_rate=0.909', 'Node 2: acc_rate=0.833']...
Round 010: test acc mean=0.8377 ± 0.0069 | min=0.8239 max=0.8473
         : test loss mean=0.4984 ± 0.0207
         : individual accs = ['0.833576', '0.841304', '0.844646', '0.837757', '0.845026', '0.838115', '0.831863', '0.847321', '0.838225', '0.846388', '0.836109', '0.824231', '0.841681', '0.840839', '0.830454', '0.830975', '0.844931', '0.833373', '0.844270', '0.823886']
         : correct/total = [(3441, 4128), (3536, 4203), (3447, 4081), (3630, 4333), (3457, 4091), (3593, 4287), (3488, 4193), (3685, 4349), (3513, 4191), (3620, 4277), (3464, 4143), (3456, 4193), (3445, 4093), (3529, 4197), (3365, 4052), (3348, 4029), (3509, 4153), (3486, 4183), (3448, 4084), (3401, 4128)]
         : compromised: 0.8395, honest: 0.8376
         : sketchguard stats = ['Node 0: acc_rate=0.875', 'Node 1: acc_rate=0.909', 'Node 2: acc_rate=0.833']...

=== FINAL RESULTS ===
Dataset: femnist, Nodes: 20, Graph: erdos, Aggregation: sketchguard
Attack: directed_deviation, 10.0% compromised
Final accuracy - Compromised: 0.8395, Honest: 0.8376
Overall test accuracy: mean=0.8377 ± 0.0069

=== Sketchguard SUMMARY ===
Node 0: acceptance=0.875
Node 1: acceptance=0.909
Node 2: acceptance=0.833
Node 3: acceptance=0.875
Node 4: acceptance=0.909
Node 5: acceptance=0.933
Node 6: acceptance=0.857
Node 7: acceptance=0.929
Node 8: acceptance=0.800
Node 9: acceptance=0.923
Node 10: acceptance=0.889
Node 11: acceptance=0.857
Node 12: acceptance=0.917
Node 13: acceptance=0.923
Node 14: acceptance=0.867
Node 15: acceptance=0.909
Node 16: acceptance=0.923
Node 17: acceptance=0.889
Node 18: acceptance=0.875
Node 19: acceptance=0.875

=== PARALLEL EXECUTION TIME (realistic for distributed system) ===
  COMMUNICATION (max across nodes):
    - Sketch transfer: 0.000s (0.0%)
    - Model fetch (accepted): 0.000s (0.0%)
  COMPUTATION (max across nodes):
    - Sketching: 5.394s (99.5%)
    - Filtering: 0.002s (0.0%)
    - Aggregation: 0.026s (0.5%)
  TOTALS:
    - Total computation: 5.421s (100.0%)
    - Total communication: 0.000s (0.0%)
    - Total parallel time: 5.421s

=== PER-NODE AVERAGE TIME ===
  - Sketching: 4.258s
  - Filtering: 0.001s
  - Aggregation: 0.019s
  - Sketch transfer: 0.000s
  - Model fetch: 0.000s
  - Total per node: 4.278s

=== TOTAL COMPUTATIONAL WORK (sum across all nodes) ===
  - Total sketching: 85.166s
  - Total filtering: 0.022s
  - Total aggregation: 0.374s
  - Total sketch transfer: 0.000s
  - Total model fetch: 0.000s
  - Grand total: 85.562s
  - Mean acceptance rate: 0.888

Sketchguard Algorithm Properties:
  - Original dimension: 6,603,710
  - Sketch size: 1000
  - Compression ratio: 19.9x
  - Single repetition: No repetitions needed
  - Theoretical complexity: O(d + N×k)
  - Approach: Sketch filtering + state aggregation
