Device: cuda
Seed: 987654321
Loading 36 LEAF FEMNIST train files...
LEAF FEMNIST train: 3597 users, 734463 samples
Loading 36 LEAF FEMNIST test files...
LEAF FEMNIST test: 3597 users, 83388 samples
Found 3597 train users, 3597 test users, 3597 common users
User sample counts range: 525 (max) to 17 (min)
Distributed ALL 3597 users across 20 clients
Users per client: 179 (with 17 clients getting +1 user)
Train partition sizes: [36360, 37070, 35957, 38262, 36024, 37732, 36921, 38328, 36867, 37683, 36507, 36915, 36007, 37001, 35681, 35453, 36585, 36801, 35964, 36345]
Test partition sizes: [4128, 4203, 4081, 4333, 4091, 4287, 4193, 4349, 4191, 4277, 4143, 4193, 4093, 4197, 4052, 4029, 4153, 4183, 4084, 4128]
  Client 0: 36360 train samples, 62 unique classes
  Client 1: 37070 train samples, 62 unique classes
  Client 2: 35957 train samples, 62 unique classes
  Client 3: 38262 train samples, 62 unique classes
  Client 4: 36024 train samples, 62 unique classes
  Client 5: 37732 train samples, 62 unique classes
  Client 6: 36921 train samples, 62 unique classes
  Client 7: 38328 train samples, 62 unique classes
  Client 8: 36867 train samples, 62 unique classes
  Client 9: 37683 train samples, 62 unique classes
  Client 10: 36507 train samples, 62 unique classes
  Client 11: 36915 train samples, 62 unique classes
  Client 12: 36007 train samples, 62 unique classes
  Client 13: 37001 train samples, 62 unique classes
  Client 14: 35681 train samples, 62 unique classes
  Client 15: 35453 train samples, 62 unique classes
  Client 16: 36585 train samples, 62 unique classes
  Client 17: 36801 train samples, 62 unique classes
  Client 18: 35964 train samples, 62 unique classes
  Client 19: 36345 train samples, 62 unique classes
Will sample 4500 samples per client per epoch
Graph: fully, nodes: 20, edges: 190
Degree statistics: avg=19.00, min=19, max=19
Attack: Compromised 8/20 nodes: [1, 5, 11, 12, 13, 14, 17, 18]
Attack type: backdoor, lambda: 1.0
Backdoor target label: 0, trigger size: 4
Model variant: baseline
Model parameters: 6,603,710
Initial test acc across nodes: mean=0.0168 ± 0.0139
Backdoor attack: Created poisoned datasets for 8 compromised nodes
Round 001: test acc mean=0.0514 ± 0.0034 | min=0.0469 max=0.0618
         : test loss mean=3.6911 ± 0.0153
         : individual accs = ['0.051599', '0.051630', '0.050723', '0.048465', '0.051088', '0.048052', '0.049130', '0.051276', '0.047960', '0.053075', '0.050447', '0.061770', '0.053750', '0.046938', '0.048124', '0.056342', '0.055141', '0.050203', '0.052889', '0.048450']
         : correct/total = [(213, 4128), (217, 4203), (207, 4081), (210, 4333), (209, 4091), (206, 4287), (206, 4193), (223, 4349), (201, 4191), (227, 4277), (209, 4143), (259, 4193), (220, 4093), (197, 4197), (195, 4052), (227, 4029), (229, 4153), (210, 4183), (216, 4084), (200, 4128)]
         : compromised: 0.0517, honest: 0.0511
Round 002: test acc mean=0.0561 ± 0.0032 | min=0.0506 max=0.0624
         : test loss mean=3.6798 ± 0.0171
         : individual accs = ['0.059593', '0.052344', '0.057584', '0.052850', '0.057932', '0.050618', '0.057000', '0.058174', '0.053209', '0.053776', '0.055998', '0.053899', '0.058637', '0.062426', '0.061204', '0.056590', '0.058271', '0.050920', '0.055583', '0.055475']
         : correct/total = [(246, 4128), (220, 4203), (235, 4081), (229, 4333), (237, 4091), (217, 4287), (239, 4193), (253, 4349), (223, 4191), (230, 4277), (232, 4143), (226, 4193), (240, 4093), (262, 4197), (248, 4052), (228, 4029), (242, 4153), (213, 4183), (227, 4084), (229, 4128)]
         : compromised: 0.0557, honest: 0.0564
Round 003: test acc mean=0.0561 ± 0.0032 | min=0.0506 max=0.0624
         : test loss mean=3.6746 ± 0.0163
         : individual accs = ['0.059593', '0.052344', '0.057584', '0.052850', '0.057932', '0.050618', '0.057000', '0.058174', '0.053209', '0.053776', '0.055998', '0.053899', '0.058637', '0.062426', '0.061204', '0.056590', '0.058271', '0.050920', '0.055583', '0.055475']
         : correct/total = [(246, 4128), (220, 4203), (235, 4081), (229, 4333), (237, 4091), (217, 4287), (239, 4193), (253, 4349), (223, 4191), (230, 4277), (232, 4143), (226, 4193), (240, 4093), (262, 4197), (248, 4052), (228, 4029), (242, 4153), (213, 4183), (227, 4084), (229, 4128)]
         : compromised: 0.0557, honest: 0.0564
Round 004: test acc mean=0.0524 ± 0.0036 | min=0.0474 max=0.0634
         : test loss mean=3.6662 ± 0.0174
         : individual accs = ['0.052568', '0.052106', '0.051948', '0.049388', '0.051577', '0.048752', '0.049845', '0.052426', '0.049869', '0.054010', '0.051412', '0.063439', '0.055216', '0.047415', '0.048865', '0.057334', '0.056104', '0.051399', '0.054848', '0.049176']
         : correct/total = [(217, 4128), (219, 4203), (212, 4081), (214, 4333), (211, 4091), (209, 4287), (209, 4193), (228, 4349), (209, 4191), (231, 4277), (213, 4143), (266, 4193), (226, 4093), (199, 4197), (198, 4052), (231, 4029), (233, 4153), (215, 4183), (224, 4084), (203, 4128)]
         : compromised: 0.0528, honest: 0.0521
Round 005: test acc mean=0.0788 ± 0.0050 | min=0.0712 max=0.0896
         : test loss mean=3.6575 ± 0.0168
         : individual accs = ['0.081638', '0.073757', '0.088949', '0.073621', '0.076021', '0.076277', '0.077033', '0.078409', '0.077309', '0.074351', '0.081583', '0.074171', '0.083069', '0.085299', '0.089585', '0.079424', '0.079220', '0.071241', '0.080803', '0.073401']
         : correct/total = [(337, 4128), (310, 4203), (363, 4081), (319, 4333), (311, 4091), (327, 4287), (323, 4193), (341, 4349), (324, 4191), (318, 4277), (338, 4143), (311, 4193), (340, 4093), (358, 4197), (363, 4052), (320, 4029), (329, 4153), (298, 4183), (330, 4084), (303, 4128)]
         : compromised: 0.0793, honest: 0.0784
Round 006: test acc mean=0.0901 ± 0.0045 | min=0.0801 max=0.0975
         : test loss mean=3.6392 ± 0.0192
         : individual accs = ['0.091328', '0.083988', '0.085518', '0.087699', '0.090687', '0.081409', '0.088004', '0.089676', '0.094011', '0.090016', '0.080135', '0.090389', '0.090398', '0.092447', '0.096742', '0.097543', '0.092222', '0.092756', '0.092311', '0.094961']
         : correct/total = [(377, 4128), (353, 4203), (349, 4081), (380, 4333), (371, 4091), (349, 4287), (369, 4193), (390, 4349), (394, 4191), (385, 4277), (332, 4143), (379, 4193), (370, 4093), (388, 4197), (392, 4052), (393, 4029), (383, 4153), (388, 4183), (377, 4084), (392, 4128)]
         : compromised: 0.0901, honest: 0.0902
Round 007: test acc mean=0.1917 ± 0.0088 | min=0.1766 max=0.2132
         : test loss mean=3.5935 ± 0.0188
         : individual accs = ['0.202035', '0.189389', '0.213183', '0.176552', '0.189685', '0.192209', '0.187694', '0.193378', '0.177523', '0.187281', '0.185856', '0.195087', '0.192280', '0.189659', '0.201135', '0.201042', '0.201782', '0.184317', '0.193928', '0.180233']
         : correct/total = [(834, 4128), (796, 4203), (870, 4081), (765, 4333), (776, 4091), (824, 4287), (787, 4193), (841, 4349), (744, 4191), (801, 4277), (770, 4143), (818, 4193), (787, 4093), (796, 4197), (815, 4052), (810, 4029), (838, 4153), (771, 4183), (792, 4084), (744, 4128)]
         : compromised: 0.1923, honest: 0.1914
Round 008: test acc mean=0.1843 ± 0.0086 | min=0.1662 max=0.2031
         : test loss mean=3.4826 ± 0.0209
         : individual accs = ['0.190407', '0.177968', '0.203136', '0.166167', '0.181618', '0.188943', '0.182447', '0.186710', '0.175614', '0.176526', '0.184649', '0.179108', '0.187882', '0.192518', '0.198174', '0.190866', '0.189020', '0.178102', '0.183154', '0.172965']
         : correct/total = [(786, 4128), (748, 4203), (829, 4081), (720, 4333), (743, 4091), (810, 4287), (765, 4193), (812, 4349), (736, 4191), (755, 4277), (765, 4143), (751, 4193), (769, 4093), (808, 4197), (803, 4052), (769, 4029), (785, 4153), (745, 4183), (748, 4084), (714, 4128)]
         : compromised: 0.1857, honest: 0.1833
Round 009: test acc mean=0.3251 ± 0.0113 | min=0.2899 max=0.3391
         : test loss mean=3.1853 ± 0.0236
         : individual accs = ['0.330184', '0.330240', '0.339133', '0.289868', '0.336348', '0.322836', '0.314572', '0.331111', '0.315438', '0.309797', '0.316437', '0.331982', '0.330809', '0.327615', '0.334650', '0.336560', '0.329882', '0.321301', '0.330069', '0.322674']
         : correct/total = [(1363, 4128), (1388, 4203), (1384, 4081), (1256, 4333), (1376, 4091), (1384, 4287), (1319, 4193), (1440, 4349), (1322, 4191), (1325, 4277), (1311, 4143), (1392, 4193), (1354, 4093), (1375, 4197), (1356, 4052), (1356, 4029), (1370, 4153), (1344, 4183), (1348, 4084), (1332, 4128)]
         : compromised: 0.3287, honest: 0.3227
Round 010: test acc mean=0.3636 ± 0.0110 | min=0.3342 max=0.3798
         : test loss mean=2.7910 ± 0.0279
         : individual accs = ['0.370155', '0.368308', '0.379809', '0.334180', '0.371303', '0.368556', '0.347722', '0.362152', '0.358387', '0.346505', '0.358677', '0.370379', '0.366235', '0.369073', '0.375370', '0.368826', '0.364315', '0.361463', '0.377081', '0.354167']
         : correct/total = [(1528, 4128), (1548, 4203), (1550, 4081), (1448, 4333), (1519, 4091), (1580, 4287), (1458, 4193), (1575, 4349), (1502, 4191), (1482, 4277), (1486, 4143), (1553, 4193), (1499, 4093), (1549, 4197), (1521, 4052), (1486, 4029), (1513, 4153), (1512, 4183), (1540, 4084), (1462, 4128)]
         : compromised: 0.3696, honest: 0.3597

=== FINAL RESULTS ===
Dataset: femnist, Nodes: 20, Graph: fully, Aggregation: krum
Attack: backdoor, 40.0% compromised
Final accuracy - Compromised: 0.3696, Honest: 0.3597
Overall test accuracy: mean=0.3636 ± 0.0110

=== BACKDOOR ATTACK SUCCESS RATE (ASR) ===
Target label: 0
Trigger size: 4x4
Overall ASR: 0.0354 ± 0.0043
Honest nodes ASR: 0.0360 ± 0.0041
Compromised nodes ASR: 0.0344 ± 0.0044
Note: Higher ASR indicates more successful backdoor attack
