Device: cuda
Seed: 987654321
Loading 36 LEAF FEMNIST train files...
LEAF FEMNIST train: 3597 users, 734463 samples
Loading 36 LEAF FEMNIST test files...
LEAF FEMNIST test: 3597 users, 83388 samples
Found 3597 train users, 3597 test users, 3597 common users
User sample counts range: 525 (max) to 17 (min)
Distributed ALL 3597 users across 20 clients
Users per client: 179 (with 17 clients getting +1 user)
Train partition sizes: [36360, 37070, 35957, 38262, 36024, 37732, 36921, 38328, 36867, 37683, 36507, 36915, 36007, 37001, 35681, 35453, 36585, 36801, 35964, 36345]
Test partition sizes: [4128, 4203, 4081, 4333, 4091, 4287, 4193, 4349, 4191, 4277, 4143, 4193, 4093, 4197, 4052, 4029, 4153, 4183, 4084, 4128]
  Client 0: 36360 train samples, 62 unique classes
  Client 1: 37070 train samples, 62 unique classes
  Client 2: 35957 train samples, 62 unique classes
  Client 3: 38262 train samples, 62 unique classes
  Client 4: 36024 train samples, 62 unique classes
  Client 5: 37732 train samples, 62 unique classes
  Client 6: 36921 train samples, 62 unique classes
  Client 7: 38328 train samples, 62 unique classes
  Client 8: 36867 train samples, 62 unique classes
  Client 9: 37683 train samples, 62 unique classes
  Client 10: 36507 train samples, 62 unique classes
  Client 11: 36915 train samples, 62 unique classes
  Client 12: 36007 train samples, 62 unique classes
  Client 13: 37001 train samples, 62 unique classes
  Client 14: 35681 train samples, 62 unique classes
  Client 15: 35453 train samples, 62 unique classes
  Client 16: 36585 train samples, 62 unique classes
  Client 17: 36801 train samples, 62 unique classes
  Client 18: 35964 train samples, 62 unique classes
  Client 19: 36345 train samples, 62 unique classes
Will sample 4500 samples per client per epoch
Graph: erdos, nodes: 20, edges: 99
Degree statistics: avg=9.90, min=7, max=14
Attack: Compromised 16/20 nodes: [1, 2, 3, 5, 6, 8, 9, 10, 11, 12, 13, 14, 15, 17, 18, 19]
Attack type: backdoor, lambda: 1.0
Backdoor target label: 0, trigger size: 4
Model variant: baseline
Model parameters: 6,603,710
UBAR ALGORITHM (Two-Stage Byzantine-resilient)
  - Model dimension: 6,603,710 parameters
  - Rho parameter: 0.19999999999999996
  - Stage 1: Distance-based filtering (select 20% closest neighbors)
  - Stage 2: Performance-based selection (loss comparison)
  - Complexity: O(deg(i)×d + deg(i)×inference)
Initial test acc across nodes: mean=0.0168 ± 0.0139
Backdoor attack: Created poisoned datasets for 16 compromised nodes
Round 001: test acc mean=0.0514 ± 0.0046 | min=0.0432 max=0.0596
         : test loss mean=30140.9128 ± 24375.7116
         : individual accs = ['0.059593', '0.048775', '0.053418', '0.043157', '0.058910', '0.045253', '0.050799', '0.056105', '0.049630', '0.043488', '0.048033', '0.049606', '0.054239', '0.049083', '0.051826', '0.051626', '0.058271', '0.049486', '0.052889', '0.054506']
         : correct/total = [(246, 4128), (205, 4203), (218, 4081), (187, 4333), (241, 4091), (194, 4287), (213, 4193), (244, 4349), (208, 4191), (186, 4277), (199, 4143), (208, 4193), (222, 4093), (206, 4197), (210, 4052), (208, 4029), (242, 4153), (207, 4183), (216, 4084), (225, 4128)]
         : compromised: 0.0497, honest: 0.0582
         : ubar stats = ['Node 0: s1=0.167, s2=1.000', 'Node 1: s1=0.100, s2=1.000', 'Node 2: s1=0.125, s2=1.000']...
Round 002: test acc mean=0.0359 ± 0.0216 | min=0.0031 max=0.0807
         : test loss mean=21188.5570 ± 34883.5020
         : individual accs = ['0.080669', '0.041637', '0.032835', '0.034387', '0.057932', '0.048985', '0.003100', '0.058174', '0.047244', '0.003741', '0.007000', '0.049606', '0.027608', '0.043364', '0.010118', '0.014892', '0.049362', '0.049486', '0.052889', '0.004845']
         : correct/total = [(333, 4128), (175, 4203), (134, 4081), (149, 4333), (237, 4091), (210, 4287), (13, 4193), (253, 4349), (198, 4191), (16, 4277), (29, 4143), (208, 4193), (113, 4093), (182, 4197), (41, 4052), (60, 4029), (205, 4153), (207, 4183), (216, 4084), (20, 4128)]
         : compromised: 0.0295, honest: 0.0615
         : ubar stats = ['Node 0: s1=0.167, s2=1.000', 'Node 1: s1=0.100, s2=1.000', 'Node 2: s1=0.125, s2=1.000']...
Round 003: test acc mean=0.0553 ± 0.0137 | min=0.0432 max=0.0947
         : test loss mean=nan ± nan
         : individual accs = ['0.059593', '0.050916', '0.054889', '0.043157', '0.093376', '0.045253', '0.057000', '0.094734', '0.051062', '0.044891', '0.047550', '0.054376', '0.052040', '0.049083', '0.045656', '0.050881', '0.058271', '0.048291', '0.050196', '0.054506']
         : correct/total = [(246, 4128), (214, 4203), (224, 4081), (187, 4333), (382, 4091), (194, 4287), (239, 4193), (412, 4349), (214, 4191), (192, 4277), (197, 4143), (228, 4193), (213, 4093), (206, 4197), (185, 4052), (205, 4029), (242, 4153), (202, 4183), (205, 4084), (225, 4128)]
         : compromised: 0.0500, honest: 0.0765
         : ubar stats = ['Node 0: s1=0.167, s2=1.000', 'Node 1: s1=0.100, s2=1.000', 'Node 2: s1=0.125, s2=1.000']...
Round 004: test acc mean=0.0539 ± 0.0103 | min=0.0432 max=0.0829
         : test loss mean=nan ± nan
         : individual accs = ['0.059593', '0.048775', '0.053418', '0.043157', '0.082865', '0.045253', '0.050799', '0.081628', '0.049630', '0.043488', '0.048033', '0.049606', '0.054239', '0.049083', '0.051826', '0.051626', '0.058271', '0.049486', '0.052889', '0.054506']
         : correct/total = [(246, 4128), (205, 4203), (218, 4081), (187, 4333), (339, 4091), (194, 4287), (213, 4193), (355, 4349), (208, 4191), (186, 4277), (199, 4143), (208, 4193), (222, 4093), (206, 4197), (210, 4052), (208, 4029), (242, 4153), (207, 4183), (216, 4084), (225, 4128)]
         : compromised: 0.0497, honest: 0.0706
         : ubar stats = ['Node 0: s1=0.167, s2=0.875', 'Node 1: s1=0.100, s2=1.000', 'Node 2: s1=0.125, s2=1.000']...
Round 005: test acc mean=0.0504 ± 0.0043 | min=0.0432 max=0.0596
         : test loss mean=nan ± nan
         : individual accs = ['0.059593', '0.048775', '0.053418', '0.043157', '0.045710', '0.045253', '0.050799', '0.047827', '0.049630', '0.043488', '0.048033', '0.049606', '0.054239', '0.049083', '0.051826', '0.051626', '0.058271', '0.049486', '0.052889', '0.054506']
         : correct/total = [(246, 4128), (205, 4203), (218, 4081), (187, 4333), (187, 4091), (194, 4287), (213, 4193), (208, 4349), (208, 4191), (186, 4277), (199, 4143), (208, 4193), (222, 4093), (206, 4197), (210, 4052), (208, 4029), (242, 4153), (207, 4183), (216, 4084), (225, 4128)]
         : compromised: 0.0497, honest: 0.0529
         : ubar stats = ['Node 0: s1=0.167, s2=0.900', 'Node 1: s1=0.100, s2=1.000', 'Node 2: s1=0.125, s2=1.000']...
Round 006: test acc mean=0.0497 ± 0.0033 | min=0.0432 max=0.0545
         : test loss mean=nan ± nan
         : individual accs = ['0.044574', '0.048775', '0.053418', '0.043157', '0.051088', '0.045253', '0.050799', '0.051276', '0.049630', '0.043488', '0.048033', '0.049606', '0.054239', '0.049083', '0.051826', '0.051626', '0.051047', '0.049486', '0.052889', '0.054506']
         : correct/total = [(184, 4128), (205, 4203), (218, 4081), (187, 4333), (209, 4091), (194, 4287), (213, 4193), (223, 4349), (208, 4191), (186, 4277), (199, 4143), (208, 4193), (222, 4093), (206, 4197), (210, 4052), (208, 4029), (212, 4153), (207, 4183), (216, 4084), (225, 4128)]
         : compromised: 0.0497, honest: 0.0495
         : ubar stats = ['Node 0: s1=0.167, s2=0.917', 'Node 1: s1=0.100, s2=1.000', 'Node 2: s1=0.125, s2=1.000']...
Round 007: test acc mean=0.0506 ± 0.0048 | min=0.0432 max=0.0620
         : test loss mean=nan ± nan
         : individual accs = ['0.062016', '0.048775', '0.053418', '0.043157', '0.047421', '0.045253', '0.050799', '0.045528', '0.049630', '0.043488', '0.048033', '0.049606', '0.054239', '0.049083', '0.051826', '0.051626', '0.060438', '0.049486', '0.052889', '0.054506']
         : correct/total = [(256, 4128), (205, 4203), (218, 4081), (187, 4333), (194, 4091), (194, 4287), (213, 4193), (198, 4349), (208, 4191), (186, 4277), (199, 4143), (208, 4193), (222, 4093), (206, 4197), (210, 4052), (208, 4029), (251, 4153), (207, 4183), (216, 4084), (225, 4128)]
         : compromised: 0.0497, honest: 0.0539
         : ubar stats = ['Node 0: s1=0.167, s2=0.857', 'Node 1: s1=0.100, s2=1.000', 'Node 2: s1=0.125, s2=1.000']...
Round 008: test acc mean=0.0495 ± 0.0037 | min=0.0430 max=0.0551
         : test loss mean=nan ± nan
         : individual accs = ['0.051599', '0.048775', '0.053418', '0.043157', '0.043021', '0.045253', '0.050799', '0.045068', '0.049630', '0.043488', '0.048033', '0.049606', '0.054239', '0.049083', '0.051826', '0.051626', '0.055141', '0.049486', '0.052889', '0.054506']
         : correct/total = [(213, 4128), (205, 4203), (218, 4081), (187, 4333), (176, 4091), (194, 4287), (213, 4193), (196, 4349), (208, 4191), (186, 4277), (199, 4143), (208, 4193), (222, 4093), (206, 4197), (210, 4052), (208, 4029), (229, 4153), (207, 4183), (216, 4084), (225, 4128)]
         : compromised: 0.0497, honest: 0.0487
         : ubar stats = ['Node 0: s1=0.167, s2=0.812', 'Node 1: s1=0.100, s2=1.000', 'Node 2: s1=0.125, s2=1.000']...
Round 009: test acc mean=0.0518 ± 0.0115 | min=0.0432 max=0.0996
         : test loss mean=nan ± nan
         : individual accs = ['0.099564', '0.048775', '0.053418', '0.043157', '0.044977', '0.045253', '0.050799', '0.043918', '0.049630', '0.043488', '0.048033', '0.049606', '0.054239', '0.049083', '0.051826', '0.051626', '0.052011', '0.049486', '0.052889', '0.054506']
         : correct/total = [(411, 4128), (205, 4203), (218, 4081), (187, 4333), (184, 4091), (194, 4287), (213, 4193), (191, 4349), (208, 4191), (186, 4277), (199, 4143), (208, 4193), (222, 4093), (206, 4197), (210, 4052), (208, 4029), (216, 4153), (207, 4183), (216, 4084), (225, 4128)]
         : compromised: 0.0497, honest: 0.0601
         : ubar stats = ['Node 0: s1=0.167, s2=0.833', 'Node 1: s1=0.100, s2=1.000', 'Node 2: s1=0.125, s2=1.000']...
Round 010: test acc mean=0.0547 ± 0.0120 | min=0.0432 max=0.0885
         : test loss mean=nan ± nan
         : individual accs = ['0.062742', '0.048775', '0.053418', '0.043157', '0.087509', '0.045253', '0.050799', '0.088526', '0.049630', '0.043488', '0.048033', '0.049606', '0.054239', '0.049083', '0.051826', '0.051626', '0.059475', '0.049486', '0.052889', '0.054506']
         : correct/total = [(259, 4128), (205, 4203), (218, 4081), (187, 4333), (358, 4091), (194, 4287), (213, 4193), (385, 4349), (208, 4191), (186, 4277), (199, 4143), (208, 4193), (222, 4093), (206, 4197), (210, 4052), (208, 4029), (247, 4153), (207, 4183), (216, 4084), (225, 4128)]
         : compromised: 0.0497, honest: 0.0746
         : ubar stats = ['Node 0: s1=0.167, s2=0.800', 'Node 1: s1=0.100, s2=1.000', 'Node 2: s1=0.125, s2=1.000']...

=== FINAL RESULTS ===
Dataset: femnist, Nodes: 20, Graph: erdos, Aggregation: ubar
Attack: backdoor, 80.0% compromised
Final accuracy - Compromised: 0.0497, Honest: 0.0746
Overall test accuracy: mean=0.0547 ± 0.0120

=== BACKDOOR ATTACK SUCCESS RATE (ASR) ===
Target label: 0
Trigger size: 4x4
Overall ASR: 0.8000 ± 0.4000
Honest nodes ASR: 0.0000 ± 0.0000
Compromised nodes ASR: 1.0000 ± 0.0000
Note: Higher ASR indicates more successful backdoor attack

=== UBAR SUMMARY ===
Node 0: stage1=0.167, stage2=0.800, overall=0.133
Node 1: stage1=0.100, stage2=1.000, overall=0.100
Node 2: stage1=0.125, stage2=1.000, overall=0.125
Node 3: stage1=0.143, stage2=1.000, overall=0.143
Node 4: stage1=0.111, stage2=1.000, overall=0.111
Node 5: stage1=0.100, stage2=1.000, overall=0.100
Node 6: stage1=0.167, stage2=0.600, overall=0.100
Node 7: stage1=0.182, stage2=0.500, overall=0.091
Node 8: stage1=0.143, stage2=1.000, overall=0.143
Node 9: stage1=0.182, stage2=0.650, overall=0.118
Node 10: stage1=0.125, stage2=1.000, overall=0.125
Node 11: stage1=0.167, stage2=0.600, overall=0.100
Node 12: stage1=0.167, stage2=0.650, overall=0.108
Node 13: stage1=0.111, stage2=1.000, overall=0.111
Node 14: stage1=0.143, stage2=0.650, overall=0.093
Node 15: stage1=0.111, stage2=1.000, overall=0.111
Node 16: stage1=0.143, stage2=1.000, overall=0.143
Node 17: stage1=0.125, stage2=1.000, overall=0.125
Node 18: stage1=0.167, stage2=0.650, overall=0.108
Node 19: stage1=0.100, stage2=1.000, overall=0.100

=== PARALLEL EXECUTION TIME (realistic for distributed system) ===
  COMMUNICATION (max across nodes):
    - Full model transfer: 0.000s (0.0%)
  COMPUTATION (max across nodes):
    - Distance computation: 0.054s (1.3%)
    - Loss computation: 4.100s (98.5%)
    - Aggregation: 0.007s (0.2%)
  TOTALS:
    - Total computation: 4.161s (100.0%)
    - Total communication: 0.000s (0.0%)
    - Total parallel time: 4.161s

=== PER-NODE AVERAGE TIME ===
  - Distance computation: 0.040s
  - Loss computation: 3.850s
  - Aggregation: 0.005s
  - Model transfer: 0.000s
  - Total per node: 3.895s

=== TOTAL COMPUTATIONAL WORK (sum across all nodes) ===
  - Total distance computation: 0.807s
  - Total loss computation: 77.001s
  - Total aggregation: 0.091s
  - Total model transfer: 0.000s
  - Grand total: 77.900s
  - Mean Stage 1 acceptance rate: 0.139
  - Mean Stage 2 acceptance rate: 0.855
  - Overall acceptance rate: 0.119

UBAR Algorithm Properties:
  - Model dimension: 6,603,710
  - Rho parameter: 0.19999999999999996
  - Two-stage approach: Distance filtering + loss evaluation
  - Stage 1 selects: 20% of neighbors
  - Stage 2 uses: Training sample loss comparison
  - Theoretical complexity: O(deg(i)×d + deg(i)×inference)
  - Approach: UBAR paper implementation
