Device: cuda
Seed: 987654321
Loading 36 LEAF FEMNIST train files...
LEAF FEMNIST train: 3597 users, 734463 samples
Loading 36 LEAF FEMNIST test files...
LEAF FEMNIST test: 3597 users, 83388 samples
Found 3597 train users, 3597 test users, 3597 common users
User sample counts range: 525 (max) to 17 (min)
Distributed ALL 3597 users across 20 clients
Users per client: 179 (with 17 clients getting +1 user)
Train partition sizes: [36360, 37070, 35957, 38262, 36024, 37732, 36921, 38328, 36867, 37683, 36507, 36915, 36007, 37001, 35681, 35453, 36585, 36801, 35964, 36345]
Test partition sizes: [4128, 4203, 4081, 4333, 4091, 4287, 4193, 4349, 4191, 4277, 4143, 4193, 4093, 4197, 4052, 4029, 4153, 4183, 4084, 4128]
  Client 0: 36360 train samples, 62 unique classes
  Client 1: 37070 train samples, 62 unique classes
  Client 2: 35957 train samples, 62 unique classes
  Client 3: 38262 train samples, 62 unique classes
  Client 4: 36024 train samples, 62 unique classes
  Client 5: 37732 train samples, 62 unique classes
  Client 6: 36921 train samples, 62 unique classes
  Client 7: 38328 train samples, 62 unique classes
  Client 8: 36867 train samples, 62 unique classes
  Client 9: 37683 train samples, 62 unique classes
  Client 10: 36507 train samples, 62 unique classes
  Client 11: 36915 train samples, 62 unique classes
  Client 12: 36007 train samples, 62 unique classes
  Client 13: 37001 train samples, 62 unique classes
  Client 14: 35681 train samples, 62 unique classes
  Client 15: 35453 train samples, 62 unique classes
  Client 16: 36585 train samples, 62 unique classes
  Client 17: 36801 train samples, 62 unique classes
  Client 18: 35964 train samples, 62 unique classes
  Client 19: 36345 train samples, 62 unique classes
Will sample 4500 samples per client per epoch
Graph: fully, nodes: 20, edges: 190
Degree statistics: avg=19.00, min=19, max=19
Attack: Compromised 12/20 nodes: [1, 2, 3, 5, 8, 11, 12, 13, 14, 15, 17, 18]
Attack type: backdoor, lambda: 1.0
Backdoor target label: 0, trigger size: 4
Model variant: baseline
Model parameters: 6,603,710
Initial test acc across nodes: mean=0.0168 ± 0.0139
Backdoor attack: Created poisoned datasets for 12 compromised nodes
Round 001: test acc mean=0.0121 ± 0.0108 | min=0.0034 max=0.0458
         : test loss mean=41525.9118 ± 13074.4355
         : individual accs = ['0.005329', '0.012610', '0.018133', '0.003462', '0.011489', '0.018661', '0.004293', '0.011267', '0.034121', '0.010288', '0.003379', '0.004770', '0.009040', '0.004765', '0.005183', '0.003971', '0.005297', '0.021994', '0.045788', '0.008721']
         : correct/total = [(22, 4128), (53, 4203), (74, 4081), (15, 4333), (47, 4091), (80, 4287), (18, 4193), (49, 4349), (143, 4191), (44, 4277), (14, 4143), (20, 4193), (37, 4093), (20, 4197), (21, 4052), (16, 4029), (22, 4153), (92, 4183), (187, 4084), (36, 4128)]
         : compromised: 0.0152, honest: 0.0075
Round 002: test acc mean=0.0487 ± 0.0031 | min=0.0422 max=0.0527
         : test loss mean=327307957115.0746 ± 6189565537.4246
         : individual accs = ['0.050145', '0.049726', '0.052683', '0.043388', '0.052554', '0.052484', '0.044598', '0.049207', '0.042233', '0.048398', '0.045619', '0.046983', '0.050574', '0.047177', '0.051826', '0.050633', '0.051288', '0.048291', '0.051665', '0.045058']
         : correct/total = [(207, 4128), (209, 4203), (215, 4081), (188, 4333), (215, 4091), (225, 4287), (187, 4193), (214, 4349), (177, 4191), (207, 4277), (189, 4143), (197, 4193), (207, 4093), (198, 4197), (210, 4052), (204, 4029), (213, 4153), (202, 4183), (211, 4084), (186, 4128)]
         : compromised: 0.0490, honest: 0.0484
Round 003: test acc mean=0.0472 ± 0.0022 | min=0.0445 max=0.0539
         : test loss mean=320.8743 ± 6.1219
         : individual accs = ['0.047238', '0.048775', '0.045087', '0.044773', '0.047421', '0.048752', '0.048891', '0.045528', '0.044619', '0.047697', '0.047309', '0.045314', '0.049597', '0.045747', '0.046397', '0.053860', '0.044546', '0.045900', '0.048482', '0.048692']
         : correct/total = [(195, 4128), (205, 4203), (184, 4081), (194, 4333), (194, 4091), (209, 4287), (205, 4193), (198, 4349), (187, 4191), (204, 4277), (196, 4143), (190, 4193), (203, 4093), (192, 4197), (188, 4052), (217, 4029), (185, 4153), (192, 4183), (198, 4084), (201, 4128)]
         : compromised: 0.0473, honest: 0.0472
Round 004: test acc mean=0.0472 ± 0.0022 | min=0.0445 max=0.0539
         : test loss mean=89.9610 ± 1.6840
         : individual accs = ['0.047238', '0.048775', '0.045087', '0.044773', '0.047421', '0.048752', '0.048891', '0.045528', '0.044619', '0.047697', '0.047309', '0.045314', '0.049597', '0.045747', '0.046397', '0.053860', '0.044546', '0.045900', '0.048482', '0.048692']
         : correct/total = [(195, 4128), (205, 4203), (184, 4081), (194, 4333), (194, 4091), (209, 4287), (205, 4193), (198, 4349), (187, 4191), (204, 4277), (196, 4143), (190, 4193), (203, 4093), (192, 4197), (188, 4052), (217, 4029), (185, 4153), (192, 4183), (198, 4084), (201, 4128)]
         : compromised: 0.0473, honest: 0.0472
Round 005: test acc mean=0.0472 ± 0.0022 | min=0.0445 max=0.0539
         : test loss mean=27.6363 ± 0.5594
         : individual accs = ['0.047238', '0.048775', '0.045087', '0.044773', '0.047421', '0.048752', '0.048891', '0.045528', '0.044619', '0.047697', '0.047309', '0.045314', '0.049597', '0.045747', '0.046397', '0.053860', '0.044546', '0.045900', '0.048482', '0.048692']
         : correct/total = [(195, 4128), (205, 4203), (184, 4081), (194, 4333), (194, 4091), (209, 4287), (205, 4193), (198, 4349), (187, 4191), (204, 4277), (196, 4143), (190, 4193), (203, 4093), (192, 4197), (188, 4052), (217, 4029), (185, 4153), (192, 4183), (198, 4084), (201, 4128)]
         : compromised: 0.0473, honest: 0.0472
Round 006: test acc mean=0.0514 ± 0.0034 | min=0.0469 max=0.0618
         : test loss mean=8.9208 ± 0.1543
         : individual accs = ['0.051599', '0.051630', '0.050723', '0.048465', '0.051088', '0.048052', '0.049130', '0.051276', '0.047960', '0.053075', '0.050447', '0.061770', '0.053750', '0.046938', '0.048124', '0.056342', '0.055141', '0.050203', '0.052889', '0.048450']
         : correct/total = [(213, 4128), (217, 4203), (207, 4081), (210, 4333), (209, 4091), (206, 4287), (206, 4193), (223, 4349), (201, 4191), (227, 4277), (209, 4143), (259, 4193), (220, 4093), (197, 4197), (195, 4052), (227, 4029), (229, 4153), (210, 4183), (216, 4084), (200, 4128)]
         : compromised: 0.0514, honest: 0.0513
Round 007: test acc mean=0.0124 ± 0.0016 | min=0.0097 max=0.0154
         : test loss mean=4.3830 ± 0.0122
         : individual accs = ['0.012355', '0.012610', '0.010782', '0.014309', '0.012955', '0.015395', '0.010017', '0.013796', '0.012646', '0.013795', '0.012551', '0.012879', '0.012460', '0.012152', '0.010118', '0.009680', '0.010836', '0.012431', '0.010774', '0.015262']
         : correct/total = [(51, 4128), (53, 4203), (44, 4081), (62, 4333), (53, 4091), (66, 4287), (42, 4193), (60, 4349), (53, 4191), (59, 4277), (52, 4143), (54, 4193), (51, 4093), (51, 4197), (41, 4052), (39, 4029), (45, 4153), (52, 4183), (44, 4084), (63, 4128)]
         : compromised: 0.0122, honest: 0.0127
Round 008: test acc mean=0.0124 ± 0.0016 | min=0.0097 max=0.0154
         : test loss mean=4.5907 ± 0.0112
         : individual accs = ['0.012355', '0.012610', '0.010782', '0.014309', '0.012955', '0.015395', '0.010017', '0.013796', '0.012646', '0.013795', '0.012551', '0.012879', '0.012460', '0.012152', '0.010118', '0.009680', '0.010836', '0.012431', '0.010774', '0.015262']
         : correct/total = [(51, 4128), (53, 4203), (44, 4081), (62, 4333), (53, 4091), (66, 4287), (42, 4193), (60, 4349), (53, 4191), (59, 4277), (52, 4143), (54, 4193), (51, 4093), (51, 4197), (41, 4052), (39, 4029), (45, 4153), (52, 4183), (44, 4084), (63, 4128)]
         : compromised: 0.0122, honest: 0.0127
Round 009: test acc mean=0.0487 ± 0.0031 | min=0.0422 max=0.0527
         : test loss mean=6.3517 ± 0.1068
         : individual accs = ['0.050145', '0.049726', '0.052683', '0.043388', '0.052554', '0.052484', '0.044598', '0.049207', '0.042233', '0.048398', '0.045619', '0.046983', '0.050574', '0.047177', '0.051826', '0.050633', '0.051288', '0.048291', '0.051665', '0.045058']
         : correct/total = [(207, 4128), (209, 4203), (215, 4081), (188, 4333), (215, 4091), (225, 4287), (187, 4193), (214, 4349), (177, 4191), (207, 4277), (189, 4143), (197, 4193), (207, 4093), (198, 4197), (210, 4052), (204, 4029), (213, 4153), (202, 4183), (211, 4084), (186, 4128)]
         : compromised: 0.0490, honest: 0.0484
Round 010: test acc mean=0.0124 ± 0.0016 | min=0.0097 max=0.0154
         : test loss mean=5.7531 ± 0.0665
         : individual accs = ['0.012355', '0.012610', '0.010782', '0.014309', '0.012955', '0.015395', '0.010017', '0.013796', '0.012646', '0.013795', '0.012551', '0.012879', '0.012460', '0.012152', '0.010118', '0.009680', '0.010836', '0.012431', '0.010774', '0.015262']
         : correct/total = [(51, 4128), (53, 4203), (44, 4081), (62, 4333), (53, 4091), (66, 4287), (42, 4193), (60, 4349), (53, 4191), (59, 4277), (52, 4143), (54, 4193), (51, 4093), (51, 4197), (41, 4052), (39, 4029), (45, 4153), (52, 4183), (44, 4084), (63, 4128)]
         : compromised: 0.0122, honest: 0.0127

=== FINAL RESULTS ===
Dataset: femnist, Nodes: 20, Graph: fully, Aggregation: d-fedavg
Attack: backdoor, 60.0% compromised
Final accuracy - Compromised: 0.0122, Honest: 0.0127
Overall test accuracy: mean=0.0124 ± 0.0016

=== BACKDOOR ATTACK SUCCESS RATE (ASR) ===
Target label: 0
Trigger size: 4x4
Overall ASR: 0.0000 ± 0.0000
Honest nodes ASR: 0.0000 ± 0.0000
Compromised nodes ASR: 0.0000 ± 0.0000
Note: Higher ASR indicates more successful backdoor attack
