Device: cuda
Seed: 987654321
Loading 36 LEAF FEMNIST train files...
LEAF FEMNIST train: 3597 users, 734463 samples
Loading 36 LEAF FEMNIST test files...
LEAF FEMNIST test: 3597 users, 83388 samples
Found 3597 train users, 3597 test users, 3597 common users
User sample counts range: 525 (max) to 17 (min)
Distributed ALL 3597 users across 20 clients
Users per client: 179 (with 17 clients getting +1 user)
Train partition sizes: [36360, 37070, 35957, 38262, 36024, 37732, 36921, 38328, 36867, 37683, 36507, 36915, 36007, 37001, 35681, 35453, 36585, 36801, 35964, 36345]
Test partition sizes: [4128, 4203, 4081, 4333, 4091, 4287, 4193, 4349, 4191, 4277, 4143, 4193, 4093, 4197, 4052, 4029, 4153, 4183, 4084, 4128]
  Client 0: 36360 train samples, 62 unique classes
  Client 1: 37070 train samples, 62 unique classes
  Client 2: 35957 train samples, 62 unique classes
  Client 3: 38262 train samples, 62 unique classes
  Client 4: 36024 train samples, 62 unique classes
  Client 5: 37732 train samples, 62 unique classes
  Client 6: 36921 train samples, 62 unique classes
  Client 7: 38328 train samples, 62 unique classes
  Client 8: 36867 train samples, 62 unique classes
  Client 9: 37683 train samples, 62 unique classes
  Client 10: 36507 train samples, 62 unique classes
  Client 11: 36915 train samples, 62 unique classes
  Client 12: 36007 train samples, 62 unique classes
  Client 13: 37001 train samples, 62 unique classes
  Client 14: 35681 train samples, 62 unique classes
  Client 15: 35453 train samples, 62 unique classes
  Client 16: 36585 train samples, 62 unique classes
  Client 17: 36801 train samples, 62 unique classes
  Client 18: 35964 train samples, 62 unique classes
  Client 19: 36345 train samples, 62 unique classes
Will sample 4500 samples per client per epoch
Graph: erdos, nodes: 20, edges: 48
Degree statistics: avg=4.80, min=2, max=7
Attack: Compromised 14/20 nodes: [1, 2, 3, 5, 6, 8, 11, 12, 13, 14, 15, 17, 18, 19]
Attack type: backdoor, lambda: 1.0
Backdoor target label: 0, trigger size: 4
Model variant: baseline
Model parameters: 6,603,710
BALANCE algorithm:
Balance Config: BALANCEConfig(gamma=2, kappa=1, alpha=0.5, min_neighbors=1)
  - Model dimension: 6,603,710 parameters
  - Complexity: O(N×d) = O(20×6,603,710)
Initial test acc across nodes: mean=0.0168 ± 0.0139
Backdoor attack: Created poisoned datasets for 14 compromised nodes
Round 001: test acc mean=0.0515 ± 0.0041 | min=0.0432 max=0.0596
         : test loss mean=29008.1860 ± 35642.5800
         : individual accs = ['0.059593', '0.048775', '0.053418', '0.043157', '0.058910', '0.045253', '0.050799', '0.051276', '0.049630', '0.047463', '0.050447', '0.049606', '0.054239', '0.049083', '0.051826', '0.051626', '0.058271', '0.049486', '0.052889', '0.054506']
         : correct/total = [(246, 4128), (205, 4203), (218, 4081), (187, 4333), (241, 4091), (194, 4287), (213, 4193), (223, 4349), (208, 4191), (203, 4277), (209, 4143), (208, 4193), (222, 4093), (206, 4197), (210, 4052), (208, 4029), (242, 4153), (207, 4183), (216, 4084), (225, 4128)]
         : compromised: 0.0503, honest: 0.0543
Round 002: test acc mean=0.0282 ± 0.0227 | min=0.0017 max=0.0582
         : test loss mean=384361.4648 ± 529828.3746
         : individual accs = ['0.044574', '0.001665', '0.003185', '0.003231', '0.057932', '0.030791', '0.005485', '0.058174', '0.005011', '0.050503', '0.055998', '0.003816', '0.003420', '0.037408', '0.002715', '0.041449', '0.049362', '0.045900', '0.054358', '0.008236']
         : correct/total = [(184, 4128), (7, 4203), (13, 4081), (14, 4333), (237, 4091), (132, 4287), (23, 4193), (253, 4349), (21, 4191), (216, 4277), (232, 4143), (16, 4193), (14, 4093), (157, 4197), (11, 4052), (167, 4029), (205, 4153), (192, 4183), (222, 4084), (34, 4128)]
         : compromised: 0.0176, honest: 0.0528
Round 003: test acc mean=0.0512 ± 0.0143 | min=0.0281 max=0.0948
         : test loss mean=nan ± nan
         : individual accs = ['0.059593', '0.034737', '0.053418', '0.040157', '0.094842', '0.045253', '0.050799', '0.043918', '0.034359', '0.077391', '0.055274', '0.028142', '0.050818', '0.049083', '0.050346', '0.051626', '0.058271', '0.049486', '0.052889', '0.044331']
         : correct/total = [(246, 4128), (146, 4203), (218, 4081), (174, 4333), (388, 4091), (194, 4287), (213, 4193), (191, 4349), (144, 4191), (331, 4277), (229, 4143), (118, 4193), (208, 4093), (206, 4197), (204, 4052), (208, 4029), (242, 4153), (207, 4183), (216, 4084), (183, 4128)]
         : compromised: 0.0454, honest: 0.0649
Round 004: test acc mean=0.0534 ± 0.0085 | min=0.0432 max=0.0859
         : test loss mean=nan ± nan
         : individual accs = ['0.059593', '0.048775', '0.053418', '0.043157', '0.058421', '0.045253', '0.050799', '0.049207', '0.049630', '0.053075', '0.085928', '0.049606', '0.054239', '0.049083', '0.051826', '0.051626', '0.058271', '0.049486', '0.052889', '0.054506']
         : correct/total = [(246, 4128), (205, 4203), (218, 4081), (187, 4333), (239, 4091), (194, 4287), (213, 4193), (214, 4349), (208, 4191), (227, 4277), (356, 4143), (208, 4193), (222, 4093), (206, 4197), (210, 4052), (208, 4029), (242, 4153), (207, 4183), (216, 4084), (225, 4128)]
         : compromised: 0.0503, honest: 0.0607
Round 005: test acc mean=0.0506 ± 0.0044 | min=0.0420 max=0.0596
         : test loss mean=nan ± nan
         : individual accs = ['0.059593', '0.048775', '0.053418', '0.043157', '0.045710', '0.045253', '0.050799', '0.047827', '0.049630', '0.053776', '0.041999', '0.049606', '0.054239', '0.049083', '0.051826', '0.051626', '0.058271', '0.049486', '0.052889', '0.054506']
         : correct/total = [(246, 4128), (205, 4203), (218, 4081), (187, 4333), (187, 4091), (194, 4287), (213, 4193), (208, 4349), (208, 4191), (230, 4277), (174, 4143), (208, 4193), (222, 4093), (206, 4197), (210, 4052), (208, 4029), (242, 4153), (207, 4183), (216, 4084), (225, 4128)]
         : compromised: 0.0503, honest: 0.0512
Round 006: test acc mean=0.0497 ± 0.0032 | min=0.0432 max=0.0545
         : test loss mean=nan ± nan
         : individual accs = ['0.044574', '0.048775', '0.053418', '0.043157', '0.051088', '0.045253', '0.050799', '0.051276', '0.049630', '0.043488', '0.050447', '0.049606', '0.054239', '0.049083', '0.051826', '0.051626', '0.049362', '0.049486', '0.052889', '0.054506']
         : correct/total = [(184, 4128), (205, 4203), (218, 4081), (187, 4333), (209, 4091), (194, 4287), (213, 4193), (223, 4349), (208, 4191), (186, 4277), (209, 4143), (208, 4193), (222, 4093), (206, 4197), (210, 4052), (208, 4029), (205, 4153), (207, 4183), (216, 4084), (225, 4128)]
         : compromised: 0.0503, honest: 0.0484
Round 007: test acc mean=0.0516 ± 0.0051 | min=0.0432 max=0.0633
         : test loss mean=nan ± nan
         : individual accs = ['0.060078', '0.048775', '0.053418', '0.043157', '0.047421', '0.045253', '0.050799', '0.058174', '0.049630', '0.043488', '0.055998', '0.049606', '0.054239', '0.049083', '0.051826', '0.051626', '0.063328', '0.049486', '0.052889', '0.054506']
         : correct/total = [(248, 4128), (205, 4203), (218, 4081), (187, 4333), (194, 4091), (194, 4287), (213, 4193), (253, 4349), (208, 4191), (186, 4277), (232, 4143), (208, 4193), (222, 4093), (206, 4197), (210, 4052), (208, 4029), (263, 4153), (207, 4183), (216, 4084), (225, 4128)]
         : compromised: 0.0503, honest: 0.0547
Round 008: test acc mean=0.0502 ± 0.0036 | min=0.0430 max=0.0551
         : test loss mean=nan ± nan
         : individual accs = ['0.051599', '0.048775', '0.053418', '0.043157', '0.043021', '0.045253', '0.050799', '0.045068', '0.049630', '0.053308', '0.051895', '0.049606', '0.054239', '0.049083', '0.051826', '0.051626', '0.055141', '0.049486', '0.052889', '0.054506']
         : correct/total = [(213, 4128), (205, 4203), (218, 4081), (187, 4333), (176, 4091), (194, 4287), (213, 4193), (196, 4349), (208, 4191), (228, 4277), (215, 4143), (208, 4193), (222, 4093), (206, 4197), (210, 4052), (208, 4029), (229, 4153), (207, 4183), (216, 4084), (225, 4128)]
         : compromised: 0.0503, honest: 0.0500
Round 009: test acc mean=0.0507 ± 0.0045 | min=0.0432 max=0.0640
         : test loss mean=nan ± nan
         : individual accs = ['0.050145', '0.048775', '0.053418', '0.043157', '0.044977', '0.045253', '0.050799', '0.043918', '0.049630', '0.054010', '0.063963', '0.049606', '0.054239', '0.049083', '0.051826', '0.051626', '0.052011', '0.049486', '0.052889', '0.054506']
         : correct/total = [(207, 4128), (205, 4203), (218, 4081), (187, 4333), (184, 4091), (194, 4287), (213, 4193), (191, 4349), (208, 4191), (231, 4277), (265, 4143), (208, 4193), (222, 4093), (206, 4197), (210, 4052), (208, 4029), (216, 4153), (207, 4183), (216, 4084), (225, 4128)]
         : compromised: 0.0503, honest: 0.0515
Round 010: test acc mean=0.0525 ± 0.0045 | min=0.0432 max=0.0602
         : test loss mean=nan ± nan
         : individual accs = ['0.059593', '0.048775', '0.053418', '0.043157', '0.058421', '0.045253', '0.050799', '0.058404', '0.049630', '0.053776', '0.055998', '0.049606', '0.054239', '0.049083', '0.051826', '0.051626', '0.060197', '0.049486', '0.052889', '0.054506']
         : correct/total = [(246, 4128), (205, 4203), (218, 4081), (187, 4333), (239, 4091), (194, 4287), (213, 4193), (254, 4349), (208, 4191), (230, 4277), (232, 4143), (208, 4193), (222, 4093), (206, 4197), (210, 4052), (208, 4029), (250, 4153), (207, 4183), (216, 4084), (225, 4128)]
         : compromised: 0.0503, honest: 0.0577

=== FINAL RESULTS ===
Dataset: femnist, Nodes: 20, Graph: erdos, Aggregation: balance
Attack: backdoor, 70.0% compromised
Final accuracy - Compromised: 0.0503, Honest: 0.0577
Overall test accuracy: mean=0.0525 ± 0.0045

=== BACKDOOR ATTACK SUCCESS RATE (ASR) ===
Target label: 0
Trigger size: 4x4
Overall ASR: 0.7000 ± 0.4583
Honest nodes ASR: 0.0000 ± 0.0000
Compromised nodes ASR: 1.0000 ± 0.0000
Note: Higher ASR indicates more successful backdoor attack

=== BALANCE SUMMARY ===
Node 0: acceptance=0.333
Node 1: acceptance=0.233
Node 2: acceptance=0.220
Node 3: acceptance=0.225
Node 4: acceptance=0.250
Node 5: acceptance=0.220
Node 6: acceptance=0.220
Node 7: acceptance=0.400
Node 8: acceptance=0.250
Node 9: acceptance=0.333
Node 10: acceptance=0.250
Node 11: acceptance=0.229
Node 12: acceptance=0.243
Node 13: acceptance=0.100
Node 14: acceptance=0.214
Node 15: acceptance=0.217
Node 16: acceptance=0.200
Node 17: acceptance=0.260
Node 18: acceptance=0.125
Node 19: acceptance=0.250

=== PARALLEL EXECUTION TIME (realistic for distributed system) ===
  COMMUNICATION (max across nodes):
    - Full model transfer: 0.000s (0.0%)
  COMPUTATION (max across nodes):
    - Filtering: 0.032s (70.5%)
    - Aggregation: 0.013s (29.5%)
  TOTALS:
    - Total computation: 0.045s (100.0%)
    - Total communication: 0.000s (0.0%)
    - Total parallel time: 0.045s

=== PER-NODE AVERAGE TIME ===
  - Filtering: 0.026s
  - Aggregation: 0.004s
  - Model transfer: 0.000s
  - Total per node: 0.029s

=== TOTAL COMPUTATIONAL WORK (sum across all nodes) ===
  - Total filtering: 0.512s
  - Total aggregation: 0.073s
  - Total model transfer: 0.000s
  - Grand total: 0.585s
  - Mean acceptance rate: 0.239

BALANCE Algorithm Properties:
  - Model dimension: 6,603,710
  - No compression: Full parameter comparison
  - Theoretical complexity: O(deg(i)×d)
  - Approach: Full parameter filtering + averaging
