Device: cuda
Seed: 987654321
Loading 36 LEAF FEMNIST train files...
LEAF FEMNIST train: 3597 users, 734463 samples
Loading 36 LEAF FEMNIST test files...
LEAF FEMNIST test: 3597 users, 83388 samples
Found 3597 train users, 3597 test users, 3597 common users
User sample counts range: 525 (max) to 17 (min)
Distributed ALL 3597 users across 20 clients
Users per client: 179 (with 17 clients getting +1 user)
Train partition sizes: [36360, 37070, 35957, 38262, 36024, 37732, 36921, 38328, 36867, 37683, 36507, 36915, 36007, 37001, 35681, 35453, 36585, 36801, 35964, 36345]
Test partition sizes: [4128, 4203, 4081, 4333, 4091, 4287, 4193, 4349, 4191, 4277, 4143, 4193, 4093, 4197, 4052, 4029, 4153, 4183, 4084, 4128]
  Client 0: 36360 train samples, 62 unique classes
  Client 1: 37070 train samples, 62 unique classes
  Client 2: 35957 train samples, 62 unique classes
  Client 3: 38262 train samples, 62 unique classes
  Client 4: 36024 train samples, 62 unique classes
  Client 5: 37732 train samples, 62 unique classes
  Client 6: 36921 train samples, 62 unique classes
  Client 7: 38328 train samples, 62 unique classes
  Client 8: 36867 train samples, 62 unique classes
  Client 9: 37683 train samples, 62 unique classes
  Client 10: 36507 train samples, 62 unique classes
  Client 11: 36915 train samples, 62 unique classes
  Client 12: 36007 train samples, 62 unique classes
  Client 13: 37001 train samples, 62 unique classes
  Client 14: 35681 train samples, 62 unique classes
  Client 15: 35453 train samples, 62 unique classes
  Client 16: 36585 train samples, 62 unique classes
  Client 17: 36801 train samples, 62 unique classes
  Client 18: 35964 train samples, 62 unique classes
  Client 19: 36345 train samples, 62 unique classes
Will sample 4500 samples per client per epoch
Graph: erdos, nodes: 20, edges: 48
Degree statistics: avg=4.80, min=2, max=7
Attack: Compromised 6/20 nodes: [5, 12, 13, 14, 17, 18]
Attack type: directed_deviation, lambda: 1.0
Model variant: baseline
Model parameters: 6,603,710
BALANCE algorithm:
Balance Config: BALANCEConfig(gamma=2, kappa=1, alpha=0.5, min_neighbors=1)
  - Model dimension: 6,603,710 parameters
  - Complexity: O(N×d) = O(20×6,603,710)
Initial test acc across nodes: mean=0.0168 ± 0.0139
Round 001: test acc mean=0.0523 ± 0.0036 | min=0.0457 max=0.0596
         : test loss mean=4.0319 ± 0.0120
         : individual accs = ['0.059593', '0.051630', '0.048272', '0.046619', '0.052066', '0.050618', '0.057000', '0.051276', '0.053209', '0.053776', '0.053102', '0.053899', '0.050818', '0.045747', '0.048124', '0.050633', '0.058271', '0.050920', '0.055583', '0.054990']
         : correct/total = [(246, 4128), (217, 4203), (197, 4081), (202, 4333), (213, 4091), (217, 4287), (239, 4193), (223, 4349), (223, 4191), (230, 4277), (220, 4143), (226, 4193), (208, 4093), (192, 4197), (195, 4052), (204, 4029), (242, 4153), (213, 4183), (227, 4084), (227, 4128)]
         : compromised: 0.0503, honest: 0.0532
Round 002: test acc mean=0.0534 ± 0.0038 | min=0.0446 max=0.0624
         : test loss mean=3.8754 ± 0.0508
         : individual accs = ['0.044574', '0.051630', '0.055134', '0.052850', '0.057932', '0.048752', '0.057000', '0.058174', '0.053209', '0.053776', '0.055998', '0.053899', '0.054239', '0.062426', '0.051579', '0.050633', '0.055141', '0.050920', '0.050196', '0.050388']
         : correct/total = [(184, 4128), (217, 4203), (225, 4081), (229, 4333), (237, 4091), (209, 4287), (239, 4193), (253, 4349), (223, 4191), (230, 4277), (232, 4143), (226, 4193), (222, 4093), (262, 4197), (209, 4052), (204, 4029), (229, 4153), (213, 4183), (205, 4084), (208, 4128)]
         : compromised: 0.0530, honest: 0.0536
Round 003: test acc mean=0.0538 ± 0.0046 | min=0.0457 max=0.0618
         : test loss mean=3.7621 ± 0.0279
         : individual accs = ['0.059593', '0.048299', '0.050723', '0.048234', '0.057932', '0.048052', '0.057000', '0.051276', '0.053209', '0.058920', '0.055274', '0.061770', '0.058637', '0.045747', '0.048124', '0.056342', '0.058271', '0.050203', '0.052889', '0.055475']
         : correct/total = [(246, 4128), (203, 4203), (207, 4081), (209, 4333), (237, 4091), (206, 4287), (239, 4193), (223, 4349), (223, 4191), (252, 4277), (229, 4143), (259, 4193), (240, 4093), (192, 4197), (195, 4052), (227, 4029), (242, 4153), (210, 4183), (216, 4084), (229, 4128)]
         : compromised: 0.0506, honest: 0.0552
Round 004: test acc mean=0.0546 ± 0.0045 | min=0.0451 max=0.0624
         : test loss mean=3.7135 ± 0.0143
         : individual accs = ['0.059593', '0.052344', '0.057584', '0.052850', '0.052554', '0.050618', '0.057000', '0.058174', '0.053209', '0.053075', '0.045619', '0.053899', '0.058637', '0.062426', '0.061204', '0.056590', '0.058271', '0.050920', '0.052889', '0.045058']
         : correct/total = [(246, 4128), (220, 4203), (235, 4081), (229, 4333), (215, 4091), (217, 4287), (239, 4193), (253, 4349), (223, 4191), (227, 4277), (189, 4143), (226, 4193), (240, 4093), (262, 4197), (248, 4052), (228, 4029), (242, 4153), (213, 4183), (216, 4084), (186, 4128)]
         : compromised: 0.0561, honest: 0.0540
Round 005: test acc mean=0.0537 ± 0.0044 | min=0.0457 max=0.0596
         : test loss mean=3.6934 ± 0.0135
         : individual accs = ['0.059593', '0.052344', '0.057584', '0.059312', '0.045710', '0.050618', '0.057000', '0.047827', '0.051062', '0.053776', '0.055998', '0.046983', '0.058637', '0.046938', '0.051579', '0.054852', '0.058271', '0.050920', '0.055583', '0.058624']
         : correct/total = [(246, 4128), (220, 4203), (235, 4081), (257, 4333), (187, 4091), (217, 4287), (239, 4193), (208, 4349), (214, 4191), (230, 4277), (232, 4143), (197, 4193), (240, 4093), (197, 4197), (209, 4052), (221, 4029), (242, 4153), (213, 4183), (227, 4084), (242, 4128)]
         : compromised: 0.0524, honest: 0.0542
Round 006: test acc mean=0.0580 ± 0.0082 | min=0.0496 max=0.0855
         : test loss mean=3.6853 ± 0.0152
         : individual accs = ['0.066618', '0.052344', '0.057584', '0.052850', '0.051088', '0.051784', '0.057000', '0.085537', '0.049630', '0.053776', '0.050447', '0.061770', '0.058637', '0.062426', '0.061204', '0.068007', '0.058271', '0.050920', '0.055583', '0.055475']
         : correct/total = [(275, 4128), (220, 4203), (235, 4081), (229, 4333), (209, 4091), (222, 4287), (239, 4193), (372, 4349), (208, 4191), (230, 4277), (209, 4143), (259, 4193), (240, 4093), (262, 4197), (248, 4052), (274, 4029), (242, 4153), (213, 4183), (227, 4084), (229, 4128)]
         : compromised: 0.0568, honest: 0.0586
Round 007: test acc mean=0.0550 ± 0.0044 | min=0.0435 max=0.0624
         : test loss mean=3.6837 ± 0.0147
         : individual accs = ['0.059593', '0.052344', '0.057584', '0.058158', '0.047421', '0.050618', '0.058908', '0.058174', '0.053209', '0.043488', '0.055998', '0.053899', '0.058637', '0.062426', '0.051826', '0.056590', '0.058271', '0.050920', '0.055583', '0.055475']
         : correct/total = [(246, 4128), (220, 4203), (235, 4081), (252, 4333), (194, 4091), (217, 4287), (247, 4193), (253, 4349), (223, 4191), (186, 4277), (232, 4143), (226, 4193), (240, 4093), (262, 4197), (210, 4052), (228, 4029), (242, 4153), (213, 4183), (227, 4084), (229, 4128)]
         : compromised: 0.0550, honest: 0.0549
Round 008: test acc mean=0.0536 ± 0.0052 | min=0.0430 max=0.0681
         : test loss mean=3.6825 ± 0.0158
         : individual accs = ['0.051599', '0.050202', '0.050723', '0.054235', '0.043021', '0.068113', '0.057000', '0.051276', '0.051062', '0.053776', '0.055998', '0.053899', '0.053750', '0.062426', '0.048124', '0.056342', '0.055141', '0.050920', '0.055583', '0.048450']
         : correct/total = [(213, 4128), (211, 4203), (207, 4081), (235, 4333), (176, 4091), (292, 4287), (239, 4193), (223, 4349), (214, 4191), (230, 4277), (232, 4143), (226, 4193), (220, 4093), (262, 4197), (195, 4052), (227, 4029), (229, 4153), (213, 4183), (227, 4084), (200, 4128)]
         : compromised: 0.0565, honest: 0.0523
Round 009: test acc mean=0.0543 ± 0.0049 | min=0.0439 max=0.0676
         : test loss mean=3.6803 ± 0.0165
         : individual accs = ['0.050145', '0.050916', '0.057584', '0.052850', '0.051088', '0.050618', '0.058431', '0.043918', '0.053209', '0.053776', '0.055998', '0.053899', '0.058637', '0.062426', '0.051826', '0.056342', '0.051047', '0.050920', '0.067581', '0.055475']
         : correct/total = [(207, 4128), (214, 4203), (235, 4081), (229, 4333), (209, 4091), (217, 4287), (245, 4193), (191, 4349), (223, 4191), (230, 4277), (232, 4143), (226, 4193), (240, 4093), (262, 4197), (210, 4052), (227, 4029), (212, 4153), (213, 4183), (276, 4084), (229, 4128)]
         : compromised: 0.0570, honest: 0.0532
Round 010: test acc mean=0.0570 ± 0.0081 | min=0.0480 max=0.0882
         : test loss mean=3.6795 ± 0.0169
         : individual accs = ['0.051599', '0.052344', '0.057584', '0.052850', '0.057932', '0.088174', '0.049130', '0.058174', '0.047960', '0.053776', '0.055998', '0.053899', '0.060103', '0.062426', '0.061204', '0.056342', '0.058271', '0.050920', '0.055583', '0.055475']
         : correct/total = [(213, 4128), (220, 4203), (235, 4081), (229, 4333), (237, 4091), (378, 4287), (206, 4193), (253, 4349), (201, 4191), (230, 4277), (232, 4143), (226, 4193), (246, 4093), (262, 4197), (248, 4052), (227, 4029), (242, 4153), (213, 4183), (227, 4084), (229, 4128)]
         : compromised: 0.0631, honest: 0.0544

=== FINAL RESULTS ===
Dataset: femnist, Nodes: 20, Graph: erdos, Aggregation: balance
Attack: directed_deviation, 30.0% compromised
Final accuracy - Compromised: 0.0631, Honest: 0.0544
Overall test accuracy: mean=0.0570 ± 0.0081

=== BALANCE SUMMARY ===
Node 0: acceptance=0.833
Node 1: acceptance=1.000
Node 2: acceptance=0.600
Node 3: acceptance=0.750
Node 4: acceptance=0.500
Node 5: acceptance=0.400
Node 6: acceptance=0.800
Node 7: acceptance=0.600
Node 8: acceptance=0.500
Node 9: acceptance=1.000
Node 10: acceptance=0.750
Node 11: acceptance=0.571
Node 12: acceptance=0.714
Node 13: acceptance=0.750
Node 14: acceptance=0.429
Node 15: acceptance=0.500
Node 16: acceptance=0.400
Node 17: acceptance=0.600
Node 18: acceptance=0.900
Node 19: acceptance=1.000

=== PARALLEL EXECUTION TIME (realistic for distributed system) ===
  COMMUNICATION (max across nodes):
    - Full model transfer: 0.000s (0.0%)
  COMPUTATION (max across nodes):
    - Filtering: 0.029s (71.0%)
    - Aggregation: 0.012s (28.9%)
  TOTALS:
    - Total computation: 0.040s (100.0%)
    - Total communication: 0.000s (0.0%)
    - Total parallel time: 0.040s

=== PER-NODE AVERAGE TIME ===
  - Filtering: 0.022s
  - Aggregation: 0.004s
  - Model transfer: 0.000s
  - Total per node: 0.027s

=== TOTAL COMPUTATIONAL WORK (sum across all nodes) ===
  - Total filtering: 0.447s
  - Total aggregation: 0.085s
  - Total model transfer: 0.000s
  - Grand total: 0.532s
  - Mean acceptance rate: 0.680

BALANCE Algorithm Properties:
  - Model dimension: 6,603,710
  - No compression: Full parameter comparison
  - Theoretical complexity: O(deg(i)×d)
  - Approach: Full parameter filtering + averaging
