Device: cuda
Seed: 987654321
Loading 36 LEAF FEMNIST train files...
LEAF FEMNIST train: 3597 users, 734463 samples
Loading 36 LEAF FEMNIST test files...
LEAF FEMNIST test: 3597 users, 83388 samples
Found 3597 train users, 3597 test users, 3597 common users
User sample counts range: 525 (max) to 17 (min)
Distributed ALL 3597 users across 20 clients
Users per client: 179 (with 17 clients getting +1 user)
Train partition sizes: [36360, 37070, 35957, 38262, 36024, 37732, 36921, 38328, 36867, 37683, 36507, 36915, 36007, 37001, 35681, 35453, 36585, 36801, 35964, 36345]
Test partition sizes: [4128, 4203, 4081, 4333, 4091, 4287, 4193, 4349, 4191, 4277, 4143, 4193, 4093, 4197, 4052, 4029, 4153, 4183, 4084, 4128]
  Client 0: 36360 train samples, 62 unique classes
  Client 1: 37070 train samples, 62 unique classes
  Client 2: 35957 train samples, 62 unique classes
  Client 3: 38262 train samples, 62 unique classes
  Client 4: 36024 train samples, 62 unique classes
  Client 5: 37732 train samples, 62 unique classes
  Client 6: 36921 train samples, 62 unique classes
  Client 7: 38328 train samples, 62 unique classes
  Client 8: 36867 train samples, 62 unique classes
  Client 9: 37683 train samples, 62 unique classes
  Client 10: 36507 train samples, 62 unique classes
  Client 11: 36915 train samples, 62 unique classes
  Client 12: 36007 train samples, 62 unique classes
  Client 13: 37001 train samples, 62 unique classes
  Client 14: 35681 train samples, 62 unique classes
  Client 15: 35453 train samples, 62 unique classes
  Client 16: 36585 train samples, 62 unique classes
  Client 17: 36801 train samples, 62 unique classes
  Client 18: 35964 train samples, 62 unique classes
  Client 19: 36345 train samples, 62 unique classes
Will sample 10000 samples per client per epoch
Graph: erdos, nodes: 20, edges: 126
Degree statistics: avg=12.60, min=8, max=16
Model variant: baseline
Model parameters: 6,603,710
BALANCE algorithm:
Balance Config: BALANCEConfig(gamma=2, kappa=1, alpha=0.5, min_neighbors=1)
  - Model dimension: 6,603,710 parameters
  - Complexity: O(N×d) = O(20×6,603,710)
Initial test acc across nodes: mean=0.0168 ± 0.0139
Round 001: test acc mean=0.5153 ± 0.0315 | min=0.4611 max=0.5948
         : test loss mean=3.7223 ± 0.0285
         : individual accs = ['0.565891', '0.505591', '0.553541', '0.497808', '0.510878', '0.594822', '0.523492', '0.512762', '0.518253', '0.461071', '0.524258', '0.525161', '0.462741', '0.476769', '0.539733', '0.518243', '0.488562', '0.520440', '0.504652', '0.500727']
         : correct/total = [(2336, 4128), (2125, 4203), (2259, 4081), (2157, 4333), (2090, 4091), (2550, 4287), (2195, 4193), (2230, 4349), (2172, 4191), (1972, 4277), (2172, 4143), (2202, 4193), (1894, 4093), (2001, 4197), (2187, 4052), (2088, 4029), (2029, 4153), (2177, 4183), (2061, 4084), (2067, 4128)]
Round 002: test acc mean=0.6878 ± 0.0155 | min=0.6632 max=0.7268
         : test loss mean=3.4006 ± 0.0341
         : individual accs = ['0.696463', '0.689032', '0.683901', '0.692361', '0.697873', '0.726849', '0.663248', '0.683835', '0.693868', '0.663549', '0.691769', '0.687336', '0.673589', '0.687872', '0.692004', '0.663192', '0.682398', '0.717189', '0.690010', '0.678779']
         : correct/total = [(2875, 4128), (2896, 4203), (2791, 4081), (3000, 4333), (2855, 4091), (3116, 4287), (2781, 4193), (2974, 4349), (2908, 4191), (2838, 4277), (2866, 4143), (2882, 4193), (2757, 4093), (2887, 4197), (2804, 4052), (2672, 4029), (2834, 4153), (3000, 4183), (2818, 4084), (2802, 4128)]
Round 003: test acc mean=0.7150 ± 0.0220 | min=0.6402 max=0.7418
         : test loss mean=3.1089 ± 0.0459
         : individual accs = ['0.721172', '0.710207', '0.710365', '0.719594', '0.735517', '0.720784', '0.711424', '0.741780', '0.710332', '0.738134', '0.734251', '0.687098', '0.730516', '0.696212', '0.714462', '0.711343', '0.709126', '0.640210', '0.734329', '0.723837']
         : correct/total = [(2977, 4128), (2985, 4203), (2899, 4081), (3118, 4333), (3009, 4091), (3090, 4287), (2983, 4193), (3226, 4349), (2977, 4191), (3157, 4277), (3042, 4143), (2881, 4193), (2990, 4093), (2922, 4197), (2895, 4052), (2866, 4029), (2945, 4153), (2678, 4183), (2999, 4084), (2988, 4128)]
Round 004: test acc mean=0.7093 ± 0.0208 | min=0.6720 max=0.7445
         : test loss mean=2.6831 ± 0.0497
         : individual accs = ['0.721899', '0.739234', '0.693212', '0.692592', '0.735028', '0.707021', '0.711424', '0.727754', '0.716774', '0.681319', '0.683804', '0.720964', '0.673345', '0.697641', '0.709526', '0.712584', '0.744522', '0.723882', '0.721596', '0.671996']
         : correct/total = [(2980, 4128), (3107, 4203), (2829, 4081), (3001, 4333), (3007, 4091), (3031, 4287), (2983, 4193), (3165, 4349), (3004, 4191), (2914, 4277), (2833, 4143), (3023, 4193), (2756, 4093), (2928, 4197), (2875, 4052), (2871, 4029), (3092, 4153), (3028, 4183), (2947, 4084), (2774, 4128)]
Round 005: test acc mean=0.6802 ± 0.0222 | min=0.6427 max=0.7241
         : test loss mean=2.1159 ± 0.0743
         : individual accs = ['0.686289', '0.687366', '0.648861', '0.642742', '0.712784', '0.698624', '0.670880', '0.724074', '0.651873', '0.692074', '0.668598', '0.666110', '0.665771', '0.672147', '0.678924', '0.664929', '0.691789', '0.705953', '0.712537', '0.661579']
         : correct/total = [(2833, 4128), (2889, 4203), (2648, 4081), (2785, 4333), (2916, 4091), (2995, 4287), (2813, 4193), (3149, 4349), (2732, 4191), (2960, 4277), (2770, 4143), (2793, 4193), (2725, 4093), (2821, 4197), (2751, 4052), (2679, 4029), (2873, 4153), (2953, 4183), (2910, 4084), (2731, 4128)]
Round 006: test acc mean=0.7143 ± 0.0201 | min=0.6706 max=0.7428
         : test loss mean=1.4476 ± 0.0603
         : individual accs = ['0.708333', '0.733762', '0.692722', '0.671359', '0.731850', '0.741311', '0.725972', '0.704530', '0.713195', '0.670563', '0.712769', '0.723348', '0.698754', '0.696926', '0.736426', '0.716307', '0.721165', '0.742768', '0.727963', '0.716328']
         : correct/total = [(2924, 4128), (3084, 4203), (2827, 4081), (2909, 4333), (2994, 4091), (3178, 4287), (3044, 4193), (3064, 4349), (2989, 4191), (2868, 4277), (2953, 4143), (3033, 4193), (2860, 4093), (2925, 4197), (2984, 4052), (2886, 4029), (2995, 4153), (3107, 4183), (2973, 4084), (2957, 4128)]
Round 007: test acc mean=0.7830 ± 0.0105 | min=0.7647 max=0.8015
         : test loss mean=0.8821 ± 0.0375
         : individual accs = ['0.788760', '0.783250', '0.768439', '0.772444', '0.801516', '0.792629', '0.775578', '0.791216', '0.783584', '0.776479', '0.765387', '0.777963', '0.794527', '0.797951', '0.786278', '0.764706', '0.791717', '0.775759', '0.792116', '0.780281']
         : correct/total = [(3256, 4128), (3292, 4203), (3136, 4081), (3347, 4333), (3279, 4091), (3398, 4287), (3252, 4193), (3441, 4349), (3284, 4191), (3321, 4277), (3171, 4143), (3262, 4193), (3252, 4093), (3349, 4197), (3186, 4052), (3081, 4029), (3288, 4153), (3245, 4183), (3235, 4084), (3221, 4128)]
Round 008: test acc mean=0.8177 ± 0.0074 | min=0.8024 max=0.8312
         : test loss mean=0.6090 ± 0.0233
         : individual accs = ['0.816860', '0.825601', '0.823083', '0.813524', '0.822048', '0.820854', '0.813499', '0.831226', '0.815080', '0.827449', '0.808834', '0.815884', '0.823357', '0.818442', '0.805035', '0.802432', '0.817722', '0.809467', '0.826641', '0.816860']
         : correct/total = [(3372, 4128), (3470, 4203), (3359, 4081), (3525, 4333), (3363, 4091), (3519, 4287), (3411, 4193), (3615, 4349), (3416, 4191), (3539, 4277), (3351, 4143), (3421, 4193), (3370, 4093), (3435, 4197), (3262, 4052), (3233, 4029), (3396, 4153), (3386, 4183), (3376, 4084), (3372, 4128)]
Round 009: test acc mean=0.8299 ± 0.0072 | min=0.8203 max=0.8434
         : test loss mean=0.5321 ± 0.0211
         : individual accs = ['0.821948', '0.835118', '0.843421', '0.825987', '0.837204', '0.832983', '0.823038', '0.843412', '0.826056', '0.839841', '0.822592', '0.822800', '0.834596', '0.827972', '0.825271', '0.820303', '0.835059', '0.826440', '0.831293', '0.822190']
         : correct/total = [(3393, 4128), (3510, 4203), (3442, 4081), (3579, 4333), (3425, 4091), (3571, 4287), (3451, 4193), (3668, 4349), (3462, 4191), (3592, 4277), (3408, 4143), (3450, 4193), (3416, 4093), (3475, 4197), (3344, 4052), (3305, 4029), (3468, 4153), (3457, 4183), (3395, 4084), (3394, 4128)]
Round 010: test acc mean=0.8375 ± 0.0071 | min=0.8212 max=0.8472
         : test loss mean=0.4981 ± 0.0209
         : individual accs = ['0.839147', '0.840828', '0.843421', '0.834987', '0.847226', '0.835783', '0.832817', '0.846631', '0.831782', '0.845452', '0.832730', '0.824708', '0.838260', '0.841553', '0.835390', '0.832465', '0.846617', '0.834090', '0.845739', '0.821221']
         : correct/total = [(3464, 4128), (3534, 4203), (3442, 4081), (3618, 4333), (3466, 4091), (3583, 4287), (3492, 4193), (3682, 4349), (3486, 4191), (3616, 4277), (3450, 4143), (3458, 4193), (3431, 4093), (3532, 4197), (3385, 4052), (3354, 4029), (3516, 4153), (3489, 4183), (3454, 4084), (3390, 4128)]

=== FINAL RESULTS ===
Dataset: femnist, Nodes: 20, Graph: erdos, Aggregation: balance
Overall test accuracy: mean=0.8375 ± 0.0071

=== BALANCE SUMMARY ===
Node 0: acceptance=1.000
Node 1: acceptance=1.000
Node 2: acceptance=1.000
Node 3: acceptance=1.000
Node 4: acceptance=1.000
Node 5: acceptance=1.000
Node 6: acceptance=1.000
Node 7: acceptance=1.000
Node 8: acceptance=1.000
Node 9: acceptance=1.000
Node 10: acceptance=1.000
Node 11: acceptance=1.000
Node 12: acceptance=1.000
Node 13: acceptance=1.000
Node 14: acceptance=1.000
Node 15: acceptance=1.000
Node 16: acceptance=1.000
Node 17: acceptance=1.000
Node 18: acceptance=1.000
Node 19: acceptance=1.000

=== PARALLEL EXECUTION TIME (realistic for distributed system) ===
  COMMUNICATION (max across nodes):
    - Full model transfer: 0.000s (0.0%)
  COMPUTATION (max across nodes):
    - Filtering: 0.223s (83.4%)
    - Aggregation: 0.044s (16.6%)
  TOTALS:
    - Total computation: 0.268s (100.0%)
    - Total communication: 0.000s (0.0%)
    - Total parallel time: 0.268s

=== PER-NODE AVERAGE TIME ===
  - Filtering: 0.105s
  - Aggregation: 0.013s
  - Model transfer: 0.000s
  - Total per node: 0.118s

=== TOTAL COMPUTATIONAL WORK (sum across all nodes) ===
  - Total filtering: 2.093s
  - Total aggregation: 0.264s
  - Total model transfer: 0.000s
  - Grand total: 2.358s
  - Mean acceptance rate: 1.000

BALANCE Algorithm Properties:
  - Model dimension: 6,603,710
  - No compression: Full parameter comparison
  - Theoretical complexity: O(deg(i)×d)
  - Approach: Full parameter filtering + averaging
