Device: cuda
Seed: 987654321
Loading 36 LEAF FEMNIST train files...
LEAF FEMNIST train: 3597 users, 734463 samples
Loading 36 LEAF FEMNIST test files...
LEAF FEMNIST test: 3597 users, 83388 samples
Found 3597 train users, 3597 test users, 3597 common users
User sample counts range: 525 (max) to 17 (min)
Distributed ALL 3597 users across 20 clients
Users per client: 179 (with 17 clients getting +1 user)
Train partition sizes: [36360, 37070, 35957, 38262, 36024, 37732, 36921, 38328, 36867, 37683, 36507, 36915, 36007, 37001, 35681, 35453, 36585, 36801, 35964, 36345]
Test partition sizes: [4128, 4203, 4081, 4333, 4091, 4287, 4193, 4349, 4191, 4277, 4143, 4193, 4093, 4197, 4052, 4029, 4153, 4183, 4084, 4128]
  Client 0: 36360 train samples, 62 unique classes
  Client 1: 37070 train samples, 62 unique classes
  Client 2: 35957 train samples, 62 unique classes
  Client 3: 38262 train samples, 62 unique classes
  Client 4: 36024 train samples, 62 unique classes
  Client 5: 37732 train samples, 62 unique classes
  Client 6: 36921 train samples, 62 unique classes
  Client 7: 38328 train samples, 62 unique classes
  Client 8: 36867 train samples, 62 unique classes
  Client 9: 37683 train samples, 62 unique classes
  Client 10: 36507 train samples, 62 unique classes
  Client 11: 36915 train samples, 62 unique classes
  Client 12: 36007 train samples, 62 unique classes
  Client 13: 37001 train samples, 62 unique classes
  Client 14: 35681 train samples, 62 unique classes
  Client 15: 35453 train samples, 62 unique classes
  Client 16: 36585 train samples, 62 unique classes
  Client 17: 36801 train samples, 62 unique classes
  Client 18: 35964 train samples, 62 unique classes
  Client 19: 36345 train samples, 62 unique classes
Will sample 4500 samples per client per epoch
Graph: erdos, nodes: 20, edges: 99
Degree statistics: avg=9.90, min=7, max=14
Attack: Compromised 14/20 nodes: [1, 2, 3, 5, 6, 8, 11, 12, 13, 14, 15, 17, 18, 19]
Attack type: gaussian, lambda: 1.0
Model variant: baseline
Model parameters: 6,603,710
UBAR ALGORITHM (Two-Stage Byzantine-resilient)
  - Model dimension: 6,603,710 parameters
  - Rho parameter: 0.30000000000000004
  - Stage 1: Distance-based filtering (select 30% closest neighbors)
  - Stage 2: Performance-based selection (loss comparison)
  - Complexity: O(deg(i)×d + deg(i)×inference)
Initial test acc across nodes: mean=0.0168 ± 0.0139
Round 001: test acc mean=0.0531 ± 0.0056 | min=0.0438 max=0.0677
         : test loss mean=4.0024 ± 0.0321
         : individual accs = ['0.059593', '0.052344', '0.055134', '0.052850', '0.044977', '0.050618', '0.057000', '0.051276', '0.053209', '0.053075', '0.050447', '0.067732', '0.062790', '0.046938', '0.048124', '0.050633', '0.055141', '0.050920', '0.055583', '0.043847']
         : correct/total = [(246, 4128), (220, 4203), (225, 4081), (229, 4333), (184, 4091), (217, 4287), (239, 4193), (223, 4349), (223, 4191), (227, 4277), (209, 4143), (284, 4193), (257, 4093), (197, 4197), (195, 4052), (204, 4029), (229, 4153), (213, 4183), (227, 4084), (181, 4128)]
         : compromised: 0.0534, honest: 0.0524
         : ubar stats = ['Node 0: s1=0.250, s2=1.000', 'Node 1: s1=0.300, s2=0.667', 'Node 2: s1=0.250, s2=0.500']...
Round 002: test acc mean=0.0518 ± 0.0048 | min=0.0420 max=0.0624
         : test loss mean=3.8240 ± 0.0688
         : individual accs = ['0.044574', '0.051630', '0.055134', '0.052850', '0.057932', '0.048752', '0.049845', '0.058174', '0.053209', '0.053776', '0.041999', '0.053899', '0.049597', '0.062426', '0.050346', '0.056590', '0.049603', '0.046139', '0.050196', '0.048692']
         : correct/total = [(184, 4128), (217, 4203), (225, 4081), (229, 4333), (237, 4091), (209, 4287), (209, 4193), (253, 4349), (223, 4191), (230, 4277), (174, 4143), (226, 4193), (203, 4093), (262, 4197), (204, 4052), (228, 4029), (206, 4153), (193, 4183), (205, 4084), (201, 4128)]
         : compromised: 0.0521, honest: 0.0510
         : ubar stats = ['Node 0: s1=0.250, s2=1.000', 'Node 1: s1=0.300, s2=0.667', 'Node 2: s1=0.250, s2=0.500']...
Round 003: test acc mean=0.0567 ± 0.0113 | min=0.0439 max=0.0890
         : test loss mean=3.7378 ± 0.0435
         : individual accs = ['0.059593', '0.050916', '0.050723', '0.048234', '0.088976', '0.048052', '0.057000', '0.043918', '0.053209', '0.087211', '0.055274', '0.053899', '0.058637', '0.062426', '0.051579', '0.056342', '0.054418', '0.050203', '0.052889', '0.050388']
         : correct/total = [(246, 4128), (214, 4203), (207, 4081), (209, 4333), (364, 4091), (206, 4287), (239, 4193), (191, 4349), (223, 4191), (373, 4277), (229, 4143), (226, 4193), (240, 4093), (262, 4197), (209, 4052), (227, 4029), (226, 4153), (210, 4183), (216, 4084), (208, 4128)]
         : compromised: 0.0532, honest: 0.0649
         : ubar stats = ['Node 0: s1=0.250, s2=1.000', 'Node 1: s1=0.300, s2=0.556', 'Node 2: s1=0.250, s2=0.500']...
Round 004: test acc mean=0.0535 ± 0.0078 | min=0.0435 max=0.0801
         : test loss mean=3.7077 ± 0.0239
         : individual accs = ['0.059593', '0.052344', '0.080127', '0.052850', '0.057932', '0.050618', '0.044598', '0.058174', '0.053209', '0.043488', '0.045619', '0.046983', '0.054239', '0.062426', '0.048124', '0.055349', '0.052011', '0.050920', '0.052889', '0.048450']
         : correct/total = [(246, 4128), (220, 4203), (327, 4081), (229, 4333), (237, 4091), (217, 4287), (187, 4193), (253, 4349), (223, 4191), (186, 4277), (189, 4143), (197, 4193), (222, 4093), (262, 4197), (195, 4052), (223, 4029), (216, 4153), (213, 4183), (216, 4084), (200, 4128)]
         : compromised: 0.0538, honest: 0.0528
         : ubar stats = ['Node 0: s1=0.250, s2=0.833', 'Node 1: s1=0.300, s2=0.500', 'Node 2: s1=0.250, s2=0.500']...
Round 005: test acc mean=0.0545 ± 0.0095 | min=0.0434 max=0.0908
         : test loss mean=3.6878 ± 0.0172
         : individual accs = ['0.059593', '0.046158', '0.053418', '0.052850', '0.057932', '0.043387', '0.057000', '0.047827', '0.051062', '0.053776', '0.055998', '0.046745', '0.045688', '0.090779', '0.051826', '0.054852', '0.059234', '0.050920', '0.055583', '0.055475']
         : correct/total = [(246, 4128), (194, 4203), (218, 4081), (229, 4333), (237, 4091), (186, 4287), (239, 4193), (208, 4349), (214, 4191), (230, 4277), (232, 4143), (196, 4193), (187, 4093), (381, 4197), (210, 4052), (221, 4029), (246, 4153), (213, 4183), (227, 4084), (229, 4128)]
         : compromised: 0.0540, honest: 0.0557
         : ubar stats = ['Node 0: s1=0.250, s2=0.800', 'Node 1: s1=0.300, s2=0.467', 'Node 2: s1=0.250, s2=0.500']...
Round 006: test acc mean=0.0557 ± 0.0113 | min=0.0434 max=0.0995
         : test loss mean=3.6814 ± 0.0180
         : individual accs = ['0.044574', '0.050916', '0.057584', '0.055389', '0.057932', '0.043387', '0.043883', '0.058174', '0.052971', '0.053776', '0.050447', '0.061770', '0.053750', '0.062426', '0.099457', '0.056590', '0.049362', '0.050920', '0.055583', '0.055475']
         : correct/total = [(184, 4128), (214, 4203), (235, 4081), (240, 4333), (237, 4091), (186, 4287), (184, 4193), (253, 4349), (222, 4191), (230, 4277), (209, 4143), (259, 4193), (220, 4093), (262, 4197), (403, 4052), (228, 4029), (205, 4153), (213, 4183), (227, 4084), (229, 4128)]
         : compromised: 0.0571, honest: 0.0524
         : ubar stats = ['Node 0: s1=0.250, s2=0.833', 'Node 1: s1=0.300, s2=0.444', 'Node 2: s1=0.250, s2=0.583']...
Round 007: test acc mean=0.0583 ± 0.0142 | min=0.0437 max=0.0963
         : test loss mean=3.6808 ± 0.0157
         : individual accs = ['0.050145', '0.048775', '0.060524', '0.052850', '0.047421', '0.050618', '0.057000', '0.058174', '0.053209', '0.043722', '0.055998', '0.085857', '0.058637', '0.046938', '0.051826', '0.096302', '0.058512', '0.045900', '0.088394', '0.055475']
         : correct/total = [(207, 4128), (205, 4203), (247, 4081), (229, 4333), (194, 4091), (217, 4287), (239, 4193), (253, 4349), (223, 4191), (187, 4277), (232, 4143), (360, 4193), (240, 4093), (197, 4197), (210, 4052), (388, 4029), (243, 4153), (192, 4183), (361, 4084), (229, 4128)]
         : compromised: 0.0609, honest: 0.0523
         : ubar stats = ['Node 0: s1=0.250, s2=0.762', 'Node 1: s1=0.300, s2=0.429', 'Node 2: s1=0.250, s2=0.571']...
Round 008: test acc mean=0.0542 ± 0.0081 | min=0.0432 max=0.0820
         : test loss mean=3.6798 ± 0.0166
         : individual accs = ['0.051599', '0.048775', '0.053418', '0.043157', '0.051088', '0.048052', '0.057000', '0.051276', '0.052016', '0.053075', '0.048033', '0.049845', '0.053750', '0.081963', '0.068855', '0.056342', '0.055141', '0.049486', '0.055583', '0.056202']
         : correct/total = [(213, 4128), (205, 4203), (218, 4081), (187, 4333), (209, 4091), (206, 4287), (239, 4193), (223, 4349), (218, 4191), (227, 4277), (199, 4143), (209, 4193), (220, 4093), (344, 4197), (279, 4052), (227, 4029), (229, 4153), (207, 4183), (227, 4084), (232, 4128)]
         : compromised: 0.0553, honest: 0.0517
         : ubar stats = ['Node 0: s1=0.250, s2=0.750', 'Node 1: s1=0.300, s2=0.417', 'Node 2: s1=0.250, s2=0.562']...
Round 009: test acc mean=0.0546 ± 0.0131 | min=0.0407 max=0.0977
         : test loss mean=3.6785 ± 0.0167
         : individual accs = ['0.050145', '0.062099', '0.051213', '0.052850', '0.044977', '0.050618', '0.050799', '0.043918', '0.054402', '0.046528', '0.083514', '0.053899', '0.058637', '0.046938', '0.097730', '0.050633', '0.040693', '0.051159', '0.052155', '0.048207']
         : correct/total = [(207, 4128), (261, 4203), (209, 4081), (229, 4333), (184, 4091), (217, 4287), (213, 4193), (191, 4349), (228, 4191), (199, 4277), (346, 4143), (226, 4193), (240, 4093), (197, 4197), (396, 4052), (204, 4029), (169, 4153), (214, 4183), (213, 4084), (199, 4128)]
         : compromised: 0.0558, honest: 0.0516
         : ubar stats = ['Node 0: s1=0.250, s2=0.704', 'Node 1: s1=0.300, s2=0.407', 'Node 2: s1=0.250, s2=0.556']...
Round 010: test acc mean=0.0575 ± 0.0096 | min=0.0480 max=0.0959
         : test loss mean=3.6771 ± 0.0172
         : individual accs = ['0.059593', '0.051630', '0.057584', '0.052850', '0.057932', '0.050618', '0.049130', '0.058174', '0.047960', '0.053776', '0.055998', '0.095874', '0.058637', '0.062426', '0.061204', '0.056590', '0.058271', '0.050920', '0.055583', '0.055475']
         : correct/total = [(246, 4128), (217, 4203), (235, 4081), (229, 4333), (237, 4091), (217, 4287), (206, 4193), (253, 4349), (201, 4191), (230, 4277), (232, 4143), (402, 4193), (240, 4093), (262, 4197), (248, 4052), (228, 4029), (242, 4153), (213, 4183), (227, 4084), (229, 4128)]
         : compromised: 0.0576, honest: 0.0573
         : ubar stats = ['Node 0: s1=0.250, s2=0.733', 'Node 1: s1=0.300, s2=0.400', 'Node 2: s1=0.250, s2=0.550']...

=== FINAL RESULTS ===
Dataset: femnist, Nodes: 20, Graph: erdos, Aggregation: ubar
Attack: gaussian, 70.0% compromised
Final accuracy - Compromised: 0.0576, Honest: 0.0573
Overall test accuracy: mean=0.0575 ± 0.0096

=== UBAR SUMMARY ===
Node 0: stage1=0.250, stage2=0.733, overall=0.183
Node 1: stage1=0.300, stage2=0.400, overall=0.120
Node 2: stage1=0.250, stage2=0.550, overall=0.138
Node 3: stage1=0.286, stage2=0.700, overall=0.200
Node 4: stage1=0.222, stage2=0.650, overall=0.144
Node 5: stage1=0.300, stage2=0.467, overall=0.140
Node 6: stage1=0.250, stage2=0.500, overall=0.125
Node 7: stage1=0.273, stage2=0.733, overall=0.200
Node 8: stage1=0.286, stage2=0.500, overall=0.143
Node 9: stage1=0.273, stage2=0.400, overall=0.109
Node 10: stage1=0.250, stage2=0.500, overall=0.125
Node 11: stage1=0.250, stage2=0.600, overall=0.150
Node 12: stage1=0.250, stage2=0.500, overall=0.125
Node 13: stage1=0.222, stage2=0.500, overall=0.111
Node 14: stage1=0.286, stage2=0.475, overall=0.136
Node 15: stage1=0.222, stage2=0.700, overall=0.156
Node 16: stage1=0.286, stage2=0.550, overall=0.157
Node 17: stage1=0.250, stage2=0.600, overall=0.150
Node 18: stage1=0.250, stage2=0.700, overall=0.175
Node 19: stage1=0.300, stage2=0.567, overall=0.170

=== PARALLEL EXECUTION TIME (realistic for distributed system) ===
  COMMUNICATION (max across nodes):
    - Full model transfer: 0.000s (0.0%)
  COMPUTATION (max across nodes):
    - Distance computation: 0.052s (1.2%)
    - Loss computation: 4.209s (98.6%)
    - Aggregation: 0.008s (0.2%)
  TOTALS:
    - Total computation: 4.270s (100.0%)
    - Total communication: 0.000s (0.0%)
    - Total parallel time: 4.270s

=== PER-NODE AVERAGE TIME ===
  - Distance computation: 0.036s
  - Loss computation: 3.985s
  - Aggregation: 0.005s
  - Model transfer: 0.000s
  - Total per node: 4.026s

=== TOTAL COMPUTATIONAL WORK (sum across all nodes) ===
  - Total distance computation: 0.724s
  - Total loss computation: 79.705s
  - Total aggregation: 0.098s
  - Total model transfer: 0.000s
  - Grand total: 80.527s
  - Mean Stage 1 acceptance rate: 0.263
  - Mean Stage 2 acceptance rate: 0.566
  - Overall acceptance rate: 0.149

UBAR Algorithm Properties:
  - Model dimension: 6,603,710
  - Rho parameter: 0.30000000000000004
  - Two-stage approach: Distance filtering + loss evaluation
  - Stage 1 selects: 30% of neighbors
  - Stage 2 uses: Training sample loss comparison
  - Theoretical complexity: O(deg(i)×d + deg(i)×inference)
  - Approach: UBAR paper implementation
