Device: cuda
Seed: 987654321
Loading 36 LEAF FEMNIST train files...
LEAF FEMNIST train: 3597 users, 734463 samples
Loading 36 LEAF FEMNIST test files...
LEAF FEMNIST test: 3597 users, 83388 samples
Found 3597 train users, 3597 test users, 3597 common users
User sample counts range: 525 (max) to 17 (min)
Distributed ALL 3597 users across 20 clients
Users per client: 179 (with 17 clients getting +1 user)
Train partition sizes: [36360, 37070, 35957, 38262, 36024, 37732, 36921, 38328, 36867, 37683, 36507, 36915, 36007, 37001, 35681, 35453, 36585, 36801, 35964, 36345]
Test partition sizes: [4128, 4203, 4081, 4333, 4091, 4287, 4193, 4349, 4191, 4277, 4143, 4193, 4093, 4197, 4052, 4029, 4153, 4183, 4084, 4128]
  Client 0: 36360 train samples, 62 unique classes
  Client 1: 37070 train samples, 62 unique classes
  Client 2: 35957 train samples, 62 unique classes
  Client 3: 38262 train samples, 62 unique classes
  Client 4: 36024 train samples, 62 unique classes
  Client 5: 37732 train samples, 62 unique classes
  Client 6: 36921 train samples, 62 unique classes
  Client 7: 38328 train samples, 62 unique classes
  Client 8: 36867 train samples, 62 unique classes
  Client 9: 37683 train samples, 62 unique classes
  Client 10: 36507 train samples, 62 unique classes
  Client 11: 36915 train samples, 62 unique classes
  Client 12: 36007 train samples, 62 unique classes
  Client 13: 37001 train samples, 62 unique classes
  Client 14: 35681 train samples, 62 unique classes
  Client 15: 35453 train samples, 62 unique classes
  Client 16: 36585 train samples, 62 unique classes
  Client 17: 36801 train samples, 62 unique classes
  Client 18: 35964 train samples, 62 unique classes
  Client 19: 36345 train samples, 62 unique classes
Will sample 4500 samples per client per epoch
Graph: erdos, nodes: 20, edges: 99
Degree statistics: avg=9.90, min=7, max=14
Attack: Compromised 4/20 nodes: [5, 12, 13, 17]
Attack type: backdoor, lambda: 1.0
Backdoor target label: 0, trigger size: 4
Model variant: baseline
Model parameters: 6,603,710
Initial test acc across nodes: mean=0.0168 ± 0.0139
Backdoor attack: Created poisoned datasets for 4 compromised nodes
Round 001: test acc mean=0.0260 ± 0.0194 | min=0.0048 max=0.0576
         : test loss mean=992.6429 ± 1218.3509
         : individual accs = ['0.005329', '0.051630', '0.057584', '0.016155', '0.016133', '0.047352', '0.006916', '0.012187', '0.012169', '0.053776', '0.011827', '0.004770', '0.016858', '0.045509', '0.005429', '0.052122', '0.006261', '0.042314', '0.014691', '0.041667']
         : correct/total = [(22, 4128), (217, 4203), (235, 4081), (70, 4333), (66, 4091), (203, 4287), (29, 4193), (53, 4349), (51, 4191), (230, 4277), (49, 4143), (20, 4193), (69, 4093), (191, 4197), (22, 4052), (210, 4029), (26, 4153), (177, 4183), (60, 4084), (172, 4128)]
         : compromised: 0.0380, honest: 0.0230
Round 002: test acc mean=0.0182 ± 0.0209 | min=0.0024 max=0.0624
         : test loss mean=2538.2938 ± 8446.8138
         : individual accs = ['0.003391', '0.002379', '0.048272', '0.002769', '0.003667', '0.003266', '0.002623', '0.002529', '0.002863', '0.036708', '0.003379', '0.003816', '0.004398', '0.062426', '0.046644', '0.041698', '0.040693', '0.003586', '0.045788', '0.003634']
         : correct/total = [(14, 4128), (10, 4203), (197, 4081), (12, 4333), (15, 4091), (14, 4287), (11, 4193), (11, 4349), (12, 4191), (157, 4277), (14, 4143), (16, 4193), (18, 4093), (262, 4197), (189, 4052), (168, 4029), (169, 4153), (15, 4183), (187, 4084), (15, 4128)]
         : compromised: 0.0184, honest: 0.0182
Round 003: test acc mean=0.0505 ± 0.0057 | min=0.0420 max=0.0624
         : test loss mean=9.8436 ± 7.7266
         : individual accs = ['0.059593', '0.046158', '0.057584', '0.048234', '0.045710', '0.048752', '0.048891', '0.045528', '0.044619', '0.053776', '0.041999', '0.049606', '0.058637', '0.062426', '0.046397', '0.051378', '0.044546', '0.045900', '0.055583', '0.054506']
         : correct/total = [(246, 4128), (194, 4203), (235, 4081), (209, 4333), (187, 4091), (209, 4287), (205, 4193), (198, 4349), (187, 4191), (230, 4277), (174, 4143), (208, 4193), (240, 4093), (262, 4197), (188, 4052), (207, 4029), (185, 4153), (192, 4183), (227, 4084), (225, 4128)]
         : compromised: 0.0539, honest: 0.0496
Round 004: test acc mean=0.0500 ± 0.0037 | min=0.0430 max=0.0576
         : test loss mean=14.6920 ± 9.3899
         : individual accs = ['0.050145', '0.048775', '0.057584', '0.043157', '0.043021', '0.045253', '0.050799', '0.045068', '0.049630', '0.053776', '0.048033', '0.049606', '0.054239', '0.049083', '0.051826', '0.051626', '0.052011', '0.049486', '0.052889', '0.054506']
         : correct/total = [(207, 4128), (205, 4203), (235, 4081), (187, 4333), (176, 4091), (194, 4287), (213, 4193), (196, 4349), (208, 4191), (230, 4277), (199, 4143), (208, 4193), (222, 4093), (206, 4197), (210, 4052), (208, 4029), (216, 4153), (207, 4183), (216, 4084), (225, 4128)]
         : compromised: 0.0495, honest: 0.0502
Round 005: test acc mean=0.0491 ± 0.0063 | min=0.0344 max=0.0624
         : test loss mean=4.9400 ± 0.8799
         : individual accs = ['0.050145', '0.048775', '0.053418', '0.043157', '0.043021', '0.038955', '0.050799', '0.045068', '0.034359', '0.043488', '0.048033', '0.049606', '0.058637', '0.062426', '0.051826', '0.051626', '0.052011', '0.049486', '0.052889', '0.054506']
         : correct/total = [(207, 4128), (205, 4203), (218, 4081), (187, 4333), (176, 4091), (167, 4287), (213, 4193), (196, 4349), (144, 4191), (186, 4277), (199, 4143), (208, 4193), (240, 4093), (262, 4197), (210, 4052), (208, 4029), (216, 4153), (207, 4183), (216, 4084), (225, 4128)]
         : compromised: 0.0524, honest: 0.0483
Round 006: test acc mean=0.0444 ± 0.0051 | min=0.0291 max=0.0534
         : test loss mean=66.8836 ± 243.4473
         : individual accs = ['0.045785', '0.042589', '0.053418', '0.040157', '0.043266', '0.047352', '0.042213', '0.041619', '0.029110', '0.043488', '0.051171', '0.041736', '0.050818', '0.049559', '0.046644', '0.041698', '0.040693', '0.045900', '0.045788', '0.044331']
         : correct/total = [(189, 4128), (179, 4203), (218, 4081), (174, 4333), (177, 4091), (203, 4287), (177, 4193), (181, 4349), (122, 4191), (186, 4277), (212, 4143), (175, 4193), (208, 4093), (208, 4197), (189, 4052), (168, 4029), (169, 4153), (192, 4183), (187, 4084), (183, 4128)]
         : compromised: 0.0484, honest: 0.0434
Round 007: test acc mean=0.0480 ± 0.0042 | min=0.0365 max=0.0551
         : test loss mean=10.1237 ± 9.6291
         : individual accs = ['0.045785', '0.046158', '0.055134', '0.036464', '0.045710', '0.043387', '0.046745', '0.047827', '0.054880', '0.047463', '0.041999', '0.049606', '0.050818', '0.049559', '0.050346', '0.051378', '0.049362', '0.051159', '0.045788', '0.050872']
         : correct/total = [(189, 4128), (194, 4203), (225, 4081), (158, 4333), (187, 4091), (186, 4287), (196, 4193), (208, 4349), (230, 4191), (203, 4277), (174, 4143), (208, 4193), (208, 4093), (208, 4197), (204, 4052), (207, 4029), (205, 4153), (214, 4183), (187, 4084), (210, 4128)]
         : compromised: 0.0487, honest: 0.0478
Round 008: test acc mean=0.0472 ± 0.0056 | min=0.0303 max=0.0545
         : test loss mean=8.9769 ± 8.5772
         : individual accs = ['0.047238', '0.048775', '0.048763', '0.044773', '0.047421', '0.045253', '0.048891', '0.035640', '0.049630', '0.053776', '0.047309', '0.045314', '0.049597', '0.045747', '0.051826', '0.053860', '0.030340', '0.045900', '0.048482', '0.054506']
         : correct/total = [(195, 4128), (205, 4203), (199, 4081), (194, 4333), (194, 4091), (194, 4287), (205, 4193), (155, 4349), (208, 4191), (230, 4277), (196, 4143), (190, 4193), (203, 4093), (192, 4197), (210, 4052), (217, 4029), (126, 4153), (192, 4183), (198, 4084), (225, 4128)]
         : compromised: 0.0466, honest: 0.0473
Round 009: test acc mean=0.0491 ± 0.0032 | min=0.0430 max=0.0555
         : test loss mean=9.0332 ± 8.5789
         : individual accs = ['0.047238', '0.048775', '0.048272', '0.044773', '0.043021', '0.045253', '0.050799', '0.045068', '0.053209', '0.050503', '0.048033', '0.049606', '0.049597', '0.045747', '0.051826', '0.053860', '0.052011', '0.049486', '0.048482', '0.055475']
         : correct/total = [(195, 4128), (205, 4203), (197, 4081), (194, 4333), (176, 4091), (194, 4287), (213, 4193), (196, 4349), (223, 4191), (216, 4277), (199, 4143), (208, 4193), (203, 4093), (192, 4197), (210, 4052), (217, 4029), (216, 4153), (207, 4183), (198, 4084), (229, 4128)]
         : compromised: 0.0475, honest: 0.0494
Round 010: test acc mean=0.0494 ± 0.0055 | min=0.0407 max=0.0579
         : test loss mean=17.6742 ± 21.5239
         : individual accs = ['0.050145', '0.052344', '0.045087', '0.043157', '0.057932', '0.047352', '0.057000', '0.041619', '0.040802', '0.047697', '0.055998', '0.053899', '0.054239', '0.049083', '0.046644', '0.056590', '0.040693', '0.050920', '0.052889', '0.044331']
         : correct/total = [(207, 4128), (220, 4203), (184, 4081), (187, 4333), (237, 4091), (203, 4287), (239, 4193), (181, 4349), (171, 4191), (204, 4277), (232, 4143), (226, 4193), (222, 4093), (206, 4197), (189, 4052), (228, 4029), (169, 4153), (213, 4183), (216, 4084), (183, 4128)]
         : compromised: 0.0504, honest: 0.0492

=== FINAL RESULTS ===
Dataset: femnist, Nodes: 20, Graph: erdos, Aggregation: d-fedavg
Attack: backdoor, 20.0% compromised
Final accuracy - Compromised: 0.0504, Honest: 0.0492
Overall test accuracy: mean=0.0494 ± 0.0055

=== BACKDOOR ATTACK SUCCESS RATE (ASR) ===
Target label: 0
Trigger size: 4x4
Overall ASR: 0.2500 ± 0.4330
Honest nodes ASR: 0.1875 ± 0.3903
Compromised nodes ASR: 0.5000 ± 0.5000
Note: Higher ASR indicates more successful backdoor attack
