Device: cuda
Seed: 987654321
Loading 36 LEAF FEMNIST train files...
LEAF FEMNIST train: 3597 users, 734463 samples
Loading 36 LEAF FEMNIST test files...
LEAF FEMNIST test: 3597 users, 83388 samples
Found 3597 train users, 3597 test users, 3597 common users
User sample counts range: 525 (max) to 17 (min)
Distributed ALL 3597 users across 20 clients
Users per client: 179 (with 17 clients getting +1 user)
Train partition sizes: [36360, 37070, 35957, 38262, 36024, 37732, 36921, 38328, 36867, 37683, 36507, 36915, 36007, 37001, 35681, 35453, 36585, 36801, 35964, 36345]
Test partition sizes: [4128, 4203, 4081, 4333, 4091, 4287, 4193, 4349, 4191, 4277, 4143, 4193, 4093, 4197, 4052, 4029, 4153, 4183, 4084, 4128]
  Client 0: 36360 train samples, 62 unique classes
  Client 1: 37070 train samples, 62 unique classes
  Client 2: 35957 train samples, 62 unique classes
  Client 3: 38262 train samples, 62 unique classes
  Client 4: 36024 train samples, 62 unique classes
  Client 5: 37732 train samples, 62 unique classes
  Client 6: 36921 train samples, 62 unique classes
  Client 7: 38328 train samples, 62 unique classes
  Client 8: 36867 train samples, 62 unique classes
  Client 9: 37683 train samples, 62 unique classes
  Client 10: 36507 train samples, 62 unique classes
  Client 11: 36915 train samples, 62 unique classes
  Client 12: 36007 train samples, 62 unique classes
  Client 13: 37001 train samples, 62 unique classes
  Client 14: 35681 train samples, 62 unique classes
  Client 15: 35453 train samples, 62 unique classes
  Client 16: 36585 train samples, 62 unique classes
  Client 17: 36801 train samples, 62 unique classes
  Client 18: 35964 train samples, 62 unique classes
  Client 19: 36345 train samples, 62 unique classes
Will sample 4500 samples per client per epoch
Graph: ring, nodes: 20, edges: 20
Degree statistics: avg=2.00, min=2, max=2
Attack: Compromised 8/20 nodes: [1, 5, 11, 12, 13, 14, 17, 18]
Attack type: directed_deviation, lambda: 1.0
Model variant: baseline
Model parameters: 6,603,710
Initial test acc across nodes: mean=0.0168 ± 0.0139
Round 001: test acc mean=0.0297 ± 0.0177 | min=0.0045 max=0.0549
         : test loss mean=62958.2454 ± 150509.3766
         : individual accs = ['0.016715', '0.004521', '0.050723', '0.047773', '0.047421', '0.028691', '0.023372', '0.053116', '0.054880', '0.048398', '0.019792', '0.041736', '0.050574', '0.012152', '0.007651', '0.005709', '0.026005', '0.014583', '0.007591', '0.032219']
         : correct/total = [(69, 4128), (19, 4203), (207, 4081), (207, 4333), (194, 4091), (123, 4287), (98, 4193), (231, 4349), (230, 4191), (207, 4277), (82, 4143), (175, 4193), (207, 4093), (51, 4197), (31, 4052), (23, 4029), (108, 4153), (61, 4183), (31, 4084), (133, 4128)]
         : compromised: 0.0209, honest: 0.0355
Round 002: test acc mean=0.0431 ± 0.0060 | min=0.0323 max=0.0511
         : test loss mean=1499273407.9272 ± 3956694965.7313
         : individual accs = ['0.047238', '0.048775', '0.035531', '0.043157', '0.037644', '0.036856', '0.035535', '0.035640', '0.051062', '0.047463', '0.039585', '0.036728', '0.049841', '0.045747', '0.045656', '0.050385', '0.047195', '0.046139', '0.032321', '0.048692']
         : correct/total = [(195, 4128), (205, 4203), (145, 4081), (187, 4333), (154, 4091), (158, 4287), (149, 4193), (155, 4349), (214, 4191), (203, 4277), (164, 4143), (154, 4193), (204, 4093), (192, 4197), (185, 4052), (203, 4029), (196, 4153), (193, 4183), (132, 4084), (201, 4128)]
         : compromised: 0.0428, honest: 0.0433
Round 003: test acc mean=0.0429 ± 0.0125 | min=0.0023 max=0.0549
         : test loss mean=798667590.8636 ± 2588845190.7175
         : individual accs = ['0.044574', '0.048775', '0.053418', '0.052850', '0.052066', '0.038955', '0.033389', '0.002299', '0.042233', '0.026420', '0.045619', '0.046983', '0.033716', '0.028592', '0.045656', '0.054852', '0.054418', '0.051159', '0.050196', '0.050872']
         : correct/total = [(184, 4128), (205, 4203), (218, 4081), (229, 4333), (213, 4091), (167, 4287), (140, 4193), (10, 4349), (177, 4191), (113, 4277), (189, 4143), (197, 4193), (138, 4093), (120, 4197), (185, 4052), (221, 4029), (226, 4153), (214, 4183), (205, 4084), (210, 4128)]
         : compromised: 0.0430, honest: 0.0428
Round 004: test acc mean=0.0431 ± 0.0092 | min=0.0138 max=0.0521
         : test loss mean=23394911305.8253 ± 65901729331.2124
         : individual accs = ['0.045785', '0.051630', '0.045087', '0.048234', '0.052066', '0.038955', '0.033389', '0.041389', '0.013839', '0.050503', '0.045619', '0.046983', '0.033716', '0.028592', '0.046644', '0.050633', '0.051288', '0.048291', '0.045788', '0.044331']
         : correct/total = [(189, 4128), (217, 4203), (184, 4081), (209, 4333), (213, 4091), (167, 4287), (140, 4193), (180, 4349), (58, 4191), (216, 4277), (189, 4143), (197, 4193), (138, 4093), (120, 4197), (189, 4052), (204, 4029), (213, 4153), (202, 4183), (187, 4084), (183, 4128)]
         : compromised: 0.0426, honest: 0.0435
Round 005: test acc mean=0.0439 ± 0.0149 | min=0.0124 max=0.0612
         : test loss mean=218185262.1463 ± 529791504.8410
         : individual accs = ['0.012355', '0.051630', '0.050723', '0.048465', '0.057932', '0.057849', '0.018841', '0.018395', '0.042233', '0.053776', '0.048033', '0.053899', '0.049841', '0.045747', '0.061204', '0.053860', '0.044546', '0.050920', '0.045788', '0.012839']
         : correct/total = [(51, 4128), (217, 4203), (207, 4081), (210, 4333), (237, 4091), (248, 4287), (79, 4193), (80, 4349), (177, 4191), (230, 4277), (199, 4143), (226, 4193), (204, 4093), (192, 4197), (248, 4052), (217, 4029), (185, 4153), (213, 4183), (187, 4084), (53, 4128)]
         : compromised: 0.0521, honest: 0.0385
Round 006: test acc mean=0.0498 ± 0.0083 | min=0.0188 max=0.0612
         : test loss mean=35944909.3890 ± 107025306.7541
         : individual accs = ['0.049176', '0.047109', '0.050723', '0.047773', '0.051088', '0.050618', '0.018841', '0.049207', '0.042233', '0.053776', '0.055998', '0.053899', '0.049597', '0.045747', '0.061204', '0.056590', '0.058271', '0.050920', '0.052155', '0.050388']
         : correct/total = [(203, 4128), (198, 4203), (207, 4081), (207, 4333), (209, 4091), (217, 4287), (79, 4193), (214, 4349), (177, 4191), (230, 4277), (232, 4143), (226, 4193), (203, 4093), (192, 4197), (248, 4052), (228, 4029), (242, 4153), (213, 4183), (213, 4084), (208, 4128)]
         : compromised: 0.0514, honest: 0.0487
Round 007: test acc mean=0.0483 ± 0.0080 | min=0.0188 max=0.0582
         : test loss mean=2570715.7143 ± 5699095.9671
         : individual accs = ['0.051599', '0.051630', '0.055134', '0.048465', '0.044977', '0.057849', '0.018841', '0.058174', '0.042233', '0.048398', '0.048033', '0.053899', '0.049841', '0.045747', '0.046397', '0.053860', '0.044546', '0.045900', '0.052155', '0.048450']
         : correct/total = [(213, 4128), (217, 4203), (225, 4081), (210, 4333), (184, 4091), (248, 4287), (79, 4193), (253, 4349), (177, 4191), (207, 4277), (199, 4143), (226, 4193), (204, 4093), (192, 4197), (188, 4052), (217, 4029), (185, 4153), (192, 4183), (213, 4084), (200, 4128)]
         : compromised: 0.0504, honest: 0.0469
Round 008: test acc mean=0.0478 ± 0.0078 | min=0.0188 max=0.0560
         : test loss mean=155619.1671 ± 340615.9841
         : individual accs = ['0.050145', '0.047109', '0.050723', '0.047773', '0.051088', '0.038955', '0.018841', '0.049207', '0.049630', '0.053776', '0.055998', '0.053899', '0.053750', '0.046938', '0.046397', '0.053860', '0.044546', '0.045900', '0.052155', '0.045058']
         : correct/total = [(207, 4128), (198, 4203), (207, 4081), (207, 4333), (209, 4091), (167, 4287), (79, 4193), (214, 4349), (208, 4191), (230, 4277), (232, 4143), (226, 4193), (220, 4093), (197, 4197), (188, 4052), (217, 4029), (185, 4153), (192, 4183), (213, 4084), (186, 4128)]
         : compromised: 0.0481, honest: 0.0476
Round 009: test acc mean=0.0420 ± 0.0108 | min=0.0184 max=0.0582
         : test loss mean=218.2771 ± 338.9581
         : individual accs = ['0.047238', '0.051630', '0.055134', '0.048465', '0.044977', '0.018428', '0.033389', '0.058174', '0.040802', '0.047697', '0.048033', '0.053899', '0.033716', '0.028592', '0.032330', '0.026061', '0.030340', '0.039445', '0.052155', '0.048692']
         : correct/total = [(195, 4128), (217, 4203), (225, 4081), (210, 4333), (184, 4091), (79, 4287), (140, 4193), (253, 4349), (171, 4191), (204, 4277), (199, 4143), (226, 4193), (138, 4093), (120, 4197), (131, 4052), (105, 4029), (126, 4153), (165, 4183), (213, 4084), (201, 4128)]
         : compromised: 0.0388, honest: 0.0441
Round 010: test acc mean=0.0485 ± 0.0090 | min=0.0188 max=0.0612
         : test loss mean=398.0100 ± 1440.9408
         : individual accs = ['0.050145', '0.051630', '0.050723', '0.047773', '0.051088', '0.038955', '0.018841', '0.049207', '0.034359', '0.046528', '0.051653', '0.053899', '0.053750', '0.046938', '0.061204', '0.056590', '0.058271', '0.050920', '0.052889', '0.045058']
         : correct/total = [(207, 4128), (217, 4203), (207, 4081), (207, 4333), (209, 4091), (167, 4287), (79, 4193), (214, 4349), (144, 4191), (199, 4277), (214, 4143), (226, 4193), (220, 4093), (197, 4197), (248, 4052), (228, 4029), (242, 4153), (213, 4183), (216, 4084), (186, 4128)]
         : compromised: 0.0513, honest: 0.0467

=== FINAL RESULTS ===
Dataset: femnist, Nodes: 20, Graph: ring, Aggregation: d-fedavg
Attack: directed_deviation, 40.0% compromised
Final accuracy - Compromised: 0.0513, Honest: 0.0467
Overall test accuracy: mean=0.0485 ± 0.0090
