Device: cuda
Seed: 987654321
Loading 36 LEAF FEMNIST train files...
LEAF FEMNIST train: 3597 users, 734463 samples
Loading 36 LEAF FEMNIST test files...
LEAF FEMNIST test: 3597 users, 83388 samples
Found 3597 train users, 3597 test users, 3597 common users
User sample counts range: 525 (max) to 17 (min)
Distributed ALL 3597 users across 20 clients
Users per client: 179 (with 17 clients getting +1 user)
Train partition sizes: [36360, 37070, 35957, 38262, 36024, 37732, 36921, 38328, 36867, 37683, 36507, 36915, 36007, 37001, 35681, 35453, 36585, 36801, 35964, 36345]
Test partition sizes: [4128, 4203, 4081, 4333, 4091, 4287, 4193, 4349, 4191, 4277, 4143, 4193, 4093, 4197, 4052, 4029, 4153, 4183, 4084, 4128]
  Client 0: 36360 train samples, 62 unique classes
  Client 1: 37070 train samples, 62 unique classes
  Client 2: 35957 train samples, 62 unique classes
  Client 3: 38262 train samples, 62 unique classes
  Client 4: 36024 train samples, 62 unique classes
  Client 5: 37732 train samples, 62 unique classes
  Client 6: 36921 train samples, 62 unique classes
  Client 7: 38328 train samples, 62 unique classes
  Client 8: 36867 train samples, 62 unique classes
  Client 9: 37683 train samples, 62 unique classes
  Client 10: 36507 train samples, 62 unique classes
  Client 11: 36915 train samples, 62 unique classes
  Client 12: 36007 train samples, 62 unique classes
  Client 13: 37001 train samples, 62 unique classes
  Client 14: 35681 train samples, 62 unique classes
  Client 15: 35453 train samples, 62 unique classes
  Client 16: 36585 train samples, 62 unique classes
  Client 17: 36801 train samples, 62 unique classes
  Client 18: 35964 train samples, 62 unique classes
  Client 19: 36345 train samples, 62 unique classes
Will sample 4500 samples per client per epoch
Graph: erdos, nodes: 20, edges: 126
Degree statistics: avg=12.60, min=8, max=16
Attack: Compromised 8/20 nodes: [1, 5, 11, 12, 13, 14, 17, 18]
Attack type: backdoor, lambda: 1.0
Backdoor target label: 0, trigger size: 4
Model variant: baseline
Model parameters: 6,603,710
Initial test acc across nodes: mean=0.0168 ± 0.0139
Backdoor attack: Created poisoned datasets for 8 compromised nodes
Round 001: test acc mean=0.0488 ± 0.0142 | min=0.0072 max=0.0757
         : test loss mean=21644.7935 ± 90538.9476
         : individual accs = ['0.051599', '0.052344', '0.057584', '0.048465', '0.057932', '0.018428', '0.049130', '0.051276', '0.053209', '0.053776', '0.034033', '0.049606', '0.053750', '0.046462', '0.051826', '0.075701', '0.058271', '0.007172', '0.050930', '0.055475']
         : correct/total = [(213, 4128), (220, 4203), (235, 4081), (210, 4333), (237, 4091), (79, 4287), (206, 4193), (223, 4349), (223, 4191), (230, 4277), (141, 4143), (208, 4193), (220, 4093), (195, 4197), (210, 4052), (305, 4029), (242, 4153), (30, 4183), (208, 4084), (229, 4128)]
         : compromised: 0.0413, honest: 0.0539
Round 002: test acc mean=0.0465 ± 0.0129 | min=0.0167 max=0.0586
         : test loss mean=206786951.5418 ± 883053445.1925
         : individual accs = ['0.050145', '0.047109', '0.055134', '0.052850', '0.044977', '0.018428', '0.044598', '0.058174', '0.051539', '0.047463', '0.016896', '0.053899', '0.058637', '0.045747', '0.051579', '0.054852', '0.054418', '0.016734', '0.052155', '0.054748']
         : correct/total = [(207, 4128), (198, 4203), (225, 4081), (229, 4333), (184, 4091), (79, 4287), (187, 4193), (253, 4349), (216, 4191), (203, 4277), (70, 4143), (226, 4193), (240, 4093), (192, 4197), (209, 4052), (221, 4029), (226, 4153), (70, 4183), (213, 4084), (226, 4128)]
         : compromised: 0.0430, honest: 0.0488
Round 003: test acc mean=0.0533 ± 0.0091 | min=0.0418 max=0.0752
         : test loss mean=3891364701.0556 ± 15868177510.5128
         : individual accs = ['0.046027', '0.052344', '0.050723', '0.043388', '0.065021', '0.052484', '0.042452', '0.041849', '0.059174', '0.053776', '0.045619', '0.042690', '0.062301', '0.062426', '0.065893', '0.075205', '0.055141', '0.048291', '0.055828', '0.044816']
         : correct/total = [(190, 4128), (220, 4203), (207, 4081), (188, 4333), (266, 4091), (225, 4287), (178, 4193), (182, 4349), (248, 4191), (230, 4277), (189, 4143), (179, 4193), (255, 4093), (262, 4197), (267, 4052), (303, 4029), (229, 4153), (202, 4183), (228, 4084), (185, 4128)]
         : compromised: 0.0553, honest: 0.0519
Round 004: test acc mean=0.0637 ± 0.0311 | min=0.0281 max=0.1445
         : test loss mean=368694860.6775 ± 734998297.1266
         : individual accs = ['0.060078', '0.054247', '0.103896', '0.084468', '0.144463', '0.038955', '0.033389', '0.041389', '0.053925', '0.056348', '0.048033', '0.028142', '0.057659', '0.049559', '0.053307', '0.143460', '0.058753', '0.049486', '0.058031', '0.056202']
         : correct/total = [(248, 4128), (228, 4203), (424, 4081), (366, 4333), (591, 4091), (167, 4287), (140, 4193), (180, 4349), (226, 4191), (241, 4277), (199, 4143), (118, 4193), (236, 4093), (208, 4197), (216, 4052), (578, 4029), (244, 4153), (207, 4183), (237, 4084), (232, 4128)]
         : compromised: 0.0487, honest: 0.0737
Round 005: test acc mean=0.0745 ± 0.0316 | min=0.0434 max=0.1536
         : test loss mean=164197.2786 ± 705391.0662
         : individual accs = ['0.153585', '0.080419', '0.072776', '0.062312', '0.086287', '0.043387', '0.048891', '0.047827', '0.145311', '0.063830', '0.047550', '0.049606', '0.088932', '0.123898', '0.051579', '0.070489', '0.069829', '0.048291', '0.084721', '0.050872']
         : correct/total = [(634, 4128), (338, 4203), (297, 4081), (270, 4333), (353, 4091), (186, 4287), (205, 4193), (208, 4349), (609, 4191), (273, 4277), (197, 4143), (208, 4193), (364, 4093), (520, 4197), (209, 4052), (284, 4029), (290, 4153), (202, 4183), (346, 4084), (210, 4128)]
         : compromised: 0.0714, honest: 0.0766
Round 006: test acc mean=0.0933 ± 0.0505 | min=0.0476 max=0.1790
         : test loss mean=944674066.8199 ± 1285499014.4133
         : individual accs = ['0.051599', '0.151320', '0.131095', '0.047773', '0.159863', '0.048052', '0.048891', '0.047827', '0.178955', '0.147533', '0.047550', '0.049606', '0.053750', '0.131523', '0.048124', '0.157856', '0.156032', '0.048291', '0.111410', '0.048450']
         : correct/total = [(213, 4128), (636, 4203), (535, 4081), (207, 4333), (654, 4091), (206, 4287), (205, 4193), (208, 4349), (750, 4191), (631, 4277), (197, 4143), (208, 4193), (220, 4093), (552, 4197), (195, 4052), (636, 4029), (648, 4153), (202, 4183), (455, 4084), (200, 4128)]
         : compromised: 0.0803, honest: 0.1020
Round 007: test acc mean=0.0746 ± 0.0536 | min=0.0394 max=0.2147
         : test loss mean=4958.2741 ± 5629.6602
         : individual accs = ['0.059593', '0.052344', '0.056114', '0.047773', '0.057932', '0.050618', '0.057000', '0.053116', '0.043188', '0.180033', '0.039585', '0.054376', '0.058637', '0.214677', '0.061204', '0.056590', '0.047195', '0.039445', '0.206905', '0.055475']
         : correct/total = [(246, 4128), (220, 4203), (229, 4081), (207, 4333), (237, 4091), (217, 4287), (239, 4193), (231, 4349), (181, 4191), (770, 4277), (164, 4143), (228, 4193), (240, 4093), (901, 4197), (248, 4052), (228, 4029), (196, 4153), (165, 4183), (845, 4084), (229, 4128)]
         : compromised: 0.0923, honest: 0.0628
Round 008: test acc mean=0.0505 ± 0.0038 | min=0.0439 max=0.0578
         : test loss mean=1397.3194 ± 623.6603
         : individual accs = ['0.049176', '0.047109', '0.055134', '0.047773', '0.044977', '0.057849', '0.053899', '0.043918', '0.051539', '0.047463', '0.051653', '0.053184', '0.052040', '0.045747', '0.051579', '0.054852', '0.054418', '0.046139', '0.052155', '0.050388']
         : correct/total = [(203, 4128), (198, 4203), (225, 4081), (207, 4333), (184, 4091), (248, 4287), (226, 4193), (191, 4349), (216, 4191), (203, 4277), (214, 4143), (223, 4193), (213, 4093), (192, 4197), (209, 4052), (221, 4029), (226, 4153), (193, 4183), (213, 4084), (208, 4128)]
         : compromised: 0.0507, honest: 0.0504
Round 009: test acc mean=0.0504 ± 0.0037 | min=0.0439 max=0.0578
         : test loss mean=1212.4089 ± 344.8054
         : individual accs = ['0.049176', '0.047109', '0.055134', '0.047773', '0.044977', '0.057849', '0.053899', '0.043918', '0.051539', '0.047463', '0.051653', '0.053184', '0.049841', '0.045747', '0.051579', '0.054852', '0.054418', '0.046139', '0.052155', '0.050388']
         : correct/total = [(203, 4128), (198, 4203), (225, 4081), (207, 4333), (184, 4091), (248, 4287), (226, 4193), (191, 4349), (216, 4191), (203, 4277), (214, 4143), (223, 4193), (204, 4093), (192, 4197), (209, 4052), (221, 4029), (226, 4153), (193, 4183), (213, 4084), (208, 4128)]
         : compromised: 0.0505, honest: 0.0504
Round 010: test acc mean=0.0486 ± 0.0031 | min=0.0432 max=0.0561
         : test loss mean=842.9719 ± 443.4265
         : individual accs = ['0.048934', '0.048775', '0.056114', '0.044773', '0.048643', '0.048519', '0.048414', '0.051276', '0.043188', '0.047697', '0.051653', '0.046745', '0.048620', '0.049559', '0.047878', '0.050385', '0.047195', '0.046139', '0.054358', '0.043847']
         : correct/total = [(202, 4128), (205, 4203), (229, 4081), (194, 4333), (199, 4091), (208, 4287), (203, 4193), (223, 4349), (181, 4191), (204, 4277), (214, 4143), (196, 4193), (199, 4093), (208, 4197), (194, 4052), (203, 4029), (196, 4153), (193, 4183), (222, 4084), (181, 4128)]
         : compromised: 0.0488, honest: 0.0485

=== FINAL RESULTS ===
Dataset: femnist, Nodes: 20, Graph: erdos, Aggregation: krum
Attack: backdoor, 40.0% compromised
Final accuracy - Compromised: 0.0488, Honest: 0.0485
Overall test accuracy: mean=0.0486 ± 0.0031

=== BACKDOOR ATTACK SUCCESS RATE (ASR) ===
Target label: 0
Trigger size: 4x4
Overall ASR: 0.0000 ± 0.0000
Honest nodes ASR: 0.0000 ± 0.0000
Compromised nodes ASR: 0.0000 ± 0.0000
Note: Higher ASR indicates more successful backdoor attack
