Device: cuda
Seed: 987654321
Loading 36 LEAF FEMNIST train files...
LEAF FEMNIST train: 3597 users, 734463 samples
Loading 36 LEAF FEMNIST test files...
LEAF FEMNIST test: 3597 users, 83388 samples
Found 3597 train users, 3597 test users, 3597 common users
User sample counts range: 525 (max) to 17 (min)
Distributed ALL 3597 users across 20 clients
Users per client: 179 (with 17 clients getting +1 user)
Train partition sizes: [36360, 37070, 35957, 38262, 36024, 37732, 36921, 38328, 36867, 37683, 36507, 36915, 36007, 37001, 35681, 35453, 36585, 36801, 35964, 36345]
Test partition sizes: [4128, 4203, 4081, 4333, 4091, 4287, 4193, 4349, 4191, 4277, 4143, 4193, 4093, 4197, 4052, 4029, 4153, 4183, 4084, 4128]
  Client 0: 36360 train samples, 62 unique classes
  Client 1: 37070 train samples, 62 unique classes
  Client 2: 35957 train samples, 62 unique classes
  Client 3: 38262 train samples, 62 unique classes
  Client 4: 36024 train samples, 62 unique classes
  Client 5: 37732 train samples, 62 unique classes
  Client 6: 36921 train samples, 62 unique classes
  Client 7: 38328 train samples, 62 unique classes
  Client 8: 36867 train samples, 62 unique classes
  Client 9: 37683 train samples, 62 unique classes
  Client 10: 36507 train samples, 62 unique classes
  Client 11: 36915 train samples, 62 unique classes
  Client 12: 36007 train samples, 62 unique classes
  Client 13: 37001 train samples, 62 unique classes
  Client 14: 35681 train samples, 62 unique classes
  Client 15: 35453 train samples, 62 unique classes
  Client 16: 36585 train samples, 62 unique classes
  Client 17: 36801 train samples, 62 unique classes
  Client 18: 35964 train samples, 62 unique classes
  Client 19: 36345 train samples, 62 unique classes
Will sample 4500 samples per client per epoch
Graph: fully, nodes: 20, edges: 190
Degree statistics: avg=19.00, min=19, max=19
Attack: Compromised 14/20 nodes: [1, 2, 3, 5, 6, 8, 11, 12, 13, 14, 15, 17, 18, 19]
Attack type: backdoor, lambda: 1.0
Backdoor target label: 0, trigger size: 4
Model variant: baseline
Model parameters: 6,603,710
Initial test acc across nodes: mean=0.0168 ± 0.0139
Backdoor attack: Created poisoned datasets for 14 compromised nodes
Round 001: test acc mean=0.0178 ± 0.0146 | min=0.0019 max=0.0455
         : test loss mean=70513.7913 ± 20241.0885
         : individual accs = ['0.014050', '0.005948', '0.003921', '0.033003', '0.022244', '0.001866', '0.011448', '0.045528', '0.044619', '0.004910', '0.013034', '0.009540', '0.003420', '0.036455', '0.011846', '0.005957', '0.034433', '0.037533', '0.012977', '0.003876']
         : correct/total = [(58, 4128), (25, 4203), (16, 4081), (143, 4333), (91, 4091), (8, 4287), (48, 4193), (198, 4349), (187, 4191), (21, 4277), (54, 4143), (40, 4193), (14, 4093), (153, 4197), (48, 4052), (24, 4029), (143, 4153), (157, 4183), (53, 4084), (16, 4128)]
         : compromised: 0.0159, honest: 0.0224
Round 002: test acc mean=0.0447 ± 0.0037 | min=0.0365 max=0.0512
         : test loss mean=2840861.6823 ± 36190.5377
         : individual accs = ['0.045785', '0.042589', '0.048763', '0.036464', '0.043266', '0.047352', '0.042213', '0.041619', '0.040802', '0.046528', '0.051171', '0.041736', '0.050818', '0.049559', '0.046644', '0.041698', '0.040693', '0.045900', '0.045788', '0.044331']
         : correct/total = [(189, 4128), (179, 4203), (199, 4081), (158, 4333), (177, 4091), (203, 4287), (177, 4193), (181, 4349), (171, 4191), (199, 4277), (212, 4143), (175, 4193), (208, 4093), (208, 4197), (189, 4052), (168, 4029), (169, 4153), (192, 4183), (187, 4084), (183, 4128)]
         : compromised: 0.0446, honest: 0.0448
Round 003: test acc mean=0.0486 ± 0.0032 | min=0.0432 max=0.0561
         : test loss mean=110.6246 ± 3.0924
         : individual accs = ['0.048934', '0.050202', '0.056114', '0.043157', '0.048643', '0.048519', '0.048414', '0.051276', '0.043188', '0.047229', '0.051653', '0.046745', '0.048620', '0.049559', '0.047878', '0.050385', '0.047195', '0.046139', '0.054358', '0.043847']
         : correct/total = [(202, 4128), (211, 4203), (229, 4081), (187, 4333), (199, 4091), (208, 4287), (203, 4193), (223, 4349), (181, 4191), (202, 4277), (214, 4143), (196, 4193), (199, 4093), (208, 4197), (194, 4052), (203, 4029), (196, 4153), (193, 4183), (222, 4084), (181, 4128)]
         : compromised: 0.0484, honest: 0.0492
Round 004: test acc mean=0.0561 ± 0.0032 | min=0.0506 max=0.0624
         : test loss mean=49.0555 ± 1.2236
         : individual accs = ['0.059593', '0.052344', '0.057584', '0.052850', '0.057932', '0.050618', '0.057000', '0.058174', '0.053209', '0.053776', '0.055998', '0.053899', '0.058637', '0.062426', '0.061204', '0.056590', '0.058271', '0.050920', '0.055583', '0.055475']
         : correct/total = [(246, 4128), (220, 4203), (235, 4081), (229, 4333), (237, 4091), (217, 4287), (239, 4193), (253, 4349), (223, 4191), (230, 4277), (232, 4143), (226, 4193), (240, 4093), (262, 4197), (248, 4052), (228, 4029), (242, 4153), (213, 4183), (227, 4084), (229, 4128)]
         : compromised: 0.0556, honest: 0.0573
Round 005: test acc mean=0.0499 ± 0.0033 | min=0.0439 max=0.0553
         : test loss mean=37.7954 ± 0.6949
         : individual accs = ['0.049661', '0.050916', '0.054889', '0.046619', '0.052066', '0.045953', '0.043883', '0.053116', '0.051062', '0.044891', '0.047550', '0.054376', '0.052040', '0.055278', '0.045656', '0.050881', '0.051047', '0.048291', '0.050196', '0.050145']
         : correct/total = [(205, 4128), (214, 4203), (224, 4081), (202, 4333), (213, 4091), (197, 4287), (184, 4193), (231, 4349), (214, 4191), (192, 4277), (197, 4143), (228, 4193), (213, 4093), (232, 4197), (185, 4052), (205, 4029), (212, 4153), (202, 4183), (205, 4084), (207, 4128)]
         : compromised: 0.0500, honest: 0.0497
Round 006: test acc mean=0.0561 ± 0.0032 | min=0.0506 max=0.0624
         : test loss mean=5.6865 ± 0.0450
         : individual accs = ['0.059593', '0.052344', '0.057584', '0.052850', '0.057932', '0.050618', '0.057000', '0.058174', '0.053209', '0.053776', '0.055998', '0.053899', '0.058637', '0.062426', '0.061204', '0.056590', '0.058271', '0.050920', '0.055583', '0.055475']
         : correct/total = [(246, 4128), (220, 4203), (235, 4081), (229, 4333), (237, 4091), (217, 4287), (239, 4193), (253, 4349), (223, 4191), (230, 4277), (232, 4143), (226, 4193), (240, 4093), (262, 4197), (248, 4052), (228, 4029), (242, 4153), (213, 4183), (227, 4084), (229, 4128)]
         : compromised: 0.0556, honest: 0.0573
Round 007: test acc mean=0.0037 ± 0.0008 | min=0.0018 max=0.0058
         : test loss mean=4.5885 ± 0.0154
         : individual accs = ['0.003876', '0.003569', '0.003676', '0.003923', '0.004155', '0.003732', '0.003100', '0.001840', '0.003579', '0.003273', '0.005793', '0.004054', '0.002932', '0.003336', '0.004936', '0.004219', '0.003612', '0.004064', '0.003918', '0.002907']
         : correct/total = [(16, 4128), (15, 4203), (15, 4081), (17, 4333), (17, 4091), (16, 4287), (13, 4193), (8, 4349), (15, 4191), (14, 4277), (24, 4143), (17, 4193), (12, 4093), (14, 4197), (20, 4052), (17, 4029), (15, 4153), (17, 4183), (16, 4084), (12, 4128)]
         : compromised: 0.0037, honest: 0.0038
Round 008: test acc mean=0.0483 ± 0.0108 | min=0.0037 max=0.0553
         : test loss mean=4.6883 ± 0.0216
         : individual accs = ['0.049176', '0.047109', '0.055134', '0.047773', '0.044977', '0.003732', '0.053899', '0.043918', '0.051539', '0.047463', '0.055274', '0.053184', '0.049841', '0.045747', '0.051579', '0.054852', '0.054418', '0.053311', '0.052155', '0.050388']
         : correct/total = [(203, 4128), (198, 4203), (225, 4081), (207, 4333), (184, 4091), (16, 4287), (226, 4193), (191, 4349), (216, 4191), (203, 4277), (229, 4143), (223, 4193), (204, 4093), (192, 4197), (209, 4052), (221, 4029), (226, 4153), (223, 4183), (213, 4084), (208, 4128)]
         : compromised: 0.0479, honest: 0.0492
Round 009: test acc mean=0.0561 ± 0.0032 | min=0.0506 max=0.0624
         : test loss mean=30.3997 ± 0.5914
         : individual accs = ['0.059593', '0.052344', '0.057584', '0.052850', '0.057932', '0.050618', '0.057000', '0.058174', '0.053209', '0.053776', '0.055998', '0.053899', '0.058637', '0.062426', '0.061204', '0.056590', '0.058271', '0.050920', '0.055583', '0.055475']
         : correct/total = [(246, 4128), (220, 4203), (235, 4081), (229, 4333), (237, 4091), (217, 4287), (239, 4193), (253, 4349), (223, 4191), (230, 4277), (232, 4143), (226, 4193), (240, 4093), (262, 4197), (248, 4052), (228, 4029), (242, 4153), (213, 4183), (227, 4084), (229, 4128)]
         : compromised: 0.0556, honest: 0.0573
Round 010: test acc mean=0.0510 ± 0.0038 | min=0.0439 max=0.0578
         : test loss mean=5.0091 ± 0.0237
         : individual accs = ['0.049176', '0.047109', '0.055134', '0.047773', '0.044977', '0.057849', '0.053899', '0.043918', '0.051539', '0.047463', '0.055274', '0.053184', '0.049841', '0.045747', '0.051579', '0.054852', '0.054418', '0.053311', '0.052155', '0.050388']
         : correct/total = [(203, 4128), (198, 4203), (225, 4081), (207, 4333), (184, 4091), (248, 4287), (226, 4193), (191, 4349), (216, 4191), (203, 4277), (229, 4143), (223, 4193), (204, 4093), (192, 4197), (209, 4052), (221, 4029), (226, 4153), (223, 4183), (213, 4084), (208, 4128)]
         : compromised: 0.0517, honest: 0.0492

=== FINAL RESULTS ===
Dataset: femnist, Nodes: 20, Graph: fully, Aggregation: krum
Attack: backdoor, 70.0% compromised
Final accuracy - Compromised: 0.0517, Honest: 0.0492
Overall test accuracy: mean=0.0510 ± 0.0038

=== BACKDOOR ATTACK SUCCESS RATE (ASR) ===
Target label: 0
Trigger size: 4x4
Overall ASR: 0.0000 ± 0.0000
Honest nodes ASR: 0.0000 ± 0.0000
Compromised nodes ASR: 0.0000 ± 0.0000
Note: Higher ASR indicates more successful backdoor attack
