Device: cuda
Seed: 987654321
Loading 36 LEAF FEMNIST train files...
LEAF FEMNIST train: 3597 users, 734463 samples
Loading 36 LEAF FEMNIST test files...
LEAF FEMNIST test: 3597 users, 83388 samples
Found 3597 train users, 3597 test users, 3597 common users
User sample counts range: 525 (max) to 17 (min)
Distributed ALL 3597 users across 20 clients
Users per client: 179 (with 17 clients getting +1 user)
Train partition sizes: [36360, 37070, 35957, 38262, 36024, 37732, 36921, 38328, 36867, 37683, 36507, 36915, 36007, 37001, 35681, 35453, 36585, 36801, 35964, 36345]
Test partition sizes: [4128, 4203, 4081, 4333, 4091, 4287, 4193, 4349, 4191, 4277, 4143, 4193, 4093, 4197, 4052, 4029, 4153, 4183, 4084, 4128]
  Client 0: 36360 train samples, 62 unique classes
  Client 1: 37070 train samples, 62 unique classes
  Client 2: 35957 train samples, 62 unique classes
  Client 3: 38262 train samples, 62 unique classes
  Client 4: 36024 train samples, 62 unique classes
  Client 5: 37732 train samples, 62 unique classes
  Client 6: 36921 train samples, 62 unique classes
  Client 7: 38328 train samples, 62 unique classes
  Client 8: 36867 train samples, 62 unique classes
  Client 9: 37683 train samples, 62 unique classes
  Client 10: 36507 train samples, 62 unique classes
  Client 11: 36915 train samples, 62 unique classes
  Client 12: 36007 train samples, 62 unique classes
  Client 13: 37001 train samples, 62 unique classes
  Client 14: 35681 train samples, 62 unique classes
  Client 15: 35453 train samples, 62 unique classes
  Client 16: 36585 train samples, 62 unique classes
  Client 17: 36801 train samples, 62 unique classes
  Client 18: 35964 train samples, 62 unique classes
  Client 19: 36345 train samples, 62 unique classes
Will sample 4500 samples per client per epoch
Graph: ring, nodes: 20, edges: 20
Degree statistics: avg=2.00, min=2, max=2
Attack: Compromised 14/20 nodes: [1, 2, 3, 5, 6, 8, 11, 12, 13, 14, 15, 17, 18, 19]
Attack type: directed_deviation, lambda: 1.0
Model variant: baseline
Model parameters: 6,603,710
UBAR ALGORITHM (Two-Stage Byzantine-resilient)
  - Model dimension: 6,603,710 parameters
  - Rho parameter: 0.30000000000000004
  - Stage 1: Distance-based filtering (select 30% closest neighbors)
  - Stage 2: Performance-based selection (loss comparison)
  - Complexity: O(deg(i)×d + deg(i)×inference)
Initial test acc across nodes: mean=0.0168 ± 0.0139
Round 001: test acc mean=0.0373 ± 0.0206 | min=0.0022 max=0.0608
         : test loss mean=9310.8370 ± 10884.2202
         : individual accs = ['0.009690', '0.052344', '0.025729', '0.043157', '0.052799', '0.057849', '0.044598', '0.058174', '0.047960', '0.047463', '0.055274', '0.060816', '0.006841', '0.017632', '0.005429', '0.050385', '0.002167', '0.050920', '0.006121', '0.050145']
         : correct/total = [(40, 4128), (220, 4203), (105, 4081), (187, 4333), (216, 4091), (248, 4287), (187, 4193), (253, 4349), (201, 4191), (203, 4277), (229, 4143), (255, 4193), (28, 4093), (74, 4197), (22, 4052), (203, 4029), (9, 4153), (213, 4183), (25, 4084), (207, 4128)]
         : compromised: 0.0371, honest: 0.0376
         : ubar stats = ['Node 0: s1=0.500, s2=1.000', 'Node 1: s1=0.500, s2=1.000', 'Node 2: s1=0.500, s2=1.000']...
Round 002: test acc mean=0.0475 ± 0.0075 | min=0.0217 max=0.0561
         : test loss mean=363.6815 ± 413.5731
         : individual accs = ['0.048934', '0.051630', '0.056114', '0.052850', '0.048643', '0.050618', '0.043883', '0.051276', '0.051062', '0.048398', '0.045619', '0.046983', '0.048620', '0.049559', '0.021718', '0.050881', '0.047195', '0.048291', '0.032321', '0.054506']
         : correct/total = [(202, 4128), (217, 4203), (229, 4081), (229, 4333), (199, 4091), (217, 4287), (184, 4193), (223, 4349), (214, 4191), (207, 4277), (189, 4143), (197, 4193), (199, 4093), (208, 4197), (88, 4052), (205, 4029), (196, 4153), (202, 4183), (132, 4084), (225, 4128)]
         : compromised: 0.0471, honest: 0.0483
         : ubar stats = ['Node 0: s1=0.500, s2=1.000', 'Node 1: s1=0.500, s2=1.000', 'Node 2: s1=0.500, s2=1.000']...
Round 003: test acc mean=0.0469 ± 0.0065 | min=0.0323 max=0.0561
         : test loss mean=244.6602 ± 290.7562
         : individual accs = ['0.048934', '0.042589', '0.056114', '0.043157', '0.037644', '0.048519', '0.048891', '0.051276', '0.051539', '0.047463', '0.055274', '0.053184', '0.048620', '0.049559', '0.032330', '0.053860', '0.047195', '0.045900', '0.032321', '0.044331']
         : correct/total = [(202, 4128), (179, 4203), (229, 4081), (187, 4333), (154, 4091), (208, 4287), (205, 4193), (223, 4349), (216, 4191), (203, 4277), (229, 4143), (223, 4193), (199, 4093), (208, 4197), (131, 4052), (217, 4029), (196, 4153), (192, 4183), (132, 4084), (183, 4128)]
         : compromised: 0.0465, honest: 0.0480
         : ubar stats = ['Node 0: s1=0.500, s2=1.000', 'Node 1: s1=0.500, s2=1.000', 'Node 2: s1=0.500, s2=1.000']...
Round 004: test acc mean=0.0400 ± 0.0146 | min=0.0131 max=0.0561
         : test loss mean=141.8786 ± 152.4415
         : individual accs = ['0.048934', '0.051630', '0.056114', '0.015232', '0.048643', '0.013063', '0.018841', '0.051276', '0.049630', '0.048398', '0.045619', '0.046983', '0.048620', '0.049559', '0.047878', '0.014892', '0.047195', '0.016734', '0.032321', '0.048450']
         : correct/total = [(202, 4128), (217, 4203), (229, 4081), (66, 4333), (199, 4091), (56, 4287), (79, 4193), (223, 4349), (208, 4191), (207, 4277), (189, 4143), (197, 4193), (199, 4093), (208, 4197), (194, 4052), (60, 4029), (196, 4153), (70, 4183), (132, 4084), (200, 4128)]
         : compromised: 0.0364, honest: 0.0483
         : ubar stats = ['Node 0: s1=0.500, s2=1.000', 'Node 1: s1=0.500, s2=1.000', 'Node 2: s1=0.500, s2=1.000']...
Round 005: test acc mean=0.0500 ± 0.0190 | min=0.0117 max=0.1172
         : test loss mean=32.8300 ± 32.0043
         : individual accs = ['0.048934', '0.048775', '0.056114', '0.033003', '0.048643', '0.034756', '0.053899', '0.051276', '0.117156', '0.053776', '0.055998', '0.061054', '0.048620', '0.049559', '0.047878', '0.028295', '0.047195', '0.011714', '0.054358', '0.048692']
         : correct/total = [(202, 4128), (205, 4203), (229, 4081), (143, 4333), (199, 4091), (149, 4287), (226, 4193), (223, 4349), (491, 4191), (230, 4277), (232, 4143), (256, 4193), (199, 4093), (208, 4197), (194, 4052), (114, 4029), (196, 4153), (49, 4183), (222, 4084), (201, 4128)]
         : compromised: 0.0496, honest: 0.0510
         : ubar stats = ['Node 0: s1=0.500, s2=1.000', 'Node 1: s1=0.500, s2=1.000', 'Node 2: s1=0.500, s2=1.000']...
Round 006: test acc mean=0.0546 ± 0.0122 | min=0.0430 max=0.0910
         : test loss mean=18.7683 ± 16.4441
         : individual accs = ['0.050145', '0.050916', '0.056114', '0.044773', '0.043021', '0.048752', '0.048891', '0.045068', '0.053686', '0.090952', '0.086894', '0.061770', '0.054239', '0.049083', '0.051826', '0.053860', '0.052011', '0.045900', '0.054358', '0.050145']
         : correct/total = [(207, 4128), (214, 4203), (229, 4081), (194, 4333), (176, 4091), (209, 4287), (205, 4193), (196, 4349), (225, 4191), (389, 4277), (360, 4143), (259, 4193), (222, 4093), (206, 4197), (210, 4052), (217, 4029), (216, 4153), (192, 4183), (222, 4084), (207, 4128)]
         : compromised: 0.0517, honest: 0.0613
         : ubar stats = ['Node 0: s1=0.500, s2=1.000', 'Node 1: s1=0.500, s2=1.000', 'Node 2: s1=0.500, s2=1.000']...
Round 007: test acc mean=0.0513 ± 0.0050 | min=0.0430 max=0.0632
         : test loss mean=8.2998 ± 4.8553
         : individual accs = ['0.050145', '0.048775', '0.056114', '0.044773', '0.043021', '0.048752', '0.048891', '0.045068', '0.054880', '0.060556', '0.063239', '0.053899', '0.054239', '0.049083', '0.051826', '0.053860', '0.052011', '0.045900', '0.052889', '0.048692']
         : correct/total = [(207, 4128), (205, 4203), (229, 4081), (194, 4333), (176, 4091), (209, 4287), (205, 4193), (196, 4349), (230, 4191), (259, 4277), (262, 4143), (226, 4193), (222, 4093), (206, 4197), (210, 4052), (217, 4029), (216, 4153), (192, 4183), (216, 4084), (201, 4128)]
         : compromised: 0.0509, honest: 0.0523
         : ubar stats = ['Node 0: s1=0.500, s2=1.000', 'Node 1: s1=0.500, s2=1.000', 'Node 2: s1=0.500, s2=1.000']...
Round 008: test acc mean=0.0548 ± 0.0132 | min=0.0439 max=0.0990
         : test loss mean=11.7587 ± 8.7165
         : individual accs = ['0.048934', '0.050916', '0.056114', '0.044773', '0.048643', '0.048752', '0.043883', '0.051276', '0.099022', '0.073884', '0.077963', '0.054615', '0.048620', '0.049559', '0.047878', '0.050881', '0.047195', '0.048291', '0.054358', '0.050145']
         : correct/total = [(202, 4128), (214, 4203), (229, 4081), (194, 4333), (199, 4091), (209, 4287), (184, 4193), (223, 4349), (415, 4191), (316, 4277), (323, 4143), (229, 4193), (199, 4093), (208, 4197), (194, 4052), (205, 4029), (196, 4153), (202, 4183), (222, 4084), (207, 4128)]
         : compromised: 0.0534, honest: 0.0580
         : ubar stats = ['Node 0: s1=0.500, s2=1.000', 'Node 1: s1=0.500, s2=1.000', 'Node 2: s1=0.500, s2=1.000']...
Round 009: test acc mean=0.0535 ± 0.0124 | min=0.0448 max=0.1047
         : test loss mean=7.0578 ± 3.5170
         : individual accs = ['0.048934', '0.048775', '0.056114', '0.044773', '0.048643', '0.048752', '0.048891', '0.051276', '0.104748', '0.057751', '0.056481', '0.058908', '0.048620', '0.049559', '0.047878', '0.053860', '0.047195', '0.045900', '0.054358', '0.048692']
         : correct/total = [(202, 4128), (205, 4203), (229, 4081), (194, 4333), (199, 4091), (209, 4287), (205, 4193), (223, 4349), (439, 4191), (247, 4277), (234, 4143), (247, 4193), (199, 4093), (208, 4197), (194, 4052), (217, 4029), (196, 4153), (192, 4183), (222, 4084), (201, 4128)]
         : compromised: 0.0543, honest: 0.0517
         : ubar stats = ['Node 0: s1=0.500, s2=1.000', 'Node 1: s1=0.500, s2=1.000', 'Node 2: s1=0.500, s2=1.000']...
Round 010: test acc mean=0.0524 ± 0.0099 | min=0.0439 max=0.0928
         : test loss mean=10.6324 ± 7.5083
         : individual accs = ['0.048934', '0.050916', '0.056114', '0.046619', '0.048643', '0.045953', '0.043883', '0.051276', '0.055357', '0.053776', '0.055998', '0.092774', '0.048620', '0.049559', '0.047878', '0.050881', '0.047195', '0.048291', '0.054358', '0.050145']
         : correct/total = [(202, 4128), (214, 4203), (229, 4081), (202, 4333), (199, 4091), (197, 4287), (184, 4193), (223, 4349), (232, 4191), (230, 4277), (232, 4143), (389, 4193), (199, 4093), (208, 4197), (194, 4052), (205, 4029), (196, 4153), (202, 4183), (222, 4084), (207, 4128)]
         : compromised: 0.0530, honest: 0.0510
         : ubar stats = ['Node 0: s1=0.500, s2=1.000', 'Node 1: s1=0.500, s2=1.000', 'Node 2: s1=0.500, s2=1.000']...

=== FINAL RESULTS ===
Dataset: femnist, Nodes: 20, Graph: ring, Aggregation: ubar
Attack: directed_deviation, 70.0% compromised
Final accuracy - Compromised: 0.0530, Honest: 0.0510
Overall test accuracy: mean=0.0524 ± 0.0099

=== UBAR SUMMARY ===
Node 0: stage1=0.500, stage2=1.000, overall=0.500
Node 1: stage1=0.500, stage2=1.000, overall=0.500
Node 2: stage1=0.500, stage2=1.000, overall=0.500
Node 3: stage1=0.500, stage2=1.000, overall=0.500
Node 4: stage1=0.500, stage2=1.000, overall=0.500
Node 5: stage1=0.500, stage2=1.000, overall=0.500
Node 6: stage1=0.500, stage2=1.000, overall=0.500
Node 7: stage1=0.500, stage2=1.000, overall=0.500
Node 8: stage1=0.500, stage2=1.000, overall=0.500
Node 9: stage1=0.500, stage2=1.000, overall=0.500
Node 10: stage1=0.500, stage2=1.000, overall=0.500
Node 11: stage1=0.500, stage2=1.000, overall=0.500
Node 12: stage1=0.500, stage2=1.000, overall=0.500
Node 13: stage1=0.500, stage2=1.000, overall=0.500
Node 14: stage1=0.500, stage2=1.000, overall=0.500
Node 15: stage1=0.500, stage2=1.000, overall=0.500
Node 16: stage1=0.500, stage2=1.000, overall=0.500
Node 17: stage1=0.500, stage2=1.000, overall=0.500
Node 18: stage1=0.500, stage2=1.000, overall=0.500
Node 19: stage1=0.500, stage2=1.000, overall=0.500

=== PARALLEL EXECUTION TIME (realistic for distributed system) ===
  COMMUNICATION (max across nodes):
    - Full model transfer: 0.000s (0.0%)
  COMPUTATION (max across nodes):
    - Distance computation: 0.030s (0.7%)
    - Loss computation: 4.080s (99.1%)
    - Aggregation: 0.006s (0.1%)
  TOTALS:
    - Total computation: 4.116s (100.0%)
    - Total communication: 0.000s (0.0%)
    - Total parallel time: 4.116s

=== PER-NODE AVERAGE TIME ===
  - Distance computation: 0.021s
  - Loss computation: 3.855s
  - Aggregation: 0.005s
  - Model transfer: 0.000s
  - Total per node: 3.880s

=== TOTAL COMPUTATIONAL WORK (sum across all nodes) ===
  - Total distance computation: 0.416s
  - Total loss computation: 77.091s
  - Total aggregation: 0.091s
  - Total model transfer: 0.000s
  - Grand total: 77.598s
  - Mean Stage 1 acceptance rate: 0.500
  - Mean Stage 2 acceptance rate: 1.000
  - Overall acceptance rate: 0.500

UBAR Algorithm Properties:
  - Model dimension: 6,603,710
  - Rho parameter: 0.30000000000000004
  - Two-stage approach: Distance filtering + loss evaluation
  - Stage 1 selects: 30% of neighbors
  - Stage 2 uses: Training sample loss comparison
  - Theoretical complexity: O(deg(i)×d + deg(i)×inference)
  - Approach: UBAR paper implementation
