Device: cuda
Seed: 987654321
Loading 36 LEAF FEMNIST train files...
LEAF FEMNIST train: 3597 users, 734463 samples
Loading 36 LEAF FEMNIST test files...
LEAF FEMNIST test: 3597 users, 83388 samples
Found 3597 train users, 3597 test users, 3597 common users
User sample counts range: 525 (max) to 17 (min)
Distributed ALL 3597 users across 20 clients
Users per client: 179 (with 17 clients getting +1 user)
Train partition sizes: [36360, 37070, 35957, 38262, 36024, 37732, 36921, 38328, 36867, 37683, 36507, 36915, 36007, 37001, 35681, 35453, 36585, 36801, 35964, 36345]
Test partition sizes: [4128, 4203, 4081, 4333, 4091, 4287, 4193, 4349, 4191, 4277, 4143, 4193, 4093, 4197, 4052, 4029, 4153, 4183, 4084, 4128]
  Client 0: 36360 train samples, 62 unique classes
  Client 1: 37070 train samples, 62 unique classes
  Client 2: 35957 train samples, 62 unique classes
  Client 3: 38262 train samples, 62 unique classes
  Client 4: 36024 train samples, 62 unique classes
  Client 5: 37732 train samples, 62 unique classes
  Client 6: 36921 train samples, 62 unique classes
  Client 7: 38328 train samples, 62 unique classes
  Client 8: 36867 train samples, 62 unique classes
  Client 9: 37683 train samples, 62 unique classes
  Client 10: 36507 train samples, 62 unique classes
  Client 11: 36915 train samples, 62 unique classes
  Client 12: 36007 train samples, 62 unique classes
  Client 13: 37001 train samples, 62 unique classes
  Client 14: 35681 train samples, 62 unique classes
  Client 15: 35453 train samples, 62 unique classes
  Client 16: 36585 train samples, 62 unique classes
  Client 17: 36801 train samples, 62 unique classes
  Client 18: 35964 train samples, 62 unique classes
  Client 19: 36345 train samples, 62 unique classes
Will sample 4500 samples per client per epoch
Graph: erdos, nodes: 20, edges: 48
Degree statistics: avg=4.80, min=2, max=7
Attack: Compromised 4/20 nodes: [5, 12, 13, 17]
Attack type: directed_deviation, lambda: 1.0
Model variant: baseline
Model parameters: 6,603,710
Initial test acc across nodes: mean=0.0168 ± 0.0139
Round 001: test acc mean=0.0358 ± 0.0204 | min=0.0032 max=0.0621
         : test loss mean=2951.0001 ± 5803.8673
         : individual accs = ['0.040698', '0.052344', '0.054889', '0.003231', '0.062088', '0.045953', '0.019795', '0.041619', '0.053209', '0.053776', '0.045619', '0.012879', '0.012460', '0.011198', '0.061204', '0.013899', '0.006742', '0.015300', '0.055583', '0.054506']
         : correct/total = [(168, 4128), (220, 4203), (224, 4081), (14, 4333), (254, 4091), (197, 4287), (83, 4193), (181, 4349), (223, 4191), (230, 4277), (189, 4143), (54, 4193), (51, 4093), (47, 4197), (248, 4052), (56, 4029), (28, 4153), (64, 4183), (227, 4084), (225, 4128)]
         : compromised: 0.0212, honest: 0.0395
Round 002: test acc mean=0.0401 ± 0.0135 | min=0.0198 max=0.0555
         : test loss mean=53914.6169 ± 145234.8267
         : individual accs = ['0.020349', '0.049726', '0.045087', '0.024694', '0.020777', '0.048752', '0.019795', '0.025063', '0.043188', '0.047697', '0.019792', '0.025042', '0.049597', '0.049083', '0.051826', '0.053860', '0.052011', '0.049486', '0.051665', '0.055475']
         : correct/total = [(84, 4128), (209, 4203), (184, 4081), (107, 4333), (85, 4091), (209, 4287), (83, 4193), (109, 4349), (181, 4191), (204, 4277), (82, 4143), (105, 4193), (203, 4093), (206, 4197), (210, 4052), (217, 4029), (216, 4153), (207, 4183), (211, 4084), (229, 4128)]
         : compromised: 0.0492, honest: 0.0379
Round 003: test acc mean=0.0468 ± 0.0058 | min=0.0347 max=0.0545
         : test loss mean=516.1690 ± 2080.3897
         : individual accs = ['0.050145', '0.034737', '0.052683', '0.040157', '0.048643', '0.038955', '0.044598', '0.049207', '0.042233', '0.039280', '0.036688', '0.046745', '0.050574', '0.049083', '0.051826', '0.051626', '0.051288', '0.049486', '0.052889', '0.054506']
         : correct/total = [(207, 4128), (146, 4203), (215, 4081), (174, 4333), (199, 4091), (167, 4287), (187, 4193), (214, 4349), (177, 4191), (168, 4277), (152, 4143), (196, 4193), (207, 4093), (206, 4197), (210, 4052), (208, 4029), (213, 4153), (207, 4183), (216, 4084), (225, 4128)]
         : compromised: 0.0470, honest: 0.0467
Round 004: test acc mean=0.0441 ± 0.0083 | min=0.0250 max=0.0531
         : test loss mean=20.7452 ± 30.8106
         : individual accs = ['0.050145', '0.051630', '0.024994', '0.040157', '0.043021', '0.048752', '0.033389', '0.045068', '0.047960', '0.053075', '0.048033', '0.028142', '0.050574', '0.028592', '0.047631', '0.050633', '0.044546', '0.048291', '0.051665', '0.045058']
         : correct/total = [(207, 4128), (217, 4203), (102, 4081), (174, 4333), (176, 4091), (209, 4287), (140, 4193), (196, 4349), (201, 4191), (227, 4277), (199, 4143), (118, 4193), (207, 4093), (120, 4197), (193, 4052), (204, 4029), (185, 4153), (202, 4183), (211, 4084), (186, 4128)]
         : compromised: 0.0441, honest: 0.0441
Round 005: test acc mean=0.0485 ± 0.0043 | min=0.0347 max=0.0553
         : test loss mean=8.9940 ± 10.5385
         : individual accs = ['0.044574', '0.034737', '0.048272', '0.048234', '0.045710', '0.043387', '0.049130', '0.047827', '0.051062', '0.053075', '0.050447', '0.049606', '0.045688', '0.055278', '0.050346', '0.051378', '0.049362', '0.051159', '0.052889', '0.048450']
         : correct/total = [(184, 4128), (146, 4203), (197, 4081), (209, 4333), (187, 4091), (186, 4287), (206, 4193), (208, 4349), (214, 4191), (227, 4277), (209, 4143), (208, 4193), (187, 4093), (232, 4197), (204, 4052), (207, 4029), (205, 4153), (214, 4183), (216, 4084), (200, 4128)]
         : compromised: 0.0489, honest: 0.0484
Round 006: test acc mean=0.0453 ± 0.0076 | min=0.0305 max=0.0553
         : test loss mean=11.7424 ± 17.7476
         : individual accs = ['0.030523', '0.051630', '0.054889', '0.043388', '0.047421', '0.048752', '0.033389', '0.045528', '0.051062', '0.053075', '0.050447', '0.045314', '0.033716', '0.055278', '0.046397', '0.032266', '0.044546', '0.037533', '0.052889', '0.048450']
         : correct/total = [(126, 4128), (217, 4203), (224, 4081), (188, 4333), (194, 4091), (209, 4287), (140, 4193), (198, 4349), (214, 4191), (227, 4277), (209, 4143), (190, 4193), (138, 4093), (232, 4197), (188, 4052), (130, 4029), (185, 4153), (157, 4183), (216, 4084), (200, 4128)]
         : compromised: 0.0438, honest: 0.0457
Round 007: test acc mean=0.0506 ± 0.0031 | min=0.0434 max=0.0563
         : test loss mean=7.1484 ± 8.1139
         : individual accs = ['0.051599', '0.051630', '0.054889', '0.048465', '0.045710', '0.043387', '0.049130', '0.047827', '0.051062', '0.053075', '0.050447', '0.049606', '0.052040', '0.055278', '0.050346', '0.056342', '0.049362', '0.050203', '0.052889', '0.048450']
         : correct/total = [(213, 4128), (217, 4203), (224, 4081), (210, 4333), (187, 4091), (186, 4287), (206, 4193), (208, 4349), (214, 4191), (227, 4277), (209, 4143), (208, 4193), (213, 4093), (232, 4197), (204, 4052), (227, 4029), (205, 4153), (210, 4183), (216, 4084), (200, 4128)]
         : compromised: 0.0502, honest: 0.0507
Round 008: test acc mean=0.0488 ± 0.0048 | min=0.0323 max=0.0553
         : test loss mean=9.5822 ± 14.4842
         : individual accs = ['0.051599', '0.050916', '0.054889', '0.048465', '0.052554', '0.048752', '0.049130', '0.045528', '0.051062', '0.044891', '0.050447', '0.045314', '0.052040', '0.055278', '0.046397', '0.032266', '0.044546', '0.051159', '0.050196', '0.050145']
         : correct/total = [(213, 4128), (214, 4203), (224, 4081), (210, 4333), (215, 4091), (209, 4287), (206, 4193), (198, 4349), (214, 4191), (192, 4277), (209, 4143), (190, 4193), (213, 4093), (232, 4197), (188, 4052), (130, 4029), (185, 4153), (214, 4183), (205, 4084), (207, 4128)]
         : compromised: 0.0518, honest: 0.0480
Round 009: test acc mean=0.0501 ± 0.0034 | min=0.0434 max=0.0563
         : test loss mean=6.3123 ± 6.7505
         : individual accs = ['0.049661', '0.051630', '0.054889', '0.048465', '0.051088', '0.043387', '0.043883', '0.047827', '0.051062', '0.053075', '0.047550', '0.049606', '0.052040', '0.055278', '0.050346', '0.056342', '0.049362', '0.046139', '0.052889', '0.048450']
         : correct/total = [(205, 4128), (217, 4203), (224, 4081), (210, 4333), (209, 4091), (186, 4287), (184, 4193), (208, 4349), (214, 4191), (227, 4277), (197, 4143), (208, 4193), (213, 4093), (232, 4197), (204, 4052), (227, 4029), (205, 4153), (193, 4183), (216, 4084), (200, 4128)]
         : compromised: 0.0492, honest: 0.0504
Round 010: test acc mean=0.0499 ± 0.0033 | min=0.0445 max=0.0563
         : test loss mean=8.3348 ± 12.3955
         : individual accs = ['0.051599', '0.050916', '0.054889', '0.048465', '0.051088', '0.048752', '0.049130', '0.045528', '0.051062', '0.044891', '0.050447', '0.045314', '0.052040', '0.055278', '0.046397', '0.056342', '0.044546', '0.050203', '0.050196', '0.050145']
         : correct/total = [(213, 4128), (214, 4203), (224, 4081), (210, 4333), (209, 4091), (209, 4287), (206, 4193), (198, 4349), (214, 4191), (192, 4277), (209, 4143), (190, 4193), (213, 4093), (232, 4197), (188, 4052), (227, 4029), (185, 4153), (210, 4183), (205, 4084), (207, 4128)]
         : compromised: 0.0516, honest: 0.0494

=== FINAL RESULTS ===
Dataset: femnist, Nodes: 20, Graph: erdos, Aggregation: d-fedavg
Attack: directed_deviation, 20.0% compromised
Final accuracy - Compromised: 0.0516, Honest: 0.0494
Overall test accuracy: mean=0.0499 ± 0.0033
