Device: cuda
Seed: 987654321
Loading 36 LEAF FEMNIST train files...
LEAF FEMNIST train: 3597 users, 734463 samples
Loading 36 LEAF FEMNIST test files...
LEAF FEMNIST test: 3597 users, 83388 samples
Found 3597 train users, 3597 test users, 3597 common users
User sample counts range: 525 (max) to 17 (min)
Distributed ALL 3597 users across 20 clients
Users per client: 179 (with 17 clients getting +1 user)
Train partition sizes: [36360, 37070, 35957, 38262, 36024, 37732, 36921, 38328, 36867, 37683, 36507, 36915, 36007, 37001, 35681, 35453, 36585, 36801, 35964, 36345]
Test partition sizes: [4128, 4203, 4081, 4333, 4091, 4287, 4193, 4349, 4191, 4277, 4143, 4193, 4093, 4197, 4052, 4029, 4153, 4183, 4084, 4128]
  Client 0: 36360 train samples, 62 unique classes
  Client 1: 37070 train samples, 62 unique classes
  Client 2: 35957 train samples, 62 unique classes
  Client 3: 38262 train samples, 62 unique classes
  Client 4: 36024 train samples, 62 unique classes
  Client 5: 37732 train samples, 62 unique classes
  Client 6: 36921 train samples, 62 unique classes
  Client 7: 38328 train samples, 62 unique classes
  Client 8: 36867 train samples, 62 unique classes
  Client 9: 37683 train samples, 62 unique classes
  Client 10: 36507 train samples, 62 unique classes
  Client 11: 36915 train samples, 62 unique classes
  Client 12: 36007 train samples, 62 unique classes
  Client 13: 37001 train samples, 62 unique classes
  Client 14: 35681 train samples, 62 unique classes
  Client 15: 35453 train samples, 62 unique classes
  Client 16: 36585 train samples, 62 unique classes
  Client 17: 36801 train samples, 62 unique classes
  Client 18: 35964 train samples, 62 unique classes
  Client 19: 36345 train samples, 62 unique classes
Will sample 4500 samples per client per epoch
Graph: erdos, nodes: 20, edges: 48
Degree statistics: avg=4.80, min=2, max=7
Attack: Compromised 12/20 nodes: [1, 2, 3, 5, 8, 11, 12, 13, 14, 15, 17, 18]
Attack type: backdoor, lambda: 1.0
Backdoor target label: 0, trigger size: 4
Model variant: baseline
Model parameters: 6,603,710
UBAR ALGORITHM (Two-Stage Byzantine-resilient)
  - Model dimension: 6,603,710 parameters
  - Rho parameter: 0.4
  - Stage 1: Distance-based filtering (select 40% closest neighbors)
  - Stage 2: Performance-based selection (loss comparison)
  - Complexity: O(deg(i)×d + deg(i)×inference)
Initial test acc across nodes: mean=0.0168 ± 0.0139
Backdoor attack: Created poisoned datasets for 12 compromised nodes
Round 001: test acc mean=0.0517 ± 0.0044 | min=0.0432 max=0.0596
         : test loss mean=24653.4419 ± 28473.4291
         : individual accs = ['0.059593', '0.048775', '0.053418', '0.043157', '0.058910', '0.045253', '0.057000', '0.051276', '0.049630', '0.047463', '0.048033', '0.049606', '0.054239', '0.049083', '0.051826', '0.051626', '0.058271', '0.049486', '0.052889', '0.054506']
         : correct/total = [(246, 4128), (205, 4203), (218, 4081), (187, 4333), (241, 4091), (194, 4287), (239, 4193), (223, 4349), (208, 4191), (203, 4277), (199, 4143), (208, 4193), (222, 4093), (206, 4197), (210, 4052), (208, 4029), (242, 4153), (207, 4183), (216, 4084), (225, 4128)]
         : compromised: 0.0499, honest: 0.0544
         : ubar stats = ['Node 0: s1=0.333, s2=0.500', 'Node 1: s1=0.333, s2=1.000', 'Node 2: s1=0.400, s2=1.000']...
Round 002: test acc mean=0.0446 ± 0.0144 | min=0.0098 max=0.0624
         : test loss mean=10985.5162 ± 15266.6737
         : individual accs = ['0.044574', '0.009755', '0.054153', '0.053773', '0.057932', '0.045486', '0.044598', '0.058174', '0.015748', '0.050503', '0.045619', '0.014071', '0.035915', '0.062426', '0.051579', '0.050881', '0.049362', '0.049486', '0.052889', '0.045058']
         : correct/total = [(184, 4128), (41, 4203), (221, 4081), (233, 4333), (237, 4091), (195, 4287), (187, 4193), (253, 4349), (66, 4191), (216, 4277), (189, 4143), (59, 4193), (147, 4093), (262, 4197), (209, 4052), (205, 4029), (205, 4153), (207, 4183), (216, 4084), (186, 4128)]
         : compromised: 0.0413, honest: 0.0495
         : ubar stats = ['Node 0: s1=0.333, s2=0.750', 'Node 1: s1=0.333, s2=1.000', 'Node 2: s1=0.400, s2=1.000']...
Round 003: test acc mean=0.0553 ± 0.0139 | min=0.0432 max=0.0961
         : test loss mean=16285184493768585216.0000 ± 16052065108388993024.0000
         : individual accs = ['0.059593', '0.046158', '0.048272', '0.043157', '0.096065', '0.043387', '0.057000', '0.093585', '0.049630', '0.047697', '0.055274', '0.049606', '0.054239', '0.049083', '0.050346', '0.051626', '0.058271', '0.051159', '0.050930', '0.050388']
         : correct/total = [(246, 4128), (194, 4203), (197, 4081), (187, 4333), (393, 4091), (186, 4287), (239, 4193), (407, 4349), (208, 4191), (204, 4277), (229, 4143), (208, 4193), (222, 4093), (206, 4197), (204, 4052), (208, 4029), (242, 4153), (214, 4183), (208, 4084), (208, 4128)]
         : compromised: 0.0490, honest: 0.0647
         : ubar stats = ['Node 0: s1=0.333, s2=0.833', 'Node 1: s1=0.333, s2=1.000', 'Node 2: s1=0.400, s2=1.000']...
Round 004: test acc mean=0.0513 ± 0.0045 | min=0.0432 max=0.0596
         : test loss mean=nan ± nan
         : individual accs = ['0.059593', '0.048775', '0.053418', '0.043157', '0.057932', '0.045253', '0.057000', '0.051276', '0.049630', '0.053075', '0.045619', '0.049606', '0.054239', '0.049083', '0.051826', '0.051626', '0.058271', '0.049486', '0.052889', '0.045058']
         : correct/total = [(246, 4128), (205, 4203), (218, 4081), (187, 4333), (237, 4091), (194, 4287), (239, 4193), (223, 4349), (208, 4191), (227, 4277), (189, 4143), (208, 4193), (222, 4093), (206, 4197), (210, 4052), (208, 4029), (242, 4153), (207, 4183), (216, 4084), (186, 4128)]
         : compromised: 0.0499, honest: 0.0535
         : ubar stats = ['Node 0: s1=0.333, s2=0.875', 'Node 1: s1=0.333, s2=0.875', 'Node 2: s1=0.400, s2=0.875']...
Round 005: test acc mean=0.0516 ± 0.0043 | min=0.0432 max=0.0596
         : test loss mean=nan ± nan
         : individual accs = ['0.059593', '0.048775', '0.053418', '0.043157', '0.045710', '0.045253', '0.057000', '0.047827', '0.049630', '0.053776', '0.055998', '0.049606', '0.054239', '0.049083', '0.051826', '0.051626', '0.058271', '0.049486', '0.052889', '0.055475']
         : correct/total = [(246, 4128), (205, 4203), (218, 4081), (187, 4333), (187, 4091), (194, 4287), (239, 4193), (208, 4349), (208, 4191), (230, 4277), (232, 4143), (208, 4193), (222, 4093), (206, 4197), (210, 4052), (208, 4029), (242, 4153), (207, 4183), (216, 4084), (229, 4128)]
         : compromised: 0.0499, honest: 0.0542
         : ubar stats = ['Node 0: s1=0.333, s2=0.900', 'Node 1: s1=0.333, s2=0.800', 'Node 2: s1=0.400, s2=0.800']...
Round 006: test acc mean=0.0491 ± 0.0033 | min=0.0432 max=0.0542
         : test loss mean=nan ± nan
         : individual accs = ['0.044574', '0.048775', '0.053418', '0.043157', '0.051088', '0.045253', '0.043883', '0.051276', '0.049630', '0.043722', '0.050447', '0.049606', '0.054239', '0.049083', '0.051826', '0.051626', '0.049362', '0.049486', '0.052889', '0.048450']
         : correct/total = [(184, 4128), (205, 4203), (218, 4081), (187, 4333), (209, 4091), (194, 4287), (184, 4193), (223, 4349), (208, 4191), (187, 4277), (209, 4143), (208, 4193), (222, 4093), (206, 4197), (210, 4052), (208, 4029), (205, 4153), (207, 4183), (216, 4084), (200, 4128)]
         : compromised: 0.0499, honest: 0.0479
         : ubar stats = ['Node 0: s1=0.333, s2=0.917', 'Node 1: s1=0.333, s2=0.750', 'Node 2: s1=0.400, s2=0.750']...
Round 007: test acc mean=0.0519 ± 0.0055 | min=0.0432 max=0.0691
         : test loss mean=nan ± nan
         : individual accs = ['0.054021', '0.048775', '0.053418', '0.043157', '0.047421', '0.045253', '0.054376', '0.058174', '0.049630', '0.044657', '0.055998', '0.049606', '0.054239', '0.049083', '0.051826', '0.051626', '0.069107', '0.049486', '0.052889', '0.055475']
         : correct/total = [(223, 4128), (205, 4203), (218, 4081), (187, 4333), (194, 4091), (194, 4287), (228, 4193), (253, 4349), (208, 4191), (191, 4277), (232, 4143), (208, 4193), (222, 4093), (206, 4197), (210, 4052), (208, 4029), (287, 4153), (207, 4183), (216, 4084), (229, 4128)]
         : compromised: 0.0499, honest: 0.0549
         : ubar stats = ['Node 0: s1=0.333, s2=0.857', 'Node 1: s1=0.333, s2=0.714', 'Node 2: s1=0.400, s2=0.714']...
Round 008: test acc mean=0.0564 ± 0.0152 | min=0.0430 max=0.0953
         : test loss mean=nan ± nan
         : individual accs = ['0.051599', '0.048775', '0.053418', '0.043157', '0.043021', '0.045253', '0.049606', '0.086687', '0.049630', '0.054010', '0.095342', '0.049606', '0.054239', '0.049083', '0.051826', '0.051626', '0.055141', '0.049486', '0.052889', '0.093023']
         : correct/total = [(213, 4128), (205, 4203), (218, 4081), (187, 4333), (176, 4091), (194, 4287), (208, 4193), (377, 4349), (208, 4191), (231, 4277), (395, 4143), (208, 4193), (222, 4093), (206, 4197), (210, 4052), (208, 4029), (229, 4153), (207, 4183), (216, 4084), (384, 4128)]
         : compromised: 0.0499, honest: 0.0661
         : ubar stats = ['Node 0: s1=0.333, s2=0.875', 'Node 1: s1=0.333, s2=0.688', 'Node 2: s1=0.400, s2=0.688']...
Round 009: test acc mean=0.0568 ± 0.0129 | min=0.0432 max=0.0853
         : test loss mean=nan ± nan
         : individual accs = ['0.085271', '0.048775', '0.053418', '0.043157', '0.044977', '0.045253', '0.050799', '0.069211', '0.049630', '0.084405', '0.077963', '0.049606', '0.054239', '0.049083', '0.051826', '0.051626', '0.052011', '0.049486', '0.052889', '0.072674']
         : correct/total = [(352, 4128), (205, 4203), (218, 4081), (187, 4333), (184, 4091), (194, 4287), (213, 4193), (301, 4349), (208, 4191), (361, 4277), (323, 4143), (208, 4193), (222, 4093), (206, 4197), (210, 4052), (208, 4029), (216, 4153), (207, 4183), (216, 4084), (300, 4128)]
         : compromised: 0.0499, honest: 0.0672
         : ubar stats = ['Node 0: s1=0.333, s2=0.833', 'Node 1: s1=0.333, s2=0.667', 'Node 2: s1=0.400, s2=0.667']...
Round 010: test acc mean=0.0538 ± 0.0070 | min=0.0432 max=0.0746
         : test loss mean=nan ± nan
         : individual accs = ['0.074612', '0.048775', '0.053418', '0.043157', '0.057932', '0.045253', '0.049130', '0.058404', '0.049630', '0.053776', '0.060101', '0.049606', '0.054239', '0.049083', '0.051826', '0.051626', '0.065254', '0.049486', '0.052889', '0.058140']
         : correct/total = [(308, 4128), (205, 4203), (218, 4081), (187, 4333), (237, 4091), (194, 4287), (206, 4193), (254, 4349), (208, 4191), (230, 4277), (249, 4143), (208, 4193), (222, 4093), (206, 4197), (210, 4052), (208, 4029), (271, 4153), (207, 4183), (216, 4084), (240, 4128)]
         : compromised: 0.0499, honest: 0.0597
         : ubar stats = ['Node 0: s1=0.333, s2=0.850', 'Node 1: s1=0.333, s2=0.650', 'Node 2: s1=0.400, s2=0.650']...

=== FINAL RESULTS ===
Dataset: femnist, Nodes: 20, Graph: erdos, Aggregation: ubar
Attack: backdoor, 60.0% compromised
Final accuracy - Compromised: 0.0499, Honest: 0.0597
Overall test accuracy: mean=0.0538 ± 0.0070

=== BACKDOOR ATTACK SUCCESS RATE (ASR) ===
Target label: 0
Trigger size: 4x4
Overall ASR: 0.6000 ± 0.4899
Honest nodes ASR: 0.0000 ± 0.0000
Compromised nodes ASR: 1.0000 ± 0.0000
Note: Higher ASR indicates more successful backdoor attack

=== UBAR SUMMARY ===
Node 0: stage1=0.333, stage2=0.850, overall=0.283
Node 1: stage1=0.333, stage2=0.650, overall=0.217
Node 2: stage1=0.400, stage2=0.650, overall=0.260
Node 3: stage1=0.250, stage2=1.000, overall=0.250
Node 4: stage1=0.250, stage2=1.000, overall=0.250
Node 5: stage1=0.400, stage2=0.600, overall=0.240
Node 6: stage1=0.400, stage2=0.500, overall=0.200
Node 7: stage1=0.400, stage2=0.750, overall=0.300
Node 8: stage1=0.500, stage2=1.000, overall=0.500
Node 9: stage1=0.333, stage2=1.000, overall=0.333
Node 10: stage1=0.250, stage2=1.000, overall=0.250
Node 11: stage1=0.286, stage2=0.650, overall=0.186
Node 12: stage1=0.286, stage2=0.650, overall=0.186
Node 13: stage1=0.250, stage2=1.000, overall=0.250
Node 14: stage1=0.286, stage2=0.600, overall=0.171
Node 15: stage1=0.333, stage2=0.650, overall=0.217
Node 16: stage1=0.400, stage2=0.500, overall=0.200
Node 17: stage1=0.400, stage2=0.650, overall=0.260
Node 18: stage1=0.250, stage2=1.000, overall=0.250
Node 19: stage1=0.500, stage2=1.000, overall=0.500

=== PARALLEL EXECUTION TIME (realistic for distributed system) ===
  COMMUNICATION (max across nodes):
    - Full model transfer: 0.000s (0.0%)
  COMPUTATION (max across nodes):
    - Distance computation: 0.032s (0.8%)
    - Loss computation: 4.195s (99.1%)
    - Aggregation: 0.007s (0.2%)
  TOTALS:
    - Total computation: 4.235s (100.0%)
    - Total communication: 0.000s (0.0%)
    - Total parallel time: 4.235s

=== PER-NODE AVERAGE TIME ===
  - Distance computation: 0.024s
  - Loss computation: 3.954s
  - Aggregation: 0.005s
  - Model transfer: 0.000s
  - Total per node: 3.982s

=== TOTAL COMPUTATIONAL WORK (sum across all nodes) ===
  - Total distance computation: 0.475s
  - Total loss computation: 79.082s
  - Total aggregation: 0.092s
  - Total model transfer: 0.000s
  - Grand total: 79.650s
  - Mean Stage 1 acceptance rate: 0.342
  - Mean Stage 2 acceptance rate: 0.785
  - Overall acceptance rate: 0.268

UBAR Algorithm Properties:
  - Model dimension: 6,603,710
  - Rho parameter: 0.4
  - Two-stage approach: Distance filtering + loss evaluation
  - Stage 1 selects: 40% of neighbors
  - Stage 2 uses: Training sample loss comparison
  - Theoretical complexity: O(deg(i)×d + deg(i)×inference)
  - Approach: UBAR paper implementation
