Device: cuda
Seed: 987654321
Loading 36 LEAF FEMNIST train files...
LEAF FEMNIST train: 3597 users, 734463 samples
Loading 36 LEAF FEMNIST test files...
LEAF FEMNIST test: 3597 users, 83388 samples
Found 3597 train users, 3597 test users, 3597 common users
User sample counts range: 525 (max) to 17 (min)
Distributed ALL 3597 users across 20 clients
Users per client: 179 (with 17 clients getting +1 user)
Train partition sizes: [36360, 37070, 35957, 38262, 36024, 37732, 36921, 38328, 36867, 37683, 36507, 36915, 36007, 37001, 35681, 35453, 36585, 36801, 35964, 36345]
Test partition sizes: [4128, 4203, 4081, 4333, 4091, 4287, 4193, 4349, 4191, 4277, 4143, 4193, 4093, 4197, 4052, 4029, 4153, 4183, 4084, 4128]
  Client 0: 36360 train samples, 62 unique classes
  Client 1: 37070 train samples, 62 unique classes
  Client 2: 35957 train samples, 62 unique classes
  Client 3: 38262 train samples, 62 unique classes
  Client 4: 36024 train samples, 62 unique classes
  Client 5: 37732 train samples, 62 unique classes
  Client 6: 36921 train samples, 62 unique classes
  Client 7: 38328 train samples, 62 unique classes
  Client 8: 36867 train samples, 62 unique classes
  Client 9: 37683 train samples, 62 unique classes
  Client 10: 36507 train samples, 62 unique classes
  Client 11: 36915 train samples, 62 unique classes
  Client 12: 36007 train samples, 62 unique classes
  Client 13: 37001 train samples, 62 unique classes
  Client 14: 35681 train samples, 62 unique classes
  Client 15: 35453 train samples, 62 unique classes
  Client 16: 36585 train samples, 62 unique classes
  Client 17: 36801 train samples, 62 unique classes
  Client 18: 35964 train samples, 62 unique classes
  Client 19: 36345 train samples, 62 unique classes
Will sample 4500 samples per client per epoch
Graph: erdos, nodes: 20, edges: 99
Degree statistics: avg=9.90, min=7, max=14
Attack: Compromised 6/20 nodes: [5, 12, 13, 14, 17, 18]
Attack type: backdoor, lambda: 1.0
Backdoor target label: 0, trigger size: 4
Model variant: baseline
Model parameters: 6,603,710
Initial test acc across nodes: mean=0.0168 ± 0.0139
Backdoor attack: Created poisoned datasets for 6 compromised nodes
Round 001: test acc mean=0.0133 ± 0.0132 | min=0.0037 max=0.0529
         : test loss mean=7416.6655 ± 15708.6503
         : individual accs = ['0.005814', '0.022127', '0.019358', '0.052850', '0.004155', '0.008631', '0.010971', '0.004139', '0.004772', '0.003741', '0.005793', '0.006916', '0.010017', '0.016679', '0.046397', '0.007942', '0.005538', '0.017213', '0.006366', '0.006298']
         : correct/total = [(24, 4128), (93, 4203), (79, 4081), (229, 4333), (17, 4091), (37, 4287), (46, 4193), (18, 4349), (20, 4191), (16, 4277), (24, 4143), (29, 4193), (41, 4093), (70, 4197), (188, 4052), (32, 4029), (23, 4153), (72, 4183), (26, 4084), (26, 4128)]
         : compromised: 0.0176, honest: 0.0115
Round 002: test acc mean=0.0540 ± 0.0047 | min=0.0445 max=0.0624
         : test loss mean=875214.9325 ± 3203197.7813
         : individual accs = ['0.050145', '0.049726', '0.052683', '0.052850', '0.057932', '0.050618', '0.057000', '0.058174', '0.053209', '0.047697', '0.055998', '0.053899', '0.058637', '0.062426', '0.061204', '0.056590', '0.044546', '0.045900', '0.055583', '0.055475']
         : correct/total = [(207, 4128), (209, 4203), (215, 4081), (229, 4333), (237, 4091), (217, 4287), (239, 4193), (253, 4349), (223, 4191), (204, 4277), (232, 4143), (226, 4193), (240, 4093), (262, 4197), (248, 4052), (228, 4029), (185, 4153), (192, 4183), (227, 4084), (229, 4128)]
         : compromised: 0.0557, honest: 0.0533
Round 003: test acc mean=0.0441 ± 0.0097 | min=0.0135 max=0.0525
         : test loss mean=230.2721 ± 246.9708
         : individual accs = ['0.050145', '0.049726', '0.045087', '0.040157', '0.042288', '0.052484', '0.028619', '0.041389', '0.051062', '0.048398', '0.047309', '0.028142', '0.050574', '0.047177', '0.048124', '0.051378', '0.013484', '0.050203', '0.051665', '0.045058']
         : correct/total = [(207, 4128), (209, 4203), (184, 4081), (174, 4333), (173, 4091), (225, 4287), (120, 4193), (180, 4349), (214, 4191), (207, 4277), (196, 4143), (118, 4193), (207, 4093), (198, 4197), (195, 4052), (207, 4029), (56, 4153), (210, 4183), (211, 4084), (186, 4128)]
         : compromised: 0.0500, honest: 0.0416
Round 004: test acc mean=0.0345 ± 0.0183 | min=0.0077 max=0.0538
         : test loss mean=144.3001 ± 101.7910
         : individual accs = ['0.050145', '0.051630', '0.052683', '0.014078', '0.014422', '0.052484', '0.013356', '0.011497', '0.042233', '0.048398', '0.045619', '0.010017', '0.053750', '0.046938', '0.048124', '0.012906', '0.007705', '0.015539', '0.052889', '0.045058']
         : correct/total = [(207, 4128), (217, 4203), (215, 4081), (61, 4333), (59, 4091), (225, 4287), (56, 4193), (50, 4349), (177, 4191), (207, 4277), (189, 4143), (42, 4193), (220, 4093), (197, 4197), (195, 4052), (52, 4029), (32, 4153), (65, 4183), (216, 4084), (186, 4128)]
         : compromised: 0.0450, honest: 0.0300
Round 005: test acc mean=0.0514 ± 0.0034 | min=0.0469 max=0.0618
         : test loss mean=82.8983 ± 47.9991
         : individual accs = ['0.051599', '0.051630', '0.050723', '0.048465', '0.051088', '0.048052', '0.049130', '0.051276', '0.047960', '0.053075', '0.050447', '0.061770', '0.053750', '0.046938', '0.048124', '0.056342', '0.055141', '0.050203', '0.052889', '0.048450']
         : correct/total = [(213, 4128), (217, 4203), (207, 4081), (210, 4333), (209, 4091), (206, 4287), (206, 4193), (223, 4349), (201, 4191), (227, 4277), (209, 4143), (259, 4193), (220, 4093), (197, 4197), (195, 4052), (227, 4029), (229, 4153), (210, 4183), (216, 4084), (200, 4128)]
         : compromised: 0.0500, honest: 0.0519
Round 006: test acc mean=0.0514 ± 0.0034 | min=0.0469 max=0.0618
         : test loss mean=42.4535 ± 18.6175
         : individual accs = ['0.051599', '0.051630', '0.050723', '0.048465', '0.051088', '0.048052', '0.049130', '0.051276', '0.047960', '0.053075', '0.050447', '0.061770', '0.053750', '0.046938', '0.048124', '0.056342', '0.055141', '0.050203', '0.052889', '0.048450']
         : correct/total = [(213, 4128), (217, 4203), (207, 4081), (210, 4333), (209, 4091), (206, 4287), (206, 4193), (223, 4349), (201, 4191), (227, 4277), (209, 4143), (259, 4193), (220, 4093), (197, 4197), (195, 4052), (227, 4029), (229, 4153), (210, 4183), (216, 4084), (200, 4128)]
         : compromised: 0.0500, honest: 0.0519
Round 007: test acc mean=0.0352 ± 0.0211 | min=0.0042 max=0.0538
         : test loss mean=14.4046 ± 5.9515
         : individual accs = ['0.051599', '0.051630', '0.050723', '0.048465', '0.051088', '0.048052', '0.005724', '0.009657', '0.007874', '0.053075', '0.050447', '0.006439', '0.053750', '0.046938', '0.005923', '0.004219', '0.006261', '0.050203', '0.052889', '0.048450']
         : correct/total = [(213, 4128), (217, 4203), (207, 4081), (210, 4333), (209, 4091), (206, 4287), (24, 4193), (42, 4349), (33, 4191), (227, 4277), (209, 4143), (27, 4193), (220, 4093), (197, 4197), (24, 4052), (17, 4029), (26, 4153), (210, 4183), (216, 4084), (200, 4128)]
         : compromised: 0.0430, honest: 0.0318
Round 008: test acc mean=0.0462 ± 0.0110 | min=0.0226 max=0.0578
         : test loss mean=6.7382 ± 1.8184
         : individual accs = ['0.049176', '0.022603', '0.055134', '0.047773', '0.044977', '0.057849', '0.053899', '0.043918', '0.051539', '0.025251', '0.026309', '0.053184', '0.049841', '0.026686', '0.051579', '0.054852', '0.054418', '0.053311', '0.052155', '0.050388']
         : correct/total = [(203, 4128), (95, 4203), (225, 4081), (207, 4333), (184, 4091), (248, 4287), (226, 4193), (191, 4349), (216, 4191), (108, 4277), (109, 4143), (223, 4193), (204, 4093), (112, 4197), (209, 4052), (221, 4029), (226, 4153), (223, 4183), (213, 4084), (208, 4128)]
         : compromised: 0.0486, honest: 0.0452
Round 009: test acc mean=0.0399 ± 0.0149 | min=0.0157 max=0.0578
         : test loss mean=5.4157 ± 0.8359
         : individual accs = ['0.049176', '0.047109', '0.055134', '0.047773', '0.044977', '0.057849', '0.023372', '0.019545', '0.022668', '0.047463', '0.055274', '0.021703', '0.049841', '0.045747', '0.051579', '0.022338', '0.015892', '0.053311', '0.052155', '0.015746']
         : correct/total = [(203, 4128), (198, 4203), (225, 4081), (207, 4333), (184, 4091), (248, 4287), (98, 4193), (85, 4349), (95, 4191), (203, 4277), (229, 4143), (91, 4193), (204, 4093), (192, 4197), (209, 4052), (90, 4029), (66, 4153), (223, 4183), (213, 4084), (65, 4128)]
         : compromised: 0.0517, honest: 0.0349
Round 010: test acc mean=0.0211 ± 0.0064 | min=0.0157 max=0.0475
         : test loss mean=4.8594 ± 0.5519
         : individual accs = ['0.019622', '0.020700', '0.022298', '0.018925', '0.016133', '0.020760', '0.023372', '0.019545', '0.022668', '0.047463', '0.017861', '0.021703', '0.020034', '0.018346', '0.021718', '0.022338', '0.015892', '0.019842', '0.017630', '0.015746']
         : correct/total = [(81, 4128), (87, 4203), (91, 4081), (82, 4333), (66, 4091), (89, 4287), (98, 4193), (85, 4349), (95, 4191), (203, 4277), (74, 4143), (91, 4193), (82, 4093), (77, 4197), (88, 4052), (90, 4029), (66, 4153), (83, 4183), (72, 4084), (65, 4128)]
         : compromised: 0.0197, honest: 0.0217

=== FINAL RESULTS ===
Dataset: femnist, Nodes: 20, Graph: erdos, Aggregation: d-fedavg
Attack: backdoor, 30.0% compromised
Final accuracy - Compromised: 0.0197, Honest: 0.0217
Overall test accuracy: mean=0.0211 ± 0.0064

=== BACKDOOR ATTACK SUCCESS RATE (ASR) ===
Target label: 0
Trigger size: 4x4
Overall ASR: 0.0000 ± 0.0000
Honest nodes ASR: 0.0000 ± 0.0000
Compromised nodes ASR: 0.0000 ± 0.0000
Note: Higher ASR indicates more successful backdoor attack
