Device: cuda
Seed: 987654321
Loading 36 LEAF FEMNIST train files...
LEAF FEMNIST train: 3597 users, 734463 samples
Loading 36 LEAF FEMNIST test files...
LEAF FEMNIST test: 3597 users, 83388 samples
Found 3597 train users, 3597 test users, 3597 common users
User sample counts range: 525 (max) to 17 (min)
Distributed ALL 3597 users across 20 clients
Users per client: 179 (with 17 clients getting +1 user)
Train partition sizes: [36360, 37070, 35957, 38262, 36024, 37732, 36921, 38328, 36867, 37683, 36507, 36915, 36007, 37001, 35681, 35453, 36585, 36801, 35964, 36345]
Test partition sizes: [4128, 4203, 4081, 4333, 4091, 4287, 4193, 4349, 4191, 4277, 4143, 4193, 4093, 4197, 4052, 4029, 4153, 4183, 4084, 4128]
  Client 0: 36360 train samples, 62 unique classes
  Client 1: 37070 train samples, 62 unique classes
  Client 2: 35957 train samples, 62 unique classes
  Client 3: 38262 train samples, 62 unique classes
  Client 4: 36024 train samples, 62 unique classes
  Client 5: 37732 train samples, 62 unique classes
  Client 6: 36921 train samples, 62 unique classes
  Client 7: 38328 train samples, 62 unique classes
  Client 8: 36867 train samples, 62 unique classes
  Client 9: 37683 train samples, 62 unique classes
  Client 10: 36507 train samples, 62 unique classes
  Client 11: 36915 train samples, 62 unique classes
  Client 12: 36007 train samples, 62 unique classes
  Client 13: 37001 train samples, 62 unique classes
  Client 14: 35681 train samples, 62 unique classes
  Client 15: 35453 train samples, 62 unique classes
  Client 16: 36585 train samples, 62 unique classes
  Client 17: 36801 train samples, 62 unique classes
  Client 18: 35964 train samples, 62 unique classes
  Client 19: 36345 train samples, 62 unique classes
Will sample 4500 samples per client per epoch
Graph: erdos, nodes: 20, edges: 48
Degree statistics: avg=4.80, min=2, max=7
Attack: Compromised 12/20 nodes: [1, 2, 3, 5, 8, 11, 12, 13, 14, 15, 17, 18]
Attack type: directed_deviation, lambda: 1.0
Model variant: baseline
Model parameters: 6,603,710
Initial test acc across nodes: mean=0.0168 ± 0.0139
Round 001: test acc mean=0.0176 ± 0.0177 | min=0.0032 max=0.0503
         : test loss mean=58138.8182 ± 64779.5658
         : individual accs = ['0.004845', '0.023793', '0.048763', '0.048234', '0.007089', '0.007231', '0.006439', '0.003219', '0.004295', '0.045125', '0.005793', '0.011925', '0.003420', '0.007624', '0.050346', '0.008439', '0.008187', '0.044466', '0.005632', '0.006783']
         : correct/total = [(20, 4128), (100, 4203), (199, 4081), (209, 4333), (29, 4091), (31, 4287), (27, 4193), (14, 4349), (18, 4191), (193, 4277), (24, 4143), (50, 4193), (14, 4093), (32, 4197), (204, 4052), (34, 4029), (34, 4153), (186, 4183), (23, 4084), (28, 4128)]
         : compromised: 0.0220, honest: 0.0109
Round 002: test acc mean=0.0438 ± 0.0165 | min=0.0037 max=0.0549
         : test loss mean=104302496259.1744 ± 452217334923.7339
         : individual accs = ['0.051599', '0.051630', '0.054889', '0.003693', '0.052066', '0.045253', '0.005962', '0.053116', '0.051062', '0.044891', '0.048033', '0.054376', '0.053750', '0.045747', '0.051579', '0.005460', '0.054418', '0.048291', '0.050196', '0.050145']
         : correct/total = [(213, 4128), (217, 4203), (224, 4081), (16, 4333), (213, 4091), (194, 4287), (25, 4193), (231, 4349), (214, 4191), (192, 4277), (199, 4143), (228, 4193), (220, 4093), (192, 4197), (209, 4052), (22, 4029), (226, 4153), (202, 4183), (205, 4084), (207, 4128)]
         : compromised: 0.0430, honest: 0.0450
Round 003: test acc mean=0.0400 ± 0.0179 | min=0.0042 max=0.0551
         : test loss mean=1169358895.1039 ± 2546111723.0854
         : individual accs = ['0.045785', '0.051630', '0.004166', '0.036464', '0.052066', '0.045953', '0.005962', '0.053116', '0.005488', '0.046528', '0.047550', '0.041736', '0.053750', '0.045747', '0.051826', '0.005460', '0.055141', '0.046139', '0.050196', '0.054506']
         : correct/total = [(189, 4128), (217, 4203), (17, 4081), (158, 4333), (213, 4091), (197, 4287), (25, 4193), (231, 4349), (23, 4191), (199, 4277), (197, 4143), (175, 4193), (220, 4093), (192, 4197), (210, 4052), (22, 4029), (229, 4153), (193, 4183), (205, 4084), (225, 4128)]
         : compromised: 0.0365, honest: 0.0451
Round 004: test acc mean=0.0407 ± 0.0155 | min=0.0039 max=0.0525
         : test loss mean=35256011.8681 ± 40019821.3501
         : individual accs = ['0.045785', '0.051630', '0.048763', '0.036464', '0.047421', '0.052484', '0.005962', '0.045528', '0.040802', '0.046528', '0.045619', '0.041736', '0.050574', '0.046938', '0.003949', '0.050633', '0.005057', '0.050203', '0.048482', '0.050388']
         : correct/total = [(189, 4128), (217, 4203), (199, 4081), (158, 4333), (194, 4091), (225, 4287), (25, 4193), (198, 4349), (171, 4191), (199, 4277), (189, 4143), (175, 4193), (207, 4093), (197, 4197), (16, 4052), (204, 4029), (21, 4153), (210, 4183), (198, 4084), (208, 4128)]
         : compromised: 0.0436, honest: 0.0365
Round 005: test acc mean=0.0469 ± 0.0039 | min=0.0407 max=0.0529
         : test loss mean=14476711.7246 ± 22956978.3058
         : individual accs = ['0.048934', '0.042589', '0.048763', '0.043157', '0.051088', '0.048052', '0.050799', '0.051276', '0.040802', '0.046528', '0.051171', '0.041736', '0.050818', '0.049559', '0.046644', '0.041698', '0.040693', '0.045900', '0.052889', '0.045058']
         : correct/total = [(202, 4128), (179, 4203), (199, 4081), (187, 4333), (209, 4091), (206, 4287), (213, 4193), (223, 4349), (171, 4191), (199, 4277), (212, 4143), (175, 4193), (208, 4093), (208, 4197), (189, 4052), (168, 4029), (169, 4153), (192, 4183), (216, 4084), (186, 4128)]
         : compromised: 0.0461, honest: 0.0482
Round 006: test acc mean=0.0466 ± 0.0062 | min=0.0247 max=0.0538
         : test loss mean=3075632.8012 ± 9070452.9572
         : individual accs = ['0.050145', '0.051630', '0.048763', '0.024694', '0.051088', '0.047352', '0.042213', '0.051276', '0.049630', '0.043488', '0.051171', '0.041736', '0.053750', '0.049559', '0.046644', '0.041698', '0.052011', '0.045900', '0.045788', '0.044331']
         : correct/total = [(207, 4128), (217, 4203), (199, 4081), (107, 4333), (209, 4091), (203, 4287), (177, 4193), (223, 4349), (208, 4191), (186, 4277), (212, 4143), (175, 4193), (220, 4093), (208, 4197), (189, 4052), (168, 4029), (216, 4153), (192, 4183), (187, 4084), (183, 4128)]
         : compromised: 0.0456, honest: 0.0482
Round 007: test acc mean=0.0422 ± 0.0098 | min=0.0161 max=0.0561
         : test loss mean=393.6589 ± 615.3192
         : individual accs = ['0.047238', '0.048775', '0.056114', '0.044773', '0.016133', '0.047352', '0.048891', '0.031272', '0.043188', '0.047229', '0.032585', '0.041736', '0.049597', '0.049559', '0.023198', '0.051378', '0.040693', '0.045900', '0.045788', '0.033430']
         : correct/total = [(195, 4128), (205, 4203), (229, 4081), (194, 4333), (66, 4091), (203, 4287), (205, 4193), (136, 4349), (181, 4191), (202, 4277), (135, 4143), (175, 4193), (203, 4093), (208, 4197), (94, 4052), (207, 4029), (169, 4153), (192, 4183), (187, 4084), (138, 4128)]
         : compromised: 0.0456, honest: 0.0372
Round 008: test acc mean=0.0489 ± 0.0053 | min=0.0408 max=0.0596
         : test loss mean=116.9181 ± 153.3961
         : individual accs = ['0.059593', '0.052344', '0.048763', '0.052850', '0.043266', '0.047352', '0.057000', '0.041619', '0.040802', '0.053776', '0.051171', '0.041736', '0.049597', '0.049559', '0.051826', '0.056590', '0.044546', '0.045900', '0.045788', '0.044331']
         : correct/total = [(246, 4128), (220, 4203), (199, 4081), (229, 4333), (177, 4091), (203, 4287), (239, 4193), (181, 4349), (171, 4191), (230, 4277), (212, 4143), (175, 4193), (203, 4093), (208, 4197), (210, 4052), (228, 4029), (185, 4153), (192, 4183), (187, 4084), (183, 4128)]
         : compromised: 0.0486, honest: 0.0494
Round 009: test acc mean=0.0469 ± 0.0037 | min=0.0393 max=0.0529
         : test loss mean=93.5977 ± 97.4723
         : individual accs = ['0.047238', '0.042589', '0.048763', '0.043388', '0.051088', '0.048052', '0.044598', '0.051276', '0.049630', '0.039280', '0.050447', '0.041736', '0.050818', '0.049559', '0.047878', '0.041698', '0.047195', '0.045900', '0.052889', '0.044331']
         : correct/total = [(195, 4128), (179, 4203), (199, 4081), (188, 4333), (209, 4091), (206, 4287), (187, 4193), (223, 4349), (208, 4191), (168, 4277), (209, 4143), (175, 4193), (208, 4093), (208, 4197), (194, 4052), (168, 4029), (196, 4153), (192, 4183), (216, 4084), (183, 4128)]
         : compromised: 0.0469, honest: 0.0469
Round 010: test acc mean=0.0463 ± 0.0044 | min=0.0407 max=0.0586
         : test loss mean=72.6399 ± 134.1747
         : individual accs = ['0.047238', '0.048775', '0.048763', '0.044773', '0.044977', '0.047352', '0.042213', '0.041619', '0.040802', '0.047697', '0.051171', '0.041736', '0.058637', '0.049559', '0.051826', '0.041698', '0.040693', '0.045900', '0.045788', '0.044331']
         : correct/total = [(195, 4128), (205, 4203), (199, 4081), (194, 4333), (184, 4091), (203, 4287), (177, 4193), (181, 4349), (171, 4191), (204, 4277), (212, 4143), (175, 4193), (240, 4093), (208, 4197), (210, 4052), (168, 4029), (169, 4153), (192, 4183), (187, 4084), (183, 4128)]
         : compromised: 0.0471, honest: 0.0450

=== FINAL RESULTS ===
Dataset: femnist, Nodes: 20, Graph: erdos, Aggregation: krum
Attack: directed_deviation, 60.0% compromised
Final accuracy - Compromised: 0.0471, Honest: 0.0450
Overall test accuracy: mean=0.0463 ± 0.0044
