Device: cuda
Seed: 987654321
Loading 36 LEAF FEMNIST train files...
LEAF FEMNIST train: 3597 users, 734463 samples
Loading 36 LEAF FEMNIST test files...
LEAF FEMNIST test: 3597 users, 83388 samples
Found 3597 train users, 3597 test users, 3597 common users
User sample counts range: 525 (max) to 17 (min)
Distributed ALL 3597 users across 20 clients
Users per client: 179 (with 17 clients getting +1 user)
Train partition sizes: [36360, 37070, 35957, 38262, 36024, 37732, 36921, 38328, 36867, 37683, 36507, 36915, 36007, 37001, 35681, 35453, 36585, 36801, 35964, 36345]
Test partition sizes: [4128, 4203, 4081, 4333, 4091, 4287, 4193, 4349, 4191, 4277, 4143, 4193, 4093, 4197, 4052, 4029, 4153, 4183, 4084, 4128]
  Client 0: 36360 train samples, 62 unique classes
  Client 1: 37070 train samples, 62 unique classes
  Client 2: 35957 train samples, 62 unique classes
  Client 3: 38262 train samples, 62 unique classes
  Client 4: 36024 train samples, 62 unique classes
  Client 5: 37732 train samples, 62 unique classes
  Client 6: 36921 train samples, 62 unique classes
  Client 7: 38328 train samples, 62 unique classes
  Client 8: 36867 train samples, 62 unique classes
  Client 9: 37683 train samples, 62 unique classes
  Client 10: 36507 train samples, 62 unique classes
  Client 11: 36915 train samples, 62 unique classes
  Client 12: 36007 train samples, 62 unique classes
  Client 13: 37001 train samples, 62 unique classes
  Client 14: 35681 train samples, 62 unique classes
  Client 15: 35453 train samples, 62 unique classes
  Client 16: 36585 train samples, 62 unique classes
  Client 17: 36801 train samples, 62 unique classes
  Client 18: 35964 train samples, 62 unique classes
  Client 19: 36345 train samples, 62 unique classes
Will sample 10000 samples per client per epoch
Graph: erdos, nodes: 20, edges: 48
Degree statistics: avg=4.80, min=2, max=7
Attack: Compromised 2/20 nodes: [5, 13]
Attack type: directed_deviation, lambda: 1.0
Model variant: baseline
Model parameters: 6,603,710
Initial test acc across nodes: mean=0.0162 ± 0.0138
Round 001: test acc mean=0.0754 ± 0.0577 | min=0.0039 max=0.2435
         : test loss mean=225.9899 ± 362.7979
         : individual accs = ['0.089147', '0.053533', '0.081843', '0.003923', '0.065510', '0.005365', '0.086334', '0.076569', '0.149129', '0.173954', '0.114893', '0.051514', '0.045932', '0.022873', '0.044669', '0.045669', '0.067662', '0.007650', '0.077865', '0.243459']
         : correct/total = [(368, 4128), (225, 4203), (334, 4081), (17, 4333), (268, 4091), (23, 4287), (362, 4193), (333, 4349), (625, 4191), (744, 4277), (476, 4143), (216, 4193), (188, 4093), (96, 4197), (181, 4052), (184, 4029), (281, 4153), (32, 4183), (318, 4084), (1005, 4128)]
         : compromised: 0.0141, honest: 0.0822
Round 002: test acc mean=0.1100 ± 0.1806 | min=0.0422 max=0.6590
         : test loss mean=972277.9310 ± 4237548.4993
         : individual accs = ['0.049419', '0.046395', '0.061505', '0.049850', '0.046199', '0.047352', '0.045314', '0.046907', '0.659031', '0.048632', '0.048274', '0.042213', '0.047398', '0.048844', '0.054788', '0.054604', '0.050566', '0.049247', '0.060235', '0.644138']
         : correct/total = [(204, 4128), (195, 4203), (251, 4081), (216, 4333), (189, 4091), (203, 4287), (190, 4193), (204, 4349), (2762, 4191), (208, 4277), (200, 4143), (177, 4193), (194, 4093), (205, 4197), (222, 4052), (220, 4029), (210, 4153), (206, 4183), (246, 4084), (2659, 4128)]
         : compromised: 0.0481, honest: 0.1169
Round 003: test acc mean=0.0509 ± 0.0045 | min=0.0429 max=0.0615
         : test loss mean=3090653842.9715 ± 6128149463.6109
         : individual accs = ['0.049903', '0.052819', '0.061505', '0.049850', '0.045710', '0.052018', '0.053422', '0.049897', '0.048437', '0.043255', '0.051895', '0.054853', '0.052040', '0.049083', '0.050592', '0.052122', '0.042861', '0.049247', '0.060235', '0.049176']
         : correct/total = [(206, 4128), (222, 4203), (251, 4081), (216, 4333), (187, 4091), (223, 4287), (224, 4193), (217, 4349), (203, 4191), (185, 4277), (215, 4143), (230, 4193), (213, 4093), (206, 4197), (205, 4052), (210, 4029), (178, 4153), (206, 4183), (246, 4084), (203, 4128)]
         : compromised: 0.0506, honest: 0.0510
Round 004: test acc mean=0.0529 ± 0.0044 | min=0.0433 max=0.0616
         : test loss mean=3202463450.0736 ± 6212884492.3877
         : individual accs = ['0.049661', '0.050440', '0.061505', '0.049850', '0.052066', '0.052018', '0.053422', '0.052656', '0.057266', '0.043255', '0.051895', '0.054853', '0.052040', '0.049083', '0.047878', '0.061554', '0.050566', '0.057853', '0.051910', '0.057413']
         : correct/total = [(205, 4128), (212, 4203), (251, 4081), (216, 4333), (213, 4091), (223, 4287), (224, 4193), (229, 4349), (240, 4191), (185, 4277), (215, 4143), (230, 4193), (213, 4093), (206, 4197), (194, 4052), (248, 4029), (210, 4153), (242, 4183), (212, 4084), (237, 4128)]
         : compromised: 0.0506, honest: 0.0531
Round 005: test acc mean=0.0543 ± 0.0042 | min=0.0486 max=0.0623
         : test loss mean=889107055.4962 ± 3210541871.8217
         : individual accs = ['0.050630', '0.052819', '0.061505', '0.049850', '0.052066', '0.052951', '0.052707', '0.052656', '0.057266', '0.048632', '0.051895', '0.054853', '0.062301', '0.049083', '0.055281', '0.061554', '0.050566', '0.052116', '0.060235', '0.057413']
         : correct/total = [(209, 4128), (222, 4203), (251, 4081), (216, 4333), (213, 4091), (227, 4287), (221, 4193), (229, 4349), (240, 4191), (208, 4277), (215, 4143), (230, 4193), (255, 4093), (206, 4197), (224, 4052), (248, 4029), (210, 4153), (218, 4183), (246, 4084), (237, 4128)]
         : compromised: 0.0510, honest: 0.0547
Round 006: test acc mean=0.0525 ± 0.0041 | min=0.0466 max=0.0615
         : test loss mean=177999063.5018 ± 686260933.3942
         : individual accs = ['0.049661', '0.052819', '0.061505', '0.046619', '0.052066', '0.051318', '0.053422', '0.046907', '0.057266', '0.050035', '0.051895', '0.054853', '0.047642', '0.047653', '0.055281', '0.051874', '0.050566', '0.051159', '0.060235', '0.057413']
         : correct/total = [(205, 4128), (222, 4203), (251, 4081), (202, 4333), (213, 4091), (220, 4287), (224, 4193), (204, 4349), (240, 4191), (214, 4277), (215, 4143), (230, 4193), (195, 4093), (200, 4197), (224, 4052), (209, 4029), (210, 4153), (214, 4183), (246, 4084), (237, 4128)]
         : compromised: 0.0495, honest: 0.0528
Round 007: test acc mean=0.0523 ± 0.0040 | min=0.0457 max=0.0615
         : test loss mean=179501909.9991 ± 623605816.0549
         : individual accs = ['0.049661', '0.052819', '0.061505', '0.049850', '0.045710', '0.052951', '0.053422', '0.046447', '0.057266', '0.050035', '0.051171', '0.054853', '0.052040', '0.049083', '0.055281', '0.046910', '0.050566', '0.057853', '0.050196', '0.057413']
         : correct/total = [(205, 4128), (222, 4203), (251, 4081), (216, 4333), (187, 4091), (227, 4287), (224, 4193), (202, 4349), (240, 4191), (214, 4277), (212, 4143), (230, 4193), (213, 4093), (206, 4197), (224, 4052), (189, 4029), (210, 4153), (242, 4183), (205, 4084), (237, 4128)]
         : compromised: 0.0510, honest: 0.0524
Round 008: test acc mean=0.0533 ± 0.0045 | min=0.0469 max=0.0623
         : test loss mean=101774678.7133 ± 403156596.5207
         : individual accs = ['0.049661', '0.052819', '0.061505', '0.047542', '0.052066', '0.051318', '0.053422', '0.046907', '0.057266', '0.048632', '0.051895', '0.054853', '0.062301', '0.046938', '0.055281', '0.051874', '0.050566', '0.052833', '0.060235', '0.057413']
         : correct/total = [(205, 4128), (222, 4203), (251, 4081), (206, 4333), (213, 4091), (220, 4287), (224, 4193), (204, 4349), (240, 4191), (208, 4277), (215, 4143), (230, 4193), (255, 4093), (197, 4197), (224, 4052), (209, 4029), (210, 4153), (221, 4183), (246, 4084), (237, 4128)]
         : compromised: 0.0491, honest: 0.0537
Round 009: test acc mean=0.0535 ± 0.0048 | min=0.0438 max=0.0623
         : test loss mean=32812057.9849 ± 132236920.9528
         : individual accs = ['0.049661', '0.052819', '0.061505', '0.043850', '0.052066', '0.052018', '0.053422', '0.052656', '0.057266', '0.048632', '0.051895', '0.054853', '0.062301', '0.049083', '0.055281', '0.046910', '0.050566', '0.057853', '0.060235', '0.057413']
         : correct/total = [(205, 4128), (222, 4203), (251, 4081), (190, 4333), (213, 4091), (223, 4287), (224, 4193), (229, 4349), (240, 4191), (208, 4277), (215, 4143), (230, 4193), (255, 4093), (206, 4197), (224, 4052), (189, 4029), (210, 4153), (242, 4183), (246, 4084), (237, 4128)]
         : compromised: 0.0506, honest: 0.0538
Round 010: test acc mean=0.0528 ± 0.0041 | min=0.0455 max=0.0615
         : test loss mean=21806060.7460 ± 87394221.1977
         : individual accs = ['0.049661', '0.052819', '0.061505', '0.048927', '0.052066', '0.045486', '0.053422', '0.050586', '0.057266', '0.048632', '0.051895', '0.054853', '0.051796', '0.054801', '0.055281', '0.051874', '0.050566', '0.046378', '0.060235', '0.057413']
         : correct/total = [(205, 4128), (222, 4203), (251, 4081), (212, 4333), (213, 4091), (195, 4287), (224, 4193), (220, 4349), (240, 4191), (208, 4277), (215, 4143), (230, 4193), (212, 4093), (230, 4197), (224, 4052), (209, 4029), (210, 4153), (194, 4183), (246, 4084), (237, 4128)]
         : compromised: 0.0501, honest: 0.0531

=== FINAL RESULTS ===
Dataset: femnist, Nodes: 20, Graph: erdos, Aggregation: d-fedavg
Attack: directed_deviation, 10.0% compromised
Final accuracy - Compromised: 0.0501, Honest: 0.0531
Overall test accuracy: mean=0.0528 ± 0.0041
