Device: cuda
Seed: 987654321
Loading 36 LEAF FEMNIST train files...
LEAF FEMNIST train: 3597 users, 734463 samples
Loading 36 LEAF FEMNIST test files...
LEAF FEMNIST test: 3597 users, 83388 samples
Found 3597 train users, 3597 test users, 3597 common users
User sample counts range: 525 (max) to 17 (min)
Distributed ALL 3597 users across 20 clients
Users per client: 179 (with 17 clients getting +1 user)
Train partition sizes: [36360, 37070, 35957, 38262, 36024, 37732, 36921, 38328, 36867, 37683, 36507, 36915, 36007, 37001, 35681, 35453, 36585, 36801, 35964, 36345]
Test partition sizes: [4128, 4203, 4081, 4333, 4091, 4287, 4193, 4349, 4191, 4277, 4143, 4193, 4093, 4197, 4052, 4029, 4153, 4183, 4084, 4128]
  Client 0: 36360 train samples, 62 unique classes
  Client 1: 37070 train samples, 62 unique classes
  Client 2: 35957 train samples, 62 unique classes
  Client 3: 38262 train samples, 62 unique classes
  Client 4: 36024 train samples, 62 unique classes
  Client 5: 37732 train samples, 62 unique classes
  Client 6: 36921 train samples, 62 unique classes
  Client 7: 38328 train samples, 62 unique classes
  Client 8: 36867 train samples, 62 unique classes
  Client 9: 37683 train samples, 62 unique classes
  Client 10: 36507 train samples, 62 unique classes
  Client 11: 36915 train samples, 62 unique classes
  Client 12: 36007 train samples, 62 unique classes
  Client 13: 37001 train samples, 62 unique classes
  Client 14: 35681 train samples, 62 unique classes
  Client 15: 35453 train samples, 62 unique classes
  Client 16: 36585 train samples, 62 unique classes
  Client 17: 36801 train samples, 62 unique classes
  Client 18: 35964 train samples, 62 unique classes
  Client 19: 36345 train samples, 62 unique classes
Will sample 4500 samples per client per epoch
Graph: erdos, nodes: 20, edges: 48
Degree statistics: avg=4.80, min=2, max=7
Attack: Compromised 2/20 nodes: [5, 13]
Attack type: krum, lambda: 1.0
Model variant: baseline
Model parameters: 6,603,710
UBAR ALGORITHM (Two-Stage Byzantine-resilient)
  - Model dimension: 6,603,710 parameters
  - Rho parameter: 0.9
  - Stage 1: Distance-based filtering (select 90% closest neighbors)
  - Stage 2: Performance-based selection (loss comparison)
  - Complexity: O(deg(i)×d + deg(i)×inference)
Initial test acc across nodes: mean=0.0168 ± 0.0139
Round 001: test acc mean=0.0555 ± 0.0059 | min=0.0457 max=0.0683
         : test loss mean=3.9942 ± 0.0362
         : individual accs = ['0.059593', '0.051630', '0.057584', '0.068313', '0.057932', '0.068113', '0.057000', '0.049207', '0.049630', '0.050035', '0.056481', '0.053899', '0.062790', '0.045747', '0.051579', '0.050633', '0.058271', '0.050920', '0.057052', '0.054506']
         : correct/total = [(246, 4128), (217, 4203), (235, 4081), (296, 4333), (237, 4091), (292, 4287), (239, 4193), (214, 4349), (208, 4191), (214, 4277), (234, 4143), (226, 4193), (257, 4093), (192, 4197), (209, 4052), (204, 4029), (242, 4153), (213, 4183), (233, 4084), (225, 4128)]
         : compromised: 0.0569, honest: 0.0554
         : ubar stats = ['Node 0: s1=0.833, s2=1.000', 'Node 1: s1=0.833, s2=0.800', 'Node 2: s1=0.800, s2=0.250']...
Round 002: test acc mean=0.0529 ± 0.0059 | min=0.0446 max=0.0698
         : test loss mean=3.8296 ± 0.0825
         : individual accs = ['0.044574', '0.051630', '0.069836', '0.052850', '0.057932', '0.048752', '0.044598', '0.058174', '0.051062', '0.048398', '0.055274', '0.053899', '0.049597', '0.062426', '0.046150', '0.050633', '0.054418', '0.050920', '0.055583', '0.050388']
         : correct/total = [(184, 4128), (217, 4203), (285, 4081), (229, 4333), (237, 4091), (209, 4287), (187, 4193), (253, 4349), (214, 4191), (207, 4277), (229, 4143), (226, 4193), (203, 4093), (262, 4197), (187, 4052), (204, 4029), (226, 4153), (213, 4183), (227, 4084), (208, 4128)]
         : compromised: 0.0556, honest: 0.0526
         : ubar stats = ['Node 0: s1=0.833, s2=1.000', 'Node 1: s1=0.833, s2=0.600', 'Node 2: s1=0.800, s2=0.625']...
Round 003: test acc mean=0.0539 ± 0.0048 | min=0.0457 max=0.0618
         : test loss mean=3.7827 ± 0.0516
         : individual accs = ['0.059593', '0.050916', '0.050723', '0.052850', '0.057932', '0.050618', '0.049130', '0.058634', '0.047960', '0.047697', '0.055274', '0.061770', '0.058637', '0.045747', '0.061204', '0.056342', '0.058271', '0.050920', '0.052889', '0.050388']
         : correct/total = [(246, 4128), (214, 4203), (207, 4081), (229, 4333), (237, 4091), (217, 4287), (206, 4193), (255, 4349), (201, 4191), (204, 4277), (229, 4143), (259, 4193), (240, 4093), (192, 4197), (248, 4052), (227, 4029), (242, 4153), (213, 4183), (216, 4084), (208, 4128)]
         : compromised: 0.0482, honest: 0.0545
         : ubar stats = ['Node 0: s1=0.833, s2=1.000', 'Node 1: s1=0.833, s2=0.467', 'Node 2: s1=0.800, s2=0.583']...
Round 004: test acc mean=0.0546 ± 0.0059 | min=0.0439 max=0.0650
         : test loss mean=3.7262 ± 0.0407
         : individual accs = ['0.059593', '0.064954', '0.057584', '0.052850', '0.057932', '0.050618', '0.043883', '0.058634', '0.049630', '0.053075', '0.045619', '0.053899', '0.059370', '0.062426', '0.061204', '0.056590', '0.058271', '0.048291', '0.052889', '0.045058']
         : correct/total = [(246, 4128), (273, 4203), (235, 4081), (229, 4333), (237, 4091), (217, 4287), (184, 4193), (255, 4349), (208, 4191), (227, 4277), (189, 4143), (226, 4193), (243, 4093), (262, 4197), (248, 4052), (228, 4029), (242, 4153), (202, 4183), (216, 4084), (186, 4128)]
         : compromised: 0.0565, honest: 0.0544
         : ubar stats = ['Node 0: s1=0.833, s2=0.900', 'Node 1: s1=0.833, s2=0.400', 'Node 2: s1=0.800, s2=0.500']...
Round 005: test acc mean=0.0556 ± 0.0112 | min=0.0420 max=0.0958
         : test loss mean=3.7069 ± 0.0278
         : individual accs = ['0.059593', '0.052344', '0.057584', '0.071544', '0.057932', '0.043387', '0.057000', '0.047827', '0.047960', '0.053776', '0.041999', '0.053899', '0.095773', '0.046938', '0.051579', '0.054852', '0.058271', '0.050920', '0.052889', '0.055475']
         : correct/total = [(246, 4128), (220, 4203), (235, 4081), (310, 4333), (237, 4091), (186, 4287), (239, 4193), (208, 4349), (201, 4191), (230, 4277), (174, 4143), (226, 4193), (392, 4093), (197, 4197), (209, 4052), (221, 4029), (242, 4153), (213, 4183), (216, 4084), (229, 4128)]
         : compromised: 0.0452, honest: 0.0567
         : ubar stats = ['Node 0: s1=0.833, s2=0.880', 'Node 1: s1=0.833, s2=0.360', 'Node 2: s1=0.800, s2=0.450']...
Round 006: test acc mean=0.0539 ± 0.0053 | min=0.0434 max=0.0624
         : test loss mean=3.6899 ± 0.0182
         : individual accs = ['0.044574', '0.051630', '0.057584', '0.052850', '0.057932', '0.043387', '0.057000', '0.047827', '0.053209', '0.053776', '0.050447', '0.061770', '0.058392', '0.062426', '0.061204', '0.051378', '0.058271', '0.050920', '0.055583', '0.048450']
         : correct/total = [(184, 4128), (217, 4203), (235, 4081), (229, 4333), (237, 4091), (186, 4287), (239, 4193), (208, 4349), (223, 4191), (230, 4277), (209, 4143), (259, 4193), (239, 4093), (262, 4197), (248, 4052), (207, 4029), (242, 4153), (213, 4183), (227, 4084), (200, 4128)]
         : compromised: 0.0529, honest: 0.0540
         : ubar stats = ['Node 0: s1=0.833, s2=0.900', 'Node 1: s1=0.833, s2=0.333', 'Node 2: s1=0.800, s2=0.417']...
Round 007: test acc mean=0.0551 ± 0.0045 | min=0.0435 max=0.0624
         : test loss mean=3.6865 ± 0.0137
         : individual accs = ['0.059593', '0.052344', '0.057584', '0.052850', '0.047421', '0.050618', '0.057477', '0.058174', '0.053209', '0.043488', '0.055998', '0.053899', '0.058637', '0.062426', '0.061698', '0.056590', '0.058271', '0.050920', '0.055583', '0.055475']
         : correct/total = [(246, 4128), (220, 4203), (235, 4081), (229, 4333), (194, 4091), (217, 4287), (241, 4193), (253, 4349), (223, 4191), (186, 4277), (232, 4143), (226, 4193), (240, 4093), (262, 4197), (250, 4052), (228, 4029), (242, 4153), (213, 4183), (227, 4084), (229, 4128)]
         : compromised: 0.0565, honest: 0.0550
         : ubar stats = ['Node 0: s1=0.833, s2=0.800', 'Node 1: s1=0.833, s2=0.429', 'Node 2: s1=0.800, s2=0.464']...
Round 008: test acc mean=0.0601 ± 0.0115 | min=0.0448 max=0.0876
         : test loss mean=3.6861 ± 0.0179
         : individual accs = ['0.059835', '0.076612', '0.050723', '0.044773', '0.084331', '0.050618', '0.057000', '0.051276', '0.053209', '0.053776', '0.072653', '0.053899', '0.058637', '0.062426', '0.087611', '0.056590', '0.055141', '0.049486', '0.055583', '0.068314']
         : correct/total = [(247, 4128), (322, 4203), (207, 4081), (194, 4333), (345, 4091), (217, 4287), (239, 4193), (223, 4349), (223, 4191), (230, 4277), (301, 4143), (226, 4193), (240, 4093), (262, 4197), (355, 4052), (228, 4029), (229, 4153), (207, 4183), (227, 4084), (282, 4128)]
         : compromised: 0.0565, honest: 0.0605
         : ubar stats = ['Node 0: s1=0.833, s2=0.775', 'Node 1: s1=0.833, s2=0.425', 'Node 2: s1=0.800, s2=0.469']...
Round 009: test acc mean=0.0534 ± 0.0043 | min=0.0439 max=0.0624
         : test loss mean=3.6827 ± 0.0153
         : individual accs = ['0.059593', '0.050916', '0.052683', '0.052850', '0.051088', '0.050618', '0.050799', '0.043918', '0.049630', '0.053776', '0.055998', '0.053899', '0.058637', '0.062426', '0.051826', '0.051626', '0.051047', '0.050203', '0.060725', '0.055475']
         : correct/total = [(246, 4128), (214, 4203), (215, 4081), (229, 4333), (209, 4091), (217, 4287), (213, 4193), (191, 4349), (208, 4191), (230, 4277), (232, 4143), (226, 4193), (240, 4093), (262, 4197), (210, 4052), (208, 4029), (212, 4153), (210, 4183), (248, 4084), (229, 4128)]
         : compromised: 0.0565, honest: 0.0530
         : ubar stats = ['Node 0: s1=0.833, s2=0.756', 'Node 1: s1=0.833, s2=0.400', 'Node 2: s1=0.800, s2=0.500']...
Round 010: test acc mean=0.0559 ± 0.0039 | min=0.0480 max=0.0624
         : test loss mean=3.6809 ± 0.0172
         : individual accs = ['0.059593', '0.051630', '0.057584', '0.052850', '0.057932', '0.060182', '0.049130', '0.058174', '0.047960', '0.053776', '0.055998', '0.053899', '0.058637', '0.062426', '0.061204', '0.056342', '0.058271', '0.050920', '0.055583', '0.055475']
         : correct/total = [(246, 4128), (217, 4203), (235, 4081), (229, 4333), (237, 4091), (258, 4287), (206, 4193), (253, 4349), (201, 4191), (230, 4277), (232, 4143), (226, 4193), (240, 4093), (262, 4197), (248, 4052), (227, 4029), (242, 4153), (213, 4183), (227, 4084), (229, 4128)]
         : compromised: 0.0613, honest: 0.0553
         : ubar stats = ['Node 0: s1=0.833, s2=0.740', 'Node 1: s1=0.833, s2=0.380', 'Node 2: s1=0.800, s2=0.550']...

=== FINAL RESULTS ===
Dataset: femnist, Nodes: 20, Graph: erdos, Aggregation: ubar
Attack: krum, 10.0% compromised
Final accuracy - Compromised: 0.0613, Honest: 0.0553
Overall test accuracy: mean=0.0559 ± 0.0039

=== UBAR SUMMARY ===
Node 0: stage1=0.833, stage2=0.740, overall=0.617
Node 1: stage1=0.833, stage2=0.380, overall=0.317
Node 2: stage1=0.800, stage2=0.550, overall=0.440
Node 3: stage1=0.750, stage2=0.633, overall=0.475
Node 4: stage1=0.750, stage2=0.600, overall=0.450
Node 5: stage1=0.800, stage2=0.350, overall=0.280
Node 6: stage1=0.800, stage2=0.575, overall=0.460
Node 7: stage1=0.800, stage2=0.525, overall=0.420
Node 8: stage1=0.500, stage2=1.000, overall=0.500
Node 9: stage1=0.667, stage2=0.800, overall=0.533
Node 10: stage1=0.750, stage2=0.467, overall=0.350
Node 11: stage1=0.857, stage2=0.367, overall=0.314
Node 12: stage1=0.857, stage2=0.450, overall=0.386
Node 13: stage1=0.750, stage2=0.533, overall=0.400
Node 14: stage1=0.857, stage2=0.567, overall=0.486
Node 15: stage1=0.833, stage2=0.520, overall=0.433
Node 16: stage1=0.800, stage2=0.475, overall=0.380
Node 17: stage1=0.800, stage2=0.350, overall=0.280
Node 18: stage1=0.750, stage2=0.733, overall=0.550
Node 19: stage1=0.500, stage2=1.000, overall=0.500

=== PARALLEL EXECUTION TIME (realistic for distributed system) ===
  COMMUNICATION (max across nodes):
    - Full model transfer: 0.000s (0.0%)
  COMPUTATION (max across nodes):
    - Distance computation: 0.035s (0.8%)
    - Loss computation: 4.182s (98.9%)
    - Aggregation: 0.010s (0.2%)
  TOTALS:
    - Total computation: 4.227s (100.0%)
    - Total communication: 0.000s (0.0%)
    - Total parallel time: 4.227s

=== PER-NODE AVERAGE TIME ===
  - Distance computation: 0.020s
  - Loss computation: 3.907s
  - Aggregation: 0.006s
  - Model transfer: 0.000s
  - Total per node: 3.933s

=== TOTAL COMPUTATIONAL WORK (sum across all nodes) ===
  - Total distance computation: 0.403s
  - Total loss computation: 78.139s
  - Total aggregation: 0.117s
  - Total model transfer: 0.000s
  - Grand total: 78.658s
  - Mean Stage 1 acceptance rate: 0.764
  - Mean Stage 2 acceptance rate: 0.581
  - Overall acceptance rate: 0.444

UBAR Algorithm Properties:
  - Model dimension: 6,603,710
  - Rho parameter: 0.9
  - Two-stage approach: Distance filtering + loss evaluation
  - Stage 1 selects: 90% of neighbors
  - Stage 2 uses: Training sample loss comparison
  - Theoretical complexity: O(deg(i)×d + deg(i)×inference)
  - Approach: UBAR paper implementation
