Device: cuda
Seed: 987654321
Loading 36 LEAF FEMNIST train files...
LEAF FEMNIST train: 3597 users, 734463 samples
Loading 36 LEAF FEMNIST test files...
LEAF FEMNIST test: 3597 users, 83388 samples
Found 3597 train users, 3597 test users, 3597 common users
User sample counts range: 525 (max) to 17 (min)
Distributed ALL 3597 users across 20 clients
Users per client: 179 (with 17 clients getting +1 user)
Train partition sizes: [36360, 37070, 35957, 38262, 36024, 37732, 36921, 38328, 36867, 37683, 36507, 36915, 36007, 37001, 35681, 35453, 36585, 36801, 35964, 36345]
Test partition sizes: [4128, 4203, 4081, 4333, 4091, 4287, 4193, 4349, 4191, 4277, 4143, 4193, 4093, 4197, 4052, 4029, 4153, 4183, 4084, 4128]
  Client 0: 36360 train samples, 62 unique classes
  Client 1: 37070 train samples, 62 unique classes
  Client 2: 35957 train samples, 62 unique classes
  Client 3: 38262 train samples, 62 unique classes
  Client 4: 36024 train samples, 62 unique classes
  Client 5: 37732 train samples, 62 unique classes
  Client 6: 36921 train samples, 62 unique classes
  Client 7: 38328 train samples, 62 unique classes
  Client 8: 36867 train samples, 62 unique classes
  Client 9: 37683 train samples, 62 unique classes
  Client 10: 36507 train samples, 62 unique classes
  Client 11: 36915 train samples, 62 unique classes
  Client 12: 36007 train samples, 62 unique classes
  Client 13: 37001 train samples, 62 unique classes
  Client 14: 35681 train samples, 62 unique classes
  Client 15: 35453 train samples, 62 unique classes
  Client 16: 36585 train samples, 62 unique classes
  Client 17: 36801 train samples, 62 unique classes
  Client 18: 35964 train samples, 62 unique classes
  Client 19: 36345 train samples, 62 unique classes
Will sample 4500 samples per client per epoch
Graph: ring, nodes: 20, edges: 20
Degree statistics: avg=2.00, min=2, max=2
Attack: Compromised 10/20 nodes: [1, 2, 5, 11, 12, 13, 14, 15, 17, 18]
Attack type: gaussian, lambda: 1.0
Model variant: baseline
Model parameters: 6,603,710
UBAR ALGORITHM (Two-Stage Byzantine-resilient)
  - Model dimension: 6,603,710 parameters
  - Rho parameter: 0.5
  - Stage 1: Distance-based filtering (select 50% closest neighbors)
  - Stage 2: Performance-based selection (loss comparison)
  - Complexity: O(deg(i)×d + deg(i)×inference)
Initial test acc across nodes: mean=0.0168 ± 0.0139
Round 001: test acc mean=0.0421 ± 0.0172 | min=0.0046 max=0.0608
         : test loss mean=131083881.3355 ± 264463838.1467
         : individual accs = ['0.049661', '0.052344', '0.055134', '0.043157', '0.043021', '0.048519', '0.044598', '0.049207', '0.047960', '0.050503', '0.055274', '0.060816', '0.016614', '0.008578', '0.005923', '0.050385', '0.004575', '0.050920', '0.054358', '0.050145']
         : correct/total = [(205, 4128), (220, 4203), (225, 4081), (187, 4333), (176, 4091), (208, 4287), (187, 4193), (214, 4349), (201, 4191), (216, 4277), (229, 4143), (255, 4193), (68, 4093), (36, 4197), (24, 4052), (203, 4029), (19, 4153), (213, 4183), (222, 4084), (207, 4128)]
         : compromised: 0.0404, honest: 0.0438
         : ubar stats = ['Node 0: s1=0.500, s2=1.000', 'Node 1: s1=0.500, s2=1.000', 'Node 2: s1=0.500, s2=1.000']...
Round 002: test acc mean=0.0478 ± 0.0114 | min=0.0062 max=0.0582
         : test loss mean=2907631693876.5239 ± 12462887172775.1660
         : individual accs = ['0.051599', '0.046158', '0.057584', '0.052850', '0.057932', '0.050618', '0.057000', '0.058174', '0.051062', '0.048398', '0.045619', '0.046983', '0.048620', '0.045747', '0.051579', '0.006205', '0.049362', '0.028688', '0.052889', '0.048450']
         : correct/total = [(213, 4128), (194, 4203), (235, 4081), (229, 4333), (237, 4091), (217, 4287), (239, 4193), (253, 4349), (214, 4191), (207, 4277), (189, 4143), (197, 4193), (199, 4093), (192, 4197), (209, 4052), (25, 4029), (205, 4153), (120, 4183), (216, 4084), (200, 4128)]
         : compromised: 0.0435, honest: 0.0520
         : ubar stats = ['Node 0: s1=0.500, s2=1.000', 'Node 1: s1=0.500, s2=1.000', 'Node 2: s1=0.500, s2=1.000']...
Round 003: test acc mean=0.0519 ± 0.0068 | min=0.0364 max=0.0727
         : test loss mean=nan ± nan
         : individual accs = ['0.059593', '0.050916', '0.050723', '0.052850', '0.057932', '0.050618', '0.044598', '0.049207', '0.051539', '0.047463', '0.055274', '0.053184', '0.036404', '0.045747', '0.051579', '0.051378', '0.051047', '0.049486', '0.072723', '0.055475']
         : correct/total = [(246, 4128), (214, 4203), (207, 4081), (229, 4333), (237, 4091), (217, 4287), (187, 4193), (214, 4349), (216, 4191), (203, 4277), (229, 4143), (223, 4193), (149, 4093), (192, 4197), (209, 4052), (207, 4029), (212, 4153), (207, 4183), (297, 4084), (229, 4128)]
         : compromised: 0.0513, honest: 0.0525
         : ubar stats = ['Node 0: s1=0.500, s2=1.000', 'Node 1: s1=0.500, s2=1.000', 'Node 2: s1=0.500, s2=1.000']...
Round 004: test acc mean=0.0586 ± 0.0161 | min=0.0456 max=0.0974
         : test loss mean=nan ± nan
         : individual accs = ['0.097384', '0.052344', '0.057584', '0.052850', '0.057932', '0.051085', '0.082518', '0.086917', '0.049630', '0.048398', '0.045619', '0.046983', '0.048620', '0.045747', '0.051579', '0.051378', '0.051047', '0.049486', '0.052889', '0.092539']
         : correct/total = [(402, 4128), (220, 4203), (235, 4081), (229, 4333), (237, 4091), (219, 4287), (346, 4193), (378, 4349), (208, 4191), (207, 4277), (189, 4143), (197, 4193), (199, 4093), (192, 4197), (209, 4052), (207, 4029), (212, 4153), (207, 4183), (216, 4084), (382, 4128)]
         : compromised: 0.0508, honest: 0.0665
         : ubar stats = ['Node 0: s1=0.500, s2=1.000', 'Node 1: s1=0.500, s2=1.000', 'Node 2: s1=0.500, s2=1.000']...
Round 005: test acc mean=0.0581 ± 0.0155 | min=0.0378 max=0.1009
         : test loss mean=nan ± nan
         : individual accs = ['0.089874', '0.052344', '0.072286', '0.054466', '0.059399', '0.050618', '0.046745', '0.047827', '0.100931', '0.053776', '0.055998', '0.054853', '0.048620', '0.045747', '0.037759', '0.051378', '0.051047', '0.049486', '0.056317', '0.081638']
         : correct/total = [(371, 4128), (220, 4203), (295, 4081), (236, 4333), (243, 4091), (217, 4287), (196, 4193), (208, 4349), (423, 4191), (230, 4277), (232, 4143), (230, 4193), (199, 4093), (192, 4197), (153, 4052), (207, 4029), (212, 4153), (207, 4183), (230, 4084), (337, 4128)]
         : compromised: 0.0519, honest: 0.0642
         : ubar stats = ['Node 0: s1=0.500, s2=1.000', 'Node 1: s1=0.500, s2=1.000', 'Node 2: s1=0.500, s2=1.000']...
Round 006: test acc mean=0.0558 ± 0.0074 | min=0.0439 max=0.0770
         : test loss mean=nan ± nan
         : individual accs = ['0.077035', '0.062099', '0.057584', '0.052850', '0.057932', '0.051318', '0.043883', '0.053346', '0.053448', '0.054711', '0.052378', '0.061770', '0.048620', '0.055278', '0.051826', '0.051378', '0.054418', '0.049486', '0.055583', '0.071221']
         : correct/total = [(318, 4128), (261, 4203), (235, 4081), (229, 4333), (237, 4091), (220, 4287), (184, 4193), (232, 4349), (224, 4191), (234, 4277), (217, 4143), (259, 4193), (199, 4093), (232, 4197), (210, 4052), (207, 4029), (226, 4153), (207, 4183), (227, 4084), (294, 4128)]
         : compromised: 0.0545, honest: 0.0571
         : ubar stats = ['Node 0: s1=0.500, s2=1.000', 'Node 1: s1=0.500, s2=1.000', 'Node 2: s1=0.500, s2=1.000']...
Round 007: test acc mean=0.0656 ± 0.0282 | min=0.0445 max=0.1410
         : test loss mean=nan ± nan
         : individual accs = ['0.140988', '0.052344', '0.057584', '0.044773', '0.047421', '0.076044', '0.097544', '0.092205', '0.053686', '0.055413', '0.056722', '0.053899', '0.048620', '0.045747', '0.051333', '0.056342', '0.044546', '0.049486', '0.050930', '0.136386']
         : correct/total = [(582, 4128), (220, 4203), (235, 4081), (194, 4333), (194, 4091), (326, 4287), (409, 4193), (401, 4349), (225, 4191), (237, 4277), (235, 4143), (226, 4193), (199, 4093), (192, 4197), (208, 4052), (227, 4029), (185, 4153), (207, 4183), (208, 4084), (563, 4128)]
         : compromised: 0.0542, honest: 0.0770
         : ubar stats = ['Node 0: s1=0.500, s2=1.000', 'Node 1: s1=0.500, s2=1.000', 'Node 2: s1=0.500, s2=1.000']...
Round 008: test acc mean=0.0706 ± 0.0301 | min=0.0445 max=0.1514
         : test loss mean=nan ± nan
         : individual accs = ['0.151405', '0.110635', '0.053908', '0.085160', '0.087509', '0.053884', '0.049130', '0.051276', '0.089955', '0.067103', '0.068791', '0.053899', '0.048620', '0.049083', '0.051826', '0.051378', '0.044546', '0.049486', '0.057052', '0.137112']
         : correct/total = [(625, 4128), (465, 4203), (220, 4081), (369, 4333), (358, 4091), (231, 4287), (206, 4193), (223, 4349), (377, 4191), (287, 4277), (285, 4143), (226, 4193), (199, 4093), (206, 4197), (210, 4052), (207, 4029), (185, 4153), (207, 4183), (233, 4084), (566, 4128)]
         : compromised: 0.0580, honest: 0.0832
         : ubar stats = ['Node 0: s1=0.500, s2=1.000', 'Node 1: s1=0.500, s2=1.000', 'Node 2: s1=0.500, s2=1.000']...
Round 009: test acc mean=0.0569 ± 0.0083 | min=0.0456 max=0.0770
         : test loss mean=nan ± nan
         : individual accs = ['0.061773', '0.050916', '0.057584', '0.054927', '0.058910', '0.076977', '0.070832', '0.059784', '0.060606', '0.048632', '0.045619', '0.054853', '0.048620', '0.049083', '0.051826', '0.054852', '0.054418', '0.049486', '0.073457', '0.055717']
         : correct/total = [(255, 4128), (214, 4203), (235, 4081), (238, 4333), (241, 4091), (330, 4287), (297, 4193), (260, 4349), (254, 4191), (208, 4277), (189, 4143), (230, 4193), (199, 4093), (206, 4197), (210, 4052), (221, 4029), (226, 4153), (207, 4183), (300, 4084), (230, 4128)]
         : compromised: 0.0568, honest: 0.0571
         : ubar stats = ['Node 0: s1=0.500, s2=1.000', 'Node 1: s1=0.500, s2=1.000', 'Node 2: s1=0.500, s2=1.000']...
Round 010: test acc mean=0.0671 ± 0.0230 | min=0.0486 max=0.1330
         : test loss mean=nan ± nan
         : individual accs = ['0.104167', '0.100404', '0.058074', '0.052850', '0.057932', '0.132960', '0.055092', '0.058634', '0.053448', '0.053776', '0.055998', '0.079180', '0.048620', '0.049083', '0.051826', '0.054852', '0.052011', '0.049486', '0.079334', '0.095203']
         : correct/total = [(430, 4128), (422, 4203), (237, 4081), (229, 4333), (237, 4091), (570, 4287), (231, 4193), (255, 4349), (224, 4191), (230, 4277), (232, 4143), (332, 4193), (199, 4093), (206, 4197), (210, 4052), (221, 4029), (216, 4153), (207, 4183), (324, 4084), (393, 4128)]
         : compromised: 0.0704, honest: 0.0639
         : ubar stats = ['Node 0: s1=0.500, s2=1.000', 'Node 1: s1=0.500, s2=1.000', 'Node 2: s1=0.500, s2=1.000']...

=== FINAL RESULTS ===
Dataset: femnist, Nodes: 20, Graph: ring, Aggregation: ubar
Attack: gaussian, 50.0% compromised
Final accuracy - Compromised: 0.0704, Honest: 0.0639
Overall test accuracy: mean=0.0671 ± 0.0230

=== UBAR SUMMARY ===
Node 0: stage1=0.500, stage2=1.000, overall=0.500
Node 1: stage1=0.500, stage2=1.000, overall=0.500
Node 2: stage1=0.500, stage2=1.000, overall=0.500
Node 3: stage1=0.500, stage2=1.000, overall=0.500
Node 4: stage1=0.500, stage2=1.000, overall=0.500
Node 5: stage1=0.500, stage2=1.000, overall=0.500
Node 6: stage1=0.500, stage2=1.000, overall=0.500
Node 7: stage1=0.500, stage2=1.000, overall=0.500
Node 8: stage1=0.500, stage2=1.000, overall=0.500
Node 9: stage1=0.500, stage2=1.000, overall=0.500
Node 10: stage1=0.500, stage2=1.000, overall=0.500
Node 11: stage1=0.500, stage2=1.000, overall=0.500
Node 12: stage1=0.500, stage2=1.000, overall=0.500
Node 13: stage1=0.500, stage2=1.000, overall=0.500
Node 14: stage1=0.500, stage2=1.000, overall=0.500
Node 15: stage1=0.500, stage2=1.000, overall=0.500
Node 16: stage1=0.500, stage2=1.000, overall=0.500
Node 17: stage1=0.500, stage2=1.000, overall=0.500
Node 18: stage1=0.500, stage2=1.000, overall=0.500
Node 19: stage1=0.500, stage2=1.000, overall=0.500

=== PARALLEL EXECUTION TIME (realistic for distributed system) ===
  COMMUNICATION (max across nodes):
    - Full model transfer: 0.000s (0.0%)
  COMPUTATION (max across nodes):
    - Distance computation: 0.026s (0.6%)
    - Loss computation: 4.181s (98.9%)
    - Aggregation: 0.020s (0.5%)
  TOTALS:
    - Total computation: 4.228s (100.0%)
    - Total communication: 0.000s (0.0%)
    - Total parallel time: 4.228s

=== PER-NODE AVERAGE TIME ===
  - Distance computation: 0.012s
  - Loss computation: 3.944s
  - Aggregation: 0.008s
  - Model transfer: 0.000s
  - Total per node: 3.964s

=== TOTAL COMPUTATIONAL WORK (sum across all nodes) ===
  - Total distance computation: 0.238s
  - Total loss computation: 78.878s
  - Total aggregation: 0.155s
  - Total model transfer: 0.000s
  - Grand total: 79.271s
  - Mean Stage 1 acceptance rate: 0.500
  - Mean Stage 2 acceptance rate: 1.000
  - Overall acceptance rate: 0.500

UBAR Algorithm Properties:
  - Model dimension: 6,603,710
  - Rho parameter: 0.5
  - Two-stage approach: Distance filtering + loss evaluation
  - Stage 1 selects: 50% of neighbors
  - Stage 2 uses: Training sample loss comparison
  - Theoretical complexity: O(deg(i)×d + deg(i)×inference)
  - Approach: UBAR paper implementation
