Device: cuda
Seed: 987654321
Loading 36 LEAF FEMNIST train files...
LEAF FEMNIST train: 3597 users, 734463 samples
Loading 36 LEAF FEMNIST test files...
LEAF FEMNIST test: 3597 users, 83388 samples
Found 3597 train users, 3597 test users, 3597 common users
User sample counts range: 525 (max) to 17 (min)
Distributed ALL 3597 users across 20 clients
Users per client: 179 (with 17 clients getting +1 user)
Train partition sizes: [36360, 37070, 35957, 38262, 36024, 37732, 36921, 38328, 36867, 37683, 36507, 36915, 36007, 37001, 35681, 35453, 36585, 36801, 35964, 36345]
Test partition sizes: [4128, 4203, 4081, 4333, 4091, 4287, 4193, 4349, 4191, 4277, 4143, 4193, 4093, 4197, 4052, 4029, 4153, 4183, 4084, 4128]
  Client 0: 36360 train samples, 62 unique classes
  Client 1: 37070 train samples, 62 unique classes
  Client 2: 35957 train samples, 62 unique classes
  Client 3: 38262 train samples, 62 unique classes
  Client 4: 36024 train samples, 62 unique classes
  Client 5: 37732 train samples, 62 unique classes
  Client 6: 36921 train samples, 62 unique classes
  Client 7: 38328 train samples, 62 unique classes
  Client 8: 36867 train samples, 62 unique classes
  Client 9: 37683 train samples, 62 unique classes
  Client 10: 36507 train samples, 62 unique classes
  Client 11: 36915 train samples, 62 unique classes
  Client 12: 36007 train samples, 62 unique classes
  Client 13: 37001 train samples, 62 unique classes
  Client 14: 35681 train samples, 62 unique classes
  Client 15: 35453 train samples, 62 unique classes
  Client 16: 36585 train samples, 62 unique classes
  Client 17: 36801 train samples, 62 unique classes
  Client 18: 35964 train samples, 62 unique classes
  Client 19: 36345 train samples, 62 unique classes
Will sample 4500 samples per client per epoch
Graph: ring, nodes: 20, edges: 20
Degree statistics: avg=2.00, min=2, max=2
Attack: Compromised 12/20 nodes: [1, 2, 3, 5, 8, 11, 12, 13, 14, 15, 17, 18]
Attack type: krum, lambda: 1.0
Model variant: baseline
Model parameters: 6,603,710
UBAR ALGORITHM (Two-Stage Byzantine-resilient)
  - Model dimension: 6,603,710 parameters
  - Rho parameter: 0.4
  - Stage 1: Distance-based filtering (select 40% closest neighbors)
  - Stage 2: Performance-based selection (loss comparison)
  - Complexity: O(deg(i)×d + deg(i)×inference)
Initial test acc across nodes: mean=0.0168 ± 0.0139
Round 001: test acc mean=0.0418 ± 0.0179 | min=0.0029 max=0.0608
         : test loss mean=5905.1375 ± 9993.7970
         : individual accs = ['0.049661', '0.052344', '0.044597', '0.043157', '0.057932', '0.048519', '0.044598', '0.049207', '0.047960', '0.047463', '0.055274', '0.060816', '0.002932', '0.013105', '0.006910', '0.050385', '0.005538', '0.050920', '0.054358', '0.050145']
         : correct/total = [(205, 4128), (220, 4203), (182, 4081), (187, 4333), (237, 4091), (208, 4287), (187, 4193), (214, 4349), (201, 4191), (203, 4277), (229, 4143), (255, 4193), (12, 4093), (55, 4197), (28, 4052), (203, 4029), (23, 4153), (213, 4183), (222, 4084), (207, 4128)]
         : compromised: 0.0397, honest: 0.0450
         : ubar stats = ['Node 0: s1=0.500, s2=1.000', 'Node 1: s1=0.500, s2=1.000', 'Node 2: s1=0.500, s2=1.000']...
Round 002: test acc mean=0.0490 ± 0.0069 | min=0.0265 max=0.0583
         : test loss mean=203464110.0065 ± 549096388.8725
         : individual accs = ['0.051599', '0.046158', '0.026464', '0.046619', '0.048643', '0.050618', '0.057000', '0.058174', '0.051062', '0.048398', '0.045619', '0.046983', '0.050574', '0.049559', '0.048124', '0.056342', '0.058271', '0.039445', '0.052889', '0.048450']
         : correct/total = [(213, 4128), (194, 4203), (108, 4081), (202, 4333), (199, 4091), (217, 4287), (239, 4193), (253, 4349), (214, 4191), (207, 4277), (189, 4143), (197, 4193), (207, 4093), (208, 4197), (195, 4052), (227, 4029), (242, 4153), (165, 4183), (216, 4084), (200, 4128)]
         : compromised: 0.0471, honest: 0.0520
         : ubar stats = ['Node 0: s1=0.500, s2=1.000', 'Node 1: s1=0.500, s2=1.000', 'Node 2: s1=0.500, s2=1.000']...
Round 003: test acc mean=0.0503 ± 0.0074 | min=0.0355 max=0.0727
         : test loss mean=20567746523.9634 ± 88929935587.0894
         : individual accs = ['0.059593', '0.050916', '0.035531', '0.046619', '0.052066', '0.050618', '0.044598', '0.049207', '0.047960', '0.047463', '0.055274', '0.053184', '0.048620', '0.046938', '0.037759', '0.051378', '0.049362', '0.051159', '0.072723', '0.055475']
         : correct/total = [(246, 4128), (214, 4203), (145, 4081), (202, 4333), (213, 4091), (217, 4287), (187, 4193), (214, 4349), (201, 4191), (203, 4277), (229, 4143), (223, 4193), (199, 4093), (197, 4197), (153, 4052), (207, 4029), (205, 4153), (214, 4183), (297, 4084), (229, 4128)]
         : compromised: 0.0495, honest: 0.0516
         : ubar stats = ['Node 0: s1=0.500, s2=1.000', 'Node 1: s1=0.500, s2=1.000', 'Node 2: s1=0.500, s2=1.000']...
Round 004: test acc mean=0.0584 ± 0.0172 | min=0.0323 max=0.0974
         : test loss mean=26623745239290568704.0000 ± 116050214995836305408.0000
         : individual accs = ['0.097384', '0.052344', '0.053418', '0.048465', '0.051088', '0.051085', '0.082518', '0.086917', '0.070628', '0.048398', '0.045619', '0.046983', '0.058637', '0.045747', '0.032330', '0.051378', '0.049362', '0.051159', '0.052889', '0.092539']
         : correct/total = [(402, 4128), (220, 4203), (218, 4081), (210, 4333), (209, 4091), (219, 4287), (346, 4193), (378, 4349), (296, 4191), (207, 4277), (189, 4143), (197, 4193), (240, 4093), (192, 4197), (131, 4052), (207, 4029), (205, 4153), (214, 4183), (216, 4084), (382, 4128)]
         : compromised: 0.0513, honest: 0.0692
         : ubar stats = ['Node 0: s1=0.500, s2=1.000', 'Node 1: s1=0.500, s2=1.000', 'Node 2: s1=0.500, s2=1.000']...
Round 005: test acc mean=0.0556 ± 0.0109 | min=0.0451 max=0.0899
         : test loss mean=nan ± nan
         : individual accs = ['0.089874', '0.052344', '0.045087', '0.052850', '0.051088', '0.050618', '0.046745', '0.047827', '0.054880', '0.053776', '0.055998', '0.061054', '0.058637', '0.049083', '0.051826', '0.053860', '0.047195', '0.050920', '0.056317', '0.081638']
         : correct/total = [(371, 4128), (220, 4203), (184, 4081), (229, 4333), (209, 4091), (217, 4287), (196, 4193), (208, 4349), (230, 4191), (230, 4277), (232, 4143), (256, 4193), (240, 4093), (206, 4197), (210, 4052), (217, 4029), (196, 4153), (213, 4183), (230, 4084), (337, 4128)]
         : compromised: 0.0531, honest: 0.0593
         : ubar stats = ['Node 0: s1=0.500, s2=1.000', 'Node 1: s1=0.500, s2=1.000', 'Node 2: s1=0.500, s2=1.000']...
Round 006: test acc mean=0.0592 ± 0.0127 | min=0.0439 max=0.0910
         : test loss mean=nan ± nan
         : individual accs = ['0.077035', '0.062099', '0.055134', '0.044773', '0.057932', '0.051318', '0.043883', '0.053346', '0.061560', '0.090952', '0.086894', '0.061770', '0.048620', '0.055278', '0.051826', '0.056590', '0.047195', '0.050920', '0.055583', '0.071221']
         : correct/total = [(318, 4128), (261, 4203), (225, 4081), (194, 4333), (237, 4091), (220, 4287), (184, 4193), (232, 4349), (258, 4191), (389, 4277), (360, 4143), (259, 4193), (199, 4093), (232, 4197), (210, 4052), (228, 4029), (196, 4153), (213, 4183), (227, 4084), (294, 4128)]
         : compromised: 0.0546, honest: 0.0661
         : ubar stats = ['Node 0: s1=0.500, s2=1.000', 'Node 1: s1=0.500, s2=1.000', 'Node 2: s1=0.500, s2=1.000']...
Round 007: test acc mean=0.0662 ± 0.0281 | min=0.0430 max=0.1410
         : test loss mean=nan ± nan
         : individual accs = ['0.140988', '0.052344', '0.050723', '0.046619', '0.043021', '0.076044', '0.097544', '0.092205', '0.053209', '0.060556', '0.063239', '0.053899', '0.058637', '0.049559', '0.051826', '0.054852', '0.044546', '0.045900', '0.050930', '0.136386']
         : correct/total = [(582, 4128), (220, 4203), (207, 4081), (202, 4333), (176, 4091), (326, 4287), (409, 4193), (401, 4349), (223, 4191), (259, 4277), (262, 4143), (226, 4193), (240, 4093), (208, 4197), (210, 4052), (221, 4029), (185, 4153), (192, 4183), (208, 4084), (563, 4128)]
         : compromised: 0.0537, honest: 0.0848
         : ubar stats = ['Node 0: s1=0.500, s2=1.000', 'Node 1: s1=0.500, s2=1.000', 'Node 2: s1=0.500, s2=1.000']...
Round 008: test acc mean=0.0663 ± 0.0302 | min=0.0430 max=0.1514
         : test loss mean=nan ± nan
         : individual accs = ['0.151405', '0.110635', '0.050723', '0.047773', '0.043021', '0.053884', '0.049130', '0.051276', '0.069435', '0.073884', '0.077963', '0.054615', '0.048620', '0.046462', '0.051826', '0.056342', '0.044546', '0.050203', '0.057052', '0.137112']
         : correct/total = [(625, 4128), (465, 4203), (207, 4081), (207, 4333), (176, 4091), (231, 4287), (206, 4193), (223, 4349), (291, 4191), (316, 4277), (323, 4143), (229, 4193), (199, 4093), (195, 4197), (210, 4052), (227, 4029), (185, 4153), (210, 4183), (233, 4084), (566, 4128)]
         : compromised: 0.0581, honest: 0.0785
         : ubar stats = ['Node 0: s1=0.500, s2=1.000', 'Node 1: s1=0.500, s2=1.000', 'Node 2: s1=0.500, s2=1.000']...
Round 009: test acc mean=0.0558 ± 0.0093 | min=0.0430 max=0.0770
         : test loss mean=nan ± nan
         : individual accs = ['0.061773', '0.050916', '0.048763', '0.047773', '0.043021', '0.076977', '0.070832', '0.059784', '0.060129', '0.057751', '0.056481', '0.058908', '0.053750', '0.046462', '0.051826', '0.050385', '0.044546', '0.046139', '0.073457', '0.055717']
         : correct/total = [(255, 4128), (214, 4203), (199, 4081), (207, 4333), (176, 4091), (330, 4287), (297, 4193), (260, 4349), (252, 4191), (247, 4277), (234, 4143), (247, 4193), (220, 4093), (195, 4197), (210, 4052), (203, 4029), (185, 4153), (193, 4183), (300, 4084), (230, 4128)]
         : compromised: 0.0555, honest: 0.0562
         : ubar stats = ['Node 0: s1=0.500, s2=1.000', 'Node 1: s1=0.500, s2=1.000', 'Node 2: s1=0.500, s2=1.000']...
Round 010: test acc mean=0.0652 ± 0.0263 | min=0.0250 max=0.1330
         : test loss mean=nan ± nan
         : individual accs = ['0.104167', '0.100404', '0.024994', '0.052850', '0.043021', '0.132960', '0.055092', '0.058634', '0.070628', '0.053776', '0.055998', '0.092774', '0.053750', '0.046462', '0.051826', '0.041698', '0.044546', '0.045900', '0.079334', '0.095203']
         : correct/total = [(430, 4128), (422, 4203), (102, 4081), (229, 4333), (176, 4091), (570, 4287), (231, 4193), (255, 4349), (296, 4191), (230, 4277), (232, 4143), (389, 4193), (220, 4093), (195, 4197), (210, 4052), (168, 4029), (185, 4153), (192, 4183), (324, 4084), (393, 4128)]
         : compromised: 0.0661, honest: 0.0638
         : ubar stats = ['Node 0: s1=0.500, s2=1.000', 'Node 1: s1=0.500, s2=1.000', 'Node 2: s1=0.500, s2=1.000']...

=== FINAL RESULTS ===
Dataset: femnist, Nodes: 20, Graph: ring, Aggregation: ubar
Attack: krum, 60.0% compromised
Final accuracy - Compromised: 0.0661, Honest: 0.0638
Overall test accuracy: mean=0.0652 ± 0.0263

=== UBAR SUMMARY ===
Node 0: stage1=0.500, stage2=1.000, overall=0.500
Node 1: stage1=0.500, stage2=1.000, overall=0.500
Node 2: stage1=0.500, stage2=1.000, overall=0.500
Node 3: stage1=0.500, stage2=1.000, overall=0.500
Node 4: stage1=0.500, stage2=1.000, overall=0.500
Node 5: stage1=0.500, stage2=1.000, overall=0.500
Node 6: stage1=0.500, stage2=1.000, overall=0.500
Node 7: stage1=0.500, stage2=1.000, overall=0.500
Node 8: stage1=0.500, stage2=1.000, overall=0.500
Node 9: stage1=0.500, stage2=1.000, overall=0.500
Node 10: stage1=0.500, stage2=1.000, overall=0.500
Node 11: stage1=0.500, stage2=1.000, overall=0.500
Node 12: stage1=0.500, stage2=1.000, overall=0.500
Node 13: stage1=0.500, stage2=1.000, overall=0.500
Node 14: stage1=0.500, stage2=1.000, overall=0.500
Node 15: stage1=0.500, stage2=1.000, overall=0.500
Node 16: stage1=0.500, stage2=1.000, overall=0.500
Node 17: stage1=0.500, stage2=1.000, overall=0.500
Node 18: stage1=0.500, stage2=1.000, overall=0.500
Node 19: stage1=0.500, stage2=1.000, overall=0.500

=== PARALLEL EXECUTION TIME (realistic for distributed system) ===
  COMMUNICATION (max across nodes):
    - Full model transfer: 0.000s (0.0%)
  COMPUTATION (max across nodes):
    - Distance computation: 0.031s (0.8%)
    - Loss computation: 4.054s (99.1%)
    - Aggregation: 0.005s (0.1%)
  TOTALS:
    - Total computation: 4.090s (100.0%)
    - Total communication: 0.000s (0.0%)
    - Total parallel time: 4.090s

=== PER-NODE AVERAGE TIME ===
  - Distance computation: 0.019s
  - Loss computation: 3.833s
  - Aggregation: 0.004s
  - Model transfer: 0.000s
  - Total per node: 3.857s

=== TOTAL COMPUTATIONAL WORK (sum across all nodes) ===
  - Total distance computation: 0.380s
  - Total loss computation: 76.665s
  - Total aggregation: 0.087s
  - Total model transfer: 0.000s
  - Grand total: 77.132s
  - Mean Stage 1 acceptance rate: 0.500
  - Mean Stage 2 acceptance rate: 1.000
  - Overall acceptance rate: 0.500

UBAR Algorithm Properties:
  - Model dimension: 6,603,710
  - Rho parameter: 0.4
  - Two-stage approach: Distance filtering + loss evaluation
  - Stage 1 selects: 40% of neighbors
  - Stage 2 uses: Training sample loss comparison
  - Theoretical complexity: O(deg(i)×d + deg(i)×inference)
  - Approach: UBAR paper implementation
