Device: cuda
Seed: 987654321
Loading 36 LEAF FEMNIST train files...
LEAF FEMNIST train: 3597 users, 734463 samples
Loading 36 LEAF FEMNIST test files...
LEAF FEMNIST test: 3597 users, 83388 samples
Found 3597 train users, 3597 test users, 3597 common users
User sample counts range: 525 (max) to 17 (min)
Distributed ALL 3597 users across 20 clients
Users per client: 179 (with 17 clients getting +1 user)
Train partition sizes: [36360, 37070, 35957, 38262, 36024, 37732, 36921, 38328, 36867, 37683, 36507, 36915, 36007, 37001, 35681, 35453, 36585, 36801, 35964, 36345]
Test partition sizes: [4128, 4203, 4081, 4333, 4091, 4287, 4193, 4349, 4191, 4277, 4143, 4193, 4093, 4197, 4052, 4029, 4153, 4183, 4084, 4128]
  Client 0: 36360 train samples, 62 unique classes
  Client 1: 37070 train samples, 62 unique classes
  Client 2: 35957 train samples, 62 unique classes
  Client 3: 38262 train samples, 62 unique classes
  Client 4: 36024 train samples, 62 unique classes
  Client 5: 37732 train samples, 62 unique classes
  Client 6: 36921 train samples, 62 unique classes
  Client 7: 38328 train samples, 62 unique classes
  Client 8: 36867 train samples, 62 unique classes
  Client 9: 37683 train samples, 62 unique classes
  Client 10: 36507 train samples, 62 unique classes
  Client 11: 36915 train samples, 62 unique classes
  Client 12: 36007 train samples, 62 unique classes
  Client 13: 37001 train samples, 62 unique classes
  Client 14: 35681 train samples, 62 unique classes
  Client 15: 35453 train samples, 62 unique classes
  Client 16: 36585 train samples, 62 unique classes
  Client 17: 36801 train samples, 62 unique classes
  Client 18: 35964 train samples, 62 unique classes
  Client 19: 36345 train samples, 62 unique classes
Will sample 10000 samples per client per epoch
Graph: ring, nodes: 20, edges: 20
Degree statistics: avg=2.00, min=2, max=2
Attack: Compromised 6/20 nodes: [5, 12, 13, 14, 17, 18]
Attack type: backdoor, lambda: 1.0
Backdoor target label: 0, trigger size: 4
Model variant: baseline
Model parameters: 6,603,710
Initial test acc across nodes: mean=0.0168 ± 0.0139
Backdoor attack: Created poisoned datasets for 6 compromised nodes
Round 001: test acc mean=0.4328 ± 0.2414 | min=0.0030 max=0.5946
         : test loss mean=84375.6750 ± 152363.3091
         : individual accs = ['0.579942', '0.585534', '0.590296', '0.557812', '0.578832', '0.587357', '0.563320', '0.544033', '0.563350', '0.565583', '0.575428', '0.594562', '0.003420', '0.049083', '0.002962', '0.579796', '0.554057', '0.005498', '0.016650', '0.558140']
         : correct/total = [(2394, 4128), (2461, 4203), (2409, 4081), (2417, 4333), (2368, 4091), (2518, 4287), (2362, 4193), (2366, 4349), (2361, 4191), (2419, 4277), (2384, 4143), (2493, 4193), (14, 4093), (206, 4197), (12, 4052), (2336, 4029), (2301, 4153), (23, 4183), (68, 4084), (2304, 4128)]
         : compromised: 0.1108, honest: 0.5708
Round 002: test acc mean=0.5653 ± 0.3095 | min=0.0215 max=0.7635
         : test loss mean=nan ± nan
         : individual accs = ['0.754118', '0.748513', '0.744425', '0.725594', '0.754339', '0.763471', '0.727403', '0.721545', '0.735624', '0.754501', '0.736182', '0.747913', '0.027119', '0.049083', '0.021471', '0.745594', '0.753913', '0.024623', '0.025220', '0.744913']
         : correct/total = [(3113, 4128), (3146, 4203), (3038, 4081), (3144, 4333), (3086, 4091), (3273, 4287), (3050, 4193), (3138, 4349), (3083, 4191), (3227, 4277), (3050, 4143), (3136, 4193), (111, 4093), (206, 4197), (87, 4052), (3004, 4029), (3131, 4153), (103, 4183), (103, 4084), (3075, 4128)]
         : compromised: 0.1518, honest: 0.7425
Round 003: test acc mean=0.5959 ± 0.3328 | min=0.0044 max=0.8031
         : test loss mean=nan ± nan
         : individual accs = ['0.798450', '0.789912', '0.791963', '0.795754', '0.797360', '0.768836', '0.780110', '0.801794', '0.787402', '0.803133', '0.786628', '0.765800', '0.004398', '0.049083', '0.021471', '0.779102', '0.797014', '0.005498', '0.019344', '0.774709']
         : correct/total = [(3296, 4128), (3320, 4203), (3232, 4081), (3448, 4333), (3262, 4091), (3296, 4287), (3271, 4193), (3487, 4349), (3300, 4191), (3435, 4277), (3259, 4143), (3211, 4193), (18, 4093), (206, 4197), (87, 4052), (3139, 4029), (3310, 4153), (23, 4183), (79, 4084), (3198, 4128)]
         : compromised: 0.1448, honest: 0.7892
Round 004: test acc mean=0.6111 ± 0.3403 | min=0.0044 max=0.8233
         : test loss mean=nan ± nan
         : individual accs = ['0.800630', '0.817749', '0.816467', '0.812139', '0.816671', '0.794728', '0.797281', '0.816280', '0.805536', '0.809680', '0.803283', '0.802290', '0.004398', '0.049083', '0.019743', '0.809630', '0.823260', '0.017213', '0.019344', '0.786337']
         : correct/total = [(3305, 4128), (3437, 4203), (3332, 4081), (3519, 4333), (3341, 4091), (3407, 4287), (3343, 4193), (3550, 4349), (3376, 4191), (3463, 4277), (3328, 4143), (3364, 4193), (18, 4093), (206, 4197), (80, 4052), (3262, 4029), (3419, 4153), (72, 4183), (79, 4084), (3246, 4128)]
         : compromised: 0.1508, honest: 0.8084
Round 005: test acc mean=0.6206 ± 0.3458 | min=0.0060 max=0.8431
         : test loss mean=nan ± nan
         : individual accs = ['0.821705', '0.830597', '0.822838', '0.815140', '0.843070', '0.819454', '0.815884', '0.823408', '0.814126', '0.827917', '0.813179', '0.798951', '0.016125', '0.049083', '0.019743', '0.818069', '0.826872', '0.005977', '0.019344', '0.810562']
         : correct/total = [(3392, 4128), (3491, 4203), (3358, 4081), (3532, 4333), (3449, 4091), (3513, 4287), (3421, 4193), (3581, 4349), (3412, 4191), (3541, 4277), (3369, 4143), (3350, 4193), (66, 4093), (206, 4197), (80, 4052), (3296, 4029), (3434, 4153), (25, 4183), (79, 4084), (3346, 4128)]
         : compromised: 0.1550, honest: 0.8202
Round 006: test acc mean=0.6232 ± 0.3473 | min=0.0044 max=0.8308
         : test loss mean=nan ± nan
         : individual accs = ['0.829942', '0.830835', '0.830189', '0.820448', '0.829137', '0.811290', '0.817553', '0.828696', '0.821045', '0.829553', '0.819937', '0.822561', '0.004398', '0.049083', '0.019743', '0.819806', '0.826631', '0.017213', '0.019344', '0.817103']
         : correct/total = [(3426, 4128), (3492, 4203), (3388, 4081), (3555, 4333), (3392, 4091), (3478, 4287), (3428, 4193), (3604, 4349), (3441, 4191), (3548, 4277), (3397, 4143), (3449, 4193), (18, 4093), (206, 4197), (80, 4052), (3303, 4029), (3433, 4153), (72, 4183), (79, 4084), (3373, 4128)]
         : compromised: 0.1535, honest: 0.8245
Round 007: test acc mean=0.6290 ± 0.3491 | min=0.0172 max=0.8460
         : test loss mean=nan ± nan
         : individual accs = ['0.828973', '0.829883', '0.837785', '0.833833', '0.846003', '0.825986', '0.827331', '0.843642', '0.833214', '0.833528', '0.819455', '0.823754', '0.017347', '0.049083', '0.019743', '0.820055', '0.828558', '0.017213', '0.019344', '0.826066']
         : correct/total = [(3422, 4128), (3488, 4203), (3419, 4081), (3613, 4333), (3461, 4091), (3541, 4287), (3469, 4193), (3669, 4349), (3492, 4191), (3565, 4277), (3395, 4143), (3454, 4193), (71, 4093), (206, 4197), (80, 4052), (3304, 4029), (3441, 4153), (72, 4183), (79, 4084), (3410, 4128)]
         : compromised: 0.1581, honest: 0.8309
Round 008: test acc mean=0.6320 ± 0.3509 | min=0.0172 max=0.8497
         : test loss mean=nan ± nan
         : individual accs = ['0.828731', '0.848204', '0.841215', '0.844219', '0.849670', '0.819921', '0.828762', '0.837664', '0.831067', '0.842647', '0.831282', '0.824231', '0.017347', '0.049083', '0.019743', '0.825267', '0.838912', '0.017213', '0.019344', '0.826066']
         : correct/total = [(3421, 4128), (3565, 4203), (3433, 4081), (3658, 4333), (3476, 4091), (3515, 4287), (3475, 4193), (3643, 4349), (3483, 4191), (3604, 4277), (3444, 4143), (3456, 4193), (71, 4093), (206, 4197), (80, 4052), (3325, 4029), (3484, 4153), (72, 4183), (79, 4084), (3410, 4128)]
         : compromised: 0.1571, honest: 0.8356
Round 009: test acc mean=0.6329 ± 0.3529 | min=0.0044 max=0.8526
         : test loss mean=nan ± nan
         : individual accs = ['0.832607', '0.845349', '0.844891', '0.835910', '0.843803', '0.826685', '0.825900', '0.852610', '0.836077', '0.841711', '0.825730', '0.834963', '0.004398', '0.049083', '0.019743', '0.833457', '0.840116', '0.017213', '0.019344', '0.828973']
         : correct/total = [(3437, 4128), (3553, 4203), (3448, 4081), (3622, 4333), (3452, 4091), (3544, 4287), (3463, 4193), (3708, 4349), (3504, 4191), (3600, 4277), (3421, 4143), (3501, 4193), (18, 4093), (206, 4197), (80, 4052), (3358, 4029), (3489, 4153), (72, 4183), (79, 4084), (3422, 4128)]
         : compromised: 0.1561, honest: 0.8373
Round 010: test acc mean=0.6339 ± 0.3520 | min=0.0172 max=0.8523
         : test loss mean=nan ± nan
         : individual accs = ['0.838421', '0.843207', '0.839745', '0.852296', '0.850403', '0.824353', '0.818746', '0.843642', '0.827726', '0.845219', '0.837799', '0.830432', '0.017347', '0.049083', '0.019743', '0.832713', '0.840597', '0.017213', '0.019344', '0.829942']
         : correct/total = [(3461, 4128), (3544, 4203), (3427, 4081), (3693, 4333), (3479, 4091), (3534, 4287), (3433, 4193), (3669, 4349), (3469, 4191), (3615, 4277), (3471, 4143), (3482, 4193), (71, 4093), (206, 4197), (80, 4052), (3355, 4029), (3491, 4153), (72, 4183), (79, 4084), (3426, 4128)]
         : compromised: 0.1578, honest: 0.8379

=== FINAL RESULTS ===
Dataset: femnist, Nodes: 20, Graph: ring, Aggregation: krum
Attack: backdoor, 30.0% compromised
Final accuracy - Compromised: 0.1578, Honest: 0.8379
Overall test accuracy: mean=0.6339 ± 0.3520

=== BACKDOOR ATTACK SUCCESS RATE (ASR) ===
Target label: 0
Trigger size: 4x4
Overall ASR: 0.0875 ± 0.2104
Honest nodes ASR: 0.0499 ± 0.0081
Compromised nodes ASR: 0.1753 ± 0.3693
Note: Higher ASR indicates more successful backdoor attack
