Device: cuda
Seed: 987654321
Loading 36 LEAF FEMNIST train files...
LEAF FEMNIST train: 3597 users, 734463 samples
Loading 36 LEAF FEMNIST test files...
LEAF FEMNIST test: 3597 users, 83388 samples
Found 3597 train users, 3597 test users, 3597 common users
User sample counts range: 525 (max) to 17 (min)
Distributed ALL 3597 users across 20 clients
Users per client: 179 (with 17 clients getting +1 user)
Train partition sizes: [36360, 37070, 35957, 38262, 36024, 37732, 36921, 38328, 36867, 37683, 36507, 36915, 36007, 37001, 35681, 35453, 36585, 36801, 35964, 36345]
Test partition sizes: [4128, 4203, 4081, 4333, 4091, 4287, 4193, 4349, 4191, 4277, 4143, 4193, 4093, 4197, 4052, 4029, 4153, 4183, 4084, 4128]
  Client 0: 36360 train samples, 62 unique classes
  Client 1: 37070 train samples, 62 unique classes
  Client 2: 35957 train samples, 62 unique classes
  Client 3: 38262 train samples, 62 unique classes
  Client 4: 36024 train samples, 62 unique classes
  Client 5: 37732 train samples, 62 unique classes
  Client 6: 36921 train samples, 62 unique classes
  Client 7: 38328 train samples, 62 unique classes
  Client 8: 36867 train samples, 62 unique classes
  Client 9: 37683 train samples, 62 unique classes
  Client 10: 36507 train samples, 62 unique classes
  Client 11: 36915 train samples, 62 unique classes
  Client 12: 36007 train samples, 62 unique classes
  Client 13: 37001 train samples, 62 unique classes
  Client 14: 35681 train samples, 62 unique classes
  Client 15: 35453 train samples, 62 unique classes
  Client 16: 36585 train samples, 62 unique classes
  Client 17: 36801 train samples, 62 unique classes
  Client 18: 35964 train samples, 62 unique classes
  Client 19: 36345 train samples, 62 unique classes
Will sample 4500 samples per client per epoch
Graph: ring, nodes: 20, edges: 20
Degree statistics: avg=2.00, min=2, max=2
Attack: Compromised 6/20 nodes: [5, 12, 13, 14, 17, 18]
Attack type: directed_deviation, lambda: 1.0
Model variant: baseline
Model parameters: 6,603,710
UBAR ALGORITHM (Two-Stage Byzantine-resilient)
  - Model dimension: 6,603,710 parameters
  - Rho parameter: 0.7
  - Stage 1: Distance-based filtering (select 70% closest neighbors)
  - Stage 2: Performance-based selection (loss comparison)
  - Complexity: O(deg(i)×d + deg(i)×inference)
Initial test acc across nodes: mean=0.0168 ± 0.0139
Round 001: test acc mean=0.0493 ± 0.0083 | min=0.0186 max=0.0608
         : test loss mean=907.7923 ± 3939.6683
         : individual accs = ['0.059593', '0.051630', '0.050723', '0.047773', '0.043021', '0.048519', '0.044598', '0.049207', '0.047960', '0.050503', '0.049722', '0.060816', '0.054239', '0.018585', '0.056762', '0.050385', '0.047195', '0.050920', '0.054358', '0.050145']
         : correct/total = [(246, 4128), (217, 4203), (207, 4081), (207, 4333), (176, 4091), (208, 4287), (187, 4193), (214, 4349), (201, 4191), (216, 4277), (206, 4143), (255, 4193), (222, 4093), (78, 4197), (230, 4052), (203, 4029), (196, 4153), (213, 4183), (222, 4084), (207, 4128)]
         : compromised: 0.0472, honest: 0.0502
         : ubar stats = ['Node 0: s1=0.500, s2=1.000', 'Node 1: s1=0.500, s2=1.000', 'Node 2: s1=0.500, s2=1.000']...
Round 002: test acc mean=0.0503 ± 0.0063 | min=0.0286 max=0.0582
         : test loss mean=14490.5780 ± 63146.7091
         : individual accs = ['0.044574', '0.051630', '0.050723', '0.052850', '0.057932', '0.050618', '0.057000', '0.058174', '0.051062', '0.044891', '0.045619', '0.046983', '0.049597', '0.028592', '0.051826', '0.054852', '0.054418', '0.050920', '0.052889', '0.050872']
         : correct/total = [(184, 4128), (217, 4203), (207, 4081), (229, 4333), (237, 4091), (217, 4287), (239, 4193), (253, 4349), (214, 4191), (192, 4277), (189, 4143), (197, 4193), (203, 4093), (120, 4197), (210, 4052), (221, 4029), (226, 4153), (213, 4183), (216, 4084), (210, 4128)]
         : compromised: 0.0474, honest: 0.0515
         : ubar stats = ['Node 0: s1=0.500, s2=1.000', 'Node 1: s1=0.500, s2=1.000', 'Node 2: s1=0.500, s2=1.000']...
Round 003: test acc mean=0.0532 ± 0.0043 | min=0.0446 max=0.0624
         : test loss mean=314.7086 ± 1355.7259
         : individual accs = ['0.059593', '0.051630', '0.050723', '0.052850', '0.057932', '0.050618', '0.044598', '0.049207', '0.051539', '0.047463', '0.055274', '0.053184', '0.058637', '0.062426', '0.048124', '0.056342', '0.055141', '0.050203', '0.052889', '0.055475']
         : correct/total = [(246, 4128), (217, 4203), (207, 4081), (229, 4333), (237, 4091), (217, 4287), (187, 4193), (214, 4349), (216, 4191), (203, 4277), (229, 4143), (223, 4193), (240, 4093), (262, 4197), (195, 4052), (227, 4029), (229, 4153), (210, 4183), (216, 4084), (229, 4128)]
         : compromised: 0.0538, honest: 0.0529
         : ubar stats = ['Node 0: s1=0.500, s2=1.000', 'Node 1: s1=0.500, s2=1.000', 'Node 2: s1=0.500, s2=1.000']...
Round 004: test acc mean=0.0622 ± 0.0166 | min=0.0435 max=0.1039
         : test loss mean=36879.9633 ± 160739.9930
         : individual accs = ['0.103924', '0.062574', '0.073756', '0.052850', '0.057932', '0.051085', '0.082518', '0.086917', '0.049630', '0.043488', '0.045619', '0.046983', '0.054239', '0.055278', '0.061204', '0.057086', '0.059957', '0.050920', '0.052889', '0.094234']
         : correct/total = [(429, 4128), (263, 4203), (301, 4081), (229, 4333), (237, 4091), (219, 4287), (346, 4193), (378, 4349), (208, 4191), (186, 4277), (189, 4143), (197, 4193), (222, 4093), (232, 4197), (248, 4052), (230, 4029), (249, 4153), (213, 4183), (216, 4084), (389, 4128)]
         : compromised: 0.0543, honest: 0.0655
         : ubar stats = ['Node 0: s1=0.500, s2=1.000', 'Node 1: s1=0.500, s2=1.000', 'Node 2: s1=0.500, s2=1.000']...
Round 005: test acc mean=0.0692 ± 0.0206 | min=0.0467 max=0.1083
         : test loss mean=6224.7936 ± 27117.2105
         : individual accs = ['0.102955', '0.052344', '0.057584', '0.053773', '0.059154', '0.050618', '0.046745', '0.047827', '0.100931', '0.108253', '0.080618', '0.076079', '0.053750', '0.062426', '0.051579', '0.087863', '0.087166', '0.050920', '0.055583', '0.097868']
         : correct/total = [(425, 4128), (220, 4203), (235, 4081), (233, 4333), (242, 4091), (217, 4287), (196, 4193), (208, 4349), (423, 4191), (463, 4277), (334, 4143), (319, 4193), (220, 4093), (262, 4197), (209, 4052), (354, 4029), (362, 4153), (213, 4183), (227, 4084), (404, 4128)]
         : compromised: 0.0541, honest: 0.0757
         : ubar stats = ['Node 0: s1=0.500, s2=1.000', 'Node 1: s1=0.500, s2=1.000', 'Node 2: s1=0.500, s2=1.000']...
Round 006: test acc mean=0.0578 ± 0.0114 | min=0.0439 max=0.1027
         : test loss mean=34145.8186 ± 148822.1442
         : individual accs = ['0.066618', '0.052344', '0.057584', '0.052850', '0.057932', '0.051318', '0.043883', '0.053346', '0.053448', '0.053776', '0.050447', '0.061770', '0.053750', '0.062426', '0.102665', '0.056590', '0.058993', '0.050920', '0.055583', '0.060562']
         : correct/total = [(275, 4128), (220, 4203), (235, 4081), (229, 4333), (237, 4091), (220, 4287), (184, 4193), (232, 4349), (224, 4191), (230, 4277), (209, 4143), (259, 4193), (220, 4093), (262, 4197), (416, 4052), (228, 4029), (245, 4153), (213, 4183), (227, 4084), (250, 4128)]
         : compromised: 0.0628, honest: 0.0557
         : ubar stats = ['Node 0: s1=0.500, s2=1.000', 'Node 1: s1=0.500, s2=1.000', 'Node 2: s1=0.500, s2=1.000']...
Round 007: test acc mean=0.0647 ± 0.0195 | min=0.0448 max=0.1065
         : test loss mean=1086.6926 ± 4720.7583
         : individual accs = ['0.062258', '0.052344', '0.057584', '0.044773', '0.047421', '0.076044', '0.097544', '0.092205', '0.053686', '0.053776', '0.055998', '0.053899', '0.058637', '0.049559', '0.051826', '0.106478', '0.106429', '0.050920', '0.050930', '0.070736']
         : correct/total = [(257, 4128), (220, 4203), (235, 4081), (194, 4333), (194, 4091), (326, 4287), (409, 4193), (401, 4349), (225, 4191), (230, 4277), (232, 4143), (226, 4193), (240, 4093), (208, 4197), (210, 4052), (429, 4029), (442, 4153), (213, 4183), (208, 4084), (292, 4128)]
         : compromised: 0.0563, honest: 0.0682
         : ubar stats = ['Node 0: s1=0.500, s2=1.000', 'Node 1: s1=0.500, s2=1.000', 'Node 2: s1=0.500, s2=1.000']...
Round 008: test acc mean=0.0743 ± 0.0300 | min=0.0284 max=0.1538
         : test loss mean=8.2788 ± 20.0692
         : individual accs = ['0.153828', '0.068998', '0.071551', '0.082391', '0.086287', '0.053884', '0.049130', '0.051276', '0.090670', '0.096797', '0.057929', '0.055569', '0.104080', '0.028354', '0.062192', '0.061554', '0.057308', '0.059527', '0.055583', '0.140019']
         : correct/total = [(635, 4128), (290, 4203), (292, 4081), (357, 4333), (353, 4091), (231, 4287), (206, 4193), (223, 4349), (380, 4191), (414, 4277), (240, 4143), (233, 4193), (426, 4093), (119, 4197), (252, 4052), (248, 4029), (238, 4153), (249, 4183), (227, 4084), (578, 4128)]
         : compromised: 0.0606, honest: 0.0802
         : ubar stats = ['Node 0: s1=0.500, s2=1.000', 'Node 1: s1=0.500, s2=1.000', 'Node 2: s1=0.500, s2=1.000']...
Round 009: test acc mean=0.0770 ± 0.0274 | min=0.0518 max=0.1551
         : test loss mean=34.1211 ± 132.7259
         : individual accs = ['0.059593', '0.142993', '0.155109', '0.053543', '0.058176', '0.076977', '0.070832', '0.059784', '0.085660', '0.096563', '0.071929', '0.065824', '0.058881', '0.055278', '0.051826', '0.087615', '0.085721', '0.086302', '0.061459', '0.055475']
         : correct/total = [(246, 4128), (601, 4203), (633, 4081), (232, 4333), (238, 4091), (330, 4287), (297, 4193), (260, 4349), (359, 4191), (413, 4277), (298, 4143), (276, 4193), (241, 4093), (232, 4197), (210, 4052), (353, 4029), (356, 4153), (361, 4183), (251, 4084), (229, 4128)]
         : compromised: 0.0651, honest: 0.0821
         : ubar stats = ['Node 0: s1=0.500, s2=1.000', 'Node 1: s1=0.500, s2=1.000', 'Node 2: s1=0.500, s2=1.000']...
Round 010: test acc mean=0.0735 ± 0.0215 | min=0.0459 max=0.1330
         : test loss mean=9.7836 ± 26.6577
         : individual accs = ['0.103924', '0.070902', '0.086988', '0.052850', '0.057932', '0.132960', '0.055092', '0.058634', '0.054402', '0.054244', '0.087376', '0.086573', '0.045932', '0.049083', '0.076999', '0.078431', '0.081869', '0.083911', '0.057542', '0.094719']
         : correct/total = [(429, 4128), (298, 4203), (355, 4081), (229, 4333), (237, 4091), (570, 4287), (231, 4193), (255, 4349), (228, 4191), (232, 4277), (362, 4143), (363, 4193), (188, 4093), (206, 4197), (312, 4052), (316, 4029), (340, 4153), (351, 4183), (235, 4084), (391, 4128)]
         : compromised: 0.0744, honest: 0.0731
         : ubar stats = ['Node 0: s1=0.500, s2=1.000', 'Node 1: s1=0.500, s2=1.000', 'Node 2: s1=0.500, s2=1.000']...

=== FINAL RESULTS ===
Dataset: femnist, Nodes: 20, Graph: ring, Aggregation: ubar
Attack: directed_deviation, 30.0% compromised
Final accuracy - Compromised: 0.0744, Honest: 0.0731
Overall test accuracy: mean=0.0735 ± 0.0215

=== UBAR SUMMARY ===
Node 0: stage1=0.500, stage2=1.000, overall=0.500
Node 1: stage1=0.500, stage2=1.000, overall=0.500
Node 2: stage1=0.500, stage2=1.000, overall=0.500
Node 3: stage1=0.500, stage2=1.000, overall=0.500
Node 4: stage1=0.500, stage2=1.000, overall=0.500
Node 5: stage1=0.500, stage2=1.000, overall=0.500
Node 6: stage1=0.500, stage2=1.000, overall=0.500
Node 7: stage1=0.500, stage2=1.000, overall=0.500
Node 8: stage1=0.500, stage2=1.000, overall=0.500
Node 9: stage1=0.500, stage2=1.000, overall=0.500
Node 10: stage1=0.500, stage2=1.000, overall=0.500
Node 11: stage1=0.500, stage2=1.000, overall=0.500
Node 12: stage1=0.500, stage2=1.000, overall=0.500
Node 13: stage1=0.500, stage2=1.000, overall=0.500
Node 14: stage1=0.500, stage2=1.000, overall=0.500
Node 15: stage1=0.500, stage2=1.000, overall=0.500
Node 16: stage1=0.500, stage2=1.000, overall=0.500
Node 17: stage1=0.500, stage2=1.000, overall=0.500
Node 18: stage1=0.500, stage2=1.000, overall=0.500
Node 19: stage1=0.500, stage2=1.000, overall=0.500

=== PARALLEL EXECUTION TIME (realistic for distributed system) ===
  COMMUNICATION (max across nodes):
    - Full model transfer: 0.000s (0.0%)
  COMPUTATION (max across nodes):
    - Distance computation: 0.028s (0.7%)
    - Loss computation: 4.090s (99.1%)
    - Aggregation: 0.007s (0.2%)
  TOTALS:
    - Total computation: 4.125s (100.0%)
    - Total communication: 0.000s (0.0%)
    - Total parallel time: 4.125s

=== PER-NODE AVERAGE TIME ===
  - Distance computation: 0.013s
  - Loss computation: 3.863s
  - Aggregation: 0.005s
  - Model transfer: 0.000s
  - Total per node: 3.881s

=== TOTAL COMPUTATIONAL WORK (sum across all nodes) ===
  - Total distance computation: 0.266s
  - Total loss computation: 77.263s
  - Total aggregation: 0.099s
  - Total model transfer: 0.000s
  - Grand total: 77.628s
  - Mean Stage 1 acceptance rate: 0.500
  - Mean Stage 2 acceptance rate: 1.000
  - Overall acceptance rate: 0.500

UBAR Algorithm Properties:
  - Model dimension: 6,603,710
  - Rho parameter: 0.7
  - Two-stage approach: Distance filtering + loss evaluation
  - Stage 1 selects: 70% of neighbors
  - Stage 2 uses: Training sample loss comparison
  - Theoretical complexity: O(deg(i)×d + deg(i)×inference)
  - Approach: UBAR paper implementation
