Device: cuda
Seed: 987654321
Loading 36 LEAF FEMNIST train files...
LEAF FEMNIST train: 3597 users, 734463 samples
Loading 36 LEAF FEMNIST test files...
LEAF FEMNIST test: 3597 users, 83388 samples
Found 3597 train users, 3597 test users, 3597 common users
User sample counts range: 525 (max) to 17 (min)
Distributed ALL 3597 users across 20 clients
Users per client: 179 (with 17 clients getting +1 user)
Train partition sizes: [36360, 37070, 35957, 38262, 36024, 37732, 36921, 38328, 36867, 37683, 36507, 36915, 36007, 37001, 35681, 35453, 36585, 36801, 35964, 36345]
Test partition sizes: [4128, 4203, 4081, 4333, 4091, 4287, 4193, 4349, 4191, 4277, 4143, 4193, 4093, 4197, 4052, 4029, 4153, 4183, 4084, 4128]
  Client 0: 36360 train samples, 62 unique classes
  Client 1: 37070 train samples, 62 unique classes
  Client 2: 35957 train samples, 62 unique classes
  Client 3: 38262 train samples, 62 unique classes
  Client 4: 36024 train samples, 62 unique classes
  Client 5: 37732 train samples, 62 unique classes
  Client 6: 36921 train samples, 62 unique classes
  Client 7: 38328 train samples, 62 unique classes
  Client 8: 36867 train samples, 62 unique classes
  Client 9: 37683 train samples, 62 unique classes
  Client 10: 36507 train samples, 62 unique classes
  Client 11: 36915 train samples, 62 unique classes
  Client 12: 36007 train samples, 62 unique classes
  Client 13: 37001 train samples, 62 unique classes
  Client 14: 35681 train samples, 62 unique classes
  Client 15: 35453 train samples, 62 unique classes
  Client 16: 36585 train samples, 62 unique classes
  Client 17: 36801 train samples, 62 unique classes
  Client 18: 35964 train samples, 62 unique classes
  Client 19: 36345 train samples, 62 unique classes
Will sample 4500 samples per client per epoch
Graph: ring, nodes: 20, edges: 20
Degree statistics: avg=2.00, min=2, max=2
Attack: Compromised 6/20 nodes: [5, 12, 13, 14, 17, 18]
Attack type: backdoor, lambda: 1.0
Backdoor target label: 0, trigger size: 4
Model variant: baseline
Model parameters: 6,603,710
Initial test acc across nodes: mean=0.0168 ± 0.0139
Backdoor attack: Created poisoned datasets for 6 compromised nodes
Round 001: test acc mean=0.0368 ± 0.0190 | min=0.0035 max=0.0553
         : test loss mean=41876.7738 ± 120371.9094
         : individual accs = ['0.051599', '0.051630', '0.055134', '0.047773', '0.006111', '0.003499', '0.049130', '0.053116', '0.054880', '0.048398', '0.055274', '0.045314', '0.025409', '0.024065', '0.051826', '0.023331', '0.010836', '0.012431', '0.055338', '0.010417']
         : correct/total = [(213, 4128), (217, 4203), (225, 4081), (207, 4333), (25, 4091), (15, 4287), (206, 4193), (231, 4349), (230, 4191), (207, 4277), (229, 4143), (190, 4193), (104, 4093), (101, 4197), (210, 4052), (94, 4029), (45, 4153), (52, 4183), (226, 4084), (43, 4128)]
         : compromised: 0.0288, honest: 0.0402
Round 002: test acc mean=0.0499 ± 0.0053 | min=0.0407 max=0.0618
         : test loss mean=nan ± nan
         : individual accs = ['0.050145', '0.046158', '0.050723', '0.052850', '0.044977', '0.057849', '0.057000', '0.043918', '0.051062', '0.055179', '0.047550', '0.061770', '0.053750', '0.049083', '0.046397', '0.041698', '0.040693', '0.045900', '0.050930', '0.050872']
         : correct/total = [(207, 4128), (194, 4203), (207, 4081), (229, 4333), (184, 4091), (248, 4287), (239, 4193), (191, 4349), (214, 4191), (236, 4277), (197, 4143), (259, 4193), (220, 4093), (206, 4197), (188, 4052), (168, 4029), (169, 4153), (192, 4183), (208, 4084), (210, 4128)]
         : compromised: 0.0507, honest: 0.0496
Round 003: test acc mean=0.0477 ± 0.0075 | min=0.0281 max=0.0657
         : test loss mean=nan ± nan
         : individual accs = ['0.049661', '0.051154', '0.065670', '0.052850', '0.051088', '0.052484', '0.049606', '0.051276', '0.051539', '0.044891', '0.051171', '0.028142', '0.033716', '0.049083', '0.046644', '0.041698', '0.040693', '0.045900', '0.048482', '0.048692']
         : correct/total = [(205, 4128), (215, 4203), (268, 4081), (229, 4333), (209, 4091), (225, 4287), (208, 4193), (223, 4349), (216, 4191), (192, 4277), (212, 4143), (118, 4193), (138, 4093), (206, 4197), (189, 4052), (168, 4029), (169, 4153), (192, 4183), (198, 4084), (201, 4128)]
         : compromised: 0.0461, honest: 0.0484
Round 004: test acc mean=0.0504 ± 0.0053 | min=0.0334 max=0.0586
         : test loss mean=nan ± nan
         : individual accs = ['0.049661', '0.050916', '0.057584', '0.052850', '0.057932', '0.048052', '0.033389', '0.051276', '0.042233', '0.048398', '0.051171', '0.053899', '0.058637', '0.049083', '0.050346', '0.051378', '0.049362', '0.051159', '0.050196', '0.050145']
         : correct/total = [(205, 4128), (214, 4203), (235, 4081), (229, 4333), (237, 4091), (206, 4287), (140, 4193), (223, 4349), (177, 4191), (207, 4277), (212, 4143), (226, 4193), (240, 4093), (206, 4197), (204, 4052), (207, 4029), (205, 4153), (214, 4183), (205, 4084), (207, 4128)]
         : compromised: 0.0512, honest: 0.0500
Round 005: test acc mean=0.0482 ± 0.0057 | min=0.0334 max=0.0576
         : test loss mean=nan ± nan
         : individual accs = ['0.049661', '0.048775', '0.057584', '0.052850', '0.052066', '0.045953', '0.033389', '0.051276', '0.042233', '0.048398', '0.045619', '0.049606', '0.045688', '0.049083', '0.051579', '0.054852', '0.054418', '0.037533', '0.043095', '0.050145']
         : correct/total = [(205, 4128), (205, 4203), (235, 4081), (229, 4333), (213, 4091), (197, 4287), (140, 4193), (223, 4349), (177, 4191), (207, 4277), (189, 4143), (208, 4193), (187, 4093), (206, 4197), (209, 4052), (221, 4029), (226, 4153), (157, 4183), (176, 4084), (207, 4128)]
         : compromised: 0.0455, honest: 0.0493
Round 006: test acc mean=0.0491 ± 0.0072 | min=0.0281 max=0.0579
         : test loss mean=nan ± nan
         : individual accs = ['0.049661', '0.050916', '0.057584', '0.052850', '0.057932', '0.048052', '0.053899', '0.051276', '0.042233', '0.048398', '0.045619', '0.028142', '0.033716', '0.049083', '0.048124', '0.056342', '0.055141', '0.050203', '0.052155', '0.050145']
         : correct/total = [(205, 4128), (214, 4203), (235, 4081), (229, 4333), (237, 4091), (206, 4287), (226, 4193), (223, 4349), (177, 4191), (207, 4277), (189, 4143), (118, 4193), (138, 4093), (206, 4197), (195, 4052), (227, 4029), (229, 4153), (210, 4183), (213, 4084), (207, 4128)]
         : compromised: 0.0469, honest: 0.0500
Round 007: test acc mean=0.0494 ± 0.0063 | min=0.0281 max=0.0579
         : test loss mean=nan ± nan
         : individual accs = ['0.049661', '0.050916', '0.057584', '0.052850', '0.057932', '0.048052', '0.049130', '0.051276', '0.042233', '0.048398', '0.045619', '0.028142', '0.045688', '0.049083', '0.048124', '0.056342', '0.055141', '0.050203', '0.052155', '0.050145']
         : correct/total = [(205, 4128), (214, 4203), (235, 4081), (229, 4333), (237, 4091), (206, 4287), (206, 4193), (223, 4349), (177, 4191), (207, 4277), (189, 4143), (118, 4193), (187, 4093), (206, 4197), (195, 4052), (227, 4029), (229, 4153), (210, 4183), (213, 4084), (207, 4128)]
         : compromised: 0.0489, honest: 0.0497
Round 008: test acc mean=0.0493 ± 0.0062 | min=0.0281 max=0.0576
         : test loss mean=nan ± nan
         : individual accs = ['0.049661', '0.050916', '0.057584', '0.052850', '0.051088', '0.045953', '0.053899', '0.051276', '0.042233', '0.048398', '0.045619', '0.028142', '0.045688', '0.049083', '0.048124', '0.056342', '0.055141', '0.050203', '0.054358', '0.048692']
         : correct/total = [(205, 4128), (214, 4203), (235, 4081), (229, 4333), (209, 4091), (197, 4287), (226, 4193), (223, 4349), (177, 4191), (207, 4277), (189, 4143), (118, 4193), (187, 4093), (206, 4197), (195, 4052), (227, 4029), (229, 4153), (210, 4183), (222, 4084), (201, 4128)]
         : compromised: 0.0489, honest: 0.0494
Round 009: test acc mean=0.0499 ± 0.0042 | min=0.0422 max=0.0612
         : test loss mean=nan ± nan
         : individual accs = ['0.049661', '0.050916', '0.057584', '0.052850', '0.052066', '0.045953', '0.043883', '0.051276', '0.042233', '0.048398', '0.045619', '0.049606', '0.045688', '0.049083', '0.061204', '0.051378', '0.049362', '0.051159', '0.050196', '0.050145']
         : correct/total = [(205, 4128), (214, 4203), (235, 4081), (229, 4333), (213, 4091), (197, 4287), (184, 4193), (223, 4349), (177, 4191), (207, 4277), (189, 4143), (208, 4193), (187, 4093), (206, 4197), (248, 4052), (207, 4029), (205, 4153), (214, 4183), (205, 4084), (207, 4128)]
         : compromised: 0.0505, honest: 0.0496
Round 010: test acc mean=0.0495 ± 0.0033 | min=0.0422 max=0.0576
         : test loss mean=nan ± nan
         : individual accs = ['0.049661', '0.052344', '0.057584', '0.052850', '0.052066', '0.045953', '0.043883', '0.051276', '0.042233', '0.048398', '0.047550', '0.049606', '0.045688', '0.049083', '0.050346', '0.051378', '0.049362', '0.051159', '0.050196', '0.050145']
         : correct/total = [(205, 4128), (220, 4203), (235, 4081), (229, 4333), (213, 4091), (197, 4287), (184, 4193), (223, 4349), (177, 4191), (207, 4277), (197, 4143), (208, 4193), (187, 4093), (206, 4197), (204, 4052), (207, 4029), (205, 4153), (214, 4183), (205, 4084), (207, 4128)]
         : compromised: 0.0487, honest: 0.0499

=== FINAL RESULTS ===
Dataset: femnist, Nodes: 20, Graph: ring, Aggregation: d-fedavg
Attack: backdoor, 30.0% compromised
Final accuracy - Compromised: 0.0487, Honest: 0.0499
Overall test accuracy: mean=0.0495 ± 0.0033

=== BACKDOOR ATTACK SUCCESS RATE (ASR) ===
Target label: 0
Trigger size: 4x4
Overall ASR: 0.0500 ± 0.2179
Honest nodes ASR: 0.0000 ± 0.0000
Compromised nodes ASR: 0.1667 ± 0.3727
Note: Higher ASR indicates more successful backdoor attack
