Device: cuda
Seed: 987654321
Loading 36 LEAF FEMNIST train files...
LEAF FEMNIST train: 3597 users, 734463 samples
Loading 36 LEAF FEMNIST test files...
LEAF FEMNIST test: 3597 users, 83388 samples
Found 3597 train users, 3597 test users, 3597 common users
User sample counts range: 525 (max) to 17 (min)
Distributed ALL 3597 users across 20 clients
Users per client: 179 (with 17 clients getting +1 user)
Train partition sizes: [36360, 37070, 35957, 38262, 36024, 37732, 36921, 38328, 36867, 37683, 36507, 36915, 36007, 37001, 35681, 35453, 36585, 36801, 35964, 36345]
Test partition sizes: [4128, 4203, 4081, 4333, 4091, 4287, 4193, 4349, 4191, 4277, 4143, 4193, 4093, 4197, 4052, 4029, 4153, 4183, 4084, 4128]
  Client 0: 36360 train samples, 62 unique classes
  Client 1: 37070 train samples, 62 unique classes
  Client 2: 35957 train samples, 62 unique classes
  Client 3: 38262 train samples, 62 unique classes
  Client 4: 36024 train samples, 62 unique classes
  Client 5: 37732 train samples, 62 unique classes
  Client 6: 36921 train samples, 62 unique classes
  Client 7: 38328 train samples, 62 unique classes
  Client 8: 36867 train samples, 62 unique classes
  Client 9: 37683 train samples, 62 unique classes
  Client 10: 36507 train samples, 62 unique classes
  Client 11: 36915 train samples, 62 unique classes
  Client 12: 36007 train samples, 62 unique classes
  Client 13: 37001 train samples, 62 unique classes
  Client 14: 35681 train samples, 62 unique classes
  Client 15: 35453 train samples, 62 unique classes
  Client 16: 36585 train samples, 62 unique classes
  Client 17: 36801 train samples, 62 unique classes
  Client 18: 35964 train samples, 62 unique classes
  Client 19: 36345 train samples, 62 unique classes
Will sample 10000 samples per client per epoch
Graph: ring, nodes: 20, edges: 20
Degree statistics: avg=2.00, min=2, max=2
Attack: Compromised 10/20 nodes: [1, 2, 5, 11, 12, 13, 14, 15, 17, 18]
Attack type: directed_deviation, lambda: 1.0
Model variant: baseline
Model parameters: 6,603,710
BALANCE algorithm:
Balance Config: BALANCEConfig(gamma=2, kappa=1, alpha=0.5, min_neighbors=1)
  - Model dimension: 6,603,710 parameters
  - Complexity: O(N×d) = O(20×6,603,710)
Initial test acc across nodes: mean=0.0168 ± 0.0139
Round 001: test acc mean=0.3422 ± 0.1723 | min=0.0043 max=0.5202
         : test loss mean=4284.9632 ± 9166.2112
         : individual accs = ['0.429990', '0.436117', '0.376868', '0.439418', '0.461745', '0.457663', '0.520153', '0.462175', '0.381293', '0.258826', '0.416606', '0.447651', '0.009773', '0.013105', '0.020237', '0.458675', '0.004334', '0.432943', '0.395690', '0.421512']
         : correct/total = [(1775, 4128), (1833, 4203), (1538, 4081), (1904, 4333), (1889, 4091), (1962, 4287), (2181, 4193), (2010, 4349), (1598, 4191), (1107, 4277), (1726, 4143), (1877, 4193), (40, 4093), (55, 4197), (82, 4052), (1848, 4029), (18, 4153), (1811, 4183), (1616, 4084), (1740, 4128)]
         : compromised: 0.3049, honest: 0.3796
Round 002: test acc mean=0.5168 ± 0.3059 | min=0.0457 max=0.7558
         : test loss mean=29537679947342.6758 ± 128070162417317.4688
         : individual accs = ['0.754845', '0.687128', '0.704729', '0.744288', '0.755805', '0.659436', '0.700930', '0.710508', '0.697924', '0.724339', '0.714699', '0.725018', '0.052040', '0.046938', '0.045656', '0.054852', '0.051047', '0.053311', '0.721841', '0.731105']
         : correct/total = [(3116, 4128), (2888, 4203), (2876, 4081), (3225, 4333), (3092, 4091), (2827, 4287), (2939, 4193), (3090, 4349), (2925, 4191), (3098, 4277), (2961, 4143), (3040, 4193), (213, 4093), (197, 4197), (185, 4052), (221, 4029), (212, 4153), (223, 4183), (2948, 4084), (3018, 4128)]
         : compromised: 0.3751, honest: 0.6585
Round 003: test acc mean=0.5608 ± 0.3354 | min=0.0457 max=0.8147
         : test loss mean=1614061504.2731 ± 5709172128.7359
         : individual accs = ['0.795300', '0.788960', '0.794903', '0.790676', '0.814715', '0.702589', '0.780587', '0.782479', '0.760439', '0.788637', '0.780594', '0.770808', '0.045688', '0.055278', '0.045656', '0.050385', '0.051047', '0.048291', '0.784525', '0.784157']
         : correct/total = [(3283, 4128), (3316, 4203), (3244, 4081), (3426, 4333), (3333, 4091), (3012, 4287), (3273, 4193), (3403, 4349), (3187, 4191), (3373, 4277), (3234, 4143), (3232, 4193), (187, 4093), (232, 4197), (185, 4052), (203, 4029), (212, 4153), (202, 4183), (3204, 4084), (3237, 4128)]
         : compromised: 0.4087, honest: 0.7129
Round 004: test acc mean=0.5803 ± 0.3471 | min=0.0457 max=0.8330
         : test loss mean=1.6925 ± 1.5156
         : individual accs = ['0.818798', '0.807994', '0.821612', '0.819986', '0.833048', '0.767903', '0.802767', '0.808462', '0.795037', '0.808277', '0.801110', '0.801813', '0.052040', '0.055278', '0.045656', '0.050881', '0.051047', '0.048291', '0.814153', '0.802810']
         : correct/total = [(3380, 4128), (3396, 4203), (3353, 4081), (3553, 4333), (3408, 4091), (3292, 4287), (3366, 4193), (3516, 4349), (3332, 4191), (3457, 4277), (3319, 4143), (3362, 4193), (213, 4093), (232, 4197), (185, 4052), (205, 4029), (212, 4153), (202, 4183), (3325, 4084), (3314, 4128)]
         : compromised: 0.4266, honest: 0.7341
Round 005: test acc mean=0.5868 ± 0.3605 | min=0.0259 max=0.8358
         : test loss mean=1.5902 ± 1.4876
         : individual accs = ['0.828488', '0.834166', '0.835825', '0.827141', '0.834270', '0.805925', '0.820653', '0.828236', '0.810785', '0.825111', '0.812213', '0.814214', '0.026142', '0.028354', '0.025913', '0.056590', '0.030821', '0.050920', '0.825171', '0.815891']
         : correct/total = [(3420, 4128), (3506, 4203), (3411, 4081), (3584, 4333), (3413, 4091), (3455, 4287), (3441, 4193), (3602, 4349), (3398, 4191), (3529, 4277), (3365, 4143), (3414, 4193), (107, 4093), (119, 4197), (105, 4052), (228, 4029), (128, 4153), (213, 4183), (3370, 4084), (3368, 4128)]
         : compromised: 0.4303, honest: 0.7434
Round 006: test acc mean=0.5975 ± 0.3570 | min=0.0479 max=0.8462
         : test loss mean=82317219.7348 ± 205396639.6606
         : individual accs = ['0.829942', '0.841780', '0.842441', '0.835218', '0.846248', '0.814789', '0.817553', '0.839963', '0.823193', '0.835866', '0.819937', '0.822800', '0.052040', '0.055278', '0.047878', '0.056590', '0.051047', '0.050920', '0.840842', '0.826066']
         : correct/total = [(3426, 4128), (3538, 4203), (3438, 4081), (3619, 4333), (3462, 4091), (3493, 4287), (3428, 4193), (3653, 4349), (3450, 4191), (3575, 4277), (3397, 4143), (3450, 4193), (213, 4093), (232, 4197), (194, 4052), (228, 4029), (212, 4153), (213, 4183), (3434, 4084), (3410, 4128)]
         : compromised: 0.4425, honest: 0.7525
Round 007: test acc mean=0.5965 ± 0.3671 | min=0.0259 max=0.8528
         : test loss mean=3.2168 ± 8.0406
         : individual accs = ['0.837694', '0.842256', '0.846116', '0.843526', '0.852848', '0.822487', '0.828762', '0.845712', '0.828203', '0.844517', '0.823558', '0.825662', '0.026142', '0.028354', '0.025913', '0.056590', '0.030821', '0.048291', '0.843291', '0.829700']
         : correct/total = [(3458, 4128), (3540, 4203), (3453, 4081), (3655, 4333), (3489, 4091), (3526, 4287), (3475, 4193), (3678, 4349), (3471, 4191), (3612, 4277), (3412, 4143), (3462, 4193), (107, 4093), (119, 4197), (105, 4052), (228, 4029), (128, 4153), (202, 4183), (3444, 4084), (3425, 4128)]
         : compromised: 0.4365, honest: 0.7565
Round 008: test acc mean=0.6048 ± 0.3632 | min=0.0472 max=0.8609
         : test loss mean=26199.0233 ± 57981.0397
         : individual accs = ['0.841328', '0.846538', '0.854938', '0.853219', '0.860914', '0.843014', '0.823277', '0.850310', '0.833930', '0.847089', '0.823799', '0.839733', '0.048620', '0.049559', '0.047878', '0.056590', '0.047195', '0.050920', '0.843291', '0.833576']
         : correct/total = [(3473, 4128), (3558, 4203), (3489, 4081), (3697, 4333), (3522, 4091), (3614, 4287), (3452, 4193), (3698, 4349), (3495, 4191), (3623, 4277), (3413, 4143), (3521, 4193), (199, 4093), (208, 4197), (194, 4052), (228, 4029), (196, 4153), (213, 4183), (3444, 4084), (3441, 4128)]
         : compromised: 0.4481, honest: 0.7615
Round 009: test acc mean=0.6044 ± 0.3719 | min=0.0259 max=0.8638
         : test loss mean=1.4583 ± 1.5183
         : individual accs = ['0.842781', '0.854628', '0.856898', '0.854143', '0.863847', '0.849079', '0.839017', '0.855369', '0.840611', '0.851064', '0.841902', '0.834486', '0.026142', '0.028354', '0.025913', '0.056590', '0.030821', '0.050920', '0.849657', '0.834787']
         : correct/total = [(3479, 4128), (3592, 4203), (3497, 4081), (3701, 4333), (3534, 4091), (3640, 4287), (3518, 4193), (3720, 4349), (3523, 4191), (3640, 4277), (3488, 4143), (3499, 4193), (107, 4093), (119, 4197), (105, 4052), (228, 4029), (128, 4153), (213, 4183), (3470, 4084), (3446, 4128)]
         : compromised: 0.4433, honest: 0.7654
Round 010: test acc mean=0.6094 ± 0.3650 | min=0.0469 max=0.8634
         : test loss mean=115258024815814.0000 ± 230966509447635.0000
         : individual accs = ['0.845446', '0.851297', '0.860083', '0.856220', '0.863359', '0.848845', '0.834486', '0.851690', '0.845860', '0.856208', '0.834178', '0.839017', '0.053750', '0.046938', '0.048124', '0.056590', '0.055141', '0.050920', '0.852106', '0.837452']
         : correct/total = [(3490, 4128), (3578, 4203), (3510, 4081), (3710, 4333), (3532, 4091), (3639, 4287), (3499, 4193), (3704, 4349), (3545, 4191), (3662, 4277), (3456, 4143), (3518, 4193), (220, 4093), (197, 4197), (195, 4052), (228, 4029), (229, 4153), (213, 4183), (3480, 4084), (3457, 4128)]
         : compromised: 0.4508, honest: 0.7680

=== FINAL RESULTS ===
Dataset: femnist, Nodes: 20, Graph: ring, Aggregation: balance
Attack: directed_deviation, 50.0% compromised
Final accuracy - Compromised: 0.4508, Honest: 0.7680
Overall test accuracy: mean=0.6094 ± 0.3650

=== BALANCE SUMMARY ===
Node 0: acceptance=0.500
Node 1: acceptance=0.500
Node 2: acceptance=0.500
Node 3: acceptance=0.500
Node 4: acceptance=0.500
Node 5: acceptance=0.850
Node 6: acceptance=0.500
Node 7: acceptance=1.000
Node 8: acceptance=1.000
Node 9: acceptance=1.000
Node 10: acceptance=0.500
Node 11: acceptance=0.500
Node 12: acceptance=0.800
Node 13: acceptance=0.800
Node 14: acceptance=0.900
Node 15: acceptance=0.750
Node 16: acceptance=0.800
Node 17: acceptance=0.750
Node 18: acceptance=0.500
Node 19: acceptance=0.500

=== PARALLEL EXECUTION TIME (realistic for distributed system) ===
  COMMUNICATION (max across nodes):
    - Full model transfer: 0.000s (0.0%)
  COMPUTATION (max across nodes):
    - Filtering: 0.056s (72.2%)
    - Aggregation: 0.022s (27.8%)
  TOTALS:
    - Total computation: 0.078s (100.0%)
    - Total communication: 0.000s (0.0%)
    - Total parallel time: 0.078s

=== PER-NODE AVERAGE TIME ===
  - Filtering: 0.039s
  - Aggregation: 0.006s
  - Model transfer: 0.000s
  - Total per node: 0.045s

=== TOTAL COMPUTATIONAL WORK (sum across all nodes) ===
  - Total filtering: 0.786s
  - Total aggregation: 0.121s
  - Total model transfer: 0.000s
  - Grand total: 0.907s
  - Mean acceptance rate: 0.682

BALANCE Algorithm Properties:
  - Model dimension: 6,603,710
  - No compression: Full parameter comparison
  - Theoretical complexity: O(deg(i)×d)
  - Approach: Full parameter filtering + averaging
