Device: cuda
Seed: 987654321
Loading 36 LEAF FEMNIST train files...
LEAF FEMNIST train: 3597 users, 734463 samples
Loading 36 LEAF FEMNIST test files...
LEAF FEMNIST test: 3597 users, 83388 samples
Found 3597 train users, 3597 test users, 3597 common users
User sample counts range: 525 (max) to 17 (min)
Distributed ALL 3597 users across 20 clients
Users per client: 179 (with 17 clients getting +1 user)
Train partition sizes: [36360, 37070, 35957, 38262, 36024, 37732, 36921, 38328, 36867, 37683, 36507, 36915, 36007, 37001, 35681, 35453, 36585, 36801, 35964, 36345]
Test partition sizes: [4128, 4203, 4081, 4333, 4091, 4287, 4193, 4349, 4191, 4277, 4143, 4193, 4093, 4197, 4052, 4029, 4153, 4183, 4084, 4128]
  Client 0: 36360 train samples, 62 unique classes
  Client 1: 37070 train samples, 62 unique classes
  Client 2: 35957 train samples, 62 unique classes
  Client 3: 38262 train samples, 62 unique classes
  Client 4: 36024 train samples, 62 unique classes
  Client 5: 37732 train samples, 62 unique classes
  Client 6: 36921 train samples, 62 unique classes
  Client 7: 38328 train samples, 62 unique classes
  Client 8: 36867 train samples, 62 unique classes
  Client 9: 37683 train samples, 62 unique classes
  Client 10: 36507 train samples, 62 unique classes
  Client 11: 36915 train samples, 62 unique classes
  Client 12: 36007 train samples, 62 unique classes
  Client 13: 37001 train samples, 62 unique classes
  Client 14: 35681 train samples, 62 unique classes
  Client 15: 35453 train samples, 62 unique classes
  Client 16: 36585 train samples, 62 unique classes
  Client 17: 36801 train samples, 62 unique classes
  Client 18: 35964 train samples, 62 unique classes
  Client 19: 36345 train samples, 62 unique classes
Will sample 10000 samples per client per epoch
Graph: erdos, nodes: 20, edges: 48
Degree statistics: avg=4.80, min=2, max=7
Attack: Compromised 16/20 nodes: [1, 2, 3, 5, 6, 8, 9, 10, 11, 12, 13, 14, 15, 17, 18, 19]
Attack type: backdoor, lambda: 1.0
Backdoor target label: 0, trigger size: 4
Model variant: baseline
Model parameters: 6,603,710
BALANCE algorithm:
Balance Config: BALANCEConfig(gamma=2, kappa=1, alpha=0.5, min_neighbors=1)
  - Model dimension: 6,603,710 parameters
  - Complexity: O(N×d) = O(20×6,603,710)
Initial test acc across nodes: mean=0.0162 ± 0.0138
Backdoor attack: Created poisoned datasets for 16 compromised nodes
Round 001: test acc mean=0.1669 ± 0.1581 | min=0.0427 max=0.4940
         : test loss mean=37261.3092 ± 51823.3877
         : individual accs = ['0.450581', '0.048775', '0.196030', '0.046619', '0.494011', '0.169582', '0.042690', '0.482180', '0.096874', '0.050736', '0.101134', '0.048891', '0.047398', '0.047653', '0.168065', '0.060809', '0.442572', '0.178819', '0.108717', '0.054990']
         : correct/total = [(1860, 4128), (205, 4203), (800, 4081), (202, 4333), (2021, 4091), (727, 4287), (179, 4193), (2097, 4349), (406, 4191), (217, 4277), (419, 4143), (205, 4193), (194, 4093), (200, 4197), (681, 4052), (245, 4029), (1838, 4153), (748, 4183), (444, 4084), (227, 4128)]
         : compromised: 0.0917, honest: 0.4673
Round 002: test acc mean=0.1838 ± 0.2755 | min=0.0036 max=0.7457
         : test loss mean=565609926.9684 ± 2464127771.3845
         : individual accs = ['0.737888', '0.052819', '0.057339', '0.049619', '0.730139', '0.052484', '0.003577', '0.745689', '0.052255', '0.050736', '0.047550', '0.048891', '0.034693', '0.048606', '0.047384', '0.049640', '0.723333', '0.049247', '0.038932', '0.054990']
         : correct/total = [(3046, 4128), (222, 4203), (234, 4081), (215, 4333), (2987, 4091), (225, 4287), (15, 4193), (3243, 4349), (219, 4191), (217, 4277), (197, 4143), (205, 4193), (142, 4093), (204, 4197), (192, 4052), (200, 4029), (3004, 4153), (206, 4183), (159, 4084), (227, 4128)]
         : compromised: 0.0462, honest: 0.7343
Round 003: test acc mean=0.1982 ± 0.2972 | min=0.0415 max=0.8009
         : test loss mean=nan ± nan
         : individual accs = ['0.795300', '0.048775', '0.049743', '0.046619', '0.786849', '0.052484', '0.041498', '0.800874', '0.051062', '0.050736', '0.048033', '0.048891', '0.047398', '0.047653', '0.054788', '0.054604', '0.786901', '0.049247', '0.054358', '0.047965']
         : correct/total = [(3283, 4128), (205, 4203), (203, 4081), (202, 4333), (3219, 4091), (225, 4287), (174, 4193), (3483, 4349), (214, 4191), (217, 4277), (199, 4143), (205, 4193), (194, 4093), (200, 4197), (222, 4052), (220, 4029), (3268, 4153), (206, 4183), (222, 4084), (198, 4128)]
         : compromised: 0.0496, honest: 0.7925
Round 004: test acc mean=0.2026 ± 0.3051 | min=0.0415 max=0.8232
         : test loss mean=nan ± nan
         : individual accs = ['0.807413', '0.048775', '0.049743', '0.046619', '0.809826', '0.052484', '0.041498', '0.823178', '0.051062', '0.050736', '0.048033', '0.048891', '0.047398', '0.047653', '0.054788', '0.054604', '0.810980', '0.049247', '0.054358', '0.054990']
         : correct/total = [(3333, 4128), (205, 4203), (203, 4081), (202, 4333), (3313, 4091), (225, 4287), (174, 4193), (3580, 4349), (214, 4191), (217, 4277), (199, 4143), (205, 4193), (194, 4093), (200, 4197), (222, 4052), (220, 4029), (3368, 4153), (206, 4183), (222, 4084), (227, 4128)]
         : compromised: 0.0501, honest: 0.8128
Round 005: test acc mean=0.2051 ± 0.3102 | min=0.0415 max=0.8338
         : test loss mean=nan ± nan
         : individual accs = ['0.819525', '0.048775', '0.049743', '0.046619', '0.826693', '0.052484', '0.041498', '0.833755', '0.051062', '0.050736', '0.048033', '0.048891', '0.047398', '0.047653', '0.054788', '0.054604', '0.822056', '0.049247', '0.054358', '0.054990']
         : correct/total = [(3383, 4128), (205, 4203), (203, 4081), (202, 4333), (3382, 4091), (225, 4287), (174, 4193), (3626, 4349), (214, 4191), (217, 4277), (199, 4143), (205, 4193), (194, 4093), (200, 4197), (222, 4052), (220, 4029), (3414, 4153), (206, 4183), (222, 4084), (227, 4128)]
         : compromised: 0.0501, honest: 0.8255
Round 006: test acc mean=0.2062 ± 0.3123 | min=0.0415 max=0.8363
         : test loss mean=nan ± nan
         : individual accs = ['0.827519', '0.048775', '0.049743', '0.046619', '0.827915', '0.052484', '0.041498', '0.836284', '0.051062', '0.050736', '0.048033', '0.048891', '0.047398', '0.047653', '0.054788', '0.054604', '0.831206', '0.049247', '0.054358', '0.054990']
         : correct/total = [(3416, 4128), (205, 4203), (203, 4081), (202, 4333), (3387, 4091), (225, 4287), (174, 4193), (3637, 4349), (214, 4191), (217, 4277), (199, 4143), (205, 4193), (194, 4093), (200, 4197), (222, 4052), (220, 4029), (3452, 4153), (206, 4183), (222, 4084), (227, 4128)]
         : compromised: 0.0501, honest: 0.8307
Round 007: test acc mean=0.2084 ± 0.3166 | min=0.0415 max=0.8464
         : test loss mean=nan ± nan
         : individual accs = ['0.835998', '0.048775', '0.049743', '0.046619', '0.838181', '0.052484', '0.041498', '0.846401', '0.051062', '0.050736', '0.048033', '0.048891', '0.047398', '0.047653', '0.054788', '0.054604', '0.845654', '0.049247', '0.054358', '0.054990']
         : correct/total = [(3451, 4128), (205, 4203), (203, 4081), (202, 4333), (3429, 4091), (225, 4287), (174, 4193), (3681, 4349), (214, 4191), (217, 4277), (199, 4143), (205, 4193), (194, 4093), (200, 4197), (222, 4052), (220, 4029), (3512, 4153), (206, 4183), (222, 4084), (227, 4128)]
         : compromised: 0.0501, honest: 0.8416
Round 008: test acc mean=0.2081 ± 0.3161 | min=0.0415 max=0.8503
         : test loss mean=nan ± nan
         : individual accs = ['0.828973', '0.048775', '0.049743', '0.046619', '0.841359', '0.052484', '0.041498', '0.850310', '0.051062', '0.050736', '0.048033', '0.048891', '0.047398', '0.047653', '0.054788', '0.054604', '0.840597', '0.049247', '0.054358', '0.054990']
         : correct/total = [(3422, 4128), (205, 4203), (203, 4081), (202, 4333), (3442, 4091), (225, 4287), (174, 4193), (3698, 4349), (214, 4191), (217, 4277), (199, 4143), (205, 4193), (194, 4093), (200, 4197), (222, 4052), (220, 4029), (3491, 4153), (206, 4183), (222, 4084), (227, 4128)]
         : compromised: 0.0501, honest: 0.8403
Round 009: test acc mean=0.2089 ± 0.3176 | min=0.0415 max=0.8549
         : test loss mean=nan ± nan
         : individual accs = ['0.837452', '0.048775', '0.049743', '0.046619', '0.839404', '0.052484', '0.041498', '0.854909', '0.051062', '0.050736', '0.048033', '0.048891', '0.047398', '0.047653', '0.054788', '0.054604', '0.844450', '0.049247', '0.054358', '0.054990']
         : correct/total = [(3457, 4128), (205, 4203), (203, 4081), (202, 4333), (3434, 4091), (225, 4287), (174, 4193), (3718, 4349), (214, 4191), (217, 4277), (199, 4143), (205, 4193), (194, 4093), (200, 4197), (222, 4052), (220, 4029), (3507, 4153), (206, 4183), (222, 4084), (227, 4128)]
         : compromised: 0.0501, honest: 0.8441
Round 010: test acc mean=0.2092 ± 0.3184 | min=0.0415 max=0.8542
         : test loss mean=nan ± nan
         : individual accs = ['0.843023', '0.048775', '0.049743', '0.046619', '0.842581', '0.052484', '0.041498', '0.854219', '0.051062', '0.050736', '0.048033', '0.048891', '0.047398', '0.047653', '0.054788', '0.054604', '0.843968', '0.049247', '0.054358', '0.054990']
         : correct/total = [(3480, 4128), (205, 4203), (203, 4081), (202, 4333), (3447, 4091), (225, 4287), (174, 4193), (3715, 4349), (214, 4191), (217, 4277), (199, 4143), (205, 4193), (194, 4093), (200, 4197), (222, 4052), (220, 4029), (3505, 4153), (206, 4183), (222, 4084), (227, 4128)]
         : compromised: 0.0501, honest: 0.8459

=== FINAL RESULTS ===
Dataset: femnist, Nodes: 20, Graph: erdos, Aggregation: balance
Attack: backdoor, 80.0% compromised
Final accuracy - Compromised: 0.0501, Honest: 0.8459
Overall test accuracy: mean=0.2092 ± 0.3184

=== BACKDOOR ATTACK SUCCESS RATE (ASR) ===
Target label: 0
Trigger size: 4x4
Overall ASR: 0.8106 ± 0.3789
Honest nodes ASR: 0.0528 ± 0.0044
Compromised nodes ASR: 1.0000 ± 0.0000
Note: Higher ASR indicates more successful backdoor attack

=== BALANCE SUMMARY ===
Node 0: acceptance=0.167
Node 1: acceptance=0.233
Node 2: acceptance=0.220
Node 3: acceptance=0.100
Node 4: acceptance=0.250
Node 5: acceptance=0.220
Node 6: acceptance=0.220
Node 7: acceptance=0.200
Node 8: acceptance=0.250
Node 9: acceptance=0.233
Node 10: acceptance=0.225
Node 11: acceptance=0.200
Node 12: acceptance=0.243
Node 13: acceptance=0.100
Node 14: acceptance=0.214
Node 15: acceptance=0.217
Node 16: acceptance=0.200
Node 17: acceptance=0.240
Node 18: acceptance=0.225
Node 19: acceptance=0.200

=== PARALLEL EXECUTION TIME (realistic for distributed system) ===
  COMMUNICATION (max across nodes):
    - Full model transfer: 0.000s (0.0%)
  COMPUTATION (max across nodes):
    - Filtering: 0.032s (74.8%)
    - Aggregation: 0.011s (25.1%)
  TOTALS:
    - Total computation: 0.043s (100.0%)
    - Total communication: 0.000s (0.0%)
    - Total parallel time: 0.043s

=== PER-NODE AVERAGE TIME ===
  - Filtering: 0.023s
  - Aggregation: 0.003s
  - Model transfer: 0.000s
  - Total per node: 0.027s

=== TOTAL COMPUTATIONAL WORK (sum across all nodes) ===
  - Total filtering: 0.468s
  - Total aggregation: 0.069s
  - Total model transfer: 0.000s
  - Grand total: 0.538s
  - Mean acceptance rate: 0.208

BALANCE Algorithm Properties:
  - Model dimension: 6,603,710
  - No compression: Full parameter comparison
  - Theoretical complexity: O(deg(i)×d)
  - Approach: Full parameter filtering + averaging
