Device: cuda
Seed: 987654321
Loading 36 LEAF FEMNIST train files...
LEAF FEMNIST train: 3597 users, 734463 samples
Loading 36 LEAF FEMNIST test files...
LEAF FEMNIST test: 3597 users, 83388 samples
Found 3597 train users, 3597 test users, 3597 common users
User sample counts range: 525 (max) to 17 (min)
Distributed ALL 3597 users across 20 clients
Users per client: 179 (with 17 clients getting +1 user)
Train partition sizes: [36360, 37070, 35957, 38262, 36024, 37732, 36921, 38328, 36867, 37683, 36507, 36915, 36007, 37001, 35681, 35453, 36585, 36801, 35964, 36345]
Test partition sizes: [4128, 4203, 4081, 4333, 4091, 4287, 4193, 4349, 4191, 4277, 4143, 4193, 4093, 4197, 4052, 4029, 4153, 4183, 4084, 4128]
  Client 0: 36360 train samples, 62 unique classes
  Client 1: 37070 train samples, 62 unique classes
  Client 2: 35957 train samples, 62 unique classes
  Client 3: 38262 train samples, 62 unique classes
  Client 4: 36024 train samples, 62 unique classes
  Client 5: 37732 train samples, 62 unique classes
  Client 6: 36921 train samples, 62 unique classes
  Client 7: 38328 train samples, 62 unique classes
  Client 8: 36867 train samples, 62 unique classes
  Client 9: 37683 train samples, 62 unique classes
  Client 10: 36507 train samples, 62 unique classes
  Client 11: 36915 train samples, 62 unique classes
  Client 12: 36007 train samples, 62 unique classes
  Client 13: 37001 train samples, 62 unique classes
  Client 14: 35681 train samples, 62 unique classes
  Client 15: 35453 train samples, 62 unique classes
  Client 16: 36585 train samples, 62 unique classes
  Client 17: 36801 train samples, 62 unique classes
  Client 18: 35964 train samples, 62 unique classes
  Client 19: 36345 train samples, 62 unique classes
Will sample 4500 samples per client per epoch
Graph: erdos, nodes: 20, edges: 99
Degree statistics: avg=9.90, min=7, max=14
Attack: Compromised 8/20 nodes: [1, 5, 11, 12, 13, 14, 17, 18]
Attack type: directed_deviation, lambda: 1.0
Model variant: baseline
Model parameters: 6,603,710
Initial test acc across nodes: mean=0.0168 ± 0.0139
Round 001: test acc mean=0.0345 ± 0.0210 | min=0.0029 max=0.0612
         : test loss mean=39743.9104 ± 80270.0009
         : individual accs = ['0.051599', '0.052344', '0.048272', '0.010155', '0.008800', '0.005365', '0.049130', '0.009657', '0.031019', '0.053776', '0.050447', '0.028858', '0.053750', '0.002859', '0.061204', '0.004468', '0.012521', '0.050203', '0.050930', '0.054506']
         : correct/total = [(213, 4128), (220, 4203), (197, 4081), (44, 4333), (36, 4091), (23, 4287), (206, 4193), (42, 4349), (130, 4191), (230, 4277), (209, 4143), (121, 4193), (220, 4093), (12, 4197), (248, 4052), (18, 4029), (52, 4153), (210, 4183), (208, 4084), (225, 4128)]
         : compromised: 0.0382, honest: 0.0320
Round 002: test acc mean=0.0508 ± 0.0108 | min=0.0430 max=0.0953
         : test loss mean=1742098145.0717 ± 4000739311.1730
         : individual accs = ['0.050145', '0.046158', '0.095320', '0.043157', '0.043021', '0.045253', '0.044598', '0.045068', '0.053209', '0.050503', '0.045619', '0.053184', '0.053750', '0.047177', '0.051826', '0.051626', '0.051288', '0.049486', '0.050930', '0.045058']
         : correct/total = [(207, 4128), (194, 4203), (389, 4081), (187, 4333), (176, 4091), (194, 4287), (187, 4193), (196, 4349), (223, 4191), (216, 4277), (189, 4143), (223, 4193), (220, 4093), (198, 4197), (210, 4052), (208, 4029), (213, 4153), (207, 4183), (208, 4084), (186, 4128)]
         : compromised: 0.0497, honest: 0.0516
Round 003: test acc mean=0.0428 ± 0.0161 | min=0.0084 max=0.0635
         : test loss mean=223727911678.9396 ± 783367123324.5212
         : individual accs = ['0.059593', '0.052344', '0.054889', '0.040157', '0.051088', '0.018661', '0.033389', '0.051276', '0.049630', '0.059855', '0.063481', '0.054376', '0.058637', '0.028592', '0.010612', '0.008439', '0.044546', '0.050203', '0.033301', '0.032219']
         : correct/total = [(246, 4128), (220, 4203), (224, 4081), (174, 4333), (209, 4091), (80, 4287), (140, 4193), (223, 4349), (208, 4191), (256, 4277), (263, 4143), (228, 4193), (240, 4093), (120, 4197), (43, 4052), (34, 4029), (185, 4153), (210, 4183), (136, 4084), (133, 4128)]
         : compromised: 0.0383, honest: 0.0457
Round 004: test acc mean=0.0481 ± 0.0088 | min=0.0250 max=0.0618
         : test loss mean=628800.3612 ± 2739902.9217
         : individual accs = ['0.051599', '0.051630', '0.024994', '0.048465', '0.043266', '0.050618', '0.057000', '0.051276', '0.053209', '0.047463', '0.050447', '0.061770', '0.053750', '0.046938', '0.037759', '0.032266', '0.058271', '0.037533', '0.052889', '0.050872']
         : correct/total = [(213, 4128), (217, 4203), (102, 4081), (210, 4333), (177, 4091), (217, 4287), (239, 4193), (223, 4349), (223, 4191), (203, 4277), (209, 4143), (259, 4193), (220, 4093), (197, 4197), (153, 4052), (130, 4029), (242, 4153), (157, 4183), (216, 4084), (210, 4128)]
         : compromised: 0.0491, honest: 0.0474
Round 005: test acc mean=0.0447 ± 0.0131 | min=0.0167 max=0.0624
         : test loss mean=1415136.8246 ± 5569269.1327
         : individual accs = ['0.030523', '0.051630', '0.056114', '0.036464', '0.051088', '0.048052', '0.033389', '0.018395', '0.053209', '0.053075', '0.050447', '0.028142', '0.053750', '0.062426', '0.061204', '0.041698', '0.040212', '0.016734', '0.052889', '0.055475']
         : correct/total = [(126, 4128), (217, 4203), (229, 4081), (158, 4333), (209, 4091), (206, 4287), (140, 4193), (80, 4349), (223, 4191), (227, 4277), (209, 4143), (118, 4193), (220, 4093), (262, 4197), (248, 4052), (168, 4029), (167, 4153), (70, 4183), (216, 4084), (229, 4128)]
         : compromised: 0.0469, honest: 0.0433
Round 006: test acc mean=0.0298 ± 0.0167 | min=0.0141 max=0.0578
         : test loss mean=1302.9541 ± 2034.4829
         : individual accs = ['0.049176', '0.015703', '0.045087', '0.018232', '0.044977', '0.057849', '0.018841', '0.018395', '0.053209', '0.015665', '0.050447', '0.014071', '0.016125', '0.049559', '0.018263', '0.014892', '0.014688', '0.016734', '0.014691', '0.048692']
         : correct/total = [(203, 4128), (66, 4203), (184, 4081), (79, 4333), (184, 4091), (248, 4287), (79, 4193), (80, 4349), (223, 4191), (67, 4277), (209, 4143), (59, 4193), (66, 4093), (208, 4197), (74, 4052), (60, 4029), (61, 4153), (70, 4183), (60, 4084), (201, 4128)]
         : compromised: 0.0254, honest: 0.0327
Round 007: test acc mean=0.0350 ± 0.0170 | min=0.0141 max=0.0563
         : test loss mean=3227.4247 ± 7754.5588
         : individual accs = ['0.016473', '0.051630', '0.050723', '0.048465', '0.051088', '0.048052', '0.018841', '0.018395', '0.047960', '0.015665', '0.016896', '0.014071', '0.016125', '0.046938', '0.048124', '0.056342', '0.055141', '0.016734', '0.014691', '0.048450']
         : correct/total = [(68, 4128), (217, 4203), (207, 4081), (210, 4333), (209, 4091), (206, 4287), (79, 4193), (80, 4349), (201, 4191), (67, 4277), (70, 4143), (59, 4193), (66, 4093), (197, 4197), (195, 4052), (227, 4029), (229, 4153), (70, 4183), (60, 4084), (200, 4128)]
         : compromised: 0.0320, honest: 0.0370
Round 008: test acc mean=0.0347 ± 0.0174 | min=0.0138 max=0.0563
         : test loss mean=101.3371 ± 208.9206
         : individual accs = ['0.016473', '0.015703', '0.014702', '0.048465', '0.051088', '0.048052', '0.018841', '0.051276', '0.013839', '0.046528', '0.050447', '0.014071', '0.016125', '0.046938', '0.050346', '0.056342', '0.055141', '0.016734', '0.014691', '0.048450']
         : correct/total = [(68, 4128), (66, 4203), (60, 4081), (210, 4333), (209, 4091), (206, 4287), (79, 4193), (223, 4349), (58, 4191), (199, 4277), (209, 4143), (59, 4193), (66, 4093), (197, 4197), (204, 4052), (227, 4029), (229, 4153), (70, 4183), (60, 4084), (200, 4128)]
         : compromised: 0.0278, honest: 0.0393
Round 009: test acc mean=0.0454 ± 0.0127 | min=0.0141 max=0.0563
         : test loss mean=95.5369 ± 332.6161
         : individual accs = ['0.051599', '0.051630', '0.055134', '0.048465', '0.051088', '0.048052', '0.049130', '0.018395', '0.047960', '0.053075', '0.041999', '0.014071', '0.053750', '0.046938', '0.048124', '0.056342', '0.055141', '0.016734', '0.052889', '0.048450']
         : correct/total = [(213, 4128), (217, 4203), (225, 4081), (210, 4333), (209, 4091), (206, 4287), (206, 4193), (80, 4349), (201, 4191), (227, 4277), (174, 4143), (59, 4193), (220, 4093), (197, 4197), (195, 4052), (227, 4029), (229, 4153), (70, 4183), (216, 4084), (200, 4128)]
         : compromised: 0.0415, honest: 0.0481
Round 010: test acc mean=0.0514 ± 0.0035 | min=0.0469 max=0.0618
         : test loss mean=3.9454 ± 0.0052
         : individual accs = ['0.051599', '0.052344', '0.050723', '0.048465', '0.051088', '0.048052', '0.049130', '0.051276', '0.047960', '0.053776', '0.050447', '0.061770', '0.053750', '0.046938', '0.048124', '0.056342', '0.055141', '0.050203', '0.052889', '0.048450']
         : correct/total = [(213, 4128), (220, 4203), (207, 4081), (210, 4333), (209, 4091), (206, 4287), (206, 4193), (223, 4349), (201, 4191), (230, 4277), (209, 4143), (259, 4193), (220, 4093), (197, 4197), (195, 4052), (227, 4029), (229, 4153), (210, 4183), (216, 4084), (200, 4128)]
         : compromised: 0.0518, honest: 0.0512

=== FINAL RESULTS ===
Dataset: femnist, Nodes: 20, Graph: erdos, Aggregation: krum
Attack: directed_deviation, 40.0% compromised
Final accuracy - Compromised: 0.0518, Honest: 0.0512
Overall test accuracy: mean=0.0514 ± 0.0035
