Device: cuda
Seed: 987654321
Loading 36 LEAF FEMNIST train files...
LEAF FEMNIST train: 3597 users, 734463 samples
Loading 36 LEAF FEMNIST test files...
LEAF FEMNIST test: 3597 users, 83388 samples
Found 3597 train users, 3597 test users, 3597 common users
User sample counts range: 525 (max) to 17 (min)
Distributed ALL 3597 users across 20 clients
Users per client: 179 (with 17 clients getting +1 user)
Train partition sizes: [36360, 37070, 35957, 38262, 36024, 37732, 36921, 38328, 36867, 37683, 36507, 36915, 36007, 37001, 35681, 35453, 36585, 36801, 35964, 36345]
Test partition sizes: [4128, 4203, 4081, 4333, 4091, 4287, 4193, 4349, 4191, 4277, 4143, 4193, 4093, 4197, 4052, 4029, 4153, 4183, 4084, 4128]
  Client 0: 36360 train samples, 62 unique classes
  Client 1: 37070 train samples, 62 unique classes
  Client 2: 35957 train samples, 62 unique classes
  Client 3: 38262 train samples, 62 unique classes
  Client 4: 36024 train samples, 62 unique classes
  Client 5: 37732 train samples, 62 unique classes
  Client 6: 36921 train samples, 62 unique classes
  Client 7: 38328 train samples, 62 unique classes
  Client 8: 36867 train samples, 62 unique classes
  Client 9: 37683 train samples, 62 unique classes
  Client 10: 36507 train samples, 62 unique classes
  Client 11: 36915 train samples, 62 unique classes
  Client 12: 36007 train samples, 62 unique classes
  Client 13: 37001 train samples, 62 unique classes
  Client 14: 35681 train samples, 62 unique classes
  Client 15: 35453 train samples, 62 unique classes
  Client 16: 36585 train samples, 62 unique classes
  Client 17: 36801 train samples, 62 unique classes
  Client 18: 35964 train samples, 62 unique classes
  Client 19: 36345 train samples, 62 unique classes
Will sample 10000 samples per client per epoch
Graph: erdos, nodes: 20, edges: 126
Degree statistics: avg=12.60, min=8, max=16
Attack: Compromised 12/20 nodes: [1, 2, 3, 5, 8, 11, 12, 13, 14, 15, 17, 18]
Attack type: backdoor, lambda: 1.0
Backdoor target label: 0, trigger size: 4
Model variant: baseline
Model parameters: 6,603,710
Sketchguard Node 0:
  Model dim: 6,603,710 → Sketch size: 1000
  Compression ratio: 6603.7x
  Using model parameters for aggregation, sketches for filtering
Sketchguard Node 1:
  Model dim: 6,603,710 → Sketch size: 1000
  Compression ratio: 6603.7x
  Using model parameters for aggregation, sketches for filtering
Sketchguard Node 2:
  Model dim: 6,603,710 → Sketch size: 1000
  Compression ratio: 6603.7x
  Using model parameters for aggregation, sketches for filtering
Sketchguard Node 3:
  Model dim: 6,603,710 → Sketch size: 1000
  Compression ratio: 6603.7x
  Using model parameters for aggregation, sketches for filtering
Sketchguard Node 4:
  Model dim: 6,603,710 → Sketch size: 1000
  Compression ratio: 6603.7x
  Using model parameters for aggregation, sketches for filtering
Sketchguard Node 5:
  Model dim: 6,603,710 → Sketch size: 1000
  Compression ratio: 6603.7x
  Using model parameters for aggregation, sketches for filtering
Sketchguard Node 6:
  Model dim: 6,603,710 → Sketch size: 1000
  Compression ratio: 6603.7x
  Using model parameters for aggregation, sketches for filtering
Sketchguard Node 7:
  Model dim: 6,603,710 → Sketch size: 1000
  Compression ratio: 6603.7x
  Using model parameters for aggregation, sketches for filtering
Sketchguard Node 8:
  Model dim: 6,603,710 → Sketch size: 1000
  Compression ratio: 6603.7x
  Using model parameters for aggregation, sketches for filtering
Sketchguard Node 9:
  Model dim: 6,603,710 → Sketch size: 1000
  Compression ratio: 6603.7x
  Using model parameters for aggregation, sketches for filtering
Sketchguard Node 10:
  Model dim: 6,603,710 → Sketch size: 1000
  Compression ratio: 6603.7x
  Using model parameters for aggregation, sketches for filtering
Sketchguard Node 11:
  Model dim: 6,603,710 → Sketch size: 1000
  Compression ratio: 6603.7x
  Using model parameters for aggregation, sketches for filtering
Sketchguard Node 12:
  Model dim: 6,603,710 → Sketch size: 1000
  Compression ratio: 6603.7x
  Using model parameters for aggregation, sketches for filtering
Sketchguard Node 13:
  Model dim: 6,603,710 → Sketch size: 1000
  Compression ratio: 6603.7x
  Using model parameters for aggregation, sketches for filtering
Sketchguard Node 14:
  Model dim: 6,603,710 → Sketch size: 1000
  Compression ratio: 6603.7x
  Using model parameters for aggregation, sketches for filtering
Sketchguard Node 15:
  Model dim: 6,603,710 → Sketch size: 1000
  Compression ratio: 6603.7x
  Using model parameters for aggregation, sketches for filtering
Sketchguard Node 16:
  Model dim: 6,603,710 → Sketch size: 1000
  Compression ratio: 6603.7x
  Using model parameters for aggregation, sketches for filtering
Sketchguard Node 17:
  Model dim: 6,603,710 → Sketch size: 1000
  Compression ratio: 6603.7x
  Using model parameters for aggregation, sketches for filtering
Sketchguard Node 18:
  Model dim: 6,603,710 → Sketch size: 1000
  Compression ratio: 6603.7x
  Using model parameters for aggregation, sketches for filtering
Sketchguard Node 19:
  Model dim: 6,603,710 → Sketch size: 1000
  Compression ratio: 6603.7x
  Using model parameters for aggregation, sketches for filtering
Sketchguard ALGORITHM (Sketch-based Filtering + State Aggregation)
  - Model dimension: 6,603,710 parameters
  - Config: SketchguardConfig(gamma=2, kappa=1, alpha=0.5, min_neighbors=1, sketch_size=1000, network_seed=987654321, attack_detection_window=5)
  - Sketch size: 1000
  - Compression ratio: 6603.7x
  - Complexity: O(d + N×k) = O(6,603,710 + 20×1000)
  - Theoretical speedup vs BALANCE: 19.9x
Initial test acc across nodes: mean=0.0168 ± 0.0139
Backdoor attack: Created poisoned datasets for 12 compromised nodes
Round 001: test acc mean=0.2579 ± 0.1890 | min=0.0488 max=0.5412
         : test loss mean=10457.7397 ± 9046.9004
         : individual accs = ['0.541182', '0.048775', '0.196520', '0.049388', '0.480567', '0.215769', '0.487002', '0.512991', '0.096874', '0.427636', '0.478880', '0.107322', '0.054239', '0.049083', '0.150049', '0.078680', '0.433903', '0.155152', '0.103085', '0.490310']
         : correct/total = [(2234, 4128), (205, 4203), (802, 4081), (214, 4333), (1966, 4091), (925, 4287), (2042, 4193), (2231, 4349), (406, 4191), (1829, 4277), (1984, 4143), (450, 4193), (222, 4093), (206, 4197), (608, 4052), (317, 4029), (1802, 4153), (649, 4183), (421, 4084), (2024, 4128)]
         : compromised: 0.1087, honest: 0.4816
         : sketchguard stats = ['Node 0: acc_rate=0.438', 'Node 1: acc_rate=0.545', 'Node 2: acc_rate=0.417']...
Round 002: test acc mean=0.2958 ± 0.3045 | min=0.0369 max=0.6849
         : test loss mean=51592678.1190 ± 224126330.8088
         : individual accs = ['0.679021', '0.036878', '0.053418', '0.045234', '0.684918', '0.048519', '0.657763', '0.664751', '0.042711', '0.655600', '0.676563', '0.049606', '0.048620', '0.055278', '0.046644', '0.043683', '0.659523', '0.048291', '0.048482', '0.670300']
         : correct/total = [(2803, 4128), (155, 4203), (218, 4081), (196, 4333), (2802, 4091), (208, 4287), (2758, 4193), (2891, 4349), (179, 4191), (2804, 4277), (2803, 4143), (208, 4193), (199, 4093), (232, 4197), (189, 4052), (176, 4029), (2739, 4153), (202, 4183), (198, 4084), (2767, 4128)]
         : compromised: 0.0473, honest: 0.6686
         : sketchguard stats = ['Node 0: acc_rate=0.438', 'Node 1: acc_rate=0.773', 'Node 2: acc_rate=0.708']...
Round 003: test acc mean=0.3079 ± 0.3162 | min=0.0432 max=0.7255
         : test loss mean=nan ± nan
         : individual accs = ['0.702277', '0.048775', '0.053418', '0.043157', '0.725495', '0.045253', '0.678750', '0.697402', '0.049630', '0.701894', '0.698769', '0.049606', '0.054239', '0.049321', '0.051826', '0.051626', '0.651336', '0.049486', '0.052889', '0.702277']
         : correct/total = [(2899, 4128), (205, 4203), (218, 4081), (187, 4333), (2968, 4091), (194, 4287), (2846, 4193), (3033, 4349), (208, 4191), (3002, 4277), (2895, 4143), (208, 4193), (222, 4093), (207, 4197), (210, 4052), (208, 4029), (2705, 4153), (207, 4183), (216, 4084), (2899, 4128)]
         : compromised: 0.0499, honest: 0.6948
         : sketchguard stats = ['Node 0: acc_rate=0.438', 'Node 1: acc_rate=0.848', 'Node 2: acc_rate=0.806']...
Round 004: test acc mean=0.3179 ± 0.3283 | min=0.0432 max=0.7502
         : test loss mean=nan ± nan
         : individual accs = ['0.710029', '0.048775', '0.053418', '0.043157', '0.750183', '0.045253', '0.721679', '0.717636', '0.049630', '0.707505', '0.722182', '0.049606', '0.054239', '0.049083', '0.051826', '0.051626', '0.730315', '0.049486', '0.052889', '0.698886']
         : correct/total = [(2931, 4128), (205, 4203), (218, 4081), (187, 4333), (3069, 4091), (194, 4287), (3026, 4193), (3121, 4349), (208, 4191), (3026, 4277), (2992, 4143), (208, 4193), (222, 4093), (206, 4197), (210, 4052), (208, 4029), (3033, 4153), (207, 4183), (216, 4084), (2885, 4128)]
         : compromised: 0.0499, honest: 0.7198
         : sketchguard stats = ['Node 0: acc_rate=0.438', 'Node 1: acc_rate=0.636', 'Node 2: acc_rate=0.604']...
Round 005: test acc mean=0.3432 ± 0.3593 | min=0.0432 max=0.7952
         : test loss mean=nan ± nan
         : individual accs = ['0.780766', '0.048775', '0.053418', '0.043157', '0.795160', '0.045253', '0.771285', '0.794665', '0.049630', '0.792144', '0.776249', '0.049606', '0.054239', '0.049083', '0.051826', '0.051626', '0.785697', '0.049486', '0.052889', '0.769138']
         : correct/total = [(3223, 4128), (205, 4203), (218, 4081), (187, 4333), (3253, 4091), (194, 4287), (3234, 4193), (3456, 4349), (208, 4191), (3388, 4277), (3216, 4143), (208, 4193), (222, 4093), (206, 4197), (210, 4052), (208, 4029), (3263, 4153), (207, 4183), (216, 4084), (3175, 4128)]
         : compromised: 0.0499, honest: 0.7831
         : sketchguard stats = ['Node 0: acc_rate=0.438', 'Node 1: acc_rate=0.509', 'Node 2: acc_rate=0.483']...
Round 006: test acc mean=0.3550 ± 0.3737 | min=0.0432 max=0.8218
         : test loss mean=nan ± nan
         : individual accs = ['0.811531', '0.048775', '0.053418', '0.043157', '0.821804', '0.045253', '0.810875', '0.820648', '0.049630', '0.817162', '0.804490', '0.049606', '0.054239', '0.049083', '0.051826', '0.051626', '0.812425', '0.049486', '0.052889', '0.803052']
         : correct/total = [(3350, 4128), (205, 4203), (218, 4081), (187, 4333), (3362, 4091), (194, 4287), (3400, 4193), (3569, 4349), (208, 4191), (3495, 4277), (3333, 4143), (208, 4193), (222, 4093), (206, 4197), (210, 4052), (208, 4029), (3374, 4153), (207, 4183), (216, 4084), (3315, 4128)]
         : compromised: 0.0499, honest: 0.8127
         : sketchguard stats = ['Node 0: acc_rate=0.438', 'Node 1: acc_rate=0.424', 'Node 2: acc_rate=0.403']...
Round 007: test acc mean=0.3621 ± 0.3824 | min=0.0432 max=0.8418
         : test loss mean=nan ± nan
         : individual accs = ['0.827762', '0.048775', '0.053418', '0.043157', '0.840870', '0.045253', '0.825900', '0.841803', '0.049630', '0.836568', '0.817282', '0.049606', '0.054239', '0.049083', '0.051826', '0.051626', '0.832410', '0.049486', '0.052889', '0.820736']
         : correct/total = [(3417, 4128), (205, 4203), (218, 4081), (187, 4333), (3440, 4091), (194, 4287), (3463, 4193), (3661, 4349), (208, 4191), (3578, 4277), (3386, 4143), (208, 4193), (222, 4093), (206, 4197), (210, 4052), (208, 4029), (3457, 4153), (207, 4183), (216, 4084), (3388, 4128)]
         : compromised: 0.0499, honest: 0.8304
         : sketchguard stats = ['Node 0: acc_rate=0.438', 'Node 1: acc_rate=0.364', 'Node 2: acc_rate=0.345']...
Round 008: test acc mean=0.3655 ± 0.3865 | min=0.0432 max=0.8489
         : test loss mean=nan ± nan
         : individual accs = ['0.838178', '0.048775', '0.053418', '0.043157', '0.848937', '0.045253', '0.832101', '0.846172', '0.049630', '0.846855', '0.828144', '0.049606', '0.054239', '0.049083', '0.051826', '0.051626', '0.840116', '0.049486', '0.052889', '0.830184']
         : correct/total = [(3460, 4128), (205, 4203), (218, 4081), (187, 4333), (3473, 4091), (194, 4287), (3489, 4193), (3680, 4349), (208, 4191), (3622, 4277), (3431, 4143), (208, 4193), (222, 4093), (206, 4197), (210, 4052), (208, 4029), (3489, 4153), (207, 4183), (216, 4084), (3427, 4128)]
         : compromised: 0.0499, honest: 0.8388
         : sketchguard stats = ['Node 0: acc_rate=0.438', 'Node 1: acc_rate=0.318', 'Node 2: acc_rate=0.302']...
Round 009: test acc mean=0.3673 ± 0.3888 | min=0.0432 max=0.8584
         : test loss mean=nan ± nan
         : individual accs = ['0.837936', '0.048775', '0.053418', '0.043157', '0.852114', '0.045253', '0.831863', '0.858358', '0.049630', '0.849427', '0.835385', '0.049606', '0.054239', '0.049083', '0.051826', '0.051626', '0.848062', '0.049486', '0.052889', '0.834787']
         : correct/total = [(3459, 4128), (205, 4203), (218, 4081), (187, 4333), (3486, 4091), (194, 4287), (3488, 4193), (3733, 4349), (208, 4191), (3633, 4277), (3461, 4143), (208, 4193), (222, 4093), (206, 4197), (210, 4052), (208, 4029), (3522, 4153), (207, 4183), (216, 4084), (3446, 4128)]
         : compromised: 0.0499, honest: 0.8435
         : sketchguard stats = ['Node 0: acc_rate=0.438', 'Node 1: acc_rate=0.283', 'Node 2: acc_rate=0.269']...
Round 010: test acc mean=0.3685 ± 0.3903 | min=0.0432 max=0.8581
         : test loss mean=nan ± nan
         : individual accs = ['0.845203', '0.048775', '0.053418', '0.043157', '0.856270', '0.045253', '0.836871', '0.858128', '0.049630', '0.851765', '0.838523', '0.049606', '0.054239', '0.049083', '0.051826', '0.051626', '0.851914', '0.049486', '0.052889', '0.833091']
         : correct/total = [(3489, 4128), (205, 4203), (218, 4081), (187, 4333), (3503, 4091), (194, 4287), (3509, 4193), (3732, 4349), (208, 4191), (3643, 4277), (3474, 4143), (208, 4193), (222, 4093), (206, 4197), (210, 4052), (208, 4029), (3538, 4153), (207, 4183), (216, 4084), (3439, 4128)]
         : compromised: 0.0499, honest: 0.8465
         : sketchguard stats = ['Node 0: acc_rate=0.438', 'Node 1: acc_rate=0.255', 'Node 2: acc_rate=0.242']...

=== FINAL RESULTS ===
Dataset: femnist, Nodes: 20, Graph: erdos, Aggregation: sketchguard
Attack: backdoor, 60.0% compromised
Final accuracy - Compromised: 0.0499, Honest: 0.8465
Overall test accuracy: mean=0.3685 ± 0.3903

=== BACKDOOR ATTACK SUCCESS RATE (ASR) ===
Target label: 0
Trigger size: 4x4
Overall ASR: 0.6193 ± 0.4663
Honest nodes ASR: 0.0483 ± 0.0042
Compromised nodes ASR: 1.0000 ± 0.0000
Note: Higher ASR indicates more successful backdoor attack

=== Sketchguard SUMMARY ===
Node 0: acceptance=0.438
Node 1: acceptance=0.255
Node 2: acceptance=0.242
Node 3: acceptance=0.250
Node 4: acceptance=0.455
Node 5: acceptance=0.240
Node 6: acceptance=0.357
Node 7: acceptance=0.357
Node 8: acceptance=0.230
Node 9: acceptance=0.462
Node 10: acceptance=0.444
Node 11: acceptance=0.243
Node 12: acceptance=0.250
Node 13: acceptance=0.238
Node 14: acceptance=0.240
Node 15: acceptance=0.236
Node 16: acceptance=0.308
Node 17: acceptance=0.267
Node 18: acceptance=0.244
Node 19: acceptance=0.375

=== PARALLEL EXECUTION TIME (realistic for distributed system) ===
  COMMUNICATION (max across nodes):
    - Sketch transfer: 0.000s (0.0%)
    - Model fetch (accepted): 0.000s (0.0%)
  COMPUTATION (max across nodes):
    - Sketching: 3.089s (99.4%)
    - Filtering: 0.003s (0.1%)
    - Aggregation: 0.017s (0.6%)
  TOTALS:
    - Total computation: 3.109s (100.0%)
    - Total communication: 0.000s (0.0%)
    - Total parallel time: 3.109s

=== PER-NODE AVERAGE TIME ===
  - Sketching: 2.343s
  - Filtering: 0.001s
  - Aggregation: 0.012s
  - Sketch transfer: 0.000s
  - Model fetch: 0.000s
  - Total per node: 2.356s

=== TOTAL COMPUTATIONAL WORK (sum across all nodes) ===
  - Total sketching: 46.853s
  - Total filtering: 0.026s
  - Total aggregation: 0.237s
  - Total sketch transfer: 0.000s
  - Total model fetch: 0.000s
  - Grand total: 47.116s
  - Mean acceptance rate: 0.306

Sketchguard Algorithm Properties:
  - Original dimension: 6,603,710
  - Sketch size: 1000
  - Compression ratio: 19.9x
  - Single repetition: No repetitions needed
  - Theoretical complexity: O(d + N×k)
  - Approach: Sketch filtering + state aggregation
