Device: cuda
Seed: 987654321
Loading 36 LEAF FEMNIST train files...
LEAF FEMNIST train: 3597 users, 734463 samples
Loading 36 LEAF FEMNIST test files...
LEAF FEMNIST test: 3597 users, 83388 samples
Found 3597 train users, 3597 test users, 3597 common users
User sample counts range: 525 (max) to 17 (min)
Distributed ALL 3597 users across 20 clients
Users per client: 179 (with 17 clients getting +1 user)
Train partition sizes: [36360, 37070, 35957, 38262, 36024, 37732, 36921, 38328, 36867, 37683, 36507, 36915, 36007, 37001, 35681, 35453, 36585, 36801, 35964, 36345]
Test partition sizes: [4128, 4203, 4081, 4333, 4091, 4287, 4193, 4349, 4191, 4277, 4143, 4193, 4093, 4197, 4052, 4029, 4153, 4183, 4084, 4128]
  Client 0: 36360 train samples, 62 unique classes
  Client 1: 37070 train samples, 62 unique classes
  Client 2: 35957 train samples, 62 unique classes
  Client 3: 38262 train samples, 62 unique classes
  Client 4: 36024 train samples, 62 unique classes
  Client 5: 37732 train samples, 62 unique classes
  Client 6: 36921 train samples, 62 unique classes
  Client 7: 38328 train samples, 62 unique classes
  Client 8: 36867 train samples, 62 unique classes
  Client 9: 37683 train samples, 62 unique classes
  Client 10: 36507 train samples, 62 unique classes
  Client 11: 36915 train samples, 62 unique classes
  Client 12: 36007 train samples, 62 unique classes
  Client 13: 37001 train samples, 62 unique classes
  Client 14: 35681 train samples, 62 unique classes
  Client 15: 35453 train samples, 62 unique classes
  Client 16: 36585 train samples, 62 unique classes
  Client 17: 36801 train samples, 62 unique classes
  Client 18: 35964 train samples, 62 unique classes
  Client 19: 36345 train samples, 62 unique classes
Will sample 4500 samples per client per epoch
Graph: ring, nodes: 20, edges: 20
Degree statistics: avg=2.00, min=2, max=2
Attack: Compromised 6/20 nodes: [5, 12, 13, 14, 17, 18]
Attack type: krum, lambda: 1.0
Model variant: baseline
Model parameters: 6,603,710
BALANCE algorithm:
Balance Config: BALANCEConfig(gamma=2, kappa=1, alpha=0.5, min_neighbors=1)
  - Model dimension: 6,603,710 parameters
  - Complexity: O(N×d) = O(20×6,603,710)
Initial test acc across nodes: mean=0.0168 ± 0.0139
Round 001: test acc mean=0.0502 ± 0.0085 | min=0.0193 max=0.0613
         : test loss mean=780.6072 ± 3385.1828
         : individual accs = ['0.061289', '0.051630', '0.055134', '0.047773', '0.043021', '0.048519', '0.044598', '0.053576', '0.047960', '0.050503', '0.055274', '0.060816', '0.054239', '0.019299', '0.056762', '0.050385', '0.047195', '0.050920', '0.054358', '0.050145']
         : correct/total = [(253, 4128), (217, 4203), (225, 4081), (207, 4333), (176, 4091), (208, 4287), (187, 4193), (233, 4349), (201, 4191), (216, 4277), (229, 4143), (255, 4193), (222, 4093), (81, 4197), (230, 4052), (203, 4029), (196, 4153), (213, 4183), (222, 4084), (207, 4128)]
         : compromised: 0.0473, honest: 0.0514
Round 002: test acc mean=0.0526 ± 0.0081 | min=0.0446 max=0.0847
         : test loss mean=51317.4415 ± 223671.1979
         : individual accs = ['0.044574', '0.051630', '0.055134', '0.052850', '0.057932', '0.050618', '0.084665', '0.053116', '0.051062', '0.048398', '0.045619', '0.046983', '0.049597', '0.045747', '0.051826', '0.054852', '0.054418', '0.050920', '0.052889', '0.048450']
         : correct/total = [(184, 4128), (217, 4203), (225, 4081), (229, 4333), (237, 4091), (217, 4287), (355, 4193), (231, 4349), (214, 4191), (207, 4277), (189, 4143), (197, 4193), (203, 4093), (192, 4197), (210, 4052), (221, 4029), (226, 4153), (213, 4183), (216, 4084), (200, 4128)]
         : compromised: 0.0503, honest: 0.0535
Round 003: test acc mean=0.0514 ± 0.0065 | min=0.0286 max=0.0596
         : test loss mean=28.9119 ± 109.8795
         : individual accs = ['0.059593', '0.050916', '0.050723', '0.052850', '0.057932', '0.050618', '0.044598', '0.051276', '0.047960', '0.047463', '0.055274', '0.053184', '0.058637', '0.028592', '0.048124', '0.056342', '0.055141', '0.050203', '0.053379', '0.055475']
         : correct/total = [(246, 4128), (214, 4203), (207, 4081), (229, 4333), (237, 4091), (217, 4287), (187, 4193), (223, 4349), (201, 4191), (203, 4277), (229, 4143), (223, 4193), (240, 4093), (120, 4197), (195, 4052), (227, 4029), (229, 4153), (210, 4183), (218, 4084), (229, 4128)]
         : compromised: 0.0483, honest: 0.0528
Round 004: test acc mean=0.0530 ± 0.0075 | min=0.0267 max=0.0612
         : test loss mean=102.0546 ± 428.7499
         : individual accs = ['0.059593', '0.052344', '0.057584', '0.052850', '0.057932', '0.050618', '0.057000', '0.059094', '0.049630', '0.048398', '0.045619', '0.046983', '0.054239', '0.026686', '0.061204', '0.057086', '0.059957', '0.050920', '0.052889', '0.058624']
         : correct/total = [(246, 4128), (220, 4203), (235, 4081), (229, 4333), (237, 4091), (217, 4287), (239, 4193), (257, 4349), (208, 4191), (207, 4277), (189, 4143), (197, 4193), (222, 4093), (112, 4197), (248, 4052), (230, 4029), (249, 4153), (213, 4183), (216, 4084), (242, 4128)]
         : compromised: 0.0494, honest: 0.0545
Round 005: test acc mean=0.0569 ± 0.0132 | min=0.0286 max=0.0879
         : test loss mean=8.6827 ± 21.7709
         : individual accs = ['0.059593', '0.052344', '0.057584', '0.052850', '0.057932', '0.050618', '0.046745', '0.047827', '0.051062', '0.053776', '0.055998', '0.056761', '0.053750', '0.028592', '0.051579', '0.087863', '0.087166', '0.050920', '0.056562', '0.078004']
         : correct/total = [(246, 4128), (220, 4203), (235, 4081), (229, 4333), (237, 4091), (217, 4287), (196, 4193), (208, 4349), (214, 4191), (230, 4277), (232, 4143), (238, 4193), (220, 4093), (120, 4197), (209, 4052), (354, 4029), (362, 4153), (213, 4183), (231, 4084), (322, 4128)]
         : compromised: 0.0487, honest: 0.0604
Round 006: test acc mean=0.0571 ± 0.0115 | min=0.0439 max=0.1027
         : test loss mean=13.0822 ± 40.9608
         : individual accs = ['0.068314', '0.054485', '0.057584', '0.052850', '0.057932', '0.050618', '0.043883', '0.053116', '0.053209', '0.053776', '0.050447', '0.061770', '0.053750', '0.049559', '0.102665', '0.056590', '0.058993', '0.050920', '0.055583', '0.056202']
         : correct/total = [(282, 4128), (229, 4203), (235, 4081), (229, 4333), (237, 4091), (217, 4287), (184, 4193), (231, 4349), (223, 4191), (230, 4277), (209, 4143), (259, 4193), (220, 4093), (208, 4197), (416, 4052), (228, 4029), (245, 4153), (213, 4183), (227, 4084), (232, 4128)]
         : compromised: 0.0605, honest: 0.0557
Round 007: test acc mean=0.0594 ± 0.0171 | min=0.0448 max=0.1065
         : test loss mean=12.0398 ± 36.4209
         : individual accs = ['0.059593', '0.052344', '0.057584', '0.044773', '0.047421', '0.050618', '0.079180', '0.058174', '0.053209', '0.053776', '0.055998', '0.053899', '0.058637', '0.045747', '0.051826', '0.106478', '0.106429', '0.050920', '0.050930', '0.050872']
         : correct/total = [(246, 4128), (220, 4203), (235, 4081), (194, 4333), (194, 4091), (217, 4287), (332, 4193), (253, 4349), (223, 4191), (230, 4277), (232, 4143), (226, 4193), (240, 4093), (192, 4197), (210, 4052), (429, 4029), (442, 4153), (213, 4183), (208, 4084), (210, 4128)]
         : compromised: 0.0514, honest: 0.0628
Round 008: test acc mean=0.0605 ± 0.0175 | min=0.0432 max=0.1289
         : test loss mean=16.3023 ± 55.0147
         : individual accs = ['0.050872', '0.074233', '0.053418', '0.043157', '0.053532', '0.050618', '0.049130', '0.051276', '0.073729', '0.068974', '0.055998', '0.053899', '0.055949', '0.050274', '0.062192', '0.061554', '0.057308', '0.059527', '0.055583', '0.128876']
         : correct/total = [(210, 4128), (312, 4203), (218, 4081), (187, 4333), (219, 4091), (217, 4287), (206, 4193), (223, 4349), (309, 4191), (295, 4277), (232, 4143), (226, 4193), (229, 4093), (211, 4197), (252, 4052), (248, 4029), (238, 4153), (249, 4183), (227, 4084), (532, 4128)]
         : compromised: 0.0557, honest: 0.0626
Round 009: test acc mean=0.0621 ± 0.0131 | min=0.0484 max=0.0886
         : test loss mean=8.4542 ± 20.8186
         : individual accs = ['0.059593', '0.050916', '0.057584', '0.052850', '0.057932', '0.053651', '0.053899', '0.066682', '0.053209', '0.048398', '0.088583', '0.053899', '0.058637', '0.062426', '0.051826', '0.087615', '0.085721', '0.086302', '0.057052', '0.055475']
         : correct/total = [(246, 4128), (214, 4203), (235, 4081), (229, 4333), (237, 4091), (230, 4287), (226, 4193), (290, 4349), (223, 4191), (207, 4277), (367, 4143), (226, 4193), (240, 4093), (262, 4197), (210, 4052), (353, 4029), (356, 4153), (361, 4183), (233, 4084), (229, 4128)]
         : compromised: 0.0616, honest: 0.0623
Round 010: test acc mean=0.0591 ± 0.0124 | min=0.0448 max=0.0839
         : test loss mean=7.1874 ± 15.3059
         : individual accs = ['0.052326', '0.055437', '0.057584', '0.052850', '0.057932', '0.048985', '0.049130', '0.051276', '0.047960', '0.053776', '0.055998', '0.054615', '0.045688', '0.044794', '0.076999', '0.078431', '0.081869', '0.083911', '0.055583', '0.076793']
         : correct/total = [(216, 4128), (233, 4203), (235, 4081), (229, 4333), (237, 4091), (210, 4287), (206, 4193), (223, 4349), (201, 4191), (230, 4277), (232, 4143), (229, 4193), (187, 4093), (188, 4197), (312, 4052), (316, 4029), (340, 4153), (351, 4183), (227, 4084), (317, 4128)]
         : compromised: 0.0593, honest: 0.0590

=== FINAL RESULTS ===
Dataset: femnist, Nodes: 20, Graph: ring, Aggregation: balance
Attack: krum, 30.0% compromised
Final accuracy - Compromised: 0.0593, Honest: 0.0590
Overall test accuracy: mean=0.0591 ± 0.0124

=== BALANCE SUMMARY ===
Node 0: acceptance=1.000
Node 1: acceptance=1.000
Node 2: acceptance=1.000
Node 3: acceptance=1.000
Node 4: acceptance=0.500
Node 5: acceptance=0.800
Node 6: acceptance=0.500
Node 7: acceptance=1.000
Node 8: acceptance=1.000
Node 9: acceptance=1.000
Node 10: acceptance=1.000
Node 11: acceptance=0.500
Node 12: acceptance=0.500
Node 13: acceptance=0.500
Node 14: acceptance=0.500
Node 15: acceptance=0.500
Node 16: acceptance=0.500
Node 17: acceptance=0.500
Node 18: acceptance=0.500
Node 19: acceptance=0.500

=== PARALLEL EXECUTION TIME (realistic for distributed system) ===
  COMMUNICATION (max across nodes):
    - Full model transfer: 0.000s (0.0%)
  COMPUTATION (max across nodes):
    - Filtering: 0.034s (73.3%)
    - Aggregation: 0.013s (26.6%)
  TOTALS:
    - Total computation: 0.047s (100.0%)
    - Total communication: 0.000s (0.0%)
    - Total parallel time: 0.047s

=== PER-NODE AVERAGE TIME ===
  - Filtering: 0.013s
  - Aggregation: 0.004s
  - Model transfer: 0.000s
  - Total per node: 0.017s

=== TOTAL COMPUTATIONAL WORK (sum across all nodes) ===
  - Total filtering: 0.252s
  - Total aggregation: 0.080s
  - Total model transfer: 0.000s
  - Grand total: 0.332s
  - Mean acceptance rate: 0.715

BALANCE Algorithm Properties:
  - Model dimension: 6,603,710
  - No compression: Full parameter comparison
  - Theoretical complexity: O(deg(i)×d)
  - Approach: Full parameter filtering + averaging
