Device: cuda
Seed: 987654321
Loading 36 LEAF FEMNIST train files...
LEAF FEMNIST train: 3597 users, 734463 samples
Loading 36 LEAF FEMNIST test files...
LEAF FEMNIST test: 3597 users, 83388 samples
Found 3597 train users, 3597 test users, 3597 common users
User sample counts range: 525 (max) to 17 (min)
Distributed ALL 3597 users across 20 clients
Users per client: 179 (with 17 clients getting +1 user)
Train partition sizes: [36360, 37070, 35957, 38262, 36024, 37732, 36921, 38328, 36867, 37683, 36507, 36915, 36007, 37001, 35681, 35453, 36585, 36801, 35964, 36345]
Test partition sizes: [4128, 4203, 4081, 4333, 4091, 4287, 4193, 4349, 4191, 4277, 4143, 4193, 4093, 4197, 4052, 4029, 4153, 4183, 4084, 4128]
  Client 0: 36360 train samples, 62 unique classes
  Client 1: 37070 train samples, 62 unique classes
  Client 2: 35957 train samples, 62 unique classes
  Client 3: 38262 train samples, 62 unique classes
  Client 4: 36024 train samples, 62 unique classes
  Client 5: 37732 train samples, 62 unique classes
  Client 6: 36921 train samples, 62 unique classes
  Client 7: 38328 train samples, 62 unique classes
  Client 8: 36867 train samples, 62 unique classes
  Client 9: 37683 train samples, 62 unique classes
  Client 10: 36507 train samples, 62 unique classes
  Client 11: 36915 train samples, 62 unique classes
  Client 12: 36007 train samples, 62 unique classes
  Client 13: 37001 train samples, 62 unique classes
  Client 14: 35681 train samples, 62 unique classes
  Client 15: 35453 train samples, 62 unique classes
  Client 16: 36585 train samples, 62 unique classes
  Client 17: 36801 train samples, 62 unique classes
  Client 18: 35964 train samples, 62 unique classes
  Client 19: 36345 train samples, 62 unique classes
Will sample 10000 samples per client per epoch
Graph: erdos, nodes: 20, edges: 99
Degree statistics: avg=9.90, min=7, max=14
Attack: Compromised 2/20 nodes: [5, 13]
Attack type: directed_deviation, lambda: 1.0
Model variant: baseline
Model parameters: 6,603,710
Initial test acc across nodes: mean=0.0162 ± 0.0138
Round 001: test acc mean=0.0294 ± 0.0220 | min=0.0036 max=0.0748
         : test loss mean=102.6245 ± 174.1290
         : individual accs = ['0.005329', '0.003569', '0.061505', '0.074775', '0.037888', '0.027525', '0.026711', '0.043228', '0.057504', '0.048632', '0.051895', '0.003577', '0.006597', '0.005480', '0.010365', '0.027550', '0.050566', '0.003586', '0.023017', '0.018653']
         : correct/total = [(22, 4128), (15, 4203), (251, 4081), (324, 4333), (155, 4091), (118, 4287), (112, 4193), (188, 4349), (241, 4191), (208, 4277), (215, 4143), (15, 4193), (27, 4093), (23, 4197), (42, 4052), (111, 4029), (210, 4153), (15, 4183), (94, 4084), (77, 4128)]
         : compromised: 0.0165, honest: 0.0308
Round 002: test acc mean=0.0494 ± 0.0103 | min=0.0148 max=0.0623
         : test loss mean=56.8701 ± 111.3314
         : individual accs = ['0.049419', '0.048775', '0.061505', '0.014770', '0.045710', '0.052018', '0.048414', '0.032191', '0.057266', '0.048632', '0.051895', '0.054853', '0.062301', '0.049083', '0.047384', '0.048151', '0.045750', '0.057853', '0.055583', '0.057413']
         : correct/total = [(204, 4128), (205, 4203), (251, 4081), (64, 4333), (187, 4091), (223, 4287), (203, 4193), (140, 4349), (240, 4191), (208, 4277), (215, 4143), (230, 4193), (255, 4093), (206, 4197), (192, 4052), (194, 4029), (190, 4153), (242, 4183), (227, 4084), (237, 4128)]
         : compromised: 0.0506, honest: 0.0493
Round 003: test acc mean=0.0545 ± 0.0043 | min=0.0486 max=0.0623
         : test loss mean=37.3388 ± 59.6860
         : individual accs = ['0.049661', '0.052819', '0.061505', '0.049850', '0.052066', '0.052018', '0.053422', '0.052656', '0.057266', '0.048632', '0.051895', '0.054853', '0.062301', '0.049083', '0.055281', '0.061554', '0.050566', '0.057853', '0.060235', '0.057413']
         : correct/total = [(205, 4128), (222, 4203), (251, 4081), (216, 4333), (213, 4091), (223, 4287), (224, 4193), (229, 4349), (240, 4191), (208, 4277), (215, 4143), (230, 4193), (255, 4093), (206, 4197), (224, 4052), (248, 4029), (210, 4153), (242, 4183), (246, 4084), (237, 4128)]
         : compromised: 0.0506, honest: 0.0550
Round 004: test acc mean=0.0515 ± 0.0037 | min=0.0438 max=0.0579
         : test loss mean=5.6234 ± 6.0599
         : individual accs = ['0.049419', '0.048775', '0.049253', '0.043850', '0.052066', '0.052018', '0.053422', '0.049897', '0.057266', '0.048632', '0.051895', '0.054853', '0.047398', '0.049083', '0.055281', '0.046910', '0.050566', '0.057853', '0.054358', '0.057413']
         : correct/total = [(204, 4128), (205, 4203), (201, 4081), (190, 4333), (213, 4091), (223, 4287), (224, 4193), (217, 4349), (240, 4191), (208, 4277), (215, 4143), (230, 4193), (194, 4093), (206, 4197), (224, 4052), (189, 4029), (210, 4153), (242, 4183), (222, 4084), (237, 4128)]
         : compromised: 0.0506, honest: 0.0516
Round 005: test acc mean=0.0509 ± 0.0039 | min=0.0464 max=0.0615
         : test loss mean=4.3523 ± 2.6004
         : individual accs = ['0.048207', '0.051392', '0.061505', '0.048927', '0.046443', '0.048519', '0.051276', '0.050126', '0.057266', '0.048632', '0.051895', '0.048653', '0.051796', '0.054801', '0.047384', '0.046662', '0.050566', '0.046378', '0.050196', '0.057413']
         : correct/total = [(199, 4128), (216, 4203), (251, 4081), (212, 4333), (190, 4091), (208, 4287), (215, 4193), (218, 4349), (240, 4191), (208, 4277), (215, 4143), (204, 4193), (212, 4093), (230, 4197), (192, 4052), (188, 4029), (210, 4153), (194, 4183), (205, 4084), (237, 4128)]
         : compromised: 0.0517, honest: 0.0508
Round 006: test acc mean=0.0507 ± 0.0036 | min=0.0446 max=0.0615
         : test loss mean=3.8729 ± 0.6928
         : individual accs = ['0.048207', '0.047347', '0.061505', '0.049619', '0.053043', '0.048519', '0.052707', '0.050126', '0.044619', '0.048632', '0.051895', '0.049845', '0.051796', '0.054801', '0.050592', '0.055845', '0.050566', '0.047574', '0.050196', '0.046512']
         : correct/total = [(199, 4128), (199, 4203), (251, 4081), (215, 4333), (217, 4091), (208, 4287), (221, 4193), (218, 4349), (187, 4191), (208, 4277), (215, 4143), (209, 4193), (212, 4093), (230, 4197), (205, 4052), (225, 4029), (210, 4153), (199, 4183), (205, 4084), (192, 4128)]
         : compromised: 0.0517, honest: 0.0506
Round 007: test acc mean=0.0488 ± 0.0045 | min=0.0422 max=0.0574
         : test loss mean=4.1270 ± 1.6852
         : individual accs = ['0.049903', '0.045206', '0.049253', '0.042234', '0.044243', '0.042454', '0.048891', '0.043228', '0.057266', '0.050269', '0.051171', '0.054853', '0.045688', '0.045509', '0.050592', '0.050137', '0.050566', '0.044227', '0.052644', '0.057413']
         : correct/total = [(206, 4128), (190, 4203), (201, 4081), (183, 4333), (181, 4091), (182, 4287), (205, 4193), (188, 4349), (240, 4191), (215, 4277), (212, 4143), (230, 4193), (187, 4093), (191, 4197), (205, 4052), (202, 4029), (210, 4153), (185, 4183), (215, 4084), (237, 4128)]
         : compromised: 0.0440, honest: 0.0493
Round 008: test acc mean=0.0473 ± 0.0044 | min=0.0422 max=0.0573
         : test loss mean=3.9903 ± 1.1794
         : individual accs = ['0.049903', '0.045206', '0.046312', '0.042234', '0.044243', '0.042454', '0.053422', '0.043228', '0.057266', '0.043488', '0.042964', '0.054853', '0.045688', '0.045509', '0.044669', '0.050137', '0.050084', '0.044227', '0.052644', '0.046512']
         : correct/total = [(206, 4128), (190, 4203), (189, 4081), (183, 4333), (181, 4091), (182, 4287), (224, 4193), (188, 4349), (240, 4191), (186, 4277), (178, 4143), (230, 4193), (187, 4093), (191, 4197), (181, 4052), (202, 4029), (208, 4153), (185, 4183), (215, 4084), (192, 4128)]
         : compromised: 0.0440, honest: 0.0476
Round 009: test acc mean=0.0425 ± 0.0072 | min=0.0296 max=0.0573
         : test loss mean=4.1173 ± 1.7016
         : individual accs = ['0.049903', '0.045206', '0.046312', '0.037618', '0.032755', '0.042454', '0.038874', '0.043228', '0.057266', '0.043488', '0.042964', '0.034343', '0.045688', '0.045509', '0.031096', '0.035989', '0.050566', '0.044227', '0.052644', '0.029554']
         : correct/total = [(206, 4128), (190, 4203), (189, 4081), (163, 4333), (134, 4091), (182, 4287), (163, 4193), (188, 4349), (240, 4191), (186, 4277), (178, 4143), (144, 4193), (187, 4093), (191, 4197), (126, 4052), (145, 4029), (210, 4153), (185, 4183), (215, 4084), (122, 4128)]
         : compromised: 0.0440, honest: 0.0423
Round 010: test acc mean=0.0494 ± 0.0042 | min=0.0425 max=0.0615
         : test loss mean=3.9109 ± 0.8518
         : individual accs = ['0.048450', '0.048299', '0.061505', '0.047542', '0.048399', '0.042454', '0.045314', '0.046907', '0.044619', '0.051672', '0.051895', '0.048891', '0.052040', '0.045509', '0.052320', '0.048151', '0.050566', '0.052833', '0.045544', '0.054990']
         : correct/total = [(200, 4128), (203, 4203), (251, 4081), (206, 4333), (198, 4091), (182, 4287), (190, 4193), (204, 4349), (187, 4191), (221, 4277), (215, 4143), (205, 4193), (213, 4093), (191, 4197), (212, 4052), (194, 4029), (210, 4153), (221, 4183), (186, 4084), (227, 4128)]
         : compromised: 0.0440, honest: 0.0500

=== FINAL RESULTS ===
Dataset: femnist, Nodes: 20, Graph: erdos, Aggregation: d-fedavg
Attack: directed_deviation, 10.0% compromised
Final accuracy - Compromised: 0.0440, Honest: 0.0500
Overall test accuracy: mean=0.0494 ± 0.0042
