Device: cuda
Seed: 987654321
Loading 36 LEAF FEMNIST train files...
LEAF FEMNIST train: 3597 users, 734463 samples
Loading 36 LEAF FEMNIST test files...
LEAF FEMNIST test: 3597 users, 83388 samples
Found 3597 train users, 3597 test users, 3597 common users
User sample counts range: 525 (max) to 17 (min)
Distributed ALL 3597 users across 20 clients
Users per client: 179 (with 17 clients getting +1 user)
Train partition sizes: [36360, 37070, 35957, 38262, 36024, 37732, 36921, 38328, 36867, 37683, 36507, 36915, 36007, 37001, 35681, 35453, 36585, 36801, 35964, 36345]
Test partition sizes: [4128, 4203, 4081, 4333, 4091, 4287, 4193, 4349, 4191, 4277, 4143, 4193, 4093, 4197, 4052, 4029, 4153, 4183, 4084, 4128]
  Client 0: 36360 train samples, 62 unique classes
  Client 1: 37070 train samples, 62 unique classes
  Client 2: 35957 train samples, 62 unique classes
  Client 3: 38262 train samples, 62 unique classes
  Client 4: 36024 train samples, 62 unique classes
  Client 5: 37732 train samples, 62 unique classes
  Client 6: 36921 train samples, 62 unique classes
  Client 7: 38328 train samples, 62 unique classes
  Client 8: 36867 train samples, 62 unique classes
  Client 9: 37683 train samples, 62 unique classes
  Client 10: 36507 train samples, 62 unique classes
  Client 11: 36915 train samples, 62 unique classes
  Client 12: 36007 train samples, 62 unique classes
  Client 13: 37001 train samples, 62 unique classes
  Client 14: 35681 train samples, 62 unique classes
  Client 15: 35453 train samples, 62 unique classes
  Client 16: 36585 train samples, 62 unique classes
  Client 17: 36801 train samples, 62 unique classes
  Client 18: 35964 train samples, 62 unique classes
  Client 19: 36345 train samples, 62 unique classes
Will sample 4500 samples per client per epoch
Graph: ring, nodes: 20, edges: 20
Degree statistics: avg=2.00, min=2, max=2
Attack: Compromised 10/20 nodes: [1, 2, 5, 11, 12, 13, 14, 15, 17, 18]
Attack type: backdoor, lambda: 1.0
Backdoor target label: 0, trigger size: 4
Model variant: baseline
Model parameters: 6,603,710
Initial test acc across nodes: mean=0.0168 ± 0.0139
Backdoor attack: Created poisoned datasets for 10 compromised nodes
Round 001: test acc mean=0.0265 ± 0.0186 | min=0.0029 max=0.0570
         : test loss mean=108062.6390 ± 196193.7326
         : individual accs = ['0.016715', '0.003331', '0.044597', '0.018925', '0.021266', '0.041754', '0.057000', '0.053116', '0.054880', '0.048398', '0.045619', '0.005247', '0.012460', '0.019299', '0.037759', '0.007942', '0.017337', '0.016734', '0.005142', '0.002907']
         : correct/total = [(69, 4128), (14, 4203), (182, 4081), (82, 4333), (87, 4091), (179, 4287), (239, 4193), (231, 4349), (230, 4191), (207, 4277), (189, 4143), (22, 4193), (51, 4093), (81, 4197), (153, 4052), (32, 4029), (72, 4153), (70, 4183), (21, 4084), (12, 4128)]
         : compromised: 0.0194, honest: 0.0336
Round 002: test acc mean=0.0441 ± 0.0113 | min=0.0041 max=0.0545
         : test loss mean=449652615.5216 ± 887782023.7963
         : individual accs = ['0.050145', '0.048775', '0.053418', '0.043157', '0.043021', '0.043387', '0.004054', '0.043918', '0.051062', '0.043488', '0.048033', '0.049606', '0.033716', '0.028592', '0.037759', '0.051626', '0.052011', '0.049486', '0.052889', '0.054506']
         : correct/total = [(207, 4128), (205, 4203), (218, 4081), (187, 4333), (176, 4091), (186, 4287), (17, 4193), (191, 4349), (214, 4191), (186, 4277), (199, 4143), (208, 4193), (138, 4093), (120, 4197), (153, 4052), (208, 4029), (216, 4153), (207, 4183), (216, 4084), (225, 4128)]
         : compromised: 0.0449, honest: 0.0433
Round 003: test acc mean=0.0484 ± 0.0056 | min=0.0334 max=0.0582
         : test loss mean=10129882813.3193 ± 26900523630.5962
         : individual accs = ['0.050145', '0.049726', '0.053418', '0.043157', '0.043021', '0.038955', '0.033389', '0.058174', '0.054880', '0.053776', '0.045619', '0.046983', '0.050574', '0.047177', '0.051826', '0.051626', '0.052011', '0.049486', '0.048482', '0.045058']
         : correct/total = [(207, 4128), (209, 4203), (218, 4081), (187, 4333), (176, 4091), (167, 4287), (140, 4193), (253, 4349), (230, 4191), (230, 4277), (189, 4143), (197, 4193), (207, 4093), (198, 4197), (210, 4052), (208, 4029), (216, 4153), (207, 4183), (198, 4084), (186, 4128)]
         : compromised: 0.0488, honest: 0.0479
Round 004: test acc mean=0.0493 ± 0.0075 | min=0.0188 max=0.0582
         : test loss mean=14976785407.1036 ± 45746093661.9283
         : individual accs = ['0.047238', '0.048775', '0.052683', '0.048465', '0.051088', '0.050618', '0.018841', '0.058174', '0.053209', '0.047697', '0.055998', '0.053899', '0.050574', '0.047177', '0.051826', '0.051626', '0.052011', '0.049486', '0.048482', '0.048692']
         : correct/total = [(195, 4128), (205, 4203), (215, 4081), (210, 4333), (209, 4091), (217, 4287), (79, 4193), (253, 4349), (223, 4191), (204, 4277), (232, 4143), (226, 4193), (207, 4093), (198, 4197), (210, 4052), (208, 4029), (216, 4153), (207, 4183), (198, 4084), (201, 4128)]
         : compromised: 0.0505, honest: 0.0481
Round 005: test acc mean=0.0456 ± 0.0089 | min=0.0188 max=0.0582
         : test loss mean=14358064242.0124 ± 46590273137.5702
         : individual accs = ['0.047238', '0.048775', '0.048763', '0.036464', '0.043266', '0.052484', '0.018841', '0.058174', '0.053209', '0.043488', '0.045619', '0.053899', '0.054239', '0.049083', '0.051826', '0.032266', '0.040212', '0.037533', '0.048482', '0.048692']
         : correct/total = [(195, 4128), (205, 4203), (199, 4081), (158, 4333), (177, 4091), (225, 4287), (79, 4193), (253, 4349), (223, 4191), (186, 4277), (189, 4143), (226, 4193), (222, 4093), (206, 4197), (210, 4052), (130, 4029), (167, 4153), (157, 4183), (198, 4084), (201, 4128)]
         : compromised: 0.0477, honest: 0.0435
Round 006: test acc mean=0.0469 ± 0.0065 | min=0.0323 max=0.0582
         : test loss mean=276126098105.3199 ± 463994623310.4283
         : individual accs = ['0.047238', '0.048775', '0.048763', '0.036464', '0.043266', '0.047352', '0.057000', '0.058174', '0.053209', '0.043488', '0.045619', '0.046983', '0.054239', '0.049083', '0.051826', '0.032266', '0.040212', '0.037533', '0.048482', '0.048692']
         : correct/total = [(195, 4128), (205, 4203), (199, 4081), (158, 4333), (177, 4091), (203, 4287), (239, 4193), (253, 4349), (223, 4191), (186, 4277), (189, 4143), (197, 4193), (222, 4093), (206, 4197), (210, 4052), (130, 4029), (167, 4153), (157, 4183), (198, 4084), (201, 4128)]
         : compromised: 0.0465, honest: 0.0473
Round 007: test acc mean=0.0493 ± 0.0042 | min=0.0414 max=0.0563
         : test loss mean=7140004343.6748 ± 30969803510.2518
         : individual accs = ['0.048934', '0.050202', '0.054889', '0.048234', '0.045710', '0.052484', '0.044598', '0.041389', '0.053209', '0.043488', '0.045619', '0.046983', '0.054239', '0.049083', '0.051826', '0.056342', '0.055141', '0.050203', '0.050196', '0.043847']
         : correct/total = [(202, 4128), (211, 4203), (224, 4081), (209, 4333), (187, 4091), (225, 4287), (187, 4193), (180, 4349), (223, 4191), (186, 4277), (189, 4143), (197, 4193), (222, 4093), (206, 4197), (210, 4052), (227, 4029), (229, 4153), (210, 4183), (205, 4084), (181, 4128)]
         : compromised: 0.0516, honest: 0.0470
Round 008: test acc mean=0.0487 ± 0.0056 | min=0.0344 max=0.0563
         : test loss mean=5743215681.1675 ± 17572708656.8056
         : individual accs = ['0.048934', '0.050202', '0.048272', '0.048234', '0.045710', '0.043387', '0.044598', '0.041389', '0.034359', '0.043488', '0.055998', '0.053899', '0.054239', '0.049083', '0.051826', '0.056342', '0.055141', '0.050203', '0.054358', '0.043847']
         : correct/total = [(202, 4128), (211, 4203), (197, 4081), (209, 4333), (187, 4091), (186, 4287), (187, 4193), (180, 4349), (144, 4191), (186, 4277), (232, 4143), (226, 4193), (222, 4093), (206, 4197), (210, 4052), (227, 4029), (229, 4153), (210, 4183), (222, 4084), (181, 4128)]
         : compromised: 0.0512, honest: 0.0462
Round 009: test acc mean=0.0503 ± 0.0045 | min=0.0434 max=0.0582
         : test loss mean=4612314522.8666 ± 20104417417.9685
         : individual accs = ['0.048934', '0.050202', '0.048272', '0.048234', '0.045710', '0.043387', '0.044598', '0.058174', '0.049630', '0.043488', '0.055998', '0.053899', '0.054239', '0.049083', '0.051826', '0.056342', '0.055141', '0.050203', '0.054358', '0.043847']
         : correct/total = [(202, 4128), (211, 4203), (197, 4081), (209, 4333), (187, 4091), (186, 4287), (187, 4193), (253, 4349), (208, 4191), (186, 4277), (232, 4143), (226, 4193), (222, 4093), (206, 4197), (210, 4052), (227, 4029), (229, 4153), (210, 4183), (222, 4084), (181, 4128)]
         : compromised: 0.0512, honest: 0.0494
Round 010: test acc mean=0.0499 ± 0.0045 | min=0.0434 max=0.0582
         : test loss mean=1613690599.2620 ± 6389903287.3420
         : individual accs = ['0.045785', '0.050202', '0.048272', '0.048234', '0.045710', '0.043387', '0.044598', '0.058174', '0.049630', '0.043488', '0.055998', '0.053899', '0.054239', '0.049083', '0.051826', '0.056342', '0.055141', '0.050203', '0.049951', '0.044331']
         : correct/total = [(189, 4128), (211, 4203), (197, 4081), (209, 4333), (187, 4091), (186, 4287), (187, 4193), (253, 4349), (208, 4191), (186, 4277), (232, 4143), (226, 4193), (222, 4093), (206, 4197), (210, 4052), (227, 4029), (229, 4153), (210, 4183), (204, 4084), (183, 4128)]
         : compromised: 0.0507, honest: 0.0491

=== FINAL RESULTS ===
Dataset: femnist, Nodes: 20, Graph: ring, Aggregation: krum
Attack: backdoor, 50.0% compromised
Final accuracy - Compromised: 0.0507, Honest: 0.0491
Overall test accuracy: mean=0.0499 ± 0.0045

=== BACKDOOR ATTACK SUCCESS RATE (ASR) ===
Target label: 0
Trigger size: 4x4
Overall ASR: 0.2500 ± 0.4330
Honest nodes ASR: 0.2000 ± 0.4000
Compromised nodes ASR: 0.3000 ± 0.4583
Note: Higher ASR indicates more successful backdoor attack
