Device: cuda
Seed: 987654321
Loading 36 LEAF FEMNIST train files...
LEAF FEMNIST train: 3597 users, 734463 samples
Loading 36 LEAF FEMNIST test files...
LEAF FEMNIST test: 3597 users, 83388 samples
Found 3597 train users, 3597 test users, 3597 common users
User sample counts range: 525 (max) to 17 (min)
Distributed ALL 3597 users across 20 clients
Users per client: 179 (with 17 clients getting +1 user)
Train partition sizes: [36360, 37070, 35957, 38262, 36024, 37732, 36921, 38328, 36867, 37683, 36507, 36915, 36007, 37001, 35681, 35453, 36585, 36801, 35964, 36345]
Test partition sizes: [4128, 4203, 4081, 4333, 4091, 4287, 4193, 4349, 4191, 4277, 4143, 4193, 4093, 4197, 4052, 4029, 4153, 4183, 4084, 4128]
  Client 0: 36360 train samples, 62 unique classes
  Client 1: 37070 train samples, 62 unique classes
  Client 2: 35957 train samples, 62 unique classes
  Client 3: 38262 train samples, 62 unique classes
  Client 4: 36024 train samples, 62 unique classes
  Client 5: 37732 train samples, 62 unique classes
  Client 6: 36921 train samples, 62 unique classes
  Client 7: 38328 train samples, 62 unique classes
  Client 8: 36867 train samples, 62 unique classes
  Client 9: 37683 train samples, 62 unique classes
  Client 10: 36507 train samples, 62 unique classes
  Client 11: 36915 train samples, 62 unique classes
  Client 12: 36007 train samples, 62 unique classes
  Client 13: 37001 train samples, 62 unique classes
  Client 14: 35681 train samples, 62 unique classes
  Client 15: 35453 train samples, 62 unique classes
  Client 16: 36585 train samples, 62 unique classes
  Client 17: 36801 train samples, 62 unique classes
  Client 18: 35964 train samples, 62 unique classes
  Client 19: 36345 train samples, 62 unique classes
Will sample 10000 samples per client per epoch
Graph: erdos, nodes: 20, edges: 126
Degree statistics: avg=12.60, min=8, max=16
Attack: Compromised 16/20 nodes: [1, 2, 3, 5, 6, 8, 9, 10, 11, 12, 13, 14, 15, 17, 18, 19]
Attack type: backdoor, lambda: 1.0
Backdoor target label: 0, trigger size: 4
Model variant: baseline
Model parameters: 6,603,710
Sketchguard Node 0:
  Model dim: 6,603,710 → Sketch size: 1000
  Compression ratio: 6603.7x
  Using model parameters for aggregation, sketches for filtering
Sketchguard Node 1:
  Model dim: 6,603,710 → Sketch size: 1000
  Compression ratio: 6603.7x
  Using model parameters for aggregation, sketches for filtering
Sketchguard Node 2:
  Model dim: 6,603,710 → Sketch size: 1000
  Compression ratio: 6603.7x
  Using model parameters for aggregation, sketches for filtering
Sketchguard Node 3:
  Model dim: 6,603,710 → Sketch size: 1000
  Compression ratio: 6603.7x
  Using model parameters for aggregation, sketches for filtering
Sketchguard Node 4:
  Model dim: 6,603,710 → Sketch size: 1000
  Compression ratio: 6603.7x
  Using model parameters for aggregation, sketches for filtering
Sketchguard Node 5:
  Model dim: 6,603,710 → Sketch size: 1000
  Compression ratio: 6603.7x
  Using model parameters for aggregation, sketches for filtering
Sketchguard Node 6:
  Model dim: 6,603,710 → Sketch size: 1000
  Compression ratio: 6603.7x
  Using model parameters for aggregation, sketches for filtering
Sketchguard Node 7:
  Model dim: 6,603,710 → Sketch size: 1000
  Compression ratio: 6603.7x
  Using model parameters for aggregation, sketches for filtering
Sketchguard Node 8:
  Model dim: 6,603,710 → Sketch size: 1000
  Compression ratio: 6603.7x
  Using model parameters for aggregation, sketches for filtering
Sketchguard Node 9:
  Model dim: 6,603,710 → Sketch size: 1000
  Compression ratio: 6603.7x
  Using model parameters for aggregation, sketches for filtering
Sketchguard Node 10:
  Model dim: 6,603,710 → Sketch size: 1000
  Compression ratio: 6603.7x
  Using model parameters for aggregation, sketches for filtering
Sketchguard Node 11:
  Model dim: 6,603,710 → Sketch size: 1000
  Compression ratio: 6603.7x
  Using model parameters for aggregation, sketches for filtering
Sketchguard Node 12:
  Model dim: 6,603,710 → Sketch size: 1000
  Compression ratio: 6603.7x
  Using model parameters for aggregation, sketches for filtering
Sketchguard Node 13:
  Model dim: 6,603,710 → Sketch size: 1000
  Compression ratio: 6603.7x
  Using model parameters for aggregation, sketches for filtering
Sketchguard Node 14:
  Model dim: 6,603,710 → Sketch size: 1000
  Compression ratio: 6603.7x
  Using model parameters for aggregation, sketches for filtering
Sketchguard Node 15:
  Model dim: 6,603,710 → Sketch size: 1000
  Compression ratio: 6603.7x
  Using model parameters for aggregation, sketches for filtering
Sketchguard Node 16:
  Model dim: 6,603,710 → Sketch size: 1000
  Compression ratio: 6603.7x
  Using model parameters for aggregation, sketches for filtering
Sketchguard Node 17:
  Model dim: 6,603,710 → Sketch size: 1000
  Compression ratio: 6603.7x
  Using model parameters for aggregation, sketches for filtering
Sketchguard Node 18:
  Model dim: 6,603,710 → Sketch size: 1000
  Compression ratio: 6603.7x
  Using model parameters for aggregation, sketches for filtering
Sketchguard Node 19:
  Model dim: 6,603,710 → Sketch size: 1000
  Compression ratio: 6603.7x
  Using model parameters for aggregation, sketches for filtering
Sketchguard ALGORITHM (Sketch-based Filtering + State Aggregation)
  - Model dimension: 6,603,710 parameters
  - Config: SketchguardConfig(gamma=2, kappa=1, alpha=0.5, min_neighbors=1, sketch_size=1000, network_seed=987654321, attack_detection_window=5)
  - Sketch size: 1000
  - Compression ratio: 6603.7x
  - Complexity: O(d + N×k) = O(6,603,710 + 20×1000)
  - Theoretical speedup vs BALANCE: 19.9x
Initial test acc across nodes: mean=0.0168 ± 0.0139
Backdoor attack: Created poisoned datasets for 16 compromised nodes
Round 001: test acc mean=0.1589 ± 0.1391 | min=0.0488 max=0.4691
         : test loss mean=14259.0833 ± 7774.0474
         : individual accs = ['0.435320', '0.048775', '0.195785', '0.049388', '0.443901', '0.214369', '0.050799', '0.469073', '0.095681', '0.068038', '0.051412', '0.108276', '0.054239', '0.049083', '0.148322', '0.076942', '0.307729', '0.154913', '0.100881', '0.054506']
         : correct/total = [(1797, 4128), (205, 4203), (799, 4081), (214, 4333), (1816, 4091), (919, 4287), (213, 4193), (2040, 4349), (401, 4191), (291, 4277), (213, 4143), (454, 4193), (222, 4093), (206, 4197), (601, 4052), (310, 4029), (1278, 4153), (648, 4183), (412, 4084), (225, 4128)]
         : compromised: 0.0951, honest: 0.4140
         : sketchguard stats = ['Node 0: acc_rate=0.188', 'Node 1: acc_rate=0.364', 'Node 2: acc_rate=0.250']...
Round 002: test acc mean=0.1682 ± 0.2530 | min=0.0031 max=0.7028
         : test loss mean=607898.4175 ± 1373891.4752
         : individual accs = ['0.653828', '0.046633', '0.045087', '0.042465', '0.702762', '0.050618', '0.048414', '0.643826', '0.043188', '0.048398', '0.003621', '0.046745', '0.051551', '0.045747', '0.047631', '0.050385', '0.691307', '0.003108', '0.054358', '0.043605']
         : correct/total = [(2699, 4128), (196, 4203), (184, 4081), (184, 4333), (2875, 4091), (217, 4287), (203, 4193), (2800, 4349), (181, 4191), (207, 4277), (15, 4143), (196, 4193), (211, 4093), (192, 4197), (193, 4052), (203, 4029), (2871, 4153), (13, 4183), (222, 4084), (180, 4128)]
         : compromised: 0.0420, honest: 0.6729
         : sketchguard stats = ['Node 0: acc_rate=0.188', 'Node 1: acc_rate=0.682', 'Node 2: acc_rate=0.625']...
Round 003: test acc mean=0.1917 ± 0.2891 | min=0.0056 max=0.7785
         : test loss mean=nan ± nan
         : individual accs = ['0.770349', '0.048775', '0.053418', '0.043157', '0.778538', '0.005598', '0.050799', '0.766153', '0.049630', '0.043488', '0.048033', '0.049606', '0.054239', '0.049083', '0.051826', '0.051626', '0.762822', '0.049486', '0.052889', '0.054506']
         : correct/total = [(3180, 4128), (205, 4203), (218, 4081), (187, 4333), (3185, 4091), (24, 4287), (213, 4193), (3332, 4349), (208, 4191), (186, 4277), (199, 4143), (208, 4193), (222, 4093), (206, 4197), (210, 4052), (208, 4029), (3168, 4153), (207, 4183), (216, 4084), (225, 4128)]
         : compromised: 0.0473, honest: 0.7695
         : sketchguard stats = ['Node 0: acc_rate=0.188', 'Node 1: acc_rate=0.788', 'Node 2: acc_rate=0.750']...
Round 004: test acc mean=0.2019 ± 0.3044 | min=0.0432 max=0.8176
         : test loss mean=nan ± nan
         : individual accs = ['0.800145', '0.048775', '0.053418', '0.043157', '0.817648', '0.045253', '0.050799', '0.811451', '0.049630', '0.043488', '0.048033', '0.049606', '0.054239', '0.049083', '0.051826', '0.051626', '0.813869', '0.049486', '0.052889', '0.054506']
         : correct/total = [(3303, 4128), (205, 4203), (218, 4081), (187, 4333), (3345, 4091), (194, 4287), (213, 4193), (3529, 4349), (208, 4191), (186, 4277), (199, 4143), (208, 4193), (222, 4093), (206, 4197), (210, 4052), (208, 4029), (3380, 4153), (207, 4183), (216, 4084), (225, 4128)]
         : compromised: 0.0497, honest: 0.8108
         : sketchguard stats = ['Node 0: acc_rate=0.188', 'Node 1: acc_rate=0.591', 'Node 2: acc_rate=0.562']...
Round 005: test acc mean=0.2053 ± 0.3111 | min=0.0432 max=0.8343
         : test loss mean=nan ± nan
         : individual accs = ['0.821705', '0.048775', '0.053418', '0.043157', '0.834270', '0.045253', '0.050799', '0.829386', '0.049630', '0.043488', '0.048033', '0.049606', '0.054239', '0.049083', '0.051826', '0.051626', '0.824705', '0.049486', '0.052889', '0.054506']
         : correct/total = [(3392, 4128), (205, 4203), (218, 4081), (187, 4333), (3413, 4091), (194, 4287), (213, 4193), (3607, 4349), (208, 4191), (186, 4277), (199, 4143), (208, 4193), (222, 4093), (206, 4197), (210, 4052), (208, 4029), (3425, 4153), (207, 4183), (216, 4084), (225, 4128)]
         : compromised: 0.0497, honest: 0.8275
         : sketchguard stats = ['Node 0: acc_rate=0.188', 'Node 1: acc_rate=0.473', 'Node 2: acc_rate=0.450']...
Round 006: test acc mean=0.2069 ± 0.3143 | min=0.0432 max=0.8423
         : test loss mean=nan ± nan
         : individual accs = ['0.831395', '0.048775', '0.053418', '0.043157', '0.837692', '0.045253', '0.050799', '0.842263', '0.049630', '0.043488', '0.048033', '0.049606', '0.054239', '0.049083', '0.051826', '0.051626', '0.830484', '0.049486', '0.052889', '0.054506']
         : correct/total = [(3432, 4128), (205, 4203), (218, 4081), (187, 4333), (3427, 4091), (194, 4287), (213, 4193), (3663, 4349), (208, 4191), (186, 4277), (199, 4143), (208, 4193), (222, 4093), (206, 4197), (210, 4052), (208, 4029), (3449, 4153), (207, 4183), (216, 4084), (225, 4128)]
         : compromised: 0.0497, honest: 0.8355
         : sketchguard stats = ['Node 0: acc_rate=0.188', 'Node 1: acc_rate=0.394', 'Node 2: acc_rate=0.375']...
Round 007: test acc mean=0.2094 ± 0.3193 | min=0.0432 max=0.8526
         : test loss mean=nan ± nan
         : individual accs = ['0.840116', '0.048775', '0.053418', '0.043157', '0.852359', '0.045253', '0.050799', '0.852610', '0.049630', '0.043488', '0.048033', '0.049606', '0.054239', '0.049083', '0.051826', '0.051626', '0.846376', '0.049486', '0.052889', '0.054506']
         : correct/total = [(3468, 4128), (205, 4203), (218, 4081), (187, 4333), (3487, 4091), (194, 4287), (213, 4193), (3708, 4349), (208, 4191), (186, 4277), (199, 4143), (208, 4193), (222, 4093), (206, 4197), (210, 4052), (208, 4029), (3515, 4153), (207, 4183), (216, 4084), (225, 4128)]
         : compromised: 0.0497, honest: 0.8479
         : sketchguard stats = ['Node 0: acc_rate=0.188', 'Node 1: acc_rate=0.338', 'Node 2: acc_rate=0.321']...
Round 008: test acc mean=0.2096 ± 0.3198 | min=0.0432 max=0.8546
         : test loss mean=nan ± nan
         : individual accs = ['0.845688', '0.048775', '0.053418', '0.043157', '0.854559', '0.045253', '0.050799', '0.853530', '0.049630', '0.043488', '0.048033', '0.049606', '0.054239', '0.049083', '0.051826', '0.051626', '0.843246', '0.049486', '0.052889', '0.054506']
         : correct/total = [(3491, 4128), (205, 4203), (218, 4081), (187, 4333), (3496, 4091), (194, 4287), (213, 4193), (3712, 4349), (208, 4191), (186, 4277), (199, 4143), (208, 4193), (222, 4093), (206, 4197), (210, 4052), (208, 4029), (3502, 4153), (207, 4183), (216, 4084), (225, 4128)]
         : compromised: 0.0497, honest: 0.8493
         : sketchguard stats = ['Node 0: acc_rate=0.188', 'Node 1: acc_rate=0.295', 'Node 2: acc_rate=0.281']...
Round 009: test acc mean=0.2104 ± 0.3214 | min=0.0432 max=0.8607
         : test loss mean=nan ± nan
         : individual accs = ['0.840843', '0.048775', '0.053418', '0.043157', '0.859203', '0.045253', '0.050799', '0.860658', '0.049630', '0.043488', '0.048033', '0.049606', '0.054239', '0.049083', '0.051826', '0.051626', '0.852155', '0.049486', '0.052889', '0.054506']
         : correct/total = [(3471, 4128), (205, 4203), (218, 4081), (187, 4333), (3515, 4091), (194, 4287), (213, 4193), (3743, 4349), (208, 4191), (186, 4277), (199, 4143), (208, 4193), (222, 4093), (206, 4197), (210, 4052), (208, 4029), (3539, 4153), (207, 4183), (216, 4084), (225, 4128)]
         : compromised: 0.0497, honest: 0.8532
         : sketchguard stats = ['Node 0: acc_rate=0.188', 'Node 1: acc_rate=0.263', 'Node 2: acc_rate=0.250']...
Round 010: test acc mean=0.2114 ± 0.3233 | min=0.0432 max=0.8614
         : test loss mean=nan ± nan
         : individual accs = ['0.852713', '0.048775', '0.053418', '0.043157', '0.861403', '0.045253', '0.050799', '0.859278', '0.049630', '0.043488', '0.048033', '0.049606', '0.054239', '0.049083', '0.051826', '0.051626', '0.858175', '0.049486', '0.052889', '0.054506']
         : correct/total = [(3520, 4128), (205, 4203), (218, 4081), (187, 4333), (3524, 4091), (194, 4287), (213, 4193), (3737, 4349), (208, 4191), (186, 4277), (199, 4143), (208, 4193), (222, 4093), (206, 4197), (210, 4052), (208, 4029), (3564, 4153), (207, 4183), (216, 4084), (225, 4128)]
         : compromised: 0.0497, honest: 0.8579
         : sketchguard stats = ['Node 0: acc_rate=0.188', 'Node 1: acc_rate=0.236', 'Node 2: acc_rate=0.225']...

=== FINAL RESULTS ===
Dataset: femnist, Nodes: 20, Graph: erdos, Aggregation: sketchguard
Attack: backdoor, 80.0% compromised
Final accuracy - Compromised: 0.0497, Honest: 0.8579
Overall test accuracy: mean=0.2114 ± 0.3233

=== BACKDOOR ATTACK SUCCESS RATE (ASR) ===
Target label: 0
Trigger size: 4x4
Overall ASR: 0.8098 ± 0.3804
Honest nodes ASR: 0.0490 ± 0.0040
Compromised nodes ASR: 1.0000 ± 0.0000
Note: Higher ASR indicates more successful backdoor attack

=== Sketchguard SUMMARY ===
Node 0: acceptance=0.188
Node 1: acceptance=0.236
Node 2: acceptance=0.225
Node 3: acceptance=0.212
Node 4: acceptance=0.273
Node 5: acceptance=0.213
Node 6: acceptance=0.214
Node 7: acceptance=0.143
Node 8: acceptance=0.220
Node 9: acceptance=0.231
Node 10: acceptance=0.222
Node 11: acceptance=0.221
Node 12: acceptance=0.225
Node 13: acceptance=0.223
Node 14: acceptance=0.220
Node 15: acceptance=0.218
Node 16: acceptance=0.154
Node 17: acceptance=0.233
Node 18: acceptance=0.225
Node 19: acceptance=0.219

=== PARALLEL EXECUTION TIME (realistic for distributed system) ===
  COMMUNICATION (max across nodes):
    - Sketch transfer: 0.000s (0.0%)
    - Model fetch (accepted): 0.000s (0.0%)
  COMPUTATION (max across nodes):
    - Sketching: 2.432s (99.4%)
    - Filtering: 0.002s (0.1%)
    - Aggregation: 0.013s (0.5%)
  TOTALS:
    - Total computation: 2.446s (100.0%)
    - Total communication: 0.000s (0.0%)
    - Total parallel time: 2.446s

=== PER-NODE AVERAGE TIME ===
  - Sketching: 2.041s
  - Filtering: 0.001s
  - Aggregation: 0.009s
  - Sketch transfer: 0.000s
  - Model fetch: 0.000s
  - Total per node: 2.051s

=== TOTAL COMPUTATIONAL WORK (sum across all nodes) ===
  - Total sketching: 40.819s
  - Total filtering: 0.022s
  - Total aggregation: 0.184s
  - Total sketch transfer: 0.000s
  - Total model fetch: 0.000s
  - Grand total: 41.025s
  - Mean acceptance rate: 0.216

Sketchguard Algorithm Properties:
  - Original dimension: 6,603,710
  - Sketch size: 1000
  - Compression ratio: 19.9x
  - Single repetition: No repetitions needed
  - Theoretical complexity: O(d + N×k)
  - Approach: Sketch filtering + state aggregation
