Device: cuda
Seed: 987654321
Loading 36 LEAF FEMNIST train files...
LEAF FEMNIST train: 3597 users, 734463 samples
Loading 36 LEAF FEMNIST test files...
LEAF FEMNIST test: 3597 users, 83388 samples
Found 3597 train users, 3597 test users, 3597 common users
User sample counts range: 525 (max) to 17 (min)
Distributed ALL 3597 users across 20 clients
Users per client: 179 (with 17 clients getting +1 user)
Train partition sizes: [36360, 37070, 35957, 38262, 36024, 37732, 36921, 38328, 36867, 37683, 36507, 36915, 36007, 37001, 35681, 35453, 36585, 36801, 35964, 36345]
Test partition sizes: [4128, 4203, 4081, 4333, 4091, 4287, 4193, 4349, 4191, 4277, 4143, 4193, 4093, 4197, 4052, 4029, 4153, 4183, 4084, 4128]
  Client 0: 36360 train samples, 62 unique classes
  Client 1: 37070 train samples, 62 unique classes
  Client 2: 35957 train samples, 62 unique classes
  Client 3: 38262 train samples, 62 unique classes
  Client 4: 36024 train samples, 62 unique classes
  Client 5: 37732 train samples, 62 unique classes
  Client 6: 36921 train samples, 62 unique classes
  Client 7: 38328 train samples, 62 unique classes
  Client 8: 36867 train samples, 62 unique classes
  Client 9: 37683 train samples, 62 unique classes
  Client 10: 36507 train samples, 62 unique classes
  Client 11: 36915 train samples, 62 unique classes
  Client 12: 36007 train samples, 62 unique classes
  Client 13: 37001 train samples, 62 unique classes
  Client 14: 35681 train samples, 62 unique classes
  Client 15: 35453 train samples, 62 unique classes
  Client 16: 36585 train samples, 62 unique classes
  Client 17: 36801 train samples, 62 unique classes
  Client 18: 35964 train samples, 62 unique classes
  Client 19: 36345 train samples, 62 unique classes
Will sample 4500 samples per client per epoch
Graph: ring, nodes: 20, edges: 20
Degree statistics: avg=2.00, min=2, max=2
Attack: Compromised 2/20 nodes: [5, 13]
Attack type: directed_deviation, lambda: 1.0
Model variant: baseline
Model parameters: 6,603,710
Initial test acc across nodes: mean=0.0168 ± 0.0139
Round 001: test acc mean=0.0553 ± 0.0093 | min=0.0481 max=0.0862
         : test loss mean=3.6875 ± 0.0160
         : individual accs = ['0.051599', '0.051630', '0.048272', '0.048234', '0.057932', '0.050618', '0.057000', '0.074730', '0.053209', '0.053776', '0.050447', '0.061770', '0.050818', '0.049559', '0.048124', '0.050633', '0.058271', '0.050920', '0.052889', '0.086240']
         : correct/total = [(213, 4128), (217, 4203), (197, 4081), (209, 4333), (237, 4091), (217, 4287), (239, 4193), (325, 4349), (223, 4191), (230, 4277), (209, 4143), (259, 4193), (208, 4093), (208, 4197), (195, 4052), (204, 4029), (242, 4153), (213, 4183), (216, 4084), (356, 4128)]
         : compromised: 0.0501, honest: 0.0559
Round 002: test acc mean=0.0591 ± 0.0158 | min=0.0446 max=0.0953
         : test loss mean=3.6816 ± 0.0170
         : individual accs = ['0.044574', '0.051630', '0.095320', '0.052850', '0.057932', '0.050618', '0.051037', '0.058174', '0.051062', '0.083470', '0.045619', '0.045314', '0.054239', '0.049083', '0.081441', '0.067262', '0.054418', '0.046139', '0.093536', '0.048450']
         : correct/total = [(184, 4128), (217, 4203), (389, 4081), (229, 4333), (237, 4091), (217, 4287), (214, 4193), (253, 4349), (214, 4191), (357, 4277), (189, 4143), (190, 4193), (222, 4093), (206, 4197), (330, 4052), (271, 4029), (226, 4153), (193, 4183), (382, 4084), (200, 4128)]
         : compromised: 0.0499, honest: 0.0601
Round 003: test acc mean=0.0617 ± 0.0215 | min=0.0443 max=0.1365
         : test loss mean=3.6744 ± 0.0164
         : individual accs = ['0.063227', '0.052819', '0.050723', '0.048234', '0.057932', '0.050618', '0.044598', '0.051506', '0.057266', '0.065466', '0.055274', '0.051514', '0.068409', '0.071480', '0.136476', '0.056342', '0.105225', '0.050203', '0.052889', '0.044331']
         : correct/total = [(261, 4128), (222, 4203), (207, 4081), (209, 4333), (237, 4091), (217, 4287), (187, 4193), (224, 4349), (240, 4191), (280, 4277), (229, 4143), (216, 4193), (280, 4093), (300, 4197), (553, 4052), (227, 4029), (437, 4153), (210, 4183), (216, 4084), (183, 4128)]
         : compromised: 0.0610, honest: 0.0618
Round 004: test acc mean=0.0768 ± 0.0289 | min=0.0461 max=0.1506
         : test loss mean=3.6656 ± 0.0169
         : individual accs = ['0.059593', '0.101118', '0.074982', '0.074544', '0.082132', '0.076977', '0.144050', '0.083238', '0.113099', '0.064064', '0.046102', '0.065109', '0.054239', '0.049083', '0.066140', '0.054852', '0.074645', '0.150610', '0.052889', '0.048692']
         : correct/total = [(246, 4128), (425, 4203), (306, 4081), (323, 4333), (336, 4091), (330, 4287), (604, 4193), (362, 4349), (474, 4191), (274, 4277), (191, 4143), (273, 4193), (222, 4093), (206, 4197), (268, 4052), (221, 4029), (310, 4153), (630, 4183), (216, 4084), (201, 4128)]
         : compromised: 0.0630, honest: 0.0783
Round 005: test acc mean=0.1080 ± 0.0394 | min=0.0478 max=0.1770
         : test loss mean=3.6538 ± 0.0184
         : individual accs = ['0.091085', '0.052581', '0.106837', '0.177014', '0.132730', '0.126895', '0.122108', '0.047827', '0.164400', '0.068272', '0.057929', '0.145958', '0.081847', '0.073147', '0.110069', '0.055101', '0.108355', '0.158260', '0.130020', '0.149467']
         : correct/total = [(376, 4128), (221, 4203), (436, 4081), (767, 4333), (543, 4091), (544, 4287), (512, 4193), (208, 4349), (689, 4191), (292, 4277), (240, 4143), (612, 4193), (335, 4093), (307, 4197), (446, 4052), (222, 4029), (450, 4153), (662, 4183), (531, 4084), (617, 4128)]
         : compromised: 0.1000, honest: 0.1089
Round 006: test acc mean=0.1303 ± 0.0393 | min=0.0446 max=0.2002
         : test loss mean=3.6306 ± 0.0250
         : individual accs = ['0.044574', '0.155365', '0.177407', '0.114470', '0.142264', '0.132027', '0.109230', '0.124856', '0.200191', '0.094459', '0.061067', '0.140234', '0.154899', '0.147486', '0.157453', '0.116406', '0.183963', '0.154435', '0.124388', '0.071221']
         : correct/total = [(184, 4128), (653, 4203), (724, 4081), (496, 4333), (582, 4091), (566, 4287), (458, 4193), (543, 4349), (839, 4191), (404, 4277), (253, 4143), (588, 4193), (634, 4093), (619, 4197), (638, 4052), (469, 4029), (764, 4153), (646, 4183), (508, 4084), (294, 4128)]
         : compromised: 0.1398, honest: 0.1293
Round 007: test acc mean=0.1650 ± 0.0538 | min=0.0909 max=0.2745
         : test loss mean=3.5761 ± 0.0482
         : individual accs = ['0.242975', '0.165120', '0.210243', '0.148627', '0.119286', '0.119431', '0.125209', '0.092435', '0.183250', '0.145663', '0.124306', '0.214405', '0.090887', '0.096736', '0.236673', '0.211963', '0.158921', '0.215874', '0.274486', '0.124273']
         : correct/total = [(1003, 4128), (694, 4203), (858, 4081), (644, 4333), (488, 4091), (512, 4287), (525, 4193), (402, 4349), (768, 4191), (623, 4277), (515, 4143), (899, 4193), (372, 4093), (406, 4197), (959, 4052), (854, 4029), (660, 4153), (903, 4183), (1121, 4084), (513, 4128)]
         : compromised: 0.1081, honest: 0.1714
Round 008: test acc mean=0.2093 ± 0.0293 | min=0.1553 max=0.2804
         : test loss mean=3.4481 ± 0.1109
         : individual accs = ['0.200097', '0.178920', '0.259740', '0.155320', '0.225862', '0.224866', '0.227761', '0.196137', '0.221904', '0.174655', '0.165339', '0.199380', '0.192280', '0.206576', '0.280355', '0.225118', '0.228991', '0.220655', '0.203967', '0.198401']
         : correct/total = [(826, 4128), (752, 4203), (1060, 4081), (673, 4333), (924, 4091), (964, 4287), (955, 4193), (853, 4349), (930, 4191), (747, 4277), (685, 4143), (836, 4193), (787, 4093), (867, 4197), (1136, 4052), (907, 4029), (951, 4153), (923, 4183), (833, 4084), (819, 4128)]
         : compromised: 0.2157, honest: 0.2086
Round 009: test acc mean=0.2779 ± 0.0486 | min=0.1849 max=0.3601
         : test loss mean=3.1659 ± 0.1785
         : individual accs = ['0.238130', '0.245539', '0.322470', '0.268405', '0.342459', '0.335899', '0.250656', '0.184870', '0.313768', '0.254150', '0.251026', '0.279275', '0.219399', '0.207767', '0.360069', '0.289154', '0.310619', '0.316280', '0.334966', '0.232316']
         : correct/total = [(983, 4128), (1032, 4203), (1316, 4081), (1163, 4333), (1401, 4091), (1440, 4287), (1051, 4193), (804, 4349), (1315, 4191), (1087, 4277), (1040, 4143), (1171, 4193), (898, 4093), (872, 4197), (1459, 4052), (1165, 4029), (1290, 4153), (1323, 4183), (1368, 4084), (959, 4128)]
         : compromised: 0.2718, honest: 0.2785
Round 010: test acc mean=0.3424 ± 0.0271 | min=0.2988 max=0.4047
         : test loss mean=2.7959 ± 0.1676
         : individual accs = ['0.313227', '0.307875', '0.373193', '0.353104', '0.365436', '0.358759', '0.318626', '0.326972', '0.366500', '0.348609', '0.331885', '0.330074', '0.298803', '0.300214', '0.404738', '0.354430', '0.362870', '0.349032', '0.364104', '0.320494']
         : correct/total = [(1293, 4128), (1294, 4203), (1523, 4081), (1530, 4333), (1495, 4091), (1538, 4287), (1336, 4193), (1422, 4349), (1536, 4191), (1491, 4277), (1375, 4143), (1384, 4193), (1223, 4093), (1260, 4197), (1640, 4052), (1428, 4029), (1507, 4153), (1460, 4183), (1487, 4084), (1323, 4128)]
         : compromised: 0.3295, honest: 0.3439

=== FINAL RESULTS ===
Dataset: femnist, Nodes: 20, Graph: ring, Aggregation: krum
Attack: directed_deviation, 10.0% compromised
Final accuracy - Compromised: 0.3295, Honest: 0.3439
Overall test accuracy: mean=0.3424 ± 0.0271
