Device: cuda
Seed: 987654321
Loading 36 LEAF FEMNIST train files...
LEAF FEMNIST train: 3597 users, 734463 samples
Loading 36 LEAF FEMNIST test files...
LEAF FEMNIST test: 3597 users, 83388 samples
Found 3597 train users, 3597 test users, 3597 common users
User sample counts range: 525 (max) to 17 (min)
Distributed ALL 3597 users across 20 clients
Users per client: 179 (with 17 clients getting +1 user)
Train partition sizes: [36360, 37070, 35957, 38262, 36024, 37732, 36921, 38328, 36867, 37683, 36507, 36915, 36007, 37001, 35681, 35453, 36585, 36801, 35964, 36345]
Test partition sizes: [4128, 4203, 4081, 4333, 4091, 4287, 4193, 4349, 4191, 4277, 4143, 4193, 4093, 4197, 4052, 4029, 4153, 4183, 4084, 4128]
  Client 0: 36360 train samples, 62 unique classes
  Client 1: 37070 train samples, 62 unique classes
  Client 2: 35957 train samples, 62 unique classes
  Client 3: 38262 train samples, 62 unique classes
  Client 4: 36024 train samples, 62 unique classes
  Client 5: 37732 train samples, 62 unique classes
  Client 6: 36921 train samples, 62 unique classes
  Client 7: 38328 train samples, 62 unique classes
  Client 8: 36867 train samples, 62 unique classes
  Client 9: 37683 train samples, 62 unique classes
  Client 10: 36507 train samples, 62 unique classes
  Client 11: 36915 train samples, 62 unique classes
  Client 12: 36007 train samples, 62 unique classes
  Client 13: 37001 train samples, 62 unique classes
  Client 14: 35681 train samples, 62 unique classes
  Client 15: 35453 train samples, 62 unique classes
  Client 16: 36585 train samples, 62 unique classes
  Client 17: 36801 train samples, 62 unique classes
  Client 18: 35964 train samples, 62 unique classes
  Client 19: 36345 train samples, 62 unique classes
Will sample 4500 samples per client per epoch
Graph: ring, nodes: 20, edges: 20
Degree statistics: avg=2.00, min=2, max=2
Attack: Compromised 12/20 nodes: [1, 2, 3, 5, 8, 11, 12, 13, 14, 15, 17, 18]
Attack type: directed_deviation, lambda: 1.0
Model variant: baseline
Model parameters: 6,603,710
BALANCE algorithm:
Balance Config: BALANCEConfig(gamma=2, kappa=1, alpha=0.5, min_neighbors=1)
  - Model dimension: 6,603,710 parameters
  - Complexity: O(N×d) = O(20×6,603,710)
Initial test acc across nodes: mean=0.0168 ± 0.0139
Round 001: test acc mean=0.0415 ± 0.0180 | min=0.0027 max=0.0608
         : test loss mean=5893.8827 ± 10026.3341
         : individual accs = ['0.049661', '0.052344', '0.040431', '0.043157', '0.057932', '0.048519', '0.044598', '0.049207', '0.047960', '0.047463', '0.055274', '0.060816', '0.002688', '0.013105', '0.006910', '0.050385', '0.004334', '0.050920', '0.054358', '0.050145']
         : correct/total = [(205, 4128), (220, 4203), (165, 4081), (187, 4333), (237, 4091), (208, 4287), (187, 4193), (214, 4349), (201, 4191), (203, 4277), (229, 4143), (255, 4193), (11, 4093), (55, 4197), (28, 4052), (203, 4029), (18, 4153), (213, 4183), (222, 4084), (207, 4128)]
         : compromised: 0.0393, honest: 0.0448
Round 002: test acc mean=0.0512 ± 0.0041 | min=0.0456 max=0.0583
         : test loss mean=173.1729 ± 278.5645
         : individual accs = ['0.051599', '0.046158', '0.057584', '0.047773', '0.051088', '0.050618', '0.057000', '0.058174', '0.051062', '0.048398', '0.045619', '0.046983', '0.050818', '0.049559', '0.045656', '0.056342', '0.058271', '0.050203', '0.052889', '0.048450']
         : correct/total = [(213, 4128), (194, 4203), (235, 4081), (207, 4333), (209, 4091), (217, 4287), (239, 4193), (253, 4349), (214, 4191), (207, 4277), (189, 4143), (197, 4193), (208, 4093), (208, 4197), (185, 4052), (227, 4029), (242, 4153), (210, 4183), (216, 4084), (200, 4128)]
         : compromised: 0.0505, honest: 0.0523
Round 003: test acc mean=0.0523 ± 0.0060 | min=0.0446 max=0.0727
         : test loss mean=60.5594 ± 89.4016
         : individual accs = ['0.059593', '0.050916', '0.050723', '0.048465', '0.051088', '0.050618', '0.044598', '0.049207', '0.047960', '0.047463', '0.055274', '0.053184', '0.053750', '0.046938', '0.048124', '0.051626', '0.058271', '0.049486', '0.072723', '0.055475']
         : correct/total = [(246, 4128), (214, 4203), (207, 4081), (210, 4333), (209, 4091), (217, 4287), (187, 4193), (214, 4349), (201, 4191), (203, 4277), (229, 4143), (223, 4193), (220, 4093), (197, 4197), (195, 4052), (208, 4029), (242, 4153), (207, 4183), (297, 4084), (229, 4128)]
         : compromised: 0.0520, honest: 0.0526
Round 004: test acc mean=0.0547 ± 0.0192 | min=0.0194 max=0.0974
         : test loss mean=35.6296 ± 47.7243
         : individual accs = ['0.097384', '0.052344', '0.019358', '0.033003', '0.047421', '0.050618', '0.082518', '0.086917', '0.051062', '0.048398', '0.045619', '0.046983', '0.049597', '0.045747', '0.046397', '0.051626', '0.044546', '0.049486', '0.052889', '0.092539']
         : correct/total = [(402, 4128), (220, 4203), (79, 4081), (143, 4333), (194, 4091), (217, 4287), (346, 4193), (378, 4349), (214, 4191), (207, 4277), (189, 4143), (197, 4193), (203, 4093), (192, 4197), (188, 4052), (208, 4029), (185, 4153), (207, 4183), (216, 4084), (382, 4128)]
         : compromised: 0.0458, honest: 0.0682
Round 005: test acc mean=0.0544 ± 0.0120 | min=0.0312 max=0.0899
         : test loss mean=11.0479 ± 10.7044
         : individual accs = ['0.089874', '0.052344', '0.050723', '0.031156', '0.051088', '0.050618', '0.046745', '0.047827', '0.051062', '0.053776', '0.055998', '0.061054', '0.053750', '0.046938', '0.048124', '0.056590', '0.052011', '0.050920', '0.056317', '0.081638']
         : correct/total = [(371, 4128), (220, 4203), (207, 4081), (135, 4333), (209, 4091), (217, 4287), (196, 4193), (208, 4349), (214, 4191), (230, 4277), (232, 4143), (256, 4193), (220, 4093), (197, 4197), (195, 4052), (228, 4029), (216, 4153), (213, 4183), (230, 4084), (337, 4128)]
         : compromised: 0.0508, honest: 0.0599
Round 006: test acc mean=0.0571 ± 0.0137 | min=0.0439 max=0.0910
         : test loss mean=19.0526 ± 23.3221
         : individual accs = ['0.077035', '0.062099', '0.045087', '0.047773', '0.047421', '0.051318', '0.043883', '0.053346', '0.053209', '0.090952', '0.086894', '0.061770', '0.049597', '0.045747', '0.046397', '0.056590', '0.044546', '0.050920', '0.055583', '0.071221']
         : correct/total = [(318, 4128), (261, 4203), (184, 4081), (207, 4333), (194, 4091), (220, 4287), (184, 4193), (232, 4349), (223, 4191), (389, 4277), (360, 4143), (259, 4193), (203, 4093), (192, 4197), (188, 4052), (228, 4029), (185, 4153), (213, 4183), (227, 4084), (294, 4128)]
         : compromised: 0.0522, honest: 0.0644
Round 007: test acc mean=0.0674 ± 0.0273 | min=0.0469 max=0.1410
         : test loss mean=13.3251 ± 15.7664
         : individual accs = ['0.140988', '0.052344', '0.057584', '0.048465', '0.051088', '0.075111', '0.097544', '0.092205', '0.053209', '0.060556', '0.063239', '0.053899', '0.058637', '0.046938', '0.048124', '0.051626', '0.058271', '0.050920', '0.050930', '0.136386']
         : correct/total = [(582, 4128), (220, 4203), (235, 4081), (210, 4333), (209, 4091), (322, 4287), (409, 4193), (401, 4349), (223, 4191), (259, 4277), (262, 4143), (226, 4193), (240, 4093), (197, 4197), (195, 4052), (208, 4029), (242, 4153), (213, 4183), (208, 4084), (563, 4128)]
         : compromised: 0.0540, honest: 0.0875
Round 008: test acc mean=0.0646 ± 0.0322 | min=0.0247 max=0.1514
         : test loss mean=32.9658 ± 44.7802
         : individual accs = ['0.151405', '0.110635', '0.045087', '0.024694', '0.047421', '0.053651', '0.049130', '0.051276', '0.084944', '0.073884', '0.077963', '0.054615', '0.049597', '0.045747', '0.046397', '0.041698', '0.044546', '0.045900', '0.057052', '0.137112']
         : correct/total = [(625, 4128), (465, 4203), (184, 4081), (107, 4333), (194, 4091), (230, 4287), (206, 4193), (223, 4349), (356, 4191), (316, 4277), (323, 4143), (229, 4193), (203, 4093), (192, 4197), (188, 4052), (168, 4029), (185, 4153), (192, 4183), (233, 4084), (566, 4128)]
         : compromised: 0.0550, honest: 0.0791
Round 009: test acc mean=0.0585 ± 0.0104 | min=0.0469 max=0.0883
         : test loss mean=8.5068 ± 11.3870
         : individual accs = ['0.061773', '0.050916', '0.050723', '0.048465', '0.051088', '0.074644', '0.070832', '0.059784', '0.088284', '0.057751', '0.056481', '0.058908', '0.053750', '0.046938', '0.048124', '0.056590', '0.055141', '0.050920', '0.073457', '0.055717']
         : correct/total = [(255, 4128), (214, 4203), (207, 4081), (210, 4333), (209, 4091), (320, 4287), (297, 4193), (260, 4349), (370, 4191), (247, 4277), (234, 4143), (247, 4193), (220, 4093), (197, 4197), (195, 4052), (228, 4029), (229, 4153), (213, 4183), (300, 4084), (230, 4128)]
         : compromised: 0.0585, honest: 0.0586
Round 010: test acc mean=0.0655 ± 0.0251 | min=0.0407 max=0.1325
         : test loss mean=61.0430 ± 127.2468
         : individual accs = ['0.104167', '0.100404', '0.045087', '0.043388', '0.043266', '0.132494', '0.055092', '0.058634', '0.054880', '0.053776', '0.055998', '0.092774', '0.050818', '0.049559', '0.046644', '0.056590', '0.040693', '0.050920', '0.079334', '0.095203']
         : correct/total = [(430, 4128), (422, 4203), (184, 4081), (188, 4333), (177, 4091), (568, 4287), (231, 4193), (255, 4349), (230, 4191), (230, 4277), (232, 4143), (389, 4193), (208, 4093), (208, 4197), (189, 4052), (228, 4029), (169, 4153), (213, 4183), (324, 4084), (393, 4128)]
         : compromised: 0.0669, honest: 0.0634

=== FINAL RESULTS ===
Dataset: femnist, Nodes: 20, Graph: ring, Aggregation: balance
Attack: directed_deviation, 60.0% compromised
Final accuracy - Compromised: 0.0669, Honest: 0.0634
Overall test accuracy: mean=0.0655 ± 0.0251

=== BALANCE SUMMARY ===
Node 0: acceptance=0.500
Node 1: acceptance=0.500
Node 2: acceptance=0.100
Node 3: acceptance=0.500
Node 4: acceptance=0.100
Node 5: acceptance=0.550
Node 6: acceptance=0.500
Node 7: acceptance=0.500
Node 8: acceptance=0.750
Node 9: acceptance=0.500
Node 10: acceptance=0.500
Node 11: acceptance=0.500
Node 12: acceptance=0.100
Node 13: acceptance=0.300
Node 14: acceptance=0.200
Node 15: acceptance=0.600
Node 16: acceptance=0.200
Node 17: acceptance=0.600
Node 18: acceptance=0.500
Node 19: acceptance=0.500

=== PARALLEL EXECUTION TIME (realistic for distributed system) ===
  COMMUNICATION (max across nodes):
    - Full model transfer: 0.000s (0.0%)
  COMPUTATION (max across nodes):
    - Filtering: 0.021s (67.3%)
    - Aggregation: 0.010s (32.7%)
  TOTALS:
    - Total computation: 0.031s (100.0%)
    - Total communication: 0.000s (0.0%)
    - Total parallel time: 0.031s

=== PER-NODE AVERAGE TIME ===
  - Filtering: 0.014s
  - Aggregation: 0.003s
  - Model transfer: 0.000s
  - Total per node: 0.018s

=== TOTAL COMPUTATIONAL WORK (sum across all nodes) ===
  - Total filtering: 0.282s
  - Total aggregation: 0.069s
  - Total model transfer: 0.000s
  - Grand total: 0.351s
  - Mean acceptance rate: 0.425

BALANCE Algorithm Properties:
  - Model dimension: 6,603,710
  - No compression: Full parameter comparison
  - Theoretical complexity: O(deg(i)×d)
  - Approach: Full parameter filtering + averaging
