Device: cuda
Seed: 987654321
Loading 36 LEAF FEMNIST train files...
LEAF FEMNIST train: 3597 users, 734463 samples
Loading 36 LEAF FEMNIST test files...
LEAF FEMNIST test: 3597 users, 83388 samples
Found 3597 train users, 3597 test users, 3597 common users
User sample counts range: 525 (max) to 17 (min)
Distributed ALL 3597 users across 20 clients
Users per client: 179 (with 17 clients getting +1 user)
Train partition sizes: [36360, 37070, 35957, 38262, 36024, 37732, 36921, 38328, 36867, 37683, 36507, 36915, 36007, 37001, 35681, 35453, 36585, 36801, 35964, 36345]
Test partition sizes: [4128, 4203, 4081, 4333, 4091, 4287, 4193, 4349, 4191, 4277, 4143, 4193, 4093, 4197, 4052, 4029, 4153, 4183, 4084, 4128]
  Client 0: 36360 train samples, 62 unique classes
  Client 1: 37070 train samples, 62 unique classes
  Client 2: 35957 train samples, 62 unique classes
  Client 3: 38262 train samples, 62 unique classes
  Client 4: 36024 train samples, 62 unique classes
  Client 5: 37732 train samples, 62 unique classes
  Client 6: 36921 train samples, 62 unique classes
  Client 7: 38328 train samples, 62 unique classes
  Client 8: 36867 train samples, 62 unique classes
  Client 9: 37683 train samples, 62 unique classes
  Client 10: 36507 train samples, 62 unique classes
  Client 11: 36915 train samples, 62 unique classes
  Client 12: 36007 train samples, 62 unique classes
  Client 13: 37001 train samples, 62 unique classes
  Client 14: 35681 train samples, 62 unique classes
  Client 15: 35453 train samples, 62 unique classes
  Client 16: 36585 train samples, 62 unique classes
  Client 17: 36801 train samples, 62 unique classes
  Client 18: 35964 train samples, 62 unique classes
  Client 19: 36345 train samples, 62 unique classes
Will sample 4500 samples per client per epoch
Graph: fully, nodes: 20, edges: 190
Degree statistics: avg=19.00, min=19, max=19
Attack: Compromised 12/20 nodes: [1, 2, 3, 5, 8, 11, 12, 13, 14, 15, 17, 18]
Attack type: backdoor, lambda: 1.0
Backdoor target label: 0, trigger size: 4
Model variant: baseline
Model parameters: 6,603,710
UBAR ALGORITHM (Two-Stage Byzantine-resilient)
  - Model dimension: 6,603,710 parameters
  - Rho parameter: 0.4
  - Stage 1: Distance-based filtering (select 40% closest neighbors)
  - Stage 2: Performance-based selection (loss comparison)
  - Complexity: O(deg(i)×d + deg(i)×inference)
Initial test acc across nodes: mean=0.0168 ± 0.0139
Backdoor attack: Created poisoned datasets for 12 compromised nodes
Round 001: test acc mean=0.0532 ± 0.0100 | min=0.0432 max=0.0935
         : test loss mean=18878.9624 ± 15501.7354
         : individual accs = ['0.093508', '0.048775', '0.053418', '0.043157', '0.057932', '0.045253', '0.057000', '0.051276', '0.049630', '0.047229', '0.050447', '0.049606', '0.054239', '0.049083', '0.051826', '0.051626', '0.058271', '0.049486', '0.052889', '0.050145']
         : correct/total = [(386, 4128), (205, 4203), (218, 4081), (187, 4333), (237, 4091), (194, 4287), (239, 4193), (223, 4349), (208, 4191), (202, 4277), (209, 4143), (208, 4193), (222, 4093), (206, 4197), (210, 4052), (208, 4029), (242, 4153), (207, 4183), (216, 4084), (207, 4128)]
         : compromised: 0.0499, honest: 0.0582
         : ubar stats = ['Node 0: s1=0.368, s2=0.571', 'Node 1: s1=0.368, s2=1.000', 'Node 2: s1=0.368, s2=1.000']...
Round 002: test acc mean=0.0439 ± 0.0151 | min=0.0091 max=0.0579
         : test loss mean=11500.9559 ± 17270.7297
         : individual accs = ['0.044574', '0.009279', '0.032590', '0.013386', '0.057932', '0.046886', '0.057000', '0.047827', '0.053448', '0.053776', '0.041999', '0.046506', '0.057171', '0.049083', '0.051826', '0.051626', '0.049362', '0.049486', '0.009060', '0.055475']
         : correct/total = [(184, 4128), (39, 4203), (133, 4081), (58, 4333), (237, 4091), (201, 4287), (239, 4193), (208, 4349), (224, 4191), (230, 4277), (174, 4143), (195, 4193), (234, 4093), (206, 4197), (210, 4052), (208, 4029), (205, 4153), (207, 4183), (37, 4084), (229, 4128)]
         : compromised: 0.0392, honest: 0.0510
         : ubar stats = ['Node 0: s1=0.368, s2=0.643', 'Node 1: s1=0.368, s2=1.000', 'Node 2: s1=0.368, s2=1.000']...
Round 003: test acc mean=0.0512 ± 0.0041 | min=0.0432 max=0.0596
         : test loss mean=49899641481157.8359 ± 158958641657940.7812
         : individual accs = ['0.059593', '0.048775', '0.050723', '0.043157', '0.057932', '0.045253', '0.057000', '0.051276', '0.049630', '0.047697', '0.051653', '0.049606', '0.054239', '0.049083', '0.051826', '0.051626', '0.054418', '0.045900', '0.052889', '0.050872']
         : correct/total = [(246, 4128), (205, 4203), (207, 4081), (187, 4333), (237, 4091), (194, 4287), (239, 4193), (223, 4349), (208, 4191), (204, 4277), (214, 4143), (208, 4193), (222, 4093), (206, 4197), (210, 4052), (208, 4029), (226, 4153), (192, 4183), (216, 4084), (210, 4128)]
         : compromised: 0.0494, honest: 0.0538
         : ubar stats = ['Node 0: s1=0.368, s2=0.762', 'Node 1: s1=0.368, s2=1.000', 'Node 2: s1=0.368, s2=1.000']...
Round 004: test acc mean=0.0531 ± 0.0108 | min=0.0432 max=0.0961
         : test loss mean=nan ± nan
         : individual accs = ['0.059593', '0.048775', '0.048272', '0.043157', '0.096065', '0.048519', '0.057000', '0.058174', '0.049630', '0.048398', '0.045619', '0.046983', '0.054239', '0.049083', '0.051826', '0.051626', '0.058271', '0.049486', '0.051665', '0.045058']
         : correct/total = [(246, 4128), (205, 4203), (197, 4081), (187, 4333), (393, 4091), (208, 4287), (239, 4193), (253, 4349), (208, 4191), (207, 4277), (189, 4143), (197, 4193), (222, 4093), (206, 4197), (210, 4052), (208, 4029), (242, 4153), (207, 4183), (211, 4084), (186, 4128)]
         : compromised: 0.0494, honest: 0.0585
         : ubar stats = ['Node 0: s1=0.368, s2=0.679', 'Node 1: s1=0.368, s2=0.786', 'Node 2: s1=0.368, s2=1.000']...
Round 005: test acc mean=0.0520 ± 0.0043 | min=0.0432 max=0.0596
         : test loss mean=nan ± nan
         : individual accs = ['0.059593', '0.048775', '0.053418', '0.043157', '0.057932', '0.045253', '0.057000', '0.047827', '0.049630', '0.053776', '0.055998', '0.049606', '0.054239', '0.049083', '0.051826', '0.051626', '0.058993', '0.049486', '0.052889', '0.050145']
         : correct/total = [(246, 4128), (205, 4203), (218, 4081), (187, 4333), (237, 4091), (194, 4287), (239, 4193), (208, 4349), (208, 4191), (230, 4277), (232, 4143), (208, 4193), (222, 4093), (206, 4197), (210, 4052), (208, 4029), (245, 4153), (207, 4183), (216, 4084), (207, 4128)]
         : compromised: 0.0499, honest: 0.0552
         : ubar stats = ['Node 0: s1=0.368, s2=0.686', 'Node 1: s1=0.368, s2=0.657', 'Node 2: s1=0.368, s2=0.829']...
Round 006: test acc mean=0.0514 ± 0.0041 | min=0.0432 max=0.0583
         : test loss mean=nan ± nan
         : individual accs = ['0.044574', '0.048775', '0.053418', '0.043157', '0.057932', '0.045253', '0.057000', '0.051276', '0.049630', '0.053776', '0.050447', '0.049606', '0.054239', '0.049083', '0.051826', '0.051626', '0.058271', '0.049486', '0.052889', '0.055475']
         : correct/total = [(184, 4128), (205, 4203), (218, 4081), (187, 4333), (237, 4091), (194, 4287), (239, 4193), (223, 4349), (208, 4191), (230, 4277), (209, 4143), (208, 4193), (222, 4093), (206, 4197), (210, 4052), (208, 4029), (242, 4153), (207, 4183), (216, 4084), (229, 4128)]
         : compromised: 0.0499, honest: 0.0536
         : ubar stats = ['Node 0: s1=0.368, s2=0.738', 'Node 1: s1=0.368, s2=0.571', 'Node 2: s1=0.368, s2=0.714']...
Round 007: test acc mean=0.0537 ± 0.0075 | min=0.0432 max=0.0809
         : test loss mean=nan ± nan
         : individual accs = ['0.059593', '0.048775', '0.053418', '0.043157', '0.051088', '0.045253', '0.057000', '0.058174', '0.049630', '0.053776', '0.055998', '0.049606', '0.054239', '0.049083', '0.051826', '0.051626', '0.058512', '0.049486', '0.052889', '0.080911']
         : correct/total = [(246, 4128), (205, 4203), (218, 4081), (187, 4333), (209, 4091), (194, 4287), (239, 4193), (253, 4349), (208, 4191), (230, 4277), (232, 4143), (208, 4193), (222, 4093), (206, 4197), (210, 4052), (208, 4029), (243, 4153), (207, 4183), (216, 4084), (334, 4128)]
         : compromised: 0.0499, honest: 0.0594
         : ubar stats = ['Node 0: s1=0.368, s2=0.714', 'Node 1: s1=0.368, s2=0.510', 'Node 2: s1=0.368, s2=0.633']...
Round 008: test acc mean=0.0511 ± 0.0040 | min=0.0432 max=0.0596
         : test loss mean=nan ± nan
         : individual accs = ['0.059593', '0.048775', '0.053418', '0.043157', '0.051088', '0.045253', '0.057954', '0.051276', '0.049630', '0.054244', '0.045619', '0.049606', '0.054239', '0.049083', '0.051826', '0.051626', '0.055141', '0.049486', '0.052889', '0.048692']
         : correct/total = [(246, 4128), (205, 4203), (218, 4081), (187, 4333), (209, 4091), (194, 4287), (243, 4193), (223, 4349), (208, 4191), (232, 4277), (189, 4143), (208, 4193), (222, 4093), (206, 4197), (210, 4052), (208, 4029), (229, 4153), (207, 4183), (216, 4084), (201, 4128)]
         : compromised: 0.0499, honest: 0.0530
         : ubar stats = ['Node 0: s1=0.368, s2=0.696', 'Node 1: s1=0.368, s2=0.464', 'Node 2: s1=0.368, s2=0.571']...
Round 009: test acc mean=0.0537 ± 0.0074 | min=0.0432 max=0.0806
         : test loss mean=nan ± nan
         : individual accs = ['0.059593', '0.048775', '0.053418', '0.043157', '0.051088', '0.045253', '0.080611', '0.058174', '0.049630', '0.055179', '0.055998', '0.049606', '0.054239', '0.049083', '0.051826', '0.051626', '0.058271', '0.049486', '0.052889', '0.055475']
         : correct/total = [(246, 4128), (205, 4203), (218, 4081), (187, 4333), (209, 4091), (194, 4287), (338, 4193), (253, 4349), (208, 4191), (236, 4277), (232, 4143), (208, 4193), (222, 4093), (206, 4197), (210, 4052), (208, 4029), (242, 4153), (207, 4183), (216, 4084), (229, 4128)]
         : compromised: 0.0499, honest: 0.0593
         : ubar stats = ['Node 0: s1=0.368, s2=0.651', 'Node 1: s1=0.368, s2=0.429', 'Node 2: s1=0.368, s2=0.524']...
Round 010: test acc mean=0.0530 ± 0.0047 | min=0.0432 max=0.0630
         : test loss mean=nan ± nan
         : individual accs = ['0.062984', '0.048775', '0.053418', '0.043157', '0.057932', '0.045253', '0.057477', '0.058174', '0.049630', '0.053776', '0.055998', '0.049606', '0.054239', '0.049083', '0.051826', '0.051626', '0.058271', '0.049486', '0.052889', '0.055475']
         : correct/total = [(260, 4128), (205, 4203), (218, 4081), (187, 4333), (237, 4091), (194, 4287), (241, 4193), (253, 4349), (208, 4191), (230, 4277), (232, 4143), (208, 4193), (222, 4093), (206, 4197), (210, 4052), (208, 4029), (242, 4153), (207, 4183), (216, 4084), (229, 4128)]
         : compromised: 0.0499, honest: 0.0575
         : ubar stats = ['Node 0: s1=0.368, s2=0.686', 'Node 1: s1=0.368, s2=0.400', 'Node 2: s1=0.368, s2=0.486']...

=== FINAL RESULTS ===
Dataset: femnist, Nodes: 20, Graph: fully, Aggregation: ubar
Attack: backdoor, 60.0% compromised
Final accuracy - Compromised: 0.0499, Honest: 0.0575
Overall test accuracy: mean=0.0530 ± 0.0047

=== BACKDOOR ATTACK SUCCESS RATE (ASR) ===
Target label: 0
Trigger size: 4x4
Overall ASR: 0.6000 ± 0.4899
Honest nodes ASR: 0.0000 ± 0.0000
Compromised nodes ASR: 1.0000 ± 0.0000
Note: Higher ASR indicates more successful backdoor attack

=== UBAR SUMMARY ===
Node 0: stage1=0.368, stage2=0.686, overall=0.253
Node 1: stage1=0.368, stage2=0.400, overall=0.147
Node 2: stage1=0.368, stage2=0.486, overall=0.179
Node 3: stage1=0.368, stage2=0.400, overall=0.147
Node 4: stage1=0.368, stage2=0.471, overall=0.174
Node 5: stage1=0.368, stage2=0.486, overall=0.179
Node 6: stage1=0.368, stage2=0.443, overall=0.163
Node 7: stage1=0.368, stage2=0.557, overall=0.205
Node 8: stage1=0.368, stage2=0.486, overall=0.179
Node 9: stage1=0.368, stage2=0.357, overall=0.132
Node 10: stage1=0.368, stage2=0.314, overall=0.116
Node 11: stage1=0.368, stage2=0.486, overall=0.179
Node 12: stage1=0.368, stage2=0.400, overall=0.147
Node 13: stage1=0.368, stage2=0.400, overall=0.147
Node 14: stage1=0.368, stage2=0.400, overall=0.147
Node 15: stage1=0.368, stage2=0.400, overall=0.147
Node 16: stage1=0.368, stage2=0.400, overall=0.147
Node 17: stage1=0.368, stage2=0.400, overall=0.147
Node 18: stage1=0.368, stage2=0.486, overall=0.179
Node 19: stage1=0.368, stage2=0.386, overall=0.142

=== PARALLEL EXECUTION TIME (realistic for distributed system) ===
  COMMUNICATION (max across nodes):
    - Full model transfer: 0.000s (0.0%)
  COMPUTATION (max across nodes):
    - Distance computation: 0.073s (1.8%)
    - Loss computation: 4.086s (98.0%)
    - Aggregation: 0.010s (0.2%)
  TOTALS:
    - Total computation: 4.169s (100.0%)
    - Total communication: 0.000s (0.0%)
    - Total parallel time: 4.169s

=== PER-NODE AVERAGE TIME ===
  - Distance computation: 0.068s
  - Loss computation: 3.867s
  - Aggregation: 0.007s
  - Model transfer: 0.000s
  - Total per node: 3.942s

=== TOTAL COMPUTATIONAL WORK (sum across all nodes) ===
  - Total distance computation: 1.369s
  - Total loss computation: 77.350s
  - Total aggregation: 0.131s
  - Total model transfer: 0.000s
  - Grand total: 78.849s
  - Mean Stage 1 acceptance rate: 0.368
  - Mean Stage 2 acceptance rate: 0.442
  - Overall acceptance rate: 0.163

UBAR Algorithm Properties:
  - Model dimension: 6,603,710
  - Rho parameter: 0.4
  - Two-stage approach: Distance filtering + loss evaluation
  - Stage 1 selects: 40% of neighbors
  - Stage 2 uses: Training sample loss comparison
  - Theoretical complexity: O(deg(i)×d + deg(i)×inference)
  - Approach: UBAR paper implementation
