Device: cuda
Seed: 987654321
Loading 36 LEAF FEMNIST train files...
LEAF FEMNIST train: 3597 users, 734463 samples
Loading 36 LEAF FEMNIST test files...
LEAF FEMNIST test: 3597 users, 83388 samples
Found 3597 train users, 3597 test users, 3597 common users
User sample counts range: 525 (max) to 17 (min)
Distributed ALL 3597 users across 20 clients
Users per client: 179 (with 17 clients getting +1 user)
Train partition sizes: [36360, 37070, 35957, 38262, 36024, 37732, 36921, 38328, 36867, 37683, 36507, 36915, 36007, 37001, 35681, 35453, 36585, 36801, 35964, 36345]
Test partition sizes: [4128, 4203, 4081, 4333, 4091, 4287, 4193, 4349, 4191, 4277, 4143, 4193, 4093, 4197, 4052, 4029, 4153, 4183, 4084, 4128]
  Client 0: 36360 train samples, 62 unique classes
  Client 1: 37070 train samples, 62 unique classes
  Client 2: 35957 train samples, 62 unique classes
  Client 3: 38262 train samples, 62 unique classes
  Client 4: 36024 train samples, 62 unique classes
  Client 5: 37732 train samples, 62 unique classes
  Client 6: 36921 train samples, 62 unique classes
  Client 7: 38328 train samples, 62 unique classes
  Client 8: 36867 train samples, 62 unique classes
  Client 9: 37683 train samples, 62 unique classes
  Client 10: 36507 train samples, 62 unique classes
  Client 11: 36915 train samples, 62 unique classes
  Client 12: 36007 train samples, 62 unique classes
  Client 13: 37001 train samples, 62 unique classes
  Client 14: 35681 train samples, 62 unique classes
  Client 15: 35453 train samples, 62 unique classes
  Client 16: 36585 train samples, 62 unique classes
  Client 17: 36801 train samples, 62 unique classes
  Client 18: 35964 train samples, 62 unique classes
  Client 19: 36345 train samples, 62 unique classes
Will sample 10000 samples per client per epoch
Graph: ring, nodes: 20, edges: 20
Degree statistics: avg=2.00, min=2, max=2
Attack: Compromised 10/20 nodes: [1, 2, 5, 11, 12, 13, 14, 15, 17, 18]
Attack type: backdoor, lambda: 1.0
Backdoor target label: 0, trigger size: 4
Model variant: baseline
Model parameters: 6,603,710
Initial test acc across nodes: mean=0.0168 ± 0.0139
Backdoor attack: Created poisoned datasets for 10 compromised nodes
Round 001: test acc mean=0.0514 ± 0.0893 | min=0.0027 max=0.4123
         : test loss mean=65619.8470 ± 101368.7141
         : individual accs = ['0.003391', '0.017606', '0.052928', '0.005539', '0.006355', '0.015162', '0.020510', '0.412279', '0.130756', '0.104045', '0.002655', '0.005008', '0.049353', '0.049321', '0.053307', '0.046910', '0.015892', '0.016017', '0.006366', '0.015019']
         : correct/total = [(14, 4128), (74, 4203), (216, 4081), (24, 4333), (26, 4091), (65, 4287), (86, 4193), (1793, 4349), (548, 4191), (445, 4277), (11, 4143), (21, 4193), (202, 4093), (207, 4197), (216, 4052), (189, 4029), (66, 4153), (67, 4183), (26, 4084), (62, 4128)]
         : compromised: 0.0312, honest: 0.0716
Round 002: test acc mean=0.0823 ± 0.1434 | min=0.0417 max=0.7072
         : test loss mean=nan ± nan
         : individual accs = ['0.047238', '0.048775', '0.047782', '0.047773', '0.044977', '0.057849', '0.043883', '0.045068', '0.707230', '0.044891', '0.051171', '0.041736', '0.054239', '0.049083', '0.051826', '0.056590', '0.058271', '0.050920', '0.048482', '0.048692']
         : correct/total = [(195, 4128), (205, 4203), (195, 4081), (207, 4333), (184, 4091), (248, 4287), (184, 4193), (196, 4349), (2964, 4191), (192, 4277), (212, 4143), (175, 4193), (222, 4093), (206, 4197), (210, 4052), (228, 4029), (242, 4153), (213, 4183), (198, 4084), (201, 4128)]
         : compromised: 0.0507, honest: 0.1139
Round 003: test acc mean=0.0504 ± 0.0036 | min=0.0449 max=0.0582
         : test loss mean=nan ± nan
         : individual accs = ['0.050145', '0.049726', '0.050723', '0.047773', '0.044977', '0.045253', '0.050799', '0.058174', '0.053209', '0.044891', '0.055998', '0.053899', '0.054239', '0.049083', '0.051826', '0.050881', '0.051047', '0.048530', '0.051665', '0.045058']
         : correct/total = [(207, 4128), (209, 4203), (207, 4081), (207, 4333), (184, 4091), (194, 4287), (213, 4193), (253, 4349), (223, 4191), (192, 4277), (232, 4143), (226, 4193), (222, 4093), (206, 4197), (210, 4052), (205, 4029), (212, 4153), (203, 4183), (211, 4084), (186, 4128)]
         : compromised: 0.0506, honest: 0.0502
Round 004: test acc mean=0.0504 ± 0.0039 | min=0.0408 max=0.0582
         : test loss mean=nan ± nan
         : individual accs = ['0.050145', '0.047109', '0.050723', '0.047773', '0.044977', '0.050618', '0.050799', '0.058174', '0.040802', '0.053776', '0.055998', '0.053899', '0.054239', '0.049083', '0.051826', '0.050633', '0.051288', '0.048291', '0.052155', '0.045058']
         : correct/total = [(207, 4128), (198, 4203), (207, 4081), (207, 4333), (184, 4091), (217, 4287), (213, 4193), (253, 4349), (171, 4191), (230, 4277), (232, 4143), (226, 4193), (222, 4093), (206, 4197), (210, 4052), (204, 4029), (213, 4153), (202, 4183), (213, 4084), (186, 4128)]
         : compromised: 0.0509, honest: 0.0499
Round 005: test acc mean=0.0509 ± 0.0044 | min=0.0407 max=0.0582
         : test loss mean=nan ± nan
         : individual accs = ['0.049176', '0.052344', '0.057584', '0.048465', '0.051088', '0.050618', '0.050799', '0.058174', '0.053209', '0.053776', '0.050447', '0.053899', '0.054239', '0.049083', '0.051826', '0.041698', '0.040693', '0.045900', '0.055583', '0.050388']
         : correct/total = [(203, 4128), (220, 4203), (235, 4081), (210, 4333), (209, 4091), (217, 4287), (213, 4193), (253, 4349), (223, 4191), (230, 4277), (209, 4143), (226, 4193), (222, 4093), (206, 4197), (210, 4052), (168, 4029), (169, 4153), (192, 4183), (227, 4084), (208, 4128)]
         : compromised: 0.0513, honest: 0.0506
Round 006: test acc mean=0.0504 ± 0.0047 | min=0.0430 max=0.0618
         : test loss mean=nan ± nan
         : individual accs = ['0.050145', '0.049726', '0.053418', '0.043157', '0.043021', '0.045253', '0.043883', '0.058174', '0.053209', '0.053776', '0.050447', '0.061770', '0.054239', '0.049083', '0.051826', '0.050881', '0.051047', '0.048291', '0.051665', '0.045058']
         : correct/total = [(207, 4128), (209, 4203), (218, 4081), (187, 4333), (176, 4091), (194, 4287), (184, 4193), (253, 4349), (223, 4191), (230, 4277), (209, 4143), (259, 4193), (222, 4093), (206, 4197), (210, 4052), (205, 4029), (212, 4153), (202, 4183), (211, 4084), (186, 4128)]
         : compromised: 0.0516, honest: 0.0492
Round 007: test acc mean=0.0512 ± 0.0051 | min=0.0430 max=0.0618
         : test loss mean=nan ± nan
         : individual accs = ['0.050145', '0.050916', '0.053418', '0.043157', '0.043021', '0.045253', '0.043883', '0.058174', '0.053209', '0.053776', '0.050447', '0.061770', '0.054239', '0.049083', '0.051826', '0.056590', '0.058271', '0.050920', '0.050196', '0.045058']
         : correct/total = [(207, 4128), (214, 4203), (218, 4081), (187, 4333), (176, 4091), (194, 4287), (184, 4193), (253, 4349), (223, 4191), (230, 4277), (209, 4143), (259, 4193), (222, 4093), (206, 4197), (210, 4052), (228, 4029), (242, 4153), (213, 4183), (205, 4084), (186, 4128)]
         : compromised: 0.0524, honest: 0.0499
Round 008: test acc mean=0.0497 ± 0.0040 | min=0.0430 max=0.0582
         : test loss mean=nan ± nan
         : individual accs = ['0.047238', '0.048775', '0.053418', '0.043157', '0.043021', '0.045253', '0.043883', '0.058174', '0.053209', '0.053776', '0.047550', '0.054376', '0.054239', '0.049083', '0.051826', '0.050881', '0.051047', '0.048291', '0.048482', '0.048692']
         : correct/total = [(195, 4128), (205, 4203), (218, 4081), (187, 4333), (176, 4091), (194, 4287), (184, 4193), (253, 4349), (223, 4191), (230, 4277), (197, 4143), (228, 4193), (222, 4093), (206, 4197), (210, 4052), (205, 4029), (212, 4153), (202, 4183), (198, 4084), (201, 4128)]
         : compromised: 0.0505, honest: 0.0490
Round 009: test acc mean=0.0499 ± 0.0040 | min=0.0430 max=0.0582
         : test loss mean=nan ± nan
         : individual accs = ['0.047238', '0.049726', '0.053418', '0.043157', '0.043021', '0.045253', '0.043883', '0.058174', '0.053209', '0.053776', '0.047550', '0.054376', '0.054239', '0.049083', '0.051826', '0.050881', '0.051047', '0.048291', '0.051665', '0.048692']
         : correct/total = [(195, 4128), (209, 4203), (218, 4081), (187, 4333), (176, 4091), (194, 4287), (184, 4193), (253, 4349), (223, 4191), (230, 4277), (197, 4143), (228, 4193), (222, 4093), (206, 4197), (210, 4052), (205, 4029), (212, 4153), (202, 4183), (211, 4084), (201, 4128)]
         : compromised: 0.0509, honest: 0.0490
Round 010: test acc mean=0.0498 ± 0.0040 | min=0.0430 max=0.0582
         : test loss mean=nan ± nan
         : individual accs = ['0.050145', '0.049726', '0.053418', '0.043157', '0.043021', '0.045253', '0.043883', '0.058174', '0.053209', '0.053776', '0.047550', '0.052230', '0.054239', '0.049083', '0.051826', '0.050881', '0.051047', '0.048291', '0.051665', '0.045058']
         : correct/total = [(207, 4128), (209, 4203), (218, 4081), (187, 4333), (176, 4091), (194, 4287), (184, 4193), (253, 4349), (223, 4191), (230, 4277), (197, 4143), (219, 4193), (222, 4093), (206, 4197), (210, 4052), (205, 4029), (212, 4153), (202, 4183), (211, 4084), (186, 4128)]
         : compromised: 0.0507, honest: 0.0489

=== FINAL RESULTS ===
Dataset: femnist, Nodes: 20, Graph: ring, Aggregation: krum
Attack: backdoor, 50.0% compromised
Final accuracy - Compromised: 0.0507, Honest: 0.0489
Overall test accuracy: mean=0.0498 ± 0.0040

=== BACKDOOR ATTACK SUCCESS RATE (ASR) ===
Target label: 0
Trigger size: 4x4
Overall ASR: 0.3976 ± 0.4871
Honest nodes ASR: 0.2000 ± 0.4000
Compromised nodes ASR: 0.5953 ± 0.4862
Note: Higher ASR indicates more successful backdoor attack
