Device: cuda
Seed: 987654321
Loading 36 LEAF FEMNIST train files...
LEAF FEMNIST train: 3597 users, 734463 samples
Loading 36 LEAF FEMNIST test files...
LEAF FEMNIST test: 3597 users, 83388 samples
Found 3597 train users, 3597 test users, 3597 common users
User sample counts range: 525 (max) to 17 (min)
Distributed ALL 3597 users across 20 clients
Users per client: 179 (with 17 clients getting +1 user)
Train partition sizes: [36360, 37070, 35957, 38262, 36024, 37732, 36921, 38328, 36867, 37683, 36507, 36915, 36007, 37001, 35681, 35453, 36585, 36801, 35964, 36345]
Test partition sizes: [4128, 4203, 4081, 4333, 4091, 4287, 4193, 4349, 4191, 4277, 4143, 4193, 4093, 4197, 4052, 4029, 4153, 4183, 4084, 4128]
  Client 0: 36360 train samples, 62 unique classes
  Client 1: 37070 train samples, 62 unique classes
  Client 2: 35957 train samples, 62 unique classes
  Client 3: 38262 train samples, 62 unique classes
  Client 4: 36024 train samples, 62 unique classes
  Client 5: 37732 train samples, 62 unique classes
  Client 6: 36921 train samples, 62 unique classes
  Client 7: 38328 train samples, 62 unique classes
  Client 8: 36867 train samples, 62 unique classes
  Client 9: 37683 train samples, 62 unique classes
  Client 10: 36507 train samples, 62 unique classes
  Client 11: 36915 train samples, 62 unique classes
  Client 12: 36007 train samples, 62 unique classes
  Client 13: 37001 train samples, 62 unique classes
  Client 14: 35681 train samples, 62 unique classes
  Client 15: 35453 train samples, 62 unique classes
  Client 16: 36585 train samples, 62 unique classes
  Client 17: 36801 train samples, 62 unique classes
  Client 18: 35964 train samples, 62 unique classes
  Client 19: 36345 train samples, 62 unique classes
Will sample 10000 samples per client per epoch
Graph: erdos, nodes: 20, edges: 99
Degree statistics: avg=9.90, min=7, max=14
Attack: Compromised 12/20 nodes: [1, 2, 3, 5, 8, 11, 12, 13, 14, 15, 17, 18]
Attack type: backdoor, lambda: 1.0
Backdoor target label: 0, trigger size: 4
Model variant: baseline
Model parameters: 6,603,710
Sketchguard Node 0:
  Model dim: 6,603,710 → Sketch size: 1000
  Compression ratio: 6603.7x
  Using model parameters for aggregation, sketches for filtering
Sketchguard Node 1:
  Model dim: 6,603,710 → Sketch size: 1000
  Compression ratio: 6603.7x
  Using model parameters for aggregation, sketches for filtering
Sketchguard Node 2:
  Model dim: 6,603,710 → Sketch size: 1000
  Compression ratio: 6603.7x
  Using model parameters for aggregation, sketches for filtering
Sketchguard Node 3:
  Model dim: 6,603,710 → Sketch size: 1000
  Compression ratio: 6603.7x
  Using model parameters for aggregation, sketches for filtering
Sketchguard Node 4:
  Model dim: 6,603,710 → Sketch size: 1000
  Compression ratio: 6603.7x
  Using model parameters for aggregation, sketches for filtering
Sketchguard Node 5:
  Model dim: 6,603,710 → Sketch size: 1000
  Compression ratio: 6603.7x
  Using model parameters for aggregation, sketches for filtering
Sketchguard Node 6:
  Model dim: 6,603,710 → Sketch size: 1000
  Compression ratio: 6603.7x
  Using model parameters for aggregation, sketches for filtering
Sketchguard Node 7:
  Model dim: 6,603,710 → Sketch size: 1000
  Compression ratio: 6603.7x
  Using model parameters for aggregation, sketches for filtering
Sketchguard Node 8:
  Model dim: 6,603,710 → Sketch size: 1000
  Compression ratio: 6603.7x
  Using model parameters for aggregation, sketches for filtering
Sketchguard Node 9:
  Model dim: 6,603,710 → Sketch size: 1000
  Compression ratio: 6603.7x
  Using model parameters for aggregation, sketches for filtering
Sketchguard Node 10:
  Model dim: 6,603,710 → Sketch size: 1000
  Compression ratio: 6603.7x
  Using model parameters for aggregation, sketches for filtering
Sketchguard Node 11:
  Model dim: 6,603,710 → Sketch size: 1000
  Compression ratio: 6603.7x
  Using model parameters for aggregation, sketches for filtering
Sketchguard Node 12:
  Model dim: 6,603,710 → Sketch size: 1000
  Compression ratio: 6603.7x
  Using model parameters for aggregation, sketches for filtering
Sketchguard Node 13:
  Model dim: 6,603,710 → Sketch size: 1000
  Compression ratio: 6603.7x
  Using model parameters for aggregation, sketches for filtering
Sketchguard Node 14:
  Model dim: 6,603,710 → Sketch size: 1000
  Compression ratio: 6603.7x
  Using model parameters for aggregation, sketches for filtering
Sketchguard Node 15:
  Model dim: 6,603,710 → Sketch size: 1000
  Compression ratio: 6603.7x
  Using model parameters for aggregation, sketches for filtering
Sketchguard Node 16:
  Model dim: 6,603,710 → Sketch size: 1000
  Compression ratio: 6603.7x
  Using model parameters for aggregation, sketches for filtering
Sketchguard Node 17:
  Model dim: 6,603,710 → Sketch size: 1000
  Compression ratio: 6603.7x
  Using model parameters for aggregation, sketches for filtering
Sketchguard Node 18:
  Model dim: 6,603,710 → Sketch size: 1000
  Compression ratio: 6603.7x
  Using model parameters for aggregation, sketches for filtering
Sketchguard Node 19:
  Model dim: 6,603,710 → Sketch size: 1000
  Compression ratio: 6603.7x
  Using model parameters for aggregation, sketches for filtering
Sketchguard ALGORITHM (Sketch-based Filtering + State Aggregation)
  - Model dimension: 6,603,710 parameters
  - Config: SketchguardConfig(gamma=2, kappa=1, alpha=0.5, min_neighbors=1, sketch_size=1000, network_seed=987654321, attack_detection_window=5)
  - Sketch size: 1000
  - Compression ratio: 6603.7x
  - Complexity: O(d + N×k) = O(6,603,710 + 20×1000)
  - Theoretical speedup vs BALANCE: 19.9x
Initial test acc across nodes: mean=0.0162 ± 0.0138
Backdoor attack: Created poisoned datasets for 12 compromised nodes
Round 001: test acc mean=0.2399 ± 0.1644 | min=0.0474 max=0.5104
         : test loss mean=10295.9922 ± 8750.2078
         : individual accs = ['0.510417', '0.048775', '0.194315', '0.057697', '0.441701', '0.174481', '0.424517', '0.406530', '0.097351', '0.413374', '0.396814', '0.147150', '0.047398', '0.047653', '0.168806', '0.065277', '0.444739', '0.179058', '0.110431', '0.421754']
         : correct/total = [(2107, 4128), (205, 4203), (793, 4081), (250, 4333), (1807, 4091), (748, 4287), (1780, 4193), (1768, 4349), (408, 4191), (1768, 4277), (1644, 4143), (617, 4193), (194, 4093), (200, 4197), (684, 4052), (263, 4029), (1847, 4153), (749, 4183), (451, 4084), (1741, 4128)]
         : compromised: 0.1115, honest: 0.4325
         : sketchguard stats = ['Node 0: acc_rate=0.417', 'Node 1: acc_rate=0.500', 'Node 2: acc_rate=0.500']...
Round 002: test acc mean=0.2934 ± 0.3051 | min=0.0250 max=0.7082
         : test loss mean=51466.8566 ± 194163.2491
         : individual accs = ['0.706153', '0.045206', '0.024994', '0.044773', '0.663652', '0.046186', '0.614357', '0.660612', '0.047244', '0.708207', '0.668839', '0.048653', '0.048131', '0.048368', '0.047878', '0.045172', '0.667469', '0.052116', '0.038932', '0.641715']
         : correct/total = [(2915, 4128), (190, 4203), (102, 4081), (194, 4333), (2715, 4091), (198, 4287), (2576, 4193), (2873, 4349), (198, 4191), (3029, 4277), (2771, 4143), (204, 4193), (197, 4093), (203, 4197), (194, 4052), (182, 4029), (2772, 4153), (218, 4183), (159, 4084), (2649, 4128)]
         : compromised: 0.0448, honest: 0.6664
         : sketchguard stats = ['Node 0: acc_rate=0.417', 'Node 1: acc_rate=0.750', 'Node 2: acc_rate=0.750']...
Round 003: test acc mean=0.3150 ± 0.3241 | min=0.0466 max=0.7253
         : test loss mean=nan ± nan
         : individual accs = ['0.725291', '0.048775', '0.049743', '0.046619', '0.703251', '0.052018', '0.717625', '0.695332', '0.051062', '0.716858', '0.709631', '0.048891', '0.047398', '0.047653', '0.054788', '0.054604', '0.720443', '0.049247', '0.054358', '0.707364']
         : correct/total = [(2994, 4128), (205, 4203), (203, 4081), (202, 4333), (2877, 4091), (223, 4287), (3009, 4193), (3024, 4349), (214, 4191), (3066, 4277), (2940, 4143), (205, 4193), (194, 4093), (200, 4197), (222, 4052), (220, 4029), (2992, 4153), (206, 4183), (222, 4084), (2920, 4128)]
         : compromised: 0.0504, honest: 0.7120
         : sketchguard stats = ['Node 0: acc_rate=0.417', 'Node 1: acc_rate=0.833', 'Node 2: acc_rate=0.833']...
Round 004: test acc mean=0.3342 ± 0.3477 | min=0.0466 max=0.7761
         : test loss mean=nan ± nan
         : individual accs = ['0.752665', '0.048775', '0.049743', '0.046619', '0.771450', '0.052484', '0.764846', '0.768453', '0.051062', '0.763386', '0.731837', '0.048891', '0.047398', '0.047653', '0.054788', '0.054604', '0.776065', '0.049247', '0.054358', '0.750484']
         : correct/total = [(3107, 4128), (205, 4203), (203, 4081), (202, 4333), (3156, 4091), (225, 4287), (3207, 4193), (3342, 4349), (214, 4191), (3265, 4277), (3032, 4143), (205, 4193), (194, 4093), (200, 4197), (222, 4052), (220, 4029), (3223, 4153), (206, 4183), (222, 4084), (3098, 4128)]
         : compromised: 0.0505, honest: 0.7599
         : sketchguard stats = ['Node 0: acc_rate=0.417', 'Node 1: acc_rate=0.625', 'Node 2: acc_rate=0.625']...
Round 005: test acc mean=0.3460 ± 0.3620 | min=0.0466 max=0.8042
         : test loss mean=nan ± nan
         : individual accs = ['0.775194', '0.048775', '0.049743', '0.046619', '0.781960', '0.052484', '0.787980', '0.799494', '0.051062', '0.795885', '0.774318', '0.048891', '0.047398', '0.047653', '0.054788', '0.054604', '0.804238', '0.049247', '0.054358', '0.795543']
         : correct/total = [(3200, 4128), (205, 4203), (203, 4081), (202, 4333), (3199, 4091), (225, 4287), (3304, 4193), (3477, 4349), (214, 4191), (3404, 4277), (3208, 4143), (205, 4193), (194, 4093), (200, 4197), (222, 4052), (220, 4029), (3340, 4153), (206, 4183), (222, 4084), (3284, 4128)]
         : compromised: 0.0505, honest: 0.7893
         : sketchguard stats = ['Node 0: acc_rate=0.417', 'Node 1: acc_rate=0.500', 'Node 2: acc_rate=0.500']...
Round 006: test acc mean=0.3547 ± 0.3727 | min=0.0466 max=0.8240
         : test loss mean=nan ± nan
         : individual accs = ['0.801841', '0.048775', '0.049743', '0.046619', '0.806160', '0.052484', '0.810637', '0.820878', '0.051062', '0.812252', '0.802559', '0.048891', '0.047398', '0.047653', '0.054788', '0.054604', '0.823983', '0.049247', '0.054358', '0.810320']
         : correct/total = [(3310, 4128), (205, 4203), (203, 4081), (202, 4333), (3298, 4091), (225, 4287), (3399, 4193), (3570, 4349), (214, 4191), (3474, 4277), (3325, 4143), (205, 4193), (194, 4093), (200, 4197), (222, 4052), (220, 4029), (3422, 4153), (206, 4183), (222, 4084), (3345, 4128)]
         : compromised: 0.0505, honest: 0.8111
         : sketchguard stats = ['Node 0: acc_rate=0.417', 'Node 1: acc_rate=0.417', 'Node 2: acc_rate=0.417']...
Round 007: test acc mean=0.3605 ± 0.3797 | min=0.0466 max=0.8361
         : test loss mean=nan ± nan
         : individual accs = ['0.819525', '0.048775', '0.049743', '0.046619', '0.818137', '0.052484', '0.828762', '0.836054', '0.051062', '0.831190', '0.815834', '0.048891', '0.047398', '0.047653', '0.054788', '0.054604', '0.832170', '0.049247', '0.054358', '0.821948']
         : correct/total = [(3383, 4128), (205, 4203), (203, 4081), (202, 4333), (3347, 4091), (225, 4287), (3475, 4193), (3636, 4349), (214, 4191), (3555, 4277), (3380, 4143), (205, 4193), (194, 4093), (200, 4197), (222, 4052), (220, 4029), (3456, 4153), (206, 4183), (222, 4084), (3393, 4128)]
         : compromised: 0.0505, honest: 0.8255
         : sketchguard stats = ['Node 0: acc_rate=0.417', 'Node 1: acc_rate=0.357', 'Node 2: acc_rate=0.357']...
Round 008: test acc mean=0.3620 ± 0.3816 | min=0.0466 max=0.8393
         : test loss mean=nan ± nan
         : individual accs = ['0.827035', '0.048775', '0.049743', '0.046619', '0.826448', '0.052484', '0.839256', '0.839273', '0.051062', '0.837737', '0.821868', '0.048891', '0.047398', '0.047653', '0.054788', '0.054604', '0.828558', '0.049247', '0.054358', '0.813711']
         : correct/total = [(3414, 4128), (205, 4203), (203, 4081), (202, 4333), (3381, 4091), (225, 4287), (3519, 4193), (3650, 4349), (214, 4191), (3583, 4277), (3405, 4143), (205, 4193), (194, 4093), (200, 4197), (222, 4052), (220, 4029), (3441, 4153), (206, 4183), (222, 4084), (3359, 4128)]
         : compromised: 0.0505, honest: 0.8292
         : sketchguard stats = ['Node 0: acc_rate=0.417', 'Node 1: acc_rate=0.312', 'Node 2: acc_rate=0.312']...
Round 009: test acc mean=0.3659 ± 0.3864 | min=0.0466 max=0.8478
         : test loss mean=nan ± nan
         : individual accs = ['0.834060', '0.048775', '0.049743', '0.046619', '0.830604', '0.052484', '0.847842', '0.846172', '0.051062', '0.847791', '0.837075', '0.048891', '0.047398', '0.047653', '0.054788', '0.054604', '0.832410', '0.049247', '0.054358', '0.836725']
         : correct/total = [(3443, 4128), (205, 4203), (203, 4081), (202, 4333), (3398, 4091), (225, 4287), (3555, 4193), (3680, 4349), (214, 4191), (3626, 4277), (3468, 4143), (205, 4193), (194, 4093), (200, 4197), (222, 4052), (220, 4029), (3457, 4153), (206, 4183), (222, 4084), (3454, 4128)]
         : compromised: 0.0505, honest: 0.8391
         : sketchguard stats = ['Node 0: acc_rate=0.417', 'Node 1: acc_rate=0.278', 'Node 2: acc_rate=0.278']...
Round 010: test acc mean=0.3681 ± 0.3890 | min=0.0466 max=0.8517
         : test loss mean=nan ± nan
         : individual accs = ['0.843023', '0.048775', '0.049743', '0.046619', '0.838426', '0.052484', '0.851658', '0.851690', '0.051062', '0.848726', '0.836592', '0.048891', '0.047398', '0.047653', '0.054788', '0.054604', '0.841801', '0.049247', '0.054358', '0.843508']
         : correct/total = [(3480, 4128), (205, 4203), (203, 4081), (202, 4333), (3430, 4091), (225, 4287), (3571, 4193), (3704, 4349), (214, 4191), (3630, 4277), (3466, 4143), (205, 4193), (194, 4093), (200, 4197), (222, 4052), (220, 4029), (3496, 4153), (206, 4183), (222, 4084), (3482, 4128)]
         : compromised: 0.0505, honest: 0.8444
         : sketchguard stats = ['Node 0: acc_rate=0.417', 'Node 1: acc_rate=0.250', 'Node 2: acc_rate=0.250']...

=== FINAL RESULTS ===
Dataset: femnist, Nodes: 20, Graph: erdos, Aggregation: sketchguard
Attack: backdoor, 60.0% compromised
Final accuracy - Compromised: 0.0505, Honest: 0.8444
Overall test accuracy: mean=0.3681 ± 0.3890

=== BACKDOOR ATTACK SUCCESS RATE (ASR) ===
Target label: 0
Trigger size: 4x4
Overall ASR: 0.6207 ± 0.4645
Honest nodes ASR: 0.0519 ± 0.0042
Compromised nodes ASR: 1.0000 ± 0.0000
Note: Higher ASR indicates more successful backdoor attack

=== Sketchguard SUMMARY ===
Node 0: acceptance=0.417
Node 1: acceptance=0.250
Node 2: acceptance=0.250
Node 3: acceptance=0.257
Node 4: acceptance=0.333
Node 5: acceptance=0.240
Node 6: acceptance=0.333
Node 7: acceptance=0.273
Node 8: acceptance=0.229
Node 9: acceptance=0.545
Node 10: acceptance=0.500
Node 11: acceptance=0.233
Node 12: acceptance=0.250
Node 13: acceptance=0.233
Node 14: acceptance=0.236
Node 15: acceptance=0.244
Node 16: acceptance=0.286
Node 17: acceptance=0.263
Node 18: acceptance=0.233
Node 19: acceptance=0.300

=== PARALLEL EXECUTION TIME (realistic for distributed system) ===
  COMMUNICATION (max across nodes):
    - Sketch transfer: 0.000s (0.0%)
    - Model fetch (accepted): 0.000s (0.0%)
  COMPUTATION (max across nodes):
    - Sketching: 2.524s (99.2%)
    - Filtering: 0.001s (0.1%)
    - Aggregation: 0.018s (0.7%)
  TOTALS:
    - Total computation: 2.543s (100.0%)
    - Total communication: 0.000s (0.0%)
    - Total parallel time: 2.543s

=== PER-NODE AVERAGE TIME ===
  - Sketching: 1.886s
  - Filtering: 0.001s
  - Aggregation: 0.013s
  - Sketch transfer: 0.000s
  - Model fetch: 0.000s
  - Total per node: 1.900s

=== TOTAL COMPUTATIONAL WORK (sum across all nodes) ===
  - Total sketching: 37.730s
  - Total filtering: 0.017s
  - Total aggregation: 0.254s
  - Total sketch transfer: 0.000s
  - Total model fetch: 0.000s
  - Grand total: 38.001s
  - Mean acceptance rate: 0.295

Sketchguard Algorithm Properties:
  - Original dimension: 6,603,710
  - Sketch size: 1000
  - Compression ratio: 19.9x
  - Single repetition: No repetitions needed
  - Theoretical complexity: O(d + N×k)
  - Approach: Sketch filtering + state aggregation
