Device: cuda
Seed: 987654321
Loading 36 LEAF FEMNIST train files...
LEAF FEMNIST train: 3597 users, 734463 samples
Loading 36 LEAF FEMNIST test files...
LEAF FEMNIST test: 3597 users, 83388 samples
Found 3597 train users, 3597 test users, 3597 common users
User sample counts range: 525 (max) to 17 (min)
Distributed ALL 3597 users across 20 clients
Users per client: 179 (with 17 clients getting +1 user)
Train partition sizes: [36360, 37070, 35957, 38262, 36024, 37732, 36921, 38328, 36867, 37683, 36507, 36915, 36007, 37001, 35681, 35453, 36585, 36801, 35964, 36345]
Test partition sizes: [4128, 4203, 4081, 4333, 4091, 4287, 4193, 4349, 4191, 4277, 4143, 4193, 4093, 4197, 4052, 4029, 4153, 4183, 4084, 4128]
  Client 0: 36360 train samples, 62 unique classes
  Client 1: 37070 train samples, 62 unique classes
  Client 2: 35957 train samples, 62 unique classes
  Client 3: 38262 train samples, 62 unique classes
  Client 4: 36024 train samples, 62 unique classes
  Client 5: 37732 train samples, 62 unique classes
  Client 6: 36921 train samples, 62 unique classes
  Client 7: 38328 train samples, 62 unique classes
  Client 8: 36867 train samples, 62 unique classes
  Client 9: 37683 train samples, 62 unique classes
  Client 10: 36507 train samples, 62 unique classes
  Client 11: 36915 train samples, 62 unique classes
  Client 12: 36007 train samples, 62 unique classes
  Client 13: 37001 train samples, 62 unique classes
  Client 14: 35681 train samples, 62 unique classes
  Client 15: 35453 train samples, 62 unique classes
  Client 16: 36585 train samples, 62 unique classes
  Client 17: 36801 train samples, 62 unique classes
  Client 18: 35964 train samples, 62 unique classes
  Client 19: 36345 train samples, 62 unique classes
Will sample 4500 samples per client per epoch
Graph: erdos, nodes: 20, edges: 99
Degree statistics: avg=9.90, min=7, max=14
Attack: Compromised 10/20 nodes: [1, 2, 5, 11, 12, 13, 14, 15, 17, 18]
Attack type: backdoor, lambda: 1.0
Backdoor target label: 0, trigger size: 4
Model variant: baseline
Model parameters: 6,603,710
Initial test acc across nodes: mean=0.0168 ± 0.0139
Backdoor attack: Created poisoned datasets for 10 compromised nodes
Round 001: test acc mean=0.0194 ± 0.0175 | min=0.0028 max=0.0636
         : test loss mean=26946.2242 ± 17629.7123
         : individual accs = ['0.007267', '0.024030', '0.010782', '0.005770', '0.013200', '0.002799', '0.005962', '0.036560', '0.014794', '0.008183', '0.047309', '0.039113', '0.048864', '0.002859', '0.010612', '0.004468', '0.063569', '0.015061', '0.006611', '0.019864']
         : correct/total = [(30, 4128), (101, 4203), (44, 4081), (25, 4333), (54, 4091), (12, 4287), (25, 4193), (159, 4349), (62, 4191), (35, 4277), (196, 4143), (164, 4193), (200, 4093), (12, 4197), (43, 4052), (18, 4029), (264, 4153), (63, 4183), (27, 4084), (82, 4128)]
         : compromised: 0.0165, honest: 0.0222
Round 002: test acc mean=0.0479 ± 0.0045 | min=0.0356 max=0.0549
         : test loss mean=23964837.7076 ± 72739222.7853
         : individual accs = ['0.044574', '0.050202', '0.050723', '0.043388', '0.051088', '0.045253', '0.046745', '0.035640', '0.054880', '0.048398', '0.045619', '0.053184', '0.050574', '0.046462', '0.046397', '0.050633', '0.040693', '0.050203', '0.052889', '0.050872']
         : correct/total = [(184, 4128), (211, 4203), (207, 4081), (188, 4333), (209, 4091), (194, 4287), (196, 4193), (155, 4349), (230, 4191), (207, 4277), (189, 4143), (223, 4193), (207, 4093), (195, 4197), (188, 4052), (204, 4029), (169, 4153), (210, 4183), (216, 4084), (210, 4128)]
         : compromised: 0.0497, honest: 0.0462
Round 003: test acc mean=0.0487 ± 0.0033 | min=0.0434 max=0.0549
         : test loss mean=3705.1704 ± 3607.9940
         : individual accs = ['0.044574', '0.046158', '0.052683', '0.043388', '0.052554', '0.043387', '0.044598', '0.049207', '0.054880', '0.050503', '0.045619', '0.046983', '0.045688', '0.049083', '0.050346', '0.051378', '0.049362', '0.051159', '0.051665', '0.050872']
         : correct/total = [(184, 4128), (194, 4203), (215, 4081), (188, 4333), (215, 4091), (186, 4287), (187, 4193), (214, 4349), (230, 4191), (216, 4277), (189, 4143), (197, 4193), (187, 4093), (206, 4197), (204, 4052), (207, 4029), (205, 4153), (214, 4183), (211, 4084), (210, 4128)]
         : compromised: 0.0489, honest: 0.0486
Round 004: test acc mean=0.0478 ± 0.0039 | min=0.0374 max=0.0549
         : test loss mean=2403.9370 ± 1271.2691
         : individual accs = ['0.044574', '0.046158', '0.048272', '0.048234', '0.045710', '0.043387', '0.046745', '0.047827', '0.054880', '0.050503', '0.041999', '0.049606', '0.045688', '0.037408', '0.050346', '0.051378', '0.049362', '0.051159', '0.050930', '0.050872']
         : correct/total = [(184, 4128), (194, 4203), (197, 4081), (209, 4333), (187, 4091), (186, 4287), (196, 4193), (208, 4349), (230, 4191), (216, 4277), (174, 4143), (208, 4193), (187, 4093), (157, 4197), (204, 4052), (207, 4029), (205, 4153), (214, 4183), (208, 4084), (210, 4128)]
         : compromised: 0.0474, honest: 0.0481
Round 005: test acc mean=0.0444 ± 0.0123 | min=0.0065 max=0.0549
         : test loss mean=215.0105 ± 173.2253
         : individual accs = ['0.044574', '0.046158', '0.048272', '0.048234', '0.045710', '0.043387', '0.046745', '0.047827', '0.054880', '0.006547', '0.010620', '0.049606', '0.045688', '0.046462', '0.050346', '0.051378', '0.049362', '0.051159', '0.050930', '0.050872']
         : correct/total = [(184, 4128), (194, 4203), (197, 4081), (209, 4333), (187, 4091), (186, 4287), (196, 4193), (208, 4349), (230, 4191), (28, 4277), (44, 4143), (208, 4193), (187, 4093), (195, 4197), (204, 4052), (207, 4029), (205, 4153), (214, 4183), (208, 4084), (210, 4128)]
         : compromised: 0.0483, honest: 0.0405
Round 006: test acc mean=0.0078 ± 0.0013 | min=0.0054 max=0.0097
         : test loss mean=4.2742 ± 0.0451
         : individual accs = ['0.008721', '0.008089', '0.009311', '0.008539', '0.007578', '0.005598', '0.006439', '0.007358', '0.006681', '0.006547', '0.007000', '0.008586', '0.009528', '0.009292', '0.005429', '0.009680', '0.007705', '0.007172', '0.006856', '0.009448']
         : correct/total = [(36, 4128), (34, 4203), (38, 4081), (37, 4333), (31, 4091), (24, 4287), (27, 4193), (32, 4349), (28, 4191), (28, 4277), (29, 4143), (36, 4193), (39, 4093), (39, 4197), (22, 4052), (39, 4029), (32, 4153), (30, 4183), (28, 4084), (39, 4128)]
         : compromised: 0.0080, honest: 0.0076
Round 007: test acc mean=0.0078 ± 0.0013 | min=0.0054 max=0.0097
         : test loss mean=4.2500 ± 0.0479
         : individual accs = ['0.008721', '0.008089', '0.009311', '0.008539', '0.007578', '0.005598', '0.006439', '0.007358', '0.006681', '0.006547', '0.007000', '0.008586', '0.009528', '0.009292', '0.005429', '0.009680', '0.007705', '0.007172', '0.006856', '0.009448']
         : correct/total = [(36, 4128), (34, 4203), (38, 4081), (37, 4333), (31, 4091), (24, 4287), (27, 4193), (32, 4349), (28, 4191), (28, 4277), (29, 4143), (36, 4193), (39, 4093), (39, 4197), (22, 4052), (39, 4029), (32, 4153), (30, 4183), (28, 4084), (39, 4128)]
         : compromised: 0.0080, honest: 0.0076
Round 008: test acc mean=0.0078 ± 0.0013 | min=0.0054 max=0.0097
         : test loss mean=4.1480 ± 0.0078
         : individual accs = ['0.008721', '0.008089', '0.009311', '0.008539', '0.007578', '0.005598', '0.006439', '0.007358', '0.006681', '0.006547', '0.007000', '0.008586', '0.009528', '0.009292', '0.005429', '0.009680', '0.007705', '0.007172', '0.006856', '0.009448']
         : correct/total = [(36, 4128), (34, 4203), (38, 4081), (37, 4333), (31, 4091), (24, 4287), (27, 4193), (32, 4349), (28, 4191), (28, 4277), (29, 4143), (36, 4193), (39, 4093), (39, 4197), (22, 4052), (39, 4029), (32, 4153), (30, 4183), (28, 4084), (39, 4128)]
         : compromised: 0.0080, honest: 0.0076
Round 009: test acc mean=0.0078 ± 0.0013 | min=0.0054 max=0.0097
         : test loss mean=4.1553 ± 0.0778
         : individual accs = ['0.008721', '0.008089', '0.009311', '0.008539', '0.007578', '0.005598', '0.006439', '0.007358', '0.006681', '0.006547', '0.007000', '0.008586', '0.009528', '0.009292', '0.005429', '0.009680', '0.007705', '0.007172', '0.006856', '0.009448']
         : correct/total = [(36, 4128), (34, 4203), (38, 4081), (37, 4333), (31, 4091), (24, 4287), (27, 4193), (32, 4349), (28, 4191), (28, 4277), (29, 4143), (36, 4193), (39, 4093), (39, 4197), (22, 4052), (39, 4029), (32, 4153), (30, 4183), (28, 4084), (39, 4128)]
         : compromised: 0.0080, honest: 0.0076
Round 010: test acc mean=0.0078 ± 0.0013 | min=0.0054 max=0.0097
         : test loss mean=4.0964 ± 0.0078
         : individual accs = ['0.008721', '0.008089', '0.009311', '0.008539', '0.007578', '0.005598', '0.006439', '0.007358', '0.006681', '0.006547', '0.007000', '0.008586', '0.009528', '0.009292', '0.005429', '0.009680', '0.007705', '0.007172', '0.006856', '0.009448']
         : correct/total = [(36, 4128), (34, 4203), (38, 4081), (37, 4333), (31, 4091), (24, 4287), (27, 4193), (32, 4349), (28, 4191), (28, 4277), (29, 4143), (36, 4193), (39, 4093), (39, 4197), (22, 4052), (39, 4029), (32, 4153), (30, 4183), (28, 4084), (39, 4128)]
         : compromised: 0.0080, honest: 0.0076

=== FINAL RESULTS ===
Dataset: femnist, Nodes: 20, Graph: erdos, Aggregation: krum
Attack: backdoor, 50.0% compromised
Final accuracy - Compromised: 0.0080, Honest: 0.0076
Overall test accuracy: mean=0.0078 ± 0.0013

=== BACKDOOR ATTACK SUCCESS RATE (ASR) ===
Target label: 0
Trigger size: 4x4
Overall ASR: 0.0000 ± 0.0000
Honest nodes ASR: 0.0000 ± 0.0000
Compromised nodes ASR: 0.0000 ± 0.0000
Note: Higher ASR indicates more successful backdoor attack
