Device: cuda
Seed: 987654321
Loading 36 LEAF FEMNIST train files...
LEAF FEMNIST train: 3597 users, 734463 samples
Loading 36 LEAF FEMNIST test files...
LEAF FEMNIST test: 3597 users, 83388 samples
Found 3597 train users, 3597 test users, 3597 common users
User sample counts range: 525 (max) to 17 (min)
Distributed ALL 3597 users across 20 clients
Users per client: 179 (with 17 clients getting +1 user)
Train partition sizes: [36360, 37070, 35957, 38262, 36024, 37732, 36921, 38328, 36867, 37683, 36507, 36915, 36007, 37001, 35681, 35453, 36585, 36801, 35964, 36345]
Test partition sizes: [4128, 4203, 4081, 4333, 4091, 4287, 4193, 4349, 4191, 4277, 4143, 4193, 4093, 4197, 4052, 4029, 4153, 4183, 4084, 4128]
  Client 0: 36360 train samples, 62 unique classes
  Client 1: 37070 train samples, 62 unique classes
  Client 2: 35957 train samples, 62 unique classes
  Client 3: 38262 train samples, 62 unique classes
  Client 4: 36024 train samples, 62 unique classes
  Client 5: 37732 train samples, 62 unique classes
  Client 6: 36921 train samples, 62 unique classes
  Client 7: 38328 train samples, 62 unique classes
  Client 8: 36867 train samples, 62 unique classes
  Client 9: 37683 train samples, 62 unique classes
  Client 10: 36507 train samples, 62 unique classes
  Client 11: 36915 train samples, 62 unique classes
  Client 12: 36007 train samples, 62 unique classes
  Client 13: 37001 train samples, 62 unique classes
  Client 14: 35681 train samples, 62 unique classes
  Client 15: 35453 train samples, 62 unique classes
  Client 16: 36585 train samples, 62 unique classes
  Client 17: 36801 train samples, 62 unique classes
  Client 18: 35964 train samples, 62 unique classes
  Client 19: 36345 train samples, 62 unique classes
Will sample 4500 samples per client per epoch
Graph: erdos, nodes: 20, edges: 48
Degree statistics: avg=4.80, min=2, max=7
Attack: Compromised 8/20 nodes: [1, 5, 11, 12, 13, 14, 17, 18]
Attack type: gaussian, lambda: 1.0
Model variant: baseline
Model parameters: 6,603,710
BALANCE algorithm:
Balance Config: BALANCEConfig(gamma=2, kappa=1, alpha=0.5, min_neighbors=1)
  - Model dimension: 6,603,710 parameters
  - Complexity: O(N×d) = O(20×6,603,710)
Initial test acc across nodes: mean=0.0168 ± 0.0139
Round 001: test acc mean=0.0540 ± 0.0044 | min=0.0466 max=0.0658
         : test loss mean=4.0217 ± 0.0241
         : individual accs = ['0.059593', '0.051630', '0.056849', '0.046619', '0.058910', '0.052484', '0.057000', '0.051276', '0.053209', '0.053776', '0.050447', '0.053899', '0.050818', '0.065761', '0.048124', '0.050633', '0.058271', '0.050920', '0.055583', '0.054990']
         : correct/total = [(246, 4128), (217, 4203), (232, 4081), (202, 4333), (241, 4091), (225, 4287), (239, 4193), (223, 4349), (223, 4191), (230, 4277), (209, 4143), (226, 4193), (208, 4093), (276, 4197), (195, 4052), (204, 4029), (242, 4153), (213, 4183), (227, 4084), (227, 4128)]
         : compromised: 0.0537, honest: 0.0543
Round 002: test acc mean=0.0541 ± 0.0032 | min=0.0494 max=0.0603
         : test loss mean=3.8343 ± 0.0817
         : individual accs = ['0.059593', '0.051630', '0.055134', '0.052850', '0.057932', '0.050618', '0.057000', '0.058174', '0.053209', '0.053776', '0.055998', '0.053899', '0.054239', '0.060281', '0.051579', '0.050633', '0.049362', '0.050920', '0.055583', '0.050388']
         : correct/total = [(246, 4128), (217, 4203), (225, 4081), (229, 4333), (237, 4091), (217, 4287), (239, 4193), (253, 4349), (223, 4191), (230, 4277), (232, 4143), (226, 4193), (222, 4093), (253, 4197), (209, 4052), (204, 4029), (205, 4153), (213, 4183), (227, 4084), (208, 4128)]
         : compromised: 0.0536, honest: 0.0545
Round 003: test acc mean=0.0548 ± 0.0035 | min=0.0481 max=0.0612
         : test loss mean=3.7483 ± 0.0499
         : individual accs = ['0.059593', '0.051630', '0.057584', '0.048234', '0.056221', '0.048052', '0.057000', '0.051276', '0.053209', '0.055413', '0.055274', '0.053899', '0.058637', '0.055278', '0.061204', '0.056342', '0.058271', '0.050920', '0.052889', '0.055475']
         : correct/total = [(246, 4128), (217, 4203), (235, 4081), (209, 4333), (230, 4091), (206, 4287), (239, 4193), (223, 4349), (223, 4191), (237, 4277), (229, 4143), (226, 4193), (240, 4093), (232, 4197), (248, 4052), (227, 4029), (242, 4153), (213, 4183), (216, 4084), (229, 4128)]
         : compromised: 0.0541, honest: 0.0553
Round 004: test acc mean=0.0553 ± 0.0044 | min=0.0451 max=0.0624
         : test loss mean=3.7134 ± 0.0258
         : individual accs = ['0.059593', '0.052344', '0.057584', '0.048465', '0.057932', '0.050618', '0.057000', '0.058174', '0.053209', '0.053075', '0.058653', '0.053899', '0.058637', '0.062426', '0.061204', '0.056590', '0.058271', '0.050920', '0.052889', '0.045058']
         : correct/total = [(246, 4128), (220, 4203), (235, 4081), (210, 4333), (237, 4091), (217, 4287), (239, 4193), (253, 4349), (223, 4191), (227, 4277), (243, 4143), (226, 4193), (240, 4093), (262, 4197), (248, 4052), (228, 4029), (242, 4153), (213, 4183), (216, 4084), (186, 4128)]
         : compromised: 0.0554, honest: 0.0553
Round 005: test acc mean=0.0528 ± 0.0046 | min=0.0434 max=0.0596
         : test loss mean=3.6989 ± 0.0186
         : individual accs = ['0.059593', '0.052344', '0.057584', '0.052850', '0.045710', '0.043387', '0.057000', '0.047827', '0.051062', '0.053776', '0.055998', '0.046983', '0.058637', '0.046938', '0.051579', '0.054852', '0.058271', '0.050920', '0.055583', '0.055475']
         : correct/total = [(246, 4128), (220, 4203), (235, 4081), (229, 4333), (187, 4091), (186, 4287), (239, 4193), (208, 4349), (214, 4191), (230, 4277), (232, 4143), (197, 4193), (240, 4093), (197, 4197), (209, 4052), (221, 4029), (242, 4153), (213, 4183), (227, 4084), (229, 4128)]
         : compromised: 0.0508, honest: 0.0542
Round 006: test acc mean=0.0541 ± 0.0044 | min=0.0434 max=0.0624
         : test loss mean=3.6896 ± 0.0153
         : individual accs = ['0.058382', '0.052344', '0.057584', '0.052850', '0.051088', '0.043387', '0.057000', '0.055875', '0.049630', '0.053776', '0.050447', '0.053899', '0.058637', '0.062426', '0.061204', '0.051378', '0.049362', '0.050920', '0.055583', '0.055475']
         : correct/total = [(241, 4128), (220, 4203), (235, 4081), (229, 4333), (209, 4091), (186, 4287), (239, 4193), (243, 4349), (208, 4191), (230, 4277), (209, 4143), (226, 4193), (240, 4093), (262, 4197), (248, 4052), (207, 4029), (205, 4153), (213, 4183), (227, 4084), (229, 4128)]
         : compromised: 0.0548, honest: 0.0536
Round 007: test acc mean=0.0549 ± 0.0037 | min=0.0474 max=0.0624
         : test loss mean=3.6871 ± 0.0142
         : individual accs = ['0.059593', '0.052344', '0.057584', '0.056081', '0.047421', '0.050618', '0.048891', '0.058174', '0.053209', '0.054010', '0.055998', '0.053899', '0.058637', '0.062426', '0.051826', '0.056590', '0.058512', '0.050920', '0.055583', '0.055475']
         : correct/total = [(246, 4128), (220, 4203), (235, 4081), (243, 4333), (194, 4091), (217, 4287), (205, 4193), (253, 4349), (223, 4191), (231, 4277), (232, 4143), (226, 4193), (240, 4093), (262, 4197), (210, 4052), (228, 4029), (243, 4153), (213, 4183), (227, 4084), (229, 4128)]
         : compromised: 0.0545, honest: 0.0551
Round 008: test acc mean=0.0575 ± 0.0121 | min=0.0430 max=0.0930
         : test loss mean=3.6858 ± 0.0148
         : individual accs = ['0.051599', '0.051630', '0.050723', '0.052850', '0.043021', '0.048052', '0.057000', '0.051276', '0.051062', '0.085808', '0.065653', '0.053899', '0.066699', '0.062426', '0.048124', '0.056342', '0.055141', '0.050920', '0.055583', '0.093023']
         : correct/total = [(213, 4128), (217, 4203), (207, 4081), (229, 4333), (176, 4091), (206, 4287), (239, 4193), (223, 4349), (214, 4191), (367, 4277), (272, 4143), (226, 4193), (273, 4093), (262, 4197), (195, 4052), (227, 4029), (229, 4153), (213, 4183), (227, 4084), (384, 4128)]
         : compromised: 0.0547, honest: 0.0595
Round 009: test acc mean=0.0530 ± 0.0042 | min=0.0439 max=0.0624
         : test loss mean=3.6830 ± 0.0156
         : individual accs = ['0.050145', '0.050916', '0.057584', '0.052850', '0.044977', '0.050618', '0.050799', '0.043918', '0.053209', '0.053776', '0.055998', '0.053899', '0.058637', '0.062426', '0.051826', '0.056342', '0.052011', '0.050920', '0.052889', '0.055475']
         : correct/total = [(207, 4128), (214, 4203), (235, 4081), (229, 4333), (184, 4091), (217, 4287), (213, 4193), (191, 4349), (223, 4191), (230, 4277), (232, 4143), (226, 4193), (240, 4093), (262, 4197), (210, 4052), (227, 4029), (216, 4153), (213, 4183), (216, 4084), (229, 4128)]
         : compromised: 0.0540, honest: 0.0523
Round 010: test acc mean=0.0570 ± 0.0084 | min=0.0480 max=0.0900
         : test loss mean=3.6818 ± 0.0157
         : individual accs = ['0.051599', '0.052344', '0.057584', '0.052850', '0.057932', '0.090040', '0.049130', '0.058404', '0.047960', '0.053776', '0.055998', '0.053899', '0.058637', '0.062426', '0.061204', '0.056342', '0.058271', '0.050920', '0.056072', '0.055475']
         : correct/total = [(213, 4128), (220, 4203), (235, 4081), (229, 4333), (237, 4091), (386, 4287), (206, 4193), (254, 4349), (201, 4191), (230, 4277), (232, 4143), (226, 4193), (240, 4093), (262, 4197), (248, 4052), (227, 4029), (242, 4153), (213, 4183), (229, 4084), (229, 4128)]
         : compromised: 0.0607, honest: 0.0546

=== FINAL RESULTS ===
Dataset: femnist, Nodes: 20, Graph: erdos, Aggregation: balance
Attack: gaussian, 40.0% compromised
Final accuracy - Compromised: 0.0607, Honest: 0.0546
Overall test accuracy: mean=0.0570 ± 0.0084

=== BALANCE SUMMARY ===
Node 0: acceptance=0.833
Node 1: acceptance=0.667
Node 2: acceptance=0.400
Node 3: acceptance=0.500
Node 4: acceptance=0.250
Node 5: acceptance=0.200
Node 6: acceptance=0.600
Node 7: acceptance=0.600
Node 8: acceptance=0.500
Node 9: acceptance=0.667
Node 10: acceptance=0.500
Node 11: acceptance=0.429
Node 12: acceptance=0.714
Node 13: acceptance=0.500
Node 14: acceptance=0.429
Node 15: acceptance=0.333
Node 16: acceptance=0.200
Node 17: acceptance=0.500
Node 18: acceptance=0.575
Node 19: acceptance=1.000

=== PARALLEL EXECUTION TIME (realistic for distributed system) ===
  COMMUNICATION (max across nodes):
    - Full model transfer: 0.000s (0.0%)
  COMPUTATION (max across nodes):
    - Filtering: 0.038s (73.0%)
    - Aggregation: 0.014s (27.0%)
  TOTALS:
    - Total computation: 0.052s (100.0%)
    - Total communication: 0.000s (0.0%)
    - Total parallel time: 0.052s

=== PER-NODE AVERAGE TIME ===
  - Filtering: 0.020s
  - Aggregation: 0.005s
  - Model transfer: 0.000s
  - Total per node: 0.025s

=== TOTAL COMPUTATIONAL WORK (sum across all nodes) ===
  - Total filtering: 0.404s
  - Total aggregation: 0.091s
  - Total model transfer: 0.000s
  - Grand total: 0.495s
  - Mean acceptance rate: 0.520

BALANCE Algorithm Properties:
  - Model dimension: 6,603,710
  - No compression: Full parameter comparison
  - Theoretical complexity: O(deg(i)×d)
  - Approach: Full parameter filtering + averaging
