Device: cuda
Seed: 987654321
Loading 36 LEAF FEMNIST train files...
LEAF FEMNIST train: 3597 users, 734463 samples
Loading 36 LEAF FEMNIST test files...
LEAF FEMNIST test: 3597 users, 83388 samples
Found 3597 train users, 3597 test users, 3597 common users
User sample counts range: 525 (max) to 17 (min)
Distributed ALL 3597 users across 20 clients
Users per client: 179 (with 17 clients getting +1 user)
Train partition sizes: [36360, 37070, 35957, 38262, 36024, 37732, 36921, 38328, 36867, 37683, 36507, 36915, 36007, 37001, 35681, 35453, 36585, 36801, 35964, 36345]
Test partition sizes: [4128, 4203, 4081, 4333, 4091, 4287, 4193, 4349, 4191, 4277, 4143, 4193, 4093, 4197, 4052, 4029, 4153, 4183, 4084, 4128]
  Client 0: 36360 train samples, 62 unique classes
  Client 1: 37070 train samples, 62 unique classes
  Client 2: 35957 train samples, 62 unique classes
  Client 3: 38262 train samples, 62 unique classes
  Client 4: 36024 train samples, 62 unique classes
  Client 5: 37732 train samples, 62 unique classes
  Client 6: 36921 train samples, 62 unique classes
  Client 7: 38328 train samples, 62 unique classes
  Client 8: 36867 train samples, 62 unique classes
  Client 9: 37683 train samples, 62 unique classes
  Client 10: 36507 train samples, 62 unique classes
  Client 11: 36915 train samples, 62 unique classes
  Client 12: 36007 train samples, 62 unique classes
  Client 13: 37001 train samples, 62 unique classes
  Client 14: 35681 train samples, 62 unique classes
  Client 15: 35453 train samples, 62 unique classes
  Client 16: 36585 train samples, 62 unique classes
  Client 17: 36801 train samples, 62 unique classes
  Client 18: 35964 train samples, 62 unique classes
  Client 19: 36345 train samples, 62 unique classes
Will sample 4500 samples per client per epoch
Graph: erdos, nodes: 20, edges: 48
Degree statistics: avg=4.80, min=2, max=7
Attack: Compromised 6/20 nodes: [5, 12, 13, 14, 17, 18]
Attack type: backdoor, lambda: 1.0
Backdoor target label: 0, trigger size: 4
Model variant: baseline
Model parameters: 6,603,710
Initial test acc across nodes: mean=0.0168 ± 0.0139
Backdoor attack: Created poisoned datasets for 6 compromised nodes
Round 001: test acc mean=0.0258 ± 0.0176 | min=0.0029 max=0.0545
         : test loss mean=9774.1700 ± 17184.0770
         : individual accs = ['0.040698', '0.052344', '0.002940', '0.045003', '0.019800', '0.022160', '0.008586', '0.044838', '0.006920', '0.053776', '0.023172', '0.019795', '0.033716', '0.007386', '0.014067', '0.007694', '0.039730', '0.004303', '0.014691', '0.054506']
         : correct/total = [(168, 4128), (220, 4203), (12, 4081), (195, 4333), (81, 4091), (95, 4287), (36, 4193), (195, 4349), (29, 4191), (230, 4277), (96, 4143), (83, 4193), (138, 4093), (31, 4197), (57, 4052), (31, 4029), (165, 4153), (18, 4183), (60, 4084), (225, 4128)]
         : compromised: 0.0161, honest: 0.0300
Round 002: test acc mean=0.0398 ± 0.0194 | min=0.0043 max=0.0596
         : test loss mean=30168041.6225 ± 69183385.0803
         : individual accs = ['0.059593', '0.048775', '0.006861', '0.048465', '0.051088', '0.004665', '0.049130', '0.051276', '0.009783', '0.047463', '0.007965', '0.004293', '0.054239', '0.046938', '0.051826', '0.056342', '0.052011', '0.049486', '0.051665', '0.043847']
         : correct/total = [(246, 4128), (205, 4203), (28, 4081), (210, 4333), (209, 4091), (20, 4287), (206, 4193), (223, 4349), (41, 4191), (203, 4277), (33, 4143), (18, 4193), (222, 4093), (197, 4197), (210, 4052), (227, 4029), (216, 4153), (207, 4183), (211, 4084), (181, 4128)]
         : compromised: 0.0431, honest: 0.0383
Round 003: test acc mean=0.0457 ± 0.0115 | min=0.0088 max=0.0624
         : test loss mean=423.1596 ± 598.7141
         : individual accs = ['0.029070', '0.049726', '0.035531', '0.052850', '0.008800', '0.050618', '0.044598', '0.049207', '0.051062', '0.039280', '0.055998', '0.053899', '0.050574', '0.062426', '0.050346', '0.050633', '0.049362', '0.051159', '0.045788', '0.032219']
         : correct/total = [(120, 4128), (209, 4203), (145, 4081), (229, 4333), (36, 4091), (217, 4287), (187, 4193), (214, 4349), (214, 4191), (168, 4277), (232, 4143), (226, 4193), (207, 4093), (262, 4197), (204, 4052), (204, 4029), (205, 4153), (214, 4183), (187, 4084), (133, 4128)]
         : compromised: 0.0518, honest: 0.0430
Round 004: test acc mean=0.0501 ± 0.0027 | min=0.0446 max=0.0549
         : test loss mean=14659.8480 ± 63458.7419
         : individual accs = ['0.044574', '0.050916', '0.054889', '0.052850', '0.052066', '0.050618', '0.046745', '0.053116', '0.054880', '0.047697', '0.048033', '0.049606', '0.045688', '0.049083', '0.050346', '0.050881', '0.049362', '0.051159', '0.050196', '0.050145']
         : correct/total = [(184, 4128), (214, 4203), (224, 4081), (229, 4333), (213, 4091), (217, 4287), (196, 4193), (231, 4349), (230, 4191), (204, 4277), (199, 4143), (208, 4193), (187, 4093), (206, 4197), (204, 4052), (205, 4029), (205, 4153), (214, 4183), (205, 4084), (207, 4128)]
         : compromised: 0.0495, honest: 0.0504
Round 005: test acc mean=0.0487 ± 0.0028 | min=0.0420 max=0.0549
         : test loss mean=5228.9667 ± 22630.4387
         : individual accs = ['0.051599', '0.051630', '0.048272', '0.048234', '0.045710', '0.045953', '0.046745', '0.047827', '0.054880', '0.047697', '0.041999', '0.049606', '0.045688', '0.046700', '0.050346', '0.051378', '0.049362', '0.051159', '0.050930', '0.048692']
         : correct/total = [(213, 4128), (217, 4203), (197, 4081), (209, 4333), (187, 4091), (197, 4287), (196, 4193), (208, 4349), (230, 4191), (204, 4277), (174, 4143), (208, 4193), (187, 4093), (196, 4197), (204, 4052), (207, 4029), (205, 4153), (214, 4183), (208, 4084), (201, 4128)]
         : compromised: 0.0485, honest: 0.0488
Round 006: test acc mean=0.0499 ± 0.0027 | min=0.0451 max=0.0549
         : test loss mean=20.6064 ± 32.3860
         : individual accs = ['0.050145', '0.047109', '0.045087', '0.048234', '0.052066', '0.052018', '0.048891', '0.047827', '0.054880', '0.053075', '0.047309', '0.054376', '0.045688', '0.046462', '0.050346', '0.050881', '0.051288', '0.051159', '0.051665', '0.050388']
         : correct/total = [(207, 4128), (198, 4203), (184, 4081), (209, 4333), (213, 4091), (223, 4287), (205, 4193), (208, 4349), (230, 4191), (227, 4277), (196, 4143), (228, 4193), (187, 4093), (195, 4197), (204, 4052), (205, 4029), (213, 4153), (214, 4183), (211, 4084), (208, 4128)]
         : compromised: 0.0496, honest: 0.0501
Round 007: test acc mean=0.0502 ± 0.0038 | min=0.0426 max=0.0553
         : test loss mean=7.4998 ± 5.1220
         : individual accs = ['0.051599', '0.042589', '0.054889', '0.048234', '0.052066', '0.045953', '0.043883', '0.053116', '0.054880', '0.046528', '0.055274', '0.054376', '0.045688', '0.055278', '0.050346', '0.050881', '0.051047', '0.051159', '0.048482', '0.048450']
         : correct/total = [(213, 4128), (179, 4203), (224, 4081), (209, 4333), (213, 4091), (197, 4287), (184, 4193), (231, 4349), (230, 4191), (199, 4277), (229, 4143), (228, 4193), (187, 4093), (232, 4197), (204, 4052), (205, 4029), (212, 4153), (214, 4183), (198, 4084), (200, 4128)]
         : compromised: 0.0495, honest: 0.0506
Round 008: test acc mean=0.0493 ± 0.0026 | min=0.0451 max=0.0549
         : test loss mean=16.4023 ± 19.7351
         : individual accs = ['0.051599', '0.047109', '0.045087', '0.048234', '0.047421', '0.052484', '0.048891', '0.047827', '0.054880', '0.053075', '0.047309', '0.046983', '0.045688', '0.046462', '0.050346', '0.051378', '0.051288', '0.051159', '0.050930', '0.048450']
         : correct/total = [(213, 4128), (198, 4203), (184, 4081), (209, 4333), (194, 4091), (225, 4287), (205, 4193), (208, 4349), (230, 4191), (227, 4277), (196, 4143), (197, 4193), (187, 4093), (195, 4197), (204, 4052), (207, 4029), (213, 4153), (214, 4183), (208, 4084), (200, 4128)]
         : compromised: 0.0495, honest: 0.0493
Round 009: test acc mean=0.0496 ± 0.0033 | min=0.0426 max=0.0560
         : test loss mean=16.8073 ± 15.5916
         : individual accs = ['0.051599', '0.042589', '0.048272', '0.048234', '0.045710', '0.045953', '0.053899', '0.047827', '0.054880', '0.053075', '0.055998', '0.049606', '0.045688', '0.046462', '0.050346', '0.051378', '0.049362', '0.051159', '0.050930', '0.048450']
         : correct/total = [(213, 4128), (179, 4203), (197, 4081), (209, 4333), (187, 4091), (197, 4287), (226, 4193), (208, 4349), (230, 4191), (227, 4277), (232, 4143), (208, 4193), (187, 4093), (195, 4197), (204, 4052), (207, 4029), (205, 4153), (214, 4183), (208, 4084), (200, 4128)]
         : compromised: 0.0484, honest: 0.0501
Round 010: test acc mean=0.0501 ± 0.0026 | min=0.0448 max=0.0549
         : test loss mean=12.1834 ± 14.2986
         : individual accs = ['0.051599', '0.047109', '0.048272', '0.044773', '0.045710', '0.052484', '0.049130', '0.053116', '0.054880', '0.053075', '0.050447', '0.049606', '0.052040', '0.046462', '0.050346', '0.050633', '0.051288', '0.051159', '0.050930', '0.048450']
         : correct/total = [(213, 4128), (198, 4203), (197, 4081), (194, 4333), (187, 4091), (225, 4287), (206, 4193), (231, 4349), (230, 4191), (227, 4277), (209, 4143), (208, 4193), (213, 4093), (195, 4197), (204, 4052), (204, 4029), (213, 4153), (214, 4183), (208, 4084), (200, 4128)]
         : compromised: 0.0506, honest: 0.0499

=== FINAL RESULTS ===
Dataset: femnist, Nodes: 20, Graph: erdos, Aggregation: d-fedavg
Attack: backdoor, 30.0% compromised
Final accuracy - Compromised: 0.0506, Honest: 0.0499
Overall test accuracy: mean=0.0501 ± 0.0026

=== BACKDOOR ATTACK SUCCESS RATE (ASR) ===
Target label: 0
Trigger size: 4x4
Overall ASR: 0.0000 ± 0.0000
Honest nodes ASR: 0.0000 ± 0.0000
Compromised nodes ASR: 0.0000 ± 0.0000
Note: Higher ASR indicates more successful backdoor attack
