Device: cuda
Seed: 987654321
Loading 36 LEAF FEMNIST train files...
LEAF FEMNIST train: 3597 users, 734463 samples
Loading 36 LEAF FEMNIST test files...
LEAF FEMNIST test: 3597 users, 83388 samples
Found 3597 train users, 3597 test users, 3597 common users
User sample counts range: 525 (max) to 17 (min)
Distributed ALL 3597 users across 20 clients
Users per client: 179 (with 17 clients getting +1 user)
Train partition sizes: [36360, 37070, 35957, 38262, 36024, 37732, 36921, 38328, 36867, 37683, 36507, 36915, 36007, 37001, 35681, 35453, 36585, 36801, 35964, 36345]
Test partition sizes: [4128, 4203, 4081, 4333, 4091, 4287, 4193, 4349, 4191, 4277, 4143, 4193, 4093, 4197, 4052, 4029, 4153, 4183, 4084, 4128]
  Client 0: 36360 train samples, 62 unique classes
  Client 1: 37070 train samples, 62 unique classes
  Client 2: 35957 train samples, 62 unique classes
  Client 3: 38262 train samples, 62 unique classes
  Client 4: 36024 train samples, 62 unique classes
  Client 5: 37732 train samples, 62 unique classes
  Client 6: 36921 train samples, 62 unique classes
  Client 7: 38328 train samples, 62 unique classes
  Client 8: 36867 train samples, 62 unique classes
  Client 9: 37683 train samples, 62 unique classes
  Client 10: 36507 train samples, 62 unique classes
  Client 11: 36915 train samples, 62 unique classes
  Client 12: 36007 train samples, 62 unique classes
  Client 13: 37001 train samples, 62 unique classes
  Client 14: 35681 train samples, 62 unique classes
  Client 15: 35453 train samples, 62 unique classes
  Client 16: 36585 train samples, 62 unique classes
  Client 17: 36801 train samples, 62 unique classes
  Client 18: 35964 train samples, 62 unique classes
  Client 19: 36345 train samples, 62 unique classes
Will sample 10000 samples per client per epoch
Graph: erdos, nodes: 20, edges: 126
Degree statistics: avg=12.60, min=8, max=16
Attack: Compromised 6/20 nodes: [5, 12, 13, 14, 17, 18]
Attack type: gaussian, lambda: 1.0
Model variant: baseline
Model parameters: 6,603,710
BALANCE algorithm:
Balance Config: BALANCEConfig(gamma=2, kappa=1, alpha=0.5, min_neighbors=1)
  - Model dimension: 6,603,710 parameters
  - Complexity: O(N×d) = O(20×6,603,710)
Initial test acc across nodes: mean=0.0168 ± 0.0139
Round 001: test acc mean=0.5098 ± 0.0351 | min=0.4527 max=0.5993
         : test loss mean=3.7281 ± 0.0281
         : individual accs = ['0.563711', '0.505591', '0.553541', '0.480037', '0.520900', '0.599254', '0.515621', '0.526098', '0.502744', '0.452654', '0.512913', '0.524207', '0.464940', '0.468430', '0.522705', '0.522710', '0.461835', '0.513507', '0.490940', '0.494186']
         : correct/total = [(2327, 4128), (2125, 4203), (2259, 4081), (2080, 4333), (2131, 4091), (2569, 4287), (2162, 4193), (2288, 4349), (2107, 4191), (1936, 4277), (2125, 4143), (2198, 4193), (1903, 4093), (1966, 4197), (2118, 4052), (2106, 4029), (1918, 4153), (2148, 4183), (2005, 4084), (2040, 4128)]
         : compromised: 0.5100, honest: 0.5098
Round 002: test acc mean=0.6807 ± 0.0149 | min=0.6461 max=0.7089
         : test loss mean=3.3701 ± 0.0744
         : individual accs = ['0.684835', '0.683321', '0.674099', '0.699515', '0.697873', '0.708887', '0.666587', '0.686825', '0.669053', '0.667992', '0.687907', '0.672549', '0.655998', '0.683345', '0.684353', '0.646066', '0.686010', '0.701171', '0.677032', '0.680475']
         : correct/total = [(2827, 4128), (2872, 4203), (2751, 4081), (3031, 4333), (2855, 4091), (3039, 4287), (2795, 4193), (2987, 4349), (2804, 4191), (2857, 4277), (2850, 4143), (2820, 4193), (2685, 4093), (2868, 4197), (2773, 4052), (2603, 4029), (2849, 4153), (2933, 4183), (2765, 4084), (2809, 4128)]
         : compromised: 0.6851, honest: 0.6788
Round 003: test acc mean=0.6976 ± 0.0347 | min=0.5773 max=0.7411
         : test loss mean=2.9934 ± 0.1796
         : individual accs = ['0.718992', '0.717583', '0.681696', '0.725133', '0.741139', '0.673898', '0.702123', '0.725914', '0.705560', '0.731354', '0.713975', '0.684236', '0.691913', '0.656183', '0.685834', '0.699429', '0.698772', '0.577337', '0.693438', '0.726986']
         : correct/total = [(2968, 4128), (3016, 4203), (2782, 4081), (3142, 4333), (3032, 4091), (2889, 4287), (2944, 4193), (3157, 4349), (2957, 4191), (3128, 4277), (2958, 4143), (2869, 4193), (2832, 4093), (2754, 4197), (2779, 4052), (2818, 4029), (2902, 4153), (2415, 4183), (2832, 4084), (3001, 4128)]
         : compromised: 0.6631, honest: 0.7123
Round 004: test acc mean=0.6885 ± 0.0357 | min=0.6101 max=0.7411
         : test loss mean=2.4328 ± 0.2124
         : individual accs = ['0.707122', '0.729717', '0.683901', '0.725133', '0.741139', '0.632144', '0.700453', '0.700161', '0.717967', '0.681085', '0.691287', '0.720964', '0.610066', '0.630212', '0.667325', '0.673120', '0.736335', '0.683481', '0.651812', '0.687016']
         : correct/total = [(2919, 4128), (3067, 4203), (2791, 4081), (3142, 4333), (3032, 4091), (2710, 4287), (2937, 4193), (3045, 4349), (3009, 4191), (2913, 4277), (2864, 4143), (3023, 4193), (2497, 4093), (2645, 4197), (2704, 4052), (2712, 4029), (3058, 4153), (2859, 4183), (2662, 4084), (2836, 4128)]
         : compromised: 0.6458, honest: 0.7068
Round 005: test acc mean=0.6820 ± 0.0397 | min=0.5998 max=0.7409
         : test loss mean=1.7536 ± 0.2012
         : individual accs = ['0.704700', '0.706876', '0.681696', '0.723517', '0.740895', '0.655237', '0.667780', '0.731433', '0.663088', '0.712415', '0.704079', '0.714763', '0.599805', '0.627591', '0.627098', '0.620750', '0.701902', '0.708821', '0.648384', '0.699612']
         : correct/total = [(2909, 4128), (2971, 4203), (2782, 4081), (3135, 4333), (3031, 4091), (2809, 4287), (2800, 4193), (3181, 4349), (2779, 4191), (3047, 4277), (2917, 4143), (2997, 4193), (2455, 4093), (2634, 4197), (2541, 4052), (2501, 4029), (2915, 4153), (2965, 4183), (2648, 4084), (2888, 4128)]
         : compromised: 0.6445, honest: 0.6981
Round 006: test acc mean=0.7516 ± 0.0235 | min=0.6991 max=0.7820
         : test loss mean=1.0948 ± 0.1066
         : individual accs = ['0.766957', '0.775636', '0.766234', '0.757443', '0.781472', '0.750641', '0.759599', '0.761554', '0.749225', '0.741875', '0.769491', '0.782018', '0.708282', '0.699071', '0.747532', '0.718541', '0.757765', '0.770022', '0.713026', '0.755814']
         : correct/total = [(3166, 4128), (3260, 4203), (3127, 4081), (3282, 4333), (3197, 4091), (3218, 4287), (3185, 4193), (3312, 4349), (3140, 4191), (3173, 4277), (3188, 4143), (3279, 4193), (2899, 4093), (2934, 4197), (3029, 4052), (2895, 4029), (3147, 4153), (3221, 4183), (2912, 4084), (3120, 4128)]
         : compromised: 0.7314, honest: 0.7603
Round 007: test acc mean=0.8018 ± 0.0105 | min=0.7722 max=0.8228
         : test loss mean=0.7113 ± 0.0464
         : individual accs = ['0.810804', '0.805377', '0.804705', '0.795984', '0.822782', '0.806625', '0.797758', '0.818809', '0.792412', '0.805705', '0.793145', '0.796327', '0.802590', '0.808196', '0.795903', '0.772152', '0.810017', '0.793211', '0.800686', '0.802326']
         : correct/total = [(3347, 4128), (3385, 4203), (3284, 4081), (3449, 4333), (3366, 4091), (3458, 4287), (3345, 4193), (3561, 4349), (3321, 4191), (3446, 4277), (3286, 4143), (3339, 4193), (3285, 4093), (3392, 4197), (3225, 4052), (3111, 4029), (3364, 4153), (3318, 4183), (3270, 4084), (3312, 4128)]
         : compromised: 0.8012, honest: 0.8020
Round 008: test acc mean=0.8249 ± 0.0084 | min=0.8062 max=0.8387
         : test loss mean=0.5616 ± 0.0250
         : individual accs = ['0.826793', '0.831787', '0.832394', '0.830372', '0.834270', '0.830884', '0.818984', '0.835594', '0.820568', '0.838672', '0.818489', '0.822800', '0.827266', '0.821777', '0.808983', '0.806155', '0.823020', '0.818551', '0.831783', '0.819041']
         : correct/total = [(3413, 4128), (3496, 4203), (3397, 4081), (3598, 4333), (3413, 4091), (3562, 4287), (3434, 4193), (3634, 4349), (3439, 4191), (3587, 4277), (3391, 4143), (3450, 4193), (3386, 4093), (3449, 4197), (3278, 4052), (3248, 4029), (3418, 4153), (3424, 4183), (3397, 4084), (3381, 4128)]
         : compromised: 0.8232, honest: 0.8256
Round 009: test acc mean=0.8344 ± 0.0079 | min=0.8215 max=0.8494
         : test loss mean=0.5119 ± 0.0205
         : individual accs = ['0.828004', '0.844397', '0.846851', '0.831756', '0.844292', '0.838348', '0.828047', '0.849391', '0.827726', '0.844517', '0.825489', '0.827808', '0.835084', '0.831070', '0.827246', '0.821544', '0.839393', '0.832656', '0.835700', '0.827762']
         : correct/total = [(3418, 4128), (3549, 4203), (3456, 4081), (3604, 4333), (3454, 4091), (3594, 4287), (3472, 4193), (3694, 4349), (3469, 4191), (3612, 4277), (3420, 4143), (3471, 4193), (3418, 4093), (3488, 4197), (3352, 4052), (3310, 4029), (3486, 4153), (3483, 4183), (3413, 4084), (3417, 4128)]
         : compromised: 0.8334, honest: 0.8348
Round 010: test acc mean=0.8412 ± 0.0065 | min=0.8273 max=0.8503
         : test loss mean=0.4855 ± 0.0211
         : individual accs = ['0.841328', '0.847490', '0.846606', '0.838911', '0.849914', '0.842081', '0.837586', '0.850310', '0.841804', '0.850129', '0.834420', '0.827331', '0.843880', '0.844889', '0.835637', '0.834202', '0.843487', '0.836959', '0.847453', '0.829942']
         : correct/total = [(3473, 4128), (3562, 4203), (3455, 4081), (3635, 4333), (3477, 4091), (3610, 4287), (3512, 4193), (3698, 4349), (3528, 4191), (3636, 4277), (3457, 4143), (3469, 4193), (3454, 4093), (3546, 4197), (3386, 4052), (3361, 4029), (3503, 4153), (3501, 4183), (3461, 4084), (3426, 4128)]
         : compromised: 0.8418, honest: 0.8410

=== FINAL RESULTS ===
Dataset: femnist, Nodes: 20, Graph: erdos, Aggregation: balance
Attack: gaussian, 30.0% compromised
Final accuracy - Compromised: 0.8418, Honest: 0.8410
Overall test accuracy: mean=0.8412 ± 0.0065

=== BALANCE SUMMARY ===
Node 0: acceptance=0.688
Node 1: acceptance=0.818
Node 2: acceptance=0.667
Node 3: acceptance=0.750
Node 4: acceptance=0.727
Node 5: acceptance=0.667
Node 6: acceptance=0.571
Node 7: acceptance=0.643
Node 8: acceptance=0.500
Node 9: acceptance=0.769
Node 10: acceptance=0.667
Node 11: acceptance=0.643
Node 12: acceptance=0.750
Node 13: acceptance=0.769
Node 14: acceptance=0.667
Node 15: acceptance=0.636
Node 16: acceptance=0.615
Node 17: acceptance=0.778
Node 18: acceptance=0.750
Node 19: acceptance=0.625

=== PARALLEL EXECUTION TIME (realistic for distributed system) ===
  COMMUNICATION (max across nodes):
    - Full model transfer: 0.000s (0.0%)
  COMPUTATION (max across nodes):
    - Filtering: 0.197s (83.9%)
    - Aggregation: 0.038s (16.1%)
  TOTALS:
    - Total computation: 0.234s (100.0%)
    - Total communication: 0.000s (0.0%)
    - Total parallel time: 0.234s

=== PER-NODE AVERAGE TIME ===
  - Filtering: 0.096s
  - Aggregation: 0.010s
  - Model transfer: 0.000s
  - Total per node: 0.106s

=== TOTAL COMPUTATIONAL WORK (sum across all nodes) ===
  - Total filtering: 1.912s
  - Total aggregation: 0.201s
  - Total model transfer: 0.000s
  - Grand total: 2.113s
  - Mean acceptance rate: 0.685

BALANCE Algorithm Properties:
  - Model dimension: 6,603,710
  - No compression: Full parameter comparison
  - Theoretical complexity: O(deg(i)×d)
  - Approach: Full parameter filtering + averaging
