Device: cuda
Seed: 987654321
Loading 36 LEAF FEMNIST train files...
LEAF FEMNIST train: 3597 users, 734463 samples
Loading 36 LEAF FEMNIST test files...
LEAF FEMNIST test: 3597 users, 83388 samples
Found 3597 train users, 3597 test users, 3597 common users
User sample counts range: 525 (max) to 17 (min)
Distributed ALL 3597 users across 20 clients
Users per client: 179 (with 17 clients getting +1 user)
Train partition sizes: [36360, 37070, 35957, 38262, 36024, 37732, 36921, 38328, 36867, 37683, 36507, 36915, 36007, 37001, 35681, 35453, 36585, 36801, 35964, 36345]
Test partition sizes: [4128, 4203, 4081, 4333, 4091, 4287, 4193, 4349, 4191, 4277, 4143, 4193, 4093, 4197, 4052, 4029, 4153, 4183, 4084, 4128]
  Client 0: 36360 train samples, 62 unique classes
  Client 1: 37070 train samples, 62 unique classes
  Client 2: 35957 train samples, 62 unique classes
  Client 3: 38262 train samples, 62 unique classes
  Client 4: 36024 train samples, 62 unique classes
  Client 5: 37732 train samples, 62 unique classes
  Client 6: 36921 train samples, 62 unique classes
  Client 7: 38328 train samples, 62 unique classes
  Client 8: 36867 train samples, 62 unique classes
  Client 9: 37683 train samples, 62 unique classes
  Client 10: 36507 train samples, 62 unique classes
  Client 11: 36915 train samples, 62 unique classes
  Client 12: 36007 train samples, 62 unique classes
  Client 13: 37001 train samples, 62 unique classes
  Client 14: 35681 train samples, 62 unique classes
  Client 15: 35453 train samples, 62 unique classes
  Client 16: 36585 train samples, 62 unique classes
  Client 17: 36801 train samples, 62 unique classes
  Client 18: 35964 train samples, 62 unique classes
  Client 19: 36345 train samples, 62 unique classes
Will sample 10000 samples per client per epoch
Graph: erdos, nodes: 20, edges: 126
Degree statistics: avg=12.60, min=8, max=16
Attack: Compromised 16/20 nodes: [1, 2, 3, 5, 6, 8, 9, 10, 11, 12, 13, 14, 15, 17, 18, 19]
Attack type: directed_deviation, lambda: 1.0
Model variant: baseline
Model parameters: 6,603,710
Sketchguard Node 0:
  Model dim: 6,603,710 → Sketch size: 1000
  Compression ratio: 6603.7x
  Using model parameters for aggregation, sketches for filtering
Sketchguard Node 1:
  Model dim: 6,603,710 → Sketch size: 1000
  Compression ratio: 6603.7x
  Using model parameters for aggregation, sketches for filtering
Sketchguard Node 2:
  Model dim: 6,603,710 → Sketch size: 1000
  Compression ratio: 6603.7x
  Using model parameters for aggregation, sketches for filtering
Sketchguard Node 3:
  Model dim: 6,603,710 → Sketch size: 1000
  Compression ratio: 6603.7x
  Using model parameters for aggregation, sketches for filtering
Sketchguard Node 4:
  Model dim: 6,603,710 → Sketch size: 1000
  Compression ratio: 6603.7x
  Using model parameters for aggregation, sketches for filtering
Sketchguard Node 5:
  Model dim: 6,603,710 → Sketch size: 1000
  Compression ratio: 6603.7x
  Using model parameters for aggregation, sketches for filtering
Sketchguard Node 6:
  Model dim: 6,603,710 → Sketch size: 1000
  Compression ratio: 6603.7x
  Using model parameters for aggregation, sketches for filtering
Sketchguard Node 7:
  Model dim: 6,603,710 → Sketch size: 1000
  Compression ratio: 6603.7x
  Using model parameters for aggregation, sketches for filtering
Sketchguard Node 8:
  Model dim: 6,603,710 → Sketch size: 1000
  Compression ratio: 6603.7x
  Using model parameters for aggregation, sketches for filtering
Sketchguard Node 9:
  Model dim: 6,603,710 → Sketch size: 1000
  Compression ratio: 6603.7x
  Using model parameters for aggregation, sketches for filtering
Sketchguard Node 10:
  Model dim: 6,603,710 → Sketch size: 1000
  Compression ratio: 6603.7x
  Using model parameters for aggregation, sketches for filtering
Sketchguard Node 11:
  Model dim: 6,603,710 → Sketch size: 1000
  Compression ratio: 6603.7x
  Using model parameters for aggregation, sketches for filtering
Sketchguard Node 12:
  Model dim: 6,603,710 → Sketch size: 1000
  Compression ratio: 6603.7x
  Using model parameters for aggregation, sketches for filtering
Sketchguard Node 13:
  Model dim: 6,603,710 → Sketch size: 1000
  Compression ratio: 6603.7x
  Using model parameters for aggregation, sketches for filtering
Sketchguard Node 14:
  Model dim: 6,603,710 → Sketch size: 1000
  Compression ratio: 6603.7x
  Using model parameters for aggregation, sketches for filtering
Sketchguard Node 15:
  Model dim: 6,603,710 → Sketch size: 1000
  Compression ratio: 6603.7x
  Using model parameters for aggregation, sketches for filtering
Sketchguard Node 16:
  Model dim: 6,603,710 → Sketch size: 1000
  Compression ratio: 6603.7x
  Using model parameters for aggregation, sketches for filtering
Sketchguard Node 17:
  Model dim: 6,603,710 → Sketch size: 1000
  Compression ratio: 6603.7x
  Using model parameters for aggregation, sketches for filtering
Sketchguard Node 18:
  Model dim: 6,603,710 → Sketch size: 1000
  Compression ratio: 6603.7x
  Using model parameters for aggregation, sketches for filtering
Sketchguard Node 19:
  Model dim: 6,603,710 → Sketch size: 1000
  Compression ratio: 6603.7x
  Using model parameters for aggregation, sketches for filtering
Sketchguard ALGORITHM (Sketch-based Filtering + State Aggregation)
  - Model dimension: 6,603,710 parameters
  - Config: SketchguardConfig(gamma=2, kappa=1, alpha=0.5, min_neighbors=1, sketch_size=1000, network_seed=987654321, attack_detection_window=5)
  - Sketch size: 1000
  - Compression ratio: 6603.7x
  - Complexity: O(d + N×k) = O(6,603,710 + 20×1000)
  - Theoretical speedup vs BALANCE: 19.9x
Initial test acc across nodes: mean=0.0168 ± 0.0139
Round 001: test acc mean=0.4255 ± 0.0637 | min=0.2853 max=0.5256
         : test loss mean=3.7596 ± 0.0515
         : individual accs = ['0.435320', '0.466096', '0.525606', '0.285253', '0.443901', '0.524843', '0.343191', '0.469073', '0.373419', '0.371288', '0.403572', '0.480563', '0.394576', '0.413391', '0.466190', '0.486225', '0.307729', '0.438680', '0.420666', '0.460271']
         : correct/total = [(1797, 4128), (1959, 4203), (2145, 4081), (1236, 4333), (1816, 4091), (2250, 4287), (1439, 4193), (2040, 4349), (1565, 4191), (1588, 4277), (1672, 4143), (2015, 4193), (1615, 4093), (1735, 4197), (1889, 4052), (1959, 4029), (1278, 4153), (1835, 4183), (1718, 4084), (1900, 4128)]
         : compromised: 0.4284, honest: 0.4140
         : sketchguard stats = ['Node 0: acc_rate=0.188', 'Node 1: acc_rate=0.364', 'Node 2: acc_rate=0.250']...
Round 002: test acc mean=0.6336 ± 0.0432 | min=0.5190 max=0.7028
         : test loss mean=2.9046 ± 0.4698
         : individual accs = ['0.653828', '0.670473', '0.635629', '0.698592', '0.702762', '0.661302', '0.619366', '0.643826', '0.613219', '0.591536', '0.595704', '0.576914', '0.647203', '0.628068', '0.639191', '0.518987', '0.691307', '0.616782', '0.661606', '0.605862']
         : correct/total = [(2699, 4128), (2818, 4203), (2594, 4081), (3027, 4333), (2875, 4091), (2835, 4287), (2597, 4193), (2800, 4349), (2570, 4191), (2530, 4277), (2468, 4143), (2419, 4193), (2649, 4093), (2636, 4197), (2590, 4052), (2091, 4029), (2871, 4153), (2580, 4183), (2702, 4084), (2501, 4128)]
         : compromised: 0.6238, honest: 0.6729
         : sketchguard stats = ['Node 0: acc_rate=0.188', 'Node 1: acc_rate=0.364', 'Node 2: acc_rate=0.250']...
Round 003: test acc mean=0.7300 ± 0.0319 | min=0.6693 max=0.7785
         : test loss mean=1.4710 ± 0.3933
         : individual accs = ['0.770349', '0.726148', '0.730213', '0.765290', '0.778538', '0.760205', '0.731457', '0.766153', '0.742066', '0.697919', '0.739319', '0.694729', '0.739311', '0.736478', '0.726061', '0.682552', '0.762822', '0.692804', '0.687316', '0.669331']
         : correct/total = [(3180, 4128), (3052, 4203), (2980, 4081), (3316, 4333), (3185, 4091), (3259, 4287), (3067, 4193), (3332, 4349), (3110, 4191), (2985, 4277), (3063, 4143), (2913, 4193), (3026, 4093), (3091, 4197), (2942, 4052), (2750, 4029), (3168, 4153), (2898, 4183), (2807, 4084), (2763, 4128)]
         : compromised: 0.7201, honest: 0.7695
         : sketchguard stats = ['Node 0: acc_rate=0.188', 'Node 1: acc_rate=0.364', 'Node 2: acc_rate=0.250']...
Round 004: test acc mean=0.7959 ± 0.0122 | min=0.7597 max=0.8176
         : test loss mean=0.7203 ± 0.0670
         : individual accs = ['0.800145', '0.800857', '0.801274', '0.796677', '0.817648', '0.802892', '0.793704', '0.811451', '0.792412', '0.799392', '0.788076', '0.786549', '0.798436', '0.793186', '0.784551', '0.782576', '0.813869', '0.796318', '0.797992', '0.759690']
         : correct/total = [(3303, 4128), (3366, 4203), (3270, 4081), (3452, 4333), (3345, 4091), (3442, 4287), (3328, 4193), (3529, 4349), (3321, 4191), (3419, 4277), (3265, 4143), (3298, 4193), (3268, 4093), (3329, 4197), (3179, 4052), (3153, 4029), (3380, 4153), (3331, 4183), (3259, 4084), (3136, 4128)]
         : compromised: 0.7922, honest: 0.8108
         : sketchguard stats = ['Node 0: acc_rate=0.188', 'Node 1: acc_rate=0.364', 'Node 2: acc_rate=0.250']...
Round 005: test acc mean=0.8190 ± 0.0082 | min=0.8039 max=0.8343
         : test loss mean=0.5752 ± 0.0303
         : individual accs = ['0.821705', '0.827742', '0.826268', '0.812370', '0.834270', '0.825286', '0.814930', '0.829386', '0.814364', '0.824877', '0.812696', '0.808729', '0.819448', '0.823207', '0.816634', '0.803922', '0.824705', '0.811379', '0.822723', '0.804990']
         : correct/total = [(3392, 4128), (3479, 4203), (3372, 4081), (3520, 4333), (3413, 4091), (3538, 4287), (3417, 4193), (3607, 4349), (3413, 4191), (3528, 4277), (3367, 4143), (3391, 4193), (3354, 4093), (3455, 4197), (3309, 4052), (3239, 4029), (3425, 4153), (3394, 4183), (3360, 4084), (3323, 4128)]
         : compromised: 0.8168, honest: 0.8275
         : sketchguard stats = ['Node 0: acc_rate=0.188', 'Node 1: acc_rate=0.364', 'Node 2: acc_rate=0.250']...
Round 006: test acc mean=0.8301 ± 0.0074 | min=0.8158 max=0.8423
         : test loss mean=0.5274 ± 0.0256
         : individual accs = ['0.831395', '0.840828', '0.838520', '0.822525', '0.837692', '0.829251', '0.821846', '0.842263', '0.826294', '0.836801', '0.820179', '0.828762', '0.836795', '0.829402', '0.828727', '0.815835', '0.830484', '0.826201', '0.838149', '0.820736']
         : correct/total = [(3432, 4128), (3534, 4203), (3422, 4081), (3564, 4333), (3427, 4091), (3555, 4287), (3446, 4193), (3663, 4349), (3463, 4191), (3579, 4277), (3398, 4143), (3475, 4193), (3425, 4093), (3481, 4197), (3358, 4052), (3287, 4029), (3449, 4153), (3456, 4183), (3423, 4084), (3388, 4128)]
         : compromised: 0.8288, honest: 0.8355
         : sketchguard stats = ['Node 0: acc_rate=0.188', 'Node 1: acc_rate=0.364', 'Node 2: acc_rate=0.250']...
Round 007: test acc mean=0.8387 ± 0.0080 | min=0.8233 max=0.8526
         : test loss mean=0.4919 ± 0.0238
         : individual accs = ['0.840116', '0.842969', '0.847096', '0.835910', '0.852359', '0.836016', '0.834248', '0.852610', '0.832498', '0.847089', '0.829592', '0.828762', '0.842414', '0.835120', '0.837117', '0.823281', '0.846376', '0.832656', '0.845739', '0.831153']
         : correct/total = [(3468, 4128), (3543, 4203), (3457, 4081), (3622, 4333), (3487, 4091), (3584, 4287), (3498, 4193), (3708, 4349), (3489, 4191), (3623, 4277), (3437, 4143), (3475, 4193), (3448, 4093), (3505, 4197), (3392, 4052), (3317, 4029), (3515, 4153), (3483, 4183), (3454, 4084), (3431, 4128)]
         : compromised: 0.8364, honest: 0.8479
         : sketchguard stats = ['Node 0: acc_rate=0.188', 'Node 1: acc_rate=0.364', 'Node 2: acc_rate=0.250']...
Round 008: test acc mean=0.8451 ± 0.0073 | min=0.8315 max=0.8546
         : test loss mean=0.4715 ± 0.0243
         : individual accs = ['0.845688', '0.852724', '0.853712', '0.841680', '0.854559', '0.852811', '0.837586', '0.853530', '0.845622', '0.853636', '0.834902', '0.835440', '0.850476', '0.845366', '0.838105', '0.831472', '0.843246', '0.840067', '0.851861', '0.839632']
         : correct/total = [(3491, 4128), (3584, 4203), (3484, 4081), (3647, 4333), (3496, 4091), (3656, 4287), (3512, 4193), (3712, 4349), (3544, 4191), (3651, 4277), (3459, 4143), (3503, 4193), (3481, 4093), (3548, 4197), (3396, 4052), (3350, 4029), (3502, 4153), (3514, 4183), (3479, 4084), (3466, 4128)]
         : compromised: 0.8441, honest: 0.8493
         : sketchguard stats = ['Node 0: acc_rate=0.188', 'Node 1: acc_rate=0.364', 'Node 2: acc_rate=0.250']...
Round 009: test acc mean=0.8475 ± 0.0075 | min=0.8358 max=0.8607
         : test loss mean=0.4570 ± 0.0215
         : individual accs = ['0.840843', '0.854152', '0.857143', '0.848142', '0.859203', '0.852111', '0.838540', '0.860658', '0.843951', '0.855039', '0.842626', '0.840210', '0.846323', '0.847510', '0.841313', '0.838421', '0.852155', '0.840545', '0.855534', '0.835756']
         : correct/total = [(3471, 4128), (3590, 4203), (3498, 4081), (3675, 4333), (3515, 4091), (3653, 4287), (3516, 4193), (3743, 4349), (3537, 4191), (3657, 4277), (3491, 4143), (3523, 4193), (3464, 4093), (3557, 4197), (3409, 4052), (3378, 4029), (3539, 4153), (3516, 4183), (3494, 4084), (3450, 4128)]
         : compromised: 0.8461, honest: 0.8532
         : sketchguard stats = ['Node 0: acc_rate=0.188', 'Node 1: acc_rate=0.364', 'Node 2: acc_rate=0.250']...
Round 010: test acc mean=0.8515 ± 0.0076 | min=0.8384 max=0.8624
         : test loss mean=0.4457 ± 0.0219
         : individual accs = ['0.852713', '0.859148', '0.860573', '0.848604', '0.861403', '0.853044', '0.842833', '0.859278', '0.850155', '0.858078', '0.843833', '0.841879', '0.857073', '0.850608', '0.847976', '0.839166', '0.858175', '0.845565', '0.862390', '0.838421']
         : correct/total = [(3520, 4128), (3611, 4203), (3512, 4081), (3677, 4333), (3524, 4091), (3657, 4287), (3534, 4193), (3737, 4349), (3563, 4191), (3670, 4277), (3496, 4143), (3530, 4193), (3508, 4093), (3570, 4197), (3436, 4052), (3381, 4029), (3564, 4153), (3537, 4183), (3522, 4084), (3461, 4128)]
         : compromised: 0.8500, honest: 0.8579
         : sketchguard stats = ['Node 0: acc_rate=0.188', 'Node 1: acc_rate=0.364', 'Node 2: acc_rate=0.250']...

=== FINAL RESULTS ===
Dataset: femnist, Nodes: 20, Graph: erdos, Aggregation: sketchguard
Attack: directed_deviation, 80.0% compromised
Final accuracy - Compromised: 0.8500, Honest: 0.8579
Overall test accuracy: mean=0.8515 ± 0.0076

=== Sketchguard SUMMARY ===
Node 0: acceptance=0.188
Node 1: acceptance=0.364
Node 2: acceptance=0.250
Node 3: acceptance=0.125
Node 4: acceptance=0.273
Node 5: acceptance=0.133
Node 6: acceptance=0.143
Node 7: acceptance=0.143
Node 8: acceptance=0.200
Node 9: acceptance=0.308
Node 10: acceptance=0.222
Node 11: acceptance=0.214
Node 12: acceptance=0.250
Node 13: acceptance=0.231
Node 14: acceptance=0.200
Node 15: acceptance=0.182
Node 16: acceptance=0.154
Node 17: acceptance=0.333
Node 18: acceptance=0.250
Node 19: acceptance=0.188

=== PARALLEL EXECUTION TIME (realistic for distributed system) ===
  COMMUNICATION (max across nodes):
    - Sketch transfer: 0.000s (0.0%)
    - Model fetch (accepted): 0.000s (0.0%)
  COMPUTATION (max across nodes):
    - Sketching: 2.415s (99.4%)
    - Filtering: 0.003s (0.1%)
    - Aggregation: 0.012s (0.5%)
  TOTALS:
    - Total computation: 2.431s (100.0%)
    - Total communication: 0.000s (0.0%)
    - Total parallel time: 2.431s

=== PER-NODE AVERAGE TIME ===
  - Sketching: 1.840s
  - Filtering: 0.001s
  - Aggregation: 0.008s
  - Sketch transfer: 0.000s
  - Model fetch: 0.000s
  - Total per node: 1.850s

=== TOTAL COMPUTATIONAL WORK (sum across all nodes) ===
  - Total sketching: 36.810s
  - Total filtering: 0.023s
  - Total aggregation: 0.169s
  - Total sketch transfer: 0.000s
  - Total model fetch: 0.000s
  - Grand total: 37.003s
  - Mean acceptance rate: 0.217

Sketchguard Algorithm Properties:
  - Original dimension: 6,603,710
  - Sketch size: 1000
  - Compression ratio: 19.9x
  - Single repetition: No repetitions needed
  - Theoretical complexity: O(d + N×k)
  - Approach: Sketch filtering + state aggregation
