Device: cuda
Seed: 987654321
Loading 36 LEAF FEMNIST train files...
LEAF FEMNIST train: 3597 users, 734463 samples
Loading 36 LEAF FEMNIST test files...
LEAF FEMNIST test: 3597 users, 83388 samples
Found 3597 train users, 3597 test users, 3597 common users
User sample counts range: 525 (max) to 17 (min)
Distributed ALL 3597 users across 20 clients
Users per client: 179 (with 17 clients getting +1 user)
Train partition sizes: [36360, 37070, 35957, 38262, 36024, 37732, 36921, 38328, 36867, 37683, 36507, 36915, 36007, 37001, 35681, 35453, 36585, 36801, 35964, 36345]
Test partition sizes: [4128, 4203, 4081, 4333, 4091, 4287, 4193, 4349, 4191, 4277, 4143, 4193, 4093, 4197, 4052, 4029, 4153, 4183, 4084, 4128]
  Client 0: 36360 train samples, 62 unique classes
  Client 1: 37070 train samples, 62 unique classes
  Client 2: 35957 train samples, 62 unique classes
  Client 3: 38262 train samples, 62 unique classes
  Client 4: 36024 train samples, 62 unique classes
  Client 5: 37732 train samples, 62 unique classes
  Client 6: 36921 train samples, 62 unique classes
  Client 7: 38328 train samples, 62 unique classes
  Client 8: 36867 train samples, 62 unique classes
  Client 9: 37683 train samples, 62 unique classes
  Client 10: 36507 train samples, 62 unique classes
  Client 11: 36915 train samples, 62 unique classes
  Client 12: 36007 train samples, 62 unique classes
  Client 13: 37001 train samples, 62 unique classes
  Client 14: 35681 train samples, 62 unique classes
  Client 15: 35453 train samples, 62 unique classes
  Client 16: 36585 train samples, 62 unique classes
  Client 17: 36801 train samples, 62 unique classes
  Client 18: 35964 train samples, 62 unique classes
  Client 19: 36345 train samples, 62 unique classes
Will sample 4500 samples per client per epoch
Graph: erdos, nodes: 20, edges: 99
Degree statistics: avg=9.90, min=7, max=14
Attack: Compromised 2/20 nodes: [5, 13]
Attack type: backdoor, lambda: 1.0
Backdoor target label: 0, trigger size: 4
Model variant: baseline
Model parameters: 6,603,710
UBAR ALGORITHM (Two-Stage Byzantine-resilient)
  - Model dimension: 6,603,710 parameters
  - Rho parameter: 0.9
  - Stage 1: Distance-based filtering (select 90% closest neighbors)
  - Stage 2: Performance-based selection (loss comparison)
  - Complexity: O(deg(i)×d + deg(i)×inference)
Initial test acc across nodes: mean=0.0168 ± 0.0139
Backdoor attack: Created poisoned datasets for 2 compromised nodes
Round 001: test acc mean=0.0538 ± 0.0057 | min=0.0453 max=0.0683
         : test loss mean=3063.8946 ± 9189.5839
         : individual accs = ['0.059593', '0.051630', '0.054643', '0.068313', '0.057932', '0.045253', '0.054615', '0.049207', '0.053209', '0.047463', '0.062756', '0.053899', '0.045688', '0.049083', '0.058490', '0.050633', '0.058271', '0.048291', '0.052889', '0.054506']
         : correct/total = [(246, 4128), (217, 4203), (223, 4081), (296, 4333), (237, 4091), (194, 4287), (229, 4193), (214, 4349), (223, 4191), (203, 4277), (260, 4143), (226, 4193), (187, 4093), (206, 4197), (237, 4052), (204, 4029), (242, 4153), (202, 4183), (216, 4084), (225, 4128)]
         : compromised: 0.0472, honest: 0.0546
         : ubar stats = ['Node 0: s1=0.833, s2=0.900', 'Node 1: s1=0.900, s2=0.667', 'Node 2: s1=0.875, s2=0.143']...
Round 002: test acc mean=0.0551 ± 0.0087 | min=0.0446 max=0.0882
         : test loss mean=1026.3410 ± 3333.9942
         : individual accs = ['0.044574', '0.051630', '0.055134', '0.052850', '0.057932', '0.065080', '0.088242', '0.058174', '0.051062', '0.053776', '0.055998', '0.053899', '0.049597', '0.047177', '0.051826', '0.050633', '0.054418', '0.049486', '0.055583', '0.054506']
         : correct/total = [(184, 4128), (217, 4203), (225, 4081), (229, 4333), (237, 4091), (279, 4287), (370, 4193), (253, 4349), (214, 4191), (230, 4277), (232, 4143), (226, 4193), (203, 4093), (198, 4197), (210, 4052), (204, 4029), (226, 4153), (207, 4183), (227, 4084), (225, 4128)]
         : compromised: 0.0561, honest: 0.0550
         : ubar stats = ['Node 0: s1=0.833, s2=0.950', 'Node 1: s1=0.900, s2=0.444', 'Node 2: s1=0.875, s2=0.429']...
Round 003: test acc mean=0.0563 ± 0.0104 | min=0.0457 max=0.0978
         : test loss mean=16560.2000 ± 68598.6235
         : individual accs = ['0.059593', '0.051630', '0.050723', '0.052850', '0.057932', '0.045720', '0.057000', '0.051276', '0.053209', '0.047463', '0.055998', '0.061770', '0.058637', '0.049083', '0.061204', '0.056342', '0.097761', '0.050203', '0.052889', '0.055475']
         : correct/total = [(246, 4128), (217, 4203), (207, 4081), (229, 4333), (237, 4091), (196, 4287), (239, 4193), (223, 4349), (223, 4191), (203, 4277), (232, 4143), (259, 4193), (240, 4093), (206, 4197), (248, 4052), (227, 4029), (406, 4153), (210, 4183), (216, 4084), (229, 4128)]
         : compromised: 0.0474, honest: 0.0573
         : ubar stats = ['Node 0: s1=0.833, s2=0.933', 'Node 1: s1=0.900, s2=0.333', 'Node 2: s1=0.875, s2=0.476']...
Round 004: test acc mean=0.0543 ± 0.0124 | min=0.0286 max=0.0984
         : test loss mean=2527790405055.2686 ± 8088343915032.9766
         : individual accs = ['0.059593', '0.050916', '0.045087', '0.052850', '0.057932', '0.045253', '0.049130', '0.058174', '0.053209', '0.098433', '0.045619', '0.059385', '0.054239', '0.028592', '0.061204', '0.056590', '0.058271', '0.050920', '0.052889', '0.048450']
         : correct/total = [(246, 4128), (214, 4203), (184, 4081), (229, 4333), (237, 4091), (194, 4287), (206, 4193), (253, 4349), (223, 4191), (421, 4277), (189, 4143), (249, 4193), (222, 4093), (120, 4197), (248, 4052), (228, 4029), (242, 4153), (213, 4183), (216, 4084), (200, 4128)]
         : compromised: 0.0369, honest: 0.0563
         : ubar stats = ['Node 0: s1=0.833, s2=0.850', 'Node 1: s1=0.900, s2=0.278', 'Node 2: s1=0.875, s2=0.393']...
Round 005: test acc mean=0.0550 ± 0.0078 | min=0.0453 max=0.0779
         : test loss mean=nan ± nan
         : individual accs = ['0.059593', '0.046158', '0.060279', '0.052850', '0.057932', '0.045253', '0.057000', '0.047827', '0.047960', '0.053776', '0.055998', '0.070832', '0.077938', '0.049083', '0.051579', '0.054852', '0.051288', '0.050920', '0.052889', '0.055475']
         : correct/total = [(246, 4128), (194, 4203), (246, 4081), (229, 4333), (237, 4091), (194, 4287), (239, 4193), (208, 4349), (201, 4191), (230, 4277), (232, 4143), (297, 4193), (319, 4093), (206, 4197), (209, 4052), (221, 4029), (213, 4153), (213, 4183), (216, 4084), (229, 4128)]
         : compromised: 0.0472, honest: 0.0558
         : ubar stats = ['Node 0: s1=0.833, s2=0.780', 'Node 1: s1=0.900, s2=0.267', 'Node 2: s1=0.875, s2=0.429']...
Round 006: test acc mean=0.0544 ± 0.0039 | min=0.0453 max=0.0612
         : test loss mean=nan ± nan
         : individual accs = ['0.059835', '0.051630', '0.057584', '0.052850', '0.057932', '0.045253', '0.057000', '0.058174', '0.053209', '0.053776', '0.050447', '0.053899', '0.053750', '0.049083', '0.061204', '0.051378', '0.058271', '0.050920', '0.055583', '0.055475']
         : correct/total = [(247, 4128), (217, 4203), (235, 4081), (229, 4333), (237, 4091), (194, 4287), (239, 4193), (253, 4349), (223, 4191), (230, 4277), (209, 4143), (226, 4193), (220, 4093), (206, 4197), (248, 4052), (207, 4029), (242, 4153), (213, 4183), (227, 4084), (229, 4128)]
         : compromised: 0.0472, honest: 0.0552
         : ubar stats = ['Node 0: s1=0.833, s2=0.800', 'Node 1: s1=0.900, s2=0.241', 'Node 2: s1=0.875, s2=0.405']...
Round 007: test acc mean=0.0534 ± 0.0045 | min=0.0435 max=0.0596
         : test loss mean=nan ± nan
         : individual accs = ['0.059593', '0.052344', '0.057584', '0.052850', '0.047421', '0.045253', '0.057000', '0.058174', '0.053209', '0.043488', '0.055998', '0.049606', '0.058637', '0.049083', '0.051826', '0.056590', '0.058271', '0.050920', '0.055583', '0.055475']
         : correct/total = [(246, 4128), (220, 4203), (235, 4081), (229, 4333), (194, 4091), (194, 4287), (239, 4193), (253, 4349), (223, 4191), (186, 4277), (232, 4143), (208, 4193), (240, 4093), (206, 4197), (210, 4052), (228, 4029), (242, 4153), (213, 4183), (227, 4084), (229, 4128)]
         : compromised: 0.0472, honest: 0.0541
         : ubar stats = ['Node 0: s1=0.833, s2=0.700', 'Node 1: s1=0.900, s2=0.333', 'Node 2: s1=0.875, s2=0.469']...
Round 008: test acc mean=0.0528 ± 0.0052 | min=0.0430 max=0.0612
         : test loss mean=nan ± nan
         : individual accs = ['0.059593', '0.046158', '0.050723', '0.043157', '0.043021', '0.045253', '0.057000', '0.051276', '0.053209', '0.053776', '0.055998', '0.053899', '0.058637', '0.049083', '0.061204', '0.056342', '0.055141', '0.050920', '0.055583', '0.055959']
         : correct/total = [(246, 4128), (194, 4203), (207, 4081), (187, 4333), (176, 4091), (194, 4287), (239, 4193), (223, 4349), (223, 4191), (230, 4277), (232, 4143), (226, 4193), (240, 4093), (206, 4197), (248, 4052), (227, 4029), (229, 4153), (213, 4183), (227, 4084), (231, 4128)]
         : compromised: 0.0472, honest: 0.0534
         : ubar stats = ['Node 0: s1=0.833, s2=0.675', 'Node 1: s1=0.900, s2=0.333', 'Node 2: s1=0.875, s2=0.500']...
Round 009: test acc mean=0.0561 ± 0.0124 | min=0.0439 max=0.1013
         : test loss mean=nan ± nan
         : individual accs = ['0.059593', '0.050916', '0.052683', '0.052850', '0.054021', '0.045253', '0.050799', '0.043918', '0.053209', '0.053776', '0.047309', '0.053899', '0.058637', '0.049083', '0.051826', '0.101266', '0.055141', '0.078652', '0.052889', '0.055475']
         : correct/total = [(246, 4128), (214, 4203), (215, 4081), (229, 4333), (221, 4091), (194, 4287), (213, 4193), (191, 4349), (223, 4191), (230, 4277), (196, 4143), (226, 4193), (240, 4093), (206, 4197), (210, 4052), (408, 4029), (229, 4153), (329, 4183), (216, 4084), (229, 4128)]
         : compromised: 0.0472, honest: 0.0570
         : ubar stats = ['Node 0: s1=0.833, s2=0.678', 'Node 1: s1=0.900, s2=0.321', 'Node 2: s1=0.875, s2=0.540']...
Round 010: test acc mean=0.0545 ± 0.0042 | min=0.0453 max=0.0612
         : test loss mean=nan ± nan
         : individual accs = ['0.059593', '0.051630', '0.057584', '0.052850', '0.057932', '0.045253', '0.049130', '0.058174', '0.047960', '0.053776', '0.055998', '0.053899', '0.058637', '0.049083', '0.061204', '0.056342', '0.058271', '0.050920', '0.055583', '0.055475']
         : correct/total = [(246, 4128), (217, 4203), (235, 4081), (229, 4333), (237, 4091), (194, 4287), (206, 4193), (253, 4349), (201, 4191), (230, 4277), (232, 4143), (226, 4193), (240, 4093), (206, 4197), (248, 4052), (227, 4029), (242, 4153), (213, 4183), (227, 4084), (229, 4128)]
         : compromised: 0.0472, honest: 0.0553
         : ubar stats = ['Node 0: s1=0.833, s2=0.670', 'Node 1: s1=0.900, s2=0.311', 'Node 2: s1=0.875, s2=0.586']...

=== FINAL RESULTS ===
Dataset: femnist, Nodes: 20, Graph: erdos, Aggregation: ubar
Attack: backdoor, 10.0% compromised
Final accuracy - Compromised: 0.0472, Honest: 0.0553
Overall test accuracy: mean=0.0545 ± 0.0042

=== BACKDOOR ATTACK SUCCESS RATE (ASR) ===
Target label: 0
Trigger size: 4x4
Overall ASR: 0.1000 ± 0.3000
Honest nodes ASR: 0.0000 ± 0.0000
Compromised nodes ASR: 1.0000 ± 0.0000
Note: Higher ASR indicates more successful backdoor attack

=== UBAR SUMMARY ===
Node 0: stage1=0.833, stage2=0.670, overall=0.558
Node 1: stage1=0.900, stage2=0.311, overall=0.280
Node 2: stage1=0.875, stage2=0.586, overall=0.512
Node 3: stage1=0.857, stage2=0.517, overall=0.443
Node 4: stage1=0.889, stage2=0.575, overall=0.511
Node 5: stage1=0.900, stage2=0.467, overall=0.420
Node 6: stage1=0.833, stage2=0.540, overall=0.450
Node 7: stage1=0.818, stage2=0.611, overall=0.500
Node 8: stage1=0.857, stage2=0.500, overall=0.429
Node 9: stage1=0.818, stage2=0.400, overall=0.327
Node 10: stage1=0.875, stage2=0.386, overall=0.337
Node 11: stage1=0.833, stage2=0.400, overall=0.333
Node 12: stage1=0.833, stage2=0.470, overall=0.392
Node 13: stage1=0.889, stage2=0.562, overall=0.500
Node 14: stage1=0.857, stage2=0.675, overall=0.579
Node 15: stage1=0.889, stage2=0.512, overall=0.456
Node 16: stage1=0.857, stage2=0.467, overall=0.400
Node 17: stage1=0.875, stage2=0.271, overall=0.237
Node 18: stage1=0.833, stage2=0.630, overall=0.525
Node 19: stage1=0.900, stage2=0.533, overall=0.480

=== PARALLEL EXECUTION TIME (realistic for distributed system) ===
  COMMUNICATION (max across nodes):
    - Full model transfer: 0.000s (0.0%)
  COMPUTATION (max across nodes):
    - Distance computation: 0.052s (0.9%)
    - Loss computation: 5.729s (98.9%)
    - Aggregation: 0.012s (0.2%)
  TOTALS:
    - Total computation: 5.793s (100.0%)
    - Total communication: 0.000s (0.0%)
    - Total parallel time: 5.793s

=== PER-NODE AVERAGE TIME ===
  - Distance computation: 0.040s
  - Loss computation: 3.989s
  - Aggregation: 0.008s
  - Model transfer: 0.000s
  - Total per node: 4.036s

=== TOTAL COMPUTATIONAL WORK (sum across all nodes) ===
  - Total distance computation: 0.790s
  - Total loss computation: 79.778s
  - Total aggregation: 0.159s
  - Total model transfer: 0.000s
  - Grand total: 80.728s
  - Mean Stage 1 acceptance rate: 0.861
  - Mean Stage 2 acceptance rate: 0.504
  - Overall acceptance rate: 0.434

UBAR Algorithm Properties:
  - Model dimension: 6,603,710
  - Rho parameter: 0.9
  - Two-stage approach: Distance filtering + loss evaluation
  - Stage 1 selects: 90% of neighbors
  - Stage 2 uses: Training sample loss comparison
  - Theoretical complexity: O(deg(i)×d + deg(i)×inference)
  - Approach: UBAR paper implementation
