Device: cuda
Seed: 987654321
Loading 36 LEAF FEMNIST train files...
LEAF FEMNIST train: 3597 users, 734463 samples
Loading 36 LEAF FEMNIST test files...
LEAF FEMNIST test: 3597 users, 83388 samples
Found 3597 train users, 3597 test users, 3597 common users
User sample counts range: 525 (max) to 17 (min)
Distributed ALL 3597 users across 20 clients
Users per client: 179 (with 17 clients getting +1 user)
Train partition sizes: [36360, 37070, 35957, 38262, 36024, 37732, 36921, 38328, 36867, 37683, 36507, 36915, 36007, 37001, 35681, 35453, 36585, 36801, 35964, 36345]
Test partition sizes: [4128, 4203, 4081, 4333, 4091, 4287, 4193, 4349, 4191, 4277, 4143, 4193, 4093, 4197, 4052, 4029, 4153, 4183, 4084, 4128]
  Client 0: 36360 train samples, 62 unique classes
  Client 1: 37070 train samples, 62 unique classes
  Client 2: 35957 train samples, 62 unique classes
  Client 3: 38262 train samples, 62 unique classes
  Client 4: 36024 train samples, 62 unique classes
  Client 5: 37732 train samples, 62 unique classes
  Client 6: 36921 train samples, 62 unique classes
  Client 7: 38328 train samples, 62 unique classes
  Client 8: 36867 train samples, 62 unique classes
  Client 9: 37683 train samples, 62 unique classes
  Client 10: 36507 train samples, 62 unique classes
  Client 11: 36915 train samples, 62 unique classes
  Client 12: 36007 train samples, 62 unique classes
  Client 13: 37001 train samples, 62 unique classes
  Client 14: 35681 train samples, 62 unique classes
  Client 15: 35453 train samples, 62 unique classes
  Client 16: 36585 train samples, 62 unique classes
  Client 17: 36801 train samples, 62 unique classes
  Client 18: 35964 train samples, 62 unique classes
  Client 19: 36345 train samples, 62 unique classes
Will sample 4500 samples per client per epoch
Graph: ring, nodes: 20, edges: 20
Degree statistics: avg=2.00, min=2, max=2
Attack: Compromised 8/20 nodes: [1, 5, 11, 12, 13, 14, 17, 18]
Attack type: gaussian, lambda: 1.0
Model variant: baseline
Model parameters: 6,603,710
UBAR ALGORITHM (Two-Stage Byzantine-resilient)
  - Model dimension: 6,603,710 parameters
  - Rho parameter: 0.6
  - Stage 1: Distance-based filtering (select 60% closest neighbors)
  - Stage 2: Performance-based selection (loss comparison)
  - Complexity: O(deg(i)×d + deg(i)×inference)
Initial test acc across nodes: mean=0.0168 ± 0.0139
Round 001: test acc mean=0.0467 ± 0.0131 | min=0.0022 max=0.0608
         : test loss mean=88175331.9215 ± 272643160.2284
         : individual accs = ['0.049661', '0.051630', '0.055134', '0.047773', '0.043021', '0.048519', '0.044598', '0.049207', '0.047960', '0.050503', '0.055274', '0.060816', '0.002199', '0.017632', '0.056762', '0.050385', '0.047195', '0.050920', '0.054358', '0.050145']
         : correct/total = [(205, 4128), (217, 4203), (225, 4081), (207, 4333), (176, 4091), (208, 4287), (187, 4193), (214, 4349), (201, 4191), (216, 4277), (229, 4143), (255, 4193), (9, 4093), (74, 4197), (230, 4052), (203, 4029), (196, 4153), (213, 4183), (222, 4084), (207, 4128)]
         : compromised: 0.0429, honest: 0.0492
         : ubar stats = ['Node 0: s1=0.500, s2=1.000', 'Node 1: s1=0.500, s2=1.000', 'Node 2: s1=0.500, s2=1.000']...
Round 002: test acc mean=0.0520 ± 0.0038 | min=0.0456 max=0.0582
         : test loss mean=nan ± nan
         : individual accs = ['0.051599', '0.047109', '0.057584', '0.052850', '0.057932', '0.050618', '0.057000', '0.058174', '0.051062', '0.048398', '0.045619', '0.046983', '0.054239', '0.047177', '0.051826', '0.054852', '0.054418', '0.050920', '0.052889', '0.048450']
         : correct/total = [(213, 4128), (198, 4203), (235, 4081), (229, 4333), (237, 4091), (217, 4287), (239, 4193), (253, 4349), (214, 4191), (207, 4277), (189, 4143), (197, 4193), (222, 4093), (198, 4197), (210, 4052), (221, 4029), (226, 4153), (213, 4183), (216, 4084), (200, 4128)]
         : compromised: 0.0502, honest: 0.0532
         : ubar stats = ['Node 0: s1=0.500, s2=1.000', 'Node 1: s1=0.500, s2=1.000', 'Node 2: s1=0.500, s2=1.000']...
Round 003: test acc mean=0.0568 ± 0.0119 | min=0.0446 max=0.0899
         : test loss mean=nan ± nan
         : individual accs = ['0.059593', '0.051630', '0.089929', '0.086084', '0.057932', '0.050618', '0.044598', '0.049207', '0.051539', '0.047463', '0.055274', '0.053184', '0.054239', '0.047177', '0.048124', '0.056342', '0.055141', '0.050203', '0.072723', '0.055475']
         : correct/total = [(246, 4128), (217, 4203), (367, 4081), (373, 4333), (237, 4091), (217, 4287), (187, 4193), (214, 4349), (216, 4191), (203, 4277), (229, 4143), (223, 4193), (222, 4093), (198, 4197), (195, 4052), (227, 4029), (229, 4153), (210, 4183), (297, 4084), (229, 4128)]
         : compromised: 0.0535, honest: 0.0590
         : ubar stats = ['Node 0: s1=0.500, s2=1.000', 'Node 1: s1=0.500, s2=1.000', 'Node 2: s1=0.500, s2=1.000']...
Round 004: test acc mean=0.0605 ± 0.0155 | min=0.0456 max=0.0974
         : test loss mean=nan ± nan
         : individual accs = ['0.097384', '0.056626', '0.057584', '0.052850', '0.057932', '0.051085', '0.082518', '0.086917', '0.049630', '0.048398', '0.045619', '0.046983', '0.054239', '0.047177', '0.061204', '0.057086', '0.059957', '0.050920', '0.052889', '0.092539']
         : correct/total = [(402, 4128), (238, 4203), (235, 4081), (229, 4333), (237, 4091), (219, 4287), (346, 4193), (378, 4349), (208, 4191), (207, 4277), (189, 4143), (197, 4193), (222, 4093), (198, 4197), (248, 4052), (230, 4029), (249, 4153), (213, 4183), (216, 4084), (382, 4128)]
         : compromised: 0.0526, honest: 0.0657
         : ubar stats = ['Node 0: s1=0.500, s2=1.000', 'Node 1: s1=0.500, s2=1.000', 'Node 2: s1=0.500, s2=1.000']...
Round 005: test acc mean=0.0660 ± 0.0188 | min=0.0467 max=0.1009
         : test loss mean=nan ± nan
         : individual accs = ['0.089874', '0.054247', '0.097035', '0.091392', '0.060132', '0.050618', '0.046745', '0.047827', '0.100931', '0.053776', '0.055998', '0.054853', '0.054239', '0.047177', '0.051579', '0.087863', '0.087166', '0.050920', '0.056317', '0.081638']
         : correct/total = [(371, 4128), (228, 4203), (396, 4081), (396, 4333), (246, 4091), (217, 4287), (196, 4193), (208, 4349), (423, 4191), (230, 4277), (232, 4143), (230, 4193), (222, 4093), (198, 4197), (209, 4052), (354, 4029), (362, 4153), (213, 4183), (230, 4084), (337, 4128)]
         : compromised: 0.0525, honest: 0.0750
         : ubar stats = ['Node 0: s1=0.500, s2=1.000', 'Node 1: s1=0.500, s2=1.000', 'Node 2: s1=0.500, s2=1.000']...
Round 006: test acc mean=0.0583 ± 0.0125 | min=0.0439 max=0.1027
         : test loss mean=nan ± nan
         : individual accs = ['0.077035', '0.052344', '0.057584', '0.052850', '0.058910', '0.051318', '0.043883', '0.053346', '0.053448', '0.054711', '0.052378', '0.061770', '0.054239', '0.047177', '0.102665', '0.056590', '0.058993', '0.050920', '0.055583', '0.071221']
         : correct/total = [(318, 4128), (220, 4203), (235, 4081), (229, 4333), (241, 4091), (220, 4287), (184, 4193), (232, 4349), (224, 4191), (234, 4277), (217, 4143), (259, 4193), (222, 4093), (198, 4197), (416, 4052), (228, 4029), (245, 4153), (213, 4183), (227, 4084), (294, 4128)]
         : compromised: 0.0595, honest: 0.0576
         : ubar stats = ['Node 0: s1=0.500, s2=1.000', 'Node 1: s1=0.500, s2=1.000', 'Node 2: s1=0.500, s2=1.000']...
Round 007: test acc mean=0.0721 ± 0.0294 | min=0.0472 max=0.1410
         : test loss mean=nan ± nan
         : individual accs = ['0.140988', '0.052344', '0.057584', '0.052850', '0.047421', '0.076044', '0.097544', '0.092205', '0.053686', '0.055413', '0.056722', '0.053899', '0.054239', '0.047177', '0.051826', '0.106478', '0.106429', '0.050920', '0.050930', '0.136386']
         : correct/total = [(582, 4128), (220, 4203), (235, 4081), (229, 4333), (194, 4091), (326, 4287), (409, 4193), (401, 4349), (225, 4191), (237, 4277), (235, 4143), (226, 4193), (222, 4093), (198, 4197), (210, 4052), (429, 4029), (442, 4153), (213, 4183), (208, 4084), (563, 4128)]
         : compromised: 0.0547, honest: 0.0836
         : ubar stats = ['Node 0: s1=0.500, s2=1.000', 'Node 1: s1=0.500, s2=1.000', 'Node 2: s1=0.500, s2=1.000']...
Round 008: test acc mean=0.0703 ± 0.0272 | min=0.0472 max=0.1514
         : test loss mean=nan ± nan
         : individual accs = ['0.151405', '0.081370', '0.066650', '0.053081', '0.084087', '0.053884', '0.049130', '0.051276', '0.089955', '0.067103', '0.068791', '0.053899', '0.054239', '0.047177', '0.062192', '0.061554', '0.057308', '0.059527', '0.057052', '0.137112']
         : correct/total = [(625, 4128), (342, 4203), (272, 4081), (230, 4333), (344, 4091), (231, 4287), (206, 4193), (223, 4349), (377, 4191), (287, 4277), (285, 4143), (226, 4193), (222, 4093), (198, 4197), (252, 4052), (248, 4029), (238, 4153), (249, 4183), (233, 4084), (566, 4128)]
         : compromised: 0.0587, honest: 0.0781
         : ubar stats = ['Node 0: s1=0.500, s2=1.000', 'Node 1: s1=0.500, s2=1.000', 'Node 2: s1=0.500, s2=1.000']...
Round 009: test acc mean=0.0676 ± 0.0229 | min=0.0456 max=0.1504
         : test loss mean=nan ± nan
         : individual accs = ['0.061773', '0.150369', '0.057829', '0.052850', '0.070398', '0.076977', '0.070832', '0.059784', '0.060606', '0.048632', '0.045619', '0.054853', '0.054239', '0.047177', '0.051826', '0.087615', '0.085721', '0.086302', '0.073457', '0.055717']
         : correct/total = [(255, 4128), (632, 4203), (236, 4081), (229, 4333), (288, 4091), (330, 4287), (297, 4193), (260, 4349), (254, 4191), (208, 4277), (189, 4143), (230, 4193), (222, 4093), (198, 4197), (210, 4052), (353, 4029), (356, 4153), (361, 4183), (300, 4084), (230, 4128)]
         : compromised: 0.0744, honest: 0.0631
         : ubar stats = ['Node 0: s1=0.500, s2=1.000', 'Node 1: s1=0.500, s2=1.000', 'Node 2: s1=0.500, s2=1.000']...
Round 010: test acc mean=0.0729 ± 0.0210 | min=0.0491 max=0.1330
         : test loss mean=nan ± nan
         : individual accs = ['0.104167', '0.090887', '0.059789', '0.056543', '0.059154', '0.132960', '0.055092', '0.058634', '0.053448', '0.053776', '0.055998', '0.079180', '0.054239', '0.049083', '0.076999', '0.078431', '0.081869', '0.083911', '0.079334', '0.095203']
         : correct/total = [(430, 4128), (382, 4203), (244, 4081), (245, 4333), (242, 4091), (570, 4287), (231, 4193), (255, 4349), (224, 4191), (230, 4277), (232, 4143), (332, 4193), (222, 4093), (206, 4197), (312, 4052), (316, 4029), (340, 4153), (351, 4183), (324, 4084), (393, 4128)]
         : compromised: 0.0808, honest: 0.0677
         : ubar stats = ['Node 0: s1=0.500, s2=1.000', 'Node 1: s1=0.500, s2=1.000', 'Node 2: s1=0.500, s2=1.000']...

=== FINAL RESULTS ===
Dataset: femnist, Nodes: 20, Graph: ring, Aggregation: ubar
Attack: gaussian, 40.0% compromised
Final accuracy - Compromised: 0.0808, Honest: 0.0677
Overall test accuracy: mean=0.0729 ± 0.0210

=== UBAR SUMMARY ===
Node 0: stage1=0.500, stage2=1.000, overall=0.500
Node 1: stage1=0.500, stage2=1.000, overall=0.500
Node 2: stage1=0.500, stage2=1.000, overall=0.500
Node 3: stage1=0.500, stage2=1.000, overall=0.500
Node 4: stage1=0.500, stage2=1.000, overall=0.500
Node 5: stage1=0.500, stage2=1.000, overall=0.500
Node 6: stage1=0.500, stage2=1.000, overall=0.500
Node 7: stage1=0.500, stage2=1.000, overall=0.500
Node 8: stage1=0.500, stage2=1.000, overall=0.500
Node 9: stage1=0.500, stage2=1.000, overall=0.500
Node 10: stage1=0.500, stage2=1.000, overall=0.500
Node 11: stage1=0.500, stage2=1.000, overall=0.500
Node 12: stage1=0.500, stage2=1.000, overall=0.500
Node 13: stage1=0.500, stage2=1.000, overall=0.500
Node 14: stage1=0.500, stage2=1.000, overall=0.500
Node 15: stage1=0.500, stage2=1.000, overall=0.500
Node 16: stage1=0.500, stage2=1.000, overall=0.500
Node 17: stage1=0.500, stage2=1.000, overall=0.500
Node 18: stage1=0.500, stage2=1.000, overall=0.500
Node 19: stage1=0.500, stage2=1.000, overall=0.500

=== PARALLEL EXECUTION TIME (realistic for distributed system) ===
  COMMUNICATION (max across nodes):
    - Full model transfer: 0.000s (0.0%)
  COMPUTATION (max across nodes):
    - Distance computation: 0.021s (0.5%)
    - Loss computation: 4.196s (99.1%)
    - Aggregation: 0.018s (0.4%)
  TOTALS:
    - Total computation: 4.235s (100.0%)
    - Total communication: 0.000s (0.0%)
    - Total parallel time: 4.235s

=== PER-NODE AVERAGE TIME ===
  - Distance computation: 0.011s
  - Loss computation: 3.964s
  - Aggregation: 0.007s
  - Model transfer: 0.000s
  - Total per node: 3.982s

=== TOTAL COMPUTATIONAL WORK (sum across all nodes) ===
  - Total distance computation: 0.214s
  - Total loss computation: 79.279s
  - Total aggregation: 0.149s
  - Total model transfer: 0.000s
  - Grand total: 79.642s
  - Mean Stage 1 acceptance rate: 0.500
  - Mean Stage 2 acceptance rate: 1.000
  - Overall acceptance rate: 0.500

UBAR Algorithm Properties:
  - Model dimension: 6,603,710
  - Rho parameter: 0.6
  - Two-stage approach: Distance filtering + loss evaluation
  - Stage 1 selects: 60% of neighbors
  - Stage 2 uses: Training sample loss comparison
  - Theoretical complexity: O(deg(i)×d + deg(i)×inference)
  - Approach: UBAR paper implementation
