Device: cuda
Seed: 987654321
Loading 36 LEAF FEMNIST train files...
LEAF FEMNIST train: 3597 users, 734463 samples
Loading 36 LEAF FEMNIST test files...
LEAF FEMNIST test: 3597 users, 83388 samples
Found 3597 train users, 3597 test users, 3597 common users
User sample counts range: 525 (max) to 17 (min)
Distributed ALL 3597 users across 20 clients
Users per client: 179 (with 17 clients getting +1 user)
Train partition sizes: [36360, 37070, 35957, 38262, 36024, 37732, 36921, 38328, 36867, 37683, 36507, 36915, 36007, 37001, 35681, 35453, 36585, 36801, 35964, 36345]
Test partition sizes: [4128, 4203, 4081, 4333, 4091, 4287, 4193, 4349, 4191, 4277, 4143, 4193, 4093, 4197, 4052, 4029, 4153, 4183, 4084, 4128]
  Client 0: 36360 train samples, 62 unique classes
  Client 1: 37070 train samples, 62 unique classes
  Client 2: 35957 train samples, 62 unique classes
  Client 3: 38262 train samples, 62 unique classes
  Client 4: 36024 train samples, 62 unique classes
  Client 5: 37732 train samples, 62 unique classes
  Client 6: 36921 train samples, 62 unique classes
  Client 7: 38328 train samples, 62 unique classes
  Client 8: 36867 train samples, 62 unique classes
  Client 9: 37683 train samples, 62 unique classes
  Client 10: 36507 train samples, 62 unique classes
  Client 11: 36915 train samples, 62 unique classes
  Client 12: 36007 train samples, 62 unique classes
  Client 13: 37001 train samples, 62 unique classes
  Client 14: 35681 train samples, 62 unique classes
  Client 15: 35453 train samples, 62 unique classes
  Client 16: 36585 train samples, 62 unique classes
  Client 17: 36801 train samples, 62 unique classes
  Client 18: 35964 train samples, 62 unique classes
  Client 19: 36345 train samples, 62 unique classes
Will sample 4500 samples per client per epoch
Graph: erdos, nodes: 20, edges: 99
Degree statistics: avg=9.90, min=7, max=14
Attack: Compromised 14/20 nodes: [1, 2, 3, 5, 6, 8, 11, 12, 13, 14, 15, 17, 18, 19]
Attack type: backdoor, lambda: 1.0
Backdoor target label: 0, trigger size: 4
Model variant: baseline
Model parameters: 6,603,710
Initial test acc across nodes: mean=0.0168 ± 0.0139
Backdoor attack: Created poisoned datasets for 14 compromised nodes
Round 001: test acc mean=0.0169 ± 0.0172 | min=0.0032 max=0.0564
         : test loss mean=90730.9553 ± 62548.2942
         : individual accs = ['0.013324', '0.052344', '0.056359', '0.008078', '0.004644', '0.003499', '0.003577', '0.006898', '0.014078', '0.044657', '0.004586', '0.007870', '0.005619', '0.045032', '0.019497', '0.003227', '0.005538', '0.015778', '0.004652', '0.019138']
         : correct/total = [(55, 4128), (220, 4203), (230, 4081), (35, 4333), (19, 4091), (15, 4287), (15, 4193), (30, 4349), (59, 4191), (191, 4277), (19, 4143), (33, 4193), (23, 4093), (189, 4197), (79, 4052), (13, 4029), (23, 4153), (66, 4183), (19, 4084), (79, 4128)]
         : compromised: 0.0185, honest: 0.0133
Round 002: test acc mean=0.0501 ± 0.0042 | min=0.0417 max=0.0624
         : test loss mean=212040242.9711 ± 790014352.1313
         : individual accs = ['0.049176', '0.048775', '0.055134', '0.048465', '0.047421', '0.048519', '0.049130', '0.051276', '0.051539', '0.047229', '0.050447', '0.053184', '0.050818', '0.062426', '0.046644', '0.041698', '0.049362', '0.045900', '0.055583', '0.048450']
         : correct/total = [(203, 4128), (205, 4203), (225, 4081), (210, 4333), (194, 4091), (208, 4287), (206, 4193), (223, 4349), (216, 4191), (202, 4277), (209, 4143), (223, 4193), (208, 4093), (262, 4197), (189, 4052), (168, 4029), (205, 4153), (192, 4183), (227, 4084), (200, 4128)]
         : compromised: 0.0504, honest: 0.0492
Round 003: test acc mean=0.0346 ± 0.0169 | min=0.0117 max=0.0539
         : test loss mean=5927.1300 ± 2052.4513
         : individual accs = ['0.013808', '0.015941', '0.012742', '0.044773', '0.012955', '0.048752', '0.048891', '0.045528', '0.051539', '0.014730', '0.047309', '0.014787', '0.049597', '0.049559', '0.046397', '0.053860', '0.044546', '0.011714', '0.015671', '0.048692']
         : correct/total = [(57, 4128), (67, 4203), (52, 4081), (194, 4333), (53, 4091), (209, 4287), (205, 4193), (198, 4349), (216, 4191), (63, 4277), (196, 4143), (62, 4193), (203, 4093), (208, 4197), (188, 4052), (217, 4029), (185, 4153), (49, 4183), (64, 4084), (201, 4128)]
         : compromised: 0.0366, honest: 0.0298
Round 004: test acc mean=0.0232 ± 0.0141 | min=0.0117 max=0.0488
         : test loss mean=802.7348 ± 439.7468
         : individual accs = ['0.013808', '0.015941', '0.012742', '0.019617', '0.012955', '0.048752', '0.013356', '0.014486', '0.015032', '0.014730', '0.019792', '0.045314', '0.017102', '0.045747', '0.016782', '0.013403', '0.016374', '0.011714', '0.048482', '0.048692']
         : correct/total = [(57, 4128), (67, 4203), (52, 4081), (85, 4333), (53, 4091), (209, 4287), (56, 4193), (63, 4349), (63, 4191), (63, 4277), (82, 4143), (190, 4193), (70, 4093), (192, 4197), (68, 4052), (54, 4029), (68, 4153), (49, 4183), (198, 4084), (201, 4128)]
         : compromised: 0.0266, honest: 0.0154
Round 005: test acc mean=0.0219 ± 0.0088 | min=0.0121 max=0.0433
         : test loss mean=66.9826 ± 59.6466
         : individual accs = ['0.027132', '0.032834', '0.012742', '0.019617', '0.043266', '0.014462', '0.013356', '0.014486', '0.015032', '0.033668', '0.012069', '0.014787', '0.026142', '0.014058', '0.025913', '0.028295', '0.030821', '0.028927', '0.015671', '0.015504']
         : correct/total = [(112, 4128), (138, 4203), (52, 4081), (85, 4333), (177, 4091), (62, 4287), (56, 4193), (63, 4349), (63, 4191), (144, 4277), (50, 4143), (62, 4193), (107, 4093), (59, 4197), (105, 4052), (114, 4029), (128, 4153), (121, 4183), (64, 4084), (64, 4128)]
         : compromised: 0.0198, honest: 0.0269
Round 006: test acc mean=0.0446 ± 0.0105 | min=0.0141 max=0.0526
         : test loss mean=16.4483 ± 15.7778
         : individual accs = ['0.050145', '0.049726', '0.048763', '0.043388', '0.052554', '0.052484', '0.042213', '0.049207', '0.015032', '0.048398', '0.045619', '0.046983', '0.050574', '0.014058', '0.046644', '0.050633', '0.040693', '0.048291', '0.051665', '0.044331']
         : correct/total = [(207, 4128), (209, 4203), (199, 4081), (188, 4333), (215, 4091), (225, 4287), (177, 4193), (214, 4349), (63, 4191), (207, 4277), (189, 4143), (197, 4193), (207, 4093), (59, 4197), (189, 4052), (204, 4029), (169, 4153), (202, 4183), (211, 4084), (183, 4128)]
         : compromised: 0.0432, honest: 0.0478
Round 007: test acc mean=0.0494 ± 0.0089 | min=0.0141 max=0.0578
         : test loss mean=66.8507 ± 12.6432
         : individual accs = ['0.049176', '0.047109', '0.055134', '0.047773', '0.044977', '0.057849', '0.053899', '0.043918', '0.051539', '0.047463', '0.055274', '0.053184', '0.049841', '0.014058', '0.051579', '0.054852', '0.054418', '0.053311', '0.052155', '0.050388']
         : correct/total = [(203, 4128), (198, 4203), (225, 4081), (207, 4333), (184, 4091), (248, 4287), (226, 4193), (191, 4349), (216, 4191), (203, 4277), (229, 4143), (223, 4193), (204, 4093), (59, 4197), (209, 4052), (221, 4029), (226, 4153), (223, 4183), (213, 4084), (208, 4128)]
         : compromised: 0.0495, honest: 0.0492
Round 008: test acc mean=0.0457 ± 0.0107 | min=0.0141 max=0.0527
         : test loss mean=6.1574 ± 4.5601
         : individual accs = ['0.050145', '0.049726', '0.052683', '0.043388', '0.052554', '0.052484', '0.044598', '0.049207', '0.015032', '0.048398', '0.045619', '0.046983', '0.050574', '0.014058', '0.051826', '0.050633', '0.051288', '0.048291', '0.051665', '0.045058']
         : correct/total = [(207, 4128), (209, 4203), (215, 4081), (188, 4333), (215, 4091), (225, 4287), (187, 4193), (214, 4349), (63, 4191), (207, 4277), (189, 4143), (197, 4193), (207, 4093), (59, 4197), (210, 4052), (204, 4029), (213, 4153), (202, 4183), (211, 4084), (186, 4128)]
         : compromised: 0.0441, honest: 0.0495
Round 009: test acc mean=0.0496 ± 0.0030 | min=0.0434 max=0.0553
         : test loss mean=4.4070 ± 1.1139
         : individual accs = ['0.050145', '0.049726', '0.052683', '0.043388', '0.052554', '0.052484', '0.044598', '0.049207', '0.051062', '0.048398', '0.045619', '0.046983', '0.050574', '0.055278', '0.051826', '0.050633', '0.051288', '0.048291', '0.051665', '0.045058']
         : correct/total = [(207, 4128), (209, 4203), (215, 4081), (188, 4333), (215, 4091), (225, 4287), (187, 4193), (214, 4349), (214, 4191), (207, 4277), (189, 4143), (197, 4193), (207, 4093), (232, 4197), (210, 4052), (204, 4029), (213, 4153), (202, 4183), (211, 4084), (186, 4128)]
         : compromised: 0.0496, honest: 0.0495
Round 010: test acc mean=0.0416 ± 0.0113 | min=0.0161 max=0.0545
         : test loss mean=5.4673 ± 4.8622
         : individual accs = ['0.045785', '0.042589', '0.048763', '0.018925', '0.016133', '0.045253', '0.050799', '0.041619', '0.049630', '0.026420', '0.051171', '0.049606', '0.050818', '0.045747', '0.046644', '0.041698', '0.040693', '0.019842', '0.045788', '0.054506']
         : correct/total = [(189, 4128), (179, 4203), (199, 4081), (82, 4333), (66, 4091), (194, 4287), (213, 4193), (181, 4349), (208, 4191), (113, 4277), (212, 4143), (208, 4193), (208, 4093), (192, 4197), (189, 4052), (168, 4029), (169, 4153), (83, 4183), (187, 4084), (225, 4128)]
         : compromised: 0.0436, honest: 0.0370

=== FINAL RESULTS ===
Dataset: femnist, Nodes: 20, Graph: erdos, Aggregation: krum
Attack: backdoor, 70.0% compromised
Final accuracy - Compromised: 0.0436, Honest: 0.0370
Overall test accuracy: mean=0.0416 ± 0.0113

=== BACKDOOR ATTACK SUCCESS RATE (ASR) ===
Target label: 0
Trigger size: 4x4
Overall ASR: 0.2500 ± 0.4330
Honest nodes ASR: 0.0000 ± 0.0000
Compromised nodes ASR: 0.3571 ± 0.4792
Note: Higher ASR indicates more successful backdoor attack
