Device: cuda
Seed: 987654321
Loading 36 LEAF FEMNIST train files...
LEAF FEMNIST train: 3597 users, 734463 samples
Loading 36 LEAF FEMNIST test files...
LEAF FEMNIST test: 3597 users, 83388 samples
Found 3597 train users, 3597 test users, 3597 common users
User sample counts range: 525 (max) to 17 (min)
Distributed ALL 3597 users across 20 clients
Users per client: 179 (with 17 clients getting +1 user)
Train partition sizes: [36360, 37070, 35957, 38262, 36024, 37732, 36921, 38328, 36867, 37683, 36507, 36915, 36007, 37001, 35681, 35453, 36585, 36801, 35964, 36345]
Test partition sizes: [4128, 4203, 4081, 4333, 4091, 4287, 4193, 4349, 4191, 4277, 4143, 4193, 4093, 4197, 4052, 4029, 4153, 4183, 4084, 4128]
  Client 0: 36360 train samples, 62 unique classes
  Client 1: 37070 train samples, 62 unique classes
  Client 2: 35957 train samples, 62 unique classes
  Client 3: 38262 train samples, 62 unique classes
  Client 4: 36024 train samples, 62 unique classes
  Client 5: 37732 train samples, 62 unique classes
  Client 6: 36921 train samples, 62 unique classes
  Client 7: 38328 train samples, 62 unique classes
  Client 8: 36867 train samples, 62 unique classes
  Client 9: 37683 train samples, 62 unique classes
  Client 10: 36507 train samples, 62 unique classes
  Client 11: 36915 train samples, 62 unique classes
  Client 12: 36007 train samples, 62 unique classes
  Client 13: 37001 train samples, 62 unique classes
  Client 14: 35681 train samples, 62 unique classes
  Client 15: 35453 train samples, 62 unique classes
  Client 16: 36585 train samples, 62 unique classes
  Client 17: 36801 train samples, 62 unique classes
  Client 18: 35964 train samples, 62 unique classes
  Client 19: 36345 train samples, 62 unique classes
Will sample 4500 samples per client per epoch
Graph: erdos, nodes: 20, edges: 126
Degree statistics: avg=12.60, min=8, max=16
Attack: Compromised 12/20 nodes: [1, 2, 3, 5, 8, 11, 12, 13, 14, 15, 17, 18]
Attack type: directed_deviation, lambda: 1.0
Model variant: baseline
Model parameters: 6,603,710
Initial test acc across nodes: mean=0.0168 ± 0.0139
Round 001: test acc mean=0.0195 ± 0.0186 | min=0.0023 max=0.0576
         : test loss mean=39475.8569 ± 21024.3632
         : individual accs = ['0.005814', '0.049964', '0.057584', '0.023540', '0.005133', '0.003499', '0.016456', '0.004139', '0.009306', '0.002338', '0.010862', '0.004770', '0.003176', '0.045032', '0.019497', '0.041698', '0.005538', '0.028448', '0.050930', '0.002907']
         : correct/total = [(24, 4128), (210, 4203), (235, 4081), (102, 4333), (21, 4091), (15, 4287), (69, 4193), (18, 4349), (39, 4191), (10, 4277), (45, 4143), (20, 4193), (13, 4093), (189, 4197), (79, 4052), (168, 4029), (23, 4153), (119, 4183), (208, 4084), (12, 4128)]
         : compromised: 0.0281, honest: 0.0066
Round 002: test acc mean=0.0490 ± 0.0041 | min=0.0383 max=0.0560
         : test loss mean=6363.8575 ± 2619.4880
         : individual accs = ['0.049176', '0.047109', '0.048272', '0.038311', '0.044977', '0.048752', '0.046745', '0.045528', '0.054880', '0.047463', '0.055998', '0.045314', '0.049841', '0.046462', '0.051579', '0.054852', '0.049362', '0.053311', '0.052155', '0.050388']
         : correct/total = [(203, 4128), (198, 4203), (197, 4081), (166, 4333), (184, 4091), (209, 4287), (196, 4193), (198, 4349), (230, 4191), (203, 4277), (232, 4143), (190, 4193), (204, 4093), (195, 4197), (209, 4052), (221, 4029), (205, 4153), (223, 4183), (213, 4084), (208, 4128)]
         : compromised: 0.0492, honest: 0.0487
Round 003: test acc mean=0.0510 ± 0.0038 | min=0.0439 max=0.0578
         : test loss mean=10086.3884 ± 3954.0376
         : individual accs = ['0.049176', '0.047109', '0.055134', '0.047773', '0.044977', '0.057849', '0.053899', '0.043918', '0.051539', '0.047463', '0.055274', '0.053184', '0.049841', '0.045747', '0.051579', '0.054852', '0.054418', '0.053311', '0.052155', '0.050388']
         : correct/total = [(203, 4128), (198, 4203), (225, 4081), (207, 4333), (184, 4091), (248, 4287), (226, 4193), (191, 4349), (216, 4191), (203, 4277), (229, 4143), (223, 4193), (204, 4093), (192, 4197), (209, 4052), (221, 4029), (226, 4153), (223, 4183), (213, 4084), (208, 4128)]
         : compromised: 0.0517, honest: 0.0499
Round 004: test acc mean=0.0487 ± 0.0054 | min=0.0369 max=0.0551
         : test loss mean=1508.8558 ± 946.6102
         : individual accs = ['0.049176', '0.047109', '0.055134', '0.038311', '0.044977', '0.036856', '0.053899', '0.043918', '0.051539', '0.047463', '0.039585', '0.053184', '0.049841', '0.045747', '0.051579', '0.054852', '0.054418', '0.053311', '0.052155', '0.050388']
         : correct/total = [(203, 4128), (198, 4203), (225, 4081), (166, 4333), (184, 4091), (158, 4287), (226, 4193), (191, 4349), (216, 4191), (203, 4277), (164, 4143), (223, 4193), (204, 4093), (192, 4197), (209, 4052), (221, 4029), (226, 4153), (223, 4183), (213, 4084), (208, 4128)]
         : compromised: 0.0491, honest: 0.0480
Round 005: test acc mean=0.0394 ± 0.0077 | min=0.0303 max=0.0578
         : test loss mean=287.5363 ± 373.0445
         : individual accs = ['0.030523', '0.034737', '0.035531', '0.040157', '0.042288', '0.057849', '0.053899', '0.043918', '0.037700', '0.039280', '0.036688', '0.053184', '0.033716', '0.045747', '0.037759', '0.032266', '0.030340', '0.037533', '0.033301', '0.032219']
         : correct/total = [(126, 4128), (146, 4203), (145, 4081), (174, 4333), (173, 4091), (248, 4287), (226, 4193), (191, 4349), (158, 4191), (168, 4277), (152, 4143), (223, 4193), (138, 4093), (192, 4197), (153, 4052), (130, 4029), (126, 4153), (157, 4183), (136, 4084), (133, 4128)]
         : compromised: 0.0400, honest: 0.0386
Round 006: test acc mean=0.0350 ± 0.0046 | min=0.0250 max=0.0423
         : test loss mean=48.9846 ± 14.6056
         : individual accs = ['0.030523', '0.034737', '0.024994', '0.040157', '0.042288', '0.038955', '0.033389', '0.041389', '0.034359', '0.039280', '0.036688', '0.028142', '0.033716', '0.028592', '0.037759', '0.032266', '0.040212', '0.037533', '0.033301', '0.032219']
         : correct/total = [(126, 4128), (146, 4203), (102, 4081), (174, 4333), (173, 4091), (167, 4287), (140, 4193), (180, 4349), (144, 4191), (168, 4277), (152, 4143), (118, 4193), (138, 4093), (120, 4197), (153, 4052), (130, 4029), (167, 4153), (157, 4183), (136, 4084), (133, 4128)]
         : compromised: 0.0337, honest: 0.0370
Round 007: test acc mean=0.0354 ± 0.0052 | min=0.0250 max=0.0459
         : test loss mean=19.4456 ± 7.0696
         : individual accs = ['0.030523', '0.034737', '0.024994', '0.040157', '0.042288', '0.038955', '0.033389', '0.041389', '0.034359', '0.039280', '0.036688', '0.028142', '0.033716', '0.028592', '0.037759', '0.032266', '0.040212', '0.045900', '0.033301', '0.032219']
         : correct/total = [(126, 4128), (146, 4203), (102, 4081), (174, 4333), (173, 4091), (167, 4287), (140, 4193), (180, 4349), (144, 4191), (168, 4277), (152, 4143), (118, 4193), (138, 4093), (120, 4197), (153, 4052), (130, 4029), (167, 4153), (192, 4183), (136, 4084), (133, 4128)]
         : compromised: 0.0344, honest: 0.0370
Round 008: test acc mean=0.0481 ± 0.0039 | min=0.0416 max=0.0538
         : test loss mean=5.1974 ± 4.6110
         : individual accs = ['0.051599', '0.051630', '0.048763', '0.048465', '0.051088', '0.047352', '0.042213', '0.041619', '0.044619', '0.053075', '0.050447', '0.041736', '0.053750', '0.049559', '0.046644', '0.041698', '0.047195', '0.050203', '0.052889', '0.048450']
         : correct/total = [(213, 4128), (217, 4203), (199, 4081), (210, 4333), (209, 4091), (203, 4287), (177, 4193), (181, 4349), (187, 4191), (227, 4277), (209, 4143), (175, 4193), (220, 4093), (208, 4197), (189, 4052), (168, 4029), (196, 4153), (210, 4183), (216, 4084), (200, 4128)]
         : compromised: 0.0481, honest: 0.0482
Round 009: test acc mean=0.0477 ± 0.0031 | min=0.0430 max=0.0542
         : test loss mean=4.6444 ± 2.6079
         : individual accs = ['0.050145', '0.048775', '0.045087', '0.044773', '0.043021', '0.048752', '0.048891', '0.045528', '0.051539', '0.043488', '0.048033', '0.045314', '0.054239', '0.045747', '0.046397', '0.053860', '0.044546', '0.049486', '0.048482', '0.048692']
         : correct/total = [(207, 4128), (205, 4203), (184, 4081), (194, 4333), (176, 4091), (209, 4287), (205, 4193), (198, 4349), (216, 4191), (186, 4277), (199, 4143), (190, 4193), (222, 4093), (192, 4197), (188, 4052), (217, 4029), (185, 4153), (207, 4183), (198, 4084), (201, 4128)]
         : compromised: 0.0485, honest: 0.0465
Round 010: test acc mean=0.0480 ± 0.0039 | min=0.0416 max=0.0538
         : test loss mean=5.0738 ± 4.5365
         : individual accs = ['0.051599', '0.051630', '0.048763', '0.048465', '0.051088', '0.047352', '0.042213', '0.041619', '0.044619', '0.053075', '0.050447', '0.041736', '0.053750', '0.049559', '0.048124', '0.041698', '0.047195', '0.045900', '0.052889', '0.048450']
         : correct/total = [(213, 4128), (217, 4203), (199, 4081), (210, 4333), (209, 4091), (203, 4287), (177, 4193), (181, 4349), (187, 4191), (227, 4277), (209, 4143), (175, 4193), (220, 4093), (208, 4197), (195, 4052), (168, 4029), (196, 4153), (192, 4183), (216, 4084), (200, 4128)]
         : compromised: 0.0479, honest: 0.0482

=== FINAL RESULTS ===
Dataset: femnist, Nodes: 20, Graph: erdos, Aggregation: krum
Attack: directed_deviation, 60.0% compromised
Final accuracy - Compromised: 0.0479, Honest: 0.0482
Overall test accuracy: mean=0.0480 ± 0.0039
