Device: cuda
Seed: 987654321
Loading 36 LEAF FEMNIST train files...
LEAF FEMNIST train: 3597 users, 734463 samples
Loading 36 LEAF FEMNIST test files...
LEAF FEMNIST test: 3597 users, 83388 samples
Found 3597 train users, 3597 test users, 3597 common users
User sample counts range: 525 (max) to 17 (min)
Distributed ALL 3597 users across 20 clients
Users per client: 179 (with 17 clients getting +1 user)
Train partition sizes: [36360, 37070, 35957, 38262, 36024, 37732, 36921, 38328, 36867, 37683, 36507, 36915, 36007, 37001, 35681, 35453, 36585, 36801, 35964, 36345]
Test partition sizes: [4128, 4203, 4081, 4333, 4091, 4287, 4193, 4349, 4191, 4277, 4143, 4193, 4093, 4197, 4052, 4029, 4153, 4183, 4084, 4128]
  Client 0: 36360 train samples, 62 unique classes
  Client 1: 37070 train samples, 62 unique classes
  Client 2: 35957 train samples, 62 unique classes
  Client 3: 38262 train samples, 62 unique classes
  Client 4: 36024 train samples, 62 unique classes
  Client 5: 37732 train samples, 62 unique classes
  Client 6: 36921 train samples, 62 unique classes
  Client 7: 38328 train samples, 62 unique classes
  Client 8: 36867 train samples, 62 unique classes
  Client 9: 37683 train samples, 62 unique classes
  Client 10: 36507 train samples, 62 unique classes
  Client 11: 36915 train samples, 62 unique classes
  Client 12: 36007 train samples, 62 unique classes
  Client 13: 37001 train samples, 62 unique classes
  Client 14: 35681 train samples, 62 unique classes
  Client 15: 35453 train samples, 62 unique classes
  Client 16: 36585 train samples, 62 unique classes
  Client 17: 36801 train samples, 62 unique classes
  Client 18: 35964 train samples, 62 unique classes
  Client 19: 36345 train samples, 62 unique classes
Will sample 4500 samples per client per epoch
Graph: erdos, nodes: 20, edges: 48
Degree statistics: avg=4.80, min=2, max=7
Attack: Compromised 2/20 nodes: [5, 13]
Attack type: backdoor, lambda: 1.0
Backdoor target label: 0, trigger size: 4
Model variant: baseline
Model parameters: 6,603,710
Initial test acc across nodes: mean=0.0168 ± 0.0139
Backdoor attack: Created poisoned datasets for 2 compromised nodes
Round 001: test acc mean=0.0428 ± 0.0190 | min=0.0044 max=0.0727
         : test loss mean=227.9379 ± 374.4668
         : individual accs = ['0.044574', '0.052344', '0.054889', '0.005539', '0.057932', '0.004432', '0.046745', '0.072660', '0.053209', '0.053776', '0.048033', '0.045314', '0.020034', '0.024065', '0.046644', '0.050633', '0.058271', '0.007650', '0.055583', '0.054506']
         : correct/total = [(184, 4128), (220, 4203), (224, 4081), (24, 4333), (237, 4091), (19, 4287), (196, 4193), (316, 4349), (223, 4191), (230, 4277), (199, 4143), (190, 4193), (82, 4093), (101, 4197), (189, 4052), (204, 4029), (242, 4153), (32, 4183), (227, 4084), (225, 4128)]
         : compromised: 0.0142, honest: 0.0460
Round 002: test acc mean=0.0346 ± 0.0204 | min=0.0023 max=0.0570
         : test loss mean=7756.8463 ± 17636.0015
         : individual accs = ['0.044574', '0.046158', '0.050723', '0.024694', '0.048643', '0.022160', '0.057000', '0.002299', '0.053209', '0.047463', '0.045619', '0.054376', '0.003909', '0.024065', '0.003208', '0.003971', '0.055141', '0.004781', '0.050196', '0.050388']
         : correct/total = [(184, 4128), (194, 4203), (207, 4081), (107, 4333), (199, 4091), (95, 4287), (239, 4193), (10, 4349), (223, 4191), (203, 4277), (189, 4143), (228, 4193), (16, 4093), (101, 4197), (13, 4052), (16, 4029), (229, 4153), (20, 4183), (205, 4084), (208, 4128)]
         : compromised: 0.0231, honest: 0.0359
Round 003: test acc mean=0.0458 ± 0.0089 | min=0.0286 max=0.0596
         : test loss mean=6.7452 ± 5.8639
         : individual accs = ['0.059593', '0.052344', '0.050723', '0.048234', '0.051088', '0.038955', '0.057000', '0.041389', '0.042233', '0.053776', '0.055998', '0.049606', '0.033716', '0.028592', '0.037759', '0.032266', '0.040212', '0.037533', '0.055583', '0.048450']
         : correct/total = [(246, 4128), (220, 4203), (207, 4081), (209, 4333), (209, 4091), (167, 4287), (239, 4193), (180, 4349), (177, 4191), (230, 4277), (232, 4143), (208, 4193), (138, 4093), (120, 4197), (153, 4052), (130, 4029), (167, 4153), (157, 4183), (227, 4084), (200, 4128)]
         : compromised: 0.0338, honest: 0.0471
Round 004: test acc mean=0.0407 ± 0.0131 | min=0.0035 max=0.0545
         : test loss mean=18932.5133 ± 78354.9842
         : individual accs = ['0.050145', '0.046158', '0.048272', '0.003462', '0.045710', '0.038955', '0.046745', '0.025063', '0.053209', '0.048398', '0.041999', '0.049606', '0.052040', '0.028592', '0.045656', '0.022834', '0.040212', '0.021516', '0.050930', '0.054506']
         : correct/total = [(207, 4128), (194, 4203), (197, 4081), (15, 4333), (187, 4091), (167, 4287), (196, 4193), (109, 4349), (223, 4191), (207, 4277), (174, 4143), (208, 4193), (213, 4093), (120, 4197), (185, 4052), (92, 4029), (167, 4153), (90, 4183), (208, 4084), (225, 4128)]
         : compromised: 0.0338, honest: 0.0415
Round 005: test acc mean=0.0495 ± 0.0054 | min=0.0369 max=0.0618
         : test loss mean=7.5061 ± 5.8455
         : individual accs = ['0.051599', '0.050202', '0.048272', '0.048465', '0.045710', '0.036856', '0.046745', '0.051276', '0.049630', '0.053075', '0.050447', '0.061770', '0.053750', '0.037408', '0.048124', '0.056342', '0.049362', '0.050203', '0.052889', '0.048450']
         : correct/total = [(213, 4128), (211, 4203), (197, 4081), (210, 4333), (187, 4091), (158, 4287), (196, 4193), (223, 4349), (208, 4191), (227, 4277), (209, 4143), (259, 4193), (220, 4093), (157, 4197), (195, 4052), (227, 4029), (205, 4153), (210, 4183), (216, 4084), (200, 4128)]
         : compromised: 0.0371, honest: 0.0509
Round 006: test acc mean=0.0491 ± 0.0037 | min=0.0432 max=0.0553
         : test loss mean=6.0715 ± 4.0828
         : individual accs = ['0.049176', '0.047109', '0.055134', '0.043157', '0.044977', '0.043387', '0.053899', '0.045068', '0.047960', '0.047463', '0.055274', '0.049606', '0.045688', '0.046938', '0.050346', '0.051378', '0.054418', '0.049486', '0.052155', '0.048450']
         : correct/total = [(203, 4128), (198, 4203), (225, 4081), (187, 4333), (184, 4091), (186, 4287), (226, 4193), (196, 4349), (201, 4191), (203, 4277), (229, 4143), (208, 4193), (187, 4093), (197, 4197), (204, 4052), (207, 4029), (226, 4153), (207, 4183), (213, 4084), (200, 4128)]
         : compromised: 0.0452, honest: 0.0495
Round 007: test acc mean=0.0501 ± 0.0029 | min=0.0450 max=0.0551
         : test loss mean=5.4153 ± 3.5114
         : individual accs = ['0.049176', '0.047109', '0.055134', '0.048465', '0.044977', '0.048752', '0.049130', '0.051276', '0.051539', '0.053075', '0.050447', '0.053899', '0.045688', '0.045747', '0.048124', '0.051378', '0.054418', '0.050203', '0.052889', '0.050388']
         : correct/total = [(203, 4128), (198, 4203), (225, 4081), (210, 4333), (184, 4091), (209, 4287), (206, 4193), (223, 4349), (216, 4191), (227, 4277), (209, 4143), (226, 4193), (187, 4093), (192, 4197), (195, 4052), (207, 4029), (226, 4153), (210, 4183), (216, 4084), (208, 4128)]
         : compromised: 0.0472, honest: 0.0504
Round 008: test acc mean=0.0527 ± 0.0042 | min=0.0450 max=0.0624
         : test loss mean=5.7726 ± 4.1677
         : individual accs = ['0.049176', '0.047109', '0.055134', '0.052850', '0.044977', '0.050618', '0.053899', '0.058174', '0.051539', '0.047463', '0.055274', '0.049606', '0.058637', '0.062426', '0.051826', '0.056590', '0.054418', '0.050920', '0.052155', '0.050388']
         : correct/total = [(203, 4128), (198, 4203), (225, 4081), (229, 4333), (184, 4091), (217, 4287), (226, 4193), (253, 4349), (216, 4191), (203, 4277), (229, 4143), (208, 4193), (240, 4093), (262, 4197), (210, 4052), (228, 4029), (226, 4153), (213, 4183), (213, 4084), (208, 4128)]
         : compromised: 0.0565, honest: 0.0522
Round 009: test acc mean=0.0507 ± 0.0032 | min=0.0450 max=0.0563
         : test loss mean=4.6583 ± 1.7166
         : individual accs = ['0.049176', '0.047109', '0.055134', '0.048465', '0.044977', '0.048752', '0.053899', '0.051276', '0.051539', '0.047463', '0.055274', '0.049606', '0.053750', '0.045747', '0.048124', '0.056342', '0.054418', '0.050203', '0.052155', '0.050388']
         : correct/total = [(203, 4128), (198, 4203), (225, 4081), (210, 4333), (184, 4091), (209, 4287), (226, 4193), (223, 4349), (216, 4191), (203, 4277), (229, 4143), (208, 4193), (220, 4093), (192, 4197), (195, 4052), (227, 4029), (226, 4153), (210, 4183), (213, 4084), (208, 4128)]
         : compromised: 0.0472, honest: 0.0511
Round 010: test acc mean=0.0507 ± 0.0037 | min=0.0450 max=0.0618
         : test loss mean=5.5440 ± 3.6805
         : individual accs = ['0.049176', '0.047109', '0.055134', '0.048465', '0.044977', '0.048752', '0.053899', '0.051276', '0.051539', '0.047697', '0.050447', '0.061770', '0.049597', '0.045747', '0.048124', '0.053860', '0.054418', '0.050203', '0.052155', '0.050388']
         : correct/total = [(203, 4128), (198, 4203), (225, 4081), (210, 4333), (184, 4091), (209, 4287), (226, 4193), (223, 4349), (216, 4191), (204, 4277), (209, 4143), (259, 4193), (203, 4093), (192, 4197), (195, 4052), (217, 4029), (226, 4153), (210, 4183), (213, 4084), (208, 4128)]
         : compromised: 0.0472, honest: 0.0511

=== FINAL RESULTS ===
Dataset: femnist, Nodes: 20, Graph: erdos, Aggregation: d-fedavg
Attack: backdoor, 10.0% compromised
Final accuracy - Compromised: 0.0472, Honest: 0.0511
Overall test accuracy: mean=0.0507 ± 0.0037

=== BACKDOOR ATTACK SUCCESS RATE (ASR) ===
Target label: 0
Trigger size: 4x4
Overall ASR: 0.0000 ± 0.0000
Honest nodes ASR: 0.0000 ± 0.0000
Compromised nodes ASR: 0.0000 ± 0.0000
Note: Higher ASR indicates more successful backdoor attack
