Device: cuda
Seed: 987654321
Loading 36 LEAF FEMNIST train files...
LEAF FEMNIST train: 3597 users, 734463 samples
Loading 36 LEAF FEMNIST test files...
LEAF FEMNIST test: 3597 users, 83388 samples
Found 3597 train users, 3597 test users, 3597 common users
User sample counts range: 525 (max) to 17 (min)
Distributed ALL 3597 users across 20 clients
Users per client: 179 (with 17 clients getting +1 user)
Train partition sizes: [36360, 37070, 35957, 38262, 36024, 37732, 36921, 38328, 36867, 37683, 36507, 36915, 36007, 37001, 35681, 35453, 36585, 36801, 35964, 36345]
Test partition sizes: [4128, 4203, 4081, 4333, 4091, 4287, 4193, 4349, 4191, 4277, 4143, 4193, 4093, 4197, 4052, 4029, 4153, 4183, 4084, 4128]
  Client 0: 36360 train samples, 62 unique classes
  Client 1: 37070 train samples, 62 unique classes
  Client 2: 35957 train samples, 62 unique classes
  Client 3: 38262 train samples, 62 unique classes
  Client 4: 36024 train samples, 62 unique classes
  Client 5: 37732 train samples, 62 unique classes
  Client 6: 36921 train samples, 62 unique classes
  Client 7: 38328 train samples, 62 unique classes
  Client 8: 36867 train samples, 62 unique classes
  Client 9: 37683 train samples, 62 unique classes
  Client 10: 36507 train samples, 62 unique classes
  Client 11: 36915 train samples, 62 unique classes
  Client 12: 36007 train samples, 62 unique classes
  Client 13: 37001 train samples, 62 unique classes
  Client 14: 35681 train samples, 62 unique classes
  Client 15: 35453 train samples, 62 unique classes
  Client 16: 36585 train samples, 62 unique classes
  Client 17: 36801 train samples, 62 unique classes
  Client 18: 35964 train samples, 62 unique classes
  Client 19: 36345 train samples, 62 unique classes
Will sample 10000 samples per client per epoch
Graph: fully, nodes: 20, edges: 190
Degree statistics: avg=19.00, min=19, max=19
Attack: Compromised 4/20 nodes: [5, 12, 13, 17]
Attack type: gaussian, lambda: 1.0
Model variant: baseline
Model parameters: 6,603,710
UBAR ALGORITHM (Two-Stage Byzantine-resilient)
  - Model dimension: 6,603,710 parameters
  - Rho parameter: 0.8
  - Stage 1: Distance-based filtering (select 80% closest neighbors)
  - Stage 2: Performance-based selection (loss comparison)
  - Complexity: O(deg(i)×d + deg(i)×inference)
Initial test acc across nodes: mean=0.0168 ± 0.0139
Round 001: test acc mean=0.4784 ± 0.0500 | min=0.3540 max=0.5741
         : test loss mean=3.7177 ± 0.0795
         : individual accs = ['0.463905', '0.507019', '0.555991', '0.438264', '0.498900', '0.574061', '0.497973', '0.497126', '0.481508', '0.353986', '0.535844', '0.408300', '0.466650', '0.476531', '0.525666', '0.459419', '0.450277', '0.422663', '0.496817', '0.458091']
         : correct/total = [(1915, 4128), (2131, 4203), (2269, 4081), (1899, 4333), (2041, 4091), (2461, 4287), (2088, 4193), (2162, 4349), (2018, 4191), (1514, 4277), (2220, 4143), (1712, 4193), (1910, 4093), (2000, 4197), (2130, 4052), (1851, 4029), (1870, 4153), (1768, 4183), (2029, 4084), (1891, 4128)]
         : compromised: 0.4850, honest: 0.4768
         : ubar stats = ['Node 0: s1=0.789, s2=0.200', 'Node 1: s1=0.789, s2=0.533', 'Node 2: s1=0.789, s2=0.733']...
Round 002: test acc mean=0.6548 ± 0.0356 | min=0.5798 max=0.7129
         : test loss mean=3.2756 ± 0.2757
         : individual accs = ['0.676357', '0.589341', '0.642245', '0.623817', '0.688340', '0.644507', '0.660148', '0.683146', '0.673825', '0.619359', '0.579773', '0.656093', '0.640850', '0.606862', '0.692004', '0.703400', '0.674693', '0.712885', '0.667238', '0.662064']
         : correct/total = [(2792, 4128), (2477, 4203), (2621, 4081), (2703, 4333), (2816, 4091), (2763, 4287), (2768, 4193), (2971, 4349), (2824, 4191), (2649, 4277), (2402, 4143), (2751, 4193), (2623, 4093), (2547, 4197), (2804, 4052), (2834, 4029), (2802, 4153), (2982, 4183), (2725, 4084), (2733, 4128)]
         : compromised: 0.6513, honest: 0.6557
         : ubar stats = ['Node 0: s1=0.789, s2=0.233', 'Node 1: s1=0.789, s2=0.300', 'Node 2: s1=0.789, s2=0.533']...
Round 003: test acc mean=0.6961 ± 0.0358 | min=0.6213 max=0.7611
         : test loss mean=2.7272 ± 0.6715
         : individual accs = ['0.708818', '0.758982', '0.664788', '0.701592', '0.703251', '0.694892', '0.699738', '0.699931', '0.697447', '0.667992', '0.732802', '0.658478', '0.761055', '0.752204', '0.647828', '0.717051', '0.688177', '0.621324', '0.678012', '0.668362']
         : correct/total = [(2926, 4128), (3190, 4203), (2713, 4081), (3040, 4333), (2877, 4091), (2979, 4287), (2934, 4193), (3044, 4349), (2923, 4191), (2857, 4277), (3036, 4143), (2761, 4193), (3115, 4093), (3157, 4197), (2625, 4052), (2889, 4029), (2858, 4153), (2599, 4183), (2769, 4084), (2759, 4128)]
         : compromised: 0.7074, honest: 0.6933
         : ubar stats = ['Node 0: s1=0.789, s2=0.289', 'Node 1: s1=0.789, s2=0.222', 'Node 2: s1=0.789, s2=0.422']...
Round 004: test acc mean=0.7165 ± 0.0439 | min=0.5947 max=0.7808
         : test loss mean=2.0335 ± 0.5271
         : individual accs = ['0.744913', '0.680228', '0.675325', '0.780752', '0.746028', '0.689760', '0.666110', '0.737181', '0.707946', '0.754501', '0.732320', '0.746959', '0.594674', '0.765070', '0.718411', '0.739638', '0.731038', '0.664356', '0.762488', '0.691376']
         : correct/total = [(3075, 4128), (2859, 4203), (2756, 4081), (3383, 4333), (3052, 4091), (2957, 4287), (2793, 4193), (3206, 4349), (2967, 4191), (3227, 4277), (3034, 4143), (3132, 4193), (2434, 4093), (3211, 4197), (2911, 4052), (2980, 4029), (3036, 4153), (2779, 4183), (3114, 4084), (2854, 4128)]
         : compromised: 0.6785, honest: 0.7260
         : ubar stats = ['Node 0: s1=0.789, s2=0.233', 'Node 1: s1=0.789, s2=0.183', 'Node 2: s1=0.789, s2=0.383']...
Round 005: test acc mean=0.7451 ± 0.0227 | min=0.7056 max=0.7837
         : test loss mean=1.5919 ± 0.2369
         : individual accs = ['0.746366', '0.783726', '0.709385', '0.756058', '0.756050', '0.767670', '0.714286', '0.774201', '0.721069', '0.705635', '0.752112', '0.754591', '0.743464', '0.779366', '0.720138', '0.734177', '0.738021', '0.729381', '0.767385', '0.749758']
         : correct/total = [(3081, 4128), (3294, 4203), (2895, 4081), (3276, 4333), (3093, 4091), (3291, 4287), (2995, 4193), (3367, 4349), (3022, 4191), (3018, 4277), (3116, 4143), (3164, 4193), (3043, 4093), (3271, 4197), (2918, 4052), (2958, 4029), (3065, 4153), (3051, 4183), (3134, 4084), (3095, 4128)]
         : compromised: 0.7550, honest: 0.7427
         : ubar stats = ['Node 0: s1=0.789, s2=0.200', 'Node 1: s1=0.789, s2=0.280', 'Node 2: s1=0.789, s2=0.440']...
Round 006: test acc mean=0.7947 ± 0.0114 | min=0.7647 max=0.8127
         : test loss mean=0.8202 ± 0.0919
         : individual accs = ['0.792393', '0.808232', '0.805195', '0.775213', '0.795649', '0.804292', '0.800859', '0.807542', '0.793605', '0.796820', '0.797007', '0.797043', '0.782800', '0.779366', '0.793929', '0.764706', '0.798218', '0.796318', '0.812684', '0.791667']
         : correct/total = [(3271, 4128), (3397, 4203), (3286, 4081), (3359, 4333), (3255, 4091), (3448, 4287), (3358, 4193), (3512, 4349), (3326, 4191), (3408, 4277), (3302, 4143), (3342, 4193), (3204, 4093), (3271, 4197), (3217, 4052), (3081, 4029), (3315, 4153), (3331, 4183), (3319, 4084), (3268, 4128)]
         : compromised: 0.7907, honest: 0.7957
         : ubar stats = ['Node 0: s1=0.789, s2=0.233', 'Node 1: s1=0.789, s2=0.256', 'Node 2: s1=0.789, s2=0.400']...
Round 007: test acc mean=0.8175 ± 0.0090 | min=0.8024 max=0.8384
         : test loss mean=0.6072 ± 0.0320
         : individual accs = ['0.820494', '0.820604', '0.830924', '0.812601', '0.838426', '0.816422', '0.818507', '0.829846', '0.812455', '0.822072', '0.806420', '0.814453', '0.826044', '0.814629', '0.817374', '0.802432', '0.822538', '0.808511', '0.811704', '0.803537']
         : correct/total = [(3387, 4128), (3449, 4203), (3391, 4081), (3521, 4333), (3430, 4091), (3500, 4287), (3432, 4193), (3609, 4349), (3405, 4191), (3516, 4277), (3341, 4143), (3415, 4193), (3381, 4093), (3419, 4197), (3312, 4052), (3233, 4029), (3416, 4153), (3382, 4183), (3315, 4084), (3317, 4128)]
         : compromised: 0.8164, honest: 0.8178
         : ubar stats = ['Node 0: s1=0.789, s2=0.219', 'Node 1: s1=0.789, s2=0.229', 'Node 2: s1=0.789, s2=0.352']...
Round 008: test acc mean=0.8289 ± 0.0098 | min=0.8122 max=0.8431
         : test loss mean=0.5375 ± 0.0279
         : individual accs = ['0.820010', '0.841780', '0.839500', '0.827833', '0.843070', '0.828551', '0.813737', '0.842722', '0.827726', '0.840075', '0.812213', '0.818507', '0.835573', '0.831546', '0.822063', '0.819558', '0.831206', '0.820942', '0.840108', '0.821221']
         : correct/total = [(3385, 4128), (3538, 4203), (3426, 4081), (3587, 4333), (3449, 4091), (3552, 4287), (3412, 4193), (3665, 4349), (3469, 4191), (3593, 4277), (3365, 4143), (3432, 4193), (3420, 4093), (3490, 4197), (3331, 4052), (3302, 4029), (3452, 4153), (3434, 4183), (3431, 4084), (3390, 4128)]
         : compromised: 0.8292, honest: 0.8288
         : ubar stats = ['Node 0: s1=0.789, s2=0.200', 'Node 1: s1=0.789, s2=0.242', 'Node 2: s1=0.789, s2=0.317']...
Round 009: test acc mean=0.8365 ± 0.0063 | min=0.8261 max=0.8489
         : test loss mean=0.5007 ± 0.0212
         : individual accs = ['0.829457', '0.843207', '0.845626', '0.836834', '0.845515', '0.839981', '0.832101', '0.848931', '0.835839', '0.840309', '0.831282', '0.826139', '0.837039', '0.833691', '0.827986', '0.828245', '0.841560', '0.833612', '0.838149', '0.833576']
         : correct/total = [(3424, 4128), (3544, 4203), (3451, 4081), (3626, 4333), (3459, 4091), (3601, 4287), (3489, 4193), (3692, 4349), (3503, 4191), (3594, 4277), (3444, 4143), (3464, 4193), (3426, 4093), (3499, 4197), (3355, 4052), (3337, 4029), (3495, 4153), (3487, 4183), (3423, 4084), (3441, 4128)]
         : compromised: 0.8361, honest: 0.8365
         : ubar stats = ['Node 0: s1=0.789, s2=0.207', 'Node 1: s1=0.789, s2=0.237', 'Node 2: s1=0.789, s2=0.289']...
Round 010: test acc mean=0.8428 ± 0.0071 | min=0.8274 max=0.8531
         : test loss mean=0.4800 ± 0.0208
         : individual accs = ['0.839390', '0.850821', '0.851997', '0.843757', '0.846492', '0.844880', '0.839256', '0.853070', '0.848485', '0.848024', '0.837799', '0.829478', '0.846079', '0.847748', '0.838351', '0.839166', '0.842042', '0.827397', '0.848188', '0.832607']
         : correct/total = [(3465, 4128), (3576, 4203), (3477, 4081), (3656, 4333), (3463, 4091), (3622, 4287), (3519, 4193), (3710, 4349), (3556, 4191), (3627, 4277), (3471, 4143), (3478, 4193), (3463, 4093), (3558, 4197), (3397, 4052), (3381, 4029), (3497, 4153), (3461, 4183), (3464, 4084), (3437, 4128)]
         : compromised: 0.8415, honest: 0.8431
         : ubar stats = ['Node 0: s1=0.789, s2=0.200', 'Node 1: s1=0.789, s2=0.287', 'Node 2: s1=0.789, s2=0.267']...

=== FINAL RESULTS ===
Dataset: femnist, Nodes: 20, Graph: fully, Aggregation: ubar
Attack: gaussian, 20.0% compromised
Final accuracy - Compromised: 0.8415, Honest: 0.8431
Overall test accuracy: mean=0.8428 ± 0.0071

=== UBAR SUMMARY ===
Node 0: stage1=0.789, stage2=0.200, overall=0.158
Node 1: stage1=0.789, stage2=0.287, overall=0.226
Node 2: stage1=0.789, stage2=0.267, overall=0.211
Node 3: stage1=0.789, stage2=0.160, overall=0.126
Node 4: stage1=0.789, stage2=0.207, overall=0.163
Node 5: stage1=0.789, stage2=0.453, overall=0.358
Node 6: stage1=0.789, stage2=0.453, overall=0.358
Node 7: stage1=0.789, stage2=0.480, overall=0.379
Node 8: stage1=0.789, stage2=0.333, overall=0.263
Node 9: stage1=0.789, stage2=0.200, overall=0.158
Node 10: stage1=0.789, stage2=0.340, overall=0.268
Node 11: stage1=0.789, stage2=0.287, overall=0.226
Node 12: stage1=0.789, stage2=0.347, overall=0.274
Node 13: stage1=0.789, stage2=0.247, overall=0.195
Node 14: stage1=0.789, stage2=0.433, overall=0.342
Node 15: stage1=0.789, stage2=0.193, overall=0.153
Node 16: stage1=0.789, stage2=0.220, overall=0.174
Node 17: stage1=0.789, stage2=0.400, overall=0.316
Node 18: stage1=0.789, stage2=0.247, overall=0.195
Node 19: stage1=0.789, stage2=0.320, overall=0.253

=== PARALLEL EXECUTION TIME (realistic for distributed system) ===
  COMMUNICATION (max across nodes):
    - Full model transfer: 0.000s (0.0%)
  COMPUTATION (max across nodes):
    - Distance computation: 0.216s (4.3%)
    - Loss computation: 4.781s (95.5%)
    - Aggregation: 0.011s (0.2%)
  TOTALS:
    - Total computation: 5.009s (100.0%)
    - Total communication: 0.000s (0.0%)
    - Total parallel time: 5.009s

=== PER-NODE AVERAGE TIME ===
  - Distance computation: 0.122s
  - Loss computation: 3.885s
  - Aggregation: 0.008s
  - Model transfer: 0.000s
  - Total per node: 4.015s

=== TOTAL COMPUTATIONAL WORK (sum across all nodes) ===
  - Total distance computation: 2.439s
  - Total loss computation: 77.691s
  - Total aggregation: 0.166s
  - Total model transfer: 0.000s
  - Grand total: 80.296s
  - Mean Stage 1 acceptance rate: 0.789
  - Mean Stage 2 acceptance rate: 0.304
  - Overall acceptance rate: 0.240

UBAR Algorithm Properties:
  - Model dimension: 6,603,710
  - Rho parameter: 0.8
  - Two-stage approach: Distance filtering + loss evaluation
  - Stage 1 selects: 80% of neighbors
  - Stage 2 uses: Training sample loss comparison
  - Theoretical complexity: O(deg(i)×d + deg(i)×inference)
  - Approach: UBAR paper implementation
