Device: cuda
Seed: 987654321
Loading 36 LEAF FEMNIST train files...
LEAF FEMNIST train: 3597 users, 734463 samples
Loading 36 LEAF FEMNIST test files...
LEAF FEMNIST test: 3597 users, 83388 samples
Found 3597 train users, 3597 test users, 3597 common users
User sample counts range: 525 (max) to 17 (min)
Distributed ALL 3597 users across 20 clients
Users per client: 179 (with 17 clients getting +1 user)
Train partition sizes: [36360, 37070, 35957, 38262, 36024, 37732, 36921, 38328, 36867, 37683, 36507, 36915, 36007, 37001, 35681, 35453, 36585, 36801, 35964, 36345]
Test partition sizes: [4128, 4203, 4081, 4333, 4091, 4287, 4193, 4349, 4191, 4277, 4143, 4193, 4093, 4197, 4052, 4029, 4153, 4183, 4084, 4128]
  Client 0: 36360 train samples, 62 unique classes
  Client 1: 37070 train samples, 62 unique classes
  Client 2: 35957 train samples, 62 unique classes
  Client 3: 38262 train samples, 62 unique classes
  Client 4: 36024 train samples, 62 unique classes
  Client 5: 37732 train samples, 62 unique classes
  Client 6: 36921 train samples, 62 unique classes
  Client 7: 38328 train samples, 62 unique classes
  Client 8: 36867 train samples, 62 unique classes
  Client 9: 37683 train samples, 62 unique classes
  Client 10: 36507 train samples, 62 unique classes
  Client 11: 36915 train samples, 62 unique classes
  Client 12: 36007 train samples, 62 unique classes
  Client 13: 37001 train samples, 62 unique classes
  Client 14: 35681 train samples, 62 unique classes
  Client 15: 35453 train samples, 62 unique classes
  Client 16: 36585 train samples, 62 unique classes
  Client 17: 36801 train samples, 62 unique classes
  Client 18: 35964 train samples, 62 unique classes
  Client 19: 36345 train samples, 62 unique classes
Will sample 4500 samples per client per epoch
Graph: fully, nodes: 20, edges: 190
Degree statistics: avg=19.00, min=19, max=19
Attack: Compromised 6/20 nodes: [5, 12, 13, 14, 17, 18]
Attack type: backdoor, lambda: 1.0
Backdoor target label: 0, trigger size: 4
Model variant: baseline
Model parameters: 6,603,710
Initial test acc across nodes: mean=0.0168 ± 0.0139
Backdoor attack: Created poisoned datasets for 6 compromised nodes
Round 001: test acc mean=0.0174 ± 0.0126 | min=0.0036 max=0.0434
         : test loss mean=2494.5843 ± 837.3715
         : individual accs = ['0.004603', '0.024030', '0.010782', '0.040157', '0.015400', '0.006065', '0.003577', '0.031272', '0.010260', '0.015431', '0.017861', '0.043406', '0.003909', '0.028354', '0.005923', '0.009680', '0.040212', '0.017452', '0.012977', '0.006056']
         : correct/total = [(19, 4128), (101, 4203), (44, 4081), (174, 4333), (63, 4091), (26, 4287), (15, 4193), (136, 4349), (43, 4191), (66, 4277), (74, 4143), (182, 4193), (16, 4093), (119, 4197), (24, 4052), (39, 4029), (167, 4153), (73, 4183), (53, 4084), (25, 4128)]
         : compromised: 0.0124, honest: 0.0195
Round 002: test acc mean=0.0447 ± 0.0037 | min=0.0365 max=0.0512
         : test loss mean=79.5075 ± 0.9459
         : individual accs = ['0.045785', '0.042589', '0.048763', '0.036464', '0.043266', '0.047352', '0.042213', '0.041619', '0.040802', '0.046528', '0.051171', '0.041736', '0.050818', '0.049559', '0.046644', '0.041698', '0.040693', '0.045900', '0.045788', '0.044331']
         : correct/total = [(189, 4128), (179, 4203), (199, 4081), (158, 4333), (177, 4091), (203, 4287), (177, 4193), (181, 4349), (171, 4191), (199, 4277), (212, 4143), (175, 4193), (208, 4093), (208, 4197), (189, 4052), (168, 4029), (169, 4153), (192, 4183), (187, 4084), (183, 4128)]
         : compromised: 0.0477, honest: 0.0434
Round 003: test acc mean=0.0447 ± 0.0037 | min=0.0365 max=0.0512
         : test loss mean=41.3808 ± 0.6434
         : individual accs = ['0.045785', '0.042589', '0.048763', '0.036464', '0.043266', '0.047352', '0.042213', '0.041619', '0.040802', '0.046528', '0.051171', '0.041736', '0.050818', '0.049559', '0.046644', '0.041698', '0.040693', '0.045900', '0.045788', '0.044331']
         : correct/total = [(189, 4128), (179, 4203), (199, 4081), (158, 4333), (177, 4091), (203, 4287), (177, 4193), (181, 4349), (171, 4191), (199, 4277), (212, 4143), (175, 4193), (208, 4093), (208, 4197), (189, 4052), (168, 4029), (169, 4153), (192, 4183), (187, 4084), (183, 4128)]
         : compromised: 0.0477, honest: 0.0434
Round 004: test acc mean=0.0561 ± 0.0032 | min=0.0506 max=0.0624
         : test loss mean=30.9169 ± 0.2817
         : individual accs = ['0.059593', '0.052344', '0.057584', '0.052850', '0.057932', '0.050618', '0.057000', '0.058174', '0.053209', '0.053776', '0.055998', '0.053899', '0.058637', '0.062426', '0.061204', '0.056590', '0.058271', '0.050920', '0.055583', '0.055475']
         : correct/total = [(246, 4128), (220, 4203), (235, 4081), (229, 4333), (237, 4091), (217, 4287), (239, 4193), (253, 4349), (223, 4191), (230, 4277), (232, 4143), (226, 4193), (240, 4093), (262, 4197), (248, 4052), (228, 4029), (242, 4153), (213, 4183), (227, 4084), (229, 4128)]
         : compromised: 0.0566, honest: 0.0559
Round 005: test acc mean=0.0561 ± 0.0032 | min=0.0506 max=0.0624
         : test loss mean=38.9278 ± 0.2645
         : individual accs = ['0.059593', '0.052344', '0.057584', '0.052850', '0.057932', '0.050618', '0.057000', '0.058174', '0.053209', '0.053776', '0.055998', '0.053899', '0.058637', '0.062426', '0.061204', '0.056590', '0.058271', '0.050920', '0.055583', '0.055475']
         : correct/total = [(246, 4128), (220, 4203), (235, 4081), (229, 4333), (237, 4091), (217, 4287), (239, 4193), (253, 4349), (223, 4191), (230, 4277), (232, 4143), (226, 4193), (240, 4093), (262, 4197), (248, 4052), (228, 4029), (242, 4153), (213, 4183), (227, 4084), (229, 4128)]
         : compromised: 0.0566, honest: 0.0559
Round 006: test acc mean=0.0493 ± 0.0035 | min=0.0430 max=0.0545
         : test loss mean=28.9261 ± 0.2339
         : individual accs = ['0.050145', '0.048775', '0.053418', '0.043157', '0.043021', '0.045253', '0.050799', '0.045068', '0.049630', '0.043488', '0.048033', '0.049606', '0.054239', '0.049083', '0.051826', '0.051626', '0.052011', '0.049486', '0.052889', '0.054506']
         : correct/total = [(207, 4128), (205, 4203), (218, 4081), (187, 4333), (176, 4091), (194, 4287), (213, 4193), (196, 4349), (208, 4191), (186, 4277), (199, 4143), (208, 4193), (222, 4093), (206, 4197), (210, 4052), (208, 4029), (216, 4153), (207, 4183), (216, 4084), (225, 4128)]
         : compromised: 0.0505, honest: 0.0488
Round 007: test acc mean=0.0493 ± 0.0035 | min=0.0430 max=0.0545
         : test loss mean=22.0490 ± 0.1125
         : individual accs = ['0.050145', '0.048775', '0.053418', '0.043157', '0.043021', '0.045253', '0.050799', '0.045068', '0.049630', '0.043488', '0.048033', '0.049606', '0.054239', '0.049083', '0.051826', '0.051626', '0.052011', '0.049486', '0.052889', '0.054506']
         : correct/total = [(207, 4128), (205, 4203), (218, 4081), (187, 4333), (176, 4091), (194, 4287), (213, 4193), (196, 4349), (208, 4191), (186, 4277), (199, 4143), (208, 4193), (222, 4093), (206, 4197), (210, 4052), (208, 4029), (216, 4153), (207, 4183), (216, 4084), (225, 4128)]
         : compromised: 0.0505, honest: 0.0488
Round 008: test acc mean=0.0259 ± 0.0025 | min=0.0215 max=0.0312
         : test loss mean=5.6261 ± 0.0316
         : individual accs = ['0.025921', '0.022603', '0.026464', '0.031156', '0.024933', '0.030324', '0.030050', '0.028052', '0.023622', '0.025251', '0.026309', '0.024326', '0.027119', '0.026686', '0.021471', '0.024820', '0.026246', '0.024623', '0.025220', '0.023256']
         : correct/total = [(107, 4128), (95, 4203), (108, 4081), (135, 4333), (102, 4091), (130, 4287), (126, 4193), (122, 4349), (99, 4191), (108, 4277), (109, 4143), (102, 4193), (111, 4093), (112, 4197), (87, 4052), (100, 4029), (109, 4153), (103, 4183), (103, 4084), (96, 4128)]
         : compromised: 0.0259, honest: 0.0259
Round 009: test acc mean=0.0259 ± 0.0025 | min=0.0215 max=0.0312
         : test loss mean=7.8412 ± 0.0844
         : individual accs = ['0.025921', '0.022603', '0.026464', '0.031156', '0.024933', '0.030324', '0.030050', '0.028052', '0.023622', '0.025251', '0.026309', '0.024326', '0.027119', '0.026686', '0.021471', '0.024820', '0.026246', '0.024623', '0.025220', '0.023256']
         : correct/total = [(107, 4128), (95, 4203), (108, 4081), (135, 4333), (102, 4091), (130, 4287), (126, 4193), (122, 4349), (99, 4191), (108, 4277), (109, 4143), (102, 4193), (111, 4093), (112, 4197), (87, 4052), (100, 4029), (109, 4153), (103, 4183), (103, 4084), (96, 4128)]
         : compromised: 0.0259, honest: 0.0259
Round 010: test acc mean=0.0353 ± 0.0034 | min=0.0261 max=0.0396
         : test loss mean=13.2939 ± 0.1163
         : individual accs = ['0.029070', '0.036878', '0.035531', '0.038311', '0.037644', '0.036856', '0.035535', '0.035640', '0.037700', '0.036708', '0.039585', '0.036728', '0.036404', '0.037408', '0.032330', '0.026061', '0.030340', '0.039445', '0.032321', '0.035853']
         : correct/total = [(120, 4128), (155, 4203), (145, 4081), (166, 4333), (154, 4091), (158, 4287), (149, 4193), (155, 4349), (158, 4191), (157, 4277), (164, 4143), (154, 4193), (149, 4093), (157, 4197), (131, 4052), (105, 4029), (126, 4153), (165, 4183), (132, 4084), (148, 4128)]
         : compromised: 0.0358, honest: 0.0351

=== FINAL RESULTS ===
Dataset: femnist, Nodes: 20, Graph: fully, Aggregation: d-fedavg
Attack: backdoor, 30.0% compromised
Final accuracy - Compromised: 0.0358, Honest: 0.0351
Overall test accuracy: mean=0.0353 ± 0.0034

=== BACKDOOR ATTACK SUCCESS RATE (ASR) ===
Target label: 0
Trigger size: 4x4
Overall ASR: 0.0000 ± 0.0000
Honest nodes ASR: 0.0000 ± 0.0000
Compromised nodes ASR: 0.0000 ± 0.0000
Note: Higher ASR indicates more successful backdoor attack
