Device: cuda
Seed: 987654321
Loading 36 LEAF FEMNIST train files...
LEAF FEMNIST train: 3597 users, 734463 samples
Loading 36 LEAF FEMNIST test files...
LEAF FEMNIST test: 3597 users, 83388 samples
Found 3597 train users, 3597 test users, 3597 common users
User sample counts range: 525 (max) to 17 (min)
Distributed ALL 3597 users across 20 clients
Users per client: 179 (with 17 clients getting +1 user)
Train partition sizes: [36360, 37070, 35957, 38262, 36024, 37732, 36921, 38328, 36867, 37683, 36507, 36915, 36007, 37001, 35681, 35453, 36585, 36801, 35964, 36345]
Test partition sizes: [4128, 4203, 4081, 4333, 4091, 4287, 4193, 4349, 4191, 4277, 4143, 4193, 4093, 4197, 4052, 4029, 4153, 4183, 4084, 4128]
  Client 0: 36360 train samples, 62 unique classes
  Client 1: 37070 train samples, 62 unique classes
  Client 2: 35957 train samples, 62 unique classes
  Client 3: 38262 train samples, 62 unique classes
  Client 4: 36024 train samples, 62 unique classes
  Client 5: 37732 train samples, 62 unique classes
  Client 6: 36921 train samples, 62 unique classes
  Client 7: 38328 train samples, 62 unique classes
  Client 8: 36867 train samples, 62 unique classes
  Client 9: 37683 train samples, 62 unique classes
  Client 10: 36507 train samples, 62 unique classes
  Client 11: 36915 train samples, 62 unique classes
  Client 12: 36007 train samples, 62 unique classes
  Client 13: 37001 train samples, 62 unique classes
  Client 14: 35681 train samples, 62 unique classes
  Client 15: 35453 train samples, 62 unique classes
  Client 16: 36585 train samples, 62 unique classes
  Client 17: 36801 train samples, 62 unique classes
  Client 18: 35964 train samples, 62 unique classes
  Client 19: 36345 train samples, 62 unique classes
Will sample 10000 samples per client per epoch
Graph: erdos, nodes: 20, edges: 99
Degree statistics: avg=9.90, min=7, max=14
Attack: Compromised 12/20 nodes: [1, 2, 3, 5, 8, 11, 12, 13, 14, 15, 17, 18]
Attack type: backdoor, lambda: 1.0
Backdoor target label: 0, trigger size: 4
Model variant: baseline
Model parameters: 6,603,710
Initial test acc across nodes: mean=0.0162 ± 0.0138
Backdoor attack: Created poisoned datasets for 12 compromised nodes
Round 001: test acc mean=0.0162 ± 0.0156 | min=0.0031 max=0.0518
         : test loss mean=44290.7907 ± 31583.6998
         : individual accs = ['0.005329', '0.045206', '0.007351', '0.039926', '0.006355', '0.003499', '0.010017', '0.020005', '0.006442', '0.005611', '0.005793', '0.051753', '0.030051', '0.010245', '0.008391', '0.013403', '0.004575', '0.003108', '0.005632', '0.042151']
         : correct/total = [(22, 4128), (190, 4203), (30, 4081), (173, 4333), (26, 4091), (15, 4287), (42, 4193), (87, 4349), (27, 4191), (24, 4277), (24, 4143), (217, 4193), (123, 4093), (43, 4197), (34, 4052), (54, 4029), (19, 4153), (13, 4183), (23, 4084), (174, 4128)]
         : compromised: 0.0188, honest: 0.0125
Round 002: test acc mean=0.0497 ± 0.0048 | min=0.0415 max=0.0597
         : test loss mean=5437257727411.1738 ± 11230315165589.7129
         : individual accs = ['0.050630', '0.046395', '0.049743', '0.043850', '0.044243', '0.042454', '0.041498', '0.052656', '0.053686', '0.048632', '0.048033', '0.054853', '0.048375', '0.049083', '0.053801', '0.051874', '0.050807', '0.045422', '0.059745', '0.057413']
         : correct/total = [(209, 4128), (195, 4203), (203, 4081), (190, 4333), (181, 4091), (182, 4287), (174, 4193), (229, 4349), (225, 4191), (208, 4277), (199, 4143), (230, 4193), (198, 4093), (206, 4197), (218, 4052), (209, 4029), (211, 4153), (190, 4183), (244, 4084), (237, 4128)]
         : compromised: 0.0499, honest: 0.0492
Round 003: test acc mean=0.0503 ± 0.0060 | min=0.0389 max=0.0623
         : test loss mean=2836326472.0255 ± 12363260125.7037
         : individual accs = ['0.049661', '0.046395', '0.061505', '0.049850', '0.045466', '0.052018', '0.053422', '0.046907', '0.042711', '0.048632', '0.051895', '0.046983', '0.062301', '0.046938', '0.053801', '0.043435', '0.050807', '0.057853', '0.038932', '0.057413']
         : correct/total = [(205, 4128), (195, 4203), (251, 4081), (216, 4333), (186, 4091), (223, 4287), (224, 4193), (204, 4349), (179, 4191), (208, 4277), (215, 4143), (197, 4193), (255, 4093), (197, 4197), (218, 4052), (175, 4029), (211, 4153), (242, 4183), (159, 4084), (237, 4128)]
         : compromised: 0.0502, honest: 0.0505
Round 004: test acc mean=0.0537 ± 0.0045 | min=0.0480 max=0.0623
         : test loss mean=109.3709 ± 252.7842
         : individual accs = ['0.049661', '0.052819', '0.061505', '0.049850', '0.052066', '0.052018', '0.051991', '0.052656', '0.050823', '0.048632', '0.051895', '0.054853', '0.062301', '0.049083', '0.055281', '0.061554', '0.050566', '0.057853', '0.060235', '0.047965']
         : correct/total = [(205, 4128), (222, 4203), (251, 4081), (216, 4333), (213, 4091), (223, 4287), (218, 4193), (229, 4349), (213, 4191), (208, 4277), (215, 4143), (230, 4193), (255, 4093), (206, 4197), (224, 4052), (248, 4029), (210, 4153), (242, 4183), (246, 4084), (198, 4128)]
         : compromised: 0.0557, honest: 0.0507
Round 005: test acc mean=0.0545 ± 0.0043 | min=0.0486 max=0.0623
         : test loss mean=3.9092 ± 0.0524
         : individual accs = ['0.049661', '0.052819', '0.061505', '0.049850', '0.052066', '0.052018', '0.053422', '0.052656', '0.057266', '0.048632', '0.051895', '0.054853', '0.062301', '0.049083', '0.055281', '0.061554', '0.050566', '0.057853', '0.060235', '0.057413']
         : correct/total = [(205, 4128), (222, 4203), (251, 4081), (216, 4333), (213, 4091), (223, 4287), (224, 4193), (229, 4349), (240, 4191), (208, 4277), (215, 4143), (230, 4193), (255, 4093), (206, 4197), (224, 4052), (248, 4029), (210, 4153), (242, 4183), (246, 4084), (237, 4128)]
         : compromised: 0.0562, honest: 0.0520
Round 006: test acc mean=0.0545 ± 0.0043 | min=0.0486 max=0.0623
         : test loss mean=3.8077 ± 0.0252
         : individual accs = ['0.049661', '0.052819', '0.061505', '0.049850', '0.052066', '0.052018', '0.053422', '0.052656', '0.057266', '0.048632', '0.051895', '0.054853', '0.062301', '0.049083', '0.055281', '0.061554', '0.050566', '0.057853', '0.060235', '0.057413']
         : correct/total = [(205, 4128), (222, 4203), (251, 4081), (216, 4333), (213, 4091), (223, 4287), (224, 4193), (229, 4349), (240, 4191), (208, 4277), (215, 4143), (230, 4193), (255, 4093), (206, 4197), (224, 4052), (248, 4029), (210, 4153), (242, 4183), (246, 4084), (237, 4128)]
         : compromised: 0.0562, honest: 0.0520
Round 007: test acc mean=0.0497 ± 0.0033 | min=0.0415 max=0.0550
         : test loss mean=3.9146 ± 0.0485
         : individual accs = ['0.049419', '0.048775', '0.049743', '0.046619', '0.045710', '0.052484', '0.041498', '0.049897', '0.051062', '0.050736', '0.048033', '0.048891', '0.047398', '0.047653', '0.054788', '0.054604', '0.047436', '0.049247', '0.054358', '0.054990']
         : correct/total = [(204, 4128), (205, 4203), (203, 4081), (202, 4333), (187, 4091), (225, 4287), (174, 4193), (217, 4349), (214, 4191), (217, 4277), (199, 4143), (205, 4193), (194, 4093), (200, 4197), (222, 4052), (220, 4029), (197, 4153), (206, 4183), (222, 4084), (227, 4128)]
         : compromised: 0.0505, honest: 0.0485
Round 008: test acc mean=0.0497 ± 0.0033 | min=0.0415 max=0.0550
         : test loss mean=3.9172 ± 0.0459
         : individual accs = ['0.049419', '0.048775', '0.049743', '0.046619', '0.045710', '0.052484', '0.041498', '0.049897', '0.051062', '0.050736', '0.048033', '0.048891', '0.047398', '0.047653', '0.054788', '0.054604', '0.047436', '0.049247', '0.054358', '0.054990']
         : correct/total = [(204, 4128), (205, 4203), (203, 4081), (202, 4333), (187, 4091), (225, 4287), (174, 4193), (217, 4349), (214, 4191), (217, 4277), (199, 4143), (205, 4193), (194, 4093), (200, 4197), (222, 4052), (220, 4029), (197, 4153), (206, 4183), (222, 4084), (227, 4128)]
         : compromised: 0.0505, honest: 0.0485
Round 009: test acc mean=0.0195 ± 0.0142 | min=0.0108 max=0.0579
         : test loss mean=3.9465 ± 0.0584
         : individual accs = ['0.015262', '0.015465', '0.010782', '0.011309', '0.017355', '0.010963', '0.013356', '0.016096', '0.015987', '0.048632', '0.051895', '0.011448', '0.013926', '0.014534', '0.012833', '0.013403', '0.012039', '0.057853', '0.015916', '0.011386']
         : correct/total = [(63, 4128), (65, 4203), (44, 4081), (49, 4333), (71, 4091), (47, 4287), (56, 4193), (70, 4349), (67, 4191), (208, 4277), (215, 4143), (48, 4193), (57, 4093), (61, 4197), (52, 4052), (54, 4029), (50, 4153), (242, 4183), (65, 4084), (47, 4128)]
         : compromised: 0.0170, honest: 0.0233
Round 010: test acc mean=0.0545 ± 0.0043 | min=0.0486 max=0.0623
         : test loss mean=4.0090 ± 0.0628
         : individual accs = ['0.049661', '0.052819', '0.061505', '0.049850', '0.052066', '0.052018', '0.053422', '0.052656', '0.057266', '0.048632', '0.051895', '0.054853', '0.062301', '0.049083', '0.055281', '0.061554', '0.050566', '0.057853', '0.060235', '0.057413']
         : correct/total = [(205, 4128), (222, 4203), (251, 4081), (216, 4333), (213, 4091), (223, 4287), (224, 4193), (229, 4349), (240, 4191), (208, 4277), (215, 4143), (230, 4193), (255, 4093), (206, 4197), (224, 4052), (248, 4029), (210, 4153), (242, 4183), (246, 4084), (237, 4128)]
         : compromised: 0.0562, honest: 0.0520

=== FINAL RESULTS ===
Dataset: femnist, Nodes: 20, Graph: erdos, Aggregation: krum
Attack: backdoor, 60.0% compromised
Final accuracy - Compromised: 0.0562, Honest: 0.0520
Overall test accuracy: mean=0.0545 ± 0.0043

=== BACKDOOR ATTACK SUCCESS RATE (ASR) ===
Target label: 0
Trigger size: 4x4
Overall ASR: 0.0000 ± 0.0000
Honest nodes ASR: 0.0000 ± 0.0000
Compromised nodes ASR: 0.0000 ± 0.0000
Note: Higher ASR indicates more successful backdoor attack
