Device: cuda
Seed: 987654321
Loading 36 LEAF FEMNIST train files...
LEAF FEMNIST train: 3597 users, 734463 samples
Loading 36 LEAF FEMNIST test files...
LEAF FEMNIST test: 3597 users, 83388 samples
Found 3597 train users, 3597 test users, 3597 common users
User sample counts range: 525 (max) to 17 (min)
Distributed ALL 3597 users across 20 clients
Users per client: 179 (with 17 clients getting +1 user)
Train partition sizes: [36360, 37070, 35957, 38262, 36024, 37732, 36921, 38328, 36867, 37683, 36507, 36915, 36007, 37001, 35681, 35453, 36585, 36801, 35964, 36345]
Test partition sizes: [4128, 4203, 4081, 4333, 4091, 4287, 4193, 4349, 4191, 4277, 4143, 4193, 4093, 4197, 4052, 4029, 4153, 4183, 4084, 4128]
  Client 0: 36360 train samples, 62 unique classes
  Client 1: 37070 train samples, 62 unique classes
  Client 2: 35957 train samples, 62 unique classes
  Client 3: 38262 train samples, 62 unique classes
  Client 4: 36024 train samples, 62 unique classes
  Client 5: 37732 train samples, 62 unique classes
  Client 6: 36921 train samples, 62 unique classes
  Client 7: 38328 train samples, 62 unique classes
  Client 8: 36867 train samples, 62 unique classes
  Client 9: 37683 train samples, 62 unique classes
  Client 10: 36507 train samples, 62 unique classes
  Client 11: 36915 train samples, 62 unique classes
  Client 12: 36007 train samples, 62 unique classes
  Client 13: 37001 train samples, 62 unique classes
  Client 14: 35681 train samples, 62 unique classes
  Client 15: 35453 train samples, 62 unique classes
  Client 16: 36585 train samples, 62 unique classes
  Client 17: 36801 train samples, 62 unique classes
  Client 18: 35964 train samples, 62 unique classes
  Client 19: 36345 train samples, 62 unique classes
Will sample 10000 samples per client per epoch
Graph: erdos, nodes: 20, edges: 126
Degree statistics: avg=12.60, min=8, max=16
Attack: Compromised 10/20 nodes: [1, 2, 5, 11, 12, 13, 14, 15, 17, 18]
Attack type: backdoor, lambda: 1.0
Backdoor target label: 0, trigger size: 4
Model variant: baseline
Model parameters: 6,603,710
Sketchguard Node 0:
  Model dim: 6,603,710 → Sketch size: 1000
  Compression ratio: 6603.7x
  Using model parameters for aggregation, sketches for filtering
Sketchguard Node 1:
  Model dim: 6,603,710 → Sketch size: 1000
  Compression ratio: 6603.7x
  Using model parameters for aggregation, sketches for filtering
Sketchguard Node 2:
  Model dim: 6,603,710 → Sketch size: 1000
  Compression ratio: 6603.7x
  Using model parameters for aggregation, sketches for filtering
Sketchguard Node 3:
  Model dim: 6,603,710 → Sketch size: 1000
  Compression ratio: 6603.7x
  Using model parameters for aggregation, sketches for filtering
Sketchguard Node 4:
  Model dim: 6,603,710 → Sketch size: 1000
  Compression ratio: 6603.7x
  Using model parameters for aggregation, sketches for filtering
Sketchguard Node 5:
  Model dim: 6,603,710 → Sketch size: 1000
  Compression ratio: 6603.7x
  Using model parameters for aggregation, sketches for filtering
Sketchguard Node 6:
  Model dim: 6,603,710 → Sketch size: 1000
  Compression ratio: 6603.7x
  Using model parameters for aggregation, sketches for filtering
Sketchguard Node 7:
  Model dim: 6,603,710 → Sketch size: 1000
  Compression ratio: 6603.7x
  Using model parameters for aggregation, sketches for filtering
Sketchguard Node 8:
  Model dim: 6,603,710 → Sketch size: 1000
  Compression ratio: 6603.7x
  Using model parameters for aggregation, sketches for filtering
Sketchguard Node 9:
  Model dim: 6,603,710 → Sketch size: 1000
  Compression ratio: 6603.7x
  Using model parameters for aggregation, sketches for filtering
Sketchguard Node 10:
  Model dim: 6,603,710 → Sketch size: 1000
  Compression ratio: 6603.7x
  Using model parameters for aggregation, sketches for filtering
Sketchguard Node 11:
  Model dim: 6,603,710 → Sketch size: 1000
  Compression ratio: 6603.7x
  Using model parameters for aggregation, sketches for filtering
Sketchguard Node 12:
  Model dim: 6,603,710 → Sketch size: 1000
  Compression ratio: 6603.7x
  Using model parameters for aggregation, sketches for filtering
Sketchguard Node 13:
  Model dim: 6,603,710 → Sketch size: 1000
  Compression ratio: 6603.7x
  Using model parameters for aggregation, sketches for filtering
Sketchguard Node 14:
  Model dim: 6,603,710 → Sketch size: 1000
  Compression ratio: 6603.7x
  Using model parameters for aggregation, sketches for filtering
Sketchguard Node 15:
  Model dim: 6,603,710 → Sketch size: 1000
  Compression ratio: 6603.7x
  Using model parameters for aggregation, sketches for filtering
Sketchguard Node 16:
  Model dim: 6,603,710 → Sketch size: 1000
  Compression ratio: 6603.7x
  Using model parameters for aggregation, sketches for filtering
Sketchguard Node 17:
  Model dim: 6,603,710 → Sketch size: 1000
  Compression ratio: 6603.7x
  Using model parameters for aggregation, sketches for filtering
Sketchguard Node 18:
  Model dim: 6,603,710 → Sketch size: 1000
  Compression ratio: 6603.7x
  Using model parameters for aggregation, sketches for filtering
Sketchguard Node 19:
  Model dim: 6,603,710 → Sketch size: 1000
  Compression ratio: 6603.7x
  Using model parameters for aggregation, sketches for filtering
Sketchguard ALGORITHM (Sketch-based Filtering + State Aggregation)
  - Model dimension: 6,603,710 parameters
  - Config: SketchguardConfig(gamma=2, kappa=1, alpha=0.5, min_neighbors=1, sketch_size=1000, network_seed=987654321, attack_detection_window=5)
  - Sketch size: 1000
  - Compression ratio: 6603.7x
  - Complexity: O(d + N×k) = O(6,603,710 + 20×1000)
  - Theoretical speedup vs BALANCE: 19.9x
Initial test acc across nodes: mean=0.0168 ± 0.0139
Backdoor attack: Created poisoned datasets for 10 compromised nodes
Round 001: test acc mean=0.3017 ± 0.1915 | min=0.0488 max=0.5463
         : test loss mean=8327.2375 ± 8675.3915
         : individual accs = ['0.546269', '0.048775', '0.196520', '0.474036', '0.480567', '0.216002', '0.495349', '0.511382', '0.482701', '0.446809', '0.499155', '0.107322', '0.054239', '0.049083', '0.150049', '0.077935', '0.440645', '0.155152', '0.102595', '0.500000']
         : correct/total = [(2255, 4128), (205, 4203), (802, 4081), (2054, 4333), (1966, 4091), (926, 4287), (2077, 4193), (2224, 4349), (2023, 4191), (1911, 4277), (2068, 4143), (450, 4193), (222, 4093), (206, 4197), (608, 4052), (314, 4029), (1830, 4153), (649, 4183), (419, 4084), (2064, 4128)]
         : compromised: 0.1158, honest: 0.4877
         : sketchguard stats = ['Node 0: acc_rate=0.500', 'Node 1: acc_rate=0.545', 'Node 2: acc_rate=0.417']...
Round 002: test acc mean=0.3635 ± 0.3156 | min=0.0381 max=0.7037
         : test loss mean=35998520.6009 ± 156680104.2168
         : individual accs = ['0.687016', '0.038068', '0.053418', '0.703670', '0.684185', '0.048519', '0.654901', '0.672109', '0.675495', '0.671499', '0.679701', '0.046745', '0.048620', '0.046938', '0.046644', '0.053860', '0.683602', '0.048291', '0.048482', '0.677810']
         : correct/total = [(2836, 4128), (160, 4203), (218, 4081), (3049, 4333), (2799, 4091), (208, 4287), (2746, 4193), (2923, 4349), (2831, 4191), (2872, 4277), (2816, 4143), (196, 4193), (199, 4093), (197, 4197), (189, 4052), (217, 4029), (2839, 4153), (202, 4183), (198, 4084), (2798, 4128)]
         : compromised: 0.0480, honest: 0.6790
         : sketchguard stats = ['Node 0: acc_rate=0.500', 'Node 1: acc_rate=0.773', 'Node 2: acc_rate=0.708']...
Round 003: test acc mean=0.3795 ± 0.3290 | min=0.0460 max=0.7339
         : test loss mean=nan ± nan
         : individual accs = ['0.713178', '0.048775', '0.053418', '0.733903', '0.719628', '0.045953', '0.697353', '0.717406', '0.702935', '0.714052', '0.704079', '0.049606', '0.054239', '0.049083', '0.051826', '0.051626', '0.674934', '0.049486', '0.052889', '0.706153']
         : correct/total = [(2944, 4128), (205, 4203), (218, 4081), (3180, 4333), (2944, 4091), (197, 4287), (2924, 4193), (3120, 4349), (2946, 4191), (3054, 4277), (2917, 4143), (208, 4193), (222, 4093), (206, 4197), (210, 4052), (208, 4029), (2803, 4153), (207, 4183), (216, 4084), (2915, 4128)]
         : compromised: 0.0507, honest: 0.7084
         : sketchguard stats = ['Node 0: acc_rate=0.500', 'Node 1: acc_rate=0.515', 'Node 2: acc_rate=0.806']...
Round 004: test acc mean=0.3811 ± 0.3309 | min=0.0453 max=0.7452
         : test loss mean=nan ± nan
         : individual accs = ['0.697190', '0.048775', '0.053418', '0.745211', '0.727695', '0.045253', '0.715478', '0.728213', '0.722978', '0.701426', '0.697321', '0.049606', '0.054239', '0.049083', '0.051826', '0.051626', '0.721888', '0.049486', '0.052889', '0.658915']
         : correct/total = [(2878, 4128), (205, 4203), (218, 4081), (3229, 4333), (2977, 4091), (194, 4287), (3000, 4193), (3167, 4349), (3030, 4191), (3000, 4277), (2889, 4143), (208, 4193), (222, 4093), (206, 4197), (210, 4052), (208, 4029), (2998, 4153), (207, 4183), (216, 4084), (2720, 4128)]
         : compromised: 0.0506, honest: 0.7116
         : sketchguard stats = ['Node 0: acc_rate=0.500', 'Node 1: acc_rate=0.386', 'Node 2: acc_rate=0.604']...
Round 005: test acc mean=0.4020 ± 0.3516 | min=0.0453 max=0.7777
         : test loss mean=nan ± nan
         : individual accs = ['0.742733', '0.048775', '0.053418', '0.768059', '0.771938', '0.045253', '0.738612', '0.777650', '0.737771', '0.773206', '0.741492', '0.049606', '0.054239', '0.049083', '0.051826', '0.051626', '0.755598', '0.049486', '0.052889', '0.726502']
         : correct/total = [(3066, 4128), (205, 4203), (218, 4081), (3328, 4333), (3158, 4091), (194, 4287), (3097, 4193), (3382, 4349), (3092, 4191), (3307, 4277), (3072, 4143), (208, 4193), (222, 4093), (206, 4197), (210, 4052), (208, 4029), (3138, 4153), (207, 4183), (216, 4084), (2999, 4128)]
         : compromised: 0.0506, honest: 0.7534
         : sketchguard stats = ['Node 0: acc_rate=0.500', 'Node 1: acc_rate=0.309', 'Node 2: acc_rate=0.483']...
Round 006: test acc mean=0.4259 ± 0.3753 | min=0.0453 max=0.8080
         : test loss mean=nan ± nan
         : individual accs = ['0.802326', '0.048775', '0.053418', '0.802446', '0.806893', '0.045253', '0.800859', '0.805932', '0.795514', '0.808043', '0.795076', '0.049606', '0.054239', '0.049083', '0.051826', '0.051626', '0.806646', '0.049486', '0.052889', '0.787306']
         : correct/total = [(3312, 4128), (205, 4203), (218, 4081), (3477, 4333), (3301, 4091), (194, 4287), (3358, 4193), (3505, 4349), (3334, 4191), (3456, 4277), (3294, 4143), (208, 4193), (222, 4093), (206, 4197), (210, 4052), (208, 4029), (3350, 4153), (207, 4183), (216, 4084), (3250, 4128)]
         : compromised: 0.0506, honest: 0.8011
         : sketchguard stats = ['Node 0: acc_rate=0.500', 'Node 1: acc_rate=0.258', 'Node 2: acc_rate=0.403']...
Round 007: test acc mean=0.4378 ± 0.3873 | min=0.0453 max=0.8397
         : test loss mean=nan ± nan
         : individual accs = ['0.821948', '0.048775', '0.053418', '0.824602', '0.838670', '0.045253', '0.818984', '0.839733', '0.819852', '0.834463', '0.807869', '0.049606', '0.054239', '0.049083', '0.051826', '0.051626', '0.827595', '0.049486', '0.052889', '0.816618']
         : correct/total = [(3393, 4128), (205, 4203), (218, 4081), (3573, 4333), (3431, 4091), (194, 4287), (3434, 4193), (3652, 4349), (3436, 4191), (3569, 4277), (3347, 4143), (208, 4193), (222, 4093), (206, 4197), (210, 4052), (208, 4029), (3437, 4153), (207, 4183), (216, 4084), (3371, 4128)]
         : compromised: 0.0506, honest: 0.8250
         : sketchguard stats = ['Node 0: acc_rate=0.500', 'Node 1: acc_rate=0.221', 'Node 2: acc_rate=0.345']...
Round 008: test acc mean=0.4428 ± 0.3922 | min=0.0453 max=0.8430
         : test loss mean=nan ± nan
         : individual accs = ['0.832122', '0.048775', '0.053418', '0.836834', '0.842826', '0.045253', '0.831147', '0.842952', '0.835123', '0.842413', '0.824282', '0.049606', '0.054239', '0.049083', '0.051826', '0.051626', '0.835541', '0.049486', '0.052889', '0.827277']
         : correct/total = [(3435, 4128), (205, 4203), (218, 4081), (3626, 4333), (3448, 4091), (194, 4287), (3485, 4193), (3666, 4349), (3500, 4191), (3603, 4277), (3415, 4143), (208, 4193), (222, 4093), (206, 4197), (210, 4052), (208, 4029), (3470, 4153), (207, 4183), (216, 4084), (3415, 4128)]
         : compromised: 0.0506, honest: 0.8351
         : sketchguard stats = ['Node 0: acc_rate=0.500', 'Node 1: acc_rate=0.193', 'Node 2: acc_rate=0.302']...
Round 009: test acc mean=0.4455 ± 0.3949 | min=0.0453 max=0.8561
         : test loss mean=nan ± nan
         : individual accs = ['0.834545', '0.048775', '0.053418', '0.840526', '0.846492', '0.045253', '0.832817', '0.856059', '0.834407', '0.847791', '0.831282', '0.049606', '0.054239', '0.049083', '0.051826', '0.051626', '0.844691', '0.049486', '0.052889', '0.834787']
         : correct/total = [(3445, 4128), (205, 4203), (218, 4081), (3642, 4333), (3463, 4091), (194, 4287), (3492, 4193), (3723, 4349), (3497, 4191), (3626, 4277), (3444, 4143), (208, 4193), (222, 4093), (206, 4197), (210, 4052), (208, 4029), (3508, 4153), (207, 4183), (216, 4084), (3446, 4128)]
         : compromised: 0.0506, honest: 0.8403
         : sketchguard stats = ['Node 0: acc_rate=0.500', 'Node 1: acc_rate=0.172', 'Node 2: acc_rate=0.269']...
Round 010: test acc mean=0.4481 ± 0.3975 | min=0.0453 max=0.8577
         : test loss mean=nan ± nan
         : individual accs = ['0.842539', '0.048775', '0.053418', '0.847219', '0.854559', '0.045253', '0.838302', '0.857668', '0.841565', '0.849895', '0.838764', '0.049606', '0.054239', '0.049083', '0.051826', '0.051626', '0.849506', '0.049486', '0.052889', '0.834787']
         : correct/total = [(3478, 4128), (205, 4203), (218, 4081), (3671, 4333), (3496, 4091), (194, 4287), (3515, 4193), (3730, 4349), (3527, 4191), (3635, 4277), (3475, 4143), (208, 4193), (222, 4093), (206, 4197), (210, 4052), (208, 4029), (3528, 4153), (207, 4183), (216, 4084), (3446, 4128)]
         : compromised: 0.0506, honest: 0.8455
         : sketchguard stats = ['Node 0: acc_rate=0.500', 'Node 1: acc_rate=0.155', 'Node 2: acc_rate=0.242']...

=== FINAL RESULTS ===
Dataset: femnist, Nodes: 20, Graph: erdos, Aggregation: sketchguard
Attack: backdoor, 50.0% compromised
Final accuracy - Compromised: 0.0506, Honest: 0.8455
Overall test accuracy: mean=0.4481 ± 0.3975

=== BACKDOOR ATTACK SUCCESS RATE (ASR) ===
Target label: 0
Trigger size: 4x4
Overall ASR: 0.5246 ± 0.4754
Honest nodes ASR: 0.0493 ± 0.0040
Compromised nodes ASR: 1.0000 ± 0.0000
Note: Higher ASR indicates more successful backdoor attack

=== Sketchguard SUMMARY ===
Node 0: acceptance=0.500
Node 1: acceptance=0.155
Node 2: acceptance=0.242
Node 3: acceptance=0.625
Node 4: acceptance=0.455
Node 5: acceptance=0.247
Node 6: acceptance=0.429
Node 7: acceptance=0.429
Node 8: acceptance=0.400
Node 9: acceptance=0.538
Node 10: acceptance=0.556
Node 11: acceptance=0.250
Node 12: acceptance=0.258
Node 13: acceptance=0.254
Node 14: acceptance=0.247
Node 15: acceptance=0.245
Node 16: acceptance=0.385
Node 17: acceptance=0.267
Node 18: acceptance=0.256
Node 19: acceptance=0.438

=== PARALLEL EXECUTION TIME (realistic for distributed system) ===
  COMMUNICATION (max across nodes):
    - Sketch transfer: 0.000s (0.0%)
    - Model fetch (accepted): 0.000s (0.0%)
  COMPUTATION (max across nodes):
    - Sketching: 3.237s (99.4%)
    - Filtering: 0.002s (0.1%)
    - Aggregation: 0.018s (0.5%)
  TOTALS:
    - Total computation: 3.256s (100.0%)
    - Total communication: 0.000s (0.0%)
    - Total parallel time: 3.256s

=== PER-NODE AVERAGE TIME ===
  - Sketching: 2.400s
  - Filtering: 0.001s
  - Aggregation: 0.012s
  - Sketch transfer: 0.000s
  - Model fetch: 0.000s
  - Total per node: 2.413s

=== TOTAL COMPUTATIONAL WORK (sum across all nodes) ===
  - Total sketching: 47.994s
  - Total filtering: 0.022s
  - Total aggregation: 0.235s
  - Total sketch transfer: 0.000s
  - Total model fetch: 0.000s
  - Grand total: 48.251s
  - Mean acceptance rate: 0.359

Sketchguard Algorithm Properties:
  - Original dimension: 6,603,710
  - Sketch size: 1000
  - Compression ratio: 19.9x
  - Single repetition: No repetitions needed
  - Theoretical complexity: O(d + N×k)
  - Approach: Sketch filtering + state aggregation
