Device: cuda
Seed: 987654321
Loading 36 LEAF FEMNIST train files...
LEAF FEMNIST train: 3597 users, 734463 samples
Loading 36 LEAF FEMNIST test files...
LEAF FEMNIST test: 3597 users, 83388 samples
Found 3597 train users, 3597 test users, 3597 common users
User sample counts range: 525 (max) to 17 (min)
Distributed ALL 3597 users across 20 clients
Users per client: 179 (with 17 clients getting +1 user)
Train partition sizes: [36360, 37070, 35957, 38262, 36024, 37732, 36921, 38328, 36867, 37683, 36507, 36915, 36007, 37001, 35681, 35453, 36585, 36801, 35964, 36345]
Test partition sizes: [4128, 4203, 4081, 4333, 4091, 4287, 4193, 4349, 4191, 4277, 4143, 4193, 4093, 4197, 4052, 4029, 4153, 4183, 4084, 4128]
  Client 0: 36360 train samples, 62 unique classes
  Client 1: 37070 train samples, 62 unique classes
  Client 2: 35957 train samples, 62 unique classes
  Client 3: 38262 train samples, 62 unique classes
  Client 4: 36024 train samples, 62 unique classes
  Client 5: 37732 train samples, 62 unique classes
  Client 6: 36921 train samples, 62 unique classes
  Client 7: 38328 train samples, 62 unique classes
  Client 8: 36867 train samples, 62 unique classes
  Client 9: 37683 train samples, 62 unique classes
  Client 10: 36507 train samples, 62 unique classes
  Client 11: 36915 train samples, 62 unique classes
  Client 12: 36007 train samples, 62 unique classes
  Client 13: 37001 train samples, 62 unique classes
  Client 14: 35681 train samples, 62 unique classes
  Client 15: 35453 train samples, 62 unique classes
  Client 16: 36585 train samples, 62 unique classes
  Client 17: 36801 train samples, 62 unique classes
  Client 18: 35964 train samples, 62 unique classes
  Client 19: 36345 train samples, 62 unique classes
Will sample 10000 samples per client per epoch
Graph: erdos, nodes: 20, edges: 48
Degree statistics: avg=4.80, min=2, max=7
Attack: Compromised 8/20 nodes: [1, 5, 11, 12, 13, 14, 17, 18]
Attack type: backdoor, lambda: 1.0
Backdoor target label: 0, trigger size: 4
Model variant: baseline
Model parameters: 6,603,710
Sketchguard Node 0:
  Model dim: 6,603,710 → Sketch size: 1000
  Compression ratio: 6603.7x
  Using model parameters for aggregation, sketches for filtering
Sketchguard Node 1:
  Model dim: 6,603,710 → Sketch size: 1000
  Compression ratio: 6603.7x
  Using model parameters for aggregation, sketches for filtering
Sketchguard Node 2:
  Model dim: 6,603,710 → Sketch size: 1000
  Compression ratio: 6603.7x
  Using model parameters for aggregation, sketches for filtering
Sketchguard Node 3:
  Model dim: 6,603,710 → Sketch size: 1000
  Compression ratio: 6603.7x
  Using model parameters for aggregation, sketches for filtering
Sketchguard Node 4:
  Model dim: 6,603,710 → Sketch size: 1000
  Compression ratio: 6603.7x
  Using model parameters for aggregation, sketches for filtering
Sketchguard Node 5:
  Model dim: 6,603,710 → Sketch size: 1000
  Compression ratio: 6603.7x
  Using model parameters for aggregation, sketches for filtering
Sketchguard Node 6:
  Model dim: 6,603,710 → Sketch size: 1000
  Compression ratio: 6603.7x
  Using model parameters for aggregation, sketches for filtering
Sketchguard Node 7:
  Model dim: 6,603,710 → Sketch size: 1000
  Compression ratio: 6603.7x
  Using model parameters for aggregation, sketches for filtering
Sketchguard Node 8:
  Model dim: 6,603,710 → Sketch size: 1000
  Compression ratio: 6603.7x
  Using model parameters for aggregation, sketches for filtering
Sketchguard Node 9:
  Model dim: 6,603,710 → Sketch size: 1000
  Compression ratio: 6603.7x
  Using model parameters for aggregation, sketches for filtering
Sketchguard Node 10:
  Model dim: 6,603,710 → Sketch size: 1000
  Compression ratio: 6603.7x
  Using model parameters for aggregation, sketches for filtering
Sketchguard Node 11:
  Model dim: 6,603,710 → Sketch size: 1000
  Compression ratio: 6603.7x
  Using model parameters for aggregation, sketches for filtering
Sketchguard Node 12:
  Model dim: 6,603,710 → Sketch size: 1000
  Compression ratio: 6603.7x
  Using model parameters for aggregation, sketches for filtering
Sketchguard Node 13:
  Model dim: 6,603,710 → Sketch size: 1000
  Compression ratio: 6603.7x
  Using model parameters for aggregation, sketches for filtering
Sketchguard Node 14:
  Model dim: 6,603,710 → Sketch size: 1000
  Compression ratio: 6603.7x
  Using model parameters for aggregation, sketches for filtering
Sketchguard Node 15:
  Model dim: 6,603,710 → Sketch size: 1000
  Compression ratio: 6603.7x
  Using model parameters for aggregation, sketches for filtering
Sketchguard Node 16:
  Model dim: 6,603,710 → Sketch size: 1000
  Compression ratio: 6603.7x
  Using model parameters for aggregation, sketches for filtering
Sketchguard Node 17:
  Model dim: 6,603,710 → Sketch size: 1000
  Compression ratio: 6603.7x
  Using model parameters for aggregation, sketches for filtering
Sketchguard Node 18:
  Model dim: 6,603,710 → Sketch size: 1000
  Compression ratio: 6603.7x
  Using model parameters for aggregation, sketches for filtering
Sketchguard Node 19:
  Model dim: 6,603,710 → Sketch size: 1000
  Compression ratio: 6603.7x
  Using model parameters for aggregation, sketches for filtering
Sketchguard ALGORITHM (Sketch-based Filtering + State Aggregation)
  - Model dimension: 6,603,710 parameters
  - Config: SketchguardConfig(gamma=2, kappa=1, alpha=0.5, min_neighbors=1, sketch_size=1000, network_seed=987654321, attack_detection_window=5)
  - Sketch size: 1000
  - Compression ratio: 6603.7x
  - Complexity: O(d + N×k) = O(6,603,710 + 20×1000)
  - Theoretical speedup vs BALANCE: 19.9x
Initial test acc across nodes: mean=0.0162 ± 0.0138
Backdoor attack: Created poisoned datasets for 8 compromised nodes
Round 001: test acc mean=0.3032 ± 0.1630 | min=0.0474 max=0.5223
         : test loss mean=7007.7986 ± 8834.1524
         : individual accs = ['0.522287', '0.048775', '0.457731', '0.411032', '0.494011', '0.169582', '0.410207', '0.429984', '0.413982', '0.397942', '0.315955', '0.144288', '0.047398', '0.047653', '0.167078', '0.453959', '0.442572', '0.179297', '0.107738', '0.402132']
         : correct/total = [(2156, 4128), (205, 4203), (1868, 4081), (1781, 4333), (2021, 4091), (727, 4287), (1720, 4193), (1870, 4349), (1735, 4191), (1702, 4277), (1309, 4143), (605, 4193), (194, 4093), (200, 4197), (677, 4052), (1829, 4029), (1838, 4153), (750, 4183), (440, 4084), (1660, 4128)]
         : compromised: 0.1140, honest: 0.4293
         : sketchguard stats = ['Node 0: acc_rate=0.833', 'Node 1: acc_rate=0.833', 'Node 2: acc_rate=0.400']...
Round 002: test acc mean=0.4332 ± 0.3175 | min=0.0038 max=0.7146
         : test loss mean=409849.9655 ± 1538032.5273
         : individual accs = ['0.714632', '0.044968', '0.689782', '0.707824', '0.691762', '0.052484', '0.685190', '0.699931', '0.702935', '0.691372', '0.644461', '0.051514', '0.048131', '0.003812', '0.052320', '0.692480', '0.714183', '0.046378', '0.059745', '0.669574']
         : correct/total = [(2950, 4128), (189, 4203), (2815, 4081), (3067, 4333), (2830, 4091), (225, 4287), (2873, 4193), (3044, 4349), (2946, 4191), (2957, 4277), (2670, 4143), (216, 4193), (197, 4093), (16, 4197), (212, 4052), (2790, 4029), (2966, 4153), (194, 4183), (244, 4084), (2764, 4128)]
         : compromised: 0.0449, honest: 0.6920
         : sketchguard stats = ['Node 0: acc_rate=0.833', 'Node 1: acc_rate=0.917', 'Node 2: acc_rate=0.400']...
Round 003: test acc mean=0.4768 ± 0.3477 | min=0.0474 max=0.7833
         : test loss mean=nan ± nan
         : individual accs = ['0.777132', '0.048775', '0.749816', '0.757904', '0.771694', '0.058782', '0.759599', '0.765463', '0.783345', '0.750526', '0.718320', '0.048891', '0.047398', '0.047653', '0.054788', '0.751055', '0.777992', '0.049247', '0.054358', '0.763324']
         : correct/total = [(3208, 4128), (205, 4203), (3060, 4081), (3284, 4333), (3157, 4091), (252, 4287), (3185, 4193), (3329, 4349), (3283, 4191), (3210, 4277), (2976, 4143), (205, 4193), (194, 4093), (200, 4197), (222, 4052), (3026, 4029), (3231, 4153), (206, 4183), (222, 4084), (3151, 4128)]
         : compromised: 0.0512, honest: 0.7605
         : sketchguard stats = ['Node 0: acc_rate=0.833', 'Node 1: acc_rate=0.944', 'Node 2: acc_rate=0.400']...
Round 004: test acc mean=0.4946 ± 0.3628 | min=0.0474 max=0.8079
         : test loss mean=nan ± nan
         : individual accs = ['0.794331', '0.048775', '0.778486', '0.796907', '0.797604', '0.052484', '0.785595', '0.804323', '0.807922', '0.790274', '0.761525', '0.048891', '0.047398', '0.047653', '0.054788', '0.793497', '0.793884', '0.049247', '0.054358', '0.784399']
         : correct/total = [(3279, 4128), (205, 4203), (3177, 4081), (3453, 4333), (3263, 4091), (225, 4287), (3294, 4193), (3498, 4349), (3386, 4191), (3380, 4277), (3155, 4143), (205, 4193), (194, 4093), (200, 4197), (222, 4052), (3197, 4029), (3297, 4153), (206, 4183), (222, 4084), (3238, 4128)]
         : compromised: 0.0504, honest: 0.7907
         : sketchguard stats = ['Node 0: acc_rate=0.833', 'Node 1: acc_rate=0.708', 'Node 2: acc_rate=0.400']...
Round 005: test acc mean=0.5036 ± 0.3701 | min=0.0474 max=0.8244
         : test loss mean=nan ± nan
         : individual accs = ['0.806202', '0.048775', '0.792943', '0.801985', '0.811538', '0.052484', '0.799666', '0.811911', '0.824386', '0.801730', '0.785663', '0.048891', '0.047398', '0.047653', '0.054788', '0.809630', '0.812425', '0.049247', '0.054358', '0.811289']
         : correct/total = [(3328, 4128), (205, 4203), (3236, 4081), (3475, 4333), (3320, 4091), (225, 4287), (3353, 4193), (3531, 4349), (3455, 4191), (3429, 4277), (3255, 4143), (205, 4193), (194, 4093), (200, 4197), (222, 4052), (3262, 4029), (3374, 4153), (206, 4183), (222, 4084), (3349, 4128)]
         : compromised: 0.0504, honest: 0.8058
         : sketchguard stats = ['Node 0: acc_rate=0.833', 'Node 1: acc_rate=0.567', 'Node 2: acc_rate=0.400']...
Round 006: test acc mean=0.5098 ± 0.3751 | min=0.0474 max=0.8296
         : test loss mean=nan ± nan
         : individual accs = ['0.809835', '0.048775', '0.800784', '0.820448', '0.810560', '0.052484', '0.819223', '0.829616', '0.829158', '0.817863', '0.802076', '0.048891', '0.047398', '0.047653', '0.054788', '0.815091', '0.825909', '0.049247', '0.054358', '0.811047']
         : correct/total = [(3343, 4128), (205, 4203), (3268, 4081), (3555, 4333), (3316, 4091), (225, 4287), (3435, 4193), (3608, 4349), (3475, 4191), (3498, 4277), (3323, 4143), (205, 4193), (194, 4093), (200, 4197), (222, 4052), (3284, 4029), (3430, 4153), (206, 4183), (222, 4084), (3348, 4128)]
         : compromised: 0.0504, honest: 0.8160
         : sketchguard stats = ['Node 0: acc_rate=0.833', 'Node 1: acc_rate=0.472', 'Node 2: acc_rate=0.400']...
Round 007: test acc mean=0.5150 ± 0.3794 | min=0.0474 max=0.8365
         : test loss mean=nan ± nan
         : individual accs = ['0.824370', '0.048775', '0.806175', '0.834757', '0.825226', '0.052484', '0.829001', '0.836514', '0.831067', '0.829787', '0.809317', '0.048891', '0.047398', '0.047653', '0.054788', '0.820551', '0.834818', '0.049247', '0.054358', '0.815649']
         : correct/total = [(3403, 4128), (205, 4203), (3290, 4081), (3617, 4333), (3376, 4091), (225, 4287), (3476, 4193), (3638, 4349), (3483, 4191), (3549, 4277), (3353, 4143), (205, 4193), (194, 4093), (200, 4197), (222, 4052), (3306, 4029), (3467, 4153), (206, 4183), (222, 4084), (3367, 4128)]
         : compromised: 0.0504, honest: 0.8248
         : sketchguard stats = ['Node 0: acc_rate=0.833', 'Node 1: acc_rate=0.405', 'Node 2: acc_rate=0.400']...
Round 008: test acc mean=0.5158 ± 0.3800 | min=0.0474 max=0.8416
         : test loss mean=nan ± nan
         : individual accs = ['0.824855', '0.048775', '0.804460', '0.835449', '0.828893', '0.052484', '0.829001', '0.841573', '0.832737', '0.836100', '0.814386', '0.048891', '0.047398', '0.047653', '0.054788', '0.824522', '0.828798', '0.049247', '0.054358', '0.811289']
         : correct/total = [(3405, 4128), (205, 4203), (3283, 4081), (3620, 4333), (3391, 4091), (225, 4287), (3476, 4193), (3660, 4349), (3490, 4191), (3576, 4277), (3374, 4143), (205, 4193), (194, 4093), (200, 4197), (222, 4052), (3322, 4029), (3442, 4153), (206, 4183), (222, 4084), (3349, 4128)]
         : compromised: 0.0504, honest: 0.8260
         : sketchguard stats = ['Node 0: acc_rate=0.833', 'Node 1: acc_rate=0.354', 'Node 2: acc_rate=0.400']...
Round 009: test acc mean=0.5215 ± 0.3846 | min=0.0474 max=0.8459
         : test loss mean=nan ± nan
         : individual accs = ['0.830426', '0.048775', '0.826268', '0.842834', '0.828648', '0.052484', '0.841641', '0.843642', '0.845860', '0.845452', '0.830075', '0.048891', '0.047398', '0.047653', '0.054788', '0.827501', '0.830484', '0.049247', '0.054358', '0.833091']
         : correct/total = [(3428, 4128), (205, 4203), (3372, 4081), (3652, 4333), (3390, 4091), (225, 4287), (3529, 4193), (3669, 4349), (3545, 4191), (3616, 4277), (3439, 4143), (205, 4193), (194, 4093), (200, 4197), (222, 4052), (3334, 4029), (3449, 4153), (206, 4183), (222, 4084), (3439, 4128)]
         : compromised: 0.0504, honest: 0.8355
         : sketchguard stats = ['Node 0: acc_rate=0.833', 'Node 1: acc_rate=0.315', 'Node 2: acc_rate=0.400']...
Round 010: test acc mean=0.5234 ± 0.3862 | min=0.0474 max=0.8492
         : test loss mean=nan ± nan
         : individual accs = ['0.835514', '0.048775', '0.828473', '0.844450', '0.834270', '0.052484', '0.842118', '0.845712', '0.849201', '0.846154', '0.832247', '0.048891', '0.047398', '0.047653', '0.054788', '0.840655', '0.832410', '0.049247', '0.054358', '0.833091']
         : correct/total = [(3449, 4128), (205, 4203), (3381, 4081), (3659, 4333), (3413, 4091), (225, 4287), (3531, 4193), (3678, 4349), (3559, 4191), (3619, 4277), (3448, 4143), (205, 4193), (194, 4093), (200, 4197), (222, 4052), (3387, 4029), (3457, 4153), (206, 4183), (222, 4084), (3439, 4128)]
         : compromised: 0.0504, honest: 0.8387
         : sketchguard stats = ['Node 0: acc_rate=0.833', 'Node 1: acc_rate=0.283', 'Node 2: acc_rate=0.400']...

=== FINAL RESULTS ===
Dataset: femnist, Nodes: 20, Graph: erdos, Aggregation: sketchguard
Attack: backdoor, 40.0% compromised
Final accuracy - Compromised: 0.0504, Honest: 0.8387
Overall test accuracy: mean=0.5234 ± 0.3862

=== BACKDOOR ATTACK SUCCESS RATE (ASR) ===
Target label: 0
Trigger size: 4x4
Overall ASR: 0.4325 ± 0.4634
Honest nodes ASR: 0.0541 ± 0.0042
Compromised nodes ASR: 1.0000 ± 0.0000
Note: Higher ASR indicates more successful backdoor attack

=== Sketchguard SUMMARY ===
Node 0: acceptance=0.833
Node 1: acceptance=0.283
Node 2: acceptance=0.400
Node 3: acceptance=0.500
Node 4: acceptance=0.250
Node 5: acceptance=0.220
Node 6: acceptance=0.600
Node 7: acceptance=0.600
Node 8: acceptance=0.500
Node 9: acceptance=0.667
Node 10: acceptance=0.500
Node 11: acceptance=0.243
Node 12: acceptance=0.271
Node 13: acceptance=0.250
Node 14: acceptance=0.243
Node 15: acceptance=0.333
Node 16: acceptance=0.200
Node 17: acceptance=0.260
Node 18: acceptance=0.275
Node 19: acceptance=1.000

=== PARALLEL EXECUTION TIME (realistic for distributed system) ===
  COMMUNICATION (max across nodes):
    - Sketch transfer: 0.000s (0.0%)
    - Model fetch (accepted): 0.000s (0.0%)
  COMPUTATION (max across nodes):
    - Sketching: 2.425s (99.2%)
    - Filtering: 0.002s (0.1%)
    - Aggregation: 0.018s (0.7%)
  TOTALS:
    - Total computation: 2.445s (100.0%)
    - Total communication: 0.000s (0.0%)
    - Total parallel time: 2.445s

=== PER-NODE AVERAGE TIME ===
  - Sketching: 1.589s
  - Filtering: 0.001s
  - Aggregation: 0.010s
  - Sketch transfer: 0.000s
  - Model fetch: 0.000s
  - Total per node: 1.600s

=== TOTAL COMPUTATIONAL WORK (sum across all nodes) ===
  - Total sketching: 31.775s
  - Total filtering: 0.015s
  - Total aggregation: 0.204s
  - Total sketch transfer: 0.000s
  - Total model fetch: 0.000s
  - Grand total: 31.994s
  - Mean acceptance rate: 0.421

Sketchguard Algorithm Properties:
  - Original dimension: 6,603,710
  - Sketch size: 1000
  - Compression ratio: 19.9x
  - Single repetition: No repetitions needed
  - Theoretical complexity: O(d + N×k)
  - Approach: Sketch filtering + state aggregation
