Device: cuda
Seed: 987654321
Loading 36 LEAF FEMNIST train files...
LEAF FEMNIST train: 3597 users, 734463 samples
Loading 36 LEAF FEMNIST test files...
LEAF FEMNIST test: 3597 users, 83388 samples
Found 3597 train users, 3597 test users, 3597 common users
User sample counts range: 525 (max) to 17 (min)
Distributed ALL 3597 users across 20 clients
Users per client: 179 (with 17 clients getting +1 user)
Train partition sizes: [36360, 37070, 35957, 38262, 36024, 37732, 36921, 38328, 36867, 37683, 36507, 36915, 36007, 37001, 35681, 35453, 36585, 36801, 35964, 36345]
Test partition sizes: [4128, 4203, 4081, 4333, 4091, 4287, 4193, 4349, 4191, 4277, 4143, 4193, 4093, 4197, 4052, 4029, 4153, 4183, 4084, 4128]
  Client 0: 36360 train samples, 62 unique classes
  Client 1: 37070 train samples, 62 unique classes
  Client 2: 35957 train samples, 62 unique classes
  Client 3: 38262 train samples, 62 unique classes
  Client 4: 36024 train samples, 62 unique classes
  Client 5: 37732 train samples, 62 unique classes
  Client 6: 36921 train samples, 62 unique classes
  Client 7: 38328 train samples, 62 unique classes
  Client 8: 36867 train samples, 62 unique classes
  Client 9: 37683 train samples, 62 unique classes
  Client 10: 36507 train samples, 62 unique classes
  Client 11: 36915 train samples, 62 unique classes
  Client 12: 36007 train samples, 62 unique classes
  Client 13: 37001 train samples, 62 unique classes
  Client 14: 35681 train samples, 62 unique classes
  Client 15: 35453 train samples, 62 unique classes
  Client 16: 36585 train samples, 62 unique classes
  Client 17: 36801 train samples, 62 unique classes
  Client 18: 35964 train samples, 62 unique classes
  Client 19: 36345 train samples, 62 unique classes
Will sample 4500 samples per client per epoch
Graph: ring, nodes: 20, edges: 20
Degree statistics: avg=2.00, min=2, max=2
Attack: Compromised 10/20 nodes: [1, 2, 5, 11, 12, 13, 14, 15, 17, 18]
Attack type: krum, lambda: 1.0
Model variant: baseline
Model parameters: 6,603,710
UBAR ALGORITHM (Two-Stage Byzantine-resilient)
  - Model dimension: 6,603,710 parameters
  - Rho parameter: 0.5
  - Stage 1: Distance-based filtering (select 50% closest neighbors)
  - Stage 2: Performance-based selection (loss comparison)
  - Complexity: O(deg(i)×d + deg(i)×inference)
Initial test acc across nodes: mean=0.0168 ± 0.0139
Round 001: test acc mean=0.0433 ± 0.0166 | min=0.0048 max=0.0608
         : test loss mean=2896.9741 ± 6061.3439
         : individual accs = ['0.049661', '0.052344', '0.055134', '0.043157', '0.043021', '0.048519', '0.044598', '0.049207', '0.047960', '0.050503', '0.055274', '0.060816', '0.045443', '0.005718', '0.004936', '0.050385', '0.004816', '0.050920', '0.054358', '0.050145']
         : correct/total = [(205, 4128), (220, 4203), (225, 4081), (187, 4333), (176, 4091), (208, 4287), (187, 4193), (214, 4349), (201, 4191), (216, 4277), (229, 4143), (255, 4193), (186, 4093), (24, 4197), (20, 4052), (203, 4029), (20, 4153), (213, 4183), (222, 4084), (207, 4128)]
         : compromised: 0.0429, honest: 0.0438
         : ubar stats = ['Node 0: s1=0.500, s2=1.000', 'Node 1: s1=0.500, s2=1.000', 'Node 2: s1=0.500, s2=1.000']...
Round 002: test acc mean=0.0504 ± 0.0054 | min=0.0337 max=0.0582
         : test loss mean=317631869.8500 ± 1374022488.8504
         : individual accs = ['0.051599', '0.046158', '0.057584', '0.052850', '0.057932', '0.050618', '0.057000', '0.058174', '0.051062', '0.048398', '0.045619', '0.046983', '0.033716', '0.049559', '0.047878', '0.051378', '0.049362', '0.051159', '0.052889', '0.048450']
         : correct/total = [(213, 4128), (194, 4203), (235, 4081), (229, 4333), (237, 4091), (217, 4287), (239, 4193), (253, 4349), (214, 4191), (207, 4277), (189, 4143), (197, 4193), (138, 4093), (208, 4197), (194, 4052), (207, 4029), (205, 4153), (214, 4183), (216, 4084), (200, 4128)]
         : compromised: 0.0488, honest: 0.0520
         : ubar stats = ['Node 0: s1=0.500, s2=1.000', 'Node 1: s1=0.500, s2=1.000', 'Node 2: s1=0.500, s2=1.000']...
Round 003: test acc mean=0.0507 ± 0.0081 | min=0.0323 max=0.0727
         : test loss mean=403364155.2032 ± 1292229722.4076
         : individual accs = ['0.059593', '0.050916', '0.050723', '0.052850', '0.057932', '0.050618', '0.044598', '0.049207', '0.051539', '0.047463', '0.055274', '0.053184', '0.053750', '0.045747', '0.048124', '0.032266', '0.044546', '0.037533', '0.072723', '0.055475']
         : correct/total = [(246, 4128), (214, 4203), (207, 4081), (229, 4333), (237, 4091), (217, 4287), (187, 4193), (214, 4349), (216, 4191), (203, 4277), (229, 4143), (223, 4193), (220, 4093), (192, 4197), (195, 4052), (130, 4029), (185, 4153), (157, 4183), (297, 4084), (229, 4128)]
         : compromised: 0.0496, honest: 0.0518
         : ubar stats = ['Node 0: s1=0.500, s2=1.000', 'Node 1: s1=0.500, s2=1.000', 'Node 2: s1=0.500, s2=1.000']...
Round 004: test acc mean=0.0589 ± 0.0160 | min=0.0456 max=0.0974
         : test loss mean=842837348218.3781 ± 2965439153219.8745
         : individual accs = ['0.097384', '0.052344', '0.057584', '0.052850', '0.057932', '0.051085', '0.082518', '0.086917', '0.049630', '0.048398', '0.045619', '0.046983', '0.049597', '0.055278', '0.048124', '0.050633', '0.051288', '0.048291', '0.052889', '0.092539']
         : correct/total = [(402, 4128), (220, 4203), (235, 4081), (229, 4333), (237, 4091), (219, 4287), (346, 4193), (378, 4349), (208, 4191), (207, 4277), (189, 4143), (197, 4193), (203, 4093), (232, 4197), (195, 4052), (204, 4029), (213, 4153), (202, 4183), (216, 4084), (382, 4128)]
         : compromised: 0.0513, honest: 0.0665
         : ubar stats = ['Node 0: s1=0.500, s2=1.000', 'Node 1: s1=0.500, s2=1.000', 'Node 2: s1=0.500, s2=1.000']...
Round 005: test acc mean=0.0583 ± 0.0157 | min=0.0308 max=0.1009
         : test loss mean=10819716178.8471 ± 47161952814.0969
         : individual accs = ['0.089874', '0.052344', '0.072286', '0.054466', '0.059399', '0.050618', '0.046745', '0.047827', '0.100931', '0.053776', '0.055998', '0.054853', '0.049597', '0.055278', '0.051826', '0.051626', '0.030821', '0.049486', '0.056317', '0.081638']
         : correct/total = [(371, 4128), (220, 4203), (295, 4081), (236, 4333), (243, 4091), (217, 4287), (196, 4193), (208, 4349), (423, 4191), (230, 4277), (232, 4143), (230, 4193), (203, 4093), (232, 4197), (210, 4052), (208, 4029), (128, 4153), (207, 4183), (230, 4084), (337, 4128)]
         : compromised: 0.0544, honest: 0.0621
         : ubar stats = ['Node 0: s1=0.500, s2=1.000', 'Node 1: s1=0.500, s2=1.000', 'Node 2: s1=0.500, s2=1.000']...
Round 006: test acc mean=0.0544 ± 0.0094 | min=0.0303 max=0.0770
         : test loss mean=29383256904.6275 ± 119297681808.0773
         : individual accs = ['0.077035', '0.062099', '0.057584', '0.052850', '0.057932', '0.051318', '0.043883', '0.053346', '0.053448', '0.054711', '0.052378', '0.061770', '0.049841', '0.055278', '0.047878', '0.050881', '0.030340', '0.048291', '0.055583', '0.071221']
         : correct/total = [(318, 4128), (261, 4203), (235, 4081), (229, 4333), (237, 4091), (220, 4287), (184, 4193), (232, 4349), (224, 4191), (234, 4277), (217, 4143), (259, 4193), (204, 4093), (232, 4197), (194, 4052), (205, 4029), (126, 4153), (202, 4183), (227, 4084), (294, 4128)]
         : compromised: 0.0541, honest: 0.0547
         : ubar stats = ['Node 0: s1=0.500, s2=1.000', 'Node 1: s1=0.500, s2=1.000', 'Node 2: s1=0.500, s2=1.000']...
Round 007: test acc mean=0.0665 ± 0.0276 | min=0.0448 max=0.1410
         : test loss mean=20519314.0144 ± 88025690.2440
         : individual accs = ['0.140988', '0.052344', '0.057584', '0.044773', '0.047421', '0.076044', '0.097544', '0.092205', '0.053686', '0.055413', '0.056722', '0.053899', '0.052040', '0.049083', '0.051579', '0.056590', '0.054418', '0.050920', '0.050930', '0.136386']
         : correct/total = [(582, 4128), (220, 4203), (235, 4081), (194, 4333), (194, 4091), (326, 4287), (409, 4193), (401, 4349), (225, 4191), (237, 4277), (235, 4143), (226, 4193), (213, 4093), (206, 4197), (209, 4052), (228, 4029), (226, 4153), (213, 4183), (208, 4084), (563, 4128)]
         : compromised: 0.0551, honest: 0.0780
         : ubar stats = ['Node 0: s1=0.500, s2=1.000', 'Node 1: s1=0.500, s2=1.000', 'Node 2: s1=0.500, s2=1.000']...
Round 008: test acc mean=0.0669 ± 0.0340 | min=0.0164 max=0.1514
         : test loss mean=47971176.7266 ± 209099384.1845
         : individual accs = ['0.151405', '0.110635', '0.053908', '0.085160', '0.087509', '0.053884', '0.049130', '0.051276', '0.089955', '0.067103', '0.068791', '0.053899', '0.016369', '0.037408', '0.051826', '0.028295', '0.058271', '0.028927', '0.057052', '0.137112']
         : correct/total = [(625, 4128), (465, 4203), (220, 4081), (369, 4333), (358, 4091), (231, 4287), (206, 4193), (223, 4349), (377, 4191), (287, 4277), (285, 4143), (226, 4193), (67, 4093), (157, 4197), (210, 4052), (114, 4029), (242, 4153), (121, 4183), (233, 4084), (566, 4128)]
         : compromised: 0.0492, honest: 0.0846
         : ubar stats = ['Node 0: s1=0.500, s2=1.000', 'Node 1: s1=0.500, s2=1.000', 'Node 2: s1=0.500, s2=1.000']...
Round 009: test acc mean=0.0507 ± 0.0170 | min=0.0164 max=0.0770
         : test loss mean=35863.8028 ± 129576.9773
         : individual accs = ['0.061773', '0.050916', '0.057584', '0.054927', '0.058910', '0.076977', '0.070832', '0.059784', '0.060606', '0.048632', '0.045619', '0.054853', '0.016369', '0.049559', '0.051826', '0.022834', '0.021430', '0.021516', '0.073457', '0.055717']
         : correct/total = [(255, 4128), (214, 4203), (235, 4081), (238, 4333), (241, 4091), (330, 4287), (297, 4193), (260, 4349), (254, 4191), (208, 4277), (189, 4143), (230, 4193), (67, 4093), (208, 4197), (210, 4052), (92, 4029), (89, 4153), (90, 4183), (300, 4084), (230, 4128)]
         : compromised: 0.0476, honest: 0.0538
         : ubar stats = ['Node 0: s1=0.500, s2=1.000', 'Node 1: s1=0.500, s2=1.000', 'Node 2: s1=0.500, s2=1.000']...
Round 010: test acc mean=0.0649 ± 0.0261 | min=0.0164 max=0.1330
         : test loss mean=3936.8271 ± 17102.9144
         : individual accs = ['0.104167', '0.100404', '0.058074', '0.052850', '0.057932', '0.132960', '0.055092', '0.058634', '0.053448', '0.053776', '0.055998', '0.079180', '0.016369', '0.049559', '0.061204', '0.051378', '0.030821', '0.051159', '0.079334', '0.095203']
         : correct/total = [(430, 4128), (422, 4203), (237, 4081), (229, 4333), (237, 4091), (570, 4287), (231, 4193), (255, 4349), (224, 4191), (230, 4277), (232, 4143), (332, 4193), (67, 4093), (208, 4197), (248, 4052), (207, 4029), (128, 4153), (214, 4183), (324, 4084), (393, 4128)]
         : compromised: 0.0680, honest: 0.0618
         : ubar stats = ['Node 0: s1=0.500, s2=1.000', 'Node 1: s1=0.500, s2=1.000', 'Node 2: s1=0.500, s2=1.000']...

=== FINAL RESULTS ===
Dataset: femnist, Nodes: 20, Graph: ring, Aggregation: ubar
Attack: krum, 50.0% compromised
Final accuracy - Compromised: 0.0680, Honest: 0.0618
Overall test accuracy: mean=0.0649 ± 0.0261

=== UBAR SUMMARY ===
Node 0: stage1=0.500, stage2=1.000, overall=0.500
Node 1: stage1=0.500, stage2=1.000, overall=0.500
Node 2: stage1=0.500, stage2=1.000, overall=0.500
Node 3: stage1=0.500, stage2=1.000, overall=0.500
Node 4: stage1=0.500, stage2=1.000, overall=0.500
Node 5: stage1=0.500, stage2=1.000, overall=0.500
Node 6: stage1=0.500, stage2=1.000, overall=0.500
Node 7: stage1=0.500, stage2=1.000, overall=0.500
Node 8: stage1=0.500, stage2=1.000, overall=0.500
Node 9: stage1=0.500, stage2=1.000, overall=0.500
Node 10: stage1=0.500, stage2=1.000, overall=0.500
Node 11: stage1=0.500, stage2=1.000, overall=0.500
Node 12: stage1=0.500, stage2=1.000, overall=0.500
Node 13: stage1=0.500, stage2=1.000, overall=0.500
Node 14: stage1=0.500, stage2=1.000, overall=0.500
Node 15: stage1=0.500, stage2=1.000, overall=0.500
Node 16: stage1=0.500, stage2=1.000, overall=0.500
Node 17: stage1=0.500, stage2=1.000, overall=0.500
Node 18: stage1=0.500, stage2=1.000, overall=0.500
Node 19: stage1=0.500, stage2=1.000, overall=0.500

=== PARALLEL EXECUTION TIME (realistic for distributed system) ===
  COMMUNICATION (max across nodes):
    - Full model transfer: 0.000s (0.0%)
  COMPUTATION (max across nodes):
    - Distance computation: 0.029s (0.7%)
    - Loss computation: 4.085s (99.2%)
    - Aggregation: 0.006s (0.1%)
  TOTALS:
    - Total computation: 4.119s (100.0%)
    - Total communication: 0.000s (0.0%)
    - Total parallel time: 4.119s

=== PER-NODE AVERAGE TIME ===
  - Distance computation: 0.018s
  - Loss computation: 3.838s
  - Aggregation: 0.004s
  - Model transfer: 0.000s
  - Total per node: 3.860s

=== TOTAL COMPUTATIONAL WORK (sum across all nodes) ===
  - Total distance computation: 0.351s
  - Total loss computation: 76.765s
  - Total aggregation: 0.088s
  - Total model transfer: 0.000s
  - Grand total: 77.204s
  - Mean Stage 1 acceptance rate: 0.500
  - Mean Stage 2 acceptance rate: 1.000
  - Overall acceptance rate: 0.500

UBAR Algorithm Properties:
  - Model dimension: 6,603,710
  - Rho parameter: 0.5
  - Two-stage approach: Distance filtering + loss evaluation
  - Stage 1 selects: 50% of neighbors
  - Stage 2 uses: Training sample loss comparison
  - Theoretical complexity: O(deg(i)×d + deg(i)×inference)
  - Approach: UBAR paper implementation
