Device: cuda
Seed: 987654321
Loading 36 LEAF FEMNIST train files...
LEAF FEMNIST train: 3597 users, 734463 samples
Loading 36 LEAF FEMNIST test files...
LEAF FEMNIST test: 3597 users, 83388 samples
Found 3597 train users, 3597 test users, 3597 common users
User sample counts range: 525 (max) to 17 (min)
Distributed ALL 3597 users across 20 clients
Users per client: 179 (with 17 clients getting +1 user)
Train partition sizes: [36360, 37070, 35957, 38262, 36024, 37732, 36921, 38328, 36867, 37683, 36507, 36915, 36007, 37001, 35681, 35453, 36585, 36801, 35964, 36345]
Test partition sizes: [4128, 4203, 4081, 4333, 4091, 4287, 4193, 4349, 4191, 4277, 4143, 4193, 4093, 4197, 4052, 4029, 4153, 4183, 4084, 4128]
  Client 0: 36360 train samples, 62 unique classes
  Client 1: 37070 train samples, 62 unique classes
  Client 2: 35957 train samples, 62 unique classes
  Client 3: 38262 train samples, 62 unique classes
  Client 4: 36024 train samples, 62 unique classes
  Client 5: 37732 train samples, 62 unique classes
  Client 6: 36921 train samples, 62 unique classes
  Client 7: 38328 train samples, 62 unique classes
  Client 8: 36867 train samples, 62 unique classes
  Client 9: 37683 train samples, 62 unique classes
  Client 10: 36507 train samples, 62 unique classes
  Client 11: 36915 train samples, 62 unique classes
  Client 12: 36007 train samples, 62 unique classes
  Client 13: 37001 train samples, 62 unique classes
  Client 14: 35681 train samples, 62 unique classes
  Client 15: 35453 train samples, 62 unique classes
  Client 16: 36585 train samples, 62 unique classes
  Client 17: 36801 train samples, 62 unique classes
  Client 18: 35964 train samples, 62 unique classes
  Client 19: 36345 train samples, 62 unique classes
Will sample 4500 samples per client per epoch
Graph: ring, nodes: 20, edges: 20
Degree statistics: avg=2.00, min=2, max=2
Attack: Compromised 4/20 nodes: [5, 12, 13, 17]
Attack type: gaussian, lambda: 1.0
Model variant: baseline
Model parameters: 6,603,710
UBAR ALGORITHM (Two-Stage Byzantine-resilient)
  - Model dimension: 6,603,710 parameters
  - Rho parameter: 0.8
  - Stage 1: Distance-based filtering (select 80% closest neighbors)
  - Stage 2: Performance-based selection (loss comparison)
  - Complexity: O(deg(i)×d + deg(i)×inference)
Initial test acc across nodes: mean=0.0168 ± 0.0139
Round 001: test acc mean=0.0506 ± 0.0046 | min=0.0430 max=0.0608
         : test loss mean=3.9742 ± 0.0181
         : individual accs = ['0.059593', '0.051630', '0.050723', '0.047773', '0.043021', '0.048519', '0.044598', '0.049207', '0.047960', '0.050503', '0.049722', '0.060816', '0.054239', '0.046938', '0.056762', '0.051874', '0.047195', '0.050920', '0.054358', '0.044816']
         : correct/total = [(246, 4128), (217, 4203), (207, 4081), (207, 4333), (176, 4091), (208, 4287), (187, 4193), (214, 4349), (201, 4191), (216, 4277), (206, 4143), (255, 4193), (222, 4093), (197, 4197), (230, 4052), (209, 4029), (196, 4153), (213, 4183), (222, 4084), (185, 4128)]
         : compromised: 0.0502, honest: 0.0507
         : ubar stats = ['Node 0: s1=0.500, s2=1.000', 'Node 1: s1=0.500, s2=1.000', 'Node 2: s1=0.500, s2=1.000']...
Round 002: test acc mean=0.0571 ± 0.0143 | min=0.0449 max=0.0933
         : test loss mean=3.7237 ± 0.0479
         : individual accs = ['0.051599', '0.051630', '0.050723', '0.052850', '0.057932', '0.050618', '0.057000', '0.058174', '0.051062', '0.044891', '0.045619', '0.046983', '0.049597', '0.088635', '0.088105', '0.093323', '0.054418', '0.048291', '0.052889', '0.048450']
         : correct/total = [(213, 4128), (217, 4203), (207, 4081), (229, 4333), (237, 4091), (217, 4287), (239, 4193), (253, 4349), (214, 4191), (192, 4277), (189, 4143), (197, 4193), (203, 4093), (372, 4197), (357, 4052), (376, 4029), (226, 4153), (202, 4183), (216, 4084), (200, 4128)]
         : compromised: 0.0593, honest: 0.0566
         : ubar stats = ['Node 0: s1=0.500, s2=1.000', 'Node 1: s1=0.500, s2=1.000', 'Node 2: s1=0.500, s2=1.000']...
Round 003: test acc mean=0.0568 ± 0.0145 | min=0.0446 max=0.1019
         : test loss mean=3.6837 ± 0.0163
         : individual accs = ['0.049661', '0.051630', '0.050723', '0.052850', '0.057932', '0.050618', '0.044598', '0.049207', '0.051539', '0.047463', '0.055274', '0.053184', '0.058637', '0.055278', '0.048124', '0.056342', '0.055141', '0.050203', '0.101861', '0.095930']
         : correct/total = [(205, 4128), (217, 4203), (207, 4081), (229, 4333), (237, 4091), (217, 4287), (187, 4193), (214, 4349), (216, 4191), (203, 4277), (229, 4143), (223, 4193), (240, 4093), (232, 4197), (195, 4052), (227, 4029), (229, 4153), (210, 4183), (416, 4084), (396, 4128)]
         : compromised: 0.0537, honest: 0.0576
         : ubar stats = ['Node 0: s1=0.500, s2=1.000', 'Node 1: s1=0.500, s2=1.000', 'Node 2: s1=0.500, s2=1.000']...
Round 004: test acc mean=0.0578 ± 0.0113 | min=0.0435 max=0.0869
         : test loss mean=3.6802 ± 0.0177
         : individual accs = ['0.059593', '0.062574', '0.073756', '0.052850', '0.057932', '0.051085', '0.082518', '0.086917', '0.049630', '0.043488', '0.045619', '0.046983', '0.054239', '0.062426', '0.061204', '0.056590', '0.058271', '0.049486', '0.052889', '0.048450']
         : correct/total = [(246, 4128), (263, 4203), (301, 4081), (229, 4333), (237, 4091), (219, 4287), (346, 4193), (378, 4349), (208, 4191), (186, 4277), (189, 4143), (197, 4193), (222, 4093), (262, 4197), (248, 4052), (228, 4029), (242, 4153), (207, 4183), (216, 4084), (200, 4128)]
         : compromised: 0.0543, honest: 0.0587
         : ubar stats = ['Node 0: s1=0.500, s2=1.000', 'Node 1: s1=0.500, s2=1.000', 'Node 2: s1=0.500, s2=1.000']...
Round 005: test acc mean=0.0627 ± 0.0179 | min=0.0467 max=0.1083
         : test loss mean=3.6794 ± 0.0169
         : individual accs = ['0.059593', '0.052344', '0.057584', '0.053773', '0.059154', '0.050618', '0.046745', '0.047827', '0.100931', '0.108253', '0.080618', '0.076079', '0.053750', '0.046938', '0.051579', '0.054852', '0.090537', '0.050920', '0.055583', '0.055475']
         : correct/total = [(246, 4128), (220, 4203), (235, 4081), (233, 4333), (242, 4091), (217, 4287), (196, 4193), (208, 4349), (423, 4191), (463, 4277), (334, 4143), (319, 4193), (220, 4093), (197, 4197), (209, 4052), (221, 4029), (376, 4153), (213, 4183), (227, 4084), (229, 4128)]
         : compromised: 0.0506, honest: 0.0657
         : ubar stats = ['Node 0: s1=0.500, s2=1.000', 'Node 1: s1=0.500, s2=1.000', 'Node 2: s1=0.500, s2=1.000']...
Round 006: test acc mean=0.0611 ± 0.0166 | min=0.0439 max=0.1078
         : test loss mean=3.6778 ± 0.0179
         : individual accs = ['0.085271', '0.052344', '0.057584', '0.052850', '0.057932', '0.051318', '0.043883', '0.053346', '0.053448', '0.053776', '0.050447', '0.061770', '0.053750', '0.062426', '0.107848', '0.102259', '0.058993', '0.050920', '0.055583', '0.055475']
         : correct/total = [(352, 4128), (220, 4203), (235, 4081), (229, 4333), (237, 4091), (220, 4287), (184, 4193), (232, 4349), (224, 4191), (230, 4277), (209, 4143), (259, 4193), (220, 4093), (262, 4197), (437, 4052), (412, 4029), (245, 4153), (213, 4183), (227, 4084), (229, 4128)]
         : compromised: 0.0546, honest: 0.0627
         : ubar stats = ['Node 0: s1=0.500, s2=1.000', 'Node 1: s1=0.500, s2=1.000', 'Node 2: s1=0.500, s2=1.000']...
Round 007: test acc mean=0.0623 ± 0.0171 | min=0.0448 max=0.0999
         : test loss mean=3.6766 ± 0.0177
         : individual accs = ['0.059593', '0.052344', '0.057584', '0.044773', '0.047421', '0.076044', '0.097544', '0.092205', '0.053686', '0.053776', '0.055998', '0.053899', '0.058637', '0.085776', '0.051826', '0.051626', '0.099928', '0.051159', '0.050930', '0.050872']
         : correct/total = [(246, 4128), (220, 4203), (235, 4081), (194, 4333), (194, 4091), (326, 4287), (409, 4193), (401, 4349), (225, 4191), (230, 4277), (232, 4143), (226, 4193), (240, 4093), (360, 4197), (210, 4052), (208, 4029), (415, 4153), (214, 4183), (208, 4084), (210, 4128)]
         : compromised: 0.0679, honest: 0.0609
         : ubar stats = ['Node 0: s1=0.500, s2=1.000', 'Node 1: s1=0.500, s2=1.000', 'Node 2: s1=0.500, s2=1.000']...
Round 008: test acc mean=0.0686 ± 0.0182 | min=0.0491 max=0.1049
         : test loss mean=3.6755 ± 0.0184
         : individual accs = ['0.104893', '0.068998', '0.071551', '0.082391', '0.086287', '0.053884', '0.049130', '0.051276', '0.090670', '0.096797', '0.057929', '0.055569', '0.104080', '0.062664', '0.061945', '0.056590', '0.055141', '0.050920', '0.055583', '0.055475']
         : correct/total = [(433, 4128), (290, 4203), (292, 4081), (357, 4333), (353, 4091), (231, 4287), (206, 4193), (223, 4349), (380, 4191), (414, 4277), (240, 4143), (233, 4193), (426, 4093), (263, 4197), (251, 4052), (228, 4029), (229, 4153), (213, 4183), (227, 4084), (229, 4128)]
         : compromised: 0.0679, honest: 0.0688
         : ubar stats = ['Node 0: s1=0.500, s2=1.000', 'Node 1: s1=0.500, s2=1.000', 'Node 2: s1=0.500, s2=1.000']...
Round 009: test acc mean=0.0755 ± 0.0276 | min=0.0497 max=0.1551
         : test loss mean=3.6727 ± 0.0182
         : individual accs = ['0.049661', '0.142993', '0.155109', '0.053543', '0.058176', '0.076977', '0.070832', '0.059784', '0.085660', '0.096563', '0.071929', '0.065824', '0.058881', '0.082916', '0.051826', '0.050633', '0.082832', '0.059766', '0.070519', '0.065165']
         : correct/total = [(205, 4128), (601, 4203), (633, 4081), (232, 4333), (238, 4091), (330, 4287), (297, 4193), (260, 4349), (359, 4191), (413, 4277), (298, 4143), (276, 4193), (241, 4093), (348, 4197), (210, 4052), (204, 4029), (344, 4153), (250, 4183), (288, 4084), (269, 4128)]
         : compromised: 0.0696, honest: 0.0769
         : ubar stats = ['Node 0: s1=0.500, s2=1.000', 'Node 1: s1=0.500, s2=1.000', 'Node 2: s1=0.500, s2=1.000']...
Round 010: test acc mean=0.0706 ± 0.0187 | min=0.0459 max=0.1330
         : test loss mean=3.6689 ± 0.0196
         : individual accs = ['0.079457', '0.070902', '0.086988', '0.052850', '0.057932', '0.132960', '0.055092', '0.058634', '0.054402', '0.054244', '0.087376', '0.086573', '0.045932', '0.070765', '0.073791', '0.063291', '0.070792', '0.079608', '0.068560', '0.061289']
         : correct/total = [(328, 4128), (298, 4203), (355, 4081), (229, 4333), (237, 4091), (570, 4287), (231, 4193), (255, 4349), (228, 4191), (232, 4277), (362, 4143), (363, 4193), (188, 4093), (297, 4197), (299, 4052), (255, 4029), (294, 4153), (333, 4183), (280, 4084), (253, 4128)]
         : compromised: 0.0823, honest: 0.0676
         : ubar stats = ['Node 0: s1=0.500, s2=1.000', 'Node 1: s1=0.500, s2=1.000', 'Node 2: s1=0.500, s2=1.000']...

=== FINAL RESULTS ===
Dataset: femnist, Nodes: 20, Graph: ring, Aggregation: ubar
Attack: gaussian, 20.0% compromised
Final accuracy - Compromised: 0.0823, Honest: 0.0676
Overall test accuracy: mean=0.0706 ± 0.0187

=== UBAR SUMMARY ===
Node 0: stage1=0.500, stage2=1.000, overall=0.500
Node 1: stage1=0.500, stage2=1.000, overall=0.500
Node 2: stage1=0.500, stage2=1.000, overall=0.500
Node 3: stage1=0.500, stage2=1.000, overall=0.500
Node 4: stage1=0.500, stage2=1.000, overall=0.500
Node 5: stage1=0.500, stage2=1.000, overall=0.500
Node 6: stage1=0.500, stage2=1.000, overall=0.500
Node 7: stage1=0.500, stage2=1.000, overall=0.500
Node 8: stage1=0.500, stage2=1.000, overall=0.500
Node 9: stage1=0.500, stage2=1.000, overall=0.500
Node 10: stage1=0.500, stage2=1.000, overall=0.500
Node 11: stage1=0.500, stage2=1.000, overall=0.500
Node 12: stage1=0.500, stage2=1.000, overall=0.500
Node 13: stage1=0.500, stage2=1.000, overall=0.500
Node 14: stage1=0.500, stage2=1.000, overall=0.500
Node 15: stage1=0.500, stage2=1.000, overall=0.500
Node 16: stage1=0.500, stage2=1.000, overall=0.500
Node 17: stage1=0.500, stage2=1.000, overall=0.500
Node 18: stage1=0.500, stage2=1.000, overall=0.500
Node 19: stage1=0.500, stage2=1.000, overall=0.500

=== PARALLEL EXECUTION TIME (realistic for distributed system) ===
  COMMUNICATION (max across nodes):
    - Full model transfer: 0.000s (0.0%)
  COMPUTATION (max across nodes):
    - Distance computation: 0.044s (1.1%)
    - Loss computation: 4.084s (98.5%)
    - Aggregation: 0.018s (0.4%)
  TOTALS:
    - Total computation: 4.145s (100.0%)
    - Total communication: 0.000s (0.0%)
    - Total parallel time: 4.146s

=== PER-NODE AVERAGE TIME ===
  - Distance computation: 0.013s
  - Loss computation: 3.835s
  - Aggregation: 0.007s
  - Model transfer: 0.000s
  - Total per node: 3.856s

=== TOTAL COMPUTATIONAL WORK (sum across all nodes) ===
  - Total distance computation: 0.267s
  - Total loss computation: 76.700s
  - Total aggregation: 0.144s
  - Total model transfer: 0.000s
  - Grand total: 77.112s
  - Mean Stage 1 acceptance rate: 0.500
  - Mean Stage 2 acceptance rate: 1.000
  - Overall acceptance rate: 0.500

UBAR Algorithm Properties:
  - Model dimension: 6,603,710
  - Rho parameter: 0.8
  - Two-stage approach: Distance filtering + loss evaluation
  - Stage 1 selects: 80% of neighbors
  - Stage 2 uses: Training sample loss comparison
  - Theoretical complexity: O(deg(i)×d + deg(i)×inference)
  - Approach: UBAR paper implementation
