Device: cuda
Seed: 987654321
Loading 36 LEAF FEMNIST train files...
LEAF FEMNIST train: 3597 users, 734463 samples
Loading 36 LEAF FEMNIST test files...
LEAF FEMNIST test: 3597 users, 83388 samples
Found 3597 train users, 3597 test users, 3597 common users
User sample counts range: 525 (max) to 17 (min)
Distributed ALL 3597 users across 20 clients
Users per client: 179 (with 17 clients getting +1 user)
Train partition sizes: [36360, 37070, 35957, 38262, 36024, 37732, 36921, 38328, 36867, 37683, 36507, 36915, 36007, 37001, 35681, 35453, 36585, 36801, 35964, 36345]
Test partition sizes: [4128, 4203, 4081, 4333, 4091, 4287, 4193, 4349, 4191, 4277, 4143, 4193, 4093, 4197, 4052, 4029, 4153, 4183, 4084, 4128]
  Client 0: 36360 train samples, 62 unique classes
  Client 1: 37070 train samples, 62 unique classes
  Client 2: 35957 train samples, 62 unique classes
  Client 3: 38262 train samples, 62 unique classes
  Client 4: 36024 train samples, 62 unique classes
  Client 5: 37732 train samples, 62 unique classes
  Client 6: 36921 train samples, 62 unique classes
  Client 7: 38328 train samples, 62 unique classes
  Client 8: 36867 train samples, 62 unique classes
  Client 9: 37683 train samples, 62 unique classes
  Client 10: 36507 train samples, 62 unique classes
  Client 11: 36915 train samples, 62 unique classes
  Client 12: 36007 train samples, 62 unique classes
  Client 13: 37001 train samples, 62 unique classes
  Client 14: 35681 train samples, 62 unique classes
  Client 15: 35453 train samples, 62 unique classes
  Client 16: 36585 train samples, 62 unique classes
  Client 17: 36801 train samples, 62 unique classes
  Client 18: 35964 train samples, 62 unique classes
  Client 19: 36345 train samples, 62 unique classes
Will sample 10000 samples per client per epoch
Graph: fully, nodes: 20, edges: 190
Degree statistics: avg=19.00, min=19, max=19
Attack: Compromised 12/20 nodes: [1, 2, 3, 5, 8, 11, 12, 13, 14, 15, 17, 18]
Attack type: backdoor, lambda: 1.0
Backdoor target label: 0, trigger size: 4
Model variant: baseline
Model parameters: 6,603,710
Sketchguard Node 0:
  Model dim: 6,603,710 → Sketch size: 1000
  Compression ratio: 6603.7x
  Using model parameters for aggregation, sketches for filtering
Sketchguard Node 1:
  Model dim: 6,603,710 → Sketch size: 1000
  Compression ratio: 6603.7x
  Using model parameters for aggregation, sketches for filtering
Sketchguard Node 2:
  Model dim: 6,603,710 → Sketch size: 1000
  Compression ratio: 6603.7x
  Using model parameters for aggregation, sketches for filtering
Sketchguard Node 3:
  Model dim: 6,603,710 → Sketch size: 1000
  Compression ratio: 6603.7x
  Using model parameters for aggregation, sketches for filtering
Sketchguard Node 4:
  Model dim: 6,603,710 → Sketch size: 1000
  Compression ratio: 6603.7x
  Using model parameters for aggregation, sketches for filtering
Sketchguard Node 5:
  Model dim: 6,603,710 → Sketch size: 1000
  Compression ratio: 6603.7x
  Using model parameters for aggregation, sketches for filtering
Sketchguard Node 6:
  Model dim: 6,603,710 → Sketch size: 1000
  Compression ratio: 6603.7x
  Using model parameters for aggregation, sketches for filtering
Sketchguard Node 7:
  Model dim: 6,603,710 → Sketch size: 1000
  Compression ratio: 6603.7x
  Using model parameters for aggregation, sketches for filtering
Sketchguard Node 8:
  Model dim: 6,603,710 → Sketch size: 1000
  Compression ratio: 6603.7x
  Using model parameters for aggregation, sketches for filtering
Sketchguard Node 9:
  Model dim: 6,603,710 → Sketch size: 1000
  Compression ratio: 6603.7x
  Using model parameters for aggregation, sketches for filtering
Sketchguard Node 10:
  Model dim: 6,603,710 → Sketch size: 1000
  Compression ratio: 6603.7x
  Using model parameters for aggregation, sketches for filtering
Sketchguard Node 11:
  Model dim: 6,603,710 → Sketch size: 1000
  Compression ratio: 6603.7x
  Using model parameters for aggregation, sketches for filtering
Sketchguard Node 12:
  Model dim: 6,603,710 → Sketch size: 1000
  Compression ratio: 6603.7x
  Using model parameters for aggregation, sketches for filtering
Sketchguard Node 13:
  Model dim: 6,603,710 → Sketch size: 1000
  Compression ratio: 6603.7x
  Using model parameters for aggregation, sketches for filtering
Sketchguard Node 14:
  Model dim: 6,603,710 → Sketch size: 1000
  Compression ratio: 6603.7x
  Using model parameters for aggregation, sketches for filtering
Sketchguard Node 15:
  Model dim: 6,603,710 → Sketch size: 1000
  Compression ratio: 6603.7x
  Using model parameters for aggregation, sketches for filtering
Sketchguard Node 16:
  Model dim: 6,603,710 → Sketch size: 1000
  Compression ratio: 6603.7x
  Using model parameters for aggregation, sketches for filtering
Sketchguard Node 17:
  Model dim: 6,603,710 → Sketch size: 1000
  Compression ratio: 6603.7x
  Using model parameters for aggregation, sketches for filtering
Sketchguard Node 18:
  Model dim: 6,603,710 → Sketch size: 1000
  Compression ratio: 6603.7x
  Using model parameters for aggregation, sketches for filtering
Sketchguard Node 19:
  Model dim: 6,603,710 → Sketch size: 1000
  Compression ratio: 6603.7x
  Using model parameters for aggregation, sketches for filtering
Sketchguard ALGORITHM (Sketch-based Filtering + State Aggregation)
  - Model dimension: 6,603,710 parameters
  - Config: SketchguardConfig(gamma=2, kappa=1, alpha=0.5, min_neighbors=1, sketch_size=1000, network_seed=987654321, attack_detection_window=5)
  - Sketch size: 1000
  - Compression ratio: 6603.7x
  - Complexity: O(d + N×k) = O(6,603,710 + 20×1000)
  - Theoretical speedup vs BALANCE: 19.9x
Initial test acc across nodes: mean=0.0168 ± 0.0139
Backdoor attack: Created poisoned datasets for 12 compromised nodes
Round 001: test acc mean=0.2640 ± 0.1956 | min=0.0488 max=0.5412
         : test loss mean=10440.9351 ± 9026.9133
         : individual accs = ['0.541182', '0.048775', '0.195540', '0.049388', '0.503789', '0.216002', '0.502743', '0.512072', '0.096636', '0.441899', '0.507845', '0.107083', '0.054239', '0.049083', '0.151037', '0.080169', '0.467373', '0.155869', '0.103575', '0.495397']
         : correct/total = [(2234, 4128), (205, 4203), (798, 4081), (214, 4333), (2061, 4091), (926, 4287), (2108, 4193), (2227, 4349), (405, 4191), (1890, 4277), (2104, 4143), (449, 4193), (222, 4093), (206, 4197), (612, 4052), (323, 4029), (1941, 4153), (652, 4183), (423, 4084), (2045, 4128)]
         : compromised: 0.1089, honest: 0.4965
         : sketchguard stats = ['Node 0: acc_rate=0.368', 'Node 1: acc_rate=0.421', 'Node 2: acc_rate=0.421']...
Round 002: test acc mean=0.2943 ± 0.3025 | min=0.0189 max=0.6778
         : test loss mean=3308688849057.9062 ± 14422239444858.9980
         : individual accs = ['0.674176', '0.048775', '0.045087', '0.018925', '0.674652', '0.052484', '0.648939', '0.672568', '0.051539', '0.646715', '0.677770', '0.049606', '0.059125', '0.045747', '0.046397', '0.053860', '0.660246', '0.049486', '0.048482', '0.662064']
         : correct/total = [(2783, 4128), (205, 4203), (184, 4081), (82, 4333), (2760, 4091), (225, 4287), (2721, 4193), (2925, 4349), (216, 4191), (2766, 4277), (2808, 4143), (208, 4193), (242, 4093), (192, 4197), (188, 4052), (217, 4029), (2742, 4153), (207, 4183), (198, 4084), (2733, 4128)]
         : compromised: 0.0475, honest: 0.6646
         : sketchguard stats = ['Node 0: acc_rate=0.368', 'Node 1: acc_rate=0.711', 'Node 2: acc_rate=0.711']...
Round 003: test acc mean=0.3032 ± 0.3104 | min=0.0432 max=0.7094
         : test loss mean=nan ± nan
         : individual accs = ['0.689680', '0.048775', '0.053418', '0.043157', '0.709362', '0.045253', '0.683997', '0.700621', '0.049630', '0.671733', '0.666184', '0.049606', '0.054239', '0.049083', '0.051826', '0.051626', '0.654948', '0.049486', '0.052889', '0.688227']
         : correct/total = [(2847, 4128), (205, 4203), (218, 4081), (187, 4333), (2902, 4091), (194, 4287), (2868, 4193), (3047, 4349), (208, 4191), (2873, 4277), (2760, 4143), (208, 4193), (222, 4093), (206, 4197), (210, 4052), (208, 4029), (2720, 4153), (207, 4183), (216, 4084), (2841, 4128)]
         : compromised: 0.0499, honest: 0.6831
         : sketchguard stats = ['Node 0: acc_rate=0.368', 'Node 1: acc_rate=0.807', 'Node 2: acc_rate=0.807']...
Round 004: test acc mean=0.3051 ± 0.3129 | min=0.0432 max=0.7162
         : test loss mean=nan ± nan
         : individual accs = ['0.669574', '0.048775', '0.053418', '0.043157', '0.716206', '0.045253', '0.705700', '0.713037', '0.049630', '0.660977', '0.673184', '0.049606', '0.054239', '0.049083', '0.051826', '0.051626', '0.709126', '0.049486', '0.052889', '0.655039']
         : correct/total = [(2764, 4128), (205, 4203), (218, 4081), (187, 4333), (2930, 4091), (194, 4287), (2959, 4193), (3101, 4349), (208, 4191), (2827, 4277), (2789, 4143), (208, 4193), (222, 4093), (206, 4197), (210, 4052), (208, 4029), (2945, 4153), (207, 4183), (216, 4084), (2704, 4128)]
         : compromised: 0.0499, honest: 0.6879
         : sketchguard stats = ['Node 0: acc_rate=0.368', 'Node 1: acc_rate=0.605', 'Node 2: acc_rate=0.605']...
Round 005: test acc mean=0.3397 ± 0.3550 | min=0.0432 max=0.7887
         : test loss mean=nan ± nan
         : individual accs = ['0.771802', '0.048775', '0.053418', '0.043157', '0.783916', '0.045253', '0.765323', '0.788687', '0.049630', '0.784195', '0.761767', '0.049606', '0.054239', '0.049083', '0.051826', '0.051626', '0.778955', '0.049486', '0.052889', '0.759932']
         : correct/total = [(3186, 4128), (205, 4203), (218, 4081), (187, 4333), (3207, 4091), (194, 4287), (3209, 4193), (3430, 4349), (208, 4191), (3354, 4277), (3156, 4143), (208, 4193), (222, 4093), (206, 4197), (210, 4052), (208, 4029), (3235, 4153), (207, 4183), (216, 4084), (3137, 4128)]
         : compromised: 0.0499, honest: 0.7743
         : sketchguard stats = ['Node 0: acc_rate=0.368', 'Node 1: acc_rate=0.484', 'Node 2: acc_rate=0.484']...
Round 006: test acc mean=0.3547 ± 0.3734 | min=0.0432 max=0.8202
         : test loss mean=nan ± nan
         : individual accs = ['0.809835', '0.048775', '0.053418', '0.043157', '0.816915', '0.045253', '0.808967', '0.820189', '0.049630', '0.816928', '0.804007', '0.049606', '0.054239', '0.049083', '0.051826', '0.051626', '0.815555', '0.049486', '0.052889', '0.803537']
         : correct/total = [(3343, 4128), (205, 4203), (218, 4081), (187, 4333), (3342, 4091), (194, 4287), (3392, 4193), (3567, 4349), (208, 4191), (3494, 4277), (3331, 4143), (208, 4193), (222, 4093), (206, 4197), (210, 4052), (208, 4029), (3387, 4153), (207, 4183), (216, 4084), (3317, 4128)]
         : compromised: 0.0499, honest: 0.8120
         : sketchguard stats = ['Node 0: acc_rate=0.368', 'Node 1: acc_rate=0.404', 'Node 2: acc_rate=0.404']...
Round 007: test acc mean=0.3621 ± 0.3824 | min=0.0432 max=0.8411
         : test loss mean=nan ± nan
         : individual accs = ['0.829215', '0.048775', '0.053418', '0.043157', '0.840870', '0.045253', '0.825662', '0.841113', '0.049630', '0.835399', '0.816558', '0.049606', '0.054239', '0.049083', '0.051826', '0.051626', '0.832410', '0.049486', '0.052889', '0.821221']
         : correct/total = [(3423, 4128), (205, 4203), (218, 4081), (187, 4333), (3440, 4091), (194, 4287), (3462, 4193), (3658, 4349), (208, 4191), (3573, 4277), (3383, 4143), (208, 4193), (222, 4093), (206, 4197), (210, 4052), (208, 4029), (3457, 4153), (207, 4183), (216, 4084), (3390, 4128)]
         : compromised: 0.0499, honest: 0.8303
         : sketchguard stats = ['Node 0: acc_rate=0.368', 'Node 1: acc_rate=0.346', 'Node 2: acc_rate=0.346']...
Round 008: test acc mean=0.3654 ± 0.3865 | min=0.0432 max=0.8492
         : test loss mean=nan ± nan
         : individual accs = ['0.836725', '0.048775', '0.053418', '0.043157', '0.849181', '0.045253', '0.830909', '0.847321', '0.049630', '0.847791', '0.824523', '0.049606', '0.054239', '0.049083', '0.051826', '0.051626', '0.843005', '0.049486', '0.052889', '0.830426']
         : correct/total = [(3454, 4128), (205, 4203), (218, 4081), (187, 4333), (3474, 4091), (194, 4287), (3484, 4193), (3685, 4349), (208, 4191), (3626, 4277), (3416, 4143), (208, 4193), (222, 4093), (206, 4197), (210, 4052), (208, 4029), (3501, 4153), (207, 4183), (216, 4084), (3428, 4128)]
         : compromised: 0.0499, honest: 0.8387
         : sketchguard stats = ['Node 0: acc_rate=0.368', 'Node 1: acc_rate=0.303', 'Node 2: acc_rate=0.303']...
Round 009: test acc mean=0.3673 ± 0.3888 | min=0.0432 max=0.8581
         : test loss mean=nan ± nan
         : individual accs = ['0.835514', '0.048775', '0.053418', '0.043157', '0.850159', '0.045253', '0.835679', '0.858128', '0.049630', '0.851298', '0.832971', '0.049606', '0.054239', '0.049083', '0.051826', '0.051626', '0.848302', '0.049486', '0.052889', '0.835514']
         : correct/total = [(3449, 4128), (205, 4203), (218, 4081), (187, 4333), (3478, 4091), (194, 4287), (3504, 4193), (3732, 4349), (208, 4191), (3641, 4277), (3451, 4143), (208, 4193), (222, 4093), (206, 4197), (210, 4052), (208, 4029), (3523, 4153), (207, 4183), (216, 4084), (3449, 4128)]
         : compromised: 0.0499, honest: 0.8434
         : sketchguard stats = ['Node 0: acc_rate=0.368', 'Node 1: acc_rate=0.269', 'Node 2: acc_rate=0.269']...
Round 010: test acc mean=0.3691 ± 0.3909 | min=0.0432 max=0.8590
         : test loss mean=nan ± nan
         : individual accs = ['0.846172', '0.048775', '0.053418', '0.043157', '0.858959', '0.045253', '0.840210', '0.856519', '0.049630', '0.852467', '0.841178', '0.049606', '0.054239', '0.049083', '0.051826', '0.051626', '0.852155', '0.049486', '0.052889', '0.834787']
         : correct/total = [(3493, 4128), (205, 4203), (218, 4081), (187, 4333), (3514, 4091), (194, 4287), (3523, 4193), (3725, 4349), (208, 4191), (3646, 4277), (3485, 4143), (208, 4193), (222, 4093), (206, 4197), (210, 4052), (208, 4029), (3539, 4153), (207, 4183), (216, 4084), (3446, 4128)]
         : compromised: 0.0499, honest: 0.8478
         : sketchguard stats = ['Node 0: acc_rate=0.368', 'Node 1: acc_rate=0.242', 'Node 2: acc_rate=0.242']...

=== FINAL RESULTS ===
Dataset: femnist, Nodes: 20, Graph: fully, Aggregation: sketchguard
Attack: backdoor, 60.0% compromised
Final accuracy - Compromised: 0.0499, Honest: 0.8478
Overall test accuracy: mean=0.3691 ± 0.3909

=== BACKDOOR ATTACK SUCCESS RATE (ASR) ===
Target label: 0
Trigger size: 4x4
Overall ASR: 0.6194 ± 0.4661
Honest nodes ASR: 0.0485 ± 0.0039
Compromised nodes ASR: 1.0000 ± 0.0000
Note: Higher ASR indicates more successful backdoor attack

=== Sketchguard SUMMARY ===
Node 0: acceptance=0.368
Node 1: acceptance=0.242
Node 2: acceptance=0.242
Node 3: acceptance=0.242
Node 4: acceptance=0.368
Node 5: acceptance=0.242
Node 6: acceptance=0.368
Node 7: acceptance=0.368
Node 8: acceptance=0.242
Node 9: acceptance=0.368
Node 10: acceptance=0.368
Node 11: acceptance=0.242
Node 12: acceptance=0.242
Node 13: acceptance=0.242
Node 14: acceptance=0.242
Node 15: acceptance=0.242
Node 16: acceptance=0.368
Node 17: acceptance=0.242
Node 18: acceptance=0.242
Node 19: acceptance=0.368

=== PARALLEL EXECUTION TIME (realistic for distributed system) ===
  COMMUNICATION (max across nodes):
    - Sketch transfer: 0.000s (0.0%)
    - Model fetch (accepted): 0.000s (0.0%)
  COMPUTATION (max across nodes):
    - Sketching: 2.905s (99.3%)
    - Filtering: 0.002s (0.1%)
    - Aggregation: 0.018s (0.6%)
  TOTALS:
    - Total computation: 2.924s (100.0%)
    - Total communication: 0.000s (0.0%)
    - Total parallel time: 2.924s

=== PER-NODE AVERAGE TIME ===
  - Sketching: 2.753s
  - Filtering: 0.001s
  - Aggregation: 0.013s
  - Sketch transfer: 0.000s
  - Model fetch: 0.000s
  - Total per node: 2.767s

=== TOTAL COMPUTATIONAL WORK (sum across all nodes) ===
  - Total sketching: 55.063s
  - Total filtering: 0.027s
  - Total aggregation: 0.259s
  - Total sketch transfer: 0.000s
  - Total model fetch: 0.000s
  - Grand total: 55.349s
  - Mean acceptance rate: 0.293

Sketchguard Algorithm Properties:
  - Original dimension: 6,603,710
  - Sketch size: 1000
  - Compression ratio: 19.9x
  - Single repetition: No repetitions needed
  - Theoretical complexity: O(d + N×k)
  - Approach: Sketch filtering + state aggregation
