Device: cuda
Seed: 987654321
Loading 36 LEAF FEMNIST train files...
LEAF FEMNIST train: 3597 users, 734463 samples
Loading 36 LEAF FEMNIST test files...
LEAF FEMNIST test: 3597 users, 83388 samples
Found 3597 train users, 3597 test users, 3597 common users
User sample counts range: 525 (max) to 17 (min)
Distributed ALL 3597 users across 20 clients
Users per client: 179 (with 17 clients getting +1 user)
Train partition sizes: [36360, 37070, 35957, 38262, 36024, 37732, 36921, 38328, 36867, 37683, 36507, 36915, 36007, 37001, 35681, 35453, 36585, 36801, 35964, 36345]
Test partition sizes: [4128, 4203, 4081, 4333, 4091, 4287, 4193, 4349, 4191, 4277, 4143, 4193, 4093, 4197, 4052, 4029, 4153, 4183, 4084, 4128]
  Client 0: 36360 train samples, 62 unique classes
  Client 1: 37070 train samples, 62 unique classes
  Client 2: 35957 train samples, 62 unique classes
  Client 3: 38262 train samples, 62 unique classes
  Client 4: 36024 train samples, 62 unique classes
  Client 5: 37732 train samples, 62 unique classes
  Client 6: 36921 train samples, 62 unique classes
  Client 7: 38328 train samples, 62 unique classes
  Client 8: 36867 train samples, 62 unique classes
  Client 9: 37683 train samples, 62 unique classes
  Client 10: 36507 train samples, 62 unique classes
  Client 11: 36915 train samples, 62 unique classes
  Client 12: 36007 train samples, 62 unique classes
  Client 13: 37001 train samples, 62 unique classes
  Client 14: 35681 train samples, 62 unique classes
  Client 15: 35453 train samples, 62 unique classes
  Client 16: 36585 train samples, 62 unique classes
  Client 17: 36801 train samples, 62 unique classes
  Client 18: 35964 train samples, 62 unique classes
  Client 19: 36345 train samples, 62 unique classes
Will sample 4500 samples per client per epoch
Graph: ring, nodes: 20, edges: 20
Degree statistics: avg=2.00, min=2, max=2
Attack: Compromised 10/20 nodes: [1, 2, 5, 11, 12, 13, 14, 15, 17, 18]
Attack type: krum, lambda: 1.0
Model variant: baseline
Model parameters: 6,603,710
BALANCE algorithm:
Balance Config: BALANCEConfig(gamma=2, kappa=1, alpha=0.5, min_neighbors=1)
  - Model dimension: 6,603,710 parameters
  - Complexity: O(N×d) = O(20×6,603,710)
Initial test acc across nodes: mean=0.0168 ± 0.0139
Round 001: test acc mean=0.0436 ± 0.0167 | min=0.0048 max=0.0608
         : test loss mean=2896.9844 ± 6061.3390
         : individual accs = ['0.049661', '0.052344', '0.055134', '0.043157', '0.043021', '0.048519', '0.044598', '0.053576', '0.047960', '0.050503', '0.055274', '0.060816', '0.045443', '0.005718', '0.004936', '0.050385', '0.004816', '0.050920', '0.054358', '0.050145']
         : correct/total = [(205, 4128), (220, 4203), (225, 4081), (187, 4333), (176, 4091), (208, 4287), (187, 4193), (233, 4349), (201, 4191), (216, 4277), (229, 4143), (255, 4193), (186, 4093), (24, 4197), (20, 4052), (203, 4029), (20, 4153), (213, 4183), (222, 4084), (207, 4128)]
         : compromised: 0.0429, honest: 0.0443
Round 002: test acc mean=0.0515 ± 0.0090 | min=0.0337 max=0.0847
         : test loss mean=317207853.1157 ± 1372188309.7177
         : individual accs = ['0.051599', '0.046158', '0.057584', '0.052850', '0.057932', '0.050618', '0.084665', '0.053116', '0.051062', '0.048398', '0.045619', '0.046983', '0.033716', '0.049559', '0.047878', '0.051378', '0.049362', '0.051159', '0.052889', '0.048450']
         : correct/total = [(213, 4128), (194, 4203), (235, 4081), (229, 4333), (237, 4091), (217, 4287), (355, 4193), (231, 4349), (214, 4191), (207, 4277), (189, 4143), (197, 4193), (138, 4093), (208, 4197), (194, 4052), (207, 4029), (205, 4153), (214, 4183), (216, 4084), (200, 4128)]
         : compromised: 0.0488, honest: 0.0543
Round 003: test acc mean=0.0505 ± 0.0082 | min=0.0323 max=0.0727
         : test loss mean=10728068513062.4570 ± 46762089924734.8281
         : individual accs = ['0.059593', '0.050916', '0.050723', '0.052850', '0.057932', '0.050618', '0.044598', '0.051276', '0.047960', '0.047463', '0.055274', '0.053184', '0.053750', '0.045747', '0.046397', '0.032266', '0.044546', '0.037533', '0.072723', '0.055475']
         : correct/total = [(246, 4128), (214, 4203), (207, 4081), (229, 4333), (237, 4091), (217, 4287), (187, 4193), (223, 4349), (201, 4191), (203, 4277), (229, 4143), (223, 4193), (220, 4093), (192, 4197), (188, 4052), (130, 4029), (185, 4153), (157, 4183), (297, 4084), (229, 4128)]
         : compromised: 0.0494, honest: 0.0517
Round 004: test acc mean=0.0554 ± 0.0144 | min=0.0308 max=0.0974
         : test loss mean=228682757036581.5000 ± 994759101631071.6250
         : individual accs = ['0.097384', '0.052344', '0.057584', '0.052850', '0.057932', '0.050618', '0.057000', '0.059094', '0.049630', '0.049334', '0.045619', '0.046983', '0.049597', '0.055278', '0.051826', '0.050633', '0.030821', '0.048291', '0.052889', '0.092539']
         : correct/total = [(402, 4128), (220, 4203), (235, 4081), (229, 4333), (237, 4091), (217, 4287), (239, 4193), (257, 4349), (208, 4191), (211, 4277), (189, 4143), (197, 4193), (203, 4093), (232, 4197), (210, 4052), (204, 4029), (128, 4153), (202, 4183), (216, 4084), (382, 4128)]
         : compromised: 0.0516, honest: 0.0592
Round 005: test acc mean=0.0546 ± 0.0131 | min=0.0308 max=0.0899
         : test loss mean=33767.5684 ± 145358.6921
         : individual accs = ['0.089874', '0.052344', '0.072286', '0.054466', '0.059399', '0.050618', '0.046745', '0.047827', '0.051062', '0.053776', '0.055998', '0.053899', '0.049597', '0.037408', '0.051826', '0.050385', '0.030821', '0.046139', '0.056317', '0.081638']
         : correct/total = [(371, 4128), (220, 4203), (295, 4081), (236, 4333), (243, 4091), (217, 4287), (196, 4193), (208, 4349), (214, 4191), (230, 4277), (232, 4143), (226, 4193), (203, 4093), (157, 4197), (210, 4052), (203, 4029), (128, 4153), (193, 4183), (230, 4084), (337, 4128)]
         : compromised: 0.0521, honest: 0.0572
Round 006: test acc mean=0.0538 ± 0.0114 | min=0.0164 max=0.0770
         : test loss mean=26489.3453 ± 87805.5983
         : individual accs = ['0.077035', '0.062099', '0.057584', '0.052850', '0.057932', '0.050618', '0.043883', '0.053116', '0.053209', '0.053776', '0.051171', '0.061770', '0.016369', '0.055278', '0.051826', '0.050881', '0.052011', '0.048291', '0.055583', '0.071221']
         : correct/total = [(318, 4128), (261, 4203), (235, 4081), (229, 4333), (237, 4091), (217, 4287), (184, 4193), (231, 4349), (223, 4191), (230, 4277), (212, 4143), (259, 4193), (67, 4093), (232, 4197), (210, 4052), (205, 4029), (216, 4153), (202, 4183), (227, 4084), (294, 4128)]
         : compromised: 0.0510, honest: 0.0566
Round 007: test acc mean=0.0550 ± 0.0323 | min=0.0097 max=0.1410
         : test loss mean=435.4282 ± 1604.5982
         : individual accs = ['0.140988', '0.052344', '0.057584', '0.044773', '0.047421', '0.051551', '0.076795', '0.058174', '0.053209', '0.054010', '0.056239', '0.053899', '0.016369', '0.045747', '0.051826', '0.009680', '0.030821', '0.011236', '0.050930', '0.136386']
         : correct/total = [(582, 4128), (220, 4203), (235, 4081), (194, 4333), (194, 4091), (221, 4287), (322, 4193), (253, 4349), (223, 4191), (231, 4277), (233, 4143), (226, 4193), (67, 4093), (192, 4197), (210, 4052), (39, 4029), (128, 4153), (47, 4183), (208, 4084), (563, 4128)]
         : compromised: 0.0401, honest: 0.0699
Round 008: test acc mean=0.0657 ± 0.0332 | min=0.0246 max=0.1514
         : test loss mean=14814.0205 ± 62266.4785
         : individual accs = ['0.151405', '0.110635', '0.053908', '0.085160', '0.087509', '0.050618', '0.049130', '0.051276', '0.062038', '0.076923', '0.058895', '0.053899', '0.049841', '0.045747', '0.051826', '0.024820', '0.030821', '0.024623', '0.057052', '0.137112']
         : correct/total = [(625, 4128), (465, 4203), (220, 4081), (369, 4333), (358, 4091), (217, 4287), (206, 4193), (223, 4349), (260, 4191), (329, 4277), (244, 4143), (226, 4193), (204, 4093), (192, 4197), (210, 4052), (100, 4029), (128, 4153), (103, 4183), (233, 4084), (566, 4128)]
         : compromised: 0.0523, honest: 0.0790
Round 009: test acc mean=0.0518 ± 0.0105 | min=0.0261 max=0.0735
         : test loss mean=1194.6527 ± 3662.6387
         : individual accs = ['0.061773', '0.050916', '0.057584', '0.054927', '0.058910', '0.062281', '0.053899', '0.060704', '0.053209', '0.048398', '0.045619', '0.053899', '0.049841', '0.045747', '0.051826', '0.026061', '0.030821', '0.039445', '0.073457', '0.055717']
         : correct/total = [(255, 4128), (214, 4203), (235, 4081), (238, 4333), (241, 4091), (267, 4287), (226, 4193), (264, 4349), (223, 4191), (207, 4277), (189, 4143), (226, 4193), (204, 4093), (192, 4197), (210, 4052), (105, 4029), (128, 4153), (165, 4183), (300, 4084), (230, 4128)]
         : compromised: 0.0511, honest: 0.0524
Round 010: test acc mean=0.0573 ± 0.0211 | min=0.0283 max=0.1042
         : test loss mean=396081.9789 ± 1697298.3340
         : individual accs = ['0.104167', '0.100404', '0.058074', '0.052850', '0.057932', '0.049219', '0.049130', '0.051276', '0.047960', '0.053776', '0.055998', '0.055092', '0.049597', '0.045747', '0.051826', '0.028295', '0.030340', '0.028927', '0.079334', '0.095203']
         : correct/total = [(430, 4128), (422, 4203), (237, 4081), (229, 4333), (237, 4091), (211, 4287), (206, 4193), (223, 4349), (201, 4191), (230, 4277), (232, 4143), (231, 4193), (203, 4093), (192, 4197), (210, 4052), (114, 4029), (126, 4153), (121, 4183), (324, 4084), (393, 4128)]
         : compromised: 0.0547, honest: 0.0599

=== FINAL RESULTS ===
Dataset: femnist, Nodes: 20, Graph: ring, Aggregation: balance
Attack: krum, 50.0% compromised
Final accuracy - Compromised: 0.0547, Honest: 0.0599
Overall test accuracy: mean=0.0573 ± 0.0211

=== BALANCE SUMMARY ===
Node 0: acceptance=0.500
Node 1: acceptance=0.500
Node 2: acceptance=0.500
Node 3: acceptance=0.500
Node 4: acceptance=0.500
Node 5: acceptance=0.800
Node 6: acceptance=0.500
Node 7: acceptance=1.000
Node 8: acceptance=1.000
Node 9: acceptance=1.000
Node 10: acceptance=0.500
Node 11: acceptance=0.500
Node 12: acceptance=0.400
Node 13: acceptance=0.400
Node 14: acceptance=0.400
Node 15: acceptance=0.550
Node 16: acceptance=0.500
Node 17: acceptance=0.550
Node 18: acceptance=0.500
Node 19: acceptance=0.500

=== PARALLEL EXECUTION TIME (realistic for distributed system) ===
  COMMUNICATION (max across nodes):
    - Full model transfer: 0.000s (0.0%)
  COMPUTATION (max across nodes):
    - Filtering: 0.019s (65.1%)
    - Aggregation: 0.010s (34.9%)
  TOTALS:
    - Total computation: 0.029s (100.0%)
    - Total communication: 0.000s (0.0%)
    - Total parallel time: 0.029s

=== PER-NODE AVERAGE TIME ===
  - Filtering: 0.013s
  - Aggregation: 0.004s
  - Model transfer: 0.000s
  - Total per node: 0.016s

=== TOTAL COMPUTATIONAL WORK (sum across all nodes) ===
  - Total filtering: 0.255s
  - Total aggregation: 0.070s
  - Total model transfer: 0.000s
  - Grand total: 0.326s
  - Mean acceptance rate: 0.580

BALANCE Algorithm Properties:
  - Model dimension: 6,603,710
  - No compression: Full parameter comparison
  - Theoretical complexity: O(deg(i)×d)
  - Approach: Full parameter filtering + averaging
