Device: cuda
Seed: 987654321
Loading 36 LEAF FEMNIST train files...
LEAF FEMNIST train: 3597 users, 734463 samples
Loading 36 LEAF FEMNIST test files...
LEAF FEMNIST test: 3597 users, 83388 samples
Found 3597 train users, 3597 test users, 3597 common users
User sample counts range: 525 (max) to 17 (min)
Distributed ALL 3597 users across 20 clients
Users per client: 179 (with 17 clients getting +1 user)
Train partition sizes: [36360, 37070, 35957, 38262, 36024, 37732, 36921, 38328, 36867, 37683, 36507, 36915, 36007, 37001, 35681, 35453, 36585, 36801, 35964, 36345]
Test partition sizes: [4128, 4203, 4081, 4333, 4091, 4287, 4193, 4349, 4191, 4277, 4143, 4193, 4093, 4197, 4052, 4029, 4153, 4183, 4084, 4128]
  Client 0: 36360 train samples, 62 unique classes
  Client 1: 37070 train samples, 62 unique classes
  Client 2: 35957 train samples, 62 unique classes
  Client 3: 38262 train samples, 62 unique classes
  Client 4: 36024 train samples, 62 unique classes
  Client 5: 37732 train samples, 62 unique classes
  Client 6: 36921 train samples, 62 unique classes
  Client 7: 38328 train samples, 62 unique classes
  Client 8: 36867 train samples, 62 unique classes
  Client 9: 37683 train samples, 62 unique classes
  Client 10: 36507 train samples, 62 unique classes
  Client 11: 36915 train samples, 62 unique classes
  Client 12: 36007 train samples, 62 unique classes
  Client 13: 37001 train samples, 62 unique classes
  Client 14: 35681 train samples, 62 unique classes
  Client 15: 35453 train samples, 62 unique classes
  Client 16: 36585 train samples, 62 unique classes
  Client 17: 36801 train samples, 62 unique classes
  Client 18: 35964 train samples, 62 unique classes
  Client 19: 36345 train samples, 62 unique classes
Will sample 4500 samples per client per epoch
Graph: ring, nodes: 20, edges: 20
Degree statistics: avg=2.00, min=2, max=2
Attack: Compromised 16/20 nodes: [1, 2, 3, 5, 6, 8, 9, 10, 11, 12, 13, 14, 15, 17, 18, 19]
Attack type: directed_deviation, lambda: 1.0
Model variant: baseline
Model parameters: 6,603,710
BALANCE algorithm:
Balance Config: BALANCEConfig(gamma=2, kappa=1, alpha=0.5, min_neighbors=1)
  - Model dimension: 6,603,710 parameters
  - Complexity: O(N×d) = O(20×6,603,710)
Initial test acc across nodes: mean=0.0168 ± 0.0139
Round 001: test acc mean=0.0321 ± 0.0195 | min=0.0035 max=0.0582
         : test loss mean=12367.6364 ± 11701.7409
         : individual accs = ['0.008479', '0.052344', '0.025239', '0.043157', '0.052799', '0.057849', '0.044598', '0.058174', '0.047960', '0.013795', '0.010138', '0.014071', '0.005864', '0.020253', '0.003455', '0.050385', '0.015411', '0.050920', '0.017630', '0.050145']
         : correct/total = [(35, 4128), (220, 4203), (103, 4081), (187, 4333), (216, 4091), (248, 4287), (187, 4193), (253, 4349), (201, 4191), (59, 4277), (42, 4143), (59, 4193), (24, 4093), (85, 4197), (14, 4052), (203, 4029), (64, 4153), (213, 4183), (72, 4084), (207, 4128)]
         : compromised: 0.0317, honest: 0.0337
Round 002: test acc mean=0.0427 ± 0.0139 | min=0.0024 max=0.0533
         : test loss mean=36061.8204 ± 148752.2835
         : individual accs = ['0.044574', '0.048537', '0.045087', '0.052850', '0.004400', '0.050618', '0.043883', '0.045528', '0.044619', '0.047697', '0.051171', '0.041736', '0.050818', '0.047177', '0.051579', '0.050633', '0.002408', '0.053311', '0.032321', '0.045058']
         : correct/total = [(184, 4128), (204, 4203), (184, 4081), (229, 4333), (18, 4091), (217, 4287), (184, 4193), (198, 4349), (187, 4191), (204, 4277), (212, 4143), (175, 4193), (208, 4093), (198, 4197), (209, 4052), (204, 4029), (10, 4153), (223, 4183), (132, 4084), (186, 4128)]
         : compromised: 0.0473, honest: 0.0242
Round 003: test acc mean=0.0392 ± 0.0103 | min=0.0176 max=0.0516
         : test loss mean=125.9254 ± 89.0276
         : individual accs = ['0.051599', '0.047109', '0.024994', '0.044773', '0.042288', '0.048752', '0.048891', '0.019545', '0.044619', '0.039280', '0.036688', '0.028142', '0.033716', '0.028592', '0.037759', '0.050633', '0.040212', '0.048291', '0.017630', '0.050388']
         : correct/total = [(213, 4128), (198, 4203), (102, 4081), (194, 4333), (173, 4091), (209, 4287), (205, 4193), (85, 4349), (187, 4191), (168, 4277), (152, 4143), (118, 4193), (138, 4093), (120, 4197), (153, 4052), (204, 4029), (167, 4153), (202, 4183), (72, 4084), (208, 4128)]
         : compromised: 0.0394, honest: 0.0384
Round 004: test acc mean=0.0450 ± 0.0135 | min=0.0158 max=0.0618
         : test loss mean=44.0542 ± 28.1805
         : individual accs = ['0.051599', '0.051630', '0.050723', '0.024233', '0.051088', '0.018661', '0.049130', '0.051276', '0.047960', '0.053075', '0.050447', '0.061770', '0.053750', '0.046938', '0.048124', '0.016629', '0.055141', '0.015778', '0.052889', '0.048450']
         : correct/total = [(213, 4128), (217, 4203), (207, 4081), (105, 4333), (209, 4091), (80, 4287), (206, 4193), (223, 4349), (201, 4191), (227, 4277), (209, 4143), (259, 4193), (220, 4093), (197, 4197), (195, 4052), (67, 4029), (229, 4153), (66, 4183), (216, 4084), (200, 4128)]
         : compromised: 0.0431, honest: 0.0523
Round 005: test acc mean=0.0236 ± 0.0114 | min=0.0124 max=0.0488
         : test loss mean=10.2539 ± 4.6315
         : individual accs = ['0.018653', '0.048775', '0.018623', '0.033003', '0.016133', '0.034756', '0.035535', '0.019545', '0.037700', '0.015899', '0.015206', '0.014071', '0.016858', '0.012390', '0.015301', '0.022338', '0.015651', '0.019842', '0.012977', '0.048692']
         : correct/total = [(77, 4128), (205, 4203), (76, 4081), (143, 4333), (66, 4091), (149, 4287), (149, 4193), (85, 4349), (158, 4191), (68, 4277), (63, 4143), (59, 4193), (69, 4093), (52, 4197), (62, 4052), (90, 4029), (65, 4153), (83, 4183), (53, 4084), (201, 4128)]
         : compromised: 0.0251, honest: 0.0175
Round 006: test acc mean=0.0526 ± 0.0033 | min=0.0469 max=0.0618
         : test loss mean=9.2594 ± 4.2783
         : individual accs = ['0.051599', '0.048775', '0.050723', '0.052850', '0.051088', '0.050618', '0.057000', '0.051276', '0.053209', '0.053075', '0.050447', '0.061770', '0.053750', '0.046938', '0.048124', '0.056590', '0.055141', '0.050920', '0.052889', '0.054506']
         : correct/total = [(213, 4128), (205, 4203), (207, 4081), (229, 4333), (209, 4091), (217, 4287), (239, 4193), (223, 4349), (223, 4191), (227, 4277), (209, 4143), (259, 4193), (220, 4093), (197, 4197), (195, 4052), (228, 4029), (229, 4153), (213, 4183), (216, 4084), (225, 4128)]
         : compromised: 0.0526, honest: 0.0523
Round 007: test acc mean=0.0315 ± 0.0146 | min=0.0159 max=0.0509
         : test loss mean=4.9843 ± 0.7719
         : individual accs = ['0.019622', '0.050916', '0.022298', '0.043157', '0.016133', '0.048519', '0.050799', '0.019545', '0.049630', '0.026420', '0.017861', '0.021703', '0.020034', '0.018346', '0.021718', '0.050881', '0.015892', '0.048291', '0.017630', '0.050145']
         : correct/total = [(81, 4128), (214, 4203), (91, 4081), (187, 4333), (66, 4091), (208, 4287), (213, 4193), (85, 4349), (208, 4191), (113, 4277), (74, 4143), (91, 4193), (82, 4093), (77, 4197), (88, 4052), (205, 4029), (66, 4153), (202, 4183), (72, 4084), (207, 4128)]
         : compromised: 0.0349, honest: 0.0178
Round 008: test acc mean=0.0496 ± 0.0050 | min=0.0407 max=0.0570
         : test loss mean=4.0295 ± 0.0399
         : individual accs = ['0.045785', '0.048775', '0.056114', '0.052850', '0.043266', '0.050618', '0.057000', '0.041619', '0.053209', '0.046528', '0.051171', '0.041736', '0.050818', '0.049559', '0.046644', '0.056590', '0.040693', '0.050920', '0.054358', '0.054506']
         : correct/total = [(189, 4128), (205, 4203), (229, 4081), (229, 4333), (177, 4091), (217, 4287), (239, 4193), (181, 4349), (223, 4191), (199, 4277), (212, 4143), (175, 4193), (208, 4093), (208, 4197), (189, 4052), (228, 4029), (169, 4153), (213, 4183), (222, 4084), (225, 4128)]
         : compromised: 0.0513, honest: 0.0428
Round 009: test acc mean=0.0389 ± 0.0078 | min=0.0250 max=0.0509
         : test loss mean=14.1267 ± 23.7151
         : individual accs = ['0.030523', '0.050916', '0.024994', '0.046619', '0.042288', '0.045953', '0.033389', '0.041389', '0.034359', '0.039280', '0.036688', '0.028142', '0.033716', '0.028592', '0.037759', '0.050881', '0.040212', '0.048291', '0.033301', '0.050145']
         : correct/total = [(126, 4128), (214, 4203), (102, 4081), (202, 4333), (173, 4091), (197, 4287), (140, 4193), (180, 4349), (144, 4191), (168, 4277), (152, 4143), (118, 4193), (138, 4093), (120, 4197), (153, 4052), (205, 4029), (167, 4153), (202, 4183), (136, 4084), (207, 4128)]
         : compromised: 0.0389, honest: 0.0386
Round 010: test acc mean=0.0513 ± 0.0035 | min=0.0467 max=0.0578
         : test loss mean=3.9193 ± 0.0289
         : individual accs = ['0.048934', '0.048775', '0.056114', '0.052850', '0.048643', '0.057849', '0.057000', '0.051276', '0.053209', '0.047229', '0.051653', '0.046745', '0.048620', '0.049559', '0.047878', '0.056590', '0.047195', '0.050920', '0.054358', '0.050388']
         : correct/total = [(202, 4128), (205, 4203), (229, 4081), (229, 4333), (199, 4091), (248, 4287), (239, 4193), (223, 4349), (223, 4191), (202, 4277), (214, 4143), (196, 4193), (199, 4093), (208, 4197), (194, 4052), (228, 4029), (196, 4153), (213, 4183), (222, 4084), (208, 4128)]
         : compromised: 0.0519, honest: 0.0490

=== FINAL RESULTS ===
Dataset: femnist, Nodes: 20, Graph: ring, Aggregation: balance
Attack: directed_deviation, 80.0% compromised
Final accuracy - Compromised: 0.0519, Honest: 0.0490
Overall test accuracy: mean=0.0513 ± 0.0035

=== BALANCE SUMMARY ===
Node 0: acceptance=0.100
Node 1: acceptance=0.350
Node 2: acceptance=0.100
Node 3: acceptance=0.100
Node 4: acceptance=0.000
Node 5: acceptance=0.100
Node 6: acceptance=0.600
Node 7: acceptance=0.200
Node 8: acceptance=0.600
Node 9: acceptance=0.100
Node 10: acceptance=0.000
Node 11: acceptance=0.200
Node 12: acceptance=0.100
Node 13: acceptance=0.000
Node 14: acceptance=0.100
Node 15: acceptance=0.100
Node 16: acceptance=0.000
Node 17: acceptance=0.100
Node 18: acceptance=0.200
Node 19: acceptance=0.350

=== PARALLEL EXECUTION TIME (realistic for distributed system) ===
  COMMUNICATION (max across nodes):
    - Full model transfer: 0.000s (0.0%)
  COMPUTATION (max across nodes):
    - Filtering: 0.027s (70.3%)
    - Aggregation: 0.011s (29.7%)
  TOTALS:
    - Total computation: 0.038s (100.0%)
    - Total communication: 0.000s (0.0%)
    - Total parallel time: 0.038s

=== PER-NODE AVERAGE TIME ===
  - Filtering: 0.016s
  - Aggregation: 0.003s
  - Model transfer: 0.000s
  - Total per node: 0.019s

=== TOTAL COMPUTATIONAL WORK (sum across all nodes) ===
  - Total filtering: 0.319s
  - Total aggregation: 0.067s
  - Total model transfer: 0.000s
  - Grand total: 0.386s
  - Mean acceptance rate: 0.170

BALANCE Algorithm Properties:
  - Model dimension: 6,603,710
  - No compression: Full parameter comparison
  - Theoretical complexity: O(deg(i)×d)
  - Approach: Full parameter filtering + averaging
