Device: cuda
Seed: 987654321
Loading 36 LEAF FEMNIST train files...
LEAF FEMNIST train: 3597 users, 734463 samples
Loading 36 LEAF FEMNIST test files...
LEAF FEMNIST test: 3597 users, 83388 samples
Found 3597 train users, 3597 test users, 3597 common users
User sample counts range: 525 (max) to 17 (min)
Distributed ALL 3597 users across 20 clients
Users per client: 179 (with 17 clients getting +1 user)
Train partition sizes: [36360, 37070, 35957, 38262, 36024, 37732, 36921, 38328, 36867, 37683, 36507, 36915, 36007, 37001, 35681, 35453, 36585, 36801, 35964, 36345]
Test partition sizes: [4128, 4203, 4081, 4333, 4091, 4287, 4193, 4349, 4191, 4277, 4143, 4193, 4093, 4197, 4052, 4029, 4153, 4183, 4084, 4128]
  Client 0: 36360 train samples, 62 unique classes
  Client 1: 37070 train samples, 62 unique classes
  Client 2: 35957 train samples, 62 unique classes
  Client 3: 38262 train samples, 62 unique classes
  Client 4: 36024 train samples, 62 unique classes
  Client 5: 37732 train samples, 62 unique classes
  Client 6: 36921 train samples, 62 unique classes
  Client 7: 38328 train samples, 62 unique classes
  Client 8: 36867 train samples, 62 unique classes
  Client 9: 37683 train samples, 62 unique classes
  Client 10: 36507 train samples, 62 unique classes
  Client 11: 36915 train samples, 62 unique classes
  Client 12: 36007 train samples, 62 unique classes
  Client 13: 37001 train samples, 62 unique classes
  Client 14: 35681 train samples, 62 unique classes
  Client 15: 35453 train samples, 62 unique classes
  Client 16: 36585 train samples, 62 unique classes
  Client 17: 36801 train samples, 62 unique classes
  Client 18: 35964 train samples, 62 unique classes
  Client 19: 36345 train samples, 62 unique classes
Will sample 10000 samples per client per epoch
Graph: ring, nodes: 20, edges: 20
Degree statistics: avg=2.00, min=2, max=2
Attack: Compromised 2/20 nodes: [5, 13]
Attack type: backdoor, lambda: 1.0
Backdoor target label: 0, trigger size: 4
Model variant: baseline
Model parameters: 6,603,710
Sketchguard Node 0:
  Model dim: 6,603,710 → Sketch size: 1000
  Compression ratio: 6603.7x
  Using model parameters for aggregation, sketches for filtering
Sketchguard Node 1:
  Model dim: 6,603,710 → Sketch size: 1000
  Compression ratio: 6603.7x
  Using model parameters for aggregation, sketches for filtering
Sketchguard Node 2:
  Model dim: 6,603,710 → Sketch size: 1000
  Compression ratio: 6603.7x
  Using model parameters for aggregation, sketches for filtering
Sketchguard Node 3:
  Model dim: 6,603,710 → Sketch size: 1000
  Compression ratio: 6603.7x
  Using model parameters for aggregation, sketches for filtering
Sketchguard Node 4:
  Model dim: 6,603,710 → Sketch size: 1000
  Compression ratio: 6603.7x
  Using model parameters for aggregation, sketches for filtering
Sketchguard Node 5:
  Model dim: 6,603,710 → Sketch size: 1000
  Compression ratio: 6603.7x
  Using model parameters for aggregation, sketches for filtering
Sketchguard Node 6:
  Model dim: 6,603,710 → Sketch size: 1000
  Compression ratio: 6603.7x
  Using model parameters for aggregation, sketches for filtering
Sketchguard Node 7:
  Model dim: 6,603,710 → Sketch size: 1000
  Compression ratio: 6603.7x
  Using model parameters for aggregation, sketches for filtering
Sketchguard Node 8:
  Model dim: 6,603,710 → Sketch size: 1000
  Compression ratio: 6603.7x
  Using model parameters for aggregation, sketches for filtering
Sketchguard Node 9:
  Model dim: 6,603,710 → Sketch size: 1000
  Compression ratio: 6603.7x
  Using model parameters for aggregation, sketches for filtering
Sketchguard Node 10:
  Model dim: 6,603,710 → Sketch size: 1000
  Compression ratio: 6603.7x
  Using model parameters for aggregation, sketches for filtering
Sketchguard Node 11:
  Model dim: 6,603,710 → Sketch size: 1000
  Compression ratio: 6603.7x
  Using model parameters for aggregation, sketches for filtering
Sketchguard Node 12:
  Model dim: 6,603,710 → Sketch size: 1000
  Compression ratio: 6603.7x
  Using model parameters for aggregation, sketches for filtering
Sketchguard Node 13:
  Model dim: 6,603,710 → Sketch size: 1000
  Compression ratio: 6603.7x
  Using model parameters for aggregation, sketches for filtering
Sketchguard Node 14:
  Model dim: 6,603,710 → Sketch size: 1000
  Compression ratio: 6603.7x
  Using model parameters for aggregation, sketches for filtering
Sketchguard Node 15:
  Model dim: 6,603,710 → Sketch size: 1000
  Compression ratio: 6603.7x
  Using model parameters for aggregation, sketches for filtering
Sketchguard Node 16:
  Model dim: 6,603,710 → Sketch size: 1000
  Compression ratio: 6603.7x
  Using model parameters for aggregation, sketches for filtering
Sketchguard Node 17:
  Model dim: 6,603,710 → Sketch size: 1000
  Compression ratio: 6603.7x
  Using model parameters for aggregation, sketches for filtering
Sketchguard Node 18:
  Model dim: 6,603,710 → Sketch size: 1000
  Compression ratio: 6603.7x
  Using model parameters for aggregation, sketches for filtering
Sketchguard Node 19:
  Model dim: 6,603,710 → Sketch size: 1000
  Compression ratio: 6603.7x
  Using model parameters for aggregation, sketches for filtering
Sketchguard ALGORITHM (Sketch-based Filtering + State Aggregation)
  - Model dimension: 6,603,710 parameters
  - Config: SketchguardConfig(gamma=2, kappa=1, alpha=0.5, min_neighbors=1, sketch_size=1000, network_seed=987654321, attack_detection_window=5)
  - Sketch size: 1000
  - Compression ratio: 6603.7x
  - Complexity: O(d + N×k) = O(6,603,710 + 20×1000)
  - Theoretical speedup vs BALANCE: 19.9x
Initial test acc across nodes: mean=0.0168 ± 0.0139
Backdoor attack: Created poisoned datasets for 2 compromised nodes
Round 001: test acc mean=0.3991 ± 0.1074 | min=0.0491 max=0.5202
         : test loss mean=1501.4656 ± 4603.2728
         : individual accs = ['0.444767', '0.414466', '0.479539', '0.399723', '0.461745', '0.216935', '0.520153', '0.462175', '0.381293', '0.258826', '0.430123', '0.448366', '0.441241', '0.049083', '0.465202', '0.492926', '0.398026', '0.453741', '0.351371', '0.412548']
         : correct/total = [(1836, 4128), (1742, 4203), (1957, 4081), (1732, 4333), (1889, 4091), (930, 4287), (2181, 4193), (2010, 4349), (1598, 4191), (1107, 4277), (1782, 4143), (1880, 4193), (1806, 4093), (206, 4197), (1885, 4052), (1986, 4029), (1653, 4153), (1898, 4183), (1435, 4084), (1703, 4128)]
         : compromised: 0.1330, honest: 0.4287
         : sketchguard stats = ['Node 0: acc_rate=1.000', 'Node 1: acc_rate=1.000', 'Node 2: acc_rate=1.000']...
Round 002: test acc mean=0.6375 ± 0.1969 | min=0.0453 max=0.7474
         : test loss mean=nan ± nan
         : individual accs = ['0.674661', '0.695456', '0.667974', '0.735057', '0.737473', '0.045253', '0.700930', '0.710508', '0.697924', '0.688801', '0.687425', '0.720487', '0.747374', '0.055278', '0.727048', '0.692976', '0.676138', '0.715754', '0.693683', '0.679021']
         : correct/total = [(2785, 4128), (2923, 4203), (2726, 4081), (3185, 4333), (3017, 4091), (194, 4287), (2939, 4193), (3090, 4349), (2925, 4191), (2946, 4277), (2848, 4143), (3021, 4193), (3059, 4093), (232, 4197), (2946, 4052), (2792, 4029), (2808, 4153), (2994, 4183), (2833, 4084), (2803, 4128)]
         : compromised: 0.0503, honest: 0.7027
         : sketchguard stats = ['Node 0: acc_rate=1.000', 'Node 1: acc_rate=1.000', 'Node 2: acc_rate=1.000']...
Round 003: test acc mean=0.6999 ± 0.2179 | min=0.0453 max=0.7996
         : test loss mean=nan ± nan
         : individual accs = ['0.776647', '0.770878', '0.761333', '0.783522', '0.799560', '0.045253', '0.780587', '0.782479', '0.760439', '0.775310', '0.762974', '0.775101', '0.791107', '0.049083', '0.778875', '0.765699', '0.758729', '0.750657', '0.767385', '0.761386']
         : correct/total = [(3206, 4128), (3240, 4203), (3107, 4081), (3395, 4333), (3271, 4091), (194, 4287), (3273, 4193), (3403, 4349), (3187, 4191), (3316, 4277), (3161, 4143), (3250, 4193), (3238, 4093), (206, 4197), (3156, 4052), (3085, 4029), (3151, 4153), (3140, 4183), (3134, 4084), (3143, 4128)]
         : compromised: 0.0472, honest: 0.7724
         : sketchguard stats = ['Node 0: acc_rate=1.000', 'Node 1: acc_rate=1.000', 'Node 2: acc_rate=1.000']...
Round 004: test acc mean=0.7248 ± 0.2261 | min=0.0453 max=0.8269
         : test loss mean=nan ± nan
         : individual accs = ['0.797965', '0.794195', '0.794413', '0.807754', '0.826937', '0.045253', '0.802767', '0.808232', '0.792651', '0.802432', '0.783490', '0.806344', '0.814073', '0.049083', '0.806022', '0.797468', '0.797014', '0.788429', '0.799706', '0.782461']
         : correct/total = [(3294, 4128), (3338, 4203), (3242, 4081), (3500, 4333), (3383, 4091), (194, 4287), (3366, 4193), (3515, 4349), (3322, 4191), (3432, 4277), (3246, 4143), (3381, 4193), (3332, 4093), (206, 4197), (3266, 4052), (3213, 4029), (3310, 4153), (3298, 4183), (3266, 4084), (3230, 4128)]
         : compromised: 0.0472, honest: 0.8001
         : sketchguard stats = ['Node 0: acc_rate=1.000', 'Node 1: acc_rate=1.000', 'Node 2: acc_rate=1.000']...
Round 005: test acc mean=0.7372 ± 0.2301 | min=0.0453 max=0.8285
         : test loss mean=nan ± nan
         : individual accs = ['0.812984', '0.810374', '0.814506', '0.820909', '0.825471', '0.045253', '0.821130', '0.828466', '0.811739', '0.818798', '0.805455', '0.806821', '0.825312', '0.049083', '0.810711', '0.808637', '0.815796', '0.802295', '0.807542', '0.802326']
         : correct/total = [(3356, 4128), (3406, 4203), (3324, 4081), (3557, 4333), (3377, 4091), (194, 4287), (3443, 4193), (3603, 4349), (3402, 4191), (3502, 4277), (3337, 4143), (3383, 4193), (3378, 4093), (206, 4197), (3285, 4052), (3258, 4029), (3388, 4153), (3356, 4183), (3298, 4084), (3312, 4128)]
         : compromised: 0.0472, honest: 0.8138
         : sketchguard stats = ['Node 0: acc_rate=1.000', 'Node 1: acc_rate=1.000', 'Node 2: acc_rate=1.000']...
Round 006: test acc mean=0.7476 ± 0.2336 | min=0.0453 max=0.8395
         : test loss mean=nan ± nan
         : individual accs = ['0.817587', '0.832739', '0.831659', '0.831295', '0.837204', '0.045253', '0.817076', '0.839503', '0.821522', '0.827449', '0.812455', '0.826854', '0.834351', '0.049083', '0.827986', '0.818069', '0.824223', '0.817117', '0.831538', '0.809109']
         : correct/total = [(3375, 4128), (3500, 4203), (3394, 4081), (3602, 4333), (3425, 4091), (194, 4287), (3426, 4193), (3651, 4349), (3443, 4191), (3539, 4277), (3366, 4143), (3467, 4193), (3415, 4093), (206, 4197), (3355, 4052), (3296, 4029), (3423, 4153), (3418, 4183), (3396, 4084), (3340, 4128)]
         : compromised: 0.0472, honest: 0.8254
         : sketchguard stats = ['Node 0: acc_rate=1.000', 'Node 1: acc_rate=1.000', 'Node 2: acc_rate=1.000']...
Round 007: test acc mean=0.7526 ± 0.2353 | min=0.0453 max=0.8450
         : test loss mean=nan ± nan
         : individual accs = ['0.826793', '0.827028', '0.839745', '0.836141', '0.844292', '0.045253', '0.829716', '0.845022', '0.825579', '0.836100', '0.815351', '0.825662', '0.841925', '0.049083', '0.833662', '0.821544', '0.834337', '0.812814', '0.837414', '0.824370']
         : correct/total = [(3413, 4128), (3476, 4203), (3427, 4081), (3623, 4333), (3454, 4091), (194, 4287), (3479, 4193), (3675, 4349), (3460, 4191), (3576, 4277), (3378, 4143), (3462, 4193), (3446, 4093), (206, 4197), (3378, 4052), (3310, 4029), (3465, 4153), (3400, 4183), (3420, 4084), (3403, 4128)]
         : compromised: 0.0472, honest: 0.8310
         : sketchguard stats = ['Node 0: acc_rate=1.000', 'Node 1: acc_rate=1.000', 'Node 2: acc_rate=1.000']...
Round 008: test acc mean=0.7581 ± 0.2372 | min=0.0453 max=0.8538
         : test loss mean=nan ± nan
         : individual accs = ['0.828004', '0.841780', '0.851507', '0.847450', '0.849914', '0.045253', '0.823992', '0.853759', '0.831067', '0.839140', '0.829592', '0.838063', '0.845346', '0.049083', '0.826505', '0.828245', '0.837226', '0.825962', '0.841822', '0.829215']
         : correct/total = [(3418, 4128), (3538, 4203), (3475, 4081), (3672, 4333), (3477, 4091), (194, 4287), (3455, 4193), (3713, 4349), (3483, 4191), (3589, 4277), (3437, 4143), (3514, 4193), (3460, 4093), (206, 4197), (3349, 4052), (3337, 4029), (3477, 4153), (3455, 4183), (3438, 4084), (3423, 4128)]
         : compromised: 0.0472, honest: 0.8371
         : sketchguard stats = ['Node 0: acc_rate=1.000', 'Node 1: acc_rate=1.000', 'Node 2: acc_rate=1.000']...
Round 009: test acc mean=0.7623 ± 0.2385 | min=0.0453 max=0.8563
         : test loss mean=nan ± nan
         : individual accs = ['0.831395', '0.847490', '0.854447', '0.847911', '0.850403', '0.045253', '0.837586', '0.856289', '0.839895', '0.848492', '0.833454', '0.836394', '0.838260', '0.049083', '0.838845', '0.840903', '0.847821', '0.832895', '0.839373', '0.830426']
         : correct/total = [(3432, 4128), (3562, 4203), (3487, 4081), (3674, 4333), (3479, 4091), (194, 4287), (3512, 4193), (3724, 4349), (3520, 4191), (3629, 4277), (3453, 4143), (3507, 4193), (3431, 4093), (206, 4197), (3399, 4052), (3388, 4029), (3521, 4153), (3484, 4183), (3428, 4084), (3428, 4128)]
         : compromised: 0.0472, honest: 0.8418
         : sketchguard stats = ['Node 0: acc_rate=1.000', 'Node 1: acc_rate=1.000', 'Node 2: acc_rate=1.000']...
Round 010: test acc mean=0.7625 ± 0.2385 | min=0.0453 max=0.8524
         : test loss mean=nan ± nan
         : individual accs = ['0.836725', '0.841304', '0.847586', '0.849758', '0.849426', '0.045253', '0.834486', '0.852380', '0.845144', '0.842413', '0.835385', '0.840448', '0.848033', '0.049083', '0.842794', '0.839414', '0.850229', '0.830743', '0.840842', '0.829215']
         : correct/total = [(3454, 4128), (3536, 4203), (3459, 4081), (3682, 4333), (3475, 4091), (194, 4287), (3499, 4193), (3707, 4349), (3542, 4191), (3603, 4277), (3461, 4143), (3524, 4193), (3471, 4093), (206, 4197), (3415, 4052), (3382, 4029), (3531, 4153), (3475, 4183), (3434, 4084), (3423, 4128)]
         : compromised: 0.0472, honest: 0.8420
         : sketchguard stats = ['Node 0: acc_rate=1.000', 'Node 1: acc_rate=1.000', 'Node 2: acc_rate=1.000']...

=== FINAL RESULTS ===
Dataset: femnist, Nodes: 20, Graph: ring, Aggregation: sketchguard
Attack: backdoor, 10.0% compromised
Final accuracy - Compromised: 0.0472, Honest: 0.8420
Overall test accuracy: mean=0.7625 ± 0.2385

=== BACKDOOR ATTACK SUCCESS RATE (ASR) ===
Target label: 0
Trigger size: 4x4
Overall ASR: 0.1482 ± 0.2840
Honest nodes ASR: 0.0535 ± 0.0059
Compromised nodes ASR: 1.0000 ± 0.0000
Note: Higher ASR indicates more successful backdoor attack

=== Sketchguard SUMMARY ===
Node 0: acceptance=1.000
Node 1: acceptance=1.000
Node 2: acceptance=1.000
Node 3: acceptance=1.000
Node 4: acceptance=0.500
Node 5: acceptance=0.100
Node 6: acceptance=0.500
Node 7: acceptance=1.000
Node 8: acceptance=1.000
Node 9: acceptance=1.000
Node 10: acceptance=1.000
Node 11: acceptance=1.000
Node 12: acceptance=0.500
Node 13: acceptance=0.200
Node 14: acceptance=0.500
Node 15: acceptance=1.000
Node 16: acceptance=1.000
Node 17: acceptance=1.000
Node 18: acceptance=1.000
Node 19: acceptance=1.000

=== PARALLEL EXECUTION TIME (realistic for distributed system) ===
  COMMUNICATION (max across nodes):
    - Sketch transfer: 0.000s (0.0%)
    - Model fetch (accepted): 0.000s (0.0%)
  COMPUTATION (max across nodes):
    - Sketching: 1.419s (99.2%)
    - Filtering: 0.001s (0.1%)
    - Aggregation: 0.011s (0.8%)
  TOTALS:
    - Total computation: 1.431s (100.0%)
    - Total communication: 0.000s (0.0%)
    - Total parallel time: 1.431s

=== PER-NODE AVERAGE TIME ===
  - Sketching: 1.232s
  - Filtering: 0.001s
  - Aggregation: 0.006s
  - Sketch transfer: 0.000s
  - Model fetch: 0.000s
  - Total per node: 1.239s

=== TOTAL COMPUTATIONAL WORK (sum across all nodes) ===
  - Total sketching: 24.639s
  - Total filtering: 0.011s
  - Total aggregation: 0.128s
  - Total sketch transfer: 0.000s
  - Total model fetch: 0.000s
  - Grand total: 24.779s
  - Mean acceptance rate: 0.815

Sketchguard Algorithm Properties:
  - Original dimension: 6,603,710
  - Sketch size: 1000
  - Compression ratio: 19.9x
  - Single repetition: No repetitions needed
  - Theoretical complexity: O(d + N×k)
  - Approach: Sketch filtering + state aggregation
