Device: cuda
Seed: 987654321
Loading 36 LEAF FEMNIST train files...
LEAF FEMNIST train: 3597 users, 734463 samples
Loading 36 LEAF FEMNIST test files...
LEAF FEMNIST test: 3597 users, 83388 samples
Found 3597 train users, 3597 test users, 3597 common users
User sample counts range: 525 (max) to 17 (min)
Distributed ALL 3597 users across 20 clients
Users per client: 179 (with 17 clients getting +1 user)
Train partition sizes: [36360, 37070, 35957, 38262, 36024, 37732, 36921, 38328, 36867, 37683, 36507, 36915, 36007, 37001, 35681, 35453, 36585, 36801, 35964, 36345]
Test partition sizes: [4128, 4203, 4081, 4333, 4091, 4287, 4193, 4349, 4191, 4277, 4143, 4193, 4093, 4197, 4052, 4029, 4153, 4183, 4084, 4128]
  Client 0: 36360 train samples, 62 unique classes
  Client 1: 37070 train samples, 62 unique classes
  Client 2: 35957 train samples, 62 unique classes
  Client 3: 38262 train samples, 62 unique classes
  Client 4: 36024 train samples, 62 unique classes
  Client 5: 37732 train samples, 62 unique classes
  Client 6: 36921 train samples, 62 unique classes
  Client 7: 38328 train samples, 62 unique classes
  Client 8: 36867 train samples, 62 unique classes
  Client 9: 37683 train samples, 62 unique classes
  Client 10: 36507 train samples, 62 unique classes
  Client 11: 36915 train samples, 62 unique classes
  Client 12: 36007 train samples, 62 unique classes
  Client 13: 37001 train samples, 62 unique classes
  Client 14: 35681 train samples, 62 unique classes
  Client 15: 35453 train samples, 62 unique classes
  Client 16: 36585 train samples, 62 unique classes
  Client 17: 36801 train samples, 62 unique classes
  Client 18: 35964 train samples, 62 unique classes
  Client 19: 36345 train samples, 62 unique classes
Will sample 4500 samples per client per epoch
Graph: fully, nodes: 20, edges: 190
Degree statistics: avg=19.00, min=19, max=19
Attack: Compromised 16/20 nodes: [1, 2, 3, 5, 6, 8, 9, 10, 11, 12, 13, 14, 15, 17, 18, 19]
Attack type: backdoor, lambda: 1.0
Backdoor target label: 0, trigger size: 4
Model variant: baseline
Model parameters: 6,603,710
UBAR ALGORITHM (Two-Stage Byzantine-resilient)
  - Model dimension: 6,603,710 parameters
  - Rho parameter: 0.19999999999999996
  - Stage 1: Distance-based filtering (select 20% closest neighbors)
  - Stage 2: Performance-based selection (loss comparison)
  - Complexity: O(deg(i)×d + deg(i)×inference)
Initial test acc across nodes: mean=0.0168 ± 0.0139
Backdoor attack: Created poisoned datasets for 16 compromised nodes
Round 001: test acc mean=0.0514 ± 0.0045 | min=0.0432 max=0.0596
         : test loss mean=24978.7545 ± 12611.0433
         : individual accs = ['0.059593', '0.048775', '0.053418', '0.043157', '0.057932', '0.045253', '0.050799', '0.056105', '0.049630', '0.043488', '0.048033', '0.049606', '0.054239', '0.049083', '0.051826', '0.051626', '0.058271', '0.049486', '0.052889', '0.054506']
         : correct/total = [(246, 4128), (205, 4203), (218, 4081), (187, 4333), (237, 4091), (194, 4287), (213, 4193), (244, 4349), (208, 4191), (186, 4277), (199, 4143), (208, 4193), (222, 4093), (206, 4197), (210, 4052), (208, 4029), (242, 4153), (207, 4183), (216, 4084), (225, 4128)]
         : compromised: 0.0497, honest: 0.0580
         : ubar stats = ['Node 0: s1=0.158, s2=1.000', 'Node 1: s1=0.158, s2=1.000', 'Node 2: s1=0.158, s2=1.000']...
Round 002: test acc mean=0.0314 ± 0.0211 | min=0.0049 max=0.0596
         : test loss mean=13293.6312 ± 14109.2187
         : individual accs = ['0.059593', '0.007614', '0.004901', '0.043157', '0.057932', '0.006298', '0.050799', '0.058174', '0.010737', '0.037643', '0.010379', '0.049606', '0.020523', '0.017632', '0.008391', '0.051626', '0.058271', '0.049486', '0.010529', '0.014050']
         : correct/total = [(246, 4128), (32, 4203), (20, 4081), (187, 4333), (237, 4091), (27, 4287), (213, 4193), (253, 4349), (45, 4191), (161, 4277), (43, 4143), (208, 4193), (84, 4093), (74, 4197), (34, 4052), (208, 4029), (242, 4153), (207, 4183), (43, 4084), (58, 4128)]
         : compromised: 0.0246, honest: 0.0585
         : ubar stats = ['Node 0: s1=0.158, s2=1.000', 'Node 1: s1=0.158, s2=1.000', 'Node 2: s1=0.158, s2=1.000']...
Round 003: test acc mean=0.0510 ± 0.0042 | min=0.0432 max=0.0596
         : test loss mean=nan ± nan
         : individual accs = ['0.059593', '0.048775', '0.053418', '0.043157', '0.057932', '0.045253', '0.050799', '0.051276', '0.049630', '0.043488', '0.048033', '0.049606', '0.054239', '0.049083', '0.051826', '0.051626', '0.055141', '0.049486', '0.052889', '0.054506']
         : correct/total = [(246, 4128), (205, 4203), (218, 4081), (187, 4333), (237, 4091), (194, 4287), (213, 4193), (223, 4349), (208, 4191), (186, 4277), (199, 4143), (208, 4193), (222, 4093), (206, 4197), (210, 4052), (208, 4029), (229, 4153), (207, 4183), (216, 4084), (225, 4128)]
         : compromised: 0.0497, honest: 0.0560
         : ubar stats = ['Node 0: s1=0.158, s2=1.000', 'Node 1: s1=0.158, s2=1.000', 'Node 2: s1=0.158, s2=1.000']...
Round 004: test acc mean=0.0515 ± 0.0047 | min=0.0432 max=0.0596
         : test loss mean=nan ± nan
         : individual accs = ['0.059593', '0.048775', '0.053418', '0.043157', '0.058176', '0.045253', '0.050799', '0.058174', '0.049630', '0.043488', '0.048033', '0.049606', '0.054239', '0.049083', '0.051826', '0.051626', '0.058271', '0.049486', '0.052889', '0.054506']
         : correct/total = [(246, 4128), (205, 4203), (218, 4081), (187, 4333), (238, 4091), (194, 4287), (213, 4193), (253, 4349), (208, 4191), (186, 4277), (199, 4143), (208, 4193), (222, 4093), (206, 4197), (210, 4052), (208, 4029), (242, 4153), (207, 4183), (216, 4084), (225, 4128)]
         : compromised: 0.0497, honest: 0.0586
         : ubar stats = ['Node 0: s1=0.158, s2=0.833', 'Node 1: s1=0.158, s2=0.833', 'Node 2: s1=0.158, s2=0.833']...
Round 005: test acc mean=0.0510 ± 0.0045 | min=0.0432 max=0.0596
         : test loss mean=nan ± nan
         : individual accs = ['0.059593', '0.048775', '0.053418', '0.043157', '0.058665', '0.045253', '0.050799', '0.047827', '0.049630', '0.043488', '0.048033', '0.049606', '0.054239', '0.049083', '0.051826', '0.051626', '0.058271', '0.049486', '0.052889', '0.054506']
         : correct/total = [(246, 4128), (205, 4203), (218, 4081), (187, 4333), (240, 4091), (194, 4287), (213, 4193), (208, 4349), (208, 4191), (186, 4277), (199, 4143), (208, 4193), (222, 4093), (206, 4197), (210, 4052), (208, 4029), (242, 4153), (207, 4183), (216, 4084), (225, 4128)]
         : compromised: 0.0497, honest: 0.0561
         : ubar stats = ['Node 0: s1=0.158, s2=0.800', 'Node 1: s1=0.158, s2=0.733', 'Node 2: s1=0.158, s2=0.733']...
Round 006: test acc mean=0.0504 ± 0.0042 | min=0.0432 max=0.0583
         : test loss mean=nan ± nan
         : individual accs = ['0.044574', '0.048775', '0.053418', '0.043157', '0.051088', '0.045253', '0.050799', '0.058174', '0.049630', '0.043488', '0.048033', '0.049606', '0.054239', '0.049083', '0.051826', '0.051626', '0.058271', '0.049486', '0.052889', '0.054506']
         : correct/total = [(184, 4128), (205, 4203), (218, 4081), (187, 4333), (209, 4091), (194, 4287), (213, 4193), (253, 4349), (208, 4191), (186, 4277), (199, 4143), (208, 4193), (222, 4093), (206, 4197), (210, 4052), (208, 4029), (242, 4153), (207, 4183), (216, 4084), (225, 4128)]
         : compromised: 0.0497, honest: 0.0530
         : ubar stats = ['Node 0: s1=0.158, s2=0.833', 'Node 1: s1=0.158, s2=0.667', 'Node 2: s1=0.158, s2=0.667']...
Round 007: test acc mean=0.0503 ± 0.0043 | min=0.0432 max=0.0596
         : test loss mean=nan ± nan
         : individual accs = ['0.059593', '0.048775', '0.053418', '0.043157', '0.047421', '0.045253', '0.050799', '0.045528', '0.049630', '0.043488', '0.048033', '0.049606', '0.054239', '0.049083', '0.051826', '0.051626', '0.058271', '0.049486', '0.052889', '0.054506']
         : correct/total = [(246, 4128), (205, 4203), (218, 4081), (187, 4333), (194, 4091), (194, 4287), (213, 4193), (198, 4349), (208, 4191), (186, 4277), (199, 4143), (208, 4193), (222, 4093), (206, 4197), (210, 4052), (208, 4029), (242, 4153), (207, 4183), (216, 4084), (225, 4128)]
         : compromised: 0.0497, honest: 0.0527
         : ubar stats = ['Node 0: s1=0.158, s2=0.762', 'Node 1: s1=0.158, s2=0.619', 'Node 2: s1=0.158, s2=0.619']...
Round 008: test acc mean=0.0503 ± 0.0033 | min=0.0432 max=0.0551
         : test loss mean=nan ± nan
         : individual accs = ['0.051599', '0.048775', '0.053418', '0.043157', '0.051577', '0.045253', '0.050799', '0.051276', '0.049630', '0.043488', '0.048033', '0.049606', '0.054239', '0.049083', '0.051826', '0.051626', '0.055141', '0.049486', '0.052889', '0.054506']
         : correct/total = [(213, 4128), (205, 4203), (218, 4081), (187, 4333), (211, 4091), (194, 4287), (213, 4193), (223, 4349), (208, 4191), (186, 4277), (199, 4143), (208, 4193), (222, 4093), (206, 4197), (210, 4052), (208, 4029), (229, 4153), (207, 4183), (216, 4084), (225, 4128)]
         : compromised: 0.0497, honest: 0.0524
         : ubar stats = ['Node 0: s1=0.158, s2=0.708', 'Node 1: s1=0.158, s2=0.583', 'Node 2: s1=0.158, s2=0.583']...
Round 009: test acc mean=0.0524 ± 0.0093 | min=0.0432 max=0.0873
         : test loss mean=nan ± nan
         : individual accs = ['0.057655', '0.048775', '0.053418', '0.043157', '0.087265', '0.045253', '0.050799', '0.043918', '0.049630', '0.043488', '0.048033', '0.049606', '0.054239', '0.049083', '0.051826', '0.051626', '0.063087', '0.049486', '0.052889', '0.054506']
         : correct/total = [(238, 4128), (205, 4203), (218, 4081), (187, 4333), (357, 4091), (194, 4287), (213, 4193), (191, 4349), (208, 4191), (186, 4277), (199, 4143), (208, 4193), (222, 4093), (206, 4197), (210, 4052), (208, 4029), (262, 4153), (207, 4183), (216, 4084), (225, 4128)]
         : compromised: 0.0497, honest: 0.0630
         : ubar stats = ['Node 0: s1=0.158, s2=0.741', 'Node 1: s1=0.158, s2=0.556', 'Node 2: s1=0.158, s2=0.556']...
Round 010: test acc mean=0.0517 ± 0.0051 | min=0.0432 max=0.0619
         : test loss mean=nan ± nan
         : individual accs = ['0.061047', '0.048775', '0.053418', '0.043157', '0.057932', '0.045253', '0.050799', '0.061853', '0.049630', '0.043488', '0.048033', '0.049606', '0.054239', '0.049083', '0.051826', '0.051626', '0.058271', '0.049486', '0.052889', '0.054506']
         : correct/total = [(252, 4128), (205, 4203), (218, 4081), (187, 4333), (237, 4091), (194, 4287), (213, 4193), (269, 4349), (208, 4191), (186, 4277), (199, 4143), (208, 4193), (222, 4093), (206, 4197), (210, 4052), (208, 4029), (242, 4153), (207, 4183), (216, 4084), (225, 4128)]
         : compromised: 0.0497, honest: 0.0598
         : ubar stats = ['Node 0: s1=0.158, s2=0.700', 'Node 1: s1=0.158, s2=0.533', 'Node 2: s1=0.158, s2=0.533']...

=== FINAL RESULTS ===
Dataset: femnist, Nodes: 20, Graph: fully, Aggregation: ubar
Attack: backdoor, 80.0% compromised
Final accuracy - Compromised: 0.0497, Honest: 0.0598
Overall test accuracy: mean=0.0517 ± 0.0051

=== BACKDOOR ATTACK SUCCESS RATE (ASR) ===
Target label: 0
Trigger size: 4x4
Overall ASR: 0.8000 ± 0.4000
Honest nodes ASR: 0.0000 ± 0.0000
Compromised nodes ASR: 1.0000 ± 0.0000
Note: Higher ASR indicates more successful backdoor attack

=== UBAR SUMMARY ===
Node 0: stage1=0.158, stage2=0.700, overall=0.111
Node 1: stage1=0.158, stage2=0.533, overall=0.084
Node 2: stage1=0.158, stage2=0.533, overall=0.084
Node 3: stage1=0.158, stage2=0.533, overall=0.084
Node 4: stage1=0.158, stage2=0.667, overall=0.105
Node 5: stage1=0.158, stage2=0.533, overall=0.084
Node 6: stage1=0.158, stage2=0.533, overall=0.084
Node 7: stage1=0.158, stage2=0.533, overall=0.084
Node 8: stage1=0.158, stage2=0.533, overall=0.084
Node 9: stage1=0.158, stage2=0.533, overall=0.084
Node 10: stage1=0.158, stage2=0.533, overall=0.084
Node 11: stage1=0.158, stage2=0.533, overall=0.084
Node 12: stage1=0.158, stage2=0.533, overall=0.084
Node 13: stage1=0.158, stage2=0.467, overall=0.074
Node 14: stage1=0.158, stage2=0.533, overall=0.084
Node 15: stage1=0.158, stage2=0.533, overall=0.084
Node 16: stage1=0.158, stage2=0.600, overall=0.095
Node 17: stage1=0.158, stage2=0.533, overall=0.084
Node 18: stage1=0.158, stage2=0.533, overall=0.084
Node 19: stage1=0.158, stage2=0.533, overall=0.084

=== PARALLEL EXECUTION TIME (realistic for distributed system) ===
  COMMUNICATION (max across nodes):
    - Full model transfer: 0.000s (0.0%)
  COMPUTATION (max across nodes):
    - Distance computation: 0.073s (1.8%)
    - Loss computation: 4.076s (98.1%)
    - Aggregation: 0.007s (0.2%)
  TOTALS:
    - Total computation: 4.156s (100.0%)
    - Total communication: 0.000s (0.0%)
    - Total parallel time: 4.156s

=== PER-NODE AVERAGE TIME ===
  - Distance computation: 0.067s
  - Loss computation: 3.851s
  - Aggregation: 0.005s
  - Model transfer: 0.000s
  - Total per node: 3.923s

=== TOTAL COMPUTATIONAL WORK (sum across all nodes) ===
  - Total distance computation: 1.338s
  - Total loss computation: 77.022s
  - Total aggregation: 0.102s
  - Total model transfer: 0.000s
  - Grand total: 78.462s
  - Mean Stage 1 acceptance rate: 0.158
  - Mean Stage 2 acceptance rate: 0.548
  - Overall acceptance rate: 0.087

UBAR Algorithm Properties:
  - Model dimension: 6,603,710
  - Rho parameter: 0.19999999999999996
  - Two-stage approach: Distance filtering + loss evaluation
  - Stage 1 selects: 20% of neighbors
  - Stage 2 uses: Training sample loss comparison
  - Theoretical complexity: O(deg(i)×d + deg(i)×inference)
  - Approach: UBAR paper implementation
