Device: cuda
Seed: 987654321
Loading 36 LEAF FEMNIST train files...
LEAF FEMNIST train: 3597 users, 734463 samples
Loading 36 LEAF FEMNIST test files...
LEAF FEMNIST test: 3597 users, 83388 samples
Found 3597 train users, 3597 test users, 3597 common users
User sample counts range: 525 (max) to 17 (min)
Distributed ALL 3597 users across 20 clients
Users per client: 179 (with 17 clients getting +1 user)
Train partition sizes: [36360, 37070, 35957, 38262, 36024, 37732, 36921, 38328, 36867, 37683, 36507, 36915, 36007, 37001, 35681, 35453, 36585, 36801, 35964, 36345]
Test partition sizes: [4128, 4203, 4081, 4333, 4091, 4287, 4193, 4349, 4191, 4277, 4143, 4193, 4093, 4197, 4052, 4029, 4153, 4183, 4084, 4128]
  Client 0: 36360 train samples, 62 unique classes
  Client 1: 37070 train samples, 62 unique classes
  Client 2: 35957 train samples, 62 unique classes
  Client 3: 38262 train samples, 62 unique classes
  Client 4: 36024 train samples, 62 unique classes
  Client 5: 37732 train samples, 62 unique classes
  Client 6: 36921 train samples, 62 unique classes
  Client 7: 38328 train samples, 62 unique classes
  Client 8: 36867 train samples, 62 unique classes
  Client 9: 37683 train samples, 62 unique classes
  Client 10: 36507 train samples, 62 unique classes
  Client 11: 36915 train samples, 62 unique classes
  Client 12: 36007 train samples, 62 unique classes
  Client 13: 37001 train samples, 62 unique classes
  Client 14: 35681 train samples, 62 unique classes
  Client 15: 35453 train samples, 62 unique classes
  Client 16: 36585 train samples, 62 unique classes
  Client 17: 36801 train samples, 62 unique classes
  Client 18: 35964 train samples, 62 unique classes
  Client 19: 36345 train samples, 62 unique classes
Will sample 4500 samples per client per epoch
Graph: erdos, nodes: 20, edges: 48
Degree statistics: avg=4.80, min=2, max=7
Attack: Compromised 6/20 nodes: [5, 12, 13, 14, 17, 18]
Attack type: directed_deviation, lambda: 1.0
Model variant: baseline
Model parameters: 6,603,710
Initial test acc across nodes: mean=0.0168 ± 0.0139
Round 001: test acc mean=0.0487 ± 0.0166 | min=0.0043 max=0.0757
         : test loss mean=57694.8705 ± 117033.3958
         : individual accs = ['0.059593', '0.052344', '0.048272', '0.052850', '0.057932', '0.022160', '0.057000', '0.058174', '0.053209', '0.053776', '0.050447', '0.061770', '0.058637', '0.047177', '0.014561', '0.075701', '0.035396', '0.004303', '0.055583', '0.054506']
         : correct/total = [(246, 4128), (220, 4203), (197, 4081), (229, 4333), (237, 4091), (95, 4287), (239, 4193), (253, 4349), (223, 4191), (230, 4277), (209, 4143), (259, 4193), (240, 4093), (198, 4197), (59, 4052), (305, 4029), (147, 4153), (18, 4183), (227, 4084), (225, 4128)]
         : compromised: 0.0337, honest: 0.0551
Round 002: test acc mean=0.0498 ± 0.0115 | min=0.0026 max=0.0596
         : test loss mean=1639126365970159616.0000 ± 3918613865317233664.0000
         : individual accs = ['0.059593', '0.051630', '0.050723', '0.052850', '0.051088', '0.002566', '0.057000', '0.058174', '0.051062', '0.044891', '0.047309', '0.053899', '0.049841', '0.045747', '0.051579', '0.056342', '0.054418', '0.053311', '0.055583', '0.048450']
         : correct/total = [(246, 4128), (217, 4203), (207, 4081), (229, 4333), (209, 4091), (11, 4287), (239, 4193), (253, 4349), (214, 4191), (192, 4277), (196, 4143), (226, 4193), (204, 4093), (192, 4197), (209, 4052), (227, 4029), (226, 4153), (223, 4183), (227, 4084), (200, 4128)]
         : compromised: 0.0431, honest: 0.0527
Round 003: test acc mean=0.0496 ± 0.0118 | min=0.0026 max=0.0595
         : test loss mean=24656343746671648768.0000 ± 58826803231312896000.0000
         : individual accs = ['0.049176', '0.051630', '0.059544', '0.043388', '0.057932', '0.002566', '0.044598', '0.058174', '0.057266', '0.053776', '0.048033', '0.053184', '0.049841', '0.049083', '0.051579', '0.057831', '0.051288', '0.053311', '0.055583', '0.044331']
         : correct/total = [(203, 4128), (217, 4203), (243, 4081), (188, 4333), (237, 4091), (11, 4287), (187, 4193), (253, 4349), (240, 4191), (230, 4277), (199, 4143), (223, 4193), (204, 4093), (206, 4197), (209, 4052), (233, 4029), (213, 4153), (223, 4183), (227, 4084), (183, 4128)]
         : compromised: 0.0437, honest: 0.0522
Round 004: test acc mean=0.0641 ± 0.0278 | min=0.0117 max=0.1415
         : test loss mean=24770940056822239232.0000 ± 59108851048363171840.0000
         : individual accs = ['0.050145', '0.064716', '0.073756', '0.065544', '0.103887', '0.011663', '0.057000', '0.082778', '0.113099', '0.053776', '0.041999', '0.049606', '0.049841', '0.046462', '0.051579', '0.141474', '0.052011', '0.053311', '0.069785', '0.048934']
         : correct/total = [(207, 4128), (272, 4203), (301, 4081), (284, 4333), (425, 4091), (50, 4287), (239, 4193), (360, 4349), (474, 4191), (230, 4277), (174, 4143), (208, 4193), (204, 4093), (195, 4197), (209, 4052), (570, 4029), (216, 4153), (223, 4183), (285, 4084), (202, 4128)]
         : compromised: 0.0471, honest: 0.0713
Round 005: test acc mean=0.0784 ± 0.0436 | min=0.0033 max=0.1644
         : test loss mean=24984166748198424576.0000 ± 59622937311872794624.0000
         : individual accs = ['0.059593', '0.055912', '0.131095', '0.052850', '0.134930', '0.003266', '0.057000', '0.133594', '0.164400', '0.077625', '0.051653', '0.053899', '0.049841', '0.049559', '0.051579', '0.051378', '0.051288', '0.053311', '0.134917', '0.149467']
         : correct/total = [(246, 4128), (235, 4203), (535, 4081), (229, 4333), (552, 4091), (14, 4287), (239, 4193), (581, 4349), (689, 4191), (332, 4277), (214, 4143), (226, 4193), (204, 4093), (208, 4197), (209, 4052), (207, 4029), (213, 4153), (223, 4183), (551, 4084), (617, 4128)]
         : compromised: 0.0571, honest: 0.0875
Round 006: test acc mean=0.0867 ± 0.0529 | min=0.0037 max=0.2002
         : test loss mean=267611417.9544 ± 638283204.2097
         : individual accs = ['0.044574', '0.129431', '0.190395', '0.048465', '0.134686', '0.003732', '0.046745', '0.137963', '0.200191', '0.053776', '0.050447', '0.053899', '0.058637', '0.062426', '0.061204', '0.140978', '0.058271', '0.050920', '0.141528', '0.066618']
         : correct/total = [(184, 4128), (544, 4203), (777, 4081), (210, 4333), (551, 4091), (16, 4287), (196, 4193), (600, 4349), (839, 4191), (230, 4277), (209, 4143), (226, 4193), (240, 4093), (262, 4197), (248, 4052), (568, 4029), (242, 4153), (213, 4183), (578, 4084), (275, 4128)]
         : compromised: 0.0631, honest: 0.0969
Round 007: test acc mean=0.1024 ± 0.0678 | min=0.0047 max=0.2436
         : test loss mean=423132769.9343 ± 1048372657.3365
         : individual accs = ['0.090601', '0.220795', '0.243568', '0.044773', '0.142508', '0.004665', '0.083711', '0.133364', '0.183250', '0.053776', '0.055998', '0.049606', '0.058637', '0.055278', '0.061204', '0.226855', '0.044546', '0.050920', '0.131489', '0.111676']
         : correct/total = [(374, 4128), (928, 4203), (994, 4081), (194, 4333), (583, 4091), (20, 4287), (351, 4193), (580, 4349), (768, 4191), (230, 4277), (232, 4143), (208, 4193), (240, 4093), (232, 4197), (248, 4052), (914, 4029), (185, 4153), (213, 4183), (537, 4084), (461, 4128)]
         : compromised: 0.0604, honest: 0.1204
Round 008: test acc mean=0.1207 ± 0.0919 | min=0.0037 max=0.2769
         : test loss mean=35275668331424.6875 ± 92882876417907.1562
         : individual accs = ['0.049661', '0.249108', '0.276893', '0.046619', '0.226351', '0.003732', '0.043883', '0.223730', '0.221904', '0.057283', '0.045619', '0.061770', '0.049841', '0.055278', '0.051579', '0.233805', '0.054418', '0.053311', '0.241430', '0.168120']
         : correct/total = [(205, 4128), (1047, 4203), (1130, 4081), (202, 4333), (926, 4091), (16, 4287), (184, 4193), (973, 4349), (930, 4191), (245, 4277), (189, 4143), (259, 4193), (204, 4093), (232, 4197), (209, 4052), (942, 4029), (226, 4153), (223, 4183), (986, 4084), (694, 4128)]
         : compromised: 0.0759, honest: 0.1399
Round 009: test acc mean=0.1596 ± 0.1337 | min=0.0407 max=0.3552
         : test loss mean=17792503312729581568.0000 ± 42456530044962889728.0000
         : individual accs = ['0.051599', '0.333333', '0.318549', '0.052850', '0.347103', '0.048052', '0.049130', '0.344447', '0.313768', '0.053776', '0.092445', '0.041736', '0.049841', '0.062426', '0.051579', '0.355175', '0.040693', '0.053311', '0.343291', '0.189438']
         : correct/total = [(213, 4128), (1401, 4203), (1300, 4081), (229, 4333), (1420, 4091), (206, 4287), (206, 4193), (1498, 4349), (1315, 4191), (230, 4277), (383, 4143), (175, 4193), (204, 4093), (262, 4197), (209, 4052), (1431, 4029), (169, 4153), (223, 4183), (1402, 4084), (782, 4128)]
         : compromised: 0.1014, honest: 0.1846
Round 010: test acc mean=0.1768 ± 0.1513 | min=0.0491 max=0.3923
         : test loss mean=17800004961382268928.0000 ± 42470749528580276224.0000
         : individual accs = ['0.051599', '0.369022', '0.368537', '0.054927', '0.392325', '0.057849', '0.049130', '0.371580', '0.366500', '0.053776', '0.055998', '0.053899', '0.049841', '0.062902', '0.051579', '0.371060', '0.058271', '0.053311', '0.365818', '0.277374']
         : correct/total = [(213, 4128), (1551, 4203), (1504, 4081), (238, 4333), (1605, 4091), (248, 4287), (206, 4193), (1616, 4349), (1536, 4191), (230, 4277), (232, 4143), (226, 4193), (204, 4093), (264, 4197), (209, 4052), (1495, 4029), (242, 4153), (223, 4183), (1494, 4084), (1145, 4128)]
         : compromised: 0.1069, honest: 0.2067

=== FINAL RESULTS ===
Dataset: femnist, Nodes: 20, Graph: erdos, Aggregation: krum
Attack: directed_deviation, 30.0% compromised
Final accuracy - Compromised: 0.1069, Honest: 0.2067
Overall test accuracy: mean=0.1768 ± 0.1513
