Device: cuda
Seed: 987654321
Loading 36 LEAF FEMNIST train files...
LEAF FEMNIST train: 3597 users, 734463 samples
Loading 36 LEAF FEMNIST test files...
LEAF FEMNIST test: 3597 users, 83388 samples
Found 3597 train users, 3597 test users, 3597 common users
User sample counts range: 525 (max) to 17 (min)
Distributed ALL 3597 users across 20 clients
Users per client: 179 (with 17 clients getting +1 user)
Train partition sizes: [36360, 37070, 35957, 38262, 36024, 37732, 36921, 38328, 36867, 37683, 36507, 36915, 36007, 37001, 35681, 35453, 36585, 36801, 35964, 36345]
Test partition sizes: [4128, 4203, 4081, 4333, 4091, 4287, 4193, 4349, 4191, 4277, 4143, 4193, 4093, 4197, 4052, 4029, 4153, 4183, 4084, 4128]
  Client 0: 36360 train samples, 62 unique classes
  Client 1: 37070 train samples, 62 unique classes
  Client 2: 35957 train samples, 62 unique classes
  Client 3: 38262 train samples, 62 unique classes
  Client 4: 36024 train samples, 62 unique classes
  Client 5: 37732 train samples, 62 unique classes
  Client 6: 36921 train samples, 62 unique classes
  Client 7: 38328 train samples, 62 unique classes
  Client 8: 36867 train samples, 62 unique classes
  Client 9: 37683 train samples, 62 unique classes
  Client 10: 36507 train samples, 62 unique classes
  Client 11: 36915 train samples, 62 unique classes
  Client 12: 36007 train samples, 62 unique classes
  Client 13: 37001 train samples, 62 unique classes
  Client 14: 35681 train samples, 62 unique classes
  Client 15: 35453 train samples, 62 unique classes
  Client 16: 36585 train samples, 62 unique classes
  Client 17: 36801 train samples, 62 unique classes
  Client 18: 35964 train samples, 62 unique classes
  Client 19: 36345 train samples, 62 unique classes
Will sample 4500 samples per client per epoch
Graph: ring, nodes: 20, edges: 20
Degree statistics: avg=2.00, min=2, max=2
Attack: Compromised 16/20 nodes: [1, 2, 3, 5, 6, 8, 9, 10, 11, 12, 13, 14, 15, 17, 18, 19]
Attack type: gaussian, lambda: 1.0
Model variant: baseline
Model parameters: 6,603,710
UBAR ALGORITHM (Two-Stage Byzantine-resilient)
  - Model dimension: 6,603,710 parameters
  - Rho parameter: 0.19999999999999996
  - Stage 1: Distance-based filtering (select 20% closest neighbors)
  - Stage 2: Performance-based selection (loss comparison)
  - Complexity: O(deg(i)×d + deg(i)×inference)
Initial test acc across nodes: mean=0.0168 ± 0.0139
Round 001: test acc mean=0.0265 ± 0.0200 | min=0.0027 max=0.0578
         : test loss mean=445804422.7088 ± 407561280.7919
         : individual accs = ['0.014777', '0.052344', '0.003676', '0.043157', '0.002689', '0.057849', '0.044598', '0.011497', '0.047960', '0.032032', '0.005552', '0.014071', '0.013682', '0.005718', '0.004689', '0.050385', '0.009632', '0.050920', '0.014447', '0.050145']
         : correct/total = [(61, 4128), (220, 4203), (15, 4081), (187, 4333), (11, 4091), (248, 4287), (187, 4193), (50, 4349), (201, 4191), (137, 4277), (23, 4143), (59, 4193), (56, 4093), (24, 4197), (19, 4052), (203, 4029), (40, 4153), (213, 4183), (59, 4084), (207, 4128)]
         : compromised: 0.0307, honest: 0.0096
         : ubar stats = ['Node 0: s1=0.500, s2=1.000', 'Node 1: s1=0.500, s2=1.000', 'Node 2: s1=0.500, s2=1.000']...
Round 002: test acc mean=0.0388 ± 0.0180 | min=0.0032 max=0.0583
         : test loss mean=nan ± nan
         : individual accs = ['0.047238', '0.004521', '0.057584', '0.003231', '0.043021', '0.045253', '0.009301', '0.045068', '0.005727', '0.048398', '0.048033', '0.049606', '0.036404', '0.049083', '0.051826', '0.041946', '0.058271', '0.026058', '0.052889', '0.053537']
         : correct/total = [(195, 4128), (19, 4203), (235, 4081), (14, 4333), (176, 4091), (194, 4287), (39, 4193), (196, 4349), (24, 4191), (207, 4277), (199, 4143), (208, 4193), (149, 4093), (206, 4197), (210, 4052), (169, 4029), (242, 4153), (109, 4183), (216, 4084), (221, 4128)]
         : compromised: 0.0365, honest: 0.0484
         : ubar stats = ['Node 0: s1=0.500, s2=1.000', 'Node 1: s1=0.500, s2=1.000', 'Node 2: s1=0.500, s2=1.000']...
Round 003: test acc mean=0.0476 ± 0.0062 | min=0.0337 max=0.0583
         : test loss mean=nan ± nan
         : individual accs = ['0.047238', '0.048775', '0.057584', '0.043157', '0.043021', '0.045253', '0.044598', '0.045068', '0.053209', '0.033668', '0.048033', '0.049606', '0.036404', '0.049083', '0.051826', '0.040953', '0.058271', '0.049486', '0.052889', '0.054506']
         : correct/total = [(195, 4128), (205, 4203), (235, 4081), (187, 4333), (176, 4091), (194, 4287), (187, 4193), (196, 4349), (223, 4191), (144, 4277), (199, 4143), (208, 4193), (149, 4093), (206, 4197), (210, 4052), (165, 4029), (242, 4153), (207, 4183), (216, 4084), (225, 4128)]
         : compromised: 0.0474, honest: 0.0484
         : ubar stats = ['Node 0: s1=0.500, s2=1.000', 'Node 1: s1=0.500, s2=1.000', 'Node 2: s1=0.500, s2=1.000']...
Round 004: test acc mean=0.0484 ± 0.0055 | min=0.0364 max=0.0583
         : test loss mean=nan ± nan
         : individual accs = ['0.047238', '0.048775', '0.057584', '0.043157', '0.043021', '0.045253', '0.044598', '0.045068', '0.053209', '0.039280', '0.048033', '0.049606', '0.036404', '0.049083', '0.051826', '0.051378', '0.058271', '0.049486', '0.052889', '0.054506']
         : correct/total = [(195, 4128), (205, 4203), (235, 4081), (187, 4333), (176, 4091), (194, 4287), (187, 4193), (196, 4349), (223, 4191), (168, 4277), (199, 4143), (208, 4193), (149, 4093), (206, 4197), (210, 4052), (207, 4029), (242, 4153), (207, 4183), (216, 4084), (225, 4128)]
         : compromised: 0.0484, honest: 0.0484
         : ubar stats = ['Node 0: s1=0.500, s2=1.000', 'Node 1: s1=0.500, s2=1.000', 'Node 2: s1=0.500, s2=1.000']...
Round 005: test acc mean=0.0475 ± 0.0065 | min=0.0337 max=0.0583
         : test loss mean=nan ± nan
         : individual accs = ['0.050145', '0.048775', '0.057584', '0.043157', '0.043021', '0.045253', '0.044598', '0.045068', '0.040802', '0.033668', '0.048033', '0.049606', '0.033716', '0.049083', '0.051826', '0.051378', '0.058271', '0.049486', '0.052889', '0.054506']
         : correct/total = [(207, 4128), (205, 4203), (235, 4081), (187, 4333), (176, 4091), (194, 4287), (187, 4193), (196, 4349), (171, 4191), (144, 4277), (199, 4143), (208, 4193), (138, 4093), (206, 4197), (210, 4052), (207, 4029), (242, 4153), (207, 4183), (216, 4084), (225, 4128)]
         : compromised: 0.0471, honest: 0.0491
         : ubar stats = ['Node 0: s1=0.500, s2=1.000', 'Node 1: s1=0.500, s2=1.000', 'Node 2: s1=0.500, s2=1.000']...
Round 006: test acc mean=0.0475 ± 0.0062 | min=0.0337 max=0.0583
         : test loss mean=nan ± nan
         : individual accs = ['0.047238', '0.048775', '0.057584', '0.043157', '0.043021', '0.045253', '0.044598', '0.045068', '0.040802', '0.033668', '0.048033', '0.049606', '0.036404', '0.049083', '0.051826', '0.050881', '0.058271', '0.049486', '0.052889', '0.054506']
         : correct/total = [(195, 4128), (205, 4203), (235, 4081), (187, 4333), (176, 4091), (194, 4287), (187, 4193), (196, 4349), (171, 4191), (144, 4277), (199, 4143), (208, 4193), (149, 4093), (206, 4197), (210, 4052), (205, 4029), (242, 4153), (207, 4183), (216, 4084), (225, 4128)]
         : compromised: 0.0473, honest: 0.0484
         : ubar stats = ['Node 0: s1=0.500, s2=1.000', 'Node 1: s1=0.500, s2=1.000', 'Node 2: s1=0.500, s2=1.000']...
Round 007: test acc mean=0.0484 ± 0.0053 | min=0.0364 max=0.0583
         : test loss mean=nan ± nan
         : individual accs = ['0.050145', '0.048775', '0.057584', '0.043157', '0.043021', '0.045253', '0.044598', '0.045068', '0.040802', '0.047229', '0.048033', '0.049606', '0.036404', '0.049083', '0.051826', '0.051378', '0.058271', '0.049486', '0.052889', '0.054506']
         : correct/total = [(207, 4128), (205, 4203), (235, 4081), (187, 4333), (176, 4091), (194, 4287), (187, 4193), (196, 4349), (171, 4191), (202, 4277), (199, 4143), (208, 4193), (149, 4093), (206, 4197), (210, 4052), (207, 4029), (242, 4153), (207, 4183), (216, 4084), (225, 4128)]
         : compromised: 0.0482, honest: 0.0491
         : ubar stats = ['Node 0: s1=0.500, s2=1.000', 'Node 1: s1=0.500, s2=1.000', 'Node 2: s1=0.500, s2=1.000']...
Round 008: test acc mean=0.0485 ± 0.0080 | min=0.0261 max=0.0662
         : test loss mean=nan ± nan
         : individual accs = ['0.050145', '0.048775', '0.057584', '0.043157', '0.043021', '0.045253', '0.044598', '0.045068', '0.037700', '0.047229', '0.048033', '0.049606', '0.026142', '0.066238', '0.051826', '0.051378', '0.058271', '0.049486', '0.052889', '0.054506']
         : correct/total = [(207, 4128), (205, 4203), (235, 4081), (187, 4333), (176, 4091), (194, 4287), (187, 4193), (196, 4349), (158, 4191), (202, 4277), (199, 4143), (208, 4193), (107, 4093), (278, 4197), (210, 4052), (207, 4029), (242, 4153), (207, 4183), (216, 4084), (225, 4128)]
         : compromised: 0.0484, honest: 0.0491
         : ubar stats = ['Node 0: s1=0.500, s2=1.000', 'Node 1: s1=0.500, s2=1.000', 'Node 2: s1=0.500, s2=1.000']...
Round 009: test acc mean=0.0473 ± 0.0065 | min=0.0261 max=0.0551
         : test loss mean=nan ± nan
         : individual accs = ['0.050145', '0.048775', '0.055134', '0.043157', '0.043021', '0.045253', '0.043406', '0.045528', '0.037700', '0.053776', '0.048033', '0.049606', '0.026142', '0.049083', '0.051826', '0.051626', '0.047195', '0.049486', '0.052889', '0.054506']
         : correct/total = [(207, 4128), (205, 4203), (225, 4081), (187, 4333), (176, 4091), (194, 4287), (182, 4193), (198, 4349), (158, 4191), (230, 4277), (199, 4143), (208, 4193), (107, 4093), (206, 4197), (210, 4052), (208, 4029), (196, 4153), (207, 4183), (216, 4084), (225, 4128)]
         : compromised: 0.0475, honest: 0.0465
         : ubar stats = ['Node 0: s1=0.500, s2=1.000', 'Node 1: s1=0.500, s2=1.000', 'Node 2: s1=0.500, s2=1.000']...
Round 010: test acc mean=0.0481 ± 0.0064 | min=0.0261 max=0.0566
         : test loss mean=nan ± nan
         : individual accs = ['0.050145', '0.048775', '0.054643', '0.043157', '0.043021', '0.045253', '0.050799', '0.045068', '0.051539', '0.043488', '0.048033', '0.049606', '0.026142', '0.044556', '0.051826', '0.056590', '0.052011', '0.049486', '0.052889', '0.054506']
         : correct/total = [(207, 4128), (205, 4203), (223, 4081), (187, 4333), (176, 4091), (194, 4287), (213, 4193), (196, 4349), (216, 4191), (186, 4277), (199, 4143), (208, 4193), (107, 4093), (187, 4197), (210, 4052), (228, 4029), (216, 4153), (207, 4183), (216, 4084), (225, 4128)]
         : compromised: 0.0482, honest: 0.0476
         : ubar stats = ['Node 0: s1=0.500, s2=1.000', 'Node 1: s1=0.500, s2=1.000', 'Node 2: s1=0.500, s2=1.000']...

=== FINAL RESULTS ===
Dataset: femnist, Nodes: 20, Graph: ring, Aggregation: ubar
Attack: gaussian, 80.0% compromised
Final accuracy - Compromised: 0.0482, Honest: 0.0476
Overall test accuracy: mean=0.0481 ± 0.0064

=== UBAR SUMMARY ===
Node 0: stage1=0.500, stage2=1.000, overall=0.500
Node 1: stage1=0.500, stage2=1.000, overall=0.500
Node 2: stage1=0.500, stage2=1.000, overall=0.500
Node 3: stage1=0.500, stage2=1.000, overall=0.500
Node 4: stage1=0.500, stage2=1.000, overall=0.500
Node 5: stage1=0.500, stage2=1.000, overall=0.500
Node 6: stage1=0.500, stage2=1.000, overall=0.500
Node 7: stage1=0.500, stage2=1.000, overall=0.500
Node 8: stage1=0.500, stage2=1.000, overall=0.500
Node 9: stage1=0.500, stage2=1.000, overall=0.500
Node 10: stage1=0.500, stage2=1.000, overall=0.500
Node 11: stage1=0.500, stage2=1.000, overall=0.500
Node 12: stage1=0.500, stage2=1.000, overall=0.500
Node 13: stage1=0.500, stage2=1.000, overall=0.500
Node 14: stage1=0.500, stage2=1.000, overall=0.500
Node 15: stage1=0.500, stage2=1.000, overall=0.500
Node 16: stage1=0.500, stage2=1.000, overall=0.500
Node 17: stage1=0.500, stage2=1.000, overall=0.500
Node 18: stage1=0.500, stage2=1.000, overall=0.500
Node 19: stage1=0.500, stage2=1.000, overall=0.500

=== PARALLEL EXECUTION TIME (realistic for distributed system) ===
  COMMUNICATION (max across nodes):
    - Full model transfer: 0.000s (0.0%)
  COMPUTATION (max across nodes):
    - Distance computation: 0.028s (0.7%)
    - Loss computation: 4.114s (98.9%)
    - Aggregation: 0.017s (0.4%)
  TOTALS:
    - Total computation: 4.159s (100.0%)
    - Total communication: 0.000s (0.0%)
    - Total parallel time: 4.159s

=== PER-NODE AVERAGE TIME ===
  - Distance computation: 0.011s
  - Loss computation: 3.870s
  - Aggregation: 0.008s
  - Model transfer: 0.000s
  - Total per node: 3.889s

=== TOTAL COMPUTATIONAL WORK (sum across all nodes) ===
  - Total distance computation: 0.219s
  - Total loss computation: 77.397s
  - Total aggregation: 0.159s
  - Total model transfer: 0.000s
  - Grand total: 77.775s
  - Mean Stage 1 acceptance rate: 0.500
  - Mean Stage 2 acceptance rate: 1.000
  - Overall acceptance rate: 0.500

UBAR Algorithm Properties:
  - Model dimension: 6,603,710
  - Rho parameter: 0.19999999999999996
  - Two-stage approach: Distance filtering + loss evaluation
  - Stage 1 selects: 20% of neighbors
  - Stage 2 uses: Training sample loss comparison
  - Theoretical complexity: O(deg(i)×d + deg(i)×inference)
  - Approach: UBAR paper implementation
