Device: cuda
Seed: 987654321
Loading 36 LEAF FEMNIST train files...
LEAF FEMNIST train: 3597 users, 734463 samples
Loading 36 LEAF FEMNIST test files...
LEAF FEMNIST test: 3597 users, 83388 samples
Found 3597 train users, 3597 test users, 3597 common users
User sample counts range: 525 (max) to 17 (min)
Distributed ALL 3597 users across 20 clients
Users per client: 179 (with 17 clients getting +1 user)
Train partition sizes: [36360, 37070, 35957, 38262, 36024, 37732, 36921, 38328, 36867, 37683, 36507, 36915, 36007, 37001, 35681, 35453, 36585, 36801, 35964, 36345]
Test partition sizes: [4128, 4203, 4081, 4333, 4091, 4287, 4193, 4349, 4191, 4277, 4143, 4193, 4093, 4197, 4052, 4029, 4153, 4183, 4084, 4128]
  Client 0: 36360 train samples, 62 unique classes
  Client 1: 37070 train samples, 62 unique classes
  Client 2: 35957 train samples, 62 unique classes
  Client 3: 38262 train samples, 62 unique classes
  Client 4: 36024 train samples, 62 unique classes
  Client 5: 37732 train samples, 62 unique classes
  Client 6: 36921 train samples, 62 unique classes
  Client 7: 38328 train samples, 62 unique classes
  Client 8: 36867 train samples, 62 unique classes
  Client 9: 37683 train samples, 62 unique classes
  Client 10: 36507 train samples, 62 unique classes
  Client 11: 36915 train samples, 62 unique classes
  Client 12: 36007 train samples, 62 unique classes
  Client 13: 37001 train samples, 62 unique classes
  Client 14: 35681 train samples, 62 unique classes
  Client 15: 35453 train samples, 62 unique classes
  Client 16: 36585 train samples, 62 unique classes
  Client 17: 36801 train samples, 62 unique classes
  Client 18: 35964 train samples, 62 unique classes
  Client 19: 36345 train samples, 62 unique classes
Will sample 10000 samples per client per epoch
Graph: erdos, nodes: 20, edges: 48
Degree statistics: avg=4.80, min=2, max=7
Attack: Compromised 8/20 nodes: [1, 5, 11, 12, 13, 14, 17, 18]
Attack type: backdoor, lambda: 1.0
Backdoor target label: 0, trigger size: 4
Model variant: baseline
Model parameters: 6,603,710
Initial test acc across nodes: mean=0.0162 ± 0.0138
Backdoor attack: Created poisoned datasets for 8 compromised nodes
Round 001: test acc mean=0.0837 ± 0.1661 | min=0.0021 max=0.5727
         : test loss mean=41524.7943 ± 94417.9369
         : individual accs = ['0.542878', '0.572686', '0.024749', '0.024233', '0.052066', '0.052951', '0.003577', '0.039549', '0.017657', '0.009119', '0.009413', '0.018364', '0.002443', '0.002144', '0.025420', '0.012906', '0.004334', '0.011236', '0.005387', '0.243459']
         : correct/total = [(2241, 4128), (2407, 4203), (101, 4081), (105, 4333), (213, 4091), (227, 4287), (15, 4193), (172, 4349), (74, 4191), (39, 4277), (39, 4143), (77, 4193), (10, 4093), (9, 4197), (103, 4052), (52, 4029), (18, 4153), (47, 4183), (22, 4084), (1005, 4128)]
         : compromised: 0.0863, honest: 0.0820
Round 002: test acc mean=0.0507 ± 0.0053 | min=0.0399 max=0.0623
         : test loss mean=nan ± nan
         : individual accs = ['0.048207', '0.048299', '0.045577', '0.039926', '0.052066', '0.052951', '0.051991', '0.044608', '0.051062', '0.042787', '0.051171', '0.051037', '0.062301', '0.049083', '0.055281', '0.061554', '0.050807', '0.051159', '0.054358', '0.049903']
         : correct/total = [(199, 4128), (203, 4203), (186, 4081), (173, 4333), (213, 4091), (227, 4287), (218, 4193), (194, 4349), (214, 4191), (183, 4277), (212, 4143), (214, 4193), (255, 4093), (206, 4197), (224, 4052), (248, 4029), (211, 4153), (214, 4183), (222, 4084), (206, 4128)]
         : compromised: 0.0531, honest: 0.0491
Round 003: test acc mean=0.0485 ± 0.0091 | min=0.0118 max=0.0574
         : test loss mean=nan ± nan
         : individual accs = ['0.049661', '0.047347', '0.011762', '0.049850', '0.051821', '0.052018', '0.053422', '0.044608', '0.051062', '0.042787', '0.053102', '0.051037', '0.047398', '0.049083', '0.053801', '0.051874', '0.047436', '0.051159', '0.054358', '0.057413']
         : correct/total = [(205, 4128), (199, 4203), (48, 4081), (216, 4333), (212, 4091), (223, 4287), (224, 4193), (194, 4349), (214, 4191), (183, 4277), (220, 4143), (214, 4193), (194, 4093), (206, 4197), (218, 4052), (209, 4029), (197, 4153), (214, 4183), (222, 4084), (237, 4128)]
         : compromised: 0.0508, honest: 0.0471
Round 004: test acc mean=0.0510 ± 0.0040 | min=0.0428 max=0.0616
         : test loss mean=nan ± nan
         : individual accs = ['0.049419', '0.052819', '0.049253', '0.048004', '0.052066', '0.052018', '0.051753', '0.046447', '0.051062', '0.042787', '0.051895', '0.054853', '0.047642', '0.046938', '0.050099', '0.061554', '0.049362', '0.051159', '0.054358', '0.057413']
         : correct/total = [(204, 4128), (222, 4203), (201, 4081), (208, 4333), (213, 4091), (223, 4287), (217, 4193), (202, 4349), (214, 4191), (183, 4277), (215, 4143), (230, 4193), (195, 4093), (197, 4197), (203, 4052), (248, 4029), (205, 4153), (214, 4183), (222, 4084), (237, 4128)]
         : compromised: 0.0512, honest: 0.0509
Round 005: test acc mean=0.0509 ± 0.0081 | min=0.0210 max=0.0616
         : test loss mean=nan ± nan
         : individual accs = ['0.047965', '0.058292', '0.061505', '0.049850', '0.052066', '0.052018', '0.051276', '0.052656', '0.051062', '0.048632', '0.051895', '0.020987', '0.052284', '0.046938', '0.050099', '0.061554', '0.045750', '0.051159', '0.054358', '0.057413']
         : correct/total = [(198, 4128), (245, 4203), (251, 4081), (216, 4333), (213, 4091), (223, 4287), (215, 4193), (229, 4349), (214, 4191), (208, 4277), (215, 4143), (88, 4193), (214, 4093), (197, 4197), (203, 4052), (248, 4029), (190, 4153), (214, 4183), (222, 4084), (237, 4128)]
         : compromised: 0.0483, honest: 0.0526
Round 006: test acc mean=0.0491 ± 0.0086 | min=0.0184 max=0.0616
         : test loss mean=nan ± nan
         : individual accs = ['0.049419', '0.048775', '0.018378', '0.049850', '0.052066', '0.052018', '0.053422', '0.052656', '0.051062', '0.048632', '0.034275', '0.051037', '0.047642', '0.049083', '0.050099', '0.061554', '0.047436', '0.052833', '0.054358', '0.057413']
         : correct/total = [(204, 4128), (205, 4203), (75, 4081), (216, 4333), (213, 4091), (223, 4287), (224, 4193), (229, 4349), (214, 4191), (208, 4277), (142, 4143), (214, 4193), (195, 4093), (206, 4197), (203, 4052), (248, 4029), (197, 4153), (221, 4183), (222, 4084), (237, 4128)]
         : compromised: 0.0507, honest: 0.0480
Round 007: test acc mean=0.0504 ± 0.0070 | min=0.0247 max=0.0615
         : test loss mean=nan ± nan
         : individual accs = ['0.047965', '0.047347', '0.061505', '0.048004', '0.051821', '0.052018', '0.051753', '0.052656', '0.051062', '0.050269', '0.050205', '0.054853', '0.048131', '0.046938', '0.024679', '0.051874', '0.047436', '0.057853', '0.054358', '0.057413']
         : correct/total = [(198, 4128), (199, 4203), (251, 4081), (208, 4333), (212, 4091), (223, 4287), (217, 4193), (229, 4349), (214, 4191), (215, 4277), (208, 4143), (230, 4193), (197, 4093), (197, 4197), (100, 4052), (209, 4029), (197, 4153), (242, 4183), (222, 4084), (237, 4128)]
         : compromised: 0.0483, honest: 0.0518
Round 008: test acc mean=0.0515 ± 0.0055 | min=0.0363 max=0.0616
         : test loss mean=nan ± nan
         : individual accs = ['0.047965', '0.052819', '0.061505', '0.048004', '0.052066', '0.052018', '0.036251', '0.052656', '0.051062', '0.050269', '0.051171', '0.051037', '0.047642', '0.046938', '0.050099', '0.061554', '0.047436', '0.057853', '0.054358', '0.057413']
         : correct/total = [(198, 4128), (222, 4203), (251, 4081), (208, 4333), (213, 4091), (223, 4287), (152, 4193), (229, 4349), (214, 4191), (215, 4277), (212, 4143), (214, 4193), (195, 4093), (197, 4197), (203, 4052), (248, 4029), (197, 4153), (242, 4183), (222, 4084), (237, 4128)]
         : compromised: 0.0516, honest: 0.0514
Round 009: test acc mean=0.0472 ± 0.0086 | min=0.0210 max=0.0574
         : test loss mean=nan ± nan
         : individual accs = ['0.049661', '0.039496', '0.049253', '0.048004', '0.051821', '0.052018', '0.051753', '0.052656', '0.051062', '0.048632', '0.051895', '0.020987', '0.052284', '0.046938', '0.031096', '0.051874', '0.047436', '0.035381', '0.054358', '0.057413']
         : correct/total = [(205, 4128), (166, 4203), (201, 4081), (208, 4333), (212, 4091), (223, 4287), (217, 4193), (229, 4349), (214, 4191), (208, 4277), (215, 4143), (88, 4193), (214, 4093), (197, 4197), (126, 4052), (209, 4029), (197, 4153), (148, 4183), (222, 4084), (237, 4128)]
         : compromised: 0.0416, honest: 0.0510
Round 010: test acc mean=0.0509 ± 0.0046 | min=0.0363 max=0.0615
         : test loss mean=nan ± nan
         : individual accs = ['0.049661', '0.052819', '0.061505', '0.048004', '0.051821', '0.051318', '0.036251', '0.052656', '0.051062', '0.050269', '0.050205', '0.051037', '0.052284', '0.046938', '0.050099', '0.051874', '0.047436', '0.051159', '0.054358', '0.057413']
         : correct/total = [(205, 4128), (222, 4203), (251, 4081), (208, 4333), (212, 4091), (220, 4287), (152, 4193), (229, 4349), (214, 4191), (215, 4277), (208, 4143), (214, 4193), (214, 4093), (197, 4197), (203, 4052), (209, 4029), (197, 4153), (214, 4183), (222, 4084), (237, 4128)]
         : compromised: 0.0513, honest: 0.0507

=== FINAL RESULTS ===
Dataset: femnist, Nodes: 20, Graph: erdos, Aggregation: krum
Attack: backdoor, 40.0% compromised
Final accuracy - Compromised: 0.0513, Honest: 0.0507
Overall test accuracy: mean=0.0509 ± 0.0046

=== BACKDOOR ATTACK SUCCESS RATE (ASR) ===
Target label: 0
Trigger size: 4x4
Overall ASR: 0.1500 ± 0.3571
Honest nodes ASR: 0.1667 ± 0.3727
Compromised nodes ASR: 0.1250 ± 0.3307
Note: Higher ASR indicates more successful backdoor attack
