Device: cuda
Seed: 987654321
Loading 36 LEAF FEMNIST train files...
LEAF FEMNIST train: 3597 users, 734463 samples
Loading 36 LEAF FEMNIST test files...
LEAF FEMNIST test: 3597 users, 83388 samples
Found 3597 train users, 3597 test users, 3597 common users
User sample counts range: 525 (max) to 17 (min)
Distributed ALL 3597 users across 20 clients
Users per client: 179 (with 17 clients getting +1 user)
Train partition sizes: [36360, 37070, 35957, 38262, 36024, 37732, 36921, 38328, 36867, 37683, 36507, 36915, 36007, 37001, 35681, 35453, 36585, 36801, 35964, 36345]
Test partition sizes: [4128, 4203, 4081, 4333, 4091, 4287, 4193, 4349, 4191, 4277, 4143, 4193, 4093, 4197, 4052, 4029, 4153, 4183, 4084, 4128]
  Client 0: 36360 train samples, 62 unique classes
  Client 1: 37070 train samples, 62 unique classes
  Client 2: 35957 train samples, 62 unique classes
  Client 3: 38262 train samples, 62 unique classes
  Client 4: 36024 train samples, 62 unique classes
  Client 5: 37732 train samples, 62 unique classes
  Client 6: 36921 train samples, 62 unique classes
  Client 7: 38328 train samples, 62 unique classes
  Client 8: 36867 train samples, 62 unique classes
  Client 9: 37683 train samples, 62 unique classes
  Client 10: 36507 train samples, 62 unique classes
  Client 11: 36915 train samples, 62 unique classes
  Client 12: 36007 train samples, 62 unique classes
  Client 13: 37001 train samples, 62 unique classes
  Client 14: 35681 train samples, 62 unique classes
  Client 15: 35453 train samples, 62 unique classes
  Client 16: 36585 train samples, 62 unique classes
  Client 17: 36801 train samples, 62 unique classes
  Client 18: 35964 train samples, 62 unique classes
  Client 19: 36345 train samples, 62 unique classes
Will sample 10000 samples per client per epoch
Graph: fully, nodes: 20, edges: 190
Degree statistics: avg=19.00, min=19, max=19
Attack: Compromised 4/20 nodes: [5, 12, 13, 17]
Attack type: backdoor, lambda: 1.0
Backdoor target label: 0, trigger size: 4
Model variant: baseline
Model parameters: 6,603,710
Sketchguard Node 0:
  Model dim: 6,603,710 → Sketch size: 1000
  Compression ratio: 6603.7x
  Using model parameters for aggregation, sketches for filtering
Sketchguard Node 1:
  Model dim: 6,603,710 → Sketch size: 1000
  Compression ratio: 6603.7x
  Using model parameters for aggregation, sketches for filtering
Sketchguard Node 2:
  Model dim: 6,603,710 → Sketch size: 1000
  Compression ratio: 6603.7x
  Using model parameters for aggregation, sketches for filtering
Sketchguard Node 3:
  Model dim: 6,603,710 → Sketch size: 1000
  Compression ratio: 6603.7x
  Using model parameters for aggregation, sketches for filtering
Sketchguard Node 4:
  Model dim: 6,603,710 → Sketch size: 1000
  Compression ratio: 6603.7x
  Using model parameters for aggregation, sketches for filtering
Sketchguard Node 5:
  Model dim: 6,603,710 → Sketch size: 1000
  Compression ratio: 6603.7x
  Using model parameters for aggregation, sketches for filtering
Sketchguard Node 6:
  Model dim: 6,603,710 → Sketch size: 1000
  Compression ratio: 6603.7x
  Using model parameters for aggregation, sketches for filtering
Sketchguard Node 7:
  Model dim: 6,603,710 → Sketch size: 1000
  Compression ratio: 6603.7x
  Using model parameters for aggregation, sketches for filtering
Sketchguard Node 8:
  Model dim: 6,603,710 → Sketch size: 1000
  Compression ratio: 6603.7x
  Using model parameters for aggregation, sketches for filtering
Sketchguard Node 9:
  Model dim: 6,603,710 → Sketch size: 1000
  Compression ratio: 6603.7x
  Using model parameters for aggregation, sketches for filtering
Sketchguard Node 10:
  Model dim: 6,603,710 → Sketch size: 1000
  Compression ratio: 6603.7x
  Using model parameters for aggregation, sketches for filtering
Sketchguard Node 11:
  Model dim: 6,603,710 → Sketch size: 1000
  Compression ratio: 6603.7x
  Using model parameters for aggregation, sketches for filtering
Sketchguard Node 12:
  Model dim: 6,603,710 → Sketch size: 1000
  Compression ratio: 6603.7x
  Using model parameters for aggregation, sketches for filtering
Sketchguard Node 13:
  Model dim: 6,603,710 → Sketch size: 1000
  Compression ratio: 6603.7x
  Using model parameters for aggregation, sketches for filtering
Sketchguard Node 14:
  Model dim: 6,603,710 → Sketch size: 1000
  Compression ratio: 6603.7x
  Using model parameters for aggregation, sketches for filtering
Sketchguard Node 15:
  Model dim: 6,603,710 → Sketch size: 1000
  Compression ratio: 6603.7x
  Using model parameters for aggregation, sketches for filtering
Sketchguard Node 16:
  Model dim: 6,603,710 → Sketch size: 1000
  Compression ratio: 6603.7x
  Using model parameters for aggregation, sketches for filtering
Sketchguard Node 17:
  Model dim: 6,603,710 → Sketch size: 1000
  Compression ratio: 6603.7x
  Using model parameters for aggregation, sketches for filtering
Sketchguard Node 18:
  Model dim: 6,603,710 → Sketch size: 1000
  Compression ratio: 6603.7x
  Using model parameters for aggregation, sketches for filtering
Sketchguard Node 19:
  Model dim: 6,603,710 → Sketch size: 1000
  Compression ratio: 6603.7x
  Using model parameters for aggregation, sketches for filtering
Sketchguard ALGORITHM (Sketch-based Filtering + State Aggregation)
  - Model dimension: 6,603,710 parameters
  - Config: SketchguardConfig(gamma=2, kappa=1, alpha=0.5, min_neighbors=1, sketch_size=1000, network_seed=987654321, attack_detection_window=5)
  - Sketch size: 1000
  - Compression ratio: 6603.7x
  - Complexity: O(d + N×k) = O(6,603,710 + 20×1000)
  - Theoretical speedup vs BALANCE: 19.9x
Initial test acc across nodes: mean=0.0168 ± 0.0139
Backdoor attack: Created poisoned datasets for 4 compromised nodes
Round 001: test acc mean=0.4412 ± 0.1661 | min=0.0491 max=0.5647
         : test loss mean=3419.7157 ± 7035.7090
         : individual accs = ['0.564680', '0.520581', '0.564077', '0.529656', '0.530433', '0.213902', '0.518006', '0.511612', '0.522548', '0.460837', '0.542119', '0.529692', '0.054239', '0.049083', '0.531096', '0.535617', '0.478690', '0.155630', '0.512243', '0.500242']
         : correct/total = [(2331, 4128), (2188, 4203), (2302, 4081), (2295, 4333), (2170, 4091), (917, 4287), (2172, 4193), (2225, 4349), (2190, 4191), (1971, 4277), (2246, 4143), (2221, 4193), (222, 4093), (206, 4197), (2152, 4052), (2158, 4029), (1988, 4153), (651, 4183), (2092, 4084), (2065, 4128)]
         : compromised: 0.1182, honest: 0.5220
         : sketchguard stats = ['Node 0: acc_rate=0.789', 'Node 1: acc_rate=0.789', 'Node 2: acc_rate=0.789']...
Round 002: test acc mean=0.5561 ± 0.2539 | min=0.0483 max=0.7067
         : test loss mean=nan ± nan
         : individual accs = ['0.694525', '0.674756', '0.689537', '0.697438', '0.699096', '0.048519', '0.663964', '0.686825', '0.663326', '0.672668', '0.706734', '0.673265', '0.049597', '0.049083', '0.696199', '0.663440', '0.680954', '0.048291', '0.689765', '0.674419']
         : correct/total = [(2867, 4128), (2836, 4203), (2814, 4081), (3022, 4333), (2860, 4091), (208, 4287), (2784, 4193), (2987, 4349), (2780, 4191), (2877, 4277), (2928, 4143), (2823, 4193), (203, 4093), (206, 4197), (2821, 4052), (2673, 4029), (2828, 4153), (202, 4183), (2817, 4084), (2784, 4128)]
         : compromised: 0.0489, honest: 0.6829
         : sketchguard stats = ['Node 0: acc_rate=0.789', 'Node 1: acc_rate=0.789', 'Node 2: acc_rate=0.789']...
Round 003: test acc mean=0.5787 ± 0.2650 | min=0.0453 max=0.7349
         : test loss mean=nan ± nan
         : individual accs = ['0.718508', '0.698073', '0.699093', '0.714286', '0.731850', '0.045253', '0.705461', '0.734882', '0.703651', '0.726911', '0.730389', '0.673026', '0.054239', '0.049083', '0.712734', '0.702656', '0.682157', '0.049486', '0.726004', '0.716328']
         : correct/total = [(2966, 4128), (2934, 4203), (2853, 4081), (3095, 4333), (2994, 4091), (194, 4287), (2958, 4193), (3196, 4349), (2949, 4191), (3109, 4277), (3026, 4143), (2822, 4193), (222, 4093), (206, 4197), (2888, 4052), (2831, 4029), (2833, 4153), (207, 4183), (2965, 4084), (2957, 4128)]
         : compromised: 0.0495, honest: 0.7110
         : sketchguard stats = ['Node 0: acc_rate=0.789', 'Node 1: acc_rate=0.789', 'Node 2: acc_rate=0.789']...
Round 004: test acc mean=0.5660 ± 0.2588 | min=0.0453 max=0.7260
         : test loss mean=nan ± nan
         : individual accs = ['0.687016', '0.718296', '0.679735', '0.696515', '0.720117', '0.045253', '0.691152', '0.709588', '0.707707', '0.657470', '0.671253', '0.704746', '0.054239', '0.049083', '0.705824', '0.685034', '0.725981', '0.049486', '0.698335', '0.663275']
         : correct/total = [(2836, 4128), (3019, 4203), (2774, 4081), (3018, 4333), (2946, 4091), (194, 4287), (2898, 4193), (3086, 4349), (2966, 4191), (2812, 4277), (2781, 4143), (2955, 4193), (222, 4093), (206, 4197), (2860, 4052), (2760, 4029), (3015, 4153), (207, 4183), (2852, 4084), (2738, 4128)]
         : compromised: 0.0495, honest: 0.6951
         : sketchguard stats = ['Node 0: acc_rate=0.789', 'Node 1: acc_rate=0.789', 'Node 2: acc_rate=0.789']...
Round 005: test acc mean=0.5378 ± 0.2452 | min=0.0453 max=0.7038
         : test loss mean=nan ± nan
         : individual accs = ['0.649952', '0.665953', '0.632933', '0.630510', '0.697385', '0.045253', '0.657286', '0.703840', '0.644476', '0.678513', '0.647840', '0.667064', '0.054239', '0.049083', '0.667572', '0.610822', '0.680954', '0.049486', '0.689030', '0.633963']
         : correct/total = [(2683, 4128), (2799, 4203), (2583, 4081), (2732, 4333), (2853, 4091), (194, 4287), (2756, 4193), (3061, 4349), (2701, 4191), (2902, 4277), (2684, 4143), (2797, 4193), (222, 4093), (206, 4197), (2705, 4052), (2461, 4029), (2828, 4153), (207, 4183), (2814, 4084), (2617, 4128)]
         : compromised: 0.0495, honest: 0.6599
         : sketchguard stats = ['Node 0: acc_rate=0.789', 'Node 1: acc_rate=0.789', 'Node 2: acc_rate=0.789']...
Round 006: test acc mean=0.5920 ± 0.2718 | min=0.0453 max=0.7546
         : test loss mean=nan ± nan
         : individual accs = ['0.715359', '0.742089', '0.712325', '0.698823', '0.754583', '0.045253', '0.737181', '0.719246', '0.723694', '0.696984', '0.724596', '0.753399', '0.054239', '0.049083', '0.753702', '0.708861', '0.746448', '0.049486', '0.737023', '0.717539']
         : correct/total = [(2953, 4128), (3119, 4203), (2907, 4081), (3028, 4333), (3087, 4091), (194, 4287), (3091, 4193), (3128, 4349), (3033, 4191), (2981, 4277), (3002, 4143), (3159, 4193), (222, 4093), (206, 4197), (3054, 4052), (2856, 4029), (3100, 4153), (207, 4183), (3010, 4084), (2962, 4128)]
         : compromised: 0.0495, honest: 0.7276
         : sketchguard stats = ['Node 0: acc_rate=0.789', 'Node 1: acc_rate=0.789', 'Node 2: acc_rate=0.789']...
Round 007: test acc mean=0.6457 ± 0.2983 | min=0.0453 max=0.8162
         : test loss mean=nan ± nan
         : individual accs = ['0.802326', '0.799191', '0.789267', '0.787676', '0.816182', '0.045253', '0.793227', '0.809152', '0.793367', '0.798223', '0.774077', '0.787264', '0.054239', '0.049083', '0.797137', '0.770166', '0.805442', '0.049486', '0.803379', '0.790213']
         : correct/total = [(3312, 4128), (3359, 4203), (3221, 4081), (3413, 4333), (3339, 4091), (194, 4287), (3326, 4193), (3519, 4349), (3325, 4191), (3414, 4277), (3207, 4143), (3301, 4193), (222, 4093), (206, 4197), (3230, 4052), (3103, 4029), (3345, 4153), (207, 4183), (3281, 4084), (3262, 4128)]
         : compromised: 0.0495, honest: 0.7948
         : sketchguard stats = ['Node 0: acc_rate=0.789', 'Node 1: acc_rate=0.789', 'Node 2: acc_rate=0.789']...
Round 008: test acc mean=0.6702 ± 0.3104 | min=0.0453 max=0.8363
         : test loss mean=nan ± nan
         : individual accs = ['0.827277', '0.832976', '0.830189', '0.829679', '0.833781', '0.045253', '0.817315', '0.836284', '0.821284', '0.833762', '0.815593', '0.823038', '0.054239', '0.049083', '0.814413', '0.810375', '0.826872', '0.049486', '0.832027', '0.820979']
         : correct/total = [(3415, 4128), (3501, 4203), (3388, 4081), (3595, 4333), (3411, 4091), (194, 4287), (3427, 4193), (3637, 4349), (3442, 4191), (3566, 4277), (3379, 4143), (3451, 4193), (222, 4093), (206, 4197), (3300, 4052), (3265, 4029), (3434, 4153), (207, 4183), (3398, 4084), (3389, 4128)]
         : compromised: 0.0495, honest: 0.8254
         : sketchguard stats = ['Node 0: acc_rate=0.789', 'Node 1: acc_rate=0.789', 'Node 2: acc_rate=0.789']...
Round 009: test acc mean=0.6778 ± 0.3142 | min=0.0453 max=0.8485
         : test loss mean=nan ± nan
         : individual accs = ['0.826793', '0.841066', '0.847831', '0.836372', '0.842826', '0.045253', '0.829716', '0.848471', '0.828919', '0.844283', '0.827902', '0.826616', '0.054239', '0.049083', '0.828480', '0.823778', '0.839152', '0.049486', '0.837904', '0.828731']
         : correct/total = [(3413, 4128), (3535, 4203), (3460, 4081), (3624, 4333), (3448, 4091), (194, 4287), (3479, 4193), (3690, 4349), (3474, 4191), (3611, 4277), (3430, 4143), (3466, 4193), (222, 4093), (206, 4197), (3357, 4052), (3319, 4029), (3485, 4153), (207, 4183), (3422, 4084), (3421, 4128)]
         : compromised: 0.0495, honest: 0.8349
         : sketchguard stats = ['Node 0: acc_rate=0.789', 'Node 1: acc_rate=0.789', 'Node 2: acc_rate=0.789']...
Round 010: test acc mean=0.6822 ± 0.3164 | min=0.0453 max=0.8516
         : test loss mean=nan ± nan
         : individual accs = ['0.838905', '0.843683', '0.844156', '0.841219', '0.851626', '0.045253', '0.836155', '0.850080', '0.840372', '0.849427', '0.833454', '0.827808', '0.054239', '0.049083', '0.833416', '0.833706', '0.844450', '0.049486', '0.848188', '0.828488']
         : correct/total = [(3463, 4128), (3546, 4203), (3445, 4081), (3645, 4333), (3484, 4091), (194, 4287), (3506, 4193), (3697, 4349), (3522, 4191), (3633, 4277), (3453, 4143), (3471, 4193), (222, 4093), (206, 4197), (3377, 4052), (3359, 4029), (3507, 4153), (207, 4183), (3464, 4084), (3420, 4128)]
         : compromised: 0.0495, honest: 0.8403
         : sketchguard stats = ['Node 0: acc_rate=0.789', 'Node 1: acc_rate=0.789', 'Node 2: acc_rate=0.789']...

=== FINAL RESULTS ===
Dataset: femnist, Nodes: 20, Graph: fully, Aggregation: sketchguard
Attack: backdoor, 20.0% compromised
Final accuracy - Compromised: 0.0495, Honest: 0.8403
Overall test accuracy: mean=0.6822 ± 0.3164

=== BACKDOOR ATTACK SUCCESS RATE (ASR) ===
Target label: 0
Trigger size: 4x4
Overall ASR: 0.2421 ± 0.3790
Honest nodes ASR: 0.0526 ± 0.0050
Compromised nodes ASR: 1.0000 ± 0.0000
Note: Higher ASR indicates more successful backdoor attack

=== Sketchguard SUMMARY ===
Node 0: acceptance=0.789
Node 1: acceptance=0.789
Node 2: acceptance=0.789
Node 3: acceptance=0.789
Node 4: acceptance=0.789
Node 5: acceptance=0.184
Node 6: acceptance=0.789
Node 7: acceptance=0.789
Node 8: acceptance=0.789
Node 9: acceptance=0.789
Node 10: acceptance=0.789
Node 11: acceptance=0.789
Node 12: acceptance=0.184
Node 13: acceptance=0.084
Node 14: acceptance=0.789
Node 15: acceptance=0.789
Node 16: acceptance=0.789
Node 17: acceptance=0.184
Node 18: acceptance=0.789
Node 19: acceptance=0.789

=== PARALLEL EXECUTION TIME (realistic for distributed system) ===
  COMMUNICATION (max across nodes):
    - Sketch transfer: 0.000s (0.0%)
    - Model fetch (accepted): 0.000s (0.0%)
  COMPUTATION (max across nodes):
    - Sketching: 5.654s (99.3%)
    - Filtering: 0.004s (0.1%)
    - Aggregation: 0.036s (0.6%)
  TOTALS:
    - Total computation: 5.694s (100.0%)
    - Total communication: 0.000s (0.0%)
    - Total parallel time: 5.694s

=== PER-NODE AVERAGE TIME ===
  - Sketching: 4.923s
  - Filtering: 0.002s
  - Aggregation: 0.022s
  - Sketch transfer: 0.000s
  - Model fetch: 0.000s
  - Total per node: 4.947s

=== TOTAL COMPUTATIONAL WORK (sum across all nodes) ===
  - Total sketching: 98.468s
  - Total filtering: 0.032s
  - Total aggregation: 0.442s
  - Total sketch transfer: 0.000s
  - Total model fetch: 0.000s
  - Grand total: 98.943s
  - Mean acceptance rate: 0.663

Sketchguard Algorithm Properties:
  - Original dimension: 6,603,710
  - Sketch size: 1000
  - Compression ratio: 19.9x
  - Single repetition: No repetitions needed
  - Theoretical complexity: O(d + N×k)
  - Approach: Sketch filtering + state aggregation
