Device: cuda
Seed: 987654321
Loading 36 LEAF FEMNIST train files...
LEAF FEMNIST train: 3597 users, 734463 samples
Loading 36 LEAF FEMNIST test files...
LEAF FEMNIST test: 3597 users, 83388 samples
Found 3597 train users, 3597 test users, 3597 common users
User sample counts range: 525 (max) to 17 (min)
Distributed ALL 3597 users across 20 clients
Users per client: 179 (with 17 clients getting +1 user)
Train partition sizes: [36360, 37070, 35957, 38262, 36024, 37732, 36921, 38328, 36867, 37683, 36507, 36915, 36007, 37001, 35681, 35453, 36585, 36801, 35964, 36345]
Test partition sizes: [4128, 4203, 4081, 4333, 4091, 4287, 4193, 4349, 4191, 4277, 4143, 4193, 4093, 4197, 4052, 4029, 4153, 4183, 4084, 4128]
  Client 0: 36360 train samples, 62 unique classes
  Client 1: 37070 train samples, 62 unique classes
  Client 2: 35957 train samples, 62 unique classes
  Client 3: 38262 train samples, 62 unique classes
  Client 4: 36024 train samples, 62 unique classes
  Client 5: 37732 train samples, 62 unique classes
  Client 6: 36921 train samples, 62 unique classes
  Client 7: 38328 train samples, 62 unique classes
  Client 8: 36867 train samples, 62 unique classes
  Client 9: 37683 train samples, 62 unique classes
  Client 10: 36507 train samples, 62 unique classes
  Client 11: 36915 train samples, 62 unique classes
  Client 12: 36007 train samples, 62 unique classes
  Client 13: 37001 train samples, 62 unique classes
  Client 14: 35681 train samples, 62 unique classes
  Client 15: 35453 train samples, 62 unique classes
  Client 16: 36585 train samples, 62 unique classes
  Client 17: 36801 train samples, 62 unique classes
  Client 18: 35964 train samples, 62 unique classes
  Client 19: 36345 train samples, 62 unique classes
Will sample 4500 samples per client per epoch
Graph: ring, nodes: 20, edges: 20
Degree statistics: avg=2.00, min=2, max=2
Attack: Compromised 2/20 nodes: [5, 13]
Attack type: backdoor, lambda: 1.0
Backdoor target label: 0, trigger size: 4
Model variant: baseline
Model parameters: 6,603,710
UBAR ALGORITHM (Two-Stage Byzantine-resilient)
  - Model dimension: 6,603,710 parameters
  - Rho parameter: 0.9
  - Stage 1: Distance-based filtering (select 90% closest neighbors)
  - Stage 2: Performance-based selection (loss comparison)
  - Complexity: O(deg(i)×d + deg(i)×inference)
Initial test acc across nodes: mean=0.0168 ± 0.0139
Backdoor attack: Created poisoned datasets for 2 compromised nodes
Round 001: test acc mean=0.0511 ± 0.0050 | min=0.0430 max=0.0608
         : test loss mean=3074.4616 ± 9218.2735
         : individual accs = ['0.059593', '0.051630', '0.050723', '0.047773', '0.043021', '0.045253', '0.044598', '0.049207', '0.047960', '0.050503', '0.049722', '0.060816', '0.054239', '0.049083', '0.056762', '0.051874', '0.058271', '0.050920', '0.055583', '0.044816']
         : correct/total = [(246, 4128), (217, 4203), (207, 4081), (207, 4333), (176, 4091), (194, 4287), (187, 4193), (214, 4349), (201, 4191), (216, 4277), (206, 4143), (255, 4193), (222, 4093), (206, 4197), (230, 4052), (209, 4029), (242, 4153), (213, 4183), (227, 4084), (185, 4128)]
         : compromised: 0.0472, honest: 0.0516
         : ubar stats = ['Node 0: s1=0.500, s2=1.000', 'Node 1: s1=0.500, s2=1.000', 'Node 2: s1=0.500, s2=1.000']...
Round 002: test acc mean=0.0546 ± 0.0128 | min=0.0434 max=0.0933
         : test loss mean=1160.1918 ± 3545.1238
         : individual accs = ['0.051599', '0.051630', '0.050723', '0.052850', '0.057932', '0.044787', '0.057000', '0.058174', '0.051062', '0.044891', '0.045619', '0.046983', '0.049597', '0.043364', '0.088105', '0.093323', '0.058271', '0.048291', '0.050196', '0.048450']
         : correct/total = [(213, 4128), (217, 4203), (207, 4081), (229, 4333), (237, 4091), (192, 4287), (239, 4193), (253, 4349), (214, 4191), (192, 4277), (189, 4143), (197, 4193), (203, 4093), (182, 4197), (357, 4052), (376, 4029), (242, 4153), (202, 4183), (205, 4084), (200, 4128)]
         : compromised: 0.0441, honest: 0.0558
         : ubar stats = ['Node 0: s1=0.500, s2=1.000', 'Node 1: s1=0.500, s2=1.000', 'Node 2: s1=0.500, s2=1.000']...
Round 003: test acc mean=0.0544 ± 0.0104 | min=0.0446 max=0.0925
         : test loss mean=203116711858.1905 ± 885365201580.9362
         : individual accs = ['0.049661', '0.051630', '0.050723', '0.052850', '0.057932', '0.045253', '0.044598', '0.049207', '0.051539', '0.047463', '0.055274', '0.053184', '0.058637', '0.049083', '0.048124', '0.056342', '0.092463', '0.050203', '0.052889', '0.071221']
         : correct/total = [(205, 4128), (217, 4203), (207, 4081), (229, 4333), (237, 4091), (194, 4287), (187, 4193), (214, 4349), (216, 4191), (203, 4277), (229, 4143), (223, 4193), (240, 4093), (206, 4197), (195, 4052), (227, 4029), (384, 4153), (210, 4183), (216, 4084), (294, 4128)]
         : compromised: 0.0472, honest: 0.0552
         : ubar stats = ['Node 0: s1=0.500, s2=1.000', 'Node 1: s1=0.500, s2=1.000', 'Node 2: s1=0.500, s2=1.000']...
Round 004: test acc mean=0.0622 ± 0.0199 | min=0.0369 max=0.1139
         : test loss mean=240398732740595264.0000 ± 1047873782170893696.0000
         : individual accs = ['0.059593', '0.062574', '0.073756', '0.052850', '0.057932', '0.036856', '0.082518', '0.086917', '0.049630', '0.043488', '0.045619', '0.046983', '0.054239', '0.047177', '0.061204', '0.056590', '0.058271', '0.104710', '0.113859', '0.048450']
         : correct/total = [(246, 4128), (263, 4203), (301, 4081), (229, 4333), (237, 4091), (158, 4287), (346, 4193), (378, 4349), (208, 4191), (186, 4277), (189, 4143), (197, 4193), (222, 4093), (198, 4197), (248, 4052), (228, 4029), (242, 4153), (438, 4183), (465, 4084), (200, 4128)]
         : compromised: 0.0420, honest: 0.0644
         : ubar stats = ['Node 0: s1=0.500, s2=1.000', 'Node 1: s1=0.500, s2=1.000', 'Node 2: s1=0.500, s2=1.000']...
Round 005: test acc mean=0.0608 ± 0.0169 | min=0.0453 max=0.1083
         : test loss mean=nan ± nan
         : individual accs = ['0.059593', '0.052344', '0.057584', '0.053773', '0.059154', '0.045253', '0.046745', '0.047827', '0.100931', '0.108253', '0.080618', '0.076079', '0.053750', '0.047177', '0.051579', '0.054852', '0.058271', '0.050920', '0.055583', '0.055717']
         : correct/total = [(246, 4128), (220, 4203), (235, 4081), (233, 4333), (242, 4091), (194, 4287), (196, 4193), (208, 4349), (423, 4191), (463, 4277), (334, 4143), (319, 4193), (220, 4093), (198, 4197), (209, 4052), (221, 4029), (242, 4153), (213, 4183), (227, 4084), (230, 4128)]
         : compromised: 0.0462, honest: 0.0624
         : ubar stats = ['Node 0: s1=0.500, s2=1.000', 'Node 1: s1=0.500, s2=1.000', 'Node 2: s1=0.500, s2=1.000']...
Round 006: test acc mean=0.0601 ± 0.0170 | min=0.0439 max=0.1078
         : test loss mean=nan ± nan
         : individual accs = ['0.085271', '0.052344', '0.057584', '0.052850', '0.057932', '0.045253', '0.043883', '0.053346', '0.053448', '0.053776', '0.050447', '0.061770', '0.053750', '0.049083', '0.107848', '0.102259', '0.058271', '0.051159', '0.057052', '0.055475']
         : correct/total = [(352, 4128), (220, 4203), (235, 4081), (229, 4333), (237, 4091), (194, 4287), (184, 4193), (232, 4349), (224, 4191), (230, 4277), (209, 4143), (259, 4193), (220, 4093), (206, 4197), (437, 4052), (412, 4029), (242, 4153), (214, 4183), (233, 4084), (229, 4128)]
         : compromised: 0.0472, honest: 0.0616
         : ubar stats = ['Node 0: s1=0.500, s2=1.000', 'Node 1: s1=0.500, s2=1.000', 'Node 2: s1=0.500, s2=1.000']...
Round 007: test acc mean=0.0572 ± 0.0132 | min=0.0448 max=0.0975
         : test loss mean=nan ± nan
         : individual accs = ['0.059593', '0.052344', '0.057584', '0.044773', '0.047421', '0.045253', '0.097544', '0.092205', '0.053686', '0.053776', '0.055998', '0.053899', '0.058637', '0.049083', '0.051826', '0.051626', '0.058271', '0.051877', '0.057297', '0.050872']
         : correct/total = [(246, 4128), (220, 4203), (235, 4081), (194, 4333), (194, 4091), (194, 4287), (409, 4193), (401, 4349), (225, 4191), (230, 4277), (232, 4143), (226, 4193), (240, 4093), (206, 4197), (210, 4052), (208, 4029), (242, 4153), (217, 4183), (234, 4084), (210, 4128)]
         : compromised: 0.0472, honest: 0.0583
         : ubar stats = ['Node 0: s1=0.500, s2=1.000', 'Node 1: s1=0.500, s2=1.000', 'Node 2: s1=0.500, s2=1.000']...
Round 008: test acc mean=0.0679 ± 0.0189 | min=0.0453 max=0.1049
         : test loss mean=nan ± nan
         : individual accs = ['0.104893', '0.068998', '0.071551', '0.082391', '0.086287', '0.045253', '0.049130', '0.051276', '0.090670', '0.096797', '0.057929', '0.055569', '0.104080', '0.049083', '0.061945', '0.056590', '0.062605', '0.050920', '0.055583', '0.055717']
         : correct/total = [(433, 4128), (290, 4203), (292, 4081), (357, 4333), (353, 4091), (194, 4287), (206, 4193), (223, 4349), (380, 4191), (414, 4277), (240, 4143), (233, 4193), (426, 4093), (206, 4197), (251, 4052), (228, 4029), (260, 4153), (213, 4183), (227, 4084), (230, 4128)]
         : compromised: 0.0472, honest: 0.0702
         : ubar stats = ['Node 0: s1=0.500, s2=1.000', 'Node 1: s1=0.500, s2=1.000', 'Node 2: s1=0.500, s2=1.000']...
Round 009: test acc mean=0.0745 ± 0.0289 | min=0.0453 max=0.1551
         : test loss mean=nan ± nan
         : individual accs = ['0.049661', '0.142993', '0.155109', '0.053543', '0.058176', '0.045253', '0.070832', '0.059784', '0.085660', '0.096563', '0.071929', '0.065824', '0.058881', '0.049083', '0.051826', '0.050633', '0.091982', '0.075305', '0.085945', '0.071948']
         : correct/total = [(205, 4128), (601, 4203), (633, 4081), (232, 4333), (238, 4091), (194, 4287), (297, 4193), (260, 4349), (359, 4191), (413, 4277), (298, 4143), (276, 4193), (241, 4093), (206, 4197), (210, 4052), (204, 4029), (382, 4153), (315, 4183), (351, 4084), (297, 4128)]
         : compromised: 0.0472, honest: 0.0776
         : ubar stats = ['Node 0: s1=0.500, s2=1.000', 'Node 1: s1=0.500, s2=1.000', 'Node 2: s1=0.500, s2=1.000']...
Round 010: test acc mean=0.0718 ± 0.0210 | min=0.0453 max=0.1161
         : test loss mean=nan ± nan
         : individual accs = ['0.079457', '0.070902', '0.086988', '0.052850', '0.057932', '0.045253', '0.055092', '0.058634', '0.054402', '0.054244', '0.087376', '0.086573', '0.045932', '0.049083', '0.073791', '0.063291', '0.116061', '0.099211', '0.109941', '0.088663']
         : correct/total = [(328, 4128), (298, 4203), (355, 4081), (229, 4333), (237, 4091), (194, 4287), (231, 4193), (255, 4349), (228, 4191), (232, 4277), (362, 4143), (363, 4193), (188, 4093), (206, 4197), (299, 4052), (255, 4029), (482, 4153), (415, 4183), (449, 4084), (366, 4128)]
         : compromised: 0.0472, honest: 0.0745
         : ubar stats = ['Node 0: s1=0.500, s2=1.000', 'Node 1: s1=0.500, s2=1.000', 'Node 2: s1=0.500, s2=1.000']...

=== FINAL RESULTS ===
Dataset: femnist, Nodes: 20, Graph: ring, Aggregation: ubar
Attack: backdoor, 10.0% compromised
Final accuracy - Compromised: 0.0472, Honest: 0.0745
Overall test accuracy: mean=0.0718 ± 0.0210

=== BACKDOOR ATTACK SUCCESS RATE (ASR) ===
Target label: 0
Trigger size: 4x4
Overall ASR: 0.1007 ± 0.2998
Honest nodes ASR: 0.0008 ± 0.0032
Compromised nodes ASR: 1.0000 ± 0.0000
Note: Higher ASR indicates more successful backdoor attack

=== UBAR SUMMARY ===
Node 0: stage1=0.500, stage2=1.000, overall=0.500
Node 1: stage1=0.500, stage2=1.000, overall=0.500
Node 2: stage1=0.500, stage2=1.000, overall=0.500
Node 3: stage1=0.500, stage2=1.000, overall=0.500
Node 4: stage1=0.500, stage2=1.000, overall=0.500
Node 5: stage1=0.500, stage2=1.000, overall=0.500
Node 6: stage1=0.500, stage2=1.000, overall=0.500
Node 7: stage1=0.500, stage2=1.000, overall=0.500
Node 8: stage1=0.500, stage2=1.000, overall=0.500
Node 9: stage1=0.500, stage2=1.000, overall=0.500
Node 10: stage1=0.500, stage2=1.000, overall=0.500
Node 11: stage1=0.500, stage2=1.000, overall=0.500
Node 12: stage1=0.500, stage2=1.000, overall=0.500
Node 13: stage1=0.500, stage2=1.000, overall=0.500
Node 14: stage1=0.500, stage2=1.000, overall=0.500
Node 15: stage1=0.500, stage2=1.000, overall=0.500
Node 16: stage1=0.500, stage2=1.000, overall=0.500
Node 17: stage1=0.500, stage2=1.000, overall=0.500
Node 18: stage1=0.500, stage2=1.000, overall=0.500
Node 19: stage1=0.500, stage2=1.000, overall=0.500

=== PARALLEL EXECUTION TIME (realistic for distributed system) ===
  COMMUNICATION (max across nodes):
    - Full model transfer: 0.000s (0.0%)
  COMPUTATION (max across nodes):
    - Distance computation: 0.018s (0.4%)
    - Loss computation: 4.129s (99.2%)
    - Aggregation: 0.015s (0.4%)
  TOTALS:
    - Total computation: 4.162s (100.0%)
    - Total communication: 0.000s (0.0%)
    - Total parallel time: 4.162s

=== PER-NODE AVERAGE TIME ===
  - Distance computation: 0.011s
  - Loss computation: 3.878s
  - Aggregation: 0.006s
  - Model transfer: 0.000s
  - Total per node: 3.894s

=== TOTAL COMPUTATIONAL WORK (sum across all nodes) ===
  - Total distance computation: 0.212s
  - Total loss computation: 77.558s
  - Total aggregation: 0.119s
  - Total model transfer: 0.000s
  - Grand total: 77.890s
  - Mean Stage 1 acceptance rate: 0.500
  - Mean Stage 2 acceptance rate: 1.000
  - Overall acceptance rate: 0.500

UBAR Algorithm Properties:
  - Model dimension: 6,603,710
  - Rho parameter: 0.9
  - Two-stage approach: Distance filtering + loss evaluation
  - Stage 1 selects: 90% of neighbors
  - Stage 2 uses: Training sample loss comparison
  - Theoretical complexity: O(deg(i)×d + deg(i)×inference)
  - Approach: UBAR paper implementation
