Device: cuda
Seed: 987654321
Loading 36 LEAF FEMNIST train files...
LEAF FEMNIST train: 3597 users, 734463 samples
Loading 36 LEAF FEMNIST test files...
LEAF FEMNIST test: 3597 users, 83388 samples
Found 3597 train users, 3597 test users, 3597 common users
User sample counts range: 525 (max) to 17 (min)
Distributed ALL 3597 users across 20 clients
Users per client: 179 (with 17 clients getting +1 user)
Train partition sizes: [36360, 37070, 35957, 38262, 36024, 37732, 36921, 38328, 36867, 37683, 36507, 36915, 36007, 37001, 35681, 35453, 36585, 36801, 35964, 36345]
Test partition sizes: [4128, 4203, 4081, 4333, 4091, 4287, 4193, 4349, 4191, 4277, 4143, 4193, 4093, 4197, 4052, 4029, 4153, 4183, 4084, 4128]
  Client 0: 36360 train samples, 62 unique classes
  Client 1: 37070 train samples, 62 unique classes
  Client 2: 35957 train samples, 62 unique classes
  Client 3: 38262 train samples, 62 unique classes
  Client 4: 36024 train samples, 62 unique classes
  Client 5: 37732 train samples, 62 unique classes
  Client 6: 36921 train samples, 62 unique classes
  Client 7: 38328 train samples, 62 unique classes
  Client 8: 36867 train samples, 62 unique classes
  Client 9: 37683 train samples, 62 unique classes
  Client 10: 36507 train samples, 62 unique classes
  Client 11: 36915 train samples, 62 unique classes
  Client 12: 36007 train samples, 62 unique classes
  Client 13: 37001 train samples, 62 unique classes
  Client 14: 35681 train samples, 62 unique classes
  Client 15: 35453 train samples, 62 unique classes
  Client 16: 36585 train samples, 62 unique classes
  Client 17: 36801 train samples, 62 unique classes
  Client 18: 35964 train samples, 62 unique classes
  Client 19: 36345 train samples, 62 unique classes
Will sample 4500 samples per client per epoch
Graph: erdos, nodes: 20, edges: 48
Degree statistics: avg=4.80, min=2, max=7
Attack: Compromised 10/20 nodes: [1, 2, 5, 11, 12, 13, 14, 15, 17, 18]
Attack type: krum, lambda: 1.0
Model variant: baseline
Model parameters: 6,603,710
UBAR ALGORITHM (Two-Stage Byzantine-resilient)
  - Model dimension: 6,603,710 parameters
  - Rho parameter: 0.5
  - Stage 1: Distance-based filtering (select 50% closest neighbors)
  - Stage 2: Performance-based selection (loss comparison)
  - Complexity: O(deg(i)×d + deg(i)×inference)
Initial test acc across nodes: mean=0.0168 ± 0.0139
Round 001: test acc mean=0.0530 ± 0.0040 | min=0.0434 max=0.0596
         : test loss mean=3.9893 ± 0.0302
         : individual accs = ['0.059593', '0.052344', '0.057584', '0.043388', '0.058910', '0.052484', '0.057000', '0.051276', '0.053209', '0.047463', '0.050447', '0.053899', '0.050818', '0.055278', '0.048124', '0.050633', '0.058271', '0.050920', '0.052889', '0.054506']
         : correct/total = [(246, 4128), (220, 4203), (235, 4081), (188, 4333), (241, 4091), (225, 4287), (239, 4193), (223, 4349), (223, 4191), (203, 4277), (209, 4143), (226, 4193), (208, 4093), (232, 4197), (195, 4052), (204, 4029), (242, 4153), (213, 4183), (216, 4084), (225, 4128)]
         : compromised: 0.0525, honest: 0.0534
         : ubar stats = ['Node 0: s1=0.500, s2=0.667', 'Node 1: s1=0.500, s2=0.333', 'Node 2: s1=0.400, s2=0.500']...
Round 002: test acc mean=0.0517 ± 0.0039 | min=0.0439 max=0.0582
         : test loss mean=3.8049 ± 0.0819
         : individual accs = ['0.044574', '0.051630', '0.055134', '0.052850', '0.057932', '0.050618', '0.043883', '0.058174', '0.053209', '0.050503', '0.055274', '0.046983', '0.054239', '0.046938', '0.051579', '0.053860', '0.049362', '0.050920', '0.055583', '0.050388']
         : correct/total = [(184, 4128), (217, 4203), (225, 4081), (229, 4333), (237, 4091), (217, 4287), (184, 4193), (253, 4349), (223, 4191), (216, 4277), (229, 4143), (197, 4193), (222, 4093), (197, 4197), (209, 4052), (217, 4029), (205, 4153), (213, 4183), (227, 4084), (208, 4128)]
         : compromised: 0.0517, honest: 0.0516
         : ubar stats = ['Node 0: s1=0.500, s2=0.667', 'Node 1: s1=0.500, s2=0.667', 'Node 2: s1=0.400, s2=0.750']...
Round 003: test acc mean=0.0600 ± 0.0148 | min=0.0467 max=0.0948
         : test loss mean=3.7136 ± 0.0398
         : individual accs = ['0.059593', '0.049726', '0.057584', '0.048234', '0.094842', '0.048052', '0.046745', '0.093585', '0.053209', '0.093523', '0.055274', '0.053184', '0.058637', '0.055278', '0.061204', '0.056342', '0.058271', '0.050203', '0.055583', '0.050388']
         : correct/total = [(246, 4128), (209, 4203), (235, 4081), (209, 4333), (388, 4091), (206, 4287), (196, 4193), (407, 4349), (223, 4191), (400, 4277), (229, 4143), (223, 4193), (240, 4093), (232, 4197), (248, 4052), (227, 4029), (242, 4153), (210, 4183), (227, 4084), (208, 4128)]
         : compromised: 0.0546, honest: 0.0654
         : ubar stats = ['Node 0: s1=0.500, s2=0.778', 'Node 1: s1=0.500, s2=0.556', 'Node 2: s1=0.400, s2=0.667']...
Round 004: test acc mean=0.0546 ± 0.0049 | min=0.0451 max=0.0624
         : test loss mean=3.7129 ± 0.0514
         : individual accs = ['0.059593', '0.052344', '0.057584', '0.053081', '0.058421', '0.061115', '0.057238', '0.049207', '0.053209', '0.053075', '0.045619', '0.049606', '0.054239', '0.062426', '0.061204', '0.056590', '0.058271', '0.050920', '0.052889', '0.045058']
         : correct/total = [(246, 4128), (220, 4203), (235, 4081), (230, 4333), (239, 4091), (262, 4287), (240, 4193), (214, 4349), (223, 4191), (227, 4277), (189, 4143), (208, 4193), (222, 4093), (262, 4197), (248, 4052), (228, 4029), (242, 4153), (213, 4183), (216, 4084), (186, 4128)]
         : compromised: 0.0559, honest: 0.0533
         : ubar stats = ['Node 0: s1=0.500, s2=0.667', 'Node 1: s1=0.500, s2=0.500', 'Node 2: s1=0.400, s2=0.750']...
Round 005: test acc mean=0.0538 ± 0.0105 | min=0.0420 max=0.0940
         : test loss mean=3.6873 ± 0.0146
         : individual accs = ['0.059593', '0.052344', '0.057584', '0.052850', '0.045710', '0.043387', '0.093966', '0.047827', '0.051062', '0.053776', '0.041999', '0.046745', '0.058637', '0.046938', '0.051826', '0.051378', '0.058271', '0.050920', '0.055583', '0.055475']
         : correct/total = [(246, 4128), (220, 4203), (235, 4081), (229, 4333), (187, 4091), (186, 4287), (394, 4193), (208, 4349), (214, 4191), (230, 4277), (174, 4143), (196, 4193), (240, 4093), (197, 4197), (210, 4052), (207, 4029), (242, 4153), (213, 4183), (227, 4084), (229, 4128)]
         : compromised: 0.0515, honest: 0.0561
         : ubar stats = ['Node 0: s1=0.500, s2=0.733', 'Node 1: s1=0.500, s2=0.467', 'Node 2: s1=0.400, s2=0.700']...
Round 006: test acc mean=0.0531 ± 0.0058 | min=0.0434 max=0.0624
         : test loss mean=3.7001 ± 0.0434
         : individual accs = ['0.044574', '0.060195', '0.057584', '0.052850', '0.051088', '0.043387', '0.057000', '0.051276', '0.049630', '0.043488', '0.050447', '0.061770', '0.058637', '0.062426', '0.061204', '0.051378', '0.049362', '0.050920', '0.055583', '0.048450']
         : correct/total = [(184, 4128), (253, 4203), (235, 4081), (229, 4333), (209, 4091), (186, 4287), (239, 4193), (223, 4349), (208, 4191), (186, 4277), (209, 4143), (259, 4193), (240, 4093), (262, 4197), (248, 4052), (207, 4029), (205, 4153), (213, 4183), (227, 4084), (200, 4128)]
         : compromised: 0.0563, honest: 0.0498
         : ubar stats = ['Node 0: s1=0.500, s2=0.778', 'Node 1: s1=0.500, s2=0.444', 'Node 2: s1=0.400, s2=0.750']...
Round 007: test acc mean=0.0543 ± 0.0048 | min=0.0435 max=0.0624
         : test loss mean=3.7074 ± 0.0458
         : individual accs = ['0.050145', '0.052344', '0.057584', '0.061851', '0.047421', '0.050618', '0.048891', '0.058174', '0.053209', '0.043488', '0.055998', '0.053899', '0.058637', '0.062426', '0.051826', '0.056590', '0.060197', '0.050920', '0.055583', '0.055475']
         : correct/total = [(207, 4128), (220, 4203), (235, 4081), (268, 4333), (194, 4091), (217, 4287), (205, 4193), (253, 4349), (223, 4191), (186, 4277), (232, 4143), (226, 4193), (240, 4093), (262, 4197), (210, 4052), (228, 4029), (250, 4153), (213, 4183), (227, 4084), (229, 4128)]
         : compromised: 0.0550, honest: 0.0535
         : ubar stats = ['Node 0: s1=0.500, s2=0.714', 'Node 1: s1=0.500, s2=0.524', 'Node 2: s1=0.400, s2=0.714']...
Round 008: test acc mean=0.0553 ± 0.0136 | min=0.0430 max=0.0952
         : test loss mean=3.7037 ± 0.0462
         : individual accs = ['0.051599', '0.051630', '0.050723', '0.044773', '0.043021', '0.048052', '0.057000', '0.045528', '0.054164', '0.053308', '0.093893', '0.053899', '0.053750', '0.045747', '0.048124', '0.056342', '0.055141', '0.050920', '0.052889', '0.095203']
         : correct/total = [(213, 4128), (217, 4203), (207, 4081), (194, 4333), (176, 4091), (206, 4287), (239, 4193), (198, 4349), (227, 4191), (228, 4277), (389, 4143), (226, 4193), (220, 4093), (192, 4197), (195, 4052), (227, 4029), (229, 4153), (213, 4183), (216, 4084), (393, 4128)]
         : compromised: 0.0512, honest: 0.0594
         : ubar stats = ['Node 0: s1=0.500, s2=0.667', 'Node 1: s1=0.500, s2=0.583', 'Node 2: s1=0.400, s2=0.688']...
Round 009: test acc mean=0.0587 ± 0.0146 | min=0.0439 max=0.1002
         : test loss mean=3.6936 ± 0.0317
         : individual accs = ['0.050145', '0.050916', '0.082333', '0.052850', '0.044977', '0.051551', '0.050799', '0.043918', '0.054641', '0.045125', '0.055998', '0.055569', '0.087466', '0.062426', '0.100197', '0.056342', '0.052011', '0.050203', '0.068315', '0.057897']
         : correct/total = [(207, 4128), (214, 4203), (336, 4081), (229, 4333), (184, 4091), (221, 4287), (213, 4193), (191, 4349), (229, 4191), (193, 4277), (232, 4143), (233, 4193), (358, 4093), (262, 4197), (406, 4052), (227, 4029), (216, 4153), (210, 4183), (279, 4084), (239, 4128)]
         : compromised: 0.0665, honest: 0.0508
         : ubar stats = ['Node 0: s1=0.500, s2=0.630', 'Node 1: s1=0.500, s2=0.593', 'Node 2: s1=0.400, s2=0.667']...
Round 010: test acc mean=0.0595 ± 0.0125 | min=0.0480 max=0.1009
         : test loss mean=3.7004 ± 0.0451
         : individual accs = ['0.059593', '0.051630', '0.057584', '0.052850', '0.057932', '0.088873', '0.049130', '0.058404', '0.047960', '0.053776', '0.055998', '0.053899', '0.100904', '0.062426', '0.061204', '0.056342', '0.058993', '0.050920', '0.055583', '0.055475']
         : correct/total = [(246, 4128), (217, 4203), (235, 4081), (229, 4333), (237, 4091), (381, 4287), (206, 4193), (254, 4349), (201, 4191), (230, 4277), (232, 4143), (226, 4193), (413, 4093), (262, 4197), (248, 4052), (227, 4029), (245, 4153), (213, 4183), (227, 4084), (229, 4128)]
         : compromised: 0.0639, honest: 0.0550
         : ubar stats = ['Node 0: s1=0.500, s2=0.600', 'Node 1: s1=0.500, s2=0.567', 'Node 2: s1=0.400, s2=0.650']...

=== FINAL RESULTS ===
Dataset: femnist, Nodes: 20, Graph: erdos, Aggregation: ubar
Attack: krum, 50.0% compromised
Final accuracy - Compromised: 0.0639, Honest: 0.0550
Overall test accuracy: mean=0.0595 ± 0.0125

=== UBAR SUMMARY ===
Node 0: stage1=0.500, stage2=0.600, overall=0.300
Node 1: stage1=0.500, stage2=0.567, overall=0.283
Node 2: stage1=0.400, stage2=0.650, overall=0.260
Node 3: stage1=0.500, stage2=0.650, overall=0.325
Node 4: stage1=0.500, stage2=0.500, overall=0.250
Node 5: stage1=0.400, stage2=0.500, overall=0.200
Node 6: stage1=0.400, stage2=0.650, overall=0.260
Node 7: stage1=0.400, stage2=0.700, overall=0.280
Node 8: stage1=0.500, stage2=1.000, overall=0.500
Node 9: stage1=0.333, stage2=1.000, overall=0.333
Node 10: stage1=0.500, stage2=0.600, overall=0.300
Node 11: stage1=0.429, stage2=0.500, overall=0.214
Node 12: stage1=0.429, stage2=0.533, overall=0.229
Node 13: stage1=0.500, stage2=0.500, overall=0.250
Node 14: stage1=0.429, stage2=0.333, overall=0.143
Node 15: stage1=0.500, stage2=0.467, overall=0.233
Node 16: stage1=0.400, stage2=0.500, overall=0.200
Node 17: stage1=0.400, stage2=0.600, overall=0.240
Node 18: stage1=0.500, stage2=0.750, overall=0.375
Node 19: stage1=0.500, stage2=1.000, overall=0.500

=== PARALLEL EXECUTION TIME (realistic for distributed system) ===
  COMMUNICATION (max across nodes):
    - Full model transfer: 0.000s (0.0%)
  COMPUTATION (max across nodes):
    - Distance computation: 0.029s (0.7%)
    - Loss computation: 4.166s (99.2%)
    - Aggregation: 0.006s (0.1%)
  TOTALS:
    - Total computation: 4.201s (100.0%)
    - Total communication: 0.000s (0.0%)
    - Total parallel time: 4.201s

=== PER-NODE AVERAGE TIME ===
  - Distance computation: 0.022s
  - Loss computation: 3.902s
  - Aggregation: 0.005s
  - Model transfer: 0.000s
  - Total per node: 3.929s

=== TOTAL COMPUTATIONAL WORK (sum across all nodes) ===
  - Total distance computation: 0.444s
  - Total loss computation: 78.044s
  - Total aggregation: 0.093s
  - Total model transfer: 0.000s
  - Grand total: 78.581s
  - Mean Stage 1 acceptance rate: 0.451
  - Mean Stage 2 acceptance rate: 0.630
  - Overall acceptance rate: 0.284

UBAR Algorithm Properties:
  - Model dimension: 6,603,710
  - Rho parameter: 0.5
  - Two-stage approach: Distance filtering + loss evaluation
  - Stage 1 selects: 50% of neighbors
  - Stage 2 uses: Training sample loss comparison
  - Theoretical complexity: O(deg(i)×d + deg(i)×inference)
  - Approach: UBAR paper implementation
