Device: cuda
Seed: 987654321
Loading 36 LEAF FEMNIST train files...
LEAF FEMNIST train: 3597 users, 734463 samples
Loading 36 LEAF FEMNIST test files...
LEAF FEMNIST test: 3597 users, 83388 samples
Found 3597 train users, 3597 test users, 3597 common users
User sample counts range: 525 (max) to 17 (min)
Distributed ALL 3597 users across 20 clients
Users per client: 179 (with 17 clients getting +1 user)
Train partition sizes: [36360, 37070, 35957, 38262, 36024, 37732, 36921, 38328, 36867, 37683, 36507, 36915, 36007, 37001, 35681, 35453, 36585, 36801, 35964, 36345]
Test partition sizes: [4128, 4203, 4081, 4333, 4091, 4287, 4193, 4349, 4191, 4277, 4143, 4193, 4093, 4197, 4052, 4029, 4153, 4183, 4084, 4128]
  Client 0: 36360 train samples, 62 unique classes
  Client 1: 37070 train samples, 62 unique classes
  Client 2: 35957 train samples, 62 unique classes
  Client 3: 38262 train samples, 62 unique classes
  Client 4: 36024 train samples, 62 unique classes
  Client 5: 37732 train samples, 62 unique classes
  Client 6: 36921 train samples, 62 unique classes
  Client 7: 38328 train samples, 62 unique classes
  Client 8: 36867 train samples, 62 unique classes
  Client 9: 37683 train samples, 62 unique classes
  Client 10: 36507 train samples, 62 unique classes
  Client 11: 36915 train samples, 62 unique classes
  Client 12: 36007 train samples, 62 unique classes
  Client 13: 37001 train samples, 62 unique classes
  Client 14: 35681 train samples, 62 unique classes
  Client 15: 35453 train samples, 62 unique classes
  Client 16: 36585 train samples, 62 unique classes
  Client 17: 36801 train samples, 62 unique classes
  Client 18: 35964 train samples, 62 unique classes
  Client 19: 36345 train samples, 62 unique classes
Will sample 4500 samples per client per epoch
Graph: erdos, nodes: 20, edges: 48
Degree statistics: avg=4.80, min=2, max=7
Attack: Compromised 10/20 nodes: [1, 2, 5, 11, 12, 13, 14, 15, 17, 18]
Attack type: backdoor, lambda: 1.0
Backdoor target label: 0, trigger size: 4
Model variant: baseline
Model parameters: 6,603,710
Initial test acc across nodes: mean=0.0168 ± 0.0139
Backdoor attack: Created poisoned datasets for 10 compromised nodes
Round 001: test acc mean=0.0203 ± 0.0177 | min=0.0029 max=0.0516
         : test loss mean=58031.7144 ± 80526.0263
         : individual accs = ['0.004360', '0.051630', '0.019358', '0.012462', '0.012955', '0.050618', '0.007155', '0.017935', '0.003818', '0.003507', '0.010379', '0.006916', '0.042756', '0.005480', '0.023198', '0.051378', '0.050325', '0.017930', '0.010774', '0.002907']
         : correct/total = [(18, 4128), (217, 4203), (79, 4081), (54, 4333), (53, 4091), (217, 4287), (30, 4193), (78, 4349), (16, 4191), (15, 4277), (43, 4143), (29, 4193), (175, 4093), (23, 4197), (94, 4052), (207, 4029), (209, 4153), (75, 4183), (44, 4084), (12, 4128)]
         : compromised: 0.0280, honest: 0.0126
Round 002: test acc mean=0.0428 ± 0.0177 | min=0.0030 max=0.0612
         : test loss mean=101221926970254592.0000 ± 406186670921290368.0000
         : individual accs = ['0.059593', '0.052344', '0.004656', '0.040157', '0.043021', '0.043387', '0.033389', '0.043918', '0.049630', '0.003040', '0.041999', '0.049606', '0.058637', '0.004765', '0.061204', '0.051378', '0.058271', '0.050920', '0.052155', '0.054506']
         : correct/total = [(246, 4128), (220, 4203), (19, 4081), (174, 4333), (176, 4091), (186, 4287), (140, 4193), (191, 4349), (208, 4191), (13, 4277), (174, 4143), (208, 4193), (240, 4093), (20, 4197), (248, 4052), (207, 4029), (242, 4153), (213, 4183), (213, 4084), (225, 4128)]
         : compromised: 0.0429, honest: 0.0428
Round 003: test acc mean=0.0484 ± 0.0053 | min=0.0323 max=0.0578
         : test loss mean=968262883954189664256.0000 ± 4220560061935832793088.0000
         : individual accs = ['0.047238', '0.048775', '0.045087', '0.048234', '0.044977', '0.057849', '0.048891', '0.043918', '0.053209', '0.047697', '0.055274', '0.049606', '0.049597', '0.046462', '0.032330', '0.054852', '0.044546', '0.045900', '0.052155', '0.050872']
         : correct/total = [(195, 4128), (205, 4203), (184, 4081), (209, 4333), (184, 4091), (248, 4287), (205, 4193), (191, 4349), (223, 4191), (204, 4277), (229, 4143), (208, 4193), (203, 4093), (195, 4197), (131, 4052), (221, 4029), (185, 4153), (192, 4183), (213, 4084), (210, 4128)]
         : compromised: 0.0483, honest: 0.0485
Round 004: test acc mean=0.0423 ± 0.0075 | min=0.0291 max=0.0539
         : test loss mean=306219467588868673372160.0000 ± 1194551222077325876133888.0000
         : individual accs = ['0.029070', '0.048775', '0.035531', '0.052850', '0.047421', '0.048752', '0.035535', '0.045528', '0.037700', '0.036708', '0.047309', '0.045314', '0.036404', '0.037408', '0.032330', '0.053860', '0.030340', '0.045900', '0.048482', '0.050388']
         : correct/total = [(120, 4128), (205, 4203), (145, 4081), (229, 4333), (194, 4091), (209, 4287), (149, 4193), (198, 4349), (158, 4191), (157, 4277), (196, 4143), (190, 4193), (149, 4093), (157, 4197), (131, 4052), (217, 4029), (126, 4153), (192, 4183), (198, 4084), (208, 4128)]
         : compromised: 0.0433, honest: 0.0413
Round 005: test acc mean=0.0482 ± 0.0028 | min=0.0446 max=0.0544
         : test loss mean=97400706220.7373 ± 341843496816.3896
         : individual accs = ['0.045785', '0.050202', '0.045087', '0.044773', '0.047421', '0.048752', '0.048891', '0.045528', '0.044619', '0.047697', '0.047309', '0.045314', '0.049841', '0.045747', '0.051579', '0.053860', '0.054418', '0.050203', '0.048482', '0.048692']
         : correct/total = [(189, 4128), (211, 4203), (184, 4081), (194, 4333), (194, 4091), (209, 4287), (205, 4193), (198, 4349), (187, 4191), (204, 4277), (196, 4143), (190, 4193), (204, 4093), (192, 4197), (209, 4052), (217, 4029), (226, 4153), (210, 4183), (198, 4084), (201, 4128)]
         : compromised: 0.0489, honest: 0.0475
Round 006: test acc mean=0.0467 ± 0.0039 | min=0.0407 max=0.0563
         : test loss mean=27971.9026 ± 75443.4172
         : individual accs = ['0.045785', '0.051630', '0.050723', '0.043157', '0.044977', '0.048752', '0.042213', '0.043918', '0.040802', '0.046528', '0.050447', '0.045314', '0.048620', '0.045747', '0.046644', '0.056342', '0.040693', '0.050203', '0.048482', '0.043847']
         : correct/total = [(189, 4128), (217, 4203), (207, 4081), (187, 4333), (184, 4091), (209, 4287), (177, 4193), (191, 4349), (171, 4191), (199, 4277), (209, 4143), (190, 4193), (199, 4093), (192, 4197), (189, 4052), (227, 4029), (169, 4153), (210, 4183), (198, 4084), (181, 4128)]
         : compromised: 0.0492, honest: 0.0442
Round 007: test acc mean=0.0467 ± 0.0043 | min=0.0365 max=0.0549
         : test loss mean=6.1141 ± 3.3780
         : individual accs = ['0.045785', '0.049726', '0.050723', '0.036464', '0.047421', '0.052484', '0.042213', '0.045528', '0.040802', '0.046528', '0.045619', '0.046745', '0.050574', '0.045747', '0.046644', '0.054852', '0.040693', '0.048291', '0.051665', '0.045058']
         : correct/total = [(189, 4128), (209, 4203), (207, 4081), (158, 4333), (194, 4091), (225, 4287), (177, 4193), (198, 4349), (171, 4191), (199, 4277), (189, 4143), (196, 4193), (207, 4093), (192, 4197), (189, 4052), (221, 4029), (169, 4153), (202, 4183), (211, 4084), (186, 4128)]
         : compromised: 0.0497, honest: 0.0436
Round 008: test acc mean=0.0510 ± 0.0036 | min=0.0457 max=0.0618
         : test loss mean=193469557.4617 ± 843314223.2692
         : individual accs = ['0.051599', '0.051630', '0.050723', '0.048465', '0.051088', '0.048052', '0.049130', '0.051276', '0.047960', '0.046528', '0.050447', '0.061770', '0.053750', '0.045747', '0.048124', '0.056342', '0.055141', '0.050203', '0.052889', '0.048450']
         : correct/total = [(213, 4128), (217, 4203), (207, 4081), (210, 4333), (209, 4091), (206, 4287), (206, 4193), (223, 4349), (201, 4191), (199, 4277), (209, 4143), (259, 4193), (220, 4093), (192, 4197), (195, 4052), (227, 4029), (229, 4153), (210, 4183), (216, 4084), (200, 4128)]
         : compromised: 0.0519, honest: 0.0500
Round 009: test acc mean=0.0506 ± 0.0029 | min=0.0457 max=0.0551
         : test loss mean=14765627150.6714 ± 32279562334.7864
         : individual accs = ['0.045785', '0.047109', '0.055134', '0.047773', '0.051088', '0.048052', '0.053899', '0.051276', '0.047960', '0.053075', '0.050447', '0.053184', '0.049841', '0.045747', '0.051579', '0.054852', '0.054418', '0.050203', '0.052155', '0.048450']
         : correct/total = [(189, 4128), (198, 4203), (225, 4081), (207, 4333), (209, 4091), (206, 4287), (226, 4193), (223, 4349), (201, 4191), (227, 4277), (209, 4143), (223, 4193), (204, 4093), (192, 4197), (209, 4052), (221, 4029), (226, 4153), (210, 4183), (213, 4084), (200, 4128)]
         : compromised: 0.0508, honest: 0.0504
Round 010: test acc mean=0.0505 ± 0.0031 | min=0.0438 max=0.0551
         : test loss mean=16839943944.8825 ± 25164520055.9563
         : individual accs = ['0.049176', '0.047109', '0.055134', '0.047773', '0.048643', '0.048519', '0.053899', '0.051276', '0.051539', '0.047229', '0.051653', '0.053184', '0.049841', '0.045747', '0.051579', '0.054852', '0.054418', '0.053311', '0.052155', '0.043847']
         : correct/total = [(203, 4128), (198, 4203), (225, 4081), (207, 4333), (199, 4091), (208, 4287), (226, 4193), (223, 4349), (216, 4191), (202, 4277), (214, 4143), (223, 4193), (204, 4093), (192, 4197), (209, 4052), (221, 4029), (226, 4153), (223, 4183), (213, 4084), (181, 4128)]
         : compromised: 0.0511, honest: 0.0499

=== FINAL RESULTS ===
Dataset: femnist, Nodes: 20, Graph: erdos, Aggregation: d-fedavg
Attack: backdoor, 50.0% compromised
Final accuracy - Compromised: 0.0511, Honest: 0.0499
Overall test accuracy: mean=0.0505 ± 0.0031

=== BACKDOOR ATTACK SUCCESS RATE (ASR) ===
Target label: 0
Trigger size: 4x4
Overall ASR: 0.0000 ± 0.0000
Honest nodes ASR: 0.0000 ± 0.0000
Compromised nodes ASR: 0.0000 ± 0.0000
Note: Higher ASR indicates more successful backdoor attack
