Device: cuda
Seed: 987654321
Loading 36 LEAF FEMNIST train files...
LEAF FEMNIST train: 3597 users, 734463 samples
Loading 36 LEAF FEMNIST test files...
LEAF FEMNIST test: 3597 users, 83388 samples
Found 3597 train users, 3597 test users, 3597 common users
User sample counts range: 525 (max) to 17 (min)
Distributed ALL 3597 users across 20 clients
Users per client: 179 (with 17 clients getting +1 user)
Train partition sizes: [36360, 37070, 35957, 38262, 36024, 37732, 36921, 38328, 36867, 37683, 36507, 36915, 36007, 37001, 35681, 35453, 36585, 36801, 35964, 36345]
Test partition sizes: [4128, 4203, 4081, 4333, 4091, 4287, 4193, 4349, 4191, 4277, 4143, 4193, 4093, 4197, 4052, 4029, 4153, 4183, 4084, 4128]
  Client 0: 36360 train samples, 62 unique classes
  Client 1: 37070 train samples, 62 unique classes
  Client 2: 35957 train samples, 62 unique classes
  Client 3: 38262 train samples, 62 unique classes
  Client 4: 36024 train samples, 62 unique classes
  Client 5: 37732 train samples, 62 unique classes
  Client 6: 36921 train samples, 62 unique classes
  Client 7: 38328 train samples, 62 unique classes
  Client 8: 36867 train samples, 62 unique classes
  Client 9: 37683 train samples, 62 unique classes
  Client 10: 36507 train samples, 62 unique classes
  Client 11: 36915 train samples, 62 unique classes
  Client 12: 36007 train samples, 62 unique classes
  Client 13: 37001 train samples, 62 unique classes
  Client 14: 35681 train samples, 62 unique classes
  Client 15: 35453 train samples, 62 unique classes
  Client 16: 36585 train samples, 62 unique classes
  Client 17: 36801 train samples, 62 unique classes
  Client 18: 35964 train samples, 62 unique classes
  Client 19: 36345 train samples, 62 unique classes
Will sample 4500 samples per client per epoch
Graph: fully, nodes: 20, edges: 190
Degree statistics: avg=19.00, min=19, max=19
Attack: Compromised 14/20 nodes: [1, 2, 3, 5, 6, 8, 11, 12, 13, 14, 15, 17, 18, 19]
Attack type: backdoor, lambda: 1.0
Backdoor target label: 0, trigger size: 4
Model variant: baseline
Model parameters: 6,603,710
BALANCE algorithm:
Balance Config: BALANCEConfig(gamma=2, kappa=1, alpha=0.5, min_neighbors=1)
  - Model dimension: 6,603,710 parameters
  - Complexity: O(N×d) = O(20×6,603,710)
Initial test acc across nodes: mean=0.0168 ± 0.0139
Backdoor attack: Created poisoned datasets for 14 compromised nodes
Round 001: test acc mean=0.0520 ± 0.0043 | min=0.0432 max=0.0596
         : test loss mean=21853.0673 ± 14411.9321
         : individual accs = ['0.059593', '0.048775', '0.053418', '0.043157', '0.057932', '0.045253', '0.050799', '0.059324', '0.049630', '0.050503', '0.050447', '0.049606', '0.054239', '0.049083', '0.051826', '0.051626', '0.058271', '0.049486', '0.052889', '0.054506']
         : correct/total = [(246, 4128), (205, 4203), (218, 4081), (187, 4333), (237, 4091), (194, 4287), (213, 4193), (258, 4349), (208, 4191), (216, 4277), (209, 4143), (208, 4193), (222, 4093), (206, 4197), (210, 4052), (208, 4029), (242, 4153), (207, 4183), (216, 4084), (225, 4128)]
         : compromised: 0.0503, honest: 0.0560
Round 002: test acc mean=0.0245 ± 0.0241 | min=0.0017 max=0.0596
         : test loss mean=370965.8538 ± 387797.7667
         : individual accs = ['0.044574', '0.001665', '0.003676', '0.002308', '0.057932', '0.004432', '0.005485', '0.058174', '0.005727', '0.059621', '0.055274', '0.048891', '0.003420', '0.003336', '0.006170', '0.004219', '0.054418', '0.049486', '0.017630', '0.003876']
         : correct/total = [(184, 4128), (7, 4203), (15, 4081), (10, 4333), (237, 4091), (19, 4287), (23, 4193), (253, 4349), (24, 4191), (255, 4277), (229, 4143), (205, 4193), (14, 4093), (14, 4197), (25, 4052), (17, 4029), (226, 4153), (207, 4183), (72, 4084), (16, 4128)]
         : compromised: 0.0115, honest: 0.0550
Round 003: test acc mean=0.0520 ± 0.0042 | min=0.0432 max=0.0596
         : test loss mean=8436763032045201408.0000 ± 36774613370231189504.0000
         : individual accs = ['0.059593', '0.048775', '0.053418', '0.043157', '0.057932', '0.045253', '0.050799', '0.051276', '0.051062', '0.047463', '0.055274', '0.049606', '0.054239', '0.049083', '0.051826', '0.056342', '0.058271', '0.049486', '0.052155', '0.054506']
         : correct/total = [(246, 4128), (205, 4203), (218, 4081), (187, 4333), (237, 4091), (194, 4287), (213, 4193), (223, 4349), (214, 4191), (203, 4277), (229, 4143), (208, 4193), (222, 4093), (206, 4197), (210, 4052), (227, 4029), (242, 4153), (207, 4183), (213, 4084), (225, 4128)]
         : compromised: 0.0507, honest: 0.0550
Round 004: test acc mean=0.0522 ± 0.0054 | min=0.0432 max=0.0660
         : test loss mean=nan ± nan
         : individual accs = ['0.059593', '0.048775', '0.057584', '0.043157', '0.065999', '0.045253', '0.050799', '0.058174', '0.049630', '0.048398', '0.045619', '0.049606', '0.054239', '0.049083', '0.051826', '0.051626', '0.058271', '0.049486', '0.052889', '0.054506']
         : correct/total = [(246, 4128), (205, 4203), (235, 4081), (187, 4333), (270, 4091), (194, 4287), (213, 4193), (253, 4349), (208, 4191), (207, 4277), (189, 4143), (208, 4193), (222, 4093), (206, 4197), (210, 4052), (208, 4029), (242, 4153), (207, 4183), (216, 4084), (225, 4128)]
         : compromised: 0.0506, honest: 0.0560
Round 005: test acc mean=0.0519 ± 0.0042 | min=0.0432 max=0.0596
         : test loss mean=nan ± nan
         : individual accs = ['0.059593', '0.048775', '0.053418', '0.043157', '0.057932', '0.045253', '0.050799', '0.047827', '0.049630', '0.053776', '0.055998', '0.049606', '0.054239', '0.049083', '0.051826', '0.051626', '0.058271', '0.049486', '0.052889', '0.054506']
         : correct/total = [(246, 4128), (205, 4203), (218, 4081), (187, 4333), (237, 4091), (194, 4287), (213, 4193), (208, 4349), (208, 4191), (230, 4277), (232, 4143), (208, 4193), (222, 4093), (206, 4197), (210, 4052), (208, 4029), (242, 4153), (207, 4183), (216, 4084), (225, 4128)]
         : compromised: 0.0503, honest: 0.0556
Round 006: test acc mean=0.0509 ± 0.0039 | min=0.0432 max=0.0583
         : test loss mean=nan ± nan
         : individual accs = ['0.044574', '0.048775', '0.053418', '0.043157', '0.057932', '0.045253', '0.050799', '0.047827', '0.049630', '0.053776', '0.050447', '0.049606', '0.054239', '0.049083', '0.051826', '0.051626', '0.058271', '0.049486', '0.052889', '0.054506']
         : correct/total = [(184, 4128), (205, 4203), (218, 4081), (187, 4333), (237, 4091), (194, 4287), (213, 4193), (208, 4349), (208, 4191), (230, 4277), (209, 4143), (208, 4193), (222, 4093), (206, 4197), (210, 4052), (208, 4029), (242, 4153), (207, 4183), (216, 4084), (225, 4128)]
         : compromised: 0.0503, honest: 0.0521
Round 007: test acc mean=0.0514 ± 0.0045 | min=0.0432 max=0.0596
         : test loss mean=nan ± nan
         : individual accs = ['0.059593', '0.048775', '0.053418', '0.043157', '0.047421', '0.045253', '0.050799', '0.058174', '0.049630', '0.043488', '0.055998', '0.049606', '0.054239', '0.049083', '0.051826', '0.051626', '0.058271', '0.049486', '0.052889', '0.054506']
         : correct/total = [(246, 4128), (205, 4203), (218, 4081), (187, 4333), (194, 4091), (194, 4287), (213, 4193), (253, 4349), (208, 4191), (186, 4277), (232, 4143), (208, 4193), (222, 4093), (206, 4197), (210, 4052), (208, 4029), (242, 4153), (207, 4183), (216, 4084), (225, 4128)]
         : compromised: 0.0503, honest: 0.0538
Round 008: test acc mean=0.0519 ± 0.0054 | min=0.0432 max=0.0719
         : test loss mean=nan ± nan
         : individual accs = ['0.051599', '0.048775', '0.053418', '0.043157', '0.051088', '0.045253', '0.050799', '0.051276', '0.049630', '0.053075', '0.071929', '0.049606', '0.054239', '0.049083', '0.051826', '0.051626', '0.055141', '0.049486', '0.052889', '0.054506']
         : correct/total = [(213, 4128), (205, 4203), (218, 4081), (187, 4333), (209, 4091), (194, 4287), (213, 4193), (223, 4349), (208, 4191), (227, 4277), (298, 4143), (208, 4193), (222, 4093), (206, 4197), (210, 4052), (208, 4029), (229, 4153), (207, 4183), (216, 4084), (225, 4128)]
         : compromised: 0.0503, honest: 0.0557
Round 009: test acc mean=0.0507 ± 0.0038 | min=0.0432 max=0.0590
         : test loss mean=nan ± nan
         : individual accs = ['0.051599', '0.048775', '0.053418', '0.043157', '0.051088', '0.045253', '0.050799', '0.043918', '0.049630', '0.047463', '0.055998', '0.049606', '0.054239', '0.049083', '0.051826', '0.051626', '0.058993', '0.049486', '0.052889', '0.054506']
         : correct/total = [(213, 4128), (205, 4203), (218, 4081), (187, 4333), (209, 4091), (194, 4287), (213, 4193), (191, 4349), (208, 4191), (203, 4277), (232, 4143), (208, 4193), (222, 4093), (206, 4197), (210, 4052), (208, 4029), (245, 4153), (207, 4183), (216, 4084), (225, 4128)]
         : compromised: 0.0503, honest: 0.0515
Round 010: test acc mean=0.0524 ± 0.0043 | min=0.0432 max=0.0596
         : test loss mean=nan ± nan
         : individual accs = ['0.059593', '0.048775', '0.053418', '0.043157', '0.057932', '0.045253', '0.050799', '0.058174', '0.049630', '0.053776', '0.055998', '0.049606', '0.054239', '0.049083', '0.051826', '0.051626', '0.058271', '0.049486', '0.052889', '0.054506']
         : correct/total = [(246, 4128), (205, 4203), (218, 4081), (187, 4333), (237, 4091), (194, 4287), (213, 4193), (253, 4349), (208, 4191), (230, 4277), (232, 4143), (208, 4193), (222, 4093), (206, 4197), (210, 4052), (208, 4029), (242, 4153), (207, 4183), (216, 4084), (225, 4128)]
         : compromised: 0.0503, honest: 0.0573

=== FINAL RESULTS ===
Dataset: femnist, Nodes: 20, Graph: fully, Aggregation: balance
Attack: backdoor, 70.0% compromised
Final accuracy - Compromised: 0.0503, Honest: 0.0573
Overall test accuracy: mean=0.0524 ± 0.0043

=== BACKDOOR ATTACK SUCCESS RATE (ASR) ===
Target label: 0
Trigger size: 4x4
Overall ASR: 0.7000 ± 0.4583
Honest nodes ASR: 0.0000 ± 0.0000
Compromised nodes ASR: 1.0000 ± 0.0000
Note: Higher ASR indicates more successful backdoor attack

=== BALANCE SUMMARY ===
Node 0: acceptance=0.263
Node 1: acceptance=0.332
Node 2: acceptance=0.332
Node 3: acceptance=0.332
Node 4: acceptance=0.263
Node 5: acceptance=0.332
Node 6: acceptance=0.332
Node 7: acceptance=0.263
Node 8: acceptance=0.332
Node 9: acceptance=0.263
Node 10: acceptance=0.263
Node 11: acceptance=0.332
Node 12: acceptance=0.332
Node 13: acceptance=0.332
Node 14: acceptance=0.332
Node 15: acceptance=0.332
Node 16: acceptance=0.263
Node 17: acceptance=0.332
Node 18: acceptance=0.232
Node 19: acceptance=0.332

=== PARALLEL EXECUTION TIME (realistic for distributed system) ===
  COMMUNICATION (max across nodes):
    - Full model transfer: 0.000s (0.0%)
  COMPUTATION (max across nodes):
    - Filtering: 0.074s (85.7%)
    - Aggregation: 0.012s (14.3%)
  TOTALS:
    - Total computation: 0.087s (100.0%)
    - Total communication: 0.000s (0.0%)
    - Total parallel time: 0.087s

=== PER-NODE AVERAGE TIME ===
  - Filtering: 0.069s
  - Aggregation: 0.005s
  - Model transfer: 0.000s
  - Total per node: 0.074s

=== TOTAL COMPUTATIONAL WORK (sum across all nodes) ===
  - Total filtering: 1.384s
  - Total aggregation: 0.102s
  - Total model transfer: 0.000s
  - Grand total: 1.486s
  - Mean acceptance rate: 0.306

BALANCE Algorithm Properties:
  - Model dimension: 6,603,710
  - No compression: Full parameter comparison
  - Theoretical complexity: O(deg(i)×d)
  - Approach: Full parameter filtering + averaging
