Device: cuda
Seed: 987654321
Loading 36 LEAF FEMNIST train files...
LEAF FEMNIST train: 3597 users, 734463 samples
Loading 36 LEAF FEMNIST test files...
LEAF FEMNIST test: 3597 users, 83388 samples
Found 3597 train users, 3597 test users, 3597 common users
User sample counts range: 525 (max) to 17 (min)
Distributed ALL 3597 users across 20 clients
Users per client: 179 (with 17 clients getting +1 user)
Train partition sizes: [36360, 37070, 35957, 38262, 36024, 37732, 36921, 38328, 36867, 37683, 36507, 36915, 36007, 37001, 35681, 35453, 36585, 36801, 35964, 36345]
Test partition sizes: [4128, 4203, 4081, 4333, 4091, 4287, 4193, 4349, 4191, 4277, 4143, 4193, 4093, 4197, 4052, 4029, 4153, 4183, 4084, 4128]
  Client 0: 36360 train samples, 62 unique classes
  Client 1: 37070 train samples, 62 unique classes
  Client 2: 35957 train samples, 62 unique classes
  Client 3: 38262 train samples, 62 unique classes
  Client 4: 36024 train samples, 62 unique classes
  Client 5: 37732 train samples, 62 unique classes
  Client 6: 36921 train samples, 62 unique classes
  Client 7: 38328 train samples, 62 unique classes
  Client 8: 36867 train samples, 62 unique classes
  Client 9: 37683 train samples, 62 unique classes
  Client 10: 36507 train samples, 62 unique classes
  Client 11: 36915 train samples, 62 unique classes
  Client 12: 36007 train samples, 62 unique classes
  Client 13: 37001 train samples, 62 unique classes
  Client 14: 35681 train samples, 62 unique classes
  Client 15: 35453 train samples, 62 unique classes
  Client 16: 36585 train samples, 62 unique classes
  Client 17: 36801 train samples, 62 unique classes
  Client 18: 35964 train samples, 62 unique classes
  Client 19: 36345 train samples, 62 unique classes
Will sample 4500 samples per client per epoch
Graph: fully, nodes: 20, edges: 190
Degree statistics: avg=19.00, min=19, max=19
Attack: Compromised 14/20 nodes: [1, 2, 3, 5, 6, 8, 11, 12, 13, 14, 15, 17, 18, 19]
Attack type: directed_deviation, lambda: 1.0
Model variant: baseline
Model parameters: 6,603,710
UBAR ALGORITHM (Two-Stage Byzantine-resilient)
  - Model dimension: 6,603,710 parameters
  - Rho parameter: 0.30000000000000004
  - Stage 1: Distance-based filtering (select 30% closest neighbors)
  - Stage 2: Performance-based selection (loss comparison)
  - Complexity: O(deg(i)×d + deg(i)×inference)
Initial test acc across nodes: mean=0.0168 ± 0.0139
Round 001: test acc mean=0.0543 ± 0.0038 | min=0.0469 max=0.0600
         : test loss mean=4.0163 ± 0.0302
         : individual accs = ['0.059593', '0.051630', '0.055134', '0.059312', '0.057932', '0.056216', '0.057000', '0.059324', '0.053209', '0.053075', '0.055274', '0.054138', '0.052040', '0.046938', '0.048124', '0.050633', '0.059957', '0.050920', '0.055583', '0.050145']
         : correct/total = [(246, 4128), (217, 4203), (225, 4081), (257, 4333), (237, 4091), (241, 4287), (239, 4193), (258, 4349), (223, 4191), (227, 4277), (229, 4143), (227, 4193), (213, 4093), (197, 4197), (195, 4052), (204, 4029), (249, 4153), (213, 4183), (227, 4084), (207, 4128)]
         : compromised: 0.0529, honest: 0.0575
         : ubar stats = ['Node 0: s1=0.263, s2=1.000', 'Node 1: s1=0.263, s2=0.800', 'Node 2: s1=0.263, s2=0.400']...
Round 002: test acc mean=0.0557 ± 0.0097 | min=0.0446 max=0.0938
         : test loss mean=3.8962 ± 0.0528
         : individual accs = ['0.044574', '0.051630', '0.058074', '0.052850', '0.057932', '0.050618', '0.057000', '0.058174', '0.053209', '0.053776', '0.055274', '0.053899', '0.045688', '0.046938', '0.061204', '0.053860', '0.058271', '0.050920', '0.055583', '0.093750']
         : correct/total = [(184, 4128), (217, 4203), (237, 4081), (229, 4333), (237, 4091), (217, 4287), (239, 4193), (253, 4349), (223, 4191), (230, 4277), (229, 4143), (226, 4193), (187, 4093), (197, 4197), (248, 4052), (217, 4029), (242, 4153), (213, 4183), (227, 4084), (387, 4128)]
         : compromised: 0.0561, honest: 0.0547
         : ubar stats = ['Node 0: s1=0.263, s2=1.000', 'Node 1: s1=0.263, s2=0.700', 'Node 2: s1=0.263, s2=0.300']...
Round 003: test acc mean=0.0537 ± 0.0044 | min=0.0457 max=0.0642
         : test loss mean=3.7450 ± 0.0323
         : individual accs = ['0.059593', '0.050916', '0.050723', '0.052850', '0.057932', '0.048052', '0.057000', '0.051276', '0.053209', '0.047463', '0.055998', '0.053184', '0.058637', '0.045747', '0.064166', '0.056342', '0.054418', '0.050920', '0.055583', '0.050872']
         : correct/total = [(246, 4128), (214, 4203), (207, 4081), (229, 4333), (237, 4091), (206, 4287), (239, 4193), (223, 4349), (223, 4191), (203, 4277), (232, 4143), (223, 4193), (240, 4093), (192, 4197), (260, 4052), (227, 4029), (226, 4153), (213, 4183), (227, 4084), (210, 4128)]
         : compromised: 0.0534, honest: 0.0544
         : ubar stats = ['Node 0: s1=0.263, s2=1.000', 'Node 1: s1=0.263, s2=0.533', 'Node 2: s1=0.263, s2=0.267']...
Round 004: test acc mean=0.0532 ± 0.0047 | min=0.0435 max=0.0624
         : test loss mean=3.6956 ± 0.0142
         : individual accs = ['0.059593', '0.049726', '0.057584', '0.052850', '0.057932', '0.050618', '0.057000', '0.058174', '0.053209', '0.043488', '0.045619', '0.053899', '0.054239', '0.062426', '0.048124', '0.054852', '0.052011', '0.050920', '0.052889', '0.048450']
         : correct/total = [(246, 4128), (209, 4203), (235, 4081), (229, 4333), (237, 4091), (217, 4287), (239, 4193), (253, 4349), (223, 4191), (186, 4277), (189, 4143), (226, 4193), (222, 4093), (262, 4197), (195, 4052), (221, 4029), (216, 4153), (213, 4183), (216, 4084), (200, 4128)]
         : compromised: 0.0533, honest: 0.0528
         : ubar stats = ['Node 0: s1=0.263, s2=0.800', 'Node 1: s1=0.263, s2=0.450', 'Node 2: s1=0.263, s2=0.350']...
Round 005: test acc mean=0.0542 ± 0.0075 | min=0.0457 max=0.0807
         : test loss mean=3.6823 ± 0.0162
         : individual accs = ['0.059593', '0.046158', '0.057584', '0.052850', '0.057932', '0.050618', '0.057000', '0.047827', '0.051062', '0.053776', '0.055998', '0.046983', '0.045688', '0.046938', '0.051579', '0.054852', '0.059716', '0.050920', '0.055583', '0.080669']
         : correct/total = [(246, 4128), (194, 4203), (235, 4081), (229, 4333), (237, 4091), (217, 4287), (239, 4193), (208, 4349), (214, 4191), (230, 4277), (232, 4143), (197, 4193), (187, 4093), (197, 4197), (209, 4052), (221, 4029), (248, 4153), (213, 4183), (227, 4084), (333, 4128)]
         : compromised: 0.0535, honest: 0.0558
         : ubar stats = ['Node 0: s1=0.263, s2=0.760', 'Node 1: s1=0.263, s2=0.400', 'Node 2: s1=0.263, s2=0.440']...
Round 006: test acc mean=0.0538 ± 0.0049 | min=0.0439 max=0.0624
         : test loss mean=3.6809 ± 0.0170
         : individual accs = ['0.044574', '0.051630', '0.057584', '0.052850', '0.057932', '0.052718', '0.043883', '0.058174', '0.049630', '0.053776', '0.050447', '0.061770', '0.053750', '0.062426', '0.048124', '0.056590', '0.058271', '0.050920', '0.055583', '0.055475']
         : correct/total = [(184, 4128), (217, 4203), (235, 4081), (229, 4333), (237, 4091), (226, 4287), (184, 4193), (253, 4349), (208, 4191), (230, 4277), (209, 4143), (259, 4193), (220, 4093), (262, 4197), (195, 4052), (228, 4029), (242, 4153), (213, 4183), (227, 4084), (229, 4128)]
         : compromised: 0.0538, honest: 0.0539
         : ubar stats = ['Node 0: s1=0.263, s2=0.800', 'Node 1: s1=0.263, s2=0.400', 'Node 2: s1=0.263, s2=0.500']...
Round 007: test acc mean=0.0548 ± 0.0041 | min=0.0435 max=0.0624
         : test loss mean=3.6808 ± 0.0166
         : individual accs = ['0.059593', '0.052344', '0.057584', '0.052850', '0.051088', '0.050618', '0.057000', '0.058174', '0.053209', '0.043488', '0.055998', '0.053899', '0.058637', '0.062426', '0.051826', '0.056342', '0.058271', '0.050920', '0.055583', '0.055475']
         : correct/total = [(246, 4128), (220, 4203), (235, 4081), (229, 4333), (209, 4091), (217, 4287), (239, 4193), (253, 4349), (223, 4191), (186, 4277), (232, 4143), (226, 4193), (240, 4093), (262, 4197), (210, 4052), (227, 4029), (242, 4153), (213, 4183), (227, 4084), (229, 4128)]
         : compromised: 0.0549, honest: 0.0544
         : ubar stats = ['Node 0: s1=0.263, s2=0.714', 'Node 1: s1=0.263, s2=0.371', 'Node 2: s1=0.263, s2=0.543']...
Round 008: test acc mean=0.0553 ± 0.0090 | min=0.0472 max=0.0889
         : test loss mean=3.6805 ± 0.0165
         : individual accs = ['0.051599', '0.050202', '0.050723', '0.088853', '0.051088', '0.050618', '0.049130', '0.051276', '0.068003', '0.053075', '0.055998', '0.049606', '0.053750', '0.047177', '0.061204', '0.056342', '0.055141', '0.050920', '0.055583', '0.055475']
         : correct/total = [(213, 4128), (211, 4203), (207, 4081), (385, 4333), (209, 4091), (217, 4287), (206, 4193), (223, 4349), (285, 4191), (227, 4277), (232, 4143), (208, 4193), (220, 4093), (198, 4197), (248, 4052), (227, 4029), (229, 4153), (213, 4183), (227, 4084), (229, 4128)]
         : compromised: 0.0563, honest: 0.0530
         : ubar stats = ['Node 0: s1=0.263, s2=0.675', 'Node 1: s1=0.263, s2=0.375', 'Node 2: s1=0.263, s2=0.500']...
Round 009: test acc mean=0.0559 ± 0.0080 | min=0.0484 max=0.0860
         : test loss mean=3.6797 ± 0.0169
         : individual accs = ['0.061289', '0.050916', '0.086008', '0.052850', '0.051332', '0.050618', '0.050799', '0.052196', '0.053209', '0.048398', '0.055998', '0.053899', '0.058637', '0.062426', '0.051579', '0.053860', '0.058271', '0.050681', '0.052889', '0.061773']
         : correct/total = [(253, 4128), (214, 4203), (351, 4081), (229, 4333), (210, 4091), (217, 4287), (213, 4193), (227, 4349), (223, 4191), (207, 4277), (232, 4143), (226, 4193), (240, 4093), (262, 4197), (209, 4052), (217, 4029), (242, 4153), (212, 4183), (216, 4084), (255, 4128)]
         : compromised: 0.0564, honest: 0.0546
         : ubar stats = ['Node 0: s1=0.263, s2=0.667', 'Node 1: s1=0.263, s2=0.356', 'Node 2: s1=0.263, s2=0.511']...
Round 010: test acc mean=0.0554 ± 0.0039 | min=0.0480 max=0.0624
         : test loss mean=3.6794 ± 0.0170
         : individual accs = ['0.059593', '0.051630', '0.057584', '0.052850', '0.057932', '0.050618', '0.049130', '0.058174', '0.047960', '0.053776', '0.055998', '0.053899', '0.058637', '0.062426', '0.061204', '0.056342', '0.058271', '0.050920', '0.055583', '0.055475']
         : correct/total = [(246, 4128), (217, 4203), (235, 4081), (229, 4333), (237, 4091), (217, 4287), (206, 4193), (253, 4349), (201, 4191), (230, 4277), (232, 4143), (226, 4193), (240, 4093), (262, 4197), (248, 4052), (227, 4029), (242, 4153), (213, 4183), (227, 4084), (229, 4128)]
         : compromised: 0.0546, honest: 0.0573
         : ubar stats = ['Node 0: s1=0.263, s2=0.700', 'Node 1: s1=0.263, s2=0.340', 'Node 2: s1=0.263, s2=0.480']...

=== FINAL RESULTS ===
Dataset: femnist, Nodes: 20, Graph: fully, Aggregation: ubar
Attack: directed_deviation, 70.0% compromised
Final accuracy - Compromised: 0.0546, Honest: 0.0573
Overall test accuracy: mean=0.0554 ± 0.0039

=== UBAR SUMMARY ===
Node 0: stage1=0.263, stage2=0.700, overall=0.184
Node 1: stage1=0.263, stage2=0.340, overall=0.089
Node 2: stage1=0.263, stage2=0.480, overall=0.126
Node 3: stage1=0.263, stage2=0.540, overall=0.142
Node 4: stage1=0.263, stage2=0.480, overall=0.126
Node 5: stage1=0.263, stage2=0.540, overall=0.142
Node 6: stage1=0.263, stage2=0.460, overall=0.121
Node 7: stage1=0.263, stage2=0.620, overall=0.163
Node 8: stage1=0.263, stage2=0.540, overall=0.142
Node 9: stage1=0.263, stage2=0.240, overall=0.063
Node 10: stage1=0.263, stage2=0.300, overall=0.079
Node 11: stage1=0.263, stage2=0.380, overall=0.100
Node 12: stage1=0.263, stage2=0.460, overall=0.121
Node 13: stage1=0.263, stage2=0.680, overall=0.179
Node 14: stage1=0.263, stage2=0.440, overall=0.116
Node 15: stage1=0.263, stage2=0.500, overall=0.132
Node 16: stage1=0.263, stage2=0.420, overall=0.111
Node 17: stage1=0.263, stage2=0.440, overall=0.116
Node 18: stage1=0.263, stage2=0.620, overall=0.163
Node 19: stage1=0.263, stage2=0.540, overall=0.142

=== PARALLEL EXECUTION TIME (realistic for distributed system) ===
  COMMUNICATION (max across nodes):
    - Full model transfer: 0.000s (0.0%)
  COMPUTATION (max across nodes):
    - Distance computation: 0.075s (1.7%)
    - Loss computation: 4.235s (98.1%)
    - Aggregation: 0.009s (0.2%)
  TOTALS:
    - Total computation: 4.320s (100.0%)
    - Total communication: 0.000s (0.0%)
    - Total parallel time: 4.320s

=== PER-NODE AVERAGE TIME ===
  - Distance computation: 0.067s
  - Loss computation: 3.992s
  - Aggregation: 0.006s
  - Model transfer: 0.000s
  - Total per node: 4.066s

=== TOTAL COMPUTATIONAL WORK (sum across all nodes) ===
  - Total distance computation: 1.346s
  - Total loss computation: 79.847s
  - Total aggregation: 0.118s
  - Total model transfer: 0.000s
  - Grand total: 81.311s
  - Mean Stage 1 acceptance rate: 0.263
  - Mean Stage 2 acceptance rate: 0.486
  - Overall acceptance rate: 0.128

UBAR Algorithm Properties:
  - Model dimension: 6,603,710
  - Rho parameter: 0.30000000000000004
  - Two-stage approach: Distance filtering + loss evaluation
  - Stage 1 selects: 30% of neighbors
  - Stage 2 uses: Training sample loss comparison
  - Theoretical complexity: O(deg(i)×d + deg(i)×inference)
  - Approach: UBAR paper implementation
