Device: cuda
Seed: 987654321
Loading 36 LEAF FEMNIST train files...
LEAF FEMNIST train: 3597 users, 734463 samples
Loading 36 LEAF FEMNIST test files...
LEAF FEMNIST test: 3597 users, 83388 samples
Found 3597 train users, 3597 test users, 3597 common users
User sample counts range: 525 (max) to 17 (min)
Distributed ALL 3597 users across 20 clients
Users per client: 179 (with 17 clients getting +1 user)
Train partition sizes: [36360, 37070, 35957, 38262, 36024, 37732, 36921, 38328, 36867, 37683, 36507, 36915, 36007, 37001, 35681, 35453, 36585, 36801, 35964, 36345]
Test partition sizes: [4128, 4203, 4081, 4333, 4091, 4287, 4193, 4349, 4191, 4277, 4143, 4193, 4093, 4197, 4052, 4029, 4153, 4183, 4084, 4128]
  Client 0: 36360 train samples, 62 unique classes
  Client 1: 37070 train samples, 62 unique classes
  Client 2: 35957 train samples, 62 unique classes
  Client 3: 38262 train samples, 62 unique classes
  Client 4: 36024 train samples, 62 unique classes
  Client 5: 37732 train samples, 62 unique classes
  Client 6: 36921 train samples, 62 unique classes
  Client 7: 38328 train samples, 62 unique classes
  Client 8: 36867 train samples, 62 unique classes
  Client 9: 37683 train samples, 62 unique classes
  Client 10: 36507 train samples, 62 unique classes
  Client 11: 36915 train samples, 62 unique classes
  Client 12: 36007 train samples, 62 unique classes
  Client 13: 37001 train samples, 62 unique classes
  Client 14: 35681 train samples, 62 unique classes
  Client 15: 35453 train samples, 62 unique classes
  Client 16: 36585 train samples, 62 unique classes
  Client 17: 36801 train samples, 62 unique classes
  Client 18: 35964 train samples, 62 unique classes
  Client 19: 36345 train samples, 62 unique classes
Will sample 10000 samples per client per epoch
Graph: erdos, nodes: 20, edges: 126
Degree statistics: avg=12.60, min=8, max=16
Attack: Compromised 12/20 nodes: [1, 2, 3, 5, 8, 11, 12, 13, 14, 15, 17, 18]
Attack type: krum, lambda: 1.0
Model variant: baseline
Model parameters: 6,603,710
Sketchguard Node 0:
  Model dim: 6,603,710 → Sketch size: 1000
  Compression ratio: 6603.7x
  Using model parameters for aggregation, sketches for filtering
Sketchguard Node 1:
  Model dim: 6,603,710 → Sketch size: 1000
  Compression ratio: 6603.7x
  Using model parameters for aggregation, sketches for filtering
Sketchguard Node 2:
  Model dim: 6,603,710 → Sketch size: 1000
  Compression ratio: 6603.7x
  Using model parameters for aggregation, sketches for filtering
Sketchguard Node 3:
  Model dim: 6,603,710 → Sketch size: 1000
  Compression ratio: 6603.7x
  Using model parameters for aggregation, sketches for filtering
Sketchguard Node 4:
  Model dim: 6,603,710 → Sketch size: 1000
  Compression ratio: 6603.7x
  Using model parameters for aggregation, sketches for filtering
Sketchguard Node 5:
  Model dim: 6,603,710 → Sketch size: 1000
  Compression ratio: 6603.7x
  Using model parameters for aggregation, sketches for filtering
Sketchguard Node 6:
  Model dim: 6,603,710 → Sketch size: 1000
  Compression ratio: 6603.7x
  Using model parameters for aggregation, sketches for filtering
Sketchguard Node 7:
  Model dim: 6,603,710 → Sketch size: 1000
  Compression ratio: 6603.7x
  Using model parameters for aggregation, sketches for filtering
Sketchguard Node 8:
  Model dim: 6,603,710 → Sketch size: 1000
  Compression ratio: 6603.7x
  Using model parameters for aggregation, sketches for filtering
Sketchguard Node 9:
  Model dim: 6,603,710 → Sketch size: 1000
  Compression ratio: 6603.7x
  Using model parameters for aggregation, sketches for filtering
Sketchguard Node 10:
  Model dim: 6,603,710 → Sketch size: 1000
  Compression ratio: 6603.7x
  Using model parameters for aggregation, sketches for filtering
Sketchguard Node 11:
  Model dim: 6,603,710 → Sketch size: 1000
  Compression ratio: 6603.7x
  Using model parameters for aggregation, sketches for filtering
Sketchguard Node 12:
  Model dim: 6,603,710 → Sketch size: 1000
  Compression ratio: 6603.7x
  Using model parameters for aggregation, sketches for filtering
Sketchguard Node 13:
  Model dim: 6,603,710 → Sketch size: 1000
  Compression ratio: 6603.7x
  Using model parameters for aggregation, sketches for filtering
Sketchguard Node 14:
  Model dim: 6,603,710 → Sketch size: 1000
  Compression ratio: 6603.7x
  Using model parameters for aggregation, sketches for filtering
Sketchguard Node 15:
  Model dim: 6,603,710 → Sketch size: 1000
  Compression ratio: 6603.7x
  Using model parameters for aggregation, sketches for filtering
Sketchguard Node 16:
  Model dim: 6,603,710 → Sketch size: 1000
  Compression ratio: 6603.7x
  Using model parameters for aggregation, sketches for filtering
Sketchguard Node 17:
  Model dim: 6,603,710 → Sketch size: 1000
  Compression ratio: 6603.7x
  Using model parameters for aggregation, sketches for filtering
Sketchguard Node 18:
  Model dim: 6,603,710 → Sketch size: 1000
  Compression ratio: 6603.7x
  Using model parameters for aggregation, sketches for filtering
Sketchguard Node 19:
  Model dim: 6,603,710 → Sketch size: 1000
  Compression ratio: 6603.7x
  Using model parameters for aggregation, sketches for filtering
Sketchguard ALGORITHM (Sketch-based Filtering + State Aggregation)
  - Model dimension: 6,603,710 parameters
  - Config: SketchguardConfig(gamma=2, kappa=1, alpha=0.5, min_neighbors=1, sketch_size=1000, network_seed=987654321, attack_detection_window=5)
  - Sketch size: 1000
  - Compression ratio: 6603.7x
  - Complexity: O(d + N×k) = O(6,603,710 + 20×1000)
  - Theoretical speedup vs BALANCE: 19.9x
Initial test acc across nodes: mean=0.0168 ± 0.0139
Round 001: test acc mean=0.4923 ± 0.0389 | min=0.4276 max=0.5874
         : test loss mean=3.7374 ± 0.0304
         : individual accs = ['0.541182', '0.490840', '0.541044', '0.441034', '0.480567', '0.587357', '0.487002', '0.512991', '0.479122', '0.427636', '0.478880', '0.522061', '0.442218', '0.469859', '0.517522', '0.510797', '0.433903', '0.510399', '0.481636', '0.490310']
         : correct/total = [(2234, 4128), (2063, 4203), (2208, 4081), (1911, 4333), (1966, 4091), (2518, 4287), (2042, 4193), (2231, 4349), (2008, 4191), (1829, 4277), (1984, 4143), (2189, 4193), (1810, 4093), (1972, 4197), (2097, 4052), (2058, 4029), (1802, 4153), (2135, 4183), (1967, 4084), (2024, 4128)]
         : compromised: 0.4995, honest: 0.4816
         : sketchguard stats = ['Node 0: acc_rate=0.438', 'Node 1: acc_rate=0.545', 'Node 2: acc_rate=0.417']...
Round 002: test acc mean=0.6636 ± 0.0230 | min=0.5977 max=0.7031
         : test loss mean=3.3165 ± 0.1158
         : individual accs = ['0.679021', '0.678563', '0.652291', '0.673206', '0.684918', '0.703056', '0.657763', '0.664751', '0.632069', '0.655600', '0.676563', '0.634629', '0.643049', '0.678342', '0.675469', '0.597667', '0.659523', '0.688023', '0.667973', '0.670300']
         : correct/total = [(2803, 4128), (2852, 4203), (2662, 4081), (2917, 4333), (2802, 4091), (3014, 4287), (2758, 4193), (2891, 4349), (2649, 4191), (2804, 4277), (2803, 4143), (2661, 4193), (2632, 4093), (2847, 4197), (2737, 4052), (2408, 4029), (2739, 4153), (2878, 4183), (2728, 4084), (2767, 4128)]
         : compromised: 0.6604, honest: 0.6686
         : sketchguard stats = ['Node 0: acc_rate=0.438', 'Node 1: acc_rate=0.545', 'Node 2: acc_rate=0.417']...
Round 003: test acc mean=0.6637 ± 0.0408 | min=0.5651 max=0.7255
         : test loss mean=2.7077 ± 0.2594
         : individual accs = ['0.702277', '0.683797', '0.617496', '0.698823', '0.725495', '0.655703', '0.678750', '0.697402', '0.626819', '0.701894', '0.698769', '0.583830', '0.659663', '0.633310', '0.664610', '0.658476', '0.651336', '0.565145', '0.667728', '0.702277']
         : correct/total = [(2899, 4128), (2874, 4203), (2520, 4081), (3028, 4333), (2968, 4091), (2811, 4287), (2846, 4193), (3033, 4349), (2627, 4191), (3002, 4277), (2895, 4143), (2448, 4193), (2700, 4093), (2658, 4197), (2693, 4052), (2653, 4029), (2705, 4153), (2364, 4183), (2727, 4084), (2899, 4128)]
         : compromised: 0.6429, honest: 0.6948
         : sketchguard stats = ['Node 0: acc_rate=0.438', 'Node 1: acc_rate=0.545', 'Node 2: acc_rate=0.417']...
Round 004: test acc mean=0.6935 ± 0.0287 | min=0.6371 max=0.7502
         : test loss mean=1.7945 ± 0.2363
         : individual accs = ['0.710029', '0.683084', '0.667728', '0.715670', '0.750183', '0.649405', '0.721679', '0.717636', '0.709854', '0.707505', '0.722182', '0.680420', '0.665038', '0.666667', '0.681639', '0.668900', '0.730315', '0.685871', '0.637120', '0.698886']
         : correct/total = [(2931, 4128), (2871, 4203), (2725, 4081), (3101, 4333), (3069, 4091), (2784, 4287), (3026, 4193), (3121, 4349), (2975, 4191), (3026, 4277), (2992, 4143), (2853, 4193), (2722, 4093), (2798, 4197), (2762, 4052), (2695, 4029), (3033, 4153), (2869, 4183), (2602, 4084), (2885, 4128)]
         : compromised: 0.6759, honest: 0.7198
         : sketchguard stats = ['Node 0: acc_rate=0.438', 'Node 1: acc_rate=0.545', 'Node 2: acc_rate=0.417']...
Round 005: test acc mean=0.7690 ± 0.0155 | min=0.7391 max=0.7952
         : test loss mean=0.9811 ± 0.1053
         : individual accs = ['0.780766', '0.748513', '0.771870', '0.765059', '0.795160', '0.775134', '0.771285', '0.794665', '0.768790', '0.792144', '0.776249', '0.746482', '0.759834', '0.757684', '0.767769', '0.739141', '0.785697', '0.763328', '0.751469', '0.769138']
         : correct/total = [(3223, 4128), (3146, 4203), (3150, 4081), (3315, 4333), (3253, 4091), (3323, 4287), (3234, 4193), (3456, 4349), (3222, 4191), (3388, 4277), (3216, 4143), (3130, 4193), (3110, 4093), (3180, 4197), (3111, 4052), (2978, 4029), (3263, 4153), (3193, 4183), (3069, 4084), (3175, 4128)]
         : compromised: 0.7596, honest: 0.7831
         : sketchguard stats = ['Node 0: acc_rate=0.438', 'Node 1: acc_rate=0.545', 'Node 2: acc_rate=0.417']...
Round 006: test acc mean=0.8110 ± 0.0064 | min=0.7982 max=0.8218
         : test loss mean=0.6426 ± 0.0291
         : individual accs = ['0.811531', '0.817511', '0.820142', '0.810755', '0.821804', '0.815722', '0.810875', '0.820648', '0.804820', '0.817162', '0.804490', '0.806821', '0.808698', '0.802478', '0.809724', '0.798213', '0.812425', '0.808511', '0.815132', '0.803052']
         : correct/total = [(3350, 4128), (3436, 4203), (3347, 4081), (3513, 4333), (3362, 4091), (3497, 4287), (3400, 4193), (3569, 4349), (3373, 4191), (3495, 4277), (3333, 4143), (3383, 4193), (3310, 4093), (3368, 4197), (3281, 4052), (3216, 4029), (3374, 4153), (3382, 4183), (3329, 4084), (3315, 4128)]
         : compromised: 0.8099, honest: 0.8127
         : sketchguard stats = ['Node 0: acc_rate=0.438', 'Node 1: acc_rate=0.545', 'Node 2: acc_rate=0.417']...
Round 007: test acc mean=0.8281 ± 0.0083 | min=0.8094 max=0.8418
         : test loss mean=0.5440 ± 0.0252
         : individual accs = ['0.827762', '0.829645', '0.837785', '0.829448', '0.840870', '0.831117', '0.825900', '0.841803', '0.826294', '0.836568', '0.817282', '0.821846', '0.833130', '0.827734', '0.823791', '0.809382', '0.832410', '0.814487', '0.833252', '0.820736']
         : correct/total = [(3417, 4128), (3487, 4203), (3419, 4081), (3594, 4333), (3440, 4091), (3563, 4287), (3463, 4193), (3661, 4349), (3463, 4191), (3578, 4277), (3386, 4143), (3446, 4193), (3410, 4093), (3474, 4197), (3338, 4052), (3261, 4029), (3457, 4153), (3407, 4183), (3403, 4084), (3388, 4128)]
         : compromised: 0.8265, honest: 0.8304
         : sketchguard stats = ['Node 0: acc_rate=0.438', 'Node 1: acc_rate=0.545', 'Node 2: acc_rate=0.417']...
Round 008: test acc mean=0.8376 ± 0.0072 | min=0.8223 max=0.8489
         : test loss mean=0.5022 ± 0.0241
         : individual accs = ['0.838178', '0.845824', '0.847831', '0.839141', '0.848937', '0.840215', '0.832101', '0.846172', '0.834884', '0.846855', '0.828144', '0.832578', '0.840704', '0.835120', '0.831194', '0.822288', '0.840116', '0.829787', '0.840842', '0.830184']
         : correct/total = [(3460, 4128), (3555, 4203), (3460, 4081), (3636, 4333), (3473, 4091), (3602, 4287), (3489, 4193), (3680, 4349), (3499, 4191), (3622, 4277), (3431, 4143), (3491, 4193), (3441, 4093), (3505, 4197), (3368, 4052), (3313, 4029), (3489, 4153), (3471, 4183), (3434, 4084), (3427, 4128)]
         : compromised: 0.8367, honest: 0.8388
         : sketchguard stats = ['Node 0: acc_rate=0.438', 'Node 1: acc_rate=0.545', 'Node 2: acc_rate=0.417']...
Round 009: test acc mean=0.8436 ± 0.0076 | min=0.8319 max=0.8584
         : test loss mean=0.4774 ± 0.0215
         : individual accs = ['0.837936', '0.850345', '0.855183', '0.849065', '0.852114', '0.848845', '0.831863', '0.858358', '0.841565', '0.849427', '0.835385', '0.835679', '0.845101', '0.842745', '0.839585', '0.832713', '0.848062', '0.836959', '0.845495', '0.834787']
         : correct/total = [(3459, 4128), (3574, 4203), (3490, 4081), (3679, 4333), (3486, 4091), (3639, 4287), (3488, 4193), (3733, 4349), (3527, 4191), (3633, 4277), (3461, 4143), (3504, 4193), (3459, 4093), (3537, 4197), (3402, 4052), (3355, 4029), (3522, 4153), (3501, 4183), (3453, 4084), (3446, 4128)]
         : compromised: 0.8436, honest: 0.8435
         : sketchguard stats = ['Node 0: acc_rate=0.438', 'Node 1: acc_rate=0.545', 'Node 2: acc_rate=0.417']...
Round 010: test acc mean=0.8470 ± 0.0073 | min=0.8331 max=0.8581
         : test loss mean=0.4622 ± 0.0221
         : individual accs = ['0.845203', '0.851535', '0.856408', '0.849065', '0.856270', '0.850478', '0.836871', '0.858128', '0.847530', '0.851765', '0.838523', '0.837109', '0.851698', '0.849178', '0.844274', '0.837429', '0.851914', '0.840306', '0.853575', '0.833091']
         : correct/total = [(3489, 4128), (3579, 4203), (3495, 4081), (3679, 4333), (3503, 4091), (3646, 4287), (3509, 4193), (3732, 4349), (3552, 4191), (3643, 4277), (3474, 4143), (3510, 4193), (3486, 4093), (3564, 4197), (3421, 4052), (3374, 4029), (3538, 4153), (3515, 4183), (3486, 4084), (3439, 4128)]
         : compromised: 0.8474, honest: 0.8465
         : sketchguard stats = ['Node 0: acc_rate=0.438', 'Node 1: acc_rate=0.545', 'Node 2: acc_rate=0.417']...

=== FINAL RESULTS ===
Dataset: femnist, Nodes: 20, Graph: erdos, Aggregation: sketchguard
Attack: krum, 60.0% compromised
Final accuracy - Compromised: 0.8474, Honest: 0.8465
Overall test accuracy: mean=0.8470 ± 0.0073

=== Sketchguard SUMMARY ===
Node 0: acceptance=0.438
Node 1: acceptance=0.545
Node 2: acceptance=0.417
Node 3: acceptance=0.500
Node 4: acceptance=0.455
Node 5: acceptance=0.400
Node 6: acceptance=0.357
Node 7: acceptance=0.357
Node 8: acceptance=0.300
Node 9: acceptance=0.462
Node 10: acceptance=0.444
Node 11: acceptance=0.429
Node 12: acceptance=0.500
Node 13: acceptance=0.385
Node 14: acceptance=0.400
Node 15: acceptance=0.364
Node 16: acceptance=0.308
Node 17: acceptance=0.667
Node 18: acceptance=0.438
Node 19: acceptance=0.375

=== PARALLEL EXECUTION TIME (realistic for distributed system) ===
  COMMUNICATION (max across nodes):
    - Sketch transfer: 0.000s (0.0%)
    - Model fetch (accepted): 0.000s (0.0%)
  COMPUTATION (max across nodes):
    - Sketching: 3.268s (99.5%)
    - Filtering: 0.002s (0.1%)
    - Aggregation: 0.016s (0.5%)
  TOTALS:
    - Total computation: 3.286s (100.0%)
    - Total communication: 0.000s (0.0%)
    - Total parallel time: 3.286s

=== PER-NODE AVERAGE TIME ===
  - Sketching: 2.557s
  - Filtering: 0.001s
  - Aggregation: 0.013s
  - Sketch transfer: 0.000s
  - Model fetch: 0.000s
  - Total per node: 2.571s

=== TOTAL COMPUTATIONAL WORK (sum across all nodes) ===
  - Total sketching: 51.149s
  - Total filtering: 0.022s
  - Total aggregation: 0.251s
  - Total sketch transfer: 0.000s
  - Total model fetch: 0.000s
  - Grand total: 51.422s
  - Mean acceptance rate: 0.427

Sketchguard Algorithm Properties:
  - Original dimension: 6,603,710
  - Sketch size: 1000
  - Compression ratio: 19.9x
  - Single repetition: No repetitions needed
  - Theoretical complexity: O(d + N×k)
  - Approach: Sketch filtering + state aggregation
