Device: cuda
Seed: 987654321
Loading 36 LEAF FEMNIST train files...
LEAF FEMNIST train: 3597 users, 734463 samples
Loading 36 LEAF FEMNIST test files...
LEAF FEMNIST test: 3597 users, 83388 samples
Found 3597 train users, 3597 test users, 3597 common users
User sample counts range: 525 (max) to 17 (min)
Distributed ALL 3597 users across 20 clients
Users per client: 179 (with 17 clients getting +1 user)
Train partition sizes: [36360, 37070, 35957, 38262, 36024, 37732, 36921, 38328, 36867, 37683, 36507, 36915, 36007, 37001, 35681, 35453, 36585, 36801, 35964, 36345]
Test partition sizes: [4128, 4203, 4081, 4333, 4091, 4287, 4193, 4349, 4191, 4277, 4143, 4193, 4093, 4197, 4052, 4029, 4153, 4183, 4084, 4128]
  Client 0: 36360 train samples, 62 unique classes
  Client 1: 37070 train samples, 62 unique classes
  Client 2: 35957 train samples, 62 unique classes
  Client 3: 38262 train samples, 62 unique classes
  Client 4: 36024 train samples, 62 unique classes
  Client 5: 37732 train samples, 62 unique classes
  Client 6: 36921 train samples, 62 unique classes
  Client 7: 38328 train samples, 62 unique classes
  Client 8: 36867 train samples, 62 unique classes
  Client 9: 37683 train samples, 62 unique classes
  Client 10: 36507 train samples, 62 unique classes
  Client 11: 36915 train samples, 62 unique classes
  Client 12: 36007 train samples, 62 unique classes
  Client 13: 37001 train samples, 62 unique classes
  Client 14: 35681 train samples, 62 unique classes
  Client 15: 35453 train samples, 62 unique classes
  Client 16: 36585 train samples, 62 unique classes
  Client 17: 36801 train samples, 62 unique classes
  Client 18: 35964 train samples, 62 unique classes
  Client 19: 36345 train samples, 62 unique classes
Will sample 10000 samples per client per epoch
Graph: erdos, nodes: 20, edges: 99
Degree statistics: avg=9.90, min=7, max=14
Attack: Compromised 10/20 nodes: [1, 2, 5, 11, 12, 13, 14, 15, 17, 18]
Attack type: krum, lambda: 1.0
Model variant: baseline
Model parameters: 6,603,710
Sketchguard Node 0:
  Model dim: 6,603,710 → Sketch size: 1000
  Compression ratio: 6603.7x
  Using model parameters for aggregation, sketches for filtering
Sketchguard Node 1:
  Model dim: 6,603,710 → Sketch size: 1000
  Compression ratio: 6603.7x
  Using model parameters for aggregation, sketches for filtering
Sketchguard Node 2:
  Model dim: 6,603,710 → Sketch size: 1000
  Compression ratio: 6603.7x
  Using model parameters for aggregation, sketches for filtering
Sketchguard Node 3:
  Model dim: 6,603,710 → Sketch size: 1000
  Compression ratio: 6603.7x
  Using model parameters for aggregation, sketches for filtering
Sketchguard Node 4:
  Model dim: 6,603,710 → Sketch size: 1000
  Compression ratio: 6603.7x
  Using model parameters for aggregation, sketches for filtering
Sketchguard Node 5:
  Model dim: 6,603,710 → Sketch size: 1000
  Compression ratio: 6603.7x
  Using model parameters for aggregation, sketches for filtering
Sketchguard Node 6:
  Model dim: 6,603,710 → Sketch size: 1000
  Compression ratio: 6603.7x
  Using model parameters for aggregation, sketches for filtering
Sketchguard Node 7:
  Model dim: 6,603,710 → Sketch size: 1000
  Compression ratio: 6603.7x
  Using model parameters for aggregation, sketches for filtering
Sketchguard Node 8:
  Model dim: 6,603,710 → Sketch size: 1000
  Compression ratio: 6603.7x
  Using model parameters for aggregation, sketches for filtering
Sketchguard Node 9:
  Model dim: 6,603,710 → Sketch size: 1000
  Compression ratio: 6603.7x
  Using model parameters for aggregation, sketches for filtering
Sketchguard Node 10:
  Model dim: 6,603,710 → Sketch size: 1000
  Compression ratio: 6603.7x
  Using model parameters for aggregation, sketches for filtering
Sketchguard Node 11:
  Model dim: 6,603,710 → Sketch size: 1000
  Compression ratio: 6603.7x
  Using model parameters for aggregation, sketches for filtering
Sketchguard Node 12:
  Model dim: 6,603,710 → Sketch size: 1000
  Compression ratio: 6603.7x
  Using model parameters for aggregation, sketches for filtering
Sketchguard Node 13:
  Model dim: 6,603,710 → Sketch size: 1000
  Compression ratio: 6603.7x
  Using model parameters for aggregation, sketches for filtering
Sketchguard Node 14:
  Model dim: 6,603,710 → Sketch size: 1000
  Compression ratio: 6603.7x
  Using model parameters for aggregation, sketches for filtering
Sketchguard Node 15:
  Model dim: 6,603,710 → Sketch size: 1000
  Compression ratio: 6603.7x
  Using model parameters for aggregation, sketches for filtering
Sketchguard Node 16:
  Model dim: 6,603,710 → Sketch size: 1000
  Compression ratio: 6603.7x
  Using model parameters for aggregation, sketches for filtering
Sketchguard Node 17:
  Model dim: 6,603,710 → Sketch size: 1000
  Compression ratio: 6603.7x
  Using model parameters for aggregation, sketches for filtering
Sketchguard Node 18:
  Model dim: 6,603,710 → Sketch size: 1000
  Compression ratio: 6603.7x
  Using model parameters for aggregation, sketches for filtering
Sketchguard Node 19:
  Model dim: 6,603,710 → Sketch size: 1000
  Compression ratio: 6603.7x
  Using model parameters for aggregation, sketches for filtering
Sketchguard ALGORITHM (Sketch-based Filtering + State Aggregation)
  - Model dimension: 6,603,710 parameters
  - Config: SketchguardConfig(gamma=2, kappa=1, alpha=0.5, min_neighbors=1, sketch_size=1000, network_seed=987654321, attack_detection_window=5)
  - Sketch size: 1000
  - Compression ratio: 6603.7x
  - Complexity: O(d + N×k) = O(6,603,710 + 20×1000)
  - Theoretical speedup vs BALANCE: 19.9x
Initial test acc across nodes: mean=0.0162 ± 0.0138
Round 001: test acc mean=0.4666 ± 0.0372 | min=0.4193 max=0.5409
         : test loss mean=3.7618 ± 0.0317
         : individual accs = ['0.533188', '0.473233', '0.484685', '0.451881', '0.441701', '0.540938', '0.423325', '0.420556', '0.460988', '0.429273', '0.419261', '0.517529', '0.446860', '0.436741', '0.477542', '0.492926', '0.444739', '0.525221', '0.459109', '0.452519']
         : correct/total = [(2201, 4128), (1989, 4203), (1978, 4081), (1958, 4333), (1807, 4091), (2319, 4287), (1775, 4193), (1829, 4349), (1932, 4191), (1836, 4277), (1737, 4143), (2170, 4193), (1829, 4093), (1833, 4197), (1935, 4052), (1986, 4029), (1847, 4153), (2197, 4183), (1875, 4084), (1868, 4128)]
         : compromised: 0.4855, honest: 0.4477
         : sketchguard stats = ['Node 0: acc_rate=0.500', 'Node 1: acc_rate=0.500', 'Node 2: acc_rate=0.500']...
Round 002: test acc mean=0.6730 ± 0.0244 | min=0.6036 max=0.7094
         : test loss mean=3.2354 ± 0.2267
         : individual accs = ['0.703004', '0.675232', '0.644450', '0.701592', '0.664385', '0.709354', '0.603625', '0.675788', '0.669530', '0.706570', '0.676804', '0.681851', '0.682385', '0.660472', '0.697187', '0.651030', '0.666988', '0.650968', '0.674094', '0.664244']
         : correct/total = [(2902, 4128), (2838, 4203), (2630, 4081), (3040, 4333), (2718, 4091), (3041, 4287), (2531, 4193), (2939, 4349), (2806, 4191), (3022, 4277), (2804, 4143), (2859, 4193), (2793, 4093), (2772, 4197), (2825, 4052), (2623, 4029), (2770, 4153), (2723, 4183), (2753, 4084), (2742, 4128)]
         : compromised: 0.6727, honest: 0.6733
         : sketchguard stats = ['Node 0: acc_rate=0.500', 'Node 1: acc_rate=0.500', 'Node 2: acc_rate=0.500']...
Round 003: test acc mean=0.6923 ± 0.0338 | min=0.6229 max=0.7445
         : test loss mean=2.6283 ± 0.4423
         : individual accs = ['0.738614', '0.680228', '0.622887', '0.744519', '0.691274', '0.662934', '0.725972', '0.719016', '0.722501', '0.720599', '0.705527', '0.680181', '0.687271', '0.673576', '0.688302', '0.625714', '0.720202', '0.645948', '0.679971', '0.710756']
         : correct/total = [(3049, 4128), (2859, 4203), (2542, 4081), (3226, 4333), (2828, 4091), (2842, 4287), (3044, 4193), (3127, 4349), (3028, 4191), (3082, 4277), (2923, 4143), (2852, 4193), (2813, 4093), (2827, 4197), (2789, 4052), (2521, 4029), (2991, 4153), (2702, 4183), (2777, 4084), (2934, 4128)]
         : compromised: 0.6647, honest: 0.7199
         : sketchguard stats = ['Node 0: acc_rate=0.500', 'Node 1: acc_rate=0.500', 'Node 2: acc_rate=0.500']...
Round 004: test acc mean=0.7184 ± 0.0386 | min=0.6235 max=0.7752
         : test loss mean=1.8245 ± 0.4190
         : individual accs = ['0.749031', '0.679753', '0.685861', '0.748211', '0.762894', '0.684161', '0.746482', '0.759715', '0.775233', '0.754501', '0.700217', '0.668972', '0.623504', '0.715273', '0.706565', '0.714569', '0.768601', '0.696868', '0.702008', '0.726017']
         : correct/total = [(3092, 4128), (2857, 4203), (2799, 4081), (3242, 4333), (3121, 4091), (2933, 4287), (3130, 4193), (3304, 4349), (3249, 4191), (3227, 4277), (2901, 4143), (2805, 4193), (2552, 4093), (3002, 4197), (2863, 4052), (2879, 4029), (3192, 4153), (2915, 4183), (2867, 4084), (2997, 4128)]
         : compromised: 0.6878, honest: 0.7491
         : sketchguard stats = ['Node 0: acc_rate=0.500', 'Node 1: acc_rate=0.500', 'Node 2: acc_rate=0.500']...
Round 005: test acc mean=0.7567 ± 0.0278 | min=0.7048 max=0.7991
         : test loss mean=1.1488 ± 0.2251
         : individual accs = ['0.767926', '0.706162', '0.759373', '0.771521', '0.770716', '0.764637', '0.766277', '0.787307', '0.799093', '0.791443', '0.746802', '0.720964', '0.717811', '0.733143', '0.747038', '0.761727', '0.798459', '0.704757', '0.748776', '0.769380']
         : correct/total = [(3170, 4128), (2968, 4203), (3099, 4081), (3343, 4333), (3153, 4091), (3278, 4287), (3213, 4193), (3424, 4349), (3349, 4191), (3385, 4277), (3094, 4143), (3023, 4193), (2938, 4093), (3077, 4197), (3027, 4052), (3069, 4029), (3316, 4153), (2948, 4183), (3058, 4084), (3176, 4128)]
         : compromised: 0.7364, honest: 0.7769
         : sketchguard stats = ['Node 0: acc_rate=0.500', 'Node 1: acc_rate=0.500', 'Node 2: acc_rate=0.500']...
Round 006: test acc mean=0.8014 ± 0.0100 | min=0.7806 max=0.8184
         : test loss mean=0.7482 ± 0.0737
         : individual accs = ['0.794089', '0.790626', '0.801764', '0.812601', '0.798827', '0.799394', '0.802290', '0.817889', '0.810308', '0.810849', '0.797007', '0.801097', '0.780601', '0.801287', '0.812192', '0.806900', '0.818444', '0.786995', '0.790157', '0.795300']
         : correct/total = [(3278, 4128), (3323, 4203), (3272, 4081), (3521, 4333), (3268, 4091), (3427, 4287), (3364, 4193), (3557, 4349), (3396, 4191), (3468, 4277), (3302, 4143), (3359, 4193), (3195, 4093), (3363, 4197), (3291, 4052), (3251, 4029), (3399, 4153), (3292, 4183), (3227, 4084), (3283, 4128)]
         : compromised: 0.7971, honest: 0.8058
         : sketchguard stats = ['Node 0: acc_rate=0.500', 'Node 1: acc_rate=0.500', 'Node 2: acc_rate=0.500']...
Round 007: test acc mean=0.8217 ± 0.0069 | min=0.8107 max=0.8347
         : test loss mean=0.5952 ± 0.0350
         : individual accs = ['0.814196', '0.827742', '0.820142', '0.828987', '0.813493', '0.817821', '0.823515', '0.834675', '0.830828', '0.822539', '0.813662', '0.822800', '0.811630', '0.824875', '0.826259', '0.825763', '0.830002', '0.810662', '0.820029', '0.814922']
         : correct/total = [(3361, 4128), (3479, 4203), (3347, 4081), (3592, 4333), (3328, 4091), (3506, 4287), (3453, 4193), (3630, 4349), (3482, 4191), (3518, 4277), (3371, 4143), (3450, 4193), (3322, 4093), (3462, 4197), (3348, 4052), (3327, 4029), (3447, 4153), (3391, 4183), (3349, 4084), (3364, 4128)]
         : compromised: 0.8208, honest: 0.8227
         : sketchguard stats = ['Node 0: acc_rate=0.500', 'Node 1: acc_rate=0.500', 'Node 2: acc_rate=0.500']...
Round 008: test acc mean=0.8282 ± 0.0071 | min=0.8074 max=0.8381
         : test loss mean=0.5370 ± 0.0238
         : individual accs = ['0.824612', '0.827980', '0.821122', '0.835449', '0.823759', '0.833916', '0.832817', '0.837434', '0.826533', '0.833294', '0.822110', '0.833771', '0.820181', '0.829402', '0.838105', '0.833954', '0.826391', '0.825245', '0.829579', '0.807413']
         : correct/total = [(3404, 4128), (3480, 4203), (3351, 4081), (3620, 4333), (3370, 4091), (3575, 4287), (3492, 4193), (3642, 4349), (3464, 4191), (3564, 4277), (3406, 4143), (3496, 4193), (3357, 4093), (3481, 4197), (3396, 4052), (3360, 4029), (3432, 4153), (3452, 4183), (3388, 4084), (3333, 4128)]
         : compromised: 0.8293, honest: 0.8270
         : sketchguard stats = ['Node 0: acc_rate=0.500', 'Node 1: acc_rate=0.500', 'Node 2: acc_rate=0.500']...
Round 009: test acc mean=0.8390 ± 0.0051 | min=0.8277 max=0.8464
         : test loss mean=0.4955 ± 0.0172
         : individual accs = ['0.832122', '0.844397', '0.839255', '0.840526', '0.827670', '0.839981', '0.844264', '0.845022', '0.846337', '0.846388', '0.834902', '0.836394', '0.836795', '0.839647', '0.842300', '0.843137', '0.831447', '0.835764', '0.837169', '0.835756']
         : correct/total = [(3435, 4128), (3549, 4203), (3425, 4081), (3642, 4333), (3386, 4091), (3601, 4287), (3540, 4193), (3675, 4349), (3547, 4191), (3620, 4277), (3459, 4143), (3507, 4193), (3425, 4093), (3524, 4197), (3413, 4052), (3397, 4029), (3453, 4153), (3496, 4183), (3419, 4084), (3450, 4128)]
         : compromised: 0.8395, honest: 0.8384
         : sketchguard stats = ['Node 0: acc_rate=0.500', 'Node 1: acc_rate=0.500', 'Node 2: acc_rate=0.500']...
Round 010: test acc mean=0.8457 ± 0.0052 | min=0.8352 max=0.8534
         : test loss mean=0.4749 ± 0.0187
         : individual accs = ['0.839390', '0.853438', '0.842686', '0.850450', '0.835248', '0.843480', '0.849511', '0.848701', '0.849201', '0.848726', '0.836109', '0.842118', '0.841681', '0.850369', '0.849210', '0.852072', '0.841079', '0.848673', '0.848188', '0.842781']
         : correct/total = [(3465, 4128), (3587, 4203), (3439, 4081), (3685, 4333), (3417, 4091), (3616, 4287), (3562, 4193), (3691, 4349), (3559, 4191), (3630, 4277), (3464, 4143), (3531, 4193), (3445, 4093), (3569, 4197), (3441, 4052), (3433, 4029), (3493, 4153), (3550, 4183), (3464, 4084), (3479, 4128)]
         : compromised: 0.8472, honest: 0.8441
         : sketchguard stats = ['Node 0: acc_rate=0.500', 'Node 1: acc_rate=0.500', 'Node 2: acc_rate=0.500']...

=== FINAL RESULTS ===
Dataset: femnist, Nodes: 20, Graph: erdos, Aggregation: sketchguard
Attack: krum, 50.0% compromised
Final accuracy - Compromised: 0.8472, Honest: 0.8441
Overall test accuracy: mean=0.8457 ± 0.0052

=== Sketchguard SUMMARY ===
Node 0: acceptance=0.500
Node 1: acceptance=0.500
Node 2: acceptance=0.500
Node 3: acceptance=0.571
Node 4: acceptance=0.333
Node 5: acceptance=0.500
Node 6: acceptance=0.417
Node 7: acceptance=0.364
Node 8: acceptance=0.286
Node 9: acceptance=0.636
Node 10: acceptance=0.625
Node 11: acceptance=0.417
Node 12: acceptance=0.583
Node 13: acceptance=0.556
Node 14: acceptance=0.429
Node 15: acceptance=0.444
Node 16: acceptance=0.286
Node 17: acceptance=0.625
Node 18: acceptance=0.500
Node 19: acceptance=0.400

=== PARALLEL EXECUTION TIME (realistic for distributed system) ===
  COMMUNICATION (max across nodes):
    - Sketch transfer: 0.000s (0.0%)
    - Model fetch (accepted): 0.000s (0.0%)
  COMPUTATION (max across nodes):
    - Sketching: 3.196s (99.2%)
    - Filtering: 0.001s (0.0%)
    - Aggregation: 0.026s (0.8%)
  TOTALS:
    - Total computation: 3.223s (100.0%)
    - Total communication: 0.000s (0.0%)
    - Total parallel time: 3.223s

=== PER-NODE AVERAGE TIME ===
  - Sketching: 2.312s
  - Filtering: 0.001s
  - Aggregation: 0.015s
  - Sketch transfer: 0.000s
  - Model fetch: 0.000s
  - Total per node: 2.327s

=== TOTAL COMPUTATIONAL WORK (sum across all nodes) ===
  - Total sketching: 46.233s
  - Total filtering: 0.018s
  - Total aggregation: 0.294s
  - Total sketch transfer: 0.000s
  - Total model fetch: 0.000s
  - Grand total: 46.545s
  - Mean acceptance rate: 0.474

Sketchguard Algorithm Properties:
  - Original dimension: 6,603,710
  - Sketch size: 1000
  - Compression ratio: 19.9x
  - Single repetition: No repetitions needed
  - Theoretical complexity: O(d + N×k)
  - Approach: Sketch filtering + state aggregation
