Device: cuda
Seed: 987654321
Loading 36 LEAF FEMNIST train files...
LEAF FEMNIST train: 3597 users, 734463 samples
Loading 36 LEAF FEMNIST test files...
LEAF FEMNIST test: 3597 users, 83388 samples
Found 3597 train users, 3597 test users, 3597 common users
User sample counts range: 525 (max) to 17 (min)
Distributed ALL 3597 users across 20 clients
Users per client: 179 (with 17 clients getting +1 user)
Train partition sizes: [36360, 37070, 35957, 38262, 36024, 37732, 36921, 38328, 36867, 37683, 36507, 36915, 36007, 37001, 35681, 35453, 36585, 36801, 35964, 36345]
Test partition sizes: [4128, 4203, 4081, 4333, 4091, 4287, 4193, 4349, 4191, 4277, 4143, 4193, 4093, 4197, 4052, 4029, 4153, 4183, 4084, 4128]
  Client 0: 36360 train samples, 62 unique classes
  Client 1: 37070 train samples, 62 unique classes
  Client 2: 35957 train samples, 62 unique classes
  Client 3: 38262 train samples, 62 unique classes
  Client 4: 36024 train samples, 62 unique classes
  Client 5: 37732 train samples, 62 unique classes
  Client 6: 36921 train samples, 62 unique classes
  Client 7: 38328 train samples, 62 unique classes
  Client 8: 36867 train samples, 62 unique classes
  Client 9: 37683 train samples, 62 unique classes
  Client 10: 36507 train samples, 62 unique classes
  Client 11: 36915 train samples, 62 unique classes
  Client 12: 36007 train samples, 62 unique classes
  Client 13: 37001 train samples, 62 unique classes
  Client 14: 35681 train samples, 62 unique classes
  Client 15: 35453 train samples, 62 unique classes
  Client 16: 36585 train samples, 62 unique classes
  Client 17: 36801 train samples, 62 unique classes
  Client 18: 35964 train samples, 62 unique classes
  Client 19: 36345 train samples, 62 unique classes
Will sample 10000 samples per client per epoch
Graph: erdos, nodes: 20, edges: 99
Degree statistics: avg=9.90, min=7, max=14
Attack: Compromised 6/20 nodes: [5, 12, 13, 14, 17, 18]
Attack type: backdoor, lambda: 1.0
Backdoor target label: 0, trigger size: 4
Model variant: baseline
Model parameters: 6,603,710
Initial test acc across nodes: mean=0.0162 ± 0.0138
Backdoor attack: Created poisoned datasets for 6 compromised nodes
Round 001: test acc mean=0.5268 ± 0.1203 | min=0.0055 max=0.5776
         : test loss mean=25224.8398 ± 109945.2634
         : individual accs = ['0.553779', '0.564121', '0.546190', '0.555504', '0.553899', '0.577560', '0.552111', '0.566337', '0.005488', '0.540566', '0.535602', '0.548056', '0.553872', '0.568978', '0.566140', '0.554480', '0.533590', '0.558929', '0.573213', '0.527616']
         : correct/total = [(2286, 4128), (2371, 4203), (2229, 4081), (2407, 4333), (2266, 4091), (2476, 4287), (2315, 4193), (2463, 4349), (23, 4191), (2312, 4277), (2219, 4143), (2298, 4193), (2267, 4093), (2388, 4197), (2294, 4052), (2234, 4029), (2216, 4153), (2338, 4183), (2341, 4084), (2178, 4128)]
         : compromised: 0.5664, honest: 0.5098
Round 002: test acc mean=0.5278 ± 0.3120 | min=0.0474 max=0.7435
         : test loss mean=nan ± nan
         : individual accs = ['0.712694', '0.743517', '0.722127', '0.734364', '0.735273', '0.052484', '0.742666', '0.730743', '0.051062', '0.733926', '0.732561', '0.729549', '0.047398', '0.047653', '0.054788', '0.735666', '0.722369', '0.739182', '0.054358', '0.733527']
         : correct/total = [(2942, 4128), (3125, 4203), (2947, 4081), (3182, 4333), (3008, 4091), (225, 4287), (3114, 4193), (3178, 4349), (214, 4191), (3139, 4277), (3035, 4143), (3059, 4193), (194, 4093), (200, 4197), (222, 4052), (2964, 4029), (3000, 4153), (3092, 4183), (222, 4084), (3028, 4128)]
         : compromised: 0.1660, honest: 0.6829
Round 003: test acc mean=0.5577 ± 0.3316 | min=0.0474 max=0.7896
         : test loss mean=nan ± nan
         : individual accs = ['0.773014', '0.768499', '0.788042', '0.786291', '0.771450', '0.052484', '0.775101', '0.778340', '0.051062', '0.789572', '0.762974', '0.763892', '0.047398', '0.047653', '0.054788', '0.778605', '0.773417', '0.771456', '0.054358', '0.765746']
         : correct/total = [(3191, 4128), (3230, 4203), (3216, 4081), (3407, 4333), (3156, 4091), (225, 4287), (3250, 4193), (3385, 4349), (214, 4191), (3377, 4277), (3161, 4143), (3203, 4193), (194, 4093), (200, 4197), (222, 4052), (3137, 4029), (3212, 4153), (3227, 4183), (222, 4084), (3161, 4128)]
         : compromised: 0.1714, honest: 0.7233
Round 004: test acc mean=0.5726 ± 0.3413 | min=0.0474 max=0.8099
         : test loss mean=nan ± nan
         : individual accs = ['0.800145', '0.787771', '0.780201', '0.798523', '0.795405', '0.052484', '0.799189', '0.789147', '0.051062', '0.809913', '0.783490', '0.792750', '0.047398', '0.047653', '0.054788', '0.803425', '0.790994', '0.803968', '0.054358', '0.808866']
         : correct/total = [(3303, 4128), (3311, 4203), (3184, 4081), (3460, 4333), (3254, 4091), (225, 4287), (3351, 4193), (3432, 4349), (214, 4191), (3464, 4277), (3246, 4143), (3324, 4193), (194, 4093), (200, 4197), (222, 4052), (3237, 4029), (3285, 4153), (3363, 4183), (222, 4084), (3339, 4128)]
         : compromised: 0.1768, honest: 0.7422
Round 005: test acc mean=0.5847 ± 0.3492 | min=0.0474 max=0.8216
         : test loss mean=nan ± nan
         : individual accs = ['0.810804', '0.817749', '0.814016', '0.810293', '0.813493', '0.052484', '0.817792', '0.821568', '0.051062', '0.809446', '0.815110', '0.815884', '0.047398', '0.047653', '0.054788', '0.818317', '0.793402', '0.814009', '0.054358', '0.813711']
         : correct/total = [(3347, 4128), (3437, 4203), (3322, 4081), (3511, 4333), (3328, 4091), (225, 4287), (3429, 4193), (3573, 4349), (214, 4191), (3462, 4277), (3377, 4143), (3421, 4193), (194, 4093), (200, 4197), (222, 4052), (3297, 4029), (3295, 4153), (3405, 4183), (222, 4084), (3359, 4128)]
         : compromised: 0.1784, honest: 0.7588
Round 006: test acc mean=0.5843 ± 0.3490 | min=0.0474 max=0.8351
         : test loss mean=nan ± nan
         : individual accs = ['0.809835', '0.808708', '0.795148', '0.817447', '0.814960', '0.052484', '0.813260', '0.817889', '0.051062', '0.820669', '0.804731', '0.799905', '0.047398', '0.047653', '0.054788', '0.822040', '0.835059', '0.803729', '0.054358', '0.814438']
         : correct/total = [(3343, 4128), (3399, 4203), (3245, 4081), (3542, 4333), (3334, 4091), (225, 4287), (3410, 4193), (3557, 4349), (214, 4191), (3510, 4277), (3334, 4143), (3354, 4193), (194, 4093), (200, 4197), (222, 4052), (3312, 4029), (3468, 4153), (3362, 4183), (222, 4084), (3362, 4128)]
         : compromised: 0.1767, honest: 0.7589
Round 007: test acc mean=0.5941 ± 0.3554 | min=0.0474 max=0.8451
         : test loss mean=nan ± nan
         : individual accs = ['0.830184', '0.845111', '0.833129', '0.831064', '0.824004', '0.052484', '0.836155', '0.820878', '0.051062', '0.827215', '0.812696', '0.815407', '0.047398', '0.047653', '0.054788', '0.820303', '0.833373', '0.822615', '0.054358', '0.822674']
         : correct/total = [(3427, 4128), (3552, 4203), (3400, 4081), (3601, 4333), (3371, 4091), (225, 4287), (3506, 4193), (3570, 4349), (214, 4191), (3538, 4277), (3367, 4143), (3419, 4193), (194, 4093), (200, 4197), (222, 4052), (3305, 4029), (3461, 4153), (3441, 4183), (222, 4084), (3396, 4128)]
         : compromised: 0.1799, honest: 0.7717
Round 008: test acc mean=0.5943 ± 0.3556 | min=0.0474 max=0.8384
         : test loss mean=nan ± nan
         : individual accs = ['0.824855', '0.838449', '0.834599', '0.828756', '0.831826', '0.052484', '0.825900', '0.838354', '0.051062', '0.836801', '0.809317', '0.831863', '0.047398', '0.047653', '0.054788', '0.833706', '0.818204', '0.829309', '0.054358', '0.795543']
         : correct/total = [(3405, 4128), (3524, 4203), (3406, 4081), (3591, 4333), (3403, 4091), (225, 4287), (3463, 4193), (3646, 4349), (214, 4191), (3579, 4277), (3353, 4143), (3488, 4193), (194, 4093), (200, 4197), (222, 4052), (3359, 4029), (3398, 4153), (3469, 4183), (222, 4084), (3284, 4128)]
         : compromised: 0.1810, honest: 0.7714
Round 009: test acc mean=0.5981 ± 0.3580 | min=0.0474 max=0.8488
         : test loss mean=nan ± nan
         : individual accs = ['0.822917', '0.823697', '0.833864', '0.827141', '0.834026', '0.052484', '0.848796', '0.837434', '0.051062', '0.831658', '0.839488', '0.826377', '0.047398', '0.047653', '0.054788', '0.832713', '0.834337', '0.830504', '0.054358', '0.831880']
         : correct/total = [(3397, 4128), (3462, 4203), (3403, 4081), (3584, 4333), (3412, 4091), (225, 4287), (3559, 4193), (3642, 4349), (214, 4191), (3557, 4277), (3478, 4143), (3465, 4193), (194, 4093), (200, 4197), (222, 4052), (3355, 4029), (3465, 4153), (3474, 4183), (222, 4084), (3434, 4128)]
         : compromised: 0.1812, honest: 0.7768
Round 010: test acc mean=0.5976 ± 0.3577 | min=0.0474 max=0.8426
         : test loss mean=nan ± nan
         : individual accs = ['0.830911', '0.834642', '0.827738', '0.836834', '0.828648', '0.052484', '0.842595', '0.834445', '0.051062', '0.838672', '0.813662', '0.828047', '0.047398', '0.047653', '0.054788', '0.834698', '0.832410', '0.836959', '0.054358', '0.824128']
         : correct/total = [(3430, 4128), (3508, 4203), (3378, 4081), (3626, 4333), (3390, 4091), (225, 4287), (3533, 4193), (3629, 4349), (214, 4191), (3587, 4277), (3371, 4143), (3472, 4193), (194, 4093), (200, 4197), (222, 4052), (3363, 4029), (3457, 4153), (3501, 4183), (222, 4084), (3402, 4128)]
         : compromised: 0.1823, honest: 0.7756

=== FINAL RESULTS ===
Dataset: femnist, Nodes: 20, Graph: erdos, Aggregation: krum
Attack: backdoor, 30.0% compromised
Final accuracy - Compromised: 0.1823, Honest: 0.7756
Overall test accuracy: mean=0.5976 ± 0.3577

=== BACKDOOR ATTACK SUCCESS RATE (ASR) ===
Target label: 0
Trigger size: 4x4
Overall ASR: 0.3360 ± 0.4348
Honest nodes ASR: 0.1190 ± 0.2444
Compromised nodes ASR: 0.8421 ± 0.3531
Note: Higher ASR indicates more successful backdoor attack
