Device: cuda
Seed: 987654321
Loading 36 LEAF FEMNIST train files...
LEAF FEMNIST train: 3597 users, 734463 samples
Loading 36 LEAF FEMNIST test files...
LEAF FEMNIST test: 3597 users, 83388 samples
Found 3597 train users, 3597 test users, 3597 common users
User sample counts range: 525 (max) to 17 (min)
Distributed ALL 3597 users across 20 clients
Users per client: 179 (with 17 clients getting +1 user)
Train partition sizes: [36360, 37070, 35957, 38262, 36024, 37732, 36921, 38328, 36867, 37683, 36507, 36915, 36007, 37001, 35681, 35453, 36585, 36801, 35964, 36345]
Test partition sizes: [4128, 4203, 4081, 4333, 4091, 4287, 4193, 4349, 4191, 4277, 4143, 4193, 4093, 4197, 4052, 4029, 4153, 4183, 4084, 4128]
  Client 0: 36360 train samples, 62 unique classes
  Client 1: 37070 train samples, 62 unique classes
  Client 2: 35957 train samples, 62 unique classes
  Client 3: 38262 train samples, 62 unique classes
  Client 4: 36024 train samples, 62 unique classes
  Client 5: 37732 train samples, 62 unique classes
  Client 6: 36921 train samples, 62 unique classes
  Client 7: 38328 train samples, 62 unique classes
  Client 8: 36867 train samples, 62 unique classes
  Client 9: 37683 train samples, 62 unique classes
  Client 10: 36507 train samples, 62 unique classes
  Client 11: 36915 train samples, 62 unique classes
  Client 12: 36007 train samples, 62 unique classes
  Client 13: 37001 train samples, 62 unique classes
  Client 14: 35681 train samples, 62 unique classes
  Client 15: 35453 train samples, 62 unique classes
  Client 16: 36585 train samples, 62 unique classes
  Client 17: 36801 train samples, 62 unique classes
  Client 18: 35964 train samples, 62 unique classes
  Client 19: 36345 train samples, 62 unique classes
Will sample 4500 samples per client per epoch
Graph: erdos, nodes: 20, edges: 126
Degree statistics: avg=12.60, min=8, max=16
Attack: Compromised 8/20 nodes: [1, 5, 11, 12, 13, 14, 17, 18]
Attack type: backdoor, lambda: 1.0
Backdoor target label: 0, trigger size: 4
Model variant: baseline
Model parameters: 6,603,710
BALANCE algorithm:
Balance Config: BALANCEConfig(gamma=2, kappa=1, alpha=0.5, min_neighbors=1)
  - Model dimension: 6,603,710 parameters
  - Complexity: O(N×d) = O(20×6,603,710)
Initial test acc across nodes: mean=0.0168 ± 0.0139
Backdoor attack: Created poisoned datasets for 8 compromised nodes
Round 001: test acc mean=0.0538 ± 0.0059 | min=0.0434 max=0.0699
         : test loss mean=12347.3482 ± 15177.7734
         : individual accs = ['0.059593', '0.048775', '0.060769', '0.043388', '0.057932', '0.045253', '0.057000', '0.058174', '0.053209', '0.069909', '0.055998', '0.049606', '0.054239', '0.049083', '0.051826', '0.050633', '0.058271', '0.049486', '0.052889', '0.050145']
         : correct/total = [(246, 4128), (205, 4203), (248, 4081), (188, 4333), (237, 4091), (194, 4287), (239, 4193), (253, 4349), (223, 4191), (299, 4277), (232, 4143), (208, 4193), (222, 4093), (206, 4197), (210, 4052), (204, 4029), (242, 4153), (207, 4183), (216, 4084), (207, 4128)]
         : compromised: 0.0501, honest: 0.0563
Round 002: test acc mean=0.0404 ± 0.0246 | min=0.0024 max=0.0739
         : test loss mean=46993.5564 ± 89466.5004
         : individual accs = ['0.059593', '0.003569', '0.055134', '0.052850', '0.057932', '0.004432', '0.057000', '0.058174', '0.053209', '0.053776', '0.055998', '0.002623', '0.003420', '0.002383', '0.004689', '0.056342', '0.054418', '0.049486', '0.049951', '0.073886']
         : correct/total = [(246, 4128), (15, 4203), (225, 4081), (229, 4333), (237, 4091), (19, 4287), (239, 4193), (253, 4349), (223, 4191), (230, 4277), (232, 4143), (11, 4193), (14, 4093), (10, 4197), (19, 4052), (227, 4029), (226, 4153), (207, 4183), (204, 4084), (305, 4128)]
         : compromised: 0.0151, honest: 0.0574
Round 003: test acc mean=0.0525 ± 0.0044 | min=0.0450 max=0.0596
         : test loss mean=nan ± nan
         : individual accs = ['0.059593', '0.048775', '0.050723', '0.048234', '0.057932', '0.045020', '0.057000', '0.051276', '0.054880', '0.047931', '0.055998', '0.049606', '0.056682', '0.049083', '0.052567', '0.056342', '0.058271', '0.045900', '0.047747', '0.055475']
         : correct/total = [(246, 4128), (205, 4203), (207, 4081), (209, 4333), (237, 4091), (193, 4287), (239, 4193), (223, 4349), (230, 4191), (205, 4277), (232, 4143), (208, 4193), (232, 4093), (206, 4197), (213, 4052), (227, 4029), (242, 4153), (192, 4183), (195, 4084), (229, 4128)]
         : compromised: 0.0494, honest: 0.0545
Round 004: test acc mean=0.0538 ± 0.0059 | min=0.0453 max=0.0717
         : test loss mean=nan ± nan
         : individual accs = ['0.059593', '0.048775', '0.057584', '0.052850', '0.057932', '0.045253', '0.057000', '0.058174', '0.053209', '0.054711', '0.045619', '0.049606', '0.054239', '0.049083', '0.051826', '0.071730', '0.058271', '0.049486', '0.052889', '0.048450']
         : correct/total = [(246, 4128), (205, 4203), (235, 4081), (229, 4333), (237, 4091), (194, 4287), (239, 4193), (253, 4349), (223, 4191), (234, 4277), (189, 4143), (208, 4193), (222, 4093), (206, 4197), (210, 4052), (289, 4029), (242, 4153), (207, 4183), (216, 4084), (200, 4128)]
         : compromised: 0.0501, honest: 0.0563
Round 005: test acc mean=0.0548 ± 0.0087 | min=0.0453 max=0.0887
         : test loss mean=nan ± nan
         : individual accs = ['0.059593', '0.048775', '0.057584', '0.052850', '0.057932', '0.045253', '0.057000', '0.047827', '0.051062', '0.053776', '0.055998', '0.049606', '0.054239', '0.049083', '0.051826', '0.054852', '0.058271', '0.049486', '0.052889', '0.088663']
         : correct/total = [(246, 4128), (205, 4203), (235, 4081), (229, 4333), (237, 4091), (194, 4287), (239, 4193), (208, 4349), (214, 4191), (230, 4277), (232, 4143), (208, 4193), (222, 4093), (206, 4197), (210, 4052), (221, 4029), (242, 4153), (207, 4183), (216, 4084), (366, 4128)]
         : compromised: 0.0501, honest: 0.0580
Round 006: test acc mean=0.0523 ± 0.0040 | min=0.0446 max=0.0583
         : test loss mean=nan ± nan
         : individual accs = ['0.044574', '0.048775', '0.057584', '0.052850', '0.057932', '0.045253', '0.057000', '0.047827', '0.053209', '0.053776', '0.050447', '0.049606', '0.054239', '0.049083', '0.051826', '0.056590', '0.058271', '0.049486', '0.052889', '0.055475']
         : correct/total = [(184, 4128), (205, 4203), (235, 4081), (229, 4333), (237, 4091), (194, 4287), (239, 4193), (208, 4349), (223, 4191), (230, 4277), (209, 4143), (208, 4193), (222, 4093), (206, 4197), (210, 4052), (228, 4029), (242, 4153), (207, 4183), (216, 4084), (229, 4128)]
         : compromised: 0.0501, honest: 0.0538
Round 007: test acc mean=0.0525 ± 0.0044 | min=0.0444 max=0.0596
         : test loss mean=nan ± nan
         : individual accs = ['0.059593', '0.048775', '0.057584', '0.052850', '0.047421', '0.045253', '0.048891', '0.058174', '0.053209', '0.044424', '0.055998', '0.049606', '0.054239', '0.049083', '0.051826', '0.056590', '0.058271', '0.049486', '0.052889', '0.055475']
         : correct/total = [(246, 4128), (205, 4203), (235, 4081), (229, 4333), (194, 4091), (194, 4287), (205, 4193), (253, 4349), (223, 4191), (190, 4277), (232, 4143), (208, 4193), (222, 4093), (206, 4197), (210, 4052), (228, 4029), (242, 4153), (207, 4183), (216, 4084), (229, 4128)]
         : compromised: 0.0501, honest: 0.0540
Round 008: test acc mean=0.0528 ± 0.0075 | min=0.0422 max=0.0817
         : test loss mean=nan ± nan
         : individual accs = ['0.051599', '0.048775', '0.050723', '0.081699', '0.051088', '0.045253', '0.057000', '0.051276', '0.042233', '0.053075', '0.055998', '0.049606', '0.054239', '0.049083', '0.051826', '0.056342', '0.055141', '0.049486', '0.052889', '0.048450']
         : correct/total = [(213, 4128), (205, 4203), (207, 4081), (354, 4333), (209, 4091), (194, 4287), (239, 4193), (223, 4349), (177, 4191), (227, 4277), (232, 4143), (208, 4193), (222, 4093), (206, 4197), (210, 4052), (227, 4029), (229, 4153), (207, 4183), (216, 4084), (200, 4128)]
         : compromised: 0.0501, honest: 0.0546
Round 009: test acc mean=0.0565 ± 0.0124 | min=0.0453 max=0.1017
         : test loss mean=nan ± nan
         : individual accs = ['0.059593', '0.048775', '0.101691', '0.052850', '0.051088', '0.045253', '0.051991', '0.058404', '0.053209', '0.079495', '0.055998', '0.049606', '0.054239', '0.049083', '0.051826', '0.051378', '0.058512', '0.049486', '0.052889', '0.055475']
         : correct/total = [(246, 4128), (205, 4203), (415, 4081), (229, 4333), (209, 4091), (194, 4287), (218, 4193), (254, 4349), (223, 4191), (340, 4277), (232, 4143), (208, 4193), (222, 4093), (206, 4197), (210, 4052), (207, 4029), (243, 4153), (207, 4183), (216, 4084), (229, 4128)]
         : compromised: 0.0501, honest: 0.0608
Round 010: test acc mean=0.0538 ± 0.0055 | min=0.0453 max=0.0712
         : test loss mean=nan ± nan
         : individual accs = ['0.071221', '0.048775', '0.057584', '0.052850', '0.057932', '0.045253', '0.049130', '0.058174', '0.047960', '0.053776', '0.055998', '0.049606', '0.054239', '0.049083', '0.051826', '0.056342', '0.058271', '0.049486', '0.052889', '0.055475']
         : correct/total = [(294, 4128), (205, 4203), (235, 4081), (229, 4333), (237, 4091), (194, 4287), (206, 4193), (253, 4349), (201, 4191), (230, 4277), (232, 4143), (208, 4193), (222, 4093), (206, 4197), (210, 4052), (227, 4029), (242, 4153), (207, 4183), (216, 4084), (229, 4128)]
         : compromised: 0.0501, honest: 0.0562

=== FINAL RESULTS ===
Dataset: femnist, Nodes: 20, Graph: erdos, Aggregation: balance
Attack: backdoor, 40.0% compromised
Final accuracy - Compromised: 0.0501, Honest: 0.0562
Overall test accuracy: mean=0.0538 ± 0.0055

=== BACKDOOR ATTACK SUCCESS RATE (ASR) ===
Target label: 0
Trigger size: 4x4
Overall ASR: 0.4000 ± 0.4899
Honest nodes ASR: 0.0000 ± 0.0000
Compromised nodes ASR: 1.0000 ± 0.0000
Note: Higher ASR indicates more successful backdoor attack

=== BALANCE SUMMARY ===
Node 0: acceptance=0.562
Node 1: acceptance=0.273
Node 2: acceptance=0.500
Node 3: acceptance=0.625
Node 4: acceptance=0.545
Node 5: acceptance=0.253
Node 6: acceptance=0.500
Node 7: acceptance=0.500
Node 8: acceptance=0.500
Node 9: acceptance=0.692
Node 10: acceptance=0.556
Node 11: acceptance=0.257
Node 12: acceptance=0.267
Node 13: acceptance=0.169
Node 14: acceptance=0.260
Node 15: acceptance=0.545
Node 16: acceptance=0.538
Node 17: acceptance=0.267
Node 18: acceptance=0.269
Node 19: acceptance=0.500

=== PARALLEL EXECUTION TIME (realistic for distributed system) ===
  COMMUNICATION (max across nodes):
    - Full model transfer: 0.000s (0.0%)
  COMPUTATION (max across nodes):
    - Filtering: 0.065s (81.5%)
    - Aggregation: 0.015s (18.5%)
  TOTALS:
    - Total computation: 0.079s (100.0%)
    - Total communication: 0.000s (0.0%)
    - Total parallel time: 0.079s

=== PER-NODE AVERAGE TIME ===
  - Filtering: 0.050s
  - Aggregation: 0.005s
  - Model transfer: 0.000s
  - Total per node: 0.055s

=== TOTAL COMPUTATIONAL WORK (sum across all nodes) ===
  - Total filtering: 0.995s
  - Total aggregation: 0.101s
  - Total model transfer: 0.000s
  - Grand total: 1.096s
  - Mean acceptance rate: 0.429

BALANCE Algorithm Properties:
  - Model dimension: 6,603,710
  - No compression: Full parameter comparison
  - Theoretical complexity: O(deg(i)×d)
  - Approach: Full parameter filtering + averaging
