Device: cuda
Seed: 987654321
Loading 36 LEAF FEMNIST train files...
LEAF FEMNIST train: 3597 users, 734463 samples
Loading 36 LEAF FEMNIST test files...
LEAF FEMNIST test: 3597 users, 83388 samples
Found 3597 train users, 3597 test users, 3597 common users
User sample counts range: 525 (max) to 17 (min)
Distributed ALL 3597 users across 20 clients
Users per client: 179 (with 17 clients getting +1 user)
Train partition sizes: [36360, 37070, 35957, 38262, 36024, 37732, 36921, 38328, 36867, 37683, 36507, 36915, 36007, 37001, 35681, 35453, 36585, 36801, 35964, 36345]
Test partition sizes: [4128, 4203, 4081, 4333, 4091, 4287, 4193, 4349, 4191, 4277, 4143, 4193, 4093, 4197, 4052, 4029, 4153, 4183, 4084, 4128]
  Client 0: 36360 train samples, 62 unique classes
  Client 1: 37070 train samples, 62 unique classes
  Client 2: 35957 train samples, 62 unique classes
  Client 3: 38262 train samples, 62 unique classes
  Client 4: 36024 train samples, 62 unique classes
  Client 5: 37732 train samples, 62 unique classes
  Client 6: 36921 train samples, 62 unique classes
  Client 7: 38328 train samples, 62 unique classes
  Client 8: 36867 train samples, 62 unique classes
  Client 9: 37683 train samples, 62 unique classes
  Client 10: 36507 train samples, 62 unique classes
  Client 11: 36915 train samples, 62 unique classes
  Client 12: 36007 train samples, 62 unique classes
  Client 13: 37001 train samples, 62 unique classes
  Client 14: 35681 train samples, 62 unique classes
  Client 15: 35453 train samples, 62 unique classes
  Client 16: 36585 train samples, 62 unique classes
  Client 17: 36801 train samples, 62 unique classes
  Client 18: 35964 train samples, 62 unique classes
  Client 19: 36345 train samples, 62 unique classes
Will sample 10000 samples per client per epoch
Graph: erdos, nodes: 20, edges: 48
Degree statistics: avg=4.80, min=2, max=7
Attack: Compromised 4/20 nodes: [5, 12, 13, 17]
Attack type: backdoor, lambda: 1.0
Backdoor target label: 0, trigger size: 4
Model variant: baseline
Model parameters: 6,603,710
Sketchguard Node 0:
  Model dim: 6,603,710 → Sketch size: 1000
  Compression ratio: 6603.7x
  Using model parameters for aggregation, sketches for filtering
Sketchguard Node 1:
  Model dim: 6,603,710 → Sketch size: 1000
  Compression ratio: 6603.7x
  Using model parameters for aggregation, sketches for filtering
Sketchguard Node 2:
  Model dim: 6,603,710 → Sketch size: 1000
  Compression ratio: 6603.7x
  Using model parameters for aggregation, sketches for filtering
Sketchguard Node 3:
  Model dim: 6,603,710 → Sketch size: 1000
  Compression ratio: 6603.7x
  Using model parameters for aggregation, sketches for filtering
Sketchguard Node 4:
  Model dim: 6,603,710 → Sketch size: 1000
  Compression ratio: 6603.7x
  Using model parameters for aggregation, sketches for filtering
Sketchguard Node 5:
  Model dim: 6,603,710 → Sketch size: 1000
  Compression ratio: 6603.7x
  Using model parameters for aggregation, sketches for filtering
Sketchguard Node 6:
  Model dim: 6,603,710 → Sketch size: 1000
  Compression ratio: 6603.7x
  Using model parameters for aggregation, sketches for filtering
Sketchguard Node 7:
  Model dim: 6,603,710 → Sketch size: 1000
  Compression ratio: 6603.7x
  Using model parameters for aggregation, sketches for filtering
Sketchguard Node 8:
  Model dim: 6,603,710 → Sketch size: 1000
  Compression ratio: 6603.7x
  Using model parameters for aggregation, sketches for filtering
Sketchguard Node 9:
  Model dim: 6,603,710 → Sketch size: 1000
  Compression ratio: 6603.7x
  Using model parameters for aggregation, sketches for filtering
Sketchguard Node 10:
  Model dim: 6,603,710 → Sketch size: 1000
  Compression ratio: 6603.7x
  Using model parameters for aggregation, sketches for filtering
Sketchguard Node 11:
  Model dim: 6,603,710 → Sketch size: 1000
  Compression ratio: 6603.7x
  Using model parameters for aggregation, sketches for filtering
Sketchguard Node 12:
  Model dim: 6,603,710 → Sketch size: 1000
  Compression ratio: 6603.7x
  Using model parameters for aggregation, sketches for filtering
Sketchguard Node 13:
  Model dim: 6,603,710 → Sketch size: 1000
  Compression ratio: 6603.7x
  Using model parameters for aggregation, sketches for filtering
Sketchguard Node 14:
  Model dim: 6,603,710 → Sketch size: 1000
  Compression ratio: 6603.7x
  Using model parameters for aggregation, sketches for filtering
Sketchguard Node 15:
  Model dim: 6,603,710 → Sketch size: 1000
  Compression ratio: 6603.7x
  Using model parameters for aggregation, sketches for filtering
Sketchguard Node 16:
  Model dim: 6,603,710 → Sketch size: 1000
  Compression ratio: 6603.7x
  Using model parameters for aggregation, sketches for filtering
Sketchguard Node 17:
  Model dim: 6,603,710 → Sketch size: 1000
  Compression ratio: 6603.7x
  Using model parameters for aggregation, sketches for filtering
Sketchguard Node 18:
  Model dim: 6,603,710 → Sketch size: 1000
  Compression ratio: 6603.7x
  Using model parameters for aggregation, sketches for filtering
Sketchguard Node 19:
  Model dim: 6,603,710 → Sketch size: 1000
  Compression ratio: 6603.7x
  Using model parameters for aggregation, sketches for filtering
Sketchguard ALGORITHM (Sketch-based Filtering + State Aggregation)
  - Model dimension: 6,603,710 parameters
  - Config: SketchguardConfig(gamma=2, kappa=1, alpha=0.5, min_neighbors=1, sketch_size=1000, network_seed=987654321, attack_detection_window=5)
  - Sketch size: 1000
  - Compression ratio: 6603.7x
  - Complexity: O(d + N×k) = O(6,603,710 + 20×1000)
  - Theoretical speedup vs BALANCE: 19.9x
Initial test acc across nodes: mean=0.0162 ± 0.0138
Backdoor attack: Created poisoned datasets for 4 compromised nodes
Round 001: test acc mean=0.3775 ± 0.1427 | min=0.0474 max=0.5223
         : test loss mean=3613.0700 ± 7421.9225
         : individual accs = ['0.522287', '0.478706', '0.499387', '0.419109', '0.397947', '0.171682', '0.454090', '0.429984', '0.387258', '0.417816', '0.397538', '0.508228', '0.047398', '0.047653', '0.466930', '0.501613', '0.464243', '0.179775', '0.356268', '0.402132']
         : correct/total = [(2156, 4128), (2012, 4203), (2038, 4081), (1816, 4333), (1628, 4091), (736, 4287), (1904, 4193), (1870, 4349), (1623, 4191), (1787, 4277), (1647, 4143), (2131, 4193), (194, 4093), (200, 4197), (1892, 4052), (2021, 4029), (1928, 4153), (752, 4183), (1455, 4084), (1660, 4128)]
         : compromised: 0.1116, honest: 0.4440
         : sketchguard stats = ['Node 0: acc_rate=0.833', 'Node 1: acc_rate=1.000', 'Node 2: acc_rate=1.000']...
Round 002: test acc mean=0.5612 ± 0.2562 | min=0.0476 max=0.7164
         : test loss mean=13064457088510.8887 ± 56946648181325.7578
         : individual accs = ['0.700097', '0.702118', '0.686596', '0.700669', '0.701784', '0.052484', '0.663248', '0.682456', '0.660224', '0.698854', '0.697321', '0.716432', '0.052040', '0.047653', '0.695706', '0.706379', '0.676619', '0.047574', '0.692948', '0.641957']
         : correct/total = [(2890, 4128), (2951, 4203), (2802, 4081), (3036, 4333), (2871, 4091), (225, 4287), (2781, 4193), (2968, 4349), (2767, 4191), (2989, 4277), (2889, 4143), (3004, 4193), (213, 4093), (200, 4197), (2819, 4052), (2846, 4029), (2810, 4153), (199, 4183), (2830, 4084), (2650, 4128)]
         : compromised: 0.0499, honest: 0.6890
         : sketchguard stats = ['Node 0: acc_rate=0.833', 'Node 1: acc_rate=1.000', 'Node 2: acc_rate=1.000']...
Round 003: test acc mean=0.5947 ± 0.2730 | min=0.0474 max=0.7580
         : test loss mean=nan ± nan
         : individual accs = ['0.745882', '0.736379', '0.719922', '0.740134', '0.721828', '0.052484', '0.740281', '0.710278', '0.713434', '0.723638', '0.729423', '0.748867', '0.047398', '0.047653', '0.722853', '0.736907', '0.727185', '0.049247', '0.723066', '0.757994']
         : correct/total = [(3079, 4128), (3095, 4203), (2938, 4081), (3207, 4333), (2953, 4091), (225, 4287), (3104, 4193), (3089, 4349), (2990, 4191), (3095, 4277), (3022, 4143), (3140, 4193), (194, 4093), (200, 4197), (2929, 4052), (2969, 4029), (3020, 4153), (206, 4183), (2953, 4084), (3129, 4128)]
         : compromised: 0.0492, honest: 0.7311
         : sketchguard stats = ['Node 0: acc_rate=0.833', 'Node 1: acc_rate=1.000', 'Node 2: acc_rate=1.000']...
Round 004: test acc mean=0.6199 ± 0.2854 | min=0.0474 max=0.7774
         : test loss mean=nan ± nan
         : individual accs = ['0.758963', '0.765882', '0.751531', '0.765751', '0.763139', '0.052484', '0.769139', '0.761554', '0.765688', '0.755904', '0.756215', '0.753160', '0.047398', '0.047653', '0.763080', '0.773641', '0.753672', '0.049247', '0.766405', '0.777374']
         : correct/total = [(3133, 4128), (3219, 4203), (3067, 4081), (3318, 4333), (3122, 4091), (225, 4287), (3225, 4193), (3312, 4349), (3209, 4191), (3233, 4277), (3133, 4143), (3158, 4193), (194, 4093), (200, 4197), (3092, 4052), (3117, 4029), (3130, 4153), (206, 4183), (3130, 4084), (3209, 4128)]
         : compromised: 0.0492, honest: 0.7626
         : sketchguard stats = ['Node 0: acc_rate=0.833', 'Node 1: acc_rate=1.000', 'Node 2: acc_rate=1.000']...
Round 005: test acc mean=0.6310 ± 0.2912 | min=0.0474 max=0.8058
         : test loss mean=nan ± nan
         : individual accs = ['0.777374', '0.766119', '0.749326', '0.785599', '0.774383', '0.052484', '0.766993', '0.765003', '0.805774', '0.787468', '0.777215', '0.768185', '0.047398', '0.047653', '0.758885', '0.771655', '0.784975', '0.049247', '0.785749', '0.799419']
         : correct/total = [(3209, 4128), (3220, 4203), (3058, 4081), (3404, 4333), (3168, 4091), (225, 4287), (3216, 4193), (3327, 4349), (3377, 4191), (3368, 4277), (3220, 4143), (3221, 4193), (194, 4093), (200, 4197), (3075, 4052), (3109, 4029), (3260, 4153), (206, 4183), (3209, 4084), (3300, 4128)]
         : compromised: 0.0492, honest: 0.7765
         : sketchguard stats = ['Node 0: acc_rate=0.833', 'Node 1: acc_rate=1.000', 'Node 2: acc_rate=1.000']...
Round 006: test acc mean=0.6475 ± 0.2993 | min=0.0474 max=0.8141
         : test loss mean=nan ± nan
         : individual accs = ['0.778101', '0.786343', '0.783631', '0.807754', '0.786116', '0.052484', '0.799666', '0.798574', '0.814126', '0.807575', '0.796283', '0.791080', '0.047398', '0.047653', '0.800346', '0.801688', '0.806646', '0.049247', '0.799951', '0.796269']
         : correct/total = [(3212, 4128), (3305, 4203), (3198, 4081), (3500, 4333), (3216, 4091), (225, 4287), (3353, 4193), (3473, 4349), (3412, 4191), (3454, 4277), (3299, 4143), (3317, 4193), (194, 4093), (200, 4197), (3243, 4052), (3230, 4029), (3350, 4153), (206, 4183), (3267, 4084), (3287, 4128)]
         : compromised: 0.0492, honest: 0.7971
         : sketchguard stats = ['Node 0: acc_rate=0.833', 'Node 1: acc_rate=1.000', 'Node 2: acc_rate=1.000']...
Round 007: test acc mean=0.6596 ± 0.3053 | min=0.0474 max=0.8270
         : test loss mean=nan ± nan
         : individual accs = ['0.806444', '0.810374', '0.794168', '0.823910', '0.801271', '0.052484', '0.817076', '0.812831', '0.822715', '0.826982', '0.802317', '0.813022', '0.047398', '0.047653', '0.810464', '0.817324', '0.819408', '0.049247', '0.813908', '0.802326']
         : correct/total = [(3329, 4128), (3406, 4203), (3241, 4081), (3570, 4333), (3278, 4091), (225, 4287), (3426, 4193), (3535, 4349), (3448, 4191), (3537, 4277), (3324, 4143), (3409, 4193), (194, 4093), (200, 4197), (3284, 4052), (3293, 4029), (3403, 4153), (206, 4183), (3324, 4084), (3312, 4128)]
         : compromised: 0.0492, honest: 0.8122
         : sketchguard stats = ['Node 0: acc_rate=0.833', 'Node 1: acc_rate=1.000', 'Node 2: acc_rate=1.000']...
Round 008: test acc mean=0.6642 ± 0.3077 | min=0.0474 max=0.8319
         : test loss mean=nan ± nan
         : individual accs = ['0.805959', '0.813229', '0.807645', '0.829910', '0.803471', '0.052484', '0.827808', '0.816969', '0.827487', '0.831892', '0.807627', '0.826377', '0.047398', '0.047653', '0.826259', '0.826508', '0.819648', '0.049247', '0.818315', '0.798692']
         : correct/total = [(3327, 4128), (3418, 4203), (3296, 4081), (3596, 4333), (3287, 4091), (225, 4287), (3471, 4193), (3553, 4349), (3468, 4191), (3558, 4277), (3346, 4143), (3465, 4193), (194, 4093), (200, 4197), (3348, 4052), (3330, 4029), (3404, 4153), (206, 4183), (3342, 4084), (3297, 4128)]
         : compromised: 0.0492, honest: 0.8180
         : sketchguard stats = ['Node 0: acc_rate=0.833', 'Node 1: acc_rate=1.000', 'Node 2: acc_rate=1.000']...
Round 009: test acc mean=0.6725 ± 0.3117 | min=0.0474 max=0.8437
         : test loss mean=nan ± nan
         : individual accs = ['0.817345', '0.830359', '0.815731', '0.836141', '0.820582', '0.052484', '0.836632', '0.828926', '0.843713', '0.840776', '0.821144', '0.827331', '0.047398', '0.047653', '0.832182', '0.828493', '0.827113', '0.049247', '0.824437', '0.822190']
         : correct/total = [(3374, 4128), (3490, 4203), (3329, 4081), (3623, 4333), (3357, 4091), (225, 4287), (3508, 4193), (3605, 4349), (3536, 4191), (3596, 4277), (3402, 4143), (3469, 4193), (194, 4093), (200, 4197), (3372, 4052), (3338, 4029), (3435, 4153), (206, 4183), (3367, 4084), (3394, 4128)]
         : compromised: 0.0492, honest: 0.8283
         : sketchguard stats = ['Node 0: acc_rate=0.833', 'Node 1: acc_rate=1.000', 'Node 2: acc_rate=1.000']...
Round 010: test acc mean=0.6781 ± 0.3145 | min=0.0474 max=0.8455
         : test loss mean=nan ± nan
         : individual accs = ['0.825581', '0.837735', '0.830679', '0.840295', '0.827670', '0.052484', '0.842833', '0.838584', '0.841804', '0.845452', '0.825006', '0.831386', '0.047398', '0.047653', '0.839832', '0.842393', '0.836745', '0.049247', '0.833007', '0.826793']
         : correct/total = [(3408, 4128), (3521, 4203), (3390, 4081), (3641, 4333), (3386, 4091), (225, 4287), (3534, 4193), (3647, 4349), (3528, 4191), (3616, 4277), (3418, 4143), (3486, 4193), (194, 4093), (200, 4197), (3403, 4052), (3394, 4029), (3475, 4153), (206, 4183), (3402, 4084), (3413, 4128)]
         : compromised: 0.0492, honest: 0.8354
         : sketchguard stats = ['Node 0: acc_rate=0.833', 'Node 1: acc_rate=1.000', 'Node 2: acc_rate=1.000']...

=== FINAL RESULTS ===
Dataset: femnist, Nodes: 20, Graph: erdos, Aggregation: sketchguard
Attack: backdoor, 20.0% compromised
Final accuracy - Compromised: 0.0492, Honest: 0.8354
Overall test accuracy: mean=0.6781 ± 0.3145

=== BACKDOOR ATTACK SUCCESS RATE (ASR) ===
Target label: 0
Trigger size: 4x4
Overall ASR: 0.2442 ± 0.3779
Honest nodes ASR: 0.0552 ± 0.0042
Compromised nodes ASR: 1.0000 ± 0.0000
Note: Higher ASR indicates more successful backdoor attack

=== Sketchguard SUMMARY ===
Node 0: acceptance=0.833
Node 1: acceptance=1.000
Node 2: acceptance=1.000
Node 3: acceptance=0.750
Node 4: acceptance=0.750
Node 5: acceptance=0.260
Node 6: acceptance=0.800
Node 7: acceptance=0.600
Node 8: acceptance=1.000
Node 9: acceptance=1.000
Node 10: acceptance=0.750
Node 11: acceptance=0.714
Node 12: acceptance=0.286
Node 13: acceptance=0.300
Node 14: acceptance=0.429
Node 15: acceptance=0.667
Node 16: acceptance=0.600
Node 17: acceptance=0.280
Node 18: acceptance=1.000
Node 19: acceptance=1.000

=== PARALLEL EXECUTION TIME (realistic for distributed system) ===
  COMMUNICATION (max across nodes):
    - Sketch transfer: 0.000s (0.0%)
    - Model fetch (accepted): 0.000s (0.0%)
  COMPUTATION (max across nodes):
    - Sketching: 2.541s (99.2%)
    - Filtering: 0.001s (0.0%)
    - Aggregation: 0.020s (0.8%)
  TOTALS:
    - Total computation: 2.563s (100.0%)
    - Total communication: 0.000s (0.0%)
    - Total parallel time: 2.563s

=== PER-NODE AVERAGE TIME ===
  - Sketching: 1.779s
  - Filtering: 0.001s
  - Aggregation: 0.010s
  - Sketch transfer: 0.000s
  - Model fetch: 0.000s
  - Total per node: 1.790s

=== TOTAL COMPUTATIONAL WORK (sum across all nodes) ===
  - Total sketching: 35.588s
  - Total filtering: 0.013s
  - Total aggregation: 0.193s
  - Total sketch transfer: 0.000s
  - Total model fetch: 0.000s
  - Grand total: 35.794s
  - Mean acceptance rate: 0.701

Sketchguard Algorithm Properties:
  - Original dimension: 6,603,710
  - Sketch size: 1000
  - Compression ratio: 19.9x
  - Single repetition: No repetitions needed
  - Theoretical complexity: O(d + N×k)
  - Approach: Sketch filtering + state aggregation
