Device: cuda
Seed: 987654321
Loading 36 LEAF FEMNIST train files...
LEAF FEMNIST train: 3597 users, 734463 samples
Loading 36 LEAF FEMNIST test files...
LEAF FEMNIST test: 3597 users, 83388 samples
Found 3597 train users, 3597 test users, 3597 common users
User sample counts range: 525 (max) to 17 (min)
Distributed ALL 3597 users across 20 clients
Users per client: 179 (with 17 clients getting +1 user)
Train partition sizes: [36360, 37070, 35957, 38262, 36024, 37732, 36921, 38328, 36867, 37683, 36507, 36915, 36007, 37001, 35681, 35453, 36585, 36801, 35964, 36345]
Test partition sizes: [4128, 4203, 4081, 4333, 4091, 4287, 4193, 4349, 4191, 4277, 4143, 4193, 4093, 4197, 4052, 4029, 4153, 4183, 4084, 4128]
  Client 0: 36360 train samples, 62 unique classes
  Client 1: 37070 train samples, 62 unique classes
  Client 2: 35957 train samples, 62 unique classes
  Client 3: 38262 train samples, 62 unique classes
  Client 4: 36024 train samples, 62 unique classes
  Client 5: 37732 train samples, 62 unique classes
  Client 6: 36921 train samples, 62 unique classes
  Client 7: 38328 train samples, 62 unique classes
  Client 8: 36867 train samples, 62 unique classes
  Client 9: 37683 train samples, 62 unique classes
  Client 10: 36507 train samples, 62 unique classes
  Client 11: 36915 train samples, 62 unique classes
  Client 12: 36007 train samples, 62 unique classes
  Client 13: 37001 train samples, 62 unique classes
  Client 14: 35681 train samples, 62 unique classes
  Client 15: 35453 train samples, 62 unique classes
  Client 16: 36585 train samples, 62 unique classes
  Client 17: 36801 train samples, 62 unique classes
  Client 18: 35964 train samples, 62 unique classes
  Client 19: 36345 train samples, 62 unique classes
Will sample 4500 samples per client per epoch
Graph: fully, nodes: 20, edges: 190
Degree statistics: avg=19.00, min=19, max=19
Attack: Compromised 10/20 nodes: [1, 2, 5, 11, 12, 13, 14, 15, 17, 18]
Attack type: backdoor, lambda: 1.0
Backdoor target label: 0, trigger size: 4
Model variant: baseline
Model parameters: 6,603,710
UBAR ALGORITHM (Two-Stage Byzantine-resilient)
  - Model dimension: 6,603,710 parameters
  - Rho parameter: 0.5
  - Stage 1: Distance-based filtering (select 50% closest neighbors)
  - Stage 2: Performance-based selection (loss comparison)
  - Complexity: O(deg(i)×d + deg(i)×inference)
Initial test acc across nodes: mean=0.0168 ± 0.0139
Backdoor attack: Created poisoned datasets for 10 compromised nodes
Round 001: test acc mean=0.0519 ± 0.0040 | min=0.0434 max=0.0596
         : test loss mean=15507.1256 ± 15566.3385
         : individual accs = ['0.059593', '0.048775', '0.053418', '0.043388', '0.057932', '0.045253', '0.057000', '0.051276', '0.053209', '0.050503', '0.050447', '0.049606', '0.054239', '0.049083', '0.051826', '0.051626', '0.058271', '0.049486', '0.052889', '0.050145']
         : correct/total = [(246, 4128), (205, 4203), (218, 4081), (188, 4333), (237, 4091), (194, 4287), (239, 4193), (223, 4349), (223, 4191), (216, 4277), (209, 4143), (208, 4193), (222, 4093), (206, 4197), (210, 4052), (208, 4029), (242, 4153), (207, 4183), (216, 4084), (207, 4128)]
         : compromised: 0.0506, honest: 0.0532
         : ubar stats = ['Node 0: s1=0.474, s2=0.444', 'Node 1: s1=0.474, s2=1.000', 'Node 2: s1=0.474, s2=1.000']...
Round 002: test acc mean=0.0484 ± 0.0097 | min=0.0231 max=0.0586
         : test loss mean=10321.3518 ± 15284.5078
         : individual accs = ['0.044574', '0.056626', '0.054889', '0.052850', '0.057932', '0.027059', '0.043883', '0.058174', '0.053209', '0.053776', '0.045619', '0.023134', '0.058637', '0.044556', '0.052073', '0.051626', '0.049362', '0.049486', '0.035504', '0.055475']
         : correct/total = [(184, 4128), (238, 4203), (224, 4081), (229, 4333), (237, 4091), (116, 4287), (184, 4193), (253, 4349), (223, 4191), (230, 4277), (189, 4143), (97, 4193), (240, 4093), (187, 4197), (211, 4052), (208, 4029), (205, 4153), (207, 4183), (145, 4084), (229, 4128)]
         : compromised: 0.0454, honest: 0.0515
         : ubar stats = ['Node 0: s1=0.474, s2=0.556', 'Node 1: s1=0.474, s2=1.000', 'Node 2: s1=0.474, s2=1.000']...
Round 003: test acc mean=0.0510 ± 0.0037 | min=0.0453 max=0.0596
         : test loss mean=nan ± nan
         : individual accs = ['0.059593', '0.048775', '0.053418', '0.048234', '0.057932', '0.045253', '0.046745', '0.051276', '0.054880', '0.047463', '0.051653', '0.049606', '0.054239', '0.049083', '0.051826', '0.051626', '0.049362', '0.045900', '0.052889', '0.050872']
         : correct/total = [(246, 4128), (205, 4203), (218, 4081), (209, 4333), (237, 4091), (194, 4287), (196, 4193), (223, 4349), (230, 4191), (203, 4277), (214, 4143), (208, 4193), (222, 4093), (206, 4197), (210, 4052), (208, 4029), (205, 4153), (192, 4183), (216, 4084), (210, 4128)]
         : compromised: 0.0503, honest: 0.0518
         : ubar stats = ['Node 0: s1=0.474, s2=0.593', 'Node 1: s1=0.474, s2=1.000', 'Node 2: s1=0.474, s2=1.000']...
Round 004: test acc mean=0.0523 ± 0.0042 | min=0.0453 max=0.0596
         : test loss mean=nan ± nan
         : individual accs = ['0.059593', '0.048775', '0.053418', '0.052850', '0.057932', '0.045253', '0.057000', '0.058174', '0.053209', '0.048398', '0.045619', '0.049606', '0.054239', '0.049083', '0.051826', '0.051626', '0.058271', '0.049486', '0.052889', '0.048450']
         : correct/total = [(246, 4128), (205, 4203), (218, 4081), (229, 4333), (237, 4091), (194, 4287), (239, 4193), (253, 4349), (223, 4191), (207, 4277), (189, 4143), (208, 4193), (222, 4093), (206, 4197), (210, 4052), (208, 4029), (242, 4153), (207, 4183), (216, 4084), (200, 4128)]
         : compromised: 0.0506, honest: 0.0539
         : ubar stats = ['Node 0: s1=0.474, s2=0.472', 'Node 1: s1=0.474, s2=0.778', 'Node 2: s1=0.474, s2=0.778']...
Round 005: test acc mean=0.0522 ± 0.0035 | min=0.0453 max=0.0596
         : test loss mean=nan ± nan
         : individual accs = ['0.059593', '0.048775', '0.053418', '0.052850', '0.057932', '0.045253', '0.057000', '0.047827', '0.051062', '0.053776', '0.055998', '0.049606', '0.054239', '0.049083', '0.051826', '0.051626', '0.051288', '0.049486', '0.052889', '0.050145']
         : correct/total = [(246, 4128), (205, 4203), (218, 4081), (229, 4333), (237, 4091), (194, 4287), (239, 4193), (208, 4349), (214, 4191), (230, 4277), (232, 4143), (208, 4193), (222, 4093), (206, 4197), (210, 4052), (208, 4029), (213, 4153), (207, 4183), (216, 4084), (207, 4128)]
         : compromised: 0.0506, honest: 0.0537
         : ubar stats = ['Node 0: s1=0.474, s2=0.511', 'Node 1: s1=0.474, s2=0.644', 'Node 2: s1=0.474, s2=0.644']...
Round 006: test acc mean=0.0521 ± 0.0036 | min=0.0446 max=0.0583
         : test loss mean=nan ± nan
         : individual accs = ['0.044574', '0.048775', '0.053418', '0.052850', '0.057932', '0.045253', '0.057000', '0.053116', '0.053209', '0.053776', '0.050447', '0.049606', '0.054239', '0.049083', '0.051826', '0.051626', '0.058271', '0.049486', '0.052889', '0.055475']
         : correct/total = [(184, 4128), (205, 4203), (218, 4081), (229, 4333), (237, 4091), (194, 4287), (239, 4193), (231, 4349), (223, 4191), (230, 4277), (209, 4143), (208, 4193), (222, 4093), (206, 4197), (210, 4052), (208, 4029), (242, 4153), (207, 4183), (216, 4084), (229, 4128)]
         : compromised: 0.0506, honest: 0.0537
         : ubar stats = ['Node 0: s1=0.474, s2=0.556', 'Node 1: s1=0.474, s2=0.556', 'Node 2: s1=0.474, s2=0.556']...
Round 007: test acc mean=0.0524 ± 0.0035 | min=0.0453 max=0.0583
         : test loss mean=nan ± nan
         : individual accs = ['0.050145', '0.048775', '0.053418', '0.052850', '0.047421', '0.045253', '0.057000', '0.058174', '0.053209', '0.053776', '0.055998', '0.049606', '0.054239', '0.049083', '0.051826', '0.051626', '0.058271', '0.049486', '0.052889', '0.055475']
         : correct/total = [(207, 4128), (205, 4203), (218, 4081), (229, 4333), (194, 4091), (194, 4287), (239, 4193), (253, 4349), (223, 4191), (230, 4277), (232, 4143), (208, 4193), (222, 4093), (206, 4197), (210, 4052), (208, 4029), (242, 4153), (207, 4183), (216, 4084), (229, 4128)]
         : compromised: 0.0506, honest: 0.0542
         : ubar stats = ['Node 0: s1=0.474, s2=0.492', 'Node 1: s1=0.474, s2=0.492', 'Node 2: s1=0.474, s2=0.492']...
Round 008: test acc mean=0.0534 ± 0.0110 | min=0.0433 max=0.0890
         : test loss mean=nan ± nan
         : individual accs = ['0.079457', '0.048775', '0.053418', '0.044773', '0.043266', '0.045253', '0.057000', '0.051276', '0.089000', '0.047697', '0.045619', '0.049606', '0.054239', '0.049083', '0.051826', '0.051626', '0.055141', '0.049486', '0.052889', '0.048692']
         : correct/total = [(328, 4128), (205, 4203), (218, 4081), (194, 4333), (177, 4091), (194, 4287), (239, 4193), (223, 4349), (373, 4191), (204, 4277), (189, 4143), (208, 4193), (222, 4093), (206, 4197), (210, 4052), (208, 4029), (229, 4153), (207, 4183), (216, 4084), (201, 4128)]
         : compromised: 0.0506, honest: 0.0562
         : ubar stats = ['Node 0: s1=0.474, s2=0.458', 'Node 1: s1=0.474, s2=0.444', 'Node 2: s1=0.474, s2=0.444']...
Round 009: test acc mean=0.0547 ± 0.0094 | min=0.0453 max=0.0926
         : test loss mean=nan ± nan
         : individual accs = ['0.059593', '0.048775', '0.053418', '0.052850', '0.051088', '0.045253', '0.050799', '0.058174', '0.053209', '0.092588', '0.055998', '0.049606', '0.054239', '0.049083', '0.051826', '0.051626', '0.058271', '0.049486', '0.052889', '0.055475']
         : correct/total = [(246, 4128), (205, 4203), (218, 4081), (229, 4333), (209, 4091), (194, 4287), (213, 4193), (253, 4349), (223, 4191), (396, 4277), (232, 4143), (208, 4193), (222, 4093), (206, 4197), (210, 4052), (208, 4029), (242, 4153), (207, 4183), (216, 4084), (229, 4128)]
         : compromised: 0.0506, honest: 0.0588
         : ubar stats = ['Node 0: s1=0.474, s2=0.432', 'Node 1: s1=0.474, s2=0.407', 'Node 2: s1=0.474, s2=0.407']...
Round 010: test acc mean=0.0528 ± 0.0039 | min=0.0453 max=0.0596
         : test loss mean=nan ± nan
         : individual accs = ['0.059593', '0.048775', '0.053418', '0.052850', '0.057932', '0.045253', '0.049130', '0.058174', '0.047960', '0.053776', '0.055998', '0.049606', '0.054239', '0.049083', '0.051826', '0.051626', '0.058271', '0.049486', '0.052889', '0.055475']
         : correct/total = [(246, 4128), (205, 4203), (218, 4081), (229, 4333), (237, 4091), (194, 4287), (206, 4193), (253, 4349), (201, 4191), (230, 4277), (232, 4143), (208, 4193), (222, 4093), (206, 4197), (210, 4052), (208, 4029), (242, 4153), (207, 4183), (216, 4084), (229, 4128)]
         : compromised: 0.0506, honest: 0.0549
         : ubar stats = ['Node 0: s1=0.474, s2=0.456', 'Node 1: s1=0.474, s2=0.378', 'Node 2: s1=0.474, s2=0.378']...

=== FINAL RESULTS ===
Dataset: femnist, Nodes: 20, Graph: fully, Aggregation: ubar
Attack: backdoor, 50.0% compromised
Final accuracy - Compromised: 0.0506, Honest: 0.0549
Overall test accuracy: mean=0.0528 ± 0.0039

=== BACKDOOR ATTACK SUCCESS RATE (ASR) ===
Target label: 0
Trigger size: 4x4
Overall ASR: 0.5000 ± 0.5000
Honest nodes ASR: 0.0000 ± 0.0000
Compromised nodes ASR: 1.0000 ± 0.0000
Note: Higher ASR indicates more successful backdoor attack

=== UBAR SUMMARY ===
Node 0: stage1=0.474, stage2=0.456, overall=0.216
Node 1: stage1=0.474, stage2=0.378, overall=0.179
Node 2: stage1=0.474, stage2=0.378, overall=0.179
Node 3: stage1=0.474, stage2=0.556, overall=0.263
Node 4: stage1=0.474, stage2=0.556, overall=0.263
Node 5: stage1=0.474, stage2=0.378, overall=0.179
Node 6: stage1=0.474, stage2=0.444, overall=0.211
Node 7: stage1=0.474, stage2=0.556, overall=0.263
Node 8: stage1=0.474, stage2=0.556, overall=0.263
Node 9: stage1=0.474, stage2=0.344, overall=0.163
Node 10: stage1=0.474, stage2=0.256, overall=0.121
Node 11: stage1=0.474, stage2=0.378, overall=0.179
Node 12: stage1=0.474, stage2=0.378, overall=0.179
Node 13: stage1=0.474, stage2=0.289, overall=0.137
Node 14: stage1=0.474, stage2=0.289, overall=0.137
Node 15: stage1=0.474, stage2=0.378, overall=0.179
Node 16: stage1=0.474, stage2=0.389, overall=0.184
Node 17: stage1=0.474, stage2=0.378, overall=0.179
Node 18: stage1=0.474, stage2=0.378, overall=0.179
Node 19: stage1=0.474, stage2=0.422, overall=0.200

=== PARALLEL EXECUTION TIME (realistic for distributed system) ===
  COMMUNICATION (max across nodes):
    - Full model transfer: 0.000s (0.0%)
  COMPUTATION (max across nodes):
    - Distance computation: 0.072s (1.7%)
    - Loss computation: 4.076s (98.1%)
    - Aggregation: 0.008s (0.2%)
  TOTALS:
    - Total computation: 4.156s (100.0%)
    - Total communication: 0.000s (0.0%)
    - Total parallel time: 4.156s

=== PER-NODE AVERAGE TIME ===
  - Distance computation: 0.067s
  - Loss computation: 3.849s
  - Aggregation: 0.007s
  - Model transfer: 0.000s
  - Total per node: 3.924s

=== TOTAL COMPUTATIONAL WORK (sum across all nodes) ===
  - Total distance computation: 1.350s
  - Total loss computation: 76.988s
  - Total aggregation: 0.139s
  - Total model transfer: 0.000s
  - Grand total: 78.477s
  - Mean Stage 1 acceptance rate: 0.474
  - Mean Stage 2 acceptance rate: 0.407
  - Overall acceptance rate: 0.193

UBAR Algorithm Properties:
  - Model dimension: 6,603,710
  - Rho parameter: 0.5
  - Two-stage approach: Distance filtering + loss evaluation
  - Stage 1 selects: 50% of neighbors
  - Stage 2 uses: Training sample loss comparison
  - Theoretical complexity: O(deg(i)×d + deg(i)×inference)
  - Approach: UBAR paper implementation
