Device: cuda
Seed: 987654321
Loading 36 LEAF FEMNIST train files...
LEAF FEMNIST train: 3597 users, 734463 samples
Loading 36 LEAF FEMNIST test files...
LEAF FEMNIST test: 3597 users, 83388 samples
Found 3597 train users, 3597 test users, 3597 common users
User sample counts range: 525 (max) to 17 (min)
Distributed ALL 3597 users across 20 clients
Users per client: 179 (with 17 clients getting +1 user)
Train partition sizes: [36360, 37070, 35957, 38262, 36024, 37732, 36921, 38328, 36867, 37683, 36507, 36915, 36007, 37001, 35681, 35453, 36585, 36801, 35964, 36345]
Test partition sizes: [4128, 4203, 4081, 4333, 4091, 4287, 4193, 4349, 4191, 4277, 4143, 4193, 4093, 4197, 4052, 4029, 4153, 4183, 4084, 4128]
  Client 0: 36360 train samples, 62 unique classes
  Client 1: 37070 train samples, 62 unique classes
  Client 2: 35957 train samples, 62 unique classes
  Client 3: 38262 train samples, 62 unique classes
  Client 4: 36024 train samples, 62 unique classes
  Client 5: 37732 train samples, 62 unique classes
  Client 6: 36921 train samples, 62 unique classes
  Client 7: 38328 train samples, 62 unique classes
  Client 8: 36867 train samples, 62 unique classes
  Client 9: 37683 train samples, 62 unique classes
  Client 10: 36507 train samples, 62 unique classes
  Client 11: 36915 train samples, 62 unique classes
  Client 12: 36007 train samples, 62 unique classes
  Client 13: 37001 train samples, 62 unique classes
  Client 14: 35681 train samples, 62 unique classes
  Client 15: 35453 train samples, 62 unique classes
  Client 16: 36585 train samples, 62 unique classes
  Client 17: 36801 train samples, 62 unique classes
  Client 18: 35964 train samples, 62 unique classes
  Client 19: 36345 train samples, 62 unique classes
Will sample 10000 samples per client per epoch
Graph: erdos, nodes: 20, edges: 126
Degree statistics: avg=12.60, min=8, max=16
Attack: Compromised 8/20 nodes: [1, 5, 11, 12, 13, 14, 17, 18]
Attack type: backdoor, lambda: 1.0
Backdoor target label: 0, trigger size: 4
Model variant: baseline
Model parameters: 6,603,710
Sketchguard Node 0:
  Model dim: 6,603,710 → Sketch size: 1000
  Compression ratio: 6603.7x
  Using model parameters for aggregation, sketches for filtering
Sketchguard Node 1:
  Model dim: 6,603,710 → Sketch size: 1000
  Compression ratio: 6603.7x
  Using model parameters for aggregation, sketches for filtering
Sketchguard Node 2:
  Model dim: 6,603,710 → Sketch size: 1000
  Compression ratio: 6603.7x
  Using model parameters for aggregation, sketches for filtering
Sketchguard Node 3:
  Model dim: 6,603,710 → Sketch size: 1000
  Compression ratio: 6603.7x
  Using model parameters for aggregation, sketches for filtering
Sketchguard Node 4:
  Model dim: 6,603,710 → Sketch size: 1000
  Compression ratio: 6603.7x
  Using model parameters for aggregation, sketches for filtering
Sketchguard Node 5:
  Model dim: 6,603,710 → Sketch size: 1000
  Compression ratio: 6603.7x
  Using model parameters for aggregation, sketches for filtering
Sketchguard Node 6:
  Model dim: 6,603,710 → Sketch size: 1000
  Compression ratio: 6603.7x
  Using model parameters for aggregation, sketches for filtering
Sketchguard Node 7:
  Model dim: 6,603,710 → Sketch size: 1000
  Compression ratio: 6603.7x
  Using model parameters for aggregation, sketches for filtering
Sketchguard Node 8:
  Model dim: 6,603,710 → Sketch size: 1000
  Compression ratio: 6603.7x
  Using model parameters for aggregation, sketches for filtering
Sketchguard Node 9:
  Model dim: 6,603,710 → Sketch size: 1000
  Compression ratio: 6603.7x
  Using model parameters for aggregation, sketches for filtering
Sketchguard Node 10:
  Model dim: 6,603,710 → Sketch size: 1000
  Compression ratio: 6603.7x
  Using model parameters for aggregation, sketches for filtering
Sketchguard Node 11:
  Model dim: 6,603,710 → Sketch size: 1000
  Compression ratio: 6603.7x
  Using model parameters for aggregation, sketches for filtering
Sketchguard Node 12:
  Model dim: 6,603,710 → Sketch size: 1000
  Compression ratio: 6603.7x
  Using model parameters for aggregation, sketches for filtering
Sketchguard Node 13:
  Model dim: 6,603,710 → Sketch size: 1000
  Compression ratio: 6603.7x
  Using model parameters for aggregation, sketches for filtering
Sketchguard Node 14:
  Model dim: 6,603,710 → Sketch size: 1000
  Compression ratio: 6603.7x
  Using model parameters for aggregation, sketches for filtering
Sketchguard Node 15:
  Model dim: 6,603,710 → Sketch size: 1000
  Compression ratio: 6603.7x
  Using model parameters for aggregation, sketches for filtering
Sketchguard Node 16:
  Model dim: 6,603,710 → Sketch size: 1000
  Compression ratio: 6603.7x
  Using model parameters for aggregation, sketches for filtering
Sketchguard Node 17:
  Model dim: 6,603,710 → Sketch size: 1000
  Compression ratio: 6603.7x
  Using model parameters for aggregation, sketches for filtering
Sketchguard Node 18:
  Model dim: 6,603,710 → Sketch size: 1000
  Compression ratio: 6603.7x
  Using model parameters for aggregation, sketches for filtering
Sketchguard Node 19:
  Model dim: 6,603,710 → Sketch size: 1000
  Compression ratio: 6603.7x
  Using model parameters for aggregation, sketches for filtering
Sketchguard ALGORITHM (Sketch-based Filtering + State Aggregation)
  - Model dimension: 6,603,710 parameters
  - Config: SketchguardConfig(gamma=2, kappa=1, alpha=0.5, min_neighbors=1, sketch_size=1000, network_seed=987654321, attack_detection_window=5)
  - Sketch size: 1000
  - Compression ratio: 6603.7x
  - Complexity: O(d + N×k) = O(6,603,710 + 20×1000)
  - Theoretical speedup vs BALANCE: 19.9x
Initial test acc across nodes: mean=0.0168 ± 0.0139
Backdoor attack: Created poisoned datasets for 8 compromised nodes
Round 001: test acc mean=0.3450 ± 0.1966 | min=0.0488 max=0.5555
         : test loss mean=6963.0771 ± 8793.2325
         : individual accs = ['0.555475', '0.048775', '0.550110', '0.474036', '0.485945', '0.214369', '0.516337', '0.521499', '0.502744', '0.447744', '0.499155', '0.107322', '0.054239', '0.049083', '0.150296', '0.517746', '0.452444', '0.155152', '0.102595', '0.495155']
         : correct/total = [(2293, 4128), (205, 4203), (2245, 4081), (2054, 4333), (1988, 4091), (919, 4287), (2165, 4193), (2268, 4349), (2107, 4191), (1915, 4277), (2068, 4143), (450, 4193), (222, 4093), (206, 4197), (609, 4052), (2086, 4029), (1879, 4153), (649, 4183), (419, 4084), (2044, 4128)]
         : compromised: 0.1102, honest: 0.5015
         : sketchguard stats = ['Node 0: acc_rate=0.562', 'Node 1: acc_rate=0.727', 'Node 2: acc_rate=0.500']...
Round 002: test acc mean=0.4269 ± 0.3083 | min=0.0466 max=0.7027
         : test loss mean=4415.8981 ± 12946.8759
         : individual accs = ['0.690891', '0.048061', '0.673364', '0.702746', '0.689074', '0.057849', '0.660863', '0.681766', '0.678120', '0.667524', '0.678977', '0.049606', '0.047887', '0.049321', '0.046644', '0.657483', '0.678305', '0.048291', '0.048482', '0.683624']
         : correct/total = [(2852, 4128), (202, 4203), (2748, 4081), (3045, 4333), (2819, 4091), (248, 4287), (2771, 4193), (2965, 4349), (2842, 4191), (2855, 4277), (2813, 4143), (208, 4193), (196, 4093), (207, 4197), (189, 4052), (2649, 4029), (2817, 4153), (202, 4183), (198, 4084), (2822, 4128)]
         : compromised: 0.0495, honest: 0.6786
         : sketchguard stats = ['Node 0: acc_rate=0.562', 'Node 1: acc_rate=0.864', 'Node 2: acc_rate=0.500']...
Round 003: test acc mean=0.4453 ± 0.3229 | min=0.0460 max=0.7353
         : test loss mean=nan ± nan
         : individual accs = ['0.717781', '0.048775', '0.663318', '0.730672', '0.735273', '0.045953', '0.701407', '0.720625', '0.705560', '0.716156', '0.709148', '0.049606', '0.054239', '0.049083', '0.051826', '0.705634', '0.684325', '0.049486', '0.052889', '0.715116']
         : correct/total = [(2963, 4128), (205, 4203), (2707, 4081), (3166, 4333), (3008, 4091), (197, 4287), (2941, 4193), (3134, 4349), (2957, 4191), (3063, 4277), (2938, 4143), (208, 4193), (222, 4093), (206, 4197), (210, 4052), (2843, 4029), (2842, 4153), (207, 4183), (216, 4084), (2952, 4128)]
         : compromised: 0.0502, honest: 0.7088
         : sketchguard stats = ['Node 0: acc_rate=0.562', 'Node 1: acc_rate=0.909', 'Node 2: acc_rate=0.500']...
Round 004: test acc mean=0.4406 ± 0.3194 | min=0.0453 max=0.7438
         : test loss mean=nan ± nan
         : individual accs = ['0.685320', '0.048775', '0.676550', '0.743826', '0.711073', '0.045253', '0.706654', '0.727294', '0.722501', '0.677344', '0.700217', '0.049606', '0.054239', '0.049083', '0.051826', '0.697195', '0.711534', '0.049486', '0.052889', '0.651647']
         : correct/total = [(2829, 4128), (205, 4203), (2761, 4081), (3223, 4333), (2909, 4091), (194, 4287), (2963, 4193), (3163, 4349), (3028, 4191), (2897, 4277), (2901, 4143), (208, 4193), (222, 4093), (206, 4197), (210, 4052), (2809, 4029), (2955, 4153), (207, 4183), (216, 4084), (2690, 4128)]
         : compromised: 0.0501, honest: 0.7009
         : sketchguard stats = ['Node 0: acc_rate=0.562', 'Node 1: acc_rate=0.682', 'Node 2: acc_rate=0.500']...
Round 005: test acc mean=0.4491 ± 0.3264 | min=0.0453 max=0.7521
         : test loss mean=nan ± nan
         : individual accs = ['0.697432', '0.048775', '0.700564', '0.750750', '0.752139', '0.045253', '0.706892', '0.746378', '0.683846', '0.744681', '0.724837', '0.049606', '0.054239', '0.049083', '0.051826', '0.667908', '0.709367', '0.049486', '0.052889', '0.695494']
         : correct/total = [(2879, 4128), (205, 4203), (2859, 4081), (3253, 4333), (3077, 4091), (194, 4287), (2964, 4193), (3246, 4349), (2866, 4191), (3185, 4277), (3003, 4143), (208, 4193), (222, 4093), (206, 4197), (210, 4052), (2691, 4029), (2946, 4153), (207, 4183), (216, 4084), (2871, 4128)]
         : compromised: 0.0501, honest: 0.7150
         : sketchguard stats = ['Node 0: acc_rate=0.562', 'Node 1: acc_rate=0.545', 'Node 2: acc_rate=0.500']...
Round 006: test acc mean=0.4878 ± 0.3574 | min=0.0453 max=0.7986
         : test loss mean=nan ± nan
         : individual accs = ['0.782219', '0.048775', '0.787797', '0.787445', '0.798582', '0.045253', '0.773670', '0.776500', '0.768313', '0.785364', '0.781559', '0.049606', '0.054239', '0.049083', '0.051826', '0.760238', '0.781604', '0.049486', '0.052889', '0.772045']
         : correct/total = [(3229, 4128), (205, 4203), (3215, 4081), (3412, 4333), (3267, 4091), (194, 4287), (3244, 4193), (3377, 4349), (3220, 4191), (3359, 4277), (3238, 4143), (208, 4193), (222, 4093), (206, 4197), (210, 4052), (3063, 4029), (3246, 4153), (207, 4183), (216, 4084), (3187, 4128)]
         : compromised: 0.0501, honest: 0.7796
         : sketchguard stats = ['Node 0: acc_rate=0.562', 'Node 1: acc_rate=0.455', 'Node 2: acc_rate=0.500']...
Round 007: test acc mean=0.5086 ± 0.3745 | min=0.0453 max=0.8301
         : test loss mean=nan ± nan
         : individual accs = ['0.817345', '0.048775', '0.820387', '0.816755', '0.830115', '0.045253', '0.809921', '0.828006', '0.803865', '0.824176', '0.798214', '0.049606', '0.054239', '0.049083', '0.051826', '0.793497', '0.818926', '0.049486', '0.052889', '0.810562']
         : correct/total = [(3374, 4128), (205, 4203), (3348, 4081), (3539, 4333), (3396, 4091), (194, 4287), (3396, 4193), (3601, 4349), (3369, 4191), (3525, 4277), (3307, 4143), (208, 4193), (222, 4093), (206, 4197), (210, 4052), (3197, 4029), (3401, 4153), (207, 4183), (216, 4084), (3346, 4128)]
         : compromised: 0.0501, honest: 0.8143
         : sketchguard stats = ['Node 0: acc_rate=0.562', 'Node 1: acc_rate=0.390', 'Node 2: acc_rate=0.500']...
Round 008: test acc mean=0.5171 ± 0.3813 | min=0.0453 max=0.8379
         : test loss mean=nan ± nan
         : individual accs = ['0.829215', '0.048775', '0.837785', '0.829448', '0.836715', '0.045253', '0.823038', '0.837894', '0.826294', '0.834697', '0.821868', '0.049606', '0.054239', '0.049083', '0.051826', '0.810127', '0.828798', '0.049486', '0.052889', '0.824855']
         : correct/total = [(3423, 4128), (205, 4203), (3419, 4081), (3594, 4333), (3423, 4091), (194, 4287), (3451, 4193), (3644, 4349), (3463, 4191), (3570, 4277), (3405, 4143), (208, 4193), (222, 4093), (206, 4197), (210, 4052), (3264, 4029), (3442, 4153), (207, 4183), (216, 4084), (3405, 4128)]
         : compromised: 0.0501, honest: 0.8284
         : sketchguard stats = ['Node 0: acc_rate=0.562', 'Node 1: acc_rate=0.341', 'Node 2: acc_rate=0.500']...
Round 009: test acc mean=0.5227 ± 0.3859 | min=0.0453 max=0.8544
         : test loss mean=nan ± nan
         : individual accs = ['0.829942', '0.048775', '0.850282', '0.837295', '0.845515', '0.045253', '0.827093', '0.854449', '0.833930', '0.842413', '0.828868', '0.049606', '0.054239', '0.049083', '0.051826', '0.828990', '0.843727', '0.049486', '0.052889', '0.830426']
         : correct/total = [(3426, 4128), (205, 4203), (3470, 4081), (3628, 4333), (3459, 4091), (194, 4287), (3468, 4193), (3716, 4349), (3495, 4191), (3603, 4277), (3434, 4143), (208, 4193), (222, 4093), (206, 4197), (210, 4052), (3340, 4029), (3504, 4153), (207, 4183), (216, 4084), (3428, 4128)]
         : compromised: 0.0501, honest: 0.8377
         : sketchguard stats = ['Node 0: acc_rate=0.562', 'Node 1: acc_rate=0.303', 'Node 2: acc_rate=0.500']...
Round 010: test acc mean=0.5260 ± 0.3886 | min=0.0453 max=0.8538
         : test loss mean=nan ± nan
         : individual accs = ['0.839390', '0.048775', '0.849547', '0.844680', '0.853825', '0.045253', '0.834486', '0.852610', '0.843236', '0.852233', '0.837316', '0.049606', '0.054239', '0.049083', '0.051826', '0.836188', '0.846135', '0.049486', '0.052889', '0.829942']
         : correct/total = [(3465, 4128), (205, 4203), (3467, 4081), (3660, 4333), (3493, 4091), (194, 4287), (3499, 4193), (3708, 4349), (3534, 4191), (3645, 4277), (3469, 4143), (208, 4193), (222, 4093), (206, 4197), (210, 4052), (3369, 4029), (3514, 4153), (207, 4183), (216, 4084), (3426, 4128)]
         : compromised: 0.0501, honest: 0.8433
         : sketchguard stats = ['Node 0: acc_rate=0.562', 'Node 1: acc_rate=0.273', 'Node 2: acc_rate=0.500']...

=== FINAL RESULTS ===
Dataset: femnist, Nodes: 20, Graph: erdos, Aggregation: sketchguard
Attack: backdoor, 40.0% compromised
Final accuracy - Compromised: 0.0501, Honest: 0.8433
Overall test accuracy: mean=0.5260 ± 0.3886

=== BACKDOOR ATTACK SUCCESS RATE (ASR) ===
Target label: 0
Trigger size: 4x4
Overall ASR: 0.4298 ± 0.4656
Honest nodes ASR: 0.0497 ± 0.0039
Compromised nodes ASR: 1.0000 ± 0.0000
Note: Higher ASR indicates more successful backdoor attack

=== Sketchguard SUMMARY ===
Node 0: acceptance=0.562
Node 1: acceptance=0.273
Node 2: acceptance=0.500
Node 3: acceptance=0.625
Node 4: acceptance=0.545
Node 5: acceptance=0.253
Node 6: acceptance=0.500
Node 7: acceptance=0.500
Node 8: acceptance=0.500
Node 9: acceptance=0.692
Node 10: acceptance=0.556
Node 11: acceptance=0.257
Node 12: acceptance=0.267
Node 13: acceptance=0.269
Node 14: acceptance=0.260
Node 15: acceptance=0.545
Node 16: acceptance=0.538
Node 17: acceptance=0.267
Node 18: acceptance=0.269
Node 19: acceptance=0.500

=== PARALLEL EXECUTION TIME (realistic for distributed system) ===
  COMMUNICATION (max across nodes):
    - Sketch transfer: 0.000s (0.0%)
    - Model fetch (accepted): 0.000s (0.0%)
  COMPUTATION (max across nodes):
    - Sketching: 3.570s (99.4%)
    - Filtering: 0.002s (0.0%)
    - Aggregation: 0.018s (0.5%)
  TOTALS:
    - Total computation: 3.590s (100.0%)
    - Total communication: 0.000s (0.0%)
    - Total parallel time: 3.590s

=== PER-NODE AVERAGE TIME ===
  - Sketching: 2.615s
  - Filtering: 0.001s
  - Aggregation: 0.013s
  - Sketch transfer: 0.000s
  - Model fetch: 0.000s
  - Total per node: 2.629s

=== TOTAL COMPUTATIONAL WORK (sum across all nodes) ===
  - Total sketching: 52.295s
  - Total filtering: 0.021s
  - Total aggregation: 0.254s
  - Total sketch transfer: 0.000s
  - Total model fetch: 0.000s
  - Grand total: 52.571s
  - Mean acceptance rate: 0.434

Sketchguard Algorithm Properties:
  - Original dimension: 6,603,710
  - Sketch size: 1000
  - Compression ratio: 19.9x
  - Single repetition: No repetitions needed
  - Theoretical complexity: O(d + N×k)
  - Approach: Sketch filtering + state aggregation
