Device: cuda
Seed: 987654321
Loading 36 LEAF FEMNIST train files...
LEAF FEMNIST train: 3597 users, 734463 samples
Loading 36 LEAF FEMNIST test files...
LEAF FEMNIST test: 3597 users, 83388 samples
Found 3597 train users, 3597 test users, 3597 common users
User sample counts range: 525 (max) to 17 (min)
Distributed ALL 3597 users across 20 clients
Users per client: 179 (with 17 clients getting +1 user)
Train partition sizes: [36360, 37070, 35957, 38262, 36024, 37732, 36921, 38328, 36867, 37683, 36507, 36915, 36007, 37001, 35681, 35453, 36585, 36801, 35964, 36345]
Test partition sizes: [4128, 4203, 4081, 4333, 4091, 4287, 4193, 4349, 4191, 4277, 4143, 4193, 4093, 4197, 4052, 4029, 4153, 4183, 4084, 4128]
  Client 0: 36360 train samples, 62 unique classes
  Client 1: 37070 train samples, 62 unique classes
  Client 2: 35957 train samples, 62 unique classes
  Client 3: 38262 train samples, 62 unique classes
  Client 4: 36024 train samples, 62 unique classes
  Client 5: 37732 train samples, 62 unique classes
  Client 6: 36921 train samples, 62 unique classes
  Client 7: 38328 train samples, 62 unique classes
  Client 8: 36867 train samples, 62 unique classes
  Client 9: 37683 train samples, 62 unique classes
  Client 10: 36507 train samples, 62 unique classes
  Client 11: 36915 train samples, 62 unique classes
  Client 12: 36007 train samples, 62 unique classes
  Client 13: 37001 train samples, 62 unique classes
  Client 14: 35681 train samples, 62 unique classes
  Client 15: 35453 train samples, 62 unique classes
  Client 16: 36585 train samples, 62 unique classes
  Client 17: 36801 train samples, 62 unique classes
  Client 18: 35964 train samples, 62 unique classes
  Client 19: 36345 train samples, 62 unique classes
Will sample 4500 samples per client per epoch
Graph: ring, nodes: 20, edges: 20
Degree statistics: avg=2.00, min=2, max=2
Attack: Compromised 12/20 nodes: [1, 2, 3, 5, 8, 11, 12, 13, 14, 15, 17, 18]
Attack type: backdoor, lambda: 1.0
Backdoor target label: 0, trigger size: 4
Model variant: baseline
Model parameters: 6,603,710
UBAR ALGORITHM (Two-Stage Byzantine-resilient)
  - Model dimension: 6,603,710 parameters
  - Rho parameter: 0.4
  - Stage 1: Distance-based filtering (select 40% closest neighbors)
  - Stage 2: Performance-based selection (loss comparison)
  - Complexity: O(deg(i)×d + deg(i)×inference)
Initial test acc across nodes: mean=0.0168 ± 0.0139
Backdoor attack: Created poisoned datasets for 12 compromised nodes
Round 001: test acc mean=0.0457 ± 0.0100 | min=0.0077 max=0.0553
         : test loss mean=34499.0669 ± 35604.7982
         : individual accs = ['0.049661', '0.048775', '0.048272', '0.043157', '0.037155', '0.045253', '0.044598', '0.049207', '0.049630', '0.047463', '0.055274', '0.049606', '0.033960', '0.049083', '0.051826', '0.051626', '0.007705', '0.049486', '0.052889', '0.050145']
         : correct/total = [(205, 4128), (205, 4203), (197, 4081), (187, 4333), (152, 4091), (194, 4287), (187, 4193), (214, 4349), (208, 4191), (203, 4277), (229, 4143), (208, 4193), (139, 4093), (206, 4197), (210, 4052), (208, 4029), (32, 4153), (207, 4183), (216, 4084), (207, 4128)]
         : compromised: 0.0478, honest: 0.0427
         : ubar stats = ['Node 0: s1=0.500, s2=1.000', 'Node 1: s1=0.500, s2=1.000', 'Node 2: s1=0.500, s2=1.000']...
Round 002: test acc mean=0.0409 ± 0.0173 | min=0.0072 max=0.0582
         : test loss mean=2206726901.6119 ± 6972363366.1399
         : individual accs = ['0.051599', '0.009041', '0.053418', '0.007154', '0.052554', '0.028691', '0.057000', '0.058174', '0.021475', '0.048398', '0.045619', '0.010255', '0.050574', '0.047177', '0.051826', '0.056590', '0.051288', '0.050920', '0.017630', '0.048450']
         : correct/total = [(213, 4128), (38, 4203), (218, 4081), (31, 4333), (215, 4091), (123, 4287), (239, 4193), (253, 4349), (90, 4191), (207, 4277), (189, 4143), (43, 4193), (207, 4093), (198, 4197), (210, 4052), (228, 4029), (213, 4153), (213, 4183), (72, 4084), (200, 4128)]
         : compromised: 0.0337, honest: 0.0516
         : ubar stats = ['Node 0: s1=0.500, s2=1.000', 'Node 1: s1=0.500, s2=1.000', 'Node 2: s1=0.500, s2=1.000']...
Round 003: test acc mean=0.0501 ± 0.0041 | min=0.0430 max=0.0596
         : test loss mean=nan ± nan
         : individual accs = ['0.059593', '0.048775', '0.048763', '0.043157', '0.043021', '0.045253', '0.044598', '0.049207', '0.049630', '0.047463', '0.055274', '0.049606', '0.054239', '0.049559', '0.051826', '0.051626', '0.052011', '0.049486', '0.052889', '0.055475']
         : correct/total = [(246, 4128), (205, 4203), (199, 4081), (187, 4333), (176, 4091), (194, 4287), (187, 4193), (214, 4349), (208, 4191), (203, 4277), (229, 4143), (208, 4193), (222, 4093), (208, 4197), (210, 4052), (208, 4029), (216, 4153), (207, 4183), (216, 4084), (229, 4128)]
         : compromised: 0.0496, honest: 0.0508
         : ubar stats = ['Node 0: s1=0.500, s2=1.000', 'Node 1: s1=0.500, s2=1.000', 'Node 2: s1=0.500, s2=1.000']...
Round 004: test acc mean=0.0574 ± 0.0167 | min=0.0430 max=0.0974
         : test loss mean=nan ± nan
         : individual accs = ['0.097384', '0.048775', '0.053418', '0.043157', '0.043021', '0.045253', '0.082518', '0.086917', '0.049630', '0.048398', '0.045619', '0.049606', '0.054239', '0.049083', '0.051826', '0.051626', '0.052011', '0.049486', '0.052889', '0.092539']
         : correct/total = [(402, 4128), (205, 4203), (218, 4081), (187, 4333), (176, 4091), (194, 4287), (346, 4193), (378, 4349), (208, 4191), (207, 4277), (189, 4143), (208, 4193), (222, 4093), (206, 4197), (210, 4052), (208, 4029), (216, 4153), (207, 4183), (216, 4084), (382, 4128)]
         : compromised: 0.0499, honest: 0.0686
         : ubar stats = ['Node 0: s1=0.500, s2=1.000', 'Node 1: s1=0.500, s2=1.000', 'Node 2: s1=0.500, s2=1.000']...
Round 005: test acc mean=0.0535 ± 0.0114 | min=0.0430 max=0.0899
         : test loss mean=nan ± nan
         : individual accs = ['0.089874', '0.048775', '0.053418', '0.043157', '0.043021', '0.045253', '0.046745', '0.047827', '0.049630', '0.053776', '0.055998', '0.049606', '0.054239', '0.049083', '0.051826', '0.051626', '0.052011', '0.049486', '0.052889', '0.081638']
         : correct/total = [(371, 4128), (205, 4203), (218, 4081), (187, 4333), (176, 4091), (194, 4287), (196, 4193), (208, 4349), (208, 4191), (230, 4277), (232, 4143), (208, 4193), (222, 4093), (206, 4197), (210, 4052), (208, 4029), (216, 4153), (207, 4183), (216, 4084), (337, 4128)]
         : compromised: 0.0499, honest: 0.0589
         : ubar stats = ['Node 0: s1=0.500, s2=1.000', 'Node 1: s1=0.500, s2=1.000', 'Node 2: s1=0.500, s2=1.000']...
Round 006: test acc mean=0.0559 ± 0.0137 | min=0.0430 max=0.0910
         : test loss mean=nan ± nan
         : individual accs = ['0.077035', '0.048775', '0.053418', '0.043157', '0.043021', '0.045253', '0.043883', '0.053346', '0.049630', '0.090952', '0.086894', '0.049606', '0.054239', '0.049083', '0.051826', '0.051626', '0.052011', '0.049486', '0.052889', '0.071221']
         : correct/total = [(318, 4128), (205, 4203), (218, 4081), (187, 4333), (176, 4091), (194, 4287), (184, 4193), (232, 4349), (208, 4191), (389, 4277), (360, 4143), (208, 4193), (222, 4093), (206, 4197), (210, 4052), (208, 4029), (216, 4153), (207, 4183), (216, 4084), (294, 4128)]
         : compromised: 0.0499, honest: 0.0648
         : ubar stats = ['Node 0: s1=0.500, s2=1.000', 'Node 1: s1=0.500, s2=1.000', 'Node 2: s1=0.500, s2=1.000']...
Round 007: test acc mean=0.0642 ± 0.0284 | min=0.0430 max=0.1410
         : test loss mean=nan ± nan
         : individual accs = ['0.140988', '0.048775', '0.053418', '0.043157', '0.043021', '0.045253', '0.097544', '0.092205', '0.049630', '0.060556', '0.063239', '0.049606', '0.054239', '0.049083', '0.051826', '0.051626', '0.052011', '0.049486', '0.052889', '0.136386']
         : correct/total = [(582, 4128), (205, 4203), (218, 4081), (187, 4333), (176, 4091), (194, 4287), (409, 4193), (401, 4349), (208, 4191), (259, 4277), (262, 4143), (208, 4193), (222, 4093), (206, 4197), (210, 4052), (208, 4029), (216, 4153), (207, 4183), (216, 4084), (563, 4128)]
         : compromised: 0.0499, honest: 0.0857
         : ubar stats = ['Node 0: s1=0.500, s2=1.000', 'Node 1: s1=0.500, s2=1.000', 'Node 2: s1=0.500, s2=1.000']...
Round 008: test acc mean=0.0617 ± 0.0288 | min=0.0430 max=0.1514
         : test loss mean=nan ± nan
         : individual accs = ['0.151405', '0.048775', '0.053418', '0.043157', '0.043021', '0.045253', '0.049130', '0.051276', '0.049630', '0.073884', '0.077963', '0.049606', '0.054239', '0.049083', '0.051826', '0.051626', '0.052011', '0.049486', '0.052889', '0.137112']
         : correct/total = [(625, 4128), (205, 4203), (218, 4081), (187, 4333), (176, 4091), (194, 4287), (206, 4193), (223, 4349), (208, 4191), (316, 4277), (323, 4143), (208, 4193), (222, 4093), (206, 4197), (210, 4052), (208, 4029), (216, 4153), (207, 4183), (216, 4084), (566, 4128)]
         : compromised: 0.0499, honest: 0.0795
         : ubar stats = ['Node 0: s1=0.500, s2=1.000', 'Node 1: s1=0.500, s2=1.000', 'Node 2: s1=0.500, s2=1.000']...
Round 009: test acc mean=0.0528 ± 0.0064 | min=0.0430 max=0.0708
         : test loss mean=nan ± nan
         : individual accs = ['0.061773', '0.048775', '0.053418', '0.043157', '0.043021', '0.045253', '0.070832', '0.059784', '0.049630', '0.057751', '0.056481', '0.049606', '0.054239', '0.049083', '0.051826', '0.051626', '0.052011', '0.049486', '0.052889', '0.055717']
         : correct/total = [(255, 4128), (205, 4203), (218, 4081), (187, 4333), (176, 4091), (194, 4287), (297, 4193), (260, 4349), (208, 4191), (247, 4277), (234, 4143), (208, 4193), (222, 4093), (206, 4197), (210, 4052), (208, 4029), (216, 4153), (207, 4183), (216, 4084), (230, 4128)]
         : compromised: 0.0499, honest: 0.0572
         : ubar stats = ['Node 0: s1=0.500, s2=1.000', 'Node 1: s1=0.500, s2=1.000', 'Node 2: s1=0.500, s2=1.000']...
Round 010: test acc mean=0.0558 ± 0.0152 | min=0.0430 max=0.1042
         : test loss mean=nan ± nan
         : individual accs = ['0.104167', '0.048775', '0.053418', '0.043157', '0.043021', '0.045253', '0.055092', '0.058634', '0.049630', '0.053776', '0.055998', '0.049606', '0.054239', '0.049083', '0.051826', '0.051626', '0.052011', '0.049486', '0.052889', '0.095203']
         : correct/total = [(430, 4128), (205, 4203), (218, 4081), (187, 4333), (176, 4091), (194, 4287), (231, 4193), (255, 4349), (208, 4191), (230, 4277), (232, 4143), (208, 4193), (222, 4093), (206, 4197), (210, 4052), (208, 4029), (216, 4153), (207, 4183), (216, 4084), (393, 4128)]
         : compromised: 0.0499, honest: 0.0647
         : ubar stats = ['Node 0: s1=0.500, s2=1.000', 'Node 1: s1=0.500, s2=1.000', 'Node 2: s1=0.500, s2=1.000']...

=== FINAL RESULTS ===
Dataset: femnist, Nodes: 20, Graph: ring, Aggregation: ubar
Attack: backdoor, 60.0% compromised
Final accuracy - Compromised: 0.0499, Honest: 0.0647
Overall test accuracy: mean=0.0558 ± 0.0152

=== BACKDOOR ATTACK SUCCESS RATE (ASR) ===
Target label: 0
Trigger size: 4x4
Overall ASR: 0.7000 ± 0.4583
Honest nodes ASR: 0.2500 ± 0.4330
Compromised nodes ASR: 1.0000 ± 0.0000
Note: Higher ASR indicates more successful backdoor attack

=== UBAR SUMMARY ===
Node 0: stage1=0.500, stage2=1.000, overall=0.500
Node 1: stage1=0.500, stage2=1.000, overall=0.500
Node 2: stage1=0.500, stage2=1.000, overall=0.500
Node 3: stage1=0.500, stage2=1.000, overall=0.500
Node 4: stage1=0.500, stage2=1.000, overall=0.500
Node 5: stage1=0.500, stage2=1.000, overall=0.500
Node 6: stage1=0.500, stage2=1.000, overall=0.500
Node 7: stage1=0.500, stage2=1.000, overall=0.500
Node 8: stage1=0.500, stage2=1.000, overall=0.500
Node 9: stage1=0.500, stage2=1.000, overall=0.500
Node 10: stage1=0.500, stage2=1.000, overall=0.500
Node 11: stage1=0.500, stage2=1.000, overall=0.500
Node 12: stage1=0.500, stage2=1.000, overall=0.500
Node 13: stage1=0.500, stage2=1.000, overall=0.500
Node 14: stage1=0.500, stage2=1.000, overall=0.500
Node 15: stage1=0.500, stage2=1.000, overall=0.500
Node 16: stage1=0.500, stage2=1.000, overall=0.500
Node 17: stage1=0.500, stage2=1.000, overall=0.500
Node 18: stage1=0.500, stage2=1.000, overall=0.500
Node 19: stage1=0.500, stage2=1.000, overall=0.500

=== PARALLEL EXECUTION TIME (realistic for distributed system) ===
  COMMUNICATION (max across nodes):
    - Full model transfer: 0.000s (0.0%)
  COMPUTATION (max across nodes):
    - Distance computation: 0.035s (0.8%)
    - Loss computation: 4.078s (99.0%)
    - Aggregation: 0.005s (0.1%)
  TOTALS:
    - Total computation: 4.118s (100.0%)
    - Total communication: 0.000s (0.0%)
    - Total parallel time: 4.118s

=== PER-NODE AVERAGE TIME ===
  - Distance computation: 0.022s
  - Loss computation: 3.827s
  - Aggregation: 0.004s
  - Model transfer: 0.000s
  - Total per node: 3.854s

=== TOTAL COMPUTATIONAL WORK (sum across all nodes) ===
  - Total distance computation: 0.434s
  - Total loss computation: 76.550s
  - Total aggregation: 0.089s
  - Total model transfer: 0.000s
  - Grand total: 77.073s
  - Mean Stage 1 acceptance rate: 0.500
  - Mean Stage 2 acceptance rate: 1.000
  - Overall acceptance rate: 0.500

UBAR Algorithm Properties:
  - Model dimension: 6,603,710
  - Rho parameter: 0.4
  - Two-stage approach: Distance filtering + loss evaluation
  - Stage 1 selects: 40% of neighbors
  - Stage 2 uses: Training sample loss comparison
  - Theoretical complexity: O(deg(i)×d + deg(i)×inference)
  - Approach: UBAR paper implementation
