Device: cuda
Seed: 987654321
Loading 36 LEAF FEMNIST train files...
LEAF FEMNIST train: 3597 users, 734463 samples
Loading 36 LEAF FEMNIST test files...
LEAF FEMNIST test: 3597 users, 83388 samples
Found 3597 train users, 3597 test users, 3597 common users
User sample counts range: 525 (max) to 17 (min)
Distributed ALL 3597 users across 20 clients
Users per client: 179 (with 17 clients getting +1 user)
Train partition sizes: [36360, 37070, 35957, 38262, 36024, 37732, 36921, 38328, 36867, 37683, 36507, 36915, 36007, 37001, 35681, 35453, 36585, 36801, 35964, 36345]
Test partition sizes: [4128, 4203, 4081, 4333, 4091, 4287, 4193, 4349, 4191, 4277, 4143, 4193, 4093, 4197, 4052, 4029, 4153, 4183, 4084, 4128]
  Client 0: 36360 train samples, 62 unique classes
  Client 1: 37070 train samples, 62 unique classes
  Client 2: 35957 train samples, 62 unique classes
  Client 3: 38262 train samples, 62 unique classes
  Client 4: 36024 train samples, 62 unique classes
  Client 5: 37732 train samples, 62 unique classes
  Client 6: 36921 train samples, 62 unique classes
  Client 7: 38328 train samples, 62 unique classes
  Client 8: 36867 train samples, 62 unique classes
  Client 9: 37683 train samples, 62 unique classes
  Client 10: 36507 train samples, 62 unique classes
  Client 11: 36915 train samples, 62 unique classes
  Client 12: 36007 train samples, 62 unique classes
  Client 13: 37001 train samples, 62 unique classes
  Client 14: 35681 train samples, 62 unique classes
  Client 15: 35453 train samples, 62 unique classes
  Client 16: 36585 train samples, 62 unique classes
  Client 17: 36801 train samples, 62 unique classes
  Client 18: 35964 train samples, 62 unique classes
  Client 19: 36345 train samples, 62 unique classes
Will sample 10000 samples per client per epoch
Graph: erdos, nodes: 20, edges: 126
Degree statistics: avg=12.60, min=8, max=16
Attack: Compromised 14/20 nodes: [1, 2, 3, 5, 6, 8, 11, 12, 13, 14, 15, 17, 18, 19]
Attack type: krum, lambda: 1.0
Model variant: baseline
Model parameters: 6,603,710
Sketchguard Node 0:
  Model dim: 6,603,710 → Sketch size: 1000
  Compression ratio: 6603.7x
  Using model parameters for aggregation, sketches for filtering
Sketchguard Node 1:
  Model dim: 6,603,710 → Sketch size: 1000
  Compression ratio: 6603.7x
  Using model parameters for aggregation, sketches for filtering
Sketchguard Node 2:
  Model dim: 6,603,710 → Sketch size: 1000
  Compression ratio: 6603.7x
  Using model parameters for aggregation, sketches for filtering
Sketchguard Node 3:
  Model dim: 6,603,710 → Sketch size: 1000
  Compression ratio: 6603.7x
  Using model parameters for aggregation, sketches for filtering
Sketchguard Node 4:
  Model dim: 6,603,710 → Sketch size: 1000
  Compression ratio: 6603.7x
  Using model parameters for aggregation, sketches for filtering
Sketchguard Node 5:
  Model dim: 6,603,710 → Sketch size: 1000
  Compression ratio: 6603.7x
  Using model parameters for aggregation, sketches for filtering
Sketchguard Node 6:
  Model dim: 6,603,710 → Sketch size: 1000
  Compression ratio: 6603.7x
  Using model parameters for aggregation, sketches for filtering
Sketchguard Node 7:
  Model dim: 6,603,710 → Sketch size: 1000
  Compression ratio: 6603.7x
  Using model parameters for aggregation, sketches for filtering
Sketchguard Node 8:
  Model dim: 6,603,710 → Sketch size: 1000
  Compression ratio: 6603.7x
  Using model parameters for aggregation, sketches for filtering
Sketchguard Node 9:
  Model dim: 6,603,710 → Sketch size: 1000
  Compression ratio: 6603.7x
  Using model parameters for aggregation, sketches for filtering
Sketchguard Node 10:
  Model dim: 6,603,710 → Sketch size: 1000
  Compression ratio: 6603.7x
  Using model parameters for aggregation, sketches for filtering
Sketchguard Node 11:
  Model dim: 6,603,710 → Sketch size: 1000
  Compression ratio: 6603.7x
  Using model parameters for aggregation, sketches for filtering
Sketchguard Node 12:
  Model dim: 6,603,710 → Sketch size: 1000
  Compression ratio: 6603.7x
  Using model parameters for aggregation, sketches for filtering
Sketchguard Node 13:
  Model dim: 6,603,710 → Sketch size: 1000
  Compression ratio: 6603.7x
  Using model parameters for aggregation, sketches for filtering
Sketchguard Node 14:
  Model dim: 6,603,710 → Sketch size: 1000
  Compression ratio: 6603.7x
  Using model parameters for aggregation, sketches for filtering
Sketchguard Node 15:
  Model dim: 6,603,710 → Sketch size: 1000
  Compression ratio: 6603.7x
  Using model parameters for aggregation, sketches for filtering
Sketchguard Node 16:
  Model dim: 6,603,710 → Sketch size: 1000
  Compression ratio: 6603.7x
  Using model parameters for aggregation, sketches for filtering
Sketchguard Node 17:
  Model dim: 6,603,710 → Sketch size: 1000
  Compression ratio: 6603.7x
  Using model parameters for aggregation, sketches for filtering
Sketchguard Node 18:
  Model dim: 6,603,710 → Sketch size: 1000
  Compression ratio: 6603.7x
  Using model parameters for aggregation, sketches for filtering
Sketchguard Node 19:
  Model dim: 6,603,710 → Sketch size: 1000
  Compression ratio: 6603.7x
  Using model parameters for aggregation, sketches for filtering
Sketchguard ALGORITHM (Sketch-based Filtering + State Aggregation)
  - Model dimension: 6,603,710 parameters
  - Config: SketchguardConfig(gamma=2, kappa=1, alpha=0.5, min_neighbors=1, sketch_size=1000, network_seed=987654321, attack_detection_window=5)
  - Sketch size: 1000
  - Compression ratio: 6603.7x
  - Complexity: O(d + N×k) = O(6,603,710 + 20×1000)
  - Theoretical speedup vs BALANCE: 19.9x
Initial test acc across nodes: mean=0.0168 ± 0.0139
Round 001: test acc mean=0.4541 ± 0.0523 | min=0.3713 max=0.5708
         : test loss mean=3.7584 ± 0.0300
         : individual accs = ['0.508236', '0.466096', '0.528302', '0.408493', '0.460279', '0.570795', '0.452421', '0.456427', '0.373419', '0.371288', '0.403572', '0.500119', '0.417786', '0.413391', '0.487907', '0.476297', '0.378522', '0.490079', '0.440500', '0.478440']
         : correct/total = [(2098, 4128), (1959, 4203), (2156, 4081), (1770, 4333), (1883, 4091), (2447, 4287), (1897, 4193), (1985, 4349), (1565, 4191), (1588, 4277), (1672, 4143), (2097, 4193), (1710, 4093), (1735, 4197), (1977, 4052), (1919, 4029), (1572, 4153), (2050, 4183), (1799, 4084), (1975, 4128)]
         : compromised: 0.4646, honest: 0.4297
         : sketchguard stats = ['Node 0: acc_rate=0.312', 'Node 1: acc_rate=0.364', 'Node 2: acc_rate=0.333']...
Round 002: test acc mean=0.6466 ± 0.0339 | min=0.5527 max=0.6897
         : test loss mean=3.2041 ± 0.1969
         : individual accs = ['0.662548', '0.680704', '0.597893', '0.682668', '0.687851', '0.687894', '0.631767', '0.643826', '0.623717', '0.649755', '0.610669', '0.623897', '0.637674', '0.647844', '0.658687', '0.552743', '0.657597', '0.689696', '0.672870', '0.631783']
         : correct/total = [(2735, 4128), (2861, 4203), (2440, 4081), (2958, 4333), (2814, 4091), (2949, 4287), (2649, 4193), (2800, 4349), (2614, 4191), (2779, 4277), (2530, 4143), (2616, 4193), (2610, 4093), (2719, 4197), (2669, 4052), (2227, 4029), (2731, 4153), (2885, 4183), (2748, 4084), (2608, 4128)]
         : compromised: 0.6443, honest: 0.6520
         : sketchguard stats = ['Node 0: acc_rate=0.312', 'Node 1: acc_rate=0.364', 'Node 2: acc_rate=0.333']...
Round 003: test acc mean=0.6671 ± 0.0469 | min=0.5593 max=0.7385
         : test loss mean=2.2170 ± 0.4224
         : individual accs = ['0.712694', '0.677611', '0.603038', '0.696054', '0.738450', '0.658036', '0.631290', '0.702690', '0.723216', '0.706570', '0.695148', '0.559265', '0.678720', '0.700500', '0.645360', '0.648300', '0.712256', '0.600287', '0.621450', '0.631298']
         : correct/total = [(2942, 4128), (2848, 4203), (2461, 4081), (3016, 4333), (3021, 4091), (2821, 4287), (2647, 4193), (3056, 4349), (3031, 4191), (3022, 4277), (2880, 4143), (2345, 4193), (2778, 4093), (2940, 4197), (2615, 4052), (2612, 4029), (2958, 4153), (2511, 4183), (2538, 4084), (2606, 4128)]
         : compromised: 0.6482, honest: 0.7113
         : sketchguard stats = ['Node 0: acc_rate=0.312', 'Node 1: acc_rate=0.364', 'Node 2: acc_rate=0.333']...
Round 004: test acc mean=0.7558 ± 0.0268 | min=0.6676 max=0.7878
         : test loss mean=1.1408 ± 0.2268
         : individual accs = ['0.764777', '0.751130', '0.766479', '0.764597', '0.787827', '0.740844', '0.739804', '0.779030', '0.779289', '0.779986', '0.771422', '0.730503', '0.755436', '0.775792', '0.743583', '0.751055', '0.786419', '0.751853', '0.728942', '0.667636']
         : correct/total = [(3157, 4128), (3157, 4203), (3128, 4081), (3313, 4333), (3223, 4091), (3176, 4287), (3102, 4193), (3388, 4349), (3266, 4191), (3336, 4277), (3196, 4143), (3063, 4193), (3092, 4093), (3256, 4197), (3013, 4052), (3026, 4029), (3266, 4153), (3145, 4183), (2977, 4084), (2756, 4128)]
         : compromised: 0.7462, honest: 0.7782
         : sketchguard stats = ['Node 0: acc_rate=0.312', 'Node 1: acc_rate=0.364', 'Node 2: acc_rate=0.333']...
Round 005: test acc mean=0.8061 ± 0.0106 | min=0.7877 max=0.8218
         : test loss mean=0.6780 ± 0.0546
         : individual accs = ['0.810320', '0.812753', '0.820387', '0.801523', '0.821804', '0.808724', '0.794658', '0.818579', '0.803865', '0.819266', '0.804007', '0.787741', '0.796970', '0.812485', '0.805281', '0.794986', '0.820371', '0.793450', '0.805828', '0.789486']
         : correct/total = [(3345, 4128), (3416, 4203), (3348, 4081), (3473, 4333), (3362, 4091), (3467, 4287), (3332, 4193), (3560, 4349), (3369, 4191), (3504, 4277), (3331, 4143), (3303, 4193), (3262, 4093), (3410, 4197), (3263, 4052), (3203, 4029), (3407, 4153), (3319, 4183), (3291, 4084), (3259, 4128)]
         : compromised: 0.8020, honest: 0.8157
         : sketchguard stats = ['Node 0: acc_rate=0.312', 'Node 1: acc_rate=0.364', 'Node 2: acc_rate=0.333']...
Round 006: test acc mean=0.8230 ± 0.0070 | min=0.8109 max=0.8344
         : test loss mean=0.5653 ± 0.0253
         : individual accs = ['0.823401', '0.834404', '0.833374', '0.825525', '0.833048', '0.823653', '0.814453', '0.832375', '0.816512', '0.829320', '0.816558', '0.817553', '0.820425', '0.822969', '0.818855', '0.810871', '0.823501', '0.815683', '0.830803', '0.817345']
         : correct/total = [(3399, 4128), (3507, 4203), (3401, 4081), (3577, 4333), (3408, 4091), (3531, 4287), (3415, 4193), (3620, 4349), (3422, 4191), (3547, 4277), (3383, 4143), (3428, 4193), (3358, 4093), (3454, 4197), (3318, 4052), (3267, 4029), (3420, 4153), (3412, 4183), (3393, 4084), (3374, 4128)]
         : compromised: 0.8216, honest: 0.8264
         : sketchguard stats = ['Node 0: acc_rate=0.312', 'Node 1: acc_rate=0.364', 'Node 2: acc_rate=0.333']...
Round 007: test acc mean=0.8342 ± 0.0080 | min=0.8202 max=0.8473
         : test loss mean=0.5140 ± 0.0243
         : individual accs = ['0.836725', '0.837497', '0.841460', '0.839603', '0.845759', '0.834616', '0.827331', '0.847321', '0.828681', '0.843348', '0.820179', '0.825423', '0.837527', '0.832023', '0.832182', '0.822040', '0.838671', '0.822376', '0.843291', '0.827519']
         : correct/total = [(3454, 4128), (3520, 4203), (3434, 4081), (3638, 4333), (3460, 4091), (3578, 4287), (3469, 4193), (3685, 4349), (3473, 4191), (3607, 4277), (3398, 4143), (3461, 4193), (3428, 4093), (3492, 4197), (3372, 4052), (3312, 4029), (3483, 4153), (3440, 4183), (3444, 4084), (3416, 4128)]
         : compromised: 0.8323, honest: 0.8387
         : sketchguard stats = ['Node 0: acc_rate=0.312', 'Node 1: acc_rate=0.364', 'Node 2: acc_rate=0.333']...
Round 008: test acc mean=0.8411 ± 0.0081 | min=0.8250 max=0.8519
         : test loss mean=0.4862 ± 0.0247
         : individual accs = ['0.840843', '0.848917', '0.849547', '0.846296', '0.851870', '0.850012', '0.832817', '0.848471', '0.839656', '0.849895', '0.828385', '0.832101', '0.845834', '0.842030', '0.831441', '0.825019', '0.841079', '0.836242', '0.848433', '0.833576']
         : correct/total = [(3471, 4128), (3568, 4203), (3467, 4081), (3667, 4333), (3485, 4091), (3644, 4287), (3492, 4193), (3690, 4349), (3519, 4191), (3635, 4277), (3432, 4143), (3489, 4193), (3462, 4093), (3534, 4197), (3369, 4052), (3324, 4029), (3493, 4153), (3498, 4183), (3465, 4084), (3441, 4128)]
         : compromised: 0.8401, honest: 0.8434
         : sketchguard stats = ['Node 0: acc_rate=0.312', 'Node 1: acc_rate=0.364', 'Node 2: acc_rate=0.333']...
Round 009: test acc mean=0.8451 ± 0.0075 | min=0.8350 max=0.8607
         : test loss mean=0.4668 ± 0.0219
         : individual accs = ['0.839632', '0.852962', '0.852732', '0.851835', '0.851626', '0.851878', '0.836394', '0.860658', '0.841088', '0.852700', '0.835868', '0.838063', '0.845834', '0.840362', '0.837858', '0.836684', '0.848302', '0.841501', '0.851616', '0.835029']
         : correct/total = [(3466, 4128), (3585, 4203), (3480, 4081), (3691, 4333), (3484, 4091), (3652, 4287), (3507, 4193), (3743, 4349), (3525, 4191), (3647, 4277), (3463, 4143), (3514, 4193), (3462, 4093), (3527, 4197), (3395, 4052), (3371, 4029), (3523, 4153), (3520, 4183), (3478, 4084), (3447, 4128)]
         : compromised: 0.8438, honest: 0.8481
         : sketchguard stats = ['Node 0: acc_rate=0.312', 'Node 1: acc_rate=0.364', 'Node 2: acc_rate=0.333']...
Round 010: test acc mean=0.8493 ± 0.0075 | min=0.8365 max=0.8609
         : test loss mean=0.4532 ± 0.0217
         : individual accs = ['0.845203', '0.857483', '0.855428', '0.848835', '0.857492', '0.852344', '0.840448', '0.858818', '0.847769', '0.857610', '0.837316', '0.840448', '0.853653', '0.849893', '0.847730', '0.837677', '0.852877', '0.847239', '0.860921', '0.836483']
         : correct/total = [(3489, 4128), (3604, 4203), (3491, 4081), (3678, 4333), (3508, 4091), (3654, 4287), (3524, 4193), (3735, 4349), (3553, 4191), (3668, 4277), (3469, 4143), (3524, 4193), (3494, 4093), (3567, 4197), (3435, 4052), (3375, 4029), (3542, 4153), (3544, 4183), (3516, 4084), (3453, 4128)]
         : compromised: 0.8483, honest: 0.8516
         : sketchguard stats = ['Node 0: acc_rate=0.312', 'Node 1: acc_rate=0.364', 'Node 2: acc_rate=0.333']...

=== FINAL RESULTS ===
Dataset: femnist, Nodes: 20, Graph: erdos, Aggregation: sketchguard
Attack: krum, 70.0% compromised
Final accuracy - Compromised: 0.8483, Honest: 0.8516
Overall test accuracy: mean=0.8493 ± 0.0075

=== Sketchguard SUMMARY ===
Node 0: acceptance=0.312
Node 1: acceptance=0.364
Node 2: acceptance=0.333
Node 3: acceptance=0.375
Node 4: acceptance=0.364
Node 5: acceptance=0.267
Node 6: acceptance=0.286
Node 7: acceptance=0.286
Node 8: acceptance=0.200
Node 9: acceptance=0.308
Node 10: acceptance=0.222
Node 11: acceptance=0.357
Node 12: acceptance=0.333
Node 13: acceptance=0.231
Node 14: acceptance=0.267
Node 15: acceptance=0.273
Node 16: acceptance=0.231
Node 17: acceptance=0.444
Node 18: acceptance=0.312
Node 19: acceptance=0.312

=== PARALLEL EXECUTION TIME (realistic for distributed system) ===
  COMMUNICATION (max across nodes):
    - Sketch transfer: 0.000s (0.0%)
    - Model fetch (accepted): 0.000s (0.0%)
  COMPUTATION (max across nodes):
    - Sketching: 2.886s (99.2%)
    - Filtering: 0.004s (0.1%)
    - Aggregation: 0.018s (0.6%)
  TOTALS:
    - Total computation: 2.908s (100.0%)
    - Total communication: 0.000s (0.0%)
    - Total parallel time: 2.908s

=== PER-NODE AVERAGE TIME ===
  - Sketching: 2.348s
  - Filtering: 0.001s
  - Aggregation: 0.012s
  - Sketch transfer: 0.000s
  - Model fetch: 0.000s
  - Total per node: 2.361s

=== TOTAL COMPUTATIONAL WORK (sum across all nodes) ===
  - Total sketching: 46.958s
  - Total filtering: 0.026s
  - Total aggregation: 0.234s
  - Total sketch transfer: 0.000s
  - Total model fetch: 0.000s
  - Grand total: 47.219s
  - Mean acceptance rate: 0.304

Sketchguard Algorithm Properties:
  - Original dimension: 6,603,710
  - Sketch size: 1000
  - Compression ratio: 19.9x
  - Single repetition: No repetitions needed
  - Theoretical complexity: O(d + N×k)
  - Approach: Sketch filtering + state aggregation
