/home/student.unimelb.edu.au/mrangwala/miniconda3/envs/edgedrift/lib/python3.12/site-packages/torch/_inductor/compile_fx.py:282: UserWarning: TensorFloat32 tensor cores for float32 matrix multiplication available but not enabled. Consider setting `torch.set_float32_matmul_precision('high')` for better performance.
  warnings.warn(
Device: cuda
Seed: 987654321
Loading 36 LEAF FEMNIST train files...
LEAF FEMNIST train: 3597 users, 734463 samples
Loading 36 LEAF FEMNIST test files...
LEAF FEMNIST test: 3597 users, 83388 samples
Found 3597 train users, 3597 test users, 3597 common users
User sample counts range: 525 (max) to 17 (min)
Distributed ALL 3597 users across 20 clients
Users per client: 179 (with 17 clients getting +1 user)
Train partition sizes: [36360, 37070, 35957, 38262, 36024, 37732, 36921, 38328, 36867, 37683, 36507, 36915, 36007, 37001, 35681, 35453, 36585, 36801, 35964, 36345]
Test partition sizes: [4128, 4203, 4081, 4333, 4091, 4287, 4193, 4349, 4191, 4277, 4143, 4193, 4093, 4197, 4052, 4029, 4153, 4183, 4084, 4128]
  Client 0: 36360 train samples, 62 unique classes
  Client 1: 37070 train samples, 62 unique classes
  Client 2: 35957 train samples, 62 unique classes
  Client 3: 38262 train samples, 62 unique classes
  Client 4: 36024 train samples, 62 unique classes
  Client 5: 37732 train samples, 62 unique classes
  Client 6: 36921 train samples, 62 unique classes
  Client 7: 38328 train samples, 62 unique classes
  Client 8: 36867 train samples, 62 unique classes
  Client 9: 37683 train samples, 62 unique classes
  Client 10: 36507 train samples, 62 unique classes
  Client 11: 36915 train samples, 62 unique classes
  Client 12: 36007 train samples, 62 unique classes
  Client 13: 37001 train samples, 62 unique classes
  Client 14: 35681 train samples, 62 unique classes
  Client 15: 35453 train samples, 62 unique classes
  Client 16: 36585 train samples, 62 unique classes
  Client 17: 36801 train samples, 62 unique classes
  Client 18: 35964 train samples, 62 unique classes
  Client 19: 36345 train samples, 62 unique classes
Will sample 4500 samples per client per epoch
Graph: ring, nodes: 20, edges: 20
Degree statistics: avg=2.00, min=2, max=2
Attack: Compromised 2/20 nodes: [5, 13]
Attack type: directed_deviation, lambda: 1.0
Model variant: baseline
Model parameters: 6,603,710
Initial test acc across nodes: mean=0.0168 ± 0.0139
Round 001: test acc mean=0.0447 ± 0.0159 | min=0.0035 max=0.0583
         : test loss mean=1310.8119 ± 2045.5433
         : individual accs = ['0.051599', '0.051630', '0.055134', '0.047773', '0.006111', '0.003499', '0.049130', '0.053116', '0.054880', '0.048398', '0.055274', '0.049606', '0.049597', '0.026686', '0.022211', '0.056590', '0.058271', '0.053311', '0.050196', '0.050145']
         : correct/total = [(213, 4128), (217, 4203), (225, 4081), (207, 4333), (25, 4091), (15, 4287), (206, 4193), (231, 4349), (230, 4191), (207, 4277), (229, 4143), (208, 4193), (203, 4093), (112, 4197), (90, 4052), (228, 4029), (242, 4153), (223, 4183), (205, 4084), (207, 4128)]
         : compromised: 0.0151, honest: 0.0479
Round 002: test acc mean=0.0474 ± 0.0118 | min=0.0044 max=0.0583
         : test loss mean=1780080.3094 ± 3422984.0609
         : individual accs = ['0.051599', '0.046158', '0.050723', '0.052850', '0.004400', '0.057849', '0.048891', '0.043918', '0.051062', '0.055179', '0.045619', '0.054376', '0.050574', '0.045747', '0.051579', '0.026061', '0.058271', '0.050920', '0.052889', '0.048450']
         : correct/total = [(213, 4128), (194, 4203), (207, 4081), (229, 4333), (18, 4091), (248, 4287), (205, 4193), (191, 4349), (214, 4191), (236, 4277), (189, 4143), (228, 4193), (207, 4093), (192, 4197), (209, 4052), (105, 4029), (242, 4153), (213, 4183), (216, 4084), (200, 4128)]
         : compromised: 0.0518, honest: 0.0469
Round 003: test acc mean=0.0526 ± 0.0047 | min=0.0469 max=0.0657
         : test loss mean=43779.6332 ± 190292.9740
         : individual accs = ['0.059593', '0.050916', '0.065670', '0.048465', '0.052066', '0.048052', '0.050799', '0.058174', '0.051539', '0.047463', '0.047550', '0.053184', '0.053750', '0.046938', '0.048124', '0.056342', '0.054418', '0.050203', '0.052889', '0.055475']
         : correct/total = [(246, 4128), (214, 4203), (268, 4081), (210, 4333), (213, 4091), (206, 4287), (213, 4193), (253, 4349), (216, 4191), (203, 4277), (197, 4143), (223, 4193), (220, 4093), (197, 4197), (195, 4052), (227, 4029), (226, 4153), (210, 4183), (216, 4084), (229, 4128)]
         : compromised: 0.0475, honest: 0.0531
Round 004: test acc mean=0.0494 ± 0.0068 | min=0.0261 max=0.0612
         : test loss mean=2781590.9821 ± 12124089.2714
         : individual accs = ['0.059593', '0.047109', '0.050723', '0.052850', '0.044977', '0.048052', '0.050799', '0.053116', '0.049630', '0.047463', '0.047550', '0.046983', '0.050574', '0.046938', '0.061204', '0.026061', '0.055141', '0.048291', '0.052889', '0.048450']
         : correct/total = [(246, 4128), (198, 4203), (207, 4081), (229, 4333), (184, 4091), (206, 4287), (213, 4193), (231, 4349), (208, 4191), (203, 4277), (197, 4143), (197, 4193), (207, 4093), (197, 4197), (248, 4052), (105, 4029), (229, 4153), (202, 4183), (216, 4084), (200, 4128)]
         : compromised: 0.0475, honest: 0.0496
Round 005: test acc mean=0.0487 ± 0.0056 | min=0.0303 max=0.0555
         : test loss mean=293076988.6339 ± 1271932357.8792
         : individual accs = ['0.049176', '0.051630', '0.050723', '0.043157', '0.051088', '0.052484', '0.044598', '0.043918', '0.047960', '0.043488', '0.051171', '0.054376', '0.052040', '0.046938', '0.048124', '0.054852', '0.030340', '0.050203', '0.052155', '0.055475']
         : correct/total = [(203, 4128), (217, 4203), (207, 4081), (187, 4333), (209, 4091), (225, 4287), (187, 4193), (191, 4349), (201, 4191), (186, 4277), (212, 4143), (228, 4193), (213, 4093), (197, 4197), (195, 4052), (221, 4029), (126, 4153), (210, 4183), (213, 4084), (229, 4128)]
         : compromised: 0.0497, honest: 0.0486
Round 006: test acc mean=0.0513 ± 0.0036 | min=0.0446 max=0.0612
         : test loss mean=147914847.9344 ± 643144423.5520
         : individual accs = ['0.049661', '0.051630', '0.050723', '0.048234', '0.051088', '0.052484', '0.044598', '0.053116', '0.051539', '0.050503', '0.048033', '0.054376', '0.053750', '0.046938', '0.061204', '0.050633', '0.054418', '0.046139', '0.055583', '0.050388']
         : correct/total = [(205, 4128), (217, 4203), (207, 4081), (209, 4333), (209, 4091), (225, 4287), (187, 4193), (231, 4349), (216, 4191), (216, 4277), (199, 4143), (228, 4193), (220, 4093), (197, 4197), (248, 4052), (204, 4029), (226, 4153), (193, 4183), (227, 4084), (208, 4128)]
         : compromised: 0.0497, honest: 0.0514
Round 007: test acc mean=0.0503 ± 0.0043 | min=0.0417 max=0.0612
         : test loss mean=83992751.6023 ± 362862681.1498
         : individual accs = ['0.051599', '0.051630', '0.050723', '0.048465', '0.051088', '0.052484', '0.044598', '0.043918', '0.051062', '0.047463', '0.048033', '0.041736', '0.052040', '0.046462', '0.061204', '0.054852', '0.051288', '0.053311', '0.055583', '0.048450']
         : correct/total = [(213, 4128), (217, 4203), (207, 4081), (210, 4333), (209, 4091), (225, 4287), (187, 4193), (191, 4349), (214, 4191), (203, 4277), (199, 4143), (175, 4193), (213, 4093), (195, 4197), (248, 4052), (221, 4029), (213, 4153), (223, 4183), (227, 4084), (200, 4128)]
         : compromised: 0.0495, honest: 0.0504
Round 008: test acc mean=0.0515 ± 0.0046 | min=0.0417 max=0.0612
         : test loss mean=26786763.4415 ± 116760752.7251
         : individual accs = ['0.051599', '0.051630', '0.050723', '0.046619', '0.051088', '0.057849', '0.044598', '0.053116', '0.051062', '0.044891', '0.055998', '0.041736', '0.053750', '0.049083', '0.061204', '0.050633', '0.054418', '0.049486', '0.055583', '0.055475']
         : correct/total = [(213, 4128), (217, 4203), (207, 4081), (202, 4333), (209, 4091), (248, 4287), (187, 4193), (231, 4349), (214, 4191), (192, 4277), (232, 4143), (175, 4193), (220, 4093), (206, 4197), (248, 4052), (204, 4029), (226, 4153), (207, 4183), (227, 4084), (229, 4128)]
         : compromised: 0.0535, honest: 0.0513
Round 009: test acc mean=0.0502 ± 0.0047 | min=0.0420 max=0.0612
         : test loss mean=6911535.0844 ± 29247426.8650
         : individual accs = ['0.051599', '0.051630', '0.050723', '0.048234', '0.051088', '0.043387', '0.044598', '0.043918', '0.051062', '0.047463', '0.041999', '0.046983', '0.052040', '0.047177', '0.061204', '0.054852', '0.051288', '0.053311', '0.055583', '0.055475']
         : correct/total = [(213, 4128), (217, 4203), (207, 4081), (209, 4333), (209, 4091), (186, 4287), (187, 4193), (191, 4349), (214, 4191), (203, 4277), (174, 4143), (197, 4193), (213, 4093), (198, 4197), (248, 4052), (221, 4029), (213, 4153), (223, 4183), (227, 4084), (229, 4128)]
         : compromised: 0.0453, honest: 0.0507
Round 010: test acc mean=0.0513 ± 0.0039 | min=0.0446 max=0.0612
         : test loss mean=19566679.7230 ± 63832695.7078
         : individual accs = ['0.051599', '0.051630', '0.050723', '0.048234', '0.051088', '0.052484', '0.044598', '0.053116', '0.051062', '0.044891', '0.055274', '0.046983', '0.050574', '0.046938', '0.061204', '0.050633', '0.054418', '0.049486', '0.055583', '0.055475']
         : correct/total = [(213, 4128), (217, 4203), (207, 4081), (209, 4333), (209, 4091), (225, 4287), (187, 4193), (231, 4349), (214, 4191), (192, 4277), (229, 4143), (197, 4193), (207, 4093), (197, 4197), (248, 4052), (204, 4029), (226, 4153), (207, 4183), (227, 4084), (229, 4128)]
         : compromised: 0.0497, honest: 0.0515

=== FINAL RESULTS ===
Dataset: femnist, Nodes: 20, Graph: ring, Aggregation: d-fedavg
Attack: directed_deviation, 10.0% compromised
Final accuracy - Compromised: 0.0497, Honest: 0.0515
Overall test accuracy: mean=0.0513 ± 0.0039
