Device: cuda
Seed: 987654321
Loading 36 LEAF FEMNIST train files...
LEAF FEMNIST train: 3597 users, 734463 samples
Loading 36 LEAF FEMNIST test files...
LEAF FEMNIST test: 3597 users, 83388 samples
Found 3597 train users, 3597 test users, 3597 common users
User sample counts range: 525 (max) to 17 (min)
Distributed ALL 3597 users across 20 clients
Users per client: 179 (with 17 clients getting +1 user)
Train partition sizes: [36360, 37070, 35957, 38262, 36024, 37732, 36921, 38328, 36867, 37683, 36507, 36915, 36007, 37001, 35681, 35453, 36585, 36801, 35964, 36345]
Test partition sizes: [4128, 4203, 4081, 4333, 4091, 4287, 4193, 4349, 4191, 4277, 4143, 4193, 4093, 4197, 4052, 4029, 4153, 4183, 4084, 4128]
  Client 0: 36360 train samples, 62 unique classes
  Client 1: 37070 train samples, 62 unique classes
  Client 2: 35957 train samples, 62 unique classes
  Client 3: 38262 train samples, 62 unique classes
  Client 4: 36024 train samples, 62 unique classes
  Client 5: 37732 train samples, 62 unique classes
  Client 6: 36921 train samples, 62 unique classes
  Client 7: 38328 train samples, 62 unique classes
  Client 8: 36867 train samples, 62 unique classes
  Client 9: 37683 train samples, 62 unique classes
  Client 10: 36507 train samples, 62 unique classes
  Client 11: 36915 train samples, 62 unique classes
  Client 12: 36007 train samples, 62 unique classes
  Client 13: 37001 train samples, 62 unique classes
  Client 14: 35681 train samples, 62 unique classes
  Client 15: 35453 train samples, 62 unique classes
  Client 16: 36585 train samples, 62 unique classes
  Client 17: 36801 train samples, 62 unique classes
  Client 18: 35964 train samples, 62 unique classes
  Client 19: 36345 train samples, 62 unique classes
Will sample 4500 samples per client per epoch
Graph: ring, nodes: 20, edges: 20
Degree statistics: avg=2.00, min=2, max=2
Attack: Compromised 14/20 nodes: [1, 2, 3, 5, 6, 8, 11, 12, 13, 14, 15, 17, 18, 19]
Attack type: backdoor, lambda: 1.0
Backdoor target label: 0, trigger size: 4
Model variant: baseline
Model parameters: 6,603,710
Initial test acc across nodes: mean=0.0168 ± 0.0139
Backdoor attack: Created poisoned datasets for 14 compromised nodes
Round 001: test acc mean=0.0276 ± 0.0176 | min=0.0052 max=0.0582
         : test loss mean=115294.9889 ± 120965.5215
         : individual accs = ['0.008963', '0.051630', '0.020093', '0.036464', '0.052554', '0.032190', '0.018602', '0.058174', '0.006920', '0.039280', '0.011827', '0.009540', '0.036159', '0.025733', '0.051826', '0.005212', '0.006261', '0.049008', '0.015916', '0.015988']
         : correct/total = [(37, 4128), (217, 4203), (82, 4081), (158, 4333), (215, 4091), (138, 4287), (78, 4193), (253, 4349), (29, 4191), (168, 4277), (49, 4143), (40, 4193), (148, 4093), (108, 4197), (210, 4052), (21, 4029), (26, 4153), (205, 4183), (65, 4084), (66, 4128)]
         : compromised: 0.0268, honest: 0.0295
Round 002: test acc mean=0.0495 ± 0.0038 | min=0.0430 max=0.0545
         : test loss mean=488067316.7968 ± 658737959.8654
         : individual accs = ['0.050145', '0.048775', '0.053418', '0.043157', '0.043021', '0.045253', '0.053899', '0.043918', '0.051539', '0.043488', '0.048033', '0.049606', '0.054239', '0.049083', '0.051826', '0.051626', '0.052011', '0.049486', '0.052889', '0.054506']
         : correct/total = [(207, 4128), (205, 4203), (218, 4081), (187, 4333), (176, 4091), (194, 4287), (226, 4193), (191, 4349), (216, 4191), (186, 4277), (199, 4143), (208, 4193), (222, 4093), (206, 4197), (210, 4052), (208, 4029), (216, 4153), (207, 4183), (216, 4084), (225, 4128)]
         : compromised: 0.0507, honest: 0.0468
Round 003: test acc mean=0.0493 ± 0.0029 | min=0.0432 max=0.0542
         : test loss mean=758721298.4385 ± 1143913012.3801
         : individual accs = ['0.044574', '0.046158', '0.053418', '0.048465', '0.051088', '0.048052', '0.048414', '0.051276', '0.043188', '0.048398', '0.045619', '0.046983', '0.054239', '0.049083', '0.051826', '0.051378', '0.049362', '0.051159', '0.052889', '0.050872']
         : correct/total = [(184, 4128), (194, 4203), (218, 4081), (210, 4333), (209, 4091), (206, 4287), (203, 4193), (223, 4349), (181, 4191), (207, 4277), (189, 4143), (197, 4193), (222, 4093), (206, 4197), (210, 4052), (207, 4029), (205, 4153), (214, 4183), (216, 4084), (210, 4128)]
         : compromised: 0.0497, honest: 0.0484
Round 004: test acc mean=0.0489 ± 0.0059 | min=0.0281 max=0.0578
         : test loss mean=2883020698.1122 ± 9904244365.7980
         : individual accs = ['0.047238', '0.048775', '0.053418', '0.047773', '0.044977', '0.057849', '0.048653', '0.045298', '0.044619', '0.047463', '0.055274', '0.028142', '0.054239', '0.049083', '0.051826', '0.051378', '0.049362', '0.051159', '0.052889', '0.048692']
         : correct/total = [(195, 4128), (205, 4203), (218, 4081), (207, 4333), (184, 4091), (248, 4287), (204, 4193), (197, 4349), (187, 4191), (203, 4277), (229, 4143), (118, 4193), (222, 4093), (206, 4197), (210, 4052), (207, 4029), (205, 4153), (214, 4183), (216, 4084), (201, 4128)]
         : compromised: 0.0492, honest: 0.0483
Round 005: test acc mean=0.0501 ± 0.0033 | min=0.0446 max=0.0560
         : test loss mean=4263021851.7474 ± 15251063433.2601
         : individual accs = ['0.050145', '0.049726', '0.053418', '0.044773', '0.047421', '0.048752', '0.048891', '0.045528', '0.044619', '0.053776', '0.055998', '0.053899', '0.054239', '0.049083', '0.051826', '0.051378', '0.049362', '0.051159', '0.052889', '0.045058']
         : correct/total = [(207, 4128), (209, 4203), (218, 4081), (194, 4333), (194, 4091), (209, 4287), (205, 4193), (198, 4349), (187, 4191), (230, 4277), (232, 4143), (226, 4193), (222, 4093), (206, 4197), (210, 4052), (207, 4029), (205, 4153), (214, 4183), (216, 4084), (186, 4128)]
         : compromised: 0.0500, honest: 0.0504
Round 006: test acc mean=0.0501 ± 0.0034 | min=0.0420 max=0.0563
         : test loss mean=1911263396.8469 ± 4370552777.6423
         : individual accs = ['0.051599', '0.051630', '0.053418', '0.044773', '0.047421', '0.048752', '0.048414', '0.051276', '0.047960', '0.050503', '0.041999', '0.046745', '0.054239', '0.049083', '0.051826', '0.056342', '0.055141', '0.050203', '0.052889', '0.048692']
         : correct/total = [(213, 4128), (217, 4203), (218, 4081), (194, 4333), (194, 4091), (209, 4287), (203, 4193), (223, 4349), (201, 4191), (216, 4277), (174, 4143), (196, 4193), (222, 4093), (206, 4197), (210, 4052), (227, 4029), (229, 4153), (210, 4183), (216, 4084), (201, 4128)]
         : compromised: 0.0504, honest: 0.0497
Round 007: test acc mean=0.0451 ± 0.0135 | min=0.0136 max=0.0578
         : test loss mean=15285738726.8291 ± 47618547606.9851
         : individual accs = ['0.015019', '0.014276', '0.053418', '0.047773', '0.044977', '0.057849', '0.048414', '0.051276', '0.043188', '0.050503', '0.041999', '0.049606', '0.054239', '0.049083', '0.051826', '0.054852', '0.054418', '0.053311', '0.052889', '0.013566']
         : correct/total = [(62, 4128), (60, 4203), (218, 4081), (207, 4333), (184, 4091), (248, 4287), (203, 4193), (223, 4349), (181, 4191), (216, 4277), (174, 4143), (208, 4193), (222, 4093), (206, 4197), (210, 4052), (221, 4029), (226, 4153), (223, 4183), (216, 4084), (56, 4128)]
         : compromised: 0.0460, honest: 0.0430
Round 008: test acc mean=0.0503 ± 0.0043 | min=0.0426 max=0.0618
         : test loss mean=303722701.6193 ± 1323733267.9953
         : individual accs = ['0.045785', '0.042589', '0.053418', '0.043388', '0.052554', '0.052484', '0.048414', '0.051276', '0.047960', '0.053075', '0.050447', '0.061770', '0.054239', '0.049083', '0.051826', '0.050881', '0.051047', '0.048291', '0.052889', '0.044331']
         : correct/total = [(189, 4128), (179, 4203), (218, 4081), (188, 4333), (215, 4091), (225, 4287), (203, 4193), (223, 4349), (201, 4191), (227, 4277), (209, 4143), (259, 4193), (222, 4093), (206, 4197), (210, 4052), (205, 4029), (212, 4153), (202, 4183), (216, 4084), (183, 4128)]
         : compromised: 0.0501, honest: 0.0507
Round 009: test acc mean=0.0500 ± 0.0046 | min=0.0426 max=0.0618
         : test loss mean=9422731449.6262 ± 37652195363.0907
         : individual accs = ['0.045785', '0.042589', '0.053418', '0.043388', '0.052554', '0.052484', '0.048414', '0.051276', '0.047960', '0.053075', '0.050447', '0.061770', '0.054239', '0.049083', '0.051826', '0.053860', '0.044546', '0.045900', '0.052889', '0.044331']
         : correct/total = [(189, 4128), (179, 4203), (218, 4081), (188, 4333), (215, 4091), (225, 4287), (203, 4193), (223, 4349), (201, 4191), (227, 4277), (209, 4143), (259, 4193), (222, 4093), (206, 4197), (210, 4052), (217, 4029), (185, 4153), (192, 4183), (216, 4084), (183, 4128)]
         : compromised: 0.0502, honest: 0.0496
Round 010: test acc mean=0.0491 ± 0.0037 | min=0.0417 max=0.0542
         : test loss mean=2643097.2593 ± 7449090.0240
         : individual accs = ['0.045785', '0.042589', '0.053418', '0.043388', '0.052554', '0.052484', '0.048414', '0.051276', '0.051062', '0.046528', '0.051171', '0.041736', '0.054239', '0.049083', '0.051826', '0.050881', '0.051047', '0.048291', '0.052889', '0.044331']
         : correct/total = [(189, 4128), (179, 4203), (218, 4081), (188, 4333), (215, 4091), (225, 4287), (203, 4193), (223, 4349), (214, 4191), (199, 4277), (212, 4143), (175, 4193), (222, 4093), (206, 4197), (210, 4052), (205, 4029), (212, 4153), (202, 4183), (216, 4084), (183, 4128)]
         : compromised: 0.0489, honest: 0.0497

=== FINAL RESULTS ===
Dataset: femnist, Nodes: 20, Graph: ring, Aggregation: d-fedavg
Attack: backdoor, 70.0% compromised
Final accuracy - Compromised: 0.0489, Honest: 0.0497
Overall test accuracy: mean=0.0491 ± 0.0037

=== BACKDOOR ATTACK SUCCESS RATE (ASR) ===
Target label: 0
Trigger size: 4x4
Overall ASR: 0.2500 ± 0.4330
Honest nodes ASR: 0.0000 ± 0.0000
Compromised nodes ASR: 0.3571 ± 0.4792
Note: Higher ASR indicates more successful backdoor attack
