Device: cuda
Seed: 987654321
Loading 36 LEAF FEMNIST train files...
LEAF FEMNIST train: 3597 users, 734463 samples
Loading 36 LEAF FEMNIST test files...
LEAF FEMNIST test: 3597 users, 83388 samples
Found 3597 train users, 3597 test users, 3597 common users
User sample counts range: 525 (max) to 17 (min)
Distributed ALL 3597 users across 20 clients
Users per client: 179 (with 17 clients getting +1 user)
Train partition sizes: [36360, 37070, 35957, 38262, 36024, 37732, 36921, 38328, 36867, 37683, 36507, 36915, 36007, 37001, 35681, 35453, 36585, 36801, 35964, 36345]
Test partition sizes: [4128, 4203, 4081, 4333, 4091, 4287, 4193, 4349, 4191, 4277, 4143, 4193, 4093, 4197, 4052, 4029, 4153, 4183, 4084, 4128]
  Client 0: 36360 train samples, 62 unique classes
  Client 1: 37070 train samples, 62 unique classes
  Client 2: 35957 train samples, 62 unique classes
  Client 3: 38262 train samples, 62 unique classes
  Client 4: 36024 train samples, 62 unique classes
  Client 5: 37732 train samples, 62 unique classes
  Client 6: 36921 train samples, 62 unique classes
  Client 7: 38328 train samples, 62 unique classes
  Client 8: 36867 train samples, 62 unique classes
  Client 9: 37683 train samples, 62 unique classes
  Client 10: 36507 train samples, 62 unique classes
  Client 11: 36915 train samples, 62 unique classes
  Client 12: 36007 train samples, 62 unique classes
  Client 13: 37001 train samples, 62 unique classes
  Client 14: 35681 train samples, 62 unique classes
  Client 15: 35453 train samples, 62 unique classes
  Client 16: 36585 train samples, 62 unique classes
  Client 17: 36801 train samples, 62 unique classes
  Client 18: 35964 train samples, 62 unique classes
  Client 19: 36345 train samples, 62 unique classes
Will sample 4500 samples per client per epoch
Graph: ring, nodes: 20, edges: 20
Degree statistics: avg=2.00, min=2, max=2
Attack: Compromised 16/20 nodes: [1, 2, 3, 5, 6, 8, 9, 10, 11, 12, 13, 14, 15, 17, 18, 19]
Attack type: backdoor, lambda: 1.0
Backdoor target label: 0, trigger size: 4
Model variant: baseline
Model parameters: 6,603,710
Initial test acc across nodes: mean=0.0168 ± 0.0139
Backdoor attack: Created poisoned datasets for 16 compromised nodes
Round 001: test acc mean=0.0283 ± 0.0172 | min=0.0043 max=0.0582
         : test loss mean=188295.5730 ± 186345.8798
         : individual accs = ['0.008963', '0.051630', '0.016908', '0.036464', '0.052554', '0.032190', '0.018602', '0.058174', '0.011215', '0.013795', '0.038861', '0.020510', '0.053995', '0.046462', '0.042695', '0.013899', '0.014447', '0.004303', '0.017630', '0.013081']
         : correct/total = [(37, 4128), (217, 4203), (69, 4081), (158, 4333), (215, 4091), (138, 4287), (78, 4193), (253, 4349), (47, 4191), (59, 4277), (161, 4143), (86, 4193), (221, 4093), (195, 4197), (173, 4052), (56, 4029), (60, 4153), (18, 4183), (72, 4084), (54, 4128)]
         : compromised: 0.0270, honest: 0.0335
Round 002: test acc mean=0.0489 ± 0.0038 | min=0.0430 max=0.0542
         : test loss mean=nan ± nan
         : individual accs = ['0.044574', '0.046158', '0.053418', '0.043157', '0.043021', '0.045253', '0.053899', '0.043918', '0.051539', '0.043488', '0.048033', '0.049606', '0.054239', '0.049083', '0.051826', '0.051626', '0.052011', '0.049486', '0.052889', '0.050872']
         : correct/total = [(184, 4128), (194, 4203), (218, 4081), (187, 4333), (176, 4091), (194, 4287), (226, 4193), (191, 4349), (216, 4191), (186, 4277), (199, 4143), (208, 4193), (222, 4093), (206, 4197), (210, 4052), (208, 4029), (216, 4153), (207, 4183), (216, 4084), (210, 4128)]
         : compromised: 0.0497, honest: 0.0459
Round 003: test acc mean=0.0501 ± 0.0037 | min=0.0432 max=0.0549
         : test loss mean=nan ± nan
         : individual accs = ['0.050145', '0.049726', '0.053418', '0.043388', '0.052554', '0.052484', '0.048414', '0.051276', '0.043188', '0.043488', '0.048033', '0.049606', '0.054239', '0.049083', '0.051826', '0.054852', '0.054418', '0.053311', '0.052889', '0.045058']
         : correct/total = [(207, 4128), (209, 4203), (218, 4081), (188, 4333), (215, 4091), (225, 4287), (203, 4193), (223, 4349), (181, 4191), (186, 4277), (199, 4143), (208, 4193), (222, 4093), (206, 4197), (210, 4052), (221, 4029), (226, 4153), (223, 4183), (216, 4084), (186, 4128)]
         : compromised: 0.0496, honest: 0.0521
Round 004: test acc mean=0.0485 ± 0.0051 | min=0.0355 max=0.0545
         : test loss mean=nan ± nan
         : individual accs = ['0.050145', '0.048775', '0.053418', '0.048465', '0.051088', '0.048052', '0.035535', '0.035640', '0.044619', '0.043488', '0.048033', '0.049606', '0.054239', '0.049083', '0.051826', '0.050633', '0.051288', '0.048291', '0.052889', '0.054506']
         : correct/total = [(207, 4128), (205, 4203), (218, 4081), (210, 4333), (209, 4091), (206, 4287), (149, 4193), (155, 4349), (187, 4191), (186, 4277), (199, 4143), (208, 4193), (222, 4093), (206, 4197), (210, 4052), (204, 4029), (213, 4153), (202, 4183), (216, 4084), (225, 4128)]
         : compromised: 0.0488, honest: 0.0470
Round 005: test acc mean=0.0478 ± 0.0039 | min=0.0391 max=0.0542
         : test loss mean=nan ± nan
         : individual accs = ['0.045785', '0.042589', '0.053418', '0.044773', '0.047421', '0.048752', '0.044360', '0.045528', '0.039131', '0.043488', '0.048033', '0.049606', '0.054239', '0.049083', '0.051826', '0.050633', '0.051288', '0.048291', '0.052889', '0.044331']
         : correct/total = [(189, 4128), (179, 4203), (218, 4081), (194, 4333), (194, 4091), (209, 4287), (186, 4193), (198, 4349), (164, 4191), (186, 4277), (199, 4143), (208, 4193), (222, 4093), (206, 4197), (210, 4052), (204, 4029), (213, 4153), (202, 4183), (216, 4084), (183, 4128)]
         : compromised: 0.0478, honest: 0.0475
Round 006: test acc mean=0.0498 ± 0.0029 | min=0.0432 max=0.0545
         : test loss mean=nan ± nan
         : individual accs = ['0.050145', '0.048775', '0.053418', '0.048465', '0.051088', '0.048052', '0.048414', '0.051276', '0.043188', '0.043488', '0.048033', '0.049606', '0.054239', '0.049083', '0.051826', '0.050633', '0.051288', '0.048291', '0.052889', '0.054506']
         : correct/total = [(207, 4128), (205, 4203), (218, 4081), (210, 4333), (209, 4091), (206, 4287), (203, 4193), (223, 4349), (181, 4191), (186, 4277), (199, 4143), (208, 4193), (222, 4093), (206, 4197), (210, 4052), (204, 4029), (213, 4153), (202, 4183), (216, 4084), (225, 4128)]
         : compromised: 0.0496, honest: 0.0509
Round 007: test acc mean=0.0518 ± 0.0038 | min=0.0435 max=0.0596
         : test loss mean=nan ± nan
         : individual accs = ['0.059593', '0.052344', '0.053418', '0.048465', '0.051088', '0.048286', '0.057000', '0.058174', '0.053209', '0.043488', '0.048033', '0.049606', '0.054239', '0.049083', '0.051826', '0.050633', '0.051288', '0.048291', '0.052889', '0.055475']
         : correct/total = [(246, 4128), (220, 4203), (218, 4081), (210, 4333), (209, 4091), (207, 4287), (239, 4193), (253, 4349), (223, 4191), (186, 4277), (199, 4143), (208, 4193), (222, 4093), (206, 4197), (210, 4052), (204, 4029), (213, 4153), (202, 4183), (216, 4084), (229, 4128)]
         : compromised: 0.0510, honest: 0.0550
Round 008: test acc mean=0.0500 ± 0.0027 | min=0.0435 max=0.0545
         : test loss mean=nan ± nan
         : individual accs = ['0.050145', '0.048775', '0.053418', '0.048465', '0.051088', '0.048052', '0.050799', '0.045068', '0.049630', '0.043488', '0.048033', '0.049606', '0.054239', '0.049083', '0.051826', '0.050633', '0.051288', '0.048291', '0.052889', '0.054506']
         : correct/total = [(207, 4128), (205, 4203), (218, 4081), (210, 4333), (209, 4091), (206, 4287), (213, 4193), (196, 4349), (208, 4191), (186, 4277), (199, 4143), (208, 4193), (222, 4093), (206, 4197), (210, 4052), (204, 4029), (213, 4153), (202, 4183), (216, 4084), (225, 4128)]
         : compromised: 0.0501, honest: 0.0494
Round 009: test acc mean=0.0497 ± 0.0029 | min=0.0435 max=0.0545
         : test loss mean=nan ± nan
         : individual accs = ['0.050145', '0.048775', '0.053418', '0.048465', '0.051088', '0.048052', '0.049368', '0.043688', '0.047483', '0.043488', '0.048033', '0.049606', '0.054239', '0.049083', '0.051826', '0.050633', '0.051288', '0.048291', '0.052889', '0.054506']
         : correct/total = [(207, 4128), (205, 4203), (218, 4081), (210, 4333), (209, 4091), (206, 4287), (207, 4193), (190, 4349), (199, 4191), (186, 4277), (199, 4143), (208, 4193), (222, 4093), (206, 4197), (210, 4052), (204, 4029), (213, 4153), (202, 4183), (216, 4084), (225, 4128)]
         : compromised: 0.0499, honest: 0.0491
Round 010: test acc mean=0.0500 ± 0.0027 | min=0.0435 max=0.0545
         : test loss mean=nan ± nan
         : individual accs = ['0.050145', '0.048775', '0.053418', '0.048465', '0.051088', '0.048052', '0.050799', '0.045068', '0.049630', '0.043488', '0.048033', '0.049606', '0.054239', '0.049083', '0.051826', '0.050633', '0.051288', '0.048291', '0.052889', '0.054506']
         : correct/total = [(207, 4128), (205, 4203), (218, 4081), (210, 4333), (209, 4091), (206, 4287), (213, 4193), (196, 4349), (208, 4191), (186, 4277), (199, 4143), (208, 4193), (222, 4093), (206, 4197), (210, 4052), (204, 4029), (213, 4153), (202, 4183), (216, 4084), (225, 4128)]
         : compromised: 0.0501, honest: 0.0494

=== FINAL RESULTS ===
Dataset: femnist, Nodes: 20, Graph: ring, Aggregation: krum
Attack: backdoor, 80.0% compromised
Final accuracy - Compromised: 0.0501, Honest: 0.0494
Overall test accuracy: mean=0.0500 ± 0.0027

=== BACKDOOR ATTACK SUCCESS RATE (ASR) ===
Target label: 0
Trigger size: 4x4
Overall ASR: 0.7000 ± 0.4583
Honest nodes ASR: 0.5000 ± 0.5000
Compromised nodes ASR: 0.7500 ± 0.4330
Note: Higher ASR indicates more successful backdoor attack
