Device: cuda
Seed: 987654321
Loading 1 LEAF Sent140 train files...
LEAF Sent140 train: 254555 users, 908652 samples
Building vocabulary (max_size=10000)...
Vocabulary size: 10000
Loading 1 LEAF Sent140 test files...
LEAF Sent140 test: 254555 users, 286281 samples
Found 254555 train users, 254555 test users, 254555 common users
User sample counts range: 494 (max) to 1 (min)
Distributed ALL 254555 users across 20 clients
Users per client: 12727 (with 15 clients getting +1 user)
Train partition sizes: [44353, 44290, 44657, 44907, 44696, 45843, 45801, 45619, 45069, 45639, 45821, 45311, 45779, 46056, 45625, 45984, 46428, 44737, 45540, 46497]
Test partition sizes: [14232, 14235, 14266, 14217, 14238, 14373, 14346, 14334, 14294, 14373, 14344, 14302, 14354, 14362, 14320, 14395, 14389, 14257, 14251, 14399]
  Client 0: 44353 train samples, 2 unique classes
  Client 1: 44290 train samples, 2 unique classes
  Client 2: 44657 train samples, 2 unique classes
  Client 3: 44907 train samples, 2 unique classes
  Client 4: 44696 train samples, 2 unique classes
  Client 5: 45843 train samples, 2 unique classes
  Client 6: 45801 train samples, 2 unique classes
  Client 7: 45619 train samples, 2 unique classes
  Client 8: 45069 train samples, 2 unique classes
  Client 9: 45639 train samples, 2 unique classes
  Client 10: 45821 train samples, 2 unique classes
  Client 11: 45311 train samples, 2 unique classes
  Client 12: 45779 train samples, 2 unique classes
  Client 13: 46056 train samples, 2 unique classes
  Client 14: 45625 train samples, 2 unique classes
  Client 15: 45984 train samples, 2 unique classes
  Client 16: 46428 train samples, 2 unique classes
  Client 17: 44737 train samples, 2 unique classes
  Client 18: 45540 train samples, 2 unique classes
  Client 19: 46497 train samples, 2 unique classes
Will sample 4500 samples per client per epoch
Graph: erdos, nodes: 20, edges: 126
Degree statistics: avg=12.60, min=8, max=16
Attack: Compromised 16/20 nodes: [1, 2, 3, 5, 6, 8, 9, 10, 11, 12, 13, 14, 15, 17, 18, 19]
Attack type: krum, lambda: 1.0
Model variant: baseline
Model parameters: 1,174,986
BALANCE algorithm:
Balance Config: BALANCEConfig(gamma=2, kappa=1, alpha=0.5, min_neighbors=1)
  - Model dimension: 1,174,986 parameters
  - Complexity: O(N×d) = O(20×1,174,986)
Initial test acc across nodes: mean=0.4965 ± 0.0152
Round 001: test acc mean=0.4981 ± 0.0087 | min=0.4820 max=0.5139
         : test loss mean=3.8822 ± 1.1230
         : individual accs = ['0.512085', '0.513874', '0.486962', '0.486530', '0.499789', '0.501913', '0.502370', '0.497698', '0.486498', '0.486120', '0.496723', '0.500839', '0.503553', '0.496588', '0.508310', '0.482042', '0.494753', '0.496668', '0.507403', '0.500660']
         : correct/total = [(7288, 14232), (7315, 14235), (6947, 14266), (6917, 14217), (7116, 14238), (7214, 14373), (7207, 14346), (7134, 14334), (6954, 14294), (6987, 14373), (7125, 14344), (7163, 14302), (7228, 14354), (7132, 14362), (7279, 14320), (6939, 14395), (7119, 14389), (7081, 14257), (7231, 14251), (7209, 14399)]
         : compromised: 0.4973, honest: 0.5011
Round 002: test acc mean=0.5014 ± 0.0078 | min=0.4880 max=0.5202
         : test loss mean=1.6212 ± 1.2393
         : individual accs = ['0.510540', '0.509449', '0.511145', '0.501020', '0.520228', '0.503235', '0.500349', '0.509348', '0.500140', '0.497739', '0.504950', '0.495665', '0.496517', '0.503203', '0.493017', '0.491421', '0.502815', '0.498913', '0.487966', '0.490451']
         : correct/total = [(7266, 14232), (7252, 14235), (7292, 14266), (7123, 14217), (7407, 14238), (7233, 14373), (7178, 14346), (7301, 14334), (7149, 14294), (7154, 14373), (7243, 14344), (7089, 14302), (7127, 14354), (7227, 14362), (7060, 14320), (7074, 14395), (7235, 14389), (7113, 14257), (6954, 14251), (7062, 14399)]
         : compromised: 0.4991, honest: 0.5107
Round 003: test acc mean=0.5052 ± 0.0098 | min=0.4820 max=0.5191
         : test loss mean=0.8105 ± 0.0898
         : individual accs = ['0.499649', '0.508816', '0.496565', '0.497503', '0.518542', '0.507201', '0.499233', '0.519115', '0.513922', '0.509288', '0.482013', '0.515313', '0.491431', '0.515249', '0.509846', '0.501146', '0.504274', '0.496107', '0.517508', '0.501146']
         : correct/total = [(7111, 14232), (7243, 14235), (7084, 14266), (7073, 14217), (7383, 14238), (7290, 14373), (7162, 14346), (7441, 14334), (7346, 14294), (7320, 14373), (6914, 14344), (7370, 14302), (7054, 14354), (7400, 14362), (7301, 14320), (7214, 14395), (7256, 14389), (7073, 14257), (7375, 14251), (7216, 14399)]
         : compromised: 0.5039, honest: 0.5104
Round 004: test acc mean=0.5157 ± 0.0124 | min=0.4918 max=0.5367
         : test loss mean=0.7297 ± 0.0234
         : individual accs = ['0.531057', '0.524412', '0.523623', '0.522332', '0.536662', '0.507549', '0.499582', '0.534533', '0.505527', '0.533639', '0.514083', '0.507412', '0.502160', '0.505849', '0.491760', '0.511080', '0.516158', '0.514624', '0.525016', '0.507813']
         : correct/total = [(7558, 14232), (7465, 14235), (7470, 14266), (7426, 14217), (7641, 14238), (7295, 14373), (7167, 14346), (7662, 14334), (7226, 14294), (7670, 14373), (7374, 14344), (7257, 14302), (7208, 14354), (7265, 14362), (7042, 14320), (7357, 14395), (7427, 14389), (7337, 14257), (7482, 14251), (7312, 14399)]
         : compromised: 0.5123, honest: 0.5296
Round 005: test acc mean=0.5376 ± 0.0089 | min=0.5206 max=0.5533
         : test loss mean=0.6985 ± 0.0051
         : individual accs = ['0.539629', '0.543449', '0.532735', '0.538299', '0.548462', '0.539553', '0.520633', '0.549184', '0.527704', '0.553329', '0.543642', '0.537547', '0.531559', '0.531890', '0.522765', '0.542827', '0.536382', '0.546889', '0.540944', '0.523925']
         : correct/total = [(7680, 14232), (7736, 14235), (7600, 14266), (7653, 14217), (7809, 14238), (7755, 14373), (7469, 14346), (7872, 14334), (7543, 14294), (7953, 14373), (7798, 14344), (7688, 14302), (7630, 14354), (7639, 14362), (7486, 14320), (7814, 14395), (7718, 14389), (7797, 14257), (7709, 14251), (7544, 14399)]
         : compromised: 0.5361, honest: 0.5434
Round 006: test acc mean=0.5536 ± 0.0071 | min=0.5349 max=0.5669
         : test loss mean=0.6868 ± 0.0031
         : individual accs = ['0.549044', '0.553846', '0.553484', '0.565520', '0.556679', '0.552286', '0.553883', '0.555742', '0.534910', '0.559730', '0.566857', '0.556216', '0.558033', '0.550898', '0.547905', '0.550191', '0.549864', '0.560286', '0.553856', '0.542815']
         : correct/total = [(7814, 14232), (7884, 14235), (7896, 14266), (8040, 14217), (7926, 14238), (7938, 14373), (7946, 14346), (7966, 14334), (7646, 14294), (8045, 14373), (8131, 14344), (7955, 14302), (8010, 14354), (7912, 14362), (7846, 14320), (7920, 14395), (7912, 14389), (7988, 14257), (7893, 14251), (7816, 14399)]
         : compromised: 0.5538, honest: 0.5528
Round 007: test acc mean=0.5685 ± 0.0050 | min=0.5576 max=0.5751
         : test loss mean=0.6795 ± 0.0021
         : individual accs = ['0.562816', '0.563049', '0.564139', '0.574523', '0.573325', '0.570166', '0.572146', '0.569485', '0.561914', '0.575106', '0.569228', '0.574745', '0.566393', '0.570185', '0.557612', '0.568878', '0.567934', '0.572140', '0.574275', '0.561358']
         : correct/total = [(8010, 14232), (8015, 14235), (8048, 14266), (8168, 14217), (8163, 14238), (8195, 14373), (8208, 14346), (8163, 14334), (8032, 14294), (8266, 14373), (8165, 14344), (8220, 14302), (8130, 14354), (8189, 14362), (7985, 14320), (8189, 14395), (8172, 14389), (8157, 14257), (8184, 14251), (8083, 14399)]
         : compromised: 0.5685, honest: 0.5684
Round 008: test acc mean=0.5766 ± 0.0057 | min=0.5622 max=0.5903
         : test loss mean=0.6758 ± 0.0026
         : individual accs = ['0.573777', '0.575623', '0.562176', '0.590350', '0.582947', '0.582620', '0.577513', '0.575973', '0.574437', '0.574341', '0.582822', '0.573207', '0.581441', '0.573945', '0.572556', '0.577353', '0.573563', '0.578242', '0.579117', '0.569762']
         : correct/total = [(8166, 14232), (8194, 14235), (8020, 14266), (8393, 14217), (8300, 14238), (8374, 14373), (8285, 14346), (8256, 14334), (8211, 14294), (8255, 14373), (8360, 14344), (8198, 14302), (8346, 14354), (8243, 14362), (8199, 14320), (8311, 14395), (8253, 14389), (8244, 14257), (8253, 14251), (8204, 14399)]
         : compromised: 0.5766, honest: 0.5766
Round 009: test acc mean=0.5838 ± 0.0065 | min=0.5722 max=0.5987
         : test loss mean=0.6721 ± 0.0033
         : individual accs = ['0.580101', '0.581524', '0.583275', '0.598720', '0.590392', '0.585403', '0.592081', '0.580020', '0.572828', '0.583455', '0.586378', '0.585652', '0.577261', '0.589820', '0.572207', '0.587496', '0.580999', '0.591850', '0.578345', '0.578860']
         : correct/total = [(8256, 14232), (8278, 14235), (8321, 14266), (8512, 14217), (8406, 14238), (8414, 14373), (8494, 14346), (8314, 14334), (8188, 14294), (8386, 14373), (8411, 14344), (8376, 14302), (8286, 14354), (8471, 14362), (8194, 14320), (8457, 14395), (8360, 14389), (8438, 14257), (8242, 14251), (8335, 14399)]
         : compromised: 0.5841, honest: 0.5829
Round 010: test acc mean=0.5946 ± 0.0042 | min=0.5870 max=0.6053
         : test loss mean=0.6670 ± 0.0025
         : individual accs = ['0.594576', '0.593678', '0.592387', '0.605261', '0.603385', '0.595283', '0.593406', '0.596135', '0.590947', '0.594309', '0.591955', '0.593903', '0.594190', '0.598315', '0.587011', '0.596943', '0.592049', '0.596339', '0.588520', '0.592680']
         : correct/total = [(8462, 14232), (8451, 14235), (8451, 14266), (8605, 14217), (8591, 14238), (8556, 14373), (8513, 14346), (8545, 14334), (8447, 14294), (8542, 14373), (8491, 14344), (8494, 14302), (8529, 14354), (8593, 14362), (8406, 14320), (8593, 14395), (8519, 14389), (8502, 14257), (8387, 14251), (8534, 14399)]
         : compromised: 0.5941, honest: 0.5965

=== FINAL RESULTS ===
Dataset: sent140, Nodes: 20, Graph: erdos, Aggregation: balance
Attack: krum, 80.0% compromised
Final accuracy - Compromised: 0.5941, Honest: 0.5965
Overall test accuracy: mean=0.5946 ± 0.0042

=== BALANCE SUMMARY ===
Node 0: acceptance=0.269
Node 1: acceptance=0.427
Node 2: acceptance=0.325
Node 3: acceptance=0.300
Node 4: acceptance=0.345
Node 5: acceptance=0.307
Node 6: acceptance=0.314
Node 7: acceptance=0.229
Node 8: acceptance=0.360
Node 9: acceptance=0.377
Node 10: acceptance=0.378
Node 11: acceptance=0.293
Node 12: acceptance=0.325
Node 13: acceptance=0.308
Node 14: acceptance=0.280
Node 15: acceptance=0.264
Node 16: acceptance=0.238
Node 17: acceptance=0.400
Node 18: acceptance=0.325
Node 19: acceptance=0.269

=== PARALLEL EXECUTION TIME (realistic for distributed system) ===
  COMMUNICATION (max across nodes):
    - Full model transfer: 0.000s (0.0%)
  COMPUTATION (max across nodes):
    - Filtering: 0.070s (84.7%)
    - Aggregation: 0.013s (15.3%)
  TOTALS:
    - Total computation: 0.083s (100.0%)
    - Total communication: 0.000s (0.0%)
    - Total parallel time: 0.083s

=== PER-NODE AVERAGE TIME ===
  - Filtering: 0.055s
  - Aggregation: 0.006s
  - Model transfer: 0.000s
  - Total per node: 0.061s

=== TOTAL COMPUTATIONAL WORK (sum across all nodes) ===
  - Total filtering: 1.091s
  - Total aggregation: 0.130s
  - Total model transfer: 0.000s
  - Grand total: 1.220s
  - Mean acceptance rate: 0.317

BALANCE Algorithm Properties:
  - Model dimension: 1,174,986
  - No compression: Full parameter comparison
  - Theoretical complexity: O(deg(i)×d)
  - Approach: Full parameter filtering + averaging
