Device: cuda
Seed: 987654321
Loading 1 LEAF Sent140 train files...
LEAF Sent140 train: 254555 users, 908652 samples
Building vocabulary (max_size=10000)...
Vocabulary size: 10000
Loading 1 LEAF Sent140 test files...
LEAF Sent140 test: 254555 users, 286281 samples
Found 254555 train users, 254555 test users, 254555 common users
User sample counts range: 494 (max) to 1 (min)
Distributed ALL 254555 users across 20 clients
Users per client: 12727 (with 15 clients getting +1 user)
Train partition sizes: [44353, 44290, 44657, 44907, 44696, 45843, 45801, 45619, 45069, 45639, 45821, 45311, 45779, 46056, 45625, 45984, 46428, 44737, 45540, 46497]
Test partition sizes: [14232, 14235, 14266, 14217, 14238, 14373, 14346, 14334, 14294, 14373, 14344, 14302, 14354, 14362, 14320, 14395, 14389, 14257, 14251, 14399]
  Client 0: 44353 train samples, 2 unique classes
  Client 1: 44290 train samples, 2 unique classes
  Client 2: 44657 train samples, 2 unique classes
  Client 3: 44907 train samples, 2 unique classes
  Client 4: 44696 train samples, 2 unique classes
  Client 5: 45843 train samples, 2 unique classes
  Client 6: 45801 train samples, 2 unique classes
  Client 7: 45619 train samples, 2 unique classes
  Client 8: 45069 train samples, 2 unique classes
  Client 9: 45639 train samples, 2 unique classes
  Client 10: 45821 train samples, 2 unique classes
  Client 11: 45311 train samples, 2 unique classes
  Client 12: 45779 train samples, 2 unique classes
  Client 13: 46056 train samples, 2 unique classes
  Client 14: 45625 train samples, 2 unique classes
  Client 15: 45984 train samples, 2 unique classes
  Client 16: 46428 train samples, 2 unique classes
  Client 17: 44737 train samples, 2 unique classes
  Client 18: 45540 train samples, 2 unique classes
  Client 19: 46497 train samples, 2 unique classes
Will sample 4500 samples per client per epoch
Graph: erdos, nodes: 20, edges: 99
Degree statistics: avg=9.90, min=7, max=14
Attack: Compromised 2/20 nodes: [5, 13]
Attack type: directed_deviation, lambda: 1.0
Model variant: baseline
Model parameters: 1,174,986
Initial test acc across nodes: mean=0.4965 ± 0.0152
Round 001: test acc mean=0.5740 ± 0.0420 | min=0.4914 max=0.6098
         : test loss mean=8.5483 ± 16.2288
         : individual accs = ['0.602797', '0.609835', '0.591897', '0.592530', '0.595519', '0.601545', '0.498815', '0.593903', '0.491395', '0.602797', '0.604573', '0.497413', '0.585412', '0.605904', '0.504050', '0.599514', '0.588366', '0.596339', '0.595818', '0.520592']
         : correct/total = [(8579, 14232), (8681, 14235), (8444, 14266), (8424, 14217), (8479, 14238), (8646, 14373), (7156, 14346), (8513, 14334), (7024, 14294), (8664, 14373), (8672, 14344), (7114, 14302), (8403, 14354), (8702, 14362), (7218, 14320), (8630, 14395), (8466, 14389), (8502, 14257), (8491, 14251), (7496, 14399)]
         : compromised: 0.6037, honest: 0.5706
Round 002: test acc mean=0.6016 ± 0.0351 | min=0.4957 max=0.6262
         : test loss mean=2.6019 ± 5.8733
         : individual accs = ['0.619379', '0.606393', '0.619094', '0.626222', '0.610128', '0.622904', '0.612017', '0.602414', '0.495732', '0.612677', '0.612591', '0.614250', '0.606939', '0.609943', '0.603282', '0.617645', '0.617208', '0.618784', '0.603677', '0.500104']
         : correct/total = [(8815, 14232), (8632, 14235), (8832, 14266), (8903, 14217), (8687, 14238), (8953, 14373), (8780, 14346), (8635, 14334), (7086, 14294), (8806, 14373), (8787, 14344), (8785, 14302), (8712, 14354), (8760, 14362), (8639, 14320), (8891, 14395), (8881, 14389), (8822, 14257), (8603, 14251), (7201, 14399)]
         : compromised: 0.6164, honest: 0.5999
Round 003: test acc mean=0.6264 ± 0.0065 | min=0.6083 max=0.6352
         : test loss mean=0.6449 ± 0.0048
         : individual accs = ['0.608277', '0.628311', '0.620777', '0.629247', '0.629723', '0.625478', '0.630071', '0.628506', '0.620820', '0.632436', '0.613148', '0.622151', '0.633134', '0.635218', '0.633310', '0.630914', '0.626659', '0.626429', '0.627535', '0.625807']
         : correct/total = [(8657, 14232), (8944, 14235), (8856, 14266), (8946, 14217), (8966, 14238), (8990, 14373), (9039, 14346), (9009, 14334), (8874, 14294), (9090, 14373), (8795, 14344), (8898, 14302), (9088, 14354), (9123, 14362), (9069, 14320), (9082, 14395), (9017, 14389), (8931, 14257), (8943, 14251), (9011, 14399)]
         : compromised: 0.6303, honest: 0.6260
Round 004: test acc mean=0.6337 ± 0.0039 | min=0.6256 max=0.6394
         : test loss mean=0.6375 ± 0.0024
         : individual accs = ['0.635118', '0.639410', '0.638231', '0.637969', '0.634359', '0.625617', '0.636345', '0.629971', '0.637330', '0.633966', '0.635178', '0.634806', '0.634039', '0.632642', '0.625838', '0.637096', '0.631941', '0.632952', '0.626412', '0.634905']
         : correct/total = [(9039, 14232), (9102, 14235), (9105, 14266), (9070, 14217), (9032, 14238), (8992, 14373), (9129, 14346), (9030, 14334), (9110, 14294), (9112, 14373), (9111, 14344), (9079, 14302), (9101, 14354), (9086, 14362), (8962, 14320), (9171, 14395), (9093, 14389), (9024, 14257), (8927, 14251), (9142, 14399)]
         : compromised: 0.6291, honest: 0.6342
Round 005: test acc mean=0.6406 ± 0.0058 | min=0.6256 max=0.6510
         : test loss mean=0.6319 ± 0.0030
         : individual accs = ['0.643269', '0.651001', '0.630310', '0.641275', '0.640188', '0.637028', '0.641642', '0.642877', '0.625647', '0.646838', '0.645427', '0.634597', '0.639125', '0.647333', '0.637291', '0.645780', '0.640072', '0.640317', '0.638692', '0.644073']
         : correct/total = [(9155, 14232), (9267, 14235), (8992, 14266), (9117, 14217), (9115, 14238), (9156, 14373), (9205, 14346), (9215, 14334), (8943, 14294), (9297, 14373), (9258, 14344), (9076, 14302), (9174, 14354), (9297, 14362), (9126, 14320), (9296, 14395), (9210, 14389), (9129, 14257), (9102, 14251), (9274, 14399)]
         : compromised: 0.6422, honest: 0.6405
Round 006: test acc mean=0.6443 ± 0.0047 | min=0.6352 max=0.6578
         : test loss mean=0.6276 ± 0.0028
         : individual accs = ['0.644885', '0.657815', '0.639843', '0.648097', '0.647703', '0.640367', '0.643315', '0.647272', '0.635232', '0.646142', '0.647379', '0.643616', '0.642051', '0.647194', '0.637360', '0.647447', '0.644381', '0.640247', '0.644025', '0.642197']
         : correct/total = [(9178, 14232), (9364, 14235), (9128, 14266), (9214, 14217), (9222, 14238), (9204, 14373), (9229, 14346), (9278, 14334), (9080, 14294), (9287, 14373), (9286, 14344), (9205, 14302), (9216, 14354), (9295, 14362), (9127, 14320), (9320, 14395), (9272, 14389), (9128, 14257), (9178, 14251), (9247, 14399)]
         : compromised: 0.6438, honest: 0.6444
Round 007: test acc mean=0.6485 ± 0.0036 | min=0.6420 max=0.6575
         : test loss mean=0.6233 ± 0.0031
         : individual accs = ['0.657462', '0.651844', '0.642717', '0.648660', '0.645456', '0.648508', '0.648473', '0.648040', '0.648034', '0.650595', '0.652886', '0.643826', '0.648809', '0.652207', '0.650419', '0.649948', '0.648064', '0.642000', '0.644306', '0.647267']
         : correct/total = [(9357, 14232), (9279, 14235), (9169, 14266), (9222, 14217), (9190, 14238), (9321, 14373), (9303, 14346), (9289, 14334), (9263, 14294), (9351, 14373), (9365, 14344), (9208, 14302), (9313, 14354), (9367, 14362), (9314, 14320), (9356, 14395), (9325, 14389), (9153, 14257), (9182, 14251), (9320, 14399)]
         : compromised: 0.6504, honest: 0.6483
Round 008: test acc mean=0.6559 ± 0.0041 | min=0.6497 max=0.6677
         : test loss mean=0.6175 ± 0.0031
         : individual accs = ['0.662240', '0.667650', '0.649727', '0.654850', '0.660346', '0.652752', '0.657047', '0.654877', '0.652931', '0.656300', '0.658185', '0.652986', '0.656542', '0.658474', '0.653771', '0.657242', '0.650636', '0.656379', '0.652726', '0.652406']
         : correct/total = [(9425, 14232), (9504, 14235), (9269, 14266), (9310, 14217), (9402, 14238), (9382, 14373), (9426, 14346), (9387, 14334), (9333, 14294), (9433, 14373), (9441, 14344), (9339, 14302), (9424, 14354), (9457, 14362), (9362, 14320), (9461, 14395), (9362, 14389), (9358, 14257), (9302, 14251), (9394, 14399)]
         : compromised: 0.6556, honest: 0.6559
Round 009: test acc mean=0.6598 ± 0.0049 | min=0.6480 max=0.6712
         : test loss mean=0.6133 ± 0.0034
         : individual accs = ['0.664067', '0.671163', '0.649727', '0.659070', '0.662593', '0.648021', '0.664088', '0.660318', '0.659158', '0.662701', '0.661601', '0.656971', '0.664414', '0.660841', '0.656564', '0.661896', '0.658072', '0.658343', '0.656726', '0.660254']
         : correct/total = [(9451, 14232), (9554, 14235), (9269, 14266), (9370, 14217), (9434, 14238), (9314, 14373), (9527, 14346), (9465, 14334), (9422, 14294), (9525, 14373), (9490, 14344), (9396, 14302), (9537, 14354), (9491, 14362), (9402, 14320), (9528, 14395), (9469, 14389), (9386, 14257), (9359, 14251), (9507, 14399)]
         : compromised: 0.6544, honest: 0.6604
Round 010: test acc mean=0.6640 ± 0.0038 | min=0.6572 max=0.6736
         : test loss mean=0.6088 ± 0.0032
         : individual accs = ['0.668704', '0.673551', '0.657157', '0.662446', '0.668001', '0.659987', '0.665760', '0.665132', '0.662236', '0.665206', '0.665226', '0.662495', '0.664205', '0.663696', '0.663268', '0.669885', '0.660713', '0.658484', '0.661427', '0.663379']
         : correct/total = [(9517, 14232), (9588, 14235), (9375, 14266), (9418, 14217), (9511, 14238), (9486, 14373), (9551, 14346), (9534, 14334), (9466, 14294), (9561, 14373), (9542, 14344), (9475, 14302), (9534, 14354), (9532, 14362), (9498, 14320), (9643, 14395), (9507, 14389), (9388, 14257), (9426, 14251), (9552, 14399)]
         : compromised: 0.6618, honest: 0.6643

=== FINAL RESULTS ===
Dataset: sent140, Nodes: 20, Graph: erdos, Aggregation: krum
Attack: directed_deviation, 10.0% compromised
Final accuracy - Compromised: 0.6618, Honest: 0.6643
Overall test accuracy: mean=0.6640 ± 0.0038
