Device: cuda
Seed: 987654321
Loading 1 LEAF Sent140 train files...
LEAF Sent140 train: 254555 users, 908652 samples
Building vocabulary (max_size=10000)...
Vocabulary size: 10000
Loading 1 LEAF Sent140 test files...
LEAF Sent140 test: 254555 users, 286281 samples
Found 254555 train users, 254555 test users, 254555 common users
User sample counts range: 494 (max) to 1 (min)
Distributed ALL 254555 users across 20 clients
Users per client: 12727 (with 15 clients getting +1 user)
Train partition sizes: [44353, 44290, 44657, 44907, 44696, 45843, 45801, 45619, 45069, 45639, 45821, 45311, 45779, 46056, 45625, 45984, 46428, 44737, 45540, 46497]
Test partition sizes: [14232, 14235, 14266, 14217, 14238, 14373, 14346, 14334, 14294, 14373, 14344, 14302, 14354, 14362, 14320, 14395, 14389, 14257, 14251, 14399]
  Client 0: 44353 train samples, 2 unique classes
  Client 1: 44290 train samples, 2 unique classes
  Client 2: 44657 train samples, 2 unique classes
  Client 3: 44907 train samples, 2 unique classes
  Client 4: 44696 train samples, 2 unique classes
  Client 5: 45843 train samples, 2 unique classes
  Client 6: 45801 train samples, 2 unique classes
  Client 7: 45619 train samples, 2 unique classes
  Client 8: 45069 train samples, 2 unique classes
  Client 9: 45639 train samples, 2 unique classes
  Client 10: 45821 train samples, 2 unique classes
  Client 11: 45311 train samples, 2 unique classes
  Client 12: 45779 train samples, 2 unique classes
  Client 13: 46056 train samples, 2 unique classes
  Client 14: 45625 train samples, 2 unique classes
  Client 15: 45984 train samples, 2 unique classes
  Client 16: 46428 train samples, 2 unique classes
  Client 17: 44737 train samples, 2 unique classes
  Client 18: 45540 train samples, 2 unique classes
  Client 19: 46497 train samples, 2 unique classes
Will sample 4500 samples per client per epoch
Graph: ring, nodes: 20, edges: 20
Degree statistics: avg=2.00, min=2, max=2
Attack: Compromised 4/20 nodes: [5, 12, 13, 17]
Attack type: backdoor, lambda: 1.0
Backdoor target label: 1, trigger size: 3
Model variant: baseline
Model parameters: 1,174,986
Initial test acc across nodes: mean=0.4965 ± 0.0152
Backdoor attack: Created poisoned datasets for 4 compromised nodes
Round 001: test acc mean=0.5689 ± 0.0459 | min=0.4877 max=0.6137
         : test loss mean=8.6425 ± 13.2766
         : individual accs = ['0.597175', '0.598806', '0.601991', '0.595414', '0.588847', '0.506436', '0.579395', '0.613716', '0.610886', '0.598831', '0.593698', '0.599217', '0.500488', '0.501950', '0.497207', '0.601806', '0.598096', '0.487690', '0.505017', '0.602264']
         : correct/total = [(8499, 14232), (8524, 14235), (8588, 14266), (8465, 14217), (8384, 14238), (7279, 14373), (8312, 14346), (8797, 14334), (8732, 14294), (8607, 14373), (8516, 14344), (8570, 14302), (7184, 14354), (7209, 14362), (7120, 14320), (8663, 14395), (8606, 14389), (6953, 14257), (7197, 14251), (8672, 14399)]
         : compromised: 0.4991, honest: 0.5864
Round 002: test acc mean=0.5790 ± 0.0536 | min=0.4950 max=0.6245
         : test loss mean=8.2832 ± 12.4792
         : individual accs = ['0.621768', '0.621356', '0.614258', '0.618555', '0.608583', '0.494956', '0.507877', '0.623204', '0.624528', '0.619008', '0.618168', '0.610684', '0.503135', '0.510932', '0.528980', '0.618131', '0.617833', '0.503051', '0.497018', '0.618168']
         : correct/total = [(8849, 14232), (8845, 14235), (8763, 14266), (8794, 14217), (8665, 14238), (7114, 14373), (7286, 14346), (8933, 14334), (8927, 14294), (8897, 14373), (8867, 14344), (8734, 14302), (7222, 14354), (7338, 14362), (7575, 14320), (8898, 14395), (8890, 14389), (7172, 14257), (7083, 14251), (8901, 14399)]
         : compromised: 0.5030, honest: 0.5980
Round 003: test acc mean=0.5825 ± 0.0649 | min=0.4813 max=0.6409
         : test loss mean=4.7221 ± 7.8190
         : individual accs = ['0.635048', '0.630558', '0.627716', '0.630020', '0.633235', '0.503792', '0.494284', '0.627738', '0.633063', '0.631323', '0.611057', '0.621172', '0.487599', '0.481340', '0.493785', '0.640917', '0.630412', '0.505155', '0.495755', '0.635322']
         : correct/total = [(9038, 14232), (8976, 14235), (8955, 14266), (8957, 14217), (9016, 14238), (7241, 14373), (7091, 14346), (8998, 14334), (9049, 14294), (9074, 14373), (8765, 14344), (8884, 14302), (6999, 14354), (6913, 14362), (7071, 14320), (9226, 14395), (9071, 14389), (7202, 14257), (7065, 14251), (9148, 14399)]
         : compromised: 0.4945, honest: 0.6045
Round 004: test acc mean=0.5908 ± 0.0680 | min=0.4893 max=0.6504
         : test loss mean=3.6440 ± 4.8352
         : individual accs = ['0.650365', '0.641728', '0.636899', '0.636773', '0.643138', '0.489251', '0.494284', '0.641412', '0.638520', '0.639463', '0.636085', '0.632289', '0.503971', '0.491366', '0.493994', '0.645641', '0.644451', '0.509785', '0.506561', '0.639281']
         : correct/total = [(9256, 14232), (9135, 14235), (9086, 14266), (9053, 14217), (9157, 14238), (7032, 14373), (7091, 14346), (9194, 14334), (9127, 14294), (9191, 14373), (9124, 14344), (9043, 14302), (7234, 14354), (7057, 14362), (7074, 14320), (9294, 14395), (9273, 14389), (7268, 14257), (7219, 14251), (9205, 14399)]
         : compromised: 0.4986, honest: 0.6138
Round 005: test acc mean=0.5931 ± 0.0726 | min=0.4854 max=0.6540
         : test loss mean=3.0028 ± 3.9455
         : individual accs = ['0.654019', '0.650790', '0.645170', '0.650278', '0.648546', '0.491199', '0.499651', '0.648179', '0.639149', '0.637515', '0.641523', '0.638722', '0.502508', '0.508564', '0.489176', '0.653491', '0.648759', '0.485867', '0.485440', '0.643725']
         : correct/total = [(9308, 14232), (9264, 14235), (9204, 14266), (9245, 14217), (9234, 14238), (7060, 14373), (7168, 14346), (9291, 14334), (9136, 14294), (9163, 14373), (9202, 14344), (9135, 14302), (7213, 14354), (7304, 14362), (7005, 14320), (9407, 14395), (9335, 14389), (6927, 14257), (6918, 14251), (9269, 14399)]
         : compromised: 0.4970, honest: 0.6171
Round 006: test acc mean=0.5994 ± 0.0693 | min=0.4927 max=0.6584
         : test loss mean=2.8891 ± 4.3081
         : individual accs = ['0.658375', '0.656832', '0.655895', '0.655553', '0.657325', '0.501357', '0.505786', '0.648249', '0.642228', '0.644542', '0.647588', '0.646763', '0.504598', '0.520680', '0.505726', '0.650226', '0.640420', '0.492670', '0.506701', '0.646364']
         : correct/total = [(9370, 14232), (9350, 14235), (9357, 14266), (9320, 14217), (9359, 14238), (7206, 14373), (7256, 14346), (9292, 14334), (9180, 14294), (9264, 14373), (9289, 14344), (9250, 14302), (7243, 14354), (7478, 14362), (7242, 14320), (9360, 14395), (9215, 14389), (7024, 14257), (7221, 14251), (9307, 14399)]
         : compromised: 0.5048, honest: 0.6230
Round 007: test acc mean=0.6031 ± 0.0751 | min=0.4924 max=0.6678
         : test loss mean=4.1236 ± 7.7582
         : individual accs = ['0.667791', '0.661609', '0.658489', '0.661462', '0.666315', '0.494190', '0.509410', '0.652016', '0.646355', '0.655674', '0.651213', '0.649490', '0.495750', '0.492411', '0.514665', '0.664884', '0.663215', '0.494915', '0.507052', '0.655601']
         : correct/total = [(9504, 14232), (9418, 14235), (9394, 14266), (9404, 14217), (9487, 14238), (7103, 14373), (7308, 14346), (9346, 14334), (9239, 14294), (9424, 14373), (9341, 14344), (9289, 14302), (7116, 14354), (7072, 14362), (7370, 14320), (9571, 14395), (9543, 14389), (7056, 14257), (7226, 14251), (9440, 14399)]
         : compromised: 0.4943, honest: 0.6303
Round 008: test acc mean=0.6062 ± 0.0768 | min=0.4901 max=0.6681
         : test loss mean=4.0811 ± 7.9652
         : individual accs = ['0.665894', '0.666175', '0.666269', '0.665893', '0.663647', '0.490086', '0.511571', '0.657109', '0.660487', '0.659848', '0.658533', '0.653265', '0.498119', '0.494221', '0.512849', '0.668149', '0.665369', '0.500526', '0.505859', '0.659907']
         : correct/total = [(9477, 14232), (9483, 14235), (9505, 14266), (9467, 14217), (9449, 14238), (7044, 14373), (7339, 14346), (9419, 14334), (9441, 14294), (9484, 14373), (9446, 14344), (9343, 14302), (7150, 14354), (7098, 14362), (7344, 14320), (9618, 14395), (9574, 14389), (7136, 14257), (7209, 14251), (9502, 14399)]
         : compromised: 0.4957, honest: 0.6338
Round 009: test acc mean=0.6086 ± 0.0792 | min=0.4920 max=0.6776
         : test loss mean=5.5121 ± 11.6255
         : individual accs = ['0.677628', '0.669968', '0.669914', '0.667300', '0.666596', '0.501426', '0.518751', '0.668132', '0.663565', '0.664997', '0.656999', '0.657391', '0.491988', '0.496101', '0.507402', '0.671900', '0.669192', '0.493161', '0.498842', '0.661435']
         : correct/total = [(9644, 14232), (9537, 14235), (9557, 14266), (9487, 14217), (9491, 14238), (7207, 14373), (7442, 14346), (9577, 14334), (9485, 14294), (9558, 14373), (9424, 14344), (9402, 14302), (7062, 14354), (7125, 14362), (7266, 14320), (9672, 14395), (9629, 14389), (7031, 14257), (7109, 14251), (9524, 14399)]
         : compromised: 0.4957, honest: 0.6369
Round 010: test acc mean=0.6136 ± 0.0801 | min=0.4872 max=0.6847
         : test loss mean=3.7899 ± 7.3769
         : individual accs = ['0.684725', '0.677696', '0.677625', '0.675811', '0.675867', '0.505462', '0.523630', '0.669457', '0.664684', '0.669032', '0.663134', '0.660257', '0.501254', '0.487188', '0.509358', '0.673984', '0.676767', '0.509925', '0.497790', '0.667616']
         : correct/total = [(9745, 14232), (9647, 14235), (9667, 14266), (9608, 14217), (9623, 14238), (7265, 14373), (7512, 14346), (9596, 14334), (9501, 14294), (9616, 14373), (9512, 14344), (9443, 14302), (7195, 14354), (6997, 14362), (7294, 14320), (9702, 14395), (9738, 14389), (7270, 14257), (7094, 14251), (9613, 14399)]
         : compromised: 0.5010, honest: 0.6417

=== FINAL RESULTS ===
Dataset: sent140, Nodes: 20, Graph: ring, Aggregation: krum
Attack: backdoor, 20.0% compromised
Final accuracy - Compromised: 0.5010, Honest: 0.6417
Overall test accuracy: mean=0.6136 ± 0.0801

=== BACKDOOR ATTACK SUCCESS RATE (ASR) ===
Target label: 1
Trigger size: 3x3
Overall ASR: 0.4969 ± 0.1045
Honest nodes ASR: 0.4583 ± 0.0723
Compromised nodes ASR: 0.6512 ± 0.0627
Note: Higher ASR indicates more successful backdoor attack
