Device: cuda
Seed: 987654321
Loading 1 LEAF Sent140 train files...
LEAF Sent140 train: 254555 users, 908652 samples
Building vocabulary (max_size=10000)...
Vocabulary size: 10000
Loading 1 LEAF Sent140 test files...
LEAF Sent140 test: 254555 users, 286281 samples
Found 254555 train users, 254555 test users, 254555 common users
User sample counts range: 494 (max) to 1 (min)
Distributed ALL 254555 users across 20 clients
Users per client: 12727 (with 15 clients getting +1 user)
Train partition sizes: [44353, 44290, 44657, 44907, 44696, 45843, 45801, 45619, 45069, 45639, 45821, 45311, 45779, 46056, 45625, 45984, 46428, 44737, 45540, 46497]
Test partition sizes: [14232, 14235, 14266, 14217, 14238, 14373, 14346, 14334, 14294, 14373, 14344, 14302, 14354, 14362, 14320, 14395, 14389, 14257, 14251, 14399]
  Client 0: 44353 train samples, 2 unique classes
  Client 1: 44290 train samples, 2 unique classes
  Client 2: 44657 train samples, 2 unique classes
  Client 3: 44907 train samples, 2 unique classes
  Client 4: 44696 train samples, 2 unique classes
  Client 5: 45843 train samples, 2 unique classes
  Client 6: 45801 train samples, 2 unique classes
  Client 7: 45619 train samples, 2 unique classes
  Client 8: 45069 train samples, 2 unique classes
  Client 9: 45639 train samples, 2 unique classes
  Client 10: 45821 train samples, 2 unique classes
  Client 11: 45311 train samples, 2 unique classes
  Client 12: 45779 train samples, 2 unique classes
  Client 13: 46056 train samples, 2 unique classes
  Client 14: 45625 train samples, 2 unique classes
  Client 15: 45984 train samples, 2 unique classes
  Client 16: 46428 train samples, 2 unique classes
  Client 17: 44737 train samples, 2 unique classes
  Client 18: 45540 train samples, 2 unique classes
  Client 19: 46497 train samples, 2 unique classes
Will sample 4500 samples per client per epoch
Graph: erdos, nodes: 20, edges: 48
Degree statistics: avg=4.80, min=2, max=7
Attack: Compromised 4/20 nodes: [5, 12, 13, 17]
Attack type: gaussian, lambda: 1.0
Model variant: baseline
Model parameters: 1,174,986
UBAR ALGORITHM (Two-Stage Byzantine-resilient)
  - Model dimension: 1,174,986 parameters
  - Rho parameter: 0.8
  - Stage 1: Distance-based filtering (select 80% closest neighbors)
  - Stage 2: Performance-based selection (loss comparison)
  - Complexity: O(deg(i)×d + deg(i)×inference)
Initial test acc across nodes: mean=0.4965 ± 0.0152
Round 001: test acc mean=0.5282 ± 0.0221 | min=0.4797 max=0.5636
         : test loss mean=0.6917 ± 0.0014
         : individual accs = ['0.536046', '0.562768', '0.530282', '0.507421', '0.506672', '0.532387', '0.501324', '0.563555', '0.527354', '0.543589', '0.522170', '0.558244', '0.511147', '0.552778', '0.529818', '0.525252', '0.551324', '0.515186', '0.506842', '0.479686']
         : correct/total = [(7629, 14232), (8011, 14235), (7565, 14266), (7214, 14217), (7214, 14238), (7652, 14373), (7192, 14346), (8078, 14334), (7538, 14294), (7813, 14373), (7490, 14344), (7984, 14302), (7337, 14354), (7939, 14362), (7587, 14320), (7561, 14395), (7933, 14389), (7345, 14257), (7223, 14251), (6907, 14399)]
         : compromised: 0.5279, honest: 0.5283
         : ubar stats = ['Node 0: s1=0.667, s2=0.250', 'Node 1: s1=0.667, s2=0.750', 'Node 2: s1=0.800, s2=1.000']...
Round 002: test acc mean=0.5326 ± 0.0377 | min=0.4887 max=0.6007
         : test loss mean=0.6912 ± 0.0022
         : individual accs = ['0.587409', '0.488725', '0.502033', '0.501372', '0.526549', '0.493982', '0.497700', '0.517511', '0.583811', '0.557991', '0.598508', '0.600685', '0.528354', '0.508564', '0.495810', '0.498923', '0.506846', '0.529144', '0.582415', '0.546496']
         : correct/total = [(8360, 14232), (6957, 14235), (7162, 14266), (7128, 14217), (7497, 14238), (7100, 14373), (7140, 14346), (7418, 14334), (8345, 14294), (8020, 14373), (8585, 14344), (8591, 14302), (7584, 14354), (7304, 14362), (7100, 14320), (7182, 14395), (7293, 14389), (7544, 14257), (8300, 14251), (7869, 14399)]
         : compromised: 0.5150, honest: 0.5370
         : ubar stats = ['Node 0: s1=0.667, s2=0.250', 'Node 1: s1=0.667, s2=0.500', 'Node 2: s1=0.800, s2=0.750']...
Round 003: test acc mean=0.5128 ± 0.0281 | min=0.4861 max=0.5773
         : test loss mean=0.6915 ± 0.0031
         : individual accs = ['0.534429', '0.486336', '0.486051', '0.492720', '0.494803', '0.493843', '0.497560', '0.495186', '0.577305', '0.554790', '0.499163', '0.549224', '0.499512', '0.508564', '0.495810', '0.498367', '0.499757', '0.503051', '0.574907', '0.514827']
         : correct/total = [(7606, 14232), (6923, 14235), (6934, 14266), (7005, 14217), (7045, 14238), (7098, 14373), (7138, 14346), (7098, 14334), (8252, 14294), (7974, 14373), (7160, 14344), (7855, 14302), (7170, 14354), (7304, 14362), (7100, 14320), (7174, 14395), (7191, 14389), (7172, 14257), (8193, 14251), (7413, 14399)]
         : compromised: 0.5012, honest: 0.5157
         : ubar stats = ['Node 0: s1=0.667, s2=0.250', 'Node 1: s1=0.667, s2=0.417', 'Node 2: s1=0.800, s2=0.833']...
Round 004: test acc mean=0.5153 ± 0.0385 | min=0.4861 max=0.6091
         : test loss mean=0.6899 ± 0.0069
         : individual accs = ['0.489109', '0.486266', '0.486051', '0.504466', '0.601840', '0.493843', '0.497560', '0.495186', '0.609067', '0.504279', '0.513664', '0.504125', '0.499512', '0.508564', '0.495810', '0.498367', '0.499757', '0.503051', '0.605431', '0.510660']
         : correct/total = [(6961, 14232), (6922, 14235), (6934, 14266), (7172, 14217), (8569, 14238), (7098, 14373), (7138, 14346), (7098, 14334), (8706, 14294), (7248, 14373), (7368, 14344), (7210, 14302), (7170, 14354), (7304, 14362), (7100, 14320), (7174, 14395), (7191, 14389), (7172, 14257), (8628, 14251), (7353, 14399)]
         : compromised: 0.5012, honest: 0.5189
         : ubar stats = ['Node 0: s1=0.667, s2=0.312', 'Node 1: s1=0.667, s2=0.438', 'Node 2: s1=0.800, s2=0.875']...
Round 005: test acc mean=0.5199 ± 0.0423 | min=0.4861 max=0.6163
         : test loss mean=0.6877 ± 0.0111
         : individual accs = ['0.489109', '0.486266', '0.486051', '0.529929', '0.611041', '0.493843', '0.497560', '0.495186', '0.616273', '0.530091', '0.499024', '0.494616', '0.499512', '0.508564', '0.495810', '0.498367', '0.499757', '0.503051', '0.613852', '0.549135']
         : correct/total = [(6961, 14232), (6922, 14235), (6934, 14266), (7534, 14217), (8700, 14238), (7098, 14373), (7138, 14346), (7098, 14334), (8809, 14294), (7619, 14373), (7158, 14344), (7074, 14302), (7170, 14354), (7304, 14362), (7100, 14320), (7174, 14395), (7191, 14389), (7172, 14257), (8748, 14251), (7907, 14399)]
         : compromised: 0.5012, honest: 0.5245
         : ubar stats = ['Node 0: s1=0.667, s2=0.450', 'Node 1: s1=0.667, s2=0.500', 'Node 2: s1=0.800, s2=0.800']...
Round 006: test acc mean=0.5270 ± 0.0469 | min=0.4861 max=0.6258
         : test loss mean=0.6854 ± 0.0151
         : individual accs = ['0.489109', '0.486266', '0.486051', '0.572976', '0.621787', '0.493843', '0.519448', '0.495186', '0.625787', '0.556877', '0.499024', '0.513075', '0.499512', '0.509609', '0.495810', '0.498367', '0.499757', '0.503051', '0.625009', '0.549066']
         : correct/total = [(6961, 14232), (6922, 14235), (6934, 14266), (8146, 14217), (8853, 14238), (7098, 14373), (7452, 14346), (7098, 14334), (8945, 14294), (8004, 14373), (7158, 14344), (7338, 14302), (7170, 14354), (7319, 14362), (7100, 14320), (7174, 14395), (7191, 14389), (7172, 14257), (8907, 14251), (7906, 14399)]
         : compromised: 0.5015, honest: 0.5333
         : ubar stats = ['Node 0: s1=0.667, s2=0.500', 'Node 1: s1=0.667, s2=0.542', 'Node 2: s1=0.800, s2=0.833']...
Round 007: test acc mean=0.5394 ± 0.0558 | min=0.4861 max=0.6338
         : test loss mean=0.6830 ± 0.0173
         : individual accs = ['0.489109', '0.486266', '0.486051', '0.574242', '0.632462', '0.493843', '0.582601', '0.627110', '0.633832', '0.593752', '0.499024', '0.509160', '0.499512', '0.554519', '0.495810', '0.498367', '0.499757', '0.503191', '0.629780', '0.499479']
         : correct/total = [(6961, 14232), (6922, 14235), (6934, 14266), (8164, 14217), (9005, 14238), (7098, 14373), (8358, 14346), (8989, 14334), (9060, 14294), (8534, 14373), (7158, 14344), (7282, 14302), (7170, 14354), (7964, 14362), (7100, 14320), (7174, 14395), (7191, 14389), (7174, 14257), (8975, 14251), (7192, 14399)]
         : compromised: 0.5128, honest: 0.5461
         : ubar stats = ['Node 0: s1=0.667, s2=0.536', 'Node 1: s1=0.667, s2=0.607', 'Node 2: s1=0.800, s2=0.857']...
Round 008: test acc mean=0.5485 ± 0.0614 | min=0.4861 max=0.6359
         : test loss mean=0.6793 ± 0.0197
         : individual accs = ['0.489109', '0.486266', '0.486051', '0.614687', '0.633727', '0.493843', '0.612157', '0.627389', '0.635931', '0.613024', '0.499024', '0.549294', '0.499512', '0.603467', '0.495810', '0.498367', '0.499757', '0.503051', '0.632587', '0.496701']
         : correct/total = [(6961, 14232), (6922, 14235), (6934, 14266), (8739, 14217), (9023, 14238), (7098, 14373), (8782, 14346), (8993, 14334), (9090, 14294), (8811, 14373), (7158, 14344), (7856, 14302), (7170, 14354), (8667, 14362), (7100, 14320), (7174, 14395), (7191, 14389), (7172, 14257), (9015, 14251), (7152, 14399)]
         : compromised: 0.5250, honest: 0.5544
         : ubar stats = ['Node 0: s1=0.667, s2=0.594', 'Node 1: s1=0.667, s2=0.594', 'Node 2: s1=0.800, s2=0.875']...
Round 009: test acc mean=0.5680 ± 0.0626 | min=0.4861 max=0.6401
         : test loss mean=0.6748 ± 0.0218
         : individual accs = ['0.593100', '0.486266', '0.486051', '0.626152', '0.634359', '0.493843', '0.622961', '0.637017', '0.640059', '0.594865', '0.595789', '0.566634', '0.499512', '0.624356', '0.495810', '0.498367', '0.499757', '0.629375', '0.638903', '0.496354']
         : correct/total = [(8441, 14232), (6922, 14235), (6934, 14266), (8902, 14217), (9032, 14238), (7098, 14373), (8937, 14346), (9131, 14334), (9149, 14294), (8550, 14373), (8546, 14344), (8104, 14302), (7170, 14354), (8967, 14362), (7100, 14320), (7174, 14395), (7191, 14389), (8973, 14257), (9105, 14251), (7147, 14399)]
         : compromised: 0.5618, honest: 0.5695
         : ubar stats = ['Node 0: s1=0.667, s2=0.583', 'Node 1: s1=0.667, s2=0.583', 'Node 2: s1=0.800, s2=0.889']...
Round 010: test acc mean=0.5681 ± 0.0652 | min=0.4861 max=0.6429
         : test loss mean=0.6703 ± 0.0238
         : individual accs = ['0.616920', '0.486266', '0.486051', '0.630302', '0.639907', '0.507966', '0.628189', '0.642877', '0.639289', '0.625826', '0.501255', '0.526290', '0.499512', '0.628325', '0.495810', '0.498367', '0.544444', '0.629305', '0.638762', '0.496354']
         : correct/total = [(8780, 14232), (6922, 14235), (6934, 14266), (8961, 14217), (9111, 14238), (7301, 14373), (9012, 14346), (9215, 14334), (9138, 14294), (8995, 14373), (7190, 14344), (7527, 14302), (7170, 14354), (9024, 14362), (7100, 14320), (7174, 14395), (7834, 14389), (8972, 14257), (9103, 14251), (7147, 14399)]
         : compromised: 0.5663, honest: 0.5686
         : ubar stats = ['Node 0: s1=0.667, s2=0.575', 'Node 1: s1=0.667, s2=0.600', 'Node 2: s1=0.800, s2=0.875']...

=== FINAL RESULTS ===
Dataset: sent140, Nodes: 20, Graph: erdos, Aggregation: ubar
Attack: gaussian, 20.0% compromised
Final accuracy - Compromised: 0.5663, Honest: 0.5686
Overall test accuracy: mean=0.5681 ± 0.0652

=== UBAR SUMMARY ===
Node 0: stage1=0.667, stage2=0.575, overall=0.383
Node 1: stage1=0.667, stage2=0.600, overall=0.400
Node 2: stage1=0.800, stage2=0.875, overall=0.700
Node 3: stage1=0.750, stage2=0.433, overall=0.325
Node 4: stage1=0.750, stage2=0.467, overall=0.350
Node 5: stage1=0.800, stage2=0.625, overall=0.500
Node 6: stage1=0.800, stage2=0.300, overall=0.240
Node 7: stage1=0.800, stage2=0.350, overall=0.280
Node 8: stage1=0.500, stage2=1.000, overall=0.500
Node 9: stage1=0.667, stage2=0.600, overall=0.400
Node 10: stage1=0.750, stage2=0.567, overall=0.425
Node 11: stage1=0.714, stage2=0.500, overall=0.357
Node 12: stage1=0.714, stage2=0.640, overall=0.457
Node 13: stage1=0.750, stage2=0.600, overall=0.450
Node 14: stage1=0.714, stage2=0.360, overall=0.257
Node 15: stage1=0.667, stage2=0.375, overall=0.250
Node 16: stage1=0.800, stage2=0.475, overall=0.380
Node 17: stage1=0.800, stage2=0.400, overall=0.320
Node 18: stage1=0.750, stage2=0.467, overall=0.350
Node 19: stage1=0.500, stage2=1.000, overall=0.500

=== PARALLEL EXECUTION TIME (realistic for distributed system) ===
  COMMUNICATION (max across nodes):
    - Full model transfer: 0.000s (0.0%)
  COMPUTATION (max across nodes):
    - Distance computation: 0.032s (51.7%)
    - Loss computation: 0.023s (37.2%)
    - Aggregation: 0.007s (11.1%)
  TOTALS:
    - Total computation: 0.062s (100.0%)
    - Total communication: 0.000s (0.0%)
    - Total parallel time: 0.062s

=== PER-NODE AVERAGE TIME ===
  - Distance computation: 0.020s
  - Loss computation: 0.016s
  - Aggregation: 0.004s
  - Model transfer: 0.000s
  - Total per node: 0.041s

=== TOTAL COMPUTATIONAL WORK (sum across all nodes) ===
  - Total distance computation: 0.405s
  - Total loss computation: 0.328s
  - Total aggregation: 0.089s
  - Total model transfer: 0.000s
  - Grand total: 0.822s
  - Mean Stage 1 acceptance rate: 0.718
  - Mean Stage 2 acceptance rate: 0.560
  - Overall acceptance rate: 0.402

UBAR Algorithm Properties:
  - Model dimension: 1,174,986
  - Rho parameter: 0.8
  - Two-stage approach: Distance filtering + loss evaluation
  - Stage 1 selects: 80% of neighbors
  - Stage 2 uses: Training sample loss comparison
  - Theoretical complexity: O(deg(i)×d + deg(i)×inference)
  - Approach: UBAR paper implementation
