Device: cuda
Seed: 987654321
Loading 1 LEAF Sent140 train files...
LEAF Sent140 train: 254555 users, 908652 samples
Building vocabulary (max_size=10000)...
Vocabulary size: 10000
Loading 1 LEAF Sent140 test files...
LEAF Sent140 test: 254555 users, 286281 samples
Found 254555 train users, 254555 test users, 254555 common users
User sample counts range: 494 (max) to 1 (min)
Distributed ALL 254555 users across 20 clients
Users per client: 12727 (with 15 clients getting +1 user)
Train partition sizes: [44353, 44290, 44657, 44907, 44696, 45843, 45801, 45619, 45069, 45639, 45821, 45311, 45779, 46056, 45625, 45984, 46428, 44737, 45540, 46497]
Test partition sizes: [14232, 14235, 14266, 14217, 14238, 14373, 14346, 14334, 14294, 14373, 14344, 14302, 14354, 14362, 14320, 14395, 14389, 14257, 14251, 14399]
  Client 0: 44353 train samples, 2 unique classes
  Client 1: 44290 train samples, 2 unique classes
  Client 2: 44657 train samples, 2 unique classes
  Client 3: 44907 train samples, 2 unique classes
  Client 4: 44696 train samples, 2 unique classes
  Client 5: 45843 train samples, 2 unique classes
  Client 6: 45801 train samples, 2 unique classes
  Client 7: 45619 train samples, 2 unique classes
  Client 8: 45069 train samples, 2 unique classes
  Client 9: 45639 train samples, 2 unique classes
  Client 10: 45821 train samples, 2 unique classes
  Client 11: 45311 train samples, 2 unique classes
  Client 12: 45779 train samples, 2 unique classes
  Client 13: 46056 train samples, 2 unique classes
  Client 14: 45625 train samples, 2 unique classes
  Client 15: 45984 train samples, 2 unique classes
  Client 16: 46428 train samples, 2 unique classes
  Client 17: 44737 train samples, 2 unique classes
  Client 18: 45540 train samples, 2 unique classes
  Client 19: 46497 train samples, 2 unique classes
Will sample 4500 samples per client per epoch
Graph: fully, nodes: 20, edges: 190
Degree statistics: avg=19.00, min=19, max=19
Attack: Compromised 16/20 nodes: [1, 2, 3, 5, 6, 8, 9, 10, 11, 12, 13, 14, 15, 17, 18, 19]
Attack type: directed_deviation, lambda: 1.0
Model variant: baseline
Model parameters: 1,174,986
UBAR ALGORITHM (Two-Stage Byzantine-resilient)
  - Model dimension: 1,174,986 parameters
  - Rho parameter: 0.19999999999999996
  - Stage 1: Distance-based filtering (select 20% closest neighbors)
  - Stage 2: Performance-based selection (loss comparison)
  - Complexity: O(deg(i)×d + deg(i)×inference)
Initial test acc across nodes: mean=0.4953 ± 0.0174
Round 001: test acc mean=0.5619 ± 0.0314 | min=0.4973 max=0.6087
         : test loss mean=0.6889 ± 0.0020
         : individual accs = ['0.608137', '0.554830', '0.545493', '0.497292', '0.583649', '0.577611', '0.590478', '0.608693', '0.545963', '0.591526', '0.567973', '0.530206', '0.546120', '0.566286', '0.508799', '0.599375', '0.526583', '0.569825', '0.533647', '0.584902']
         : correct/total = [(8655, 14232), (7898, 14235), (7782, 14266), (7070, 14217), (8310, 14238), (8302, 14373), (8471, 14346), (8725, 14334), (7804, 14294), (8502, 14373), (8147, 14344), (7583, 14302), (7839, 14354), (8133, 14362), (7286, 14320), (8628, 14395), (7577, 14389), (8124, 14257), (7605, 14251), (8422, 14399)]
         : compromised: 0.5569, honest: 0.5818
         : ubar stats = ['Node 0: s1=0.158, s2=1.000', 'Node 1: s1=0.158, s2=0.333', 'Node 2: s1=0.158, s2=0.333']...
Round 002: test acc mean=0.6072 ± 0.0290 | min=0.5461 max=0.6412
         : test loss mean=0.6742 ± 0.0138
         : individual accs = ['0.634486', '0.618124', '0.560283', '0.565661', '0.635202', '0.621513', '0.546076', '0.622994', '0.610606', '0.606624', '0.634481', '0.631590', '0.606869', '0.614121', '0.619623', '0.589719', '0.595177', '0.641229', '0.552452', '0.636572']
         : correct/total = [(9030, 14232), (8799, 14235), (7993, 14266), (8042, 14217), (9044, 14238), (8933, 14373), (7834, 14346), (8930, 14334), (8728, 14294), (8719, 14373), (9101, 14344), (9033, 14302), (8711, 14354), (8820, 14362), (8873, 14320), (8489, 14395), (8564, 14389), (9142, 14257), (7873, 14251), (9166, 14399)]
         : compromised: 0.6035, honest: 0.6220
         : ubar stats = ['Node 0: s1=0.158, s2=0.667', 'Node 1: s1=0.158, s2=0.667', 'Node 2: s1=0.158, s2=0.333']...
Round 003: test acc mean=0.6271 ± 0.0228 | min=0.5436 max=0.6457
         : test loss mean=0.6560 ± 0.0148
         : individual accs = ['0.642285', '0.627327', '0.626174', '0.624886', '0.636957', '0.634384', '0.600446', '0.632692', '0.619631', '0.645725', '0.627719', '0.644246', '0.543612', '0.634382', '0.638617', '0.635637', '0.640003', '0.640738', '0.601782', '0.645253']
         : correct/total = [(9141, 14232), (8930, 14235), (8933, 14266), (8884, 14217), (9069, 14238), (9118, 14373), (8614, 14346), (9069, 14334), (8857, 14294), (9281, 14373), (9004, 14344), (9214, 14302), (7803, 14354), (9111, 14362), (9145, 14320), (9150, 14395), (9209, 14389), (9135, 14257), (8576, 14251), (9291, 14399)]
         : compromised: 0.6244, honest: 0.6380
         : ubar stats = ['Node 0: s1=0.158, s2=0.667', 'Node 1: s1=0.158, s2=0.667', 'Node 2: s1=0.158, s2=0.333']...
Round 004: test acc mean=0.6416 ± 0.0077 | min=0.6274 max=0.6525
         : test loss mean=0.6380 ± 0.0066
         : individual accs = ['0.638702', '0.627397', '0.630520', '0.641837', '0.641172', '0.650317', '0.637669', '0.648528', '0.628446', '0.648438', '0.635109', '0.640680', '0.647555', '0.642807', '0.630307', '0.646336', '0.648551', '0.652101', '0.642622', '0.652476']
         : correct/total = [(9090, 14232), (8931, 14235), (8995, 14266), (9125, 14217), (9129, 14238), (9347, 14373), (9148, 14346), (9296, 14334), (8983, 14294), (9320, 14373), (9110, 14344), (9163, 14302), (9295, 14354), (9232, 14362), (9026, 14320), (9304, 14395), (9332, 14389), (9297, 14257), (9158, 14251), (9395, 14399)]
         : compromised: 0.6409, honest: 0.6442
         : ubar stats = ['Node 0: s1=0.158, s2=0.583', 'Node 1: s1=0.158, s2=0.583', 'Node 2: s1=0.158, s2=0.417']...
Round 005: test acc mean=0.6463 ± 0.0054 | min=0.6312 max=0.6524
         : test loss mean=0.6304 ± 0.0044
         : individual accs = ['0.652263', '0.647278', '0.643488', '0.631216', '0.648055', '0.650177', '0.646382', '0.650621', '0.650902', '0.648786', '0.636642', '0.650818', '0.652362', '0.645662', '0.646089', '0.641264', '0.649732', '0.649856', '0.640025', '0.644142']
         : correct/total = [(9283, 14232), (9214, 14235), (9180, 14266), (8974, 14217), (9227, 14238), (9345, 14373), (9273, 14346), (9326, 14334), (9304, 14294), (9325, 14373), (9132, 14344), (9308, 14302), (9364, 14354), (9273, 14362), (9252, 14320), (9231, 14395), (9349, 14389), (9265, 14257), (9121, 14251), (9275, 14399)]
         : compromised: 0.6453, honest: 0.6502
         : ubar stats = ['Node 0: s1=0.158, s2=0.533', 'Node 1: s1=0.158, s2=0.533', 'Node 2: s1=0.158, s2=0.400']...
Round 006: test acc mean=0.6511 ± 0.0061 | min=0.6387 max=0.6605
         : test loss mean=0.6250 ± 0.0046
         : individual accs = ['0.651279', '0.654022', '0.646572', '0.645987', '0.654937', '0.660475', '0.641015', '0.660039', '0.650483', '0.651708', '0.649261', '0.656202', '0.659537', '0.647821', '0.649651', '0.638694', '0.644729', '0.653504', '0.646411', '0.658726']
         : correct/total = [(9269, 14232), (9310, 14235), (9224, 14266), (9184, 14217), (9325, 14238), (9493, 14373), (9196, 14346), (9461, 14334), (9298, 14294), (9367, 14373), (9313, 14344), (9385, 14302), (9467, 14354), (9304, 14362), (9303, 14320), (9194, 14395), (9277, 14389), (9317, 14257), (9212, 14251), (9485, 14399)]
         : compromised: 0.6506, honest: 0.6527
         : ubar stats = ['Node 0: s1=0.158, s2=0.556', 'Node 1: s1=0.158, s2=0.500', 'Node 2: s1=0.158, s2=0.389']...
Round 007: test acc mean=0.6527 ± 0.0075 | min=0.6276 max=0.6625
         : test loss mean=0.6225 ± 0.0057
         : individual accs = ['0.655987', '0.657464', '0.643628', '0.649293', '0.657325', '0.660753', '0.648822', '0.649156', '0.656849', '0.653656', '0.649122', '0.653125', '0.661836', '0.648935', '0.653841', '0.650712', '0.655848', '0.656800', '0.627605', '0.662546']
         : correct/total = [(9336, 14232), (9359, 14235), (9182, 14266), (9231, 14217), (9359, 14238), (9497, 14373), (9308, 14346), (9305, 14334), (9389, 14294), (9395, 14373), (9311, 14344), (9341, 14302), (9500, 14354), (9320, 14362), (9363, 14320), (9367, 14395), (9437, 14389), (9364, 14257), (8944, 14251), (9540, 14399)]
         : compromised: 0.6522, honest: 0.6546
         : ubar stats = ['Node 0: s1=0.158, s2=0.524', 'Node 1: s1=0.158, s2=0.476', 'Node 2: s1=0.158, s2=0.476']...
Round 008: test acc mean=0.6574 ± 0.0064 | min=0.6414 max=0.6694
         : test loss mean=0.6192 ± 0.0052
         : individual accs = ['0.657532', '0.659501', '0.657367', '0.654920', '0.650302', '0.665484', '0.661299', '0.665620', '0.663495', '0.647603', '0.655117', '0.652776', '0.669360', '0.655828', '0.651885', '0.659326', '0.657586', '0.660658', '0.641429', '0.661157']
         : correct/total = [(9358, 14232), (9388, 14235), (9378, 14266), (9311, 14217), (9259, 14238), (9565, 14373), (9487, 14346), (9541, 14334), (9484, 14294), (9308, 14373), (9397, 14344), (9336, 14302), (9608, 14354), (9419, 14362), (9335, 14320), (9491, 14395), (9462, 14389), (9419, 14257), (9141, 14251), (9520, 14399)]
         : compromised: 0.6573, honest: 0.6578
         : ubar stats = ['Node 0: s1=0.158, s2=0.500', 'Node 1: s1=0.158, s2=0.458', 'Node 2: s1=0.158, s2=0.542']...
Round 009: test acc mean=0.6584 ± 0.0080 | min=0.6432 max=0.6709
         : test loss mean=0.6173 ± 0.0059
         : individual accs = ['0.644744', '0.647910', '0.662064', '0.653373', '0.662874', '0.670911', '0.643246', '0.667434', '0.666853', '0.646977', '0.661113', '0.663753', '0.661000', '0.654435', '0.656564', '0.662869', '0.662867', '0.661289', '0.650200', '0.666921']
         : correct/total = [(9176, 14232), (9223, 14235), (9445, 14266), (9289, 14217), (9438, 14238), (9643, 14373), (9228, 14346), (9567, 14334), (9532, 14294), (9299, 14373), (9483, 14344), (9493, 14302), (9488, 14354), (9399, 14362), (9402, 14320), (9542, 14395), (9538, 14389), (9428, 14257), (9266, 14251), (9603, 14399)]
         : compromised: 0.6581, honest: 0.6595
         : ubar stats = ['Node 0: s1=0.158, s2=0.481', 'Node 1: s1=0.158, s2=0.444', 'Node 2: s1=0.158, s2=0.519']...
Round 010: test acc mean=0.6632 ± 0.0045 | min=0.6541 max=0.6705
         : test loss mean=0.6119 ± 0.0037
         : individual accs = ['0.658516', '0.666596', '0.657157', '0.654076', '0.666807', '0.666040', '0.665970', '0.670504', '0.666573', '0.658805', '0.663762', '0.663404', '0.670336', '0.659449', '0.658869', '0.661341', '0.662103', '0.663113', '0.659743', '0.670047']
         : correct/total = [(9372, 14232), (9489, 14235), (9375, 14266), (9299, 14217), (9494, 14238), (9573, 14373), (9554, 14346), (9611, 14334), (9528, 14294), (9469, 14373), (9521, 14344), (9488, 14302), (9622, 14354), (9471, 14362), (9435, 14320), (9520, 14395), (9527, 14389), (9454, 14257), (9402, 14251), (9648, 14399)]
         : compromised: 0.6628, honest: 0.6645
         : ubar stats = ['Node 0: s1=0.158, s2=0.467', 'Node 1: s1=0.158, s2=0.433', 'Node 2: s1=0.158, s2=0.500']...

=== FINAL RESULTS ===
Dataset: sent140, Nodes: 20, Graph: fully, Aggregation: ubar
Attack: directed_deviation, 80.0% compromised
Final accuracy - Compromised: 0.6628, Honest: 0.6645
Overall test accuracy: mean=0.6632 ± 0.0045

=== UBAR SUMMARY ===
Node 0: stage1=0.158, stage2=0.467, overall=0.074
Node 1: stage1=0.158, stage2=0.433, overall=0.068
Node 2: stage1=0.158, stage2=0.500, overall=0.079
Node 3: stage1=0.158, stage2=0.400, overall=0.063
Node 4: stage1=0.158, stage2=0.467, overall=0.074
Node 5: stage1=0.158, stage2=0.500, overall=0.079
Node 6: stage1=0.158, stage2=0.567, overall=0.089
Node 7: stage1=0.158, stage2=0.600, overall=0.095
Node 8: stage1=0.158, stage2=0.500, overall=0.079
Node 9: stage1=0.158, stage2=0.533, overall=0.084
Node 10: stage1=0.158, stage2=0.467, overall=0.074
Node 11: stage1=0.158, stage2=0.733, overall=0.116
Node 12: stage1=0.158, stage2=0.500, overall=0.079
Node 13: stage1=0.158, stage2=0.533, overall=0.084
Node 14: stage1=0.158, stage2=0.600, overall=0.095
Node 15: stage1=0.158, stage2=0.433, overall=0.068
Node 16: stage1=0.158, stage2=0.800, overall=0.126
Node 17: stage1=0.158, stage2=0.500, overall=0.079
Node 18: stage1=0.158, stage2=0.467, overall=0.074
Node 19: stage1=0.158, stage2=0.367, overall=0.058

=== PARALLEL EXECUTION TIME (realistic for distributed system) ===
  COMMUNICATION (max across nodes):
    - Full model transfer: 0.000s (0.0%)
  COMPUTATION (max across nodes):
    - Distance computation: 0.072s (77.5%)
    - Loss computation: 0.016s (17.0%)
    - Aggregation: 0.005s (5.5%)
  TOTALS:
    - Total computation: 0.094s (100.0%)
    - Total communication: 0.000s (0.0%)
    - Total parallel time: 0.094s

=== PER-NODE AVERAGE TIME ===
  - Distance computation: 0.072s
  - Loss computation: 0.014s
  - Aggregation: 0.004s
  - Model transfer: 0.000s
  - Total per node: 0.089s

=== TOTAL COMPUTATIONAL WORK (sum across all nodes) ===
  - Total distance computation: 1.432s
  - Total loss computation: 0.277s
  - Total aggregation: 0.080s
  - Total model transfer: 0.000s
  - Grand total: 1.789s
  - Mean Stage 1 acceptance rate: 0.158
  - Mean Stage 2 acceptance rate: 0.518
  - Overall acceptance rate: 0.082

UBAR Algorithm Properties:
  - Model dimension: 1,174,986
  - Rho parameter: 0.19999999999999996
  - Two-stage approach: Distance filtering + loss evaluation
  - Stage 1 selects: 20% of neighbors
  - Stage 2 uses: Training sample loss comparison
  - Theoretical complexity: O(deg(i)×d + deg(i)×inference)
  - Approach: UBAR paper implementation
