Device: cuda
Seed: 987654321
Loading 1 LEAF Sent140 train files...
LEAF Sent140 train: 254555 users, 908652 samples
Building vocabulary (max_size=10000)...
Vocabulary size: 10000
Loading 1 LEAF Sent140 test files...
LEAF Sent140 test: 254555 users, 286281 samples
Found 254555 train users, 254555 test users, 254555 common users
User sample counts range: 494 (max) to 1 (min)
Distributed ALL 254555 users across 20 clients
Users per client: 12727 (with 15 clients getting +1 user)
Train partition sizes: [44353, 44290, 44657, 44907, 44696, 45843, 45801, 45619, 45069, 45639, 45821, 45311, 45779, 46056, 45625, 45984, 46428, 44737, 45540, 46497]
Test partition sizes: [14232, 14235, 14266, 14217, 14238, 14373, 14346, 14334, 14294, 14373, 14344, 14302, 14354, 14362, 14320, 14395, 14389, 14257, 14251, 14399]
  Client 0: 44353 train samples, 2 unique classes
  Client 1: 44290 train samples, 2 unique classes
  Client 2: 44657 train samples, 2 unique classes
  Client 3: 44907 train samples, 2 unique classes
  Client 4: 44696 train samples, 2 unique classes
  Client 5: 45843 train samples, 2 unique classes
  Client 6: 45801 train samples, 2 unique classes
  Client 7: 45619 train samples, 2 unique classes
  Client 8: 45069 train samples, 2 unique classes
  Client 9: 45639 train samples, 2 unique classes
  Client 10: 45821 train samples, 2 unique classes
  Client 11: 45311 train samples, 2 unique classes
  Client 12: 45779 train samples, 2 unique classes
  Client 13: 46056 train samples, 2 unique classes
  Client 14: 45625 train samples, 2 unique classes
  Client 15: 45984 train samples, 2 unique classes
  Client 16: 46428 train samples, 2 unique classes
  Client 17: 44737 train samples, 2 unique classes
  Client 18: 45540 train samples, 2 unique classes
  Client 19: 46497 train samples, 2 unique classes
Will sample 4500 samples per client per epoch
Graph: ring, nodes: 20, edges: 20
Degree statistics: avg=2.00, min=2, max=2
Attack: Compromised 8/20 nodes: [1, 5, 11, 12, 13, 14, 17, 18]
Attack type: directed_deviation, lambda: 1.0
Model variant: baseline
Model parameters: 1,174,986
BALANCE algorithm:
Balance Config: BALANCEConfig(gamma=2, kappa=1, alpha=0.5, min_neighbors=1)
  - Model dimension: 1,174,986 parameters
  - Complexity: O(N×d) = O(20×1,174,986)
Initial test acc across nodes: mean=0.4965 ± 0.0152
Round 001: test acc mean=0.5121 ± 0.0189 | min=0.4894 max=0.5544
         : test loss mean=1.8350 ± 1.4407
         : individual accs = ['0.489390', '0.553495', '0.515491', '0.554407', '0.504214', '0.509288', '0.509898', '0.526441', '0.518679', '0.540110', '0.500767', '0.518669', '0.497980', '0.500487', '0.493925', '0.502813', '0.489749', '0.521709', '0.501579', '0.493298']
         : correct/total = [(6965, 14232), (7879, 14235), (7354, 14266), (7882, 14217), (7179, 14238), (7320, 14373), (7315, 14346), (7546, 14334), (7414, 14294), (7763, 14373), (7183, 14344), (7418, 14302), (7148, 14354), (7188, 14362), (7073, 14320), (7238, 14395), (7047, 14389), (7438, 14257), (7148, 14251), (7103, 14399)]
         : compromised: 0.5121, honest: 0.5121
Round 002: test acc mean=0.4973 ± 0.0088 | min=0.4762 max=0.5104
         : test loss mean=1.6521 ± 1.0608
         : individual accs = ['0.500000', '0.476150', '0.494813', '0.479778', '0.496278', '0.504070', '0.489893', '0.504604', '0.488597', '0.507688', '0.498048', '0.505244', '0.502717', '0.492550', '0.510405', '0.503856', '0.505873', '0.496177', '0.491194', '0.498646']
         : correct/total = [(7116, 14232), (6778, 14235), (7059, 14266), (6821, 14217), (7066, 14238), (7245, 14373), (7028, 14346), (7233, 14334), (6984, 14294), (7297, 14373), (7144, 14344), (7226, 14302), (7216, 14354), (7074, 14362), (7309, 14320), (7253, 14395), (7279, 14389), (7074, 14257), (7000, 14251), (7180, 14399)]
         : compromised: 0.4973, honest: 0.4973
Round 003: test acc mean=0.5114 ± 0.0098 | min=0.4955 max=0.5340
         : test loss mean=0.9500 ± 0.4452
         : individual accs = ['0.514545', '0.496663', '0.509463', '0.498910', '0.498104', '0.514993', '0.516939', '0.517022', '0.509235', '0.509288', '0.522030', '0.511187', '0.500836', '0.495474', '0.514874', '0.526641', '0.534019', '0.510626', '0.510912', '0.516980']
         : correct/total = [(7323, 14232), (7070, 14235), (7268, 14266), (7093, 14217), (7092, 14238), (7402, 14373), (7416, 14346), (7411, 14334), (7279, 14294), (7320, 14373), (7488, 14344), (7311, 14302), (7189, 14354), (7116, 14362), (7373, 14320), (7581, 14395), (7684, 14389), (7280, 14257), (7281, 14251), (7444, 14399)]
         : compromised: 0.5069, honest: 0.5144
Round 004: test acc mean=0.5334 ± 0.0254 | min=0.4956 max=0.5892
         : test loss mean=0.8898 ± 0.5368
         : individual accs = ['0.524803', '0.516473', '0.555797', '0.548850', '0.554151', '0.535170', '0.559459', '0.570811', '0.514202', '0.567731', '0.589166', '0.508251', '0.502647', '0.505710', '0.520880', '0.535186', '0.533880', '0.514835', '0.495614', '0.515105']
         : correct/total = [(7469, 14232), (7352, 14235), (7929, 14266), (7803, 14217), (7890, 14238), (7692, 14373), (8026, 14346), (8182, 14334), (7350, 14294), (8160, 14373), (8451, 14344), (7269, 14302), (7215, 14354), (7263, 14362), (7459, 14320), (7704, 14395), (7682, 14389), (7340, 14257), (7063, 14251), (7417, 14399)]
         : compromised: 0.5124, honest: 0.5474
Round 005: test acc mean=0.5518 ± 0.0324 | min=0.4947 max=0.6029
         : test loss mean=0.7720 ± 0.2451
         : individual accs = ['0.523609', '0.511697', '0.576896', '0.582964', '0.580419', '0.535379', '0.584483', '0.587903', '0.574437', '0.602866', '0.598996', '0.568312', '0.499930', '0.494708', '0.538617', '0.543522', '0.536590', '0.544013', '0.519893', '0.530384']
         : correct/total = [(7452, 14232), (7284, 14235), (8230, 14266), (8288, 14217), (8264, 14238), (7695, 14373), (8385, 14346), (8427, 14334), (8211, 14294), (8665, 14373), (8592, 14344), (8128, 14302), (7176, 14354), (7105, 14362), (7713, 14320), (7824, 14395), (7721, 14389), (7756, 14257), (7409, 14251), (7637, 14399)]
         : compromised: 0.5266, honest: 0.5686
Round 006: test acc mean=0.5589 ± 0.0366 | min=0.4988 max=0.6077
         : test loss mean=0.8618 ± 0.5355
         : individual accs = ['0.530495', '0.510292', '0.590775', '0.596891', '0.594395', '0.533152', '0.595009', '0.596275', '0.580873', '0.602240', '0.607711', '0.605300', '0.498816', '0.499652', '0.545740', '0.540465', '0.535339', '0.548222', '0.529156', '0.537537']
         : correct/total = [(7550, 14232), (7264, 14235), (8428, 14266), (8486, 14217), (8463, 14238), (7663, 14373), (8536, 14346), (8547, 14334), (8303, 14294), (8656, 14373), (8717, 14344), (8657, 14302), (7160, 14354), (7176, 14362), (7815, 14320), (7780, 14395), (7703, 14389), (7816, 14257), (7541, 14251), (7740, 14399)]
         : compromised: 0.5338, honest: 0.5757
Round 007: test acc mean=0.5686 ± 0.0373 | min=0.4959 max=0.6145
         : test loss mean=0.7059 ± 0.0879
         : individual accs = ['0.531197', '0.530523', '0.596243', '0.605754', '0.600506', '0.585751', '0.601631', '0.603460', '0.596054', '0.609963', '0.614473', '0.611942', '0.501811', '0.495892', '0.553631', '0.551928', '0.546112', '0.558182', '0.534980', '0.541565']
         : correct/total = [(7560, 14232), (7552, 14235), (8506, 14266), (8612, 14217), (8550, 14238), (8419, 14373), (8631, 14346), (8650, 14334), (8520, 14294), (8767, 14373), (8814, 14344), (8752, 14302), (7203, 14354), (7122, 14362), (7928, 14320), (7945, 14395), (7858, 14389), (7958, 14257), (7624, 14251), (7798, 14399)]
         : compromised: 0.5466, honest: 0.5832
Round 008: test acc mean=0.5765 ± 0.0385 | min=0.4988 max=0.6185
         : test loss mean=0.8644 ± 0.5827
         : individual accs = ['0.527544', '0.588620', '0.601921', '0.611029', '0.607670', '0.605371', '0.610135', '0.611623', '0.605429', '0.615460', '0.618516', '0.615858', '0.498816', '0.505640', '0.561941', '0.556513', '0.550768', '0.560076', '0.538278', '0.539690']
         : correct/total = [(7508, 14232), (8379, 14235), (8587, 14266), (8687, 14217), (8652, 14238), (8701, 14373), (8753, 14346), (8767, 14334), (8654, 14294), (8846, 14373), (8872, 14344), (8808, 14302), (7160, 14354), (7262, 14362), (8047, 14320), (8011, 14395), (7925, 14389), (7985, 14257), (7671, 14251), (7771, 14399)]
         : compromised: 0.5593, honest: 0.5880
Round 009: test acc mean=0.5816 ± 0.0415 | min=0.4917 max=0.6226
         : test loss mean=0.7128 ± 0.1527
         : individual accs = ['0.535202', '0.606463', '0.611524', '0.615249', '0.612375', '0.621373', '0.618151', '0.617901', '0.613334', '0.616712', '0.621305', '0.622570', '0.506340', '0.491714', '0.560684', '0.562070', '0.556050', '0.560076', '0.539401', '0.543024']
         : correct/total = [(7617, 14232), (8633, 14235), (8724, 14266), (8747, 14217), (8719, 14238), (8931, 14373), (8868, 14346), (8857, 14334), (8767, 14294), (8864, 14373), (8912, 14344), (8904, 14302), (7268, 14354), (7062, 14362), (8029, 14320), (8091, 14395), (8001, 14389), (7985, 14257), (7687, 14251), (7819, 14399)]
         : compromised: 0.5636, honest: 0.5936
Round 010: test acc mean=0.5850 ± 0.0435 | min=0.4934 max=0.6268
         : test loss mean=0.8439 ± 0.5391
         : individual accs = ['0.537240', '0.620091', '0.617763', '0.616164', '0.616519', '0.626035', '0.620800', '0.620692', '0.621170', '0.623252', '0.626813', '0.625926', '0.493382', '0.505988', '0.564804', '0.561306', '0.551602', '0.567651', '0.538769', '0.543718']
         : correct/total = [(7646, 14232), (8827, 14235), (8813, 14266), (8760, 14217), (8778, 14238), (8998, 14373), (8906, 14346), (8897, 14334), (8879, 14294), (8958, 14373), (8991, 14344), (8952, 14302), (7082, 14354), (7267, 14362), (8088, 14320), (8080, 14395), (7937, 14389), (8093, 14257), (7678, 14251), (7829, 14399)]
         : compromised: 0.5678, honest: 0.5964

=== FINAL RESULTS ===
Dataset: sent140, Nodes: 20, Graph: ring, Aggregation: balance
Attack: directed_deviation, 40.0% compromised
Final accuracy - Compromised: 0.5678, Honest: 0.5964
Overall test accuracy: mean=0.5850 ± 0.0435

=== BALANCE SUMMARY ===
Node 0: acceptance=0.600
Node 1: acceptance=0.750
Node 2: acceptance=0.600
Node 3: acceptance=1.000
Node 4: acceptance=0.600
Node 5: acceptance=0.800
Node 6: acceptance=0.600
Node 7: acceptance=1.000
Node 8: acceptance=1.000
Node 9: acceptance=1.000
Node 10: acceptance=0.600
Node 11: acceptance=0.600
Node 12: acceptance=0.200
Node 13: acceptance=0.200
Node 14: acceptance=0.600
Node 15: acceptance=0.600
Node 16: acceptance=0.600
Node 17: acceptance=0.600
Node 18: acceptance=0.600
Node 19: acceptance=0.600

=== PARALLEL EXECUTION TIME (realistic for distributed system) ===
  COMMUNICATION (max across nodes):
    - Full model transfer: 0.000s (0.0%)
  COMPUTATION (max across nodes):
    - Filtering: 0.015s (58.2%)
    - Aggregation: 0.010s (41.8%)
  TOTALS:
    - Total computation: 0.025s (100.0%)
    - Total communication: 0.000s (0.0%)
    - Total parallel time: 0.025s

=== PER-NODE AVERAGE TIME ===
  - Filtering: 0.012s
  - Aggregation: 0.005s
  - Model transfer: 0.000s
  - Total per node: 0.017s

=== TOTAL COMPUTATIONAL WORK (sum across all nodes) ===
  - Total filtering: 0.244s
  - Total aggregation: 0.098s
  - Total model transfer: 0.000s
  - Grand total: 0.342s
  - Mean acceptance rate: 0.657

BALANCE Algorithm Properties:
  - Model dimension: 1,174,986
  - No compression: Full parameter comparison
  - Theoretical complexity: O(deg(i)×d)
  - Approach: Full parameter filtering + averaging
