Device: cuda
Seed: 987654321
Loading 1 LEAF Sent140 train files...
LEAF Sent140 train: 254555 users, 908652 samples
Building vocabulary (max_size=10000)...
Vocabulary size: 10000
Loading 1 LEAF Sent140 test files...
LEAF Sent140 test: 254555 users, 286281 samples
Found 254555 train users, 254555 test users, 254555 common users
User sample counts range: 494 (max) to 1 (min)
Distributed ALL 254555 users across 20 clients
Users per client: 12727 (with 15 clients getting +1 user)
Train partition sizes: [44353, 44290, 44657, 44907, 44696, 45843, 45801, 45619, 45069, 45639, 45821, 45311, 45779, 46056, 45625, 45984, 46428, 44737, 45540, 46497]
Test partition sizes: [14232, 14235, 14266, 14217, 14238, 14373, 14346, 14334, 14294, 14373, 14344, 14302, 14354, 14362, 14320, 14395, 14389, 14257, 14251, 14399]
  Client 0: 44353 train samples, 2 unique classes
  Client 1: 44290 train samples, 2 unique classes
  Client 2: 44657 train samples, 2 unique classes
  Client 3: 44907 train samples, 2 unique classes
  Client 4: 44696 train samples, 2 unique classes
  Client 5: 45843 train samples, 2 unique classes
  Client 6: 45801 train samples, 2 unique classes
  Client 7: 45619 train samples, 2 unique classes
  Client 8: 45069 train samples, 2 unique classes
  Client 9: 45639 train samples, 2 unique classes
  Client 10: 45821 train samples, 2 unique classes
  Client 11: 45311 train samples, 2 unique classes
  Client 12: 45779 train samples, 2 unique classes
  Client 13: 46056 train samples, 2 unique classes
  Client 14: 45625 train samples, 2 unique classes
  Client 15: 45984 train samples, 2 unique classes
  Client 16: 46428 train samples, 2 unique classes
  Client 17: 44737 train samples, 2 unique classes
  Client 18: 45540 train samples, 2 unique classes
  Client 19: 46497 train samples, 2 unique classes
Will sample 4500 samples per client per epoch
Graph: erdos, nodes: 20, edges: 99
Degree statistics: avg=9.90, min=7, max=14
Attack: Compromised 16/20 nodes: [1, 2, 3, 5, 6, 8, 9, 10, 11, 12, 13, 14, 15, 17, 18, 19]
Attack type: directed_deviation, lambda: 1.0
Model variant: baseline
Model parameters: 1,174,986
Initial test acc across nodes: mean=0.4965 ± 0.0152
Round 001: test acc mean=0.4977 ± 0.0064 | min=0.4820 max=0.5113
         : test loss mean=14.2009 ± 5.5352
         : individual accs = ['0.507448', '0.501651', '0.501262', '0.496096', '0.489816', '0.492869', '0.500627', '0.496582', '0.511333', '0.495095', '0.500837', '0.493427', '0.500209', '0.482036', '0.497905', '0.488156', '0.499826', '0.497650', '0.499404', '0.502257']
         : correct/total = [(7222, 14232), (7141, 14235), (7151, 14266), (7053, 14217), (6974, 14238), (7084, 14373), (7182, 14346), (7118, 14334), (7309, 14294), (7116, 14373), (7184, 14344), (7057, 14302), (7180, 14354), (6923, 14362), (7130, 14320), (7027, 14395), (7192, 14389), (7095, 14257), (7117, 14251), (7232, 14399)]
         : compromised: 0.4976, honest: 0.4984
Round 002: test acc mean=0.5045 ± 0.0067 | min=0.4868 max=0.5173
         : test loss mean=17.5211 ± 5.3610
         : individual accs = ['0.502881', '0.517316', '0.513318', '0.515088', '0.506743', '0.504070', '0.498118', '0.503767', '0.496782', '0.509219', '0.505577', '0.501608', '0.502438', '0.486840', '0.505726', '0.503369', '0.500730', '0.499193', '0.511122', '0.505382']
         : correct/total = [(7157, 14232), (7364, 14235), (7323, 14266), (7323, 14217), (7215, 14238), (7245, 14373), (7146, 14346), (7221, 14334), (7101, 14294), (7319, 14373), (7252, 14344), (7174, 14302), (7212, 14354), (6992, 14362), (7242, 14320), (7246, 14395), (7205, 14389), (7117, 14257), (7284, 14251), (7277, 14399)]
         : compromised: 0.5047, honest: 0.5035
Round 003: test acc mean=0.4962 ± 0.0080 | min=0.4817 max=0.5115
         : test loss mean=3.1463 ± 1.2559
         : individual accs = ['0.490093', '0.485915', '0.483738', '0.494408', '0.487288', '0.505462', '0.493866', '0.499163', '0.481671', '0.492869', '0.511503', '0.491330', '0.499025', '0.507102', '0.497137', '0.505314', '0.493641', '0.502490', '0.500386', '0.502535']
         : correct/total = [(6975, 14232), (6917, 14235), (6901, 14266), (7029, 14217), (6938, 14238), (7265, 14373), (7085, 14346), (7155, 14334), (6885, 14294), (7084, 14373), (7337, 14344), (7027, 14302), (7163, 14354), (7283, 14362), (7119, 14320), (7274, 14395), (7103, 14389), (7164, 14257), (7131, 14251), (7236, 14399)]
         : compromised: 0.4972, honest: 0.4925
Round 004: test acc mean=0.5030 ± 0.0084 | min=0.4860 max=0.5162
         : test loss mean=8.5142 ± 4.0708
         : individual accs = ['0.512929', '0.500667', '0.508412', '0.505451', '0.512502', '0.506784', '0.502579', '0.495465', '0.514342', '0.497530', '0.497769', '0.500699', '0.499025', '0.487606', '0.508939', '0.501841', '0.516228', '0.486007', '0.511754', '0.493784']
         : correct/total = [(7300, 14232), (7127, 14235), (7253, 14266), (7186, 14217), (7297, 14238), (7284, 14373), (7210, 14346), (7102, 14334), (7352, 14294), (7151, 14373), (7140, 14344), (7161, 14302), (7163, 14354), (7003, 14362), (7288, 14320), (7224, 14395), (7428, 14389), (6929, 14257), (7293, 14251), (7110, 14399)]
         : compromised: 0.5014, honest: 0.5093
Round 005: test acc mean=0.4965 ± 0.0062 | min=0.4869 max=0.5092
         : test loss mean=3.0074 ± 1.4055
         : individual accs = ['0.491709', '0.487250', '0.500421', '0.494619', '0.486936', '0.495443', '0.501255', '0.500558', '0.500000', '0.490086', '0.497630', '0.494406', '0.496377', '0.509191', '0.495740', '0.500868', '0.508583', '0.501017', '0.489650', '0.488298']
         : correct/total = [(6998, 14232), (6936, 14235), (7139, 14266), (7032, 14217), (6933, 14238), (7121, 14373), (7191, 14346), (7175, 14334), (7147, 14294), (7044, 14373), (7138, 14344), (7071, 14302), (7125, 14354), (7313, 14362), (7099, 14320), (7210, 14395), (7318, 14389), (7143, 14257), (6978, 14251), (7031, 14399)]
         : compromised: 0.4964, honest: 0.4969
Round 006: test acc mean=0.5045 ± 0.0066 | min=0.4868 max=0.5141
         : test loss mean=7.0517 ± 4.2262
         : individual accs = ['0.514053', '0.505304', '0.510725', '0.507421', '0.512221', '0.496695', '0.504879', '0.508511', '0.511403', '0.502818', '0.506762', '0.500629', '0.494845', '0.486840', '0.507402', '0.502397', '0.505178', '0.505787', '0.509438', '0.495798']
         : correct/total = [(7316, 14232), (7193, 14235), (7286, 14266), (7214, 14217), (7293, 14238), (7139, 14373), (7243, 14346), (7289, 14334), (7310, 14294), (7227, 14373), (7269, 14344), (7160, 14302), (7103, 14354), (6992, 14362), (7266, 14320), (7232, 14395), (7269, 14389), (7211, 14257), (7260, 14251), (7139, 14399)]
         : compromised: 0.5031, honest: 0.5100
Round 007: test acc mean=0.5017 ± 0.0067 | min=0.4893 max=0.5136
         : test loss mean=2.2708 ± 0.6247
         : individual accs = ['0.492552', '0.492378', '0.507500', '0.496026', '0.493890', '0.505879', '0.502300', '0.504883', '0.500770', '0.499409', '0.508226', '0.513565', '0.495054', '0.505570', '0.507821', '0.489267', '0.497880', '0.501789', '0.508105', '0.510383']
         : correct/total = [(7010, 14232), (7009, 14235), (7240, 14266), (7052, 14217), (7032, 14238), (7271, 14373), (7206, 14346), (7237, 14334), (7158, 14294), (7178, 14373), (7290, 14344), (7345, 14302), (7106, 14354), (7261, 14362), (7272, 14320), (7043, 14395), (7164, 14389), (7154, 14257), (7241, 14251), (7349, 14399)]
         : compromised: 0.5028, honest: 0.4973
Round 008: test acc mean=0.4995 ± 0.0030 | min=0.4910 max=0.5060
         : test loss mean=4.3018 ± 1.7847
         : individual accs = ['0.499016', '0.498981', '0.502173', '0.498277', '0.491010', '0.497669', '0.500139', '0.503070', '0.498111', '0.502679', '0.501325', '0.496993', '0.501533', '0.496658', '0.499860', '0.500868', '0.499340', '0.505997', '0.500526', '0.496701']
         : correct/total = [(7102, 14232), (7103, 14235), (7164, 14266), (7084, 14217), (6991, 14238), (7153, 14373), (7175, 14346), (7211, 14334), (7120, 14294), (7225, 14373), (7191, 14344), (7108, 14302), (7199, 14354), (7133, 14362), (7158, 14320), (7210, 14395), (7185, 14389), (7214, 14257), (7133, 14251), (7152, 14399)]
         : compromised: 0.4999, honest: 0.4981
Round 009: test acc mean=0.5044 ± 0.0071 | min=0.4872 max=0.5130
         : test loss mean=1.7894 ± 0.5112
         : individual accs = ['0.512577', '0.487179', '0.507781', '0.492861', '0.501405', '0.499617', '0.495748', '0.510604', '0.500070', '0.504001', '0.497769', '0.511956', '0.506827', '0.506545', '0.511802', '0.510247', '0.513031', '0.507891', '0.499333', '0.510313']
         : correct/total = [(7295, 14232), (6935, 14235), (7244, 14266), (7007, 14217), (7139, 14238), (7181, 14373), (7112, 14346), (7319, 14334), (7148, 14294), (7244, 14373), (7140, 14344), (7322, 14302), (7275, 14354), (7275, 14362), (7329, 14320), (7345, 14395), (7382, 14389), (7241, 14257), (7116, 14251), (7348, 14399)]
         : compromised: 0.5031, honest: 0.5094
Round 010: test acc mean=0.5033 ± 0.0052 | min=0.4912 max=0.5124
         : test loss mean=2.8804 ± 1.4522
         : individual accs = ['0.500773', '0.512399', '0.508902', '0.499332', '0.499017', '0.507271', '0.503904', '0.500209', '0.504757', '0.505670', '0.499721', '0.500839', '0.507524', '0.491227', '0.507332', '0.502327', '0.505247', '0.494774', '0.512034', '0.502049']
         : correct/total = [(7127, 14232), (7294, 14235), (7260, 14266), (7099, 14217), (7105, 14238), (7291, 14373), (7229, 14346), (7170, 14334), (7215, 14294), (7268, 14373), (7168, 14344), (7163, 14302), (7285, 14354), (7055, 14362), (7265, 14320), (7231, 14395), (7270, 14389), (7054, 14257), (7297, 14251), (7229, 14399)]
         : compromised: 0.5038, honest: 0.5013

=== FINAL RESULTS ===
Dataset: sent140, Nodes: 20, Graph: erdos, Aggregation: krum
Attack: directed_deviation, 80.0% compromised
Final accuracy - Compromised: 0.5038, Honest: 0.5013
Overall test accuracy: mean=0.5033 ± 0.0052
