Device: cuda
Seed: 987654321
Loading 1 LEAF Sent140 train files...
LEAF Sent140 train: 254555 users, 908652 samples
Building vocabulary (max_size=10000)...
Vocabulary size: 10000
Loading 1 LEAF Sent140 test files...
LEAF Sent140 test: 254555 users, 286281 samples
Found 254555 train users, 254555 test users, 254555 common users
User sample counts range: 494 (max) to 1 (min)
Distributed ALL 254555 users across 20 clients
Users per client: 12727 (with 15 clients getting +1 user)
Train partition sizes: [44353, 44290, 44657, 44907, 44696, 45843, 45801, 45619, 45069, 45639, 45821, 45311, 45779, 46056, 45625, 45984, 46428, 44737, 45540, 46497]
Test partition sizes: [14232, 14235, 14266, 14217, 14238, 14373, 14346, 14334, 14294, 14373, 14344, 14302, 14354, 14362, 14320, 14395, 14389, 14257, 14251, 14399]
  Client 0: 44353 train samples, 2 unique classes
  Client 1: 44290 train samples, 2 unique classes
  Client 2: 44657 train samples, 2 unique classes
  Client 3: 44907 train samples, 2 unique classes
  Client 4: 44696 train samples, 2 unique classes
  Client 5: 45843 train samples, 2 unique classes
  Client 6: 45801 train samples, 2 unique classes
  Client 7: 45619 train samples, 2 unique classes
  Client 8: 45069 train samples, 2 unique classes
  Client 9: 45639 train samples, 2 unique classes
  Client 10: 45821 train samples, 2 unique classes
  Client 11: 45311 train samples, 2 unique classes
  Client 12: 45779 train samples, 2 unique classes
  Client 13: 46056 train samples, 2 unique classes
  Client 14: 45625 train samples, 2 unique classes
  Client 15: 45984 train samples, 2 unique classes
  Client 16: 46428 train samples, 2 unique classes
  Client 17: 44737 train samples, 2 unique classes
  Client 18: 45540 train samples, 2 unique classes
  Client 19: 46497 train samples, 2 unique classes
Will sample 4500 samples per client per epoch
Graph: erdos, nodes: 20, edges: 99
Degree statistics: avg=9.90, min=7, max=14
Model variant: baseline
Model parameters: 1,174,986
BALANCE algorithm:
Balance Config: BALANCEConfig(gamma=2, kappa=1, alpha=0.5, min_neighbors=1)
  - Model dimension: 1,174,986 parameters
  - Complexity: O(N×d) = O(20×1,174,986)
Initial test acc across nodes: mean=0.4953 ± 0.0174
Round 001: test acc mean=0.5665 ± 0.0381 | min=0.5059 max=0.6288
         : test loss mean=0.6898 ± 0.0006
         : individual accs = ['0.548553', '0.587004', '0.517314', '0.505944', '0.606124', '0.565922', '0.628816', '0.618948', '0.572478', '0.554373', '0.522518', '0.567543', '0.612791', '0.554519', '0.516550', '0.575755', '0.523247', '0.602160', '0.532173', '0.618098']
         : correct/total = [(7807, 14232), (8356, 14235), (7380, 14266), (7193, 14217), (8630, 14238), (8134, 14373), (9021, 14346), (8872, 14334), (8183, 14294), (7968, 14373), (7495, 14344), (8117, 14302), (8796, 14354), (7964, 14362), (7397, 14320), (8288, 14395), (7529, 14389), (8585, 14257), (7584, 14251), (8900, 14399)]
Round 002: test acc mean=0.5748 ± 0.0466 | min=0.4925 max=0.6323
         : test loss mean=0.6901 ± 0.0007
         : individual accs = ['0.616358', '0.629926', '0.589093', '0.590139', '0.569322', '0.557991', '0.518821', '0.632273', '0.606548', '0.610172', '0.524122', '0.592225', '0.502856', '0.624426', '0.492528', '0.570198', '0.528390', '0.620467', '0.620869', '0.500104']
         : correct/total = [(8772, 14232), (8967, 14235), (8404, 14266), (8390, 14217), (8106, 14238), (8020, 14373), (7443, 14346), (9063, 14334), (8670, 14294), (8770, 14373), (7518, 14344), (8470, 14302), (7218, 14354), (8968, 14362), (7053, 14320), (8208, 14395), (7603, 14389), (8846, 14257), (8848, 14251), (7201, 14399)]
Round 003: test acc mean=0.5327 ± 0.0379 | min=0.4934 max=0.5951
         : test loss mean=0.6900 ± 0.0008
         : individual accs = ['0.553963', '0.524763', '0.587971', '0.512133', '0.590603', '0.587143', '0.499791', '0.493442', '0.507556', '0.515341', '0.498397', '0.568871', '0.502926', '0.526250', '0.496439', '0.497881', '0.506985', '0.595076', '0.589924', '0.499340']
         : correct/total = [(7884, 14232), (7470, 14235), (8388, 14266), (7281, 14217), (8409, 14238), (8439, 14373), (7170, 14346), (7073, 14334), (7255, 14294), (7407, 14373), (7149, 14344), (8136, 14302), (7219, 14354), (7558, 14362), (7109, 14320), (7167, 14395), (7295, 14389), (8484, 14257), (8407, 14251), (7190, 14399)]
Round 004: test acc mean=0.5542 ± 0.0456 | min=0.4921 max=0.6300
         : test loss mean=0.6882 ± 0.0015
         : individual accs = ['0.552277', '0.629996', '0.492079', '0.508054', '0.506181', '0.626244', '0.551443', '0.506767', '0.581713', '0.604954', '0.498397', '0.560761', '0.503205', '0.605556', '0.503142', '0.526016', '0.585239', '0.558533', '0.615536', '0.567331']
         : correct/total = [(7860, 14232), (8968, 14235), (7020, 14266), (7223, 14217), (7207, 14238), (9001, 14373), (7911, 14346), (7264, 14334), (8315, 14294), (8695, 14373), (7149, 14344), (8020, 14302), (7223, 14354), (8697, 14362), (7205, 14320), (7572, 14395), (8421, 14389), (7963, 14257), (8772, 14251), (8169, 14399)]
Round 005: test acc mean=0.5906 ± 0.0336 | min=0.5179 max=0.6392
         : test loss mean=0.6829 ± 0.0026
         : individual accs = ['0.622470', '0.629645', '0.620286', '0.567068', '0.639205', '0.599388', '0.535759', '0.635552', '0.578634', '0.574897', '0.580312', '0.604811', '0.517904', '0.602005', '0.573394', '0.530045', '0.583640', '0.609665', '0.590625', '0.616987']
         : correct/total = [(8859, 14232), (8963, 14235), (8849, 14266), (8062, 14217), (9101, 14238), (8615, 14373), (7686, 14346), (9110, 14334), (8271, 14294), (8263, 14373), (8324, 14344), (8650, 14302), (7434, 14354), (8646, 14362), (8211, 14320), (7630, 14395), (8398, 14389), (8692, 14257), (8417, 14251), (8884, 14399)]
Round 006: test acc mean=0.6318 ± 0.0133 | min=0.5834 max=0.6458
         : test loss mean=0.6664 ± 0.0042
         : individual accs = ['0.635399', '0.640885', '0.631712', '0.633115', '0.623753', '0.639393', '0.620940', '0.642738', '0.641178', '0.633479', '0.616146', '0.583415', '0.638498', '0.630762', '0.639804', '0.633970', '0.645841', '0.633233', '0.632166', '0.639767']
         : correct/total = [(9043, 14232), (9123, 14235), (9012, 14266), (9001, 14217), (8881, 14238), (9190, 14373), (8908, 14346), (9213, 14334), (9165, 14294), (9105, 14373), (8838, 14344), (8344, 14302), (9165, 14354), (9059, 14362), (9162, 14320), (9126, 14395), (9293, 14389), (9028, 14257), (9009, 14251), (9212, 14399)]
Round 007: test acc mean=0.6324 ± 0.0160 | min=0.5926 max=0.6477
         : test loss mean=0.6485 ± 0.0067
         : individual accs = ['0.639826', '0.644468', '0.633114', '0.635014', '0.647703', '0.646212', '0.634323', '0.607158', '0.647055', '0.640785', '0.627091', '0.604671', '0.644629', '0.592605', '0.643925', '0.614380', '0.641045', '0.642491', '0.616518', '0.645253']
         : correct/total = [(9106, 14232), (9174, 14235), (9032, 14266), (9028, 14217), (9222, 14238), (9288, 14373), (9100, 14346), (8703, 14334), (9249, 14294), (9210, 14373), (8995, 14344), (8648, 14302), (9253, 14354), (8511, 14362), (9221, 14320), (8844, 14395), (9224, 14389), (9160, 14257), (8786, 14251), (9291, 14399)]
Round 008: test acc mean=0.6462 ± 0.0066 | min=0.6327 max=0.6558
         : test loss mean=0.6345 ± 0.0047
         : individual accs = ['0.645447', '0.632666', '0.636408', '0.655061', '0.645526', '0.647186', '0.651401', '0.644063', '0.655170', '0.650108', '0.649679', '0.655782', '0.643235', '0.637168', '0.646159', '0.648003', '0.647717', '0.640598', '0.637639', '0.655115']
         : correct/total = [(9186, 14232), (9006, 14235), (9079, 14266), (9313, 14217), (9191, 14238), (9302, 14373), (9345, 14346), (9232, 14334), (9365, 14294), (9344, 14373), (9319, 14344), (9379, 14302), (9233, 14354), (9151, 14362), (9253, 14320), (9328, 14395), (9320, 14389), (9133, 14257), (9087, 14251), (9433, 14399)]
Round 009: test acc mean=0.6550 ± 0.0094 | min=0.6195 max=0.6643
         : test loss mean=0.6264 ± 0.0064
         : individual accs = ['0.619519', '0.661117', '0.652460', '0.659422', '0.653884', '0.659640', '0.656978', '0.664295', '0.658318', '0.650734', '0.644451', '0.657111', '0.659955', '0.654783', '0.659358', '0.652449', '0.664118', '0.656239', '0.652866', '0.662129']
         : correct/total = [(8817, 14232), (9411, 14235), (9308, 14266), (9375, 14217), (9310, 14238), (9481, 14373), (9425, 14346), (9522, 14334), (9410, 14294), (9353, 14373), (9244, 14344), (9398, 14302), (9473, 14354), (9404, 14362), (9442, 14320), (9392, 14395), (9556, 14389), (9356, 14257), (9304, 14251), (9534, 14399)]
Round 010: test acc mean=0.6629 ± 0.0075 | min=0.6397 max=0.6731
         : test loss mean=0.6183 ± 0.0063
         : individual accs = ['0.660764', '0.667580', '0.639703', '0.668636', '0.670038', '0.667362', '0.668200', '0.673085', '0.664684', '0.656022', '0.663413', '0.665571', '0.671520', '0.660145', '0.665642', '0.659326', '0.667385', '0.657502', '0.655042', '0.656157']
         : correct/total = [(9404, 14232), (9503, 14235), (9126, 14266), (9506, 14217), (9540, 14238), (9592, 14373), (9586, 14346), (9648, 14334), (9501, 14294), (9429, 14373), (9516, 14344), (9519, 14302), (9639, 14354), (9481, 14362), (9532, 14320), (9491, 14395), (9603, 14389), (9374, 14257), (9335, 14251), (9448, 14399)]

=== FINAL RESULTS ===
Dataset: sent140, Nodes: 20, Graph: erdos, Aggregation: balance
Overall test accuracy: mean=0.6629 ± 0.0075

=== BALANCE SUMMARY ===
Node 0: acceptance=1.000
Node 1: acceptance=1.000
Node 2: acceptance=1.000
Node 3: acceptance=1.000
Node 4: acceptance=1.000
Node 5: acceptance=1.000
Node 6: acceptance=1.000
Node 7: acceptance=1.000
Node 8: acceptance=1.000
Node 9: acceptance=1.000
Node 10: acceptance=1.000
Node 11: acceptance=1.000
Node 12: acceptance=1.000
Node 13: acceptance=1.000
Node 14: acceptance=1.000
Node 15: acceptance=1.000
Node 16: acceptance=1.000
Node 17: acceptance=1.000
Node 18: acceptance=1.000
Node 19: acceptance=1.000

=== PARALLEL EXECUTION TIME (realistic for distributed system) ===
  COMMUNICATION (max across nodes):
    - Full model transfer: 0.000s (0.0%)
  COMPUTATION (max across nodes):
    - Filtering: 0.062s (79.1%)
    - Aggregation: 0.016s (20.9%)
  TOTALS:
    - Total computation: 0.079s (100.0%)
    - Total communication: 0.000s (0.0%)
    - Total parallel time: 0.079s

=== PER-NODE AVERAGE TIME ===
  - Filtering: 0.041s
  - Aggregation: 0.010s
  - Model transfer: 0.000s
  - Total per node: 0.050s

=== TOTAL COMPUTATIONAL WORK (sum across all nodes) ===
  - Total filtering: 0.813s
  - Total aggregation: 0.192s
  - Total model transfer: 0.000s
  - Grand total: 1.006s
  - Mean acceptance rate: 1.000

BALANCE Algorithm Properties:
  - Model dimension: 1,174,986
  - No compression: Full parameter comparison
  - Theoretical complexity: O(deg(i)×d)
  - Approach: Full parameter filtering + averaging
