Device: cuda
Seed: 987654321
Loading 1 LEAF Sent140 train files...
LEAF Sent140 train: 254555 users, 908652 samples
Building vocabulary (max_size=10000)...
Vocabulary size: 10000
Loading 1 LEAF Sent140 test files...
LEAF Sent140 test: 254555 users, 286281 samples
Found 254555 train users, 254555 test users, 254555 common users
User sample counts range: 494 (max) to 1 (min)
Distributed ALL 254555 users across 20 clients
Users per client: 12727 (with 15 clients getting +1 user)
Train partition sizes: [44353, 44290, 44657, 44907, 44696, 45843, 45801, 45619, 45069, 45639, 45821, 45311, 45779, 46056, 45625, 45984, 46428, 44737, 45540, 46497]
Test partition sizes: [14232, 14235, 14266, 14217, 14238, 14373, 14346, 14334, 14294, 14373, 14344, 14302, 14354, 14362, 14320, 14395, 14389, 14257, 14251, 14399]
  Client 0: 44353 train samples, 2 unique classes
  Client 1: 44290 train samples, 2 unique classes
  Client 2: 44657 train samples, 2 unique classes
  Client 3: 44907 train samples, 2 unique classes
  Client 4: 44696 train samples, 2 unique classes
  Client 5: 45843 train samples, 2 unique classes
  Client 6: 45801 train samples, 2 unique classes
  Client 7: 45619 train samples, 2 unique classes
  Client 8: 45069 train samples, 2 unique classes
  Client 9: 45639 train samples, 2 unique classes
  Client 10: 45821 train samples, 2 unique classes
  Client 11: 45311 train samples, 2 unique classes
  Client 12: 45779 train samples, 2 unique classes
  Client 13: 46056 train samples, 2 unique classes
  Client 14: 45625 train samples, 2 unique classes
  Client 15: 45984 train samples, 2 unique classes
  Client 16: 46428 train samples, 2 unique classes
  Client 17: 44737 train samples, 2 unique classes
  Client 18: 45540 train samples, 2 unique classes
  Client 19: 46497 train samples, 2 unique classes
Will sample 4500 samples per client per epoch
Graph: erdos, nodes: 20, edges: 126
Degree statistics: avg=12.60, min=8, max=16
Attack: Compromised 4/20 nodes: [5, 12, 13, 17]
Attack type: directed_deviation, lambda: 1.0
Model variant: baseline
Model parameters: 1,174,986
Initial test acc across nodes: mean=0.4965 ± 0.0152
Round 001: test acc mean=0.5002 ± 0.0093 | min=0.4830 max=0.5225
         : test loss mean=1.2609 ± 0.7120
         : individual accs = ['0.501967', '0.508395', '0.522501', '0.508476', '0.492415', '0.494051', '0.503346', '0.510604', '0.487407', '0.493008', '0.505438', '0.493987', '0.496099', '0.483011', '0.499930', '0.495797', '0.500104', '0.495616', '0.514911', '0.496701']
         : correct/total = [(7144, 14232), (7237, 14235), (7454, 14266), (7229, 14217), (7011, 14238), (7101, 14373), (7221, 14346), (7319, 14334), (6967, 14294), (7086, 14373), (7250, 14344), (7065, 14302), (7121, 14354), (6937, 14362), (7159, 14320), (7137, 14395), (7196, 14389), (7066, 14257), (7338, 14251), (7152, 14399)]
         : compromised: 0.4922, honest: 0.5022
Round 002: test acc mean=0.5096 ± 0.0078 | min=0.4898 max=0.5228
         : test loss mean=1.1171 ± 0.3802
         : individual accs = ['0.508642', '0.510573', '0.522781', '0.489836', '0.502037', '0.509080', '0.517566', '0.521836', '0.510494', '0.509706', '0.511991', '0.518039', '0.509544', '0.508564', '0.510894', '0.496700', '0.508583', '0.501789', '0.517157', '0.506632']
         : correct/total = [(7239, 14232), (7268, 14235), (7458, 14266), (6964, 14217), (7148, 14238), (7317, 14373), (7425, 14346), (7480, 14334), (7297, 14294), (7326, 14373), (7344, 14344), (7409, 14302), (7314, 14354), (7304, 14362), (7316, 14320), (7150, 14395), (7318, 14389), (7154, 14257), (7370, 14251), (7295, 14399)]
         : compromised: 0.5072, honest: 0.5102
Round 003: test acc mean=0.4973 ± 0.0172 | min=0.4562 max=0.5252
         : test loss mean=0.6962 ± 0.0044
         : individual accs = ['0.511313', '0.513664', '0.514300', '0.507421', '0.506110', '0.472205', '0.488777', '0.504535', '0.493704', '0.525221', '0.476157', '0.508041', '0.506688', '0.490879', '0.456215', '0.501841', '0.468205', '0.497089', '0.511333', '0.492465']
         : correct/total = [(7277, 14232), (7312, 14235), (7337, 14266), (7214, 14217), (7206, 14238), (6787, 14373), (7012, 14346), (7232, 14334), (7057, 14294), (7549, 14373), (6830, 14344), (7266, 14302), (7273, 14354), (7050, 14362), (6533, 14320), (7224, 14395), (6737, 14389), (7087, 14257), (7287, 14251), (7091, 14399)]
         : compromised: 0.4917, honest: 0.4987
Round 004: test acc mean=0.5290 ± 0.0068 | min=0.5185 max=0.5419
         : test loss mean=0.7654 ± 0.1137
         : individual accs = ['0.537099', '0.534387', '0.537081', '0.526342', '0.534064', '0.524316', '0.526349', '0.537254', '0.524486', '0.525499', '0.518544', '0.523144', '0.519298', '0.532934', '0.527514', '0.531504', '0.523177', '0.536719', '0.541857', '0.519411']
         : correct/total = [(7644, 14232), (7607, 14235), (7662, 14266), (7483, 14217), (7604, 14238), (7536, 14373), (7551, 14346), (7701, 14334), (7497, 14294), (7553, 14373), (7438, 14344), (7482, 14302), (7454, 14354), (7654, 14362), (7554, 14320), (7651, 14395), (7528, 14389), (7652, 14257), (7722, 14251), (7479, 14399)]
         : compromised: 0.5283, honest: 0.5292
Round 005: test acc mean=0.5080 ± 0.0127 | min=0.4914 max=0.5406
         : test loss mean=0.6952 ± 0.0043
         : individual accs = ['0.507870', '0.513804', '0.515982', '0.540620', '0.522194', '0.502331', '0.505019', '0.502302', '0.504128', '0.530369', '0.498536', '0.503146', '0.500418', '0.491436', '0.494344', '0.501424', '0.494475', '0.526338', '0.505719', '0.498715']
         : correct/total = [(7228, 14232), (7314, 14235), (7361, 14266), (7686, 14217), (7435, 14238), (7220, 14373), (7245, 14346), (7200, 14334), (7206, 14294), (7623, 14373), (7151, 14344), (7196, 14302), (7183, 14354), (7058, 14362), (7079, 14320), (7218, 14395), (7115, 14389), (7504, 14257), (7207, 14251), (7181, 14399)]
         : compromised: 0.5051, honest: 0.5087
Round 006: test acc mean=0.5434 ± 0.0070 | min=0.5318 max=0.5585
         : test loss mean=0.7201 ± 0.0577
         : individual accs = ['0.545531', '0.541693', '0.532455', '0.549413', '0.558505', '0.547137', '0.535411', '0.556509', '0.541766', '0.542823', '0.534718', '0.539575', '0.534764', '0.531820', '0.544553', '0.547968', '0.544305', '0.545697', '0.546558', '0.546496']
         : correct/total = [(7764, 14232), (7711, 14235), (7596, 14266), (7811, 14217), (7952, 14238), (7864, 14373), (7681, 14346), (7977, 14334), (7744, 14294), (7802, 14373), (7670, 14344), (7717, 14302), (7676, 14354), (7638, 14362), (7798, 14320), (7888, 14395), (7832, 14389), (7780, 14257), (7789, 14251), (7869, 14399)]
         : compromised: 0.5399, honest: 0.5443
Round 007: test acc mean=0.5176 ± 0.0174 | min=0.4889 max=0.5447
         : test loss mean=0.6923 ± 0.0018
         : individual accs = ['0.518058', '0.536495', '0.496285', '0.532672', '0.494171', '0.528700', '0.530183', '0.514441', '0.532461', '0.544702', '0.529281', '0.516641', '0.500557', '0.491436', '0.539595', '0.539007', '0.505664', '0.505576', '0.488878', '0.508160']
         : correct/total = [(7373, 14232), (7637, 14235), (7080, 14266), (7573, 14217), (7036, 14238), (7599, 14373), (7606, 14346), (7374, 14334), (7611, 14294), (7829, 14373), (7592, 14344), (7389, 14302), (7185, 14354), (7058, 14362), (7727, 14320), (7759, 14395), (7276, 14389), (7208, 14257), (6967, 14251), (7317, 14399)]
         : compromised: 0.5066, honest: 0.5204
Round 008: test acc mean=0.5492 ± 0.0074 | min=0.5355 max=0.5610
         : test loss mean=0.7082 ± 0.0429
         : individual accs = ['0.548763', '0.539656', '0.539745', '0.556658', '0.560964', '0.558199', '0.542172', '0.560067', '0.544774', '0.557225', '0.535485', '0.548315', '0.543821', '0.543030', '0.555168', '0.549218', '0.554660', '0.545977', '0.545365', '0.555594']
         : correct/total = [(7810, 14232), (7682, 14235), (7700, 14266), (7914, 14217), (7987, 14238), (8023, 14373), (7778, 14346), (8028, 14334), (7787, 14294), (8009, 14373), (7681, 14344), (7842, 14302), (7806, 14354), (7799, 14362), (7950, 14320), (7906, 14395), (7981, 14389), (7784, 14257), (7772, 14251), (8000, 14399)]
         : compromised: 0.5478, honest: 0.5496
Round 009: test acc mean=0.5279 ± 0.0298 | min=0.4876 max=0.5684
         : test loss mean=0.6896 ± 0.0037
         : individual accs = ['0.490444', '0.497155', '0.487593', '0.550397', '0.494100', '0.561678', '0.556322', '0.546044', '0.558206', '0.558826', '0.547895', '0.552650', '0.500766', '0.491505', '0.568366', '0.510386', '0.551115', '0.502911', '0.488738', '0.543718']
         : correct/total = [(6980, 14232), (7077, 14235), (6956, 14266), (7825, 14217), (7035, 14238), (8073, 14373), (7981, 14346), (7827, 14334), (7979, 14294), (8032, 14373), (7859, 14344), (7904, 14302), (7188, 14354), (7059, 14362), (8139, 14320), (7347, 14395), (7930, 14389), (7170, 14257), (6965, 14251), (7829, 14399)]
         : compromised: 0.5142, honest: 0.5314
Round 010: test acc mean=0.5562 ± 0.0078 | min=0.5443 max=0.5719
         : test loss mean=0.6990 ± 0.0313
         : individual accs = ['0.549747', '0.549701', '0.544862', '0.567912', '0.558857', '0.567731', '0.547818', '0.571857', '0.554638', '0.548598', '0.544269', '0.559502', '0.554828', '0.553057', '0.561313', '0.551164', '0.564181', '0.554394', '0.554908', '0.564831']
         : correct/total = [(7824, 14232), (7825, 14235), (7773, 14266), (8074, 14217), (7957, 14238), (8160, 14373), (7859, 14346), (8197, 14334), (7928, 14294), (7885, 14373), (7807, 14344), (8002, 14302), (7964, 14354), (7943, 14362), (8038, 14320), (7934, 14395), (8118, 14389), (7904, 14257), (7908, 14251), (8133, 14399)]
         : compromised: 0.5575, honest: 0.5559

=== FINAL RESULTS ===
Dataset: sent140, Nodes: 20, Graph: erdos, Aggregation: d-fedavg
Attack: directed_deviation, 20.0% compromised
Final accuracy - Compromised: 0.5575, Honest: 0.5559
Overall test accuracy: mean=0.5562 ± 0.0078
