Device: cuda
Seed: 987654321
Loading 1 LEAF Sent140 train files...
LEAF Sent140 train: 254555 users, 908652 samples
Building vocabulary (max_size=10000)...
Vocabulary size: 10000
Loading 1 LEAF Sent140 test files...
LEAF Sent140 test: 254555 users, 286281 samples
Found 254555 train users, 254555 test users, 254555 common users
User sample counts range: 494 (max) to 1 (min)
Distributed ALL 254555 users across 20 clients
Users per client: 12727 (with 15 clients getting +1 user)
Train partition sizes: [44353, 44290, 44657, 44907, 44696, 45843, 45801, 45619, 45069, 45639, 45821, 45311, 45779, 46056, 45625, 45984, 46428, 44737, 45540, 46497]
Test partition sizes: [14232, 14235, 14266, 14217, 14238, 14373, 14346, 14334, 14294, 14373, 14344, 14302, 14354, 14362, 14320, 14395, 14389, 14257, 14251, 14399]
  Client 0: 44353 train samples, 2 unique classes
  Client 1: 44290 train samples, 2 unique classes
  Client 2: 44657 train samples, 2 unique classes
  Client 3: 44907 train samples, 2 unique classes
  Client 4: 44696 train samples, 2 unique classes
  Client 5: 45843 train samples, 2 unique classes
  Client 6: 45801 train samples, 2 unique classes
  Client 7: 45619 train samples, 2 unique classes
  Client 8: 45069 train samples, 2 unique classes
  Client 9: 45639 train samples, 2 unique classes
  Client 10: 45821 train samples, 2 unique classes
  Client 11: 45311 train samples, 2 unique classes
  Client 12: 45779 train samples, 2 unique classes
  Client 13: 46056 train samples, 2 unique classes
  Client 14: 45625 train samples, 2 unique classes
  Client 15: 45984 train samples, 2 unique classes
  Client 16: 46428 train samples, 2 unique classes
  Client 17: 44737 train samples, 2 unique classes
  Client 18: 45540 train samples, 2 unique classes
  Client 19: 46497 train samples, 2 unique classes
Will sample 4500 samples per client per epoch
Graph: erdos, nodes: 20, edges: 99
Degree statistics: avg=9.90, min=7, max=14
Attack: Compromised 10/20 nodes: [1, 2, 5, 11, 12, 13, 14, 15, 17, 18]
Attack type: backdoor, lambda: 1.0
Backdoor target label: 1, trigger size: 3
Model variant: baseline
Model parameters: 1,174,986
Initial test acc across nodes: mean=0.4953 ± 0.0174
Backdoor attack: Created poisoned datasets for 10 compromised nodes
Round 001: test acc mean=0.5005 ± 0.0080 | min=0.4822 max=0.5169
         : test loss mean=5.9716 ± 2.0158
         : individual accs = ['0.516934', '0.482192', '0.494252', '0.512204', '0.500913', '0.506436', '0.501115', '0.501256', '0.496712', '0.510193', '0.503904', '0.507202', '0.501463', '0.497215', '0.493156', '0.488711', '0.492529', '0.504875', '0.497719', '0.500451']
         : correct/total = [(7357, 14232), (6864, 14235), (7051, 14266), (7282, 14217), (7132, 14238), (7279, 14373), (7189, 14346), (7185, 14334), (7100, 14294), (7333, 14373), (7228, 14344), (7254, 14302), (7198, 14354), (7141, 14362), (7062, 14320), (7035, 14395), (7087, 14389), (7198, 14257), (7093, 14251), (7206, 14399)]
         : compromised: 0.4973, honest: 0.5036
Round 002: test acc mean=0.4992 ± 0.0061 | min=0.4875 max=0.5115
         : test loss mean=6.6993 ± 2.0217
         : individual accs = ['0.498454', '0.511486', '0.504206', '0.492439', '0.494662', '0.505114', '0.487662', '0.503698', '0.500770', '0.504557', '0.495120', '0.494756', '0.495820', '0.487537', '0.499511', '0.502952', '0.503996', '0.504735', '0.501509', '0.494548']
         : correct/total = [(7094, 14232), (7281, 14235), (7193, 14266), (7001, 14217), (7043, 14238), (7260, 14373), (6996, 14346), (7220, 14334), (7158, 14294), (7252, 14373), (7102, 14344), (7076, 14302), (7117, 14354), (7002, 14362), (7153, 14320), (7240, 14395), (7252, 14389), (7196, 14257), (7147, 14251), (7121, 14399)]
         : compromised: 0.5008, honest: 0.4976
Round 003: test acc mean=0.5026 ± 0.0067 | min=0.4846 max=0.5136
         : test loss mean=2.5532 ± 0.8416
         : individual accs = ['0.507307', '0.495539', '0.510515', '0.513610', '0.502739', '0.501635', '0.504391', '0.508023', '0.500840', '0.500313', '0.501394', '0.496504', '0.498607', '0.501741', '0.504679', '0.495519', '0.484606', '0.511117', '0.511683', '0.500868']
         : correct/total = [(7220, 14232), (7054, 14235), (7283, 14266), (7302, 14217), (7158, 14238), (7210, 14373), (7236, 14346), (7282, 14334), (7159, 14294), (7191, 14373), (7192, 14344), (7101, 14302), (7157, 14354), (7206, 14362), (7227, 14320), (7133, 14395), (6973, 14389), (7287, 14257), (7292, 14251), (7212, 14399)]
         : compromised: 0.5028, honest: 0.5024
Round 004: test acc mean=0.4960 ± 0.0061 | min=0.4827 max=0.5061
         : test loss mean=8.2842 ± 3.3823
         : individual accs = ['0.492693', '0.482684', '0.489556', '0.483435', '0.494522', '0.496486', '0.500279', '0.492256', '0.498111', '0.500313', '0.506135', '0.495455', '0.503414', '0.505083', '0.493296', '0.498715', '0.492251', '0.498632', '0.496527', '0.499201']
         : correct/total = [(7012, 14232), (6871, 14235), (6984, 14266), (6873, 14217), (7041, 14238), (7136, 14373), (7177, 14346), (7056, 14334), (7120, 14294), (7191, 14373), (7260, 14344), (7086, 14302), (7226, 14354), (7254, 14362), (7064, 14320), (7179, 14395), (7083, 14389), (7109, 14257), (7076, 14251), (7188, 14399)]
         : compromised: 0.4960, honest: 0.4959
Round 005: test acc mean=0.4983 ± 0.0070 | min=0.4868 max=0.5141
         : test loss mean=9.8528 ± 2.0025
         : individual accs = ['0.489952', '0.486758', '0.492009', '0.491876', '0.514117', '0.497461', '0.499582', '0.501814', '0.500490', '0.502818', '0.501603', '0.497343', '0.501393', '0.506267', '0.496508', '0.495728', '0.487664', '0.511608', '0.496667', '0.495243']
         : correct/total = [(6973, 14232), (6929, 14235), (7019, 14266), (6993, 14217), (7320, 14238), (7150, 14373), (7167, 14346), (7193, 14334), (7154, 14294), (7227, 14373), (7195, 14344), (7113, 14302), (7197, 14354), (7271, 14362), (7110, 14320), (7136, 14395), (7017, 14389), (7294, 14257), (7078, 14251), (7131, 14399)]
         : compromised: 0.4982, honest: 0.4985
Round 006: test acc mean=0.4947 ± 0.0072 | min=0.4793 max=0.5062
         : test loss mean=8.5666 ± 2.4379
         : individual accs = ['0.498946', '0.486477', '0.488995', '0.479989', '0.492906', '0.495443', '0.497839', '0.486187', '0.506226', '0.495025', '0.495468', '0.497832', '0.501115', '0.503064', '0.496648', '0.499271', '0.491904', '0.479343', '0.502912', '0.499062']
         : correct/total = [(7101, 14232), (6925, 14235), (6976, 14266), (6824, 14217), (7018, 14238), (7121, 14373), (7142, 14346), (6969, 14334), (7236, 14294), (7115, 14373), (7107, 14344), (7120, 14302), (7193, 14354), (7225, 14362), (7112, 14320), (7187, 14395), (7078, 14389), (6834, 14257), (7167, 14251), (7186, 14399)]
         : compromised: 0.4951, honest: 0.4944
Round 007: test acc mean=0.4951 ± 0.0051 | min=0.4853 max=0.5063
         : test loss mean=2.5438 ± 1.3561
         : individual accs = ['0.494028', '0.485283', '0.487032', '0.487163', '0.494522', '0.495234', '0.499651', '0.492954', '0.498321', '0.494608', '0.506274', '0.498112', '0.503832', '0.496588', '0.492528', '0.497395', '0.492668', '0.491057', '0.497088', '0.498160']
         : correct/total = [(7031, 14232), (6908, 14235), (6948, 14266), (6926, 14217), (7041, 14238), (7118, 14373), (7168, 14346), (7066, 14334), (7123, 14294), (7109, 14373), (7262, 14344), (7124, 14302), (7232, 14354), (7132, 14362), (7053, 14320), (7160, 14395), (7089, 14389), (7001, 14257), (7084, 14251), (7173, 14399)]
         : compromised: 0.4944, honest: 0.4958
Round 008: test acc mean=0.5023 ± 0.0071 | min=0.4906 max=0.5192
         : test loss mean=1.7356 ± 0.7159
         : individual accs = ['0.501265', '0.511416', '0.501682', '0.519167', '0.507937', '0.503166', '0.499582', '0.494837', '0.497272', '0.505949', '0.510248', '0.490631', '0.500766', '0.493385', '0.502723', '0.493088', '0.507471', '0.509013', '0.502351', '0.493576']
         : correct/total = [(7134, 14232), (7280, 14235), (7157, 14266), (7381, 14217), (7232, 14238), (7232, 14373), (7167, 14346), (7093, 14334), (7108, 14294), (7272, 14373), (7319, 14344), (7017, 14302), (7188, 14354), (7086, 14362), (7199, 14320), (7098, 14395), (7302, 14389), (7257, 14257), (7159, 14251), (7107, 14399)]
         : compromised: 0.5008, honest: 0.5037
Round 009: test acc mean=0.5041 ± 0.0073 | min=0.4893 max=0.5224
         : test loss mean=3.2378 ± 1.7587
         : individual accs = ['0.508151', '0.516825', '0.507080', '0.522403', '0.505689', '0.503931', '0.505995', '0.496721', '0.500490', '0.504696', '0.503207', '0.497972', '0.498676', '0.492968', '0.508170', '0.504898', '0.489332', '0.509925', '0.504456', '0.500521']
         : correct/total = [(7232, 14232), (7357, 14235), (7234, 14266), (7427, 14217), (7200, 14238), (7243, 14373), (7259, 14346), (7120, 14334), (7154, 14294), (7254, 14373), (7218, 14344), (7122, 14302), (7158, 14354), (7080, 14362), (7277, 14320), (7268, 14395), (7041, 14389), (7270, 14257), (7189, 14251), (7207, 14399)]
         : compromised: 0.5045, honest: 0.5037
Round 010: test acc mean=0.5047 ± 0.0055 | min=0.4932 max=0.5170
         : test loss mean=2.2772 ± 2.0544
         : individual accs = ['0.507448', '0.516965', '0.512617', '0.515017', '0.503933', '0.504001', '0.509271', '0.502930', '0.501609', '0.503235', '0.503067', '0.505034', '0.497074', '0.493246', '0.505726', '0.500799', '0.505039', '0.504805', '0.504386', '0.498785']
         : correct/total = [(7222, 14232), (7359, 14235), (7313, 14266), (7322, 14217), (7175, 14238), (7244, 14373), (7306, 14346), (7209, 14334), (7170, 14294), (7233, 14373), (7216, 14344), (7223, 14302), (7135, 14354), (7084, 14362), (7242, 14320), (7209, 14395), (7267, 14389), (7197, 14257), (7188, 14251), (7182, 14399)]
         : compromised: 0.5045, honest: 0.5050

=== FINAL RESULTS ===
Dataset: sent140, Nodes: 20, Graph: erdos, Aggregation: krum
Attack: backdoor, 50.0% compromised
Final accuracy - Compromised: 0.5045, Honest: 0.5050
Overall test accuracy: mean=0.5047 ± 0.0055

=== BACKDOOR ATTACK SUCCESS RATE (ASR) ===
Target label: 1
Trigger size: 3x3
Overall ASR: 0.0112 ± 0.0155
Honest nodes ASR: 0.0176 ± 0.0185
Compromised nodes ASR: 0.0049 ± 0.0077
Note: Higher ASR indicates more successful backdoor attack
