Device: cuda
Seed: 987654321
Loading 1 LEAF Sent140 train files...
LEAF Sent140 train: 254555 users, 908652 samples
Building vocabulary (max_size=10000)...
Vocabulary size: 10000
Loading 1 LEAF Sent140 test files...
LEAF Sent140 test: 254555 users, 286281 samples
Found 254555 train users, 254555 test users, 254555 common users
User sample counts range: 494 (max) to 1 (min)
Distributed ALL 254555 users across 20 clients
Users per client: 12727 (with 15 clients getting +1 user)
Train partition sizes: [44353, 44290, 44657, 44907, 44696, 45843, 45801, 45619, 45069, 45639, 45821, 45311, 45779, 46056, 45625, 45984, 46428, 44737, 45540, 46497]
Test partition sizes: [14232, 14235, 14266, 14217, 14238, 14373, 14346, 14334, 14294, 14373, 14344, 14302, 14354, 14362, 14320, 14395, 14389, 14257, 14251, 14399]
  Client 0: 44353 train samples, 2 unique classes
  Client 1: 44290 train samples, 2 unique classes
  Client 2: 44657 train samples, 2 unique classes
  Client 3: 44907 train samples, 2 unique classes
  Client 4: 44696 train samples, 2 unique classes
  Client 5: 45843 train samples, 2 unique classes
  Client 6: 45801 train samples, 2 unique classes
  Client 7: 45619 train samples, 2 unique classes
  Client 8: 45069 train samples, 2 unique classes
  Client 9: 45639 train samples, 2 unique classes
  Client 10: 45821 train samples, 2 unique classes
  Client 11: 45311 train samples, 2 unique classes
  Client 12: 45779 train samples, 2 unique classes
  Client 13: 46056 train samples, 2 unique classes
  Client 14: 45625 train samples, 2 unique classes
  Client 15: 45984 train samples, 2 unique classes
  Client 16: 46428 train samples, 2 unique classes
  Client 17: 44737 train samples, 2 unique classes
  Client 18: 45540 train samples, 2 unique classes
  Client 19: 46497 train samples, 2 unique classes
Will sample 4500 samples per client per epoch
Graph: erdos, nodes: 20, edges: 99
Degree statistics: avg=9.90, min=7, max=14
Attack: Compromised 8/20 nodes: [1, 5, 11, 12, 13, 14, 17, 18]
Attack type: backdoor, lambda: 1.0
Backdoor target label: 1, trigger size: 3
Model variant: baseline
Model parameters: 1,174,986
Initial test acc across nodes: mean=0.4953 ± 0.0174
Backdoor attack: Created poisoned datasets for 8 compromised nodes
Round 001: test acc mean=0.4983 ± 0.0064 | min=0.4847 max=0.5122
         : test loss mean=17.3470 ± 8.4892
         : individual accs = ['0.505832', '0.504320', '0.499439', '0.512204', '0.501826', '0.494956', '0.497072', '0.495256', '0.503848', '0.485424', '0.501603', '0.494127', '0.504041', '0.494569', '0.498464', '0.501563', '0.496977', '0.484744', '0.493579', '0.496840']
         : correct/total = [(7199, 14232), (7179, 14235), (7125, 14266), (7282, 14217), (7145, 14238), (7114, 14373), (7131, 14346), (7099, 14334), (7202, 14294), (6977, 14373), (7195, 14344), (7067, 14302), (7235, 14354), (7103, 14362), (7138, 14320), (7220, 14395), (7151, 14389), (6911, 14257), (7034, 14251), (7154, 14399)]
         : compromised: 0.4961, honest: 0.4998
Round 002: test acc mean=0.5082 ± 0.0108 | min=0.4918 max=0.5334
         : test loss mean=27.9449 ± 22.8112
         : individual accs = ['0.507237', '0.533404', '0.513108', '0.520082', '0.506883', '0.504348', '0.499024', '0.503907', '0.499930', '0.527378', '0.500070', '0.506782', '0.498885', '0.491784', '0.507123', '0.498576', '0.510390', '0.504173', '0.528033', '0.502188']
         : correct/total = [(7219, 14232), (7593, 14235), (7320, 14266), (7394, 14217), (7217, 14238), (7249, 14373), (7159, 14346), (7223, 14334), (7146, 14294), (7580, 14373), (7173, 14344), (7248, 14302), (7161, 14354), (7063, 14362), (7262, 14320), (7177, 14395), (7344, 14389), (7188, 14257), (7525, 14251), (7231, 14399)]
         : compromised: 0.5093, honest: 0.5074
Round 003: test acc mean=0.5056 ± 0.0058 | min=0.4932 max=0.5170
         : test loss mean=49.4318 ± 26.7156
         : individual accs = ['0.507378', '0.516965', '0.513038', '0.515369', '0.505478', '0.504140', '0.500209', '0.507255', '0.501819', '0.513602', '0.501603', '0.506153', '0.497144', '0.493176', '0.507402', '0.502258', '0.507401', '0.504664', '0.504386', '0.501632']
         : correct/total = [(7221, 14232), (7359, 14235), (7319, 14266), (7327, 14217), (7197, 14238), (7246, 14373), (7176, 14346), (7271, 14334), (7173, 14294), (7382, 14373), (7195, 14344), (7239, 14302), (7136, 14354), (7083, 14362), (7266, 14320), (7230, 14395), (7301, 14389), (7195, 14257), (7188, 14251), (7223, 14399)]
         : compromised: 0.5043, honest: 0.5064
Round 004: test acc mean=0.5049 ± 0.0056 | min=0.4932 max=0.5170
         : test loss mean=58.1229 ± 30.3397
         : individual accs = ['0.507378', '0.516965', '0.512968', '0.515088', '0.505478', '0.504209', '0.500209', '0.507255', '0.500490', '0.501705', '0.501603', '0.506153', '0.497144', '0.493176', '0.507402', '0.502258', '0.507471', '0.504664', '0.504386', '0.501910']
         : correct/total = [(7221, 14232), (7359, 14235), (7318, 14266), (7323, 14217), (7197, 14238), (7247, 14373), (7176, 14346), (7271, 14334), (7154, 14294), (7211, 14373), (7195, 14344), (7239, 14302), (7136, 14354), (7083, 14362), (7266, 14320), (7230, 14395), (7302, 14389), (7195, 14257), (7188, 14251), (7227, 14399)]
         : compromised: 0.5043, honest: 0.5053
Round 005: test acc mean=0.5038 ± 0.0052 | min=0.4918 max=0.5130
         : test loss mean=28.7868 ± 22.2952
         : individual accs = ['0.507378', '0.491816', '0.512968', '0.511078', '0.505338', '0.504279', '0.500279', '0.508023', '0.501889', '0.509288', '0.502510', '0.506153', '0.500627', '0.494848', '0.507332', '0.502119', '0.507471', '0.504524', '0.496246', '0.501840']
         : correct/total = [(7221, 14232), (7001, 14235), (7318, 14266), (7266, 14217), (7195, 14238), (7248, 14373), (7177, 14346), (7282, 14334), (7174, 14294), (7320, 14373), (7208, 14344), (7239, 14302), (7186, 14354), (7107, 14362), (7265, 14320), (7228, 14395), (7302, 14389), (7193, 14257), (7072, 14251), (7226, 14399)]
         : compromised: 0.5007, honest: 0.5058
Round 006: test acc mean=0.5024 ± 0.0068 | min=0.4891 max=0.5159
         : test loss mean=37.3432 ± 20.9386
         : individual accs = ['0.508221', '0.515911', '0.509463', '0.515510', '0.497542', '0.498991', '0.498885', '0.505860', '0.489086', '0.493008', '0.495608', '0.502587', '0.496865', '0.503481', '0.507332', '0.501077', '0.502676', '0.506839', '0.503123', '0.495798']
         : correct/total = [(7233, 14232), (7344, 14235), (7268, 14266), (7329, 14217), (7084, 14238), (7172, 14373), (7157, 14346), (7251, 14334), (6991, 14294), (7086, 14373), (7109, 14344), (7188, 14302), (7132, 14354), (7231, 14362), (7265, 14320), (7213, 14395), (7233, 14389), (7226, 14257), (7170, 14251), (7139, 14399)]
         : compromised: 0.5044, honest: 0.5011
Round 007: test acc mean=0.4947 ± 0.0078 | min=0.4813 max=0.5148
         : test loss mean=17.3918 ± 12.8265
         : individual accs = ['0.508221', '0.481279', '0.485280', '0.514806', '0.484548', '0.490712', '0.495330', '0.494977', '0.497412', '0.493008', '0.498675', '0.498741', '0.503623', '0.496727', '0.492109', '0.489406', '0.492946', '0.498492', '0.488036', '0.490381']
         : correct/total = [(7233, 14232), (6851, 14235), (6923, 14266), (7319, 14217), (6899, 14238), (7053, 14373), (7106, 14346), (7095, 14334), (7110, 14294), (7086, 14373), (7153, 14344), (7133, 14302), (7229, 14354), (7134, 14362), (7047, 14320), (7045, 14395), (7093, 14389), (7107, 14257), (6955, 14251), (7061, 14399)]
         : compromised: 0.4937, honest: 0.4954
Round 008: test acc mean=0.4970 ± 0.0063 | min=0.4839 max=0.5082
         : test loss mean=27.1888 ± 16.2355
         : individual accs = ['0.492271', '0.483878', '0.484929', '0.492509', '0.494592', '0.495860', '0.503555', '0.508162', '0.498181', '0.499896', '0.498048', '0.504685', '0.502926', '0.506545', '0.492388', '0.497951', '0.492668', '0.495616', '0.495263', '0.500313']
         : correct/total = [(7006, 14232), (6888, 14235), (6918, 14266), (7002, 14217), (7042, 14238), (7127, 14373), (7224, 14346), (7284, 14334), (7121, 14294), (7185, 14373), (7144, 14344), (7218, 14302), (7219, 14354), (7275, 14362), (7051, 14320), (7168, 14395), (7089, 14389), (7066, 14257), (7058, 14251), (7204, 14399)]
         : compromised: 0.4971, honest: 0.4969
Round 009: test acc mean=0.5009 ± 0.0082 | min=0.4875 max=0.5193
         : test loss mean=9.3720 ± 3.4027
         : individual accs = ['0.519323', '0.514085', '0.508762', '0.488500', '0.502037', '0.494051', '0.500558', '0.504674', '0.487547', '0.500870', '0.505508', '0.497693', '0.499512', '0.507032', '0.491131', '0.510316', '0.499548', '0.498562', '0.491123', '0.498160']
         : correct/total = [(7391, 14232), (7318, 14235), (7258, 14266), (6945, 14217), (7148, 14238), (7101, 14373), (7181, 14346), (7234, 14334), (6969, 14294), (7199, 14373), (7251, 14344), (7118, 14302), (7170, 14354), (7282, 14362), (7033, 14320), (7346, 14395), (7188, 14389), (7108, 14257), (6999, 14251), (7173, 14399)]
         : compromised: 0.4991, honest: 0.5022
Round 010: test acc mean=0.5034 ± 0.0056 | min=0.4918 max=0.5174
         : test loss mean=19.4016 ± 17.0382
         : individual accs = ['0.501054', '0.517387', '0.506659', '0.514736', '0.502458', '0.505044', '0.500418', '0.507255', '0.501329', '0.503792', '0.503346', '0.498252', '0.496795', '0.491784', '0.507402', '0.501771', '0.502120', '0.499334', '0.504386', '0.502188']
         : correct/total = [(7131, 14232), (7365, 14235), (7228, 14266), (7318, 14217), (7154, 14238), (7259, 14373), (7179, 14346), (7271, 14334), (7166, 14294), (7241, 14373), (7220, 14344), (7126, 14302), (7131, 14354), (7063, 14362), (7266, 14320), (7223, 14395), (7225, 14389), (7119, 14257), (7188, 14251), (7231, 14399)]
         : compromised: 0.5025, honest: 0.5039

=== FINAL RESULTS ===
Dataset: sent140, Nodes: 20, Graph: erdos, Aggregation: krum
Attack: backdoor, 40.0% compromised
Final accuracy - Compromised: 0.5025, Honest: 0.5039
Overall test accuracy: mean=0.5034 ± 0.0056

=== BACKDOOR ATTACK SUCCESS RATE (ASR) ===
Target label: 1
Trigger size: 3x3
Overall ASR: 0.1501 ± 0.2352
Honest nodes ASR: 0.1892 ± 0.2622
Compromised nodes ASR: 0.0915 ± 0.1716
Note: Higher ASR indicates more successful backdoor attack
