Device: cuda
Seed: 987654321
Loading 1 LEAF Sent140 train files...
LEAF Sent140 train: 254555 users, 908652 samples
Building vocabulary (max_size=10000)...
Vocabulary size: 10000
Loading 1 LEAF Sent140 test files...
LEAF Sent140 test: 254555 users, 286281 samples
Found 254555 train users, 254555 test users, 254555 common users
User sample counts range: 494 (max) to 1 (min)
Distributed ALL 254555 users across 20 clients
Users per client: 12727 (with 15 clients getting +1 user)
Train partition sizes: [44353, 44290, 44657, 44907, 44696, 45843, 45801, 45619, 45069, 45639, 45821, 45311, 45779, 46056, 45625, 45984, 46428, 44737, 45540, 46497]
Test partition sizes: [14232, 14235, 14266, 14217, 14238, 14373, 14346, 14334, 14294, 14373, 14344, 14302, 14354, 14362, 14320, 14395, 14389, 14257, 14251, 14399]
  Client 0: 44353 train samples, 2 unique classes
  Client 1: 44290 train samples, 2 unique classes
  Client 2: 44657 train samples, 2 unique classes
  Client 3: 44907 train samples, 2 unique classes
  Client 4: 44696 train samples, 2 unique classes
  Client 5: 45843 train samples, 2 unique classes
  Client 6: 45801 train samples, 2 unique classes
  Client 7: 45619 train samples, 2 unique classes
  Client 8: 45069 train samples, 2 unique classes
  Client 9: 45639 train samples, 2 unique classes
  Client 10: 45821 train samples, 2 unique classes
  Client 11: 45311 train samples, 2 unique classes
  Client 12: 45779 train samples, 2 unique classes
  Client 13: 46056 train samples, 2 unique classes
  Client 14: 45625 train samples, 2 unique classes
  Client 15: 45984 train samples, 2 unique classes
  Client 16: 46428 train samples, 2 unique classes
  Client 17: 44737 train samples, 2 unique classes
  Client 18: 45540 train samples, 2 unique classes
  Client 19: 46497 train samples, 2 unique classes
Will sample 4500 samples per client per epoch
Graph: fully, nodes: 20, edges: 190
Degree statistics: avg=19.00, min=19, max=19
Attack: Compromised 16/20 nodes: [1, 2, 3, 5, 6, 8, 9, 10, 11, 12, 13, 14, 15, 17, 18, 19]
Attack type: backdoor, lambda: 1.0
Backdoor target label: 1, trigger size: 3
Model variant: baseline
Model parameters: 1,174,986
Initial test acc across nodes: mean=0.4953 ± 0.0174
Backdoor attack: Created poisoned datasets for 16 compromised nodes
Round 001: test acc mean=0.4997 ± 0.0063 | min=0.4859 max=0.5117
         : test loss mean=14.2477 ± 4.0547
         : individual accs = ['0.507518', '0.490762', '0.510865', '0.511711', '0.502248', '0.500035', '0.495190', '0.500279', '0.500210', '0.501844', '0.502719', '0.492658', '0.501463', '0.485865', '0.500838', '0.491699', '0.498575', '0.504173', '0.496035', '0.499410']
         : correct/total = [(7223, 14232), (6986, 14235), (7288, 14266), (7275, 14217), (7151, 14238), (7187, 14373), (7104, 14346), (7171, 14334), (7150, 14294), (7213, 14373), (7211, 14344), (7046, 14302), (7198, 14354), (6978, 14362), (7172, 14320), (7078, 14395), (7174, 14389), (7188, 14257), (7069, 14251), (7191, 14399)]
         : compromised: 0.4991, honest: 0.5022
Round 002: test acc mean=0.5049 ± 0.0053 | min=0.4942 max=0.5166
         : test loss mean=44.7590 ± 0.5275
         : individual accs = ['0.507518', '0.516614', '0.511356', '0.514877', '0.505057', '0.504696', '0.499930', '0.506069', '0.502309', '0.502539', '0.501673', '0.506293', '0.496865', '0.494151', '0.506494', '0.501355', '0.506846', '0.505155', '0.507122', '0.500243']
         : correct/total = [(7223, 14232), (7354, 14235), (7295, 14266), (7320, 14217), (7191, 14238), (7254, 14373), (7172, 14346), (7254, 14334), (7180, 14294), (7223, 14373), (7196, 14344), (7241, 14302), (7132, 14354), (7097, 14362), (7253, 14320), (7217, 14395), (7293, 14389), (7202, 14257), (7227, 14251), (7203, 14399)]
         : compromised: 0.5045, honest: 0.5064
Round 003: test acc mean=0.5051 ± 0.0055 | min=0.4932 max=0.5170
         : test loss mean=57.9035 ± 0.6680
         : individual accs = ['0.507378', '0.516965', '0.513038', '0.515088', '0.505478', '0.504140', '0.500209', '0.507186', '0.501819', '0.504696', '0.501464', '0.506153', '0.497144', '0.493176', '0.507402', '0.502327', '0.507540', '0.504664', '0.504386', '0.501910']
         : correct/total = [(7221, 14232), (7359, 14235), (7319, 14266), (7323, 14217), (7197, 14238), (7246, 14373), (7176, 14346), (7270, 14334), (7173, 14294), (7254, 14373), (7193, 14344), (7239, 14302), (7136, 14354), (7083, 14362), (7266, 14320), (7231, 14395), (7303, 14389), (7195, 14257), (7188, 14251), (7227, 14399)]
         : compromised: 0.5047, honest: 0.5069
Round 004: test acc mean=0.5049 ± 0.0055 | min=0.4931 max=0.5176
         : test loss mean=64.9971 ± 0.7404
         : individual accs = ['0.506254', '0.517597', '0.511706', '0.514244', '0.505549', '0.504557', '0.499582', '0.508441', '0.501679', '0.504209', '0.501882', '0.506712', '0.496238', '0.493107', '0.507682', '0.502119', '0.506568', '0.504384', '0.504245', '0.501424']
         : correct/total = [(7205, 14232), (7368, 14235), (7300, 14266), (7311, 14217), (7198, 14238), (7252, 14373), (7167, 14346), (7288, 14334), (7171, 14294), (7247, 14373), (7199, 14344), (7247, 14302), (7123, 14354), (7082, 14362), (7270, 14320), (7228, 14395), (7289, 14389), (7191, 14257), (7186, 14251), (7220, 14399)]
         : compromised: 0.5045, honest: 0.5067
Round 005: test acc mean=0.5042 ± 0.0046 | min=0.4936 max=0.5111
         : test loss mean=72.1970 ± 0.9640
         : individual accs = ['0.506254', '0.511135', '0.509463', '0.511149', '0.504425', '0.502331', '0.498676', '0.504116', '0.504477', '0.506018', '0.500000', '0.510208', '0.500627', '0.493594', '0.502095', '0.506495', '0.508513', '0.506137', '0.499965', '0.498854']
         : correct/total = [(7205, 14232), (7276, 14235), (7268, 14266), (7267, 14217), (7182, 14238), (7220, 14373), (7154, 14346), (7226, 14334), (7211, 14294), (7273, 14373), (7172, 14344), (7297, 14302), (7186, 14354), (7089, 14362), (7190, 14320), (7291, 14395), (7317, 14389), (7216, 14257), (7125, 14251), (7183, 14399)]
         : compromised: 0.5038, honest: 0.5058
Round 006: test acc mean=0.5058 ± 0.0035 | min=0.4981 max=0.5123
         : test loss mean=34.2717 ± 0.3624
         : individual accs = ['0.508572', '0.506428', '0.504066', '0.512344', '0.508007', '0.509567', '0.498118', '0.505372', '0.500280', '0.508105', '0.509481', '0.501888', '0.504459', '0.505501', '0.508310', '0.508718', '0.501772', '0.504945', '0.507754', '0.502743']
         : correct/total = [(7238, 14232), (7209, 14235), (7191, 14266), (7284, 14217), (7233, 14238), (7324, 14373), (7146, 14346), (7244, 14334), (7151, 14294), (7303, 14373), (7308, 14344), (7178, 14302), (7241, 14354), (7260, 14362), (7279, 14320), (7323, 14395), (7220, 14389), (7199, 14257), (7236, 14251), (7239, 14399)]
         : compromised: 0.5058, honest: 0.5059
Round 007: test acc mean=0.4950 ± 0.0054 | min=0.4834 max=0.5065
         : test loss mean=102.7152 ± 1.1783
         : individual accs = ['0.492482', '0.483386', '0.487523', '0.485264', '0.494943', '0.496069', '0.500139', '0.492675', '0.497971', '0.494956', '0.498397', '0.493847', '0.503205', '0.506545', '0.492598', '0.497534', '0.492877', '0.495546', '0.495895', '0.498021']
         : correct/total = [(7009, 14232), (6881, 14235), (6955, 14266), (6899, 14217), (7047, 14238), (7130, 14373), (7175, 14346), (7062, 14334), (7118, 14294), (7114, 14373), (7149, 14344), (7063, 14302), (7223, 14354), (7275, 14362), (7054, 14320), (7162, 14395), (7092, 14389), (7065, 14257), (7067, 14251), (7171, 14399)]
         : compromised: 0.4954, honest: 0.4932
Round 008: test acc mean=0.5090 ± 0.0044 | min=0.4957 max=0.5175
         : test loss mean=25.7242 ± 0.3921
         : individual accs = ['0.511102', '0.503196', '0.503224', '0.495674', '0.510184', '0.508384', '0.508922', '0.506837', '0.509654', '0.510610', '0.512549', '0.511956', '0.517486', '0.512603', '0.507961', '0.509760', '0.509000', '0.508522', '0.509438', '0.513091']
         : correct/total = [(7274, 14232), (7163, 14235), (7179, 14266), (7047, 14217), (7264, 14238), (7307, 14373), (7301, 14346), (7265, 14334), (7285, 14294), (7339, 14373), (7352, 14344), (7322, 14302), (7428, 14354), (7362, 14362), (7274, 14320), (7338, 14395), (7324, 14389), (7250, 14257), (7260, 14251), (7388, 14399)]
         : compromised: 0.5089, honest: 0.5093
Round 009: test acc mean=0.4964 ± 0.0061 | min=0.4843 max=0.5113
         : test loss mean=47.8421 ± 0.7669
         : individual accs = ['0.497752', '0.487109', '0.487453', '0.484279', '0.494732', '0.495304', '0.506761', '0.493651', '0.497971', '0.491616', '0.497490', '0.498462', '0.503274', '0.511280', '0.495950', '0.497812', '0.496768', '0.497580', '0.495404', '0.497187']
         : correct/total = [(7084, 14232), (6934, 14235), (6954, 14266), (6885, 14217), (7044, 14238), (7119, 14373), (7270, 14346), (7076, 14334), (7118, 14294), (7066, 14373), (7136, 14344), (7129, 14302), (7224, 14354), (7343, 14362), (7102, 14320), (7166, 14395), (7148, 14389), (7094, 14257), (7060, 14251), (7159, 14399)]
         : compromised: 0.4966, honest: 0.4957
Round 010: test acc mean=0.5047 ± 0.0051 | min=0.4930 max=0.5156
         : test loss mean=56.7737 ± 0.5626
         : individual accs = ['0.505902', '0.515630', '0.509743', '0.515017', '0.508217', '0.504279', '0.502579', '0.506488', '0.503708', '0.501426', '0.499791', '0.507342', '0.497492', '0.492968', '0.504888', '0.504342', '0.506707', '0.503332', '0.501088', '0.503577']
         : correct/total = [(7200, 14232), (7340, 14235), (7272, 14266), (7322, 14217), (7236, 14238), (7248, 14373), (7210, 14346), (7260, 14334), (7200, 14294), (7207, 14373), (7169, 14344), (7256, 14302), (7141, 14354), (7080, 14362), (7230, 14320), (7260, 14395), (7291, 14389), (7176, 14257), (7141, 14251), (7251, 14399)]
         : compromised: 0.5042, honest: 0.5068

=== FINAL RESULTS ===
Dataset: sent140, Nodes: 20, Graph: fully, Aggregation: d-fedavg
Attack: backdoor, 80.0% compromised
Final accuracy - Compromised: 0.5042, Honest: 0.5068
Overall test accuracy: mean=0.5047 ± 0.0051

=== BACKDOOR ATTACK SUCCESS RATE (ASR) ===
Target label: 1
Trigger size: 3x3
Overall ASR: 0.0033 ± 0.0005
Honest nodes ASR: 0.0034 ± 0.0003
Compromised nodes ASR: 0.0033 ± 0.0005
Note: Higher ASR indicates more successful backdoor attack
