Device: cuda
Seed: 987654321
Loading 1 LEAF Sent140 train files...
LEAF Sent140 train: 254555 users, 908652 samples
Building vocabulary (max_size=10000)...
Vocabulary size: 10000
Loading 1 LEAF Sent140 test files...
LEAF Sent140 test: 254555 users, 286281 samples
Found 254555 train users, 254555 test users, 254555 common users
User sample counts range: 494 (max) to 1 (min)
Distributed ALL 254555 users across 20 clients
Users per client: 12727 (with 15 clients getting +1 user)
Train partition sizes: [44353, 44290, 44657, 44907, 44696, 45843, 45801, 45619, 45069, 45639, 45821, 45311, 45779, 46056, 45625, 45984, 46428, 44737, 45540, 46497]
Test partition sizes: [14232, 14235, 14266, 14217, 14238, 14373, 14346, 14334, 14294, 14373, 14344, 14302, 14354, 14362, 14320, 14395, 14389, 14257, 14251, 14399]
  Client 0: 44353 train samples, 2 unique classes
  Client 1: 44290 train samples, 2 unique classes
  Client 2: 44657 train samples, 2 unique classes
  Client 3: 44907 train samples, 2 unique classes
  Client 4: 44696 train samples, 2 unique classes
  Client 5: 45843 train samples, 2 unique classes
  Client 6: 45801 train samples, 2 unique classes
  Client 7: 45619 train samples, 2 unique classes
  Client 8: 45069 train samples, 2 unique classes
  Client 9: 45639 train samples, 2 unique classes
  Client 10: 45821 train samples, 2 unique classes
  Client 11: 45311 train samples, 2 unique classes
  Client 12: 45779 train samples, 2 unique classes
  Client 13: 46056 train samples, 2 unique classes
  Client 14: 45625 train samples, 2 unique classes
  Client 15: 45984 train samples, 2 unique classes
  Client 16: 46428 train samples, 2 unique classes
  Client 17: 44737 train samples, 2 unique classes
  Client 18: 45540 train samples, 2 unique classes
  Client 19: 46497 train samples, 2 unique classes
Will sample 4500 samples per client per epoch
Graph: ring, nodes: 20, edges: 20
Degree statistics: avg=2.00, min=2, max=2
Attack: Compromised 16/20 nodes: [1, 2, 3, 5, 6, 8, 9, 10, 11, 12, 13, 14, 15, 17, 18, 19]
Attack type: gaussian, lambda: 1.0
Model variant: baseline
Model parameters: 1,174,986
UBAR ALGORITHM (Two-Stage Byzantine-resilient)
  - Model dimension: 1,174,986 parameters
  - Rho parameter: 0.19999999999999996
  - Stage 1: Distance-based filtering (select 20% closest neighbors)
  - Stage 2: Performance-based selection (loss comparison)
  - Complexity: O(deg(i)×d + deg(i)×inference)
Initial test acc across nodes: mean=0.4965 ± 0.0152
Round 001: test acc mean=0.5136 ± 0.0186 | min=0.4936 max=0.5627
         : test loss mean=787.5171 ± 735.9952
         : individual accs = ['0.493606', '0.523147', '0.504206', '0.515017', '0.499438', '0.532805', '0.562666', '0.503698', '0.511613', '0.511445', '0.500488', '0.505943', '0.495402', '0.508286', '0.504958', '0.525669', '0.494266', '0.542050', '0.494071', '0.543649']
         : correct/total = [(7025, 14232), (7447, 14235), (7193, 14266), (7322, 14217), (7111, 14238), (7658, 14373), (8072, 14346), (7220, 14334), (7313, 14294), (7351, 14373), (7179, 14344), (7236, 14302), (7111, 14354), (7300, 14362), (7231, 14320), (7567, 14395), (7112, 14389), (7728, 14257), (7041, 14251), (7828, 14399)]
         : compromised: 0.5176, honest: 0.4978
         : ubar stats = ['Node 0: s1=0.500, s2=1.000', 'Node 1: s1=0.500, s2=1.000', 'Node 2: s1=0.500, s2=1.000']...
Round 002: test acc mean=0.5009 ± 0.0080 | min=0.4849 max=0.5150
         : test loss mean=1032.0045 ± 311.2290
         : individual accs = ['0.494168', '0.502424', '0.484929', '0.509531', '0.502528', '0.495860', '0.507807', '0.494837', '0.493424', '0.495304', '0.500279', '0.504545', '0.501533', '0.514343', '0.510964', '0.501077', '0.492390', '0.506698', '0.514981', '0.490937']
         : correct/total = [(7033, 14232), (7152, 14235), (6918, 14266), (7244, 14217), (7155, 14238), (7127, 14373), (7285, 14346), (7093, 14334), (7053, 14294), (7119, 14373), (7176, 14344), (7216, 14302), (7199, 14354), (7387, 14362), (7317, 14320), (7213, 14395), (7085, 14389), (7224, 14257), (7339, 14251), (7069, 14399)]
         : compromised: 0.5022, honest: 0.4960
         : ubar stats = ['Node 0: s1=0.500, s2=1.000', 'Node 1: s1=0.500, s2=1.000', 'Node 2: s1=0.500, s2=1.000']...
Round 003: test acc mean=0.4977 ± 0.0061 | min=0.4841 max=0.5084
         : test loss mean=1356.1402 ± 865.4995
         : individual accs = ['0.489320', '0.489638', '0.492990', '0.492790', '0.505900', '0.498435', '0.501952', '0.497768', '0.490835', '0.503444', '0.499861', '0.484058', '0.508360', '0.501044', '0.503841', '0.500590', '0.498714', '0.497510', '0.495053', '0.502118']
         : correct/total = [(6964, 14232), (6970, 14235), (7033, 14266), (7006, 14217), (7203, 14238), (7164, 14373), (7201, 14346), (7135, 14334), (7016, 14294), (7236, 14373), (7170, 14344), (6923, 14302), (7297, 14354), (7196, 14362), (7215, 14320), (7206, 14395), (7176, 14389), (7093, 14257), (7055, 14251), (7230, 14399)]
         : compromised: 0.4977, honest: 0.4979
         : ubar stats = ['Node 0: s1=0.500, s2=1.000', 'Node 1: s1=0.500, s2=1.000', 'Node 2: s1=0.500, s2=1.000']...
Round 004: test acc mean=0.5017 ± 0.0093 | min=0.4812 max=0.5239
         : test loss mean=1018.8816 ± 350.8699
         : individual accs = ['0.490374', '0.499824', '0.507220', '0.500598', '0.498525', '0.501635', '0.498397', '0.481164', '0.523926', '0.500244', '0.501115', '0.503985', '0.512192', '0.504665', '0.501047', '0.483640', '0.509278', '0.507751', '0.510350', '0.499062']
         : correct/total = [(6979, 14232), (7115, 14235), (7236, 14266), (7117, 14217), (7098, 14238), (7210, 14373), (7150, 14346), (6897, 14334), (7489, 14294), (7190, 14373), (7188, 14344), (7208, 14302), (7352, 14354), (7248, 14362), (7175, 14320), (6962, 14395), (7328, 14389), (7239, 14257), (7273, 14251), (7186, 14399)]
         : compromised: 0.5035, honest: 0.4948
         : ubar stats = ['Node 0: s1=0.500, s2=1.000', 'Node 1: s1=0.500, s2=1.000', 'Node 2: s1=0.500, s2=1.000']...
Round 005: test acc mean=0.4999 ± 0.0085 | min=0.4849 max=0.5199
         : test loss mean=1268.1855 ± 687.9781
         : individual accs = ['0.499859', '0.506990', '0.496635', '0.515721', '0.500140', '0.519933', '0.484874', '0.501186', '0.492444', '0.493564', '0.494144', '0.488114', '0.500697', '0.508146', '0.501955', '0.507676', '0.501911', '0.496247', '0.498000', '0.490451']
         : correct/total = [(7114, 14232), (7217, 14235), (7085, 14266), (7332, 14217), (7121, 14238), (7473, 14373), (6956, 14346), (7184, 14334), (7039, 14294), (7094, 14373), (7088, 14344), (6981, 14302), (7187, 14354), (7298, 14362), (7188, 14320), (7308, 14395), (7222, 14389), (7075, 14257), (7097, 14251), (7062, 14399)]
         : compromised: 0.4997, honest: 0.5008
         : ubar stats = ['Node 0: s1=0.500, s2=1.000', 'Node 1: s1=0.500, s2=1.000', 'Node 2: s1=0.500, s2=1.000']...
Round 006: test acc mean=0.4994 ± 0.0063 | min=0.4873 max=0.5110
         : test loss mean=973.4231 ± 386.3902
         : individual accs = ['0.491568', '0.510011', '0.496355', '0.511008', '0.498455', '0.499269', '0.500558', '0.496930', '0.503778', '0.504140', '0.491495', '0.487275', '0.502856', '0.494848', '0.505028', '0.504828', '0.500799', '0.488813', '0.497790', '0.503160']
         : correct/total = [(6996, 14232), (7260, 14235), (7081, 14266), (7265, 14217), (7097, 14238), (7176, 14373), (7181, 14346), (7123, 14334), (7201, 14294), (7246, 14373), (7050, 14344), (6969, 14302), (7218, 14354), (7107, 14362), (7232, 14320), (7267, 14395), (7206, 14389), (6969, 14257), (7094, 14251), (7245, 14399)]
         : compromised: 0.5001, honest: 0.4969
         : ubar stats = ['Node 0: s1=0.500, s2=1.000', 'Node 1: s1=0.500, s2=1.000', 'Node 2: s1=0.500, s2=1.000']...
Round 007: test acc mean=0.4978 ± 0.0082 | min=0.4852 max=0.5133
         : test loss mean=1230.7155 ± 577.3276
         : individual accs = ['0.504286', '0.492799', '0.507781', '0.507280', '0.496769', '0.487163', '0.498745', '0.490303', '0.489016', '0.507549', '0.505926', '0.485177', '0.497492', '0.490182', '0.513268', '0.493505', '0.488429', '0.504664', '0.492386', '0.502813']
         : correct/total = [(7177, 14232), (7015, 14235), (7244, 14266), (7212, 14217), (7073, 14238), (7002, 14373), (7155, 14346), (7028, 14334), (6990, 14294), (7295, 14373), (7257, 14344), (6939, 14302), (7141, 14354), (7040, 14362), (7350, 14320), (7104, 14395), (7028, 14389), (7195, 14257), (7017, 14251), (7240, 14399)]
         : compromised: 0.4985, honest: 0.4949
         : ubar stats = ['Node 0: s1=0.500, s2=1.000', 'Node 1: s1=0.500, s2=1.000', 'Node 2: s1=0.500, s2=1.000']...
Round 008: test acc mean=0.5015 ± 0.0095 | min=0.4800 max=0.5258
         : test loss mean=1257.5062 ± 530.9502
         : individual accs = ['0.508291', '0.507482', '0.502453', '0.499121', '0.505338', '0.494190', '0.479994', '0.525813', '0.508465', '0.504835', '0.491983', '0.496644', '0.494914', '0.499025', '0.504679', '0.499687', '0.498575', '0.496107', '0.494632', '0.517605']
         : correct/total = [(7234, 14232), (7224, 14235), (7168, 14266), (7096, 14217), (7195, 14238), (7103, 14373), (6886, 14346), (7537, 14334), (7268, 14294), (7256, 14373), (7057, 14344), (7103, 14302), (7104, 14354), (7167, 14362), (7227, 14320), (7193, 14395), (7174, 14389), (7073, 14257), (7049, 14251), (7453, 14399)]
         : compromised: 0.4995, honest: 0.5095
         : ubar stats = ['Node 0: s1=0.500, s2=1.000', 'Node 1: s1=0.500, s2=1.000', 'Node 2: s1=0.500, s2=1.000']...
Round 009: test acc mean=0.5027 ± 0.0083 | min=0.4870 max=0.5219
         : test loss mean=1119.7363 ± 522.6865
         : individual accs = ['0.509696', '0.509940', '0.511846', '0.504255', '0.496067', '0.486955', '0.502021', '0.501674', '0.521897', '0.496973', '0.494841', '0.511187', '0.491779', '0.500279', '0.506145', '0.501007', '0.498645', '0.499404', '0.514280', '0.495868']
         : correct/total = [(7254, 14232), (7259, 14235), (7302, 14266), (7169, 14217), (7063, 14238), (6999, 14373), (7202, 14346), (7191, 14334), (7460, 14294), (7143, 14373), (7098, 14344), (7311, 14302), (7059, 14354), (7185, 14362), (7248, 14320), (7212, 14395), (7175, 14389), (7120, 14257), (7329, 14251), (7140, 14399)]
         : compromised: 0.5030, honest: 0.5015
         : ubar stats = ['Node 0: s1=0.500, s2=1.000', 'Node 1: s1=0.500, s2=1.000', 'Node 2: s1=0.500, s2=1.000']...
Round 010: test acc mean=0.5016 ± 0.0081 | min=0.4882 max=0.5168
         : test loss mean=1183.4591 ± 457.8661
         : individual accs = ['0.504918', '0.496593', '0.488224', '0.516776', '0.490448', '0.509288', '0.511989', '0.504465', '0.492235', '0.498156', '0.510876', '0.497343', '0.506618', '0.492550', '0.499651', '0.500313', '0.501564', '0.493933', '0.501438', '0.515591']
         : correct/total = [(7186, 14232), (7069, 14235), (6965, 14266), (7347, 14217), (6983, 14238), (7320, 14373), (7345, 14346), (7231, 14334), (7036, 14294), (7160, 14373), (7328, 14344), (7113, 14302), (7272, 14354), (7074, 14362), (7155, 14320), (7202, 14395), (7217, 14389), (7042, 14257), (7146, 14251), (7424, 14399)]
         : compromised: 0.5020, honest: 0.5003
         : ubar stats = ['Node 0: s1=0.500, s2=1.000', 'Node 1: s1=0.500, s2=1.000', 'Node 2: s1=0.500, s2=1.000']...

=== FINAL RESULTS ===
Dataset: sent140, Nodes: 20, Graph: ring, Aggregation: ubar
Attack: gaussian, 80.0% compromised
Final accuracy - Compromised: 0.5020, Honest: 0.5003
Overall test accuracy: mean=0.5016 ± 0.0081

=== UBAR SUMMARY ===
Node 0: stage1=0.500, stage2=1.000, overall=0.500
Node 1: stage1=0.500, stage2=1.000, overall=0.500
Node 2: stage1=0.500, stage2=1.000, overall=0.500
Node 3: stage1=0.500, stage2=1.000, overall=0.500
Node 4: stage1=0.500, stage2=1.000, overall=0.500
Node 5: stage1=0.500, stage2=1.000, overall=0.500
Node 6: stage1=0.500, stage2=1.000, overall=0.500
Node 7: stage1=0.500, stage2=1.000, overall=0.500
Node 8: stage1=0.500, stage2=1.000, overall=0.500
Node 9: stage1=0.500, stage2=1.000, overall=0.500
Node 10: stage1=0.500, stage2=1.000, overall=0.500
Node 11: stage1=0.500, stage2=1.000, overall=0.500
Node 12: stage1=0.500, stage2=1.000, overall=0.500
Node 13: stage1=0.500, stage2=1.000, overall=0.500
Node 14: stage1=0.500, stage2=1.000, overall=0.500
Node 15: stage1=0.500, stage2=1.000, overall=0.500
Node 16: stage1=0.500, stage2=1.000, overall=0.500
Node 17: stage1=0.500, stage2=1.000, overall=0.500
Node 18: stage1=0.500, stage2=1.000, overall=0.500
Node 19: stage1=0.500, stage2=1.000, overall=0.500

=== PARALLEL EXECUTION TIME (realistic for distributed system) ===
  COMMUNICATION (max across nodes):
    - Full model transfer: 0.000s (0.0%)
  COMPUTATION (max across nodes):
    - Distance computation: 0.022s (54.2%)
    - Loss computation: 0.015s (36.4%)
    - Aggregation: 0.004s (9.4%)
  TOTALS:
    - Total computation: 0.041s (100.0%)
    - Total communication: 0.000s (0.0%)
    - Total parallel time: 0.041s

=== PER-NODE AVERAGE TIME ===
  - Distance computation: 0.009s
  - Loss computation: 0.010s
  - Aggregation: 0.003s
  - Model transfer: 0.000s
  - Total per node: 0.023s

=== TOTAL COMPUTATIONAL WORK (sum across all nodes) ===
  - Total distance computation: 0.184s
  - Total loss computation: 0.207s
  - Total aggregation: 0.067s
  - Total model transfer: 0.000s
  - Grand total: 0.457s
  - Mean Stage 1 acceptance rate: 0.500
  - Mean Stage 2 acceptance rate: 1.000
  - Overall acceptance rate: 0.500

UBAR Algorithm Properties:
  - Model dimension: 1,174,986
  - Rho parameter: 0.19999999999999996
  - Two-stage approach: Distance filtering + loss evaluation
  - Stage 1 selects: 20% of neighbors
  - Stage 2 uses: Training sample loss comparison
  - Theoretical complexity: O(deg(i)×d + deg(i)×inference)
  - Approach: UBAR paper implementation
