Device: cuda
Seed: 987654321
Loading 1 LEAF Sent140 train files...
LEAF Sent140 train: 254555 users, 908652 samples
Building vocabulary (max_size=10000)...
Vocabulary size: 10000
Loading 1 LEAF Sent140 test files...
LEAF Sent140 test: 254555 users, 286281 samples
Found 254555 train users, 254555 test users, 254555 common users
User sample counts range: 494 (max) to 1 (min)
Distributed ALL 254555 users across 20 clients
Users per client: 12727 (with 15 clients getting +1 user)
Train partition sizes: [44353, 44290, 44657, 44907, 44696, 45843, 45801, 45619, 45069, 45639, 45821, 45311, 45779, 46056, 45625, 45984, 46428, 44737, 45540, 46497]
Test partition sizes: [14232, 14235, 14266, 14217, 14238, 14373, 14346, 14334, 14294, 14373, 14344, 14302, 14354, 14362, 14320, 14395, 14389, 14257, 14251, 14399]
  Client 0: 44353 train samples, 2 unique classes
  Client 1: 44290 train samples, 2 unique classes
  Client 2: 44657 train samples, 2 unique classes
  Client 3: 44907 train samples, 2 unique classes
  Client 4: 44696 train samples, 2 unique classes
  Client 5: 45843 train samples, 2 unique classes
  Client 6: 45801 train samples, 2 unique classes
  Client 7: 45619 train samples, 2 unique classes
  Client 8: 45069 train samples, 2 unique classes
  Client 9: 45639 train samples, 2 unique classes
  Client 10: 45821 train samples, 2 unique classes
  Client 11: 45311 train samples, 2 unique classes
  Client 12: 45779 train samples, 2 unique classes
  Client 13: 46056 train samples, 2 unique classes
  Client 14: 45625 train samples, 2 unique classes
  Client 15: 45984 train samples, 2 unique classes
  Client 16: 46428 train samples, 2 unique classes
  Client 17: 44737 train samples, 2 unique classes
  Client 18: 45540 train samples, 2 unique classes
  Client 19: 46497 train samples, 2 unique classes
Will sample 4500 samples per client per epoch
Graph: erdos, nodes: 20, edges: 126
Degree statistics: avg=12.60, min=8, max=16
Attack: Compromised 2/20 nodes: [5, 13]
Attack type: backdoor, lambda: 1.0
Backdoor target label: 1, trigger size: 3
Model variant: baseline
Model parameters: 1,174,986
Sketchguard Node 0:
  Model dim: 1,174,986 → Sketch size: 180
  Compression ratio: 6527.7x
  Using model parameters for aggregation, sketches for filtering
Sketchguard Node 1:
  Model dim: 1,174,986 → Sketch size: 180
  Compression ratio: 6527.7x
  Using model parameters for aggregation, sketches for filtering
Sketchguard Node 2:
  Model dim: 1,174,986 → Sketch size: 180
  Compression ratio: 6527.7x
  Using model parameters for aggregation, sketches for filtering
Sketchguard Node 3:
  Model dim: 1,174,986 → Sketch size: 180
  Compression ratio: 6527.7x
  Using model parameters for aggregation, sketches for filtering
Sketchguard Node 4:
  Model dim: 1,174,986 → Sketch size: 180
  Compression ratio: 6527.7x
  Using model parameters for aggregation, sketches for filtering
Sketchguard Node 5:
  Model dim: 1,174,986 → Sketch size: 180
  Compression ratio: 6527.7x
  Using model parameters for aggregation, sketches for filtering
Sketchguard Node 6:
  Model dim: 1,174,986 → Sketch size: 180
  Compression ratio: 6527.7x
  Using model parameters for aggregation, sketches for filtering
Sketchguard Node 7:
  Model dim: 1,174,986 → Sketch size: 180
  Compression ratio: 6527.7x
  Using model parameters for aggregation, sketches for filtering
Sketchguard Node 8:
  Model dim: 1,174,986 → Sketch size: 180
  Compression ratio: 6527.7x
  Using model parameters for aggregation, sketches for filtering
Sketchguard Node 9:
  Model dim: 1,174,986 → Sketch size: 180
  Compression ratio: 6527.7x
  Using model parameters for aggregation, sketches for filtering
Sketchguard Node 10:
  Model dim: 1,174,986 → Sketch size: 180
  Compression ratio: 6527.7x
  Using model parameters for aggregation, sketches for filtering
Sketchguard Node 11:
  Model dim: 1,174,986 → Sketch size: 180
  Compression ratio: 6527.7x
  Using model parameters for aggregation, sketches for filtering
Sketchguard Node 12:
  Model dim: 1,174,986 → Sketch size: 180
  Compression ratio: 6527.7x
  Using model parameters for aggregation, sketches for filtering
Sketchguard Node 13:
  Model dim: 1,174,986 → Sketch size: 180
  Compression ratio: 6527.7x
  Using model parameters for aggregation, sketches for filtering
Sketchguard Node 14:
  Model dim: 1,174,986 → Sketch size: 180
  Compression ratio: 6527.7x
  Using model parameters for aggregation, sketches for filtering
Sketchguard Node 15:
  Model dim: 1,174,986 → Sketch size: 180
  Compression ratio: 6527.7x
  Using model parameters for aggregation, sketches for filtering
Sketchguard Node 16:
  Model dim: 1,174,986 → Sketch size: 180
  Compression ratio: 6527.7x
  Using model parameters for aggregation, sketches for filtering
Sketchguard Node 17:
  Model dim: 1,174,986 → Sketch size: 180
  Compression ratio: 6527.7x
  Using model parameters for aggregation, sketches for filtering
Sketchguard Node 18:
  Model dim: 1,174,986 → Sketch size: 180
  Compression ratio: 6527.7x
  Using model parameters for aggregation, sketches for filtering
Sketchguard Node 19:
  Model dim: 1,174,986 → Sketch size: 180
  Compression ratio: 6527.7x
  Using model parameters for aggregation, sketches for filtering
Sketchguard ALGORITHM (Sketch-based Filtering + State Aggregation)
  - Model dimension: 1,174,986 parameters
  - Config: SketchguardConfig(gamma=2, kappa=1, alpha=0.5, min_neighbors=1, sketch_size=180, network_seed=987654321, attack_detection_window=5)
  - Sketch size: 180
  - Compression ratio: 6527.7x
  - Complexity: O(d + N×k) = O(1,174,986 + 20×180)
  - Theoretical speedup vs BALANCE: 19.9x
Initial test acc across nodes: mean=0.4953 ± 0.0174
Backdoor attack: Created poisoned datasets for 2 compromised nodes
Round 001: test acc mean=0.5109 ± 0.0122 | min=0.4910 max=0.5444
         : test loss mean=4.6514 ± 11.8644
         : individual accs = ['0.507378', '0.516965', '0.512547', '0.491032', '0.523318', '0.530439', '0.500070', '0.512488', '0.501819', '0.504766', '0.544409', '0.506153', '0.502229', '0.516502', '0.507263', '0.493991', '0.509903', '0.521077', '0.513718', '0.502257']
         : correct/total = [(7221, 14232), (7359, 14235), (7312, 14266), (6981, 14217), (7451, 14238), (7624, 14373), (7174, 14346), (7346, 14334), (7173, 14294), (7255, 14373), (7809, 14344), (7239, 14302), (7209, 14354), (7418, 14362), (7264, 14320), (7111, 14395), (7337, 14389), (7429, 14257), (7321, 14251), (7232, 14399)]
         : compromised: 0.5235, honest: 0.5095
         : sketchguard stats = ['Node 0: acc_rate=1.000', 'Node 1: acc_rate=1.000', 'Node 2: acc_rate=1.000']...
Round 002: test acc mean=0.5560 ± 0.0399 | min=0.4962 max=0.6169
         : test loss mean=32.6249 ± 96.2832
         : individual accs = ['0.558600', '0.584615', '0.596453', '0.517127', '0.608864', '0.501635', '0.567963', '0.527138', '0.605219', '0.511375', '0.519451', '0.601734', '0.616901', '0.496170', '0.588966', '0.560681', '0.516297', '0.506769', '0.584661', '0.549344']
         : correct/total = [(7950, 14232), (8322, 14235), (8509, 14266), (7352, 14217), (8669, 14238), (7210, 14373), (8148, 14346), (7556, 14334), (8651, 14294), (7350, 14373), (7451, 14344), (8606, 14302), (8855, 14354), (7126, 14362), (8434, 14320), (8071, 14395), (7429, 14389), (7225, 14257), (8332, 14251), (7910, 14399)]
         : compromised: 0.4989, honest: 0.5623
         : sketchguard stats = ['Node 0: acc_rate=0.938', 'Node 1: acc_rate=0.955', 'Node 2: acc_rate=0.917']...
Round 003: test acc mean=0.5967 ± 0.0341 | min=0.5013 max=0.6227
         : test loss mean=1094.4221 ± 3360.1596
         : individual accs = ['0.622681', '0.610256', '0.612365', '0.613561', '0.598188', '0.501287', '0.593754', '0.581833', '0.614873', '0.613372', '0.614055', '0.564606', '0.618434', '0.504804', '0.615433', '0.605071', '0.618737', '0.605036', '0.622202', '0.603861']
         : correct/total = [(8862, 14232), (8687, 14235), (8736, 14266), (8723, 14217), (8517, 14238), (7205, 14373), (8518, 14346), (8340, 14334), (8789, 14294), (8816, 14373), (8808, 14344), (8075, 14302), (8877, 14354), (7250, 14362), (8813, 14320), (8710, 14395), (8903, 14389), (8626, 14257), (8867, 14251), (8695, 14399)]
         : compromised: 0.5030, honest: 0.6071
         : sketchguard stats = ['Node 0: acc_rate=0.917', 'Node 1: acc_rate=0.939', 'Node 2: acc_rate=0.889']...
Round 004: test acc mean=0.6114 ± 0.0389 | min=0.4930 max=0.6342
         : test loss mean=118850.1272 ± 366329.1242
         : individual accs = ['0.627178', '0.631753', '0.609842', '0.626152', '0.632814', '0.503722', '0.626725', '0.631226', '0.629425', '0.595492', '0.604016', '0.627325', '0.627839', '0.493037', '0.622975', '0.627926', '0.627076', '0.627762', '0.621290', '0.634211']
         : correct/total = [(8926, 14232), (8993, 14235), (8700, 14266), (8902, 14217), (9010, 14238), (7240, 14373), (8991, 14346), (9048, 14334), (8997, 14294), (8559, 14373), (8664, 14344), (8972, 14302), (9012, 14354), (7081, 14362), (8921, 14320), (9039, 14395), (9023, 14389), (8950, 14257), (8854, 14251), (9132, 14399)]
         : compromised: 0.4984, honest: 0.6239
         : sketchguard stats = ['Node 0: acc_rate=0.906', 'Node 1: acc_rate=0.932', 'Node 2: acc_rate=0.875']...
Round 005: test acc mean=0.6221 ± 0.0416 | min=0.4977 max=0.6499
         : test loss mean=11216106.5223 ± 33746077.1447
         : individual accs = ['0.638069', '0.634703', '0.633464', '0.631075', '0.641452', '0.500522', '0.641712', '0.625785', '0.649923', '0.619286', '0.637479', '0.638162', '0.636756', '0.497702', '0.641899', '0.642237', '0.635902', '0.634425', '0.620588', '0.641433']
         : correct/total = [(9081, 14232), (9035, 14235), (9037, 14266), (8972, 14217), (9133, 14238), (7194, 14373), (9206, 14346), (8970, 14334), (9290, 14294), (8901, 14373), (9144, 14344), (9127, 14302), (9140, 14354), (7148, 14362), (9192, 14320), (9245, 14395), (9150, 14389), (9045, 14257), (8844, 14251), (9236, 14399)]
         : compromised: 0.4991, honest: 0.6358
         : sketchguard stats = ['Node 0: acc_rate=0.900', 'Node 1: acc_rate=0.927', 'Node 2: acc_rate=0.867']...
Round 006: test acc mean=0.6295 ± 0.0436 | min=0.4995 max=0.6542
         : test loss mean=575323268.7871 ± 1729179210.9348
         : individual accs = ['0.644463', '0.651001', '0.638511', '0.641134', '0.647633', '0.499478', '0.647428', '0.650133', '0.654191', '0.643290', '0.630368', '0.635156', '0.642817', '0.500000', '0.648115', '0.648003', '0.648968', '0.639054', '0.636376', '0.642892']
         : correct/total = [(9172, 14232), (9267, 14235), (9109, 14266), (9115, 14217), (9221, 14238), (7179, 14373), (9288, 14346), (9319, 14334), (9351, 14294), (9246, 14373), (9042, 14344), (9084, 14302), (9227, 14354), (7181, 14362), (9281, 14320), (9328, 14395), (9338, 14389), (9111, 14257), (9069, 14251), (9257, 14399)]
         : compromised: 0.4997, honest: 0.6439
         : sketchguard stats = ['Node 0: acc_rate=0.896', 'Node 1: acc_rate=0.924', 'Node 2: acc_rate=0.861']...
Round 007: test acc mean=0.6342 ± 0.0460 | min=0.4947 max=0.6587
         : test loss mean=31638035540.0036 ± 102703381232.0937
         : individual accs = ['0.649311', '0.658658', '0.647484', '0.652529', '0.658730', '0.502052', '0.645476', '0.629692', '0.658458', '0.649551', '0.644032', '0.652216', '0.656333', '0.494708', '0.657751', '0.631122', '0.655292', '0.651329', '0.642762', '0.647406']
         : correct/total = [(9241, 14232), (9376, 14235), (9237, 14266), (9277, 14217), (9379, 14238), (7216, 14373), (9260, 14346), (9026, 14334), (9412, 14294), (9336, 14373), (9238, 14344), (9328, 14302), (9421, 14354), (7105, 14362), (9419, 14320), (9085, 14395), (9429, 14389), (9286, 14257), (9160, 14251), (9322, 14399)]
         : compromised: 0.4984, honest: 0.6493
         : sketchguard stats = ['Node 0: acc_rate=0.893', 'Node 1: acc_rate=0.922', 'Node 2: acc_rate=0.857']...
Round 008: test acc mean=0.6411 ± 0.0463 | min=0.5020 max=0.6654
         : test loss mean=2373786108461.0933 ± 7159391802257.1855
         : individual accs = ['0.655214', '0.652406', '0.631712', '0.661321', '0.654516', '0.501983', '0.659208', '0.661574', '0.665384', '0.659361', '0.657348', '0.660957', '0.651526', '0.505779', '0.660894', '0.655019', '0.659045', '0.657151', '0.648095', '0.663379']
         : correct/total = [(9325, 14232), (9287, 14235), (9012, 14266), (9402, 14217), (9319, 14238), (7215, 14373), (9457, 14346), (9483, 14334), (9511, 14294), (9477, 14373), (9429, 14344), (9453, 14302), (9352, 14354), (7264, 14362), (9464, 14320), (9429, 14395), (9483, 14389), (9369, 14257), (9236, 14251), (9552, 14399)]
         : compromised: 0.5039, honest: 0.6563
         : sketchguard stats = ['Node 0: acc_rate=0.891', 'Node 1: acc_rate=0.920', 'Node 2: acc_rate=0.854']...
Round 009: test acc mean=0.6435 ± 0.0490 | min=0.4992 max=0.6703
         : test loss mean=327601187398359.5625 ± 986695944128964.3750
         : individual accs = ['0.617060', '0.668282', '0.659120', '0.665401', '0.657958', '0.501426', '0.651959', '0.661923', '0.669092', '0.662005', '0.646891', '0.655083', '0.663857', '0.499234', '0.664106', '0.662035', '0.670304', '0.664095', '0.662620', '0.667685']
         : correct/total = [(8782, 14232), (9513, 14235), (9403, 14266), (9460, 14217), (9368, 14238), (7207, 14373), (9353, 14346), (9488, 14334), (9564, 14294), (9515, 14373), (9279, 14344), (9369, 14302), (9529, 14354), (7170, 14362), (9510, 14320), (9530, 14395), (9645, 14389), (9468, 14257), (9443, 14251), (9614, 14399)]
         : compromised: 0.5003, honest: 0.6594
         : sketchguard stats = ['Node 0: acc_rate=0.889', 'Node 1: acc_rate=0.919', 'Node 2: acc_rate=0.852']...
Round 010: test acc mean=0.6539 ± 0.0495 | min=0.5024 max=0.6808
         : test loss mean=18547956883193164.0000 ± 56108979966749488.0000
         : individual accs = ['0.669407', '0.675518', '0.650918', '0.672505', '0.675797', '0.502400', '0.674683', '0.680829', '0.674969', '0.663675', '0.665505', '0.672703', '0.674864', '0.511210', '0.673534', '0.664397', '0.675794', '0.670127', '0.659252', '0.669838']
         : correct/total = [(9527, 14232), (9616, 14235), (9286, 14266), (9561, 14217), (9622, 14238), (7221, 14373), (9679, 14346), (9759, 14334), (9648, 14294), (9539, 14373), (9546, 14344), (9621, 14302), (9687, 14354), (7342, 14362), (9645, 14320), (9564, 14395), (9724, 14389), (9554, 14257), (9395, 14251), (9645, 14399)]
         : compromised: 0.5068, honest: 0.6702
         : sketchguard stats = ['Node 0: acc_rate=0.887', 'Node 1: acc_rate=0.918', 'Node 2: acc_rate=0.850']...

=== FINAL RESULTS ===
Dataset: sent140, Nodes: 20, Graph: erdos, Aggregation: sketchguard
Attack: backdoor, 10.0% compromised
Final accuracy - Compromised: 0.5068, Honest: 0.6702
Overall test accuracy: mean=0.6539 ± 0.0495

=== BACKDOOR ATTACK SUCCESS RATE (ASR) ===
Target label: 1
Trigger size: 3x3
Overall ASR: 0.5075 ± 0.0718
Honest nodes ASR: 0.5003 ± 0.0619
Compromised nodes ASR: 0.5720 ± 0.1111
Note: Higher ASR indicates more successful backdoor attack

=== Sketchguard SUMMARY ===
Node 0: acceptance=0.887
Node 1: acceptance=0.918
Node 2: acceptance=0.850
Node 3: acceptance=0.887
Node 4: acceptance=0.918
Node 5: acceptance=0.600
Node 6: acceptance=0.871
Node 7: acceptance=0.936
Node 8: acceptance=0.820
Node 9: acceptance=0.931
Node 10: acceptance=0.900
Node 11: acceptance=0.871
Node 12: acceptance=0.925
Node 13: acceptance=0.600
Node 14: acceptance=0.880
Node 15: acceptance=0.918
Node 16: acceptance=0.931
Node 17: acceptance=0.900
Node 18: acceptance=0.887
Node 19: acceptance=0.887

=== PARALLEL EXECUTION TIME (realistic for distributed system) ===
  COMMUNICATION (max across nodes):
    - Sketch transfer: 0.000s (0.0%)
    - Model fetch (accepted): 0.000s (0.0%)
  COMPUTATION (max across nodes):
    - Sketching: 0.514s (94.8%)
    - Filtering: 0.001s (0.2%)
    - Aggregation: 0.027s (5.0%)
  TOTALS:
    - Total computation: 0.542s (100.0%)
    - Total communication: 0.000s (0.0%)
    - Total parallel time: 0.542s

=== PER-NODE AVERAGE TIME ===
  - Sketching: 0.418s
  - Filtering: 0.001s
  - Aggregation: 0.019s
  - Sketch transfer: 0.000s
  - Model fetch: 0.000s
  - Total per node: 0.438s

=== TOTAL COMPUTATIONAL WORK (sum across all nodes) ===
  - Total sketching: 8.364s
  - Total filtering: 0.013s
  - Total aggregation: 0.381s
  - Total sketch transfer: 0.000s
  - Total model fetch: 0.000s
  - Grand total: 8.757s
  - Mean acceptance rate: 0.866

Sketchguard Algorithm Properties:
  - Original dimension: 1,174,986
  - Sketch size: 180
  - Compression ratio: 19.9x
  - Single repetition: No repetitions needed
  - Theoretical complexity: O(d + N×k)
  - Approach: Sketch filtering + state aggregation
