Device: cuda
Seed: 987654321
Loading 1 LEAF Sent140 train files...
LEAF Sent140 train: 254555 users, 908652 samples
Building vocabulary (max_size=10000)...
Vocabulary size: 10000
Loading 1 LEAF Sent140 test files...
LEAF Sent140 test: 254555 users, 286281 samples
Found 254555 train users, 254555 test users, 254555 common users
User sample counts range: 494 (max) to 1 (min)
Distributed ALL 254555 users across 20 clients
Users per client: 12727 (with 15 clients getting +1 user)
Train partition sizes: [44353, 44290, 44657, 44907, 44696, 45843, 45801, 45619, 45069, 45639, 45821, 45311, 45779, 46056, 45625, 45984, 46428, 44737, 45540, 46497]
Test partition sizes: [14232, 14235, 14266, 14217, 14238, 14373, 14346, 14334, 14294, 14373, 14344, 14302, 14354, 14362, 14320, 14395, 14389, 14257, 14251, 14399]
  Client 0: 44353 train samples, 2 unique classes
  Client 1: 44290 train samples, 2 unique classes
  Client 2: 44657 train samples, 2 unique classes
  Client 3: 44907 train samples, 2 unique classes
  Client 4: 44696 train samples, 2 unique classes
  Client 5: 45843 train samples, 2 unique classes
  Client 6: 45801 train samples, 2 unique classes
  Client 7: 45619 train samples, 2 unique classes
  Client 8: 45069 train samples, 2 unique classes
  Client 9: 45639 train samples, 2 unique classes
  Client 10: 45821 train samples, 2 unique classes
  Client 11: 45311 train samples, 2 unique classes
  Client 12: 45779 train samples, 2 unique classes
  Client 13: 46056 train samples, 2 unique classes
  Client 14: 45625 train samples, 2 unique classes
  Client 15: 45984 train samples, 2 unique classes
  Client 16: 46428 train samples, 2 unique classes
  Client 17: 44737 train samples, 2 unique classes
  Client 18: 45540 train samples, 2 unique classes
  Client 19: 46497 train samples, 2 unique classes
Will sample 4500 samples per client per epoch
Graph: ring, nodes: 20, edges: 20
Degree statistics: avg=2.00, min=2, max=2
Attack: Compromised 8/20 nodes: [1, 5, 11, 12, 13, 14, 17, 18]
Attack type: backdoor, lambda: 1.0
Backdoor target label: 1, trigger size: 3
Model variant: baseline
Model parameters: 1,174,986
BALANCE algorithm:
Balance Config: BALANCEConfig(gamma=2, kappa=1, alpha=0.5, min_neighbors=1)
  - Model dimension: 1,174,986 parameters
  - Complexity: O(N×d) = O(20×1,174,986)
Initial test acc across nodes: mean=0.4965 ± 0.0152
Backdoor attack: Created poisoned datasets for 8 compromised nodes
Round 001: test acc mean=0.5066 ± 0.0167 | min=0.4894 max=0.5544
         : test loss mean=18.1031 ± 22.1100
         : individual accs = ['0.489390', '0.496171', '0.515491', '0.554407', '0.504214', '0.496486', '0.509898', '0.526441', '0.518679', '0.540110', '0.500767', '0.490281', '0.501463', '0.504874', '0.498534', '0.502813', '0.489749', '0.503472', '0.495404', '0.493298']
         : correct/total = [(6965, 14232), (7063, 14235), (7354, 14266), (7882, 14217), (7179, 14238), (7136, 14373), (7315, 14346), (7546, 14334), (7414, 14294), (7763, 14373), (7183, 14344), (7012, 14302), (7198, 14354), (7251, 14362), (7139, 14320), (7238, 14395), (7047, 14389), (7178, 14257), (7060, 14251), (7103, 14399)]
         : compromised: 0.4983, honest: 0.5121
Round 002: test acc mean=0.4995 ± 0.0080 | min=0.4798 max=0.5103
         : test loss mean=608.1326 ± 768.0749
         : individual accs = ['0.483066', '0.501581', '0.497757', '0.479778', '0.508428', '0.505322', '0.500836', '0.504604', '0.488597', '0.507688', '0.501046', '0.501958', '0.496865', '0.503064', '0.500000', '0.495241', '0.497880', '0.510276', '0.509789', '0.496284']
         : correct/total = [(6875, 14232), (7140, 14235), (7101, 14266), (6821, 14217), (7239, 14238), (7263, 14373), (7185, 14346), (7233, 14334), (6984, 14294), (7297, 14373), (7187, 14344), (7179, 14302), (7132, 14354), (7225, 14362), (7160, 14320), (7129, 14395), (7164, 14389), (7275, 14257), (7265, 14251), (7146, 14399)]
         : compromised: 0.5036, honest: 0.4968
Round 003: test acc mean=0.5020 ± 0.0081 | min=0.4859 max=0.5145
         : test loss mean=71908.8726 ± 147707.4579
         : individual accs = ['0.508432', '0.497928', '0.512407', '0.513892', '0.497050', '0.494330', '0.503625', '0.504744', '0.509235', '0.514506', '0.504322', '0.490771', '0.485858', '0.509818', '0.507053', '0.493574', '0.490653', '0.501929', '0.498912', '0.501910']
         : correct/total = [(7236, 14232), (7088, 14235), (7310, 14266), (7306, 14217), (7077, 14238), (7105, 14373), (7225, 14346), (7235, 14334), (7279, 14294), (7395, 14373), (7234, 14344), (7019, 14302), (6974, 14354), (7322, 14362), (7261, 14320), (7105, 14395), (7060, 14389), (7156, 14257), (7110, 14251), (7227, 14399)]
         : compromised: 0.4983, honest: 0.5045
Round 004: test acc mean=0.5050 ± 0.0092 | min=0.4865 max=0.5205
         : test loss mean=4047142.2012 ± 5073977.8055
         : individual accs = ['0.515528', '0.496382', '0.508692', '0.513329', '0.486515', '0.499339', '0.504740', '0.509976', '0.512243', '0.509706', '0.515407', '0.505384', '0.503901', '0.495753', '0.504050', '0.500313', '0.520467', '0.491618', '0.491053', '0.515591']
         : correct/total = [(7337, 14232), (7066, 14235), (7257, 14266), (7298, 14217), (6927, 14238), (7177, 14373), (7241, 14346), (7310, 14334), (7322, 14294), (7326, 14373), (7393, 14344), (7228, 14302), (7233, 14354), (7120, 14362), (7218, 14320), (7202, 14395), (7489, 14389), (7009, 14257), (6998, 14251), (7424, 14399)]
         : compromised: 0.4984, honest: 0.5094
Round 005: test acc mean=0.5022 ± 0.0094 | min=0.4912 max=0.5316
         : test loss mean=307419777.8430 ± 392686624.4317
         : individual accs = ['0.503302', '0.496452', '0.512758', '0.504044', '0.513977', '0.497043', '0.503346', '0.491210', '0.513642', '0.531552', '0.500349', '0.505314', '0.500766', '0.497911', '0.492458', '0.497534', '0.496490', '0.493863', '0.497088', '0.494479']
         : correct/total = [(7163, 14232), (7067, 14235), (7315, 14266), (7166, 14217), (7318, 14238), (7144, 14373), (7221, 14346), (7041, 14334), (7342, 14294), (7640, 14373), (7177, 14344), (7227, 14302), (7188, 14354), (7151, 14362), (7052, 14320), (7162, 14395), (7144, 14389), (7041, 14257), (7084, 14251), (7120, 14399)]
         : compromised: 0.4976, honest: 0.5052
Round 006: test acc mean=0.5065 ± 0.0139 | min=0.4825 max=0.5541
         : test loss mean=24054305263.0210 ± 30499673124.5867
         : individual accs = ['0.502389', '0.482473', '0.499509', '0.499472', '0.508639', '0.501078', '0.505925', '0.501116', '0.554079', '0.523273', '0.515407', '0.500350', '0.503483', '0.513647', '0.503561', '0.508857', '0.506359', '0.488041', '0.508315', '0.503229']
         : correct/total = [(7150, 14232), (6868, 14235), (7126, 14266), (7101, 14217), (7242, 14238), (7202, 14373), (7258, 14346), (7183, 14334), (7920, 14294), (7521, 14373), (7393, 14344), (7156, 14302), (7227, 14354), (7377, 14362), (7211, 14320), (7325, 14395), (7286, 14389), (6958, 14257), (7244, 14251), (7246, 14399)]
         : compromised: 0.5001, honest: 0.5107
Round 007: test acc mean=0.5046 ± 0.0092 | min=0.4960 max=0.5367
         : test loss mean=1909661671459.0027 ± 2493988953872.9375
         : individual accs = ['0.504848', '0.500035', '0.507290', '0.497081', '0.509973', '0.496278', '0.513384', '0.496791', '0.536729', '0.505462', '0.515128', '0.505104', '0.497701', '0.495962', '0.506564', '0.498437', '0.497880', '0.503893', '0.503123', '0.499826']
         : correct/total = [(7185, 14232), (7118, 14235), (7237, 14266), (7067, 14217), (7261, 14238), (7133, 14373), (7365, 14346), (7121, 14334), (7672, 14294), (7265, 14373), (7389, 14344), (7224, 14302), (7144, 14354), (7123, 14362), (7254, 14320), (7175, 14395), (7164, 14389), (7184, 14257), (7170, 14251), (7197, 14399)]
         : compromised: 0.5011, honest: 0.5069
Round 008: test acc mean=0.5025 ± 0.0071 | min=0.4920 max=0.5256
         : test loss mean=168094119042361.9688 ± 218968225164615.5000
         : individual accs = ['0.499368', '0.492799', '0.506239', '0.505803', '0.502669', '0.492034', '0.499094', '0.504395', '0.525605', '0.507966', '0.497560', '0.492379', '0.500557', '0.506267', '0.507053', '0.501355', '0.503718', '0.499193', '0.502842', '0.503993']
         : correct/total = [(7107, 14232), (7015, 14235), (7222, 14266), (7191, 14217), (7157, 14238), (7072, 14373), (7160, 14346), (7230, 14334), (7513, 14294), (7301, 14373), (7137, 14344), (7042, 14302), (7185, 14354), (7271, 14362), (7261, 14320), (7217, 14395), (7248, 14389), (7117, 14257), (7166, 14251), (7257, 14399)]
         : compromised: 0.4991, honest: 0.5048
Round 009: test acc mean=0.5046 ± 0.0053 | min=0.4941 max=0.5164
         : test loss mean=14692804281985094.0000 ± 19472758704685704.0000
         : individual accs = ['0.507378', '0.504250', '0.507360', '0.511922', '0.498736', '0.494121', '0.511571', '0.502860', '0.516440', '0.501148', '0.506065', '0.506433', '0.511216', '0.507381', '0.499511', '0.500452', '0.502050', '0.498913', '0.502210', '0.501354']
         : correct/total = [(7221, 14232), (7178, 14235), (7238, 14266), (7278, 14217), (7101, 14238), (7102, 14373), (7339, 14346), (7208, 14334), (7382, 14294), (7203, 14373), (7259, 14344), (7243, 14302), (7338, 14354), (7287, 14362), (7153, 14320), (7204, 14395), (7224, 14389), (7113, 14257), (7157, 14251), (7219, 14399)]
         : compromised: 0.5030, honest: 0.5056
Round 010: test acc mean=0.5023 ± 0.0075 | min=0.4846 max=0.5182
         : test loss mean=1190084620504279808.0000 ± 1537727031005323776.0000
         : individual accs = ['0.486650', '0.499333', '0.501612', '0.503271', '0.499789', '0.497878', '0.504670', '0.506907', '0.513852', '0.505462', '0.502091', '0.498112', '0.505713', '0.518243', '0.503771', '0.499548', '0.500035', '0.503121', '0.510912', '0.484617']
         : correct/total = [(6926, 14232), (7108, 14235), (7156, 14266), (7155, 14217), (7116, 14238), (7156, 14373), (7240, 14346), (7266, 14334), (7345, 14294), (7265, 14373), (7202, 14344), (7124, 14302), (7259, 14354), (7443, 14362), (7214, 14320), (7191, 14395), (7195, 14389), (7173, 14257), (7281, 14251), (6978, 14399)]
         : compromised: 0.5046, honest: 0.5007

=== FINAL RESULTS ===
Dataset: sent140, Nodes: 20, Graph: ring, Aggregation: balance
Attack: backdoor, 40.0% compromised
Final accuracy - Compromised: 0.5046, Honest: 0.5007
Overall test accuracy: mean=0.5023 ± 0.0075

=== BACKDOOR ATTACK SUCCESS RATE (ASR) ===
Target label: 1
Trigger size: 3x3
Overall ASR: 0.7546 ± 0.2426
Honest nodes ASR: 0.6008 ± 0.1970
Compromised nodes ASR: 0.9852 ± 0.0163
Note: Higher ASR indicates more successful backdoor attack

=== BALANCE SUMMARY ===
Node 0: acceptance=0.800
Node 1: acceptance=0.800
Node 2: acceptance=1.000
Node 3: acceptance=1.000
Node 4: acceptance=1.000
Node 5: acceptance=0.800
Node 6: acceptance=1.000
Node 7: acceptance=1.000
Node 8: acceptance=1.000
Node 9: acceptance=1.000
Node 10: acceptance=1.000
Node 11: acceptance=0.800
Node 12: acceptance=0.900
Node 13: acceptance=0.900
Node 14: acceptance=0.800
Node 15: acceptance=0.800
Node 16: acceptance=0.800
Node 17: acceptance=0.800
Node 18: acceptance=0.800
Node 19: acceptance=0.800

=== PARALLEL EXECUTION TIME (realistic for distributed system) ===
  COMMUNICATION (max across nodes):
    - Full model transfer: 0.000s (0.0%)
  COMPUTATION (max across nodes):
    - Filtering: 0.019s (60.7%)
    - Aggregation: 0.012s (39.3%)
  TOTALS:
    - Total computation: 0.031s (100.0%)
    - Total communication: 0.000s (0.0%)
    - Total parallel time: 0.031s

=== PER-NODE AVERAGE TIME ===
  - Filtering: 0.012s
  - Aggregation: 0.005s
  - Model transfer: 0.000s
  - Total per node: 0.018s

=== TOTAL COMPUTATIONAL WORK (sum across all nodes) ===
  - Total filtering: 0.248s
  - Total aggregation: 0.107s
  - Total model transfer: 0.000s
  - Grand total: 0.355s
  - Mean acceptance rate: 0.890

BALANCE Algorithm Properties:
  - Model dimension: 1,174,986
  - No compression: Full parameter comparison
  - Theoretical complexity: O(deg(i)×d)
  - Approach: Full parameter filtering + averaging
