Device: cuda
Seed: 987654321
Loading 1 LEAF Sent140 train files...
LEAF Sent140 train: 254555 users, 908652 samples
Building vocabulary (max_size=10000)...
Vocabulary size: 10000
Loading 1 LEAF Sent140 test files...
LEAF Sent140 test: 254555 users, 286281 samples
Found 254555 train users, 254555 test users, 254555 common users
User sample counts range: 494 (max) to 1 (min)
Distributed ALL 254555 users across 20 clients
Users per client: 12727 (with 15 clients getting +1 user)
Train partition sizes: [44353, 44290, 44657, 44907, 44696, 45843, 45801, 45619, 45069, 45639, 45821, 45311, 45779, 46056, 45625, 45984, 46428, 44737, 45540, 46497]
Test partition sizes: [14232, 14235, 14266, 14217, 14238, 14373, 14346, 14334, 14294, 14373, 14344, 14302, 14354, 14362, 14320, 14395, 14389, 14257, 14251, 14399]
  Client 0: 44353 train samples, 2 unique classes
  Client 1: 44290 train samples, 2 unique classes
  Client 2: 44657 train samples, 2 unique classes
  Client 3: 44907 train samples, 2 unique classes
  Client 4: 44696 train samples, 2 unique classes
  Client 5: 45843 train samples, 2 unique classes
  Client 6: 45801 train samples, 2 unique classes
  Client 7: 45619 train samples, 2 unique classes
  Client 8: 45069 train samples, 2 unique classes
  Client 9: 45639 train samples, 2 unique classes
  Client 10: 45821 train samples, 2 unique classes
  Client 11: 45311 train samples, 2 unique classes
  Client 12: 45779 train samples, 2 unique classes
  Client 13: 46056 train samples, 2 unique classes
  Client 14: 45625 train samples, 2 unique classes
  Client 15: 45984 train samples, 2 unique classes
  Client 16: 46428 train samples, 2 unique classes
  Client 17: 44737 train samples, 2 unique classes
  Client 18: 45540 train samples, 2 unique classes
  Client 19: 46497 train samples, 2 unique classes
Will sample 4500 samples per client per epoch
Graph: ring, nodes: 20, edges: 20
Degree statistics: avg=2.00, min=2, max=2
Attack: Compromised 14/20 nodes: [1, 2, 3, 5, 6, 8, 11, 12, 13, 14, 15, 17, 18, 19]
Attack type: backdoor, lambda: 1.0
Backdoor target label: 1, trigger size: 3
Model variant: baseline
Model parameters: 1,174,986
Initial test acc across nodes: mean=0.4965 ± 0.0152
Backdoor attack: Created poisoned datasets for 14 compromised nodes
Round 001: test acc mean=0.5008 ± 0.0096 | min=0.4858 max=0.5216
         : test loss mean=15.4571 ± 13.8277
         : individual accs = ['0.503373', '0.511275', '0.486612', '0.496518', '0.509552', '0.499965', '0.513732', '0.493721', '0.521617', '0.498295', '0.485778', '0.497972', '0.498119', '0.507520', '0.499092', '0.496283', '0.514977', '0.502911', '0.489860', '0.488992']
         : correct/total = [(7164, 14232), (7278, 14235), (6942, 14266), (7059, 14217), (7255, 14238), (7186, 14373), (7370, 14346), (7077, 14334), (7456, 14294), (7162, 14373), (6968, 14344), (7122, 14302), (7150, 14354), (7289, 14362), (7147, 14320), (7144, 14395), (7410, 14389), (7170, 14257), (6981, 14251), (7041, 14399)]
         : compromised: 0.5007, honest: 0.5009
Round 002: test acc mean=0.5043 ± 0.0069 | min=0.4876 max=0.5150
         : test loss mean=15.6935 ± 6.2069
         : individual accs = ['0.497892', '0.506147', '0.509183', '0.511360', '0.501545', '0.509010', '0.498257', '0.499093', '0.508955', '0.487581', '0.494702', '0.502168', '0.507176', '0.513995', '0.515014', '0.511914', '0.509486', '0.499965', '0.503894', '0.498437']
         : correct/total = [(7086, 14232), (7205, 14235), (7264, 14266), (7270, 14217), (7141, 14238), (7316, 14373), (7148, 14346), (7154, 14334), (7275, 14294), (7008, 14373), (7096, 14344), (7182, 14302), (7280, 14354), (7382, 14362), (7375, 14320), (7369, 14395), (7331, 14389), (7128, 14257), (7181, 14251), (7177, 14399)]
         : compromised: 0.5068, honest: 0.4984
Round 003: test acc mean=0.5044 ± 0.0084 | min=0.4940 max=0.5237
         : test loss mean=36.9117 ± 31.3781
         : individual accs = ['0.495011', '0.494977', '0.504767', '0.523739', '0.520930', '0.519516', '0.505158', '0.499163', '0.508045', '0.505044', '0.499721', '0.506852', '0.499582', '0.509678', '0.497696', '0.504898', '0.503301', '0.496247', '0.494000', '0.500104']
         : correct/total = [(7045, 14232), (7046, 14235), (7201, 14266), (7446, 14217), (7417, 14238), (7467, 14373), (7247, 14346), (7155, 14334), (7262, 14294), (7259, 14373), (7168, 14344), (7249, 14302), (7171, 14354), (7320, 14362), (7127, 14320), (7268, 14395), (7242, 14389), (7075, 14257), (7040, 14251), (7201, 14399)]
         : compromised: 0.5047, honest: 0.5039
Round 004: test acc mean=0.5029 ± 0.0055 | min=0.4889 max=0.5102
         : test loss mean=256.6421 ± 346.3113
         : individual accs = ['0.504427', '0.506358', '0.488925', '0.507772', '0.505900', '0.506088', '0.502370', '0.504674', '0.510214', '0.509358', '0.504601', '0.507551', '0.500000', '0.508077', '0.500070', '0.501216', '0.500035', '0.497931', '0.490702', '0.501771']
         : correct/total = [(7179, 14232), (7208, 14235), (6975, 14266), (7219, 14217), (7203, 14238), (7274, 14373), (7207, 14346), (7234, 14334), (7293, 14294), (7321, 14373), (7238, 14344), (7259, 14302), (7177, 14354), (7297, 14362), (7161, 14320), (7215, 14395), (7195, 14389), (7099, 14257), (6993, 14251), (7225, 14399)]
         : compromised: 0.5021, honest: 0.5048
Round 005: test acc mean=0.5014 ± 0.0062 | min=0.4880 max=0.5103
         : test loss mean=577.3260 ± 941.9384
         : individual accs = ['0.504356', '0.508676', '0.503295', '0.510305', '0.509482', '0.507618', '0.497979', '0.493582', '0.504477', '0.509984', '0.504113', '0.502447', '0.494427', '0.488024', '0.499930', '0.494894', '0.498089', '0.492740', '0.503333', '0.499618']
         : correct/total = [(7178, 14232), (7241, 14235), (7180, 14266), (7255, 14217), (7254, 14238), (7296, 14373), (7144, 14346), (7075, 14334), (7211, 14294), (7330, 14373), (7231, 14344), (7186, 14302), (7097, 14354), (7009, 14362), (7159, 14320), (7124, 14395), (7167, 14389), (7025, 14257), (7173, 14251), (7194, 14399)]
         : compromised: 0.5006, honest: 0.5033
Round 006: test acc mean=0.5035 ± 0.0064 | min=0.4892 max=0.5136
         : test loss mean=5534.2122 ± 9415.1415
         : individual accs = ['0.511031', '0.513593', '0.489205', '0.507772', '0.505900', '0.506157', '0.502579', '0.504465', '0.510914', '0.507131', '0.500906', '0.507901', '0.502717', '0.510723', '0.495461', '0.501633', '0.500243', '0.496949', '0.491123', '0.503438']
         : correct/total = [(7273, 14232), (7311, 14235), (6979, 14266), (7219, 14217), (7203, 14238), (7275, 14373), (7210, 14346), (7231, 14334), (7303, 14294), (7289, 14373), (7185, 14344), (7264, 14302), (7216, 14354), (7335, 14362), (7095, 14320), (7221, 14395), (7198, 14389), (7085, 14257), (6999, 14251), (7249, 14399)]
         : compromised: 0.5029, honest: 0.5049
Round 007: test acc mean=0.5002 ± 0.0077 | min=0.4854 max=0.5133
         : test loss mean=58217.2125 ± 100794.1538
         : individual accs = ['0.490936', '0.485423', '0.513318', '0.505662', '0.513064', '0.503722', '0.502021', '0.504674', '0.493634', '0.496695', '0.490379', '0.499231', '0.500418', '0.491018', '0.504050', '0.506287', '0.498784', '0.501789', '0.510912', '0.491701']
         : correct/total = [(6987, 14232), (6910, 14235), (7323, 14266), (7189, 14217), (7305, 14238), (7240, 14373), (7202, 14346), (7234, 14334), (7056, 14294), (7139, 14373), (7034, 14344), (7140, 14302), (7183, 14354), (7052, 14362), (7218, 14320), (7288, 14395), (7177, 14389), (7154, 14257), (7281, 14251), (7080, 14399)]
         : compromised: 0.5007, honest: 0.4991
Round 008: test acc mean=0.5036 ± 0.0063 | min=0.4889 max=0.5138
         : test loss mean=308988.9094 ± 535071.8754
         : individual accs = ['0.510891', '0.513804', '0.488925', '0.507843', '0.505970', '0.506157', '0.502440', '0.504814', '0.511543', '0.506992', '0.500976', '0.507971', '0.501742', '0.510096', '0.498254', '0.501633', '0.500243', '0.496949', '0.490773', '0.503646']
         : correct/total = [(7271, 14232), (7314, 14235), (6975, 14266), (7220, 14217), (7204, 14238), (7275, 14373), (7208, 14346), (7236, 14334), (7312, 14294), (7287, 14373), (7186, 14344), (7265, 14302), (7202, 14354), (7326, 14362), (7135, 14320), (7221, 14395), (7198, 14389), (7085, 14257), (6994, 14251), (7252, 14399)]
         : compromised: 0.5030, honest: 0.5050
Round 009: test acc mean=0.4980 ± 0.0076 | min=0.4865 max=0.5147
         : test loss mean=1283002.6550 ± 2222755.6899
         : individual accs = ['0.490233', '0.487601', '0.514650', '0.492861', '0.498385', '0.486537', '0.498048', '0.495465', '0.493074', '0.488485', '0.497978', '0.509090', '0.501045', '0.490879', '0.504120', '0.498367', '0.499826', '0.503051', '0.511754', '0.498160']
         : correct/total = [(6977, 14232), (6941, 14235), (7342, 14266), (7007, 14217), (7096, 14238), (6993, 14373), (7145, 14346), (7102, 14334), (7048, 14294), (7021, 14373), (7143, 14344), (7281, 14302), (7192, 14354), (7050, 14362), (7219, 14320), (7174, 14395), (7192, 14389), (7172, 14257), (7293, 14251), (7173, 14399)]
         : compromised: 0.4992, honest: 0.4951
Round 010: test acc mean=0.5020 ± 0.0076 | min=0.4881 max=0.5137
         : test loss mean=2910362.2006 ± 5040755.2170
         : individual accs = ['0.510891', '0.513734', '0.488434', '0.507772', '0.505900', '0.506157', '0.502440', '0.504814', '0.511543', '0.506992', '0.500976', '0.507971', '0.489411', '0.502715', '0.490154', '0.501633', '0.500243', '0.496949', '0.488106', '0.503646']
         : correct/total = [(7271, 14232), (7313, 14235), (6968, 14266), (7219, 14217), (7203, 14238), (7275, 14373), (7208, 14346), (7236, 14334), (7312, 14294), (7287, 14373), (7186, 14344), (7265, 14302), (7025, 14354), (7220, 14362), (7019, 14320), (7221, 14395), (7198, 14389), (7085, 14257), (6956, 14251), (7252, 14399)]
         : compromised: 0.5008, honest: 0.5050

=== FINAL RESULTS ===
Dataset: sent140, Nodes: 20, Graph: ring, Aggregation: d-fedavg
Attack: backdoor, 70.0% compromised
Final accuracy - Compromised: 0.5008, Honest: 0.5050
Overall test accuracy: mean=0.5020 ± 0.0076

=== BACKDOOR ATTACK SUCCESS RATE (ASR) ===
Target label: 1
Trigger size: 3x3
Overall ASR: 0.2496 ± 0.4323
Honest nodes ASR: 0.0000 ± 0.0000
Compromised nodes ASR: 0.3566 ± 0.4784
Note: Higher ASR indicates more successful backdoor attack
