Device: cuda
Seed: 987654321
Loading 1 LEAF Sent140 train files...
LEAF Sent140 train: 254555 users, 908652 samples
Building vocabulary (max_size=10000)...
Vocabulary size: 10000
Loading 1 LEAF Sent140 test files...
LEAF Sent140 test: 254555 users, 286281 samples
Found 254555 train users, 254555 test users, 254555 common users
User sample counts range: 494 (max) to 1 (min)
Distributed ALL 254555 users across 20 clients
Users per client: 12727 (with 15 clients getting +1 user)
Train partition sizes: [44353, 44290, 44657, 44907, 44696, 45843, 45801, 45619, 45069, 45639, 45821, 45311, 45779, 46056, 45625, 45984, 46428, 44737, 45540, 46497]
Test partition sizes: [14232, 14235, 14266, 14217, 14238, 14373, 14346, 14334, 14294, 14373, 14344, 14302, 14354, 14362, 14320, 14395, 14389, 14257, 14251, 14399]
  Client 0: 44353 train samples, 2 unique classes
  Client 1: 44290 train samples, 2 unique classes
  Client 2: 44657 train samples, 2 unique classes
  Client 3: 44907 train samples, 2 unique classes
  Client 4: 44696 train samples, 2 unique classes
  Client 5: 45843 train samples, 2 unique classes
  Client 6: 45801 train samples, 2 unique classes
  Client 7: 45619 train samples, 2 unique classes
  Client 8: 45069 train samples, 2 unique classes
  Client 9: 45639 train samples, 2 unique classes
  Client 10: 45821 train samples, 2 unique classes
  Client 11: 45311 train samples, 2 unique classes
  Client 12: 45779 train samples, 2 unique classes
  Client 13: 46056 train samples, 2 unique classes
  Client 14: 45625 train samples, 2 unique classes
  Client 15: 45984 train samples, 2 unique classes
  Client 16: 46428 train samples, 2 unique classes
  Client 17: 44737 train samples, 2 unique classes
  Client 18: 45540 train samples, 2 unique classes
  Client 19: 46497 train samples, 2 unique classes
Will sample 4500 samples per client per epoch
Graph: erdos, nodes: 20, edges: 126
Degree statistics: avg=12.60, min=8, max=16
Attack: Compromised 2/20 nodes: [5, 13]
Attack type: directed_deviation, lambda: 1.0
Model variant: baseline
Model parameters: 1,174,986
Initial test acc across nodes: mean=0.4953 ± 0.0174
Round 001: test acc mean=0.5032 ± 0.0106 | min=0.4830 max=0.5291
         : test loss mean=0.7403 ± 0.0648
         : individual accs = ['0.519815', '0.516965', '0.498949', '0.529085', '0.495716', '0.500870', '0.506831', '0.501605', '0.507066', '0.504557', '0.501394', '0.510138', '0.497771', '0.488720', '0.483031', '0.499340', '0.492529', '0.513642', '0.494632', '0.501354']
         : correct/total = [(7398, 14232), (7359, 14235), (7118, 14266), (7522, 14217), (7058, 14238), (7199, 14373), (7271, 14346), (7190, 14334), (7248, 14294), (7252, 14373), (7192, 14344), (7296, 14302), (7145, 14354), (7019, 14362), (6917, 14320), (7188, 14395), (7087, 14389), (7323, 14257), (7049, 14251), (7219, 14399)]
         : compromised: 0.4948, honest: 0.5041
Round 002: test acc mean=0.4997 ± 0.0088 | min=0.4819 max=0.5170
         : test loss mean=0.7384 ± 0.0432
         : individual accs = ['0.504708', '0.516965', '0.501262', '0.503411', '0.505478', '0.499200', '0.486198', '0.507255', '0.484679', '0.504766', '0.481874', '0.496993', '0.497144', '0.485030', '0.506983', '0.502258', '0.507471', '0.501438', '0.501860', '0.499687']
         : correct/total = [(7183, 14232), (7359, 14235), (7151, 14266), (7157, 14217), (7197, 14238), (7175, 14373), (6975, 14346), (7271, 14334), (6928, 14294), (7255, 14373), (6912, 14344), (7108, 14302), (7136, 14354), (6966, 14362), (7260, 14320), (7230, 14395), (7302, 14389), (7149, 14257), (7152, 14251), (7195, 14399)]
         : compromised: 0.4921, honest: 0.5006
Round 003: test acc mean=0.5026 ± 0.0116 | min=0.4791 max=0.5301
         : test loss mean=0.6930 ± 0.0006
         : individual accs = ['0.492622', '0.516965', '0.479111', '0.530140', '0.505408', '0.495860', '0.499164', '0.507814', '0.489856', '0.508662', '0.501603', '0.493707', '0.497701', '0.506824', '0.492598', '0.522265', '0.512336', '0.504735', '0.495614', '0.498090']
         : correct/total = [(7011, 14232), (7359, 14235), (6835, 14266), (7537, 14217), (7196, 14238), (7127, 14373), (7161, 14346), (7279, 14334), (7002, 14294), (7311, 14373), (7195, 14344), (7061, 14302), (7144, 14354), (7279, 14362), (7054, 14320), (7518, 14395), (7372, 14389), (7196, 14257), (7063, 14251), (7172, 14399)]
         : compromised: 0.5013, honest: 0.5027
Round 004: test acc mean=0.5875 ± 0.0116 | min=0.5478 max=0.6003
         : test loss mean=0.6740 ± 0.0077
         : individual accs = ['0.599424', '0.591851', '0.577457', '0.595906', '0.581332', '0.594865', '0.585878', '0.588461', '0.547782', '0.573784', '0.592791', '0.594882', '0.579351', '0.588637', '0.600349', '0.589580', '0.583640', '0.596970', '0.590485', '0.595805']
         : correct/total = [(8531, 14232), (8425, 14235), (8238, 14266), (8472, 14217), (8277, 14238), (8550, 14373), (8405, 14346), (8435, 14334), (7830, 14294), (8247, 14373), (8503, 14344), (8508, 14302), (8316, 14354), (8454, 14362), (8597, 14320), (8487, 14395), (8398, 14389), (8511, 14257), (8415, 14251), (8579, 14399)]
         : compromised: 0.5918, honest: 0.5870
Round 005: test acc mean=0.5695 ± 0.0405 | min=0.5025 max=0.6334
         : test loss mean=0.6880 ± 0.0043
         : individual accs = ['0.547007', '0.614050', '0.561755', '0.580080', '0.581753', '0.502539', '0.572285', '0.633389', '0.549321', '0.604328', '0.618935', '0.531045', '0.614393', '0.519844', '0.511802', '0.603265', '0.625547', '0.520727', '0.531682', '0.566845']
         : correct/total = [(7785, 14232), (8741, 14235), (8014, 14266), (8247, 14217), (8283, 14238), (7223, 14373), (8210, 14346), (9079, 14334), (7852, 14294), (8686, 14373), (8878, 14344), (7595, 14302), (8819, 14354), (7466, 14362), (7329, 14320), (8684, 14395), (9001, 14389), (7424, 14257), (7577, 14251), (8162, 14399)]
         : compromised: 0.5112, honest: 0.5760
Round 006: test acc mean=0.6181 ± 0.0042 | min=0.6126 max=0.6293
         : test loss mean=0.6667 ± 0.0125
         : individual accs = ['0.621417', '0.629294', '0.612716', '0.620947', '0.618837', '0.618799', '0.612575', '0.614483', '0.613894', '0.617408', '0.615379', '0.617186', '0.615787', '0.612728', '0.623813', '0.617645', '0.622976', '0.617241', '0.617360', '0.621988']
         : correct/total = [(8844, 14232), (8958, 14235), (8741, 14266), (8828, 14217), (8811, 14238), (8894, 14373), (8788, 14346), (8808, 14334), (8775, 14294), (8874, 14373), (8827, 14344), (8827, 14302), (8839, 14354), (8800, 14362), (8933, 14320), (8891, 14395), (8964, 14389), (8800, 14257), (8798, 14251), (8956, 14399)]
         : compromised: 0.6158, honest: 0.6184
Round 007: test acc mean=0.6185 ± 0.0147 | min=0.5940 max=0.6473
         : test loss mean=0.6676 ± 0.0079
         : individual accs = ['0.602094', '0.638426', '0.612856', '0.613913', '0.635483', '0.608920', '0.608881', '0.647272', '0.608087', '0.634523', '0.624094', '0.618235', '0.640727', '0.607645', '0.605796', '0.623828', '0.632219', '0.605176', '0.593993', '0.607056']
         : correct/total = [(8569, 14232), (9088, 14235), (8743, 14266), (8728, 14217), (9048, 14238), (8752, 14373), (8735, 14346), (9278, 14334), (8692, 14294), (9120, 14373), (8952, 14344), (8842, 14302), (9197, 14354), (8727, 14362), (8675, 14320), (8980, 14395), (9097, 14389), (8628, 14257), (8465, 14251), (8741, 14399)]
         : compromised: 0.6083, honest: 0.6196
Round 008: test acc mean=0.6436 ± 0.0055 | min=0.6340 max=0.6522
         : test loss mean=0.6406 ± 0.0124
         : individual accs = ['0.645447', '0.649737', '0.633955', '0.649434', '0.650232', '0.646768', '0.636275', '0.646086', '0.633972', '0.639880', '0.642917', '0.640750', '0.641285', '0.635218', '0.647626', '0.648836', '0.652165', '0.642491', '0.642201', '0.646503']
         : correct/total = [(9186, 14232), (9249, 14235), (9044, 14266), (9233, 14217), (9258, 14238), (9296, 14373), (9128, 14346), (9261, 14334), (9062, 14294), (9197, 14373), (9222, 14344), (9164, 14302), (9205, 14354), (9123, 14362), (9274, 14320), (9340, 14395), (9384, 14389), (9160, 14257), (9152, 14251), (9309, 14399)]
         : compromised: 0.6410, honest: 0.6439
Round 009: test acc mean=0.6204 ± 0.0128 | min=0.5994 max=0.6463
         : test loss mean=0.6534 ± 0.0068
         : individual accs = ['0.600618', '0.612364', '0.624282', '0.620032', '0.621014', '0.608711', '0.623519', '0.646296', '0.628236', '0.628331', '0.599414', '0.630611', '0.637662', '0.624565', '0.612081', '0.630010', '0.638057', '0.609525', '0.603186', '0.609834']
         : correct/total = [(8548, 14232), (8717, 14235), (8906, 14266), (8815, 14217), (8842, 14238), (8749, 14373), (8945, 14346), (9264, 14334), (8980, 14294), (9031, 14373), (8598, 14344), (9019, 14302), (9153, 14354), (8970, 14362), (8765, 14320), (9069, 14395), (9181, 14389), (8690, 14257), (8596, 14251), (8781, 14399)]
         : compromised: 0.6166, honest: 0.6208
Round 010: test acc mean=0.6588 ± 0.0061 | min=0.6442 max=0.6676
         : test loss mean=0.6229 ± 0.0103
         : individual accs = ['0.660132', '0.664208', '0.645731', '0.666315', '0.666035', '0.661866', '0.655653', '0.661783', '0.644186', '0.657483', '0.658603', '0.656971', '0.658910', '0.650397', '0.660754', '0.662383', '0.667593', '0.657431', '0.656866', '0.663310']
         : correct/total = [(9395, 14232), (9455, 14235), (9212, 14266), (9473, 14217), (9483, 14238), (9513, 14373), (9406, 14346), (9486, 14334), (9208, 14294), (9450, 14373), (9447, 14344), (9396, 14302), (9458, 14354), (9341, 14362), (9462, 14320), (9535, 14395), (9606, 14389), (9373, 14257), (9361, 14251), (9551, 14399)]
         : compromised: 0.6561, honest: 0.6591

=== FINAL RESULTS ===
Dataset: sent140, Nodes: 20, Graph: erdos, Aggregation: d-fedavg
Attack: directed_deviation, 10.0% compromised
Final accuracy - Compromised: 0.6561, Honest: 0.6591
Overall test accuracy: mean=0.6588 ± 0.0061
