Device: cuda
Seed: 987654321
Loading 1 LEAF Sent140 train files...
LEAF Sent140 train: 254555 users, 908652 samples
Building vocabulary (max_size=10000)...
Vocabulary size: 10000
Loading 1 LEAF Sent140 test files...
LEAF Sent140 test: 254555 users, 286281 samples
Found 254555 train users, 254555 test users, 254555 common users
User sample counts range: 494 (max) to 1 (min)
Distributed ALL 254555 users across 20 clients
Users per client: 12727 (with 15 clients getting +1 user)
Train partition sizes: [44353, 44290, 44657, 44907, 44696, 45843, 45801, 45619, 45069, 45639, 45821, 45311, 45779, 46056, 45625, 45984, 46428, 44737, 45540, 46497]
Test partition sizes: [14232, 14235, 14266, 14217, 14238, 14373, 14346, 14334, 14294, 14373, 14344, 14302, 14354, 14362, 14320, 14395, 14389, 14257, 14251, 14399]
  Client 0: 44353 train samples, 2 unique classes
  Client 1: 44290 train samples, 2 unique classes
  Client 2: 44657 train samples, 2 unique classes
  Client 3: 44907 train samples, 2 unique classes
  Client 4: 44696 train samples, 2 unique classes
  Client 5: 45843 train samples, 2 unique classes
  Client 6: 45801 train samples, 2 unique classes
  Client 7: 45619 train samples, 2 unique classes
  Client 8: 45069 train samples, 2 unique classes
  Client 9: 45639 train samples, 2 unique classes
  Client 10: 45821 train samples, 2 unique classes
  Client 11: 45311 train samples, 2 unique classes
  Client 12: 45779 train samples, 2 unique classes
  Client 13: 46056 train samples, 2 unique classes
  Client 14: 45625 train samples, 2 unique classes
  Client 15: 45984 train samples, 2 unique classes
  Client 16: 46428 train samples, 2 unique classes
  Client 17: 44737 train samples, 2 unique classes
  Client 18: 45540 train samples, 2 unique classes
  Client 19: 46497 train samples, 2 unique classes
Will sample 4500 samples per client per epoch
Graph: erdos, nodes: 20, edges: 99
Degree statistics: avg=9.90, min=7, max=14
Attack: Compromised 4/20 nodes: [5, 12, 13, 17]
Attack type: backdoor, lambda: 1.0
Backdoor target label: 1, trigger size: 3
Model variant: baseline
Model parameters: 1,174,986
BALANCE algorithm:
Balance Config: BALANCEConfig(gamma=2, kappa=1, alpha=0.5, min_neighbors=1)
  - Model dimension: 1,174,986 parameters
  - Complexity: O(N×d) = O(20×1,174,986)
Initial test acc across nodes: mean=0.4965 ± 0.0152
Backdoor attack: Created poisoned datasets for 4 compromised nodes
Round 001: test acc mean=0.5046 ± 0.0219 | min=0.4846 max=0.5882
         : test loss mean=8.1630 ± 15.2534
         : individual accs = ['0.487282', '0.512750', '0.522781', '0.506647', '0.510395', '0.493564', '0.484595', '0.486536', '0.510424', '0.588186', '0.498466', '0.501259', '0.509126', '0.508425', '0.491201', '0.510733', '0.490653', '0.502280', '0.489229', '0.487673']
         : correct/total = [(6935, 14232), (7299, 14235), (7458, 14266), (7203, 14217), (7267, 14238), (7094, 14373), (6952, 14346), (6974, 14334), (7296, 14294), (8454, 14373), (7150, 14344), (7169, 14302), (7308, 14354), (7302, 14362), (7034, 14320), (7352, 14395), (7060, 14389), (7161, 14257), (6972, 14251), (7022, 14399)]
         : compromised: 0.5033, honest: 0.5049
Round 002: test acc mean=0.5091 ± 0.0128 | min=0.4859 max=0.5360
         : test loss mean=250.3784 ± 500.1561
         : individual accs = ['0.515739', '0.514015', '0.485911', '0.508124', '0.535960', '0.499756', '0.502021', '0.502093', '0.524486', '0.493008', '0.528165', '0.532233', '0.504389', '0.500000', '0.497346', '0.505523', '0.508027', '0.505436', '0.517297', '0.503438']
         : correct/total = [(7340, 14232), (7317, 14235), (6932, 14266), (7224, 14217), (7631, 14238), (7183, 14373), (7202, 14346), (7197, 14334), (7497, 14294), (7086, 14373), (7576, 14344), (7612, 14302), (7240, 14354), (7181, 14362), (7122, 14320), (7277, 14395), (7310, 14389), (7206, 14257), (7372, 14251), (7249, 14399)]
         : compromised: 0.5024, honest: 0.5108
Round 003: test acc mean=0.5113 ± 0.0189 | min=0.4861 max=0.5608
         : test loss mean=14045.3016 ± 28179.5751
         : individual accs = ['0.517004', '0.531788', '0.486051', '0.492439', '0.521562', '0.492173', '0.501115', '0.554974', '0.510494', '0.493008', '0.516104', '0.560761', '0.503483', '0.511001', '0.507821', '0.502466', '0.502050', '0.500526', '0.514420', '0.507674']
         : correct/total = [(7358, 14232), (7570, 14235), (6934, 14266), (7001, 14217), (7426, 14238), (7074, 14373), (7189, 14346), (7955, 14334), (7297, 14294), (7086, 14373), (7403, 14344), (8020, 14302), (7227, 14354), (7339, 14362), (7272, 14320), (7233, 14395), (7224, 14389), (7136, 14257), (7331, 14251), (7310, 14399)]
         : compromised: 0.5018, honest: 0.5137
Round 004: test acc mean=0.5037 ± 0.0193 | min=0.4860 max=0.5610
         : test loss mean=1608203.7999 ± 3249956.0304
         : individual accs = ['0.490795', '0.485985', '0.486051', '0.492228', '0.494030', '0.503722', '0.497560', '0.495326', '0.513782', '0.493008', '0.514919', '0.537967', '0.506409', '0.488302', '0.495810', '0.499340', '0.533533', '0.494634', '0.488597', '0.561011']
         : correct/total = [(6985, 14232), (6918, 14235), (6934, 14266), (6998, 14217), (7034, 14238), (7240, 14373), (7138, 14346), (7100, 14334), (7344, 14294), (7086, 14373), (7386, 14344), (7694, 14302), (7269, 14354), (7013, 14362), (7100, 14320), (7188, 14395), (7677, 14389), (7052, 14257), (6963, 14251), (8078, 14399)]
         : compromised: 0.4983, honest: 0.5050
Round 005: test acc mean=0.4949 ± 0.0062 | min=0.4861 max=0.5114
         : test loss mean=98973381.3389 ± 198795721.1654
         : individual accs = ['0.489109', '0.486266', '0.486051', '0.492228', '0.494100', '0.496069', '0.497560', '0.495186', '0.488107', '0.493008', '0.499024', '0.492029', '0.506270', '0.511419', '0.495810', '0.498367', '0.499757', '0.491969', '0.488738', '0.496562']
         : correct/total = [(6961, 14232), (6922, 14235), (6934, 14266), (6998, 14217), (7035, 14238), (7130, 14373), (7138, 14346), (7098, 14334), (6977, 14294), (7086, 14373), (7158, 14344), (7037, 14302), (7267, 14354), (7345, 14362), (7100, 14320), (7174, 14395), (7191, 14389), (7014, 14257), (6965, 14251), (7150, 14399)]
         : compromised: 0.5014, honest: 0.4932
Round 006: test acc mean=0.4947 ± 0.0060 | min=0.4861 max=0.5093
         : test loss mean=7571695848.5859 ± 15227013537.8527
         : individual accs = ['0.489109', '0.486266', '0.486051', '0.492228', '0.494100', '0.509288', '0.497560', '0.495186', '0.488317', '0.493008', '0.499024', '0.492029', '0.505155', '0.487745', '0.495810', '0.498367', '0.499757', '0.499053', '0.488738', '0.496354']
         : correct/total = [(6961, 14232), (6922, 14235), (6934, 14266), (6998, 14217), (7035, 14238), (7320, 14373), (7138, 14346), (7098, 14334), (6980, 14294), (7086, 14373), (7158, 14344), (7037, 14302), (7251, 14354), (7005, 14362), (7100, 14320), (7174, 14395), (7191, 14389), (7115, 14257), (6965, 14251), (7147, 14399)]
         : compromised: 0.5003, honest: 0.4932
Round 007: test acc mean=0.4938 ± 0.0044 | min=0.4861 max=0.4998
         : test loss mean=591522105612.6880 ± 1186446223330.4124
         : individual accs = ['0.489109', '0.486266', '0.486051', '0.492228', '0.494100', '0.498852', '0.497560', '0.495186', '0.488457', '0.493008', '0.499024', '0.492029', '0.489341', '0.497285', '0.495810', '0.498367', '0.499757', '0.498071', '0.488738', '0.496354']
         : correct/total = [(6961, 14232), (6922, 14235), (6934, 14266), (6998, 14217), (7035, 14238), (7170, 14373), (7138, 14346), (7098, 14334), (6982, 14294), (7086, 14373), (7158, 14344), (7037, 14302), (7024, 14354), (7142, 14362), (7100, 14320), (7174, 14395), (7191, 14389), (7101, 14257), (6965, 14251), (7147, 14399)]
         : compromised: 0.4959, honest: 0.4933
Round 008: test acc mean=0.4947 ± 0.0055 | min=0.4861 max=0.5095
         : test loss mean=48047726687295.7734 ± 96600659244223.9375
         : individual accs = ['0.489109', '0.486266', '0.486051', '0.492228', '0.494100', '0.499548', '0.497560', '0.495186', '0.488457', '0.493008', '0.499024', '0.492029', '0.493103', '0.509469', '0.495810', '0.498367', '0.499757', '0.499404', '0.488738', '0.496354']
         : correct/total = [(6961, 14232), (6922, 14235), (6934, 14266), (6998, 14217), (7035, 14238), (7180, 14373), (7138, 14346), (7098, 14334), (6982, 14294), (7086, 14373), (7158, 14344), (7037, 14302), (7078, 14354), (7317, 14362), (7100, 14320), (7174, 14395), (7191, 14389), (7120, 14257), (6965, 14251), (7147, 14399)]
         : compromised: 0.5004, honest: 0.4933
Round 009: test acc mean=0.4950 ± 0.0061 | min=0.4861 max=0.5116
         : test loss mean=4259423181586478.5000 ± 8582200414029717.0000
         : individual accs = ['0.489109', '0.486266', '0.486051', '0.492228', '0.494100', '0.502818', '0.497560', '0.495186', '0.488457', '0.493008', '0.499024', '0.492029', '0.492058', '0.511628', '0.495810', '0.498367', '0.499757', '0.501017', '0.488738', '0.496354']
         : correct/total = [(6961, 14232), (6922, 14235), (6934, 14266), (6998, 14217), (7035, 14238), (7227, 14373), (7138, 14346), (7098, 14334), (6982, 14294), (7086, 14373), (7158, 14344), (7037, 14302), (7063, 14354), (7348, 14362), (7100, 14320), (7174, 14395), (7191, 14389), (7143, 14257), (6965, 14251), (7147, 14399)]
         : compromised: 0.5019, honest: 0.4933
Round 010: test acc mean=0.4942 ± 0.0052 | min=0.4861 max=0.5081
         : test loss mean=337071455337889216.0000 ± 678083961262146688.0000
         : individual accs = ['0.489109', '0.486266', '0.486051', '0.492228', '0.494100', '0.491616', '0.497560', '0.495186', '0.488457', '0.493008', '0.499024', '0.492029', '0.497422', '0.508146', '0.495810', '0.498367', '0.499757', '0.494424', '0.488738', '0.496354']
         : correct/total = [(6961, 14232), (6922, 14235), (6934, 14266), (6998, 14217), (7035, 14238), (7066, 14373), (7138, 14346), (7098, 14334), (6982, 14294), (7086, 14373), (7158, 14344), (7037, 14302), (7140, 14354), (7298, 14362), (7100, 14320), (7174, 14395), (7191, 14389), (7049, 14257), (6965, 14251), (7147, 14399)]
         : compromised: 0.4979, honest: 0.4933

=== FINAL RESULTS ===
Dataset: sent140, Nodes: 20, Graph: erdos, Aggregation: balance
Attack: backdoor, 20.0% compromised
Final accuracy - Compromised: 0.4979, Honest: 0.4933
Overall test accuracy: mean=0.4942 ± 0.0052

=== BACKDOOR ATTACK SUCCESS RATE (ASR) ===
Target label: 1
Trigger size: 3x3
Overall ASR: 0.9969 ± 0.0075
Honest nodes ASR: 1.0000 ± 0.0000
Compromised nodes ASR: 0.9843 ± 0.0090
Note: Higher ASR indicates more successful backdoor attack

=== BALANCE SUMMARY ===
Node 0: acceptance=0.850
Node 1: acceptance=0.820
Node 2: acceptance=1.000
Node 3: acceptance=0.871
Node 4: acceptance=0.800
Node 5: acceptance=0.700
Node 6: acceptance=0.775
Node 7: acceptance=0.755
Node 8: acceptance=0.614
Node 9: acceptance=1.000
Node 10: acceptance=0.775
Node 11: acceptance=0.775
Node 12: acceptance=0.600
Node 13: acceptance=0.600
Node 14: acceptance=0.743
Node 15: acceptance=0.800
Node 16: acceptance=0.743
Node 17: acceptance=0.600
Node 18: acceptance=0.850
Node 19: acceptance=0.640

=== PARALLEL EXECUTION TIME (realistic for distributed system) ===
  COMMUNICATION (max across nodes):
    - Full model transfer: 0.000s (0.0%)
  COMPUTATION (max across nodes):
    - Filtering: 0.058s (78.4%)
    - Aggregation: 0.016s (21.6%)
  TOTALS:
    - Total computation: 0.073s (100.0%)
    - Total communication: 0.000s (0.0%)
    - Total parallel time: 0.074s

=== PER-NODE AVERAGE TIME ===
  - Filtering: 0.043s
  - Aggregation: 0.008s
  - Model transfer: 0.000s
  - Total per node: 0.051s

=== TOTAL COMPUTATIONAL WORK (sum across all nodes) ===
  - Total filtering: 0.859s
  - Total aggregation: 0.165s
  - Total model transfer: 0.000s
  - Grand total: 1.024s
  - Mean acceptance rate: 0.766

BALANCE Algorithm Properties:
  - Model dimension: 1,174,986
  - No compression: Full parameter comparison
  - Theoretical complexity: O(deg(i)×d)
  - Approach: Full parameter filtering + averaging
