Device: cuda
Seed: 987654321
Loading 1 LEAF Sent140 train files...
LEAF Sent140 train: 254555 users, 908652 samples
Building vocabulary (max_size=10000)...
Vocabulary size: 10000
Loading 1 LEAF Sent140 test files...
LEAF Sent140 test: 254555 users, 286281 samples
Found 254555 train users, 254555 test users, 254555 common users
User sample counts range: 494 (max) to 1 (min)
Distributed ALL 254555 users across 20 clients
Users per client: 12727 (with 15 clients getting +1 user)
Train partition sizes: [44353, 44290, 44657, 44907, 44696, 45843, 45801, 45619, 45069, 45639, 45821, 45311, 45779, 46056, 45625, 45984, 46428, 44737, 45540, 46497]
Test partition sizes: [14232, 14235, 14266, 14217, 14238, 14373, 14346, 14334, 14294, 14373, 14344, 14302, 14354, 14362, 14320, 14395, 14389, 14257, 14251, 14399]
  Client 0: 44353 train samples, 2 unique classes
  Client 1: 44290 train samples, 2 unique classes
  Client 2: 44657 train samples, 2 unique classes
  Client 3: 44907 train samples, 2 unique classes
  Client 4: 44696 train samples, 2 unique classes
  Client 5: 45843 train samples, 2 unique classes
  Client 6: 45801 train samples, 2 unique classes
  Client 7: 45619 train samples, 2 unique classes
  Client 8: 45069 train samples, 2 unique classes
  Client 9: 45639 train samples, 2 unique classes
  Client 10: 45821 train samples, 2 unique classes
  Client 11: 45311 train samples, 2 unique classes
  Client 12: 45779 train samples, 2 unique classes
  Client 13: 46056 train samples, 2 unique classes
  Client 14: 45625 train samples, 2 unique classes
  Client 15: 45984 train samples, 2 unique classes
  Client 16: 46428 train samples, 2 unique classes
  Client 17: 44737 train samples, 2 unique classes
  Client 18: 45540 train samples, 2 unique classes
  Client 19: 46497 train samples, 2 unique classes
Will sample 4500 samples per client per epoch
Graph: fully, nodes: 20, edges: 190
Degree statistics: avg=19.00, min=19, max=19
Attack: Compromised 8/20 nodes: [1, 5, 11, 12, 13, 14, 17, 18]
Attack type: backdoor, lambda: 1.0
Backdoor target label: 1, trigger size: 3
Model variant: baseline
Model parameters: 1,174,986
Initial test acc across nodes: mean=0.4965 ± 0.0152
Backdoor attack: Created poisoned datasets for 8 compromised nodes
Round 001: test acc mean=0.5010 ± 0.0084 | min=0.4835 max=0.5134
         : test loss mean=3.9442 ± 1.1079
         : individual accs = ['0.510891', '0.488655', '0.483527', '0.488078', '0.509903', '0.494121', '0.509341', '0.501744', '0.507346', '0.513393', '0.501603', '0.504125', '0.488366', '0.494987', '0.502374', '0.503300', '0.501286', '0.502280', '0.509298', '0.505035']
         : correct/total = [(7271, 14232), (6956, 14235), (6898, 14266), (6939, 14217), (7260, 14238), (7102, 14373), (7307, 14346), (7192, 14334), (7252, 14294), (7379, 14373), (7195, 14344), (7210, 14302), (7010, 14354), (7109, 14362), (7194, 14320), (7245, 14395), (7213, 14389), (7161, 14257), (7258, 14251), (7272, 14399)]
         : compromised: 0.4980, honest: 0.5030
Round 002: test acc mean=0.5033 ± 0.0044 | min=0.4951 max=0.5127
         : test loss mean=3.6810 ± 0.0549
         : individual accs = ['0.502038', '0.512680', '0.503925', '0.505240', '0.503652', '0.500800', '0.502858', '0.501326', '0.509095', '0.505462', '0.501673', '0.506503', '0.505643', '0.496797', '0.504679', '0.501980', '0.495100', '0.496318', '0.510841', '0.500243']
         : correct/total = [(7145, 14232), (7298, 14235), (7189, 14266), (7183, 14217), (7171, 14238), (7198, 14373), (7214, 14346), (7186, 14334), (7277, 14294), (7265, 14373), (7196, 14344), (7244, 14302), (7258, 14354), (7135, 14362), (7227, 14320), (7226, 14395), (7124, 14389), (7076, 14257), (7280, 14251), (7203, 14399)]
         : compromised: 0.5043, honest: 0.5027
Round 003: test acc mean=0.5051 ± 0.0056 | min=0.4914 max=0.5139
         : test loss mean=3.9205 ± 0.0384
         : individual accs = ['0.510891', '0.513734', '0.513949', '0.507772', '0.505900', '0.506157', '0.502440', '0.504814', '0.511543', '0.506992', '0.500976', '0.507971', '0.500488', '0.491436', '0.504190', '0.501633', '0.500243', '0.496949', '0.511262', '0.503646']
         : correct/total = [(7271, 14232), (7313, 14235), (7332, 14266), (7219, 14217), (7203, 14238), (7275, 14373), (7208, 14346), (7236, 14334), (7312, 14294), (7287, 14373), (7186, 14344), (7265, 14302), (7184, 14354), (7058, 14362), (7220, 14320), (7221, 14395), (7198, 14389), (7085, 14257), (7286, 14251), (7252, 14399)]
         : compromised: 0.5040, honest: 0.5059
Round 004: test acc mean=0.4983 ± 0.0047 | min=0.4914 max=0.5100
         : test loss mean=4.7340 ± 0.0434
         : individual accs = ['0.491428', '0.492518', '0.491588', '0.493705', '0.495786', '0.495512', '0.495399', '0.500000', '0.495383', '0.496208', '0.495678', '0.500070', '0.503762', '0.509957', '0.500279', '0.500799', '0.501842', '0.504594', '0.498351', '0.502743']
         : correct/total = [(6994, 14232), (7011, 14235), (7013, 14266), (7019, 14217), (7059, 14238), (7122, 14373), (7107, 14346), (7167, 14334), (7081, 14294), (7132, 14373), (7110, 14344), (7152, 14302), (7231, 14354), (7324, 14362), (7164, 14320), (7209, 14395), (7221, 14389), (7194, 14257), (7102, 14251), (7239, 14399)]
         : compromised: 0.5006, honest: 0.4967
Round 005: test acc mean=0.4949 ± 0.0056 | min=0.4862 max=0.5088
         : test loss mean=2.8991 ± 0.0499
         : individual accs = ['0.489039', '0.486196', '0.486191', '0.492228', '0.494171', '0.494051', '0.497769', '0.495117', '0.488597', '0.493147', '0.499024', '0.491959', '0.499512', '0.508773', '0.495740', '0.498576', '0.499826', '0.502911', '0.488738', '0.496493']
         : correct/total = [(6960, 14232), (6921, 14235), (6936, 14266), (6998, 14217), (7036, 14238), (7101, 14373), (7141, 14346), (7097, 14334), (6984, 14294), (7088, 14373), (7158, 14344), (7036, 14302), (7170, 14354), (7307, 14362), (7099, 14320), (7177, 14395), (7192, 14389), (7170, 14257), (6965, 14251), (7149, 14399)]
         : compromised: 0.4960, honest: 0.4942
Round 006: test acc mean=0.4951 ± 0.0057 | min=0.4851 max=0.5091
         : test loss mean=2.4796 ± 0.0316
         : individual accs = ['0.489460', '0.485072', '0.486191', '0.493072', '0.494873', '0.494260', '0.496794', '0.495884', '0.489576', '0.493634', '0.499094', '0.492449', '0.499094', '0.509052', '0.496159', '0.499548', '0.501216', '0.502771', '0.488597', '0.496146']
         : correct/total = [(6966, 14232), (6905, 14235), (6936, 14266), (7010, 14217), (7046, 14238), (7104, 14373), (7127, 14346), (7108, 14334), (6998, 14294), (7095, 14373), (7159, 14344), (7043, 14302), (7164, 14354), (7311, 14362), (7105, 14320), (7191, 14395), (7212, 14389), (7168, 14257), (6963, 14251), (7144, 14399)]
         : compromised: 0.4959, honest: 0.4946
Round 007: test acc mean=0.4949 ± 0.0056 | min=0.4861 max=0.5086
         : test loss mean=1.3351 ± 0.0234
         : individual accs = ['0.489109', '0.486266', '0.486051', '0.492228', '0.494100', '0.493843', '0.497560', '0.495186', '0.488457', '0.493008', '0.499024', '0.492029', '0.499512', '0.508564', '0.495810', '0.498367', '0.499757', '0.503051', '0.488738', '0.496354']
         : correct/total = [(6961, 14232), (6922, 14235), (6934, 14266), (6998, 14217), (7035, 14238), (7098, 14373), (7138, 14346), (7098, 14334), (6982, 14294), (7086, 14373), (7158, 14344), (7037, 14302), (7170, 14354), (7304, 14362), (7100, 14320), (7174, 14395), (7191, 14389), (7172, 14257), (6965, 14251), (7147, 14399)]
         : compromised: 0.4960, honest: 0.4941
Round 008: test acc mean=0.4996 ± 0.0042 | min=0.4909 max=0.5095
         : test loss mean=0.8166 ± 0.0047
         : individual accs = ['0.496698', '0.504320', '0.503154', '0.502216', '0.500000', '0.509497', '0.497630', '0.499163', '0.499510', '0.501357', '0.496026', '0.497413', '0.497980', '0.490948', '0.502235', '0.499340', '0.496560', '0.494845', '0.506912', '0.496076']
         : correct/total = [(7069, 14232), (7179, 14235), (7178, 14266), (7140, 14217), (7119, 14238), (7323, 14373), (7139, 14346), (7155, 14334), (7140, 14294), (7206, 14373), (7115, 14344), (7114, 14302), (7148, 14354), (7051, 14362), (7192, 14320), (7188, 14395), (7145, 14389), (7055, 14257), (7224, 14251), (7143, 14399)]
         : compromised: 0.5005, honest: 0.4990
Round 009: test acc mean=0.5463 ± 0.0053 | min=0.5375 max=0.5635
         : test loss mean=0.6864 ± 0.0010
         : individual accs = ['0.548553', '0.545697', '0.542058', '0.546599', '0.549305', '0.537466', '0.546076', '0.547719', '0.545544', '0.538858', '0.547128', '0.543700', '0.549255', '0.563501', '0.539595', '0.544634', '0.548614', '0.551729', '0.543681', '0.546357']
         : correct/total = [(7807, 14232), (7768, 14235), (7733, 14266), (7771, 14217), (7821, 14238), (7725, 14373), (7834, 14346), (7851, 14334), (7798, 14294), (7745, 14373), (7848, 14344), (7776, 14302), (7884, 14354), (8093, 14362), (7727, 14320), (7840, 14395), (7894, 14389), (7866, 14257), (7748, 14251), (7867, 14399)]
         : compromised: 0.5468, honest: 0.5460
Round 010: test acc mean=0.5145 ± 0.0036 | min=0.5061 max=0.5214
         : test loss mean=0.7335 ± 0.0025
         : individual accs = ['0.509275', '0.517808', '0.516613', '0.516072', '0.511097', '0.518611', '0.515893', '0.519534', '0.512313', '0.514785', '0.514431', '0.511677', '0.521388', '0.514831', '0.514106', '0.517402', '0.506081', '0.511819', '0.512455', '0.513508']
         : correct/total = [(7248, 14232), (7371, 14235), (7370, 14266), (7337, 14217), (7277, 14238), (7454, 14373), (7401, 14346), (7447, 14334), (7323, 14294), (7399, 14373), (7379, 14344), (7318, 14302), (7484, 14354), (7394, 14362), (7362, 14320), (7448, 14395), (7282, 14389), (7297, 14257), (7303, 14251), (7394, 14399)]
         : compromised: 0.5153, honest: 0.5139

=== FINAL RESULTS ===
Dataset: sent140, Nodes: 20, Graph: fully, Aggregation: d-fedavg
Attack: backdoor, 40.0% compromised
Final accuracy - Compromised: 0.5153, Honest: 0.5139
Overall test accuracy: mean=0.5145 ± 0.0036

=== BACKDOOR ATTACK SUCCESS RATE (ASR) ===
Target label: 1
Trigger size: 3x3
Overall ASR: 0.8919 ± 0.0030
Honest nodes ASR: 0.8920 ± 0.0037
Compromised nodes ASR: 0.8917 ± 0.0017
Note: Higher ASR indicates more successful backdoor attack
