Device: cuda
Seed: 987654321
Loading 1 LEAF Sent140 train files...
LEAF Sent140 train: 254555 users, 908652 samples
Building vocabulary (max_size=10000)...
Vocabulary size: 10000
Loading 1 LEAF Sent140 test files...
LEAF Sent140 test: 254555 users, 286281 samples
Found 254555 train users, 254555 test users, 254555 common users
User sample counts range: 494 (max) to 1 (min)
Distributed ALL 254555 users across 20 clients
Users per client: 12727 (with 15 clients getting +1 user)
Train partition sizes: [44353, 44290, 44657, 44907, 44696, 45843, 45801, 45619, 45069, 45639, 45821, 45311, 45779, 46056, 45625, 45984, 46428, 44737, 45540, 46497]
Test partition sizes: [14232, 14235, 14266, 14217, 14238, 14373, 14346, 14334, 14294, 14373, 14344, 14302, 14354, 14362, 14320, 14395, 14389, 14257, 14251, 14399]
  Client 0: 44353 train samples, 2 unique classes
  Client 1: 44290 train samples, 2 unique classes
  Client 2: 44657 train samples, 2 unique classes
  Client 3: 44907 train samples, 2 unique classes
  Client 4: 44696 train samples, 2 unique classes
  Client 5: 45843 train samples, 2 unique classes
  Client 6: 45801 train samples, 2 unique classes
  Client 7: 45619 train samples, 2 unique classes
  Client 8: 45069 train samples, 2 unique classes
  Client 9: 45639 train samples, 2 unique classes
  Client 10: 45821 train samples, 2 unique classes
  Client 11: 45311 train samples, 2 unique classes
  Client 12: 45779 train samples, 2 unique classes
  Client 13: 46056 train samples, 2 unique classes
  Client 14: 45625 train samples, 2 unique classes
  Client 15: 45984 train samples, 2 unique classes
  Client 16: 46428 train samples, 2 unique classes
  Client 17: 44737 train samples, 2 unique classes
  Client 18: 45540 train samples, 2 unique classes
  Client 19: 46497 train samples, 2 unique classes
Will sample 4500 samples per client per epoch
Graph: erdos, nodes: 20, edges: 99
Degree statistics: avg=9.90, min=7, max=14
Attack: Compromised 12/20 nodes: [1, 2, 3, 5, 8, 11, 12, 13, 14, 15, 17, 18]
Attack type: krum, lambda: 1.0
Model variant: baseline
Model parameters: 1,174,986
BALANCE algorithm:
Balance Config: BALANCEConfig(gamma=2, kappa=1, alpha=0.5, min_neighbors=1)
  - Model dimension: 1,174,986 parameters
  - Complexity: O(N×d) = O(20×1,174,986)
Initial test acc across nodes: mean=0.4965 ± 0.0152
Round 001: test acc mean=0.4995 ± 0.0076 | min=0.4838 max=0.5150
         : test loss mean=1.9462 ± 0.6458
         : individual accs = ['0.502389', '0.498911', '0.506169', '0.501372', '0.499930', '0.483754', '0.493517', '0.487861', '0.514971', '0.489112', '0.506623', '0.510628', '0.495541', '0.505918', '0.504050', '0.502188', '0.495656', '0.494704', '0.495474', '0.501354']
         : correct/total = [(7150, 14232), (7102, 14235), (7221, 14266), (7128, 14217), (7118, 14238), (6953, 14373), (7080, 14346), (6993, 14334), (7361, 14294), (7030, 14373), (7267, 14344), (7303, 14302), (7113, 14354), (7266, 14362), (7218, 14320), (7229, 14395), (7132, 14389), (7053, 14257), (7061, 14251), (7219, 14399)]
         : compromised: 0.5011, honest: 0.4971
Round 002: test acc mean=0.5025 ± 0.0126 | min=0.4824 max=0.5203
         : test loss mean=0.7801 ± 0.0731
         : individual accs = ['0.506113', '0.517878', '0.518646', '0.498488', '0.483354', '0.504835', '0.515893', '0.514302', '0.505107', '0.497113', '0.520287', '0.496434', '0.482374', '0.489068', '0.516899', '0.489337', '0.496907', '0.516658', '0.485159', '0.494895']
         : correct/total = [(7203, 14232), (7372, 14235), (7399, 14266), (7087, 14217), (6882, 14238), (7256, 14373), (7401, 14346), (7372, 14334), (7220, 14294), (7145, 14373), (7463, 14344), (7100, 14302), (6924, 14354), (7024, 14362), (7402, 14320), (7044, 14395), (7150, 14389), (7366, 14257), (6914, 14251), (7126, 14399)]
         : compromised: 0.5017, honest: 0.5036
Round 003: test acc mean=0.5134 ± 0.0165 | min=0.4756 max=0.5492
         : test loss mean=0.7041 ± 0.0104
         : individual accs = ['0.507237', '0.531296', '0.516753', '0.506506', '0.505619', '0.494469', '0.519518', '0.506139', '0.517140', '0.501287', '0.544339', '0.527479', '0.525219', '0.513229', '0.494832', '0.509205', '0.475572', '0.514274', '0.549225', '0.509133']
         : correct/total = [(7219, 14232), (7563, 14235), (7372, 14266), (7201, 14217), (7199, 14238), (7107, 14373), (7453, 14346), (7255, 14334), (7392, 14294), (7205, 14373), (7808, 14344), (7544, 14302), (7539, 14354), (7371, 14362), (7086, 14320), (7330, 14395), (6843, 14389), (7332, 14257), (7827, 14251), (7331, 14399)]
         : compromised: 0.5166, honest: 0.5086
Round 004: test acc mean=0.5300 ± 0.0139 | min=0.5034 max=0.5574
         : test loss mean=0.6921 ± 0.0039
         : individual accs = ['0.542861', '0.557429', '0.533366', '0.528593', '0.536662', '0.513463', '0.521191', '0.519255', '0.533231', '0.532039', '0.556609', '0.527968', '0.549812', '0.521654', '0.503422', '0.516082', '0.514629', '0.524093', '0.531682', '0.536843']
         : correct/total = [(7726, 14232), (7935, 14235), (7609, 14266), (7515, 14217), (7641, 14238), (7380, 14373), (7477, 14346), (7443, 14334), (7622, 14294), (7647, 14373), (7984, 14344), (7551, 14302), (7892, 14354), (7492, 14362), (7209, 14320), (7429, 14395), (7405, 14389), (7472, 14257), (7577, 14251), (7730, 14399)]
         : compromised: 0.5284, honest: 0.5325
Round 005: test acc mean=0.5551 ± 0.0101 | min=0.5351 max=0.5723
         : test loss mean=0.6844 ± 0.0030
         : individual accs = ['0.556844', '0.572251', '0.537011', '0.554969', '0.557522', '0.548320', '0.557019', '0.558044', '0.559046', '0.554025', '0.570761', '0.535100', '0.564999', '0.538783', '0.558240', '0.550191', '0.550629', '0.549134', '0.557715', '0.570526']
         : correct/total = [(7925, 14232), (8146, 14235), (7661, 14266), (7890, 14217), (7938, 14238), (7881, 14373), (7991, 14346), (7999, 14334), (7991, 14294), (7963, 14373), (8187, 14344), (7653, 14302), (8110, 14354), (7738, 14362), (7994, 14320), (7920, 14395), (7923, 14389), (7829, 14257), (7948, 14251), (8215, 14399)]
         : compromised: 0.5521, honest: 0.5594
Round 006: test acc mean=0.5749 ± 0.0047 | min=0.5671 max=0.5846
         : test loss mean=0.6766 ± 0.0020
         : individual accs = ['0.571178', '0.583000', '0.573391', '0.578744', '0.570937', '0.576428', '0.580092', '0.572973', '0.571499', '0.571419', '0.584565', '0.573626', '0.580187', '0.574572', '0.576676', '0.569156', '0.572451', '0.567090', '0.569504', '0.579901']
         : correct/total = [(8129, 14232), (8299, 14235), (8180, 14266), (8228, 14217), (8129, 14238), (8285, 14373), (8322, 14346), (8213, 14334), (8169, 14294), (8213, 14373), (8385, 14344), (8204, 14302), (8328, 14354), (8252, 14362), (8258, 14320), (8193, 14395), (8237, 14389), (8085, 14257), (8116, 14251), (8350, 14399)]
         : compromised: 0.5745, honest: 0.5754
Round 007: test acc mean=0.5914 ± 0.0042 | min=0.5832 max=0.5996
         : test loss mean=0.6687 ± 0.0018
         : individual accs = ['0.592468', '0.593467', '0.591196', '0.592460', '0.591445', '0.594865', '0.595776', '0.583229', '0.584791', '0.590691', '0.598160', '0.590687', '0.599624', '0.591770', '0.592598', '0.587079', '0.591355', '0.589184', '0.583327', '0.593861']
         : correct/total = [(8432, 14232), (8448, 14235), (8434, 14266), (8423, 14217), (8421, 14238), (8550, 14373), (8547, 14346), (8360, 14334), (8359, 14294), (8490, 14373), (8580, 14344), (8448, 14302), (8607, 14354), (8499, 14362), (8486, 14320), (8451, 14395), (8509, 14389), (8400, 14257), (8313, 14251), (8551, 14399)]
         : compromised: 0.5909, honest: 0.5921
Round 008: test acc mean=0.6004 ± 0.0041 | min=0.5954 max=0.6099
         : test loss mean=0.6622 ± 0.0020
         : individual accs = ['0.598159', '0.607095', '0.595402', '0.599845', '0.602332', '0.605649', '0.599679', '0.595996', '0.595425', '0.599388', '0.605828', '0.598658', '0.609935', '0.597479', '0.603492', '0.598541', '0.597192', '0.602441', '0.596028', '0.599972']
         : correct/total = [(8513, 14232), (8642, 14235), (8494, 14266), (8528, 14217), (8576, 14238), (8705, 14373), (8603, 14346), (8543, 14334), (8511, 14294), (8615, 14373), (8690, 14344), (8562, 14302), (8755, 14354), (8581, 14362), (8642, 14320), (8616, 14395), (8593, 14389), (8589, 14257), (8494, 14251), (8639, 14399)]
         : compromised: 0.6008, honest: 0.5998
Round 009: test acc mean=0.6077 ± 0.0037 | min=0.6002 max=0.6163
         : test loss mean=0.6570 ± 0.0016
         : individual accs = ['0.606380', '0.616298', '0.608299', '0.608356', '0.607108', '0.611633', '0.606650', '0.606530', '0.601301', '0.612885', '0.607780', '0.605650', '0.608820', '0.610082', '0.606006', '0.610281', '0.602544', '0.609736', '0.600239', '0.606639']
         : correct/total = [(8630, 14232), (8773, 14235), (8678, 14266), (8649, 14217), (8644, 14238), (8791, 14373), (8703, 14346), (8694, 14334), (8595, 14294), (8809, 14373), (8718, 14344), (8662, 14302), (8739, 14354), (8762, 14362), (8678, 14320), (8785, 14395), (8670, 14389), (8693, 14257), (8554, 14251), (8735, 14399)]
         : compromised: 0.6081, honest: 0.6071
Round 010: test acc mean=0.6137 ± 0.0041 | min=0.6058 max=0.6216
         : test loss mean=0.6526 ± 0.0016
         : individual accs = ['0.613898', '0.621637', '0.612505', '0.614476', '0.617151', '0.618451', '0.608253', '0.616088', '0.610466', '0.618799', '0.611754', '0.609425', '0.615647', '0.610639', '0.617249', '0.617437', '0.608937', '0.615908', '0.605782', '0.609903']
         : correct/total = [(8737, 14232), (8849, 14235), (8738, 14266), (8736, 14217), (8787, 14238), (8889, 14373), (8726, 14346), (8831, 14334), (8726, 14294), (8894, 14373), (8775, 14344), (8716, 14302), (8837, 14354), (8770, 14362), (8839, 14320), (8888, 14395), (8762, 14389), (8781, 14257), (8633, 14251), (8782, 14399)]
         : compromised: 0.6141, honest: 0.6131

=== FINAL RESULTS ===
Dataset: sent140, Nodes: 20, Graph: erdos, Aggregation: balance
Attack: krum, 60.0% compromised
Final accuracy - Compromised: 0.6141, Honest: 0.6131
Overall test accuracy: mean=0.6137 ± 0.0041

=== BALANCE SUMMARY ===
Node 0: acceptance=0.475
Node 1: acceptance=0.550
Node 2: acceptance=0.550
Node 3: acceptance=0.614
Node 4: acceptance=0.400
Node 5: acceptance=0.460
Node 6: acceptance=0.400
Node 7: acceptance=0.345
Node 8: acceptance=0.357
Node 9: acceptance=0.591
Node 10: acceptance=0.550
Node 11: acceptance=0.400
Node 12: acceptance=0.550
Node 13: acceptance=0.400
Node 14: acceptance=0.421
Node 15: acceptance=0.500
Node 16: acceptance=0.357
Node 17: acceptance=0.662
Node 18: acceptance=0.400
Node 19: acceptance=0.370

=== PARALLEL EXECUTION TIME (realistic for distributed system) ===
  COMMUNICATION (max across nodes):
    - Full model transfer: 0.000s (0.0%)
  COMPUTATION (max across nodes):
    - Filtering: 0.056s (81.2%)
    - Aggregation: 0.013s (18.8%)
  TOTALS:
    - Total computation: 0.069s (100.0%)
    - Total communication: 0.000s (0.0%)
    - Total parallel time: 0.069s

=== PER-NODE AVERAGE TIME ===
  - Filtering: 0.044s
  - Aggregation: 0.007s
  - Model transfer: 0.000s
  - Total per node: 0.051s

=== TOTAL COMPUTATIONAL WORK (sum across all nodes) ===
  - Total filtering: 0.877s
  - Total aggregation: 0.133s
  - Total model transfer: 0.000s
  - Grand total: 1.010s
  - Mean acceptance rate: 0.468

BALANCE Algorithm Properties:
  - Model dimension: 1,174,986
  - No compression: Full parameter comparison
  - Theoretical complexity: O(deg(i)×d)
  - Approach: Full parameter filtering + averaging
