Device: cuda
Seed: 987654321
Loading 1 LEAF Sent140 train files...
LEAF Sent140 train: 254555 users, 908652 samples
Building vocabulary (max_size=10000)...
Vocabulary size: 10000
Loading 1 LEAF Sent140 test files...
LEAF Sent140 test: 254555 users, 286281 samples
Found 254555 train users, 254555 test users, 254555 common users
User sample counts range: 494 (max) to 1 (min)
Distributed ALL 254555 users across 20 clients
Users per client: 12727 (with 15 clients getting +1 user)
Train partition sizes: [44353, 44290, 44657, 44907, 44696, 45843, 45801, 45619, 45069, 45639, 45821, 45311, 45779, 46056, 45625, 45984, 46428, 44737, 45540, 46497]
Test partition sizes: [14232, 14235, 14266, 14217, 14238, 14373, 14346, 14334, 14294, 14373, 14344, 14302, 14354, 14362, 14320, 14395, 14389, 14257, 14251, 14399]
  Client 0: 44353 train samples, 2 unique classes
  Client 1: 44290 train samples, 2 unique classes
  Client 2: 44657 train samples, 2 unique classes
  Client 3: 44907 train samples, 2 unique classes
  Client 4: 44696 train samples, 2 unique classes
  Client 5: 45843 train samples, 2 unique classes
  Client 6: 45801 train samples, 2 unique classes
  Client 7: 45619 train samples, 2 unique classes
  Client 8: 45069 train samples, 2 unique classes
  Client 9: 45639 train samples, 2 unique classes
  Client 10: 45821 train samples, 2 unique classes
  Client 11: 45311 train samples, 2 unique classes
  Client 12: 45779 train samples, 2 unique classes
  Client 13: 46056 train samples, 2 unique classes
  Client 14: 45625 train samples, 2 unique classes
  Client 15: 45984 train samples, 2 unique classes
  Client 16: 46428 train samples, 2 unique classes
  Client 17: 44737 train samples, 2 unique classes
  Client 18: 45540 train samples, 2 unique classes
  Client 19: 46497 train samples, 2 unique classes
Will sample 4500 samples per client per epoch
Graph: fully, nodes: 20, edges: 190
Degree statistics: avg=19.00, min=19, max=19
Attack: Compromised 4/20 nodes: [5, 12, 13, 17]
Attack type: krum, lambda: 1.0
Model variant: baseline
Model parameters: 1,174,986
Sketchguard Node 0:
  Model dim: 1,174,986 → Sketch size: 180
  Compression ratio: 6527.7x
  Using model parameters for aggregation, sketches for filtering
Sketchguard Node 1:
  Model dim: 1,174,986 → Sketch size: 180
  Compression ratio: 6527.7x
  Using model parameters for aggregation, sketches for filtering
Sketchguard Node 2:
  Model dim: 1,174,986 → Sketch size: 180
  Compression ratio: 6527.7x
  Using model parameters for aggregation, sketches for filtering
Sketchguard Node 3:
  Model dim: 1,174,986 → Sketch size: 180
  Compression ratio: 6527.7x
  Using model parameters for aggregation, sketches for filtering
Sketchguard Node 4:
  Model dim: 1,174,986 → Sketch size: 180
  Compression ratio: 6527.7x
  Using model parameters for aggregation, sketches for filtering
Sketchguard Node 5:
  Model dim: 1,174,986 → Sketch size: 180
  Compression ratio: 6527.7x
  Using model parameters for aggregation, sketches for filtering
Sketchguard Node 6:
  Model dim: 1,174,986 → Sketch size: 180
  Compression ratio: 6527.7x
  Using model parameters for aggregation, sketches for filtering
Sketchguard Node 7:
  Model dim: 1,174,986 → Sketch size: 180
  Compression ratio: 6527.7x
  Using model parameters for aggregation, sketches for filtering
Sketchguard Node 8:
  Model dim: 1,174,986 → Sketch size: 180
  Compression ratio: 6527.7x
  Using model parameters for aggregation, sketches for filtering
Sketchguard Node 9:
  Model dim: 1,174,986 → Sketch size: 180
  Compression ratio: 6527.7x
  Using model parameters for aggregation, sketches for filtering
Sketchguard Node 10:
  Model dim: 1,174,986 → Sketch size: 180
  Compression ratio: 6527.7x
  Using model parameters for aggregation, sketches for filtering
Sketchguard Node 11:
  Model dim: 1,174,986 → Sketch size: 180
  Compression ratio: 6527.7x
  Using model parameters for aggregation, sketches for filtering
Sketchguard Node 12:
  Model dim: 1,174,986 → Sketch size: 180
  Compression ratio: 6527.7x
  Using model parameters for aggregation, sketches for filtering
Sketchguard Node 13:
  Model dim: 1,174,986 → Sketch size: 180
  Compression ratio: 6527.7x
  Using model parameters for aggregation, sketches for filtering
Sketchguard Node 14:
  Model dim: 1,174,986 → Sketch size: 180
  Compression ratio: 6527.7x
  Using model parameters for aggregation, sketches for filtering
Sketchguard Node 15:
  Model dim: 1,174,986 → Sketch size: 180
  Compression ratio: 6527.7x
  Using model parameters for aggregation, sketches for filtering
Sketchguard Node 16:
  Model dim: 1,174,986 → Sketch size: 180
  Compression ratio: 6527.7x
  Using model parameters for aggregation, sketches for filtering
Sketchguard Node 17:
  Model dim: 1,174,986 → Sketch size: 180
  Compression ratio: 6527.7x
  Using model parameters for aggregation, sketches for filtering
Sketchguard Node 18:
  Model dim: 1,174,986 → Sketch size: 180
  Compression ratio: 6527.7x
  Using model parameters for aggregation, sketches for filtering
Sketchguard Node 19:
  Model dim: 1,174,986 → Sketch size: 180
  Compression ratio: 6527.7x
  Using model parameters for aggregation, sketches for filtering
Sketchguard ALGORITHM (Sketch-based Filtering + State Aggregation)
  - Model dimension: 1,174,986 parameters
  - Config: SketchguardConfig(gamma=2, kappa=1, alpha=0.5, min_neighbors=1, sketch_size=180, network_seed=987654321, attack_detection_window=5)
  - Sketch size: 180
  - Compression ratio: 6527.7x
  - Complexity: O(d + N×k) = O(1,174,986 + 20×180)
  - Theoretical speedup vs BALANCE: 19.9x
Initial test acc across nodes: mean=0.4953 ± 0.0174
Round 001: test acc mean=0.5017 ± 0.0126 | min=0.4757 max=0.5397
         : test loss mean=0.6977 ± 0.0064
         : individual accs = ['0.495925', '0.492940', '0.496145', '0.493353', '0.495786', '0.495652', '0.517217', '0.513325', '0.502519', '0.499269', '0.506762', '0.501259', '0.539710', '0.517755', '0.475698', '0.504550', '0.496699', '0.495616', '0.495755', '0.498160']
         : correct/total = [(7058, 14232), (7017, 14235), (7078, 14266), (7014, 14217), (7059, 14238), (7124, 14373), (7420, 14346), (7358, 14334), (7183, 14294), (7176, 14373), (7269, 14344), (7169, 14302), (7747, 14354), (7436, 14362), (6812, 14320), (7263, 14395), (7147, 14389), (7066, 14257), (7065, 14251), (7173, 14399)]
         : compromised: 0.5122, honest: 0.4991
         : sketchguard stats = ['Node 0: acc_rate=1.000', 'Node 1: acc_rate=1.000', 'Node 2: acc_rate=1.000']...
Round 002: test acc mean=0.5842 ± 0.0263 | min=0.5227 max=0.6217
         : test loss mean=0.6803 ± 0.0043
         : individual accs = ['0.574621', '0.611170', '0.592107', '0.612295', '0.610198', '0.531483', '0.608671', '0.621669', '0.588569', '0.582342', '0.586029', '0.582716', '0.609447', '0.570046', '0.580517', '0.594512', '0.545417', '0.593743', '0.522700', '0.566359']
         : correct/total = [(8178, 14232), (8700, 14235), (8447, 14266), (8705, 14217), (8688, 14238), (7639, 14373), (8732, 14346), (8911, 14334), (8413, 14294), (8370, 14373), (8406, 14344), (8334, 14302), (8748, 14354), (8187, 14362), (8313, 14320), (8558, 14395), (7848, 14389), (8465, 14257), (7449, 14251), (8155, 14399)]
         : compromised: 0.5762, honest: 0.5862
         : sketchguard stats = ['Node 0: acc_rate=0.895', 'Node 1: acc_rate=0.895', 'Node 2: acc_rate=0.895']...
Round 003: test acc mean=0.6123 ± 0.0244 | min=0.5292 max=0.6391
         : test loss mean=0.6672 ± 0.0057
         : individual accs = ['0.614812', '0.639129', '0.622739', '0.611170', '0.633305', '0.617547', '0.611948', '0.567602', '0.616762', '0.626731', '0.617610', '0.629772', '0.626097', '0.618020', '0.600489', '0.603334', '0.632080', '0.600968', '0.627114', '0.529203']
         : correct/total = [(8750, 14232), (9098, 14235), (8884, 14266), (8689, 14217), (9017, 14238), (8876, 14373), (8779, 14346), (8136, 14334), (8816, 14294), (9008, 14373), (8859, 14344), (9007, 14302), (8987, 14354), (8876, 14362), (8599, 14320), (8685, 14395), (9095, 14389), (8568, 14257), (8937, 14251), (7620, 14399)]
         : compromised: 0.6157, honest: 0.6115
         : sketchguard stats = ['Node 0: acc_rate=0.860', 'Node 1: acc_rate=0.860', 'Node 2: acc_rate=0.860']...
Round 004: test acc mean=0.6354 ± 0.0060 | min=0.6234 max=0.6451
         : test loss mean=0.6466 ± 0.0039
         : individual accs = ['0.636804', '0.643133', '0.631922', '0.631779', '0.630636', '0.639602', '0.637739', '0.642458', '0.645096', '0.631183', '0.632529', '0.634806', '0.636129', '0.634870', '0.625768', '0.631122', '0.643895', '0.623413', '0.630903', '0.644142']
         : correct/total = [(9063, 14232), (9155, 14235), (9015, 14266), (8982, 14217), (8979, 14238), (9193, 14373), (9149, 14346), (9209, 14334), (9221, 14294), (9072, 14373), (9073, 14344), (9079, 14302), (9131, 14354), (9118, 14362), (8961, 14320), (9085, 14395), (9265, 14389), (8888, 14257), (8991, 14251), (9275, 14399)]
         : compromised: 0.6335, honest: 0.6359
         : sketchguard stats = ['Node 0: acc_rate=0.842', 'Node 1: acc_rate=0.842', 'Node 2: acc_rate=0.842']...
Round 005: test acc mean=0.6425 ± 0.0074 | min=0.6254 max=0.6530
         : test loss mean=0.6350 ± 0.0049
         : individual accs = ['0.643761', '0.645662', '0.638371', '0.644510', '0.653041', '0.649482', '0.648473', '0.642110', '0.650763', '0.625409', '0.632250', '0.642288', '0.647764', '0.640440', '0.650000', '0.631052', '0.646536', '0.637932', '0.631324', '0.648170']
         : correct/total = [(9162, 14232), (9191, 14235), (9107, 14266), (9163, 14217), (9298, 14238), (9335, 14373), (9303, 14346), (9204, 14334), (9302, 14294), (8989, 14373), (9069, 14344), (9186, 14302), (9298, 14354), (9198, 14362), (9308, 14320), (9084, 14395), (9303, 14389), (9095, 14257), (8997, 14251), (9333, 14399)]
         : compromised: 0.6439, honest: 0.6421
         : sketchguard stats = ['Node 0: acc_rate=0.832', 'Node 1: acc_rate=0.832', 'Node 2: acc_rate=0.832']...
Round 006: test acc mean=0.6514 ± 0.0038 | min=0.6438 max=0.6576
         : test loss mean=0.6242 ± 0.0034
         : individual accs = ['0.650646', '0.654935', '0.646572', '0.653513', '0.655078', '0.656091', '0.654608', '0.651179', '0.657619', '0.651221', '0.643753', '0.644805', '0.649087', '0.650536', '0.653492', '0.650156', '0.653763', '0.650487', '0.646130', '0.654490']
         : correct/total = [(9260, 14232), (9323, 14235), (9224, 14266), (9291, 14217), (9327, 14238), (9430, 14373), (9391, 14346), (9334, 14334), (9400, 14294), (9360, 14373), (9234, 14344), (9222, 14302), (9317, 14354), (9343, 14362), (9358, 14320), (9359, 14395), (9407, 14389), (9274, 14257), (9208, 14251), (9424, 14399)]
         : compromised: 0.6516, honest: 0.6514
         : sketchguard stats = ['Node 0: acc_rate=0.825', 'Node 1: acc_rate=0.825', 'Node 2: acc_rate=0.825']...
Round 007: test acc mean=0.6564 ± 0.0088 | min=0.6308 max=0.6660
         : test loss mean=0.6179 ± 0.0063
         : individual accs = ['0.658165', '0.666034', '0.654774', '0.656468', '0.662593', '0.664927', '0.654538', '0.630808', '0.663285', '0.658805', '0.644799', '0.664033', '0.664762', '0.648030', '0.662919', '0.640639', '0.659671', '0.655608', '0.659182', '0.657268']
         : correct/total = [(9367, 14232), (9481, 14235), (9341, 14266), (9333, 14217), (9434, 14238), (9557, 14373), (9390, 14346), (9042, 14334), (9481, 14294), (9469, 14373), (9249, 14344), (9497, 14302), (9542, 14354), (9307, 14362), (9493, 14320), (9222, 14395), (9492, 14389), (9347, 14257), (9394, 14251), (9464, 14399)]
         : compromised: 0.6583, honest: 0.6559
         : sketchguard stats = ['Node 0: acc_rate=0.820', 'Node 1: acc_rate=0.820', 'Node 2: acc_rate=0.820']...
Round 008: test acc mean=0.6628 ± 0.0063 | min=0.6469 max=0.6731
         : test loss mean=0.6112 ± 0.0049
         : individual accs = ['0.661046', '0.658237', '0.646853', '0.666315', '0.659994', '0.666945', '0.673149', '0.665829', '0.669931', '0.663745', '0.663204', '0.664173', '0.649923', '0.664880', '0.666411', '0.666134', '0.665925', '0.659185', '0.656094', '0.668727']
         : correct/total = [(9408, 14232), (9370, 14235), (9228, 14266), (9473, 14217), (9397, 14238), (9586, 14373), (9657, 14346), (9544, 14334), (9576, 14294), (9540, 14373), (9513, 14344), (9499, 14302), (9329, 14354), (9549, 14362), (9543, 14320), (9589, 14395), (9582, 14389), (9398, 14257), (9350, 14251), (9629, 14399)]
         : compromised: 0.6602, honest: 0.6635
         : sketchguard stats = ['Node 0: acc_rate=0.816', 'Node 1: acc_rate=0.816', 'Node 2: acc_rate=0.816']...
Round 009: test acc mean=0.6684 ± 0.0067 | min=0.6490 max=0.6768
         : test loss mean=0.6057 ± 0.0056
         : individual accs = ['0.649030', '0.676783', '0.668302', '0.673138', '0.664841', '0.675920', '0.665551', '0.669597', '0.675948', '0.667084', '0.655605', '0.665222', '0.668664', '0.671146', '0.672765', '0.662105', '0.674752', '0.669917', '0.672444', '0.669352']
         : correct/total = [(9237, 14232), (9634, 14235), (9534, 14266), (9570, 14217), (9466, 14238), (9715, 14373), (9548, 14346), (9598, 14334), (9662, 14294), (9588, 14373), (9404, 14344), (9514, 14302), (9598, 14354), (9639, 14362), (9634, 14320), (9531, 14395), (9709, 14389), (9551, 14257), (9583, 14251), (9638, 14399)]
         : compromised: 0.6714, honest: 0.6677
         : sketchguard stats = ['Node 0: acc_rate=0.813', 'Node 1: acc_rate=0.813', 'Node 2: acc_rate=0.813']...
Round 010: test acc mean=0.6774 ± 0.0049 | min=0.6649 max=0.6835
         : test loss mean=0.5961 ± 0.0043
         : individual accs = ['0.673904', '0.682543', '0.664938', '0.675529', '0.682469', '0.681973', '0.681444', '0.683410', '0.683504', '0.672024', '0.676520', '0.677178', '0.680298', '0.676159', '0.677514', '0.673498', '0.678782', '0.679666', '0.668585', '0.678172']
         : correct/total = [(9591, 14232), (9716, 14235), (9486, 14266), (9604, 14217), (9717, 14238), (9802, 14373), (9776, 14346), (9796, 14334), (9770, 14294), (9659, 14373), (9704, 14344), (9685, 14302), (9765, 14354), (9711, 14362), (9702, 14320), (9695, 14395), (9767, 14389), (9690, 14257), (9528, 14251), (9765, 14399)]
         : compromised: 0.6795, honest: 0.6769
         : sketchguard stats = ['Node 0: acc_rate=0.811', 'Node 1: acc_rate=0.811', 'Node 2: acc_rate=0.811']...

=== FINAL RESULTS ===
Dataset: sent140, Nodes: 20, Graph: fully, Aggregation: sketchguard
Attack: krum, 20.0% compromised
Final accuracy - Compromised: 0.6795, Honest: 0.6769
Overall test accuracy: mean=0.6774 ± 0.0049

=== Sketchguard SUMMARY ===
Node 0: acceptance=0.811
Node 1: acceptance=0.811
Node 2: acceptance=0.811
Node 3: acceptance=0.811
Node 4: acceptance=0.811
Node 5: acceptance=0.858
Node 6: acceptance=0.811
Node 7: acceptance=0.811
Node 8: acceptance=0.811
Node 9: acceptance=0.811
Node 10: acceptance=0.811
Node 11: acceptance=0.811
Node 12: acceptance=0.858
Node 13: acceptance=0.858
Node 14: acceptance=0.811
Node 15: acceptance=0.811
Node 16: acceptance=0.811
Node 17: acceptance=0.858
Node 18: acceptance=0.811
Node 19: acceptance=0.811

=== PARALLEL EXECUTION TIME (realistic for distributed system) ===
  COMMUNICATION (max across nodes):
    - Sketch transfer: 0.000s (0.0%)
    - Model fetch (accepted): 0.000s (0.0%)
  COMPUTATION (max across nodes):
    - Sketching: 0.631s (94.9%)
    - Filtering: 0.001s (0.2%)
    - Aggregation: 0.033s (4.9%)
  TOTALS:
    - Total computation: 0.665s (100.0%)
    - Total communication: 0.000s (0.0%)
    - Total parallel time: 0.665s

=== PER-NODE AVERAGE TIME ===
  - Sketching: 0.559s
  - Filtering: 0.001s
  - Aggregation: 0.026s
  - Sketch transfer: 0.000s
  - Model fetch: 0.000s
  - Total per node: 0.586s

=== TOTAL COMPUTATIONAL WORK (sum across all nodes) ===
  - Total sketching: 11.188s
  - Total filtering: 0.018s
  - Total aggregation: 0.522s
  - Total sketch transfer: 0.000s
  - Total model fetch: 0.000s
  - Grand total: 11.728s
  - Mean acceptance rate: 0.820

Sketchguard Algorithm Properties:
  - Original dimension: 1,174,986
  - Sketch size: 180
  - Compression ratio: 19.9x
  - Single repetition: No repetitions needed
  - Theoretical complexity: O(d + N×k)
  - Approach: Sketch filtering + state aggregation
