Device: cuda
Seed: 987654321
Loading 1 LEAF Sent140 train files...
LEAF Sent140 train: 254555 users, 908652 samples
Building vocabulary (max_size=10000)...
Vocabulary size: 10000
Loading 1 LEAF Sent140 test files...
LEAF Sent140 test: 254555 users, 286281 samples
Found 254555 train users, 254555 test users, 254555 common users
User sample counts range: 494 (max) to 1 (min)
Distributed ALL 254555 users across 20 clients
Users per client: 12727 (with 15 clients getting +1 user)
Train partition sizes: [44353, 44290, 44657, 44907, 44696, 45843, 45801, 45619, 45069, 45639, 45821, 45311, 45779, 46056, 45625, 45984, 46428, 44737, 45540, 46497]
Test partition sizes: [14232, 14235, 14266, 14217, 14238, 14373, 14346, 14334, 14294, 14373, 14344, 14302, 14354, 14362, 14320, 14395, 14389, 14257, 14251, 14399]
  Client 0: 44353 train samples, 2 unique classes
  Client 1: 44290 train samples, 2 unique classes
  Client 2: 44657 train samples, 2 unique classes
  Client 3: 44907 train samples, 2 unique classes
  Client 4: 44696 train samples, 2 unique classes
  Client 5: 45843 train samples, 2 unique classes
  Client 6: 45801 train samples, 2 unique classes
  Client 7: 45619 train samples, 2 unique classes
  Client 8: 45069 train samples, 2 unique classes
  Client 9: 45639 train samples, 2 unique classes
  Client 10: 45821 train samples, 2 unique classes
  Client 11: 45311 train samples, 2 unique classes
  Client 12: 45779 train samples, 2 unique classes
  Client 13: 46056 train samples, 2 unique classes
  Client 14: 45625 train samples, 2 unique classes
  Client 15: 45984 train samples, 2 unique classes
  Client 16: 46428 train samples, 2 unique classes
  Client 17: 44737 train samples, 2 unique classes
  Client 18: 45540 train samples, 2 unique classes
  Client 19: 46497 train samples, 2 unique classes
Will sample 4500 samples per client per epoch
Graph: ring, nodes: 20, edges: 20
Degree statistics: avg=2.00, min=2, max=2
Attack: Compromised 2/20 nodes: [5, 13]
Attack type: backdoor, lambda: 1.0
Backdoor target label: 1, trigger size: 3
Model variant: baseline
Model parameters: 1,174,986
BALANCE algorithm:
Balance Config: BALANCEConfig(gamma=2, kappa=1, alpha=0.5, min_neighbors=1)
  - Model dimension: 1,174,986 parameters
  - Complexity: O(N×d) = O(20×1,174,986)
Initial test acc across nodes: mean=0.4965 ± 0.0152
Backdoor attack: Created poisoned datasets for 2 compromised nodes
Round 001: test acc mean=0.5224 ± 0.0208 | min=0.4965 max=0.5606
         : test loss mean=4.6826 ± 11.0765
         : individual accs = ['0.511031', '0.553495', '0.515211', '0.554407', '0.507796', '0.496486', '0.503206', '0.526441', '0.518679', '0.540110', '0.498048', '0.560621', '0.497074', '0.513438', '0.501676', '0.540396', '0.524776', '0.521218', '0.508736', '0.555941']
         : correct/total = [(7273, 14232), (7879, 14235), (7350, 14266), (7882, 14217), (7230, 14238), (7136, 14373), (7219, 14346), (7546, 14334), (7414, 14294), (7763, 14373), (7144, 14344), (8018, 14302), (7135, 14354), (7374, 14362), (7184, 14320), (7779, 14395), (7551, 14389), (7431, 14257), (7250, 14251), (8005, 14399)]
         : compromised: 0.5050, honest: 0.5244
Round 002: test acc mean=0.5020 ± 0.0117 | min=0.4712 max=0.5192
         : test loss mean=116.5580 ± 346.9153
         : individual accs = ['0.491568', '0.508114', '0.488925', '0.512837', '0.506602', '0.502887', '0.500697', '0.498744', '0.488597', '0.498782', '0.513385', '0.495805', '0.517765', '0.490600', '0.471159', '0.507676', '0.504552', '0.517570', '0.503754', '0.519203']
         : correct/total = [(6996, 14232), (7233, 14235), (6975, 14266), (7291, 14217), (7213, 14238), (7228, 14373), (7183, 14346), (7149, 14334), (6984, 14294), (7169, 14373), (7364, 14344), (7091, 14302), (7432, 14354), (7046, 14362), (6747, 14320), (7308, 14395), (7260, 14389), (7379, 14257), (7179, 14251), (7476, 14399)]
         : compromised: 0.4967, honest: 0.5025
Round 003: test acc mean=0.5005 ± 0.0100 | min=0.4863 max=0.5230
         : test loss mean=9671.4218 ± 29140.5624
         : individual accs = ['0.489179', '0.486336', '0.486541', '0.523036', '0.505268', '0.497600', '0.507459', '0.504465', '0.488317', '0.493147', '0.512828', '0.509229', '0.495054', '0.518800', '0.501327', '0.498298', '0.499757', '0.503051', '0.491685', '0.499618']
         : correct/total = [(6962, 14232), (6923, 14235), (6941, 14266), (7436, 14217), (7194, 14238), (7152, 14373), (7280, 14346), (7231, 14334), (6980, 14294), (7088, 14373), (7356, 14344), (7283, 14302), (7106, 14354), (7451, 14362), (7179, 14320), (7173, 14395), (7191, 14389), (7172, 14257), (7007, 14251), (7194, 14399)]
         : compromised: 0.5082, honest: 0.4997
Round 004: test acc mean=0.5039 ± 0.0124 | min=0.4867 max=0.5411
         : test loss mean=767066.9174 ± 2421030.4195
         : individual accs = ['0.489320', '0.486688', '0.541147', '0.498980', '0.520719', '0.510262', '0.497909', '0.504953', '0.517000', '0.493008', '0.502858', '0.500979', '0.492755', '0.507589', '0.496369', '0.517332', '0.502259', '0.503262', '0.494000', '0.499826']
         : correct/total = [(6964, 14232), (6928, 14235), (7720, 14266), (7094, 14217), (7414, 14238), (7334, 14373), (7143, 14346), (7238, 14334), (7390, 14294), (7086, 14373), (7213, 14344), (7165, 14302), (7073, 14354), (7290, 14362), (7108, 14320), (7447, 14395), (7227, 14389), (7175, 14257), (7040, 14251), (7197, 14399)]
         : compromised: 0.5089, honest: 0.5033
Round 005: test acc mean=0.5069 ± 0.0144 | min=0.4863 max=0.5451
         : test loss mean=34812198.1815 ± 104874946.4119
         : individual accs = ['0.489109', '0.486266', '0.545142', '0.512977', '0.502107', '0.507340', '0.504740', '0.506837', '0.511683', '0.493008', '0.500976', '0.525591', '0.501951', '0.509121', '0.502933', '0.534005', '0.514560', '0.503121', '0.489860', '0.496493']
         : correct/total = [(6961, 14232), (6922, 14235), (7777, 14266), (7293, 14217), (7149, 14238), (7292, 14373), (7241, 14346), (7265, 14334), (7314, 14294), (7086, 14373), (7186, 14344), (7517, 14302), (7205, 14354), (7312, 14362), (7202, 14320), (7687, 14395), (7404, 14389), (7173, 14257), (6981, 14251), (7149, 14399)]
         : compromised: 0.5082, honest: 0.5067
Round 006: test acc mean=0.5144 ± 0.0199 | min=0.4865 max=0.5646
         : test loss mean=2464978060.2535 ± 7421408098.7914
         : individual accs = ['0.489109', '0.486547', '0.539675', '0.520152', '0.515311', '0.507201', '0.506761', '0.528115', '0.512033', '0.564600', '0.516244', '0.526430', '0.498328', '0.516014', '0.494413', '0.506982', '0.544096', '0.530967', '0.488948', '0.496354']
         : correct/total = [(6961, 14232), (6926, 14235), (7699, 14266), (7395, 14217), (7337, 14238), (7290, 14373), (7270, 14346), (7570, 14334), (7319, 14294), (8115, 14373), (7405, 14344), (7529, 14302), (7153, 14354), (7411, 14362), (7080, 14320), (7298, 14395), (7829, 14389), (7570, 14257), (6968, 14251), (7147, 14399)]
         : compromised: 0.5116, honest: 0.5147
Round 007: test acc mean=0.5188 ± 0.0247 | min=0.4891 max=0.5720
         : test loss mean=226174332339.6318 ± 691520507878.0054
         : individual accs = ['0.489109', '0.513945', '0.538413', '0.508827', '0.512783', '0.505462', '0.509271', '0.508162', '0.554079', '0.571975', '0.555912', '0.511677', '0.499512', '0.495962', '0.504399', '0.507537', '0.545764', '0.558463', '0.489159', '0.496354']
         : correct/total = [(6961, 14232), (7316, 14235), (7681, 14266), (7234, 14217), (7301, 14238), (7265, 14373), (7306, 14346), (7284, 14334), (7920, 14294), (8221, 14373), (7974, 14344), (7318, 14302), (7170, 14354), (7123, 14362), (7223, 14320), (7306, 14395), (7853, 14389), (7962, 14257), (6971, 14251), (7147, 14399)]
         : compromised: 0.5007, honest: 0.5209
Round 008: test acc mean=0.5206 ± 0.0280 | min=0.4891 max=0.5885
         : test loss mean=18433574523517.3398 ± 56784288807224.3281
         : individual accs = ['0.489109', '0.548437', '0.531333', '0.503552', '0.508920', '0.501913', '0.498188', '0.520720', '0.545544', '0.588534', '0.550335', '0.501818', '0.490665', '0.496936', '0.498324', '0.518374', '0.545069', '0.571859', '0.505649', '0.496423']
         : correct/total = [(6961, 14232), (7807, 14235), (7580, 14266), (7159, 14217), (7246, 14238), (7214, 14373), (7147, 14346), (7464, 14334), (7798, 14294), (8459, 14373), (7894, 14344), (7177, 14302), (7043, 14354), (7137, 14362), (7136, 14320), (7462, 14395), (7843, 14389), (8153, 14257), (7206, 14251), (7148, 14399)]
         : compromised: 0.4994, honest: 0.5229
Round 009: test acc mean=0.5223 ± 0.0288 | min=0.4884 max=0.5856
         : test loss mean=1426092713278026.7500 ± 4348516476637765.5000
         : individual accs = ['0.491217', '0.576396', '0.537081', '0.505944', '0.501405', '0.503166', '0.488359', '0.496651', '0.533650', '0.585612', '0.553751', '0.506712', '0.512819', '0.499721', '0.499721', '0.510316', '0.536590', '0.558673', '0.551119', '0.496562']
         : correct/total = [(6991, 14232), (8205, 14235), (7662, 14266), (7193, 14217), (7139, 14238), (7232, 14373), (7006, 14346), (7119, 14334), (7628, 14294), (8417, 14373), (7943, 14344), (7247, 14302), (7361, 14354), (7177, 14362), (7156, 14320), (7346, 14395), (7721, 14389), (7965, 14257), (7854, 14251), (7150, 14399)]
         : compromised: 0.5014, honest: 0.5246
Round 010: test acc mean=0.5237 ± 0.0264 | min=0.4965 max=0.5753
         : test loss mean=112842318572233696.0000 ± 340834131835724736.0000
         : individual accs = ['0.548272', '0.575342', '0.541147', '0.506014', '0.502107', '0.499339', '0.497281', '0.500419', '0.528054', '0.574132', '0.529490', '0.506013', '0.511983', '0.501393', '0.498743', '0.511705', '0.529710', '0.570457', '0.545927', '0.496493']
         : correct/total = [(7803, 14232), (8190, 14235), (7720, 14266), (7194, 14217), (7149, 14238), (7177, 14373), (7134, 14346), (7173, 14334), (7548, 14294), (8252, 14373), (7595, 14344), (7237, 14302), (7349, 14354), (7201, 14362), (7142, 14320), (7366, 14395), (7622, 14389), (8133, 14257), (7780, 14251), (7149, 14399)]
         : compromised: 0.5004, honest: 0.5263

=== FINAL RESULTS ===
Dataset: sent140, Nodes: 20, Graph: ring, Aggregation: balance
Attack: backdoor, 10.0% compromised
Final accuracy - Compromised: 0.5004, Honest: 0.5263
Overall test accuracy: mean=0.5237 ± 0.0264

=== BACKDOOR ATTACK SUCCESS RATE (ASR) ===
Target label: 1
Trigger size: 3x3
Overall ASR: 0.5481 ± 0.2348
Honest nodes ASR: 0.5040 ± 0.2040
Compromised nodes ASR: 0.9448 ± 0.0457
Note: Higher ASR indicates more successful backdoor attack

=== BALANCE SUMMARY ===
Node 0: acceptance=1.000
Node 1: acceptance=1.000
Node 2: acceptance=1.000
Node 3: acceptance=1.000
Node 4: acceptance=1.000
Node 5: acceptance=0.600
Node 6: acceptance=1.000
Node 7: acceptance=1.000
Node 8: acceptance=1.000
Node 9: acceptance=1.000
Node 10: acceptance=1.000
Node 11: acceptance=1.000
Node 12: acceptance=1.000
Node 13: acceptance=0.600
Node 14: acceptance=1.000
Node 15: acceptance=1.000
Node 16: acceptance=1.000
Node 17: acceptance=1.000
Node 18: acceptance=1.000
Node 19: acceptance=1.000

=== PARALLEL EXECUTION TIME (realistic for distributed system) ===
  COMMUNICATION (max across nodes):
    - Full model transfer: 0.000s (0.0%)
  COMPUTATION (max across nodes):
    - Filtering: 0.015s (55.7%)
    - Aggregation: 0.012s (44.2%)
  TOTALS:
    - Total computation: 0.027s (100.0%)
    - Total communication: 0.000s (0.0%)
    - Total parallel time: 0.027s

=== PER-NODE AVERAGE TIME ===
  - Filtering: 0.011s
  - Aggregation: 0.006s
  - Model transfer: 0.000s
  - Total per node: 0.017s

=== TOTAL COMPUTATIONAL WORK (sum across all nodes) ===
  - Total filtering: 0.229s
  - Total aggregation: 0.114s
  - Total model transfer: 0.000s
  - Grand total: 0.343s
  - Mean acceptance rate: 0.960

BALANCE Algorithm Properties:
  - Model dimension: 1,174,986
  - No compression: Full parameter comparison
  - Theoretical complexity: O(deg(i)×d)
  - Approach: Full parameter filtering + averaging
