Device: cuda
Seed: 987654321
Loading 1 LEAF Sent140 train files...
LEAF Sent140 train: 254555 users, 908652 samples
Building vocabulary (max_size=10000)...
Vocabulary size: 10000
Loading 1 LEAF Sent140 test files...
LEAF Sent140 test: 254555 users, 286281 samples
Found 254555 train users, 254555 test users, 254555 common users
User sample counts range: 494 (max) to 1 (min)
Distributed ALL 254555 users across 20 clients
Users per client: 12727 (with 15 clients getting +1 user)
Train partition sizes: [44353, 44290, 44657, 44907, 44696, 45843, 45801, 45619, 45069, 45639, 45821, 45311, 45779, 46056, 45625, 45984, 46428, 44737, 45540, 46497]
Test partition sizes: [14232, 14235, 14266, 14217, 14238, 14373, 14346, 14334, 14294, 14373, 14344, 14302, 14354, 14362, 14320, 14395, 14389, 14257, 14251, 14399]
  Client 0: 44353 train samples, 2 unique classes
  Client 1: 44290 train samples, 2 unique classes
  Client 2: 44657 train samples, 2 unique classes
  Client 3: 44907 train samples, 2 unique classes
  Client 4: 44696 train samples, 2 unique classes
  Client 5: 45843 train samples, 2 unique classes
  Client 6: 45801 train samples, 2 unique classes
  Client 7: 45619 train samples, 2 unique classes
  Client 8: 45069 train samples, 2 unique classes
  Client 9: 45639 train samples, 2 unique classes
  Client 10: 45821 train samples, 2 unique classes
  Client 11: 45311 train samples, 2 unique classes
  Client 12: 45779 train samples, 2 unique classes
  Client 13: 46056 train samples, 2 unique classes
  Client 14: 45625 train samples, 2 unique classes
  Client 15: 45984 train samples, 2 unique classes
  Client 16: 46428 train samples, 2 unique classes
  Client 17: 44737 train samples, 2 unique classes
  Client 18: 45540 train samples, 2 unique classes
  Client 19: 46497 train samples, 2 unique classes
Will sample 4500 samples per client per epoch
Graph: erdos, nodes: 20, edges: 99
Degree statistics: avg=9.90, min=7, max=14
Attack: Compromised 8/20 nodes: [1, 5, 11, 12, 13, 14, 17, 18]
Attack type: backdoor, lambda: 1.0
Backdoor target label: 1, trigger size: 3
Model variant: baseline
Model parameters: 1,174,986
Initial test acc across nodes: mean=0.4965 ± 0.0152
Backdoor attack: Created poisoned datasets for 8 compromised nodes
Round 001: test acc mean=0.4990 ± 0.0057 | min=0.4885 max=0.5099
         : test loss mean=17.4338 ± 8.5900
         : individual accs = ['0.503794', '0.505163', '0.495233', '0.508405', '0.496980', '0.502957', '0.496863', '0.500488', '0.509864', '0.488485', '0.502231', '0.492588', '0.497144', '0.490461', '0.495391', '0.503022', '0.499131', '0.492881', '0.503894', '0.495729']
         : correct/total = [(7170, 14232), (7191, 14235), (7065, 14266), (7228, 14217), (7076, 14238), (7229, 14373), (7128, 14346), (7174, 14334), (7288, 14294), (7021, 14373), (7204, 14344), (7045, 14302), (7136, 14354), (7044, 14362), (7094, 14320), (7241, 14395), (7182, 14389), (7027, 14257), (7181, 14251), (7138, 14399)]
         : compromised: 0.4976, honest: 0.5000
Round 002: test acc mean=0.5052 ± 0.0070 | min=0.4939 max=0.5176
         : test loss mean=32.3765 ± 17.2994
         : individual accs = ['0.509415', '0.514015', '0.512617', '0.517620', '0.497191', '0.507062', '0.503625', '0.502791', '0.513992', '0.508105', '0.501743', '0.513005', '0.499025', '0.493873', '0.506774', '0.495936', '0.496490', '0.497650', '0.510982', '0.502118']
         : correct/total = [(7250, 14232), (7317, 14235), (7313, 14266), (7359, 14217), (7079, 14238), (7288, 14373), (7225, 14346), (7207, 14334), (7347, 14294), (7303, 14373), (7197, 14344), (7337, 14302), (7163, 14354), (7093, 14362), (7257, 14320), (7139, 14395), (7144, 14389), (7095, 14257), (7282, 14251), (7230, 14399)]
         : compromised: 0.5053, honest: 0.5051
Round 003: test acc mean=0.5030 ± 0.0083 | min=0.4825 max=0.5205
         : test loss mean=3.4666 ± 1.9135
         : individual accs = ['0.513350', '0.510924', '0.513529', '0.493142', '0.504495', '0.505949', '0.496236', '0.508581', '0.498111', '0.508036', '0.496375', '0.506992', '0.498119', '0.497215', '0.499791', '0.482459', '0.504483', '0.500736', '0.520455', '0.501979']
         : correct/total = [(7306, 14232), (7273, 14235), (7326, 14266), (7011, 14217), (7183, 14238), (7272, 14373), (7119, 14346), (7290, 14334), (7120, 14294), (7302, 14373), (7120, 14344), (7251, 14302), (7150, 14354), (7141, 14362), (7157, 14320), (6945, 14395), (7259, 14389), (7139, 14257), (7417, 14251), (7228, 14399)]
         : compromised: 0.5050, honest: 0.5017
Round 004: test acc mean=0.4971 ± 0.0117 | min=0.4749 max=0.5190
         : test loss mean=8.1005 ± 4.7959
         : individual accs = ['0.491639', '0.496312', '0.486331', '0.519027', '0.490799', '0.487511', '0.498327', '0.490721', '0.487687', '0.501774', '0.514431', '0.495665', '0.512401', '0.506406', '0.501955', '0.477944', '0.474946', '0.511959', '0.505438', '0.490798']
         : correct/total = [(6997, 14232), (7065, 14235), (6938, 14266), (7379, 14217), (6988, 14238), (7007, 14373), (7149, 14346), (7034, 14334), (6971, 14294), (7212, 14373), (7379, 14344), (7089, 14302), (7355, 14354), (7273, 14362), (7188, 14320), (6880, 14395), (6834, 14389), (7299, 14257), (7203, 14251), (7067, 14399)]
         : compromised: 0.5022, honest: 0.4937
Round 005: test acc mean=0.5107 ± 0.0101 | min=0.4862 max=0.5237
         : test loss mean=2.9607 ± 2.5266
         : individual accs = ['0.516653', '0.514436', '0.515982', '0.494197', '0.503793', '0.514715', '0.519727', '0.505511', '0.511543', '0.508662', '0.519869', '0.520137', '0.523687', '0.486214', '0.521927', '0.508093', '0.493224', '0.511047', '0.520104', '0.505382']
         : correct/total = [(7353, 14232), (7323, 14235), (7361, 14266), (7026, 14217), (7173, 14238), (7398, 14373), (7456, 14346), (7246, 14334), (7312, 14294), (7311, 14373), (7457, 14344), (7439, 14302), (7517, 14354), (6983, 14362), (7474, 14320), (7314, 14395), (7097, 14389), (7286, 14257), (7412, 14251), (7277, 14399)]
         : compromised: 0.5140, honest: 0.5086
Round 006: test acc mean=0.5042 ± 0.0058 | min=0.4916 max=0.5139
         : test loss mean=3.6273 ± 1.9549
         : individual accs = ['0.491568', '0.508044', '0.502664', '0.505100', '0.501826', '0.498017', '0.513941', '0.510325', '0.508115', '0.505810', '0.513455', '0.504405', '0.510450', '0.493455', '0.503561', '0.502883', '0.501772', '0.498001', '0.507122', '0.504063']
         : correct/total = [(6996, 14232), (7232, 14235), (7171, 14266), (7181, 14217), (7145, 14238), (7158, 14373), (7373, 14346), (7315, 14334), (7263, 14294), (7270, 14373), (7365, 14344), (7214, 14302), (7327, 14354), (7087, 14362), (7211, 14320), (7239, 14395), (7220, 14389), (7100, 14257), (7227, 14251), (7258, 14399)]
         : compromised: 0.5029, honest: 0.5051
Round 007: test acc mean=0.4965 ± 0.0093 | min=0.4848 max=0.5160
         : test loss mean=6.8644 ± 5.5310
         : individual accs = ['0.484753', '0.504531', '0.494813', '0.488640', '0.499157', '0.487094', '0.492402', '0.486047', '0.501889', '0.503235', '0.508366', '0.486435', '0.501324', '0.516014', '0.498534', '0.492879', '0.486761', '0.489514', '0.514981', '0.491979']
         : correct/total = [(6899, 14232), (7182, 14235), (7059, 14266), (6947, 14217), (7107, 14238), (7001, 14373), (7064, 14346), (6967, 14334), (7174, 14294), (7233, 14373), (7292, 14344), (6957, 14302), (7196, 14354), (7411, 14362), (7139, 14320), (7095, 14395), (7004, 14389), (6979, 14257), (7339, 14251), (7084, 14399)]
         : compromised: 0.4998, honest: 0.4942
Round 008: test acc mean=0.5006 ± 0.0076 | min=0.4893 max=0.5181
         : test loss mean=8.0752 ± 5.0395
         : individual accs = ['0.498384', '0.502353', '0.495444', '0.489344', '0.509622', '0.495095', '0.492960', '0.499791', '0.496222', '0.502261', '0.497769', '0.501678', '0.500070', '0.518103', '0.493296', '0.513790', '0.499201', '0.495195', '0.514701', '0.496493']
         : correct/total = [(7093, 14232), (7151, 14235), (7068, 14266), (6957, 14217), (7256, 14238), (7116, 14373), (7072, 14346), (7164, 14334), (7093, 14294), (7219, 14373), (7140, 14344), (7175, 14302), (7178, 14354), (7441, 14362), (7064, 14320), (7396, 14395), (7183, 14389), (7060, 14257), (7335, 14251), (7149, 14399)]
         : compromised: 0.5026, honest: 0.4993
Round 009: test acc mean=0.5015 ± 0.0078 | min=0.4883 max=0.5207
         : test loss mean=4.2159 ± 2.6622
         : individual accs = ['0.497119', '0.511416', '0.500280', '0.495815', '0.494381', '0.499409', '0.492890', '0.489466', '0.506506', '0.509775', '0.500767', '0.502307', '0.508221', '0.504456', '0.488268', '0.499201', '0.498367', '0.520727', '0.509859', '0.500035']
         : correct/total = [(7075, 14232), (7280, 14235), (7137, 14266), (7049, 14217), (7039, 14238), (7178, 14373), (7071, 14346), (7016, 14334), (7240, 14294), (7327, 14373), (7183, 14344), (7184, 14302), (7295, 14354), (7245, 14362), (6992, 14320), (7186, 14395), (7171, 14389), (7424, 14257), (7266, 14251), (7200, 14399)]
         : compromised: 0.5056, honest: 0.4987
Round 010: test acc mean=0.5024 ± 0.0070 | min=0.4896 max=0.5139
         : test loss mean=29.3449 ± 22.4192
         : individual accs = ['0.504005', '0.503688', '0.501402', '0.506436', '0.507515', '0.506644', '0.496027', '0.489605', '0.502868', '0.508105', '0.512828', '0.491540', '0.513933', '0.497354', '0.493087', '0.510386', '0.506707', '0.496037', '0.505579', '0.493715']
         : correct/total = [(7173, 14232), (7170, 14235), (7153, 14266), (7200, 14217), (7226, 14238), (7282, 14373), (7116, 14346), (7018, 14334), (7188, 14294), (7303, 14373), (7356, 14344), (7030, 14302), (7377, 14354), (7143, 14362), (7061, 14320), (7347, 14395), (7291, 14389), (7072, 14257), (7205, 14251), (7109, 14399)]
         : compromised: 0.5010, honest: 0.5033

=== FINAL RESULTS ===
Dataset: sent140, Nodes: 20, Graph: erdos, Aggregation: krum
Attack: backdoor, 40.0% compromised
Final accuracy - Compromised: 0.5010, Honest: 0.5033
Overall test accuracy: mean=0.5024 ± 0.0070

=== BACKDOOR ATTACK SUCCESS RATE (ASR) ===
Target label: 1
Trigger size: 3x3
Overall ASR: 0.3454 ± 0.1342
Honest nodes ASR: 0.3411 ± 0.1414
Compromised nodes ASR: 0.3518 ± 0.1223
Note: Higher ASR indicates more successful backdoor attack
