Device: cuda
Seed: 987654321
Loading 1 LEAF Sent140 train files...
LEAF Sent140 train: 254555 users, 908652 samples
Building vocabulary (max_size=10000)...
Vocabulary size: 10000
Loading 1 LEAF Sent140 test files...
LEAF Sent140 test: 254555 users, 286281 samples
Found 254555 train users, 254555 test users, 254555 common users
User sample counts range: 494 (max) to 1 (min)
Distributed ALL 254555 users across 20 clients
Users per client: 12727 (with 15 clients getting +1 user)
Train partition sizes: [44353, 44290, 44657, 44907, 44696, 45843, 45801, 45619, 45069, 45639, 45821, 45311, 45779, 46056, 45625, 45984, 46428, 44737, 45540, 46497]
Test partition sizes: [14232, 14235, 14266, 14217, 14238, 14373, 14346, 14334, 14294, 14373, 14344, 14302, 14354, 14362, 14320, 14395, 14389, 14257, 14251, 14399]
  Client 0: 44353 train samples, 2 unique classes
  Client 1: 44290 train samples, 2 unique classes
  Client 2: 44657 train samples, 2 unique classes
  Client 3: 44907 train samples, 2 unique classes
  Client 4: 44696 train samples, 2 unique classes
  Client 5: 45843 train samples, 2 unique classes
  Client 6: 45801 train samples, 2 unique classes
  Client 7: 45619 train samples, 2 unique classes
  Client 8: 45069 train samples, 2 unique classes
  Client 9: 45639 train samples, 2 unique classes
  Client 10: 45821 train samples, 2 unique classes
  Client 11: 45311 train samples, 2 unique classes
  Client 12: 45779 train samples, 2 unique classes
  Client 13: 46056 train samples, 2 unique classes
  Client 14: 45625 train samples, 2 unique classes
  Client 15: 45984 train samples, 2 unique classes
  Client 16: 46428 train samples, 2 unique classes
  Client 17: 44737 train samples, 2 unique classes
  Client 18: 45540 train samples, 2 unique classes
  Client 19: 46497 train samples, 2 unique classes
Will sample 4500 samples per client per epoch
Graph: erdos, nodes: 20, edges: 126
Degree statistics: avg=12.60, min=8, max=16
Attack: Compromised 8/20 nodes: [1, 5, 11, 12, 13, 14, 17, 18]
Attack type: backdoor, lambda: 1.0
Backdoor target label: 1, trigger size: 3
Model variant: baseline
Model parameters: 1,174,986
Sketchguard Node 0:
  Model dim: 1,174,986 → Sketch size: 180
  Compression ratio: 6527.7x
  Using model parameters for aggregation, sketches for filtering
Sketchguard Node 1:
  Model dim: 1,174,986 → Sketch size: 180
  Compression ratio: 6527.7x
  Using model parameters for aggregation, sketches for filtering
Sketchguard Node 2:
  Model dim: 1,174,986 → Sketch size: 180
  Compression ratio: 6527.7x
  Using model parameters for aggregation, sketches for filtering
Sketchguard Node 3:
  Model dim: 1,174,986 → Sketch size: 180
  Compression ratio: 6527.7x
  Using model parameters for aggregation, sketches for filtering
Sketchguard Node 4:
  Model dim: 1,174,986 → Sketch size: 180
  Compression ratio: 6527.7x
  Using model parameters for aggregation, sketches for filtering
Sketchguard Node 5:
  Model dim: 1,174,986 → Sketch size: 180
  Compression ratio: 6527.7x
  Using model parameters for aggregation, sketches for filtering
Sketchguard Node 6:
  Model dim: 1,174,986 → Sketch size: 180
  Compression ratio: 6527.7x
  Using model parameters for aggregation, sketches for filtering
Sketchguard Node 7:
  Model dim: 1,174,986 → Sketch size: 180
  Compression ratio: 6527.7x
  Using model parameters for aggregation, sketches for filtering
Sketchguard Node 8:
  Model dim: 1,174,986 → Sketch size: 180
  Compression ratio: 6527.7x
  Using model parameters for aggregation, sketches for filtering
Sketchguard Node 9:
  Model dim: 1,174,986 → Sketch size: 180
  Compression ratio: 6527.7x
  Using model parameters for aggregation, sketches for filtering
Sketchguard Node 10:
  Model dim: 1,174,986 → Sketch size: 180
  Compression ratio: 6527.7x
  Using model parameters for aggregation, sketches for filtering
Sketchguard Node 11:
  Model dim: 1,174,986 → Sketch size: 180
  Compression ratio: 6527.7x
  Using model parameters for aggregation, sketches for filtering
Sketchguard Node 12:
  Model dim: 1,174,986 → Sketch size: 180
  Compression ratio: 6527.7x
  Using model parameters for aggregation, sketches for filtering
Sketchguard Node 13:
  Model dim: 1,174,986 → Sketch size: 180
  Compression ratio: 6527.7x
  Using model parameters for aggregation, sketches for filtering
Sketchguard Node 14:
  Model dim: 1,174,986 → Sketch size: 180
  Compression ratio: 6527.7x
  Using model parameters for aggregation, sketches for filtering
Sketchguard Node 15:
  Model dim: 1,174,986 → Sketch size: 180
  Compression ratio: 6527.7x
  Using model parameters for aggregation, sketches for filtering
Sketchguard Node 16:
  Model dim: 1,174,986 → Sketch size: 180
  Compression ratio: 6527.7x
  Using model parameters for aggregation, sketches for filtering
Sketchguard Node 17:
  Model dim: 1,174,986 → Sketch size: 180
  Compression ratio: 6527.7x
  Using model parameters for aggregation, sketches for filtering
Sketchguard Node 18:
  Model dim: 1,174,986 → Sketch size: 180
  Compression ratio: 6527.7x
  Using model parameters for aggregation, sketches for filtering
Sketchguard Node 19:
  Model dim: 1,174,986 → Sketch size: 180
  Compression ratio: 6527.7x
  Using model parameters for aggregation, sketches for filtering
Sketchguard ALGORITHM (Sketch-based Filtering + State Aggregation)
  - Model dimension: 1,174,986 parameters
  - Config: SketchguardConfig(gamma=2, kappa=1, alpha=0.5, min_neighbors=1, sketch_size=180, network_seed=987654321, attack_detection_window=5)
  - Sketch size: 180
  - Compression ratio: 6527.7x
  - Complexity: O(d + N×k) = O(1,174,986 + 20×180)
  - Theoretical speedup vs BALANCE: 19.9x
Initial test acc across nodes: mean=0.4965 ± 0.0152
Backdoor attack: Created poisoned datasets for 8 compromised nodes
Round 001: test acc mean=0.4982 ± 0.0084 | min=0.4820 max=0.5110
         : test loss mean=14.1023 ± 17.5381
         : individual accs = ['0.483488', '0.495609', '0.483527', '0.505803', '0.497261', '0.499200', '0.511014', '0.503767', '0.496362', '0.497113', '0.500767', '0.493707', '0.506618', '0.510096', '0.498743', '0.497048', '0.482035', '0.503682', '0.489439', '0.507813']
         : correct/total = [(6881, 14232), (7055, 14235), (6898, 14266), (7191, 14217), (7080, 14238), (7175, 14373), (7331, 14346), (7221, 14334), (7095, 14294), (7145, 14373), (7183, 14344), (7061, 14302), (7272, 14354), (7326, 14362), (7142, 14320), (7155, 14395), (6936, 14389), (7181, 14257), (6975, 14251), (7312, 14399)]
         : compromised: 0.4996, honest: 0.4972
         : sketchguard stats = ['Node 0: acc_rate=1.000', 'Node 1: acc_rate=1.000', 'Node 2: acc_rate=1.000']...
Round 002: test acc mean=0.5124 ± 0.0152 | min=0.4923 max=0.5494
         : test loss mean=594.8119 ± 735.4246
         : individual accs = ['0.514053', '0.498560', '0.527268', '0.508405', '0.540385', '0.504070', '0.510107', '0.512209', '0.512733', '0.528839', '0.504671', '0.500280', '0.494078', '0.492271', '0.501955', '0.549357', '0.501911', '0.507260', '0.505228', '0.533995']
         : correct/total = [(7316, 14232), (7097, 14235), (7522, 14266), (7228, 14217), (7694, 14238), (7245, 14373), (7318, 14346), (7342, 14334), (7329, 14294), (7601, 14373), (7239, 14344), (7155, 14302), (7092, 14354), (7070, 14362), (7188, 14320), (7908, 14395), (7222, 14389), (7232, 14257), (7200, 14251), (7689, 14399)]
         : compromised: 0.5005, honest: 0.5203
         : sketchguard stats = ['Node 0: acc_rate=0.781', 'Node 1: acc_rate=1.000', 'Node 2: acc_rate=0.750']...
Round 003: test acc mean=0.5268 ± 0.0252 | min=0.4872 max=0.5696
         : test loss mean=31729.1506 ± 39361.3128
         : individual accs = ['0.534429', '0.500808', '0.539675', '0.508757', '0.552044', '0.498226', '0.524258', '0.543324', '0.548062', '0.543728', '0.569646', '0.487205', '0.507315', '0.515945', '0.500838', '0.568183', '0.547988', '0.502280', '0.493018', '0.550316']
         : correct/total = [(7606, 14232), (7129, 14235), (7699, 14266), (7233, 14217), (7860, 14238), (7161, 14373), (7521, 14346), (7788, 14334), (7834, 14294), (7815, 14373), (8171, 14344), (6968, 14302), (7282, 14354), (7410, 14362), (7172, 14320), (8179, 14395), (7885, 14389), (7161, 14257), (7026, 14251), (7924, 14399)]
         : compromised: 0.5007, honest: 0.5442
         : sketchguard stats = ['Node 0: acc_rate=0.708', 'Node 1: acc_rate=1.000', 'Node 2: acc_rate=0.667']...
Round 004: test acc mean=0.5404 ± 0.0387 | min=0.4838 max=0.5841
         : test loss mean=4481753.1538 ± 5634678.9157
         : individual accs = ['0.563027', '0.486969', '0.574653', '0.557713', '0.584071', '0.500174', '0.558483', '0.582740', '0.570309', '0.568775', '0.571528', '0.502937', '0.496656', '0.483777', '0.489385', '0.577353', '0.573633', '0.496037', '0.495263', '0.574623']
         : correct/total = [(8013, 14232), (6932, 14235), (8198, 14266), (7929, 14217), (8316, 14238), (7189, 14373), (8012, 14346), (8353, 14334), (8152, 14294), (8175, 14373), (8198, 14344), (7193, 14302), (7129, 14354), (6948, 14362), (7008, 14320), (8311, 14395), (8254, 14389), (7072, 14257), (7058, 14251), (8274, 14399)]
         : compromised: 0.4939, honest: 0.5714
         : sketchguard stats = ['Node 0: acc_rate=0.672', 'Node 1: acc_rate=1.000', 'Node 2: acc_rate=0.625']...
Round 005: test acc mean=0.5557 ± 0.0493 | min=0.4874 max=0.6020
         : test loss mean=240694545.4411 ± 296994671.3371
         : individual accs = ['0.592257', '0.502002', '0.599047', '0.591194', '0.596011', '0.487372', '0.596403', '0.594600', '0.598223', '0.599249', '0.601994', '0.489162', '0.495541', '0.499861', '0.503911', '0.596179', '0.583988', '0.499684', '0.488527', '0.599764']
         : correct/total = [(8429, 14232), (7146, 14235), (8546, 14266), (8405, 14217), (8486, 14238), (7005, 14373), (8556, 14346), (8523, 14334), (8551, 14294), (8613, 14373), (8635, 14344), (6996, 14302), (7113, 14354), (7179, 14362), (7216, 14320), (8582, 14395), (8403, 14389), (7124, 14257), (6962, 14251), (8636, 14399)]
         : compromised: 0.4958, honest: 0.5957
         : sketchguard stats = ['Node 0: acc_rate=0.650', 'Node 1: acc_rate=1.000', 'Node 2: acc_rate=0.600']...
Round 006: test acc mean=0.5651 ± 0.0520 | min=0.4950 max=0.6111
         : test loss mean=17590706727.5805 ± 21694479663.2320
         : individual accs = ['0.606169', '0.505374', '0.610122', '0.608849', '0.608161', '0.495025', '0.610414', '0.606111', '0.603400', '0.608363', '0.611127', '0.499930', '0.502160', '0.501253', '0.507402', '0.604168', '0.603725', '0.498632', '0.502351', '0.608792']
         : correct/total = [(8627, 14232), (7194, 14235), (8704, 14266), (8656, 14217), (8659, 14238), (7115, 14373), (8757, 14346), (8688, 14334), (8625, 14294), (8744, 14373), (8766, 14344), (7150, 14302), (7208, 14354), (7199, 14362), (7266, 14320), (8697, 14395), (8687, 14389), (7109, 14257), (7159, 14251), (8766, 14399)]
         : compromised: 0.5015, honest: 0.6075
         : sketchguard stats = ['Node 0: acc_rate=0.635', 'Node 1: acc_rate=1.000', 'Node 2: acc_rate=0.583']...
Round 007: test acc mean=0.5711 ± 0.0557 | min=0.4952 max=0.6210
         : test loss mean=1516225157479.8171 ± 1864052201428.1133
         : individual accs = ['0.613687', '0.507411', '0.615590', '0.621017', '0.617011', '0.505114', '0.618361', '0.614134', '0.617182', '0.613511', '0.617680', '0.508530', '0.495193', '0.510723', '0.499791', '0.619590', '0.611856', '0.501438', '0.496246', '0.618237']
         : correct/total = [(8734, 14232), (7223, 14235), (8782, 14266), (8829, 14217), (8785, 14238), (7260, 14373), (8871, 14346), (8803, 14334), (8822, 14294), (8818, 14373), (8860, 14344), (7273, 14302), (7108, 14354), (7335, 14362), (7157, 14320), (8919, 14395), (8804, 14389), (7149, 14257), (7072, 14251), (8902, 14399)]
         : compromised: 0.5031, honest: 0.6165
         : sketchguard stats = ['Node 0: acc_rate=0.625', 'Node 1: acc_rate=0.857', 'Node 2: acc_rate=0.571']...
Round 008: test acc mean=0.5747 ± 0.0594 | min=0.4968 max=0.6276
         : test loss mean=127197645105544.9688 ± 157004351374228.3438
         : individual accs = ['0.621627', '0.502634', '0.622109', '0.626222', '0.617643', '0.509219', '0.621846', '0.620832', '0.627606', '0.620886', '0.625976', '0.498881', '0.496795', '0.504665', '0.499651', '0.625981', '0.621864', '0.497791', '0.506771', '0.624835']
         : correct/total = [(8847, 14232), (7155, 14235), (8875, 14266), (8903, 14217), (8794, 14238), (7319, 14373), (8921, 14346), (8899, 14334), (8971, 14294), (8924, 14373), (8979, 14344), (7135, 14302), (7131, 14354), (7248, 14362), (7155, 14320), (9011, 14395), (8948, 14389), (7097, 14257), (7222, 14251), (8997, 14399)]
         : compromised: 0.5021, honest: 0.6231
         : sketchguard stats = ['Node 0: acc_rate=0.617', 'Node 1: acc_rate=0.750', 'Node 2: acc_rate=0.562']...
Round 009: test acc mean=0.5780 ± 0.0613 | min=0.4956 max=0.6320
         : test loss mean=10815239379216736.0000 ± 13385949920989872.0000
         : individual accs = ['0.630410', '0.495609', '0.627085', '0.626363', '0.624666', '0.504070', '0.627074', '0.623064', '0.631174', '0.625757', '0.630508', '0.498602', '0.505504', '0.511349', '0.513198', '0.630914', '0.626173', '0.496809', '0.500526', '0.631988']
         : correct/total = [(8972, 14232), (7055, 14235), (8946, 14266), (8905, 14217), (8894, 14238), (7245, 14373), (8996, 14346), (8931, 14334), (9022, 14294), (8994, 14373), (9044, 14344), (7131, 14302), (7256, 14354), (7344, 14362), (7349, 14320), (9082, 14395), (9010, 14389), (7083, 14257), (7133, 14251), (9100, 14399)]
         : compromised: 0.5032, honest: 0.6279
         : sketchguard stats = ['Node 0: acc_rate=0.611', 'Node 1: acc_rate=0.667', 'Node 2: acc_rate=0.556']...
Round 010: test acc mean=0.5816 ± 0.0645 | min=0.4966 max=0.6393
         : test loss mean=889992795620693760.0000 ± 1104374622321548032.0000
         : individual accs = ['0.633853', '0.498419', '0.632132', '0.639305', '0.629934', '0.496626', '0.633626', '0.633040', '0.635162', '0.631601', '0.636852', '0.499371', '0.497074', '0.511071', '0.513338', '0.635359', '0.632080', '0.502420', '0.503403', '0.637197']
         : correct/total = [(9021, 14232), (7095, 14235), (9018, 14266), (9089, 14217), (8969, 14238), (7138, 14373), (9090, 14346), (9074, 14334), (9079, 14294), (9078, 14373), (9135, 14344), (7142, 14302), (7135, 14354), (7340, 14362), (7351, 14320), (9146, 14395), (9095, 14389), (7163, 14257), (7174, 14251), (9175, 14399)]
         : compromised: 0.5027, honest: 0.6342
         : sketchguard stats = ['Node 0: acc_rate=0.606', 'Node 1: acc_rate=0.600', 'Node 2: acc_rate=0.550']...

=== FINAL RESULTS ===
Dataset: sent140, Nodes: 20, Graph: erdos, Aggregation: sketchguard
Attack: backdoor, 40.0% compromised
Final accuracy - Compromised: 0.5027, Honest: 0.6342
Overall test accuracy: mean=0.5816 ± 0.0645

=== BACKDOOR ATTACK SUCCESS RATE (ASR) ===
Target label: 1
Trigger size: 3x3
Overall ASR: 0.7024 ± 0.2357
Honest nodes ASR: 0.5113 ± 0.0337
Compromised nodes ASR: 0.9892 ± 0.0126
Note: Higher ASR indicates more successful backdoor attack

=== Sketchguard SUMMARY ===
Node 0: acceptance=0.606
Node 1: acceptance=0.600
Node 2: acceptance=0.550
Node 3: acceptance=0.662
Node 4: acceptance=0.591
Node 5: acceptance=0.600
Node 6: acceptance=0.550
Node 7: acceptance=0.550
Node 8: acceptance=0.550
Node 9: acceptance=0.723
Node 10: acceptance=0.600
Node 11: acceptance=0.600
Node 12: acceptance=0.600
Node 13: acceptance=0.600
Node 14: acceptance=0.600
Node 15: acceptance=0.591
Node 16: acceptance=0.585
Node 17: acceptance=0.600
Node 18: acceptance=0.600
Node 19: acceptance=0.550

=== PARALLEL EXECUTION TIME (realistic for distributed system) ===
  COMMUNICATION (max across nodes):
    - Sketch transfer: 0.000s (0.0%)
    - Model fetch (accepted): 0.000s (0.0%)
  COMPUTATION (max across nodes):
    - Sketching: 0.425s (95.4%)
    - Filtering: 0.001s (0.2%)
    - Aggregation: 0.019s (4.4%)
  TOTALS:
    - Total computation: 0.446s (100.0%)
    - Total communication: 0.000s (0.0%)
    - Total parallel time: 0.446s

=== PER-NODE AVERAGE TIME ===
  - Sketching: 0.338s
  - Filtering: 0.001s
  - Aggregation: 0.015s
  - Sketch transfer: 0.000s
  - Model fetch: 0.000s
  - Total per node: 0.353s

=== TOTAL COMPUTATIONAL WORK (sum across all nodes) ===
  - Total sketching: 6.755s
  - Total filtering: 0.013s
  - Total aggregation: 0.301s
  - Total sketch transfer: 0.000s
  - Total model fetch: 0.000s
  - Grand total: 7.069s
  - Mean acceptance rate: 0.595

Sketchguard Algorithm Properties:
  - Original dimension: 1,174,986
  - Sketch size: 180
  - Compression ratio: 19.9x
  - Single repetition: No repetitions needed
  - Theoretical complexity: O(d + N×k)
  - Approach: Sketch filtering + state aggregation
