Device: cuda
Seed: 987654321
Loading 1 LEAF Sent140 train files...
LEAF Sent140 train: 254555 users, 908652 samples
Building vocabulary (max_size=10000)...
Vocabulary size: 10000
Loading 1 LEAF Sent140 test files...
LEAF Sent140 test: 254555 users, 286281 samples
Found 254555 train users, 254555 test users, 254555 common users
User sample counts range: 494 (max) to 1 (min)
Distributed ALL 254555 users across 20 clients
Users per client: 12727 (with 15 clients getting +1 user)
Train partition sizes: [44353, 44290, 44657, 44907, 44696, 45843, 45801, 45619, 45069, 45639, 45821, 45311, 45779, 46056, 45625, 45984, 46428, 44737, 45540, 46497]
Test partition sizes: [14232, 14235, 14266, 14217, 14238, 14373, 14346, 14334, 14294, 14373, 14344, 14302, 14354, 14362, 14320, 14395, 14389, 14257, 14251, 14399]
  Client 0: 44353 train samples, 2 unique classes
  Client 1: 44290 train samples, 2 unique classes
  Client 2: 44657 train samples, 2 unique classes
  Client 3: 44907 train samples, 2 unique classes
  Client 4: 44696 train samples, 2 unique classes
  Client 5: 45843 train samples, 2 unique classes
  Client 6: 45801 train samples, 2 unique classes
  Client 7: 45619 train samples, 2 unique classes
  Client 8: 45069 train samples, 2 unique classes
  Client 9: 45639 train samples, 2 unique classes
  Client 10: 45821 train samples, 2 unique classes
  Client 11: 45311 train samples, 2 unique classes
  Client 12: 45779 train samples, 2 unique classes
  Client 13: 46056 train samples, 2 unique classes
  Client 14: 45625 train samples, 2 unique classes
  Client 15: 45984 train samples, 2 unique classes
  Client 16: 46428 train samples, 2 unique classes
  Client 17: 44737 train samples, 2 unique classes
  Client 18: 45540 train samples, 2 unique classes
  Client 19: 46497 train samples, 2 unique classes
Will sample 4500 samples per client per epoch
Graph: fully, nodes: 20, edges: 190
Degree statistics: avg=19.00, min=19, max=19
Attack: Compromised 16/20 nodes: [1, 2, 3, 5, 6, 8, 9, 10, 11, 12, 13, 14, 15, 17, 18, 19]
Attack type: gaussian, lambda: 1.0
Model variant: baseline
Model parameters: 1,174,986
Sketchguard Node 0:
  Model dim: 1,174,986 → Sketch size: 180
  Compression ratio: 6527.7x
  Using model parameters for aggregation, sketches for filtering
Sketchguard Node 1:
  Model dim: 1,174,986 → Sketch size: 180
  Compression ratio: 6527.7x
  Using model parameters for aggregation, sketches for filtering
Sketchguard Node 2:
  Model dim: 1,174,986 → Sketch size: 180
  Compression ratio: 6527.7x
  Using model parameters for aggregation, sketches for filtering
Sketchguard Node 3:
  Model dim: 1,174,986 → Sketch size: 180
  Compression ratio: 6527.7x
  Using model parameters for aggregation, sketches for filtering
Sketchguard Node 4:
  Model dim: 1,174,986 → Sketch size: 180
  Compression ratio: 6527.7x
  Using model parameters for aggregation, sketches for filtering
Sketchguard Node 5:
  Model dim: 1,174,986 → Sketch size: 180
  Compression ratio: 6527.7x
  Using model parameters for aggregation, sketches for filtering
Sketchguard Node 6:
  Model dim: 1,174,986 → Sketch size: 180
  Compression ratio: 6527.7x
  Using model parameters for aggregation, sketches for filtering
Sketchguard Node 7:
  Model dim: 1,174,986 → Sketch size: 180
  Compression ratio: 6527.7x
  Using model parameters for aggregation, sketches for filtering
Sketchguard Node 8:
  Model dim: 1,174,986 → Sketch size: 180
  Compression ratio: 6527.7x
  Using model parameters for aggregation, sketches for filtering
Sketchguard Node 9:
  Model dim: 1,174,986 → Sketch size: 180
  Compression ratio: 6527.7x
  Using model parameters for aggregation, sketches for filtering
Sketchguard Node 10:
  Model dim: 1,174,986 → Sketch size: 180
  Compression ratio: 6527.7x
  Using model parameters for aggregation, sketches for filtering
Sketchguard Node 11:
  Model dim: 1,174,986 → Sketch size: 180
  Compression ratio: 6527.7x
  Using model parameters for aggregation, sketches for filtering
Sketchguard Node 12:
  Model dim: 1,174,986 → Sketch size: 180
  Compression ratio: 6527.7x
  Using model parameters for aggregation, sketches for filtering
Sketchguard Node 13:
  Model dim: 1,174,986 → Sketch size: 180
  Compression ratio: 6527.7x
  Using model parameters for aggregation, sketches for filtering
Sketchguard Node 14:
  Model dim: 1,174,986 → Sketch size: 180
  Compression ratio: 6527.7x
  Using model parameters for aggregation, sketches for filtering
Sketchguard Node 15:
  Model dim: 1,174,986 → Sketch size: 180
  Compression ratio: 6527.7x
  Using model parameters for aggregation, sketches for filtering
Sketchguard Node 16:
  Model dim: 1,174,986 → Sketch size: 180
  Compression ratio: 6527.7x
  Using model parameters for aggregation, sketches for filtering
Sketchguard Node 17:
  Model dim: 1,174,986 → Sketch size: 180
  Compression ratio: 6527.7x
  Using model parameters for aggregation, sketches for filtering
Sketchguard Node 18:
  Model dim: 1,174,986 → Sketch size: 180
  Compression ratio: 6527.7x
  Using model parameters for aggregation, sketches for filtering
Sketchguard Node 19:
  Model dim: 1,174,986 → Sketch size: 180
  Compression ratio: 6527.7x
  Using model parameters for aggregation, sketches for filtering
Sketchguard ALGORITHM (Sketch-based Filtering + State Aggregation)
  - Model dimension: 1,174,986 parameters
  - Config: SketchguardConfig(gamma=2, kappa=1, alpha=0.5, min_neighbors=1, sketch_size=180, network_seed=987654321, attack_detection_window=5)
  - Sketch size: 180
  - Compression ratio: 6527.7x
  - Complexity: O(d + N×k) = O(1,174,986 + 20×180)
  - Theoretical speedup vs BALANCE: 19.9x
Initial test acc across nodes: mean=0.4965 ± 0.0152
Round 001: test acc mean=0.5412 ± 0.0207 | min=0.5071 max=0.5902
         : test loss mean=0.6915 ± 0.0008
         : individual accs = ['0.533024', '0.551809', '0.525936', '0.562496', '0.525846', '0.543797', '0.520703', '0.580857', '0.507066', '0.590204', '0.541969', '0.547686', '0.550927', '0.536485', '0.533380', '0.515943', '0.546946', '0.520306', '0.527331', '0.560317']
         : correct/total = [(7586, 14232), (7855, 14235), (7503, 14266), (7997, 14217), (7487, 14238), (7816, 14373), (7470, 14346), (8326, 14334), (7248, 14294), (8483, 14373), (7774, 14344), (7833, 14302), (7908, 14354), (7705, 14362), (7638, 14320), (7427, 14395), (7870, 14389), (7418, 14257), (7515, 14251), (8068, 14399)]
         : compromised: 0.5398, honest: 0.5467
         : sketchguard stats = ['Node 0: acc_rate=0.158', 'Node 1: acc_rate=0.211', 'Node 2: acc_rate=0.211']...
Round 002: test acc mean=0.5087 ± 0.0256 | min=0.4860 max=0.5780
         : test loss mean=0.6926 ± 0.0009
         : individual accs = ['0.555790', '0.486407', '0.485981', '0.492368', '0.531044', '0.493843', '0.497351', '0.577996', '0.488317', '0.494330', '0.499024', '0.529856', '0.499303', '0.508216', '0.495810', '0.498367', '0.551254', '0.503051', '0.488738', '0.496562']
         : correct/total = [(7910, 14232), (6924, 14235), (6933, 14266), (7000, 14217), (7561, 14238), (7098, 14373), (7135, 14346), (8285, 14334), (6980, 14294), (7105, 14373), (7158, 14344), (7578, 14302), (7167, 14354), (7299, 14362), (7100, 14320), (7174, 14395), (7932, 14389), (7172, 14257), (6965, 14251), (7150, 14399)]
         : compromised: 0.4973, honest: 0.5540
         : sketchguard stats = ['Node 0: acc_rate=0.158', 'Node 1: acc_rate=0.211', 'Node 2: acc_rate=0.211']...
Round 003: test acc mean=0.5000 ± 0.0117 | min=0.4863 max=0.5362
         : test loss mean=0.6919 ± 0.0011
         : individual accs = ['0.513912', '0.486336', '0.486471', '0.492157', '0.510605', '0.493843', '0.497560', '0.536208', '0.488317', '0.493008', '0.499024', '0.496714', '0.499512', '0.508564', '0.495810', '0.498367', '0.514768', '0.503051', '0.488738', '0.496493']
         : correct/total = [(7314, 14232), (6923, 14235), (6940, 14266), (6997, 14217), (7270, 14238), (7098, 14373), (7138, 14346), (7686, 14334), (6980, 14294), (7086, 14373), (7158, 14344), (7104, 14302), (7170, 14354), (7304, 14362), (7100, 14320), (7174, 14395), (7407, 14389), (7172, 14257), (6965, 14251), (7149, 14399)]
         : compromised: 0.4952, honest: 0.5189
         : sketchguard stats = ['Node 0: acc_rate=0.158', 'Node 1: acc_rate=0.211', 'Node 2: acc_rate=0.211']...
Round 004: test acc mean=0.5309 ± 0.0217 | min=0.5022 max=0.5708
         : test loss mean=0.6891 ± 0.0012
         : individual accs = ['0.568859', '0.526098', '0.559582', '0.515299', '0.570796', '0.507758', '0.506692', '0.564602', '0.518469', '0.516524', '0.502231', '0.538806', '0.520830', '0.517407', '0.509218', '0.529003', '0.562166', '0.526689', '0.532314', '0.524828']
         : correct/total = [(8096, 14232), (7489, 14235), (7983, 14266), (7326, 14217), (8127, 14238), (7298, 14373), (7269, 14346), (8093, 14334), (7411, 14294), (7424, 14373), (7204, 14344), (7706, 14302), (7476, 14354), (7431, 14362), (7292, 14320), (7615, 14395), (8089, 14389), (7509, 14257), (7586, 14251), (7557, 14399)]
         : compromised: 0.5220, honest: 0.5666
         : sketchguard stats = ['Node 0: acc_rate=0.158', 'Node 1: acc_rate=0.211', 'Node 2: acc_rate=0.211']...
Round 005: test acc mean=0.5747 ± 0.0123 | min=0.5480 max=0.5963
         : test loss mean=0.6843 ± 0.0014
         : individual accs = ['0.584739', '0.581103', '0.568765', '0.578040', '0.595870', '0.560008', '0.565872', '0.596344', '0.575906', '0.567731', '0.547964', '0.565795', '0.562422', '0.588846', '0.562360', '0.577909', '0.591146', '0.570597', '0.575960', '0.576082']
         : correct/total = [(8322, 14232), (8272, 14235), (8114, 14266), (8218, 14217), (8484, 14238), (8049, 14373), (8118, 14346), (8548, 14334), (8232, 14294), (8160, 14373), (7860, 14344), (8092, 14302), (8073, 14354), (8457, 14362), (8053, 14320), (8319, 14395), (8506, 14389), (8135, 14257), (8208, 14251), (8295, 14399)]
         : compromised: 0.5703, honest: 0.5920
         : sketchguard stats = ['Node 0: acc_rate=0.158', 'Node 1: acc_rate=0.211', 'Node 2: acc_rate=0.211']...
Round 006: test acc mean=0.5983 ± 0.0060 | min=0.5833 max=0.6071
         : test loss mean=0.6756 ± 0.0014
         : individual accs = ['0.599494', '0.595715', '0.600729', '0.602940', '0.602472', '0.601962', '0.600725', '0.603181', '0.603680', '0.598275', '0.605898', '0.597469', '0.607078', '0.600543', '0.583310', '0.592428', '0.596914', '0.592691', '0.587678', '0.592055']
         : correct/total = [(8532, 14232), (8480, 14235), (8570, 14266), (8572, 14217), (8578, 14238), (8652, 14373), (8618, 14346), (8646, 14334), (8629, 14294), (8599, 14373), (8691, 14344), (8545, 14302), (8714, 14354), (8625, 14362), (8353, 14320), (8528, 14395), (8589, 14389), (8450, 14257), (8375, 14251), (8525, 14399)]
         : compromised: 0.5977, honest: 0.6005
         : sketchguard stats = ['Node 0: acc_rate=0.158', 'Node 1: acc_rate=0.211', 'Node 2: acc_rate=0.211']...
Round 007: test acc mean=0.6124 ± 0.0027 | min=0.6057 max=0.6167
         : test loss mean=0.6628 ± 0.0013
         : individual accs = ['0.616709', '0.613066', '0.609141', '0.614405', '0.615044', '0.613790', '0.613830', '0.610088', '0.613544', '0.614485', '0.615519', '0.608866', '0.614254', '0.615583', '0.611173', '0.610281', '0.610327', '0.610647', '0.605712', '0.612473']
         : correct/total = [(8777, 14232), (8727, 14235), (8690, 14266), (8735, 14217), (8757, 14238), (8822, 14373), (8806, 14346), (8745, 14334), (8770, 14294), (8832, 14373), (8829, 14344), (8708, 14302), (8817, 14354), (8841, 14362), (8752, 14320), (8785, 14395), (8782, 14389), (8706, 14257), (8632, 14251), (8819, 14399)]
         : compromised: 0.6123, honest: 0.6130
         : sketchguard stats = ['Node 0: acc_rate=0.158', 'Node 1: acc_rate=0.211', 'Node 2: acc_rate=0.211']...
Round 008: test acc mean=0.6185 ± 0.0035 | min=0.6097 max=0.6251
         : test loss mean=0.6544 ± 0.0018
         : individual accs = ['0.621417', '0.619108', '0.609701', '0.625097', '0.621365', '0.621860', '0.619615', '0.615460', '0.620120', '0.619008', '0.621514', '0.615578', '0.621639', '0.619900', '0.618366', '0.617923', '0.613941', '0.616960', '0.612589', '0.619001']
         : correct/total = [(8844, 14232), (8813, 14235), (8698, 14266), (8887, 14217), (8847, 14238), (8938, 14373), (8889, 14346), (8822, 14334), (8864, 14294), (8897, 14373), (8915, 14344), (8804, 14302), (8923, 14354), (8903, 14362), (8855, 14320), (8895, 14395), (8834, 14389), (8796, 14257), (8730, 14251), (8913, 14399)]
         : compromised: 0.6186, honest: 0.6180
         : sketchguard stats = ['Node 0: acc_rate=0.158', 'Node 1: acc_rate=0.211', 'Node 2: acc_rate=0.211']...
Round 009: test acc mean=0.6262 ± 0.0035 | min=0.6193 max=0.6332
         : test loss mean=0.6479 ± 0.0017
         : individual accs = ['0.633151', '0.628802', '0.625894', '0.632553', '0.627406', '0.626522', '0.627701', '0.627041', '0.622709', '0.626383', '0.624861', '0.622221', '0.627630', '0.628812', '0.622905', '0.629733', '0.619293', '0.624886', '0.620588', '0.624418']
         : correct/total = [(9011, 14232), (8951, 14235), (8929, 14266), (8993, 14217), (8933, 14238), (9005, 14373), (9005, 14346), (8988, 14334), (8901, 14294), (9003, 14373), (8963, 14344), (8899, 14302), (9009, 14354), (9031, 14362), (8920, 14320), (9065, 14395), (8911, 14389), (8909, 14257), (8844, 14251), (8991, 14399)]
         : compromised: 0.6260, honest: 0.6267
         : sketchguard stats = ['Node 0: acc_rate=0.158', 'Node 1: acc_rate=0.211', 'Node 2: acc_rate=0.211']...
Round 010: test acc mean=0.6335 ± 0.0034 | min=0.6274 max=0.6416
         : test loss mean=0.6420 ± 0.0017
         : individual accs = ['0.638842', '0.636108', '0.632974', '0.641556', '0.636887', '0.631183', '0.633766', '0.633040', '0.636001', '0.635984', '0.633366', '0.629492', '0.634318', '0.634661', '0.632332', '0.634109', '0.627354', '0.629866', '0.629500', '0.629558']
         : correct/total = [(9092, 14232), (9055, 14235), (9030, 14266), (9121, 14217), (9068, 14238), (9072, 14373), (9092, 14346), (9074, 14334), (9091, 14294), (9141, 14373), (9085, 14344), (9003, 14302), (9105, 14354), (9115, 14362), (9055, 14320), (9128, 14395), (9027, 14389), (8980, 14257), (8971, 14251), (9065, 14399)]
         : compromised: 0.6334, honest: 0.6340
         : sketchguard stats = ['Node 0: acc_rate=0.158', 'Node 1: acc_rate=0.211', 'Node 2: acc_rate=0.211']...

=== FINAL RESULTS ===
Dataset: sent140, Nodes: 20, Graph: fully, Aggregation: sketchguard
Attack: gaussian, 80.0% compromised
Final accuracy - Compromised: 0.6334, Honest: 0.6340
Overall test accuracy: mean=0.6335 ± 0.0034

=== Sketchguard SUMMARY ===
Node 0: acceptance=0.158
Node 1: acceptance=0.211
Node 2: acceptance=0.211
Node 3: acceptance=0.211
Node 4: acceptance=0.158
Node 5: acceptance=0.211
Node 6: acceptance=0.211
Node 7: acceptance=0.158
Node 8: acceptance=0.211
Node 9: acceptance=0.211
Node 10: acceptance=0.211
Node 11: acceptance=0.211
Node 12: acceptance=0.211
Node 13: acceptance=0.211
Node 14: acceptance=0.211
Node 15: acceptance=0.211
Node 16: acceptance=0.158
Node 17: acceptance=0.211
Node 18: acceptance=0.211
Node 19: acceptance=0.211

=== PARALLEL EXECUTION TIME (realistic for distributed system) ===
  COMMUNICATION (max across nodes):
    - Sketch transfer: 0.000s (0.0%)
    - Model fetch (accepted): 0.000s (0.0%)
  COMPUTATION (max across nodes):
    - Sketching: 0.282s (95.4%)
    - Filtering: 0.001s (0.4%)
    - Aggregation: 0.012s (4.2%)
  TOTALS:
    - Total computation: 0.296s (100.0%)
    - Total communication: 0.000s (0.0%)
    - Total parallel time: 0.296s

=== PER-NODE AVERAGE TIME ===
  - Sketching: 0.248s
  - Filtering: 0.001s
  - Aggregation: 0.010s
  - Sketch transfer: 0.000s
  - Model fetch: 0.000s
  - Total per node: 0.258s

=== TOTAL COMPUTATIONAL WORK (sum across all nodes) ===
  - Total sketching: 4.956s
  - Total filtering: 0.016s
  - Total aggregation: 0.193s
  - Total sketch transfer: 0.000s
  - Total model fetch: 0.000s
  - Grand total: 5.165s
  - Mean acceptance rate: 0.200

Sketchguard Algorithm Properties:
  - Original dimension: 1,174,986
  - Sketch size: 180
  - Compression ratio: 19.9x
  - Single repetition: No repetitions needed
  - Theoretical complexity: O(d + N×k)
  - Approach: Sketch filtering + state aggregation
