Device: cuda
Seed: 987654321
Loading 1 LEAF Sent140 train files...
LEAF Sent140 train: 254555 users, 908652 samples
Building vocabulary (max_size=10000)...
Vocabulary size: 10000
Loading 1 LEAF Sent140 test files...
LEAF Sent140 test: 254555 users, 286281 samples
Found 254555 train users, 254555 test users, 254555 common users
User sample counts range: 494 (max) to 1 (min)
Distributed ALL 254555 users across 20 clients
Users per client: 12727 (with 15 clients getting +1 user)
Train partition sizes: [44353, 44290, 44657, 44907, 44696, 45843, 45801, 45619, 45069, 45639, 45821, 45311, 45779, 46056, 45625, 45984, 46428, 44737, 45540, 46497]
Test partition sizes: [14232, 14235, 14266, 14217, 14238, 14373, 14346, 14334, 14294, 14373, 14344, 14302, 14354, 14362, 14320, 14395, 14389, 14257, 14251, 14399]
  Client 0: 44353 train samples, 2 unique classes
  Client 1: 44290 train samples, 2 unique classes
  Client 2: 44657 train samples, 2 unique classes
  Client 3: 44907 train samples, 2 unique classes
  Client 4: 44696 train samples, 2 unique classes
  Client 5: 45843 train samples, 2 unique classes
  Client 6: 45801 train samples, 2 unique classes
  Client 7: 45619 train samples, 2 unique classes
  Client 8: 45069 train samples, 2 unique classes
  Client 9: 45639 train samples, 2 unique classes
  Client 10: 45821 train samples, 2 unique classes
  Client 11: 45311 train samples, 2 unique classes
  Client 12: 45779 train samples, 2 unique classes
  Client 13: 46056 train samples, 2 unique classes
  Client 14: 45625 train samples, 2 unique classes
  Client 15: 45984 train samples, 2 unique classes
  Client 16: 46428 train samples, 2 unique classes
  Client 17: 44737 train samples, 2 unique classes
  Client 18: 45540 train samples, 2 unique classes
  Client 19: 46497 train samples, 2 unique classes
Will sample 4500 samples per client per epoch
Graph: erdos, nodes: 20, edges: 126
Degree statistics: avg=12.60, min=8, max=16
Attack: Compromised 10/20 nodes: [1, 2, 5, 11, 12, 13, 14, 15, 17, 18]
Attack type: directed_deviation, lambda: 1.0
Model variant: baseline
Model parameters: 1,174,986
Sketchguard Node 0:
  Model dim: 1,174,986 → Sketch size: 180
  Compression ratio: 6527.7x
  Using model parameters for aggregation, sketches for filtering
Sketchguard Node 1:
  Model dim: 1,174,986 → Sketch size: 180
  Compression ratio: 6527.7x
  Using model parameters for aggregation, sketches for filtering
Sketchguard Node 2:
  Model dim: 1,174,986 → Sketch size: 180
  Compression ratio: 6527.7x
  Using model parameters for aggregation, sketches for filtering
Sketchguard Node 3:
  Model dim: 1,174,986 → Sketch size: 180
  Compression ratio: 6527.7x
  Using model parameters for aggregation, sketches for filtering
Sketchguard Node 4:
  Model dim: 1,174,986 → Sketch size: 180
  Compression ratio: 6527.7x
  Using model parameters for aggregation, sketches for filtering
Sketchguard Node 5:
  Model dim: 1,174,986 → Sketch size: 180
  Compression ratio: 6527.7x
  Using model parameters for aggregation, sketches for filtering
Sketchguard Node 6:
  Model dim: 1,174,986 → Sketch size: 180
  Compression ratio: 6527.7x
  Using model parameters for aggregation, sketches for filtering
Sketchguard Node 7:
  Model dim: 1,174,986 → Sketch size: 180
  Compression ratio: 6527.7x
  Using model parameters for aggregation, sketches for filtering
Sketchguard Node 8:
  Model dim: 1,174,986 → Sketch size: 180
  Compression ratio: 6527.7x
  Using model parameters for aggregation, sketches for filtering
Sketchguard Node 9:
  Model dim: 1,174,986 → Sketch size: 180
  Compression ratio: 6527.7x
  Using model parameters for aggregation, sketches for filtering
Sketchguard Node 10:
  Model dim: 1,174,986 → Sketch size: 180
  Compression ratio: 6527.7x
  Using model parameters for aggregation, sketches for filtering
Sketchguard Node 11:
  Model dim: 1,174,986 → Sketch size: 180
  Compression ratio: 6527.7x
  Using model parameters for aggregation, sketches for filtering
Sketchguard Node 12:
  Model dim: 1,174,986 → Sketch size: 180
  Compression ratio: 6527.7x
  Using model parameters for aggregation, sketches for filtering
Sketchguard Node 13:
  Model dim: 1,174,986 → Sketch size: 180
  Compression ratio: 6527.7x
  Using model parameters for aggregation, sketches for filtering
Sketchguard Node 14:
  Model dim: 1,174,986 → Sketch size: 180
  Compression ratio: 6527.7x
  Using model parameters for aggregation, sketches for filtering
Sketchguard Node 15:
  Model dim: 1,174,986 → Sketch size: 180
  Compression ratio: 6527.7x
  Using model parameters for aggregation, sketches for filtering
Sketchguard Node 16:
  Model dim: 1,174,986 → Sketch size: 180
  Compression ratio: 6527.7x
  Using model parameters for aggregation, sketches for filtering
Sketchguard Node 17:
  Model dim: 1,174,986 → Sketch size: 180
  Compression ratio: 6527.7x
  Using model parameters for aggregation, sketches for filtering
Sketchguard Node 18:
  Model dim: 1,174,986 → Sketch size: 180
  Compression ratio: 6527.7x
  Using model parameters for aggregation, sketches for filtering
Sketchguard Node 19:
  Model dim: 1,174,986 → Sketch size: 180
  Compression ratio: 6527.7x
  Using model parameters for aggregation, sketches for filtering
Sketchguard ALGORITHM (Sketch-based Filtering + State Aggregation)
  - Model dimension: 1,174,986 parameters
  - Config: SketchguardConfig(gamma=2, kappa=1, alpha=0.5, min_neighbors=1, sketch_size=180, network_seed=987654321, attack_detection_window=5)
  - Sketch size: 180
  - Compression ratio: 6527.7x
  - Complexity: O(d + N×k) = O(1,174,986 + 20×180)
  - Theoretical speedup vs BALANCE: 19.9x
Initial test acc across nodes: mean=0.4965 ± 0.0152
Round 001: test acc mean=0.4995 ± 0.0138 | min=0.4825 max=0.5450
         : test loss mean=0.7396 ± 0.0392
         : individual accs = ['0.489601', '0.482473', '0.511776', '0.512063', '0.492625', '0.488694', '0.502440', '0.505511', '0.509305', '0.501635', '0.508575', '0.544959', '0.500209', '0.497145', '0.489106', '0.499687', '0.488498', '0.495265', '0.485650', '0.484200']
         : correct/total = [(6968, 14232), (6868, 14235), (7301, 14266), (7280, 14217), (7014, 14238), (7024, 14373), (7208, 14346), (7246, 14334), (7280, 14294), (7210, 14373), (7295, 14344), (7794, 14302), (7180, 14354), (7140, 14362), (7004, 14320), (7193, 14395), (7029, 14389), (7061, 14257), (6921, 14251), (6972, 14399)]
         : compromised: 0.4995, honest: 0.4994
         : sketchguard stats = ['Node 0: acc_rate=1.000', 'Node 1: acc_rate=1.000', 'Node 2: acc_rate=1.000']...
Round 002: test acc mean=0.5176 ± 0.0150 | min=0.4973 max=0.5522
         : test loss mean=0.6944 ± 0.0041
         : individual accs = ['0.525295', '0.552160', '0.511916', '0.501090', '0.514328', '0.497530', '0.520006', '0.530208', '0.497272', '0.509358', '0.508854', '0.518249', '0.502229', '0.547626', '0.515503', '0.507329', '0.522552', '0.506909', '0.535541', '0.528648']
         : correct/total = [(7476, 14232), (7860, 14235), (7303, 14266), (7124, 14217), (7323, 14238), (7151, 14373), (7460, 14346), (7600, 14334), (7108, 14294), (7321, 14373), (7299, 14344), (7412, 14302), (7209, 14354), (7865, 14362), (7382, 14320), (7303, 14395), (7519, 14389), (7227, 14257), (7632, 14251), (7612, 14399)]
         : compromised: 0.5195, honest: 0.5158
         : sketchguard stats = ['Node 0: acc_rate=0.750', 'Node 1: acc_rate=0.773', 'Node 2: acc_rate=0.708']...
Round 003: test acc mean=0.5496 ± 0.0116 | min=0.5220 max=0.5661
         : test loss mean=0.6863 ± 0.0020
         : individual accs = ['0.564362', '0.552160', '0.563367', '0.540339', '0.563703', '0.531413', '0.550676', '0.553928', '0.530222', '0.566131', '0.521960', '0.546008', '0.556152', '0.555911', '0.555098', '0.553526', '0.549100', '0.547941', '0.549225', '0.540246']
         : correct/total = [(8032, 14232), (7860, 14235), (8037, 14266), (7682, 14217), (8026, 14238), (7638, 14373), (7900, 14346), (7940, 14334), (7579, 14294), (8137, 14373), (7487, 14344), (7809, 14302), (7983, 14354), (7984, 14362), (7949, 14320), (7968, 14395), (7901, 14389), (7812, 14257), (7827, 14251), (7779, 14399)]
         : compromised: 0.5511, honest: 0.5481
         : sketchguard stats = ['Node 0: acc_rate=0.667', 'Node 1: acc_rate=0.697', 'Node 2: acc_rate=0.611']...
Round 004: test acc mean=0.5859 ± 0.0068 | min=0.5688 max=0.5986
         : test loss mean=0.6753 ± 0.0026
         : individual accs = ['0.588603', '0.583913', '0.598626', '0.568756', '0.594466', '0.589439', '0.582392', '0.584415', '0.573317', '0.588464', '0.592791', '0.583485', '0.590149', '0.583554', '0.588338', '0.581730', '0.582806', '0.582100', '0.586204', '0.593861']
         : correct/total = [(8377, 14232), (8312, 14235), (8540, 14266), (8086, 14217), (8464, 14238), (8472, 14373), (8355, 14346), (8377, 14334), (8195, 14294), (8458, 14373), (8503, 14344), (8345, 14302), (8471, 14354), (8381, 14362), (8425, 14320), (8374, 14395), (8386, 14389), (8299, 14257), (8354, 14251), (8551, 14399)]
         : compromised: 0.5868, honest: 0.5850
         : sketchguard stats = ['Node 0: acc_rate=0.625', 'Node 1: acc_rate=0.659', 'Node 2: acc_rate=0.562']...
Round 005: test acc mean=0.6018 ± 0.0046 | min=0.5904 max=0.6109
         : test loss mean=0.6633 ± 0.0018
         : individual accs = ['0.598721', '0.606533', '0.600238', '0.596117', '0.610900', '0.605649', '0.598773', '0.601228', '0.590388', '0.601336', '0.600251', '0.600895', '0.608054', '0.602702', '0.598045', '0.603265', '0.602961', '0.607701', '0.598063', '0.604000']
         : correct/total = [(8521, 14232), (8634, 14235), (8563, 14266), (8475, 14217), (8698, 14238), (8705, 14373), (8590, 14346), (8618, 14334), (8439, 14294), (8643, 14373), (8610, 14344), (8594, 14302), (8728, 14354), (8656, 14362), (8564, 14320), (8684, 14395), (8676, 14389), (8664, 14257), (8523, 14251), (8697, 14399)]
         : compromised: 0.6031, honest: 0.6005
         : sketchguard stats = ['Node 0: acc_rate=0.600', 'Node 1: acc_rate=0.636', 'Node 2: acc_rate=0.533']...
Round 006: test acc mean=0.6123 ± 0.0042 | min=0.6009 max=0.6188
         : test loss mean=0.6551 ± 0.0023
         : individual accs = ['0.614250', '0.617211', '0.615870', '0.610185', '0.615466', '0.617408', '0.611390', '0.609600', '0.607318', '0.608085', '0.613567', '0.612712', '0.618782', '0.614260', '0.610894', '0.608406', '0.600876', '0.617521', '0.612308', '0.609834']
         : correct/total = [(8742, 14232), (8786, 14235), (8786, 14266), (8675, 14217), (8763, 14238), (8874, 14373), (8771, 14346), (8738, 14334), (8681, 14294), (8740, 14373), (8801, 14344), (8763, 14302), (8882, 14354), (8822, 14362), (8748, 14320), (8758, 14395), (8646, 14389), (8804, 14257), (8726, 14251), (8781, 14399)]
         : compromised: 0.6145, honest: 0.6101
         : sketchguard stats = ['Node 0: acc_rate=0.583', 'Node 1: acc_rate=0.621', 'Node 2: acc_rate=0.514']...
Round 007: test acc mean=0.6184 ± 0.0036 | min=0.6107 max=0.6237
         : test loss mean=0.6503 ± 0.0017
         : individual accs = ['0.619660', '0.615033', '0.619445', '0.622635', '0.623472', '0.623669', '0.617663', '0.610716', '0.617392', '0.619634', '0.614752', '0.618235', '0.618643', '0.621432', '0.620042', '0.617784', '0.611787', '0.623343', '0.614624', '0.618932']
         : correct/total = [(8819, 14232), (8755, 14235), (8837, 14266), (8852, 14217), (8877, 14238), (8964, 14373), (8861, 14346), (8754, 14334), (8825, 14294), (8906, 14373), (8818, 14344), (8842, 14302), (8880, 14354), (8925, 14362), (8879, 14320), (8893, 14395), (8803, 14389), (8887, 14257), (8759, 14251), (8912, 14399)]
         : compromised: 0.6192, honest: 0.6177
         : sketchguard stats = ['Node 0: acc_rate=0.571', 'Node 1: acc_rate=0.610', 'Node 2: acc_rate=0.500']...
Round 008: test acc mean=0.6231 ± 0.0029 | min=0.6156 max=0.6276
         : test loss mean=0.6473 ± 0.0027
         : individual accs = ['0.624508', '0.624658', '0.623791', '0.625097', '0.615606', '0.621513', '0.622682', '0.620901', '0.625227', '0.621373', '0.622560', '0.617466', '0.627630', '0.625957', '0.621020', '0.624383', '0.621238', '0.626990', '0.625781', '0.624141']
         : correct/total = [(8888, 14232), (8892, 14235), (8899, 14266), (8887, 14217), (8765, 14238), (8933, 14373), (8933, 14346), (8900, 14334), (8937, 14294), (8931, 14373), (8930, 14344), (8831, 14302), (9009, 14354), (8990, 14362), (8893, 14320), (8988, 14395), (8939, 14389), (8939, 14257), (8918, 14251), (8987, 14399)]
         : compromised: 0.6239, honest: 0.6223
         : sketchguard stats = ['Node 0: acc_rate=0.562', 'Node 1: acc_rate=0.602', 'Node 2: acc_rate=0.490']...
Round 009: test acc mean=0.6280 ± 0.0038 | min=0.6184 max=0.6338
         : test loss mean=0.6435 ± 0.0025
         : individual accs = ['0.631254', '0.630699', '0.630380', '0.627629', '0.625931', '0.629514', '0.628677', '0.622297', '0.632013', '0.624226', '0.624791', '0.628304', '0.630626', '0.632920', '0.618436', '0.628343', '0.622906', '0.633794', '0.629570', '0.627891']
         : correct/total = [(8984, 14232), (8978, 14235), (8993, 14266), (8923, 14217), (8912, 14238), (9048, 14373), (9019, 14346), (8920, 14334), (9034, 14294), (8972, 14373), (8962, 14344), (8986, 14302), (9052, 14354), (9090, 14362), (8856, 14320), (9045, 14395), (8963, 14389), (9036, 14257), (8972, 14251), (9041, 14399)]
         : compromised: 0.6293, honest: 0.6268
         : sketchguard stats = ['Node 0: acc_rate=0.556', 'Node 1: acc_rate=0.596', 'Node 2: acc_rate=0.481']...
Round 010: test acc mean=0.6325 ± 0.0028 | min=0.6266 max=0.6374
         : test loss mean=0.6398 ± 0.0018
         : individual accs = ['0.633502', '0.634563', '0.631572', '0.636984', '0.634218', '0.632923', '0.631883', '0.626622', '0.632503', '0.631114', '0.632181', '0.627744', '0.632158', '0.635427', '0.632263', '0.631261', '0.628119', '0.637441', '0.635464', '0.631085']
         : correct/total = [(9016, 14232), (9033, 14235), (9010, 14266), (9056, 14217), (9030, 14238), (9097, 14373), (9065, 14346), (8982, 14334), (9041, 14294), (9071, 14373), (9068, 14344), (8978, 14302), (9074, 14354), (9126, 14362), (9054, 14320), (9087, 14395), (9038, 14389), (9088, 14257), (9056, 14251), (9087, 14399)]
         : compromised: 0.6331, honest: 0.6318
         : sketchguard stats = ['Node 0: acc_rate=0.550', 'Node 1: acc_rate=0.591', 'Node 2: acc_rate=0.475']...

=== FINAL RESULTS ===
Dataset: sent140, Nodes: 20, Graph: erdos, Aggregation: sketchguard
Attack: directed_deviation, 50.0% compromised
Final accuracy - Compromised: 0.6331, Honest: 0.6318
Overall test accuracy: mean=0.6325 ± 0.0028

=== Sketchguard SUMMARY ===
Node 0: acceptance=0.550
Node 1: acceptance=0.591
Node 2: acceptance=0.475
Node 3: acceptance=0.662
Node 4: acceptance=0.509
Node 5: acceptance=0.520
Node 6: acceptance=0.486
Node 7: acceptance=0.486
Node 8: acceptance=0.460
Node 9: acceptance=0.585
Node 10: acceptance=0.600
Node 11: acceptance=0.550
Node 12: acceptance=0.625
Node 13: acceptance=0.585
Node 14: acceptance=0.520
Node 15: acceptance=0.509
Node 16: acceptance=0.446
Node 17: acceptance=0.700
Node 18: acceptance=0.606
Node 19: acceptance=0.494

=== PARALLEL EXECUTION TIME (realistic for distributed system) ===
  COMMUNICATION (max across nodes):
    - Sketch transfer: 0.000s (0.0%)
    - Model fetch (accepted): 0.000s (0.0%)
  COMPUTATION (max across nodes):
    - Sketching: 0.421s (94.5%)
    - Filtering: 0.001s (0.3%)
    - Aggregation: 0.023s (5.2%)
  TOTALS:
    - Total computation: 0.446s (100.0%)
    - Total communication: 0.000s (0.0%)
    - Total parallel time: 0.446s

=== PER-NODE AVERAGE TIME ===
  - Sketching: 0.320s
  - Filtering: 0.001s
  - Aggregation: 0.014s
  - Sketch transfer: 0.000s
  - Model fetch: 0.000s
  - Total per node: 0.335s

=== TOTAL COMPUTATIONAL WORK (sum across all nodes) ===
  - Total sketching: 6.404s
  - Total filtering: 0.013s
  - Total aggregation: 0.288s
  - Total sketch transfer: 0.000s
  - Total model fetch: 0.000s
  - Grand total: 6.704s
  - Mean acceptance rate: 0.548

Sketchguard Algorithm Properties:
  - Original dimension: 1,174,986
  - Sketch size: 180
  - Compression ratio: 19.9x
  - Single repetition: No repetitions needed
  - Theoretical complexity: O(d + N×k)
  - Approach: Sketch filtering + state aggregation
