Device: cuda
Seed: 987654321
Loading 1 LEAF Sent140 train files...
LEAF Sent140 train: 254555 users, 908652 samples
Building vocabulary (max_size=10000)...
Vocabulary size: 10000
Loading 1 LEAF Sent140 test files...
LEAF Sent140 test: 254555 users, 286281 samples
Found 254555 train users, 254555 test users, 254555 common users
User sample counts range: 494 (max) to 1 (min)
Distributed ALL 254555 users across 20 clients
Users per client: 12727 (with 15 clients getting +1 user)
Train partition sizes: [44353, 44290, 44657, 44907, 44696, 45843, 45801, 45619, 45069, 45639, 45821, 45311, 45779, 46056, 45625, 45984, 46428, 44737, 45540, 46497]
Test partition sizes: [14232, 14235, 14266, 14217, 14238, 14373, 14346, 14334, 14294, 14373, 14344, 14302, 14354, 14362, 14320, 14395, 14389, 14257, 14251, 14399]
  Client 0: 44353 train samples, 2 unique classes
  Client 1: 44290 train samples, 2 unique classes
  Client 2: 44657 train samples, 2 unique classes
  Client 3: 44907 train samples, 2 unique classes
  Client 4: 44696 train samples, 2 unique classes
  Client 5: 45843 train samples, 2 unique classes
  Client 6: 45801 train samples, 2 unique classes
  Client 7: 45619 train samples, 2 unique classes
  Client 8: 45069 train samples, 2 unique classes
  Client 9: 45639 train samples, 2 unique classes
  Client 10: 45821 train samples, 2 unique classes
  Client 11: 45311 train samples, 2 unique classes
  Client 12: 45779 train samples, 2 unique classes
  Client 13: 46056 train samples, 2 unique classes
  Client 14: 45625 train samples, 2 unique classes
  Client 15: 45984 train samples, 2 unique classes
  Client 16: 46428 train samples, 2 unique classes
  Client 17: 44737 train samples, 2 unique classes
  Client 18: 45540 train samples, 2 unique classes
  Client 19: 46497 train samples, 2 unique classes
Will sample 4500 samples per client per epoch
Graph: erdos, nodes: 20, edges: 126
Degree statistics: avg=12.60, min=8, max=16
Attack: Compromised 10/20 nodes: [1, 2, 5, 11, 12, 13, 14, 15, 17, 18]
Attack type: backdoor, lambda: 1.0
Backdoor target label: 1, trigger size: 3
Model variant: baseline
Model parameters: 1,174,986
BALANCE algorithm:
Balance Config: BALANCEConfig(gamma=2, kappa=1, alpha=0.5, min_neighbors=1)
  - Model dimension: 1,174,986 parameters
  - Complexity: O(N×d) = O(20×1,174,986)
Initial test acc across nodes: mean=0.4965 ± 0.0152
Backdoor attack: Created poisoned datasets for 10 compromised nodes
Round 001: test acc mean=0.5018 ± 0.0072 | min=0.4883 max=0.5158
         : test loss mean=18.6953 ± 17.9687
         : individual accs = ['0.496979', '0.499754', '0.488644', '0.510656', '0.495084', '0.499548', '0.504740', '0.496582', '0.506786', '0.509914', '0.515825', '0.497972', '0.496935', '0.510932', '0.503003', '0.498576', '0.510320', '0.504945', '0.488317', '0.501146']
         : correct/total = [(7073, 14232), (7114, 14235), (6971, 14266), (7260, 14217), (7049, 14238), (7180, 14373), (7241, 14346), (7118, 14334), (7244, 14294), (7329, 14373), (7399, 14344), (7122, 14302), (7133, 14354), (7338, 14362), (7203, 14320), (7177, 14395), (7343, 14389), (7199, 14257), (6959, 14251), (7216, 14399)]
         : compromised: 0.4989, honest: 0.5048
Round 002: test acc mean=0.5001 ± 0.0097 | min=0.4848 max=0.5167
         : test loss mean=674.2868 ± 676.2305
         : individual accs = ['0.484823', '0.502283', '0.494953', '0.511711', '0.505900', '0.505114', '0.510107', '0.485768', '0.516720', '0.516663', '0.505856', '0.508880', '0.498537', '0.485308', '0.497835', '0.492602', '0.487803', '0.495827', '0.500175', '0.495312']
         : correct/total = [(6900, 14232), (7150, 14235), (7061, 14266), (7275, 14217), (7203, 14238), (7260, 14373), (7318, 14346), (6963, 14334), (7386, 14294), (7426, 14373), (7256, 14344), (7278, 14302), (7156, 14354), (6970, 14362), (7129, 14320), (7091, 14395), (7019, 14389), (7069, 14257), (7128, 14251), (7132, 14399)]
         : compromised: 0.4982, honest: 0.5021
Round 003: test acc mean=0.5053 ± 0.0122 | min=0.4884 max=0.5478
         : test loss mean=43034.5201 ± 44275.7448
         : individual accs = ['0.506324', '0.492237', '0.507010', '0.506577', '0.505900', '0.488416', '0.509201', '0.504604', '0.509724', '0.547763', '0.501255', '0.497832', '0.490107', '0.501323', '0.506425', '0.502397', '0.506568', '0.504454', '0.496176', '0.521703']
         : correct/total = [(7206, 14232), (7007, 14235), (7233, 14266), (7202, 14217), (7203, 14238), (7020, 14373), (7305, 14346), (7233, 14334), (7286, 14294), (7873, 14373), (7190, 14344), (7120, 14302), (7035, 14354), (7200, 14362), (7252, 14320), (7232, 14395), (7289, 14389), (7192, 14257), (7071, 14251), (7512, 14399)]
         : compromised: 0.4986, honest: 0.5120
Round 004: test acc mean=0.5232 ± 0.0264 | min=0.4889 max=0.5686
         : test loss mean=5514485.4521 ± 5811616.0669
         : individual accs = ['0.541456', '0.488936', '0.508622', '0.521981', '0.563352', '0.510054', '0.568591', '0.567950', '0.517980', '0.564461', '0.512688', '0.512096', '0.491083', '0.505570', '0.507332', '0.491560', '0.528042', '0.493722', '0.515192', '0.552399']
         : correct/total = [(7706, 14232), (6960, 14235), (7256, 14266), (7421, 14217), (8021, 14238), (7331, 14373), (8157, 14346), (8141, 14334), (7404, 14294), (8113, 14373), (7354, 14344), (7324, 14302), (7049, 14354), (7261, 14362), (7265, 14320), (7076, 14395), (7598, 14389), (7039, 14257), (7342, 14251), (7954, 14399)]
         : compromised: 0.5024, honest: 0.5439
Round 005: test acc mean=0.5414 ± 0.0413 | min=0.4877 max=0.5994
         : test loss mean=320275181.9724 ± 328683828.5345
         : individual accs = ['0.575393', '0.493432', '0.501682', '0.561511', '0.594255', '0.498504', '0.598285', '0.599414', '0.562264', '0.582829', '0.569646', '0.513844', '0.491779', '0.522420', '0.509427', '0.487669', '0.583015', '0.502350', '0.496737', '0.582679']
         : correct/total = [(8189, 14232), (7024, 14235), (7157, 14266), (7983, 14217), (8461, 14238), (7165, 14373), (8583, 14346), (8592, 14334), (8037, 14294), (8377, 14373), (8171, 14344), (7349, 14302), (7059, 14354), (7503, 14362), (7295, 14320), (7020, 14395), (8389, 14389), (7162, 14257), (7079, 14251), (8390, 14399)]
         : compromised: 0.5018, honest: 0.5809
Round 006: test acc mean=0.5508 ± 0.0518 | min=0.4898 max=0.6063
         : test loss mean=23353232255.1502 ± 23692091741.3656
         : individual accs = ['0.596613', '0.496733', '0.498738', '0.599775', '0.606335', '0.500174', '0.605116', '0.606042', '0.593396', '0.605441', '0.605480', '0.509579', '0.491849', '0.491296', '0.511034', '0.489823', '0.599208', '0.496388', '0.508035', '0.604348']
         : correct/total = [(8491, 14232), (7071, 14235), (7115, 14266), (8527, 14217), (8633, 14238), (7189, 14373), (8681, 14346), (8687, 14334), (8482, 14294), (8702, 14373), (8685, 14344), (7288, 14302), (7060, 14354), (7056, 14362), (7318, 14320), (7051, 14395), (8622, 14389), (7077, 14257), (7240, 14251), (8702, 14399)]
         : compromised: 0.4994, honest: 0.6022
Round 007: test acc mean=0.5541 ± 0.0572 | min=0.4912 max=0.6146
         : test loss mean=1901511820498.6230 ± 1942953260205.5891
         : individual accs = ['0.607926', '0.495890', '0.499509', '0.614054', '0.611322', '0.491199', '0.611529', '0.610646', '0.614594', '0.613581', '0.610708', '0.508810', '0.494078', '0.501532', '0.496020', '0.493852', '0.603100', '0.494073', '0.495685', '0.613584']
         : correct/total = [(8652, 14232), (7059, 14235), (7126, 14266), (8730, 14217), (8704, 14238), (7060, 14373), (8773, 14346), (8753, 14334), (8785, 14294), (8819, 14373), (8760, 14344), (7277, 14302), (7092, 14354), (7203, 14362), (7103, 14320), (7109, 14395), (8678, 14389), (7044, 14257), (7064, 14251), (8835, 14399)]
         : compromised: 0.4971, honest: 0.6111
Round 008: test acc mean=0.5574 ± 0.0594 | min=0.4919 max=0.6212
         : test loss mean=162352530448660.5312 ± 166078650234167.2188
         : individual accs = ['0.611580', '0.497787', '0.496215', '0.620243', '0.619609', '0.497113', '0.615503', '0.615250', '0.621170', '0.616990', '0.616704', '0.509090', '0.495263', '0.498190', '0.495810', '0.491907', '0.612343', '0.494634', '0.505298', '0.617335']
         : correct/total = [(8704, 14232), (7086, 14235), (7079, 14266), (8818, 14217), (8822, 14238), (7145, 14373), (8830, 14346), (8819, 14334), (8879, 14294), (8868, 14373), (8846, 14344), (7281, 14302), (7109, 14354), (7155, 14362), (7100, 14320), (7081, 14395), (8811, 14389), (7052, 14257), (7201, 14251), (8889, 14399)]
         : compromised: 0.4981, honest: 0.6167
Round 009: test acc mean=0.5611 ± 0.0607 | min=0.4884 max=0.6251
         : test loss mean=13268772565248644.0000 ± 13515506165323102.0000
         : individual accs = ['0.619590', '0.493853', '0.504626', '0.625097', '0.620663', '0.503305', '0.623379', '0.619925', '0.622779', '0.623043', '0.620120', '0.511747', '0.488435', '0.502228', '0.500768', '0.500243', '0.617764', '0.493302', '0.507473', '0.623307']
         : correct/total = [(8818, 14232), (7030, 14235), (7199, 14266), (8887, 14217), (8837, 14238), (7234, 14373), (8943, 14346), (8886, 14334), (8902, 14294), (8955, 14373), (8895, 14344), (7319, 14302), (7011, 14354), (7213, 14362), (7171, 14320), (7201, 14395), (8889, 14389), (7033, 14257), (7232, 14251), (8975, 14399)]
         : compromised: 0.5006, honest: 0.6216
Round 010: test acc mean=0.5644 ± 0.0626 | min=0.4939 max=0.6304
         : test loss mean=1114726373964551936.0000 ± 1139757838292975488.0000
         : individual accs = ['0.622260', '0.502634', '0.505047', '0.630442', '0.628880', '0.497182', '0.626516', '0.628506', '0.628585', '0.626383', '0.626882', '0.515382', '0.496168', '0.506475', '0.503073', '0.495450', '0.624366', '0.493863', '0.504456', '0.626224']
         : correct/total = [(8856, 14232), (7155, 14235), (7205, 14266), (8963, 14217), (8954, 14238), (7146, 14373), (8988, 14346), (9009, 14334), (8985, 14294), (9003, 14373), (8992, 14344), (7371, 14302), (7122, 14354), (7274, 14362), (7204, 14320), (7132, 14395), (8984, 14389), (7041, 14257), (7189, 14251), (9017, 14399)]
         : compromised: 0.5020, honest: 0.6269

=== FINAL RESULTS ===
Dataset: sent140, Nodes: 20, Graph: erdos, Aggregation: balance
Attack: backdoor, 50.0% compromised
Final accuracy - Compromised: 0.5020, Honest: 0.6269
Overall test accuracy: mean=0.5644 ± 0.0626

=== BACKDOOR ATTACK SUCCESS RATE (ASR) ===
Target label: 1
Trigger size: 3x3
Overall ASR: 0.7417 ± 0.2499
Honest nodes ASR: 0.4936 ± 0.0418
Compromised nodes ASR: 0.9899 ± 0.0040
Note: Higher ASR indicates more successful backdoor attack

=== BALANCE SUMMARY ===
Node 0: acceptance=0.550
Node 1: acceptance=0.600
Node 2: acceptance=0.700
Node 3: acceptance=0.662
Node 4: acceptance=0.509
Node 5: acceptance=0.700
Node 6: acceptance=0.486
Node 7: acceptance=0.486
Node 8: acceptance=0.460
Node 9: acceptance=0.585
Node 10: acceptance=0.600
Node 11: acceptance=0.600
Node 12: acceptance=0.600
Node 13: acceptance=0.600
Node 14: acceptance=0.600
Node 15: acceptance=0.600
Node 16: acceptance=0.446
Node 17: acceptance=0.700
Node 18: acceptance=0.600
Node 19: acceptance=0.494

=== PARALLEL EXECUTION TIME (realistic for distributed system) ===
  COMMUNICATION (max across nodes):
    - Full model transfer: 0.000s (0.0%)
  COMPUTATION (max across nodes):
    - Filtering: 0.072s (81.9%)
    - Aggregation: 0.016s (18.1%)
  TOTALS:
    - Total computation: 0.088s (100.0%)
    - Total communication: 0.000s (0.0%)
    - Total parallel time: 0.088s

=== PER-NODE AVERAGE TIME ===
  - Filtering: 0.055s
  - Aggregation: 0.008s
  - Model transfer: 0.000s
  - Total per node: 0.063s

=== TOTAL COMPUTATIONAL WORK (sum across all nodes) ===
  - Total filtering: 1.091s
  - Total aggregation: 0.170s
  - Total model transfer: 0.000s
  - Grand total: 1.261s
  - Mean acceptance rate: 0.579

BALANCE Algorithm Properties:
  - Model dimension: 1,174,986
  - No compression: Full parameter comparison
  - Theoretical complexity: O(deg(i)×d)
  - Approach: Full parameter filtering + averaging
