Device: cuda
Seed: 987654321
Loading 1 LEAF Sent140 train files...
LEAF Sent140 train: 254555 users, 908652 samples
Building vocabulary (max_size=10000)...
Vocabulary size: 10000
Loading 1 LEAF Sent140 test files...
LEAF Sent140 test: 254555 users, 286281 samples
Found 254555 train users, 254555 test users, 254555 common users
User sample counts range: 494 (max) to 1 (min)
Distributed ALL 254555 users across 20 clients
Users per client: 12727 (with 15 clients getting +1 user)
Train partition sizes: [44353, 44290, 44657, 44907, 44696, 45843, 45801, 45619, 45069, 45639, 45821, 45311, 45779, 46056, 45625, 45984, 46428, 44737, 45540, 46497]
Test partition sizes: [14232, 14235, 14266, 14217, 14238, 14373, 14346, 14334, 14294, 14373, 14344, 14302, 14354, 14362, 14320, 14395, 14389, 14257, 14251, 14399]
  Client 0: 44353 train samples, 2 unique classes
  Client 1: 44290 train samples, 2 unique classes
  Client 2: 44657 train samples, 2 unique classes
  Client 3: 44907 train samples, 2 unique classes
  Client 4: 44696 train samples, 2 unique classes
  Client 5: 45843 train samples, 2 unique classes
  Client 6: 45801 train samples, 2 unique classes
  Client 7: 45619 train samples, 2 unique classes
  Client 8: 45069 train samples, 2 unique classes
  Client 9: 45639 train samples, 2 unique classes
  Client 10: 45821 train samples, 2 unique classes
  Client 11: 45311 train samples, 2 unique classes
  Client 12: 45779 train samples, 2 unique classes
  Client 13: 46056 train samples, 2 unique classes
  Client 14: 45625 train samples, 2 unique classes
  Client 15: 45984 train samples, 2 unique classes
  Client 16: 46428 train samples, 2 unique classes
  Client 17: 44737 train samples, 2 unique classes
  Client 18: 45540 train samples, 2 unique classes
  Client 19: 46497 train samples, 2 unique classes
Will sample 4500 samples per client per epoch
Graph: erdos, nodes: 20, edges: 126
Degree statistics: avg=12.60, min=8, max=16
Attack: Compromised 16/20 nodes: [1, 2, 3, 5, 6, 8, 9, 10, 11, 12, 13, 14, 15, 17, 18, 19]
Attack type: backdoor, lambda: 1.0
Backdoor target label: 1, trigger size: 3
Model variant: baseline
Model parameters: 1,174,986
BALANCE algorithm:
Balance Config: BALANCEConfig(gamma=2, kappa=1, alpha=0.5, min_neighbors=1)
  - Model dimension: 1,174,986 parameters
  - Complexity: O(N×d) = O(20×1,174,986)
Initial test acc across nodes: mean=0.4965 ± 0.0152
Backdoor attack: Created poisoned datasets for 16 compromised nodes
Round 001: test acc mean=0.4998 ± 0.0073 | min=0.4884 max=0.5120
         : test loss mean=28.9181 ± 16.1766
         : individual accs = ['0.511594', '0.512048', '0.488364', '0.507772', '0.499298', '0.493564', '0.498257', '0.497000', '0.506506', '0.490503', '0.499373', '0.498042', '0.506061', '0.511767', '0.499791', '0.496631', '0.494753', '0.503472', '0.488808', '0.492881']
         : correct/total = [(7281, 14232), (7289, 14235), (6967, 14266), (7219, 14217), (7109, 14238), (7094, 14373), (7148, 14346), (7124, 14334), (7240, 14294), (7050, 14373), (7163, 14344), (7123, 14302), (7264, 14354), (7350, 14362), (7157, 14320), (7149, 14395), (7119, 14389), (7178, 14257), (6966, 14251), (7097, 14399)]
         : compromised: 0.4996, honest: 0.5007
Round 002: test acc mean=0.5032 ± 0.0066 | min=0.4936 max=0.5241
         : test loss mean=1147.2145 ± 592.5901
         : individual accs = ['0.502600', '0.509238', '0.496986', '0.506084', '0.524090', '0.496904', '0.503276', '0.510883', '0.493634', '0.504557', '0.500906', '0.502727', '0.498467', '0.504526', '0.499511', '0.498020', '0.508861', '0.496738', '0.507122', '0.499757']
         : correct/total = [(7153, 14232), (7249, 14235), (7090, 14266), (7195, 14217), (7462, 14238), (7142, 14373), (7220, 14346), (7323, 14334), (7056, 14294), (7252, 14373), (7185, 14344), (7190, 14302), (7155, 14354), (7246, 14362), (7153, 14320), (7169, 14395), (7322, 14389), (7082, 14257), (7227, 14251), (7196, 14399)]
         : compromised: 0.5012, honest: 0.5116
Round 003: test acc mean=0.5009 ± 0.0088 | min=0.4865 max=0.5211
         : test loss mean=71297.9293 ± 37875.2555
         : individual accs = ['0.521150', '0.503196', '0.486541', '0.498066', '0.516505', '0.494817', '0.490171', '0.507325', '0.504337', '0.498852', '0.498885', '0.499930', '0.495123', '0.511628', '0.502584', '0.495311', '0.505942', '0.507119', '0.488106', '0.493159']
         : correct/total = [(7417, 14232), (7163, 14235), (6941, 14266), (7081, 14217), (7354, 14238), (7112, 14373), (7032, 14346), (7272, 14334), (7209, 14294), (7170, 14373), (7156, 14344), (7150, 14302), (7107, 14354), (7348, 14362), (7197, 14320), (7130, 14395), (7280, 14389), (7230, 14257), (6956, 14251), (7101, 14399)]
         : compromised: 0.4980, honest: 0.5127
Round 004: test acc mean=0.5087 ± 0.0205 | min=0.4804 max=0.5575
         : test loss mean=10987108.4187 ± 7640080.5889
         : individual accs = ['0.546655', '0.484861', '0.493271', '0.500035', '0.557522', '0.505810', '0.498676', '0.551835', '0.504757', '0.500522', '0.514501', '0.503846', '0.499791', '0.501114', '0.497905', '0.480445', '0.526027', '0.510486', '0.499614', '0.496493']
         : correct/total = [(7780, 14232), (6902, 14235), (7037, 14266), (7109, 14217), (7938, 14238), (7270, 14373), (7154, 14346), (7910, 14334), (7215, 14294), (7194, 14373), (7380, 14344), (7206, 14302), (7174, 14354), (7197, 14362), (7130, 14320), (6916, 14395), (7569, 14389), (7278, 14257), (7120, 14251), (7149, 14399)]
         : compromised: 0.4995, honest: 0.5455
Round 005: test acc mean=0.5143 ± 0.0241 | min=0.4946 max=0.5660
         : test loss mean=536241880.8832 ± 281934306.5136
         : individual accs = ['0.560849', '0.498279', '0.500000', '0.506366', '0.563843', '0.494608', '0.503834', '0.565997', '0.495033', '0.511028', '0.504183', '0.496084', '0.499025', '0.504526', '0.513198', '0.500660', '0.554173', '0.509574', '0.508666', '0.497048']
         : correct/total = [(7982, 14232), (7093, 14235), (7133, 14266), (7199, 14217), (8028, 14238), (7109, 14373), (7228, 14346), (8113, 14334), (7076, 14294), (7345, 14373), (7232, 14344), (7095, 14302), (7163, 14354), (7246, 14362), (7349, 14320), (7207, 14395), (7974, 14389), (7265, 14257), (7249, 14251), (7157, 14399)]
         : compromised: 0.5026, honest: 0.5612
Round 006: test acc mean=0.5162 ± 0.0272 | min=0.4910 max=0.5754
         : test loss mean=42126032170.2974 ± 21858707847.8752
         : individual accs = ['0.564503', '0.500386', '0.499650', '0.509320', '0.575432', '0.503583', '0.495260', '0.573252', '0.490975', '0.502748', '0.506484', '0.506013', '0.500697', '0.495056', '0.507402', '0.510177', '0.564667', '0.499123', '0.513438', '0.506007']
         : correct/total = [(8034, 14232), (7123, 14235), (7128, 14266), (7241, 14217), (8193, 14238), (7238, 14373), (7105, 14346), (8217, 14334), (7018, 14294), (7226, 14373), (7265, 14344), (7237, 14302), (7187, 14354), (7110, 14362), (7266, 14320), (7344, 14395), (8125, 14389), (7116, 14257), (7317, 14251), (7286, 14399)]
         : compromised: 0.5029, honest: 0.5695
Round 007: test acc mean=0.5198 ± 0.0330 | min=0.4939 max=0.5886
         : test loss mean=3253039274952.1802 ± 1693889273071.8794
         : individual accs = ['0.583614', '0.493994', '0.496635', '0.507069', '0.588636', '0.504418', '0.505367', '0.580717', '0.497971', '0.509636', '0.510527', '0.502937', '0.502578', '0.493942', '0.506983', '0.512331', '0.586559', '0.504735', '0.509719', '0.497465']
         : correct/total = [(8306, 14232), (7032, 14235), (7085, 14266), (7209, 14217), (8381, 14238), (7250, 14373), (7250, 14346), (8324, 14334), (7118, 14294), (7325, 14373), (7323, 14344), (7193, 14302), (7214, 14354), (7094, 14362), (7260, 14320), (7375, 14395), (8440, 14389), (7196, 14257), (7264, 14251), (7163, 14399)]
         : compromised: 0.5035, honest: 0.5849
Round 008: test acc mean=0.5224 ± 0.0342 | min=0.4990 max=0.5949
         : test loss mean=273638738246735.2500 ± 143448532024494.4688
         : individual accs = ['0.588041', '0.499754', '0.504206', '0.508827', '0.593904', '0.503444', '0.506274', '0.585252', '0.503988', '0.507827', '0.505717', '0.506433', '0.504319', '0.499025', '0.512849', '0.505940', '0.594899', '0.505716', '0.508456', '0.503854']
         : correct/total = [(8369, 14232), (7114, 14235), (7193, 14266), (7234, 14217), (8456, 14238), (7236, 14373), (7263, 14346), (8389, 14334), (7204, 14294), (7299, 14373), (7254, 14344), (7243, 14302), (7239, 14354), (7167, 14362), (7344, 14320), (7283, 14395), (8560, 14389), (7210, 14257), (7246, 14251), (7255, 14399)]
         : compromised: 0.5054, honest: 0.5905
Round 009: test acc mean=0.5214 ± 0.0366 | min=0.4968 max=0.5954
         : test loss mean=22962796465024220.0000 ± 12085436690760204.0000
         : individual accs = ['0.590852', '0.497998', '0.496846', '0.498628', '0.595308', '0.499687', '0.504043', '0.595437', '0.497412', '0.513463', '0.508436', '0.503076', '0.502508', '0.508077', '0.507682', '0.507468', '0.595246', '0.505015', '0.503333', '0.498160']
         : correct/total = [(8409, 14232), (7089, 14235), (7088, 14266), (7089, 14217), (8476, 14238), (7182, 14373), (7231, 14346), (8535, 14334), (7110, 14294), (7380, 14373), (7293, 14344), (7195, 14302), (7213, 14354), (7297, 14362), (7270, 14320), (7305, 14395), (8565, 14389), (7200, 14257), (7173, 14251), (7173, 14399)]
         : compromised: 0.5032, honest: 0.5942
Round 010: test acc mean=0.5241 ± 0.0400 | min=0.4985 max=0.6068
         : test loss mean=1910739475641948672.0000 ± 997047900103129088.0000
         : individual accs = ['0.601110', '0.502494', '0.504696', '0.499894', '0.606757', '0.505114', '0.500349', '0.603460', '0.501189', '0.509706', '0.506344', '0.500350', '0.501393', '0.498468', '0.503771', '0.509413', '0.603100', '0.513642', '0.509227', '0.501215']
         : correct/total = [(8555, 14232), (7153, 14235), (7200, 14266), (7107, 14217), (8639, 14238), (7260, 14373), (7178, 14346), (8650, 14334), (7164, 14294), (7326, 14373), (7263, 14344), (7156, 14302), (7197, 14354), (7159, 14362), (7214, 14320), (7333, 14395), (8678, 14389), (7323, 14257), (7257, 14251), (7217, 14399)]
         : compromised: 0.5042, honest: 0.6036

=== FINAL RESULTS ===
Dataset: sent140, Nodes: 20, Graph: erdos, Aggregation: balance
Attack: backdoor, 80.0% compromised
Final accuracy - Compromised: 0.5042, Honest: 0.6036
Overall test accuracy: mean=0.5241 ± 0.0400

=== BACKDOOR ATTACK SUCCESS RATE (ASR) ===
Target label: 1
Trigger size: 3x3
Overall ASR: 0.9000 ± 0.1726
Honest nodes ASR: 0.5554 ± 0.0107
Compromised nodes ASR: 0.9862 ± 0.0107
Note: Higher ASR indicates more successful backdoor attack

=== BALANCE SUMMARY ===
Node 0: acceptance=0.269
Node 1: acceptance=0.600
Node 2: acceptance=0.600
Node 3: acceptance=0.600
Node 4: acceptance=0.345
Node 5: acceptance=0.600
Node 6: acceptance=0.600
Node 7: acceptance=0.229
Node 8: acceptance=0.600
Node 9: acceptance=0.600
Node 10: acceptance=0.700
Node 11: acceptance=0.700
Node 12: acceptance=0.600
Node 13: acceptance=0.600
Node 14: acceptance=0.600
Node 15: acceptance=0.700
Node 16: acceptance=0.238
Node 17: acceptance=0.600
Node 18: acceptance=0.600
Node 19: acceptance=0.600

=== PARALLEL EXECUTION TIME (realistic for distributed system) ===
  COMMUNICATION (max across nodes):
    - Full model transfer: 0.000s (0.0%)
  COMPUTATION (max across nodes):
    - Filtering: 0.068s (83.9%)
    - Aggregation: 0.013s (16.1%)
  TOTALS:
    - Total computation: 0.081s (100.0%)
    - Total communication: 0.000s (0.0%)
    - Total parallel time: 0.081s

=== PER-NODE AVERAGE TIME ===
  - Filtering: 0.054s
  - Aggregation: 0.008s
  - Model transfer: 0.000s
  - Total per node: 0.062s

=== TOTAL COMPUTATIONAL WORK (sum across all nodes) ===
  - Total filtering: 1.079s
  - Total aggregation: 0.161s
  - Total model transfer: 0.000s
  - Grand total: 1.241s
  - Mean acceptance rate: 0.549

BALANCE Algorithm Properties:
  - Model dimension: 1,174,986
  - No compression: Full parameter comparison
  - Theoretical complexity: O(deg(i)×d)
  - Approach: Full parameter filtering + averaging
