Device: cuda
Seed: 987654321
Loading 1 LEAF Sent140 train files...
LEAF Sent140 train: 254555 users, 908652 samples
Building vocabulary (max_size=10000)...
Vocabulary size: 10000
Loading 1 LEAF Sent140 test files...
LEAF Sent140 test: 254555 users, 286281 samples
Found 254555 train users, 254555 test users, 254555 common users
User sample counts range: 494 (max) to 1 (min)
Distributed ALL 254555 users across 20 clients
Users per client: 12727 (with 15 clients getting +1 user)
Train partition sizes: [44353, 44290, 44657, 44907, 44696, 45843, 45801, 45619, 45069, 45639, 45821, 45311, 45779, 46056, 45625, 45984, 46428, 44737, 45540, 46497]
Test partition sizes: [14232, 14235, 14266, 14217, 14238, 14373, 14346, 14334, 14294, 14373, 14344, 14302, 14354, 14362, 14320, 14395, 14389, 14257, 14251, 14399]
  Client 0: 44353 train samples, 2 unique classes
  Client 1: 44290 train samples, 2 unique classes
  Client 2: 44657 train samples, 2 unique classes
  Client 3: 44907 train samples, 2 unique classes
  Client 4: 44696 train samples, 2 unique classes
  Client 5: 45843 train samples, 2 unique classes
  Client 6: 45801 train samples, 2 unique classes
  Client 7: 45619 train samples, 2 unique classes
  Client 8: 45069 train samples, 2 unique classes
  Client 9: 45639 train samples, 2 unique classes
  Client 10: 45821 train samples, 2 unique classes
  Client 11: 45311 train samples, 2 unique classes
  Client 12: 45779 train samples, 2 unique classes
  Client 13: 46056 train samples, 2 unique classes
  Client 14: 45625 train samples, 2 unique classes
  Client 15: 45984 train samples, 2 unique classes
  Client 16: 46428 train samples, 2 unique classes
  Client 17: 44737 train samples, 2 unique classes
  Client 18: 45540 train samples, 2 unique classes
  Client 19: 46497 train samples, 2 unique classes
Will sample 4500 samples per client per epoch
Graph: erdos, nodes: 20, edges: 48
Degree statistics: avg=4.80, min=2, max=7
Attack: Compromised 4/20 nodes: [5, 12, 13, 17]
Attack type: backdoor, lambda: 1.0
Backdoor target label: 1, trigger size: 3
Model variant: baseline
Model parameters: 1,174,986
Initial test acc across nodes: mean=0.4965 ± 0.0152
Backdoor attack: Created poisoned datasets for 4 compromised nodes
Round 001: test acc mean=0.5349 ± 0.0472 | min=0.4911 max=0.6098
         : test loss mean=16.9530 ± 15.9090
         : individual accs = ['0.593100', '0.609835', '0.599047', '0.512274', '0.504425', '0.493564', '0.496096', '0.502651', '0.591717', '0.602797', '0.501952', '0.499860', '0.496377', '0.491088', '0.496159', '0.520667', '0.495865', '0.497861', '0.595818', '0.596986']
         : correct/total = [(8441, 14232), (8681, 14235), (8546, 14266), (7283, 14217), (7182, 14238), (7094, 14373), (7117, 14346), (7205, 14334), (8458, 14294), (8664, 14373), (7200, 14344), (7149, 14302), (7125, 14354), (7053, 14362), (7105, 14320), (7495, 14395), (7135, 14389), (7098, 14257), (8491, 14251), (8596, 14399)]
         : compromised: 0.4947, honest: 0.5450
Round 002: test acc mean=0.5715 ± 0.0558 | min=0.4962 max=0.6247
         : test loss mean=14.3008 ± 19.2944
         : individual accs = ['0.617482', '0.624658', '0.617973', '0.620806', '0.619329', '0.508662', '0.615363', '0.504604', '0.611026', '0.619217', '0.618377', '0.614529', '0.500070', '0.514483', '0.497975', '0.499896', '0.505178', '0.496247', '0.608449', '0.616084']
         : correct/total = [(8788, 14232), (8892, 14235), (8816, 14266), (8826, 14217), (8818, 14238), (7311, 14373), (8828, 14346), (7233, 14334), (8734, 14294), (8900, 14373), (8870, 14344), (8789, 14302), (7178, 14354), (7389, 14362), (7131, 14320), (7196, 14395), (7269, 14389), (7075, 14257), (8671, 14251), (8871, 14399)]
         : compromised: 0.5049, honest: 0.5882
Round 003: test acc mean=0.5958 ± 0.0589 | min=0.4868 max=0.6367
         : test loss mean=2.4797 ± 3.8910
         : individual accs = ['0.628162', '0.628451', '0.631011', '0.630091', '0.636676', '0.493703', '0.621079', '0.494628', '0.622009', '0.630627', '0.630577', '0.626206', '0.635502', '0.634591', '0.502793', '0.636610', '0.486761', '0.492530', '0.625710', '0.628030']
         : correct/total = [(8940, 14232), (8946, 14235), (9002, 14266), (8958, 14217), (9065, 14238), (7096, 14373), (8910, 14346), (7090, 14334), (8891, 14294), (9064, 14373), (9045, 14344), (8956, 14302), (9122, 14354), (9114, 14362), (7200, 14320), (9164, 14395), (7004, 14389), (7022, 14257), (8917, 14251), (9043, 14399)]
         : compromised: 0.5641, honest: 0.6037
Round 004: test acc mean=0.5948 ± 0.0651 | min=0.4871 max=0.6489
         : test loss mean=3.9806 ± 5.1691
         : individual accs = ['0.639053', '0.648894', '0.637320', '0.636281', '0.634499', '0.491199', '0.629444', '0.496163', '0.636911', '0.639115', '0.641313', '0.634177', '0.501393', '0.641693', '0.504050', '0.493713', '0.632080', '0.487129', '0.632657', '0.638794']
         : correct/total = [(9095, 14232), (9237, 14235), (9092, 14266), (9046, 14217), (9034, 14238), (7060, 14373), (9030, 14346), (7112, 14334), (9104, 14294), (9186, 14373), (9199, 14344), (9070, 14302), (7197, 14354), (9216, 14362), (7218, 14320), (7107, 14395), (9095, 14389), (6945, 14257), (9016, 14251), (9198, 14399)]
         : compromised: 0.5304, honest: 0.6109
Round 005: test acc mean=0.6151 ± 0.0582 | min=0.4956 max=0.6573
         : test loss mean=1.8179 ± 2.4498
         : individual accs = ['0.647836', '0.643133', '0.646152', '0.647957', '0.657325', '0.497808', '0.641224', '0.499442', '0.641388', '0.647812', '0.643056', '0.634666', '0.647346', '0.646358', '0.503841', '0.495589', '0.640767', '0.638002', '0.640727', '0.641433']
         : correct/total = [(9220, 14232), (9155, 14235), (9218, 14266), (9212, 14217), (9359, 14238), (7155, 14373), (9199, 14346), (7159, 14334), (9168, 14294), (9311, 14373), (9224, 14344), (9077, 14302), (9292, 14354), (9283, 14362), (7215, 14320), (7134, 14395), (9220, 14389), (9096, 14257), (9131, 14251), (9236, 14399)]
         : compromised: 0.6074, honest: 0.6170
Round 006: test acc mean=0.6059 ± 0.0673 | min=0.4894 max=0.6552
         : test loss mean=2.6229 ± 3.8707
         : individual accs = ['0.653527', '0.651914', '0.652811', '0.648660', '0.651707', '0.489390', '0.649031', '0.504953', '0.644746', '0.651917', '0.647100', '0.647742', '0.510938', '0.655201', '0.502863', '0.508024', '0.649454', '0.504173', '0.644867', '0.648726']
         : correct/total = [(9301, 14232), (9280, 14235), (9313, 14266), (9222, 14217), (9279, 14238), (7034, 14373), (9311, 14346), (7238, 14334), (9216, 14294), (9370, 14373), (9282, 14344), (9264, 14302), (7334, 14354), (9410, 14362), (7201, 14320), (7313, 14395), (9345, 14389), (7188, 14257), (9190, 14251), (9341, 14399)]
         : compromised: 0.5399, honest: 0.6224
Round 007: test acc mean=0.6325 ± 0.0545 | min=0.5010 max=0.6627
         : test loss mean=3.5393 ± 7.3426
         : individual accs = ['0.662662', '0.656270', '0.654774', '0.656468', '0.656412', '0.504488', '0.655165', '0.503698', '0.647265', '0.660892', '0.652607', '0.654174', '0.654661', '0.659170', '0.501047', '0.661896', '0.651122', '0.646209', '0.651112', '0.659490']
         : correct/total = [(9431, 14232), (9342, 14235), (9341, 14266), (9333, 14217), (9346, 14238), (7251, 14373), (9399, 14346), (7220, 14334), (9252, 14294), (9499, 14373), (9361, 14344), (9356, 14302), (9397, 14354), (9467, 14362), (7175, 14320), (9528, 14395), (9369, 14389), (9213, 14257), (9279, 14251), (9496, 14399)]
         : compromised: 0.6161, honest: 0.6366
Round 008: test acc mean=0.6275 ± 0.0641 | min=0.4941 max=0.6637
         : test loss mean=3.9410 ± 6.9222
         : individual accs = ['0.663435', '0.659361', '0.655475', '0.659633', '0.659854', '0.494121', '0.657814', '0.496302', '0.658178', '0.657344', '0.659021', '0.659278', '0.657517', '0.663417', '0.500140', '0.662800', '0.654111', '0.507260', '0.661147', '0.663727']
         : correct/total = [(9442, 14232), (9386, 14235), (9351, 14266), (9378, 14217), (9395, 14238), (7102, 14373), (9437, 14346), (7114, 14334), (9408, 14294), (9448, 14373), (9453, 14344), (9429, 14302), (9438, 14354), (9528, 14362), (7162, 14320), (9541, 14395), (9412, 14389), (7232, 14257), (9422, 14251), (9557, 14399)]
         : compromised: 0.5806, honest: 0.6392
Round 009: test acc mean=0.6412 ± 0.0579 | min=0.4985 max=0.6727
         : test loss mean=2.7027 ± 5.3613
         : individual accs = ['0.672709', '0.665051', '0.665428', '0.663923', '0.667861', '0.505949', '0.663390', '0.662481', '0.664684', '0.668336', '0.666062', '0.663683', '0.663160', '0.665367', '0.506075', '0.670858', '0.662311', '0.498492', '0.661357', '0.667338']
         : correct/total = [(9574, 14232), (9467, 14235), (9493, 14266), (9439, 14217), (9509, 14238), (7272, 14373), (9517, 14346), (9496, 14334), (9501, 14294), (9606, 14373), (9554, 14344), (9492, 14302), (9519, 14354), (9556, 14362), (7247, 14320), (9657, 14395), (9530, 14389), (7107, 14257), (9425, 14251), (9609, 14399)]
         : compromised: 0.5832, honest: 0.6557
Round 010: test acc mean=0.6520 ± 0.0508 | min=0.4992 max=0.6761
         : test loss mean=2.2598 ± 4.9781
         : individual accs = ['0.676082', '0.670460', '0.668793', '0.672083', '0.660837', '0.499200', '0.670082', '0.666667', '0.668672', '0.674250', '0.664738', '0.666550', '0.669918', '0.672121', '0.501187', '0.675860', '0.661686', '0.660097', '0.668795', '0.672199']
         : correct/total = [(9622, 14232), (9544, 14235), (9541, 14266), (9555, 14217), (9409, 14238), (7175, 14373), (9613, 14346), (9556, 14334), (9558, 14294), (9691, 14373), (9535, 14344), (9533, 14302), (9616, 14354), (9653, 14362), (7177, 14320), (9729, 14395), (9521, 14389), (9411, 14257), (9531, 14251), (9679, 14399)]
         : compromised: 0.6253, honest: 0.6587

=== FINAL RESULTS ===
Dataset: sent140, Nodes: 20, Graph: erdos, Aggregation: krum
Attack: backdoor, 20.0% compromised
Final accuracy - Compromised: 0.6253, Honest: 0.6587
Overall test accuracy: mean=0.6520 ± 0.0508

=== BACKDOOR ATTACK SUCCESS RATE (ASR) ===
Target label: 1
Trigger size: 3x3
Overall ASR: 0.4637 ± 0.1542
Honest nodes ASR: 0.4461 ± 0.1291
Compromised nodes ASR: 0.5341 ± 0.2145
Note: Higher ASR indicates more successful backdoor attack
