Device: cuda
Seed: 987654321
Loading 1 LEAF Sent140 train files...
LEAF Sent140 train: 254555 users, 908652 samples
Building vocabulary (max_size=10000)...
Vocabulary size: 10000
Loading 1 LEAF Sent140 test files...
LEAF Sent140 test: 254555 users, 286281 samples
Found 254555 train users, 254555 test users, 254555 common users
User sample counts range: 494 (max) to 1 (min)
Distributed ALL 254555 users across 20 clients
Users per client: 12727 (with 15 clients getting +1 user)
Train partition sizes: [44353, 44290, 44657, 44907, 44696, 45843, 45801, 45619, 45069, 45639, 45821, 45311, 45779, 46056, 45625, 45984, 46428, 44737, 45540, 46497]
Test partition sizes: [14232, 14235, 14266, 14217, 14238, 14373, 14346, 14334, 14294, 14373, 14344, 14302, 14354, 14362, 14320, 14395, 14389, 14257, 14251, 14399]
  Client 0: 44353 train samples, 2 unique classes
  Client 1: 44290 train samples, 2 unique classes
  Client 2: 44657 train samples, 2 unique classes
  Client 3: 44907 train samples, 2 unique classes
  Client 4: 44696 train samples, 2 unique classes
  Client 5: 45843 train samples, 2 unique classes
  Client 6: 45801 train samples, 2 unique classes
  Client 7: 45619 train samples, 2 unique classes
  Client 8: 45069 train samples, 2 unique classes
  Client 9: 45639 train samples, 2 unique classes
  Client 10: 45821 train samples, 2 unique classes
  Client 11: 45311 train samples, 2 unique classes
  Client 12: 45779 train samples, 2 unique classes
  Client 13: 46056 train samples, 2 unique classes
  Client 14: 45625 train samples, 2 unique classes
  Client 15: 45984 train samples, 2 unique classes
  Client 16: 46428 train samples, 2 unique classes
  Client 17: 44737 train samples, 2 unique classes
  Client 18: 45540 train samples, 2 unique classes
  Client 19: 46497 train samples, 2 unique classes
Will sample 4500 samples per client per epoch
Graph: ring, nodes: 20, edges: 20
Degree statistics: avg=2.00, min=2, max=2
Attack: Compromised 2/20 nodes: [5, 13]
Attack type: directed_deviation, lambda: 1.0
Model variant: baseline
Model parameters: 1,174,986
BALANCE algorithm:
Balance Config: BALANCEConfig(gamma=2, kappa=1, alpha=0.5, min_neighbors=1)
  - Model dimension: 1,174,986 parameters
  - Complexity: O(N×d) = O(20×1,174,986)
Initial test acc across nodes: mean=0.4965 ± 0.0152
Round 001: test acc mean=0.5247 ± 0.0206 | min=0.4971 max=0.5606
         : test loss mean=0.9655 ± 0.6020
         : individual accs = ['0.511031', '0.553495', '0.515211', '0.554407', '0.507796', '0.509288', '0.503206', '0.526441', '0.518679', '0.540110', '0.498048', '0.560621', '0.497074', '0.546790', '0.501676', '0.540396', '0.524776', '0.521218', '0.508736', '0.555941']
         : correct/total = [(7273, 14232), (7879, 14235), (7350, 14266), (7882, 14217), (7230, 14238), (7320, 14373), (7219, 14346), (7546, 14334), (7414, 14294), (7763, 14373), (7144, 14344), (8018, 14302), (7135, 14354), (7853, 14362), (7184, 14320), (7779, 14395), (7551, 14389), (7431, 14257), (7250, 14251), (8005, 14399)]
         : compromised: 0.5280, honest: 0.5244
Round 002: test acc mean=0.5019 ± 0.0101 | min=0.4884 max=0.5192
         : test loss mean=0.8500 ± 0.3213
         : individual accs = ['0.491568', '0.508114', '0.488925', '0.512837', '0.514749', '0.498643', '0.488359', '0.498744', '0.488597', '0.498782', '0.513385', '0.495805', '0.491222', '0.505640', '0.489804', '0.507676', '0.504552', '0.517570', '0.503754', '0.519203']
         : correct/total = [(6996, 14232), (7233, 14235), (6975, 14266), (7291, 14217), (7329, 14238), (7167, 14373), (7006, 14346), (7149, 14334), (6984, 14294), (7169, 14373), (7364, 14344), (7091, 14302), (7051, 14354), (7262, 14362), (7014, 14320), (7308, 14395), (7260, 14389), (7379, 14257), (7179, 14251), (7476, 14399)]
         : compromised: 0.5021, honest: 0.5019
Round 003: test acc mean=0.5023 ± 0.0131 | min=0.4863 max=0.5328
         : test loss mean=0.6993 ± 0.0111
         : individual accs = ['0.489179', '0.486336', '0.486541', '0.516494', '0.532800', '0.526334', '0.502370', '0.505232', '0.488317', '0.493147', '0.512828', '0.521046', '0.495750', '0.503969', '0.501606', '0.490934', '0.499757', '0.503051', '0.491685', '0.499618']
         : correct/total = [(6962, 14232), (6923, 14235), (6941, 14266), (7343, 14217), (7586, 14238), (7565, 14373), (7207, 14346), (7242, 14334), (6980, 14294), (7088, 14373), (7356, 14344), (7452, 14302), (7116, 14354), (7238, 14362), (7183, 14320), (7067, 14395), (7191, 14389), (7172, 14257), (7007, 14251), (7194, 14399)]
         : compromised: 0.5152, honest: 0.5009
Round 004: test acc mean=0.5308 ± 0.0318 | min=0.4867 max=0.5866
         : test loss mean=0.6881 ± 0.0061
         : individual accs = ['0.489320', '0.486688', '0.521800', '0.586622', '0.575783', '0.553607', '0.548655', '0.572904', '0.494193', '0.493008', '0.526422', '0.568172', '0.565278', '0.525693', '0.541690', '0.542897', '0.526722', '0.503262', '0.494000', '0.499826']
         : correct/total = [(6964, 14232), (6928, 14235), (7444, 14266), (8340, 14217), (8198, 14238), (7957, 14373), (7871, 14346), (8212, 14334), (7064, 14294), (7086, 14373), (7551, 14344), (8126, 14302), (8114, 14354), (7550, 14362), (7757, 14320), (7815, 14395), (7579, 14389), (7175, 14257), (7040, 14251), (7197, 14399)]
         : compromised: 0.5397, honest: 0.5298
Round 005: test acc mean=0.5416 ± 0.0398 | min=0.4863 max=0.6042
         : test loss mean=0.6838 ± 0.0101
         : individual accs = ['0.489109', '0.486266', '0.504907', '0.601111', '0.604158', '0.564948', '0.583647', '0.582671', '0.539317', '0.493008', '0.529629', '0.580898', '0.583740', '0.549436', '0.560335', '0.561653', '0.527486', '0.503051', '0.489860', '0.496493']
         : correct/total = [(6961, 14232), (6922, 14235), (7203, 14266), (8546, 14217), (8602, 14238), (8120, 14373), (8373, 14346), (8352, 14334), (7709, 14294), (7086, 14373), (7597, 14344), (8308, 14302), (8379, 14354), (7891, 14362), (8024, 14320), (8085, 14395), (7590, 14389), (7172, 14257), (6981, 14251), (7149, 14399)]
         : compromised: 0.5572, honest: 0.5399
Round 006: test acc mean=0.5555 ± 0.0445 | min=0.4863 max=0.6134
         : test loss mean=0.6806 ± 0.0128
         : individual accs = ['0.489109', '0.486266', '0.571709', '0.606598', '0.613429', '0.580394', '0.598913', '0.598507', '0.569540', '0.493008', '0.573550', '0.598448', '0.599902', '0.558279', '0.573464', '0.571935', '0.537702', '0.503121', '0.489088', '0.496354']
         : correct/total = [(6961, 14232), (6922, 14235), (8156, 14266), (8624, 14217), (8734, 14238), (8342, 14373), (8592, 14346), (8579, 14334), (8141, 14294), (7086, 14373), (8227, 14344), (8559, 14302), (8611, 14354), (8018, 14362), (8212, 14320), (8233, 14395), (7737, 14389), (7173, 14257), (6970, 14251), (7147, 14399)]
         : compromised: 0.5693, honest: 0.5539
Round 007: test acc mean=0.5614 ± 0.0488 | min=0.4863 max=0.6223
         : test loss mean=0.6774 ± 0.0149
         : individual accs = ['0.489109', '0.486266', '0.584186', '0.614405', '0.622349', '0.594448', '0.604350', '0.602972', '0.552050', '0.493008', '0.584565', '0.608936', '0.611816', '0.566773', '0.592109', '0.589371', '0.542498', '0.503121', '0.488738', '0.496354']
         : correct/total = [(6961, 14232), (6922, 14235), (8334, 14266), (8735, 14217), (8861, 14238), (8544, 14373), (8670, 14346), (8643, 14334), (7891, 14294), (7086, 14373), (8385, 14344), (8709, 14302), (8782, 14354), (8140, 14362), (8479, 14320), (8484, 14395), (7806, 14389), (7173, 14257), (6965, 14251), (7147, 14399)]
         : compromised: 0.5806, honest: 0.5592
Round 008: test acc mean=0.5706 ± 0.0522 | min=0.4863 max=0.6271
         : test loss mean=0.6726 ± 0.0168
         : individual accs = ['0.489109', '0.486266', '0.577247', '0.617359', '0.627125', '0.610172', '0.613760', '0.611832', '0.584371', '0.497391', '0.598857', '0.611243', '0.618991', '0.607019', '0.603561', '0.600834', '0.566613', '0.504103', '0.489299', '0.496354']
         : correct/total = [(6961, 14232), (6922, 14235), (8235, 14266), (8777, 14217), (8929, 14238), (8770, 14373), (8805, 14346), (8770, 14334), (8353, 14294), (7149, 14373), (8590, 14344), (8742, 14302), (8885, 14354), (8718, 14362), (8643, 14320), (8649, 14395), (8153, 14389), (7187, 14257), (6973, 14251), (7147, 14399)]
         : compromised: 0.6086, honest: 0.5664
Round 009: test acc mean=0.5781 ± 0.0548 | min=0.4865 max=0.6287
         : test loss mean=0.6678 ± 0.0188
         : individual accs = ['0.489109', '0.486477', '0.607318', '0.622565', '0.621225', '0.621234', '0.620661', '0.618599', '0.589758', '0.500522', '0.609314', '0.621941', '0.628745', '0.620666', '0.613478', '0.607711', '0.580096', '0.513011', '0.492457', '0.496354']
         : correct/total = [(6961, 14232), (6925, 14235), (8664, 14266), (8851, 14217), (8845, 14238), (8929, 14373), (8904, 14346), (8867, 14334), (8430, 14294), (7194, 14373), (8740, 14344), (8895, 14302), (9025, 14354), (8914, 14362), (8785, 14320), (8748, 14395), (8347, 14389), (7314, 14257), (7018, 14251), (7147, 14399)]
         : compromised: 0.6209, honest: 0.5733
Round 010: test acc mean=0.5886 ± 0.0550 | min=0.4887 max=0.6377
         : test loss mean=0.6622 ± 0.0213
         : individual accs = ['0.489109', '0.497085', '0.619585', '0.631216', '0.635553', '0.632575', '0.623379', '0.624459', '0.614314', '0.572184', '0.612242', '0.625087', '0.637662', '0.633199', '0.618296', '0.615491', '0.591007', '0.513783', '0.488738', '0.496354']
         : correct/total = [(6961, 14232), (7076, 14235), (8839, 14266), (8974, 14217), (9049, 14238), (9092, 14373), (8943, 14346), (8951, 14334), (8781, 14294), (8224, 14373), (8782, 14344), (8940, 14302), (9153, 14354), (9094, 14362), (8854, 14320), (8860, 14395), (8504, 14389), (7325, 14257), (6965, 14251), (7147, 14399)]
         : compromised: 0.6329, honest: 0.5836

=== FINAL RESULTS ===
Dataset: sent140, Nodes: 20, Graph: ring, Aggregation: balance
Attack: directed_deviation, 10.0% compromised
Final accuracy - Compromised: 0.6329, Honest: 0.5836
Overall test accuracy: mean=0.5886 ± 0.0550

=== BALANCE SUMMARY ===
Node 0: acceptance=1.000
Node 1: acceptance=1.000
Node 2: acceptance=1.000
Node 3: acceptance=1.000
Node 4: acceptance=0.600
Node 5: acceptance=0.800
Node 6: acceptance=0.600
Node 7: acceptance=1.000
Node 8: acceptance=1.000
Node 9: acceptance=1.000
Node 10: acceptance=1.000
Node 11: acceptance=1.000
Node 12: acceptance=0.600
Node 13: acceptance=0.800
Node 14: acceptance=0.600
Node 15: acceptance=1.000
Node 16: acceptance=1.000
Node 17: acceptance=1.000
Node 18: acceptance=1.000
Node 19: acceptance=1.000

=== PARALLEL EXECUTION TIME (realistic for distributed system) ===
  COMMUNICATION (max across nodes):
    - Full model transfer: 0.000s (0.0%)
  COMPUTATION (max across nodes):
    - Filtering: 0.028s (69.9%)
    - Aggregation: 0.012s (30.1%)
  TOTALS:
    - Total computation: 0.040s (100.0%)
    - Total communication: 0.000s (0.0%)
    - Total parallel time: 0.040s

=== PER-NODE AVERAGE TIME ===
  - Filtering: 0.012s
  - Aggregation: 0.006s
  - Model transfer: 0.000s
  - Total per node: 0.018s

=== TOTAL COMPUTATIONAL WORK (sum across all nodes) ===
  - Total filtering: 0.249s
  - Total aggregation: 0.114s
  - Total model transfer: 0.000s
  - Grand total: 0.363s
  - Mean acceptance rate: 0.900

BALANCE Algorithm Properties:
  - Model dimension: 1,174,986
  - No compression: Full parameter comparison
  - Theoretical complexity: O(deg(i)×d)
  - Approach: Full parameter filtering + averaging
