Device: cuda
Seed: 987654321
Loading 1 LEAF Sent140 train files...
LEAF Sent140 train: 254555 users, 908652 samples
Building vocabulary (max_size=10000)...
Vocabulary size: 10000
Loading 1 LEAF Sent140 test files...
LEAF Sent140 test: 254555 users, 286281 samples
Found 254555 train users, 254555 test users, 254555 common users
User sample counts range: 494 (max) to 1 (min)
Distributed ALL 254555 users across 20 clients
Users per client: 12727 (with 15 clients getting +1 user)
Train partition sizes: [44353, 44290, 44657, 44907, 44696, 45843, 45801, 45619, 45069, 45639, 45821, 45311, 45779, 46056, 45625, 45984, 46428, 44737, 45540, 46497]
Test partition sizes: [14232, 14235, 14266, 14217, 14238, 14373, 14346, 14334, 14294, 14373, 14344, 14302, 14354, 14362, 14320, 14395, 14389, 14257, 14251, 14399]
  Client 0: 44353 train samples, 2 unique classes
  Client 1: 44290 train samples, 2 unique classes
  Client 2: 44657 train samples, 2 unique classes
  Client 3: 44907 train samples, 2 unique classes
  Client 4: 44696 train samples, 2 unique classes
  Client 5: 45843 train samples, 2 unique classes
  Client 6: 45801 train samples, 2 unique classes
  Client 7: 45619 train samples, 2 unique classes
  Client 8: 45069 train samples, 2 unique classes
  Client 9: 45639 train samples, 2 unique classes
  Client 10: 45821 train samples, 2 unique classes
  Client 11: 45311 train samples, 2 unique classes
  Client 12: 45779 train samples, 2 unique classes
  Client 13: 46056 train samples, 2 unique classes
  Client 14: 45625 train samples, 2 unique classes
  Client 15: 45984 train samples, 2 unique classes
  Client 16: 46428 train samples, 2 unique classes
  Client 17: 44737 train samples, 2 unique classes
  Client 18: 45540 train samples, 2 unique classes
  Client 19: 46497 train samples, 2 unique classes
Will sample 4500 samples per client per epoch
Graph: erdos, nodes: 20, edges: 48
Degree statistics: avg=4.80, min=2, max=7
Attack: Compromised 8/20 nodes: [1, 5, 11, 12, 13, 14, 17, 18]
Attack type: backdoor, lambda: 1.0
Backdoor target label: 1, trigger size: 3
Model variant: baseline
Model parameters: 1,174,986
BALANCE algorithm:
Balance Config: BALANCEConfig(gamma=2, kappa=1, alpha=0.5, min_neighbors=1)
  - Model dimension: 1,174,986 parameters
  - Complexity: O(N×d) = O(20×1,174,986)
Initial test acc across nodes: mean=0.4965 ± 0.0152
Backdoor attack: Created poisoned datasets for 8 compromised nodes
Round 001: test acc mean=0.5031 ± 0.0106 | min=0.4888 max=0.5405
         : test loss mean=13.7601 ± 15.8228
         : individual accs = ['0.488758', '0.503548', '0.510234', '0.499613', '0.492063', '0.494817', '0.493657', '0.505790', '0.504058', '0.501426', '0.495817', '0.501259', '0.505922', '0.508007', '0.503841', '0.514206', '0.501425', '0.502490', '0.494351', '0.540524']
         : correct/total = [(6956, 14232), (7168, 14235), (7279, 14266), (7103, 14217), (7006, 14238), (7112, 14373), (7082, 14346), (7250, 14334), (7205, 14294), (7207, 14373), (7112, 14344), (7169, 14302), (7262, 14354), (7296, 14362), (7215, 14320), (7402, 14395), (7215, 14389), (7164, 14257), (7045, 14251), (7783, 14399)]
         : compromised: 0.5018, honest: 0.5040
Round 002: test acc mean=0.5035 ± 0.0119 | min=0.4852 max=0.5273
         : test loss mean=507.6870 ± 622.0205
         : individual accs = ['0.505832', '0.508816', '0.498598', '0.520082', '0.494311', '0.504418', '0.486198', '0.510465', '0.527284', '0.501913', '0.503555', '0.504195', '0.499512', '0.489765', '0.498673', '0.527197', '0.507540', '0.509855', '0.485159', '0.486353']
         : correct/total = [(7199, 14232), (7243, 14235), (7113, 14266), (7394, 14217), (7038, 14238), (7250, 14373), (6975, 14346), (7317, 14334), (7537, 14294), (7214, 14373), (7223, 14344), (7211, 14302), (7170, 14354), (7034, 14362), (7141, 14320), (7589, 14395), (7303, 14389), (7269, 14257), (6914, 14251), (7003, 14399)]
         : compromised: 0.5000, honest: 0.5058
Round 003: test acc mean=0.5167 ± 0.0193 | min=0.4943 max=0.5653
         : test loss mean=34018.6450 ± 43386.9986
         : individual accs = ['0.536608', '0.495961', '0.530492', '0.536681', '0.498385', '0.498504', '0.521260', '0.528394', '0.508745', '0.526056', '0.533882', '0.514613', '0.501951', '0.499025', '0.507821', '0.541160', '0.498853', '0.496598', '0.494281', '0.565317']
         : correct/total = [(7637, 14232), (7060, 14235), (7568, 14266), (7630, 14217), (7096, 14238), (7165, 14373), (7478, 14346), (7574, 14334), (7272, 14294), (7561, 14373), (7658, 14344), (7360, 14302), (7205, 14354), (7167, 14362), (7272, 14320), (7790, 14395), (7178, 14389), (7080, 14257), (7044, 14251), (8140, 14399)]
         : compromised: 0.5011, honest: 0.5272
Round 004: test acc mean=0.5163 ± 0.0248 | min=0.4871 max=0.5927
         : test loss mean=4591790.4689 ± 6330006.8855
         : individual accs = ['0.525365', '0.501581', '0.545563', '0.554055', '0.500913', '0.493982', '0.517217', '0.507604', '0.504897', '0.539066', '0.529769', '0.500140', '0.487112', '0.504387', '0.498673', '0.516916', '0.496421', '0.499614', '0.509438', '0.592680']
         : correct/total = [(7477, 14232), (7140, 14235), (7783, 14266), (7877, 14217), (7132, 14238), (7100, 14373), (7420, 14346), (7276, 14334), (7217, 14294), (7748, 14373), (7599, 14344), (7153, 14302), (6992, 14354), (7244, 14362), (7141, 14320), (7441, 14395), (7143, 14389), (7123, 14257), (7260, 14251), (8534, 14399)]
         : compromised: 0.4994, honest: 0.5275
Round 005: test acc mean=0.5182 ± 0.0260 | min=0.4945 max=0.5766
         : test loss mean=256996226.3493 ± 324882209.4931
         : individual accs = ['0.515177', '0.501159', '0.521870', '0.574172', '0.505829', '0.497252', '0.540429', '0.499721', '0.511543', '0.550129', '0.559607', '0.494476', '0.499512', '0.497424', '0.506494', '0.508579', '0.500382', '0.495055', '0.509017', '0.576568']
         : correct/total = [(7332, 14232), (7134, 14235), (7445, 14266), (8163, 14217), (7202, 14238), (7147, 14373), (7753, 14346), (7163, 14334), (7312, 14294), (7907, 14373), (8027, 14344), (7072, 14302), (7170, 14354), (7144, 14362), (7253, 14320), (7321, 14395), (7200, 14389), (7058, 14257), (7254, 14251), (8302, 14399)]
         : compromised: 0.5000, honest: 0.5303
Round 006: test acc mean=0.5274 ± 0.0299 | min=0.4897 max=0.5818
         : test loss mean=18729325832.3021 ± 23559314252.3364
         : individual accs = ['0.524522', '0.504742', '0.561966', '0.581839', '0.502880', '0.500591', '0.564896', '0.554695', '0.519239', '0.565366', '0.546012', '0.501818', '0.497701', '0.489695', '0.502863', '0.544356', '0.500313', '0.508452', '0.501228', '0.574970']
         : correct/total = [(7465, 14232), (7185, 14235), (8017, 14266), (8272, 14217), (7160, 14238), (7195, 14373), (8104, 14346), (7951, 14334), (7422, 14294), (8126, 14373), (7832, 14344), (7177, 14302), (7144, 14354), (7033, 14362), (7201, 14320), (7836, 14395), (7199, 14389), (7249, 14257), (7143, 14251), (8279, 14399)]
         : compromised: 0.5009, honest: 0.5451
Round 007: test acc mean=0.5375 ± 0.0401 | min=0.4887 max=0.5967
         : test loss mean=1540170128802.9192 ± 1915709700223.5796
         : individual accs = ['0.573286', '0.497366', '0.574653', '0.596680', '0.506743', '0.499269', '0.582044', '0.570601', '0.506786', '0.579141', '0.582125', '0.499091', '0.488714', '0.508146', '0.503422', '0.577840', '0.500521', '0.501438', '0.507824', '0.593444']
         : correct/total = [(8159, 14232), (7080, 14235), (8198, 14266), (8483, 14217), (7215, 14238), (7176, 14373), (8350, 14346), (8179, 14334), (7244, 14294), (8324, 14373), (8350, 14344), (7138, 14302), (7015, 14354), (7298, 14362), (7209, 14320), (8318, 14395), (7202, 14389), (7149, 14257), (7237, 14251), (8545, 14399)]
         : compromised: 0.5007, honest: 0.5620
Round 008: test acc mean=0.5452 ± 0.0434 | min=0.4985 max=0.6013
         : test loss mean=125831550548450.0312 ± 157398156212542.1250
         : individual accs = ['0.590289', '0.512891', '0.593439', '0.601252', '0.506321', '0.504975', '0.590060', '0.589996', '0.504617', '0.596605', '0.594883', '0.507481', '0.501951', '0.501601', '0.506564', '0.583953', '0.516436', '0.506418', '0.498491', '0.595944']
         : correct/total = [(8401, 14232), (7301, 14235), (8466, 14266), (8548, 14217), (7209, 14238), (7258, 14373), (8465, 14346), (8457, 14334), (7213, 14294), (8575, 14373), (8533, 14344), (7258, 14302), (7205, 14354), (7204, 14362), (7254, 14320), (8406, 14395), (7431, 14389), (7220, 14257), (7104, 14251), (8581, 14399)]
         : compromised: 0.5050, honest: 0.5720
Round 009: test acc mean=0.5470 ± 0.0500 | min=0.4922 max=0.6122
         : test loss mean=10618031554443390.0000 ± 13505155171801162.0000
         : individual accs = ['0.597737', '0.505234', '0.603182', '0.607582', '0.507726', '0.504488', '0.600516', '0.594810', '0.506646', '0.601614', '0.612242', '0.492169', '0.499164', '0.503760', '0.511034', '0.591455', '0.494405', '0.499544', '0.498632', '0.607889']
         : correct/total = [(8507, 14232), (7192, 14235), (8605, 14266), (8638, 14217), (7229, 14238), (7251, 14373), (8615, 14346), (8526, 14334), (7242, 14294), (8647, 14373), (8782, 14344), (7039, 14302), (7165, 14354), (7235, 14362), (7318, 14320), (8514, 14395), (7114, 14389), (7122, 14257), (7106, 14251), (8753, 14399)]
         : compromised: 0.5018, honest: 0.5772
Round 010: test acc mean=0.5511 ± 0.0515 | min=0.4963 max=0.6145
         : test loss mean=887964656601925760.0000 ± 1122539005128676096.0000
         : individual accs = ['0.604132', '0.505304', '0.613837', '0.607371', '0.503301', '0.507340', '0.604698', '0.600460', '0.522597', '0.608432', '0.614543', '0.496294', '0.499930', '0.500418', '0.510126', '0.602362', '0.501286', '0.506839', '0.499614', '0.612751']
         : correct/total = [(8598, 14232), (7193, 14235), (8757, 14266), (8635, 14217), (7166, 14238), (7292, 14373), (8675, 14346), (8607, 14334), (7470, 14294), (8745, 14373), (8815, 14344), (7098, 14302), (7176, 14354), (7187, 14362), (7305, 14320), (8671, 14395), (7213, 14389), (7226, 14257), (7120, 14251), (8823, 14399)]
         : compromised: 0.5032, honest: 0.5830

=== FINAL RESULTS ===
Dataset: sent140, Nodes: 20, Graph: erdos, Aggregation: balance
Attack: backdoor, 40.0% compromised
Final accuracy - Compromised: 0.5032, Honest: 0.5830
Overall test accuracy: mean=0.5511 ± 0.0515

=== BACKDOOR ATTACK SUCCESS RATE (ASR) ===
Target label: 1
Trigger size: 3x3
Overall ASR: 0.6331 ± 0.3029
Honest nodes ASR: 0.3971 ± 0.1167
Compromised nodes ASR: 0.9872 ± 0.0064
Note: Higher ASR indicates more successful backdoor attack

=== BALANCE SUMMARY ===
Node 0: acceptance=0.683
Node 1: acceptance=0.600
Node 2: acceptance=0.460
Node 3: acceptance=0.550
Node 4: acceptance=0.975
Node 5: acceptance=0.700
Node 6: acceptance=0.640
Node 7: acceptance=0.540
Node 8: acceptance=1.000
Node 9: acceptance=0.700
Node 10: acceptance=0.550
Node 11: acceptance=0.600
Node 12: acceptance=0.600
Node 13: acceptance=0.600
Node 14: acceptance=0.600
Node 15: acceptance=0.400
Node 16: acceptance=0.980
Node 17: acceptance=0.700
Node 18: acceptance=0.600
Node 19: acceptance=1.000

=== PARALLEL EXECUTION TIME (realistic for distributed system) ===
  COMMUNICATION (max across nodes):
    - Full model transfer: 0.000s (0.0%)
  COMPUTATION (max across nodes):
    - Filtering: 0.034s (72.3%)
    - Aggregation: 0.013s (27.7%)
  TOTALS:
    - Total computation: 0.047s (100.0%)
    - Total communication: 0.000s (0.0%)
    - Total parallel time: 0.047s

=== PER-NODE AVERAGE TIME ===
  - Filtering: 0.023s
  - Aggregation: 0.006s
  - Model transfer: 0.000s
  - Total per node: 0.029s

=== TOTAL COMPUTATIONAL WORK (sum across all nodes) ===
  - Total filtering: 0.468s
  - Total aggregation: 0.120s
  - Total model transfer: 0.000s
  - Grand total: 0.588s
  - Mean acceptance rate: 0.674

BALANCE Algorithm Properties:
  - Model dimension: 1,174,986
  - No compression: Full parameter comparison
  - Theoretical complexity: O(deg(i)×d)
  - Approach: Full parameter filtering + averaging
