Device: cuda
Seed: 987654321
Loading 1 LEAF Sent140 train files...
LEAF Sent140 train: 254555 users, 908652 samples
Building vocabulary (max_size=10000)...
Vocabulary size: 10000
Loading 1 LEAF Sent140 test files...
LEAF Sent140 test: 254555 users, 286281 samples
Found 254555 train users, 254555 test users, 254555 common users
User sample counts range: 494 (max) to 1 (min)
Distributed ALL 254555 users across 20 clients
Users per client: 12727 (with 15 clients getting +1 user)
Train partition sizes: [44353, 44290, 44657, 44907, 44696, 45843, 45801, 45619, 45069, 45639, 45821, 45311, 45779, 46056, 45625, 45984, 46428, 44737, 45540, 46497]
Test partition sizes: [14232, 14235, 14266, 14217, 14238, 14373, 14346, 14334, 14294, 14373, 14344, 14302, 14354, 14362, 14320, 14395, 14389, 14257, 14251, 14399]
  Client 0: 44353 train samples, 2 unique classes
  Client 1: 44290 train samples, 2 unique classes
  Client 2: 44657 train samples, 2 unique classes
  Client 3: 44907 train samples, 2 unique classes
  Client 4: 44696 train samples, 2 unique classes
  Client 5: 45843 train samples, 2 unique classes
  Client 6: 45801 train samples, 2 unique classes
  Client 7: 45619 train samples, 2 unique classes
  Client 8: 45069 train samples, 2 unique classes
  Client 9: 45639 train samples, 2 unique classes
  Client 10: 45821 train samples, 2 unique classes
  Client 11: 45311 train samples, 2 unique classes
  Client 12: 45779 train samples, 2 unique classes
  Client 13: 46056 train samples, 2 unique classes
  Client 14: 45625 train samples, 2 unique classes
  Client 15: 45984 train samples, 2 unique classes
  Client 16: 46428 train samples, 2 unique classes
  Client 17: 44737 train samples, 2 unique classes
  Client 18: 45540 train samples, 2 unique classes
  Client 19: 46497 train samples, 2 unique classes
Will sample 4500 samples per client per epoch
Graph: ring, nodes: 20, edges: 20
Degree statistics: avg=2.00, min=2, max=2
Attack: Compromised 6/20 nodes: [5, 12, 13, 14, 17, 18]
Attack type: backdoor, lambda: 1.0
Backdoor target label: 1, trigger size: 3
Model variant: baseline
Model parameters: 1,174,986
Initial test acc across nodes: mean=0.4953 ± 0.0174
Backdoor attack: Created poisoned datasets for 6 compromised nodes
Round 001: test acc mean=0.5101 ± 0.0172 | min=0.4882 max=0.5652
         : test loss mean=9.0402 ± 22.2753
         : individual accs = ['0.534992', '0.565227', '0.488224', '0.512415', '0.510395', '0.505183', '0.506483', '0.524766', '0.502169', '0.533779', '0.502022', '0.508880', '0.504180', '0.506615', '0.494134', '0.500243', '0.495865', '0.502420', '0.496667', '0.507535']
         : correct/total = [(7614, 14232), (8046, 14235), (6965, 14266), (7285, 14217), (7267, 14238), (7261, 14373), (7266, 14346), (7522, 14334), (7178, 14294), (7672, 14373), (7201, 14344), (7278, 14302), (7237, 14354), (7276, 14362), (7076, 14320), (7201, 14395), (7135, 14389), (7163, 14257), (7078, 14251), (7308, 14399)]
         : compromised: 0.5015, honest: 0.5138
Round 002: test acc mean=0.5180 ± 0.0480 | min=0.4845 max=0.6367
         : test loss mean=9.4265 ± 17.8173
         : individual accs = ['0.491428', '0.636740', '0.628207', '0.515088', '0.496207', '0.499687', '0.501115', '0.494977', '0.512873', '0.628053', '0.501394', '0.495036', '0.505782', '0.484543', '0.492039', '0.500313', '0.492390', '0.492109', '0.492386', '0.500313']
         : correct/total = [(6994, 14232), (9064, 14235), (8962, 14266), (7323, 14217), (7065, 14238), (7182, 14373), (7189, 14346), (7095, 14334), (7331, 14294), (9027, 14373), (7192, 14344), (7080, 14302), (7260, 14354), (6959, 14362), (7046, 14320), (7202, 14395), (7085, 14389), (7016, 14257), (7017, 14251), (7204, 14399)]
         : compromised: 0.4944, honest: 0.5282
Round 003: test acc mean=0.5195 ± 0.0412 | min=0.4875 max=0.6236
         : test loss mean=11.9219 ± 41.7607
         : individual accs = ['0.507799', '0.616579', '0.607739', '0.515228', '0.495575', '0.500104', '0.492332', '0.507325', '0.498181', '0.623600', '0.509342', '0.504055', '0.496726', '0.516989', '0.500768', '0.508718', '0.508235', '0.497861', '0.495755', '0.487534']
         : correct/total = [(7227, 14232), (8777, 14235), (8670, 14266), (7325, 14217), (7056, 14238), (7188, 14373), (7063, 14346), (7272, 14334), (7121, 14294), (8963, 14373), (7306, 14344), (7209, 14302), (7130, 14354), (7425, 14362), (7171, 14320), (7323, 14395), (7313, 14389), (7098, 14257), (7065, 14251), (7020, 14399)]
         : compromised: 0.5014, honest: 0.5273
Round 004: test acc mean=0.5091 ± 0.0097 | min=0.4967 max=0.5347
         : test loss mean=33.4220 ± 106.7236
         : individual accs = ['0.502178', '0.517808', '0.534698', '0.516987', '0.505549', '0.504001', '0.500209', '0.499651', '0.527494', '0.521464', '0.515337', '0.506083', '0.496726', '0.507172', '0.506355', '0.501980', '0.507262', '0.504524', '0.504807', '0.502188']
         : correct/total = [(7147, 14232), (7371, 14235), (7628, 14266), (7350, 14217), (7198, 14238), (7244, 14373), (7176, 14346), (7162, 14334), (7540, 14294), (7495, 14373), (7392, 14344), (7238, 14302), (7130, 14354), (7284, 14362), (7251, 14320), (7226, 14395), (7299, 14389), (7193, 14257), (7194, 14251), (7231, 14399)]
         : compromised: 0.5039, honest: 0.5113
Round 005: test acc mean=0.5122 ± 0.0202 | min=0.4939 max=0.5840
         : test loss mean=132.1014 ± 550.2903
         : individual accs = ['0.518269', '0.533474', '0.537922', '0.493916', '0.508709', '0.502679', '0.498188', '0.515976', '0.522247', '0.584012', '0.496933', '0.505524', '0.493939', '0.506893', '0.507053', '0.502327', '0.510459', '0.500877', '0.502351', '0.502118']
         : correct/total = [(7376, 14232), (7594, 14235), (7674, 14266), (7022, 14217), (7243, 14238), (7225, 14373), (7147, 14346), (7396, 14334), (7465, 14294), (8394, 14373), (7128, 14344), (7230, 14302), (7090, 14354), (7280, 14362), (7261, 14320), (7231, 14395), (7345, 14389), (7141, 14257), (7159, 14251), (7230, 14399)]
         : compromised: 0.5023, honest: 0.5164
Round 006: test acc mean=0.5144 ± 0.0302 | min=0.4878 max=0.6133
         : test loss mean=110.7836 ± 463.0300
         : individual accs = ['0.502951', '0.613347', '0.552783', '0.528663', '0.489114', '0.490294', '0.508016', '0.540952', '0.512942', '0.558895', '0.505996', '0.500000', '0.501324', '0.490670', '0.507612', '0.501007', '0.501494', '0.495616', '0.487825', '0.499201']
         : correct/total = [(7158, 14232), (8731, 14235), (7886, 14266), (7516, 14217), (6964, 14238), (7047, 14373), (7288, 14346), (7754, 14334), (7332, 14294), (8033, 14373), (7258, 14344), (7151, 14302), (7196, 14354), (7047, 14362), (7269, 14320), (7212, 14395), (7216, 14389), (7066, 14257), (6952, 14251), (7188, 14399)]
         : compromised: 0.4956, honest: 0.5225
Round 007: test acc mean=0.5145 ± 0.0223 | min=0.4928 max=0.5770
         : test loss mean=159.1660 ± 671.4140
         : individual accs = ['0.499157', '0.577028', '0.549769', '0.503763', '0.505549', '0.506853', '0.499791', '0.534184', '0.531062', '0.556530', '0.507460', '0.507551', '0.492824', '0.508773', '0.504260', '0.499062', '0.495448', '0.503542', '0.505508', '0.501702']
         : correct/total = [(7104, 14232), (8214, 14235), (7843, 14266), (7162, 14217), (7198, 14238), (7285, 14373), (7170, 14346), (7657, 14334), (7591, 14294), (7999, 14373), (7279, 14344), (7259, 14302), (7074, 14354), (7307, 14362), (7221, 14320), (7184, 14395), (7129, 14389), (7179, 14257), (7204, 14251), (7224, 14399)]
         : compromised: 0.5036, honest: 0.5191
Round 008: test acc mean=0.5061 ± 0.0111 | min=0.4922 max=0.5340
         : test loss mean=887.4370 ± 3844.1863
         : individual accs = ['0.502670', '0.534036', '0.516052', '0.492509', '0.497261', '0.497391', '0.502440', '0.530696', '0.507696', '0.514993', '0.500558', '0.503216', '0.492197', '0.501741', '0.505377', '0.510316', '0.515741', '0.495756', '0.499895', '0.501215']
         : correct/total = [(7154, 14232), (7602, 14235), (7362, 14266), (7002, 14217), (7080, 14238), (7149, 14373), (7208, 14346), (7607, 14334), (7257, 14294), (7402, 14373), (7180, 14344), (7197, 14302), (7065, 14354), (7206, 14362), (7237, 14320), (7346, 14395), (7421, 14389), (7068, 14257), (7124, 14251), (7217, 14399)]
         : compromised: 0.4987, honest: 0.5092
Round 009: test acc mean=0.5069 ± 0.0130 | min=0.4926 max=0.5455
         : test loss mean=4655.5673 ± 20270.9171
         : individual accs = ['0.500843', '0.518511', '0.534137', '0.494900', '0.492625', '0.497739', '0.493866', '0.492814', '0.545474', '0.513671', '0.508505', '0.502447', '0.508221', '0.504944', '0.504539', '0.503856', '0.507888', '0.511468', '0.503894', '0.498298']
         : correct/total = [(7128, 14232), (7381, 14235), (7620, 14266), (7036, 14217), (7014, 14238), (7154, 14373), (7085, 14346), (7064, 14334), (7797, 14294), (7383, 14373), (7294, 14344), (7186, 14302), (7295, 14354), (7252, 14362), (7225, 14320), (7253, 14395), (7308, 14389), (7292, 14257), (7181, 14251), (7175, 14399)]
         : compromised: 0.5051, honest: 0.5077
Round 010: test acc mean=0.5007 ± 0.0115 | min=0.4829 max=0.5327
         : test loss mean=32749.2397 ± 142723.7158
         : individual accs = ['0.532743', '0.492237', '0.518365', '0.494619', '0.485953', '0.494121', '0.494005', '0.492884', '0.507486', '0.513324', '0.507669', '0.505104', '0.503274', '0.485796', '0.482891', '0.500104', '0.504205', '0.500807', '0.497930', '0.499757']
         : correct/total = [(7582, 14232), (7007, 14235), (7395, 14266), (7032, 14217), (6919, 14238), (7102, 14373), (7087, 14346), (7065, 14334), (7254, 14294), (7378, 14373), (7282, 14344), (7224, 14302), (7224, 14354), (6977, 14362), (6915, 14320), (7199, 14395), (7255, 14389), (7140, 14257), (7096, 14251), (7196, 14399)]
         : compromised: 0.4941, honest: 0.5035

=== FINAL RESULTS ===
Dataset: sent140, Nodes: 20, Graph: ring, Aggregation: d-fedavg
Attack: backdoor, 30.0% compromised
Final accuracy - Compromised: 0.4941, Honest: 0.5035
Overall test accuracy: mean=0.5007 ± 0.0115

=== BACKDOOR ATTACK SUCCESS RATE (ASR) ===
Target label: 1
Trigger size: 3x3
Overall ASR: 0.6137 ± 0.3289
Honest nodes ASR: 0.5993 ± 0.3487
Compromised nodes ASR: 0.6473 ± 0.2744
Note: Higher ASR indicates more successful backdoor attack
