Device: cuda
Seed: 987654321
Loading 1 LEAF Sent140 train files...
LEAF Sent140 train: 254555 users, 908652 samples
Building vocabulary (max_size=10000)...
Vocabulary size: 10000
Loading 1 LEAF Sent140 test files...
LEAF Sent140 test: 254555 users, 286281 samples
Found 254555 train users, 254555 test users, 254555 common users
User sample counts range: 494 (max) to 1 (min)
Distributed ALL 254555 users across 20 clients
Users per client: 12727 (with 15 clients getting +1 user)
Train partition sizes: [44353, 44290, 44657, 44907, 44696, 45843, 45801, 45619, 45069, 45639, 45821, 45311, 45779, 46056, 45625, 45984, 46428, 44737, 45540, 46497]
Test partition sizes: [14232, 14235, 14266, 14217, 14238, 14373, 14346, 14334, 14294, 14373, 14344, 14302, 14354, 14362, 14320, 14395, 14389, 14257, 14251, 14399]
  Client 0: 44353 train samples, 2 unique classes
  Client 1: 44290 train samples, 2 unique classes
  Client 2: 44657 train samples, 2 unique classes
  Client 3: 44907 train samples, 2 unique classes
  Client 4: 44696 train samples, 2 unique classes
  Client 5: 45843 train samples, 2 unique classes
  Client 6: 45801 train samples, 2 unique classes
  Client 7: 45619 train samples, 2 unique classes
  Client 8: 45069 train samples, 2 unique classes
  Client 9: 45639 train samples, 2 unique classes
  Client 10: 45821 train samples, 2 unique classes
  Client 11: 45311 train samples, 2 unique classes
  Client 12: 45779 train samples, 2 unique classes
  Client 13: 46056 train samples, 2 unique classes
  Client 14: 45625 train samples, 2 unique classes
  Client 15: 45984 train samples, 2 unique classes
  Client 16: 46428 train samples, 2 unique classes
  Client 17: 44737 train samples, 2 unique classes
  Client 18: 45540 train samples, 2 unique classes
  Client 19: 46497 train samples, 2 unique classes
Will sample 4500 samples per client per epoch
Graph: fully, nodes: 20, edges: 190
Degree statistics: avg=19.00, min=19, max=19
Attack: Compromised 12/20 nodes: [1, 2, 3, 5, 8, 11, 12, 13, 14, 15, 17, 18]
Attack type: directed_deviation, lambda: 1.0
Model variant: baseline
Model parameters: 1,174,986
Initial test acc across nodes: mean=0.4953 ± 0.0174
Round 001: test acc mean=0.4974 ± 0.0067 | min=0.4821 max=0.5100
         : test loss mean=8.4118 ± 2.1579
         : individual accs = ['0.507659', '0.482122', '0.498318', '0.509953', '0.499227', '0.500174', '0.494981', '0.490931', '0.497342', '0.490712', '0.503625', '0.499161', '0.499164', '0.487397', '0.500419', '0.505245', '0.490722', '0.499544', '0.498562', '0.491909']
         : correct/total = [(7225, 14232), (6863, 14235), (7109, 14266), (7250, 14217), (7108, 14238), (7189, 14373), (7101, 14346), (7037, 14334), (7109, 14294), (7053, 14373), (7224, 14344), (7139, 14302), (7165, 14354), (7000, 14362), (7166, 14320), (7273, 14395), (7061, 14389), (7122, 14257), (7105, 14251), (7083, 14399)]
         : compromised: 0.4981, honest: 0.4962
Round 002: test acc mean=0.5009 ± 0.0039 | min=0.4917 max=0.5080
         : test loss mean=4.4715 ± 0.0512
         : individual accs = ['0.505621', '0.502353', '0.503154', '0.507983', '0.505338', '0.501705', '0.503276', '0.503837', '0.503358', '0.493912', '0.500070', '0.503846', '0.497980', '0.491714', '0.501606', '0.497881', '0.499131', '0.499755', '0.497298', '0.497673']
         : correct/total = [(7196, 14232), (7151, 14235), (7178, 14266), (7222, 14217), (7195, 14238), (7211, 14373), (7220, 14346), (7222, 14334), (7195, 14294), (7099, 14373), (7173, 14344), (7206, 14302), (7148, 14354), (7062, 14362), (7183, 14320), (7167, 14395), (7182, 14389), (7125, 14257), (7087, 14251), (7166, 14399)]
         : compromised: 0.5007, honest: 0.5011
Round 003: test acc mean=0.4921 ± 0.0049 | min=0.4824 max=0.5017
         : test loss mean=1.0949 ± 0.0126
         : individual accs = ['0.492622', '0.483316', '0.484859', '0.482380', '0.491291', '0.493843', '0.498397', '0.490721', '0.493844', '0.494330', '0.496026', '0.488743', '0.498328', '0.501671', '0.490782', '0.491976', '0.490166', '0.491548', '0.489580', '0.497743']
         : correct/total = [(7011, 14232), (6880, 14235), (6917, 14266), (6858, 14217), (6995, 14238), (7098, 14373), (7150, 14346), (7034, 14334), (7059, 14294), (7105, 14373), (7115, 14344), (6990, 14302), (7153, 14354), (7205, 14362), (7028, 14320), (7082, 14395), (7053, 14389), (7008, 14257), (6977, 14251), (7167, 14399)]
         : compromised: 0.4909, honest: 0.4939
Round 004: test acc mean=0.5016 ± 0.0045 | min=0.4941 max=0.5116
         : test loss mean=0.8820 ± 0.0079
         : individual accs = ['0.497400', '0.505234', '0.511636', '0.500528', '0.496207', '0.501426', '0.506971', '0.503698', '0.508395', '0.494121', '0.498815', '0.499231', '0.501672', '0.501462', '0.504050', '0.495102', '0.497533', '0.501929', '0.499895', '0.507188']
         : correct/total = [(7079, 14232), (7192, 14235), (7299, 14266), (7116, 14217), (7065, 14238), (7207, 14373), (7273, 14346), (7220, 14334), (7267, 14294), (7102, 14373), (7155, 14344), (7140, 14302), (7201, 14354), (7202, 14362), (7218, 14320), (7127, 14395), (7159, 14389), (7156, 14257), (7124, 14251), (7303, 14399)]
         : compromised: 0.5025, honest: 0.5002
Round 005: test acc mean=0.5164 ± 0.0038 | min=0.5109 max=0.5247
         : test loss mean=0.6963 ± 0.0008
         : individual accs = ['0.517847', '0.513593', '0.511776', '0.511782', '0.524652', '0.515411', '0.511850', '0.520162', '0.518259', '0.518055', '0.512828', '0.517200', '0.515814', '0.517268', '0.522207', '0.517332', '0.522343', '0.513432', '0.510912', '0.515522']
         : correct/total = [(7370, 14232), (7311, 14235), (7301, 14266), (7276, 14217), (7470, 14238), (7408, 14373), (7343, 14346), (7456, 14334), (7408, 14294), (7446, 14373), (7356, 14344), (7397, 14302), (7404, 14354), (7429, 14362), (7478, 14320), (7447, 14395), (7516, 14389), (7320, 14257), (7281, 14251), (7423, 14399)]
         : compromised: 0.5154, honest: 0.5179
Round 006: test acc mean=0.4928 ± 0.0046 | min=0.4820 max=0.5017
         : test loss mean=0.7352 ± 0.0034
         : individual accs = ['0.492693', '0.495539', '0.491658', '0.499754', '0.493960', '0.495165', '0.487801', '0.497837', '0.492724', '0.495652', '0.489752', '0.495175', '0.488017', '0.481966', '0.501746', '0.486002', '0.493988', '0.493512', '0.493229', '0.488992']
         : correct/total = [(7012, 14232), (7054, 14235), (7014, 14266), (7105, 14217), (7033, 14238), (7117, 14373), (6998, 14346), (7136, 14334), (7043, 14294), (7124, 14373), (7025, 14344), (7082, 14302), (7005, 14354), (6922, 14362), (7185, 14320), (6996, 14395), (7108, 14389), (7036, 14257), (7029, 14251), (7041, 14399)]
         : compromised: 0.4929, honest: 0.4926
Round 007: test acc mean=0.5069 ± 0.0063 | min=0.4923 max=0.5217
         : test loss mean=0.6930 ± 0.0006
         : individual accs = ['0.513491', '0.521742', '0.513739', '0.514455', '0.510184', '0.505114', '0.502370', '0.508511', '0.502938', '0.507827', '0.502858', '0.508321', '0.499025', '0.492271', '0.507332', '0.506287', '0.511502', '0.503472', '0.504596', '0.501007']
         : correct/total = [(7308, 14232), (7427, 14235), (7329, 14266), (7314, 14217), (7264, 14238), (7260, 14373), (7207, 14346), (7289, 14334), (7189, 14294), (7299, 14373), (7213, 14344), (7270, 14302), (7163, 14354), (7070, 14362), (7265, 14320), (7288, 14395), (7360, 14389), (7178, 14257), (7191, 14251), (7214, 14399)]
         : compromised: 0.5066, honest: 0.5072
Round 008: test acc mean=0.4986 ± 0.0039 | min=0.4872 max=0.5034
         : test loss mean=0.7236 ± 0.0028
         : individual accs = ['0.503443', '0.496593', '0.497757', '0.490047', '0.500211', '0.499617', '0.499373', '0.502512', '0.501329', '0.500870', '0.499442', '0.497553', '0.498885', '0.498050', '0.487151', '0.502327', '0.499409', '0.502280', '0.497088', '0.498090']
         : correct/total = [(7165, 14232), (7069, 14235), (7101, 14266), (6967, 14217), (7122, 14238), (7181, 14373), (7164, 14346), (7203, 14334), (7166, 14294), (7199, 14373), (7164, 14344), (7116, 14302), (7161, 14354), (7153, 14362), (6976, 14320), (7231, 14395), (7186, 14389), (7161, 14257), (7084, 14251), (7172, 14399)]
         : compromised: 0.4974, honest: 0.5004
Round 009: test acc mean=0.5505 ± 0.0058 | min=0.5395 max=0.5593
         : test loss mean=0.6901 ± 0.0003
         : individual accs = ['0.555860', '0.539515', '0.541988', '0.551241', '0.546074', '0.548528', '0.551652', '0.547649', '0.542325', '0.549711', '0.551799', '0.559292', '0.557684', '0.558488', '0.553142', '0.559014', '0.552436', '0.542190', '0.551470', '0.550455']
         : correct/total = [(7911, 14232), (7680, 14235), (7732, 14266), (7837, 14217), (7775, 14238), (7884, 14373), (7914, 14346), (7850, 14334), (7752, 14294), (7901, 14373), (7915, 14344), (7999, 14302), (8005, 14354), (8021, 14362), (7921, 14320), (8047, 14395), (7949, 14389), (7730, 14257), (7859, 14251), (7926, 14399)]
         : compromised: 0.5504, honest: 0.5507
Round 010: test acc mean=0.5159 ± 0.0044 | min=0.5073 max=0.5241
         : test loss mean=0.7060 ± 0.0018
         : individual accs = ['0.521360', '0.522866', '0.513809', '0.519308', '0.511448', '0.515828', '0.522166', '0.514581', '0.514272', '0.511375', '0.516732', '0.507342', '0.524105', '0.512672', '0.513059', '0.518513', '0.517131', '0.509715', '0.515332', '0.515869']
         : correct/total = [(7420, 14232), (7443, 14235), (7330, 14266), (7383, 14217), (7282, 14238), (7414, 14373), (7491, 14346), (7376, 14334), (7351, 14294), (7350, 14373), (7412, 14344), (7256, 14302), (7523, 14354), (7363, 14362), (7347, 14320), (7464, 14395), (7441, 14389), (7267, 14257), (7344, 14251), (7428, 14399)]
         : compromised: 0.5156, honest: 0.5163

=== FINAL RESULTS ===
Dataset: sent140, Nodes: 20, Graph: fully, Aggregation: krum
Attack: directed_deviation, 60.0% compromised
Final accuracy - Compromised: 0.5156, Honest: 0.5163
Overall test accuracy: mean=0.5159 ± 0.0044
