Device: cuda
Seed: 987654321
Loading 1 LEAF Sent140 train files...
LEAF Sent140 train: 254555 users, 908652 samples
Building vocabulary (max_size=10000)...
Vocabulary size: 10000
Loading 1 LEAF Sent140 test files...
LEAF Sent140 test: 254555 users, 286281 samples
Found 254555 train users, 254555 test users, 254555 common users
User sample counts range: 494 (max) to 1 (min)
Distributed ALL 254555 users across 20 clients
Users per client: 12727 (with 15 clients getting +1 user)
Train partition sizes: [44353, 44290, 44657, 44907, 44696, 45843, 45801, 45619, 45069, 45639, 45821, 45311, 45779, 46056, 45625, 45984, 46428, 44737, 45540, 46497]
Test partition sizes: [14232, 14235, 14266, 14217, 14238, 14373, 14346, 14334, 14294, 14373, 14344, 14302, 14354, 14362, 14320, 14395, 14389, 14257, 14251, 14399]
  Client 0: 44353 train samples, 2 unique classes
  Client 1: 44290 train samples, 2 unique classes
  Client 2: 44657 train samples, 2 unique classes
  Client 3: 44907 train samples, 2 unique classes
  Client 4: 44696 train samples, 2 unique classes
  Client 5: 45843 train samples, 2 unique classes
  Client 6: 45801 train samples, 2 unique classes
  Client 7: 45619 train samples, 2 unique classes
  Client 8: 45069 train samples, 2 unique classes
  Client 9: 45639 train samples, 2 unique classes
  Client 10: 45821 train samples, 2 unique classes
  Client 11: 45311 train samples, 2 unique classes
  Client 12: 45779 train samples, 2 unique classes
  Client 13: 46056 train samples, 2 unique classes
  Client 14: 45625 train samples, 2 unique classes
  Client 15: 45984 train samples, 2 unique classes
  Client 16: 46428 train samples, 2 unique classes
  Client 17: 44737 train samples, 2 unique classes
  Client 18: 45540 train samples, 2 unique classes
  Client 19: 46497 train samples, 2 unique classes
Will sample 4500 samples per client per epoch
Graph: fully, nodes: 20, edges: 190
Degree statistics: avg=19.00, min=19, max=19
Attack: Compromised 6/20 nodes: [5, 12, 13, 14, 17, 18]
Attack type: krum, lambda: 1.0
Model variant: baseline
Model parameters: 1,174,986
Sketchguard Node 0:
  Model dim: 1,174,986 → Sketch size: 180
  Compression ratio: 6527.7x
  Using model parameters for aggregation, sketches for filtering
Sketchguard Node 1:
  Model dim: 1,174,986 → Sketch size: 180
  Compression ratio: 6527.7x
  Using model parameters for aggregation, sketches for filtering
Sketchguard Node 2:
  Model dim: 1,174,986 → Sketch size: 180
  Compression ratio: 6527.7x
  Using model parameters for aggregation, sketches for filtering
Sketchguard Node 3:
  Model dim: 1,174,986 → Sketch size: 180
  Compression ratio: 6527.7x
  Using model parameters for aggregation, sketches for filtering
Sketchguard Node 4:
  Model dim: 1,174,986 → Sketch size: 180
  Compression ratio: 6527.7x
  Using model parameters for aggregation, sketches for filtering
Sketchguard Node 5:
  Model dim: 1,174,986 → Sketch size: 180
  Compression ratio: 6527.7x
  Using model parameters for aggregation, sketches for filtering
Sketchguard Node 6:
  Model dim: 1,174,986 → Sketch size: 180
  Compression ratio: 6527.7x
  Using model parameters for aggregation, sketches for filtering
Sketchguard Node 7:
  Model dim: 1,174,986 → Sketch size: 180
  Compression ratio: 6527.7x
  Using model parameters for aggregation, sketches for filtering
Sketchguard Node 8:
  Model dim: 1,174,986 → Sketch size: 180
  Compression ratio: 6527.7x
  Using model parameters for aggregation, sketches for filtering
Sketchguard Node 9:
  Model dim: 1,174,986 → Sketch size: 180
  Compression ratio: 6527.7x
  Using model parameters for aggregation, sketches for filtering
Sketchguard Node 10:
  Model dim: 1,174,986 → Sketch size: 180
  Compression ratio: 6527.7x
  Using model parameters for aggregation, sketches for filtering
Sketchguard Node 11:
  Model dim: 1,174,986 → Sketch size: 180
  Compression ratio: 6527.7x
  Using model parameters for aggregation, sketches for filtering
Sketchguard Node 12:
  Model dim: 1,174,986 → Sketch size: 180
  Compression ratio: 6527.7x
  Using model parameters for aggregation, sketches for filtering
Sketchguard Node 13:
  Model dim: 1,174,986 → Sketch size: 180
  Compression ratio: 6527.7x
  Using model parameters for aggregation, sketches for filtering
Sketchguard Node 14:
  Model dim: 1,174,986 → Sketch size: 180
  Compression ratio: 6527.7x
  Using model parameters for aggregation, sketches for filtering
Sketchguard Node 15:
  Model dim: 1,174,986 → Sketch size: 180
  Compression ratio: 6527.7x
  Using model parameters for aggregation, sketches for filtering
Sketchguard Node 16:
  Model dim: 1,174,986 → Sketch size: 180
  Compression ratio: 6527.7x
  Using model parameters for aggregation, sketches for filtering
Sketchguard Node 17:
  Model dim: 1,174,986 → Sketch size: 180
  Compression ratio: 6527.7x
  Using model parameters for aggregation, sketches for filtering
Sketchguard Node 18:
  Model dim: 1,174,986 → Sketch size: 180
  Compression ratio: 6527.7x
  Using model parameters for aggregation, sketches for filtering
Sketchguard Node 19:
  Model dim: 1,174,986 → Sketch size: 180
  Compression ratio: 6527.7x
  Using model parameters for aggregation, sketches for filtering
Sketchguard ALGORITHM (Sketch-based Filtering + State Aggregation)
  - Model dimension: 1,174,986 parameters
  - Config: SketchguardConfig(gamma=2, kappa=1, alpha=0.5, min_neighbors=1, sketch_size=180, network_seed=987654321, attack_detection_window=5)
  - Sketch size: 180
  - Compression ratio: 6527.7x
  - Complexity: O(d + N×k) = O(1,174,986 + 20×180)
  - Theoretical speedup vs BALANCE: 19.9x
Initial test acc across nodes: mean=0.4965 ± 0.0152
Round 001: test acc mean=0.4963 ± 0.0145 | min=0.4635 max=0.5305
         : test loss mean=0.7005 ± 0.0112
         : individual accs = ['0.489109', '0.499543', '0.485560', '0.501020', '0.470782', '0.493286', '0.463544', '0.509837', '0.500490', '0.530509', '0.492750', '0.497413', '0.500139', '0.500627', '0.497835', '0.518374', '0.501633', '0.502630', '0.491053', '0.479478']
         : correct/total = [(6961, 14232), (7111, 14235), (6927, 14266), (7123, 14217), (6703, 14238), (7090, 14373), (6650, 14346), (7308, 14334), (7154, 14294), (7625, 14373), (7068, 14344), (7114, 14302), (7179, 14354), (7190, 14362), (7129, 14320), (7462, 14395), (7218, 14389), (7166, 14257), (6998, 14251), (6904, 14399)]
         : compromised: 0.4976, honest: 0.4957
         : sketchguard stats = ['Node 0: acc_rate=1.000', 'Node 1: acc_rate=1.000', 'Node 2: acc_rate=1.000']...
Round 002: test acc mean=0.5339 ± 0.0227 | min=0.5014 max=0.5824
         : test loss mean=0.6896 ± 0.0021
         : individual accs = ['0.548693', '0.542536', '0.539324', '0.548780', '0.531606', '0.514298', '0.522933', '0.570741', '0.502728', '0.582411', '0.517359', '0.521186', '0.562213', '0.523674', '0.502723', '0.516429', '0.546737', '0.558603', '0.524595', '0.501424']
         : correct/total = [(7809, 14232), (7723, 14235), (7694, 14266), (7802, 14217), (7569, 14238), (7392, 14373), (7502, 14346), (8181, 14334), (7186, 14294), (8371, 14373), (7421, 14344), (7454, 14302), (8070, 14354), (7521, 14362), (7199, 14320), (7434, 14395), (7867, 14389), (7964, 14257), (7476, 14251), (7220, 14399)]
         : compromised: 0.5310, honest: 0.5352
         : sketchguard stats = ['Node 0: acc_rate=0.842', 'Node 1: acc_rate=0.842', 'Node 2: acc_rate=0.842']...
Round 003: test acc mean=0.5504 ± 0.0254 | min=0.4979 max=0.5912
         : test loss mean=0.6857 ± 0.0032
         : individual accs = ['0.554033', '0.555743', '0.566031', '0.568052', '0.587793', '0.497878', '0.565314', '0.573531', '0.534630', '0.591247', '0.528932', '0.532723', '0.571896', '0.531820', '0.527723', '0.531851', '0.548405', '0.581539', '0.505087', '0.553719']
         : correct/total = [(7885, 14232), (7911, 14235), (8075, 14266), (8076, 14217), (8369, 14238), (7156, 14373), (8110, 14346), (8221, 14334), (7642, 14294), (8498, 14373), (7587, 14344), (7619, 14302), (8209, 14354), (7638, 14362), (7557, 14320), (7656, 14395), (7891, 14389), (8291, 14257), (7198, 14251), (7973, 14399)]
         : compromised: 0.5360, honest: 0.5566
         : sketchguard stats = ['Node 0: acc_rate=0.789', 'Node 1: acc_rate=0.789', 'Node 2: acc_rate=0.789']...
Round 004: test acc mean=0.5944 ± 0.0052 | min=0.5817 max=0.6038
         : test loss mean=0.6733 ± 0.0033
         : individual accs = ['0.594646', '0.593678', '0.592738', '0.599916', '0.602472', '0.588186', '0.593127', '0.597809', '0.592836', '0.603841', '0.601297', '0.590267', '0.599066', '0.590517', '0.581704', '0.593400', '0.592605', '0.597110', '0.588731', '0.593652']
         : correct/total = [(8463, 14232), (8451, 14235), (8456, 14266), (8529, 14217), (8578, 14238), (8454, 14373), (8509, 14346), (8569, 14334), (8474, 14294), (8679, 14373), (8625, 14344), (8442, 14302), (8599, 14354), (8481, 14362), (8330, 14320), (8542, 14395), (8527, 14389), (8513, 14257), (8390, 14251), (8548, 14399)]
         : compromised: 0.5909, honest: 0.5959
         : sketchguard stats = ['Node 0: acc_rate=0.763', 'Node 1: acc_rate=0.763', 'Node 2: acc_rate=0.763']...
Round 005: test acc mean=0.6085 ± 0.0045 | min=0.5989 max=0.6175
         : test loss mean=0.6600 ± 0.0024
         : individual accs = ['0.606942', '0.610959', '0.607178', '0.611170', '0.614342', '0.614207', '0.609508', '0.609809', '0.601371', '0.610868', '0.613009', '0.605160', '0.617528', '0.604651', '0.598883', '0.609656', '0.603586', '0.608192', '0.603958', '0.609834']
         : correct/total = [(8638, 14232), (8697, 14235), (8662, 14266), (8689, 14217), (8747, 14238), (8828, 14373), (8744, 14346), (8741, 14334), (8596, 14294), (8780, 14373), (8793, 14344), (8655, 14302), (8864, 14354), (8684, 14362), (8576, 14320), (8776, 14395), (8685, 14389), (8671, 14257), (8607, 14251), (8781, 14399)]
         : compromised: 0.6079, honest: 0.6088
         : sketchguard stats = ['Node 0: acc_rate=0.747', 'Node 1: acc_rate=0.747', 'Node 2: acc_rate=0.747']...
Round 006: test acc mean=0.6180 ± 0.0044 | min=0.6039 max=0.6265
         : test loss mean=0.6517 ± 0.0023
         : individual accs = ['0.615514', '0.621215', '0.619375', '0.618907', '0.618696', '0.623739', '0.619058', '0.613646', '0.618651', '0.620886', '0.618865', '0.619284', '0.626515', '0.613007', '0.615014', '0.618826', '0.603934', '0.617451', '0.617501', '0.619626']
         : correct/total = [(8760, 14232), (8843, 14235), (8836, 14266), (8799, 14217), (8809, 14238), (8965, 14373), (8881, 14346), (8796, 14334), (8843, 14294), (8924, 14373), (8877, 14344), (8857, 14302), (8993, 14354), (8804, 14362), (8807, 14320), (8908, 14395), (8690, 14389), (8803, 14257), (8800, 14251), (8922, 14399)]
         : compromised: 0.6189, honest: 0.6176
         : sketchguard stats = ['Node 0: acc_rate=0.737', 'Node 1: acc_rate=0.737', 'Node 2: acc_rate=0.737']...
Round 007: test acc mean=0.6244 ± 0.0041 | min=0.6185 max=0.6354
         : test loss mean=0.6466 ± 0.0022
         : individual accs = ['0.620011', '0.623253', '0.622950', '0.626926', '0.624105', '0.629862', '0.622543', '0.618460', '0.625157', '0.627774', '0.628277', '0.622990', '0.635363', '0.622963', '0.618575', '0.627926', '0.619154', '0.621589', '0.622974', '0.627474']
         : correct/total = [(8824, 14232), (8872, 14235), (8887, 14266), (8913, 14217), (8886, 14238), (9053, 14373), (8931, 14346), (8865, 14334), (8936, 14294), (9023, 14373), (9012, 14344), (8910, 14302), (9120, 14354), (8947, 14362), (8858, 14320), (9039, 14395), (8909, 14389), (8862, 14257), (8878, 14251), (9035, 14399)]
         : compromised: 0.6252, honest: 0.6241
         : sketchguard stats = ['Node 0: acc_rate=0.729', 'Node 1: acc_rate=0.729', 'Node 2: acc_rate=0.729']...
Round 008: test acc mean=0.6273 ± 0.0054 | min=0.6173 max=0.6416
         : test loss mean=0.6438 ± 0.0034
         : individual accs = ['0.624719', '0.630067', '0.628137', '0.632623', '0.621155', '0.628192', '0.625540', '0.621948', '0.626836', '0.628192', '0.628695', '0.617256', '0.641633', '0.627907', '0.620601', '0.636610', '0.623601', '0.625167', '0.625851', '0.631502']
         : correct/total = [(8891, 14232), (8969, 14235), (8961, 14266), (8994, 14217), (8844, 14238), (9029, 14373), (8974, 14346), (8915, 14334), (8960, 14294), (9029, 14373), (9018, 14344), (8828, 14302), (9210, 14354), (9018, 14362), (8887, 14320), (9164, 14395), (8973, 14389), (8913, 14257), (8919, 14251), (9093, 14399)]
         : compromised: 0.6282, honest: 0.6269
         : sketchguard stats = ['Node 0: acc_rate=0.724', 'Node 1: acc_rate=0.724', 'Node 2: acc_rate=0.724']...
Round 009: test acc mean=0.6313 ± 0.0062 | min=0.6143 max=0.6418
         : test loss mean=0.6406 ± 0.0043
         : individual accs = ['0.628513', '0.635054', '0.631361', '0.624112', '0.630707', '0.640507', '0.628886', '0.625227', '0.632083', '0.628540', '0.634900', '0.634177', '0.640100', '0.630553', '0.614316', '0.641820', '0.625547', '0.630006', '0.634482', '0.634975']
         : correct/total = [(8945, 14232), (9040, 14235), (9007, 14266), (8873, 14217), (8980, 14238), (9206, 14373), (9022, 14346), (8962, 14334), (9035, 14294), (9034, 14373), (9107, 14344), (9070, 14302), (9188, 14354), (9056, 14362), (8797, 14320), (9239, 14395), (9001, 14389), (8982, 14257), (9042, 14251), (9143, 14399)]
         : compromised: 0.6317, honest: 0.6311
         : sketchguard stats = ['Node 0: acc_rate=0.719', 'Node 1: acc_rate=0.719', 'Node 2: acc_rate=0.719']...
Round 010: test acc mean=0.6378 ± 0.0041 | min=0.6317 max=0.6477
         : test loss mean=0.6352 ± 0.0027
         : individual accs = ['0.635118', '0.641026', '0.637950', '0.640290', '0.631690', '0.641341', '0.634253', '0.633250', '0.638799', '0.640646', '0.639361', '0.634177', '0.647694', '0.633199', '0.636732', '0.644113', '0.632428', '0.634074', '0.639183', '0.639697']
         : correct/total = [(9039, 14232), (9125, 14235), (9101, 14266), (9103, 14217), (8994, 14238), (9218, 14373), (9099, 14346), (9077, 14334), (9131, 14294), (9208, 14373), (9171, 14344), (9070, 14302), (9297, 14354), (9094, 14362), (9118, 14320), (9272, 14395), (9100, 14389), (9040, 14257), (9109, 14251), (9211, 14399)]
         : compromised: 0.6387, honest: 0.6373
         : sketchguard stats = ['Node 0: acc_rate=0.716', 'Node 1: acc_rate=0.716', 'Node 2: acc_rate=0.716']...

=== FINAL RESULTS ===
Dataset: sent140, Nodes: 20, Graph: fully, Aggregation: sketchguard
Attack: krum, 30.0% compromised
Final accuracy - Compromised: 0.6387, Honest: 0.6373
Overall test accuracy: mean=0.6378 ± 0.0041

=== Sketchguard SUMMARY ===
Node 0: acceptance=0.716
Node 1: acceptance=0.716
Node 2: acceptance=0.716
Node 3: acceptance=0.716
Node 4: acceptance=0.716
Node 5: acceptance=0.763
Node 6: acceptance=0.716
Node 7: acceptance=0.716
Node 8: acceptance=0.716
Node 9: acceptance=0.716
Node 10: acceptance=0.716
Node 11: acceptance=0.716
Node 12: acceptance=0.763
Node 13: acceptance=0.763
Node 14: acceptance=0.763
Node 15: acceptance=0.716
Node 16: acceptance=0.716
Node 17: acceptance=0.763
Node 18: acceptance=0.763
Node 19: acceptance=0.716

=== PARALLEL EXECUTION TIME (realistic for distributed system) ===
  COMMUNICATION (max across nodes):
    - Sketch transfer: 0.000s (0.0%)
    - Model fetch (accepted): 0.000s (0.0%)
  COMPUTATION (max across nodes):
    - Sketching: 0.590s (95.0%)
    - Filtering: 0.001s (0.2%)
    - Aggregation: 0.030s (4.8%)
  TOTALS:
    - Total computation: 0.621s (100.0%)
    - Total communication: 0.000s (0.0%)
    - Total parallel time: 0.621s

=== PER-NODE AVERAGE TIME ===
  - Sketching: 0.514s
  - Filtering: 0.001s
  - Aggregation: 0.024s
  - Sketch transfer: 0.000s
  - Model fetch: 0.000s
  - Total per node: 0.539s

=== TOTAL COMPUTATIONAL WORK (sum across all nodes) ===
  - Total sketching: 10.284s
  - Total filtering: 0.016s
  - Total aggregation: 0.482s
  - Total sketch transfer: 0.000s
  - Total model fetch: 0.000s
  - Grand total: 10.782s
  - Mean acceptance rate: 0.730

Sketchguard Algorithm Properties:
  - Original dimension: 1,174,986
  - Sketch size: 180
  - Compression ratio: 19.9x
  - Single repetition: No repetitions needed
  - Theoretical complexity: O(d + N×k)
  - Approach: Sketch filtering + state aggregation
