Device: cuda
Seed: 987654321
Loading 1 LEAF Sent140 train files...
LEAF Sent140 train: 254555 users, 908652 samples
Building vocabulary (max_size=10000)...
Vocabulary size: 10000
Loading 1 LEAF Sent140 test files...
LEAF Sent140 test: 254555 users, 286281 samples
Found 254555 train users, 254555 test users, 254555 common users
User sample counts range: 494 (max) to 1 (min)
Distributed ALL 254555 users across 20 clients
Users per client: 12727 (with 15 clients getting +1 user)
Train partition sizes: [44353, 44290, 44657, 44907, 44696, 45843, 45801, 45619, 45069, 45639, 45821, 45311, 45779, 46056, 45625, 45984, 46428, 44737, 45540, 46497]
Test partition sizes: [14232, 14235, 14266, 14217, 14238, 14373, 14346, 14334, 14294, 14373, 14344, 14302, 14354, 14362, 14320, 14395, 14389, 14257, 14251, 14399]
  Client 0: 44353 train samples, 2 unique classes
  Client 1: 44290 train samples, 2 unique classes
  Client 2: 44657 train samples, 2 unique classes
  Client 3: 44907 train samples, 2 unique classes
  Client 4: 44696 train samples, 2 unique classes
  Client 5: 45843 train samples, 2 unique classes
  Client 6: 45801 train samples, 2 unique classes
  Client 7: 45619 train samples, 2 unique classes
  Client 8: 45069 train samples, 2 unique classes
  Client 9: 45639 train samples, 2 unique classes
  Client 10: 45821 train samples, 2 unique classes
  Client 11: 45311 train samples, 2 unique classes
  Client 12: 45779 train samples, 2 unique classes
  Client 13: 46056 train samples, 2 unique classes
  Client 14: 45625 train samples, 2 unique classes
  Client 15: 45984 train samples, 2 unique classes
  Client 16: 46428 train samples, 2 unique classes
  Client 17: 44737 train samples, 2 unique classes
  Client 18: 45540 train samples, 2 unique classes
  Client 19: 46497 train samples, 2 unique classes
Will sample 4500 samples per client per epoch
Graph: erdos, nodes: 20, edges: 99
Degree statistics: avg=9.90, min=7, max=14
Attack: Compromised 10/20 nodes: [1, 2, 5, 11, 12, 13, 14, 15, 17, 18]
Attack type: directed_deviation, lambda: 1.0
Model variant: baseline
Model parameters: 1,174,986
BALANCE algorithm:
Balance Config: BALANCEConfig(gamma=2, kappa=1, alpha=0.5, min_neighbors=1)
  - Model dimension: 1,174,986 parameters
  - Complexity: O(N×d) = O(20×1,174,986)
Initial test acc across nodes: mean=0.4965 ± 0.0152
Round 001: test acc mean=0.4980 ± 0.0081 | min=0.4814 max=0.5138
         : test loss mean=1.8299 ± 0.5453
         : individual accs = ['0.497962', '0.490692', '0.481354', '0.511219', '0.508358', '0.501635', '0.502161', '0.489814', '0.513782', '0.493564', '0.499024', '0.510558', '0.498258', '0.487745', '0.497765', '0.499965', '0.494475', '0.497300', '0.491895', '0.492951']
         : correct/total = [(7087, 14232), (6985, 14235), (6867, 14266), (7268, 14217), (7238, 14238), (7210, 14373), (7204, 14346), (7021, 14334), (7344, 14294), (7094, 14373), (7158, 14344), (7302, 14302), (7152, 14354), (7005, 14362), (7128, 14320), (7197, 14395), (7115, 14389), (7090, 14257), (7010, 14251), (7098, 14399)]
         : compromised: 0.4957, honest: 0.5003
Round 002: test acc mean=0.5073 ± 0.0126 | min=0.4818 max=0.5324
         : test loss mean=0.7466 ± 0.0448
         : individual accs = ['0.524452', '0.515139', '0.492149', '0.511430', '0.514187', '0.481806', '0.508853', '0.499651', '0.509654', '0.491964', '0.498118', '0.532443', '0.501393', '0.531402', '0.498603', '0.511219', '0.498575', '0.503612', '0.506771', '0.513994']
         : correct/total = [(7464, 14232), (7333, 14235), (7021, 14266), (7271, 14217), (7321, 14238), (6925, 14373), (7300, 14346), (7162, 14334), (7285, 14294), (7071, 14373), (7145, 14344), (7615, 14302), (7197, 14354), (7632, 14362), (7140, 14320), (7359, 14395), (7174, 14389), (7180, 14257), (7222, 14251), (7401, 14399)]
         : compromised: 0.5075, honest: 0.5071
Round 003: test acc mean=0.5117 ± 0.0130 | min=0.4913 max=0.5375
         : test loss mean=0.6996 ± 0.0063
         : individual accs = ['0.519815', '0.506498', '0.496705', '0.506647', '0.517207', '0.499965', '0.519657', '0.513604', '0.531272', '0.528560', '0.503555', '0.530625', '0.498537', '0.491296', '0.496508', '0.504828', '0.503023', '0.537490', '0.507964', '0.519758']
         : correct/total = [(7398, 14232), (7210, 14235), (7086, 14266), (7203, 14217), (7364, 14238), (7186, 14373), (7455, 14346), (7362, 14334), (7594, 14294), (7597, 14373), (7223, 14344), (7589, 14302), (7156, 14354), (7056, 14362), (7110, 14320), (7267, 14395), (7238, 14389), (7663, 14257), (7239, 14251), (7484, 14399)]
         : compromised: 0.5070, honest: 0.5163
Round 004: test acc mean=0.5246 ± 0.0219 | min=0.4803 max=0.5638
         : test loss mean=0.6921 ± 0.0057
         : individual accs = ['0.551574', '0.516825', '0.517104', '0.545263', '0.539472', '0.491338', '0.547051', '0.542277', '0.541276', '0.563765', '0.537019', '0.543840', '0.498537', '0.512324', '0.480307', '0.504411', '0.503371', '0.517220', '0.513578', '0.525314']
         : correct/total = [(7850, 14232), (7357, 14235), (7377, 14266), (7752, 14217), (7681, 14238), (7062, 14373), (7848, 14346), (7773, 14334), (7737, 14294), (8103, 14373), (7703, 14344), (7778, 14302), (7156, 14354), (7358, 14362), (6878, 14320), (7261, 14395), (7243, 14389), (7374, 14257), (7319, 14251), (7564, 14399)]
         : compromised: 0.5095, honest: 0.5396
Round 005: test acc mean=0.5647 ± 0.0160 | min=0.5350 max=0.5887
         : test loss mean=0.6824 ± 0.0044
         : individual accs = ['0.581506', '0.572111', '0.564980', '0.572202', '0.581051', '0.535935', '0.583647', '0.569764', '0.567301', '0.588673', '0.586378', '0.563348', '0.547374', '0.558070', '0.546369', '0.558875', '0.578706', '0.534965', '0.552803', '0.549135']
         : correct/total = [(8276, 14232), (8144, 14235), (8060, 14266), (8135, 14217), (8273, 14238), (7703, 14373), (8373, 14346), (8167, 14334), (8109, 14294), (8461, 14373), (8411, 14344), (8057, 14302), (7857, 14354), (8015, 14362), (7824, 14320), (8045, 14395), (8327, 14389), (7627, 14257), (7878, 14251), (7907, 14399)]
         : compromised: 0.5535, honest: 0.5758
Round 006: test acc mean=0.5898 ± 0.0093 | min=0.5713 max=0.6068
         : test loss mean=0.6717 ± 0.0038
         : individual accs = ['0.591414', '0.602178', '0.585027', '0.588732', '0.598047', '0.577054', '0.602677', '0.594810', '0.585350', '0.596953', '0.606804', '0.584394', '0.589383', '0.580560', '0.571299', '0.591108', '0.594968', '0.590517', '0.573083', '0.592124']
         : correct/total = [(8417, 14232), (8572, 14235), (8346, 14266), (8370, 14217), (8515, 14238), (8294, 14373), (8646, 14346), (8526, 14334), (8367, 14294), (8580, 14373), (8704, 14344), (8358, 14302), (8460, 14354), (8338, 14362), (8181, 14320), (8509, 14395), (8561, 14389), (8419, 14257), (8167, 14251), (8526, 14399)]
         : compromised: 0.5845, honest: 0.5952
Round 007: test acc mean=0.6036 ± 0.0061 | min=0.5881 max=0.6137
         : test loss mean=0.6623 ± 0.0028
         : individual accs = ['0.605326', '0.606884', '0.593509', '0.605894', '0.609074', '0.597509', '0.606720', '0.608832', '0.596054', '0.609337', '0.613706', '0.595791', '0.604640', '0.605347', '0.604190', '0.604654', '0.605740', '0.607491', '0.588099', '0.603167']
         : correct/total = [(8615, 14232), (8639, 14235), (8467, 14266), (8614, 14217), (8672, 14238), (8588, 14373), (8704, 14346), (8727, 14334), (8520, 14294), (8758, 14373), (8803, 14344), (8521, 14302), (8679, 14354), (8694, 14362), (8652, 14320), (8704, 14395), (8716, 14389), (8661, 14257), (8381, 14251), (8685, 14399)]
         : compromised: 0.6008, honest: 0.6064
Round 008: test acc mean=0.6108 ± 0.0054 | min=0.6025 max=0.6238
         : test loss mean=0.6563 ± 0.0026
         : individual accs = ['0.609542', '0.617141', '0.603112', '0.612365', '0.608091', '0.603423', '0.611669', '0.615460', '0.603820', '0.614138', '0.623815', '0.602503', '0.613279', '0.608481', '0.610405', '0.611949', '0.613038', '0.617521', '0.605431', '0.610806']
         : correct/total = [(8675, 14232), (8785, 14235), (8604, 14266), (8706, 14217), (8658, 14238), (8673, 14373), (8775, 14346), (8822, 14334), (8631, 14294), (8827, 14373), (8948, 14344), (8617, 14302), (8803, 14354), (8739, 14362), (8741, 14320), (8809, 14395), (8821, 14389), (8804, 14257), (8628, 14251), (8795, 14399)]
         : compromised: 0.6093, honest: 0.6123
Round 009: test acc mean=0.6187 ± 0.0042 | min=0.6130 max=0.6273
         : test loss mean=0.6510 ± 0.0021
         : individual accs = ['0.620222', '0.627327', '0.613417', '0.616445', '0.616589', '0.616225', '0.622613', '0.619855', '0.614594', '0.621582', '0.626743', '0.619494', '0.618295', '0.623451', '0.612989', '0.620424', '0.613385', '0.621589', '0.613220', '0.616223']
         : correct/total = [(8827, 14232), (8930, 14235), (8751, 14266), (8764, 14217), (8779, 14238), (8857, 14373), (8932, 14346), (8885, 14334), (8785, 14294), (8934, 14373), (8990, 14344), (8860, 14302), (8875, 14354), (8954, 14362), (8778, 14320), (8931, 14395), (8826, 14389), (8862, 14257), (8739, 14251), (8873, 14399)]
         : compromised: 0.6186, honest: 0.6188
Round 010: test acc mean=0.6257 ± 0.0033 | min=0.6174 max=0.6313
         : test loss mean=0.6456 ± 0.0019
         : individual accs = ['0.624859', '0.631261', '0.617412', '0.626222', '0.623402', '0.623739', '0.624564', '0.629064', '0.624878', '0.630001', '0.630647', '0.622990', '0.630974', '0.626445', '0.623603', '0.625148', '0.623045', '0.626429', '0.623956', '0.625807']
         : correct/total = [(8893, 14232), (8986, 14235), (8808, 14266), (8903, 14217), (8876, 14238), (8965, 14373), (8960, 14346), (9017, 14334), (8932, 14294), (9055, 14373), (9046, 14344), (8910, 14302), (9057, 14354), (8997, 14362), (8930, 14320), (8999, 14395), (8965, 14389), (8931, 14257), (8892, 14251), (9011, 14399)]
         : compromised: 0.6252, honest: 0.6262

=== FINAL RESULTS ===
Dataset: sent140, Nodes: 20, Graph: erdos, Aggregation: balance
Attack: directed_deviation, 50.0% compromised
Final accuracy - Compromised: 0.6252, Honest: 0.6262
Overall test accuracy: mean=0.6257 ± 0.0033

=== BALANCE SUMMARY ===
Node 0: acceptance=0.550
Node 1: acceptance=0.550
Node 2: acceptance=0.550
Node 3: acceptance=0.614
Node 4: acceptance=0.400
Node 5: acceptance=0.550
Node 6: acceptance=0.475
Node 7: acceptance=0.427
Node 8: acceptance=0.357
Node 9: acceptance=0.673
Node 10: acceptance=0.662
Node 11: acceptance=0.475
Node 12: acceptance=0.625
Node 13: acceptance=0.600
Node 14: acceptance=0.486
Node 15: acceptance=0.500
Node 16: acceptance=0.357
Node 17: acceptance=0.662
Node 18: acceptance=0.550
Node 19: acceptance=0.460

=== PARALLEL EXECUTION TIME (realistic for distributed system) ===
  COMMUNICATION (max across nodes):
    - Full model transfer: 0.000s (0.0%)
  COMPUTATION (max across nodes):
    - Filtering: 0.057s (78.9%)
    - Aggregation: 0.015s (21.1%)
  TOTALS:
    - Total computation: 0.072s (100.0%)
    - Total communication: 0.000s (0.0%)
    - Total parallel time: 0.072s

=== PER-NODE AVERAGE TIME ===
  - Filtering: 0.043s
  - Aggregation: 0.007s
  - Model transfer: 0.000s
  - Total per node: 0.051s

=== TOTAL COMPUTATIONAL WORK (sum across all nodes) ===
  - Total filtering: 0.868s
  - Total aggregation: 0.143s
  - Total model transfer: 0.000s
  - Grand total: 1.012s
  - Mean acceptance rate: 0.526

BALANCE Algorithm Properties:
  - Model dimension: 1,174,986
  - No compression: Full parameter comparison
  - Theoretical complexity: O(deg(i)×d)
  - Approach: Full parameter filtering + averaging
