Device: cuda
Seed: 987654321
Loading 1 LEAF Sent140 train files...
LEAF Sent140 train: 254555 users, 908652 samples
Building vocabulary (max_size=10000)...
Vocabulary size: 10000
Loading 1 LEAF Sent140 test files...
LEAF Sent140 test: 254555 users, 286281 samples
Found 254555 train users, 254555 test users, 254555 common users
User sample counts range: 494 (max) to 1 (min)
Distributed ALL 254555 users across 20 clients
Users per client: 12727 (with 15 clients getting +1 user)
Train partition sizes: [44353, 44290, 44657, 44907, 44696, 45843, 45801, 45619, 45069, 45639, 45821, 45311, 45779, 46056, 45625, 45984, 46428, 44737, 45540, 46497]
Test partition sizes: [14232, 14235, 14266, 14217, 14238, 14373, 14346, 14334, 14294, 14373, 14344, 14302, 14354, 14362, 14320, 14395, 14389, 14257, 14251, 14399]
  Client 0: 44353 train samples, 2 unique classes
  Client 1: 44290 train samples, 2 unique classes
  Client 2: 44657 train samples, 2 unique classes
  Client 3: 44907 train samples, 2 unique classes
  Client 4: 44696 train samples, 2 unique classes
  Client 5: 45843 train samples, 2 unique classes
  Client 6: 45801 train samples, 2 unique classes
  Client 7: 45619 train samples, 2 unique classes
  Client 8: 45069 train samples, 2 unique classes
  Client 9: 45639 train samples, 2 unique classes
  Client 10: 45821 train samples, 2 unique classes
  Client 11: 45311 train samples, 2 unique classes
  Client 12: 45779 train samples, 2 unique classes
  Client 13: 46056 train samples, 2 unique classes
  Client 14: 45625 train samples, 2 unique classes
  Client 15: 45984 train samples, 2 unique classes
  Client 16: 46428 train samples, 2 unique classes
  Client 17: 44737 train samples, 2 unique classes
  Client 18: 45540 train samples, 2 unique classes
  Client 19: 46497 train samples, 2 unique classes
Will sample 4500 samples per client per epoch
Graph: ring, nodes: 20, edges: 20
Degree statistics: avg=2.00, min=2, max=2
Attack: Compromised 4/20 nodes: [5, 12, 13, 17]
Attack type: gaussian, lambda: 1.0
Model variant: baseline
Model parameters: 1,174,986
BALANCE algorithm:
Balance Config: BALANCEConfig(gamma=2, kappa=1, alpha=0.5, min_neighbors=1)
  - Model dimension: 1,174,986 parameters
  - Complexity: O(N×d) = O(20×1,174,986)
Initial test acc across nodes: mean=0.4965 ± 0.0152
Round 001: test acc mean=0.5293 ± 0.0184 | min=0.4980 max=0.5627
         : test loss mean=0.6917 ± 0.0012
         : individual accs = ['0.511031', '0.553495', '0.515211', '0.554407', '0.517980', '0.509288', '0.562666', '0.526441', '0.518679', '0.540110', '0.498048', '0.533562', '0.505713', '0.549993', '0.524860', '0.540396', '0.513239', '0.521218', '0.533226', '0.555941']
         : correct/total = [(7273, 14232), (7879, 14235), (7350, 14266), (7882, 14217), (7375, 14238), (7320, 14373), (8072, 14346), (7546, 14334), (7414, 14294), (7763, 14373), (7144, 14344), (7631, 14302), (7259, 14354), (7899, 14362), (7516, 14320), (7779, 14395), (7385, 14389), (7431, 14257), (7599, 14251), (8005, 14399)]
         : compromised: 0.5216, honest: 0.5312
Round 002: test acc mean=0.5307 ± 0.0332 | min=0.4873 max=0.6059
         : test loss mean=0.6894 ± 0.0035
         : individual accs = ['0.491849', '0.507903', '0.487312', '0.503271', '0.525284', '0.493843', '0.605883', '0.554765', '0.488737', '0.498852', '0.536182', '0.570480', '0.588756', '0.548531', '0.529958', '0.529073', '0.534992', '0.508312', '0.559891', '0.549830']
         : correct/total = [(7000, 14232), (7230, 14235), (6952, 14266), (7155, 14217), (7479, 14238), (7098, 14373), (8692, 14346), (7952, 14334), (6986, 14294), (7170, 14373), (7691, 14344), (8159, 14302), (8451, 14354), (7878, 14362), (7589, 14320), (7616, 14395), (7698, 14389), (7247, 14257), (7979, 14251), (7917, 14399)]
         : compromised: 0.5349, honest: 0.5296
Round 003: test acc mean=0.5402 ± 0.0407 | min=0.4860 max=0.6083
         : test loss mean=0.6869 ± 0.0057
         : individual accs = ['0.489390', '0.486266', '0.485981', '0.528241', '0.566021', '0.493843', '0.606511', '0.562648', '0.488597', '0.493634', '0.525237', '0.555587', '0.608263', '0.570951', '0.566690', '0.560125', '0.550003', '0.503191', '0.588520', '0.574137']
         : correct/total = [(6965, 14232), (6922, 14235), (6933, 14266), (7510, 14217), (8059, 14238), (7098, 14373), (8701, 14346), (8065, 14334), (6984, 14294), (7095, 14373), (7534, 14344), (7946, 14302), (8731, 14354), (8200, 14362), (8115, 14320), (8063, 14395), (7914, 14389), (7174, 14257), (8387, 14251), (8267, 14399)]
         : compromised: 0.5441, honest: 0.5392
Round 004: test acc mean=0.5581 ± 0.0461 | min=0.4872 max=0.6137
         : test loss mean=0.6832 ± 0.0083
         : individual accs = ['0.505902', '0.487179', '0.494743', '0.561370', '0.580208', '0.493843', '0.605116', '0.583438', '0.489646', '0.494190', '0.555912', '0.581317', '0.610422', '0.599429', '0.591061', '0.592497', '0.588505', '0.527951', '0.605922', '0.613723']
         : correct/total = [(7200, 14232), (6935, 14235), (7058, 14266), (7981, 14217), (8261, 14238), (7098, 14373), (8681, 14346), (8363, 14334), (6999, 14294), (7103, 14373), (7974, 14344), (8314, 14302), (8762, 14354), (8609, 14362), (8464, 14320), (8529, 14395), (8468, 14389), (7527, 14257), (8635, 14251), (8837, 14399)]
         : compromised: 0.5579, honest: 0.5582
Round 005: test acc mean=0.5641 ± 0.0503 | min=0.4863 max=0.6224
         : test loss mean=0.6795 ± 0.0112
         : individual accs = ['0.506535', '0.486266', '0.488574', '0.572484', '0.590884', '0.493843', '0.622403', '0.616925', '0.494193', '0.493912', '0.558840', '0.580758', '0.609935', '0.612171', '0.598883', '0.602084', '0.600737', '0.533773', '0.607396', '0.611779']
         : correct/total = [(7209, 14232), (6922, 14235), (6970, 14266), (8139, 14217), (8413, 14238), (7098, 14373), (8929, 14346), (8843, 14334), (7064, 14294), (7099, 14373), (8016, 14344), (8306, 14302), (8755, 14354), (8792, 14362), (8576, 14320), (8667, 14395), (8644, 14389), (7610, 14257), (8656, 14251), (8809, 14399)]
         : compromised: 0.5624, honest: 0.5645
Round 006: test acc mean=0.5755 ± 0.0465 | min=0.4863 max=0.6224
         : test loss mean=0.6757 ± 0.0133
         : individual accs = ['0.523609', '0.486266', '0.505117', '0.584441', '0.595730', '0.493843', '0.622403', '0.619576', '0.525675', '0.509845', '0.603876', '0.602363', '0.610771', '0.615792', '0.602025', '0.605488', '0.605254', '0.573683', '0.611536', '0.611848']
         : correct/total = [(7452, 14232), (6922, 14235), (7206, 14266), (8309, 14217), (8482, 14238), (7098, 14373), (8929, 14346), (8881, 14334), (7514, 14294), (7328, 14373), (8662, 14344), (8615, 14302), (8767, 14354), (8844, 14362), (8621, 14320), (8716, 14395), (8709, 14389), (8179, 14257), (8715, 14251), (8810, 14399)]
         : compromised: 0.5735, honest: 0.5759
Round 007: test acc mean=0.5888 ± 0.0450 | min=0.4916 max=0.6228
         : test loss mean=0.6710 ± 0.0151
         : individual accs = ['0.601813', '0.491605', '0.530142', '0.599142', '0.606405', '0.493843', '0.622822', '0.619646', '0.534140', '0.516524', '0.607641', '0.606628', '0.617041', '0.620387', '0.616131', '0.620563', '0.617416', '0.614014', '0.617571', '0.622335']
         : correct/total = [(8565, 14232), (6998, 14235), (7563, 14266), (8518, 14217), (8634, 14238), (7098, 14373), (8935, 14346), (8882, 14334), (7635, 14294), (7424, 14373), (8716, 14344), (8676, 14302), (8857, 14354), (8910, 14362), (8823, 14320), (8933, 14395), (8884, 14389), (8754, 14257), (8801, 14251), (8961, 14399)]
         : compromised: 0.5863, honest: 0.5894
Round 008: test acc mean=0.6025 ± 0.0347 | min=0.4878 max=0.6300
         : test loss mean=0.6655 ± 0.0159
         : individual accs = ['0.586636', '0.487812', '0.541287', '0.609974', '0.612094', '0.581159', '0.630001', '0.625227', '0.584721', '0.575871', '0.612660', '0.611523', '0.621290', '0.628882', '0.624860', '0.629316', '0.622906', '0.616329', '0.621711', '0.625530']
         : correct/total = [(8349, 14232), (6944, 14235), (7722, 14266), (8672, 14217), (8715, 14238), (8353, 14373), (9038, 14346), (8962, 14334), (8358, 14294), (8277, 14373), (8788, 14344), (8746, 14302), (8918, 14354), (9032, 14362), (8948, 14320), (9059, 14395), (8963, 14389), (8787, 14257), (8860, 14251), (9007, 14399)]
         : compromised: 0.6119, honest: 0.6001
Round 009: test acc mean=0.6104 ± 0.0272 | min=0.5195 max=0.6347
         : test loss mean=0.6608 ± 0.0153
         : individual accs = ['0.605888', '0.519494', '0.587060', '0.612576', '0.615395', '0.615738', '0.630280', '0.629482', '0.580523', '0.568496', '0.611266', '0.612222', '0.623729', '0.632781', '0.625559', '0.634734', '0.629648', '0.619836', '0.623816', '0.628655']
         : correct/total = [(8623, 14232), (7395, 14235), (8375, 14266), (8709, 14217), (8762, 14238), (8850, 14373), (9042, 14346), (9023, 14334), (8298, 14294), (8171, 14373), (8768, 14344), (8756, 14302), (8953, 14354), (9088, 14362), (8958, 14320), (9137, 14395), (9060, 14389), (8837, 14257), (8890, 14251), (9052, 14399)]
         : compromised: 0.6230, honest: 0.6072
Round 010: test acc mean=0.6233 ± 0.0120 | min=0.5822 max=0.6420
         : test loss mean=0.6558 ± 0.0141
         : individual accs = ['0.618676', '0.582157', '0.610753', '0.617359', '0.617713', '0.624643', '0.633347', '0.630180', '0.619211', '0.620051', '0.619632', '0.619354', '0.629163', '0.635148', '0.632193', '0.642028', '0.631107', '0.624746', '0.626623', '0.632058']
         : correct/total = [(8805, 14232), (8287, 14235), (8713, 14266), (8777, 14217), (8795, 14238), (8978, 14373), (9086, 14346), (9033, 14334), (8851, 14294), (8912, 14373), (8888, 14344), (8858, 14302), (9031, 14354), (9122, 14362), (9053, 14320), (9242, 14395), (9081, 14389), (8907, 14257), (8930, 14251), (9101, 14399)]
         : compromised: 0.6284, honest: 0.6220

=== FINAL RESULTS ===
Dataset: sent140, Nodes: 20, Graph: ring, Aggregation: balance
Attack: gaussian, 20.0% compromised
Final accuracy - Compromised: 0.6284, Honest: 0.6220
Overall test accuracy: mean=0.6233 ± 0.0120

=== BALANCE SUMMARY ===
Node 0: acceptance=1.000
Node 1: acceptance=1.000
Node 2: acceptance=1.000
Node 3: acceptance=1.000
Node 4: acceptance=0.500
Node 5: acceptance=0.800
Node 6: acceptance=0.500
Node 7: acceptance=1.000
Node 8: acceptance=1.000
Node 9: acceptance=1.000
Node 10: acceptance=1.000
Node 11: acceptance=0.500
Node 12: acceptance=0.500
Node 13: acceptance=0.500
Node 14: acceptance=0.500
Node 15: acceptance=1.000
Node 16: acceptance=0.500
Node 17: acceptance=0.800
Node 18: acceptance=0.500
Node 19: acceptance=1.000

=== PARALLEL EXECUTION TIME (realistic for distributed system) ===
  COMMUNICATION (max across nodes):
    - Full model transfer: 0.000s (0.0%)
  COMPUTATION (max across nodes):
    - Filtering: 0.026s (68.0%)
    - Aggregation: 0.012s (32.0%)
  TOTALS:
    - Total computation: 0.038s (100.0%)
    - Total communication: 0.000s (0.0%)
    - Total parallel time: 0.038s

=== PER-NODE AVERAGE TIME ===
  - Filtering: 0.012s
  - Aggregation: 0.006s
  - Model transfer: 0.000s
  - Total per node: 0.018s

=== TOTAL COMPUTATIONAL WORK (sum across all nodes) ===
  - Total filtering: 0.245s
  - Total aggregation: 0.117s
  - Total model transfer: 0.000s
  - Grand total: 0.363s
  - Mean acceptance rate: 0.780

BALANCE Algorithm Properties:
  - Model dimension: 1,174,986
  - No compression: Full parameter comparison
  - Theoretical complexity: O(deg(i)×d)
  - Approach: Full parameter filtering + averaging
