Device: cuda
Seed: 987654321
Loading 1 LEAF Sent140 train files...
LEAF Sent140 train: 254555 users, 908652 samples
Building vocabulary (max_size=10000)...
Vocabulary size: 10000
Loading 1 LEAF Sent140 test files...
LEAF Sent140 test: 254555 users, 286281 samples
Found 254555 train users, 254555 test users, 254555 common users
User sample counts range: 494 (max) to 1 (min)
Distributed ALL 254555 users across 20 clients
Users per client: 12727 (with 15 clients getting +1 user)
Train partition sizes: [44353, 44290, 44657, 44907, 44696, 45843, 45801, 45619, 45069, 45639, 45821, 45311, 45779, 46056, 45625, 45984, 46428, 44737, 45540, 46497]
Test partition sizes: [14232, 14235, 14266, 14217, 14238, 14373, 14346, 14334, 14294, 14373, 14344, 14302, 14354, 14362, 14320, 14395, 14389, 14257, 14251, 14399]
  Client 0: 44353 train samples, 2 unique classes
  Client 1: 44290 train samples, 2 unique classes
  Client 2: 44657 train samples, 2 unique classes
  Client 3: 44907 train samples, 2 unique classes
  Client 4: 44696 train samples, 2 unique classes
  Client 5: 45843 train samples, 2 unique classes
  Client 6: 45801 train samples, 2 unique classes
  Client 7: 45619 train samples, 2 unique classes
  Client 8: 45069 train samples, 2 unique classes
  Client 9: 45639 train samples, 2 unique classes
  Client 10: 45821 train samples, 2 unique classes
  Client 11: 45311 train samples, 2 unique classes
  Client 12: 45779 train samples, 2 unique classes
  Client 13: 46056 train samples, 2 unique classes
  Client 14: 45625 train samples, 2 unique classes
  Client 15: 45984 train samples, 2 unique classes
  Client 16: 46428 train samples, 2 unique classes
  Client 17: 44737 train samples, 2 unique classes
  Client 18: 45540 train samples, 2 unique classes
  Client 19: 46497 train samples, 2 unique classes
Will sample 4500 samples per client per epoch
Graph: fully, nodes: 20, edges: 190
Degree statistics: avg=19.00, min=19, max=19
Attack: Compromised 16/20 nodes: [1, 2, 3, 5, 6, 8, 9, 10, 11, 12, 13, 14, 15, 17, 18, 19]
Attack type: gaussian, lambda: 1.0
Model variant: baseline
Model parameters: 1,174,986
UBAR ALGORITHM (Two-Stage Byzantine-resilient)
  - Model dimension: 1,174,986 parameters
  - Rho parameter: 0.19999999999999996
  - Stage 1: Distance-based filtering (select 20% closest neighbors)
  - Stage 2: Performance-based selection (loss comparison)
  - Complexity: O(deg(i)×d + deg(i)×inference)
Initial test acc across nodes: mean=0.4965 ± 0.0152
Round 001: test acc mean=0.5329 ± 0.0221 | min=0.4862 max=0.5761
         : test loss mean=0.6913 ± 0.0014
         : individual accs = ['0.544056', '0.550825', '0.532244', '0.515017', '0.525846', '0.549920', '0.518402', '0.576113', '0.501259', '0.526612', '0.517987', '0.552370', '0.572175', '0.525414', '0.519274', '0.509066', '0.546946', '0.486217', '0.545646', '0.542399']
         : correct/total = [(7743, 14232), (7841, 14235), (7593, 14266), (7322, 14217), (7487, 14238), (7904, 14373), (7437, 14346), (8258, 14334), (7165, 14294), (7569, 14373), (7430, 14344), (7900, 14302), (8213, 14354), (7546, 14362), (7436, 14320), (7328, 14395), (7870, 14389), (6932, 14257), (7776, 14251), (7810, 14399)]
         : compromised: 0.5291, honest: 0.5482
         : ubar stats = ['Node 0: s1=0.158, s2=0.333', 'Node 1: s1=0.158, s2=1.000', 'Node 2: s1=0.158, s2=0.333']...
Round 002: test acc mean=0.5420 ± 0.0385 | min=0.4882 max=0.5998
         : test loss mean=0.6907 ± 0.0026
         : individual accs = ['0.587830', '0.492167', '0.565751', '0.522403', '0.533713', '0.494260', '0.539454', '0.589787', '0.488247', '0.594726', '0.550544', '0.599776', '0.585969', '0.508564', '0.495880', '0.549218', '0.560915', '0.503051', '0.579398', '0.498090']
         : correct/total = [(8366, 14232), (7006, 14235), (8071, 14266), (7427, 14217), (7599, 14238), (7104, 14373), (7739, 14346), (8454, 14334), (6979, 14294), (8548, 14373), (7897, 14344), (8578, 14302), (8411, 14354), (7304, 14362), (7101, 14320), (7906, 14395), (8071, 14389), (7172, 14257), (8257, 14251), (7172, 14399)]
         : compromised: 0.5355, honest: 0.5681
         : ubar stats = ['Node 0: s1=0.158, s2=0.333', 'Node 1: s1=0.158, s2=0.833', 'Node 2: s1=0.158, s2=0.333']...
Round 003: test acc mean=0.5191 ± 0.0265 | min=0.4882 max=0.5889
         : test loss mean=0.6904 ± 0.0021
         : individual accs = ['0.527895', '0.489146', '0.533576', '0.495745', '0.526759', '0.493843', '0.498118', '0.549044', '0.488177', '0.519168', '0.499303', '0.547965', '0.588895', '0.508564', '0.495810', '0.523793', '0.540830', '0.503051', '0.554838', '0.496632']
         : correct/total = [(7513, 14232), (6963, 14235), (7612, 14266), (7048, 14217), (7500, 14238), (7098, 14373), (7146, 14346), (7870, 14334), (6978, 14294), (7462, 14373), (7162, 14344), (7837, 14302), (8453, 14354), (7304, 14362), (7100, 14320), (7540, 14395), (7782, 14389), (7172, 14257), (7907, 14251), (7151, 14399)]
         : compromised: 0.5148, honest: 0.5361
         : ubar stats = ['Node 0: s1=0.158, s2=0.333', 'Node 1: s1=0.158, s2=0.778', 'Node 2: s1=0.158, s2=0.333']...
Round 004: test acc mean=0.5453 ± 0.0284 | min=0.5111 max=0.5889
         : test loss mean=0.6880 ± 0.0021
         : individual accs = ['0.567032', '0.540850', '0.575634', '0.519378', '0.570094', '0.524177', '0.518263', '0.568648', '0.516091', '0.511932', '0.519799', '0.578940', '0.588895', '0.516502', '0.511103', '0.584578', '0.563278', '0.526548', '0.581924', '0.522258']
         : correct/total = [(8070, 14232), (7699, 14235), (8212, 14266), (7384, 14217), (8117, 14238), (7534, 14373), (7435, 14346), (8151, 14334), (7377, 14294), (7358, 14373), (7456, 14344), (8280, 14302), (8453, 14354), (7418, 14362), (7319, 14320), (8415, 14395), (8105, 14389), (7507, 14257), (8293, 14251), (7520, 14399)]
         : compromised: 0.5398, honest: 0.5673
         : ubar stats = ['Node 0: s1=0.158, s2=0.500', 'Node 1: s1=0.158, s2=0.750', 'Node 2: s1=0.158, s2=0.500']...
Round 005: test acc mean=0.5811 ± 0.0152 | min=0.5579 max=0.6073
         : test loss mean=0.6830 ± 0.0026
         : individual accs = ['0.590289', '0.573656', '0.575915', '0.576001', '0.601138', '0.572254', '0.557856', '0.603111', '0.572688', '0.564392', '0.562605', '0.587540', '0.607287', '0.585225', '0.561941', '0.599653', '0.600181', '0.568493', '0.592801', '0.569762']
         : correct/total = [(8401, 14232), (8166, 14235), (8216, 14266), (8189, 14217), (8559, 14238), (8225, 14373), (8003, 14346), (8645, 14334), (8186, 14294), (8112, 14373), (8070, 14344), (8403, 14302), (8717, 14354), (8405, 14362), (8047, 14320), (8632, 14395), (8636, 14389), (8105, 14257), (8448, 14251), (8204, 14399)]
         : compromised: 0.5768, honest: 0.5987
         : ubar stats = ['Node 0: s1=0.158, s2=0.600', 'Node 1: s1=0.158, s2=0.667', 'Node 2: s1=0.158, s2=0.533']...
Round 006: test acc mean=0.6003 ± 0.0059 | min=0.5836 max=0.6137
         : test loss mean=0.6736 ± 0.0026
         : individual accs = ['0.601953', '0.602248', '0.599818', '0.602026', '0.599733', '0.603284', '0.600307', '0.605065', '0.599832', '0.596953', '0.607223', '0.602573', '0.613697', '0.601448', '0.583589', '0.602640', '0.601571', '0.594375', '0.596309', '0.591430']
         : correct/total = [(8567, 14232), (8573, 14235), (8557, 14266), (8559, 14217), (8539, 14238), (8671, 14373), (8612, 14346), (8673, 14334), (8574, 14294), (8580, 14373), (8710, 14344), (8618, 14302), (8809, 14354), (8638, 14362), (8357, 14320), (8675, 14395), (8656, 14389), (8474, 14257), (8498, 14251), (8516, 14399)]
         : compromised: 0.5999, honest: 0.6021
         : ubar stats = ['Node 0: s1=0.158, s2=0.667', 'Node 1: s1=0.158, s2=0.611', 'Node 2: s1=0.158, s2=0.500']...
Round 007: test acc mean=0.6142 ± 0.0031 | min=0.6098 max=0.6208
         : test loss mean=0.6608 ± 0.0017
         : individual accs = ['0.620784', '0.610537', '0.612225', '0.619399', '0.618275', '0.610798', '0.613551', '0.612809', '0.614454', '0.614138', '0.616913', '0.609845', '0.617250', '0.617393', '0.611592', '0.612157', '0.613594', '0.613663', '0.610343', '0.614695']
         : correct/total = [(8835, 14232), (8691, 14235), (8734, 14266), (8806, 14217), (8803, 14238), (8779, 14373), (8802, 14346), (8784, 14334), (8783, 14294), (8827, 14373), (8849, 14344), (8722, 14302), (8860, 14354), (8867, 14362), (8758, 14320), (8812, 14395), (8829, 14389), (8749, 14257), (8698, 14251), (8851, 14399)]
         : compromised: 0.6137, honest: 0.6164
         : ubar stats = ['Node 0: s1=0.158, s2=0.619', 'Node 1: s1=0.158, s2=0.571', 'Node 2: s1=0.158, s2=0.571']...
Round 008: test acc mean=0.6200 ± 0.0036 | min=0.6109 max=0.6275
         : test loss mean=0.6528 ± 0.0018
         : individual accs = ['0.623806', '0.620724', '0.610893', '0.627488', '0.622489', '0.617964', '0.618639', '0.620971', '0.620400', '0.620956', '0.625349', '0.617536', '0.622823', '0.620039', '0.618575', '0.621396', '0.614636', '0.617591', '0.617922', '0.619349']
         : correct/total = [(8878, 14232), (8836, 14235), (8715, 14266), (8921, 14217), (8863, 14238), (8882, 14373), (8875, 14346), (8901, 14334), (8868, 14294), (8925, 14373), (8970, 14344), (8832, 14302), (8940, 14354), (8905, 14362), (8858, 14320), (8945, 14395), (8844, 14389), (8805, 14257), (8806, 14251), (8918, 14399)]
         : compromised: 0.6199, honest: 0.6205
         : ubar stats = ['Node 0: s1=0.158, s2=0.583', 'Node 1: s1=0.158, s2=0.542', 'Node 2: s1=0.158, s2=0.625']...
Round 009: test acc mean=0.6272 ± 0.0040 | min=0.6210 max=0.6354
         : test loss mean=0.6467 ± 0.0017
         : individual accs = ['0.635048', '0.631823', '0.627927', '0.635436', '0.629513', '0.623669', '0.628050', '0.627808', '0.622009', '0.627148', '0.626673', '0.623339', '0.628048', '0.630065', '0.622207', '0.631539', '0.621030', '0.625307', '0.623886', '0.624141']
         : correct/total = [(9038, 14232), (8994, 14235), (8958, 14266), (9034, 14217), (8963, 14238), (8964, 14373), (9010, 14346), (8999, 14334), (8891, 14294), (9014, 14373), (8989, 14344), (8915, 14302), (9015, 14354), (9049, 14362), (8910, 14320), (9091, 14395), (8936, 14389), (8915, 14257), (8891, 14251), (8987, 14399)]
         : compromised: 0.6270, honest: 0.6283
         : ubar stats = ['Node 0: s1=0.158, s2=0.630', 'Node 1: s1=0.158, s2=0.519', 'Node 2: s1=0.158, s2=0.593']...
Round 010: test acc mean=0.6335 ± 0.0034 | min=0.6291 max=0.6418
         : test loss mean=0.6418 ± 0.0017
         : individual accs = ['0.638702', '0.636740', '0.631011', '0.641837', '0.635834', '0.631044', '0.631326', '0.632622', '0.635022', '0.635775', '0.632599', '0.629143', '0.635781', '0.636959', '0.635196', '0.631817', '0.629300', '0.629515', '0.629570', '0.630947']
         : correct/total = [(9090, 14232), (9064, 14235), (9002, 14266), (9125, 14217), (9053, 14238), (9070, 14373), (9057, 14346), (9068, 14334), (9077, 14294), (9138, 14373), (9074, 14344), (8998, 14302), (9126, 14354), (9148, 14362), (9096, 14320), (9095, 14395), (9055, 14389), (8975, 14257), (8972, 14251), (9085, 14399)]
         : compromised: 0.6334, honest: 0.6341
         : ubar stats = ['Node 0: s1=0.158, s2=0.633', 'Node 1: s1=0.158, s2=0.533', 'Node 2: s1=0.158, s2=0.567']...

=== FINAL RESULTS ===
Dataset: sent140, Nodes: 20, Graph: fully, Aggregation: ubar
Attack: gaussian, 80.0% compromised
Final accuracy - Compromised: 0.6334, Honest: 0.6341
Overall test accuracy: mean=0.6335 ± 0.0034

=== UBAR SUMMARY ===
Node 0: stage1=0.158, stage2=0.633, overall=0.100
Node 1: stage1=0.158, stage2=0.533, overall=0.084
Node 2: stage1=0.158, stage2=0.567, overall=0.089
Node 3: stage1=0.158, stage2=0.733, overall=0.116
Node 4: stage1=0.158, stage2=0.733, overall=0.116
Node 5: stage1=0.158, stage2=0.800, overall=0.126
Node 6: stage1=0.158, stage2=0.500, overall=0.079
Node 7: stage1=0.158, stage2=0.667, overall=0.105
Node 8: stage1=0.158, stage2=0.867, overall=0.137
Node 9: stage1=0.158, stage2=0.667, overall=0.105
Node 10: stage1=0.158, stage2=0.667, overall=0.105
Node 11: stage1=0.158, stage2=0.467, overall=0.074
Node 12: stage1=0.158, stage2=0.433, overall=0.068
Node 13: stage1=0.158, stage2=0.900, overall=0.142
Node 14: stage1=0.158, stage2=0.900, overall=0.142
Node 15: stage1=0.158, stage2=0.433, overall=0.068
Node 16: stage1=0.158, stage2=0.700, overall=0.111
Node 17: stage1=0.158, stage2=0.867, overall=0.137
Node 18: stage1=0.158, stage2=0.500, overall=0.079
Node 19: stage1=0.158, stage2=0.933, overall=0.147

=== PARALLEL EXECUTION TIME (realistic for distributed system) ===
  COMMUNICATION (max across nodes):
    - Full model transfer: 0.000s (0.0%)
  COMPUTATION (max across nodes):
    - Distance computation: 0.085s (78.0%)
    - Loss computation: 0.018s (16.7%)
    - Aggregation: 0.006s (5.2%)
  TOTALS:
    - Total computation: 0.109s (100.0%)
    - Total communication: 0.000s (0.0%)
    - Total parallel time: 0.109s

=== PER-NODE AVERAGE TIME ===
  - Distance computation: 0.077s
  - Loss computation: 0.015s
  - Aggregation: 0.005s
  - Model transfer: 0.000s
  - Total per node: 0.096s

=== TOTAL COMPUTATIONAL WORK (sum across all nodes) ===
  - Total distance computation: 1.539s
  - Total loss computation: 0.292s
  - Total aggregation: 0.094s
  - Total model transfer: 0.000s
  - Grand total: 1.925s
  - Mean Stage 1 acceptance rate: 0.158
  - Mean Stage 2 acceptance rate: 0.675
  - Overall acceptance rate: 0.107

UBAR Algorithm Properties:
  - Model dimension: 1,174,986
  - Rho parameter: 0.19999999999999996
  - Two-stage approach: Distance filtering + loss evaluation
  - Stage 1 selects: 20% of neighbors
  - Stage 2 uses: Training sample loss comparison
  - Theoretical complexity: O(deg(i)×d + deg(i)×inference)
  - Approach: UBAR paper implementation
