Device: cuda
Seed: 987654321
Loading 1 LEAF Sent140 train files...
LEAF Sent140 train: 254555 users, 908652 samples
Building vocabulary (max_size=10000)...
Vocabulary size: 10000
Loading 1 LEAF Sent140 test files...
LEAF Sent140 test: 254555 users, 286281 samples
Found 254555 train users, 254555 test users, 254555 common users
User sample counts range: 494 (max) to 1 (min)
Distributed ALL 254555 users across 20 clients
Users per client: 12727 (with 15 clients getting +1 user)
Train partition sizes: [44353, 44290, 44657, 44907, 44696, 45843, 45801, 45619, 45069, 45639, 45821, 45311, 45779, 46056, 45625, 45984, 46428, 44737, 45540, 46497]
Test partition sizes: [14232, 14235, 14266, 14217, 14238, 14373, 14346, 14334, 14294, 14373, 14344, 14302, 14354, 14362, 14320, 14395, 14389, 14257, 14251, 14399]
  Client 0: 44353 train samples, 2 unique classes
  Client 1: 44290 train samples, 2 unique classes
  Client 2: 44657 train samples, 2 unique classes
  Client 3: 44907 train samples, 2 unique classes
  Client 4: 44696 train samples, 2 unique classes
  Client 5: 45843 train samples, 2 unique classes
  Client 6: 45801 train samples, 2 unique classes
  Client 7: 45619 train samples, 2 unique classes
  Client 8: 45069 train samples, 2 unique classes
  Client 9: 45639 train samples, 2 unique classes
  Client 10: 45821 train samples, 2 unique classes
  Client 11: 45311 train samples, 2 unique classes
  Client 12: 45779 train samples, 2 unique classes
  Client 13: 46056 train samples, 2 unique classes
  Client 14: 45625 train samples, 2 unique classes
  Client 15: 45984 train samples, 2 unique classes
  Client 16: 46428 train samples, 2 unique classes
  Client 17: 44737 train samples, 2 unique classes
  Client 18: 45540 train samples, 2 unique classes
  Client 19: 46497 train samples, 2 unique classes
Will sample 4500 samples per client per epoch
Graph: erdos, nodes: 20, edges: 48
Degree statistics: avg=4.80, min=2, max=7
Attack: Compromised 14/20 nodes: [1, 2, 3, 5, 6, 8, 11, 12, 13, 14, 15, 17, 18, 19]
Attack type: krum, lambda: 1.0
Model variant: baseline
Model parameters: 1,174,986
UBAR ALGORITHM (Two-Stage Byzantine-resilient)
  - Model dimension: 1,174,986 parameters
  - Rho parameter: 0.30000000000000004
  - Stage 1: Distance-based filtering (select 30% closest neighbors)
  - Stage 2: Performance-based selection (loss comparison)
  - Complexity: O(deg(i)×d + deg(i)×inference)
Initial test acc across nodes: mean=0.4953 ± 0.0174
Round 001: test acc mean=0.5539 ± 0.0333 | min=0.4962 max=0.6145
         : test loss mean=0.8525 ± 0.7155
         : individual accs = ['0.589165', '0.507692', '0.571008', '0.496237', '0.597907', '0.569749', '0.533389', '0.579113', '0.554289', '0.591526', '0.567973', '0.516291', '0.549464', '0.497006', '0.527025', '0.614519', '0.572938', '0.569825', '0.533647', '0.540038']
         : correct/total = [(8385, 14232), (7227, 14235), (8146, 14266), (7055, 14217), (8513, 14238), (8189, 14373), (7652, 14346), (8301, 14334), (7923, 14294), (8502, 14373), (8147, 14344), (7384, 14302), (7887, 14354), (7138, 14362), (7547, 14320), (8846, 14395), (8244, 14389), (8124, 14257), (7605, 14251), (7776, 14399)]
         : compromised: 0.5414, honest: 0.5831
         : ubar stats = ['Node 0: s1=0.167, s2=1.000', 'Node 1: s1=0.167, s2=1.000', 'Node 2: s1=0.200, s2=1.000']...
Round 002: test acc mean=0.6192 ± 0.0329 | min=0.4850 max=0.6433
         : test loss mean=0.7236 ± 0.2800
         : individual accs = ['0.639123', '0.608008', '0.624492', '0.625659', '0.637800', '0.633062', '0.622682', '0.643296', '0.618301', '0.639185', '0.634830', '0.620473', '0.605476', '0.484960', '0.631075', '0.628760', '0.601640', '0.621309', '0.622833', '0.640531']
         : correct/total = [(9096, 14232), (8655, 14235), (8909, 14266), (8895, 14217), (9081, 14238), (9099, 14373), (8933, 14346), (9221, 14334), (8838, 14294), (9187, 14373), (9106, 14344), (8874, 14302), (8691, 14354), (6965, 14362), (9037, 14320), (9051, 14395), (8657, 14389), (8858, 14257), (8876, 14251), (9223, 14399)]
         : compromised: 0.6134, honest: 0.6326
         : ubar stats = ['Node 0: s1=0.167, s2=1.000', 'Node 1: s1=0.167, s2=1.000', 'Node 2: s1=0.200, s2=1.000']...
Round 003: test acc mean=0.6191 ± 0.0423 | min=0.4969 max=0.6530
         : test loss mean=0.6908 ± 0.1960
         : individual accs = ['0.643409', '0.636600', '0.626665', '0.637547', '0.644473', '0.646072', '0.625122', '0.634157', '0.644676', '0.652960', '0.625558', '0.548105', '0.522015', '0.496936', '0.640922', '0.633206', '0.639308', '0.615136', '0.630131', '0.638030']
         : correct/total = [(9157, 14232), (9062, 14235), (8940, 14266), (9064, 14217), (9176, 14238), (9286, 14373), (8968, 14346), (9090, 14334), (9215, 14294), (9385, 14373), (8973, 14344), (7839, 14302), (7493, 14354), (7137, 14362), (9178, 14320), (9115, 14395), (9199, 14389), (8770, 14257), (8980, 14251), (9187, 14399)]
         : compromised: 0.6101, honest: 0.6400
         : ubar stats = ['Node 0: s1=0.167, s2=1.000', 'Node 1: s1=0.167, s2=1.000', 'Node 2: s1=0.200, s2=1.000']...
Round 004: test acc mean=0.6387 ± 0.0328 | min=0.4998 max=0.6582
         : test loss mean=0.7104 ± 0.3418
         : individual accs = ['0.651911', '0.640393', '0.640684', '0.645776', '0.640820', '0.657622', '0.643873', '0.658155', '0.652721', '0.656717', '0.651143', '0.628094', '0.637732', '0.499791', '0.642388', '0.643557', '0.648412', '0.646209', '0.635815', '0.652129']
         : correct/total = [(9278, 14232), (9116, 14235), (9140, 14266), (9181, 14217), (9124, 14238), (9452, 14373), (9237, 14346), (9434, 14334), (9330, 14294), (9439, 14373), (9340, 14344), (8983, 14302), (9154, 14354), (7178, 14362), (9199, 14320), (9264, 14395), (9330, 14389), (9213, 14257), (9061, 14251), (9390, 14399)]
         : compromised: 0.6333, honest: 0.6512
         : ubar stats = ['Node 0: s1=0.167, s2=1.000', 'Node 1: s1=0.167, s2=1.000', 'Node 2: s1=0.200, s2=1.000']...
Round 005: test acc mean=0.6433 ± 0.0338 | min=0.4993 max=0.6613
         : test loss mean=0.7024 ± 0.3355
         : individual accs = ['0.646360', '0.649175', '0.647484', '0.651825', '0.659713', '0.655952', '0.649728', '0.661295', '0.657619', '0.649343', '0.652538', '0.628374', '0.639961', '0.499304', '0.651257', '0.653838', '0.655223', '0.651960', '0.645148', '0.659143']
         : correct/total = [(9199, 14232), (9241, 14235), (9237, 14266), (9267, 14217), (9393, 14238), (9428, 14373), (9321, 14346), (9479, 14334), (9400, 14294), (9333, 14373), (9360, 14344), (8987, 14302), (9186, 14354), (7171, 14362), (9326, 14320), (9412, 14395), (9428, 14389), (9295, 14257), (9194, 14251), (9491, 14399)]
         : compromised: 0.6386, honest: 0.6541
         : ubar stats = ['Node 0: s1=0.167, s2=1.000', 'Node 1: s1=0.167, s2=1.000', 'Node 2: s1=0.200, s2=1.000']...
Round 006: test acc mean=0.6492 ± 0.0378 | min=0.4869 max=0.6689
         : test loss mean=0.6648 ± 0.2133
         : individual accs = ['0.658094', '0.662100', '0.647624', '0.650278', '0.663787', '0.664997', '0.655095', '0.666388', '0.658178', '0.668893', '0.662158', '0.646063', '0.659119', '0.486910', '0.657402', '0.652171', '0.652234', '0.656730', '0.650902', '0.665116']
         : correct/total = [(9366, 14232), (9425, 14235), (9239, 14266), (9245, 14217), (9451, 14238), (9558, 14373), (9398, 14346), (9552, 14334), (9408, 14294), (9614, 14373), (9498, 14344), (9240, 14302), (9461, 14354), (6993, 14362), (9414, 14320), (9388, 14395), (9385, 14389), (9363, 14257), (9276, 14251), (9577, 14399)]
         : compromised: 0.6438, honest: 0.6619
         : ubar stats = ['Node 0: s1=0.167, s2=1.000', 'Node 1: s1=0.167, s2=1.000', 'Node 2: s1=0.200, s2=1.000']...
Round 007: test acc mean=0.6509 ± 0.0337 | min=0.5104 max=0.6715
         : test loss mean=0.6533 ± 0.1667
         : individual accs = ['0.660343', '0.665683', '0.655264', '0.663361', '0.656483', '0.640924', '0.653353', '0.665829', '0.666643', '0.671537', '0.659370', '0.626556', '0.664693', '0.510375', '0.661313', '0.656339', '0.661617', '0.662622', '0.649218', '0.666782']
         : correct/total = [(9398, 14232), (9476, 14235), (9348, 14266), (9431, 14217), (9347, 14238), (9212, 14373), (9373, 14346), (9544, 14334), (9529, 14294), (9652, 14373), (9458, 14344), (8961, 14302), (9541, 14354), (7330, 14362), (9470, 14320), (9448, 14395), (9520, 14389), (9447, 14257), (9252, 14251), (9601, 14399)]
         : compromised: 0.6459, honest: 0.6625
         : ubar stats = ['Node 0: s1=0.167, s2=1.000', 'Node 1: s1=0.167, s2=1.000', 'Node 2: s1=0.200, s2=1.000']...
Round 008: test acc mean=0.6562 ± 0.0377 | min=0.4984 max=0.6771
         : test loss mean=0.6518 ± 0.1810
         : individual accs = ['0.664488', '0.670109', '0.665288', '0.662024', '0.674182', '0.670632', '0.667503', '0.667713', '0.670421', '0.672789', '0.666481', '0.629073', '0.669639', '0.498399', '0.665503', '0.663564', '0.663145', '0.662482', '0.643955', '0.677061']
         : correct/total = [(9457, 14232), (9539, 14235), (9491, 14266), (9412, 14217), (9599, 14238), (9639, 14373), (9576, 14346), (9571, 14334), (9583, 14294), (9670, 14373), (9560, 14344), (8997, 14302), (9612, 14354), (7158, 14362), (9530, 14320), (9552, 14395), (9542, 14389), (9445, 14257), (9177, 14251), (9749, 14399)]
         : compromised: 0.6511, honest: 0.6681
         : ubar stats = ['Node 0: s1=0.167, s2=1.000', 'Node 1: s1=0.167, s2=1.000', 'Node 2: s1=0.200, s2=1.000']...
Round 009: test acc mean=0.6568 ± 0.0407 | min=0.4850 max=0.6793
         : test loss mean=0.6434 ± 0.1585
         : individual accs = ['0.658094', '0.678047', '0.660241', '0.663220', '0.672988', '0.679329', '0.647707', '0.674550', '0.660627', '0.667154', '0.671709', '0.637463', '0.668942', '0.484960', '0.673115', '0.660646', '0.671763', '0.666129', '0.664445', '0.675394']
         : correct/total = [(9366, 14232), (9652, 14235), (9419, 14266), (9429, 14217), (9582, 14238), (9764, 14373), (9292, 14346), (9669, 14334), (9443, 14294), (9589, 14373), (9635, 14344), (9117, 14302), (9602, 14354), (6965, 14362), (9639, 14320), (9510, 14395), (9666, 14389), (9497, 14257), (9469, 14251), (9725, 14399)]
         : compromised: 0.6514, honest: 0.6694
         : ubar stats = ['Node 0: s1=0.167, s2=1.000', 'Node 1: s1=0.167, s2=1.000', 'Node 2: s1=0.200, s2=1.000']...
Round 010: test acc mean=0.6661 ± 0.0373 | min=0.5070 max=0.6845
         : test loss mean=0.6267 ± 0.1281
         : individual accs = ['0.669477', '0.679944', '0.662274', '0.673138', '0.681978', '0.684478', '0.674753', '0.684247', '0.669861', '0.679886', '0.678960', '0.658719', '0.683155', '0.506963', '0.676327', '0.666065', '0.676350', '0.673143', '0.662410', '0.680047']
         : correct/total = [(9528, 14232), (9679, 14235), (9448, 14266), (9570, 14217), (9710, 14238), (9838, 14373), (9680, 14346), (9808, 14334), (9575, 14294), (9772, 14373), (9739, 14344), (9421, 14302), (9806, 14354), (7281, 14362), (9685, 14320), (9588, 14395), (9732, 14389), (9597, 14257), (9440, 14251), (9792, 14399)]
         : compromised: 0.6608, honest: 0.6785
         : ubar stats = ['Node 0: s1=0.167, s2=1.000', 'Node 1: s1=0.167, s2=1.000', 'Node 2: s1=0.200, s2=1.000']...

=== FINAL RESULTS ===
Dataset: sent140, Nodes: 20, Graph: erdos, Aggregation: ubar
Attack: krum, 70.0% compromised
Final accuracy - Compromised: 0.6608, Honest: 0.6785
Overall test accuracy: mean=0.6661 ± 0.0373

=== UBAR SUMMARY ===
Node 0: stage1=0.167, stage2=1.000, overall=0.167
Node 1: stage1=0.167, stage2=1.000, overall=0.167
Node 2: stage1=0.200, stage2=1.000, overall=0.200
Node 3: stage1=0.250, stage2=1.000, overall=0.250
Node 4: stage1=0.250, stage2=1.000, overall=0.250
Node 5: stage1=0.200, stage2=1.000, overall=0.200
Node 6: stage1=0.200, stage2=1.000, overall=0.200
Node 7: stage1=0.200, stage2=1.000, overall=0.200
Node 8: stage1=0.500, stage2=1.000, overall=0.500
Node 9: stage1=0.333, stage2=1.000, overall=0.333
Node 10: stage1=0.250, stage2=1.000, overall=0.250
Node 11: stage1=0.286, stage2=0.700, overall=0.200
Node 12: stage1=0.286, stage2=0.650, overall=0.186
Node 13: stage1=0.250, stage2=1.000, overall=0.250
Node 14: stage1=0.286, stage2=0.500, overall=0.143
Node 15: stage1=0.167, stage2=1.000, overall=0.167
Node 16: stage1=0.200, stage2=1.000, overall=0.200
Node 17: stage1=0.200, stage2=1.000, overall=0.200
Node 18: stage1=0.250, stage2=1.000, overall=0.250
Node 19: stage1=0.500, stage2=1.000, overall=0.500

=== PARALLEL EXECUTION TIME (realistic for distributed system) ===
  COMMUNICATION (max across nodes):
    - Full model transfer: 0.000s (0.1%)
  COMPUTATION (max across nodes):
    - Distance computation: 0.027s (61.3%)
    - Loss computation: 0.013s (30.0%)
    - Aggregation: 0.004s (8.7%)
  TOTALS:
    - Total computation: 0.043s (99.9%)
    - Total communication: 0.000s (0.1%)
    - Total parallel time: 0.043s

=== PER-NODE AVERAGE TIME ===
  - Distance computation: 0.018s
  - Loss computation: 0.008s
  - Aggregation: 0.003s
  - Model transfer: 0.000s
  - Total per node: 0.030s

=== TOTAL COMPUTATIONAL WORK (sum across all nodes) ===
  - Total distance computation: 0.367s
  - Total loss computation: 0.163s
  - Total aggregation: 0.066s
  - Total model transfer: 0.000s
  - Grand total: 0.595s
  - Mean Stage 1 acceptance rate: 0.257
  - Mean Stage 2 acceptance rate: 0.943
  - Overall acceptance rate: 0.242

UBAR Algorithm Properties:
  - Model dimension: 1,174,986
  - Rho parameter: 0.30000000000000004
  - Two-stage approach: Distance filtering + loss evaluation
  - Stage 1 selects: 30% of neighbors
  - Stage 2 uses: Training sample loss comparison
  - Theoretical complexity: O(deg(i)×d + deg(i)×inference)
  - Approach: UBAR paper implementation
