Device: cuda
Seed: 987654321
Loading 1 LEAF Sent140 train files...
LEAF Sent140 train: 254555 users, 908652 samples
Building vocabulary (max_size=10000)...
Vocabulary size: 10000
Loading 1 LEAF Sent140 test files...
LEAF Sent140 test: 254555 users, 286281 samples
Found 254555 train users, 254555 test users, 254555 common users
User sample counts range: 494 (max) to 1 (min)
Distributed ALL 254555 users across 20 clients
Users per client: 12727 (with 15 clients getting +1 user)
Train partition sizes: [44353, 44290, 44657, 44907, 44696, 45843, 45801, 45619, 45069, 45639, 45821, 45311, 45779, 46056, 45625, 45984, 46428, 44737, 45540, 46497]
Test partition sizes: [14232, 14235, 14266, 14217, 14238, 14373, 14346, 14334, 14294, 14373, 14344, 14302, 14354, 14362, 14320, 14395, 14389, 14257, 14251, 14399]
  Client 0: 44353 train samples, 2 unique classes
  Client 1: 44290 train samples, 2 unique classes
  Client 2: 44657 train samples, 2 unique classes
  Client 3: 44907 train samples, 2 unique classes
  Client 4: 44696 train samples, 2 unique classes
  Client 5: 45843 train samples, 2 unique classes
  Client 6: 45801 train samples, 2 unique classes
  Client 7: 45619 train samples, 2 unique classes
  Client 8: 45069 train samples, 2 unique classes
  Client 9: 45639 train samples, 2 unique classes
  Client 10: 45821 train samples, 2 unique classes
  Client 11: 45311 train samples, 2 unique classes
  Client 12: 45779 train samples, 2 unique classes
  Client 13: 46056 train samples, 2 unique classes
  Client 14: 45625 train samples, 2 unique classes
  Client 15: 45984 train samples, 2 unique classes
  Client 16: 46428 train samples, 2 unique classes
  Client 17: 44737 train samples, 2 unique classes
  Client 18: 45540 train samples, 2 unique classes
  Client 19: 46497 train samples, 2 unique classes
Will sample 4500 samples per client per epoch
Graph: erdos, nodes: 20, edges: 126
Degree statistics: avg=12.60, min=8, max=16
Attack: Compromised 6/20 nodes: [5, 12, 13, 14, 17, 18]
Attack type: backdoor, lambda: 1.0
Backdoor target label: 1, trigger size: 3
Model variant: baseline
Model parameters: 1,174,986
Initial test acc across nodes: mean=0.4965 ± 0.0152
Backdoor attack: Created poisoned datasets for 6 compromised nodes
Round 001: test acc mean=0.5000 ± 0.0065 | min=0.4889 max=0.5181
         : test loss mean=23.5470 ± 8.6003
         : individual accs = ['0.502951', '0.505444', '0.503575', '0.496378', '0.518050', '0.491755', '0.494145', '0.494558', '0.512663', '0.493703', '0.499303', '0.498602', '0.500070', '0.501462', '0.500838', '0.498159', '0.501077', '0.499193', '0.499614', '0.488853']
         : correct/total = [(7158, 14232), (7195, 14235), (7184, 14266), (7057, 14217), (7376, 14238), (7068, 14373), (7089, 14346), (7089, 14334), (7328, 14294), (7096, 14373), (7162, 14344), (7131, 14302), (7178, 14354), (7202, 14362), (7172, 14320), (7171, 14395), (7210, 14389), (7117, 14257), (7120, 14251), (7039, 14399)]
         : compromised: 0.4988, honest: 0.5005
Round 002: test acc mean=0.4946 ± 0.0046 | min=0.4875 max=0.5064
         : test loss mean=38.1724 ± 8.8390
         : individual accs = ['0.494379', '0.491254', '0.487453', '0.491032', '0.497823', '0.489181', '0.490102', '0.500070', '0.490975', '0.495791', '0.496026', '0.491749', '0.497283', '0.506406', '0.496718', '0.492810', '0.502954', '0.491899', '0.492597', '0.496007']
         : correct/total = [(7036, 14232), (6993, 14235), (6954, 14266), (6981, 14217), (7088, 14238), (7031, 14373), (7031, 14346), (7168, 14334), (7018, 14294), (7126, 14373), (7115, 14344), (7033, 14302), (7138, 14354), (7273, 14362), (7113, 14320), (7094, 14395), (7237, 14389), (7013, 14257), (7020, 14251), (7142, 14399)]
         : compromised: 0.4957, honest: 0.4942
Round 003: test acc mean=0.5066 ± 0.0102 | min=0.4908 max=0.5208
         : test loss mean=5.9417 ± 1.9115
         : individual accs = ['0.490795', '0.507341', '0.509743', '0.515580', '0.502809', '0.491268', '0.518542', '0.518767', '0.491115', '0.520838', '0.513734', '0.516991', '0.491152', '0.517337', '0.498603', '0.509066', '0.498784', '0.503612', '0.515402', '0.500174']
         : correct/total = [(6985, 14232), (7222, 14235), (7272, 14266), (7330, 14217), (7159, 14238), (7061, 14373), (7439, 14346), (7436, 14334), (7020, 14294), (7486, 14373), (7369, 14344), (7394, 14302), (7050, 14354), (7430, 14362), (7140, 14320), (7328, 14395), (7177, 14389), (7180, 14257), (7345, 14251), (7202, 14399)]
         : compromised: 0.5029, honest: 0.5082
Round 004: test acc mean=0.5095 ± 0.0054 | min=0.4972 max=0.5171
         : test loss mean=14.1951 ± 20.5086
         : individual accs = ['0.514966', '0.508676', '0.514790', '0.513610', '0.508077', '0.513880', '0.503137', '0.504744', '0.510004', '0.512002', '0.515407', '0.507202', '0.502090', '0.505222', '0.505936', '0.516429', '0.505317', '0.497159', '0.513578', '0.517119']
         : correct/total = [(7329, 14232), (7241, 14235), (7344, 14266), (7302, 14217), (7234, 14238), (7386, 14373), (7218, 14346), (7235, 14334), (7290, 14294), (7359, 14373), (7393, 14344), (7254, 14302), (7207, 14354), (7256, 14362), (7245, 14320), (7434, 14395), (7271, 14389), (7088, 14257), (7319, 14251), (7446, 14399)]
         : compromised: 0.5063, honest: 0.5108
Round 005: test acc mean=0.5058 ± 0.0089 | min=0.4930 max=0.5243
         : test loss mean=26.0383 ± 26.8947
         : individual accs = ['0.496557', '0.512259', '0.511145', '0.495041', '0.509060', '0.519446', '0.501394', '0.496861', '0.509095', '0.493495', '0.502510', '0.500489', '0.510102', '0.509678', '0.519553', '0.510872', '0.500452', '0.492951', '0.501228', '0.524342']
         : correct/total = [(7067, 14232), (7292, 14235), (7292, 14266), (7038, 14217), (7248, 14238), (7466, 14373), (7193, 14346), (7122, 14334), (7277, 14294), (7093, 14373), (7208, 14344), (7158, 14302), (7322, 14354), (7320, 14362), (7440, 14320), (7354, 14395), (7201, 14389), (7028, 14257), (7143, 14251), (7550, 14399)]
         : compromised: 0.5088, honest: 0.5045
Round 006: test acc mean=0.5082 ± 0.0064 | min=0.4931 max=0.5221
         : test loss mean=1.9786 ± 1.7002
         : individual accs = ['0.512929', '0.504672', '0.503575', '0.507772', '0.505127', '0.522090', '0.505228', '0.515418', '0.508115', '0.502261', '0.512828', '0.504195', '0.511286', '0.507798', '0.493087', '0.503161', '0.505803', '0.520236', '0.508877', '0.510383']
         : correct/total = [(7300, 14232), (7184, 14235), (7184, 14266), (7219, 14217), (7192, 14238), (7504, 14373), (7248, 14346), (7388, 14334), (7263, 14294), (7219, 14373), (7356, 14344), (7211, 14302), (7339, 14354), (7293, 14362), (7061, 14320), (7243, 14395), (7278, 14389), (7417, 14257), (7252, 14251), (7349, 14399)]
         : compromised: 0.5106, honest: 0.5072
Round 007: test acc mean=0.5089 ± 0.0081 | min=0.4885 max=0.5244
         : test loss mean=9.6183 ± 37.7624
         : individual accs = ['0.501897', '0.498630', '0.518085', '0.504044', '0.507726', '0.509567', '0.504391', '0.520790', '0.488527', '0.506992', '0.510318', '0.518739', '0.514421', '0.516572', '0.504120', '0.507676', '0.524359', '0.506558', '0.506561', '0.507049']
         : correct/total = [(7143, 14232), (7098, 14235), (7391, 14266), (7166, 14217), (7229, 14238), (7324, 14373), (7236, 14346), (7465, 14334), (6983, 14294), (7287, 14373), (7320, 14344), (7419, 14302), (7384, 14354), (7419, 14362), (7219, 14320), (7308, 14395), (7545, 14389), (7222, 14257), (7219, 14251), (7301, 14399)]
         : compromised: 0.5096, honest: 0.5085
Round 008: test acc mean=0.5213 ± 0.0128 | min=0.4885 max=0.5381
         : test loss mean=8.1256 ± 31.7367
         : individual accs = ['0.529160', '0.521742', '0.530282', '0.520082', '0.536662', '0.503027', '0.511641', '0.535510', '0.488457', '0.524873', '0.538065', '0.527688', '0.520621', '0.534605', '0.499162', '0.516221', '0.511154', '0.527390', '0.527191', '0.522050']
         : correct/total = [(7531, 14232), (7427, 14235), (7565, 14266), (7394, 14217), (7641, 14238), (7230, 14373), (7340, 14346), (7676, 14334), (6982, 14294), (7544, 14373), (7718, 14344), (7547, 14302), (7473, 14354), (7678, 14362), (7148, 14320), (7431, 14395), (7355, 14389), (7519, 14257), (7513, 14251), (7517, 14399)]
         : compromised: 0.5187, honest: 0.5224
Round 009: test acc mean=0.5197 ± 0.0043 | min=0.5123 max=0.5281
         : test loss mean=0.7891 ± 0.0064
         : individual accs = ['0.513280', '0.518230', '0.512267', '0.522754', '0.518050', '0.521742', '0.514290', '0.524627', '0.517210', '0.528073', '0.523285', '0.520347', '0.520134', '0.527851', '0.516341', '0.516360', '0.517409', '0.521428', '0.518560', '0.522050']
         : correct/total = [(7305, 14232), (7377, 14235), (7308, 14266), (7432, 14217), (7376, 14238), (7499, 14373), (7378, 14346), (7520, 14334), (7393, 14294), (7590, 14373), (7506, 14344), (7442, 14302), (7466, 14354), (7581, 14362), (7394, 14320), (7433, 14395), (7445, 14389), (7434, 14257), (7390, 14251), (7517, 14399)]
         : compromised: 0.5210, honest: 0.5192
Round 010: test acc mean=0.5076 ± 0.0060 | min=0.4925 max=0.5168
         : test loss mean=0.7759 ± 0.0273
         : individual accs = ['0.506183', '0.500738', '0.502804', '0.504889', '0.510957', '0.514298', '0.503276', '0.508651', '0.509165', '0.503653', '0.513385', '0.504825', '0.513864', '0.516780', '0.513198', '0.498993', '0.513378', '0.492530', '0.509508', '0.511911']
         : correct/total = [(7204, 14232), (7128, 14235), (7173, 14266), (7178, 14217), (7275, 14238), (7392, 14373), (7220, 14346), (7291, 14334), (7278, 14294), (7239, 14373), (7364, 14344), (7220, 14302), (7376, 14354), (7422, 14362), (7349, 14320), (7183, 14395), (7387, 14389), (7022, 14257), (7261, 14251), (7371, 14399)]
         : compromised: 0.5100, honest: 0.5066

=== FINAL RESULTS ===
Dataset: sent140, Nodes: 20, Graph: erdos, Aggregation: krum
Attack: backdoor, 30.0% compromised
Final accuracy - Compromised: 0.5100, Honest: 0.5066
Overall test accuracy: mean=0.5076 ± 0.0060

=== BACKDOOR ATTACK SUCCESS RATE (ASR) ===
Target label: 1
Trigger size: 3x3
Overall ASR: 0.2325 ± 0.0467
Honest nodes ASR: 0.2333 ± 0.0465
Compromised nodes ASR: 0.2308 ± 0.0469
Note: Higher ASR indicates more successful backdoor attack
