Device: cuda
Seed: 987654321
Loading 1 LEAF Sent140 train files...
LEAF Sent140 train: 254555 users, 908652 samples
Building vocabulary (max_size=10000)...
Vocabulary size: 10000
Loading 1 LEAF Sent140 test files...
LEAF Sent140 test: 254555 users, 286281 samples
Found 254555 train users, 254555 test users, 254555 common users
User sample counts range: 494 (max) to 1 (min)
Distributed ALL 254555 users across 20 clients
Users per client: 12727 (with 15 clients getting +1 user)
Train partition sizes: [44353, 44290, 44657, 44907, 44696, 45843, 45801, 45619, 45069, 45639, 45821, 45311, 45779, 46056, 45625, 45984, 46428, 44737, 45540, 46497]
Test partition sizes: [14232, 14235, 14266, 14217, 14238, 14373, 14346, 14334, 14294, 14373, 14344, 14302, 14354, 14362, 14320, 14395, 14389, 14257, 14251, 14399]
  Client 0: 44353 train samples, 2 unique classes
  Client 1: 44290 train samples, 2 unique classes
  Client 2: 44657 train samples, 2 unique classes
  Client 3: 44907 train samples, 2 unique classes
  Client 4: 44696 train samples, 2 unique classes
  Client 5: 45843 train samples, 2 unique classes
  Client 6: 45801 train samples, 2 unique classes
  Client 7: 45619 train samples, 2 unique classes
  Client 8: 45069 train samples, 2 unique classes
  Client 9: 45639 train samples, 2 unique classes
  Client 10: 45821 train samples, 2 unique classes
  Client 11: 45311 train samples, 2 unique classes
  Client 12: 45779 train samples, 2 unique classes
  Client 13: 46056 train samples, 2 unique classes
  Client 14: 45625 train samples, 2 unique classes
  Client 15: 45984 train samples, 2 unique classes
  Client 16: 46428 train samples, 2 unique classes
  Client 17: 44737 train samples, 2 unique classes
  Client 18: 45540 train samples, 2 unique classes
  Client 19: 46497 train samples, 2 unique classes
Will sample 4500 samples per client per epoch
Graph: erdos, nodes: 20, edges: 99
Degree statistics: avg=9.90, min=7, max=14
Attack: Compromised 14/20 nodes: [1, 2, 3, 5, 6, 8, 11, 12, 13, 14, 15, 17, 18, 19]
Attack type: directed_deviation, lambda: 1.0
Model variant: baseline
Model parameters: 1,174,986
Initial test acc across nodes: mean=0.4965 ± 0.0152
Round 001: test acc mean=0.5010 ± 0.0066 | min=0.4878 max=0.5137
         : test loss mean=12.6975 ± 6.1390
         : individual accs = ['0.511172', '0.490762', '0.487803', '0.494830', '0.497682', '0.513671', '0.496933', '0.509907', '0.495872', '0.500591', '0.498048', '0.501888', '0.507454', '0.495683', '0.506844', '0.506495', '0.500452', '0.500386', '0.504526', '0.499132']
         : correct/total = [(7275, 14232), (6986, 14235), (6959, 14266), (7035, 14217), (7086, 14238), (7383, 14373), (7129, 14346), (7309, 14334), (7088, 14294), (7195, 14373), (7144, 14344), (7178, 14302), (7284, 14354), (7119, 14362), (7258, 14320), (7291, 14395), (7201, 14389), (7134, 14257), (7190, 14251), (7187, 14399)]
         : compromised: 0.5002, honest: 0.5030
Round 002: test acc mean=0.5015 ± 0.0047 | min=0.4913 max=0.5083
         : test loss mean=9.7343 ± 2.9447
         : individual accs = ['0.501405', '0.508325', '0.505047', '0.500387', '0.502037', '0.503583', '0.492472', '0.505023', '0.505597', '0.503931', '0.502998', '0.505594', '0.501742', '0.491296', '0.508310', '0.500382', '0.501772', '0.493021', '0.497298', '0.499896']
         : correct/total = [(7136, 14232), (7236, 14235), (7205, 14266), (7114, 14217), (7148, 14238), (7238, 14373), (7065, 14346), (7239, 14334), (7227, 14294), (7243, 14373), (7215, 14344), (7231, 14302), (7202, 14354), (7056, 14362), (7279, 14320), (7203, 14395), (7220, 14389), (7029, 14257), (7087, 14251), (7198, 14399)]
         : compromised: 0.5009, honest: 0.5029
Round 003: test acc mean=0.4983 ± 0.0065 | min=0.4867 max=0.5079
         : test loss mean=2.3752 ± 0.8512
         : individual accs = ['0.499157', '0.495188', '0.493902', '0.493001', '0.487849', '0.500452', '0.503346', '0.494140', '0.498951', '0.486746', '0.507878', '0.494336', '0.507385', '0.487328', '0.498743', '0.506078', '0.504205', '0.504033', '0.497088', '0.505382']
         : correct/total = [(7104, 14232), (7049, 14235), (7046, 14266), (7009, 14217), (6946, 14238), (7193, 14373), (7221, 14346), (7083, 14334), (7132, 14294), (6996, 14373), (7285, 14344), (7070, 14302), (7283, 14354), (6999, 14362), (7142, 14320), (7285, 14395), (7255, 14389), (7186, 14257), (7084, 14251), (7277, 14399)]
         : compromised: 0.4989, honest: 0.4967
Round 004: test acc mean=0.4981 ± 0.0051 | min=0.4888 max=0.5071
         : test loss mean=5.5829 ± 1.8056
         : individual accs = ['0.497260', '0.498841', '0.493902', '0.489695', '0.506813', '0.495443', '0.502579', '0.488768', '0.501679', '0.505601', '0.493447', '0.496015', '0.493730', '0.500975', '0.502723', '0.498090', '0.507123', '0.495686', '0.498421', '0.495659']
         : correct/total = [(7077, 14232), (7101, 14235), (7046, 14266), (6962, 14217), (7216, 14238), (7121, 14373), (7210, 14346), (7006, 14334), (7171, 14294), (7267, 14373), (7078, 14344), (7094, 14302), (7087, 14354), (7195, 14362), (7199, 14320), (7170, 14395), (7297, 14389), (7067, 14257), (7103, 14251), (7137, 14399)]
         : compromised: 0.4974, honest: 0.4998
Round 005: test acc mean=0.4937 ± 0.0073 | min=0.4815 max=0.5120
         : test loss mean=2.2035 ± 1.1627
         : individual accs = ['0.497681', '0.488233', '0.484088', '0.493705', '0.495645', '0.488694', '0.488499', '0.491698', '0.504477', '0.490642', '0.490310', '0.490771', '0.493242', '0.512046', '0.495670', '0.503786', '0.484884', '0.500666', '0.481510', '0.497882']
         : correct/total = [(7083, 14232), (6950, 14235), (6906, 14266), (7019, 14217), (7057, 14238), (7024, 14373), (7008, 14346), (7048, 14334), (7211, 14294), (7052, 14373), (7033, 14344), (7019, 14302), (7080, 14354), (7354, 14362), (7098, 14320), (7252, 14395), (6977, 14389), (7138, 14257), (6862, 14251), (7169, 14399)]
         : compromised: 0.4945, honest: 0.4918
Round 006: test acc mean=0.5011 ± 0.0038 | min=0.4937 max=0.5081
         : test loss mean=3.6739 ± 1.5687
         : individual accs = ['0.498384', '0.499122', '0.505608', '0.508124', '0.502669', '0.501983', '0.493726', '0.501674', '0.503568', '0.506018', '0.496096', '0.497483', '0.503553', '0.505361', '0.502654', '0.497325', '0.496143', '0.498983', '0.500737', '0.503646']
         : correct/total = [(7093, 14232), (7105, 14235), (7213, 14266), (7224, 14217), (7157, 14238), (7215, 14373), (7083, 14346), (7191, 14334), (7198, 14294), (7273, 14373), (7116, 14344), (7115, 14302), (7228, 14354), (7258, 14362), (7198, 14320), (7159, 14395), (7139, 14389), (7114, 14257), (7136, 14251), (7252, 14399)]
         : compromised: 0.5016, honest: 0.5002
Round 007: test acc mean=0.4963 ± 0.0095 | min=0.4740 max=0.5131
         : test loss mean=2.0184 ± 1.0518
         : individual accs = ['0.494941', '0.495188', '0.473994', '0.491946', '0.496278', '0.494399', '0.503694', '0.494140', '0.493774', '0.506923', '0.496863', '0.489023', '0.497074', '0.512533', '0.485405', '0.486488', '0.498297', '0.513081', '0.490773', '0.511911']
         : correct/total = [(7044, 14232), (7049, 14235), (6762, 14266), (6994, 14217), (7066, 14238), (7106, 14373), (7226, 14346), (7083, 14334), (7058, 14294), (7286, 14373), (7127, 14344), (6994, 14302), (7135, 14354), (7361, 14362), (6951, 14320), (7003, 14395), (7170, 14389), (7315, 14257), (6994, 14251), (7371, 14399)]
         : compromised: 0.4957, honest: 0.4979
Round 008: test acc mean=0.5043 ± 0.0041 | min=0.4963 max=0.5094
         : test loss mean=2.4626 ± 1.2852
         : individual accs = ['0.508502', '0.508325', '0.506519', '0.496307', '0.509411', '0.502539', '0.502649', '0.500698', '0.500350', '0.508105', '0.498815', '0.502168', '0.503553', '0.506406', '0.508170', '0.498506', '0.508930', '0.509013', '0.507122', '0.499618']
         : correct/total = [(7237, 14232), (7236, 14235), (7226, 14266), (7056, 14217), (7253, 14238), (7223, 14373), (7211, 14346), (7177, 14334), (7152, 14294), (7303, 14373), (7155, 14344), (7182, 14302), (7228, 14354), (7273, 14362), (7277, 14320), (7176, 14395), (7323, 14389), (7257, 14257), (7227, 14251), (7194, 14399)]
         : compromised: 0.5037, honest: 0.5057
Round 009: test acc mean=0.5009 ± 0.0076 | min=0.4877 max=0.5164
         : test loss mean=1.7909 ± 1.2772
         : individual accs = ['0.495854', '0.497998', '0.487733', '0.497292', '0.490097', '0.508732', '0.497491', '0.503907', '0.502519', '0.488416', '0.504671', '0.499511', '0.498049', '0.516363', '0.513268', '0.501702', '0.504761', '0.494985', '0.511543', '0.503507']
         : correct/total = [(7057, 14232), (7089, 14235), (6958, 14266), (7070, 14217), (6978, 14238), (7312, 14373), (7137, 14346), (7223, 14334), (7183, 14294), (7020, 14373), (7239, 14344), (7144, 14302), (7149, 14354), (7416, 14362), (7350, 14320), (7222, 14395), (7263, 14389), (7057, 14257), (7290, 14251), (7250, 14399)]
         : compromised: 0.5022, honest: 0.4980
Round 010: test acc mean=0.5036 ± 0.0060 | min=0.4943 max=0.5159
         : test loss mean=1.8964 ± 1.0943
         : individual accs = ['0.505340', '0.512469', '0.504416', '0.506436', '0.506040', '0.499548', '0.502161', '0.514441', '0.507206', '0.506853', '0.507878', '0.497483', '0.500836', '0.499025', '0.499441', '0.515874', '0.494266', '0.501718', '0.494492', '0.497048']
         : correct/total = [(7192, 14232), (7295, 14235), (7196, 14266), (7200, 14217), (7205, 14238), (7180, 14373), (7204, 14346), (7374, 14334), (7250, 14294), (7285, 14373), (7285, 14344), (7115, 14302), (7189, 14354), (7167, 14362), (7152, 14320), (7426, 14395), (7112, 14389), (7153, 14257), (7047, 14251), (7157, 14399)]
         : compromised: 0.5027, honest: 0.5058

=== FINAL RESULTS ===
Dataset: sent140, Nodes: 20, Graph: erdos, Aggregation: krum
Attack: directed_deviation, 70.0% compromised
Final accuracy - Compromised: 0.5027, Honest: 0.5058
Overall test accuracy: mean=0.5036 ± 0.0060
