Device: cuda
Seed: 987654321
Loading 1 LEAF Sent140 train files...
LEAF Sent140 train: 254555 users, 908652 samples
Building vocabulary (max_size=10000)...
Vocabulary size: 10000
Loading 1 LEAF Sent140 test files...
LEAF Sent140 test: 254555 users, 286281 samples
Found 254555 train users, 254555 test users, 254555 common users
User sample counts range: 494 (max) to 1 (min)
Distributed ALL 254555 users across 20 clients
Users per client: 12727 (with 15 clients getting +1 user)
Train partition sizes: [44353, 44290, 44657, 44907, 44696, 45843, 45801, 45619, 45069, 45639, 45821, 45311, 45779, 46056, 45625, 45984, 46428, 44737, 45540, 46497]
Test partition sizes: [14232, 14235, 14266, 14217, 14238, 14373, 14346, 14334, 14294, 14373, 14344, 14302, 14354, 14362, 14320, 14395, 14389, 14257, 14251, 14399]
  Client 0: 44353 train samples, 2 unique classes
  Client 1: 44290 train samples, 2 unique classes
  Client 2: 44657 train samples, 2 unique classes
  Client 3: 44907 train samples, 2 unique classes
  Client 4: 44696 train samples, 2 unique classes
  Client 5: 45843 train samples, 2 unique classes
  Client 6: 45801 train samples, 2 unique classes
  Client 7: 45619 train samples, 2 unique classes
  Client 8: 45069 train samples, 2 unique classes
  Client 9: 45639 train samples, 2 unique classes
  Client 10: 45821 train samples, 2 unique classes
  Client 11: 45311 train samples, 2 unique classes
  Client 12: 45779 train samples, 2 unique classes
  Client 13: 46056 train samples, 2 unique classes
  Client 14: 45625 train samples, 2 unique classes
  Client 15: 45984 train samples, 2 unique classes
  Client 16: 46428 train samples, 2 unique classes
  Client 17: 44737 train samples, 2 unique classes
  Client 18: 45540 train samples, 2 unique classes
  Client 19: 46497 train samples, 2 unique classes
Will sample 4500 samples per client per epoch
Graph: erdos, nodes: 20, edges: 99
Degree statistics: avg=9.90, min=7, max=14
Attack: Compromised 6/20 nodes: [5, 12, 13, 14, 17, 18]
Attack type: backdoor, lambda: 1.0
Backdoor target label: 1, trigger size: 3
Model variant: baseline
Model parameters: 1,174,986
UBAR ALGORITHM (Two-Stage Byzantine-resilient)
  - Model dimension: 1,174,986 parameters
  - Rho parameter: 0.7
  - Stage 1: Distance-based filtering (select 70% closest neighbors)
  - Stage 2: Performance-based selection (loss comparison)
  - Complexity: O(deg(i)×d + deg(i)×inference)
Initial test acc across nodes: mean=0.4965 ± 0.0152
Backdoor attack: Created poisoned datasets for 6 compromised nodes
Round 001: test acc mean=0.5297 ± 0.0250 | min=0.4854 max=0.5769
         : test loss mean=11.7426 ± 17.5278
         : individual accs = ['0.519463', '0.576888', '0.519767', '0.523106', '0.563000', '0.499130', '0.509689', '0.530417', '0.553659', '0.562861', '0.549080', '0.558244', '0.509335', '0.510305', '0.503212', '0.524349', '0.551602', '0.503893', '0.485440', '0.539829']
         : correct/total = [(7393, 14232), (8212, 14235), (7415, 14266), (7437, 14217), (8016, 14238), (7174, 14373), (7312, 14346), (7603, 14334), (7914, 14294), (8090, 14373), (7876, 14344), (7984, 14302), (7311, 14354), (7329, 14362), (7206, 14320), (7548, 14395), (7937, 14389), (7184, 14257), (6918, 14251), (7773, 14399)]
         : compromised: 0.5019, honest: 0.5416
         : ubar stats = ['Node 0: s1=0.667, s2=0.125', 'Node 1: s1=0.700, s2=0.571', 'Node 2: s1=0.625, s2=0.800']...
Round 002: test acc mean=0.5080 ± 0.0233 | min=0.4861 max=0.5801
         : test loss mean=335.4115 ± 513.0425
         : individual accs = ['0.492903', '0.486266', '0.486051', '0.505873', '0.505829', '0.502400', '0.500836', '0.562858', '0.510914', '0.497113', '0.499024', '0.580059', '0.505155', '0.507659', '0.496439', '0.498576', '0.499757', '0.499825', '0.491685', '0.531426']
         : correct/total = [(7015, 14232), (6922, 14235), (6934, 14266), (7192, 14217), (7202, 14238), (7221, 14373), (7185, 14346), (8068, 14334), (7303, 14294), (7145, 14373), (7158, 14344), (8296, 14302), (7251, 14354), (7291, 14362), (7109, 14320), (7177, 14395), (7191, 14389), (7126, 14257), (7007, 14251), (7652, 14399)]
         : compromised: 0.5005, honest: 0.5112
         : ubar stats = ['Node 0: s1=0.667, s2=0.375', 'Node 1: s1=0.700, s2=0.643', 'Node 2: s1=0.625, s2=0.600']...
Round 003: test acc mean=0.4965 ± 0.0066 | min=0.4861 max=0.5085
         : test loss mean=25288.1723 ± 39422.8612
         : individual accs = ['0.489109', '0.486266', '0.486051', '0.508265', '0.494100', '0.501774', '0.497560', '0.496512', '0.488457', '0.493008', '0.499024', '0.492029', '0.497353', '0.489277', '0.498883', '0.498367', '0.499757', '0.501087', '0.505579', '0.508508']
         : correct/total = [(6961, 14232), (6922, 14235), (6934, 14266), (7226, 14217), (7035, 14238), (7212, 14373), (7138, 14346), (7117, 14334), (6982, 14294), (7086, 14373), (7158, 14344), (7037, 14302), (7139, 14354), (7027, 14362), (7144, 14320), (7174, 14395), (7191, 14389), (7144, 14257), (7205, 14251), (7322, 14399)]
         : compromised: 0.4990, honest: 0.4955
         : ubar stats = ['Node 0: s1=0.667, s2=0.375', 'Node 1: s1=0.700, s2=0.524', 'Node 2: s1=0.625, s2=0.667']...
Round 004: test acc mean=0.4964 ± 0.0069 | min=0.4861 max=0.5114
         : test loss mean=3593634.7322 ± 5880500.3834
         : individual accs = ['0.489109', '0.486266', '0.486051', '0.507632', '0.494100', '0.495234', '0.497560', '0.511441', '0.488946', '0.493008', '0.499024', '0.492029', '0.495332', '0.510235', '0.496508', '0.498367', '0.499757', '0.498071', '0.492808', '0.496562']
         : correct/total = [(6961, 14232), (6922, 14235), (6934, 14266), (7217, 14217), (7035, 14238), (7118, 14373), (7138, 14346), (7331, 14334), (6989, 14294), (7086, 14373), (7158, 14344), (7037, 14302), (7110, 14354), (7328, 14362), (7110, 14320), (7174, 14395), (7191, 14389), (7101, 14257), (7023, 14251), (7150, 14399)]
         : compromised: 0.4980, honest: 0.4957
         : ubar stats = ['Node 0: s1=0.667, s2=0.312', 'Node 1: s1=0.700, s2=0.464', 'Node 2: s1=0.625, s2=0.750']...
Round 005: test acc mean=0.4979 ± 0.0163 | min=0.4861 max=0.5654
         : test loss mean=187734077.3722 ± 288625667.3957
         : individual accs = ['0.489109', '0.486266', '0.486051', '0.492228', '0.494100', '0.498226', '0.497560', '0.565369', '0.488457', '0.493008', '0.499024', '0.492029', '0.491222', '0.487049', '0.501466', '0.498367', '0.499757', '0.498282', '0.504456', '0.496562']
         : correct/total = [(6961, 14232), (6922, 14235), (6934, 14266), (6998, 14217), (7035, 14238), (7161, 14373), (7138, 14346), (8104, 14334), (6982, 14294), (7086, 14373), (7158, 14344), (7037, 14302), (7051, 14354), (6995, 14362), (7181, 14320), (7174, 14395), (7191, 14389), (7104, 14257), (7189, 14251), (7150, 14399)]
         : compromised: 0.4968, honest: 0.4984
         : ubar stats = ['Node 0: s1=0.667, s2=0.275', 'Node 1: s1=0.700, s2=0.429', 'Node 2: s1=0.625, s2=0.720']...
Round 006: test acc mean=0.4971 ± 0.0073 | min=0.4861 max=0.5158
         : test loss mean=15342487673.7491 ± 23638382897.8288
         : individual accs = ['0.489109', '0.486266', '0.486051', '0.492228', '0.495224', '0.498156', '0.497560', '0.515767', '0.488457', '0.493008', '0.499024', '0.492099', '0.501881', '0.508007', '0.506774', '0.498367', '0.499757', '0.497720', '0.500246', '0.496354']
         : correct/total = [(6961, 14232), (6922, 14235), (6934, 14266), (6998, 14217), (7051, 14238), (7160, 14373), (7138, 14346), (7393, 14334), (6982, 14294), (7086, 14373), (7158, 14344), (7038, 14302), (7204, 14354), (7296, 14362), (7257, 14320), (7174, 14395), (7191, 14389), (7096, 14257), (7129, 14251), (7147, 14399)]
         : compromised: 0.5021, honest: 0.4949
         : ubar stats = ['Node 0: s1=0.667, s2=0.271', 'Node 1: s1=0.700, s2=0.452', 'Node 2: s1=0.625, s2=0.700']...
Round 007: test acc mean=0.4961 ± 0.0066 | min=0.4861 max=0.5089
         : test loss mean=1410427926922.3430 ± 2164350109423.5073
         : individual accs = ['0.489109', '0.486266', '0.486051', '0.492228', '0.494100', '0.492660', '0.497560', '0.495186', '0.488457', '0.493008', '0.499024', '0.492029', '0.494775', '0.507868', '0.505656', '0.498367', '0.499757', '0.508873', '0.505087', '0.496354']
         : correct/total = [(6961, 14232), (6922, 14235), (6934, 14266), (6998, 14217), (7035, 14238), (7081, 14373), (7138, 14346), (7098, 14334), (6982, 14294), (7086, 14373), (7158, 14344), (7037, 14302), (7102, 14354), (7294, 14362), (7241, 14320), (7174, 14395), (7191, 14389), (7255, 14257), (7198, 14251), (7147, 14399)]
         : compromised: 0.5025, honest: 0.4934
         : ubar stats = ['Node 0: s1=0.667, s2=0.250', 'Node 1: s1=0.700, s2=0.429', 'Node 2: s1=0.625, s2=0.743']...
Round 008: test acc mean=0.4958 ± 0.0061 | min=0.4861 max=0.5091
         : test loss mean=110207675689086.6250 ± 172675098758006.0625
         : individual accs = ['0.489109', '0.486266', '0.486051', '0.492228', '0.494100', '0.504140', '0.497560', '0.495186', '0.488457', '0.493008', '0.499024', '0.492029', '0.505922', '0.499861', '0.492109', '0.498367', '0.499757', '0.497019', '0.509087', '0.496354']
         : correct/total = [(6961, 14232), (6922, 14235), (6934, 14266), (6998, 14217), (7035, 14238), (7246, 14373), (7138, 14346), (7098, 14334), (6982, 14294), (7086, 14373), (7158, 14344), (7037, 14302), (7262, 14354), (7179, 14362), (7047, 14320), (7174, 14395), (7191, 14389), (7086, 14257), (7255, 14251), (7147, 14399)]
         : compromised: 0.5014, honest: 0.4934
         : ubar stats = ['Node 0: s1=0.667, s2=0.266', 'Node 1: s1=0.700, s2=0.429', 'Node 2: s1=0.625, s2=0.675']...
Round 009: test acc mean=0.4955 ± 0.0059 | min=0.4861 max=0.5086
         : test loss mean=8399181316682973.0000 ± 13127643275821260.0000
         : individual accs = ['0.489109', '0.486266', '0.486051', '0.492228', '0.494100', '0.497113', '0.497560', '0.495186', '0.488457', '0.493008', '0.499024', '0.492029', '0.508569', '0.507450', '0.494274', '0.498367', '0.499757', '0.494985', '0.501088', '0.496354']
         : correct/total = [(6961, 14232), (6922, 14235), (6934, 14266), (6998, 14217), (7035, 14238), (7145, 14373), (7138, 14346), (7098, 14334), (6982, 14294), (7086, 14373), (7158, 14344), (7037, 14302), (7300, 14354), (7288, 14362), (7078, 14320), (7174, 14395), (7191, 14389), (7057, 14257), (7141, 14251), (7147, 14399)]
         : compromised: 0.5006, honest: 0.4934
         : ubar stats = ['Node 0: s1=0.667, s2=0.333', 'Node 1: s1=0.700, s2=0.460', 'Node 2: s1=0.625, s2=0.689']...
Round 010: test acc mean=0.4965 ± 0.0061 | min=0.4861 max=0.5060
         : test loss mean=605274363126607616.0000 ± 933679236183585664.0000
         : individual accs = ['0.489109', '0.486266', '0.486051', '0.492228', '0.494100', '0.498991', '0.497560', '0.495186', '0.488457', '0.493008', '0.499024', '0.492029', '0.504737', '0.505640', '0.502933', '0.498367', '0.499757', '0.505997', '0.503544', '0.496354']
         : correct/total = [(6961, 14232), (6922, 14235), (6934, 14266), (6998, 14217), (7035, 14238), (7172, 14373), (7138, 14346), (7098, 14334), (6982, 14294), (7086, 14373), (7158, 14344), (7037, 14302), (7245, 14354), (7262, 14362), (7202, 14320), (7174, 14395), (7191, 14389), (7214, 14257), (7176, 14251), (7147, 14399)]
         : compromised: 0.5036, honest: 0.4934
         : ubar stats = ['Node 0: s1=0.667, s2=0.350', 'Node 1: s1=0.700, s2=0.514', 'Node 2: s1=0.625, s2=0.700']...

=== FINAL RESULTS ===
Dataset: sent140, Nodes: 20, Graph: erdos, Aggregation: ubar
Attack: backdoor, 30.0% compromised
Final accuracy - Compromised: 0.5036, Honest: 0.4934
Overall test accuracy: mean=0.4965 ± 0.0061

=== BACKDOOR ATTACK SUCCESS RATE (ASR) ===
Target label: 1
Trigger size: 3x3
Overall ASR: 0.9969 ± 0.0084
Honest nodes ASR: 1.0000 ± 0.0000
Compromised nodes ASR: 0.9897 ± 0.0126
Note: Higher ASR indicates more successful backdoor attack

=== UBAR SUMMARY ===
Node 0: stage1=0.667, stage2=0.350, overall=0.233
Node 1: stage1=0.700, stage2=0.514, overall=0.360
Node 2: stage1=0.625, stage2=0.700, overall=0.438
Node 3: stage1=0.571, stage2=0.525, overall=0.300
Node 4: stage1=0.667, stage2=0.433, overall=0.289
Node 5: stage1=0.700, stage2=1.000, overall=0.700
Node 6: stage1=0.667, stage2=0.225, overall=0.150
Node 7: stage1=0.636, stage2=0.271, overall=0.173
Node 8: stage1=0.571, stage2=0.325, overall=0.186
Node 9: stage1=0.636, stage2=0.386, overall=0.245
Node 10: stage1=0.625, stage2=0.460, overall=0.288
Node 11: stage1=0.667, stage2=0.312, overall=0.208
Node 12: stage1=0.667, stage2=1.000, overall=0.667
Node 13: stage1=0.667, stage2=1.000, overall=0.667
Node 14: stage1=0.643, stage2=1.000, overall=0.643
Node 15: stage1=0.667, stage2=0.350, overall=0.233
Node 16: stage1=0.571, stage2=0.675, overall=0.386
Node 17: stage1=0.625, stage2=1.000, overall=0.625
Node 18: stage1=0.667, stage2=1.000, overall=0.667
Node 19: stage1=0.700, stage2=0.271, overall=0.190

=== PARALLEL EXECUTION TIME (realistic for distributed system) ===
  COMMUNICATION (max across nodes):
    - Full model transfer: 0.000s (0.0%)
  COMPUTATION (max across nodes):
    - Distance computation: 0.060s (56.8%)
    - Loss computation: 0.032s (29.7%)
    - Aggregation: 0.014s (13.5%)
  TOTALS:
    - Total computation: 0.106s (100.0%)
    - Total communication: 0.000s (0.0%)
    - Total parallel time: 0.106s

=== PER-NODE AVERAGE TIME ===
  - Distance computation: 0.039s
  - Loss computation: 0.025s
  - Aggregation: 0.007s
  - Model transfer: 0.000s
  - Total per node: 0.072s

=== TOTAL COMPUTATIONAL WORK (sum across all nodes) ===
  - Total distance computation: 0.790s
  - Total loss computation: 0.505s
  - Total aggregation: 0.145s
  - Total model transfer: 0.000s
  - Grand total: 1.440s
  - Mean Stage 1 acceptance rate: 0.647
  - Mean Stage 2 acceptance rate: 0.590
  - Overall acceptance rate: 0.382

UBAR Algorithm Properties:
  - Model dimension: 1,174,986
  - Rho parameter: 0.7
  - Two-stage approach: Distance filtering + loss evaluation
  - Stage 1 selects: 70% of neighbors
  - Stage 2 uses: Training sample loss comparison
  - Theoretical complexity: O(deg(i)×d + deg(i)×inference)
  - Approach: UBAR paper implementation
