Device: cuda
Seed: 987654321
Loading 1 LEAF Sent140 train files...
LEAF Sent140 train: 254555 users, 908652 samples
Building vocabulary (max_size=10000)...
Vocabulary size: 10000
Loading 1 LEAF Sent140 test files...
LEAF Sent140 test: 254555 users, 286281 samples
Found 254555 train users, 254555 test users, 254555 common users
User sample counts range: 494 (max) to 1 (min)
Distributed ALL 254555 users across 20 clients
Users per client: 12727 (with 15 clients getting +1 user)
Train partition sizes: [44353, 44290, 44657, 44907, 44696, 45843, 45801, 45619, 45069, 45639, 45821, 45311, 45779, 46056, 45625, 45984, 46428, 44737, 45540, 46497]
Test partition sizes: [14232, 14235, 14266, 14217, 14238, 14373, 14346, 14334, 14294, 14373, 14344, 14302, 14354, 14362, 14320, 14395, 14389, 14257, 14251, 14399]
  Client 0: 44353 train samples, 2 unique classes
  Client 1: 44290 train samples, 2 unique classes
  Client 2: 44657 train samples, 2 unique classes
  Client 3: 44907 train samples, 2 unique classes
  Client 4: 44696 train samples, 2 unique classes
  Client 5: 45843 train samples, 2 unique classes
  Client 6: 45801 train samples, 2 unique classes
  Client 7: 45619 train samples, 2 unique classes
  Client 8: 45069 train samples, 2 unique classes
  Client 9: 45639 train samples, 2 unique classes
  Client 10: 45821 train samples, 2 unique classes
  Client 11: 45311 train samples, 2 unique classes
  Client 12: 45779 train samples, 2 unique classes
  Client 13: 46056 train samples, 2 unique classes
  Client 14: 45625 train samples, 2 unique classes
  Client 15: 45984 train samples, 2 unique classes
  Client 16: 46428 train samples, 2 unique classes
  Client 17: 44737 train samples, 2 unique classes
  Client 18: 45540 train samples, 2 unique classes
  Client 19: 46497 train samples, 2 unique classes
Will sample 4500 samples per client per epoch
Graph: erdos, nodes: 20, edges: 99
Degree statistics: avg=9.90, min=7, max=14
Attack: Compromised 2/20 nodes: [5, 13]
Attack type: backdoor, lambda: 1.0
Backdoor target label: 1, trigger size: 3
Model variant: baseline
Model parameters: 1,174,986
Initial test acc across nodes: mean=0.4953 ± 0.0174
Backdoor attack: Created poisoned datasets for 2 compromised nodes
Round 001: test acc mean=0.6010 ± 0.0569 | min=0.4983 max=0.6475
         : test loss mean=8.4469 ± 16.0460
         : individual accs = ['0.637366', '0.647489', '0.610402', '0.614968', '0.623613', '0.637167', '0.502649', '0.622018', '0.500630', '0.641272', '0.643196', '0.498322', '0.642469', '0.642250', '0.507263', '0.617923', '0.639238', '0.639195', '0.641429', '0.512049']
         : correct/total = [(9071, 14232), (9217, 14235), (8708, 14266), (8743, 14217), (8879, 14238), (9158, 14373), (7211, 14346), (8916, 14334), (7156, 14294), (9217, 14373), (9226, 14344), (7127, 14302), (9222, 14354), (9224, 14362), (7264, 14320), (8895, 14395), (9198, 14389), (9113, 14257), (9141, 14251), (7373, 14399)]
         : compromised: 0.6397, honest: 0.5967
Round 002: test acc mean=0.6519 ± 0.0117 | min=0.6264 max=0.6680
         : test loss mean=0.6216 ± 0.0087
         : individual accs = ['0.654933', '0.660274', '0.656596', '0.659703', '0.663085', '0.658109', '0.648125', '0.650551', '0.667973', '0.636193', '0.655535', '0.650189', '0.636826', '0.640092', '0.626397', '0.659048', '0.655709', '0.662622', '0.630061', '0.666782']
         : correct/total = [(9321, 14232), (9399, 14235), (9367, 14266), (9379, 14217), (9441, 14238), (9459, 14373), (9298, 14346), (9325, 14334), (9548, 14294), (9144, 14373), (9403, 14344), (9299, 14302), (9141, 14354), (9193, 14362), (8970, 14320), (9487, 14395), (9435, 14389), (9447, 14257), (8979, 14251), (9601, 14399)]
         : compromised: 0.6491, honest: 0.6523
Round 003: test acc mean=0.6638 ± 0.0136 | min=0.6394 max=0.6823
         : test loss mean=0.6120 ± 0.0119
         : individual accs = ['0.640458', '0.682262', '0.639352', '0.677569', '0.644473', '0.675085', '0.652795', '0.672318', '0.653141', '0.671885', '0.677775', '0.639771', '0.672565', '0.672608', '0.669344', '0.668010', '0.658281', '0.664796', '0.666550', '0.676228']
         : correct/total = [(9115, 14232), (9712, 14235), (9121, 14266), (9633, 14217), (9176, 14238), (9703, 14373), (9365, 14346), (9637, 14334), (9336, 14294), (9657, 14373), (9722, 14344), (9150, 14302), (9654, 14354), (9660, 14362), (9585, 14320), (9616, 14395), (9472, 14389), (9478, 14257), (9499, 14251), (9737, 14399)]
         : compromised: 0.6738, honest: 0.6626
Round 004: test acc mean=0.6786 ± 0.0061 | min=0.6678 max=0.6925
         : test loss mean=0.5935 ± 0.0055
         : individual accs = ['0.678260', '0.672006', '0.672298', '0.686502', '0.683102', '0.680164', '0.680259', '0.678178', '0.678047', '0.667780', '0.684886', '0.679905', '0.677929', '0.684027', '0.669902', '0.673359', '0.677601', '0.684015', '0.670690', '0.692479']
         : correct/total = [(9653, 14232), (9566, 14235), (9591, 14266), (9760, 14217), (9726, 14238), (9776, 14373), (9759, 14346), (9721, 14334), (9692, 14294), (9598, 14373), (9824, 14344), (9724, 14302), (9731, 14354), (9824, 14362), (9593, 14320), (9693, 14395), (9750, 14389), (9752, 14257), (9558, 14251), (9971, 14399)]
         : compromised: 0.6821, honest: 0.6782
Round 005: test acc mean=0.6865 ± 0.0074 | min=0.6666 max=0.6973
         : test loss mean=0.5859 ± 0.0088
         : individual accs = ['0.686130', '0.674394', '0.677415', '0.680453', '0.687667', '0.697349', '0.688973', '0.687735', '0.687911', '0.689279', '0.694855', '0.688435', '0.691933', '0.695934', '0.688617', '0.666620', '0.687539', '0.690047', '0.678198', '0.691159']
         : correct/total = [(9765, 14232), (9600, 14235), (9664, 14266), (9674, 14217), (9791, 14238), (10023, 14373), (9884, 14346), (9858, 14334), (9833, 14294), (9907, 14373), (9967, 14344), (9846, 14302), (9932, 14354), (9995, 14362), (9861, 14320), (9596, 14395), (9893, 14389), (9838, 14257), (9665, 14251), (9952, 14399)]
         : compromised: 0.6966, honest: 0.6854
Round 006: test acc mean=0.6910 ± 0.0083 | min=0.6759 max=0.7082
         : test loss mean=0.5781 ± 0.0062
         : individual accs = ['0.680649', '0.708184', '0.687158', '0.680805', '0.690195', '0.694775', '0.694549', '0.683619', '0.692738', '0.689905', '0.688511', '0.680674', '0.694789', '0.692313', '0.699721', '0.697117', '0.697477', '0.705899', '0.684584', '0.675950']
         : correct/total = [(9687, 14232), (10081, 14235), (9803, 14266), (9679, 14217), (9827, 14238), (9986, 14373), (9964, 14346), (9799, 14334), (9902, 14294), (9916, 14373), (9876, 14344), (9735, 14302), (9973, 14354), (9943, 14362), (10020, 14320), (10035, 14395), (10036, 14389), (10064, 14257), (9756, 14251), (9733, 14399)]
         : compromised: 0.6935, honest: 0.6907
Round 007: test acc mean=0.7050 ± 0.0068 | min=0.6934 max=0.7198
         : test loss mean=0.5652 ± 0.0085
         : individual accs = ['0.697302', '0.719845', '0.704753', '0.699374', '0.713021', '0.711682', '0.700056', '0.708804', '0.699734', '0.705698', '0.707055', '0.706964', '0.715689', '0.707701', '0.693436', '0.698854', '0.699632', '0.711510', '0.698828', '0.699146']
         : correct/total = [(9924, 14232), (10247, 14235), (10054, 14266), (9943, 14217), (10152, 14238), (10229, 14373), (10043, 14346), (10160, 14334), (10002, 14294), (10143, 14373), (10142, 14344), (10111, 14302), (10273, 14354), (10164, 14362), (9930, 14320), (10060, 14395), (10067, 14389), (10144, 14257), (9959, 14251), (10067, 14399)]
         : compromised: 0.7097, honest: 0.7044
Round 008: test acc mean=0.6997 ± 0.0068 | min=0.6878 max=0.7169
         : test loss mean=0.5723 ± 0.0111
         : individual accs = ['0.690416', '0.714015', '0.697112', '0.696349', '0.705998', '0.702150', '0.695873', '0.696596', '0.716944', '0.697349', '0.698480', '0.701161', '0.703010', '0.700251', '0.694553', '0.687808', '0.696921', '0.701690', '0.693285', '0.703799']
         : correct/total = [(9826, 14232), (10164, 14235), (9945, 14266), (9900, 14217), (10052, 14238), (10092, 14373), (9983, 14346), (9985, 14334), (10248, 14294), (10023, 14373), (10019, 14344), (10028, 14302), (10091, 14354), (10057, 14362), (9946, 14320), (9901, 14395), (10028, 14389), (10004, 14257), (9880, 14251), (10134, 14399)]
         : compromised: 0.7012, honest: 0.6995
Round 009: test acc mean=0.7088 ± 0.0061 | min=0.6965 max=0.7172
         : test loss mean=0.5600 ± 0.0063
         : individual accs = ['0.711495', '0.717246', '0.705103', '0.712246', '0.716463', '0.699367', '0.707723', '0.700572', '0.696516', '0.714465', '0.700990', '0.711719', '0.711021', '0.714733', '0.708589', '0.712400', '0.717076', '0.704286', '0.710406', '0.703660']
         : correct/total = [(10126, 14232), (10210, 14235), (10059, 14266), (10126, 14217), (10201, 14238), (10052, 14373), (10153, 14346), (10042, 14334), (9956, 14294), (10269, 14373), (10055, 14344), (10179, 14302), (10206, 14354), (10265, 14362), (10147, 14320), (10255, 14395), (10318, 14389), (10041, 14257), (10124, 14251), (10132, 14399)]
         : compromised: 0.7071, honest: 0.7090
Round 010: test acc mean=0.7209 ± 0.0047 | min=0.7119 max=0.7294
         : test loss mean=0.5462 ± 0.0068
         : individual accs = ['0.719786', '0.724412', '0.717931', '0.715341', '0.722714', '0.723649', '0.713300', '0.724222', '0.714146', '0.711890', '0.715282', '0.725353', '0.725024', '0.729425', '0.723115', '0.723168', '0.724512', '0.724416', '0.717494', '0.721995']
         : correct/total = [(10244, 14232), (10312, 14235), (10242, 14266), (10170, 14217), (10290, 14238), (10401, 14373), (10233, 14346), (10381, 14334), (10208, 14294), (10232, 14373), (10260, 14344), (10374, 14302), (10407, 14354), (10476, 14362), (10355, 14320), (10410, 14395), (10425, 14389), (10328, 14257), (10225, 14251), (10396, 14399)]
         : compromised: 0.7265, honest: 0.7202

=== FINAL RESULTS ===
Dataset: sent140, Nodes: 20, Graph: erdos, Aggregation: krum
Attack: backdoor, 10.0% compromised
Final accuracy - Compromised: 0.7265, Honest: 0.7202
Overall test accuracy: mean=0.7209 ± 0.0047

=== BACKDOOR ATTACK SUCCESS RATE (ASR) ===
Target label: 1
Trigger size: 3x3
Overall ASR: 0.4597 ± 0.0576
Honest nodes ASR: 0.4558 ± 0.0592
Compromised nodes ASR: 0.4946 ± 0.0178
Note: Higher ASR indicates more successful backdoor attack
