Device: cuda
Seed: 987654321
Loading 1 LEAF Sent140 train files...
LEAF Sent140 train: 254555 users, 908652 samples
Building vocabulary (max_size=10000)...
Vocabulary size: 10000
Loading 1 LEAF Sent140 test files...
LEAF Sent140 test: 254555 users, 286281 samples
Found 254555 train users, 254555 test users, 254555 common users
User sample counts range: 494 (max) to 1 (min)
Distributed ALL 254555 users across 20 clients
Users per client: 12727 (with 15 clients getting +1 user)
Train partition sizes: [44353, 44290, 44657, 44907, 44696, 45843, 45801, 45619, 45069, 45639, 45821, 45311, 45779, 46056, 45625, 45984, 46428, 44737, 45540, 46497]
Test partition sizes: [14232, 14235, 14266, 14217, 14238, 14373, 14346, 14334, 14294, 14373, 14344, 14302, 14354, 14362, 14320, 14395, 14389, 14257, 14251, 14399]
  Client 0: 44353 train samples, 2 unique classes
  Client 1: 44290 train samples, 2 unique classes
  Client 2: 44657 train samples, 2 unique classes
  Client 3: 44907 train samples, 2 unique classes
  Client 4: 44696 train samples, 2 unique classes
  Client 5: 45843 train samples, 2 unique classes
  Client 6: 45801 train samples, 2 unique classes
  Client 7: 45619 train samples, 2 unique classes
  Client 8: 45069 train samples, 2 unique classes
  Client 9: 45639 train samples, 2 unique classes
  Client 10: 45821 train samples, 2 unique classes
  Client 11: 45311 train samples, 2 unique classes
  Client 12: 45779 train samples, 2 unique classes
  Client 13: 46056 train samples, 2 unique classes
  Client 14: 45625 train samples, 2 unique classes
  Client 15: 45984 train samples, 2 unique classes
  Client 16: 46428 train samples, 2 unique classes
  Client 17: 44737 train samples, 2 unique classes
  Client 18: 45540 train samples, 2 unique classes
  Client 19: 46497 train samples, 2 unique classes
Will sample 4500 samples per client per epoch
Graph: erdos, nodes: 20, edges: 126
Degree statistics: avg=12.60, min=8, max=16
Attack: Compromised 10/20 nodes: [1, 2, 5, 11, 12, 13, 14, 15, 17, 18]
Attack type: backdoor, lambda: 1.0
Backdoor target label: 1, trigger size: 3
Model variant: baseline
Model parameters: 1,174,986
Sketchguard Node 0:
  Model dim: 1,174,986 → Sketch size: 180
  Compression ratio: 6527.7x
  Using model parameters for aggregation, sketches for filtering
Sketchguard Node 1:
  Model dim: 1,174,986 → Sketch size: 180
  Compression ratio: 6527.7x
  Using model parameters for aggregation, sketches for filtering
Sketchguard Node 2:
  Model dim: 1,174,986 → Sketch size: 180
  Compression ratio: 6527.7x
  Using model parameters for aggregation, sketches for filtering
Sketchguard Node 3:
  Model dim: 1,174,986 → Sketch size: 180
  Compression ratio: 6527.7x
  Using model parameters for aggregation, sketches for filtering
Sketchguard Node 4:
  Model dim: 1,174,986 → Sketch size: 180
  Compression ratio: 6527.7x
  Using model parameters for aggregation, sketches for filtering
Sketchguard Node 5:
  Model dim: 1,174,986 → Sketch size: 180
  Compression ratio: 6527.7x
  Using model parameters for aggregation, sketches for filtering
Sketchguard Node 6:
  Model dim: 1,174,986 → Sketch size: 180
  Compression ratio: 6527.7x
  Using model parameters for aggregation, sketches for filtering
Sketchguard Node 7:
  Model dim: 1,174,986 → Sketch size: 180
  Compression ratio: 6527.7x
  Using model parameters for aggregation, sketches for filtering
Sketchguard Node 8:
  Model dim: 1,174,986 → Sketch size: 180
  Compression ratio: 6527.7x
  Using model parameters for aggregation, sketches for filtering
Sketchguard Node 9:
  Model dim: 1,174,986 → Sketch size: 180
  Compression ratio: 6527.7x
  Using model parameters for aggregation, sketches for filtering
Sketchguard Node 10:
  Model dim: 1,174,986 → Sketch size: 180
  Compression ratio: 6527.7x
  Using model parameters for aggregation, sketches for filtering
Sketchguard Node 11:
  Model dim: 1,174,986 → Sketch size: 180
  Compression ratio: 6527.7x
  Using model parameters for aggregation, sketches for filtering
Sketchguard Node 12:
  Model dim: 1,174,986 → Sketch size: 180
  Compression ratio: 6527.7x
  Using model parameters for aggregation, sketches for filtering
Sketchguard Node 13:
  Model dim: 1,174,986 → Sketch size: 180
  Compression ratio: 6527.7x
  Using model parameters for aggregation, sketches for filtering
Sketchguard Node 14:
  Model dim: 1,174,986 → Sketch size: 180
  Compression ratio: 6527.7x
  Using model parameters for aggregation, sketches for filtering
Sketchguard Node 15:
  Model dim: 1,174,986 → Sketch size: 180
  Compression ratio: 6527.7x
  Using model parameters for aggregation, sketches for filtering
Sketchguard Node 16:
  Model dim: 1,174,986 → Sketch size: 180
  Compression ratio: 6527.7x
  Using model parameters for aggregation, sketches for filtering
Sketchguard Node 17:
  Model dim: 1,174,986 → Sketch size: 180
  Compression ratio: 6527.7x
  Using model parameters for aggregation, sketches for filtering
Sketchguard Node 18:
  Model dim: 1,174,986 → Sketch size: 180
  Compression ratio: 6527.7x
  Using model parameters for aggregation, sketches for filtering
Sketchguard Node 19:
  Model dim: 1,174,986 → Sketch size: 180
  Compression ratio: 6527.7x
  Using model parameters for aggregation, sketches for filtering
Sketchguard ALGORITHM (Sketch-based Filtering + State Aggregation)
  - Model dimension: 1,174,986 parameters
  - Config: SketchguardConfig(gamma=2, kappa=1, alpha=0.5, min_neighbors=1, sketch_size=180, network_seed=987654321, attack_detection_window=5)
  - Sketch size: 180
  - Compression ratio: 6527.7x
  - Complexity: O(d + N×k) = O(1,174,986 + 20×180)
  - Theoretical speedup vs BALANCE: 19.9x
Initial test acc across nodes: mean=0.4953 ± 0.0174
Backdoor attack: Created poisoned datasets for 10 compromised nodes
Round 001: test acc mean=0.5043 ± 0.0124 | min=0.4763 max=0.5259
         : test loss mean=22.4218 ± 22.8335
         : individual accs = ['0.495292', '0.508535', '0.510865', '0.518604', '0.483846', '0.520142', '0.499930', '0.504395', '0.500909', '0.525917', '0.502789', '0.508810', '0.517277', '0.508564', '0.508380', '0.505523', '0.476267', '0.508733', '0.497930', '0.482672']
         : correct/total = [(7049, 14232), (7239, 14235), (7288, 14266), (7373, 14217), (6889, 14238), (7476, 14373), (7172, 14346), (7230, 14334), (7160, 14294), (7559, 14373), (7212, 14344), (7277, 14302), (7425, 14354), (7304, 14362), (7280, 14320), (7277, 14395), (6853, 14389), (7253, 14257), (7096, 14251), (6950, 14399)]
         : compromised: 0.5095, honest: 0.4991
         : sketchguard stats = ['Node 0: acc_rate=1.000', 'Node 1: acc_rate=1.000', 'Node 2: acc_rate=1.000']...
Round 002: test acc mean=0.5267 ± 0.0333 | min=0.4918 max=0.6030
         : test loss mean=348.7861 ± 363.5315
         : individual accs = ['0.592397', '0.512891', '0.506869', '0.511500', '0.563703', '0.495721', '0.553395', '0.603042', '0.547712', '0.513811', '0.535555', '0.506642', '0.493660', '0.491784', '0.496927', '0.499201', '0.563903', '0.502280', '0.497719', '0.545038']
         : correct/total = [(8431, 14232), (7301, 14235), (7231, 14266), (7272, 14217), (8026, 14238), (7125, 14373), (7939, 14346), (8644, 14334), (7829, 14294), (7385, 14373), (7682, 14344), (7246, 14302), (7086, 14354), (7063, 14362), (7116, 14320), (7186, 14395), (8114, 14389), (7161, 14257), (7093, 14251), (7848, 14399)]
         : compromised: 0.5004, honest: 0.5530
         : sketchguard stats = ['Node 0: acc_rate=0.750', 'Node 1: acc_rate=1.000', 'Node 2: acc_rate=1.000']...
Round 003: test acc mean=0.5425 ± 0.0472 | min=0.4873 max=0.6220
         : test loss mean=10821.7985 ± 12023.1266
         : individual accs = ['0.583895', '0.489568', '0.500701', '0.600056', '0.621997', '0.493008', '0.605674', '0.556997', '0.581013', '0.610659', '0.598438', '0.506433', '0.497422', '0.505918', '0.507612', '0.506773', '0.569463', '0.502280', '0.487334', '0.525523']
         : correct/total = [(8310, 14232), (6969, 14235), (7143, 14266), (8531, 14217), (8856, 14238), (7086, 14373), (8689, 14346), (7984, 14334), (8305, 14294), (8777, 14373), (8584, 14344), (7243, 14302), (7140, 14354), (7266, 14362), (7269, 14320), (7295, 14395), (8194, 14389), (7161, 14257), (6945, 14251), (7567, 14399)]
         : compromised: 0.4997, honest: 0.5854
         : sketchguard stats = ['Node 0: acc_rate=0.667', 'Node 1: acc_rate=1.000', 'Node 2: acc_rate=1.000']...
Round 004: test acc mean=0.5640 ± 0.0654 | min=0.4840 max=0.6397
         : test loss mean=2475420.1412 ± 2860751.9173
         : individual accs = ['0.626546', '0.509308', '0.488855', '0.633537', '0.639697', '0.483963', '0.637251', '0.633250', '0.610396', '0.616364', '0.625488', '0.507272', '0.498816', '0.512255', '0.504888', '0.492115', '0.627771', '0.497931', '0.497439', '0.637683']
         : correct/total = [(8917, 14232), (7250, 14235), (6974, 14266), (9007, 14217), (9108, 14238), (6956, 14373), (9142, 14346), (9077, 14334), (8725, 14294), (8859, 14373), (8972, 14344), (7255, 14302), (7160, 14354), (7357, 14362), (7230, 14320), (7084, 14395), (9033, 14389), (7099, 14257), (7089, 14251), (9182, 14399)]
         : compromised: 0.4993, honest: 0.6288
         : sketchguard stats = ['Node 0: acc_rate=0.625', 'Node 1: acc_rate=1.000', 'Node 2: acc_rate=1.000']...
Round 005: test acc mean=0.5722 ± 0.0709 | min=0.4895 max=0.6507
         : test loss mean=60671481.9360 ± 69687930.9535
         : individual accs = ['0.644393', '0.514506', '0.499299', '0.643385', '0.650723', '0.501426', '0.642618', '0.648388', '0.646425', '0.620747', '0.636294', '0.507971', '0.497562', '0.490322', '0.504399', '0.489476', '0.649593', '0.498141', '0.515543', '0.643447']
         : correct/total = [(9171, 14232), (7324, 14235), (7123, 14266), (9147, 14217), (9265, 14238), (7207, 14373), (9219, 14346), (9294, 14334), (9240, 14294), (8922, 14373), (9127, 14344), (7265, 14302), (7142, 14354), (7042, 14362), (7223, 14320), (7046, 14395), (9347, 14389), (7102, 14257), (7347, 14251), (9265, 14399)]
         : compromised: 0.5019, honest: 0.6426
         : sketchguard stats = ['Node 0: acc_rate=0.600', 'Node 1: acc_rate=1.000', 'Node 2: acc_rate=1.000']...
Round 006: test acc mean=0.5782 ± 0.0768 | min=0.4819 max=0.6606
         : test loss mean=3647523768.8941 ± 3914651975.5622
         : individual accs = ['0.653035', '0.481911', '0.510444', '0.650489', '0.656412', '0.498782', '0.658023', '0.660597', '0.656849', '0.650734', '0.647448', '0.502797', '0.503692', '0.499791', '0.496927', '0.504411', '0.658489', '0.513011', '0.505368', '0.655254']
         : correct/total = [(9294, 14232), (6860, 14235), (7282, 14266), (9248, 14217), (9346, 14238), (7169, 14373), (9440, 14346), (9469, 14334), (9389, 14294), (9353, 14373), (9287, 14344), (7191, 14302), (7230, 14354), (7178, 14362), (7116, 14320), (7261, 14395), (9475, 14389), (7314, 14257), (7202, 14251), (9435, 14399)]
         : compromised: 0.5017, honest: 0.6547
         : sketchguard stats = ['Node 0: acc_rate=0.583', 'Node 1: acc_rate=1.000', 'Node 2: acc_rate=1.000']...
Round 007: test acc mean=0.5820 ± 0.0779 | min=0.4929 max=0.6663
         : test loss mean=366518978651.6447 ± 439406755376.2641
         : individual accs = ['0.660554', '0.501862', '0.506729', '0.658085', '0.662031', '0.512837', '0.665412', '0.652853', '0.660907', '0.657413', '0.656442', '0.516501', '0.504807', '0.492898', '0.496508', '0.506912', '0.666273', '0.503051', '0.501368', '0.656712']
         : correct/total = [(9401, 14232), (7144, 14235), (7229, 14266), (9356, 14217), (9426, 14238), (7371, 14373), (9546, 14346), (9358, 14334), (9447, 14294), (9449, 14373), (9416, 14344), (7387, 14302), (7246, 14354), (7079, 14362), (7110, 14320), (7297, 14395), (9587, 14389), (7172, 14257), (7145, 14251), (9456, 14399)]
         : compromised: 0.5043, honest: 0.6597
         : sketchguard stats = ['Node 0: acc_rate=0.571', 'Node 1: acc_rate=0.857', 'Node 2: acc_rate=0.857']...
Round 008: test acc mean=0.5826 ± 0.0840 | min=0.4845 max=0.6710
         : test loss mean=31691493482500.0625 ± 39517982906754.6328
         : individual accs = ['0.663505', '0.506849', '0.506659', '0.668073', '0.659994', '0.487094', '0.670988', '0.669597', '0.668392', '0.663814', '0.663134', '0.505174', '0.496238', '0.501044', '0.489804', '0.484543', '0.669122', '0.507260', '0.503684', '0.666852']
         : correct/total = [(9443, 14232), (7215, 14235), (7228, 14266), (9498, 14217), (9397, 14238), (7001, 14373), (9626, 14346), (9598, 14334), (9554, 14294), (9541, 14373), (9512, 14344), (7225, 14302), (7123, 14354), (7196, 14362), (7014, 14320), (6975, 14395), (9628, 14389), (7232, 14257), (7178, 14251), (9602, 14399)]
         : compromised: 0.4988, honest: 0.6663
         : sketchguard stats = ['Node 0: acc_rate=0.562', 'Node 1: acc_rate=0.750', 'Node 2: acc_rate=0.750']...
Round 009: test acc mean=0.5798 ± 0.0792 | min=0.4896 max=0.6696
         : test loss mean=2825749647091941.5000 ± 2964946870681811.0000
         : individual accs = ['0.631043', '0.512469', '0.505117', '0.668495', '0.660416', '0.490433', '0.644152', '0.662411', '0.669582', '0.658735', '0.654071', '0.503706', '0.501324', '0.491923', '0.512779', '0.499271', '0.669261', '0.489584', '0.505859', '0.664699']
         : correct/total = [(8981, 14232), (7295, 14235), (7206, 14266), (9504, 14217), (9403, 14238), (7049, 14373), (9241, 14346), (9495, 14334), (9571, 14294), (9468, 14373), (9382, 14344), (7204, 14302), (7196, 14354), (7065, 14362), (7343, 14320), (7187, 14395), (9630, 14389), (6980, 14257), (7209, 14251), (9571, 14399)]
         : compromised: 0.5012, honest: 0.6583
         : sketchguard stats = ['Node 0: acc_rate=0.556', 'Node 1: acc_rate=0.667', 'Node 2: acc_rate=0.667']...
Round 010: test acc mean=0.5885 ± 0.0880 | min=0.4874 max=0.6826
         : test loss mean=285121624770582112.0000 ± 332300384815294464.0000
         : individual accs = ['0.671726', '0.489498', '0.510444', '0.675248', '0.678887', '0.495373', '0.682629', '0.679573', '0.673919', '0.669102', '0.676102', '0.505174', '0.517695', '0.497354', '0.487360', '0.496492', '0.679130', '0.504945', '0.503894', '0.676436']
         : correct/total = [(9560, 14232), (6968, 14235), (7282, 14266), (9600, 14217), (9666, 14238), (7120, 14373), (9793, 14346), (9741, 14334), (9633, 14294), (9617, 14373), (9698, 14344), (7225, 14302), (7431, 14354), (7143, 14362), (6979, 14320), (7147, 14395), (9772, 14389), (7199, 14257), (7181, 14251), (9740, 14399)]
         : compromised: 0.5008, honest: 0.6763
         : sketchguard stats = ['Node 0: acc_rate=0.550', 'Node 1: acc_rate=0.600', 'Node 2: acc_rate=0.600']...

=== FINAL RESULTS ===
Dataset: sent140, Nodes: 20, Graph: erdos, Aggregation: sketchguard
Attack: backdoor, 50.0% compromised
Final accuracy - Compromised: 0.5008, Honest: 0.6763
Overall test accuracy: mean=0.5885 ± 0.0880

=== BACKDOOR ATTACK SUCCESS RATE (ASR) ===
Target label: 1
Trigger size: 3x3
Overall ASR: 0.7051 ± 0.2458
Honest nodes ASR: 0.4695 ± 0.0502
Compromised nodes ASR: 0.9407 ± 0.0852
Note: Higher ASR indicates more successful backdoor attack

=== Sketchguard SUMMARY ===
Node 0: acceptance=0.550
Node 1: acceptance=0.600
Node 2: acceptance=0.600
Node 3: acceptance=0.662
Node 4: acceptance=0.509
Node 5: acceptance=0.600
Node 6: acceptance=0.486
Node 7: acceptance=0.486
Node 8: acceptance=0.460
Node 9: acceptance=0.585
Node 10: acceptance=0.600
Node 11: acceptance=0.600
Node 12: acceptance=0.600
Node 13: acceptance=0.600
Node 14: acceptance=0.600
Node 15: acceptance=0.600
Node 16: acceptance=0.446
Node 17: acceptance=0.600
Node 18: acceptance=0.600
Node 19: acceptance=0.494

=== PARALLEL EXECUTION TIME (realistic for distributed system) ===
  COMMUNICATION (max across nodes):
    - Sketch transfer: 0.000s (0.0%)
    - Model fetch (accepted): 0.000s (0.0%)
  COMPUTATION (max across nodes):
    - Sketching: 0.431s (94.5%)
    - Filtering: 0.001s (0.2%)
    - Aggregation: 0.024s (5.2%)
  TOTALS:
    - Total computation: 0.456s (100.0%)
    - Total communication: 0.000s (0.0%)
    - Total parallel time: 0.456s

=== PER-NODE AVERAGE TIME ===
  - Sketching: 0.336s
  - Filtering: 0.001s
  - Aggregation: 0.015s
  - Sketch transfer: 0.000s
  - Model fetch: 0.000s
  - Total per node: 0.352s

=== TOTAL COMPUTATIONAL WORK (sum across all nodes) ===
  - Total sketching: 6.727s
  - Total filtering: 0.013s
  - Total aggregation: 0.298s
  - Total sketch transfer: 0.000s
  - Total model fetch: 0.000s
  - Grand total: 7.038s
  - Mean acceptance rate: 0.564

Sketchguard Algorithm Properties:
  - Original dimension: 1,174,986
  - Sketch size: 180
  - Compression ratio: 19.9x
  - Single repetition: No repetitions needed
  - Theoretical complexity: O(d + N×k)
  - Approach: Sketch filtering + state aggregation
