Device: cuda
Seed: 987654321
Loading 1 LEAF Sent140 train files...
LEAF Sent140 train: 254555 users, 908652 samples
Building vocabulary (max_size=10000)...
Vocabulary size: 10000
Loading 1 LEAF Sent140 test files...
LEAF Sent140 test: 254555 users, 286281 samples
Found 254555 train users, 254555 test users, 254555 common users
User sample counts range: 494 (max) to 1 (min)
Distributed ALL 254555 users across 20 clients
Users per client: 12727 (with 15 clients getting +1 user)
Train partition sizes: [44353, 44290, 44657, 44907, 44696, 45843, 45801, 45619, 45069, 45639, 45821, 45311, 45779, 46056, 45625, 45984, 46428, 44737, 45540, 46497]
Test partition sizes: [14232, 14235, 14266, 14217, 14238, 14373, 14346, 14334, 14294, 14373, 14344, 14302, 14354, 14362, 14320, 14395, 14389, 14257, 14251, 14399]
  Client 0: 44353 train samples, 2 unique classes
  Client 1: 44290 train samples, 2 unique classes
  Client 2: 44657 train samples, 2 unique classes
  Client 3: 44907 train samples, 2 unique classes
  Client 4: 44696 train samples, 2 unique classes
  Client 5: 45843 train samples, 2 unique classes
  Client 6: 45801 train samples, 2 unique classes
  Client 7: 45619 train samples, 2 unique classes
  Client 8: 45069 train samples, 2 unique classes
  Client 9: 45639 train samples, 2 unique classes
  Client 10: 45821 train samples, 2 unique classes
  Client 11: 45311 train samples, 2 unique classes
  Client 12: 45779 train samples, 2 unique classes
  Client 13: 46056 train samples, 2 unique classes
  Client 14: 45625 train samples, 2 unique classes
  Client 15: 45984 train samples, 2 unique classes
  Client 16: 46428 train samples, 2 unique classes
  Client 17: 44737 train samples, 2 unique classes
  Client 18: 45540 train samples, 2 unique classes
  Client 19: 46497 train samples, 2 unique classes
Will sample 4500 samples per client per epoch
Graph: ring, nodes: 20, edges: 20
Degree statistics: avg=2.00, min=2, max=2
Model variant: baseline
Model parameters: 1,174,986
Sketchguard Node 0:
  Model dim: 1,174,986 → Sketch size: 180
  Compression ratio: 6527.7x
  Using model parameters for aggregation, sketches for filtering
Sketchguard Node 1:
  Model dim: 1,174,986 → Sketch size: 180
  Compression ratio: 6527.7x
  Using model parameters for aggregation, sketches for filtering
Sketchguard Node 2:
  Model dim: 1,174,986 → Sketch size: 180
  Compression ratio: 6527.7x
  Using model parameters for aggregation, sketches for filtering
Sketchguard Node 3:
  Model dim: 1,174,986 → Sketch size: 180
  Compression ratio: 6527.7x
  Using model parameters for aggregation, sketches for filtering
Sketchguard Node 4:
  Model dim: 1,174,986 → Sketch size: 180
  Compression ratio: 6527.7x
  Using model parameters for aggregation, sketches for filtering
Sketchguard Node 5:
  Model dim: 1,174,986 → Sketch size: 180
  Compression ratio: 6527.7x
  Using model parameters for aggregation, sketches for filtering
Sketchguard Node 6:
  Model dim: 1,174,986 → Sketch size: 180
  Compression ratio: 6527.7x
  Using model parameters for aggregation, sketches for filtering
Sketchguard Node 7:
  Model dim: 1,174,986 → Sketch size: 180
  Compression ratio: 6527.7x
  Using model parameters for aggregation, sketches for filtering
Sketchguard Node 8:
  Model dim: 1,174,986 → Sketch size: 180
  Compression ratio: 6527.7x
  Using model parameters for aggregation, sketches for filtering
Sketchguard Node 9:
  Model dim: 1,174,986 → Sketch size: 180
  Compression ratio: 6527.7x
  Using model parameters for aggregation, sketches for filtering
Sketchguard Node 10:
  Model dim: 1,174,986 → Sketch size: 180
  Compression ratio: 6527.7x
  Using model parameters for aggregation, sketches for filtering
Sketchguard Node 11:
  Model dim: 1,174,986 → Sketch size: 180
  Compression ratio: 6527.7x
  Using model parameters for aggregation, sketches for filtering
Sketchguard Node 12:
  Model dim: 1,174,986 → Sketch size: 180
  Compression ratio: 6527.7x
  Using model parameters for aggregation, sketches for filtering
Sketchguard Node 13:
  Model dim: 1,174,986 → Sketch size: 180
  Compression ratio: 6527.7x
  Using model parameters for aggregation, sketches for filtering
Sketchguard Node 14:
  Model dim: 1,174,986 → Sketch size: 180
  Compression ratio: 6527.7x
  Using model parameters for aggregation, sketches for filtering
Sketchguard Node 15:
  Model dim: 1,174,986 → Sketch size: 180
  Compression ratio: 6527.7x
  Using model parameters for aggregation, sketches for filtering
Sketchguard Node 16:
  Model dim: 1,174,986 → Sketch size: 180
  Compression ratio: 6527.7x
  Using model parameters for aggregation, sketches for filtering
Sketchguard Node 17:
  Model dim: 1,174,986 → Sketch size: 180
  Compression ratio: 6527.7x
  Using model parameters for aggregation, sketches for filtering
Sketchguard Node 18:
  Model dim: 1,174,986 → Sketch size: 180
  Compression ratio: 6527.7x
  Using model parameters for aggregation, sketches for filtering
Sketchguard Node 19:
  Model dim: 1,174,986 → Sketch size: 180
  Compression ratio: 6527.7x
  Using model parameters for aggregation, sketches for filtering
Sketchguard ALGORITHM (Sketch-based Filtering + State Aggregation)
  - Model dimension: 1,174,986 parameters
  - Config: SketchguardConfig(gamma=2, kappa=1, alpha=0.5, min_neighbors=1, sketch_size=180, network_seed=987654321, attack_detection_window=5)
  - Sketch size: 180
  - Compression ratio: 6527.7x
  - Complexity: O(d + N×k) = O(1,174,986 + 20×180)
  - Theoretical speedup vs BALANCE: 19.9x
Initial test acc across nodes: mean=0.4953 ± 0.0174
Round 001: test acc mean=0.5474 ± 0.0324 | min=0.5012 max=0.6236
         : test loss mean=0.6901 ± 0.0013
         : individual accs = ['0.583263', '0.623604', '0.535118', '0.566575', '0.573676', '0.508592', '0.542590', '0.576531', '0.501189', '0.572254', '0.509481', '0.553419', '0.527658', '0.527712', '0.513059', '0.527405', '0.526583', '0.595778', '0.520525', '0.563650']
         : correct/total = [(8301, 14232), (8877, 14235), (7634, 14266), (8055, 14217), (8168, 14238), (7310, 14373), (7784, 14346), (8264, 14334), (7164, 14294), (8225, 14373), (7308, 14344), (7915, 14302), (7574, 14354), (7579, 14362), (7347, 14320), (7592, 14395), (7577, 14389), (8494, 14257), (7418, 14251), (8116, 14399)]
         : sketchguard stats = ['Node 0: acc_rate=1.000', 'Node 1: acc_rate=1.000', 'Node 2: acc_rate=1.000']...
Round 002: test acc mean=0.6059 ± 0.0291 | min=0.5405 max=0.6451
         : test loss mean=0.6775 ± 0.0039
         : individual accs = ['0.611790', '0.645100', '0.629679', '0.624886', '0.571990', '0.626035', '0.620731', '0.599484', '0.624108', '0.612537', '0.609244', '0.617816', '0.638080', '0.625679', '0.600978', '0.617576', '0.540482', '0.560777', '0.541366', '0.599347']
         : correct/total = [(8707, 14232), (9183, 14235), (8983, 14266), (8884, 14217), (8144, 14238), (8998, 14373), (8905, 14346), (8593, 14334), (8921, 14294), (8804, 14373), (8739, 14344), (8836, 14302), (9159, 14354), (8986, 14362), (8606, 14320), (8890, 14395), (7777, 14389), (7995, 14257), (7715, 14251), (8630, 14399)]
         : sketchguard stats = ['Node 0: acc_rate=1.000', 'Node 1: acc_rate=1.000', 'Node 2: acc_rate=1.000']...
Round 003: test acc mean=0.6240 ± 0.0117 | min=0.6030 max=0.6382
         : test loss mean=0.6636 ± 0.0040
         : individual accs = ['0.608839', '0.634633', '0.631501', '0.622565', '0.615255', '0.638211', '0.603025', '0.603181', '0.609417', '0.636471', '0.632390', '0.625717', '0.626794', '0.636610', '0.633799', '0.632650', '0.636875', '0.609525', '0.624588', '0.617196']
         : correct/total = [(8665, 14232), (9034, 14235), (9009, 14266), (8851, 14217), (8760, 14238), (9173, 14373), (8651, 14346), (8646, 14334), (8711, 14294), (9148, 14373), (9071, 14344), (8949, 14302), (8997, 14354), (9143, 14362), (9076, 14320), (9107, 14395), (9164, 14389), (8690, 14257), (8901, 14251), (8887, 14399)]
         : sketchguard stats = ['Node 0: acc_rate=1.000', 'Node 1: acc_rate=1.000', 'Node 2: acc_rate=1.000']...
Round 004: test acc mean=0.6369 ± 0.0074 | min=0.6217 max=0.6503
         : test loss mean=0.6535 ± 0.0054
         : individual accs = ['0.643690', '0.640674', '0.646011', '0.639727', '0.636185', '0.650317', '0.646661', '0.637366', '0.628585', '0.621652', '0.629880', '0.643057', '0.641285', '0.637098', '0.624441', '0.629733', '0.639516', '0.634986', '0.630272', '0.637822']
         : correct/total = [(9161, 14232), (9120, 14235), (9216, 14266), (9095, 14217), (9058, 14238), (9347, 14373), (9277, 14346), (9136, 14334), (8985, 14294), (8935, 14373), (9035, 14344), (9197, 14302), (9205, 14354), (9150, 14362), (8942, 14320), (9065, 14395), (9202, 14389), (9053, 14257), (8982, 14251), (9184, 14399)]
         : sketchguard stats = ['Node 0: acc_rate=1.000', 'Node 1: acc_rate=1.000', 'Node 2: acc_rate=1.000']...
Round 005: test acc mean=0.6396 ± 0.0079 | min=0.6212 max=0.6556
         : test loss mean=0.6492 ± 0.0054
         : individual accs = ['0.644252', '0.649245', '0.647203', '0.638250', '0.650091', '0.655604', '0.641851', '0.644691', '0.637400', '0.642733', '0.636015', '0.643476', '0.640240', '0.636262', '0.636313', '0.629871', '0.621169', '0.628463', '0.635885', '0.632683']
         : correct/total = [(9169, 14232), (9242, 14235), (9233, 14266), (9074, 14217), (9256, 14238), (9423, 14373), (9208, 14346), (9241, 14334), (9111, 14294), (9238, 14373), (9123, 14344), (9203, 14302), (9190, 14354), (9138, 14362), (9112, 14320), (9067, 14395), (8938, 14389), (8960, 14257), (9062, 14251), (9110, 14399)]
         : sketchguard stats = ['Node 0: acc_rate=1.000', 'Node 1: acc_rate=1.000', 'Node 2: acc_rate=1.000']...
Round 006: test acc mean=0.6423 ± 0.0088 | min=0.6209 max=0.6582
         : test loss mean=0.6433 ± 0.0062
         : individual accs = ['0.644393', '0.648823', '0.644539', '0.649434', '0.653533', '0.658248', '0.653632', '0.638203', '0.638170', '0.638141', '0.625070', '0.620892', '0.640588', '0.647055', '0.635615', '0.638902', '0.641393', '0.641369', '0.639604', '0.647476']
         : correct/total = [(9171, 14232), (9236, 14235), (9195, 14266), (9233, 14217), (9305, 14238), (9461, 14373), (9377, 14346), (9148, 14334), (9122, 14294), (9172, 14373), (8966, 14344), (8880, 14302), (9195, 14354), (9293, 14362), (9102, 14320), (9197, 14395), (9229, 14389), (9144, 14257), (9115, 14251), (9323, 14399)]
         : sketchguard stats = ['Node 0: acc_rate=1.000', 'Node 1: acc_rate=1.000', 'Node 2: acc_rate=1.000']...
Round 007: test acc mean=0.6446 ± 0.0097 | min=0.6207 max=0.6616
         : test loss mean=0.6383 ± 0.0051
         : individual accs = ['0.652473', '0.650088', '0.620707', '0.651755', '0.648757', '0.659918', '0.661578', '0.638552', '0.647125', '0.649482', '0.627161', '0.643337', '0.646788', '0.649840', '0.644134', '0.639319', '0.640767', '0.635688', '0.635464', '0.649906']
         : correct/total = [(9286, 14232), (9254, 14235), (8855, 14266), (9266, 14217), (9237, 14238), (9485, 14373), (9491, 14346), (9153, 14334), (9250, 14294), (9335, 14373), (8996, 14344), (9201, 14302), (9284, 14354), (9333, 14362), (9224, 14320), (9203, 14395), (9220, 14389), (9063, 14257), (9056, 14251), (9358, 14399)]
         : sketchguard stats = ['Node 0: acc_rate=1.000', 'Node 1: acc_rate=1.000', 'Node 2: acc_rate=1.000']...
Round 008: test acc mean=0.6470 ± 0.0087 | min=0.6194 max=0.6642
         : test loss mean=0.6352 ± 0.0044
         : individual accs = ['0.644533', '0.637092', '0.654844', '0.652036', '0.641101', '0.664232', '0.647846', '0.619436', '0.644396', '0.652404', '0.650934', '0.650399', '0.650272', '0.651720', '0.639735', '0.646752', '0.648064', '0.648453', '0.642551', '0.654143']
         : correct/total = [(9173, 14232), (9069, 14235), (9342, 14266), (9270, 14217), (9128, 14238), (9547, 14373), (9294, 14346), (8879, 14334), (9211, 14294), (9377, 14373), (9337, 14344), (9302, 14302), (9334, 14354), (9360, 14362), (9161, 14320), (9310, 14395), (9325, 14389), (9245, 14257), (9157, 14251), (9419, 14399)]
         : sketchguard stats = ['Node 0: acc_rate=1.000', 'Node 1: acc_rate=1.000', 'Node 2: acc_rate=1.000']...
Round 009: test acc mean=0.6511 ± 0.0085 | min=0.6299 max=0.6688
         : test loss mean=0.6314 ± 0.0055
         : individual accs = ['0.629918', '0.654162', '0.660732', '0.656819', '0.663295', '0.668823', '0.651401', '0.650760', '0.638799', '0.642733', '0.647936', '0.645364', '0.648321', '0.656663', '0.649232', '0.649878', '0.645146', '0.652522', '0.649709', '0.658935']
         : correct/total = [(8965, 14232), (9312, 14235), (9426, 14266), (9338, 14217), (9444, 14238), (9613, 14373), (9345, 14346), (9328, 14334), (9131, 14294), (9238, 14373), (9294, 14344), (9230, 14302), (9306, 14354), (9431, 14362), (9297, 14320), (9355, 14395), (9283, 14389), (9303, 14257), (9259, 14251), (9488, 14399)]
         : sketchguard stats = ['Node 0: acc_rate=1.000', 'Node 1: acc_rate=1.000', 'Node 2: acc_rate=1.000']...
Round 010: test acc mean=0.6590 ± 0.0063 | min=0.6506 max=0.6728
         : test loss mean=0.6248 ± 0.0049
         : individual accs = ['0.662943', '0.659501', '0.653442', '0.661180', '0.667509', '0.667641', '0.672801', '0.668969', '0.654610', '0.652265', '0.660206', '0.657530', '0.650899', '0.650606', '0.656494', '0.652171', '0.655779', '0.658694', '0.654340', '0.662060']
         : correct/total = [(9435, 14232), (9388, 14235), (9322, 14266), (9400, 14217), (9504, 14238), (9596, 14373), (9652, 14346), (9589, 14334), (9357, 14294), (9375, 14373), (9470, 14344), (9404, 14302), (9343, 14354), (9344, 14362), (9401, 14320), (9388, 14395), (9436, 14389), (9391, 14257), (9325, 14251), (9533, 14399)]
         : sketchguard stats = ['Node 0: acc_rate=1.000', 'Node 1: acc_rate=1.000', 'Node 2: acc_rate=1.000']...

=== FINAL RESULTS ===
Dataset: sent140, Nodes: 20, Graph: ring, Aggregation: sketchguard
Overall test accuracy: mean=0.6590 ± 0.0063

=== Sketchguard SUMMARY ===
Node 0: acceptance=1.000
Node 1: acceptance=1.000
Node 2: acceptance=1.000
Node 3: acceptance=1.000
Node 4: acceptance=1.000
Node 5: acceptance=1.000
Node 6: acceptance=1.000
Node 7: acceptance=1.000
Node 8: acceptance=1.000
Node 9: acceptance=1.000
Node 10: acceptance=1.000
Node 11: acceptance=1.000
Node 12: acceptance=1.000
Node 13: acceptance=1.000
Node 14: acceptance=1.000
Node 15: acceptance=1.000
Node 16: acceptance=1.000
Node 17: acceptance=1.000
Node 18: acceptance=1.000
Node 19: acceptance=1.000

=== PARALLEL EXECUTION TIME (realistic for distributed system) ===
  COMMUNICATION (max across nodes):
    - Sketch transfer: 0.000s (0.0%)
    - Model fetch (accepted): 0.000s (0.0%)
  COMPUTATION (max across nodes):
    - Sketching: 0.178s (92.5%)
    - Filtering: 0.001s (0.3%)
    - Aggregation: 0.014s (7.1%)
  TOTALS:
    - Total computation: 0.192s (100.0%)
    - Total communication: 0.000s (0.0%)
    - Total parallel time: 0.192s

=== PER-NODE AVERAGE TIME ===
  - Sketching: 0.161s
  - Filtering: 0.000s
  - Aggregation: 0.006s
  - Sketch transfer: 0.000s
  - Model fetch: 0.000s
  - Total per node: 0.167s

=== TOTAL COMPUTATIONAL WORK (sum across all nodes) ===
  - Total sketching: 3.213s
  - Total filtering: 0.006s
  - Total aggregation: 0.121s
  - Total sketch transfer: 0.000s
  - Total model fetch: 0.000s
  - Grand total: 3.341s
  - Mean acceptance rate: 1.000

Sketchguard Algorithm Properties:
  - Original dimension: 1,174,986
  - Sketch size: 180
  - Compression ratio: 19.9x
  - Single repetition: No repetitions needed
  - Theoretical complexity: O(d + N×k)
  - Approach: Sketch filtering + state aggregation
