Device: cuda
Seed: 987654321
Loading 1 LEAF Sent140 train files...
LEAF Sent140 train: 254555 users, 908652 samples
Building vocabulary (max_size=10000)...
Vocabulary size: 10000
Loading 1 LEAF Sent140 test files...
LEAF Sent140 test: 254555 users, 286281 samples
Found 254555 train users, 254555 test users, 254555 common users
User sample counts range: 494 (max) to 1 (min)
Distributed ALL 254555 users across 20 clients
Users per client: 12727 (with 15 clients getting +1 user)
Train partition sizes: [44353, 44290, 44657, 44907, 44696, 45843, 45801, 45619, 45069, 45639, 45821, 45311, 45779, 46056, 45625, 45984, 46428, 44737, 45540, 46497]
Test partition sizes: [14232, 14235, 14266, 14217, 14238, 14373, 14346, 14334, 14294, 14373, 14344, 14302, 14354, 14362, 14320, 14395, 14389, 14257, 14251, 14399]
  Client 0: 44353 train samples, 2 unique classes
  Client 1: 44290 train samples, 2 unique classes
  Client 2: 44657 train samples, 2 unique classes
  Client 3: 44907 train samples, 2 unique classes
  Client 4: 44696 train samples, 2 unique classes
  Client 5: 45843 train samples, 2 unique classes
  Client 6: 45801 train samples, 2 unique classes
  Client 7: 45619 train samples, 2 unique classes
  Client 8: 45069 train samples, 2 unique classes
  Client 9: 45639 train samples, 2 unique classes
  Client 10: 45821 train samples, 2 unique classes
  Client 11: 45311 train samples, 2 unique classes
  Client 12: 45779 train samples, 2 unique classes
  Client 13: 46056 train samples, 2 unique classes
  Client 14: 45625 train samples, 2 unique classes
  Client 15: 45984 train samples, 2 unique classes
  Client 16: 46428 train samples, 2 unique classes
  Client 17: 44737 train samples, 2 unique classes
  Client 18: 45540 train samples, 2 unique classes
  Client 19: 46497 train samples, 2 unique classes
Will sample 4500 samples per client per epoch
Graph: ring, nodes: 20, edges: 20
Degree statistics: avg=2.00, min=2, max=2
Attack: Compromised 10/20 nodes: [1, 2, 5, 11, 12, 13, 14, 15, 17, 18]
Attack type: directed_deviation, lambda: 1.0
Model variant: baseline
Model parameters: 1,174,986
Initial test acc across nodes: mean=0.4965 ± 0.0152
Round 001: test acc mean=0.5009 ± 0.0090 | min=0.4860 max=0.5276
         : test loss mean=8.7380 ± 10.7953
         : individual accs = ['0.492411', '0.509589', '0.508271', '0.510516', '0.498033', '0.493912', '0.500279', '0.485977', '0.527564', '0.504905', '0.492122', '0.499790', '0.500418', '0.507520', '0.505656', '0.490240', '0.498923', '0.497580', '0.495334', '0.498368']
         : correct/total = [(7008, 14232), (7254, 14235), (7251, 14266), (7258, 14217), (7091, 14238), (7099, 14373), (7177, 14346), (6966, 14334), (7541, 14294), (7257, 14373), (7059, 14344), (7148, 14302), (7183, 14354), (7289, 14362), (7241, 14320), (7057, 14395), (7179, 14389), (7094, 14257), (7059, 14251), (7176, 14399)]
         : compromised: 0.5008, honest: 0.5009
Round 002: test acc mean=0.5025 ± 0.0065 | min=0.4885 max=0.5122
         : test loss mean=6.6397 ± 4.7396
         : individual accs = ['0.502319', '0.507552', '0.493831', '0.510234', '0.512221', '0.501009', '0.498048', '0.503070', '0.488457', '0.508175', '0.500627', '0.502028', '0.494636', '0.498329', '0.496229', '0.511636', '0.509973', '0.506839', '0.507263', '0.497604']
         : correct/total = [(7149, 14232), (7225, 14235), (7045, 14266), (7254, 14217), (7293, 14238), (7201, 14373), (7145, 14346), (7211, 14334), (6982, 14294), (7304, 14373), (7181, 14344), (7180, 14302), (7100, 14354), (7157, 14362), (7106, 14320), (7365, 14395), (7338, 14389), (7226, 14257), (7229, 14251), (7165, 14399)]
         : compromised: 0.5019, honest: 0.5031
Round 003: test acc mean=0.4979 ± 0.0091 | min=0.4833 max=0.5130
         : test loss mean=2.1943 ± 1.2850
         : individual accs = ['0.512999', '0.490903', '0.483738', '0.508476', '0.501334', '0.483267', '0.500836', '0.512767', '0.509235', '0.510471', '0.497281', '0.495245', '0.491292', '0.489695', '0.500000', '0.485933', '0.498367', '0.493091', '0.494000', '0.499549']
         : correct/total = [(7301, 14232), (6988, 14235), (6901, 14266), (7229, 14217), (7138, 14238), (6946, 14373), (7185, 14346), (7350, 14334), (7279, 14294), (7337, 14373), (7133, 14344), (7083, 14302), (7052, 14354), (7033, 14362), (7160, 14320), (6995, 14395), (7171, 14389), (7030, 14257), (7040, 14251), (7193, 14399)]
         : compromised: 0.4907, honest: 0.5051
Round 004: test acc mean=0.5032 ± 0.0068 | min=0.4952 max=0.5205
         : test loss mean=4.5825 ± 3.5272
         : individual accs = ['0.495714', '0.508676', '0.499369', '0.496237', '0.499719', '0.520490', '0.496515', '0.508162', '0.497481', '0.516663', '0.501882', '0.500280', '0.508430', '0.506267', '0.495182', '0.498298', '0.500174', '0.501578', '0.506842', '0.506007']
         : correct/total = [(7055, 14232), (7241, 14235), (7124, 14266), (7055, 14217), (7115, 14238), (7481, 14373), (7123, 14346), (7284, 14334), (7111, 14294), (7426, 14373), (7199, 14344), (7155, 14302), (7298, 14354), (7271, 14362), (7091, 14320), (7173, 14395), (7197, 14389), (7151, 14257), (7223, 14251), (7286, 14399)]
         : compromised: 0.5045, honest: 0.5019
Round 005: test acc mean=0.5032 ± 0.0067 | min=0.4936 max=0.5179
         : test loss mean=2.1346 ± 1.5503
         : individual accs = ['0.516582', '0.503618', '0.498388', '0.504396', '0.497963', '0.499269', '0.497281', '0.502721', '0.511333', '0.511584', '0.498745', '0.495106', '0.507663', '0.517894', '0.500419', '0.498854', '0.498297', '0.493582', '0.503263', '0.507605']
         : correct/total = [(7352, 14232), (7169, 14235), (7110, 14266), (7171, 14217), (7090, 14238), (7176, 14373), (7134, 14346), (7206, 14334), (7309, 14294), (7353, 14373), (7154, 14344), (7081, 14302), (7287, 14354), (7438, 14362), (7166, 14320), (7181, 14395), (7170, 14389), (7037, 14257), (7172, 14251), (7309, 14399)]
         : compromised: 0.5018, honest: 0.5047
Round 006: test acc mean=0.5101 ± 0.0117 | min=0.4998 max=0.5509
         : test loss mean=3.5292 ± 2.7918
         : individual accs = ['0.508924', '0.511416', '0.507991', '0.516635', '0.508990', '0.517359', '0.504182', '0.511302', '0.550861', '0.529604', '0.500349', '0.503916', '0.501254', '0.505779', '0.499791', '0.501424', '0.501564', '0.506488', '0.502702', '0.511911']
         : correct/total = [(7243, 14232), (7280, 14235), (7247, 14266), (7345, 14217), (7247, 14238), (7436, 14373), (7233, 14346), (7329, 14334), (7874, 14294), (7612, 14373), (7177, 14344), (7207, 14302), (7195, 14354), (7264, 14362), (7157, 14320), (7218, 14395), (7217, 14389), (7221, 14257), (7164, 14251), (7371, 14399)]
         : compromised: 0.5058, honest: 0.5144
Round 007: test acc mean=0.5122 ± 0.0134 | min=0.4913 max=0.5478
         : test loss mean=1.7477 ± 1.1542
         : individual accs = ['0.521009', '0.503126', '0.492009', '0.508405', '0.513345', '0.522368', '0.509829', '0.533766', '0.547782', '0.510054', '0.496723', '0.491330', '0.507245', '0.514204', '0.498603', '0.517263', '0.516297', '0.515536', '0.501860', '0.523925']
         : correct/total = [(7415, 14232), (7162, 14235), (7019, 14266), (7228, 14217), (7309, 14238), (7508, 14373), (7314, 14346), (7651, 14334), (7830, 14294), (7331, 14373), (7125, 14344), (7027, 14302), (7281, 14354), (7385, 14362), (7140, 14320), (7446, 14395), (7429, 14389), (7350, 14257), (7152, 14251), (7544, 14399)]
         : compromised: 0.5064, honest: 0.5181
Round 008: test acc mean=0.5123 ± 0.0146 | min=0.4952 max=0.5593
         : test loss mean=2.7620 ± 2.1604
         : individual accs = ['0.518339', '0.499824', '0.495233', '0.514806', '0.508358', '0.515480', '0.508574', '0.510046', '0.559256', '0.545328', '0.506693', '0.502237', '0.506340', '0.504735', '0.502933', '0.507607', '0.506290', '0.508101', '0.507263', '0.517883']
         : correct/total = [(7377, 14232), (7115, 14235), (7065, 14266), (7319, 14217), (7238, 14238), (7409, 14373), (7296, 14346), (7311, 14334), (7994, 14294), (7838, 14373), (7268, 14344), (7183, 14302), (7268, 14354), (7249, 14362), (7202, 14320), (7307, 14395), (7285, 14389), (7244, 14257), (7229, 14251), (7457, 14399)]
         : compromised: 0.5050, honest: 0.5196
Round 009: test acc mean=0.5142 ± 0.0190 | min=0.4880 max=0.5701
         : test loss mean=1.7643 ± 1.1991
         : individual accs = ['0.538645', '0.502424', '0.488013', '0.512415', '0.519666', '0.523690', '0.511292', '0.541021', '0.570099', '0.501357', '0.502998', '0.493288', '0.505713', '0.516780', '0.500978', '0.503091', '0.506081', '0.507330', '0.502842', '0.535523']
         : correct/total = [(7666, 14232), (7152, 14235), (6962, 14266), (7285, 14217), (7399, 14238), (7527, 14373), (7335, 14346), (7755, 14334), (8149, 14294), (7206, 14373), (7215, 14344), (7055, 14302), (7259, 14354), (7422, 14362), (7174, 14320), (7242, 14395), (7282, 14389), (7233, 14257), (7166, 14251), (7711, 14399)]
         : compromised: 0.5044, honest: 0.5239
Round 010: test acc mean=0.5155 ± 0.0215 | min=0.4944 max=0.5765
         : test loss mean=2.4974 ± 2.1032
         : individual accs = ['0.519815', '0.501159', '0.497477', '0.516072', '0.512221', '0.507897', '0.509968', '0.539696', '0.576536', '0.569540', '0.507111', '0.497343', '0.494427', '0.504595', '0.504260', '0.511358', '0.506776', '0.508242', '0.506421', '0.518439']
         : correct/total = [(7398, 14232), (7134, 14235), (7097, 14266), (7337, 14217), (7293, 14238), (7300, 14373), (7316, 14346), (7736, 14334), (8241, 14294), (8186, 14373), (7274, 14344), (7113, 14302), (7097, 14354), (7247, 14362), (7221, 14320), (7361, 14395), (7292, 14389), (7246, 14257), (7217, 14251), (7465, 14399)]
         : compromised: 0.5033, honest: 0.5276

=== FINAL RESULTS ===
Dataset: sent140, Nodes: 20, Graph: ring, Aggregation: krum
Attack: directed_deviation, 50.0% compromised
Final accuracy - Compromised: 0.5033, Honest: 0.5276
Overall test accuracy: mean=0.5155 ± 0.0215
