Device: cuda
Seed: 987654321
Loading 1 LEAF Sent140 train files...
LEAF Sent140 train: 254555 users, 908652 samples
Building vocabulary (max_size=10000)...
Vocabulary size: 10000
Loading 1 LEAF Sent140 test files...
LEAF Sent140 test: 254555 users, 286281 samples
Found 254555 train users, 254555 test users, 254555 common users
User sample counts range: 494 (max) to 1 (min)
Distributed ALL 254555 users across 20 clients
Users per client: 12727 (with 15 clients getting +1 user)
Train partition sizes: [44353, 44290, 44657, 44907, 44696, 45843, 45801, 45619, 45069, 45639, 45821, 45311, 45779, 46056, 45625, 45984, 46428, 44737, 45540, 46497]
Test partition sizes: [14232, 14235, 14266, 14217, 14238, 14373, 14346, 14334, 14294, 14373, 14344, 14302, 14354, 14362, 14320, 14395, 14389, 14257, 14251, 14399]
  Client 0: 44353 train samples, 2 unique classes
  Client 1: 44290 train samples, 2 unique classes
  Client 2: 44657 train samples, 2 unique classes
  Client 3: 44907 train samples, 2 unique classes
  Client 4: 44696 train samples, 2 unique classes
  Client 5: 45843 train samples, 2 unique classes
  Client 6: 45801 train samples, 2 unique classes
  Client 7: 45619 train samples, 2 unique classes
  Client 8: 45069 train samples, 2 unique classes
  Client 9: 45639 train samples, 2 unique classes
  Client 10: 45821 train samples, 2 unique classes
  Client 11: 45311 train samples, 2 unique classes
  Client 12: 45779 train samples, 2 unique classes
  Client 13: 46056 train samples, 2 unique classes
  Client 14: 45625 train samples, 2 unique classes
  Client 15: 45984 train samples, 2 unique classes
  Client 16: 46428 train samples, 2 unique classes
  Client 17: 44737 train samples, 2 unique classes
  Client 18: 45540 train samples, 2 unique classes
  Client 19: 46497 train samples, 2 unique classes
Will sample 4500 samples per client per epoch
Graph: erdos, nodes: 20, edges: 48
Degree statistics: avg=4.80, min=2, max=7
Attack: Compromised 16/20 nodes: [1, 2, 3, 5, 6, 8, 9, 10, 11, 12, 13, 14, 15, 17, 18, 19]
Attack type: directed_deviation, lambda: 1.0
Model variant: baseline
Model parameters: 1,174,986
Initial test acc across nodes: mean=0.4965 ± 0.0152
Round 001: test acc mean=0.5011 ± 0.0063 | min=0.4856 max=0.5126
         : test loss mean=13.7617 ± 8.8236
         : individual accs = ['0.505972', '0.503196', '0.501682', '0.492650', '0.505619', '0.501496', '0.500906', '0.496372', '0.489156', '0.510193', '0.512619', '0.504825', '0.485579', '0.504317', '0.501816', '0.498367', '0.498923', '0.501298', '0.504456', '0.502049']
         : correct/total = [(7201, 14232), (7163, 14235), (7157, 14266), (7004, 14217), (7199, 14238), (7208, 14373), (7186, 14346), (7115, 14334), (6992, 14294), (7333, 14373), (7353, 14344), (7220, 14302), (6970, 14354), (7243, 14362), (7186, 14320), (7174, 14395), (7179, 14389), (7147, 14257), (7189, 14251), (7229, 14399)]
         : compromised: 0.5009, honest: 0.5017
Round 002: test acc mean=0.5006 ± 0.0061 | min=0.4876 max=0.5107
         : test loss mean=11.3374 ± 2.6967
         : individual accs = ['0.495714', '0.509097', '0.509743', '0.500879', '0.500913', '0.499826', '0.499721', '0.492326', '0.499091', '0.504835', '0.502301', '0.503566', '0.495750', '0.510653', '0.499162', '0.487600', '0.489402', '0.502981', '0.505017', '0.503924']
         : correct/total = [(7055, 14232), (7247, 14235), (7272, 14266), (7121, 14217), (7132, 14238), (7184, 14373), (7169, 14346), (7057, 14334), (7134, 14294), (7256, 14373), (7205, 14344), (7202, 14302), (7116, 14354), (7334, 14362), (7148, 14320), (7019, 14395), (7042, 14389), (7171, 14257), (7197, 14251), (7256, 14399)]
         : compromised: 0.5021, honest: 0.4946
Round 003: test acc mean=0.4983 ± 0.0070 | min=0.4883 max=0.5116
         : test loss mean=3.3167 ± 0.7493
         : individual accs = ['0.511523', '0.489919', '0.490327', '0.492509', '0.497472', '0.500313', '0.498188', '0.495535', '0.488317', '0.492799', '0.499024', '0.493358', '0.497353', '0.511628', '0.508659', '0.500590', '0.503649', '0.508592', '0.493229', '0.492743']
         : correct/total = [(7280, 14232), (6974, 14235), (6995, 14266), (7002, 14217), (7083, 14238), (7191, 14373), (7147, 14346), (7103, 14334), (6980, 14294), (7083, 14373), (7158, 14344), (7056, 14302), (7139, 14354), (7348, 14362), (7284, 14320), (7206, 14395), (7247, 14389), (7251, 14257), (7029, 14251), (7095, 14399)]
         : compromised: 0.4973, honest: 0.5020
Round 004: test acc mean=0.5092 ± 0.0066 | min=0.4973 max=0.5201
         : test loss mean=7.4588 ± 2.0681
         : individual accs = ['0.517917', '0.516684', '0.505678', '0.508265', '0.498946', '0.509984', '0.519030', '0.508581', '0.520078', '0.513671', '0.497281', '0.504615', '0.503832', '0.504665', '0.503003', '0.502813', '0.514351', '0.510065', '0.507473', '0.516772']
         : correct/total = [(7371, 14232), (7355, 14235), (7214, 14266), (7226, 14217), (7104, 14238), (7330, 14373), (7446, 14346), (7290, 14334), (7434, 14294), (7383, 14373), (7133, 14344), (7217, 14302), (7232, 14354), (7248, 14362), (7203, 14320), (7238, 14395), (7401, 14389), (7272, 14257), (7232, 14251), (7441, 14399)]
         : compromised: 0.5090, honest: 0.5099
Round 005: test acc mean=0.5035 ± 0.0082 | min=0.4873 max=0.5202
         : test loss mean=2.7759 ± 0.5263
         : individual accs = ['0.520236', '0.487320', '0.512267', '0.495885', '0.502177', '0.508732', '0.501882', '0.488070', '0.509235', '0.504557', '0.512688', '0.497902', '0.502299', '0.503760', '0.496997', '0.508510', '0.515741', '0.503682', '0.497860', '0.500590']
         : correct/total = [(7404, 14232), (6937, 14235), (7308, 14266), (7050, 14217), (7150, 14238), (7312, 14373), (7200, 14346), (6996, 14334), (7279, 14294), (7252, 14373), (7354, 14344), (7121, 14302), (7210, 14354), (7235, 14362), (7117, 14320), (7320, 14395), (7421, 14389), (7181, 14257), (7095, 14251), (7208, 14399)]
         : compromised: 0.5028, honest: 0.5066
Round 006: test acc mean=0.5004 ± 0.0067 | min=0.4876 max=0.5141
         : test loss mean=5.5907 ± 1.6021
         : individual accs = ['0.493676', '0.509238', '0.492009', '0.502005', '0.505829', '0.498156', '0.502161', '0.498256', '0.491325', '0.495443', '0.487591', '0.509090', '0.504528', '0.514065', '0.495880', '0.500174', '0.501008', '0.497861', '0.501298', '0.509133']
         : correct/total = [(7026, 14232), (7249, 14235), (7019, 14266), (7137, 14217), (7202, 14238), (7160, 14373), (7204, 14346), (7142, 14334), (7023, 14294), (7121, 14373), (6994, 14344), (7281, 14302), (7242, 14354), (7383, 14362), (7101, 14320), (7200, 14395), (7209, 14389), (7098, 14257), (7144, 14251), (7331, 14399)]
         : compromised: 0.5006, honest: 0.4997
Round 007: test acc mean=0.5019 ± 0.0076 | min=0.4935 max=0.5224
         : test loss mean=2.0682 ± 0.5360
         : individual accs = ['0.512437', '0.495469', '0.500701', '0.512344', '0.500913', '0.496208', '0.495399', '0.499791', '0.493494', '0.496139', '0.494771', '0.512026', '0.500279', '0.522351', '0.498673', '0.502466', '0.500521', '0.496107', '0.497088', '0.509966']
         : correct/total = [(7293, 14232), (7053, 14235), (7143, 14266), (7284, 14217), (7132, 14238), (7132, 14373), (7107, 14346), (7164, 14334), (7054, 14294), (7131, 14373), (7097, 14344), (7323, 14302), (7181, 14354), (7502, 14362), (7141, 14320), (7233, 14395), (7202, 14389), (7073, 14257), (7084, 14251), (7343, 14399)]
         : compromised: 0.5015, honest: 0.5034
Round 008: test acc mean=0.5045 ± 0.0033 | min=0.4982 max=0.5096
         : test loss mean=3.7194 ± 1.2784
         : individual accs = ['0.507097', '0.503758', '0.506940', '0.508194', '0.505829', '0.501287', '0.506064', '0.505232', '0.500770', '0.507340', '0.502022', '0.509649', '0.501254', '0.503760', '0.498603', '0.498229', '0.507262', '0.505296', '0.502140', '0.509619']
         : correct/total = [(7217, 14232), (7171, 14235), (7232, 14266), (7225, 14217), (7202, 14238), (7205, 14373), (7260, 14346), (7242, 14334), (7158, 14294), (7292, 14373), (7201, 14344), (7289, 14302), (7195, 14354), (7235, 14362), (7140, 14320), (7172, 14395), (7299, 14389), (7204, 14257), (7156, 14251), (7338, 14399)]
         : compromised: 0.5041, honest: 0.5064
Round 009: test acc mean=0.5006 ± 0.0065 | min=0.4809 max=0.5127
         : test loss mean=2.0360 ± 0.6978
         : individual accs = ['0.508713', '0.496874', '0.496846', '0.495534', '0.506251', '0.499896', '0.504113', '0.504395', '0.512733', '0.498504', '0.499512', '0.497413', '0.503483', '0.508007', '0.498045', '0.494269', '0.500799', '0.480887', '0.501789', '0.503368']
         : correct/total = [(7240, 14232), (7073, 14235), (7088, 14266), (7045, 14217), (7208, 14238), (7185, 14373), (7232, 14346), (7230, 14334), (7329, 14294), (7165, 14373), (7165, 14344), (7114, 14302), (7227, 14354), (7296, 14362), (7132, 14320), (7115, 14395), (7206, 14389), (6856, 14257), (7151, 14251), (7248, 14399)]
         : compromised: 0.4995, honest: 0.5050
Round 010: test acc mean=0.5054 ± 0.0060 | min=0.4921 max=0.5146
         : test loss mean=2.8198 ± 1.1504
         : individual accs = ['0.499016', '0.505163', '0.492079', '0.508405', '0.512432', '0.511654', '0.506204', '0.509000', '0.500140', '0.504905', '0.497560', '0.505314', '0.507454', '0.506754', '0.500489', '0.496492', '0.510181', '0.514624', '0.506350', '0.514411']
         : correct/total = [(7102, 14232), (7191, 14235), (7020, 14266), (7228, 14217), (7296, 14238), (7354, 14373), (7262, 14346), (7296, 14334), (7149, 14294), (7257, 14373), (7137, 14344), (7227, 14302), (7284, 14354), (7278, 14362), (7167, 14320), (7147, 14395), (7341, 14389), (7337, 14257), (7216, 14251), (7407, 14399)]
         : compromised: 0.5049, honest: 0.5077

=== FINAL RESULTS ===
Dataset: sent140, Nodes: 20, Graph: erdos, Aggregation: krum
Attack: directed_deviation, 80.0% compromised
Final accuracy - Compromised: 0.5049, Honest: 0.5077
Overall test accuracy: mean=0.5054 ± 0.0060
