Device: cuda
Seed: 987654321
Loading 1 LEAF Sent140 train files...
LEAF Sent140 train: 254555 users, 908652 samples
Building vocabulary (max_size=10000)...
Vocabulary size: 10000
Loading 1 LEAF Sent140 test files...
LEAF Sent140 test: 254555 users, 286281 samples
Found 254555 train users, 254555 test users, 254555 common users
User sample counts range: 494 (max) to 1 (min)
Distributed ALL 254555 users across 20 clients
Users per client: 12727 (with 15 clients getting +1 user)
Train partition sizes: [44353, 44290, 44657, 44907, 44696, 45843, 45801, 45619, 45069, 45639, 45821, 45311, 45779, 46056, 45625, 45984, 46428, 44737, 45540, 46497]
Test partition sizes: [14232, 14235, 14266, 14217, 14238, 14373, 14346, 14334, 14294, 14373, 14344, 14302, 14354, 14362, 14320, 14395, 14389, 14257, 14251, 14399]
  Client 0: 44353 train samples, 2 unique classes
  Client 1: 44290 train samples, 2 unique classes
  Client 2: 44657 train samples, 2 unique classes
  Client 3: 44907 train samples, 2 unique classes
  Client 4: 44696 train samples, 2 unique classes
  Client 5: 45843 train samples, 2 unique classes
  Client 6: 45801 train samples, 2 unique classes
  Client 7: 45619 train samples, 2 unique classes
  Client 8: 45069 train samples, 2 unique classes
  Client 9: 45639 train samples, 2 unique classes
  Client 10: 45821 train samples, 2 unique classes
  Client 11: 45311 train samples, 2 unique classes
  Client 12: 45779 train samples, 2 unique classes
  Client 13: 46056 train samples, 2 unique classes
  Client 14: 45625 train samples, 2 unique classes
  Client 15: 45984 train samples, 2 unique classes
  Client 16: 46428 train samples, 2 unique classes
  Client 17: 44737 train samples, 2 unique classes
  Client 18: 45540 train samples, 2 unique classes
  Client 19: 46497 train samples, 2 unique classes
Will sample 4500 samples per client per epoch
Graph: erdos, nodes: 20, edges: 126
Degree statistics: avg=12.60, min=8, max=16
Model variant: baseline
Model parameters: 1,174,986
BALANCE algorithm:
Balance Config: BALANCEConfig(gamma=2, kappa=1, alpha=0.5, min_neighbors=1)
  - Model dimension: 1,174,986 parameters
  - Complexity: O(N×d) = O(20×1,174,986)
Initial test acc across nodes: mean=0.4953 ± 0.0174
Round 001: test acc mean=0.5641 ± 0.0400 | min=0.5062 max=0.6260
         : test loss mean=0.6897 ± 0.0007
         : individual accs = ['0.557055', '0.588409', '0.514931', '0.506155', '0.611673', '0.543102', '0.625680', '0.620971', '0.537568', '0.562235', '0.518475', '0.552580', '0.612791', '0.564893', '0.522626', '0.569712', '0.508305', '0.599705', '0.538839', '0.626016']
         : correct/total = [(7928, 14232), (8376, 14235), (7346, 14266), (7196, 14217), (8709, 14238), (7806, 14373), (8976, 14346), (8901, 14334), (7684, 14294), (8081, 14373), (7437, 14344), (7903, 14302), (8796, 14354), (8113, 14362), (7484, 14320), (8201, 14395), (7314, 14389), (8550, 14257), (7679, 14251), (9014, 14399)]
Round 002: test acc mean=0.5696 ± 0.0505 | min=0.4925 max=0.6303
         : test loss mean=0.6904 ± 0.0006
         : individual accs = ['0.603499', '0.609905', '0.609631', '0.619610', '0.496629', '0.512558', '0.509550', '0.629413', '0.615993', '0.581646', '0.557585', '0.606139', '0.502856', '0.630274', '0.492528', '0.563390', '0.518730', '0.603212', '0.622693', '0.506285']
         : correct/total = [(8589, 14232), (8682, 14235), (8697, 14266), (8809, 14217), (7071, 14238), (7367, 14373), (7310, 14346), (9022, 14334), (8805, 14294), (8360, 14373), (7998, 14344), (8669, 14302), (7218, 14354), (9052, 14362), (7053, 14320), (8110, 14395), (7464, 14389), (8600, 14257), (8874, 14251), (7290, 14399)]
Round 003: test acc mean=0.5217 ± 0.0332 | min=0.4923 max=0.6098
         : test loss mean=0.6904 ± 0.0007
         : individual accs = ['0.520306', '0.499965', '0.531544', '0.492298', '0.530482', '0.547902', '0.499791', '0.493024', '0.511263', '0.498365', '0.498466', '0.597818', '0.502856', '0.543587', '0.493925', '0.498298', '0.510807', '0.553903', '0.609782', '0.499826']
         : correct/total = [(7405, 14232), (7117, 14235), (7583, 14266), (6999, 14217), (7553, 14238), (7875, 14373), (7170, 14346), (7067, 14334), (7308, 14294), (7163, 14373), (7150, 14344), (8550, 14302), (7218, 14354), (7807, 14362), (7073, 14320), (7173, 14395), (7350, 14389), (7897, 14257), (8690, 14251), (7197, 14399)]
Round 004: test acc mean=0.5379 ± 0.0472 | min=0.4865 max=0.6230
         : test loss mean=0.6890 ± 0.0012
         : individual accs = ['0.498033', '0.621005', '0.541497', '0.486530', '0.495505', '0.515341', '0.504322', '0.506697', '0.536659', '0.597300', '0.498466', '0.553699', '0.502996', '0.621780', '0.496089', '0.505662', '0.592536', '0.496528', '0.622974', '0.564970']
         : correct/total = [(7088, 14232), (8840, 14235), (7725, 14266), (6917, 14217), (7055, 14238), (7407, 14373), (7235, 14346), (7263, 14334), (7671, 14294), (8585, 14373), (7150, 14344), (7919, 14302), (7220, 14354), (8930, 14362), (7104, 14320), (7279, 14395), (8526, 14389), (7079, 14257), (8878, 14251), (8135, 14399)]
Round 005: test acc mean=0.5997 ± 0.0345 | min=0.5303 max=0.6422
         : test loss mean=0.6831 ± 0.0026
         : individual accs = ['0.630972', '0.626976', '0.597084', '0.560526', '0.625579', '0.633619', '0.530322', '0.635482', '0.642158', '0.581090', '0.586168', '0.535520', '0.535251', '0.597619', '0.606494', '0.628274', '0.614914', '0.600477', '0.595537', '0.629835']
         : correct/total = [(8980, 14232), (8925, 14235), (8518, 14266), (7969, 14217), (8907, 14238), (9107, 14373), (7608, 14346), (9109, 14334), (9179, 14294), (8352, 14373), (8408, 14344), (7659, 14302), (7683, 14354), (8583, 14362), (8685, 14320), (9044, 14395), (8848, 14389), (8561, 14257), (8487, 14251), (9069, 14399)]
Round 006: test acc mean=0.6303 ± 0.0117 | min=0.5910 max=0.6424
         : test loss mean=0.6660 ± 0.0038
         : individual accs = ['0.637929', '0.640604', '0.631852', '0.630583', '0.626212', '0.640924', '0.631953', '0.624948', '0.642367', '0.634175', '0.611545', '0.591036', '0.633552', '0.627837', '0.638198', '0.620980', '0.639933', '0.635758', '0.628517', '0.637197']
         : correct/total = [(9079, 14232), (9119, 14235), (9014, 14266), (8965, 14217), (8916, 14238), (9212, 14373), (9066, 14346), (8958, 14334), (9182, 14294), (9115, 14373), (8772, 14344), (8453, 14302), (9094, 14354), (9017, 14362), (9139, 14320), (8939, 14395), (9208, 14389), (9064, 14257), (8957, 14251), (9175, 14399)]
Round 007: test acc mean=0.6361 ± 0.0119 | min=0.6086 max=0.6486
         : test loss mean=0.6457 ± 0.0057
         : individual accs = ['0.640247', '0.648613', '0.638091', '0.633186', '0.648265', '0.646281', '0.639900', '0.638831', '0.643907', '0.643846', '0.625906', '0.612222', '0.643375', '0.608550', '0.644344', '0.616534', '0.644451', '0.640598', '0.621641', '0.642336']
         : correct/total = [(9112, 14232), (9233, 14235), (9103, 14266), (9002, 14217), (9230, 14238), (9289, 14373), (9180, 14346), (9157, 14334), (9204, 14294), (9254, 14373), (8978, 14344), (8756, 14302), (9235, 14354), (8740, 14362), (9227, 14320), (8875, 14395), (9273, 14389), (9133, 14257), (8859, 14251), (9249, 14399)]
Round 008: test acc mean=0.6476 ± 0.0047 | min=0.6394 max=0.6553
         : test loss mean=0.6327 ± 0.0035
         : individual accs = ['0.649171', '0.642641', '0.640754', '0.654779', '0.650934', '0.646907', '0.649868', '0.642040', '0.654680', '0.651430', '0.649122', '0.655293', '0.645325', '0.639396', '0.646648', '0.646822', '0.649037', '0.644736', '0.640587', '0.650879']
         : correct/total = [(9239, 14232), (9148, 14235), (9141, 14266), (9309, 14217), (9268, 14238), (9298, 14373), (9323, 14346), (9203, 14334), (9358, 14294), (9363, 14373), (9311, 14344), (9372, 14302), (9263, 14354), (9183, 14362), (9260, 14320), (9311, 14395), (9339, 14389), (9192, 14257), (9129, 14251), (9372, 14399)]
Round 009: test acc mean=0.6552 ± 0.0092 | min=0.6198 max=0.6658
         : test loss mean=0.6258 ± 0.0067
         : individual accs = ['0.619800', '0.659712', '0.651479', '0.661180', '0.657677', '0.658596', '0.655095', '0.665829', '0.657689', '0.655604', '0.647797', '0.651098', '0.660373', '0.655689', '0.658520', '0.652796', '0.663910', '0.656520', '0.654270', '0.660046']
         : correct/total = [(8821, 14232), (9391, 14235), (9294, 14266), (9400, 14217), (9364, 14238), (9466, 14373), (9398, 14346), (9544, 14334), (9401, 14294), (9423, 14373), (9292, 14344), (9312, 14302), (9479, 14354), (9417, 14362), (9430, 14320), (9397, 14395), (9553, 14389), (9360, 14257), (9324, 14251), (9504, 14399)]
Round 010: test acc mean=0.6640 ± 0.0075 | min=0.6403 max=0.6751
         : test loss mean=0.6177 ± 0.0060
         : individual accs = ['0.662029', '0.668563', '0.640264', '0.668214', '0.671653', '0.668476', '0.665970', '0.675108', '0.670141', '0.655883', '0.663274', '0.665641', '0.671450', '0.660702', '0.666620', '0.658006', '0.668427', '0.660097', '0.656164', '0.662338']
         : correct/total = [(9422, 14232), (9517, 14235), (9134, 14266), (9500, 14217), (9563, 14238), (9608, 14373), (9554, 14346), (9677, 14334), (9579, 14294), (9427, 14373), (9514, 14344), (9520, 14302), (9638, 14354), (9489, 14362), (9546, 14320), (9472, 14395), (9618, 14389), (9411, 14257), (9351, 14251), (9537, 14399)]

=== FINAL RESULTS ===
Dataset: sent140, Nodes: 20, Graph: erdos, Aggregation: balance
Overall test accuracy: mean=0.6640 ± 0.0075

=== BALANCE SUMMARY ===
Node 0: acceptance=1.000
Node 1: acceptance=1.000
Node 2: acceptance=1.000
Node 3: acceptance=1.000
Node 4: acceptance=1.000
Node 5: acceptance=1.000
Node 6: acceptance=1.000
Node 7: acceptance=1.000
Node 8: acceptance=1.000
Node 9: acceptance=1.000
Node 10: acceptance=1.000
Node 11: acceptance=1.000
Node 12: acceptance=1.000
Node 13: acceptance=1.000
Node 14: acceptance=1.000
Node 15: acceptance=1.000
Node 16: acceptance=1.000
Node 17: acceptance=1.000
Node 18: acceptance=1.000
Node 19: acceptance=1.000

=== PARALLEL EXECUTION TIME (realistic for distributed system) ===
  COMMUNICATION (max across nodes):
    - Full model transfer: 0.000s (0.0%)
  COMPUTATION (max across nodes):
    - Filtering: 0.077s (80.6%)
    - Aggregation: 0.019s (19.4%)
  TOTALS:
    - Total computation: 0.096s (100.0%)
    - Total communication: 0.000s (0.0%)
    - Total parallel time: 0.096s

=== PER-NODE AVERAGE TIME ===
  - Filtering: 0.050s
  - Aggregation: 0.011s
  - Model transfer: 0.000s
  - Total per node: 0.061s

=== TOTAL COMPUTATIONAL WORK (sum across all nodes) ===
  - Total filtering: 1.009s
  - Total aggregation: 0.219s
  - Total model transfer: 0.000s
  - Grand total: 1.228s
  - Mean acceptance rate: 1.000

BALANCE Algorithm Properties:
  - Model dimension: 1,174,986
  - No compression: Full parameter comparison
  - Theoretical complexity: O(deg(i)×d)
  - Approach: Full parameter filtering + averaging
