Device: cuda
Seed: 987654321
Loading 1 LEAF Sent140 train files...
LEAF Sent140 train: 254555 users, 908652 samples
Building vocabulary (max_size=10000)...
Vocabulary size: 10000
Loading 1 LEAF Sent140 test files...
LEAF Sent140 test: 254555 users, 286281 samples
Found 254555 train users, 254555 test users, 254555 common users
User sample counts range: 494 (max) to 1 (min)
Distributed ALL 254555 users across 20 clients
Users per client: 12727 (with 15 clients getting +1 user)
Train partition sizes: [44353, 44290, 44657, 44907, 44696, 45843, 45801, 45619, 45069, 45639, 45821, 45311, 45779, 46056, 45625, 45984, 46428, 44737, 45540, 46497]
Test partition sizes: [14232, 14235, 14266, 14217, 14238, 14373, 14346, 14334, 14294, 14373, 14344, 14302, 14354, 14362, 14320, 14395, 14389, 14257, 14251, 14399]
  Client 0: 44353 train samples, 2 unique classes
  Client 1: 44290 train samples, 2 unique classes
  Client 2: 44657 train samples, 2 unique classes
  Client 3: 44907 train samples, 2 unique classes
  Client 4: 44696 train samples, 2 unique classes
  Client 5: 45843 train samples, 2 unique classes
  Client 6: 45801 train samples, 2 unique classes
  Client 7: 45619 train samples, 2 unique classes
  Client 8: 45069 train samples, 2 unique classes
  Client 9: 45639 train samples, 2 unique classes
  Client 10: 45821 train samples, 2 unique classes
  Client 11: 45311 train samples, 2 unique classes
  Client 12: 45779 train samples, 2 unique classes
  Client 13: 46056 train samples, 2 unique classes
  Client 14: 45625 train samples, 2 unique classes
  Client 15: 45984 train samples, 2 unique classes
  Client 16: 46428 train samples, 2 unique classes
  Client 17: 44737 train samples, 2 unique classes
  Client 18: 45540 train samples, 2 unique classes
  Client 19: 46497 train samples, 2 unique classes
Will sample 4500 samples per client per epoch
Graph: fully, nodes: 20, edges: 190
Degree statistics: avg=19.00, min=19, max=19
Attack: Compromised 6/20 nodes: [5, 12, 13, 14, 17, 18]
Attack type: backdoor, lambda: 1.0
Backdoor target label: 1, trigger size: 3
Model variant: baseline
Model parameters: 1,174,986
Initial test acc across nodes: mean=0.4965 ± 0.0152
Backdoor attack: Created poisoned datasets for 6 compromised nodes
Round 001: test acc mean=0.4970 ± 0.0081 | min=0.4813 max=0.5113
         : test loss mean=2.1263 ± 0.6827
         : individual accs = ['0.505410', '0.486196', '0.489556', '0.488781', '0.492415', '0.500939', '0.502997', '0.511302', '0.508675', '0.502052', '0.495608', '0.500350', '0.499791', '0.493525', '0.500489', '0.501910', '0.481548', '0.501087', '0.481300', '0.496493']
         : correct/total = [(7193, 14232), (6921, 14235), (6984, 14266), (6949, 14217), (7011, 14238), (7200, 14373), (7216, 14346), (7329, 14334), (7271, 14294), (7216, 14373), (7109, 14344), (7156, 14302), (7174, 14354), (7088, 14362), (7167, 14320), (7225, 14395), (6929, 14389), (7144, 14257), (6859, 14251), (7149, 14399)]
         : compromised: 0.4962, honest: 0.4974
Round 002: test acc mean=0.5150 ± 0.0035 | min=0.5075 max=0.5214
         : test loss mean=2.4043 ± 0.0259
         : individual accs = ['0.519463', '0.517106', '0.516613', '0.512977', '0.511518', '0.512976', '0.510456', '0.518348', '0.519659', '0.512419', '0.515616', '0.516711', '0.516232', '0.507450', '0.521369', '0.515526', '0.513587', '0.510556', '0.517999', '0.514341']
         : correct/total = [(7393, 14232), (7361, 14235), (7370, 14266), (7293, 14217), (7283, 14238), (7373, 14373), (7323, 14346), (7430, 14334), (7428, 14294), (7365, 14373), (7396, 14344), (7390, 14302), (7410, 14354), (7288, 14362), (7466, 14320), (7421, 14395), (7390, 14389), (7279, 14257), (7382, 14251), (7406, 14399)]
         : compromised: 0.5144, honest: 0.5153
Round 003: test acc mean=0.5061 ± 0.0052 | min=0.4939 max=0.5156
         : test loss mean=0.8316 ± 0.0068
         : individual accs = ['0.507659', '0.515630', '0.514160', '0.509320', '0.510184', '0.508314', '0.503764', '0.505511', '0.511683', '0.505531', '0.501464', '0.509369', '0.501811', '0.493873', '0.502584', '0.504342', '0.501911', '0.499193', '0.510982', '0.505382']
         : correct/total = [(7225, 14232), (7340, 14235), (7335, 14266), (7241, 14217), (7264, 14238), (7306, 14373), (7227, 14346), (7246, 14334), (7314, 14294), (7266, 14373), (7193, 14344), (7285, 14302), (7203, 14354), (7093, 14362), (7197, 14320), (7260, 14395), (7222, 14389), (7117, 14257), (7282, 14251), (7277, 14399)]
         : compromised: 0.5028, honest: 0.5076
Round 004: test acc mean=0.4949 ± 0.0056 | min=0.4861 max=0.5086
         : test loss mean=5.3869 ± 0.0703
         : individual accs = ['0.489109', '0.486266', '0.486121', '0.492228', '0.494030', '0.493843', '0.497560', '0.495256', '0.488457', '0.493008', '0.499024', '0.492029', '0.499512', '0.508634', '0.495810', '0.498367', '0.499826', '0.503051', '0.488738', '0.496284']
         : correct/total = [(6961, 14232), (6922, 14235), (6935, 14266), (6998, 14217), (7034, 14238), (7098, 14373), (7138, 14346), (7099, 14334), (6982, 14294), (7086, 14373), (7158, 14344), (7037, 14302), (7170, 14354), (7305, 14362), (7100, 14320), (7174, 14395), (7192, 14389), (7172, 14257), (6965, 14251), (7146, 14399)]
         : compromised: 0.4983, honest: 0.4934
Round 005: test acc mean=0.4949 ± 0.0056 | min=0.4861 max=0.5086
         : test loss mean=8.2420 ± 0.0913
         : individual accs = ['0.489109', '0.486266', '0.486051', '0.492228', '0.494100', '0.493843', '0.497560', '0.495186', '0.488457', '0.493008', '0.499024', '0.492029', '0.499512', '0.508564', '0.495810', '0.498367', '0.499757', '0.503051', '0.488738', '0.496354']
         : correct/total = [(6961, 14232), (6922, 14235), (6934, 14266), (6998, 14217), (7035, 14238), (7098, 14373), (7138, 14346), (7098, 14334), (6982, 14294), (7086, 14373), (7158, 14344), (7037, 14302), (7170, 14354), (7304, 14362), (7100, 14320), (7174, 14395), (7191, 14389), (7172, 14257), (6965, 14251), (7147, 14399)]
         : compromised: 0.4983, honest: 0.4934
Round 006: test acc mean=0.4955 ± 0.0053 | min=0.4868 max=0.5089
         : test loss mean=1.4502 ± 0.0164
         : individual accs = ['0.492130', '0.487531', '0.486752', '0.492579', '0.494803', '0.493216', '0.498397', '0.495396', '0.489086', '0.496139', '0.500070', '0.492239', '0.500139', '0.508912', '0.494344', '0.499062', '0.501216', '0.501648', '0.489790', '0.497326']
         : correct/total = [(7004, 14232), (6940, 14235), (6944, 14266), (7003, 14217), (7045, 14238), (7089, 14373), (7150, 14346), (7101, 14334), (6991, 14294), (7131, 14373), (7173, 14344), (7040, 14302), (7179, 14354), (7309, 14362), (7079, 14320), (7184, 14395), (7212, 14389), (7152, 14257), (6980, 14251), (7161, 14399)]
         : compromised: 0.4980, honest: 0.4945
Round 007: test acc mean=0.5150 ± 0.0057 | min=0.5030 max=0.5296
         : test loss mean=0.7698 ± 0.0082
         : individual accs = ['0.509626', '0.502986', '0.506589', '0.513962', '0.515522', '0.517637', '0.518193', '0.514581', '0.512103', '0.517011', '0.516104', '0.509649', '0.518949', '0.529592', '0.513617', '0.515040', '0.518104', '0.519534', '0.509508', '0.522606']
         : correct/total = [(7253, 14232), (7160, 14235), (7227, 14266), (7307, 14217), (7340, 14238), (7440, 14373), (7434, 14346), (7376, 14334), (7320, 14294), (7431, 14373), (7403, 14344), (7289, 14302), (7449, 14354), (7606, 14362), (7355, 14320), (7414, 14395), (7455, 14389), (7407, 14257), (7261, 14251), (7525, 14399)]
         : compromised: 0.5181, honest: 0.5137
Round 008: test acc mean=0.5225 ± 0.0043 | min=0.5151 max=0.5305
         : test loss mean=0.7201 ± 0.0027
         : individual accs = ['0.525717', '0.525184', '0.518506', '0.523669', '0.520930', '0.515620', '0.527185', '0.520301', '0.527214', '0.519307', '0.515059', '0.524892', '0.522851', '0.530149', '0.522835', '0.522820', '0.516575', '0.519604', '0.521507', '0.530523']
         : correct/total = [(7482, 14232), (7476, 14235), (7397, 14266), (7445, 14217), (7417, 14238), (7411, 14373), (7563, 14346), (7458, 14334), (7536, 14294), (7464, 14373), (7388, 14344), (7507, 14302), (7505, 14354), (7614, 14362), (7487, 14320), (7526, 14395), (7433, 14389), (7408, 14257), (7432, 14251), (7639, 14399)]
         : compromised: 0.5221, honest: 0.5227
Round 009: test acc mean=0.5495 ± 0.0056 | min=0.5401 max=0.5602
         : test loss mean=0.6832 ± 0.0022
         : individual accs = ['0.541105', '0.557850', '0.554115', '0.548076', '0.558927', '0.550894', '0.553255', '0.543254', '0.560165', '0.550198', '0.549289', '0.545308', '0.540128', '0.544144', '0.552514', '0.551233', '0.544027', '0.548713', '0.551049', '0.544830']
         : correct/total = [(7701, 14232), (7941, 14235), (7905, 14266), (7792, 14217), (7958, 14238), (7918, 14373), (7937, 14346), (7787, 14334), (8007, 14294), (7908, 14373), (7879, 14344), (7799, 14302), (7753, 14354), (7815, 14362), (7912, 14320), (7935, 14395), (7828, 14389), (7823, 14257), (7853, 14251), (7845, 14399)]
         : compromised: 0.5479, honest: 0.5501
Round 010: test acc mean=0.5099 ± 0.0043 | min=0.5010 max=0.5170
         : test loss mean=0.7027 ± 0.0016
         : individual accs = ['0.509064', '0.513453', '0.517034', '0.511078', '0.511378', '0.511306', '0.509480', '0.512837', '0.515671', '0.513115', '0.508784', '0.512656', '0.502647', '0.504317', '0.510615', '0.503369', '0.501008', '0.506488', '0.510912', '0.513647']
         : correct/total = [(7245, 14232), (7309, 14235), (7376, 14266), (7266, 14217), (7281, 14238), (7349, 14373), (7309, 14346), (7351, 14334), (7371, 14294), (7375, 14373), (7298, 14344), (7332, 14302), (7215, 14354), (7243, 14362), (7312, 14320), (7246, 14395), (7209, 14389), (7221, 14257), (7281, 14251), (7396, 14399)]
         : compromised: 0.5077, honest: 0.5109

=== FINAL RESULTS ===
Dataset: sent140, Nodes: 20, Graph: fully, Aggregation: d-fedavg
Attack: backdoor, 30.0% compromised
Final accuracy - Compromised: 0.5077, Honest: 0.5109
Overall test accuracy: mean=0.5099 ± 0.0043

=== BACKDOOR ATTACK SUCCESS RATE (ASR) ===
Target label: 1
Trigger size: 3x3
Overall ASR: 0.9266 ± 0.0025
Honest nodes ASR: 0.9261 ± 0.0023
Compromised nodes ASR: 0.9277 ± 0.0028
Note: Higher ASR indicates more successful backdoor attack
