Device: cuda
Seed: 987654321
Loading 1 LEAF Sent140 train files...
LEAF Sent140 train: 254555 users, 908652 samples
Building vocabulary (max_size=10000)...
Vocabulary size: 10000
Loading 1 LEAF Sent140 test files...
LEAF Sent140 test: 254555 users, 286281 samples
Found 254555 train users, 254555 test users, 254555 common users
User sample counts range: 494 (max) to 1 (min)
Distributed ALL 254555 users across 20 clients
Users per client: 12727 (with 15 clients getting +1 user)
Train partition sizes: [44353, 44290, 44657, 44907, 44696, 45843, 45801, 45619, 45069, 45639, 45821, 45311, 45779, 46056, 45625, 45984, 46428, 44737, 45540, 46497]
Test partition sizes: [14232, 14235, 14266, 14217, 14238, 14373, 14346, 14334, 14294, 14373, 14344, 14302, 14354, 14362, 14320, 14395, 14389, 14257, 14251, 14399]
  Client 0: 44353 train samples, 2 unique classes
  Client 1: 44290 train samples, 2 unique classes
  Client 2: 44657 train samples, 2 unique classes
  Client 3: 44907 train samples, 2 unique classes
  Client 4: 44696 train samples, 2 unique classes
  Client 5: 45843 train samples, 2 unique classes
  Client 6: 45801 train samples, 2 unique classes
  Client 7: 45619 train samples, 2 unique classes
  Client 8: 45069 train samples, 2 unique classes
  Client 9: 45639 train samples, 2 unique classes
  Client 10: 45821 train samples, 2 unique classes
  Client 11: 45311 train samples, 2 unique classes
  Client 12: 45779 train samples, 2 unique classes
  Client 13: 46056 train samples, 2 unique classes
  Client 14: 45625 train samples, 2 unique classes
  Client 15: 45984 train samples, 2 unique classes
  Client 16: 46428 train samples, 2 unique classes
  Client 17: 44737 train samples, 2 unique classes
  Client 18: 45540 train samples, 2 unique classes
  Client 19: 46497 train samples, 2 unique classes
Will sample 4500 samples per client per epoch
Graph: fully, nodes: 20, edges: 190
Degree statistics: avg=19.00, min=19, max=19
Attack: Compromised 12/20 nodes: [1, 2, 3, 5, 8, 11, 12, 13, 14, 15, 17, 18]
Attack type: backdoor, lambda: 1.0
Backdoor target label: 1, trigger size: 3
Model variant: baseline
Model parameters: 1,174,986
Initial test acc across nodes: mean=0.4953 ± 0.0174
Backdoor attack: Created poisoned datasets for 12 compromised nodes
Round 001: test acc mean=0.4974 ± 0.0067 | min=0.4821 max=0.5100
         : test loss mean=8.4118 ± 2.1579
         : individual accs = ['0.507659', '0.482122', '0.498318', '0.509953', '0.499227', '0.500174', '0.494981', '0.490931', '0.497342', '0.490712', '0.503625', '0.499161', '0.499164', '0.487397', '0.500419', '0.505245', '0.490722', '0.499544', '0.498562', '0.491909']
         : correct/total = [(7225, 14232), (6863, 14235), (7109, 14266), (7250, 14217), (7108, 14238), (7189, 14373), (7101, 14346), (7037, 14334), (7109, 14294), (7053, 14373), (7224, 14344), (7139, 14302), (7165, 14354), (7000, 14362), (7166, 14320), (7273, 14395), (7061, 14389), (7122, 14257), (7105, 14251), (7083, 14399)]
         : compromised: 0.4981, honest: 0.4962
Round 002: test acc mean=0.5008 ± 0.0053 | min=0.4899 max=0.5093
         : test loss mean=9.5483 ± 0.1547
         : individual accs = ['0.501827', '0.502424', '0.509253', '0.505662', '0.506883', '0.500939', '0.507946', '0.498884', '0.505947', '0.494260', '0.502579', '0.495175', '0.495332', '0.489904', '0.500000', '0.497673', '0.504622', '0.503963', '0.501158', '0.491284']
         : correct/total = [(7142, 14232), (7152, 14235), (7265, 14266), (7189, 14217), (7217, 14238), (7200, 14373), (7287, 14346), (7151, 14334), (7232, 14294), (7104, 14373), (7209, 14344), (7082, 14302), (7110, 14354), (7036, 14362), (7160, 14320), (7164, 14395), (7261, 14389), (7185, 14257), (7142, 14251), (7074, 14399)]
         : compromised: 0.5006, honest: 0.5010
Round 003: test acc mean=0.5063 ± 0.0054 | min=0.4935 max=0.5178
         : test loss mean=7.9765 ± 0.0990
         : individual accs = ['0.508642', '0.515911', '0.511916', '0.517760', '0.506532', '0.504209', '0.502161', '0.508372', '0.502938', '0.508871', '0.504322', '0.507831', '0.498398', '0.493455', '0.507263', '0.504967', '0.510668', '0.505997', '0.504175', '0.502118']
         : correct/total = [(7239, 14232), (7344, 14235), (7303, 14266), (7361, 14217), (7212, 14238), (7247, 14373), (7204, 14346), (7287, 14334), (7189, 14294), (7314, 14373), (7234, 14344), (7263, 14302), (7154, 14354), (7087, 14362), (7264, 14320), (7269, 14395), (7348, 14389), (7214, 14257), (7185, 14251), (7230, 14399)]
         : compromised: 0.5062, honest: 0.5065
Round 004: test acc mean=0.4913 ± 0.0045 | min=0.4851 max=0.5033
         : test loss mean=9.9739 ± 0.1219
         : individual accs = ['0.492060', '0.485142', '0.488925', '0.485968', '0.492204', '0.490086', '0.497769', '0.492535', '0.498181', '0.487859', '0.488218', '0.488603', '0.487530', '0.503273', '0.487360', '0.493088', '0.493849', '0.493302', '0.487194', '0.492604']
         : correct/total = [(7003, 14232), (6906, 14235), (6975, 14266), (6909, 14217), (7008, 14238), (7044, 14373), (7141, 14346), (7060, 14334), (7121, 14294), (7012, 14373), (7003, 14344), (6988, 14302), (6998, 14354), (7228, 14362), (6979, 14320), (7098, 14395), (7106, 14389), (7033, 14257), (6943, 14251), (7093, 14399)]
         : compromised: 0.4907, honest: 0.4921
Round 005: test acc mean=0.4985 ± 0.0052 | min=0.4866 max=0.5083
         : test loss mean=18.0090 ± 0.2925
         : individual accs = ['0.496487', '0.486617', '0.492570', '0.489062', '0.496207', '0.496278', '0.501673', '0.498674', '0.502938', '0.500731', '0.501046', '0.497483', '0.507942', '0.508286', '0.495740', '0.498298', '0.497741', '0.500316', '0.498842', '0.502118']
         : correct/total = [(7066, 14232), (6927, 14235), (7027, 14266), (6953, 14217), (7065, 14238), (7133, 14373), (7197, 14346), (7148, 14334), (7189, 14294), (7197, 14373), (7187, 14344), (7115, 14302), (7291, 14354), (7300, 14362), (7099, 14320), (7173, 14395), (7162, 14389), (7133, 14257), (7109, 14251), (7230, 14399)]
         : compromised: 0.4979, honest: 0.4993
Round 006: test acc mean=0.4982 ± 0.0056 | min=0.4847 max=0.5088
         : test loss mean=23.5193 ± 0.3258
         : individual accs = ['0.493325', '0.484651', '0.489836', '0.490047', '0.496699', '0.500174', '0.505228', '0.496721', '0.503078', '0.496695', '0.502789', '0.496924', '0.501811', '0.508773', '0.494972', '0.502258', '0.498019', '0.499895', '0.501649', '0.500660']
         : correct/total = [(7021, 14232), (6899, 14235), (6988, 14266), (6967, 14217), (7072, 14238), (7189, 14373), (7248, 14346), (7120, 14334), (7191, 14294), (7139, 14373), (7212, 14344), (7107, 14302), (7203, 14354), (7307, 14362), (7088, 14320), (7230, 14395), (7166, 14389), (7127, 14257), (7149, 14251), (7209, 14399)]
         : compromised: 0.4978, honest: 0.4988
Round 007: test acc mean=0.4945 ± 0.0054 | min=0.4834 max=0.5062
         : test loss mean=25.7837 ± 0.3216
         : individual accs = ['0.491779', '0.483386', '0.488154', '0.484490', '0.492836', '0.496208', '0.499930', '0.494000', '0.496222', '0.494678', '0.496933', '0.493847', '0.503205', '0.506197', '0.490712', '0.497048', '0.490305', '0.495686', '0.496106', '0.497604']
         : correct/total = [(6999, 14232), (6881, 14235), (6964, 14266), (6888, 14217), (7017, 14238), (7132, 14373), (7172, 14346), (7081, 14334), (7093, 14294), (7110, 14373), (7128, 14344), (7063, 14302), (7223, 14354), (7270, 14362), (7027, 14320), (7155, 14395), (7055, 14389), (7067, 14257), (7070, 14251), (7165, 14399)]
         : compromised: 0.4943, honest: 0.4948
Round 008: test acc mean=0.4967 ± 0.0051 | min=0.4868 max=0.5057
         : test loss mean=3.0412 ± 0.0510
         : individual accs = ['0.491849', '0.487320', '0.486822', '0.488078', '0.496137', '0.497669', '0.502788', '0.494907', '0.500909', '0.496069', '0.498187', '0.497273', '0.498607', '0.504526', '0.495810', '0.497603', '0.496351', '0.495897', '0.500667', '0.505730']
         : correct/total = [(7000, 14232), (6937, 14235), (6945, 14266), (6939, 14217), (7064, 14238), (7153, 14373), (7213, 14346), (7094, 14334), (7160, 14294), (7130, 14373), (7146, 14344), (7112, 14302), (7157, 14354), (7246, 14362), (7100, 14320), (7163, 14395), (7142, 14389), (7070, 14257), (7135, 14251), (7282, 14399)]
         : compromised: 0.4959, honest: 0.4978
Round 009: test acc mean=0.5051 ± 0.0053 | min=0.4937 max=0.5159
         : test loss mean=1.8530 ± 0.0309
         : individual accs = ['0.507940', '0.515911', '0.513178', '0.515017', '0.505338', '0.504488', '0.500418', '0.507186', '0.502588', '0.505322', '0.501464', '0.506433', '0.496935', '0.493733', '0.507751', '0.502258', '0.506846', '0.504033', '0.504175', '0.501354']
         : correct/total = [(7229, 14232), (7344, 14235), (7321, 14266), (7322, 14217), (7195, 14238), (7251, 14373), (7179, 14346), (7270, 14334), (7184, 14294), (7263, 14373), (7193, 14344), (7243, 14302), (7133, 14354), (7091, 14362), (7271, 14320), (7230, 14395), (7293, 14389), (7186, 14257), (7185, 14251), (7219, 14399)]
         : compromised: 0.5055, honest: 0.5045
Round 010: test acc mean=0.4987 ± 0.0052 | min=0.4880 max=0.5067
         : test loss mean=7.2421 ± 0.0853
         : individual accs = ['0.496346', '0.488022', '0.489556', '0.489836', '0.497542', '0.494956', '0.504810', '0.497000', '0.501819', '0.498295', '0.501185', '0.498672', '0.505016', '0.506684', '0.493785', '0.502258', '0.499757', '0.503262', '0.500737', '0.503785']
         : correct/total = [(7064, 14232), (6947, 14235), (6984, 14266), (6964, 14217), (7084, 14238), (7114, 14373), (7242, 14346), (7124, 14334), (7173, 14294), (7162, 14373), (7189, 14344), (7132, 14302), (7249, 14354), (7277, 14362), (7071, 14320), (7230, 14395), (7191, 14389), (7175, 14257), (7136, 14251), (7254, 14399)]
         : compromised: 0.4979, honest: 0.4998

=== FINAL RESULTS ===
Dataset: sent140, Nodes: 20, Graph: fully, Aggregation: krum
Attack: backdoor, 60.0% compromised
Final accuracy - Compromised: 0.4979, Honest: 0.4998
Overall test accuracy: mean=0.4987 ± 0.0052

=== BACKDOOR ATTACK SUCCESS RATE (ASR) ===
Target label: 1
Trigger size: 3x3
Overall ASR: 0.9244 ± 0.0031
Honest nodes ASR: 0.9238 ± 0.0026
Compromised nodes ASR: 0.9247 ± 0.0033
Note: Higher ASR indicates more successful backdoor attack
