Device: cuda
Seed: 987654321
Loading 1 LEAF Sent140 train files...
LEAF Sent140 train: 254555 users, 908652 samples
Building vocabulary (max_size=10000)...
Vocabulary size: 10000
Loading 1 LEAF Sent140 test files...
LEAF Sent140 test: 254555 users, 286281 samples
Found 254555 train users, 254555 test users, 254555 common users
User sample counts range: 494 (max) to 1 (min)
Distributed ALL 254555 users across 20 clients
Users per client: 12727 (with 15 clients getting +1 user)
Train partition sizes: [44353, 44290, 44657, 44907, 44696, 45843, 45801, 45619, 45069, 45639, 45821, 45311, 45779, 46056, 45625, 45984, 46428, 44737, 45540, 46497]
Test partition sizes: [14232, 14235, 14266, 14217, 14238, 14373, 14346, 14334, 14294, 14373, 14344, 14302, 14354, 14362, 14320, 14395, 14389, 14257, 14251, 14399]
  Client 0: 44353 train samples, 2 unique classes
  Client 1: 44290 train samples, 2 unique classes
  Client 2: 44657 train samples, 2 unique classes
  Client 3: 44907 train samples, 2 unique classes
  Client 4: 44696 train samples, 2 unique classes
  Client 5: 45843 train samples, 2 unique classes
  Client 6: 45801 train samples, 2 unique classes
  Client 7: 45619 train samples, 2 unique classes
  Client 8: 45069 train samples, 2 unique classes
  Client 9: 45639 train samples, 2 unique classes
  Client 10: 45821 train samples, 2 unique classes
  Client 11: 45311 train samples, 2 unique classes
  Client 12: 45779 train samples, 2 unique classes
  Client 13: 46056 train samples, 2 unique classes
  Client 14: 45625 train samples, 2 unique classes
  Client 15: 45984 train samples, 2 unique classes
  Client 16: 46428 train samples, 2 unique classes
  Client 17: 44737 train samples, 2 unique classes
  Client 18: 45540 train samples, 2 unique classes
  Client 19: 46497 train samples, 2 unique classes
Will sample 4500 samples per client per epoch
Graph: ring, nodes: 20, edges: 20
Degree statistics: avg=2.00, min=2, max=2
Attack: Compromised 10/20 nodes: [1, 2, 5, 11, 12, 13, 14, 15, 17, 18]
Attack type: backdoor, lambda: 1.0
Backdoor target label: 1, trigger size: 3
Model variant: baseline
Model parameters: 1,174,986
Initial test acc across nodes: mean=0.4965 ± 0.0152
Backdoor attack: Created poisoned datasets for 10 compromised nodes
Round 001: test acc mean=0.5004 ± 0.0090 | min=0.4860 max=0.5276
         : test loss mean=13.8034 ± 22.4132
         : individual accs = ['0.492411', '0.509589', '0.508271', '0.510516', '0.498033', '0.493912', '0.500279', '0.485977', '0.527564', '0.504905', '0.492122', '0.499790', '0.498258', '0.508564', '0.497277', '0.490240', '0.498923', '0.497580', '0.495334', '0.498368']
         : correct/total = [(7008, 14232), (7254, 14235), (7251, 14266), (7258, 14217), (7091, 14238), (7099, 14373), (7177, 14346), (6966, 14334), (7541, 14294), (7257, 14373), (7059, 14344), (7148, 14302), (7152, 14354), (7304, 14362), (7121, 14320), (7057, 14395), (7179, 14389), (7094, 14257), (7059, 14251), (7176, 14399)]
         : compromised: 0.4999, honest: 0.5009
Round 002: test acc mean=0.5014 ± 0.0070 | min=0.4885 max=0.5163
         : test loss mean=21.0170 ± 32.7398
         : individual accs = ['0.500422', '0.510292', '0.516333', '0.511641', '0.508498', '0.494121', '0.503834', '0.503070', '0.488457', '0.508175', '0.496445', '0.504685', '0.502299', '0.494290', '0.496229', '0.498159', '0.495100', '0.493302', '0.498702', '0.503021']
         : correct/total = [(7122, 14232), (7264, 14235), (7366, 14266), (7274, 14217), (7240, 14238), (7102, 14373), (7228, 14346), (7211, 14334), (6982, 14294), (7304, 14373), (7121, 14344), (7218, 14302), (7210, 14354), (7099, 14362), (7106, 14320), (7171, 14395), (7124, 14389), (7033, 14257), (7107, 14251), (7243, 14399)]
         : compromised: 0.5008, honest: 0.5019
Round 003: test acc mean=0.5076 ± 0.0062 | min=0.4959 max=0.5240
         : test loss mean=127.7927 ± 278.6410
         : individual accs = ['0.509767', '0.513945', '0.516122', '0.511149', '0.504425', '0.508384', '0.501603', '0.523999', '0.509235', '0.508453', '0.501255', '0.508740', '0.499443', '0.508704', '0.495880', '0.511289', '0.507610', '0.502490', '0.508877', '0.501007']
         : correct/total = [(7255, 14232), (7316, 14235), (7363, 14266), (7267, 14217), (7182, 14238), (7307, 14373), (7196, 14346), (7511, 14334), (7279, 14294), (7308, 14373), (7190, 14344), (7276, 14302), (7169, 14354), (7306, 14362), (7101, 14320), (7360, 14395), (7304, 14389), (7164, 14257), (7252, 14251), (7214, 14399)]
         : compromised: 0.5074, honest: 0.5079
Round 004: test acc mean=0.5044 ± 0.0074 | min=0.4913 max=0.5185
         : test loss mean=171.7577 ± 391.4487
         : individual accs = ['0.512156', '0.505374', '0.501542', '0.492720', '0.493187', '0.494608', '0.499303', '0.504674', '0.508885', '0.518542', '0.506135', '0.491330', '0.509614', '0.504735', '0.511941', '0.510594', '0.510320', '0.500105', '0.500596', '0.511563']
         : correct/total = [(7289, 14232), (7194, 14235), (7155, 14266), (7005, 14217), (7022, 14238), (7109, 14373), (7163, 14346), (7234, 14334), (7274, 14294), (7453, 14373), (7260, 14344), (7027, 14302), (7315, 14354), (7249, 14362), (7331, 14320), (7350, 14395), (7343, 14389), (7130, 14257), (7134, 14251), (7366, 14399)]
         : compromised: 0.5030, honest: 0.5057
Round 005: test acc mean=0.5051 ± 0.0099 | min=0.4922 max=0.5404
         : test loss mean=3250.7763 ± 7678.9701
         : individual accs = ['0.511102', '0.511697', '0.513178', '0.511500', '0.506040', '0.503583', '0.500697', '0.498326', '0.540437', '0.499896', '0.492192', '0.499091', '0.500209', '0.506963', '0.497067', '0.501216', '0.500104', '0.496949', '0.510982', '0.501493']
         : correct/total = [(7274, 14232), (7284, 14235), (7321, 14266), (7272, 14217), (7205, 14238), (7238, 14373), (7183, 14346), (7143, 14334), (7725, 14294), (7185, 14373), (7060, 14344), (7138, 14302), (7180, 14354), (7281, 14362), (7118, 14320), (7215, 14395), (7196, 14389), (7085, 14257), (7282, 14251), (7221, 14399)]
         : compromised: 0.5041, honest: 0.5062
Round 006: test acc mean=0.5002 ± 0.0086 | min=0.4870 max=0.5216
         : test loss mean=13891.2481 ± 33040.9684
         : individual accs = ['0.505270', '0.490832', '0.509954', '0.500668', '0.503652', '0.498365', '0.489056', '0.488768', '0.521617', '0.507758', '0.492262', '0.497902', '0.490874', '0.486980', '0.496788', '0.504133', '0.506985', '0.509153', '0.500667', '0.501702']
         : correct/total = [(7191, 14232), (6987, 14235), (7275, 14266), (7118, 14217), (7171, 14238), (7163, 14373), (7016, 14346), (7006, 14334), (7456, 14294), (7298, 14373), (7061, 14344), (7121, 14302), (7046, 14354), (6994, 14362), (7114, 14320), (7257, 14395), (7295, 14389), (7259, 14257), (7135, 14251), (7224, 14399)]
         : compromised: 0.4986, honest: 0.5018
Round 007: test acc mean=0.5025 ± 0.0072 | min=0.4879 max=0.5134
         : test loss mean=119730.5281 ± 284976.7907
         : individual accs = ['0.508502', '0.513383', '0.503505', '0.500387', '0.493890', '0.495582', '0.492681', '0.501116', '0.501259', '0.493912', '0.487939', '0.500140', '0.503762', '0.508704', '0.498115', '0.512539', '0.513378', '0.505015', '0.510841', '0.505591']
         : correct/total = [(7237, 14232), (7308, 14235), (7183, 14266), (7114, 14217), (7032, 14238), (7123, 14373), (7068, 14346), (7183, 14334), (7165, 14294), (7099, 14373), (6999, 14344), (7153, 14302), (7231, 14354), (7306, 14362), (7133, 14320), (7378, 14395), (7387, 14389), (7200, 14257), (7280, 14251), (7280, 14399)]
         : compromised: 0.5052, honest: 0.4999
Round 008: test acc mean=0.5037 ± 0.0073 | min=0.4891 max=0.5176
         : test loss mean=1009791.6117 ± 2403941.0921
         : individual accs = ['0.517636', '0.511907', '0.507851', '0.496096', '0.502107', '0.503096', '0.505367', '0.516046', '0.503008', '0.508245', '0.502091', '0.504475', '0.494914', '0.489138', '0.499162', '0.498020', '0.496421', '0.497370', '0.510841', '0.510591']
         : correct/total = [(7367, 14232), (7287, 14235), (7245, 14266), (7053, 14217), (7149, 14238), (7231, 14373), (7250, 14346), (7397, 14334), (7190, 14294), (7305, 14373), (7202, 14344), (7215, 14302), (7104, 14354), (7025, 14362), (7148, 14320), (7169, 14395), (7143, 14389), (7091, 14257), (7280, 14251), (7352, 14399)]
         : compromised: 0.5017, honest: 0.5058
Round 009: test acc mean=0.5038 ± 0.0069 | min=0.4870 max=0.5142
         : test loss mean=8103032.0444 ± 19291854.0654
         : individual accs = ['0.510821', '0.513664', '0.514230', '0.507983', '0.506110', '0.506157', '0.498606', '0.486954', '0.508465', '0.495860', '0.498187', '0.505803', '0.502856', '0.507589', '0.495880', '0.507259', '0.497046', '0.496809', '0.511262', '0.503785']
         : correct/total = [(7270, 14232), (7312, 14235), (7336, 14266), (7222, 14217), (7206, 14238), (7275, 14373), (7153, 14346), (6980, 14334), (7268, 14294), (7127, 14373), (7146, 14344), (7234, 14302), (7218, 14354), (7290, 14362), (7101, 14320), (7302, 14395), (7152, 14389), (7083, 14257), (7286, 14251), (7254, 14399)]
         : compromised: 0.5062, honest: 0.5014
Round 010: test acc mean=0.5014 ± 0.0067 | min=0.4859 max=0.5138
         : test loss mean=71804509.8254 ± 170947223.1658
         : individual accs = ['0.510259', '0.513804', '0.507781', '0.509812', '0.501054', '0.501218', '0.497351', '0.499163', '0.502379', '0.499826', '0.497351', '0.485876', '0.494845', '0.489904', '0.500489', '0.501633', '0.499062', '0.503753', '0.509578', '0.503785']
         : correct/total = [(7262, 14232), (7314, 14235), (7244, 14266), (7248, 14217), (7134, 14238), (7204, 14373), (7135, 14346), (7155, 14334), (7181, 14294), (7184, 14373), (7134, 14344), (6949, 14302), (7103, 14354), (7036, 14362), (7167, 14320), (7221, 14395), (7181, 14389), (7182, 14257), (7262, 14251), (7254, 14399)]
         : compromised: 0.5009, honest: 0.5020

=== FINAL RESULTS ===
Dataset: sent140, Nodes: 20, Graph: ring, Aggregation: krum
Attack: backdoor, 50.0% compromised
Final accuracy - Compromised: 0.5009, Honest: 0.5020
Overall test accuracy: mean=0.5014 ± 0.0067

=== BACKDOOR ATTACK SUCCESS RATE (ASR) ===
Target label: 1
Trigger size: 3x3
Overall ASR: 0.5944 ± 0.3385
Honest nodes ASR: 0.5453 ± 0.3351
Compromised nodes ASR: 0.6435 ± 0.3347
Note: Higher ASR indicates more successful backdoor attack
