Device: cuda
Seed: 987654321
Loading 1 LEAF Sent140 train files...
LEAF Sent140 train: 254555 users, 908652 samples
Building vocabulary (max_size=10000)...
Vocabulary size: 10000
Loading 1 LEAF Sent140 test files...
LEAF Sent140 test: 254555 users, 286281 samples
Found 254555 train users, 254555 test users, 254555 common users
User sample counts range: 494 (max) to 1 (min)
Distributed ALL 254555 users across 20 clients
Users per client: 12727 (with 15 clients getting +1 user)
Train partition sizes: [44353, 44290, 44657, 44907, 44696, 45843, 45801, 45619, 45069, 45639, 45821, 45311, 45779, 46056, 45625, 45984, 46428, 44737, 45540, 46497]
Test partition sizes: [14232, 14235, 14266, 14217, 14238, 14373, 14346, 14334, 14294, 14373, 14344, 14302, 14354, 14362, 14320, 14395, 14389, 14257, 14251, 14399]
  Client 0: 44353 train samples, 2 unique classes
  Client 1: 44290 train samples, 2 unique classes
  Client 2: 44657 train samples, 2 unique classes
  Client 3: 44907 train samples, 2 unique classes
  Client 4: 44696 train samples, 2 unique classes
  Client 5: 45843 train samples, 2 unique classes
  Client 6: 45801 train samples, 2 unique classes
  Client 7: 45619 train samples, 2 unique classes
  Client 8: 45069 train samples, 2 unique classes
  Client 9: 45639 train samples, 2 unique classes
  Client 10: 45821 train samples, 2 unique classes
  Client 11: 45311 train samples, 2 unique classes
  Client 12: 45779 train samples, 2 unique classes
  Client 13: 46056 train samples, 2 unique classes
  Client 14: 45625 train samples, 2 unique classes
  Client 15: 45984 train samples, 2 unique classes
  Client 16: 46428 train samples, 2 unique classes
  Client 17: 44737 train samples, 2 unique classes
  Client 18: 45540 train samples, 2 unique classes
  Client 19: 46497 train samples, 2 unique classes
Will sample 4500 samples per client per epoch
Graph: erdos, nodes: 20, edges: 48
Degree statistics: avg=4.80, min=2, max=7
Attack: Compromised 8/20 nodes: [1, 5, 11, 12, 13, 14, 17, 18]
Attack type: gaussian, lambda: 1.0
Model variant: baseline
Model parameters: 1,174,986
Sketchguard Node 0:
  Model dim: 1,174,986 → Sketch size: 180
  Compression ratio: 6527.7x
  Using model parameters for aggregation, sketches for filtering
Sketchguard Node 1:
  Model dim: 1,174,986 → Sketch size: 180
  Compression ratio: 6527.7x
  Using model parameters for aggregation, sketches for filtering
Sketchguard Node 2:
  Model dim: 1,174,986 → Sketch size: 180
  Compression ratio: 6527.7x
  Using model parameters for aggregation, sketches for filtering
Sketchguard Node 3:
  Model dim: 1,174,986 → Sketch size: 180
  Compression ratio: 6527.7x
  Using model parameters for aggregation, sketches for filtering
Sketchguard Node 4:
  Model dim: 1,174,986 → Sketch size: 180
  Compression ratio: 6527.7x
  Using model parameters for aggregation, sketches for filtering
Sketchguard Node 5:
  Model dim: 1,174,986 → Sketch size: 180
  Compression ratio: 6527.7x
  Using model parameters for aggregation, sketches for filtering
Sketchguard Node 6:
  Model dim: 1,174,986 → Sketch size: 180
  Compression ratio: 6527.7x
  Using model parameters for aggregation, sketches for filtering
Sketchguard Node 7:
  Model dim: 1,174,986 → Sketch size: 180
  Compression ratio: 6527.7x
  Using model parameters for aggregation, sketches for filtering
Sketchguard Node 8:
  Model dim: 1,174,986 → Sketch size: 180
  Compression ratio: 6527.7x
  Using model parameters for aggregation, sketches for filtering
Sketchguard Node 9:
  Model dim: 1,174,986 → Sketch size: 180
  Compression ratio: 6527.7x
  Using model parameters for aggregation, sketches for filtering
Sketchguard Node 10:
  Model dim: 1,174,986 → Sketch size: 180
  Compression ratio: 6527.7x
  Using model parameters for aggregation, sketches for filtering
Sketchguard Node 11:
  Model dim: 1,174,986 → Sketch size: 180
  Compression ratio: 6527.7x
  Using model parameters for aggregation, sketches for filtering
Sketchguard Node 12:
  Model dim: 1,174,986 → Sketch size: 180
  Compression ratio: 6527.7x
  Using model parameters for aggregation, sketches for filtering
Sketchguard Node 13:
  Model dim: 1,174,986 → Sketch size: 180
  Compression ratio: 6527.7x
  Using model parameters for aggregation, sketches for filtering
Sketchguard Node 14:
  Model dim: 1,174,986 → Sketch size: 180
  Compression ratio: 6527.7x
  Using model parameters for aggregation, sketches for filtering
Sketchguard Node 15:
  Model dim: 1,174,986 → Sketch size: 180
  Compression ratio: 6527.7x
  Using model parameters for aggregation, sketches for filtering
Sketchguard Node 16:
  Model dim: 1,174,986 → Sketch size: 180
  Compression ratio: 6527.7x
  Using model parameters for aggregation, sketches for filtering
Sketchguard Node 17:
  Model dim: 1,174,986 → Sketch size: 180
  Compression ratio: 6527.7x
  Using model parameters for aggregation, sketches for filtering
Sketchguard Node 18:
  Model dim: 1,174,986 → Sketch size: 180
  Compression ratio: 6527.7x
  Using model parameters for aggregation, sketches for filtering
Sketchguard Node 19:
  Model dim: 1,174,986 → Sketch size: 180
  Compression ratio: 6527.7x
  Using model parameters for aggregation, sketches for filtering
Sketchguard ALGORITHM (Sketch-based Filtering + State Aggregation)
  - Model dimension: 1,174,986 parameters
  - Config: SketchguardConfig(gamma=2, kappa=1, alpha=0.5, min_neighbors=1, sketch_size=180, network_seed=987654321, attack_detection_window=5)
  - Sketch size: 180
  - Compression ratio: 6527.7x
  - Complexity: O(d + N×k) = O(1,174,986 + 20×180)
  - Theoretical speedup vs BALANCE: 19.9x
Initial test acc across nodes: mean=0.4965 ± 0.0152
Round 001: test acc mean=0.5406 ± 0.0218 | min=0.5038 max=0.5899
         : test loss mean=0.6913 ± 0.0011
         : individual accs = ['0.554736', '0.556867', '0.522080', '0.516143', '0.563984', '0.535170', '0.517426', '0.589926', '0.533581', '0.526265', '0.503834', '0.529786', '0.570085', '0.565242', '0.558659', '0.543869', '0.545903', '0.515326', '0.521858', '0.540524']
         : correct/total = [(7895, 14232), (7927, 14235), (7448, 14266), (7338, 14217), (8030, 14238), (7692, 14373), (7423, 14346), (8456, 14334), (7627, 14294), (7564, 14373), (7227, 14344), (7577, 14302), (8183, 14354), (8118, 14362), (8000, 14320), (7829, 14395), (7855, 14389), (7347, 14257), (7437, 14251), (7783, 14399)]
         : compromised: 0.5441, honest: 0.5382
         : sketchguard stats = ['Node 0: acc_rate=0.833', 'Node 1: acc_rate=0.833', 'Node 2: acc_rate=0.400']...
Round 002: test acc mean=0.5161 ± 0.0330 | min=0.4863 max=0.5872
         : test loss mean=0.6912 ± 0.0032
         : individual accs = ['0.502108', '0.486266', '0.496776', '0.492017', '0.587231', '0.586864', '0.497560', '0.559509', '0.547293', '0.494817', '0.498885', '0.493078', '0.499303', '0.508564', '0.495810', '0.513512', '0.572729', '0.503051', '0.488738', '0.498368']
         : correct/total = [(7146, 14232), (6922, 14235), (7087, 14266), (6995, 14217), (8361, 14238), (8435, 14373), (7138, 14346), (8020, 14334), (7823, 14294), (7112, 14373), (7156, 14344), (7052, 14302), (7167, 14354), (7304, 14362), (7100, 14320), (7392, 14395), (8241, 14389), (7172, 14257), (6965, 14251), (7176, 14399)]
         : compromised: 0.5077, honest: 0.5217
         : sketchguard stats = ['Node 0: acc_rate=0.833', 'Node 1: acc_rate=0.750', 'Node 2: acc_rate=0.400']...
Round 003: test acc mean=0.5123 ± 0.0333 | min=0.4861 max=0.6153
         : test loss mean=0.6911 ± 0.0045
         : individual accs = ['0.489320', '0.486266', '0.486051', '0.492228', '0.615325', '0.565018', '0.497560', '0.559369', '0.535889', '0.492869', '0.499024', '0.492029', '0.499512', '0.508564', '0.495810', '0.498367', '0.544166', '0.503051', '0.488738', '0.496423']
         : correct/total = [(6964, 14232), (6922, 14235), (6934, 14266), (6998, 14217), (8761, 14238), (8121, 14373), (7138, 14346), (8018, 14334), (7660, 14294), (7084, 14373), (7158, 14344), (7037, 14302), (7170, 14354), (7304, 14362), (7100, 14320), (7174, 14395), (7830, 14389), (7172, 14257), (6965, 14251), (7148, 14399)]
         : compromised: 0.5049, honest: 0.5172
         : sketchguard stats = ['Node 0: acc_rate=0.833', 'Node 1: acc_rate=0.667', 'Node 2: acc_rate=0.400']...
Round 004: test acc mean=0.5151 ± 0.0368 | min=0.4861 max=0.6085
         : test loss mean=0.6906 ± 0.0054
         : individual accs = ['0.490304', '0.486266', '0.486051', '0.492228', '0.608512', '0.599457', '0.497560', '0.562578', '0.551910', '0.493008', '0.499024', '0.492029', '0.499512', '0.508564', '0.495810', '0.498367', '0.549934', '0.505226', '0.488738', '0.496354']
         : correct/total = [(6978, 14232), (6922, 14235), (6934, 14266), (6998, 14217), (8664, 14238), (8616, 14373), (7138, 14346), (8064, 14334), (7889, 14294), (7086, 14373), (7158, 14344), (7037, 14302), (7170, 14354), (7304, 14362), (7100, 14320), (7174, 14395), (7913, 14389), (7203, 14257), (6965, 14251), (7147, 14399)]
         : compromised: 0.5095, honest: 0.5188
         : sketchguard stats = ['Node 0: acc_rate=0.833', 'Node 1: acc_rate=0.625', 'Node 2: acc_rate=0.400']...
Round 005: test acc mean=0.5176 ± 0.0415 | min=0.4861 max=0.6214
         : test loss mean=0.6903 ± 0.0063
         : individual accs = ['0.489109', '0.486266', '0.486051', '0.492228', '0.621365', '0.613372', '0.497560', '0.590833', '0.521058', '0.493008', '0.499024', '0.492029', '0.499512', '0.508564', '0.495810', '0.498367', '0.541455', '0.541208', '0.488738', '0.496354']
         : correct/total = [(6961, 14232), (6922, 14235), (6934, 14266), (6998, 14217), (8847, 14238), (8816, 14373), (7138, 14346), (8469, 14334), (7448, 14294), (7086, 14373), (7158, 14344), (7037, 14302), (7170, 14354), (7304, 14362), (7100, 14320), (7174, 14395), (7791, 14389), (7716, 14257), (6965, 14251), (7147, 14399)]
         : compromised: 0.5157, honest: 0.5189
         : sketchguard stats = ['Node 0: acc_rate=0.833', 'Node 1: acc_rate=0.600', 'Node 2: acc_rate=0.400']...
Round 006: test acc mean=0.5179 ± 0.0423 | min=0.4861 max=0.6177
         : test loss mean=0.6899 ± 0.0069
         : individual accs = ['0.489109', '0.486266', '0.486051', '0.492228', '0.617713', '0.614346', '0.497560', '0.587554', '0.523926', '0.493008', '0.499163', '0.492029', '0.499512', '0.508564', '0.495810', '0.498367', '0.513795', '0.576910', '0.488738', '0.496354']
         : correct/total = [(6961, 14232), (6922, 14235), (6934, 14266), (6998, 14217), (8795, 14238), (8830, 14373), (7138, 14346), (8422, 14334), (7489, 14294), (7086, 14373), (7160, 14344), (7037, 14302), (7170, 14354), (7304, 14362), (7100, 14320), (7174, 14395), (7393, 14389), (8225, 14257), (6965, 14251), (7147, 14399)]
         : compromised: 0.5203, honest: 0.5162
         : sketchguard stats = ['Node 0: acc_rate=0.833', 'Node 1: acc_rate=0.611', 'Node 2: acc_rate=0.400']...
Round 007: test acc mean=0.5203 ± 0.0450 | min=0.4861 max=0.6252
         : test loss mean=0.6893 ± 0.0077
         : individual accs = ['0.489390', '0.486266', '0.486051', '0.492228', '0.625228', '0.614207', '0.497560', '0.584066', '0.537428', '0.493008', '0.499094', '0.492029', '0.499512', '0.508564', '0.495810', '0.498367', '0.521440', '0.601319', '0.489018', '0.496354']
         : correct/total = [(6965, 14232), (6922, 14235), (6934, 14266), (6998, 14217), (8902, 14238), (8828, 14373), (7138, 14346), (8372, 14334), (7682, 14294), (7086, 14373), (7159, 14344), (7037, 14302), (7170, 14354), (7304, 14362), (7100, 14320), (7174, 14395), (7503, 14389), (8573, 14257), (6969, 14251), (7147, 14399)]
         : compromised: 0.5233, honest: 0.5184
         : sketchguard stats = ['Node 0: acc_rate=0.833', 'Node 1: acc_rate=0.619', 'Node 2: acc_rate=0.400']...
Round 008: test acc mean=0.5175 ± 0.0438 | min=0.4861 max=0.6169
         : test loss mean=0.6889 ± 0.0085
         : individual accs = ['0.489109', '0.486266', '0.486051', '0.492228', '0.613780', '0.616851', '0.497560', '0.579671', '0.499300', '0.493008', '0.500279', '0.492029', '0.499512', '0.508564', '0.495810', '0.498367', '0.510668', '0.602792', '0.491264', '0.496354']
         : correct/total = [(6961, 14232), (6922, 14235), (6934, 14266), (6998, 14217), (8739, 14238), (8866, 14373), (7138, 14346), (8309, 14334), (7137, 14294), (7086, 14373), (7176, 14344), (7037, 14302), (7170, 14354), (7304, 14362), (7100, 14320), (7174, 14395), (7348, 14389), (8594, 14257), (7001, 14251), (7147, 14399)]
         : compromised: 0.5241, honest: 0.5130
         : sketchguard stats = ['Node 0: acc_rate=0.833', 'Node 1: acc_rate=0.625', 'Node 2: acc_rate=0.400']...
Round 009: test acc mean=0.5177 ± 0.0451 | min=0.4861 max=0.6161
         : test loss mean=0.6883 ± 0.0093
         : individual accs = ['0.489109', '0.486266', '0.486051', '0.492228', '0.616098', '0.614903', '0.497560', '0.583229', '0.492724', '0.493008', '0.501464', '0.492029', '0.499512', '0.508564', '0.495810', '0.498367', '0.510181', '0.611068', '0.490001', '0.496354']
         : correct/total = [(6961, 14232), (6922, 14235), (6934, 14266), (6998, 14217), (8772, 14238), (8838, 14373), (7138, 14346), (8360, 14334), (7043, 14294), (7086, 14373), (7193, 14344), (7037, 14302), (7170, 14354), (7304, 14362), (7100, 14320), (7174, 14395), (7341, 14389), (8712, 14257), (6983, 14251), (7147, 14399)]
         : compromised: 0.5248, honest: 0.5130
         : sketchguard stats = ['Node 0: acc_rate=0.833', 'Node 1: acc_rate=0.630', 'Node 2: acc_rate=0.400']...
Round 010: test acc mean=0.5214 ± 0.0506 | min=0.4861 max=0.6272
         : test loss mean=0.6873 ± 0.0108
         : individual accs = ['0.489109', '0.486266', '0.486051', '0.492228', '0.627195', '0.623600', '0.497560', '0.618041', '0.490066', '0.493008', '0.523703', '0.492029', '0.499512', '0.508564', '0.495810', '0.498576', '0.506568', '0.615557', '0.488738', '0.496354']
         : correct/total = [(6961, 14232), (6922, 14235), (6934, 14266), (6998, 14217), (8930, 14238), (8963, 14373), (7138, 14346), (8859, 14334), (7005, 14294), (7086, 14373), (7512, 14344), (7037, 14302), (7170, 14354), (7304, 14362), (7100, 14320), (7177, 14395), (7289, 14389), (8776, 14257), (6965, 14251), (7147, 14399)]
         : compromised: 0.5263, honest: 0.5182
         : sketchguard stats = ['Node 0: acc_rate=0.833', 'Node 1: acc_rate=0.633', 'Node 2: acc_rate=0.400']...

=== FINAL RESULTS ===
Dataset: sent140, Nodes: 20, Graph: erdos, Aggregation: sketchguard
Attack: gaussian, 40.0% compromised
Final accuracy - Compromised: 0.5263, Honest: 0.5182
Overall test accuracy: mean=0.5214 ± 0.0506

=== Sketchguard SUMMARY ===
Node 0: acceptance=0.833
Node 1: acceptance=0.633
Node 2: acceptance=0.400
Node 3: acceptance=0.500
Node 4: acceptance=0.250
Node 5: acceptance=0.200
Node 6: acceptance=0.600
Node 7: acceptance=0.600
Node 8: acceptance=0.500
Node 9: acceptance=0.667
Node 10: acceptance=0.500
Node 11: acceptance=0.429
Node 12: acceptance=0.714
Node 13: acceptance=0.500
Node 14: acceptance=0.429
Node 15: acceptance=0.333
Node 16: acceptance=0.200
Node 17: acceptance=0.440
Node 18: acceptance=0.600
Node 19: acceptance=1.000

=== PARALLEL EXECUTION TIME (realistic for distributed system) ===
  COMMUNICATION (max across nodes):
    - Sketch transfer: 0.000s (0.0%)
    - Model fetch (accepted): 0.000s (0.0%)
  COMPUTATION (max across nodes):
    - Sketching: 0.323s (95.7%)
    - Filtering: 0.001s (0.3%)
    - Aggregation: 0.014s (4.1%)
  TOTALS:
    - Total computation: 0.338s (100.0%)
    - Total communication: 0.000s (0.0%)
    - Total parallel time: 0.338s

=== PER-NODE AVERAGE TIME ===
  - Sketching: 0.214s
  - Filtering: 0.000s
  - Aggregation: 0.008s
  - Sketch transfer: 0.000s
  - Model fetch: 0.000s
  - Total per node: 0.223s

=== TOTAL COMPUTATIONAL WORK (sum across all nodes) ===
  - Total sketching: 4.285s
  - Total filtering: 0.009s
  - Total aggregation: 0.164s
  - Total sketch transfer: 0.000s
  - Total model fetch: 0.000s
  - Grand total: 4.458s
  - Mean acceptance rate: 0.516

Sketchguard Algorithm Properties:
  - Original dimension: 1,174,986
  - Sketch size: 180
  - Compression ratio: 19.9x
  - Single repetition: No repetitions needed
  - Theoretical complexity: O(d + N×k)
  - Approach: Sketch filtering + state aggregation
