Device: cuda
Seed: 987654321
Loading 1 LEAF Sent140 train files...
LEAF Sent140 train: 254555 users, 908652 samples
Building vocabulary (max_size=10000)...
Vocabulary size: 10000
Loading 1 LEAF Sent140 test files...
LEAF Sent140 test: 254555 users, 286281 samples
Found 254555 train users, 254555 test users, 254555 common users
User sample counts range: 494 (max) to 1 (min)
Distributed ALL 254555 users across 20 clients
Users per client: 12727 (with 15 clients getting +1 user)
Train partition sizes: [44353, 44290, 44657, 44907, 44696, 45843, 45801, 45619, 45069, 45639, 45821, 45311, 45779, 46056, 45625, 45984, 46428, 44737, 45540, 46497]
Test partition sizes: [14232, 14235, 14266, 14217, 14238, 14373, 14346, 14334, 14294, 14373, 14344, 14302, 14354, 14362, 14320, 14395, 14389, 14257, 14251, 14399]
  Client 0: 44353 train samples, 2 unique classes
  Client 1: 44290 train samples, 2 unique classes
  Client 2: 44657 train samples, 2 unique classes
  Client 3: 44907 train samples, 2 unique classes
  Client 4: 44696 train samples, 2 unique classes
  Client 5: 45843 train samples, 2 unique classes
  Client 6: 45801 train samples, 2 unique classes
  Client 7: 45619 train samples, 2 unique classes
  Client 8: 45069 train samples, 2 unique classes
  Client 9: 45639 train samples, 2 unique classes
  Client 10: 45821 train samples, 2 unique classes
  Client 11: 45311 train samples, 2 unique classes
  Client 12: 45779 train samples, 2 unique classes
  Client 13: 46056 train samples, 2 unique classes
  Client 14: 45625 train samples, 2 unique classes
  Client 15: 45984 train samples, 2 unique classes
  Client 16: 46428 train samples, 2 unique classes
  Client 17: 44737 train samples, 2 unique classes
  Client 18: 45540 train samples, 2 unique classes
  Client 19: 46497 train samples, 2 unique classes
Will sample 4500 samples per client per epoch
Graph: erdos, nodes: 20, edges: 99
Degree statistics: avg=9.90, min=7, max=14
Attack: Compromised 8/20 nodes: [1, 5, 11, 12, 13, 14, 17, 18]
Attack type: directed_deviation, lambda: 1.0
Model variant: baseline
Model parameters: 1,174,986
Initial test acc across nodes: mean=0.4965 ± 0.0152
Round 001: test acc mean=0.4990 ± 0.0057 | min=0.4885 max=0.5099
         : test loss mean=17.4338 ± 8.5900
         : individual accs = ['0.503794', '0.505163', '0.495233', '0.508405', '0.496980', '0.502957', '0.496863', '0.500488', '0.509864', '0.488485', '0.502231', '0.492588', '0.497144', '0.490461', '0.495391', '0.503022', '0.499131', '0.492881', '0.503894', '0.495729']
         : correct/total = [(7170, 14232), (7191, 14235), (7065, 14266), (7228, 14217), (7076, 14238), (7229, 14373), (7128, 14346), (7174, 14334), (7288, 14294), (7021, 14373), (7204, 14344), (7045, 14302), (7136, 14354), (7044, 14362), (7094, 14320), (7241, 14395), (7182, 14389), (7027, 14257), (7181, 14251), (7138, 14399)]
         : compromised: 0.4976, honest: 0.5000
Round 002: test acc mean=0.5023 ± 0.0052 | min=0.4910 max=0.5133
         : test loss mean=18.4740 ± 9.2379
         : individual accs = ['0.505972', '0.499543', '0.500981', '0.513329', '0.506672', '0.505879', '0.500627', '0.492186', '0.509654', '0.508105', '0.502231', '0.498741', '0.500766', '0.491018', '0.504749', '0.500104', '0.502815', '0.503121', '0.500035', '0.498646']
         : correct/total = [(7201, 14232), (7111, 14235), (7147, 14266), (7298, 14217), (7214, 14238), (7271, 14373), (7182, 14346), (7055, 14334), (7285, 14294), (7303, 14373), (7204, 14344), (7133, 14302), (7188, 14354), (7052, 14362), (7228, 14320), (7199, 14395), (7235, 14389), (7173, 14257), (7126, 14251), (7180, 14399)]
         : compromised: 0.5005, honest: 0.5034
Round 003: test acc mean=0.4931 ± 0.0089 | min=0.4775 max=0.5087
         : test loss mean=3.7188 ± 1.5340
         : individual accs = ['0.498454', '0.480787', '0.481985', '0.493142', '0.492344', '0.493703', '0.496933', '0.486536', '0.498251', '0.478675', '0.499163', '0.490001', '0.499930', '0.508704', '0.477514', '0.497742', '0.499409', '0.505366', '0.481229', '0.501285']
         : correct/total = [(7094, 14232), (6844, 14235), (6876, 14266), (7011, 14217), (7010, 14238), (7096, 14373), (7129, 14346), (6974, 14334), (7122, 14294), (6880, 14373), (7160, 14344), (7008, 14302), (7176, 14354), (7306, 14362), (6838, 14320), (7165, 14395), (7186, 14389), (7205, 14257), (6858, 14251), (7218, 14399)]
         : compromised: 0.4922, honest: 0.4937
Round 004: test acc mean=0.5049 ± 0.0083 | min=0.4928 max=0.5223
         : test loss mean=7.2467 ± 4.9143
         : individual accs = ['0.503794', '0.508465', '0.501402', '0.498347', '0.522264', '0.495791', '0.496166', '0.505790', '0.497132', '0.521881', '0.509063', '0.510698', '0.500279', '0.506824', '0.499162', '0.505453', '0.515324', '0.495195', '0.511543', '0.492812']
         : correct/total = [(7170, 14232), (7238, 14235), (7153, 14266), (7085, 14217), (7436, 14238), (7126, 14373), (7118, 14346), (7250, 14334), (7106, 14294), (7501, 14373), (7302, 14344), (7304, 14302), (7181, 14354), (7279, 14362), (7148, 14320), (7276, 14395), (7415, 14389), (7060, 14257), (7290, 14251), (7096, 14399)]
         : compromised: 0.5035, honest: 0.5058
Round 005: test acc mean=0.4932 ± 0.0104 | min=0.4694 max=0.5191
         : test loss mean=4.0231 ± 2.8389
         : individual accs = ['0.502389', '0.495118', '0.469368', '0.508898', '0.492977', '0.493912', '0.490799', '0.486815', '0.488457', '0.519098', '0.481525', '0.490840', '0.484813', '0.506684', '0.489874', '0.489406', '0.500452', '0.491758', '0.495334', '0.485798']
         : correct/total = [(7150, 14232), (7048, 14235), (6696, 14266), (7235, 14217), (7019, 14238), (7099, 14373), (7041, 14346), (6978, 14334), (6982, 14294), (7461, 14373), (6907, 14344), (7020, 14302), (6959, 14354), (7277, 14362), (7015, 14320), (7045, 14395), (7201, 14389), (7011, 14257), (7059, 14251), (6995, 14399)]
         : compromised: 0.4935, honest: 0.4930
Round 006: test acc mean=0.5059 ± 0.0082 | min=0.4912 max=0.5222
         : test loss mean=3.6175 ± 2.5633
         : individual accs = ['0.499227', '0.521812', '0.508552', '0.501864', '0.508358', '0.504835', '0.501046', '0.508372', '0.499370', '0.522229', '0.509690', '0.504615', '0.520203', '0.506127', '0.504190', '0.491212', '0.501494', '0.491618', '0.509157', '0.504410']
         : correct/total = [(7105, 14232), (7428, 14235), (7255, 14266), (7135, 14217), (7238, 14238), (7256, 14373), (7188, 14346), (7287, 14334), (7138, 14294), (7506, 14373), (7311, 14344), (7217, 14302), (7467, 14354), (7269, 14362), (7220, 14320), (7071, 14395), (7216, 14389), (7009, 14257), (7256, 14251), (7263, 14399)]
         : compromised: 0.5078, honest: 0.5047
Round 007: test acc mean=0.5063 ± 0.0074 | min=0.4893 max=0.5179
         : test loss mean=3.6960 ± 3.0851
         : individual accs = ['0.507378', '0.505585', '0.499509', '0.508968', '0.499438', '0.516315', '0.509062', '0.497488', '0.510844', '0.515828', '0.503834', '0.500280', '0.514421', '0.489347', '0.517877', '0.503091', '0.509000', '0.502069', '0.516244', '0.499965']
         : correct/total = [(7221, 14232), (7197, 14235), (7126, 14266), (7236, 14217), (7111, 14238), (7421, 14373), (7303, 14346), (7131, 14334), (7302, 14294), (7414, 14373), (7227, 14344), (7155, 14302), (7384, 14354), (7028, 14362), (7416, 14320), (7242, 14395), (7324, 14389), (7158, 14257), (7357, 14251), (7199, 14399)]
         : compromised: 0.5078, honest: 0.5054
Round 008: test acc mean=0.5050 ± 0.0066 | min=0.4876 max=0.5128
         : test loss mean=2.5190 ± 1.6096
         : individual accs = ['0.505481', '0.507271', '0.507641', '0.487585', '0.496137', '0.512837', '0.506971', '0.494140', '0.512593', '0.501426', '0.510248', '0.511677', '0.504389', '0.512324', '0.502025', '0.504203', '0.504205', '0.508312', '0.511683', '0.499062']
         : correct/total = [(7194, 14232), (7221, 14235), (7242, 14266), (6932, 14217), (7064, 14238), (7371, 14373), (7273, 14346), (7083, 14334), (7327, 14294), (7207, 14373), (7319, 14344), (7318, 14302), (7240, 14354), (7358, 14362), (7189, 14320), (7258, 14395), (7255, 14389), (7247, 14257), (7292, 14251), (7186, 14399)]
         : compromised: 0.5088, honest: 0.5025
Round 009: test acc mean=0.5054 ± 0.0091 | min=0.4821 max=0.5165
         : test loss mean=3.5142 ± 3.1603
         : individual accs = ['0.506816', '0.513874', '0.503154', '0.506788', '0.498033', '0.508175', '0.511292', '0.482140', '0.509934', '0.509149', '0.516523', '0.504195', '0.515187', '0.489486', '0.513897', '0.499687', '0.502884', '0.511328', '0.514420', '0.491770']
         : correct/total = [(7213, 14232), (7315, 14235), (7178, 14266), (7205, 14217), (7091, 14238), (7304, 14373), (7335, 14346), (6911, 14334), (7289, 14294), (7318, 14373), (7409, 14344), (7211, 14302), (7395, 14354), (7030, 14362), (7359, 14320), (7193, 14395), (7236, 14389), (7290, 14257), (7331, 14251), (7081, 14399)]
         : compromised: 0.5088, honest: 0.5032
Round 010: test acc mean=0.5075 ± 0.0102 | min=0.4839 max=0.5276
         : test loss mean=1.9346 ± 1.1552
         : individual accs = ['0.514264', '0.518019', '0.505608', '0.505873', '0.502599', '0.503235', '0.510874', '0.498256', '0.501959', '0.524664', '0.527607', '0.501328', '0.517277', '0.483916', '0.510335', '0.496909', '0.501425', '0.503542', '0.519683', '0.502882']
         : correct/total = [(7319, 14232), (7374, 14235), (7213, 14266), (7192, 14217), (7156, 14238), (7233, 14373), (7329, 14346), (7142, 14334), (7175, 14294), (7541, 14373), (7568, 14344), (7170, 14302), (7425, 14354), (6950, 14362), (7308, 14320), (7153, 14395), (7215, 14389), (7179, 14257), (7406, 14251), (7241, 14399)]
         : compromised: 0.5072, honest: 0.5077

=== FINAL RESULTS ===
Dataset: sent140, Nodes: 20, Graph: erdos, Aggregation: krum
Attack: directed_deviation, 40.0% compromised
Final accuracy - Compromised: 0.5072, Honest: 0.5077
Overall test accuracy: mean=0.5075 ± 0.0102
