Device: cuda
Seed: 987654321
Loading 1 LEAF Sent140 train files...
LEAF Sent140 train: 254555 users, 908652 samples
Building vocabulary (max_size=10000)...
Vocabulary size: 10000
Loading 1 LEAF Sent140 test files...
LEAF Sent140 test: 254555 users, 286281 samples
Found 254555 train users, 254555 test users, 254555 common users
User sample counts range: 494 (max) to 1 (min)
Distributed ALL 254555 users across 20 clients
Users per client: 12727 (with 15 clients getting +1 user)
Train partition sizes: [44353, 44290, 44657, 44907, 44696, 45843, 45801, 45619, 45069, 45639, 45821, 45311, 45779, 46056, 45625, 45984, 46428, 44737, 45540, 46497]
Test partition sizes: [14232, 14235, 14266, 14217, 14238, 14373, 14346, 14334, 14294, 14373, 14344, 14302, 14354, 14362, 14320, 14395, 14389, 14257, 14251, 14399]
  Client 0: 44353 train samples, 2 unique classes
  Client 1: 44290 train samples, 2 unique classes
  Client 2: 44657 train samples, 2 unique classes
  Client 3: 44907 train samples, 2 unique classes
  Client 4: 44696 train samples, 2 unique classes
  Client 5: 45843 train samples, 2 unique classes
  Client 6: 45801 train samples, 2 unique classes
  Client 7: 45619 train samples, 2 unique classes
  Client 8: 45069 train samples, 2 unique classes
  Client 9: 45639 train samples, 2 unique classes
  Client 10: 45821 train samples, 2 unique classes
  Client 11: 45311 train samples, 2 unique classes
  Client 12: 45779 train samples, 2 unique classes
  Client 13: 46056 train samples, 2 unique classes
  Client 14: 45625 train samples, 2 unique classes
  Client 15: 45984 train samples, 2 unique classes
  Client 16: 46428 train samples, 2 unique classes
  Client 17: 44737 train samples, 2 unique classes
  Client 18: 45540 train samples, 2 unique classes
  Client 19: 46497 train samples, 2 unique classes
Will sample 4500 samples per client per epoch
Graph: fully, nodes: 20, edges: 190
Degree statistics: avg=19.00, min=19, max=19
Attack: Compromised 6/20 nodes: [5, 12, 13, 14, 17, 18]
Attack type: directed_deviation, lambda: 1.0
Model variant: baseline
Model parameters: 1,174,986
Sketchguard Node 0:
  Model dim: 1,174,986 → Sketch size: 180
  Compression ratio: 6527.7x
  Using model parameters for aggregation, sketches for filtering
Sketchguard Node 1:
  Model dim: 1,174,986 → Sketch size: 180
  Compression ratio: 6527.7x
  Using model parameters for aggregation, sketches for filtering
Sketchguard Node 2:
  Model dim: 1,174,986 → Sketch size: 180
  Compression ratio: 6527.7x
  Using model parameters for aggregation, sketches for filtering
Sketchguard Node 3:
  Model dim: 1,174,986 → Sketch size: 180
  Compression ratio: 6527.7x
  Using model parameters for aggregation, sketches for filtering
Sketchguard Node 4:
  Model dim: 1,174,986 → Sketch size: 180
  Compression ratio: 6527.7x
  Using model parameters for aggregation, sketches for filtering
Sketchguard Node 5:
  Model dim: 1,174,986 → Sketch size: 180
  Compression ratio: 6527.7x
  Using model parameters for aggregation, sketches for filtering
Sketchguard Node 6:
  Model dim: 1,174,986 → Sketch size: 180
  Compression ratio: 6527.7x
  Using model parameters for aggregation, sketches for filtering
Sketchguard Node 7:
  Model dim: 1,174,986 → Sketch size: 180
  Compression ratio: 6527.7x
  Using model parameters for aggregation, sketches for filtering
Sketchguard Node 8:
  Model dim: 1,174,986 → Sketch size: 180
  Compression ratio: 6527.7x
  Using model parameters for aggregation, sketches for filtering
Sketchguard Node 9:
  Model dim: 1,174,986 → Sketch size: 180
  Compression ratio: 6527.7x
  Using model parameters for aggregation, sketches for filtering
Sketchguard Node 10:
  Model dim: 1,174,986 → Sketch size: 180
  Compression ratio: 6527.7x
  Using model parameters for aggregation, sketches for filtering
Sketchguard Node 11:
  Model dim: 1,174,986 → Sketch size: 180
  Compression ratio: 6527.7x
  Using model parameters for aggregation, sketches for filtering
Sketchguard Node 12:
  Model dim: 1,174,986 → Sketch size: 180
  Compression ratio: 6527.7x
  Using model parameters for aggregation, sketches for filtering
Sketchguard Node 13:
  Model dim: 1,174,986 → Sketch size: 180
  Compression ratio: 6527.7x
  Using model parameters for aggregation, sketches for filtering
Sketchguard Node 14:
  Model dim: 1,174,986 → Sketch size: 180
  Compression ratio: 6527.7x
  Using model parameters for aggregation, sketches for filtering
Sketchguard Node 15:
  Model dim: 1,174,986 → Sketch size: 180
  Compression ratio: 6527.7x
  Using model parameters for aggregation, sketches for filtering
Sketchguard Node 16:
  Model dim: 1,174,986 → Sketch size: 180
  Compression ratio: 6527.7x
  Using model parameters for aggregation, sketches for filtering
Sketchguard Node 17:
  Model dim: 1,174,986 → Sketch size: 180
  Compression ratio: 6527.7x
  Using model parameters for aggregation, sketches for filtering
Sketchguard Node 18:
  Model dim: 1,174,986 → Sketch size: 180
  Compression ratio: 6527.7x
  Using model parameters for aggregation, sketches for filtering
Sketchguard Node 19:
  Model dim: 1,174,986 → Sketch size: 180
  Compression ratio: 6527.7x
  Using model parameters for aggregation, sketches for filtering
Sketchguard ALGORITHM (Sketch-based Filtering + State Aggregation)
  - Model dimension: 1,174,986 parameters
  - Config: SketchguardConfig(gamma=2, kappa=1, alpha=0.5, min_neighbors=1, sketch_size=180, network_seed=987654321, attack_detection_window=5)
  - Sketch size: 180
  - Compression ratio: 6527.7x
  - Complexity: O(d + N×k) = O(1,174,986 + 20×180)
  - Theoretical speedup vs BALANCE: 19.9x
Initial test acc across nodes: mean=0.4953 ± 0.0174
Round 001: test acc mean=0.5005 ± 0.0200 | min=0.4650 max=0.5582
         : test loss mean=0.6981 ± 0.0096
         : individual accs = ['0.492552', '0.495961', '0.484368', '0.521137', '0.465023', '0.493982', '0.486129', '0.510744', '0.496362', '0.558199', '0.484872', '0.496154', '0.499025', '0.491366', '0.506145', '0.530670', '0.490931', '0.498983', '0.524454', '0.482881']
         : correct/total = [(7010, 14232), (7060, 14235), (6910, 14266), (7409, 14217), (6621, 14238), (7100, 14373), (6974, 14346), (7321, 14334), (7095, 14294), (8023, 14373), (6955, 14344), (7096, 14302), (7163, 14354), (7057, 14362), (7248, 14320), (7639, 14395), (7064, 14389), (7114, 14257), (7474, 14251), (6953, 14399)]
         : compromised: 0.5023, honest: 0.4997
         : sketchguard stats = ['Node 0: acc_rate=1.000', 'Node 1: acc_rate=1.000', 'Node 2: acc_rate=1.000']...
Round 002: test acc mean=0.5929 ± 0.0185 | min=0.5520 max=0.6222
         : test loss mean=0.6783 ± 0.0032
         : individual accs = ['0.607434', '0.606041', '0.597364', '0.569459', '0.622208', '0.588464', '0.622194', '0.577229', '0.585350', '0.579698', '0.619144', '0.601944', '0.586875', '0.605487', '0.551955', '0.578812', '0.595385', '0.609665', '0.581924', '0.571984']
         : correct/total = [(8645, 14232), (8627, 14235), (8522, 14266), (8096, 14217), (8859, 14238), (8458, 14373), (8926, 14346), (8274, 14334), (8367, 14294), (8332, 14373), (8881, 14344), (8609, 14302), (8424, 14354), (8696, 14362), (7904, 14320), (8332, 14395), (8567, 14389), (8692, 14257), (8293, 14251), (8236, 14399)]
         : compromised: 0.5874, honest: 0.5953
         : sketchguard stats = ['Node 0: acc_rate=0.842', 'Node 1: acc_rate=0.842', 'Node 2: acc_rate=0.842']...
Round 003: test acc mean=0.6158 ± 0.0141 | min=0.5834 max=0.6354
         : test loss mean=0.6660 ± 0.0056
         : individual accs = ['0.605396', '0.630348', '0.614538', '0.603784', '0.583439', '0.629583', '0.608044', '0.600879', '0.616482', '0.632505', '0.627370', '0.627465', '0.623311', '0.621849', '0.615084', '0.635429', '0.620474', '0.620187', '0.614764', '0.585527']
         : correct/total = [(8616, 14232), (8973, 14235), (8767, 14266), (8584, 14217), (8307, 14238), (9049, 14373), (8723, 14346), (8613, 14334), (8812, 14294), (9091, 14373), (8999, 14344), (8974, 14302), (8947, 14354), (8931, 14362), (8808, 14320), (9147, 14395), (8928, 14389), (8842, 14257), (8761, 14251), (8431, 14399)]
         : compromised: 0.6208, honest: 0.6137
         : sketchguard stats = ['Node 0: acc_rate=0.789', 'Node 1: acc_rate=0.789', 'Node 2: acc_rate=0.789']...
Round 004: test acc mean=0.6363 ± 0.0080 | min=0.6070 max=0.6473
         : test loss mean=0.6431 ± 0.0056
         : individual accs = ['0.636031', '0.640464', '0.636548', '0.640641', '0.640750', '0.640159', '0.636484', '0.634366', '0.639149', '0.644333', '0.634830', '0.635156', '0.642748', '0.634870', '0.606983', '0.627926', '0.639933', '0.632531', '0.635464', '0.647267']
         : correct/total = [(9052, 14232), (9117, 14235), (9081, 14266), (9108, 14217), (9123, 14238), (9201, 14373), (9131, 14346), (9093, 14334), (9136, 14294), (9261, 14373), (9106, 14344), (9084, 14302), (9226, 14354), (9118, 14362), (8692, 14320), (9039, 14395), (9208, 14389), (9018, 14257), (9056, 14251), (9320, 14399)]
         : compromised: 0.6321, honest: 0.6381
         : sketchguard stats = ['Node 0: acc_rate=0.763', 'Node 1: acc_rate=0.763', 'Node 2: acc_rate=0.763']...
Round 005: test acc mean=0.6493 ± 0.0059 | min=0.6337 max=0.6574
         : test loss mean=0.6276 ± 0.0049
         : individual accs = ['0.643339', '0.654373', '0.642437', '0.654850', '0.654797', '0.653865', '0.652935', '0.644900', '0.652022', '0.633688', '0.647936', '0.650119', '0.657447', '0.646428', '0.647626', '0.651268', '0.657238', '0.644035', '0.643674', '0.653795']
         : correct/total = [(9156, 14232), (9315, 14235), (9165, 14266), (9310, 14217), (9323, 14238), (9398, 14373), (9367, 14346), (9244, 14334), (9320, 14294), (9108, 14373), (9294, 14344), (9298, 14302), (9437, 14354), (9284, 14362), (9274, 14320), (9375, 14395), (9457, 14389), (9182, 14257), (9173, 14251), (9414, 14399)]
         : compromised: 0.6488, honest: 0.6495
         : sketchguard stats = ['Node 0: acc_rate=0.747', 'Node 1: acc_rate=0.747', 'Node 2: acc_rate=0.747']...
Round 006: test acc mean=0.6561 ± 0.0060 | min=0.6438 max=0.6651
         : test loss mean=0.6181 ± 0.0046
         : individual accs = ['0.657040', '0.662873', '0.651549', '0.660266', '0.652830', '0.662840', '0.660672', '0.661365', '0.662236', '0.660057', '0.643753', '0.647182', '0.652013', '0.654853', '0.650698', '0.655922', '0.662520', '0.649646', '0.649498', '0.665116']
         : correct/total = [(9351, 14232), (9436, 14235), (9295, 14266), (9387, 14217), (9295, 14238), (9527, 14373), (9478, 14346), (9480, 14334), (9466, 14294), (9487, 14373), (9234, 14344), (9256, 14302), (9359, 14354), (9405, 14362), (9318, 14320), (9442, 14395), (9533, 14389), (9262, 14257), (9256, 14251), (9577, 14399)]
         : compromised: 0.6533, honest: 0.6574
         : sketchguard stats = ['Node 0: acc_rate=0.737', 'Node 1: acc_rate=0.737', 'Node 2: acc_rate=0.737']...
Round 007: test acc mean=0.6637 ± 0.0064 | min=0.6432 max=0.6703
         : test loss mean=0.6106 ± 0.0048
         : individual accs = ['0.665191', '0.670320', '0.662835', '0.664979', '0.668984', '0.669658', '0.666667', '0.643156', '0.666084', '0.665136', '0.656023', '0.665991', '0.669360', '0.660075', '0.663547', '0.654185', '0.670026', '0.662762', '0.661076', '0.668866']
         : correct/total = [(9467, 14232), (9542, 14235), (9456, 14266), (9454, 14217), (9525, 14238), (9625, 14373), (9564, 14346), (9219, 14334), (9521, 14294), (9560, 14373), (9410, 14344), (9525, 14302), (9608, 14354), (9480, 14362), (9502, 14320), (9417, 14395), (9641, 14389), (9449, 14257), (9421, 14251), (9631, 14399)]
         : compromised: 0.6644, honest: 0.6635
         : sketchguard stats = ['Node 0: acc_rate=0.729', 'Node 1: acc_rate=0.729', 'Node 2: acc_rate=0.729']...
Round 008: test acc mean=0.6700 ± 0.0064 | min=0.6553 max=0.6798
         : test loss mean=0.6037 ± 0.0050
         : individual accs = ['0.666807', '0.670460', '0.657928', '0.679257', '0.668844', '0.675711', '0.679841', '0.672806', '0.677277', '0.672233', '0.671221', '0.668298', '0.661070', '0.669684', '0.665503', '0.669677', '0.675099', '0.668303', '0.655322', '0.675464']
         : correct/total = [(9490, 14232), (9544, 14235), (9386, 14266), (9657, 14217), (9523, 14238), (9712, 14373), (9753, 14346), (9644, 14334), (9681, 14294), (9662, 14373), (9628, 14344), (9558, 14302), (9489, 14354), (9618, 14362), (9530, 14320), (9640, 14395), (9714, 14389), (9528, 14257), (9339, 14251), (9726, 14399)]
         : compromised: 0.6659, honest: 0.6718
         : sketchguard stats = ['Node 0: acc_rate=0.724', 'Node 1: acc_rate=0.724', 'Node 2: acc_rate=0.724']...
Round 009: test acc mean=0.6704 ± 0.0092 | min=0.6439 max=0.6830
         : test loss mean=0.6033 ± 0.0075
         : individual accs = ['0.643901', '0.683035', '0.674541', '0.677639', '0.676429', '0.680025', '0.655374', '0.673504', '0.673010', '0.666806', '0.655605', '0.665361', '0.673331', '0.673792', '0.669623', '0.667315', '0.677392', '0.671600', '0.673497', '0.675672']
         : correct/total = [(9164, 14232), (9723, 14235), (9623, 14266), (9634, 14217), (9631, 14238), (9774, 14373), (9402, 14346), (9654, 14334), (9620, 14294), (9584, 14373), (9404, 14344), (9516, 14302), (9665, 14354), (9677, 14362), (9589, 14320), (9606, 14395), (9747, 14389), (9575, 14257), (9598, 14251), (9729, 14399)]
         : compromised: 0.6736, honest: 0.6690
         : sketchguard stats = ['Node 0: acc_rate=0.719', 'Node 1: acc_rate=0.719', 'Node 2: acc_rate=0.719']...
Round 010: test acc mean=0.6821 ± 0.0043 | min=0.6728 max=0.6919
         : test loss mean=0.5911 ± 0.0039
         : individual accs = ['0.679103', '0.684651', '0.677064', '0.684884', '0.684506', '0.686287', '0.685278', '0.691852', '0.684343', '0.678842', '0.684537', '0.681863', '0.688101', '0.678596', '0.679260', '0.678222', '0.682605', '0.680788', '0.672795', '0.679422']
         : correct/total = [(9665, 14232), (9746, 14235), (9659, 14266), (9737, 14217), (9746, 14238), (9864, 14373), (9831, 14346), (9917, 14334), (9782, 14294), (9757, 14373), (9819, 14344), (9752, 14302), (9877, 14354), (9746, 14362), (9727, 14320), (9763, 14395), (9822, 14389), (9706, 14257), (9588, 14251), (9783, 14399)]
         : compromised: 0.6810, honest: 0.6827
         : sketchguard stats = ['Node 0: acc_rate=0.716', 'Node 1: acc_rate=0.716', 'Node 2: acc_rate=0.716']...

=== FINAL RESULTS ===
Dataset: sent140, Nodes: 20, Graph: fully, Aggregation: sketchguard
Attack: directed_deviation, 30.0% compromised
Final accuracy - Compromised: 0.6810, Honest: 0.6827
Overall test accuracy: mean=0.6821 ± 0.0043

=== Sketchguard SUMMARY ===
Node 0: acceptance=0.716
Node 1: acceptance=0.716
Node 2: acceptance=0.716
Node 3: acceptance=0.716
Node 4: acceptance=0.716
Node 5: acceptance=0.763
Node 6: acceptance=0.716
Node 7: acceptance=0.716
Node 8: acceptance=0.716
Node 9: acceptance=0.716
Node 10: acceptance=0.716
Node 11: acceptance=0.716
Node 12: acceptance=0.763
Node 13: acceptance=0.763
Node 14: acceptance=0.763
Node 15: acceptance=0.716
Node 16: acceptance=0.716
Node 17: acceptance=0.763
Node 18: acceptance=0.763
Node 19: acceptance=0.716

=== PARALLEL EXECUTION TIME (realistic for distributed system) ===
  COMMUNICATION (max across nodes):
    - Sketch transfer: 0.000s (0.0%)
    - Model fetch (accepted): 0.000s (0.0%)
  COMPUTATION (max across nodes):
    - Sketching: 0.592s (95.0%)
    - Filtering: 0.001s (0.2%)
    - Aggregation: 0.030s (4.8%)
  TOTALS:
    - Total computation: 0.624s (100.0%)
    - Total communication: 0.000s (0.0%)
    - Total parallel time: 0.624s

=== PER-NODE AVERAGE TIME ===
  - Sketching: 0.524s
  - Filtering: 0.001s
  - Aggregation: 0.024s
  - Sketch transfer: 0.000s
  - Model fetch: 0.000s
  - Total per node: 0.549s

=== TOTAL COMPUTATIONAL WORK (sum across all nodes) ===
  - Total sketching: 10.474s
  - Total filtering: 0.016s
  - Total aggregation: 0.487s
  - Total sketch transfer: 0.000s
  - Total model fetch: 0.000s
  - Grand total: 10.978s
  - Mean acceptance rate: 0.730

Sketchguard Algorithm Properties:
  - Original dimension: 1,174,986
  - Sketch size: 180
  - Compression ratio: 19.9x
  - Single repetition: No repetitions needed
  - Theoretical complexity: O(d + N×k)
  - Approach: Sketch filtering + state aggregation
