Device: cuda
Seed: 987654321
Loading 1 LEAF Sent140 train files...
LEAF Sent140 train: 254555 users, 908652 samples
Building vocabulary (max_size=10000)...
Vocabulary size: 10000
Loading 1 LEAF Sent140 test files...
LEAF Sent140 test: 254555 users, 286281 samples
Found 254555 train users, 254555 test users, 254555 common users
User sample counts range: 494 (max) to 1 (min)
Distributed ALL 254555 users across 20 clients
Users per client: 12727 (with 15 clients getting +1 user)
Train partition sizes: [44353, 44290, 44657, 44907, 44696, 45843, 45801, 45619, 45069, 45639, 45821, 45311, 45779, 46056, 45625, 45984, 46428, 44737, 45540, 46497]
Test partition sizes: [14232, 14235, 14266, 14217, 14238, 14373, 14346, 14334, 14294, 14373, 14344, 14302, 14354, 14362, 14320, 14395, 14389, 14257, 14251, 14399]
  Client 0: 44353 train samples, 2 unique classes
  Client 1: 44290 train samples, 2 unique classes
  Client 2: 44657 train samples, 2 unique classes
  Client 3: 44907 train samples, 2 unique classes
  Client 4: 44696 train samples, 2 unique classes
  Client 5: 45843 train samples, 2 unique classes
  Client 6: 45801 train samples, 2 unique classes
  Client 7: 45619 train samples, 2 unique classes
  Client 8: 45069 train samples, 2 unique classes
  Client 9: 45639 train samples, 2 unique classes
  Client 10: 45821 train samples, 2 unique classes
  Client 11: 45311 train samples, 2 unique classes
  Client 12: 45779 train samples, 2 unique classes
  Client 13: 46056 train samples, 2 unique classes
  Client 14: 45625 train samples, 2 unique classes
  Client 15: 45984 train samples, 2 unique classes
  Client 16: 46428 train samples, 2 unique classes
  Client 17: 44737 train samples, 2 unique classes
  Client 18: 45540 train samples, 2 unique classes
  Client 19: 46497 train samples, 2 unique classes
Will sample 4500 samples per client per epoch
Graph: fully, nodes: 20, edges: 190
Degree statistics: avg=19.00, min=19, max=19
Attack: Compromised 6/20 nodes: [5, 12, 13, 14, 17, 18]
Attack type: backdoor, lambda: 1.0
Backdoor target label: 1, trigger size: 3
Model variant: baseline
Model parameters: 1,174,986
Initial test acc across nodes: mean=0.4953 ± 0.0174
Backdoor attack: Created poisoned datasets for 6 compromised nodes
Round 001: test acc mean=0.4980 ± 0.0059 | min=0.4875 max=0.5089
         : test loss mean=22.8048 ± 6.0464
         : individual accs = ['0.508853', '0.494415', '0.493271', '0.494549', '0.505478', '0.500244', '0.495818', '0.504744', '0.498181', '0.491060', '0.500279', '0.502867', '0.487530', '0.496031', '0.491830', '0.502397', '0.505039', '0.497089', '0.502140', '0.487534']
         : correct/total = [(7242, 14232), (7038, 14235), (7037, 14266), (7031, 14217), (7197, 14238), (7190, 14373), (7113, 14346), (7235, 14334), (7121, 14294), (7058, 14373), (7176, 14344), (7192, 14302), (6998, 14354), (7124, 14362), (7043, 14320), (7232, 14395), (7267, 14389), (7087, 14257), (7156, 14251), (7020, 14399)]
         : compromised: 0.4958, honest: 0.4989
Round 002: test acc mean=0.5039 ± 0.0054 | min=0.4927 max=0.5137
         : test loss mean=27.1994 ± 0.8337
         : individual accs = ['0.504918', '0.513664', '0.510094', '0.513681', '0.507094', '0.503374', '0.499303', '0.509000', '0.501609', '0.500104', '0.499024', '0.505104', '0.494636', '0.492689', '0.506564', '0.499410', '0.503996', '0.504244', '0.505929', '0.503368']
         : correct/total = [(7186, 14232), (7312, 14235), (7277, 14266), (7303, 14217), (7220, 14238), (7235, 14373), (7163, 14346), (7296, 14334), (7170, 14294), (7188, 14373), (7158, 14344), (7224, 14302), (7100, 14354), (7076, 14362), (7254, 14320), (7189, 14395), (7252, 14389), (7189, 14257), (7210, 14251), (7248, 14399)]
         : compromised: 0.5012, honest: 0.5050
Round 003: test acc mean=0.5024 ± 0.0049 | min=0.4932 max=0.5139
         : test loss mean=1.4658 ± 0.0166
         : individual accs = ['0.503092', '0.513874', '0.509463', '0.511993', '0.503301', '0.501218', '0.496236', '0.505093', '0.498951', '0.502331', '0.499861', '0.503216', '0.495611', '0.493176', '0.502235', '0.500590', '0.502189', '0.504524', '0.500596', '0.500521']
         : correct/total = [(7160, 14232), (7315, 14235), (7268, 14266), (7279, 14217), (7166, 14238), (7204, 14373), (7119, 14346), (7240, 14334), (7132, 14294), (7220, 14373), (7170, 14344), (7197, 14302), (7114, 14354), (7083, 14362), (7192, 14320), (7206, 14395), (7226, 14389), (7193, 14257), (7134, 14251), (7207, 14399)]
         : compromised: 0.4996, honest: 0.5036
Round 004: test acc mean=0.4974 ± 0.0058 | min=0.4840 max=0.5088
         : test loss mean=1.2972 ± 0.0128
         : individual accs = ['0.493606', '0.484018', '0.492780', '0.486390', '0.499227', '0.497530', '0.504043', '0.495535', '0.501259', '0.496556', '0.498745', '0.493777', '0.505713', '0.508843', '0.495601', '0.497951', '0.494892', '0.498422', '0.498983', '0.504479']
         : correct/total = [(7025, 14232), (6890, 14235), (7030, 14266), (6915, 14217), (7108, 14238), (7151, 14373), (7231, 14346), (7103, 14334), (7165, 14294), (7137, 14373), (7154, 14344), (7062, 14302), (7259, 14354), (7308, 14362), (7097, 14320), (7168, 14395), (7121, 14389), (7106, 14257), (7111, 14251), (7264, 14399)]
         : compromised: 0.5008, honest: 0.4959
Round 005: test acc mean=0.4956 ± 0.0053 | min=0.4852 max=0.5075
         : test loss mean=1.2145 ± 0.0118
         : individual accs = ['0.494519', '0.485845', '0.487593', '0.485194', '0.496207', '0.496278', '0.500697', '0.494210', '0.498671', '0.495095', '0.498885', '0.493917', '0.504319', '0.507450', '0.491480', '0.496839', '0.494197', '0.495406', '0.497369', '0.498160']
         : correct/total = [(7038, 14232), (6916, 14235), (6956, 14266), (6898, 14217), (7065, 14238), (7133, 14373), (7183, 14346), (7084, 14334), (7128, 14294), (7116, 14373), (7156, 14344), (7064, 14302), (7239, 14354), (7288, 14362), (7038, 14320), (7152, 14395), (7111, 14389), (7063, 14257), (7088, 14251), (7173, 14399)]
         : compromised: 0.4987, honest: 0.4943
Round 006: test acc mean=0.4965 ± 0.0051 | min=0.4867 max=0.5074
         : test loss mean=0.9625 ± 0.0072
         : individual accs = ['0.494871', '0.486688', '0.488154', '0.486812', '0.496488', '0.497461', '0.500488', '0.495814', '0.499370', '0.496069', '0.498675', '0.495665', '0.503901', '0.507381', '0.492039', '0.499062', '0.496560', '0.496037', '0.497719', '0.500590']
         : correct/total = [(7043, 14232), (6928, 14235), (6964, 14266), (6921, 14217), (7069, 14238), (7150, 14373), (7180, 14346), (7107, 14334), (7138, 14294), (7130, 14373), (7153, 14344), (7089, 14302), (7233, 14354), (7287, 14362), (7046, 14320), (7184, 14395), (7145, 14389), (7072, 14257), (7093, 14251), (7208, 14399)]
         : compromised: 0.4991, honest: 0.4954
Round 007: test acc mean=0.5037 ± 0.0039 | min=0.4969 max=0.5096
         : test loss mean=0.7330 ± 0.0025
         : individual accs = ['0.505270', '0.508044', '0.501472', '0.499754', '0.497963', '0.503514', '0.496933', '0.507535', '0.509165', '0.504696', '0.509621', '0.508460', '0.504877', '0.499513', '0.507193', '0.498229', '0.503371', '0.499053', '0.505438', '0.503924']
         : correct/total = [(7191, 14232), (7232, 14235), (7154, 14266), (7105, 14217), (7090, 14238), (7237, 14373), (7129, 14346), (7275, 14334), (7278, 14294), (7254, 14373), (7310, 14344), (7272, 14302), (7247, 14354), (7174, 14362), (7263, 14320), (7172, 14395), (7243, 14389), (7115, 14257), (7203, 14251), (7256, 14399)]
         : compromised: 0.5033, honest: 0.5039
Round 008: test acc mean=0.5011 ± 0.0035 | min=0.4938 max=0.5061
         : test loss mean=0.7248 ± 0.0022
         : individual accs = ['0.500632', '0.503688', '0.505748', '0.497855', '0.498244', '0.494399', '0.502579', '0.504674', '0.497691', '0.497669', '0.504462', '0.501538', '0.500488', '0.493803', '0.503771', '0.502605', '0.502259', '0.506067', '0.498702', '0.504132']
         : correct/total = [(7125, 14232), (7170, 14235), (7215, 14266), (7078, 14217), (7094, 14238), (7106, 14373), (7210, 14346), (7234, 14334), (7114, 14294), (7153, 14373), (7236, 14344), (7173, 14302), (7184, 14354), (7092, 14362), (7214, 14320), (7235, 14395), (7227, 14389), (7215, 14257), (7107, 14251), (7259, 14399)]
         : compromised: 0.4995, honest: 0.5017
Round 009: test acc mean=0.5016 ± 0.0051 | min=0.4900 max=0.5104
         : test loss mean=0.7463 ± 0.0036
         : individual accs = ['0.500843', '0.510362', '0.504907', '0.508124', '0.500632', '0.502818', '0.497351', '0.502023', '0.500140', '0.508592', '0.499651', '0.500000', '0.494705', '0.490043', '0.508240', '0.497951', '0.506290', '0.504805', '0.500175', '0.495104']
         : correct/total = [(7128, 14232), (7265, 14235), (7203, 14266), (7224, 14217), (7128, 14238), (7227, 14373), (7135, 14346), (7196, 14334), (7149, 14294), (7310, 14373), (7167, 14344), (7151, 14302), (7101, 14354), (7038, 14362), (7278, 14320), (7168, 14395), (7285, 14389), (7197, 14257), (7128, 14251), (7129, 14399)]
         : compromised: 0.5001, honest: 0.5023
Round 010: test acc mean=0.5088 ± 0.0045 | min=0.5013 max=0.5187
         : test loss mean=0.7256 ± 0.0030
         : individual accs = ['0.512226', '0.508746', '0.516753', '0.508124', '0.518682', '0.501287', '0.505019', '0.508511', '0.508185', '0.505601', '0.513107', '0.503846', '0.501463', '0.510235', '0.511522', '0.513373', '0.505803', '0.505085', '0.507543', '0.509897']
         : correct/total = [(7290, 14232), (7242, 14235), (7372, 14266), (7224, 14217), (7385, 14238), (7205, 14373), (7245, 14346), (7289, 14334), (7264, 14294), (7267, 14373), (7360, 14344), (7206, 14302), (7198, 14354), (7328, 14362), (7325, 14320), (7390, 14395), (7278, 14389), (7201, 14257), (7233, 14251), (7342, 14399)]
         : compromised: 0.5062, honest: 0.5098

=== FINAL RESULTS ===
Dataset: sent140, Nodes: 20, Graph: fully, Aggregation: krum
Attack: backdoor, 30.0% compromised
Final accuracy - Compromised: 0.5062, Honest: 0.5098
Overall test accuracy: mean=0.5088 ± 0.0045

=== BACKDOOR ATTACK SUCCESS RATE (ASR) ===
Target label: 1
Trigger size: 3x3
Overall ASR: 0.6385 ± 0.0045
Honest nodes ASR: 0.6398 ± 0.0036
Compromised nodes ASR: 0.6357 ± 0.0050
Note: Higher ASR indicates more successful backdoor attack
