Device: cuda
Seed: 987654321
Loading 1 LEAF Sent140 train files...
LEAF Sent140 train: 254555 users, 908652 samples
Building vocabulary (max_size=10000)...
Vocabulary size: 10000
Loading 1 LEAF Sent140 test files...
LEAF Sent140 test: 254555 users, 286281 samples
Found 254555 train users, 254555 test users, 254555 common users
User sample counts range: 494 (max) to 1 (min)
Distributed ALL 254555 users across 20 clients
Users per client: 12727 (with 15 clients getting +1 user)
Train partition sizes: [44353, 44290, 44657, 44907, 44696, 45843, 45801, 45619, 45069, 45639, 45821, 45311, 45779, 46056, 45625, 45984, 46428, 44737, 45540, 46497]
Test partition sizes: [14232, 14235, 14266, 14217, 14238, 14373, 14346, 14334, 14294, 14373, 14344, 14302, 14354, 14362, 14320, 14395, 14389, 14257, 14251, 14399]
  Client 0: 44353 train samples, 2 unique classes
  Client 1: 44290 train samples, 2 unique classes
  Client 2: 44657 train samples, 2 unique classes
  Client 3: 44907 train samples, 2 unique classes
  Client 4: 44696 train samples, 2 unique classes
  Client 5: 45843 train samples, 2 unique classes
  Client 6: 45801 train samples, 2 unique classes
  Client 7: 45619 train samples, 2 unique classes
  Client 8: 45069 train samples, 2 unique classes
  Client 9: 45639 train samples, 2 unique classes
  Client 10: 45821 train samples, 2 unique classes
  Client 11: 45311 train samples, 2 unique classes
  Client 12: 45779 train samples, 2 unique classes
  Client 13: 46056 train samples, 2 unique classes
  Client 14: 45625 train samples, 2 unique classes
  Client 15: 45984 train samples, 2 unique classes
  Client 16: 46428 train samples, 2 unique classes
  Client 17: 44737 train samples, 2 unique classes
  Client 18: 45540 train samples, 2 unique classes
  Client 19: 46497 train samples, 2 unique classes
Will sample 4500 samples per client per epoch
Graph: ring, nodes: 20, edges: 20
Degree statistics: avg=2.00, min=2, max=2
Attack: Compromised 6/20 nodes: [5, 12, 13, 14, 17, 18]
Attack type: directed_deviation, lambda: 1.0
Model variant: baseline
Model parameters: 1,174,986
Sketchguard Node 0:
  Model dim: 1,174,986 → Sketch size: 180
  Compression ratio: 6527.7x
  Using model parameters for aggregation, sketches for filtering
Sketchguard Node 1:
  Model dim: 1,174,986 → Sketch size: 180
  Compression ratio: 6527.7x
  Using model parameters for aggregation, sketches for filtering
Sketchguard Node 2:
  Model dim: 1,174,986 → Sketch size: 180
  Compression ratio: 6527.7x
  Using model parameters for aggregation, sketches for filtering
Sketchguard Node 3:
  Model dim: 1,174,986 → Sketch size: 180
  Compression ratio: 6527.7x
  Using model parameters for aggregation, sketches for filtering
Sketchguard Node 4:
  Model dim: 1,174,986 → Sketch size: 180
  Compression ratio: 6527.7x
  Using model parameters for aggregation, sketches for filtering
Sketchguard Node 5:
  Model dim: 1,174,986 → Sketch size: 180
  Compression ratio: 6527.7x
  Using model parameters for aggregation, sketches for filtering
Sketchguard Node 6:
  Model dim: 1,174,986 → Sketch size: 180
  Compression ratio: 6527.7x
  Using model parameters for aggregation, sketches for filtering
Sketchguard Node 7:
  Model dim: 1,174,986 → Sketch size: 180
  Compression ratio: 6527.7x
  Using model parameters for aggregation, sketches for filtering
Sketchguard Node 8:
  Model dim: 1,174,986 → Sketch size: 180
  Compression ratio: 6527.7x
  Using model parameters for aggregation, sketches for filtering
Sketchguard Node 9:
  Model dim: 1,174,986 → Sketch size: 180
  Compression ratio: 6527.7x
  Using model parameters for aggregation, sketches for filtering
Sketchguard Node 10:
  Model dim: 1,174,986 → Sketch size: 180
  Compression ratio: 6527.7x
  Using model parameters for aggregation, sketches for filtering
Sketchguard Node 11:
  Model dim: 1,174,986 → Sketch size: 180
  Compression ratio: 6527.7x
  Using model parameters for aggregation, sketches for filtering
Sketchguard Node 12:
  Model dim: 1,174,986 → Sketch size: 180
  Compression ratio: 6527.7x
  Using model parameters for aggregation, sketches for filtering
Sketchguard Node 13:
  Model dim: 1,174,986 → Sketch size: 180
  Compression ratio: 6527.7x
  Using model parameters for aggregation, sketches for filtering
Sketchguard Node 14:
  Model dim: 1,174,986 → Sketch size: 180
  Compression ratio: 6527.7x
  Using model parameters for aggregation, sketches for filtering
Sketchguard Node 15:
  Model dim: 1,174,986 → Sketch size: 180
  Compression ratio: 6527.7x
  Using model parameters for aggregation, sketches for filtering
Sketchguard Node 16:
  Model dim: 1,174,986 → Sketch size: 180
  Compression ratio: 6527.7x
  Using model parameters for aggregation, sketches for filtering
Sketchguard Node 17:
  Model dim: 1,174,986 → Sketch size: 180
  Compression ratio: 6527.7x
  Using model parameters for aggregation, sketches for filtering
Sketchguard Node 18:
  Model dim: 1,174,986 → Sketch size: 180
  Compression ratio: 6527.7x
  Using model parameters for aggregation, sketches for filtering
Sketchguard Node 19:
  Model dim: 1,174,986 → Sketch size: 180
  Compression ratio: 6527.7x
  Using model parameters for aggregation, sketches for filtering
Sketchguard ALGORITHM (Sketch-based Filtering + State Aggregation)
  - Model dimension: 1,174,986 parameters
  - Config: SketchguardConfig(gamma=2, kappa=1, alpha=0.5, min_neighbors=1, sketch_size=180, network_seed=987654321, attack_detection_window=5)
  - Sketch size: 180
  - Compression ratio: 6527.7x
  - Complexity: O(d + N×k) = O(1,174,986 + 20×180)
  - Theoretical speedup vs BALANCE: 19.9x
Initial test acc across nodes: mean=0.4953 ± 0.0174
Round 001: test acc mean=0.5270 ± 0.0363 | min=0.4894 max=0.6236
         : test loss mean=1.1724 ± 0.5533
         : individual accs = ['0.583263', '0.623604', '0.535118', '0.566575', '0.516294', '0.508592', '0.517984', '0.576531', '0.501189', '0.572254', '0.509481', '0.499441', '0.508848', '0.499234', '0.512430', '0.501980', '0.489402', '0.500175', '0.528594', '0.489548']
         : correct/total = [(8301, 14232), (8877, 14235), (7634, 14266), (8055, 14217), (7351, 14238), (7310, 14373), (7431, 14346), (8264, 14334), (7164, 14294), (8225, 14373), (7308, 14344), (7143, 14302), (7304, 14354), (7170, 14362), (7338, 14320), (7226, 14395), (7042, 14389), (7131, 14257), (7533, 14251), (7049, 14399)]
         : compromised: 0.5096, honest: 0.5345
         : sketchguard stats = ['Node 0: acc_rate=1.000', 'Node 1: acc_rate=1.000', 'Node 2: acc_rate=1.000']...
Round 002: test acc mean=0.5300 ± 0.0499 | min=0.4930 max=0.6442
         : test loss mean=1.0239 ± 0.7695
         : individual accs = ['0.493044', '0.644187', '0.635497', '0.513751', '0.506883', '0.522995', '0.514708', '0.509348', '0.622639', '0.608572', '0.519311', '0.496015', '0.494566', '0.508704', '0.505726', '0.498576', '0.494405', '0.510696', '0.500877', '0.498993']
         : correct/total = [(7017, 14232), (9170, 14235), (9066, 14266), (7304, 14217), (7217, 14238), (7517, 14373), (7384, 14346), (7301, 14334), (8900, 14294), (8747, 14373), (7449, 14344), (7094, 14302), (7099, 14354), (7306, 14362), (7242, 14320), (7177, 14395), (7114, 14389), (7281, 14257), (7138, 14251), (7185, 14399)]
         : compromised: 0.5073, honest: 0.5397
         : sketchguard stats = ['Node 0: acc_rate=1.000', 'Node 1: acc_rate=1.000', 'Node 2: acc_rate=1.000']...
Round 003: test acc mean=0.5492 ± 0.0470 | min=0.4985 max=0.6431
         : test loss mean=0.7581 ± 0.2573
         : individual accs = ['0.539629', '0.643063', '0.630170', '0.564957', '0.612375', '0.539692', '0.587272', '0.581973', '0.539037', '0.625965', '0.516801', '0.549294', '0.498537', '0.499095', '0.520670', '0.516290', '0.507123', '0.501368', '0.506842', '0.503646']
         : correct/total = [(7680, 14232), (9154, 14235), (8990, 14266), (8032, 14217), (8719, 14238), (7757, 14373), (8425, 14346), (8342, 14334), (7705, 14294), (8997, 14373), (7413, 14344), (7856, 14302), (7156, 14354), (7168, 14362), (7456, 14320), (7432, 14395), (7297, 14389), (7148, 14257), (7223, 14251), (7252, 14399)]
         : compromised: 0.5110, honest: 0.5655
         : sketchguard stats = ['Node 0: acc_rate=1.000', 'Node 1: acc_rate=1.000', 'Node 2: acc_rate=1.000']...
Round 004: test acc mean=0.5948 ± 0.0446 | min=0.5065 max=0.6444
         : test loss mean=0.9561 ± 1.2810
         : individual accs = ['0.634345', '0.642571', '0.644399', '0.634592', '0.639837', '0.553468', '0.634184', '0.621948', '0.564223', '0.618938', '0.624861', '0.611173', '0.586248', '0.506545', '0.524372', '0.555123', '0.551046', '0.518833', '0.603396', '0.626641']
         : correct/total = [(9028, 14232), (9147, 14235), (9193, 14266), (9022, 14217), (9110, 14238), (7955, 14373), (9098, 14346), (8915, 14334), (8065, 14294), (8896, 14373), (8963, 14344), (8741, 14302), (8415, 14354), (7275, 14362), (7509, 14320), (7991, 14395), (7929, 14389), (7397, 14257), (8599, 14251), (9023, 14399)]
         : compromised: 0.5488, honest: 0.6146
         : sketchguard stats = ['Node 0: acc_rate=1.000', 'Node 1: acc_rate=1.000', 'Node 2: acc_rate=1.000']...
Round 005: test acc mean=0.6210 ± 0.0339 | min=0.5070 max=0.6516
         : test loss mean=0.6810 ± 0.1488
         : individual accs = ['0.641091', '0.647559', '0.644469', '0.636984', '0.651636', '0.634175', '0.638157', '0.644970', '0.631104', '0.628400', '0.629253', '0.628723', '0.625192', '0.506963', '0.571997', '0.589719', '0.587949', '0.600126', '0.631464', '0.649142']
         : correct/total = [(9124, 14232), (9218, 14235), (9194, 14266), (9056, 14217), (9278, 14238), (9115, 14373), (9155, 14346), (9245, 14334), (9021, 14294), (9032, 14373), (9026, 14344), (8992, 14302), (8974, 14354), (7281, 14362), (8191, 14320), (8489, 14395), (8460, 14389), (8556, 14257), (8999, 14251), (9347, 14399)]
         : compromised: 0.5950, honest: 0.6321
         : sketchguard stats = ['Node 0: acc_rate=1.000', 'Node 1: acc_rate=1.000', 'Node 2: acc_rate=1.000']...
Round 006: test acc mean=0.6277 ± 0.0329 | min=0.5142 max=0.6609
         : test loss mean=0.6609 ± 0.0956
         : individual accs = ['0.652122', '0.646365', '0.641946', '0.654850', '0.658168', '0.625339', '0.645128', '0.649435', '0.635162', '0.626035', '0.625976', '0.636135', '0.637941', '0.514204', '0.602933', '0.591664', '0.590451', '0.612261', '0.646481', '0.660879']
         : correct/total = [(9281, 14232), (9201, 14235), (9158, 14266), (9310, 14217), (9371, 14238), (8988, 14373), (9255, 14346), (9309, 14334), (9079, 14294), (8998, 14373), (8979, 14344), (9098, 14302), (9157, 14354), (7385, 14362), (8634, 14320), (8517, 14395), (8496, 14389), (8729, 14257), (9213, 14251), (9516, 14399)]
         : compromised: 0.6065, honest: 0.6367
         : sketchguard stats = ['Node 0: acc_rate=1.000', 'Node 1: acc_rate=1.000', 'Node 2: acc_rate=1.000']...
Round 007: test acc mean=0.6371 ± 0.0321 | min=0.5093 max=0.6660
         : test loss mean=0.6635 ± 0.1447
         : individual accs = ['0.654651', '0.640534', '0.632343', '0.658648', '0.660205', '0.613929', '0.654468', '0.650691', '0.645236', '0.646977', '0.646403', '0.643966', '0.644280', '0.509261', '0.622905', '0.632859', '0.633679', '0.627411', '0.657217', '0.666018']
         : correct/total = [(9317, 14232), (9118, 14235), (9021, 14266), (9364, 14217), (9400, 14238), (8824, 14373), (9389, 14346), (9327, 14334), (9223, 14294), (9299, 14373), (9272, 14344), (9210, 14302), (9248, 14354), (7314, 14362), (8920, 14320), (9110, 14395), (9118, 14389), (8945, 14257), (9366, 14251), (9590, 14399)]
         : compromised: 0.6125, honest: 0.6476
         : sketchguard stats = ['Node 0: acc_rate=1.000', 'Node 1: acc_rate=1.000', 'Node 2: acc_rate=1.000']...
Round 008: test acc mean=0.6417 ± 0.0314 | min=0.5088 max=0.6680
         : test loss mean=0.6429 ± 0.0725
         : individual accs = ['0.652263', '0.651704', '0.650778', '0.653865', '0.658941', '0.629583', '0.647637', '0.644203', '0.645306', '0.649482', '0.653374', '0.652077', '0.646997', '0.508773', '0.641271', '0.644668', '0.641045', '0.642211', '0.651393', '0.667963']
         : correct/total = [(9283, 14232), (9277, 14235), (9284, 14266), (9296, 14217), (9382, 14238), (9049, 14373), (9291, 14346), (9234, 14334), (9224, 14294), (9335, 14373), (9372, 14344), (9326, 14302), (9287, 14354), (7307, 14362), (9183, 14320), (9280, 14395), (9224, 14389), (9156, 14257), (9283, 14251), (9618, 14399)]
         : compromised: 0.6200, honest: 0.6510
         : sketchguard stats = ['Node 0: acc_rate=1.000', 'Node 1: acc_rate=1.000', 'Node 2: acc_rate=1.000']...
Round 009: test acc mean=0.6450 ± 0.0350 | min=0.5004 max=0.6684
         : test loss mean=0.6548 ± 0.1474
         : individual accs = ['0.651209', '0.664840', '0.661783', '0.664346', '0.668423', '0.663118', '0.617454', '0.642110', '0.642088', '0.645168', '0.654908', '0.652286', '0.652501', '0.500418', '0.646439', '0.648767', '0.648898', '0.654135', '0.665778', '0.655323']
         : correct/total = [(9268, 14232), (9464, 14235), (9441, 14266), (9445, 14217), (9517, 14238), (9531, 14373), (8858, 14346), (9204, 14334), (9178, 14294), (9273, 14373), (9394, 14344), (9329, 14302), (9366, 14354), (7187, 14362), (9257, 14320), (9339, 14395), (9337, 14389), (9326, 14257), (9488, 14251), (9436, 14399)]
         : compromised: 0.6304, honest: 0.6513
         : sketchguard stats = ['Node 0: acc_rate=1.000', 'Node 1: acc_rate=1.000', 'Node 2: acc_rate=1.000']...
Round 010: test acc mean=0.6549 ± 0.0355 | min=0.5022 max=0.6744
         : test loss mean=0.6330 ± 0.0921
         : individual accs = ['0.665051', '0.664629', '0.662134', '0.665471', '0.673058', '0.666040', '0.665830', '0.667783', '0.650063', '0.651360', '0.662925', '0.657530', '0.662324', '0.502228', '0.662151', '0.664050', '0.660574', '0.661079', '0.659182', '0.674422']
         : correct/total = [(9465, 14232), (9461, 14235), (9446, 14266), (9461, 14217), (9583, 14238), (9573, 14373), (9552, 14346), (9572, 14334), (9292, 14294), (9362, 14373), (9509, 14344), (9404, 14302), (9507, 14354), (7213, 14362), (9482, 14320), (9559, 14395), (9505, 14389), (9425, 14257), (9394, 14251), (9711, 14399)]
         : compromised: 0.6355, honest: 0.6632
         : sketchguard stats = ['Node 0: acc_rate=1.000', 'Node 1: acc_rate=1.000', 'Node 2: acc_rate=1.000']...

=== FINAL RESULTS ===
Dataset: sent140, Nodes: 20, Graph: ring, Aggregation: sketchguard
Attack: directed_deviation, 30.0% compromised
Final accuracy - Compromised: 0.6355, Honest: 0.6632
Overall test accuracy: mean=0.6549 ± 0.0355

=== Sketchguard SUMMARY ===
Node 0: acceptance=1.000
Node 1: acceptance=1.000
Node 2: acceptance=1.000
Node 3: acceptance=1.000
Node 4: acceptance=0.550
Node 5: acceptance=0.800
Node 6: acceptance=0.550
Node 7: acceptance=1.000
Node 8: acceptance=1.000
Node 9: acceptance=1.000
Node 10: acceptance=1.000
Node 11: acceptance=0.600
Node 12: acceptance=0.550
Node 13: acceptance=0.200
Node 14: acceptance=0.550
Node 15: acceptance=0.600
Node 16: acceptance=0.650
Node 17: acceptance=0.550
Node 18: acceptance=0.500
Node 19: acceptance=0.600

=== PARALLEL EXECUTION TIME (realistic for distributed system) ===
  COMMUNICATION (max across nodes):
    - Sketch transfer: 0.000s (0.0%)
    - Model fetch (accepted): 0.000s (0.0%)
  COMPUTATION (max across nodes):
    - Sketching: 0.211s (93.9%)
    - Filtering: 0.001s (0.3%)
    - Aggregation: 0.013s (5.8%)
  TOTALS:
    - Total computation: 0.225s (100.0%)
    - Total communication: 0.000s (0.0%)
    - Total parallel time: 0.225s

=== PER-NODE AVERAGE TIME ===
  - Sketching: 0.158s
  - Filtering: 0.000s
  - Aggregation: 0.006s
  - Sketch transfer: 0.000s
  - Model fetch: 0.000s
  - Total per node: 0.164s

=== TOTAL COMPUTATIONAL WORK (sum across all nodes) ===
  - Total sketching: 3.162s
  - Total filtering: 0.006s
  - Total aggregation: 0.118s
  - Total sketch transfer: 0.000s
  - Total model fetch: 0.000s
  - Grand total: 3.287s
  - Mean acceptance rate: 0.735

Sketchguard Algorithm Properties:
  - Original dimension: 1,174,986
  - Sketch size: 180
  - Compression ratio: 19.9x
  - Single repetition: No repetitions needed
  - Theoretical complexity: O(d + N×k)
  - Approach: Sketch filtering + state aggregation
