Device: cuda
Seed: 987654321
Loading 1 LEAF Sent140 train files...
LEAF Sent140 train: 254555 users, 908652 samples
Building vocabulary (max_size=10000)...
Vocabulary size: 10000
Loading 1 LEAF Sent140 test files...
LEAF Sent140 test: 254555 users, 286281 samples
Found 254555 train users, 254555 test users, 254555 common users
User sample counts range: 494 (max) to 1 (min)
Distributed ALL 254555 users across 20 clients
Users per client: 12727 (with 15 clients getting +1 user)
Train partition sizes: [44353, 44290, 44657, 44907, 44696, 45843, 45801, 45619, 45069, 45639, 45821, 45311, 45779, 46056, 45625, 45984, 46428, 44737, 45540, 46497]
Test partition sizes: [14232, 14235, 14266, 14217, 14238, 14373, 14346, 14334, 14294, 14373, 14344, 14302, 14354, 14362, 14320, 14395, 14389, 14257, 14251, 14399]
  Client 0: 44353 train samples, 2 unique classes
  Client 1: 44290 train samples, 2 unique classes
  Client 2: 44657 train samples, 2 unique classes
  Client 3: 44907 train samples, 2 unique classes
  Client 4: 44696 train samples, 2 unique classes
  Client 5: 45843 train samples, 2 unique classes
  Client 6: 45801 train samples, 2 unique classes
  Client 7: 45619 train samples, 2 unique classes
  Client 8: 45069 train samples, 2 unique classes
  Client 9: 45639 train samples, 2 unique classes
  Client 10: 45821 train samples, 2 unique classes
  Client 11: 45311 train samples, 2 unique classes
  Client 12: 45779 train samples, 2 unique classes
  Client 13: 46056 train samples, 2 unique classes
  Client 14: 45625 train samples, 2 unique classes
  Client 15: 45984 train samples, 2 unique classes
  Client 16: 46428 train samples, 2 unique classes
  Client 17: 44737 train samples, 2 unique classes
  Client 18: 45540 train samples, 2 unique classes
  Client 19: 46497 train samples, 2 unique classes
Will sample 4500 samples per client per epoch
Graph: ring, nodes: 20, edges: 20
Degree statistics: avg=2.00, min=2, max=2
Attack: Compromised 2/20 nodes: [5, 13]
Attack type: directed_deviation, lambda: 1.0
Model variant: baseline
Model parameters: 1,174,986
Sketchguard Node 0:
  Model dim: 1,174,986 → Sketch size: 180
  Compression ratio: 6527.7x
  Using model parameters for aggregation, sketches for filtering
Sketchguard Node 1:
  Model dim: 1,174,986 → Sketch size: 180
  Compression ratio: 6527.7x
  Using model parameters for aggregation, sketches for filtering
Sketchguard Node 2:
  Model dim: 1,174,986 → Sketch size: 180
  Compression ratio: 6527.7x
  Using model parameters for aggregation, sketches for filtering
Sketchguard Node 3:
  Model dim: 1,174,986 → Sketch size: 180
  Compression ratio: 6527.7x
  Using model parameters for aggregation, sketches for filtering
Sketchguard Node 4:
  Model dim: 1,174,986 → Sketch size: 180
  Compression ratio: 6527.7x
  Using model parameters for aggregation, sketches for filtering
Sketchguard Node 5:
  Model dim: 1,174,986 → Sketch size: 180
  Compression ratio: 6527.7x
  Using model parameters for aggregation, sketches for filtering
Sketchguard Node 6:
  Model dim: 1,174,986 → Sketch size: 180
  Compression ratio: 6527.7x
  Using model parameters for aggregation, sketches for filtering
Sketchguard Node 7:
  Model dim: 1,174,986 → Sketch size: 180
  Compression ratio: 6527.7x
  Using model parameters for aggregation, sketches for filtering
Sketchguard Node 8:
  Model dim: 1,174,986 → Sketch size: 180
  Compression ratio: 6527.7x
  Using model parameters for aggregation, sketches for filtering
Sketchguard Node 9:
  Model dim: 1,174,986 → Sketch size: 180
  Compression ratio: 6527.7x
  Using model parameters for aggregation, sketches for filtering
Sketchguard Node 10:
  Model dim: 1,174,986 → Sketch size: 180
  Compression ratio: 6527.7x
  Using model parameters for aggregation, sketches for filtering
Sketchguard Node 11:
  Model dim: 1,174,986 → Sketch size: 180
  Compression ratio: 6527.7x
  Using model parameters for aggregation, sketches for filtering
Sketchguard Node 12:
  Model dim: 1,174,986 → Sketch size: 180
  Compression ratio: 6527.7x
  Using model parameters for aggregation, sketches for filtering
Sketchguard Node 13:
  Model dim: 1,174,986 → Sketch size: 180
  Compression ratio: 6527.7x
  Using model parameters for aggregation, sketches for filtering
Sketchguard Node 14:
  Model dim: 1,174,986 → Sketch size: 180
  Compression ratio: 6527.7x
  Using model parameters for aggregation, sketches for filtering
Sketchguard Node 15:
  Model dim: 1,174,986 → Sketch size: 180
  Compression ratio: 6527.7x
  Using model parameters for aggregation, sketches for filtering
Sketchguard Node 16:
  Model dim: 1,174,986 → Sketch size: 180
  Compression ratio: 6527.7x
  Using model parameters for aggregation, sketches for filtering
Sketchguard Node 17:
  Model dim: 1,174,986 → Sketch size: 180
  Compression ratio: 6527.7x
  Using model parameters for aggregation, sketches for filtering
Sketchguard Node 18:
  Model dim: 1,174,986 → Sketch size: 180
  Compression ratio: 6527.7x
  Using model parameters for aggregation, sketches for filtering
Sketchguard Node 19:
  Model dim: 1,174,986 → Sketch size: 180
  Compression ratio: 6527.7x
  Using model parameters for aggregation, sketches for filtering
Sketchguard ALGORITHM (Sketch-based Filtering + State Aggregation)
  - Model dimension: 1,174,986 parameters
  - Config: SketchguardConfig(gamma=2, kappa=1, alpha=0.5, min_neighbors=1, sketch_size=180, network_seed=987654321, attack_detection_window=5)
  - Sketch size: 180
  - Compression ratio: 6527.7x
  - Complexity: O(d + N×k) = O(1,174,986 + 20×180)
  - Theoretical speedup vs BALANCE: 19.9x
Initial test acc across nodes: mean=0.4953 ± 0.0174
Round 001: test acc mean=0.5390 ± 0.0372 | min=0.4878 max=0.6236
         : test loss mean=0.9510 ± 0.5279
         : individual accs = ['0.583263', '0.623604', '0.535118', '0.566575', '0.507375', '0.508592', '0.499024', '0.576531', '0.501189', '0.572254', '0.509481', '0.553419', '0.494496', '0.527712', '0.487779', '0.527405', '0.526583', '0.595778', '0.520525', '0.563650']
         : correct/total = [(8301, 14232), (8877, 14235), (7634, 14266), (8055, 14217), (7224, 14238), (7310, 14373), (7159, 14346), (8264, 14334), (7164, 14294), (8225, 14373), (7308, 14344), (7915, 14302), (7098, 14354), (7579, 14362), (6985, 14320), (7592, 14395), (7577, 14389), (8494, 14257), (7418, 14251), (8116, 14399)]
         : compromised: 0.5182, honest: 0.5413
         : sketchguard stats = ['Node 0: acc_rate=1.000', 'Node 1: acc_rate=1.000', 'Node 2: acc_rate=1.000']...
Round 002: test acc mean=0.5560 ± 0.0517 | min=0.4890 max=0.6374
         : test loss mean=0.7481 ± 0.2715
         : individual accs = ['0.637366', '0.632034', '0.634235', '0.514314', '0.546004', '0.520281', '0.529276', '0.488977', '0.622289', '0.612746', '0.603249', '0.501748', '0.496586', '0.524439', '0.507193', '0.502258', '0.542289', '0.550116', '0.540032', '0.615390']
         : correct/total = [(9071, 14232), (8997, 14235), (9048, 14266), (7312, 14217), (7774, 14238), (7478, 14373), (7593, 14346), (7009, 14334), (8895, 14294), (8807, 14373), (8653, 14344), (7176, 14302), (7128, 14354), (7532, 14362), (7263, 14320), (7230, 14395), (7803, 14389), (7843, 14257), (7696, 14251), (8861, 14399)]
         : compromised: 0.5224, honest: 0.5598
         : sketchguard stats = ['Node 0: acc_rate=1.000', 'Node 1: acc_rate=1.000', 'Node 2: acc_rate=1.000']...
Round 003: test acc mean=0.5921 ± 0.0388 | min=0.4940 max=0.6358
         : test loss mean=0.6723 ± 0.0127
         : individual accs = ['0.593873', '0.630910', '0.626665', '0.615320', '0.600506', '0.576289', '0.574725', '0.584903', '0.591297', '0.635775', '0.604016', '0.493987', '0.503065', '0.534396', '0.609567', '0.602084', '0.629022', '0.596830', '0.614203', '0.624488']
         : correct/total = [(8452, 14232), (8981, 14235), (8940, 14266), (8748, 14217), (8550, 14238), (8283, 14373), (8245, 14346), (8384, 14334), (8452, 14294), (9138, 14373), (8664, 14344), (7065, 14302), (7221, 14354), (7675, 14362), (8729, 14320), (8667, 14395), (9051, 14389), (8509, 14257), (8753, 14251), (8992, 14399)]
         : compromised: 0.5553, honest: 0.5962
         : sketchguard stats = ['Node 0: acc_rate=1.000', 'Node 1: acc_rate=1.000', 'Node 2: acc_rate=1.000']...
Round 004: test acc mean=0.6237 ± 0.0161 | min=0.5809 max=0.6417
         : test loss mean=0.6555 ± 0.0092
         : individual accs = ['0.639193', '0.637092', '0.639773', '0.629528', '0.636957', '0.608850', '0.635160', '0.641691', '0.624598', '0.623600', '0.580940', '0.605440', '0.608750', '0.594555', '0.620740', '0.620771', '0.630690', '0.633584', '0.623465', '0.638447']
         : correct/total = [(9097, 14232), (9069, 14235), (9127, 14266), (8950, 14217), (9069, 14238), (8751, 14373), (9112, 14346), (9198, 14334), (8928, 14294), (8963, 14373), (8333, 14344), (8659, 14302), (8738, 14354), (8539, 14362), (8889, 14320), (8936, 14395), (9075, 14389), (9033, 14257), (8885, 14251), (9193, 14399)]
         : compromised: 0.6017, honest: 0.6261
         : sketchguard stats = ['Node 0: acc_rate=1.000', 'Node 1: acc_rate=1.000', 'Node 2: acc_rate=1.000']...
Round 005: test acc mean=0.6322 ± 0.0120 | min=0.5943 max=0.6504
         : test loss mean=0.6478 ± 0.0095
         : individual accs = ['0.642847', '0.647208', '0.638231', '0.631920', '0.650442', '0.625826', '0.627492', '0.627738', '0.638799', '0.636471', '0.594325', '0.634666', '0.639264', '0.611684', '0.635196', '0.630149', '0.626590', '0.630147', '0.636447', '0.638030']
         : correct/total = [(9149, 14232), (9213, 14235), (9105, 14266), (8984, 14217), (9261, 14238), (8995, 14373), (9002, 14346), (8998, 14334), (9131, 14294), (9148, 14373), (8525, 14344), (9077, 14302), (9176, 14354), (8785, 14362), (9096, 14320), (9071, 14395), (9016, 14389), (8984, 14257), (9070, 14251), (9187, 14399)]
         : compromised: 0.6188, honest: 0.6337
         : sketchguard stats = ['Node 0: acc_rate=1.000', 'Node 1: acc_rate=1.000', 'Node 2: acc_rate=1.000']...
Round 006: test acc mean=0.6424 ± 0.0092 | min=0.6155 max=0.6612
         : test loss mean=0.6400 ± 0.0104
         : individual accs = ['0.647976', '0.647840', '0.643208', '0.653232', '0.661188', '0.640646', '0.646243', '0.654667', '0.640129', '0.634106', '0.642847', '0.639911', '0.632576', '0.615513', '0.643994', '0.640500', '0.638752', '0.639405', '0.638201', '0.647962']
         : correct/total = [(9222, 14232), (9222, 14235), (9176, 14266), (9287, 14217), (9414, 14238), (9208, 14373), (9271, 14346), (9384, 14334), (9150, 14294), (9114, 14373), (9221, 14344), (9152, 14302), (9080, 14354), (8840, 14362), (9222, 14320), (9220, 14395), (9191, 14389), (9116, 14257), (9095, 14251), (9330, 14399)]
         : compromised: 0.6281, honest: 0.6440
         : sketchguard stats = ['Node 0: acc_rate=1.000', 'Node 1: acc_rate=1.000', 'Node 2: acc_rate=1.000']...
Round 007: test acc mean=0.6410 ± 0.0109 | min=0.6215 max=0.6640
         : test loss mean=0.6371 ± 0.0101
         : individual accs = ['0.650998', '0.651563', '0.628067', '0.657382', '0.663998', '0.639324', '0.650634', '0.640993', '0.644256', '0.645029', '0.621514', '0.637603', '0.648878', '0.626932', '0.633799', '0.632720', '0.629300', '0.633794', '0.634692', '0.649073']
         : correct/total = [(9265, 14232), (9275, 14235), (8960, 14266), (9346, 14217), (9454, 14238), (9189, 14373), (9334, 14346), (9188, 14334), (9209, 14294), (9271, 14373), (8915, 14344), (9119, 14302), (9314, 14354), (9004, 14362), (9076, 14320), (9108, 14395), (9055, 14389), (9036, 14257), (9045, 14251), (9346, 14399)]
         : compromised: 0.6331, honest: 0.6419
         : sketchguard stats = ['Node 0: acc_rate=1.000', 'Node 1: acc_rate=1.000', 'Node 2: acc_rate=1.000']...
Round 008: test acc mean=0.6434 ± 0.0111 | min=0.6029 max=0.6549
         : test loss mean=0.6350 ± 0.0082
         : individual accs = ['0.645798', '0.641658', '0.653512', '0.651192', '0.654867', '0.637515', '0.635996', '0.632622', '0.644676', '0.649482', '0.642708', '0.636484', '0.646440', '0.602910', '0.650559', '0.649253', '0.648342', '0.648243', '0.642762', '0.652615']
         : correct/total = [(9191, 14232), (9134, 14235), (9323, 14266), (9258, 14217), (9324, 14238), (9163, 14373), (9124, 14346), (9068, 14334), (9215, 14294), (9335, 14373), (9219, 14344), (9103, 14302), (9279, 14354), (8659, 14362), (9316, 14320), (9346, 14395), (9329, 14389), (9242, 14257), (9160, 14251), (9397, 14399)]
         : compromised: 0.6202, honest: 0.6460
         : sketchguard stats = ['Node 0: acc_rate=1.000', 'Node 1: acc_rate=1.000', 'Node 2: acc_rate=1.000']...
Round 009: test acc mean=0.6481 ± 0.0096 | min=0.6274 max=0.6660
         : test loss mean=0.6293 ± 0.0081
         : individual accs = ['0.632589', '0.651563', '0.659470', '0.659351', '0.665964', '0.661101', '0.627422', '0.647133', '0.642437', '0.645098', '0.644241', '0.644525', '0.647276', '0.643504', '0.634497', '0.649045', '0.646814', '0.652802', '0.647253', '0.659560']
         : correct/total = [(9003, 14232), (9275, 14235), (9408, 14266), (9374, 14217), (9482, 14238), (9502, 14373), (9001, 14346), (9276, 14334), (9183, 14294), (9272, 14373), (9241, 14344), (9218, 14302), (9291, 14354), (9242, 14362), (9086, 14320), (9343, 14395), (9307, 14389), (9307, 14257), (9224, 14251), (9497, 14399)]
         : compromised: 0.6523, honest: 0.6476
         : sketchguard stats = ['Node 0: acc_rate=1.000', 'Node 1: acc_rate=1.000', 'Node 2: acc_rate=1.000']...
Round 010: test acc mean=0.6585 ± 0.0063 | min=0.6485 max=0.6721
         : test loss mean=0.6198 ± 0.0076
         : individual accs = ['0.661256', '0.658026', '0.654283', '0.663220', '0.672075', '0.664858', '0.662275', '0.665620', '0.652442', '0.651986', '0.658603', '0.665431', '0.665947', '0.652486', '0.648534', '0.652101', '0.654597', '0.654065', '0.651042', '0.660879']
         : correct/total = [(9411, 14232), (9367, 14235), (9334, 14266), (9429, 14217), (9569, 14238), (9556, 14373), (9501, 14346), (9541, 14334), (9326, 14294), (9371, 14373), (9447, 14344), (9517, 14302), (9559, 14354), (9371, 14362), (9287, 14320), (9387, 14395), (9419, 14389), (9325, 14257), (9278, 14251), (9516, 14399)]
         : compromised: 0.6587, honest: 0.6585
         : sketchguard stats = ['Node 0: acc_rate=1.000', 'Node 1: acc_rate=1.000', 'Node 2: acc_rate=1.000']...

=== FINAL RESULTS ===
Dataset: sent140, Nodes: 20, Graph: ring, Aggregation: sketchguard
Attack: directed_deviation, 10.0% compromised
Final accuracy - Compromised: 0.6587, Honest: 0.6585
Overall test accuracy: mean=0.6585 ± 0.0063

=== Sketchguard SUMMARY ===
Node 0: acceptance=1.000
Node 1: acceptance=1.000
Node 2: acceptance=1.000
Node 3: acceptance=1.000
Node 4: acceptance=0.550
Node 5: acceptance=0.800
Node 6: acceptance=0.550
Node 7: acceptance=1.000
Node 8: acceptance=1.000
Node 9: acceptance=1.000
Node 10: acceptance=1.000
Node 11: acceptance=1.000
Node 12: acceptance=0.600
Node 13: acceptance=0.850
Node 14: acceptance=0.550
Node 15: acceptance=1.000
Node 16: acceptance=1.000
Node 17: acceptance=1.000
Node 18: acceptance=1.000
Node 19: acceptance=1.000

=== PARALLEL EXECUTION TIME (realistic for distributed system) ===
  COMMUNICATION (max across nodes):
    - Sketch transfer: 0.000s (0.0%)
    - Model fetch (accepted): 0.000s (0.0%)
  COMPUTATION (max across nodes):
    - Sketching: 0.226s (95.0%)
    - Filtering: 0.001s (0.3%)
    - Aggregation: 0.011s (4.7%)
  TOTALS:
    - Total computation: 0.238s (100.0%)
    - Total communication: 0.000s (0.0%)
    - Total parallel time: 0.238s

=== PER-NODE AVERAGE TIME ===
  - Sketching: 0.168s
  - Filtering: 0.000s
  - Aggregation: 0.006s
  - Sketch transfer: 0.000s
  - Model fetch: 0.000s
  - Total per node: 0.174s

=== TOTAL COMPUTATIONAL WORK (sum across all nodes) ===
  - Total sketching: 3.350s
  - Total filtering: 0.007s
  - Total aggregation: 0.119s
  - Total sketch transfer: 0.000s
  - Total model fetch: 0.000s
  - Grand total: 3.476s
  - Mean acceptance rate: 0.895

Sketchguard Algorithm Properties:
  - Original dimension: 1,174,986
  - Sketch size: 180
  - Compression ratio: 19.9x
  - Single repetition: No repetitions needed
  - Theoretical complexity: O(d + N×k)
  - Approach: Sketch filtering + state aggregation
