Device: cuda
Seed: 987654321
Loading 1 LEAF Sent140 train files...
LEAF Sent140 train: 254555 users, 908652 samples
Building vocabulary (max_size=10000)...
Vocabulary size: 10000
Loading 1 LEAF Sent140 test files...
LEAF Sent140 test: 254555 users, 286281 samples
Found 254555 train users, 254555 test users, 254555 common users
User sample counts range: 494 (max) to 1 (min)
Distributed ALL 254555 users across 20 clients
Users per client: 12727 (with 15 clients getting +1 user)
Train partition sizes: [44353, 44290, 44657, 44907, 44696, 45843, 45801, 45619, 45069, 45639, 45821, 45311, 45779, 46056, 45625, 45984, 46428, 44737, 45540, 46497]
Test partition sizes: [14232, 14235, 14266, 14217, 14238, 14373, 14346, 14334, 14294, 14373, 14344, 14302, 14354, 14362, 14320, 14395, 14389, 14257, 14251, 14399]
  Client 0: 44353 train samples, 2 unique classes
  Client 1: 44290 train samples, 2 unique classes
  Client 2: 44657 train samples, 2 unique classes
  Client 3: 44907 train samples, 2 unique classes
  Client 4: 44696 train samples, 2 unique classes
  Client 5: 45843 train samples, 2 unique classes
  Client 6: 45801 train samples, 2 unique classes
  Client 7: 45619 train samples, 2 unique classes
  Client 8: 45069 train samples, 2 unique classes
  Client 9: 45639 train samples, 2 unique classes
  Client 10: 45821 train samples, 2 unique classes
  Client 11: 45311 train samples, 2 unique classes
  Client 12: 45779 train samples, 2 unique classes
  Client 13: 46056 train samples, 2 unique classes
  Client 14: 45625 train samples, 2 unique classes
  Client 15: 45984 train samples, 2 unique classes
  Client 16: 46428 train samples, 2 unique classes
  Client 17: 44737 train samples, 2 unique classes
  Client 18: 45540 train samples, 2 unique classes
  Client 19: 46497 train samples, 2 unique classes
Will sample 4500 samples per client per epoch
Graph: erdos, nodes: 20, edges: 99
Degree statistics: avg=9.90, min=7, max=14
Attack: Compromised 16/20 nodes: [1, 2, 3, 5, 6, 8, 9, 10, 11, 12, 13, 14, 15, 17, 18, 19]
Attack type: gaussian, lambda: 1.0
Model variant: baseline
Model parameters: 1,174,986
Sketchguard Node 0:
  Model dim: 1,174,986 → Sketch size: 180
  Compression ratio: 6527.7x
  Using model parameters for aggregation, sketches for filtering
Sketchguard Node 1:
  Model dim: 1,174,986 → Sketch size: 180
  Compression ratio: 6527.7x
  Using model parameters for aggregation, sketches for filtering
Sketchguard Node 2:
  Model dim: 1,174,986 → Sketch size: 180
  Compression ratio: 6527.7x
  Using model parameters for aggregation, sketches for filtering
Sketchguard Node 3:
  Model dim: 1,174,986 → Sketch size: 180
  Compression ratio: 6527.7x
  Using model parameters for aggregation, sketches for filtering
Sketchguard Node 4:
  Model dim: 1,174,986 → Sketch size: 180
  Compression ratio: 6527.7x
  Using model parameters for aggregation, sketches for filtering
Sketchguard Node 5:
  Model dim: 1,174,986 → Sketch size: 180
  Compression ratio: 6527.7x
  Using model parameters for aggregation, sketches for filtering
Sketchguard Node 6:
  Model dim: 1,174,986 → Sketch size: 180
  Compression ratio: 6527.7x
  Using model parameters for aggregation, sketches for filtering
Sketchguard Node 7:
  Model dim: 1,174,986 → Sketch size: 180
  Compression ratio: 6527.7x
  Using model parameters for aggregation, sketches for filtering
Sketchguard Node 8:
  Model dim: 1,174,986 → Sketch size: 180
  Compression ratio: 6527.7x
  Using model parameters for aggregation, sketches for filtering
Sketchguard Node 9:
  Model dim: 1,174,986 → Sketch size: 180
  Compression ratio: 6527.7x
  Using model parameters for aggregation, sketches for filtering
Sketchguard Node 10:
  Model dim: 1,174,986 → Sketch size: 180
  Compression ratio: 6527.7x
  Using model parameters for aggregation, sketches for filtering
Sketchguard Node 11:
  Model dim: 1,174,986 → Sketch size: 180
  Compression ratio: 6527.7x
  Using model parameters for aggregation, sketches for filtering
Sketchguard Node 12:
  Model dim: 1,174,986 → Sketch size: 180
  Compression ratio: 6527.7x
  Using model parameters for aggregation, sketches for filtering
Sketchguard Node 13:
  Model dim: 1,174,986 → Sketch size: 180
  Compression ratio: 6527.7x
  Using model parameters for aggregation, sketches for filtering
Sketchguard Node 14:
  Model dim: 1,174,986 → Sketch size: 180
  Compression ratio: 6527.7x
  Using model parameters for aggregation, sketches for filtering
Sketchguard Node 15:
  Model dim: 1,174,986 → Sketch size: 180
  Compression ratio: 6527.7x
  Using model parameters for aggregation, sketches for filtering
Sketchguard Node 16:
  Model dim: 1,174,986 → Sketch size: 180
  Compression ratio: 6527.7x
  Using model parameters for aggregation, sketches for filtering
Sketchguard Node 17:
  Model dim: 1,174,986 → Sketch size: 180
  Compression ratio: 6527.7x
  Using model parameters for aggregation, sketches for filtering
Sketchguard Node 18:
  Model dim: 1,174,986 → Sketch size: 180
  Compression ratio: 6527.7x
  Using model parameters for aggregation, sketches for filtering
Sketchguard Node 19:
  Model dim: 1,174,986 → Sketch size: 180
  Compression ratio: 6527.7x
  Using model parameters for aggregation, sketches for filtering
Sketchguard ALGORITHM (Sketch-based Filtering + State Aggregation)
  - Model dimension: 1,174,986 parameters
  - Config: SketchguardConfig(gamma=2, kappa=1, alpha=0.5, min_neighbors=1, sketch_size=180, network_seed=987654321, attack_detection_window=5)
  - Sketch size: 180
  - Compression ratio: 6527.7x
  - Complexity: O(d + N×k) = O(1,174,986 + 20×180)
  - Theoretical speedup vs BALANCE: 19.9x
Initial test acc across nodes: mean=0.4953 ± 0.0174
Round 001: test acc mean=0.5559 ± 0.0292 | min=0.5000 max=0.6008
         : test loss mean=44.2046 ± 189.6787
         : individual accs = ['0.582209', '0.561925', '0.520679', '0.555954', '0.593763', '0.549781', '0.533389', '0.595089', '0.554289', '0.600849', '0.512479', '0.571319', '0.593214', '0.543796', '0.521508', '0.563876', '0.572938', '0.568142', '0.523051', '0.500035']
         : correct/total = [(8286, 14232), (7999, 14235), (7428, 14266), (7904, 14217), (8454, 14238), (7902, 14373), (7652, 14346), (8530, 14334), (7923, 14294), (8636, 14373), (7351, 14344), (8171, 14302), (8515, 14354), (7810, 14362), (7468, 14320), (8117, 14395), (8244, 14389), (8100, 14257), (7454, 14251), (7200, 14399)]
         : compromised: 0.5484, honest: 0.5860
         : sketchguard stats = ['Node 0: acc_rate=0.167', 'Node 1: acc_rate=0.400', 'Node 2: acc_rate=0.250']...
Round 002: test acc mean=0.6030 ± 0.0374 | min=0.5143 max=0.6400
         : test loss mean=7.9679 ± 31.7961
         : individual accs = ['0.625632', '0.588479', '0.616431', '0.613421', '0.630145', '0.626383', '0.628050', '0.640017', '0.625857', '0.626035', '0.614682', '0.632849', '0.542149', '0.627141', '0.514316', '0.579229', '0.638404', '0.584274', '0.587397', '0.519064']
         : correct/total = [(8904, 14232), (8377, 14235), (8794, 14266), (8721, 14217), (8972, 14238), (9003, 14373), (9010, 14346), (9174, 14334), (8946, 14294), (8998, 14373), (8817, 14344), (9051, 14302), (7782, 14354), (9007, 14362), (7365, 14320), (8338, 14395), (9186, 14389), (8330, 14257), (8371, 14251), (7474, 14399)]
         : compromised: 0.5954, honest: 0.6335
         : sketchguard stats = ['Node 0: acc_rate=0.167', 'Node 1: acc_rate=0.400', 'Node 2: acc_rate=0.250']...
Round 003: test acc mean=0.6185 ± 0.0341 | min=0.5016 max=0.6484
         : test loss mean=11.0932 ± 45.4951
         : individual accs = ['0.629286', '0.619740', '0.634866', '0.615953', '0.642506', '0.637445', '0.619476', '0.648388', '0.633902', '0.630836', '0.603109', '0.638792', '0.622475', '0.638490', '0.617528', '0.544356', '0.630204', '0.629585', '0.632307', '0.501563']
         : correct/total = [(8956, 14232), (8822, 14235), (9057, 14266), (8757, 14217), (9148, 14238), (9162, 14373), (8887, 14346), (9294, 14334), (9061, 14294), (9067, 14373), (8651, 14344), (9136, 14302), (8935, 14354), (9170, 14362), (8843, 14320), (7836, 14395), (9068, 14389), (8976, 14257), (9011, 14251), (7222, 14399)]
         : compromised: 0.6138, honest: 0.6376
         : sketchguard stats = ['Node 0: acc_rate=0.167', 'Node 1: acc_rate=0.400', 'Node 2: acc_rate=0.250']...
Round 004: test acc mean=0.6328 ± 0.0308 | min=0.5028 max=0.6526
         : test loss mean=4.8375 ± 18.2853
         : individual accs = ['0.639826', '0.626484', '0.630730', '0.643596', '0.637660', '0.652613', '0.643943', '0.643505', '0.650273', '0.648299', '0.632111', '0.637883', '0.647276', '0.639465', '0.621299', '0.636402', '0.641949', '0.640177', '0.640306', '0.502813']
         : correct/total = [(9106, 14232), (8918, 14235), (8998, 14266), (9150, 14217), (9079, 14238), (9380, 14373), (9238, 14346), (9224, 14334), (9295, 14294), (9318, 14373), (9067, 14344), (9123, 14302), (9291, 14354), (9184, 14362), (8897, 14320), (9161, 14395), (9237, 14389), (9127, 14257), (9125, 14251), (7240, 14399)]
         : compromised: 0.6309, honest: 0.6407
         : sketchguard stats = ['Node 0: acc_rate=0.167', 'Node 1: acc_rate=0.400', 'Node 2: acc_rate=0.250']...
Round 005: test acc mean=0.6397 ± 0.0334 | min=0.4956 max=0.6563
         : test loss mean=6.2805 ± 24.6191
         : individual accs = ['0.645868', '0.651423', '0.644469', '0.642892', '0.650583', '0.643777', '0.646522', '0.656342', '0.652582', '0.648021', '0.643196', '0.654034', '0.652153', '0.647890', '0.640712', '0.639319', '0.647648', '0.648734', '0.642551', '0.495590']
         : correct/total = [(9192, 14232), (9273, 14235), (9194, 14266), (9140, 14217), (9263, 14238), (9253, 14373), (9275, 14346), (9408, 14334), (9328, 14294), (9314, 14373), (9226, 14344), (9354, 14302), (9361, 14354), (9305, 14362), (9175, 14320), (9203, 14395), (9319, 14389), (9249, 14257), (9157, 14251), (7136, 14399)]
         : compromised: 0.6371, honest: 0.6501
         : sketchguard stats = ['Node 0: acc_rate=0.167', 'Node 1: acc_rate=0.400', 'Node 2: acc_rate=0.250']...
Round 006: test acc mean=0.6427 ± 0.0320 | min=0.5055 max=0.6600
         : test loss mean=4.8923 ± 18.5941
         : individual accs = ['0.643971', '0.654724', '0.646082', '0.645284', '0.654586', '0.657831', '0.643315', '0.658993', '0.651392', '0.652960', '0.651422', '0.653545', '0.660025', '0.650675', '0.646858', '0.642028', '0.637987', '0.650558', '0.646130', '0.505521']
         : correct/total = [(9165, 14232), (9320, 14235), (9217, 14266), (9174, 14217), (9320, 14238), (9455, 14373), (9229, 14346), (9446, 14334), (9311, 14294), (9385, 14373), (9344, 14344), (9347, 14302), (9474, 14354), (9345, 14362), (9263, 14320), (9242, 14395), (9180, 14389), (9275, 14257), (9208, 14251), (7279, 14399)]
         : compromised: 0.6411, honest: 0.6489
         : sketchguard stats = ['Node 0: acc_rate=0.167', 'Node 1: acc_rate=0.400', 'Node 2: acc_rate=0.250']...
Round 007: test acc mean=0.6470 ± 0.0325 | min=0.5075 max=0.6634
         : test loss mean=36.5887 ± 156.7740
         : individual accs = ['0.651630', '0.658799', '0.649446', '0.652247', '0.659713', '0.663327', '0.641573', '0.655435', '0.653631', '0.656022', '0.650864', '0.655223', '0.663439', '0.652764', '0.651257', '0.657937', '0.657516', '0.658273', '0.642762', '0.507466']
         : correct/total = [(9274, 14232), (9378, 14235), (9265, 14266), (9273, 14217), (9393, 14238), (9534, 14373), (9204, 14346), (9395, 14334), (9343, 14294), (9429, 14373), (9336, 14344), (9371, 14302), (9523, 14354), (9375, 14362), (9326, 14320), (9471, 14395), (9461, 14389), (9385, 14257), (9160, 14251), (7307, 14399)]
         : compromised: 0.6447, honest: 0.6561
         : sketchguard stats = ['Node 0: acc_rate=0.167', 'Node 1: acc_rate=0.400', 'Node 2: acc_rate=0.250']...
Round 008: test acc mean=0.6479 ± 0.0350 | min=0.4985 max=0.6692
         : test loss mean=62.1803 ± 268.3287
         : individual accs = ['0.648609', '0.653249', '0.648395', '0.651685', '0.650583', '0.664440', '0.656559', '0.663318', '0.662166', '0.652473', '0.659718', '0.646553', '0.669221', '0.657638', '0.653701', '0.661619', '0.658072', '0.663464', '0.638411', '0.498507']
         : correct/total = [(9231, 14232), (9299, 14235), (9250, 14266), (9265, 14217), (9263, 14238), (9550, 14373), (9419, 14346), (9508, 14334), (9465, 14294), (9378, 14373), (9463, 14344), (9247, 14302), (9606, 14354), (9445, 14362), (9361, 14320), (9524, 14395), (9469, 14389), (9459, 14257), (9098, 14251), (7178, 14399)]
         : compromised: 0.6461, honest: 0.6551
         : sketchguard stats = ['Node 0: acc_rate=0.167', 'Node 1: acc_rate=0.400', 'Node 2: acc_rate=0.250']...
Round 009: test acc mean=0.6476 ± 0.0354 | min=0.4984 max=0.6720
         : test loss mean=51.8483 ± 223.3009
         : individual accs = ['0.646852', '0.659080', '0.645801', '0.655131', '0.654727', '0.671954', '0.627701', '0.666178', '0.648174', '0.648508', '0.659579', '0.658020', '0.663996', '0.660284', '0.654679', '0.663008', '0.659671', '0.658343', '0.652165', '0.498368']
         : correct/total = [(9206, 14232), (9382, 14235), (9213, 14266), (9314, 14217), (9322, 14238), (9658, 14373), (9005, 14346), (9549, 14334), (9265, 14294), (9321, 14373), (9461, 14344), (9411, 14302), (9531, 14354), (9483, 14362), (9375, 14320), (9544, 14395), (9492, 14389), (9386, 14257), (9294, 14251), (7176, 14399)]
         : compromised: 0.6453, honest: 0.6569
         : sketchguard stats = ['Node 0: acc_rate=0.167', 'Node 1: acc_rate=0.400', 'Node 2: acc_rate=0.250']...
Round 010: test acc mean=0.6563 ± 0.0358 | min=0.5012 max=0.6720
         : test loss mean=43.3846 ± 186.4417
         : individual accs = ['0.661959', '0.669477', '0.657087', '0.660969', '0.667299', '0.671954', '0.661857', '0.671132', '0.667063', '0.662005', '0.664320', '0.660537', '0.670057', '0.660145', '0.660754', '0.665300', '0.663910', '0.667462', '0.662199', '0.501215']
         : correct/total = [(9421, 14232), (9530, 14235), (9374, 14266), (9397, 14217), (9501, 14238), (9658, 14373), (9495, 14346), (9620, 14334), (9535, 14294), (9515, 14373), (9529, 14344), (9447, 14302), (9618, 14354), (9481, 14362), (9462, 14320), (9577, 14395), (9553, 14389), (9516, 14257), (9437, 14251), (7217, 14399)]
         : compromised: 0.6539, honest: 0.6661
         : sketchguard stats = ['Node 0: acc_rate=0.167', 'Node 1: acc_rate=0.400', 'Node 2: acc_rate=0.250']...

=== FINAL RESULTS ===
Dataset: sent140, Nodes: 20, Graph: erdos, Aggregation: sketchguard
Attack: gaussian, 80.0% compromised
Final accuracy - Compromised: 0.6539, Honest: 0.6661
Overall test accuracy: mean=0.6563 ± 0.0358

=== Sketchguard SUMMARY ===
Node 0: acceptance=0.167
Node 1: acceptance=0.400
Node 2: acceptance=0.250
Node 3: acceptance=0.143
Node 4: acceptance=0.222
Node 5: acceptance=0.200
Node 6: acceptance=0.083
Node 7: acceptance=0.091
Node 8: acceptance=0.143
Node 9: acceptance=0.364
Node 10: acceptance=0.250
Node 11: acceptance=0.083
Node 12: acceptance=0.250
Node 13: acceptance=0.111
Node 14: acceptance=0.214
Node 15: acceptance=0.222
Node 16: acceptance=0.143
Node 17: acceptance=0.375
Node 18: acceptance=0.250
Node 19: acceptance=0.500

=== PARALLEL EXECUTION TIME (realistic for distributed system) ===
  COMMUNICATION (max across nodes):
    - Sketch transfer: 0.000s (0.0%)
    - Model fetch (accepted): 0.000s (0.0%)
  COMPUTATION (max across nodes):
    - Sketching: 0.302s (95.5%)
    - Filtering: 0.001s (0.3%)
    - Aggregation: 0.013s (4.2%)
  TOTALS:
    - Total computation: 0.316s (100.0%)
    - Total communication: 0.000s (0.0%)
    - Total parallel time: 0.316s

=== PER-NODE AVERAGE TIME ===
  - Sketching: 0.201s
  - Filtering: 0.001s
  - Aggregation: 0.008s
  - Sketch transfer: 0.000s
  - Model fetch: 0.000s
  - Total per node: 0.209s

=== TOTAL COMPUTATIONAL WORK (sum across all nodes) ===
  - Total sketching: 4.010s
  - Total filtering: 0.011s
  - Total aggregation: 0.156s
  - Total sketch transfer: 0.000s
  - Total model fetch: 0.000s
  - Grand total: 4.177s
  - Mean acceptance rate: 0.223

Sketchguard Algorithm Properties:
  - Original dimension: 1,174,986
  - Sketch size: 180
  - Compression ratio: 19.9x
  - Single repetition: No repetitions needed
  - Theoretical complexity: O(d + N×k)
  - Approach: Sketch filtering + state aggregation
