Device: cuda
Seed: 987654321
Loading 1 LEAF Sent140 train files...
LEAF Sent140 train: 254555 users, 908652 samples
Building vocabulary (max_size=10000)...
Vocabulary size: 10000
Loading 1 LEAF Sent140 test files...
LEAF Sent140 test: 254555 users, 286281 samples
Found 254555 train users, 254555 test users, 254555 common users
User sample counts range: 494 (max) to 1 (min)
Distributed ALL 254555 users across 20 clients
Users per client: 12727 (with 15 clients getting +1 user)
Train partition sizes: [44353, 44290, 44657, 44907, 44696, 45843, 45801, 45619, 45069, 45639, 45821, 45311, 45779, 46056, 45625, 45984, 46428, 44737, 45540, 46497]
Test partition sizes: [14232, 14235, 14266, 14217, 14238, 14373, 14346, 14334, 14294, 14373, 14344, 14302, 14354, 14362, 14320, 14395, 14389, 14257, 14251, 14399]
  Client 0: 44353 train samples, 2 unique classes
  Client 1: 44290 train samples, 2 unique classes
  Client 2: 44657 train samples, 2 unique classes
  Client 3: 44907 train samples, 2 unique classes
  Client 4: 44696 train samples, 2 unique classes
  Client 5: 45843 train samples, 2 unique classes
  Client 6: 45801 train samples, 2 unique classes
  Client 7: 45619 train samples, 2 unique classes
  Client 8: 45069 train samples, 2 unique classes
  Client 9: 45639 train samples, 2 unique classes
  Client 10: 45821 train samples, 2 unique classes
  Client 11: 45311 train samples, 2 unique classes
  Client 12: 45779 train samples, 2 unique classes
  Client 13: 46056 train samples, 2 unique classes
  Client 14: 45625 train samples, 2 unique classes
  Client 15: 45984 train samples, 2 unique classes
  Client 16: 46428 train samples, 2 unique classes
  Client 17: 44737 train samples, 2 unique classes
  Client 18: 45540 train samples, 2 unique classes
  Client 19: 46497 train samples, 2 unique classes
Will sample 4500 samples per client per epoch
Graph: fully, nodes: 20, edges: 190
Degree statistics: avg=19.00, min=19, max=19
Attack: Compromised 10/20 nodes: [1, 2, 5, 11, 12, 13, 14, 15, 17, 18]
Attack type: backdoor, lambda: 1.0
Backdoor target label: 1, trigger size: 3
Model variant: baseline
Model parameters: 1,174,986
UBAR ALGORITHM (Two-Stage Byzantine-resilient)
  - Model dimension: 1,174,986 parameters
  - Rho parameter: 0.5
  - Stage 1: Distance-based filtering (select 50% closest neighbors)
  - Stage 2: Performance-based selection (loss comparison)
  - Complexity: O(deg(i)×d + deg(i)×inference)
Initial test acc across nodes: mean=0.4965 ± 0.0152
Backdoor attack: Created poisoned datasets for 10 compromised nodes
Round 001: test acc mean=0.5189 ± 0.0270 | min=0.4863 max=0.5739
         : test loss mean=18.8053 ± 19.3152
         : individual accs = ['0.520728', '0.493642', '0.486331', '0.542660', '0.540877', '0.498574', '0.540708', '0.568578', '0.506576', '0.573923', '0.536601', '0.497273', '0.501045', '0.511558', '0.511522', '0.499687', '0.562722', '0.503823', '0.487615', '0.494548']
         : correct/total = [(7411, 14232), (7027, 14235), (6938, 14266), (7715, 14217), (7701, 14238), (7166, 14373), (7757, 14346), (8150, 14334), (7241, 14294), (8249, 14373), (7697, 14344), (7112, 14302), (7192, 14354), (7347, 14362), (7325, 14320), (7193, 14395), (8097, 14389), (7183, 14257), (6949, 14251), (7121, 14399)]
         : compromised: 0.4991, honest: 0.5388
         : ubar stats = ['Node 0: s1=0.474, s2=0.111', 'Node 1: s1=0.474, s2=1.000', 'Node 2: s1=0.474, s2=1.000']...
Round 002: test acc mean=0.5066 ± 0.0175 | min=0.4885 max=0.5594
         : test loss mean=613.5650 ± 620.1256
         : individual accs = ['0.515950', '0.502353', '0.501542', '0.503130', '0.500421', '0.506784', '0.497560', '0.552253', '0.488457', '0.493008', '0.499024', '0.503916', '0.505782', '0.493176', '0.498743', '0.495936', '0.499757', '0.508031', '0.507192', '0.559414']
         : correct/total = [(7343, 14232), (7151, 14235), (7155, 14266), (7153, 14217), (7125, 14238), (7284, 14373), (7138, 14346), (7916, 14334), (6982, 14294), (7086, 14373), (7158, 14344), (7207, 14302), (7260, 14354), (7083, 14362), (7142, 14320), (7139, 14395), (7191, 14389), (7243, 14257), (7228, 14251), (8055, 14399)]
         : compromised: 0.5023, honest: 0.5109
         : ubar stats = ['Node 0: s1=0.474, s2=0.556', 'Node 1: s1=0.474, s2=1.000', 'Node 2: s1=0.474, s2=1.000']...
Round 003: test acc mean=0.4974 ± 0.0061 | min=0.4885 max=0.5149
         : test loss mean=52172.8835 ± 53896.2789
         : individual accs = ['0.489109', '0.497295', '0.500070', '0.492228', '0.493960', '0.497739', '0.497560', '0.514860', '0.488457', '0.493008', '0.499024', '0.491540', '0.505364', '0.506893', '0.496718', '0.494547', '0.499757', '0.499123', '0.494913', '0.496354']
         : correct/total = [(6961, 14232), (7079, 14235), (7134, 14266), (6998, 14217), (7033, 14238), (7154, 14373), (7138, 14346), (7380, 14334), (6982, 14294), (7086, 14373), (7158, 14344), (7030, 14302), (7254, 14354), (7280, 14362), (7113, 14320), (7119, 14395), (7191, 14389), (7116, 14257), (7053, 14251), (7147, 14399)]
         : compromised: 0.4984, honest: 0.4964
         : ubar stats = ['Node 0: s1=0.474, s2=0.481', 'Node 1: s1=0.474, s2=1.000', 'Node 2: s1=0.474, s2=1.000']...
Round 004: test acc mean=0.4982 ± 0.0108 | min=0.4866 max=0.5388
         : test loss mean=4933512.0574 ± 5195356.1549
         : individual accs = ['0.497049', '0.491184', '0.486612', '0.492228', '0.538840', '0.501565', '0.497560', '0.509627', '0.488457', '0.493008', '0.499024', '0.497413', '0.496795', '0.490322', '0.489385', '0.503161', '0.499757', '0.499825', '0.496106', '0.496979']
         : correct/total = [(7074, 14232), (6992, 14235), (6942, 14266), (6998, 14217), (7672, 14238), (7209, 14373), (7138, 14346), (7305, 14334), (6982, 14294), (7086, 14373), (7158, 14344), (7114, 14302), (7131, 14354), (7042, 14362), (7008, 14320), (7243, 14395), (7191, 14389), (7126, 14257), (7070, 14251), (7156, 14399)]
         : compromised: 0.4952, honest: 0.5013
         : ubar stats = ['Node 0: s1=0.474, s2=0.417', 'Node 1: s1=0.474, s2=1.000', 'Node 2: s1=0.474, s2=1.000']...
Round 005: test acc mean=0.4996 ± 0.0137 | min=0.4885 max=0.5558
         : test loss mean=293734117.1507 ± 304277693.0820
         : individual accs = ['0.489320', '0.493783', '0.501262', '0.492790', '0.494662', '0.490433', '0.500349', '0.555811', '0.488457', '0.493008', '0.499024', '0.495245', '0.497771', '0.498607', '0.495182', '0.503230', '0.500382', '0.505296', '0.495965', '0.501076']
         : correct/total = [(6964, 14232), (7029, 14235), (7151, 14266), (7006, 14217), (7043, 14238), (7049, 14373), (7178, 14346), (7967, 14334), (6982, 14294), (7086, 14373), (7158, 14344), (7083, 14302), (7145, 14354), (7161, 14362), (7091, 14320), (7244, 14395), (7200, 14389), (7204, 14257), (7068, 14251), (7215, 14399)]
         : compromised: 0.4977, honest: 0.5015
         : ubar stats = ['Node 0: s1=0.474, s2=0.422', 'Node 1: s1=0.474, s2=1.000', 'Node 2: s1=0.474, s2=1.000']...
Round 006: test acc mean=0.5080 ± 0.0198 | min=0.4820 max=0.5535
         : test loss mean=22835032957.2813 ± 23429230961.7467
         : individual accs = ['0.494168', '0.489287', '0.500701', '0.504466', '0.553519', '0.500244', '0.546354', '0.542556', '0.538967', '0.492938', '0.499163', '0.495595', '0.501742', '0.481966', '0.499302', '0.499132', '0.502954', '0.511328', '0.497579', '0.508438']
         : correct/total = [(7033, 14232), (6965, 14235), (7143, 14266), (7172, 14217), (7881, 14238), (7190, 14373), (7838, 14346), (7777, 14334), (7704, 14294), (7085, 14373), (7160, 14344), (7088, 14302), (7202, 14354), (6922, 14362), (7150, 14320), (7185, 14395), (7237, 14389), (7290, 14257), (7091, 14251), (7321, 14399)]
         : compromised: 0.4977, honest: 0.5184
         : ubar stats = ['Node 0: s1=0.474, s2=0.444', 'Node 1: s1=0.474, s2=1.000', 'Node 2: s1=0.474, s2=1.000']...
Round 007: test acc mean=0.5225 ± 0.0359 | min=0.4885 max=0.5884
         : test loss mean=2028188326749.0300 ± 2062757961910.5925
         : individual accs = ['0.585652', '0.490762', '0.488504', '0.505451', '0.588355', '0.494608', '0.574028', '0.577717', '0.568490', '0.493077', '0.507111', '0.496644', '0.508430', '0.493176', '0.497905', '0.494964', '0.528112', '0.497580', '0.502842', '0.556358']
         : correct/total = [(8335, 14232), (6986, 14235), (6969, 14266), (7186, 14217), (8377, 14238), (7109, 14373), (8235, 14346), (8281, 14334), (8126, 14294), (7087, 14373), (7274, 14344), (7103, 14302), (7298, 14354), (7083, 14362), (7130, 14320), (7125, 14395), (7599, 14389), (7094, 14257), (7166, 14251), (8011, 14399)]
         : compromised: 0.4965, honest: 0.5484
         : ubar stats = ['Node 0: s1=0.474, s2=0.397', 'Node 1: s1=0.474, s2=1.000', 'Node 2: s1=0.474, s2=1.000']...
Round 008: test acc mean=0.5389 ± 0.0433 | min=0.4914 max=0.5992
         : test loss mean=185253714199416.9375 ± 189576986232903.2188
         : individual accs = ['0.566259', '0.506147', '0.491378', '0.562777', '0.598680', '0.501496', '0.596752', '0.593833', '0.599202', '0.504488', '0.569925', '0.494197', '0.504668', '0.492689', '0.496858', '0.507676', '0.587115', '0.501648', '0.509087', '0.594069']
         : correct/total = [(8059, 14232), (7205, 14235), (7010, 14266), (8001, 14217), (8524, 14238), (7208, 14373), (8561, 14346), (8512, 14334), (8565, 14294), (7251, 14373), (8175, 14344), (7068, 14302), (7244, 14354), (7076, 14362), (7115, 14320), (7308, 14395), (8448, 14389), (7152, 14257), (7255, 14251), (8554, 14399)]
         : compromised: 0.5006, honest: 0.5773
         : ubar stats = ['Node 0: s1=0.474, s2=0.431', 'Node 1: s1=0.474, s2=1.000', 'Node 2: s1=0.474, s2=1.000']...
Round 009: test acc mean=0.5507 ± 0.0512 | min=0.4916 max=0.6192
         : test loss mean=14346233893825058.0000 ± 14891131264087340.0000
         : individual accs = ['0.575815', '0.499824', '0.503084', '0.603573', '0.619188', '0.498156', '0.614596', '0.606600', '0.598923', '0.566479', '0.598857', '0.505594', '0.504250', '0.498956', '0.498743', '0.491629', '0.606991', '0.500386', '0.508526', '0.614209']
         : correct/total = [(8195, 14232), (7115, 14235), (7177, 14266), (8581, 14217), (8816, 14238), (7160, 14373), (8817, 14346), (8695, 14334), (8561, 14294), (8142, 14373), (8590, 14344), (7231, 14302), (7238, 14354), (7166, 14362), (7142, 14320), (7077, 14395), (8734, 14389), (7134, 14257), (7247, 14251), (8844, 14399)]
         : compromised: 0.5009, honest: 0.6005
         : ubar stats = ['Node 0: s1=0.474, s2=0.407', 'Node 1: s1=0.474, s2=1.000', 'Node 2: s1=0.474, s2=1.000']...
Round 010: test acc mean=0.5613 ± 0.0581 | min=0.4916 max=0.6272
         : test loss mean=1131521716003556992.0000 ± 1157454001749837568.0000
         : individual accs = ['0.609331', '0.503758', '0.499299', '0.624112', '0.627195', '0.506505', '0.621706', '0.620483', '0.616133', '0.610868', '0.618656', '0.500070', '0.503971', '0.511210', '0.491620', '0.507051', '0.618459', '0.507680', '0.503965', '0.624627']
         : correct/total = [(8672, 14232), (7171, 14235), (7123, 14266), (8873, 14217), (8930, 14238), (7280, 14373), (8919, 14346), (8894, 14334), (8807, 14294), (8780, 14373), (8874, 14344), (7152, 14302), (7234, 14354), (7342, 14362), (7040, 14320), (7299, 14395), (8899, 14389), (7238, 14257), (7182, 14251), (8994, 14399)]
         : compromised: 0.5035, honest: 0.6192
         : ubar stats = ['Node 0: s1=0.474, s2=0.378', 'Node 1: s1=0.474, s2=1.000', 'Node 2: s1=0.474, s2=1.000']...

=== FINAL RESULTS ===
Dataset: sent140, Nodes: 20, Graph: fully, Aggregation: ubar
Attack: backdoor, 50.0% compromised
Final accuracy - Compromised: 0.5035, Honest: 0.6192
Overall test accuracy: mean=0.5613 ± 0.0581

=== BACKDOOR ATTACK SUCCESS RATE (ASR) ===
Target label: 1
Trigger size: 3x3
Overall ASR: 0.7601 ± 0.2308
Honest nodes ASR: 0.5319 ± 0.0484
Compromised nodes ASR: 0.9883 ± 0.0059
Note: Higher ASR indicates more successful backdoor attack

=== UBAR SUMMARY ===
Node 0: stage1=0.474, stage2=0.378, overall=0.179
Node 1: stage1=0.474, stage2=1.000, overall=0.474
Node 2: stage1=0.474, stage2=1.000, overall=0.474
Node 3: stage1=0.474, stage2=0.556, overall=0.263
Node 4: stage1=0.474, stage2=0.300, overall=0.142
Node 5: stage1=0.474, stage2=1.000, overall=0.474
Node 6: stage1=0.474, stage2=0.333, overall=0.158
Node 7: stage1=0.474, stage2=0.300, overall=0.142
Node 8: stage1=0.474, stage2=0.556, overall=0.263
Node 9: stage1=0.474, stage2=0.511, overall=0.242
Node 10: stage1=0.474, stage2=0.800, overall=0.379
Node 11: stage1=0.474, stage2=1.000, overall=0.474
Node 12: stage1=0.474, stage2=1.000, overall=0.474
Node 13: stage1=0.474, stage2=1.000, overall=0.474
Node 14: stage1=0.474, stage2=1.000, overall=0.474
Node 15: stage1=0.474, stage2=1.000, overall=0.474
Node 16: stage1=0.474, stage2=0.611, overall=0.289
Node 17: stage1=0.474, stage2=1.000, overall=0.474
Node 18: stage1=0.474, stage2=1.000, overall=0.474
Node 19: stage1=0.474, stage2=0.367, overall=0.174

=== PARALLEL EXECUTION TIME (realistic for distributed system) ===
  COMMUNICATION (max across nodes):
    - Full model transfer: 0.000s (0.0%)
  COMPUTATION (max across nodes):
    - Distance computation: 0.081s (61.7%)
    - Loss computation: 0.035s (27.0%)
    - Aggregation: 0.015s (11.3%)
  TOTALS:
    - Total computation: 0.131s (100.0%)
    - Total communication: 0.000s (0.0%)
    - Total parallel time: 0.131s

=== PER-NODE AVERAGE TIME ===
  - Distance computation: 0.077s
  - Loss computation: 0.033s
  - Aggregation: 0.011s
  - Model transfer: 0.000s
  - Total per node: 0.121s

=== TOTAL COMPUTATIONAL WORK (sum across all nodes) ===
  - Total distance computation: 1.540s
  - Total loss computation: 0.653s
  - Total aggregation: 0.225s
  - Total model transfer: 0.000s
  - Grand total: 2.418s
  - Mean Stage 1 acceptance rate: 0.474
  - Mean Stage 2 acceptance rate: 0.736
  - Overall acceptance rate: 0.348

UBAR Algorithm Properties:
  - Model dimension: 1,174,986
  - Rho parameter: 0.5
  - Two-stage approach: Distance filtering + loss evaluation
  - Stage 1 selects: 50% of neighbors
  - Stage 2 uses: Training sample loss comparison
  - Theoretical complexity: O(deg(i)×d + deg(i)×inference)
  - Approach: UBAR paper implementation
