Device: cuda
Seed: 987654321
Loading 1 LEAF Sent140 train files...
LEAF Sent140 train: 254555 users, 908652 samples
Building vocabulary (max_size=10000)...
Vocabulary size: 10000
Loading 1 LEAF Sent140 test files...
LEAF Sent140 test: 254555 users, 286281 samples
Found 254555 train users, 254555 test users, 254555 common users
User sample counts range: 494 (max) to 1 (min)
Distributed ALL 254555 users across 20 clients
Users per client: 12727 (with 15 clients getting +1 user)
Train partition sizes: [44353, 44290, 44657, 44907, 44696, 45843, 45801, 45619, 45069, 45639, 45821, 45311, 45779, 46056, 45625, 45984, 46428, 44737, 45540, 46497]
Test partition sizes: [14232, 14235, 14266, 14217, 14238, 14373, 14346, 14334, 14294, 14373, 14344, 14302, 14354, 14362, 14320, 14395, 14389, 14257, 14251, 14399]
  Client 0: 44353 train samples, 2 unique classes
  Client 1: 44290 train samples, 2 unique classes
  Client 2: 44657 train samples, 2 unique classes
  Client 3: 44907 train samples, 2 unique classes
  Client 4: 44696 train samples, 2 unique classes
  Client 5: 45843 train samples, 2 unique classes
  Client 6: 45801 train samples, 2 unique classes
  Client 7: 45619 train samples, 2 unique classes
  Client 8: 45069 train samples, 2 unique classes
  Client 9: 45639 train samples, 2 unique classes
  Client 10: 45821 train samples, 2 unique classes
  Client 11: 45311 train samples, 2 unique classes
  Client 12: 45779 train samples, 2 unique classes
  Client 13: 46056 train samples, 2 unique classes
  Client 14: 45625 train samples, 2 unique classes
  Client 15: 45984 train samples, 2 unique classes
  Client 16: 46428 train samples, 2 unique classes
  Client 17: 44737 train samples, 2 unique classes
  Client 18: 45540 train samples, 2 unique classes
  Client 19: 46497 train samples, 2 unique classes
Will sample 4500 samples per client per epoch
Graph: ring, nodes: 20, edges: 20
Degree statistics: avg=2.00, min=2, max=2
Attack: Compromised 6/20 nodes: [5, 12, 13, 14, 17, 18]
Attack type: backdoor, lambda: 1.0
Backdoor target label: 1, trigger size: 3
Model variant: baseline
Model parameters: 1,174,986
Initial test acc across nodes: mean=0.4965 ± 0.0152
Backdoor attack: Created poisoned datasets for 6 compromised nodes
Round 001: test acc mean=0.5635 ± 0.0476 | min=0.4886 max=0.6137
         : test loss mean=11.8786 ± 18.2242
         : individual accs = ['0.597175', '0.598806', '0.601991', '0.595414', '0.588847', '0.506436', '0.579395', '0.613716', '0.610886', '0.598831', '0.593698', '0.599217', '0.500488', '0.508843', '0.495531', '0.503022', '0.598096', '0.493722', '0.488597', '0.596986']
         : correct/total = [(8499, 14232), (8524, 14235), (8588, 14266), (8465, 14217), (8384, 14238), (7279, 14373), (8312, 14346), (8797, 14334), (8732, 14294), (8607, 14373), (8516, 14344), (8570, 14302), (7184, 14354), (7308, 14362), (7096, 14320), (7241, 14395), (8606, 14389), (7039, 14257), (6963, 14251), (8596, 14399)]
         : compromised: 0.4989, honest: 0.5911
Round 002: test acc mean=0.5685 ± 0.0557 | min=0.4958 max=0.6236
         : test loss mean=25.9706 ± 84.6982
         : individual accs = ['0.623243', '0.621215', '0.614398', '0.617008', '0.615255', '0.509149', '0.504879', '0.623622', '0.622569', '0.617825', '0.616704', '0.610544', '0.516929', '0.502924', '0.512709', '0.507746', '0.508652', '0.495827', '0.505298', '0.622821']
         : correct/total = [(8870, 14232), (8843, 14235), (8765, 14266), (8772, 14217), (8760, 14238), (7318, 14373), (7243, 14346), (8939, 14334), (8899, 14294), (8880, 14373), (8846, 14344), (8732, 14302), (7420, 14354), (7223, 14362), (7342, 14320), (7309, 14395), (7319, 14389), (7069, 14257), (7201, 14251), (8968, 14399)]
         : compromised: 0.5071, honest: 0.5947
Round 003: test acc mean=0.5718 ± 0.0623 | min=0.4965 max=0.6365
         : test loss mean=97.7714 ± 403.6328
         : individual accs = ['0.623595', '0.630769', '0.627015', '0.631216', '0.630215', '0.496695', '0.501324', '0.628645', '0.631244', '0.632436', '0.613776', '0.621312', '0.500627', '0.508564', '0.499441', '0.512747', '0.512961', '0.496458', '0.499895', '0.636503']
         : correct/total = [(8875, 14232), (8979, 14235), (8945, 14266), (8974, 14217), (8973, 14238), (7139, 14373), (7192, 14346), (9011, 14334), (9023, 14294), (9090, 14373), (8804, 14344), (8886, 14302), (7186, 14354), (7304, 14362), (7152, 14320), (7381, 14395), (7381, 14389), (7078, 14257), (7124, 14251), (9165, 14399)]
         : compromised: 0.5003, honest: 0.6024
Round 004: test acc mean=0.5789 ± 0.0670 | min=0.4936 max=0.6467
         : test loss mean=125.7087 ± 522.3853
         : individual accs = ['0.646712', '0.638426', '0.638301', '0.637265', '0.639064', '0.501913', '0.508365', '0.640366', '0.636351', '0.640785', '0.634551', '0.634457', '0.498328', '0.496310', '0.500698', '0.518652', '0.519425', '0.493582', '0.509508', '0.645809']
         : correct/total = [(9204, 14232), (9088, 14235), (9106, 14266), (9060, 14217), (9099, 14238), (7214, 14373), (7293, 14346), (9179, 14334), (9096, 14294), (9210, 14373), (9102, 14344), (9074, 14302), (7153, 14354), (7128, 14362), (7170, 14320), (7466, 14395), (7474, 14389), (7037, 14257), (7261, 14251), (9299, 14399)]
         : compromised: 0.5001, honest: 0.6128
Round 005: test acc mean=0.5842 ± 0.0699 | min=0.4971 max=0.6551
         : test loss mean=463.4726 ± 1973.0089
         : individual accs = ['0.652614', '0.652195', '0.645521', '0.650981', '0.653954', '0.506923', '0.501394', '0.646086', '0.641878', '0.636471', '0.643056', '0.639561', '0.498258', '0.511071', '0.503771', '0.531157', '0.510112', '0.497089', '0.507754', '0.655115']
         : correct/total = [(9288, 14232), (9284, 14235), (9209, 14266), (9255, 14217), (9311, 14238), (7286, 14373), (7193, 14346), (9261, 14334), (9175, 14294), (9148, 14373), (9224, 14344), (9147, 14302), (7152, 14354), (7340, 14362), (7214, 14320), (7646, 14395), (7340, 14389), (7087, 14257), (7236, 14251), (9433, 14399)]
         : compromised: 0.5041, honest: 0.6186
Round 006: test acc mean=0.5855 ± 0.0730 | min=0.4932 max=0.6587
         : test loss mean=1064.2985 ± 4585.5729
         : individual accs = ['0.656619', '0.656270', '0.655194', '0.655272', '0.658660', '0.514646', '0.514987', '0.646435', '0.641878', '0.646351', '0.647727', '0.645924', '0.497492', '0.493176', '0.504190', '0.509482', '0.504830', '0.497089', '0.509929', '0.653379']
         : correct/total = [(9345, 14232), (9342, 14235), (9347, 14266), (9316, 14217), (9378, 14238), (7397, 14373), (7388, 14346), (9266, 14334), (9175, 14294), (9290, 14373), (9291, 14344), (9238, 14302), (7141, 14354), (7083, 14362), (7220, 14320), (7334, 14395), (7264, 14389), (7087, 14257), (7267, 14251), (9408, 14399)]
         : compromised: 0.5028, honest: 0.6209
Round 007: test acc mean=0.5900 ± 0.0736 | min=0.4965 max=0.6680
         : test loss mean=3604.7165 ± 15673.0503
         : individual accs = ['0.668002', '0.660485', '0.655895', '0.665049', '0.656904', '0.504766', '0.508644', '0.650063', '0.646285', '0.657135', '0.651352', '0.648511', '0.496865', '0.509400', '0.504469', '0.524835', '0.525957', '0.496458', '0.511122', '0.658657']
         : correct/total = [(9507, 14232), (9402, 14235), (9357, 14266), (9455, 14217), (9353, 14238), (7255, 14373), (7297, 14346), (9318, 14334), (9238, 14294), (9445, 14373), (9343, 14344), (9275, 14302), (7132, 14354), (7316, 14362), (7224, 14320), (7555, 14395), (7568, 14389), (7078, 14257), (7284, 14251), (9484, 14399)]
         : compromised: 0.5038, honest: 0.6270
Round 008: test acc mean=0.5925 ± 0.0761 | min=0.4969 max=0.6673
         : test loss mean=10370.9437 ± 45150.7712
         : individual accs = ['0.665683', '0.665402', '0.665779', '0.665823', '0.653322', '0.508662', '0.513174', '0.657597', '0.660557', '0.659779', '0.657766', '0.651937', '0.501045', '0.503551', '0.504190', '0.512053', '0.529988', '0.496949', '0.508947', '0.667269']
         : correct/total = [(9474, 14232), (9472, 14235), (9498, 14266), (9466, 14217), (9302, 14238), (7311, 14373), (7362, 14346), (9426, 14334), (9442, 14294), (9483, 14373), (9435, 14344), (9324, 14302), (7192, 14354), (7232, 14362), (7220, 14320), (7371, 14395), (7626, 14389), (7085, 14257), (7253, 14251), (9608, 14399)]
         : compromised: 0.5039, honest: 0.6304
Round 009: test acc mean=0.5982 ± 0.0768 | min=0.4971 max=0.6795
         : test loss mean=37445.8234 ± 163188.2427
         : individual accs = ['0.679525', '0.668985', '0.670896', '0.671942', '0.667299', '0.506575', '0.513802', '0.667922', '0.663285', '0.663397', '0.657766', '0.656901', '0.501045', '0.514900', '0.504399', '0.543869', '0.535617', '0.497089', '0.510210', '0.668935']
         : correct/total = [(9671, 14232), (9523, 14235), (9571, 14266), (9553, 14217), (9501, 14238), (7281, 14373), (7371, 14346), (9574, 14334), (9481, 14294), (9535, 14373), (9435, 14344), (9395, 14302), (7192, 14354), (7395, 14362), (7223, 14320), (7829, 14395), (7707, 14389), (7087, 14257), (7271, 14251), (9632, 14399)]
         : compromised: 0.5057, honest: 0.6379
Round 010: test acc mean=0.5991 ± 0.0800 | min=0.4969 max=0.6835
         : test loss mean=142648.2685 ± 621750.1328
         : individual accs = ['0.683530', '0.676502', '0.677064', '0.672997', '0.672004', '0.515411', '0.509410', '0.668481', '0.664754', '0.668754', '0.662368', '0.658719', '0.501881', '0.500557', '0.504190', '0.536645', '0.533672', '0.496949', '0.503614', '0.673797']
         : correct/total = [(9728, 14232), (9630, 14235), (9659, 14266), (9568, 14217), (9568, 14238), (7408, 14373), (7308, 14346), (9582, 14334), (9502, 14294), (9612, 14373), (9501, 14344), (9421, 14302), (7204, 14354), (7189, 14362), (7220, 14320), (7725, 14395), (7679, 14389), (7085, 14257), (7177, 14251), (9702, 14399)]
         : compromised: 0.5038, honest: 0.6399

=== FINAL RESULTS ===
Dataset: sent140, Nodes: 20, Graph: ring, Aggregation: krum
Attack: backdoor, 30.0% compromised
Final accuracy - Compromised: 0.5038, Honest: 0.6399
Overall test accuracy: mean=0.5991 ± 0.0800

=== BACKDOOR ATTACK SUCCESS RATE (ASR) ===
Target label: 1
Trigger size: 3x3
Overall ASR: 0.4162 ± 0.2453
Honest nodes ASR: 0.4991 ± 0.1021
Compromised nodes ASR: 0.2228 ± 0.3504
Note: Higher ASR indicates more successful backdoor attack
