Device: cuda
Seed: 987654321
Loading 1 LEAF Sent140 train files...
LEAF Sent140 train: 254555 users, 908652 samples
Building vocabulary (max_size=10000)...
Vocabulary size: 10000
Loading 1 LEAF Sent140 test files...
LEAF Sent140 test: 254555 users, 286281 samples
Found 254555 train users, 254555 test users, 254555 common users
User sample counts range: 494 (max) to 1 (min)
Distributed ALL 254555 users across 20 clients
Users per client: 12727 (with 15 clients getting +1 user)
Train partition sizes: [44353, 44290, 44657, 44907, 44696, 45843, 45801, 45619, 45069, 45639, 45821, 45311, 45779, 46056, 45625, 45984, 46428, 44737, 45540, 46497]
Test partition sizes: [14232, 14235, 14266, 14217, 14238, 14373, 14346, 14334, 14294, 14373, 14344, 14302, 14354, 14362, 14320, 14395, 14389, 14257, 14251, 14399]
  Client 0: 44353 train samples, 2 unique classes
  Client 1: 44290 train samples, 2 unique classes
  Client 2: 44657 train samples, 2 unique classes
  Client 3: 44907 train samples, 2 unique classes
  Client 4: 44696 train samples, 2 unique classes
  Client 5: 45843 train samples, 2 unique classes
  Client 6: 45801 train samples, 2 unique classes
  Client 7: 45619 train samples, 2 unique classes
  Client 8: 45069 train samples, 2 unique classes
  Client 9: 45639 train samples, 2 unique classes
  Client 10: 45821 train samples, 2 unique classes
  Client 11: 45311 train samples, 2 unique classes
  Client 12: 45779 train samples, 2 unique classes
  Client 13: 46056 train samples, 2 unique classes
  Client 14: 45625 train samples, 2 unique classes
  Client 15: 45984 train samples, 2 unique classes
  Client 16: 46428 train samples, 2 unique classes
  Client 17: 44737 train samples, 2 unique classes
  Client 18: 45540 train samples, 2 unique classes
  Client 19: 46497 train samples, 2 unique classes
Will sample 4500 samples per client per epoch
Graph: erdos, nodes: 20, edges: 126
Degree statistics: avg=12.60, min=8, max=16
Attack: Compromised 4/20 nodes: [5, 12, 13, 17]
Attack type: directed_deviation, lambda: 1.0
Model variant: baseline
Model parameters: 1,174,986
Initial test acc across nodes: mean=0.4965 ± 0.0152
Round 001: test acc mean=0.5103 ± 0.0288 | min=0.4920 max=0.5988
         : test loss mean=22.9304 ± 13.7287
         : individual accs = ['0.504989', '0.504672', '0.503996', '0.592530', '0.499227', '0.501009', '0.502788', '0.504116', '0.497481', '0.598831', '0.510388', '0.502587', '0.499373', '0.493246', '0.496020', '0.501563', '0.499965', '0.491969', '0.504456', '0.495937']
         : correct/total = [(7187, 14232), (7184, 14235), (7190, 14266), (8424, 14217), (7108, 14238), (7201, 14373), (7213, 14346), (7226, 14334), (7111, 14294), (8607, 14373), (7321, 14344), (7188, 14302), (7168, 14354), (7084, 14362), (7103, 14320), (7220, 14395), (7194, 14389), (7014, 14257), (7189, 14251), (7141, 14399)]
         : compromised: 0.4964, honest: 0.5137
Round 002: test acc mean=0.5176 ± 0.0328 | min=0.4871 max=0.6139
         : test loss mean=16.8225 ± 5.6699
         : individual accs = ['0.497541', '0.511907', '0.510935', '0.613913', '0.513906', '0.507271', '0.509062', '0.501256', '0.514552', '0.613720', '0.500070', '0.509929', '0.513446', '0.513160', '0.504120', '0.517332', '0.505386', '0.487059', '0.506000', '0.501771']
         : correct/total = [(7081, 14232), (7287, 14235), (7289, 14266), (8728, 14217), (7317, 14238), (7291, 14373), (7303, 14346), (7185, 14334), (7355, 14294), (8821, 14373), (7173, 14344), (7293, 14302), (7370, 14354), (7370, 14362), (7219, 14320), (7447, 14395), (7272, 14389), (6944, 14257), (7211, 14251), (7225, 14399)]
         : compromised: 0.5052, honest: 0.5207
Round 003: test acc mean=0.4958 ± 0.0073 | min=0.4859 max=0.5139
         : test loss mean=3.7414 ± 1.2237
         : individual accs = ['0.488477', '0.486266', '0.485911', '0.490399', '0.495505', '0.493564', '0.497491', '0.495186', '0.487407', '0.506366', '0.496235', '0.492099', '0.499512', '0.508773', '0.495810', '0.498437', '0.499479', '0.513923', '0.488738', '0.496562']
         : correct/total = [(6952, 14232), (6922, 14235), (6932, 14266), (6972, 14217), (7055, 14238), (7094, 14373), (7137, 14346), (7098, 14334), (6967, 14294), (7278, 14373), (7118, 14344), (7038, 14302), (7170, 14354), (7307, 14362), (7100, 14320), (7175, 14395), (7187, 14389), (7327, 14257), (6965, 14251), (7150, 14399)]
         : compromised: 0.5039, honest: 0.4938
Round 004: test acc mean=0.5059 ± 0.0068 | min=0.4935 max=0.5231
         : test loss mean=0.7961 ± 0.0202
         : individual accs = ['0.504848', '0.504461', '0.505187', '0.513399', '0.493538', '0.498574', '0.500906', '0.504883', '0.523087', '0.509567', '0.506902', '0.506642', '0.501045', '0.502507', '0.498534', '0.512261', '0.508235', '0.518412', '0.502561', '0.502465']
         : correct/total = [(7185, 14232), (7181, 14235), (7207, 14266), (7299, 14217), (7027, 14238), (7166, 14373), (7186, 14346), (7237, 14334), (7477, 14294), (7324, 14373), (7271, 14344), (7246, 14302), (7192, 14354), (7217, 14362), (7139, 14320), (7374, 14395), (7313, 14389), (7391, 14257), (7162, 14251), (7235, 14399)]
         : compromised: 0.5051, honest: 0.5061
Round 005: test acc mean=0.5085 ± 0.0049 | min=0.4979 max=0.5162
         : test loss mean=0.7376 ± 0.0030
         : individual accs = ['0.504848', '0.504742', '0.504486', '0.508054', '0.499649', '0.506714', '0.497909', '0.511093', '0.511473', '0.508523', '0.512409', '0.510768', '0.506549', '0.515806', '0.510335', '0.516151', '0.512197', '0.503051', '0.510140', '0.515036']
         : correct/total = [(7185, 14232), (7185, 14235), (7197, 14266), (7223, 14217), (7114, 14238), (7283, 14373), (7143, 14346), (7326, 14334), (7311, 14294), (7309, 14373), (7350, 14344), (7305, 14302), (7271, 14354), (7408, 14362), (7308, 14320), (7430, 14395), (7370, 14389), (7172, 14257), (7270, 14251), (7416, 14399)]
         : compromised: 0.5080, honest: 0.5086
Round 006: test acc mean=0.5112 ± 0.0045 | min=0.5046 max=0.5222
         : test loss mean=0.7232 ± 0.0037
         : individual accs = ['0.511664', '0.509308', '0.510234', '0.508898', '0.504635', '0.513184', '0.505367', '0.515836', '0.516231', '0.514506', '0.522239', '0.506083', '0.509753', '0.516154', '0.514874', '0.505314', '0.506637', '0.511819', '0.507543', '0.513716']
         : correct/total = [(7282, 14232), (7250, 14235), (7279, 14266), (7235, 14217), (7185, 14238), (7376, 14373), (7250, 14346), (7394, 14334), (7379, 14294), (7395, 14373), (7491, 14344), (7238, 14302), (7317, 14354), (7413, 14362), (7373, 14320), (7274, 14395), (7290, 14389), (7297, 14257), (7233, 14251), (7397, 14399)]
         : compromised: 0.5127, honest: 0.5108
Round 007: test acc mean=0.5164 ± 0.0029 | min=0.5105 max=0.5211
         : test loss mean=0.7116 ± 0.0021
         : individual accs = ['0.511242', '0.515911', '0.516262', '0.514244', '0.514749', '0.519516', '0.510456', '0.518906', '0.519309', '0.521116', '0.515756', '0.518459', '0.514769', '0.518939', '0.519413', '0.520111', '0.515324', '0.512590', '0.515753', '0.515661']
         : correct/total = [(7276, 14232), (7344, 14235), (7365, 14266), (7311, 14217), (7329, 14238), (7467, 14373), (7323, 14346), (7438, 14334), (7423, 14294), (7490, 14373), (7398, 14344), (7415, 14302), (7389, 14354), (7453, 14362), (7438, 14320), (7487, 14395), (7415, 14389), (7308, 14257), (7350, 14251), (7425, 14399)]
         : compromised: 0.5165, honest: 0.5164
Round 008: test acc mean=0.5163 ± 0.0039 | min=0.5081 max=0.5249
         : test loss mean=0.7088 ± 0.0017
         : individual accs = ['0.515318', '0.508114', '0.513879', '0.517901', '0.516224', '0.519237', '0.511641', '0.508790', '0.517980', '0.516107', '0.524888', '0.513145', '0.519089', '0.517616', '0.519134', '0.521639', '0.513795', '0.516869', '0.517508', '0.517119']
         : correct/total = [(7334, 14232), (7233, 14235), (7331, 14266), (7363, 14217), (7350, 14238), (7463, 14373), (7340, 14346), (7293, 14334), (7404, 14294), (7418, 14373), (7529, 14344), (7339, 14302), (7451, 14354), (7434, 14362), (7434, 14320), (7509, 14395), (7393, 14389), (7369, 14257), (7375, 14251), (7446, 14399)]
         : compromised: 0.5182, honest: 0.5158
Round 009: test acc mean=0.5168 ± 0.0045 | min=0.5083 max=0.5255
         : test loss mean=0.7036 ± 0.0016
         : individual accs = ['0.514685', '0.516754', '0.512477', '0.508335', '0.510254', '0.520142', '0.510177', '0.520371', '0.517140', '0.525221', '0.517359', '0.518459', '0.521318', '0.525484', '0.515154', '0.518513', '0.519286', '0.513432', '0.514841', '0.517050']
         : correct/total = [(7325, 14232), (7356, 14235), (7311, 14266), (7227, 14217), (7265, 14238), (7476, 14373), (7319, 14346), (7459, 14334), (7392, 14294), (7549, 14373), (7421, 14344), (7415, 14302), (7483, 14354), (7547, 14362), (7377, 14320), (7464, 14395), (7472, 14389), (7320, 14257), (7337, 14251), (7445, 14399)]
         : compromised: 0.5201, honest: 0.5160
Round 010: test acc mean=0.5158 ± 0.0048 | min=0.5066 max=0.5237
         : test loss mean=0.7010 ± 0.0017
         : individual accs = ['0.515669', '0.506990', '0.512477', '0.511289', '0.506602', '0.522925', '0.507668', '0.516464', '0.517490', '0.523690', '0.521054', '0.515103', '0.516790', '0.523117', '0.516341', '0.515874', '0.517826', '0.515326', '0.516946', '0.515869']
         : correct/total = [(7339, 14232), (7217, 14235), (7311, 14266), (7269, 14217), (7213, 14238), (7516, 14373), (7283, 14346), (7403, 14334), (7397, 14294), (7527, 14373), (7474, 14344), (7367, 14302), (7418, 14354), (7513, 14362), (7394, 14320), (7426, 14395), (7451, 14389), (7347, 14257), (7367, 14251), (7428, 14399)]
         : compromised: 0.5195, honest: 0.5148

=== FINAL RESULTS ===
Dataset: sent140, Nodes: 20, Graph: erdos, Aggregation: krum
Attack: directed_deviation, 20.0% compromised
Final accuracy - Compromised: 0.5195, Honest: 0.5148
Overall test accuracy: mean=0.5158 ± 0.0048
