Device: cuda
Seed: 987654321
Loading 1 LEAF Sent140 train files...
LEAF Sent140 train: 254555 users, 908652 samples
Building vocabulary (max_size=10000)...
Vocabulary size: 10000
Loading 1 LEAF Sent140 test files...
LEAF Sent140 test: 254555 users, 286281 samples
Found 254555 train users, 254555 test users, 254555 common users
User sample counts range: 494 (max) to 1 (min)
Distributed ALL 254555 users across 20 clients
Users per client: 12727 (with 15 clients getting +1 user)
Train partition sizes: [44353, 44290, 44657, 44907, 44696, 45843, 45801, 45619, 45069, 45639, 45821, 45311, 45779, 46056, 45625, 45984, 46428, 44737, 45540, 46497]
Test partition sizes: [14232, 14235, 14266, 14217, 14238, 14373, 14346, 14334, 14294, 14373, 14344, 14302, 14354, 14362, 14320, 14395, 14389, 14257, 14251, 14399]
  Client 0: 44353 train samples, 2 unique classes
  Client 1: 44290 train samples, 2 unique classes
  Client 2: 44657 train samples, 2 unique classes
  Client 3: 44907 train samples, 2 unique classes
  Client 4: 44696 train samples, 2 unique classes
  Client 5: 45843 train samples, 2 unique classes
  Client 6: 45801 train samples, 2 unique classes
  Client 7: 45619 train samples, 2 unique classes
  Client 8: 45069 train samples, 2 unique classes
  Client 9: 45639 train samples, 2 unique classes
  Client 10: 45821 train samples, 2 unique classes
  Client 11: 45311 train samples, 2 unique classes
  Client 12: 45779 train samples, 2 unique classes
  Client 13: 46056 train samples, 2 unique classes
  Client 14: 45625 train samples, 2 unique classes
  Client 15: 45984 train samples, 2 unique classes
  Client 16: 46428 train samples, 2 unique classes
  Client 17: 44737 train samples, 2 unique classes
  Client 18: 45540 train samples, 2 unique classes
  Client 19: 46497 train samples, 2 unique classes
Will sample 4500 samples per client per epoch
Graph: erdos, nodes: 20, edges: 48
Degree statistics: avg=4.80, min=2, max=7
Attack: Compromised 10/20 nodes: [1, 2, 5, 11, 12, 13, 14, 15, 17, 18]
Attack type: gaussian, lambda: 1.0
Model variant: baseline
Model parameters: 1,174,986
UBAR ALGORITHM (Two-Stage Byzantine-resilient)
  - Model dimension: 1,174,986 parameters
  - Rho parameter: 0.5
  - Stage 1: Distance-based filtering (select 50% closest neighbors)
  - Stage 2: Performance-based selection (loss comparison)
  - Complexity: O(deg(i)×d + deg(i)×inference)
Initial test acc across nodes: mean=0.4965 ± 0.0152
Round 001: test acc mean=0.5298 ± 0.0255 | min=0.4775 max=0.5722
         : test loss mean=0.6915 ± 0.0017
         : individual accs = ['0.544056', '0.545978', '0.522080', '0.523106', '0.563984', '0.535170', '0.501324', '0.570532', '0.533581', '0.543589', '0.477482', '0.514474', '0.572175', '0.547347', '0.529818', '0.510524', '0.545903', '0.515256', '0.520174', '0.479686']
         : correct/total = [(7743, 14232), (7772, 14235), (7448, 14266), (7437, 14217), (8030, 14238), (7692, 14373), (7192, 14346), (8178, 14334), (7627, 14294), (7813, 14373), (6849, 14344), (7358, 14302), (8213, 14354), (7861, 14362), (7587, 14320), (7349, 14395), (7855, 14389), (7346, 14257), (7413, 14251), (6907, 14399)]
         : compromised: 0.5313, honest: 0.5283
         : ubar stats = ['Node 0: s1=0.500, s2=0.333', 'Node 1: s1=0.500, s2=0.333', 'Node 2: s1=0.400, s2=1.000']...
Round 002: test acc mean=0.5470 ± 0.0365 | min=0.4885 max=0.5978
         : test loss mean=0.6879 ± 0.0052
         : individual accs = ['0.592327', '0.541342', '0.492359', '0.511219', '0.597767', '0.560982', '0.498118', '0.591182', '0.567441', '0.578515', '0.515477', '0.500350', '0.584576', '0.545328', '0.561034', '0.554359', '0.594551', '0.511398', '0.488527', '0.552469']
         : correct/total = [(8430, 14232), (7706, 14235), (7024, 14266), (7268, 14217), (8511, 14238), (8063, 14373), (7146, 14346), (8474, 14334), (8111, 14294), (8315, 14373), (7394, 14344), (7156, 14302), (8391, 14354), (7832, 14362), (8034, 14320), (7980, 14395), (8555, 14389), (7291, 14257), (6962, 14251), (7955, 14399)]
         : compromised: 0.5340, honest: 0.5599
         : ubar stats = ['Node 0: s1=0.500, s2=0.333', 'Node 1: s1=0.500, s2=0.333', 'Node 2: s1=0.400, s2=1.000']...
Round 003: test acc mean=0.5524 ± 0.0494 | min=0.4864 max=0.6220
         : test loss mean=0.6821 ± 0.0117
         : individual accs = ['0.604904', '0.486407', '0.487312', '0.492228', '0.621997', '0.593543', '0.497560', '0.616436', '0.597873', '0.598483', '0.501046', '0.492029', '0.568622', '0.534118', '0.587709', '0.577631', '0.608798', '0.546819', '0.488738', '0.545038']
         : correct/total = [(8609, 14232), (6924, 14235), (6952, 14266), (6998, 14217), (8856, 14238), (8531, 14373), (7138, 14346), (8836, 14334), (8546, 14294), (8602, 14373), (7187, 14344), (7037, 14302), (8162, 14354), (7671, 14362), (8416, 14320), (8315, 14395), (8760, 14389), (7796, 14257), (6965, 14251), (7848, 14399)]
         : compromised: 0.5363, honest: 0.5684
         : ubar stats = ['Node 0: s1=0.500, s2=0.333', 'Node 1: s1=0.500, s2=0.333', 'Node 2: s1=0.400, s2=1.000']...
Round 004: test acc mean=0.5765 ± 0.0465 | min=0.4923 max=0.6251
         : test loss mean=0.6735 ± 0.0172
         : individual accs = ['0.620714', '0.511556', '0.531964', '0.492298', '0.625088', '0.621791', '0.594521', '0.621320', '0.616343', '0.616781', '0.533254', '0.531184', '0.581510', '0.521794', '0.609148', '0.619104', '0.619640', '0.602792', '0.504596', '0.555594']
         : correct/total = [(8834, 14232), (7282, 14235), (7589, 14266), (6999, 14217), (8900, 14238), (8937, 14373), (8529, 14346), (8906, 14334), (8810, 14294), (8865, 14373), (7649, 14344), (7597, 14302), (8347, 14354), (7494, 14362), (8723, 14320), (8912, 14395), (8916, 14389), (8594, 14257), (7191, 14251), (8000, 14399)]
         : compromised: 0.5635, honest: 0.5896
         : ubar stats = ['Node 0: s1=0.500, s2=0.333', 'Node 1: s1=0.500, s2=0.417', 'Node 2: s1=0.400, s2=1.000']...
Round 005: test acc mean=0.5961 ± 0.0409 | min=0.4887 max=0.6389
         : test loss mean=0.6660 ± 0.0202
         : individual accs = ['0.627881', '0.579838', '0.488714', '0.576845', '0.638924', '0.633549', '0.619964', '0.631854', '0.619840', '0.625826', '0.586447', '0.583415', '0.557893', '0.512046', '0.618156', '0.630288', '0.627146', '0.624535', '0.570416', '0.567609']
         : correct/total = [(8936, 14232), (8254, 14235), (6972, 14266), (8201, 14217), (9097, 14238), (9106, 14373), (8894, 14346), (9057, 14334), (8860, 14294), (8995, 14373), (8412, 14344), (8344, 14302), (8008, 14354), (7354, 14362), (8852, 14320), (9073, 14395), (9024, 14389), (8904, 14257), (8129, 14251), (8173, 14399)]
         : compromised: 0.5799, honest: 0.6122
         : ubar stats = ['Node 0: s1=0.500, s2=0.333', 'Node 1: s1=0.500, s2=0.533', 'Node 2: s1=0.400, s2=1.000']...
Round 006: test acc mean=0.6110 ± 0.0377 | min=0.4982 max=0.6388
         : test loss mean=0.6604 ± 0.0201
         : individual accs = ['0.634064', '0.609062', '0.498248', '0.617711', '0.638713', '0.638767', '0.631256', '0.636808', '0.626627', '0.633549', '0.630786', '0.622920', '0.621290', '0.512812', '0.621299', '0.606530', '0.628536', '0.625026', '0.581363', '0.604695']
         : correct/total = [(9024, 14232), (8670, 14235), (7108, 14266), (8782, 14217), (9094, 14238), (9181, 14373), (9056, 14346), (9128, 14334), (8957, 14294), (9106, 14373), (9048, 14344), (8909, 14302), (8918, 14354), (7365, 14362), (8897, 14320), (8731, 14395), (9044, 14389), (8911, 14257), (8285, 14251), (8707, 14399)]
         : compromised: 0.5937, honest: 0.6283
         : ubar stats = ['Node 0: s1=0.500, s2=0.333', 'Node 1: s1=0.500, s2=0.500', 'Node 2: s1=0.400, s2=1.000']...
Round 007: test acc mean=0.6243 ± 0.0258 | min=0.5367 max=0.6439
         : test loss mean=0.6534 ± 0.0210
         : individual accs = ['0.643901', '0.593467', '0.536731', '0.635366', '0.642717', '0.642733', '0.635369', '0.640087', '0.627046', '0.640854', '0.629392', '0.634946', '0.631949', '0.620248', '0.635754', '0.579229', '0.638196', '0.635127', '0.613431', '0.629280']
         : correct/total = [(9164, 14232), (8448, 14235), (7657, 14266), (9033, 14217), (9151, 14238), (9238, 14373), (9115, 14346), (9175, 14334), (8963, 14294), (9211, 14373), (9028, 14344), (9081, 14302), (9071, 14354), (8908, 14362), (9104, 14320), (8338, 14395), (9183, 14389), (9055, 14257), (8742, 14251), (9061, 14399)]
         : compromised: 0.6124, honest: 0.6362
         : ubar stats = ['Node 0: s1=0.500, s2=0.381', 'Node 1: s1=0.500, s2=0.571', 'Node 2: s1=0.400, s2=1.000']...
Round 008: test acc mean=0.6295 ± 0.0260 | min=0.5237 max=0.6481
         : test loss mean=0.6486 ± 0.0205
         : individual accs = ['0.648117', '0.634282', '0.523693', '0.637265', '0.638151', '0.640785', '0.640806', '0.639947', '0.638730', '0.638350', '0.638107', '0.629143', '0.641076', '0.633686', '0.640154', '0.607294', '0.641879', '0.620046', '0.618062', '0.640392']
         : correct/total = [(9224, 14232), (9029, 14235), (7471, 14266), (9060, 14217), (9086, 14238), (9210, 14373), (9193, 14346), (9173, 14334), (9130, 14294), (9175, 14373), (9153, 14344), (8998, 14302), (9202, 14354), (9101, 14362), (9167, 14320), (8742, 14395), (9236, 14389), (8840, 14257), (8808, 14251), (9221, 14399)]
         : compromised: 0.6188, honest: 0.6402
         : ubar stats = ['Node 0: s1=0.500, s2=0.375', 'Node 1: s1=0.500, s2=0.583', 'Node 2: s1=0.400, s2=1.000']...
Round 009: test acc mean=0.6357 ± 0.0169 | min=0.5830 max=0.6532
         : test loss mean=0.6434 ± 0.0195
         : individual accs = ['0.653176', '0.635687', '0.582995', '0.641415', '0.644824', '0.646351', '0.646522', '0.643435', '0.640898', '0.642594', '0.637549', '0.640889', '0.646997', '0.644687', '0.634846', '0.598958', '0.646119', '0.628183', '0.617150', '0.640114']
         : correct/total = [(9296, 14232), (9049, 14235), (8317, 14266), (9119, 14217), (9181, 14238), (9290, 14373), (9275, 14346), (9223, 14334), (9161, 14294), (9236, 14373), (9145, 14344), (9166, 14302), (9287, 14354), (9259, 14362), (9091, 14320), (8622, 14395), (9297, 14389), (8956, 14257), (8795, 14251), (9217, 14399)]
         : compromised: 0.6277, honest: 0.6437
         : ubar stats = ['Node 0: s1=0.500, s2=0.407', 'Node 1: s1=0.500, s2=0.630', 'Node 2: s1=0.400, s2=1.000']...
Round 010: test acc mean=0.6404 ± 0.0121 | min=0.5967 max=0.6524
         : test loss mean=0.6389 ± 0.0177
         : individual accs = ['0.652403', '0.634071', '0.596663', '0.647675', '0.647493', '0.644403', '0.649310', '0.643784', '0.643277', '0.646142', '0.640337', '0.641868', '0.651386', '0.648030', '0.642109', '0.626120', '0.647787', '0.636740', '0.630201', '0.638447']
         : correct/total = [(9285, 14232), (9026, 14235), (8512, 14266), (9208, 14217), (9219, 14238), (9262, 14373), (9315, 14346), (9228, 14334), (9195, 14294), (9287, 14373), (9185, 14344), (9180, 14302), (9350, 14354), (9307, 14362), (9195, 14320), (9013, 14395), (9321, 14389), (9078, 14257), (8981, 14251), (9193, 14399)]
         : compromised: 0.6352, honest: 0.6457
         : ubar stats = ['Node 0: s1=0.500, s2=0.433', 'Node 1: s1=0.500, s2=0.667', 'Node 2: s1=0.400, s2=1.000']...

=== FINAL RESULTS ===
Dataset: sent140, Nodes: 20, Graph: erdos, Aggregation: ubar
Attack: gaussian, 50.0% compromised
Final accuracy - Compromised: 0.6352, Honest: 0.6457
Overall test accuracy: mean=0.6404 ± 0.0121

=== UBAR SUMMARY ===
Node 0: stage1=0.500, stage2=0.433, overall=0.217
Node 1: stage1=0.500, stage2=0.667, overall=0.333
Node 2: stage1=0.400, stage2=1.000, overall=0.400
Node 3: stage1=0.500, stage2=0.700, overall=0.350
Node 4: stage1=0.500, stage2=0.500, overall=0.250
Node 5: stage1=0.400, stage2=0.500, overall=0.200
Node 6: stage1=0.400, stage2=0.600, overall=0.240
Node 7: stage1=0.400, stage2=0.700, overall=0.280
Node 8: stage1=0.500, stage2=1.000, overall=0.500
Node 9: stage1=0.333, stage2=1.000, overall=0.333
Node 10: stage1=0.500, stage2=0.700, overall=0.350
Node 11: stage1=0.429, stage2=0.400, overall=0.171
Node 12: stage1=0.429, stage2=0.700, overall=0.300
Node 13: stage1=0.500, stage2=0.500, overall=0.250
Node 14: stage1=0.429, stage2=0.333, overall=0.143
Node 15: stage1=0.500, stage2=0.467, overall=0.233
Node 16: stage1=0.400, stage2=0.500, overall=0.200
Node 17: stage1=0.400, stage2=0.650, overall=0.260
Node 18: stage1=0.500, stage2=0.950, overall=0.475
Node 19: stage1=0.500, stage2=1.000, overall=0.500

=== PARALLEL EXECUTION TIME (realistic for distributed system) ===
  COMMUNICATION (max across nodes):
    - Full model transfer: 0.000s (0.0%)
  COMPUTATION (max across nodes):
    - Distance computation: 0.031s (50.5%)
    - Loss computation: 0.026s (41.8%)
    - Aggregation: 0.005s (7.7%)
  TOTALS:
    - Total computation: 0.062s (100.0%)
    - Total communication: 0.000s (0.0%)
    - Total parallel time: 0.062s

=== PER-NODE AVERAGE TIME ===
  - Distance computation: 0.020s
  - Loss computation: 0.012s
  - Aggregation: 0.004s
  - Model transfer: 0.000s
  - Total per node: 0.036s

=== TOTAL COMPUTATIONAL WORK (sum across all nodes) ===
  - Total distance computation: 0.400s
  - Total loss computation: 0.250s
  - Total aggregation: 0.074s
  - Total model transfer: 0.000s
  - Grand total: 0.724s
  - Mean Stage 1 acceptance rate: 0.451
  - Mean Stage 2 acceptance rate: 0.665
  - Overall acceptance rate: 0.300

UBAR Algorithm Properties:
  - Model dimension: 1,174,986
  - Rho parameter: 0.5
  - Two-stage approach: Distance filtering + loss evaluation
  - Stage 1 selects: 50% of neighbors
  - Stage 2 uses: Training sample loss comparison
  - Theoretical complexity: O(deg(i)×d + deg(i)×inference)
  - Approach: UBAR paper implementation
