Device: cuda
Seed: 987654321
Loading 1 LEAF Sent140 train files...
LEAF Sent140 train: 254555 users, 908652 samples
Building vocabulary (max_size=10000)...
Vocabulary size: 10000
Loading 1 LEAF Sent140 test files...
LEAF Sent140 test: 254555 users, 286281 samples
Found 254555 train users, 254555 test users, 254555 common users
User sample counts range: 494 (max) to 1 (min)
Distributed ALL 254555 users across 20 clients
Users per client: 12727 (with 15 clients getting +1 user)
Train partition sizes: [44353, 44290, 44657, 44907, 44696, 45843, 45801, 45619, 45069, 45639, 45821, 45311, 45779, 46056, 45625, 45984, 46428, 44737, 45540, 46497]
Test partition sizes: [14232, 14235, 14266, 14217, 14238, 14373, 14346, 14334, 14294, 14373, 14344, 14302, 14354, 14362, 14320, 14395, 14389, 14257, 14251, 14399]
  Client 0: 44353 train samples, 2 unique classes
  Client 1: 44290 train samples, 2 unique classes
  Client 2: 44657 train samples, 2 unique classes
  Client 3: 44907 train samples, 2 unique classes
  Client 4: 44696 train samples, 2 unique classes
  Client 5: 45843 train samples, 2 unique classes
  Client 6: 45801 train samples, 2 unique classes
  Client 7: 45619 train samples, 2 unique classes
  Client 8: 45069 train samples, 2 unique classes
  Client 9: 45639 train samples, 2 unique classes
  Client 10: 45821 train samples, 2 unique classes
  Client 11: 45311 train samples, 2 unique classes
  Client 12: 45779 train samples, 2 unique classes
  Client 13: 46056 train samples, 2 unique classes
  Client 14: 45625 train samples, 2 unique classes
  Client 15: 45984 train samples, 2 unique classes
  Client 16: 46428 train samples, 2 unique classes
  Client 17: 44737 train samples, 2 unique classes
  Client 18: 45540 train samples, 2 unique classes
  Client 19: 46497 train samples, 2 unique classes
Will sample 4500 samples per client per epoch
Graph: fully, nodes: 20, edges: 190
Degree statistics: avg=19.00, min=19, max=19
Attack: Compromised 6/20 nodes: [5, 12, 13, 14, 17, 18]
Attack type: directed_deviation, lambda: 1.0
Model variant: baseline
Model parameters: 1,174,986
Initial test acc across nodes: mean=0.4965 ± 0.0152
Round 001: test acc mean=0.4970 ± 0.0081 | min=0.4813 max=0.5113
         : test loss mean=2.1263 ± 0.6827
         : individual accs = ['0.505410', '0.486196', '0.489556', '0.488781', '0.492415', '0.500939', '0.502997', '0.511302', '0.508675', '0.502052', '0.495608', '0.500350', '0.499791', '0.493525', '0.500489', '0.501910', '0.481548', '0.501087', '0.481300', '0.496493']
         : correct/total = [(7193, 14232), (6921, 14235), (6984, 14266), (6949, 14217), (7011, 14238), (7200, 14373), (7216, 14346), (7329, 14334), (7271, 14294), (7216, 14373), (7109, 14344), (7156, 14302), (7174, 14354), (7088, 14362), (7167, 14320), (7225, 14395), (6929, 14389), (7144, 14257), (6859, 14251), (7149, 14399)]
         : compromised: 0.4962, honest: 0.4974
Round 002: test acc mean=0.5125 ± 0.0052 | min=0.5043 max=0.5204
         : test loss mean=1.6894 ± 0.0202
         : individual accs = ['0.518479', '0.515701', '0.516473', '0.515861', '0.504284', '0.509080', '0.505019', '0.517092', '0.520428', '0.514646', '0.516383', '0.518809', '0.507872', '0.513508', '0.518156', '0.511358', '0.506290', '0.506418', '0.506631', '0.506980']
         : correct/total = [(7379, 14232), (7341, 14235), (7368, 14266), (7334, 14217), (7180, 14238), (7317, 14373), (7245, 14346), (7412, 14334), (7439, 14294), (7397, 14373), (7407, 14344), (7420, 14302), (7290, 14354), (7375, 14362), (7420, 14320), (7361, 14395), (7285, 14389), (7220, 14257), (7220, 14251), (7300, 14399)]
         : compromised: 0.5103, honest: 0.5134
Round 003: test acc mean=0.5049 ± 0.0056 | min=0.4910 max=0.5136
         : test loss mean=0.6994 ± 0.0011
         : individual accs = ['0.510680', '0.513383', '0.513599', '0.507983', '0.505408', '0.506366', '0.502509', '0.504604', '0.511263', '0.506714', '0.500906', '0.508111', '0.500070', '0.491018', '0.502165', '0.501841', '0.499479', '0.496949', '0.511052', '0.503229']
         : correct/total = [(7268, 14232), (7308, 14235), (7327, 14266), (7222, 14217), (7196, 14238), (7278, 14373), (7209, 14346), (7233, 14334), (7308, 14294), (7283, 14373), (7185, 14344), (7267, 14302), (7178, 14354), (7052, 14362), (7191, 14320), (7224, 14395), (7187, 14389), (7085, 14257), (7283, 14251), (7246, 14399)]
         : compromised: 0.5013, honest: 0.5064
Round 004: test acc mean=0.5228 ± 0.0043 | min=0.5146 max=0.5313
         : test loss mean=0.8198 ± 0.0050
         : individual accs = ['0.520798', '0.516684', '0.521800', '0.525287', '0.522686', '0.514576', '0.520912', '0.518976', '0.528893', '0.524038', '0.522239', '0.521605', '0.521806', '0.528756', '0.521229', '0.531226', '0.522343', '0.521568', '0.518700', '0.531287']
         : correct/total = [(7412, 14232), (7355, 14235), (7444, 14266), (7468, 14217), (7442, 14238), (7396, 14373), (7473, 14346), (7439, 14334), (7560, 14294), (7532, 14373), (7491, 14344), (7460, 14302), (7490, 14354), (7594, 14362), (7464, 14320), (7647, 14395), (7516, 14389), (7436, 14257), (7392, 14251), (7650, 14399)]
         : compromised: 0.5211, honest: 0.5235
Round 005: test acc mean=0.5922 ± 0.0040 | min=0.5843 max=0.5996
         : test loss mean=0.6723 ± 0.0010
         : individual accs = ['0.592819', '0.590516', '0.589794', '0.598790', '0.594817', '0.597788', '0.595218', '0.594879', '0.588988', '0.594100', '0.589166', '0.590757', '0.593005', '0.599568', '0.588198', '0.595137', '0.585725', '0.584274', '0.589362', '0.590319']
         : correct/total = [(8437, 14232), (8406, 14235), (8414, 14266), (8513, 14217), (8469, 14238), (8592, 14373), (8539, 14346), (8527, 14334), (8419, 14294), (8539, 14373), (8451, 14344), (8449, 14302), (8512, 14354), (8611, 14362), (8423, 14320), (8567, 14395), (8428, 14389), (8330, 14257), (8399, 14251), (8500, 14399)]
         : compromised: 0.5920, honest: 0.5922
Round 006: test acc mean=0.5277 ± 0.0049 | min=0.5187 max=0.5390
         : test loss mean=0.7217 ± 0.0032
         : individual accs = ['0.521852', '0.524622', '0.531123', '0.532391', '0.534204', '0.518681', '0.529486', '0.525324', '0.528753', '0.527378', '0.521612', '0.532513', '0.526891', '0.532168', '0.526536', '0.539007', '0.523872', '0.527671', '0.521648', '0.528439']
         : correct/total = [(7427, 14232), (7468, 14235), (7577, 14266), (7569, 14217), (7606, 14238), (7455, 14373), (7596, 14346), (7530, 14334), (7558, 14294), (7580, 14373), (7482, 14344), (7616, 14302), (7563, 14354), (7643, 14362), (7540, 14320), (7759, 14395), (7538, 14389), (7523, 14257), (7434, 14251), (7609, 14399)]
         : compromised: 0.5256, honest: 0.5286
Round 007: test acc mean=0.6010 ± 0.0041 | min=0.5948 max=0.6088
         : test loss mean=0.6629 ± 0.0022
         : individual accs = ['0.602305', '0.597471', '0.597434', '0.603714', '0.602894', '0.607667', '0.601631', '0.601995', '0.598293', '0.605371', '0.602482', '0.594812', '0.607775', '0.608829', '0.597346', '0.601389', '0.596984', '0.595778', '0.595818', '0.600111']
         : correct/total = [(8572, 14232), (8505, 14235), (8523, 14266), (8583, 14217), (8584, 14238), (8734, 14373), (8631, 14346), (8629, 14334), (8552, 14294), (8701, 14373), (8642, 14344), (8507, 14302), (8724, 14354), (8744, 14362), (8554, 14320), (8657, 14395), (8590, 14389), (8494, 14257), (8491, 14251), (8641, 14399)]
         : compromised: 0.6022, honest: 0.6005
Round 008: test acc mean=0.5395 ± 0.0052 | min=0.5292 max=0.5477
         : test loss mean=0.6989 ± 0.0029
         : individual accs = ['0.533235', '0.536214', '0.547736', '0.546177', '0.546495', '0.536631', '0.541614', '0.533138', '0.540786', '0.540667', '0.534788', '0.539575', '0.538456', '0.544980', '0.536872', '0.544425', '0.535062', '0.546749', '0.529156', '0.537954']
         : correct/total = [(7589, 14232), (7633, 14235), (7814, 14266), (7765, 14217), (7781, 14238), (7713, 14373), (7770, 14346), (7642, 14334), (7730, 14294), (7771, 14373), (7671, 14344), (7717, 14302), (7729, 14354), (7827, 14362), (7688, 14320), (7837, 14395), (7699, 14389), (7795, 14257), (7541, 14251), (7746, 14399)]
         : compromised: 0.5388, honest: 0.5398
Round 009: test acc mean=0.6105 ± 0.0040 | min=0.6032 max=0.6196
         : test loss mean=0.6566 ± 0.0022
         : individual accs = ['0.614952', '0.609273', '0.606337', '0.613069', '0.609917', '0.613581', '0.611390', '0.615181', '0.609486', '0.613233', '0.611615', '0.603272', '0.619618', '0.614747', '0.609008', '0.609517', '0.606922', '0.607701', '0.603186', '0.608445']
         : correct/total = [(8752, 14232), (8673, 14235), (8650, 14266), (8716, 14217), (8684, 14238), (8819, 14373), (8771, 14346), (8818, 14334), (8712, 14294), (8814, 14373), (8773, 14344), (8628, 14302), (8894, 14354), (8829, 14362), (8721, 14320), (8774, 14395), (8733, 14389), (8664, 14257), (8596, 14251), (8761, 14399)]
         : compromised: 0.6113, honest: 0.6102
Round 010: test acc mean=0.5493 ± 0.0045 | min=0.5400 max=0.5571
         : test loss mean=0.6896 ± 0.0022
         : individual accs = ['0.547499', '0.546189', '0.551451', '0.557080', '0.554432', '0.545815', '0.549979', '0.541579', '0.553519', '0.551242', '0.548522', '0.545238', '0.547165', '0.556399', '0.549511', '0.555887', '0.546668', '0.548853', '0.540032', '0.549344']
         : correct/total = [(7792, 14232), (7775, 14235), (7867, 14266), (7920, 14217), (7894, 14238), (7845, 14373), (7890, 14346), (7763, 14334), (7912, 14294), (7923, 14373), (7868, 14344), (7798, 14302), (7854, 14354), (7991, 14362), (7869, 14320), (8002, 14395), (7866, 14389), (7825, 14257), (7696, 14251), (7910, 14399)]
         : compromised: 0.5480, honest: 0.5499

=== FINAL RESULTS ===
Dataset: sent140, Nodes: 20, Graph: fully, Aggregation: d-fedavg
Attack: directed_deviation, 30.0% compromised
Final accuracy - Compromised: 0.5480, Honest: 0.5499
Overall test accuracy: mean=0.5493 ± 0.0045
