Device: cuda
Seed: 987654321
Loading 1 LEAF Sent140 train files...
LEAF Sent140 train: 254555 users, 908652 samples
Building vocabulary (max_size=10000)...
Vocabulary size: 10000
Loading 1 LEAF Sent140 test files...
LEAF Sent140 test: 254555 users, 286281 samples
Found 254555 train users, 254555 test users, 254555 common users
User sample counts range: 494 (max) to 1 (min)
Distributed ALL 254555 users across 20 clients
Users per client: 12727 (with 15 clients getting +1 user)
Train partition sizes: [44353, 44290, 44657, 44907, 44696, 45843, 45801, 45619, 45069, 45639, 45821, 45311, 45779, 46056, 45625, 45984, 46428, 44737, 45540, 46497]
Test partition sizes: [14232, 14235, 14266, 14217, 14238, 14373, 14346, 14334, 14294, 14373, 14344, 14302, 14354, 14362, 14320, 14395, 14389, 14257, 14251, 14399]
  Client 0: 44353 train samples, 2 unique classes
  Client 1: 44290 train samples, 2 unique classes
  Client 2: 44657 train samples, 2 unique classes
  Client 3: 44907 train samples, 2 unique classes
  Client 4: 44696 train samples, 2 unique classes
  Client 5: 45843 train samples, 2 unique classes
  Client 6: 45801 train samples, 2 unique classes
  Client 7: 45619 train samples, 2 unique classes
  Client 8: 45069 train samples, 2 unique classes
  Client 9: 45639 train samples, 2 unique classes
  Client 10: 45821 train samples, 2 unique classes
  Client 11: 45311 train samples, 2 unique classes
  Client 12: 45779 train samples, 2 unique classes
  Client 13: 46056 train samples, 2 unique classes
  Client 14: 45625 train samples, 2 unique classes
  Client 15: 45984 train samples, 2 unique classes
  Client 16: 46428 train samples, 2 unique classes
  Client 17: 44737 train samples, 2 unique classes
  Client 18: 45540 train samples, 2 unique classes
  Client 19: 46497 train samples, 2 unique classes
Will sample 4500 samples per client per epoch
Graph: ring, nodes: 20, edges: 20
Degree statistics: avg=2.00, min=2, max=2
Attack: Compromised 16/20 nodes: [1, 2, 3, 5, 6, 8, 9, 10, 11, 12, 13, 14, 15, 17, 18, 19]
Attack type: backdoor, lambda: 1.0
Backdoor target label: 1, trigger size: 3
Model variant: baseline
Model parameters: 1,174,986
Initial test acc across nodes: mean=0.4965 ± 0.0152
Backdoor attack: Created poisoned datasets for 16 compromised nodes
Round 001: test acc mean=0.5010 ± 0.0068 | min=0.4863 max=0.5137
         : test loss mean=18.7263 ± 11.7330
         : individual accs = ['0.503373', '0.511275', '0.486331', '0.496518', '0.509552', '0.499965', '0.513732', '0.493721', '0.509654', '0.498504', '0.492819', '0.496364', '0.502996', '0.507520', '0.495601', '0.502813', '0.495309', '0.500526', '0.499404', '0.504688']
         : correct/total = [(7164, 14232), (7278, 14235), (6938, 14266), (7059, 14217), (7255, 14238), (7186, 14373), (7370, 14346), (7077, 14334), (7285, 14294), (7165, 14373), (7069, 14344), (7099, 14302), (7220, 14354), (7289, 14362), (7097, 14320), (7238, 14395), (7127, 14389), (7136, 14257), (7117, 14251), (7267, 14399)]
         : compromised: 0.5012, honest: 0.5005
Round 002: test acc mean=0.4955 ± 0.0066 | min=0.4855 max=0.5088
         : test loss mean=26.6247 ± 6.0594
         : individual accs = ['0.503302', '0.498771', '0.495934', '0.485475', '0.493679', '0.492382', '0.491078', '0.493163', '0.485938', '0.500383', '0.500000', '0.499650', '0.501533', '0.508843', '0.496578', '0.487322', '0.489263', '0.487480', '0.492176', '0.506285']
         : correct/total = [(7163, 14232), (7100, 14235), (7075, 14266), (6902, 14217), (7029, 14238), (7077, 14373), (7045, 14346), (7069, 14334), (6946, 14294), (7192, 14373), (7172, 14344), (7146, 14302), (7199, 14354), (7308, 14362), (7111, 14320), (7015, 14395), (7040, 14389), (6950, 14257), (7014, 14251), (7290, 14399)]
         : compromised: 0.4956, honest: 0.4949
Round 003: test acc mean=0.4965 ± 0.0061 | min=0.4866 max=0.5066
         : test loss mean=79.6165 ± 41.9478
         : individual accs = ['0.489601', '0.488233', '0.506589', '0.492439', '0.494171', '0.494678', '0.491566', '0.493861', '0.489156', '0.499548', '0.500139', '0.505873', '0.493382', '0.486562', '0.499162', '0.496353', '0.505386', '0.504314', '0.503263', '0.496007']
         : correct/total = [(6968, 14232), (6950, 14235), (7227, 14266), (7001, 14217), (7036, 14238), (7110, 14373), (7052, 14346), (7079, 14334), (6992, 14294), (7180, 14373), (7174, 14344), (7235, 14302), (7082, 14354), (6988, 14362), (7148, 14320), (7145, 14395), (7272, 14389), (7190, 14257), (7172, 14251), (7142, 14399)]
         : compromised: 0.4967, honest: 0.4958
Round 004: test acc mean=0.5016 ± 0.0076 | min=0.4861 max=0.5146
         : test loss mean=769.5508 ± 868.8301
         : individual accs = ['0.509696', '0.514647', '0.486051', '0.506436', '0.506251', '0.506853', '0.507180', '0.505651', '0.511753', '0.492938', '0.498954', '0.491959', '0.499582', '0.508495', '0.495740', '0.501285', '0.500452', '0.496388', '0.488738', '0.503299']
         : correct/total = [(7254, 14232), (7326, 14235), (6934, 14266), (7200, 14217), (7208, 14238), (7285, 14373), (7276, 14346), (7248, 14334), (7315, 14294), (7085, 14373), (7157, 14344), (7036, 14302), (7171, 14354), (7303, 14362), (7099, 14320), (7216, 14395), (7201, 14389), (7077, 14257), (6965, 14251), (7247, 14399)]
         : compromised: 0.5006, honest: 0.5055
Round 005: test acc mean=0.5007 ± 0.0070 | min=0.4872 max=0.5134
         : test loss mean=5440.4870 ± 6618.2988
         : individual accs = ['0.506745', '0.505725', '0.513388', '0.489977', '0.498385', '0.487163', '0.500418', '0.499302', '0.505877', '0.506644', '0.501534', '0.508390', '0.500697', '0.491088', '0.505447', '0.491351', '0.495795', '0.497650', '0.509859', '0.498854']
         : correct/total = [(7212, 14232), (7199, 14235), (7324, 14266), (6966, 14217), (7096, 14238), (7002, 14373), (7179, 14346), (7157, 14334), (7231, 14294), (7282, 14373), (7194, 14344), (7271, 14302), (7187, 14354), (7053, 14362), (7238, 14320), (7073, 14395), (7134, 14389), (7095, 14257), (7266, 14251), (7183, 14399)]
         : compromised: 0.5009, honest: 0.5001
Round 006: test acc mean=0.5008 ± 0.0074 | min=0.4861 max=0.5136
         : test loss mean=29887.7827 ± 36475.8148
         : individual accs = ['0.510680', '0.513593', '0.486121', '0.507772', '0.505900', '0.506157', '0.493866', '0.508093', '0.503778', '0.492938', '0.499024', '0.492029', '0.499443', '0.508564', '0.495810', '0.502675', '0.499826', '0.497931', '0.488738', '0.503507']
         : correct/total = [(7268, 14232), (7311, 14235), (6935, 14266), (7219, 14217), (7203, 14238), (7275, 14373), (7085, 14346), (7283, 14334), (7201, 14294), (7085, 14373), (7158, 14344), (7037, 14302), (7169, 14354), (7304, 14362), (7100, 14320), (7236, 14395), (7192, 14389), (7099, 14257), (6965, 14251), (7250, 14399)]
         : compromised: 0.4995, honest: 0.5061
Round 007: test acc mean=0.4971 ± 0.0081 | min=0.4815 max=0.5117
         : test loss mean=38589.0278 ± 47159.9776
         : individual accs = ['0.493184', '0.484791', '0.511706', '0.481466', '0.489395', '0.487094', '0.497769', '0.495396', '0.488806', '0.505392', '0.501464', '0.506573', '0.497701', '0.491993', '0.503003', '0.499201', '0.499757', '0.504384', '0.509368', '0.493993']
         : correct/total = [(7019, 14232), (6901, 14235), (7300, 14266), (6845, 14217), (6968, 14238), (7001, 14373), (7141, 14346), (7101, 14334), (6987, 14294), (7264, 14373), (7193, 14344), (7245, 14302), (7144, 14354), (7066, 14362), (7203, 14320), (7186, 14395), (7191, 14389), (7191, 14257), (7259, 14251), (7113, 14399)]
         : compromised: 0.4978, honest: 0.4944
Round 008: test acc mean=0.5003 ± 0.0079 | min=0.4846 max=0.5137
         : test loss mean=97152.5935 ± 118778.6707
         : individual accs = ['0.510891', '0.513734', '0.498738', '0.507843', '0.505900', '0.506018', '0.502440', '0.504186', '0.511613', '0.484589', '0.495329', '0.495245', '0.490665', '0.485726', '0.496229', '0.501841', '0.500521', '0.496949', '0.493018', '0.503577']
         : correct/total = [(7271, 14232), (7313, 14235), (7115, 14266), (7220, 14217), (7203, 14238), (7273, 14373), (7208, 14346), (7227, 14334), (7313, 14294), (6965, 14373), (7105, 14344), (7083, 14302), (7043, 14354), (6976, 14362), (7106, 14320), (7224, 14395), (7202, 14389), (7085, 14257), (7026, 14251), (7251, 14399)]
         : compromised: 0.4990, honest: 0.5054
Round 009: test acc mean=0.4952 ± 0.0072 | min=0.4819 max=0.5113
         : test loss mean=1590131.2645 ± 1947547.4293
         : individual accs = ['0.485666', '0.481911', '0.488434', '0.493353', '0.495997', '0.493703', '0.497560', '0.495814', '0.488317', '0.494051', '0.499442', '0.494336', '0.503414', '0.511280', '0.496858', '0.500799', '0.501703', '0.504805', '0.492386', '0.483714']
         : correct/total = [(6912, 14232), (6860, 14235), (6968, 14266), (7014, 14217), (7062, 14238), (7096, 14373), (7138, 14346), (7107, 14334), (6980, 14294), (7101, 14373), (7164, 14344), (7070, 14302), (7226, 14354), (7343, 14362), (7115, 14320), (7209, 14395), (7219, 14389), (7197, 14257), (7017, 14251), (6965, 14399)]
         : compromised: 0.4953, honest: 0.4948
Round 010: test acc mean=0.5015 ± 0.0066 | min=0.4911 max=0.5139
         : test loss mean=1020812.6926 ± 1250203.8200
         : individual accs = ['0.510680', '0.513874', '0.491448', '0.507913', '0.505338', '0.506157', '0.507528', '0.509348', '0.507626', '0.497948', '0.495468', '0.496294', '0.495402', '0.498816', '0.494134', '0.500104', '0.500104', '0.496879', '0.491123', '0.503368']
         : correct/total = [(7268, 14232), (7315, 14235), (7011, 14266), (7221, 14217), (7195, 14238), (7275, 14373), (7281, 14346), (7301, 14334), (7256, 14294), (7157, 14373), (7107, 14344), (7098, 14302), (7111, 14354), (7164, 14362), (7076, 14320), (7199, 14395), (7196, 14389), (7084, 14257), (6999, 14251), (7248, 14399)]
         : compromised: 0.5003, honest: 0.5064

=== FINAL RESULTS ===
Dataset: sent140, Nodes: 20, Graph: ring, Aggregation: krum
Attack: backdoor, 80.0% compromised
Final accuracy - Compromised: 0.5003, Honest: 0.5064
Overall test accuracy: mean=0.5015 ± 0.0066

=== BACKDOOR ATTACK SUCCESS RATE (ASR) ===
Target label: 1
Trigger size: 3x3
Overall ASR: 0.5444 ± 0.4788
Honest nodes ASR: 0.2500 ± 0.4083
Compromised nodes ASR: 0.6180 ± 0.4667
Note: Higher ASR indicates more successful backdoor attack
