Device: cuda
Seed: 987654321
Loading 1 LEAF Sent140 train files...
LEAF Sent140 train: 254555 users, 908652 samples
Building vocabulary (max_size=10000)...
Vocabulary size: 10000
Loading 1 LEAF Sent140 test files...
LEAF Sent140 test: 254555 users, 286281 samples
Found 254555 train users, 254555 test users, 254555 common users
User sample counts range: 494 (max) to 1 (min)
Distributed ALL 254555 users across 20 clients
Users per client: 12727 (with 15 clients getting +1 user)
Train partition sizes: [44353, 44290, 44657, 44907, 44696, 45843, 45801, 45619, 45069, 45639, 45821, 45311, 45779, 46056, 45625, 45984, 46428, 44737, 45540, 46497]
Test partition sizes: [14232, 14235, 14266, 14217, 14238, 14373, 14346, 14334, 14294, 14373, 14344, 14302, 14354, 14362, 14320, 14395, 14389, 14257, 14251, 14399]
  Client 0: 44353 train samples, 2 unique classes
  Client 1: 44290 train samples, 2 unique classes
  Client 2: 44657 train samples, 2 unique classes
  Client 3: 44907 train samples, 2 unique classes
  Client 4: 44696 train samples, 2 unique classes
  Client 5: 45843 train samples, 2 unique classes
  Client 6: 45801 train samples, 2 unique classes
  Client 7: 45619 train samples, 2 unique classes
  Client 8: 45069 train samples, 2 unique classes
  Client 9: 45639 train samples, 2 unique classes
  Client 10: 45821 train samples, 2 unique classes
  Client 11: 45311 train samples, 2 unique classes
  Client 12: 45779 train samples, 2 unique classes
  Client 13: 46056 train samples, 2 unique classes
  Client 14: 45625 train samples, 2 unique classes
  Client 15: 45984 train samples, 2 unique classes
  Client 16: 46428 train samples, 2 unique classes
  Client 17: 44737 train samples, 2 unique classes
  Client 18: 45540 train samples, 2 unique classes
  Client 19: 46497 train samples, 2 unique classes
Will sample 4500 samples per client per epoch
Graph: fully, nodes: 20, edges: 190
Degree statistics: avg=19.00, min=19, max=19
Attack: Compromised 12/20 nodes: [1, 2, 3, 5, 8, 11, 12, 13, 14, 15, 17, 18]
Attack type: gaussian, lambda: 1.0
Model variant: baseline
Model parameters: 1,174,986
BALANCE algorithm:
Balance Config: BALANCEConfig(gamma=2, kappa=1, alpha=0.5, min_neighbors=1)
  - Model dimension: 1,174,986 parameters
  - Complexity: O(N×d) = O(20×1,174,986)
Initial test acc across nodes: mean=0.4953 ± 0.0174
Round 001: test acc mean=0.5664 ± 0.0398 | min=0.5032 max=0.6285
         : test loss mean=0.6898 ± 0.0008
         : individual accs = ['0.582279', '0.552792', '0.522711', '0.519800', '0.628459', '0.567383', '0.620521', '0.625087', '0.511753', '0.590413', '0.534579', '0.559013', '0.622335', '0.525136', '0.540293', '0.572629', '0.503232', '0.597250', '0.547470', '0.604834']
         : correct/total = [(8287, 14232), (7869, 14235), (7457, 14266), (7390, 14217), (8948, 14238), (8155, 14373), (8902, 14346), (8960, 14334), (7315, 14294), (8486, 14373), (7668, 14344), (7995, 14302), (8933, 14354), (7542, 14362), (7737, 14320), (8243, 14395), (7241, 14389), (8515, 14257), (7802, 14251), (8709, 14399)]
         : compromised: 0.5532, honest: 0.5862
Round 002: test acc mean=0.5505 ± 0.0447 | min=0.4918 max=0.6164
         : test loss mean=0.6899 ± 0.0015
         : individual accs = ['0.614882', '0.491816', '0.502453', '0.608005', '0.497542', '0.526612', '0.515475', '0.585182', '0.510144', '0.609894', '0.591188', '0.575234', '0.502856', '0.566982', '0.492598', '0.529073', '0.616443', '0.596549', '0.553786', '0.523022']
         : correct/total = [(8751, 14232), (7001, 14235), (7168, 14266), (8644, 14217), (7084, 14238), (7569, 14373), (7395, 14346), (8388, 14334), (7292, 14294), (8766, 14373), (8480, 14344), (8227, 14302), (7218, 14354), (8143, 14362), (7054, 14320), (7616, 14395), (8870, 14389), (8505, 14257), (7892, 14251), (7531, 14399)]
         : compromised: 0.5380, honest: 0.5692
Round 003: test acc mean=0.5463 ± 0.0442 | min=0.4857 max=0.6217
         : test loss mean=0.6869 ± 0.0029
         : individual accs = ['0.502108', '0.485704', '0.548227', '0.574945', '0.598820', '0.566340', '0.509550', '0.510255', '0.517140', '0.621652', '0.559746', '0.572857', '0.514839', '0.528199', '0.493366', '0.497742', '0.609771', '0.597812', '0.613080', '0.504757']
         : correct/total = [(7146, 14232), (6914, 14235), (7821, 14266), (8174, 14217), (8526, 14238), (8140, 14373), (7310, 14346), (7314, 14334), (7392, 14294), (8935, 14373), (8029, 14344), (8193, 14302), (7390, 14354), (7586, 14362), (7065, 14320), (7165, 14395), (8774, 14389), (8523, 14257), (8737, 14251), (7268, 14399)]
         : compromised: 0.5425, honest: 0.5521
Round 004: test acc mean=0.6242 ± 0.0139 | min=0.5845 max=0.6431
         : test loss mean=0.6721 ± 0.0045
         : individual accs = ['0.622822', '0.584475', '0.631501', '0.628403', '0.623543', '0.633758', '0.636693', '0.609739', '0.621100', '0.627079', '0.619353', '0.632359', '0.600251', '0.631806', '0.607402', '0.632233', '0.643130', '0.627060', '0.631114', '0.640253']
         : correct/total = [(8864, 14232), (8320, 14235), (9009, 14266), (8934, 14217), (8878, 14238), (9109, 14373), (9134, 14346), (8740, 14334), (8878, 14294), (9013, 14373), (8884, 14344), (9044, 14302), (8616, 14354), (9074, 14362), (8698, 14320), (9101, 14395), (9254, 14389), (8940, 14257), (8994, 14251), (9219, 14399)]
         : compromised: 0.6218, honest: 0.6278
Round 005: test acc mean=0.6384 ± 0.0144 | min=0.5798 max=0.6510
         : test loss mean=0.6473 ± 0.0066
         : individual accs = ['0.640037', '0.641447', '0.635847', '0.641275', '0.642646', '0.645933', '0.643385', '0.650970', '0.640828', '0.636680', '0.638037', '0.647742', '0.641981', '0.637237', '0.648603', '0.579785', '0.640003', '0.644666', '0.626833', '0.645045']
         : correct/total = [(9109, 14232), (9131, 14235), (9071, 14266), (9117, 14217), (9150, 14238), (9284, 14373), (9230, 14346), (9331, 14334), (9160, 14294), (9151, 14373), (9152, 14344), (9264, 14302), (9215, 14354), (9152, 14362), (9288, 14320), (8346, 14395), (9209, 14389), (9191, 14257), (8933, 14251), (9288, 14399)]
         : compromised: 0.6360, honest: 0.6421
Round 006: test acc mean=0.6474 ± 0.0039 | min=0.6378 max=0.6517
         : test loss mean=0.6325 ± 0.0025
         : individual accs = ['0.650155', '0.650580', '0.639913', '0.650489', '0.651707', '0.651291', '0.651471', '0.648598', '0.645725', '0.643985', '0.637758', '0.647602', '0.649296', '0.645662', '0.650838', '0.647378', '0.647231', '0.645227', '0.641639', '0.650809']
         : correct/total = [(9253, 14232), (9261, 14235), (9129, 14266), (9248, 14217), (9279, 14238), (9361, 14373), (9346, 14346), (9297, 14334), (9230, 14294), (9256, 14373), (9148, 14344), (9262, 14302), (9320, 14354), (9273, 14362), (9320, 14320), (9319, 14395), (9313, 14389), (9199, 14257), (9144, 14251), (9371, 14399)]
         : compromised: 0.6471, honest: 0.6477
Round 007: test acc mean=0.6512 ± 0.0061 | min=0.6374 max=0.6590
         : test loss mean=0.6278 ± 0.0047
         : individual accs = ['0.656057', '0.652687', '0.640684', '0.654357', '0.656342', '0.659013', '0.656141', '0.639180', '0.652721', '0.652195', '0.648006', '0.653125', '0.657099', '0.647403', '0.655656', '0.637374', '0.656335', '0.653363', '0.645569', '0.650670']
         : correct/total = [(9337, 14232), (9291, 14235), (9140, 14266), (9303, 14217), (9345, 14238), (9472, 14373), (9413, 14346), (9162, 14334), (9330, 14294), (9374, 14373), (9295, 14344), (9341, 14302), (9432, 14354), (9298, 14362), (9389, 14320), (9175, 14395), (9444, 14389), (9315, 14257), (9200, 14251), (9369, 14399)]
         : compromised: 0.6508, honest: 0.6519
Round 008: test acc mean=0.6565 ± 0.0045 | min=0.6433 max=0.6639
         : test loss mean=0.6232 ± 0.0033
         : individual accs = ['0.657813', '0.658026', '0.643278', '0.663853', '0.653954', '0.662423', '0.658093', '0.654458', '0.658528', '0.657900', '0.651492', '0.654034', '0.659119', '0.650954', '0.656844', '0.659604', '0.660018', '0.658133', '0.652235', '0.659143']
         : correct/total = [(9362, 14232), (9367, 14235), (9177, 14266), (9438, 14217), (9311, 14238), (9521, 14373), (9441, 14346), (9381, 14334), (9413, 14294), (9456, 14373), (9345, 14344), (9354, 14302), (9461, 14354), (9349, 14362), (9406, 14320), (9495, 14395), (9497, 14389), (9383, 14257), (9295, 14251), (9491, 14399)]
         : compromised: 0.6564, honest: 0.6566
Round 009: test acc mean=0.6563 ± 0.0077 | min=0.6350 max=0.6690
         : test loss mean=0.6227 ± 0.0064
         : individual accs = ['0.634978', '0.668985', '0.653302', '0.659281', '0.657255', '0.665971', '0.651540', '0.656900', '0.651462', '0.651012', '0.660625', '0.650049', '0.661976', '0.661468', '0.644344', '0.653838', '0.664883', '0.662482', '0.656024', '0.660601']
         : correct/total = [(9037, 14232), (9523, 14235), (9320, 14266), (9373, 14217), (9358, 14238), (9572, 14373), (9347, 14346), (9416, 14334), (9312, 14294), (9357, 14373), (9476, 14344), (9297, 14302), (9502, 14354), (9500, 14362), (9227, 14320), (9412, 14395), (9567, 14389), (9445, 14257), (9349, 14251), (9512, 14399)]
         : compromised: 0.6574, honest: 0.6547
Round 010: test acc mean=0.6671 ± 0.0050 | min=0.6520 max=0.6741
         : test loss mean=0.6131 ± 0.0035
         : individual accs = ['0.668353', '0.670249', '0.651970', '0.671450', '0.672637', '0.669589', '0.669873', '0.674131', '0.667623', '0.664858', '0.662646', '0.664872', '0.672635', '0.665785', '0.665154', '0.662244', '0.669887', '0.670688', '0.661217', '0.665741']
         : correct/total = [(9512, 14232), (9541, 14235), (9301, 14266), (9546, 14217), (9577, 14238), (9624, 14373), (9610, 14346), (9663, 14334), (9543, 14294), (9556, 14373), (9505, 14344), (9509, 14302), (9655, 14354), (9562, 14362), (9525, 14320), (9533, 14395), (9639, 14389), (9562, 14257), (9423, 14251), (9586, 14399)]
         : compromised: 0.6661, honest: 0.6685

=== FINAL RESULTS ===
Dataset: sent140, Nodes: 20, Graph: fully, Aggregation: balance
Attack: gaussian, 60.0% compromised
Final accuracy - Compromised: 0.6661, Honest: 0.6685
Overall test accuracy: mean=0.6671 ± 0.0050

=== BALANCE SUMMARY ===
Node 0: acceptance=0.368
Node 1: acceptance=0.421
Node 2: acceptance=0.421
Node 3: acceptance=0.421
Node 4: acceptance=0.368
Node 5: acceptance=0.421
Node 6: acceptance=0.368
Node 7: acceptance=0.368
Node 8: acceptance=0.421
Node 9: acceptance=0.368
Node 10: acceptance=0.368
Node 11: acceptance=0.421
Node 12: acceptance=0.421
Node 13: acceptance=0.421
Node 14: acceptance=0.421
Node 15: acceptance=0.421
Node 16: acceptance=0.368
Node 17: acceptance=0.421
Node 18: acceptance=0.421
Node 19: acceptance=0.368

=== PARALLEL EXECUTION TIME (realistic for distributed system) ===
  COMMUNICATION (max across nodes):
    - Full model transfer: 0.000s (0.0%)
  COMPUTATION (max across nodes):
    - Filtering: 0.084s (85.2%)
    - Aggregation: 0.015s (14.8%)
  TOTALS:
    - Total computation: 0.098s (100.0%)
    - Total communication: 0.000s (0.0%)
    - Total parallel time: 0.098s

=== PER-NODE AVERAGE TIME ===
  - Filtering: 0.075s
  - Aggregation: 0.008s
  - Model transfer: 0.000s
  - Total per node: 0.084s

=== TOTAL COMPUTATIONAL WORK (sum across all nodes) ===
  - Total filtering: 1.505s
  - Total aggregation: 0.166s
  - Total model transfer: 0.000s
  - Grand total: 1.671s
  - Mean acceptance rate: 0.400

BALANCE Algorithm Properties:
  - Model dimension: 1,174,986
  - No compression: Full parameter comparison
  - Theoretical complexity: O(deg(i)×d)
  - Approach: Full parameter filtering + averaging
