Device: cuda
Seed: 987654321
Loading 1 LEAF Sent140 train files...
LEAF Sent140 train: 254555 users, 908652 samples
Building vocabulary (max_size=10000)...
Vocabulary size: 10000
Loading 1 LEAF Sent140 test files...
LEAF Sent140 test: 254555 users, 286281 samples
Found 254555 train users, 254555 test users, 254555 common users
User sample counts range: 494 (max) to 1 (min)
Distributed ALL 254555 users across 20 clients
Users per client: 12727 (with 15 clients getting +1 user)
Train partition sizes: [44353, 44290, 44657, 44907, 44696, 45843, 45801, 45619, 45069, 45639, 45821, 45311, 45779, 46056, 45625, 45984, 46428, 44737, 45540, 46497]
Test partition sizes: [14232, 14235, 14266, 14217, 14238, 14373, 14346, 14334, 14294, 14373, 14344, 14302, 14354, 14362, 14320, 14395, 14389, 14257, 14251, 14399]
  Client 0: 44353 train samples, 2 unique classes
  Client 1: 44290 train samples, 2 unique classes
  Client 2: 44657 train samples, 2 unique classes
  Client 3: 44907 train samples, 2 unique classes
  Client 4: 44696 train samples, 2 unique classes
  Client 5: 45843 train samples, 2 unique classes
  Client 6: 45801 train samples, 2 unique classes
  Client 7: 45619 train samples, 2 unique classes
  Client 8: 45069 train samples, 2 unique classes
  Client 9: 45639 train samples, 2 unique classes
  Client 10: 45821 train samples, 2 unique classes
  Client 11: 45311 train samples, 2 unique classes
  Client 12: 45779 train samples, 2 unique classes
  Client 13: 46056 train samples, 2 unique classes
  Client 14: 45625 train samples, 2 unique classes
  Client 15: 45984 train samples, 2 unique classes
  Client 16: 46428 train samples, 2 unique classes
  Client 17: 44737 train samples, 2 unique classes
  Client 18: 45540 train samples, 2 unique classes
  Client 19: 46497 train samples, 2 unique classes
Will sample 4500 samples per client per epoch
Graph: erdos, nodes: 20, edges: 126
Degree statistics: avg=12.60, min=8, max=16
Attack: Compromised 4/20 nodes: [5, 12, 13, 17]
Attack type: directed_deviation, lambda: 1.0
Model variant: baseline
Model parameters: 1,174,986
Initial test acc across nodes: mean=0.4953 ± 0.0174
Round 001: test acc mean=0.5007 ± 0.0082 | min=0.4865 max=0.5172
         : test loss mean=1.2509 ± 0.7039
         : individual accs = ['0.508783', '0.500246', '0.517244', '0.516705', '0.486515', '0.488625', '0.500000', '0.506697', '0.504058', '0.495234', '0.500906', '0.490631', '0.499373', '0.490391', '0.500838', '0.502744', '0.494683', '0.501789', '0.509227', '0.498785']
         : correct/total = [(7241, 14232), (7121, 14235), (7379, 14266), (7346, 14217), (6927, 14238), (7023, 14373), (7173, 14346), (7263, 14334), (7205, 14294), (7118, 14373), (7185, 14344), (7017, 14302), (7168, 14354), (7043, 14362), (7172, 14320), (7237, 14395), (7118, 14389), (7154, 14257), (7257, 14251), (7182, 14399)]
         : compromised: 0.4950, honest: 0.5021
Round 002: test acc mean=0.4979 ± 0.0155 | min=0.4632 max=0.5178
         : test loss mean=0.9291 ± 0.2231
         : individual accs = ['0.477797', '0.485213', '0.505888', '0.463178', '0.468113', '0.508384', '0.505019', '0.517790', '0.515951', '0.492799', '0.515477', '0.512446', '0.500836', '0.513369', '0.499092', '0.483640', '0.500869', '0.486778', '0.507824', '0.498437']
         : correct/total = [(6800, 14232), (6907, 14235), (7217, 14266), (6585, 14217), (6665, 14238), (7307, 14373), (7245, 14346), (7422, 14334), (7375, 14294), (7083, 14373), (7394, 14344), (7329, 14302), (7189, 14354), (7373, 14362), (7147, 14320), (6962, 14395), (7207, 14389), (6940, 14257), (7237, 14251), (7177, 14399)]
         : compromised: 0.5023, honest: 0.4968
Round 003: test acc mean=0.4979 ± 0.0122 | min=0.4825 max=0.5384
         : test loss mean=0.7072 ± 0.0272
         : individual accs = ['0.492622', '0.485915', '0.487102', '0.482521', '0.513064', '0.485146', '0.498745', '0.506558', '0.497551', '0.538440', '0.490170', '0.504545', '0.502856', '0.506824', '0.492598', '0.497742', '0.493502', '0.496177', '0.495614', '0.489548']
         : correct/total = [(7011, 14232), (6917, 14235), (6949, 14266), (6860, 14217), (7305, 14238), (6973, 14373), (7155, 14346), (7261, 14334), (7112, 14294), (7739, 14373), (7031, 14344), (7216, 14302), (7218, 14354), (7279, 14362), (7054, 14320), (7165, 14395), (7101, 14389), (7074, 14257), (7063, 14251), (7049, 14399)]
         : compromised: 0.4978, honest: 0.4979
Round 004: test acc mean=0.5336 ± 0.0091 | min=0.5120 max=0.5538
         : test loss mean=0.7287 ± 0.0623
         : individual accs = ['0.530987', '0.532912', '0.528740', '0.526904', '0.537295', '0.535727', '0.539663', '0.530557', '0.537848', '0.553816', '0.525934', '0.537547', '0.529748', '0.517964', '0.544763', '0.532685', '0.544861', '0.512029', '0.534910', '0.538023']
         : correct/total = [(7557, 14232), (7586, 14235), (7543, 14266), (7491, 14217), (7650, 14238), (7700, 14373), (7742, 14346), (7605, 14334), (7688, 14294), (7960, 14373), (7544, 14344), (7688, 14302), (7604, 14354), (7439, 14362), (7801, 14320), (7668, 14395), (7840, 14389), (7300, 14257), (7623, 14251), (7747, 14399)]
         : compromised: 0.5239, honest: 0.5361
Round 005: test acc mean=0.5512 ± 0.0360 | min=0.4956 max=0.6066
         : test loss mean=0.6899 ± 0.0108
         : individual accs = ['0.561692', '0.592624', '0.593088', '0.529648', '0.604369', '0.569540', '0.503137', '0.556230', '0.495593', '0.606624', '0.504183', '0.555167', '0.502717', '0.506754', '0.536453', '0.519278', '0.581555', '0.574875', '0.582275', '0.547607']
         : correct/total = [(7994, 14232), (8436, 14235), (8461, 14266), (7530, 14217), (8605, 14238), (8186, 14373), (7218, 14346), (7973, 14334), (7084, 14294), (8719, 14373), (7232, 14344), (7940, 14302), (7216, 14354), (7278, 14362), (7682, 14320), (7475, 14395), (8368, 14389), (8196, 14257), (8298, 14251), (7885, 14399)]
         : compromised: 0.5385, honest: 0.5543
Round 006: test acc mean=0.5864 ± 0.0146 | min=0.5496 max=0.6216
         : test loss mean=0.6981 ± 0.0445
         : individual accs = ['0.590571', '0.593607', '0.590425', '0.611451', '0.588636', '0.578237', '0.566151', '0.584205', '0.577025', '0.621582', '0.549568', '0.588659', '0.583949', '0.579307', '0.581285', '0.599027', '0.592119', '0.579365', '0.592169', '0.580110']
         : correct/total = [(8405, 14232), (8450, 14235), (8423, 14266), (8693, 14217), (8381, 14238), (8311, 14373), (8122, 14346), (8374, 14334), (8248, 14294), (8934, 14373), (7883, 14344), (8419, 14302), (8382, 14354), (8320, 14362), (8324, 14320), (8623, 14395), (8520, 14389), (8260, 14257), (8439, 14251), (8353, 14399)]
         : compromised: 0.5802, honest: 0.5879
Round 007: test acc mean=0.5783 ± 0.0345 | min=0.5183 max=0.6296
         : test loss mean=0.6752 ± 0.0159
         : individual accs = ['0.556071', '0.554197', '0.588532', '0.553211', '0.587372', '0.610450', '0.536944', '0.629552', '0.549741', '0.597370', '0.518335', '0.624458', '0.547861', '0.570116', '0.597835', '0.582077', '0.628883', '0.518412', '0.592660', '0.621640']
         : correct/total = [(7914, 14232), (7889, 14235), (8396, 14266), (7865, 14217), (8363, 14238), (8774, 14373), (7703, 14346), (9024, 14334), (7858, 14294), (8586, 14373), (7435, 14344), (8931, 14302), (7864, 14354), (8188, 14362), (8561, 14320), (8379, 14395), (9049, 14389), (7391, 14257), (8446, 14251), (8951, 14399)]
         : compromised: 0.5617, honest: 0.5824
Round 008: test acc mean=0.6164 ± 0.0127 | min=0.5832 max=0.6314
         : test loss mean=0.6703 ± 0.0293
         : individual accs = ['0.630902', '0.631401', '0.618183', '0.617008', '0.626703', '0.608085', '0.591733', '0.617483', '0.596754', '0.621652', '0.583240', '0.617186', '0.629093', '0.627002', '0.609078', '0.625217', '0.623115', '0.622221', '0.616237', '0.615529']
         : correct/total = [(8979, 14232), (8988, 14235), (8819, 14266), (8772, 14217), (8923, 14238), (8740, 14373), (8489, 14346), (8851, 14334), (8530, 14294), (8935, 14373), (8366, 14344), (8827, 14302), (9030, 14354), (9005, 14362), (8722, 14320), (9000, 14395), (8966, 14389), (8871, 14257), (8782, 14251), (8863, 14399)]
         : compromised: 0.6216, honest: 0.6151
Round 009: test acc mean=0.6077 ± 0.0328 | min=0.5279 max=0.6460
         : test loss mean=0.6627 ± 0.0220
         : individual accs = ['0.618676', '0.607517', '0.611103', '0.582190', '0.627827', '0.636889', '0.546285', '0.646016', '0.566391', '0.622139', '0.527886', '0.638372', '0.563536', '0.606531', '0.627863', '0.618757', '0.641879', '0.598794', '0.626342', '0.638030']
         : correct/total = [(8805, 14232), (8648, 14235), (8718, 14266), (8277, 14217), (8939, 14238), (9154, 14373), (7837, 14346), (9260, 14334), (8096, 14294), (8942, 14373), (7572, 14344), (9130, 14302), (8089, 14354), (8711, 14362), (8991, 14320), (8907, 14395), (9236, 14389), (8537, 14257), (8926, 14251), (9187, 14399)]
         : compromised: 0.6014, honest: 0.6092
Round 010: test acc mean=0.6312 ± 0.0121 | min=0.5979 max=0.6466
         : test loss mean=0.6560 ± 0.0236
         : individual accs = ['0.641723', '0.646575', '0.635006', '0.636562', '0.637730', '0.622347', '0.608393', '0.633319', '0.613334', '0.642315', '0.597881', '0.632289', '0.640867', '0.638560', '0.622765', '0.640570', '0.637223', '0.634636', '0.630131', '0.631641']
         : correct/total = [(9133, 14232), (9204, 14235), (9059, 14266), (9050, 14217), (9080, 14238), (8945, 14373), (8728, 14346), (9078, 14334), (8767, 14294), (9232, 14373), (8576, 14344), (9043, 14302), (9199, 14354), (9171, 14362), (8918, 14320), (9221, 14395), (9169, 14389), (9048, 14257), (8980, 14251), (9095, 14399)]
         : compromised: 0.6341, honest: 0.6305

=== FINAL RESULTS ===
Dataset: sent140, Nodes: 20, Graph: erdos, Aggregation: d-fedavg
Attack: directed_deviation, 20.0% compromised
Final accuracy - Compromised: 0.6341, Honest: 0.6305
Overall test accuracy: mean=0.6312 ± 0.0121
