Device: cuda
Seed: 987654321
Loading 1 LEAF Sent140 train files...
LEAF Sent140 train: 254555 users, 908652 samples
Building vocabulary (max_size=10000)...
Vocabulary size: 10000
Loading 1 LEAF Sent140 test files...
LEAF Sent140 test: 254555 users, 286281 samples
Found 254555 train users, 254555 test users, 254555 common users
User sample counts range: 494 (max) to 1 (min)
Distributed ALL 254555 users across 20 clients
Users per client: 12727 (with 15 clients getting +1 user)
Train partition sizes: [44353, 44290, 44657, 44907, 44696, 45843, 45801, 45619, 45069, 45639, 45821, 45311, 45779, 46056, 45625, 45984, 46428, 44737, 45540, 46497]
Test partition sizes: [14232, 14235, 14266, 14217, 14238, 14373, 14346, 14334, 14294, 14373, 14344, 14302, 14354, 14362, 14320, 14395, 14389, 14257, 14251, 14399]
  Client 0: 44353 train samples, 2 unique classes
  Client 1: 44290 train samples, 2 unique classes
  Client 2: 44657 train samples, 2 unique classes
  Client 3: 44907 train samples, 2 unique classes
  Client 4: 44696 train samples, 2 unique classes
  Client 5: 45843 train samples, 2 unique classes
  Client 6: 45801 train samples, 2 unique classes
  Client 7: 45619 train samples, 2 unique classes
  Client 8: 45069 train samples, 2 unique classes
  Client 9: 45639 train samples, 2 unique classes
  Client 10: 45821 train samples, 2 unique classes
  Client 11: 45311 train samples, 2 unique classes
  Client 12: 45779 train samples, 2 unique classes
  Client 13: 46056 train samples, 2 unique classes
  Client 14: 45625 train samples, 2 unique classes
  Client 15: 45984 train samples, 2 unique classes
  Client 16: 46428 train samples, 2 unique classes
  Client 17: 44737 train samples, 2 unique classes
  Client 18: 45540 train samples, 2 unique classes
  Client 19: 46497 train samples, 2 unique classes
Will sample 4500 samples per client per epoch
Graph: erdos, nodes: 20, edges: 126
Degree statistics: avg=12.60, min=8, max=16
Attack: Compromised 12/20 nodes: [1, 2, 3, 5, 8, 11, 12, 13, 14, 15, 17, 18]
Attack type: directed_deviation, lambda: 1.0
Model variant: baseline
Model parameters: 1,174,986
Initial test acc across nodes: mean=0.4953 ± 0.0174
Round 001: test acc mean=0.4992 ± 0.0070 | min=0.4865 max=0.5085
         : test loss mean=7.7094 ± 3.9081
         : individual accs = ['0.507729', '0.505374', '0.487172', '0.502427', '0.501756', '0.499409', '0.493587', '0.499372', '0.495243', '0.494678', '0.492959', '0.507481', '0.508290', '0.499582', '0.503212', '0.490240', '0.508513', '0.486498', '0.507122', '0.492951']
         : correct/total = [(7226, 14232), (7194, 14235), (6950, 14266), (7143, 14217), (7144, 14238), (7178, 14373), (7081, 14346), (7158, 14334), (7079, 14294), (7110, 14373), (7071, 14344), (7258, 14302), (7296, 14354), (7175, 14362), (7206, 14320), (7057, 14395), (7317, 14389), (6936, 14257), (7227, 14251), (7098, 14399)]
         : compromised: 0.4993, honest: 0.4989
Round 002: test acc mean=0.5062 ± 0.0062 | min=0.4955 max=0.5216
         : test loss mean=8.6197 ± 2.4200
         : individual accs = ['0.510610', '0.513242', '0.509814', '0.521629', '0.506110', '0.499200', '0.504601', '0.506976', '0.513642', '0.508592', '0.497839', '0.508390', '0.497771', '0.495474', '0.507682', '0.499548', '0.508444', '0.502209', '0.508385', '0.503090']
         : correct/total = [(7267, 14232), (7306, 14235), (7273, 14266), (7416, 14217), (7206, 14238), (7175, 14373), (7239, 14346), (7267, 14334), (7342, 14294), (7310, 14373), (7141, 14344), (7271, 14302), (7145, 14354), (7116, 14362), (7270, 14320), (7191, 14395), (7316, 14389), (7160, 14257), (7245, 14251), (7244, 14399)]
         : compromised: 0.5064, honest: 0.5058
Round 003: test acc mean=0.5009 ± 0.0099 | min=0.4796 max=0.5177
         : test loss mean=1.1186 ± 0.2402
         : individual accs = ['0.496487', '0.483878', '0.516192', '0.493634', '0.494943', '0.489529', '0.497839', '0.506558', '0.494753', '0.495512', '0.479573', '0.507062', '0.506479', '0.502924', '0.501816', '0.517749', '0.511641', '0.502490', '0.509789', '0.509341']
         : correct/total = [(7066, 14232), (6888, 14235), (7364, 14266), (7018, 14217), (7047, 14238), (7036, 14373), (7142, 14346), (7261, 14334), (7072, 14294), (7122, 14373), (6879, 14344), (7252, 14302), (7270, 14354), (7223, 14362), (7186, 14320), (7453, 14395), (7362, 14389), (7164, 14257), (7265, 14251), (7334, 14399)]
         : compromised: 0.5022, honest: 0.4990
Round 004: test acc mean=0.4959 ± 0.0065 | min=0.4814 max=0.5098
         : test loss mean=1.3226 ± 0.2759
         : individual accs = ['0.492201', '0.481419', '0.491378', '0.500176', '0.492063', '0.491547', '0.498327', '0.486187', '0.496292', '0.493564', '0.493865', '0.494616', '0.496029', '0.503203', '0.499162', '0.509760', '0.497880', '0.491899', '0.502421', '0.506424']
         : correct/total = [(7005, 14232), (6853, 14235), (7010, 14266), (7111, 14217), (7006, 14238), (7065, 14373), (7149, 14346), (6969, 14334), (7094, 14294), (7094, 14373), (7084, 14344), (7074, 14302), (7120, 14354), (7227, 14362), (7148, 14320), (7338, 14395), (7164, 14389), (7013, 14257), (7160, 14251), (7292, 14399)]
         : compromised: 0.4965, honest: 0.4951
Round 005: test acc mean=0.5080 ± 0.0080 | min=0.4960 max=0.5326
         : test loss mean=0.9896 ± 0.3590
         : individual accs = ['0.503232', '0.505374', '0.512337', '0.532602', '0.513977', '0.506157', '0.500139', '0.507465', '0.511963', '0.509288', '0.510457', '0.507342', '0.512958', '0.496031', '0.505517', '0.517124', '0.507540', '0.497370', '0.506280', '0.496354']
         : correct/total = [(7162, 14232), (7194, 14235), (7309, 14266), (7572, 14217), (7318, 14238), (7275, 14373), (7175, 14346), (7274, 14334), (7318, 14294), (7320, 14373), (7322, 14344), (7256, 14302), (7363, 14354), (7124, 14362), (7239, 14320), (7444, 14395), (7303, 14389), (7091, 14257), (7215, 14251), (7147, 14399)]
         : compromised: 0.5093, honest: 0.5061
Round 006: test acc mean=0.5011 ± 0.0089 | min=0.4858 max=0.5181
         : test loss mean=0.8174 ± 0.0889
         : individual accs = ['0.492974', '0.485845', '0.511005', '0.490962', '0.491502', '0.497669', '0.518054', '0.517441', '0.509165', '0.492590', '0.493516', '0.509229', '0.501254', '0.505152', '0.501466', '0.503647', '0.510112', '0.493512', '0.498070', '0.498229']
         : correct/total = [(7016, 14232), (6916, 14235), (7290, 14266), (6980, 14217), (6998, 14238), (7153, 14373), (7432, 14346), (7417, 14334), (7278, 14294), (7080, 14373), (7079, 14344), (7283, 14302), (7195, 14354), (7255, 14362), (7181, 14320), (7250, 14395), (7340, 14389), (7036, 14257), (7098, 14251), (7174, 14399)]
         : compromised: 0.5006, honest: 0.5018
Round 007: test acc mean=0.5059 ± 0.0055 | min=0.4938 max=0.5173
         : test loss mean=0.7673 ± 0.1940
         : individual accs = ['0.507799', '0.517316', '0.512688', '0.515017', '0.506743', '0.507897', '0.501603', '0.509558', '0.502379', '0.506923', '0.503555', '0.508111', '0.498258', '0.493803', '0.507402', '0.502536', '0.509278', '0.500596', '0.504456', '0.501702']
         : correct/total = [(7227, 14232), (7364, 14235), (7314, 14266), (7322, 14217), (7215, 14238), (7300, 14373), (7196, 14346), (7304, 14334), (7181, 14294), (7286, 14373), (7223, 14344), (7267, 14302), (7152, 14354), (7092, 14362), (7266, 14320), (7234, 14395), (7328, 14389), (7137, 14257), (7189, 14251), (7224, 14399)]
         : compromised: 0.5059, honest: 0.5059
Round 008: test acc mean=0.5058 ± 0.0098 | min=0.4842 max=0.5221
         : test loss mean=0.7804 ± 0.0434
         : individual accs = ['0.495995', '0.484159', '0.515702', '0.494127', '0.495435', '0.505670', '0.513105', '0.514581', '0.509794', '0.496626', '0.498954', '0.519508', '0.504389', '0.519357', '0.504818', '0.513025', '0.522065', '0.502700', '0.502842', '0.502396']
         : correct/total = [(7059, 14232), (6892, 14235), (7357, 14266), (7025, 14217), (7054, 14238), (7268, 14373), (7361, 14346), (7376, 14334), (7287, 14294), (7138, 14373), (7157, 14344), (7430, 14302), (7240, 14354), (7459, 14362), (7229, 14320), (7385, 14395), (7512, 14389), (7167, 14257), (7166, 14251), (7234, 14399)]
         : compromised: 0.5063, honest: 0.5049
Round 009: test acc mean=0.5061 ± 0.0054 | min=0.4946 max=0.5172
         : test loss mean=0.7336 ± 0.1156
         : individual accs = ['0.507237', '0.517246', '0.513879', '0.515439', '0.505408', '0.505879', '0.500767', '0.507395', '0.508395', '0.505253', '0.502091', '0.506782', '0.497492', '0.494569', '0.507751', '0.502675', '0.507610', '0.508592', '0.504456', '0.502118']
         : correct/total = [(7219, 14232), (7363, 14235), (7331, 14266), (7328, 14217), (7196, 14238), (7271, 14373), (7184, 14346), (7273, 14334), (7267, 14294), (7262, 14373), (7202, 14344), (7248, 14302), (7141, 14354), (7103, 14362), (7271, 14320), (7236, 14395), (7304, 14389), (7251, 14257), (7189, 14251), (7230, 14399)]
         : compromised: 0.5069, honest: 0.5047
Round 010: test acc mean=0.5077 ± 0.0108 | min=0.4877 max=0.5279
         : test loss mean=0.7658 ± 0.0351
         : individual accs = ['0.495503', '0.487671', '0.518996', '0.488359', '0.500281', '0.516315', '0.520424', '0.517232', '0.509724', '0.499409', '0.501046', '0.513285', '0.504110', '0.522072', '0.504958', '0.516013', '0.527903', '0.501298', '0.505298', '0.503854']
         : correct/total = [(7052, 14232), (6942, 14235), (7404, 14266), (6943, 14217), (7123, 14238), (7421, 14373), (7466, 14346), (7414, 14334), (7286, 14294), (7178, 14373), (7187, 14344), (7341, 14302), (7236, 14354), (7498, 14362), (7231, 14320), (7428, 14395), (7596, 14389), (7147, 14257), (7201, 14251), (7255, 14399)]
         : compromised: 0.5073, honest: 0.5082

=== FINAL RESULTS ===
Dataset: sent140, Nodes: 20, Graph: erdos, Aggregation: d-fedavg
Attack: directed_deviation, 60.0% compromised
Final accuracy - Compromised: 0.5073, Honest: 0.5082
Overall test accuracy: mean=0.5077 ± 0.0108
