Device: cuda
Seed: 987654321
Loading 1 LEAF Sent140 train files...
LEAF Sent140 train: 254555 users, 908652 samples
Building vocabulary (max_size=10000)...
Vocabulary size: 10000
Loading 1 LEAF Sent140 test files...
LEAF Sent140 test: 254555 users, 286281 samples
Found 254555 train users, 254555 test users, 254555 common users
User sample counts range: 494 (max) to 1 (min)
Distributed ALL 254555 users across 20 clients
Users per client: 12727 (with 15 clients getting +1 user)
Train partition sizes: [44353, 44290, 44657, 44907, 44696, 45843, 45801, 45619, 45069, 45639, 45821, 45311, 45779, 46056, 45625, 45984, 46428, 44737, 45540, 46497]
Test partition sizes: [14232, 14235, 14266, 14217, 14238, 14373, 14346, 14334, 14294, 14373, 14344, 14302, 14354, 14362, 14320, 14395, 14389, 14257, 14251, 14399]
  Client 0: 44353 train samples, 2 unique classes
  Client 1: 44290 train samples, 2 unique classes
  Client 2: 44657 train samples, 2 unique classes
  Client 3: 44907 train samples, 2 unique classes
  Client 4: 44696 train samples, 2 unique classes
  Client 5: 45843 train samples, 2 unique classes
  Client 6: 45801 train samples, 2 unique classes
  Client 7: 45619 train samples, 2 unique classes
  Client 8: 45069 train samples, 2 unique classes
  Client 9: 45639 train samples, 2 unique classes
  Client 10: 45821 train samples, 2 unique classes
  Client 11: 45311 train samples, 2 unique classes
  Client 12: 45779 train samples, 2 unique classes
  Client 13: 46056 train samples, 2 unique classes
  Client 14: 45625 train samples, 2 unique classes
  Client 15: 45984 train samples, 2 unique classes
  Client 16: 46428 train samples, 2 unique classes
  Client 17: 44737 train samples, 2 unique classes
  Client 18: 45540 train samples, 2 unique classes
  Client 19: 46497 train samples, 2 unique classes
Will sample 4500 samples per client per epoch
Graph: erdos, nodes: 20, edges: 99
Degree statistics: avg=9.90, min=7, max=14
Attack: Compromised 4/20 nodes: [5, 12, 13, 17]
Attack type: krum, lambda: 1.0
Model variant: baseline
Model parameters: 1,174,986
BALANCE algorithm:
Balance Config: BALANCEConfig(gamma=2, kappa=1, alpha=0.5, min_neighbors=1)
  - Model dimension: 1,174,986 parameters
  - Complexity: O(N×d) = O(20×1,174,986)
Initial test acc across nodes: mean=0.4965 ± 0.0152
Round 001: test acc mean=0.5079 ± 0.0248 | min=0.4852 max=0.5882
         : test loss mean=0.8017 ± 0.1403
         : individual accs = ['0.486509', '0.512821', '0.522781', '0.506647', '0.510535', '0.498922', '0.485153', '0.487652', '0.510424', '0.588186', '0.498536', '0.501888', '0.503971', '0.559462', '0.490573', '0.509830', '0.491209', '0.514554', '0.489790', '0.487951']
         : correct/total = [(6924, 14232), (7300, 14235), (7458, 14266), (7203, 14217), (7269, 14238), (7171, 14373), (6960, 14346), (6990, 14334), (7296, 14294), (8454, 14373), (7151, 14344), (7178, 14302), (7234, 14354), (8035, 14362), (7025, 14320), (7339, 14395), (7068, 14389), (7336, 14257), (6980, 14251), (7026, 14399)]
         : compromised: 0.5192, honest: 0.5050
Round 002: test acc mean=0.5100 ± 0.0123 | min=0.4859 max=0.5320
         : test loss mean=0.6935 ± 0.0029
         : individual accs = ['0.518620', '0.514085', '0.485911', '0.508124', '0.531957', '0.518263', '0.503416', '0.503209', '0.514971', '0.493008', '0.531023', '0.530765', '0.500348', '0.508564', '0.496997', '0.504620', '0.504691', '0.501298', '0.522139', '0.508369']
         : correct/total = [(7381, 14232), (7318, 14235), (6932, 14266), (7224, 14217), (7574, 14238), (7449, 14373), (7222, 14346), (7213, 14334), (7361, 14294), (7086, 14373), (7617, 14344), (7591, 14302), (7182, 14354), (7304, 14362), (7117, 14320), (7264, 14395), (7262, 14389), (7147, 14257), (7441, 14251), (7320, 14399)]
         : compromised: 0.5071, honest: 0.5107
Round 003: test acc mean=0.5110 ± 0.0191 | min=0.4860 max=0.5622
         : test loss mean=0.6927 ± 0.0011
         : individual accs = ['0.514615', '0.532771', '0.485981', '0.492439', '0.523458', '0.496139', '0.502928', '0.552114', '0.494053', '0.493008', '0.517568', '0.562159', '0.499303', '0.508564', '0.507053', '0.502605', '0.501355', '0.503051', '0.514981', '0.516355']
         : correct/total = [(7324, 14232), (7584, 14235), (6933, 14266), (7001, 14217), (7453, 14238), (7131, 14373), (7215, 14346), (7914, 14334), (7062, 14294), (7086, 14373), (7424, 14344), (8040, 14302), (7167, 14354), (7304, 14362), (7261, 14320), (7235, 14395), (7214, 14389), (7172, 14257), (7339, 14251), (7435, 14399)]
         : compromised: 0.5018, honest: 0.5133
Round 004: test acc mean=0.5036 ± 0.0194 | min=0.4860 max=0.5608
         : test loss mean=0.6930 ± 0.0005
         : individual accs = ['0.491287', '0.485985', '0.486051', '0.492228', '0.494030', '0.493912', '0.497560', '0.495465', '0.492794', '0.493008', '0.522239', '0.560831', '0.499512', '0.508564', '0.495810', '0.499062', '0.535617', '0.503051', '0.488597', '0.537051']
         : correct/total = [(6992, 14232), (6918, 14235), (6934, 14266), (6998, 14217), (7034, 14238), (7099, 14373), (7138, 14346), (7102, 14334), (7044, 14294), (7086, 14373), (7491, 14344), (8021, 14302), (7170, 14354), (7304, 14362), (7100, 14320), (7184, 14395), (7707, 14389), (7172, 14257), (6963, 14251), (7733, 14399)]
         : compromised: 0.5013, honest: 0.5042
Round 005: test acc mean=0.4953 ± 0.0061 | min=0.4861 max=0.5086
         : test loss mean=0.6934 ± 0.0004
         : individual accs = ['0.489109', '0.486266', '0.486051', '0.492228', '0.494100', '0.493843', '0.497560', '0.495186', '0.487687', '0.493008', '0.499024', '0.492029', '0.499512', '0.508564', '0.495810', '0.498367', '0.499757', '0.503051', '0.488738', '0.505452']
         : correct/total = [(6961, 14232), (6922, 14235), (6934, 14266), (6998, 14217), (7035, 14238), (7098, 14373), (7138, 14346), (7098, 14334), (6971, 14294), (7086, 14373), (7158, 14344), (7037, 14302), (7170, 14354), (7304, 14362), (7100, 14320), (7174, 14395), (7191, 14389), (7172, 14257), (6965, 14251), (7278, 14399)]
         : compromised: 0.5012, honest: 0.4938
Round 006: test acc mean=0.4948 ± 0.0056 | min=0.4861 max=0.5086
         : test loss mean=0.6936 ± 0.0003
         : individual accs = ['0.489109', '0.486266', '0.486051', '0.492228', '0.494100', '0.493843', '0.497560', '0.495186', '0.488177', '0.493008', '0.499024', '0.492029', '0.499512', '0.508564', '0.495810', '0.498367', '0.499757', '0.503051', '0.488738', '0.496354']
         : correct/total = [(6961, 14232), (6922, 14235), (6934, 14266), (6998, 14217), (7035, 14238), (7098, 14373), (7138, 14346), (7098, 14334), (6978, 14294), (7086, 14373), (7158, 14344), (7037, 14302), (7170, 14354), (7304, 14362), (7100, 14320), (7174, 14395), (7191, 14389), (7172, 14257), (6965, 14251), (7147, 14399)]
         : compromised: 0.5012, honest: 0.4932
Round 007: test acc mean=0.4949 ± 0.0056 | min=0.4861 max=0.5086
         : test loss mean=0.6936 ± 0.0003
         : individual accs = ['0.489109', '0.486266', '0.486051', '0.492228', '0.494100', '0.493843', '0.497560', '0.495186', '0.488457', '0.493008', '0.499024', '0.492029', '0.499512', '0.508564', '0.495810', '0.498367', '0.499757', '0.503051', '0.488738', '0.496354']
         : correct/total = [(6961, 14232), (6922, 14235), (6934, 14266), (6998, 14217), (7035, 14238), (7098, 14373), (7138, 14346), (7098, 14334), (6982, 14294), (7086, 14373), (7158, 14344), (7037, 14302), (7170, 14354), (7304, 14362), (7100, 14320), (7174, 14395), (7191, 14389), (7172, 14257), (6965, 14251), (7147, 14399)]
         : compromised: 0.5012, honest: 0.4933
Round 008: test acc mean=0.4949 ± 0.0056 | min=0.4861 max=0.5086
         : test loss mean=0.6935 ± 0.0003
         : individual accs = ['0.489109', '0.486266', '0.486051', '0.492228', '0.494100', '0.493843', '0.497560', '0.495186', '0.488457', '0.493008', '0.499024', '0.492029', '0.499512', '0.508564', '0.495810', '0.498367', '0.499757', '0.503051', '0.488738', '0.496354']
         : correct/total = [(6961, 14232), (6922, 14235), (6934, 14266), (6998, 14217), (7035, 14238), (7098, 14373), (7138, 14346), (7098, 14334), (6982, 14294), (7086, 14373), (7158, 14344), (7037, 14302), (7170, 14354), (7304, 14362), (7100, 14320), (7174, 14395), (7191, 14389), (7172, 14257), (6965, 14251), (7147, 14399)]
         : compromised: 0.5012, honest: 0.4933
Round 009: test acc mean=0.4949 ± 0.0056 | min=0.4861 max=0.5086
         : test loss mean=0.6935 ± 0.0004
         : individual accs = ['0.489109', '0.486266', '0.486051', '0.492228', '0.494100', '0.493843', '0.497560', '0.495186', '0.488457', '0.493008', '0.499024', '0.492029', '0.499512', '0.508564', '0.495810', '0.498367', '0.499757', '0.503051', '0.488738', '0.496354']
         : correct/total = [(6961, 14232), (6922, 14235), (6934, 14266), (6998, 14217), (7035, 14238), (7098, 14373), (7138, 14346), (7098, 14334), (6982, 14294), (7086, 14373), (7158, 14344), (7037, 14302), (7170, 14354), (7304, 14362), (7100, 14320), (7174, 14395), (7191, 14389), (7172, 14257), (6965, 14251), (7147, 14399)]
         : compromised: 0.5012, honest: 0.4933
Round 010: test acc mean=0.4949 ± 0.0056 | min=0.4861 max=0.5086
         : test loss mean=0.6935 ± 0.0004
         : individual accs = ['0.489109', '0.486266', '0.486051', '0.492228', '0.494100', '0.493843', '0.497560', '0.495186', '0.488457', '0.493008', '0.499024', '0.492029', '0.499512', '0.508564', '0.495810', '0.498367', '0.499757', '0.503051', '0.488738', '0.496354']
         : correct/total = [(6961, 14232), (6922, 14235), (6934, 14266), (6998, 14217), (7035, 14238), (7098, 14373), (7138, 14346), (7098, 14334), (6982, 14294), (7086, 14373), (7158, 14344), (7037, 14302), (7170, 14354), (7304, 14362), (7100, 14320), (7174, 14395), (7191, 14389), (7172, 14257), (6965, 14251), (7147, 14399)]
         : compromised: 0.5012, honest: 0.4933

=== FINAL RESULTS ===
Dataset: sent140, Nodes: 20, Graph: erdos, Aggregation: balance
Attack: krum, 20.0% compromised
Final accuracy - Compromised: 0.5012, Honest: 0.4933
Overall test accuracy: mean=0.4949 ± 0.0056

=== BALANCE SUMMARY ===
Node 0: acceptance=0.850
Node 1: acceptance=0.820
Node 2: acceptance=1.000
Node 3: acceptance=0.871
Node 4: acceptance=0.800
Node 5: acceptance=0.820
Node 6: acceptance=0.775
Node 7: acceptance=0.755
Node 8: acceptance=0.614
Node 9: acceptance=1.000
Node 10: acceptance=0.775
Node 11: acceptance=0.775
Node 12: acceptance=0.925
Node 13: acceptance=1.000
Node 14: acceptance=0.743
Node 15: acceptance=0.800
Node 16: acceptance=0.743
Node 17: acceptance=0.887
Node 18: acceptance=0.850
Node 19: acceptance=0.640

=== PARALLEL EXECUTION TIME (realistic for distributed system) ===
  COMMUNICATION (max across nodes):
    - Full model transfer: 0.000s (0.0%)
  COMPUTATION (max across nodes):
    - Filtering: 0.064s (80.7%)
    - Aggregation: 0.015s (19.3%)
  TOTALS:
    - Total computation: 0.079s (100.0%)
    - Total communication: 0.000s (0.0%)
    - Total parallel time: 0.079s

=== PER-NODE AVERAGE TIME ===
  - Filtering: 0.043s
  - Aggregation: 0.008s
  - Model transfer: 0.000s
  - Total per node: 0.052s

=== TOTAL COMPUTATIONAL WORK (sum across all nodes) ===
  - Total filtering: 0.865s
  - Total aggregation: 0.169s
  - Total model transfer: 0.000s
  - Grand total: 1.034s
  - Mean acceptance rate: 0.822

BALANCE Algorithm Properties:
  - Model dimension: 1,174,986
  - No compression: Full parameter comparison
  - Theoretical complexity: O(deg(i)×d)
  - Approach: Full parameter filtering + averaging
