Device: cuda
Seed: 987654321
Loading 1 LEAF Sent140 train files...
LEAF Sent140 train: 254555 users, 908652 samples
Building vocabulary (max_size=10000)...
Vocabulary size: 10000
Loading 1 LEAF Sent140 test files...
LEAF Sent140 test: 254555 users, 286281 samples
Found 254555 train users, 254555 test users, 254555 common users
User sample counts range: 494 (max) to 1 (min)
Distributed ALL 254555 users across 20 clients
Users per client: 12727 (with 15 clients getting +1 user)
Train partition sizes: [44353, 44290, 44657, 44907, 44696, 45843, 45801, 45619, 45069, 45639, 45821, 45311, 45779, 46056, 45625, 45984, 46428, 44737, 45540, 46497]
Test partition sizes: [14232, 14235, 14266, 14217, 14238, 14373, 14346, 14334, 14294, 14373, 14344, 14302, 14354, 14362, 14320, 14395, 14389, 14257, 14251, 14399]
  Client 0: 44353 train samples, 2 unique classes
  Client 1: 44290 train samples, 2 unique classes
  Client 2: 44657 train samples, 2 unique classes
  Client 3: 44907 train samples, 2 unique classes
  Client 4: 44696 train samples, 2 unique classes
  Client 5: 45843 train samples, 2 unique classes
  Client 6: 45801 train samples, 2 unique classes
  Client 7: 45619 train samples, 2 unique classes
  Client 8: 45069 train samples, 2 unique classes
  Client 9: 45639 train samples, 2 unique classes
  Client 10: 45821 train samples, 2 unique classes
  Client 11: 45311 train samples, 2 unique classes
  Client 12: 45779 train samples, 2 unique classes
  Client 13: 46056 train samples, 2 unique classes
  Client 14: 45625 train samples, 2 unique classes
  Client 15: 45984 train samples, 2 unique classes
  Client 16: 46428 train samples, 2 unique classes
  Client 17: 44737 train samples, 2 unique classes
  Client 18: 45540 train samples, 2 unique classes
  Client 19: 46497 train samples, 2 unique classes
Will sample 4500 samples per client per epoch
Graph: ring, nodes: 20, edges: 20
Degree statistics: avg=2.00, min=2, max=2
Attack: Compromised 6/20 nodes: [5, 12, 13, 14, 17, 18]
Attack type: directed_deviation, lambda: 1.0
Model variant: baseline
Model parameters: 1,174,986
Initial test acc across nodes: mean=0.4965 ± 0.0152
Round 001: test acc mean=0.5631 ± 0.0480 | min=0.4886 max=0.6137
         : test loss mean=9.8744 ± 14.1788
         : individual accs = ['0.597175', '0.598806', '0.601991', '0.595414', '0.588847', '0.506436', '0.579395', '0.613716', '0.610886', '0.598831', '0.593698', '0.599217', '0.500488', '0.501323', '0.495531', '0.503022', '0.598096', '0.493722', '0.488597', '0.596986']
         : correct/total = [(8499, 14232), (8524, 14235), (8588, 14266), (8465, 14217), (8384, 14238), (7279, 14373), (8312, 14346), (8797, 14334), (8732, 14294), (8607, 14373), (8516, 14344), (8570, 14302), (7184, 14354), (7200, 14362), (7096, 14320), (7241, 14395), (8606, 14389), (7039, 14257), (6963, 14251), (8596, 14399)]
         : compromised: 0.4977, honest: 0.5911
Round 002: test acc mean=0.5654 ± 0.0592 | min=0.4883 max=0.6236
         : test loss mean=12.0123 ± 15.3348
         : individual accs = ['0.623243', '0.621215', '0.614398', '0.617008', '0.615255', '0.493286', '0.494911', '0.623622', '0.622569', '0.617825', '0.616704', '0.610544', '0.502020', '0.511698', '0.491899', '0.507746', '0.508652', '0.504033', '0.488317', '0.622821']
         : correct/total = [(8870, 14232), (8843, 14235), (8765, 14266), (8772, 14217), (8760, 14238), (7090, 14373), (7100, 14346), (8939, 14334), (8899, 14294), (8880, 14373), (8846, 14344), (8732, 14302), (7206, 14354), (7349, 14362), (7044, 14320), (7309, 14395), (7319, 14389), (7186, 14257), (6959, 14251), (8968, 14399)]
         : compromised: 0.4985, honest: 0.5940
Round 003: test acc mean=0.5721 ± 0.0614 | min=0.4913 max=0.6365
         : test loss mean=8.1516 ± 12.2821
         : individual accs = ['0.623595', '0.630769', '0.627015', '0.631216', '0.624175', '0.503792', '0.501603', '0.628645', '0.631244', '0.632436', '0.613776', '0.621312', '0.500348', '0.491296', '0.506145', '0.512747', '0.512961', '0.503753', '0.508806', '0.636503']
         : correct/total = [(8875, 14232), (8979, 14235), (8945, 14266), (8974, 14217), (8887, 14238), (7241, 14373), (7196, 14346), (9011, 14334), (9023, 14294), (9090, 14373), (8804, 14344), (8886, 14302), (7182, 14354), (7056, 14362), (7248, 14320), (7381, 14395), (7381, 14389), (7182, 14257), (7251, 14251), (9165, 14399)]
         : compromised: 0.5024, honest: 0.6020
Round 004: test acc mean=0.5771 ± 0.0692 | min=0.4842 max=0.6467
         : test loss mean=6.9220 ± 9.6076
         : individual accs = ['0.646712', '0.638426', '0.638301', '0.637265', '0.639064', '0.492869', '0.497909', '0.640366', '0.636351', '0.640785', '0.634551', '0.634457', '0.492894', '0.508286', '0.498813', '0.518652', '0.519425', '0.497650', '0.484247', '0.645809']
         : correct/total = [(9204, 14232), (9088, 14235), (9106, 14266), (9060, 14217), (9099, 14238), (7084, 14373), (7143, 14346), (9179, 14334), (9096, 14294), (9210, 14373), (9102, 14344), (9074, 14302), (7075, 14354), (7300, 14362), (7143, 14320), (7466, 14395), (7474, 14389), (7095, 14257), (6901, 14251), (9299, 14399)]
         : compromised: 0.4958, honest: 0.6120
Round 005: test acc mean=0.5831 ± 0.0712 | min=0.4918 max=0.6551
         : test loss mean=7.8758 ± 11.3131
         : individual accs = ['0.652614', '0.652195', '0.645521', '0.650981', '0.653954', '0.504975', '0.499721', '0.646086', '0.641878', '0.636471', '0.643056', '0.639561', '0.496795', '0.491784', '0.502654', '0.531157', '0.510112', '0.494845', '0.513438', '0.655115']
         : correct/total = [(9288, 14232), (9284, 14235), (9209, 14266), (9255, 14217), (9311, 14238), (7258, 14373), (7169, 14346), (9261, 14334), (9175, 14294), (9148, 14373), (9224, 14344), (9147, 14302), (7131, 14354), (7063, 14362), (7198, 14320), (7646, 14395), (7340, 14389), (7055, 14257), (7317, 14251), (9433, 14399)]
         : compromised: 0.5007, honest: 0.6185
Round 006: test acc mean=0.5852 ± 0.0733 | min=0.4894 max=0.6587
         : test loss mean=6.6018 ± 10.2521
         : individual accs = ['0.656619', '0.656270', '0.655194', '0.655272', '0.658660', '0.493564', '0.511014', '0.646435', '0.641878', '0.646351', '0.647727', '0.645924', '0.501324', '0.509748', '0.514874', '0.509482', '0.504830', '0.505787', '0.489369', '0.653379']
         : correct/total = [(9345, 14232), (9342, 14235), (9347, 14266), (9316, 14217), (9378, 14238), (7094, 14373), (7331, 14346), (9266, 14334), (9175, 14294), (9290, 14373), (9291, 14344), (9238, 14302), (7196, 14354), (7321, 14362), (7373, 14320), (7334, 14395), (7264, 14389), (7211, 14257), (6974, 14251), (9408, 14399)]
         : compromised: 0.5024, honest: 0.6206
Round 007: test acc mean=0.5891 ± 0.0747 | min=0.4928 max=0.6680
         : test loss mean=8.5515 ± 13.4754
         : individual accs = ['0.668002', '0.660485', '0.655895', '0.665049', '0.656904', '0.505949', '0.508783', '0.650063', '0.646285', '0.657135', '0.651352', '0.648511', '0.496586', '0.492759', '0.504330', '0.524835', '0.525957', '0.496388', '0.508245', '0.658657']
         : correct/total = [(9507, 14232), (9402, 14235), (9357, 14266), (9455, 14217), (9353, 14238), (7272, 14373), (7299, 14346), (9318, 14334), (9238, 14294), (9445, 14373), (9343, 14344), (9275, 14302), (7128, 14354), (7077, 14362), (7222, 14320), (7555, 14395), (7568, 14389), (7077, 14257), (7243, 14251), (9484, 14399)]
         : compromised: 0.5007, honest: 0.6270
Round 008: test acc mean=0.5908 ± 0.0781 | min=0.4901 max=0.6673
         : test loss mean=8.3356 ± 13.7020
         : individual accs = ['0.665683', '0.665402', '0.665779', '0.665823', '0.653322', '0.495234', '0.509201', '0.657597', '0.660557', '0.659779', '0.657766', '0.651937', '0.501045', '0.508564', '0.497486', '0.512053', '0.529988', '0.501298', '0.490071', '0.667269']
         : correct/total = [(9474, 14232), (9472, 14235), (9498, 14266), (9466, 14217), (9302, 14238), (7118, 14373), (7305, 14346), (9426, 14334), (9442, 14294), (9483, 14373), (9435, 14344), (9324, 14302), (7192, 14354), (7304, 14362), (7124, 14320), (7371, 14395), (7626, 14389), (7147, 14257), (6984, 14251), (9608, 14399)]
         : compromised: 0.4989, honest: 0.6302
Round 009: test acc mean=0.5966 ± 0.0787 | min=0.4914 max=0.6795
         : test loss mean=9.5924 ± 15.4832
         : individual accs = ['0.679525', '0.668985', '0.670896', '0.671942', '0.667299', '0.502679', '0.516799', '0.667922', '0.663285', '0.663397', '0.657766', '0.656901', '0.500697', '0.491436', '0.502374', '0.543869', '0.535617', '0.493652', '0.508947', '0.668935']
         : correct/total = [(9671, 14232), (9523, 14235), (9571, 14266), (9553, 14217), (9501, 14238), (7225, 14373), (7414, 14346), (9574, 14334), (9481, 14294), (9535, 14373), (9435, 14344), (9395, 14302), (7187, 14354), (7058, 14362), (7194, 14320), (7829, 14395), (7707, 14389), (7038, 14257), (7253, 14251), (9632, 14399)]
         : compromised: 0.5000, honest: 0.6381
Round 010: test acc mean=0.5964 ± 0.0832 | min=0.4878 max=0.6835
         : test loss mean=6.7746 ± 10.8181
         : individual accs = ['0.683530', '0.676502', '0.677064', '0.672997', '0.672004', '0.494469', '0.501743', '0.668481', '0.664754', '0.668754', '0.662368', '0.658719', '0.499791', '0.508704', '0.487849', '0.536645', '0.533672', '0.495406', '0.490141', '0.673797']
         : correct/total = [(9728, 14232), (9630, 14235), (9659, 14266), (9568, 14217), (9568, 14238), (7107, 14373), (7198, 14346), (9582, 14334), (9502, 14294), (9612, 14373), (9501, 14344), (9421, 14302), (7174, 14354), (7306, 14362), (6986, 14320), (7725, 14395), (7679, 14389), (7063, 14257), (6985, 14251), (9702, 14399)]
         : compromised: 0.4961, honest: 0.6394

=== FINAL RESULTS ===
Dataset: sent140, Nodes: 20, Graph: ring, Aggregation: krum
Attack: directed_deviation, 30.0% compromised
Final accuracy - Compromised: 0.4961, Honest: 0.6394
Overall test accuracy: mean=0.5964 ± 0.0832
