Device: cuda
Seed: 987654321
Loading 1 LEAF Sent140 train files...
LEAF Sent140 train: 254555 users, 908652 samples
Building vocabulary (max_size=10000)...
Vocabulary size: 10000
Loading 1 LEAF Sent140 test files...
LEAF Sent140 test: 254555 users, 286281 samples
Found 254555 train users, 254555 test users, 254555 common users
User sample counts range: 494 (max) to 1 (min)
Distributed ALL 254555 users across 20 clients
Users per client: 12727 (with 15 clients getting +1 user)
Train partition sizes: [44353, 44290, 44657, 44907, 44696, 45843, 45801, 45619, 45069, 45639, 45821, 45311, 45779, 46056, 45625, 45984, 46428, 44737, 45540, 46497]
Test partition sizes: [14232, 14235, 14266, 14217, 14238, 14373, 14346, 14334, 14294, 14373, 14344, 14302, 14354, 14362, 14320, 14395, 14389, 14257, 14251, 14399]
  Client 0: 44353 train samples, 2 unique classes
  Client 1: 44290 train samples, 2 unique classes
  Client 2: 44657 train samples, 2 unique classes
  Client 3: 44907 train samples, 2 unique classes
  Client 4: 44696 train samples, 2 unique classes
  Client 5: 45843 train samples, 2 unique classes
  Client 6: 45801 train samples, 2 unique classes
  Client 7: 45619 train samples, 2 unique classes
  Client 8: 45069 train samples, 2 unique classes
  Client 9: 45639 train samples, 2 unique classes
  Client 10: 45821 train samples, 2 unique classes
  Client 11: 45311 train samples, 2 unique classes
  Client 12: 45779 train samples, 2 unique classes
  Client 13: 46056 train samples, 2 unique classes
  Client 14: 45625 train samples, 2 unique classes
  Client 15: 45984 train samples, 2 unique classes
  Client 16: 46428 train samples, 2 unique classes
  Client 17: 44737 train samples, 2 unique classes
  Client 18: 45540 train samples, 2 unique classes
  Client 19: 46497 train samples, 2 unique classes
Will sample 4500 samples per client per epoch
Graph: erdos, nodes: 20, edges: 99
Degree statistics: avg=9.90, min=7, max=14
Attack: Compromised 14/20 nodes: [1, 2, 3, 5, 6, 8, 11, 12, 13, 14, 15, 17, 18, 19]
Attack type: backdoor, lambda: 1.0
Backdoor target label: 1, trigger size: 3
Model variant: baseline
Model parameters: 1,174,986
BALANCE algorithm:
Balance Config: BALANCEConfig(gamma=2, kappa=1, alpha=0.5, min_neighbors=1)
  - Model dimension: 1,174,986 parameters
  - Complexity: O(N×d) = O(20×1,174,986)
Initial test acc across nodes: mean=0.4965 ± 0.0152
Backdoor attack: Created poisoned datasets for 14 compromised nodes
Round 001: test acc mean=0.4990 ± 0.0058 | min=0.4855 max=0.5081
         : test loss mean=22.9046 ± 15.0272
         : individual accs = ['0.505340', '0.494626', '0.486892', '0.502145', '0.505197', '0.498226', '0.496515', '0.504604', '0.497132', '0.508105', '0.485499', '0.494476', '0.500000', '0.505918', '0.499302', '0.497534', '0.499687', '0.502209', '0.495193', '0.500938']
         : correct/total = [(7192, 14232), (7041, 14235), (6946, 14266), (7139, 14217), (7193, 14238), (7161, 14373), (7123, 14346), (7233, 14334), (7106, 14294), (7303, 14373), (6964, 14344), (7072, 14302), (7177, 14354), (7266, 14362), (7150, 14320), (7162, 14395), (7190, 14389), (7160, 14257), (7057, 14251), (7213, 14399)]
         : compromised: 0.4979, honest: 0.5014
Round 002: test acc mean=0.5024 ± 0.0063 | min=0.4937 max=0.5149
         : test loss mean=976.8901 ± 651.2617
         : individual accs = ['0.504146', '0.504812', '0.495163', '0.511993', '0.496559', '0.514924', '0.494842', '0.493861', '0.506226', '0.493703', '0.504462', '0.501189', '0.493660', '0.510862', '0.502584', '0.507746', '0.509069', '0.500736', '0.499404', '0.502327']
         : correct/total = [(7175, 14232), (7186, 14235), (7064, 14266), (7279, 14217), (7070, 14238), (7401, 14373), (7099, 14346), (7079, 14334), (7236, 14294), (7096, 14373), (7236, 14344), (7168, 14302), (7086, 14354), (7337, 14362), (7197, 14320), (7309, 14395), (7325, 14389), (7139, 14257), (7117, 14251), (7233, 14399)]
         : compromised: 0.5033, honest: 0.5003
Round 003: test acc mean=0.5022 ± 0.0084 | min=0.4882 max=0.5212
         : test loss mean=59200.7118 ± 40381.5275
         : individual accs = ['0.513069', '0.497295', '0.489415', '0.505592', '0.515452', '0.499130', '0.500418', '0.512418', '0.488247', '0.501983', '0.521194', '0.507342', '0.496099', '0.498468', '0.501536', '0.502397', '0.503023', '0.492249', '0.494281', '0.503646']
         : correct/total = [(7302, 14232), (7079, 14235), (6982, 14266), (7188, 14217), (7339, 14238), (7174, 14373), (7179, 14346), (7345, 14334), (6979, 14294), (7215, 14373), (7476, 14344), (7256, 14302), (7121, 14354), (7159, 14362), (7182, 14320), (7232, 14395), (7238, 14389), (7018, 14257), (7044, 14251), (7252, 14399)]
         : compromised: 0.4983, honest: 0.5112
Round 004: test acc mean=0.5041 ± 0.0134 | min=0.4757 max=0.5294
         : test loss mean=9132589.4042 ± 6671312.2506
         : individual accs = ['0.513772', '0.475729', '0.490397', '0.484631', '0.518893', '0.496626', '0.500906', '0.523720', '0.507346', '0.508732', '0.516523', '0.506083', '0.506409', '0.514343', '0.499232', '0.511705', '0.529363', '0.489304', '0.494562', '0.492743']
         : correct/total = [(7312, 14232), (6772, 14235), (6996, 14266), (6890, 14217), (7388, 14238), (7138, 14373), (7186, 14346), (7507, 14334), (7252, 14294), (7312, 14373), (7409, 14344), (7238, 14302), (7269, 14354), (7387, 14362), (7149, 14320), (7366, 14395), (7617, 14389), (6976, 14257), (7048, 14251), (7095, 14399)]
         : compromised: 0.4979, honest: 0.5185
Round 005: test acc mean=0.5106 ± 0.0184 | min=0.4892 max=0.5435
         : test loss mean=458981237.6152 ± 307614804.1606
         : individual accs = ['0.535413', '0.489217', '0.502523', '0.500739', '0.541509', '0.496208', '0.502161', '0.534464', '0.502798', '0.531970', '0.540086', '0.503566', '0.497353', '0.496170', '0.491411', '0.508927', '0.543540', '0.496107', '0.496597', '0.501354']
         : correct/total = [(7620, 14232), (6964, 14235), (7169, 14266), (7119, 14217), (7710, 14238), (7132, 14373), (7204, 14346), (7661, 14334), (7187, 14294), (7646, 14373), (7747, 14344), (7202, 14302), (7139, 14354), (7126, 14362), (7037, 14320), (7326, 14395), (7821, 14389), (7073, 14257), (7077, 14251), (7219, 14399)]
         : compromised: 0.4989, honest: 0.5378
Round 006: test acc mean=0.5159 ± 0.0243 | min=0.4861 max=0.5636
         : test loss mean=34873961517.3282 ± 23331399620.1298
         : individual accs = ['0.551714', '0.486126', '0.499720', '0.498136', '0.550569', '0.498643', '0.504810', '0.551556', '0.505667', '0.541014', '0.549010', '0.514194', '0.497910', '0.497006', '0.493436', '0.513512', '0.563555', '0.503542', '0.491194', '0.507535']
         : correct/total = [(7852, 14232), (6920, 14235), (7129, 14266), (7082, 14217), (7839, 14238), (7167, 14373), (7242, 14346), (7906, 14334), (7228, 14294), (7776, 14373), (7875, 14344), (7354, 14302), (7147, 14354), (7138, 14362), (7066, 14320), (7392, 14395), (8109, 14389), (7179, 14257), (7000, 14251), (7308, 14399)]
         : compromised: 0.5008, honest: 0.5512
Round 007: test acc mean=0.5195 ± 0.0292 | min=0.4864 max=0.5700
         : test loss mean=2855880761052.4644 ± 1902947834147.2927
         : individual accs = ['0.566892', '0.486407', '0.501612', '0.492931', '0.570024', '0.500452', '0.495539', '0.558323', '0.500210', '0.559730', '0.557934', '0.505454', '0.499373', '0.505152', '0.498045', '0.510177', '0.566335', '0.505576', '0.499474', '0.509966']
         : correct/total = [(8068, 14232), (6924, 14235), (7156, 14266), (7008, 14217), (8116, 14238), (7193, 14373), (7109, 14346), (8003, 14334), (7150, 14294), (8045, 14373), (8003, 14344), (7229, 14302), (7168, 14354), (7255, 14362), (7132, 14320), (7344, 14395), (8149, 14389), (7208, 14257), (7118, 14251), (7343, 14399)]
         : compromised: 0.5007, honest: 0.5632
Round 008: test acc mean=0.5244 ± 0.0323 | min=0.4906 max=0.5798
         : test loss mean=237941509944913.9062 ± 158048440141380.0625
         : individual accs = ['0.572723', '0.490622', '0.500841', '0.498980', '0.579786', '0.499756', '0.501464', '0.568927', '0.511823', '0.571349', '0.573480', '0.507831', '0.498467', '0.513090', '0.508310', '0.510038', '0.572312', '0.499544', '0.500035', '0.508855']
         : correct/total = [(8151, 14232), (6984, 14235), (7145, 14266), (7094, 14217), (8255, 14238), (7183, 14373), (7194, 14346), (8155, 14334), (7316, 14294), (8212, 14373), (8226, 14344), (7263, 14302), (7155, 14354), (7369, 14362), (7279, 14320), (7342, 14395), (8235, 14389), (7122, 14257), (7126, 14251), (7327, 14399)]
         : compromised: 0.5035, honest: 0.5731
Round 009: test acc mean=0.5266 ± 0.0366 | min=0.4940 max=0.5913
         : test loss mean=19721897573812248.0000 ± 13157955392821534.0000
         : individual accs = ['0.583474', '0.493994', '0.505888', '0.495111', '0.591305', '0.500035', '0.502370', '0.571648', '0.509165', '0.581646', '0.581776', '0.501538', '0.498189', '0.510792', '0.505028', '0.507885', '0.581694', '0.503472', '0.500105', '0.507396']
         : correct/total = [(8304, 14232), (7032, 14235), (7217, 14266), (7039, 14217), (8419, 14238), (7187, 14373), (7207, 14346), (8194, 14334), (7278, 14294), (8360, 14373), (8345, 14344), (7173, 14302), (7151, 14354), (7336, 14362), (7232, 14320), (7311, 14395), (8370, 14389), (7178, 14257), (7127, 14251), (7306, 14399)]
         : compromised: 0.5029, honest: 0.5819
Round 010: test acc mean=0.5294 ± 0.0415 | min=0.4964 max=0.5987
         : test loss mean=1678957146697773056.0000 ± 1121656449371315840.0000
         : individual accs = ['0.590992', '0.496382', '0.497336', '0.497151', '0.598750', '0.499687', '0.500070', '0.589577', '0.503778', '0.591943', '0.593279', '0.503216', '0.504250', '0.511976', '0.503701', '0.512539', '0.589478', '0.496598', '0.496877', '0.509549']
         : correct/total = [(8411, 14232), (7066, 14235), (7095, 14266), (7068, 14217), (8525, 14238), (7182, 14373), (7174, 14346), (8451, 14334), (7201, 14294), (8508, 14373), (8510, 14344), (7197, 14302), (7238, 14354), (7353, 14362), (7213, 14320), (7378, 14395), (8482, 14389), (7080, 14257), (7081, 14251), (7337, 14399)]
         : compromised: 0.5024, honest: 0.5923

=== FINAL RESULTS ===
Dataset: sent140, Nodes: 20, Graph: erdos, Aggregation: balance
Attack: backdoor, 70.0% compromised
Final accuracy - Compromised: 0.5024, Honest: 0.5923
Overall test accuracy: mean=0.5294 ± 0.0415

=== BACKDOOR ATTACK SUCCESS RATE (ASR) ===
Target label: 1
Trigger size: 3x3
Overall ASR: 0.8605 ± 0.2029
Honest nodes ASR: 0.5508 ± 0.0101
Compromised nodes ASR: 0.9932 ± 0.0048
Note: Higher ASR indicates more successful backdoor attack

=== BALANCE SUMMARY ===
Node 0: acceptance=0.400
Node 1: acceptance=0.600
Node 2: acceptance=0.600
Node 3: acceptance=0.600
Node 4: acceptance=0.400
Node 5: acceptance=0.600
Node 6: acceptance=0.600
Node 7: acceptance=0.345
Node 8: acceptance=0.600
Node 9: acceptance=0.427
Node 10: acceptance=0.325
Node 11: acceptance=0.600
Node 12: acceptance=0.700
Node 13: acceptance=0.600
Node 14: acceptance=0.600
Node 15: acceptance=0.600
Node 16: acceptance=0.357
Node 17: acceptance=0.600
Node 18: acceptance=0.600
Node 19: acceptance=0.600

=== PARALLEL EXECUTION TIME (realistic for distributed system) ===
  COMMUNICATION (max across nodes):
    - Full model transfer: 0.000s (0.0%)
  COMPUTATION (max across nodes):
    - Filtering: 0.061s (82.7%)
    - Aggregation: 0.013s (17.3%)
  TOTALS:
    - Total computation: 0.073s (100.0%)
    - Total communication: 0.000s (0.0%)
    - Total parallel time: 0.073s

=== PER-NODE AVERAGE TIME ===
  - Filtering: 0.044s
  - Aggregation: 0.007s
  - Model transfer: 0.000s
  - Total per node: 0.051s

=== TOTAL COMPUTATIONAL WORK (sum across all nodes) ===
  - Total filtering: 0.872s
  - Total aggregation: 0.145s
  - Total model transfer: 0.000s
  - Grand total: 1.017s
  - Mean acceptance rate: 0.538

BALANCE Algorithm Properties:
  - Model dimension: 1,174,986
  - No compression: Full parameter comparison
  - Theoretical complexity: O(deg(i)×d)
  - Approach: Full parameter filtering + averaging
