Device: cuda
Seed: 987654321
Loading 1 LEAF Sent140 train files...
LEAF Sent140 train: 254555 users, 908652 samples
Building vocabulary (max_size=10000)...
Vocabulary size: 10000
Loading 1 LEAF Sent140 test files...
LEAF Sent140 test: 254555 users, 286281 samples
Found 254555 train users, 254555 test users, 254555 common users
User sample counts range: 494 (max) to 1 (min)
Distributed ALL 254555 users across 20 clients
Users per client: 12727 (with 15 clients getting +1 user)
Train partition sizes: [44353, 44290, 44657, 44907, 44696, 45843, 45801, 45619, 45069, 45639, 45821, 45311, 45779, 46056, 45625, 45984, 46428, 44737, 45540, 46497]
Test partition sizes: [14232, 14235, 14266, 14217, 14238, 14373, 14346, 14334, 14294, 14373, 14344, 14302, 14354, 14362, 14320, 14395, 14389, 14257, 14251, 14399]
  Client 0: 44353 train samples, 2 unique classes
  Client 1: 44290 train samples, 2 unique classes
  Client 2: 44657 train samples, 2 unique classes
  Client 3: 44907 train samples, 2 unique classes
  Client 4: 44696 train samples, 2 unique classes
  Client 5: 45843 train samples, 2 unique classes
  Client 6: 45801 train samples, 2 unique classes
  Client 7: 45619 train samples, 2 unique classes
  Client 8: 45069 train samples, 2 unique classes
  Client 9: 45639 train samples, 2 unique classes
  Client 10: 45821 train samples, 2 unique classes
  Client 11: 45311 train samples, 2 unique classes
  Client 12: 45779 train samples, 2 unique classes
  Client 13: 46056 train samples, 2 unique classes
  Client 14: 45625 train samples, 2 unique classes
  Client 15: 45984 train samples, 2 unique classes
  Client 16: 46428 train samples, 2 unique classes
  Client 17: 44737 train samples, 2 unique classes
  Client 18: 45540 train samples, 2 unique classes
  Client 19: 46497 train samples, 2 unique classes
Will sample 4500 samples per client per epoch
Graph: erdos, nodes: 20, edges: 48
Degree statistics: avg=4.80, min=2, max=7
Attack: Compromised 4/20 nodes: [5, 12, 13, 17]
Attack type: directed_deviation, lambda: 1.0
Model variant: baseline
Model parameters: 1,174,986
Initial test acc across nodes: mean=0.4965 ± 0.0152
Round 001: test acc mean=0.5349 ± 0.0472 | min=0.4911 max=0.6098
         : test loss mean=16.9530 ± 15.9090
         : individual accs = ['0.593100', '0.609835', '0.599047', '0.512274', '0.504425', '0.493564', '0.496096', '0.502651', '0.591717', '0.602797', '0.501952', '0.499860', '0.496377', '0.491088', '0.496159', '0.520667', '0.495865', '0.497861', '0.595818', '0.596986']
         : correct/total = [(8441, 14232), (8681, 14235), (8546, 14266), (7283, 14217), (7182, 14238), (7094, 14373), (7117, 14346), (7205, 14334), (8458, 14294), (8664, 14373), (7200, 14344), (7149, 14302), (7125, 14354), (7053, 14362), (7105, 14320), (7495, 14395), (7135, 14389), (7098, 14257), (8491, 14251), (8596, 14399)]
         : compromised: 0.4947, honest: 0.5450
Round 002: test acc mean=0.5710 ± 0.0565 | min=0.4899 max=0.6247
         : test loss mean=14.4460 ± 19.8280
         : individual accs = ['0.617482', '0.624658', '0.617973', '0.620806', '0.619329', '0.504418', '0.615363', '0.503628', '0.611026', '0.619217', '0.618377', '0.614529', '0.500836', '0.514483', '0.508799', '0.500938', '0.493780', '0.489935', '0.608449', '0.616084']
         : correct/total = [(8788, 14232), (8892, 14235), (8816, 14266), (8826, 14217), (8818, 14238), (7250, 14373), (8828, 14346), (7219, 14334), (8734, 14294), (8900, 14373), (8870, 14344), (8789, 14302), (7189, 14354), (7389, 14362), (7286, 14320), (7211, 14395), (7105, 14389), (6985, 14257), (8671, 14251), (8871, 14399)]
         : compromised: 0.5024, honest: 0.5882
Round 003: test acc mean=0.5825 ± 0.0627 | min=0.4876 max=0.6367
         : test loss mean=2.5963 ± 3.0941
         : individual accs = ['0.628162', '0.628451', '0.631011', '0.630091', '0.636676', '0.492799', '0.621079', '0.487582', '0.622009', '0.630627', '0.630577', '0.623619', '0.505086', '0.632363', '0.491620', '0.498923', '0.501564', '0.504033', '0.625710', '0.628030']
         : correct/total = [(8940, 14232), (8946, 14235), (9002, 14266), (8958, 14217), (9065, 14238), (7083, 14373), (8910, 14346), (6989, 14334), (8891, 14294), (9064, 14373), (9045, 14344), (8919, 14302), (7250, 14354), (9082, 14362), (7040, 14320), (7182, 14395), (7217, 14389), (7186, 14257), (8917, 14251), (9043, 14399)]
         : compromised: 0.5336, honest: 0.5947
Round 004: test acc mean=0.5974 ± 0.0595 | min=0.4984 max=0.6416
         : test loss mean=3.2044 ± 4.1123
         : individual accs = ['0.635540', '0.639059', '0.637320', '0.636281', '0.634499', '0.498435', '0.629444', '0.513674', '0.636911', '0.639115', '0.641592', '0.634457', '0.511007', '0.639813', '0.505028', '0.508301', '0.632080', '0.503472', '0.632657', '0.638794']
         : correct/total = [(9045, 14232), (9097, 14235), (9092, 14266), (9046, 14217), (9034, 14238), (7164, 14373), (9030, 14346), (7363, 14334), (9104, 14294), (9186, 14373), (9203, 14344), (9074, 14302), (7335, 14354), (9189, 14362), (7232, 14320), (7317, 14395), (9095, 14389), (7178, 14257), (9016, 14251), (9198, 14399)]
         : compromised: 0.5382, honest: 0.6122
Round 005: test acc mean=0.6217 ± 0.0538 | min=0.4910 max=0.6491
         : test loss mean=1.8456 ± 2.9074
         : individual accs = ['0.647203', '0.643133', '0.645521', '0.647957', '0.642646', '0.490990', '0.643455', '0.499860', '0.641388', '0.647951', '0.644799', '0.642218', '0.647346', '0.649144', '0.491131', '0.647655', '0.640767', '0.638002', '0.642271', '0.641433']
         : correct/total = [(9211, 14232), (9155, 14235), (9209, 14266), (9212, 14217), (9150, 14238), (7057, 14373), (9231, 14346), (7165, 14334), (9168, 14294), (9313, 14373), (9249, 14344), (9185, 14302), (9292, 14354), (9323, 14362), (7033, 14320), (9323, 14395), (9220, 14389), (9096, 14257), (9153, 14251), (9236, 14399)]
         : compromised: 0.6064, honest: 0.6256
Round 006: test acc mean=0.6339 ± 0.0429 | min=0.5050 max=0.6539
         : test loss mean=1.7359 ± 3.4861
         : individual accs = ['0.653879', '0.652547', '0.652811', '0.649715', '0.642857', '0.504975', '0.650565', '0.647133', '0.644746', '0.653239', '0.653514', '0.644525', '0.645395', '0.643782', '0.506425', '0.642515', '0.649454', '0.642211', '0.648376', '0.648726']
         : correct/total = [(9306, 14232), (9289, 14235), (9313, 14266), (9237, 14217), (9153, 14238), (7258, 14373), (9333, 14346), (9276, 14334), (9216, 14294), (9389, 14373), (9374, 14344), (9218, 14302), (9264, 14354), (9246, 14362), (7252, 14320), (9249, 14395), (9345, 14389), (9156, 14257), (9240, 14251), (9341, 14399)]
         : compromised: 0.6091, honest: 0.6401
Round 007: test acc mean=0.6400 ± 0.0465 | min=0.5005 max=0.6608
         : test loss mean=1.5918 ± 2.9301
         : individual accs = ['0.660835', '0.656270', '0.655334', '0.657171', '0.654516', '0.501287', '0.657605', '0.655225', '0.647265', '0.656161', '0.652607', '0.654174', '0.656960', '0.658265', '0.500489', '0.656895', '0.655084', '0.651750', '0.653217', '0.659490']
         : correct/total = [(9405, 14232), (9342, 14235), (9349, 14266), (9343, 14217), (9319, 14238), (7205, 14373), (9434, 14346), (9392, 14334), (9252, 14294), (9431, 14373), (9361, 14344), (9356, 14302), (9430, 14354), (9454, 14362), (7167, 14320), (9456, 14395), (9426, 14389), (9292, 14257), (9309, 14251), (9496, 14399)]
         : compromised: 0.6171, honest: 0.6458
Round 008: test acc mean=0.6437 ± 0.0460 | min=0.5054 max=0.6681
         : test loss mean=2.1386 ± 4.5737
         : individual accs = ['0.662240', '0.665262', '0.659891', '0.661743', '0.656553', '0.507062', '0.662066', '0.651458', '0.658178', '0.658109', '0.652050', '0.660467', '0.661000', '0.660980', '0.505447', '0.668149', '0.652790', '0.650277', '0.656726', '0.663241']
         : correct/total = [(9425, 14232), (9470, 14235), (9414, 14266), (9408, 14217), (9348, 14238), (7288, 14373), (9498, 14346), (9338, 14334), (9408, 14294), (9459, 14373), (9353, 14344), (9446, 14302), (9488, 14354), (9493, 14362), (7238, 14320), (9618, 14395), (9393, 14389), (9271, 14257), (9359, 14251), (9550, 14399)]
         : compromised: 0.6198, honest: 0.6496
Round 009: test acc mean=0.6480 ± 0.0504 | min=0.4924 max=0.6736
         : test loss mean=1.9343 ± 3.9752
         : individual accs = ['0.666105', '0.665753', '0.664938', '0.666174', '0.666456', '0.501913', '0.662903', '0.665760', '0.660207', '0.668406', '0.659927', '0.661166', '0.668315', '0.667456', '0.492388', '0.673637', '0.664605', '0.657221', '0.663743', '0.663102']
         : correct/total = [(9480, 14232), (9477, 14235), (9486, 14266), (9471, 14217), (9489, 14238), (7214, 14373), (9510, 14346), (9543, 14334), (9437, 14294), (9607, 14373), (9466, 14344), (9456, 14302), (9593, 14354), (9586, 14362), (7051, 14320), (9697, 14395), (9563, 14389), (9370, 14257), (9459, 14251), (9548, 14399)]
         : compromised: 0.6237, honest: 0.6541
Round 010: test acc mean=0.6514 ± 0.0461 | min=0.5126 max=0.6766
         : test loss mean=1.8465 ± 3.7207
         : individual accs = ['0.672428', '0.667791', '0.669143', '0.671098', '0.663787', '0.515550', '0.671337', '0.663527', '0.664335', '0.672163', '0.665574', '0.656831', '0.660025', '0.671842', '0.512640', '0.676624', '0.665925', '0.654556', '0.665427', '0.667894']
         : correct/total = [(9570, 14232), (9506, 14235), (9546, 14266), (9541, 14217), (9451, 14238), (7410, 14373), (9631, 14346), (9511, 14334), (9496, 14294), (9661, 14373), (9547, 14344), (9394, 14302), (9474, 14354), (9649, 14362), (7341, 14320), (9740, 14395), (9582, 14389), (9332, 14257), (9483, 14251), (9617, 14399)]
         : compromised: 0.6255, honest: 0.6579

=== FINAL RESULTS ===
Dataset: sent140, Nodes: 20, Graph: erdos, Aggregation: krum
Attack: directed_deviation, 20.0% compromised
Final accuracy - Compromised: 0.6255, Honest: 0.6579
Overall test accuracy: mean=0.6514 ± 0.0461
