Device: cuda
Seed: 987654321
Loading 1 LEAF Sent140 train files...
LEAF Sent140 train: 254555 users, 908652 samples
Building vocabulary (max_size=10000)...
Vocabulary size: 10000
Loading 1 LEAF Sent140 test files...
LEAF Sent140 test: 254555 users, 286281 samples
Found 254555 train users, 254555 test users, 254555 common users
User sample counts range: 494 (max) to 1 (min)
Distributed ALL 254555 users across 20 clients
Users per client: 12727 (with 15 clients getting +1 user)
Train partition sizes: [44353, 44290, 44657, 44907, 44696, 45843, 45801, 45619, 45069, 45639, 45821, 45311, 45779, 46056, 45625, 45984, 46428, 44737, 45540, 46497]
Test partition sizes: [14232, 14235, 14266, 14217, 14238, 14373, 14346, 14334, 14294, 14373, 14344, 14302, 14354, 14362, 14320, 14395, 14389, 14257, 14251, 14399]
  Client 0: 44353 train samples, 2 unique classes
  Client 1: 44290 train samples, 2 unique classes
  Client 2: 44657 train samples, 2 unique classes
  Client 3: 44907 train samples, 2 unique classes
  Client 4: 44696 train samples, 2 unique classes
  Client 5: 45843 train samples, 2 unique classes
  Client 6: 45801 train samples, 2 unique classes
  Client 7: 45619 train samples, 2 unique classes
  Client 8: 45069 train samples, 2 unique classes
  Client 9: 45639 train samples, 2 unique classes
  Client 10: 45821 train samples, 2 unique classes
  Client 11: 45311 train samples, 2 unique classes
  Client 12: 45779 train samples, 2 unique classes
  Client 13: 46056 train samples, 2 unique classes
  Client 14: 45625 train samples, 2 unique classes
  Client 15: 45984 train samples, 2 unique classes
  Client 16: 46428 train samples, 2 unique classes
  Client 17: 44737 train samples, 2 unique classes
  Client 18: 45540 train samples, 2 unique classes
  Client 19: 46497 train samples, 2 unique classes
Will sample 4500 samples per client per epoch
Graph: erdos, nodes: 20, edges: 48
Degree statistics: avg=4.80, min=2, max=7
Attack: Compromised 6/20 nodes: [5, 12, 13, 14, 17, 18]
Attack type: directed_deviation, lambda: 1.0
Model variant: baseline
Model parameters: 1,174,986
Initial test acc across nodes: mean=0.4965 ± 0.0152
Round 001: test acc mean=0.5203 ± 0.0405 | min=0.4840 max=0.6098
         : test loss mean=18.6823 ± 14.4340
         : individual accs = ['0.593100', '0.609835', '0.513879', '0.496659', '0.498946', '0.496973', '0.497072', '0.494907', '0.600392', '0.505810', '0.501673', '0.492379', '0.506967', '0.509678', '0.494972', '0.507190', '0.501981', '0.502280', '0.483966', '0.596986']
         : correct/total = [(8441, 14232), (8681, 14235), (7331, 14266), (7061, 14217), (7104, 14238), (7143, 14373), (7131, 14346), (7094, 14334), (8582, 14294), (7270, 14373), (7196, 14344), (7042, 14302), (7277, 14354), (7320, 14362), (7088, 14320), (7301, 14395), (7223, 14389), (7161, 14257), (6897, 14251), (8596, 14399)]
         : compromised: 0.4991, honest: 0.5293
Round 002: test acc mean=0.5249 ± 0.0470 | min=0.4892 max=0.6235
         : test loss mean=17.7694 ± 13.7638
         : individual accs = ['0.489250', '0.620513', '0.501122', '0.492579', '0.505970', '0.501078', '0.623519', '0.512837', '0.611865', '0.503235', '0.500139', '0.513425', '0.499861', '0.501810', '0.502444', '0.504620', '0.500869', '0.496598', '0.499053', '0.617126']
         : correct/total = [(6963, 14232), (8833, 14235), (7149, 14266), (7003, 14217), (7204, 14238), (7202, 14373), (8945, 14346), (7351, 14334), (8746, 14294), (7233, 14373), (7174, 14344), (7343, 14302), (7175, 14354), (7207, 14362), (7195, 14320), (7264, 14395), (7207, 14389), (7080, 14257), (7112, 14251), (8886, 14399)]
         : compromised: 0.5001, honest: 0.5355
Round 003: test acc mean=0.5310 ± 0.0564 | min=0.4854 max=0.6305
         : test loss mean=3.3369 ± 2.7057
         : individual accs = ['0.629005', '0.630488', '0.485560', '0.492509', '0.493960', '0.493912', '0.497700', '0.497837', '0.624598', '0.510123', '0.498606', '0.506642', '0.519855', '0.485378', '0.495810', '0.502813', '0.496977', '0.502841', '0.627745', '0.626710']
         : correct/total = [(8952, 14232), (8975, 14235), (6927, 14266), (7002, 14217), (7033, 14238), (7099, 14373), (7140, 14346), (7136, 14334), (8928, 14294), (7332, 14373), (7152, 14344), (7246, 14302), (7462, 14354), (6971, 14362), (7100, 14320), (7238, 14395), (7151, 14389), (7169, 14257), (8946, 14251), (9024, 14399)]
         : compromised: 0.5209, honest: 0.5353
Round 004: test acc mean=0.5200 ± 0.0495 | min=0.4833 max=0.6405
         : test loss mean=6.0295 ± 5.8911
         : individual accs = ['0.639193', '0.504461', '0.497126', '0.493072', '0.508428', '0.497391', '0.499233', '0.504256', '0.630824', '0.499061', '0.499861', '0.498462', '0.508012', '0.498120', '0.494483', '0.499271', '0.492460', '0.483342', '0.513367', '0.640461']
         : correct/total = [(9097, 14232), (7181, 14235), (7092, 14266), (7010, 14217), (7239, 14238), (7149, 14373), (7162, 14346), (7228, 14334), (9017, 14294), (7173, 14373), (7170, 14344), (7129, 14302), (7292, 14354), (7154, 14362), (7081, 14320), (7187, 14395), (7086, 14389), (6891, 14257), (7316, 14251), (9222, 14399)]
         : compromised: 0.4991, honest: 0.5290
Round 005: test acc mean=0.5232 ± 0.0497 | min=0.4791 max=0.6453
         : test loss mean=5.1035 ± 5.0955
         : individual accs = ['0.645306', '0.515771', '0.506659', '0.519238', '0.511238', '0.483824', '0.521888', '0.493163', '0.626836', '0.503166', '0.502091', '0.495805', '0.499094', '0.488651', '0.479050', '0.511914', '0.509278', '0.505857', '0.502281', '0.643309']
         : correct/total = [(9184, 14232), (7342, 14235), (7228, 14266), (7382, 14217), (7279, 14238), (6954, 14373), (7487, 14346), (7069, 14334), (8960, 14294), (7232, 14373), (7202, 14344), (7091, 14302), (7164, 14354), (7018, 14362), (6860, 14320), (7369, 14395), (7328, 14389), (7212, 14257), (7158, 14251), (9263, 14399)]
         : compromised: 0.4931, honest: 0.5361
Round 006: test acc mean=0.5240 ± 0.0450 | min=0.4795 max=0.6491
         : test loss mean=3.7908 ± 4.2605
         : individual accs = ['0.527263', '0.499895', '0.514580', '0.570514', '0.500913', '0.487233', '0.569218', '0.503070', '0.634112', '0.507758', '0.513246', '0.505314', '0.492058', '0.479529', '0.505098', '0.499687', '0.503857', '0.513572', '0.504596', '0.649073']
         : correct/total = [(7504, 14232), (7116, 14235), (7341, 14266), (8111, 14217), (7132, 14238), (7003, 14373), (8166, 14346), (7211, 14334), (9064, 14294), (7298, 14373), (7362, 14344), (7227, 14302), (7063, 14354), (6887, 14362), (7233, 14320), (7193, 14395), (7250, 14389), (7322, 14257), (7191, 14251), (9346, 14399)]
         : compromised: 0.4970, honest: 0.5356
Round 007: test acc mean=0.5309 ± 0.0558 | min=0.4802 max=0.6591
         : test loss mean=6.8935 ± 6.7292
         : individual accs = ['0.545601', '0.492308', '0.503996', '0.570373', '0.503652', '0.500800', '0.584971', '0.491768', '0.639429', '0.511097', '0.520078', '0.498322', '0.493382', '0.480156', '0.487151', '0.507676', '0.485510', '0.498702', '0.643885', '0.659143']
         : correct/total = [(7765, 14232), (7008, 14235), (7190, 14266), (8109, 14217), (7171, 14238), (7198, 14373), (8392, 14346), (7049, 14334), (9140, 14294), (7346, 14373), (7460, 14344), (7127, 14302), (7082, 14354), (6896, 14362), (6976, 14320), (7308, 14395), (6986, 14389), (7110, 14257), (9176, 14251), (9491, 14399)]
         : compromised: 0.5173, honest: 0.5367
Round 008: test acc mean=0.5299 ± 0.0509 | min=0.4787 max=0.6536
         : test loss mean=3.6591 ± 5.2692
         : individual accs = ['0.536327', '0.595083', '0.501542', '0.600127', '0.489043', '0.491199', '0.533319', '0.497070', '0.653561', '0.506923', '0.515686', '0.507621', '0.478682', '0.511071', '0.501536', '0.505314', '0.500313', '0.510626', '0.651954', '0.510105']
         : correct/total = [(7633, 14232), (8471, 14235), (7155, 14266), (8532, 14217), (6963, 14238), (7060, 14373), (7651, 14346), (7125, 14334), (9342, 14294), (7286, 14373), (7397, 14344), (7260, 14302), (6871, 14354), (7340, 14362), (7182, 14320), (7274, 14395), (7199, 14389), (7280, 14257), (9291, 14251), (7345, 14399)]
         : compromised: 0.5242, honest: 0.5323
Round 009: test acc mean=0.5315 ± 0.0544 | min=0.4851 max=0.6529
         : test loss mean=4.7159 ± 4.4381
         : individual accs = ['0.551855', '0.559185', '0.496495', '0.614757', '0.490729', '0.505253', '0.611041', '0.507186', '0.652302', '0.485146', '0.502998', '0.494197', '0.490038', '0.497145', '0.495810', '0.500035', '0.514351', '0.508242', '0.652937', '0.500799']
         : correct/total = [(7854, 14232), (7960, 14235), (7083, 14266), (8740, 14217), (6987, 14238), (7262, 14373), (8766, 14346), (7270, 14334), (9324, 14294), (6973, 14373), (7215, 14344), (7068, 14302), (7034, 14354), (7140, 14362), (7100, 14320), (7198, 14395), (7401, 14389), (7246, 14257), (9305, 14251), (7211, 14399)]
         : compromised: 0.5249, honest: 0.5344
Round 010: test acc mean=0.5367 ± 0.0550 | min=0.4789 max=0.6599
         : test loss mean=2.6081 ± 2.9070
         : individual accs = ['0.561832', '0.511345', '0.558531', '0.623409', '0.506883', '0.493843', '0.611460', '0.513813', '0.659927', '0.478884', '0.514361', '0.507971', '0.509126', '0.504108', '0.494483', '0.512192', '0.503510', '0.496037', '0.658901', '0.512605']
         : correct/total = [(7996, 14232), (7279, 14235), (7968, 14266), (8863, 14217), (7217, 14238), (7098, 14373), (8772, 14346), (7365, 14334), (9433, 14294), (6883, 14373), (7378, 14344), (7265, 14302), (7308, 14354), (7240, 14362), (7081, 14320), (7373, 14395), (7245, 14389), (7072, 14257), (9390, 14251), (7381, 14399)]
         : compromised: 0.5261, honest: 0.5412

=== FINAL RESULTS ===
Dataset: sent140, Nodes: 20, Graph: erdos, Aggregation: krum
Attack: directed_deviation, 30.0% compromised
Final accuracy - Compromised: 0.5261, Honest: 0.5412
Overall test accuracy: mean=0.5367 ± 0.0550
