Device: cuda
Seed: 987654321
Loading 1 LEAF Sent140 train files...
LEAF Sent140 train: 254555 users, 908652 samples
Building vocabulary (max_size=10000)...
Vocabulary size: 10000
Loading 1 LEAF Sent140 test files...
LEAF Sent140 test: 254555 users, 286281 samples
Found 254555 train users, 254555 test users, 254555 common users
User sample counts range: 494 (max) to 1 (min)
Distributed ALL 254555 users across 20 clients
Users per client: 12727 (with 15 clients getting +1 user)
Train partition sizes: [44353, 44290, 44657, 44907, 44696, 45843, 45801, 45619, 45069, 45639, 45821, 45311, 45779, 46056, 45625, 45984, 46428, 44737, 45540, 46497]
Test partition sizes: [14232, 14235, 14266, 14217, 14238, 14373, 14346, 14334, 14294, 14373, 14344, 14302, 14354, 14362, 14320, 14395, 14389, 14257, 14251, 14399]
  Client 0: 44353 train samples, 2 unique classes
  Client 1: 44290 train samples, 2 unique classes
  Client 2: 44657 train samples, 2 unique classes
  Client 3: 44907 train samples, 2 unique classes
  Client 4: 44696 train samples, 2 unique classes
  Client 5: 45843 train samples, 2 unique classes
  Client 6: 45801 train samples, 2 unique classes
  Client 7: 45619 train samples, 2 unique classes
  Client 8: 45069 train samples, 2 unique classes
  Client 9: 45639 train samples, 2 unique classes
  Client 10: 45821 train samples, 2 unique classes
  Client 11: 45311 train samples, 2 unique classes
  Client 12: 45779 train samples, 2 unique classes
  Client 13: 46056 train samples, 2 unique classes
  Client 14: 45625 train samples, 2 unique classes
  Client 15: 45984 train samples, 2 unique classes
  Client 16: 46428 train samples, 2 unique classes
  Client 17: 44737 train samples, 2 unique classes
  Client 18: 45540 train samples, 2 unique classes
  Client 19: 46497 train samples, 2 unique classes
Will sample 4500 samples per client per epoch
Graph: fully, nodes: 20, edges: 190
Degree statistics: avg=19.00, min=19, max=19
Attack: Compromised 6/20 nodes: [5, 12, 13, 14, 17, 18]
Attack type: backdoor, lambda: 1.0
Backdoor target label: 1, trigger size: 3
Model variant: baseline
Model parameters: 1,174,986
Sketchguard Node 0:
  Model dim: 1,174,986 → Sketch size: 180
  Compression ratio: 6527.7x
  Using model parameters for aggregation, sketches for filtering
Sketchguard Node 1:
  Model dim: 1,174,986 → Sketch size: 180
  Compression ratio: 6527.7x
  Using model parameters for aggregation, sketches for filtering
Sketchguard Node 2:
  Model dim: 1,174,986 → Sketch size: 180
  Compression ratio: 6527.7x
  Using model parameters for aggregation, sketches for filtering
Sketchguard Node 3:
  Model dim: 1,174,986 → Sketch size: 180
  Compression ratio: 6527.7x
  Using model parameters for aggregation, sketches for filtering
Sketchguard Node 4:
  Model dim: 1,174,986 → Sketch size: 180
  Compression ratio: 6527.7x
  Using model parameters for aggregation, sketches for filtering
Sketchguard Node 5:
  Model dim: 1,174,986 → Sketch size: 180
  Compression ratio: 6527.7x
  Using model parameters for aggregation, sketches for filtering
Sketchguard Node 6:
  Model dim: 1,174,986 → Sketch size: 180
  Compression ratio: 6527.7x
  Using model parameters for aggregation, sketches for filtering
Sketchguard Node 7:
  Model dim: 1,174,986 → Sketch size: 180
  Compression ratio: 6527.7x
  Using model parameters for aggregation, sketches for filtering
Sketchguard Node 8:
  Model dim: 1,174,986 → Sketch size: 180
  Compression ratio: 6527.7x
  Using model parameters for aggregation, sketches for filtering
Sketchguard Node 9:
  Model dim: 1,174,986 → Sketch size: 180
  Compression ratio: 6527.7x
  Using model parameters for aggregation, sketches for filtering
Sketchguard Node 10:
  Model dim: 1,174,986 → Sketch size: 180
  Compression ratio: 6527.7x
  Using model parameters for aggregation, sketches for filtering
Sketchguard Node 11:
  Model dim: 1,174,986 → Sketch size: 180
  Compression ratio: 6527.7x
  Using model parameters for aggregation, sketches for filtering
Sketchguard Node 12:
  Model dim: 1,174,986 → Sketch size: 180
  Compression ratio: 6527.7x
  Using model parameters for aggregation, sketches for filtering
Sketchguard Node 13:
  Model dim: 1,174,986 → Sketch size: 180
  Compression ratio: 6527.7x
  Using model parameters for aggregation, sketches for filtering
Sketchguard Node 14:
  Model dim: 1,174,986 → Sketch size: 180
  Compression ratio: 6527.7x
  Using model parameters for aggregation, sketches for filtering
Sketchguard Node 15:
  Model dim: 1,174,986 → Sketch size: 180
  Compression ratio: 6527.7x
  Using model parameters for aggregation, sketches for filtering
Sketchguard Node 16:
  Model dim: 1,174,986 → Sketch size: 180
  Compression ratio: 6527.7x
  Using model parameters for aggregation, sketches for filtering
Sketchguard Node 17:
  Model dim: 1,174,986 → Sketch size: 180
  Compression ratio: 6527.7x
  Using model parameters for aggregation, sketches for filtering
Sketchguard Node 18:
  Model dim: 1,174,986 → Sketch size: 180
  Compression ratio: 6527.7x
  Using model parameters for aggregation, sketches for filtering
Sketchguard Node 19:
  Model dim: 1,174,986 → Sketch size: 180
  Compression ratio: 6527.7x
  Using model parameters for aggregation, sketches for filtering
Sketchguard ALGORITHM (Sketch-based Filtering + State Aggregation)
  - Model dimension: 1,174,986 parameters
  - Config: SketchguardConfig(gamma=2, kappa=1, alpha=0.5, min_neighbors=1, sketch_size=180, network_seed=987654321, attack_detection_window=5)
  - Sketch size: 180
  - Compression ratio: 6527.7x
  - Complexity: O(d + N×k) = O(1,174,986 + 20×180)
  - Theoretical speedup vs BALANCE: 19.9x
Initial test acc across nodes: mean=0.4953 ± 0.0174
Backdoor attack: Created poisoned datasets for 6 compromised nodes
Round 001: test acc mean=0.5050 ± 0.0208 | min=0.4650 max=0.5582
         : test loss mean=12.4597 ± 18.4271
         : individual accs = ['0.492552', '0.495961', '0.484368', '0.521137', '0.465023', '0.521951', '0.486129', '0.510744', '0.496362', '0.558199', '0.484872', '0.496154', '0.518601', '0.523743', '0.515293', '0.530670', '0.490931', '0.515045', '0.508666', '0.482881']
         : correct/total = [(7010, 14232), (7060, 14235), (6910, 14266), (7409, 14217), (6621, 14238), (7502, 14373), (6974, 14346), (7321, 14334), (7095, 14294), (8023, 14373), (6955, 14344), (7096, 14302), (7444, 14354), (7522, 14362), (7379, 14320), (7639, 14395), (7064, 14389), (7343, 14257), (7249, 14251), (6953, 14399)]
         : compromised: 0.5172, honest: 0.4997
         : sketchguard stats = ['Node 0: acc_rate=1.000', 'Node 1: acc_rate=1.000', 'Node 2: acc_rate=1.000']...
Round 002: test acc mean=0.5665 ± 0.0466 | min=0.4916 max=0.6222
         : test loss mean=117.8265 ± 184.6456
         : individual accs = ['0.607434', '0.606041', '0.597364', '0.569459', '0.622208', '0.499826', '0.622194', '0.577229', '0.585350', '0.579698', '0.619144', '0.601944', '0.491570', '0.494917', '0.506704', '0.578812', '0.595385', '0.499684', '0.502631', '0.571984']
         : correct/total = [(8645, 14232), (8627, 14235), (8522, 14266), (8096, 14217), (8859, 14238), (7184, 14373), (8926, 14346), (8274, 14334), (8367, 14294), (8332, 14373), (8881, 14344), (8609, 14302), (7056, 14354), (7108, 14362), (7256, 14320), (8332, 14395), (8567, 14389), (7124, 14257), (7163, 14251), (8236, 14399)]
         : compromised: 0.4992, honest: 0.5953
         : sketchguard stats = ['Node 0: acc_rate=0.842', 'Node 1: acc_rate=0.842', 'Node 2: acc_rate=0.842']...
Round 003: test acc mean=0.5792 ± 0.0544 | min=0.4925 max=0.6354
         : test loss mean=6513.5938 ± 11012.6757
         : individual accs = ['0.605396', '0.630348', '0.614538', '0.603784', '0.583439', '0.505810', '0.608044', '0.600879', '0.616482', '0.632505', '0.627370', '0.627465', '0.495750', '0.492550', '0.497905', '0.635429', '0.620474', '0.495967', '0.504386', '0.585527']
         : correct/total = [(8616, 14232), (8973, 14235), (8767, 14266), (8584, 14217), (8307, 14238), (7270, 14373), (8723, 14346), (8613, 14334), (8812, 14294), (9091, 14373), (8999, 14344), (8974, 14302), (7116, 14354), (7074, 14362), (7130, 14320), (9147, 14395), (8928, 14389), (7071, 14257), (7188, 14251), (8431, 14399)]
         : compromised: 0.4987, honest: 0.6137
         : sketchguard stats = ['Node 0: acc_rate=0.789', 'Node 1: acc_rate=0.789', 'Node 2: acc_rate=0.789']...
Round 004: test acc mean=0.5990 ± 0.0601 | min=0.4976 max=0.6473
         : test loss mean=1420582.2595 ± 2349513.5558
         : individual accs = ['0.636031', '0.640464', '0.636548', '0.640641', '0.640750', '0.515689', '0.636484', '0.634366', '0.639149', '0.644333', '0.634830', '0.635156', '0.497631', '0.516572', '0.499511', '0.627926', '0.639933', '0.512941', '0.503754', '0.647267']
         : correct/total = [(9052, 14232), (9117, 14235), (9081, 14266), (9108, 14217), (9123, 14238), (7412, 14373), (9131, 14346), (9093, 14334), (9136, 14294), (9261, 14373), (9106, 14344), (9084, 14302), (7143, 14354), (7419, 14362), (7153, 14320), (9039, 14395), (9208, 14389), (7313, 14257), (7179, 14251), (9320, 14399)]
         : compromised: 0.5077, honest: 0.6381
         : sketchguard stats = ['Node 0: acc_rate=0.763', 'Node 1: acc_rate=0.763', 'Node 2: acc_rate=0.763']...
Round 005: test acc mean=0.6053 ± 0.0679 | min=0.4939 max=0.6572
         : test loss mean=33146156.6508 ± 51840245.0067
         : individual accs = ['0.643339', '0.654373', '0.642437', '0.654850', '0.654797', '0.501357', '0.652935', '0.644900', '0.652022', '0.633688', '0.647936', '0.650119', '0.499582', '0.507729', '0.503422', '0.651268', '0.657238', '0.493933', '0.506070', '0.653795']
         : correct/total = [(9156, 14232), (9315, 14235), (9165, 14266), (9310, 14217), (9323, 14238), (7206, 14373), (9367, 14346), (9244, 14334), (9320, 14294), (9108, 14373), (9294, 14344), (9298, 14302), (7171, 14354), (7292, 14362), (7209, 14320), (9375, 14395), (9457, 14389), (7042, 14257), (7212, 14251), (9414, 14399)]
         : compromised: 0.5020, honest: 0.6495
         : sketchguard stats = ['Node 0: acc_rate=0.747', 'Node 1: acc_rate=0.747', 'Node 2: acc_rate=0.747']...
Round 006: test acc mean=0.6111 ± 0.0709 | min=0.4933 max=0.6651
         : test loss mean=2113760474.2414 ± 3418427370.8542
         : individual accs = ['0.657040', '0.662873', '0.651549', '0.660266', '0.652830', '0.514785', '0.660672', '0.661365', '0.662236', '0.660057', '0.643753', '0.647182', '0.507315', '0.493316', '0.504190', '0.655922', '0.662520', '0.498983', '0.500667', '0.665116']
         : correct/total = [(9351, 14232), (9436, 14235), (9295, 14266), (9387, 14217), (9295, 14238), (7399, 14373), (9478, 14346), (9480, 14334), (9466, 14294), (9487, 14373), (9234, 14344), (9256, 14302), (7282, 14354), (7085, 14362), (7220, 14320), (9442, 14395), (9533, 14389), (7114, 14257), (7135, 14251), (9577, 14399)]
         : compromised: 0.5032, honest: 0.6574
         : sketchguard stats = ['Node 0: acc_rate=0.737', 'Node 1: acc_rate=0.737', 'Node 2: acc_rate=0.737']...
Round 007: test acc mean=0.6163 ± 0.0725 | min=0.4923 max=0.6703
         : test loss mean=170762198178.4825 ± 271703122226.6822
         : individual accs = ['0.665191', '0.670320', '0.662835', '0.664979', '0.668984', '0.520838', '0.666667', '0.643156', '0.666084', '0.665136', '0.656023', '0.665991', '0.492337', '0.503830', '0.504888', '0.654185', '0.670026', '0.507961', '0.506771', '0.668866']
         : correct/total = [(9467, 14232), (9542, 14235), (9456, 14266), (9454, 14217), (9525, 14238), (7486, 14373), (9564, 14346), (9219, 14334), (9521, 14294), (9560, 14373), (9410, 14344), (9525, 14302), (7067, 14354), (7236, 14362), (7230, 14320), (9417, 14395), (9641, 14389), (7242, 14257), (7222, 14251), (9631, 14399)]
         : compromised: 0.5061, honest: 0.6635
         : sketchguard stats = ['Node 0: acc_rate=0.729', 'Node 1: acc_rate=0.729', 'Node 2: acc_rate=0.729']...
Round 008: test acc mean=0.6184 ± 0.0818 | min=0.4829 max=0.6798
         : test loss mean=17345692881559.5781 ± 28572417994265.7695
         : individual accs = ['0.666807', '0.670460', '0.657928', '0.679257', '0.668844', '0.483267', '0.679841', '0.672806', '0.677277', '0.672233', '0.671221', '0.668298', '0.495611', '0.496867', '0.502793', '0.669677', '0.675099', '0.482921', '0.501438', '0.675464']
         : correct/total = [(9490, 14232), (9544, 14235), (9386, 14266), (9657, 14217), (9523, 14238), (6946, 14373), (9753, 14346), (9644, 14334), (9681, 14294), (9662, 14373), (9628, 14344), (9558, 14302), (7114, 14354), (7136, 14362), (7200, 14320), (9640, 14395), (9714, 14389), (6885, 14257), (7146, 14251), (9726, 14399)]
         : compromised: 0.4938, honest: 0.6718
         : sketchguard stats = ['Node 0: acc_rate=0.724', 'Node 1: acc_rate=0.724', 'Node 2: acc_rate=0.724']...
Round 009: test acc mean=0.6176 ± 0.0791 | min=0.4879 max=0.6830
         : test loss mean=1061121608024646.7500 ± 1701163625286144.0000
         : individual accs = ['0.643901', '0.683035', '0.674541', '0.677639', '0.676429', '0.505949', '0.655374', '0.673504', '0.673010', '0.666806', '0.655605', '0.665361', '0.487878', '0.496727', '0.503352', '0.667315', '0.677392', '0.500736', '0.491053', '0.675672']
         : correct/total = [(9164, 14232), (9723, 14235), (9623, 14266), (9634, 14217), (9631, 14238), (7272, 14373), (9402, 14346), (9654, 14334), (9620, 14294), (9584, 14373), (9404, 14344), (9516, 14302), (7003, 14354), (7134, 14362), (7208, 14320), (9606, 14395), (9747, 14389), (7139, 14257), (6998, 14251), (9729, 14399)]
         : compromised: 0.4976, honest: 0.6690
         : sketchguard stats = ['Node 0: acc_rate=0.719', 'Node 1: acc_rate=0.719', 'Node 2: acc_rate=0.719']...
Round 010: test acc mean=0.6287 ± 0.0825 | min=0.4944 max=0.6919
         : test loss mean=114725679925740192.0000 ± 195642729591030400.0000
         : individual accs = ['0.679103', '0.684651', '0.677064', '0.684884', '0.684506', '0.505462', '0.685278', '0.691852', '0.684343', '0.678842', '0.684537', '0.681863', '0.508012', '0.502855', '0.501955', '0.678222', '0.682605', '0.494354', '0.504877', '0.679422']
         : correct/total = [(9665, 14232), (9746, 14235), (9659, 14266), (9737, 14217), (9746, 14238), (7265, 14373), (9831, 14346), (9917, 14334), (9782, 14294), (9757, 14373), (9819, 14344), (9752, 14302), (7292, 14354), (7222, 14362), (7188, 14320), (9763, 14395), (9822, 14389), (7048, 14257), (7195, 14251), (9783, 14399)]
         : compromised: 0.5029, honest: 0.6827
         : sketchguard stats = ['Node 0: acc_rate=0.716', 'Node 1: acc_rate=0.716', 'Node 2: acc_rate=0.716']...

=== FINAL RESULTS ===
Dataset: sent140, Nodes: 20, Graph: fully, Aggregation: sketchguard
Attack: backdoor, 30.0% compromised
Final accuracy - Compromised: 0.5029, Honest: 0.6827
Overall test accuracy: mean=0.6287 ± 0.0825

=== BACKDOOR ATTACK SUCCESS RATE (ASR) ===
Target label: 1
Trigger size: 3x3
Overall ASR: 0.5988 ± 0.2348
Honest nodes ASR: 0.4553 ± 0.0523
Compromised nodes ASR: 0.9336 ± 0.1316
Note: Higher ASR indicates more successful backdoor attack

=== Sketchguard SUMMARY ===
Node 0: acceptance=0.716
Node 1: acceptance=0.716
Node 2: acceptance=0.716
Node 3: acceptance=0.716
Node 4: acceptance=0.716
Node 5: acceptance=0.600
Node 6: acceptance=0.716
Node 7: acceptance=0.716
Node 8: acceptance=0.716
Node 9: acceptance=0.716
Node 10: acceptance=0.716
Node 11: acceptance=0.716
Node 12: acceptance=0.600
Node 13: acceptance=0.600
Node 14: acceptance=0.600
Node 15: acceptance=0.716
Node 16: acceptance=0.716
Node 17: acceptance=0.600
Node 18: acceptance=0.600
Node 19: acceptance=0.716

=== PARALLEL EXECUTION TIME (realistic for distributed system) ===
  COMMUNICATION (max across nodes):
    - Sketch transfer: 0.000s (0.0%)
    - Model fetch (accepted): 0.000s (0.0%)
  COMPUTATION (max across nodes):
    - Sketching: 0.518s (93.9%)
    - Filtering: 0.001s (0.2%)
    - Aggregation: 0.032s (5.9%)
  TOTALS:
    - Total computation: 0.552s (100.0%)
    - Total communication: 0.000s (0.0%)
    - Total parallel time: 0.552s

=== PER-NODE AVERAGE TIME ===
  - Sketching: 0.500s
  - Filtering: 0.001s
  - Aggregation: 0.023s
  - Sketch transfer: 0.000s
  - Model fetch: 0.000s
  - Total per node: 0.524s

=== TOTAL COMPUTATIONAL WORK (sum across all nodes) ===
  - Total sketching: 10.004s
  - Total filtering: 0.016s
  - Total aggregation: 0.454s
  - Total sketch transfer: 0.000s
  - Total model fetch: 0.000s
  - Grand total: 10.475s
  - Mean acceptance rate: 0.681

Sketchguard Algorithm Properties:
  - Original dimension: 1,174,986
  - Sketch size: 180
  - Compression ratio: 19.9x
  - Single repetition: No repetitions needed
  - Theoretical complexity: O(d + N×k)
  - Approach: Sketch filtering + state aggregation
