Device: cuda
Seed: 987654321
Loading 1 LEAF Sent140 train files...
LEAF Sent140 train: 254555 users, 908652 samples
Building vocabulary (max_size=10000)...
Vocabulary size: 10000
Loading 1 LEAF Sent140 test files...
LEAF Sent140 test: 254555 users, 286281 samples
Found 254555 train users, 254555 test users, 254555 common users
User sample counts range: 494 (max) to 1 (min)
Distributed ALL 254555 users across 20 clients
Users per client: 12727 (with 15 clients getting +1 user)
Train partition sizes: [44353, 44290, 44657, 44907, 44696, 45843, 45801, 45619, 45069, 45639, 45821, 45311, 45779, 46056, 45625, 45984, 46428, 44737, 45540, 46497]
Test partition sizes: [14232, 14235, 14266, 14217, 14238, 14373, 14346, 14334, 14294, 14373, 14344, 14302, 14354, 14362, 14320, 14395, 14389, 14257, 14251, 14399]
  Client 0: 44353 train samples, 2 unique classes
  Client 1: 44290 train samples, 2 unique classes
  Client 2: 44657 train samples, 2 unique classes
  Client 3: 44907 train samples, 2 unique classes
  Client 4: 44696 train samples, 2 unique classes
  Client 5: 45843 train samples, 2 unique classes
  Client 6: 45801 train samples, 2 unique classes
  Client 7: 45619 train samples, 2 unique classes
  Client 8: 45069 train samples, 2 unique classes
  Client 9: 45639 train samples, 2 unique classes
  Client 10: 45821 train samples, 2 unique classes
  Client 11: 45311 train samples, 2 unique classes
  Client 12: 45779 train samples, 2 unique classes
  Client 13: 46056 train samples, 2 unique classes
  Client 14: 45625 train samples, 2 unique classes
  Client 15: 45984 train samples, 2 unique classes
  Client 16: 46428 train samples, 2 unique classes
  Client 17: 44737 train samples, 2 unique classes
  Client 18: 45540 train samples, 2 unique classes
  Client 19: 46497 train samples, 2 unique classes
Will sample 4500 samples per client per epoch
Graph: erdos, nodes: 20, edges: 126
Degree statistics: avg=12.60, min=8, max=16
Attack: Compromised 8/20 nodes: [1, 5, 11, 12, 13, 14, 17, 18]
Attack type: directed_deviation, lambda: 1.0
Model variant: baseline
Model parameters: 1,174,986
Initial test acc across nodes: mean=0.4965 ± 0.0152
Round 001: test acc mean=0.5032 ± 0.0059 | min=0.4933 max=0.5154
         : test loss mean=3.9067 ± 1.1889
         : individual accs = ['0.508642', '0.502775', '0.511145', '0.508827', '0.498104', '0.507966', '0.502021', '0.499512', '0.507066', '0.510958', '0.499233', '0.503356', '0.500836', '0.494708', '0.500140', '0.497881', '0.515394', '0.505997', '0.493299', '0.495521']
         : correct/total = [(7239, 14232), (7157, 14235), (7292, 14266), (7234, 14217), (7092, 14238), (7301, 14373), (7202, 14346), (7160, 14334), (7248, 14294), (7344, 14373), (7161, 14344), (7199, 14302), (7189, 14354), (7105, 14362), (7162, 14320), (7167, 14395), (7416, 14389), (7214, 14257), (7030, 14251), (7135, 14399)]
         : compromised: 0.5011, honest: 0.5045
Round 002: test acc mean=0.5044 ± 0.0045 | min=0.4915 max=0.5095
         : test loss mean=3.1710 ± 0.7184
         : individual accs = ['0.504497', '0.503688', '0.509533', '0.506436', '0.500773', '0.506297', '0.500767', '0.505721', '0.500630', '0.491477', '0.507181', '0.503007', '0.508221', '0.507729', '0.509427', '0.498159', '0.507262', '0.500105', '0.507333', '0.508924']
         : correct/total = [(7180, 14232), (7170, 14235), (7269, 14266), (7200, 14217), (7130, 14238), (7277, 14373), (7184, 14346), (7249, 14334), (7156, 14294), (7064, 14373), (7275, 14344), (7194, 14302), (7295, 14354), (7292, 14362), (7295, 14320), (7171, 14395), (7299, 14389), (7130, 14257), (7230, 14251), (7328, 14399)]
         : compromised: 0.5057, honest: 0.5034
Round 003: test acc mean=0.4964 ± 0.0061 | min=0.4860 max=0.5086
         : test loss mean=0.9532 ± 0.1220
         : individual accs = ['0.489109', '0.485985', '0.486962', '0.492087', '0.494171', '0.494260', '0.507807', '0.499163', '0.500909', '0.493495', '0.499024', '0.493777', '0.499512', '0.508634', '0.495950', '0.498367', '0.501008', '0.503051', '0.488738', '0.496354']
         : correct/total = [(6961, 14232), (6918, 14235), (6947, 14266), (6996, 14217), (7036, 14238), (7104, 14373), (7285, 14346), (7155, 14334), (7160, 14294), (7093, 14373), (7158, 14344), (7062, 14302), (7170, 14354), (7305, 14362), (7102, 14320), (7174, 14395), (7209, 14389), (7172, 14257), (6965, 14251), (7147, 14399)]
         : compromised: 0.4962, honest: 0.4965
Round 004: test acc mean=0.5107 ± 0.0049 | min=0.5015 max=0.5210
         : test loss mean=1.4369 ± 0.4113
         : individual accs = ['0.513491', '0.512329', '0.514370', '0.505944', '0.506672', '0.504209', '0.513802', '0.512627', '0.514552', '0.520977', '0.516313', '0.508810', '0.516929', '0.511698', '0.509777', '0.510663', '0.501981', '0.501508', '0.509719', '0.507535']
         : correct/total = [(7308, 14232), (7293, 14235), (7338, 14266), (7193, 14217), (7214, 14238), (7247, 14373), (7371, 14346), (7348, 14334), (7355, 14294), (7488, 14373), (7406, 14344), (7277, 14302), (7420, 14354), (7349, 14362), (7300, 14320), (7351, 14395), (7223, 14389), (7150, 14257), (7264, 14251), (7308, 14399)]
         : compromised: 0.5094, honest: 0.5116
Round 005: test acc mean=0.5078 ± 0.0123 | min=0.4921 max=0.5336
         : test loss mean=0.8280 ± 0.0752
         : individual accs = ['0.492903', '0.492097', '0.524394', '0.492509', '0.499227', '0.512419', '0.533598', '0.516534', '0.525885', '0.498226', '0.506414', '0.511607', '0.500070', '0.509957', '0.500628', '0.499896', '0.520745', '0.504033', '0.492597', '0.521356']
         : correct/total = [(7015, 14232), (7005, 14235), (7481, 14266), (7002, 14217), (7108, 14238), (7365, 14373), (7655, 14346), (7404, 14334), (7517, 14294), (7161, 14373), (7264, 14344), (7317, 14302), (7178, 14354), (7324, 14362), (7169, 14320), (7196, 14395), (7493, 14389), (7186, 14257), (7020, 14251), (7507, 14399)]
         : compromised: 0.5029, honest: 0.5110
Round 006: test acc mean=0.5073 ± 0.0049 | min=0.4989 max=0.5183
         : test loss mean=1.0091 ± 0.2331
         : individual accs = ['0.500070', '0.504742', '0.506028', '0.506577', '0.507937', '0.512210', '0.508713', '0.513046', '0.498881', '0.499269', '0.510736', '0.506852', '0.518253', '0.509400', '0.512640', '0.508649', '0.505456', '0.506418', '0.500456', '0.510383']
         : correct/total = [(7117, 14232), (7185, 14235), (7219, 14266), (7202, 14217), (7232, 14238), (7362, 14373), (7298, 14346), (7354, 14334), (7131, 14294), (7176, 14373), (7326, 14344), (7249, 14302), (7439, 14354), (7316, 14362), (7341, 14320), (7322, 14395), (7273, 14389), (7220, 14257), (7132, 14251), (7349, 14399)]
         : compromised: 0.5089, honest: 0.5063
Round 007: test acc mean=0.5328 ± 0.0213 | min=0.4896 max=0.5693
         : test loss mean=0.7249 ± 0.0328
         : individual accs = ['0.536959', '0.489638', '0.548998', '0.494689', '0.547900', '0.534405', '0.544542', '0.537045', '0.569260', '0.496765', '0.531651', '0.531045', '0.521179', '0.529592', '0.549651', '0.541369', '0.559316', '0.526829', '0.508526', '0.557469']
         : correct/total = [(7642, 14232), (6970, 14235), (7832, 14266), (7033, 14217), (7801, 14238), (7681, 14373), (7812, 14346), (7698, 14334), (8137, 14294), (7140, 14373), (7626, 14344), (7595, 14302), (7481, 14354), (7606, 14362), (7871, 14320), (7793, 14395), (8048, 14389), (7511, 14257), (7247, 14251), (8027, 14399)]
         : compromised: 0.5239, honest: 0.5388
Round 008: test acc mean=0.5070 ± 0.0049 | min=0.4974 max=0.5196
         : test loss mean=0.8651 ± 0.1483
         : individual accs = ['0.502811', '0.497436', '0.508342', '0.506295', '0.507796', '0.510401', '0.511920', '0.506069', '0.506646', '0.500591', '0.509690', '0.506363', '0.507524', '0.509052', '0.519623', '0.508024', '0.512058', '0.505576', '0.497719', '0.506077']
         : correct/total = [(7156, 14232), (7081, 14235), (7252, 14266), (7198, 14217), (7230, 14238), (7336, 14373), (7344, 14346), (7254, 14334), (7242, 14294), (7195, 14373), (7311, 14344), (7242, 14302), (7285, 14354), (7311, 14362), (7441, 14320), (7313, 14395), (7368, 14389), (7208, 14257), (7093, 14251), (7287, 14399)]
         : compromised: 0.5067, honest: 0.5072
Round 009: test acc mean=0.5423 ± 0.0283 | min=0.4939 max=0.5921
         : test loss mean=0.7064 ± 0.0202
         : individual accs = ['0.537240', '0.493923', '0.577527', '0.508476', '0.537084', '0.550198', '0.569845', '0.571787', '0.592067', '0.501357', '0.534091', '0.565445', '0.525707', '0.513020', '0.556355', '0.531435', '0.572034', '0.529003', '0.506210', '0.572887']
         : correct/total = [(7646, 14232), (7031, 14235), (8239, 14266), (7229, 14217), (7647, 14238), (7908, 14373), (8175, 14346), (8196, 14334), (8463, 14294), (7206, 14373), (7661, 14344), (8087, 14302), (7546, 14354), (7368, 14362), (7967, 14320), (7650, 14395), (8231, 14389), (7542, 14257), (7214, 14251), (8249, 14399)]
         : compromised: 0.5300, honest: 0.5505
Round 010: test acc mean=0.5078 ± 0.0032 | min=0.5006 max=0.5129
         : test loss mean=0.7858 ± 0.0889
         : individual accs = ['0.508713', '0.506920', '0.509393', '0.506436', '0.511378', '0.512419', '0.509201', '0.510116', '0.507905', '0.502748', '0.509900', '0.504964', '0.507315', '0.510444', '0.505587', '0.507190', '0.512892', '0.500596', '0.502351', '0.508994']
         : correct/total = [(7240, 14232), (7216, 14235), (7267, 14266), (7200, 14217), (7281, 14238), (7365, 14373), (7305, 14346), (7312, 14334), (7260, 14294), (7226, 14373), (7314, 14344), (7222, 14302), (7282, 14354), (7331, 14362), (7240, 14320), (7301, 14395), (7380, 14389), (7137, 14257), (7159, 14251), (7329, 14399)]
         : compromised: 0.5063, honest: 0.5087

=== FINAL RESULTS ===
Dataset: sent140, Nodes: 20, Graph: erdos, Aggregation: d-fedavg
Attack: directed_deviation, 40.0% compromised
Final accuracy - Compromised: 0.5063, Honest: 0.5087
Overall test accuracy: mean=0.5078 ± 0.0032
