Device: cuda
Seed: 987654321
Loading 1 LEAF Sent140 train files...
LEAF Sent140 train: 254555 users, 908652 samples
Building vocabulary (max_size=10000)...
Vocabulary size: 10000
Loading 1 LEAF Sent140 test files...
LEAF Sent140 test: 254555 users, 286281 samples
Found 254555 train users, 254555 test users, 254555 common users
User sample counts range: 494 (max) to 1 (min)
Distributed ALL 254555 users across 20 clients
Users per client: 12727 (with 15 clients getting +1 user)
Train partition sizes: [44353, 44290, 44657, 44907, 44696, 45843, 45801, 45619, 45069, 45639, 45821, 45311, 45779, 46056, 45625, 45984, 46428, 44737, 45540, 46497]
Test partition sizes: [14232, 14235, 14266, 14217, 14238, 14373, 14346, 14334, 14294, 14373, 14344, 14302, 14354, 14362, 14320, 14395, 14389, 14257, 14251, 14399]
  Client 0: 44353 train samples, 2 unique classes
  Client 1: 44290 train samples, 2 unique classes
  Client 2: 44657 train samples, 2 unique classes
  Client 3: 44907 train samples, 2 unique classes
  Client 4: 44696 train samples, 2 unique classes
  Client 5: 45843 train samples, 2 unique classes
  Client 6: 45801 train samples, 2 unique classes
  Client 7: 45619 train samples, 2 unique classes
  Client 8: 45069 train samples, 2 unique classes
  Client 9: 45639 train samples, 2 unique classes
  Client 10: 45821 train samples, 2 unique classes
  Client 11: 45311 train samples, 2 unique classes
  Client 12: 45779 train samples, 2 unique classes
  Client 13: 46056 train samples, 2 unique classes
  Client 14: 45625 train samples, 2 unique classes
  Client 15: 45984 train samples, 2 unique classes
  Client 16: 46428 train samples, 2 unique classes
  Client 17: 44737 train samples, 2 unique classes
  Client 18: 45540 train samples, 2 unique classes
  Client 19: 46497 train samples, 2 unique classes
Will sample 4500 samples per client per epoch
Graph: ring, nodes: 20, edges: 20
Degree statistics: avg=2.00, min=2, max=2
Attack: Compromised 16/20 nodes: [1, 2, 3, 5, 6, 8, 9, 10, 11, 12, 13, 14, 15, 17, 18, 19]
Attack type: directed_deviation, lambda: 1.0
Model variant: baseline
Model parameters: 1,174,986
BALANCE algorithm:
Balance Config: BALANCEConfig(gamma=2, kappa=1, alpha=0.5, min_neighbors=1)
  - Model dimension: 1,174,986 parameters
  - Complexity: O(N×d) = O(20×1,174,986)
Initial test acc across nodes: mean=0.4953 ± 0.0174
Round 001: test acc mean=0.5008 ± 0.0078 | min=0.4877 max=0.5144
         : test loss mean=4.2556 ± 2.6517
         : individual accs = ['0.506816', '0.514366', '0.489836', '0.507913', '0.503652', '0.501426', '0.501743', '0.487652', '0.514202', '0.495165', '0.503207', '0.498951', '0.504877', '0.501323', '0.512081', '0.493783', '0.501981', '0.493722', '0.493299', '0.489548']
         : correct/total = [(7213, 14232), (7322, 14235), (6988, 14266), (7221, 14217), (7171, 14238), (7207, 14373), (7198, 14346), (6990, 14334), (7350, 14294), (7117, 14373), (7218, 14344), (7136, 14302), (7247, 14354), (7200, 14362), (7333, 14320), (7108, 14395), (7223, 14389), (7039, 14257), (7030, 14251), (7049, 14399)]
         : compromised: 0.5010, honest: 0.5000
Round 002: test acc mean=0.5000 ± 0.0097 | min=0.4816 max=0.5199
         : test loss mean=2.4314 ± 1.5319
         : individual accs = ['0.508502', '0.486407', '0.507641', '0.485264', '0.498806', '0.514437', '0.487383', '0.493861', '0.499440', '0.505670', '0.505926', '0.500699', '0.502020', '0.495126', '0.504399', '0.481626', '0.509139', '0.519885', '0.497228', '0.497187']
         : correct/total = [(7237, 14232), (6924, 14235), (7242, 14266), (6899, 14217), (7102, 14238), (7394, 14373), (6992, 14346), (7079, 14334), (7139, 14294), (7268, 14373), (7257, 14344), (7161, 14302), (7206, 14354), (7111, 14362), (7223, 14320), (6933, 14395), (7326, 14389), (7412, 14257), (7086, 14251), (7159, 14399)]
         : compromised: 0.4994, honest: 0.5026
Round 003: test acc mean=0.4991 ± 0.0100 | min=0.4764 max=0.5123
         : test loss mean=1.0976 ± 0.4475
         : individual accs = ['0.476391', '0.484440', '0.492009', '0.479496', '0.504355', '0.492034', '0.511014', '0.512278', '0.501049', '0.496278', '0.502022', '0.506363', '0.507872', '0.502228', '0.506355', '0.493296', '0.497463', '0.500666', '0.511122', '0.505174']
         : correct/total = [(6780, 14232), (6896, 14235), (7019, 14266), (6817, 14217), (7181, 14238), (7072, 14373), (7331, 14346), (7343, 14334), (7162, 14294), (7133, 14373), (7201, 14344), (7242, 14302), (7290, 14354), (7213, 14362), (7251, 14320), (7101, 14395), (7158, 14389), (7138, 14257), (7284, 14251), (7274, 14399)]
         : compromised: 0.4995, honest: 0.4976
Round 004: test acc mean=0.5030 ± 0.0165 | min=0.4500 max=0.5272
         : test loss mean=0.8513 ± 0.1174
         : individual accs = ['0.501686', '0.523709', '0.520398', '0.504466', '0.506110', '0.504975', '0.501115', '0.491698', '0.499230', '0.504209', '0.507041', '0.519158', '0.527240', '0.512812', '0.487430', '0.486905', '0.497533', '0.449954', '0.497298', '0.518022']
         : correct/total = [(7140, 14232), (7455, 14235), (7424, 14266), (7172, 14217), (7206, 14238), (7258, 14373), (7189, 14346), (7048, 14334), (7136, 14294), (7247, 14373), (7273, 14344), (7425, 14302), (7568, 14354), (7365, 14362), (6980, 14320), (7009, 14395), (7159, 14389), (6415, 14257), (7087, 14251), (7459, 14399)]
         : compromised: 0.5040, honest: 0.4993
Round 005: test acc mean=0.5064 ± 0.0144 | min=0.4769 max=0.5462
         : test loss mean=0.9725 ± 0.2422
         : individual accs = ['0.507237', '0.521602', '0.495724', '0.546177', '0.495786', '0.525847', '0.496584', '0.497140', '0.476913', '0.498435', '0.509063', '0.499511', '0.514003', '0.492202', '0.513268', '0.502327', '0.501772', '0.504664', '0.509508', '0.519897']
         : correct/total = [(7219, 14232), (7425, 14235), (7072, 14266), (7765, 14217), (7059, 14238), (7558, 14373), (7124, 14346), (7126, 14334), (6817, 14294), (7164, 14373), (7302, 14344), (7144, 14302), (7378, 14354), (7069, 14362), (7350, 14320), (7231, 14395), (7220, 14389), (7195, 14257), (7261, 14251), (7486, 14399)]
         : compromised: 0.5079, honest: 0.5005
Round 006: test acc mean=0.5158 ± 0.0113 | min=0.4950 max=0.5473
         : test loss mean=0.7714 ± 0.0684
         : individual accs = ['0.518409', '0.507692', '0.526847', '0.514877', '0.523599', '0.504001', '0.507389', '0.510674', '0.547293', '0.513950', '0.510736', '0.522864', '0.520552', '0.528408', '0.522556', '0.504967', '0.508444', '0.504875', '0.522630', '0.494965']
         : correct/total = [(7378, 14232), (7227, 14235), (7516, 14266), (7320, 14217), (7455, 14238), (7244, 14373), (7279, 14346), (7320, 14334), (7823, 14294), (7387, 14373), (7326, 14344), (7478, 14302), (7472, 14354), (7589, 14362), (7483, 14320), (7269, 14395), (7316, 14389), (7198, 14257), (7448, 14251), (7127, 14399)]
         : compromised: 0.5159, honest: 0.5153
Round 007: test acc mean=0.5095 ± 0.0134 | min=0.4913 max=0.5481
         : test loss mean=0.7219 ± 0.0304
         : individual accs = ['0.505059', '0.516403', '0.500771', '0.513962', '0.499508', '0.491338', '0.499233', '0.514302', '0.548062', '0.508245', '0.529350', '0.515313', '0.511147', '0.510235', '0.493785', '0.493922', '0.507401', '0.496528', '0.508947', '0.525800']
         : correct/total = [(7188, 14232), (7351, 14235), (7144, 14266), (7307, 14217), (7112, 14238), (7062, 14373), (7162, 14346), (7372, 14334), (7834, 14294), (7305, 14373), (7593, 14344), (7370, 14302), (7337, 14354), (7328, 14362), (7071, 14320), (7110, 14395), (7301, 14389), (7079, 14257), (7253, 14251), (7571, 14399)]
         : compromised: 0.5102, honest: 0.5066
Round 008: test acc mean=0.5182 ± 0.0142 | min=0.4830 max=0.5398
         : test loss mean=0.7073 ± 0.0131
         : individual accs = ['0.517215', '0.483035', '0.515421', '0.518464', '0.529990', '0.510958', '0.497212', '0.539835', '0.491815', '0.526821', '0.511294', '0.518109', '0.526264', '0.528199', '0.516341', '0.515804', '0.523177', '0.536859', '0.535050', '0.521495']
         : correct/total = [(7361, 14232), (6876, 14235), (7353, 14266), (7371, 14217), (7546, 14238), (7344, 14373), (7133, 14346), (7738, 14334), (7030, 14294), (7572, 14373), (7334, 14344), (7410, 14302), (7554, 14354), (7586, 14362), (7394, 14320), (7425, 14395), (7528, 14389), (7654, 14257), (7625, 14251), (7509, 14399)]
         : compromised: 0.5158, honest: 0.5276
Round 009: test acc mean=0.5095 ± 0.0108 | min=0.4930 max=0.5448
         : test loss mean=0.6972 ± 0.0054
         : individual accs = ['0.504918', '0.516895', '0.492990', '0.502638', '0.500843', '0.506644', '0.523561', '0.504674', '0.507276', '0.544841', '0.511573', '0.514124', '0.508151', '0.518939', '0.502654', '0.498229', '0.513865', '0.510135', '0.504877', '0.501979']
         : correct/total = [(7186, 14232), (7358, 14235), (7033, 14266), (7146, 14217), (7131, 14238), (7282, 14373), (7511, 14346), (7234, 14334), (7251, 14294), (7831, 14373), (7338, 14344), (7353, 14302), (7294, 14354), (7453, 14362), (7198, 14320), (7172, 14395), (7394, 14389), (7273, 14257), (7195, 14251), (7228, 14399)]
         : compromised: 0.5103, honest: 0.5061
Round 010: test acc mean=0.5288 ± 0.0203 | min=0.4934 max=0.5728
         : test loss mean=0.6939 ± 0.0039
         : individual accs = ['0.546585', '0.547945', '0.517805', '0.493423', '0.523880', '0.572810', '0.499582', '0.523022', '0.498181', '0.520490', '0.534230', '0.523773', '0.530444', '0.534187', '0.537849', '0.498854', '0.558135', '0.537911', '0.545435', '0.532190']
         : correct/total = [(7779, 14232), (7800, 14235), (7387, 14266), (7015, 14217), (7459, 14238), (8233, 14373), (7167, 14346), (7497, 14334), (7121, 14294), (7481, 14373), (7663, 14344), (7491, 14302), (7614, 14354), (7672, 14362), (7702, 14320), (7181, 14395), (8031, 14389), (7669, 14257), (7773, 14251), (7663, 14399)]
         : compromised: 0.5266, honest: 0.5379

=== FINAL RESULTS ===
Dataset: sent140, Nodes: 20, Graph: ring, Aggregation: balance
Attack: directed_deviation, 80.0% compromised
Final accuracy - Compromised: 0.5266, Honest: 0.5379
Overall test accuracy: mean=0.5288 ± 0.0203

=== BALANCE SUMMARY ===
Node 0: acceptance=0.100
Node 1: acceptance=0.300
Node 2: acceptance=0.100
Node 3: acceptance=0.300
Node 4: acceptance=0.100
Node 5: acceptance=0.300
Node 6: acceptance=0.300
Node 7: acceptance=0.100
Node 8: acceptance=0.300
Node 9: acceptance=0.100
Node 10: acceptance=0.100
Node 11: acceptance=0.100
Node 12: acceptance=0.100
Node 13: acceptance=0.100
Node 14: acceptance=0.100
Node 15: acceptance=0.300
Node 16: acceptance=0.100
Node 17: acceptance=0.300
Node 18: acceptance=0.100
Node 19: acceptance=0.300

=== PARALLEL EXECUTION TIME (realistic for distributed system) ===
  COMMUNICATION (max across nodes):
    - Full model transfer: 0.000s (0.0%)
  COMPUTATION (max across nodes):
    - Filtering: 0.013s (53.9%)
    - Aggregation: 0.011s (46.0%)
  TOTALS:
    - Total computation: 0.024s (100.0%)
    - Total communication: 0.000s (0.0%)
    - Total parallel time: 0.024s

=== PER-NODE AVERAGE TIME ===
  - Filtering: 0.011s
  - Aggregation: 0.005s
  - Model transfer: 0.000s
  - Total per node: 0.016s

=== TOTAL COMPUTATIONAL WORK (sum across all nodes) ===
  - Total filtering: 0.223s
  - Total aggregation: 0.097s
  - Total model transfer: 0.000s
  - Grand total: 0.320s
  - Mean acceptance rate: 0.180

BALANCE Algorithm Properties:
  - Model dimension: 1,174,986
  - No compression: Full parameter comparison
  - Theoretical complexity: O(deg(i)×d)
  - Approach: Full parameter filtering + averaging
