Device: cuda
Seed: 987654321
Loading 1 LEAF Sent140 train files...
LEAF Sent140 train: 254555 users, 908652 samples
Building vocabulary (max_size=10000)...
Vocabulary size: 10000
Loading 1 LEAF Sent140 test files...
LEAF Sent140 test: 254555 users, 286281 samples
Found 254555 train users, 254555 test users, 254555 common users
User sample counts range: 494 (max) to 1 (min)
Distributed ALL 254555 users across 20 clients
Users per client: 12727 (with 15 clients getting +1 user)
Train partition sizes: [44353, 44290, 44657, 44907, 44696, 45843, 45801, 45619, 45069, 45639, 45821, 45311, 45779, 46056, 45625, 45984, 46428, 44737, 45540, 46497]
Test partition sizes: [14232, 14235, 14266, 14217, 14238, 14373, 14346, 14334, 14294, 14373, 14344, 14302, 14354, 14362, 14320, 14395, 14389, 14257, 14251, 14399]
  Client 0: 44353 train samples, 2 unique classes
  Client 1: 44290 train samples, 2 unique classes
  Client 2: 44657 train samples, 2 unique classes
  Client 3: 44907 train samples, 2 unique classes
  Client 4: 44696 train samples, 2 unique classes
  Client 5: 45843 train samples, 2 unique classes
  Client 6: 45801 train samples, 2 unique classes
  Client 7: 45619 train samples, 2 unique classes
  Client 8: 45069 train samples, 2 unique classes
  Client 9: 45639 train samples, 2 unique classes
  Client 10: 45821 train samples, 2 unique classes
  Client 11: 45311 train samples, 2 unique classes
  Client 12: 45779 train samples, 2 unique classes
  Client 13: 46056 train samples, 2 unique classes
  Client 14: 45625 train samples, 2 unique classes
  Client 15: 45984 train samples, 2 unique classes
  Client 16: 46428 train samples, 2 unique classes
  Client 17: 44737 train samples, 2 unique classes
  Client 18: 45540 train samples, 2 unique classes
  Client 19: 46497 train samples, 2 unique classes
Will sample 4500 samples per client per epoch
Graph: erdos, nodes: 20, edges: 126
Degree statistics: avg=12.60, min=8, max=16
Attack: Compromised 16/20 nodes: [1, 2, 3, 5, 6, 8, 9, 10, 11, 12, 13, 14, 15, 17, 18, 19]
Attack type: gaussian, lambda: 1.0
Model variant: baseline
Model parameters: 1,174,986
Sketchguard Node 0:
  Model dim: 1,174,986 → Sketch size: 180
  Compression ratio: 6527.7x
  Using model parameters for aggregation, sketches for filtering
Sketchguard Node 1:
  Model dim: 1,174,986 → Sketch size: 180
  Compression ratio: 6527.7x
  Using model parameters for aggregation, sketches for filtering
Sketchguard Node 2:
  Model dim: 1,174,986 → Sketch size: 180
  Compression ratio: 6527.7x
  Using model parameters for aggregation, sketches for filtering
Sketchguard Node 3:
  Model dim: 1,174,986 → Sketch size: 180
  Compression ratio: 6527.7x
  Using model parameters for aggregation, sketches for filtering
Sketchguard Node 4:
  Model dim: 1,174,986 → Sketch size: 180
  Compression ratio: 6527.7x
  Using model parameters for aggregation, sketches for filtering
Sketchguard Node 5:
  Model dim: 1,174,986 → Sketch size: 180
  Compression ratio: 6527.7x
  Using model parameters for aggregation, sketches for filtering
Sketchguard Node 6:
  Model dim: 1,174,986 → Sketch size: 180
  Compression ratio: 6527.7x
  Using model parameters for aggregation, sketches for filtering
Sketchguard Node 7:
  Model dim: 1,174,986 → Sketch size: 180
  Compression ratio: 6527.7x
  Using model parameters for aggregation, sketches for filtering
Sketchguard Node 8:
  Model dim: 1,174,986 → Sketch size: 180
  Compression ratio: 6527.7x
  Using model parameters for aggregation, sketches for filtering
Sketchguard Node 9:
  Model dim: 1,174,986 → Sketch size: 180
  Compression ratio: 6527.7x
  Using model parameters for aggregation, sketches for filtering
Sketchguard Node 10:
  Model dim: 1,174,986 → Sketch size: 180
  Compression ratio: 6527.7x
  Using model parameters for aggregation, sketches for filtering
Sketchguard Node 11:
  Model dim: 1,174,986 → Sketch size: 180
  Compression ratio: 6527.7x
  Using model parameters for aggregation, sketches for filtering
Sketchguard Node 12:
  Model dim: 1,174,986 → Sketch size: 180
  Compression ratio: 6527.7x
  Using model parameters for aggregation, sketches for filtering
Sketchguard Node 13:
  Model dim: 1,174,986 → Sketch size: 180
  Compression ratio: 6527.7x
  Using model parameters for aggregation, sketches for filtering
Sketchguard Node 14:
  Model dim: 1,174,986 → Sketch size: 180
  Compression ratio: 6527.7x
  Using model parameters for aggregation, sketches for filtering
Sketchguard Node 15:
  Model dim: 1,174,986 → Sketch size: 180
  Compression ratio: 6527.7x
  Using model parameters for aggregation, sketches for filtering
Sketchguard Node 16:
  Model dim: 1,174,986 → Sketch size: 180
  Compression ratio: 6527.7x
  Using model parameters for aggregation, sketches for filtering
Sketchguard Node 17:
  Model dim: 1,174,986 → Sketch size: 180
  Compression ratio: 6527.7x
  Using model parameters for aggregation, sketches for filtering
Sketchguard Node 18:
  Model dim: 1,174,986 → Sketch size: 180
  Compression ratio: 6527.7x
  Using model parameters for aggregation, sketches for filtering
Sketchguard Node 19:
  Model dim: 1,174,986 → Sketch size: 180
  Compression ratio: 6527.7x
  Using model parameters for aggregation, sketches for filtering
Sketchguard ALGORITHM (Sketch-based Filtering + State Aggregation)
  - Model dimension: 1,174,986 parameters
  - Config: SketchguardConfig(gamma=2, kappa=1, alpha=0.5, min_neighbors=1, sketch_size=180, network_seed=987654321, attack_detection_window=5)
  - Sketch size: 180
  - Compression ratio: 6527.7x
  - Complexity: O(d + N×k) = O(1,174,986 + 20×180)
  - Theoretical speedup vs BALANCE: 19.9x
Initial test acc across nodes: mean=0.4953 ± 0.0174
Round 001: test acc mean=0.5603 ± 0.0302 | min=0.5125 max=0.6081
         : test loss mean=0.6898 ± 0.0009
         : individual accs = ['0.608137', '0.561925', '0.524183', '0.555954', '0.605422', '0.549781', '0.567754', '0.599065', '0.521058', '0.600849', '0.512479', '0.526080', '0.593214', '0.563083', '0.521508', '0.563876', '0.540760', '0.568142', '0.536804', '0.585666']
         : correct/total = [(8655, 14232), (7999, 14235), (7478, 14266), (7904, 14217), (8620, 14238), (7902, 14373), (8145, 14346), (8587, 14334), (7448, 14294), (8636, 14373), (7351, 14344), (7524, 14302), (8515, 14354), (8087, 14362), (7468, 14320), (8117, 14395), (7781, 14389), (8100, 14257), (7650, 14251), (8433, 14399)]
         : compromised: 0.5533, honest: 0.5883
         : sketchguard stats = ['Node 0: acc_rate=0.188', 'Node 1: acc_rate=0.364', 'Node 2: acc_rate=0.250']...
Round 002: test acc mean=0.5972 ± 0.0267 | min=0.5233 max=0.6388
         : test loss mean=0.6824 ± 0.0074
         : individual accs = ['0.619660', '0.569512', '0.564769', '0.618837', '0.609987', '0.625965', '0.615991', '0.638831', '0.584931', '0.621373', '0.611545', '0.616208', '0.599902', '0.608133', '0.523254', '0.598194', '0.576621', '0.586659', '0.586625', '0.567539']
         : correct/total = [(8819, 14232), (8107, 14235), (8057, 14266), (8798, 14217), (8685, 14238), (8997, 14373), (8837, 14346), (9157, 14334), (8361, 14294), (8931, 14373), (8772, 14344), (8813, 14302), (8611, 14354), (8734, 14362), (7493, 14320), (8611, 14395), (8297, 14389), (8364, 14257), (8360, 14251), (8172, 14399)]
         : compromised: 0.5937, honest: 0.6113
         : sketchguard stats = ['Node 0: acc_rate=0.188', 'Node 1: acc_rate=0.364', 'Node 2: acc_rate=0.250']...
Round 003: test acc mean=0.6242 ± 0.0174 | min=0.5796 max=0.6441
         : test loss mean=0.6591 ± 0.0092
         : individual accs = ['0.625632', '0.624728', '0.626875', '0.618555', '0.644051', '0.638558', '0.629513', '0.634017', '0.642927', '0.634453', '0.592443', '0.637743', '0.631183', '0.623033', '0.617249', '0.579576', '0.641601', '0.625587', '0.626903', '0.588721']
         : correct/total = [(8904, 14232), (8893, 14235), (8943, 14266), (8794, 14217), (9170, 14238), (9178, 14373), (9031, 14346), (9088, 14334), (9190, 14294), (9119, 14373), (8498, 14344), (9121, 14302), (9060, 14354), (8948, 14362), (8839, 14320), (8343, 14395), (9232, 14389), (8919, 14257), (8934, 14251), (8477, 14399)]
         : compromised: 0.6211, honest: 0.6363
         : sketchguard stats = ['Node 0: acc_rate=0.188', 'Node 1: acc_rate=0.364', 'Node 2: acc_rate=0.250']...
Round 004: test acc mean=0.6378 ± 0.0078 | min=0.6186 max=0.6519
         : test loss mean=0.6417 ± 0.0050
         : individual accs = ['0.637507', '0.625290', '0.633114', '0.637265', '0.636325', '0.651917', '0.640457', '0.638482', '0.644326', '0.646142', '0.633017', '0.627185', '0.645325', '0.633965', '0.618645', '0.635568', '0.645563', '0.640598', '0.638903', '0.646087']
         : correct/total = [(9073, 14232), (8901, 14235), (9032, 14266), (9060, 14217), (9060, 14238), (9370, 14373), (9188, 14346), (9152, 14334), (9210, 14294), (9287, 14373), (9080, 14344), (8970, 14302), (9263, 14354), (9105, 14362), (8859, 14320), (9149, 14395), (9289, 14389), (9133, 14257), (9105, 14251), (9303, 14399)]
         : compromised: 0.6374, honest: 0.6395
         : sketchguard stats = ['Node 0: acc_rate=0.188', 'Node 1: acc_rate=0.364', 'Node 2: acc_rate=0.250']...
Round 005: test acc mean=0.6458 ± 0.0042 | min=0.6379 max=0.6533
         : test loss mean=0.6319 ± 0.0033
         : individual accs = ['0.646501', '0.650228', '0.644539', '0.641064', '0.651707', '0.645307', '0.641573', '0.647691', '0.651042', '0.647881', '0.641313', '0.647322', '0.653337', '0.641902', '0.640433', '0.637860', '0.649663', '0.647612', '0.641639', '0.647337']
         : correct/total = [(9201, 14232), (9256, 14235), (9195, 14266), (9114, 14217), (9279, 14238), (9275, 14373), (9204, 14346), (9284, 14334), (9306, 14294), (9312, 14373), (9199, 14344), (9258, 14302), (9378, 14354), (9219, 14362), (9171, 14320), (9182, 14395), (9348, 14389), (9233, 14257), (9144, 14251), (9321, 14399)]
         : compromised: 0.6450, honest: 0.6489
         : sketchguard stats = ['Node 0: acc_rate=0.188', 'Node 1: acc_rate=0.364', 'Node 2: acc_rate=0.250']...
Round 006: test acc mean=0.6477 ± 0.0052 | min=0.6384 max=0.6574
         : test loss mean=0.6283 ± 0.0038
         : individual accs = ['0.639193', '0.654514', '0.646853', '0.644791', '0.650091', '0.655256', '0.646034', '0.652016', '0.645096', '0.646281', '0.650307', '0.649560', '0.657378', '0.641206', '0.647416', '0.638416', '0.640420', '0.651750', '0.646691', '0.651156']
         : correct/total = [(9097, 14232), (9317, 14235), (9228, 14266), (9167, 14217), (9256, 14238), (9418, 14373), (9268, 14346), (9346, 14334), (9221, 14294), (9289, 14373), (9328, 14344), (9290, 14302), (9436, 14354), (9209, 14362), (9271, 14320), (9190, 14395), (9215, 14389), (9292, 14257), (9216, 14251), (9376, 14399)]
         : compromised: 0.6483, honest: 0.6454
         : sketchguard stats = ['Node 0: acc_rate=0.188', 'Node 1: acc_rate=0.364', 'Node 2: acc_rate=0.250']...
Round 007: test acc mean=0.6545 ± 0.0049 | min=0.6435 max=0.6629
         : test loss mean=0.6224 ± 0.0037
         : individual accs = ['0.653246', '0.657885', '0.646572', '0.652036', '0.660486', '0.662910', '0.649031', '0.658993', '0.656289', '0.651569', '0.651840', '0.652776', '0.659677', '0.651511', '0.651885', '0.653213', '0.658420', '0.657291', '0.643464', '0.660115']
         : correct/total = [(9297, 14232), (9365, 14235), (9224, 14266), (9270, 14217), (9404, 14238), (9528, 14373), (9311, 14346), (9446, 14334), (9381, 14294), (9365, 14373), (9350, 14344), (9336, 14302), (9469, 14354), (9357, 14362), (9335, 14320), (9403, 14395), (9474, 14389), (9371, 14257), (9170, 14251), (9505, 14399)]
         : compromised: 0.6536, honest: 0.6578
         : sketchguard stats = ['Node 0: acc_rate=0.188', 'Node 1: acc_rate=0.364', 'Node 2: acc_rate=0.250']...
Round 008: test acc mean=0.6561 ± 0.0063 | min=0.6388 max=0.6686
         : test loss mean=0.6205 ± 0.0047
         : individual accs = ['0.653246', '0.656270', '0.649446', '0.652107', '0.653533', '0.668615', '0.655583', '0.659760', '0.662446', '0.653169', '0.658254', '0.654034', '0.665598', '0.653321', '0.651816', '0.657589', '0.654597', '0.661710', '0.638762', '0.661713']
         : correct/total = [(9297, 14232), (9342, 14235), (9265, 14266), (9271, 14217), (9305, 14238), (9610, 14373), (9405, 14346), (9457, 14334), (9469, 14294), (9388, 14373), (9442, 14344), (9354, 14302), (9554, 14354), (9383, 14362), (9334, 14320), (9466, 14395), (9419, 14389), (9434, 14257), (9103, 14251), (9528, 14399)]
         : compromised: 0.6563, honest: 0.6553
         : sketchguard stats = ['Node 0: acc_rate=0.188', 'Node 1: acc_rate=0.364', 'Node 2: acc_rate=0.250']...
Round 009: test acc mean=0.6567 ± 0.0076 | min=0.6352 max=0.6725
         : test loss mean=0.6190 ± 0.0051
         : individual accs = ['0.647274', '0.658166', '0.652320', '0.651333', '0.661610', '0.672511', '0.635160', '0.657876', '0.662096', '0.650317', '0.657906', '0.654314', '0.665320', '0.659170', '0.653980', '0.659951', '0.665091', '0.659395', '0.657638', '0.653309']
         : correct/total = [(9212, 14232), (9369, 14235), (9306, 14266), (9260, 14217), (9420, 14238), (9666, 14373), (9112, 14346), (9430, 14334), (9464, 14294), (9347, 14373), (9437, 14344), (9358, 14302), (9550, 14354), (9467, 14362), (9365, 14320), (9500, 14395), (9570, 14389), (9401, 14257), (9372, 14251), (9407, 14399)]
         : compromised: 0.6564, honest: 0.6580
         : sketchguard stats = ['Node 0: acc_rate=0.188', 'Node 1: acc_rate=0.364', 'Node 2: acc_rate=0.250']...
Round 010: test acc mean=0.6645 ± 0.0044 | min=0.6569 max=0.6751
         : test loss mean=0.6124 ± 0.0029
         : individual accs = ['0.666105', '0.669687', '0.656947', '0.661321', '0.667720', '0.675085', '0.662066', '0.668341', '0.663285', '0.662075', '0.664389', '0.658579', '0.669639', '0.661607', '0.657682', '0.663842', '0.663423', '0.667391', '0.661778', '0.668241']
         : correct/total = [(9480, 14232), (9533, 14235), (9372, 14266), (9402, 14217), (9507, 14238), (9703, 14373), (9498, 14346), (9580, 14334), (9481, 14294), (9516, 14373), (9530, 14344), (9419, 14302), (9612, 14354), (9502, 14362), (9418, 14320), (9556, 14395), (9546, 14389), (9515, 14257), (9431, 14251), (9622, 14399)]
         : compromised: 0.6640, honest: 0.6664
         : sketchguard stats = ['Node 0: acc_rate=0.188', 'Node 1: acc_rate=0.364', 'Node 2: acc_rate=0.250']...

=== FINAL RESULTS ===
Dataset: sent140, Nodes: 20, Graph: erdos, Aggregation: sketchguard
Attack: gaussian, 80.0% compromised
Final accuracy - Compromised: 0.6640, Honest: 0.6664
Overall test accuracy: mean=0.6645 ± 0.0044

=== Sketchguard SUMMARY ===
Node 0: acceptance=0.188
Node 1: acceptance=0.364
Node 2: acceptance=0.250
Node 3: acceptance=0.125
Node 4: acceptance=0.273
Node 5: acceptance=0.133
Node 6: acceptance=0.143
Node 7: acceptance=0.143
Node 8: acceptance=0.200
Node 9: acceptance=0.308
Node 10: acceptance=0.222
Node 11: acceptance=0.214
Node 12: acceptance=0.250
Node 13: acceptance=0.231
Node 14: acceptance=0.200
Node 15: acceptance=0.182
Node 16: acceptance=0.154
Node 17: acceptance=0.333
Node 18: acceptance=0.250
Node 19: acceptance=0.188

=== PARALLEL EXECUTION TIME (realistic for distributed system) ===
  COMMUNICATION (max across nodes):
    - Sketch transfer: 0.000s (0.0%)
    - Model fetch (accepted): 0.000s (0.0%)
  COMPUTATION (max across nodes):
    - Sketching: 0.280s (95.6%)
    - Filtering: 0.001s (0.4%)
    - Aggregation: 0.012s (4.0%)
  TOTALS:
    - Total computation: 0.293s (100.0%)
    - Total communication: 0.000s (0.0%)
    - Total parallel time: 0.293s

=== PER-NODE AVERAGE TIME ===
  - Sketching: 0.218s
  - Filtering: 0.001s
  - Aggregation: 0.008s
  - Sketch transfer: 0.000s
  - Model fetch: 0.000s
  - Total per node: 0.227s

=== TOTAL COMPUTATIONAL WORK (sum across all nodes) ===
  - Total sketching: 4.360s
  - Total filtering: 0.012s
  - Total aggregation: 0.165s
  - Total sketch transfer: 0.000s
  - Total model fetch: 0.000s
  - Grand total: 4.538s
  - Mean acceptance rate: 0.217

Sketchguard Algorithm Properties:
  - Original dimension: 1,174,986
  - Sketch size: 180
  - Compression ratio: 19.9x
  - Single repetition: No repetitions needed
  - Theoretical complexity: O(d + N×k)
  - Approach: Sketch filtering + state aggregation
