Device: cuda
Seed: 987654321
Loading 1 LEAF Sent140 train files...
LEAF Sent140 train: 254555 users, 908652 samples
Building vocabulary (max_size=10000)...
Vocabulary size: 10000
Loading 1 LEAF Sent140 test files...
LEAF Sent140 test: 254555 users, 286281 samples
Found 254555 train users, 254555 test users, 254555 common users
User sample counts range: 494 (max) to 1 (min)
Distributed ALL 254555 users across 20 clients
Users per client: 12727 (with 15 clients getting +1 user)
Train partition sizes: [44353, 44290, 44657, 44907, 44696, 45843, 45801, 45619, 45069, 45639, 45821, 45311, 45779, 46056, 45625, 45984, 46428, 44737, 45540, 46497]
Test partition sizes: [14232, 14235, 14266, 14217, 14238, 14373, 14346, 14334, 14294, 14373, 14344, 14302, 14354, 14362, 14320, 14395, 14389, 14257, 14251, 14399]
  Client 0: 44353 train samples, 2 unique classes
  Client 1: 44290 train samples, 2 unique classes
  Client 2: 44657 train samples, 2 unique classes
  Client 3: 44907 train samples, 2 unique classes
  Client 4: 44696 train samples, 2 unique classes
  Client 5: 45843 train samples, 2 unique classes
  Client 6: 45801 train samples, 2 unique classes
  Client 7: 45619 train samples, 2 unique classes
  Client 8: 45069 train samples, 2 unique classes
  Client 9: 45639 train samples, 2 unique classes
  Client 10: 45821 train samples, 2 unique classes
  Client 11: 45311 train samples, 2 unique classes
  Client 12: 45779 train samples, 2 unique classes
  Client 13: 46056 train samples, 2 unique classes
  Client 14: 45625 train samples, 2 unique classes
  Client 15: 45984 train samples, 2 unique classes
  Client 16: 46428 train samples, 2 unique classes
  Client 17: 44737 train samples, 2 unique classes
  Client 18: 45540 train samples, 2 unique classes
  Client 19: 46497 train samples, 2 unique classes
Will sample 4500 samples per client per epoch
Graph: erdos, nodes: 20, edges: 99
Degree statistics: avg=9.90, min=7, max=14
Attack: Compromised 14/20 nodes: [1, 2, 3, 5, 6, 8, 11, 12, 13, 14, 15, 17, 18, 19]
Attack type: krum, lambda: 1.0
Model variant: baseline
Model parameters: 1,174,986
Sketchguard Node 0:
  Model dim: 1,174,986 → Sketch size: 180
  Compression ratio: 6527.7x
  Using model parameters for aggregation, sketches for filtering
Sketchguard Node 1:
  Model dim: 1,174,986 → Sketch size: 180
  Compression ratio: 6527.7x
  Using model parameters for aggregation, sketches for filtering
Sketchguard Node 2:
  Model dim: 1,174,986 → Sketch size: 180
  Compression ratio: 6527.7x
  Using model parameters for aggregation, sketches for filtering
Sketchguard Node 3:
  Model dim: 1,174,986 → Sketch size: 180
  Compression ratio: 6527.7x
  Using model parameters for aggregation, sketches for filtering
Sketchguard Node 4:
  Model dim: 1,174,986 → Sketch size: 180
  Compression ratio: 6527.7x
  Using model parameters for aggregation, sketches for filtering
Sketchguard Node 5:
  Model dim: 1,174,986 → Sketch size: 180
  Compression ratio: 6527.7x
  Using model parameters for aggregation, sketches for filtering
Sketchguard Node 6:
  Model dim: 1,174,986 → Sketch size: 180
  Compression ratio: 6527.7x
  Using model parameters for aggregation, sketches for filtering
Sketchguard Node 7:
  Model dim: 1,174,986 → Sketch size: 180
  Compression ratio: 6527.7x
  Using model parameters for aggregation, sketches for filtering
Sketchguard Node 8:
  Model dim: 1,174,986 → Sketch size: 180
  Compression ratio: 6527.7x
  Using model parameters for aggregation, sketches for filtering
Sketchguard Node 9:
  Model dim: 1,174,986 → Sketch size: 180
  Compression ratio: 6527.7x
  Using model parameters for aggregation, sketches for filtering
Sketchguard Node 10:
  Model dim: 1,174,986 → Sketch size: 180
  Compression ratio: 6527.7x
  Using model parameters for aggregation, sketches for filtering
Sketchguard Node 11:
  Model dim: 1,174,986 → Sketch size: 180
  Compression ratio: 6527.7x
  Using model parameters for aggregation, sketches for filtering
Sketchguard Node 12:
  Model dim: 1,174,986 → Sketch size: 180
  Compression ratio: 6527.7x
  Using model parameters for aggregation, sketches for filtering
Sketchguard Node 13:
  Model dim: 1,174,986 → Sketch size: 180
  Compression ratio: 6527.7x
  Using model parameters for aggregation, sketches for filtering
Sketchguard Node 14:
  Model dim: 1,174,986 → Sketch size: 180
  Compression ratio: 6527.7x
  Using model parameters for aggregation, sketches for filtering
Sketchguard Node 15:
  Model dim: 1,174,986 → Sketch size: 180
  Compression ratio: 6527.7x
  Using model parameters for aggregation, sketches for filtering
Sketchguard Node 16:
  Model dim: 1,174,986 → Sketch size: 180
  Compression ratio: 6527.7x
  Using model parameters for aggregation, sketches for filtering
Sketchguard Node 17:
  Model dim: 1,174,986 → Sketch size: 180
  Compression ratio: 6527.7x
  Using model parameters for aggregation, sketches for filtering
Sketchguard Node 18:
  Model dim: 1,174,986 → Sketch size: 180
  Compression ratio: 6527.7x
  Using model parameters for aggregation, sketches for filtering
Sketchguard Node 19:
  Model dim: 1,174,986 → Sketch size: 180
  Compression ratio: 6527.7x
  Using model parameters for aggregation, sketches for filtering
Sketchguard ALGORITHM (Sketch-based Filtering + State Aggregation)
  - Model dimension: 1,174,986 parameters
  - Config: SketchguardConfig(gamma=2, kappa=1, alpha=0.5, min_neighbors=1, sketch_size=180, network_seed=987654321, attack_detection_window=5)
  - Sketch size: 180
  - Compression ratio: 6527.7x
  - Complexity: O(d + N×k) = O(1,174,986 + 20×180)
  - Theoretical speedup vs BALANCE: 19.9x
Initial test acc across nodes: mean=0.4965 ± 0.0152
Round 001: test acc mean=0.5002 ± 0.0088 | min=0.4847 max=0.5202
         : test loss mean=0.8470 ± 0.1276
         : individual accs = ['0.501616', '0.504531', '0.503855', '0.493142', '0.484689', '0.497530', '0.498745', '0.520232', '0.507556', '0.492382', '0.504601', '0.502237', '0.486554', '0.501184', '0.488268', '0.518027', '0.501842', '0.495897', '0.499544', '0.501007']
         : correct/total = [(7139, 14232), (7182, 14235), (7188, 14266), (7011, 14217), (6901, 14238), (7151, 14373), (7155, 14346), (7457, 14334), (7255, 14294), (7077, 14373), (7238, 14344), (7183, 14302), (6984, 14354), (7198, 14362), (6992, 14320), (7457, 14395), (7221, 14389), (7070, 14257), (7119, 14251), (7214, 14399)]
         : compromised: 0.4999, honest: 0.5009
         : sketchguard stats = ['Node 0: acc_rate=1.000', 'Node 1: acc_rate=1.000', 'Node 2: acc_rate=1.000']...
Round 002: test acc mean=0.5134 ± 0.0155 | min=0.4805 max=0.5399
         : test loss mean=0.9527 ± 0.6904
         : individual accs = ['0.514966', '0.535441', '0.538413', '0.507561', '0.509411', '0.503722', '0.504879', '0.521487', '0.514691', '0.506366', '0.501185', '0.512935', '0.500906', '0.480504', '0.536383', '0.493574', '0.502745', '0.539945', '0.513157', '0.529273']
         : correct/total = [(7329, 14232), (7622, 14235), (7681, 14266), (7216, 14217), (7253, 14238), (7240, 14373), (7243, 14346), (7475, 14334), (7357, 14294), (7278, 14373), (7189, 14344), (7336, 14302), (7190, 14354), (6901, 14362), (7681, 14320), (7105, 14395), (7234, 14389), (7698, 14257), (7313, 14251), (7621, 14399)]
         : compromised: 0.5151, honest: 0.5094
         : sketchguard stats = ['Node 0: acc_rate=0.708', 'Node 1: acc_rate=0.700', 'Node 2: acc_rate=0.688']...
Round 003: test acc mean=0.5184 ± 0.0213 | min=0.4878 max=0.5780
         : test loss mean=0.6955 ± 0.0083
         : individual accs = ['0.557476', '0.523077', '0.513879', '0.518886', '0.517488', '0.517498', '0.505646', '0.500767', '0.516790', '0.577959', '0.498745', '0.508321', '0.522084', '0.487815', '0.527723', '0.521431', '0.548544', '0.493652', '0.510841', '0.498715']
         : correct/total = [(7934, 14232), (7446, 14235), (7331, 14266), (7377, 14217), (7368, 14238), (7438, 14373), (7254, 14346), (7178, 14334), (7387, 14294), (8307, 14373), (7154, 14344), (7270, 14302), (7494, 14354), (7006, 14362), (7557, 14320), (7506, 14395), (7893, 14389), (7038, 14257), (7280, 14251), (7181, 14399)]
         : compromised: 0.5119, honest: 0.5335
         : sketchguard stats = ['Node 0: acc_rate=0.583', 'Node 1: acc_rate=0.600', 'Node 2: acc_rate=0.583']...
Round 004: test acc mean=0.5529 ± 0.0215 | min=0.5114 max=0.5908
         : test loss mean=0.6850 ± 0.0055
         : individual accs = ['0.580593', '0.545135', '0.561335', '0.534009', '0.572412', '0.528700', '0.558344', '0.559788', '0.575626', '0.590830', '0.536113', '0.556985', '0.531977', '0.557722', '0.552793', '0.516777', '0.584891', '0.541418', '0.511403', '0.561289']
         : correct/total = [(8263, 14232), (7760, 14235), (8008, 14266), (7592, 14217), (8150, 14238), (7599, 14373), (8010, 14346), (8024, 14334), (8228, 14294), (8492, 14373), (7690, 14344), (7966, 14302), (7636, 14354), (8010, 14362), (7916, 14320), (7439, 14395), (8416, 14389), (7719, 14257), (7288, 14251), (8082, 14399)]
         : compromised: 0.5453, honest: 0.5708
         : sketchguard stats = ['Node 0: acc_rate=0.521', 'Node 1: acc_rate=0.550', 'Node 2: acc_rate=0.531']...
Round 005: test acc mean=0.5894 ± 0.0116 | min=0.5620 max=0.6051
         : test loss mean=0.6706 ± 0.0054
         : individual accs = ['0.597316', '0.587636', '0.585448', '0.579588', '0.600014', '0.562026', '0.598773', '0.599274', '0.577795', '0.605093', '0.590630', '0.592644', '0.567159', '0.601239', '0.583031', '0.602223', '0.601293', '0.587220', '0.580170', '0.588444']
         : correct/total = [(8501, 14232), (8365, 14235), (8352, 14266), (8240, 14217), (8543, 14238), (8078, 14373), (8590, 14346), (8590, 14334), (8259, 14294), (8697, 14373), (8472, 14344), (8476, 14302), (8141, 14354), (8635, 14362), (8349, 14320), (8669, 14395), (8652, 14389), (8372, 14257), (8268, 14251), (8473, 14399)]
         : compromised: 0.5852, honest: 0.5989
         : sketchguard stats = ['Node 0: acc_rate=0.483', 'Node 1: acc_rate=0.520', 'Node 2: acc_rate=0.500']...
Round 006: test acc mean=0.6078 ± 0.0058 | min=0.5977 max=0.6214
         : test loss mean=0.6575 ± 0.0033
         : individual accs = ['0.607856', '0.621356', '0.612505', '0.597735', '0.612586', '0.610728', '0.609787', '0.606669', '0.599762', '0.614625', '0.609663', '0.612012', '0.601156', '0.613285', '0.603142', '0.605280', '0.604907', '0.605527', '0.608028', '0.599069']
         : correct/total = [(8651, 14232), (8845, 14235), (8738, 14266), (8498, 14217), (8722, 14238), (8778, 14373), (8748, 14346), (8696, 14334), (8573, 14294), (8834, 14373), (8745, 14344), (8753, 14302), (8629, 14354), (8808, 14362), (8637, 14320), (8713, 14395), (8704, 14389), (8633, 14257), (8665, 14251), (8626, 14399)]
         : compromised: 0.6071, honest: 0.6094
         : sketchguard stats = ['Node 0: acc_rate=0.458', 'Node 1: acc_rate=0.500', 'Node 2: acc_rate=0.479']...
Round 007: test acc mean=0.6174 ± 0.0036 | min=0.6105 max=0.6242
         : test loss mean=0.6501 ± 0.0023
         : individual accs = ['0.617130', '0.621426', '0.618113', '0.610466', '0.616800', '0.619425', '0.619406', '0.613297', '0.611585', '0.624226', '0.613218', '0.616697', '0.618295', '0.619900', '0.620740', '0.622855', '0.618181', '0.617942', '0.615816', '0.613445']
         : correct/total = [(8783, 14232), (8846, 14235), (8818, 14266), (8679, 14217), (8782, 14238), (8903, 14373), (8886, 14346), (8791, 14334), (8742, 14294), (8972, 14373), (8796, 14344), (8820, 14302), (8875, 14354), (8903, 14362), (8889, 14320), (8966, 14395), (8895, 14389), (8810, 14257), (8776, 14251), (8833, 14399)]
         : compromised: 0.6176, honest: 0.6171
         : sketchguard stats = ['Node 0: acc_rate=0.440', 'Node 1: acc_rate=0.486', 'Node 2: acc_rate=0.464']...
Round 008: test acc mean=0.6221 ± 0.0032 | min=0.6161 max=0.6290
         : test loss mean=0.6465 ± 0.0022
         : individual accs = ['0.621417', '0.625992', '0.621057', '0.619751', '0.622349', '0.619843', '0.621776', '0.619646', '0.617742', '0.622417', '0.624373', '0.616068', '0.627909', '0.620457', '0.621159', '0.628968', '0.619848', '0.626078', '0.623956', '0.621432']
         : correct/total = [(8844, 14232), (8911, 14235), (8860, 14266), (8811, 14217), (8861, 14238), (8909, 14373), (8920, 14346), (8882, 14334), (8830, 14294), (8946, 14373), (8956, 14344), (8811, 14302), (9013, 14354), (8911, 14362), (8895, 14320), (9054, 14395), (8919, 14389), (8926, 14257), (8892, 14251), (8948, 14399)]
         : compromised: 0.6223, honest: 0.6217
         : sketchguard stats = ['Node 0: acc_rate=0.427', 'Node 1: acc_rate=0.475', 'Node 2: acc_rate=0.453']...
Round 009: test acc mean=0.6284 ± 0.0044 | min=0.6198 max=0.6377
         : test loss mean=0.6415 ± 0.0025
         : individual accs = ['0.626686', '0.637724', '0.626735', '0.622143', '0.630917', '0.630627', '0.629792', '0.625855', '0.619771', '0.629583', '0.630647', '0.627814', '0.632576', '0.625749', '0.622556', '0.636263', '0.628258', '0.630988', '0.630342', '0.623793']
         : correct/total = [(8919, 14232), (9078, 14235), (8941, 14266), (8845, 14217), (8983, 14238), (9064, 14373), (9035, 14346), (8971, 14334), (8859, 14294), (9049, 14373), (9046, 14344), (8979, 14302), (9080, 14354), (8987, 14362), (8915, 14320), (9159, 14395), (9040, 14389), (8996, 14257), (8983, 14251), (8982, 14399)]
         : compromised: 0.6283, honest: 0.6287
         : sketchguard stats = ['Node 0: acc_rate=0.417', 'Node 1: acc_rate=0.467', 'Node 2: acc_rate=0.444']...
Round 010: test acc mean=0.6331 ± 0.0042 | min=0.6243 max=0.6424
         : test loss mean=0.6378 ± 0.0023
         : individual accs = ['0.630270', '0.642431', '0.628417', '0.632623', '0.635412', '0.633410', '0.632859', '0.632761', '0.624318', '0.635497', '0.634969', '0.629213', '0.639891', '0.628464', '0.632542', '0.640639', '0.630968', '0.632672', '0.633850', '0.630530']
         : correct/total = [(8970, 14232), (9145, 14235), (8965, 14266), (8994, 14217), (9047, 14238), (9104, 14373), (9079, 14346), (9070, 14334), (8924, 14294), (9134, 14373), (9108, 14344), (8999, 14302), (9185, 14354), (9026, 14362), (9058, 14320), (9222, 14395), (9079, 14389), (9020, 14257), (9033, 14251), (9079, 14399)]
         : compromised: 0.6330, honest: 0.6333
         : sketchguard stats = ['Node 0: acc_rate=0.408', 'Node 1: acc_rate=0.460', 'Node 2: acc_rate=0.438']...

=== FINAL RESULTS ===
Dataset: sent140, Nodes: 20, Graph: erdos, Aggregation: sketchguard
Attack: krum, 70.0% compromised
Final accuracy - Compromised: 0.6330, Honest: 0.6333
Overall test accuracy: mean=0.6331 ± 0.0042

=== Sketchguard SUMMARY ===
Node 0: acceptance=0.408
Node 1: acceptance=0.460
Node 2: acceptance=0.438
Node 3: acceptance=0.514
Node 4: acceptance=0.411
Node 5: acceptance=0.280
Node 6: acceptance=0.325
Node 7: acceptance=0.345
Node 8: acceptance=0.214
Node 9: acceptance=0.436
Node 10: acceptance=0.375
Node 11: acceptance=0.325
Node 12: acceptance=0.442
Node 13: acceptance=0.200
Node 14: acceptance=0.343
Node 15: acceptance=0.400
Node 16: acceptance=0.371
Node 17: acceptance=0.550
Node 18: acceptance=0.325
Node 19: acceptance=0.270

=== PARALLEL EXECUTION TIME (realistic for distributed system) ===
  COMMUNICATION (max across nodes):
    - Sketch transfer: 0.000s (0.0%)
    - Model fetch (accepted): 0.000s (0.0%)
  COMPUTATION (max across nodes):
    - Sketching: 0.305s (95.3%)
    - Filtering: 0.001s (0.3%)
    - Aggregation: 0.014s (4.4%)
  TOTALS:
    - Total computation: 0.320s (100.0%)
    - Total communication: 0.000s (0.0%)
    - Total parallel time: 0.320s

=== PER-NODE AVERAGE TIME ===
  - Sketching: 0.243s
  - Filtering: 0.001s
  - Aggregation: 0.010s
  - Sketch transfer: 0.000s
  - Model fetch: 0.000s
  - Total per node: 0.253s

=== TOTAL COMPUTATIONAL WORK (sum across all nodes) ===
  - Total sketching: 4.855s
  - Total filtering: 0.012s
  - Total aggregation: 0.197s
  - Total sketch transfer: 0.000s
  - Total model fetch: 0.000s
  - Grand total: 5.063s
  - Mean acceptance rate: 0.372

Sketchguard Algorithm Properties:
  - Original dimension: 1,174,986
  - Sketch size: 180
  - Compression ratio: 19.9x
  - Single repetition: No repetitions needed
  - Theoretical complexity: O(d + N×k)
  - Approach: Sketch filtering + state aggregation
