Device: cuda
Seed: 987654321
Loading 1 LEAF Sent140 train files...
LEAF Sent140 train: 254555 users, 908652 samples
Building vocabulary (max_size=10000)...
Vocabulary size: 10000
Loading 1 LEAF Sent140 test files...
LEAF Sent140 test: 254555 users, 286281 samples
Found 254555 train users, 254555 test users, 254555 common users
User sample counts range: 494 (max) to 1 (min)
Distributed ALL 254555 users across 20 clients
Users per client: 12727 (with 15 clients getting +1 user)
Train partition sizes: [44353, 44290, 44657, 44907, 44696, 45843, 45801, 45619, 45069, 45639, 45821, 45311, 45779, 46056, 45625, 45984, 46428, 44737, 45540, 46497]
Test partition sizes: [14232, 14235, 14266, 14217, 14238, 14373, 14346, 14334, 14294, 14373, 14344, 14302, 14354, 14362, 14320, 14395, 14389, 14257, 14251, 14399]
  Client 0: 44353 train samples, 2 unique classes
  Client 1: 44290 train samples, 2 unique classes
  Client 2: 44657 train samples, 2 unique classes
  Client 3: 44907 train samples, 2 unique classes
  Client 4: 44696 train samples, 2 unique classes
  Client 5: 45843 train samples, 2 unique classes
  Client 6: 45801 train samples, 2 unique classes
  Client 7: 45619 train samples, 2 unique classes
  Client 8: 45069 train samples, 2 unique classes
  Client 9: 45639 train samples, 2 unique classes
  Client 10: 45821 train samples, 2 unique classes
  Client 11: 45311 train samples, 2 unique classes
  Client 12: 45779 train samples, 2 unique classes
  Client 13: 46056 train samples, 2 unique classes
  Client 14: 45625 train samples, 2 unique classes
  Client 15: 45984 train samples, 2 unique classes
  Client 16: 46428 train samples, 2 unique classes
  Client 17: 44737 train samples, 2 unique classes
  Client 18: 45540 train samples, 2 unique classes
  Client 19: 46497 train samples, 2 unique classes
Will sample 4500 samples per client per epoch
Graph: ring, nodes: 20, edges: 20
Degree statistics: avg=2.00, min=2, max=2
Attack: Compromised 16/20 nodes: [1, 2, 3, 5, 6, 8, 9, 10, 11, 12, 13, 14, 15, 17, 18, 19]
Attack type: krum, lambda: 1.0
Model variant: baseline
Model parameters: 1,174,986
UBAR ALGORITHM (Two-Stage Byzantine-resilient)
  - Model dimension: 1,174,986 parameters
  - Rho parameter: 0.19999999999999996
  - Stage 1: Distance-based filtering (select 20% closest neighbors)
  - Stage 2: Performance-based selection (loss comparison)
  - Complexity: O(deg(i)×d + deg(i)×inference)
Initial test acc across nodes: mean=0.4965 ± 0.0152
Round 001: test acc mean=0.5125 ± 0.0196 | min=0.4897 max=0.5627
         : test loss mean=3.7078 ± 2.8109
         : individual accs = ['0.503443', '0.523147', '0.495304', '0.515017', '0.489676', '0.532805', '0.562666', '0.493791', '0.511613', '0.512141', '0.504044', '0.508530', '0.502996', '0.495056', '0.495182', '0.525669', '0.490931', '0.542050', '0.501438', '0.543649']
         : correct/total = [(7165, 14232), (7447, 14235), (7066, 14266), (7322, 14217), (6972, 14238), (7658, 14373), (8072, 14346), (7078, 14334), (7313, 14294), (7361, 14373), (7230, 14344), (7273, 14302), (7220, 14354), (7110, 14362), (7091, 14320), (7567, 14395), (7064, 14389), (7728, 14257), (7146, 14251), (7828, 14399)]
         : compromised: 0.5170, honest: 0.4945
         : ubar stats = ['Node 0: s1=0.500, s2=1.000', 'Node 1: s1=0.500, s2=1.000', 'Node 2: s1=0.500, s2=1.000']...
Round 002: test acc mean=0.5009 ± 0.0062 | min=0.4903 max=0.5122
         : test loss mean=3.2861 ± 2.0656
         : individual accs = ['0.493255', '0.498209', '0.490257', '0.508335', '0.502107', '0.502609', '0.502788', '0.499581', '0.509445', '0.512210', '0.506972', '0.493847', '0.503553', '0.496101', '0.496718', '0.500799', '0.501564', '0.510416', '0.490632', '0.498785']
         : correct/total = [(7020, 14232), (7092, 14235), (6994, 14266), (7227, 14217), (7149, 14238), (7224, 14373), (7213, 14346), (7161, 14334), (7282, 14294), (7362, 14373), (7272, 14344), (7063, 14302), (7228, 14354), (7125, 14362), (7113, 14320), (7209, 14395), (7217, 14389), (7277, 14257), (6992, 14251), (7182, 14399)]
         : compromised: 0.5014, honest: 0.4991
         : ubar stats = ['Node 0: s1=0.500, s2=1.000', 'Node 1: s1=0.500, s2=1.000', 'Node 2: s1=0.500, s2=1.000']...
Round 003: test acc mean=0.5057 ± 0.0100 | min=0.4822 max=0.5192
         : test loss mean=1.5840 ± 0.3388
         : individual accs = ['0.509556', '0.507552', '0.518085', '0.502989', '0.515873', '0.509636', '0.513941', '0.502372', '0.518609', '0.511654', '0.506205', '0.519158', '0.497074', '0.482245', '0.509567', '0.487461', '0.501008', '0.490356', '0.508315', '0.502674']
         : correct/total = [(7252, 14232), (7225, 14235), (7391, 14266), (7151, 14217), (7345, 14238), (7325, 14373), (7373, 14346), (7201, 14334), (7413, 14294), (7354, 14373), (7261, 14344), (7425, 14302), (7135, 14354), (6926, 14362), (7297, 14320), (7017, 14395), (7209, 14389), (6991, 14257), (7244, 14251), (7238, 14399)]
         : compromised: 0.5053, honest: 0.5072
         : ubar stats = ['Node 0: s1=0.500, s2=1.000', 'Node 1: s1=0.500, s2=1.000', 'Node 2: s1=0.500, s2=1.000']...
Round 004: test acc mean=0.4953 ± 0.0083 | min=0.4806 max=0.5114
         : test loss mean=2.1000 ± 1.0909
         : individual accs = ['0.500913', '0.482051', '0.486051', '0.498558', '0.499789', '0.486050', '0.502091', '0.494279', '0.509654', '0.480554', '0.496723', '0.487205', '0.496029', '0.493316', '0.499860', '0.511428', '0.495934', '0.503121', '0.495825', '0.486145']
         : correct/total = [(7129, 14232), (6862, 14235), (6934, 14266), (7088, 14217), (7116, 14238), (6986, 14373), (7203, 14346), (7085, 14334), (7285, 14294), (6907, 14373), (7125, 14344), (6968, 14302), (7120, 14354), (7085, 14362), (7158, 14320), (7362, 14395), (7136, 14389), (7173, 14257), (7066, 14251), (7000, 14399)]
         : compromised: 0.4947, honest: 0.4977
         : ubar stats = ['Node 0: s1=0.500, s2=1.000', 'Node 1: s1=0.500, s2=1.000', 'Node 2: s1=0.500, s2=1.000']...
Round 005: test acc mean=0.5090 ± 0.0088 | min=0.4958 max=0.5307
         : test loss mean=1.1987 ± 0.2880
         : individual accs = ['0.497681', '0.510292', '0.511426', '0.530703', '0.514679', '0.525430', '0.503206', '0.512627', '0.506086', '0.513393', '0.507041', '0.516641', '0.507315', '0.512672', '0.499511', '0.496631', '0.504274', '0.495756', '0.511333', '0.504132']
         : correct/total = [(7083, 14232), (7264, 14235), (7296, 14266), (7545, 14217), (7328, 14238), (7552, 14373), (7219, 14346), (7348, 14334), (7234, 14294), (7379, 14373), (7273, 14344), (7389, 14302), (7282, 14354), (7363, 14362), (7153, 14320), (7149, 14395), (7256, 14389), (7068, 14257), (7287, 14251), (7259, 14399)]
         : compromised: 0.5095, honest: 0.5073
         : ubar stats = ['Node 0: s1=0.500, s2=1.000', 'Node 1: s1=0.500, s2=1.000', 'Node 2: s1=0.500, s2=1.000']...
Round 006: test acc mean=0.4993 ± 0.0066 | min=0.4827 max=0.5102
         : test loss mean=1.7145 ± 0.6994
         : individual accs = ['0.504286', '0.491816', '0.505958', '0.496448', '0.496067', '0.498365', '0.500558', '0.498814', '0.510214', '0.496834', '0.506205', '0.494826', '0.497213', '0.498468', '0.500908', '0.482668', '0.505247', '0.488181', '0.507052', '0.505452']
         : correct/total = [(7177, 14232), (7001, 14235), (7218, 14266), (7058, 14217), (7063, 14238), (7163, 14373), (7181, 14346), (7150, 14334), (7293, 14294), (7141, 14373), (7261, 14344), (7077, 14302), (7137, 14354), (7159, 14362), (7173, 14320), (6948, 14395), (7270, 14389), (6960, 14257), (7226, 14251), (7278, 14399)]
         : compromised: 0.4988, honest: 0.5011
         : ubar stats = ['Node 0: s1=0.500, s2=1.000', 'Node 1: s1=0.500, s2=1.000', 'Node 2: s1=0.500, s2=1.000']...
Round 007: test acc mean=0.5077 ± 0.0055 | min=0.4961 max=0.5185
         : test loss mean=1.2170 ± 0.0827
         : individual accs = ['0.502811', '0.508816', '0.496145', '0.506858', '0.510886', '0.507340', '0.515126', '0.505721', '0.504547', '0.518542', '0.516662', '0.515942', '0.504041', '0.505710', '0.507193', '0.501702', '0.503718', '0.504945', '0.512104', '0.506007']
         : correct/total = [(7156, 14232), (7243, 14235), (7078, 14266), (7206, 14217), (7274, 14238), (7292, 14373), (7390, 14346), (7249, 14334), (7212, 14294), (7453, 14373), (7411, 14344), (7379, 14302), (7235, 14354), (7263, 14362), (7263, 14320), (7222, 14395), (7248, 14389), (7199, 14257), (7298, 14251), (7286, 14399)]
         : compromised: 0.5082, honest: 0.5058
         : ubar stats = ['Node 0: s1=0.500, s2=1.000', 'Node 1: s1=0.500, s2=1.000', 'Node 2: s1=0.500, s2=1.000']...
Round 008: test acc mean=0.5058 ± 0.0067 | min=0.4914 max=0.5176
         : test loss mean=1.6371 ± 0.5894
         : individual accs = ['0.501827', '0.503969', '0.508552', '0.491384', '0.514468', '0.506088', '0.516799', '0.504325', '0.517560', '0.504557', '0.506065', '0.511886', '0.503832', '0.510305', '0.497696', '0.500729', '0.509486', '0.509364', '0.494421', '0.503090']
         : correct/total = [(7142, 14232), (7174, 14235), (7255, 14266), (6986, 14217), (7325, 14238), (7274, 14373), (7414, 14346), (7229, 14334), (7398, 14294), (7252, 14373), (7259, 14344), (7321, 14302), (7232, 14354), (7329, 14362), (7127, 14320), (7208, 14395), (7331, 14389), (7262, 14257), (7046, 14251), (7244, 14399)]
         : compromised: 0.5054, honest: 0.5075
         : ubar stats = ['Node 0: s1=0.500, s2=1.000', 'Node 1: s1=0.500, s2=1.000', 'Node 2: s1=0.500, s2=1.000']...
Round 009: test acc mean=0.5068 ± 0.0050 | min=0.4971 max=0.5158
         : test loss mean=1.3045 ± 0.3071
         : individual accs = ['0.501757', '0.504391', '0.503295', '0.511078', '0.505127', '0.504627', '0.497072', '0.509767', '0.508395', '0.515759', '0.508296', '0.501958', '0.510868', '0.509400', '0.510964', '0.499132', '0.500799', '0.508031', '0.510420', '0.515383']
         : correct/total = [(7141, 14232), (7180, 14235), (7180, 14266), (7266, 14217), (7192, 14238), (7253, 14373), (7131, 14346), (7307, 14334), (7267, 14294), (7413, 14373), (7291, 14344), (7179, 14302), (7333, 14354), (7316, 14362), (7317, 14320), (7185, 14395), (7206, 14389), (7243, 14257), (7274, 14251), (7421, 14399)]
         : compromised: 0.5074, honest: 0.5044
         : ubar stats = ['Node 0: s1=0.500, s2=1.000', 'Node 1: s1=0.500, s2=1.000', 'Node 2: s1=0.500, s2=1.000']...
Round 010: test acc mean=0.5093 ± 0.0062 | min=0.4930 max=0.5220
         : test loss mean=1.3474 ± 0.3558
         : individual accs = ['0.516723', '0.506779', '0.511636', '0.506366', '0.511729', '0.506227', '0.517008', '0.504256', '0.514342', '0.508245', '0.522030', '0.512935', '0.509962', '0.506267', '0.508520', '0.493018', '0.512405', '0.499614', '0.509859', '0.508160']
         : correct/total = [(7354, 14232), (7214, 14235), (7299, 14266), (7199, 14217), (7286, 14238), (7276, 14373), (7417, 14346), (7228, 14334), (7352, 14294), (7305, 14373), (7488, 14344), (7336, 14302), (7320, 14354), (7271, 14362), (7282, 14320), (7097, 14395), (7373, 14389), (7123, 14257), (7266, 14251), (7317, 14399)]
         : compromised: 0.5088, honest: 0.5113
         : ubar stats = ['Node 0: s1=0.500, s2=1.000', 'Node 1: s1=0.500, s2=1.000', 'Node 2: s1=0.500, s2=1.000']...

=== FINAL RESULTS ===
Dataset: sent140, Nodes: 20, Graph: ring, Aggregation: ubar
Attack: krum, 80.0% compromised
Final accuracy - Compromised: 0.5088, Honest: 0.5113
Overall test accuracy: mean=0.5093 ± 0.0062

=== UBAR SUMMARY ===
Node 0: stage1=0.500, stage2=1.000, overall=0.500
Node 1: stage1=0.500, stage2=1.000, overall=0.500
Node 2: stage1=0.500, stage2=1.000, overall=0.500
Node 3: stage1=0.500, stage2=1.000, overall=0.500
Node 4: stage1=0.500, stage2=1.000, overall=0.500
Node 5: stage1=0.500, stage2=1.000, overall=0.500
Node 6: stage1=0.500, stage2=1.000, overall=0.500
Node 7: stage1=0.500, stage2=1.000, overall=0.500
Node 8: stage1=0.500, stage2=1.000, overall=0.500
Node 9: stage1=0.500, stage2=1.000, overall=0.500
Node 10: stage1=0.500, stage2=1.000, overall=0.500
Node 11: stage1=0.500, stage2=1.000, overall=0.500
Node 12: stage1=0.500, stage2=1.000, overall=0.500
Node 13: stage1=0.500, stage2=1.000, overall=0.500
Node 14: stage1=0.500, stage2=1.000, overall=0.500
Node 15: stage1=0.500, stage2=1.000, overall=0.500
Node 16: stage1=0.500, stage2=1.000, overall=0.500
Node 17: stage1=0.500, stage2=1.000, overall=0.500
Node 18: stage1=0.500, stage2=1.000, overall=0.500
Node 19: stage1=0.500, stage2=1.000, overall=0.500

=== PARALLEL EXECUTION TIME (realistic for distributed system) ===
  COMMUNICATION (max across nodes):
    - Full model transfer: 0.000s (0.0%)
  COMPUTATION (max across nodes):
    - Distance computation: 0.012s (41.8%)
    - Loss computation: 0.014s (46.8%)
    - Aggregation: 0.003s (11.4%)
  TOTALS:
    - Total computation: 0.029s (100.0%)
    - Total communication: 0.000s (0.0%)
    - Total parallel time: 0.029s

=== PER-NODE AVERAGE TIME ===
  - Distance computation: 0.009s
  - Loss computation: 0.010s
  - Aggregation: 0.003s
  - Model transfer: 0.000s
  - Total per node: 0.022s

=== TOTAL COMPUTATIONAL WORK (sum across all nodes) ===
  - Total distance computation: 0.183s
  - Total loss computation: 0.195s
  - Total aggregation: 0.065s
  - Total model transfer: 0.000s
  - Grand total: 0.443s
  - Mean Stage 1 acceptance rate: 0.500
  - Mean Stage 2 acceptance rate: 1.000
  - Overall acceptance rate: 0.500

UBAR Algorithm Properties:
  - Model dimension: 1,174,986
  - Rho parameter: 0.19999999999999996
  - Two-stage approach: Distance filtering + loss evaluation
  - Stage 1 selects: 20% of neighbors
  - Stage 2 uses: Training sample loss comparison
  - Theoretical complexity: O(deg(i)×d + deg(i)×inference)
  - Approach: UBAR paper implementation
