Device: cuda
Seed: 987654321
Loading 1 LEAF Sent140 train files...
LEAF Sent140 train: 254555 users, 908652 samples
Building vocabulary (max_size=10000)...
Vocabulary size: 10000
Loading 1 LEAF Sent140 test files...
LEAF Sent140 test: 254555 users, 286281 samples
Found 254555 train users, 254555 test users, 254555 common users
User sample counts range: 494 (max) to 1 (min)
Distributed ALL 254555 users across 20 clients
Users per client: 12727 (with 15 clients getting +1 user)
Train partition sizes: [44353, 44290, 44657, 44907, 44696, 45843, 45801, 45619, 45069, 45639, 45821, 45311, 45779, 46056, 45625, 45984, 46428, 44737, 45540, 46497]
Test partition sizes: [14232, 14235, 14266, 14217, 14238, 14373, 14346, 14334, 14294, 14373, 14344, 14302, 14354, 14362, 14320, 14395, 14389, 14257, 14251, 14399]
  Client 0: 44353 train samples, 2 unique classes
  Client 1: 44290 train samples, 2 unique classes
  Client 2: 44657 train samples, 2 unique classes
  Client 3: 44907 train samples, 2 unique classes
  Client 4: 44696 train samples, 2 unique classes
  Client 5: 45843 train samples, 2 unique classes
  Client 6: 45801 train samples, 2 unique classes
  Client 7: 45619 train samples, 2 unique classes
  Client 8: 45069 train samples, 2 unique classes
  Client 9: 45639 train samples, 2 unique classes
  Client 10: 45821 train samples, 2 unique classes
  Client 11: 45311 train samples, 2 unique classes
  Client 12: 45779 train samples, 2 unique classes
  Client 13: 46056 train samples, 2 unique classes
  Client 14: 45625 train samples, 2 unique classes
  Client 15: 45984 train samples, 2 unique classes
  Client 16: 46428 train samples, 2 unique classes
  Client 17: 44737 train samples, 2 unique classes
  Client 18: 45540 train samples, 2 unique classes
  Client 19: 46497 train samples, 2 unique classes
Will sample 4500 samples per client per epoch
Graph: erdos, nodes: 20, edges: 99
Degree statistics: avg=9.90, min=7, max=14
Attack: Compromised 12/20 nodes: [1, 2, 3, 5, 8, 11, 12, 13, 14, 15, 17, 18]
Attack type: backdoor, lambda: 1.0
Backdoor target label: 1, trigger size: 3
Model variant: baseline
Model parameters: 1,174,986
Initial test acc across nodes: mean=0.4965 ± 0.0152
Backdoor attack: Created poisoned datasets for 12 compromised nodes
Round 001: test acc mean=0.5019 ± 0.0064 | min=0.4878 max=0.5145
         : test loss mean=7.5256 ± 2.3549
         : individual accs = ['0.514545', '0.502705', '0.505748', '0.501583', '0.505829', '0.504140', '0.493169', '0.499442', '0.498811', '0.495234', '0.499930', '0.503216', '0.511425', '0.487815', '0.513547', '0.501771', '0.496768', '0.503051', '0.495825', '0.503090']
         : correct/total = [(7323, 14232), (7156, 14235), (7215, 14266), (7131, 14217), (7202, 14238), (7246, 14373), (7075, 14346), (7159, 14334), (7130, 14294), (7118, 14373), (7171, 14344), (7197, 14302), (7341, 14354), (7006, 14362), (7354, 14320), (7223, 14395), (7148, 14389), (7172, 14257), (7066, 14251), (7244, 14399)]
         : compromised: 0.5025, honest: 0.5010
Round 002: test acc mean=0.5045 ± 0.0057 | min=0.4947 max=0.5139
         : test loss mean=17.1868 ± 5.4861
         : individual accs = ['0.511523', '0.513945', '0.513739', '0.505029', '0.504565', '0.503096', '0.498745', '0.506628', '0.507346', '0.509010', '0.497978', '0.510278', '0.499652', '0.494708', '0.504050', '0.499757', '0.501633', '0.497019', '0.511122', '0.499271']
         : correct/total = [(7280, 14232), (7316, 14235), (7329, 14266), (7180, 14217), (7184, 14238), (7231, 14373), (7155, 14346), (7262, 14334), (7252, 14294), (7316, 14373), (7143, 14344), (7298, 14302), (7172, 14354), (7105, 14362), (7218, 14320), (7194, 14395), (7218, 14389), (7086, 14257), (7284, 14251), (7189, 14399)]
         : compromised: 0.5050, honest: 0.5037
Round 003: test acc mean=0.5051 ± 0.0056 | min=0.4914 max=0.5139
         : test loss mean=12.5270 ± 1.4218
         : individual accs = ['0.510891', '0.513734', '0.513949', '0.507772', '0.505900', '0.506157', '0.502440', '0.504814', '0.511543', '0.506992', '0.500976', '0.507971', '0.500488', '0.491436', '0.504190', '0.501633', '0.500243', '0.496949', '0.511262', '0.503646']
         : correct/total = [(7271, 14232), (7313, 14235), (7332, 14266), (7219, 14217), (7203, 14238), (7275, 14373), (7208, 14346), (7236, 14334), (7312, 14294), (7287, 14373), (7186, 14344), (7265, 14302), (7184, 14354), (7058, 14362), (7220, 14320), (7221, 14395), (7198, 14389), (7085, 14257), (7286, 14251), (7252, 14399)]
         : compromised: 0.5056, honest: 0.5045
Round 004: test acc mean=0.5002 ± 0.0061 | min=0.4910 max=0.5109
         : test loss mean=8.4817 ± 3.9444
         : individual accs = ['0.501757', '0.509308', '0.490958', '0.494830', '0.496699', '0.498782', '0.498188', '0.496372', '0.491675', '0.508592', '0.507529', '0.491679', '0.510868', '0.505292', '0.497626', '0.500104', '0.501772', '0.508522', '0.497579', '0.496423']
         : correct/total = [(7141, 14232), (7250, 14235), (7004, 14266), (7035, 14217), (7072, 14238), (7169, 14373), (7147, 14346), (7115, 14334), (7028, 14294), (7310, 14373), (7280, 14344), (7032, 14302), (7333, 14354), (7257, 14362), (7126, 14320), (7199, 14395), (7220, 14389), (7250, 14257), (7091, 14251), (7148, 14399)]
         : compromised: 0.4998, honest: 0.5009
Round 005: test acc mean=0.4948 ± 0.0056 | min=0.4861 max=0.5086
         : test loss mean=21.5615 ± 3.2509
         : individual accs = ['0.489109', '0.486266', '0.486051', '0.492228', '0.494100', '0.493843', '0.497560', '0.495186', '0.488457', '0.492938', '0.499024', '0.492029', '0.499512', '0.508564', '0.495810', '0.498367', '0.499757', '0.503051', '0.488738', '0.496354']
         : correct/total = [(6961, 14232), (6922, 14235), (6934, 14266), (6998, 14217), (7035, 14238), (7098, 14373), (7138, 14346), (7098, 14334), (6982, 14294), (7085, 14373), (7158, 14344), (7037, 14302), (7170, 14354), (7304, 14362), (7100, 14320), (7174, 14395), (7191, 14389), (7172, 14257), (6965, 14251), (7147, 14399)]
         : compromised: 0.4944, honest: 0.4955
Round 006: test acc mean=0.4949 ± 0.0056 | min=0.4861 max=0.5086
         : test loss mean=31.3436 ± 7.1329
         : individual accs = ['0.489109', '0.486266', '0.486051', '0.492228', '0.494100', '0.493843', '0.497560', '0.495465', '0.488527', '0.493008', '0.499024', '0.492868', '0.499512', '0.508564', '0.495740', '0.498367', '0.499757', '0.503051', '0.488808', '0.495937']
         : correct/total = [(6961, 14232), (6922, 14235), (6934, 14266), (6998, 14217), (7035, 14238), (7098, 14373), (7138, 14346), (7102, 14334), (6983, 14294), (7086, 14373), (7158, 14344), (7049, 14302), (7170, 14354), (7304, 14362), (7099, 14320), (7174, 14395), (7191, 14389), (7172, 14257), (6966, 14251), (7141, 14399)]
         : compromised: 0.4945, honest: 0.4955
Round 007: test acc mean=0.4949 ± 0.0056 | min=0.4861 max=0.5086
         : test loss mean=16.9074 ± 10.9265
         : individual accs = ['0.489109', '0.486266', '0.486051', '0.492228', '0.494100', '0.493843', '0.497560', '0.495186', '0.488457', '0.493008', '0.499024', '0.492029', '0.499512', '0.508564', '0.495810', '0.498367', '0.499757', '0.503051', '0.488738', '0.496354']
         : correct/total = [(6961, 14232), (6922, 14235), (6934, 14266), (6998, 14217), (7035, 14238), (7098, 14373), (7138, 14346), (7098, 14334), (6982, 14294), (7086, 14373), (7158, 14344), (7037, 14302), (7170, 14354), (7304, 14362), (7100, 14320), (7174, 14395), (7191, 14389), (7172, 14257), (6965, 14251), (7147, 14399)]
         : compromised: 0.4944, honest: 0.4955
Round 008: test acc mean=0.5037 ± 0.0051 | min=0.4917 max=0.5115
         : test loss mean=12.1420 ± 5.4441
         : individual accs = ['0.502881', '0.504180', '0.509253', '0.508757', '0.505127', '0.503235', '0.502509', '0.504814', '0.511543', '0.493564', '0.498466', '0.507971', '0.507733', '0.491714', '0.504120', '0.498854', '0.500243', '0.503682', '0.511122', '0.503646']
         : correct/total = [(7157, 14232), (7177, 14235), (7265, 14266), (7233, 14217), (7192, 14238), (7233, 14373), (7209, 14346), (7236, 14334), (7312, 14294), (7094, 14373), (7150, 14344), (7265, 14302), (7288, 14354), (7062, 14362), (7219, 14320), (7181, 14395), (7198, 14389), (7181, 14257), (7284, 14251), (7252, 14399)]
         : compromised: 0.5052, honest: 0.5014
Round 009: test acc mean=0.5051 ± 0.0056 | min=0.4914 max=0.5138
         : test loss mean=6.5384 ± 2.8207
         : individual accs = ['0.510961', '0.513734', '0.513809', '0.507702', '0.505900', '0.506157', '0.502440', '0.504814', '0.511683', '0.507131', '0.500418', '0.507971', '0.500557', '0.491436', '0.504190', '0.501633', '0.500243', '0.496949', '0.511262', '0.503646']
         : correct/total = [(7272, 14232), (7313, 14235), (7330, 14266), (7218, 14217), (7203, 14238), (7275, 14373), (7208, 14346), (7236, 14334), (7314, 14294), (7289, 14373), (7178, 14344), (7265, 14302), (7185, 14354), (7058, 14362), (7220, 14320), (7221, 14395), (7198, 14389), (7085, 14257), (7286, 14251), (7252, 14399)]
         : compromised: 0.5056, honest: 0.5044
Round 010: test acc mean=0.4970 ± 0.0086 | min=0.4815 max=0.5136
         : test loss mean=6.2857 ± 5.8606
         : individual accs = ['0.504427', '0.513593', '0.508342', '0.508546', '0.487147', '0.502679', '0.491635', '0.493651', '0.488876', '0.506992', '0.501046', '0.491400', '0.500627', '0.481549', '0.495601', '0.491837', '0.497950', '0.497019', '0.482071', '0.496007']
         : correct/total = [(7179, 14232), (7311, 14235), (7252, 14266), (7230, 14217), (6936, 14238), (7225, 14373), (7053, 14346), (7076, 14334), (6988, 14294), (7287, 14373), (7187, 14344), (7028, 14302), (7186, 14354), (6916, 14362), (7097, 14320), (7080, 14395), (7165, 14389), (7086, 14257), (6870, 14251), (7142, 14399)]
         : compromised: 0.4968, honest: 0.4974

=== FINAL RESULTS ===
Dataset: sent140, Nodes: 20, Graph: erdos, Aggregation: d-fedavg
Attack: backdoor, 60.0% compromised
Final accuracy - Compromised: 0.4968, Honest: 0.4974
Overall test accuracy: mean=0.4970 ± 0.0086

=== BACKDOOR ATTACK SUCCESS RATE (ASR) ===
Target label: 1
Trigger size: 3x3
Overall ASR: 0.3436 ± 0.3835
Honest nodes ASR: 0.4307 ± 0.4019
Compromised nodes ASR: 0.2855 ± 0.3592
Note: Higher ASR indicates more successful backdoor attack
