Device: cuda
Seed: 987654321
Loading 1 LEAF Sent140 train files...
LEAF Sent140 train: 254555 users, 908652 samples
Building vocabulary (max_size=10000)...
Vocabulary size: 10000
Loading 1 LEAF Sent140 test files...
LEAF Sent140 test: 254555 users, 286281 samples
Found 254555 train users, 254555 test users, 254555 common users
User sample counts range: 494 (max) to 1 (min)
Distributed ALL 254555 users across 20 clients
Users per client: 12727 (with 15 clients getting +1 user)
Train partition sizes: [44353, 44290, 44657, 44907, 44696, 45843, 45801, 45619, 45069, 45639, 45821, 45311, 45779, 46056, 45625, 45984, 46428, 44737, 45540, 46497]
Test partition sizes: [14232, 14235, 14266, 14217, 14238, 14373, 14346, 14334, 14294, 14373, 14344, 14302, 14354, 14362, 14320, 14395, 14389, 14257, 14251, 14399]
  Client 0: 44353 train samples, 2 unique classes
  Client 1: 44290 train samples, 2 unique classes
  Client 2: 44657 train samples, 2 unique classes
  Client 3: 44907 train samples, 2 unique classes
  Client 4: 44696 train samples, 2 unique classes
  Client 5: 45843 train samples, 2 unique classes
  Client 6: 45801 train samples, 2 unique classes
  Client 7: 45619 train samples, 2 unique classes
  Client 8: 45069 train samples, 2 unique classes
  Client 9: 45639 train samples, 2 unique classes
  Client 10: 45821 train samples, 2 unique classes
  Client 11: 45311 train samples, 2 unique classes
  Client 12: 45779 train samples, 2 unique classes
  Client 13: 46056 train samples, 2 unique classes
  Client 14: 45625 train samples, 2 unique classes
  Client 15: 45984 train samples, 2 unique classes
  Client 16: 46428 train samples, 2 unique classes
  Client 17: 44737 train samples, 2 unique classes
  Client 18: 45540 train samples, 2 unique classes
  Client 19: 46497 train samples, 2 unique classes
Will sample 4500 samples per client per epoch
Graph: erdos, nodes: 20, edges: 126
Degree statistics: avg=12.60, min=8, max=16
Attack: Compromised 6/20 nodes: [5, 12, 13, 14, 17, 18]
Attack type: directed_deviation, lambda: 1.0
Model variant: baseline
Model parameters: 1,174,986
Initial test acc across nodes: mean=0.4953 ± 0.0174
Round 001: test acc mean=0.5009 ± 0.0052 | min=0.4879 max=0.5116
         : test loss mean=23.4432 ± 8.5932
         : individual accs = ['0.509345', '0.502143', '0.503365', '0.499894', '0.511589', '0.502331', '0.503764', '0.501186', '0.493284', '0.496556', '0.498885', '0.500350', '0.502647', '0.487885', '0.496229', '0.498090', '0.499340', '0.505506', '0.505368', '0.499618']
         : correct/total = [(7249, 14232), (7148, 14235), (7181, 14266), (7107, 14217), (7284, 14238), (7220, 14373), (7227, 14346), (7184, 14334), (7051, 14294), (7137, 14373), (7156, 14344), (7156, 14302), (7215, 14354), (7007, 14362), (7106, 14320), (7170, 14395), (7185, 14389), (7207, 14257), (7202, 14251), (7194, 14399)]
         : compromised: 0.5000, honest: 0.5012
Round 002: test acc mean=0.5073 ± 0.0082 | min=0.4797 max=0.5157
         : test loss mean=3.1546 ± 5.5683
         : individual accs = ['0.509767', '0.515701', '0.507641', '0.514314', '0.514258', '0.509914', '0.495818', '0.501256', '0.503988', '0.507271', '0.479713', '0.503916', '0.513028', '0.504874', '0.512919', '0.514067', '0.502745', '0.514554', '0.510701', '0.509271']
         : correct/total = [(7255, 14232), (7341, 14235), (7242, 14266), (7312, 14217), (7322, 14238), (7329, 14373), (7113, 14346), (7185, 14334), (7204, 14294), (7291, 14373), (6881, 14344), (7207, 14302), (7364, 14354), (7251, 14362), (7345, 14320), (7400, 14395), (7234, 14389), (7336, 14257), (7278, 14251), (7333, 14399)]
         : compromised: 0.5110, honest: 0.5057
Round 003: test acc mean=0.5003 ± 0.0055 | min=0.4899 max=0.5113
         : test loss mean=1.0082 ± 0.5947
         : individual accs = ['0.506394', '0.489919', '0.495724', '0.509812', '0.506532', '0.498226', '0.502021', '0.494419', '0.499580', '0.497043', '0.500488', '0.494616', '0.507594', '0.511349', '0.496997', '0.496770', '0.498575', '0.503262', '0.498281', '0.498854']
         : correct/total = [(7207, 14232), (6974, 14235), (7072, 14266), (7248, 14217), (7212, 14238), (7161, 14373), (7202, 14346), (7087, 14334), (7141, 14294), (7144, 14373), (7179, 14344), (7074, 14302), (7286, 14354), (7344, 14362), (7117, 14320), (7151, 14395), (7174, 14389), (7175, 14257), (7101, 14251), (7183, 14399)]
         : compromised: 0.5026, honest: 0.4993
Round 004: test acc mean=0.5065 ± 0.0135 | min=0.4869 max=0.5297
         : test loss mean=7.8157 ± 30.7833
         : individual accs = ['0.490163', '0.493221', '0.529651', '0.496518', '0.493679', '0.497878', '0.519309', '0.522813', '0.501819', '0.499478', '0.493586', '0.496574', '0.504528', '0.515457', '0.521648', '0.523862', '0.526722', '0.486919', '0.517087', '0.499479']
         : correct/total = [(6976, 14232), (7021, 14235), (7556, 14266), (7059, 14217), (7029, 14238), (7156, 14373), (7450, 14346), (7494, 14334), (7173, 14294), (7179, 14373), (7080, 14344), (7102, 14302), (7242, 14354), (7403, 14362), (7470, 14320), (7541, 14395), (7579, 14389), (6942, 14257), (7369, 14251), (7192, 14399)]
         : compromised: 0.5073, honest: 0.5062
Round 005: test acc mean=0.5124 ± 0.0121 | min=0.4946 max=0.5299
         : test loss mean=2.5850 ± 7.9243
         : individual accs = ['0.518269', '0.506639', '0.527408', '0.529929', '0.499087', '0.519446', '0.523839', '0.529580', '0.508325', '0.512558', '0.497978', '0.519997', '0.502299', '0.501671', '0.496439', '0.494616', '0.529224', '0.504524', '0.501860', '0.523578']
         : correct/total = [(7376, 14232), (7212, 14235), (7524, 14266), (7534, 14217), (7106, 14238), (7466, 14373), (7515, 14346), (7591, 14334), (7266, 14294), (7367, 14373), (7143, 14344), (7437, 14302), (7210, 14354), (7205, 14362), (7109, 14320), (7120, 14395), (7615, 14389), (7193, 14257), (7152, 14251), (7539, 14399)]
         : compromised: 0.5044, honest: 0.5158
Round 006: test acc mean=0.5093 ± 0.0051 | min=0.4985 max=0.5174
         : test loss mean=4.9322 ± 18.3755
         : individual accs = ['0.505832', '0.508184', '0.510094', '0.501301', '0.507937', '0.513184', '0.505367', '0.514023', '0.498461', '0.517220', '0.505996', '0.502168', '0.514212', '0.517407', '0.506494', '0.509344', '0.515950', '0.509224', '0.512455', '0.510730']
         : correct/total = [(7199, 14232), (7234, 14235), (7277, 14266), (7127, 14217), (7232, 14238), (7376, 14373), (7250, 14346), (7368, 14334), (7125, 14294), (7434, 14373), (7258, 14344), (7182, 14302), (7381, 14354), (7431, 14362), (7253, 14320), (7332, 14395), (7424, 14389), (7260, 14257), (7303, 14251), (7354, 14399)]
         : compromised: 0.5122, honest: 0.5080
Round 007: test acc mean=0.5076 ± 0.0058 | min=0.5018 max=0.5268
         : test loss mean=9.1084 ± 36.5579
         : individual accs = ['0.502319', '0.501932', '0.502103', '0.526764', '0.507375', '0.507758', '0.509480', '0.506907', '0.501819', '0.503931', '0.506065', '0.504894', '0.509544', '0.516572', '0.504399', '0.510524', '0.508861', '0.501999', '0.509157', '0.510244']
         : correct/total = [(7149, 14232), (7145, 14235), (7163, 14266), (7489, 14217), (7224, 14238), (7298, 14373), (7309, 14346), (7266, 14334), (7173, 14294), (7243, 14373), (7259, 14344), (7221, 14302), (7314, 14354), (7419, 14362), (7223, 14320), (7349, 14395), (7322, 14389), (7157, 14257), (7256, 14251), (7347, 14399)]
         : compromised: 0.5082, honest: 0.5074
Round 008: test acc mean=0.5054 ± 0.0067 | min=0.4906 max=0.5175
         : test loss mean=2.3263 ± 7.0152
         : individual accs = ['0.498524', '0.498209', '0.502594', '0.516002', '0.505549', '0.506992', '0.512965', '0.503767', '0.490555', '0.496278', '0.502928', '0.505384', '0.508360', '0.510792', '0.500000', '0.512609', '0.510529', '0.504664', '0.503684', '0.517466']
         : correct/total = [(7095, 14232), (7092, 14235), (7170, 14266), (7336, 14217), (7198, 14238), (7287, 14373), (7359, 14346), (7221, 14334), (7012, 14294), (7133, 14373), (7214, 14344), (7228, 14302), (7297, 14354), (7336, 14362), (7160, 14320), (7379, 14395), (7346, 14389), (7195, 14257), (7178, 14251), (7451, 14399)]
         : compromised: 0.5057, honest: 0.5052
Round 009: test acc mean=0.5142 ± 0.0084 | min=0.4952 max=0.5281
         : test loss mean=3.2899 ± 11.2664
         : individual accs = ['0.513280', '0.521672', '0.512197', '0.495182', '0.511167', '0.528073', '0.514429', '0.503558', '0.500979', '0.518820', '0.503416', '0.517200', '0.515605', '0.515806', '0.513268', '0.525808', '0.518243', '0.517360', '0.511192', '0.526981']
         : correct/total = [(7305, 14232), (7426, 14235), (7307, 14266), (7040, 14217), (7278, 14238), (7590, 14373), (7380, 14346), (7218, 14334), (7161, 14294), (7457, 14373), (7221, 14344), (7397, 14302), (7401, 14354), (7408, 14362), (7350, 14320), (7569, 14395), (7457, 14389), (7376, 14257), (7285, 14251), (7588, 14399)]
         : compromised: 0.5169, honest: 0.5131
Round 010: test acc mean=0.5113 ± 0.0096 | min=0.4952 max=0.5239
         : test loss mean=1.8955 ± 5.1771
         : individual accs = ['0.520868', '0.519002', '0.505608', '0.496940', '0.520298', '0.499200', '0.521400', '0.509837', '0.497691', '0.520907', '0.505020', '0.519298', '0.505922', '0.518660', '0.495182', '0.504759', '0.519981', '0.503262', '0.523893', '0.518439']
         : correct/total = [(7413, 14232), (7388, 14235), (7213, 14266), (7065, 14217), (7408, 14238), (7175, 14373), (7480, 14346), (7308, 14334), (7114, 14294), (7487, 14373), (7244, 14344), (7427, 14302), (7262, 14354), (7449, 14362), (7091, 14320), (7266, 14395), (7482, 14389), (7175, 14257), (7466, 14251), (7465, 14399)]
         : compromised: 0.5077, honest: 0.5129

=== FINAL RESULTS ===
Dataset: sent140, Nodes: 20, Graph: erdos, Aggregation: krum
Attack: directed_deviation, 30.0% compromised
Final accuracy - Compromised: 0.5077, Honest: 0.5129
Overall test accuracy: mean=0.5113 ± 0.0096
