Device: cuda
Seed: 987654321
Loading 1 LEAF Sent140 train files...
LEAF Sent140 train: 254555 users, 908652 samples
Building vocabulary (max_size=10000)...
Vocabulary size: 10000
Loading 1 LEAF Sent140 test files...
LEAF Sent140 test: 254555 users, 286281 samples
Found 254555 train users, 254555 test users, 254555 common users
User sample counts range: 494 (max) to 1 (min)
Distributed ALL 254555 users across 20 clients
Users per client: 12727 (with 15 clients getting +1 user)
Train partition sizes: [44353, 44290, 44657, 44907, 44696, 45843, 45801, 45619, 45069, 45639, 45821, 45311, 45779, 46056, 45625, 45984, 46428, 44737, 45540, 46497]
Test partition sizes: [14232, 14235, 14266, 14217, 14238, 14373, 14346, 14334, 14294, 14373, 14344, 14302, 14354, 14362, 14320, 14395, 14389, 14257, 14251, 14399]
  Client 0: 44353 train samples, 2 unique classes
  Client 1: 44290 train samples, 2 unique classes
  Client 2: 44657 train samples, 2 unique classes
  Client 3: 44907 train samples, 2 unique classes
  Client 4: 44696 train samples, 2 unique classes
  Client 5: 45843 train samples, 2 unique classes
  Client 6: 45801 train samples, 2 unique classes
  Client 7: 45619 train samples, 2 unique classes
  Client 8: 45069 train samples, 2 unique classes
  Client 9: 45639 train samples, 2 unique classes
  Client 10: 45821 train samples, 2 unique classes
  Client 11: 45311 train samples, 2 unique classes
  Client 12: 45779 train samples, 2 unique classes
  Client 13: 46056 train samples, 2 unique classes
  Client 14: 45625 train samples, 2 unique classes
  Client 15: 45984 train samples, 2 unique classes
  Client 16: 46428 train samples, 2 unique classes
  Client 17: 44737 train samples, 2 unique classes
  Client 18: 45540 train samples, 2 unique classes
  Client 19: 46497 train samples, 2 unique classes
Will sample 4500 samples per client per epoch
Graph: fully, nodes: 20, edges: 190
Degree statistics: avg=19.00, min=19, max=19
Attack: Compromised 8/20 nodes: [1, 5, 11, 12, 13, 14, 17, 18]
Attack type: backdoor, lambda: 1.0
Backdoor target label: 1, trigger size: 3
Model variant: baseline
Model parameters: 1,174,986
Initial test acc across nodes: mean=0.4965 ± 0.0152
Backdoor attack: Created poisoned datasets for 8 compromised nodes
Round 001: test acc mean=0.5004 ± 0.0074 | min=0.4831 max=0.5097
         : test loss mean=24.9387 ± 8.2338
         : individual accs = ['0.507518', '0.489357', '0.483107', '0.502286', '0.502528', '0.495095', '0.499930', '0.486047', '0.502379', '0.502609', '0.502301', '0.493288', '0.504528', '0.494778', '0.505237', '0.505592', '0.506151', '0.508031', '0.509719', '0.507257']
         : correct/total = [(7223, 14232), (6966, 14235), (6892, 14266), (7141, 14217), (7155, 14238), (7116, 14373), (7172, 14346), (6967, 14334), (7181, 14294), (7224, 14373), (7205, 14344), (7055, 14302), (7242, 14354), (7106, 14362), (7235, 14320), (7278, 14395), (7283, 14389), (7243, 14257), (7264, 14251), (7304, 14399)]
         : compromised: 0.5000, honest: 0.5006
Round 002: test acc mean=0.5094 ± 0.0047 | min=0.4997 max=0.5171
         : test loss mean=25.7041 ± 0.3734
         : individual accs = ['0.517074', '0.509027', '0.515491', '0.514877', '0.509973', '0.513532', '0.514708', '0.504465', '0.510424', '0.509010', '0.504322', '0.511467', '0.509335', '0.499721', '0.506145', '0.506704', '0.507749', '0.500596', '0.513157', '0.509549']
         : correct/total = [(7359, 14232), (7246, 14235), (7354, 14266), (7320, 14217), (7261, 14238), (7381, 14373), (7384, 14346), (7231, 14334), (7296, 14294), (7316, 14373), (7234, 14344), (7315, 14302), (7311, 14354), (7177, 14362), (7248, 14320), (7294, 14395), (7306, 14389), (7137, 14257), (7313, 14251), (7337, 14399)]
         : compromised: 0.5079, honest: 0.5104
Round 003: test acc mean=0.5049 ± 0.0055 | min=0.4910 max=0.5132
         : test loss mean=10.1497 ± 0.1295
         : individual accs = ['0.510118', '0.513242', '0.512617', '0.506928', '0.506391', '0.505322', '0.502509', '0.504604', '0.511124', '0.506157', '0.500488', '0.508390', '0.501045', '0.491018', '0.503422', '0.500382', '0.500313', '0.497089', '0.512034', '0.503993']
         : correct/total = [(7260, 14232), (7306, 14235), (7313, 14266), (7207, 14217), (7210, 14238), (7263, 14373), (7209, 14346), (7233, 14334), (7306, 14294), (7275, 14373), (7179, 14344), (7271, 14302), (7192, 14354), (7052, 14362), (7209, 14320), (7203, 14395), (7199, 14389), (7087, 14257), (7297, 14251), (7257, 14399)]
         : compromised: 0.5039, honest: 0.5055
Round 004: test acc mean=0.5109 ± 0.0043 | min=0.5013 max=0.5175
         : test loss mean=1.1544 ± 0.0112
         : individual accs = ['0.508783', '0.503899', '0.501332', '0.506788', '0.514749', '0.513741', '0.509829', '0.513325', '0.510354', '0.513602', '0.515547', '0.511677', '0.517486', '0.513995', '0.509986', '0.512470', '0.506985', '0.515606', '0.504807', '0.513925']
         : correct/total = [(7241, 14232), (7173, 14235), (7152, 14266), (7205, 14217), (7329, 14238), (7384, 14373), (7314, 14346), (7358, 14334), (7295, 14294), (7382, 14373), (7395, 14344), (7318, 14302), (7428, 14354), (7382, 14362), (7303, 14320), (7377, 14395), (7295, 14389), (7351, 14257), (7194, 14251), (7400, 14399)]
         : compromised: 0.5114, honest: 0.5106
Round 005: test acc mean=0.5027 ± 0.0037 | min=0.4952 max=0.5088
         : test loss mean=0.8886 ± 0.0057
         : individual accs = ['0.503724', '0.507552', '0.500771', '0.499965', '0.495154', '0.502331', '0.504322', '0.501605', '0.501329', '0.508801', '0.502649', '0.497623', '0.499582', '0.497424', '0.506564', '0.505662', '0.505039', '0.505506', '0.500105', '0.508646']
         : correct/total = [(7169, 14232), (7225, 14235), (7144, 14266), (7108, 14217), (7050, 14238), (7220, 14373), (7235, 14346), (7190, 14334), (7166, 14294), (7313, 14373), (7210, 14344), (7117, 14302), (7171, 14354), (7144, 14362), (7254, 14320), (7279, 14395), (7267, 14389), (7207, 14257), (7127, 14251), (7324, 14399)]
         : compromised: 0.5021, honest: 0.5031
Round 006: test acc mean=0.4991 ± 0.0055 | min=0.4875 max=0.5126
         : test loss mean=0.7986 ± 0.0052
         : individual accs = ['0.497611', '0.501229', '0.497897', '0.496729', '0.501686', '0.499269', '0.498397', '0.512627', '0.487477', '0.501357', '0.498397', '0.497133', '0.488784', '0.496240', '0.505377', '0.501424', '0.507193', '0.501227', '0.493650', '0.498993']
         : correct/total = [(7082, 14232), (7135, 14235), (7103, 14266), (7062, 14217), (7143, 14238), (7176, 14373), (7150, 14346), (7348, 14334), (6968, 14294), (7206, 14373), (7149, 14344), (7110, 14302), (7016, 14354), (7127, 14362), (7237, 14320), (7218, 14395), (7298, 14389), (7146, 14257), (7035, 14251), (7185, 14399)]
         : compromised: 0.4979, honest: 0.5000
Round 007: test acc mean=0.5073 ± 0.0040 | min=0.4964 max=0.5149
         : test loss mean=0.7588 ± 0.0035
         : individual accs = ['0.502178', '0.505515', '0.505538', '0.505522', '0.508639', '0.508523', '0.508225', '0.514860', '0.496432', '0.511793', '0.509133', '0.504545', '0.504041', '0.506406', '0.504120', '0.508788', '0.512683', '0.508733', '0.508877', '0.511494']
         : correct/total = [(7147, 14232), (7196, 14235), (7212, 14266), (7187, 14217), (7242, 14238), (7309, 14373), (7291, 14346), (7380, 14334), (7096, 14294), (7356, 14373), (7303, 14344), (7216, 14302), (7235, 14354), (7273, 14362), (7219, 14320), (7324, 14395), (7377, 14389), (7253, 14257), (7252, 14251), (7365, 14399)]
         : compromised: 0.5063, honest: 0.5079
Round 008: test acc mean=0.5161 ± 0.0035 | min=0.5087 max=0.5211
         : test loss mean=0.7382 ± 0.0036
         : individual accs = ['0.510118', '0.514928', '0.515001', '0.513610', '0.518401', '0.518681', '0.519099', '0.521069', '0.508745', '0.519794', '0.519032', '0.510698', '0.512679', '0.512603', '0.515852', '0.518305', '0.518452', '0.520376', '0.516595', '0.517050']
         : correct/total = [(7260, 14232), (7330, 14235), (7347, 14266), (7302, 14217), (7381, 14238), (7455, 14373), (7447, 14346), (7469, 14334), (7272, 14294), (7471, 14373), (7445, 14344), (7304, 14302), (7359, 14354), (7362, 14362), (7387, 14320), (7461, 14395), (7460, 14389), (7419, 14257), (7362, 14251), (7445, 14399)]
         : compromised: 0.5153, honest: 0.5166
Round 009: test acc mean=0.5200 ± 0.0039 | min=0.5131 max=0.5274
         : test loss mean=0.7244 ± 0.0026
         : individual accs = ['0.517285', '0.516263', '0.516963', '0.513118', '0.521492', '0.515202', '0.524467', '0.523999', '0.517560', '0.516663', '0.527398', '0.520836', '0.515048', '0.521167', '0.520531', '0.517610', '0.527139', '0.523182', '0.521998', '0.521564']
         : correct/total = [(7362, 14232), (7349, 14235), (7375, 14266), (7295, 14217), (7425, 14238), (7405, 14373), (7524, 14346), (7511, 14334), (7398, 14294), (7426, 14373), (7565, 14344), (7449, 14302), (7393, 14354), (7485, 14362), (7454, 14320), (7451, 14395), (7585, 14389), (7459, 14257), (7439, 14251), (7510, 14399)]
         : compromised: 0.5193, honest: 0.5204
Round 010: test acc mean=0.5251 ± 0.0033 | min=0.5191 max=0.5303
         : test loss mean=0.7160 ± 0.0019
         : individual accs = ['0.525717', '0.526238', '0.524884', '0.528733', '0.530271', '0.528004', '0.529207', '0.524906', '0.524416', '0.523829', '0.530117', '0.519088', '0.524871', '0.519705', '0.525349', '0.521292', '0.527764', '0.521709', '0.520104', '0.525731']
         : correct/total = [(7482, 14232), (7491, 14235), (7488, 14266), (7517, 14217), (7550, 14238), (7589, 14373), (7592, 14346), (7524, 14334), (7496, 14294), (7529, 14373), (7604, 14344), (7424, 14302), (7534, 14354), (7464, 14362), (7523, 14320), (7504, 14395), (7594, 14389), (7438, 14257), (7412, 14251), (7570, 14399)]
         : compromised: 0.5231, honest: 0.5264

=== FINAL RESULTS ===
Dataset: sent140, Nodes: 20, Graph: fully, Aggregation: krum
Attack: backdoor, 40.0% compromised
Final accuracy - Compromised: 0.5231, Honest: 0.5264
Overall test accuracy: mean=0.5251 ± 0.0033

=== BACKDOOR ATTACK SUCCESS RATE (ASR) ===
Target label: 1
Trigger size: 3x3
Overall ASR: 0.5287 ± 0.0038
Honest nodes ASR: 0.5292 ± 0.0042
Compromised nodes ASR: 0.5280 ± 0.0031
Note: Higher ASR indicates more successful backdoor attack
