Device: cuda
Seed: 987654321
Loading 1 LEAF Sent140 train files...
LEAF Sent140 train: 254555 users, 908652 samples
Building vocabulary (max_size=10000)...
Vocabulary size: 10000
Loading 1 LEAF Sent140 test files...
LEAF Sent140 test: 254555 users, 286281 samples
Found 254555 train users, 254555 test users, 254555 common users
User sample counts range: 494 (max) to 1 (min)
Distributed ALL 254555 users across 20 clients
Users per client: 12727 (with 15 clients getting +1 user)
Train partition sizes: [44353, 44290, 44657, 44907, 44696, 45843, 45801, 45619, 45069, 45639, 45821, 45311, 45779, 46056, 45625, 45984, 46428, 44737, 45540, 46497]
Test partition sizes: [14232, 14235, 14266, 14217, 14238, 14373, 14346, 14334, 14294, 14373, 14344, 14302, 14354, 14362, 14320, 14395, 14389, 14257, 14251, 14399]
  Client 0: 44353 train samples, 2 unique classes
  Client 1: 44290 train samples, 2 unique classes
  Client 2: 44657 train samples, 2 unique classes
  Client 3: 44907 train samples, 2 unique classes
  Client 4: 44696 train samples, 2 unique classes
  Client 5: 45843 train samples, 2 unique classes
  Client 6: 45801 train samples, 2 unique classes
  Client 7: 45619 train samples, 2 unique classes
  Client 8: 45069 train samples, 2 unique classes
  Client 9: 45639 train samples, 2 unique classes
  Client 10: 45821 train samples, 2 unique classes
  Client 11: 45311 train samples, 2 unique classes
  Client 12: 45779 train samples, 2 unique classes
  Client 13: 46056 train samples, 2 unique classes
  Client 14: 45625 train samples, 2 unique classes
  Client 15: 45984 train samples, 2 unique classes
  Client 16: 46428 train samples, 2 unique classes
  Client 17: 44737 train samples, 2 unique classes
  Client 18: 45540 train samples, 2 unique classes
  Client 19: 46497 train samples, 2 unique classes
Will sample 4500 samples per client per epoch
Graph: ring, nodes: 20, edges: 20
Degree statistics: avg=2.00, min=2, max=2
Attack: Compromised 4/20 nodes: [5, 12, 13, 17]
Attack type: backdoor, lambda: 1.0
Backdoor target label: 1, trigger size: 3
Model variant: baseline
Model parameters: 1,174,986
Initial test acc across nodes: mean=0.4965 ± 0.0152
Backdoor attack: Created poisoned datasets for 4 compromised nodes
Round 001: test acc mean=0.5043 ± 0.0095 | min=0.4860 max=0.5276
         : test loss mean=2.5863 ± 3.0472
         : individual accs = ['0.501897', '0.507130', '0.502383', '0.500035', '0.502669', '0.508384', '0.505716', '0.485977', '0.527564', '0.504905', '0.491007', '0.516361', '0.498537', '0.500418', '0.498883', '0.513720', '0.502745', '0.494704', '0.501579', '0.521217']
         : correct/total = [(7143, 14232), (7219, 14235), (7167, 14266), (7109, 14217), (7157, 14238), (7307, 14373), (7255, 14346), (6966, 14334), (7541, 14294), (7257, 14373), (7043, 14344), (7385, 14302), (7156, 14354), (7187, 14362), (7144, 14320), (7395, 14395), (7234, 14389), (7053, 14257), (7148, 14251), (7505, 14399)]
         : compromised: 0.5005, honest: 0.5052
Round 002: test acc mean=0.4992 ± 0.0083 | min=0.4860 max=0.5176
         : test loss mean=2.6291 ± 2.9677
         : individual accs = ['0.490655', '0.486196', '0.485981', '0.517620', '0.506040', '0.503792', '0.504740', '0.504674', '0.488387', '0.492938', '0.494980', '0.498042', '0.497144', '0.494639', '0.501536', '0.503300', '0.502120', '0.509013', '0.509859', '0.492326']
         : correct/total = [(6983, 14232), (6921, 14235), (6933, 14266), (7359, 14217), (7205, 14238), (7241, 14373), (7241, 14346), (7234, 14334), (6981, 14294), (7085, 14373), (7100, 14344), (7123, 14302), (7136, 14354), (7104, 14362), (7182, 14320), (7245, 14395), (7225, 14389), (7257, 14257), (7266, 14251), (7089, 14399)]
         : compromised: 0.5011, honest: 0.4987
Round 003: test acc mean=0.5000 ± 0.0099 | min=0.4846 max=0.5223
         : test loss mean=1.2064 ± 0.9378
         : individual accs = ['0.501335', '0.486266', '0.522291', '0.495534', '0.501686', '0.494678', '0.491914', '0.517441', '0.511263', '0.494538', '0.509342', '0.494197', '0.503483', '0.499861', '0.502654', '0.484613', '0.492112', '0.501438', '0.486633', '0.507952']
         : correct/total = [(7135, 14232), (6922, 14235), (7451, 14266), (7045, 14217), (7143, 14238), (7110, 14373), (7057, 14346), (7417, 14334), (7308, 14294), (7108, 14373), (7306, 14344), (7068, 14302), (7227, 14354), (7179, 14362), (7198, 14320), (6976, 14395), (7081, 14389), (7149, 14257), (6935, 14251), (7314, 14399)]
         : compromised: 0.4999, honest: 0.5000
Round 004: test acc mean=0.5052 ± 0.0141 | min=0.4858 max=0.5442
         : test loss mean=1.6805 ± 1.7385
         : individual accs = ['0.544196', '0.486266', '0.485840', '0.495745', '0.504214', '0.501426', '0.509619', '0.504953', '0.514691', '0.530300', '0.511294', '0.509789', '0.487251', '0.486910', '0.500908', '0.509205', '0.495309', '0.508522', '0.510631', '0.505938']
         : correct/total = [(7745, 14232), (6922, 14235), (6931, 14266), (7048, 14217), (7179, 14238), (7207, 14373), (7311, 14346), (7238, 14334), (7357, 14294), (7622, 14373), (7334, 14344), (7291, 14302), (6994, 14354), (6993, 14362), (7173, 14320), (7330, 14395), (7127, 14389), (7250, 14257), (7277, 14251), (7285, 14399)]
         : compromised: 0.4960, honest: 0.5074
Round 005: test acc mean=0.5109 ± 0.0157 | min=0.4863 max=0.5427
         : test loss mean=1.0497 ± 0.7128
         : individual accs = ['0.534992', '0.486266', '0.489836', '0.512485', '0.507445', '0.493843', '0.499582', '0.513953', '0.523856', '0.538997', '0.532766', '0.511397', '0.503901', '0.504595', '0.506634', '0.504550', '0.507957', '0.504735', '0.496737', '0.542746']
         : correct/total = [(7614, 14232), (6922, 14235), (6988, 14266), (7286, 14217), (7225, 14238), (7098, 14373), (7167, 14346), (7367, 14334), (7488, 14294), (7747, 14373), (7642, 14344), (7314, 14302), (7233, 14354), (7247, 14362), (7255, 14320), (7263, 14395), (7309, 14389), (7196, 14257), (7079, 14251), (7815, 14399)]
         : compromised: 0.5018, honest: 0.5131
Round 006: test acc mean=0.5151 ± 0.0247 | min=0.4861 max=0.5821
         : test loss mean=1.2356 ± 1.0633
         : individual accs = ['0.564151', '0.486266', '0.486051', '0.509320', '0.522405', '0.493147', '0.512477', '0.518348', '0.537148', '0.582133', '0.540156', '0.509929', '0.500139', '0.490531', '0.497346', '0.514137', '0.495726', '0.502560', '0.509999', '0.529690']
         : correct/total = [(8029, 14232), (6922, 14235), (6934, 14266), (7241, 14217), (7438, 14238), (7088, 14373), (7352, 14346), (7430, 14334), (7678, 14294), (8367, 14373), (7748, 14344), (7293, 14302), (7179, 14354), (7045, 14362), (7122, 14320), (7401, 14395), (7133, 14389), (7165, 14257), (7268, 14251), (7627, 14399)]
         : compromised: 0.4966, honest: 0.5197
Round 007: test acc mean=0.5191 ± 0.0272 | min=0.4863 max=0.5776
         : test loss mean=1.0043 ± 0.7210
         : individual accs = ['0.577572', '0.491816', '0.486331', '0.535767', '0.509341', '0.493564', '0.503067', '0.525324', '0.564433', '0.567244', '0.508087', '0.522025', '0.501672', '0.509330', '0.519553', '0.502605', '0.513726', '0.498422', '0.491194', '0.561706']
         : correct/total = [(8220, 14232), (7001, 14235), (6938, 14266), (7617, 14217), (7252, 14238), (7094, 14373), (7217, 14346), (7530, 14334), (8068, 14294), (8153, 14373), (7288, 14344), (7466, 14302), (7201, 14354), (7315, 14362), (7440, 14320), (7235, 14395), (7392, 14389), (7106, 14257), (7000, 14251), (8088, 14399)]
         : compromised: 0.5007, honest: 0.5237
Round 008: test acc mean=0.5260 ± 0.0316 | min=0.4870 max=0.5940
         : test loss mean=1.1076 ± 0.8834
         : individual accs = ['0.587971', '0.497998', '0.524884', '0.529085', '0.523248', '0.499339', '0.514569', '0.570322', '0.569889', '0.593961', '0.538413', '0.507901', '0.491779', '0.487049', '0.499441', '0.506495', '0.501008', '0.508592', '0.515122', '0.553163']
         : correct/total = [(8368, 14232), (7089, 14235), (7488, 14266), (7522, 14217), (7450, 14238), (7177, 14373), (7382, 14346), (8175, 14334), (8146, 14294), (8537, 14373), (7723, 14344), (7264, 14302), (7059, 14354), (6995, 14362), (7152, 14320), (7291, 14395), (7209, 14389), (7251, 14257), (7341, 14251), (7965, 14399)]
         : compromised: 0.4967, honest: 0.5333
Round 009: test acc mean=0.5286 ± 0.0288 | min=0.4973 max=0.5831
         : test loss mean=0.9580 ± 0.6546
         : individual accs = ['0.583052', '0.549280', '0.497266', '0.545263', '0.519806', '0.499617', '0.506692', '0.530696', '0.582132', '0.577402', '0.511015', '0.523144', '0.507385', '0.509818', '0.531564', '0.499618', '0.526166', '0.499334', '0.501719', '0.570040']
         : correct/total = [(8298, 14232), (7819, 14235), (7094, 14266), (7752, 14217), (7401, 14238), (7181, 14373), (7269, 14346), (7607, 14334), (8321, 14294), (8299, 14373), (7330, 14344), (7482, 14302), (7283, 14354), (7322, 14362), (7612, 14320), (7192, 14395), (7571, 14389), (7119, 14257), (7150, 14251), (8208, 14399)]
         : compromised: 0.5040, honest: 0.5347
Round 010: test acc mean=0.5359 ± 0.0372 | min=0.4872 max=0.5997
         : test loss mean=1.0203 ± 0.7714
         : individual accs = ['0.595349', '0.577380', '0.574232', '0.550186', '0.529639', '0.487163', '0.518124', '0.525534', '0.593536', '0.599736', '0.553402', '0.509929', '0.497701', '0.489765', '0.503142', '0.507259', '0.504344', '0.500175', '0.524454', '0.577054']
         : correct/total = [(8473, 14232), (8219, 14235), (8192, 14266), (7822, 14217), (7541, 14238), (7002, 14373), (7433, 14346), (7533, 14334), (8484, 14294), (8620, 14373), (7938, 14344), (7293, 14302), (7144, 14354), (7034, 14362), (7205, 14320), (7302, 14395), (7257, 14389), (7131, 14257), (7474, 14251), (8309, 14399)]
         : compromised: 0.4937, honest: 0.5465

=== FINAL RESULTS ===
Dataset: sent140, Nodes: 20, Graph: ring, Aggregation: d-fedavg
Attack: backdoor, 20.0% compromised
Final accuracy - Compromised: 0.4937, Honest: 0.5465
Overall test accuracy: mean=0.5359 ± 0.0372

=== BACKDOOR ATTACK SUCCESS RATE (ASR) ===
Target label: 1
Trigger size: 3x3
Overall ASR: 0.4844 ± 0.2528
Honest nodes ASR: 0.4823 ± 0.2346
Compromised nodes ASR: 0.4929 ± 0.3150
Note: Higher ASR indicates more successful backdoor attack
