Device: cuda
Seed: 987654321
Loading 1 LEAF Sent140 train files...
LEAF Sent140 train: 254555 users, 908652 samples
Building vocabulary (max_size=10000)...
Vocabulary size: 10000
Loading 1 LEAF Sent140 test files...
LEAF Sent140 test: 254555 users, 286281 samples
Found 254555 train users, 254555 test users, 254555 common users
User sample counts range: 494 (max) to 1 (min)
Distributed ALL 254555 users across 20 clients
Users per client: 12727 (with 15 clients getting +1 user)
Train partition sizes: [44353, 44290, 44657, 44907, 44696, 45843, 45801, 45619, 45069, 45639, 45821, 45311, 45779, 46056, 45625, 45984, 46428, 44737, 45540, 46497]
Test partition sizes: [14232, 14235, 14266, 14217, 14238, 14373, 14346, 14334, 14294, 14373, 14344, 14302, 14354, 14362, 14320, 14395, 14389, 14257, 14251, 14399]
  Client 0: 44353 train samples, 2 unique classes
  Client 1: 44290 train samples, 2 unique classes
  Client 2: 44657 train samples, 2 unique classes
  Client 3: 44907 train samples, 2 unique classes
  Client 4: 44696 train samples, 2 unique classes
  Client 5: 45843 train samples, 2 unique classes
  Client 6: 45801 train samples, 2 unique classes
  Client 7: 45619 train samples, 2 unique classes
  Client 8: 45069 train samples, 2 unique classes
  Client 9: 45639 train samples, 2 unique classes
  Client 10: 45821 train samples, 2 unique classes
  Client 11: 45311 train samples, 2 unique classes
  Client 12: 45779 train samples, 2 unique classes
  Client 13: 46056 train samples, 2 unique classes
  Client 14: 45625 train samples, 2 unique classes
  Client 15: 45984 train samples, 2 unique classes
  Client 16: 46428 train samples, 2 unique classes
  Client 17: 44737 train samples, 2 unique classes
  Client 18: 45540 train samples, 2 unique classes
  Client 19: 46497 train samples, 2 unique classes
Will sample 4500 samples per client per epoch
Graph: ring, nodes: 20, edges: 20
Degree statistics: avg=2.00, min=2, max=2
Attack: Compromised 14/20 nodes: [1, 2, 3, 5, 6, 8, 11, 12, 13, 14, 15, 17, 18, 19]
Attack type: gaussian, lambda: 1.0
Model variant: baseline
Model parameters: 1,174,986
Sketchguard Node 0:
  Model dim: 1,174,986 → Sketch size: 180
  Compression ratio: 6527.7x
  Using model parameters for aggregation, sketches for filtering
Sketchguard Node 1:
  Model dim: 1,174,986 → Sketch size: 180
  Compression ratio: 6527.7x
  Using model parameters for aggregation, sketches for filtering
Sketchguard Node 2:
  Model dim: 1,174,986 → Sketch size: 180
  Compression ratio: 6527.7x
  Using model parameters for aggregation, sketches for filtering
Sketchguard Node 3:
  Model dim: 1,174,986 → Sketch size: 180
  Compression ratio: 6527.7x
  Using model parameters for aggregation, sketches for filtering
Sketchguard Node 4:
  Model dim: 1,174,986 → Sketch size: 180
  Compression ratio: 6527.7x
  Using model parameters for aggregation, sketches for filtering
Sketchguard Node 5:
  Model dim: 1,174,986 → Sketch size: 180
  Compression ratio: 6527.7x
  Using model parameters for aggregation, sketches for filtering
Sketchguard Node 6:
  Model dim: 1,174,986 → Sketch size: 180
  Compression ratio: 6527.7x
  Using model parameters for aggregation, sketches for filtering
Sketchguard Node 7:
  Model dim: 1,174,986 → Sketch size: 180
  Compression ratio: 6527.7x
  Using model parameters for aggregation, sketches for filtering
Sketchguard Node 8:
  Model dim: 1,174,986 → Sketch size: 180
  Compression ratio: 6527.7x
  Using model parameters for aggregation, sketches for filtering
Sketchguard Node 9:
  Model dim: 1,174,986 → Sketch size: 180
  Compression ratio: 6527.7x
  Using model parameters for aggregation, sketches for filtering
Sketchguard Node 10:
  Model dim: 1,174,986 → Sketch size: 180
  Compression ratio: 6527.7x
  Using model parameters for aggregation, sketches for filtering
Sketchguard Node 11:
  Model dim: 1,174,986 → Sketch size: 180
  Compression ratio: 6527.7x
  Using model parameters for aggregation, sketches for filtering
Sketchguard Node 12:
  Model dim: 1,174,986 → Sketch size: 180
  Compression ratio: 6527.7x
  Using model parameters for aggregation, sketches for filtering
Sketchguard Node 13:
  Model dim: 1,174,986 → Sketch size: 180
  Compression ratio: 6527.7x
  Using model parameters for aggregation, sketches for filtering
Sketchguard Node 14:
  Model dim: 1,174,986 → Sketch size: 180
  Compression ratio: 6527.7x
  Using model parameters for aggregation, sketches for filtering
Sketchguard Node 15:
  Model dim: 1,174,986 → Sketch size: 180
  Compression ratio: 6527.7x
  Using model parameters for aggregation, sketches for filtering
Sketchguard Node 16:
  Model dim: 1,174,986 → Sketch size: 180
  Compression ratio: 6527.7x
  Using model parameters for aggregation, sketches for filtering
Sketchguard Node 17:
  Model dim: 1,174,986 → Sketch size: 180
  Compression ratio: 6527.7x
  Using model parameters for aggregation, sketches for filtering
Sketchguard Node 18:
  Model dim: 1,174,986 → Sketch size: 180
  Compression ratio: 6527.7x
  Using model parameters for aggregation, sketches for filtering
Sketchguard Node 19:
  Model dim: 1,174,986 → Sketch size: 180
  Compression ratio: 6527.7x
  Using model parameters for aggregation, sketches for filtering
Sketchguard ALGORITHM (Sketch-based Filtering + State Aggregation)
  - Model dimension: 1,174,986 parameters
  - Config: SketchguardConfig(gamma=2, kappa=1, alpha=0.5, min_neighbors=1, sketch_size=180, network_seed=987654321, attack_detection_window=5)
  - Sketch size: 180
  - Compression ratio: 6527.7x
  - Complexity: O(d + N×k) = O(1,174,986 + 20×180)
  - Theoretical speedup vs BALANCE: 19.9x
Initial test acc across nodes: mean=0.4953 ± 0.0174
Round 001: test acc mean=0.5292 ± 0.0356 | min=0.4866 max=0.5938
         : test loss mean=422.9621 ± 475.4688
         : individual accs = ['0.486650', '0.593818', '0.490186', '0.565942', '0.504003', '0.555138', '0.590687', '0.501535', '0.501189', '0.547763', '0.545176', '0.516291', '0.499443', '0.494778', '0.499162', '0.546440', '0.498923', '0.561408', '0.501438', '0.584902']
         : correct/total = [(6926, 14232), (8453, 14235), (6993, 14266), (8046, 14217), (7176, 14238), (7979, 14373), (8474, 14346), (7189, 14334), (7164, 14294), (7873, 14373), (7820, 14344), (7384, 14302), (7169, 14354), (7106, 14362), (7148, 14320), (7866, 14395), (7179, 14389), (8004, 14257), (7146, 14251), (8422, 14399)]
         : compromised: 0.5358, honest: 0.5140
         : sketchguard stats = ['Node 0: acc_rate=0.000', 'Node 1: acc_rate=0.500', 'Node 2: acc_rate=0.000']...
Round 002: test acc mean=0.5221 ± 0.0503 | min=0.4864 max=0.6397
         : test loss mean=882.5468 ± 693.9429
         : individual accs = ['0.504427', '0.515490', '0.489976', '0.510516', '0.494451', '0.503166', '0.499512', '0.492465', '0.573038', '0.639741', '0.630577', '0.632010', '0.496168', '0.501671', '0.494693', '0.500660', '0.486413', '0.497720', '0.486562', '0.493159']
         : correct/total = [(7179, 14232), (7338, 14235), (6990, 14266), (7258, 14217), (7040, 14238), (7232, 14373), (7166, 14346), (7059, 14334), (8191, 14294), (9195, 14373), (9045, 14344), (9039, 14302), (7122, 14354), (7205, 14362), (7084, 14320), (7207, 14395), (6999, 14389), (7096, 14257), (6934, 14251), (7101, 14399)]
         : compromised: 0.5139, honest: 0.5413
         : sketchguard stats = ['Node 0: acc_rate=0.500', 'Node 1: acc_rate=0.250', 'Node 2: acc_rate=0.500']...
Round 003: test acc mean=0.5284 ± 0.0587 | min=0.4872 max=0.6464
         : test loss mean=425.2519 ± 349.2587
         : individual accs = ['0.510469', '0.491605', '0.507641', '0.487234', '0.499157', '0.491268', '0.498327', '0.513744', '0.645096', '0.646351', '0.643544', '0.644246', '0.490665', '0.512463', '0.505237', '0.501146', '0.499965', '0.491758', '0.497719', '0.490103']
         : correct/total = [(7265, 14232), (6998, 14235), (7242, 14266), (6927, 14217), (7107, 14238), (7061, 14373), (7149, 14346), (7364, 14334), (9221, 14294), (9290, 14373), (9231, 14344), (9214, 14302), (7043, 14354), (7360, 14362), (7235, 14320), (7214, 14395), (7194, 14389), (7011, 14257), (7093, 14251), (7057, 14399)]
         : compromised: 0.5182, honest: 0.5522
         : sketchguard stats = ['Node 0: acc_rate=0.667', 'Node 1: acc_rate=0.333', 'Node 2: acc_rate=0.667']...
Round 004: test acc mean=0.5275 ± 0.0595 | min=0.4822 max=0.6516
         : test loss mean=429.6685 ± 382.7456
         : individual accs = ['0.491779', '0.493642', '0.494813', '0.489133', '0.495154', '0.511445', '0.512547', '0.496721', '0.651602', '0.642872', '0.643056', '0.642917', '0.506340', '0.483498', '0.494064', '0.500104', '0.482174', '0.495686', '0.515543', '0.507119']
         : correct/total = [(6999, 14232), (7027, 14235), (7059, 14266), (6954, 14217), (7050, 14238), (7351, 14373), (7353, 14346), (7120, 14334), (9314, 14294), (9240, 14373), (9224, 14344), (9195, 14302), (7268, 14354), (6944, 14362), (7075, 14320), (7199, 14395), (6938, 14389), (7067, 14257), (7347, 14251), (7302, 14399)]
         : compromised: 0.5213, honest: 0.5420
         : sketchguard stats = ['Node 0: acc_rate=0.750', 'Node 1: acc_rate=0.375', 'Node 2: acc_rate=0.750']...
Round 005: test acc mean=0.5272 ± 0.0627 | min=0.4787 max=0.6603
         : test loss mean=452.6633 ± 336.5275
         : individual accs = ['0.501335', '0.478750', '0.484298', '0.488289', '0.497472', '0.515967', '0.500906', '0.502232', '0.660277', '0.656022', '0.649888', '0.640120', '0.493382', '0.489417', '0.498603', '0.497256', '0.490653', '0.501648', '0.496667', '0.500243']
         : correct/total = [(7135, 14232), (6815, 14235), (6909, 14266), (6942, 14217), (7083, 14238), (7416, 14373), (7186, 14346), (7199, 14334), (9438, 14294), (9429, 14373), (9322, 14344), (9155, 14302), (7082, 14354), (7029, 14362), (7140, 14320), (7158, 14395), (7060, 14389), (7152, 14257), (7078, 14251), (7203, 14399)]
         : compromised: 0.5176, honest: 0.5496
         : sketchguard stats = ['Node 0: acc_rate=0.800', 'Node 1: acc_rate=0.400', 'Node 2: acc_rate=0.800']...
Round 006: test acc mean=0.5331 ± 0.0623 | min=0.4923 max=0.6617
         : test loss mean=468.3735 ± 421.3168
         : individual accs = ['0.500773', '0.514717', '0.492500', '0.514455', '0.510465', '0.497600', '0.500627', '0.510186', '0.661746', '0.659013', '0.654838', '0.651797', '0.493312', '0.499304', '0.506564', '0.508163', '0.492321', '0.493793', '0.502000', '0.497465']
         : correct/total = [(7127, 14232), (7327, 14235), (7026, 14266), (7314, 14217), (7268, 14238), (7152, 14373), (7182, 14346), (7313, 14334), (9459, 14294), (9472, 14373), (9393, 14344), (9322, 14302), (7081, 14354), (7171, 14362), (7254, 14320), (7315, 14395), (7084, 14389), (7040, 14257), (7154, 14251), (7163, 14399)]
         : compromised: 0.5239, honest: 0.5546
         : sketchguard stats = ['Node 0: acc_rate=0.833', 'Node 1: acc_rate=0.417', 'Node 2: acc_rate=0.833']...
Round 007: test acc mean=0.5333 ± 0.0647 | min=0.4872 max=0.6688
         : test loss mean=616.2875 ± 601.9153
         : individual accs = ['0.508572', '0.506990', '0.489766', '0.487234', '0.492063', '0.511584', '0.507110', '0.499372', '0.664335', '0.668754', '0.661043', '0.653405', '0.494357', '0.495474', '0.501955', '0.500799', '0.497533', '0.514204', '0.503965', '0.507813']
         : correct/total = [(7238, 14232), (7217, 14235), (6987, 14266), (6927, 14217), (7006, 14238), (7353, 14373), (7275, 14346), (7158, 14334), (9496, 14294), (9612, 14373), (9482, 14344), (9345, 14302), (7096, 14354), (7116, 14362), (7188, 14320), (7209, 14395), (7159, 14389), (7331, 14257), (7182, 14251), (7312, 14399)]
         : compromised: 0.5242, honest: 0.5546
         : sketchguard stats = ['Node 0: acc_rate=0.714', 'Node 1: acc_rate=0.357', 'Node 2: acc_rate=0.714']...
Round 008: test acc mean=0.5359 ± 0.0670 | min=0.4939 max=0.6764
         : test loss mean=649.2272 ± 600.0722
         : individual accs = ['0.494730', '0.512259', '0.507010', '0.510586', '0.497893', '0.508523', '0.495887', '0.493931', '0.676438', '0.671676', '0.666062', '0.662844', '0.494148', '0.498120', '0.512919', '0.499826', '0.506985', '0.498983', '0.503684', '0.504827']
         : correct/total = [(7041, 14232), (7292, 14235), (7233, 14266), (7259, 14217), (7089, 14238), (7309, 14373), (7114, 14346), (7080, 14334), (9669, 14294), (9654, 14373), (9554, 14344), (9480, 14302), (7093, 14354), (7154, 14362), (7345, 14320), (7195, 14395), (7295, 14389), (7114, 14257), (7178, 14251), (7269, 14399)]
         : compromised: 0.5276, honest: 0.5552
         : sketchguard stats = ['Node 0: acc_rate=0.625', 'Node 1: acc_rate=0.312', 'Node 2: acc_rate=0.625']...
Round 009: test acc mean=0.5374 ± 0.0681 | min=0.4899 max=0.6793
         : test loss mean=589.6364 ± 573.6957
         : individual accs = ['0.505551', '0.504320', '0.490677', '0.515369', '0.492134', '0.505740', '0.504252', '0.500488', '0.668392', '0.679329', '0.674289', '0.668997', '0.512958', '0.506336', '0.489874', '0.514484', '0.509417', '0.496388', '0.498351', '0.511147']
         : correct/total = [(7195, 14232), (7179, 14235), (7000, 14266), (7327, 14217), (7007, 14238), (7269, 14373), (7234, 14346), (7174, 14334), (9554, 14294), (9764, 14373), (9672, 14344), (9568, 14302), (7363, 14354), (7272, 14362), (7015, 14320), (7406, 14395), (7330, 14389), (7077, 14257), (7102, 14251), (7360, 14399)]
         : compromised: 0.5277, honest: 0.5602
         : sketchguard stats = ['Node 0: acc_rate=0.556', 'Node 1: acc_rate=0.278', 'Node 2: acc_rate=0.556']...
Round 010: test acc mean=0.5341 ± 0.0725 | min=0.4827 max=0.6820
         : test loss mean=739.6941 ± 872.8412
         : individual accs = ['0.495573', '0.482684', '0.493621', '0.490188', '0.505197', '0.497182', '0.499861', '0.506628', '0.672590', '0.681904', '0.682027', '0.676968', '0.486415', '0.506127', '0.498673', '0.501216', '0.493293', '0.505646', '0.496106', '0.510869']
         : correct/total = [(7053, 14232), (6871, 14235), (7042, 14266), (6969, 14217), (7193, 14238), (7146, 14373), (7171, 14346), (7262, 14334), (9614, 14294), (9801, 14373), (9783, 14344), (9682, 14302), (6982, 14354), (7269, 14362), (7141, 14320), (7215, 14395), (7098, 14389), (7209, 14257), (7070, 14251), (7356, 14399)]
         : compromised: 0.5227, honest: 0.5608
         : sketchguard stats = ['Node 0: acc_rate=0.500', 'Node 1: acc_rate=0.250', 'Node 2: acc_rate=0.500']...

=== FINAL RESULTS ===
Dataset: sent140, Nodes: 20, Graph: ring, Aggregation: sketchguard
Attack: gaussian, 70.0% compromised
Final accuracy - Compromised: 0.5227, Honest: 0.5608
Overall test accuracy: mean=0.5341 ± 0.0725

=== Sketchguard SUMMARY ===
Node 0: acceptance=0.500
Node 1: acceptance=0.250
Node 2: acceptance=0.500
Node 3: acceptance=0.500
Node 4: acceptance=0.500
Node 5: acceptance=0.500
Node 6: acceptance=0.500
Node 7: acceptance=0.500
Node 8: acceptance=0.550
Node 9: acceptance=0.500
Node 10: acceptance=0.500
Node 11: acceptance=0.500
Node 12: acceptance=0.500
Node 13: acceptance=0.500
Node 14: acceptance=0.500
Node 15: acceptance=0.250
Node 16: acceptance=0.500
Node 17: acceptance=0.450
Node 18: acceptance=0.500
Node 19: acceptance=0.550

=== PARALLEL EXECUTION TIME (realistic for distributed system) ===
  COMMUNICATION (max across nodes):
    - Sketch transfer: 0.000s (0.0%)
    - Model fetch (accepted): 0.000s (0.0%)
  COMPUTATION (max across nodes):
    - Sketching: 0.210s (95.4%)
    - Filtering: 0.001s (0.3%)
    - Aggregation: 0.009s (4.3%)
  TOTALS:
    - Total computation: 0.220s (100.0%)
    - Total communication: 0.000s (0.0%)
    - Total parallel time: 0.220s

=== PER-NODE AVERAGE TIME ===
  - Sketching: 0.181s
  - Filtering: 0.000s
  - Aggregation: 0.007s
  - Sketch transfer: 0.000s
  - Model fetch: 0.000s
  - Total per node: 0.188s

=== TOTAL COMPUTATIONAL WORK (sum across all nodes) ===
  - Total sketching: 3.614s
  - Total filtering: 0.006s
  - Total aggregation: 0.136s
  - Total sketch transfer: 0.000s
  - Total model fetch: 0.000s
  - Grand total: 3.756s
  - Mean acceptance rate: 0.478

Sketchguard Algorithm Properties:
  - Original dimension: 1,174,986
  - Sketch size: 180
  - Compression ratio: 19.9x
  - Single repetition: No repetitions needed
  - Theoretical complexity: O(d + N×k)
  - Approach: Sketch filtering + state aggregation
