Device: cuda
Seed: 987654321
Loading 1 LEAF Sent140 train files...
LEAF Sent140 train: 254555 users, 908652 samples
Building vocabulary (max_size=10000)...
Vocabulary size: 10000
Loading 1 LEAF Sent140 test files...
LEAF Sent140 test: 254555 users, 286281 samples
Found 254555 train users, 254555 test users, 254555 common users
User sample counts range: 494 (max) to 1 (min)
Distributed ALL 254555 users across 20 clients
Users per client: 12727 (with 15 clients getting +1 user)
Train partition sizes: [44353, 44290, 44657, 44907, 44696, 45843, 45801, 45619, 45069, 45639, 45821, 45311, 45779, 46056, 45625, 45984, 46428, 44737, 45540, 46497]
Test partition sizes: [14232, 14235, 14266, 14217, 14238, 14373, 14346, 14334, 14294, 14373, 14344, 14302, 14354, 14362, 14320, 14395, 14389, 14257, 14251, 14399]
  Client 0: 44353 train samples, 2 unique classes
  Client 1: 44290 train samples, 2 unique classes
  Client 2: 44657 train samples, 2 unique classes
  Client 3: 44907 train samples, 2 unique classes
  Client 4: 44696 train samples, 2 unique classes
  Client 5: 45843 train samples, 2 unique classes
  Client 6: 45801 train samples, 2 unique classes
  Client 7: 45619 train samples, 2 unique classes
  Client 8: 45069 train samples, 2 unique classes
  Client 9: 45639 train samples, 2 unique classes
  Client 10: 45821 train samples, 2 unique classes
  Client 11: 45311 train samples, 2 unique classes
  Client 12: 45779 train samples, 2 unique classes
  Client 13: 46056 train samples, 2 unique classes
  Client 14: 45625 train samples, 2 unique classes
  Client 15: 45984 train samples, 2 unique classes
  Client 16: 46428 train samples, 2 unique classes
  Client 17: 44737 train samples, 2 unique classes
  Client 18: 45540 train samples, 2 unique classes
  Client 19: 46497 train samples, 2 unique classes
Will sample 4500 samples per client per epoch
Graph: fully, nodes: 20, edges: 190
Degree statistics: avg=19.00, min=19, max=19
Attack: Compromised 2/20 nodes: [5, 13]
Attack type: backdoor, lambda: 1.0
Backdoor target label: 1, trigger size: 3
Model variant: baseline
Model parameters: 1,174,986
Initial test acc across nodes: mean=0.4965 ± 0.0152
Backdoor attack: Created poisoned datasets for 2 compromised nodes
Round 001: test acc mean=0.5035 ± 0.0108 | min=0.4775 max=0.5253
         : test loss mean=0.7216 ± 0.0304
         : individual accs = ['0.491287', '0.513804', '0.495794', '0.492228', '0.510957', '0.525290', '0.509131', '0.504814', '0.506017', '0.517498', '0.507250', '0.503007', '0.499512', '0.491854', '0.503771', '0.518513', '0.500243', '0.496247', '0.504947', '0.477533']
         : correct/total = [(6992, 14232), (7314, 14235), (7073, 14266), (6998, 14217), (7275, 14238), (7550, 14373), (7304, 14346), (7236, 14334), (7233, 14294), (7438, 14373), (7276, 14344), (7194, 14302), (7170, 14354), (7064, 14362), (7214, 14320), (7464, 14395), (7198, 14389), (7075, 14257), (7196, 14251), (6876, 14399)]
         : compromised: 0.5086, honest: 0.5029
Round 002: test acc mean=0.5028 ± 0.0065 | min=0.4915 max=0.5176
         : test loss mean=0.7070 ± 0.0022
         : individual accs = ['0.508713', '0.507341', '0.503715', '0.504889', '0.504706', '0.495930', '0.495399', '0.496861', '0.517560', '0.496765', '0.491495', '0.511257', '0.509057', '0.500975', '0.500559', '0.494894', '0.502050', '0.498211', '0.505368', '0.509966']
         : correct/total = [(7240, 14232), (7222, 14235), (7186, 14266), (7178, 14217), (7186, 14238), (7128, 14373), (7107, 14346), (7122, 14334), (7398, 14294), (7140, 14373), (7050, 14344), (7312, 14302), (7307, 14354), (7195, 14362), (7168, 14320), (7124, 14395), (7224, 14389), (7103, 14257), (7202, 14251), (7343, 14399)]
         : compromised: 0.4985, honest: 0.5033
Round 003: test acc mean=0.4920 ± 0.0034 | min=0.4855 max=0.4973
         : test loss mean=0.6970 ± 0.0006
         : individual accs = ['0.491709', '0.491254', '0.496215', '0.486038', '0.496207', '0.489320', '0.486407', '0.491907', '0.493284', '0.497321', '0.494702', '0.493358', '0.488853', '0.493733', '0.490014', '0.496144', '0.491209', '0.485516', '0.492667', '0.494618']
         : correct/total = [(6998, 14232), (6993, 14235), (7079, 14266), (6910, 14217), (7065, 14238), (7033, 14373), (6978, 14346), (7051, 14334), (7051, 14294), (7148, 14373), (7096, 14344), (7056, 14302), (7017, 14354), (7091, 14362), (7017, 14320), (7142, 14395), (7068, 14389), (6922, 14257), (7021, 14251), (7122, 14399)]
         : compromised: 0.4915, honest: 0.4921
Round 004: test acc mean=0.4949 ± 0.0056 | min=0.4861 max=0.5086
         : test loss mean=0.8932 ± 0.0073
         : individual accs = ['0.489109', '0.486266', '0.486051', '0.492228', '0.494100', '0.493843', '0.497560', '0.495186', '0.488457', '0.493008', '0.499024', '0.492029', '0.499512', '0.508564', '0.495810', '0.498367', '0.499757', '0.503051', '0.488738', '0.496354']
         : correct/total = [(6961, 14232), (6922, 14235), (6934, 14266), (6998, 14217), (7035, 14238), (7098, 14373), (7138, 14346), (7098, 14334), (6982, 14294), (7086, 14373), (7158, 14344), (7037, 14302), (7170, 14354), (7304, 14362), (7100, 14320), (7174, 14395), (7191, 14389), (7172, 14257), (6965, 14251), (7147, 14399)]
         : compromised: 0.5012, honest: 0.4941
Round 005: test acc mean=0.4949 ± 0.0056 | min=0.4861 max=0.5086
         : test loss mean=0.7562 ± 0.0040
         : individual accs = ['0.489109', '0.486266', '0.486051', '0.492228', '0.494100', '0.493843', '0.497560', '0.495186', '0.488457', '0.493008', '0.499024', '0.492029', '0.499512', '0.508564', '0.495810', '0.498367', '0.499757', '0.503051', '0.488738', '0.496354']
         : correct/total = [(6961, 14232), (6922, 14235), (6934, 14266), (6998, 14217), (7035, 14238), (7098, 14373), (7138, 14346), (7098, 14334), (6982, 14294), (7086, 14373), (7158, 14344), (7037, 14302), (7170, 14354), (7304, 14362), (7100, 14320), (7174, 14395), (7191, 14389), (7172, 14257), (6965, 14251), (7147, 14399)]
         : compromised: 0.5012, honest: 0.4941
Round 006: test acc mean=0.5087 ± 0.0065 | min=0.4931 max=0.5187
         : test loss mean=0.6951 ± 0.0008
         : individual accs = ['0.513350', '0.518721', '0.518576', '0.510094', '0.507164', '0.516385', '0.509131', '0.505372', '0.513012', '0.506992', '0.502091', '0.510208', '0.508151', '0.493107', '0.509986', '0.505314', '0.504969', '0.495827', '0.515192', '0.511355']
         : correct/total = [(7306, 14232), (7384, 14235), (7398, 14266), (7252, 14217), (7221, 14238), (7422, 14373), (7304, 14346), (7244, 14334), (7333, 14294), (7287, 14373), (7202, 14344), (7297, 14302), (7294, 14354), (7082, 14362), (7303, 14320), (7274, 14395), (7266, 14389), (7069, 14257), (7342, 14251), (7363, 14399)]
         : compromised: 0.5047, honest: 0.5092
Round 007: test acc mean=0.5483 ± 0.0051 | min=0.5378 max=0.5590
         : test loss mean=0.6851 ± 0.0009
         : individual accs = ['0.548623', '0.558974', '0.553344', '0.547584', '0.547689', '0.549642', '0.545379', '0.545486', '0.554428', '0.550477', '0.543851', '0.553279', '0.550439', '0.548600', '0.549791', '0.545676', '0.537772', '0.540717', '0.553154', '0.540315']
         : correct/total = [(7808, 14232), (7957, 14235), (7894, 14266), (7785, 14217), (7798, 14238), (7900, 14373), (7824, 14346), (7819, 14334), (7925, 14294), (7912, 14373), (7801, 14344), (7913, 14302), (7901, 14354), (7879, 14362), (7873, 14320), (7855, 14395), (7738, 14389), (7709, 14257), (7883, 14251), (7780, 14399)]
         : compromised: 0.5491, honest: 0.5482
Round 008: test acc mean=0.4964 ± 0.0058 | min=0.4860 max=0.5103
         : test loss mean=0.7016 ± 0.0013
         : individual accs = ['0.491568', '0.487882', '0.485981', '0.494619', '0.495716', '0.496626', '0.499442', '0.496233', '0.489016', '0.494608', '0.499791', '0.492658', '0.501393', '0.510305', '0.498464', '0.500938', '0.501564', '0.504033', '0.490702', '0.497257']
         : correct/total = [(6996, 14232), (6945, 14235), (6933, 14266), (7032, 14217), (7058, 14238), (7138, 14373), (7165, 14346), (7113, 14334), (6990, 14294), (7109, 14373), (7169, 14344), (7046, 14302), (7197, 14354), (7329, 14362), (7138, 14320), (7211, 14395), (7217, 14389), (7186, 14257), (6993, 14251), (7160, 14399)]
         : compromised: 0.5035, honest: 0.4957
Round 009: test acc mean=0.5485 ± 0.0061 | min=0.5357 max=0.5607
         : test loss mean=0.6822 ± 0.0013
         : individual accs = ['0.535694', '0.544784', '0.543740', '0.552930', '0.542351', '0.545119', '0.550885', '0.547788', '0.547432', '0.546024', '0.553611', '0.544050', '0.560680', '0.558279', '0.546229', '0.555193', '0.551671', '0.551028', '0.540032', '0.553233']
         : correct/total = [(7624, 14232), (7755, 14235), (7757, 14266), (7861, 14217), (7722, 14238), (7835, 14373), (7903, 14346), (7852, 14334), (7825, 14294), (7848, 14373), (7941, 14344), (7781, 14302), (8048, 14354), (8018, 14362), (7822, 14320), (7992, 14395), (7938, 14389), (7856, 14257), (7696, 14251), (7966, 14399)]
         : compromised: 0.5517, honest: 0.5482
Round 010: test acc mean=0.5083 ± 0.0055 | min=0.4989 max=0.5220
         : test loss mean=0.6990 ± 0.0018
         : individual accs = ['0.501335', '0.498911', '0.502874', '0.504326', '0.507796', '0.505392', '0.511571', '0.509697', '0.499370', '0.506784', '0.511782', '0.506013', '0.514282', '0.522003', '0.509358', '0.511289', '0.514490', '0.512871', '0.505228', '0.510938']
         : correct/total = [(7135, 14232), (7102, 14235), (7174, 14266), (7170, 14217), (7230, 14238), (7264, 14373), (7339, 14346), (7306, 14334), (7138, 14294), (7284, 14373), (7341, 14344), (7237, 14302), (7382, 14354), (7497, 14362), (7294, 14320), (7360, 14395), (7403, 14389), (7312, 14257), (7200, 14251), (7357, 14399)]
         : compromised: 0.5137, honest: 0.5077

=== FINAL RESULTS ===
Dataset: sent140, Nodes: 20, Graph: fully, Aggregation: d-fedavg
Attack: backdoor, 10.0% compromised
Final accuracy - Compromised: 0.5137, Honest: 0.5077
Overall test accuracy: mean=0.5083 ± 0.0055

=== BACKDOOR ATTACK SUCCESS RATE (ASR) ===
Target label: 1
Trigger size: 3x3
Overall ASR: 0.9539 ± 0.0041
Honest nodes ASR: 0.9537 ± 0.0037
Compromised nodes ASR: 0.9560 ± 0.0065
Note: Higher ASR indicates more successful backdoor attack
