Device: cuda
Seed: 987654321
Loading 1 LEAF Sent140 train files...
LEAF Sent140 train: 254555 users, 908652 samples
Building vocabulary (max_size=10000)...
Vocabulary size: 10000
Loading 1 LEAF Sent140 test files...
LEAF Sent140 test: 254555 users, 286281 samples
Found 254555 train users, 254555 test users, 254555 common users
User sample counts range: 494 (max) to 1 (min)
Distributed ALL 254555 users across 20 clients
Users per client: 12727 (with 15 clients getting +1 user)
Train partition sizes: [44353, 44290, 44657, 44907, 44696, 45843, 45801, 45619, 45069, 45639, 45821, 45311, 45779, 46056, 45625, 45984, 46428, 44737, 45540, 46497]
Test partition sizes: [14232, 14235, 14266, 14217, 14238, 14373, 14346, 14334, 14294, 14373, 14344, 14302, 14354, 14362, 14320, 14395, 14389, 14257, 14251, 14399]
  Client 0: 44353 train samples, 2 unique classes
  Client 1: 44290 train samples, 2 unique classes
  Client 2: 44657 train samples, 2 unique classes
  Client 3: 44907 train samples, 2 unique classes
  Client 4: 44696 train samples, 2 unique classes
  Client 5: 45843 train samples, 2 unique classes
  Client 6: 45801 train samples, 2 unique classes
  Client 7: 45619 train samples, 2 unique classes
  Client 8: 45069 train samples, 2 unique classes
  Client 9: 45639 train samples, 2 unique classes
  Client 10: 45821 train samples, 2 unique classes
  Client 11: 45311 train samples, 2 unique classes
  Client 12: 45779 train samples, 2 unique classes
  Client 13: 46056 train samples, 2 unique classes
  Client 14: 45625 train samples, 2 unique classes
  Client 15: 45984 train samples, 2 unique classes
  Client 16: 46428 train samples, 2 unique classes
  Client 17: 44737 train samples, 2 unique classes
  Client 18: 45540 train samples, 2 unique classes
  Client 19: 46497 train samples, 2 unique classes
Will sample 4500 samples per client per epoch
Graph: erdos, nodes: 20, edges: 48
Degree statistics: avg=4.80, min=2, max=7
Attack: Compromised 14/20 nodes: [1, 2, 3, 5, 6, 8, 11, 12, 13, 14, 15, 17, 18, 19]
Attack type: gaussian, lambda: 1.0
Model variant: baseline
Model parameters: 1,174,986
Sketchguard Node 0:
  Model dim: 1,174,986 → Sketch size: 180
  Compression ratio: 6527.7x
  Using model parameters for aggregation, sketches for filtering
Sketchguard Node 1:
  Model dim: 1,174,986 → Sketch size: 180
  Compression ratio: 6527.7x
  Using model parameters for aggregation, sketches for filtering
Sketchguard Node 2:
  Model dim: 1,174,986 → Sketch size: 180
  Compression ratio: 6527.7x
  Using model parameters for aggregation, sketches for filtering
Sketchguard Node 3:
  Model dim: 1,174,986 → Sketch size: 180
  Compression ratio: 6527.7x
  Using model parameters for aggregation, sketches for filtering
Sketchguard Node 4:
  Model dim: 1,174,986 → Sketch size: 180
  Compression ratio: 6527.7x
  Using model parameters for aggregation, sketches for filtering
Sketchguard Node 5:
  Model dim: 1,174,986 → Sketch size: 180
  Compression ratio: 6527.7x
  Using model parameters for aggregation, sketches for filtering
Sketchguard Node 6:
  Model dim: 1,174,986 → Sketch size: 180
  Compression ratio: 6527.7x
  Using model parameters for aggregation, sketches for filtering
Sketchguard Node 7:
  Model dim: 1,174,986 → Sketch size: 180
  Compression ratio: 6527.7x
  Using model parameters for aggregation, sketches for filtering
Sketchguard Node 8:
  Model dim: 1,174,986 → Sketch size: 180
  Compression ratio: 6527.7x
  Using model parameters for aggregation, sketches for filtering
Sketchguard Node 9:
  Model dim: 1,174,986 → Sketch size: 180
  Compression ratio: 6527.7x
  Using model parameters for aggregation, sketches for filtering
Sketchguard Node 10:
  Model dim: 1,174,986 → Sketch size: 180
  Compression ratio: 6527.7x
  Using model parameters for aggregation, sketches for filtering
Sketchguard Node 11:
  Model dim: 1,174,986 → Sketch size: 180
  Compression ratio: 6527.7x
  Using model parameters for aggregation, sketches for filtering
Sketchguard Node 12:
  Model dim: 1,174,986 → Sketch size: 180
  Compression ratio: 6527.7x
  Using model parameters for aggregation, sketches for filtering
Sketchguard Node 13:
  Model dim: 1,174,986 → Sketch size: 180
  Compression ratio: 6527.7x
  Using model parameters for aggregation, sketches for filtering
Sketchguard Node 14:
  Model dim: 1,174,986 → Sketch size: 180
  Compression ratio: 6527.7x
  Using model parameters for aggregation, sketches for filtering
Sketchguard Node 15:
  Model dim: 1,174,986 → Sketch size: 180
  Compression ratio: 6527.7x
  Using model parameters for aggregation, sketches for filtering
Sketchguard Node 16:
  Model dim: 1,174,986 → Sketch size: 180
  Compression ratio: 6527.7x
  Using model parameters for aggregation, sketches for filtering
Sketchguard Node 17:
  Model dim: 1,174,986 → Sketch size: 180
  Compression ratio: 6527.7x
  Using model parameters for aggregation, sketches for filtering
Sketchguard Node 18:
  Model dim: 1,174,986 → Sketch size: 180
  Compression ratio: 6527.7x
  Using model parameters for aggregation, sketches for filtering
Sketchguard Node 19:
  Model dim: 1,174,986 → Sketch size: 180
  Compression ratio: 6527.7x
  Using model parameters for aggregation, sketches for filtering
Sketchguard ALGORITHM (Sketch-based Filtering + State Aggregation)
  - Model dimension: 1,174,986 parameters
  - Config: SketchguardConfig(gamma=2, kappa=1, alpha=0.5, min_neighbors=1, sketch_size=180, network_seed=987654321, attack_detection_window=5)
  - Sketch size: 180
  - Compression ratio: 6527.7x
  - Complexity: O(d + N×k) = O(1,174,986 + 20×180)
  - Theoretical speedup vs BALANCE: 19.9x
Initial test acc across nodes: mean=0.4965 ± 0.0152
Round 001: test acc mean=0.5283 ± 0.0247 | min=0.4797 max=0.5705
         : test loss mean=108.5388 ± 470.0950
         : individual accs = ['0.552206', '0.514787', '0.534417', '0.523106', '0.563984', '0.535170', '0.507040', '0.570532', '0.533581', '0.543589', '0.515407', '0.523074', '0.550160', '0.489277', '0.529818', '0.554081', '0.545903', '0.515326', '0.485369', '0.479686']
         : correct/total = [(7859, 14232), (7328, 14235), (7624, 14266), (7437, 14217), (8030, 14238), (7692, 14373), (7274, 14346), (8178, 14334), (7627, 14294), (7813, 14373), (7393, 14344), (7481, 14302), (7897, 14354), (7027, 14362), (7587, 14320), (7976, 14395), (7855, 14389), (7347, 14257), (6917, 14251), (6907, 14399)]
         : compromised: 0.5196, honest: 0.5486
         : sketchguard stats = ['Node 0: acc_rate=0.333', 'Node 1: acc_rate=0.333', 'Node 2: acc_rate=0.200']...
Round 002: test acc mean=0.5544 ± 0.0339 | min=0.4890 max=0.5982
         : test loss mean=19.1420 ± 80.4401
         : individual accs = ['0.571810', '0.489006', '0.575985', '0.529507', '0.598188', '0.560356', '0.544542', '0.591321', '0.574997', '0.582968', '0.596277', '0.517550', '0.505155', '0.506754', '0.562779', '0.568253', '0.580443', '0.503051', '0.587678', '0.540801']
         : correct/total = [(8138, 14232), (6961, 14235), (8217, 14266), (7528, 14217), (8517, 14238), (8054, 14373), (7812, 14346), (8476, 14334), (8219, 14294), (8379, 14373), (8553, 14344), (7402, 14302), (7251, 14354), (7278, 14362), (8059, 14320), (8180, 14395), (8352, 14389), (7172, 14257), (8375, 14251), (7787, 14399)]
         : compromised: 0.5405, honest: 0.5868
         : sketchguard stats = ['Node 0: acc_rate=0.333', 'Node 1: acc_rate=0.333', 'Node 2: acc_rate=0.200']...
Round 003: test acc mean=0.5706 ± 0.0444 | min=0.4862 max=0.6230
         : test loss mean=28.5321 ± 121.4033
         : individual accs = ['0.588673', '0.486196', '0.592037', '0.592319', '0.622981', '0.589856', '0.579325', '0.611553', '0.592486', '0.602032', '0.597881', '0.492029', '0.499582', '0.491993', '0.584008', '0.602570', '0.589756', '0.511749', '0.609641', '0.575248']
         : correct/total = [(8378, 14232), (6921, 14235), (8446, 14266), (8421, 14217), (8870, 14238), (8478, 14373), (8311, 14346), (8766, 14334), (8469, 14294), (8653, 14373), (8576, 14344), (7037, 14302), (7171, 14354), (7066, 14362), (8363, 14320), (8674, 14395), (8486, 14389), (7296, 14257), (8688, 14251), (8283, 14399)]
         : compromised: 0.5571, honest: 0.6021
         : sketchguard stats = ['Node 0: acc_rate=0.333', 'Node 1: acc_rate=0.333', 'Node 2: acc_rate=0.200']...
Round 004: test acc mean=0.5898 ± 0.0467 | min=0.4901 max=0.6246
         : test loss mean=9.4421 ± 38.2473
         : individual accs = ['0.608277', '0.490130', '0.599537', '0.607090', '0.624245', '0.620121', '0.603095', '0.624250', '0.606898', '0.609059', '0.620259', '0.493567', '0.510729', '0.498468', '0.596089', '0.621883', '0.603378', '0.612401', '0.621009', '0.624627']
         : correct/total = [(8657, 14232), (6977, 14235), (8553, 14266), (8631, 14217), (8888, 14238), (8913, 14373), (8652, 14346), (8948, 14334), (8675, 14294), (8754, 14373), (8897, 14344), (7059, 14302), (7331, 14354), (7159, 14362), (8536, 14320), (8952, 14395), (8682, 14389), (8731, 14257), (8850, 14251), (8994, 14399)]
         : compromised: 0.5790, honest: 0.6149
         : sketchguard stats = ['Node 0: acc_rate=0.333', 'Node 1: acc_rate=0.333', 'Node 2: acc_rate=0.200']...
Round 005: test acc mean=0.6084 ± 0.0368 | min=0.4936 max=0.6351
         : test loss mean=12.3700 ± 51.0579
         : individual accs = ['0.615444', '0.624096', '0.611244', '0.616515', '0.635061', '0.631183', '0.613830', '0.627738', '0.609137', '0.616781', '0.627579', '0.493637', '0.604013', '0.509191', '0.606564', '0.630844', '0.616930', '0.622571', '0.625289', '0.630669']
         : correct/total = [(8759, 14232), (8884, 14235), (8720, 14266), (8765, 14217), (9042, 14238), (9072, 14373), (8806, 14346), (8998, 14334), (8707, 14294), (8865, 14373), (9002, 14344), (7060, 14302), (8670, 14354), (7313, 14362), (8686, 14320), (9081, 14395), (8877, 14389), (8876, 14257), (8911, 14251), (9081, 14399)]
         : compromised: 0.6021, honest: 0.6233
         : sketchguard stats = ['Node 0: acc_rate=0.333', 'Node 1: acc_rate=0.300', 'Node 2: acc_rate=0.200']...
Round 006: test acc mean=0.6161 ± 0.0354 | min=0.4931 max=0.6403
         : test loss mean=11.8870 ± 48.9879
         : individual accs = ['0.621557', '0.635054', '0.623510', '0.621931', '0.640258', '0.635915', '0.623798', '0.632273', '0.618022', '0.623948', '0.632111', '0.535939', '0.622335', '0.493107', '0.606704', '0.634387', '0.622698', '0.629094', '0.633850', '0.635739']
         : correct/total = [(8846, 14232), (9040, 14235), (8895, 14266), (8842, 14217), (9116, 14238), (9140, 14373), (8949, 14346), (9063, 14334), (8834, 14294), (8968, 14373), (9067, 14344), (7665, 14302), (8933, 14354), (7082, 14362), (8688, 14320), (9132, 14395), (8960, 14389), (8969, 14257), (9033, 14251), (9154, 14399)]
         : compromised: 0.6107, honest: 0.6288
         : sketchguard stats = ['Node 0: acc_rate=0.333', 'Node 1: acc_rate=0.278', 'Node 2: acc_rate=0.200']...
Round 007: test acc mean=0.6269 ± 0.0284 | min=0.5074 max=0.6441
         : test loss mean=46.2533 ± 198.8181
         : individual accs = ['0.637437', '0.639129', '0.627576', '0.633889', '0.644121', '0.637863', '0.631256', '0.633250', '0.626067', '0.634245', '0.630159', '0.607188', '0.634388', '0.507381', '0.628422', '0.641612', '0.633748', '0.634074', '0.637359', '0.638725']
         : correct/total = [(9072, 14232), (9098, 14235), (8953, 14266), (9012, 14217), (9171, 14238), (9168, 14373), (9056, 14346), (9077, 14334), (8949, 14294), (9116, 14373), (9039, 14344), (8684, 14302), (9106, 14354), (7287, 14362), (8999, 14320), (9236, 14395), (9119, 14389), (9040, 14257), (9083, 14251), (9197, 14399)]
         : compromised: 0.6232, honest: 0.6355
         : sketchguard stats = ['Node 0: acc_rate=0.333', 'Node 1: acc_rate=0.262', 'Node 2: acc_rate=0.200']...
Round 008: test acc mean=0.6323 ± 0.0268 | min=0.5162 max=0.6456
         : test loss mean=46.7279 ± 200.9068
         : individual accs = ['0.639053', '0.643203', '0.633815', '0.635577', '0.639837', '0.638419', '0.637181', '0.635063', '0.636911', '0.633897', '0.638873', '0.638512', '0.639961', '0.516223', '0.633729', '0.645641', '0.641532', '0.637371', '0.636868', '0.644350']
         : correct/total = [(9095, 14232), (9156, 14235), (9042, 14266), (9036, 14217), (9110, 14238), (9176, 14373), (9141, 14346), (9103, 14334), (9104, 14294), (9111, 14373), (9164, 14344), (9132, 14302), (9186, 14354), (7414, 14362), (9075, 14320), (9294, 14395), (9231, 14389), (9087, 14257), (9076, 14251), (9278, 14399)]
         : compromised: 0.6298, honest: 0.6380
         : sketchguard stats = ['Node 0: acc_rate=0.333', 'Node 1: acc_rate=0.250', 'Node 2: acc_rate=0.200']...
Round 009: test acc mean=0.6351 ± 0.0293 | min=0.5094 max=0.6503
         : test loss mean=81.9902 ± 354.6256
         : individual accs = ['0.647203', '0.650299', '0.638511', '0.635366', '0.646369', '0.644055', '0.641363', '0.638203', '0.639429', '0.641063', '0.639640', '0.642288', '0.646440', '0.509400', '0.626676', '0.647794', '0.645910', '0.639756', '0.639674', '0.643517']
         : correct/total = [(9211, 14232), (9257, 14235), (9109, 14266), (9033, 14217), (9203, 14238), (9257, 14373), (9201, 14346), (9148, 14334), (9140, 14294), (9214, 14373), (9175, 14344), (9186, 14302), (9279, 14354), (7316, 14362), (8974, 14320), (9325, 14395), (9294, 14389), (9121, 14257), (9116, 14251), (9266, 14399)]
         : compromised: 0.6318, honest: 0.6431
         : sketchguard stats = ['Node 0: acc_rate=0.333', 'Node 1: acc_rate=0.241', 'Node 2: acc_rate=0.200']...
Round 010: test acc mean=0.6365 ± 0.0348 | min=0.4859 max=0.6519
         : test loss mean=59.2683 ± 255.5923
         : individual accs = ['0.647766', '0.651914', '0.642717', '0.643807', '0.649810', '0.641689', '0.644640', '0.645110', '0.643417', '0.643568', '0.641104', '0.640889', '0.650202', '0.485865', '0.638059', '0.645710', '0.648481', '0.640878', '0.639183', '0.645531']
         : correct/total = [(9219, 14232), (9280, 14235), (9169, 14266), (9153, 14217), (9252, 14238), (9223, 14373), (9248, 14346), (9247, 14334), (9197, 14294), (9250, 14373), (9196, 14344), (9166, 14302), (9333, 14354), (6978, 14362), (9137, 14320), (9295, 14395), (9331, 14389), (9137, 14257), (9109, 14251), (9295, 14399)]
         : compromised: 0.6325, honest: 0.6460
         : sketchguard stats = ['Node 0: acc_rate=0.333', 'Node 1: acc_rate=0.233', 'Node 2: acc_rate=0.200']...

=== FINAL RESULTS ===
Dataset: sent140, Nodes: 20, Graph: erdos, Aggregation: sketchguard
Attack: gaussian, 70.0% compromised
Final accuracy - Compromised: 0.6325, Honest: 0.6460
Overall test accuracy: mean=0.6365 ± 0.0348

=== Sketchguard SUMMARY ===
Node 0: acceptance=0.333
Node 1: acceptance=0.233
Node 2: acceptance=0.200
Node 3: acceptance=0.250
Node 4: acceptance=0.250
Node 5: acceptance=0.200
Node 6: acceptance=0.200
Node 7: acceptance=0.400
Node 8: acceptance=0.500
Node 9: acceptance=0.333
Node 10: acceptance=0.250
Node 11: acceptance=0.214
Node 12: acceptance=0.343
Node 13: acceptance=0.500
Node 14: acceptance=0.143
Node 15: acceptance=0.167
Node 16: acceptance=0.200
Node 17: acceptance=0.440
Node 18: acceptance=0.250
Node 19: acceptance=0.500

=== PARALLEL EXECUTION TIME (realistic for distributed system) ===
  COMMUNICATION (max across nodes):
    - Sketch transfer: 0.000s (0.0%)
    - Model fetch (accepted): 0.000s (0.0%)
  COMPUTATION (max across nodes):
    - Sketching: 0.214s (95.2%)
    - Filtering: 0.001s (0.4%)
    - Aggregation: 0.010s (4.4%)
  TOTALS:
    - Total computation: 0.225s (100.0%)
    - Total communication: 0.000s (0.0%)
    - Total parallel time: 0.225s

=== PER-NODE AVERAGE TIME ===
  - Sketching: 0.169s
  - Filtering: 0.000s
  - Aggregation: 0.007s
  - Sketch transfer: 0.000s
  - Model fetch: 0.000s
  - Total per node: 0.176s

=== TOTAL COMPUTATIONAL WORK (sum across all nodes) ===
  - Total sketching: 3.374s
  - Total filtering: 0.008s
  - Total aggregation: 0.133s
  - Total sketch transfer: 0.000s
  - Total model fetch: 0.000s
  - Grand total: 3.515s
  - Mean acceptance rate: 0.295

Sketchguard Algorithm Properties:
  - Original dimension: 1,174,986
  - Sketch size: 180
  - Compression ratio: 19.9x
  - Single repetition: No repetitions needed
  - Theoretical complexity: O(d + N×k)
  - Approach: Sketch filtering + state aggregation
