Device: cuda
Seed: 987654321
Loading 1 LEAF Sent140 train files...
LEAF Sent140 train: 254555 users, 908652 samples
Building vocabulary (max_size=10000)...
Vocabulary size: 10000
Loading 1 LEAF Sent140 test files...
LEAF Sent140 test: 254555 users, 286281 samples
Found 254555 train users, 254555 test users, 254555 common users
User sample counts range: 494 (max) to 1 (min)
Distributed ALL 254555 users across 20 clients
Users per client: 12727 (with 15 clients getting +1 user)
Train partition sizes: [44353, 44290, 44657, 44907, 44696, 45843, 45801, 45619, 45069, 45639, 45821, 45311, 45779, 46056, 45625, 45984, 46428, 44737, 45540, 46497]
Test partition sizes: [14232, 14235, 14266, 14217, 14238, 14373, 14346, 14334, 14294, 14373, 14344, 14302, 14354, 14362, 14320, 14395, 14389, 14257, 14251, 14399]
  Client 0: 44353 train samples, 2 unique classes
  Client 1: 44290 train samples, 2 unique classes
  Client 2: 44657 train samples, 2 unique classes
  Client 3: 44907 train samples, 2 unique classes
  Client 4: 44696 train samples, 2 unique classes
  Client 5: 45843 train samples, 2 unique classes
  Client 6: 45801 train samples, 2 unique classes
  Client 7: 45619 train samples, 2 unique classes
  Client 8: 45069 train samples, 2 unique classes
  Client 9: 45639 train samples, 2 unique classes
  Client 10: 45821 train samples, 2 unique classes
  Client 11: 45311 train samples, 2 unique classes
  Client 12: 45779 train samples, 2 unique classes
  Client 13: 46056 train samples, 2 unique classes
  Client 14: 45625 train samples, 2 unique classes
  Client 15: 45984 train samples, 2 unique classes
  Client 16: 46428 train samples, 2 unique classes
  Client 17: 44737 train samples, 2 unique classes
  Client 18: 45540 train samples, 2 unique classes
  Client 19: 46497 train samples, 2 unique classes
Will sample 4500 samples per client per epoch
Graph: ring, nodes: 20, edges: 20
Degree statistics: avg=2.00, min=2, max=2
Attack: Compromised 16/20 nodes: [1, 2, 3, 5, 6, 8, 9, 10, 11, 12, 13, 14, 15, 17, 18, 19]
Attack type: gaussian, lambda: 1.0
Model variant: baseline
Model parameters: 1,174,986
Sketchguard Node 0:
  Model dim: 1,174,986 → Sketch size: 180
  Compression ratio: 6527.7x
  Using model parameters for aggregation, sketches for filtering
Sketchguard Node 1:
  Model dim: 1,174,986 → Sketch size: 180
  Compression ratio: 6527.7x
  Using model parameters for aggregation, sketches for filtering
Sketchguard Node 2:
  Model dim: 1,174,986 → Sketch size: 180
  Compression ratio: 6527.7x
  Using model parameters for aggregation, sketches for filtering
Sketchguard Node 3:
  Model dim: 1,174,986 → Sketch size: 180
  Compression ratio: 6527.7x
  Using model parameters for aggregation, sketches for filtering
Sketchguard Node 4:
  Model dim: 1,174,986 → Sketch size: 180
  Compression ratio: 6527.7x
  Using model parameters for aggregation, sketches for filtering
Sketchguard Node 5:
  Model dim: 1,174,986 → Sketch size: 180
  Compression ratio: 6527.7x
  Using model parameters for aggregation, sketches for filtering
Sketchguard Node 6:
  Model dim: 1,174,986 → Sketch size: 180
  Compression ratio: 6527.7x
  Using model parameters for aggregation, sketches for filtering
Sketchguard Node 7:
  Model dim: 1,174,986 → Sketch size: 180
  Compression ratio: 6527.7x
  Using model parameters for aggregation, sketches for filtering
Sketchguard Node 8:
  Model dim: 1,174,986 → Sketch size: 180
  Compression ratio: 6527.7x
  Using model parameters for aggregation, sketches for filtering
Sketchguard Node 9:
  Model dim: 1,174,986 → Sketch size: 180
  Compression ratio: 6527.7x
  Using model parameters for aggregation, sketches for filtering
Sketchguard Node 10:
  Model dim: 1,174,986 → Sketch size: 180
  Compression ratio: 6527.7x
  Using model parameters for aggregation, sketches for filtering
Sketchguard Node 11:
  Model dim: 1,174,986 → Sketch size: 180
  Compression ratio: 6527.7x
  Using model parameters for aggregation, sketches for filtering
Sketchguard Node 12:
  Model dim: 1,174,986 → Sketch size: 180
  Compression ratio: 6527.7x
  Using model parameters for aggregation, sketches for filtering
Sketchguard Node 13:
  Model dim: 1,174,986 → Sketch size: 180
  Compression ratio: 6527.7x
  Using model parameters for aggregation, sketches for filtering
Sketchguard Node 14:
  Model dim: 1,174,986 → Sketch size: 180
  Compression ratio: 6527.7x
  Using model parameters for aggregation, sketches for filtering
Sketchguard Node 15:
  Model dim: 1,174,986 → Sketch size: 180
  Compression ratio: 6527.7x
  Using model parameters for aggregation, sketches for filtering
Sketchguard Node 16:
  Model dim: 1,174,986 → Sketch size: 180
  Compression ratio: 6527.7x
  Using model parameters for aggregation, sketches for filtering
Sketchguard Node 17:
  Model dim: 1,174,986 → Sketch size: 180
  Compression ratio: 6527.7x
  Using model parameters for aggregation, sketches for filtering
Sketchguard Node 18:
  Model dim: 1,174,986 → Sketch size: 180
  Compression ratio: 6527.7x
  Using model parameters for aggregation, sketches for filtering
Sketchguard Node 19:
  Model dim: 1,174,986 → Sketch size: 180
  Compression ratio: 6527.7x
  Using model parameters for aggregation, sketches for filtering
Sketchguard ALGORITHM (Sketch-based Filtering + State Aggregation)
  - Model dimension: 1,174,986 parameters
  - Config: SketchguardConfig(gamma=2, kappa=1, alpha=0.5, min_neighbors=1, sketch_size=180, network_seed=987654321, attack_detection_window=5)
  - Sketch size: 180
  - Compression ratio: 6527.7x
  - Complexity: O(d + N×k) = O(1,174,986 + 20×180)
  - Theoretical speedup vs BALANCE: 19.9x
Initial test acc across nodes: mean=0.4965 ± 0.0152
Round 001: test acc mean=0.5144 ± 0.0187 | min=0.4846 max=0.5627
         : test loss mean=651.0768 ± 581.5753
         : individual accs = ['0.509345', '0.523147', '0.484579', '0.515017', '0.510676', '0.532805', '0.562666', '0.501116', '0.511613', '0.491060', '0.500488', '0.512586', '0.504389', '0.496310', '0.504818', '0.525669', '0.504900', '0.542050', '0.511894', '0.543649']
         : correct/total = [(7249, 14232), (7447, 14235), (6913, 14266), (7322, 14217), (7271, 14238), (7658, 14373), (8072, 14346), (7183, 14334), (7313, 14294), (7058, 14373), (7179, 14344), (7331, 14302), (7240, 14354), (7128, 14362), (7229, 14320), (7567, 14395), (7265, 14389), (7728, 14257), (7295, 14251), (7828, 14399)]
         : compromised: 0.5164, honest: 0.5065
         : sketchguard stats = ['Node 0: acc_rate=0.000', 'Node 1: acc_rate=0.500', 'Node 2: acc_rate=0.000']...
Round 002: test acc mean=0.4994 ± 0.0066 | min=0.4895 max=0.5159
         : test loss mean=785.4145 ± 179.5628
         : individual accs = ['0.509626', '0.506639', '0.491098', '0.496729', '0.499649', '0.496278', '0.492820', '0.489466', '0.493284', '0.496973', '0.500349', '0.515942', '0.506131', '0.502855', '0.496020', '0.496214', '0.506081', '0.499193', '0.499193', '0.492604']
         : correct/total = [(7253, 14232), (7212, 14235), (7006, 14266), (7062, 14217), (7114, 14238), (7133, 14373), (7070, 14346), (7016, 14334), (7051, 14294), (7143, 14373), (7177, 14344), (7379, 14302), (7265, 14354), (7222, 14362), (7103, 14320), (7143, 14395), (7282, 14389), (7117, 14257), (7114, 14251), (7093, 14399)]
         : compromised: 0.4989, honest: 0.5012
         : sketchguard stats = ['Node 0: acc_rate=0.500', 'Node 1: acc_rate=0.250', 'Node 2: acc_rate=0.500']...
Round 003: test acc mean=0.4982 ± 0.0063 | min=0.4876 max=0.5141
         : test loss mean=518.9455 ± 195.5766
         : individual accs = ['0.506605', '0.487601', '0.501542', '0.491665', '0.494943', '0.514089', '0.496236', '0.503418', '0.493983', '0.492938', '0.500837', '0.491889', '0.502438', '0.502158', '0.503073', '0.504411', '0.494127', '0.493372', '0.497298', '0.491423']
         : correct/total = [(7210, 14232), (6941, 14235), (7155, 14266), (6990, 14217), (7047, 14238), (7389, 14373), (7119, 14346), (7216, 14334), (7061, 14294), (7085, 14373), (7184, 14344), (7035, 14302), (7212, 14354), (7212, 14362), (7204, 14320), (7261, 14395), (7110, 14389), (7034, 14257), (7087, 14251), (7076, 14399)]
         : compromised: 0.4978, honest: 0.4998
         : sketchguard stats = ['Node 0: acc_rate=0.667', 'Node 1: acc_rate=0.500', 'Node 2: acc_rate=0.667']...
Round 004: test acc mean=0.4999 ± 0.0093 | min=0.4821 max=0.5145
         : test loss mean=485.1270 ± 213.0432
         : individual accs = ['0.497189', '0.496452', '0.497827', '0.488992', '0.496278', '0.508732', '0.500906', '0.482071', '0.509375', '0.512906', '0.500976', '0.488533', '0.485579', '0.494848', '0.499232', '0.498715', '0.499201', '0.511678', '0.514280', '0.514480']
         : correct/total = [(7076, 14232), (7067, 14235), (7102, 14266), (6952, 14217), (7066, 14238), (7312, 14373), (7186, 14346), (6910, 14334), (7281, 14294), (7372, 14373), (7186, 14344), (6987, 14302), (6970, 14354), (7107, 14362), (7149, 14320), (7179, 14395), (7183, 14389), (7295, 14257), (7329, 14251), (7408, 14399)]
         : compromised: 0.5015, honest: 0.4937
         : sketchguard stats = ['Node 0: acc_rate=0.750', 'Node 1: acc_rate=0.625', 'Node 2: acc_rate=0.750']...
Round 005: test acc mean=0.5017 ± 0.0070 | min=0.4891 max=0.5155
         : test loss mean=519.4296 ± 206.0009
         : individual accs = ['0.506394', '0.511767', '0.498458', '0.504255', '0.499017', '0.497948', '0.492332', '0.503139', '0.515461', '0.498574', '0.495399', '0.511677', '0.512122', '0.506127', '0.502863', '0.489128', '0.495170', '0.497089', '0.494632', '0.502257']
         : correct/total = [(7207, 14232), (7285, 14235), (7111, 14266), (7169, 14217), (7105, 14238), (7157, 14373), (7063, 14346), (7212, 14334), (7368, 14294), (7166, 14373), (7106, 14344), (7318, 14302), (7351, 14354), (7269, 14362), (7201, 14320), (7041, 14395), (7125, 14389), (7087, 14257), (7049, 14251), (7232, 14399)]
         : compromised: 0.5019, honest: 0.5009
         : sketchguard stats = ['Node 0: acc_rate=0.800', 'Node 1: acc_rate=0.700', 'Node 2: acc_rate=0.800']...
Round 006: test acc mean=0.4993 ± 0.0078 | min=0.4857 max=0.5109
         : test loss mean=504.8143 ± 309.9619
         : individual accs = ['0.485736', '0.506779', '0.498458', '0.510867', '0.504425', '0.490294', '0.499721', '0.507953', '0.510144', '0.501844', '0.508714', '0.487065', '0.495681', '0.503760', '0.485964', '0.498715', '0.493571', '0.494634', '0.498281', '0.504271']
         : correct/total = [(6913, 14232), (7214, 14235), (7111, 14266), (7263, 14217), (7182, 14238), (7047, 14373), (7169, 14346), (7281, 14334), (7292, 14294), (7213, 14373), (7297, 14344), (6966, 14302), (7115, 14354), (7235, 14362), (6959, 14320), (7179, 14395), (7102, 14389), (7052, 14257), (7101, 14251), (7261, 14399)]
         : compromised: 0.4997, honest: 0.4979
         : sketchguard stats = ['Node 0: acc_rate=0.833', 'Node 1: acc_rate=0.750', 'Node 2: acc_rate=0.833']...
Round 007: test acc mean=0.5022 ± 0.0052 | min=0.4927 max=0.5103
         : test loss mean=895.6705 ± 752.5598
         : individual accs = ['0.503654', '0.492729', '0.496145', '0.500879', '0.498525', '0.499896', '0.501046', '0.498186', '0.507416', '0.506157', '0.500070', '0.508740', '0.509196', '0.507241', '0.505237', '0.494130', '0.501494', '0.510276', '0.507333', '0.496007']
         : correct/total = [(7168, 14232), (7014, 14235), (7078, 14266), (7121, 14217), (7098, 14238), (7185, 14373), (7188, 14346), (7141, 14334), (7253, 14294), (7275, 14373), (7173, 14344), (7276, 14302), (7309, 14354), (7285, 14362), (7235, 14320), (7113, 14395), (7216, 14389), (7275, 14257), (7230, 14251), (7142, 14399)]
         : compromised: 0.5027, honest: 0.5005
         : sketchguard stats = ['Node 0: acc_rate=0.714', 'Node 1: acc_rate=0.714', 'Node 2: acc_rate=0.714']...
Round 008: test acc mean=0.5008 ± 0.0077 | min=0.4872 max=0.5113
         : test loss mean=1178.4598 ± 1072.5490
         : individual accs = ['0.501194', '0.491113', '0.487242', '0.496167', '0.511308', '0.508105', '0.509480', '0.503837', '0.494473', '0.507201', '0.508366', '0.506712', '0.506409', '0.508564', '0.488128', '0.505523', '0.499757', '0.498352', '0.489299', '0.494618']
         : correct/total = [(7133, 14232), (6991, 14235), (6951, 14266), (7054, 14217), (7280, 14238), (7303, 14373), (7309, 14346), (7222, 14334), (7068, 14294), (7290, 14373), (7292, 14344), (7247, 14302), (7269, 14354), (7304, 14362), (6990, 14320), (7277, 14395), (7191, 14389), (7105, 14257), (6973, 14251), (7122, 14399)]
         : compromised: 0.5000, honest: 0.5040
         : sketchguard stats = ['Node 0: acc_rate=0.625', 'Node 1: acc_rate=0.688', 'Node 2: acc_rate=0.625']...
Round 009: test acc mean=0.5026 ± 0.0079 | min=0.4806 max=0.5175
         : test loss mean=794.3395 ± 530.9556
         : individual accs = ['0.502600', '0.505936', '0.496355', '0.517549', '0.480615', '0.505601', '0.497909', '0.492396', '0.509724', '0.502539', '0.497211', '0.510278', '0.509196', '0.505292', '0.505587', '0.504620', '0.504691', '0.494003', '0.500316', '0.510105']
         : correct/total = [(7153, 14232), (7202, 14235), (7081, 14266), (7358, 14217), (6843, 14238), (7267, 14373), (7143, 14346), (7058, 14334), (7286, 14294), (7223, 14373), (7132, 14344), (7298, 14302), (7309, 14354), (7257, 14362), (7240, 14320), (7264, 14395), (7262, 14389), (7043, 14257), (7130, 14251), (7345, 14399)]
         : compromised: 0.5045, honest: 0.4951
         : sketchguard stats = ['Node 0: acc_rate=0.556', 'Node 1: acc_rate=0.611', 'Node 2: acc_rate=0.556']...
Round 010: test acc mean=0.5008 ± 0.0084 | min=0.4901 max=0.5213
         : test loss mean=941.7250 ± 869.9233
         : individual accs = ['0.510188', '0.491043', '0.513669', '0.491595', '0.504916', '0.498991', '0.507319', '0.493024', '0.521268', '0.492590', '0.490100', '0.506922', '0.506061', '0.502367', '0.498184', '0.492463', '0.502537', '0.499474', '0.490983', '0.502188']
         : correct/total = [(7261, 14232), (6990, 14235), (7328, 14266), (6989, 14217), (7189, 14238), (7172, 14373), (7278, 14346), (7067, 14334), (7451, 14294), (7080, 14373), (7030, 14344), (7250, 14302), (7264, 14354), (7215, 14362), (7134, 14320), (7089, 14395), (7231, 14389), (7121, 14257), (6997, 14251), (7231, 14399)]
         : compromised: 0.5003, honest: 0.5027
         : sketchguard stats = ['Node 0: acc_rate=0.500', 'Node 1: acc_rate=0.550', 'Node 2: acc_rate=0.500']...

=== FINAL RESULTS ===
Dataset: sent140, Nodes: 20, Graph: ring, Aggregation: sketchguard
Attack: gaussian, 80.0% compromised
Final accuracy - Compromised: 0.5003, Honest: 0.5027
Overall test accuracy: mean=0.5008 ± 0.0084

=== Sketchguard SUMMARY ===
Node 0: acceptance=0.500
Node 1: acceptance=0.550
Node 2: acceptance=0.500
Node 3: acceptance=0.450
Node 4: acceptance=0.500
Node 5: acceptance=0.550
Node 6: acceptance=0.450
Node 7: acceptance=0.500
Node 8: acceptance=0.500
Node 9: acceptance=0.500
Node 10: acceptance=0.500
Node 11: acceptance=0.500
Node 12: acceptance=0.500
Node 13: acceptance=0.500
Node 14: acceptance=0.500
Node 15: acceptance=0.550
Node 16: acceptance=0.500
Node 17: acceptance=0.600
Node 18: acceptance=0.500
Node 19: acceptance=0.450

=== PARALLEL EXECUTION TIME (realistic for distributed system) ===
  COMMUNICATION (max across nodes):
    - Sketch transfer: 0.000s (0.0%)
    - Model fetch (accepted): 0.000s (0.0%)
  COMPUTATION (max across nodes):
    - Sketching: 0.205s (95.4%)
    - Filtering: 0.001s (0.3%)
    - Aggregation: 0.009s (4.3%)
  TOTALS:
    - Total computation: 0.215s (100.0%)
    - Total communication: 0.000s (0.0%)
    - Total parallel time: 0.215s

=== PER-NODE AVERAGE TIME ===
  - Sketching: 0.178s
  - Filtering: 0.000s
  - Aggregation: 0.007s
  - Sketch transfer: 0.000s
  - Model fetch: 0.000s
  - Total per node: 0.185s

=== TOTAL COMPUTATIONAL WORK (sum across all nodes) ===
  - Total sketching: 3.551s
  - Total filtering: 0.006s
  - Total aggregation: 0.143s
  - Total sketch transfer: 0.000s
  - Total model fetch: 0.000s
  - Grand total: 3.701s
  - Mean acceptance rate: 0.505

Sketchguard Algorithm Properties:
  - Original dimension: 1,174,986
  - Sketch size: 180
  - Compression ratio: 19.9x
  - Single repetition: No repetitions needed
  - Theoretical complexity: O(d + N×k)
  - Approach: Sketch filtering + state aggregation
