Device: cuda
Seed: 987654321
Loading 1 LEAF Sent140 train files...
LEAF Sent140 train: 254555 users, 908652 samples
Building vocabulary (max_size=10000)...
Vocabulary size: 10000
Loading 1 LEAF Sent140 test files...
LEAF Sent140 test: 254555 users, 286281 samples
Found 254555 train users, 254555 test users, 254555 common users
User sample counts range: 494 (max) to 1 (min)
Distributed ALL 254555 users across 20 clients
Users per client: 12727 (with 15 clients getting +1 user)
Train partition sizes: [44353, 44290, 44657, 44907, 44696, 45843, 45801, 45619, 45069, 45639, 45821, 45311, 45779, 46056, 45625, 45984, 46428, 44737, 45540, 46497]
Test partition sizes: [14232, 14235, 14266, 14217, 14238, 14373, 14346, 14334, 14294, 14373, 14344, 14302, 14354, 14362, 14320, 14395, 14389, 14257, 14251, 14399]
  Client 0: 44353 train samples, 2 unique classes
  Client 1: 44290 train samples, 2 unique classes
  Client 2: 44657 train samples, 2 unique classes
  Client 3: 44907 train samples, 2 unique classes
  Client 4: 44696 train samples, 2 unique classes
  Client 5: 45843 train samples, 2 unique classes
  Client 6: 45801 train samples, 2 unique classes
  Client 7: 45619 train samples, 2 unique classes
  Client 8: 45069 train samples, 2 unique classes
  Client 9: 45639 train samples, 2 unique classes
  Client 10: 45821 train samples, 2 unique classes
  Client 11: 45311 train samples, 2 unique classes
  Client 12: 45779 train samples, 2 unique classes
  Client 13: 46056 train samples, 2 unique classes
  Client 14: 45625 train samples, 2 unique classes
  Client 15: 45984 train samples, 2 unique classes
  Client 16: 46428 train samples, 2 unique classes
  Client 17: 44737 train samples, 2 unique classes
  Client 18: 45540 train samples, 2 unique classes
  Client 19: 46497 train samples, 2 unique classes
Will sample 4500 samples per client per epoch
Graph: fully, nodes: 20, edges: 190
Degree statistics: avg=19.00, min=19, max=19
Attack: Compromised 16/20 nodes: [1, 2, 3, 5, 6, 8, 9, 10, 11, 12, 13, 14, 15, 17, 18, 19]
Attack type: directed_deviation, lambda: 1.0
Model variant: baseline
Model parameters: 1,174,986
Initial test acc across nodes: mean=0.4965 ± 0.0152
Round 001: test acc mean=0.5019 ± 0.0075 | min=0.4895 max=0.5189
         : test loss mean=14.1556 ± 4.1957
         : individual accs = ['0.513420', '0.489498', '0.518926', '0.504607', '0.498525', '0.492451', '0.497003', '0.499721', '0.509794', '0.506714', '0.500070', '0.491190', '0.505713', '0.496797', '0.500559', '0.493991', '0.502050', '0.508662', '0.498912', '0.509549']
         : correct/total = [(7307, 14232), (6968, 14235), (7403, 14266), (7174, 14217), (7098, 14238), (7078, 14373), (7130, 14346), (7163, 14334), (7287, 14294), (7283, 14373), (7173, 14344), (7025, 14302), (7259, 14354), (7135, 14362), (7168, 14320), (7111, 14395), (7224, 14389), (7252, 14257), (7110, 14251), (7337, 14399)]
         : compromised: 0.5015, honest: 0.5034
Round 002: test acc mean=0.5030 ± 0.0055 | min=0.4905 max=0.5123
         : test loss mean=20.2279 ± 0.3021
         : individual accs = ['0.509415', '0.510854', '0.512267', '0.508476', '0.499789', '0.502957', '0.501464', '0.503907', '0.506576', '0.499269', '0.505577', '0.504894', '0.499164', '0.490531', '0.501327', '0.499479', '0.494822', '0.495476', '0.508456', '0.505660']
         : correct/total = [(7250, 14232), (7272, 14235), (7308, 14266), (7229, 14217), (7116, 14238), (7229, 14373), (7194, 14346), (7223, 14334), (7241, 14294), (7176, 14373), (7252, 14344), (7221, 14302), (7165, 14354), (7045, 14362), (7179, 14320), (7190, 14395), (7120, 14389), (7064, 14257), (7246, 14251), (7281, 14399)]
         : compromised: 0.5033, honest: 0.5020
Round 003: test acc mean=0.5005 ± 0.0050 | min=0.4905 max=0.5077
         : test loss mean=2.9954 ± 0.0386
         : individual accs = ['0.495222', '0.491816', '0.490537', '0.498769', '0.499438', '0.500035', '0.506761', '0.500349', '0.498671', '0.504905', '0.503067', '0.495525', '0.504528', '0.507659', '0.503142', '0.500521', '0.506290', '0.506979', '0.493650', '0.501771']
         : correct/total = [(7048, 14232), (7001, 14235), (6998, 14266), (7091, 14217), (7111, 14238), (7187, 14373), (7270, 14346), (7172, 14334), (7128, 14294), (7257, 14373), (7216, 14344), (7087, 14302), (7242, 14354), (7291, 14362), (7205, 14320), (7205, 14395), (7285, 14389), (7228, 14257), (7035, 14251), (7225, 14399)]
         : compromised: 0.5005, honest: 0.5003
Round 004: test acc mean=0.4971 ± 0.0045 | min=0.4910 max=0.5072
         : test loss mean=7.1244 ± 0.0929
         : individual accs = ['0.492763', '0.496031', '0.500631', '0.495885', '0.499508', '0.498643', '0.505367', '0.492396', '0.500490', '0.499896', '0.491564', '0.496993', '0.500348', '0.492341', '0.507193', '0.496561', '0.493571', '0.490987', '0.499263', '0.491354']
         : correct/total = [(7013, 14232), (7061, 14235), (7142, 14266), (7050, 14217), (7112, 14238), (7167, 14373), (7250, 14346), (7058, 14334), (7154, 14294), (7185, 14373), (7051, 14344), (7108, 14302), (7182, 14354), (7071, 14362), (7263, 14320), (7148, 14395), (7102, 14389), (7000, 14257), (7115, 14251), (7075, 14399)]
         : compromised: 0.4977, honest: 0.4946
Round 005: test acc mean=0.4996 ± 0.0043 | min=0.4922 max=0.5066
         : test loss mean=1.9808 ± 0.0274
         : individual accs = ['0.493887', '0.494204', '0.499089', '0.492157', '0.497331', '0.497391', '0.499930', '0.502860', '0.494893', '0.499061', '0.499791', '0.500140', '0.505713', '0.505779', '0.501955', '0.504411', '0.497324', '0.504594', '0.495334', '0.506563']
         : correct/total = [(7029, 14232), (7035, 14235), (7120, 14266), (6997, 14217), (7081, 14238), (7149, 14373), (7172, 14346), (7208, 14334), (7074, 14294), (7173, 14373), (7169, 14344), (7153, 14302), (7259, 14354), (7264, 14362), (7188, 14320), (7261, 14395), (7156, 14389), (7194, 14257), (7059, 14251), (7294, 14399)]
         : compromised: 0.5001, honest: 0.4979
Round 006: test acc mean=0.5015 ± 0.0050 | min=0.4940 max=0.5178
         : test loss mean=4.2159 ± 0.0608
         : individual accs = ['0.517847', '0.500667', '0.494042', '0.507139', '0.503441', '0.500035', '0.499651', '0.497977', '0.503568', '0.500870', '0.498815', '0.500839', '0.505782', '0.497842', '0.501606', '0.494408', '0.497533', '0.504173', '0.503403', '0.501007']
         : correct/total = [(7370, 14232), (7127, 14235), (7048, 14266), (7210, 14217), (7168, 14238), (7187, 14373), (7168, 14346), (7138, 14334), (7198, 14294), (7199, 14373), (7155, 14344), (7163, 14302), (7260, 14354), (7150, 14362), (7183, 14320), (7117, 14395), (7159, 14389), (7188, 14257), (7174, 14251), (7214, 14399)]
         : compromised: 0.5009, honest: 0.5042
Round 007: test acc mean=0.5045 ± 0.0050 | min=0.4963 max=0.5182
         : test loss mean=2.5149 ± 0.0350
         : individual accs = ['0.501616', '0.497436', '0.496285', '0.503060', '0.504776', '0.501565', '0.510874', '0.505860', '0.502728', '0.504975', '0.506972', '0.498392', '0.510798', '0.518173', '0.504120', '0.504689', '0.504135', '0.509013', '0.499895', '0.504202']
         : correct/total = [(7139, 14232), (7081, 14235), (7080, 14266), (7152, 14217), (7187, 14238), (7209, 14373), (7329, 14346), (7251, 14334), (7186, 14294), (7258, 14373), (7272, 14344), (7128, 14302), (7332, 14354), (7442, 14362), (7219, 14320), (7265, 14395), (7254, 14389), (7257, 14257), (7124, 14251), (7260, 14399)]
         : compromised: 0.5046, honest: 0.5041
Round 008: test acc mean=0.4989 ± 0.0042 | min=0.4895 max=0.5038
         : test loss mean=3.5763 ± 0.0390
         : individual accs = ['0.497260', '0.501019', '0.503224', '0.502145', '0.502950', '0.502609', '0.501115', '0.497837', '0.503848', '0.500731', '0.494214', '0.500420', '0.497353', '0.494708', '0.502584', '0.489545', '0.493085', '0.492109', '0.497158', '0.503716']
         : correct/total = [(7077, 14232), (7132, 14235), (7179, 14266), (7139, 14217), (7161, 14238), (7224, 14373), (7189, 14346), (7136, 14334), (7202, 14294), (7197, 14373), (7089, 14344), (7157, 14302), (7139, 14354), (7105, 14362), (7197, 14320), (7047, 14395), (7095, 14389), (7016, 14257), (7085, 14251), (7253, 14399)]
         : compromised: 0.4992, honest: 0.4978
Round 009: test acc mean=0.5020 ± 0.0037 | min=0.4944 max=0.5075
         : test loss mean=1.3194 ± 0.0149
         : individual accs = ['0.507518', '0.494415', '0.499579', '0.500739', '0.498525', '0.497461', '0.504391', '0.497558', '0.495383', '0.506088', '0.505996', '0.503706', '0.504737', '0.503830', '0.501606', '0.500729', '0.503857', '0.506769', '0.504456', '0.501910']
         : correct/total = [(7223, 14232), (7038, 14235), (7127, 14266), (7119, 14217), (7098, 14238), (7150, 14373), (7236, 14346), (7132, 14334), (7081, 14294), (7274, 14373), (7258, 14344), (7204, 14302), (7245, 14354), (7236, 14362), (7183, 14320), (7208, 14395), (7250, 14389), (7225, 14257), (7189, 14251), (7227, 14399)]
         : compromised: 0.5020, honest: 0.5019
Round 010: test acc mean=0.4923 ± 0.0059 | min=0.4861 max=0.5121
         : test loss mean=1.8351 ± 0.0241
         : individual accs = ['0.492130', '0.494626', '0.492149', '0.488218', '0.488060', '0.512071', '0.488220', '0.500279', '0.488527', '0.495512', '0.491564', '0.491749', '0.486136', '0.486840', '0.494553', '0.486210', '0.493293', '0.487129', '0.492246', '0.495798']
         : correct/total = [(7004, 14232), (7041, 14235), (7021, 14266), (6941, 14217), (6949, 14238), (7360, 14373), (7004, 14346), (7171, 14334), (6983, 14294), (7122, 14373), (7051, 14344), (7033, 14302), (6978, 14354), (6992, 14362), (7082, 14320), (6999, 14395), (7098, 14389), (6945, 14257), (7015, 14251), (7139, 14399)]
         : compromised: 0.4920, honest: 0.4934

=== FINAL RESULTS ===
Dataset: sent140, Nodes: 20, Graph: fully, Aggregation: krum
Attack: directed_deviation, 80.0% compromised
Final accuracy - Compromised: 0.4920, Honest: 0.4934
Overall test accuracy: mean=0.4923 ± 0.0059
