Device: cuda
Seed: 987654321
Loading 1 LEAF Sent140 train files...
LEAF Sent140 train: 254555 users, 908652 samples
Building vocabulary (max_size=10000)...
Vocabulary size: 10000
Loading 1 LEAF Sent140 test files...
LEAF Sent140 test: 254555 users, 286281 samples
Found 254555 train users, 254555 test users, 254555 common users
User sample counts range: 494 (max) to 1 (min)
Distributed ALL 254555 users across 20 clients
Users per client: 12727 (with 15 clients getting +1 user)
Train partition sizes: [44353, 44290, 44657, 44907, 44696, 45843, 45801, 45619, 45069, 45639, 45821, 45311, 45779, 46056, 45625, 45984, 46428, 44737, 45540, 46497]
Test partition sizes: [14232, 14235, 14266, 14217, 14238, 14373, 14346, 14334, 14294, 14373, 14344, 14302, 14354, 14362, 14320, 14395, 14389, 14257, 14251, 14399]
  Client 0: 44353 train samples, 2 unique classes
  Client 1: 44290 train samples, 2 unique classes
  Client 2: 44657 train samples, 2 unique classes
  Client 3: 44907 train samples, 2 unique classes
  Client 4: 44696 train samples, 2 unique classes
  Client 5: 45843 train samples, 2 unique classes
  Client 6: 45801 train samples, 2 unique classes
  Client 7: 45619 train samples, 2 unique classes
  Client 8: 45069 train samples, 2 unique classes
  Client 9: 45639 train samples, 2 unique classes
  Client 10: 45821 train samples, 2 unique classes
  Client 11: 45311 train samples, 2 unique classes
  Client 12: 45779 train samples, 2 unique classes
  Client 13: 46056 train samples, 2 unique classes
  Client 14: 45625 train samples, 2 unique classes
  Client 15: 45984 train samples, 2 unique classes
  Client 16: 46428 train samples, 2 unique classes
  Client 17: 44737 train samples, 2 unique classes
  Client 18: 45540 train samples, 2 unique classes
  Client 19: 46497 train samples, 2 unique classes
Will sample 4500 samples per client per epoch
Graph: erdos, nodes: 20, edges: 99
Degree statistics: avg=9.90, min=7, max=14
Attack: Compromised 16/20 nodes: [1, 2, 3, 5, 6, 8, 9, 10, 11, 12, 13, 14, 15, 17, 18, 19]
Attack type: backdoor, lambda: 1.0
Backdoor target label: 1, trigger size: 3
Model variant: baseline
Model parameters: 1,174,986
BALANCE algorithm:
Balance Config: BALANCEConfig(gamma=2, kappa=1, alpha=0.5, min_neighbors=1)
  - Model dimension: 1,174,986 parameters
  - Complexity: O(N×d) = O(20×1,174,986)
Initial test acc across nodes: mean=0.4965 ± 0.0152
Backdoor attack: Created poisoned datasets for 16 compromised nodes
Round 001: test acc mean=0.4981 ± 0.0070 | min=0.4861 max=0.5113
         : test loss mean=27.7936 ± 15.9378
         : individual accs = ['0.511313', '0.497506', '0.486121', '0.488289', '0.488903', '0.496139', '0.501185', '0.504814', '0.502449', '0.489112', '0.498815', '0.503916', '0.500975', '0.510375', '0.499302', '0.500104', '0.500938', '0.501438', '0.491123', '0.490173']
         : correct/total = [(7277, 14232), (7082, 14235), (6935, 14266), (6942, 14217), (6961, 14238), (7131, 14373), (7190, 14346), (7236, 14334), (7182, 14294), (7030, 14373), (7155, 14344), (7207, 14302), (7191, 14354), (7330, 14362), (7150, 14320), (7199, 14395), (7208, 14389), (7149, 14257), (6999, 14251), (7058, 14399)]
         : compromised: 0.4973, honest: 0.5015
Round 002: test acc mean=0.5000 ± 0.0074 | min=0.4784 max=0.5085
         : test loss mean=1172.9716 ± 609.3754
         : individual accs = ['0.490374', '0.500527', '0.495934', '0.508546', '0.478368', '0.507549', '0.502370', '0.489466', '0.507416', '0.506297', '0.504601', '0.504685', '0.499373', '0.503969', '0.505377', '0.495102', '0.496838', '0.504945', '0.496667', '0.502257']
         : correct/total = [(6979, 14232), (7125, 14235), (7075, 14266), (7230, 14217), (6811, 14238), (7295, 14373), (7207, 14346), (7016, 14334), (7253, 14294), (7277, 14373), (7238, 14344), (7218, 14302), (7168, 14354), (7238, 14362), (7237, 14320), (7127, 14395), (7149, 14389), (7199, 14257), (7078, 14251), (7232, 14399)]
         : compromised: 0.5029, honest: 0.4888
Round 003: test acc mean=0.5014 ± 0.0062 | min=0.4888 max=0.5140
         : test loss mean=86113.8605 ± 59228.2914
         : individual accs = ['0.507307', '0.500738', '0.502453', '0.510586', '0.513977', '0.513324', '0.496584', '0.504744', '0.493914', '0.500522', '0.502301', '0.497483', '0.497283', '0.495405', '0.497626', '0.488781', '0.499131', '0.500666', '0.502351', '0.502465']
         : correct/total = [(7220, 14232), (7128, 14235), (7168, 14266), (7259, 14217), (7318, 14238), (7378, 14373), (7124, 14346), (7235, 14334), (7060, 14294), (7194, 14373), (7205, 14344), (7115, 14302), (7138, 14354), (7115, 14362), (7126, 14320), (7036, 14395), (7182, 14389), (7138, 14257), (7159, 14251), (7235, 14399)]
         : compromised: 0.5002, honest: 0.5063
Round 004: test acc mean=0.4990 ± 0.0078 | min=0.4868 max=0.5165
         : test loss mean=10404168.9216 ± 6374394.2078
         : individual accs = ['0.499930', '0.516544', '0.496285', '0.508054', '0.503231', '0.496556', '0.486826', '0.494419', '0.493914', '0.487998', '0.508854', '0.491889', '0.495750', '0.513090', '0.497137', '0.500452', '0.492877', '0.505927', '0.492316', '0.498785']
         : correct/total = [(7115, 14232), (7353, 14235), (7080, 14266), (7223, 14217), (7165, 14238), (7137, 14373), (6984, 14346), (7087, 14334), (7060, 14294), (7014, 14373), (7299, 14344), (7035, 14302), (7116, 14354), (7369, 14362), (7119, 14320), (7204, 14395), (7092, 14389), (7213, 14257), (7016, 14251), (7182, 14399)]
         : compromised: 0.4994, honest: 0.4976
Round 005: test acc mean=0.5016 ± 0.0075 | min=0.4848 max=0.5117
         : test loss mean=540321927.8518 ± 283671022.2906
         : individual accs = ['0.511734', '0.498841', '0.492500', '0.504677', '0.509271', '0.484798', '0.496515', '0.504744', '0.504617', '0.486816', '0.503904', '0.507062', '0.510868', '0.510792', '0.499651', '0.508510', '0.501494', '0.502981', '0.497860', '0.495173']
         : correct/total = [(7283, 14232), (7101, 14235), (7026, 14266), (7175, 14217), (7251, 14238), (6968, 14373), (7123, 14346), (7235, 14334), (7213, 14294), (6997, 14373), (7228, 14344), (7252, 14302), (7333, 14354), (7336, 14362), (7155, 14320), (7320, 14395), (7216, 14389), (7171, 14257), (7095, 14251), (7130, 14399)]
         : compromised: 0.5003, honest: 0.5068
Round 006: test acc mean=0.5019 ± 0.0059 | min=0.4884 max=0.5104
         : test loss mean=40066866687.1931 ± 21060236299.6611
         : individual accs = ['0.504637', '0.508184', '0.495794', '0.510375', '0.496699', '0.498295', '0.488359', '0.502791', '0.500070', '0.494330', '0.509969', '0.505664', '0.505016', '0.505501', '0.495112', '0.501910', '0.505942', '0.496037', '0.506070', '0.507535']
         : correct/total = [(7182, 14232), (7234, 14235), (7073, 14266), (7256, 14217), (7072, 14238), (7162, 14373), (7006, 14346), (7207, 14334), (7148, 14294), (7105, 14373), (7315, 14344), (7232, 14302), (7249, 14354), (7260, 14362), (7090, 14320), (7225, 14395), (7280, 14389), (7072, 14257), (7212, 14251), (7308, 14399)]
         : compromised: 0.5018, honest: 0.5025
Round 007: test acc mean=0.5034 ± 0.0061 | min=0.4888 max=0.5162
         : test loss mean=3283691453578.5200 ± 1754572050908.7778
         : individual accs = ['0.500351', '0.509097', '0.488785', '0.504677', '0.510254', '0.501913', '0.495539', '0.507744', '0.505597', '0.493495', '0.516244', '0.500210', '0.503971', '0.499234', '0.501816', '0.508163', '0.503579', '0.503823', '0.504105', '0.510313']
         : correct/total = [(7121, 14232), (7247, 14235), (6973, 14266), (7175, 14217), (7265, 14238), (7214, 14373), (7109, 14346), (7278, 14334), (7227, 14294), (7093, 14373), (7405, 14344), (7154, 14302), (7234, 14354), (7170, 14362), (7186, 14320), (7315, 14395), (7246, 14389), (7183, 14257), (7184, 14251), (7348, 14399)]
         : compromised: 0.5029, honest: 0.5055
Round 008: test acc mean=0.5014 ± 0.0068 | min=0.4881 max=0.5107
         : test loss mean=276523270566700.7500 ± 148145621869866.8750
         : individual accs = ['0.488055', '0.510713', '0.493201', '0.504889', '0.489886', '0.503861', '0.496166', '0.488768', '0.504058', '0.498713', '0.508993', '0.503846', '0.506758', '0.504595', '0.501746', '0.506217', '0.508444', '0.496949', '0.505508', '0.506980']
         : correct/total = [(6946, 14232), (7270, 14235), (7036, 14266), (7178, 14217), (6975, 14238), (7242, 14373), (7118, 14346), (7006, 14334), (7205, 14294), (7168, 14373), (7301, 14344), (7206, 14302), (7274, 14354), (7247, 14362), (7185, 14320), (7287, 14395), (7316, 14389), (7085, 14257), (7204, 14251), (7300, 14399)]
         : compromised: 0.5033, honest: 0.4938
Round 009: test acc mean=0.5036 ± 0.0057 | min=0.4946 max=0.5169
         : test loss mean=23348221073101440.0000 ± 12449726677868156.0000
         : individual accs = ['0.502881', '0.516895', '0.495724', '0.502005', '0.512572', '0.506297', '0.494563', '0.502860', '0.507835', '0.502052', '0.507460', '0.498252', '0.502369', '0.501462', '0.499302', '0.505523', '0.504552', '0.494704', '0.503193', '0.511772']
         : correct/total = [(7157, 14232), (7358, 14235), (7072, 14266), (7137, 14217), (7298, 14238), (7277, 14373), (7095, 14346), (7208, 14334), (7259, 14294), (7216, 14373), (7279, 14344), (7126, 14302), (7211, 14354), (7202, 14362), (7150, 14320), (7277, 14395), (7260, 14389), (7053, 14257), (7171, 14251), (7369, 14399)]
         : compromised: 0.5031, honest: 0.5057
Round 010: test acc mean=0.5048 ± 0.0071 | min=0.4872 max=0.5195
         : test loss mean=1959020661398409984.0000 ± 1032106538822504576.0000
         : individual accs = ['0.519463', '0.510221', '0.487172', '0.503904', '0.517769', '0.506157', '0.495609', '0.506000', '0.508395', '0.497739', '0.507320', '0.497623', '0.501881', '0.504038', '0.504190', '0.507954', '0.509417', '0.501508', '0.508806', '0.500243']
         : correct/total = [(7393, 14232), (7263, 14235), (6950, 14266), (7164, 14217), (7372, 14238), (7275, 14373), (7110, 14346), (7253, 14334), (7267, 14294), (7154, 14373), (7277, 14344), (7117, 14302), (7204, 14354), (7239, 14362), (7220, 14320), (7312, 14395), (7330, 14389), (7150, 14257), (7251, 14251), (7203, 14399)]
         : compromised: 0.5027, honest: 0.5132

=== FINAL RESULTS ===
Dataset: sent140, Nodes: 20, Graph: erdos, Aggregation: balance
Attack: backdoor, 80.0% compromised
Final accuracy - Compromised: 0.5027, Honest: 0.5132
Overall test accuracy: mean=0.5048 ± 0.0071

=== BACKDOOR ATTACK SUCCESS RATE (ASR) ===
Target label: 1
Trigger size: 3x3
Overall ASR: 0.8686 ± 0.2516
Honest nodes ASR: 0.3757 ± 0.1127
Compromised nodes ASR: 0.9919 ± 0.0061
Note: Higher ASR indicates more successful backdoor attack

=== BALANCE SUMMARY ===
Node 0: acceptance=0.542
Node 1: acceptance=0.700
Node 2: acceptance=0.700
Node 3: acceptance=0.700
Node 4: acceptance=0.256
Node 5: acceptance=0.700
Node 6: acceptance=0.700
Node 7: acceptance=0.800
Node 8: acceptance=0.700
Node 9: acceptance=0.700
Node 10: acceptance=0.700
Node 11: acceptance=0.700
Node 12: acceptance=0.700
Node 13: acceptance=0.700
Node 14: acceptance=0.700
Node 15: acceptance=0.800
Node 16: acceptance=0.600
Node 17: acceptance=0.700
Node 18: acceptance=0.700
Node 19: acceptance=0.600

=== PARALLEL EXECUTION TIME (realistic for distributed system) ===
  COMMUNICATION (max across nodes):
    - Full model transfer: 0.000s (0.0%)
  COMPUTATION (max across nodes):
    - Filtering: 0.058s (81.0%)
    - Aggregation: 0.014s (19.0%)
  TOTALS:
    - Total computation: 0.072s (100.0%)
    - Total communication: 0.000s (0.0%)
    - Total parallel time: 0.072s

=== PER-NODE AVERAGE TIME ===
  - Filtering: 0.043s
  - Aggregation: 0.008s
  - Model transfer: 0.000s
  - Total per node: 0.051s

=== TOTAL COMPUTATIONAL WORK (sum across all nodes) ===
  - Total filtering: 0.855s
  - Total aggregation: 0.159s
  - Total model transfer: 0.000s
  - Grand total: 1.014s
  - Mean acceptance rate: 0.670

BALANCE Algorithm Properties:
  - Model dimension: 1,174,986
  - No compression: Full parameter comparison
  - Theoretical complexity: O(deg(i)×d)
  - Approach: Full parameter filtering + averaging
