Device: cuda
Seed: 987654321
Loading 1 LEAF Sent140 train files...
LEAF Sent140 train: 254555 users, 908652 samples
Building vocabulary (max_size=10000)...
Vocabulary size: 10000
Loading 1 LEAF Sent140 test files...
LEAF Sent140 test: 254555 users, 286281 samples
Found 254555 train users, 254555 test users, 254555 common users
User sample counts range: 494 (max) to 1 (min)
Distributed ALL 254555 users across 20 clients
Users per client: 12727 (with 15 clients getting +1 user)
Train partition sizes: [44353, 44290, 44657, 44907, 44696, 45843, 45801, 45619, 45069, 45639, 45821, 45311, 45779, 46056, 45625, 45984, 46428, 44737, 45540, 46497]
Test partition sizes: [14232, 14235, 14266, 14217, 14238, 14373, 14346, 14334, 14294, 14373, 14344, 14302, 14354, 14362, 14320, 14395, 14389, 14257, 14251, 14399]
  Client 0: 44353 train samples, 2 unique classes
  Client 1: 44290 train samples, 2 unique classes
  Client 2: 44657 train samples, 2 unique classes
  Client 3: 44907 train samples, 2 unique classes
  Client 4: 44696 train samples, 2 unique classes
  Client 5: 45843 train samples, 2 unique classes
  Client 6: 45801 train samples, 2 unique classes
  Client 7: 45619 train samples, 2 unique classes
  Client 8: 45069 train samples, 2 unique classes
  Client 9: 45639 train samples, 2 unique classes
  Client 10: 45821 train samples, 2 unique classes
  Client 11: 45311 train samples, 2 unique classes
  Client 12: 45779 train samples, 2 unique classes
  Client 13: 46056 train samples, 2 unique classes
  Client 14: 45625 train samples, 2 unique classes
  Client 15: 45984 train samples, 2 unique classes
  Client 16: 46428 train samples, 2 unique classes
  Client 17: 44737 train samples, 2 unique classes
  Client 18: 45540 train samples, 2 unique classes
  Client 19: 46497 train samples, 2 unique classes
Will sample 4500 samples per client per epoch
Graph: erdos, nodes: 20, edges: 99
Degree statistics: avg=9.90, min=7, max=14
Attack: Compromised 16/20 nodes: [1, 2, 3, 5, 6, 8, 9, 10, 11, 12, 13, 14, 15, 17, 18, 19]
Attack type: directed_deviation, lambda: 1.0
Model variant: baseline
Model parameters: 1,174,986
Initial test acc across nodes: mean=0.4953 ± 0.0174
Round 001: test acc mean=0.4984 ± 0.0063 | min=0.4858 max=0.5103
         : test loss mean=14.1459 ± 5.4727
         : individual accs = ['0.510329', '0.506498', '0.505117', '0.490117', '0.495084', '0.497948', '0.505995', '0.491977', '0.501259', '0.493634', '0.498466', '0.505594', '0.497701', '0.488790', '0.495950', '0.485794', '0.495865', '0.501438', '0.501438', '0.498576']
         : correct/total = [(7263, 14232), (7210, 14235), (7206, 14266), (6968, 14217), (7049, 14238), (7157, 14373), (7259, 14346), (7052, 14334), (7165, 14294), (7095, 14373), (7150, 14344), (7231, 14302), (7144, 14354), (7020, 14362), (7102, 14320), (6993, 14395), (7135, 14389), (7149, 14257), (7146, 14251), (7179, 14399)]
         : compromised: 0.4984, honest: 0.4983
Round 002: test acc mean=0.4944 ± 0.0120 | min=0.4712 max=0.5132
         : test loss mean=15.3032 ± 9.2933
         : individual accs = ['0.507799', '0.471163', '0.513248', '0.485194', '0.499508', '0.499965', '0.501743', '0.479699', '0.502519', '0.471509', '0.499651', '0.506922', '0.488017', '0.492759', '0.477793', '0.491976', '0.506985', '0.490987', '0.495544', '0.504479']
         : correct/total = [(7227, 14232), (6707, 14235), (7322, 14266), (6898, 14217), (7112, 14238), (7186, 14373), (7198, 14346), (6876, 14334), (7183, 14294), (6777, 14373), (7167, 14344), (7250, 14302), (7005, 14354), (7077, 14362), (6842, 14320), (7082, 14395), (7295, 14389), (7000, 14257), (7062, 14251), (7264, 14399)]
         : compromised: 0.4933, honest: 0.4985
Round 003: test acc mean=0.5037 ± 0.0052 | min=0.4926 max=0.5156
         : test loss mean=2.1140 ± 0.8359
         : individual accs = ['0.506675', '0.515630', '0.492640', '0.497573', '0.503863', '0.504835', '0.500906', '0.509627', '0.505247', '0.504627', '0.501882', '0.501189', '0.497910', '0.504526', '0.507263', '0.502327', '0.498158', '0.510486', '0.509648', '0.499132']
         : correct/total = [(7211, 14232), (7340, 14235), (7028, 14266), (7074, 14217), (7174, 14238), (7256, 14373), (7186, 14346), (7305, 14334), (7222, 14294), (7253, 14373), (7199, 14344), (7168, 14302), (7147, 14354), (7246, 14362), (7264, 14320), (7231, 14395), (7168, 14389), (7278, 14257), (7263, 14251), (7187, 14399)]
         : compromised: 0.5035, honest: 0.5046
Round 004: test acc mean=0.4950 ± 0.0069 | min=0.4837 max=0.5098
         : test loss mean=2.1919 ± 0.7323
         : individual accs = ['0.497189', '0.483737', '0.489766', '0.486741', '0.494732', '0.491825', '0.507737', '0.491768', '0.509794', '0.492034', '0.495608', '0.499720', '0.497910', '0.504178', '0.493645', '0.490587', '0.486135', '0.488883', '0.496877', '0.501840']
         : correct/total = [(7076, 14232), (6886, 14235), (6987, 14266), (6920, 14217), (7044, 14238), (7069, 14373), (7284, 14346), (7049, 14334), (7287, 14294), (7072, 14373), (7109, 14344), (7147, 14302), (7147, 14354), (7241, 14362), (7069, 14320), (7062, 14395), (6995, 14389), (6970, 14257), (7081, 14251), (7226, 14399)]
         : compromised: 0.4957, honest: 0.4925
Round 005: test acc mean=0.4965 ± 0.0093 | min=0.4794 max=0.5193
         : test loss mean=1.0013 ± 0.3174
         : individual accs = ['0.508361', '0.519283', '0.487663', '0.501231', '0.489816', '0.491199', '0.497281', '0.497768', '0.499440', '0.501009', '0.479364', '0.488953', '0.493312', '0.490809', '0.507751', '0.493366', '0.511849', '0.491338', '0.489650', '0.490242']
         : correct/total = [(7235, 14232), (7392, 14235), (6957, 14266), (7126, 14217), (6974, 14238), (7060, 14373), (7134, 14346), (7135, 14334), (7139, 14294), (7201, 14373), (6876, 14344), (6993, 14302), (7081, 14354), (7049, 14362), (7271, 14320), (7102, 14395), (7365, 14389), (7005, 14257), (6978, 14251), (7059, 14399)]
         : compromised: 0.4951, honest: 0.5019
Round 006: test acc mean=0.5057 ± 0.0080 | min=0.4907 max=0.5224
         : test loss mean=1.0916 ± 0.4530
         : individual accs = ['0.502038', '0.522445', '0.496986', '0.490680', '0.509130', '0.501913', '0.511711', '0.497977', '0.503988', '0.520768', '0.502789', '0.504825', '0.508430', '0.512672', '0.500419', '0.504481', '0.495031', '0.515817', '0.503684', '0.508160']
         : correct/total = [(7145, 14232), (7437, 14235), (7090, 14266), (6976, 14217), (7249, 14238), (7214, 14373), (7341, 14346), (7138, 14334), (7204, 14294), (7485, 14373), (7212, 14344), (7220, 14302), (7298, 14354), (7363, 14362), (7166, 14320), (7262, 14395), (7123, 14389), (7354, 14257), (7178, 14251), (7317, 14399)]
         : compromised: 0.5069, honest: 0.5010
Round 007: test acc mean=0.5016 ± 0.0086 | min=0.4784 max=0.5193
         : test loss mean=0.9111 ± 0.1582
         : individual accs = ['0.506816', '0.519283', '0.512828', '0.513610', '0.501896', '0.497878', '0.501882', '0.506139', '0.501889', '0.503235', '0.499373', '0.495875', '0.495541', '0.495753', '0.506844', '0.497464', '0.507332', '0.495756', '0.493369', '0.478436']
         : correct/total = [(7213, 14232), (7392, 14235), (7316, 14266), (7302, 14217), (7146, 14238), (7156, 14373), (7200, 14346), (7255, 14334), (7174, 14294), (7233, 14373), (7163, 14344), (7092, 14302), (7113, 14354), (7120, 14362), (7258, 14320), (7161, 14395), (7300, 14389), (7068, 14257), (7031, 14251), (6889, 14399)]
         : compromised: 0.5006, honest: 0.5055
Round 008: test acc mean=0.4991 ± 0.0081 | min=0.4858 max=0.5190
         : test loss mean=1.0844 ± 0.3553
         : individual accs = ['0.486088', '0.503477', '0.486822', '0.485756', '0.506040', '0.496208', '0.504949', '0.496163', '0.497761', '0.519029', '0.502161', '0.497063', '0.504528', '0.509818', '0.492109', '0.500868', '0.493363', '0.504524', '0.494772', '0.499687']
         : correct/total = [(6918, 14232), (7167, 14235), (6945, 14266), (6906, 14217), (7205, 14238), (7132, 14373), (7244, 14346), (7112, 14334), (7115, 14294), (7460, 14373), (7203, 14344), (7109, 14302), (7242, 14354), (7322, 14362), (7047, 14320), (7210, 14395), (7099, 14389), (7193, 14257), (7051, 14251), (7195, 14399)]
         : compromised: 0.5000, honest: 0.4954
Round 009: test acc mean=0.5033 ± 0.0076 | min=0.4815 max=0.5156
         : test loss mean=0.7953 ± 0.1289
         : individual accs = ['0.508924', '0.515630', '0.515071', '0.514384', '0.505338', '0.501635', '0.501046', '0.505581', '0.497272', '0.505114', '0.499303', '0.496924', '0.495541', '0.498050', '0.506983', '0.501563', '0.507540', '0.504664', '0.504877', '0.481492']
         : correct/total = [(7243, 14232), (7340, 14235), (7348, 14266), (7313, 14217), (7195, 14238), (7210, 14373), (7188, 14346), (7247, 14334), (7108, 14294), (7260, 14373), (7162, 14344), (7107, 14302), (7113, 14354), (7153, 14362), (7260, 14320), (7220, 14395), (7303, 14389), (7195, 14257), (7195, 14251), (6933, 14399)]
         : compromised: 0.5025, honest: 0.5068
Round 010: test acc mean=0.4975 ± 0.0059 | min=0.4872 max=0.5097
         : test loss mean=0.9747 ± 0.3059
         : individual accs = ['0.496557', '0.493080', '0.489065', '0.487234', '0.496207', '0.502192', '0.505716', '0.493442', '0.503498', '0.496626', '0.505298', '0.492379', '0.503553', '0.501880', '0.492458', '0.497812', '0.493154', '0.496107', '0.494492', '0.509688']
         : correct/total = [(7067, 14232), (7019, 14235), (6977, 14266), (6927, 14217), (7065, 14238), (7218, 14373), (7255, 14346), (7073, 14334), (7197, 14294), (7138, 14373), (7248, 14344), (7042, 14302), (7228, 14354), (7208, 14362), (7052, 14320), (7166, 14395), (7096, 14389), (7073, 14257), (7047, 14251), (7339, 14399)]
         : compromised: 0.4982, honest: 0.4948

=== FINAL RESULTS ===
Dataset: sent140, Nodes: 20, Graph: erdos, Aggregation: d-fedavg
Attack: directed_deviation, 80.0% compromised
Final accuracy - Compromised: 0.4982, Honest: 0.4948
Overall test accuracy: mean=0.4975 ± 0.0059
