Device: cuda
Seed: 987654321
Loading 1 LEAF Sent140 train files...
LEAF Sent140 train: 254555 users, 908652 samples
Building vocabulary (max_size=10000)...
Vocabulary size: 10000
Loading 1 LEAF Sent140 test files...
LEAF Sent140 test: 254555 users, 286281 samples
Found 254555 train users, 254555 test users, 254555 common users
User sample counts range: 494 (max) to 1 (min)
Distributed ALL 254555 users across 20 clients
Users per client: 12727 (with 15 clients getting +1 user)
Train partition sizes: [44353, 44290, 44657, 44907, 44696, 45843, 45801, 45619, 45069, 45639, 45821, 45311, 45779, 46056, 45625, 45984, 46428, 44737, 45540, 46497]
Test partition sizes: [14232, 14235, 14266, 14217, 14238, 14373, 14346, 14334, 14294, 14373, 14344, 14302, 14354, 14362, 14320, 14395, 14389, 14257, 14251, 14399]
  Client 0: 44353 train samples, 2 unique classes
  Client 1: 44290 train samples, 2 unique classes
  Client 2: 44657 train samples, 2 unique classes
  Client 3: 44907 train samples, 2 unique classes
  Client 4: 44696 train samples, 2 unique classes
  Client 5: 45843 train samples, 2 unique classes
  Client 6: 45801 train samples, 2 unique classes
  Client 7: 45619 train samples, 2 unique classes
  Client 8: 45069 train samples, 2 unique classes
  Client 9: 45639 train samples, 2 unique classes
  Client 10: 45821 train samples, 2 unique classes
  Client 11: 45311 train samples, 2 unique classes
  Client 12: 45779 train samples, 2 unique classes
  Client 13: 46056 train samples, 2 unique classes
  Client 14: 45625 train samples, 2 unique classes
  Client 15: 45984 train samples, 2 unique classes
  Client 16: 46428 train samples, 2 unique classes
  Client 17: 44737 train samples, 2 unique classes
  Client 18: 45540 train samples, 2 unique classes
  Client 19: 46497 train samples, 2 unique classes
Will sample 4500 samples per client per epoch
Graph: erdos, nodes: 20, edges: 99
Degree statistics: avg=9.90, min=7, max=14
Attack: Compromised 8/20 nodes: [1, 5, 11, 12, 13, 14, 17, 18]
Attack type: backdoor, lambda: 1.0
Backdoor target label: 1, trigger size: 3
Model variant: baseline
Model parameters: 1,174,986
Initial test acc across nodes: mean=0.4953 ± 0.0174
Backdoor attack: Created poisoned datasets for 8 compromised nodes
Round 001: test acc mean=0.5017 ± 0.0060 | min=0.4938 max=0.5141
         : test loss mean=4.9368 ± 2.5938
         : individual accs = ['0.507167', '0.498771', '0.493831', '0.512204', '0.501826', '0.496973', '0.502300', '0.512627', '0.503848', '0.507479', '0.499582', '0.494546', '0.514142', '0.494569', '0.502444', '0.501563', '0.496977', '0.496247', '0.498351', '0.498298']
         : correct/total = [(7218, 14232), (7100, 14235), (7045, 14266), (7282, 14217), (7145, 14238), (7143, 14373), (7206, 14346), (7348, 14334), (7202, 14294), (7294, 14373), (7166, 14344), (7073, 14302), (7380, 14354), (7103, 14362), (7195, 14320), (7220, 14395), (7151, 14389), (7075, 14257), (7102, 14251), (7175, 14399)]
         : compromised: 0.4995, honest: 0.5031
Round 002: test acc mean=0.4998 ± 0.0052 | min=0.4870 max=0.5077
         : test loss mean=4.4567 ± 1.6646
         : individual accs = ['0.500000', '0.503969', '0.501893', '0.502778', '0.501334', '0.486955', '0.498954', '0.501884', '0.504827', '0.505670', '0.497909', '0.507691', '0.500348', '0.489904', '0.494693', '0.501355', '0.496351', '0.506137', '0.494281', '0.499479']
         : correct/total = [(7116, 14232), (7174, 14235), (7160, 14266), (7148, 14217), (7138, 14238), (6999, 14373), (7158, 14346), (7194, 14334), (7216, 14294), (7268, 14373), (7142, 14344), (7261, 14302), (7182, 14354), (7036, 14362), (7084, 14320), (7217, 14395), (7142, 14389), (7216, 14257), (7044, 14251), (7192, 14399)]
         : compromised: 0.4980, honest: 0.5010
Round 003: test acc mean=0.5017 ± 0.0091 | min=0.4876 max=0.5188
         : test loss mean=2.7012 ± 0.7810
         : individual accs = ['0.505832', '0.488584', '0.500350', '0.487585', '0.497120', '0.516454', '0.498257', '0.489047', '0.497761', '0.504696', '0.508645', '0.491190', '0.508987', '0.510862', '0.513338', '0.495311', '0.505873', '0.495546', '0.518841', '0.499201']
         : correct/total = [(7199, 14232), (6955, 14235), (7138, 14266), (6932, 14217), (7078, 14238), (7423, 14373), (7148, 14346), (7010, 14334), (7115, 14294), (7254, 14373), (7296, 14344), (7025, 14302), (7306, 14354), (7337, 14362), (7351, 14320), (7130, 14395), (7279, 14389), (7065, 14257), (7394, 14251), (7188, 14399)]
         : compromised: 0.5055, honest: 0.4991
Round 004: test acc mean=0.4944 ± 0.0062 | min=0.4816 max=0.5033
         : test loss mean=3.8847 ± 1.2336
         : individual accs = ['0.499297', '0.498911', '0.481635', '0.482240', '0.493679', '0.500661', '0.495818', '0.492117', '0.500979', '0.487024', '0.503346', '0.485736', '0.497074', '0.501323', '0.489176', '0.498229', '0.493085', '0.495195', '0.494913', '0.498298']
         : correct/total = [(7106, 14232), (7102, 14235), (6871, 14266), (6856, 14217), (7029, 14238), (7196, 14373), (7113, 14346), (7054, 14334), (7161, 14294), (7000, 14373), (7220, 14344), (6947, 14302), (7135, 14354), (7200, 14362), (7005, 14320), (7172, 14395), (7095, 14389), (7060, 14257), (7053, 14251), (7175, 14399)]
         : compromised: 0.4954, honest: 0.4938
Round 005: test acc mean=0.4986 ± 0.0060 | min=0.4902 max=0.5100
         : test loss mean=8.1795 ± 2.5563
         : individual accs = ['0.499157', '0.491605', '0.490537', '0.494056', '0.505478', '0.501218', '0.506274', '0.490163', '0.505737', '0.509984', '0.499373', '0.490701', '0.498467', '0.503830', '0.497416', '0.492602', '0.492251', '0.503121', '0.496527', '0.503090']
         : correct/total = [(7104, 14232), (6998, 14235), (6998, 14266), (7024, 14217), (7197, 14238), (7204, 14373), (7263, 14346), (7026, 14334), (7229, 14294), (7330, 14373), (7163, 14344), (7018, 14302), (7155, 14354), (7236, 14362), (7123, 14320), (7091, 14395), (7083, 14389), (7173, 14257), (7076, 14251), (7244, 14399)]
         : compromised: 0.4979, honest: 0.4991
Round 006: test acc mean=0.5030 ± 0.0099 | min=0.4865 max=0.5235
         : test loss mean=8.1003 ± 2.2165
         : individual accs = ['0.516793', '0.515068', '0.510444', '0.506295', '0.498314', '0.491895', '0.496933', '0.505023', '0.491255', '0.497113', '0.486475', '0.498252', '0.523478', '0.512255', '0.504888', '0.491143', '0.493293', '0.509364', '0.513297', '0.498229']
         : correct/total = [(7355, 14232), (7332, 14235), (7282, 14266), (7198, 14217), (7095, 14238), (7070, 14373), (7129, 14346), (7239, 14334), (7022, 14294), (7145, 14373), (6978, 14344), (7126, 14302), (7514, 14354), (7357, 14362), (7230, 14320), (7070, 14395), (7098, 14389), (7262, 14257), (7315, 14251), (7174, 14399)]
         : compromised: 0.5086, honest: 0.4993
Round 007: test acc mean=0.5011 ± 0.0078 | min=0.4821 max=0.5116
         : test loss mean=8.5252 ± 2.5749
         : individual accs = ['0.493887', '0.506498', '0.487242', '0.505803', '0.492906', '0.499896', '0.504391', '0.503558', '0.496922', '0.508592', '0.507738', '0.498532', '0.504459', '0.501601', '0.492737', '0.504411', '0.508166', '0.510977', '0.482071', '0.511633']
         : correct/total = [(7029, 14232), (7210, 14235), (6951, 14266), (7191, 14217), (7018, 14238), (7185, 14373), (7236, 14346), (7218, 14334), (7103, 14294), (7310, 14373), (7283, 14344), (7130, 14302), (7241, 14354), (7204, 14362), (7056, 14320), (7261, 14395), (7312, 14389), (7285, 14257), (6870, 14251), (7367, 14399)]
         : compromised: 0.4996, honest: 0.5021
Round 008: test acc mean=0.5047 ± 0.0046 | min=0.4963 max=0.5137
         : test loss mean=20.1333 ± 6.6187
         : individual accs = ['0.503513', '0.513734', '0.512407', '0.512696', '0.503371', '0.500800', '0.500976', '0.507744', '0.499160', '0.505949', '0.505647', '0.506992', '0.496308', '0.500696', '0.505377', '0.499062', '0.508861', '0.504594', '0.503052', '0.503785']
         : correct/total = [(7166, 14232), (7313, 14235), (7310, 14266), (7289, 14217), (7167, 14238), (7198, 14373), (7187, 14346), (7278, 14334), (7135, 14294), (7272, 14373), (7253, 14344), (7251, 14302), (7124, 14354), (7191, 14362), (7237, 14320), (7184, 14395), (7322, 14389), (7194, 14257), (7169, 14251), (7254, 14399)]
         : compromised: 0.5039, honest: 0.5053
Round 009: test acc mean=0.5052 ± 0.0055 | min=0.4932 max=0.5171
         : test loss mean=46.4935 ± 18.0816
         : individual accs = ['0.507307', '0.517106', '0.513038', '0.515017', '0.505549', '0.504140', '0.500070', '0.507535', '0.501819', '0.506505', '0.501603', '0.506013', '0.497144', '0.493176', '0.507332', '0.502605', '0.507471', '0.504664', '0.504386', '0.501910']
         : correct/total = [(7220, 14232), (7361, 14235), (7319, 14266), (7322, 14217), (7198, 14238), (7246, 14373), (7174, 14346), (7275, 14334), (7173, 14294), (7280, 14373), (7195, 14344), (7237, 14302), (7136, 14354), (7083, 14362), (7265, 14320), (7235, 14395), (7302, 14389), (7195, 14257), (7188, 14251), (7227, 14399)]
         : compromised: 0.5042, honest: 0.5059
Round 010: test acc mean=0.5042 ± 0.0058 | min=0.4931 max=0.5153
         : test loss mean=28.8660 ± 16.8035
         : individual accs = ['0.507378', '0.515279', '0.512968', '0.514877', '0.509060', '0.504070', '0.497839', '0.501884', '0.501819', '0.499617', '0.501046', '0.505803', '0.497074', '0.493107', '0.507332', '0.496839', '0.506568', '0.504033', '0.504526', '0.501910']
         : correct/total = [(7221, 14232), (7335, 14235), (7318, 14266), (7320, 14217), (7248, 14238), (7245, 14373), (7142, 14346), (7194, 14334), (7173, 14294), (7181, 14373), (7187, 14344), (7234, 14302), (7135, 14354), (7082, 14362), (7265, 14320), (7152, 14395), (7289, 14389), (7186, 14257), (7190, 14251), (7227, 14399)]
         : compromised: 0.5039, honest: 0.5043

=== FINAL RESULTS ===
Dataset: sent140, Nodes: 20, Graph: erdos, Aggregation: d-fedavg
Attack: backdoor, 40.0% compromised
Final accuracy - Compromised: 0.5039, Honest: 0.5043
Overall test accuracy: mean=0.5042 ± 0.0058

=== BACKDOOR ATTACK SUCCESS RATE (ASR) ===
Target label: 1
Trigger size: 3x3
Overall ASR: 0.0071 ± 0.0104
Honest nodes ASR: 0.0101 ± 0.0121
Compromised nodes ASR: 0.0028 ± 0.0041
Note: Higher ASR indicates more successful backdoor attack
