Device: cuda
Seed: 987654321
Loading 1 LEAF Sent140 train files...
LEAF Sent140 train: 254555 users, 908652 samples
Building vocabulary (max_size=10000)...
Vocabulary size: 10000
Loading 1 LEAF Sent140 test files...
LEAF Sent140 test: 254555 users, 286281 samples
Found 254555 train users, 254555 test users, 254555 common users
User sample counts range: 494 (max) to 1 (min)
Distributed ALL 254555 users across 20 clients
Users per client: 12727 (with 15 clients getting +1 user)
Train partition sizes: [44353, 44290, 44657, 44907, 44696, 45843, 45801, 45619, 45069, 45639, 45821, 45311, 45779, 46056, 45625, 45984, 46428, 44737, 45540, 46497]
Test partition sizes: [14232, 14235, 14266, 14217, 14238, 14373, 14346, 14334, 14294, 14373, 14344, 14302, 14354, 14362, 14320, 14395, 14389, 14257, 14251, 14399]
  Client 0: 44353 train samples, 2 unique classes
  Client 1: 44290 train samples, 2 unique classes
  Client 2: 44657 train samples, 2 unique classes
  Client 3: 44907 train samples, 2 unique classes
  Client 4: 44696 train samples, 2 unique classes
  Client 5: 45843 train samples, 2 unique classes
  Client 6: 45801 train samples, 2 unique classes
  Client 7: 45619 train samples, 2 unique classes
  Client 8: 45069 train samples, 2 unique classes
  Client 9: 45639 train samples, 2 unique classes
  Client 10: 45821 train samples, 2 unique classes
  Client 11: 45311 train samples, 2 unique classes
  Client 12: 45779 train samples, 2 unique classes
  Client 13: 46056 train samples, 2 unique classes
  Client 14: 45625 train samples, 2 unique classes
  Client 15: 45984 train samples, 2 unique classes
  Client 16: 46428 train samples, 2 unique classes
  Client 17: 44737 train samples, 2 unique classes
  Client 18: 45540 train samples, 2 unique classes
  Client 19: 46497 train samples, 2 unique classes
Will sample 4500 samples per client per epoch
Graph: ring, nodes: 20, edges: 20
Degree statistics: avg=2.00, min=2, max=2
Attack: Compromised 4/20 nodes: [5, 12, 13, 17]
Attack type: backdoor, lambda: 1.0
Backdoor target label: 1, trigger size: 3
Model variant: baseline
Model parameters: 1,174,986
Sketchguard Node 0:
  Model dim: 1,174,986 → Sketch size: 180
  Compression ratio: 6527.7x
  Using model parameters for aggregation, sketches for filtering
Sketchguard Node 1:
  Model dim: 1,174,986 → Sketch size: 180
  Compression ratio: 6527.7x
  Using model parameters for aggregation, sketches for filtering
Sketchguard Node 2:
  Model dim: 1,174,986 → Sketch size: 180
  Compression ratio: 6527.7x
  Using model parameters for aggregation, sketches for filtering
Sketchguard Node 3:
  Model dim: 1,174,986 → Sketch size: 180
  Compression ratio: 6527.7x
  Using model parameters for aggregation, sketches for filtering
Sketchguard Node 4:
  Model dim: 1,174,986 → Sketch size: 180
  Compression ratio: 6527.7x
  Using model parameters for aggregation, sketches for filtering
Sketchguard Node 5:
  Model dim: 1,174,986 → Sketch size: 180
  Compression ratio: 6527.7x
  Using model parameters for aggregation, sketches for filtering
Sketchguard Node 6:
  Model dim: 1,174,986 → Sketch size: 180
  Compression ratio: 6527.7x
  Using model parameters for aggregation, sketches for filtering
Sketchguard Node 7:
  Model dim: 1,174,986 → Sketch size: 180
  Compression ratio: 6527.7x
  Using model parameters for aggregation, sketches for filtering
Sketchguard Node 8:
  Model dim: 1,174,986 → Sketch size: 180
  Compression ratio: 6527.7x
  Using model parameters for aggregation, sketches for filtering
Sketchguard Node 9:
  Model dim: 1,174,986 → Sketch size: 180
  Compression ratio: 6527.7x
  Using model parameters for aggregation, sketches for filtering
Sketchguard Node 10:
  Model dim: 1,174,986 → Sketch size: 180
  Compression ratio: 6527.7x
  Using model parameters for aggregation, sketches for filtering
Sketchguard Node 11:
  Model dim: 1,174,986 → Sketch size: 180
  Compression ratio: 6527.7x
  Using model parameters for aggregation, sketches for filtering
Sketchguard Node 12:
  Model dim: 1,174,986 → Sketch size: 180
  Compression ratio: 6527.7x
  Using model parameters for aggregation, sketches for filtering
Sketchguard Node 13:
  Model dim: 1,174,986 → Sketch size: 180
  Compression ratio: 6527.7x
  Using model parameters for aggregation, sketches for filtering
Sketchguard Node 14:
  Model dim: 1,174,986 → Sketch size: 180
  Compression ratio: 6527.7x
  Using model parameters for aggregation, sketches for filtering
Sketchguard Node 15:
  Model dim: 1,174,986 → Sketch size: 180
  Compression ratio: 6527.7x
  Using model parameters for aggregation, sketches for filtering
Sketchguard Node 16:
  Model dim: 1,174,986 → Sketch size: 180
  Compression ratio: 6527.7x
  Using model parameters for aggregation, sketches for filtering
Sketchguard Node 17:
  Model dim: 1,174,986 → Sketch size: 180
  Compression ratio: 6527.7x
  Using model parameters for aggregation, sketches for filtering
Sketchguard Node 18:
  Model dim: 1,174,986 → Sketch size: 180
  Compression ratio: 6527.7x
  Using model parameters for aggregation, sketches for filtering
Sketchguard Node 19:
  Model dim: 1,174,986 → Sketch size: 180
  Compression ratio: 6527.7x
  Using model parameters for aggregation, sketches for filtering
Sketchguard ALGORITHM (Sketch-based Filtering + State Aggregation)
  - Model dimension: 1,174,986 parameters
  - Config: SketchguardConfig(gamma=2, kappa=1, alpha=0.5, min_neighbors=1, sketch_size=180, network_seed=987654321, attack_detection_window=5)
  - Sketch size: 180
  - Compression ratio: 6527.7x
  - Complexity: O(d + N×k) = O(1,174,986 + 20×180)
  - Theoretical speedup vs BALANCE: 19.9x
Initial test acc across nodes: mean=0.4953 ± 0.0174
Backdoor attack: Created poisoned datasets for 4 compromised nodes
Round 001: test acc mean=0.5329 ± 0.0342 | min=0.5011 max=0.6236
         : test loss mean=9.2799 ± 16.6682
         : individual accs = ['0.583263', '0.623604', '0.535118', '0.566575', '0.508850', '0.518890', '0.514778', '0.576531', '0.501189', '0.572254', '0.509481', '0.508111', '0.510729', '0.507450', '0.505796', '0.527405', '0.504900', '0.519254', '0.501088', '0.563650']
         : correct/total = [(8301, 14232), (8877, 14235), (7634, 14266), (8055, 14217), (7245, 14238), (7458, 14373), (7385, 14346), (8264, 14334), (7164, 14294), (8225, 14373), (7308, 14344), (7267, 14302), (7331, 14354), (7288, 14362), (7243, 14320), (7592, 14395), (7265, 14389), (7403, 14257), (7141, 14251), (8116, 14399)]
         : compromised: 0.5141, honest: 0.5377
         : sketchguard stats = ['Node 0: acc_rate=1.000', 'Node 1: acc_rate=1.000', 'Node 2: acc_rate=1.000']...
Round 002: test acc mean=0.5350 ± 0.0546 | min=0.4874 max=0.6428
         : test loss mean=72.6190 ± 160.7512
         : individual accs = ['0.624087', '0.642782', '0.635988', '0.515017', '0.506672', '0.503861', '0.521888', '0.495047', '0.624178', '0.613720', '0.500070', '0.507481', '0.509544', '0.490600', '0.509288', '0.502327', '0.509139', '0.498211', '0.487404', '0.502257']
         : correct/total = [(8882, 14232), (9150, 14235), (9073, 14266), (7322, 14217), (7214, 14238), (7242, 14373), (7487, 14346), (7096, 14334), (8922, 14294), (8821, 14373), (7173, 14344), (7258, 14302), (7314, 14354), (7046, 14362), (7293, 14320), (7231, 14395), (7326, 14389), (7103, 14257), (6946, 14251), (7232, 14399)]
         : compromised: 0.5006, honest: 0.5436
         : sketchguard stats = ['Node 0: acc_rate=1.000', 'Node 1: acc_rate=1.000', 'Node 2: acc_rate=1.000']...
Round 003: test acc mean=0.5608 ± 0.0515 | min=0.4919 max=0.6356
         : test loss mean=3154.8797 ± 6889.0058
         : individual accs = ['0.608980', '0.618967', '0.590214', '0.601182', '0.612586', '0.503931', '0.595427', '0.596205', '0.618651', '0.635567', '0.525586', '0.525241', '0.496029', '0.491854', '0.508729', '0.493435', '0.508930', '0.498422', '0.588450', '0.598583']
         : correct/total = [(8667, 14232), (8811, 14235), (8420, 14266), (8547, 14217), (8722, 14238), (7243, 14373), (8542, 14346), (8546, 14334), (8843, 14294), (9135, 14373), (7539, 14344), (7512, 14302), (7120, 14354), (7064, 14362), (7285, 14320), (7103, 14395), (7323, 14389), (7106, 14257), (8386, 14251), (8619, 14399)]
         : compromised: 0.4976, honest: 0.5767
         : sketchguard stats = ['Node 0: acc_rate=1.000', 'Node 1: acc_rate=1.000', 'Node 2: acc_rate=1.000']...
Round 004: test acc mean=0.5936 ± 0.0517 | min=0.4946 max=0.6398
         : test loss mean=1617886.6610 ± 4706330.1167
         : individual accs = ['0.639545', '0.639621', '0.635988', '0.636914', '0.633586', '0.507827', '0.631256', '0.632273', '0.613684', '0.621234', '0.610429', '0.607607', '0.501811', '0.506615', '0.545810', '0.571032', '0.576413', '0.494564', '0.625219', '0.639836']
         : correct/total = [(9102, 14232), (9105, 14235), (9073, 14266), (9055, 14217), (9021, 14238), (7299, 14373), (9056, 14346), (9063, 14334), (8772, 14294), (8929, 14373), (8756, 14344), (8690, 14302), (7203, 14354), (7276, 14362), (7816, 14320), (8220, 14395), (8294, 14389), (7051, 14257), (8910, 14251), (9213, 14399)]
         : compromised: 0.5027, honest: 0.6163
         : sketchguard stats = ['Node 0: acc_rate=1.000', 'Node 1: acc_rate=1.000', 'Node 2: acc_rate=1.000']...
Round 005: test acc mean=0.6058 ± 0.0531 | min=0.4976 max=0.6483
         : test loss mean=17369488.1615 ± 37729343.0898
         : individual accs = ['0.643479', '0.648332', '0.642156', '0.641415', '0.647493', '0.500174', '0.638296', '0.641621', '0.641738', '0.639880', '0.620538', '0.630122', '0.497562', '0.513229', '0.594134', '0.595623', '0.593995', '0.509224', '0.638341', '0.638933']
         : correct/total = [(9158, 14232), (9229, 14235), (9161, 14266), (9119, 14217), (9219, 14238), (7189, 14373), (9157, 14346), (9197, 14334), (9173, 14294), (9197, 14373), (8901, 14344), (9012, 14302), (7142, 14354), (7371, 14362), (8508, 14320), (8574, 14395), (8547, 14389), (7260, 14257), (9097, 14251), (9200, 14399)]
         : compromised: 0.5050, honest: 0.6310
         : sketchguard stats = ['Node 0: acc_rate=1.000', 'Node 1: acc_rate=1.000', 'Node 2: acc_rate=1.000']...
Round 006: test acc mean=0.6128 ± 0.0558 | min=0.4957 max=0.6585
         : test loss mean=1706597854.5252 ± 3910777135.8773
         : individual accs = ['0.650998', '0.649947', '0.644539', '0.654568', '0.658519', '0.505044', '0.650565', '0.653900', '0.640199', '0.639672', '0.635806', '0.635645', '0.495681', '0.507172', '0.619064', '0.610003', '0.599416', '0.512731', '0.639745', '0.652545']
         : correct/total = [(9265, 14232), (9252, 14235), (9195, 14266), (9306, 14217), (9376, 14238), (7259, 14373), (9333, 14346), (9373, 14334), (9151, 14294), (9194, 14373), (9120, 14344), (9091, 14302), (7115, 14354), (7284, 14362), (8865, 14320), (8781, 14395), (8625, 14389), (7310, 14257), (9117, 14251), (9396, 14399)]
         : compromised: 0.5052, honest: 0.6397
         : sketchguard stats = ['Node 0: acc_rate=1.000', 'Node 1: acc_rate=1.000', 'Node 2: acc_rate=1.000']...
Round 007: test acc mean=0.6165 ± 0.0566 | min=0.4962 max=0.6574
         : test loss mean=126106143619.5497 ± 273049533367.5864
         : individual accs = ['0.648609', '0.654373', '0.630029', '0.655413', '0.657396', '0.514785', '0.657187', '0.648109', '0.645865', '0.644611', '0.638525', '0.641169', '0.507106', '0.496170', '0.633869', '0.629871', '0.629022', '0.501157', '0.642692', '0.653379']
         : correct/total = [(9231, 14232), (9315, 14235), (8988, 14266), (9318, 14217), (9360, 14238), (7399, 14373), (9428, 14346), (9290, 14334), (9232, 14294), (9265, 14373), (9159, 14344), (9170, 14302), (7279, 14354), (7126, 14362), (9077, 14320), (9067, 14395), (9051, 14389), (7145, 14257), (9159, 14251), (9408, 14399)]
         : compromised: 0.5048, honest: 0.6444
         : sketchguard stats = ['Node 0: acc_rate=1.000', 'Node 1: acc_rate=1.000', 'Node 2: acc_rate=1.000']...
Round 008: test acc mean=0.6162 ± 0.0588 | min=0.4881 max=0.6577
         : test loss mean=10575109816106.3379 ± 21249040992898.5742
         : individual accs = ['0.638491', '0.637935', '0.650217', '0.647394', '0.648757', '0.496278', '0.636763', '0.635343', '0.647614', '0.649064', '0.649958', '0.657740', '0.488087', '0.517825', '0.642668', '0.638486', '0.638057', '0.496177', '0.650621', '0.656573']
         : correct/total = [(9087, 14232), (9081, 14235), (9276, 14266), (9204, 14217), (9237, 14238), (7133, 14373), (9135, 14346), (9107, 14334), (9257, 14294), (9329, 14373), (9323, 14344), (9407, 14302), (7006, 14354), (7437, 14362), (9203, 14320), (9191, 14395), (9181, 14389), (7074, 14257), (9272, 14251), (9454, 14399)]
         : compromised: 0.4996, honest: 0.6454
         : sketchguard stats = ['Node 0: acc_rate=1.000', 'Node 1: acc_rate=1.000', 'Node 2: acc_rate=1.000']...
Round 009: test acc mean=0.6210 ± 0.0556 | min=0.5058 max=0.6608
         : test loss mean=819600075039149.3750 ± 1796860938210428.5000
         : individual accs = ['0.621979', '0.656481', '0.660101', '0.659492', '0.660837', '0.507897', '0.625680', '0.647342', '0.640758', '0.638698', '0.649540', '0.654943', '0.505782', '0.524022', '0.645461', '0.650156', '0.650010', '0.509644', '0.658831', '0.652823']
         : correct/total = [(8852, 14232), (9345, 14235), (9417, 14266), (9376, 14217), (9409, 14238), (7300, 14373), (8976, 14346), (9279, 14334), (9159, 14294), (9180, 14373), (9317, 14344), (9367, 14302), (7260, 14354), (7526, 14362), (9243, 14320), (9359, 14395), (9353, 14389), (7266, 14257), (9389, 14251), (9400, 14399)]
         : compromised: 0.5118, honest: 0.6483
         : sketchguard stats = ['Node 0: acc_rate=1.000', 'Node 1: acc_rate=1.000', 'Node 2: acc_rate=1.000']...
Round 010: test acc mean=0.6292 ± 0.0629 | min=0.4896 max=0.6724
         : test loss mean=88863753221119520.0000 ± 199046581989677152.0000
         : individual accs = ['0.661186', '0.661468', '0.652741', '0.664064', '0.672426', '0.499756', '0.665342', '0.667225', '0.651602', '0.650595', '0.660276', '0.661796', '0.523826', '0.504178', '0.660126', '0.661549', '0.654806', '0.489584', '0.656866', '0.664699']
         : correct/total = [(9410, 14232), (9416, 14235), (9312, 14266), (9441, 14217), (9574, 14238), (7183, 14373), (9545, 14346), (9564, 14334), (9314, 14294), (9351, 14373), (9471, 14344), (9465, 14302), (7519, 14354), (7241, 14362), (9453, 14320), (9523, 14395), (9422, 14389), (6980, 14257), (9361, 14251), (9571, 14399)]
         : compromised: 0.5043, honest: 0.6604
         : sketchguard stats = ['Node 0: acc_rate=1.000', 'Node 1: acc_rate=1.000', 'Node 2: acc_rate=1.000']...

=== FINAL RESULTS ===
Dataset: sent140, Nodes: 20, Graph: ring, Aggregation: sketchguard
Attack: backdoor, 20.0% compromised
Final accuracy - Compromised: 0.5043, Honest: 0.6604
Overall test accuracy: mean=0.6292 ± 0.0629

=== BACKDOOR ATTACK SUCCESS RATE (ASR) ===
Target label: 1
Trigger size: 3x3
Overall ASR: 0.5837 ± 0.1758
Honest nodes ASR: 0.5098 ± 0.0526
Compromised nodes ASR: 0.8793 ± 0.1850
Note: Higher ASR indicates more successful backdoor attack

=== Sketchguard SUMMARY ===
Node 0: acceptance=1.000
Node 1: acceptance=1.000
Node 2: acceptance=1.000
Node 3: acceptance=1.000
Node 4: acceptance=0.550
Node 5: acceptance=0.600
Node 6: acceptance=0.550
Node 7: acceptance=1.000
Node 8: acceptance=1.000
Node 9: acceptance=1.000
Node 10: acceptance=1.000
Node 11: acceptance=0.600
Node 12: acceptance=0.600
Node 13: acceptance=0.600
Node 14: acceptance=0.600
Node 15: acceptance=1.000
Node 16: acceptance=0.600
Node 17: acceptance=0.600
Node 18: acceptance=0.550
Node 19: acceptance=1.000

=== PARALLEL EXECUTION TIME (realistic for distributed system) ===
  COMMUNICATION (max across nodes):
    - Sketch transfer: 0.000s (0.0%)
    - Model fetch (accepted): 0.000s (0.0%)
  COMPUTATION (max across nodes):
    - Sketching: 0.209s (95.0%)
    - Filtering: 0.001s (0.4%)
    - Aggregation: 0.010s (4.5%)
  TOTALS:
    - Total computation: 0.220s (100.0%)
    - Total communication: 0.000s (0.0%)
    - Total parallel time: 0.220s

=== PER-NODE AVERAGE TIME ===
  - Sketching: 0.160s
  - Filtering: 0.000s
  - Aggregation: 0.006s
  - Sketch transfer: 0.000s
  - Model fetch: 0.000s
  - Total per node: 0.167s

=== TOTAL COMPUTATIONAL WORK (sum across all nodes) ===
  - Total sketching: 3.207s
  - Total filtering: 0.007s
  - Total aggregation: 0.120s
  - Total sketch transfer: 0.000s
  - Total model fetch: 0.000s
  - Grand total: 3.333s
  - Mean acceptance rate: 0.792

Sketchguard Algorithm Properties:
  - Original dimension: 1,174,986
  - Sketch size: 180
  - Compression ratio: 19.9x
  - Single repetition: No repetitions needed
  - Theoretical complexity: O(d + N×k)
  - Approach: Sketch filtering + state aggregation
