Device: cuda
Seed: 987654321
Loading 1 LEAF Sent140 train files...
LEAF Sent140 train: 254555 users, 908652 samples
Building vocabulary (max_size=10000)...
Vocabulary size: 10000
Loading 1 LEAF Sent140 test files...
LEAF Sent140 test: 254555 users, 286281 samples
Found 254555 train users, 254555 test users, 254555 common users
User sample counts range: 494 (max) to 1 (min)
Distributed ALL 254555 users across 20 clients
Users per client: 12727 (with 15 clients getting +1 user)
Train partition sizes: [44353, 44290, 44657, 44907, 44696, 45843, 45801, 45619, 45069, 45639, 45821, 45311, 45779, 46056, 45625, 45984, 46428, 44737, 45540, 46497]
Test partition sizes: [14232, 14235, 14266, 14217, 14238, 14373, 14346, 14334, 14294, 14373, 14344, 14302, 14354, 14362, 14320, 14395, 14389, 14257, 14251, 14399]
  Client 0: 44353 train samples, 2 unique classes
  Client 1: 44290 train samples, 2 unique classes
  Client 2: 44657 train samples, 2 unique classes
  Client 3: 44907 train samples, 2 unique classes
  Client 4: 44696 train samples, 2 unique classes
  Client 5: 45843 train samples, 2 unique classes
  Client 6: 45801 train samples, 2 unique classes
  Client 7: 45619 train samples, 2 unique classes
  Client 8: 45069 train samples, 2 unique classes
  Client 9: 45639 train samples, 2 unique classes
  Client 10: 45821 train samples, 2 unique classes
  Client 11: 45311 train samples, 2 unique classes
  Client 12: 45779 train samples, 2 unique classes
  Client 13: 46056 train samples, 2 unique classes
  Client 14: 45625 train samples, 2 unique classes
  Client 15: 45984 train samples, 2 unique classes
  Client 16: 46428 train samples, 2 unique classes
  Client 17: 44737 train samples, 2 unique classes
  Client 18: 45540 train samples, 2 unique classes
  Client 19: 46497 train samples, 2 unique classes
Will sample 4500 samples per client per epoch
Graph: erdos, nodes: 20, edges: 48
Degree statistics: avg=4.80, min=2, max=7
Attack: Compromised 16/20 nodes: [1, 2, 3, 5, 6, 8, 9, 10, 11, 12, 13, 14, 15, 17, 18, 19]
Attack type: gaussian, lambda: 1.0
Model variant: baseline
Model parameters: 1,174,986
Sketchguard Node 0:
  Model dim: 1,174,986 → Sketch size: 180
  Compression ratio: 6527.7x
  Using model parameters for aggregation, sketches for filtering
Sketchguard Node 1:
  Model dim: 1,174,986 → Sketch size: 180
  Compression ratio: 6527.7x
  Using model parameters for aggregation, sketches for filtering
Sketchguard Node 2:
  Model dim: 1,174,986 → Sketch size: 180
  Compression ratio: 6527.7x
  Using model parameters for aggregation, sketches for filtering
Sketchguard Node 3:
  Model dim: 1,174,986 → Sketch size: 180
  Compression ratio: 6527.7x
  Using model parameters for aggregation, sketches for filtering
Sketchguard Node 4:
  Model dim: 1,174,986 → Sketch size: 180
  Compression ratio: 6527.7x
  Using model parameters for aggregation, sketches for filtering
Sketchguard Node 5:
  Model dim: 1,174,986 → Sketch size: 180
  Compression ratio: 6527.7x
  Using model parameters for aggregation, sketches for filtering
Sketchguard Node 6:
  Model dim: 1,174,986 → Sketch size: 180
  Compression ratio: 6527.7x
  Using model parameters for aggregation, sketches for filtering
Sketchguard Node 7:
  Model dim: 1,174,986 → Sketch size: 180
  Compression ratio: 6527.7x
  Using model parameters for aggregation, sketches for filtering
Sketchguard Node 8:
  Model dim: 1,174,986 → Sketch size: 180
  Compression ratio: 6527.7x
  Using model parameters for aggregation, sketches for filtering
Sketchguard Node 9:
  Model dim: 1,174,986 → Sketch size: 180
  Compression ratio: 6527.7x
  Using model parameters for aggregation, sketches for filtering
Sketchguard Node 10:
  Model dim: 1,174,986 → Sketch size: 180
  Compression ratio: 6527.7x
  Using model parameters for aggregation, sketches for filtering
Sketchguard Node 11:
  Model dim: 1,174,986 → Sketch size: 180
  Compression ratio: 6527.7x
  Using model parameters for aggregation, sketches for filtering
Sketchguard Node 12:
  Model dim: 1,174,986 → Sketch size: 180
  Compression ratio: 6527.7x
  Using model parameters for aggregation, sketches for filtering
Sketchguard Node 13:
  Model dim: 1,174,986 → Sketch size: 180
  Compression ratio: 6527.7x
  Using model parameters for aggregation, sketches for filtering
Sketchguard Node 14:
  Model dim: 1,174,986 → Sketch size: 180
  Compression ratio: 6527.7x
  Using model parameters for aggregation, sketches for filtering
Sketchguard Node 15:
  Model dim: 1,174,986 → Sketch size: 180
  Compression ratio: 6527.7x
  Using model parameters for aggregation, sketches for filtering
Sketchguard Node 16:
  Model dim: 1,174,986 → Sketch size: 180
  Compression ratio: 6527.7x
  Using model parameters for aggregation, sketches for filtering
Sketchguard Node 17:
  Model dim: 1,174,986 → Sketch size: 180
  Compression ratio: 6527.7x
  Using model parameters for aggregation, sketches for filtering
Sketchguard Node 18:
  Model dim: 1,174,986 → Sketch size: 180
  Compression ratio: 6527.7x
  Using model parameters for aggregation, sketches for filtering
Sketchguard Node 19:
  Model dim: 1,174,986 → Sketch size: 180
  Compression ratio: 6527.7x
  Using model parameters for aggregation, sketches for filtering
Sketchguard ALGORITHM (Sketch-based Filtering + State Aggregation)
  - Model dimension: 1,174,986 parameters
  - Config: SketchguardConfig(gamma=2, kappa=1, alpha=0.5, min_neighbors=1, sketch_size=180, network_seed=987654321, attack_detection_window=5)
  - Sketch size: 180
  - Compression ratio: 6527.7x
  - Complexity: O(d + N×k) = O(1,174,986 + 20×180)
  - Theoretical speedup vs BALANCE: 19.9x
Initial test acc across nodes: mean=0.4953 ± 0.0174
Round 001: test acc mean=0.5547 ± 0.0351 | min=0.4968 max=0.6145
         : test loss mean=196.0559 ± 398.7534
         : individual accs = ['0.571248', '0.533685', '0.571008', '0.507913', '0.597907', '0.569749', '0.533389', '0.595089', '0.554289', '0.591526', '0.567973', '0.498322', '0.593214', '0.504178', '0.527025', '0.614519', '0.572938', '0.558813', '0.533647', '0.496771']
         : correct/total = [(8130, 14232), (7597, 14235), (8146, 14266), (7221, 14217), (8513, 14238), (8189, 14373), (7652, 14346), (8530, 14334), (7923, 14294), (8502, 14373), (8147, 14344), (7127, 14302), (8515, 14354), (7241, 14362), (7547, 14320), (8846, 14395), (8244, 14389), (7967, 14257), (7605, 14251), (7153, 14399)]
         : compromised: 0.5473, honest: 0.5843
         : sketchguard stats = ['Node 0: acc_rate=0.167', 'Node 1: acc_rate=0.333', 'Node 2: acc_rate=0.200']...
Round 002: test acc mean=0.5952 ± 0.0514 | min=0.5016 max=0.6446
         : test loss mean=58.0901 ± 120.5665
         : individual accs = ['0.638772', '0.553916', '0.608440', '0.503482', '0.641874', '0.636610', '0.616827', '0.644551', '0.627536', '0.596953', '0.631902', '0.501608', '0.570294', '0.511141', '0.628911', '0.638902', '0.644312', '0.576910', '0.627184', '0.504271']
         : correct/total = [(9091, 14232), (7885, 14235), (8680, 14266), (7158, 14217), (9139, 14238), (9150, 14373), (8849, 14346), (9239, 14334), (8970, 14294), (8580, 14373), (9064, 14344), (7174, 14302), (8186, 14354), (7341, 14362), (9006, 14320), (9197, 14395), (9271, 14389), (8225, 14257), (8938, 14251), (7261, 14399)]
         : compromised: 0.5834, honest: 0.6424
         : sketchguard stats = ['Node 0: acc_rate=0.167', 'Node 1: acc_rate=0.333', 'Node 2: acc_rate=0.200']...
Round 003: test acc mean=0.6038 ± 0.0530 | min=0.4945 max=0.6504
         : test loss mean=63.4146 ± 149.8125
         : individual accs = ['0.637788', '0.564313', '0.620777', '0.504748', '0.646509', '0.634314', '0.631744', '0.650412', '0.642717', '0.638419', '0.627649', '0.505384', '0.609029', '0.511419', '0.642249', '0.626051', '0.639933', '0.615277', '0.633499', '0.494548']
         : correct/total = [(9077, 14232), (8033, 14235), (8856, 14266), (7176, 14217), (9205, 14238), (9117, 14373), (9063, 14346), (9323, 14334), (9187, 14294), (9176, 14373), (9003, 14344), (7228, 14302), (8742, 14354), (7345, 14362), (9197, 14320), (9012, 14395), (9208, 14389), (8772, 14257), (9028, 14251), (7121, 14399)]
         : compromised: 0.5939, honest: 0.6437
         : sketchguard stats = ['Node 0: acc_rate=0.167', 'Node 1: acc_rate=0.333', 'Node 2: acc_rate=0.200']...
Round 004: test acc mean=0.6139 ± 0.0607 | min=0.4848 max=0.6548
         : test loss mean=102.9851 ± 233.8966
         : individual accs = ['0.650717', '0.608851', '0.641315', '0.484772', '0.651707', '0.649969', '0.649031', '0.649226', '0.647964', '0.646907', '0.651213', '0.497902', '0.648251', '0.492968', '0.634497', '0.643279', '0.654806', '0.637091', '0.636166', '0.501215']
         : correct/total = [(9261, 14232), (8667, 14235), (9149, 14266), (6892, 14217), (9279, 14238), (9342, 14373), (9311, 14346), (9306, 14334), (9262, 14294), (9298, 14373), (9341, 14344), (7121, 14302), (9305, 14354), (7080, 14362), (9086, 14320), (9260, 14395), (9422, 14389), (9083, 14257), (9066, 14251), (7217, 14399)]
         : compromised: 0.6045, honest: 0.6516
         : sketchguard stats = ['Node 0: acc_rate=0.167', 'Node 1: acc_rate=0.333', 'Node 2: acc_rate=0.200']...
Round 005: test acc mean=0.6230 ± 0.0615 | min=0.4893 max=0.6613
         : test loss mean=47.7373 ± 103.0735
         : individual accs = ['0.659500', '0.648894', '0.647834', '0.489273', '0.661259', '0.653517', '0.658232', '0.660737', '0.660627', '0.652265', '0.655675', '0.494616', '0.656960', '0.505292', '0.652304', '0.650990', '0.657586', '0.633934', '0.645779', '0.513994']
         : correct/total = [(9386, 14232), (9237, 14235), (9242, 14266), (6956, 14217), (9415, 14238), (9393, 14373), (9443, 14346), (9471, 14334), (9443, 14294), (9375, 14373), (9405, 14344), (7074, 14302), (9430, 14354), (7257, 14362), (9341, 14320), (9371, 14395), (9462, 14389), (9038, 14257), (9203, 14251), (7401, 14399)]
         : compromised: 0.6138, honest: 0.6598
         : sketchguard stats = ['Node 0: acc_rate=0.167', 'Node 1: acc_rate=0.300', 'Node 2: acc_rate=0.200']...
Round 006: test acc mean=0.6264 ± 0.0624 | min=0.4933 max=0.6663
         : test loss mean=41.2909 ± 90.5228
         : individual accs = ['0.652684', '0.659150', '0.652741', '0.516213', '0.664560', '0.661727', '0.658790', '0.666318', '0.665524', '0.657204', '0.660416', '0.493288', '0.665320', '0.497493', '0.659288', '0.646961', '0.657169', '0.640668', '0.649358', '0.503368']
         : correct/total = [(9289, 14232), (9383, 14235), (9312, 14266), (7339, 14217), (9462, 14238), (9511, 14373), (9451, 14346), (9551, 14334), (9513, 14294), (9446, 14373), (9473, 14344), (7055, 14302), (9550, 14354), (7145, 14362), (9441, 14320), (9313, 14395), (9456, 14389), (9134, 14257), (9254, 14251), (7248, 14399)]
         : compromised: 0.6180, honest: 0.6602
         : sketchguard stats = ['Node 0: acc_rate=0.167', 'Node 1: acc_rate=0.278', 'Node 2: acc_rate=0.200']...
Round 007: test acc mean=0.6294 ± 0.0668 | min=0.4896 max=0.6717
         : test loss mean=183.4437 ± 374.8717
         : individual accs = ['0.662521', '0.669336', '0.661643', '0.489555', '0.671724', '0.664510', '0.663948', '0.665550', '0.666573', '0.657692', '0.667945', '0.494406', '0.663439', '0.505222', '0.663966', '0.659743', '0.662867', '0.656379', '0.644376', '0.496562']
         : correct/total = [(9429, 14232), (9528, 14235), (9439, 14266), (6960, 14217), (9564, 14238), (9551, 14373), (9525, 14346), (9540, 14334), (9528, 14294), (9453, 14373), (9581, 14344), (7071, 14302), (9523, 14354), (7256, 14362), (9508, 14320), (9497, 14395), (9538, 14389), (9358, 14257), (9183, 14251), (7150, 14399)]
         : compromised: 0.6203, honest: 0.6657
         : sketchguard stats = ['Node 0: acc_rate=0.167', 'Node 1: acc_rate=0.262', 'Node 2: acc_rate=0.200']...
Round 008: test acc mean=0.6319 ± 0.0666 | min=0.4950 max=0.6754
         : test loss mean=326.4790 ± 781.2706
         : individual accs = ['0.662732', '0.659501', '0.663676', '0.511571', '0.669968', '0.670980', '0.675380', '0.672108', '0.673220', '0.664510', '0.670455', '0.494966', '0.669500', '0.496449', '0.666341', '0.667037', '0.662381', '0.660447', '0.630342', '0.496979']
         : correct/total = [(9432, 14232), (9388, 14235), (9468, 14266), (7273, 14217), (9539, 14238), (9644, 14373), (9689, 14346), (9634, 14334), (9623, 14294), (9551, 14373), (9617, 14344), (7079, 14302), (9610, 14354), (7130, 14362), (9542, 14320), (9602, 14395), (9531, 14389), (9416, 14257), (8983, 14251), (7156, 14399)]
         : compromised: 0.6232, honest: 0.6668
         : sketchguard stats = ['Node 0: acc_rate=0.167', 'Node 1: acc_rate=0.250', 'Node 2: acc_rate=0.200']...
Round 009: test acc mean=0.6312 ± 0.0645 | min=0.4967 max=0.6774
         : test loss mean=192.4416 ± 394.3572
         : individual accs = ['0.659289', '0.673973', '0.646783', '0.496659', '0.672426', '0.677381', '0.637739', '0.673294', '0.649993', '0.637167', '0.674289', '0.507691', '0.667340', '0.513786', '0.672905', '0.663355', '0.663979', '0.668373', '0.668234', '0.499201']
         : correct/total = [(9383, 14232), (9594, 14235), (9227, 14266), (7061, 14217), (9574, 14238), (9736, 14373), (9149, 14346), (9651, 14334), (9291, 14294), (9158, 14373), (9672, 14344), (7261, 14302), (9579, 14354), (7379, 14362), (9636, 14320), (9549, 14395), (9554, 14389), (9529, 14257), (9523, 14251), (7188, 14399)]
         : compromised: 0.6222, honest: 0.6672
         : sketchguard stats = ['Node 0: acc_rate=0.167', 'Node 1: acc_rate=0.241', 'Node 2: acc_rate=0.200']...
Round 010: test acc mean=0.6427 ± 0.0707 | min=0.4971 max=0.6870
         : test loss mean=207.4337 ± 425.9768
         : individual accs = ['0.682476', '0.679452', '0.674401', '0.503482', '0.678045', '0.679329', '0.675659', '0.682643', '0.687002', '0.680721', '0.680215', '0.497063', '0.683991', '0.507450', '0.676466', '0.668913', '0.676003', '0.676720', '0.664795', '0.498229']
         : correct/total = [(9713, 14232), (9672, 14235), (9621, 14266), (7158, 14217), (9654, 14238), (9764, 14373), (9693, 14346), (9785, 14334), (9820, 14294), (9784, 14373), (9757, 14344), (7109, 14302), (9818, 14354), (7288, 14362), (9687, 14320), (9629, 14395), (9727, 14389), (9648, 14257), (9474, 14251), (7174, 14399)]
         : compromised: 0.6334, honest: 0.6798
         : sketchguard stats = ['Node 0: acc_rate=0.167', 'Node 1: acc_rate=0.233', 'Node 2: acc_rate=0.200']...

=== FINAL RESULTS ===
Dataset: sent140, Nodes: 20, Graph: erdos, Aggregation: sketchguard
Attack: gaussian, 80.0% compromised
Final accuracy - Compromised: 0.6334, Honest: 0.6798
Overall test accuracy: mean=0.6427 ± 0.0707

=== Sketchguard SUMMARY ===
Node 0: acceptance=0.167
Node 1: acceptance=0.233
Node 2: acceptance=0.200
Node 3: acceptance=0.500
Node 4: acceptance=0.250
Node 5: acceptance=0.200
Node 6: acceptance=0.200
Node 7: acceptance=0.200
Node 8: acceptance=0.500
Node 9: acceptance=0.333
Node 10: acceptance=0.250
Node 11: acceptance=0.500
Node 12: acceptance=0.329
Node 13: acceptance=0.500
Node 14: acceptance=0.143
Node 15: acceptance=0.167
Node 16: acceptance=0.200
Node 17: acceptance=0.280
Node 18: acceptance=0.250
Node 19: acceptance=0.500

=== PARALLEL EXECUTION TIME (realistic for distributed system) ===
  COMMUNICATION (max across nodes):
    - Sketch transfer: 0.000s (0.0%)
    - Model fetch (accepted): 0.000s (0.0%)
  COMPUTATION (max across nodes):
    - Sketching: 0.254s (95.6%)
    - Filtering: 0.001s (0.3%)
    - Aggregation: 0.011s (4.1%)
  TOTALS:
    - Total computation: 0.266s (100.0%)
    - Total communication: 0.000s (0.0%)
    - Total parallel time: 0.266s

=== PER-NODE AVERAGE TIME ===
  - Sketching: 0.175s
  - Filtering: 0.000s
  - Aggregation: 0.007s
  - Sketch transfer: 0.000s
  - Model fetch: 0.000s
  - Total per node: 0.182s

=== TOTAL COMPUTATIONAL WORK (sum across all nodes) ===
  - Total sketching: 3.494s
  - Total filtering: 0.008s
  - Total aggregation: 0.137s
  - Total sketch transfer: 0.000s
  - Total model fetch: 0.000s
  - Grand total: 3.639s
  - Mean acceptance rate: 0.295

Sketchguard Algorithm Properties:
  - Original dimension: 1,174,986
  - Sketch size: 180
  - Compression ratio: 19.9x
  - Single repetition: No repetitions needed
  - Theoretical complexity: O(d + N×k)
  - Approach: Sketch filtering + state aggregation
