Device: cuda
Seed: 987654321
Loading 1 LEAF Sent140 train files...
LEAF Sent140 train: 254555 users, 908652 samples
Building vocabulary (max_size=10000)...
Vocabulary size: 10000
Loading 1 LEAF Sent140 test files...
LEAF Sent140 test: 254555 users, 286281 samples
Found 254555 train users, 254555 test users, 254555 common users
User sample counts range: 494 (max) to 1 (min)
Distributed ALL 254555 users across 20 clients
Users per client: 12727 (with 15 clients getting +1 user)
Train partition sizes: [44353, 44290, 44657, 44907, 44696, 45843, 45801, 45619, 45069, 45639, 45821, 45311, 45779, 46056, 45625, 45984, 46428, 44737, 45540, 46497]
Test partition sizes: [14232, 14235, 14266, 14217, 14238, 14373, 14346, 14334, 14294, 14373, 14344, 14302, 14354, 14362, 14320, 14395, 14389, 14257, 14251, 14399]
  Client 0: 44353 train samples, 2 unique classes
  Client 1: 44290 train samples, 2 unique classes
  Client 2: 44657 train samples, 2 unique classes
  Client 3: 44907 train samples, 2 unique classes
  Client 4: 44696 train samples, 2 unique classes
  Client 5: 45843 train samples, 2 unique classes
  Client 6: 45801 train samples, 2 unique classes
  Client 7: 45619 train samples, 2 unique classes
  Client 8: 45069 train samples, 2 unique classes
  Client 9: 45639 train samples, 2 unique classes
  Client 10: 45821 train samples, 2 unique classes
  Client 11: 45311 train samples, 2 unique classes
  Client 12: 45779 train samples, 2 unique classes
  Client 13: 46056 train samples, 2 unique classes
  Client 14: 45625 train samples, 2 unique classes
  Client 15: 45984 train samples, 2 unique classes
  Client 16: 46428 train samples, 2 unique classes
  Client 17: 44737 train samples, 2 unique classes
  Client 18: 45540 train samples, 2 unique classes
  Client 19: 46497 train samples, 2 unique classes
Will sample 4500 samples per client per epoch
Graph: erdos, nodes: 20, edges: 99
Degree statistics: avg=9.90, min=7, max=14
Attack: Compromised 16/20 nodes: [1, 2, 3, 5, 6, 8, 9, 10, 11, 12, 13, 14, 15, 17, 18, 19]
Attack type: gaussian, lambda: 1.0
Model variant: baseline
Model parameters: 1,174,986
Sketchguard Node 0:
  Model dim: 1,174,986 → Sketch size: 180
  Compression ratio: 6527.7x
  Using model parameters for aggregation, sketches for filtering
Sketchguard Node 1:
  Model dim: 1,174,986 → Sketch size: 180
  Compression ratio: 6527.7x
  Using model parameters for aggregation, sketches for filtering
Sketchguard Node 2:
  Model dim: 1,174,986 → Sketch size: 180
  Compression ratio: 6527.7x
  Using model parameters for aggregation, sketches for filtering
Sketchguard Node 3:
  Model dim: 1,174,986 → Sketch size: 180
  Compression ratio: 6527.7x
  Using model parameters for aggregation, sketches for filtering
Sketchguard Node 4:
  Model dim: 1,174,986 → Sketch size: 180
  Compression ratio: 6527.7x
  Using model parameters for aggregation, sketches for filtering
Sketchguard Node 5:
  Model dim: 1,174,986 → Sketch size: 180
  Compression ratio: 6527.7x
  Using model parameters for aggregation, sketches for filtering
Sketchguard Node 6:
  Model dim: 1,174,986 → Sketch size: 180
  Compression ratio: 6527.7x
  Using model parameters for aggregation, sketches for filtering
Sketchguard Node 7:
  Model dim: 1,174,986 → Sketch size: 180
  Compression ratio: 6527.7x
  Using model parameters for aggregation, sketches for filtering
Sketchguard Node 8:
  Model dim: 1,174,986 → Sketch size: 180
  Compression ratio: 6527.7x
  Using model parameters for aggregation, sketches for filtering
Sketchguard Node 9:
  Model dim: 1,174,986 → Sketch size: 180
  Compression ratio: 6527.7x
  Using model parameters for aggregation, sketches for filtering
Sketchguard Node 10:
  Model dim: 1,174,986 → Sketch size: 180
  Compression ratio: 6527.7x
  Using model parameters for aggregation, sketches for filtering
Sketchguard Node 11:
  Model dim: 1,174,986 → Sketch size: 180
  Compression ratio: 6527.7x
  Using model parameters for aggregation, sketches for filtering
Sketchguard Node 12:
  Model dim: 1,174,986 → Sketch size: 180
  Compression ratio: 6527.7x
  Using model parameters for aggregation, sketches for filtering
Sketchguard Node 13:
  Model dim: 1,174,986 → Sketch size: 180
  Compression ratio: 6527.7x
  Using model parameters for aggregation, sketches for filtering
Sketchguard Node 14:
  Model dim: 1,174,986 → Sketch size: 180
  Compression ratio: 6527.7x
  Using model parameters for aggregation, sketches for filtering
Sketchguard Node 15:
  Model dim: 1,174,986 → Sketch size: 180
  Compression ratio: 6527.7x
  Using model parameters for aggregation, sketches for filtering
Sketchguard Node 16:
  Model dim: 1,174,986 → Sketch size: 180
  Compression ratio: 6527.7x
  Using model parameters for aggregation, sketches for filtering
Sketchguard Node 17:
  Model dim: 1,174,986 → Sketch size: 180
  Compression ratio: 6527.7x
  Using model parameters for aggregation, sketches for filtering
Sketchguard Node 18:
  Model dim: 1,174,986 → Sketch size: 180
  Compression ratio: 6527.7x
  Using model parameters for aggregation, sketches for filtering
Sketchguard Node 19:
  Model dim: 1,174,986 → Sketch size: 180
  Compression ratio: 6527.7x
  Using model parameters for aggregation, sketches for filtering
Sketchguard ALGORITHM (Sketch-based Filtering + State Aggregation)
  - Model dimension: 1,174,986 parameters
  - Config: SketchguardConfig(gamma=2, kappa=1, alpha=0.5, min_neighbors=1, sketch_size=180, network_seed=987654321, attack_detection_window=5)
  - Sketch size: 180
  - Compression ratio: 6527.7x
  - Complexity: O(d + N×k) = O(1,174,986 + 20×180)
  - Theoretical speedup vs BALANCE: 19.9x
Initial test acc across nodes: mean=0.4965 ± 0.0152
Round 001: test acc mean=0.5345 ± 0.0222 | min=0.4976 max=0.5902
         : test loss mean=43.4159 ± 186.2316
         : individual accs = ['0.519604', '0.551809', '0.524814', '0.509601', '0.561877', '0.530509', '0.507040', '0.563555', '0.533581', '0.590204', '0.510666', '0.551951', '0.550160', '0.539410', '0.530517', '0.513373', '0.545903', '0.527460', '0.530489', '0.497604']
         : correct/total = [(7395, 14232), (7855, 14235), (7487, 14266), (7245, 14217), (8000, 14238), (7625, 14373), (7274, 14346), (8078, 14334), (7627, 14294), (8483, 14373), (7325, 14344), (7894, 14302), (7897, 14354), (7747, 14362), (7597, 14320), (7390, 14395), (7855, 14389), (7520, 14257), (7560, 14251), (7165, 14399)]
         : compromised: 0.5312, honest: 0.5477
         : sketchguard stats = ['Node 0: acc_rate=0.167', 'Node 1: acc_rate=0.400', 'Node 2: acc_rate=0.250']...
Round 002: test acc mean=0.5319 ± 0.0399 | min=0.4880 max=0.6054
         : test loss mean=21.9551 ± 92.6921
         : individual accs = ['0.564362', '0.487952', '0.490537', '0.573609', '0.589128', '0.507410', '0.531856', '0.605414', '0.557297', '0.500035', '0.500070', '0.595791', '0.500000', '0.561064', '0.495740', '0.498506', '0.577733', '0.503963', '0.498351', '0.498785']
         : correct/total = [(8032, 14232), (6946, 14235), (6998, 14266), (8155, 14217), (8388, 14238), (7293, 14373), (7630, 14346), (8678, 14334), (7966, 14294), (7187, 14373), (7173, 14344), (8521, 14302), (7177, 14354), (8058, 14362), (7099, 14320), (7176, 14395), (8313, 14389), (7185, 14257), (7102, 14251), (7182, 14399)]
         : compromised: 0.5188, honest: 0.5842
         : sketchguard stats = ['Node 0: acc_rate=0.167', 'Node 1: acc_rate=0.400', 'Node 2: acc_rate=0.250']...
Round 003: test acc mean=0.5414 ± 0.0415 | min=0.4922 max=0.6076
         : test loss mean=8.2734 ± 33.0683
         : individual accs = ['0.579609', '0.504812', '0.539745', '0.591123', '0.596362', '0.497461', '0.542730', '0.607646', '0.566881', '0.497878', '0.499233', '0.594322', '0.501254', '0.586896', '0.502235', '0.498367', '0.586837', '0.508312', '0.534208', '0.492187']
         : correct/total = [(8249, 14232), (7186, 14235), (7700, 14266), (8404, 14217), (8491, 14238), (7150, 14373), (7786, 14346), (8710, 14334), (8103, 14294), (7156, 14373), (7161, 14344), (8500, 14302), (7195, 14354), (8429, 14362), (7192, 14320), (7174, 14395), (8444, 14389), (7247, 14257), (7613, 14251), (7087, 14399)]
         : compromised: 0.5286, honest: 0.5926
         : sketchguard stats = ['Node 0: acc_rate=0.167', 'Node 1: acc_rate=0.400', 'Node 2: acc_rate=0.250']...
Round 004: test acc mean=0.5841 ± 0.0232 | min=0.5136 max=0.6119
         : test loss mean=4.6713 ± 17.3918
         : individual accs = ['0.603429', '0.582297', '0.590214', '0.611873', '0.607740', '0.576428', '0.583438', '0.611692', '0.596054', '0.576637', '0.554448', '0.602014', '0.576355', '0.600543', '0.550279', '0.575964', '0.599069', '0.577751', '0.592941', '0.513647']
         : correct/total = [(8588, 14232), (8289, 14235), (8420, 14266), (8699, 14217), (8653, 14238), (8285, 14373), (8370, 14346), (8768, 14334), (8520, 14294), (8288, 14373), (7953, 14344), (8610, 14302), (8273, 14354), (8625, 14362), (7880, 14320), (8291, 14395), (8620, 14389), (8237, 14257), (8450, 14251), (7396, 14399)]
         : compromised: 0.5788, honest: 0.6055
         : sketchguard stats = ['Node 0: acc_rate=0.167', 'Node 1: acc_rate=0.400', 'Node 2: acc_rate=0.250']...
Round 005: test acc mean=0.5990 ± 0.0246 | min=0.4971 max=0.6226
         : test loss mean=11.8896 ± 48.8927
         : individual accs = ['0.609542', '0.605479', '0.588252', '0.622565', '0.614763', '0.606415', '0.601771', '0.614553', '0.596964', '0.600918', '0.595301', '0.606279', '0.599136', '0.611544', '0.595740', '0.606877', '0.606574', '0.601249', '0.599607', '0.497118']
         : correct/total = [(8675, 14232), (8619, 14235), (8392, 14266), (8851, 14217), (8753, 14238), (8716, 14373), (8633, 14346), (8809, 14334), (8533, 14294), (8637, 14373), (8539, 14344), (8671, 14302), (8600, 14354), (8783, 14362), (8531, 14320), (8736, 14395), (8728, 14389), (8572, 14257), (8545, 14251), (7158, 14399)]
         : compromised: 0.5960, honest: 0.6114
         : sketchguard stats = ['Node 0: acc_rate=0.167', 'Node 1: acc_rate=0.400', 'Node 2: acc_rate=0.250']...
Round 006: test acc mean=0.6080 ± 0.0267 | min=0.4946 max=0.6243
         : test loss mean=4.5847 ± 17.0994
         : individual accs = ['0.613758', '0.613909', '0.610893', '0.624323', '0.620523', '0.617477', '0.616478', '0.620692', '0.611235', '0.610659', '0.619074', '0.617116', '0.618991', '0.621223', '0.600140', '0.607919', '0.605254', '0.609525', '0.605291', '0.494618']
         : correct/total = [(8735, 14232), (8739, 14235), (8715, 14266), (8876, 14217), (8835, 14238), (8875, 14373), (8844, 14346), (8897, 14334), (8737, 14294), (8777, 14373), (8880, 14344), (8826, 14302), (8885, 14354), (8922, 14362), (8594, 14320), (8751, 14395), (8709, 14389), (8690, 14257), (8626, 14251), (7122, 14399)]
         : compromised: 0.6062, honest: 0.6151
         : sketchguard stats = ['Node 0: acc_rate=0.167', 'Node 1: acc_rate=0.400', 'Node 2: acc_rate=0.250']...
Round 007: test acc mean=0.6199 ± 0.0252 | min=0.5114 max=0.6346
         : test loss mean=41.3238 ± 177.2888
         : individual accs = ['0.634556', '0.623393', '0.620496', '0.632412', '0.633095', '0.627774', '0.627004', '0.626134', '0.623548', '0.628261', '0.624512', '0.628304', '0.624913', '0.628185', '0.620531', '0.620980', '0.621655', '0.620537', '0.619816', '0.511424']
         : correct/total = [(9031, 14232), (8874, 14235), (8852, 14266), (8991, 14217), (9014, 14238), (9023, 14373), (8995, 14346), (8975, 14334), (8913, 14294), (9030, 14373), (8958, 14344), (8986, 14302), (8970, 14354), (9022, 14362), (8886, 14320), (8939, 14395), (8945, 14389), (8847, 14257), (8833, 14251), (7364, 14399)]
         : compromised: 0.6176, honest: 0.6289
         : sketchguard stats = ['Node 0: acc_rate=0.167', 'Node 1: acc_rate=0.400', 'Node 2: acc_rate=0.250']...
Round 008: test acc mean=0.6251 ± 0.0286 | min=0.5012 max=0.6382
         : test loss mean=60.8671 ± 262.5051
         : individual accs = ['0.636313', '0.630207', '0.627576', '0.637828', '0.638151', '0.627913', '0.630908', '0.630947', '0.632923', '0.630696', '0.634690', '0.630751', '0.638150', '0.631249', '0.627304', '0.629246', '0.626520', '0.628744', '0.631394', '0.501215']
         : correct/total = [(9056, 14232), (8971, 14235), (8953, 14266), (9068, 14217), (9086, 14238), (9025, 14373), (9051, 14346), (9044, 14334), (9047, 14294), (9065, 14373), (9104, 14344), (9021, 14302), (9160, 14354), (9066, 14362), (8983, 14320), (9058, 14395), (9015, 14389), (8964, 14257), (8998, 14251), (7217, 14399)]
         : compromised: 0.6232, honest: 0.6330
         : sketchguard stats = ['Node 0: acc_rate=0.167', 'Node 1: acc_rate=0.400', 'Node 2: acc_rate=0.250']...
Round 009: test acc mean=0.6307 ± 0.0308 | min=0.4982 max=0.6467
         : test loss mean=35.5273 ± 152.0748
         : individual accs = ['0.646712', '0.641658', '0.637109', '0.640853', '0.645667', '0.636541', '0.635229', '0.633808', '0.639499', '0.639811', '0.642777', '0.638162', '0.640518', '0.631876', '0.625768', '0.637027', '0.630551', '0.634004', '0.637780', '0.498160']
         : correct/total = [(9204, 14232), (9134, 14235), (9089, 14266), (9111, 14217), (9193, 14238), (9149, 14373), (9113, 14346), (9085, 14334), (9141, 14294), (9196, 14373), (9220, 14344), (9127, 14302), (9194, 14354), (9075, 14362), (8961, 14320), (9170, 14395), (9073, 14389), (9039, 14257), (9089, 14251), (7173, 14399)]
         : compromised: 0.6285, honest: 0.6392
         : sketchguard stats = ['Node 0: acc_rate=0.167', 'Node 1: acc_rate=0.400', 'Node 2: acc_rate=0.250']...
Round 010: test acc mean=0.6347 ± 0.0306 | min=0.5027 max=0.6497
         : test loss mean=37.9419 ± 162.6150
         : individual accs = ['0.648047', '0.647629', '0.636058', '0.644369', '0.649740', '0.640715', '0.639342', '0.639738', '0.642927', '0.644055', '0.647936', '0.636345', '0.648182', '0.634800', '0.635894', '0.640570', '0.636528', '0.636038', '0.641850', '0.502674']
         : correct/total = [(9223, 14232), (9219, 14235), (9074, 14266), (9161, 14217), (9251, 14238), (9209, 14373), (9172, 14346), (9170, 14334), (9190, 14294), (9257, 14373), (9294, 14344), (9101, 14302), (9304, 14354), (9117, 14362), (9106, 14320), (9221, 14395), (9159, 14389), (9068, 14257), (9147, 14251), (7238, 14399)]
         : compromised: 0.6325, honest: 0.6435
         : sketchguard stats = ['Node 0: acc_rate=0.167', 'Node 1: acc_rate=0.400', 'Node 2: acc_rate=0.250']...

=== FINAL RESULTS ===
Dataset: sent140, Nodes: 20, Graph: erdos, Aggregation: sketchguard
Attack: gaussian, 80.0% compromised
Final accuracy - Compromised: 0.6325, Honest: 0.6435
Overall test accuracy: mean=0.6347 ± 0.0306

=== Sketchguard SUMMARY ===
Node 0: acceptance=0.167
Node 1: acceptance=0.400
Node 2: acceptance=0.250
Node 3: acceptance=0.143
Node 4: acceptance=0.222
Node 5: acceptance=0.200
Node 6: acceptance=0.083
Node 7: acceptance=0.091
Node 8: acceptance=0.143
Node 9: acceptance=0.364
Node 10: acceptance=0.250
Node 11: acceptance=0.083
Node 12: acceptance=0.250
Node 13: acceptance=0.111
Node 14: acceptance=0.214
Node 15: acceptance=0.222
Node 16: acceptance=0.143
Node 17: acceptance=0.375
Node 18: acceptance=0.250
Node 19: acceptance=0.500

=== PARALLEL EXECUTION TIME (realistic for distributed system) ===
  COMMUNICATION (max across nodes):
    - Sketch transfer: 0.000s (0.0%)
    - Model fetch (accepted): 0.000s (0.0%)
  COMPUTATION (max across nodes):
    - Sketching: 0.302s (95.4%)
    - Filtering: 0.001s (0.3%)
    - Aggregation: 0.013s (4.3%)
  TOTALS:
    - Total computation: 0.316s (100.0%)
    - Total communication: 0.000s (0.0%)
    - Total parallel time: 0.316s

=== PER-NODE AVERAGE TIME ===
  - Sketching: 0.200s
  - Filtering: 0.001s
  - Aggregation: 0.008s
  - Sketch transfer: 0.000s
  - Model fetch: 0.000s
  - Total per node: 0.208s

=== TOTAL COMPUTATIONAL WORK (sum across all nodes) ===
  - Total sketching: 3.991s
  - Total filtering: 0.011s
  - Total aggregation: 0.162s
  - Total sketch transfer: 0.000s
  - Total model fetch: 0.000s
  - Grand total: 4.163s
  - Mean acceptance rate: 0.223

Sketchguard Algorithm Properties:
  - Original dimension: 1,174,986
  - Sketch size: 180
  - Compression ratio: 19.9x
  - Single repetition: No repetitions needed
  - Theoretical complexity: O(d + N×k)
  - Approach: Sketch filtering + state aggregation
