Device: cuda
Seed: 987654321
Loading 1 LEAF Sent140 train files...
LEAF Sent140 train: 254555 users, 908652 samples
Building vocabulary (max_size=10000)...
Vocabulary size: 10000
Loading 1 LEAF Sent140 test files...
LEAF Sent140 test: 254555 users, 286281 samples
Found 254555 train users, 254555 test users, 254555 common users
User sample counts range: 494 (max) to 1 (min)
Distributed ALL 254555 users across 20 clients
Users per client: 12727 (with 15 clients getting +1 user)
Train partition sizes: [44353, 44290, 44657, 44907, 44696, 45843, 45801, 45619, 45069, 45639, 45821, 45311, 45779, 46056, 45625, 45984, 46428, 44737, 45540, 46497]
Test partition sizes: [14232, 14235, 14266, 14217, 14238, 14373, 14346, 14334, 14294, 14373, 14344, 14302, 14354, 14362, 14320, 14395, 14389, 14257, 14251, 14399]
  Client 0: 44353 train samples, 2 unique classes
  Client 1: 44290 train samples, 2 unique classes
  Client 2: 44657 train samples, 2 unique classes
  Client 3: 44907 train samples, 2 unique classes
  Client 4: 44696 train samples, 2 unique classes
  Client 5: 45843 train samples, 2 unique classes
  Client 6: 45801 train samples, 2 unique classes
  Client 7: 45619 train samples, 2 unique classes
  Client 8: 45069 train samples, 2 unique classes
  Client 9: 45639 train samples, 2 unique classes
  Client 10: 45821 train samples, 2 unique classes
  Client 11: 45311 train samples, 2 unique classes
  Client 12: 45779 train samples, 2 unique classes
  Client 13: 46056 train samples, 2 unique classes
  Client 14: 45625 train samples, 2 unique classes
  Client 15: 45984 train samples, 2 unique classes
  Client 16: 46428 train samples, 2 unique classes
  Client 17: 44737 train samples, 2 unique classes
  Client 18: 45540 train samples, 2 unique classes
  Client 19: 46497 train samples, 2 unique classes
Will sample 4500 samples per client per epoch
Graph: erdos, nodes: 20, edges: 99
Degree statistics: avg=9.90, min=7, max=14
Attack: Compromised 12/20 nodes: [1, 2, 3, 5, 8, 11, 12, 13, 14, 15, 17, 18]
Attack type: backdoor, lambda: 1.0
Backdoor target label: 1, trigger size: 3
Model variant: baseline
Model parameters: 1,174,986
BALANCE algorithm:
Balance Config: BALANCEConfig(gamma=2, kappa=1, alpha=0.5, min_neighbors=1)
  - Model dimension: 1,174,986 parameters
  - Complexity: O(N×d) = O(20×1,174,986)
Initial test acc across nodes: mean=0.4965 ± 0.0152
Backdoor attack: Created poisoned datasets for 12 compromised nodes
Round 001: test acc mean=0.5000 ± 0.0076 | min=0.4851 max=0.5128
         : test loss mean=21.9402 ± 17.8009
         : individual accs = ['0.502740', '0.512821', '0.486331', '0.501512', '0.500702', '0.494817', '0.493029', '0.485070', '0.506296', '0.490433', '0.506972', '0.512166', '0.504389', '0.505849', '0.502304', '0.500868', '0.495934', '0.505296', '0.491544', '0.501285']
         : correct/total = [(7155, 14232), (7300, 14235), (6938, 14266), (7130, 14217), (7129, 14238), (7112, 14373), (7073, 14346), (6953, 14334), (7237, 14294), (7049, 14373), (7272, 14344), (7325, 14302), (7240, 14354), (7265, 14362), (7193, 14320), (7210, 14395), (7136, 14389), (7204, 14257), (7005, 14251), (7218, 14399)]
         : compromised: 0.5020, honest: 0.4970
Round 002: test acc mean=0.5014 ± 0.0090 | min=0.4877 max=0.5191
         : test loss mean=830.8937 ± 686.6070
         : individual accs = ['0.508432', '0.496101', '0.492079', '0.510234', '0.514117', '0.502261', '0.519099', '0.493721', '0.507905', '0.493425', '0.518126', '0.504825', '0.500836', '0.490809', '0.506075', '0.494755', '0.494544', '0.495756', '0.497719', '0.487742']
         : correct/total = [(7236, 14232), (7062, 14235), (7020, 14266), (7254, 14217), (7320, 14238), (7219, 14373), (7447, 14346), (7077, 14334), (7260, 14294), (7092, 14373), (7432, 14344), (7220, 14302), (7189, 14354), (7049, 14362), (7247, 14320), (7122, 14395), (7116, 14389), (7068, 14257), (7093, 14251), (7023, 14399)]
         : compromised: 0.4999, honest: 0.5037
Round 003: test acc mean=0.5028 ± 0.0112 | min=0.4884 max=0.5310
         : test loss mean=53687.7323 ± 45059.9920
         : individual accs = ['0.504637', '0.495680', '0.498107', '0.493916', '0.505338', '0.511028', '0.519030', '0.519185', '0.489926', '0.506436', '0.530954', '0.488533', '0.509614', '0.497076', '0.504190', '0.500452', '0.488359', '0.509224', '0.488667', '0.495451']
         : correct/total = [(7182, 14232), (7056, 14235), (7106, 14266), (7022, 14217), (7195, 14238), (7345, 14373), (7446, 14346), (7442, 14334), (7003, 14294), (7279, 14373), (7616, 14344), (6987, 14302), (7315, 14354), (7139, 14362), (7220, 14320), (7204, 14395), (7027, 14389), (7260, 14257), (6964, 14251), (7134, 14399)]
         : compromised: 0.4989, honest: 0.5087
Round 004: test acc mean=0.5116 ± 0.0196 | min=0.4816 max=0.5512
         : test loss mean=7097061.4371 ± 6330612.0009
         : individual accs = ['0.537381', '0.484440', '0.481635', '0.496659', '0.531746', '0.498226', '0.528091', '0.532161', '0.484609', '0.531413', '0.551241', '0.505803', '0.518253', '0.506754', '0.499581', '0.507885', '0.514490', '0.496528', '0.494071', '0.530315']
         : correct/total = [(7648, 14232), (6896, 14235), (6871, 14266), (7061, 14217), (7571, 14238), (7161, 14373), (7576, 14346), (7628, 14334), (6927, 14294), (7638, 14373), (7907, 14344), (7234, 14302), (7439, 14354), (7278, 14362), (7154, 14320), (7311, 14395), (7403, 14389), (7079, 14257), (7041, 14251), (7636, 14399)]
         : compromised: 0.4979, honest: 0.5321
Round 005: test acc mean=0.5190 ± 0.0270 | min=0.4913 max=0.5607
         : test loss mean=379323318.2690 ± 316660076.2899
         : individual accs = ['0.548693', '0.491746', '0.494673', '0.496307', '0.540947', '0.492869', '0.549143', '0.539696', '0.501049', '0.552633', '0.559677', '0.491330', '0.504459', '0.498886', '0.495740', '0.508579', '0.558065', '0.503612', '0.491685', '0.560733']
         : correct/total = [(7809, 14232), (7000, 14235), (7057, 14266), (7056, 14217), (7702, 14238), (7084, 14373), (7878, 14346), (7736, 14334), (7162, 14294), (7943, 14373), (8028, 14344), (7027, 14302), (7241, 14354), (7165, 14362), (7099, 14320), (7321, 14395), (8030, 14389), (7180, 14257), (7007, 14251), (8074, 14399)]
         : compromised: 0.4976, honest: 0.5512
Round 006: test acc mean=0.5277 ± 0.0329 | min=0.4901 max=0.5787
         : test loss mean=29051288791.8383 ± 24308045826.8333
         : individual accs = ['0.564924', '0.496593', '0.490116', '0.496307', '0.559629', '0.508453', '0.572285', '0.547370', '0.503148', '0.567314', '0.578709', '0.500280', '0.508778', '0.500627', '0.501327', '0.506287', '0.571965', '0.505646', '0.500316', '0.573929']
         : correct/total = [(8040, 14232), (7069, 14235), (6992, 14266), (7056, 14217), (7968, 14238), (7308, 14373), (8210, 14346), (7846, 14334), (7192, 14294), (8154, 14373), (8301, 14344), (7155, 14302), (7303, 14354), (7190, 14362), (7179, 14320), (7288, 14395), (8230, 14389), (7209, 14257), (7130, 14251), (8264, 14399)]
         : compromised: 0.5015, honest: 0.5670
Round 007: test acc mean=0.5374 ± 0.0403 | min=0.4927 max=0.5906
         : test loss mean=2401380065380.3208 ± 2007268786889.2473
         : individual accs = ['0.580453', '0.494626', '0.492710', '0.503833', '0.588285', '0.502470', '0.589851', '0.579252', '0.501889', '0.586516', '0.590630', '0.507971', '0.508290', '0.498259', '0.518156', '0.515248', '0.586698', '0.513151', '0.502421', '0.587610']
         : correct/total = [(8261, 14232), (7041, 14235), (7029, 14266), (7163, 14217), (8376, 14238), (7222, 14373), (8462, 14346), (8303, 14334), (7174, 14294), (8430, 14373), (8472, 14344), (7265, 14302), (7296, 14354), (7156, 14362), (7420, 14320), (7417, 14395), (8442, 14389), (7316, 14257), (7160, 14251), (8461, 14399)]
         : compromised: 0.5049, honest: 0.5862
Round 008: test acc mean=0.5411 ± 0.0459 | min=0.4980 max=0.6003
         : test loss mean=200344211024843.9375 ± 168164088632211.8125
         : individual accs = ['0.592608', '0.497998', '0.504346', '0.502919', '0.597767', '0.500522', '0.597309', '0.593275', '0.500560', '0.600083', '0.600321', '0.501538', '0.507942', '0.502507', '0.510545', '0.509621', '0.597262', '0.500456', '0.505017', '0.598444']
         : correct/total = [(8434, 14232), (7089, 14235), (7195, 14266), (7150, 14217), (8511, 14238), (7194, 14373), (8569, 14346), (8504, 14334), (7155, 14294), (8625, 14373), (8611, 14344), (7173, 14302), (7291, 14354), (7217, 14362), (7311, 14320), (7336, 14395), (8594, 14389), (7135, 14257), (7197, 14251), (8617, 14399)]
         : compromised: 0.5037, honest: 0.5971
Round 009: test acc mean=0.5447 ± 0.0498 | min=0.4965 max=0.6143
         : test loss mean=16951805833905098.0000 ± 14178180841382132.0000
         : individual accs = ['0.603288', '0.498138', '0.503505', '0.500950', '0.605773', '0.501218', '0.607277', '0.602065', '0.502798', '0.614346', '0.605061', '0.507691', '0.507036', '0.509887', '0.510265', '0.512192', '0.603030', '0.496528', '0.499895', '0.603306']
         : correct/total = [(8586, 14232), (7091, 14235), (7183, 14266), (7122, 14217), (8625, 14238), (7204, 14373), (8712, 14346), (8630, 14334), (7187, 14294), (8830, 14373), (8679, 14344), (7261, 14302), (7278, 14354), (7323, 14362), (7307, 14320), (7373, 14395), (8677, 14389), (7079, 14257), (7124, 14251), (8687, 14399)]
         : compromised: 0.5042, honest: 0.6055
Round 010: test acc mean=0.5488 ± 0.0522 | min=0.4972 max=0.6204
         : test loss mean=1441067731783964160.0000 ± 1206208611298106880.0000
         : individual accs = ['0.612352', '0.502845', '0.497196', '0.502427', '0.614834', '0.504557', '0.610205', '0.611902', '0.505527', '0.620399', '0.614682', '0.506013', '0.510032', '0.507589', '0.514385', '0.516499', '0.607825', '0.503402', '0.505368', '0.607889']
         : correct/total = [(8715, 14232), (7158, 14235), (7093, 14266), (7143, 14217), (8754, 14238), (7252, 14373), (8754, 14346), (8771, 14334), (7226, 14294), (8917, 14373), (8817, 14344), (7237, 14302), (7321, 14354), (7290, 14362), (7366, 14320), (7435, 14395), (8746, 14389), (7177, 14257), (7202, 14251), (8753, 14399)]
         : compromised: 0.5063, honest: 0.6125

=== FINAL RESULTS ===
Dataset: sent140, Nodes: 20, Graph: erdos, Aggregation: balance
Attack: backdoor, 60.0% compromised
Final accuracy - Compromised: 0.5063, Honest: 0.6125
Overall test accuracy: mean=0.5488 ± 0.0522

=== BACKDOOR ATTACK SUCCESS RATE (ASR) ===
Target label: 1
Trigger size: 3x3
Overall ASR: 0.8146 ± 0.2244
Honest nodes ASR: 0.5410 ± 0.0345
Compromised nodes ASR: 0.9969 ± 0.0014
Note: Higher ASR indicates more successful backdoor attack

=== BALANCE SUMMARY ===
Node 0: acceptance=0.475
Node 1: acceptance=0.600
Node 2: acceptance=0.600
Node 3: acceptance=0.600
Node 4: acceptance=0.400
Node 5: acceptance=0.700
Node 6: acceptance=0.400
Node 7: acceptance=0.345
Node 8: acceptance=0.600
Node 9: acceptance=0.591
Node 10: acceptance=0.550
Node 11: acceptance=0.600
Node 12: acceptance=0.600
Node 13: acceptance=0.600
Node 14: acceptance=0.600
Node 15: acceptance=0.600
Node 16: acceptance=0.357
Node 17: acceptance=0.600
Node 18: acceptance=0.600
Node 19: acceptance=0.370

=== PARALLEL EXECUTION TIME (realistic for distributed system) ===
  COMMUNICATION (max across nodes):
    - Full model transfer: 0.000s (0.0%)
  COMPUTATION (max across nodes):
    - Filtering: 0.057s (80.7%)
    - Aggregation: 0.014s (19.3%)
  TOTALS:
    - Total computation: 0.071s (100.0%)
    - Total communication: 0.000s (0.0%)
    - Total parallel time: 0.071s

=== PER-NODE AVERAGE TIME ===
  - Filtering: 0.045s
  - Aggregation: 0.007s
  - Model transfer: 0.000s
  - Total per node: 0.052s

=== TOTAL COMPUTATIONAL WORK (sum across all nodes) ===
  - Total filtering: 0.891s
  - Total aggregation: 0.146s
  - Total model transfer: 0.000s
  - Grand total: 1.037s
  - Mean acceptance rate: 0.539

BALANCE Algorithm Properties:
  - Model dimension: 1,174,986
  - No compression: Full parameter comparison
  - Theoretical complexity: O(deg(i)×d)
  - Approach: Full parameter filtering + averaging
