Device: cuda
Seed: 987654321
Loading 1 LEAF Sent140 train files...
LEAF Sent140 train: 254555 users, 908652 samples
Building vocabulary (max_size=10000)...
Vocabulary size: 10000
Loading 1 LEAF Sent140 test files...
LEAF Sent140 test: 254555 users, 286281 samples
Found 254555 train users, 254555 test users, 254555 common users
User sample counts range: 494 (max) to 1 (min)
Distributed ALL 254555 users across 20 clients
Users per client: 12727 (with 15 clients getting +1 user)
Train partition sizes: [44353, 44290, 44657, 44907, 44696, 45843, 45801, 45619, 45069, 45639, 45821, 45311, 45779, 46056, 45625, 45984, 46428, 44737, 45540, 46497]
Test partition sizes: [14232, 14235, 14266, 14217, 14238, 14373, 14346, 14334, 14294, 14373, 14344, 14302, 14354, 14362, 14320, 14395, 14389, 14257, 14251, 14399]
  Client 0: 44353 train samples, 2 unique classes
  Client 1: 44290 train samples, 2 unique classes
  Client 2: 44657 train samples, 2 unique classes
  Client 3: 44907 train samples, 2 unique classes
  Client 4: 44696 train samples, 2 unique classes
  Client 5: 45843 train samples, 2 unique classes
  Client 6: 45801 train samples, 2 unique classes
  Client 7: 45619 train samples, 2 unique classes
  Client 8: 45069 train samples, 2 unique classes
  Client 9: 45639 train samples, 2 unique classes
  Client 10: 45821 train samples, 2 unique classes
  Client 11: 45311 train samples, 2 unique classes
  Client 12: 45779 train samples, 2 unique classes
  Client 13: 46056 train samples, 2 unique classes
  Client 14: 45625 train samples, 2 unique classes
  Client 15: 45984 train samples, 2 unique classes
  Client 16: 46428 train samples, 2 unique classes
  Client 17: 44737 train samples, 2 unique classes
  Client 18: 45540 train samples, 2 unique classes
  Client 19: 46497 train samples, 2 unique classes
Will sample 4500 samples per client per epoch
Graph: fully, nodes: 20, edges: 190
Degree statistics: avg=19.00, min=19, max=19
Attack: Compromised 16/20 nodes: [1, 2, 3, 5, 6, 8, 9, 10, 11, 12, 13, 14, 15, 17, 18, 19]
Attack type: gaussian, lambda: 1.0
Model variant: baseline
Model parameters: 1,174,986
BALANCE algorithm:
Balance Config: BALANCEConfig(gamma=2, kappa=1, alpha=0.5, min_neighbors=1)
  - Model dimension: 1,174,986 parameters
  - Complexity: O(N×d) = O(20×1,174,986)
Initial test acc across nodes: mean=0.4965 ± 0.0152
Round 001: test acc mean=0.5412 ± 0.0207 | min=0.5071 max=0.5902
         : test loss mean=0.6915 ± 0.0008
         : individual accs = ['0.533024', '0.551809', '0.525936', '0.562496', '0.525917', '0.543797', '0.520703', '0.580857', '0.507066', '0.590204', '0.541969', '0.547686', '0.550927', '0.536485', '0.533380', '0.515943', '0.546946', '0.520306', '0.527331', '0.560317']
         : correct/total = [(7586, 14232), (7855, 14235), (7503, 14266), (7997, 14217), (7488, 14238), (7816, 14373), (7470, 14346), (8326, 14334), (7248, 14294), (8483, 14373), (7774, 14344), (7833, 14302), (7908, 14354), (7705, 14362), (7638, 14320), (7427, 14395), (7870, 14389), (7418, 14257), (7515, 14251), (8068, 14399)]
         : compromised: 0.5398, honest: 0.5467
Round 002: test acc mean=0.5086 ± 0.0255 | min=0.4859 max=0.5787
         : test loss mean=0.6926 ± 0.0009
         : individual accs = ['0.556703', '0.486617', '0.485911', '0.492368', '0.531535', '0.493843', '0.497421', '0.578694', '0.488177', '0.494747', '0.499024', '0.528527', '0.499303', '0.508146', '0.495810', '0.498367', '0.548683', '0.503051', '0.488738', '0.496493']
         : correct/total = [(7923, 14232), (6927, 14235), (6932, 14266), (7000, 14217), (7568, 14238), (7098, 14373), (7136, 14346), (8295, 14334), (6978, 14294), (7111, 14373), (7158, 14344), (7559, 14302), (7167, 14354), (7298, 14362), (7100, 14320), (7174, 14395), (7895, 14389), (7172, 14257), (6965, 14251), (7149, 14399)]
         : compromised: 0.4973, honest: 0.5539
Round 003: test acc mean=0.5001 ± 0.0119 | min=0.4863 max=0.5369
         : test loss mean=0.6919 ± 0.0011
         : individual accs = ['0.513561', '0.486336', '0.486612', '0.492228', '0.511238', '0.493843', '0.497560', '0.536905', '0.488247', '0.493008', '0.499024', '0.495945', '0.499512', '0.508564', '0.495810', '0.498367', '0.516158', '0.503051', '0.488738', '0.496354']
         : correct/total = [(7309, 14232), (6923, 14235), (6942, 14266), (6998, 14217), (7279, 14238), (7098, 14373), (7138, 14346), (7696, 14334), (6979, 14294), (7086, 14373), (7158, 14344), (7093, 14302), (7170, 14354), (7304, 14362), (7100, 14320), (7174, 14395), (7427, 14389), (7172, 14257), (6965, 14251), (7147, 14399)]
         : compromised: 0.4952, honest: 0.5195
Round 004: test acc mean=0.5305 ± 0.0215 | min=0.5019 max=0.5691
         : test loss mean=0.6892 ± 0.0012
         : individual accs = ['0.568578', '0.526449', '0.558250', '0.515017', '0.569111', '0.507131', '0.507598', '0.563695', '0.517560', '0.516246', '0.501882', '0.538876', '0.519437', '0.517198', '0.508939', '0.529698', '0.561957', '0.525987', '0.531471', '0.524273']
         : correct/total = [(8092, 14232), (7494, 14235), (7964, 14266), (7322, 14217), (8103, 14238), (7289, 14373), (7282, 14346), (8080, 14334), (7398, 14294), (7420, 14373), (7199, 14344), (7707, 14302), (7456, 14354), (7428, 14362), (7288, 14320), (7625, 14395), (8086, 14389), (7499, 14257), (7574, 14251), (7549, 14399)]
         : compromised: 0.5216, honest: 0.5658
Round 005: test acc mean=0.5752 ± 0.0123 | min=0.5477 max=0.5974
         : test loss mean=0.6843 ± 0.0014
         : individual accs = ['0.586706', '0.581454', '0.568555', '0.579095', '0.595379', '0.561887', '0.566778', '0.597391', '0.576815', '0.569192', '0.547685', '0.567613', '0.562422', '0.589194', '0.562081', '0.577701', '0.590104', '0.572070', '0.576030', '0.575457']
         : correct/total = [(8350, 14232), (8277, 14235), (8111, 14266), (8233, 14217), (8477, 14238), (8076, 14373), (8131, 14346), (8563, 14334), (8245, 14294), (8181, 14373), (7856, 14344), (8118, 14302), (8073, 14354), (8462, 14362), (8049, 14320), (8316, 14395), (8491, 14389), (8156, 14257), (8209, 14251), (8286, 14399)]
         : compromised: 0.5709, honest: 0.5924
Round 006: test acc mean=0.5979 ± 0.0057 | min=0.5832 max=0.6062
         : test loss mean=0.6756 ± 0.0014
         : individual accs = ['0.599424', '0.596698', '0.600379', '0.601674', '0.601419', '0.600849', '0.600516', '0.601925', '0.602910', '0.598135', '0.605549', '0.598028', '0.606172', '0.599429', '0.583170', '0.593123', '0.594899', '0.593673', '0.586696', '0.592541']
         : correct/total = [(8531, 14232), (8494, 14235), (8565, 14266), (8554, 14217), (8563, 14238), (8636, 14373), (8615, 14346), (8628, 14334), (8618, 14294), (8597, 14373), (8686, 14344), (8553, 14302), (8701, 14354), (8609, 14362), (8351, 14320), (8538, 14395), (8560, 14389), (8464, 14257), (8361, 14251), (8532, 14399)]
         : compromised: 0.5975, honest: 0.5994
Round 007: test acc mean=0.6125 ± 0.0029 | min=0.6051 max=0.6179
         : test loss mean=0.6628 ± 0.0013
         : individual accs = ['0.616006', '0.613558', '0.608159', '0.617922', '0.614974', '0.612885', '0.613621', '0.610506', '0.613264', '0.614694', '0.615867', '0.609215', '0.613627', '0.614329', '0.611662', '0.610142', '0.610397', '0.610788', '0.605080', '0.612612']
         : correct/total = [(8767, 14232), (8734, 14235), (8676, 14266), (8785, 14217), (8756, 14238), (8809, 14373), (8803, 14346), (8751, 14334), (8766, 14294), (8835, 14373), (8834, 14344), (8713, 14302), (8808, 14354), (8823, 14362), (8759, 14320), (8783, 14395), (8783, 14389), (8708, 14257), (8623, 14251), (8821, 14399)]
         : compromised: 0.6123, honest: 0.6130
Round 008: test acc mean=0.6188 ± 0.0034 | min=0.6111 max=0.6251
         : test loss mean=0.6543 ± 0.0018
         : individual accs = ['0.621908', '0.618827', '0.611103', '0.625097', '0.621717', '0.622208', '0.620033', '0.616297', '0.620260', '0.619425', '0.621933', '0.615928', '0.621430', '0.620318', '0.618785', '0.618409', '0.613872', '0.617521', '0.612589', '0.618862']
         : correct/total = [(8851, 14232), (8809, 14235), (8718, 14266), (8887, 14217), (8852, 14238), (8943, 14373), (8895, 14346), (8834, 14334), (8866, 14294), (8903, 14373), (8921, 14344), (8809, 14302), (8920, 14354), (8909, 14362), (8861, 14320), (8902, 14395), (8833, 14389), (8804, 14257), (8730, 14251), (8911, 14399)]
         : compromised: 0.6189, honest: 0.6184
Round 009: test acc mean=0.6260 ± 0.0036 | min=0.6192 max=0.6328
         : test loss mean=0.6479 ± 0.0018
         : individual accs = ['0.632729', '0.628451', '0.625824', '0.632764', '0.627967', '0.626174', '0.627353', '0.626762', '0.622709', '0.626244', '0.624861', '0.621731', '0.628327', '0.628951', '0.622975', '0.629871', '0.619154', '0.624325', '0.621009', '0.622613']
         : correct/total = [(9005, 14232), (8946, 14235), (8928, 14266), (8996, 14217), (8941, 14238), (9000, 14373), (9000, 14346), (8984, 14334), (8901, 14294), (9001, 14373), (8963, 14344), (8892, 14302), (9019, 14354), (9033, 14362), (8921, 14320), (9067, 14395), (8909, 14389), (8901, 14257), (8850, 14251), (8965, 14399)]
         : compromised: 0.6259, honest: 0.6267
Round 010: test acc mean=0.6331 ± 0.0033 | min=0.6276 max=0.6406
         : test loss mean=0.6422 ± 0.0017
         : individual accs = ['0.639053', '0.634352', '0.632413', '0.640571', '0.636185', '0.630557', '0.633138', '0.632831', '0.636071', '0.634175', '0.631902', '0.629422', '0.634666', '0.635288', '0.632123', '0.633484', '0.627563', '0.629726', '0.629079', '0.629141']
         : correct/total = [(9095, 14232), (9030, 14235), (9022, 14266), (9107, 14217), (9058, 14238), (9063, 14373), (9083, 14346), (9071, 14334), (9092, 14294), (9115, 14373), (9064, 14344), (9002, 14302), (9110, 14354), (9124, 14362), (9052, 14320), (9119, 14395), (9030, 14389), (8978, 14257), (8965, 14251), (9059, 14399)]
         : compromised: 0.6329, honest: 0.6339

=== FINAL RESULTS ===
Dataset: sent140, Nodes: 20, Graph: fully, Aggregation: balance
Attack: gaussian, 80.0% compromised
Final accuracy - Compromised: 0.6329, Honest: 0.6339
Overall test accuracy: mean=0.6331 ± 0.0033

=== BALANCE SUMMARY ===
Node 0: acceptance=0.158
Node 1: acceptance=0.211
Node 2: acceptance=0.211
Node 3: acceptance=0.211
Node 4: acceptance=0.158
Node 5: acceptance=0.211
Node 6: acceptance=0.211
Node 7: acceptance=0.158
Node 8: acceptance=0.211
Node 9: acceptance=0.211
Node 10: acceptance=0.211
Node 11: acceptance=0.211
Node 12: acceptance=0.211
Node 13: acceptance=0.211
Node 14: acceptance=0.211
Node 15: acceptance=0.211
Node 16: acceptance=0.158
Node 17: acceptance=0.211
Node 18: acceptance=0.211
Node 19: acceptance=0.211

=== PARALLEL EXECUTION TIME (realistic for distributed system) ===
  COMMUNICATION (max across nodes):
    - Full model transfer: 0.000s (0.0%)
  COMPUTATION (max across nodes):
    - Filtering: 0.097s (88.9%)
    - Aggregation: 0.012s (11.1%)
  TOTALS:
    - Total computation: 0.109s (100.0%)
    - Total communication: 0.000s (0.0%)
    - Total parallel time: 0.109s

=== PER-NODE AVERAGE TIME ===
  - Filtering: 0.079s
  - Aggregation: 0.006s
  - Model transfer: 0.000s
  - Total per node: 0.086s

=== TOTAL COMPUTATIONAL WORK (sum across all nodes) ===
  - Total filtering: 1.585s
  - Total aggregation: 0.127s
  - Total model transfer: 0.000s
  - Grand total: 1.712s
  - Mean acceptance rate: 0.200

BALANCE Algorithm Properties:
  - Model dimension: 1,174,986
  - No compression: Full parameter comparison
  - Theoretical complexity: O(deg(i)×d)
  - Approach: Full parameter filtering + averaging
