Device: cuda
Seed: 987654321
Loading 1 LEAF Sent140 train files...
LEAF Sent140 train: 254555 users, 908652 samples
Building vocabulary (max_size=10000)...
Vocabulary size: 10000
Loading 1 LEAF Sent140 test files...
LEAF Sent140 test: 254555 users, 286281 samples
Found 254555 train users, 254555 test users, 254555 common users
User sample counts range: 494 (max) to 1 (min)
Distributed ALL 254555 users across 20 clients
Users per client: 12727 (with 15 clients getting +1 user)
Train partition sizes: [44353, 44290, 44657, 44907, 44696, 45843, 45801, 45619, 45069, 45639, 45821, 45311, 45779, 46056, 45625, 45984, 46428, 44737, 45540, 46497]
Test partition sizes: [14232, 14235, 14266, 14217, 14238, 14373, 14346, 14334, 14294, 14373, 14344, 14302, 14354, 14362, 14320, 14395, 14389, 14257, 14251, 14399]
  Client 0: 44353 train samples, 2 unique classes
  Client 1: 44290 train samples, 2 unique classes
  Client 2: 44657 train samples, 2 unique classes
  Client 3: 44907 train samples, 2 unique classes
  Client 4: 44696 train samples, 2 unique classes
  Client 5: 45843 train samples, 2 unique classes
  Client 6: 45801 train samples, 2 unique classes
  Client 7: 45619 train samples, 2 unique classes
  Client 8: 45069 train samples, 2 unique classes
  Client 9: 45639 train samples, 2 unique classes
  Client 10: 45821 train samples, 2 unique classes
  Client 11: 45311 train samples, 2 unique classes
  Client 12: 45779 train samples, 2 unique classes
  Client 13: 46056 train samples, 2 unique classes
  Client 14: 45625 train samples, 2 unique classes
  Client 15: 45984 train samples, 2 unique classes
  Client 16: 46428 train samples, 2 unique classes
  Client 17: 44737 train samples, 2 unique classes
  Client 18: 45540 train samples, 2 unique classes
  Client 19: 46497 train samples, 2 unique classes
Will sample 4500 samples per client per epoch
Graph: erdos, nodes: 20, edges: 126
Degree statistics: avg=12.60, min=8, max=16
Attack: Compromised 8/20 nodes: [1, 5, 11, 12, 13, 14, 17, 18]
Attack type: backdoor, lambda: 1.0
Backdoor target label: 1, trigger size: 3
Model variant: baseline
Model parameters: 1,174,986
Initial test acc across nodes: mean=0.4965 ± 0.0152
Backdoor attack: Created poisoned datasets for 8 compromised nodes
Round 001: test acc mean=0.5032 ± 0.0059 | min=0.4933 max=0.5154
         : test loss mean=3.9067 ± 1.1889
         : individual accs = ['0.508642', '0.502775', '0.511145', '0.508827', '0.498104', '0.507966', '0.502021', '0.499512', '0.507066', '0.510958', '0.499233', '0.503356', '0.500836', '0.494708', '0.500140', '0.497881', '0.515394', '0.505997', '0.493299', '0.495521']
         : correct/total = [(7239, 14232), (7157, 14235), (7292, 14266), (7234, 14217), (7092, 14238), (7301, 14373), (7202, 14346), (7160, 14334), (7248, 14294), (7344, 14373), (7161, 14344), (7199, 14302), (7189, 14354), (7105, 14362), (7162, 14320), (7167, 14395), (7416, 14389), (7214, 14257), (7030, 14251), (7135, 14399)]
         : compromised: 0.5011, honest: 0.5045
Round 002: test acc mean=0.5033 ± 0.0049 | min=0.4916 max=0.5116
         : test loss mean=5.4968 ± 1.3980
         : individual accs = ['0.509415', '0.503899', '0.511636', '0.508054', '0.504355', '0.505670', '0.503137', '0.501605', '0.506506', '0.507479', '0.506832', '0.507272', '0.497283', '0.491645', '0.505587', '0.496492', '0.502189', '0.500526', '0.500316', '0.496632']
         : correct/total = [(7250, 14232), (7173, 14235), (7299, 14266), (7223, 14217), (7181, 14238), (7268, 14373), (7218, 14346), (7190, 14334), (7240, 14294), (7294, 14373), (7270, 14344), (7255, 14302), (7138, 14354), (7061, 14362), (7240, 14320), (7147, 14395), (7226, 14389), (7136, 14257), (7130, 14251), (7151, 14399)]
         : compromised: 0.5015, honest: 0.5045
Round 003: test acc mean=0.4963 ± 0.0059 | min=0.4836 max=0.5074
         : test loss mean=1.8330 ± 0.3338
         : individual accs = ['0.505621', '0.500738', '0.490607', '0.499894', '0.496699', '0.494399', '0.493726', '0.500140', '0.501819', '0.503374', '0.494214', '0.507412', '0.492755', '0.486423', '0.494832', '0.494060', '0.483633', '0.497650', '0.498351', '0.490590']
         : correct/total = [(7196, 14232), (7128, 14235), (6999, 14266), (7107, 14217), (7072, 14238), (7106, 14373), (7083, 14346), (7169, 14334), (7173, 14294), (7235, 14373), (7089, 14344), (7257, 14302), (7073, 14354), (6986, 14362), (7086, 14320), (7112, 14395), (6959, 14389), (7095, 14257), (7102, 14251), (7064, 14399)]
         : compromised: 0.4966, honest: 0.4962
Round 004: test acc mean=0.4940 ± 0.0057 | min=0.4848 max=0.5077
         : test loss mean=9.3042 ± 2.4636
         : individual accs = ['0.487774', '0.487390', '0.484789', '0.492439', '0.492696', '0.492590', '0.497769', '0.494837', '0.487337', '0.489877', '0.498397', '0.490840', '0.498398', '0.507729', '0.494064', '0.498159', '0.499618', '0.502420', '0.488317', '0.493854']
         : correct/total = [(6942, 14232), (6938, 14235), (6916, 14266), (7001, 14217), (7015, 14238), (7080, 14373), (7141, 14346), (7093, 14334), (6966, 14294), (7041, 14373), (7149, 14344), (7020, 14302), (7154, 14354), (7292, 14362), (7075, 14320), (7171, 14395), (7189, 14389), (7163, 14257), (6959, 14251), (7111, 14399)]
         : compromised: 0.4952, honest: 0.4931
Round 005: test acc mean=0.4949 ± 0.0056 | min=0.4861 max=0.5086
         : test loss mean=69.7689 ± 10.5514
         : individual accs = ['0.489109', '0.486266', '0.486051', '0.492228', '0.494100', '0.493843', '0.497560', '0.495186', '0.488457', '0.493008', '0.499024', '0.492029', '0.499512', '0.508564', '0.495810', '0.498367', '0.499757', '0.503051', '0.488738', '0.496354']
         : correct/total = [(6961, 14232), (6922, 14235), (6934, 14266), (6998, 14217), (7035, 14238), (7098, 14373), (7138, 14346), (7098, 14334), (6982, 14294), (7086, 14373), (7158, 14344), (7037, 14302), (7170, 14354), (7304, 14362), (7100, 14320), (7174, 14395), (7191, 14389), (7172, 14257), (6965, 14251), (7147, 14399)]
         : compromised: 0.4960, honest: 0.4941
Round 006: test acc mean=0.4949 ± 0.0056 | min=0.4861 max=0.5086
         : test loss mean=94.7095 ± 9.6749
         : individual accs = ['0.489109', '0.486266', '0.486051', '0.492228', '0.494100', '0.493843', '0.497560', '0.495186', '0.488457', '0.493008', '0.499024', '0.492029', '0.499512', '0.508564', '0.495810', '0.498367', '0.499757', '0.503051', '0.488738', '0.496354']
         : correct/total = [(6961, 14232), (6922, 14235), (6934, 14266), (6998, 14217), (7035, 14238), (7098, 14373), (7138, 14346), (7098, 14334), (6982, 14294), (7086, 14373), (7158, 14344), (7037, 14302), (7170, 14354), (7304, 14362), (7100, 14320), (7174, 14395), (7191, 14389), (7172, 14257), (6965, 14251), (7147, 14399)]
         : compromised: 0.4960, honest: 0.4941
Round 007: test acc mean=0.4967 ± 0.0083 | min=0.4829 max=0.5139
         : test loss mean=12.1019 ± 9.9601
         : individual accs = ['0.482926', '0.486336', '0.513949', '0.492017', '0.495645', '0.504001', '0.502579', '0.502791', '0.507416', '0.493008', '0.494144', '0.505664', '0.494705', '0.508216', '0.493785', '0.489753', '0.492182', '0.486077', '0.487896', '0.500868']
         : correct/total = [(6873, 14232), (6923, 14235), (7332, 14266), (6995, 14217), (7057, 14238), (7244, 14373), (7210, 14346), (7207, 14334), (7253, 14294), (7086, 14373), (7088, 14344), (7232, 14302), (7101, 14354), (7299, 14362), (7071, 14320), (7050, 14395), (7082, 14389), (6930, 14257), (6953, 14251), (7212, 14399)]
         : compromised: 0.4958, honest: 0.4973
Round 008: test acc mean=0.5052 ± 0.0056 | min=0.4914 max=0.5139
         : test loss mean=26.0368 ± 4.5576
         : individual accs = ['0.510891', '0.513874', '0.513949', '0.507772', '0.505900', '0.506157', '0.502440', '0.504814', '0.511543', '0.507758', '0.500976', '0.507971', '0.500557', '0.491366', '0.504190', '0.501633', '0.500243', '0.496949', '0.511122', '0.503646']
         : correct/total = [(7271, 14232), (7315, 14235), (7332, 14266), (7219, 14217), (7203, 14238), (7275, 14373), (7208, 14346), (7236, 14334), (7312, 14294), (7298, 14373), (7186, 14344), (7265, 14302), (7185, 14354), (7057, 14362), (7220, 14320), (7221, 14395), (7198, 14389), (7085, 14257), (7284, 14251), (7252, 14399)]
         : compromised: 0.5040, honest: 0.5060
Round 009: test acc mean=0.5051 ± 0.0056 | min=0.4914 max=0.5139
         : test loss mean=114.3021 ± 16.4509
         : individual accs = ['0.510891', '0.513734', '0.513949', '0.507772', '0.505900', '0.506157', '0.502440', '0.504814', '0.511543', '0.506992', '0.500976', '0.507971', '0.500488', '0.491436', '0.504190', '0.501633', '0.500243', '0.496949', '0.511262', '0.503646']
         : correct/total = [(7271, 14232), (7313, 14235), (7332, 14266), (7219, 14217), (7203, 14238), (7275, 14373), (7208, 14346), (7236, 14334), (7312, 14294), (7287, 14373), (7186, 14344), (7265, 14302), (7184, 14354), (7058, 14362), (7220, 14320), (7221, 14395), (7198, 14389), (7085, 14257), (7286, 14251), (7252, 14399)]
         : compromised: 0.5040, honest: 0.5059
Round 010: test acc mean=0.5051 ± 0.0056 | min=0.4914 max=0.5139
         : test loss mean=123.9051 ± 14.5578
         : individual accs = ['0.510891', '0.513734', '0.513949', '0.507772', '0.505900', '0.506157', '0.502440', '0.504814', '0.511543', '0.506992', '0.500976', '0.507971', '0.500488', '0.491436', '0.504190', '0.501633', '0.500243', '0.496949', '0.511262', '0.503646']
         : correct/total = [(7271, 14232), (7313, 14235), (7332, 14266), (7219, 14217), (7203, 14238), (7275, 14373), (7208, 14346), (7236, 14334), (7312, 14294), (7287, 14373), (7186, 14344), (7265, 14302), (7184, 14354), (7058, 14362), (7220, 14320), (7221, 14395), (7198, 14389), (7085, 14257), (7286, 14251), (7252, 14399)]
         : compromised: 0.5040, honest: 0.5059

=== FINAL RESULTS ===
Dataset: sent140, Nodes: 20, Graph: erdos, Aggregation: d-fedavg
Attack: backdoor, 40.0% compromised
Final accuracy - Compromised: 0.5040, Honest: 0.5059
Overall test accuracy: mean=0.5051 ± 0.0056

=== BACKDOOR ATTACK SUCCESS RATE (ASR) ===
Target label: 1
Trigger size: 3x3
Overall ASR: 0.0000 ± 0.0000
Honest nodes ASR: 0.0000 ± 0.0000
Compromised nodes ASR: 0.0000 ± 0.0000
Note: Higher ASR indicates more successful backdoor attack
