Device: cuda
Seed: 987654321
Loading 1 LEAF Sent140 train files...
LEAF Sent140 train: 254555 users, 908652 samples
Building vocabulary (max_size=10000)...
Vocabulary size: 10000
Loading 1 LEAF Sent140 test files...
LEAF Sent140 test: 254555 users, 286281 samples
Found 254555 train users, 254555 test users, 254555 common users
User sample counts range: 494 (max) to 1 (min)
Distributed ALL 254555 users across 20 clients
Users per client: 12727 (with 15 clients getting +1 user)
Train partition sizes: [44353, 44290, 44657, 44907, 44696, 45843, 45801, 45619, 45069, 45639, 45821, 45311, 45779, 46056, 45625, 45984, 46428, 44737, 45540, 46497]
Test partition sizes: [14232, 14235, 14266, 14217, 14238, 14373, 14346, 14334, 14294, 14373, 14344, 14302, 14354, 14362, 14320, 14395, 14389, 14257, 14251, 14399]
  Client 0: 44353 train samples, 2 unique classes
  Client 1: 44290 train samples, 2 unique classes
  Client 2: 44657 train samples, 2 unique classes
  Client 3: 44907 train samples, 2 unique classes
  Client 4: 44696 train samples, 2 unique classes
  Client 5: 45843 train samples, 2 unique classes
  Client 6: 45801 train samples, 2 unique classes
  Client 7: 45619 train samples, 2 unique classes
  Client 8: 45069 train samples, 2 unique classes
  Client 9: 45639 train samples, 2 unique classes
  Client 10: 45821 train samples, 2 unique classes
  Client 11: 45311 train samples, 2 unique classes
  Client 12: 45779 train samples, 2 unique classes
  Client 13: 46056 train samples, 2 unique classes
  Client 14: 45625 train samples, 2 unique classes
  Client 15: 45984 train samples, 2 unique classes
  Client 16: 46428 train samples, 2 unique classes
  Client 17: 44737 train samples, 2 unique classes
  Client 18: 45540 train samples, 2 unique classes
  Client 19: 46497 train samples, 2 unique classes
Will sample 4500 samples per client per epoch
Graph: erdos, nodes: 20, edges: 126
Degree statistics: avg=12.60, min=8, max=16
Attack: Compromised 2/20 nodes: [5, 13]
Attack type: backdoor, lambda: 1.0
Backdoor target label: 1, trigger size: 3
Model variant: baseline
Model parameters: 1,174,986
Initial test acc across nodes: mean=0.4953 ± 0.0174
Backdoor attack: Created poisoned datasets for 2 compromised nodes
Round 001: test acc mean=0.5681 ± 0.0682 | min=0.4908 max=0.6475
         : test loss mean=10.9050 ± 11.0755
         : individual accs = ['0.506254', '0.647489', '0.501192', '0.643947', '0.623613', '0.493425', '0.510595', '0.622018', '0.494543', '0.641272', '0.643196', '0.496784', '0.642469', '0.510026', '0.495461', '0.636332', '0.618181', '0.639195', '0.490843', '0.504479']
         : correct/total = [(7205, 14232), (9217, 14235), (7150, 14266), (9155, 14217), (8879, 14238), (7092, 14373), (7325, 14346), (8916, 14334), (7069, 14294), (9217, 14373), (9226, 14344), (7105, 14302), (9222, 14354), (7325, 14362), (7095, 14320), (9160, 14395), (8895, 14389), (9113, 14257), (6995, 14251), (7264, 14399)]
         : compromised: 0.5017, honest: 0.5754
Round 002: test acc mean=0.6347 ± 0.0295 | min=0.5149 max=0.6610
         : test loss mean=2.7859 ± 9.4098
         : individual accs = ['0.639474', '0.625641', '0.629048', '0.514947', '0.640118', '0.648855', '0.659208', '0.660806', '0.636911', '0.636541', '0.657209', '0.660957', '0.631183', '0.630831', '0.633729', '0.636332', '0.635694', '0.632111', '0.636166', '0.648101']
         : correct/total = [(9101, 14232), (8906, 14235), (8974, 14266), (7321, 14217), (9114, 14238), (9326, 14373), (9457, 14346), (9472, 14334), (9104, 14294), (9149, 14373), (9427, 14344), (9453, 14302), (9060, 14354), (9060, 14362), (9075, 14320), (9160, 14395), (9147, 14389), (9012, 14257), (9066, 14251), (9332, 14399)]
         : compromised: 0.6398, honest: 0.6341
Round 003: test acc mean=0.6547 ± 0.0112 | min=0.6402 max=0.6753
         : test loss mean=0.6226 ± 0.0132
         : individual accs = ['0.640177', '0.641096', '0.641736', '0.659281', '0.655570', '0.644124', '0.667643', '0.675317', '0.647195', '0.673068', '0.652259', '0.668298', '0.651317', '0.650118', '0.641899', '0.643279', '0.663145', '0.669075', '0.658901', '0.650879']
         : correct/total = [(9111, 14232), (9126, 14235), (9155, 14266), (9373, 14217), (9334, 14238), (9258, 14373), (9578, 14346), (9680, 14334), (9251, 14294), (9674, 14373), (9356, 14344), (9558, 14302), (9349, 14354), (9337, 14362), (9192, 14320), (9260, 14395), (9542, 14389), (9539, 14257), (9390, 14251), (9372, 14399)]
         : compromised: 0.6471, honest: 0.6556
Round 004: test acc mean=0.6686 ± 0.0114 | min=0.6477 max=0.6840
         : test loss mean=0.6046 ± 0.0117
         : individual accs = ['0.673623', '0.671092', '0.674961', '0.647675', '0.677132', '0.657622', '0.675450', '0.683968', '0.677347', '0.677033', '0.658254', '0.651377', '0.679253', '0.658056', '0.673534', '0.673984', '0.676072', '0.681279', '0.650621', '0.653587']
         : correct/total = [(9587, 14232), (9553, 14235), (9629, 14266), (9208, 14217), (9641, 14238), (9452, 14373), (9690, 14346), (9804, 14334), (9682, 14294), (9731, 14373), (9442, 14344), (9316, 14302), (9750, 14354), (9451, 14362), (9645, 14320), (9702, 14395), (9728, 14389), (9713, 14257), (9272, 14251), (9411, 14399)]
         : compromised: 0.6578, honest: 0.6698
Round 005: test acc mean=0.6847 ± 0.0044 | min=0.6747 max=0.6932
         : test loss mean=0.5884 ± 0.0043
         : individual accs = ['0.683460', '0.688514', '0.683443', '0.678484', '0.686684', '0.686913', '0.683535', '0.688921', '0.685742', '0.686426', '0.688093', '0.686477', '0.693187', '0.684097', '0.679120', '0.683084', '0.686844', '0.674686', '0.677426', '0.689492']
         : correct/total = [(9727, 14232), (9801, 14235), (9750, 14266), (9646, 14217), (9777, 14238), (9873, 14373), (9806, 14346), (9875, 14334), (9802, 14294), (9866, 14373), (9870, 14344), (9818, 14302), (9950, 14354), (9825, 14362), (9725, 14320), (9833, 14395), (9883, 14389), (9619, 14257), (9654, 14251), (9928, 14399)]
         : compromised: 0.6855, honest: 0.6846
Round 006: test acc mean=0.6866 ± 0.0086 | min=0.6726 max=0.7042
         : test loss mean=0.5832 ± 0.0072
         : individual accs = ['0.688940', '0.698771', '0.672859', '0.690582', '0.682259', '0.691296', '0.677053', '0.683410', '0.692598', '0.682251', '0.704197', '0.676409', '0.693117', '0.682983', '0.690293', '0.676763', '0.672597', '0.697552', '0.687671', '0.690048']
         : correct/total = [(9805, 14232), (9947, 14235), (9599, 14266), (9818, 14217), (9714, 14238), (9936, 14373), (9713, 14346), (9796, 14334), (9900, 14294), (9806, 14373), (10101, 14344), (9674, 14302), (9949, 14354), (9809, 14362), (9885, 14320), (9742, 14395), (9678, 14389), (9945, 14257), (9800, 14251), (9936, 14399)]
         : compromised: 0.6871, honest: 0.6865
Round 007: test acc mean=0.6982 ± 0.0136 | min=0.6529 max=0.7101
         : test loss mean=0.5714 ± 0.0174
         : individual accs = ['0.691751', '0.708325', '0.696621', '0.697897', '0.708737', '0.704724', '0.703193', '0.704409', '0.702253', '0.702846', '0.710123', '0.705146', '0.705169', '0.704150', '0.695391', '0.667940', '0.701578', '0.652872', '0.696092', '0.703938']
         : correct/total = [(9845, 14232), (10083, 14235), (9938, 14266), (9922, 14217), (10091, 14238), (10129, 14373), (10088, 14346), (10097, 14334), (10038, 14294), (10102, 14373), (10186, 14344), (10085, 14302), (10122, 14354), (10113, 14362), (9958, 14320), (9615, 14395), (10095, 14389), (9308, 14257), (9920, 14251), (10136, 14399)]
         : compromised: 0.7044, honest: 0.6975
Round 008: test acc mean=0.7010 ± 0.0081 | min=0.6849 max=0.7198
         : test loss mean=0.5678 ± 0.0092
         : individual accs = ['0.698356', '0.689287', '0.691644', '0.698389', '0.719764', '0.701176', '0.705075', '0.709920', '0.707849', '0.707785', '0.688232', '0.705006', '0.708165', '0.704498', '0.699232', '0.701841', '0.702968', '0.684927', '0.695670', '0.699979']
         : correct/total = [(9939, 14232), (9812, 14235), (9867, 14266), (9929, 14217), (10248, 14238), (10078, 14373), (10115, 14346), (10176, 14334), (10118, 14294), (10173, 14373), (9872, 14344), (10083, 14302), (10165, 14354), (10118, 14362), (10013, 14320), (10103, 14395), (10115, 14389), (9765, 14257), (9914, 14251), (10079, 14399)]
         : compromised: 0.7028, honest: 0.7008
Round 009: test acc mean=0.7039 ± 0.0158 | min=0.6510 max=0.7219
         : test loss mean=0.5643 ± 0.0178
         : individual accs = ['0.690978', '0.695961', '0.705804', '0.692762', '0.705717', '0.694288', '0.721177', '0.721850', '0.716874', '0.696306', '0.720929', '0.712977', '0.698969', '0.718772', '0.651047', '0.706217', '0.696157', '0.714456', '0.713073', '0.702757']
         : correct/total = [(9834, 14232), (9907, 14235), (10069, 14266), (9849, 14217), (10048, 14238), (9979, 14373), (10346, 14346), (10347, 14334), (10247, 14294), (10008, 14373), (10341, 14344), (10197, 14302), (10033, 14354), (10323, 14362), (9323, 14320), (10166, 14395), (10017, 14389), (10186, 14257), (10162, 14251), (10119, 14399)]
         : compromised: 0.7065, honest: 0.7036
Round 010: test acc mean=0.7004 ± 0.0116 | min=0.6866 max=0.7190
         : test loss mean=0.5727 ± 0.0150
         : individual accs = ['0.686622', '0.712540', '0.711412', '0.709010', '0.716674', '0.693940', '0.692667', '0.718990', '0.702253', '0.688931', '0.718419', '0.693400', '0.692002', '0.693566', '0.687011', '0.689128', '0.702620', '0.717753', '0.688513', '0.691784']
         : correct/total = [(9772, 14232), (10143, 14235), (10149, 14266), (10080, 14217), (10204, 14238), (9974, 14373), (9937, 14346), (10306, 14334), (10038, 14294), (9902, 14373), (10305, 14344), (9917, 14302), (9933, 14354), (9961, 14362), (9838, 14320), (9920, 14395), (10110, 14389), (10233, 14257), (9812, 14251), (9961, 14399)]
         : compromised: 0.6938, honest: 0.7011

=== FINAL RESULTS ===
Dataset: sent140, Nodes: 20, Graph: erdos, Aggregation: krum
Attack: backdoor, 10.0% compromised
Final accuracy - Compromised: 0.6938, Honest: 0.7011
Overall test accuracy: mean=0.7004 ± 0.0116

=== BACKDOOR ATTACK SUCCESS RATE (ASR) ===
Target label: 1
Trigger size: 3x3
Overall ASR: 0.5569 ± 0.1210
Honest nodes ASR: 0.5470 ± 0.1236
Compromised nodes ASR: 0.6467 ± 0.0001
Note: Higher ASR indicates more successful backdoor attack
