Device: cuda
Seed: 987654321
Loading 1 LEAF Sent140 train files...
LEAF Sent140 train: 254555 users, 908652 samples
Building vocabulary (max_size=10000)...
Vocabulary size: 10000
Loading 1 LEAF Sent140 test files...
LEAF Sent140 test: 254555 users, 286281 samples
Found 254555 train users, 254555 test users, 254555 common users
User sample counts range: 494 (max) to 1 (min)
Distributed ALL 254555 users across 20 clients
Users per client: 12727 (with 15 clients getting +1 user)
Train partition sizes: [44353, 44290, 44657, 44907, 44696, 45843, 45801, 45619, 45069, 45639, 45821, 45311, 45779, 46056, 45625, 45984, 46428, 44737, 45540, 46497]
Test partition sizes: [14232, 14235, 14266, 14217, 14238, 14373, 14346, 14334, 14294, 14373, 14344, 14302, 14354, 14362, 14320, 14395, 14389, 14257, 14251, 14399]
  Client 0: 44353 train samples, 2 unique classes
  Client 1: 44290 train samples, 2 unique classes
  Client 2: 44657 train samples, 2 unique classes
  Client 3: 44907 train samples, 2 unique classes
  Client 4: 44696 train samples, 2 unique classes
  Client 5: 45843 train samples, 2 unique classes
  Client 6: 45801 train samples, 2 unique classes
  Client 7: 45619 train samples, 2 unique classes
  Client 8: 45069 train samples, 2 unique classes
  Client 9: 45639 train samples, 2 unique classes
  Client 10: 45821 train samples, 2 unique classes
  Client 11: 45311 train samples, 2 unique classes
  Client 12: 45779 train samples, 2 unique classes
  Client 13: 46056 train samples, 2 unique classes
  Client 14: 45625 train samples, 2 unique classes
  Client 15: 45984 train samples, 2 unique classes
  Client 16: 46428 train samples, 2 unique classes
  Client 17: 44737 train samples, 2 unique classes
  Client 18: 45540 train samples, 2 unique classes
  Client 19: 46497 train samples, 2 unique classes
Will sample 4500 samples per client per epoch
Graph: ring, nodes: 20, edges: 20
Degree statistics: avg=2.00, min=2, max=2
Attack: Compromised 14/20 nodes: [1, 2, 3, 5, 6, 8, 11, 12, 13, 14, 15, 17, 18, 19]
Attack type: gaussian, lambda: 1.0
Model variant: baseline
Model parameters: 1,174,986
BALANCE algorithm:
Balance Config: BALANCEConfig(gamma=2, kappa=1, alpha=0.5, min_neighbors=1)
  - Model dimension: 1,174,986 parameters
  - Complexity: O(N×d) = O(20×1,174,986)
Initial test acc across nodes: mean=0.4965 ± 0.0152
Round 001: test acc mean=0.5180 ± 0.0177 | min=0.4936 max=0.5627
         : test loss mean=452.6956 ± 522.8747
         : individual accs = ['0.493606', '0.523147', '0.504206', '0.515017', '0.499438', '0.532805', '0.562666', '0.503698', '0.518679', '0.526473', '0.515965', '0.533562', '0.502369', '0.502507', '0.501397', '0.525669', '0.508305', '0.542050', '0.504035', '0.543649']
         : correct/total = [(7025, 14232), (7447, 14235), (7193, 14266), (7322, 14217), (7111, 14238), (7658, 14373), (8072, 14346), (7220, 14334), (7414, 14294), (7567, 14373), (7401, 14344), (7631, 14302), (7211, 14354), (7217, 14362), (7180, 14320), (7567, 14395), (7314, 14389), (7728, 14257), (7183, 14251), (7828, 14399)]
         : compromised: 0.5223, honest: 0.5079
Round 002: test acc mean=0.5105 ± 0.0272 | min=0.4900 max=0.5849
         : test loss mean=738.6801 ± 471.1941
         : individual accs = ['0.497822', '0.496382', '0.490046', '0.502638', '0.500913', '0.498922', '0.501952', '0.495326', '0.509165', '0.582064', '0.584914', '0.551811', '0.502090', '0.505988', '0.496927', '0.501424', '0.500104', '0.498913', '0.491825', '0.500590']
         : correct/total = [(7085, 14232), (7066, 14235), (6991, 14266), (7146, 14217), (7132, 14238), (7171, 14373), (7201, 14346), (7100, 14334), (7278, 14294), (8366, 14373), (8390, 14344), (7892, 14302), (7207, 14354), (7267, 14362), (7116, 14320), (7218, 14395), (7196, 14389), (7113, 14257), (7009, 14251), (7208, 14399)]
         : compromised: 0.5035, honest: 0.5269
Round 003: test acc mean=0.5187 ± 0.0367 | min=0.4822 max=0.5986
         : test loss mean=416.9989 ± 262.8771
         : individual accs = ['0.498524', '0.507552', '0.494322', '0.500950', '0.503722', '0.511932', '0.496515', '0.509139', '0.593256', '0.595005', '0.598648', '0.569431', '0.510032', '0.514761', '0.518017', '0.482181', '0.488220', '0.496528', '0.487194', '0.497326']
         : correct/total = [(7095, 14232), (7225, 14235), (7052, 14266), (7122, 14217), (7172, 14238), (7358, 14373), (7123, 14346), (7298, 14334), (8480, 14294), (8552, 14373), (8587, 14344), (8144, 14302), (7321, 14354), (7393, 14362), (7418, 14320), (6941, 14395), (7025, 14389), (7079, 14257), (6943, 14251), (7161, 14399)]
         : compromised: 0.5129, honest: 0.5322
Round 004: test acc mean=0.5216 ± 0.0464 | min=0.4865 max=0.6198
         : test loss mean=469.0295 ± 374.8293
         : individual accs = ['0.488828', '0.486547', '0.501752', '0.491665', '0.506251', '0.495025', '0.492402', '0.499512', '0.611096', '0.619773', '0.618098', '0.604811', '0.504180', '0.505292', '0.509916', '0.499410', '0.488151', '0.506137', '0.499825', '0.503090']
         : correct/total = [(6957, 14232), (6926, 14235), (7158, 14266), (6990, 14217), (7208, 14238), (7115, 14373), (7064, 14346), (7160, 14334), (8735, 14294), (8908, 14373), (8866, 14344), (8650, 14302), (7237, 14354), (7257, 14362), (7302, 14320), (7189, 14395), (7024, 14389), (7216, 14257), (7123, 14251), (7244, 14399)]
         : compromised: 0.5151, honest: 0.5368
Round 005: test acc mean=0.5259 ± 0.0466 | min=0.4910 max=0.6262
         : test loss mean=560.0777 ± 455.0328
         : individual accs = ['0.491498', '0.490973', '0.512898', '0.497714', '0.503722', '0.504209', '0.498327', '0.506976', '0.610466', '0.626244', '0.622630', '0.613271', '0.504807', '0.503760', '0.495182', '0.508788', '0.503788', '0.503753', '0.509859', '0.509410']
         : correct/total = [(6995, 14232), (6989, 14235), (7317, 14266), (7076, 14217), (7172, 14238), (7247, 14373), (7149, 14346), (7267, 14334), (8726, 14294), (9001, 14373), (8931, 14344), (8771, 14302), (7246, 14354), (7235, 14362), (7091, 14320), (7324, 14395), (7249, 14389), (7182, 14257), (7266, 14251), (7335, 14399)]
         : compromised: 0.5188, honest: 0.5425
Round 006: test acc mean=0.5266 ± 0.0502 | min=0.4934 max=0.6319
         : test loss mean=380.3248 ± 265.4176
         : individual accs = ['0.499859', '0.510011', '0.493551', '0.496378', '0.493890', '0.502679', '0.499721', '0.493442', '0.617252', '0.631949', '0.626673', '0.629492', '0.500906', '0.516572', '0.503003', '0.501841', '0.503857', '0.502280', '0.507754', '0.499965']
         : correct/total = [(7114, 14232), (7260, 14235), (7041, 14266), (7057, 14217), (7032, 14238), (7225, 14373), (7169, 14346), (7073, 14334), (8823, 14294), (9083, 14373), (8989, 14344), (9003, 14302), (7190, 14354), (7419, 14362), (7203, 14320), (7224, 14395), (7250, 14389), (7161, 14257), (7236, 14251), (7199, 14399)]
         : compromised: 0.5201, honest: 0.5416
Round 007: test acc mean=0.5264 ± 0.0538 | min=0.4884 max=0.6410
         : test loss mean=889.0008 ± 754.2362
         : individual accs = ['0.494238', '0.488374', '0.499229', '0.514525', '0.502599', '0.498365', '0.517078', '0.503837', '0.625297', '0.640994', '0.635806', '0.629422', '0.496795', '0.499721', '0.490503', '0.511150', '0.503649', '0.495686', '0.492106', '0.488506']
         : correct/total = [(7034, 14232), (6952, 14235), (7122, 14266), (7315, 14217), (7156, 14238), (7163, 14373), (7418, 14346), (7222, 14334), (8938, 14294), (9213, 14373), (9120, 14344), (9002, 14302), (7131, 14354), (7177, 14362), (7024, 14320), (7358, 14395), (7247, 14389), (7067, 14257), (7013, 14251), (7034, 14399)]
         : compromised: 0.5176, honest: 0.5469
Round 008: test acc mean=0.5265 ± 0.0550 | min=0.4874 max=0.6413
         : test loss mean=882.9561 ± 717.7885
         : individual accs = ['0.487423', '0.512048', '0.513248', '0.492087', '0.496207', '0.499896', '0.490311', '0.502581', '0.631034', '0.641341', '0.635039', '0.635925', '0.499373', '0.507729', '0.494763', '0.500174', '0.496073', '0.502139', '0.496035', '0.496910']
         : correct/total = [(6937, 14232), (7289, 14235), (7322, 14266), (6996, 14217), (7065, 14238), (7185, 14373), (7034, 14346), (7204, 14334), (9020, 14294), (9218, 14373), (9109, 14344), (9095, 14302), (7168, 14354), (7292, 14362), (7085, 14320), (7200, 14395), (7138, 14389), (7159, 14257), (7069, 14251), (7155, 14399)]
         : compromised: 0.5194, honest: 0.5431
Round 009: test acc mean=0.5274 ± 0.0554 | min=0.4861 max=0.6411
         : test loss mean=894.4135 ± 747.6770
         : individual accs = ['0.505972', '0.486055', '0.487593', '0.493634', '0.515733', '0.504418', '0.497142', '0.498116', '0.634672', '0.641063', '0.634830', '0.638722', '0.498328', '0.508564', '0.504190', '0.502397', '0.494961', '0.502420', '0.501228', '0.497951']
         : correct/total = [(7201, 14232), (6919, 14235), (6956, 14266), (7018, 14217), (7343, 14238), (7250, 14373), (7132, 14346), (7140, 14334), (9072, 14294), (9214, 14373), (9106, 14344), (9135, 14302), (7153, 14354), (7304, 14362), (7220, 14320), (7232, 14395), (7122, 14389), (7163, 14257), (7143, 14251), (7170, 14399)]
         : compromised: 0.5184, honest: 0.5484
Round 010: test acc mean=0.5294 ± 0.0568 | min=0.4863 max=0.6448
         : test loss mean=1002.1153 ± 911.0934
         : individual accs = ['0.496346', '0.486336', '0.508972', '0.510586', '0.498244', '0.499339', '0.521609', '0.503628', '0.641248', '0.644751', '0.640547', '0.640470', '0.499373', '0.514135', '0.498534', '0.501702', '0.496629', '0.507891', '0.486492', '0.491215']
         : correct/total = [(7064, 14232), (6923, 14235), (7261, 14266), (7259, 14217), (7094, 14238), (7177, 14373), (7483, 14346), (7219, 14334), (9166, 14294), (9267, 14373), (9188, 14344), (9160, 14302), (7168, 14354), (7384, 14362), (7139, 14320), (7222, 14395), (7146, 14389), (7241, 14257), (6933, 14251), (7073, 14399)]
         : compromised: 0.5220, honest: 0.5467

=== FINAL RESULTS ===
Dataset: sent140, Nodes: 20, Graph: ring, Aggregation: balance
Attack: gaussian, 70.0% compromised
Final accuracy - Compromised: 0.5220, Honest: 0.5467
Overall test accuracy: mean=0.5294 ± 0.0568

=== BALANCE SUMMARY ===
Node 0: acceptance=0.500
Node 1: acceptance=0.450
Node 2: acceptance=0.500
Node 3: acceptance=0.500
Node 4: acceptance=0.500
Node 5: acceptance=0.450
Node 6: acceptance=0.250
Node 7: acceptance=0.500
Node 8: acceptance=0.550
Node 9: acceptance=0.500
Node 10: acceptance=0.500
Node 11: acceptance=0.500
Node 12: acceptance=0.500
Node 13: acceptance=0.500
Node 14: acceptance=0.500
Node 15: acceptance=0.450
Node 16: acceptance=0.500
Node 17: acceptance=0.500
Node 18: acceptance=0.500
Node 19: acceptance=0.450

=== PARALLEL EXECUTION TIME (realistic for distributed system) ===
  COMMUNICATION (max across nodes):
    - Full model transfer: 0.000s (0.0%)
  COMPUTATION (max across nodes):
    - Filtering: 0.026s (69.1%)
    - Aggregation: 0.012s (30.9%)
  TOTALS:
    - Total computation: 0.037s (100.0%)
    - Total communication: 0.000s (0.0%)
    - Total parallel time: 0.037s

=== PER-NODE AVERAGE TIME ===
  - Filtering: 0.012s
  - Aggregation: 0.006s
  - Model transfer: 0.000s
  - Total per node: 0.018s

=== TOTAL COMPUTATIONAL WORK (sum across all nodes) ===
  - Total filtering: 0.247s
  - Total aggregation: 0.114s
  - Total model transfer: 0.000s
  - Grand total: 0.361s
  - Mean acceptance rate: 0.480

BALANCE Algorithm Properties:
  - Model dimension: 1,174,986
  - No compression: Full parameter comparison
  - Theoretical complexity: O(deg(i)×d)
  - Approach: Full parameter filtering + averaging
