Device: cuda
Seed: 987654321
Loading 1 LEAF Sent140 train files...
LEAF Sent140 train: 254555 users, 908652 samples
Building vocabulary (max_size=10000)...
Vocabulary size: 10000
Loading 1 LEAF Sent140 test files...
LEAF Sent140 test: 254555 users, 286281 samples
Found 254555 train users, 254555 test users, 254555 common users
User sample counts range: 494 (max) to 1 (min)
Distributed ALL 254555 users across 20 clients
Users per client: 12727 (with 15 clients getting +1 user)
Train partition sizes: [44353, 44290, 44657, 44907, 44696, 45843, 45801, 45619, 45069, 45639, 45821, 45311, 45779, 46056, 45625, 45984, 46428, 44737, 45540, 46497]
Test partition sizes: [14232, 14235, 14266, 14217, 14238, 14373, 14346, 14334, 14294, 14373, 14344, 14302, 14354, 14362, 14320, 14395, 14389, 14257, 14251, 14399]
  Client 0: 44353 train samples, 2 unique classes
  Client 1: 44290 train samples, 2 unique classes
  Client 2: 44657 train samples, 2 unique classes
  Client 3: 44907 train samples, 2 unique classes
  Client 4: 44696 train samples, 2 unique classes
  Client 5: 45843 train samples, 2 unique classes
  Client 6: 45801 train samples, 2 unique classes
  Client 7: 45619 train samples, 2 unique classes
  Client 8: 45069 train samples, 2 unique classes
  Client 9: 45639 train samples, 2 unique classes
  Client 10: 45821 train samples, 2 unique classes
  Client 11: 45311 train samples, 2 unique classes
  Client 12: 45779 train samples, 2 unique classes
  Client 13: 46056 train samples, 2 unique classes
  Client 14: 45625 train samples, 2 unique classes
  Client 15: 45984 train samples, 2 unique classes
  Client 16: 46428 train samples, 2 unique classes
  Client 17: 44737 train samples, 2 unique classes
  Client 18: 45540 train samples, 2 unique classes
  Client 19: 46497 train samples, 2 unique classes
Will sample 4500 samples per client per epoch
Graph: ring, nodes: 20, edges: 20
Degree statistics: avg=2.00, min=2, max=2
Attack: Compromised 6/20 nodes: [5, 12, 13, 14, 17, 18]
Attack type: gaussian, lambda: 1.0
Model variant: baseline
Model parameters: 1,174,986
UBAR ALGORITHM (Two-Stage Byzantine-resilient)
  - Model dimension: 1,174,986 parameters
  - Rho parameter: 0.7
  - Stage 1: Distance-based filtering (select 70% closest neighbors)
  - Stage 2: Performance-based selection (loss comparison)
  - Complexity: O(deg(i)×d + deg(i)×inference)
Initial test acc across nodes: mean=0.4965 ± 0.0152
Round 001: test acc mean=0.5276 ± 0.0168 | min=0.4917 max=0.5627
         : test loss mean=73.6722 ± 318.1165
         : individual accs = ['0.548974', '0.523147', '0.537852', '0.515017', '0.517980', '0.517846', '0.562666', '0.553858', '0.511613', '0.526473', '0.522170', '0.533562', '0.505713', '0.491714', '0.524860', '0.525669', '0.513239', '0.542050', '0.533226', '0.543649']
         : correct/total = [(7813, 14232), (7447, 14235), (7673, 14266), (7322, 14217), (7375, 14238), (7443, 14373), (8072, 14346), (7939, 14334), (7313, 14294), (7567, 14373), (7490, 14344), (7631, 14302), (7259, 14354), (7062, 14362), (7516, 14320), (7567, 14395), (7385, 14389), (7728, 14257), (7599, 14251), (7828, 14399)]
         : compromised: 0.5192, honest: 0.5311
         : ubar stats = ['Node 0: s1=0.500, s2=1.000', 'Node 1: s1=0.500, s2=1.000', 'Node 2: s1=0.500, s2=1.000']...
Round 002: test acc mean=0.5696 ± 0.0284 | min=0.4898 max=0.6119
         : test loss mean=75.4835 ± 326.0480
         : individual accs = ['0.587409', '0.562627', '0.573251', '0.561230', '0.560261', '0.557573', '0.611878', '0.607646', '0.575416', '0.560078', '0.604085', '0.601175', '0.589313', '0.489834', '0.527793', '0.558388', '0.557092', '0.542260', '0.575258', '0.589485']
         : correct/total = [(8360, 14232), (8009, 14235), (8178, 14266), (7979, 14217), (7977, 14238), (8014, 14373), (8778, 14346), (8710, 14334), (8225, 14294), (8050, 14373), (8665, 14344), (8598, 14302), (8459, 14354), (7035, 14362), (7558, 14320), (8038, 14395), (8016, 14389), (7731, 14257), (8198, 14251), (8488, 14399)]
         : compromised: 0.5470, honest: 0.5793
         : ubar stats = ['Node 0: s1=0.500, s2=1.000', 'Node 1: s1=0.500, s2=1.000', 'Node 2: s1=0.500, s2=1.000']...
Round 003: test acc mean=0.5913 ± 0.0308 | min=0.4944 max=0.6185
         : test loss mean=91.5175 ± 395.9958
         : individual accs = ['0.614460', '0.607095', '0.545563', '0.602518', '0.599452', '0.599179', '0.615433', '0.616436', '0.605779', '0.593891', '0.610081', '0.611033', '0.615647', '0.494430', '0.552095', '0.580549', '0.576552', '0.562320', '0.605572', '0.618515']
         : correct/total = [(8745, 14232), (8642, 14235), (7783, 14266), (8566, 14217), (8535, 14238), (8612, 14373), (8829, 14346), (8836, 14334), (8659, 14294), (8536, 14373), (8751, 14344), (8739, 14302), (8837, 14354), (7101, 14362), (7906, 14320), (8357, 14395), (8296, 14389), (8017, 14257), (8630, 14251), (8906, 14399)]
         : compromised: 0.5715, honest: 0.5998
         : ubar stats = ['Node 0: s1=0.500, s2=1.000', 'Node 1: s1=0.500, s2=1.000', 'Node 2: s1=0.500, s2=1.000']...
Round 004: test acc mean=0.6104 ± 0.0273 | min=0.5065 max=0.6299
         : test loss mean=46.9978 ± 202.0021
         : individual accs = ['0.625492', '0.622620', '0.591616', '0.617078', '0.611041', '0.627774', '0.625261', '0.623413', '0.621520', '0.629931', '0.619004', '0.626975', '0.625749', '0.506545', '0.587989', '0.599236', '0.598443', '0.594866', '0.624798', '0.628238']
         : correct/total = [(8902, 14232), (8863, 14235), (8440, 14266), (8773, 14217), (8700, 14238), (9023, 14373), (8970, 14346), (8936, 14334), (8884, 14294), (9054, 14373), (8879, 14344), (8967, 14302), (8982, 14354), (7275, 14362), (8420, 14320), (8626, 14395), (8611, 14389), (8481, 14257), (8904, 14251), (9046, 14399)]
         : compromised: 0.5946, honest: 0.6171
         : ubar stats = ['Node 0: s1=0.500, s2=1.000', 'Node 1: s1=0.500, s2=1.000', 'Node 2: s1=0.500, s2=1.000']...
Round 005: test acc mean=0.6187 ± 0.0315 | min=0.4900 max=0.6381
         : test loss mean=67.6311 ± 291.9771
         : individual accs = ['0.629989', '0.629996', '0.606267', '0.631779', '0.630566', '0.638071', '0.633905', '0.633110', '0.628865', '0.632088', '0.627370', '0.633268', '0.637105', '0.489974', '0.601606', '0.613268', '0.607269', '0.607772', '0.631043', '0.630877']
         : correct/total = [(8966, 14232), (8968, 14235), (8649, 14266), (8982, 14217), (8978, 14238), (9171, 14373), (9094, 14346), (9075, 14334), (8989, 14294), (9085, 14373), (8999, 14344), (9057, 14302), (9145, 14354), (7037, 14362), (8615, 14320), (8828, 14395), (8738, 14389), (8665, 14257), (8993, 14251), (9084, 14399)]
         : compromised: 0.6009, honest: 0.6263
         : ubar stats = ['Node 0: s1=0.500, s2=1.000', 'Node 1: s1=0.500, s2=1.000', 'Node 2: s1=0.500, s2=1.000']...
Round 006: test acc mean=0.6242 ± 0.0297 | min=0.5047 max=0.6428
         : test loss mean=46.4425 ± 199.6413
         : individual accs = ['0.635118', '0.639199', '0.630029', '0.639164', '0.635131', '0.638280', '0.638366', '0.636529', '0.627536', '0.642802', '0.630229', '0.642567', '0.634248', '0.504735', '0.602514', '0.612435', '0.609076', '0.614014', '0.633850', '0.638169']
         : correct/total = [(9039, 14232), (9099, 14235), (8988, 14266), (9087, 14217), (9043, 14238), (9174, 14373), (9158, 14346), (9124, 14334), (8970, 14294), (9239, 14373), (9040, 14344), (9190, 14302), (9104, 14354), (7249, 14362), (8628, 14320), (8816, 14395), (8764, 14389), (8754, 14257), (9033, 14251), (9189, 14399)]
         : compromised: 0.6046, honest: 0.6326
         : ubar stats = ['Node 0: s1=0.500, s2=1.000', 'Node 1: s1=0.500, s2=1.000', 'Node 2: s1=0.500, s2=1.000']...
Round 007: test acc mean=0.6288 ± 0.0330 | min=0.4904 max=0.6466
         : test loss mean=108.4408 ± 469.9020
         : individual accs = ['0.644744', '0.637935', '0.619585', '0.646620', '0.644824', '0.641341', '0.639063', '0.632692', '0.629705', '0.646142', '0.633296', '0.638442', '0.644420', '0.490391', '0.621020', '0.629246', '0.623115', '0.621940', '0.644165', '0.646642']
         : correct/total = [(9176, 14232), (9081, 14235), (8839, 14266), (9193, 14217), (9181, 14238), (9218, 14373), (9168, 14346), (9069, 14334), (9001, 14294), (9287, 14373), (9084, 14344), (9131, 14302), (9250, 14354), (7043, 14362), (8893, 14320), (9058, 14395), (8966, 14389), (8867, 14257), (9180, 14251), (9311, 14399)]
         : compromised: 0.6105, honest: 0.6366
         : ubar stats = ['Node 0: s1=0.500, s2=1.000', 'Node 1: s1=0.500, s2=1.000', 'Node 2: s1=0.500, s2=1.000']...
Round 008: test acc mean=0.6340 ± 0.0289 | min=0.5106 max=0.6496
         : test loss mean=139.7202 ± 606.2635
         : individual accs = ['0.644463', '0.638637', '0.635707', '0.646058', '0.642366', '0.640994', '0.642688', '0.637715', '0.641878', '0.649621', '0.637967', '0.642707', '0.647833', '0.510583', '0.629958', '0.635568', '0.632497', '0.627481', '0.646551', '0.647823']
         : correct/total = [(9172, 14232), (9091, 14235), (9069, 14266), (9185, 14217), (9146, 14238), (9213, 14373), (9220, 14346), (9141, 14334), (9175, 14294), (9337, 14373), (9151, 14344), (9192, 14302), (9299, 14354), (7333, 14362), (9021, 14320), (9149, 14395), (9101, 14389), (8946, 14257), (9214, 14251), (9328, 14399)]
         : compromised: 0.6172, honest: 0.6411
         : ubar stats = ['Node 0: s1=0.500, s2=1.000', 'Node 1: s1=0.500, s2=1.000', 'Node 2: s1=0.500, s2=1.000']...
Round 009: test acc mean=0.6369 ± 0.0344 | min=0.4889 max=0.6519
         : test loss mean=71.1467 ± 307.3721
         : individual accs = ['0.648187', '0.648332', '0.643348', '0.645002', '0.646228', '0.645238', '0.644221', '0.644203', '0.646355', '0.651291', '0.644172', '0.649839', '0.650690', '0.488929', '0.630726', '0.642584', '0.637501', '0.633163', '0.646481', '0.651851']
         : correct/total = [(9225, 14232), (9229, 14235), (9178, 14266), (9170, 14217), (9201, 14238), (9274, 14373), (9242, 14346), (9234, 14334), (9239, 14294), (9361, 14373), (9240, 14344), (9294, 14302), (9340, 14354), (7022, 14362), (9032, 14320), (9250, 14395), (9173, 14389), (9027, 14257), (9213, 14251), (9386, 14399)]
         : compromised: 0.6159, honest: 0.6459
         : ubar stats = ['Node 0: s1=0.500, s2=1.000', 'Node 1: s1=0.500, s2=1.000', 'Node 2: s1=0.500, s2=1.000']...
Round 010: test acc mean=0.6397 ± 0.0342 | min=0.4921 max=0.6554
         : test loss mean=50.5936 ± 217.7937
         : individual accs = ['0.650787', '0.653179', '0.643348', '0.651685', '0.652058', '0.645794', '0.646591', '0.646296', '0.650623', '0.654700', '0.640825', '0.646623', '0.655427', '0.492132', '0.640154', '0.644877', '0.640350', '0.640527', '0.646972', '0.651573']
         : correct/total = [(9262, 14232), (9298, 14235), (9178, 14266), (9265, 14217), (9284, 14238), (9282, 14373), (9276, 14346), (9264, 14334), (9300, 14294), (9410, 14373), (9192, 14344), (9248, 14302), (9408, 14354), (7068, 14362), (9167, 14320), (9283, 14395), (9214, 14389), (9132, 14257), (9220, 14251), (9382, 14399)]
         : compromised: 0.6202, honest: 0.6481
         : ubar stats = ['Node 0: s1=0.500, s2=1.000', 'Node 1: s1=0.500, s2=1.000', 'Node 2: s1=0.500, s2=1.000']...

=== FINAL RESULTS ===
Dataset: sent140, Nodes: 20, Graph: ring, Aggregation: ubar
Attack: gaussian, 30.0% compromised
Final accuracy - Compromised: 0.6202, Honest: 0.6481
Overall test accuracy: mean=0.6397 ± 0.0342

=== UBAR SUMMARY ===
Node 0: stage1=0.500, stage2=1.000, overall=0.500
Node 1: stage1=0.500, stage2=1.000, overall=0.500
Node 2: stage1=0.500, stage2=1.000, overall=0.500
Node 3: stage1=0.500, stage2=1.000, overall=0.500
Node 4: stage1=0.500, stage2=1.000, overall=0.500
Node 5: stage1=0.500, stage2=1.000, overall=0.500
Node 6: stage1=0.500, stage2=1.000, overall=0.500
Node 7: stage1=0.500, stage2=1.000, overall=0.500
Node 8: stage1=0.500, stage2=1.000, overall=0.500
Node 9: stage1=0.500, stage2=1.000, overall=0.500
Node 10: stage1=0.500, stage2=1.000, overall=0.500
Node 11: stage1=0.500, stage2=1.000, overall=0.500
Node 12: stage1=0.500, stage2=1.000, overall=0.500
Node 13: stage1=0.500, stage2=1.000, overall=0.500
Node 14: stage1=0.500, stage2=1.000, overall=0.500
Node 15: stage1=0.500, stage2=1.000, overall=0.500
Node 16: stage1=0.500, stage2=1.000, overall=0.500
Node 17: stage1=0.500, stage2=1.000, overall=0.500
Node 18: stage1=0.500, stage2=1.000, overall=0.500
Node 19: stage1=0.500, stage2=1.000, overall=0.500

=== PARALLEL EXECUTION TIME (realistic for distributed system) ===
  COMMUNICATION (max across nodes):
    - Full model transfer: 0.000s (0.1%)
  COMPUTATION (max across nodes):
    - Distance computation: 0.022s (52.1%)
    - Loss computation: 0.017s (39.5%)
    - Aggregation: 0.003s (8.3%)
  TOTALS:
    - Total computation: 0.042s (99.9%)
    - Total communication: 0.000s (0.1%)
    - Total parallel time: 0.042s

=== PER-NODE AVERAGE TIME ===
  - Distance computation: 0.009s
  - Loss computation: 0.009s
  - Aggregation: 0.003s
  - Model transfer: 0.000s
  - Total per node: 0.022s

=== TOTAL COMPUTATIONAL WORK (sum across all nodes) ===
  - Total distance computation: 0.190s
  - Total loss computation: 0.190s
  - Total aggregation: 0.066s
  - Total model transfer: 0.000s
  - Grand total: 0.445s
  - Mean Stage 1 acceptance rate: 0.500
  - Mean Stage 2 acceptance rate: 1.000
  - Overall acceptance rate: 0.500

UBAR Algorithm Properties:
  - Model dimension: 1,174,986
  - Rho parameter: 0.7
  - Two-stage approach: Distance filtering + loss evaluation
  - Stage 1 selects: 70% of neighbors
  - Stage 2 uses: Training sample loss comparison
  - Theoretical complexity: O(deg(i)×d + deg(i)×inference)
  - Approach: UBAR paper implementation
