Device: cuda
Seed: 987654321
Loading 1 LEAF Sent140 train files...
LEAF Sent140 train: 254555 users, 908652 samples
Building vocabulary (max_size=10000)...
Vocabulary size: 10000
Loading 1 LEAF Sent140 test files...
LEAF Sent140 test: 254555 users, 286281 samples
Found 254555 train users, 254555 test users, 254555 common users
User sample counts range: 494 (max) to 1 (min)
Distributed ALL 254555 users across 20 clients
Users per client: 12727 (with 15 clients getting +1 user)
Train partition sizes: [44353, 44290, 44657, 44907, 44696, 45843, 45801, 45619, 45069, 45639, 45821, 45311, 45779, 46056, 45625, 45984, 46428, 44737, 45540, 46497]
Test partition sizes: [14232, 14235, 14266, 14217, 14238, 14373, 14346, 14334, 14294, 14373, 14344, 14302, 14354, 14362, 14320, 14395, 14389, 14257, 14251, 14399]
  Client 0: 44353 train samples, 2 unique classes
  Client 1: 44290 train samples, 2 unique classes
  Client 2: 44657 train samples, 2 unique classes
  Client 3: 44907 train samples, 2 unique classes
  Client 4: 44696 train samples, 2 unique classes
  Client 5: 45843 train samples, 2 unique classes
  Client 6: 45801 train samples, 2 unique classes
  Client 7: 45619 train samples, 2 unique classes
  Client 8: 45069 train samples, 2 unique classes
  Client 9: 45639 train samples, 2 unique classes
  Client 10: 45821 train samples, 2 unique classes
  Client 11: 45311 train samples, 2 unique classes
  Client 12: 45779 train samples, 2 unique classes
  Client 13: 46056 train samples, 2 unique classes
  Client 14: 45625 train samples, 2 unique classes
  Client 15: 45984 train samples, 2 unique classes
  Client 16: 46428 train samples, 2 unique classes
  Client 17: 44737 train samples, 2 unique classes
  Client 18: 45540 train samples, 2 unique classes
  Client 19: 46497 train samples, 2 unique classes
Will sample 4500 samples per client per epoch
Graph: erdos, nodes: 20, edges: 99
Degree statistics: avg=9.90, min=7, max=14
Attack: Compromised 4/20 nodes: [5, 12, 13, 17]
Attack type: directed_deviation, lambda: 1.0
Model variant: baseline
Model parameters: 1,174,986
Initial test acc across nodes: mean=0.4965 ± 0.0152
Round 001: test acc mean=0.5000 ± 0.0117 | min=0.4787 max=0.5327
         : test loss mean=1.4465 ± 0.9392
         : individual accs = ['0.510750', '0.512891', '0.513879', '0.490047', '0.532729', '0.501287', '0.486895', '0.497837', '0.490975', '0.506992', '0.498466', '0.493567', '0.502020', '0.491227', '0.496997', '0.497742', '0.510459', '0.490636', '0.478703', '0.495937']
         : correct/total = [(7269, 14232), (7301, 14235), (7331, 14266), (6967, 14217), (7585, 14238), (7205, 14373), (6985, 14346), (7136, 14334), (7018, 14294), (7287, 14373), (7150, 14344), (7059, 14302), (7206, 14354), (7055, 14362), (7117, 14320), (7165, 14395), (7345, 14389), (6995, 14257), (6822, 14251), (7141, 14399)]
         : compromised: 0.4963, honest: 0.5009
Round 002: test acc mean=0.4995 ± 0.0092 | min=0.4789 max=0.5176
         : test loss mean=1.2400 ± 0.6102
         : individual accs = ['0.503513', '0.492378', '0.513879', '0.497784', '0.503371', '0.501983', '0.491426', '0.496651', '0.503708', '0.498574', '0.480201', '0.494826', '0.510450', '0.517616', '0.499162', '0.478916', '0.501216', '0.502630', '0.498070', '0.502674']
         : correct/total = [(7166, 14232), (7009, 14235), (7331, 14266), (7077, 14217), (7167, 14238), (7215, 14373), (7050, 14346), (7119, 14334), (7200, 14294), (7166, 14373), (6888, 14344), (7077, 14302), (7327, 14354), (7434, 14362), (7148, 14320), (6894, 14395), (7212, 14389), (7166, 14257), (7098, 14251), (7238, 14399)]
         : compromised: 0.5082, honest: 0.4973
Round 003: test acc mean=0.5010 ± 0.0153 | min=0.4627 max=0.5311
         : test loss mean=0.7125 ± 0.0357
         : individual accs = ['0.511313', '0.486969', '0.531123', '0.508124', '0.505829', '0.476310', '0.498885', '0.502372', '0.508045', '0.518542', '0.500906', '0.506153', '0.501602', '0.508077', '0.479120', '0.501007', '0.462715', '0.497159', '0.520314', '0.495451']
         : correct/total = [(7277, 14232), (6932, 14235), (7577, 14266), (7224, 14217), (7202, 14238), (6846, 14373), (7157, 14346), (7201, 14334), (7262, 14294), (7453, 14373), (7185, 14344), (7239, 14302), (7200, 14354), (7297, 14362), (6861, 14320), (7212, 14395), (6658, 14389), (7088, 14257), (7415, 14251), (7134, 14399)]
         : compromised: 0.4958, honest: 0.5023
Round 004: test acc mean=0.5208 ± 0.0122 | min=0.4913 max=0.5468
         : test loss mean=0.8844 ± 0.3337
         : individual accs = ['0.534359', '0.531858', '0.513739', '0.543364', '0.521211', '0.520699', '0.525861', '0.515906', '0.511403', '0.507201', '0.526004', '0.527758', '0.516929', '0.491296', '0.515363', '0.513095', '0.513934', '0.519464', '0.546769', '0.518925']
         : correct/total = [(7605, 14232), (7571, 14235), (7329, 14266), (7725, 14217), (7421, 14238), (7484, 14373), (7544, 14346), (7395, 14334), (7310, 14294), (7290, 14373), (7545, 14344), (7548, 14302), (7420, 14354), (7056, 14362), (7380, 14320), (7386, 14395), (7395, 14389), (7406, 14257), (7792, 14251), (7472, 14399)]
         : compromised: 0.5121, honest: 0.5229
Round 005: test acc mean=0.5204 ± 0.0131 | min=0.4966 max=0.5441
         : test loss mean=0.7039 ± 0.0392
         : individual accs = ['0.523749', '0.524271', '0.535890', '0.520785', '0.530973', '0.506157', '0.512896', '0.522045', '0.520148', '0.531343', '0.500976', '0.535310', '0.531559', '0.544144', '0.525768', '0.501077', '0.516923', '0.501227', '0.527121', '0.496562']
         : correct/total = [(7454, 14232), (7463, 14235), (7645, 14266), (7404, 14217), (7560, 14238), (7275, 14373), (7358, 14346), (7483, 14334), (7435, 14294), (7637, 14373), (7186, 14344), (7656, 14302), (7630, 14354), (7815, 14362), (7529, 14320), (7213, 14395), (7438, 14389), (7146, 14257), (7512, 14251), (7150, 14399)]
         : compromised: 0.5208, honest: 0.5204
Round 006: test acc mean=0.5391 ± 0.0124 | min=0.5070 max=0.5555
         : test loss mean=0.7922 ± 0.2224
         : individual accs = ['0.549677', '0.550755', '0.535819', '0.551171', '0.544880', '0.537327', '0.539941', '0.535929', '0.524206', '0.506992', '0.546919', '0.544959', '0.550439', '0.549157', '0.529749', '0.539632', '0.523803', '0.546188', '0.555540', '0.519550']
         : correct/total = [(7823, 14232), (7840, 14235), (7644, 14266), (7836, 14217), (7758, 14238), (7723, 14373), (7746, 14346), (7682, 14334), (7493, 14294), (7287, 14373), (7845, 14344), (7794, 14302), (7901, 14354), (7887, 14362), (7586, 14320), (7768, 14395), (7537, 14389), (7787, 14257), (7917, 14251), (7481, 14399)]
         : compromised: 0.5458, honest: 0.5375
Round 007: test acc mean=0.5284 ± 0.0247 | min=0.4896 max=0.5808
         : test loss mean=0.7020 ± 0.0435
         : individual accs = ['0.507378', '0.526730', '0.546054', '0.494971', '0.580770', '0.506297', '0.573052', '0.542417', '0.525535', '0.536840', '0.501534', '0.563348', '0.513655', '0.536416', '0.535265', '0.510386', '0.538884', '0.534334', '0.489650', '0.504618']
         : correct/total = [(7221, 14232), (7498, 14235), (7790, 14266), (7037, 14217), (8269, 14238), (7277, 14373), (8221, 14346), (7775, 14334), (7512, 14294), (7716, 14373), (7194, 14344), (8057, 14302), (7373, 14354), (7704, 14362), (7665, 14320), (7347, 14395), (7754, 14389), (7618, 14257), (6978, 14251), (7266, 14399)]
         : compromised: 0.5227, honest: 0.5298
Round 008: test acc mean=0.5443 ± 0.0100 | min=0.5245 max=0.5578
         : test loss mean=0.7497 ± 0.1485
         : individual accs = ['0.549888', '0.551598', '0.556778', '0.540128', '0.556047', '0.550964', '0.541963', '0.547649', '0.534910', '0.526612', '0.553263', '0.548804', '0.541661', '0.524509', '0.542737', '0.557833', '0.541038', '0.551378', '0.542629', '0.524759']
         : correct/total = [(7826, 14232), (7852, 14235), (7943, 14266), (7679, 14217), (7917, 14238), (7919, 14373), (7775, 14346), (7850, 14334), (7646, 14294), (7569, 14373), (7936, 14344), (7849, 14302), (7775, 14354), (7533, 14362), (7772, 14320), (8030, 14395), (7785, 14389), (7861, 14257), (7733, 14251), (7556, 14399)]
         : compromised: 0.5421, honest: 0.5448
Round 009: test acc mean=0.5352 ± 0.0270 | min=0.4894 max=0.5859
         : test loss mean=0.7001 ± 0.0424
         : individual accs = ['0.520868', '0.563541', '0.536590', '0.493353', '0.585897', '0.511375', '0.582950', '0.547719', '0.539527', '0.534057', '0.514849', '0.566284', '0.499025', '0.529035', '0.546648', '0.543314', '0.557162', '0.533913', '0.489369', '0.508299']
         : correct/total = [(7413, 14232), (8022, 14235), (7655, 14266), (7014, 14217), (8342, 14238), (7350, 14373), (8363, 14346), (7851, 14334), (7712, 14294), (7676, 14373), (7385, 14344), (8099, 14302), (7163, 14354), (7598, 14362), (7828, 14320), (7821, 14395), (8017, 14389), (7612, 14257), (6974, 14251), (7319, 14399)]
         : compromised: 0.5183, honest: 0.5394
Round 010: test acc mean=0.5446 ± 0.0158 | min=0.5106 max=0.5685
         : test loss mean=0.7319 ± 0.1155
         : individual accs = ['0.541245', '0.550685', '0.568485', '0.527326', '0.563141', '0.548181', '0.557019', '0.554765', '0.540437', '0.545189', '0.556260', '0.560131', '0.512540', '0.510583', '0.545810', '0.558805', '0.548822', '0.549134', '0.529717', '0.524203']
         : correct/total = [(7703, 14232), (7839, 14235), (8110, 14266), (7497, 14217), (8018, 14238), (7879, 14373), (7991, 14346), (7952, 14334), (7725, 14294), (7836, 14373), (7979, 14344), (8011, 14302), (7357, 14354), (7333, 14362), (7816, 14320), (8044, 14395), (7897, 14389), (7829, 14257), (7549, 14251), (7548, 14399)]
         : compromised: 0.5301, honest: 0.5483

=== FINAL RESULTS ===
Dataset: sent140, Nodes: 20, Graph: erdos, Aggregation: d-fedavg
Attack: directed_deviation, 20.0% compromised
Final accuracy - Compromised: 0.5301, Honest: 0.5483
Overall test accuracy: mean=0.5446 ± 0.0158
