Device: cuda
Seed: 987654321
Loading 1 LEAF Sent140 train files...
LEAF Sent140 train: 254555 users, 908652 samples
Building vocabulary (max_size=10000)...
Vocabulary size: 10000
Loading 1 LEAF Sent140 test files...
LEAF Sent140 test: 254555 users, 286281 samples
Found 254555 train users, 254555 test users, 254555 common users
User sample counts range: 494 (max) to 1 (min)
Distributed ALL 254555 users across 20 clients
Users per client: 12727 (with 15 clients getting +1 user)
Train partition sizes: [44353, 44290, 44657, 44907, 44696, 45843, 45801, 45619, 45069, 45639, 45821, 45311, 45779, 46056, 45625, 45984, 46428, 44737, 45540, 46497]
Test partition sizes: [14232, 14235, 14266, 14217, 14238, 14373, 14346, 14334, 14294, 14373, 14344, 14302, 14354, 14362, 14320, 14395, 14389, 14257, 14251, 14399]
  Client 0: 44353 train samples, 2 unique classes
  Client 1: 44290 train samples, 2 unique classes
  Client 2: 44657 train samples, 2 unique classes
  Client 3: 44907 train samples, 2 unique classes
  Client 4: 44696 train samples, 2 unique classes
  Client 5: 45843 train samples, 2 unique classes
  Client 6: 45801 train samples, 2 unique classes
  Client 7: 45619 train samples, 2 unique classes
  Client 8: 45069 train samples, 2 unique classes
  Client 9: 45639 train samples, 2 unique classes
  Client 10: 45821 train samples, 2 unique classes
  Client 11: 45311 train samples, 2 unique classes
  Client 12: 45779 train samples, 2 unique classes
  Client 13: 46056 train samples, 2 unique classes
  Client 14: 45625 train samples, 2 unique classes
  Client 15: 45984 train samples, 2 unique classes
  Client 16: 46428 train samples, 2 unique classes
  Client 17: 44737 train samples, 2 unique classes
  Client 18: 45540 train samples, 2 unique classes
  Client 19: 46497 train samples, 2 unique classes
Will sample 4500 samples per client per epoch
Graph: erdos, nodes: 20, edges: 48
Degree statistics: avg=4.80, min=2, max=7
Attack: Compromised 8/20 nodes: [1, 5, 11, 12, 13, 14, 17, 18]
Attack type: directed_deviation, lambda: 1.0
Model variant: baseline
Model parameters: 1,174,986
BALANCE algorithm:
Balance Config: BALANCEConfig(gamma=2, kappa=1, alpha=0.5, min_neighbors=1)
  - Model dimension: 1,174,986 parameters
  - Complexity: O(N×d) = O(20×1,174,986)
Initial test acc across nodes: mean=0.4953 ± 0.0174
Round 001: test acc mean=0.5025 ± 0.0202 | min=0.4718 max=0.5802
         : test loss mean=1.6642 ± 1.0160
         : individual accs = ['0.471824', '0.514858', '0.508622', '0.490610', '0.491712', '0.499061', '0.495957', '0.501814', '0.500840', '0.498782', '0.504392', '0.491120', '0.481051', '0.496727', '0.500698', '0.507121', '0.506081', '0.501227', '0.507122', '0.580179']
         : correct/total = [(6715, 14232), (7329, 14235), (7256, 14266), (6975, 14217), (7001, 14238), (7173, 14373), (7115, 14346), (7193, 14334), (7159, 14294), (7169, 14373), (7235, 14344), (7024, 14302), (6905, 14354), (7134, 14362), (7170, 14320), (7300, 14395), (7282, 14389), (7146, 14257), (7227, 14251), (8354, 14399)]
         : compromised: 0.4990, honest: 0.5048
Round 002: test acc mean=0.5053 ± 0.0077 | min=0.4905 max=0.5199
         : test loss mean=0.9863 ± 0.6251
         : individual accs = ['0.508432', '0.516263', '0.494252', '0.519871', '0.497120', '0.501913', '0.500836', '0.502581', '0.503778', '0.512697', '0.507669', '0.511886', '0.503762', '0.513995', '0.507891', '0.500938', '0.490514', '0.515115', '0.497018', '0.500243']
         : correct/total = [(7236, 14232), (7349, 14235), (7051, 14266), (7391, 14217), (7078, 14238), (7214, 14373), (7185, 14346), (7204, 14334), (7201, 14294), (7369, 14373), (7282, 14344), (7321, 14302), (7231, 14354), (7382, 14362), (7273, 14320), (7211, 14395), (7058, 14389), (7344, 14257), (7083, 14251), (7203, 14399)]
         : compromised: 0.5085, honest: 0.5032
Round 003: test acc mean=0.5364 ± 0.0359 | min=0.4955 max=0.6000
         : test loss mean=0.6896 ± 0.0084
         : individual accs = ['0.495925', '0.534036', '0.585238', '0.585637', '0.502458', '0.498017', '0.575561', '0.518069', '0.502029', '0.600014', '0.595441', '0.509020', '0.531489', '0.547208', '0.524651', '0.551997', '0.503371', '0.503963', '0.495474', '0.568651']
         : correct/total = [(7058, 14232), (7602, 14235), (8349, 14266), (8326, 14217), (7154, 14238), (7158, 14373), (8257, 14346), (7426, 14334), (7176, 14294), (8624, 14373), (8541, 14344), (7280, 14302), (7629, 14354), (7859, 14362), (7513, 14320), (7946, 14395), (7243, 14389), (7185, 14257), (7061, 14251), (8188, 14399)]
         : compromised: 0.5180, honest: 0.5487
Round 004: test acc mean=0.5781 ± 0.0366 | min=0.4941 max=0.6387
         : test loss mean=0.6767 ± 0.0117
         : individual accs = ['0.601672', '0.603934', '0.601921', '0.614265', '0.579857', '0.537744', '0.604698', '0.608274', '0.599063', '0.586934', '0.575572', '0.594183', '0.585760', '0.595878', '0.494064', '0.519972', '0.561054', '0.532160', '0.526068', '0.638655']
         : correct/total = [(8563, 14232), (8597, 14235), (8587, 14266), (8733, 14217), (8256, 14238), (7729, 14373), (8675, 14346), (8719, 14334), (8563, 14294), (8436, 14373), (8256, 14344), (8498, 14302), (8408, 14354), (8558, 14362), (7075, 14320), (7485, 14395), (8073, 14389), (7587, 14257), (7497, 14251), (9196, 14399)]
         : compromised: 0.5587, honest: 0.5910
Round 005: test acc mean=0.6072 ± 0.0324 | min=0.5014 max=0.6466
         : test loss mean=0.6641 ± 0.0141
         : individual accs = ['0.628443', '0.604145', '0.629679', '0.636421', '0.612446', '0.621095', '0.612296', '0.610646', '0.642297', '0.603841', '0.604992', '0.614110', '0.611816', '0.606879', '0.501397', '0.544217', '0.621238', '0.610367', '0.581714', '0.646642']
         : correct/total = [(8944, 14232), (8600, 14235), (8983, 14266), (9048, 14217), (8720, 14238), (8927, 14373), (8784, 14346), (8753, 14334), (9181, 14294), (8679, 14373), (8678, 14344), (8783, 14302), (8782, 14354), (8716, 14362), (7180, 14320), (7834, 14395), (8939, 14389), (8702, 14257), (8290, 14251), (9311, 14399)]
         : compromised: 0.5939, honest: 0.6161
Round 006: test acc mean=0.6254 ± 0.0222 | min=0.5452 max=0.6511
         : test loss mean=0.6526 ± 0.0158
         : individual accs = ['0.638983', '0.616649', '0.631011', '0.644932', '0.636396', '0.635428', '0.633835', '0.641621', '0.645725', '0.628609', '0.607362', '0.629562', '0.612791', '0.614051', '0.545182', '0.611740', '0.635763', '0.632742', '0.614413', '0.651087']
         : correct/total = [(9094, 14232), (8778, 14235), (9002, 14266), (9169, 14217), (9061, 14238), (9133, 14373), (9093, 14346), (9197, 14334), (9230, 14294), (9035, 14373), (8712, 14344), (9004, 14302), (8796, 14354), (8819, 14362), (7807, 14320), (8806, 14395), (9148, 14389), (9021, 14257), (8756, 14251), (9375, 14399)]
         : compromised: 0.6126, honest: 0.6339
Round 007: test acc mean=0.6361 ± 0.0138 | min=0.5920 max=0.6556
         : test loss mean=0.6426 ± 0.0139
         : individual accs = ['0.644463', '0.631753', '0.612996', '0.637336', '0.640680', '0.628192', '0.641085', '0.628506', '0.655590', '0.645307', '0.636433', '0.640050', '0.632646', '0.630692', '0.592039', '0.641473', '0.645146', '0.647471', '0.637008', '0.653309']
         : correct/total = [(9172, 14232), (8993, 14235), (8745, 14266), (9061, 14217), (9122, 14238), (9029, 14373), (9197, 14346), (9009, 14334), (9371, 14294), (9275, 14373), (9129, 14344), (9154, 14302), (9081, 14354), (9058, 14362), (8478, 14320), (9234, 14395), (9283, 14389), (9231, 14257), (9078, 14251), (9407, 14399)]
         : compromised: 0.6300, honest: 0.6402
Round 008: test acc mean=0.6478 ± 0.0088 | min=0.6277 max=0.6619
         : test loss mean=0.6344 ± 0.0145
         : individual accs = ['0.651841', '0.647137', '0.640053', '0.656397', '0.655218', '0.649830', '0.640597', '0.642389', '0.661886', '0.650734', '0.630856', '0.642078', '0.651665', '0.641624', '0.643785', '0.627718', '0.652999', '0.657291', '0.652095', '0.658865']
         : correct/total = [(9277, 14232), (9212, 14235), (9131, 14266), (9332, 14217), (9329, 14238), (9340, 14373), (9190, 14346), (9208, 14334), (9461, 14294), (9353, 14373), (9049, 14344), (9183, 14302), (9354, 14354), (9215, 14362), (9219, 14320), (9036, 14395), (9396, 14389), (9371, 14257), (9293, 14251), (9487, 14399)]
         : compromised: 0.6482, honest: 0.6475
Round 009: test acc mean=0.6490 ± 0.0085 | min=0.6281 max=0.6603
         : test loss mean=0.6310 ± 0.0083
         : individual accs = ['0.633713', '0.650228', '0.628067', '0.654991', '0.640258', '0.654352', '0.645825', '0.655295', '0.634042', '0.644472', '0.654699', '0.650748', '0.656542', '0.652834', '0.650908', '0.652518', '0.648134', '0.657291', '0.660305', '0.654490']
         : correct/total = [(9019, 14232), (9256, 14235), (8960, 14266), (9312, 14217), (9116, 14238), (9405, 14373), (9265, 14346), (9393, 14334), (9063, 14294), (9263, 14373), (9391, 14344), (9307, 14302), (9424, 14354), (9376, 14362), (9321, 14320), (9393, 14395), (9326, 14389), (9371, 14257), (9410, 14251), (9424, 14399)]
         : compromised: 0.6542, honest: 0.6455
Round 010: test acc mean=0.6602 ± 0.0077 | min=0.6388 max=0.6717
         : test loss mean=0.6182 ± 0.0099
         : individual accs = ['0.659359', '0.658799', '0.638792', '0.668988', '0.659924', '0.661588', '0.656002', '0.667155', '0.671331', '0.662562', '0.654350', '0.663474', '0.660861', '0.658195', '0.659288', '0.652518', '0.666203', '0.671740', '0.647744', '0.665463']
         : correct/total = [(9384, 14232), (9378, 14235), (9113, 14266), (9511, 14217), (9396, 14238), (9509, 14373), (9411, 14346), (9563, 14334), (9596, 14294), (9523, 14373), (9386, 14344), (9489, 14302), (9486, 14354), (9453, 14362), (9441, 14320), (9393, 14395), (9586, 14389), (9577, 14257), (9231, 14251), (9582, 14399)]
         : compromised: 0.6602, honest: 0.6602

=== FINAL RESULTS ===
Dataset: sent140, Nodes: 20, Graph: erdos, Aggregation: balance
Attack: directed_deviation, 40.0% compromised
Final accuracy - Compromised: 0.6602, Honest: 0.6602
Overall test accuracy: mean=0.6602 ± 0.0077

=== BALANCE SUMMARY ===
Node 0: acceptance=0.850
Node 1: acceptance=0.633
Node 2: acceptance=0.460
Node 3: acceptance=0.550
Node 4: acceptance=0.400
Node 5: acceptance=0.360
Node 6: acceptance=0.640
Node 7: acceptance=0.640
Node 8: acceptance=0.600
Node 9: acceptance=0.700
Node 10: acceptance=0.550
Node 11: acceptance=0.457
Node 12: acceptance=0.714
Node 13: acceptance=0.550
Node 14: acceptance=0.443
Node 15: acceptance=0.400
Node 16: acceptance=0.360
Node 17: acceptance=0.480
Node 18: acceptance=0.575
Node 19: acceptance=1.000

=== PARALLEL EXECUTION TIME (realistic for distributed system) ===
  COMMUNICATION (max across nodes):
    - Full model transfer: 0.000s (0.0%)
  COMPUTATION (max across nodes):
    - Filtering: 0.030s (70.6%)
    - Aggregation: 0.012s (29.3%)
  TOTALS:
    - Total computation: 0.042s (100.0%)
    - Total communication: 0.000s (0.0%)
    - Total parallel time: 0.042s

=== PER-NODE AVERAGE TIME ===
  - Filtering: 0.021s
  - Aggregation: 0.006s
  - Model transfer: 0.000s
  - Total per node: 0.027s

=== TOTAL COMPUTATIONAL WORK (sum across all nodes) ===
  - Total filtering: 0.428s
  - Total aggregation: 0.110s
  - Total model transfer: 0.000s
  - Grand total: 0.539s
  - Mean acceptance rate: 0.568

BALANCE Algorithm Properties:
  - Model dimension: 1,174,986
  - No compression: Full parameter comparison
  - Theoretical complexity: O(deg(i)×d)
  - Approach: Full parameter filtering + averaging
