Device: cuda
Seed: 987654321
Loading 1 LEAF Sent140 train files...
LEAF Sent140 train: 254555 users, 908652 samples
Building vocabulary (max_size=10000)...
Vocabulary size: 10000
Loading 1 LEAF Sent140 test files...
LEAF Sent140 test: 254555 users, 286281 samples
Found 254555 train users, 254555 test users, 254555 common users
User sample counts range: 494 (max) to 1 (min)
Distributed ALL 254555 users across 20 clients
Users per client: 12727 (with 15 clients getting +1 user)
Train partition sizes: [44353, 44290, 44657, 44907, 44696, 45843, 45801, 45619, 45069, 45639, 45821, 45311, 45779, 46056, 45625, 45984, 46428, 44737, 45540, 46497]
Test partition sizes: [14232, 14235, 14266, 14217, 14238, 14373, 14346, 14334, 14294, 14373, 14344, 14302, 14354, 14362, 14320, 14395, 14389, 14257, 14251, 14399]
  Client 0: 44353 train samples, 2 unique classes
  Client 1: 44290 train samples, 2 unique classes
  Client 2: 44657 train samples, 2 unique classes
  Client 3: 44907 train samples, 2 unique classes
  Client 4: 44696 train samples, 2 unique classes
  Client 5: 45843 train samples, 2 unique classes
  Client 6: 45801 train samples, 2 unique classes
  Client 7: 45619 train samples, 2 unique classes
  Client 8: 45069 train samples, 2 unique classes
  Client 9: 45639 train samples, 2 unique classes
  Client 10: 45821 train samples, 2 unique classes
  Client 11: 45311 train samples, 2 unique classes
  Client 12: 45779 train samples, 2 unique classes
  Client 13: 46056 train samples, 2 unique classes
  Client 14: 45625 train samples, 2 unique classes
  Client 15: 45984 train samples, 2 unique classes
  Client 16: 46428 train samples, 2 unique classes
  Client 17: 44737 train samples, 2 unique classes
  Client 18: 45540 train samples, 2 unique classes
  Client 19: 46497 train samples, 2 unique classes
Will sample 4500 samples per client per epoch
Graph: ring, nodes: 20, edges: 20
Degree statistics: avg=2.00, min=2, max=2
Attack: Compromised 6/20 nodes: [5, 12, 13, 14, 17, 18]
Attack type: directed_deviation, lambda: 1.0
Model variant: baseline
Model parameters: 1,174,986
Initial test acc across nodes: mean=0.4953 ± 0.0174
Round 001: test acc mean=0.5097 ± 0.0174 | min=0.4882 max=0.5652
         : test loss mean=5.0711 ± 6.9681
         : individual accs = ['0.534992', '0.565227', '0.488224', '0.512415', '0.510395', '0.505183', '0.506483', '0.524766', '0.502169', '0.533779', '0.502022', '0.508880', '0.504180', '0.499164', '0.494134', '0.500243', '0.495865', '0.502420', '0.496667', '0.507535']
         : correct/total = [(7614, 14232), (8046, 14235), (6965, 14266), (7285, 14217), (7267, 14238), (7261, 14373), (7266, 14346), (7522, 14334), (7178, 14294), (7672, 14373), (7201, 14344), (7278, 14302), (7237, 14354), (7169, 14362), (7076, 14320), (7201, 14395), (7135, 14389), (7163, 14257), (7078, 14251), (7308, 14399)]
         : compromised: 0.5003, honest: 0.5138
Round 002: test acc mean=0.5213 ± 0.0466 | min=0.4914 max=0.6367
         : test loss mean=2.8920 ± 3.5463
         : individual accs = ['0.491428', '0.636740', '0.628207', '0.515088', '0.495154', '0.491547', '0.500070', '0.494977', '0.512873', '0.628053', '0.501394', '0.497203', '0.494914', '0.505710', '0.499302', '0.499618', '0.504691', '0.507400', '0.510280', '0.512258']
         : correct/total = [(6994, 14232), (9064, 14235), (8962, 14266), (7323, 14217), (7050, 14238), (7065, 14373), (7174, 14346), (7095, 14334), (7331, 14294), (9027, 14373), (7192, 14344), (7111, 14302), (7104, 14354), (7263, 14362), (7150, 14320), (7192, 14395), (7262, 14389), (7234, 14257), (7272, 14251), (7376, 14399)]
         : compromised: 0.5015, honest: 0.5298
Round 003: test acc mean=0.5126 ± 0.0455 | min=0.4677 max=0.6236
         : test loss mean=1.1243 ± 0.6468
         : individual accs = ['0.518339', '0.616579', '0.607739', '0.467680', '0.512712', '0.484589', '0.503555', '0.477396', '0.498181', '0.623600', '0.523494', '0.501958', '0.496586', '0.497493', '0.482682', '0.486836', '0.496490', '0.479273', '0.492948', '0.484061']
         : correct/total = [(7377, 14232), (8777, 14235), (8670, 14266), (6649, 14217), (7300, 14238), (6965, 14373), (7224, 14346), (6843, 14334), (7121, 14294), (8963, 14373), (7509, 14344), (7179, 14302), (7128, 14354), (7145, 14362), (6912, 14320), (7008, 14395), (7144, 14389), (6833, 14257), (7025, 14251), (6970, 14399)]
         : compromised: 0.4889, honest: 0.5228
Round 004: test acc mean=0.5186 ± 0.0434 | min=0.4897 max=0.6297
         : test loss mean=1.5268 ± 1.2278
         : individual accs = ['0.507448', '0.620302', '0.629749', '0.561018', '0.499438', '0.497252', '0.489753', '0.504116', '0.498461', '0.595074', '0.501813', '0.489722', '0.490456', '0.503203', '0.493506', '0.492393', '0.497046', '0.499755', '0.505087', '0.497118']
         : correct/total = [(7222, 14232), (8830, 14235), (8984, 14266), (7976, 14217), (7111, 14238), (7147, 14373), (7026, 14346), (7226, 14334), (7125, 14294), (8553, 14373), (7198, 14344), (7004, 14302), (7040, 14354), (7227, 14362), (7067, 14320), (7088, 14395), (7152, 14389), (7125, 14257), (7198, 14251), (7158, 14399)]
         : compromised: 0.4982, honest: 0.5274
Round 005: test acc mean=0.5261 ± 0.0488 | min=0.4838 max=0.6421
         : test loss mean=1.2705 ± 0.8951
         : individual accs = ['0.504427', '0.642079', '0.630730', '0.505100', '0.504495', '0.504418', '0.501394', '0.546323', '0.574857', '0.624226', '0.495678', '0.501748', '0.501951', '0.483846', '0.499302', '0.511983', '0.504205', '0.507961', '0.492386', '0.485728']
         : correct/total = [(7179, 14232), (9140, 14235), (8998, 14266), (7181, 14217), (7183, 14238), (7250, 14373), (7193, 14346), (7831, 14334), (8217, 14294), (8972, 14373), (7110, 14344), (7176, 14302), (7205, 14354), (6949, 14362), (7150, 14320), (7370, 14395), (7255, 14389), (7242, 14257), (7017, 14251), (6994, 14399)]
         : compromised: 0.4983, honest: 0.5381
Round 006: test acc mean=0.5367 ± 0.0570 | min=0.4854 max=0.6391
         : test loss mean=1.4152 ± 1.3691
         : individual accs = ['0.612493', '0.639059', '0.638091', '0.490962', '0.495786', '0.495095', '0.523351', '0.605763', '0.624318', '0.613581', '0.517777', '0.493078', '0.485440', '0.506684', '0.500978', '0.499410', '0.497741', '0.500175', '0.500175', '0.493784']
         : correct/total = [(8717, 14232), (9097, 14235), (9103, 14266), (6980, 14217), (7059, 14238), (7116, 14373), (7508, 14346), (8683, 14334), (8924, 14294), (8819, 14373), (7427, 14344), (7052, 14302), (6968, 14354), (7277, 14362), (7174, 14320), (7189, 14395), (7162, 14389), (7131, 14257), (7128, 14251), (7110, 14399)]
         : compromised: 0.4981, honest: 0.5532
Round 007: test acc mean=0.5458 ± 0.0533 | min=0.4932 max=0.6485
         : test loss mean=1.2044 ± 0.9258
         : individual accs = ['0.589657', '0.648542', '0.640053', '0.584863', '0.511167', '0.504140', '0.517357', '0.532301', '0.627746', '0.639463', '0.539808', '0.502937', '0.495611', '0.498956', '0.494204', '0.540188', '0.531031', '0.493161', '0.506140', '0.518578']
         : correct/total = [(8392, 14232), (9232, 14235), (9131, 14266), (8315, 14217), (7278, 14238), (7246, 14373), (7422, 14346), (7630, 14334), (8973, 14294), (9191, 14373), (7743, 14344), (7193, 14302), (7114, 14354), (7166, 14362), (7077, 14320), (7776, 14395), (7641, 14389), (7031, 14257), (7213, 14251), (7467, 14399)]
         : compromised: 0.4987, honest: 0.5660
Round 008: test acc mean=0.5514 ± 0.0601 | min=0.4949 max=0.6515
         : test loss mean=1.3990 ± 1.4182
         : individual accs = ['0.632940', '0.651493', '0.645240', '0.522614', '0.506181', '0.495860', '0.521609', '0.609948', '0.626487', '0.637932', '0.617680', '0.494896', '0.495750', '0.507381', '0.501327', '0.524904', '0.520259', '0.496668', '0.510069', '0.508160']
         : correct/total = [(9008, 14232), (9274, 14235), (9205, 14266), (7430, 14217), (7207, 14238), (7127, 14373), (7483, 14346), (8743, 14334), (8955, 14294), (9169, 14373), (8860, 14344), (7078, 14302), (7116, 14354), (7287, 14362), (7179, 14320), (7556, 14395), (7486, 14389), (7081, 14257), (7269, 14251), (7317, 14399)]
         : compromised: 0.5012, honest: 0.5729
Round 009: test acc mean=0.5467 ± 0.0571 | min=0.4843 max=0.6505
         : test loss mean=1.2858 ± 1.3118
         : individual accs = ['0.620925', '0.640253', '0.650498', '0.589154', '0.538278', '0.504140', '0.502788', '0.500070', '0.623968', '0.637515', '0.582962', '0.504755', '0.501324', '0.484264', '0.501257', '0.511983', '0.517270', '0.499755', '0.499544', '0.522606']
         : correct/total = [(8837, 14232), (9114, 14235), (9280, 14266), (8376, 14217), (7664, 14238), (7246, 14373), (7213, 14346), (7168, 14334), (8919, 14294), (9163, 14373), (8362, 14344), (7219, 14302), (7196, 14354), (6955, 14362), (7178, 14320), (7370, 14395), (7443, 14389), (7125, 14257), (7119, 14251), (7525, 14399)]
         : compromised: 0.4984, honest: 0.5674
Round 010: test acc mean=0.5571 ± 0.0624 | min=0.4951 max=0.6590
         : test loss mean=1.1723 ± 0.9064
         : individual accs = ['0.648047', '0.659009', '0.654633', '0.545755', '0.506110', '0.495860', '0.516311', '0.635970', '0.626347', '0.645933', '0.594743', '0.516851', '0.496447', '0.495056', '0.503212', '0.551997', '0.542706', '0.500877', '0.502210', '0.503924']
         : correct/total = [(9223, 14232), (9381, 14235), (9339, 14266), (7759, 14217), (7206, 14238), (7127, 14373), (7407, 14346), (9116, 14334), (8953, 14294), (9284, 14373), (8531, 14344), (7392, 14302), (7126, 14354), (7110, 14362), (7206, 14320), (7946, 14395), (7809, 14389), (7141, 14257), (7157, 14251), (7256, 14399)]
         : compromised: 0.4989, honest: 0.5820

=== FINAL RESULTS ===
Dataset: sent140, Nodes: 20, Graph: ring, Aggregation: d-fedavg
Attack: directed_deviation, 30.0% compromised
Final accuracy - Compromised: 0.4989, Honest: 0.5820
Overall test accuracy: mean=0.5571 ± 0.0624
