Device: cuda
Seed: 987654321
Loading 1 LEAF Sent140 train files...
LEAF Sent140 train: 254555 users, 908652 samples
Building vocabulary (max_size=10000)...
Vocabulary size: 10000
Loading 1 LEAF Sent140 test files...
LEAF Sent140 test: 254555 users, 286281 samples
Found 254555 train users, 254555 test users, 254555 common users
User sample counts range: 494 (max) to 1 (min)
Distributed ALL 254555 users across 20 clients
Users per client: 12727 (with 15 clients getting +1 user)
Train partition sizes: [44353, 44290, 44657, 44907, 44696, 45843, 45801, 45619, 45069, 45639, 45821, 45311, 45779, 46056, 45625, 45984, 46428, 44737, 45540, 46497]
Test partition sizes: [14232, 14235, 14266, 14217, 14238, 14373, 14346, 14334, 14294, 14373, 14344, 14302, 14354, 14362, 14320, 14395, 14389, 14257, 14251, 14399]
  Client 0: 44353 train samples, 2 unique classes
  Client 1: 44290 train samples, 2 unique classes
  Client 2: 44657 train samples, 2 unique classes
  Client 3: 44907 train samples, 2 unique classes
  Client 4: 44696 train samples, 2 unique classes
  Client 5: 45843 train samples, 2 unique classes
  Client 6: 45801 train samples, 2 unique classes
  Client 7: 45619 train samples, 2 unique classes
  Client 8: 45069 train samples, 2 unique classes
  Client 9: 45639 train samples, 2 unique classes
  Client 10: 45821 train samples, 2 unique classes
  Client 11: 45311 train samples, 2 unique classes
  Client 12: 45779 train samples, 2 unique classes
  Client 13: 46056 train samples, 2 unique classes
  Client 14: 45625 train samples, 2 unique classes
  Client 15: 45984 train samples, 2 unique classes
  Client 16: 46428 train samples, 2 unique classes
  Client 17: 44737 train samples, 2 unique classes
  Client 18: 45540 train samples, 2 unique classes
  Client 19: 46497 train samples, 2 unique classes
Will sample 4500 samples per client per epoch
Graph: fully, nodes: 20, edges: 190
Degree statistics: avg=19.00, min=19, max=19
Attack: Compromised 4/20 nodes: [5, 12, 13, 17]
Attack type: krum, lambda: 1.0
Model variant: baseline
Model parameters: 1,174,986
Sketchguard Node 0:
  Model dim: 1,174,986 → Sketch size: 180
  Compression ratio: 6527.7x
  Using model parameters for aggregation, sketches for filtering
Sketchguard Node 1:
  Model dim: 1,174,986 → Sketch size: 180
  Compression ratio: 6527.7x
  Using model parameters for aggregation, sketches for filtering
Sketchguard Node 2:
  Model dim: 1,174,986 → Sketch size: 180
  Compression ratio: 6527.7x
  Using model parameters for aggregation, sketches for filtering
Sketchguard Node 3:
  Model dim: 1,174,986 → Sketch size: 180
  Compression ratio: 6527.7x
  Using model parameters for aggregation, sketches for filtering
Sketchguard Node 4:
  Model dim: 1,174,986 → Sketch size: 180
  Compression ratio: 6527.7x
  Using model parameters for aggregation, sketches for filtering
Sketchguard Node 5:
  Model dim: 1,174,986 → Sketch size: 180
  Compression ratio: 6527.7x
  Using model parameters for aggregation, sketches for filtering
Sketchguard Node 6:
  Model dim: 1,174,986 → Sketch size: 180
  Compression ratio: 6527.7x
  Using model parameters for aggregation, sketches for filtering
Sketchguard Node 7:
  Model dim: 1,174,986 → Sketch size: 180
  Compression ratio: 6527.7x
  Using model parameters for aggregation, sketches for filtering
Sketchguard Node 8:
  Model dim: 1,174,986 → Sketch size: 180
  Compression ratio: 6527.7x
  Using model parameters for aggregation, sketches for filtering
Sketchguard Node 9:
  Model dim: 1,174,986 → Sketch size: 180
  Compression ratio: 6527.7x
  Using model parameters for aggregation, sketches for filtering
Sketchguard Node 10:
  Model dim: 1,174,986 → Sketch size: 180
  Compression ratio: 6527.7x
  Using model parameters for aggregation, sketches for filtering
Sketchguard Node 11:
  Model dim: 1,174,986 → Sketch size: 180
  Compression ratio: 6527.7x
  Using model parameters for aggregation, sketches for filtering
Sketchguard Node 12:
  Model dim: 1,174,986 → Sketch size: 180
  Compression ratio: 6527.7x
  Using model parameters for aggregation, sketches for filtering
Sketchguard Node 13:
  Model dim: 1,174,986 → Sketch size: 180
  Compression ratio: 6527.7x
  Using model parameters for aggregation, sketches for filtering
Sketchguard Node 14:
  Model dim: 1,174,986 → Sketch size: 180
  Compression ratio: 6527.7x
  Using model parameters for aggregation, sketches for filtering
Sketchguard Node 15:
  Model dim: 1,174,986 → Sketch size: 180
  Compression ratio: 6527.7x
  Using model parameters for aggregation, sketches for filtering
Sketchguard Node 16:
  Model dim: 1,174,986 → Sketch size: 180
  Compression ratio: 6527.7x
  Using model parameters for aggregation, sketches for filtering
Sketchguard Node 17:
  Model dim: 1,174,986 → Sketch size: 180
  Compression ratio: 6527.7x
  Using model parameters for aggregation, sketches for filtering
Sketchguard Node 18:
  Model dim: 1,174,986 → Sketch size: 180
  Compression ratio: 6527.7x
  Using model parameters for aggregation, sketches for filtering
Sketchguard Node 19:
  Model dim: 1,174,986 → Sketch size: 180
  Compression ratio: 6527.7x
  Using model parameters for aggregation, sketches for filtering
Sketchguard ALGORITHM (Sketch-based Filtering + State Aggregation)
  - Model dimension: 1,174,986 parameters
  - Config: SketchguardConfig(gamma=2, kappa=1, alpha=0.5, min_neighbors=1, sketch_size=180, network_seed=987654321, attack_detection_window=5)
  - Sketch size: 180
  - Compression ratio: 6527.7x
  - Complexity: O(d + N×k) = O(1,174,986 + 20×180)
  - Theoretical speedup vs BALANCE: 19.9x
Initial test acc across nodes: mean=0.4965 ± 0.0152
Round 001: test acc mean=0.4972 ± 0.0139 | min=0.4584 max=0.5243
         : test loss mean=0.7011 ± 0.0094
         : individual accs = ['0.487282', '0.487109', '0.491658', '0.512626', '0.486585', '0.490573', '0.502997', '0.506976', '0.489506', '0.516107', '0.500767', '0.489372', '0.514142', '0.524300', '0.458450', '0.501007', '0.496212', '0.502911', '0.488878', '0.496354']
         : correct/total = [(6935, 14232), (6934, 14235), (7014, 14266), (7288, 14217), (6928, 14238), (7051, 14373), (7216, 14346), (7267, 14334), (6997, 14294), (7418, 14373), (7183, 14344), (6999, 14302), (7380, 14354), (7530, 14362), (6565, 14320), (7212, 14395), (7140, 14389), (7170, 14257), (6967, 14251), (7147, 14399)]
         : compromised: 0.5080, honest: 0.4945
         : sketchguard stats = ['Node 0: acc_rate=1.000', 'Node 1: acc_rate=1.000', 'Node 2: acc_rate=1.000']...
Round 002: test acc mean=0.5288 ± 0.0235 | min=0.4970 max=0.5759
         : test loss mean=0.6906 ± 0.0021
         : individual accs = ['0.510399', '0.540569', '0.552152', '0.543504', '0.514468', '0.508105', '0.517845', '0.528952', '0.525535', '0.539971', '0.575851', '0.518109', '0.501254', '0.546651', '0.496997', '0.520945', '0.564667', '0.503823', '0.568100', '0.497673']
         : correct/total = [(7264, 14232), (7695, 14235), (7877, 14266), (7727, 14217), (7325, 14238), (7303, 14373), (7429, 14346), (7582, 14334), (7512, 14294), (7761, 14373), (8260, 14344), (7410, 14302), (7195, 14354), (7851, 14362), (7117, 14320), (7499, 14395), (8125, 14389), (7183, 14257), (8096, 14251), (7166, 14399)]
         : compromised: 0.5150, honest: 0.5322
         : sketchguard stats = ['Node 0: acc_rate=0.895', 'Node 1: acc_rate=0.895', 'Node 2: acc_rate=0.895']...
Round 003: test acc mean=0.5501 ± 0.0220 | min=0.5037 max=0.5893
         : test loss mean=0.6873 ± 0.0023
         : individual accs = ['0.565135', '0.559817', '0.578228', '0.568474', '0.589268', '0.503653', '0.535480', '0.548416', '0.546383', '0.565992', '0.556121', '0.565865', '0.523756', '0.537460', '0.541411', '0.538034', '0.549586', '0.506278', '0.577223', '0.546218']
         : correct/total = [(8043, 14232), (7969, 14235), (8249, 14266), (8082, 14217), (8390, 14238), (7239, 14373), (7682, 14346), (7861, 14334), (7810, 14294), (8135, 14373), (7977, 14344), (8093, 14302), (7518, 14354), (7719, 14362), (7753, 14320), (7745, 14395), (7908, 14389), (7218, 14257), (8226, 14251), (7865, 14399)]
         : compromised: 0.5178, honest: 0.5582
         : sketchguard stats = ['Node 0: acc_rate=0.860', 'Node 1: acc_rate=0.860', 'Node 2: acc_rate=0.860']...
Round 004: test acc mean=0.5947 ± 0.0061 | min=0.5839 max=0.6044
         : test loss mean=0.6782 ± 0.0031
         : individual accs = ['0.596121', '0.587987', '0.593299', '0.600056', '0.601559', '0.583942', '0.586366', '0.592298', '0.596824', '0.602101', '0.600112', '0.591106', '0.595235', '0.586409', '0.589176', '0.599583', '0.596914', '0.587992', '0.602624', '0.604417']
         : correct/total = [(8484, 14232), (8370, 14235), (8464, 14266), (8531, 14217), (8565, 14238), (8393, 14373), (8412, 14346), (8490, 14334), (8531, 14294), (8654, 14373), (8608, 14344), (8454, 14302), (8544, 14354), (8422, 14362), (8437, 14320), (8631, 14395), (8589, 14389), (8383, 14257), (8588, 14251), (8703, 14399)]
         : compromised: 0.5884, honest: 0.5963
         : sketchguard stats = ['Node 0: acc_rate=0.842', 'Node 1: acc_rate=0.842', 'Node 2: acc_rate=0.842']...
Round 005: test acc mean=0.6051 ± 0.0049 | min=0.5962 max=0.6182
         : test loss mean=0.6655 ± 0.0023
         : individual accs = ['0.606380', '0.603653', '0.601430', '0.618204', '0.608372', '0.603145', '0.609020', '0.605763', '0.596194', '0.608293', '0.608199', '0.603412', '0.604709', '0.599011', '0.605796', '0.601459', '0.605602', '0.603072', '0.598133', '0.612612']
         : correct/total = [(8630, 14232), (8593, 14235), (8580, 14266), (8789, 14217), (8662, 14238), (8669, 14373), (8737, 14346), (8683, 14334), (8522, 14294), (8743, 14373), (8724, 14344), (8630, 14302), (8680, 14354), (8603, 14362), (8675, 14320), (8658, 14395), (8714, 14389), (8598, 14257), (8524, 14251), (8821, 14399)]
         : compromised: 0.6025, honest: 0.6058
         : sketchguard stats = ['Node 0: acc_rate=0.832', 'Node 1: acc_rate=0.832', 'Node 2: acc_rate=0.832']...
Round 006: test acc mean=0.6147 ± 0.0040 | min=0.6027 max=0.6208
         : test loss mean=0.6562 ± 0.0024
         : individual accs = ['0.616217', '0.615666', '0.609842', '0.620806', '0.616730', '0.617268', '0.614736', '0.612390', '0.610746', '0.619634', '0.615867', '0.612292', '0.615369', '0.619412', '0.617737', '0.610976', '0.602683', '0.613313', '0.617360', '0.615321']
         : correct/total = [(8770, 14232), (8764, 14235), (8700, 14266), (8826, 14217), (8781, 14238), (8872, 14373), (8819, 14346), (8778, 14334), (8730, 14294), (8906, 14373), (8834, 14344), (8757, 14302), (8833, 14354), (8896, 14362), (8846, 14320), (8795, 14395), (8672, 14389), (8744, 14257), (8798, 14251), (8860, 14399)]
         : compromised: 0.6163, honest: 0.6143
         : sketchguard stats = ['Node 0: acc_rate=0.825', 'Node 1: acc_rate=0.825', 'Node 2: acc_rate=0.825']...
Round 007: test acc mean=0.6201 ± 0.0034 | min=0.6115 max=0.6250
         : test loss mean=0.6514 ± 0.0022
         : individual accs = ['0.620714', '0.623042', '0.616711', '0.625026', '0.623964', '0.624365', '0.622752', '0.617762', '0.620400', '0.623252', '0.617680', '0.619004', '0.616762', '0.621153', '0.621089', '0.622230', '0.615053', '0.617942', '0.611466', '0.621571']
         : correct/total = [(8834, 14232), (8869, 14235), (8798, 14266), (8886, 14217), (8884, 14238), (8974, 14373), (8934, 14346), (8855, 14334), (8868, 14294), (8958, 14373), (8860, 14344), (8853, 14302), (8853, 14354), (8921, 14362), (8894, 14320), (8957, 14395), (8850, 14389), (8810, 14257), (8714, 14251), (8950, 14399)]
         : compromised: 0.6201, honest: 0.6201
         : sketchguard stats = ['Node 0: acc_rate=0.820', 'Node 1: acc_rate=0.820', 'Node 2: acc_rate=0.820']...
Round 008: test acc mean=0.6233 ± 0.0050 | min=0.6105 max=0.6306
         : test loss mean=0.6487 ± 0.0033
         : individual accs = ['0.625913', '0.624868', '0.624982', '0.627699', '0.610549', '0.627566', '0.628468', '0.617413', '0.621240', '0.626870', '0.619771', '0.618655', '0.629859', '0.624704', '0.616830', '0.630636', '0.621169', '0.622992', '0.618834', '0.626224']
         : correct/total = [(8908, 14232), (8895, 14235), (8916, 14266), (8924, 14217), (8693, 14238), (9020, 14373), (9016, 14346), (8850, 14334), (8880, 14294), (9010, 14373), (8890, 14344), (8848, 14302), (9041, 14354), (8972, 14362), (8833, 14320), (9078, 14395), (8938, 14389), (8882, 14257), (8819, 14251), (9017, 14399)]
         : compromised: 0.6263, honest: 0.6225
         : sketchguard stats = ['Node 0: acc_rate=0.816', 'Node 1: acc_rate=0.816', 'Node 2: acc_rate=0.816']...
Round 009: test acc mean=0.6224 ± 0.0066 | min=0.6050 max=0.6351
         : test loss mean=0.6483 ± 0.0044
         : individual accs = ['0.619590', '0.622691', '0.621267', '0.619470', '0.622911', '0.635149', '0.627422', '0.616785', '0.619631', '0.614973', '0.615100', '0.621871', '0.627700', '0.624147', '0.604958', '0.632720', '0.620891', '0.626640', '0.625430', '0.629488']
         : correct/total = [(8818, 14232), (8864, 14235), (8863, 14266), (8807, 14217), (8869, 14238), (9129, 14373), (9001, 14346), (8841, 14334), (8857, 14294), (8839, 14373), (8823, 14344), (8894, 14302), (9010, 14354), (8964, 14362), (8663, 14320), (9108, 14395), (8934, 14389), (8934, 14257), (8913, 14251), (9064, 14399)]
         : compromised: 0.6284, honest: 0.6209
         : sketchguard stats = ['Node 0: acc_rate=0.813', 'Node 1: acc_rate=0.813', 'Node 2: acc_rate=0.813']...
Round 010: test acc mean=0.6318 ± 0.0036 | min=0.6255 max=0.6390
         : test loss mean=0.6422 ± 0.0027
         : individual accs = ['0.633221', '0.633579', '0.633114', '0.633819', '0.625579', '0.635428', '0.635717', '0.628785', '0.629075', '0.632436', '0.629392', '0.625507', '0.636687', '0.630274', '0.635475', '0.639041', '0.627563', '0.630217', '0.631254', '0.630738']
         : correct/total = [(9012, 14232), (9019, 14235), (9032, 14266), (9011, 14217), (8907, 14238), (9133, 14373), (9120, 14346), (9013, 14334), (8992, 14294), (9090, 14373), (9028, 14344), (8946, 14302), (9139, 14354), (9052, 14362), (9100, 14320), (9199, 14395), (9030, 14389), (8985, 14257), (8996, 14251), (9082, 14399)]
         : compromised: 0.6332, honest: 0.6315
         : sketchguard stats = ['Node 0: acc_rate=0.811', 'Node 1: acc_rate=0.811', 'Node 2: acc_rate=0.811']...

=== FINAL RESULTS ===
Dataset: sent140, Nodes: 20, Graph: fully, Aggregation: sketchguard
Attack: krum, 20.0% compromised
Final accuracy - Compromised: 0.6332, Honest: 0.6315
Overall test accuracy: mean=0.6318 ± 0.0036

=== Sketchguard SUMMARY ===
Node 0: acceptance=0.811
Node 1: acceptance=0.811
Node 2: acceptance=0.811
Node 3: acceptance=0.811
Node 4: acceptance=0.811
Node 5: acceptance=0.858
Node 6: acceptance=0.811
Node 7: acceptance=0.811
Node 8: acceptance=0.811
Node 9: acceptance=0.811
Node 10: acceptance=0.811
Node 11: acceptance=0.811
Node 12: acceptance=0.858
Node 13: acceptance=0.858
Node 14: acceptance=0.811
Node 15: acceptance=0.811
Node 16: acceptance=0.811
Node 17: acceptance=0.858
Node 18: acceptance=0.811
Node 19: acceptance=0.811

=== PARALLEL EXECUTION TIME (realistic for distributed system) ===
  COMMUNICATION (max across nodes):
    - Sketch transfer: 0.000s (0.0%)
    - Model fetch (accepted): 0.000s (0.0%)
  COMPUTATION (max across nodes):
    - Sketching: 0.620s (94.8%)
    - Filtering: 0.001s (0.2%)
    - Aggregation: 0.032s (5.0%)
  TOTALS:
    - Total computation: 0.654s (100.0%)
    - Total communication: 0.000s (0.0%)
    - Total parallel time: 0.654s

=== PER-NODE AVERAGE TIME ===
  - Sketching: 0.550s
  - Filtering: 0.001s
  - Aggregation: 0.026s
  - Sketch transfer: 0.000s
  - Model fetch: 0.000s
  - Total per node: 0.577s

=== TOTAL COMPUTATIONAL WORK (sum across all nodes) ===
  - Total sketching: 11.009s
  - Total filtering: 0.017s
  - Total aggregation: 0.520s
  - Total sketch transfer: 0.000s
  - Total model fetch: 0.000s
  - Grand total: 11.546s
  - Mean acceptance rate: 0.820

Sketchguard Algorithm Properties:
  - Original dimension: 1,174,986
  - Sketch size: 180
  - Compression ratio: 19.9x
  - Single repetition: No repetitions needed
  - Theoretical complexity: O(d + N×k)
  - Approach: Sketch filtering + state aggregation
