Device: cuda
Seed: 987654321
Loading 1 LEAF Sent140 train files...
LEAF Sent140 train: 254555 users, 908652 samples
Building vocabulary (max_size=10000)...
Vocabulary size: 10000
Loading 1 LEAF Sent140 test files...
LEAF Sent140 test: 254555 users, 286281 samples
Found 254555 train users, 254555 test users, 254555 common users
User sample counts range: 494 (max) to 1 (min)
Distributed ALL 254555 users across 20 clients
Users per client: 12727 (with 15 clients getting +1 user)
Train partition sizes: [44353, 44290, 44657, 44907, 44696, 45843, 45801, 45619, 45069, 45639, 45821, 45311, 45779, 46056, 45625, 45984, 46428, 44737, 45540, 46497]
Test partition sizes: [14232, 14235, 14266, 14217, 14238, 14373, 14346, 14334, 14294, 14373, 14344, 14302, 14354, 14362, 14320, 14395, 14389, 14257, 14251, 14399]
  Client 0: 44353 train samples, 2 unique classes
  Client 1: 44290 train samples, 2 unique classes
  Client 2: 44657 train samples, 2 unique classes
  Client 3: 44907 train samples, 2 unique classes
  Client 4: 44696 train samples, 2 unique classes
  Client 5: 45843 train samples, 2 unique classes
  Client 6: 45801 train samples, 2 unique classes
  Client 7: 45619 train samples, 2 unique classes
  Client 8: 45069 train samples, 2 unique classes
  Client 9: 45639 train samples, 2 unique classes
  Client 10: 45821 train samples, 2 unique classes
  Client 11: 45311 train samples, 2 unique classes
  Client 12: 45779 train samples, 2 unique classes
  Client 13: 46056 train samples, 2 unique classes
  Client 14: 45625 train samples, 2 unique classes
  Client 15: 45984 train samples, 2 unique classes
  Client 16: 46428 train samples, 2 unique classes
  Client 17: 44737 train samples, 2 unique classes
  Client 18: 45540 train samples, 2 unique classes
  Client 19: 46497 train samples, 2 unique classes
Will sample 4500 samples per client per epoch
Graph: fully, nodes: 20, edges: 190
Degree statistics: avg=19.00, min=19, max=19
Attack: Compromised 10/20 nodes: [1, 2, 5, 11, 12, 13, 14, 15, 17, 18]
Attack type: directed_deviation, lambda: 1.0
Model variant: baseline
Model parameters: 1,174,986
Sketchguard Node 0:
  Model dim: 1,174,986 → Sketch size: 180
  Compression ratio: 6527.7x
  Using model parameters for aggregation, sketches for filtering
Sketchguard Node 1:
  Model dim: 1,174,986 → Sketch size: 180
  Compression ratio: 6527.7x
  Using model parameters for aggregation, sketches for filtering
Sketchguard Node 2:
  Model dim: 1,174,986 → Sketch size: 180
  Compression ratio: 6527.7x
  Using model parameters for aggregation, sketches for filtering
Sketchguard Node 3:
  Model dim: 1,174,986 → Sketch size: 180
  Compression ratio: 6527.7x
  Using model parameters for aggregation, sketches for filtering
Sketchguard Node 4:
  Model dim: 1,174,986 → Sketch size: 180
  Compression ratio: 6527.7x
  Using model parameters for aggregation, sketches for filtering
Sketchguard Node 5:
  Model dim: 1,174,986 → Sketch size: 180
  Compression ratio: 6527.7x
  Using model parameters for aggregation, sketches for filtering
Sketchguard Node 6:
  Model dim: 1,174,986 → Sketch size: 180
  Compression ratio: 6527.7x
  Using model parameters for aggregation, sketches for filtering
Sketchguard Node 7:
  Model dim: 1,174,986 → Sketch size: 180
  Compression ratio: 6527.7x
  Using model parameters for aggregation, sketches for filtering
Sketchguard Node 8:
  Model dim: 1,174,986 → Sketch size: 180
  Compression ratio: 6527.7x
  Using model parameters for aggregation, sketches for filtering
Sketchguard Node 9:
  Model dim: 1,174,986 → Sketch size: 180
  Compression ratio: 6527.7x
  Using model parameters for aggregation, sketches for filtering
Sketchguard Node 10:
  Model dim: 1,174,986 → Sketch size: 180
  Compression ratio: 6527.7x
  Using model parameters for aggregation, sketches for filtering
Sketchguard Node 11:
  Model dim: 1,174,986 → Sketch size: 180
  Compression ratio: 6527.7x
  Using model parameters for aggregation, sketches for filtering
Sketchguard Node 12:
  Model dim: 1,174,986 → Sketch size: 180
  Compression ratio: 6527.7x
  Using model parameters for aggregation, sketches for filtering
Sketchguard Node 13:
  Model dim: 1,174,986 → Sketch size: 180
  Compression ratio: 6527.7x
  Using model parameters for aggregation, sketches for filtering
Sketchguard Node 14:
  Model dim: 1,174,986 → Sketch size: 180
  Compression ratio: 6527.7x
  Using model parameters for aggregation, sketches for filtering
Sketchguard Node 15:
  Model dim: 1,174,986 → Sketch size: 180
  Compression ratio: 6527.7x
  Using model parameters for aggregation, sketches for filtering
Sketchguard Node 16:
  Model dim: 1,174,986 → Sketch size: 180
  Compression ratio: 6527.7x
  Using model parameters for aggregation, sketches for filtering
Sketchguard Node 17:
  Model dim: 1,174,986 → Sketch size: 180
  Compression ratio: 6527.7x
  Using model parameters for aggregation, sketches for filtering
Sketchguard Node 18:
  Model dim: 1,174,986 → Sketch size: 180
  Compression ratio: 6527.7x
  Using model parameters for aggregation, sketches for filtering
Sketchguard Node 19:
  Model dim: 1,174,986 → Sketch size: 180
  Compression ratio: 6527.7x
  Using model parameters for aggregation, sketches for filtering
Sketchguard ALGORITHM (Sketch-based Filtering + State Aggregation)
  - Model dimension: 1,174,986 parameters
  - Config: SketchguardConfig(gamma=2, kappa=1, alpha=0.5, min_neighbors=1, sketch_size=180, network_seed=987654321, attack_detection_window=5)
  - Sketch size: 180
  - Compression ratio: 6527.7x
  - Complexity: O(d + N×k) = O(1,174,986 + 20×180)
  - Theoretical speedup vs BALANCE: 19.9x
Initial test acc across nodes: mean=0.4965 ± 0.0152
Round 001: test acc mean=0.4953 ± 0.0106 | min=0.4754 max=0.5121
         : test loss mean=0.7108 ± 0.0121
         : individual accs = ['0.489320', '0.478258', '0.484649', '0.509742', '0.488341', '0.495443', '0.475394', '0.499721', '0.512103', '0.505810', '0.495887', '0.501608', '0.500975', '0.505152', '0.483031', '0.510663', '0.482382', '0.499123', '0.490913', '0.497465']
         : correct/total = [(6964, 14232), (6808, 14235), (6914, 14266), (7247, 14217), (6953, 14238), (7121, 14373), (6820, 14346), (7163, 14334), (7320, 14294), (7270, 14373), (7113, 14344), (7174, 14302), (7191, 14354), (7255, 14362), (6917, 14320), (7351, 14395), (6941, 14389), (7116, 14257), (6996, 14251), (7163, 14399)]
         : compromised: 0.4950, honest: 0.4956
         : sketchguard stats = ['Node 0: acc_rate=1.000', 'Node 1: acc_rate=1.000', 'Node 2: acc_rate=1.000']...
Round 002: test acc mean=0.5391 ± 0.0136 | min=0.5161 max=0.5642
         : test loss mean=0.6884 ± 0.0027
         : individual accs = ['0.537591', '0.516052', '0.544511', '0.527537', '0.564194', '0.519794', '0.551582', '0.548835', '0.530292', '0.549572', '0.540505', '0.562998', '0.520064', '0.535301', '0.530866', '0.541438', '0.549170', '0.520166', '0.545435', '0.546635']
         : correct/total = [(7651, 14232), (7346, 14235), (7768, 14266), (7500, 14217), (8033, 14238), (7471, 14373), (7913, 14346), (7867, 14334), (7580, 14294), (7899, 14373), (7753, 14344), (8052, 14302), (7465, 14354), (7688, 14362), (7602, 14320), (7794, 14395), (7902, 14389), (7416, 14257), (7773, 14251), (7871, 14399)]
         : compromised: 0.5337, honest: 0.5446
         : sketchguard stats = ['Node 0: acc_rate=0.737', 'Node 1: acc_rate=0.763', 'Node 2: acc_rate=0.763']...
Round 003: test acc mean=0.5709 ± 0.0095 | min=0.5560 max=0.5877
         : test loss mean=0.6801 ± 0.0025
         : individual accs = ['0.566821', '0.556516', '0.568344', '0.555954', '0.587723', '0.561609', '0.578210', '0.582880', '0.566042', '0.586725', '0.569018', '0.573976', '0.575798', '0.574572', '0.561662', '0.574783', '0.564667', '0.556919', '0.581643', '0.574762']
         : correct/total = [(8067, 14232), (7922, 14235), (8108, 14266), (7904, 14217), (8368, 14238), (8072, 14373), (8295, 14346), (8355, 14334), (8091, 14294), (8433, 14373), (8162, 14344), (8209, 14302), (8265, 14354), (8252, 14362), (8043, 14320), (8274, 14395), (8125, 14389), (7940, 14257), (8289, 14251), (8276, 14399)]
         : compromised: 0.5686, honest: 0.5733
         : sketchguard stats = ['Node 0: acc_rate=0.649', 'Node 1: acc_rate=0.684', 'Node 2: acc_rate=0.684']...
Round 004: test acc mean=0.5987 ± 0.0044 | min=0.5900 max=0.6074
         : test loss mean=0.6673 ± 0.0022
         : individual accs = ['0.593100', '0.591359', '0.599467', '0.596469', '0.602542', '0.597300', '0.602119', '0.599205', '0.589968', '0.607389', '0.602900', '0.604181', '0.597743', '0.601239', '0.602235', '0.595485', '0.595733', '0.596619', '0.602274', '0.596361']
         : correct/total = [(8441, 14232), (8418, 14235), (8552, 14266), (8480, 14217), (8579, 14238), (8585, 14373), (8638, 14346), (8589, 14334), (8433, 14294), (8730, 14373), (8648, 14344), (8641, 14302), (8580, 14354), (8635, 14362), (8624, 14320), (8572, 14395), (8572, 14389), (8506, 14257), (8583, 14251), (8587, 14399)]
         : compromised: 0.5988, honest: 0.5986
         : sketchguard stats = ['Node 0: acc_rate=0.605', 'Node 1: acc_rate=0.645', 'Node 2: acc_rate=0.645']...
Round 005: test acc mean=0.6074 ± 0.0041 | min=0.5978 max=0.6130
         : test loss mean=0.6585 ± 0.0019
         : individual accs = ['0.604975', '0.607727', '0.609701', '0.610466', '0.607038', '0.604954', '0.610972', '0.610925', '0.598713', '0.612955', '0.608617', '0.611173', '0.608193', '0.606183', '0.612081', '0.597777', '0.603100', '0.611209', '0.604028', '0.606848']
         : correct/total = [(8610, 14232), (8651, 14235), (8698, 14266), (8679, 14217), (8643, 14238), (8695, 14373), (8765, 14346), (8757, 14334), (8558, 14294), (8810, 14373), (8730, 14344), (8741, 14302), (8730, 14354), (8706, 14362), (8765, 14320), (8605, 14395), (8678, 14389), (8714, 14257), (8608, 14251), (8738, 14399)]
         : compromised: 0.6073, honest: 0.6075
         : sketchguard stats = ['Node 0: acc_rate=0.579', 'Node 1: acc_rate=0.621', 'Node 2: acc_rate=0.621']...
Round 006: test acc mean=0.6119 ± 0.0045 | min=0.5990 max=0.6171
         : test loss mean=0.6542 ± 0.0028
         : individual accs = ['0.607926', '0.612294', '0.614818', '0.613350', '0.613429', '0.611285', '0.616827', '0.612878', '0.603820', '0.617129', '0.614961', '0.617116', '0.613418', '0.615165', '0.610405', '0.599027', '0.609215', '0.612471', '0.614694', '0.607612']
         : correct/total = [(8652, 14232), (8716, 14235), (8771, 14266), (8720, 14217), (8734, 14238), (8786, 14373), (8849, 14346), (8785, 14334), (8631, 14294), (8870, 14373), (8821, 14344), (8826, 14302), (8805, 14354), (8835, 14362), (8741, 14320), (8623, 14395), (8766, 14389), (8732, 14257), (8760, 14251), (8749, 14399)]
         : compromised: 0.6121, honest: 0.6117
         : sketchguard stats = ['Node 0: acc_rate=0.561', 'Node 1: acc_rate=0.605', 'Node 2: acc_rate=0.605']...
Round 007: test acc mean=0.6187 ± 0.0035 | min=0.6142 max=0.6278
         : test loss mean=0.6495 ± 0.0020
         : individual accs = ['0.615655', '0.614542', '0.618393', '0.623409', '0.619961', '0.616294', '0.623379', '0.619297', '0.615993', '0.627774', '0.622351', '0.621382', '0.616483', '0.620318', '0.618925', '0.614172', '0.616235', '0.618012', '0.616729', '0.615321']
         : correct/total = [(8762, 14232), (8748, 14235), (8822, 14266), (8863, 14217), (8827, 14238), (8858, 14373), (8943, 14346), (8877, 14334), (8805, 14294), (9023, 14373), (8927, 14344), (8887, 14302), (8849, 14354), (8909, 14362), (8863, 14320), (8841, 14395), (8867, 14389), (8811, 14257), (8789, 14251), (8860, 14399)]
         : compromised: 0.6175, honest: 0.6199
         : sketchguard stats = ['Node 0: acc_rate=0.549', 'Node 1: acc_rate=0.594', 'Node 2: acc_rate=0.594']...
Round 008: test acc mean=0.6232 ± 0.0026 | min=0.6163 max=0.6276
         : test loss mean=0.6459 ± 0.0017
         : individual accs = ['0.616287', '0.624306', '0.623370', '0.627348', '0.621155', '0.621095', '0.625889', '0.627599', '0.622919', '0.626313', '0.625139', '0.622990', '0.622823', '0.620735', '0.624511', '0.621049', '0.621725', '0.622642', '0.624518', '0.622127']
         : correct/total = [(8771, 14232), (8887, 14235), (8893, 14266), (8919, 14217), (8844, 14238), (8927, 14373), (8979, 14346), (8996, 14334), (8904, 14294), (9002, 14373), (8967, 14344), (8910, 14302), (8940, 14354), (8915, 14362), (8943, 14320), (8940, 14395), (8946, 14389), (8877, 14257), (8900, 14251), (8958, 14399)]
         : compromised: 0.6228, honest: 0.6236
         : sketchguard stats = ['Node 0: acc_rate=0.539', 'Node 1: acc_rate=0.586', 'Node 2: acc_rate=0.586']...
Round 009: test acc mean=0.6278 ± 0.0035 | min=0.6207 max=0.6337
         : test loss mean=0.6431 ± 0.0019
         : individual accs = ['0.620714', '0.630418', '0.629258', '0.632131', '0.625369', '0.623600', '0.633208', '0.630320', '0.623968', '0.631253', '0.630856', '0.633688', '0.624565', '0.628534', '0.623464', '0.627718', '0.624713', '0.627692', '0.627535', '0.626780']
         : correct/total = [(8834, 14232), (8974, 14235), (8977, 14266), (8987, 14217), (8904, 14238), (8963, 14373), (9084, 14346), (9035, 14334), (8919, 14294), (9073, 14373), (9049, 14344), (9063, 14302), (8965, 14354), (9027, 14362), (8928, 14320), (9036, 14395), (8989, 14389), (8949, 14257), (8943, 14251), (9025, 14399)]
         : compromised: 0.6276, honest: 0.6279
         : sketchguard stats = ['Node 0: acc_rate=0.532', 'Node 1: acc_rate=0.579', 'Node 2: acc_rate=0.579']...
Round 010: test acc mean=0.6321 ± 0.0025 | min=0.6279 max=0.6391
         : test loss mean=0.6392 ± 0.0019
         : individual accs = ['0.630551', '0.631120', '0.631782', '0.639094', '0.629513', '0.630836', '0.636484', '0.629831', '0.631454', '0.635288', '0.633784', '0.633478', '0.632089', '0.631319', '0.631704', '0.630636', '0.627910', '0.633654', '0.632657', '0.629766']
         : correct/total = [(8974, 14232), (8984, 14235), (9013, 14266), (9086, 14217), (8963, 14238), (9067, 14373), (9131, 14346), (9028, 14334), (9026, 14294), (9131, 14373), (9091, 14344), (9060, 14302), (9073, 14354), (9067, 14362), (9046, 14320), (9078, 14395), (9035, 14389), (9034, 14257), (9016, 14251), (9068, 14399)]
         : compromised: 0.6319, honest: 0.6324
         : sketchguard stats = ['Node 0: acc_rate=0.526', 'Node 1: acc_rate=0.574', 'Node 2: acc_rate=0.574']...

=== FINAL RESULTS ===
Dataset: sent140, Nodes: 20, Graph: fully, Aggregation: sketchguard
Attack: directed_deviation, 50.0% compromised
Final accuracy - Compromised: 0.6319, Honest: 0.6324
Overall test accuracy: mean=0.6321 ± 0.0025

=== Sketchguard SUMMARY ===
Node 0: acceptance=0.526
Node 1: acceptance=0.574
Node 2: acceptance=0.574
Node 3: acceptance=0.526
Node 4: acceptance=0.526
Node 5: acceptance=0.574
Node 6: acceptance=0.526
Node 7: acceptance=0.526
Node 8: acceptance=0.526
Node 9: acceptance=0.526
Node 10: acceptance=0.526
Node 11: acceptance=0.574
Node 12: acceptance=0.574
Node 13: acceptance=0.574
Node 14: acceptance=0.574
Node 15: acceptance=0.574
Node 16: acceptance=0.526
Node 17: acceptance=0.574
Node 18: acceptance=0.574
Node 19: acceptance=0.526

=== PARALLEL EXECUTION TIME (realistic for distributed system) ===
  COMMUNICATION (max across nodes):
    - Sketch transfer: 0.000s (0.0%)
    - Model fetch (accepted): 0.000s (0.0%)
  COMPUTATION (max across nodes):
    - Sketching: 0.499s (95.1%)
    - Filtering: 0.001s (0.2%)
    - Aggregation: 0.024s (4.7%)
  TOTALS:
    - Total computation: 0.524s (100.0%)
    - Total communication: 0.000s (0.0%)
    - Total parallel time: 0.524s

=== PER-NODE AVERAGE TIME ===
  - Sketching: 0.439s
  - Filtering: 0.001s
  - Aggregation: 0.020s
  - Sketch transfer: 0.000s
  - Model fetch: 0.000s
  - Total per node: 0.460s

=== TOTAL COMPUTATIONAL WORK (sum across all nodes) ===
  - Total sketching: 8.777s
  - Total filtering: 0.017s
  - Total aggregation: 0.401s
  - Total sketch transfer: 0.000s
  - Total model fetch: 0.000s
  - Grand total: 9.195s
  - Mean acceptance rate: 0.550

Sketchguard Algorithm Properties:
  - Original dimension: 1,174,986
  - Sketch size: 180
  - Compression ratio: 19.9x
  - Single repetition: No repetitions needed
  - Theoretical complexity: O(d + N×k)
  - Approach: Sketch filtering + state aggregation
