Device: cuda
Seed: 987654321
Loading 1 LEAF Sent140 train files...
LEAF Sent140 train: 254555 users, 908652 samples
Building vocabulary (max_size=10000)...
Vocabulary size: 10000
Loading 1 LEAF Sent140 test files...
LEAF Sent140 test: 254555 users, 286281 samples
Found 254555 train users, 254555 test users, 254555 common users
User sample counts range: 494 (max) to 1 (min)
Distributed ALL 254555 users across 20 clients
Users per client: 12727 (with 15 clients getting +1 user)
Train partition sizes: [44353, 44290, 44657, 44907, 44696, 45843, 45801, 45619, 45069, 45639, 45821, 45311, 45779, 46056, 45625, 45984, 46428, 44737, 45540, 46497]
Test partition sizes: [14232, 14235, 14266, 14217, 14238, 14373, 14346, 14334, 14294, 14373, 14344, 14302, 14354, 14362, 14320, 14395, 14389, 14257, 14251, 14399]
  Client 0: 44353 train samples, 2 unique classes
  Client 1: 44290 train samples, 2 unique classes
  Client 2: 44657 train samples, 2 unique classes
  Client 3: 44907 train samples, 2 unique classes
  Client 4: 44696 train samples, 2 unique classes
  Client 5: 45843 train samples, 2 unique classes
  Client 6: 45801 train samples, 2 unique classes
  Client 7: 45619 train samples, 2 unique classes
  Client 8: 45069 train samples, 2 unique classes
  Client 9: 45639 train samples, 2 unique classes
  Client 10: 45821 train samples, 2 unique classes
  Client 11: 45311 train samples, 2 unique classes
  Client 12: 45779 train samples, 2 unique classes
  Client 13: 46056 train samples, 2 unique classes
  Client 14: 45625 train samples, 2 unique classes
  Client 15: 45984 train samples, 2 unique classes
  Client 16: 46428 train samples, 2 unique classes
  Client 17: 44737 train samples, 2 unique classes
  Client 18: 45540 train samples, 2 unique classes
  Client 19: 46497 train samples, 2 unique classes
Will sample 4500 samples per client per epoch
Graph: fully, nodes: 20, edges: 190
Degree statistics: avg=19.00, min=19, max=19
Attack: Compromised 4/20 nodes: [5, 12, 13, 17]
Attack type: backdoor, lambda: 1.0
Backdoor target label: 1, trigger size: 3
Model variant: baseline
Model parameters: 1,174,986
Initial test acc across nodes: mean=0.4965 ± 0.0152
Backdoor attack: Created poisoned datasets for 4 compromised nodes
Round 001: test acc mean=0.4994 ± 0.0086 | min=0.4748 max=0.5120
         : test loss mean=1.0932 ± 0.2329
         : individual accs = ['0.494730', '0.486407', '0.474835', '0.492790', '0.491642', '0.506018', '0.496096', '0.510604', '0.508605', '0.502748', '0.503277', '0.495455', '0.500070', '0.511976', '0.499791', '0.498020', '0.499270', '0.500736', '0.508456', '0.505799']
         : correct/total = [(7041, 14232), (6924, 14235), (6774, 14266), (7006, 14217), (7000, 14238), (7273, 14373), (7117, 14346), (7319, 14334), (7270, 14294), (7226, 14373), (7219, 14344), (7086, 14302), (7178, 14354), (7353, 14362), (7157, 14320), (7169, 14395), (7184, 14389), (7139, 14257), (7246, 14251), (7283, 14399)]
         : compromised: 0.5047, honest: 0.4980
Round 002: test acc mean=0.4799 ± 0.0038 | min=0.4740 max=0.4890
         : test loss mean=1.0751 ± 0.0079
         : individual accs = ['0.477867', '0.474043', '0.479952', '0.478723', '0.477736', '0.484798', '0.483828', '0.485698', '0.477473', '0.480623', '0.478806', '0.474829', '0.479170', '0.480574', '0.477514', '0.480097', '0.488985', '0.484534', '0.474493', '0.478367']
         : correct/total = [(6801, 14232), (6748, 14235), (6847, 14266), (6806, 14217), (6802, 14238), (6968, 14373), (6941, 14346), (6962, 14334), (6825, 14294), (6908, 14373), (6868, 14344), (6791, 14302), (6878, 14354), (6902, 14362), (6838, 14320), (6911, 14395), (7036, 14389), (6908, 14257), (6762, 14251), (6888, 14399)]
         : compromised: 0.4823, honest: 0.4793
Round 003: test acc mean=0.4993 ± 0.0055 | min=0.4855 max=0.5106
         : test loss mean=0.7569 ± 0.0039
         : individual accs = ['0.504708', '0.505374', '0.507781', '0.501723', '0.496980', '0.498574', '0.498676', '0.497837', '0.510634', '0.500800', '0.493447', '0.501958', '0.495193', '0.485517', '0.498045', '0.495728', '0.495726', '0.493302', '0.502982', '0.500868']
         : correct/total = [(7183, 14232), (7194, 14235), (7244, 14266), (7133, 14217), (7076, 14238), (7166, 14373), (7154, 14346), (7136, 14334), (7299, 14294), (7198, 14373), (7078, 14344), (7179, 14302), (7108, 14354), (6973, 14362), (7132, 14320), (7136, 14395), (7133, 14389), (7033, 14257), (7168, 14251), (7212, 14399)]
         : compromised: 0.4931, honest: 0.5008
Round 004: test acc mean=0.5014 ± 0.0057 | min=0.4890 max=0.5121
         : test loss mean=1.1924 ± 0.0119
         : individual accs = ['0.507237', '0.509378', '0.512057', '0.507421', '0.500211', '0.500731', '0.496863', '0.501674', '0.506856', '0.505740', '0.496026', '0.502657', '0.496586', '0.488999', '0.500628', '0.494825', '0.497741', '0.495336', '0.507614', '0.500104']
         : correct/total = [(7219, 14232), (7251, 14235), (7305, 14266), (7214, 14217), (7122, 14238), (7197, 14373), (7128, 14346), (7191, 14334), (7245, 14294), (7269, 14373), (7115, 14344), (7189, 14302), (7128, 14354), (7023, 14362), (7169, 14320), (7123, 14395), (7162, 14389), (7062, 14257), (7234, 14251), (7201, 14399)]
         : compromised: 0.4954, honest: 0.5029
Round 005: test acc mean=0.5043 ± 0.0055 | min=0.4953 max=0.5144
         : test loss mean=0.7529 ± 0.0039
         : individual accs = ['0.509345', '0.514436', '0.512197', '0.506717', '0.499508', '0.506227', '0.507040', '0.501535', '0.507765', '0.504975', '0.505438', '0.509160', '0.501184', '0.495265', '0.496439', '0.504133', '0.496699', '0.503402', '0.509578', '0.495312']
         : correct/total = [(7249, 14232), (7323, 14235), (7307, 14266), (7204, 14217), (7112, 14238), (7276, 14373), (7274, 14346), (7189, 14334), (7258, 14294), (7258, 14373), (7250, 14344), (7282, 14302), (7194, 14354), (7113, 14362), (7109, 14320), (7257, 14395), (7147, 14389), (7177, 14257), (7262, 14251), (7132, 14399)]
         : compromised: 0.5015, honest: 0.5050
Round 006: test acc mean=0.4966 ± 0.0050 | min=0.4873 max=0.5085
         : test loss mean=0.8072 ± 0.0044
         : individual accs = ['0.491639', '0.495258', '0.493060', '0.498769', '0.494451', '0.497321', '0.505089', '0.494907', '0.492374', '0.493147', '0.508505', '0.496504', '0.487251', '0.495056', '0.496858', '0.503369', '0.500452', '0.497019', '0.490913', '0.500382']
         : correct/total = [(6997, 14232), (7050, 14235), (7034, 14266), (7091, 14217), (7040, 14238), (7148, 14373), (7246, 14346), (7094, 14334), (7038, 14294), (7088, 14373), (7294, 14344), (7101, 14302), (6994, 14354), (7110, 14362), (7115, 14320), (7246, 14395), (7201, 14389), (7086, 14257), (6996, 14251), (7205, 14399)]
         : compromised: 0.4942, honest: 0.4972
Round 007: test acc mean=0.4924 ± 0.0056 | min=0.4842 max=0.5072
         : test loss mean=0.7931 ± 0.0049
         : individual accs = ['0.487634', '0.484159', '0.484929', '0.487726', '0.490589', '0.492173', '0.495190', '0.490163', '0.487547', '0.490990', '0.494841', '0.489372', '0.497144', '0.507241', '0.493715', '0.494964', '0.499965', '0.498702', '0.485580', '0.494826']
         : correct/total = [(6940, 14232), (6892, 14235), (6918, 14266), (6934, 14217), (6985, 14238), (7074, 14373), (7104, 14346), (7026, 14334), (6969, 14294), (7057, 14373), (7098, 14344), (6999, 14302), (7136, 14354), (7285, 14362), (7070, 14320), (7125, 14395), (7194, 14389), (7110, 14257), (6920, 14251), (7125, 14399)]
         : compromised: 0.4988, honest: 0.4908
Round 008: test acc mean=0.5287 ± 0.0048 | min=0.5182 max=0.5379
         : test loss mean=0.7072 ± 0.0023
         : individual accs = ['0.537872', '0.530453', '0.529791', '0.530562', '0.534204', '0.523412', '0.525164', '0.528324', '0.528124', '0.532735', '0.524749', '0.522374', '0.537202', '0.523743', '0.530028', '0.526572', '0.518174', '0.528372', '0.531191', '0.531842']
         : correct/total = [(7655, 14232), (7551, 14235), (7558, 14266), (7543, 14217), (7606, 14238), (7523, 14373), (7534, 14346), (7573, 14334), (7549, 14294), (7657, 14373), (7527, 14344), (7471, 14302), (7711, 14354), (7522, 14362), (7590, 14320), (7580, 14395), (7456, 14389), (7533, 14257), (7570, 14251), (7658, 14399)]
         : compromised: 0.5282, honest: 0.5289
Round 009: test acc mean=0.5434 ± 0.0044 | min=0.5345 max=0.5500
         : test loss mean=0.6856 ± 0.0015
         : individual accs = ['0.549958', '0.545065', '0.549769', '0.546177', '0.542000', '0.548598', '0.541405', '0.544021', '0.544214', '0.538440', '0.545315', '0.545448', '0.542497', '0.535998', '0.549232', '0.542411', '0.535756', '0.534474', '0.543330', '0.544552']
         : correct/total = [(7827, 14232), (7759, 14235), (7843, 14266), (7765, 14217), (7717, 14238), (7885, 14373), (7767, 14346), (7798, 14334), (7779, 14294), (7739, 14373), (7822, 14344), (7801, 14302), (7787, 14354), (7698, 14362), (7865, 14320), (7808, 14395), (7709, 14389), (7620, 14257), (7743, 14251), (7841, 14399)]
         : compromised: 0.5404, honest: 0.5442
Round 010: test acc mean=0.4984 ± 0.0052 | min=0.4888 max=0.5115
         : test loss mean=0.7380 ± 0.0038
         : individual accs = ['0.492833', '0.488795', '0.489976', '0.496729', '0.498806', '0.500035', '0.502788', '0.497558', '0.493284', '0.496834', '0.499512', '0.493917', '0.501672', '0.511489', '0.499860', '0.502119', '0.502189', '0.504454', '0.494281', '0.500313']
         : correct/total = [(7014, 14232), (6958, 14235), (6990, 14266), (7062, 14217), (7102, 14238), (7187, 14373), (7213, 14346), (7132, 14334), (7051, 14294), (7141, 14373), (7165, 14344), (7064, 14302), (7201, 14354), (7346, 14362), (7158, 14320), (7228, 14395), (7226, 14389), (7192, 14257), (7044, 14251), (7204, 14399)]
         : compromised: 0.5044, honest: 0.4969

=== FINAL RESULTS ===
Dataset: sent140, Nodes: 20, Graph: fully, Aggregation: d-fedavg
Attack: backdoor, 20.0% compromised
Final accuracy - Compromised: 0.5044, Honest: 0.4969
Overall test accuracy: mean=0.4984 ± 0.0052

=== BACKDOOR ATTACK SUCCESS RATE (ASR) ===
Target label: 1
Trigger size: 3x3
Overall ASR: 0.9990 ± 0.0003
Honest nodes ASR: 0.9990 ± 0.0003
Compromised nodes ASR: 0.9987 ± 0.0003
Note: Higher ASR indicates more successful backdoor attack
