Device: cuda
Seed: 987654321
Loading 1 LEAF Sent140 train files...
LEAF Sent140 train: 254555 users, 908652 samples
Building vocabulary (max_size=10000)...
Vocabulary size: 10000
Loading 1 LEAF Sent140 test files...
LEAF Sent140 test: 254555 users, 286281 samples
Found 254555 train users, 254555 test users, 254555 common users
User sample counts range: 494 (max) to 1 (min)
Distributed ALL 254555 users across 20 clients
Users per client: 12727 (with 15 clients getting +1 user)
Train partition sizes: [44353, 44290, 44657, 44907, 44696, 45843, 45801, 45619, 45069, 45639, 45821, 45311, 45779, 46056, 45625, 45984, 46428, 44737, 45540, 46497]
Test partition sizes: [14232, 14235, 14266, 14217, 14238, 14373, 14346, 14334, 14294, 14373, 14344, 14302, 14354, 14362, 14320, 14395, 14389, 14257, 14251, 14399]
  Client 0: 44353 train samples, 2 unique classes
  Client 1: 44290 train samples, 2 unique classes
  Client 2: 44657 train samples, 2 unique classes
  Client 3: 44907 train samples, 2 unique classes
  Client 4: 44696 train samples, 2 unique classes
  Client 5: 45843 train samples, 2 unique classes
  Client 6: 45801 train samples, 2 unique classes
  Client 7: 45619 train samples, 2 unique classes
  Client 8: 45069 train samples, 2 unique classes
  Client 9: 45639 train samples, 2 unique classes
  Client 10: 45821 train samples, 2 unique classes
  Client 11: 45311 train samples, 2 unique classes
  Client 12: 45779 train samples, 2 unique classes
  Client 13: 46056 train samples, 2 unique classes
  Client 14: 45625 train samples, 2 unique classes
  Client 15: 45984 train samples, 2 unique classes
  Client 16: 46428 train samples, 2 unique classes
  Client 17: 44737 train samples, 2 unique classes
  Client 18: 45540 train samples, 2 unique classes
  Client 19: 46497 train samples, 2 unique classes
Will sample 4500 samples per client per epoch
Graph: fully, nodes: 20, edges: 190
Degree statistics: avg=19.00, min=19, max=19
Attack: Compromised 2/20 nodes: [5, 13]
Attack type: directed_deviation, lambda: 1.0
Model variant: baseline
Model parameters: 1,174,986
Initial test acc across nodes: mean=0.4965 ± 0.0152
Round 001: test acc mean=0.5035 ± 0.0108 | min=0.4775 max=0.5253
         : test loss mean=0.7216 ± 0.0304
         : individual accs = ['0.491287', '0.513804', '0.495794', '0.492228', '0.510957', '0.525290', '0.509131', '0.504814', '0.506017', '0.517498', '0.507250', '0.503007', '0.499512', '0.491854', '0.503771', '0.518513', '0.500243', '0.496247', '0.504947', '0.477533']
         : correct/total = [(6992, 14232), (7314, 14235), (7073, 14266), (6998, 14217), (7275, 14238), (7550, 14373), (7304, 14346), (7236, 14334), (7233, 14294), (7438, 14373), (7276, 14344), (7194, 14302), (7170, 14354), (7064, 14362), (7214, 14320), (7464, 14395), (7198, 14389), (7075, 14257), (7196, 14251), (6876, 14399)]
         : compromised: 0.5086, honest: 0.5029
Round 002: test acc mean=0.4956 ± 0.0042 | min=0.4876 max=0.5010
         : test loss mean=0.7009 ± 0.0010
         : individual accs = ['0.489390', '0.489849', '0.490257', '0.492157', '0.497120', '0.495373', '0.494981', '0.500907', '0.487617', '0.499548', '0.497281', '0.493218', '0.500836', '0.501044', '0.492877', '0.498645', '0.499687', '0.499264', '0.493579', '0.498090']
         : correct/total = [(6965, 14232), (6973, 14235), (6994, 14266), (6997, 14217), (7078, 14238), (7120, 14373), (7101, 14346), (7180, 14334), (6970, 14294), (7180, 14373), (7133, 14344), (7054, 14302), (7189, 14354), (7196, 14362), (7058, 14320), (7178, 14395), (7190, 14389), (7118, 14257), (7034, 14251), (7172, 14399)]
         : compromised: 0.4982, honest: 0.4953
Round 003: test acc mean=0.5051 ± 0.0056 | min=0.4914 max=0.5139
         : test loss mean=0.6931 ± 0.0002
         : individual accs = ['0.510891', '0.513734', '0.513949', '0.507772', '0.505900', '0.506157', '0.502440', '0.504814', '0.511543', '0.506992', '0.500976', '0.507971', '0.500488', '0.491436', '0.504190', '0.501633', '0.500243', '0.496949', '0.511262', '0.503646']
         : correct/total = [(7271, 14232), (7313, 14235), (7332, 14266), (7219, 14217), (7203, 14238), (7275, 14373), (7208, 14346), (7236, 14334), (7312, 14294), (7287, 14373), (7186, 14344), (7265, 14302), (7184, 14354), (7058, 14362), (7220, 14320), (7221, 14395), (7198, 14389), (7085, 14257), (7286, 14251), (7252, 14399)]
         : compromised: 0.4988, honest: 0.5059
Round 004: test acc mean=0.5798 ± 0.0039 | min=0.5709 max=0.5871
         : test loss mean=0.6753 ± 0.0015
         : individual accs = ['0.579680', '0.581876', '0.579770', '0.573117', '0.582385', '0.577472', '0.583368', '0.579950', '0.574927', '0.578167', '0.580800', '0.575304', '0.587084', '0.584946', '0.580237', '0.580896', '0.570853', '0.583363', '0.579538', '0.581707']
         : correct/total = [(8250, 14232), (8283, 14235), (8271, 14266), (8148, 14217), (8292, 14238), (8300, 14373), (8369, 14346), (8313, 14334), (8218, 14294), (8310, 14373), (8331, 14344), (8228, 14302), (8427, 14354), (8401, 14362), (8309, 14320), (8362, 14395), (8214, 14389), (8317, 14257), (8259, 14251), (8376, 14399)]
         : compromised: 0.5812, honest: 0.5796
Round 005: test acc mean=0.4949 ± 0.0056 | min=0.4861 max=0.5086
         : test loss mean=0.6936 ± 0.0002
         : individual accs = ['0.489109', '0.486266', '0.486051', '0.492228', '0.494100', '0.493843', '0.497560', '0.495186', '0.488457', '0.493008', '0.499024', '0.492029', '0.499512', '0.508564', '0.495810', '0.498367', '0.499757', '0.503051', '0.488738', '0.496354']
         : correct/total = [(6961, 14232), (6922, 14235), (6934, 14266), (6998, 14217), (7035, 14238), (7098, 14373), (7138, 14346), (7098, 14334), (6982, 14294), (7086, 14373), (7158, 14344), (7037, 14302), (7170, 14354), (7304, 14362), (7100, 14320), (7174, 14395), (7191, 14389), (7172, 14257), (6965, 14251), (7147, 14399)]
         : compromised: 0.5012, honest: 0.4941
Round 006: test acc mean=0.5965 ± 0.0037 | min=0.5870 max=0.6020
         : test loss mean=0.6655 ± 0.0019
         : individual accs = ['0.597948', '0.598314', '0.596663', '0.589154', '0.597626', '0.596257', '0.599331', '0.595019', '0.596404', '0.593961', '0.597114', '0.592225', '0.601992', '0.600891', '0.600349', '0.594095', '0.587046', '0.596830', '0.599888', '0.598792']
         : correct/total = [(8510, 14232), (8517, 14235), (8512, 14266), (8376, 14217), (8509, 14238), (8570, 14373), (8598, 14346), (8529, 14334), (8525, 14294), (8537, 14373), (8565, 14344), (8470, 14302), (8641, 14354), (8630, 14362), (8597, 14320), (8552, 14395), (8447, 14389), (8509, 14257), (8549, 14251), (8622, 14399)]
         : compromised: 0.5986, honest: 0.5963
Round 007: test acc mean=0.4949 ± 0.0056 | min=0.4861 max=0.5086
         : test loss mean=0.6939 ± 0.0004
         : individual accs = ['0.489109', '0.486266', '0.486051', '0.492228', '0.494100', '0.493843', '0.497560', '0.495186', '0.488457', '0.493008', '0.499024', '0.492029', '0.499512', '0.508564', '0.495810', '0.498367', '0.499757', '0.503051', '0.488738', '0.496354']
         : correct/total = [(6961, 14232), (6922, 14235), (6934, 14266), (6998, 14217), (7035, 14238), (7098, 14373), (7138, 14346), (7098, 14334), (6982, 14294), (7086, 14373), (7158, 14344), (7037, 14302), (7170, 14354), (7304, 14362), (7100, 14320), (7174, 14395), (7191, 14389), (7172, 14257), (6965, 14251), (7147, 14399)]
         : compromised: 0.5012, honest: 0.4941
Round 008: test acc mean=0.6050 ± 0.0038 | min=0.5950 max=0.6100
         : test loss mean=0.6595 ± 0.0022
         : individual accs = ['0.606169', '0.609694', '0.606827', '0.600267', '0.606616', '0.605649', '0.607486', '0.600740', '0.605009', '0.602727', '0.603318', '0.599986', '0.609865', '0.605626', '0.609008', '0.602501', '0.595038', '0.605176', '0.607396', '0.610042']
         : correct/total = [(8627, 14232), (8679, 14235), (8657, 14266), (8534, 14217), (8637, 14238), (8705, 14373), (8715, 14346), (8611, 14334), (8648, 14294), (8663, 14373), (8654, 14344), (8581, 14302), (8754, 14354), (8698, 14362), (8721, 14320), (8673, 14395), (8562, 14389), (8628, 14257), (8656, 14251), (8784, 14399)]
         : compromised: 0.6056, honest: 0.6049
Round 009: test acc mean=0.4949 ± 0.0056 | min=0.4861 max=0.5086
         : test loss mean=0.6940 ± 0.0004
         : individual accs = ['0.489109', '0.486266', '0.486051', '0.492228', '0.494100', '0.493843', '0.497560', '0.495186', '0.488457', '0.493008', '0.499024', '0.492029', '0.499512', '0.508564', '0.495810', '0.498367', '0.499757', '0.503051', '0.488738', '0.496354']
         : correct/total = [(6961, 14232), (6922, 14235), (6934, 14266), (6998, 14217), (7035, 14238), (7098, 14373), (7138, 14346), (7098, 14334), (6982, 14294), (7086, 14373), (7158, 14344), (7037, 14302), (7170, 14354), (7304, 14362), (7100, 14320), (7174, 14395), (7191, 14389), (7172, 14257), (6965, 14251), (7147, 14399)]
         : compromised: 0.5012, honest: 0.4941
Round 010: test acc mean=0.6108 ± 0.0037 | min=0.5998 max=0.6152
         : test loss mean=0.6556 ± 0.0023
         : individual accs = ['0.610877', '0.614261', '0.611524', '0.605754', '0.613991', '0.612050', '0.613899', '0.606042', '0.612215', '0.611424', '0.610151', '0.605719', '0.615229', '0.611405', '0.612500', '0.609100', '0.599833', '0.610998', '0.614624', '0.613515']
         : correct/total = [(8694, 14232), (8744, 14235), (8724, 14266), (8612, 14217), (8742, 14238), (8797, 14373), (8807, 14346), (8687, 14334), (8751, 14294), (8788, 14373), (8752, 14344), (8663, 14302), (8831, 14354), (8781, 14362), (8771, 14320), (8768, 14395), (8631, 14389), (8711, 14257), (8759, 14251), (8834, 14399)]
         : compromised: 0.6117, honest: 0.6106

=== FINAL RESULTS ===
Dataset: sent140, Nodes: 20, Graph: fully, Aggregation: d-fedavg
Attack: directed_deviation, 10.0% compromised
Final accuracy - Compromised: 0.6117, Honest: 0.6106
Overall test accuracy: mean=0.6108 ± 0.0037
