Device: cuda
Seed: 987654321
Loading 1 LEAF Sent140 train files...
LEAF Sent140 train: 254555 users, 908652 samples
Building vocabulary (max_size=10000)...
Vocabulary size: 10000
Loading 1 LEAF Sent140 test files...
LEAF Sent140 test: 254555 users, 286281 samples
Found 254555 train users, 254555 test users, 254555 common users
User sample counts range: 494 (max) to 1 (min)
Distributed ALL 254555 users across 20 clients
Users per client: 12727 (with 15 clients getting +1 user)
Train partition sizes: [44353, 44290, 44657, 44907, 44696, 45843, 45801, 45619, 45069, 45639, 45821, 45311, 45779, 46056, 45625, 45984, 46428, 44737, 45540, 46497]
Test partition sizes: [14232, 14235, 14266, 14217, 14238, 14373, 14346, 14334, 14294, 14373, 14344, 14302, 14354, 14362, 14320, 14395, 14389, 14257, 14251, 14399]
  Client 0: 44353 train samples, 2 unique classes
  Client 1: 44290 train samples, 2 unique classes
  Client 2: 44657 train samples, 2 unique classes
  Client 3: 44907 train samples, 2 unique classes
  Client 4: 44696 train samples, 2 unique classes
  Client 5: 45843 train samples, 2 unique classes
  Client 6: 45801 train samples, 2 unique classes
  Client 7: 45619 train samples, 2 unique classes
  Client 8: 45069 train samples, 2 unique classes
  Client 9: 45639 train samples, 2 unique classes
  Client 10: 45821 train samples, 2 unique classes
  Client 11: 45311 train samples, 2 unique classes
  Client 12: 45779 train samples, 2 unique classes
  Client 13: 46056 train samples, 2 unique classes
  Client 14: 45625 train samples, 2 unique classes
  Client 15: 45984 train samples, 2 unique classes
  Client 16: 46428 train samples, 2 unique classes
  Client 17: 44737 train samples, 2 unique classes
  Client 18: 45540 train samples, 2 unique classes
  Client 19: 46497 train samples, 2 unique classes
Will sample 4500 samples per client per epoch
Graph: erdos, nodes: 20, edges: 48
Degree statistics: avg=4.80, min=2, max=7
Attack: Compromised 16/20 nodes: [1, 2, 3, 5, 6, 8, 9, 10, 11, 12, 13, 14, 15, 17, 18, 19]
Attack type: backdoor, lambda: 1.0
Backdoor target label: 1, trigger size: 3
Model variant: baseline
Model parameters: 1,174,986
BALANCE algorithm:
Balance Config: BALANCEConfig(gamma=2, kappa=1, alpha=0.5, min_neighbors=1)
  - Model dimension: 1,174,986 parameters
  - Complexity: O(N×d) = O(20×1,174,986)
Initial test acc across nodes: mean=0.4953 ± 0.0174
Backdoor attack: Created poisoned datasets for 16 compromised nodes
Round 001: test acc mean=0.5018 ± 0.0083 | min=0.4865 max=0.5189
         : test loss mean=43.7745 ± 27.3326
         : individual accs = ['0.506956', '0.492027', '0.494392', '0.486530', '0.509552', '0.496695', '0.494772', '0.501465', '0.517140', '0.506297', '0.509830', '0.499301', '0.497074', '0.508425', '0.518925', '0.499826', '0.491765', '0.501017', '0.498140', '0.505243']
         : correct/total = [(7215, 14232), (7004, 14235), (7053, 14266), (6917, 14217), (7255, 14238), (7139, 14373), (7098, 14346), (7188, 14334), (7392, 14294), (7277, 14373), (7313, 14344), (7141, 14302), (7135, 14354), (7302, 14362), (7431, 14320), (7195, 14395), (7076, 14389), (7143, 14257), (7099, 14251), (7275, 14399)]
         : compromised: 0.5016, honest: 0.5024
Round 002: test acc mean=0.5024 ± 0.0073 | min=0.4925 max=0.5170
         : test loss mean=1138.6709 ± 627.1756
         : individual accs = ['0.492622', '0.517035', '0.513038', '0.515088', '0.494522', '0.504209', '0.500279', '0.492814', '0.498461', '0.504835', '0.502510', '0.506223', '0.496795', '0.492828', '0.507472', '0.502675', '0.492460', '0.503823', '0.508736', '0.501979']
         : correct/total = [(7011, 14232), (7360, 14235), (7319, 14266), (7323, 14217), (7041, 14238), (7247, 14373), (7177, 14346), (7064, 14334), (7125, 14294), (7256, 14373), (7208, 14344), (7240, 14302), (7131, 14354), (7078, 14362), (7267, 14320), (7236, 14395), (7086, 14389), (7183, 14257), (7250, 14251), (7228, 14399)]
         : compromised: 0.5047, honest: 0.4931
Round 003: test acc mean=0.5010 ± 0.0070 | min=0.4839 max=0.5123
         : test loss mean=89684.1780 ± 148499.5248
         : individual accs = ['0.507378', '0.483948', '0.487312', '0.497433', '0.505478', '0.495930', '0.505019', '0.507255', '0.498461', '0.498156', '0.503834', '0.494336', '0.503483', '0.506824', '0.496997', '0.503300', '0.507471', '0.498211', '0.506280', '0.512327']
         : correct/total = [(7221, 14232), (6889, 14235), (6952, 14266), (7072, 14217), (7197, 14238), (7128, 14373), (7245, 14346), (7271, 14334), (7125, 14294), (7160, 14373), (7227, 14344), (7070, 14302), (7227, 14354), (7279, 14362), (7117, 14320), (7245, 14395), (7302, 14389), (7103, 14257), (7215, 14251), (7377, 14399)]
         : compromised: 0.4995, honest: 0.5069
Round 004: test acc mean=0.5004 ± 0.0060 | min=0.4894 max=0.5151
         : test loss mean=9036723.3659 ± 5317138.0304
         : individual accs = ['0.494168', '0.505163', '0.503505', '0.515088', '0.492344', '0.494051', '0.489405', '0.497140', '0.500979', '0.505114', '0.502370', '0.506363', '0.505016', '0.493316', '0.503631', '0.501077', '0.493919', '0.499474', '0.504105', '0.501840']
         : correct/total = [(7033, 14232), (7191, 14235), (7183, 14266), (7323, 14217), (7010, 14238), (7101, 14373), (7021, 14346), (7126, 14334), (7161, 14294), (7260, 14373), (7206, 14344), (7242, 14302), (7249, 14354), (7085, 14362), (7212, 14320), (7213, 14395), (7107, 14389), (7121, 14257), (7184, 14251), (7226, 14399)]
         : compromised: 0.5019, honest: 0.4944
Round 005: test acc mean=0.4974 ± 0.0067 | min=0.4832 max=0.5076
         : test loss mean=390586530.6335 ± 289864034.0792
         : individual accs = ['0.500492', '0.483246', '0.487102', '0.484912', '0.505338', '0.497043', '0.500070', '0.507395', '0.498811', '0.495512', '0.498327', '0.493777', '0.502020', '0.506824', '0.494972', '0.498298', '0.507610', '0.494564', '0.493720', '0.498021']
         : correct/total = [(7123, 14232), (6879, 14235), (6949, 14266), (6894, 14217), (7195, 14238), (7144, 14373), (7174, 14346), (7273, 14334), (7130, 14294), (7122, 14373), (7148, 14344), (7062, 14302), (7206, 14354), (7279, 14362), (7088, 14320), (7173, 14395), (7304, 14389), (7051, 14257), (7036, 14251), (7171, 14399)]
         : compromised: 0.4955, honest: 0.5052
Round 006: test acc mean=0.5038 ± 0.0065 | min=0.4927 max=0.5170
         : test loss mean=47295025629.3463 ± 27274520337.6030
         : individual accs = ['0.498524', '0.517035', '0.513038', '0.515088', '0.508007', '0.504070', '0.500209', '0.492814', '0.501329', '0.504766', '0.501603', '0.507062', '0.505922', '0.492968', '0.507332', '0.502188', '0.492668', '0.504454', '0.504386', '0.501910']
         : correct/total = [(7095, 14232), (7360, 14235), (7319, 14266), (7323, 14217), (7233, 14238), (7245, 14373), (7176, 14346), (7064, 14334), (7166, 14294), (7255, 14373), (7195, 14344), (7252, 14302), (7262, 14354), (7080, 14362), (7265, 14320), (7229, 14395), (7089, 14389), (7192, 14257), (7188, 14251), (7227, 14399)]
         : compromised: 0.5052, honest: 0.4980
Round 007: test acc mean=0.4974 ± 0.0083 | min=0.4806 max=0.5106
         : test loss mean=2662987459199.9624 ± 1787099663282.5701
         : individual accs = ['0.507378', '0.483105', '0.480583', '0.484912', '0.505478', '0.494678', '0.499791', '0.507325', '0.497901', '0.496139', '0.498536', '0.493008', '0.510589', '0.506684', '0.492388', '0.498576', '0.507471', '0.493582', '0.490983', '0.498021']
         : correct/total = [(7221, 14232), (6877, 14235), (6856, 14266), (6894, 14217), (7197, 14238), (7110, 14373), (7170, 14346), (7272, 14334), (7117, 14294), (7131, 14373), (7151, 14344), (7051, 14302), (7329, 14354), (7277, 14362), (7051, 14320), (7177, 14395), (7302, 14389), (7037, 14257), (6997, 14251), (7171, 14399)]
         : compromised: 0.4950, honest: 0.5069
Round 008: test acc mean=0.5030 ± 0.0071 | min=0.4920 max=0.5170
         : test loss mean=334624925983491.3125 ± 190167347173116.2812
         : individual accs = ['0.492341', '0.516965', '0.513038', '0.515369', '0.498595', '0.504140', '0.500209', '0.496861', '0.501819', '0.504627', '0.501603', '0.513215', '0.497353', '0.493037', '0.507332', '0.502188', '0.492043', '0.504945', '0.504386', '0.500590']
         : correct/total = [(7007, 14232), (7359, 14235), (7319, 14266), (7327, 14217), (7099, 14238), (7246, 14373), (7176, 14346), (7122, 14334), (7173, 14294), (7253, 14373), (7195, 14344), (7340, 14302), (7139, 14354), (7081, 14362), (7265, 14320), (7229, 14395), (7080, 14389), (7199, 14257), (7188, 14251), (7208, 14399)]
         : compromised: 0.5051, honest: 0.4950
Round 009: test acc mean=0.4963 ± 0.0069 | min=0.4826 max=0.5070
         : test loss mean=20165364496853508.0000 ± 13127459479074700.0000
         : individual accs = ['0.498314', '0.482613', '0.486121', '0.485405', '0.504776', '0.495721', '0.499930', '0.507046', '0.493354', '0.494956', '0.498327', '0.491679', '0.506688', '0.506824', '0.490433', '0.495936', '0.501494', '0.493302', '0.496106', '0.497465']
         : correct/total = [(7092, 14232), (6870, 14235), (6935, 14266), (6901, 14217), (7187, 14238), (7125, 14373), (7172, 14346), (7268, 14334), (7052, 14294), (7114, 14373), (7148, 14344), (7032, 14302), (7273, 14354), (7279, 14362), (7023, 14320), (7139, 14395), (7216, 14389), (7033, 14257), (7070, 14251), (7163, 14399)]
         : compromised: 0.4947, honest: 0.5029
Round 010: test acc mean=0.5025 ± 0.0073 | min=0.4909 max=0.5169
         : test loss mean=2507151361721486336.0000 ± 1622876565729008384.0000
         : individual accs = ['0.490866', '0.516895', '0.513038', '0.514947', '0.494662', '0.504140', '0.500209', '0.494907', '0.501539', '0.504835', '0.501603', '0.508740', '0.494148', '0.494082', '0.507472', '0.502258', '0.492460', '0.504875', '0.504105', '0.503577']
         : correct/total = [(6986, 14232), (7358, 14235), (7319, 14266), (7321, 14217), (7043, 14238), (7246, 14373), (7176, 14346), (7094, 14334), (7169, 14294), (7256, 14373), (7195, 14344), (7276, 14302), (7093, 14354), (7096, 14362), (7267, 14320), (7230, 14395), (7086, 14389), (7198, 14257), (7184, 14251), (7251, 14399)]
         : compromised: 0.5048, honest: 0.4932

=== FINAL RESULTS ===
Dataset: sent140, Nodes: 20, Graph: erdos, Aggregation: balance
Attack: backdoor, 80.0% compromised
Final accuracy - Compromised: 0.5048, Honest: 0.4932
Overall test accuracy: mean=0.5025 ± 0.0073

=== BACKDOOR ATTACK SUCCESS RATE (ASR) ===
Target label: 1
Trigger size: 3x3
Overall ASR: 0.1786 ± 0.3109
Honest nodes ASR: 0.5491 ± 0.4498
Compromised nodes ASR: 0.0860 ± 0.1655
Note: Higher ASR indicates more successful backdoor attack

=== BALANCE SUMMARY ===
Node 0: acceptance=0.700
Node 1: acceptance=0.600
Node 2: acceptance=0.600
Node 3: acceptance=0.500
Node 4: acceptance=0.700
Node 5: acceptance=0.600
Node 6: acceptance=0.600
Node 7: acceptance=0.800
Node 8: acceptance=0.600
Node 9: acceptance=0.600
Node 10: acceptance=0.600
Node 11: acceptance=0.500
Node 12: acceptance=0.600
Node 13: acceptance=0.500
Node 14: acceptance=0.600
Node 15: acceptance=0.600
Node 16: acceptance=0.900
Node 17: acceptance=0.600
Node 18: acceptance=0.600
Node 19: acceptance=0.500

=== PARALLEL EXECUTION TIME (realistic for distributed system) ===
  COMMUNICATION (max across nodes):
    - Full model transfer: 0.000s (0.0%)
  COMPUTATION (max across nodes):
    - Filtering: 0.030s (70.9%)
    - Aggregation: 0.012s (29.1%)
  TOTALS:
    - Total computation: 0.042s (100.0%)
    - Total communication: 0.000s (0.0%)
    - Total parallel time: 0.042s

=== PER-NODE AVERAGE TIME ===
  - Filtering: 0.022s
  - Aggregation: 0.006s
  - Model transfer: 0.000s
  - Total per node: 0.028s

=== TOTAL COMPUTATIONAL WORK (sum across all nodes) ===
  - Total filtering: 0.432s
  - Total aggregation: 0.118s
  - Total model transfer: 0.000s
  - Grand total: 0.550s
  - Mean acceptance rate: 0.615

BALANCE Algorithm Properties:
  - Model dimension: 1,174,986
  - No compression: Full parameter comparison
  - Theoretical complexity: O(deg(i)×d)
  - Approach: Full parameter filtering + averaging
