Device: cuda
Seed: 987654321
Loading 1 LEAF Sent140 train files...
LEAF Sent140 train: 254555 users, 908652 samples
Building vocabulary (max_size=10000)...
Vocabulary size: 10000
Loading 1 LEAF Sent140 test files...
LEAF Sent140 test: 254555 users, 286281 samples
Found 254555 train users, 254555 test users, 254555 common users
User sample counts range: 494 (max) to 1 (min)
Distributed ALL 254555 users across 20 clients
Users per client: 12727 (with 15 clients getting +1 user)
Train partition sizes: [44353, 44290, 44657, 44907, 44696, 45843, 45801, 45619, 45069, 45639, 45821, 45311, 45779, 46056, 45625, 45984, 46428, 44737, 45540, 46497]
Test partition sizes: [14232, 14235, 14266, 14217, 14238, 14373, 14346, 14334, 14294, 14373, 14344, 14302, 14354, 14362, 14320, 14395, 14389, 14257, 14251, 14399]
  Client 0: 44353 train samples, 2 unique classes
  Client 1: 44290 train samples, 2 unique classes
  Client 2: 44657 train samples, 2 unique classes
  Client 3: 44907 train samples, 2 unique classes
  Client 4: 44696 train samples, 2 unique classes
  Client 5: 45843 train samples, 2 unique classes
  Client 6: 45801 train samples, 2 unique classes
  Client 7: 45619 train samples, 2 unique classes
  Client 8: 45069 train samples, 2 unique classes
  Client 9: 45639 train samples, 2 unique classes
  Client 10: 45821 train samples, 2 unique classes
  Client 11: 45311 train samples, 2 unique classes
  Client 12: 45779 train samples, 2 unique classes
  Client 13: 46056 train samples, 2 unique classes
  Client 14: 45625 train samples, 2 unique classes
  Client 15: 45984 train samples, 2 unique classes
  Client 16: 46428 train samples, 2 unique classes
  Client 17: 44737 train samples, 2 unique classes
  Client 18: 45540 train samples, 2 unique classes
  Client 19: 46497 train samples, 2 unique classes
Will sample 4500 samples per client per epoch
Graph: fully, nodes: 20, edges: 190
Degree statistics: avg=19.00, min=19, max=19
Attack: Compromised 14/20 nodes: [1, 2, 3, 5, 6, 8, 11, 12, 13, 14, 15, 17, 18, 19]
Attack type: directed_deviation, lambda: 1.0
Model variant: baseline
Model parameters: 1,174,986
BALANCE algorithm:
Balance Config: BALANCEConfig(gamma=2, kappa=1, alpha=0.5, min_neighbors=1)
  - Model dimension: 1,174,986 parameters
  - Complexity: O(N×d) = O(20×1,174,986)
Initial test acc across nodes: mean=0.4965 ± 0.0152
Round 001: test acc mean=0.5031 ± 0.0080 | min=0.4807 max=0.5155
         : test loss mean=2.8746 ± 1.0031
         : individual accs = ['0.504146', '0.513664', '0.508412', '0.494900', '0.505478', '0.508245', '0.494354', '0.499233', '0.515461', '0.506505', '0.514431', '0.502657', '0.491640', '0.480713', '0.504818', '0.502049', '0.504691', '0.500807', '0.505859', '0.503229']
         : correct/total = [(7175, 14232), (7312, 14235), (7253, 14266), (7036, 14217), (7197, 14238), (7305, 14373), (7092, 14346), (7156, 14334), (7368, 14294), (7280, 14373), (7379, 14344), (7189, 14302), (7057, 14354), (6904, 14362), (7229, 14320), (7227, 14395), (7262, 14389), (7140, 14257), (7209, 14251), (7246, 14399)]
         : compromised: 0.5019, honest: 0.5057
Round 002: test acc mean=0.5044 ± 0.0104 | min=0.4872 max=0.5260
         : test loss mean=0.7953 ± 0.0686
         : individual accs = ['0.490233', '0.510783', '0.504346', '0.495534', '0.512432', '0.506088', '0.508295', '0.503139', '0.520218', '0.509567', '0.526004', '0.497133', '0.488644', '0.494569', '0.500209', '0.503369', '0.521718', '0.501438', '0.507192', '0.487187']
         : correct/total = [(6977, 14232), (7271, 14235), (7195, 14266), (7045, 14217), (7296, 14238), (7274, 14373), (7292, 14346), (7212, 14334), (7436, 14294), (7324, 14373), (7545, 14344), (7110, 14302), (7014, 14354), (7103, 14362), (7163, 14320), (7246, 14395), (7507, 14389), (7149, 14257), (7228, 14251), (7015, 14399)]
         : compromised: 0.5018, honest: 0.5105
Round 003: test acc mean=0.5115 ± 0.0135 | min=0.4905 max=0.5459
         : test loss mean=0.7284 ± 0.0463
         : individual accs = ['0.513702', '0.513664', '0.519487', '0.505311', '0.515803', '0.504835', '0.534504', '0.490512', '0.499160', '0.510401', '0.545943', '0.503776', '0.525359', '0.523395', '0.496299', '0.501424', '0.501494', '0.516238', '0.515122', '0.493993']
         : correct/total = [(7311, 14232), (7312, 14235), (7411, 14266), (7184, 14217), (7344, 14238), (7256, 14373), (7668, 14346), (7031, 14334), (7135, 14294), (7336, 14373), (7831, 14344), (7205, 14302), (7541, 14354), (7517, 14362), (7107, 14320), (7218, 14395), (7216, 14389), (7360, 14257), (7341, 14251), (7113, 14399)]
         : compromised: 0.5109, honest: 0.5130
Round 004: test acc mean=0.5307 ± 0.0142 | min=0.5098 max=0.5596
         : test loss mean=0.7007 ± 0.0171
         : individual accs = ['0.545672', '0.512610', '0.522010', '0.539143', '0.541649', '0.520907', '0.521121', '0.528743', '0.548342', '0.537049', '0.559607', '0.515313', '0.522920', '0.552430', '0.542598', '0.536992', '0.520467', '0.519254', '0.516595', '0.509827']
         : correct/total = [(7766, 14232), (7297, 14235), (7447, 14266), (7665, 14217), (7712, 14238), (7487, 14373), (7476, 14346), (7579, 14334), (7838, 14294), (7719, 14373), (8027, 14344), (7370, 14302), (7506, 14354), (7934, 14362), (7770, 14320), (7730, 14395), (7489, 14389), (7403, 14257), (7362, 14251), (7341, 14399)]
         : compromised: 0.5271, honest: 0.5389
Round 005: test acc mean=0.5705 ± 0.0071 | min=0.5500 max=0.5809
         : test loss mean=0.6784 ± 0.0028
         : individual accs = ['0.576658', '0.549982', '0.570798', '0.575438', '0.580629', '0.561539', '0.569776', '0.574508', '0.569470', '0.573019', '0.578081', '0.563278', '0.572245', '0.571090', '0.570182', '0.574852', '0.565362', '0.569054', '0.563399', '0.580874']
         : correct/total = [(8207, 14232), (7829, 14235), (8143, 14266), (8181, 14217), (8267, 14238), (8071, 14373), (8174, 14346), (8235, 14334), (8140, 14294), (8236, 14373), (8292, 14344), (8056, 14302), (8214, 14354), (8202, 14362), (8165, 14320), (8275, 14395), (8135, 14389), (8113, 14257), (8029, 14251), (8364, 14399)]
         : compromised: 0.5687, honest: 0.5747
Round 006: test acc mean=0.5868 ± 0.0035 | min=0.5779 max=0.5926
         : test loss mean=0.6705 ± 0.0017
         : individual accs = ['0.590079', '0.577871', '0.587971', '0.584582', '0.591094', '0.590552', '0.590060', '0.586019', '0.585770', '0.583455', '0.589654', '0.584673', '0.589870', '0.583484', '0.583589', '0.587982', '0.584474', '0.585397', '0.586555', '0.592611']
         : correct/total = [(8398, 14232), (8226, 14235), (8388, 14266), (8311, 14217), (8416, 14238), (8488, 14373), (8465, 14346), (8400, 14334), (8373, 14294), (8386, 14373), (8458, 14344), (8362, 14302), (8467, 14354), (8380, 14362), (8357, 14320), (8464, 14395), (8410, 14389), (8346, 14257), (8359, 14251), (8533, 14399)]
         : compromised: 0.5865, honest: 0.5875
Round 007: test acc mean=0.5953 ± 0.0031 | min=0.5892 max=0.6029
         : test loss mean=0.6655 ± 0.0017
         : individual accs = ['0.597737', '0.589182', '0.594420', '0.596117', '0.602894', '0.599736', '0.595218', '0.594530', '0.592556', '0.594657', '0.596207', '0.593903', '0.598857', '0.593232', '0.591760', '0.593956', '0.592258', '0.598022', '0.594064', '0.597611']
         : correct/total = [(8507, 14232), (8387, 14235), (8480, 14266), (8475, 14217), (8584, 14238), (8620, 14373), (8539, 14346), (8522, 14334), (8470, 14294), (8547, 14373), (8552, 14344), (8494, 14302), (8596, 14354), (8520, 14362), (8474, 14320), (8550, 14395), (8522, 14389), (8526, 14257), (8466, 14251), (8605, 14399)]
         : compromised: 0.5949, honest: 0.5964
Round 008: test acc mean=0.6012 ± 0.0030 | min=0.5959 max=0.6059
         : test loss mean=0.6624 ± 0.0021
         : individual accs = ['0.599635', '0.595926', '0.599047', '0.605472', '0.605914', '0.600710', '0.598982', '0.600600', '0.599692', '0.600362', '0.603806', '0.598238', '0.604013', '0.600891', '0.596369', '0.603751', '0.597123', '0.605106', '0.604870', '0.602611']
         : correct/total = [(8534, 14232), (8483, 14235), (8546, 14266), (8608, 14217), (8627, 14238), (8634, 14373), (8593, 14346), (8609, 14334), (8572, 14294), (8629, 14373), (8661, 14344), (8556, 14302), (8670, 14354), (8630, 14362), (8540, 14320), (8691, 14395), (8592, 14389), (8627, 14257), (8620, 14251), (8677, 14399)]
         : compromised: 0.6011, honest: 0.6012
Round 009: test acc mean=0.6048 ± 0.0030 | min=0.5966 max=0.6110
         : test loss mean=0.6597 ± 0.0019
         : individual accs = ['0.606942', '0.603021', '0.603182', '0.608005', '0.610971', '0.604815', '0.604907', '0.603670', '0.596614', '0.602171', '0.604504', '0.602993', '0.607287', '0.605904', '0.602374', '0.605419', '0.601779', '0.607140', '0.607677', '0.607473']
         : correct/total = [(8638, 14232), (8584, 14235), (8605, 14266), (8644, 14217), (8699, 14238), (8693, 14373), (8678, 14346), (8653, 14334), (8528, 14294), (8655, 14373), (8671, 14344), (8624, 14302), (8717, 14354), (8702, 14362), (8626, 14320), (8715, 14395), (8659, 14389), (8656, 14257), (8660, 14251), (8747, 14399)]
         : compromised: 0.6048, honest: 0.6050
Round 010: test acc mean=0.6098 ± 0.0026 | min=0.6041 max=0.6156
         : test loss mean=0.6557 ± 0.0016
         : individual accs = ['0.611790', '0.610959', '0.608860', '0.609904', '0.615606', '0.609894', '0.608881', '0.609948', '0.608927', '0.612468', '0.610917', '0.604111', '0.609447', '0.607924', '0.604749', '0.610559', '0.606922', '0.612120', '0.610975', '0.611987']
         : correct/total = [(8707, 14232), (8697, 14235), (8686, 14266), (8671, 14217), (8765, 14238), (8766, 14373), (8735, 14346), (8743, 14334), (8704, 14294), (8803, 14373), (8763, 14344), (8640, 14302), (8748, 14354), (8731, 14362), (8660, 14320), (8789, 14395), (8733, 14389), (8727, 14257), (8707, 14251), (8812, 14399)]
         : compromised: 0.6092, honest: 0.6113

=== FINAL RESULTS ===
Dataset: sent140, Nodes: 20, Graph: fully, Aggregation: balance
Attack: directed_deviation, 70.0% compromised
Final accuracy - Compromised: 0.6092, Honest: 0.6113
Overall test accuracy: mean=0.6098 ± 0.0026

=== BALANCE SUMMARY ===
Node 0: acceptance=0.337
Node 1: acceptance=0.384
Node 2: acceptance=0.384
Node 3: acceptance=0.384
Node 4: acceptance=0.337
Node 5: acceptance=0.384
Node 6: acceptance=0.384
Node 7: acceptance=0.337
Node 8: acceptance=0.384
Node 9: acceptance=0.337
Node 10: acceptance=0.337
Node 11: acceptance=0.384
Node 12: acceptance=0.384
Node 13: acceptance=0.384
Node 14: acceptance=0.384
Node 15: acceptance=0.384
Node 16: acceptance=0.337
Node 17: acceptance=0.384
Node 18: acceptance=0.384
Node 19: acceptance=0.384

=== PARALLEL EXECUTION TIME (realistic for distributed system) ===
  COMMUNICATION (max across nodes):
    - Full model transfer: 0.000s (0.0%)
  COMPUTATION (max across nodes):
    - Filtering: 0.083s (85.7%)
    - Aggregation: 0.014s (14.3%)
  TOTALS:
    - Total computation: 0.097s (100.0%)
    - Total communication: 0.000s (0.0%)
    - Total parallel time: 0.097s

=== PER-NODE AVERAGE TIME ===
  - Filtering: 0.078s
  - Aggregation: 0.008s
  - Model transfer: 0.000s
  - Total per node: 0.086s

=== TOTAL COMPUTATIONAL WORK (sum across all nodes) ===
  - Total filtering: 1.568s
  - Total aggregation: 0.160s
  - Total model transfer: 0.000s
  - Grand total: 1.729s
  - Mean acceptance rate: 0.370

BALANCE Algorithm Properties:
  - Model dimension: 1,174,986
  - No compression: Full parameter comparison
  - Theoretical complexity: O(deg(i)×d)
  - Approach: Full parameter filtering + averaging
