Device: cuda
Seed: 987654321
Loading 1 LEAF Sent140 train files...
LEAF Sent140 train: 254555 users, 908652 samples
Building vocabulary (max_size=10000)...
Vocabulary size: 10000
Loading 1 LEAF Sent140 test files...
LEAF Sent140 test: 254555 users, 286281 samples
Found 254555 train users, 254555 test users, 254555 common users
User sample counts range: 494 (max) to 1 (min)
Distributed ALL 254555 users across 20 clients
Users per client: 12727 (with 15 clients getting +1 user)
Train partition sizes: [44353, 44290, 44657, 44907, 44696, 45843, 45801, 45619, 45069, 45639, 45821, 45311, 45779, 46056, 45625, 45984, 46428, 44737, 45540, 46497]
Test partition sizes: [14232, 14235, 14266, 14217, 14238, 14373, 14346, 14334, 14294, 14373, 14344, 14302, 14354, 14362, 14320, 14395, 14389, 14257, 14251, 14399]
  Client 0: 44353 train samples, 2 unique classes
  Client 1: 44290 train samples, 2 unique classes
  Client 2: 44657 train samples, 2 unique classes
  Client 3: 44907 train samples, 2 unique classes
  Client 4: 44696 train samples, 2 unique classes
  Client 5: 45843 train samples, 2 unique classes
  Client 6: 45801 train samples, 2 unique classes
  Client 7: 45619 train samples, 2 unique classes
  Client 8: 45069 train samples, 2 unique classes
  Client 9: 45639 train samples, 2 unique classes
  Client 10: 45821 train samples, 2 unique classes
  Client 11: 45311 train samples, 2 unique classes
  Client 12: 45779 train samples, 2 unique classes
  Client 13: 46056 train samples, 2 unique classes
  Client 14: 45625 train samples, 2 unique classes
  Client 15: 45984 train samples, 2 unique classes
  Client 16: 46428 train samples, 2 unique classes
  Client 17: 44737 train samples, 2 unique classes
  Client 18: 45540 train samples, 2 unique classes
  Client 19: 46497 train samples, 2 unique classes
Will sample 4500 samples per client per epoch
Graph: erdos, nodes: 20, edges: 48
Degree statistics: avg=4.80, min=2, max=7
Attack: Compromised 2/20 nodes: [5, 13]
Attack type: backdoor, lambda: 1.0
Backdoor target label: 1, trigger size: 3
Model variant: baseline
Model parameters: 1,174,986
Initial test acc across nodes: mean=0.4965 ± 0.0152
Backdoor attack: Created poisoned datasets for 2 compromised nodes
Round 001: test acc mean=0.5651 ± 0.0485 | min=0.4913 max=0.6104
         : test loss mean=8.3002 ± 10.6224
         : individual accs = ['0.593100', '0.609835', '0.599047', '0.507139', '0.610409', '0.508245', '0.606441', '0.499930', '0.591717', '0.602797', '0.604573', '0.491260', '0.603595', '0.506197', '0.492179', '0.601806', '0.588366', '0.492530', '0.595818', '0.596986']
         : correct/total = [(8441, 14232), (8681, 14235), (8546, 14266), (7210, 14217), (8691, 14238), (7305, 14373), (8700, 14346), (7166, 14334), (8458, 14294), (8664, 14373), (8672, 14344), (7026, 14302), (8664, 14354), (7270, 14362), (7048, 14320), (8663, 14395), (8466, 14389), (7022, 14257), (8491, 14251), (8596, 14399)]
         : compromised: 0.5072, honest: 0.5715
Round 002: test acc mean=0.5990 ± 0.0432 | min=0.4856 max=0.6265
         : test loss mean=4.2685 ± 8.6696
         : individual accs = ['0.626546', '0.624868', '0.618113', '0.509249', '0.618345', '0.496417', '0.614596', '0.608414', '0.612565', '0.619982', '0.621863', '0.612991', '0.617110', '0.485587', '0.614735', '0.618965', '0.612204', '0.619205', '0.610273', '0.616987']
         : correct/total = [(8917, 14232), (8895, 14235), (8818, 14266), (7240, 14217), (8804, 14238), (7135, 14373), (8817, 14346), (8721, 14334), (8756, 14294), (8911, 14373), (8920, 14344), (8767, 14302), (8858, 14354), (6974, 14362), (8803, 14320), (8910, 14395), (8809, 14389), (8828, 14257), (8697, 14251), (8884, 14399)]
         : compromised: 0.4910, honest: 0.6109
Round 003: test acc mean=0.6324 ± 0.0083 | min=0.6108 max=0.6494
         : test loss mean=0.6385 ± 0.0067
         : individual accs = ['0.649382', '0.643836', '0.638161', '0.631638', '0.637519', '0.629722', '0.640109', '0.629622', '0.637330', '0.631810', '0.631693', '0.610754', '0.632089', '0.639256', '0.621439', '0.636263', '0.630412', '0.625447', '0.625991', '0.625113']
         : correct/total = [(9242, 14232), (9165, 14235), (9104, 14266), (8980, 14217), (9077, 14238), (9051, 14373), (9183, 14346), (9025, 14334), (9110, 14294), (9081, 14373), (9061, 14344), (8735, 14302), (9073, 14354), (9181, 14362), (8899, 14320), (9159, 14395), (9071, 14389), (8917, 14257), (8921, 14251), (9001, 14399)]
         : compromised: 0.6345, honest: 0.6321
Round 004: test acc mean=0.6435 ± 0.0056 | min=0.6322 max=0.6544
         : test loss mean=0.6290 ± 0.0054
         : individual accs = ['0.654370', '0.650018', '0.643909', '0.638039', '0.644192', '0.642942', '0.648752', '0.650760', '0.647544', '0.637306', '0.649679', '0.632219', '0.644350', '0.638630', '0.636662', '0.642932', '0.641810', '0.641369', '0.636727', '0.646989']
         : correct/total = [(9313, 14232), (9253, 14235), (9186, 14266), (9071, 14217), (9172, 14238), (9241, 14373), (9307, 14346), (9328, 14334), (9256, 14294), (9160, 14373), (9319, 14344), (9042, 14302), (9249, 14354), (9172, 14362), (9117, 14320), (9255, 14395), (9235, 14389), (9144, 14257), (9074, 14251), (9316, 14399)]
         : compromised: 0.6408, honest: 0.6438
Round 005: test acc mean=0.6514 ± 0.0044 | min=0.6422 max=0.6578
         : test loss mean=0.6215 ± 0.0041
         : individual accs = ['0.657813', '0.657815', '0.650638', '0.647886', '0.657817', '0.644890', '0.654677', '0.649784', '0.652022', '0.647951', '0.656442', '0.653475', '0.651735', '0.650536', '0.647556', '0.655575', '0.647022', '0.648033', '0.642201', '0.654698']
         : correct/total = [(9362, 14232), (9364, 14235), (9282, 14266), (9211, 14217), (9366, 14238), (9269, 14373), (9392, 14346), (9314, 14334), (9320, 14294), (9313, 14373), (9416, 14344), (9346, 14302), (9355, 14354), (9343, 14362), (9273, 14320), (9437, 14395), (9310, 14389), (9239, 14257), (9152, 14251), (9427, 14399)]
         : compromised: 0.6477, honest: 0.6518
Round 006: test acc mean=0.6567 ± 0.0050 | min=0.6440 max=0.6666
         : test loss mean=0.6168 ± 0.0050
         : individual accs = ['0.666596', '0.664981', '0.658769', '0.654006', '0.659433', '0.653447', '0.659975', '0.655923', '0.659228', '0.651847', '0.658673', '0.660257', '0.654800', '0.657290', '0.643994', '0.661410', '0.650288', '0.655818', '0.652866', '0.654629']
         : correct/total = [(9487, 14232), (9466, 14235), (9398, 14266), (9298, 14217), (9389, 14238), (9392, 14373), (9468, 14346), (9402, 14334), (9423, 14294), (9369, 14373), (9448, 14344), (9443, 14302), (9399, 14354), (9440, 14362), (9222, 14320), (9521, 14395), (9357, 14389), (9350, 14257), (9304, 14251), (9426, 14399)]
         : compromised: 0.6554, honest: 0.6569
Round 007: test acc mean=0.6604 ± 0.0062 | min=0.6468 max=0.6731
         : test loss mean=0.6131 ± 0.0063
         : individual accs = ['0.673061', '0.665613', '0.653582', '0.662657', '0.658871', '0.656857', '0.669176', '0.654946', '0.663145', '0.659013', '0.665365', '0.654664', '0.664553', '0.661816', '0.646788', '0.659743', '0.661130', '0.656730', '0.652165', '0.667824']
         : correct/total = [(9579, 14232), (9475, 14235), (9324, 14266), (9421, 14217), (9381, 14238), (9441, 14373), (9600, 14346), (9388, 14334), (9479, 14294), (9472, 14373), (9544, 14344), (9363, 14302), (9539, 14354), (9505, 14362), (9262, 14320), (9497, 14395), (9513, 14389), (9363, 14257), (9294, 14251), (9616, 14399)]
         : compromised: 0.6593, honest: 0.6605
Round 008: test acc mean=0.6680 ± 0.0046 | min=0.6614 max=0.6771
         : test loss mean=0.6051 ± 0.0039
         : individual accs = ['0.677066', '0.675097', '0.666760', '0.668073', '0.670319', '0.662701', '0.673498', '0.666736', '0.672380', '0.668963', '0.669688', '0.661516', '0.669430', '0.661816', '0.669274', '0.670788', '0.661617', '0.662552', '0.661427', '0.669977']
         : correct/total = [(9636, 14232), (9610, 14235), (9512, 14266), (9498, 14217), (9544, 14238), (9525, 14373), (9662, 14346), (9557, 14334), (9611, 14294), (9615, 14373), (9606, 14344), (9461, 14302), (9609, 14354), (9505, 14362), (9584, 14320), (9656, 14395), (9520, 14389), (9446, 14257), (9426, 14251), (9647, 14399)]
         : compromised: 0.6623, honest: 0.6686
Round 009: test acc mean=0.6717 ± 0.0048 | min=0.6619 max=0.6811
         : test loss mean=0.6017 ± 0.0047
         : individual accs = ['0.678541', '0.681068', '0.672648', '0.675037', '0.675235', '0.661866', '0.675659', '0.667015', '0.676438', '0.669937', '0.671431', '0.666900', '0.670127', '0.666829', '0.674860', '0.670233', '0.670651', '0.664866', '0.668444', '0.676991']
         : correct/total = [(9657, 14232), (9695, 14235), (9596, 14266), (9597, 14217), (9614, 14238), (9513, 14373), (9693, 14346), (9561, 14334), (9669, 14294), (9629, 14373), (9631, 14344), (9538, 14302), (9619, 14354), (9577, 14362), (9664, 14320), (9648, 14395), (9650, 14389), (9479, 14257), (9526, 14251), (9748, 14399)]
         : compromised: 0.6643, honest: 0.6726
Round 010: test acc mean=0.6762 ± 0.0041 | min=0.6684 max=0.6842
         : test loss mean=0.5968 ± 0.0041
         : individual accs = ['0.682055', '0.682192', '0.677976', '0.675107', '0.681065', '0.668406', '0.674892', '0.672806', '0.677627', '0.677938', '0.676032', '0.673332', '0.674794', '0.674001', '0.676327', '0.677666', '0.676906', '0.671109', '0.669286', '0.684214']
         : correct/total = [(9707, 14232), (9711, 14235), (9672, 14266), (9598, 14217), (9697, 14238), (9607, 14373), (9682, 14346), (9644, 14334), (9686, 14294), (9744, 14373), (9697, 14344), (9630, 14302), (9686, 14354), (9680, 14362), (9685, 14320), (9755, 14395), (9740, 14389), (9568, 14257), (9538, 14251), (9852, 14399)]
         : compromised: 0.6712, honest: 0.6767

=== FINAL RESULTS ===
Dataset: sent140, Nodes: 20, Graph: erdos, Aggregation: krum
Attack: backdoor, 10.0% compromised
Final accuracy - Compromised: 0.6712, Honest: 0.6767
Overall test accuracy: mean=0.6762 ± 0.0041

=== BACKDOOR ATTACK SUCCESS RATE (ASR) ===
Target label: 1
Trigger size: 3x3
Overall ASR: 0.4387 ± 0.0413
Honest nodes ASR: 0.4387 ± 0.0378
Compromised nodes ASR: 0.4382 ± 0.0651
Note: Higher ASR indicates more successful backdoor attack
