Device: cuda
Seed: 987654321
Loading 1 LEAF Sent140 train files...
LEAF Sent140 train: 254555 users, 908652 samples
Building vocabulary (max_size=10000)...
Vocabulary size: 10000
Loading 1 LEAF Sent140 test files...
LEAF Sent140 test: 254555 users, 286281 samples
Found 254555 train users, 254555 test users, 254555 common users
User sample counts range: 494 (max) to 1 (min)
Distributed ALL 254555 users across 20 clients
Users per client: 12727 (with 15 clients getting +1 user)
Train partition sizes: [44353, 44290, 44657, 44907, 44696, 45843, 45801, 45619, 45069, 45639, 45821, 45311, 45779, 46056, 45625, 45984, 46428, 44737, 45540, 46497]
Test partition sizes: [14232, 14235, 14266, 14217, 14238, 14373, 14346, 14334, 14294, 14373, 14344, 14302, 14354, 14362, 14320, 14395, 14389, 14257, 14251, 14399]
  Client 0: 44353 train samples, 2 unique classes
  Client 1: 44290 train samples, 2 unique classes
  Client 2: 44657 train samples, 2 unique classes
  Client 3: 44907 train samples, 2 unique classes
  Client 4: 44696 train samples, 2 unique classes
  Client 5: 45843 train samples, 2 unique classes
  Client 6: 45801 train samples, 2 unique classes
  Client 7: 45619 train samples, 2 unique classes
  Client 8: 45069 train samples, 2 unique classes
  Client 9: 45639 train samples, 2 unique classes
  Client 10: 45821 train samples, 2 unique classes
  Client 11: 45311 train samples, 2 unique classes
  Client 12: 45779 train samples, 2 unique classes
  Client 13: 46056 train samples, 2 unique classes
  Client 14: 45625 train samples, 2 unique classes
  Client 15: 45984 train samples, 2 unique classes
  Client 16: 46428 train samples, 2 unique classes
  Client 17: 44737 train samples, 2 unique classes
  Client 18: 45540 train samples, 2 unique classes
  Client 19: 46497 train samples, 2 unique classes
Will sample 4500 samples per client per epoch
Graph: fully, nodes: 20, edges: 190
Degree statistics: avg=19.00, min=19, max=19
Attack: Compromised 2/20 nodes: [5, 13]
Attack type: directed_deviation, lambda: 1.0
Model variant: baseline
Model parameters: 1,174,986
BALANCE algorithm:
Balance Config: BALANCEConfig(gamma=2, kappa=1, alpha=0.5, min_neighbors=1)
  - Model dimension: 1,174,986 parameters
  - Complexity: O(N×d) = O(20×1,174,986)
Initial test acc across nodes: mean=0.4965 ± 0.0152
Round 001: test acc mean=0.5021 ± 0.0138 | min=0.4751 max=0.5357
         : test loss mean=0.6968 ± 0.0036
         : individual accs = ['0.479553', '0.513874', '0.491729', '0.511149', '0.494311', '0.535657', '0.514429', '0.493372', '0.509514', '0.506853', '0.475112', '0.488323', '0.510102', '0.509539', '0.508939', '0.499548', '0.499965', '0.511959', '0.485369', '0.503299']
         : correct/total = [(6825, 14232), (7315, 14235), (7015, 14266), (7267, 14217), (7038, 14238), (7699, 14373), (7380, 14346), (7072, 14334), (7283, 14294), (7285, 14373), (6815, 14344), (6984, 14302), (7322, 14354), (7318, 14362), (7288, 14320), (7191, 14395), (7194, 14389), (7299, 14257), (6917, 14251), (7247, 14399)]
         : compromised: 0.5226, honest: 0.4999
Round 002: test acc mean=0.5127 ± 0.0206 | min=0.4917 max=0.5779
         : test loss mean=0.6928 ± 0.0004
         : individual accs = ['0.496065', '0.514226', '0.514160', '0.553985', '0.506532', '0.493843', '0.577931', '0.495186', '0.513362', '0.506992', '0.499024', '0.491749', '0.512122', '0.508564', '0.500349', '0.509205', '0.500452', '0.533142', '0.505368', '0.521356']
         : correct/total = [(7060, 14232), (7320, 14235), (7335, 14266), (7876, 14217), (7212, 14238), (7098, 14373), (8291, 14346), (7098, 14334), (7338, 14294), (7287, 14373), (7158, 14344), (7033, 14302), (7351, 14354), (7304, 14362), (7165, 14320), (7330, 14395), (7201, 14389), (7601, 14257), (7202, 14251), (7507, 14399)]
         : compromised: 0.5012, honest: 0.5140
Round 003: test acc mean=0.4949 ± 0.0056 | min=0.4861 max=0.5086
         : test loss mean=0.6935 ± 0.0002
         : individual accs = ['0.489109', '0.486266', '0.486051', '0.492228', '0.494100', '0.493843', '0.497560', '0.495186', '0.488457', '0.493008', '0.499024', '0.492029', '0.499512', '0.508564', '0.495810', '0.498367', '0.499757', '0.503051', '0.488738', '0.496354']
         : correct/total = [(6961, 14232), (6922, 14235), (6934, 14266), (6998, 14217), (7035, 14238), (7098, 14373), (7138, 14346), (7098, 14334), (6982, 14294), (7086, 14373), (7158, 14344), (7037, 14302), (7170, 14354), (7304, 14362), (7100, 14320), (7174, 14395), (7191, 14389), (7172, 14257), (6965, 14251), (7147, 14399)]
         : compromised: 0.5012, honest: 0.4941
Round 004: test acc mean=0.4949 ± 0.0056 | min=0.4861 max=0.5086
         : test loss mean=0.6937 ± 0.0002
         : individual accs = ['0.489109', '0.486266', '0.486051', '0.492228', '0.494100', '0.493843', '0.497560', '0.495186', '0.488457', '0.493008', '0.499024', '0.492029', '0.499512', '0.508564', '0.495810', '0.498367', '0.499757', '0.503051', '0.488738', '0.496354']
         : correct/total = [(6961, 14232), (6922, 14235), (6934, 14266), (6998, 14217), (7035, 14238), (7098, 14373), (7138, 14346), (7098, 14334), (6982, 14294), (7086, 14373), (7158, 14344), (7037, 14302), (7170, 14354), (7304, 14362), (7100, 14320), (7174, 14395), (7191, 14389), (7172, 14257), (6965, 14251), (7147, 14399)]
         : compromised: 0.5012, honest: 0.4941
Round 005: test acc mean=0.4949 ± 0.0056 | min=0.4861 max=0.5086
         : test loss mean=0.6940 ± 0.0003
         : individual accs = ['0.489109', '0.486266', '0.486051', '0.492228', '0.494100', '0.493843', '0.497560', '0.495186', '0.488457', '0.493008', '0.499024', '0.492029', '0.499512', '0.508564', '0.495810', '0.498367', '0.499757', '0.503051', '0.488738', '0.496354']
         : correct/total = [(6961, 14232), (6922, 14235), (6934, 14266), (6998, 14217), (7035, 14238), (7098, 14373), (7138, 14346), (7098, 14334), (6982, 14294), (7086, 14373), (7158, 14344), (7037, 14302), (7170, 14354), (7304, 14362), (7100, 14320), (7174, 14395), (7191, 14389), (7172, 14257), (6965, 14251), (7147, 14399)]
         : compromised: 0.5012, honest: 0.4941
Round 006: test acc mean=0.4949 ± 0.0056 | min=0.4861 max=0.5086
         : test loss mean=0.6941 ± 0.0003
         : individual accs = ['0.489109', '0.486266', '0.486051', '0.492228', '0.494100', '0.493843', '0.497560', '0.495186', '0.488457', '0.493008', '0.499024', '0.492029', '0.499512', '0.508564', '0.495810', '0.498367', '0.499757', '0.503051', '0.488738', '0.496354']
         : correct/total = [(6961, 14232), (6922, 14235), (6934, 14266), (6998, 14217), (7035, 14238), (7098, 14373), (7138, 14346), (7098, 14334), (6982, 14294), (7086, 14373), (7158, 14344), (7037, 14302), (7170, 14354), (7304, 14362), (7100, 14320), (7174, 14395), (7191, 14389), (7172, 14257), (6965, 14251), (7147, 14399)]
         : compromised: 0.5012, honest: 0.4941
Round 007: test acc mean=0.4949 ± 0.0056 | min=0.4861 max=0.5086
         : test loss mean=0.6941 ± 0.0003
         : individual accs = ['0.489109', '0.486266', '0.486051', '0.492228', '0.494100', '0.493843', '0.497560', '0.495186', '0.488457', '0.493008', '0.499024', '0.492029', '0.499512', '0.508564', '0.495810', '0.498367', '0.499757', '0.503051', '0.488738', '0.496354']
         : correct/total = [(6961, 14232), (6922, 14235), (6934, 14266), (6998, 14217), (7035, 14238), (7098, 14373), (7138, 14346), (7098, 14334), (6982, 14294), (7086, 14373), (7158, 14344), (7037, 14302), (7170, 14354), (7304, 14362), (7100, 14320), (7174, 14395), (7191, 14389), (7172, 14257), (6965, 14251), (7147, 14399)]
         : compromised: 0.5012, honest: 0.4941
Round 008: test acc mean=0.4949 ± 0.0056 | min=0.4861 max=0.5086
         : test loss mean=0.6941 ± 0.0003
         : individual accs = ['0.489109', '0.486266', '0.486051', '0.492228', '0.494100', '0.493843', '0.497560', '0.495186', '0.488457', '0.493008', '0.499024', '0.492029', '0.499512', '0.508564', '0.495810', '0.498367', '0.499757', '0.503051', '0.488738', '0.496354']
         : correct/total = [(6961, 14232), (6922, 14235), (6934, 14266), (6998, 14217), (7035, 14238), (7098, 14373), (7138, 14346), (7098, 14334), (6982, 14294), (7086, 14373), (7158, 14344), (7037, 14302), (7170, 14354), (7304, 14362), (7100, 14320), (7174, 14395), (7191, 14389), (7172, 14257), (6965, 14251), (7147, 14399)]
         : compromised: 0.5012, honest: 0.4941
Round 009: test acc mean=0.4949 ± 0.0056 | min=0.4861 max=0.5086
         : test loss mean=0.6942 ± 0.0004
         : individual accs = ['0.489109', '0.486266', '0.486051', '0.492228', '0.494100', '0.493843', '0.497560', '0.495186', '0.488457', '0.493008', '0.499024', '0.492029', '0.499512', '0.508564', '0.495810', '0.498367', '0.499757', '0.503051', '0.488738', '0.496354']
         : correct/total = [(6961, 14232), (6922, 14235), (6934, 14266), (6998, 14217), (7035, 14238), (7098, 14373), (7138, 14346), (7098, 14334), (6982, 14294), (7086, 14373), (7158, 14344), (7037, 14302), (7170, 14354), (7304, 14362), (7100, 14320), (7174, 14395), (7191, 14389), (7172, 14257), (6965, 14251), (7147, 14399)]
         : compromised: 0.5012, honest: 0.4941
Round 010: test acc mean=0.4949 ± 0.0056 | min=0.4861 max=0.5086
         : test loss mean=0.6942 ± 0.0004
         : individual accs = ['0.489109', '0.486266', '0.486051', '0.492228', '0.494100', '0.493843', '0.497560', '0.495186', '0.488457', '0.493008', '0.499024', '0.492029', '0.499512', '0.508564', '0.495810', '0.498367', '0.499757', '0.503051', '0.488738', '0.496354']
         : correct/total = [(6961, 14232), (6922, 14235), (6934, 14266), (6998, 14217), (7035, 14238), (7098, 14373), (7138, 14346), (7098, 14334), (6982, 14294), (7086, 14373), (7158, 14344), (7037, 14302), (7170, 14354), (7304, 14362), (7100, 14320), (7174, 14395), (7191, 14389), (7172, 14257), (6965, 14251), (7147, 14399)]
         : compromised: 0.5012, honest: 0.4941

=== FINAL RESULTS ===
Dataset: sent140, Nodes: 20, Graph: fully, Aggregation: balance
Attack: directed_deviation, 10.0% compromised
Final accuracy - Compromised: 0.5012, Honest: 0.4941
Overall test accuracy: mean=0.4949 ± 0.0056

=== BALANCE SUMMARY ===
Node 0: acceptance=0.905
Node 1: acceptance=0.905
Node 2: acceptance=0.905
Node 3: acceptance=0.905
Node 4: acceptance=0.905
Node 5: acceptance=0.953
Node 6: acceptance=0.905
Node 7: acceptance=0.905
Node 8: acceptance=0.905
Node 9: acceptance=0.905
Node 10: acceptance=0.905
Node 11: acceptance=0.905
Node 12: acceptance=0.905
Node 13: acceptance=0.953
Node 14: acceptance=0.905
Node 15: acceptance=0.905
Node 16: acceptance=0.905
Node 17: acceptance=0.905
Node 18: acceptance=0.905
Node 19: acceptance=0.905

=== PARALLEL EXECUTION TIME (realistic for distributed system) ===
  COMMUNICATION (max across nodes):
    - Full model transfer: 0.000s (0.0%)
  COMPUTATION (max across nodes):
    - Filtering: 0.084s (81.5%)
    - Aggregation: 0.019s (18.5%)
  TOTALS:
    - Total computation: 0.103s (100.0%)
    - Total communication: 0.000s (0.0%)
    - Total parallel time: 0.103s

=== PER-NODE AVERAGE TIME ===
  - Filtering: 0.079s
  - Aggregation: 0.013s
  - Model transfer: 0.000s
  - Total per node: 0.092s

=== TOTAL COMPUTATIONAL WORK (sum across all nodes) ===
  - Total filtering: 1.582s
  - Total aggregation: 0.264s
  - Total model transfer: 0.000s
  - Grand total: 1.846s
  - Mean acceptance rate: 0.910

BALANCE Algorithm Properties:
  - Model dimension: 1,174,986
  - No compression: Full parameter comparison
  - Theoretical complexity: O(deg(i)×d)
  - Approach: Full parameter filtering + averaging
