Device: cuda
Seed: 987654321
Loading 1 LEAF Sent140 train files...
LEAF Sent140 train: 254555 users, 908652 samples
Building vocabulary (max_size=10000)...
Vocabulary size: 10000
Loading 1 LEAF Sent140 test files...
LEAF Sent140 test: 254555 users, 286281 samples
Found 254555 train users, 254555 test users, 254555 common users
User sample counts range: 494 (max) to 1 (min)
Distributed ALL 254555 users across 20 clients
Users per client: 12727 (with 15 clients getting +1 user)
Train partition sizes: [44353, 44290, 44657, 44907, 44696, 45843, 45801, 45619, 45069, 45639, 45821, 45311, 45779, 46056, 45625, 45984, 46428, 44737, 45540, 46497]
Test partition sizes: [14232, 14235, 14266, 14217, 14238, 14373, 14346, 14334, 14294, 14373, 14344, 14302, 14354, 14362, 14320, 14395, 14389, 14257, 14251, 14399]
  Client 0: 44353 train samples, 2 unique classes
  Client 1: 44290 train samples, 2 unique classes
  Client 2: 44657 train samples, 2 unique classes
  Client 3: 44907 train samples, 2 unique classes
  Client 4: 44696 train samples, 2 unique classes
  Client 5: 45843 train samples, 2 unique classes
  Client 6: 45801 train samples, 2 unique classes
  Client 7: 45619 train samples, 2 unique classes
  Client 8: 45069 train samples, 2 unique classes
  Client 9: 45639 train samples, 2 unique classes
  Client 10: 45821 train samples, 2 unique classes
  Client 11: 45311 train samples, 2 unique classes
  Client 12: 45779 train samples, 2 unique classes
  Client 13: 46056 train samples, 2 unique classes
  Client 14: 45625 train samples, 2 unique classes
  Client 15: 45984 train samples, 2 unique classes
  Client 16: 46428 train samples, 2 unique classes
  Client 17: 44737 train samples, 2 unique classes
  Client 18: 45540 train samples, 2 unique classes
  Client 19: 46497 train samples, 2 unique classes
Will sample 4500 samples per client per epoch
Graph: erdos, nodes: 20, edges: 126
Degree statistics: avg=12.60, min=8, max=16
Attack: Compromised 14/20 nodes: [1, 2, 3, 5, 6, 8, 11, 12, 13, 14, 15, 17, 18, 19]
Attack type: krum, lambda: 1.0
Model variant: baseline
Model parameters: 1,174,986
BALANCE algorithm:
Balance Config: BALANCEConfig(gamma=2, kappa=1, alpha=0.5, min_neighbors=1)
  - Model dimension: 1,174,986 parameters
  - Complexity: O(N×d) = O(20×1,174,986)
Initial test acc across nodes: mean=0.4965 ± 0.0152
Round 001: test acc mean=0.5001 ± 0.0071 | min=0.4857 max=0.5112
         : test loss mean=2.8865 ± 1.0646
         : individual accs = ['0.506113', '0.504110', '0.499720', '0.509812', '0.496769', '0.494051', '0.510038', '0.502093', '0.494893', '0.503931', '0.492819', '0.490840', '0.496726', '0.511210', '0.488338', '0.506495', '0.501981', '0.503823', '0.485720', '0.501910']
         : correct/total = [(7203, 14232), (7176, 14235), (7129, 14266), (7248, 14217), (7073, 14238), (7101, 14373), (7317, 14346), (7197, 14334), (7074, 14294), (7243, 14373), (7069, 14344), (7020, 14302), (7130, 14354), (7342, 14362), (6993, 14320), (7291, 14395), (7223, 14389), (7183, 14257), (6922, 14251), (7227, 14399)]
         : compromised: 0.4998, honest: 0.5006
Round 002: test acc mean=0.5045 ± 0.0112 | min=0.4884 max=0.5270
         : test loss mean=0.9621 ± 0.7398
         : individual accs = ['0.513912', '0.491886', '0.515071', '0.527045', '0.516927', '0.488416', '0.502161', '0.496023', '0.490486', '0.511932', '0.505508', '0.502098', '0.522084', '0.500209', '0.512360', '0.490865', '0.500869', '0.496949', '0.491053', '0.513161']
         : correct/total = [(7314, 14232), (7002, 14235), (7348, 14266), (7493, 14217), (7360, 14238), (7020, 14373), (7204, 14346), (7110, 14334), (7011, 14294), (7358, 14373), (7251, 14344), (7181, 14302), (7494, 14354), (7184, 14362), (7337, 14320), (7066, 14395), (7207, 14389), (7085, 14257), (6998, 14251), (7389, 14399)]
         : compromised: 0.5031, honest: 0.5075
Round 003: test acc mean=0.5111 ± 0.0144 | min=0.4749 max=0.5372
         : test loss mean=0.7324 ± 0.0464
         : individual accs = ['0.537170', '0.527713', '0.505397', '0.507913', '0.517488', '0.506923', '0.515335', '0.517790', '0.491535', '0.514506', '0.517429', '0.506153', '0.535809', '0.474934', '0.502444', '0.507051', '0.523038', '0.498422', '0.517648', '0.496840']
         : correct/total = [(7645, 14232), (7512, 14235), (7210, 14266), (7221, 14217), (7368, 14238), (7286, 14373), (7393, 14346), (7422, 14334), (7026, 14294), (7395, 14373), (7422, 14344), (7239, 14302), (7691, 14354), (6821, 14362), (7195, 14320), (7299, 14395), (7526, 14389), (7106, 14257), (7377, 14251), (7154, 14399)]
         : compromised: 0.5067, honest: 0.5212
Round 004: test acc mean=0.5312 ± 0.0167 | min=0.4943 max=0.5544
         : test loss mean=0.7022 ± 0.0185
         : individual accs = ['0.549466', '0.552441', '0.532174', '0.524583', '0.554432', '0.521951', '0.507459', '0.546184', '0.494333', '0.546163', '0.537228', '0.524542', '0.540128', '0.518103', '0.510126', '0.530670', '0.546181', '0.513993', '0.550909', '0.523370']
         : correct/total = [(7820, 14232), (7864, 14235), (7592, 14266), (7458, 14217), (7894, 14238), (7502, 14373), (7280, 14346), (7829, 14334), (7066, 14294), (7850, 14373), (7706, 14344), (7502, 14302), (7753, 14354), (7441, 14362), (7305, 14320), (7639, 14395), (7859, 14389), (7328, 14257), (7851, 14251), (7536, 14399)]
         : compromised: 0.5246, honest: 0.5466
Round 005: test acc mean=0.5621 ± 0.0115 | min=0.5265 max=0.5759
         : test loss mean=0.6831 ± 0.0056
         : individual accs = ['0.575604', '0.573727', '0.550329', '0.561300', '0.573255', '0.560356', '0.554858', '0.566346', '0.526515', '0.572462', '0.575014', '0.564117', '0.562909', '0.549923', '0.558240', '0.566863', '0.561540', '0.560637', '0.575889', '0.552747']
         : correct/total = [(8192, 14232), (8167, 14235), (7851, 14266), (7980, 14217), (8162, 14238), (8054, 14373), (7960, 14346), (8118, 14334), (7526, 14294), (8228, 14373), (8248, 14344), (8068, 14302), (8080, 14354), (7898, 14362), (7994, 14320), (8160, 14395), (8080, 14389), (7993, 14257), (8207, 14251), (7959, 14399)]
         : compromised: 0.5585, honest: 0.5707
Round 006: test acc mean=0.5836 ± 0.0046 | min=0.5750 max=0.5931
         : test loss mean=0.6730 ± 0.0021
         : individual accs = ['0.590430', '0.587285', '0.579350', '0.579588', '0.588847', '0.585960', '0.582323', '0.588880', '0.574997', '0.584986', '0.593140', '0.580688', '0.583461', '0.583554', '0.577863', '0.581660', '0.584057', '0.576910', '0.584240', '0.584277']
         : correct/total = [(8403, 14232), (8360, 14235), (8265, 14266), (8240, 14217), (8384, 14238), (8422, 14373), (8354, 14346), (8441, 14334), (8219, 14294), (8408, 14373), (8508, 14344), (8305, 14302), (8375, 14354), (8381, 14362), (8275, 14320), (8373, 14395), (8404, 14389), (8225, 14257), (8326, 14251), (8413, 14399)]
         : compromised: 0.5816, honest: 0.5884
Round 007: test acc mean=0.5958 ± 0.0031 | min=0.5889 max=0.6009
         : test loss mean=0.6668 ± 0.0022
         : individual accs = ['0.600197', '0.591500', '0.588883', '0.591264', '0.600927', '0.597788', '0.597867', '0.595089', '0.594235', '0.598344', '0.597881', '0.596560', '0.599763', '0.595530', '0.597486', '0.591872', '0.596914', '0.593673', '0.595958', '0.594694']
         : correct/total = [(8542, 14232), (8420, 14235), (8401, 14266), (8406, 14217), (8556, 14238), (8592, 14373), (8577, 14346), (8530, 14334), (8494, 14294), (8600, 14373), (8576, 14344), (8532, 14302), (8609, 14354), (8553, 14362), (8556, 14320), (8520, 14395), (8589, 14389), (8464, 14257), (8493, 14251), (8563, 14399)]
         : compromised: 0.5948, honest: 0.5982
Round 008: test acc mean=0.6030 ± 0.0038 | min=0.5951 max=0.6091
         : test loss mean=0.6625 ± 0.0027
         : individual accs = ['0.604623', '0.599087', '0.595121', '0.601393', '0.607248', '0.609128', '0.603931', '0.601577', '0.604939', '0.606276', '0.606107', '0.595861', '0.605336', '0.605904', '0.606145', '0.597846', '0.601571', '0.598443', '0.605221', '0.603584']
         : correct/total = [(8605, 14232), (8528, 14235), (8490, 14266), (8550, 14217), (8646, 14238), (8755, 14373), (8664, 14346), (8623, 14334), (8647, 14294), (8714, 14373), (8694, 14344), (8522, 14302), (8689, 14354), (8702, 14362), (8680, 14320), (8606, 14395), (8656, 14389), (8532, 14257), (8625, 14251), (8691, 14399)]
         : compromised: 0.6023, honest: 0.6046
Round 009: test acc mean=0.6078 ± 0.0031 | min=0.6003 max=0.6140
         : test loss mean=0.6587 ± 0.0020
         : individual accs = ['0.610736', '0.603512', '0.607809', '0.607442', '0.613991', '0.608780', '0.610553', '0.606390', '0.604519', '0.611842', '0.607223', '0.607188', '0.611119', '0.608411', '0.606285', '0.605002', '0.609007', '0.600267', '0.610133', '0.605667']
         : correct/total = [(8692, 14232), (8591, 14235), (8671, 14266), (8636, 14217), (8742, 14238), (8750, 14373), (8759, 14346), (8692, 14334), (8641, 14294), (8794, 14373), (8710, 14344), (8684, 14302), (8772, 14354), (8738, 14362), (8682, 14320), (8709, 14395), (8763, 14389), (8558, 14257), (8695, 14251), (8721, 14399)]
         : compromised: 0.6069, honest: 0.6099
Round 010: test acc mean=0.6142 ± 0.0045 | min=0.6048 max=0.6244
         : test loss mean=0.6544 ± 0.0021
         : individual accs = ['0.616006', '0.608711', '0.613767', '0.614616', '0.624105', '0.616642', '0.616897', '0.612460', '0.611445', '0.624435', '0.613636', '0.609146', '0.611885', '0.612589', '0.615573', '0.612088', '0.612968', '0.604826', '0.614273', '0.617335']
         : correct/total = [(8767, 14232), (8665, 14235), (8756, 14266), (8738, 14217), (8886, 14238), (8863, 14373), (8850, 14346), (8779, 14334), (8740, 14294), (8975, 14373), (8802, 14344), (8712, 14302), (8783, 14354), (8798, 14362), (8815, 14320), (8811, 14395), (8820, 14389), (8623, 14257), (8754, 14251), (8889, 14399)]
         : compromised: 0.6128, honest: 0.6173

=== FINAL RESULTS ===
Dataset: sent140, Nodes: 20, Graph: erdos, Aggregation: balance
Attack: krum, 70.0% compromised
Final accuracy - Compromised: 0.6128, Honest: 0.6173
Overall test accuracy: mean=0.6142 ± 0.0045

=== BALANCE SUMMARY ===
Node 0: acceptance=0.381
Node 1: acceptance=0.427
Node 2: acceptance=0.400
Node 3: acceptance=0.438
Node 4: acceptance=0.427
Node 5: acceptance=0.340
Node 6: acceptance=0.357
Node 7: acceptance=0.357
Node 8: acceptance=0.360
Node 9: acceptance=0.377
Node 10: acceptance=0.300
Node 11: acceptance=0.421
Node 12: acceptance=0.400
Node 13: acceptance=0.308
Node 14: acceptance=0.340
Node 15: acceptance=0.345
Node 16: acceptance=0.308
Node 17: acceptance=0.500
Node 18: acceptance=0.381
Node 19: acceptance=0.381

=== PARALLEL EXECUTION TIME (realistic for distributed system) ===
  COMMUNICATION (max across nodes):
    - Full model transfer: 0.000s (0.0%)
  COMPUTATION (max across nodes):
    - Filtering: 0.068s (83.6%)
    - Aggregation: 0.013s (16.3%)
  TOTALS:
    - Total computation: 0.082s (100.0%)
    - Total communication: 0.000s (0.0%)
    - Total parallel time: 0.082s

=== PER-NODE AVERAGE TIME ===
  - Filtering: 0.054s
  - Aggregation: 0.007s
  - Model transfer: 0.000s
  - Total per node: 0.061s

=== TOTAL COMPUTATIONAL WORK (sum across all nodes) ===
  - Total filtering: 1.085s
  - Total aggregation: 0.138s
  - Total model transfer: 0.000s
  - Grand total: 1.223s
  - Mean acceptance rate: 0.377

BALANCE Algorithm Properties:
  - Model dimension: 1,174,986
  - No compression: Full parameter comparison
  - Theoretical complexity: O(deg(i)×d)
  - Approach: Full parameter filtering + averaging
