Device: cuda
Seed: 987654321
Loading 1 LEAF Sent140 train files...
LEAF Sent140 train: 254555 users, 908652 samples
Building vocabulary (max_size=10000)...
Vocabulary size: 10000
Loading 1 LEAF Sent140 test files...
LEAF Sent140 test: 254555 users, 286281 samples
Found 254555 train users, 254555 test users, 254555 common users
User sample counts range: 494 (max) to 1 (min)
Distributed ALL 254555 users across 20 clients
Users per client: 12727 (with 15 clients getting +1 user)
Train partition sizes: [44353, 44290, 44657, 44907, 44696, 45843, 45801, 45619, 45069, 45639, 45821, 45311, 45779, 46056, 45625, 45984, 46428, 44737, 45540, 46497]
Test partition sizes: [14232, 14235, 14266, 14217, 14238, 14373, 14346, 14334, 14294, 14373, 14344, 14302, 14354, 14362, 14320, 14395, 14389, 14257, 14251, 14399]
  Client 0: 44353 train samples, 2 unique classes
  Client 1: 44290 train samples, 2 unique classes
  Client 2: 44657 train samples, 2 unique classes
  Client 3: 44907 train samples, 2 unique classes
  Client 4: 44696 train samples, 2 unique classes
  Client 5: 45843 train samples, 2 unique classes
  Client 6: 45801 train samples, 2 unique classes
  Client 7: 45619 train samples, 2 unique classes
  Client 8: 45069 train samples, 2 unique classes
  Client 9: 45639 train samples, 2 unique classes
  Client 10: 45821 train samples, 2 unique classes
  Client 11: 45311 train samples, 2 unique classes
  Client 12: 45779 train samples, 2 unique classes
  Client 13: 46056 train samples, 2 unique classes
  Client 14: 45625 train samples, 2 unique classes
  Client 15: 45984 train samples, 2 unique classes
  Client 16: 46428 train samples, 2 unique classes
  Client 17: 44737 train samples, 2 unique classes
  Client 18: 45540 train samples, 2 unique classes
  Client 19: 46497 train samples, 2 unique classes
Will sample 4500 samples per client per epoch
Graph: erdos, nodes: 20, edges: 126
Degree statistics: avg=12.60, min=8, max=16
Attack: Compromised 6/20 nodes: [5, 12, 13, 14, 17, 18]
Attack type: directed_deviation, lambda: 1.0
Model variant: baseline
Model parameters: 1,174,986
Initial test acc across nodes: mean=0.4965 ± 0.0152
Round 001: test acc mean=0.5000 ± 0.0083 | min=0.4735 max=0.5160
         : test loss mean=2.6059 ± 1.0794
         : individual accs = ['0.503162', '0.510081', '0.509533', '0.496800', '0.490659', '0.499130', '0.497839', '0.515976', '0.507765', '0.473457', '0.500000', '0.500769', '0.500488', '0.497076', '0.504120', '0.500382', '0.501077', '0.497440', '0.497509', '0.496632']
         : correct/total = [(7161, 14232), (7261, 14235), (7269, 14266), (7063, 14217), (6986, 14238), (7174, 14373), (7142, 14346), (7396, 14334), (7258, 14294), (6805, 14373), (7172, 14344), (7162, 14302), (7184, 14354), (7139, 14362), (7219, 14320), (7203, 14395), (7210, 14389), (7092, 14257), (7090, 14251), (7151, 14399)]
         : compromised: 0.4993, honest: 0.5003
Round 002: test acc mean=0.4956 ± 0.0051 | min=0.4850 max=0.5072
         : test loss mean=4.0395 ± 1.5649
         : individual accs = ['0.491849', '0.491113', '0.484999', '0.492368', '0.495435', '0.491825', '0.498397', '0.495396', '0.491605', '0.496695', '0.498606', '0.492588', '0.502229', '0.507241', '0.496508', '0.500243', '0.498019', '0.502981', '0.488808', '0.495521']
         : correct/total = [(7000, 14232), (6991, 14235), (6919, 14266), (7000, 14217), (7054, 14238), (7069, 14373), (7150, 14346), (7101, 14334), (7027, 14294), (7139, 14373), (7152, 14344), (7045, 14302), (7209, 14354), (7285, 14362), (7110, 14320), (7201, 14395), (7166, 14389), (7171, 14257), (6966, 14251), (7135, 14399)]
         : compromised: 0.4983, honest: 0.4945
Round 003: test acc mean=0.5069 ± 0.0080 | min=0.4914 max=0.5250
         : test loss mean=0.7685 ± 0.0327
         : individual accs = ['0.510891', '0.513734', '0.513949', '0.507772', '0.505900', '0.505392', '0.524955', '0.505790', '0.524486', '0.506992', '0.500976', '0.508321', '0.500488', '0.491436', '0.504190', '0.501633', '0.499896', '0.496949', '0.511262', '0.503646']
         : correct/total = [(7271, 14232), (7313, 14235), (7332, 14266), (7219, 14217), (7203, 14238), (7264, 14373), (7531, 14346), (7250, 14334), (7497, 14294), (7287, 14373), (7186, 14344), (7270, 14302), (7184, 14354), (7058, 14362), (7220, 14320), (7221, 14395), (7193, 14389), (7085, 14257), (7286, 14251), (7252, 14399)]
         : compromised: 0.5016, honest: 0.5092
Round 004: test acc mean=0.5029 ± 0.0057 | min=0.4956 max=0.5173
         : test loss mean=1.1363 ± 0.4937
         : individual accs = ['0.503935', '0.517316', '0.497406', '0.507843', '0.510676', '0.501496', '0.498048', '0.500279', '0.498601', '0.507688', '0.497421', '0.498112', '0.511843', '0.502576', '0.506564', '0.495589', '0.497880', '0.498352', '0.504526', '0.502049']
         : correct/total = [(7172, 14232), (7364, 14235), (7096, 14266), (7220, 14217), (7271, 14238), (7208, 14373), (7145, 14346), (7171, 14334), (7127, 14294), (7297, 14373), (7135, 14344), (7124, 14302), (7347, 14354), (7218, 14362), (7254, 14320), (7134, 14395), (7164, 14389), (7105, 14257), (7190, 14251), (7229, 14399)]
         : compromised: 0.5042, honest: 0.5023
Round 005: test acc mean=0.5147 ± 0.0146 | min=0.4914 max=0.5444
         : test loss mean=0.7180 ± 0.0239
         : individual accs = ['0.510891', '0.511556', '0.519417', '0.507702', '0.505900', '0.539414', '0.525443', '0.544370', '0.520988', '0.506923', '0.500976', '0.537827', '0.500488', '0.491436', '0.514525', '0.501563', '0.534714', '0.497019', '0.511262', '0.511286']
         : correct/total = [(7271, 14232), (7282, 14235), (7410, 14266), (7218, 14217), (7203, 14238), (7753, 14373), (7538, 14346), (7803, 14334), (7447, 14294), (7286, 14373), (7186, 14344), (7692, 14302), (7184, 14354), (7058, 14362), (7368, 14320), (7220, 14395), (7694, 14389), (7086, 14257), (7286, 14251), (7362, 14399)]
         : compromised: 0.5090, honest: 0.5171
Round 006: test acc mean=0.5176 ± 0.0112 | min=0.4964 max=0.5424
         : test loss mean=0.8643 ± 0.2867
         : individual accs = ['0.525436', '0.504531', '0.515982', '0.527537', '0.542422', '0.508245', '0.497909', '0.510883', '0.496362', '0.528978', '0.522030', '0.509299', '0.522084', '0.524300', '0.523603', '0.517263', '0.514351', '0.519675', '0.531752', '0.509966']
         : correct/total = [(7478, 14232), (7182, 14235), (7361, 14266), (7500, 14217), (7723, 14238), (7305, 14373), (7143, 14346), (7323, 14334), (7095, 14294), (7603, 14373), (7488, 14344), (7284, 14302), (7494, 14354), (7530, 14362), (7498, 14320), (7446, 14395), (7401, 14389), (7409, 14257), (7578, 14251), (7343, 14399)]
         : compromised: 0.5216, honest: 0.5159
Round 007: test acc mean=0.5215 ± 0.0214 | min=0.4914 max=0.5641
         : test loss mean=0.7086 ± 0.0222
         : individual accs = ['0.511383', '0.508816', '0.556147', '0.507772', '0.506040', '0.548459', '0.530880', '0.532650', '0.523996', '0.507201', '0.504880', '0.532932', '0.500488', '0.491436', '0.559707', '0.503647', '0.531865', '0.497300', '0.511333', '0.564067']
         : correct/total = [(7278, 14232), (7243, 14235), (7934, 14266), (7219, 14217), (7205, 14238), (7883, 14373), (7616, 14346), (7635, 14334), (7490, 14294), (7290, 14373), (7242, 14344), (7622, 14302), (7184, 14354), (7058, 14362), (8015, 14320), (7250, 14395), (7653, 14389), (7090, 14257), (7287, 14251), (8122, 14399)]
         : compromised: 0.5181, honest: 0.5230
Round 008: test acc mean=0.5271 ± 0.0187 | min=0.4979 max=0.5577
         : test loss mean=0.7968 ± 0.2064
         : individual accs = ['0.535905', '0.497928', '0.524183', '0.554055', '0.541579', '0.504140', '0.499930', '0.514023', '0.498741', '0.549850', '0.536392', '0.509229', '0.546886', '0.557652', '0.523673', '0.527614', '0.514212', '0.538613', '0.545435', '0.522536']
         : correct/total = [(7627, 14232), (7088, 14235), (7478, 14266), (7877, 14217), (7711, 14238), (7246, 14373), (7172, 14346), (7368, 14334), (7129, 14294), (7903, 14373), (7694, 14344), (7283, 14302), (7850, 14354), (8009, 14362), (7499, 14320), (7595, 14395), (7399, 14389), (7679, 14257), (7773, 14251), (7524, 14399)]
         : compromised: 0.5361, honest: 0.5233
Round 009: test acc mean=0.5324 ± 0.0253 | min=0.4918 max=0.5839
         : test loss mean=0.7027 ± 0.0204
         : individual accs = ['0.541948', '0.512399', '0.577317', '0.507772', '0.506391', '0.537744', '0.542869', '0.536696', '0.539737', '0.506923', '0.521054', '0.536219', '0.500766', '0.491784', '0.573673', '0.539979', '0.532838', '0.507260', '0.550488', '0.583929']
         : correct/total = [(7713, 14232), (7294, 14235), (8236, 14266), (7219, 14217), (7210, 14238), (7729, 14373), (7788, 14346), (7693, 14334), (7715, 14294), (7286, 14373), (7474, 14344), (7669, 14302), (7188, 14354), (7063, 14362), (8215, 14320), (7773, 14395), (7667, 14389), (7232, 14257), (7845, 14251), (8408, 14399)]
         : compromised: 0.5270, honest: 0.5347
Round 010: test acc mean=0.5263 ± 0.0145 | min=0.4969 max=0.5490
         : test loss mean=0.7644 ± 0.1551
         : individual accs = ['0.546164', '0.508184', '0.523202', '0.532461', '0.548954', '0.510819', '0.508086', '0.515488', '0.496852', '0.524803', '0.536670', '0.516291', '0.523756', '0.544075', '0.533869', '0.531712', '0.513865', '0.540717', '0.545997', '0.524620']
         : correct/total = [(7773, 14232), (7234, 14235), (7464, 14266), (7570, 14217), (7816, 14238), (7342, 14373), (7289, 14346), (7389, 14334), (7102, 14294), (7543, 14373), (7698, 14344), (7384, 14302), (7518, 14354), (7814, 14362), (7645, 14320), (7654, 14395), (7394, 14389), (7709, 14257), (7781, 14251), (7554, 14399)]
         : compromised: 0.5332, honest: 0.5234

=== FINAL RESULTS ===
Dataset: sent140, Nodes: 20, Graph: erdos, Aggregation: d-fedavg
Attack: directed_deviation, 30.0% compromised
Final accuracy - Compromised: 0.5332, Honest: 0.5234
Overall test accuracy: mean=0.5263 ± 0.0145
