Device: cuda
Seed: 987654321
Loading 1 LEAF Sent140 train files...
LEAF Sent140 train: 254555 users, 908652 samples
Building vocabulary (max_size=10000)...
Vocabulary size: 10000
Loading 1 LEAF Sent140 test files...
LEAF Sent140 test: 254555 users, 286281 samples
Found 254555 train users, 254555 test users, 254555 common users
User sample counts range: 494 (max) to 1 (min)
Distributed ALL 254555 users across 20 clients
Users per client: 12727 (with 15 clients getting +1 user)
Train partition sizes: [44353, 44290, 44657, 44907, 44696, 45843, 45801, 45619, 45069, 45639, 45821, 45311, 45779, 46056, 45625, 45984, 46428, 44737, 45540, 46497]
Test partition sizes: [14232, 14235, 14266, 14217, 14238, 14373, 14346, 14334, 14294, 14373, 14344, 14302, 14354, 14362, 14320, 14395, 14389, 14257, 14251, 14399]
  Client 0: 44353 train samples, 2 unique classes
  Client 1: 44290 train samples, 2 unique classes
  Client 2: 44657 train samples, 2 unique classes
  Client 3: 44907 train samples, 2 unique classes
  Client 4: 44696 train samples, 2 unique classes
  Client 5: 45843 train samples, 2 unique classes
  Client 6: 45801 train samples, 2 unique classes
  Client 7: 45619 train samples, 2 unique classes
  Client 8: 45069 train samples, 2 unique classes
  Client 9: 45639 train samples, 2 unique classes
  Client 10: 45821 train samples, 2 unique classes
  Client 11: 45311 train samples, 2 unique classes
  Client 12: 45779 train samples, 2 unique classes
  Client 13: 46056 train samples, 2 unique classes
  Client 14: 45625 train samples, 2 unique classes
  Client 15: 45984 train samples, 2 unique classes
  Client 16: 46428 train samples, 2 unique classes
  Client 17: 44737 train samples, 2 unique classes
  Client 18: 45540 train samples, 2 unique classes
  Client 19: 46497 train samples, 2 unique classes
Will sample 4500 samples per client per epoch
Graph: erdos, nodes: 20, edges: 99
Degree statistics: avg=9.90, min=7, max=14
Attack: Compromised 6/20 nodes: [5, 12, 13, 14, 17, 18]
Attack type: backdoor, lambda: 1.0
Backdoor target label: 1, trigger size: 3
Model variant: baseline
Model parameters: 1,174,986
Initial test acc across nodes: mean=0.4965 ± 0.0152
Backdoor attack: Created poisoned datasets for 6 compromised nodes
Round 001: test acc mean=0.5022 ± 0.0242 | min=0.4837 max=0.6028
         : test loss mean=22.4290 ± 9.3697
         : individual accs = ['0.511172', '0.489708', '0.483738', '0.493283', '0.497191', '0.508175', '0.494075', '0.501535', '0.487127', '0.602797', '0.497421', '0.490980', '0.495472', '0.495683', '0.510615', '0.500313', '0.496629', '0.493021', '0.490562', '0.505174']
         : correct/total = [(7275, 14232), (6971, 14235), (6901, 14266), (7013, 14217), (7079, 14238), (7304, 14373), (7088, 14346), (7189, 14334), (6963, 14294), (8664, 14373), (7135, 14344), (7022, 14302), (7112, 14354), (7119, 14362), (7312, 14320), (7202, 14395), (7146, 14389), (7029, 14257), (6991, 14251), (7274, 14399)]
         : compromised: 0.4989, honest: 0.5037
Round 002: test acc mean=0.5065 ± 0.0278 | min=0.4831 max=0.6217
         : test loss mean=17.6117 ± 4.6857
         : individual accs = ['0.483137', '0.504250', '0.508342', '0.507913', '0.506953', '0.498226', '0.508783', '0.510744', '0.495732', '0.621652', '0.497699', '0.487065', '0.506409', '0.511698', '0.486941', '0.511428', '0.490027', '0.501508', '0.499754', '0.491423']
         : correct/total = [(6876, 14232), (7178, 14235), (7252, 14266), (7221, 14217), (7218, 14238), (7161, 14373), (7299, 14346), (7321, 14334), (7086, 14294), (8935, 14373), (7139, 14344), (6966, 14302), (7269, 14354), (7349, 14362), (6973, 14320), (7362, 14395), (7051, 14389), (7150, 14257), (7122, 14251), (7076, 14399)]
         : compromised: 0.5008, honest: 0.5089
Round 003: test acc mean=0.5031 ± 0.0065 | min=0.4882 max=0.5129
         : test loss mean=3.8420 ± 1.2132
         : individual accs = ['0.505059', '0.506568', '0.493691', '0.505240', '0.500913', '0.506923', '0.499721', '0.496023', '0.505947', '0.512906', '0.494771', '0.511886', '0.498258', '0.500905', '0.509427', '0.503508', '0.509834', '0.500666', '0.511754', '0.488228']
         : correct/total = [(7188, 14232), (7211, 14235), (7043, 14266), (7183, 14217), (7132, 14238), (7286, 14373), (7169, 14346), (7110, 14334), (7232, 14294), (7372, 14373), (7097, 14344), (7321, 14302), (7152, 14354), (7194, 14362), (7295, 14320), (7248, 14395), (7336, 14389), (7138, 14257), (7293, 14251), (7030, 14399)]
         : compromised: 0.5047, honest: 0.5024
Round 004: test acc mean=0.5055 ± 0.0059 | min=0.4923 max=0.5163
         : test loss mean=13.8683 ± 16.4486
         : individual accs = ['0.508994', '0.503337', '0.501893', '0.495745', '0.499579', '0.506018', '0.511571', '0.504674', '0.512383', '0.505044', '0.499861', '0.504125', '0.508081', '0.492341', '0.516341', '0.507537', '0.501564', '0.514344', '0.507964', '0.508160']
         : correct/total = [(7244, 14232), (7165, 14235), (7160, 14266), (7048, 14217), (7113, 14238), (7273, 14373), (7339, 14346), (7234, 14334), (7324, 14294), (7259, 14373), (7170, 14344), (7210, 14302), (7293, 14354), (7071, 14362), (7394, 14320), (7306, 14395), (7217, 14389), (7333, 14257), (7239, 14251), (7317, 14399)]
         : compromised: 0.5075, honest: 0.5046
Round 005: test acc mean=0.5043 ± 0.0050 | min=0.4918 max=0.5149
         : test loss mean=36.3304 ± 35.7492
         : individual accs = ['0.502389', '0.502915', '0.500421', '0.508194', '0.509763', '0.505462', '0.502858', '0.504535', '0.510634', '0.510680', '0.505020', '0.502237', '0.514909', '0.491784', '0.504050', '0.501285', '0.500799', '0.497370', '0.506631', '0.503924']
         : correct/total = [(7150, 14232), (7159, 14235), (7139, 14266), (7225, 14217), (7258, 14238), (7265, 14373), (7214, 14346), (7232, 14334), (7299, 14294), (7340, 14373), (7244, 14344), (7183, 14302), (7391, 14354), (7063, 14362), (7218, 14320), (7216, 14395), (7206, 14389), (7091, 14257), (7220, 14251), (7256, 14399)]
         : compromised: 0.5034, honest: 0.5047
Round 006: test acc mean=0.5066 ± 0.0052 | min=0.4986 max=0.5169
         : test loss mean=8.8844 ± 12.7638
         : individual accs = ['0.506886', '0.505444', '0.500140', '0.508405', '0.503652', '0.515620', '0.503485', '0.505581', '0.516930', '0.513602', '0.507250', '0.507062', '0.507106', '0.514483', '0.501885', '0.502327', '0.498784', '0.508031', '0.507333', '0.498576']
         : correct/total = [(7214, 14232), (7195, 14235), (7135, 14266), (7228, 14217), (7171, 14238), (7411, 14373), (7223, 14346), (7247, 14334), (7389, 14294), (7382, 14373), (7276, 14344), (7252, 14302), (7279, 14354), (7389, 14362), (7187, 14320), (7231, 14395), (7177, 14389), (7243, 14257), (7230, 14251), (7179, 14399)]
         : compromised: 0.5091, honest: 0.5056
Round 007: test acc mean=0.5023 ± 0.0087 | min=0.4683 max=0.5120
         : test loss mean=2.9110 ± 3.8751
         : individual accs = ['0.501967', '0.502424', '0.502944', '0.502849', '0.499157', '0.506992', '0.507877', '0.468327', '0.501889', '0.510123', '0.504044', '0.505034', '0.502229', '0.511976', '0.508520', '0.497603', '0.503232', '0.503612', '0.496877', '0.508855']
         : correct/total = [(7144, 14232), (7152, 14235), (7175, 14266), (7149, 14217), (7107, 14238), (7287, 14373), (7286, 14346), (6713, 14334), (7174, 14294), (7332, 14373), (7230, 14344), (7223, 14302), (7209, 14354), (7353, 14362), (7282, 14320), (7163, 14395), (7241, 14389), (7180, 14257), (7081, 14251), (7327, 14399)]
         : compromised: 0.5050, honest: 0.5012
Round 008: test acc mean=0.5036 ± 0.0063 | min=0.4883 max=0.5136
         : test loss mean=19.5147 ± 33.3175
         : individual accs = ['0.503373', '0.511837', '0.502173', '0.502005', '0.500913', '0.504766', '0.507807', '0.495396', '0.488317', '0.499200', '0.507320', '0.504755', '0.511983', '0.511141', '0.495810', '0.498576', '0.499479', '0.513572', '0.509087', '0.505452']
         : correct/total = [(7164, 14232), (7286, 14235), (7164, 14266), (7137, 14217), (7132, 14238), (7255, 14373), (7285, 14346), (7101, 14334), (6980, 14294), (7175, 14373), (7277, 14344), (7219, 14302), (7349, 14354), (7341, 14362), (7100, 14320), (7177, 14395), (7187, 14389), (7322, 14257), (7255, 14251), (7278, 14399)]
         : compromised: 0.5077, honest: 0.5019
Round 009: test acc mean=0.5033 ± 0.0055 | min=0.4885 max=0.5100
         : test loss mean=48.7285 ± 84.4945
         : individual accs = ['0.505340', '0.505866', '0.505958', '0.505381', '0.508007', '0.502609', '0.506971', '0.495186', '0.488457', '0.506505', '0.503277', '0.502797', '0.509057', '0.507589', '0.495810', '0.498367', '0.499757', '0.509995', '0.500175', '0.509688']
         : correct/total = [(7192, 14232), (7201, 14235), (7218, 14266), (7185, 14217), (7233, 14238), (7224, 14373), (7273, 14346), (7098, 14334), (6982, 14294), (7280, 14373), (7219, 14344), (7191, 14302), (7307, 14354), (7290, 14362), (7100, 14320), (7174, 14395), (7191, 14389), (7271, 14257), (7128, 14251), (7339, 14399)]
         : compromised: 0.5042, honest: 0.5030
Round 010: test acc mean=0.5061 ± 0.0064 | min=0.4885 max=0.5157
         : test loss mean=45.7067 ± 109.1515
         : individual accs = ['0.508642', '0.515701', '0.509814', '0.497151', '0.509201', '0.508105', '0.513523', '0.508721', '0.488457', '0.504348', '0.500349', '0.507831', '0.506479', '0.511280', '0.512640', '0.498367', '0.499757', '0.503612', '0.508947', '0.509480']
         : correct/total = [(7239, 14232), (7341, 14235), (7273, 14266), (7068, 14217), (7250, 14238), (7303, 14373), (7367, 14346), (7292, 14334), (6982, 14294), (7249, 14373), (7177, 14344), (7263, 14302), (7270, 14354), (7343, 14362), (7341, 14320), (7174, 14395), (7191, 14389), (7180, 14257), (7253, 14251), (7336, 14399)]
         : compromised: 0.5085, honest: 0.5051

=== FINAL RESULTS ===
Dataset: sent140, Nodes: 20, Graph: erdos, Aggregation: krum
Attack: backdoor, 30.0% compromised
Final accuracy - Compromised: 0.5085, Honest: 0.5051
Overall test accuracy: mean=0.5061 ± 0.0064

=== BACKDOOR ATTACK SUCCESS RATE (ASR) ===
Target label: 1
Trigger size: 3x3
Overall ASR: 0.6304 ± 0.1851
Honest nodes ASR: 0.6434 ± 0.2066
Compromised nodes ASR: 0.6001 ± 0.1154
Note: Higher ASR indicates more successful backdoor attack
