Device: cuda
Seed: 987654321
Loading 1 LEAF Sent140 train files...
LEAF Sent140 train: 254555 users, 908652 samples
Building vocabulary (max_size=10000)...
Vocabulary size: 10000
Loading 1 LEAF Sent140 test files...
LEAF Sent140 test: 254555 users, 286281 samples
Found 254555 train users, 254555 test users, 254555 common users
User sample counts range: 494 (max) to 1 (min)
Distributed ALL 254555 users across 20 clients
Users per client: 12727 (with 15 clients getting +1 user)
Train partition sizes: [44353, 44290, 44657, 44907, 44696, 45843, 45801, 45619, 45069, 45639, 45821, 45311, 45779, 46056, 45625, 45984, 46428, 44737, 45540, 46497]
Test partition sizes: [14232, 14235, 14266, 14217, 14238, 14373, 14346, 14334, 14294, 14373, 14344, 14302, 14354, 14362, 14320, 14395, 14389, 14257, 14251, 14399]
  Client 0: 44353 train samples, 2 unique classes
  Client 1: 44290 train samples, 2 unique classes
  Client 2: 44657 train samples, 2 unique classes
  Client 3: 44907 train samples, 2 unique classes
  Client 4: 44696 train samples, 2 unique classes
  Client 5: 45843 train samples, 2 unique classes
  Client 6: 45801 train samples, 2 unique classes
  Client 7: 45619 train samples, 2 unique classes
  Client 8: 45069 train samples, 2 unique classes
  Client 9: 45639 train samples, 2 unique classes
  Client 10: 45821 train samples, 2 unique classes
  Client 11: 45311 train samples, 2 unique classes
  Client 12: 45779 train samples, 2 unique classes
  Client 13: 46056 train samples, 2 unique classes
  Client 14: 45625 train samples, 2 unique classes
  Client 15: 45984 train samples, 2 unique classes
  Client 16: 46428 train samples, 2 unique classes
  Client 17: 44737 train samples, 2 unique classes
  Client 18: 45540 train samples, 2 unique classes
  Client 19: 46497 train samples, 2 unique classes
Will sample 4500 samples per client per epoch
Graph: ring, nodes: 20, edges: 20
Degree statistics: avg=2.00, min=2, max=2
Attack: Compromised 2/20 nodes: [5, 13]
Attack type: backdoor, lambda: 1.0
Backdoor target label: 1, trigger size: 3
Model variant: baseline
Model parameters: 1,174,986
Initial test acc across nodes: mean=0.4953 ± 0.0174
Backdoor attack: Created poisoned datasets for 2 compromised nodes
Round 001: test acc mean=0.5142 ± 0.0165 | min=0.4882 max=0.5652
         : test loss mean=1.3028 ± 1.0056
         : individual accs = ['0.534992', '0.565227', '0.488224', '0.512415', '0.510395', '0.505183', '0.506483', '0.524766', '0.502169', '0.533779', '0.502022', '0.511677', '0.502926', '0.502367', '0.499860', '0.507815', '0.518313', '0.529564', '0.515753', '0.510035']
         : correct/total = [(7614, 14232), (8046, 14235), (6965, 14266), (7285, 14217), (7267, 14238), (7261, 14373), (7266, 14346), (7522, 14334), (7178, 14294), (7672, 14373), (7201, 14344), (7318, 14302), (7219, 14354), (7215, 14362), (7158, 14320), (7310, 14395), (7458, 14389), (7550, 14257), (7350, 14251), (7344, 14399)]
         : compromised: 0.5038, honest: 0.5154
Round 002: test acc mean=0.5519 ± 0.0549 | min=0.4915 max=0.6377
         : test loss mean=1.4409 ± 1.1998
         : individual accs = ['0.607223', '0.637654', '0.627085', '0.491524', '0.501264', '0.499269', '0.499861', '0.507255', '0.539807', '0.627079', '0.623048', '0.493078', '0.503623', '0.502576', '0.506844', '0.500729', '0.593092', '0.593673', '0.582906', '0.601083']
         : correct/total = [(8642, 14232), (9077, 14235), (8946, 14266), (6988, 14217), (7137, 14238), (7176, 14373), (7171, 14346), (7271, 14334), (7716, 14294), (9013, 14373), (8937, 14344), (7052, 14302), (7229, 14354), (7218, 14362), (7258, 14320), (7208, 14395), (8534, 14389), (8464, 14257), (8307, 14251), (8655, 14399)]
         : compromised: 0.5009, honest: 0.5576
Round 003: test acc mean=0.5532 ± 0.0511 | min=0.4910 max=0.6273
         : test loss mean=0.7521 ± 0.1649
         : individual accs = ['0.593170', '0.619951', '0.590004', '0.491735', '0.533923', '0.507410', '0.502231', '0.507325', '0.571429', '0.623391', '0.549080', '0.507621', '0.514769', '0.506824', '0.490992', '0.497603', '0.614080', '0.627271', '0.627324', '0.587194']
         : correct/total = [(8442, 14232), (8825, 14235), (8417, 14266), (6991, 14217), (7602, 14238), (7293, 14373), (7205, 14346), (7272, 14334), (8168, 14294), (8960, 14373), (7876, 14344), (7260, 14302), (7389, 14354), (7279, 14362), (7031, 14320), (7163, 14395), (8836, 14389), (8943, 14257), (8940, 14251), (8455, 14399)]
         : compromised: 0.5071, honest: 0.5583
Round 004: test acc mean=0.5480 ± 0.0638 | min=0.4857 max=0.6420
         : test loss mean=0.8237 ± 0.2986
         : individual accs = ['0.639545', '0.642009', '0.487803', '0.485686', '0.503933', '0.488068', '0.495957', '0.493024', '0.498181', '0.634175', '0.535904', '0.507062', '0.503205', '0.494290', '0.513687', '0.520181', '0.610536', '0.631199', '0.634201', '0.640739']
         : correct/total = [(9102, 14232), (9139, 14235), (6959, 14266), (6905, 14217), (7175, 14238), (7015, 14373), (7115, 14346), (7067, 14334), (7121, 14294), (9115, 14373), (7687, 14344), (7252, 14302), (7223, 14354), (7099, 14362), (7356, 14320), (7488, 14395), (8785, 14389), (8999, 14257), (9038, 14251), (9226, 14399)]
         : compromised: 0.4912, honest: 0.5543
Round 005: test acc mean=0.5693 ± 0.0590 | min=0.4939 max=0.6445
         : test loss mean=0.7333 ± 0.1350
         : individual accs = ['0.640528', '0.644468', '0.570938', '0.494549', '0.530833', '0.495930', '0.493866', '0.515557', '0.582342', '0.638558', '0.632390', '0.534191', '0.534276', '0.506824', '0.498603', '0.538659', '0.631038', '0.626569', '0.635043', '0.640669']
         : correct/total = [(9116, 14232), (9174, 14235), (8145, 14266), (7031, 14217), (7558, 14238), (7128, 14373), (7085, 14346), (7390, 14334), (8324, 14294), (9178, 14373), (9071, 14344), (7640, 14302), (7669, 14354), (7279, 14362), (7140, 14320), (7754, 14395), (9080, 14389), (8933, 14257), (9050, 14251), (9225, 14399)]
         : compromised: 0.5014, honest: 0.5768
Round 006: test acc mean=0.5718 ± 0.0578 | min=0.4924 max=0.6492
         : test loss mean=0.7429 ± 0.1637
         : individual accs = ['0.643901', '0.649175', '0.619375', '0.555602', '0.500351', '0.503722', '0.498745', '0.536626', '0.603190', '0.624365', '0.557446', '0.548804', '0.512122', '0.492411', '0.516341', '0.525877', '0.624574', '0.638984', '0.635534', '0.648587']
         : correct/total = [(9164, 14232), (9241, 14235), (8836, 14266), (7899, 14217), (7124, 14238), (7240, 14373), (7155, 14346), (7692, 14334), (8622, 14294), (8974, 14373), (7996, 14344), (7849, 14302), (7351, 14354), (7072, 14362), (7394, 14320), (7570, 14395), (8987, 14389), (9110, 14257), (9057, 14251), (9339, 14399)]
         : compromised: 0.4981, honest: 0.5800
Round 007: test acc mean=0.5918 ± 0.0584 | min=0.4913 max=0.6510
         : test loss mean=0.6926 ± 0.0729
         : individual accs = ['0.650998', '0.649526', '0.649096', '0.605894', '0.545723', '0.491268', '0.504810', '0.514441', '0.632223', '0.644055', '0.641523', '0.590127', '0.513585', '0.506545', '0.538547', '0.600834', '0.637848', '0.636670', '0.634482', '0.647614']
         : correct/total = [(9265, 14232), (9246, 14235), (9260, 14266), (8614, 14217), (7770, 14238), (7061, 14373), (7242, 14346), (7374, 14334), (9037, 14294), (9257, 14373), (9202, 14344), (8440, 14302), (7372, 14354), (7275, 14362), (7712, 14320), (8649, 14395), (9178, 14389), (9077, 14257), (9042, 14251), (9325, 14399)]
         : compromised: 0.4989, honest: 0.6021
Round 008: test acc mean=0.5888 ± 0.0615 | min=0.4755 max=0.6508
         : test loss mean=0.7023 ± 0.0969
         : individual accs = ['0.650787', '0.629645', '0.635287', '0.521840', '0.512783', '0.475544', '0.518124', '0.622785', '0.636631', '0.646907', '0.630368', '0.628793', '0.517904', '0.500209', '0.535265', '0.541646', '0.630482', '0.648173', '0.645148', '0.647267']
         : correct/total = [(9262, 14232), (8963, 14235), (9063, 14266), (7419, 14217), (7301, 14238), (6835, 14373), (7433, 14346), (8927, 14334), (9100, 14294), (9298, 14373), (9042, 14344), (8993, 14302), (7434, 14354), (7184, 14362), (7665, 14320), (7797, 14395), (9072, 14389), (9241, 14257), (9194, 14251), (9320, 14399)]
         : compromised: 0.4879, honest: 0.6000
Round 009: test acc mean=0.5957 ± 0.0538 | min=0.4954 max=0.6529
         : test loss mean=0.6844 ± 0.0671
         : individual accs = ['0.642566', '0.637302', '0.646222', '0.575719', '0.552957', '0.495443', '0.541614', '0.523301', '0.629005', '0.652891', '0.646542', '0.572368', '0.538596', '0.506406', '0.562430', '0.598263', '0.641949', '0.646910', '0.651253', '0.652684']
         : correct/total = [(9145, 14232), (9072, 14235), (9219, 14266), (8185, 14217), (7873, 14238), (7121, 14373), (7770, 14346), (7501, 14334), (8991, 14294), (9384, 14373), (9274, 14344), (8186, 14302), (7731, 14354), (7273, 14362), (8054, 14320), (8612, 14395), (9237, 14389), (9223, 14257), (9281, 14251), (9398, 14399)]
         : compromised: 0.5009, honest: 0.6063
Round 010: test acc mean=0.6021 ± 0.0604 | min=0.4856 max=0.6631
         : test loss mean=0.6881 ± 0.0858
         : individual accs = ['0.662591', '0.655848', '0.640053', '0.555954', '0.532097', '0.485563', '0.520981', '0.645598', '0.645306', '0.655187', '0.649610', '0.596560', '0.537133', '0.513856', '0.524302', '0.605905', '0.643756', '0.653504', '0.655393', '0.663102']
         : correct/total = [(9430, 14232), (9336, 14235), (9131, 14266), (7904, 14217), (7576, 14238), (6979, 14373), (7474, 14346), (9254, 14334), (9224, 14294), (9417, 14373), (9318, 14344), (8532, 14302), (7710, 14354), (7380, 14362), (7508, 14320), (8722, 14395), (9263, 14389), (9317, 14257), (9340, 14251), (9548, 14399)]
         : compromised: 0.4997, honest: 0.6135

=== FINAL RESULTS ===
Dataset: sent140, Nodes: 20, Graph: ring, Aggregation: d-fedavg
Attack: backdoor, 10.0% compromised
Final accuracy - Compromised: 0.4997, Honest: 0.6135
Overall test accuracy: mean=0.6021 ± 0.0604

=== BACKDOOR ATTACK SUCCESS RATE (ASR) ===
Target label: 1
Trigger size: 3x3
Overall ASR: 0.6384 ± 0.1632
Honest nodes ASR: 0.6185 ± 0.1590
Compromised nodes ASR: 0.8175 ± 0.0579
Note: Higher ASR indicates more successful backdoor attack
