Device: cuda
Seed: 987654321
Loading 1 LEAF Sent140 train files...
LEAF Sent140 train: 254555 users, 908652 samples
Building vocabulary (max_size=10000)...
Vocabulary size: 10000
Loading 1 LEAF Sent140 test files...
LEAF Sent140 test: 254555 users, 286281 samples
Found 254555 train users, 254555 test users, 254555 common users
User sample counts range: 494 (max) to 1 (min)
Distributed ALL 254555 users across 20 clients
Users per client: 12727 (with 15 clients getting +1 user)
Train partition sizes: [44353, 44290, 44657, 44907, 44696, 45843, 45801, 45619, 45069, 45639, 45821, 45311, 45779, 46056, 45625, 45984, 46428, 44737, 45540, 46497]
Test partition sizes: [14232, 14235, 14266, 14217, 14238, 14373, 14346, 14334, 14294, 14373, 14344, 14302, 14354, 14362, 14320, 14395, 14389, 14257, 14251, 14399]
  Client 0: 44353 train samples, 2 unique classes
  Client 1: 44290 train samples, 2 unique classes
  Client 2: 44657 train samples, 2 unique classes
  Client 3: 44907 train samples, 2 unique classes
  Client 4: 44696 train samples, 2 unique classes
  Client 5: 45843 train samples, 2 unique classes
  Client 6: 45801 train samples, 2 unique classes
  Client 7: 45619 train samples, 2 unique classes
  Client 8: 45069 train samples, 2 unique classes
  Client 9: 45639 train samples, 2 unique classes
  Client 10: 45821 train samples, 2 unique classes
  Client 11: 45311 train samples, 2 unique classes
  Client 12: 45779 train samples, 2 unique classes
  Client 13: 46056 train samples, 2 unique classes
  Client 14: 45625 train samples, 2 unique classes
  Client 15: 45984 train samples, 2 unique classes
  Client 16: 46428 train samples, 2 unique classes
  Client 17: 44737 train samples, 2 unique classes
  Client 18: 45540 train samples, 2 unique classes
  Client 19: 46497 train samples, 2 unique classes
Will sample 4500 samples per client per epoch
Graph: erdos, nodes: 20, edges: 48
Degree statistics: avg=4.80, min=2, max=7
Attack: Compromised 6/20 nodes: [5, 12, 13, 14, 17, 18]
Attack type: gaussian, lambda: 1.0
Model variant: baseline
Model parameters: 1,174,986
UBAR ALGORITHM (Two-Stage Byzantine-resilient)
  - Model dimension: 1,174,986 parameters
  - Rho parameter: 0.7
  - Stage 1: Distance-based filtering (select 70% closest neighbors)
  - Stage 2: Performance-based selection (loss comparison)
  - Complexity: O(deg(i)×d + deg(i)×inference)
Initial test acc across nodes: mean=0.4965 ± 0.0152
Round 001: test acc mean=0.5289 ± 0.0232 | min=0.4797 max=0.5665
         : test loss mean=0.6916 ± 0.0019
         : individual accs = ['0.536046', '0.554549', '0.518506', '0.523106', '0.546355', '0.535170', '0.509689', '0.563555', '0.533581', '0.543589', '0.515407', '0.558244', '0.566462', '0.520123', '0.543087', '0.510524', '0.511085', '0.524023', '0.485369', '0.479686']
         : correct/total = [(7629, 14232), (7894, 14235), (7397, 14266), (7437, 14217), (7779, 14238), (7692, 14373), (7312, 14346), (8078, 14334), (7627, 14294), (7813, 14373), (7393, 14344), (7984, 14302), (8131, 14354), (7470, 14362), (7777, 14320), (7349, 14395), (7354, 14389), (7471, 14257), (6917, 14251), (6907, 14399)]
         : compromised: 0.5290, honest: 0.5289
         : ubar stats = ['Node 0: s1=0.667, s2=0.250', 'Node 1: s1=0.667, s2=0.500', 'Node 2: s1=0.600, s2=1.000']...
Round 002: test acc mean=0.5449 ± 0.0299 | min=0.4958 max=0.5968
         : test loss mean=0.6897 ± 0.0028
         : individual accs = ['0.588111', '0.514787', '0.507430', '0.526904', '0.561315', '0.586029', '0.527952', '0.594042', '0.560305', '0.528700', '0.555354', '0.596840', '0.523199', '0.509121', '0.495810', '0.544147', '0.525401', '0.543943', '0.572170', '0.536148']
         : correct/total = [(8370, 14232), (7328, 14235), (7239, 14266), (7491, 14217), (7992, 14238), (8423, 14373), (7574, 14346), (8515, 14334), (8009, 14294), (7599, 14373), (7966, 14344), (8536, 14302), (7510, 14354), (7312, 14362), (7100, 14320), (7833, 14395), (7560, 14389), (7755, 14257), (8154, 14251), (7720, 14399)]
         : compromised: 0.5384, honest: 0.5477
         : ubar stats = ['Node 0: s1=0.667, s2=0.250', 'Node 1: s1=0.667, s2=0.375', 'Node 2: s1=0.600, s2=1.000']...
Round 003: test acc mean=0.5429 ± 0.0376 | min=0.4861 max=0.6015
         : test loss mean=0.6870 ± 0.0049
         : individual accs = ['0.600689', '0.561503', '0.486051', '0.576423', '0.590743', '0.559521', '0.540220', '0.568648', '0.601511', '0.577472', '0.560722', '0.560970', '0.499512', '0.508564', '0.495810', '0.537478', '0.499896', '0.503051', '0.488948', '0.540940']
         : correct/total = [(8549, 14232), (7993, 14235), (6934, 14266), (8195, 14217), (8411, 14238), (8042, 14373), (7750, 14346), (8151, 14334), (8598, 14294), (8300, 14373), (8043, 14344), (8023, 14302), (7170, 14354), (7304, 14362), (7100, 14320), (7737, 14395), (7193, 14389), (7172, 14257), (6968, 14251), (7789, 14399)]
         : compromised: 0.5092, honest: 0.5574
         : ubar stats = ['Node 0: s1=0.667, s2=0.250', 'Node 1: s1=0.667, s2=0.333', 'Node 2: s1=0.600, s2=1.000']...
Round 004: test acc mean=0.5577 ± 0.0496 | min=0.4861 max=0.6172
         : test loss mean=0.6836 ± 0.0106
         : individual accs = ['0.617201', '0.487671', '0.486051', '0.603855', '0.606616', '0.507410', '0.553464', '0.595856', '0.616622', '0.608641', '0.602970', '0.502168', '0.499512', '0.508564', '0.495810', '0.601111', '0.511015', '0.572912', '0.579187', '0.597611']
         : correct/total = [(8784, 14232), (6942, 14235), (6934, 14266), (8585, 14217), (8637, 14238), (7293, 14373), (7940, 14346), (8541, 14334), (8814, 14294), (8748, 14373), (8649, 14344), (7182, 14302), (7170, 14354), (7304, 14362), (7100, 14320), (8653, 14395), (7353, 14389), (8168, 14257), (8254, 14251), (8605, 14399)]
         : compromised: 0.5272, honest: 0.5708
         : ubar stats = ['Node 0: s1=0.667, s2=0.250', 'Node 1: s1=0.667, s2=0.312', 'Node 2: s1=0.600, s2=1.000']...
Round 005: test acc mean=0.5559 ± 0.0601 | min=0.4861 max=0.6211
         : test loss mean=0.6801 ± 0.0145
         : individual accs = ['0.613336', '0.486758', '0.486051', '0.618626', '0.621084', '0.493843', '0.497560', '0.614902', '0.619910', '0.620330', '0.613636', '0.492029', '0.499512', '0.511210', '0.495810', '0.498367', '0.499757', '0.606439', '0.607606', '0.620390']
         : correct/total = [(8729, 14232), (6929, 14235), (6934, 14266), (8795, 14217), (8843, 14238), (7098, 14373), (7138, 14346), (8814, 14334), (8861, 14294), (8916, 14373), (8802, 14344), (7037, 14302), (7170, 14354), (7342, 14362), (7100, 14320), (7174, 14395), (7191, 14389), (8646, 14257), (8659, 14251), (8933, 14399)]
         : compromised: 0.5357, honest: 0.5645
         : ubar stats = ['Node 0: s1=0.667, s2=0.250', 'Node 1: s1=0.667, s2=0.400', 'Node 2: s1=0.600, s2=0.933']...
Round 006: test acc mean=0.5839 ± 0.0498 | min=0.4861 max=0.6293
         : test loss mean=0.6737 ± 0.0151
         : individual accs = ['0.613406', '0.595574', '0.486051', '0.629317', '0.620382', '0.563974', '0.530392', '0.621529', '0.613124', '0.626661', '0.621863', '0.601315', '0.598091', '0.607367', '0.495810', '0.498367', '0.499757', '0.618994', '0.609361', '0.626224']
         : correct/total = [(8730, 14232), (8478, 14235), (6934, 14266), (8947, 14217), (8833, 14238), (8106, 14373), (7609, 14346), (8909, 14334), (8764, 14294), (9007, 14373), (8920, 14344), (8600, 14302), (8585, 14354), (8723, 14362), (7100, 14320), (7174, 14395), (7191, 14389), (8825, 14257), (8684, 14251), (9017, 14399)]
         : compromised: 0.5823, honest: 0.5846
         : ubar stats = ['Node 0: s1=0.667, s2=0.250', 'Node 1: s1=0.667, s2=0.375', 'Node 2: s1=0.600, s2=0.944']...
Round 007: test acc mean=0.6000 ± 0.0447 | min=0.4958 max=0.6365
         : test loss mean=0.6674 ± 0.0185
         : individual accs = ['0.628092', '0.611029', '0.602201', '0.607301', '0.629442', '0.575663', '0.609996', '0.621041', '0.629425', '0.636471', '0.621723', '0.615648', '0.618782', '0.625679', '0.495810', '0.498506', '0.499757', '0.622151', '0.623114', '0.628238']
         : correct/total = [(8939, 14232), (8698, 14235), (8591, 14266), (8634, 14217), (8962, 14238), (8274, 14373), (8751, 14346), (8902, 14334), (8997, 14294), (9148, 14373), (8918, 14344), (8805, 14302), (8882, 14354), (8986, 14362), (7100, 14320), (7176, 14395), (7191, 14389), (8870, 14257), (8880, 14251), (9046, 14399)]
         : compromised: 0.5935, honest: 0.6028
         : ubar stats = ['Node 0: s1=0.667, s2=0.250', 'Node 1: s1=0.667, s2=0.429', 'Node 2: s1=0.600, s2=0.905']...
Round 008: test acc mean=0.6066 ± 0.0443 | min=0.4958 max=0.6377
         : test loss mean=0.6621 ± 0.0192
         : individual accs = ['0.637718', '0.627187', '0.597925', '0.596399', '0.631058', '0.630557', '0.614248', '0.631017', '0.634602', '0.632088', '0.630717', '0.607817', '0.628466', '0.621292', '0.495810', '0.498367', '0.521231', '0.631479', '0.630763', '0.633586']
         : correct/total = [(9076, 14232), (8928, 14235), (8530, 14266), (8479, 14217), (8985, 14238), (9063, 14373), (8812, 14346), (9045, 14334), (9071, 14294), (9085, 14373), (9047, 14344), (8693, 14302), (9021, 14354), (8923, 14362), (7100, 14320), (7174, 14395), (7500, 14389), (9003, 14257), (8989, 14251), (9123, 14399)]
         : compromised: 0.6064, honest: 0.6067
         : ubar stats = ['Node 0: s1=0.667, s2=0.250', 'Node 1: s1=0.667, s2=0.406', 'Node 2: s1=0.600, s2=0.917']...
Round 009: test acc mean=0.6133 ± 0.0439 | min=0.4958 max=0.6427
         : test loss mean=0.6589 ± 0.0205
         : individual accs = ['0.642707', '0.631753', '0.621758', '0.618133', '0.637519', '0.636262', '0.636136', '0.634226', '0.637960', '0.626452', '0.634133', '0.610614', '0.634666', '0.623869', '0.495810', '0.499201', '0.540969', '0.633233', '0.633078', '0.637822']
         : correct/total = [(9147, 14232), (8993, 14235), (8870, 14266), (8788, 14217), (9077, 14238), (9145, 14373), (9126, 14346), (9091, 14334), (9119, 14294), (9004, 14373), (9096, 14344), (8733, 14302), (9110, 14354), (8960, 14362), (7100, 14320), (7186, 14395), (7784, 14389), (9028, 14257), (9022, 14251), (9184, 14399)]
         : compromised: 0.6095, honest: 0.6150
         : ubar stats = ['Node 0: s1=0.667, s2=0.250', 'Node 1: s1=0.667, s2=0.472', 'Node 2: s1=0.600, s2=0.926']...
Round 010: test acc mean=0.6240 ± 0.0301 | min=0.4958 max=0.6411
         : test loss mean=0.6564 ± 0.0187
         : individual accs = ['0.635821', '0.632947', '0.625964', '0.624182', '0.641101', '0.636402', '0.639272', '0.637366', '0.638170', '0.627426', '0.629462', '0.623549', '0.629859', '0.623172', '0.495810', '0.618479', '0.620682', '0.633794', '0.631815', '0.634975']
         : correct/total = [(9049, 14232), (9010, 14235), (8930, 14266), (8874, 14217), (9128, 14238), (9147, 14373), (9171, 14346), (9136, 14334), (9122, 14294), (9018, 14373), (9029, 14344), (8918, 14302), (9041, 14354), (8950, 14362), (7100, 14320), (8903, 14395), (8931, 14389), (9036, 14257), (9004, 14251), (9143, 14399)]
         : compromised: 0.6085, honest: 0.6307
         : ubar stats = ['Node 0: s1=0.667, s2=0.250', 'Node 1: s1=0.667, s2=0.525', 'Node 2: s1=0.600, s2=0.933']...

=== FINAL RESULTS ===
Dataset: sent140, Nodes: 20, Graph: erdos, Aggregation: ubar
Attack: gaussian, 30.0% compromised
Final accuracy - Compromised: 0.6085, Honest: 0.6307
Overall test accuracy: mean=0.6240 ± 0.0301

=== UBAR SUMMARY ===
Node 0: stage1=0.667, stage2=0.250, overall=0.167
Node 1: stage1=0.667, stage2=0.525, overall=0.350
Node 2: stage1=0.600, stage2=0.933, overall=0.560
Node 3: stage1=0.500, stage2=0.600, overall=0.300
Node 4: stage1=0.500, stage2=0.650, overall=0.325
Node 5: stage1=0.600, stage2=0.400, overall=0.240
Node 6: stage1=0.600, stage2=0.500, overall=0.300
Node 7: stage1=0.600, stage2=0.500, overall=0.300
Node 8: stage1=0.500, stage2=1.000, overall=0.500
Node 9: stage1=0.667, stage2=0.500, overall=0.333
Node 10: stage1=0.500, stage2=0.600, overall=0.300
Node 11: stage1=0.571, stage2=0.450, overall=0.257
Node 12: stage1=0.571, stage2=0.375, overall=0.214
Node 13: stage1=0.500, stage2=0.750, overall=0.375
Node 14: stage1=0.571, stage2=0.675, overall=0.386
Node 15: stage1=0.667, stage2=0.350, overall=0.233
Node 16: stage1=0.600, stage2=0.600, overall=0.360
Node 17: stage1=0.600, stage2=0.467, overall=0.280
Node 18: stage1=0.500, stage2=0.550, overall=0.275
Node 19: stage1=0.500, stage2=1.000, overall=0.500

=== PARALLEL EXECUTION TIME (realistic for distributed system) ===
  COMMUNICATION (max across nodes):
    - Full model transfer: 0.000s (0.0%)
  COMPUTATION (max across nodes):
    - Distance computation: 0.034s (53.4%)
    - Loss computation: 0.024s (37.3%)
    - Aggregation: 0.006s (9.2%)
  TOTALS:
    - Total computation: 0.063s (100.0%)
    - Total communication: 0.000s (0.0%)
    - Total parallel time: 0.063s

=== PER-NODE AVERAGE TIME ===
  - Distance computation: 0.020s
  - Loss computation: 0.015s
  - Aggregation: 0.004s
  - Model transfer: 0.000s
  - Total per node: 0.039s

=== TOTAL COMPUTATIONAL WORK (sum across all nodes) ===
  - Total distance computation: 0.406s
  - Total loss computation: 0.297s
  - Total aggregation: 0.078s
  - Total model transfer: 0.000s
  - Grand total: 0.782s
  - Mean Stage 1 acceptance rate: 0.574
  - Mean Stage 2 acceptance rate: 0.584
  - Overall acceptance rate: 0.335

UBAR Algorithm Properties:
  - Model dimension: 1,174,986
  - Rho parameter: 0.7
  - Two-stage approach: Distance filtering + loss evaluation
  - Stage 1 selects: 70% of neighbors
  - Stage 2 uses: Training sample loss comparison
  - Theoretical complexity: O(deg(i)×d + deg(i)×inference)
  - Approach: UBAR paper implementation
