Device: cuda
Seed: 987654321
Loading 1 LEAF Sent140 train files...
LEAF Sent140 train: 254555 users, 908652 samples
Building vocabulary (max_size=10000)...
Vocabulary size: 10000
Loading 1 LEAF Sent140 test files...
LEAF Sent140 test: 254555 users, 286281 samples
Found 254555 train users, 254555 test users, 254555 common users
User sample counts range: 494 (max) to 1 (min)
Distributed ALL 254555 users across 20 clients
Users per client: 12727 (with 15 clients getting +1 user)
Train partition sizes: [44353, 44290, 44657, 44907, 44696, 45843, 45801, 45619, 45069, 45639, 45821, 45311, 45779, 46056, 45625, 45984, 46428, 44737, 45540, 46497]
Test partition sizes: [14232, 14235, 14266, 14217, 14238, 14373, 14346, 14334, 14294, 14373, 14344, 14302, 14354, 14362, 14320, 14395, 14389, 14257, 14251, 14399]
  Client 0: 44353 train samples, 2 unique classes
  Client 1: 44290 train samples, 2 unique classes
  Client 2: 44657 train samples, 2 unique classes
  Client 3: 44907 train samples, 2 unique classes
  Client 4: 44696 train samples, 2 unique classes
  Client 5: 45843 train samples, 2 unique classes
  Client 6: 45801 train samples, 2 unique classes
  Client 7: 45619 train samples, 2 unique classes
  Client 8: 45069 train samples, 2 unique classes
  Client 9: 45639 train samples, 2 unique classes
  Client 10: 45821 train samples, 2 unique classes
  Client 11: 45311 train samples, 2 unique classes
  Client 12: 45779 train samples, 2 unique classes
  Client 13: 46056 train samples, 2 unique classes
  Client 14: 45625 train samples, 2 unique classes
  Client 15: 45984 train samples, 2 unique classes
  Client 16: 46428 train samples, 2 unique classes
  Client 17: 44737 train samples, 2 unique classes
  Client 18: 45540 train samples, 2 unique classes
  Client 19: 46497 train samples, 2 unique classes
Will sample 4500 samples per client per epoch
Graph: erdos, nodes: 20, edges: 99
Degree statistics: avg=9.90, min=7, max=14
Attack: Compromised 16/20 nodes: [1, 2, 3, 5, 6, 8, 9, 10, 11, 12, 13, 14, 15, 17, 18, 19]
Attack type: directed_deviation, lambda: 1.0
Model variant: baseline
Model parameters: 1,174,986
BALANCE algorithm:
Balance Config: BALANCEConfig(gamma=2, kappa=1, alpha=0.5, min_neighbors=1)
  - Model dimension: 1,174,986 parameters
  - Complexity: O(N×d) = O(20×1,174,986)
Initial test acc across nodes: mean=0.4953 ± 0.0174
Round 001: test acc mean=0.4991 ± 0.0078 | min=0.4876 max=0.5139
         : test loss mean=3.7766 ± 1.3475
         : individual accs = ['0.503865', '0.513874', '0.502804', '0.493916', '0.487568', '0.499548', '0.503137', '0.507255', '0.499440', '0.501635', '0.498815', '0.510908', '0.496447', '0.489904', '0.493226', '0.492532', '0.495031', '0.490145', '0.512736', '0.488298']
         : correct/total = [(7171, 14232), (7315, 14235), (7173, 14266), (7022, 14217), (6942, 14238), (7180, 14373), (7218, 14346), (7271, 14334), (7139, 14294), (7210, 14373), (7155, 14344), (7307, 14302), (7126, 14354), (7036, 14362), (7063, 14320), (7090, 14395), (7123, 14389), (6988, 14257), (7307, 14251), (7031, 14399)]
         : compromised: 0.4992, honest: 0.4984
Round 002: test acc mean=0.5040 ± 0.0090 | min=0.4855 max=0.5193
         : test loss mean=1.7015 ± 1.2215
         : individual accs = ['0.516793', '0.519283', '0.498458', '0.512133', '0.506181', '0.499826', '0.500627', '0.514232', '0.507486', '0.505531', '0.489752', '0.517200', '0.498398', '0.492689', '0.509777', '0.485516', '0.498992', '0.501648', '0.504315', '0.500382']
         : correct/total = [(7355, 14232), (7392, 14235), (7111, 14266), (7281, 14217), (7207, 14238), (7184, 14373), (7182, 14346), (7371, 14334), (7254, 14294), (7266, 14373), (7025, 14344), (7397, 14302), (7154, 14354), (7076, 14362), (7300, 14320), (6989, 14395), (7180, 14389), (7152, 14257), (7187, 14251), (7205, 14399)]
         : compromised: 0.5027, honest: 0.5090
Round 003: test acc mean=0.5007 ± 0.0133 | min=0.4642 max=0.5262
         : test loss mean=0.8532 ± 0.5674
         : individual accs = ['0.495503', '0.512188', '0.498738', '0.505592', '0.513415', '0.508384', '0.499791', '0.494070', '0.526165', '0.464204', '0.500558', '0.501678', '0.502996', '0.498329', '0.496927', '0.507051', '0.499896', '0.472680', '0.516034', '0.500521']
         : correct/total = [(7052, 14232), (7291, 14235), (7115, 14266), (7188, 14217), (7310, 14238), (7307, 14373), (7170, 14346), (7082, 14334), (7521, 14294), (6672, 14373), (7180, 14344), (7175, 14302), (7220, 14354), (7157, 14362), (7116, 14320), (7299, 14395), (7193, 14389), (6739, 14257), (7354, 14251), (7207, 14399)]
         : compromised: 0.5007, honest: 0.5007
Round 004: test acc mean=0.5250 ± 0.0155 | min=0.4987 max=0.5522
         : test loss mean=0.7953 ± 0.4447
         : individual accs = ['0.524452', '0.543098', '0.508552', '0.508898', '0.552184', '0.519794', '0.510874', '0.532092', '0.520008', '0.514715', '0.533603', '0.498672', '0.527309', '0.536973', '0.532193', '0.512539', '0.543749', '0.530757', '0.549926', '0.499340']
         : correct/total = [(7464, 14232), (7731, 14235), (7255, 14266), (7235, 14217), (7862, 14238), (7471, 14373), (7329, 14346), (7627, 14334), (7433, 14294), (7398, 14373), (7654, 14344), (7132, 14302), (7569, 14354), (7712, 14362), (7621, 14320), (7378, 14395), (7824, 14389), (7567, 14257), (7837, 14251), (7190, 14399)]
         : compromised: 0.5217, honest: 0.5381
Round 005: test acc mean=0.5486 ± 0.0150 | min=0.5124 max=0.5764
         : test loss mean=0.8089 ± 0.5412
         : individual accs = ['0.541596', '0.552441', '0.524253', '0.541183', '0.561104', '0.538997', '0.541545', '0.576392', '0.544424', '0.565505', '0.545803', '0.555517', '0.552529', '0.545537', '0.541131', '0.536367', '0.563069', '0.568072', '0.563189', '0.512397']
         : correct/total = [(7708, 14232), (7864, 14235), (7479, 14266), (7694, 14217), (7989, 14238), (7747, 14373), (7769, 14346), (8262, 14334), (7782, 14294), (8128, 14373), (7829, 14344), (7945, 14302), (7931, 14354), (7835, 14362), (7749, 14320), (7721, 14395), (8102, 14389), (8099, 14257), (8026, 14251), (7378, 14399)]
         : compromised: 0.5456, honest: 0.5605
Round 006: test acc mean=0.5662 ± 0.0195 | min=0.4969 max=0.5963
         : test loss mean=0.7981 ± 0.5233
         : individual accs = ['0.567875', '0.578855', '0.553764', '0.566083', '0.577258', '0.560078', '0.576886', '0.596344', '0.553029', '0.579837', '0.566369', '0.575164', '0.569179', '0.584807', '0.572835', '0.546162', '0.560289', '0.570386', '0.571188', '0.496910']
         : correct/total = [(8082, 14232), (8240, 14235), (7900, 14266), (8048, 14217), (8219, 14238), (8050, 14373), (8276, 14346), (8548, 14334), (7905, 14294), (8334, 14373), (8124, 14344), (8226, 14302), (8170, 14354), (8399, 14362), (8203, 14320), (7862, 14395), (8062, 14389), (8132, 14257), (8140, 14251), (7155, 14399)]
         : compromised: 0.5638, honest: 0.5754
Round 007: test acc mean=0.5882 ± 0.0213 | min=0.5029 max=0.6119
         : test loss mean=0.7420 ± 0.3176
         : individual accs = ['0.578274', '0.597120', '0.584677', '0.596750', '0.591937', '0.587003', '0.591384', '0.606181', '0.602281', '0.589230', '0.584635', '0.600545', '0.583531', '0.598106', '0.596089', '0.580618', '0.611856', '0.588553', '0.591608', '0.502882']
         : correct/total = [(8230, 14232), (8500, 14235), (8341, 14266), (8484, 14217), (8428, 14238), (8437, 14373), (8484, 14346), (8689, 14334), (8609, 14294), (8469, 14373), (8386, 14344), (8589, 14302), (8376, 14354), (8590, 14362), (8536, 14320), (8358, 14395), (8804, 14389), (8391, 14257), (8431, 14251), (7241, 14399)]
         : compromised: 0.5859, honest: 0.5971
Round 008: test acc mean=0.5945 ± 0.0226 | min=0.4994 max=0.6159
         : test loss mean=0.7257 ± 0.2651
         : individual accs = ['0.602586', '0.600913', '0.590144', '0.604628', '0.598820', '0.599527', '0.600098', '0.604297', '0.607248', '0.595074', '0.592582', '0.596001', '0.598718', '0.592188', '0.602933', '0.590969', '0.615887', '0.600758', '0.597362', '0.499410']
         : correct/total = [(8576, 14232), (8554, 14235), (8419, 14266), (8596, 14217), (8526, 14238), (8617, 14373), (8609, 14346), (8662, 14334), (8680, 14294), (8553, 14373), (8500, 14344), (8524, 14302), (8594, 14354), (8505, 14362), (8634, 14320), (8507, 14395), (8862, 14389), (8565, 14257), (8513, 14251), (7191, 14399)]
         : compromised: 0.5918, honest: 0.6054
Round 009: test acc mean=0.6041 ± 0.0251 | min=0.5027 max=0.6193
         : test loss mean=0.6907 ± 0.1405
         : individual accs = ['0.607645', '0.610046', '0.605285', '0.615742', '0.609285', '0.613442', '0.611460', '0.616995', '0.617182', '0.613790', '0.607083', '0.614669', '0.610631', '0.615931', '0.607612', '0.603057', '0.619293', '0.607912', '0.572241', '0.502674']
         : correct/total = [(8648, 14232), (8684, 14235), (8635, 14266), (8754, 14217), (8675, 14238), (8817, 14373), (8772, 14346), (8844, 14334), (8822, 14294), (8822, 14373), (8708, 14344), (8791, 14302), (8765, 14354), (8846, 14362), (8701, 14320), (8681, 14395), (8911, 14389), (8667, 14257), (8155, 14251), (7238, 14399)]
         : compromised: 0.6018, honest: 0.6133
Round 010: test acc mean=0.6124 ± 0.0264 | min=0.5007 max=0.6320
         : test loss mean=0.6773 ± 0.1081
         : individual accs = ['0.617552', '0.619248', '0.609491', '0.623971', '0.616379', '0.615529', '0.621428', '0.625157', '0.620610', '0.632018', '0.620817', '0.611733', '0.618225', '0.607506', '0.618087', '0.618062', '0.629578', '0.611349', '0.610062', '0.500660']
         : correct/total = [(8789, 14232), (8815, 14235), (8695, 14266), (8871, 14217), (8776, 14238), (8847, 14373), (8915, 14346), (8961, 14334), (8871, 14294), (9084, 14373), (8905, 14344), (8749, 14302), (8874, 14354), (8725, 14362), (8851, 14320), (8897, 14395), (9059, 14389), (8716, 14257), (8694, 14251), (7209, 14399)]
         : compromised: 0.6099, honest: 0.6222

=== FINAL RESULTS ===
Dataset: sent140, Nodes: 20, Graph: erdos, Aggregation: balance
Attack: directed_deviation, 80.0% compromised
Final accuracy - Compromised: 0.6099, Honest: 0.6222
Overall test accuracy: mean=0.6124 ± 0.0264

=== BALANCE SUMMARY ===
Node 0: acceptance=0.250
Node 1: acceptance=0.460
Node 2: acceptance=0.325
Node 3: acceptance=0.314
Node 4: acceptance=0.300
Node 5: acceptance=0.280
Node 6: acceptance=0.267
Node 7: acceptance=0.273
Node 8: acceptance=0.314
Node 9: acceptance=0.427
Node 10: acceptance=0.325
Node 11: acceptance=0.267
Node 12: acceptance=0.325
Node 13: acceptance=0.289
Node 14: acceptance=0.293
Node 15: acceptance=0.300
Node 16: acceptance=0.314
Node 17: acceptance=0.425
Node 18: acceptance=0.325
Node 19: acceptance=0.200

=== PARALLEL EXECUTION TIME (realistic for distributed system) ===
  COMMUNICATION (max across nodes):
    - Full model transfer: 0.000s (0.0%)
  COMPUTATION (max across nodes):
    - Filtering: 0.056s (82.9%)
    - Aggregation: 0.012s (17.1%)
  TOTALS:
    - Total computation: 0.067s (100.0%)
    - Total communication: 0.000s (0.0%)
    - Total parallel time: 0.067s

=== PER-NODE AVERAGE TIME ===
  - Filtering: 0.041s
  - Aggregation: 0.006s
  - Model transfer: 0.000s
  - Total per node: 0.047s

=== TOTAL COMPUTATIONAL WORK (sum across all nodes) ===
  - Total filtering: 0.814s
  - Total aggregation: 0.117s
  - Total model transfer: 0.000s
  - Grand total: 0.931s
  - Mean acceptance rate: 0.314

BALANCE Algorithm Properties:
  - Model dimension: 1,174,986
  - No compression: Full parameter comparison
  - Theoretical complexity: O(deg(i)×d)
  - Approach: Full parameter filtering + averaging
