Device: cuda
Seed: 987654321
Loading 1 LEAF Sent140 train files...
LEAF Sent140 train: 254555 users, 908652 samples
Building vocabulary (max_size=10000)...
Vocabulary size: 10000
Loading 1 LEAF Sent140 test files...
LEAF Sent140 test: 254555 users, 286281 samples
Found 254555 train users, 254555 test users, 254555 common users
User sample counts range: 494 (max) to 1 (min)
Distributed ALL 254555 users across 20 clients
Users per client: 12727 (with 15 clients getting +1 user)
Train partition sizes: [44353, 44290, 44657, 44907, 44696, 45843, 45801, 45619, 45069, 45639, 45821, 45311, 45779, 46056, 45625, 45984, 46428, 44737, 45540, 46497]
Test partition sizes: [14232, 14235, 14266, 14217, 14238, 14373, 14346, 14334, 14294, 14373, 14344, 14302, 14354, 14362, 14320, 14395, 14389, 14257, 14251, 14399]
  Client 0: 44353 train samples, 2 unique classes
  Client 1: 44290 train samples, 2 unique classes
  Client 2: 44657 train samples, 2 unique classes
  Client 3: 44907 train samples, 2 unique classes
  Client 4: 44696 train samples, 2 unique classes
  Client 5: 45843 train samples, 2 unique classes
  Client 6: 45801 train samples, 2 unique classes
  Client 7: 45619 train samples, 2 unique classes
  Client 8: 45069 train samples, 2 unique classes
  Client 9: 45639 train samples, 2 unique classes
  Client 10: 45821 train samples, 2 unique classes
  Client 11: 45311 train samples, 2 unique classes
  Client 12: 45779 train samples, 2 unique classes
  Client 13: 46056 train samples, 2 unique classes
  Client 14: 45625 train samples, 2 unique classes
  Client 15: 45984 train samples, 2 unique classes
  Client 16: 46428 train samples, 2 unique classes
  Client 17: 44737 train samples, 2 unique classes
  Client 18: 45540 train samples, 2 unique classes
  Client 19: 46497 train samples, 2 unique classes
Will sample 4500 samples per client per epoch
Graph: erdos, nodes: 20, edges: 48
Degree statistics: avg=4.80, min=2, max=7
Attack: Compromised 16/20 nodes: [1, 2, 3, 5, 6, 8, 9, 10, 11, 12, 13, 14, 15, 17, 18, 19]
Attack type: backdoor, lambda: 1.0
Backdoor target label: 1, trigger size: 3
Model variant: baseline
Model parameters: 1,174,986
BALANCE algorithm:
Balance Config: BALANCEConfig(gamma=2, kappa=1, alpha=0.5, min_neighbors=1)
  - Model dimension: 1,174,986 parameters
  - Complexity: O(N×d) = O(20×1,174,986)
Initial test acc across nodes: mean=0.4965 ± 0.0152
Backdoor attack: Created poisoned datasets for 16 compromised nodes
Round 001: test acc mean=0.5005 ± 0.0065 | min=0.4879 max=0.5134
         : test loss mean=27.6912 ± 15.2371
         : individual accs = ['0.500281', '0.499754', '0.487943', '0.494760', '0.506743', '0.494678', '0.494214', '0.513395', '0.506156', '0.498574', '0.505089', '0.498741', '0.493591', '0.511767', '0.509916', '0.498159', '0.497811', '0.501578', '0.495193', '0.502327']
         : correct/total = [(7120, 14232), (7114, 14235), (6961, 14266), (7034, 14217), (7215, 14238), (7110, 14373), (7090, 14346), (7359, 14334), (7235, 14294), (7166, 14373), (7245, 14344), (7133, 14302), (7085, 14354), (7350, 14362), (7302, 14320), (7171, 14395), (7163, 14389), (7151, 14257), (7057, 14251), (7233, 14399)]
         : compromised: 0.4995, honest: 0.5046
Round 002: test acc mean=0.5007 ± 0.0071 | min=0.4861 max=0.5160
         : test loss mean=1261.5787 ± 712.9522
         : individual accs = ['0.489320', '0.498349', '0.486051', '0.508124', '0.495575', '0.497948', '0.495818', '0.496023', '0.505457', '0.508801', '0.516035', '0.505943', '0.502856', '0.508843', '0.498883', '0.498298', '0.499965', '0.507680', '0.494421', '0.499410']
         : correct/total = [(6964, 14232), (7094, 14235), (6934, 14266), (7224, 14217), (7056, 14238), (7157, 14373), (7113, 14346), (7110, 14334), (7225, 14294), (7313, 14373), (7402, 14344), (7236, 14302), (7218, 14354), (7308, 14362), (7144, 14320), (7173, 14395), (7194, 14389), (7238, 14257), (7046, 14251), (7191, 14399)]
         : compromised: 0.5021, honest: 0.4952
Round 003: test acc mean=0.4975 ± 0.0079 | min=0.4804 max=0.5109
         : test loss mean=97571.8079 ± 75104.1837
         : individual accs = ['0.510891', '0.496171', '0.491168', '0.490610', '0.505900', '0.493843', '0.493587', '0.504814', '0.497831', '0.510749', '0.501464', '0.491610', '0.480354', '0.504526', '0.495670', '0.483432', '0.500243', '0.503682', '0.493439', '0.500174']
         : correct/total = [(7271, 14232), (7063, 14235), (7007, 14266), (6975, 14217), (7203, 14238), (7098, 14373), (7081, 14346), (7236, 14334), (7116, 14294), (7341, 14373), (7193, 14344), (7031, 14302), (6895, 14354), (7246, 14362), (7098, 14320), (6959, 14395), (7198, 14389), (7181, 14257), (7032, 14251), (7202, 14399)]
         : compromised: 0.4955, honest: 0.5055
Round 004: test acc mean=0.4998 ± 0.0092 | min=0.4811 max=0.5189
         : test loss mean=9280272.3189 ± 5485650.1746
         : individual accs = ['0.504497', '0.492167', '0.518926', '0.497503', '0.503231', '0.492660', '0.509829', '0.499163', '0.518050', '0.499200', '0.492959', '0.490351', '0.501254', '0.498329', '0.481145', '0.499965', '0.497463', '0.499965', '0.489088', '0.510869']
         : correct/total = [(7180, 14232), (7006, 14235), (7403, 14266), (7073, 14217), (7165, 14238), (7081, 14373), (7314, 14346), (7155, 14334), (7405, 14294), (7175, 14373), (7071, 14344), (7013, 14302), (7195, 14354), (7157, 14362), (6890, 14320), (7197, 14395), (7158, 14389), (7128, 14257), (6970, 14251), (7356, 14399)]
         : compromised: 0.4995, honest: 0.5011
Round 005: test acc mean=0.5001 ± 0.0066 | min=0.4853 max=0.5099
         : test loss mean=532105347.4784 ± 282035312.4791
         : individual accs = ['0.509907', '0.497787', '0.509673', '0.503974', '0.507164', '0.485285', '0.507737', '0.504535', '0.493634', '0.500800', '0.491007', '0.499091', '0.501881', '0.496867', '0.495880', '0.500035', '0.503371', '0.494073', '0.506631', '0.491840']
         : correct/total = [(7257, 14232), (7086, 14235), (7271, 14266), (7165, 14217), (7221, 14238), (6975, 14373), (7284, 14346), (7232, 14334), (7056, 14294), (7198, 14373), (7043, 14344), (7138, 14302), (7204, 14354), (7136, 14362), (7101, 14320), (7198, 14395), (7243, 14389), (7044, 14257), (7220, 14251), (7082, 14399)]
         : compromised: 0.4985, honest: 0.5062
Round 006: test acc mean=0.5007 ± 0.0080 | min=0.4872 max=0.5129
         : test loss mean=40225132816.1361 ± 21564181005.1649
         : individual accs = ['0.510750', '0.499614', '0.512337', '0.504115', '0.503161', '0.488625', '0.512896', '0.512627', '0.496222', '0.499200', '0.489822', '0.496574', '0.504110', '0.487188', '0.497416', '0.505801', '0.488637', '0.499193', '0.507192', '0.497535']
         : correct/total = [(7269, 14232), (7112, 14235), (7309, 14266), (7167, 14217), (7164, 14238), (7023, 14373), (7358, 14346), (7348, 14334), (7093, 14294), (7175, 14373), (7026, 14344), (7102, 14302), (7236, 14354), (6997, 14362), (7123, 14320), (7281, 14395), (7031, 14389), (7117, 14257), (7228, 14251), (7164, 14399)]
         : compromised: 0.4999, honest: 0.5038
Round 007: test acc mean=0.5024 ± 0.0075 | min=0.4880 max=0.5178
         : test loss mean=3207262340819.6738 ± 1709866834515.6289
         : individual accs = ['0.514685', '0.493853', '0.505327', '0.503411', '0.507796', '0.488833', '0.517775', '0.505372', '0.502029', '0.499269', '0.488009', '0.510768', '0.497353', '0.493385', '0.506006', '0.502952', '0.504552', '0.501648', '0.504807', '0.500521']
         : correct/total = [(7325, 14232), (7030, 14235), (7209, 14266), (7157, 14217), (7230, 14238), (7026, 14373), (7428, 14346), (7244, 14334), (7176, 14294), (7176, 14373), (7000, 14344), (7305, 14302), (7139, 14354), (7086, 14362), (7246, 14320), (7240, 14395), (7260, 14389), (7152, 14257), (7194, 14251), (7207, 14399)]
         : compromised: 0.5010, honest: 0.5081
Round 008: test acc mean=0.5030 ± 0.0069 | min=0.4890 max=0.5185
         : test loss mean=275282805301232.2500 ± 148043556115134.6250
         : individual accs = ['0.510821', '0.495188', '0.512337', '0.508265', '0.510044', '0.489042', '0.518472', '0.508511', '0.501119', '0.502679', '0.494841', '0.503566', '0.500627', '0.506127', '0.500140', '0.501424', '0.499965', '0.496598', '0.503684', '0.496284']
         : correct/total = [(7270, 14232), (7049, 14235), (7309, 14266), (7226, 14217), (7262, 14238), (7029, 14373), (7438, 14346), (7289, 14334), (7163, 14294), (7225, 14373), (7098, 14344), (7202, 14302), (7186, 14354), (7269, 14362), (7162, 14320), (7218, 14395), (7194, 14389), (7080, 14257), (7178, 14251), (7146, 14399)]
         : compromised: 0.5019, honest: 0.5073
Round 009: test acc mean=0.5018 ± 0.0061 | min=0.4948 max=0.5179
         : test loss mean=22688327047457740.0000 ± 12137302470661672.0000
         : individual accs = ['0.510540', '0.494837', '0.511776', '0.500809', '0.497823', '0.495234', '0.517914', '0.497140', '0.496992', '0.501426', '0.496654', '0.495805', '0.501672', '0.500000', '0.507472', '0.506982', '0.500660', '0.498211', '0.505017', '0.499826']
         : correct/total = [(7266, 14232), (7044, 14235), (7301, 14266), (7120, 14217), (7088, 14238), (7118, 14373), (7430, 14346), (7126, 14334), (7104, 14294), (7207, 14373), (7124, 14344), (7091, 14302), (7201, 14354), (7181, 14362), (7267, 14320), (7298, 14395), (7204, 14389), (7103, 14257), (7197, 14251), (7197, 14399)]
         : compromised: 0.5019, honest: 0.5015
Round 010: test acc mean=0.5039 ± 0.0072 | min=0.4915 max=0.5196
         : test loss mean=1879444193253512448.0000 ± 1017593060811248896.0000
         : individual accs = ['0.502038', '0.499895', '0.509533', '0.508757', '0.495997', '0.491547', '0.519587', '0.493931', '0.500000', '0.515480', '0.502370', '0.510348', '0.505434', '0.503412', '0.495112', '0.511358', '0.508374', '0.497650', '0.506491', '0.501146']
         : correct/total = [(7145, 14232), (7116, 14235), (7269, 14266), (7233, 14217), (7062, 14238), (7065, 14373), (7454, 14346), (7080, 14334), (7147, 14294), (7409, 14373), (7206, 14344), (7299, 14302), (7255, 14354), (7230, 14362), (7090, 14320), (7361, 14395), (7315, 14389), (7095, 14257), (7218, 14251), (7216, 14399)]
         : compromised: 0.5049, honest: 0.5001

=== FINAL RESULTS ===
Dataset: sent140, Nodes: 20, Graph: erdos, Aggregation: balance
Attack: backdoor, 80.0% compromised
Final accuracy - Compromised: 0.5049, Honest: 0.5001
Overall test accuracy: mean=0.5039 ± 0.0072

=== BACKDOOR ATTACK SUCCESS RATE (ASR) ===
Target label: 1
Trigger size: 3x3
Overall ASR: 0.9215 ± 0.2116
Honest nodes ASR: 0.6354 ± 0.3485
Compromised nodes ASR: 0.9930 ± 0.0059
Note: Higher ASR indicates more successful backdoor attack

=== BALANCE SUMMARY ===
Node 0: acceptance=1.000
Node 1: acceptance=0.800
Node 2: acceptance=0.800
Node 3: acceptance=0.600
Node 4: acceptance=0.900
Node 5: acceptance=0.800
Node 6: acceptance=0.800
Node 7: acceptance=0.800
Node 8: acceptance=0.800
Node 9: acceptance=0.800
Node 10: acceptance=0.800
Node 11: acceptance=0.600
Node 12: acceptance=0.800
Node 13: acceptance=0.600
Node 14: acceptance=0.800
Node 15: acceptance=0.800
Node 16: acceptance=0.900
Node 17: acceptance=0.800
Node 18: acceptance=0.900
Node 19: acceptance=0.600

=== PARALLEL EXECUTION TIME (realistic for distributed system) ===
  COMMUNICATION (max across nodes):
    - Full model transfer: 0.000s (0.0%)
  COMPUTATION (max across nodes):
    - Filtering: 0.033s (69.0%)
    - Aggregation: 0.015s (31.0%)
  TOTALS:
    - Total computation: 0.048s (100.0%)
    - Total communication: 0.000s (0.0%)
    - Total parallel time: 0.048s

=== PER-NODE AVERAGE TIME ===
  - Filtering: 0.023s
  - Aggregation: 0.007s
  - Model transfer: 0.000s
  - Total per node: 0.030s

=== TOTAL COMPUTATIONAL WORK (sum across all nodes) ===
  - Total filtering: 0.469s
  - Total aggregation: 0.130s
  - Total model transfer: 0.000s
  - Grand total: 0.600s
  - Mean acceptance rate: 0.785

BALANCE Algorithm Properties:
  - Model dimension: 1,174,986
  - No compression: Full parameter comparison
  - Theoretical complexity: O(deg(i)×d)
  - Approach: Full parameter filtering + averaging
