Device: cuda
Seed: 987654321
Loading 1 LEAF Sent140 train files...
LEAF Sent140 train: 254555 users, 908652 samples
Building vocabulary (max_size=10000)...
Vocabulary size: 10000
Loading 1 LEAF Sent140 test files...
LEAF Sent140 test: 254555 users, 286281 samples
Found 254555 train users, 254555 test users, 254555 common users
User sample counts range: 494 (max) to 1 (min)
Distributed ALL 254555 users across 20 clients
Users per client: 12727 (with 15 clients getting +1 user)
Train partition sizes: [44353, 44290, 44657, 44907, 44696, 45843, 45801, 45619, 45069, 45639, 45821, 45311, 45779, 46056, 45625, 45984, 46428, 44737, 45540, 46497]
Test partition sizes: [14232, 14235, 14266, 14217, 14238, 14373, 14346, 14334, 14294, 14373, 14344, 14302, 14354, 14362, 14320, 14395, 14389, 14257, 14251, 14399]
  Client 0: 44353 train samples, 2 unique classes
  Client 1: 44290 train samples, 2 unique classes
  Client 2: 44657 train samples, 2 unique classes
  Client 3: 44907 train samples, 2 unique classes
  Client 4: 44696 train samples, 2 unique classes
  Client 5: 45843 train samples, 2 unique classes
  Client 6: 45801 train samples, 2 unique classes
  Client 7: 45619 train samples, 2 unique classes
  Client 8: 45069 train samples, 2 unique classes
  Client 9: 45639 train samples, 2 unique classes
  Client 10: 45821 train samples, 2 unique classes
  Client 11: 45311 train samples, 2 unique classes
  Client 12: 45779 train samples, 2 unique classes
  Client 13: 46056 train samples, 2 unique classes
  Client 14: 45625 train samples, 2 unique classes
  Client 15: 45984 train samples, 2 unique classes
  Client 16: 46428 train samples, 2 unique classes
  Client 17: 44737 train samples, 2 unique classes
  Client 18: 45540 train samples, 2 unique classes
  Client 19: 46497 train samples, 2 unique classes
Will sample 4500 samples per client per epoch
Graph: erdos, nodes: 20, edges: 48
Degree statistics: avg=4.80, min=2, max=7
Attack: Compromised 6/20 nodes: [5, 12, 13, 14, 17, 18]
Attack type: backdoor, lambda: 1.0
Backdoor target label: 1, trigger size: 3
Model variant: baseline
Model parameters: 1,174,986
Initial test acc across nodes: mean=0.4965 ± 0.0152
Backdoor attack: Created poisoned datasets for 6 compromised nodes
Round 001: test acc mean=0.5025 ± 0.0087 | min=0.4897 max=0.5203
         : test loss mean=3.1701 ± 2.5339
         : individual accs = ['0.512858', '0.499754', '0.513318', '0.502286', '0.496980', '0.489738', '0.492054', '0.493512', '0.509165', '0.505810', '0.501325', '0.495945', '0.496517', '0.518591', '0.499511', '0.520250', '0.500521', '0.502841', '0.490843', '0.508924']
         : correct/total = [(7299, 14232), (7114, 14235), (7323, 14266), (7141, 14217), (7076, 14238), (7039, 14373), (7059, 14346), (7074, 14334), (7278, 14294), (7270, 14373), (7191, 14344), (7093, 14302), (7127, 14354), (7448, 14362), (7153, 14320), (7489, 14395), (7202, 14389), (7169, 14257), (6995, 14251), (7328, 14399)]
         : compromised: 0.4997, honest: 0.5038
Round 002: test acc mean=0.5026 ± 0.0070 | min=0.4847 max=0.5142
         : test loss mean=3.6021 ± 3.0136
         : individual accs = ['0.504216', '0.510362', '0.513459', '0.504748', '0.510957', '0.503583', '0.501115', '0.497488', '0.514202', '0.503166', '0.493447', '0.500839', '0.501602', '0.484682', '0.502095', '0.503439', '0.500521', '0.507049', '0.502561', '0.491979']
         : correct/total = [(7176, 14232), (7265, 14235), (7325, 14266), (7176, 14217), (7275, 14238), (7238, 14373), (7189, 14346), (7131, 14334), (7350, 14294), (7232, 14373), (7078, 14344), (7163, 14302), (7200, 14354), (6961, 14362), (7190, 14320), (7247, 14395), (7202, 14389), (7229, 14257), (7162, 14251), (7084, 14399)]
         : compromised: 0.5003, honest: 0.5036
Round 003: test acc mean=0.5027 ± 0.0123 | min=0.4789 max=0.5296
         : test loss mean=0.9701 ± 0.4473
         : individual accs = ['0.529581', '0.507622', '0.497827', '0.502497', '0.498595', '0.508105', '0.501185', '0.514302', '0.488597', '0.500731', '0.516941', '0.500629', '0.486972', '0.483498', '0.499651', '0.500174', '0.504066', '0.478852', '0.510841', '0.522675']
         : correct/total = [(7537, 14232), (7226, 14235), (7102, 14266), (7144, 14217), (7099, 14238), (7303, 14373), (7190, 14346), (7372, 14334), (6984, 14294), (7197, 14373), (7415, 14344), (7160, 14302), (6990, 14354), (6944, 14362), (7155, 14320), (7200, 14395), (7253, 14389), (6827, 14257), (7280, 14251), (7526, 14399)]
         : compromised: 0.4947, honest: 0.5061
Round 004: test acc mean=0.5053 ± 0.0101 | min=0.4690 max=0.5182
         : test loss mean=1.6690 ± 1.0742
         : individual accs = ['0.517566', '0.513593', '0.507711', '0.501794', '0.509763', '0.508245', '0.502858', '0.503279', '0.516021', '0.502400', '0.505229', '0.500909', '0.506827', '0.496588', '0.507332', '0.518166', '0.500938', '0.505366', '0.511543', '0.468991']
         : correct/total = [(7366, 14232), (7311, 14235), (7243, 14266), (7134, 14217), (7258, 14238), (7305, 14373), (7214, 14346), (7214, 14334), (7376, 14294), (7221, 14373), (7247, 14344), (7164, 14302), (7275, 14354), (7132, 14362), (7265, 14320), (7459, 14395), (7208, 14389), (7205, 14257), (7290, 14251), (6753, 14399)]
         : compromised: 0.5060, honest: 0.5049
Round 005: test acc mean=0.5042 ± 0.0076 | min=0.4859 max=0.5230
         : test loss mean=0.9640 ± 0.4838
         : individual accs = ['0.504216', '0.506498', '0.504556', '0.506506', '0.511308', '0.496626', '0.500279', '0.511302', '0.494683', '0.500591', '0.511015', '0.500210', '0.485858', '0.522977', '0.508520', '0.503091', '0.505108', '0.497159', '0.503263', '0.510244']
         : correct/total = [(7176, 14232), (7210, 14235), (7198, 14266), (7201, 14217), (7280, 14238), (7138, 14373), (7177, 14346), (7329, 14334), (7071, 14294), (7195, 14373), (7330, 14344), (7154, 14302), (6974, 14354), (7511, 14362), (7282, 14320), (7242, 14395), (7268, 14389), (7088, 14257), (7172, 14251), (7347, 14399)]
         : compromised: 0.5024, honest: 0.5050
Round 006: test acc mean=0.5068 ± 0.0106 | min=0.4946 max=0.5368
         : test loss mean=1.3251 ± 0.8123
         : individual accs = ['0.510540', '0.536846', '0.511005', '0.517409', '0.513555', '0.503444', '0.498885', '0.506976', '0.514342', '0.526821', '0.507181', '0.502727', '0.498258', '0.494569', '0.501117', '0.499896', '0.500452', '0.499123', '0.497158', '0.496562']
         : correct/total = [(7266, 14232), (7642, 14235), (7290, 14266), (7356, 14217), (7312, 14238), (7236, 14373), (7157, 14346), (7267, 14334), (7352, 14294), (7572, 14373), (7275, 14344), (7190, 14302), (7152, 14354), (7103, 14362), (7176, 14320), (7196, 14395), (7201, 14389), (7116, 14257), (7085, 14251), (7150, 14399)]
         : compromised: 0.4989, honest: 0.5102
Round 007: test acc mean=0.5041 ± 0.0096 | min=0.4750 max=0.5242
         : test loss mean=1.0087 ± 0.6370
         : individual accs = ['0.507026', '0.513593', '0.502523', '0.515721', '0.511378', '0.498017', '0.497769', '0.524208', '0.499300', '0.506157', '0.510945', '0.503706', '0.499164', '0.497215', '0.501327', '0.506704', '0.511363', '0.502630', '0.474984', '0.498785']
         : correct/total = [(7216, 14232), (7311, 14235), (7169, 14266), (7332, 14217), (7281, 14238), (7158, 14373), (7141, 14346), (7514, 14334), (7137, 14294), (7275, 14373), (7329, 14344), (7204, 14302), (7165, 14354), (7141, 14362), (7179, 14320), (7294, 14395), (7358, 14389), (7166, 14257), (6769, 14251), (7182, 14399)]
         : compromised: 0.4956, honest: 0.5078
Round 008: test acc mean=0.5119 ± 0.0163 | min=0.4955 max=0.5609
         : test loss mean=1.1163 ± 0.6125
         : individual accs = ['0.516934', '0.531928', '0.503505', '0.532883', '0.502177', '0.505949', '0.508365', '0.503698', '0.507556', '0.537536', '0.515686', '0.500699', '0.495541', '0.507729', '0.497835', '0.507051', '0.498784', '0.496668', '0.505649', '0.560942']
         : correct/total = [(7357, 14232), (7572, 14235), (7183, 14266), (7576, 14217), (7150, 14238), (7272, 14373), (7293, 14346), (7220, 14334), (7255, 14294), (7726, 14373), (7397, 14344), (7161, 14302), (7113, 14354), (7292, 14362), (7129, 14320), (7299, 14395), (7177, 14389), (7081, 14257), (7206, 14251), (8077, 14399)]
         : compromised: 0.5016, honest: 0.5163
Round 009: test acc mean=0.5046 ± 0.0170 | min=0.4712 max=0.5410
         : test loss mean=0.9350 ± 0.5548
         : individual accs = ['0.499578', '0.508957', '0.503014', '0.499191', '0.498244', '0.495860', '0.500418', '0.536556', '0.533161', '0.495443', '0.540993', '0.499091', '0.499094', '0.471244', '0.492179', '0.507329', '0.502328', '0.501859', '0.482001', '0.525662']
         : correct/total = [(7110, 14232), (7245, 14235), (7176, 14266), (7097, 14217), (7094, 14238), (7127, 14373), (7179, 14346), (7691, 14334), (7621, 14294), (7121, 14373), (7760, 14344), (7138, 14302), (7164, 14354), (6768, 14362), (7048, 14320), (7303, 14395), (7228, 14389), (7155, 14257), (6869, 14251), (7569, 14399)]
         : compromised: 0.4904, honest: 0.5107
Round 010: test acc mean=0.5064 ± 0.0149 | min=0.4916 max=0.5611
         : test loss mean=0.9709 ± 0.4411
         : individual accs = ['0.511031', '0.514998', '0.491799', '0.521066', '0.498736', '0.498782', '0.498954', '0.505372', '0.502938', '0.509636', '0.518475', '0.495106', '0.494427', '0.491575', '0.503212', '0.506148', '0.498367', '0.501929', '0.505087', '0.561081']
         : correct/total = [(7273, 14232), (7331, 14235), (7016, 14266), (7408, 14217), (7101, 14238), (7169, 14373), (7158, 14346), (7244, 14334), (7189, 14294), (7325, 14373), (7437, 14344), (7081, 14302), (7097, 14354), (7060, 14362), (7206, 14320), (7286, 14395), (7171, 14389), (7156, 14257), (7198, 14251), (8079, 14399)]
         : compromised: 0.4992, honest: 0.5096

=== FINAL RESULTS ===
Dataset: sent140, Nodes: 20, Graph: erdos, Aggregation: d-fedavg
Attack: backdoor, 30.0% compromised
Final accuracy - Compromised: 0.4992, Honest: 0.5096
Overall test accuracy: mean=0.5064 ± 0.0149

=== BACKDOOR ATTACK SUCCESS RATE (ASR) ===
Target label: 1
Trigger size: 3x3
Overall ASR: 0.4365 ± 0.2467
Honest nodes ASR: 0.4599 ± 0.2761
Compromised nodes ASR: 0.3820 ± 0.1440
Note: Higher ASR indicates more successful backdoor attack
