Device: cuda
Seed: 987654321
Loading 1 LEAF Sent140 train files...
LEAF Sent140 train: 254555 users, 908652 samples
Building vocabulary (max_size=10000)...
Vocabulary size: 10000
Loading 1 LEAF Sent140 test files...
LEAF Sent140 test: 254555 users, 286281 samples
Found 254555 train users, 254555 test users, 254555 common users
User sample counts range: 494 (max) to 1 (min)
Distributed ALL 254555 users across 20 clients
Users per client: 12727 (with 15 clients getting +1 user)
Train partition sizes: [44353, 44290, 44657, 44907, 44696, 45843, 45801, 45619, 45069, 45639, 45821, 45311, 45779, 46056, 45625, 45984, 46428, 44737, 45540, 46497]
Test partition sizes: [14232, 14235, 14266, 14217, 14238, 14373, 14346, 14334, 14294, 14373, 14344, 14302, 14354, 14362, 14320, 14395, 14389, 14257, 14251, 14399]
  Client 0: 44353 train samples, 2 unique classes
  Client 1: 44290 train samples, 2 unique classes
  Client 2: 44657 train samples, 2 unique classes
  Client 3: 44907 train samples, 2 unique classes
  Client 4: 44696 train samples, 2 unique classes
  Client 5: 45843 train samples, 2 unique classes
  Client 6: 45801 train samples, 2 unique classes
  Client 7: 45619 train samples, 2 unique classes
  Client 8: 45069 train samples, 2 unique classes
  Client 9: 45639 train samples, 2 unique classes
  Client 10: 45821 train samples, 2 unique classes
  Client 11: 45311 train samples, 2 unique classes
  Client 12: 45779 train samples, 2 unique classes
  Client 13: 46056 train samples, 2 unique classes
  Client 14: 45625 train samples, 2 unique classes
  Client 15: 45984 train samples, 2 unique classes
  Client 16: 46428 train samples, 2 unique classes
  Client 17: 44737 train samples, 2 unique classes
  Client 18: 45540 train samples, 2 unique classes
  Client 19: 46497 train samples, 2 unique classes
Will sample 4500 samples per client per epoch
Graph: erdos, nodes: 20, edges: 126
Degree statistics: avg=12.60, min=8, max=16
Attack: Compromised 8/20 nodes: [1, 5, 11, 12, 13, 14, 17, 18]
Attack type: directed_deviation, lambda: 1.0
Model variant: baseline
Model parameters: 1,174,986
Initial test acc across nodes: mean=0.4965 ± 0.0152
Round 001: test acc mean=0.4998 ± 0.0054 | min=0.4896 max=0.5096
         : test loss mean=20.5538 ± 8.8668
         : individual accs = ['0.509556', '0.498981', '0.496705', '0.501161', '0.503090', '0.505601', '0.497281', '0.503000', '0.503988', '0.493286', '0.499233', '0.506642', '0.502438', '0.490739', '0.496997', '0.494269', '0.502398', '0.505997', '0.489650', '0.494618']
         : correct/total = [(7252, 14232), (7103, 14235), (7086, 14266), (7125, 14217), (7163, 14238), (7267, 14373), (7134, 14346), (7210, 14334), (7204, 14294), (7090, 14373), (7161, 14344), (7246, 14302), (7212, 14354), (7048, 14362), (7117, 14320), (7115, 14395), (7229, 14389), (7214, 14257), (6978, 14251), (7122, 14399)]
         : compromised: 0.4996, honest: 0.4999
Round 002: test acc mean=0.5025 ± 0.0067 | min=0.4919 max=0.5153
         : test loss mean=13.8274 ± 3.6345
         : individual accs = ['0.494028', '0.496101', '0.514931', '0.505381', '0.501124', '0.497948', '0.507459', '0.503209', '0.502868', '0.515272', '0.495399', '0.503985', '0.492685', '0.491923', '0.500628', '0.511636', '0.507193', '0.503682', '0.497228', '0.506910']
         : correct/total = [(7031, 14232), (7062, 14235), (7346, 14266), (7185, 14217), (7135, 14238), (7157, 14373), (7280, 14346), (7213, 14334), (7188, 14294), (7406, 14373), (7106, 14344), (7208, 14302), (7072, 14354), (7065, 14362), (7169, 14320), (7365, 14395), (7298, 14389), (7181, 14257), (7086, 14251), (7299, 14399)]
         : compromised: 0.4980, honest: 0.5055
Round 003: test acc mean=0.4983 ± 0.0085 | min=0.4840 max=0.5164
         : test loss mean=2.3085 ± 0.6967
         : individual accs = ['0.493465', '0.484018', '0.488785', '0.507561', '0.490097', '0.507618', '0.499512', '0.495675', '0.487058', '0.516385', '0.488148', '0.492658', '0.499861', '0.512533', '0.500908', '0.503856', '0.498714', '0.504945', '0.496456', '0.497257']
         : correct/total = [(7023, 14232), (6890, 14235), (6973, 14266), (7216, 14217), (6978, 14238), (7296, 14373), (7166, 14346), (7105, 14334), (6962, 14294), (7422, 14373), (7002, 14344), (7046, 14302), (7175, 14354), (7361, 14362), (7173, 14320), (7253, 14395), (7176, 14389), (7199, 14257), (7075, 14251), (7160, 14399)]
         : compromised: 0.4999, honest: 0.4972
Round 004: test acc mean=0.5120 ± 0.0093 | min=0.4939 max=0.5285
         : test loss mean=3.3245 ± 4.1167
         : individual accs = ['0.514615', '0.511556', '0.507921', '0.516987', '0.519947', '0.509149', '0.502788', '0.505860', '0.526165', '0.528491', '0.495050', '0.499371', '0.511704', '0.513647', '0.519623', '0.520320', '0.516923', '0.493933', '0.519613', '0.506355']
         : correct/total = [(7324, 14232), (7282, 14235), (7246, 14266), (7350, 14217), (7403, 14238), (7318, 14373), (7213, 14346), (7251, 14334), (7521, 14294), (7596, 14373), (7101, 14344), (7142, 14302), (7345, 14354), (7377, 14362), (7441, 14320), (7490, 14395), (7438, 14389), (7042, 14257), (7405, 14251), (7291, 14399)]
         : compromised: 0.5098, honest: 0.5135
Round 005: test acc mean=0.5130 ± 0.0090 | min=0.4890 max=0.5257
         : test loss mean=5.6463 ± 3.7623
         : individual accs = ['0.519112', '0.517316', '0.496776', '0.511641', '0.516294', '0.511028', '0.509689', '0.521557', '0.489016', '0.519655', '0.499582', '0.508950', '0.516650', '0.521724', '0.516480', '0.513928', '0.518730', '0.506698', '0.519051', '0.525731']
         : correct/total = [(7388, 14232), (7364, 14235), (7087, 14266), (7274, 14217), (7351, 14238), (7345, 14373), (7312, 14346), (7476, 14334), (6990, 14294), (7469, 14373), (7166, 14344), (7279, 14302), (7416, 14354), (7493, 14362), (7396, 14320), (7398, 14395), (7464, 14389), (7224, 14257), (7397, 14251), (7570, 14399)]
         : compromised: 0.5147, honest: 0.5118
Round 006: test acc mean=0.5122 ± 0.0081 | min=0.4980 max=0.5304
         : test loss mean=1.9352 ± 0.3613
         : individual accs = ['0.513350', '0.522866', '0.515912', '0.513048', '0.505408', '0.508384', '0.510107', '0.511860', '0.504897', '0.530439', '0.497978', '0.513145', '0.510171', '0.525832', '0.506634', '0.507885', '0.516853', '0.499193', '0.521648', '0.507535']
         : correct/total = [(7306, 14232), (7443, 14235), (7360, 14266), (7294, 14217), (7196, 14238), (7307, 14373), (7318, 14346), (7337, 14334), (7217, 14294), (7624, 14373), (7143, 14344), (7339, 14302), (7323, 14354), (7552, 14362), (7255, 14320), (7311, 14395), (7437, 14389), (7117, 14257), (7434, 14251), (7308, 14399)]
         : compromised: 0.5135, honest: 0.5113
Round 007: test acc mean=0.5064 ± 0.0071 | min=0.4962 max=0.5209
         : test loss mean=2.9817 ± 2.1158
         : individual accs = ['0.500843', '0.506639', '0.516333', '0.504818', '0.505268', '0.507340', '0.500000', '0.520580', '0.508535', '0.499269', '0.496166', '0.496294', '0.504668', '0.511071', '0.502165', '0.520945', '0.500382', '0.503262', '0.514911', '0.508785']
         : correct/total = [(7128, 14232), (7212, 14235), (7366, 14266), (7177, 14217), (7194, 14238), (7292, 14373), (7173, 14346), (7462, 14334), (7269, 14294), (7176, 14373), (7117, 14344), (7098, 14302), (7244, 14354), (7340, 14362), (7191, 14320), (7499, 14395), (7200, 14389), (7175, 14257), (7338, 14251), (7326, 14399)]
         : compromised: 0.5058, honest: 0.5068
Round 008: test acc mean=0.4963 ± 0.0066 | min=0.4859 max=0.5095
         : test loss mean=19.3412 ± 9.1724
         : individual accs = ['0.494590', '0.509519', '0.497477', '0.509531', '0.492063', '0.496904', '0.496933', '0.498047', '0.494893', '0.506436', '0.489961', '0.499441', '0.489132', '0.485935', '0.496089', '0.496978', '0.493085', '0.486147', '0.501930', '0.491354']
         : correct/total = [(7039, 14232), (7253, 14235), (7097, 14266), (7244, 14217), (7006, 14238), (7142, 14373), (7129, 14346), (7139, 14334), (7074, 14294), (7279, 14373), (7028, 14344), (7143, 14302), (7021, 14354), (6979, 14362), (7104, 14320), (7154, 14395), (7095, 14389), (6931, 14257), (7153, 14251), (7075, 14399)]
         : compromised: 0.4956, honest: 0.4968
Round 009: test acc mean=0.4990 ± 0.0072 | min=0.4880 max=0.5191
         : test loss mean=2.2317 ± 0.7981
         : individual accs = ['0.488758', '0.501089', '0.505608', '0.519097', '0.497050', '0.487998', '0.496515', '0.492675', '0.494473', '0.508523', '0.499233', '0.496224', '0.508987', '0.497424', '0.497696', '0.498576', '0.493154', '0.504735', '0.497930', '0.493645']
         : correct/total = [(6956, 14232), (7133, 14235), (7213, 14266), (7380, 14217), (7077, 14238), (7014, 14373), (7123, 14346), (7062, 14334), (7068, 14294), (7309, 14373), (7161, 14344), (7097, 14302), (7306, 14354), (7144, 14362), (7127, 14320), (7177, 14395), (7096, 14389), (7196, 14257), (7096, 14251), (7108, 14399)]
         : compromised: 0.4990, honest: 0.4989
Round 010: test acc mean=0.5043 ± 0.0099 | min=0.4896 max=0.5201
         : test loss mean=5.5741 ± 5.2684
         : individual accs = ['0.515880', '0.513523', '0.496635', '0.520082', '0.490027', '0.495025', '0.498257', '0.501535', '0.515671', '0.508871', '0.499163', '0.505594', '0.511634', '0.516989', '0.491899', '0.489614', '0.514351', '0.493091', '0.511262', '0.496701']
         : correct/total = [(7342, 14232), (7310, 14235), (7085, 14266), (7394, 14217), (6977, 14238), (7115, 14373), (7148, 14346), (7189, 14334), (7371, 14294), (7314, 14373), (7160, 14344), (7231, 14302), (7344, 14354), (7425, 14362), (7044, 14320), (7048, 14395), (7401, 14389), (7030, 14257), (7286, 14251), (7152, 14399)]
         : compromised: 0.5049, honest: 0.5039

=== FINAL RESULTS ===
Dataset: sent140, Nodes: 20, Graph: erdos, Aggregation: krum
Attack: directed_deviation, 40.0% compromised
Final accuracy - Compromised: 0.5049, Honest: 0.5039
Overall test accuracy: mean=0.5043 ± 0.0099
