Device: cuda
Seed: 987654321
Loading 1 LEAF Sent140 train files...
LEAF Sent140 train: 254555 users, 908652 samples
Building vocabulary (max_size=10000)...
Vocabulary size: 10000
Loading 1 LEAF Sent140 test files...
LEAF Sent140 test: 254555 users, 286281 samples
Found 254555 train users, 254555 test users, 254555 common users
User sample counts range: 494 (max) to 1 (min)
Distributed ALL 254555 users across 20 clients
Users per client: 12727 (with 15 clients getting +1 user)
Train partition sizes: [44353, 44290, 44657, 44907, 44696, 45843, 45801, 45619, 45069, 45639, 45821, 45311, 45779, 46056, 45625, 45984, 46428, 44737, 45540, 46497]
Test partition sizes: [14232, 14235, 14266, 14217, 14238, 14373, 14346, 14334, 14294, 14373, 14344, 14302, 14354, 14362, 14320, 14395, 14389, 14257, 14251, 14399]
  Client 0: 44353 train samples, 2 unique classes
  Client 1: 44290 train samples, 2 unique classes
  Client 2: 44657 train samples, 2 unique classes
  Client 3: 44907 train samples, 2 unique classes
  Client 4: 44696 train samples, 2 unique classes
  Client 5: 45843 train samples, 2 unique classes
  Client 6: 45801 train samples, 2 unique classes
  Client 7: 45619 train samples, 2 unique classes
  Client 8: 45069 train samples, 2 unique classes
  Client 9: 45639 train samples, 2 unique classes
  Client 10: 45821 train samples, 2 unique classes
  Client 11: 45311 train samples, 2 unique classes
  Client 12: 45779 train samples, 2 unique classes
  Client 13: 46056 train samples, 2 unique classes
  Client 14: 45625 train samples, 2 unique classes
  Client 15: 45984 train samples, 2 unique classes
  Client 16: 46428 train samples, 2 unique classes
  Client 17: 44737 train samples, 2 unique classes
  Client 18: 45540 train samples, 2 unique classes
  Client 19: 46497 train samples, 2 unique classes
Will sample 4500 samples per client per epoch
Graph: fully, nodes: 20, edges: 190
Degree statistics: avg=19.00, min=19, max=19
Attack: Compromised 10/20 nodes: [1, 2, 5, 11, 12, 13, 14, 15, 17, 18]
Attack type: backdoor, lambda: 1.0
Backdoor target label: 1, trigger size: 3
Model variant: baseline
Model parameters: 1,174,986
BALANCE algorithm:
Balance Config: BALANCEConfig(gamma=2, kappa=1, alpha=0.5, min_neighbors=1)
  - Model dimension: 1,174,986 parameters
  - Complexity: O(N×d) = O(20×1,174,986)
Initial test acc across nodes: mean=0.4965 ± 0.0152
Backdoor attack: Created poisoned datasets for 10 compromised nodes
Round 001: test acc mean=0.4994 ± 0.0076 | min=0.4851 max=0.5144
         : test loss mean=19.8427 ± 20.3448
         : individual accs = ['0.495925', '0.500457', '0.485139', '0.508616', '0.493187', '0.495165', '0.502370', '0.514441', '0.491325', '0.492799', '0.491355', '0.501748', '0.500279', '0.510932', '0.497137', '0.499826', '0.509973', '0.502911', '0.490141', '0.504271']
         : correct/total = [(7058, 14232), (7124, 14235), (6921, 14266), (7231, 14217), (7022, 14238), (7117, 14373), (7207, 14346), (7374, 14334), (7023, 14294), (7083, 14373), (7048, 14344), (7176, 14302), (7181, 14354), (7338, 14362), (7119, 14320), (7195, 14395), (7338, 14389), (7170, 14257), (6985, 14251), (7261, 14399)]
         : compromised: 0.4984, honest: 0.5004
Round 002: test acc mean=0.5041 ± 0.0059 | min=0.4958 max=0.5201
         : test loss mean=756.0418 ± 788.6924
         : individual accs = ['0.510540', '0.505234', '0.520118', '0.507350', '0.498174', '0.499896', '0.499791', '0.500558', '0.506786', '0.508523', '0.500558', '0.500769', '0.498119', '0.496588', '0.508031', '0.505314', '0.507262', '0.495756', '0.501228', '0.511841']
         : correct/total = [(7266, 14232), (7192, 14235), (7420, 14266), (7213, 14217), (7093, 14238), (7185, 14373), (7170, 14346), (7175, 14334), (7244, 14294), (7309, 14373), (7180, 14344), (7162, 14302), (7150, 14354), (7132, 14362), (7275, 14320), (7274, 14395), (7299, 14389), (7068, 14257), (7143, 14251), (7370, 14399)]
         : compromised: 0.5031, honest: 0.5051
Round 003: test acc mean=0.5053 ± 0.0050 | min=0.4960 max=0.5116
         : test loss mean=42320.2132 ± 43055.5547
         : individual accs = ['0.510891', '0.496804', '0.504696', '0.507702', '0.505478', '0.496695', '0.502370', '0.511511', '0.511263', '0.508453', '0.500976', '0.502168', '0.509335', '0.510096', '0.502584', '0.503717', '0.510181', '0.495967', '0.504386', '0.511633']
         : correct/total = [(7271, 14232), (7072, 14235), (7200, 14266), (7218, 14217), (7197, 14238), (7139, 14373), (7207, 14346), (7332, 14334), (7308, 14294), (7308, 14373), (7186, 14344), (7182, 14302), (7311, 14354), (7326, 14362), (7197, 14320), (7251, 14395), (7341, 14389), (7071, 14257), (7188, 14251), (7367, 14399)]
         : compromised: 0.5026, honest: 0.5080
Round 004: test acc mean=0.5059 ± 0.0072 | min=0.4863 max=0.5214
         : test loss mean=6740122.6526 ± 7246235.3873
         : individual accs = ['0.510750', '0.521391', '0.493551', '0.507772', '0.506602', '0.486329', '0.503973', '0.506767', '0.511403', '0.508801', '0.500349', '0.508600', '0.508569', '0.500975', '0.502863', '0.508163', '0.511710', '0.512731', '0.502000', '0.504549']
         : correct/total = [(7269, 14232), (7422, 14235), (7041, 14266), (7219, 14217), (7213, 14238), (6990, 14373), (7230, 14346), (7264, 14334), (7310, 14294), (7313, 14373), (7177, 14344), (7274, 14302), (7300, 14354), (7195, 14362), (7201, 14320), (7315, 14395), (7363, 14389), (7310, 14257), (7154, 14251), (7265, 14399)]
         : compromised: 0.5045, honest: 0.5073
Round 005: test acc mean=0.5386 ± 0.0352 | min=0.4882 max=0.5894
         : test loss mean=306156521.7937 ± 310781086.6196
         : individual accs = ['0.566821', '0.488233', '0.492430', '0.573328', '0.555836', '0.510054', '0.571239', '0.574438', '0.576815', '0.572671', '0.589375', '0.501049', '0.505573', '0.508425', '0.499791', '0.519833', '0.576065', '0.512310', '0.506280', '0.571012']
         : correct/total = [(8067, 14232), (6950, 14235), (7025, 14266), (8151, 14217), (7914, 14238), (7331, 14373), (8195, 14346), (8234, 14334), (8245, 14294), (8231, 14373), (8454, 14344), (7166, 14302), (7257, 14354), (7302, 14362), (7157, 14320), (7483, 14395), (8289, 14389), (7304, 14257), (7215, 14251), (8222, 14399)]
         : compromised: 0.5044, honest: 0.5728
Round 006: test acc mean=0.5556 ± 0.0543 | min=0.4900 max=0.6137
         : test loss mean=23440552626.5750 ± 23892100535.8654
         : individual accs = ['0.601461', '0.489989', '0.492430', '0.613702', '0.610198', '0.505810', '0.611320', '0.612530', '0.604869', '0.613442', '0.612242', '0.501189', '0.514839', '0.496588', '0.503631', '0.508232', '0.608034', '0.498422', '0.504877', '0.608445']
         : correct/total = [(8560, 14232), (6975, 14235), (7025, 14266), (8725, 14217), (8688, 14238), (7270, 14373), (8770, 14346), (8780, 14334), (8646, 14294), (8817, 14373), (8782, 14344), (7168, 14302), (7390, 14354), (7132, 14362), (7212, 14320), (7316, 14395), (8749, 14389), (7106, 14257), (7195, 14251), (8761, 14399)]
         : compromised: 0.5016, honest: 0.6096
Round 007: test acc mean=0.5602 ± 0.0583 | min=0.4910 max=0.6243
         : test loss mean=1863957230755.7766 ± 1906856260850.1477
         : individual accs = ['0.610807', '0.491394', '0.499790', '0.623268', '0.614342', '0.511515', '0.624286', '0.621808', '0.613124', '0.622139', '0.619283', '0.498951', '0.502160', '0.491018', '0.509148', '0.505801', '0.617486', '0.506067', '0.505719', '0.616154']
         : correct/total = [(8693, 14232), (6995, 14235), (7130, 14266), (8861, 14217), (8747, 14238), (7352, 14373), (8956, 14346), (8913, 14334), (8764, 14294), (8942, 14373), (8883, 14344), (7136, 14302), (7208, 14354), (7052, 14362), (7291, 14320), (7281, 14395), (8885, 14389), (7215, 14257), (7207, 14251), (8872, 14399)]
         : compromised: 0.5022, honest: 0.6183
Round 008: test acc mean=0.5648 ± 0.0613 | min=0.4936 max=0.6302
         : test loss mean=158125211964605.4375 ± 162487880088648.4062
         : individual accs = ['0.618465', '0.493572', '0.494603', '0.630161', '0.619820', '0.506853', '0.629723', '0.626134', '0.627186', '0.627496', '0.629601', '0.502517', '0.509684', '0.496031', '0.512849', '0.511497', '0.625478', '0.502209', '0.508035', '0.623932']
         : correct/total = [(8802, 14232), (7026, 14235), (7056, 14266), (8959, 14217), (8825, 14238), (7285, 14373), (9034, 14346), (8975, 14334), (8965, 14294), (9019, 14373), (9031, 14344), (7187, 14302), (7316, 14354), (7124, 14362), (7344, 14320), (7363, 14395), (9000, 14389), (7160, 14257), (7240, 14251), (8984, 14399)]
         : compromised: 0.5038, honest: 0.6258
Round 009: test acc mean=0.5670 ± 0.0633 | min=0.4947 max=0.6347
         : test loss mean=13176946261670968.0000 ± 13585214788052550.0000
         : individual accs = ['0.626476', '0.494696', '0.498318', '0.633045', '0.626282', '0.508523', '0.634672', '0.629413', '0.628306', '0.631531', '0.632878', '0.497902', '0.515257', '0.498816', '0.510964', '0.512817', '0.628814', '0.503051', '0.499123', '0.630044']
         : correct/total = [(8916, 14232), (7042, 14235), (7109, 14266), (9000, 14217), (8917, 14238), (7309, 14373), (9105, 14346), (9022, 14334), (8981, 14294), (9077, 14373), (9078, 14344), (7121, 14302), (7396, 14354), (7164, 14362), (7317, 14320), (7382, 14395), (9048, 14389), (7172, 14257), (7113, 14251), (9072, 14399)]
         : compromised: 0.5039, honest: 0.6301
Round 010: test acc mean=0.5695 ± 0.0652 | min=0.4964 max=0.6404
         : test loss mean=1081817429666444672.0000 ± 1111450444127317760.0000
         : individual accs = ['0.632448', '0.499052', '0.503435', '0.640360', '0.629091', '0.518472', '0.638645', '0.631645', '0.633902', '0.635497', '0.638176', '0.502867', '0.505782', '0.496379', '0.504888', '0.506356', '0.631733', '0.504173', '0.503894', '0.633725']
         : correct/total = [(9001, 14232), (7104, 14235), (7182, 14266), (9104, 14217), (8957, 14238), (7452, 14373), (9162, 14346), (9054, 14334), (9061, 14294), (9134, 14373), (9154, 14344), (7192, 14302), (7260, 14354), (7129, 14362), (7230, 14320), (7289, 14395), (9090, 14389), (7188, 14257), (7181, 14251), (9125, 14399)]
         : compromised: 0.5045, honest: 0.6345

=== FINAL RESULTS ===
Dataset: sent140, Nodes: 20, Graph: fully, Aggregation: balance
Attack: backdoor, 50.0% compromised
Final accuracy - Compromised: 0.5045, Honest: 0.6345
Overall test accuracy: mean=0.5695 ± 0.0652

=== BACKDOOR ATTACK SUCCESS RATE (ASR) ===
Target label: 1
Trigger size: 3x3
Overall ASR: 0.7402 ± 0.2551
Honest nodes ASR: 0.4865 ± 0.0376
Compromised nodes ASR: 0.9939 ± 0.0035
Note: Higher ASR indicates more successful backdoor attack

=== BALANCE SUMMARY ===
Node 0: acceptance=0.526
Node 1: acceptance=0.700
Node 2: acceptance=0.700
Node 3: acceptance=0.526
Node 4: acceptance=0.526
Node 5: acceptance=0.700
Node 6: acceptance=0.526
Node 7: acceptance=0.526
Node 8: acceptance=0.526
Node 9: acceptance=0.526
Node 10: acceptance=0.526
Node 11: acceptance=0.700
Node 12: acceptance=0.700
Node 13: acceptance=0.700
Node 14: acceptance=0.700
Node 15: acceptance=0.700
Node 16: acceptance=0.526
Node 17: acceptance=0.700
Node 18: acceptance=0.800
Node 19: acceptance=0.526

=== PARALLEL EXECUTION TIME (realistic for distributed system) ===
  COMMUNICATION (max across nodes):
    - Full model transfer: 0.000s (0.0%)
  COMPUTATION (max across nodes):
    - Filtering: 0.084s (84.2%)
    - Aggregation: 0.016s (15.7%)
  TOTALS:
    - Total computation: 0.099s (100.0%)
    - Total communication: 0.000s (0.0%)
    - Total parallel time: 0.099s

=== PER-NODE AVERAGE TIME ===
  - Filtering: 0.078s
  - Aggregation: 0.011s
  - Model transfer: 0.000s
  - Total per node: 0.089s

=== TOTAL COMPUTATIONAL WORK (sum across all nodes) ===
  - Total filtering: 1.567s
  - Total aggregation: 0.212s
  - Total model transfer: 0.000s
  - Grand total: 1.779s
  - Mean acceptance rate: 0.618

BALANCE Algorithm Properties:
  - Model dimension: 1,174,986
  - No compression: Full parameter comparison
  - Theoretical complexity: O(deg(i)×d)
  - Approach: Full parameter filtering + averaging
