Device: cuda
Seed: 987654321
Loading 1 LEAF Sent140 train files...
LEAF Sent140 train: 254555 users, 908652 samples
Building vocabulary (max_size=10000)...
Vocabulary size: 10000
Loading 1 LEAF Sent140 test files...
LEAF Sent140 test: 254555 users, 286281 samples
Found 254555 train users, 254555 test users, 254555 common users
User sample counts range: 494 (max) to 1 (min)
Distributed ALL 254555 users across 20 clients
Users per client: 12727 (with 15 clients getting +1 user)
Train partition sizes: [44353, 44290, 44657, 44907, 44696, 45843, 45801, 45619, 45069, 45639, 45821, 45311, 45779, 46056, 45625, 45984, 46428, 44737, 45540, 46497]
Test partition sizes: [14232, 14235, 14266, 14217, 14238, 14373, 14346, 14334, 14294, 14373, 14344, 14302, 14354, 14362, 14320, 14395, 14389, 14257, 14251, 14399]
  Client 0: 44353 train samples, 2 unique classes
  Client 1: 44290 train samples, 2 unique classes
  Client 2: 44657 train samples, 2 unique classes
  Client 3: 44907 train samples, 2 unique classes
  Client 4: 44696 train samples, 2 unique classes
  Client 5: 45843 train samples, 2 unique classes
  Client 6: 45801 train samples, 2 unique classes
  Client 7: 45619 train samples, 2 unique classes
  Client 8: 45069 train samples, 2 unique classes
  Client 9: 45639 train samples, 2 unique classes
  Client 10: 45821 train samples, 2 unique classes
  Client 11: 45311 train samples, 2 unique classes
  Client 12: 45779 train samples, 2 unique classes
  Client 13: 46056 train samples, 2 unique classes
  Client 14: 45625 train samples, 2 unique classes
  Client 15: 45984 train samples, 2 unique classes
  Client 16: 46428 train samples, 2 unique classes
  Client 17: 44737 train samples, 2 unique classes
  Client 18: 45540 train samples, 2 unique classes
  Client 19: 46497 train samples, 2 unique classes
Will sample 4500 samples per client per epoch
Graph: erdos, nodes: 20, edges: 48
Degree statistics: avg=4.80, min=2, max=7
Attack: Compromised 14/20 nodes: [1, 2, 3, 5, 6, 8, 11, 12, 13, 14, 15, 17, 18, 19]
Attack type: directed_deviation, lambda: 1.0
Model variant: baseline
Model parameters: 1,174,986
Initial test acc across nodes: mean=0.4965 ± 0.0152
Round 001: test acc mean=0.4973 ± 0.0067 | min=0.4859 max=0.5071
         : test loss mean=12.7528 ± 8.1941
         : individual accs = ['0.506886', '0.489498', '0.490046', '0.507139', '0.503582', '0.498991', '0.502928', '0.498116', '0.496992', '0.506436', '0.493935', '0.491889', '0.493869', '0.489417', '0.501606', '0.498784', '0.503649', '0.485937', '0.486282', '0.499965']
         : correct/total = [(7214, 14232), (6968, 14235), (6991, 14266), (7210, 14217), (7170, 14238), (7172, 14373), (7215, 14346), (7140, 14334), (7104, 14294), (7279, 14373), (7085, 14344), (7035, 14302), (7089, 14354), (7029, 14362), (7183, 14320), (7180, 14395), (7247, 14389), (6928, 14257), (6930, 14251), (7199, 14399)]
         : compromised: 0.4952, honest: 0.5021
Round 002: test acc mean=0.4989 ± 0.0070 | min=0.4839 max=0.5100
         : test loss mean=10.5195 ± 3.8461
         : individual accs = ['0.500984', '0.487460', '0.505748', '0.502919', '0.498525', '0.496973', '0.502509', '0.506139', '0.507835', '0.498643', '0.483896', '0.497133', '0.487321', '0.509957', '0.491271', '0.508024', '0.500174', '0.498913', '0.496176', '0.496771']
         : correct/total = [(7130, 14232), (6939, 14235), (7215, 14266), (7150, 14217), (7098, 14238), (7143, 14373), (7209, 14346), (7255, 14334), (7259, 14294), (7167, 14373), (6941, 14344), (7110, 14302), (6995, 14354), (7324, 14362), (7035, 14320), (7313, 14395), (7197, 14389), (7113, 14257), (7071, 14251), (7153, 14399)]
         : compromised: 0.4992, honest: 0.4981
Round 003: test acc mean=0.5031 ± 0.0089 | min=0.4885 max=0.5211
         : test loss mean=2.4922 ± 0.9227
         : individual accs = ['0.498735', '0.488514', '0.513599', '0.504466', '0.503020', '0.499756', '0.504949', '0.489256', '0.514412', '0.512419', '0.498118', '0.518039', '0.495193', '0.500418', '0.500140', '0.495658', '0.493849', '0.505857', '0.504877', '0.521147']
         : correct/total = [(7098, 14232), (6954, 14235), (7327, 14266), (7172, 14217), (7162, 14238), (7183, 14373), (7244, 14346), (7013, 14334), (7353, 14294), (7365, 14373), (7145, 14344), (7409, 14302), (7108, 14354), (7187, 14362), (7162, 14320), (7135, 14395), (7106, 14389), (7212, 14257), (7195, 14251), (7504, 14399)]
         : compromised: 0.5048, honest: 0.4992
Round 004: test acc mean=0.5007 ± 0.0064 | min=0.4877 max=0.5132
         : test loss mean=6.2104 ± 2.9019
         : individual accs = ['0.505059', '0.494064', '0.493902', '0.496729', '0.502739', '0.494538', '0.504391', '0.505581', '0.496292', '0.499687', '0.495678', '0.512656', '0.501463', '0.499791', '0.501257', '0.497187', '0.509139', '0.513151', '0.503894', '0.487673']
         : correct/total = [(7188, 14232), (7033, 14235), (7046, 14266), (7062, 14217), (7158, 14238), (7108, 14373), (7236, 14346), (7247, 14334), (7094, 14294), (7182, 14373), (7110, 14344), (7332, 14302), (7198, 14354), (7178, 14362), (7178, 14320), (7157, 14395), (7326, 14389), (7316, 14257), (7181, 14251), (7022, 14399)]
         : compromised: 0.4998, honest: 0.5030
Round 005: test acc mean=0.4993 ± 0.0105 | min=0.4829 max=0.5151
         : test loss mean=2.5019 ± 1.4042
         : individual accs = ['0.482926', '0.506639', '0.512267', '0.504255', '0.503020', '0.485702', '0.514290', '0.502651', '0.506156', '0.495512', '0.492610', '0.514334', '0.500488', '0.490531', '0.488128', '0.486072', '0.484606', '0.515115', '0.494351', '0.506077']
         : correct/total = [(6873, 14232), (7212, 14235), (7308, 14266), (7169, 14217), (7162, 14238), (6981, 14373), (7378, 14346), (7205, 14334), (7235, 14294), (7122, 14373), (7066, 14344), (7356, 14302), (7184, 14354), (7045, 14362), (6990, 14320), (6997, 14395), (6973, 14389), (7344, 14257), (7045, 14251), (7287, 14399)]
         : compromised: 0.5017, honest: 0.4936
Round 006: test acc mean=0.4995 ± 0.0061 | min=0.4889 max=0.5171
         : test loss mean=4.0735 ± 2.1627
         : individual accs = ['0.496065', '0.505655', '0.492990', '0.500950', '0.499157', '0.495791', '0.497351', '0.517092', '0.488876', '0.500731', '0.495678', '0.499650', '0.496517', '0.503203', '0.497975', '0.493088', '0.502884', '0.510346', '0.498000', '0.497257']
         : correct/total = [(7060, 14232), (7198, 14235), (7033, 14266), (7122, 14217), (7107, 14238), (7126, 14373), (7135, 14346), (7412, 14334), (6988, 14294), (7197, 14373), (7110, 14344), (7146, 14302), (7127, 14354), (7227, 14362), (7131, 14320), (7098, 14395), (7236, 14389), (7276, 14257), (7097, 14251), (7160, 14399)]
         : compromised: 0.4984, honest: 0.5019
Round 007: test acc mean=0.5012 ± 0.0062 | min=0.4907 max=0.5139
         : test loss mean=2.4561 ± 1.3150
         : individual accs = ['0.495292', '0.490692', '0.491448', '0.494338', '0.513906', '0.493982', '0.499024', '0.504953', '0.503078', '0.498017', '0.500488', '0.507621', '0.504528', '0.512603', '0.498045', '0.502258', '0.501286', '0.503963', '0.507684', '0.499826']
         : correct/total = [(7049, 14232), (6985, 14235), (7011, 14266), (7028, 14217), (7317, 14238), (7100, 14373), (7159, 14346), (7238, 14334), (7191, 14294), (7158, 14373), (7179, 14344), (7260, 14302), (7242, 14354), (7362, 14362), (7132, 14320), (7230, 14395), (7213, 14389), (7185, 14257), (7235, 14251), (7197, 14399)]
         : compromised: 0.5006, honest: 0.5023
Round 008: test acc mean=0.5014 ± 0.0039 | min=0.4957 max=0.5109
         : test loss mean=3.8528 ± 2.2619
         : individual accs = ['0.507026', '0.497295', '0.503365', '0.498417', '0.499227', '0.496834', '0.500070', '0.499581', '0.500070', '0.506227', '0.501394', '0.497763', '0.506827', '0.510932', '0.501676', '0.498159', '0.502467', '0.503191', '0.495685', '0.501910']
         : correct/total = [(7216, 14232), (7079, 14235), (7181, 14266), (7086, 14217), (7108, 14238), (7141, 14373), (7174, 14346), (7161, 14334), (7148, 14294), (7276, 14373), (7192, 14344), (7119, 14302), (7275, 14354), (7338, 14362), (7184, 14320), (7171, 14395), (7230, 14389), (7174, 14257), (7064, 14251), (7227, 14399)]
         : compromised: 0.5009, honest: 0.5027
Round 009: test acc mean=0.4990 ± 0.0074 | min=0.4820 max=0.5119
         : test loss mean=2.5447 ± 1.6186
         : individual accs = ['0.499297', '0.501932', '0.498808', '0.491595', '0.493679', '0.505879', '0.504810', '0.489745', '0.498741', '0.496278', '0.497211', '0.511886', '0.482026', '0.487954', '0.498045', '0.496700', '0.505178', '0.504735', '0.505228', '0.509966']
         : correct/total = [(7106, 14232), (7145, 14235), (7116, 14266), (6989, 14217), (7029, 14238), (7271, 14373), (7242, 14346), (7020, 14334), (7129, 14294), (7133, 14373), (7132, 14344), (7321, 14302), (6919, 14354), (7008, 14362), (7132, 14320), (7150, 14395), (7269, 14389), (7196, 14257), (7200, 14251), (7343, 14399)]
         : compromised: 0.4999, honest: 0.4969
Round 010: test acc mean=0.5008 ± 0.0080 | min=0.4884 max=0.5147
         : test loss mean=3.4066 ± 2.0993
         : individual accs = ['0.508080', '0.501300', '0.492149', '0.494338', '0.505619', '0.488972', '0.502091', '0.514720', '0.504897', '0.510193', '0.489055', '0.491889', '0.511913', '0.504038', '0.504749', '0.488433', '0.510390', '0.497650', '0.500175', '0.495868']
         : correct/total = [(7231, 14232), (7136, 14235), (7021, 14266), (7028, 14217), (7199, 14238), (7028, 14373), (7203, 14346), (7378, 14334), (7217, 14294), (7333, 14373), (7015, 14344), (7035, 14302), (7348, 14354), (7239, 14362), (7228, 14320), (7031, 14395), (7344, 14389), (7095, 14257), (7128, 14251), (7140, 14399)]
         : compromised: 0.4985, honest: 0.5063

=== FINAL RESULTS ===
Dataset: sent140, Nodes: 20, Graph: erdos, Aggregation: krum
Attack: directed_deviation, 70.0% compromised
Final accuracy - Compromised: 0.4985, Honest: 0.5063
Overall test accuracy: mean=0.5008 ± 0.0080
