Device: cuda
Seed: 987654321
Loading 1 LEAF Sent140 train files...
LEAF Sent140 train: 254555 users, 908652 samples
Building vocabulary (max_size=10000)...
Vocabulary size: 10000
Loading 1 LEAF Sent140 test files...
LEAF Sent140 test: 254555 users, 286281 samples
Found 254555 train users, 254555 test users, 254555 common users
User sample counts range: 494 (max) to 1 (min)
Distributed ALL 254555 users across 20 clients
Users per client: 12727 (with 15 clients getting +1 user)
Train partition sizes: [44353, 44290, 44657, 44907, 44696, 45843, 45801, 45619, 45069, 45639, 45821, 45311, 45779, 46056, 45625, 45984, 46428, 44737, 45540, 46497]
Test partition sizes: [14232, 14235, 14266, 14217, 14238, 14373, 14346, 14334, 14294, 14373, 14344, 14302, 14354, 14362, 14320, 14395, 14389, 14257, 14251, 14399]
  Client 0: 44353 train samples, 2 unique classes
  Client 1: 44290 train samples, 2 unique classes
  Client 2: 44657 train samples, 2 unique classes
  Client 3: 44907 train samples, 2 unique classes
  Client 4: 44696 train samples, 2 unique classes
  Client 5: 45843 train samples, 2 unique classes
  Client 6: 45801 train samples, 2 unique classes
  Client 7: 45619 train samples, 2 unique classes
  Client 8: 45069 train samples, 2 unique classes
  Client 9: 45639 train samples, 2 unique classes
  Client 10: 45821 train samples, 2 unique classes
  Client 11: 45311 train samples, 2 unique classes
  Client 12: 45779 train samples, 2 unique classes
  Client 13: 46056 train samples, 2 unique classes
  Client 14: 45625 train samples, 2 unique classes
  Client 15: 45984 train samples, 2 unique classes
  Client 16: 46428 train samples, 2 unique classes
  Client 17: 44737 train samples, 2 unique classes
  Client 18: 45540 train samples, 2 unique classes
  Client 19: 46497 train samples, 2 unique classes
Will sample 4500 samples per client per epoch
Graph: ring, nodes: 20, edges: 20
Degree statistics: avg=2.00, min=2, max=2
Attack: Compromised 14/20 nodes: [1, 2, 3, 5, 6, 8, 11, 12, 13, 14, 15, 17, 18, 19]
Attack type: krum, lambda: 1.0
Model variant: baseline
Model parameters: 1,174,986
BALANCE algorithm:
Balance Config: BALANCEConfig(gamma=2, kappa=1, alpha=0.5, min_neighbors=1)
  - Model dimension: 1,174,986 parameters
  - Complexity: O(N×d) = O(20×1,174,986)
Initial test acc across nodes: mean=0.4953 ± 0.0174
Round 001: test acc mean=0.5018 ± 0.0088 | min=0.4895 max=0.5190
         : test loss mean=3.7081 ± 2.8439
         : individual accs = ['0.504918', '0.514366', '0.491658', '0.507913', '0.492696', '0.501426', '0.501743', '0.491349', '0.501189', '0.518959', '0.489891', '0.512586', '0.489550', '0.502437', '0.493436', '0.494547', '0.511224', '0.511328', '0.497930', '0.507396']
         : correct/total = [(7186, 14232), (7322, 14235), (7014, 14266), (7221, 14217), (7015, 14238), (7207, 14373), (7198, 14346), (7043, 14334), (7164, 14294), (7459, 14373), (7027, 14344), (7331, 14302), (7027, 14354), (7216, 14362), (7066, 14320), (7119, 14395), (7356, 14389), (7290, 14257), (7096, 14251), (7306, 14399)]
         : compromised: 0.5020, honest: 0.5015
Round 002: test acc mean=0.5013 ± 0.0074 | min=0.4890 max=0.5148
         : test loss mean=2.4386 ± 1.8323
         : individual accs = ['0.510891', '0.497014', '0.513669', '0.510656', '0.506181', '0.508314', '0.497630', '0.504604', '0.499160', '0.491755', '0.491286', '0.514823', '0.496447', '0.488999', '0.498324', '0.500521', '0.498923', '0.494424', '0.497439', '0.504827']
         : correct/total = [(7271, 14232), (7075, 14235), (7328, 14266), (7260, 14217), (7207, 14238), (7306, 14373), (7139, 14346), (7233, 14334), (7135, 14294), (7068, 14373), (7047, 14344), (7363, 14302), (7126, 14354), (7023, 14362), (7136, 14320), (7205, 14395), (7179, 14389), (7049, 14257), (7089, 14251), (7269, 14399)]
         : compromised: 0.5016, honest: 0.5006
Round 003: test acc mean=0.4994 ± 0.0116 | min=0.4777 max=0.5248
         : test loss mean=1.2414 ± 0.5477
         : individual accs = ['0.500843', '0.479452', '0.481284', '0.498277', '0.503371', '0.477701', '0.498885', '0.493442', '0.510424', '0.493773', '0.504880', '0.512166', '0.506061', '0.492202', '0.494274', '0.524835', '0.510529', '0.494704', '0.512596', '0.498993']
         : correct/total = [(7128, 14232), (6825, 14235), (6866, 14266), (7084, 14217), (7167, 14238), (6866, 14373), (7157, 14346), (7073, 14334), (7296, 14294), (7097, 14373), (7242, 14344), (7325, 14302), (7264, 14354), (7069, 14362), (7078, 14320), (7555, 14395), (7346, 14389), (7053, 14257), (7305, 14251), (7185, 14399)]
         : compromised: 0.4987, honest: 0.5011
Round 004: test acc mean=0.5155 ± 0.0272 | min=0.4878 max=0.5949
         : test loss mean=0.9329 ± 0.2686
         : individual accs = ['0.494800', '0.525465', '0.500210', '0.499402', '0.504635', '0.503653', '0.500558', '0.487791', '0.499580', '0.594935', '0.588051', '0.511537', '0.502369', '0.515597', '0.500768', '0.519694', '0.509000', '0.527811', '0.509087', '0.515800']
         : correct/total = [(7042, 14232), (7480, 14235), (7136, 14266), (7100, 14217), (7185, 14238), (7239, 14373), (7181, 14346), (6992, 14334), (7141, 14294), (8551, 14373), (8435, 14344), (7316, 14302), (7211, 14354), (7405, 14362), (7171, 14320), (7481, 14395), (7324, 14389), (7525, 14257), (7255, 14251), (7427, 14399)]
         : compromised: 0.5094, honest: 0.5299
Round 005: test acc mean=0.5270 ± 0.0392 | min=0.4982 max=0.6194
         : test loss mean=1.5034 ± 0.5847
         : individual accs = ['0.504356', '0.529399', '0.508832', '0.500668', '0.501124', '0.509010', '0.501394', '0.510674', '0.543935', '0.619425', '0.614543', '0.608656', '0.509544', '0.504038', '0.503492', '0.506495', '0.498158', '0.503402', '0.510140', '0.553025']
         : correct/total = [(7178, 14232), (7536, 14235), (7259, 14266), (7118, 14217), (7135, 14238), (7316, 14373), (7193, 14346), (7320, 14334), (7775, 14294), (8903, 14373), (8815, 14344), (8705, 14302), (7314, 14354), (7239, 14362), (7210, 14320), (7291, 14395), (7168, 14389), (7177, 14257), (7270, 14251), (7963, 14399)]
         : compromised: 0.5209, honest: 0.5414
Round 006: test acc mean=0.5283 ± 0.0508 | min=0.4915 max=0.6338
         : test loss mean=0.7417 ± 0.0657
         : individual accs = ['0.494730', '0.525044', '0.491518', '0.507913', '0.496699', '0.499061', '0.496375', '0.492605', '0.622429', '0.633758', '0.630508', '0.626066', '0.502926', '0.502855', '0.492109', '0.504828', '0.512058', '0.507540', '0.501579', '0.524967']
         : correct/total = [(7041, 14232), (7474, 14235), (7012, 14266), (7221, 14217), (7072, 14238), (7173, 14373), (7121, 14346), (7061, 14334), (8897, 14294), (9109, 14373), (9044, 14344), (8954, 14302), (7219, 14354), (7222, 14362), (7047, 14320), (7267, 14395), (7368, 14389), (7236, 14257), (7148, 14251), (7559, 14399)]
         : compromised: 0.5218, honest: 0.5434
Round 007: test acc mean=0.5346 ± 0.0516 | min=0.4993 max=0.6380
         : test loss mean=1.4363 ± 0.5300
         : individual accs = ['0.505481', '0.550474', '0.503855', '0.505733', '0.504355', '0.505601', '0.499861', '0.506907', '0.638030', '0.634384', '0.629810', '0.636694', '0.500766', '0.508773', '0.503701', '0.505870', '0.509347', '0.499334', '0.502631', '0.541218']
         : correct/total = [(7194, 14232), (7836, 14235), (7188, 14266), (7190, 14217), (7181, 14238), (7267, 14373), (7171, 14346), (7266, 14334), (9120, 14294), (9118, 14373), (9034, 14344), (9106, 14302), (7188, 14354), (7307, 14362), (7213, 14320), (7282, 14395), (7329, 14389), (7119, 14257), (7163, 14251), (7793, 14399)]
         : compromised: 0.5288, honest: 0.5484
Round 008: test acc mean=0.5330 ± 0.0604 | min=0.4842 max=0.6533
         : test loss mean=0.7192 ± 0.0789
         : individual accs = ['0.494941', '0.484229', '0.485840', '0.500246', '0.498806', '0.507758', '0.492193', '0.491838', '0.653281', '0.651082', '0.652817', '0.650468', '0.508848', '0.531959', '0.504190', '0.513928', '0.511641', '0.509083', '0.504807', '0.511147']
         : correct/total = [(7044, 14232), (6893, 14235), (6931, 14266), (7112, 14217), (7102, 14238), (7298, 14373), (7061, 14346), (7050, 14334), (9338, 14294), (9358, 14373), (9364, 14344), (9303, 14302), (7304, 14354), (7640, 14362), (7220, 14320), (7398, 14395), (7362, 14389), (7258, 14257), (7194, 14251), (7360, 14399)]
         : compromised: 0.5256, honest: 0.5502
Round 009: test acc mean=0.5335 ± 0.0634 | min=0.4873 max=0.6633
         : test loss mean=1.5265 ± 0.6365
         : individual accs = ['0.502038', '0.517246', '0.502804', '0.487304', '0.505759', '0.505601', '0.493308', '0.500209', '0.662376', '0.656509', '0.655675', '0.663334', '0.513376', '0.488302', '0.508310', '0.498923', '0.505525', '0.508031', '0.493790', '0.501354']
         : correct/total = [(7145, 14232), (7363, 14235), (7173, 14266), (6928, 14217), (7201, 14238), (7267, 14373), (7077, 14346), (7170, 14334), (9468, 14294), (9436, 14373), (9405, 14344), (9487, 14302), (7369, 14354), (7013, 14362), (7279, 14320), (7182, 14395), (7274, 14389), (7243, 14257), (7037, 14251), (7219, 14399)]
         : compromised: 0.5246, honest: 0.5543
Round 010: test acc mean=0.5338 ± 0.0674 | min=0.4818 max=0.6724
         : test loss mean=0.7823 ± 0.1834
         : individual accs = ['0.508010', '0.515560', '0.507500', '0.487234', '0.481809', '0.502887', '0.506413', '0.494349', '0.672380', '0.663327', '0.667248', '0.667739', '0.500975', '0.503551', '0.499651', '0.511219', '0.496977', '0.496458', '0.499614', '0.492673']
         : correct/total = [(7230, 14232), (7339, 14235), (7240, 14266), (6927, 14217), (6860, 14238), (7228, 14373), (7265, 14346), (7086, 14334), (9611, 14294), (9534, 14373), (9571, 14344), (9550, 14302), (7191, 14354), (7232, 14362), (7155, 14320), (7359, 14395), (7151, 14389), (7078, 14257), (7120, 14251), (7094, 14399)]
         : compromised: 0.5260, honest: 0.5520

=== FINAL RESULTS ===
Dataset: sent140, Nodes: 20, Graph: ring, Aggregation: balance
Attack: krum, 70.0% compromised
Final accuracy - Compromised: 0.5260, Honest: 0.5520
Overall test accuracy: mean=0.5338 ± 0.0674

=== BALANCE SUMMARY ===
Node 0: acceptance=0.200
Node 1: acceptance=0.600
Node 2: acceptance=0.200
Node 3: acceptance=0.600
Node 4: acceptance=0.200
Node 5: acceptance=0.600
Node 6: acceptance=0.600
Node 7: acceptance=0.200
Node 8: acceptance=0.600
Node 9: acceptance=0.650
Node 10: acceptance=0.650
Node 11: acceptance=0.550
Node 12: acceptance=0.200
Node 13: acceptance=0.200
Node 14: acceptance=0.200
Node 15: acceptance=0.600
Node 16: acceptance=0.200
Node 17: acceptance=0.600
Node 18: acceptance=0.200
Node 19: acceptance=0.600

=== PARALLEL EXECUTION TIME (realistic for distributed system) ===
  COMMUNICATION (max across nodes):
    - Full model transfer: 0.000s (0.0%)
  COMPUTATION (max across nodes):
    - Filtering: 0.013s (55.7%)
    - Aggregation: 0.011s (44.2%)
  TOTALS:
    - Total computation: 0.024s (100.0%)
    - Total communication: 0.000s (0.0%)
    - Total parallel time: 0.024s

=== PER-NODE AVERAGE TIME ===
  - Filtering: 0.011s
  - Aggregation: 0.005s
  - Model transfer: 0.000s
  - Total per node: 0.016s

=== TOTAL COMPUTATIONAL WORK (sum across all nodes) ===
  - Total filtering: 0.222s
  - Total aggregation: 0.097s
  - Total model transfer: 0.000s
  - Grand total: 0.320s
  - Mean acceptance rate: 0.422

BALANCE Algorithm Properties:
  - Model dimension: 1,174,986
  - No compression: Full parameter comparison
  - Theoretical complexity: O(deg(i)×d)
  - Approach: Full parameter filtering + averaging
