Device: cuda
Seed: 987654321
Loading 1 LEAF Sent140 train files...
LEAF Sent140 train: 254555 users, 908652 samples
Building vocabulary (max_size=10000)...
Vocabulary size: 10000
Loading 1 LEAF Sent140 test files...
LEAF Sent140 test: 254555 users, 286281 samples
Found 254555 train users, 254555 test users, 254555 common users
User sample counts range: 494 (max) to 1 (min)
Distributed ALL 254555 users across 20 clients
Users per client: 12727 (with 15 clients getting +1 user)
Train partition sizes: [44353, 44290, 44657, 44907, 44696, 45843, 45801, 45619, 45069, 45639, 45821, 45311, 45779, 46056, 45625, 45984, 46428, 44737, 45540, 46497]
Test partition sizes: [14232, 14235, 14266, 14217, 14238, 14373, 14346, 14334, 14294, 14373, 14344, 14302, 14354, 14362, 14320, 14395, 14389, 14257, 14251, 14399]
  Client 0: 44353 train samples, 2 unique classes
  Client 1: 44290 train samples, 2 unique classes
  Client 2: 44657 train samples, 2 unique classes
  Client 3: 44907 train samples, 2 unique classes
  Client 4: 44696 train samples, 2 unique classes
  Client 5: 45843 train samples, 2 unique classes
  Client 6: 45801 train samples, 2 unique classes
  Client 7: 45619 train samples, 2 unique classes
  Client 8: 45069 train samples, 2 unique classes
  Client 9: 45639 train samples, 2 unique classes
  Client 10: 45821 train samples, 2 unique classes
  Client 11: 45311 train samples, 2 unique classes
  Client 12: 45779 train samples, 2 unique classes
  Client 13: 46056 train samples, 2 unique classes
  Client 14: 45625 train samples, 2 unique classes
  Client 15: 45984 train samples, 2 unique classes
  Client 16: 46428 train samples, 2 unique classes
  Client 17: 44737 train samples, 2 unique classes
  Client 18: 45540 train samples, 2 unique classes
  Client 19: 46497 train samples, 2 unique classes
Will sample 4500 samples per client per epoch
Graph: erdos, nodes: 20, edges: 126
Degree statistics: avg=12.60, min=8, max=16
Attack: Compromised 8/20 nodes: [1, 5, 11, 12, 13, 14, 17, 18]
Attack type: directed_deviation, lambda: 1.0
Model variant: baseline
Model parameters: 1,174,986
Initial test acc across nodes: mean=0.4953 ± 0.0174
Round 001: test acc mean=0.4996 ± 0.0053 | min=0.4922 max=0.5104
         : test loss mean=20.4845 ± 8.7756
         : individual accs = ['0.510399', '0.499824', '0.507851', '0.506436', '0.494662', '0.499269', '0.502719', '0.497070', '0.506576', '0.494538', '0.501603', '0.504195', '0.500418', '0.493942', '0.492179', '0.497117', '0.492738', '0.500736', '0.494842', '0.494618']
         : correct/total = [(7264, 14232), (7115, 14235), (7245, 14266), (7200, 14217), (7043, 14238), (7176, 14373), (7212, 14346), (7125, 14334), (7241, 14294), (7108, 14373), (7195, 14344), (7211, 14302), (7183, 14354), (7094, 14362), (7048, 14320), (7156, 14395), (7090, 14389), (7139, 14257), (7052, 14251), (7122, 14399)]
         : compromised: 0.4982, honest: 0.5005
Round 002: test acc mean=0.5054 ± 0.0057 | min=0.4940 max=0.5175
         : test loss mean=9.8838 ± 6.1090
         : individual accs = ['0.506254', '0.517527', '0.507080', '0.496870', '0.505057', '0.510401', '0.512477', '0.509000', '0.512453', '0.505740', '0.500349', '0.493987', '0.506270', '0.512533', '0.500489', '0.499062', '0.503788', '0.501368', '0.504526', '0.503646']
         : correct/total = [(7205, 14232), (7367, 14235), (7234, 14266), (7064, 14217), (7191, 14238), (7336, 14373), (7352, 14346), (7296, 14334), (7325, 14294), (7269, 14373), (7177, 14344), (7065, 14302), (7267, 14354), (7361, 14362), (7167, 14320), (7184, 14395), (7249, 14389), (7148, 14257), (7190, 14251), (7252, 14399)]
         : compromised: 0.5059, honest: 0.5051
Round 003: test acc mean=0.5042 ± 0.0056 | min=0.4908 max=0.5145
         : test loss mean=2.1023 ± 0.5738
         : individual accs = ['0.502178', '0.510362', '0.514510', '0.499543', '0.504706', '0.501009', '0.510595', '0.504814', '0.506856', '0.508384', '0.510666', '0.500070', '0.501045', '0.494848', '0.502025', '0.490795', '0.508861', '0.508101', '0.504386', '0.500729']
         : correct/total = [(7147, 14232), (7265, 14235), (7340, 14266), (7102, 14217), (7186, 14238), (7201, 14373), (7325, 14346), (7236, 14334), (7245, 14294), (7307, 14373), (7325, 14344), (7152, 14302), (7192, 14354), (7107, 14362), (7189, 14320), (7065, 14395), (7322, 14389), (7244, 14257), (7188, 14251), (7210, 14399)]
         : compromised: 0.5027, honest: 0.5052
Round 004: test acc mean=0.4989 ± 0.0069 | min=0.4844 max=0.5096
         : test loss mean=5.2831 ± 2.5141
         : individual accs = ['0.497189', '0.484440', '0.488154', '0.507561', '0.499649', '0.505392', '0.505646', '0.500558', '0.499021', '0.501218', '0.493377', '0.502797', '0.509614', '0.499930', '0.490293', '0.504411', '0.493154', '0.492390', '0.494632', '0.509063']
         : correct/total = [(7076, 14232), (6896, 14235), (6964, 14266), (7216, 14217), (7114, 14238), (7264, 14373), (7254, 14346), (7175, 14334), (7133, 14294), (7204, 14373), (7077, 14344), (7191, 14302), (7315, 14354), (7180, 14362), (7021, 14320), (7261, 14395), (7096, 14389), (7020, 14257), (7049, 14251), (7330, 14399)]
         : compromised: 0.4974, honest: 0.4999
Round 005: test acc mean=0.4987 ± 0.0095 | min=0.4802 max=0.5162
         : test loss mean=1.4800 ± 0.3236
         : individual accs = ['0.509345', '0.516192', '0.494112', '0.491806', '0.495013', '0.504348', '0.495399', '0.486466', '0.487197', '0.502470', '0.508087', '0.480213', '0.500906', '0.482175', '0.498254', '0.505245', '0.507957', '0.507330', '0.495965', '0.505313']
         : correct/total = [(7249, 14232), (7348, 14235), (7049, 14266), (6992, 14217), (7048, 14238), (7249, 14373), (7107, 14346), (6973, 14334), (6964, 14294), (7222, 14373), (7288, 14344), (6868, 14302), (7190, 14354), (6925, 14362), (7135, 14320), (7273, 14395), (7309, 14389), (7233, 14257), (7068, 14251), (7276, 14399)]
         : compromised: 0.4982, honest: 0.4990
Round 006: test acc mean=0.4989 ± 0.0064 | min=0.4877 max=0.5146
         : test loss mean=3.2128 ± 1.2287
         : individual accs = ['0.487704', '0.499614', '0.492780', '0.494689', '0.494030', '0.494260', '0.498885', '0.494279', '0.501679', '0.510749', '0.514571', '0.495735', '0.500348', '0.507729', '0.497277', '0.503925', '0.491973', '0.498843', '0.498000', '0.501354']
         : correct/total = [(6941, 14232), (7112, 14235), (7030, 14266), (7033, 14217), (7034, 14238), (7104, 14373), (7157, 14346), (7085, 14334), (7171, 14294), (7341, 14373), (7381, 14344), (7090, 14302), (7182, 14354), (7292, 14362), (7121, 14320), (7254, 14395), (7079, 14389), (7112, 14257), (7097, 14251), (7219, 14399)]
         : compromised: 0.4990, honest: 0.4989
Round 007: test acc mean=0.4945 ± 0.0067 | min=0.4807 max=0.5066
         : test loss mean=0.8582 ± 0.1943
         : individual accs = ['0.491709', '0.500948', '0.487383', '0.506577', '0.488973', '0.497461', '0.487035', '0.495186', '0.503008', '0.496765', '0.502579', '0.499091', '0.501881', '0.486771', '0.490573', '0.489614', '0.480714', '0.495195', '0.489860', '0.499549']
         : correct/total = [(6998, 14232), (7131, 14235), (6953, 14266), (7202, 14217), (6962, 14238), (7150, 14373), (6987, 14346), (7098, 14334), (7190, 14294), (7140, 14373), (7209, 14344), (7138, 14302), (7204, 14354), (6991, 14362), (7025, 14320), (7048, 14395), (6917, 14389), (7060, 14257), (6981, 14251), (7193, 14399)]
         : compromised: 0.4952, honest: 0.4941
Round 008: test acc mean=0.5044 ± 0.0079 | min=0.4824 max=0.5208
         : test loss mean=0.8284 ± 0.0728
         : individual accs = ['0.512507', '0.482403', '0.499019', '0.514244', '0.494803', '0.505740', '0.503694', '0.504814', '0.513782', '0.520838', '0.502858', '0.499790', '0.500766', '0.503760', '0.511383', '0.499340', '0.507123', '0.503893', '0.504105', '0.502257']
         : correct/total = [(7294, 14232), (6867, 14235), (7119, 14266), (7311, 14217), (7045, 14238), (7269, 14373), (7226, 14346), (7236, 14334), (7344, 14294), (7486, 14373), (7213, 14344), (7148, 14302), (7188, 14354), (7235, 14362), (7323, 14320), (7188, 14395), (7297, 14389), (7184, 14257), (7184, 14251), (7232, 14399)]
         : compromised: 0.5015, honest: 0.5063
Round 009: test acc mean=0.4996 ± 0.0082 | min=0.4828 max=0.5130
         : test loss mean=0.7505 ± 0.0493
         : individual accs = ['0.488969', '0.487741', '0.487312', '0.504959', '0.501826', '0.502470', '0.504810', '0.502651', '0.482790', '0.512976', '0.504322', '0.496504', '0.496099', '0.506267', '0.497556', '0.497325', '0.492946', '0.508031', '0.511192', '0.505938']
         : correct/total = [(6959, 14232), (6943, 14235), (6952, 14266), (7179, 14217), (7145, 14238), (7222, 14373), (7242, 14346), (7205, 14334), (6901, 14294), (7373, 14373), (7234, 14344), (7101, 14302), (7121, 14354), (7271, 14362), (7125, 14320), (7159, 14395), (7093, 14389), (7243, 14257), (7285, 14251), (7285, 14399)]
         : compromised: 0.5007, honest: 0.4989
Round 010: test acc mean=0.5059 ± 0.0059 | min=0.4936 max=0.5150
         : test loss mean=0.8518 ± 0.1830
         : individual accs = ['0.509767', '0.493572', '0.501893', '0.512415', '0.510535', '0.502331', '0.503485', '0.503977', '0.500700', '0.512489', '0.496654', '0.503426', '0.514839', '0.510583', '0.515014', '0.508371', '0.507123', '0.498422', '0.504035', '0.509133']
         : correct/total = [(7255, 14232), (7026, 14235), (7160, 14266), (7285, 14217), (7269, 14238), (7220, 14373), (7223, 14346), (7224, 14334), (7157, 14294), (7366, 14373), (7124, 14344), (7200, 14302), (7390, 14354), (7333, 14362), (7375, 14320), (7318, 14395), (7297, 14389), (7106, 14257), (7183, 14251), (7331, 14399)]
         : compromised: 0.5053, honest: 0.5064

=== FINAL RESULTS ===
Dataset: sent140, Nodes: 20, Graph: erdos, Aggregation: krum
Attack: directed_deviation, 40.0% compromised
Final accuracy - Compromised: 0.5053, Honest: 0.5064
Overall test accuracy: mean=0.5059 ± 0.0059
