Device: cuda
Seed: 987654321
Loading 1 LEAF Sent140 train files...
LEAF Sent140 train: 254555 users, 908652 samples
Building vocabulary (max_size=10000)...
Vocabulary size: 10000
Loading 1 LEAF Sent140 test files...
LEAF Sent140 test: 254555 users, 286281 samples
Found 254555 train users, 254555 test users, 254555 common users
User sample counts range: 494 (max) to 1 (min)
Distributed ALL 254555 users across 20 clients
Users per client: 12727 (with 15 clients getting +1 user)
Train partition sizes: [44353, 44290, 44657, 44907, 44696, 45843, 45801, 45619, 45069, 45639, 45821, 45311, 45779, 46056, 45625, 45984, 46428, 44737, 45540, 46497]
Test partition sizes: [14232, 14235, 14266, 14217, 14238, 14373, 14346, 14334, 14294, 14373, 14344, 14302, 14354, 14362, 14320, 14395, 14389, 14257, 14251, 14399]
  Client 0: 44353 train samples, 2 unique classes
  Client 1: 44290 train samples, 2 unique classes
  Client 2: 44657 train samples, 2 unique classes
  Client 3: 44907 train samples, 2 unique classes
  Client 4: 44696 train samples, 2 unique classes
  Client 5: 45843 train samples, 2 unique classes
  Client 6: 45801 train samples, 2 unique classes
  Client 7: 45619 train samples, 2 unique classes
  Client 8: 45069 train samples, 2 unique classes
  Client 9: 45639 train samples, 2 unique classes
  Client 10: 45821 train samples, 2 unique classes
  Client 11: 45311 train samples, 2 unique classes
  Client 12: 45779 train samples, 2 unique classes
  Client 13: 46056 train samples, 2 unique classes
  Client 14: 45625 train samples, 2 unique classes
  Client 15: 45984 train samples, 2 unique classes
  Client 16: 46428 train samples, 2 unique classes
  Client 17: 44737 train samples, 2 unique classes
  Client 18: 45540 train samples, 2 unique classes
  Client 19: 46497 train samples, 2 unique classes
Will sample 4500 samples per client per epoch
Graph: fully, nodes: 20, edges: 190
Degree statistics: avg=19.00, min=19, max=19
Attack: Compromised 14/20 nodes: [1, 2, 3, 5, 6, 8, 11, 12, 13, 14, 15, 17, 18, 19]
Attack type: gaussian, lambda: 1.0
Model variant: baseline
Model parameters: 1,174,986
Sketchguard Node 0:
  Model dim: 1,174,986 → Sketch size: 180
  Compression ratio: 6527.7x
  Using model parameters for aggregation, sketches for filtering
Sketchguard Node 1:
  Model dim: 1,174,986 → Sketch size: 180
  Compression ratio: 6527.7x
  Using model parameters for aggregation, sketches for filtering
Sketchguard Node 2:
  Model dim: 1,174,986 → Sketch size: 180
  Compression ratio: 6527.7x
  Using model parameters for aggregation, sketches for filtering
Sketchguard Node 3:
  Model dim: 1,174,986 → Sketch size: 180
  Compression ratio: 6527.7x
  Using model parameters for aggregation, sketches for filtering
Sketchguard Node 4:
  Model dim: 1,174,986 → Sketch size: 180
  Compression ratio: 6527.7x
  Using model parameters for aggregation, sketches for filtering
Sketchguard Node 5:
  Model dim: 1,174,986 → Sketch size: 180
  Compression ratio: 6527.7x
  Using model parameters for aggregation, sketches for filtering
Sketchguard Node 6:
  Model dim: 1,174,986 → Sketch size: 180
  Compression ratio: 6527.7x
  Using model parameters for aggregation, sketches for filtering
Sketchguard Node 7:
  Model dim: 1,174,986 → Sketch size: 180
  Compression ratio: 6527.7x
  Using model parameters for aggregation, sketches for filtering
Sketchguard Node 8:
  Model dim: 1,174,986 → Sketch size: 180
  Compression ratio: 6527.7x
  Using model parameters for aggregation, sketches for filtering
Sketchguard Node 9:
  Model dim: 1,174,986 → Sketch size: 180
  Compression ratio: 6527.7x
  Using model parameters for aggregation, sketches for filtering
Sketchguard Node 10:
  Model dim: 1,174,986 → Sketch size: 180
  Compression ratio: 6527.7x
  Using model parameters for aggregation, sketches for filtering
Sketchguard Node 11:
  Model dim: 1,174,986 → Sketch size: 180
  Compression ratio: 6527.7x
  Using model parameters for aggregation, sketches for filtering
Sketchguard Node 12:
  Model dim: 1,174,986 → Sketch size: 180
  Compression ratio: 6527.7x
  Using model parameters for aggregation, sketches for filtering
Sketchguard Node 13:
  Model dim: 1,174,986 → Sketch size: 180
  Compression ratio: 6527.7x
  Using model parameters for aggregation, sketches for filtering
Sketchguard Node 14:
  Model dim: 1,174,986 → Sketch size: 180
  Compression ratio: 6527.7x
  Using model parameters for aggregation, sketches for filtering
Sketchguard Node 15:
  Model dim: 1,174,986 → Sketch size: 180
  Compression ratio: 6527.7x
  Using model parameters for aggregation, sketches for filtering
Sketchguard Node 16:
  Model dim: 1,174,986 → Sketch size: 180
  Compression ratio: 6527.7x
  Using model parameters for aggregation, sketches for filtering
Sketchguard Node 17:
  Model dim: 1,174,986 → Sketch size: 180
  Compression ratio: 6527.7x
  Using model parameters for aggregation, sketches for filtering
Sketchguard Node 18:
  Model dim: 1,174,986 → Sketch size: 180
  Compression ratio: 6527.7x
  Using model parameters for aggregation, sketches for filtering
Sketchguard Node 19:
  Model dim: 1,174,986 → Sketch size: 180
  Compression ratio: 6527.7x
  Using model parameters for aggregation, sketches for filtering
Sketchguard ALGORITHM (Sketch-based Filtering + State Aggregation)
  - Model dimension: 1,174,986 parameters
  - Config: SketchguardConfig(gamma=2, kappa=1, alpha=0.5, min_neighbors=1, sketch_size=180, network_seed=987654321, attack_detection_window=5)
  - Sketch size: 180
  - Compression ratio: 6527.7x
  - Complexity: O(d + N×k) = O(1,174,986 + 20×180)
  - Theoretical speedup vs BALANCE: 19.9x
Initial test acc across nodes: mean=0.4965 ± 0.0152
Round 001: test acc mean=0.5470 ± 0.0264 | min=0.4964 max=0.5954
         : test loss mean=0.6914 ± 0.0006
         : individual accs = ['0.531619', '0.581735', '0.521940', '0.566646', '0.528024', '0.560147', '0.517775', '0.595437', '0.496362', '0.586795', '0.548383', '0.547056', '0.562631', '0.542543', '0.559986', '0.510524', '0.575092', '0.514133', '0.545295', '0.548094']
         : correct/total = [(7566, 14232), (8281, 14235), (7446, 14266), (8056, 14217), (7518, 14238), (8051, 14373), (7428, 14346), (8535, 14334), (7095, 14294), (8434, 14373), (7866, 14344), (7824, 14302), (8076, 14354), (7792, 14362), (8019, 14320), (7349, 14395), (8275, 14389), (7330, 14257), (7771, 14251), (7892, 14399)]
         : compromised: 0.5411, honest: 0.5609
         : sketchguard stats = ['Node 0: acc_rate=0.263', 'Node 1: acc_rate=0.316', 'Node 2: acc_rate=0.316']...
Round 002: test acc mean=0.4949 ± 0.0056 | min=0.4861 max=0.5086
         : test loss mean=0.6932 ± 0.0004
         : individual accs = ['0.489039', '0.486336', '0.486051', '0.492228', '0.494100', '0.493843', '0.497560', '0.495396', '0.488457', '0.493147', '0.499024', '0.492309', '0.499512', '0.508564', '0.495810', '0.498367', '0.500799', '0.503051', '0.488738', '0.496354']
         : correct/total = [(6960, 14232), (6923, 14235), (6934, 14266), (6998, 14217), (7035, 14238), (7098, 14373), (7138, 14346), (7101, 14334), (6982, 14294), (7088, 14373), (7158, 14344), (7041, 14302), (7170, 14354), (7304, 14362), (7100, 14320), (7174, 14395), (7206, 14389), (7172, 14257), (6965, 14251), (7147, 14399)]
         : compromised: 0.4948, honest: 0.4953
         : sketchguard stats = ['Node 0: acc_rate=0.263', 'Node 1: acc_rate=0.316', 'Node 2: acc_rate=0.316']...
Round 003: test acc mean=0.4949 ± 0.0056 | min=0.4861 max=0.5086
         : test loss mean=0.6938 ± 0.0003
         : individual accs = ['0.489109', '0.486266', '0.486051', '0.492228', '0.494100', '0.493843', '0.497560', '0.495186', '0.488457', '0.493008', '0.499024', '0.492029', '0.499512', '0.508564', '0.495810', '0.498367', '0.499757', '0.503051', '0.488738', '0.496354']
         : correct/total = [(6961, 14232), (6922, 14235), (6934, 14266), (6998, 14217), (7035, 14238), (7098, 14373), (7138, 14346), (7098, 14334), (6982, 14294), (7086, 14373), (7158, 14344), (7037, 14302), (7170, 14354), (7304, 14362), (7100, 14320), (7174, 14395), (7191, 14389), (7172, 14257), (6965, 14251), (7147, 14399)]
         : compromised: 0.4948, honest: 0.4950
         : sketchguard stats = ['Node 0: acc_rate=0.263', 'Node 1: acc_rate=0.316', 'Node 2: acc_rate=0.316']...
Round 004: test acc mean=0.4949 ± 0.0056 | min=0.4861 max=0.5086
         : test loss mean=0.6935 ± 0.0003
         : individual accs = ['0.489109', '0.486266', '0.486051', '0.492228', '0.494100', '0.493843', '0.497560', '0.495186', '0.488457', '0.493008', '0.499024', '0.492029', '0.499512', '0.508564', '0.495810', '0.498367', '0.499757', '0.503051', '0.488738', '0.496354']
         : correct/total = [(6961, 14232), (6922, 14235), (6934, 14266), (6998, 14217), (7035, 14238), (7098, 14373), (7138, 14346), (7098, 14334), (6982, 14294), (7086, 14373), (7158, 14344), (7037, 14302), (7170, 14354), (7304, 14362), (7100, 14320), (7174, 14395), (7191, 14389), (7172, 14257), (6965, 14251), (7147, 14399)]
         : compromised: 0.4948, honest: 0.4950
         : sketchguard stats = ['Node 0: acc_rate=0.263', 'Node 1: acc_rate=0.316', 'Node 2: acc_rate=0.316']...
Round 005: test acc mean=0.4949 ± 0.0056 | min=0.4861 max=0.5086
         : test loss mean=0.6933 ± 0.0004
         : individual accs = ['0.489109', '0.486266', '0.486051', '0.492228', '0.494100', '0.493843', '0.497560', '0.495186', '0.488457', '0.493008', '0.499024', '0.492029', '0.499512', '0.508564', '0.495810', '0.498367', '0.499757', '0.503051', '0.488738', '0.496354']
         : correct/total = [(6961, 14232), (6922, 14235), (6934, 14266), (6998, 14217), (7035, 14238), (7098, 14373), (7138, 14346), (7098, 14334), (6982, 14294), (7086, 14373), (7158, 14344), (7037, 14302), (7170, 14354), (7304, 14362), (7100, 14320), (7174, 14395), (7191, 14389), (7172, 14257), (6965, 14251), (7147, 14399)]
         : compromised: 0.4948, honest: 0.4950
         : sketchguard stats = ['Node 0: acc_rate=0.263', 'Node 1: acc_rate=0.316', 'Node 2: acc_rate=0.316']...
Round 006: test acc mean=0.4949 ± 0.0056 | min=0.4861 max=0.5086
         : test loss mean=0.6930 ± 0.0004
         : individual accs = ['0.489109', '0.486266', '0.486051', '0.492228', '0.494100', '0.493843', '0.497560', '0.495186', '0.488457', '0.493008', '0.499024', '0.492029', '0.499512', '0.508564', '0.495810', '0.498367', '0.499757', '0.503051', '0.488738', '0.496354']
         : correct/total = [(6961, 14232), (6922, 14235), (6934, 14266), (6998, 14217), (7035, 14238), (7098, 14373), (7138, 14346), (7098, 14334), (6982, 14294), (7086, 14373), (7158, 14344), (7037, 14302), (7170, 14354), (7304, 14362), (7100, 14320), (7174, 14395), (7191, 14389), (7172, 14257), (6965, 14251), (7147, 14399)]
         : compromised: 0.4948, honest: 0.4950
         : sketchguard stats = ['Node 0: acc_rate=0.263', 'Node 1: acc_rate=0.316', 'Node 2: acc_rate=0.316']...
Round 007: test acc mean=0.4949 ± 0.0056 | min=0.4861 max=0.5086
         : test loss mean=0.6926 ± 0.0003
         : individual accs = ['0.489109', '0.486266', '0.486051', '0.492228', '0.494100', '0.493843', '0.497560', '0.495186', '0.488457', '0.493008', '0.499024', '0.492029', '0.499512', '0.508564', '0.495810', '0.498367', '0.499757', '0.503051', '0.488738', '0.496354']
         : correct/total = [(6961, 14232), (6922, 14235), (6934, 14266), (6998, 14217), (7035, 14238), (7098, 14373), (7138, 14346), (7098, 14334), (6982, 14294), (7086, 14373), (7158, 14344), (7037, 14302), (7170, 14354), (7304, 14362), (7100, 14320), (7174, 14395), (7191, 14389), (7172, 14257), (6965, 14251), (7147, 14399)]
         : compromised: 0.4948, honest: 0.4950
         : sketchguard stats = ['Node 0: acc_rate=0.263', 'Node 1: acc_rate=0.316', 'Node 2: acc_rate=0.316']...
Round 008: test acc mean=0.4951 ± 0.0055 | min=0.4861 max=0.5086
         : test loss mean=0.6921 ± 0.0004
         : individual accs = ['0.489109', '0.486266', '0.486051', '0.492298', '0.494171', '0.493843', '0.497560', '0.495605', '0.488667', '0.493147', '0.499024', '0.492449', '0.499512', '0.508564', '0.495810', '0.498367', '0.500382', '0.503051', '0.491264', '0.496423']
         : correct/total = [(6961, 14232), (6922, 14235), (6934, 14266), (6999, 14217), (7036, 14238), (7098, 14373), (7138, 14346), (7104, 14334), (6985, 14294), (7088, 14373), (7158, 14344), (7043, 14302), (7170, 14354), (7304, 14362), (7100, 14320), (7174, 14395), (7200, 14389), (7172, 14257), (7001, 14251), (7148, 14399)]
         : compromised: 0.4950, honest: 0.4952
         : sketchguard stats = ['Node 0: acc_rate=0.263', 'Node 1: acc_rate=0.316', 'Node 2: acc_rate=0.316']...
Round 009: test acc mean=0.4959 ± 0.0052 | min=0.4868 max=0.5089
         : test loss mean=0.6915 ± 0.0004
         : individual accs = ['0.491217', '0.487109', '0.486822', '0.493634', '0.494873', '0.493912', '0.497560', '0.495884', '0.488597', '0.493147', '0.499163', '0.493497', '0.499652', '0.508912', '0.495810', '0.498437', '0.501008', '0.503612', '0.497158', '0.497326']
         : correct/total = [(6991, 14232), (6934, 14235), (6945, 14266), (7018, 14217), (7046, 14238), (7099, 14373), (7138, 14346), (7108, 14334), (6984, 14294), (7088, 14373), (7160, 14344), (7058, 14302), (7172, 14354), (7309, 14362), (7100, 14320), (7175, 14395), (7209, 14389), (7180, 14257), (7085, 14251), (7161, 14399)]
         : compromised: 0.4959, honest: 0.4959
         : sketchguard stats = ['Node 0: acc_rate=0.263', 'Node 1: acc_rate=0.316', 'Node 2: acc_rate=0.316']...
Round 010: test acc mean=0.5034 ± 0.0062 | min=0.4923 max=0.5159
         : test loss mean=0.6905 ± 0.0004
         : individual accs = ['0.495644', '0.507130', '0.503365', '0.510234', '0.507445', '0.496278', '0.498885', '0.509069', '0.492304', '0.496834', '0.504044', '0.505594', '0.503065', '0.515945', '0.496927', '0.501910', '0.511502', '0.507260', '0.495614', '0.508160']
         : correct/total = [(7054, 14232), (7219, 14235), (7181, 14266), (7254, 14217), (7225, 14238), (7133, 14373), (7157, 14346), (7297, 14334), (7037, 14294), (7141, 14373), (7230, 14344), (7231, 14302), (7221, 14354), (7410, 14362), (7116, 14320), (7225, 14395), (7360, 14389), (7232, 14257), (7063, 14251), (7317, 14399)]
         : compromised: 0.5030, honest: 0.5041
         : sketchguard stats = ['Node 0: acc_rate=0.263', 'Node 1: acc_rate=0.316', 'Node 2: acc_rate=0.316']...

=== FINAL RESULTS ===
Dataset: sent140, Nodes: 20, Graph: fully, Aggregation: sketchguard
Attack: gaussian, 70.0% compromised
Final accuracy - Compromised: 0.5030, Honest: 0.5041
Overall test accuracy: mean=0.5034 ± 0.0062

=== Sketchguard SUMMARY ===
Node 0: acceptance=0.263
Node 1: acceptance=0.316
Node 2: acceptance=0.316
Node 3: acceptance=0.316
Node 4: acceptance=0.263
Node 5: acceptance=0.316
Node 6: acceptance=0.316
Node 7: acceptance=0.263
Node 8: acceptance=0.316
Node 9: acceptance=0.263
Node 10: acceptance=0.263
Node 11: acceptance=0.316
Node 12: acceptance=0.316
Node 13: acceptance=0.316
Node 14: acceptance=0.316
Node 15: acceptance=0.316
Node 16: acceptance=0.263
Node 17: acceptance=0.316
Node 18: acceptance=0.316
Node 19: acceptance=0.316

=== PARALLEL EXECUTION TIME (realistic for distributed system) ===
  COMMUNICATION (max across nodes):
    - Sketch transfer: 0.000s (0.0%)
    - Model fetch (accepted): 0.000s (0.0%)
  COMPUTATION (max across nodes):
    - Sketching: 0.346s (95.4%)
    - Filtering: 0.001s (0.3%)
    - Aggregation: 0.015s (4.2%)
  TOTALS:
    - Total computation: 0.363s (100.0%)
    - Total communication: 0.000s (0.0%)
    - Total parallel time: 0.363s

=== PER-NODE AVERAGE TIME ===
  - Sketching: 0.307s
  - Filtering: 0.001s
  - Aggregation: 0.013s
  - Sketch transfer: 0.000s
  - Model fetch: 0.000s
  - Total per node: 0.321s

=== TOTAL COMPUTATIONAL WORK (sum across all nodes) ===
  - Total sketching: 6.135s
  - Total filtering: 0.017s
  - Total aggregation: 0.259s
  - Total sketch transfer: 0.000s
  - Total model fetch: 0.000s
  - Grand total: 6.411s
  - Mean acceptance rate: 0.300

Sketchguard Algorithm Properties:
  - Original dimension: 1,174,986
  - Sketch size: 180
  - Compression ratio: 19.9x
  - Single repetition: No repetitions needed
  - Theoretical complexity: O(d + N×k)
  - Approach: Sketch filtering + state aggregation
