Device: cuda
Seed: 987654321
Loading 1 LEAF Sent140 train files...
LEAF Sent140 train: 254555 users, 908652 samples
Building vocabulary (max_size=10000)...
Vocabulary size: 10000
Loading 1 LEAF Sent140 test files...
LEAF Sent140 test: 254555 users, 286281 samples
Found 254555 train users, 254555 test users, 254555 common users
User sample counts range: 494 (max) to 1 (min)
Distributed ALL 254555 users across 20 clients
Users per client: 12727 (with 15 clients getting +1 user)
Train partition sizes: [44353, 44290, 44657, 44907, 44696, 45843, 45801, 45619, 45069, 45639, 45821, 45311, 45779, 46056, 45625, 45984, 46428, 44737, 45540, 46497]
Test partition sizes: [14232, 14235, 14266, 14217, 14238, 14373, 14346, 14334, 14294, 14373, 14344, 14302, 14354, 14362, 14320, 14395, 14389, 14257, 14251, 14399]
  Client 0: 44353 train samples, 2 unique classes
  Client 1: 44290 train samples, 2 unique classes
  Client 2: 44657 train samples, 2 unique classes
  Client 3: 44907 train samples, 2 unique classes
  Client 4: 44696 train samples, 2 unique classes
  Client 5: 45843 train samples, 2 unique classes
  Client 6: 45801 train samples, 2 unique classes
  Client 7: 45619 train samples, 2 unique classes
  Client 8: 45069 train samples, 2 unique classes
  Client 9: 45639 train samples, 2 unique classes
  Client 10: 45821 train samples, 2 unique classes
  Client 11: 45311 train samples, 2 unique classes
  Client 12: 45779 train samples, 2 unique classes
  Client 13: 46056 train samples, 2 unique classes
  Client 14: 45625 train samples, 2 unique classes
  Client 15: 45984 train samples, 2 unique classes
  Client 16: 46428 train samples, 2 unique classes
  Client 17: 44737 train samples, 2 unique classes
  Client 18: 45540 train samples, 2 unique classes
  Client 19: 46497 train samples, 2 unique classes
Will sample 4500 samples per client per epoch
Graph: erdos, nodes: 20, edges: 48
Degree statistics: avg=4.80, min=2, max=7
Attack: Compromised 10/20 nodes: [1, 2, 5, 11, 12, 13, 14, 15, 17, 18]
Attack type: directed_deviation, lambda: 1.0
Model variant: baseline
Model parameters: 1,174,986
Initial test acc across nodes: mean=0.4965 ± 0.0152
Round 001: test acc mean=0.5007 ± 0.0090 | min=0.4838 max=0.5155
         : test loss mean=8.5411 ± 7.7472
         : individual accs = ['0.515458', '0.512961', '0.488434', '0.504255', '0.485110', '0.494956', '0.509759', '0.483815', '0.507975', '0.493216', '0.511294', '0.500559', '0.501324', '0.491575', '0.497975', '0.511844', '0.501077', '0.501438', '0.503544', '0.496701']
         : correct/total = [(7336, 14232), (7302, 14235), (6968, 14266), (7169, 14217), (6907, 14238), (7114, 14373), (7313, 14346), (6935, 14334), (7261, 14294), (7089, 14373), (7334, 14344), (7159, 14302), (7196, 14354), (7060, 14362), (7131, 14320), (7368, 14395), (7210, 14389), (7149, 14257), (7176, 14251), (7152, 14399)]
         : compromised: 0.5005, honest: 0.5009
Round 002: test acc mean=0.5030 ± 0.0053 | min=0.4911 max=0.5142
         : test loss mean=8.2458 ± 5.7538
         : individual accs = ['0.498243', '0.507763', '0.514230', '0.506717', '0.510044', '0.500174', '0.500139', '0.507535', '0.503008', '0.504975', '0.505159', '0.506013', '0.496795', '0.491088', '0.500489', '0.503508', '0.503996', '0.494424', '0.501438', '0.503854']
         : correct/total = [(7091, 14232), (7228, 14235), (7336, 14266), (7204, 14217), (7262, 14238), (7189, 14373), (7175, 14346), (7275, 14334), (7190, 14294), (7258, 14373), (7246, 14344), (7237, 14302), (7131, 14354), (7053, 14362), (7167, 14320), (7248, 14395), (7252, 14389), (7049, 14257), (7146, 14251), (7255, 14399)]
         : compromised: 0.5016, honest: 0.5044
Round 003: test acc mean=0.5000 ± 0.0103 | min=0.4810 max=0.5246
         : test loss mean=2.0901 ± 1.5708
         : individual accs = ['0.489671', '0.489076', '0.492500', '0.497784', '0.501967', '0.495860', '0.494145', '0.499512', '0.524626', '0.486050', '0.510806', '0.500000', '0.520134', '0.503551', '0.500349', '0.500938', '0.500521', '0.503051', '0.481019', '0.509410']
         : correct/total = [(6969, 14232), (6962, 14235), (7026, 14266), (7077, 14217), (7147, 14238), (7127, 14373), (7089, 14346), (7160, 14334), (7499, 14294), (6986, 14373), (7327, 14344), (7151, 14302), (7466, 14354), (7232, 14362), (7165, 14320), (7211, 14395), (7202, 14389), (7172, 14257), (6855, 14251), (7335, 14399)]
         : compromised: 0.4986, honest: 0.5014
Round 004: test acc mean=0.4995 ± 0.0083 | min=0.4809 max=0.5138
         : test loss mean=4.6151 ± 3.3484
         : individual accs = ['0.485666', '0.501089', '0.511005', '0.498980', '0.503933', '0.506157', '0.495887', '0.506488', '0.498811', '0.500452', '0.491007', '0.509439', '0.480911', '0.490322', '0.502584', '0.502258', '0.499548', '0.501648', '0.513789', '0.489478']
         : correct/total = [(6912, 14232), (7133, 14235), (7290, 14266), (7094, 14217), (7175, 14238), (7275, 14373), (7114, 14346), (7260, 14334), (7130, 14294), (7193, 14373), (7043, 14344), (7286, 14302), (6903, 14354), (7042, 14362), (7197, 14320), (7230, 14395), (7188, 14389), (7152, 14257), (7322, 14251), (7048, 14399)]
         : compromised: 0.5019, honest: 0.4970
Round 005: test acc mean=0.5010 ± 0.0097 | min=0.4805 max=0.5231
         : test loss mean=1.7136 ± 1.3602
         : individual accs = ['0.487071', '0.502143', '0.498388', '0.496589', '0.495505', '0.491060', '0.501952', '0.480536', '0.511194', '0.504835', '0.500488', '0.496854', '0.523060', '0.512533', '0.500628', '0.499896', '0.498506', '0.495265', '0.504807', '0.518508']
         : correct/total = [(6932, 14232), (7148, 14235), (7110, 14266), (7060, 14217), (7055, 14238), (7058, 14373), (7201, 14346), (6888, 14334), (7307, 14294), (7256, 14373), (7179, 14344), (7106, 14302), (7508, 14354), (7361, 14362), (7169, 14320), (7196, 14395), (7173, 14389), (7061, 14257), (7194, 14251), (7466, 14399)]
         : compromised: 0.5025, honest: 0.4995
Round 006: test acc mean=0.5039 ± 0.0069 | min=0.4925 max=0.5169
         : test loss mean=3.4541 ± 2.8715
         : individual accs = ['0.516863', '0.505163', '0.513949', '0.511711', '0.499017', '0.501426', '0.512617', '0.493024', '0.501609', '0.509845', '0.504044', '0.501538', '0.497213', '0.493107', '0.503980', '0.507746', '0.498297', '0.492460', '0.507754', '0.506771']
         : correct/total = [(7356, 14232), (7191, 14235), (7332, 14266), (7275, 14217), (7105, 14238), (7207, 14373), (7354, 14346), (7067, 14334), (7170, 14294), (7328, 14373), (7230, 14344), (7173, 14302), (7137, 14354), (7082, 14362), (7217, 14320), (7309, 14395), (7170, 14389), (7021, 14257), (7236, 14251), (7297, 14399)]
         : compromised: 0.5024, honest: 0.5054
Round 007: test acc mean=0.5023 ± 0.0085 | min=0.4875 max=0.5213
         : test loss mean=1.6491 ± 1.3020
         : individual accs = ['0.489109', '0.506849', '0.487523', '0.494197', '0.496559', '0.495304', '0.501952', '0.493024', '0.513642', '0.502122', '0.509551', '0.500629', '0.515675', '0.511141', '0.502025', '0.501841', '0.501703', '0.501929', '0.500737', '0.521286']
         : correct/total = [(6961, 14232), (7215, 14235), (6955, 14266), (7026, 14217), (7070, 14238), (7119, 14373), (7201, 14346), (7067, 14334), (7342, 14294), (7217, 14373), (7309, 14344), (7160, 14302), (7402, 14354), (7341, 14362), (7189, 14320), (7224, 14395), (7219, 14389), (7156, 14257), (7136, 14251), (7506, 14399)]
         : compromised: 0.5024, honest: 0.5023
Round 008: test acc mean=0.5021 ± 0.0062 | min=0.4899 max=0.5182
         : test loss mean=2.9087 ± 2.7994
         : individual accs = ['0.503021', '0.496593', '0.507500', '0.504326', '0.500421', '0.503166', '0.498118', '0.506209', '0.499091', '0.518194', '0.507041', '0.510348', '0.494705', '0.489904', '0.503282', '0.504411', '0.502954', '0.493652', '0.496948', '0.502465']
         : correct/total = [(7159, 14232), (7069, 14235), (7240, 14266), (7170, 14217), (7125, 14238), (7232, 14373), (7146, 14346), (7256, 14334), (7134, 14294), (7448, 14373), (7273, 14344), (7299, 14302), (7101, 14354), (7036, 14362), (7207, 14320), (7261, 14395), (7237, 14389), (7038, 14257), (7082, 14251), (7235, 14399)]
         : compromised: 0.5001, honest: 0.5042
Round 009: test acc mean=0.5051 ± 0.0096 | min=0.4889 max=0.5262
         : test loss mean=1.4866 ± 1.1640
         : individual accs = ['0.490093', '0.508254', '0.488855', '0.508335', '0.503441', '0.490642', '0.505019', '0.513674', '0.516580', '0.500939', '0.520984', '0.503776', '0.501602', '0.506893', '0.497486', '0.505801', '0.507193', '0.510977', '0.495193', '0.526217']
         : correct/total = [(6975, 14232), (7235, 14235), (6974, 14266), (7227, 14217), (7168, 14238), (7052, 14373), (7245, 14346), (7363, 14334), (7384, 14294), (7200, 14373), (7473, 14344), (7205, 14302), (7200, 14354), (7280, 14362), (7124, 14320), (7281, 14395), (7298, 14389), (7285, 14257), (7057, 14251), (7577, 14399)]
         : compromised: 0.5009, honest: 0.5092
Round 010: test acc mean=0.5029 ± 0.0060 | min=0.4908 max=0.5141
         : test loss mean=2.5759 ± 2.6691
         : individual accs = ['0.498314', '0.496944', '0.510585', '0.496167', '0.494873', '0.506714', '0.507598', '0.498744', '0.503778', '0.514089', '0.500488', '0.503356', '0.497631', '0.490809', '0.504330', '0.505453', '0.503927', '0.503402', '0.507824', '0.513369']
         : correct/total = [(7092, 14232), (7074, 14235), (7284, 14266), (7054, 14217), (7046, 14238), (7283, 14373), (7282, 14346), (7149, 14334), (7201, 14294), (7389, 14373), (7179, 14344), (7199, 14302), (7143, 14354), (7049, 14362), (7222, 14320), (7276, 14395), (7251, 14389), (7177, 14257), (7237, 14251), (7392, 14399)]
         : compromised: 0.5027, honest: 0.5031

=== FINAL RESULTS ===
Dataset: sent140, Nodes: 20, Graph: erdos, Aggregation: d-fedavg
Attack: directed_deviation, 50.0% compromised
Final accuracy - Compromised: 0.5027, Honest: 0.5031
Overall test accuracy: mean=0.5029 ± 0.0060
