Device: cuda
Seed: 987654321
Loading 1 LEAF Sent140 train files...
LEAF Sent140 train: 254555 users, 908652 samples
Building vocabulary (max_size=10000)...
Vocabulary size: 10000
Loading 1 LEAF Sent140 test files...
LEAF Sent140 test: 254555 users, 286281 samples
Found 254555 train users, 254555 test users, 254555 common users
User sample counts range: 494 (max) to 1 (min)
Distributed ALL 254555 users across 20 clients
Users per client: 12727 (with 15 clients getting +1 user)
Train partition sizes: [44353, 44290, 44657, 44907, 44696, 45843, 45801, 45619, 45069, 45639, 45821, 45311, 45779, 46056, 45625, 45984, 46428, 44737, 45540, 46497]
Test partition sizes: [14232, 14235, 14266, 14217, 14238, 14373, 14346, 14334, 14294, 14373, 14344, 14302, 14354, 14362, 14320, 14395, 14389, 14257, 14251, 14399]
  Client 0: 44353 train samples, 2 unique classes
  Client 1: 44290 train samples, 2 unique classes
  Client 2: 44657 train samples, 2 unique classes
  Client 3: 44907 train samples, 2 unique classes
  Client 4: 44696 train samples, 2 unique classes
  Client 5: 45843 train samples, 2 unique classes
  Client 6: 45801 train samples, 2 unique classes
  Client 7: 45619 train samples, 2 unique classes
  Client 8: 45069 train samples, 2 unique classes
  Client 9: 45639 train samples, 2 unique classes
  Client 10: 45821 train samples, 2 unique classes
  Client 11: 45311 train samples, 2 unique classes
  Client 12: 45779 train samples, 2 unique classes
  Client 13: 46056 train samples, 2 unique classes
  Client 14: 45625 train samples, 2 unique classes
  Client 15: 45984 train samples, 2 unique classes
  Client 16: 46428 train samples, 2 unique classes
  Client 17: 44737 train samples, 2 unique classes
  Client 18: 45540 train samples, 2 unique classes
  Client 19: 46497 train samples, 2 unique classes
Will sample 4500 samples per client per epoch
Graph: erdos, nodes: 20, edges: 99
Degree statistics: avg=9.90, min=7, max=14
Attack: Compromised 6/20 nodes: [5, 12, 13, 14, 17, 18]
Attack type: directed_deviation, lambda: 1.0
Model variant: baseline
Model parameters: 1,174,986
Initial test acc across nodes: mean=0.4965 ± 0.0152
Round 001: test acc mean=0.4980 ± 0.0085 | min=0.4868 max=0.5181
         : test loss mean=3.0166 ± 2.3299
         : individual accs = ['0.518128', '0.488374', '0.487663', '0.505662', '0.497612', '0.504488', '0.492472', '0.499581', '0.487197', '0.506714', '0.493656', '0.489302', '0.512819', '0.486771', '0.501676', '0.500590', '0.501633', '0.494284', '0.492597', '0.499271']
         : correct/total = [(7374, 14232), (6952, 14235), (6957, 14266), (7189, 14217), (7085, 14238), (7251, 14373), (7065, 14346), (7161, 14334), (6964, 14294), (7283, 14373), (7081, 14344), (6998, 14302), (7361, 14354), (6991, 14362), (7184, 14320), (7206, 14395), (7218, 14389), (7047, 14257), (7020, 14251), (7189, 14399)]
         : compromised: 0.4988, honest: 0.4977
Round 002: test acc mean=0.5023 ± 0.0065 | min=0.4920 max=0.5184
         : test loss mean=2.5858 ± 1.4971
         : individual accs = ['0.503302', '0.507271', '0.512057', '0.501020', '0.506953', '0.491964', '0.501882', '0.498884', '0.506996', '0.492799', '0.518405', '0.495175', '0.504041', '0.494430', '0.502514', '0.504689', '0.498714', '0.497159', '0.508806', '0.499687']
         : correct/total = [(7163, 14232), (7221, 14235), (7305, 14266), (7123, 14217), (7218, 14238), (7071, 14373), (7200, 14346), (7151, 14334), (7247, 14294), (7083, 14373), (7436, 14344), (7082, 14302), (7235, 14354), (7101, 14362), (7196, 14320), (7265, 14395), (7176, 14389), (7088, 14257), (7251, 14251), (7195, 14399)]
         : compromised: 0.4998, honest: 0.5034
Round 003: test acc mean=0.5056 ± 0.0121 | min=0.4887 max=0.5264
         : test loss mean=0.7678 ± 0.1553
         : individual accs = ['0.513912', '0.518440', '0.494112', '0.492228', '0.499298', '0.493843', '0.512268', '0.498674', '0.503358', '0.519029', '0.499512', '0.508321', '0.499512', '0.508982', '0.490573', '0.525113', '0.524776', '0.494003', '0.488738', '0.526356']
         : correct/total = [(7314, 14232), (7380, 14235), (7049, 14266), (6998, 14217), (7109, 14238), (7098, 14373), (7349, 14346), (7148, 14334), (7195, 14294), (7460, 14373), (7165, 14344), (7270, 14302), (7170, 14354), (7310, 14362), (7025, 14320), (7559, 14395), (7551, 14389), (7043, 14257), (6965, 14251), (7579, 14399)]
         : compromised: 0.4959, honest: 0.5097
Round 004: test acc mean=0.5063 ± 0.0058 | min=0.4930 max=0.5158
         : test loss mean=1.3850 ± 0.7612
         : individual accs = ['0.510188', '0.507060', '0.512617', '0.510516', '0.507445', '0.504070', '0.500000', '0.514023', '0.501679', '0.493008', '0.499861', '0.505803', '0.506618', '0.508773', '0.513198', '0.501216', '0.499757', '0.503262', '0.511122', '0.515800']
         : correct/total = [(7261, 14232), (7218, 14235), (7313, 14266), (7258, 14217), (7225, 14238), (7245, 14373), (7173, 14346), (7368, 14334), (7171, 14294), (7086, 14373), (7170, 14344), (7234, 14302), (7272, 14354), (7307, 14362), (7349, 14320), (7215, 14395), (7191, 14389), (7175, 14257), (7284, 14251), (7427, 14399)]
         : compromised: 0.5078, honest: 0.5056
Round 005: test acc mean=0.5020 ± 0.0078 | min=0.4859 max=0.5160
         : test loss mean=0.7894 ± 0.1840
         : individual accs = ['0.498595', '0.496382', '0.485911', '0.492368', '0.505689', '0.496069', '0.515963', '0.514162', '0.505037', '0.508871', '0.499024', '0.509999', '0.499512', '0.508634', '0.503701', '0.506078', '0.507679', '0.496879', '0.488738', '0.501702']
         : correct/total = [(7096, 14232), (7066, 14235), (6932, 14266), (7000, 14217), (7200, 14238), (7130, 14373), (7402, 14346), (7370, 14334), (7219, 14294), (7314, 14373), (7158, 14344), (7294, 14302), (7170, 14354), (7305, 14362), (7213, 14320), (7285, 14395), (7305, 14389), (7084, 14257), (6965, 14251), (7224, 14399)]
         : compromised: 0.4989, honest: 0.5034
Round 006: test acc mean=0.5101 ± 0.0089 | min=0.4862 max=0.5270
         : test loss mean=1.0853 ± 0.5316
         : individual accs = ['0.519885', '0.486196', '0.526987', '0.514595', '0.509622', '0.514854', '0.504531', '0.505651', '0.506226', '0.493077', '0.506344', '0.505314', '0.515257', '0.518730', '0.518296', '0.509621', '0.513865', '0.509294', '0.512315', '0.511077']
         : correct/total = [(7399, 14232), (6921, 14235), (7518, 14266), (7316, 14217), (7256, 14238), (7400, 14373), (7238, 14346), (7248, 14334), (7236, 14294), (7087, 14373), (7263, 14344), (7227, 14302), (7396, 14354), (7450, 14362), (7422, 14320), (7336, 14395), (7394, 14389), (7261, 14257), (7301, 14251), (7359, 14399)]
         : compromised: 0.5148, honest: 0.5081
Round 007: test acc mean=0.5112 ± 0.0170 | min=0.4863 max=0.5487
         : test loss mean=0.7562 ± 0.1115
         : individual accs = ['0.510610', '0.496452', '0.486261', '0.492228', '0.505900', '0.516246', '0.537432', '0.526092', '0.509864', '0.532596', '0.499024', '0.523843', '0.499512', '0.508564', '0.504190', '0.548663', '0.534575', '0.497791', '0.488738', '0.505105']
         : correct/total = [(7267, 14232), (7067, 14235), (6937, 14266), (6998, 14217), (7203, 14238), (7420, 14373), (7710, 14346), (7541, 14334), (7288, 14294), (7655, 14373), (7158, 14344), (7492, 14302), (7170, 14354), (7304, 14362), (7220, 14320), (7898, 14395), (7692, 14389), (7097, 14257), (6965, 14251), (7273, 14399)]
         : compromised: 0.5025, honest: 0.5149
Round 008: test acc mean=0.5141 ± 0.0128 | min=0.4867 max=0.5405
         : test loss mean=0.9483 ± 0.3950
         : individual accs = ['0.514755', '0.486688', '0.531894', '0.540480', '0.524161', '0.526195', '0.502788', '0.506279', '0.508045', '0.493077', '0.505856', '0.505384', '0.526264', '0.528130', '0.517388', '0.506565', '0.511571', '0.512801', '0.516385', '0.517883']
         : correct/total = [(7326, 14232), (6928, 14235), (7588, 14266), (7684, 14217), (7463, 14238), (7563, 14373), (7213, 14346), (7257, 14334), (7262, 14294), (7087, 14373), (7256, 14344), (7228, 14302), (7554, 14354), (7585, 14362), (7409, 14320), (7292, 14395), (7361, 14389), (7311, 14257), (7359, 14251), (7457, 14399)]
         : compromised: 0.5212, honest: 0.5111
Round 009: test acc mean=0.5179 ± 0.0241 | min=0.4863 max=0.5654
         : test loss mean=0.7437 ± 0.1215
         : individual accs = ['0.511664', '0.497085', '0.486331', '0.492228', '0.506251', '0.526682', '0.561829', '0.532650', '0.509025', '0.527656', '0.499512', '0.545938', '0.499512', '0.508564', '0.509358', '0.565405', '0.555355', '0.496879', '0.488738', '0.537468']
         : correct/total = [(7282, 14232), (7076, 14235), (6938, 14266), (6998, 14217), (7208, 14238), (7570, 14373), (8060, 14346), (7635, 14334), (7276, 14294), (7584, 14373), (7165, 14344), (7808, 14302), (7170, 14354), (7304, 14362), (7294, 14320), (8139, 14395), (7991, 14389), (7084, 14257), (6965, 14251), (7739, 14399)]
         : compromised: 0.5050, honest: 0.5235
Round 010: test acc mean=0.5143 ± 0.0145 | min=0.4888 max=0.5393
         : test loss mean=0.8716 ± 0.3007
         : individual accs = ['0.525295', '0.488795', '0.530422', '0.539284', '0.520719', '0.526056', '0.491008', '0.502860', '0.501889', '0.493008', '0.511642', '0.504055', '0.527867', '0.532099', '0.521159', '0.507398', '0.500452', '0.517220', '0.528594', '0.516216']
         : correct/total = [(7476, 14232), (6958, 14235), (7567, 14266), (7667, 14217), (7414, 14238), (7561, 14373), (7044, 14346), (7208, 14334), (7174, 14294), (7086, 14373), (7339, 14344), (7209, 14302), (7577, 14354), (7642, 14362), (7463, 14320), (7304, 14395), (7201, 14389), (7374, 14257), (7533, 14251), (7433, 14399)]
         : compromised: 0.5255, honest: 0.5095

=== FINAL RESULTS ===
Dataset: sent140, Nodes: 20, Graph: erdos, Aggregation: d-fedavg
Attack: directed_deviation, 30.0% compromised
Final accuracy - Compromised: 0.5255, Honest: 0.5095
Overall test accuracy: mean=0.5143 ± 0.0145
