Device: cuda
Seed: 987654321
Loading 1 LEAF Sent140 train files...
LEAF Sent140 train: 254555 users, 908652 samples
Building vocabulary (max_size=10000)...
Vocabulary size: 10000
Loading 1 LEAF Sent140 test files...
LEAF Sent140 test: 254555 users, 286281 samples
Found 254555 train users, 254555 test users, 254555 common users
User sample counts range: 494 (max) to 1 (min)
Distributed ALL 254555 users across 20 clients
Users per client: 12727 (with 15 clients getting +1 user)
Train partition sizes: [44353, 44290, 44657, 44907, 44696, 45843, 45801, 45619, 45069, 45639, 45821, 45311, 45779, 46056, 45625, 45984, 46428, 44737, 45540, 46497]
Test partition sizes: [14232, 14235, 14266, 14217, 14238, 14373, 14346, 14334, 14294, 14373, 14344, 14302, 14354, 14362, 14320, 14395, 14389, 14257, 14251, 14399]
  Client 0: 44353 train samples, 2 unique classes
  Client 1: 44290 train samples, 2 unique classes
  Client 2: 44657 train samples, 2 unique classes
  Client 3: 44907 train samples, 2 unique classes
  Client 4: 44696 train samples, 2 unique classes
  Client 5: 45843 train samples, 2 unique classes
  Client 6: 45801 train samples, 2 unique classes
  Client 7: 45619 train samples, 2 unique classes
  Client 8: 45069 train samples, 2 unique classes
  Client 9: 45639 train samples, 2 unique classes
  Client 10: 45821 train samples, 2 unique classes
  Client 11: 45311 train samples, 2 unique classes
  Client 12: 45779 train samples, 2 unique classes
  Client 13: 46056 train samples, 2 unique classes
  Client 14: 45625 train samples, 2 unique classes
  Client 15: 45984 train samples, 2 unique classes
  Client 16: 46428 train samples, 2 unique classes
  Client 17: 44737 train samples, 2 unique classes
  Client 18: 45540 train samples, 2 unique classes
  Client 19: 46497 train samples, 2 unique classes
Will sample 4500 samples per client per epoch
Graph: erdos, nodes: 20, edges: 126
Degree statistics: avg=12.60, min=8, max=16
Attack: Compromised 16/20 nodes: [1, 2, 3, 5, 6, 8, 9, 10, 11, 12, 13, 14, 15, 17, 18, 19]
Attack type: gaussian, lambda: 1.0
Model variant: baseline
Model parameters: 1,174,986
Sketchguard Node 0:
  Model dim: 1,174,986 → Sketch size: 180
  Compression ratio: 6527.7x
  Using model parameters for aggregation, sketches for filtering
Sketchguard Node 1:
  Model dim: 1,174,986 → Sketch size: 180
  Compression ratio: 6527.7x
  Using model parameters for aggregation, sketches for filtering
Sketchguard Node 2:
  Model dim: 1,174,986 → Sketch size: 180
  Compression ratio: 6527.7x
  Using model parameters for aggregation, sketches for filtering
Sketchguard Node 3:
  Model dim: 1,174,986 → Sketch size: 180
  Compression ratio: 6527.7x
  Using model parameters for aggregation, sketches for filtering
Sketchguard Node 4:
  Model dim: 1,174,986 → Sketch size: 180
  Compression ratio: 6527.7x
  Using model parameters for aggregation, sketches for filtering
Sketchguard Node 5:
  Model dim: 1,174,986 → Sketch size: 180
  Compression ratio: 6527.7x
  Using model parameters for aggregation, sketches for filtering
Sketchguard Node 6:
  Model dim: 1,174,986 → Sketch size: 180
  Compression ratio: 6527.7x
  Using model parameters for aggregation, sketches for filtering
Sketchguard Node 7:
  Model dim: 1,174,986 → Sketch size: 180
  Compression ratio: 6527.7x
  Using model parameters for aggregation, sketches for filtering
Sketchguard Node 8:
  Model dim: 1,174,986 → Sketch size: 180
  Compression ratio: 6527.7x
  Using model parameters for aggregation, sketches for filtering
Sketchguard Node 9:
  Model dim: 1,174,986 → Sketch size: 180
  Compression ratio: 6527.7x
  Using model parameters for aggregation, sketches for filtering
Sketchguard Node 10:
  Model dim: 1,174,986 → Sketch size: 180
  Compression ratio: 6527.7x
  Using model parameters for aggregation, sketches for filtering
Sketchguard Node 11:
  Model dim: 1,174,986 → Sketch size: 180
  Compression ratio: 6527.7x
  Using model parameters for aggregation, sketches for filtering
Sketchguard Node 12:
  Model dim: 1,174,986 → Sketch size: 180
  Compression ratio: 6527.7x
  Using model parameters for aggregation, sketches for filtering
Sketchguard Node 13:
  Model dim: 1,174,986 → Sketch size: 180
  Compression ratio: 6527.7x
  Using model parameters for aggregation, sketches for filtering
Sketchguard Node 14:
  Model dim: 1,174,986 → Sketch size: 180
  Compression ratio: 6527.7x
  Using model parameters for aggregation, sketches for filtering
Sketchguard Node 15:
  Model dim: 1,174,986 → Sketch size: 180
  Compression ratio: 6527.7x
  Using model parameters for aggregation, sketches for filtering
Sketchguard Node 16:
  Model dim: 1,174,986 → Sketch size: 180
  Compression ratio: 6527.7x
  Using model parameters for aggregation, sketches for filtering
Sketchguard Node 17:
  Model dim: 1,174,986 → Sketch size: 180
  Compression ratio: 6527.7x
  Using model parameters for aggregation, sketches for filtering
Sketchguard Node 18:
  Model dim: 1,174,986 → Sketch size: 180
  Compression ratio: 6527.7x
  Using model parameters for aggregation, sketches for filtering
Sketchguard Node 19:
  Model dim: 1,174,986 → Sketch size: 180
  Compression ratio: 6527.7x
  Using model parameters for aggregation, sketches for filtering
Sketchguard ALGORITHM (Sketch-based Filtering + State Aggregation)
  - Model dimension: 1,174,986 parameters
  - Config: SketchguardConfig(gamma=2, kappa=1, alpha=0.5, min_neighbors=1, sketch_size=180, network_seed=987654321, attack_detection_window=5)
  - Sketch size: 180
  - Compression ratio: 6527.7x
  - Complexity: O(d + N×k) = O(1,174,986 + 20×180)
  - Theoretical speedup vs BALANCE: 19.9x
Initial test acc across nodes: mean=0.4965 ± 0.0152
Round 001: test acc mean=0.5386 ± 0.0209 | min=0.5096 max=0.5902
         : test loss mean=0.6915 ± 0.0008
         : individual accs = ['0.533024', '0.551809', '0.543600', '0.509601', '0.525846', '0.530509', '0.529416', '0.576113', '0.539387', '0.590204', '0.510666', '0.546497', '0.550160', '0.522768', '0.530517', '0.513373', '0.542359', '0.527460', '0.527331', '0.571359']
         : correct/total = [(7586, 14232), (7855, 14235), (7755, 14266), (7245, 14217), (7487, 14238), (7625, 14373), (7595, 14346), (8258, 14334), (7710, 14294), (8483, 14373), (7325, 14344), (7816, 14302), (7897, 14354), (7508, 14362), (7597, 14320), (7390, 14395), (7804, 14389), (7520, 14257), (7515, 14251), (8227, 14399)]
         : compromised: 0.5372, honest: 0.5443
         : sketchguard stats = ['Node 0: acc_rate=0.188', 'Node 1: acc_rate=0.364', 'Node 2: acc_rate=0.250']...
Round 002: test acc mean=0.5160 ± 0.0287 | min=0.4863 max=0.5786
         : test loss mean=0.6919 ± 0.0016
         : individual accs = ['0.563800', '0.486828', '0.486331', '0.562285', '0.553308', '0.519864', '0.497769', '0.578624', '0.492304', '0.497391', '0.502789', '0.530975', '0.500975', '0.508982', '0.495740', '0.498437', '0.551185', '0.503332', '0.488667', '0.500174']
         : correct/total = [(8024, 14232), (6930, 14235), (6938, 14266), (7994, 14217), (7878, 14238), (7472, 14373), (7141, 14346), (8294, 14334), (7037, 14294), (7149, 14373), (7212, 14344), (7594, 14302), (7191, 14354), (7310, 14362), (7099, 14320), (7175, 14395), (7931, 14389), (7176, 14257), (6964, 14251), (7202, 14399)]
         : compromised: 0.5046, honest: 0.5617
         : sketchguard stats = ['Node 0: acc_rate=0.188', 'Node 1: acc_rate=0.364', 'Node 2: acc_rate=0.250']...
Round 003: test acc mean=0.5104 ± 0.0226 | min=0.4875 max=0.5716
         : test loss mean=0.6907 ± 0.0021
         : individual accs = ['0.538786', '0.487460', '0.490677', '0.571569', '0.531044', '0.501635', '0.497769', '0.554904', '0.499230', '0.493008', '0.499233', '0.515173', '0.499582', '0.509330', '0.496997', '0.498367', '0.531587', '0.503262', '0.488948', '0.499271']
         : correct/total = [(7668, 14232), (6939, 14235), (7000, 14266), (8126, 14217), (7561, 14238), (7210, 14373), (7141, 14346), (7954, 14334), (7136, 14294), (7086, 14373), (7161, 14344), (7368, 14302), (7171, 14354), (7315, 14362), (7117, 14320), (7174, 14395), (7649, 14389), (7175, 14257), (6968, 14251), (7189, 14399)]
         : compromised: 0.5032, honest: 0.5391
         : sketchguard stats = ['Node 0: acc_rate=0.188', 'Node 1: acc_rate=0.364', 'Node 2: acc_rate=0.250']...
Round 004: test acc mean=0.5544 ± 0.0195 | min=0.5242 max=0.5858
         : test loss mean=0.6873 ± 0.0022
         : individual accs = ['0.581788', '0.547805', '0.570377', '0.585778', '0.580489', '0.565853', '0.528649', '0.584903', '0.547572', '0.535518', '0.546152', '0.568732', '0.543403', '0.530010', '0.524232', '0.538520', '0.571895', '0.541138', '0.547541', '0.546705']
         : correct/total = [(8280, 14232), (7798, 14235), (8137, 14266), (8328, 14217), (8265, 14238), (8133, 14373), (7584, 14346), (8384, 14334), (7827, 14294), (7697, 14373), (7834, 14344), (8134, 14302), (7800, 14354), (7612, 14362), (7507, 14320), (7752, 14395), (8229, 14389), (7715, 14257), (7803, 14251), (7872, 14399)]
         : compromised: 0.5480, honest: 0.5798
         : sketchguard stats = ['Node 0: acc_rate=0.188', 'Node 1: acc_rate=0.364', 'Node 2: acc_rate=0.250']...
Round 005: test acc mean=0.5897 ± 0.0091 | min=0.5759 max=0.6116
         : test loss mean=0.6811 ± 0.0026
         : individual accs = ['0.596332', '0.594942', '0.575915', '0.611592', '0.603807', '0.589995', '0.577234', '0.602344', '0.586050', '0.585473', '0.582474', '0.581807', '0.580396', '0.591770', '0.581006', '0.596804', '0.592327', '0.587290', '0.585573', '0.590110']
         : correct/total = [(8487, 14232), (8469, 14235), (8216, 14266), (8695, 14217), (8597, 14238), (8480, 14373), (8281, 14346), (8634, 14334), (8377, 14294), (8415, 14373), (8355, 14344), (8321, 14302), (8331, 14354), (8499, 14362), (8320, 14320), (8591, 14395), (8523, 14389), (8373, 14257), (8345, 14251), (8497, 14399)]
         : compromised: 0.5874, honest: 0.5987
         : sketchguard stats = ['Node 0: acc_rate=0.188', 'Node 1: acc_rate=0.364', 'Node 2: acc_rate=0.250']...
Round 006: test acc mean=0.6036 ± 0.0056 | min=0.5923 max=0.6133
         : test loss mean=0.6709 ± 0.0023
         : individual accs = ['0.603288', '0.602459', '0.602762', '0.613280', '0.606967', '0.609754', '0.606023', '0.603111', '0.604030', '0.601892', '0.611893', '0.604741', '0.612164', '0.606601', '0.592458', '0.601250', '0.599555', '0.598864', '0.592309', '0.599347']
         : correct/total = [(8586, 14232), (8576, 14235), (8599, 14266), (8719, 14217), (8642, 14238), (8764, 14373), (8694, 14346), (8645, 14334), (8634, 14294), (8651, 14373), (8777, 14344), (8649, 14302), (8787, 14354), (8712, 14362), (8484, 14320), (8655, 14395), (8627, 14389), (8538, 14257), (8441, 14251), (8630, 14399)]
         : compromised: 0.6037, honest: 0.6032
         : sketchguard stats = ['Node 0: acc_rate=0.188', 'Node 1: acc_rate=0.364', 'Node 2: acc_rate=0.250']...
Round 007: test acc mean=0.6161 ± 0.0038 | min=0.6079 max=0.6235
         : test loss mean=0.6585 ± 0.0016
         : individual accs = ['0.623524', '0.614261', '0.611734', '0.617289', '0.622419', '0.619217', '0.618012', '0.616227', '0.616203', '0.616851', '0.618656', '0.612222', '0.620036', '0.618925', '0.612989', '0.612921', '0.612690', '0.613172', '0.607887', '0.616501']
         : correct/total = [(8874, 14232), (8744, 14235), (8727, 14266), (8776, 14217), (8862, 14238), (8900, 14373), (8866, 14346), (8833, 14334), (8808, 14294), (8866, 14373), (8874, 14344), (8756, 14302), (8900, 14354), (8889, 14362), (8778, 14320), (8823, 14395), (8816, 14389), (8742, 14257), (8663, 14251), (8877, 14399)]
         : compromised: 0.6154, honest: 0.6187
         : sketchguard stats = ['Node 0: acc_rate=0.188', 'Node 1: acc_rate=0.364', 'Node 2: acc_rate=0.250']...
Round 008: test acc mean=0.6242 ± 0.0038 | min=0.6178 max=0.6304
         : test loss mean=0.6505 ± 0.0020
         : individual accs = ['0.628654', '0.625220', '0.617763', '0.630372', '0.627546', '0.627913', '0.623031', '0.623831', '0.625787', '0.624922', '0.630020', '0.618305', '0.626376', '0.624913', '0.621089', '0.622369', '0.618320', '0.624185', '0.618343', '0.624835']
         : correct/total = [(8947, 14232), (8900, 14235), (8813, 14266), (8962, 14217), (8935, 14238), (9025, 14373), (8938, 14346), (8942, 14334), (8945, 14294), (8982, 14373), (9037, 14344), (8843, 14302), (8991, 14354), (8975, 14362), (8894, 14320), (8959, 14395), (8897, 14389), (8899, 14257), (8812, 14251), (8997, 14399)]
         : compromised: 0.6241, honest: 0.6246
         : sketchguard stats = ['Node 0: acc_rate=0.188', 'Node 1: acc_rate=0.364', 'Node 2: acc_rate=0.250']...
Round 009: test acc mean=0.6325 ± 0.0045 | min=0.6235 max=0.6411
         : test loss mean=0.6437 ± 0.0020
         : individual accs = ['0.641091', '0.635406', '0.630730', '0.638742', '0.636606', '0.632227', '0.634951', '0.630040', '0.630264', '0.636262', '0.635527', '0.630122', '0.633064', '0.637864', '0.625838', '0.631956', '0.623532', '0.628183', '0.626553', '0.631294']
         : correct/total = [(9124, 14232), (9045, 14235), (8998, 14266), (9081, 14217), (9064, 14238), (9087, 14373), (9109, 14346), (9031, 14334), (9009, 14294), (9145, 14373), (9116, 14344), (9012, 14302), (9087, 14354), (9161, 14362), (8962, 14320), (9097, 14395), (8972, 14389), (8956, 14257), (8929, 14251), (9090, 14399)]
         : compromised: 0.6324, honest: 0.6328
         : sketchguard stats = ['Node 0: acc_rate=0.188', 'Node 1: acc_rate=0.364', 'Node 2: acc_rate=0.250']...
Round 010: test acc mean=0.6380 ± 0.0042 | min=0.6320 max=0.6462
         : test loss mean=0.6389 ± 0.0020
         : individual accs = ['0.646220', '0.641869', '0.633324', '0.636773', '0.645456', '0.632088', '0.634672', '0.637087', '0.638939', '0.642524', '0.641453', '0.637463', '0.642051', '0.641136', '0.636103', '0.636124', '0.632011', '0.632742', '0.636166', '0.635739']
         : correct/total = [(9197, 14232), (9137, 14235), (9035, 14266), (9053, 14217), (9190, 14238), (9085, 14373), (9105, 14346), (9132, 14334), (9133, 14294), (9235, 14373), (9201, 14344), (9117, 14302), (9216, 14354), (9208, 14362), (9109, 14320), (9157, 14395), (9094, 14389), (9021, 14257), (9066, 14251), (9154, 14399)]
         : compromised: 0.6374, honest: 0.6402
         : sketchguard stats = ['Node 0: acc_rate=0.188', 'Node 1: acc_rate=0.364', 'Node 2: acc_rate=0.250']...

=== FINAL RESULTS ===
Dataset: sent140, Nodes: 20, Graph: erdos, Aggregation: sketchguard
Attack: gaussian, 80.0% compromised
Final accuracy - Compromised: 0.6374, Honest: 0.6402
Overall test accuracy: mean=0.6380 ± 0.0042

=== Sketchguard SUMMARY ===
Node 0: acceptance=0.188
Node 1: acceptance=0.364
Node 2: acceptance=0.250
Node 3: acceptance=0.125
Node 4: acceptance=0.273
Node 5: acceptance=0.133
Node 6: acceptance=0.143
Node 7: acceptance=0.143
Node 8: acceptance=0.200
Node 9: acceptance=0.308
Node 10: acceptance=0.222
Node 11: acceptance=0.214
Node 12: acceptance=0.250
Node 13: acceptance=0.231
Node 14: acceptance=0.200
Node 15: acceptance=0.182
Node 16: acceptance=0.154
Node 17: acceptance=0.333
Node 18: acceptance=0.250
Node 19: acceptance=0.188

=== PARALLEL EXECUTION TIME (realistic for distributed system) ===
  COMMUNICATION (max across nodes):
    - Sketch transfer: 0.000s (0.0%)
    - Model fetch (accepted): 0.000s (0.0%)
  COMPUTATION (max across nodes):
    - Sketching: 0.293s (95.5%)
    - Filtering: 0.001s (0.4%)
    - Aggregation: 0.013s (4.1%)
  TOTALS:
    - Total computation: 0.306s (100.0%)
    - Total communication: 0.000s (0.0%)
    - Total parallel time: 0.306s

=== PER-NODE AVERAGE TIME ===
  - Sketching: 0.223s
  - Filtering: 0.001s
  - Aggregation: 0.009s
  - Sketch transfer: 0.000s
  - Model fetch: 0.000s
  - Total per node: 0.232s

=== TOTAL COMPUTATIONAL WORK (sum across all nodes) ===
  - Total sketching: 4.451s
  - Total filtering: 0.013s
  - Total aggregation: 0.171s
  - Total sketch transfer: 0.000s
  - Total model fetch: 0.000s
  - Grand total: 4.634s
  - Mean acceptance rate: 0.217

Sketchguard Algorithm Properties:
  - Original dimension: 1,174,986
  - Sketch size: 180
  - Compression ratio: 19.9x
  - Single repetition: No repetitions needed
  - Theoretical complexity: O(d + N×k)
  - Approach: Sketch filtering + state aggregation
