Device: cuda
Seed: 987654321
Loading 1 LEAF Sent140 train files...
LEAF Sent140 train: 254555 users, 908652 samples
Building vocabulary (max_size=10000)...
Vocabulary size: 10000
Loading 1 LEAF Sent140 test files...
LEAF Sent140 test: 254555 users, 286281 samples
Found 254555 train users, 254555 test users, 254555 common users
User sample counts range: 494 (max) to 1 (min)
Distributed ALL 254555 users across 20 clients
Users per client: 12727 (with 15 clients getting +1 user)
Train partition sizes: [44353, 44290, 44657, 44907, 44696, 45843, 45801, 45619, 45069, 45639, 45821, 45311, 45779, 46056, 45625, 45984, 46428, 44737, 45540, 46497]
Test partition sizes: [14232, 14235, 14266, 14217, 14238, 14373, 14346, 14334, 14294, 14373, 14344, 14302, 14354, 14362, 14320, 14395, 14389, 14257, 14251, 14399]
  Client 0: 44353 train samples, 2 unique classes
  Client 1: 44290 train samples, 2 unique classes
  Client 2: 44657 train samples, 2 unique classes
  Client 3: 44907 train samples, 2 unique classes
  Client 4: 44696 train samples, 2 unique classes
  Client 5: 45843 train samples, 2 unique classes
  Client 6: 45801 train samples, 2 unique classes
  Client 7: 45619 train samples, 2 unique classes
  Client 8: 45069 train samples, 2 unique classes
  Client 9: 45639 train samples, 2 unique classes
  Client 10: 45821 train samples, 2 unique classes
  Client 11: 45311 train samples, 2 unique classes
  Client 12: 45779 train samples, 2 unique classes
  Client 13: 46056 train samples, 2 unique classes
  Client 14: 45625 train samples, 2 unique classes
  Client 15: 45984 train samples, 2 unique classes
  Client 16: 46428 train samples, 2 unique classes
  Client 17: 44737 train samples, 2 unique classes
  Client 18: 45540 train samples, 2 unique classes
  Client 19: 46497 train samples, 2 unique classes
Will sample 4500 samples per client per epoch
Graph: erdos, nodes: 20, edges: 126
Degree statistics: avg=12.60, min=8, max=16
Attack: Compromised 12/20 nodes: [1, 2, 3, 5, 8, 11, 12, 13, 14, 15, 17, 18]
Attack type: backdoor, lambda: 1.0
Backdoor target label: 1, trigger size: 3
Model variant: baseline
Model parameters: 1,174,986
Initial test acc across nodes: mean=0.4953 ± 0.0174
Backdoor attack: Created poisoned datasets for 12 compromised nodes
Round 001: test acc mean=0.4992 ± 0.0070 | min=0.4865 max=0.5085
         : test loss mean=7.7094 ± 3.9081
         : individual accs = ['0.507729', '0.505374', '0.487172', '0.502427', '0.501756', '0.499409', '0.493587', '0.499372', '0.495243', '0.494678', '0.492959', '0.507481', '0.508290', '0.499582', '0.503212', '0.490240', '0.508513', '0.486498', '0.507122', '0.492951']
         : correct/total = [(7226, 14232), (7194, 14235), (6950, 14266), (7143, 14217), (7144, 14238), (7178, 14373), (7081, 14346), (7158, 14334), (7079, 14294), (7110, 14373), (7071, 14344), (7258, 14302), (7296, 14354), (7175, 14362), (7206, 14320), (7057, 14395), (7317, 14389), (6936, 14257), (7227, 14251), (7098, 14399)]
         : compromised: 0.4993, honest: 0.4989
Round 002: test acc mean=0.5048 ± 0.0055 | min=0.4939 max=0.5177
         : test loss mean=12.5431 ± 4.9314
         : individual accs = ['0.504778', '0.512118', '0.517664', '0.502849', '0.504074', '0.505740', '0.509131', '0.493931', '0.498251', '0.507271', '0.499094', '0.504615', '0.499025', '0.500000', '0.514106', '0.503022', '0.509486', '0.503542', '0.504035', '0.503577']
         : correct/total = [(7184, 14232), (7290, 14235), (7385, 14266), (7149, 14217), (7177, 14238), (7269, 14373), (7304, 14346), (7080, 14334), (7122, 14294), (7291, 14373), (7159, 14344), (7217, 14302), (7163, 14354), (7181, 14362), (7362, 14320), (7241, 14395), (7331, 14389), (7179, 14257), (7183, 14251), (7251, 14399)]
         : compromised: 0.5054, honest: 0.5039
Round 003: test acc mean=0.5051 ± 0.0053 | min=0.4935 max=0.5166
         : test loss mean=10.8582 ± 2.0175
         : individual accs = ['0.507799', '0.516614', '0.513178', '0.514947', '0.505197', '0.504348', '0.500488', '0.507186', '0.502309', '0.504279', '0.502370', '0.505454', '0.497213', '0.493525', '0.507542', '0.502258', '0.506915', '0.504454', '0.504456', '0.502118']
         : correct/total = [(7227, 14232), (7354, 14235), (7321, 14266), (7321, 14217), (7193, 14238), (7249, 14373), (7180, 14346), (7270, 14334), (7180, 14294), (7248, 14373), (7206, 14344), (7229, 14302), (7137, 14354), (7088, 14362), (7268, 14320), (7230, 14395), (7294, 14389), (7192, 14257), (7189, 14251), (7230, 14399)]
         : compromised: 0.5055, honest: 0.5045
Round 004: test acc mean=0.4961 ± 0.0048 | min=0.4874 max=0.5058
         : test loss mean=15.9927 ± 7.5762
         : individual accs = ['0.494028', '0.490270', '0.488013', '0.487445', '0.497401', '0.495721', '0.499094', '0.492256', '0.497342', '0.501148', '0.499930', '0.493637', '0.500766', '0.505849', '0.492179', '0.498159', '0.492807', '0.504173', '0.494702', '0.497326']
         : correct/total = [(7031, 14232), (6979, 14235), (6962, 14266), (6930, 14217), (7082, 14238), (7125, 14373), (7160, 14346), (7056, 14334), (7109, 14294), (7203, 14373), (7171, 14344), (7060, 14302), (7188, 14354), (7265, 14362), (7048, 14320), (7171, 14395), (7091, 14389), (7188, 14257), (7050, 14251), (7161, 14399)]
         : compromised: 0.4957, honest: 0.4967
Round 005: test acc mean=0.4960 ± 0.0046 | min=0.4870 max=0.5059
         : test loss mean=7.8149 ± 2.2490
         : individual accs = ['0.493957', '0.486969', '0.491658', '0.495182', '0.494662', '0.491616', '0.500209', '0.492675', '0.498041', '0.497252', '0.495678', '0.494197', '0.505782', '0.505918', '0.491969', '0.499479', '0.491834', '0.495336', '0.500526', '0.496354']
         : correct/total = [(7030, 14232), (6932, 14235), (7014, 14266), (7040, 14217), (7043, 14238), (7066, 14373), (7176, 14346), (7062, 14334), (7119, 14294), (7147, 14373), (7110, 14344), (7068, 14302), (7260, 14354), (7266, 14362), (7045, 14320), (7190, 14395), (7077, 14389), (7062, 14257), (7133, 14251), (7147, 14399)]
         : compromised: 0.4964, honest: 0.4953
Round 006: test acc mean=0.5068 ± 0.0106 | min=0.4851 max=0.5276
         : test loss mean=9.1263 ± 1.8634
         : individual accs = ['0.503162', '0.485142', '0.523062', '0.491384', '0.497120', '0.505879', '0.517914', '0.507744', '0.527634', '0.497182', '0.499791', '0.505664', '0.509196', '0.516641', '0.508310', '0.504411', '0.519911', '0.495265', '0.509017', '0.512466']
         : correct/total = [(7161, 14232), (6906, 14235), (7462, 14266), (6986, 14217), (7078, 14238), (7271, 14373), (7430, 14346), (7278, 14334), (7542, 14294), (7146, 14373), (7169, 14344), (7232, 14302), (7309, 14354), (7420, 14362), (7279, 14320), (7261, 14395), (7481, 14389), (7061, 14257), (7254, 14251), (7379, 14399)]
         : compromised: 0.5068, honest: 0.5069
Round 007: test acc mean=0.4950 ± 0.0049 | min=0.4846 max=0.5026
         : test loss mean=14.7484 ± 2.6614
         : individual accs = ['0.492201', '0.485213', '0.484579', '0.487304', '0.495013', '0.496973', '0.501673', '0.494279', '0.496502', '0.496278', '0.496793', '0.493427', '0.502647', '0.500766', '0.494902', '0.499340', '0.490722', '0.497861', '0.494351', '0.499271']
         : correct/total = [(7005, 14232), (6907, 14235), (6913, 14266), (6928, 14217), (7048, 14238), (7143, 14373), (7197, 14346), (7085, 14334), (7097, 14294), (7133, 14373), (7126, 14344), (7057, 14302), (7215, 14354), (7192, 14362), (7087, 14320), (7188, 14395), (7061, 14389), (7098, 14257), (7045, 14251), (7189, 14399)]
         : compromised: 0.4945, honest: 0.4958
Round 008: test acc mean=0.5014 ± 0.0082 | min=0.4834 max=0.5166
         : test loss mean=4.1177 ± 1.6881
         : individual accs = ['0.490655', '0.494275', '0.488224', '0.511219', '0.483354', '0.503444', '0.503834', '0.503209', '0.501889', '0.492242', '0.508017', '0.499511', '0.511286', '0.508495', '0.503631', '0.501146', '0.495865', '0.504454', '0.506561', '0.516633']
         : correct/total = [(6983, 14232), (7036, 14235), (6965, 14266), (7268, 14217), (6882, 14238), (7236, 14373), (7228, 14346), (7213, 14334), (7174, 14294), (7075, 14373), (7287, 14344), (7144, 14302), (7339, 14354), (7303, 14362), (7212, 14320), (7214, 14395), (7135, 14389), (7192, 14257), (7219, 14251), (7439, 14399)]
         : compromised: 0.5028, honest: 0.4992
Round 009: test acc mean=0.4974 ± 0.0056 | min=0.4846 max=0.5094
         : test loss mean=5.2508 ± 0.4898
         : individual accs = ['0.494941', '0.484580', '0.494603', '0.489695', '0.499789', '0.496765', '0.505089', '0.494558', '0.493983', '0.494051', '0.495956', '0.497133', '0.492755', '0.509400', '0.496229', '0.503717', '0.499548', '0.499825', '0.498983', '0.506146']
         : correct/total = [(7044, 14232), (6898, 14235), (7056, 14266), (6962, 14217), (7116, 14238), (7140, 14373), (7246, 14346), (7089, 14334), (7061, 14294), (7101, 14373), (7114, 14344), (7110, 14302), (7073, 14354), (7316, 14362), (7106, 14320), (7251, 14395), (7188, 14389), (7126, 14257), (7111, 14251), (7288, 14399)]
         : compromised: 0.4965, honest: 0.4988
Round 010: test acc mean=0.4981 ± 0.0046 | min=0.4903 max=0.5080
         : test loss mean=4.9461 ± 1.4261
         : individual accs = ['0.503865', '0.499333', '0.501963', '0.507561', '0.493679', '0.497669', '0.499164', '0.494419', '0.497132', '0.491686', '0.496933', '0.496434', '0.492337', '0.490322', '0.508031', '0.496422', '0.501286', '0.497229', '0.500246', '0.496910']
         : correct/total = [(7171, 14232), (7108, 14235), (7161, 14266), (7216, 14217), (7029, 14238), (7153, 14373), (7161, 14346), (7087, 14334), (7106, 14294), (7067, 14373), (7128, 14344), (7100, 14302), (7067, 14354), (7042, 14362), (7275, 14320), (7146, 14395), (7213, 14389), (7089, 14257), (7129, 14251), (7155, 14399)]
         : compromised: 0.4987, honest: 0.4972

=== FINAL RESULTS ===
Dataset: sent140, Nodes: 20, Graph: erdos, Aggregation: krum
Attack: backdoor, 60.0% compromised
Final accuracy - Compromised: 0.4987, Honest: 0.4972
Overall test accuracy: mean=0.4981 ± 0.0046

=== BACKDOOR ATTACK SUCCESS RATE (ASR) ===
Target label: 1
Trigger size: 3x3
Overall ASR: 0.6352 ± 0.1395
Honest nodes ASR: 0.6641 ± 0.1222
Compromised nodes ASR: 0.6160 ± 0.1468
Note: Higher ASR indicates more successful backdoor attack
