Device: cuda
Seed: 987654321
Loading 1 LEAF Sent140 train files...
LEAF Sent140 train: 254555 users, 908652 samples
Building vocabulary (max_size=10000)...
Vocabulary size: 10000
Loading 1 LEAF Sent140 test files...
LEAF Sent140 test: 254555 users, 286281 samples
Found 254555 train users, 254555 test users, 254555 common users
User sample counts range: 494 (max) to 1 (min)
Distributed ALL 254555 users across 20 clients
Users per client: 12727 (with 15 clients getting +1 user)
Train partition sizes: [44353, 44290, 44657, 44907, 44696, 45843, 45801, 45619, 45069, 45639, 45821, 45311, 45779, 46056, 45625, 45984, 46428, 44737, 45540, 46497]
Test partition sizes: [14232, 14235, 14266, 14217, 14238, 14373, 14346, 14334, 14294, 14373, 14344, 14302, 14354, 14362, 14320, 14395, 14389, 14257, 14251, 14399]
  Client 0: 44353 train samples, 2 unique classes
  Client 1: 44290 train samples, 2 unique classes
  Client 2: 44657 train samples, 2 unique classes
  Client 3: 44907 train samples, 2 unique classes
  Client 4: 44696 train samples, 2 unique classes
  Client 5: 45843 train samples, 2 unique classes
  Client 6: 45801 train samples, 2 unique classes
  Client 7: 45619 train samples, 2 unique classes
  Client 8: 45069 train samples, 2 unique classes
  Client 9: 45639 train samples, 2 unique classes
  Client 10: 45821 train samples, 2 unique classes
  Client 11: 45311 train samples, 2 unique classes
  Client 12: 45779 train samples, 2 unique classes
  Client 13: 46056 train samples, 2 unique classes
  Client 14: 45625 train samples, 2 unique classes
  Client 15: 45984 train samples, 2 unique classes
  Client 16: 46428 train samples, 2 unique classes
  Client 17: 44737 train samples, 2 unique classes
  Client 18: 45540 train samples, 2 unique classes
  Client 19: 46497 train samples, 2 unique classes
Will sample 4500 samples per client per epoch
Graph: fully, nodes: 20, edges: 190
Degree statistics: avg=19.00, min=19, max=19
Attack: Compromised 14/20 nodes: [1, 2, 3, 5, 6, 8, 11, 12, 13, 14, 15, 17, 18, 19]
Attack type: directed_deviation, lambda: 1.0
Model variant: baseline
Model parameters: 1,174,986
Initial test acc across nodes: mean=0.4965 ± 0.0152
Round 001: test acc mean=0.5019 ± 0.0065 | min=0.4918 max=0.5158
         : test loss mean=11.6198 ± 4.5031
         : individual accs = ['0.507518', '0.513874', '0.492149', '0.503271', '0.494100', '0.505044', '0.495399', '0.503070', '0.492235', '0.506714', '0.491843', '0.500629', '0.515814', '0.497911', '0.499860', '0.503508', '0.503996', '0.504314', '0.506140', '0.501424']
         : correct/total = [(7223, 14232), (7315, 14235), (7021, 14266), (7155, 14217), (7035, 14238), (7259, 14373), (7107, 14346), (7211, 14334), (7036, 14294), (7283, 14373), (7055, 14344), (7160, 14302), (7404, 14354), (7151, 14362), (7158, 14320), (7248, 14395), (7252, 14389), (7190, 14257), (7213, 14251), (7220, 14399)]
         : compromised: 0.5023, honest: 0.5012
Round 002: test acc mean=0.4894 ± 0.0036 | min=0.4829 max=0.4963
         : test loss mean=9.3246 ± 0.0818
         : individual accs = ['0.486158', '0.486758', '0.485981', '0.495604', '0.485883', '0.487929', '0.486477', '0.491419', '0.482860', '0.488625', '0.494492', '0.490701', '0.491501', '0.487606', '0.492179', '0.490795', '0.486066', '0.496318', '0.487615', '0.493784']
         : correct/total = [(6919, 14232), (6929, 14235), (6933, 14266), (7046, 14217), (6918, 14238), (7013, 14373), (6979, 14346), (7044, 14334), (6902, 14294), (7023, 14373), (7093, 14344), (7018, 14302), (7055, 14354), (7003, 14362), (7048, 14320), (7065, 14395), (6994, 14389), (7076, 14257), (6949, 14251), (7110, 14399)]
         : compromised: 0.4897, honest: 0.4888
Round 003: test acc mean=0.4834 ± 0.0043 | min=0.4723 max=0.4897
         : test loss mean=1.1045 ± 0.0118
         : individual accs = ['0.482715', '0.485494', '0.487523', '0.488851', '0.482441', '0.487442', '0.483340', '0.484443', '0.483000', '0.485424', '0.481665', '0.488253', '0.472342', '0.474029', '0.484288', '0.484057', '0.482382', '0.481167', '0.489720', '0.479686']
         : correct/total = [(6870, 14232), (6911, 14235), (6955, 14266), (6950, 14217), (6869, 14238), (7006, 14373), (6934, 14346), (6944, 14334), (6904, 14294), (6977, 14373), (6909, 14344), (6983, 14302), (6780, 14354), (6808, 14362), (6935, 14320), (6968, 14395), (6941, 14389), (6860, 14257), (6979, 14251), (6907, 14399)]
         : compromised: 0.4835, honest: 0.4832
Round 004: test acc mean=0.4988 ± 0.0035 | min=0.4893 max=0.5044
         : test loss mean=5.0380 ± 0.0557
         : individual accs = ['0.493957', '0.501440', '0.489275', '0.501442', '0.499438', '0.504418', '0.500558', '0.499512', '0.500979', '0.494678', '0.501115', '0.496364', '0.496377', '0.501462', '0.498184', '0.495380', '0.498923', '0.503542', '0.501438', '0.498298']
         : correct/total = [(7030, 14232), (7138, 14235), (6980, 14266), (7129, 14217), (7111, 14238), (7250, 14373), (7181, 14346), (7160, 14334), (7161, 14294), (7110, 14373), (7188, 14344), (7099, 14302), (7125, 14354), (7202, 14362), (7134, 14320), (7131, 14395), (7179, 14389), (7179, 14257), (7146, 14251), (7175, 14399)]
         : compromised: 0.4992, honest: 0.4979
Round 005: test acc mean=0.5041 ± 0.0056 | min=0.4892 max=0.5136
         : test loss mean=1.2255 ± 0.0195
         : individual accs = ['0.510961', '0.511064', '0.513599', '0.507491', '0.503582', '0.503514', '0.502788', '0.502512', '0.508955', '0.505322', '0.502091', '0.507901', '0.499930', '0.489208', '0.502235', '0.501771', '0.501008', '0.495125', '0.509999', '0.502188']
         : correct/total = [(7272, 14232), (7275, 14235), (7327, 14266), (7215, 14217), (7170, 14238), (7237, 14373), (7213, 14346), (7203, 14334), (7275, 14294), (7263, 14373), (7202, 14344), (7264, 14302), (7176, 14354), (7026, 14362), (7192, 14320), (7223, 14395), (7209, 14389), (7059, 14257), (7268, 14251), (7231, 14399)]
         : compromised: 0.5040, honest: 0.5042
Round 006: test acc mean=0.5016 ± 0.0037 | min=0.4940 max=0.5077
         : test loss mean=2.9725 ± 0.0333
         : individual accs = ['0.507659', '0.505163', '0.504136', '0.498347', '0.503722', '0.501774', '0.496654', '0.499791', '0.493983', '0.498365', '0.506902', '0.500769', '0.500627', '0.503481', '0.501397', '0.507121', '0.497602', '0.504033', '0.496597', '0.503299']
         : correct/total = [(7225, 14232), (7191, 14235), (7192, 14266), (7085, 14217), (7172, 14238), (7212, 14373), (7125, 14346), (7164, 14334), (7061, 14294), (7163, 14373), (7271, 14344), (7162, 14302), (7186, 14354), (7231, 14362), (7180, 14320), (7300, 14395), (7160, 14389), (7186, 14257), (7077, 14251), (7247, 14399)]
         : compromised: 0.5012, honest: 0.5023
Round 007: test acc mean=0.5061 ± 0.0047 | min=0.4983 max=0.5184
         : test loss mean=0.8122 ± 0.0043
         : individual accs = ['0.511875', '0.502283', '0.498318', '0.505592', '0.503793', '0.501705', '0.500558', '0.501674', '0.503288', '0.505531', '0.504183', '0.506363', '0.502996', '0.518382', '0.507751', '0.513234', '0.509000', '0.507751', '0.507263', '0.510938']
         : correct/total = [(7285, 14232), (7150, 14235), (7109, 14266), (7188, 14217), (7173, 14238), (7211, 14373), (7181, 14346), (7191, 14334), (7194, 14294), (7266, 14373), (7232, 14344), (7242, 14302), (7220, 14354), (7445, 14362), (7271, 14320), (7388, 14395), (7324, 14389), (7239, 14257), (7229, 14251), (7357, 14399)]
         : compromised: 0.5062, honest: 0.5060
Round 008: test acc mean=0.5004 ± 0.0037 | min=0.4948 max=0.5100
         : test loss mean=1.9716 ± 0.0220
         : individual accs = ['0.510048', '0.496874', '0.501472', '0.495674', '0.498666', '0.496973', '0.506134', '0.502232', '0.498671', '0.503166', '0.500279', '0.494826', '0.503623', '0.504108', '0.502584', '0.497048', '0.497602', '0.499264', '0.500386', '0.497951']
         : correct/total = [(7259, 14232), (7073, 14235), (7154, 14266), (7047, 14217), (7100, 14238), (7143, 14373), (7261, 14346), (7199, 14334), (7128, 14294), (7232, 14373), (7176, 14344), (7077, 14302), (7229, 14354), (7240, 14362), (7197, 14320), (7155, 14395), (7160, 14389), (7118, 14257), (7131, 14251), (7170, 14399)]
         : compromised: 0.4997, honest: 0.5020
Round 009: test acc mean=0.5025 ± 0.0051 | min=0.4898 max=0.5105
         : test loss mean=0.7914 ± 0.0048
         : individual accs = ['0.505551', '0.510362', '0.510515', '0.500387', '0.499789', '0.502192', '0.503834', '0.501953', '0.507346', '0.503027', '0.501673', '0.506992', '0.498119', '0.489765', '0.503771', '0.498854', '0.497880', '0.494564', '0.509298', '0.504063']
         : correct/total = [(7195, 14232), (7265, 14235), (7283, 14266), (7114, 14217), (7116, 14238), (7218, 14373), (7228, 14346), (7195, 14334), (7252, 14294), (7230, 14373), (7196, 14344), (7251, 14302), (7150, 14354), (7034, 14362), (7214, 14320), (7181, 14395), (7164, 14389), (7051, 14257), (7258, 14251), (7258, 14399)]
         : compromised: 0.5029, honest: 0.5016
Round 010: test acc mean=0.4985 ± 0.0043 | min=0.4877 max=0.5049
         : test loss mean=1.4135 ± 0.0109
         : individual accs = ['0.491076', '0.498981', '0.501192', '0.500668', '0.500773', '0.503027', '0.499303', '0.487652', '0.497132', '0.503583', '0.504950', '0.500769', '0.503832', '0.500766', '0.493855', '0.495450', '0.498436', '0.493863', '0.498281', '0.496840']
         : correct/total = [(6989, 14232), (7103, 14235), (7150, 14266), (7118, 14217), (7130, 14238), (7230, 14373), (7163, 14346), (6990, 14334), (7106, 14294), (7238, 14373), (7243, 14344), (7162, 14302), (7232, 14354), (7192, 14362), (7072, 14320), (7132, 14395), (7172, 14389), (7041, 14257), (7101, 14251), (7154, 14399)]
         : compromised: 0.4989, honest: 0.4977

=== FINAL RESULTS ===
Dataset: sent140, Nodes: 20, Graph: fully, Aggregation: d-fedavg
Attack: directed_deviation, 70.0% compromised
Final accuracy - Compromised: 0.4989, Honest: 0.4977
Overall test accuracy: mean=0.4985 ± 0.0043
