Device: cuda
Seed: 987654321
Loading 1 LEAF Sent140 train files...
LEAF Sent140 train: 254555 users, 908652 samples
Building vocabulary (max_size=10000)...
Vocabulary size: 10000
Loading 1 LEAF Sent140 test files...
LEAF Sent140 test: 254555 users, 286281 samples
Found 254555 train users, 254555 test users, 254555 common users
User sample counts range: 494 (max) to 1 (min)
Distributed ALL 254555 users across 20 clients
Users per client: 12727 (with 15 clients getting +1 user)
Train partition sizes: [44353, 44290, 44657, 44907, 44696, 45843, 45801, 45619, 45069, 45639, 45821, 45311, 45779, 46056, 45625, 45984, 46428, 44737, 45540, 46497]
Test partition sizes: [14232, 14235, 14266, 14217, 14238, 14373, 14346, 14334, 14294, 14373, 14344, 14302, 14354, 14362, 14320, 14395, 14389, 14257, 14251, 14399]
  Client 0: 44353 train samples, 2 unique classes
  Client 1: 44290 train samples, 2 unique classes
  Client 2: 44657 train samples, 2 unique classes
  Client 3: 44907 train samples, 2 unique classes
  Client 4: 44696 train samples, 2 unique classes
  Client 5: 45843 train samples, 2 unique classes
  Client 6: 45801 train samples, 2 unique classes
  Client 7: 45619 train samples, 2 unique classes
  Client 8: 45069 train samples, 2 unique classes
  Client 9: 45639 train samples, 2 unique classes
  Client 10: 45821 train samples, 2 unique classes
  Client 11: 45311 train samples, 2 unique classes
  Client 12: 45779 train samples, 2 unique classes
  Client 13: 46056 train samples, 2 unique classes
  Client 14: 45625 train samples, 2 unique classes
  Client 15: 45984 train samples, 2 unique classes
  Client 16: 46428 train samples, 2 unique classes
  Client 17: 44737 train samples, 2 unique classes
  Client 18: 45540 train samples, 2 unique classes
  Client 19: 46497 train samples, 2 unique classes
Will sample 4500 samples per client per epoch
Graph: fully, nodes: 20, edges: 190
Degree statistics: avg=19.00, min=19, max=19
Attack: Compromised 14/20 nodes: [1, 2, 3, 5, 6, 8, 11, 12, 13, 14, 15, 17, 18, 19]
Attack type: krum, lambda: 1.0
Model variant: baseline
Model parameters: 1,174,986
Sketchguard Node 0:
  Model dim: 1,174,986 → Sketch size: 180
  Compression ratio: 6527.7x
  Using model parameters for aggregation, sketches for filtering
Sketchguard Node 1:
  Model dim: 1,174,986 → Sketch size: 180
  Compression ratio: 6527.7x
  Using model parameters for aggregation, sketches for filtering
Sketchguard Node 2:
  Model dim: 1,174,986 → Sketch size: 180
  Compression ratio: 6527.7x
  Using model parameters for aggregation, sketches for filtering
Sketchguard Node 3:
  Model dim: 1,174,986 → Sketch size: 180
  Compression ratio: 6527.7x
  Using model parameters for aggregation, sketches for filtering
Sketchguard Node 4:
  Model dim: 1,174,986 → Sketch size: 180
  Compression ratio: 6527.7x
  Using model parameters for aggregation, sketches for filtering
Sketchguard Node 5:
  Model dim: 1,174,986 → Sketch size: 180
  Compression ratio: 6527.7x
  Using model parameters for aggregation, sketches for filtering
Sketchguard Node 6:
  Model dim: 1,174,986 → Sketch size: 180
  Compression ratio: 6527.7x
  Using model parameters for aggregation, sketches for filtering
Sketchguard Node 7:
  Model dim: 1,174,986 → Sketch size: 180
  Compression ratio: 6527.7x
  Using model parameters for aggregation, sketches for filtering
Sketchguard Node 8:
  Model dim: 1,174,986 → Sketch size: 180
  Compression ratio: 6527.7x
  Using model parameters for aggregation, sketches for filtering
Sketchguard Node 9:
  Model dim: 1,174,986 → Sketch size: 180
  Compression ratio: 6527.7x
  Using model parameters for aggregation, sketches for filtering
Sketchguard Node 10:
  Model dim: 1,174,986 → Sketch size: 180
  Compression ratio: 6527.7x
  Using model parameters for aggregation, sketches for filtering
Sketchguard Node 11:
  Model dim: 1,174,986 → Sketch size: 180
  Compression ratio: 6527.7x
  Using model parameters for aggregation, sketches for filtering
Sketchguard Node 12:
  Model dim: 1,174,986 → Sketch size: 180
  Compression ratio: 6527.7x
  Using model parameters for aggregation, sketches for filtering
Sketchguard Node 13:
  Model dim: 1,174,986 → Sketch size: 180
  Compression ratio: 6527.7x
  Using model parameters for aggregation, sketches for filtering
Sketchguard Node 14:
  Model dim: 1,174,986 → Sketch size: 180
  Compression ratio: 6527.7x
  Using model parameters for aggregation, sketches for filtering
Sketchguard Node 15:
  Model dim: 1,174,986 → Sketch size: 180
  Compression ratio: 6527.7x
  Using model parameters for aggregation, sketches for filtering
Sketchguard Node 16:
  Model dim: 1,174,986 → Sketch size: 180
  Compression ratio: 6527.7x
  Using model parameters for aggregation, sketches for filtering
Sketchguard Node 17:
  Model dim: 1,174,986 → Sketch size: 180
  Compression ratio: 6527.7x
  Using model parameters for aggregation, sketches for filtering
Sketchguard Node 18:
  Model dim: 1,174,986 → Sketch size: 180
  Compression ratio: 6527.7x
  Using model parameters for aggregation, sketches for filtering
Sketchguard Node 19:
  Model dim: 1,174,986 → Sketch size: 180
  Compression ratio: 6527.7x
  Using model parameters for aggregation, sketches for filtering
Sketchguard ALGORITHM (Sketch-based Filtering + State Aggregation)
  - Model dimension: 1,174,986 parameters
  - Config: SketchguardConfig(gamma=2, kappa=1, alpha=0.5, min_neighbors=1, sketch_size=180, network_seed=987654321, attack_detection_window=5)
  - Sketch size: 180
  - Compression ratio: 6527.7x
  - Complexity: O(d + N×k) = O(1,174,986 + 20×180)
  - Theoretical speedup vs BALANCE: 19.9x
Initial test acc across nodes: mean=0.4965 ± 0.0152
Round 001: test acc mean=0.5044 ± 0.0049 | min=0.4910 max=0.5137
         : test loss mean=0.8085 ± 0.0723
         : individual accs = ['0.510821', '0.513734', '0.503365', '0.507421', '0.505759', '0.505879', '0.500488', '0.504814', '0.507556', '0.506853', '0.500906', '0.507971', '0.501115', '0.491018', '0.504609', '0.501494', '0.500521', '0.500666', '0.511122', '0.501771']
         : correct/total = [(7270, 14232), (7313, 14235), (7181, 14266), (7214, 14217), (7201, 14238), (7271, 14373), (7180, 14346), (7236, 14334), (7255, 14294), (7285, 14373), (7185, 14344), (7265, 14302), (7193, 14354), (7052, 14362), (7226, 14320), (7219, 14395), (7202, 14389), (7138, 14257), (7284, 14251), (7225, 14399)]
         : compromised: 0.5042, honest: 0.5049
         : sketchguard stats = ['Node 0: acc_rate=1.000', 'Node 1: acc_rate=1.000', 'Node 2: acc_rate=1.000']...
Round 002: test acc mean=0.5410 ± 0.0158 | min=0.5126 max=0.5675
         : test loss mean=0.6878 ± 0.0040
         : individual accs = ['0.559935', '0.520899', '0.552362', '0.542942', '0.556188', '0.512558', '0.540848', '0.567532', '0.551210', '0.561609', '0.540644', '0.526779', '0.537760', '0.549575', '0.531145', '0.523098', '0.558343', '0.514133', '0.541787', '0.530731']
         : correct/total = [(7969, 14232), (7415, 14235), (7880, 14266), (7719, 14217), (7919, 14238), (7367, 14373), (7759, 14346), (8135, 14334), (7879, 14294), (8072, 14373), (7755, 14344), (7534, 14302), (7719, 14354), (7893, 14362), (7606, 14320), (7530, 14395), (8034, 14389), (7330, 14257), (7721, 14251), (7642, 14399)]
         : compromised: 0.5340, honest: 0.5574
         : sketchguard stats = ['Node 0: acc_rate=0.632', 'Node 1: acc_rate=0.658', 'Node 2: acc_rate=0.658']...
Round 003: test acc mean=0.5780 ± 0.0046 | min=0.5662 max=0.5872
         : test loss mean=0.6756 ± 0.0023
         : individual accs = ['0.577431', '0.574921', '0.579770', '0.573046', '0.579576', '0.583873', '0.579256', '0.583787', '0.570519', '0.587212', '0.566230', '0.576353', '0.576703', '0.583484', '0.578003', '0.576589', '0.578289', '0.579084', '0.576240', '0.578860']
         : correct/total = [(8218, 14232), (8184, 14235), (8271, 14266), (8147, 14217), (8252, 14238), (8392, 14373), (8310, 14346), (8368, 14334), (8155, 14294), (8440, 14373), (8122, 14344), (8243, 14302), (8278, 14354), (8380, 14362), (8277, 14320), (8300, 14395), (8321, 14389), (8256, 14257), (8212, 14251), (8335, 14399)]
         : compromised: 0.5776, honest: 0.5788
         : sketchguard stats = ['Node 0: acc_rate=0.509', 'Node 1: acc_rate=0.544', 'Node 2: acc_rate=0.544']...
Round 004: test acc mean=0.5960 ± 0.0022 | min=0.5920 max=0.6020
         : test loss mean=0.6644 ± 0.0012
         : individual accs = ['0.594435', '0.593818', '0.595752', '0.595695', '0.596643', '0.595144', '0.596752', '0.597042', '0.595844', '0.601962', '0.593001', '0.596979', '0.595095', '0.591979', '0.593994', '0.597499', '0.593995', '0.596900', '0.598344', '0.598583']
         : correct/total = [(8460, 14232), (8453, 14235), (8499, 14266), (8469, 14217), (8495, 14238), (8554, 14373), (8561, 14346), (8558, 14334), (8517, 14294), (8652, 14373), (8506, 14344), (8538, 14302), (8542, 14354), (8502, 14362), (8506, 14320), (8601, 14395), (8547, 14389), (8510, 14257), (8527, 14251), (8619, 14399)]
         : compromised: 0.5959, honest: 0.5962
         : sketchguard stats = ['Node 0: acc_rate=0.447', 'Node 1: acc_rate=0.487', 'Node 2: acc_rate=0.487']...
Round 005: test acc mean=0.6053 ± 0.0030 | min=0.6013 max=0.6131
         : test loss mean=0.6586 ± 0.0013
         : individual accs = ['0.602234', '0.608711', '0.604584', '0.613139', '0.604017', '0.601266', '0.607347', '0.609111', '0.603260', '0.609894', '0.603109', '0.603762', '0.605267', '0.603676', '0.603561', '0.604724', '0.607686', '0.605597', '0.602905', '0.602750']
         : correct/total = [(8571, 14232), (8665, 14235), (8625, 14266), (8717, 14217), (8600, 14238), (8642, 14373), (8713, 14346), (8731, 14334), (8623, 14294), (8766, 14373), (8651, 14344), (8635, 14302), (8688, 14354), (8670, 14362), (8643, 14320), (8705, 14395), (8744, 14389), (8634, 14257), (8592, 14251), (8679, 14399)]
         : compromised: 0.6050, honest: 0.6060
         : sketchguard stats = ['Node 0: acc_rate=0.411', 'Node 1: acc_rate=0.453', 'Node 2: acc_rate=0.453']...
Round 006: test acc mean=0.6122 ± 0.0035 | min=0.6055 max=0.6197
         : test loss mean=0.6543 ± 0.0021
         : individual accs = ['0.609612', '0.618897', '0.615029', '0.612928', '0.611111', '0.608989', '0.614666', '0.614483', '0.605499', '0.619704', '0.610987', '0.612572', '0.612930', '0.615652', '0.607053', '0.610281', '0.609841', '0.609876', '0.610764', '0.613445']
         : correct/total = [(8676, 14232), (8810, 14235), (8774, 14266), (8714, 14217), (8701, 14238), (8753, 14373), (8818, 14346), (8808, 14334), (8655, 14294), (8907, 14373), (8764, 14344), (8761, 14302), (8798, 14354), (8842, 14362), (8693, 14320), (8785, 14395), (8775, 14389), (8695, 14257), (8704, 14251), (8833, 14399)]
         : compromised: 0.6120, honest: 0.6126
         : sketchguard stats = ['Node 0: acc_rate=0.386', 'Node 1: acc_rate=0.430', 'Node 2: acc_rate=0.430']...
Round 007: test acc mean=0.6180 ± 0.0034 | min=0.6117 max=0.6252
         : test loss mean=0.6499 ± 0.0019
         : individual accs = ['0.616147', '0.614261', '0.616150', '0.622916', '0.617713', '0.615947', '0.623449', '0.616925', '0.611725', '0.625200', '0.616216', '0.619913', '0.618782', '0.621083', '0.614385', '0.620076', '0.618042', '0.618433', '0.613641', '0.618098']
         : correct/total = [(8769, 14232), (8744, 14235), (8790, 14266), (8856, 14217), (8795, 14238), (8853, 14373), (8944, 14346), (8843, 14334), (8744, 14294), (8986, 14373), (8839, 14344), (8866, 14302), (8882, 14354), (8920, 14362), (8798, 14320), (8926, 14395), (8893, 14389), (8817, 14257), (8745, 14251), (8900, 14399)]
         : compromised: 0.6178, honest: 0.6184
         : sketchguard stats = ['Node 0: acc_rate=0.368', 'Node 1: acc_rate=0.414', 'Node 2: acc_rate=0.414']...
Round 008: test acc mean=0.6216 ± 0.0033 | min=0.6153 max=0.6272
         : test loss mean=0.6467 ± 0.0023
         : individual accs = ['0.619379', '0.620934', '0.618814', '0.624323', '0.615325', '0.616294', '0.625819', '0.622297', '0.618092', '0.627148', '0.623745', '0.619773', '0.624774', '0.621083', '0.619344', '0.627162', '0.620404', '0.623764', '0.619816', '0.623863']
         : correct/total = [(8815, 14232), (8839, 14235), (8828, 14266), (8876, 14217), (8761, 14238), (8858, 14373), (8978, 14346), (8920, 14334), (8835, 14294), (9014, 14373), (8947, 14344), (8864, 14302), (8968, 14354), (8920, 14362), (8869, 14320), (9028, 14395), (8927, 14389), (8893, 14257), (8833, 14251), (8983, 14399)]
         : compromised: 0.6217, honest: 0.6214
         : sketchguard stats = ['Node 0: acc_rate=0.355', 'Node 1: acc_rate=0.401', 'Node 2: acc_rate=0.401']...
Round 009: test acc mean=0.6269 ± 0.0040 | min=0.6187 max=0.6337
         : test loss mean=0.6427 ± 0.0022
         : individual accs = ['0.625773', '0.632174', '0.626455', '0.630442', '0.625509', '0.621582', '0.632093', '0.630180', '0.622079', '0.633688', '0.624163', '0.629143', '0.629302', '0.626584', '0.618715', '0.631608', '0.623949', '0.627411', '0.622974', '0.624418']
         : correct/total = [(8906, 14232), (8999, 14235), (8937, 14266), (8963, 14217), (8906, 14238), (8934, 14373), (9068, 14346), (9033, 14334), (8892, 14294), (9108, 14373), (8953, 14344), (8998, 14302), (9033, 14354), (8999, 14362), (8860, 14320), (9092, 14395), (8978, 14389), (8945, 14257), (8878, 14251), (8991, 14399)]
         : compromised: 0.6268, honest: 0.6272
         : sketchguard stats = ['Node 0: acc_rate=0.345', 'Node 1: acc_rate=0.392', 'Node 2: acc_rate=0.392']...
Round 010: test acc mean=0.6317 ± 0.0036 | min=0.6261 max=0.6385
         : test loss mean=0.6383 ± 0.0023
         : individual accs = ['0.628583', '0.638286', '0.630310', '0.636632', '0.629372', '0.628748', '0.632093', '0.634645', '0.626067', '0.638489', '0.630229', '0.632849', '0.633830', '0.629021', '0.630726', '0.637374', '0.629717', '0.629656', '0.626412', '0.630460']
         : correct/total = [(8946, 14232), (9086, 14235), (8992, 14266), (9051, 14217), (8961, 14238), (9037, 14373), (9068, 14346), (9097, 14334), (8949, 14294), (9177, 14373), (9040, 14344), (9051, 14302), (9098, 14354), (9034, 14362), (9032, 14320), (9175, 14395), (9061, 14389), (8977, 14257), (8927, 14251), (9078, 14399)]
         : compromised: 0.6316, honest: 0.6318
         : sketchguard stats = ['Node 0: acc_rate=0.337', 'Node 1: acc_rate=0.384', 'Node 2: acc_rate=0.384']...

=== FINAL RESULTS ===
Dataset: sent140, Nodes: 20, Graph: fully, Aggregation: sketchguard
Attack: krum, 70.0% compromised
Final accuracy - Compromised: 0.6316, Honest: 0.6318
Overall test accuracy: mean=0.6317 ± 0.0036

=== Sketchguard SUMMARY ===
Node 0: acceptance=0.337
Node 1: acceptance=0.384
Node 2: acceptance=0.384
Node 3: acceptance=0.384
Node 4: acceptance=0.337
Node 5: acceptance=0.384
Node 6: acceptance=0.384
Node 7: acceptance=0.337
Node 8: acceptance=0.384
Node 9: acceptance=0.337
Node 10: acceptance=0.337
Node 11: acceptance=0.384
Node 12: acceptance=0.384
Node 13: acceptance=0.384
Node 14: acceptance=0.384
Node 15: acceptance=0.384
Node 16: acceptance=0.337
Node 17: acceptance=0.384
Node 18: acceptance=0.384
Node 19: acceptance=0.384

=== PARALLEL EXECUTION TIME (realistic for distributed system) ===
  COMMUNICATION (max across nodes):
    - Sketch transfer: 0.000s (0.0%)
    - Model fetch (accepted): 0.000s (0.0%)
  COMPUTATION (max across nodes):
    - Sketching: 0.374s (95.3%)
    - Filtering: 0.001s (0.3%)
    - Aggregation: 0.017s (4.4%)
  TOTALS:
    - Total computation: 0.392s (100.0%)
    - Total communication: 0.000s (0.0%)
    - Total parallel time: 0.392s

=== PER-NODE AVERAGE TIME ===
  - Sketching: 0.332s
  - Filtering: 0.001s
  - Aggregation: 0.014s
  - Sketch transfer: 0.000s
  - Model fetch: 0.000s
  - Total per node: 0.346s

=== TOTAL COMPUTATIONAL WORK (sum across all nodes) ===
  - Total sketching: 6.634s
  - Total filtering: 0.015s
  - Total aggregation: 0.276s
  - Total sketch transfer: 0.000s
  - Total model fetch: 0.000s
  - Grand total: 6.926s
  - Mean acceptance rate: 0.370

Sketchguard Algorithm Properties:
  - Original dimension: 1,174,986
  - Sketch size: 180
  - Compression ratio: 19.9x
  - Single repetition: No repetitions needed
  - Theoretical complexity: O(d + N×k)
  - Approach: Sketch filtering + state aggregation
