Device: cuda
Seed: 987654321
Loading 1 LEAF Sent140 train files...
LEAF Sent140 train: 254555 users, 908652 samples
Building vocabulary (max_size=10000)...
Vocabulary size: 10000
Loading 1 LEAF Sent140 test files...
LEAF Sent140 test: 254555 users, 286281 samples
Found 254555 train users, 254555 test users, 254555 common users
User sample counts range: 494 (max) to 1 (min)
Distributed ALL 254555 users across 20 clients
Users per client: 12727 (with 15 clients getting +1 user)
Train partition sizes: [44353, 44290, 44657, 44907, 44696, 45843, 45801, 45619, 45069, 45639, 45821, 45311, 45779, 46056, 45625, 45984, 46428, 44737, 45540, 46497]
Test partition sizes: [14232, 14235, 14266, 14217, 14238, 14373, 14346, 14334, 14294, 14373, 14344, 14302, 14354, 14362, 14320, 14395, 14389, 14257, 14251, 14399]
  Client 0: 44353 train samples, 2 unique classes
  Client 1: 44290 train samples, 2 unique classes
  Client 2: 44657 train samples, 2 unique classes
  Client 3: 44907 train samples, 2 unique classes
  Client 4: 44696 train samples, 2 unique classes
  Client 5: 45843 train samples, 2 unique classes
  Client 6: 45801 train samples, 2 unique classes
  Client 7: 45619 train samples, 2 unique classes
  Client 8: 45069 train samples, 2 unique classes
  Client 9: 45639 train samples, 2 unique classes
  Client 10: 45821 train samples, 2 unique classes
  Client 11: 45311 train samples, 2 unique classes
  Client 12: 45779 train samples, 2 unique classes
  Client 13: 46056 train samples, 2 unique classes
  Client 14: 45625 train samples, 2 unique classes
  Client 15: 45984 train samples, 2 unique classes
  Client 16: 46428 train samples, 2 unique classes
  Client 17: 44737 train samples, 2 unique classes
  Client 18: 45540 train samples, 2 unique classes
  Client 19: 46497 train samples, 2 unique classes
Will sample 4500 samples per client per epoch
Graph: erdos, nodes: 20, edges: 48
Degree statistics: avg=4.80, min=2, max=7
Attack: Compromised 4/20 nodes: [5, 12, 13, 17]
Attack type: directed_deviation, lambda: 1.0
Model variant: baseline
Model parameters: 1,174,986
Initial test acc across nodes: mean=0.4965 ± 0.0152
Round 001: test acc mean=0.5055 ± 0.0140 | min=0.4914 max=0.5541
         : test loss mean=2.1246 ± 2.8296
         : individual accs = ['0.512858', '0.499754', '0.515491', '0.508616', '0.522616', '0.496626', '0.497142', '0.504814', '0.554079', '0.505810', '0.493586', '0.509229', '0.497074', '0.491366', '0.497486', '0.499132', '0.492043', '0.492951', '0.509648', '0.508924']
         : correct/total = [(7299, 14232), (7114, 14235), (7354, 14266), (7231, 14217), (7441, 14238), (7138, 14373), (7132, 14346), (7236, 14334), (7920, 14294), (7270, 14373), (7080, 14344), (7283, 14302), (7135, 14354), (7057, 14362), (7124, 14320), (7185, 14395), (7080, 14389), (7028, 14257), (7263, 14251), (7328, 14399)]
         : compromised: 0.4945, honest: 0.5082
Round 002: test acc mean=0.5050 ± 0.0066 | min=0.4918 max=0.5218
         : test loss mean=1.5102 ± 1.1970
         : individual accs = ['0.503373', '0.513664', '0.507641', '0.508335', '0.494803', '0.504279', '0.521818', '0.501256', '0.512733', '0.507201', '0.507529', '0.506712', '0.502438', '0.491784', '0.506075', '0.496700', '0.497672', '0.506769', '0.506070', '0.504132']
         : correct/total = [(7164, 14232), (7312, 14235), (7242, 14266), (7227, 14217), (7045, 14238), (7248, 14373), (7486, 14346), (7185, 14334), (7329, 14294), (7290, 14373), (7280, 14344), (7247, 14302), (7212, 14354), (7063, 14362), (7247, 14320), (7150, 14395), (7161, 14389), (7225, 14257), (7212, 14251), (7259, 14399)]
         : compromised: 0.5013, honest: 0.5060
Round 003: test acc mean=0.5043 ± 0.0133 | min=0.4706 max=0.5272
         : test loss mean=0.7532 ± 0.1386
         : individual accs = ['0.489601', '0.516052', '0.489415', '0.488359', '0.516435', '0.512767', '0.502440', '0.470629', '0.495523', '0.523551', '0.501115', '0.512516', '0.498049', '0.508425', '0.499511', '0.515179', '0.527208', '0.507961', '0.511473', '0.499757']
         : correct/total = [(6968, 14232), (7346, 14235), (6982, 14266), (6943, 14217), (7353, 14238), (7370, 14373), (7208, 14346), (6746, 14334), (7083, 14294), (7525, 14373), (7188, 14344), (7330, 14302), (7149, 14354), (7302, 14362), (7153, 14320), (7416, 14395), (7586, 14389), (7242, 14257), (7289, 14251), (7196, 14399)]
         : compromised: 0.5068, honest: 0.5037
Round 004: test acc mean=0.5085 ± 0.0127 | min=0.4865 max=0.5352
         : test loss mean=0.8765 ± 0.3183
         : individual accs = ['0.535202', '0.514226', '0.486541', '0.534149', '0.501967', '0.512002', '0.523212', '0.499442', '0.491815', '0.496765', '0.499582', '0.517900', '0.515187', '0.513786', '0.513128', '0.500104', '0.499896', '0.506979', '0.510982', '0.496215']
         : correct/total = [(7617, 14232), (7320, 14235), (6941, 14266), (7594, 14217), (7147, 14238), (7359, 14373), (7506, 14346), (7159, 14334), (7030, 14294), (7140, 14373), (7166, 14344), (7407, 14302), (7395, 14354), (7379, 14362), (7348, 14320), (7199, 14395), (7193, 14389), (7228, 14257), (7282, 14251), (7145, 14399)]
         : compromised: 0.5120, honest: 0.5076
Round 005: test acc mean=0.5211 ± 0.0171 | min=0.4929 max=0.5483
         : test loss mean=0.7361 ± 0.1361
         : individual accs = ['0.527052', '0.542325', '0.492850', '0.498699', '0.522545', '0.517359', '0.548306', '0.531952', '0.501259', '0.543589', '0.501255', '0.529786', '0.506061', '0.508564', '0.513128', '0.503994', '0.537563', '0.514344', '0.544664', '0.536426']
         : correct/total = [(7501, 14232), (7720, 14235), (7031, 14266), (7090, 14217), (7440, 14238), (7436, 14373), (7866, 14346), (7625, 14334), (7165, 14294), (7813, 14373), (7190, 14344), (7577, 14302), (7264, 14354), (7304, 14362), (7348, 14320), (7255, 14395), (7735, 14389), (7333, 14257), (7762, 14251), (7724, 14399)]
         : compromised: 0.5116, honest: 0.5235
Round 006: test acc mean=0.5278 ± 0.0192 | min=0.4982 max=0.5666
         : test loss mean=0.8001 ± 0.2423
         : individual accs = ['0.551574', '0.548718', '0.514790', '0.548920', '0.539683', '0.499617', '0.548306', '0.517371', '0.538198', '0.536144', '0.535346', '0.507901', '0.528215', '0.509261', '0.501746', '0.514970', '0.498228', '0.518833', '0.531752', '0.566637']
         : correct/total = [(7850, 14232), (7811, 14235), (7344, 14266), (7804, 14217), (7684, 14238), (7181, 14373), (7866, 14346), (7416, 14334), (7693, 14294), (7706, 14373), (7679, 14344), (7264, 14302), (7582, 14354), (7314, 14362), (7185, 14320), (7413, 14395), (7169, 14389), (7397, 14257), (7578, 14251), (8159, 14399)]
         : compromised: 0.5140, honest: 0.5313
Round 007: test acc mean=0.5396 ± 0.0212 | min=0.5084 max=0.5761
         : test loss mean=0.7292 ± 0.1297
         : individual accs = ['0.558319', '0.552371', '0.567924', '0.508757', '0.540525', '0.518611', '0.557647', '0.542626', '0.576116', '0.560147', '0.509481', '0.527059', '0.529051', '0.508425', '0.515433', '0.530045', '0.526166', '0.539174', '0.552312', '0.572262']
         : correct/total = [(7946, 14232), (7863, 14235), (8102, 14266), (7233, 14217), (7696, 14238), (7454, 14373), (8000, 14346), (7778, 14334), (8235, 14294), (8051, 14373), (7308, 14344), (7538, 14302), (7594, 14354), (7302, 14362), (7381, 14320), (7630, 14395), (7571, 14389), (7687, 14257), (7871, 14251), (8240, 14399)]
         : compromised: 0.5238, honest: 0.5436
Round 008: test acc mean=0.5378 ± 0.0196 | min=0.5033 max=0.5741
         : test loss mean=0.7673 ± 0.1931
         : individual accs = ['0.559514', '0.517246', '0.530282', '0.550327', '0.549234', '0.514228', '0.548724', '0.526371', '0.574087', '0.566827', '0.551311', '0.503286', '0.547165', '0.508286', '0.519344', '0.539910', '0.522760', '0.524164', '0.547751', '0.554552']
         : correct/total = [(7963, 14232), (7363, 14235), (7565, 14266), (7824, 14217), (7820, 14238), (7391, 14373), (7872, 14346), (7545, 14334), (8206, 14294), (8147, 14373), (7908, 14344), (7198, 14302), (7854, 14354), (7300, 14362), (7437, 14320), (7772, 14395), (7522, 14389), (7473, 14257), (7806, 14251), (7985, 14399)]
         : compromised: 0.5235, honest: 0.5413
Round 009: test acc mean=0.5487 ± 0.0200 | min=0.5085 max=0.5844
         : test loss mean=0.7235 ± 0.1219
         : individual accs = ['0.559162', '0.560801', '0.553974', '0.531969', '0.558505', '0.530091', '0.558692', '0.546114', '0.584441', '0.560774', '0.567903', '0.530415', '0.535182', '0.508495', '0.512640', '0.549705', '0.538884', '0.536859', '0.568802', '0.580526']
         : correct/total = [(7958, 14232), (7983, 14235), (7903, 14266), (7563, 14217), (7952, 14238), (7619, 14373), (8015, 14346), (7828, 14334), (8354, 14294), (8060, 14373), (8146, 14344), (7586, 14302), (7682, 14354), (7303, 14362), (7341, 14320), (7913, 14395), (7754, 14389), (7654, 14257), (8106, 14251), (8359, 14399)]
         : compromised: 0.5277, honest: 0.5540
Round 010: test acc mean=0.5432 ± 0.0206 | min=0.5084 max=0.5800
         : test loss mean=0.7508 ± 0.1720
         : individual accs = ['0.568086', '0.541482', '0.533997', '0.561652', '0.556398', '0.514785', '0.559389', '0.532859', '0.566391', '0.562096', '0.558491', '0.512516', '0.528842', '0.508425', '0.520531', '0.541299', '0.534019', '0.523602', '0.560101', '0.579971']
         : correct/total = [(8085, 14232), (7708, 14235), (7618, 14266), (7985, 14217), (7922, 14238), (7399, 14373), (8025, 14346), (7638, 14334), (8096, 14294), (8079, 14373), (8011, 14344), (7330, 14302), (7591, 14354), (7302, 14362), (7454, 14320), (7792, 14395), (7684, 14389), (7465, 14257), (7982, 14251), (8351, 14399)]
         : compromised: 0.5189, honest: 0.5493

=== FINAL RESULTS ===
Dataset: sent140, Nodes: 20, Graph: erdos, Aggregation: d-fedavg
Attack: directed_deviation, 20.0% compromised
Final accuracy - Compromised: 0.5189, Honest: 0.5493
Overall test accuracy: mean=0.5432 ± 0.0206
