Device: cuda
Seed: 987654321
Loading 1 LEAF Sent140 train files...
LEAF Sent140 train: 254555 users, 908652 samples
Building vocabulary (max_size=10000)...
Vocabulary size: 10000
Loading 1 LEAF Sent140 test files...
LEAF Sent140 test: 254555 users, 286281 samples
Found 254555 train users, 254555 test users, 254555 common users
User sample counts range: 494 (max) to 1 (min)
Distributed ALL 254555 users across 20 clients
Users per client: 12727 (with 15 clients getting +1 user)
Train partition sizes: [44353, 44290, 44657, 44907, 44696, 45843, 45801, 45619, 45069, 45639, 45821, 45311, 45779, 46056, 45625, 45984, 46428, 44737, 45540, 46497]
Test partition sizes: [14232, 14235, 14266, 14217, 14238, 14373, 14346, 14334, 14294, 14373, 14344, 14302, 14354, 14362, 14320, 14395, 14389, 14257, 14251, 14399]
  Client 0: 44353 train samples, 2 unique classes
  Client 1: 44290 train samples, 2 unique classes
  Client 2: 44657 train samples, 2 unique classes
  Client 3: 44907 train samples, 2 unique classes
  Client 4: 44696 train samples, 2 unique classes
  Client 5: 45843 train samples, 2 unique classes
  Client 6: 45801 train samples, 2 unique classes
  Client 7: 45619 train samples, 2 unique classes
  Client 8: 45069 train samples, 2 unique classes
  Client 9: 45639 train samples, 2 unique classes
  Client 10: 45821 train samples, 2 unique classes
  Client 11: 45311 train samples, 2 unique classes
  Client 12: 45779 train samples, 2 unique classes
  Client 13: 46056 train samples, 2 unique classes
  Client 14: 45625 train samples, 2 unique classes
  Client 15: 45984 train samples, 2 unique classes
  Client 16: 46428 train samples, 2 unique classes
  Client 17: 44737 train samples, 2 unique classes
  Client 18: 45540 train samples, 2 unique classes
  Client 19: 46497 train samples, 2 unique classes
Will sample 4500 samples per client per epoch
Graph: ring, nodes: 20, edges: 20
Degree statistics: avg=2.00, min=2, max=2
Attack: Compromised 16/20 nodes: [1, 2, 3, 5, 6, 8, 9, 10, 11, 12, 13, 14, 15, 17, 18, 19]
Attack type: krum, lambda: 1.0
Model variant: baseline
Model parameters: 1,174,986
UBAR ALGORITHM (Two-Stage Byzantine-resilient)
  - Model dimension: 1,174,986 parameters
  - Rho parameter: 0.19999999999999996
  - Stage 1: Distance-based filtering (select 20% closest neighbors)
  - Stage 2: Performance-based selection (loss comparison)
  - Complexity: O(deg(i)×d + deg(i)×inference)
Initial test acc across nodes: mean=0.4953 ± 0.0174
Round 001: test acc mean=0.5273 ± 0.0360 | min=0.4910 max=0.5938
         : test loss mean=3.6845 ± 2.8370
         : individual accs = ['0.503865', '0.593818', '0.491028', '0.565942', '0.493819', '0.555138', '0.590687', '0.491838', '0.550091', '0.520072', '0.503346', '0.496015', '0.506200', '0.499095', '0.494902', '0.546440', '0.499062', '0.561408', '0.497649', '0.584902']
         : correct/total = [(7171, 14232), (8453, 14235), (7005, 14266), (8046, 14217), (7031, 14238), (7979, 14373), (8474, 14346), (7050, 14334), (7863, 14294), (7475, 14373), (7220, 14344), (7094, 14302), (7266, 14354), (7168, 14362), (7087, 14320), (7866, 14395), (7181, 14389), (8004, 14257), (7092, 14251), (8422, 14399)]
         : compromised: 0.5348, honest: 0.4971
         : ubar stats = ['Node 0: s1=0.500, s2=1.000', 'Node 1: s1=0.500, s2=1.000', 'Node 2: s1=0.500, s2=1.000']...
Round 002: test acc mean=0.5002 ± 0.0091 | min=0.4824 max=0.5186
         : test loss mean=3.1065 ± 2.1772
         : individual accs = ['0.494660', '0.514436', '0.487453', '0.515650', '0.482371', '0.504696', '0.500418', '0.490582', '0.502029', '0.493216', '0.498675', '0.504545', '0.502926', '0.507172', '0.494134', '0.501980', '0.503162', '0.492600', '0.518630', '0.495243']
         : correct/total = [(7040, 14232), (7323, 14235), (6954, 14266), (7331, 14217), (6868, 14238), (7254, 14373), (7179, 14346), (7032, 14334), (7176, 14294), (7089, 14373), (7153, 14344), (7216, 14302), (7219, 14354), (7284, 14362), (7076, 14320), (7226, 14395), (7240, 14389), (7023, 14257), (7391, 14251), (7131, 14399)]
         : compromised: 0.5021, honest: 0.4927
         : ubar stats = ['Node 0: s1=0.500, s2=1.000', 'Node 1: s1=0.500, s2=1.000', 'Node 2: s1=0.500, s2=1.000']...
Round 003: test acc mean=0.5053 ± 0.0078 | min=0.4945 max=0.5235
         : test loss mean=1.6626 ± 0.8822
         : individual accs = ['0.502600', '0.522655', '0.512968', '0.513259', '0.503582', '0.503235', '0.497351', '0.509209', '0.494543', '0.501009', '0.498885', '0.502797', '0.507106', '0.503969', '0.503003', '0.506565', '0.497602', '0.507891', '0.494492', '0.523509']
         : correct/total = [(7153, 14232), (7440, 14235), (7318, 14266), (7297, 14217), (7170, 14238), (7233, 14373), (7135, 14346), (7299, 14334), (7069, 14294), (7201, 14373), (7156, 14344), (7191, 14302), (7279, 14354), (7238, 14362), (7203, 14320), (7292, 14395), (7160, 14389), (7241, 14257), (7047, 14251), (7538, 14399)]
         : compromised: 0.5058, honest: 0.5032
         : ubar stats = ['Node 0: s1=0.500, s2=1.000', 'Node 1: s1=0.500, s2=1.000', 'Node 2: s1=0.500, s2=1.000']...
Round 004: test acc mean=0.5009 ± 0.0107 | min=0.4848 max=0.5295
         : test loss mean=1.7307 ± 0.9163
         : individual accs = ['0.491217', '0.502564', '0.490537', '0.505100', '0.502739', '0.494121', '0.527185', '0.491977', '0.529453', '0.501635', '0.498536', '0.496504', '0.504737', '0.509539', '0.497207', '0.497187', '0.494961', '0.497580', '0.500596', '0.484756']
         : correct/total = [(6991, 14232), (7154, 14235), (6998, 14266), (7181, 14217), (7158, 14238), (7102, 14373), (7563, 14346), (7052, 14334), (7568, 14294), (7210, 14373), (7151, 14344), (7101, 14302), (7245, 14354), (7318, 14362), (7120, 14320), (7157, 14395), (7122, 14389), (7094, 14257), (7134, 14251), (6980, 14399)]
         : compromised: 0.5023, honest: 0.4952
         : ubar stats = ['Node 0: s1=0.500, s2=1.000', 'Node 1: s1=0.500, s2=1.000', 'Node 2: s1=0.500, s2=1.000']...
Round 005: test acc mean=0.5077 ± 0.0120 | min=0.4926 max=0.5351
         : test loss mean=1.0112 ± 0.2732
         : individual accs = ['0.515880', '0.504391', '0.506028', '0.502567', '0.492625', '0.499965', '0.522445', '0.510534', '0.515741', '0.495095', '0.494562', '0.503076', '0.494287', '0.500766', '0.500209', '0.535116', '0.501772', '0.532931', '0.507052', '0.518717']
         : correct/total = [(7342, 14232), (7180, 14235), (7219, 14266), (7145, 14217), (7014, 14238), (7186, 14373), (7495, 14346), (7318, 14334), (7372, 14294), (7116, 14373), (7094, 14344), (7195, 14302), (7095, 14354), (7192, 14362), (7163, 14320), (7703, 14395), (7220, 14389), (7598, 14257), (7226, 14251), (7469, 14399)]
         : compromised: 0.5083, honest: 0.5052
         : ubar stats = ['Node 0: s1=0.500, s2=1.000', 'Node 1: s1=0.500, s2=1.000', 'Node 2: s1=0.500, s2=1.000']...
Round 006: test acc mean=0.4977 ± 0.0073 | min=0.4853 max=0.5120
         : test loss mean=0.8797 ± 0.1590
         : individual accs = ['0.503373', '0.504531', '0.500000', '0.511993', '0.487358', '0.504557', '0.498118', '0.492396', '0.507206', '0.494051', '0.486684', '0.485317', '0.507454', '0.501323', '0.497207', '0.497673', '0.496490', '0.496388', '0.489299', '0.493159']
         : correct/total = [(7164, 14232), (7182, 14235), (7133, 14266), (7279, 14217), (6939, 14238), (7252, 14373), (7146, 14346), (7058, 14334), (7250, 14294), (7101, 14373), (6981, 14344), (6941, 14302), (7284, 14354), (7200, 14362), (7120, 14320), (7164, 14395), (7144, 14389), (7077, 14257), (6973, 14251), (7101, 14399)]
         : compromised: 0.4984, honest: 0.4949
         : ubar stats = ['Node 0: s1=0.500, s2=1.000', 'Node 1: s1=0.500, s2=1.000', 'Node 2: s1=0.500, s2=1.000']...
Round 007: test acc mean=0.5146 ± 0.0125 | min=0.4918 max=0.5363
         : test loss mean=0.7309 ± 0.0292
         : individual accs = ['0.525295', '0.532912', '0.514790', '0.519519', '0.514679', '0.517985', '0.498397', '0.519046', '0.502658', '0.520907', '0.496166', '0.536289', '0.530026', '0.515945', '0.497277', '0.499896', '0.520398', '0.491758', '0.519542', '0.518647']
         : correct/total = [(7476, 14232), (7586, 14235), (7344, 14266), (7386, 14217), (7328, 14238), (7445, 14373), (7150, 14346), (7440, 14334), (7185, 14294), (7487, 14373), (7117, 14344), (7670, 14302), (7608, 14354), (7410, 14362), (7121, 14320), (7196, 14395), (7488, 14389), (7011, 14257), (7404, 14251), (7468, 14399)]
         : compromised: 0.5133, honest: 0.5199
         : ubar stats = ['Node 0: s1=0.500, s2=1.000', 'Node 1: s1=0.500, s2=1.000', 'Node 2: s1=0.500, s2=1.000']...
Round 008: test acc mean=0.4996 ± 0.0063 | min=0.4864 max=0.5149
         : test loss mean=0.7646 ± 0.0732
         : individual accs = ['0.504497', '0.494415', '0.495093', '0.509742', '0.495505', '0.496626', '0.514917', '0.496302', '0.501749', '0.500104', '0.496235', '0.491470', '0.497213', '0.502994', '0.501746', '0.500521', '0.486413', '0.507751', '0.496877', '0.500938']
         : correct/total = [(7180, 14232), (7038, 14235), (7063, 14266), (7247, 14217), (7055, 14238), (7138, 14373), (7387, 14346), (7114, 14334), (7172, 14294), (7188, 14373), (7118, 14344), (7029, 14302), (7137, 14354), (7224, 14362), (7185, 14320), (7205, 14395), (6999, 14389), (7239, 14257), (7081, 14251), (7213, 14399)]
         : compromised: 0.5005, honest: 0.4957
         : ubar stats = ['Node 0: s1=0.500, s2=1.000', 'Node 1: s1=0.500, s2=1.000', 'Node 2: s1=0.500, s2=1.000']...
Round 009: test acc mean=0.5252 ± 0.0152 | min=0.4881 max=0.5447
         : test loss mean=0.7001 ± 0.0059
         : individual accs = ['0.534992', '0.533825', '0.533717', '0.488078', '0.524090', '0.501218', '0.519866', '0.534603', '0.508395', '0.543867', '0.521263', '0.544749', '0.538874', '0.506267', '0.536453', '0.521292', '0.540899', '0.514063', '0.538980', '0.519203']
         : correct/total = [(7614, 14232), (7599, 14235), (7614, 14266), (6939, 14217), (7462, 14238), (7204, 14373), (7458, 14346), (7663, 14334), (7267, 14294), (7817, 14373), (7477, 14344), (7791, 14302), (7735, 14354), (7271, 14362), (7682, 14320), (7504, 14395), (7783, 14389), (7329, 14257), (7681, 14251), (7476, 14399)]
         : compromised: 0.5231, honest: 0.5336
         : ubar stats = ['Node 0: s1=0.500, s2=1.000', 'Node 1: s1=0.500, s2=1.000', 'Node 2: s1=0.500, s2=1.000']...
Round 010: test acc mean=0.5133 ± 0.0161 | min=0.4944 max=0.5474
         : test loss mean=0.7290 ± 0.0468
         : individual accs = ['0.506816', '0.534176', '0.501752', '0.537807', '0.507656', '0.533848', '0.547400', '0.504046', '0.545893', '0.502331', '0.499163', '0.499301', '0.504528', '0.509539', '0.506913', '0.503161', '0.505525', '0.515536', '0.505438', '0.494409']
         : correct/total = [(7213, 14232), (7604, 14235), (7158, 14266), (7646, 14217), (7228, 14238), (7673, 14373), (7853, 14346), (7225, 14334), (7803, 14294), (7220, 14373), (7160, 14344), (7141, 14302), (7242, 14354), (7318, 14362), (7259, 14320), (7243, 14395), (7274, 14389), (7350, 14257), (7203, 14251), (7119, 14399)]
         : compromised: 0.5151, honest: 0.5060
         : ubar stats = ['Node 0: s1=0.500, s2=1.000', 'Node 1: s1=0.500, s2=1.000', 'Node 2: s1=0.500, s2=1.000']...

=== FINAL RESULTS ===
Dataset: sent140, Nodes: 20, Graph: ring, Aggregation: ubar
Attack: krum, 80.0% compromised
Final accuracy - Compromised: 0.5151, Honest: 0.5060
Overall test accuracy: mean=0.5133 ± 0.0161

=== UBAR SUMMARY ===
Node 0: stage1=0.500, stage2=1.000, overall=0.500
Node 1: stage1=0.500, stage2=1.000, overall=0.500
Node 2: stage1=0.500, stage2=1.000, overall=0.500
Node 3: stage1=0.500, stage2=1.000, overall=0.500
Node 4: stage1=0.500, stage2=1.000, overall=0.500
Node 5: stage1=0.500, stage2=1.000, overall=0.500
Node 6: stage1=0.500, stage2=1.000, overall=0.500
Node 7: stage1=0.500, stage2=1.000, overall=0.500
Node 8: stage1=0.500, stage2=1.000, overall=0.500
Node 9: stage1=0.500, stage2=1.000, overall=0.500
Node 10: stage1=0.500, stage2=1.000, overall=0.500
Node 11: stage1=0.500, stage2=1.000, overall=0.500
Node 12: stage1=0.500, stage2=1.000, overall=0.500
Node 13: stage1=0.500, stage2=1.000, overall=0.500
Node 14: stage1=0.500, stage2=1.000, overall=0.500
Node 15: stage1=0.500, stage2=1.000, overall=0.500
Node 16: stage1=0.500, stage2=1.000, overall=0.500
Node 17: stage1=0.500, stage2=1.000, overall=0.500
Node 18: stage1=0.500, stage2=1.000, overall=0.500
Node 19: stage1=0.500, stage2=1.000, overall=0.500

=== PARALLEL EXECUTION TIME (realistic for distributed system) ===
  COMMUNICATION (max across nodes):
    - Full model transfer: 0.000s (0.1%)
  COMPUTATION (max across nodes):
    - Distance computation: 0.008s (38.3%)
    - Loss computation: 0.010s (47.0%)
    - Aggregation: 0.003s (14.7%)
  TOTALS:
    - Total computation: 0.022s (99.9%)
    - Total communication: 0.000s (0.1%)
    - Total parallel time: 0.022s

=== PER-NODE AVERAGE TIME ===
  - Distance computation: 0.008s
  - Loss computation: 0.008s
  - Aggregation: 0.003s
  - Model transfer: 0.000s
  - Total per node: 0.019s

=== TOTAL COMPUTATIONAL WORK (sum across all nodes) ===
  - Total distance computation: 0.155s
  - Total loss computation: 0.169s
  - Total aggregation: 0.063s
  - Total model transfer: 0.000s
  - Grand total: 0.387s
  - Mean Stage 1 acceptance rate: 0.500
  - Mean Stage 2 acceptance rate: 1.000
  - Overall acceptance rate: 0.500

UBAR Algorithm Properties:
  - Model dimension: 1,174,986
  - Rho parameter: 0.19999999999999996
  - Two-stage approach: Distance filtering + loss evaluation
  - Stage 1 selects: 20% of neighbors
  - Stage 2 uses: Training sample loss comparison
  - Theoretical complexity: O(deg(i)×d + deg(i)×inference)
  - Approach: UBAR paper implementation
