Device: cuda
Seed: 987654321
Loading 1 LEAF Sent140 train files...
LEAF Sent140 train: 254555 users, 908652 samples
Building vocabulary (max_size=10000)...
Vocabulary size: 10000
Loading 1 LEAF Sent140 test files...
LEAF Sent140 test: 254555 users, 286281 samples
Found 254555 train users, 254555 test users, 254555 common users
User sample counts range: 494 (max) to 1 (min)
Distributed ALL 254555 users across 20 clients
Users per client: 12727 (with 15 clients getting +1 user)
Train partition sizes: [44353, 44290, 44657, 44907, 44696, 45843, 45801, 45619, 45069, 45639, 45821, 45311, 45779, 46056, 45625, 45984, 46428, 44737, 45540, 46497]
Test partition sizes: [14232, 14235, 14266, 14217, 14238, 14373, 14346, 14334, 14294, 14373, 14344, 14302, 14354, 14362, 14320, 14395, 14389, 14257, 14251, 14399]
  Client 0: 44353 train samples, 2 unique classes
  Client 1: 44290 train samples, 2 unique classes
  Client 2: 44657 train samples, 2 unique classes
  Client 3: 44907 train samples, 2 unique classes
  Client 4: 44696 train samples, 2 unique classes
  Client 5: 45843 train samples, 2 unique classes
  Client 6: 45801 train samples, 2 unique classes
  Client 7: 45619 train samples, 2 unique classes
  Client 8: 45069 train samples, 2 unique classes
  Client 9: 45639 train samples, 2 unique classes
  Client 10: 45821 train samples, 2 unique classes
  Client 11: 45311 train samples, 2 unique classes
  Client 12: 45779 train samples, 2 unique classes
  Client 13: 46056 train samples, 2 unique classes
  Client 14: 45625 train samples, 2 unique classes
  Client 15: 45984 train samples, 2 unique classes
  Client 16: 46428 train samples, 2 unique classes
  Client 17: 44737 train samples, 2 unique classes
  Client 18: 45540 train samples, 2 unique classes
  Client 19: 46497 train samples, 2 unique classes
Will sample 4500 samples per client per epoch
Graph: erdos, nodes: 20, edges: 99
Degree statistics: avg=9.90, min=7, max=14
Attack: Compromised 2/20 nodes: [5, 13]
Attack type: directed_deviation, lambda: 1.0
Model variant: baseline
Model parameters: 1,174,986
UBAR ALGORITHM (Two-Stage Byzantine-resilient)
  - Model dimension: 1,174,986 parameters
  - Rho parameter: 0.9
  - Stage 1: Distance-based filtering (select 90% closest neighbors)
  - Stage 2: Performance-based selection (loss comparison)
  - Complexity: O(deg(i)×d + deg(i)×inference)
Initial test acc across nodes: mean=0.4965 ± 0.0152
Round 001: test acc mean=0.5428 ± 0.0201 | min=0.5013 max=0.5715
         : test loss mean=0.6913 ± 0.0008
         : individual accs = ['0.536748', '0.545978', '0.523833', '0.570725', '0.536522', '0.571488', '0.501324', '0.534882', '0.540367', '0.570862', '0.538901', '0.535939', '0.524941', '0.556886', '0.570112', '0.525252', '0.569602', '0.509995', '0.542067', '0.548927']
         : correct/total = [(7639, 14232), (7772, 14235), (7473, 14266), (8114, 14217), (7639, 14238), (8214, 14373), (7192, 14346), (7667, 14334), (7724, 14294), (8205, 14373), (7730, 14344), (7665, 14302), (7535, 14354), (7998, 14362), (8164, 14320), (7561, 14395), (8196, 14389), (7271, 14257), (7725, 14251), (7904, 14399)]
         : compromised: 0.5642, honest: 0.5404
         : ubar stats = ['Node 0: s1=0.833, s2=0.400', 'Node 1: s1=0.900, s2=0.111', 'Node 2: s1=0.875, s2=0.286']...
Round 002: test acc mean=0.5015 ± 0.0117 | min=0.4885 max=0.5306
         : test loss mean=0.6929 ± 0.0004
         : individual accs = ['0.489179', '0.489498', '0.491658', '0.492228', '0.494171', '0.493843', '0.497560', '0.510395', '0.488457', '0.502887', '0.499024', '0.529297', '0.513724', '0.508564', '0.495810', '0.498715', '0.499757', '0.503051', '0.501860', '0.530592']
         : correct/total = [(6962, 14232), (6968, 14235), (7014, 14266), (6998, 14217), (7036, 14238), (7098, 14373), (7138, 14346), (7316, 14334), (6982, 14294), (7228, 14373), (7158, 14344), (7570, 14302), (7374, 14354), (7304, 14362), (7100, 14320), (7179, 14395), (7191, 14389), (7172, 14257), (7152, 14251), (7640, 14399)]
         : compromised: 0.5012, honest: 0.5015
         : ubar stats = ['Node 0: s1=0.833, s2=0.400', 'Node 1: s1=0.900, s2=0.111', 'Node 2: s1=0.875, s2=0.357']...
Round 003: test acc mean=0.4949 ± 0.0056 | min=0.4861 max=0.5086
         : test loss mean=0.6937 ± 0.0003
         : individual accs = ['0.489109', '0.486266', '0.486051', '0.492228', '0.494100', '0.493843', '0.497560', '0.495186', '0.488457', '0.493008', '0.499024', '0.492029', '0.499512', '0.508564', '0.495810', '0.498367', '0.499757', '0.503051', '0.488738', '0.496354']
         : correct/total = [(6961, 14232), (6922, 14235), (6934, 14266), (6998, 14217), (7035, 14238), (7098, 14373), (7138, 14346), (7098, 14334), (6982, 14294), (7086, 14373), (7158, 14344), (7037, 14302), (7170, 14354), (7304, 14362), (7100, 14320), (7174, 14395), (7191, 14389), (7172, 14257), (6965, 14251), (7147, 14399)]
         : compromised: 0.5012, honest: 0.4941
         : ubar stats = ['Node 0: s1=0.833, s2=0.433', 'Node 1: s1=0.900, s2=0.333', 'Node 2: s1=0.875, s2=0.476']...
Round 004: test acc mean=0.4949 ± 0.0056 | min=0.4861 max=0.5086
         : test loss mean=0.6938 ± 0.0004
         : individual accs = ['0.489109', '0.486266', '0.486051', '0.492228', '0.494100', '0.493843', '0.497560', '0.495186', '0.488457', '0.493008', '0.499024', '0.492029', '0.499512', '0.508564', '0.495810', '0.498367', '0.499757', '0.503051', '0.488738', '0.496354']
         : correct/total = [(6961, 14232), (6922, 14235), (6934, 14266), (6998, 14217), (7035, 14238), (7098, 14373), (7138, 14346), (7098, 14334), (6982, 14294), (7086, 14373), (7158, 14344), (7037, 14302), (7170, 14354), (7304, 14362), (7100, 14320), (7174, 14395), (7191, 14389), (7172, 14257), (6965, 14251), (7147, 14399)]
         : compromised: 0.5012, honest: 0.4941
         : ubar stats = ['Node 0: s1=0.833, s2=0.400', 'Node 1: s1=0.900, s2=0.333', 'Node 2: s1=0.875, s2=0.607']...
Round 005: test acc mean=0.4949 ± 0.0056 | min=0.4861 max=0.5086
         : test loss mean=0.6941 ± 0.0004
         : individual accs = ['0.489109', '0.486266', '0.486051', '0.492228', '0.494100', '0.493843', '0.497560', '0.495186', '0.488457', '0.493008', '0.499024', '0.492029', '0.499512', '0.508564', '0.495810', '0.498367', '0.499757', '0.503051', '0.488738', '0.496354']
         : correct/total = [(6961, 14232), (6922, 14235), (6934, 14266), (6998, 14217), (7035, 14238), (7098, 14373), (7138, 14346), (7098, 14334), (6982, 14294), (7086, 14373), (7158, 14344), (7037, 14302), (7170, 14354), (7304, 14362), (7100, 14320), (7174, 14395), (7191, 14389), (7172, 14257), (6965, 14251), (7147, 14399)]
         : compromised: 0.5012, honest: 0.4941
         : ubar stats = ['Node 0: s1=0.833, s2=0.400', 'Node 1: s1=0.900, s2=0.378', 'Node 2: s1=0.875, s2=0.657']...
Round 006: test acc mean=0.4949 ± 0.0056 | min=0.4861 max=0.5086
         : test loss mean=0.6941 ± 0.0004
         : individual accs = ['0.489109', '0.486266', '0.486051', '0.492228', '0.494100', '0.493843', '0.497560', '0.495186', '0.488457', '0.493008', '0.499024', '0.492029', '0.499512', '0.508564', '0.495810', '0.498367', '0.499757', '0.503051', '0.488738', '0.496354']
         : correct/total = [(6961, 14232), (6922, 14235), (6934, 14266), (6998, 14217), (7035, 14238), (7098, 14373), (7138, 14346), (7098, 14334), (6982, 14294), (7086, 14373), (7158, 14344), (7037, 14302), (7170, 14354), (7304, 14362), (7100, 14320), (7174, 14395), (7191, 14389), (7172, 14257), (6965, 14251), (7147, 14399)]
         : compromised: 0.5012, honest: 0.4941
         : ubar stats = ['Node 0: s1=0.833, s2=0.433', 'Node 1: s1=0.900, s2=0.444', 'Node 2: s1=0.875, s2=0.643']...
Round 007: test acc mean=0.4949 ± 0.0056 | min=0.4861 max=0.5086
         : test loss mean=0.6941 ± 0.0003
         : individual accs = ['0.489109', '0.486266', '0.486051', '0.492228', '0.494100', '0.493843', '0.497560', '0.495186', '0.488457', '0.493008', '0.499024', '0.492029', '0.499512', '0.508564', '0.495810', '0.498367', '0.499757', '0.503051', '0.488738', '0.496354']
         : correct/total = [(6961, 14232), (6922, 14235), (6934, 14266), (6998, 14217), (7035, 14238), (7098, 14373), (7138, 14346), (7098, 14334), (6982, 14294), (7086, 14373), (7158, 14344), (7037, 14302), (7170, 14354), (7304, 14362), (7100, 14320), (7174, 14395), (7191, 14389), (7172, 14257), (6965, 14251), (7147, 14399)]
         : compromised: 0.5012, honest: 0.4941
         : ubar stats = ['Node 0: s1=0.833, s2=0.486', 'Node 1: s1=0.900, s2=0.429', 'Node 2: s1=0.875, s2=0.694']...
Round 008: test acc mean=0.4949 ± 0.0056 | min=0.4861 max=0.5086
         : test loss mean=0.6941 ± 0.0004
         : individual accs = ['0.489109', '0.486266', '0.486051', '0.492228', '0.494100', '0.493843', '0.497560', '0.495186', '0.488457', '0.493008', '0.499024', '0.492029', '0.499512', '0.508564', '0.495810', '0.498367', '0.499757', '0.503051', '0.488738', '0.496354']
         : correct/total = [(6961, 14232), (6922, 14235), (6934, 14266), (6998, 14217), (7035, 14238), (7098, 14373), (7138, 14346), (7098, 14334), (6982, 14294), (7086, 14373), (7158, 14344), (7037, 14302), (7170, 14354), (7304, 14362), (7100, 14320), (7174, 14395), (7191, 14389), (7172, 14257), (6965, 14251), (7147, 14399)]
         : compromised: 0.5012, honest: 0.4941
         : ubar stats = ['Node 0: s1=0.833, s2=0.463', 'Node 1: s1=0.900, s2=0.431', 'Node 2: s1=0.875, s2=0.643']...
Round 009: test acc mean=0.4949 ± 0.0056 | min=0.4861 max=0.5086
         : test loss mean=0.6942 ± 0.0005
         : individual accs = ['0.489109', '0.486266', '0.486051', '0.492228', '0.494100', '0.493843', '0.497560', '0.495186', '0.488457', '0.493008', '0.499024', '0.492029', '0.499512', '0.508564', '0.495810', '0.498367', '0.499757', '0.503051', '0.488738', '0.496354']
         : correct/total = [(6961, 14232), (6922, 14235), (6934, 14266), (6998, 14217), (7035, 14238), (7098, 14373), (7138, 14346), (7098, 14334), (6982, 14294), (7086, 14373), (7158, 14344), (7037, 14302), (7170, 14354), (7304, 14362), (7100, 14320), (7174, 14395), (7191, 14389), (7172, 14257), (6965, 14251), (7147, 14399)]
         : compromised: 0.5012, honest: 0.4941
         : ubar stats = ['Node 0: s1=0.833, s2=0.456', 'Node 1: s1=0.900, s2=0.407', 'Node 2: s1=0.875, s2=0.603']...
Round 010: test acc mean=0.4949 ± 0.0056 | min=0.4861 max=0.5086
         : test loss mean=0.6943 ± 0.0005
         : individual accs = ['0.489109', '0.486266', '0.486051', '0.492228', '0.494100', '0.493843', '0.497560', '0.495186', '0.488457', '0.493008', '0.499024', '0.492029', '0.499512', '0.508564', '0.495810', '0.498367', '0.499757', '0.503051', '0.488738', '0.496354']
         : correct/total = [(6961, 14232), (6922, 14235), (6934, 14266), (6998, 14217), (7035, 14238), (7098, 14373), (7138, 14346), (7098, 14334), (6982, 14294), (7086, 14373), (7158, 14344), (7037, 14302), (7170, 14354), (7304, 14362), (7100, 14320), (7174, 14395), (7191, 14389), (7172, 14257), (6965, 14251), (7147, 14399)]
         : compromised: 0.5012, honest: 0.4941
         : ubar stats = ['Node 0: s1=0.833, s2=0.460', 'Node 1: s1=0.900, s2=0.444', 'Node 2: s1=0.875, s2=0.643']...

=== FINAL RESULTS ===
Dataset: sent140, Nodes: 20, Graph: erdos, Aggregation: ubar
Attack: directed_deviation, 10.0% compromised
Final accuracy - Compromised: 0.5012, Honest: 0.4941
Overall test accuracy: mean=0.4949 ± 0.0056

=== UBAR SUMMARY ===
Node 0: stage1=0.833, stage2=0.460, overall=0.383
Node 1: stage1=0.900, stage2=0.444, overall=0.400
Node 2: stage1=0.875, stage2=0.643, overall=0.562
Node 3: stage1=0.857, stage2=0.600, overall=0.514
Node 4: stage1=0.889, stage2=0.388, overall=0.344
Node 5: stage1=0.900, stage2=0.667, overall=0.600
Node 6: stage1=0.833, stage2=0.220, overall=0.183
Node 7: stage1=0.818, stage2=0.411, overall=0.336
Node 8: stage1=0.857, stage2=0.500, overall=0.429
Node 9: stage1=0.818, stage2=0.367, overall=0.300
Node 10: stage1=0.875, stage2=0.500, overall=0.438
Node 11: stage1=0.833, stage2=0.180, overall=0.150
Node 12: stage1=0.833, stage2=0.370, overall=0.308
Node 13: stage1=0.889, stage2=0.850, overall=0.756
Node 14: stage1=0.857, stage2=0.850, overall=0.729
Node 15: stage1=0.889, stage2=0.300, overall=0.267
Node 16: stage1=0.857, stage2=0.550, overall=0.471
Node 17: stage1=0.875, stage2=0.657, overall=0.575
Node 18: stage1=0.833, stage2=0.730, overall=0.608
Node 19: stage1=0.900, stage2=0.411, overall=0.370

=== PARALLEL EXECUTION TIME (realistic for distributed system) ===
  COMMUNICATION (max across nodes):
    - Full model transfer: 0.000s (0.0%)
  COMPUTATION (max across nodes):
    - Distance computation: 0.053s (46.3%)
    - Loss computation: 0.045s (39.3%)
    - Aggregation: 0.016s (14.3%)
  TOTALS:
    - Total computation: 0.114s (100.0%)
    - Total communication: 0.000s (0.0%)
    - Total parallel time: 0.114s

=== PER-NODE AVERAGE TIME ===
  - Distance computation: 0.040s
  - Loss computation: 0.032s
  - Aggregation: 0.008s
  - Model transfer: 0.000s
  - Total per node: 0.081s

=== TOTAL COMPUTATIONAL WORK (sum across all nodes) ===
  - Total distance computation: 0.805s
  - Total loss computation: 0.648s
  - Total aggregation: 0.160s
  - Total model transfer: 0.000s
  - Grand total: 1.613s
  - Mean Stage 1 acceptance rate: 0.861
  - Mean Stage 2 acceptance rate: 0.505
  - Overall acceptance rate: 0.435

UBAR Algorithm Properties:
  - Model dimension: 1,174,986
  - Rho parameter: 0.9
  - Two-stage approach: Distance filtering + loss evaluation
  - Stage 1 selects: 90% of neighbors
  - Stage 2 uses: Training sample loss comparison
  - Theoretical complexity: O(deg(i)×d + deg(i)×inference)
  - Approach: UBAR paper implementation
