Device: cuda
Seed: 987654321
Loading 1 LEAF Sent140 train files...
LEAF Sent140 train: 254555 users, 908652 samples
Building vocabulary (max_size=10000)...
Vocabulary size: 10000
Loading 1 LEAF Sent140 test files...
LEAF Sent140 test: 254555 users, 286281 samples
Found 254555 train users, 254555 test users, 254555 common users
User sample counts range: 494 (max) to 1 (min)
Distributed ALL 254555 users across 20 clients
Users per client: 12727 (with 15 clients getting +1 user)
Train partition sizes: [44353, 44290, 44657, 44907, 44696, 45843, 45801, 45619, 45069, 45639, 45821, 45311, 45779, 46056, 45625, 45984, 46428, 44737, 45540, 46497]
Test partition sizes: [14232, 14235, 14266, 14217, 14238, 14373, 14346, 14334, 14294, 14373, 14344, 14302, 14354, 14362, 14320, 14395, 14389, 14257, 14251, 14399]
  Client 0: 44353 train samples, 2 unique classes
  Client 1: 44290 train samples, 2 unique classes
  Client 2: 44657 train samples, 2 unique classes
  Client 3: 44907 train samples, 2 unique classes
  Client 4: 44696 train samples, 2 unique classes
  Client 5: 45843 train samples, 2 unique classes
  Client 6: 45801 train samples, 2 unique classes
  Client 7: 45619 train samples, 2 unique classes
  Client 8: 45069 train samples, 2 unique classes
  Client 9: 45639 train samples, 2 unique classes
  Client 10: 45821 train samples, 2 unique classes
  Client 11: 45311 train samples, 2 unique classes
  Client 12: 45779 train samples, 2 unique classes
  Client 13: 46056 train samples, 2 unique classes
  Client 14: 45625 train samples, 2 unique classes
  Client 15: 45984 train samples, 2 unique classes
  Client 16: 46428 train samples, 2 unique classes
  Client 17: 44737 train samples, 2 unique classes
  Client 18: 45540 train samples, 2 unique classes
  Client 19: 46497 train samples, 2 unique classes
Will sample 4500 samples per client per epoch
Graph: ring, nodes: 20, edges: 20
Degree statistics: avg=2.00, min=2, max=2
Attack: Compromised 4/20 nodes: [5, 12, 13, 17]
Attack type: gaussian, lambda: 1.0
Model variant: baseline
Model parameters: 1,174,986
UBAR ALGORITHM (Two-Stage Byzantine-resilient)
  - Model dimension: 1,174,986 parameters
  - Rho parameter: 0.8
  - Stage 1: Distance-based filtering (select 80% closest neighbors)
  - Stage 2: Performance-based selection (loss comparison)
  - Complexity: O(deg(i)×d + deg(i)×inference)
Initial test acc across nodes: mean=0.4965 ± 0.0152
Round 001: test acc mean=0.5280 ± 0.0171 | min=0.4927 max=0.5627
         : test loss mean=0.6913 ± 0.0014
         : individual accs = ['0.548974', '0.523147', '0.537852', '0.515017', '0.517980', '0.517846', '0.562666', '0.553858', '0.511613', '0.526473', '0.522170', '0.533562', '0.505713', '0.549993', '0.524860', '0.525252', '0.513239', '0.492670', '0.533226', '0.543649']
         : correct/total = [(7813, 14232), (7447, 14235), (7673, 14266), (7322, 14217), (7375, 14238), (7443, 14373), (8072, 14346), (7939, 14334), (7313, 14294), (7567, 14373), (7490, 14344), (7631, 14302), (7259, 14354), (7899, 14362), (7516, 14320), (7561, 14395), (7385, 14389), (7024, 14257), (7599, 14251), (7828, 14399)]
         : compromised: 0.5166, honest: 0.5308
         : ubar stats = ['Node 0: s1=0.500, s2=1.000', 'Node 1: s1=0.500, s2=1.000', 'Node 2: s1=0.500, s2=1.000']...
Round 002: test acc mean=0.5736 ± 0.0205 | min=0.5437 max=0.6119
         : test loss mean=0.6830 ± 0.0066
         : individual accs = ['0.588392', '0.563470', '0.567784', '0.561089', '0.559770', '0.555208', '0.611948', '0.607158', '0.574857', '0.562583', '0.604085', '0.599916', '0.588756', '0.548531', '0.543715', '0.548524', '0.554660', '0.567090', '0.574907', '0.588860']
         : correct/total = [(8374, 14232), (8021, 14235), (8100, 14266), (7977, 14217), (7970, 14238), (7980, 14373), (8779, 14346), (8703, 14334), (8217, 14294), (8086, 14373), (8665, 14344), (8580, 14302), (8451, 14354), (7878, 14362), (7786, 14320), (7896, 14395), (7981, 14389), (8085, 14257), (8193, 14251), (8479, 14399)]
         : compromised: 0.5649, honest: 0.5757
         : ubar stats = ['Node 0: s1=0.500, s2=1.000', 'Node 1: s1=0.500, s2=1.000', 'Node 2: s1=0.500, s2=1.000']...
Round 003: test acc mean=0.5993 ± 0.0167 | min=0.5451 max=0.6170
         : test loss mean=0.6691 ± 0.0095
         : individual accs = ['0.615022', '0.604917', '0.545142', '0.601815', '0.599874', '0.595631', '0.615363', '0.616157', '0.605919', '0.592361', '0.609035', '0.610614', '0.615020', '0.588567', '0.589944', '0.592497', '0.577802', '0.585677', '0.606835', '0.616987']
         : correct/total = [(8753, 14232), (8611, 14235), (7777, 14266), (8556, 14217), (8541, 14238), (8561, 14373), (8828, 14346), (8832, 14334), (8661, 14294), (8514, 14373), (8736, 14344), (8733, 14302), (8828, 14354), (8453, 14362), (8448, 14320), (8529, 14395), (8314, 14389), (8350, 14257), (8648, 14251), (8884, 14399)]
         : compromised: 0.5962, honest: 0.6000
         : ubar stats = ['Node 0: s1=0.500, s2=1.000', 'Node 1: s1=0.500, s2=1.000', 'Node 2: s1=0.500, s2=1.000']...
Round 004: test acc mean=0.6185 ± 0.0096 | min=0.5920 max=0.6297
         : test loss mean=0.6543 ± 0.0098
         : individual accs = ['0.624930', '0.622550', '0.592037', '0.615742', '0.611322', '0.628957', '0.625052', '0.623692', '0.621939', '0.629722', '0.618865', '0.626626', '0.625610', '0.613494', '0.610056', '0.612643', '0.605185', '0.607561', '0.624728', '0.629488']
         : correct/total = [(8894, 14232), (8862, 14235), (8446, 14266), (8754, 14217), (8704, 14238), (9040, 14373), (8967, 14346), (8940, 14334), (8890, 14294), (9051, 14373), (8877, 14344), (8962, 14302), (8980, 14354), (8811, 14362), (8736, 14320), (8819, 14395), (8708, 14389), (8662, 14257), (8903, 14251), (9064, 14399)]
         : compromised: 0.6189, honest: 0.6184
         : ubar stats = ['Node 0: s1=0.500, s2=1.000', 'Node 1: s1=0.500, s2=1.000', 'Node 2: s1=0.500, s2=1.000']...
Round 005: test acc mean=0.6273 ± 0.0080 | min=0.6060 max=0.6389
         : test loss mean=0.6458 ± 0.0065
         : individual accs = ['0.628654', '0.629434', '0.605986', '0.631216', '0.630355', '0.638906', '0.633905', '0.632971', '0.627746', '0.632366', '0.627510', '0.635086', '0.636617', '0.621014', '0.616620', '0.621327', '0.619987', '0.615627', '0.630342', '0.630599']
         : correct/total = [(8947, 14232), (8960, 14235), (8645, 14266), (8974, 14217), (8975, 14238), (9183, 14373), (9094, 14346), (9073, 14334), (8973, 14294), (9089, 14373), (9001, 14344), (9083, 14302), (9138, 14354), (8919, 14362), (8830, 14320), (8944, 14395), (8921, 14389), (8777, 14257), (8983, 14251), (9080, 14399)]
         : compromised: 0.6280, honest: 0.6271
         : ubar stats = ['Node 0: s1=0.500, s2=1.000', 'Node 1: s1=0.500, s2=1.000', 'Node 2: s1=0.500, s2=1.000']...
Round 006: test acc mean=0.6329 ± 0.0069 | min=0.6168 max=0.6431
         : test loss mean=0.6401 ± 0.0051
         : individual accs = ['0.634486', '0.637092', '0.630240', '0.638461', '0.634850', '0.639185', '0.638506', '0.635552', '0.626347', '0.643081', '0.630089', '0.642358', '0.633482', '0.634174', '0.616830', '0.628274', '0.620543', '0.622431', '0.635183', '0.637058']
         : correct/total = [(9030, 14232), (9069, 14235), (8991, 14266), (9077, 14217), (9039, 14238), (9187, 14373), (9160, 14346), (9110, 14334), (8953, 14294), (9243, 14373), (9038, 14344), (9187, 14302), (9093, 14354), (9108, 14362), (8833, 14320), (9044, 14395), (8929, 14389), (8874, 14257), (9052, 14251), (9173, 14399)]
         : compromised: 0.6323, honest: 0.6331
         : ubar stats = ['Node 0: s1=0.500, s2=1.000', 'Node 1: s1=0.500, s2=1.000', 'Node 2: s1=0.500, s2=1.000']...
Round 007: test acc mean=0.6378 ± 0.0070 | min=0.6194 max=0.6464
         : test loss mean=0.6370 ± 0.0048
         : individual accs = ['0.644252', '0.637654', '0.619445', '0.646409', '0.644332', '0.640994', '0.638715', '0.633180', '0.630194', '0.646420', '0.633575', '0.637393', '0.643444', '0.638212', '0.634637', '0.638486', '0.629717', '0.629024', '0.644727', '0.645670']
         : correct/total = [(9169, 14232), (9077, 14235), (8837, 14266), (9190, 14217), (9174, 14238), (9213, 14373), (9163, 14346), (9076, 14334), (9008, 14294), (9291, 14373), (9088, 14344), (9116, 14302), (9236, 14354), (9166, 14362), (9088, 14320), (9191, 14395), (9061, 14389), (8968, 14257), (9188, 14251), (9297, 14399)]
         : compromised: 0.6379, honest: 0.6378
         : ubar stats = ['Node 0: s1=0.500, s2=1.000', 'Node 1: s1=0.500, s2=1.000', 'Node 2: s1=0.500, s2=1.000']...
Round 008: test acc mean=0.6424 ± 0.0037 | min=0.6368 max=0.6497
         : test loss mean=0.6328 ± 0.0030
         : individual accs = ['0.645587', '0.641588', '0.636759', '0.646058', '0.643559', '0.640924', '0.643176', '0.637715', '0.641248', '0.649690', '0.639222', '0.643966', '0.647833', '0.640370', '0.638617', '0.643487', '0.637292', '0.638283', '0.645569', '0.646850']
         : correct/total = [(9188, 14232), (9133, 14235), (9084, 14266), (9185, 14217), (9163, 14238), (9212, 14373), (9227, 14346), (9141, 14334), (9166, 14294), (9338, 14373), (9169, 14344), (9210, 14302), (9299, 14354), (9197, 14362), (9145, 14320), (9263, 14395), (9170, 14389), (9100, 14257), (9200, 14251), (9314, 14399)]
         : compromised: 0.6419, honest: 0.6425
         : ubar stats = ['Node 0: s1=0.500, s2=1.000', 'Node 1: s1=0.500, s2=1.000', 'Node 2: s1=0.500, s2=1.000']...
Round 009: test acc mean=0.6449 ± 0.0041 | min=0.6354 max=0.6520
         : test loss mean=0.6303 ± 0.0030
         : individual accs = ['0.648539', '0.648121', '0.642296', '0.641275', '0.644683', '0.644820', '0.645337', '0.645110', '0.645236', '0.650595', '0.644381', '0.649490', '0.650968', '0.642529', '0.638827', '0.642445', '0.640489', '0.635407', '0.645639', '0.651990']
         : correct/total = [(9230, 14232), (9226, 14235), (9163, 14266), (9117, 14217), (9179, 14238), (9268, 14373), (9258, 14346), (9247, 14334), (9223, 14294), (9351, 14373), (9243, 14344), (9289, 14302), (9344, 14354), (9228, 14362), (9148, 14320), (9248, 14395), (9216, 14389), (9059, 14257), (9201, 14251), (9388, 14399)]
         : compromised: 0.6434, honest: 0.6453
         : ubar stats = ['Node 0: s1=0.500, s2=1.000', 'Node 1: s1=0.500, s2=1.000', 'Node 2: s1=0.500, s2=1.000']...
Round 010: test acc mean=0.6475 ± 0.0046 | min=0.6394 max=0.6565
         : test loss mean=0.6283 ± 0.0030
         : individual accs = ['0.650717', '0.653390', '0.643909', '0.651052', '0.651988', '0.645933', '0.646801', '0.646296', '0.650063', '0.652613', '0.640407', '0.645224', '0.656472', '0.644339', '0.642528', '0.646336', '0.642366', '0.639405', '0.648516', '0.652129']
         : correct/total = [(9261, 14232), (9301, 14235), (9186, 14266), (9256, 14217), (9283, 14238), (9284, 14373), (9279, 14346), (9264, 14334), (9292, 14294), (9380, 14373), (9186, 14344), (9228, 14302), (9423, 14354), (9254, 14362), (9201, 14320), (9304, 14395), (9243, 14389), (9116, 14257), (9242, 14251), (9390, 14399)]
         : compromised: 0.6465, honest: 0.6478
         : ubar stats = ['Node 0: s1=0.500, s2=1.000', 'Node 1: s1=0.500, s2=1.000', 'Node 2: s1=0.500, s2=1.000']...

=== FINAL RESULTS ===
Dataset: sent140, Nodes: 20, Graph: ring, Aggregation: ubar
Attack: gaussian, 20.0% compromised
Final accuracy - Compromised: 0.6465, Honest: 0.6478
Overall test accuracy: mean=0.6475 ± 0.0046

=== UBAR SUMMARY ===
Node 0: stage1=0.500, stage2=1.000, overall=0.500
Node 1: stage1=0.500, stage2=1.000, overall=0.500
Node 2: stage1=0.500, stage2=1.000, overall=0.500
Node 3: stage1=0.500, stage2=1.000, overall=0.500
Node 4: stage1=0.500, stage2=1.000, overall=0.500
Node 5: stage1=0.500, stage2=1.000, overall=0.500
Node 6: stage1=0.500, stage2=1.000, overall=0.500
Node 7: stage1=0.500, stage2=1.000, overall=0.500
Node 8: stage1=0.500, stage2=1.000, overall=0.500
Node 9: stage1=0.500, stage2=1.000, overall=0.500
Node 10: stage1=0.500, stage2=1.000, overall=0.500
Node 11: stage1=0.500, stage2=1.000, overall=0.500
Node 12: stage1=0.500, stage2=1.000, overall=0.500
Node 13: stage1=0.500, stage2=1.000, overall=0.500
Node 14: stage1=0.500, stage2=1.000, overall=0.500
Node 15: stage1=0.500, stage2=1.000, overall=0.500
Node 16: stage1=0.500, stage2=1.000, overall=0.500
Node 17: stage1=0.500, stage2=1.000, overall=0.500
Node 18: stage1=0.500, stage2=1.000, overall=0.500
Node 19: stage1=0.500, stage2=1.000, overall=0.500

=== PARALLEL EXECUTION TIME (realistic for distributed system) ===
  COMMUNICATION (max across nodes):
    - Full model transfer: 0.000s (0.0%)
  COMPUTATION (max across nodes):
    - Distance computation: 0.026s (61.9%)
    - Loss computation: 0.013s (29.8%)
    - Aggregation: 0.003s (8.3%)
  TOTALS:
    - Total computation: 0.042s (100.0%)
    - Total communication: 0.000s (0.0%)
    - Total parallel time: 0.042s

=== PER-NODE AVERAGE TIME ===
  - Distance computation: 0.009s
  - Loss computation: 0.009s
  - Aggregation: 0.003s
  - Model transfer: 0.000s
  - Total per node: 0.021s

=== TOTAL COMPUTATIONAL WORK (sum across all nodes) ===
  - Total distance computation: 0.189s
  - Total loss computation: 0.176s
  - Total aggregation: 0.065s
  - Total model transfer: 0.000s
  - Grand total: 0.430s
  - Mean Stage 1 acceptance rate: 0.500
  - Mean Stage 2 acceptance rate: 1.000
  - Overall acceptance rate: 0.500

UBAR Algorithm Properties:
  - Model dimension: 1,174,986
  - Rho parameter: 0.8
  - Two-stage approach: Distance filtering + loss evaluation
  - Stage 1 selects: 80% of neighbors
  - Stage 2 uses: Training sample loss comparison
  - Theoretical complexity: O(deg(i)×d + deg(i)×inference)
  - Approach: UBAR paper implementation
