Device: cuda
Seed: 987654321
Loading 1 LEAF Sent140 train files...
LEAF Sent140 train: 254555 users, 908652 samples
Building vocabulary (max_size=10000)...
Vocabulary size: 10000
Loading 1 LEAF Sent140 test files...
LEAF Sent140 test: 254555 users, 286281 samples
Found 254555 train users, 254555 test users, 254555 common users
User sample counts range: 494 (max) to 1 (min)
Distributed ALL 254555 users across 20 clients
Users per client: 12727 (with 15 clients getting +1 user)
Train partition sizes: [44353, 44290, 44657, 44907, 44696, 45843, 45801, 45619, 45069, 45639, 45821, 45311, 45779, 46056, 45625, 45984, 46428, 44737, 45540, 46497]
Test partition sizes: [14232, 14235, 14266, 14217, 14238, 14373, 14346, 14334, 14294, 14373, 14344, 14302, 14354, 14362, 14320, 14395, 14389, 14257, 14251, 14399]
  Client 0: 44353 train samples, 2 unique classes
  Client 1: 44290 train samples, 2 unique classes
  Client 2: 44657 train samples, 2 unique classes
  Client 3: 44907 train samples, 2 unique classes
  Client 4: 44696 train samples, 2 unique classes
  Client 5: 45843 train samples, 2 unique classes
  Client 6: 45801 train samples, 2 unique classes
  Client 7: 45619 train samples, 2 unique classes
  Client 8: 45069 train samples, 2 unique classes
  Client 9: 45639 train samples, 2 unique classes
  Client 10: 45821 train samples, 2 unique classes
  Client 11: 45311 train samples, 2 unique classes
  Client 12: 45779 train samples, 2 unique classes
  Client 13: 46056 train samples, 2 unique classes
  Client 14: 45625 train samples, 2 unique classes
  Client 15: 45984 train samples, 2 unique classes
  Client 16: 46428 train samples, 2 unique classes
  Client 17: 44737 train samples, 2 unique classes
  Client 18: 45540 train samples, 2 unique classes
  Client 19: 46497 train samples, 2 unique classes
Will sample 4500 samples per client per epoch
Graph: fully, nodes: 20, edges: 190
Degree statistics: avg=19.00, min=19, max=19
Attack: Compromised 2/20 nodes: [5, 13]
Attack type: backdoor, lambda: 1.0
Backdoor target label: 1, trigger size: 3
Model variant: baseline
Model parameters: 1,174,986
BALANCE algorithm:
Balance Config: BALANCEConfig(gamma=2, kappa=1, alpha=0.5, min_neighbors=1)
  - Model dimension: 1,174,986 parameters
  - Complexity: O(N×d) = O(20×1,174,986)
Initial test acc across nodes: mean=0.4965 ± 0.0152
Backdoor attack: Created poisoned datasets for 2 compromised nodes
Round 001: test acc mean=0.5001 ± 0.0115 | min=0.4751 max=0.5144
         : test loss mean=4.4712 ± 11.3220
         : individual accs = ['0.479553', '0.513874', '0.491729', '0.511149', '0.494311', '0.494886', '0.514429', '0.493372', '0.509514', '0.506853', '0.475112', '0.488323', '0.510102', '0.508843', '0.508939', '0.499548', '0.499965', '0.511959', '0.485369', '0.503299']
         : correct/total = [(6825, 14232), (7315, 14235), (7015, 14266), (7267, 14217), (7038, 14238), (7113, 14373), (7380, 14346), (7072, 14334), (7283, 14294), (7285, 14373), (6815, 14344), (6984, 14302), (7322, 14354), (7308, 14362), (7288, 14320), (7191, 14395), (7194, 14389), (7299, 14257), (6917, 14251), (7247, 14399)]
         : compromised: 0.5019, honest: 0.4999
Round 002: test acc mean=0.5124 ± 0.0206 | min=0.4917 max=0.5779
         : test loss mean=129.3287 ± 386.0464
         : individual accs = ['0.496065', '0.514226', '0.514160', '0.553985', '0.506532', '0.500800', '0.577931', '0.495186', '0.513362', '0.506992', '0.499024', '0.491749', '0.512122', '0.496867', '0.500349', '0.509205', '0.500452', '0.533142', '0.505368', '0.521356']
         : correct/total = [(7060, 14232), (7320, 14235), (7335, 14266), (7876, 14217), (7212, 14238), (7198, 14373), (8291, 14346), (7098, 14334), (7338, 14294), (7287, 14373), (7158, 14344), (7033, 14302), (7351, 14354), (7136, 14362), (7165, 14320), (7330, 14395), (7201, 14389), (7601, 14257), (7202, 14251), (7507, 14399)]
         : compromised: 0.4988, honest: 0.5140
Round 003: test acc mean=0.4952 ± 0.0078 | min=0.4861 max=0.5217
         : test loss mean=6753.3297 ± 20329.4945
         : individual accs = ['0.489109', '0.486266', '0.486051', '0.492228', '0.494100', '0.486885', '0.497560', '0.495186', '0.488457', '0.493008', '0.499024', '0.492029', '0.499512', '0.521724', '0.495810', '0.498367', '0.499757', '0.503051', '0.488738', '0.496354']
         : correct/total = [(6961, 14232), (6922, 14235), (6934, 14266), (6998, 14217), (7035, 14238), (6998, 14373), (7138, 14346), (7098, 14334), (6982, 14294), (7086, 14373), (7158, 14344), (7037, 14302), (7170, 14354), (7493, 14362), (7100, 14320), (7174, 14395), (7191, 14389), (7172, 14257), (6965, 14251), (7147, 14399)]
         : compromised: 0.5043, honest: 0.4941
Round 004: test acc mean=0.4949 ± 0.0053 | min=0.4861 max=0.5065
         : test loss mean=719407.7565 ± 2171739.7842
         : individual accs = ['0.489109', '0.486266', '0.486051', '0.492228', '0.494100', '0.495930', '0.497560', '0.495186', '0.488457', '0.493008', '0.499024', '0.492029', '0.499512', '0.506475', '0.495810', '0.498367', '0.499757', '0.503051', '0.488738', '0.496354']
         : correct/total = [(6961, 14232), (6922, 14235), (6934, 14266), (6998, 14217), (7035, 14238), (7128, 14373), (7138, 14346), (7098, 14334), (6982, 14294), (7086, 14373), (7158, 14344), (7037, 14302), (7170, 14354), (7274, 14362), (7100, 14320), (7174, 14395), (7191, 14389), (7172, 14257), (6965, 14251), (7147, 14399)]
         : compromised: 0.5012, honest: 0.4941
Round 005: test acc mean=0.4954 ± 0.0059 | min=0.4861 max=0.5079
         : test loss mean=42684150.7918 ± 128386308.5367
         : individual accs = ['0.489109', '0.486266', '0.486051', '0.492228', '0.494100', '0.504557', '0.497560', '0.495186', '0.488457', '0.493008', '0.499024', '0.492029', '0.499512', '0.507868', '0.495810', '0.498367', '0.499757', '0.503051', '0.488738', '0.496354']
         : correct/total = [(6961, 14232), (6922, 14235), (6934, 14266), (6998, 14217), (7035, 14238), (7252, 14373), (7138, 14346), (7098, 14334), (6982, 14294), (7086, 14373), (7158, 14344), (7037, 14302), (7170, 14354), (7294, 14362), (7100, 14320), (7174, 14395), (7191, 14389), (7172, 14257), (6965, 14251), (7147, 14399)]
         : compromised: 0.5062, honest: 0.4941
Round 006: test acc mean=0.4954 ± 0.0060 | min=0.4861 max=0.5077
         : test loss mean=3257693435.5917 ± 9784206254.2825
         : individual accs = ['0.489109', '0.486266', '0.486051', '0.492228', '0.494100', '0.507688', '0.497560', '0.495186', '0.488457', '0.493008', '0.499024', '0.492029', '0.499512', '0.505779', '0.495810', '0.498367', '0.499757', '0.503051', '0.488738', '0.496354']
         : correct/total = [(6961, 14232), (6922, 14235), (6934, 14266), (6998, 14217), (7035, 14238), (7297, 14373), (7138, 14346), (7098, 14334), (6982, 14294), (7086, 14373), (7158, 14344), (7037, 14302), (7170, 14354), (7264, 14362), (7100, 14320), (7174, 14395), (7191, 14389), (7172, 14257), (6965, 14251), (7147, 14399)]
         : compromised: 0.5067, honest: 0.4941
Round 007: test acc mean=0.4949 ± 0.0052 | min=0.4861 max=0.5045
         : test loss mean=238867425566.3810 ± 721047096862.0756
         : individual accs = ['0.489109', '0.486266', '0.486051', '0.492228', '0.494100', '0.499339', '0.497560', '0.495186', '0.488457', '0.493008', '0.499024', '0.492029', '0.499512', '0.504456', '0.495810', '0.498367', '0.499757', '0.503051', '0.488738', '0.496354']
         : correct/total = [(6961, 14232), (6922, 14235), (6934, 14266), (6998, 14217), (7035, 14238), (7177, 14373), (7138, 14346), (7098, 14334), (6982, 14294), (7086, 14373), (7158, 14344), (7037, 14302), (7170, 14354), (7245, 14362), (7100, 14320), (7174, 14395), (7191, 14389), (7172, 14257), (6965, 14251), (7147, 14399)]
         : compromised: 0.5019, honest: 0.4941
Round 008: test acc mean=0.4955 ± 0.0062 | min=0.4861 max=0.5082
         : test loss mean=19703749403704.2461 ± 59495694034556.9844
         : individual accs = ['0.489109', '0.486266', '0.486051', '0.492228', '0.494100', '0.508245', '0.497560', '0.495186', '0.488457', '0.493008', '0.499024', '0.492029', '0.499512', '0.507381', '0.495810', '0.498367', '0.499757', '0.503051', '0.488738', '0.496354']
         : correct/total = [(6961, 14232), (6922, 14235), (6934, 14266), (6998, 14217), (7035, 14238), (7305, 14373), (7138, 14346), (7098, 14334), (6982, 14294), (7086, 14373), (7158, 14344), (7037, 14302), (7170, 14354), (7287, 14362), (7100, 14320), (7174, 14395), (7191, 14389), (7172, 14257), (6965, 14251), (7147, 14399)]
         : compromised: 0.5078, honest: 0.4941
Round 009: test acc mean=0.4937 ± 0.0050 | min=0.4857 max=0.5031
         : test loss mean=1687657700652046.5000 ± 5063248526574924.0000
         : individual accs = ['0.489109', '0.486266', '0.486051', '0.492228', '0.494100', '0.485702', '0.497560', '0.495186', '0.488457', '0.493008', '0.499024', '0.492029', '0.499512', '0.492898', '0.495810', '0.498367', '0.499757', '0.503051', '0.488738', '0.496354']
         : correct/total = [(6961, 14232), (6922, 14235), (6934, 14266), (6998, 14217), (7035, 14238), (6981, 14373), (7138, 14346), (7098, 14334), (6982, 14294), (7086, 14373), (7158, 14344), (7037, 14302), (7170, 14354), (7079, 14362), (7100, 14320), (7174, 14395), (7191, 14389), (7172, 14257), (6965, 14251), (7147, 14399)]
         : compromised: 0.4893, honest: 0.4941
Round 010: test acc mean=0.4941 ± 0.0049 | min=0.4861 max=0.5031
         : test loss mean=127215335098754896.0000 ± 384183901766963328.0000
         : individual accs = ['0.489109', '0.486266', '0.486051', '0.492228', '0.494100', '0.498226', '0.497560', '0.495186', '0.488457', '0.493008', '0.499024', '0.492029', '0.499512', '0.488511', '0.495810', '0.498367', '0.499757', '0.503051', '0.488738', '0.496354']
         : correct/total = [(6961, 14232), (6922, 14235), (6934, 14266), (6998, 14217), (7035, 14238), (7161, 14373), (7138, 14346), (7098, 14334), (6982, 14294), (7086, 14373), (7158, 14344), (7037, 14302), (7170, 14354), (7016, 14362), (7100, 14320), (7174, 14395), (7191, 14389), (7172, 14257), (6965, 14251), (7147, 14399)]
         : compromised: 0.4934, honest: 0.4941

=== FINAL RESULTS ===
Dataset: sent140, Nodes: 20, Graph: fully, Aggregation: balance
Attack: backdoor, 10.0% compromised
Final accuracy - Compromised: 0.4934, Honest: 0.4941
Overall test accuracy: mean=0.4941 ± 0.0049

=== BACKDOOR ATTACK SUCCESS RATE (ASR) ===
Target label: 1
Trigger size: 3x3
Overall ASR: 0.9978 ± 0.0075
Honest nodes ASR: 1.0000 ± 0.0000
Compromised nodes ASR: 0.9780 ± 0.0114
Note: Higher ASR indicates more successful backdoor attack

=== BALANCE SUMMARY ===
Node 0: acceptance=0.905
Node 1: acceptance=0.905
Node 2: acceptance=0.905
Node 3: acceptance=0.905
Node 4: acceptance=0.905
Node 5: acceptance=0.600
Node 6: acceptance=0.905
Node 7: acceptance=0.905
Node 8: acceptance=0.905
Node 9: acceptance=0.905
Node 10: acceptance=0.905
Node 11: acceptance=0.905
Node 12: acceptance=0.905
Node 13: acceptance=0.600
Node 14: acceptance=0.905
Node 15: acceptance=0.905
Node 16: acceptance=0.905
Node 17: acceptance=0.905
Node 18: acceptance=0.905
Node 19: acceptance=0.905

=== PARALLEL EXECUTION TIME (realistic for distributed system) ===
  COMMUNICATION (max across nodes):
    - Full model transfer: 0.000s (0.0%)
  COMPUTATION (max across nodes):
    - Filtering: 0.082s (80.5%)
    - Aggregation: 0.020s (19.5%)
  TOTALS:
    - Total computation: 0.102s (100.0%)
    - Total communication: 0.000s (0.0%)
    - Total parallel time: 0.102s

=== PER-NODE AVERAGE TIME ===
  - Filtering: 0.079s
  - Aggregation: 0.013s
  - Model transfer: 0.000s
  - Total per node: 0.092s

=== TOTAL COMPUTATIONAL WORK (sum across all nodes) ===
  - Total filtering: 1.584s
  - Total aggregation: 0.258s
  - Total model transfer: 0.000s
  - Grand total: 1.842s
  - Mean acceptance rate: 0.875

BALANCE Algorithm Properties:
  - Model dimension: 1,174,986
  - No compression: Full parameter comparison
  - Theoretical complexity: O(deg(i)×d)
  - Approach: Full parameter filtering + averaging
