Device: cuda
Seed: 987654321
Loading 1 LEAF Sent140 train files...
LEAF Sent140 train: 254555 users, 908652 samples
Building vocabulary (max_size=10000)...
Vocabulary size: 10000
Loading 1 LEAF Sent140 test files...
LEAF Sent140 test: 254555 users, 286281 samples
Found 254555 train users, 254555 test users, 254555 common users
User sample counts range: 494 (max) to 1 (min)
Distributed ALL 254555 users across 20 clients
Users per client: 12727 (with 15 clients getting +1 user)
Train partition sizes: [44353, 44290, 44657, 44907, 44696, 45843, 45801, 45619, 45069, 45639, 45821, 45311, 45779, 46056, 45625, 45984, 46428, 44737, 45540, 46497]
Test partition sizes: [14232, 14235, 14266, 14217, 14238, 14373, 14346, 14334, 14294, 14373, 14344, 14302, 14354, 14362, 14320, 14395, 14389, 14257, 14251, 14399]
  Client 0: 44353 train samples, 2 unique classes
  Client 1: 44290 train samples, 2 unique classes
  Client 2: 44657 train samples, 2 unique classes
  Client 3: 44907 train samples, 2 unique classes
  Client 4: 44696 train samples, 2 unique classes
  Client 5: 45843 train samples, 2 unique classes
  Client 6: 45801 train samples, 2 unique classes
  Client 7: 45619 train samples, 2 unique classes
  Client 8: 45069 train samples, 2 unique classes
  Client 9: 45639 train samples, 2 unique classes
  Client 10: 45821 train samples, 2 unique classes
  Client 11: 45311 train samples, 2 unique classes
  Client 12: 45779 train samples, 2 unique classes
  Client 13: 46056 train samples, 2 unique classes
  Client 14: 45625 train samples, 2 unique classes
  Client 15: 45984 train samples, 2 unique classes
  Client 16: 46428 train samples, 2 unique classes
  Client 17: 44737 train samples, 2 unique classes
  Client 18: 45540 train samples, 2 unique classes
  Client 19: 46497 train samples, 2 unique classes
Will sample 4500 samples per client per epoch
Graph: erdos, nodes: 20, edges: 126
Degree statistics: avg=12.60, min=8, max=16
Attack: Compromised 10/20 nodes: [1, 2, 5, 11, 12, 13, 14, 15, 17, 18]
Attack type: backdoor, lambda: 1.0
Backdoor target label: 1, trigger size: 3
Model variant: baseline
Model parameters: 1,174,986
Initial test acc across nodes: mean=0.4965 ± 0.0152
Backdoor attack: Created poisoned datasets for 10 compromised nodes
Round 001: test acc mean=0.5024 ± 0.0080 | min=0.4893 max=0.5190
         : test loss mean=5.9707 ± 3.7663
         : individual accs = ['0.513842', '0.494415', '0.513318', '0.507069', '0.507234', '0.500313', '0.490450', '0.499233', '0.489296', '0.498713', '0.518963', '0.503356', '0.504807', '0.503133', '0.505028', '0.504203', '0.497533', '0.491548', '0.511683', '0.494201']
         : correct/total = [(7313, 14232), (7038, 14235), (7323, 14266), (7209, 14217), (7222, 14238), (7191, 14373), (7036, 14346), (7156, 14334), (6994, 14294), (7168, 14373), (7444, 14344), (7199, 14302), (7246, 14354), (7226, 14362), (7232, 14320), (7258, 14395), (7159, 14389), (7008, 14257), (7292, 14251), (7116, 14399)]
         : compromised: 0.5032, honest: 0.5017
Round 002: test acc mean=0.5037 ± 0.0049 | min=0.4910 max=0.5106
         : test loss mean=9.2650 ± 1.8121
         : individual accs = ['0.510540', '0.506428', '0.510585', '0.510445', '0.508428', '0.500870', '0.505437', '0.502302', '0.507905', '0.506575', '0.499861', '0.505873', '0.502996', '0.491018', '0.501117', '0.500521', '0.498575', '0.498843', '0.506280', '0.500382']
         : correct/total = [(7266, 14232), (7209, 14235), (7284, 14266), (7257, 14217), (7239, 14238), (7199, 14373), (7251, 14346), (7200, 14334), (7260, 14294), (7281, 14373), (7170, 14344), (7235, 14302), (7220, 14354), (7052, 14362), (7176, 14320), (7205, 14395), (7174, 14389), (7112, 14257), (7215, 14251), (7205, 14399)]
         : compromised: 0.5025, honest: 0.5050
Round 003: test acc mean=0.5051 ± 0.0056 | min=0.4914 max=0.5139
         : test loss mean=7.1408 ± 1.0406
         : individual accs = ['0.510891', '0.513734', '0.513949', '0.507772', '0.505900', '0.506157', '0.502440', '0.504814', '0.511543', '0.506992', '0.500976', '0.507971', '0.500488', '0.491436', '0.504190', '0.501633', '0.500243', '0.496949', '0.511262', '0.503646']
         : correct/total = [(7271, 14232), (7313, 14235), (7332, 14266), (7219, 14217), (7203, 14238), (7275, 14373), (7208, 14346), (7236, 14334), (7312, 14294), (7287, 14373), (7186, 14344), (7265, 14302), (7184, 14354), (7058, 14362), (7220, 14320), (7221, 14395), (7198, 14389), (7085, 14257), (7286, 14251), (7252, 14399)]
         : compromised: 0.5048, honest: 0.5055
Round 004: test acc mean=0.4951 ± 0.0054 | min=0.4861 max=0.5079
         : test loss mean=11.8613 ± 5.0671
         : individual accs = ['0.490093', '0.488795', '0.486051', '0.488429', '0.494030', '0.493773', '0.497421', '0.495535', '0.488597', '0.495512', '0.501255', '0.492029', '0.499861', '0.507868', '0.496439', '0.498784', '0.500035', '0.500526', '0.489720', '0.496632']
         : correct/total = [(6975, 14232), (6958, 14235), (6934, 14266), (6944, 14217), (7034, 14238), (7097, 14373), (7136, 14346), (7103, 14334), (6984, 14294), (7122, 14373), (7190, 14344), (7037, 14302), (7175, 14354), (7294, 14362), (7109, 14320), (7180, 14395), (7195, 14389), (7136, 14257), (6979, 14251), (7151, 14399)]
         : compromised: 0.4954, honest: 0.4948
Round 005: test acc mean=0.4949 ± 0.0056 | min=0.4861 max=0.5086
         : test loss mean=17.7050 ± 1.8176
         : individual accs = ['0.489109', '0.486266', '0.486051', '0.492228', '0.494100', '0.493843', '0.497560', '0.495186', '0.488457', '0.493008', '0.499024', '0.492029', '0.499512', '0.508564', '0.495810', '0.498367', '0.499757', '0.503051', '0.488738', '0.496354']
         : correct/total = [(6961, 14232), (6922, 14235), (6934, 14266), (6998, 14217), (7035, 14238), (7098, 14373), (7138, 14346), (7098, 14334), (6982, 14294), (7086, 14373), (7158, 14344), (7037, 14302), (7170, 14354), (7304, 14362), (7100, 14320), (7174, 14395), (7191, 14389), (7172, 14257), (6965, 14251), (7147, 14399)]
         : compromised: 0.4952, honest: 0.4945
Round 006: test acc mean=0.5010 ± 0.0054 | min=0.4916 max=0.5128
         : test loss mean=3.6776 ± 1.7749
         : individual accs = ['0.499368', '0.498911', '0.512758', '0.491595', '0.496488', '0.506505', '0.500697', '0.504535', '0.508395', '0.492660', '0.498187', '0.508181', '0.502508', '0.493942', '0.503980', '0.501771', '0.496629', '0.503682', '0.496948', '0.502535']
         : correct/total = [(7107, 14232), (7102, 14235), (7315, 14266), (6989, 14217), (7069, 14238), (7280, 14373), (7183, 14346), (7232, 14334), (7267, 14294), (7081, 14373), (7146, 14344), (7268, 14302), (7213, 14354), (7094, 14362), (7217, 14320), (7223, 14395), (7146, 14389), (7181, 14257), (7082, 14251), (7236, 14399)]
         : compromised: 0.5029, honest: 0.4991
Round 007: test acc mean=0.5045 ± 0.0052 | min=0.4913 max=0.5138
         : test loss mean=2.7033 ± 0.2392
         : individual accs = ['0.510821', '0.513804', '0.502383', '0.506155', '0.505900', '0.505810', '0.502091', '0.504674', '0.511473', '0.506923', '0.501464', '0.508740', '0.500488', '0.491296', '0.504260', '0.501633', '0.500382', '0.497300', '0.511192', '0.503854']
         : correct/total = [(7270, 14232), (7314, 14235), (7167, 14266), (7196, 14217), (7203, 14238), (7270, 14373), (7203, 14346), (7234, 14334), (7311, 14294), (7286, 14373), (7193, 14344), (7276, 14302), (7184, 14354), (7056, 14362), (7221, 14320), (7221, 14395), (7200, 14389), (7090, 14257), (7285, 14251), (7255, 14399)]
         : compromised: 0.5037, honest: 0.5054
Round 008: test acc mean=0.5079 ± 0.0063 | min=0.4975 max=0.5231
         : test loss mean=1.5227 ± 0.3752
         : individual accs = ['0.513491', '0.511486', '0.497477', '0.508616', '0.517488', '0.505670', '0.505507', '0.508162', '0.505527', '0.498365', '0.507808', '0.500210', '0.505922', '0.523117', '0.506285', '0.512470', '0.508305', '0.499123', '0.509859', '0.513369']
         : correct/total = [(7308, 14232), (7281, 14235), (7097, 14266), (7231, 14217), (7368, 14238), (7268, 14373), (7252, 14346), (7284, 14334), (7226, 14294), (7163, 14373), (7284, 14344), (7154, 14302), (7262, 14354), (7513, 14362), (7250, 14320), (7377, 14395), (7314, 14389), (7116, 14257), (7266, 14251), (7392, 14399)]
         : compromised: 0.5072, honest: 0.5087
Round 009: test acc mean=0.5043 ± 0.0068 | min=0.4869 max=0.5165
         : test loss mean=1.1116 ± 0.5010
         : individual accs = ['0.512648', '0.516544', '0.486892', '0.506506', '0.509622', '0.501218', '0.512338', '0.498674', '0.510704', '0.507271', '0.500767', '0.500769', '0.501045', '0.499234', '0.502304', '0.499896', '0.509417', '0.496738', '0.510561', '0.501910']
         : correct/total = [(7296, 14232), (7353, 14235), (6946, 14266), (7201, 14217), (7256, 14238), (7204, 14373), (7350, 14346), (7148, 14334), (7300, 14294), (7291, 14373), (7183, 14344), (7162, 14302), (7192, 14354), (7170, 14362), (7193, 14320), (7196, 14395), (7330, 14389), (7082, 14257), (7276, 14251), (7227, 14399)]
         : compromised: 0.5015, honest: 0.5070
Round 010: test acc mean=0.4995 ± 0.0053 | min=0.4887 max=0.5091
         : test loss mean=1.5650 ± 0.1329
         : individual accs = ['0.503232', '0.506147', '0.504907', '0.509109', '0.496980', '0.501705', '0.498397', '0.494489', '0.503708', '0.498504', '0.493586', '0.499580', '0.492755', '0.488651', '0.502165', '0.494547', '0.498714', '0.494213', '0.506912', '0.501354']
         : correct/total = [(7162, 14232), (7205, 14235), (7203, 14266), (7238, 14217), (7076, 14238), (7211, 14373), (7150, 14346), (7088, 14334), (7200, 14294), (7165, 14373), (7080, 14344), (7145, 14302), (7073, 14354), (7018, 14362), (7191, 14320), (7119, 14395), (7176, 14389), (7046, 14257), (7224, 14251), (7219, 14399)]
         : compromised: 0.4992, honest: 0.4998

=== FINAL RESULTS ===
Dataset: sent140, Nodes: 20, Graph: erdos, Aggregation: d-fedavg
Attack: backdoor, 50.0% compromised
Final accuracy - Compromised: 0.4992, Honest: 0.4998
Overall test accuracy: mean=0.4995 ± 0.0053

=== BACKDOOR ATTACK SUCCESS RATE (ASR) ===
Target label: 1
Trigger size: 3x3
Overall ASR: 0.4294 ± 0.2682
Honest nodes ASR: 0.4157 ± 0.2769
Compromised nodes ASR: 0.4431 ± 0.2584
Note: Higher ASR indicates more successful backdoor attack
