Device: cuda
Seed: 987654321
Loading 1 LEAF Sent140 train files...
LEAF Sent140 train: 254555 users, 908652 samples
Building vocabulary (max_size=10000)...
Vocabulary size: 10000
Loading 1 LEAF Sent140 test files...
LEAF Sent140 test: 254555 users, 286281 samples
Found 254555 train users, 254555 test users, 254555 common users
User sample counts range: 494 (max) to 1 (min)
Distributed ALL 254555 users across 20 clients
Users per client: 12727 (with 15 clients getting +1 user)
Train partition sizes: [44353, 44290, 44657, 44907, 44696, 45843, 45801, 45619, 45069, 45639, 45821, 45311, 45779, 46056, 45625, 45984, 46428, 44737, 45540, 46497]
Test partition sizes: [14232, 14235, 14266, 14217, 14238, 14373, 14346, 14334, 14294, 14373, 14344, 14302, 14354, 14362, 14320, 14395, 14389, 14257, 14251, 14399]
  Client 0: 44353 train samples, 2 unique classes
  Client 1: 44290 train samples, 2 unique classes
  Client 2: 44657 train samples, 2 unique classes
  Client 3: 44907 train samples, 2 unique classes
  Client 4: 44696 train samples, 2 unique classes
  Client 5: 45843 train samples, 2 unique classes
  Client 6: 45801 train samples, 2 unique classes
  Client 7: 45619 train samples, 2 unique classes
  Client 8: 45069 train samples, 2 unique classes
  Client 9: 45639 train samples, 2 unique classes
  Client 10: 45821 train samples, 2 unique classes
  Client 11: 45311 train samples, 2 unique classes
  Client 12: 45779 train samples, 2 unique classes
  Client 13: 46056 train samples, 2 unique classes
  Client 14: 45625 train samples, 2 unique classes
  Client 15: 45984 train samples, 2 unique classes
  Client 16: 46428 train samples, 2 unique classes
  Client 17: 44737 train samples, 2 unique classes
  Client 18: 45540 train samples, 2 unique classes
  Client 19: 46497 train samples, 2 unique classes
Will sample 4500 samples per client per epoch
Graph: fully, nodes: 20, edges: 190
Degree statistics: avg=19.00, min=19, max=19
Attack: Compromised 4/20 nodes: [5, 12, 13, 17]
Attack type: directed_deviation, lambda: 1.0
Model variant: baseline
Model parameters: 1,174,986
Initial test acc across nodes: mean=0.4965 ± 0.0152
Round 001: test acc mean=0.4982 ± 0.0059 | min=0.4872 max=0.5089
         : test loss mean=23.2990 ± 8.4266
         : individual accs = ['0.508924', '0.488303', '0.487242', '0.493775', '0.495084', '0.499339', '0.499651', '0.503977', '0.495872', '0.501357', '0.500906', '0.494826', '0.499512', '0.497076', '0.491341', '0.502466', '0.490444', '0.504594', '0.503333', '0.506563']
         : correct/total = [(7243, 14232), (6951, 14235), (6951, 14266), (7020, 14217), (7049, 14238), (7177, 14373), (7168, 14346), (7224, 14334), (7088, 14294), (7206, 14373), (7185, 14344), (7077, 14302), (7170, 14354), (7139, 14362), (7036, 14320), (7233, 14395), (7057, 14389), (7194, 14257), (7173, 14251), (7294, 14399)]
         : compromised: 0.5001, honest: 0.4978
Round 002: test acc mean=0.4994 ± 0.0043 | min=0.4886 max=0.5076
         : test loss mean=15.3309 ± 0.2157
         : individual accs = ['0.504146', '0.501229', '0.502453', '0.507632', '0.501334', '0.502539', '0.497979', '0.495954', '0.500630', '0.503374', '0.500349', '0.504055', '0.491779', '0.488581', '0.496020', '0.497951', '0.497463', '0.495686', '0.500035', '0.498646']
         : correct/total = [(7175, 14232), (7135, 14235), (7168, 14266), (7217, 14217), (7138, 14238), (7223, 14373), (7144, 14346), (7109, 14334), (7156, 14294), (7235, 14373), (7177, 14344), (7209, 14302), (7059, 14354), (7017, 14362), (7103, 14320), (7168, 14395), (7158, 14389), (7067, 14257), (7126, 14251), (7180, 14399)]
         : compromised: 0.4946, honest: 0.5006
Round 003: test acc mean=0.5071 ± 0.0029 | min=0.5016 max=0.5136
         : test loss mean=2.5935 ± 0.0326
         : individual accs = ['0.511031', '0.508114', '0.506449', '0.505170', '0.510114', '0.507410', '0.510316', '0.507674', '0.502728', '0.501565', '0.506902', '0.503496', '0.508290', '0.513577', '0.509078', '0.506704', '0.506429', '0.507330', '0.504666', '0.504688']
         : correct/total = [(7273, 14232), (7233, 14235), (7225, 14266), (7182, 14217), (7263, 14238), (7293, 14373), (7321, 14346), (7277, 14334), (7186, 14294), (7209, 14373), (7271, 14344), (7201, 14302), (7296, 14354), (7376, 14362), (7290, 14320), (7294, 14395), (7287, 14389), (7233, 14257), (7192, 14251), (7267, 14399)]
         : compromised: 0.5092, honest: 0.5066
Round 004: test acc mean=0.5073 ± 0.0041 | min=0.4993 max=0.5127
         : test loss mean=1.7460 ± 0.0206
         : individual accs = ['0.506745', '0.504531', '0.501542', '0.511571', '0.510605', '0.511167', '0.507040', '0.510674', '0.512103', '0.505253', '0.509900', '0.504545', '0.508012', '0.512672', '0.500279', '0.509344', '0.511780', '0.499264', '0.502842', '0.505730']
         : correct/total = [(7212, 14232), (7182, 14235), (7155, 14266), (7273, 14217), (7270, 14238), (7347, 14373), (7274, 14346), (7320, 14334), (7320, 14294), (7262, 14373), (7314, 14344), (7216, 14302), (7292, 14354), (7363, 14362), (7164, 14320), (7332, 14395), (7364, 14389), (7118, 14257), (7166, 14251), (7282, 14399)]
         : compromised: 0.5078, honest: 0.5072
Round 005: test acc mean=0.5062 ± 0.0045 | min=0.4984 max=0.5130
         : test loss mean=1.4236 ± 0.0157
         : individual accs = ['0.510680', '0.502283', '0.510585', '0.511289', '0.512993', '0.505740', '0.503416', '0.502232', '0.511613', '0.512767', '0.506274', '0.508600', '0.501533', '0.498399', '0.503492', '0.502605', '0.507957', '0.502630', '0.509227', '0.499410']
         : correct/total = [(7268, 14232), (7150, 14235), (7284, 14266), (7269, 14217), (7304, 14238), (7269, 14373), (7222, 14346), (7199, 14334), (7313, 14294), (7370, 14373), (7262, 14344), (7274, 14302), (7199, 14354), (7158, 14362), (7210, 14320), (7235, 14395), (7309, 14389), (7166, 14257), (7257, 14251), (7191, 14399)]
         : compromised: 0.5021, honest: 0.5072
Round 006: test acc mean=0.5156 ± 0.0038 | min=0.5095 max=0.5229
         : test loss mean=1.0381 ± 0.0154
         : individual accs = ['0.520447', '0.511697', '0.514650', '0.515932', '0.522264', '0.511654', '0.516729', '0.517232', '0.521058', '0.522855', '0.517080', '0.516291', '0.511913', '0.510653', '0.512570', '0.516290', '0.514768', '0.512731', '0.515964', '0.509480']
         : correct/total = [(7407, 14232), (7284, 14235), (7342, 14266), (7335, 14217), (7436, 14238), (7354, 14373), (7413, 14346), (7414, 14334), (7448, 14294), (7515, 14373), (7417, 14344), (7384, 14302), (7348, 14354), (7334, 14362), (7340, 14320), (7432, 14395), (7407, 14389), (7310, 14257), (7353, 14251), (7336, 14399)]
         : compromised: 0.5117, honest: 0.5166
Round 007: test acc mean=0.5002 ± 0.0051 | min=0.4877 max=0.5100
         : test loss mean=0.9760 ± 0.0118
         : individual accs = ['0.508853', '0.503337', '0.510024', '0.501723', '0.500492', '0.500104', '0.500558', '0.497558', '0.504477', '0.502818', '0.500627', '0.505873', '0.494845', '0.487676', '0.499511', '0.495589', '0.494892', '0.495125', '0.501158', '0.497951']
         : correct/total = [(7242, 14232), (7165, 14235), (7276, 14266), (7133, 14217), (7126, 14238), (7188, 14373), (7181, 14346), (7132, 14334), (7211, 14294), (7227, 14373), (7181, 14344), (7235, 14302), (7103, 14354), (7004, 14362), (7153, 14320), (7134, 14395), (7121, 14389), (7059, 14257), (7142, 14251), (7170, 14399)]
         : compromised: 0.4944, honest: 0.5016
Round 008: test acc mean=0.5019 ± 0.0051 | min=0.4902 max=0.5110
         : test loss mean=0.9572 ± 0.0098
         : individual accs = ['0.509345', '0.506849', '0.511005', '0.506858', '0.500281', '0.503722', '0.502649', '0.501953', '0.507066', '0.504001', '0.499861', '0.505314', '0.494496', '0.490182', '0.502863', '0.497673', '0.495448', '0.496598', '0.501930', '0.498924']
         : correct/total = [(7249, 14232), (7215, 14235), (7290, 14266), (7206, 14217), (7123, 14238), (7240, 14373), (7211, 14346), (7195, 14334), (7248, 14294), (7244, 14373), (7170, 14344), (7227, 14302), (7098, 14354), (7040, 14362), (7201, 14320), (7164, 14395), (7129, 14389), (7080, 14257), (7153, 14251), (7184, 14399)]
         : compromised: 0.4962, honest: 0.5033
Round 009: test acc mean=0.5029 ± 0.0057 | min=0.4870 max=0.5114
         : test loss mean=0.8943 ± 0.0085
         : individual accs = ['0.510750', '0.509940', '0.511356', '0.507983', '0.501826', '0.503514', '0.501255', '0.501465', '0.508815', '0.503653', '0.500976', '0.506992', '0.498955', '0.487049', '0.505447', '0.500174', '0.497602', '0.497019', '0.504877', '0.497535']
         : correct/total = [(7269, 14232), (7259, 14235), (7295, 14266), (7222, 14217), (7145, 14238), (7237, 14373), (7191, 14346), (7188, 14334), (7273, 14294), (7239, 14373), (7186, 14344), (7251, 14302), (7162, 14354), (6995, 14362), (7238, 14320), (7200, 14395), (7160, 14389), (7086, 14257), (7195, 14251), (7164, 14399)]
         : compromised: 0.4966, honest: 0.5044
Round 010: test acc mean=0.5113 ± 0.0051 | min=0.5024 max=0.5228
         : test loss mean=0.7919 ± 0.0064
         : individual accs = ['0.510048', '0.508395', '0.508972', '0.511289', '0.513555', '0.508384', '0.503904', '0.514930', '0.511263', '0.504627', '0.507948', '0.506573', '0.518949', '0.522768', '0.510684', '0.513373', '0.515046', '0.516378', '0.502351', '0.516703']
         : correct/total = [(7259, 14232), (7237, 14235), (7261, 14266), (7269, 14217), (7312, 14238), (7307, 14373), (7229, 14346), (7381, 14334), (7308, 14294), (7253, 14373), (7286, 14344), (7245, 14302), (7449, 14354), (7508, 14362), (7313, 14320), (7390, 14395), (7411, 14389), (7362, 14257), (7159, 14251), (7440, 14399)]
         : compromised: 0.5166, honest: 0.5100

=== FINAL RESULTS ===
Dataset: sent140, Nodes: 20, Graph: fully, Aggregation: krum
Attack: directed_deviation, 20.0% compromised
Final accuracy - Compromised: 0.5166, Honest: 0.5100
Overall test accuracy: mean=0.5113 ± 0.0051
