Device: cuda
Seed: 987654321
Loading 1 LEAF Sent140 train files...
LEAF Sent140 train: 254555 users, 908652 samples
Building vocabulary (max_size=10000)...
Vocabulary size: 10000
Loading 1 LEAF Sent140 test files...
LEAF Sent140 test: 254555 users, 286281 samples
Found 254555 train users, 254555 test users, 254555 common users
User sample counts range: 494 (max) to 1 (min)
Distributed ALL 254555 users across 20 clients
Users per client: 12727 (with 15 clients getting +1 user)
Train partition sizes: [44353, 44290, 44657, 44907, 44696, 45843, 45801, 45619, 45069, 45639, 45821, 45311, 45779, 46056, 45625, 45984, 46428, 44737, 45540, 46497]
Test partition sizes: [14232, 14235, 14266, 14217, 14238, 14373, 14346, 14334, 14294, 14373, 14344, 14302, 14354, 14362, 14320, 14395, 14389, 14257, 14251, 14399]
  Client 0: 44353 train samples, 2 unique classes
  Client 1: 44290 train samples, 2 unique classes
  Client 2: 44657 train samples, 2 unique classes
  Client 3: 44907 train samples, 2 unique classes
  Client 4: 44696 train samples, 2 unique classes
  Client 5: 45843 train samples, 2 unique classes
  Client 6: 45801 train samples, 2 unique classes
  Client 7: 45619 train samples, 2 unique classes
  Client 8: 45069 train samples, 2 unique classes
  Client 9: 45639 train samples, 2 unique classes
  Client 10: 45821 train samples, 2 unique classes
  Client 11: 45311 train samples, 2 unique classes
  Client 12: 45779 train samples, 2 unique classes
  Client 13: 46056 train samples, 2 unique classes
  Client 14: 45625 train samples, 2 unique classes
  Client 15: 45984 train samples, 2 unique classes
  Client 16: 46428 train samples, 2 unique classes
  Client 17: 44737 train samples, 2 unique classes
  Client 18: 45540 train samples, 2 unique classes
  Client 19: 46497 train samples, 2 unique classes
Will sample 4500 samples per client per epoch
Graph: fully, nodes: 20, edges: 190
Degree statistics: avg=19.00, min=19, max=19
Attack: Compromised 16/20 nodes: [1, 2, 3, 5, 6, 8, 9, 10, 11, 12, 13, 14, 15, 17, 18, 19]
Attack type: gaussian, lambda: 1.0
Model variant: baseline
Model parameters: 1,174,986
Sketchguard Node 0:
  Model dim: 1,174,986 → Sketch size: 180
  Compression ratio: 6527.7x
  Using model parameters for aggregation, sketches for filtering
Sketchguard Node 1:
  Model dim: 1,174,986 → Sketch size: 180
  Compression ratio: 6527.7x
  Using model parameters for aggregation, sketches for filtering
Sketchguard Node 2:
  Model dim: 1,174,986 → Sketch size: 180
  Compression ratio: 6527.7x
  Using model parameters for aggregation, sketches for filtering
Sketchguard Node 3:
  Model dim: 1,174,986 → Sketch size: 180
  Compression ratio: 6527.7x
  Using model parameters for aggregation, sketches for filtering
Sketchguard Node 4:
  Model dim: 1,174,986 → Sketch size: 180
  Compression ratio: 6527.7x
  Using model parameters for aggregation, sketches for filtering
Sketchguard Node 5:
  Model dim: 1,174,986 → Sketch size: 180
  Compression ratio: 6527.7x
  Using model parameters for aggregation, sketches for filtering
Sketchguard Node 6:
  Model dim: 1,174,986 → Sketch size: 180
  Compression ratio: 6527.7x
  Using model parameters for aggregation, sketches for filtering
Sketchguard Node 7:
  Model dim: 1,174,986 → Sketch size: 180
  Compression ratio: 6527.7x
  Using model parameters for aggregation, sketches for filtering
Sketchguard Node 8:
  Model dim: 1,174,986 → Sketch size: 180
  Compression ratio: 6527.7x
  Using model parameters for aggregation, sketches for filtering
Sketchguard Node 9:
  Model dim: 1,174,986 → Sketch size: 180
  Compression ratio: 6527.7x
  Using model parameters for aggregation, sketches for filtering
Sketchguard Node 10:
  Model dim: 1,174,986 → Sketch size: 180
  Compression ratio: 6527.7x
  Using model parameters for aggregation, sketches for filtering
Sketchguard Node 11:
  Model dim: 1,174,986 → Sketch size: 180
  Compression ratio: 6527.7x
  Using model parameters for aggregation, sketches for filtering
Sketchguard Node 12:
  Model dim: 1,174,986 → Sketch size: 180
  Compression ratio: 6527.7x
  Using model parameters for aggregation, sketches for filtering
Sketchguard Node 13:
  Model dim: 1,174,986 → Sketch size: 180
  Compression ratio: 6527.7x
  Using model parameters for aggregation, sketches for filtering
Sketchguard Node 14:
  Model dim: 1,174,986 → Sketch size: 180
  Compression ratio: 6527.7x
  Using model parameters for aggregation, sketches for filtering
Sketchguard Node 15:
  Model dim: 1,174,986 → Sketch size: 180
  Compression ratio: 6527.7x
  Using model parameters for aggregation, sketches for filtering
Sketchguard Node 16:
  Model dim: 1,174,986 → Sketch size: 180
  Compression ratio: 6527.7x
  Using model parameters for aggregation, sketches for filtering
Sketchguard Node 17:
  Model dim: 1,174,986 → Sketch size: 180
  Compression ratio: 6527.7x
  Using model parameters for aggregation, sketches for filtering
Sketchguard Node 18:
  Model dim: 1,174,986 → Sketch size: 180
  Compression ratio: 6527.7x
  Using model parameters for aggregation, sketches for filtering
Sketchguard Node 19:
  Model dim: 1,174,986 → Sketch size: 180
  Compression ratio: 6527.7x
  Using model parameters for aggregation, sketches for filtering
Sketchguard ALGORITHM (Sketch-based Filtering + State Aggregation)
  - Model dimension: 1,174,986 parameters
  - Config: SketchguardConfig(gamma=2, kappa=1, alpha=0.5, min_neighbors=1, sketch_size=180, network_seed=987654321, attack_detection_window=5)
  - Sketch size: 180
  - Compression ratio: 6527.7x
  - Complexity: O(d + N×k) = O(1,174,986 + 20×180)
  - Theoretical speedup vs BALANCE: 19.9x
Initial test acc across nodes: mean=0.4953 ± 0.0174
Round 001: test acc mean=0.5647 ± 0.0362 | min=0.5085 max=0.6127
         : test loss mean=0.6899 ± 0.0009
         : individual accs = ['0.608137', '0.561925', '0.521800', '0.554477', '0.605422', '0.587003', '0.600655', '0.608693', '0.508535', '0.600849', '0.513037', '0.544190', '0.612652', '0.566704', '0.518645', '0.552275', '0.512058', '0.589886', '0.536804', '0.589277']
         : correct/total = [(8655, 14232), (7999, 14235), (7444, 14266), (7883, 14217), (8620, 14238), (8437, 14373), (8617, 14346), (8725, 14334), (7269, 14294), (8636, 14373), (7359, 14344), (7783, 14302), (8794, 14354), (8139, 14362), (7427, 14320), (7950, 14395), (7368, 14389), (8410, 14257), (7650, 14251), (8485, 14399)]
         : compromised: 0.5599, honest: 0.5836
         : sketchguard stats = ['Node 0: acc_rate=0.158', 'Node 1: acc_rate=0.211', 'Node 2: acc_rate=0.211']...
Round 002: test acc mean=0.5903 ± 0.0355 | min=0.4930 max=0.6319
         : test loss mean=0.6865 ± 0.0039
         : individual accs = ['0.619800', '0.551247', '0.602061', '0.625659', '0.622911', '0.560704', '0.613272', '0.631854', '0.611235', '0.628261', '0.608268', '0.619843', '0.536297', '0.586757', '0.493017', '0.575130', '0.601501', '0.564284', '0.590064', '0.563789']
         : correct/total = [(8821, 14232), (7847, 14235), (8589, 14266), (8895, 14217), (8869, 14238), (8059, 14373), (8798, 14346), (9057, 14334), (8737, 14294), (9030, 14373), (8725, 14344), (8865, 14302), (7698, 14354), (8427, 14362), (7060, 14320), (8279, 14395), (8655, 14389), (8045, 14257), (8409, 14251), (8118, 14399)]
         : compromised: 0.5831, honest: 0.6190
         : sketchguard stats = ['Node 0: acc_rate=0.158', 'Node 1: acc_rate=0.211', 'Node 2: acc_rate=0.211']...
Round 003: test acc mean=0.6271 ± 0.0094 | min=0.6034 max=0.6413
         : test loss mean=0.6647 ± 0.0074
         : individual accs = ['0.623173', '0.628943', '0.627786', '0.622635', '0.641312', '0.635080', '0.618779', '0.630040', '0.633343', '0.633132', '0.603388', '0.629982', '0.636617', '0.619621', '0.626047', '0.628829', '0.639725', '0.626710', '0.630833', '0.606500']
         : correct/total = [(8869, 14232), (8953, 14235), (8956, 14266), (8852, 14217), (9131, 14238), (9128, 14373), (8877, 14346), (9031, 14334), (9053, 14294), (9100, 14373), (8655, 14344), (9010, 14302), (9138, 14354), (8899, 14362), (8965, 14320), (9052, 14395), (9205, 14389), (8935, 14257), (8990, 14251), (8733, 14399)]
         : compromised: 0.6255, honest: 0.6336
         : sketchguard stats = ['Node 0: acc_rate=0.158', 'Node 1: acc_rate=0.211', 'Node 2: acc_rate=0.211']...
Round 004: test acc mean=0.6369 ± 0.0079 | min=0.6148 max=0.6493
         : test loss mean=0.6430 ± 0.0046
         : individual accs = ['0.630972', '0.624798', '0.639212', '0.636703', '0.638643', '0.649273', '0.636345', '0.640087', '0.635721', '0.641063', '0.638316', '0.630262', '0.643932', '0.627837', '0.614804', '0.637513', '0.645980', '0.641860', '0.637148', '0.647337']
         : correct/total = [(8980, 14232), (8894, 14235), (9119, 14266), (9052, 14217), (9093, 14238), (9332, 14373), (9129, 14346), (9175, 14334), (9087, 14294), (9214, 14373), (9156, 14344), (9014, 14302), (9243, 14354), (9017, 14362), (8804, 14320), (9177, 14395), (9295, 14389), (9151, 14257), (9080, 14251), (9321, 14399)]
         : compromised: 0.6364, honest: 0.6389
         : sketchguard stats = ['Node 0: acc_rate=0.158', 'Node 1: acc_rate=0.211', 'Node 2: acc_rate=0.211']...
Round 005: test acc mean=0.6444 ± 0.0045 | min=0.6354 max=0.6517
         : test loss mean=0.6331 ± 0.0033
         : individual accs = ['0.647485', '0.645592', '0.642507', '0.640149', '0.649459', '0.647742', '0.642688', '0.649993', '0.651742', '0.644055', '0.635388', '0.644385', '0.650550', '0.645105', '0.642249', '0.635985', '0.646675', '0.642562', '0.638131', '0.646087']
         : correct/total = [(9215, 14232), (9190, 14235), (9166, 14266), (9101, 14217), (9247, 14238), (9310, 14373), (9220, 14346), (9317, 14334), (9316, 14294), (9257, 14373), (9114, 14344), (9216, 14302), (9338, 14354), (9265, 14362), (9197, 14320), (9155, 14395), (9305, 14389), (9161, 14257), (9094, 14251), (9303, 14399)]
         : compromised: 0.6434, honest: 0.6484
         : sketchguard stats = ['Node 0: acc_rate=0.158', 'Node 1: acc_rate=0.211', 'Node 2: acc_rate=0.211']...
Round 006: test acc mean=0.6459 ± 0.0055 | min=0.6320 max=0.6546
         : test loss mean=0.6307 ± 0.0041
         : individual accs = ['0.631956', '0.651282', '0.644680', '0.644299', '0.646650', '0.654630', '0.645267', '0.645040', '0.647125', '0.646629', '0.650446', '0.645714', '0.653825', '0.644757', '0.646578', '0.635637', '0.639794', '0.648874', '0.641569', '0.652684']
         : correct/total = [(8994, 14232), (9271, 14235), (9197, 14266), (9160, 14217), (9207, 14238), (9409, 14373), (9257, 14346), (9246, 14334), (9250, 14294), (9294, 14373), (9330, 14344), (9235, 14302), (9385, 14354), (9260, 14362), (9259, 14320), (9150, 14395), (9206, 14389), (9251, 14257), (9143, 14251), (9398, 14399)]
         : compromised: 0.6471, honest: 0.6409
         : sketchguard stats = ['Node 0: acc_rate=0.158', 'Node 1: acc_rate=0.211', 'Node 2: acc_rate=0.211']...
Round 007: test acc mean=0.6530 ± 0.0055 | min=0.6419 max=0.6660
         : test loss mean=0.6243 ± 0.0040
         : individual accs = ['0.650857', '0.656059', '0.644329', '0.647324', '0.655289', '0.665971', '0.653004', '0.655365', '0.660417', '0.651360', '0.649888', '0.649560', '0.657656', '0.652764', '0.651676', '0.647030', '0.654458', '0.656590', '0.641920', '0.658032']
         : correct/total = [(9263, 14232), (9339, 14235), (9192, 14266), (9203, 14217), (9330, 14238), (9572, 14373), (9368, 14346), (9394, 14334), (9440, 14294), (9362, 14373), (9322, 14344), (9290, 14302), (9440, 14354), (9375, 14362), (9332, 14320), (9314, 14395), (9417, 14389), (9361, 14257), (9148, 14251), (9475, 14399)]
         : compromised: 0.6527, honest: 0.6540
         : sketchguard stats = ['Node 0: acc_rate=0.158', 'Node 1: acc_rate=0.211', 'Node 2: acc_rate=0.211']...
Round 008: test acc mean=0.6546 ± 0.0062 | min=0.6383 max=0.6660
         : test loss mean=0.6223 ± 0.0044
         : individual accs = ['0.654300', '0.656481', '0.647133', '0.652599', '0.656483', '0.666040', '0.656908', '0.658225', '0.659927', '0.651151', '0.655396', '0.654594', '0.660791', '0.650606', '0.643087', '0.654950', '0.658211', '0.656660', '0.638271', '0.660393']
         : correct/total = [(9312, 14232), (9345, 14235), (9232, 14266), (9278, 14217), (9347, 14238), (9573, 14373), (9424, 14346), (9435, 14334), (9433, 14294), (9359, 14373), (9401, 14344), (9362, 14302), (9485, 14354), (9344, 14362), (9209, 14320), (9428, 14395), (9471, 14389), (9362, 14257), (9096, 14251), (9509, 14399)]
         : compromised: 0.6541, honest: 0.6568
         : sketchguard stats = ['Node 0: acc_rate=0.158', 'Node 1: acc_rate=0.211', 'Node 2: acc_rate=0.211']...
Round 009: test acc mean=0.6558 ± 0.0071 | min=0.6389 max=0.6705
         : test loss mean=0.6209 ± 0.0048
         : individual accs = ['0.643198', '0.654233', '0.651058', '0.653302', '0.661118', '0.670493', '0.638854', '0.660876', '0.662306', '0.651151', '0.657836', '0.654034', '0.662603', '0.661677', '0.649511', '0.656478', '0.664257', '0.654415', '0.654551', '0.653101']
         : correct/total = [(9154, 14232), (9313, 14235), (9288, 14266), (9288, 14217), (9413, 14238), (9637, 14373), (9165, 14346), (9473, 14334), (9467, 14294), (9359, 14373), (9436, 14344), (9354, 14302), (9511, 14354), (9503, 14362), (9301, 14320), (9450, 14395), (9558, 14389), (9330, 14257), (9328, 14251), (9404, 14399)]
         : compromised: 0.6554, honest: 0.6574
         : sketchguard stats = ['Node 0: acc_rate=0.158', 'Node 1: acc_rate=0.211', 'Node 2: acc_rate=0.211']...
Round 010: test acc mean=0.6624 ± 0.0045 | min=0.6541 max=0.6712
         : test loss mean=0.6144 ± 0.0029
         : individual accs = ['0.662240', '0.668142', '0.658208', '0.654920', '0.668071', '0.671189', '0.662275', '0.665550', '0.665384', '0.661518', '0.662368', '0.654104', '0.666783', '0.660075', '0.657053', '0.657659', '0.665508', '0.661429', '0.660375', '0.666088']
         : correct/total = [(9425, 14232), (9511, 14235), (9390, 14266), (9311, 14217), (9512, 14238), (9647, 14373), (9501, 14346), (9540, 14334), (9511, 14294), (9508, 14373), (9501, 14344), (9355, 14302), (9571, 14354), (9480, 14362), (9409, 14320), (9467, 14395), (9576, 14389), (9430, 14257), (9411, 14251), (9591, 14399)]
         : compromised: 0.6617, honest: 0.6653
         : sketchguard stats = ['Node 0: acc_rate=0.158', 'Node 1: acc_rate=0.211', 'Node 2: acc_rate=0.211']...

=== FINAL RESULTS ===
Dataset: sent140, Nodes: 20, Graph: fully, Aggregation: sketchguard
Attack: gaussian, 80.0% compromised
Final accuracy - Compromised: 0.6617, Honest: 0.6653
Overall test accuracy: mean=0.6624 ± 0.0045

=== Sketchguard SUMMARY ===
Node 0: acceptance=0.158
Node 1: acceptance=0.211
Node 2: acceptance=0.211
Node 3: acceptance=0.211
Node 4: acceptance=0.158
Node 5: acceptance=0.211
Node 6: acceptance=0.211
Node 7: acceptance=0.158
Node 8: acceptance=0.211
Node 9: acceptance=0.211
Node 10: acceptance=0.211
Node 11: acceptance=0.211
Node 12: acceptance=0.211
Node 13: acceptance=0.211
Node 14: acceptance=0.211
Node 15: acceptance=0.211
Node 16: acceptance=0.158
Node 17: acceptance=0.211
Node 18: acceptance=0.211
Node 19: acceptance=0.211

=== PARALLEL EXECUTION TIME (realistic for distributed system) ===
  COMMUNICATION (max across nodes):
    - Sketch transfer: 0.000s (0.0%)
    - Model fetch (accepted): 0.000s (0.0%)
  COMPUTATION (max across nodes):
    - Sketching: 0.283s (95.4%)
    - Filtering: 0.001s (0.4%)
    - Aggregation: 0.012s (4.2%)
  TOTALS:
    - Total computation: 0.297s (100.0%)
    - Total communication: 0.000s (0.0%)
    - Total parallel time: 0.297s

=== PER-NODE AVERAGE TIME ===
  - Sketching: 0.250s
  - Filtering: 0.001s
  - Aggregation: 0.010s
  - Sketch transfer: 0.000s
  - Model fetch: 0.000s
  - Total per node: 0.261s

=== TOTAL COMPUTATIONAL WORK (sum across all nodes) ===
  - Total sketching: 5.010s
  - Total filtering: 0.017s
  - Total aggregation: 0.191s
  - Total sketch transfer: 0.000s
  - Total model fetch: 0.000s
  - Grand total: 5.218s
  - Mean acceptance rate: 0.200

Sketchguard Algorithm Properties:
  - Original dimension: 1,174,986
  - Sketch size: 180
  - Compression ratio: 19.9x
  - Single repetition: No repetitions needed
  - Theoretical complexity: O(d + N×k)
  - Approach: Sketch filtering + state aggregation
