Device: cuda
Seed: 987654321
Loading 1 LEAF Sent140 train files...
LEAF Sent140 train: 254555 users, 908652 samples
Building vocabulary (max_size=10000)...
Vocabulary size: 10000
Loading 1 LEAF Sent140 test files...
LEAF Sent140 test: 254555 users, 286281 samples
Found 254555 train users, 254555 test users, 254555 common users
User sample counts range: 494 (max) to 1 (min)
Distributed ALL 254555 users across 20 clients
Users per client: 12727 (with 15 clients getting +1 user)
Train partition sizes: [44353, 44290, 44657, 44907, 44696, 45843, 45801, 45619, 45069, 45639, 45821, 45311, 45779, 46056, 45625, 45984, 46428, 44737, 45540, 46497]
Test partition sizes: [14232, 14235, 14266, 14217, 14238, 14373, 14346, 14334, 14294, 14373, 14344, 14302, 14354, 14362, 14320, 14395, 14389, 14257, 14251, 14399]
  Client 0: 44353 train samples, 2 unique classes
  Client 1: 44290 train samples, 2 unique classes
  Client 2: 44657 train samples, 2 unique classes
  Client 3: 44907 train samples, 2 unique classes
  Client 4: 44696 train samples, 2 unique classes
  Client 5: 45843 train samples, 2 unique classes
  Client 6: 45801 train samples, 2 unique classes
  Client 7: 45619 train samples, 2 unique classes
  Client 8: 45069 train samples, 2 unique classes
  Client 9: 45639 train samples, 2 unique classes
  Client 10: 45821 train samples, 2 unique classes
  Client 11: 45311 train samples, 2 unique classes
  Client 12: 45779 train samples, 2 unique classes
  Client 13: 46056 train samples, 2 unique classes
  Client 14: 45625 train samples, 2 unique classes
  Client 15: 45984 train samples, 2 unique classes
  Client 16: 46428 train samples, 2 unique classes
  Client 17: 44737 train samples, 2 unique classes
  Client 18: 45540 train samples, 2 unique classes
  Client 19: 46497 train samples, 2 unique classes
Will sample 4500 samples per client per epoch
Graph: erdos, nodes: 20, edges: 99
Degree statistics: avg=9.90, min=7, max=14
Attack: Compromised 2/20 nodes: [5, 13]
Attack type: directed_deviation, lambda: 1.0
Model variant: baseline
Model parameters: 1,174,986
Initial test acc across nodes: mean=0.4953 ± 0.0174
Round 001: test acc mean=0.5044 ± 0.0107 | min=0.4888 max=0.5356
         : test loss mean=0.8006 ± 0.2500
         : individual accs = ['0.510259', '0.514366', '0.513038', '0.512555', '0.500281', '0.490851', '0.535620', '0.500070', '0.490486', '0.495234', '0.503974', '0.506922', '0.505155', '0.492619', '0.504818', '0.488781', '0.506220', '0.514765', '0.505859', '0.496632']
         : correct/total = [(7262, 14232), (7322, 14235), (7319, 14266), (7287, 14217), (7123, 14238), (7055, 14373), (7684, 14346), (7168, 14334), (7011, 14294), (7118, 14373), (7229, 14344), (7250, 14302), (7251, 14354), (7075, 14362), (7229, 14320), (7036, 14395), (7284, 14389), (7339, 14257), (7209, 14251), (7151, 14399)]
         : compromised: 0.4917, honest: 0.5058
Round 002: test acc mean=0.5008 ± 0.0108 | min=0.4700 max=0.5189
         : test loss mean=0.7618 ± 0.1396
         : individual accs = ['0.500211', '0.489287', '0.486962', '0.470001', '0.508428', '0.518890', '0.511850', '0.497698', '0.512663', '0.495234', '0.498397', '0.505943', '0.502996', '0.507102', '0.497626', '0.509135', '0.492529', '0.511538', '0.496176', '0.503716']
         : correct/total = [(7119, 14232), (6965, 14235), (6947, 14266), (6682, 14217), (7239, 14238), (7458, 14373), (7343, 14346), (7134, 14334), (7328, 14294), (7118, 14373), (7149, 14344), (7236, 14302), (7220, 14354), (7283, 14362), (7126, 14320), (7329, 14395), (7087, 14389), (7293, 14257), (7071, 14251), (7253, 14399)]
         : compromised: 0.5130, honest: 0.4995
Round 003: test acc mean=0.5072 ± 0.0267 | min=0.4830 max=0.5735
         : test loss mean=0.7058 ± 0.0416
         : individual accs = ['0.492622', '0.483035', '0.523342', '0.483998', '0.494522', '0.495860', '0.499651', '0.492745', '0.499370', '0.562930', '0.566578', '0.493987', '0.502856', '0.506824', '0.492598', '0.497742', '0.573494', '0.495336', '0.495614', '0.491770']
         : correct/total = [(7011, 14232), (6876, 14235), (7466, 14266), (6881, 14217), (7041, 14238), (7127, 14373), (7168, 14346), (7063, 14334), (7138, 14294), (8091, 14373), (8127, 14344), (7065, 14302), (7218, 14354), (7279, 14362), (7054, 14320), (7165, 14395), (8252, 14389), (7062, 14257), (7063, 14251), (7081, 14399)]
         : compromised: 0.5013, honest: 0.5079
Round 004: test acc mean=0.5347 ± 0.0364 | min=0.4870 max=0.5954
         : test loss mean=0.7343 ± 0.1166
         : individual accs = ['0.576588', '0.556235', '0.486962', '0.572906', '0.595379', '0.495860', '0.529555', '0.580368', '0.509445', '0.495234', '0.498397', '0.551601', '0.502856', '0.506824', '0.556285', '0.591247', '0.492529', '0.558883', '0.495614', '0.541635']
         : correct/total = [(8206, 14232), (7918, 14235), (6947, 14266), (8145, 14217), (8477, 14238), (7127, 14373), (7597, 14346), (8319, 14334), (7282, 14294), (7118, 14373), (7149, 14344), (7889, 14302), (7218, 14354), (7279, 14362), (7966, 14320), (8511, 14395), (7087, 14389), (7968, 14257), (7063, 14251), (7799, 14399)]
         : compromised: 0.5013, honest: 0.5384
Round 005: test acc mean=0.5182 ± 0.0463 | min=0.4830 max=0.6205
         : test loss mean=0.7441 ± 0.1350
         : individual accs = ['0.492622', '0.483035', '0.599607', '0.484912', '0.494522', '0.495860', '0.499791', '0.492745', '0.498321', '0.615112', '0.604434', '0.493847', '0.502856', '0.506824', '0.492598', '0.497742', '0.620474', '0.495336', '0.495614', '0.498090']
         : correct/total = [(7011, 14232), (6876, 14235), (8554, 14266), (6894, 14217), (7041, 14238), (7127, 14373), (7170, 14346), (7063, 14334), (7123, 14294), (8841, 14373), (8670, 14344), (7063, 14302), (7218, 14354), (7279, 14362), (7054, 14320), (7165, 14395), (8928, 14389), (7062, 14257), (7063, 14251), (7172, 14399)]
         : compromised: 0.5013, honest: 0.5201
Round 006: test acc mean=0.5652 ± 0.0399 | min=0.4961 max=0.6177
         : test loss mean=0.7585 ± 0.2045
         : individual accs = ['0.605467', '0.610256', '0.599678', '0.567841', '0.594185', '0.496069', '0.530880', '0.602763', '0.512383', '0.590760', '0.617680', '0.533911', '0.520691', '0.506824', '0.562500', '0.597152', '0.608659', '0.588483', '0.526910', '0.530315']
         : correct/total = [(8617, 14232), (8687, 14235), (8555, 14266), (8073, 14217), (8460, 14238), (7130, 14373), (7616, 14346), (8640, 14334), (7324, 14294), (8491, 14373), (8860, 14344), (7636, 14302), (7474, 14354), (7279, 14362), (8055, 14320), (8596, 14395), (8758, 14389), (8390, 14257), (7509, 14251), (7636, 14399)]
         : compromised: 0.5014, honest: 0.5723
Round 007: test acc mean=0.5384 ± 0.0522 | min=0.4849 max=0.6348
         : test loss mean=0.7239 ± 0.1427
         : individual accs = ['0.546093', '0.551458', '0.614117', '0.484912', '0.501264', '0.510749', '0.499791', '0.529092', '0.498601', '0.622000', '0.621654', '0.493777', '0.605754', '0.493733', '0.492598', '0.498159', '0.634790', '0.495406', '0.575118', '0.498090']
         : correct/total = [(7772, 14232), (7850, 14235), (8761, 14266), (6894, 14217), (7137, 14238), (7341, 14373), (7170, 14346), (7584, 14334), (7127, 14294), (8940, 14373), (8917, 14344), (7062, 14302), (8695, 14354), (7091, 14362), (7054, 14320), (7171, 14395), (9134, 14389), (7063, 14257), (8196, 14251), (7172, 14399)]
         : compromised: 0.5022, honest: 0.5424
Round 008: test acc mean=0.5775 ± 0.0397 | min=0.4932 max=0.6208
         : test loss mean=0.7853 ± 0.2992
         : individual accs = ['0.612634', '0.593467', '0.575845', '0.581135', '0.617783', '0.590482', '0.527882', '0.619297', '0.506646', '0.616921', '0.605340', '0.530695', '0.573359', '0.493176', '0.577025', '0.620771', '0.608729', '0.611209', '0.567188', '0.519758']
         : correct/total = [(8719, 14232), (8448, 14235), (8215, 14266), (8262, 14217), (8796, 14238), (8487, 14373), (7573, 14346), (8877, 14334), (7242, 14294), (8867, 14373), (8683, 14344), (7590, 14302), (8230, 14354), (7083, 14362), (8263, 14320), (8936, 14395), (8759, 14389), (8714, 14257), (8083, 14251), (7484, 14399)]
         : compromised: 0.5418, honest: 0.5814
Round 009: test acc mean=0.5221 ± 0.0541 | min=0.4830 max=0.6443
         : test loss mean=0.8183 ± 0.1833
         : individual accs = ['0.492622', '0.483035', '0.633114', '0.484912', '0.494522', '0.495860', '0.499791', '0.492745', '0.498181', '0.619982', '0.620050', '0.493847', '0.502856', '0.506824', '0.492598', '0.497742', '0.644312', '0.495336', '0.495614', '0.498090']
         : correct/total = [(7011, 14232), (6876, 14235), (9032, 14266), (6894, 14217), (7041, 14238), (7127, 14373), (7170, 14346), (7063, 14334), (7121, 14294), (8911, 14373), (8894, 14344), (7063, 14302), (7218, 14354), (7279, 14362), (7054, 14320), (7165, 14395), (9271, 14389), (7062, 14257), (7063, 14251), (7172, 14399)]
         : compromised: 0.5013, honest: 0.5244
Round 010: test acc mean=0.5654 ± 0.0536 | min=0.4964 max=0.6433
         : test loss mean=0.7583 ± 0.2275
         : individual accs = ['0.628302', '0.643344', '0.508342', '0.609622', '0.635974', '0.496417', '0.555765', '0.637645', '0.510144', '0.511236', '0.512758', '0.545169', '0.539014', '0.506824', '0.615293', '0.627718', '0.561679', '0.622782', '0.512525', '0.526912']
         : correct/total = [(8942, 14232), (9158, 14235), (7252, 14266), (8667, 14217), (9055, 14238), (7135, 14373), (7973, 14346), (9140, 14334), (7292, 14294), (7348, 14373), (7355, 14344), (7797, 14302), (7737, 14354), (7279, 14362), (8811, 14320), (9036, 14395), (8082, 14389), (8879, 14257), (7304, 14251), (7587, 14399)]
         : compromised: 0.5016, honest: 0.5725

=== FINAL RESULTS ===
Dataset: sent140, Nodes: 20, Graph: erdos, Aggregation: d-fedavg
Attack: directed_deviation, 10.0% compromised
Final accuracy - Compromised: 0.5016, Honest: 0.5725
Overall test accuracy: mean=0.5654 ± 0.0536
