Device: cuda
Seed: 987654321
Loading 1 LEAF Sent140 train files...
LEAF Sent140 train: 254555 users, 908652 samples
Building vocabulary (max_size=10000)...
Vocabulary size: 10000
Loading 1 LEAF Sent140 test files...
LEAF Sent140 test: 254555 users, 286281 samples
Found 254555 train users, 254555 test users, 254555 common users
User sample counts range: 494 (max) to 1 (min)
Distributed ALL 254555 users across 20 clients
Users per client: 12727 (with 15 clients getting +1 user)
Train partition sizes: [44353, 44290, 44657, 44907, 44696, 45843, 45801, 45619, 45069, 45639, 45821, 45311, 45779, 46056, 45625, 45984, 46428, 44737, 45540, 46497]
Test partition sizes: [14232, 14235, 14266, 14217, 14238, 14373, 14346, 14334, 14294, 14373, 14344, 14302, 14354, 14362, 14320, 14395, 14389, 14257, 14251, 14399]
  Client 0: 44353 train samples, 2 unique classes
  Client 1: 44290 train samples, 2 unique classes
  Client 2: 44657 train samples, 2 unique classes
  Client 3: 44907 train samples, 2 unique classes
  Client 4: 44696 train samples, 2 unique classes
  Client 5: 45843 train samples, 2 unique classes
  Client 6: 45801 train samples, 2 unique classes
  Client 7: 45619 train samples, 2 unique classes
  Client 8: 45069 train samples, 2 unique classes
  Client 9: 45639 train samples, 2 unique classes
  Client 10: 45821 train samples, 2 unique classes
  Client 11: 45311 train samples, 2 unique classes
  Client 12: 45779 train samples, 2 unique classes
  Client 13: 46056 train samples, 2 unique classes
  Client 14: 45625 train samples, 2 unique classes
  Client 15: 45984 train samples, 2 unique classes
  Client 16: 46428 train samples, 2 unique classes
  Client 17: 44737 train samples, 2 unique classes
  Client 18: 45540 train samples, 2 unique classes
  Client 19: 46497 train samples, 2 unique classes
Will sample 4500 samples per client per epoch
Graph: fully, nodes: 20, edges: 190
Degree statistics: avg=19.00, min=19, max=19
Attack: Compromised 8/20 nodes: [1, 5, 11, 12, 13, 14, 17, 18]
Attack type: directed_deviation, lambda: 1.0
Model variant: baseline
Model parameters: 1,174,986
Sketchguard Node 0:
  Model dim: 1,174,986 → Sketch size: 180
  Compression ratio: 6527.7x
  Using model parameters for aggregation, sketches for filtering
Sketchguard Node 1:
  Model dim: 1,174,986 → Sketch size: 180
  Compression ratio: 6527.7x
  Using model parameters for aggregation, sketches for filtering
Sketchguard Node 2:
  Model dim: 1,174,986 → Sketch size: 180
  Compression ratio: 6527.7x
  Using model parameters for aggregation, sketches for filtering
Sketchguard Node 3:
  Model dim: 1,174,986 → Sketch size: 180
  Compression ratio: 6527.7x
  Using model parameters for aggregation, sketches for filtering
Sketchguard Node 4:
  Model dim: 1,174,986 → Sketch size: 180
  Compression ratio: 6527.7x
  Using model parameters for aggregation, sketches for filtering
Sketchguard Node 5:
  Model dim: 1,174,986 → Sketch size: 180
  Compression ratio: 6527.7x
  Using model parameters for aggregation, sketches for filtering
Sketchguard Node 6:
  Model dim: 1,174,986 → Sketch size: 180
  Compression ratio: 6527.7x
  Using model parameters for aggregation, sketches for filtering
Sketchguard Node 7:
  Model dim: 1,174,986 → Sketch size: 180
  Compression ratio: 6527.7x
  Using model parameters for aggregation, sketches for filtering
Sketchguard Node 8:
  Model dim: 1,174,986 → Sketch size: 180
  Compression ratio: 6527.7x
  Using model parameters for aggregation, sketches for filtering
Sketchguard Node 9:
  Model dim: 1,174,986 → Sketch size: 180
  Compression ratio: 6527.7x
  Using model parameters for aggregation, sketches for filtering
Sketchguard Node 10:
  Model dim: 1,174,986 → Sketch size: 180
  Compression ratio: 6527.7x
  Using model parameters for aggregation, sketches for filtering
Sketchguard Node 11:
  Model dim: 1,174,986 → Sketch size: 180
  Compression ratio: 6527.7x
  Using model parameters for aggregation, sketches for filtering
Sketchguard Node 12:
  Model dim: 1,174,986 → Sketch size: 180
  Compression ratio: 6527.7x
  Using model parameters for aggregation, sketches for filtering
Sketchguard Node 13:
  Model dim: 1,174,986 → Sketch size: 180
  Compression ratio: 6527.7x
  Using model parameters for aggregation, sketches for filtering
Sketchguard Node 14:
  Model dim: 1,174,986 → Sketch size: 180
  Compression ratio: 6527.7x
  Using model parameters for aggregation, sketches for filtering
Sketchguard Node 15:
  Model dim: 1,174,986 → Sketch size: 180
  Compression ratio: 6527.7x
  Using model parameters for aggregation, sketches for filtering
Sketchguard Node 16:
  Model dim: 1,174,986 → Sketch size: 180
  Compression ratio: 6527.7x
  Using model parameters for aggregation, sketches for filtering
Sketchguard Node 17:
  Model dim: 1,174,986 → Sketch size: 180
  Compression ratio: 6527.7x
  Using model parameters for aggregation, sketches for filtering
Sketchguard Node 18:
  Model dim: 1,174,986 → Sketch size: 180
  Compression ratio: 6527.7x
  Using model parameters for aggregation, sketches for filtering
Sketchguard Node 19:
  Model dim: 1,174,986 → Sketch size: 180
  Compression ratio: 6527.7x
  Using model parameters for aggregation, sketches for filtering
Sketchguard ALGORITHM (Sketch-based Filtering + State Aggregation)
  - Model dimension: 1,174,986 parameters
  - Config: SketchguardConfig(gamma=2, kappa=1, alpha=0.5, min_neighbors=1, sketch_size=180, network_seed=987654321, attack_detection_window=5)
  - Sketch size: 180
  - Compression ratio: 6527.7x
  - Complexity: O(d + N×k) = O(1,174,986 + 20×180)
  - Theoretical speedup vs BALANCE: 19.9x
Initial test acc across nodes: mean=0.4965 ± 0.0152
Round 001: test acc mean=0.5048 ± 0.0079 | min=0.4934 max=0.5210
         : test loss mean=0.7159 ± 0.0226
         : individual accs = ['0.511523', '0.513242', '0.515982', '0.507843', '0.521000', '0.499965', '0.502440', '0.504883', '0.516510', '0.514089', '0.498397', '0.502587', '0.501881', '0.493664', '0.503352', '0.497951', '0.493363', '0.498352', '0.496386', '0.502952']
         : correct/total = [(7280, 14232), (7306, 14235), (7361, 14266), (7220, 14217), (7418, 14238), (7186, 14373), (7208, 14346), (7237, 14334), (7383, 14294), (7389, 14373), (7149, 14344), (7188, 14302), (7204, 14354), (7090, 14362), (7208, 14320), (7168, 14395), (7099, 14389), (7105, 14257), (7074, 14251), (7242, 14399)]
         : compromised: 0.5012, honest: 0.5072
         : sketchguard stats = ['Node 0: acc_rate=1.000', 'Node 1: acc_rate=1.000', 'Node 2: acc_rate=1.000']...
Round 002: test acc mean=0.5469 ± 0.0260 | min=0.4953 max=0.5853
         : test loss mean=0.6898 ± 0.0165
         : individual accs = ['0.537943', '0.523288', '0.585308', '0.525779', '0.570867', '0.525847', '0.544333', '0.583298', '0.569330', '0.560217', '0.564138', '0.528038', '0.495332', '0.564058', '0.553492', '0.575617', '0.540969', '0.497229', '0.524875', '0.568512']
         : correct/total = [(7656, 14232), (7449, 14235), (8350, 14266), (7475, 14217), (8128, 14238), (7558, 14373), (7809, 14346), (8361, 14334), (8138, 14294), (8052, 14373), (8092, 14344), (7552, 14302), (7110, 14354), (8101, 14362), (7926, 14320), (8286, 14395), (7784, 14389), (7089, 14257), (7480, 14251), (8186, 14399)]
         : compromised: 0.5265, honest: 0.5605
         : sketchguard stats = ['Node 0: acc_rate=0.789', 'Node 1: acc_rate=0.816', 'Node 2: acc_rate=0.789']...
Round 003: test acc mean=0.5907 ± 0.0215 | min=0.5006 max=0.6037
         : test loss mean=0.6749 ± 0.0055
         : individual accs = ['0.582279', '0.581946', '0.603743', '0.603362', '0.592710', '0.602240', '0.602189', '0.597530', '0.599202', '0.594587', '0.597811', '0.593623', '0.500627', '0.594416', '0.596648', '0.598263', '0.593300', '0.585817', '0.595046', '0.598375']
         : correct/total = [(8287, 14232), (8284, 14235), (8613, 14266), (8578, 14217), (8439, 14238), (8656, 14373), (8639, 14346), (8565, 14334), (8565, 14294), (8546, 14373), (8575, 14344), (8490, 14302), (7186, 14354), (8537, 14362), (8544, 14320), (8612, 14395), (8537, 14389), (8352, 14257), (8480, 14251), (8616, 14399)]
         : compromised: 0.5813, honest: 0.5969
         : sketchguard stats = ['Node 0: acc_rate=0.719', 'Node 1: acc_rate=0.754', 'Node 2: acc_rate=0.719']...
Round 004: test acc mean=0.6047 ± 0.0240 | min=0.5005 max=0.6157
         : test loss mean=0.6616 ± 0.0075
         : individual accs = ['0.611580', '0.609203', '0.611664', '0.615671', '0.610479', '0.610868', '0.613133', '0.607437', '0.611655', '0.612677', '0.610499', '0.609845', '0.500488', '0.608829', '0.606215', '0.608961', '0.604629', '0.609245', '0.610203', '0.610181']
         : correct/total = [(8704, 14232), (8672, 14235), (8726, 14266), (8753, 14217), (8692, 14238), (8780, 14373), (8796, 14346), (8707, 14334), (8743, 14294), (8806, 14373), (8757, 14344), (8722, 14302), (7184, 14354), (8744, 14362), (8681, 14320), (8766, 14395), (8700, 14389), (8686, 14257), (8696, 14251), (8786, 14399)]
         : compromised: 0.5956, honest: 0.6107
         : sketchguard stats = ['Node 0: acc_rate=0.684', 'Node 1: acc_rate=0.724', 'Node 2: acc_rate=0.684']...
Round 005: test acc mean=0.6184 ± 0.0052 | min=0.6015 max=0.6252
         : test loss mean=0.6524 ± 0.0059
         : individual accs = ['0.622681', '0.622480', '0.621688', '0.624534', '0.616028', '0.620956', '0.623867', '0.620762', '0.620820', '0.625200', '0.617819', '0.619214', '0.601505', '0.616209', '0.614735', '0.617437', '0.612621', '0.616890', '0.614764', '0.616918']
         : correct/total = [(8862, 14232), (8861, 14235), (8869, 14266), (8879, 14217), (8771, 14238), (8925, 14373), (8950, 14346), (8898, 14334), (8874, 14294), (8986, 14373), (8862, 14344), (8856, 14302), (8634, 14354), (8850, 14362), (8803, 14320), (8888, 14395), (8815, 14389), (8795, 14257), (8761, 14251), (8883, 14399)]
         : compromised: 0.6158, honest: 0.6200
         : sketchguard stats = ['Node 0: acc_rate=0.663', 'Node 1: acc_rate=0.705', 'Node 2: acc_rate=0.663']...
Round 006: test acc mean=0.6262 ± 0.0043 | min=0.6135 max=0.6336
         : test loss mean=0.6453 ± 0.0028
         : individual accs = ['0.627108', '0.631331', '0.624842', '0.628754', '0.623753', '0.629653', '0.633626', '0.621111', '0.626557', '0.628540', '0.629392', '0.629562', '0.628048', '0.624704', '0.621927', '0.623689', '0.613455', '0.626359', '0.628166', '0.622474']
         : correct/total = [(8925, 14232), (8987, 14235), (8914, 14266), (8939, 14217), (8881, 14238), (9050, 14373), (9090, 14346), (8903, 14334), (8956, 14294), (9034, 14373), (9028, 14344), (9004, 14302), (9015, 14354), (8972, 14362), (8906, 14320), (8978, 14395), (8827, 14389), (8930, 14257), (8952, 14251), (8963, 14399)]
         : compromised: 0.6275, honest: 0.6253
         : sketchguard stats = ['Node 0: acc_rate=0.649', 'Node 1: acc_rate=0.693', 'Node 2: acc_rate=0.649']...
Round 007: test acc mean=0.6327 ± 0.0038 | min=0.6266 max=0.6388
         : test loss mean=0.6402 ± 0.0025
         : individual accs = ['0.635750', '0.634282', '0.630660', '0.638813', '0.627897', '0.633132', '0.638436', '0.630389', '0.635651', '0.635358', '0.634272', '0.636065', '0.637732', '0.628673', '0.628701', '0.634734', '0.627771', '0.630076', '0.626553', '0.629766']
         : correct/total = [(9048, 14232), (9029, 14235), (8997, 14266), (9082, 14217), (8940, 14238), (9100, 14373), (9159, 14346), (9036, 14334), (9086, 14294), (9132, 14373), (9098, 14344), (9097, 14302), (9154, 14354), (9029, 14362), (9003, 14320), (9137, 14395), (9033, 14389), (8983, 14257), (8929, 14251), (9068, 14399)]
         : compromised: 0.6319, honest: 0.6333
         : sketchguard stats = ['Node 0: acc_rate=0.639', 'Node 1: acc_rate=0.684', 'Node 2: acc_rate=0.639']...
Round 008: test acc mean=0.6358 ± 0.0049 | min=0.6262 max=0.6435
         : test loss mean=0.6375 ± 0.0030
         : individual accs = ['0.639404', '0.640604', '0.636338', '0.643525', '0.626212', '0.638002', '0.643315', '0.631994', '0.638170', '0.636054', '0.634690', '0.628513', '0.640240', '0.633895', '0.627933', '0.641403', '0.635485', '0.633513', '0.635394', '0.630460']
         : correct/total = [(9100, 14232), (9119, 14235), (9078, 14266), (9149, 14217), (8916, 14238), (9170, 14373), (9229, 14346), (9059, 14334), (9122, 14294), (9142, 14373), (9104, 14344), (8989, 14302), (9190, 14354), (9104, 14362), (8992, 14320), (9233, 14395), (9144, 14389), (9032, 14257), (9055, 14251), (9078, 14399)]
         : compromised: 0.6348, honest: 0.6364
         : sketchguard stats = ['Node 0: acc_rate=0.632', 'Node 1: acc_rate=0.678', 'Node 2: acc_rate=0.632']...
Round 009: test acc mean=0.6384 ± 0.0055 | min=0.6216 max=0.6471
         : test loss mean=0.6352 ± 0.0044
         : individual accs = ['0.641091', '0.647137', '0.640264', '0.637758', '0.630355', '0.641759', '0.644221', '0.634436', '0.641528', '0.634801', '0.638804', '0.640120', '0.643793', '0.637376', '0.621648', '0.643904', '0.636667', '0.635758', '0.640797', '0.636086']
         : correct/total = [(9124, 14232), (9212, 14235), (9134, 14266), (9067, 14217), (8975, 14238), (9224, 14373), (9242, 14346), (9094, 14334), (9170, 14294), (9124, 14373), (9163, 14344), (9155, 14302), (9241, 14354), (9154, 14362), (8902, 14320), (9269, 14395), (9161, 14389), (9064, 14257), (9132, 14251), (9159, 14399)]
         : compromised: 0.6385, honest: 0.6383
         : sketchguard stats = ['Node 0: acc_rate=0.626', 'Node 1: acc_rate=0.673', 'Node 2: acc_rate=0.626']...
Round 010: test acc mean=0.6431 ± 0.0040 | min=0.6327 max=0.6491
         : test loss mean=0.6308 ± 0.0024
         : individual accs = ['0.644393', '0.649104', '0.643488', '0.648449', '0.632743', '0.643150', '0.646940', '0.637087', '0.646215', '0.646142', '0.643265', '0.641379', '0.646788', '0.638978', '0.643506', '0.647169', '0.641184', '0.638493', '0.642481', '0.641295']
         : correct/total = [(9171, 14232), (9240, 14235), (9180, 14266), (9219, 14217), (9009, 14238), (9244, 14373), (9281, 14346), (9132, 14334), (9237, 14294), (9287, 14373), (9227, 14344), (9173, 14302), (9284, 14354), (9177, 14362), (9215, 14320), (9316, 14395), (9226, 14389), (9103, 14257), (9156, 14251), (9234, 14399)]
         : compromised: 0.6430, honest: 0.6432
         : sketchguard stats = ['Node 0: acc_rate=0.621', 'Node 1: acc_rate=0.668', 'Node 2: acc_rate=0.621']...

=== FINAL RESULTS ===
Dataset: sent140, Nodes: 20, Graph: fully, Aggregation: sketchguard
Attack: directed_deviation, 40.0% compromised
Final accuracy - Compromised: 0.6430, Honest: 0.6432
Overall test accuracy: mean=0.6431 ± 0.0040

=== Sketchguard SUMMARY ===
Node 0: acceptance=0.621
Node 1: acceptance=0.668
Node 2: acceptance=0.621
Node 3: acceptance=0.621
Node 4: acceptance=0.621
Node 5: acceptance=0.668
Node 6: acceptance=0.621
Node 7: acceptance=0.621
Node 8: acceptance=0.621
Node 9: acceptance=0.621
Node 10: acceptance=0.621
Node 11: acceptance=0.668
Node 12: acceptance=0.705
Node 13: acceptance=0.668
Node 14: acceptance=0.668
Node 15: acceptance=0.621
Node 16: acceptance=0.621
Node 17: acceptance=0.668
Node 18: acceptance=0.668
Node 19: acceptance=0.621

=== PARALLEL EXECUTION TIME (realistic for distributed system) ===
  COMMUNICATION (max across nodes):
    - Sketch transfer: 0.000s (0.0%)
    - Model fetch (accepted): 0.000s (0.0%)
  COMPUTATION (max across nodes):
    - Sketching: 0.562s (94.8%)
    - Filtering: 0.001s (0.2%)
    - Aggregation: 0.029s (5.0%)
  TOTALS:
    - Total computation: 0.592s (100.0%)
    - Total communication: 0.000s (0.0%)
    - Total parallel time: 0.592s

=== PER-NODE AVERAGE TIME ===
  - Sketching: 0.491s
  - Filtering: 0.001s
  - Aggregation: 0.023s
  - Sketch transfer: 0.000s
  - Model fetch: 0.000s
  - Total per node: 0.514s

=== TOTAL COMPUTATIONAL WORK (sum across all nodes) ===
  - Total sketching: 9.810s
  - Total filtering: 0.018s
  - Total aggregation: 0.452s
  - Total sketch transfer: 0.000s
  - Total model fetch: 0.000s
  - Grand total: 10.280s
  - Mean acceptance rate: 0.642

Sketchguard Algorithm Properties:
  - Original dimension: 1,174,986
  - Sketch size: 180
  - Compression ratio: 19.9x
  - Single repetition: No repetitions needed
  - Theoretical complexity: O(d + N×k)
  - Approach: Sketch filtering + state aggregation
