Device: cuda
Seed: 987654321
Loading 1 LEAF Sent140 train files...
LEAF Sent140 train: 254555 users, 908652 samples
Building vocabulary (max_size=10000)...
Vocabulary size: 10000
Loading 1 LEAF Sent140 test files...
LEAF Sent140 test: 254555 users, 286281 samples
Found 254555 train users, 254555 test users, 254555 common users
User sample counts range: 494 (max) to 1 (min)
Distributed ALL 254555 users across 20 clients
Users per client: 12727 (with 15 clients getting +1 user)
Train partition sizes: [44353, 44290, 44657, 44907, 44696, 45843, 45801, 45619, 45069, 45639, 45821, 45311, 45779, 46056, 45625, 45984, 46428, 44737, 45540, 46497]
Test partition sizes: [14232, 14235, 14266, 14217, 14238, 14373, 14346, 14334, 14294, 14373, 14344, 14302, 14354, 14362, 14320, 14395, 14389, 14257, 14251, 14399]
  Client 0: 44353 train samples, 2 unique classes
  Client 1: 44290 train samples, 2 unique classes
  Client 2: 44657 train samples, 2 unique classes
  Client 3: 44907 train samples, 2 unique classes
  Client 4: 44696 train samples, 2 unique classes
  Client 5: 45843 train samples, 2 unique classes
  Client 6: 45801 train samples, 2 unique classes
  Client 7: 45619 train samples, 2 unique classes
  Client 8: 45069 train samples, 2 unique classes
  Client 9: 45639 train samples, 2 unique classes
  Client 10: 45821 train samples, 2 unique classes
  Client 11: 45311 train samples, 2 unique classes
  Client 12: 45779 train samples, 2 unique classes
  Client 13: 46056 train samples, 2 unique classes
  Client 14: 45625 train samples, 2 unique classes
  Client 15: 45984 train samples, 2 unique classes
  Client 16: 46428 train samples, 2 unique classes
  Client 17: 44737 train samples, 2 unique classes
  Client 18: 45540 train samples, 2 unique classes
  Client 19: 46497 train samples, 2 unique classes
Will sample 4500 samples per client per epoch
Graph: ring, nodes: 20, edges: 20
Degree statistics: avg=2.00, min=2, max=2
Attack: Compromised 14/20 nodes: [1, 2, 3, 5, 6, 8, 11, 12, 13, 14, 15, 17, 18, 19]
Attack type: directed_deviation, lambda: 1.0
Model variant: baseline
Model parameters: 1,174,986
BALANCE algorithm:
Balance Config: BALANCEConfig(gamma=2, kappa=1, alpha=0.5, min_neighbors=1)
  - Model dimension: 1,174,986 parameters
  - Complexity: O(N×d) = O(20×1,174,986)
Initial test acc across nodes: mean=0.4965 ± 0.0152
Round 001: test acc mean=0.5021 ± 0.0078 | min=0.4873 max=0.5187
         : test loss mean=3.7523 ± 3.0292
         : individual accs = ['0.510329', '0.511907', '0.488925', '0.501231', '0.497331', '0.502679', '0.494633', '0.493442', '0.518679', '0.510332', '0.505159', '0.508181', '0.487251', '0.501044', '0.495531', '0.496909', '0.503649', '0.509153', '0.503333', '0.502257']
         : correct/total = [(7263, 14232), (7287, 14235), (6975, 14266), (7126, 14217), (7081, 14238), (7225, 14373), (7096, 14346), (7073, 14334), (7414, 14294), (7335, 14373), (7246, 14344), (7268, 14302), (6994, 14354), (7196, 14362), (7096, 14320), (7153, 14395), (7247, 14389), (7259, 14257), (7173, 14251), (7232, 14399)]
         : compromised: 0.5016, honest: 0.5034
Round 002: test acc mean=0.5019 ± 0.0062 | min=0.4927 max=0.5178
         : test loss mean=3.0274 ± 2.3234
         : individual accs = ['0.503935', '0.496452', '0.505748', '0.502849', '0.504635', '0.503653', '0.502300', '0.502163', '0.493774', '0.503583', '0.498815', '0.513425', '0.498049', '0.503969', '0.492668', '0.517819', '0.496143', '0.507330', '0.496246', '0.494548']
         : correct/total = [(7172, 14232), (7067, 14235), (7215, 14266), (7149, 14217), (7185, 14238), (7239, 14373), (7206, 14346), (7198, 14334), (7058, 14294), (7238, 14373), (7155, 14344), (7343, 14302), (7149, 14354), (7238, 14362), (7055, 14320), (7454, 14395), (7139, 14389), (7233, 14257), (7072, 14251), (7121, 14399)]
         : compromised: 0.5021, honest: 0.5015
Round 003: test acc mean=0.4997 ± 0.0109 | min=0.4861 max=0.5273
         : test loss mean=1.1909 ± 0.4320
         : individual accs = ['0.493465', '0.486126', '0.487172', '0.500739', '0.487288', '0.492451', '0.507319', '0.508860', '0.504058', '0.514785', '0.527259', '0.511886', '0.487599', '0.495613', '0.497137', '0.499201', '0.495448', '0.512169', '0.489088', '0.495798']
         : correct/total = [(7023, 14232), (6920, 14235), (6950, 14266), (7119, 14217), (6938, 14238), (7078, 14373), (7278, 14346), (7294, 14334), (7205, 14294), (7399, 14373), (7563, 14344), (7321, 14302), (6999, 14354), (7118, 14362), (7119, 14320), (7186, 14395), (7129, 14389), (7302, 14257), (6970, 14251), (7139, 14399)]
         : compromised: 0.4976, honest: 0.5045
Round 004: test acc mean=0.5092 ± 0.0177 | min=0.4772 max=0.5524
         : test loss mean=1.3358 ± 0.6342
         : individual accs = ['0.501967', '0.517246', '0.503855', '0.499191', '0.495997', '0.498087', '0.505437', '0.515418', '0.477193', '0.548041', '0.552356', '0.532303', '0.498676', '0.488163', '0.501676', '0.513581', '0.503649', '0.515396', '0.506701', '0.508160']
         : correct/total = [(7144, 14232), (7363, 14235), (7188, 14266), (7097, 14217), (7062, 14238), (7159, 14373), (7251, 14346), (7388, 14334), (6821, 14294), (7877, 14373), (7923, 14344), (7613, 14302), (7158, 14354), (7011, 14362), (7184, 14320), (7393, 14395), (7247, 14389), (7348, 14257), (7221, 14251), (7317, 14399)]
         : compromised: 0.5047, honest: 0.5196
Round 005: test acc mean=0.5055 ± 0.0255 | min=0.4751 max=0.5630
         : test loss mean=1.0902 ± 0.4122
         : individual accs = ['0.501616', '0.486898', '0.490607', '0.508335', '0.501264', '0.509775', '0.492681', '0.499651', '0.509724', '0.562304', '0.562953', '0.559922', '0.482932', '0.513856', '0.495182', '0.487461', '0.488846', '0.475135', '0.489229', '0.491284']
         : correct/total = [(7139, 14232), (6931, 14235), (6999, 14266), (7227, 14217), (7137, 14238), (7327, 14373), (7068, 14346), (7162, 14334), (7286, 14294), (8082, 14373), (8075, 14344), (8008, 14302), (6932, 14354), (7380, 14362), (7091, 14320), (7017, 14395), (7034, 14389), (6774, 14257), (6972, 14251), (7074, 14399)]
         : compromised: 0.4995, honest: 0.5194
Round 006: test acc mean=0.5122 ± 0.0278 | min=0.4853 max=0.5823
         : test loss mean=1.0003 ± 0.3406
         : individual accs = ['0.508572', '0.506006', '0.501332', '0.504326', '0.497472', '0.495234', '0.507807', '0.495744', '0.506996', '0.582342', '0.575990', '0.572717', '0.491710', '0.485308', '0.500838', '0.499479', '0.501355', '0.503612', '0.507824', '0.499896']
         : correct/total = [(7238, 14232), (7203, 14235), (7152, 14266), (7170, 14217), (7083, 14238), (7118, 14373), (7285, 14346), (7106, 14334), (7247, 14294), (8370, 14373), (8262, 14344), (8191, 14302), (7058, 14354), (6970, 14362), (7172, 14320), (7190, 14395), (7214, 14389), (7180, 14257), (7237, 14251), (7198, 14399)]
         : compromised: 0.5059, honest: 0.5269
Round 007: test acc mean=0.5201 ± 0.0344 | min=0.4907 max=0.5902
         : test loss mean=0.9178 ± 0.2535
         : individual accs = ['0.501897', '0.497576', '0.496004', '0.507843', '0.502248', '0.506436', '0.493517', '0.491489', '0.570379', '0.590204', '0.586447', '0.582925', '0.493382', '0.498329', '0.505726', '0.548663', '0.498436', '0.539384', '0.499895', '0.490659']
         : correct/total = [(7143, 14232), (7083, 14235), (7076, 14266), (7220, 14217), (7151, 14238), (7279, 14373), (7080, 14346), (7045, 14334), (8153, 14294), (8483, 14373), (8412, 14344), (8337, 14302), (7082, 14354), (7157, 14362), (7242, 14320), (7898, 14395), (7172, 14389), (7690, 14257), (7124, 14251), (7065, 14399)]
         : compromised: 0.5165, honest: 0.5285
Round 008: test acc mean=0.5200 ± 0.0355 | min=0.4908 max=0.5954
         : test loss mean=0.8218 ± 0.1503
         : individual accs = ['0.513912', '0.502213', '0.511005', '0.497222', '0.505197', '0.495860', '0.505228', '0.506349', '0.585840', '0.595352', '0.592931', '0.585443', '0.497840', '0.490809', '0.509707', '0.498159', '0.498367', '0.503682', '0.510280', '0.493993']
         : correct/total = [(7314, 14232), (7149, 14235), (7290, 14266), (7069, 14217), (7193, 14238), (7127, 14373), (7248, 14346), (7258, 14334), (8374, 14294), (8557, 14373), (8505, 14344), (8373, 14302), (7146, 14354), (7049, 14362), (7299, 14320), (7171, 14395), (7171, 14389), (7181, 14257), (7272, 14251), (7113, 14399)]
         : compromised: 0.5134, honest: 0.5354
Round 009: test acc mean=0.5230 ± 0.0346 | min=0.4953 max=0.5954
         : test loss mean=0.8336 ± 0.1649
         : individual accs = ['0.515599', '0.511697', '0.497266', '0.497433', '0.505970', '0.502331', '0.500418', '0.505651', '0.589898', '0.595352', '0.592094', '0.587890', '0.509405', '0.507520', '0.509358', '0.514206', '0.510598', '0.508592', '0.495263', '0.503229']
         : correct/total = [(7338, 14232), (7284, 14235), (7094, 14266), (7072, 14217), (7204, 14238), (7220, 14373), (7179, 14346), (7248, 14334), (8432, 14294), (8557, 14373), (8493, 14344), (8408, 14302), (7312, 14354), (7289, 14362), (7294, 14320), (7402, 14395), (7347, 14389), (7251, 14257), (7058, 14251), (7246, 14399)]
         : compromised: 0.5168, honest: 0.5375
Round 010: test acc mean=0.5293 ± 0.0350 | min=0.4944 max=0.6048
         : test loss mean=0.7620 ± 0.0873
         : individual accs = ['0.522063', '0.514155', '0.509183', '0.505381', '0.516927', '0.494399', '0.504879', '0.519046', '0.596264', '0.604815', '0.597323', '0.593623', '0.512401', '0.515318', '0.517877', '0.514276', '0.509208', '0.524795', '0.510490', '0.503993']
         : correct/total = [(7430, 14232), (7319, 14235), (7264, 14266), (7185, 14217), (7360, 14238), (7106, 14373), (7243, 14346), (7440, 14334), (8523, 14294), (8693, 14373), (8568, 14344), (8490, 14302), (7355, 14354), (7401, 14362), (7416, 14320), (7403, 14395), (7327, 14389), (7482, 14257), (7275, 14251), (7257, 14399)]
         : compromised: 0.5226, honest: 0.5449

=== FINAL RESULTS ===
Dataset: sent140, Nodes: 20, Graph: ring, Aggregation: balance
Attack: directed_deviation, 70.0% compromised
Final accuracy - Compromised: 0.5226, Honest: 0.5449
Overall test accuracy: mean=0.5293 ± 0.0350

=== BALANCE SUMMARY ===
Node 0: acceptance=0.100
Node 1: acceptance=0.300
Node 2: acceptance=0.200
Node 3: acceptance=0.300
Node 4: acceptance=0.100
Node 5: acceptance=0.300
Node 6: acceptance=0.300
Node 7: acceptance=0.100
Node 8: acceptance=0.750
Node 9: acceptance=0.650
Node 10: acceptance=0.650
Node 11: acceptance=0.600
Node 12: acceptance=0.200
Node 13: acceptance=0.200
Node 14: acceptance=0.200
Node 15: acceptance=0.300
Node 16: acceptance=0.100
Node 17: acceptance=0.300
Node 18: acceptance=0.200
Node 19: acceptance=0.300

=== PARALLEL EXECUTION TIME (realistic for distributed system) ===
  COMMUNICATION (max across nodes):
    - Full model transfer: 0.000s (0.0%)
  COMPUTATION (max across nodes):
    - Filtering: 0.016s (60.0%)
    - Aggregation: 0.011s (39.9%)
  TOTALS:
    - Total computation: 0.026s (100.0%)
    - Total communication: 0.000s (0.0%)
    - Total parallel time: 0.026s

=== PER-NODE AVERAGE TIME ===
  - Filtering: 0.012s
  - Aggregation: 0.005s
  - Model transfer: 0.000s
  - Total per node: 0.017s

=== TOTAL COMPUTATIONAL WORK (sum across all nodes) ===
  - Total filtering: 0.244s
  - Total aggregation: 0.095s
  - Total model transfer: 0.000s
  - Grand total: 0.339s
  - Mean acceptance rate: 0.307

BALANCE Algorithm Properties:
  - Model dimension: 1,174,986
  - No compression: Full parameter comparison
  - Theoretical complexity: O(deg(i)×d)
  - Approach: Full parameter filtering + averaging
