Device: cuda
Seed: 987654321
Loading 1 LEAF Sent140 train files...
LEAF Sent140 train: 254555 users, 908652 samples
Building vocabulary (max_size=10000)...
Vocabulary size: 10000
Loading 1 LEAF Sent140 test files...
LEAF Sent140 test: 254555 users, 286281 samples
Found 254555 train users, 254555 test users, 254555 common users
User sample counts range: 494 (max) to 1 (min)
Distributed ALL 254555 users across 20 clients
Users per client: 12727 (with 15 clients getting +1 user)
Train partition sizes: [44353, 44290, 44657, 44907, 44696, 45843, 45801, 45619, 45069, 45639, 45821, 45311, 45779, 46056, 45625, 45984, 46428, 44737, 45540, 46497]
Test partition sizes: [14232, 14235, 14266, 14217, 14238, 14373, 14346, 14334, 14294, 14373, 14344, 14302, 14354, 14362, 14320, 14395, 14389, 14257, 14251, 14399]
  Client 0: 44353 train samples, 2 unique classes
  Client 1: 44290 train samples, 2 unique classes
  Client 2: 44657 train samples, 2 unique classes
  Client 3: 44907 train samples, 2 unique classes
  Client 4: 44696 train samples, 2 unique classes
  Client 5: 45843 train samples, 2 unique classes
  Client 6: 45801 train samples, 2 unique classes
  Client 7: 45619 train samples, 2 unique classes
  Client 8: 45069 train samples, 2 unique classes
  Client 9: 45639 train samples, 2 unique classes
  Client 10: 45821 train samples, 2 unique classes
  Client 11: 45311 train samples, 2 unique classes
  Client 12: 45779 train samples, 2 unique classes
  Client 13: 46056 train samples, 2 unique classes
  Client 14: 45625 train samples, 2 unique classes
  Client 15: 45984 train samples, 2 unique classes
  Client 16: 46428 train samples, 2 unique classes
  Client 17: 44737 train samples, 2 unique classes
  Client 18: 45540 train samples, 2 unique classes
  Client 19: 46497 train samples, 2 unique classes
Will sample 4500 samples per client per epoch
Graph: erdos, nodes: 20, edges: 48
Degree statistics: avg=4.80, min=2, max=7
Attack: Compromised 2/20 nodes: [5, 13]
Attack type: directed_deviation, lambda: 1.0
Model variant: baseline
Model parameters: 1,174,986
Initial test acc across nodes: mean=0.4965 ± 0.0152
Round 001: test acc mean=0.5088 ± 0.0126 | min=0.4951 max=0.5541
         : test loss mean=0.9042 ± 0.3683
         : individual accs = ['0.506745', '0.499754', '0.515491', '0.500598', '0.505127', '0.505322', '0.525024', '0.506279', '0.554079', '0.505810', '0.501882', '0.508041', '0.518740', '0.510096', '0.495112', '0.497464', '0.500660', '0.500596', '0.509648', '0.508924']
         : correct/total = [(7212, 14232), (7114, 14235), (7354, 14266), (7117, 14217), (7192, 14238), (7263, 14373), (7532, 14346), (7257, 14334), (7920, 14294), (7270, 14373), (7199, 14344), (7266, 14302), (7446, 14354), (7326, 14362), (7090, 14320), (7161, 14395), (7204, 14389), (7137, 14257), (7263, 14251), (7328, 14399)]
         : compromised: 0.5077, honest: 0.5089
Round 002: test acc mean=0.5018 ± 0.0088 | min=0.4861 max=0.5255
         : test loss mean=0.7910 ± 0.1476
         : individual accs = ['0.489109', '0.510713', '0.486121', '0.506788', '0.505689', '0.498643', '0.502091', '0.525534', '0.488457', '0.498852', '0.502022', '0.511956', '0.501115', '0.501671', '0.511034', '0.501563', '0.501772', '0.501859', '0.495614', '0.496354']
         : correct/total = [(6961, 14232), (7270, 14235), (6935, 14266), (7205, 14217), (7200, 14238), (7167, 14373), (7203, 14346), (7533, 14334), (6982, 14294), (7170, 14373), (7201, 14344), (7322, 14302), (7193, 14354), (7205, 14362), (7318, 14320), (7220, 14395), (7220, 14389), (7155, 14257), (7063, 14251), (7147, 14399)]
         : compromised: 0.5002, honest: 0.5020
Round 003: test acc mean=0.5024 ± 0.0135 | min=0.4587 max=0.5284
         : test loss mean=0.7087 ± 0.0365
         : individual accs = ['0.489109', '0.513664', '0.499720', '0.510023', '0.505970', '0.458707', '0.502091', '0.496233', '0.488457', '0.510680', '0.503486', '0.508111', '0.499721', '0.516014', '0.528422', '0.499965', '0.502398', '0.506628', '0.512104', '0.496354']
         : correct/total = [(6961, 14232), (7312, 14235), (7129, 14266), (7251, 14217), (7204, 14238), (6593, 14373), (7203, 14346), (7113, 14334), (6982, 14294), (7340, 14373), (7222, 14344), (7267, 14302), (7173, 14354), (7411, 14362), (7567, 14320), (7197, 14395), (7229, 14389), (7223, 14257), (7298, 14251), (7147, 14399)]
         : compromised: 0.4874, honest: 0.5041
Round 004: test acc mean=0.5102 ± 0.0208 | min=0.4831 max=0.5513
         : test loss mean=0.7190 ± 0.0672
         : individual accs = ['0.489671', '0.486266', '0.486051', '0.525638', '0.494030', '0.506227', '0.497560', '0.551277', '0.488457', '0.519933', '0.536810', '0.514334', '0.523896', '0.491784', '0.524232', '0.528031', '0.500799', '0.549695', '0.483054', '0.505660']
         : correct/total = [(6969, 14232), (6922, 14235), (6934, 14266), (7473, 14217), (7034, 14238), (7276, 14373), (7138, 14346), (7902, 14334), (6982, 14294), (7473, 14373), (7700, 14344), (7356, 14302), (7520, 14354), (7063, 14362), (7507, 14320), (7601, 14395), (7206, 14389), (7837, 14257), (6884, 14251), (7281, 14399)]
         : compromised: 0.4990, honest: 0.5114
Round 005: test acc mean=0.5225 ± 0.0232 | min=0.4885 max=0.5601
         : test loss mean=0.6976 ± 0.0215
         : individual accs = ['0.489109', '0.514506', '0.531544', '0.533798', '0.510114', '0.493843', '0.560086', '0.533626', '0.488457', '0.545119', '0.558212', '0.525381', '0.499234', '0.507729', '0.543506', '0.499687', '0.558343', '0.535176', '0.526489', '0.496354']
         : correct/total = [(6961, 14232), (7324, 14235), (7583, 14266), (7589, 14217), (7263, 14238), (7098, 14373), (8035, 14346), (7649, 14334), (6982, 14294), (7835, 14373), (8007, 14344), (7514, 14302), (7166, 14354), (7292, 14362), (7783, 14320), (7193, 14395), (8034, 14389), (7630, 14257), (7503, 14251), (7147, 14399)]
         : compromised: 0.5008, honest: 0.5249
Round 006: test acc mean=0.5204 ± 0.0295 | min=0.4861 max=0.5747
         : test loss mean=0.7083 ± 0.0497
         : individual accs = ['0.529160', '0.486266', '0.486051', '0.546529', '0.494100', '0.509010', '0.497560', '0.561741', '0.488457', '0.503027', '0.506832', '0.532723', '0.574683', '0.496797', '0.534218', '0.562348', '0.499757', '0.567300', '0.488738', '0.541982']
         : correct/total = [(7531, 14232), (6922, 14235), (6934, 14266), (7770, 14217), (7035, 14238), (7316, 14373), (7138, 14346), (8052, 14334), (6982, 14294), (7230, 14373), (7270, 14344), (7619, 14302), (8249, 14354), (7135, 14362), (7650, 14320), (8095, 14395), (7191, 14389), (8088, 14257), (6965, 14251), (7804, 14399)]
         : compromised: 0.5029, honest: 0.5223
Round 007: test acc mean=0.5290 ± 0.0327 | min=0.4885 max=0.5849
         : test loss mean=0.6952 ± 0.0201
         : individual accs = ['0.489109', '0.493151', '0.560073', '0.557361', '0.567355', '0.493843', '0.584902', '0.551695', '0.488457', '0.524316', '0.555424', '0.534121', '0.499512', '0.508564', '0.550489', '0.498367', '0.574467', '0.559094', '0.492597', '0.496354']
         : correct/total = [(6961, 14232), (7020, 14235), (7990, 14266), (7924, 14217), (8078, 14238), (7098, 14373), (8391, 14346), (7908, 14334), (6982, 14294), (7536, 14373), (7967, 14344), (7639, 14302), (7170, 14354), (7304, 14362), (7883, 14320), (7174, 14395), (8266, 14389), (7971, 14257), (7020, 14251), (7147, 14399)]
         : compromised: 0.5012, honest: 0.5320
Round 008: test acc mean=0.5293 ± 0.0354 | min=0.4861 max=0.5910
         : test loss mean=0.7040 ± 0.0428
         : individual accs = ['0.560006', '0.486266', '0.486051', '0.557642', '0.494100', '0.516107', '0.497560', '0.565230', '0.488527', '0.493077', '0.510736', '0.543281', '0.574683', '0.550759', '0.544274', '0.560611', '0.499757', '0.576769', '0.488738', '0.591013']
         : correct/total = [(7970, 14232), (6922, 14235), (6934, 14266), (7928, 14217), (7035, 14238), (7418, 14373), (7138, 14346), (8102, 14334), (6983, 14294), (7087, 14373), (7326, 14344), (7770, 14302), (8249, 14354), (7910, 14362), (7794, 14320), (8070, 14395), (7191, 14389), (8223, 14257), (6965, 14251), (8510, 14399)]
         : compromised: 0.5334, honest: 0.5288
Round 009: test acc mean=0.5403 ± 0.0343 | min=0.4885 max=0.5894
         : test loss mean=0.6918 ± 0.0170
         : individual accs = ['0.489109', '0.570144', '0.549628', '0.564324', '0.563141', '0.493843', '0.582950', '0.557695', '0.488527', '0.562791', '0.589375', '0.540484', '0.499512', '0.508564', '0.555098', '0.498367', '0.547849', '0.569895', '0.578416', '0.496354']
         : correct/total = [(6961, 14232), (8116, 14235), (7841, 14266), (8023, 14217), (8018, 14238), (7098, 14373), (8363, 14346), (7994, 14334), (6983, 14294), (8089, 14373), (8454, 14344), (7730, 14302), (7170, 14354), (7304, 14362), (7949, 14320), (7174, 14395), (7883, 14389), (8125, 14257), (8243, 14251), (7147, 14399)]
         : compromised: 0.5012, honest: 0.5446
Round 010: test acc mean=0.5371 ± 0.0403 | min=0.4861 max=0.5933
         : test loss mean=0.7000 ± 0.0385
         : individual accs = ['0.585722', '0.486266', '0.486051', '0.570796', '0.494100', '0.512210', '0.497560', '0.571508', '0.488737', '0.493843', '0.556609', '0.555936', '0.582834', '0.578053', '0.551885', '0.570129', '0.499757', '0.578733', '0.488738', '0.593305']
         : correct/total = [(8336, 14232), (6922, 14235), (6934, 14266), (8115, 14217), (7035, 14238), (7362, 14373), (7138, 14346), (8192, 14334), (6986, 14294), (7098, 14373), (7984, 14344), (7951, 14302), (8366, 14354), (8302, 14362), (7903, 14320), (8207, 14395), (7191, 14389), (8251, 14257), (6965, 14251), (8543, 14399)]
         : compromised: 0.5451, honest: 0.5363

=== FINAL RESULTS ===
Dataset: sent140, Nodes: 20, Graph: erdos, Aggregation: d-fedavg
Attack: directed_deviation, 10.0% compromised
Final accuracy - Compromised: 0.5451, Honest: 0.5363
Overall test accuracy: mean=0.5371 ± 0.0403
