Device: cuda
Seed: 987654321
Loading 1 LEAF Sent140 train files...
LEAF Sent140 train: 254555 users, 908652 samples
Building vocabulary (max_size=10000)...
Vocabulary size: 10000
Loading 1 LEAF Sent140 test files...
LEAF Sent140 test: 254555 users, 286281 samples
Found 254555 train users, 254555 test users, 254555 common users
User sample counts range: 494 (max) to 1 (min)
Distributed ALL 254555 users across 20 clients
Users per client: 12727 (with 15 clients getting +1 user)
Train partition sizes: [44353, 44290, 44657, 44907, 44696, 45843, 45801, 45619, 45069, 45639, 45821, 45311, 45779, 46056, 45625, 45984, 46428, 44737, 45540, 46497]
Test partition sizes: [14232, 14235, 14266, 14217, 14238, 14373, 14346, 14334, 14294, 14373, 14344, 14302, 14354, 14362, 14320, 14395, 14389, 14257, 14251, 14399]
  Client 0: 44353 train samples, 2 unique classes
  Client 1: 44290 train samples, 2 unique classes
  Client 2: 44657 train samples, 2 unique classes
  Client 3: 44907 train samples, 2 unique classes
  Client 4: 44696 train samples, 2 unique classes
  Client 5: 45843 train samples, 2 unique classes
  Client 6: 45801 train samples, 2 unique classes
  Client 7: 45619 train samples, 2 unique classes
  Client 8: 45069 train samples, 2 unique classes
  Client 9: 45639 train samples, 2 unique classes
  Client 10: 45821 train samples, 2 unique classes
  Client 11: 45311 train samples, 2 unique classes
  Client 12: 45779 train samples, 2 unique classes
  Client 13: 46056 train samples, 2 unique classes
  Client 14: 45625 train samples, 2 unique classes
  Client 15: 45984 train samples, 2 unique classes
  Client 16: 46428 train samples, 2 unique classes
  Client 17: 44737 train samples, 2 unique classes
  Client 18: 45540 train samples, 2 unique classes
  Client 19: 46497 train samples, 2 unique classes
Will sample 4500 samples per client per epoch
Graph: erdos, nodes: 20, edges: 99
Degree statistics: avg=9.90, min=7, max=14
Attack: Compromised 2/20 nodes: [5, 13]
Attack type: backdoor, lambda: 1.0
Backdoor target label: 1, trigger size: 3
Model variant: baseline
Model parameters: 1,174,986
Initial test acc across nodes: mean=0.4965 ± 0.0152
Backdoor attack: Created poisoned datasets for 2 compromised nodes
Round 001: test acc mean=0.5030 ± 0.0112 | min=0.4772 max=0.5292
         : test loss mean=0.8092 ± 0.2741
         : individual accs = ['0.510188', '0.511275', '0.513879', '0.506506', '0.501967', '0.507758', '0.529207', '0.496791', '0.479222', '0.506992', '0.500976', '0.507831', '0.502160', '0.491018', '0.503980', '0.477249', '0.500243', '0.509855', '0.505719', '0.497882']
         : correct/total = [(7261, 14232), (7278, 14235), (7331, 14266), (7201, 14217), (7147, 14238), (7298, 14373), (7592, 14346), (7121, 14334), (6850, 14294), (7287, 14373), (7186, 14344), (7263, 14302), (7208, 14354), (7052, 14362), (7217, 14320), (6870, 14395), (7198, 14389), (7269, 14257), (7207, 14251), (7169, 14399)]
         : compromised: 0.4994, honest: 0.5034
Round 002: test acc mean=0.5052 ± 0.0133 | min=0.4711 max=0.5379
         : test loss mean=0.7884 ± 0.2481
         : individual accs = ['0.510891', '0.506709', '0.486121', '0.505100', '0.507164', '0.510680', '0.491078', '0.515418', '0.505317', '0.494817', '0.512828', '0.505384', '0.537899', '0.521097', '0.502933', '0.471066', '0.500591', '0.514835', '0.502491', '0.502327']
         : correct/total = [(7271, 14232), (7213, 14235), (6935, 14266), (7181, 14217), (7221, 14238), (7340, 14373), (7045, 14346), (7388, 14334), (7223, 14294), (7112, 14373), (7356, 14344), (7228, 14302), (7721, 14354), (7484, 14362), (7202, 14320), (6781, 14395), (7203, 14389), (7340, 14257), (7161, 14251), (7233, 14399)]
         : compromised: 0.5159, honest: 0.5041
Round 003: test acc mean=0.4927 ± 0.0181 | min=0.4540 max=0.5288
         : test loss mean=0.7150 ± 0.0443
         : individual accs = ['0.476110', '0.488795', '0.494462', '0.498699', '0.487498', '0.463995', '0.501812', '0.461211', '0.513922', '0.497321', '0.503765', '0.502447', '0.484813', '0.453976', '0.514385', '0.502605', '0.528807', '0.492109', '0.484177', '0.503507']
         : correct/total = [(6776, 14232), (6958, 14235), (7054, 14266), (7090, 14217), (6941, 14238), (6669, 14373), (7199, 14346), (6611, 14334), (7346, 14294), (7148, 14373), (7226, 14344), (7186, 14302), (6959, 14354), (6520, 14362), (7366, 14320), (7235, 14395), (7609, 14389), (7016, 14257), (6900, 14251), (7250, 14399)]
         : compromised: 0.4590, honest: 0.4965
Round 004: test acc mean=0.5065 ± 0.0113 | min=0.4836 max=0.5418
         : test loss mean=0.7341 ± 0.0805
         : individual accs = ['0.510961', '0.513383', '0.511075', '0.505170', '0.505127', '0.504627', '0.505367', '0.505093', '0.495802', '0.514646', '0.541760', '0.515452', '0.500836', '0.483637', '0.504190', '0.502327', '0.511919', '0.494845', '0.510982', '0.493368']
         : correct/total = [(7272, 14232), (7308, 14235), (7291, 14266), (7182, 14217), (7192, 14238), (7253, 14373), (7250, 14346), (7240, 14334), (7087, 14294), (7397, 14373), (7771, 14344), (7372, 14302), (7189, 14354), (6946, 14362), (7220, 14320), (7231, 14395), (7366, 14389), (7055, 14257), (7282, 14251), (7104, 14399)]
         : compromised: 0.4941, honest: 0.5079
Round 005: test acc mean=0.5010 ± 0.0097 | min=0.4863 max=0.5222
         : test loss mean=0.7367 ± 0.0426
         : individual accs = ['0.488687', '0.486336', '0.521520', '0.492298', '0.494100', '0.507688', '0.497351', '0.494698', '0.496152', '0.512002', '0.522239', '0.491540', '0.502717', '0.502924', '0.495950', '0.498367', '0.511015', '0.502981', '0.505087', '0.495798']
         : correct/total = [(6955, 14232), (6923, 14235), (7440, 14266), (6999, 14217), (7035, 14238), (7297, 14373), (7135, 14346), (7091, 14334), (7092, 14294), (7359, 14373), (7491, 14344), (7030, 14302), (7216, 14354), (7223, 14362), (7102, 14320), (7174, 14395), (7353, 14389), (7171, 14257), (7198, 14251), (7139, 14399)]
         : compromised: 0.5053, honest: 0.5005
Round 006: test acc mean=0.4940 ± 0.0106 | min=0.4707 max=0.5194
         : test loss mean=0.7672 ± 0.0638
         : individual accs = ['0.489109', '0.486266', '0.493481', '0.491524', '0.494100', '0.490155', '0.484456', '0.495186', '0.470687', '0.502192', '0.513107', '0.493637', '0.499512', '0.500348', '0.486173', '0.498367', '0.519355', '0.502981', '0.488948', '0.480797']
         : correct/total = [(6961, 14232), (6922, 14235), (7040, 14266), (6988, 14217), (7035, 14238), (7045, 14373), (6950, 14346), (7098, 14334), (6728, 14294), (7218, 14373), (7360, 14344), (7060, 14302), (7170, 14354), (7186, 14362), (6962, 14320), (7174, 14395), (7473, 14389), (7171, 14257), (6968, 14251), (6923, 14399)]
         : compromised: 0.4953, honest: 0.4939
Round 007: test acc mean=0.5036 ± 0.0167 | min=0.4868 max=0.5675
         : test loss mean=0.9137 ± 0.3464
         : individual accs = ['0.489460', '0.486758', '0.515842', '0.492298', '0.495154', '0.502331', '0.498885', '0.496651', '0.494333', '0.516594', '0.567485', '0.494476', '0.505295', '0.514900', '0.496788', '0.498923', '0.505039', '0.503612', '0.497439', '0.500382']
         : correct/total = [(6966, 14232), (6929, 14235), (7359, 14266), (6999, 14217), (7050, 14238), (7220, 14373), (7157, 14346), (7119, 14334), (7066, 14294), (7425, 14373), (8140, 14344), (7072, 14302), (7253, 14354), (7395, 14362), (7114, 14320), (7182, 14395), (7267, 14389), (7180, 14257), (7089, 14251), (7205, 14399)]
         : compromised: 0.5086, honest: 0.5031
Round 008: test acc mean=0.5037 ± 0.0270 | min=0.4672 max=0.5572
         : test loss mean=0.8689 ± 0.1508
         : individual accs = ['0.489109', '0.485213', '0.555096', '0.474010', '0.494873', '0.493982', '0.480691', '0.495465', '0.522037', '0.553260', '0.545036', '0.484478', '0.499512', '0.508773', '0.467249', '0.497881', '0.557162', '0.496528', '0.488738', '0.484895']
         : correct/total = [(6961, 14232), (6907, 14235), (7919, 14266), (6739, 14217), (7046, 14238), (7100, 14373), (6896, 14346), (7102, 14334), (7462, 14294), (7952, 14373), (7818, 14344), (6929, 14302), (7170, 14354), (7307, 14362), (6691, 14320), (7167, 14395), (8017, 14389), (7079, 14257), (6965, 14251), (6982, 14399)]
         : compromised: 0.5014, honest: 0.5040
Round 009: test acc mean=0.5037 ± 0.0144 | min=0.4834 max=0.5341
         : test loss mean=0.9858 ± 0.2491
         : individual accs = ['0.496417', '0.518089', '0.486682', '0.514314', '0.524582', '0.483406', '0.500906', '0.520371', '0.496432', '0.493147', '0.495608', '0.494057', '0.499721', '0.491854', '0.512640', '0.534074', '0.499340', '0.528232', '0.490562', '0.494479']
         : correct/total = [(7065, 14232), (7375, 14235), (6943, 14266), (7312, 14217), (7469, 14238), (6948, 14373), (7186, 14346), (7459, 14334), (7096, 14294), (7088, 14373), (7109, 14344), (7066, 14302), (7173, 14354), (7064, 14362), (7341, 14320), (7688, 14395), (7185, 14389), (7531, 14257), (6991, 14251), (7120, 14399)]
         : compromised: 0.4876, honest: 0.5055
Round 010: test acc mean=0.5272 ± 0.0119 | min=0.5113 max=0.5586
         : test loss mean=0.8286 ± 0.1125
         : individual accs = ['0.519674', '0.534387', '0.546334', '0.529788', '0.517840', '0.512071', '0.535620', '0.512139', '0.522877', '0.536075', '0.527259', '0.532373', '0.522572', '0.511349', '0.537430', '0.515040', '0.558621', '0.521077', '0.521507', '0.530245']
         : correct/total = [(7396, 14232), (7607, 14235), (7794, 14266), (7532, 14217), (7373, 14238), (7360, 14373), (7684, 14346), (7341, 14334), (7474, 14294), (7705, 14373), (7563, 14344), (7614, 14302), (7501, 14354), (7344, 14362), (7696, 14320), (7414, 14395), (8038, 14389), (7429, 14257), (7432, 14251), (7635, 14399)]
         : compromised: 0.5117, honest: 0.5289

=== FINAL RESULTS ===
Dataset: sent140, Nodes: 20, Graph: erdos, Aggregation: d-fedavg
Attack: backdoor, 10.0% compromised
Final accuracy - Compromised: 0.5117, Honest: 0.5289
Overall test accuracy: mean=0.5272 ± 0.0119

=== BACKDOOR ATTACK SUCCESS RATE (ASR) ===
Target label: 1
Trigger size: 3x3
Overall ASR: 0.6987 ± 0.2398
Honest nodes ASR: 0.6683 ± 0.2339
Compromised nodes ASR: 0.9717 ± 0.0107
Note: Higher ASR indicates more successful backdoor attack
