Device: cuda
Seed: 987654321
Loading 1 LEAF Sent140 train files...
LEAF Sent140 train: 254555 users, 908652 samples
Building vocabulary (max_size=10000)...
Vocabulary size: 10000
Loading 1 LEAF Sent140 test files...
LEAF Sent140 test: 254555 users, 286281 samples
Found 254555 train users, 254555 test users, 254555 common users
User sample counts range: 494 (max) to 1 (min)
Distributed ALL 254555 users across 20 clients
Users per client: 12727 (with 15 clients getting +1 user)
Train partition sizes: [44353, 44290, 44657, 44907, 44696, 45843, 45801, 45619, 45069, 45639, 45821, 45311, 45779, 46056, 45625, 45984, 46428, 44737, 45540, 46497]
Test partition sizes: [14232, 14235, 14266, 14217, 14238, 14373, 14346, 14334, 14294, 14373, 14344, 14302, 14354, 14362, 14320, 14395, 14389, 14257, 14251, 14399]
  Client 0: 44353 train samples, 2 unique classes
  Client 1: 44290 train samples, 2 unique classes
  Client 2: 44657 train samples, 2 unique classes
  Client 3: 44907 train samples, 2 unique classes
  Client 4: 44696 train samples, 2 unique classes
  Client 5: 45843 train samples, 2 unique classes
  Client 6: 45801 train samples, 2 unique classes
  Client 7: 45619 train samples, 2 unique classes
  Client 8: 45069 train samples, 2 unique classes
  Client 9: 45639 train samples, 2 unique classes
  Client 10: 45821 train samples, 2 unique classes
  Client 11: 45311 train samples, 2 unique classes
  Client 12: 45779 train samples, 2 unique classes
  Client 13: 46056 train samples, 2 unique classes
  Client 14: 45625 train samples, 2 unique classes
  Client 15: 45984 train samples, 2 unique classes
  Client 16: 46428 train samples, 2 unique classes
  Client 17: 44737 train samples, 2 unique classes
  Client 18: 45540 train samples, 2 unique classes
  Client 19: 46497 train samples, 2 unique classes
Will sample 4500 samples per client per epoch
Graph: erdos, nodes: 20, edges: 126
Degree statistics: avg=12.60, min=8, max=16
Attack: Compromised 6/20 nodes: [5, 12, 13, 14, 17, 18]
Attack type: krum, lambda: 1.0
Model variant: baseline
Model parameters: 1,174,986
Sketchguard Node 0:
  Model dim: 1,174,986 → Sketch size: 180
  Compression ratio: 6527.7x
  Using model parameters for aggregation, sketches for filtering
Sketchguard Node 1:
  Model dim: 1,174,986 → Sketch size: 180
  Compression ratio: 6527.7x
  Using model parameters for aggregation, sketches for filtering
Sketchguard Node 2:
  Model dim: 1,174,986 → Sketch size: 180
  Compression ratio: 6527.7x
  Using model parameters for aggregation, sketches for filtering
Sketchguard Node 3:
  Model dim: 1,174,986 → Sketch size: 180
  Compression ratio: 6527.7x
  Using model parameters for aggregation, sketches for filtering
Sketchguard Node 4:
  Model dim: 1,174,986 → Sketch size: 180
  Compression ratio: 6527.7x
  Using model parameters for aggregation, sketches for filtering
Sketchguard Node 5:
  Model dim: 1,174,986 → Sketch size: 180
  Compression ratio: 6527.7x
  Using model parameters for aggregation, sketches for filtering
Sketchguard Node 6:
  Model dim: 1,174,986 → Sketch size: 180
  Compression ratio: 6527.7x
  Using model parameters for aggregation, sketches for filtering
Sketchguard Node 7:
  Model dim: 1,174,986 → Sketch size: 180
  Compression ratio: 6527.7x
  Using model parameters for aggregation, sketches for filtering
Sketchguard Node 8:
  Model dim: 1,174,986 → Sketch size: 180
  Compression ratio: 6527.7x
  Using model parameters for aggregation, sketches for filtering
Sketchguard Node 9:
  Model dim: 1,174,986 → Sketch size: 180
  Compression ratio: 6527.7x
  Using model parameters for aggregation, sketches for filtering
Sketchguard Node 10:
  Model dim: 1,174,986 → Sketch size: 180
  Compression ratio: 6527.7x
  Using model parameters for aggregation, sketches for filtering
Sketchguard Node 11:
  Model dim: 1,174,986 → Sketch size: 180
  Compression ratio: 6527.7x
  Using model parameters for aggregation, sketches for filtering
Sketchguard Node 12:
  Model dim: 1,174,986 → Sketch size: 180
  Compression ratio: 6527.7x
  Using model parameters for aggregation, sketches for filtering
Sketchguard Node 13:
  Model dim: 1,174,986 → Sketch size: 180
  Compression ratio: 6527.7x
  Using model parameters for aggregation, sketches for filtering
Sketchguard Node 14:
  Model dim: 1,174,986 → Sketch size: 180
  Compression ratio: 6527.7x
  Using model parameters for aggregation, sketches for filtering
Sketchguard Node 15:
  Model dim: 1,174,986 → Sketch size: 180
  Compression ratio: 6527.7x
  Using model parameters for aggregation, sketches for filtering
Sketchguard Node 16:
  Model dim: 1,174,986 → Sketch size: 180
  Compression ratio: 6527.7x
  Using model parameters for aggregation, sketches for filtering
Sketchguard Node 17:
  Model dim: 1,174,986 → Sketch size: 180
  Compression ratio: 6527.7x
  Using model parameters for aggregation, sketches for filtering
Sketchguard Node 18:
  Model dim: 1,174,986 → Sketch size: 180
  Compression ratio: 6527.7x
  Using model parameters for aggregation, sketches for filtering
Sketchguard Node 19:
  Model dim: 1,174,986 → Sketch size: 180
  Compression ratio: 6527.7x
  Using model parameters for aggregation, sketches for filtering
Sketchguard ALGORITHM (Sketch-based Filtering + State Aggregation)
  - Model dimension: 1,174,986 parameters
  - Config: SketchguardConfig(gamma=2, kappa=1, alpha=0.5, min_neighbors=1, sketch_size=180, network_seed=987654321, attack_detection_window=5)
  - Sketch size: 180
  - Compression ratio: 6527.7x
  - Complexity: O(d + N×k) = O(1,174,986 + 20×180)
  - Theoretical speedup vs BALANCE: 19.9x
Initial test acc across nodes: mean=0.4965 ± 0.0152
Round 001: test acc mean=0.5063 ± 0.0114 | min=0.4791 max=0.5259
         : test loss mean=0.7096 ± 0.0208
         : individual accs = ['0.479132', '0.512469', '0.520538', '0.488711', '0.503652', '0.509427', '0.514847', '0.525883', '0.506436', '0.505531', '0.520706', '0.504475', '0.500070', '0.520888', '0.509358', '0.502605', '0.490375', '0.497019', '0.508877', '0.504549']
         : correct/total = [(6819, 14232), (7295, 14235), (7426, 14266), (6948, 14217), (7171, 14238), (7322, 14373), (7386, 14346), (7538, 14334), (7239, 14294), (7266, 14373), (7469, 14344), (7215, 14302), (7178, 14354), (7481, 14362), (7294, 14320), (7235, 14395), (7056, 14389), (7086, 14257), (7252, 14251), (7265, 14399)]
         : compromised: 0.5076, honest: 0.5057
         : sketchguard stats = ['Node 0: acc_rate=1.000', 'Node 1: acc_rate=1.000', 'Node 2: acc_rate=1.000']...
Round 002: test acc mean=0.5253 ± 0.0202 | min=0.4866 max=0.5669
         : test loss mean=0.6910 ± 0.0029
         : individual accs = ['0.510399', '0.486617', '0.539955', '0.535134', '0.499930', '0.513880', '0.556392', '0.516813', '0.524766', '0.546024', '0.504462', '0.566914', '0.503832', '0.519914', '0.536732', '0.519416', '0.553061', '0.510907', '0.527752', '0.532537']
         : correct/total = [(7264, 14232), (6927, 14235), (7703, 14266), (7608, 14217), (7118, 14238), (7386, 14373), (7982, 14346), (7408, 14334), (7501, 14294), (7848, 14373), (7236, 14344), (8108, 14302), (7232, 14354), (7467, 14362), (7686, 14320), (7477, 14395), (7958, 14389), (7284, 14257), (7521, 14251), (7668, 14399)]
         : compromised: 0.5188, honest: 0.5280
         : sketchguard stats = ['Node 0: acc_rate=0.844', 'Node 1: acc_rate=0.909', 'Node 2: acc_rate=0.833']...
Round 003: test acc mean=0.5495 ± 0.0228 | min=0.5005 max=0.5755
         : test loss mean=0.6867 ± 0.0032
         : individual accs = ['0.568086', '0.522164', '0.570447', '0.562847', '0.528656', '0.552633', '0.575491', '0.540603', '0.561214', '0.573367', '0.528374', '0.570619', '0.500488', '0.562387', '0.567737', '0.554498', '0.529641', '0.502560', '0.549646', '0.569137']
         : correct/total = [(8085, 14232), (7433, 14235), (8138, 14266), (8002, 14217), (7527, 14238), (7943, 14373), (8256, 14346), (7749, 14334), (8022, 14294), (8241, 14373), (7579, 14344), (8161, 14302), (7184, 14354), (8077, 14362), (8130, 14320), (7982, 14395), (7621, 14389), (7165, 14257), (7833, 14251), (8195, 14399)]
         : compromised: 0.5392, honest: 0.5539
         : sketchguard stats = ['Node 0: acc_rate=0.792', 'Node 1: acc_rate=0.879', 'Node 2: acc_rate=0.778']...
Round 004: test acc mean=0.5856 ± 0.0105 | min=0.5481 max=0.5975
         : test loss mean=0.6772 ± 0.0042
         : individual accs = ['0.595700', '0.579417', '0.585939', '0.585356', '0.581121', '0.597509', '0.594173', '0.575903', '0.589688', '0.589021', '0.595162', '0.590617', '0.548140', '0.587871', '0.588547', '0.588260', '0.577802', '0.585817', '0.580240', '0.595458']
         : correct/total = [(8478, 14232), (8248, 14235), (8359, 14266), (8322, 14217), (8274, 14238), (8588, 14373), (8524, 14346), (8255, 14334), (8429, 14294), (8466, 14373), (8537, 14344), (8447, 14302), (7868, 14354), (8443, 14362), (8428, 14320), (8468, 14395), (8314, 14389), (8352, 14257), (8269, 14251), (8574, 14399)]
         : compromised: 0.5814, honest: 0.5874
         : sketchguard stats = ['Node 0: acc_rate=0.766', 'Node 1: acc_rate=0.864', 'Node 2: acc_rate=0.750']...
Round 005: test acc mean=0.6044 ± 0.0062 | min=0.5920 max=0.6196
         : test loss mean=0.6640 ± 0.0036
         : individual accs = ['0.608909', '0.605339', '0.608650', '0.611873', '0.606054', '0.619564', '0.606023', '0.599065', '0.597943', '0.602797', '0.609663', '0.604041', '0.599345', '0.605904', '0.597277', '0.602431', '0.598930', '0.600968', '0.592029', '0.611362']
         : correct/total = [(8666, 14232), (8617, 14235), (8683, 14266), (8699, 14217), (8629, 14238), (8905, 14373), (8694, 14346), (8587, 14334), (8547, 14294), (8664, 14373), (8745, 14344), (8639, 14302), (8603, 14354), (8702, 14362), (8553, 14320), (8672, 14395), (8618, 14389), (8568, 14257), (8437, 14251), (8803, 14399)]
         : compromised: 0.6025, honest: 0.6052
         : sketchguard stats = ['Node 0: acc_rate=0.750', 'Node 1: acc_rate=0.855', 'Node 2: acc_rate=0.733']...
Round 006: test acc mean=0.6162 ± 0.0066 | min=0.5971 max=0.6291
         : test loss mean=0.6539 ± 0.0030
         : individual accs = ['0.622541', '0.617562', '0.621688', '0.620384', '0.617432', '0.629096', '0.612993', '0.609948', '0.609137', '0.617129', '0.617540', '0.615718', '0.622057', '0.622406', '0.614595', '0.609865', '0.597053', '0.612892', '0.614694', '0.618446']
         : correct/total = [(8860, 14232), (8791, 14235), (8869, 14266), (8820, 14217), (8791, 14238), (9042, 14373), (8794, 14346), (8743, 14334), (8707, 14294), (8870, 14373), (8858, 14344), (8806, 14302), (8929, 14354), (8939, 14362), (8801, 14320), (8779, 14395), (8591, 14389), (8738, 14257), (8760, 14251), (8905, 14399)]
         : compromised: 0.6193, honest: 0.6148
         : sketchguard stats = ['Node 0: acc_rate=0.740', 'Node 1: acc_rate=0.848', 'Node 2: acc_rate=0.722']...
Round 007: test acc mean=0.6233 ± 0.0043 | min=0.6148 max=0.6325
         : test loss mean=0.6480 ± 0.0024
         : individual accs = ['0.625773', '0.623744', '0.622038', '0.628895', '0.628880', '0.632505', '0.621846', '0.617762', '0.620400', '0.626244', '0.622281', '0.620613', '0.628466', '0.624077', '0.622137', '0.622438', '0.614775', '0.620888', '0.616518', '0.626363']
         : correct/total = [(8906, 14232), (8879, 14235), (8874, 14266), (8941, 14217), (8954, 14238), (9091, 14373), (8921, 14346), (8855, 14334), (8868, 14294), (9001, 14373), (8926, 14344), (8876, 14302), (9021, 14354), (8963, 14362), (8909, 14320), (8960, 14395), (8846, 14389), (8852, 14257), (8786, 14251), (9019, 14399)]
         : compromised: 0.6241, honest: 0.6230
         : sketchguard stats = ['Node 0: acc_rate=0.732', 'Node 1: acc_rate=0.844', 'Node 2: acc_rate=0.714']...
Round 008: test acc mean=0.6258 ± 0.0054 | min=0.6129 max=0.6374
         : test loss mean=0.6453 ± 0.0042
         : individual accs = ['0.627319', '0.628521', '0.628908', '0.630653', '0.612937', '0.627357', '0.628119', '0.620483', '0.625227', '0.629166', '0.625279', '0.618165', '0.637383', '0.629578', '0.620531', '0.630983', '0.618181', '0.627060', '0.622553', '0.627335']
         : correct/total = [(8928, 14232), (8947, 14235), (8972, 14266), (8966, 14217), (8727, 14238), (9017, 14373), (9011, 14346), (8894, 14334), (8937, 14294), (9043, 14373), (8969, 14344), (8841, 14302), (9149, 14354), (9042, 14362), (8886, 14320), (9083, 14395), (8895, 14389), (8940, 14257), (8872, 14251), (9033, 14399)]
         : compromised: 0.6274, honest: 0.6251
         : sketchguard stats = ['Node 0: acc_rate=0.727', 'Node 1: acc_rate=0.841', 'Node 2: acc_rate=0.708']...
Round 009: test acc mean=0.6289 ± 0.0078 | min=0.6050 max=0.6429
         : test loss mean=0.6431 ± 0.0052
         : individual accs = ['0.626335', '0.633720', '0.632833', '0.622283', '0.626773', '0.642942', '0.630698', '0.623692', '0.630964', '0.625896', '0.623187', '0.624528', '0.636478', '0.633895', '0.604958', '0.638972', '0.624088', '0.629235', '0.632307', '0.634697']
         : correct/total = [(8914, 14232), (9021, 14235), (9028, 14266), (8847, 14217), (8924, 14238), (9241, 14373), (9048, 14346), (8940, 14334), (9019, 14294), (8996, 14373), (8939, 14344), (8932, 14302), (9136, 14354), (9104, 14362), (8663, 14320), (9198, 14395), (8980, 14389), (8971, 14257), (9011, 14251), (9139, 14399)]
         : compromised: 0.6300, honest: 0.6285
         : sketchguard stats = ['Node 0: acc_rate=0.722', 'Node 1: acc_rate=0.838', 'Node 2: acc_rate=0.704']...
Round 010: test acc mean=0.6360 ± 0.0050 | min=0.6264 max=0.6431
         : test loss mean=0.6374 ± 0.0029
         : individual accs = ['0.637718', '0.640112', '0.636969', '0.638602', '0.626352', '0.642246', '0.635787', '0.628994', '0.634532', '0.639045', '0.638734', '0.626416', '0.640100', '0.637237', '0.638897', '0.643140', '0.628327', '0.631199', '0.634271', '0.640461']
         : correct/total = [(9076, 14232), (9112, 14235), (9087, 14266), (9079, 14217), (8918, 14238), (9231, 14373), (9121, 14346), (9016, 14334), (9070, 14294), (9185, 14373), (9162, 14344), (8959, 14302), (9188, 14354), (9152, 14362), (9149, 14320), (9258, 14395), (9041, 14389), (8999, 14257), (9039, 14251), (9222, 14399)]
         : compromised: 0.6373, honest: 0.6354
         : sketchguard stats = ['Node 0: acc_rate=0.719', 'Node 1: acc_rate=0.836', 'Node 2: acc_rate=0.700']...

=== FINAL RESULTS ===
Dataset: sent140, Nodes: 20, Graph: erdos, Aggregation: sketchguard
Attack: krum, 30.0% compromised
Final accuracy - Compromised: 0.6373, Honest: 0.6354
Overall test accuracy: mean=0.6360 ± 0.0050

=== Sketchguard SUMMARY ===
Node 0: acceptance=0.719
Node 1: acceptance=0.836
Node 2: acceptance=0.700
Node 3: acceptance=0.775
Node 4: acceptance=0.755
Node 5: acceptance=0.700
Node 6: acceptance=0.614
Node 7: acceptance=0.679
Node 8: acceptance=0.550
Node 9: acceptance=0.792
Node 10: acceptance=0.700
Node 11: acceptance=0.679
Node 12: acceptance=0.792
Node 13: acceptance=0.792
Node 14: acceptance=0.700
Node 15: acceptance=0.673
Node 16: acceptance=0.654
Node 17: acceptance=0.800
Node 18: acceptance=0.775
Node 19: acceptance=0.662

=== PARALLEL EXECUTION TIME (realistic for distributed system) ===
  COMMUNICATION (max across nodes):
    - Sketch transfer: 0.000s (0.0%)
    - Model fetch (accepted): 0.000s (0.0%)
  COMPUTATION (max across nodes):
    - Sketching: 0.519s (94.4%)
    - Filtering: 0.001s (0.2%)
    - Aggregation: 0.030s (5.4%)
  TOTALS:
    - Total computation: 0.550s (100.0%)
    - Total communication: 0.000s (0.0%)
    - Total parallel time: 0.550s

=== PER-NODE AVERAGE TIME ===
  - Sketching: 0.390s
  - Filtering: 0.001s
  - Aggregation: 0.018s
  - Sketch transfer: 0.000s
  - Model fetch: 0.000s
  - Total per node: 0.408s

=== TOTAL COMPUTATIONAL WORK (sum across all nodes) ===
  - Total sketching: 7.791s
  - Total filtering: 0.013s
  - Total aggregation: 0.351s
  - Total sketch transfer: 0.000s
  - Total model fetch: 0.000s
  - Grand total: 8.156s
  - Mean acceptance rate: 0.717

Sketchguard Algorithm Properties:
  - Original dimension: 1,174,986
  - Sketch size: 180
  - Compression ratio: 19.9x
  - Single repetition: No repetitions needed
  - Theoretical complexity: O(d + N×k)
  - Approach: Sketch filtering + state aggregation
