Device: cuda
Seed: 987654321
Loading 1 LEAF Sent140 train files...
LEAF Sent140 train: 254555 users, 908652 samples
Building vocabulary (max_size=10000)...
Vocabulary size: 10000
Loading 1 LEAF Sent140 test files...
LEAF Sent140 test: 254555 users, 286281 samples
Found 254555 train users, 254555 test users, 254555 common users
User sample counts range: 494 (max) to 1 (min)
Distributed ALL 254555 users across 20 clients
Users per client: 12727 (with 15 clients getting +1 user)
Train partition sizes: [44353, 44290, 44657, 44907, 44696, 45843, 45801, 45619, 45069, 45639, 45821, 45311, 45779, 46056, 45625, 45984, 46428, 44737, 45540, 46497]
Test partition sizes: [14232, 14235, 14266, 14217, 14238, 14373, 14346, 14334, 14294, 14373, 14344, 14302, 14354, 14362, 14320, 14395, 14389, 14257, 14251, 14399]
  Client 0: 44353 train samples, 2 unique classes
  Client 1: 44290 train samples, 2 unique classes
  Client 2: 44657 train samples, 2 unique classes
  Client 3: 44907 train samples, 2 unique classes
  Client 4: 44696 train samples, 2 unique classes
  Client 5: 45843 train samples, 2 unique classes
  Client 6: 45801 train samples, 2 unique classes
  Client 7: 45619 train samples, 2 unique classes
  Client 8: 45069 train samples, 2 unique classes
  Client 9: 45639 train samples, 2 unique classes
  Client 10: 45821 train samples, 2 unique classes
  Client 11: 45311 train samples, 2 unique classes
  Client 12: 45779 train samples, 2 unique classes
  Client 13: 46056 train samples, 2 unique classes
  Client 14: 45625 train samples, 2 unique classes
  Client 15: 45984 train samples, 2 unique classes
  Client 16: 46428 train samples, 2 unique classes
  Client 17: 44737 train samples, 2 unique classes
  Client 18: 45540 train samples, 2 unique classes
  Client 19: 46497 train samples, 2 unique classes
Will sample 4500 samples per client per epoch
Graph: erdos, nodes: 20, edges: 48
Degree statistics: avg=4.80, min=2, max=7
Attack: Compromised 8/20 nodes: [1, 5, 11, 12, 13, 14, 17, 18]
Attack type: backdoor, lambda: 1.0
Backdoor target label: 1, trigger size: 3
Model variant: baseline
Model parameters: 1,174,986
Initial test acc across nodes: mean=0.4953 ± 0.0174
Backdoor attack: Created poisoned datasets for 8 compromised nodes
Round 001: test acc mean=0.5012 ± 0.0066 | min=0.4925 max=0.5143
         : test loss mean=5.1370 ± 4.0585
         : individual accs = ['0.508010', '0.510854', '0.493761', '0.492509', '0.495575', '0.499269', '0.505019', '0.498395', '0.498321', '0.508871', '0.501743', '0.496924', '0.496377', '0.502158', '0.495042', '0.498298', '0.501633', '0.513222', '0.493509', '0.514272']
         : correct/total = [(7230, 14232), (7272, 14235), (7044, 14266), (7002, 14217), (7056, 14238), (7176, 14373), (7245, 14346), (7144, 14334), (7123, 14294), (7314, 14373), (7197, 14344), (7107, 14302), (7125, 14354), (7212, 14362), (7089, 14320), (7173, 14395), (7218, 14389), (7317, 14257), (7033, 14251), (7405, 14399)]
         : compromised: 0.5009, honest: 0.5014
Round 002: test acc mean=0.5029 ± 0.0070 | min=0.4877 max=0.5158
         : test loss mean=7.2069 ± 4.6252
         : individual accs = ['0.504778', '0.507903', '0.514440', '0.515791', '0.504284', '0.502470', '0.487662', '0.508023', '0.501679', '0.503514', '0.499930', '0.498112', '0.495959', '0.494290', '0.505936', '0.491907', '0.509764', '0.506278', '0.507403', '0.498715']
         : correct/total = [(7184, 14232), (7230, 14235), (7339, 14266), (7333, 14217), (7180, 14238), (7222, 14373), (6996, 14346), (7282, 14334), (7171, 14294), (7237, 14373), (7171, 14344), (7124, 14302), (7119, 14354), (7099, 14362), (7245, 14320), (7081, 14395), (7335, 14389), (7218, 14257), (7231, 14251), (7181, 14399)]
         : compromised: 0.5023, honest: 0.5034
Round 003: test acc mean=0.5036 ± 0.0060 | min=0.4924 max=0.5219
         : test loss mean=2.6452 ± 1.8954
         : individual accs = ['0.506535', '0.511275', '0.507851', '0.521910', '0.492415', '0.504557', '0.500627', '0.501674', '0.501889', '0.505462', '0.497699', '0.505733', '0.496726', '0.498816', '0.506494', '0.502119', '0.501842', '0.498211', '0.504175', '0.505105']
         : correct/total = [(7209, 14232), (7278, 14235), (7245, 14266), (7420, 14217), (7011, 14238), (7252, 14373), (7182, 14346), (7191, 14334), (7174, 14294), (7265, 14373), (7139, 14344), (7233, 14302), (7130, 14354), (7164, 14362), (7253, 14320), (7228, 14395), (7221, 14389), (7103, 14257), (7185, 14251), (7273, 14399)]
         : compromised: 0.5032, honest: 0.5038
Round 004: test acc mean=0.4979 ± 0.0053 | min=0.4862 max=0.5050
         : test loss mean=3.2556 ± 3.9523
         : individual accs = ['0.499157', '0.505023', '0.488154', '0.486179', '0.495294', '0.497669', '0.499512', '0.501465', '0.498601', '0.494330', '0.501813', '0.497553', '0.504110', '0.504874', '0.491969', '0.498923', '0.494683', '0.503472', '0.492176', '0.503438']
         : correct/total = [(7104, 14232), (7189, 14235), (6964, 14266), (6912, 14217), (7052, 14238), (7153, 14373), (7166, 14346), (7188, 14334), (7127, 14294), (7105, 14373), (7198, 14344), (7116, 14302), (7236, 14354), (7251, 14362), (7045, 14320), (7182, 14395), (7118, 14389), (7178, 14257), (7014, 14251), (7249, 14399)]
         : compromised: 0.4996, honest: 0.4968
Round 005: test acc mean=0.4940 ± 0.0060 | min=0.4830 max=0.5035
         : test loss mean=1.9590 ± 2.1984
         : individual accs = ['0.492482', '0.482965', '0.496495', '0.484068', '0.486866', '0.493703', '0.502161', '0.495605', '0.499021', '0.496069', '0.492610', '0.496644', '0.498398', '0.503481', '0.483939', '0.497742', '0.487525', '0.497019', '0.501368', '0.492604']
         : correct/total = [(7009, 14232), (6875, 14235), (7083, 14266), (6882, 14217), (6932, 14238), (7096, 14373), (7204, 14346), (7104, 14334), (7133, 14294), (7130, 14373), (7066, 14344), (7103, 14302), (7154, 14354), (7231, 14362), (6930, 14320), (7165, 14395), (7015, 14389), (7086, 14257), (7145, 14251), (7093, 14399)]
         : compromised: 0.4947, honest: 0.4936
Round 006: test acc mean=0.4949 ± 0.0088 | min=0.4760 max=0.5095
         : test loss mean=2.4414 ± 1.7864
         : individual accs = ['0.495503', '0.482965', '0.506659', '0.495323', '0.492415', '0.507549', '0.490590', '0.486326', '0.497132', '0.509497', '0.503834', '0.492309', '0.491361', '0.494430', '0.495810', '0.475999', '0.498019', '0.488111', '0.484738', '0.508716']
         : correct/total = [(7052, 14232), (6875, 14235), (7228, 14266), (7042, 14217), (7011, 14238), (7295, 14373), (7038, 14346), (6971, 14334), (7106, 14294), (7323, 14373), (7227, 14344), (7041, 14302), (7053, 14354), (7101, 14362), (7100, 14320), (6852, 14395), (7166, 14389), (6959, 14257), (6908, 14251), (7325, 14399)]
         : compromised: 0.4922, honest: 0.4967
Round 007: test acc mean=0.5033 ± 0.0049 | min=0.4946 max=0.5145
         : test loss mean=1.9655 ± 2.4404
         : individual accs = ['0.512296', '0.507622', '0.514510', '0.502919', '0.502037', '0.504001', '0.501185', '0.503209', '0.496992', '0.507618', '0.500000', '0.505733', '0.501881', '0.495892', '0.494553', '0.500035', '0.502189', '0.506839', '0.505719', '0.501354']
         : correct/total = [(7291, 14232), (7226, 14235), (7340, 14266), (7150, 14217), (7148, 14238), (7244, 14373), (7190, 14346), (7213, 14334), (7104, 14294), (7296, 14373), (7172, 14344), (7233, 14302), (7204, 14354), (7122, 14362), (7082, 14320), (7198, 14395), (7226, 14389), (7226, 14257), (7207, 14251), (7219, 14399)]
         : compromised: 0.5028, honest: 0.5037
Round 008: test acc mean=0.4996 ± 0.0073 | min=0.4868 max=0.5168
         : test loss mean=5.9276 ± 6.7437
         : individual accs = ['0.516793', '0.511907', '0.486752', '0.488218', '0.494873', '0.495999', '0.502370', '0.498884', '0.500700', '0.503722', '0.498397', '0.493847', '0.504110', '0.508495', '0.491271', '0.497464', '0.494822', '0.498001', '0.502842', '0.501910']
         : correct/total = [(7355, 14232), (7287, 14235), (6944, 14266), (6941, 14217), (7046, 14238), (7129, 14373), (7207, 14346), (7151, 14334), (7157, 14294), (7240, 14373), (7149, 14344), (7063, 14302), (7236, 14354), (7303, 14362), (7035, 14320), (7161, 14395), (7120, 14389), (7100, 14257), (7166, 14251), (7227, 14399)]
         : compromised: 0.5008, honest: 0.4987
Round 009: test acc mean=0.4960 ± 0.0059 | min=0.4845 max=0.5071
         : test loss mean=3.3850 ± 2.3101
         : individual accs = ['0.499930', '0.484510', '0.488084', '0.485123', '0.493819', '0.498504', '0.499791', '0.492745', '0.498601', '0.495234', '0.499303', '0.492728', '0.502856', '0.506963', '0.492598', '0.497325', '0.494753', '0.495336', '0.495544', '0.507119']
         : correct/total = [(7115, 14232), (6897, 14235), (6963, 14266), (6897, 14217), (7031, 14238), (7165, 14373), (7170, 14346), (7063, 14334), (7127, 14294), (7118, 14373), (7162, 14344), (7047, 14302), (7218, 14354), (7281, 14362), (7054, 14320), (7159, 14395), (7119, 14389), (7062, 14257), (7062, 14251), (7302, 14399)]
         : compromised: 0.4961, honest: 0.4960
Round 010: test acc mean=0.4981 ± 0.0080 | min=0.4828 max=0.5120
         : test loss mean=3.4851 ± 3.0565
         : individual accs = ['0.492482', '0.483035', '0.503996', '0.497995', '0.499298', '0.499130', '0.502858', '0.492745', '0.499021', '0.512002', '0.499721', '0.482800', '0.508639', '0.506754', '0.501676', '0.483015', '0.504205', '0.493512', '0.498000', '0.500313']
         : correct/total = [(7009, 14232), (6876, 14235), (7190, 14266), (7080, 14217), (7109, 14238), (7174, 14373), (7214, 14346), (7063, 14334), (7133, 14294), (7359, 14373), (7168, 14344), (6905, 14302), (7301, 14354), (7278, 14362), (7184, 14320), (6953, 14395), (7255, 14389), (7036, 14257), (7097, 14251), (7204, 14399)]
         : compromised: 0.4967, honest: 0.4990

=== FINAL RESULTS ===
Dataset: sent140, Nodes: 20, Graph: erdos, Aggregation: d-fedavg
Attack: backdoor, 40.0% compromised
Final accuracy - Compromised: 0.4967, Honest: 0.4990
Overall test accuracy: mean=0.4981 ± 0.0080

=== BACKDOOR ATTACK SUCCESS RATE (ASR) ===
Target label: 1
Trigger size: 3x3
Overall ASR: 0.6176 ± 0.3641
Honest nodes ASR: 0.5753 ± 0.3748
Compromised nodes ASR: 0.6811 ± 0.3376
Note: Higher ASR indicates more successful backdoor attack
