Device: cuda
Seed: 987654321
Loading 1 LEAF Sent140 train files...
LEAF Sent140 train: 254555 users, 908652 samples
Building vocabulary (max_size=10000)...
Vocabulary size: 10000
Loading 1 LEAF Sent140 test files...
LEAF Sent140 test: 254555 users, 286281 samples
Found 254555 train users, 254555 test users, 254555 common users
User sample counts range: 494 (max) to 1 (min)
Distributed ALL 254555 users across 20 clients
Users per client: 12727 (with 15 clients getting +1 user)
Train partition sizes: [44353, 44290, 44657, 44907, 44696, 45843, 45801, 45619, 45069, 45639, 45821, 45311, 45779, 46056, 45625, 45984, 46428, 44737, 45540, 46497]
Test partition sizes: [14232, 14235, 14266, 14217, 14238, 14373, 14346, 14334, 14294, 14373, 14344, 14302, 14354, 14362, 14320, 14395, 14389, 14257, 14251, 14399]
  Client 0: 44353 train samples, 2 unique classes
  Client 1: 44290 train samples, 2 unique classes
  Client 2: 44657 train samples, 2 unique classes
  Client 3: 44907 train samples, 2 unique classes
  Client 4: 44696 train samples, 2 unique classes
  Client 5: 45843 train samples, 2 unique classes
  Client 6: 45801 train samples, 2 unique classes
  Client 7: 45619 train samples, 2 unique classes
  Client 8: 45069 train samples, 2 unique classes
  Client 9: 45639 train samples, 2 unique classes
  Client 10: 45821 train samples, 2 unique classes
  Client 11: 45311 train samples, 2 unique classes
  Client 12: 45779 train samples, 2 unique classes
  Client 13: 46056 train samples, 2 unique classes
  Client 14: 45625 train samples, 2 unique classes
  Client 15: 45984 train samples, 2 unique classes
  Client 16: 46428 train samples, 2 unique classes
  Client 17: 44737 train samples, 2 unique classes
  Client 18: 45540 train samples, 2 unique classes
  Client 19: 46497 train samples, 2 unique classes
Will sample 4500 samples per client per epoch
Graph: erdos, nodes: 20, edges: 99
Degree statistics: avg=9.90, min=7, max=14
Attack: Compromised 10/20 nodes: [1, 2, 5, 11, 12, 13, 14, 15, 17, 18]
Attack type: directed_deviation, lambda: 1.0
Model variant: baseline
Model parameters: 1,174,986
Initial test acc across nodes: mean=0.4965 ± 0.0152
Round 001: test acc mean=0.4998 ± 0.0078 | min=0.4842 max=0.5138
         : test loss mean=5.9770 ± 1.9631
         : individual accs = ['0.507729', '0.484229', '0.486121', '0.501794', '0.504846', '0.502818', '0.506901', '0.496721', '0.506856', '0.513811', '0.500627', '0.510348', '0.501881', '0.493594', '0.496369', '0.486488', '0.496282', '0.495195', '0.500807', '0.503507']
         : correct/total = [(7226, 14232), (6893, 14235), (6935, 14266), (7134, 14217), (7188, 14238), (7227, 14373), (7272, 14346), (7120, 14334), (7245, 14294), (7385, 14373), (7181, 14344), (7299, 14302), (7204, 14354), (7089, 14362), (7108, 14320), (7003, 14395), (7141, 14389), (7060, 14257), (7137, 14251), (7250, 14399)]
         : compromised: 0.4958, honest: 0.5039
Round 002: test acc mean=0.4993 ± 0.0062 | min=0.4851 max=0.5088
         : test loss mean=5.1943 ± 1.6169
         : individual accs = ['0.498876', '0.503829', '0.504696', '0.505029', '0.508850', '0.497321', '0.501673', '0.507604', '0.499300', '0.485076', '0.494353', '0.508670', '0.490874', '0.496867', '0.493506', '0.497464', '0.502537', '0.503051', '0.494492', '0.492812']
         : correct/total = [(7100, 14232), (7172, 14235), (7200, 14266), (7180, 14217), (7245, 14238), (7148, 14373), (7197, 14346), (7276, 14334), (7137, 14294), (6972, 14373), (7091, 14344), (7275, 14302), (7046, 14354), (7136, 14362), (7067, 14320), (7161, 14395), (7231, 14389), (7172, 14257), (7047, 14251), (7096, 14399)]
         : compromised: 0.4991, honest: 0.4996
Round 003: test acc mean=0.5002 ± 0.0101 | min=0.4839 max=0.5195
         : test loss mean=1.0048 ± 0.2467
         : individual accs = ['0.488406', '0.502143', '0.502944', '0.512555', '0.495716', '0.506505', '0.489753', '0.515488', '0.490625', '0.488485', '0.491843', '0.497413', '0.516581', '0.519496', '0.499302', '0.491837', '0.483911', '0.502981', '0.507964', '0.500174']
         : correct/total = [(6951, 14232), (7148, 14235), (7175, 14266), (7287, 14217), (7058, 14238), (7280, 14373), (7026, 14346), (7389, 14334), (7013, 14294), (7021, 14373), (7055, 14344), (7114, 14302), (7415, 14354), (7461, 14362), (7150, 14320), (7080, 14395), (6963, 14389), (7171, 14257), (7239, 14251), (7202, 14399)]
         : compromised: 0.5047, honest: 0.4957
Round 004: test acc mean=0.4987 ± 0.0047 | min=0.4919 max=0.5074
         : test loss mean=2.2852 ± 0.8339
         : individual accs = ['0.504989', '0.506006', '0.496215', '0.499965', '0.502107', '0.496347', '0.494772', '0.502023', '0.499160', '0.503166', '0.500976', '0.495805', '0.501045', '0.491923', '0.493366', '0.493852', '0.492877', '0.507400', '0.500175', '0.492395']
         : correct/total = [(7187, 14232), (7203, 14235), (7079, 14266), (7108, 14217), (7149, 14238), (7134, 14373), (7098, 14346), (7196, 14334), (7135, 14294), (7232, 14373), (7186, 14344), (7091, 14302), (7192, 14354), (7065, 14362), (7065, 14320), (7109, 14395), (7092, 14389), (7234, 14257), (7128, 14251), (7090, 14399)]
         : compromised: 0.4982, honest: 0.4992
Round 005: test acc mean=0.4978 ± 0.0107 | min=0.4819 max=0.5261
         : test loss mean=1.0503 ± 0.3409
         : individual accs = ['0.489812', '0.489146', '0.481915', '0.507843', '0.482020', '0.500174', '0.489962', '0.489884', '0.511473', '0.496278', '0.495468', '0.499790', '0.495332', '0.509191', '0.497067', '0.498437', '0.491417', '0.526057', '0.492316', '0.511911']
         : correct/total = [(6971, 14232), (6963, 14235), (6875, 14266), (7220, 14217), (6863, 14238), (7189, 14373), (7029, 14346), (7022, 14334), (7311, 14294), (7133, 14373), (7107, 14344), (7148, 14302), (7110, 14354), (7313, 14362), (7118, 14320), (7175, 14395), (7071, 14389), (7500, 14257), (7016, 14251), (7371, 14399)]
         : compromised: 0.4989, honest: 0.4966
Round 006: test acc mean=0.5049 ± 0.0057 | min=0.4970 max=0.5223
         : test loss mean=1.5171 ± 0.5552
         : individual accs = ['0.505129', '0.506498', '0.496986', '0.502989', '0.503863', '0.499269', '0.507668', '0.507325', '0.497342', '0.511236', '0.522309', '0.498112', '0.509893', '0.505431', '0.506704', '0.500729', '0.505942', '0.508312', '0.500596', '0.502535']
         : correct/total = [(7189, 14232), (7210, 14235), (7090, 14266), (7151, 14217), (7174, 14238), (7176, 14373), (7283, 14346), (7272, 14334), (7109, 14294), (7348, 14373), (7492, 14344), (7124, 14302), (7319, 14354), (7259, 14362), (7256, 14320), (7208, 14395), (7280, 14389), (7247, 14257), (7134, 14251), (7236, 14399)]
         : compromised: 0.5033, honest: 0.5066
Round 007: test acc mean=0.5049 ± 0.0106 | min=0.4831 max=0.5273
         : test loss mean=0.8636 ± 0.1506
         : individual accs = ['0.504427', '0.509730', '0.506589', '0.514666', '0.507023', '0.502887', '0.505228', '0.503558', '0.488527', '0.495512', '0.493726', '0.483079', '0.514142', '0.511071', '0.501466', '0.504272', '0.489819', '0.518622', '0.527331', '0.515800']
         : correct/total = [(7179, 14232), (7256, 14235), (7227, 14266), (7317, 14217), (7219, 14238), (7228, 14373), (7248, 14346), (7218, 14334), (6983, 14294), (7122, 14373), (7082, 14344), (6909, 14302), (7380, 14354), (7340, 14362), (7181, 14320), (7259, 14395), (7048, 14389), (7394, 14257), (7515, 14251), (7427, 14399)]
         : compromised: 0.5079, honest: 0.5018
Round 008: test acc mean=0.5061 ± 0.0089 | min=0.4936 max=0.5269
         : test loss mean=1.1630 ± 0.3696
         : individual accs = ['0.499719', '0.504391', '0.502874', '0.506225', '0.499789', '0.495652', '0.509689', '0.505790', '0.495383', '0.509288', '0.526910', '0.493637', '0.513376', '0.516989', '0.505168', '0.505036', '0.494892', '0.524374', '0.504315', '0.509480']
         : correct/total = [(7112, 14232), (7180, 14235), (7174, 14266), (7197, 14217), (7116, 14238), (7124, 14373), (7312, 14346), (7250, 14334), (7081, 14294), (7320, 14373), (7558, 14344), (7060, 14302), (7369, 14354), (7425, 14362), (7234, 14320), (7270, 14395), (7121, 14389), (7476, 14257), (7187, 14251), (7336, 14399)]
         : compromised: 0.5066, honest: 0.5057
Round 009: test acc mean=0.5146 ± 0.0158 | min=0.4799 max=0.5432
         : test loss mean=0.7783 ± 0.1109
         : individual accs = ['0.496276', '0.507060', '0.534768', '0.506858', '0.528234', '0.543171', '0.530740', '0.517441', '0.529523', '0.508175', '0.502928', '0.495525', '0.502926', '0.511976', '0.527304', '0.517402', '0.479950', '0.501157', '0.515332', '0.534620']
         : correct/total = [(7063, 14232), (7218, 14235), (7629, 14266), (7206, 14217), (7521, 14238), (7807, 14373), (7614, 14346), (7417, 14334), (7569, 14294), (7304, 14373), (7214, 14344), (7087, 14302), (7219, 14354), (7353, 14362), (7551, 14320), (7448, 14395), (6906, 14389), (7145, 14257), (7344, 14251), (7698, 14399)]
         : compromised: 0.5157, honest: 0.5135
Round 010: test acc mean=0.5078 ± 0.0039 | min=0.4996 max=0.5143
         : test loss mean=0.9499 ± 0.2248
         : individual accs = ['0.505270', '0.512188', '0.502804', '0.507983', '0.510535', '0.507827', '0.503555', '0.509627', '0.504058', '0.507201', '0.512967', '0.499580', '0.504598', '0.505222', '0.505168', '0.514276', '0.509208', '0.509224', '0.511052', '0.514272']
         : correct/total = [(7191, 14232), (7291, 14235), (7173, 14266), (7222, 14217), (7269, 14238), (7299, 14373), (7224, 14346), (7305, 14334), (7205, 14294), (7290, 14373), (7358, 14344), (7145, 14302), (7243, 14354), (7256, 14362), (7234, 14320), (7403, 14395), (7327, 14389), (7260, 14257), (7283, 14251), (7405, 14399)]
         : compromised: 0.5072, honest: 0.5085

=== FINAL RESULTS ===
Dataset: sent140, Nodes: 20, Graph: erdos, Aggregation: krum
Attack: directed_deviation, 50.0% compromised
Final accuracy - Compromised: 0.5072, Honest: 0.5085
Overall test accuracy: mean=0.5078 ± 0.0039
