Device: cuda
Seed: 987654321
Loading 1 LEAF Sent140 train files...
LEAF Sent140 train: 254555 users, 908652 samples
Building vocabulary (max_size=10000)...
Vocabulary size: 10000
Loading 1 LEAF Sent140 test files...
LEAF Sent140 test: 254555 users, 286281 samples
Found 254555 train users, 254555 test users, 254555 common users
User sample counts range: 494 (max) to 1 (min)
Distributed ALL 254555 users across 20 clients
Users per client: 12727 (with 15 clients getting +1 user)
Train partition sizes: [44353, 44290, 44657, 44907, 44696, 45843, 45801, 45619, 45069, 45639, 45821, 45311, 45779, 46056, 45625, 45984, 46428, 44737, 45540, 46497]
Test partition sizes: [14232, 14235, 14266, 14217, 14238, 14373, 14346, 14334, 14294, 14373, 14344, 14302, 14354, 14362, 14320, 14395, 14389, 14257, 14251, 14399]
  Client 0: 44353 train samples, 2 unique classes
  Client 1: 44290 train samples, 2 unique classes
  Client 2: 44657 train samples, 2 unique classes
  Client 3: 44907 train samples, 2 unique classes
  Client 4: 44696 train samples, 2 unique classes
  Client 5: 45843 train samples, 2 unique classes
  Client 6: 45801 train samples, 2 unique classes
  Client 7: 45619 train samples, 2 unique classes
  Client 8: 45069 train samples, 2 unique classes
  Client 9: 45639 train samples, 2 unique classes
  Client 10: 45821 train samples, 2 unique classes
  Client 11: 45311 train samples, 2 unique classes
  Client 12: 45779 train samples, 2 unique classes
  Client 13: 46056 train samples, 2 unique classes
  Client 14: 45625 train samples, 2 unique classes
  Client 15: 45984 train samples, 2 unique classes
  Client 16: 46428 train samples, 2 unique classes
  Client 17: 44737 train samples, 2 unique classes
  Client 18: 45540 train samples, 2 unique classes
  Client 19: 46497 train samples, 2 unique classes
Will sample 4500 samples per client per epoch
Graph: erdos, nodes: 20, edges: 48
Degree statistics: avg=4.80, min=2, max=7
Attack: Compromised 6/20 nodes: [5, 12, 13, 14, 17, 18]
Attack type: krum, lambda: 1.0
Model variant: baseline
Model parameters: 1,174,986
UBAR ALGORITHM (Two-Stage Byzantine-resilient)
  - Model dimension: 1,174,986 parameters
  - Rho parameter: 0.7
  - Stage 1: Distance-based filtering (select 70% closest neighbors)
  - Stage 2: Performance-based selection (loss comparison)
  - Complexity: O(deg(i)×d + deg(i)×inference)
Initial test acc across nodes: mean=0.4965 ± 0.0152
Round 001: test acc mean=0.5289 ± 0.0232 | min=0.4797 max=0.5665
         : test loss mean=0.6916 ± 0.0019
         : individual accs = ['0.536046', '0.554549', '0.518506', '0.523106', '0.546355', '0.535170', '0.509689', '0.563555', '0.533581', '0.543589', '0.515407', '0.558244', '0.566462', '0.520123', '0.543087', '0.510524', '0.511085', '0.524023', '0.485369', '0.479686']
         : correct/total = [(7629, 14232), (7894, 14235), (7397, 14266), (7437, 14217), (7779, 14238), (7692, 14373), (7312, 14346), (8078, 14334), (7627, 14294), (7813, 14373), (7393, 14344), (7984, 14302), (8131, 14354), (7470, 14362), (7777, 14320), (7349, 14395), (7354, 14389), (7471, 14257), (6917, 14251), (6907, 14399)]
         : compromised: 0.5290, honest: 0.5289
         : ubar stats = ['Node 0: s1=0.667, s2=0.250', 'Node 1: s1=0.667, s2=0.500', 'Node 2: s1=0.600, s2=1.000']...
Round 002: test acc mean=0.5449 ± 0.0299 | min=0.4958 max=0.5968
         : test loss mean=0.6897 ± 0.0028
         : individual accs = ['0.588111', '0.514787', '0.507430', '0.526904', '0.561315', '0.586029', '0.527952', '0.594042', '0.560305', '0.528700', '0.555354', '0.596840', '0.523199', '0.509121', '0.495810', '0.544147', '0.525401', '0.543943', '0.572170', '0.536148']
         : correct/total = [(8370, 14232), (7328, 14235), (7239, 14266), (7491, 14217), (7992, 14238), (8423, 14373), (7574, 14346), (8515, 14334), (8009, 14294), (7599, 14373), (7966, 14344), (8536, 14302), (7510, 14354), (7312, 14362), (7100, 14320), (7833, 14395), (7560, 14389), (7755, 14257), (8154, 14251), (7720, 14399)]
         : compromised: 0.5384, honest: 0.5477
         : ubar stats = ['Node 0: s1=0.667, s2=0.250', 'Node 1: s1=0.667, s2=0.375', 'Node 2: s1=0.600, s2=1.000']...
Round 003: test acc mean=0.5427 ± 0.0374 | min=0.4861 max=0.6026
         : test loss mean=0.6870 ± 0.0048
         : individual accs = ['0.600337', '0.561714', '0.486051', '0.576563', '0.589128', '0.558547', '0.538966', '0.565718', '0.602561', '0.578307', '0.558352', '0.561040', '0.499512', '0.508564', '0.495810', '0.538034', '0.499965', '0.503051', '0.488948', '0.543649']
         : correct/total = [(8544, 14232), (7996, 14235), (6934, 14266), (8197, 14217), (8388, 14238), (8028, 14373), (7732, 14346), (8109, 14334), (8613, 14294), (8312, 14373), (8009, 14344), (8024, 14302), (7170, 14354), (7304, 14362), (7100, 14320), (7745, 14395), (7194, 14389), (7172, 14257), (6968, 14251), (7828, 14399)]
         : compromised: 0.5091, honest: 0.5572
         : ubar stats = ['Node 0: s1=0.667, s2=0.250', 'Node 1: s1=0.667, s2=0.333', 'Node 2: s1=0.600, s2=1.000']...
Round 004: test acc mean=0.5570 ± 0.0500 | min=0.4861 max=0.6173
         : test loss mean=0.6825 ± 0.0109
         : individual accs = ['0.616849', '0.487460', '0.486051', '0.605332', '0.607459', '0.507131', '0.536805', '0.596623', '0.617252', '0.609685', '0.602830', '0.502237', '0.499512', '0.508564', '0.495810', '0.599653', '0.511988', '0.572771', '0.578766', '0.598167']
         : correct/total = [(8779, 14232), (6939, 14235), (6934, 14266), (8606, 14217), (8649, 14238), (7289, 14373), (7701, 14346), (8552, 14334), (8823, 14294), (8763, 14373), (8647, 14344), (7183, 14302), (7170, 14354), (7304, 14362), (7100, 14320), (8632, 14395), (7367, 14389), (8166, 14257), (8248, 14251), (8613, 14399)]
         : compromised: 0.5271, honest: 0.5699
         : ubar stats = ['Node 0: s1=0.667, s2=0.250', 'Node 1: s1=0.667, s2=0.312', 'Node 2: s1=0.600, s2=1.000']...
Round 005: test acc mean=0.5603 ± 0.0587 | min=0.4861 max=0.6209
         : test loss mean=0.6802 ± 0.0141
         : individual accs = ['0.613196', '0.489287', '0.486051', '0.618274', '0.620593', '0.493843', '0.497630', '0.614483', '0.619491', '0.620121', '0.613497', '0.492029', '0.500000', '0.510444', '0.495810', '0.584786', '0.499757', '0.607912', '0.607466', '0.620946']
         : correct/total = [(8727, 14232), (6965, 14235), (6934, 14266), (8790, 14217), (8836, 14238), (7098, 14373), (7139, 14346), (8808, 14334), (8855, 14294), (8913, 14373), (8800, 14344), (7037, 14302), (7177, 14354), (7331, 14362), (7100, 14320), (8418, 14395), (7191, 14389), (8667, 14257), (8657, 14251), (8941, 14399)]
         : compromised: 0.5359, honest: 0.5707
         : ubar stats = ['Node 0: s1=0.667, s2=0.250', 'Node 1: s1=0.667, s2=0.350', 'Node 2: s1=0.600, s2=0.933']...
Round 006: test acc mean=0.5712 ± 0.0562 | min=0.4861 max=0.6273
         : test loss mean=0.6763 ± 0.0154
         : individual accs = ['0.613336', '0.601194', '0.486051', '0.627348', '0.612516', '0.506366', '0.497769', '0.608623', '0.613194', '0.626939', '0.623397', '0.502937', '0.499512', '0.610987', '0.495810', '0.543661', '0.499757', '0.617802', '0.610554', '0.627127']
         : correct/total = [(8729, 14232), (8558, 14235), (6934, 14266), (8919, 14217), (8721, 14238), (7278, 14373), (7141, 14346), (8724, 14334), (8765, 14294), (9011, 14373), (8942, 14344), (7193, 14302), (7170, 14354), (8775, 14362), (7100, 14320), (7826, 14395), (7191, 14389), (8808, 14257), (8701, 14251), (9030, 14399)]
         : compromised: 0.5568, honest: 0.5774
         : ubar stats = ['Node 0: s1=0.667, s2=0.250', 'Node 1: s1=0.667, s2=0.333', 'Node 2: s1=0.600, s2=0.944']...
Round 007: test acc mean=0.5863 ± 0.0512 | min=0.4958 max=0.6359
         : test loss mean=0.6711 ± 0.0186
         : individual accs = ['0.629427', '0.613418', '0.601991', '0.531898', '0.619469', '0.570305', '0.497560', '0.615530', '0.630055', '0.635915', '0.624024', '0.614460', '0.502647', '0.625609', '0.495810', '0.547621', '0.499757', '0.618714', '0.621641', '0.629697']
         : correct/total = [(8958, 14232), (8732, 14235), (8588, 14266), (7562, 14217), (8820, 14238), (8197, 14373), (7138, 14346), (8823, 14334), (9006, 14294), (9140, 14373), (8951, 14344), (8788, 14302), (7215, 14354), (8985, 14362), (7100, 14320), (7883, 14395), (7191, 14389), (8821, 14257), (8859, 14251), (9067, 14399)]
         : compromised: 0.5725, honest: 0.5922
         : ubar stats = ['Node 0: s1=0.667, s2=0.250', 'Node 1: s1=0.667, s2=0.357', 'Node 2: s1=0.600, s2=0.905']...
Round 008: test acc mean=0.5921 ± 0.0502 | min=0.4958 max=0.6359
         : test loss mean=0.6680 ± 0.0194
         : individual accs = ['0.635821', '0.620583', '0.596033', '0.540761', '0.618205', '0.623878', '0.497560', '0.627110', '0.634882', '0.630140', '0.627928', '0.586352', '0.577191', '0.618855', '0.495810', '0.498367', '0.520467', '0.633022', '0.622202', '0.635947']
         : correct/total = [(9049, 14232), (8834, 14235), (8503, 14266), (7688, 14217), (8802, 14238), (8967, 14373), (7138, 14346), (8989, 14334), (9075, 14294), (9057, 14373), (9007, 14344), (8386, 14302), (8285, 14354), (8888, 14362), (7100, 14320), (7174, 14395), (7489, 14389), (9025, 14257), (8867, 14251), (9157, 14399)]
         : compromised: 0.5952, honest: 0.5907
         : ubar stats = ['Node 0: s1=0.667, s2=0.250', 'Node 1: s1=0.667, s2=0.344', 'Node 2: s1=0.600, s2=0.917']...
Round 009: test acc mean=0.6035 ± 0.0463 | min=0.4958 max=0.6427
         : test loss mean=0.6642 ± 0.0201
         : individual accs = ['0.642707', '0.626906', '0.619164', '0.593233', '0.630496', '0.632158', '0.520145', '0.631854', '0.637680', '0.624156', '0.632320', '0.597888', '0.625470', '0.623172', '0.495810', '0.503230', '0.541038', '0.629796', '0.626974', '0.636016']
         : correct/total = [(9147, 14232), (8924, 14235), (8833, 14266), (8434, 14217), (8977, 14238), (9086, 14373), (7462, 14346), (9057, 14334), (9115, 14294), (8971, 14373), (9070, 14344), (8551, 14302), (8978, 14354), (8950, 14362), (7100, 14320), (7244, 14395), (7785, 14389), (8979, 14257), (8935, 14251), (9158, 14399)]
         : compromised: 0.6056, honest: 0.6026
         : ubar stats = ['Node 0: s1=0.667, s2=0.250', 'Node 1: s1=0.667, s2=0.417', 'Node 2: s1=0.600, s2=0.926']...
Round 010: test acc mean=0.6129 ± 0.0401 | min=0.4963 max=0.6377
         : test loss mean=0.6607 ± 0.0192
         : individual accs = ['0.635540', '0.629083', '0.624702', '0.588802', '0.636396', '0.634453', '0.620800', '0.634157', '0.637680', '0.624783', '0.628346', '0.609495', '0.628187', '0.619134', '0.496299', '0.498367', '0.617416', '0.631199', '0.629570', '0.634211']
         : correct/total = [(9045, 14232), (8955, 14235), (8912, 14266), (8371, 14217), (9061, 14238), (9119, 14373), (8906, 14346), (9090, 14334), (9115, 14294), (8980, 14373), (9013, 14344), (8717, 14302), (9017, 14354), (8892, 14362), (7107, 14320), (7174, 14395), (8884, 14389), (8999, 14257), (8972, 14251), (9132, 14399)]
         : compromised: 0.6065, honest: 0.6157
         : ubar stats = ['Node 0: s1=0.667, s2=0.250', 'Node 1: s1=0.667, s2=0.475', 'Node 2: s1=0.600, s2=0.933']...

=== FINAL RESULTS ===
Dataset: sent140, Nodes: 20, Graph: erdos, Aggregation: ubar
Attack: krum, 30.0% compromised
Final accuracy - Compromised: 0.6065, Honest: 0.6157
Overall test accuracy: mean=0.6129 ± 0.0401

=== UBAR SUMMARY ===
Node 0: stage1=0.667, stage2=0.250, overall=0.167
Node 1: stage1=0.667, stage2=0.475, overall=0.317
Node 2: stage1=0.600, stage2=0.933, overall=0.560
Node 3: stage1=0.500, stage2=0.600, overall=0.300
Node 4: stage1=0.500, stage2=0.650, overall=0.325
Node 5: stage1=0.600, stage2=0.400, overall=0.240
Node 6: stage1=0.600, stage2=0.633, overall=0.380
Node 7: stage1=0.600, stage2=0.633, overall=0.380
Node 8: stage1=0.500, stage2=1.000, overall=0.500
Node 9: stage1=0.667, stage2=0.500, overall=0.333
Node 10: stage1=0.500, stage2=0.550, overall=0.275
Node 11: stage1=0.571, stage2=0.475, overall=0.271
Node 12: stage1=0.571, stage2=0.500, overall=0.286
Node 13: stage1=0.500, stage2=0.750, overall=0.375
Node 14: stage1=0.571, stage2=0.675, overall=0.386
Node 15: stage1=0.667, stage2=0.300, overall=0.200
Node 16: stage1=0.600, stage2=0.600, overall=0.360
Node 17: stage1=0.600, stage2=0.467, overall=0.280
Node 18: stage1=0.500, stage2=0.550, overall=0.275
Node 19: stage1=0.500, stage2=1.000, overall=0.500

=== PARALLEL EXECUTION TIME (realistic for distributed system) ===
  COMMUNICATION (max across nodes):
    - Full model transfer: 0.000s (0.0%)
  COMPUTATION (max across nodes):
    - Distance computation: 0.029s (53.1%)
    - Loss computation: 0.020s (36.1%)
    - Aggregation: 0.006s (10.8%)
  TOTALS:
    - Total computation: 0.054s (100.0%)
    - Total communication: 0.000s (0.0%)
    - Total parallel time: 0.054s

=== PER-NODE AVERAGE TIME ===
  - Distance computation: 0.020s
  - Loss computation: 0.014s
  - Aggregation: 0.004s
  - Model transfer: 0.000s
  - Total per node: 0.038s

=== TOTAL COMPUTATIONAL WORK (sum across all nodes) ===
  - Total distance computation: 0.404s
  - Total loss computation: 0.283s
  - Total aggregation: 0.080s
  - Total model transfer: 0.000s
  - Grand total: 0.767s
  - Mean Stage 1 acceptance rate: 0.574
  - Mean Stage 2 acceptance rate: 0.597
  - Overall acceptance rate: 0.343

UBAR Algorithm Properties:
  - Model dimension: 1,174,986
  - Rho parameter: 0.7
  - Two-stage approach: Distance filtering + loss evaluation
  - Stage 1 selects: 70% of neighbors
  - Stage 2 uses: Training sample loss comparison
  - Theoretical complexity: O(deg(i)×d + deg(i)×inference)
  - Approach: UBAR paper implementation
