Device: cuda
Seed: 987654321
Loading 1 LEAF Sent140 train files...
LEAF Sent140 train: 254555 users, 908652 samples
Building vocabulary (max_size=10000)...
Vocabulary size: 10000
Loading 1 LEAF Sent140 test files...
LEAF Sent140 test: 254555 users, 286281 samples
Found 254555 train users, 254555 test users, 254555 common users
User sample counts range: 494 (max) to 1 (min)
Distributed ALL 254555 users across 20 clients
Users per client: 12727 (with 15 clients getting +1 user)
Train partition sizes: [44353, 44290, 44657, 44907, 44696, 45843, 45801, 45619, 45069, 45639, 45821, 45311, 45779, 46056, 45625, 45984, 46428, 44737, 45540, 46497]
Test partition sizes: [14232, 14235, 14266, 14217, 14238, 14373, 14346, 14334, 14294, 14373, 14344, 14302, 14354, 14362, 14320, 14395, 14389, 14257, 14251, 14399]
  Client 0: 44353 train samples, 2 unique classes
  Client 1: 44290 train samples, 2 unique classes
  Client 2: 44657 train samples, 2 unique classes
  Client 3: 44907 train samples, 2 unique classes
  Client 4: 44696 train samples, 2 unique classes
  Client 5: 45843 train samples, 2 unique classes
  Client 6: 45801 train samples, 2 unique classes
  Client 7: 45619 train samples, 2 unique classes
  Client 8: 45069 train samples, 2 unique classes
  Client 9: 45639 train samples, 2 unique classes
  Client 10: 45821 train samples, 2 unique classes
  Client 11: 45311 train samples, 2 unique classes
  Client 12: 45779 train samples, 2 unique classes
  Client 13: 46056 train samples, 2 unique classes
  Client 14: 45625 train samples, 2 unique classes
  Client 15: 45984 train samples, 2 unique classes
  Client 16: 46428 train samples, 2 unique classes
  Client 17: 44737 train samples, 2 unique classes
  Client 18: 45540 train samples, 2 unique classes
  Client 19: 46497 train samples, 2 unique classes
Will sample 4500 samples per client per epoch
Graph: erdos, nodes: 20, edges: 99
Degree statistics: avg=9.90, min=7, max=14
Attack: Compromised 4/20 nodes: [5, 12, 13, 17]
Attack type: backdoor, lambda: 1.0
Backdoor target label: 1, trigger size: 3
Model variant: baseline
Model parameters: 1,174,986
Initial test acc across nodes: mean=0.4965 ± 0.0152
Backdoor attack: Created poisoned datasets for 4 compromised nodes
Round 001: test acc mean=0.5000 ± 0.0117 | min=0.4787 max=0.5327
         : test loss mean=1.4465 ± 0.9392
         : individual accs = ['0.510750', '0.512891', '0.513879', '0.490047', '0.532729', '0.501287', '0.486895', '0.497837', '0.490975', '0.506992', '0.498466', '0.493567', '0.502020', '0.491227', '0.496997', '0.497742', '0.510459', '0.490636', '0.478703', '0.495937']
         : correct/total = [(7269, 14232), (7301, 14235), (7331, 14266), (6967, 14217), (7585, 14238), (7205, 14373), (6985, 14346), (7136, 14334), (7018, 14294), (7287, 14373), (7150, 14344), (7059, 14302), (7206, 14354), (7055, 14362), (7117, 14320), (7165, 14395), (7345, 14389), (6995, 14257), (6822, 14251), (7141, 14399)]
         : compromised: 0.4963, honest: 0.5009
Round 002: test acc mean=0.4916 ± 0.0102 | min=0.4743 max=0.5139
         : test loss mean=1.2392 ± 0.5557
         : individual accs = ['0.507167', '0.488865', '0.513879', '0.478441', '0.490518', '0.505810', '0.492890', '0.474257', '0.494753', '0.498574', '0.489682', '0.487344', '0.484046', '0.507520', '0.481844', '0.484196', '0.487108', '0.484744', '0.486843', '0.494201']
         : correct/total = [(7218, 14232), (6959, 14235), (7331, 14266), (6802, 14217), (6984, 14238), (7270, 14373), (7071, 14346), (6798, 14334), (7072, 14294), (7166, 14373), (7024, 14344), (6970, 14302), (6948, 14354), (7289, 14362), (6900, 14320), (6970, 14395), (7009, 14389), (6911, 14257), (6938, 14251), (7116, 14399)]
         : compromised: 0.4955, honest: 0.4907
Round 003: test acc mean=0.5017 ± 0.0115 | min=0.4758 max=0.5236
         : test loss mean=1.0313 ± 0.2600
         : individual accs = ['0.480888', '0.503618', '0.514650', '0.498558', '0.511238', '0.502679', '0.499651', '0.504883', '0.504967', '0.523621', '0.500000', '0.508950', '0.475826', '0.490252', '0.513966', '0.494825', '0.506776', '0.492109', '0.491474', '0.514550']
         : correct/total = [(6844, 14232), (7169, 14235), (7342, 14266), (7088, 14217), (7279, 14238), (7225, 14373), (7168, 14346), (7237, 14334), (7218, 14294), (7526, 14373), (7172, 14344), (7279, 14302), (6830, 14354), (7041, 14362), (7360, 14320), (7123, 14395), (7292, 14389), (7016, 14257), (7004, 14251), (7409, 14399)]
         : compromised: 0.4902, honest: 0.5045
Round 004: test acc mean=0.5096 ± 0.0076 | min=0.4889 max=0.5228
         : test loss mean=1.2660 ± 0.4536
         : individual accs = ['0.506183', '0.519494', '0.488925', '0.508194', '0.508428', '0.515828', '0.505158', '0.511720', '0.511124', '0.496417', '0.510318', '0.512865', '0.506479', '0.522768', '0.521439', '0.507121', '0.511085', '0.513362', '0.505719', '0.509341']
         : correct/total = [(7204, 14232), (7395, 14235), (6975, 14266), (7225, 14217), (7239, 14238), (7414, 14373), (7247, 14346), (7335, 14334), (7306, 14294), (7135, 14373), (7320, 14344), (7335, 14302), (7270, 14354), (7508, 14362), (7467, 14320), (7300, 14395), (7354, 14389), (7319, 14257), (7207, 14251), (7334, 14399)]
         : compromised: 0.5146, honest: 0.5083
Round 005: test acc mean=0.4984 ± 0.0113 | min=0.4796 max=0.5262
         : test loss mean=0.7095 ± 0.0260
         : individual accs = ['0.488758', '0.486266', '0.526216', '0.492439', '0.494100', '0.487442', '0.500627', '0.495884', '0.479642', '0.522577', '0.494702', '0.492938', '0.501184', '0.509330', '0.500209', '0.498367', '0.509417', '0.495546', '0.489860', '0.503160']
         : correct/total = [(6956, 14232), (6922, 14235), (7507, 14266), (7001, 14217), (7035, 14238), (7006, 14373), (7182, 14346), (7108, 14334), (6856, 14294), (7511, 14373), (7096, 14344), (7050, 14302), (7194, 14354), (7315, 14362), (7163, 14320), (7174, 14395), (7330, 14389), (7065, 14257), (6981, 14251), (7245, 14399)]
         : compromised: 0.4984, honest: 0.4984
Round 006: test acc mean=0.4943 ± 0.0070 | min=0.4853 max=0.5116
         : test loss mean=1.4285 ± 0.8460
         : individual accs = ['0.485947', '0.485283', '0.486121', '0.488429', '0.491783', '0.493564', '0.497421', '0.494558', '0.486568', '0.493008', '0.501673', '0.491610', '0.509335', '0.511628', '0.493436', '0.491699', '0.499201', '0.499193', '0.493720', '0.491076']
         : correct/total = [(6916, 14232), (6908, 14235), (6935, 14266), (6944, 14217), (7002, 14238), (7094, 14373), (7136, 14346), (7089, 14334), (6955, 14294), (7086, 14373), (7196, 14344), (7031, 14302), (7311, 14354), (7348, 14362), (7066, 14320), (7078, 14395), (7183, 14389), (7117, 14257), (7036, 14251), (7071, 14399)]
         : compromised: 0.5034, honest: 0.4920
Round 007: test acc mean=0.4957 ± 0.0091 | min=0.4811 max=0.5133
         : test loss mean=0.8897 ± 0.2985
         : individual accs = ['0.492060', '0.487460', '0.511706', '0.482732', '0.493749', '0.496765', '0.492054', '0.490861', '0.487967', '0.513254', '0.500139', '0.481052', '0.505016', '0.510862', '0.490782', '0.490934', '0.498923', '0.500456', '0.486071', '0.500174']
         : correct/total = [(7003, 14232), (6939, 14235), (7300, 14266), (6863, 14217), (7030, 14238), (7140, 14373), (7059, 14346), (7036, 14334), (6975, 14294), (7377, 14373), (7174, 14344), (6880, 14302), (7249, 14354), (7337, 14362), (7028, 14320), (7067, 14395), (7179, 14389), (7135, 14257), (6927, 14251), (7202, 14399)]
         : compromised: 0.5033, honest: 0.4937
Round 008: test acc mean=0.5157 ± 0.0073 | min=0.4926 max=0.5254
         : test loss mean=1.0694 ± 0.5007
         : individual accs = ['0.525436', '0.520618', '0.492570', '0.520715', '0.509692', '0.519307', '0.517217', '0.521976', '0.518819', '0.518472', '0.516104', '0.520277', '0.505991', '0.515875', '0.524372', '0.518930', '0.510251', '0.511538', '0.509227', '0.516494']
         : correct/total = [(7478, 14232), (7411, 14235), (7027, 14266), (7403, 14217), (7257, 14238), (7464, 14373), (7420, 14346), (7482, 14334), (7416, 14294), (7452, 14373), (7403, 14344), (7441, 14302), (7263, 14354), (7409, 14362), (7509, 14320), (7470, 14395), (7342, 14389), (7293, 14257), (7257, 14251), (7437, 14399)]
         : compromised: 0.5132, honest: 0.5163
Round 009: test acc mean=0.5028 ± 0.0124 | min=0.4819 max=0.5337
         : test loss mean=0.7063 ± 0.0238
         : individual accs = ['0.510821', '0.513734', '0.520819', '0.513681', '0.494171', '0.533709', '0.488011', '0.494907', '0.503288', '0.518611', '0.501115', '0.492379', '0.499512', '0.503760', '0.501047', '0.501841', '0.498992', '0.496949', '0.481931', '0.486700']
         : correct/total = [(7270, 14232), (7313, 14235), (7430, 14266), (7303, 14217), (7036, 14238), (7671, 14373), (7001, 14346), (7094, 14334), (7194, 14294), (7454, 14373), (7188, 14344), (7042, 14302), (7170, 14354), (7235, 14362), (7175, 14320), (7224, 14395), (7180, 14389), (7085, 14257), (6868, 14251), (7008, 14399)]
         : compromised: 0.5085, honest: 0.5014
Round 010: test acc mean=0.4976 ± 0.0079 | min=0.4831 max=0.5139
         : test loss mean=1.2621 ± 0.8383
         : individual accs = ['0.483137', '0.484651', '0.513879', '0.492157', '0.493328', '0.493703', '0.498606', '0.498256', '0.492724', '0.507271', '0.502789', '0.495805', '0.500209', '0.512115', '0.497486', '0.501216', '0.498297', '0.504314', '0.487896', '0.493368']
         : correct/total = [(6876, 14232), (6899, 14235), (7331, 14266), (6997, 14217), (7024, 14238), (7096, 14373), (7153, 14346), (7142, 14334), (7043, 14294), (7291, 14373), (7212, 14344), (7091, 14302), (7180, 14354), (7355, 14362), (7124, 14320), (7215, 14395), (7170, 14389), (7190, 14257), (6953, 14251), (7104, 14399)]
         : compromised: 0.5026, honest: 0.4963

=== FINAL RESULTS ===
Dataset: sent140, Nodes: 20, Graph: erdos, Aggregation: d-fedavg
Attack: backdoor, 20.0% compromised
Final accuracy - Compromised: 0.5026, Honest: 0.4963
Overall test accuracy: mean=0.4976 ± 0.0079

=== BACKDOOR ATTACK SUCCESS RATE (ASR) ===
Target label: 1
Trigger size: 3x3
Overall ASR: 0.7734 ± 0.2619
Honest nodes ASR: 0.7483 ± 0.2837
Compromised nodes ASR: 0.8736 ± 0.0917
Note: Higher ASR indicates more successful backdoor attack
