Device: cuda
Seed: 987654321
Loading 1 LEAF Sent140 train files...
LEAF Sent140 train: 254555 users, 908652 samples
Building vocabulary (max_size=10000)...
Vocabulary size: 10000
Loading 1 LEAF Sent140 test files...
LEAF Sent140 test: 254555 users, 286281 samples
Found 254555 train users, 254555 test users, 254555 common users
User sample counts range: 494 (max) to 1 (min)
Distributed ALL 254555 users across 20 clients
Users per client: 12727 (with 15 clients getting +1 user)
Train partition sizes: [44353, 44290, 44657, 44907, 44696, 45843, 45801, 45619, 45069, 45639, 45821, 45311, 45779, 46056, 45625, 45984, 46428, 44737, 45540, 46497]
Test partition sizes: [14232, 14235, 14266, 14217, 14238, 14373, 14346, 14334, 14294, 14373, 14344, 14302, 14354, 14362, 14320, 14395, 14389, 14257, 14251, 14399]
  Client 0: 44353 train samples, 2 unique classes
  Client 1: 44290 train samples, 2 unique classes
  Client 2: 44657 train samples, 2 unique classes
  Client 3: 44907 train samples, 2 unique classes
  Client 4: 44696 train samples, 2 unique classes
  Client 5: 45843 train samples, 2 unique classes
  Client 6: 45801 train samples, 2 unique classes
  Client 7: 45619 train samples, 2 unique classes
  Client 8: 45069 train samples, 2 unique classes
  Client 9: 45639 train samples, 2 unique classes
  Client 10: 45821 train samples, 2 unique classes
  Client 11: 45311 train samples, 2 unique classes
  Client 12: 45779 train samples, 2 unique classes
  Client 13: 46056 train samples, 2 unique classes
  Client 14: 45625 train samples, 2 unique classes
  Client 15: 45984 train samples, 2 unique classes
  Client 16: 46428 train samples, 2 unique classes
  Client 17: 44737 train samples, 2 unique classes
  Client 18: 45540 train samples, 2 unique classes
  Client 19: 46497 train samples, 2 unique classes
Will sample 4500 samples per client per epoch
Graph: erdos, nodes: 20, edges: 48
Degree statistics: avg=4.80, min=2, max=7
Attack: Compromised 4/20 nodes: [5, 12, 13, 17]
Attack type: backdoor, lambda: 1.0
Backdoor target label: 1, trigger size: 3
Model variant: baseline
Model parameters: 1,174,986
BALANCE algorithm:
Balance Config: BALANCEConfig(gamma=2, kappa=1, alpha=0.5, min_neighbors=1)
  - Model dimension: 1,174,986 parameters
  - Complexity: O(N×d) = O(20×1,174,986)
Initial test acc across nodes: mean=0.4965 ± 0.0152
Backdoor attack: Created poisoned datasets for 4 compromised nodes
Round 001: test acc mean=0.5129 ± 0.0253 | min=0.4740 max=0.5686
         : test loss mean=7.3121 ± 13.0274
         : individual accs = ['0.488758', '0.568599', '0.526987', '0.507702', '0.508288', '0.495025', '0.494702', '0.500977', '0.565832', '0.547137', '0.473996', '0.500140', '0.495820', '0.509887', '0.502933', '0.498576', '0.490027', '0.505857', '0.535892', '0.540524']
         : correct/total = [(6956, 14232), (8094, 14235), (7518, 14266), (7218, 14217), (7237, 14238), (7115, 14373), (7097, 14346), (7181, 14334), (8088, 14294), (7864, 14373), (6799, 14344), (7153, 14302), (7117, 14354), (7323, 14362), (7202, 14320), (7177, 14395), (7051, 14389), (7212, 14257), (7637, 14251), (7783, 14399)]
         : compromised: 0.5016, honest: 0.5157
Round 002: test acc mean=0.5069 ± 0.0153 | min=0.4861 max=0.5399
         : test loss mean=264.7034 ± 529.4680
         : individual accs = ['0.517847', '0.500176', '0.486051', '0.528593', '0.539893', '0.499756', '0.517845', '0.516464', '0.537568', '0.492938', '0.501115', '0.507062', '0.495681', '0.501671', '0.518156', '0.488086', '0.501911', '0.498492', '0.489580', '0.499687']
         : correct/total = [(7370, 14232), (7120, 14235), (6934, 14266), (7515, 14217), (7687, 14238), (7183, 14373), (7429, 14346), (7403, 14334), (7684, 14294), (7085, 14373), (7188, 14344), (7252, 14302), (7115, 14354), (7205, 14362), (7420, 14320), (7026, 14395), (7222, 14389), (7107, 14257), (6977, 14251), (7195, 14399)]
         : compromised: 0.4989, honest: 0.5089
Round 003: test acc mean=0.5122 ± 0.0267 | min=0.4861 max=0.5678
         : test loss mean=13599.9291 ± 27556.7451
         : individual accs = ['0.489039', '0.486266', '0.486051', '0.492650', '0.567847', '0.499826', '0.499512', '0.520929', '0.489786', '0.492869', '0.535625', '0.559502', '0.488296', '0.497354', '0.528631', '0.544634', '0.528459', '0.494774', '0.488738', '0.552261']
         : correct/total = [(6960, 14232), (6922, 14235), (6934, 14266), (7004, 14217), (8085, 14238), (7184, 14373), (7166, 14346), (7467, 14334), (7001, 14294), (7084, 14373), (7683, 14344), (8002, 14302), (7009, 14354), (7143, 14362), (7570, 14320), (7840, 14395), (7604, 14389), (7054, 14257), (6965, 14251), (7952, 14399)]
         : compromised: 0.4951, honest: 0.5164
Round 004: test acc mean=0.5112 ± 0.0263 | min=0.4861 max=0.5939
         : test loss mean=1722235.7726 ± 3536698.4130
         : individual accs = ['0.488969', '0.486266', '0.486051', '0.493353', '0.545161', '0.498156', '0.497909', '0.507465', '0.488806', '0.493147', '0.593907', '0.529227', '0.507524', '0.517129', '0.541131', '0.529281', '0.512266', '0.494494', '0.488738', '0.525523']
         : correct/total = [(6959, 14232), (6922, 14235), (6934, 14266), (7014, 14217), (7762, 14238), (7160, 14373), (7143, 14346), (7274, 14334), (6987, 14294), (7088, 14373), (8519, 14344), (7569, 14302), (7285, 14354), (7427, 14362), (7749, 14320), (7619, 14395), (7371, 14389), (7050, 14257), (6965, 14251), (7567, 14399)]
         : compromised: 0.5043, honest: 0.5129
Round 005: test acc mean=0.5036 ± 0.0213 | min=0.4861 max=0.5839
         : test loss mean=108633574.1483 ± 217397865.0858
         : individual accs = ['0.489179', '0.486266', '0.486051', '0.494338', '0.515522', '0.501078', '0.497700', '0.515488', '0.488457', '0.493216', '0.583868', '0.492029', '0.495123', '0.498886', '0.524930', '0.510524', '0.511085', '0.502139', '0.488738', '0.496910']
         : correct/total = [(6962, 14232), (6922, 14235), (6934, 14266), (7028, 14217), (7340, 14238), (7202, 14373), (7140, 14346), (7389, 14334), (6982, 14294), (7089, 14373), (8375, 14344), (7037, 14302), (7107, 14354), (7165, 14362), (7517, 14320), (7349, 14395), (7354, 14389), (7159, 14257), (6965, 14251), (7155, 14399)]
         : compromised: 0.4993, honest: 0.5046
Round 006: test acc mean=0.4986 ± 0.0178 | min=0.4861 max=0.5721
         : test loss mean=7558743144.3544 ± 15312782881.5137
         : individual accs = ['0.489109', '0.486266', '0.486051', '0.493916', '0.495084', '0.493982', '0.497560', '0.508162', '0.488457', '0.493495', '0.572086', '0.492029', '0.488296', '0.498886', '0.499022', '0.500313', '0.501425', '0.501929', '0.488738', '0.496562']
         : correct/total = [(6961, 14232), (6922, 14235), (6934, 14266), (7022, 14217), (7049, 14238), (7100, 14373), (7138, 14346), (7284, 14334), (6982, 14294), (7093, 14373), (8206, 14344), (7037, 14302), (7009, 14354), (7165, 14362), (7146, 14320), (7202, 14395), (7215, 14389), (7156, 14257), (6965, 14251), (7150, 14399)]
         : compromised: 0.4958, honest: 0.4993
Round 007: test acc mean=0.4981 ± 0.0113 | min=0.4861 max=0.5358
         : test loss mean=631199437895.5525 ± 1268061406629.7446
         : individual accs = ['0.489179', '0.486266', '0.486051', '0.492228', '0.494451', '0.493982', '0.497560', '0.507953', '0.488457', '0.493008', '0.535764', '0.492029', '0.497422', '0.510514', '0.510894', '0.499062', '0.504066', '0.496809', '0.488738', '0.496701']
         : correct/total = [(6962, 14232), (6922, 14235), (6934, 14266), (6998, 14217), (7040, 14238), (7100, 14373), (7138, 14346), (7281, 14334), (6982, 14294), (7086, 14373), (7685, 14344), (7037, 14302), (7140, 14354), (7332, 14362), (7316, 14320), (7184, 14395), (7253, 14389), (7083, 14257), (6965, 14251), (7152, 14399)]
         : compromised: 0.4997, honest: 0.4977
Round 008: test acc mean=0.4987 ± 0.0130 | min=0.4861 max=0.5454
         : test loss mean=56052225666666.1875 ± 112300700853820.8906
         : individual accs = ['0.489109', '0.486266', '0.486051', '0.492298', '0.494241', '0.492242', '0.497560', '0.512767', '0.488457', '0.493077', '0.545385', '0.492029', '0.500766', '0.511906', '0.504539', '0.498437', '0.502745', '0.500386', '0.488738', '0.497187']
         : correct/total = [(6961, 14232), (6922, 14235), (6934, 14266), (6999, 14217), (7037, 14238), (7075, 14373), (7138, 14346), (7350, 14334), (6982, 14294), (7087, 14373), (7823, 14344), (7037, 14302), (7188, 14354), (7352, 14362), (7225, 14320), (7175, 14395), (7234, 14389), (7134, 14257), (6965, 14251), (7159, 14399)]
         : compromised: 0.5013, honest: 0.4981
Round 009: test acc mean=0.4955 ± 0.0066 | min=0.4861 max=0.5097
         : test loss mean=4748269791675026.0000 ± 9585797032360012.0000
         : individual accs = ['0.489179', '0.486266', '0.486051', '0.492298', '0.494522', '0.493982', '0.497560', '0.506349', '0.488457', '0.493008', '0.507878', '0.492029', '0.493591', '0.509748', '0.496997', '0.498367', '0.502259', '0.496809', '0.488738', '0.496701']
         : correct/total = [(6962, 14232), (6922, 14235), (6934, 14266), (6999, 14217), (7041, 14238), (7100, 14373), (7138, 14346), (7258, 14334), (6982, 14294), (7086, 14373), (7285, 14344), (7037, 14302), (7085, 14354), (7321, 14362), (7117, 14320), (7174, 14395), (7227, 14389), (7083, 14257), (6965, 14251), (7152, 14399)]
         : compromised: 0.4985, honest: 0.4948
Round 010: test acc mean=0.4998 ± 0.0159 | min=0.4861 max=0.5537
         : test loss mean=390062209690506368.0000 ± 788030636561126528.0000
         : individual accs = ['0.489109', '0.486196', '0.486051', '0.492298', '0.496278', '0.492938', '0.497560', '0.553718', '0.488457', '0.493008', '0.531163', '0.492029', '0.500697', '0.512603', '0.496927', '0.498437', '0.502328', '0.498211', '0.488738', '0.498507']
         : correct/total = [(6961, 14232), (6921, 14235), (6934, 14266), (6999, 14217), (7066, 14238), (7085, 14373), (7138, 14346), (7937, 14334), (6982, 14294), (7086, 14373), (7619, 14344), (7037, 14302), (7187, 14354), (7362, 14362), (7116, 14320), (7175, 14395), (7228, 14389), (7103, 14257), (6965, 14251), (7178, 14399)]
         : compromised: 0.5011, honest: 0.4994

=== FINAL RESULTS ===
Dataset: sent140, Nodes: 20, Graph: erdos, Aggregation: balance
Attack: backdoor, 20.0% compromised
Final accuracy - Compromised: 0.5011, Honest: 0.4994
Overall test accuracy: mean=0.4998 ± 0.0159

=== BACKDOOR ATTACK SUCCESS RATE (ASR) ===
Target label: 1
Trigger size: 3x3
Overall ASR: 0.9871 ± 0.0318
Honest nodes ASR: 0.9869 ± 0.0355
Compromised nodes ASR: 0.9880 ± 0.0041
Note: Higher ASR indicates more successful backdoor attack

=== BALANCE SUMMARY ===
Node 0: acceptance=0.850
Node 1: acceptance=1.000
Node 2: acceptance=1.000
Node 3: acceptance=0.775
Node 4: acceptance=0.775
Node 5: acceptance=0.700
Node 6: acceptance=0.820
Node 7: acceptance=0.640
Node 8: acceptance=1.000
Node 9: acceptance=1.000
Node 10: acceptance=0.775
Node 11: acceptance=0.743
Node 12: acceptance=0.600
Node 13: acceptance=0.600
Node 14: acceptance=0.486
Node 15: acceptance=0.700
Node 16: acceptance=0.640
Node 17: acceptance=0.600
Node 18: acceptance=1.000
Node 19: acceptance=1.000

=== PARALLEL EXECUTION TIME (realistic for distributed system) ===
  COMMUNICATION (max across nodes):
    - Full model transfer: 0.000s (0.0%)
  COMPUTATION (max across nodes):
    - Filtering: 0.032s (71.2%)
    - Aggregation: 0.013s (28.8%)
  TOTALS:
    - Total computation: 0.045s (100.0%)
    - Total communication: 0.000s (0.0%)
    - Total parallel time: 0.045s

=== PER-NODE AVERAGE TIME ===
  - Filtering: 0.023s
  - Aggregation: 0.006s
  - Model transfer: 0.000s
  - Total per node: 0.029s

=== TOTAL COMPUTATIONAL WORK (sum across all nodes) ===
  - Total filtering: 0.463s
  - Total aggregation: 0.124s
  - Total model transfer: 0.000s
  - Grand total: 0.586s
  - Mean acceptance rate: 0.785

BALANCE Algorithm Properties:
  - Model dimension: 1,174,986
  - No compression: Full parameter comparison
  - Theoretical complexity: O(deg(i)×d)
  - Approach: Full parameter filtering + averaging
