Device: cuda
Seed: 987654321
Loading 1 LEAF Sent140 train files...
LEAF Sent140 train: 254555 users, 908652 samples
Building vocabulary (max_size=10000)...
Vocabulary size: 10000
Loading 1 LEAF Sent140 test files...
LEAF Sent140 test: 254555 users, 286281 samples
Found 254555 train users, 254555 test users, 254555 common users
User sample counts range: 494 (max) to 1 (min)
Distributed ALL 254555 users across 20 clients
Users per client: 12727 (with 15 clients getting +1 user)
Train partition sizes: [44353, 44290, 44657, 44907, 44696, 45843, 45801, 45619, 45069, 45639, 45821, 45311, 45779, 46056, 45625, 45984, 46428, 44737, 45540, 46497]
Test partition sizes: [14232, 14235, 14266, 14217, 14238, 14373, 14346, 14334, 14294, 14373, 14344, 14302, 14354, 14362, 14320, 14395, 14389, 14257, 14251, 14399]
  Client 0: 44353 train samples, 2 unique classes
  Client 1: 44290 train samples, 2 unique classes
  Client 2: 44657 train samples, 2 unique classes
  Client 3: 44907 train samples, 2 unique classes
  Client 4: 44696 train samples, 2 unique classes
  Client 5: 45843 train samples, 2 unique classes
  Client 6: 45801 train samples, 2 unique classes
  Client 7: 45619 train samples, 2 unique classes
  Client 8: 45069 train samples, 2 unique classes
  Client 9: 45639 train samples, 2 unique classes
  Client 10: 45821 train samples, 2 unique classes
  Client 11: 45311 train samples, 2 unique classes
  Client 12: 45779 train samples, 2 unique classes
  Client 13: 46056 train samples, 2 unique classes
  Client 14: 45625 train samples, 2 unique classes
  Client 15: 45984 train samples, 2 unique classes
  Client 16: 46428 train samples, 2 unique classes
  Client 17: 44737 train samples, 2 unique classes
  Client 18: 45540 train samples, 2 unique classes
  Client 19: 46497 train samples, 2 unique classes
Will sample 4500 samples per client per epoch
Graph: erdos, nodes: 20, edges: 126
Degree statistics: avg=12.60, min=8, max=16
Attack: Compromised 6/20 nodes: [5, 12, 13, 14, 17, 18]
Attack type: backdoor, lambda: 1.0
Backdoor target label: 1, trigger size: 3
Model variant: baseline
Model parameters: 1,174,986
Sketchguard Node 0:
  Model dim: 1,174,986 → Sketch size: 180
  Compression ratio: 6527.7x
  Using model parameters for aggregation, sketches for filtering
Sketchguard Node 1:
  Model dim: 1,174,986 → Sketch size: 180
  Compression ratio: 6527.7x
  Using model parameters for aggregation, sketches for filtering
Sketchguard Node 2:
  Model dim: 1,174,986 → Sketch size: 180
  Compression ratio: 6527.7x
  Using model parameters for aggregation, sketches for filtering
Sketchguard Node 3:
  Model dim: 1,174,986 → Sketch size: 180
  Compression ratio: 6527.7x
  Using model parameters for aggregation, sketches for filtering
Sketchguard Node 4:
  Model dim: 1,174,986 → Sketch size: 180
  Compression ratio: 6527.7x
  Using model parameters for aggregation, sketches for filtering
Sketchguard Node 5:
  Model dim: 1,174,986 → Sketch size: 180
  Compression ratio: 6527.7x
  Using model parameters for aggregation, sketches for filtering
Sketchguard Node 6:
  Model dim: 1,174,986 → Sketch size: 180
  Compression ratio: 6527.7x
  Using model parameters for aggregation, sketches for filtering
Sketchguard Node 7:
  Model dim: 1,174,986 → Sketch size: 180
  Compression ratio: 6527.7x
  Using model parameters for aggregation, sketches for filtering
Sketchguard Node 8:
  Model dim: 1,174,986 → Sketch size: 180
  Compression ratio: 6527.7x
  Using model parameters for aggregation, sketches for filtering
Sketchguard Node 9:
  Model dim: 1,174,986 → Sketch size: 180
  Compression ratio: 6527.7x
  Using model parameters for aggregation, sketches for filtering
Sketchguard Node 10:
  Model dim: 1,174,986 → Sketch size: 180
  Compression ratio: 6527.7x
  Using model parameters for aggregation, sketches for filtering
Sketchguard Node 11:
  Model dim: 1,174,986 → Sketch size: 180
  Compression ratio: 6527.7x
  Using model parameters for aggregation, sketches for filtering
Sketchguard Node 12:
  Model dim: 1,174,986 → Sketch size: 180
  Compression ratio: 6527.7x
  Using model parameters for aggregation, sketches for filtering
Sketchguard Node 13:
  Model dim: 1,174,986 → Sketch size: 180
  Compression ratio: 6527.7x
  Using model parameters for aggregation, sketches for filtering
Sketchguard Node 14:
  Model dim: 1,174,986 → Sketch size: 180
  Compression ratio: 6527.7x
  Using model parameters for aggregation, sketches for filtering
Sketchguard Node 15:
  Model dim: 1,174,986 → Sketch size: 180
  Compression ratio: 6527.7x
  Using model parameters for aggregation, sketches for filtering
Sketchguard Node 16:
  Model dim: 1,174,986 → Sketch size: 180
  Compression ratio: 6527.7x
  Using model parameters for aggregation, sketches for filtering
Sketchguard Node 17:
  Model dim: 1,174,986 → Sketch size: 180
  Compression ratio: 6527.7x
  Using model parameters for aggregation, sketches for filtering
Sketchguard Node 18:
  Model dim: 1,174,986 → Sketch size: 180
  Compression ratio: 6527.7x
  Using model parameters for aggregation, sketches for filtering
Sketchguard Node 19:
  Model dim: 1,174,986 → Sketch size: 180
  Compression ratio: 6527.7x
  Using model parameters for aggregation, sketches for filtering
Sketchguard ALGORITHM (Sketch-based Filtering + State Aggregation)
  - Model dimension: 1,174,986 parameters
  - Config: SketchguardConfig(gamma=2, kappa=1, alpha=0.5, min_neighbors=1, sketch_size=180, network_seed=987654321, attack_detection_window=5)
  - Sketch size: 180
  - Compression ratio: 6527.7x
  - Complexity: O(d + N×k) = O(1,174,986 + 20×180)
  - Theoretical speedup vs BALANCE: 19.9x
Initial test acc across nodes: mean=0.4953 ± 0.0174
Backdoor attack: Created poisoned datasets for 6 compromised nodes
Round 001: test acc mean=0.5085 ± 0.0157 | min=0.4702 max=0.5350
         : test loss mean=13.6008 ± 20.4754
         : individual accs = ['0.470208', '0.514787', '0.517805', '0.470915', '0.510184', '0.518403', '0.516729', '0.535022', '0.500979', '0.500313', '0.523703', '0.503496', '0.523617', '0.512463', '0.518855', '0.512192', '0.498367', '0.506207', '0.498562', '0.517189']
         : correct/total = [(6692, 14232), (7328, 14235), (7387, 14266), (6695, 14217), (7264, 14238), (7451, 14373), (7413, 14346), (7669, 14334), (7161, 14294), (7191, 14373), (7512, 14344), (7201, 14302), (7516, 14354), (7360, 14362), (7430, 14320), (7373, 14395), (7171, 14389), (7217, 14257), (7105, 14251), (7447, 14399)]
         : compromised: 0.5130, honest: 0.5066
         : sketchguard stats = ['Node 0: acc_rate=1.000', 'Node 1: acc_rate=1.000', 'Node 2: acc_rate=1.000']...
Round 002: test acc mean=0.5557 ± 0.0462 | min=0.4832 max=0.6199
         : test loss mean=136.6557 ± 215.9290
         : individual accs = ['0.598019', '0.483175', '0.576686', '0.598227', '0.566582', '0.505322', '0.598285', '0.585810', '0.600252', '0.533431', '0.596695', '0.619913', '0.496168', '0.494430', '0.499930', '0.574783', '0.577386', '0.501087', '0.501438', '0.606014']
         : correct/total = [(8511, 14232), (6878, 14235), (8227, 14266), (8505, 14217), (8067, 14238), (7263, 14373), (8583, 14346), (8397, 14334), (8580, 14294), (7667, 14373), (8559, 14344), (8866, 14302), (7122, 14354), (7101, 14362), (7159, 14320), (8274, 14395), (8308, 14389), (7144, 14257), (7146, 14251), (8726, 14399)]
         : compromised: 0.4997, honest: 0.5797
         : sketchguard stats = ['Node 0: acc_rate=0.844', 'Node 1: acc_rate=0.909', 'Node 2: acc_rate=0.833']...
Round 003: test acc mean=0.5753 ± 0.0508 | min=0.4942 max=0.6244
         : test loss mean=7501.7759 ± 11891.4630
         : individual accs = ['0.614109', '0.563330', '0.620636', '0.608075', '0.613710', '0.510401', '0.597170', '0.567532', '0.622289', '0.624365', '0.613218', '0.618725', '0.497492', '0.494151', '0.508380', '0.617298', '0.616096', '0.504945', '0.494562', '0.599764']
         : correct/total = [(8740, 14232), (8019, 14235), (8854, 14266), (8645, 14217), (8738, 14238), (7336, 14373), (8567, 14346), (8135, 14334), (8895, 14294), (8974, 14373), (8796, 14344), (8849, 14302), (7141, 14354), (7097, 14362), (7280, 14320), (8886, 14395), (8865, 14389), (7199, 14257), (7048, 14251), (8636, 14399)]
         : compromised: 0.5017, honest: 0.6069
         : sketchguard stats = ['Node 0: acc_rate=0.792', 'Node 1: acc_rate=0.879', 'Node 2: acc_rate=0.778']...
Round 004: test acc mean=0.5949 ± 0.0627 | min=0.4898 max=0.6467
         : test loss mean=1931163.2850 ± 4174685.3449
         : individual accs = ['0.630551', '0.636108', '0.634375', '0.628403', '0.626422', '0.494678', '0.633347', '0.641063', '0.646705', '0.635288', '0.631484', '0.632149', '0.489759', '0.512812', '0.493645', '0.642932', '0.640142', '0.496528', '0.510210', '0.641295']
         : correct/total = [(8974, 14232), (9055, 14235), (9050, 14266), (8934, 14217), (8919, 14238), (7110, 14373), (9086, 14346), (9189, 14334), (9244, 14294), (9131, 14373), (9058, 14344), (9041, 14302), (7030, 14354), (7365, 14362), (7069, 14320), (9255, 14395), (9211, 14389), (7079, 14257), (7271, 14251), (9234, 14399)]
         : compromised: 0.4996, honest: 0.6357
         : sketchguard stats = ['Node 0: acc_rate=0.766', 'Node 1: acc_rate=0.864', 'Node 2: acc_rate=0.750']...
Round 005: test acc mean=0.6020 ± 0.0658 | min=0.4955 max=0.6575
         : test loss mean=46456118.5568 ± 82075407.5015
         : individual accs = ['0.645096', '0.644679', '0.641385', '0.649223', '0.649600', '0.501635', '0.647288', '0.634715', '0.657549', '0.623739', '0.647309', '0.643127', '0.495541', '0.503064', '0.508031', '0.642793', '0.650914', '0.498282', '0.505087', '0.650392']
         : correct/total = [(9181, 14232), (9177, 14235), (9150, 14266), (9230, 14217), (9249, 14238), (7210, 14373), (9286, 14346), (9098, 14334), (9399, 14294), (8965, 14373), (9285, 14344), (9198, 14302), (7113, 14354), (7225, 14362), (7275, 14320), (9253, 14395), (9366, 14389), (7104, 14257), (7198, 14251), (9365, 14399)]
         : compromised: 0.5019, honest: 0.6448
         : sketchguard stats = ['Node 0: acc_rate=0.750', 'Node 1: acc_rate=0.855', 'Node 2: acc_rate=0.733']...
Round 006: test acc mean=0.6089 ± 0.0706 | min=0.4938 max=0.6615
         : test loss mean=2157833123.9581 ± 3593733315.4405
         : individual accs = ['0.652965', '0.654443', '0.650568', '0.656819', '0.655078', '0.502887', '0.657256', '0.656969', '0.661466', '0.654282', '0.653514', '0.644315', '0.503344', '0.509957', '0.500908', '0.652101', '0.659323', '0.493793', '0.496176', '0.661088']
         : correct/total = [(9293, 14232), (9316, 14235), (9281, 14266), (9338, 14217), (9327, 14238), (7228, 14373), (9429, 14346), (9417, 14334), (9455, 14294), (9404, 14373), (9374, 14344), (9215, 14302), (7225, 14354), (7324, 14362), (7173, 14320), (9387, 14395), (9487, 14389), (7040, 14257), (7071, 14251), (9519, 14399)]
         : compromised: 0.5012, honest: 0.6550
         : sketchguard stats = ['Node 0: acc_rate=0.740', 'Node 1: acc_rate=0.848', 'Node 2: acc_rate=0.722']...
Round 007: test acc mean=0.6134 ± 0.0721 | min=0.4973 max=0.6705
         : test loss mean=171196083860.5998 ± 288222055738.6620
         : individual accs = ['0.661748', '0.666596', '0.658489', '0.664275', '0.666386', '0.501218', '0.657675', '0.648040', '0.670491', '0.666388', '0.654350', '0.659628', '0.502996', '0.511419', '0.503701', '0.647100', '0.661061', '0.497300', '0.505158', '0.664352']
         : correct/total = [(9418, 14232), (9489, 14235), (9394, 14266), (9444, 14217), (9488, 14238), (7204, 14373), (9435, 14346), (9289, 14334), (9584, 14294), (9578, 14373), (9386, 14344), (9434, 14302), (7220, 14354), (7345, 14362), (7213, 14320), (9315, 14395), (9512, 14389), (7090, 14257), (7199, 14251), (9566, 14399)]
         : compromised: 0.5036, honest: 0.6605
         : sketchguard stats = ['Node 0: acc_rate=0.732', 'Node 1: acc_rate=0.844', 'Node 2: acc_rate=0.714']...
Round 008: test acc mean=0.6169 ± 0.0765 | min=0.4921 max=0.6775
         : test loss mean=20526359480382.0781 ± 34556698453687.5039
         : individual accs = ['0.668142', '0.664840', '0.643979', '0.672434', '0.654937', '0.507271', '0.677471', '0.673085', '0.676088', '0.668684', '0.666341', '0.661446', '0.500418', '0.492132', '0.501885', '0.664814', '0.670582', '0.496809', '0.504807', '0.671574']
         : correct/total = [(9509, 14232), (9464, 14235), (9187, 14266), (9560, 14217), (9325, 14238), (7291, 14373), (9719, 14346), (9648, 14334), (9664, 14294), (9611, 14373), (9558, 14344), (9460, 14302), (7183, 14354), (7068, 14362), (7187, 14320), (9570, 14395), (9649, 14389), (7083, 14257), (7194, 14251), (9670, 14399)]
         : compromised: 0.5006, honest: 0.6667
         : sketchguard stats = ['Node 0: acc_rate=0.727', 'Node 1: acc_rate=0.841', 'Node 2: acc_rate=0.708']...
Round 009: test acc mean=0.6186 ± 0.0771 | min=0.4934 max=0.6792
         : test loss mean=1428881936843628.7500 ± 2284820542638733.0000
         : individual accs = ['0.642988', '0.674816', '0.670545', '0.677921', '0.670249', '0.501913', '0.674543', '0.673434', '0.677907', '0.669102', '0.641732', '0.664662', '0.502647', '0.503412', '0.502095', '0.670024', '0.679199', '0.507119', '0.493369', '0.674769']
         : correct/total = [(9151, 14232), (9606, 14235), (9566, 14266), (9638, 14217), (9543, 14238), (7214, 14373), (9677, 14346), (9653, 14334), (9690, 14294), (9617, 14373), (9205, 14344), (9506, 14302), (7215, 14354), (7230, 14362), (7190, 14320), (9645, 14395), (9773, 14389), (7230, 14257), (7031, 14251), (9716, 14399)]
         : compromised: 0.5018, honest: 0.6687
         : sketchguard stats = ['Node 0: acc_rate=0.722', 'Node 1: acc_rate=0.838', 'Node 2: acc_rate=0.704']...
Round 010: test acc mean=0.6241 ± 0.0837 | min=0.4867 max=0.6857
         : test loss mean=155209411051441472.0000 ± 266514939000146048.0000
         : individual accs = ['0.681422', '0.681068', '0.658349', '0.682141', '0.684366', '0.505183', '0.684790', '0.685712', '0.680285', '0.675990', '0.680075', '0.677667', '0.503274', '0.486701', '0.487360', '0.668496', '0.682466', '0.491899', '0.506421', '0.679075']
         : correct/total = [(9698, 14232), (9695, 14235), (9392, 14266), (9698, 14217), (9744, 14238), (7261, 14373), (9824, 14346), (9829, 14334), (9724, 14294), (9716, 14373), (9755, 14344), (9692, 14302), (7224, 14354), (6990, 14362), (6979, 14320), (9623, 14395), (9820, 14389), (7013, 14257), (7217, 14251), (9778, 14399)]
         : compromised: 0.4968, honest: 0.6787
         : sketchguard stats = ['Node 0: acc_rate=0.719', 'Node 1: acc_rate=0.836', 'Node 2: acc_rate=0.700']...

=== FINAL RESULTS ===
Dataset: sent140, Nodes: 20, Graph: erdos, Aggregation: sketchguard
Attack: backdoor, 30.0% compromised
Final accuracy - Compromised: 0.4968, Honest: 0.6787
Overall test accuracy: mean=0.6241 ± 0.0837

=== BACKDOOR ATTACK SUCCESS RATE (ASR) ===
Target label: 1
Trigger size: 3x3
Overall ASR: 0.6120 ± 0.2126
Honest nodes ASR: 0.4941 ± 0.0587
Compromised nodes ASR: 0.8871 ± 0.1856
Note: Higher ASR indicates more successful backdoor attack

=== Sketchguard SUMMARY ===
Node 0: acceptance=0.719
Node 1: acceptance=0.836
Node 2: acceptance=0.700
Node 3: acceptance=0.775
Node 4: acceptance=0.755
Node 5: acceptance=0.600
Node 6: acceptance=0.614
Node 7: acceptance=0.679
Node 8: acceptance=0.550
Node 9: acceptance=0.792
Node 10: acceptance=0.700
Node 11: acceptance=0.679
Node 12: acceptance=0.600
Node 13: acceptance=0.600
Node 14: acceptance=0.600
Node 15: acceptance=0.673
Node 16: acceptance=0.654
Node 17: acceptance=0.600
Node 18: acceptance=0.600
Node 19: acceptance=0.662

=== PARALLEL EXECUTION TIME (realistic for distributed system) ===
  COMMUNICATION (max across nodes):
    - Sketch transfer: 0.000s (0.0%)
    - Model fetch (accepted): 0.000s (0.0%)
  COMPUTATION (max across nodes):
    - Sketching: 0.435s (94.2%)
    - Filtering: 0.001s (0.2%)
    - Aggregation: 0.025s (5.5%)
  TOTALS:
    - Total computation: 0.462s (100.0%)
    - Total communication: 0.000s (0.0%)
    - Total parallel time: 0.462s

=== PER-NODE AVERAGE TIME ===
  - Sketching: 0.359s
  - Filtering: 0.001s
  - Aggregation: 0.016s
  - Sketch transfer: 0.000s
  - Model fetch: 0.000s
  - Total per node: 0.375s

=== TOTAL COMPUTATIONAL WORK (sum across all nodes) ===
  - Total sketching: 7.175s
  - Total filtering: 0.013s
  - Total aggregation: 0.321s
  - Total sketch transfer: 0.000s
  - Total model fetch: 0.000s
  - Grand total: 7.509s
  - Mean acceptance rate: 0.669

Sketchguard Algorithm Properties:
  - Original dimension: 1,174,986
  - Sketch size: 180
  - Compression ratio: 19.9x
  - Single repetition: No repetitions needed
  - Theoretical complexity: O(d + N×k)
  - Approach: Sketch filtering + state aggregation
