Device: cuda
Seed: 987654321
Loading 1 LEAF Sent140 train files...
LEAF Sent140 train: 254555 users, 908652 samples
Building vocabulary (max_size=10000)...
Vocabulary size: 10000
Loading 1 LEAF Sent140 test files...
LEAF Sent140 test: 254555 users, 286281 samples
Found 254555 train users, 254555 test users, 254555 common users
User sample counts range: 494 (max) to 1 (min)
Distributed ALL 254555 users across 20 clients
Users per client: 12727 (with 15 clients getting +1 user)
Train partition sizes: [44353, 44290, 44657, 44907, 44696, 45843, 45801, 45619, 45069, 45639, 45821, 45311, 45779, 46056, 45625, 45984, 46428, 44737, 45540, 46497]
Test partition sizes: [14232, 14235, 14266, 14217, 14238, 14373, 14346, 14334, 14294, 14373, 14344, 14302, 14354, 14362, 14320, 14395, 14389, 14257, 14251, 14399]
  Client 0: 44353 train samples, 2 unique classes
  Client 1: 44290 train samples, 2 unique classes
  Client 2: 44657 train samples, 2 unique classes
  Client 3: 44907 train samples, 2 unique classes
  Client 4: 44696 train samples, 2 unique classes
  Client 5: 45843 train samples, 2 unique classes
  Client 6: 45801 train samples, 2 unique classes
  Client 7: 45619 train samples, 2 unique classes
  Client 8: 45069 train samples, 2 unique classes
  Client 9: 45639 train samples, 2 unique classes
  Client 10: 45821 train samples, 2 unique classes
  Client 11: 45311 train samples, 2 unique classes
  Client 12: 45779 train samples, 2 unique classes
  Client 13: 46056 train samples, 2 unique classes
  Client 14: 45625 train samples, 2 unique classes
  Client 15: 45984 train samples, 2 unique classes
  Client 16: 46428 train samples, 2 unique classes
  Client 17: 44737 train samples, 2 unique classes
  Client 18: 45540 train samples, 2 unique classes
  Client 19: 46497 train samples, 2 unique classes
Will sample 4500 samples per client per epoch
Graph: fully, nodes: 20, edges: 190
Degree statistics: avg=19.00, min=19, max=19
Attack: Compromised 4/20 nodes: [5, 12, 13, 17]
Attack type: directed_deviation, lambda: 1.0
Model variant: baseline
Model parameters: 1,174,986
BALANCE algorithm:
Balance Config: BALANCEConfig(gamma=2, kappa=1, alpha=0.5, min_neighbors=1)
  - Model dimension: 1,174,986 parameters
  - Complexity: O(N×d) = O(20×1,174,986)
Initial test acc across nodes: mean=0.4965 ± 0.0152
Round 001: test acc mean=0.5034 ± 0.0104 | min=0.4864 max=0.5234
         : test loss mean=0.7456 ± 0.0418
         : individual accs = ['0.487774', '0.489006', '0.495864', '0.514736', '0.523388', '0.501148', '0.500558', '0.506558', '0.511683', '0.504001', '0.511921', '0.486366', '0.500488', '0.492759', '0.505168', '0.504203', '0.506846', '0.492670', '0.509929', '0.523300']
         : correct/total = [(6942, 14232), (6961, 14235), (7074, 14266), (7318, 14217), (7452, 14238), (7203, 14373), (7181, 14346), (7261, 14334), (7314, 14294), (7244, 14373), (7343, 14344), (6956, 14302), (7184, 14354), (7077, 14362), (7234, 14320), (7258, 14395), (7293, 14389), (7024, 14257), (7267, 14251), (7535, 14399)]
         : compromised: 0.4968, honest: 0.5051
Round 002: test acc mean=0.5220 ± 0.0245 | min=0.5002 max=0.5868
         : test loss mean=0.6913 ± 0.0013
         : individual accs = ['0.512718', '0.517176', '0.518085', '0.571288', '0.509552', '0.504001', '0.521748', '0.586787', '0.546523', '0.563278', '0.503416', '0.521955', '0.500906', '0.511628', '0.504260', '0.524835', '0.500174', '0.502490', '0.515473', '0.503993']
         : correct/total = [(7297, 14232), (7362, 14235), (7391, 14266), (8122, 14217), (7255, 14238), (7244, 14373), (7485, 14346), (8411, 14334), (7812, 14294), (8096, 14373), (7221, 14344), (7465, 14302), (7190, 14354), (7348, 14362), (7221, 14320), (7555, 14395), (7197, 14389), (7164, 14257), (7346, 14251), (7257, 14399)]
         : compromised: 0.5048, honest: 0.5263
Round 003: test acc mean=0.5127 ± 0.0202 | min=0.4907 max=0.5706
         : test loss mean=0.6928 ± 0.0003
         : individual accs = ['0.490655', '0.513804', '0.513949', '0.510727', '0.505900', '0.493843', '0.506274', '0.546044', '0.511683', '0.570584', '0.502928', '0.513495', '0.500488', '0.508425', '0.504190', '0.502744', '0.501008', '0.496949', '0.555961', '0.503646']
         : correct/total = [(6983, 14232), (7314, 14235), (7332, 14266), (7261, 14217), (7203, 14238), (7098, 14373), (7263, 14346), (7827, 14334), (7314, 14294), (8201, 14373), (7214, 14344), (7344, 14302), (7184, 14354), (7302, 14362), (7220, 14320), (7237, 14395), (7209, 14389), (7085, 14257), (7923, 14251), (7252, 14399)]
         : compromised: 0.4999, honest: 0.5158
Round 004: test acc mean=0.4961 ± 0.0073 | min=0.4861 max=0.5178
         : test loss mean=0.6932 ± 0.0001
         : individual accs = ['0.489109', '0.486126', '0.489345', '0.492228', '0.517769', '0.493843', '0.497560', '0.495186', '0.488247', '0.492729', '0.499024', '0.491749', '0.499512', '0.508564', '0.495461', '0.498367', '0.499618', '0.503051', '0.488597', '0.496284']
         : correct/total = [(6961, 14232), (6920, 14235), (6981, 14266), (6998, 14217), (7372, 14238), (7098, 14373), (7138, 14346), (7098, 14334), (6979, 14294), (7082, 14373), (7158, 14344), (7033, 14302), (7170, 14354), (7304, 14362), (7095, 14320), (7174, 14395), (7189, 14389), (7172, 14257), (6963, 14251), (7146, 14399)]
         : compromised: 0.5012, honest: 0.4948
Round 005: test acc mean=0.4949 ± 0.0056 | min=0.4861 max=0.5086
         : test loss mean=0.6936 ± 0.0003
         : individual accs = ['0.489109', '0.486266', '0.486051', '0.492228', '0.494100', '0.493843', '0.497560', '0.495186', '0.488457', '0.493008', '0.499024', '0.492029', '0.499512', '0.508564', '0.495810', '0.498367', '0.499757', '0.503051', '0.488738', '0.496354']
         : correct/total = [(6961, 14232), (6922, 14235), (6934, 14266), (6998, 14217), (7035, 14238), (7098, 14373), (7138, 14346), (7098, 14334), (6982, 14294), (7086, 14373), (7158, 14344), (7037, 14302), (7170, 14354), (7304, 14362), (7100, 14320), (7174, 14395), (7191, 14389), (7172, 14257), (6965, 14251), (7147, 14399)]
         : compromised: 0.5012, honest: 0.4933
Round 006: test acc mean=0.4949 ± 0.0056 | min=0.4861 max=0.5086
         : test loss mean=0.6938 ± 0.0003
         : individual accs = ['0.489109', '0.486266', '0.486051', '0.492228', '0.494100', '0.493843', '0.497560', '0.495186', '0.488457', '0.493008', '0.499024', '0.492029', '0.499512', '0.508564', '0.495810', '0.498367', '0.499757', '0.503051', '0.488738', '0.496354']
         : correct/total = [(6961, 14232), (6922, 14235), (6934, 14266), (6998, 14217), (7035, 14238), (7098, 14373), (7138, 14346), (7098, 14334), (6982, 14294), (7086, 14373), (7158, 14344), (7037, 14302), (7170, 14354), (7304, 14362), (7100, 14320), (7174, 14395), (7191, 14389), (7172, 14257), (6965, 14251), (7147, 14399)]
         : compromised: 0.5012, honest: 0.4933
Round 007: test acc mean=0.4949 ± 0.0056 | min=0.4861 max=0.5086
         : test loss mean=0.6938 ± 0.0003
         : individual accs = ['0.489109', '0.486266', '0.486051', '0.492228', '0.494100', '0.493843', '0.497560', '0.495186', '0.488457', '0.493008', '0.499024', '0.492029', '0.499512', '0.508564', '0.495810', '0.498367', '0.499757', '0.503051', '0.488738', '0.496354']
         : correct/total = [(6961, 14232), (6922, 14235), (6934, 14266), (6998, 14217), (7035, 14238), (7098, 14373), (7138, 14346), (7098, 14334), (6982, 14294), (7086, 14373), (7158, 14344), (7037, 14302), (7170, 14354), (7304, 14362), (7100, 14320), (7174, 14395), (7191, 14389), (7172, 14257), (6965, 14251), (7147, 14399)]
         : compromised: 0.5012, honest: 0.4933
Round 008: test acc mean=0.4949 ± 0.0056 | min=0.4861 max=0.5086
         : test loss mean=0.6938 ± 0.0003
         : individual accs = ['0.489109', '0.486266', '0.486051', '0.492228', '0.494100', '0.493843', '0.497560', '0.495186', '0.488457', '0.493008', '0.499024', '0.492029', '0.499512', '0.508564', '0.495810', '0.498367', '0.499757', '0.503051', '0.488738', '0.496354']
         : correct/total = [(6961, 14232), (6922, 14235), (6934, 14266), (6998, 14217), (7035, 14238), (7098, 14373), (7138, 14346), (7098, 14334), (6982, 14294), (7086, 14373), (7158, 14344), (7037, 14302), (7170, 14354), (7304, 14362), (7100, 14320), (7174, 14395), (7191, 14389), (7172, 14257), (6965, 14251), (7147, 14399)]
         : compromised: 0.5012, honest: 0.4933
Round 009: test acc mean=0.4949 ± 0.0056 | min=0.4861 max=0.5086
         : test loss mean=0.6938 ± 0.0004
         : individual accs = ['0.489109', '0.486266', '0.486051', '0.492228', '0.494100', '0.493843', '0.497560', '0.495186', '0.488457', '0.493008', '0.499024', '0.492029', '0.499512', '0.508564', '0.495810', '0.498367', '0.499757', '0.503051', '0.488738', '0.496354']
         : correct/total = [(6961, 14232), (6922, 14235), (6934, 14266), (6998, 14217), (7035, 14238), (7098, 14373), (7138, 14346), (7098, 14334), (6982, 14294), (7086, 14373), (7158, 14344), (7037, 14302), (7170, 14354), (7304, 14362), (7100, 14320), (7174, 14395), (7191, 14389), (7172, 14257), (6965, 14251), (7147, 14399)]
         : compromised: 0.5012, honest: 0.4933
Round 010: test acc mean=0.4949 ± 0.0056 | min=0.4861 max=0.5086
         : test loss mean=0.6938 ± 0.0004
         : individual accs = ['0.489109', '0.486266', '0.486051', '0.492228', '0.494100', '0.493843', '0.497560', '0.495186', '0.488457', '0.493008', '0.499024', '0.492029', '0.499512', '0.508564', '0.495810', '0.498367', '0.499757', '0.503051', '0.488738', '0.496354']
         : correct/total = [(6961, 14232), (6922, 14235), (6934, 14266), (6998, 14217), (7035, 14238), (7098, 14373), (7138, 14346), (7098, 14334), (6982, 14294), (7086, 14373), (7158, 14344), (7037, 14302), (7170, 14354), (7304, 14362), (7100, 14320), (7174, 14395), (7191, 14389), (7172, 14257), (6965, 14251), (7147, 14399)]
         : compromised: 0.5012, honest: 0.4933

=== FINAL RESULTS ===
Dataset: sent140, Nodes: 20, Graph: fully, Aggregation: balance
Attack: directed_deviation, 20.0% compromised
Final accuracy - Compromised: 0.5012, Honest: 0.4933
Overall test accuracy: mean=0.4949 ± 0.0056

=== BALANCE SUMMARY ===
Node 0: acceptance=0.811
Node 1: acceptance=0.811
Node 2: acceptance=0.811
Node 3: acceptance=0.811
Node 4: acceptance=0.811
Node 5: acceptance=0.858
Node 6: acceptance=0.811
Node 7: acceptance=0.811
Node 8: acceptance=0.811
Node 9: acceptance=0.811
Node 10: acceptance=0.811
Node 11: acceptance=0.811
Node 12: acceptance=0.858
Node 13: acceptance=0.858
Node 14: acceptance=0.811
Node 15: acceptance=0.811
Node 16: acceptance=0.811
Node 17: acceptance=0.858
Node 18: acceptance=0.811
Node 19: acceptance=0.811

=== PARALLEL EXECUTION TIME (realistic for distributed system) ===
  COMMUNICATION (max across nodes):
    - Full model transfer: 0.000s (0.0%)
  COMPUTATION (max across nodes):
    - Filtering: 0.087s (82.7%)
    - Aggregation: 0.018s (17.3%)
  TOTALS:
    - Total computation: 0.105s (100.0%)
    - Total communication: 0.000s (0.0%)
    - Total parallel time: 0.105s

=== PER-NODE AVERAGE TIME ===
  - Filtering: 0.080s
  - Aggregation: 0.012s
  - Model transfer: 0.000s
  - Total per node: 0.092s

=== TOTAL COMPUTATIONAL WORK (sum across all nodes) ===
  - Total filtering: 1.601s
  - Total aggregation: 0.245s
  - Total model transfer: 0.000s
  - Grand total: 1.846s
  - Mean acceptance rate: 0.820

BALANCE Algorithm Properties:
  - Model dimension: 1,174,986
  - No compression: Full parameter comparison
  - Theoretical complexity: O(deg(i)×d)
  - Approach: Full parameter filtering + averaging
