Device: cuda
Seed: 987654321
Loading 1 LEAF Sent140 train files...
LEAF Sent140 train: 254555 users, 908652 samples
Building vocabulary (max_size=10000)...
Vocabulary size: 10000
Loading 1 LEAF Sent140 test files...
LEAF Sent140 test: 254555 users, 286281 samples
Found 254555 train users, 254555 test users, 254555 common users
User sample counts range: 494 (max) to 1 (min)
Distributed ALL 254555 users across 20 clients
Users per client: 12727 (with 15 clients getting +1 user)
Train partition sizes: [44353, 44290, 44657, 44907, 44696, 45843, 45801, 45619, 45069, 45639, 45821, 45311, 45779, 46056, 45625, 45984, 46428, 44737, 45540, 46497]
Test partition sizes: [14232, 14235, 14266, 14217, 14238, 14373, 14346, 14334, 14294, 14373, 14344, 14302, 14354, 14362, 14320, 14395, 14389, 14257, 14251, 14399]
  Client 0: 44353 train samples, 2 unique classes
  Client 1: 44290 train samples, 2 unique classes
  Client 2: 44657 train samples, 2 unique classes
  Client 3: 44907 train samples, 2 unique classes
  Client 4: 44696 train samples, 2 unique classes
  Client 5: 45843 train samples, 2 unique classes
  Client 6: 45801 train samples, 2 unique classes
  Client 7: 45619 train samples, 2 unique classes
  Client 8: 45069 train samples, 2 unique classes
  Client 9: 45639 train samples, 2 unique classes
  Client 10: 45821 train samples, 2 unique classes
  Client 11: 45311 train samples, 2 unique classes
  Client 12: 45779 train samples, 2 unique classes
  Client 13: 46056 train samples, 2 unique classes
  Client 14: 45625 train samples, 2 unique classes
  Client 15: 45984 train samples, 2 unique classes
  Client 16: 46428 train samples, 2 unique classes
  Client 17: 44737 train samples, 2 unique classes
  Client 18: 45540 train samples, 2 unique classes
  Client 19: 46497 train samples, 2 unique classes
Will sample 4500 samples per client per epoch
Graph: erdos, nodes: 20, edges: 126
Degree statistics: avg=12.60, min=8, max=16
Attack: Compromised 6/20 nodes: [5, 12, 13, 14, 17, 18]
Attack type: krum, lambda: 1.0
Model variant: baseline
Model parameters: 1,174,986
BALANCE algorithm:
Balance Config: BALANCEConfig(gamma=2, kappa=1, alpha=0.5, min_neighbors=1)
  - Model dimension: 1,174,986 parameters
  - Complexity: O(N×d) = O(20×1,174,986)
Initial test acc across nodes: mean=0.4965 ± 0.0152
Round 001: test acc mean=0.4985 ± 0.0083 | min=0.4869 max=0.5183
         : test loss mean=0.9825 ± 0.2635
         : individual accs = ['0.498665', '0.489146', '0.489836', '0.494900', '0.510395', '0.502818', '0.496166', '0.518348', '0.510634', '0.496347', '0.499024', '0.500629', '0.497910', '0.510026', '0.486941', '0.498090', '0.491417', '0.487550', '0.492597', '0.499410']
         : correct/total = [(7097, 14232), (6963, 14235), (6988, 14266), (7036, 14217), (7267, 14238), (7227, 14373), (7118, 14346), (7430, 14334), (7299, 14294), (7134, 14373), (7158, 14344), (7160, 14302), (7147, 14354), (7325, 14362), (6973, 14320), (7170, 14395), (7071, 14389), (6951, 14257), (7020, 14251), (7191, 14399)]
         : compromised: 0.4963, honest: 0.4995
Round 002: test acc mean=0.5085 ± 0.0138 | min=0.4913 max=0.5458
         : test loss mean=0.6957 ± 0.0055
         : individual accs = ['0.506605', '0.535792', '0.512057', '0.493142', '0.510816', '0.500522', '0.517148', '0.506976', '0.513152', '0.505670', '0.499651', '0.500839', '0.545771', '0.513299', '0.499930', '0.524696', '0.504622', '0.491338', '0.491825', '0.496493']
         : correct/total = [(7210, 14232), (7627, 14235), (7305, 14266), (7011, 14217), (7273, 14238), (7194, 14373), (7419, 14346), (7267, 14334), (7335, 14294), (7268, 14373), (7167, 14344), (7163, 14302), (7834, 14354), (7372, 14362), (7159, 14320), (7553, 14395), (7261, 14389), (7005, 14257), (7009, 14251), (7149, 14399)]
         : compromised: 0.5071, honest: 0.5091
Round 003: test acc mean=0.5094 ± 0.0198 | min=0.4877 max=0.5547
         : test loss mean=0.6923 ± 0.0017
         : individual accs = ['0.509767', '0.487671', '0.489696', '0.495604', '0.532097', '0.496556', '0.502788', '0.545626', '0.554708', '0.492938', '0.548871', '0.512586', '0.502717', '0.493107', '0.492668', '0.506773', '0.514073', '0.503472', '0.494632', '0.511563']
         : correct/total = [(7255, 14232), (6942, 14235), (6986, 14266), (7046, 14217), (7576, 14238), (7137, 14373), (7213, 14346), (7821, 14334), (7929, 14294), (7085, 14373), (7873, 14344), (7331, 14302), (7216, 14354), (7082, 14362), (7055, 14320), (7295, 14395), (7397, 14389), (7178, 14257), (7049, 14251), (7366, 14399)]
         : compromised: 0.4972, honest: 0.5146
Round 004: test acc mean=0.5133 ± 0.0266 | min=0.4852 max=0.5658
         : test loss mean=0.6924 ± 0.0014
         : individual accs = ['0.500422', '0.486477', '0.485210', '0.492298', '0.494381', '0.493843', '0.497560', '0.542277', '0.559745', '0.493773', '0.549637', '0.492379', '0.513585', '0.508564', '0.495740', '0.565821', '0.554868', '0.503051', '0.496877', '0.539760']
         : correct/total = [(7122, 14232), (6925, 14235), (6922, 14266), (6999, 14217), (7039, 14238), (7098, 14373), (7138, 14346), (7773, 14334), (8001, 14294), (7097, 14373), (7884, 14344), (7042, 14302), (7372, 14354), (7304, 14362), (7099, 14320), (8145, 14395), (7984, 14389), (7172, 14257), (7081, 14251), (7772, 14399)]
         : compromised: 0.5019, honest: 0.5182
Round 005: test acc mean=0.5048 ± 0.0167 | min=0.4865 max=0.5453
         : test loss mean=0.6919 ± 0.0011
         : individual accs = ['0.493536', '0.490341', '0.486471', '0.492720', '0.495224', '0.493773', '0.497839', '0.517929', '0.545264', '0.498087', '0.502091', '0.491679', '0.499652', '0.509957', '0.495880', '0.541369', '0.535201', '0.502911', '0.497158', '0.509619']
         : correct/total = [(7024, 14232), (6980, 14235), (6940, 14266), (7005, 14217), (7051, 14238), (7097, 14373), (7142, 14346), (7424, 14334), (7794, 14294), (7159, 14373), (7202, 14344), (7032, 14302), (7172, 14354), (7324, 14362), (7101, 14320), (7793, 14395), (7701, 14389), (7170, 14257), (7085, 14251), (7338, 14399)]
         : compromised: 0.4999, honest: 0.5070
Round 006: test acc mean=0.5150 ± 0.0146 | min=0.4973 max=0.5628
         : test loss mean=0.6903 ± 0.0011
         : individual accs = ['0.505902', '0.505374', '0.510024', '0.506928', '0.504144', '0.504070', '0.506622', '0.516046', '0.562754', '0.511584', '0.522379', '0.507971', '0.519855', '0.511837', '0.497346', '0.536228', '0.535339', '0.507189', '0.510140', '0.518300']
         : correct/total = [(7200, 14232), (7194, 14235), (7276, 14266), (7207, 14217), (7178, 14238), (7245, 14373), (7268, 14346), (7397, 14334), (8044, 14294), (7353, 14373), (7493, 14344), (7265, 14302), (7462, 14354), (7351, 14362), (7122, 14320), (7719, 14395), (7703, 14389), (7231, 14257), (7270, 14251), (7463, 14399)]
         : compromised: 0.5084, honest: 0.5178
Round 007: test acc mean=0.5479 ± 0.0117 | min=0.5322 max=0.5736
         : test loss mean=0.6868 ± 0.0012
         : individual accs = ['0.568929', '0.537197', '0.550610', '0.534782', '0.550428', '0.533987', '0.538896', '0.543951', '0.573597', '0.533779', '0.555354', '0.540833', '0.543124', '0.553962', '0.538827', '0.559222', '0.557787', '0.532230', '0.558487', '0.552677']
         : correct/total = [(8097, 14232), (7647, 14235), (7855, 14266), (7603, 14217), (7837, 14238), (7675, 14373), (7731, 14346), (7797, 14334), (8199, 14294), (7672, 14373), (7966, 14344), (7735, 14302), (7796, 14354), (7956, 14362), (7716, 14320), (8050, 14395), (8026, 14389), (7588, 14257), (7959, 14251), (7958, 14399)]
         : compromised: 0.5434, honest: 0.5499
Round 008: test acc mean=0.5777 ± 0.0081 | min=0.5641 max=0.5937
         : test loss mean=0.6801 ± 0.0017
         : individual accs = ['0.574199', '0.573305', '0.564139', '0.587114', '0.573184', '0.568844', '0.571239', '0.567671', '0.593746', '0.567940', '0.586447', '0.576982', '0.591682', '0.574154', '0.578701', '0.584925', '0.585169', '0.575366', '0.579819', '0.580249']
         : correct/total = [(8172, 14232), (8161, 14235), (8048, 14266), (8347, 14217), (8161, 14238), (8176, 14373), (8195, 14346), (8137, 14334), (8487, 14294), (8163, 14373), (8412, 14344), (8252, 14302), (8493, 14354), (8246, 14362), (8287, 14320), (8420, 14395), (8420, 14389), (8203, 14257), (8263, 14251), (8355, 14399)]
         : compromised: 0.5781, honest: 0.5776
Round 009: test acc mean=0.5966 ± 0.0036 | min=0.5898 max=0.6038
         : test loss mean=0.6697 ± 0.0017
         : individual accs = ['0.596473', '0.595434', '0.592458', '0.603784', '0.594817', '0.592848', '0.597309', '0.594461', '0.600532', '0.597857', '0.600530', '0.596210', '0.596349', '0.603050', '0.589804', '0.600834', '0.593995', '0.595006', '0.592520', '0.598583']
         : correct/total = [(8489, 14232), (8476, 14235), (8452, 14266), (8584, 14217), (8469, 14238), (8521, 14373), (8569, 14346), (8521, 14334), (8584, 14294), (8593, 14373), (8614, 14344), (8527, 14302), (8560, 14354), (8661, 14362), (8446, 14320), (8649, 14395), (8547, 14389), (8483, 14257), (8444, 14251), (8619, 14399)]
         : compromised: 0.5949, honest: 0.5974
Round 010: test acc mean=0.6102 ± 0.0032 | min=0.6055 max=0.6159
         : test loss mean=0.6599 ± 0.0014
         : individual accs = ['0.607504', '0.613699', '0.606617', '0.610677', '0.613078', '0.612816', '0.605813', '0.607228', '0.615923', '0.613164', '0.612033', '0.607887', '0.614184', '0.613215', '0.607402', '0.608823', '0.605463', '0.611489', '0.605852', '0.610945']
         : correct/total = [(8646, 14232), (8736, 14235), (8654, 14266), (8682, 14217), (8729, 14238), (8808, 14373), (8691, 14346), (8704, 14334), (8804, 14294), (8813, 14373), (8779, 14344), (8694, 14302), (8816, 14354), (8807, 14362), (8698, 14320), (8764, 14395), (8712, 14389), (8718, 14257), (8634, 14251), (8797, 14399)]
         : compromised: 0.6108, honest: 0.6099

=== FINAL RESULTS ===
Dataset: sent140, Nodes: 20, Graph: erdos, Aggregation: balance
Attack: krum, 30.0% compromised
Final accuracy - Compromised: 0.6108, Honest: 0.6099
Overall test accuracy: mean=0.6102 ± 0.0032

=== BALANCE SUMMARY ===
Node 0: acceptance=0.719
Node 1: acceptance=0.836
Node 2: acceptance=0.700
Node 3: acceptance=0.775
Node 4: acceptance=0.755
Node 5: acceptance=0.700
Node 6: acceptance=0.614
Node 7: acceptance=0.679
Node 8: acceptance=0.550
Node 9: acceptance=0.792
Node 10: acceptance=0.700
Node 11: acceptance=0.679
Node 12: acceptance=0.775
Node 13: acceptance=0.792
Node 14: acceptance=0.700
Node 15: acceptance=0.673
Node 16: acceptance=0.654
Node 17: acceptance=0.800
Node 18: acceptance=0.775
Node 19: acceptance=0.662

=== PARALLEL EXECUTION TIME (realistic for distributed system) ===
  COMMUNICATION (max across nodes):
    - Full model transfer: 0.000s (0.0%)
  COMPUTATION (max across nodes):
    - Filtering: 0.068s (80.9%)
    - Aggregation: 0.016s (19.1%)
  TOTALS:
    - Total computation: 0.084s (100.0%)
    - Total communication: 0.000s (0.0%)
    - Total parallel time: 0.084s

=== PER-NODE AVERAGE TIME ===
  - Filtering: 0.054s
  - Aggregation: 0.009s
  - Model transfer: 0.000s
  - Total per node: 0.064s

=== TOTAL COMPUTATIONAL WORK (sum across all nodes) ===
  - Total filtering: 1.089s
  - Total aggregation: 0.180s
  - Total model transfer: 0.000s
  - Grand total: 1.270s
  - Mean acceptance rate: 0.716

BALANCE Algorithm Properties:
  - Model dimension: 1,174,986
  - No compression: Full parameter comparison
  - Theoretical complexity: O(deg(i)×d)
  - Approach: Full parameter filtering + averaging
