Device: cuda
Seed: 987654321
Loading 1 LEAF Sent140 train files...
LEAF Sent140 train: 254555 users, 908652 samples
Building vocabulary (max_size=10000)...
Vocabulary size: 10000
Loading 1 LEAF Sent140 test files...
LEAF Sent140 test: 254555 users, 286281 samples
Found 254555 train users, 254555 test users, 254555 common users
User sample counts range: 494 (max) to 1 (min)
Distributed ALL 254555 users across 20 clients
Users per client: 12727 (with 15 clients getting +1 user)
Train partition sizes: [44353, 44290, 44657, 44907, 44696, 45843, 45801, 45619, 45069, 45639, 45821, 45311, 45779, 46056, 45625, 45984, 46428, 44737, 45540, 46497]
Test partition sizes: [14232, 14235, 14266, 14217, 14238, 14373, 14346, 14334, 14294, 14373, 14344, 14302, 14354, 14362, 14320, 14395, 14389, 14257, 14251, 14399]
  Client 0: 44353 train samples, 2 unique classes
  Client 1: 44290 train samples, 2 unique classes
  Client 2: 44657 train samples, 2 unique classes
  Client 3: 44907 train samples, 2 unique classes
  Client 4: 44696 train samples, 2 unique classes
  Client 5: 45843 train samples, 2 unique classes
  Client 6: 45801 train samples, 2 unique classes
  Client 7: 45619 train samples, 2 unique classes
  Client 8: 45069 train samples, 2 unique classes
  Client 9: 45639 train samples, 2 unique classes
  Client 10: 45821 train samples, 2 unique classes
  Client 11: 45311 train samples, 2 unique classes
  Client 12: 45779 train samples, 2 unique classes
  Client 13: 46056 train samples, 2 unique classes
  Client 14: 45625 train samples, 2 unique classes
  Client 15: 45984 train samples, 2 unique classes
  Client 16: 46428 train samples, 2 unique classes
  Client 17: 44737 train samples, 2 unique classes
  Client 18: 45540 train samples, 2 unique classes
  Client 19: 46497 train samples, 2 unique classes
Will sample 4500 samples per client per epoch
Graph: ring, nodes: 20, edges: 20
Degree statistics: avg=2.00, min=2, max=2
Attack: Compromised 12/20 nodes: [1, 2, 3, 5, 8, 11, 12, 13, 14, 15, 17, 18]
Attack type: backdoor, lambda: 1.0
Backdoor target label: 1, trigger size: 3
Model variant: baseline
Model parameters: 1,174,986
Initial test acc across nodes: mean=0.4953 ± 0.0174
Backdoor attack: Created poisoned datasets for 12 compromised nodes
Round 001: test acc mean=0.4979 ± 0.0069 | min=0.4858 max=0.5144
         : test loss mean=21.5190 ± 27.8479
         : individual accs = ['0.499227', '0.514366', '0.487102', '0.485827', '0.495856', '0.499061', '0.494702', '0.502442', '0.506576', '0.503374', '0.496026', '0.494127', '0.502787', '0.506963', '0.492598', '0.494408', '0.495448', '0.497440', '0.501368', '0.488923']
         : correct/total = [(7105, 14232), (7322, 14235), (6949, 14266), (6907, 14217), (7060, 14238), (7173, 14373), (7097, 14346), (7202, 14334), (7241, 14294), (7235, 14373), (7115, 14344), (7067, 14302), (7217, 14354), (7281, 14362), (7054, 14320), (7117, 14395), (7129, 14389), (7092, 14257), (7145, 14251), (7040, 14399)]
         : compromised: 0.4986, honest: 0.4970
Round 002: test acc mean=0.4960 ± 0.0063 | min=0.4830 max=0.5129
         : test loss mean=55.2984 ± 38.6351
         : individual accs = ['0.492622', '0.483035', '0.512898', '0.484912', '0.494522', '0.495860', '0.499791', '0.492745', '0.498181', '0.495234', '0.498397', '0.493847', '0.497004', '0.493594', '0.507542', '0.497742', '0.492529', '0.495336', '0.495614', '0.498090']
         : correct/total = [(7011, 14232), (6876, 14235), (7317, 14266), (6894, 14217), (7041, 14238), (7127, 14373), (7170, 14346), (7063, 14334), (7121, 14294), (7118, 14373), (7149, 14344), (7063, 14302), (7134, 14354), (7089, 14362), (7268, 14320), (7165, 14395), (7087, 14389), (7062, 14257), (7063, 14251), (7172, 14399)]
         : compromised: 0.4963, honest: 0.4955
Round 003: test acc mean=0.4963 ± 0.0059 | min=0.4844 max=0.5123
         : test loss mean=85.6764 ± 123.4979
         : individual accs = ['0.495363', '0.486196', '0.512267', '0.484420', '0.494311', '0.495582', '0.499721', '0.493582', '0.498391', '0.495791', '0.499233', '0.493218', '0.497074', '0.492202', '0.506983', '0.498437', '0.492182', '0.496177', '0.496386', '0.498437']
         : correct/total = [(7050, 14232), (6921, 14235), (7308, 14266), (6887, 14217), (7038, 14238), (7123, 14373), (7169, 14346), (7075, 14334), (7124, 14294), (7126, 14373), (7161, 14344), (7054, 14302), (7135, 14354), (7069, 14362), (7260, 14320), (7175, 14395), (7082, 14389), (7074, 14257), (7074, 14251), (7177, 14399)]
         : compromised: 0.4964, honest: 0.4961
Round 004: test acc mean=0.5014 ± 0.0077 | min=0.4855 max=0.5168
         : test loss mean=45.5135 ± 63.2494
         : individual accs = ['0.510118', '0.516825', '0.485490', '0.514595', '0.505057', '0.504696', '0.498466', '0.509069', '0.498601', '0.504070', '0.497421', '0.506083', '0.493173', '0.494569', '0.494553', '0.494686', '0.497811', '0.494284', '0.503052', '0.505868']
         : correct/total = [(7260, 14232), (7357, 14235), (6926, 14266), (7316, 14217), (7191, 14238), (7254, 14373), (7151, 14346), (7297, 14334), (7127, 14294), (7245, 14373), (7135, 14344), (7238, 14302), (7079, 14354), (7103, 14362), (7082, 14320), (7121, 14395), (7163, 14389), (7047, 14257), (7169, 14251), (7284, 14399)]
         : compromised: 0.5001, honest: 0.5035
Round 005: test acc mean=0.5021 ± 0.0099 | min=0.4787 max=0.5193
         : test loss mean=147.9131 ± 258.0604
         : individual accs = ['0.499508', '0.519283', '0.507921', '0.499824', '0.503020', '0.509706', '0.489405', '0.478722', '0.491745', '0.498087', '0.499582', '0.511677', '0.515396', '0.512324', '0.515014', '0.497742', '0.492946', '0.495476', '0.506280', '0.498160']
         : correct/total = [(7109, 14232), (7392, 14235), (7246, 14266), (7106, 14217), (7162, 14238), (7326, 14373), (7021, 14346), (6862, 14334), (7029, 14294), (7159, 14373), (7166, 14344), (7318, 14302), (7398, 14354), (7358, 14362), (7375, 14320), (7165, 14395), (7093, 14389), (7064, 14257), (7215, 14251), (7173, 14399)]
         : compromised: 0.5069, honest: 0.4949
Round 006: test acc mean=0.4982 ± 0.0082 | min=0.4785 max=0.5158
         : test loss mean=765.8881 ± 1503.1327
         : individual accs = ['0.507518', '0.515841', '0.495374', '0.510375', '0.502880', '0.500174', '0.495190', '0.494419', '0.500350', '0.478467', '0.485081', '0.505314', '0.497144', '0.497006', '0.491899', '0.502049', '0.496490', '0.496879', '0.491755', '0.500590']
         : correct/total = [(7223, 14232), (7343, 14235), (7067, 14266), (7256, 14217), (7160, 14238), (7189, 14373), (7104, 14346), (7087, 14334), (7152, 14294), (6877, 14373), (6958, 14344), (7227, 14302), (7136, 14354), (7138, 14362), (7044, 14320), (7227, 14395), (7144, 14389), (7084, 14257), (7008, 14251), (7208, 14399)]
         : compromised: 0.5003, honest: 0.4951
Round 007: test acc mean=0.5002 ± 0.0100 | min=0.4796 max=0.5233
         : test loss mean=3535.8666 ± 7041.4339
         : individual accs = ['0.499508', '0.505866', '0.496846', '0.505381', '0.514819', '0.523273', '0.487732', '0.479559', '0.493774', '0.503166', '0.504183', '0.493427', '0.494218', '0.507241', '0.500209', '0.497951', '0.492043', '0.493372', '0.494913', '0.516286']
         : correct/total = [(7109, 14232), (7201, 14235), (7088, 14266), (7185, 14217), (7330, 14238), (7521, 14373), (6997, 14346), (6874, 14334), (7058, 14294), (7232, 14373), (7232, 14344), (7057, 14302), (7094, 14354), (7285, 14362), (7163, 14320), (7168, 14395), (7080, 14389), (7034, 14257), (7053, 14251), (7434, 14399)]
         : compromised: 0.5005, honest: 0.4997
Round 008: test acc mean=0.4933 ± 0.0137 | min=0.4638 max=0.5216
         : test loss mean=10296.5353 ± 20534.6383
         : individual accs = ['0.482715', '0.494134', '0.501192', '0.484912', '0.494522', '0.495860', '0.485083', '0.490233', '0.496012', '0.521603', '0.518126', '0.501119', '0.503414', '0.500000', '0.503282', '0.463842', '0.468761', '0.479273', '0.492457', '0.490034']
         : correct/total = [(6870, 14232), (7034, 14235), (7150, 14266), (6894, 14217), (7041, 14238), (7127, 14373), (6959, 14346), (7027, 14334), (7090, 14294), (7497, 14373), (7432, 14344), (7167, 14302), (7226, 14354), (7181, 14362), (7207, 14320), (6677, 14395), (6745, 14389), (6833, 14257), (7018, 14251), (7056, 14399)]
         : compromised: 0.4930, honest: 0.4939
Round 009: test acc mean=0.5020 ± 0.0077 | min=0.4879 max=0.5165
         : test loss mean=30801.5315 ± 61621.2318
         : individual accs = ['0.506535', '0.516544', '0.495233', '0.487937', '0.495575', '0.497878', '0.506831', '0.502093', '0.494123', '0.512906', '0.508296', '0.515732', '0.501045', '0.504038', '0.499232', '0.494199', '0.500035', '0.490917', '0.506912', '0.504202']
         : correct/total = [(7209, 14232), (7353, 14235), (7065, 14266), (6937, 14217), (7056, 14238), (7156, 14373), (7271, 14346), (7197, 14334), (7063, 14294), (7372, 14373), (7291, 14344), (7376, 14302), (7192, 14354), (7239, 14362), (7149, 14320), (7114, 14395), (7195, 14389), (6999, 14257), (7224, 14251), (7260, 14399)]
         : compromised: 0.5003, honest: 0.5046
Round 010: test acc mean=0.4996 ± 0.0082 | min=0.4864 max=0.5214
         : test loss mean=169579.0074 ± 339211.0374
         : individual accs = ['0.521360', '0.491535', '0.492289', '0.492509', '0.498806', '0.501565', '0.495051', '0.489256', '0.508675', '0.497461', '0.500349', '0.486435', '0.500488', '0.504665', '0.494134', '0.499132', '0.500591', '0.497300', '0.504947', '0.514550']
         : correct/total = [(7420, 14232), (6997, 14235), (7023, 14266), (7002, 14217), (7102, 14238), (7209, 14373), (7102, 14346), (7013, 14334), (7271, 14294), (7150, 14373), (7177, 14344), (6957, 14302), (7184, 14354), (7248, 14362), (7076, 14320), (7185, 14395), (7203, 14389), (7090, 14257), (7196, 14251), (7409, 14399)]
         : compromised: 0.4978, honest: 0.5022

=== FINAL RESULTS ===
Dataset: sent140, Nodes: 20, Graph: ring, Aggregation: d-fedavg
Attack: backdoor, 60.0% compromised
Final accuracy - Compromised: 0.4978, Honest: 0.5022
Overall test accuracy: mean=0.4996 ± 0.0082

=== BACKDOOR ATTACK SUCCESS RATE (ASR) ===
Target label: 1
Trigger size: 3x3
Overall ASR: 0.7355 ± 0.2768
Honest nodes ASR: 0.7400 ± 0.2770
Compromised nodes ASR: 0.7325 ± 0.2766
Note: Higher ASR indicates more successful backdoor attack
