Device: cuda
Seed: 987654321
Loading 1 LEAF Sent140 train files...
LEAF Sent140 train: 254555 users, 908652 samples
Building vocabulary (max_size=10000)...
Vocabulary size: 10000
Loading 1 LEAF Sent140 test files...
LEAF Sent140 test: 254555 users, 286281 samples
Found 254555 train users, 254555 test users, 254555 common users
User sample counts range: 494 (max) to 1 (min)
Distributed ALL 254555 users across 20 clients
Users per client: 12727 (with 15 clients getting +1 user)
Train partition sizes: [44353, 44290, 44657, 44907, 44696, 45843, 45801, 45619, 45069, 45639, 45821, 45311, 45779, 46056, 45625, 45984, 46428, 44737, 45540, 46497]
Test partition sizes: [14232, 14235, 14266, 14217, 14238, 14373, 14346, 14334, 14294, 14373, 14344, 14302, 14354, 14362, 14320, 14395, 14389, 14257, 14251, 14399]
  Client 0: 44353 train samples, 2 unique classes
  Client 1: 44290 train samples, 2 unique classes
  Client 2: 44657 train samples, 2 unique classes
  Client 3: 44907 train samples, 2 unique classes
  Client 4: 44696 train samples, 2 unique classes
  Client 5: 45843 train samples, 2 unique classes
  Client 6: 45801 train samples, 2 unique classes
  Client 7: 45619 train samples, 2 unique classes
  Client 8: 45069 train samples, 2 unique classes
  Client 9: 45639 train samples, 2 unique classes
  Client 10: 45821 train samples, 2 unique classes
  Client 11: 45311 train samples, 2 unique classes
  Client 12: 45779 train samples, 2 unique classes
  Client 13: 46056 train samples, 2 unique classes
  Client 14: 45625 train samples, 2 unique classes
  Client 15: 45984 train samples, 2 unique classes
  Client 16: 46428 train samples, 2 unique classes
  Client 17: 44737 train samples, 2 unique classes
  Client 18: 45540 train samples, 2 unique classes
  Client 19: 46497 train samples, 2 unique classes
Will sample 4500 samples per client per epoch
Graph: erdos, nodes: 20, edges: 99
Degree statistics: avg=9.90, min=7, max=14
Attack: Compromised 2/20 nodes: [5, 13]
Attack type: backdoor, lambda: 1.0
Backdoor target label: 1, trigger size: 3
Model variant: baseline
Model parameters: 1,174,986
BALANCE algorithm:
Balance Config: BALANCEConfig(gamma=2, kappa=1, alpha=0.5, min_neighbors=1)
  - Model dimension: 1,174,986 parameters
  - Complexity: O(N×d) = O(20×1,174,986)
Initial test acc across nodes: mean=0.4965 ± 0.0152
Backdoor attack: Created poisoned datasets for 2 compromised nodes
Round 001: test acc mean=0.5187 ± 0.0233 | min=0.4974 max=0.5882
         : test loss mean=4.3693 ± 10.9918
         : individual accs = ['0.504848', '0.510221', '0.522781', '0.507913', '0.497401', '0.499756', '0.524467', '0.503977', '0.502309', '0.588186', '0.546779', '0.532932', '0.506618', '0.508425', '0.501816', '0.500868', '0.568073', '0.511047', '0.519121', '0.517397']
         : correct/total = [(7185, 14232), (7263, 14235), (7458, 14266), (7221, 14217), (7082, 14238), (7183, 14373), (7524, 14346), (7224, 14334), (7180, 14294), (8454, 14373), (7843, 14344), (7622, 14302), (7272, 14354), (7302, 14362), (7186, 14320), (7210, 14395), (8174, 14389), (7286, 14257), (7398, 14251), (7450, 14399)]
         : compromised: 0.5041, honest: 0.5204
Round 002: test acc mean=0.5095 ± 0.0167 | min=0.4891 max=0.5668
         : test loss mean=107.9148 ± 322.0830
         : individual accs = ['0.489109', '0.527643', '0.498808', '0.530562', '0.506251', '0.503096', '0.515684', '0.495256', '0.508255', '0.498713', '0.503625', '0.508041', '0.499512', '0.499582', '0.521020', '0.498298', '0.499757', '0.506558', '0.512525', '0.566845']
         : correct/total = [(6961, 14232), (7511, 14235), (7116, 14266), (7543, 14217), (7208, 14238), (7231, 14373), (7398, 14346), (7099, 14334), (7265, 14294), (7168, 14373), (7224, 14344), (7266, 14302), (7170, 14354), (7175, 14362), (7461, 14320), (7173, 14395), (7191, 14389), (7222, 14257), (7304, 14251), (8162, 14399)]
         : compromised: 0.5013, honest: 0.5104
Round 003: test acc mean=0.4997 ± 0.0127 | min=0.4861 max=0.5457
         : test loss mean=5864.7828 ± 17784.0680
         : individual accs = ['0.489109', '0.486266', '0.486051', '0.493916', '0.494100', '0.510471', '0.497560', '0.495186', '0.509305', '0.493008', '0.499024', '0.545728', '0.499512', '0.510514', '0.495810', '0.498367', '0.499757', '0.503051', '0.488738', '0.498646']
         : correct/total = [(6961, 14232), (6922, 14235), (6934, 14266), (7022, 14217), (7035, 14238), (7337, 14373), (7138, 14346), (7098, 14334), (7280, 14294), (7086, 14373), (7158, 14344), (7805, 14302), (7170, 14354), (7332, 14362), (7100, 14320), (7174, 14395), (7191, 14389), (7172, 14257), (6965, 14251), (7180, 14399)]
         : compromised: 0.5105, honest: 0.4985
Round 004: test acc mean=0.4936 ± 0.0049 | min=0.4861 max=0.5031
         : test loss mean=899938.4320 ± 2714540.5229
         : individual accs = ['0.489109', '0.486266', '0.486051', '0.492228', '0.494100', '0.489807', '0.497560', '0.495186', '0.488457', '0.493008', '0.499024', '0.492029', '0.499512', '0.487676', '0.495810', '0.498367', '0.499757', '0.503051', '0.488738', '0.496354']
         : correct/total = [(6961, 14232), (6922, 14235), (6934, 14266), (6998, 14217), (7035, 14238), (7040, 14373), (7138, 14346), (7098, 14334), (6982, 14294), (7086, 14373), (7158, 14344), (7037, 14302), (7170, 14354), (7004, 14362), (7100, 14320), (7174, 14395), (7191, 14389), (7172, 14257), (6965, 14251), (7147, 14399)]
         : compromised: 0.4887, honest: 0.4941
Round 005: test acc mean=0.4945 ± 0.0060 | min=0.4861 max=0.5094
         : test loss mean=56038166.7639 ± 175671860.9477
         : individual accs = ['0.489109', '0.486266', '0.486051', '0.492228', '0.494100', '0.509427', '0.497560', '0.495186', '0.488457', '0.493008', '0.499024', '0.492029', '0.499512', '0.486840', '0.495810', '0.498367', '0.499757', '0.503051', '0.488738', '0.496354']
         : correct/total = [(6961, 14232), (6922, 14235), (6934, 14266), (6998, 14217), (7035, 14238), (7322, 14373), (7138, 14346), (7098, 14334), (6982, 14294), (7086, 14373), (7158, 14344), (7037, 14302), (7170, 14354), (6992, 14362), (7100, 14320), (7174, 14395), (7191, 14389), (7172, 14257), (6965, 14251), (7147, 14399)]
         : compromised: 0.4981, honest: 0.4941
Round 006: test acc mean=0.4953 ± 0.0057 | min=0.4861 max=0.5061
         : test loss mean=3226234572.7860 ± 9690316872.6348
         : individual accs = ['0.489109', '0.486266', '0.486051', '0.492228', '0.494100', '0.506088', '0.497560', '0.495186', '0.488457', '0.493008', '0.499024', '0.492029', '0.499512', '0.504665', '0.495810', '0.498367', '0.499757', '0.503051', '0.488738', '0.496354']
         : correct/total = [(6961, 14232), (6922, 14235), (6934, 14266), (6998, 14217), (7035, 14238), (7274, 14373), (7138, 14346), (7098, 14334), (6982, 14294), (7086, 14373), (7158, 14344), (7037, 14302), (7170, 14354), (7248, 14362), (7100, 14320), (7174, 14395), (7191, 14389), (7172, 14257), (6965, 14251), (7147, 14399)]
         : compromised: 0.5054, honest: 0.4941
Round 007: test acc mean=0.4955 ± 0.0075 | min=0.4861 max=0.5212
         : test loss mean=243065636308.5472 ± 729285103761.3295
         : individual accs = ['0.489109', '0.486266', '0.486051', '0.492228', '0.494100', '0.521186', '0.497560', '0.495186', '0.488457', '0.493008', '0.499024', '0.492029', '0.499512', '0.493246', '0.495810', '0.498367', '0.499757', '0.503051', '0.488738', '0.496354']
         : correct/total = [(6961, 14232), (6922, 14235), (6934, 14266), (6998, 14217), (7035, 14238), (7491, 14373), (7138, 14346), (7098, 14334), (6982, 14294), (7086, 14373), (7158, 14344), (7037, 14302), (7170, 14354), (7084, 14362), (7100, 14320), (7174, 14395), (7191, 14389), (7172, 14257), (6965, 14251), (7147, 14399)]
         : compromised: 0.5072, honest: 0.4941
Round 008: test acc mean=0.4956 ± 0.0065 | min=0.4861 max=0.5127
         : test loss mean=18765870705666.0859 ± 56640617617320.2969
         : individual accs = ['0.489109', '0.486266', '0.486051', '0.492228', '0.494100', '0.512697', '0.497560', '0.495186', '0.488457', '0.493008', '0.499024', '0.492029', '0.499512', '0.504735', '0.495810', '0.498367', '0.499757', '0.503051', '0.488738', '0.496354']
         : correct/total = [(6961, 14232), (6922, 14235), (6934, 14266), (6998, 14217), (7035, 14238), (7369, 14373), (7138, 14346), (7098, 14334), (6982, 14294), (7086, 14373), (7158, 14344), (7037, 14302), (7170, 14354), (7249, 14362), (7100, 14320), (7174, 14395), (7191, 14389), (7172, 14257), (6965, 14251), (7147, 14399)]
         : compromised: 0.5087, honest: 0.4941
Round 009: test acc mean=0.4953 ± 0.0058 | min=0.4861 max=0.5083
         : test loss mean=1814700980873385.2500 ± 5588950757273844.0000
         : individual accs = ['0.489109', '0.486266', '0.486051', '0.492228', '0.494100', '0.508314', '0.497560', '0.495186', '0.488457', '0.493008', '0.499024', '0.492029', '0.499512', '0.502715', '0.495810', '0.498367', '0.499757', '0.503051', '0.488738', '0.496354']
         : correct/total = [(6961, 14232), (6922, 14235), (6934, 14266), (6998, 14217), (7035, 14238), (7306, 14373), (7138, 14346), (7098, 14334), (6982, 14294), (7086, 14373), (7158, 14344), (7037, 14302), (7170, 14354), (7220, 14362), (7100, 14320), (7174, 14395), (7191, 14389), (7172, 14257), (6965, 14251), (7147, 14399)]
         : compromised: 0.5055, honest: 0.4941
Round 010: test acc mean=0.4953 ± 0.0066 | min=0.4861 max=0.5158
         : test loss mean=129943124489400320.0000 ± 391660686944782272.0000
         : individual accs = ['0.489109', '0.486266', '0.486051', '0.492228', '0.494100', '0.515759', '0.497560', '0.495186', '0.488457', '0.493008', '0.499024', '0.492029', '0.499512', '0.494708', '0.495810', '0.498367', '0.499757', '0.503051', '0.488738', '0.496354']
         : correct/total = [(6961, 14232), (6922, 14235), (6934, 14266), (6998, 14217), (7035, 14238), (7413, 14373), (7138, 14346), (7098, 14334), (6982, 14294), (7086, 14373), (7158, 14344), (7037, 14302), (7170, 14354), (7105, 14362), (7100, 14320), (7174, 14395), (7191, 14389), (7172, 14257), (6965, 14251), (7147, 14399)]
         : compromised: 0.5052, honest: 0.4941

=== FINAL RESULTS ===
Dataset: sent140, Nodes: 20, Graph: erdos, Aggregation: balance
Attack: backdoor, 10.0% compromised
Final accuracy - Compromised: 0.5052, Honest: 0.4941
Overall test accuracy: mean=0.4953 ± 0.0066

=== BACKDOOR ATTACK SUCCESS RATE (ASR) ===
Target label: 1
Trigger size: 3x3
Overall ASR: 0.9939 ± 0.0211
Honest nodes ASR: 1.0000 ± 0.0000
Compromised nodes ASR: 0.9387 ± 0.0329
Note: Higher ASR indicates more successful backdoor attack

=== BALANCE SUMMARY ===
Node 0: acceptance=0.925
Node 1: acceptance=0.910
Node 2: acceptance=1.000
Node 3: acceptance=0.871
Node 4: acceptance=0.900
Node 5: acceptance=0.600
Node 6: acceptance=0.850
Node 7: acceptance=0.918
Node 8: acceptance=0.743
Node 9: acceptance=1.000
Node 10: acceptance=1.000
Node 11: acceptance=0.850
Node 12: acceptance=0.925
Node 13: acceptance=0.600
Node 14: acceptance=0.871
Node 15: acceptance=0.900
Node 16: acceptance=1.000
Node 17: acceptance=0.887
Node 18: acceptance=0.925
Node 19: acceptance=0.820

=== PARALLEL EXECUTION TIME (realistic for distributed system) ===
  COMMUNICATION (max across nodes):
    - Full model transfer: 0.000s (0.0%)
  COMPUTATION (max across nodes):
    - Filtering: 0.064s (79.7%)
    - Aggregation: 0.016s (20.3%)
  TOTALS:
    - Total computation: 0.080s (100.0%)
    - Total communication: 0.000s (0.0%)
    - Total parallel time: 0.080s

=== PER-NODE AVERAGE TIME ===
  - Filtering: 0.044s
  - Aggregation: 0.009s
  - Model transfer: 0.000s
  - Total per node: 0.053s

=== TOTAL COMPUTATIONAL WORK (sum across all nodes) ===
  - Total filtering: 0.872s
  - Total aggregation: 0.178s
  - Total model transfer: 0.000s
  - Grand total: 1.051s
  - Mean acceptance rate: 0.875

BALANCE Algorithm Properties:
  - Model dimension: 1,174,986
  - No compression: Full parameter comparison
  - Theoretical complexity: O(deg(i)×d)
  - Approach: Full parameter filtering + averaging
