Device: cuda
Seed: 987654321
Loading 1 LEAF Sent140 train files...
LEAF Sent140 train: 254555 users, 908652 samples
Building vocabulary (max_size=10000)...
Vocabulary size: 10000
Loading 1 LEAF Sent140 test files...
LEAF Sent140 test: 254555 users, 286281 samples
Found 254555 train users, 254555 test users, 254555 common users
User sample counts range: 494 (max) to 1 (min)
Distributed ALL 254555 users across 20 clients
Users per client: 12727 (with 15 clients getting +1 user)
Train partition sizes: [44353, 44290, 44657, 44907, 44696, 45843, 45801, 45619, 45069, 45639, 45821, 45311, 45779, 46056, 45625, 45984, 46428, 44737, 45540, 46497]
Test partition sizes: [14232, 14235, 14266, 14217, 14238, 14373, 14346, 14334, 14294, 14373, 14344, 14302, 14354, 14362, 14320, 14395, 14389, 14257, 14251, 14399]
  Client 0: 44353 train samples, 2 unique classes
  Client 1: 44290 train samples, 2 unique classes
  Client 2: 44657 train samples, 2 unique classes
  Client 3: 44907 train samples, 2 unique classes
  Client 4: 44696 train samples, 2 unique classes
  Client 5: 45843 train samples, 2 unique classes
  Client 6: 45801 train samples, 2 unique classes
  Client 7: 45619 train samples, 2 unique classes
  Client 8: 45069 train samples, 2 unique classes
  Client 9: 45639 train samples, 2 unique classes
  Client 10: 45821 train samples, 2 unique classes
  Client 11: 45311 train samples, 2 unique classes
  Client 12: 45779 train samples, 2 unique classes
  Client 13: 46056 train samples, 2 unique classes
  Client 14: 45625 train samples, 2 unique classes
  Client 15: 45984 train samples, 2 unique classes
  Client 16: 46428 train samples, 2 unique classes
  Client 17: 44737 train samples, 2 unique classes
  Client 18: 45540 train samples, 2 unique classes
  Client 19: 46497 train samples, 2 unique classes
Will sample 4500 samples per client per epoch
Graph: erdos, nodes: 20, edges: 99
Degree statistics: avg=9.90, min=7, max=14
Attack: Compromised 2/20 nodes: [5, 13]
Attack type: backdoor, lambda: 1.0
Backdoor target label: 1, trigger size: 3
Model variant: baseline
Model parameters: 1,174,986
Initial test acc across nodes: mean=0.4965 ± 0.0152
Backdoor attack: Created poisoned datasets for 2 compromised nodes
Round 001: test acc mean=0.5740 ± 0.0420 | min=0.4914 max=0.6098
         : test loss mean=8.5483 ± 16.2288
         : individual accs = ['0.602797', '0.609835', '0.591897', '0.592530', '0.595519', '0.601545', '0.498815', '0.593903', '0.491395', '0.602797', '0.604573', '0.497413', '0.585412', '0.605904', '0.504050', '0.599514', '0.588366', '0.596339', '0.595818', '0.520592']
         : correct/total = [(8579, 14232), (8681, 14235), (8444, 14266), (8424, 14217), (8479, 14238), (8646, 14373), (7156, 14346), (8513, 14334), (7024, 14294), (8664, 14373), (8672, 14344), (7114, 14302), (8403, 14354), (8702, 14362), (7218, 14320), (8630, 14395), (8466, 14389), (8502, 14257), (8491, 14251), (7496, 14399)]
         : compromised: 0.6037, honest: 0.5706
Round 002: test acc mean=0.6034 ± 0.0325 | min=0.5001 max=0.6262
         : test loss mean=2.8239 ± 6.5373
         : individual accs = ['0.619379', '0.606393', '0.619094', '0.626222', '0.610128', '0.622904', '0.612017', '0.618181', '0.500140', '0.612677', '0.612591', '0.614739', '0.606939', '0.609943', '0.603282', '0.617645', '0.617208', '0.618784', '0.603677', '0.515452']
         : correct/total = [(8815, 14232), (8632, 14235), (8832, 14266), (8903, 14217), (8687, 14238), (8953, 14373), (8780, 14346), (8861, 14334), (7149, 14294), (8806, 14373), (8787, 14344), (8792, 14302), (8712, 14354), (8760, 14362), (8639, 14320), (8891, 14395), (8881, 14389), (8822, 14257), (8603, 14251), (7422, 14399)]
         : compromised: 0.6164, honest: 0.6019
Round 003: test acc mean=0.6253 ± 0.0067 | min=0.6083 max=0.6367
         : test loss mean=0.6453 ± 0.0048
         : individual accs = ['0.608277', '0.629294', '0.620777', '0.629247', '0.623543', '0.625478', '0.630071', '0.626901', '0.623059', '0.632436', '0.629044', '0.622151', '0.624983', '0.636680', '0.620321', '0.630219', '0.626659', '0.626429', '0.630833', '0.610320']
         : correct/total = [(8657, 14232), (8958, 14235), (8856, 14266), (8946, 14217), (8878, 14238), (8990, 14373), (9039, 14346), (8986, 14334), (8906, 14294), (9090, 14373), (9023, 14344), (8898, 14302), (8971, 14354), (9144, 14362), (8883, 14320), (9072, 14395), (9017, 14389), (8931, 14257), (8990, 14251), (8788, 14399)]
         : compromised: 0.6311, honest: 0.6247
Round 004: test acc mean=0.6323 ± 0.0036 | min=0.6266 max=0.6414
         : test loss mean=0.6387 ± 0.0024
         : individual accs = ['0.633432', '0.641377', '0.628908', '0.636984', '0.636115', '0.629862', '0.635578', '0.633040', '0.629635', '0.633062', '0.631832', '0.630751', '0.631322', '0.634591', '0.626606', '0.635151', '0.631733', '0.631339', '0.627114', '0.627057']
         : correct/total = [(9015, 14232), (9130, 14235), (8972, 14266), (9056, 14217), (9057, 14238), (9053, 14373), (9118, 14346), (9074, 14334), (9000, 14294), (9099, 14373), (9063, 14344), (9021, 14302), (9062, 14354), (9114, 14362), (8973, 14320), (9143, 14395), (9090, 14389), (9001, 14257), (8937, 14251), (9029, 14399)]
         : compromised: 0.6322, honest: 0.6323
Round 005: test acc mean=0.6403 ± 0.0047 | min=0.6307 max=0.6538
         : test loss mean=0.6320 ± 0.0028
         : individual accs = ['0.640950', '0.653811', '0.630730', '0.641064', '0.647563', '0.636332', '0.642548', '0.640435', '0.640688', '0.642872', '0.640268', '0.635925', '0.639543', '0.641693', '0.635615', '0.643974', '0.639725', '0.635547', '0.638201', '0.637753']
         : correct/total = [(9122, 14232), (9307, 14235), (8998, 14266), (9114, 14217), (9220, 14238), (9146, 14373), (9218, 14346), (9180, 14334), (9158, 14294), (9240, 14373), (9184, 14344), (9095, 14302), (9180, 14354), (9216, 14362), (9102, 14320), (9270, 14395), (9205, 14389), (9061, 14257), (9095, 14251), (9183, 14399)]
         : compromised: 0.6390, honest: 0.6404
Round 006: test acc mean=0.6430 ± 0.0035 | min=0.6368 max=0.6502
         : test loss mean=0.6290 ± 0.0024
         : individual accs = ['0.650155', '0.646505', '0.636829', '0.645284', '0.640539', '0.642385', '0.644918', '0.644063', '0.641248', '0.642663', '0.641662', '0.644036', '0.640449', '0.649770', '0.638198', '0.643696', '0.641254', '0.637441', '0.645428', '0.644281']
         : correct/total = [(9253, 14232), (9203, 14235), (9085, 14266), (9174, 14217), (9120, 14238), (9233, 14373), (9252, 14346), (9232, 14334), (9166, 14294), (9237, 14373), (9204, 14344), (9211, 14302), (9193, 14354), (9332, 14362), (9139, 14320), (9266, 14395), (9227, 14389), (9088, 14257), (9198, 14251), (9277, 14399)]
         : compromised: 0.6461, honest: 0.6427
Round 007: test acc mean=0.6457 ± 0.0046 | min=0.6366 max=0.6531
         : test loss mean=0.6263 ± 0.0047
         : individual accs = ['0.642988', '0.653109', '0.644960', '0.648941', '0.645737', '0.644055', '0.643594', '0.647412', '0.640199', '0.650386', '0.650864', '0.640959', '0.647973', '0.651998', '0.636592', '0.651129', '0.638126', '0.648804', '0.643744', '0.642822']
         : correct/total = [(9151, 14232), (9297, 14235), (9201, 14266), (9226, 14217), (9194, 14238), (9257, 14373), (9233, 14346), (9280, 14334), (9151, 14294), (9348, 14373), (9336, 14344), (9167, 14302), (9301, 14354), (9364, 14362), (9116, 14320), (9373, 14395), (9182, 14389), (9250, 14257), (9174, 14251), (9256, 14399)]
         : compromised: 0.6480, honest: 0.6455
Round 008: test acc mean=0.6565 ± 0.0031 | min=0.6516 max=0.6618
         : test loss mean=0.6164 ± 0.0024
         : individual accs = ['0.661327', '0.658588', '0.652110', '0.657030', '0.654095', '0.655952', '0.660184', '0.653900', '0.654610', '0.659431', '0.661810', '0.656342', '0.652849', '0.659100', '0.653911', '0.661341', '0.651609', '0.655678', '0.655182', '0.655323']
         : correct/total = [(9412, 14232), (9375, 14235), (9303, 14266), (9341, 14217), (9313, 14238), (9428, 14373), (9471, 14346), (9373, 14334), (9357, 14294), (9478, 14373), (9493, 14344), (9387, 14302), (9371, 14354), (9466, 14362), (9364, 14320), (9520, 14395), (9376, 14389), (9348, 14257), (9337, 14251), (9436, 14399)]
         : compromised: 0.6575, honest: 0.6564
Round 009: test acc mean=0.6583 ± 0.0047 | min=0.6464 max=0.6700
         : test loss mean=0.6149 ± 0.0036
         : individual accs = ['0.662943', '0.669968', '0.654003', '0.657874', '0.663576', '0.646351', '0.656350', '0.659132', '0.659717', '0.663188', '0.654002', '0.659139', '0.657378', '0.660214', '0.657193', '0.657242', '0.656196', '0.659045', '0.659884', '0.652684']
         : correct/total = [(9435, 14232), (9537, 14235), (9330, 14266), (9353, 14217), (9448, 14238), (9290, 14373), (9416, 14346), (9448, 14334), (9430, 14294), (9532, 14373), (9381, 14344), (9427, 14302), (9436, 14354), (9482, 14362), (9411, 14320), (9461, 14395), (9442, 14389), (9396, 14257), (9404, 14251), (9398, 14399)]
         : compromised: 0.6533, honest: 0.6589
Round 010: test acc mean=0.6636 ± 0.0038 | min=0.6556 max=0.6719
         : test loss mean=0.6094 ± 0.0029
         : individual accs = ['0.667931', '0.671935', '0.655615', '0.661673', '0.663857', '0.660057', '0.667155', '0.664155', '0.657619', '0.667154', '0.665435', '0.660887', '0.662185', '0.663278', '0.664385', '0.668357', '0.663145', '0.661920', '0.660024', '0.666088']
         : correct/total = [(9506, 14232), (9565, 14235), (9353, 14266), (9407, 14217), (9452, 14238), (9487, 14373), (9571, 14346), (9520, 14334), (9400, 14294), (9589, 14373), (9545, 14344), (9452, 14302), (9505, 14354), (9526, 14362), (9514, 14320), (9621, 14395), (9542, 14389), (9437, 14257), (9406, 14251), (9591, 14399)]
         : compromised: 0.6617, honest: 0.6639

=== FINAL RESULTS ===
Dataset: sent140, Nodes: 20, Graph: erdos, Aggregation: krum
Attack: backdoor, 10.0% compromised
Final accuracy - Compromised: 0.6617, Honest: 0.6639
Overall test accuracy: mean=0.6636 ± 0.0038

=== BACKDOOR ATTACK SUCCESS RATE (ASR) ===
Target label: 1
Trigger size: 3x3
Overall ASR: 0.4480 ± 0.0137
Honest nodes ASR: 0.4471 ± 0.0140
Compromised nodes ASR: 0.4563 ± 0.0042
Note: Higher ASR indicates more successful backdoor attack
