Device: cuda
Seed: 987654321
Loading 1 LEAF Sent140 train files...
LEAF Sent140 train: 254555 users, 908652 samples
Building vocabulary (max_size=10000)...
Vocabulary size: 10000
Loading 1 LEAF Sent140 test files...
LEAF Sent140 test: 254555 users, 286281 samples
Found 254555 train users, 254555 test users, 254555 common users
User sample counts range: 494 (max) to 1 (min)
Distributed ALL 254555 users across 20 clients
Users per client: 12727 (with 15 clients getting +1 user)
Train partition sizes: [44353, 44290, 44657, 44907, 44696, 45843, 45801, 45619, 45069, 45639, 45821, 45311, 45779, 46056, 45625, 45984, 46428, 44737, 45540, 46497]
Test partition sizes: [14232, 14235, 14266, 14217, 14238, 14373, 14346, 14334, 14294, 14373, 14344, 14302, 14354, 14362, 14320, 14395, 14389, 14257, 14251, 14399]
  Client 0: 44353 train samples, 2 unique classes
  Client 1: 44290 train samples, 2 unique classes
  Client 2: 44657 train samples, 2 unique classes
  Client 3: 44907 train samples, 2 unique classes
  Client 4: 44696 train samples, 2 unique classes
  Client 5: 45843 train samples, 2 unique classes
  Client 6: 45801 train samples, 2 unique classes
  Client 7: 45619 train samples, 2 unique classes
  Client 8: 45069 train samples, 2 unique classes
  Client 9: 45639 train samples, 2 unique classes
  Client 10: 45821 train samples, 2 unique classes
  Client 11: 45311 train samples, 2 unique classes
  Client 12: 45779 train samples, 2 unique classes
  Client 13: 46056 train samples, 2 unique classes
  Client 14: 45625 train samples, 2 unique classes
  Client 15: 45984 train samples, 2 unique classes
  Client 16: 46428 train samples, 2 unique classes
  Client 17: 44737 train samples, 2 unique classes
  Client 18: 45540 train samples, 2 unique classes
  Client 19: 46497 train samples, 2 unique classes
Will sample 4500 samples per client per epoch
Graph: fully, nodes: 20, edges: 190
Degree statistics: avg=19.00, min=19, max=19
Attack: Compromised 6/20 nodes: [5, 12, 13, 14, 17, 18]
Attack type: backdoor, lambda: 1.0
Backdoor target label: 1, trigger size: 3
Model variant: baseline
Model parameters: 1,174,986
Initial test acc across nodes: mean=0.4965 ± 0.0152
Backdoor attack: Created poisoned datasets for 6 compromised nodes
Round 001: test acc mean=0.4975 ± 0.0069 | min=0.4868 max=0.5115
         : test loss mean=22.8941 ± 6.0390
         : individual accs = ['0.511453', '0.487601', '0.492780', '0.489977', '0.507164', '0.502400', '0.496584', '0.497837', '0.506296', '0.491268', '0.503904', '0.495525', '0.494566', '0.492411', '0.492877', '0.500590', '0.504413', '0.504454', '0.491965', '0.486839']
         : correct/total = [(7279, 14232), (6941, 14235), (7030, 14266), (6966, 14217), (7221, 14238), (7221, 14373), (7124, 14346), (7136, 14334), (7237, 14294), (7061, 14373), (7228, 14344), (7087, 14302), (7099, 14354), (7072, 14362), (7058, 14320), (7206, 14395), (7258, 14389), (7192, 14257), (7011, 14251), (7010, 14399)]
         : compromised: 0.4964, honest: 0.4980
Round 002: test acc mean=0.5011 ± 0.0050 | min=0.4893 max=0.5114
         : test loss mean=25.4212 ± 0.3434
         : individual accs = ['0.502319', '0.497857', '0.502313', '0.501794', '0.506181', '0.500731', '0.500349', '0.497837', '0.498811', '0.499339', '0.507878', '0.504964', '0.494845', '0.494569', '0.511383', '0.498367', '0.502815', '0.489304', '0.506912', '0.503090']
         : correct/total = [(7149, 14232), (7087, 14235), (7166, 14266), (7134, 14217), (7207, 14238), (7197, 14373), (7178, 14346), (7136, 14334), (7130, 14294), (7177, 14373), (7285, 14344), (7222, 14302), (7103, 14354), (7103, 14362), (7323, 14320), (7174, 14395), (7235, 14389), (6976, 14257), (7224, 14251), (7244, 14399)]
         : compromised: 0.4996, honest: 0.5017
Round 003: test acc mean=0.5058 ± 0.0055 | min=0.4930 max=0.5146
         : test loss mean=5.5789 ± 0.0681
         : individual accs = ['0.509767', '0.514506', '0.512477', '0.506366', '0.507234', '0.505462', '0.503694', '0.505372', '0.512173', '0.506436', '0.501394', '0.510138', '0.502369', '0.492968', '0.506075', '0.503994', '0.500938', '0.495897', '0.514560', '0.504132']
         : correct/total = [(7255, 14232), (7324, 14235), (7311, 14266), (7199, 14217), (7222, 14238), (7265, 14373), (7226, 14346), (7244, 14334), (7321, 14294), (7279, 14373), (7192, 14344), (7296, 14302), (7211, 14354), (7080, 14362), (7247, 14320), (7255, 14395), (7208, 14389), (7070, 14257), (7333, 14251), (7259, 14399)]
         : compromised: 0.5029, honest: 0.5070
Round 004: test acc mean=0.5005 ± 0.0052 | min=0.4895 max=0.5089
         : test loss mean=0.9761 ± 0.0108
         : individual accs = ['0.499649', '0.496804', '0.502313', '0.498136', '0.503231', '0.501009', '0.499651', '0.500279', '0.508885', '0.498991', '0.503486', '0.506782', '0.508430', '0.492132', '0.489455', '0.495519', '0.501147', '0.493652', '0.507403', '0.502674']
         : correct/total = [(7111, 14232), (7072, 14235), (7166, 14266), (7082, 14217), (7165, 14238), (7201, 14373), (7168, 14346), (7171, 14334), (7274, 14294), (7172, 14373), (7222, 14344), (7248, 14302), (7298, 14354), (7068, 14362), (7009, 14320), (7133, 14395), (7211, 14389), (7038, 14257), (7231, 14251), (7238, 14399)]
         : compromised: 0.4987, honest: 0.5013
Round 005: test acc mean=0.5072 ± 0.0039 | min=0.4984 max=0.5150
         : test loss mean=0.8148 ± 0.0044
         : individual accs = ['0.514966', '0.503758', '0.511846', '0.504537', '0.510535', '0.508175', '0.505716', '0.504604', '0.512173', '0.507131', '0.509272', '0.509090', '0.508290', '0.498399', '0.511522', '0.506495', '0.503232', '0.501227', '0.505719', '0.507744']
         : correct/total = [(7329, 14232), (7171, 14235), (7302, 14266), (7173, 14217), (7269, 14238), (7304, 14373), (7255, 14346), (7233, 14334), (7321, 14294), (7289, 14373), (7305, 14344), (7281, 14302), (7296, 14354), (7158, 14362), (7325, 14320), (7291, 14395), (7241, 14389), (7146, 14257), (7207, 14251), (7311, 14399)]
         : compromised: 0.5056, honest: 0.5079
Round 006: test acc mean=0.5176 ± 0.0033 | min=0.5113 max=0.5240
         : test loss mean=0.7694 ± 0.0027
         : individual accs = ['0.515950', '0.514506', '0.514720', '0.520574', '0.513134', '0.518055', '0.519657', '0.518697', '0.519519', '0.518333', '0.516801', '0.523983', '0.519019', '0.511349', '0.518785', '0.522265', '0.518035', '0.521498', '0.514350', '0.512466']
         : correct/total = [(7343, 14232), (7324, 14235), (7343, 14266), (7401, 14217), (7306, 14238), (7446, 14373), (7455, 14346), (7435, 14334), (7426, 14294), (7450, 14373), (7413, 14344), (7494, 14302), (7450, 14354), (7344, 14362), (7429, 14320), (7518, 14395), (7454, 14389), (7435, 14257), (7330, 14251), (7379, 14399)]
         : compromised: 0.5172, honest: 0.5178
Round 007: test acc mean=0.5217 ± 0.0026 | min=0.5167 max=0.5267
         : test loss mean=0.7430 ± 0.0032
         : individual accs = ['0.517707', '0.523850', '0.520819', '0.521488', '0.521000', '0.519029', '0.524467', '0.524208', '0.521897', '0.518194', '0.523285', '0.525871', '0.522502', '0.519774', '0.522416', '0.526711', '0.524081', '0.516729', '0.520034', '0.520939']
         : correct/total = [(7368, 14232), (7457, 14235), (7430, 14266), (7414, 14217), (7418, 14238), (7460, 14373), (7524, 14346), (7514, 14334), (7460, 14294), (7448, 14373), (7506, 14344), (7521, 14302), (7500, 14354), (7465, 14362), (7481, 14320), (7582, 14395), (7541, 14389), (7367, 14257), (7411, 14251), (7501, 14399)]
         : compromised: 0.5201, honest: 0.5225
Round 008: test acc mean=0.5195 ± 0.0042 | min=0.5113 max=0.5289
         : test loss mean=0.7337 ± 0.0030
         : individual accs = ['0.515177', '0.511345', '0.516262', '0.523317', '0.519174', '0.516802', '0.528858', '0.521766', '0.516790', '0.521742', '0.519241', '0.522095', '0.524662', '0.525623', '0.518226', '0.517819', '0.523177', '0.516939', '0.516244', '0.514411']
         : correct/total = [(7332, 14232), (7279, 14235), (7365, 14266), (7440, 14217), (7392, 14238), (7428, 14373), (7587, 14346), (7479, 14334), (7387, 14294), (7499, 14373), (7448, 14344), (7467, 14302), (7531, 14354), (7549, 14362), (7421, 14320), (7454, 14395), (7528, 14389), (7370, 14257), (7357, 14251), (7407, 14399)]
         : compromised: 0.5197, honest: 0.5194
Round 009: test acc mean=0.5233 ± 0.0044 | min=0.5158 max=0.5352
         : test loss mean=0.7180 ± 0.0023
         : individual accs = ['0.519112', '0.515982', '0.519837', '0.522614', '0.520719', '0.524664', '0.535201', '0.522743', '0.520568', '0.523203', '0.524888', '0.529786', '0.527170', '0.525902', '0.525070', '0.524140', '0.522969', '0.515817', '0.519964', '0.526356']
         : correct/total = [(7388, 14232), (7345, 14235), (7416, 14266), (7430, 14217), (7414, 14238), (7541, 14373), (7678, 14346), (7493, 14334), (7441, 14294), (7520, 14373), (7529, 14344), (7577, 14302), (7567, 14354), (7553, 14362), (7519, 14320), (7545, 14395), (7525, 14389), (7354, 14257), (7410, 14251), (7579, 14399)]
         : compromised: 0.5231, honest: 0.5234
Round 010: test acc mean=0.5277 ± 0.0042 | min=0.5157 max=0.5355
         : test loss mean=0.7139 ± 0.0026
         : individual accs = ['0.527122', '0.521883', '0.531614', '0.529296', '0.527462', '0.525777', '0.534156', '0.528603', '0.530502', '0.523829', '0.530535', '0.535520', '0.526682', '0.527642', '0.529190', '0.530392', '0.526791', '0.515677', '0.526068', '0.524967']
         : correct/total = [(7502, 14232), (7429, 14235), (7584, 14266), (7525, 14217), (7510, 14238), (7557, 14373), (7663, 14346), (7577, 14334), (7583, 14294), (7529, 14373), (7610, 14344), (7659, 14302), (7560, 14354), (7578, 14362), (7578, 14320), (7635, 14395), (7580, 14389), (7352, 14257), (7497, 14251), (7559, 14399)]
         : compromised: 0.5252, honest: 0.5288

=== FINAL RESULTS ===
Dataset: sent140, Nodes: 20, Graph: fully, Aggregation: krum
Attack: backdoor, 30.0% compromised
Final accuracy - Compromised: 0.5252, Honest: 0.5288
Overall test accuracy: mean=0.5277 ± 0.0042

=== BACKDOOR ATTACK SUCCESS RATE (ASR) ===
Target label: 1
Trigger size: 3x3
Overall ASR: 0.2013 ± 0.0027
Honest nodes ASR: 0.2018 ± 0.0028
Compromised nodes ASR: 0.1999 ± 0.0018
Note: Higher ASR indicates more successful backdoor attack
