Device: cuda
Seed: 987654321
Loading 1 LEAF Sent140 train files...
LEAF Sent140 train: 254555 users, 908652 samples
Building vocabulary (max_size=10000)...
Vocabulary size: 10000
Loading 1 LEAF Sent140 test files...
LEAF Sent140 test: 254555 users, 286281 samples
Found 254555 train users, 254555 test users, 254555 common users
User sample counts range: 494 (max) to 1 (min)
Distributed ALL 254555 users across 20 clients
Users per client: 12727 (with 15 clients getting +1 user)
Train partition sizes: [44353, 44290, 44657, 44907, 44696, 45843, 45801, 45619, 45069, 45639, 45821, 45311, 45779, 46056, 45625, 45984, 46428, 44737, 45540, 46497]
Test partition sizes: [14232, 14235, 14266, 14217, 14238, 14373, 14346, 14334, 14294, 14373, 14344, 14302, 14354, 14362, 14320, 14395, 14389, 14257, 14251, 14399]
  Client 0: 44353 train samples, 2 unique classes
  Client 1: 44290 train samples, 2 unique classes
  Client 2: 44657 train samples, 2 unique classes
  Client 3: 44907 train samples, 2 unique classes
  Client 4: 44696 train samples, 2 unique classes
  Client 5: 45843 train samples, 2 unique classes
  Client 6: 45801 train samples, 2 unique classes
  Client 7: 45619 train samples, 2 unique classes
  Client 8: 45069 train samples, 2 unique classes
  Client 9: 45639 train samples, 2 unique classes
  Client 10: 45821 train samples, 2 unique classes
  Client 11: 45311 train samples, 2 unique classes
  Client 12: 45779 train samples, 2 unique classes
  Client 13: 46056 train samples, 2 unique classes
  Client 14: 45625 train samples, 2 unique classes
  Client 15: 45984 train samples, 2 unique classes
  Client 16: 46428 train samples, 2 unique classes
  Client 17: 44737 train samples, 2 unique classes
  Client 18: 45540 train samples, 2 unique classes
  Client 19: 46497 train samples, 2 unique classes
Will sample 4500 samples per client per epoch
Graph: ring, nodes: 20, edges: 20
Degree statistics: avg=2.00, min=2, max=2
Attack: Compromised 6/20 nodes: [5, 12, 13, 14, 17, 18]
Attack type: backdoor, lambda: 1.0
Backdoor target label: 1, trigger size: 3
Model variant: baseline
Model parameters: 1,174,986
Initial test acc across nodes: mean=0.4953 ± 0.0174
Backdoor attack: Created poisoned datasets for 6 compromised nodes
Round 001: test acc mean=0.5908 ± 0.0659 | min=0.4952 max=0.6524
         : test loss mean=13.7152 ± 24.5809
         : individual accs = ['0.650646', '0.644468', '0.649236', '0.630794', '0.635483', '0.498782', '0.649937', '0.639877', '0.636911', '0.619286', '0.613009', '0.643197', '0.503901', '0.507172', '0.501746', '0.495241', '0.637501', '0.509013', '0.498070', '0.652406']
         : correct/total = [(9260, 14232), (9174, 14235), (9262, 14266), (8968, 14217), (9048, 14238), (7169, 14373), (9324, 14346), (9172, 14334), (9104, 14294), (8901, 14373), (8793, 14344), (9199, 14302), (7233, 14354), (7284, 14362), (7185, 14320), (7129, 14395), (9173, 14389), (7257, 14257), (7098, 14251), (9394, 14399)]
         : compromised: 0.5031, honest: 0.6284
Round 002: test acc mean=0.5856 ± 0.0724 | min=0.4948 max=0.6753
         : test loss mean=31.1377 ± 113.3533
         : individual accs = ['0.634415', '0.631893', '0.628838', '0.672294', '0.661259', '0.494817', '0.506274', '0.659900', '0.635232', '0.634106', '0.660625', '0.657251', '0.505782', '0.504178', '0.518575', '0.509482', '0.507054', '0.505226', '0.509789', '0.675255']
         : correct/total = [(9029, 14232), (8995, 14235), (8971, 14266), (9558, 14217), (9415, 14238), (7112, 14373), (7263, 14346), (9459, 14334), (9080, 14294), (9114, 14373), (9476, 14344), (9400, 14302), (7260, 14354), (7241, 14362), (7426, 14320), (7334, 14395), (7296, 14389), (7203, 14257), (7265, 14251), (9723, 14399)]
         : compromised: 0.5064, honest: 0.6196
Round 003: test acc mean=0.5936 ± 0.0815 | min=0.4886 max=0.6847
         : test loss mean=38.3816 ± 144.5336
         : individual accs = ['0.650646', '0.650228', '0.678046', '0.684744', '0.666948', '0.496765', '0.504043', '0.660039', '0.672660', '0.665832', '0.666760', '0.671375', '0.515675', '0.508355', '0.502933', '0.511705', '0.512058', '0.497019', '0.488597', '0.667477']
         : correct/total = [(9260, 14232), (9256, 14235), (9673, 14266), (9735, 14217), (9496, 14238), (7140, 14373), (7231, 14346), (9461, 14334), (9615, 14294), (9570, 14373), (9564, 14344), (9602, 14302), (7402, 14354), (7301, 14362), (7202, 14320), (7366, 14395), (7368, 14389), (7086, 14257), (6963, 14251), (9611, 14399)]
         : compromised: 0.5016, honest: 0.6330
Round 004: test acc mean=0.5984 ± 0.0880 | min=0.4850 max=0.6941
         : test loss mean=68.3681 ± 281.5749
         : individual accs = ['0.680298', '0.681208', '0.683864', '0.686713', '0.689493', '0.503444', '0.513105', '0.661434', '0.681545', '0.664927', '0.677426', '0.650049', '0.492267', '0.504526', '0.501676', '0.508024', '0.514838', '0.485025', '0.494141', '0.694076']
         : correct/total = [(9682, 14232), (9697, 14235), (9756, 14266), (9763, 14217), (9817, 14238), (7236, 14373), (7361, 14346), (9481, 14334), (9742, 14294), (9557, 14373), (9717, 14344), (9297, 14302), (7066, 14354), (7246, 14362), (7184, 14320), (7313, 14395), (7408, 14389), (6915, 14257), (7042, 14251), (9994, 14399)]
         : compromised: 0.4968, honest: 0.6419
Round 005: test acc mean=0.6057 ± 0.0898 | min=0.4927 max=0.7071
         : test loss mean=114.0579 ± 469.4845
         : individual accs = ['0.696669', '0.692589', '0.682322', '0.681367', '0.707052', '0.502400', '0.516451', '0.657039', '0.695677', '0.650595', '0.696737', '0.684450', '0.492685', '0.513438', '0.508240', '0.524557', '0.495031', '0.504735', '0.511824', '0.701090']
         : correct/total = [(9915, 14232), (9859, 14235), (9734, 14266), (9687, 14217), (10067, 14238), (7221, 14373), (7409, 14346), (9418, 14334), (9944, 14294), (9351, 14373), (9994, 14344), (9789, 14302), (7072, 14354), (7374, 14362), (7278, 14320), (7551, 14395), (7123, 14389), (7196, 14257), (7294, 14251), (10095, 14399)]
         : compromised: 0.5056, honest: 0.6487
Round 006: test acc mean=0.6114 ± 0.0947 | min=0.4966 max=0.7076
         : test loss mean=425.1081 ± 1833.8534
         : individual accs = ['0.692313', '0.698349', '0.693467', '0.703243', '0.707613', '0.496556', '0.515266', '0.691154', '0.701903', '0.694497', '0.689487', '0.689414', '0.506549', '0.506127', '0.508031', '0.516429', '0.507957', '0.501999', '0.503333', '0.704980']
         : correct/total = [(9853, 14232), (9941, 14235), (9893, 14266), (9998, 14217), (10075, 14238), (7137, 14373), (7392, 14346), (9907, 14334), (10033, 14294), (9982, 14373), (9890, 14344), (9860, 14302), (7271, 14354), (7269, 14362), (7275, 14320), (7434, 14395), (7309, 14389), (7157, 14257), (7173, 14251), (10151, 14399)]
         : compromised: 0.5038, honest: 0.6576
Round 007: test acc mean=0.6148 ± 0.0986 | min=0.4889 max=0.7153
         : test loss mean=1146.4250 ± 4975.4501
         : individual accs = ['0.699199', '0.709378', '0.693467', '0.703946', '0.715339', '0.507062', '0.510316', '0.692479', '0.706800', '0.698880', '0.709983', '0.705636', '0.501393', '0.488859', '0.507612', '0.506704', '0.531587', '0.503051', '0.499544', '0.705049']
         : correct/total = [(9951, 14232), (10098, 14235), (9893, 14266), (10008, 14217), (10185, 14238), (7288, 14373), (7321, 14346), (9926, 14334), (10103, 14294), (10045, 14373), (10184, 14344), (10092, 14302), (7197, 14354), (7021, 14362), (7269, 14320), (7294, 14395), (7649, 14389), (7172, 14257), (7119, 14251), (10152, 14399)]
         : compromised: 0.5013, honest: 0.6635
Round 008: test acc mean=0.6143 ± 0.1005 | min=0.4916 max=0.7191
         : test loss mean=3309.9015 ± 14409.3560
         : individual accs = ['0.714446', '0.706849', '0.676433', '0.715481', '0.682259', '0.503166', '0.530461', '0.706223', '0.715195', '0.708899', '0.698410', '0.706824', '0.506688', '0.502855', '0.495950', '0.506495', '0.504274', '0.491618', '0.494632', '0.719147']
         : correct/total = [(10168, 14232), (10062, 14235), (9650, 14266), (10172, 14217), (9714, 14238), (7232, 14373), (7610, 14346), (10123, 14334), (10223, 14294), (10189, 14373), (10018, 14344), (10109, 14302), (7273, 14354), (7222, 14362), (7102, 14320), (7291, 14395), (7256, 14389), (7009, 14257), (7049, 14251), (10355, 14399)]
         : compromised: 0.4992, honest: 0.6637
Round 009: test acc mean=0.6201 ± 0.1048 | min=0.4953 max=0.7223
         : test loss mean=12141.1915 ± 52908.1064
         : individual accs = ['0.711003', '0.718370', '0.717370', '0.719280', '0.718921', '0.497252', '0.508783', '0.722338', '0.714076', '0.697906', '0.709983', '0.710670', '0.495332', '0.499164', '0.512430', '0.508163', '0.512336', '0.508592', '0.498211', '0.721439']
         : correct/total = [(10119, 14232), (10226, 14235), (10234, 14266), (10226, 14217), (10236, 14238), (7147, 14373), (7299, 14346), (10354, 14334), (10207, 14294), (10031, 14373), (10184, 14344), (10164, 14302), (7110, 14354), (7169, 14362), (7338, 14320), (7315, 14395), (7372, 14389), (7251, 14257), (7100, 14251), (10388, 14399)]
         : compromised: 0.5018, honest: 0.6708
Round 010: test acc mean=0.6232 ± 0.1030 | min=0.4854 max=0.7307
         : test loss mean=39677.4866 ± 172936.6021
         : individual accs = ['0.713182', '0.720478', '0.702720', '0.728494', '0.730721', '0.503444', '0.540499', '0.722199', '0.722051', '0.697419', '0.712075', '0.713187', '0.508290', '0.503621', '0.495670', '0.516846', '0.530266', '0.485446', '0.507824', '0.708869']
         : correct/total = [(10150, 14232), (10256, 14235), (10025, 14266), (10357, 14217), (10404, 14238), (7236, 14373), (7754, 14346), (10352, 14334), (10321, 14294), (10024, 14373), (10214, 14344), (10200, 14302), (7296, 14354), (7233, 14362), (7098, 14320), (7440, 14395), (7630, 14389), (6921, 14257), (7237, 14251), (10207, 14399)]
         : compromised: 0.5007, honest: 0.6756

=== FINAL RESULTS ===
Dataset: sent140, Nodes: 20, Graph: ring, Aggregation: krum
Attack: backdoor, 30.0% compromised
Final accuracy - Compromised: 0.5007, Honest: 0.6756
Overall test accuracy: mean=0.6232 ± 0.1030

=== BACKDOOR ATTACK SUCCESS RATE (ASR) ===
Target label: 1
Trigger size: 3x3
Overall ASR: 0.4516 ± 0.2056
Honest nodes ASR: 0.4586 ± 0.1485
Compromised nodes ASR: 0.4355 ± 0.2984
Note: Higher ASR indicates more successful backdoor attack
