Device: cuda
Seed: 987654321
Loading 1 LEAF Sent140 train files...
LEAF Sent140 train: 254555 users, 908652 samples
Building vocabulary (max_size=10000)...
Vocabulary size: 10000
Loading 1 LEAF Sent140 test files...
LEAF Sent140 test: 254555 users, 286281 samples
Found 254555 train users, 254555 test users, 254555 common users
User sample counts range: 494 (max) to 1 (min)
Distributed ALL 254555 users across 20 clients
Users per client: 12727 (with 15 clients getting +1 user)
Train partition sizes: [44353, 44290, 44657, 44907, 44696, 45843, 45801, 45619, 45069, 45639, 45821, 45311, 45779, 46056, 45625, 45984, 46428, 44737, 45540, 46497]
Test partition sizes: [14232, 14235, 14266, 14217, 14238, 14373, 14346, 14334, 14294, 14373, 14344, 14302, 14354, 14362, 14320, 14395, 14389, 14257, 14251, 14399]
  Client 0: 44353 train samples, 2 unique classes
  Client 1: 44290 train samples, 2 unique classes
  Client 2: 44657 train samples, 2 unique classes
  Client 3: 44907 train samples, 2 unique classes
  Client 4: 44696 train samples, 2 unique classes
  Client 5: 45843 train samples, 2 unique classes
  Client 6: 45801 train samples, 2 unique classes
  Client 7: 45619 train samples, 2 unique classes
  Client 8: 45069 train samples, 2 unique classes
  Client 9: 45639 train samples, 2 unique classes
  Client 10: 45821 train samples, 2 unique classes
  Client 11: 45311 train samples, 2 unique classes
  Client 12: 45779 train samples, 2 unique classes
  Client 13: 46056 train samples, 2 unique classes
  Client 14: 45625 train samples, 2 unique classes
  Client 15: 45984 train samples, 2 unique classes
  Client 16: 46428 train samples, 2 unique classes
  Client 17: 44737 train samples, 2 unique classes
  Client 18: 45540 train samples, 2 unique classes
  Client 19: 46497 train samples, 2 unique classes
Will sample 4500 samples per client per epoch
Graph: fully, nodes: 20, edges: 190
Degree statistics: avg=19.00, min=19, max=19
Attack: Compromised 16/20 nodes: [1, 2, 3, 5, 6, 8, 9, 10, 11, 12, 13, 14, 15, 17, 18, 19]
Attack type: backdoor, lambda: 1.0
Backdoor target label: 1, trigger size: 3
Model variant: baseline
Model parameters: 1,174,986
BALANCE algorithm:
Balance Config: BALANCEConfig(gamma=2, kappa=1, alpha=0.5, min_neighbors=1)
  - Model dimension: 1,174,986 parameters
  - Complexity: O(N×d) = O(20×1,174,986)
Initial test acc across nodes: mean=0.4965 ± 0.0152
Backdoor attack: Created poisoned datasets for 16 compromised nodes
Round 001: test acc mean=0.4994 ± 0.0070 | min=0.4858 max=0.5107
         : test loss mean=26.3511 ± 13.8941
         : individual accs = ['0.508924', '0.493502', '0.485840', '0.493283', '0.499157', '0.491686', '0.507877', '0.491977', '0.510074', '0.499548', '0.500139', '0.494057', '0.503344', '0.510653', '0.508310', '0.500104', '0.502745', '0.498211', '0.490843', '0.497812']
         : correct/total = [(7243, 14232), (7025, 14235), (6931, 14266), (7013, 14217), (7107, 14238), (7067, 14373), (7286, 14346), (7052, 14334), (7291, 14294), (7180, 14373), (7174, 14344), (7066, 14302), (7225, 14354), (7334, 14362), (7279, 14320), (7199, 14395), (7234, 14389), (7103, 14257), (6995, 14251), (7168, 14399)]
         : compromised: 0.4991, honest: 0.5007
Round 002: test acc mean=0.4993 ± 0.0054 | min=0.4892 max=0.5079
         : test loss mean=1116.4824 ± 579.9793
         : individual accs = ['0.505832', '0.507692', '0.489205', '0.490047', '0.495224', '0.507897', '0.502300', '0.498674', '0.504757', '0.498574', '0.496793', '0.494546', '0.505155', '0.496727', '0.494483', '0.499410', '0.496004', '0.495336', '0.502912', '0.504618']
         : correct/total = [(7199, 14232), (7227, 14235), (6979, 14266), (6967, 14217), (7051, 14238), (7300, 14373), (7206, 14346), (7148, 14334), (7215, 14294), (7166, 14373), (7126, 14344), (7073, 14302), (7251, 14354), (7134, 14362), (7081, 14320), (7189, 14395), (7137, 14389), (7062, 14257), (7167, 14251), (7266, 14399)]
         : compromised: 0.4994, honest: 0.4989
Round 003: test acc mean=0.5028 ± 0.0087 | min=0.4860 max=0.5256
         : test loss mean=71862.9264 ± 40360.7493
         : individual accs = ['0.509626', '0.490903', '0.499579', '0.504396', '0.525565', '0.506505', '0.508434', '0.515906', '0.503148', '0.492034', '0.498187', '0.506992', '0.504668', '0.505013', '0.493087', '0.486002', '0.502537', '0.500877', '0.506631', '0.496771']
         : correct/total = [(7253, 14232), (6988, 14235), (7127, 14266), (7171, 14217), (7483, 14238), (7280, 14373), (7294, 14346), (7395, 14334), (7192, 14294), (7072, 14373), (7146, 14344), (7251, 14302), (7244, 14354), (7253, 14362), (7061, 14320), (6996, 14395), (7231, 14389), (7141, 14257), (7220, 14251), (7153, 14399)]
         : compromised: 0.5002, honest: 0.5134
Round 004: test acc mean=0.5052 ± 0.0164 | min=0.4852 max=0.5461
         : test loss mean=11603661.7929 ± 7274978.1717
         : individual accs = ['0.534078', '0.507341', '0.494532', '0.485264', '0.546144', '0.498365', '0.495609', '0.532650', '0.497691', '0.485215', '0.505089', '0.499091', '0.491292', '0.514204', '0.501117', '0.494199', '0.525193', '0.496177', '0.502631', '0.498646']
         : correct/total = [(7601, 14232), (7222, 14235), (7055, 14266), (6899, 14217), (7776, 14238), (7163, 14373), (7110, 14346), (7635, 14334), (7114, 14294), (6974, 14373), (7245, 14344), (7138, 14302), (7052, 14354), (7385, 14362), (7176, 14320), (7114, 14395), (7557, 14389), (7074, 14257), (7163, 14251), (7180, 14399)]
         : compromised: 0.4979, honest: 0.5345
Round 005: test acc mean=0.5097 ± 0.0206 | min=0.4860 max=0.5518
         : test loss mean=539506529.6496 ± 276298974.6623
         : individual accs = ['0.548693', '0.500597', '0.517174', '0.503693', '0.551763', '0.508732', '0.485989', '0.545905', '0.499720', '0.489807', '0.504601', '0.492309', '0.501463', '0.494569', '0.504539', '0.500729', '0.548405', '0.498773', '0.500526', '0.496215']
         : correct/total = [(7809, 14232), (7126, 14235), (7378, 14266), (7161, 14217), (7856, 14238), (7312, 14373), (6972, 14346), (7825, 14334), (7143, 14294), (7040, 14373), (7238, 14344), (7041, 14302), (7198, 14354), (7103, 14362), (7225, 14320), (7208, 14395), (7891, 14389), (7111, 14257), (7133, 14251), (7145, 14399)]
         : compromised: 0.5000, honest: 0.5487
Round 006: test acc mean=0.5123 ± 0.0208 | min=0.4888 max=0.5552
         : test loss mean=40800782791.5129 ± 20776823382.1411
         : individual accs = ['0.555228', '0.505023', '0.504136', '0.502005', '0.555064', '0.510123', '0.488777', '0.552881', '0.502099', '0.499269', '0.504741', '0.499091', '0.499373', '0.498329', '0.497696', '0.509413', '0.547919', '0.501859', '0.509578', '0.503368']
         : correct/total = [(7902, 14232), (7189, 14235), (7192, 14266), (7137, 14217), (7903, 14238), (7332, 14373), (7012, 14346), (7925, 14334), (7177, 14294), (7176, 14373), (7240, 14344), (7138, 14302), (7168, 14354), (7157, 14362), (7127, 14320), (7333, 14395), (7884, 14389), (7155, 14257), (7262, 14251), (7248, 14399)]
         : compromised: 0.5022, honest: 0.5528
Round 007: test acc mean=0.5148 ± 0.0242 | min=0.4948 max=0.5655
         : test loss mean=3331975252569.0249 ± 1705955684728.2656
         : individual accs = ['0.565486', '0.509308', '0.510164', '0.498769', '0.562298', '0.504975', '0.494842', '0.563974', '0.495523', '0.494817', '0.509202', '0.502587', '0.499861', '0.507659', '0.496439', '0.513442', '0.556397', '0.501578', '0.504175', '0.504618']
         : correct/total = [(8048, 14232), (7250, 14235), (7278, 14266), (7091, 14217), (8006, 14238), (7258, 14373), (7099, 14346), (8084, 14334), (7083, 14294), (7112, 14373), (7304, 14344), (7188, 14302), (7175, 14354), (7291, 14362), (7109, 14320), (7391, 14395), (8006, 14389), (7151, 14257), (7185, 14251), (7266, 14399)]
         : compromised: 0.5030, honest: 0.5620
Round 008: test acc mean=0.5159 ± 0.0272 | min=0.4942 max=0.5743
         : test loss mean=277276738913062.5625 ± 142335331898076.3750
         : individual accs = ['0.565486', '0.502283', '0.511075', '0.506084', '0.574308', '0.501218', '0.494214', '0.571090', '0.500420', '0.499130', '0.503625', '0.497623', '0.504598', '0.505779', '0.503701', '0.509969', '0.567934', '0.498211', '0.501579', '0.500382']
         : correct/total = [(8048, 14232), (7150, 14235), (7291, 14266), (7195, 14217), (8177, 14238), (7204, 14373), (7090, 14346), (8186, 14334), (7153, 14294), (7174, 14373), (7224, 14344), (7117, 14302), (7243, 14354), (7264, 14362), (7213, 14320), (7341, 14395), (8172, 14389), (7103, 14257), (7148, 14251), (7205, 14399)]
         : compromised: 0.5025, honest: 0.5697
Round 009: test acc mean=0.5165 ± 0.0302 | min=0.4908 max=0.5795
         : test loss mean=22987467314373344.0000 ± 11968476927784720.0000
         : individual accs = ['0.572232', '0.501159', '0.515561', '0.497222', '0.579506', '0.505253', '0.490799', '0.578764', '0.490835', '0.497739', '0.503904', '0.495735', '0.499094', '0.506406', '0.503631', '0.509621', '0.571895', '0.498211', '0.501930', '0.509827']
         : correct/total = [(8144, 14232), (7134, 14235), (7355, 14266), (7069, 14217), (8251, 14238), (7262, 14373), (7041, 14346), (8296, 14334), (7016, 14294), (7154, 14373), (7228, 14344), (7090, 14302), (7164, 14354), (7273, 14362), (7212, 14320), (7336, 14395), (8229, 14389), (7103, 14257), (7153, 14251), (7341, 14399)]
         : compromised: 0.5017, honest: 0.5756
Round 010: test acc mean=0.5208 ± 0.0338 | min=0.4888 max=0.5934
         : test loss mean=1895737044170474240.0000 ± 997164298480149248.0000
         : individual accs = ['0.589025', '0.501932', '0.508902', '0.504607', '0.586459', '0.503514', '0.488847', '0.593414', '0.498531', '0.501287', '0.513525', '0.500070', '0.505155', '0.509818', '0.500279', '0.507537', '0.581555', '0.507540', '0.506771', '0.506632']
         : correct/total = [(8383, 14232), (7145, 14235), (7260, 14266), (7174, 14217), (8350, 14238), (7237, 14373), (7013, 14346), (8506, 14334), (7126, 14294), (7205, 14373), (7366, 14344), (7152, 14302), (7251, 14354), (7322, 14362), (7164, 14320), (7306, 14395), (8368, 14389), (7236, 14257), (7222, 14251), (7295, 14399)]
         : compromised: 0.5041, honest: 0.5876

=== FINAL RESULTS ===
Dataset: sent140, Nodes: 20, Graph: fully, Aggregation: balance
Attack: backdoor, 80.0% compromised
Final accuracy - Compromised: 0.5041, Honest: 0.5876
Overall test accuracy: mean=0.5208 ± 0.0338

=== BACKDOOR ATTACK SUCCESS RATE (ASR) ===
Target label: 1
Trigger size: 3x3
Overall ASR: 0.8846 ± 0.2117
Honest nodes ASR: 0.4617 ± 0.0105
Compromised nodes ASR: 0.9904 ± 0.0100
Note: Higher ASR indicates more successful backdoor attack

=== BALANCE SUMMARY ===
Node 0: acceptance=0.242
Node 1: acceptance=0.800
Node 2: acceptance=0.800
Node 3: acceptance=0.900
Node 4: acceptance=0.242
Node 5: acceptance=0.800
Node 6: acceptance=0.800
Node 7: acceptance=0.242
Node 8: acceptance=0.800
Node 9: acceptance=0.800
Node 10: acceptance=0.800
Node 11: acceptance=0.800
Node 12: acceptance=0.800
Node 13: acceptance=0.800
Node 14: acceptance=0.800
Node 15: acceptance=0.800
Node 16: acceptance=0.242
Node 17: acceptance=0.800
Node 18: acceptance=0.800
Node 19: acceptance=0.800

=== PARALLEL EXECUTION TIME (realistic for distributed system) ===
  COMMUNICATION (max across nodes):
    - Full model transfer: 0.000s (0.0%)
  COMPUTATION (max across nodes):
    - Filtering: 0.085s (86.8%)
    - Aggregation: 0.013s (13.2%)
  TOTALS:
    - Total computation: 0.098s (100.0%)
    - Total communication: 0.000s (0.0%)
    - Total parallel time: 0.098s

=== PER-NODE AVERAGE TIME ===
  - Filtering: 0.079s
  - Aggregation: 0.011s
  - Model transfer: 0.000s
  - Total per node: 0.090s

=== TOTAL COMPUTATIONAL WORK (sum across all nodes) ===
  - Total filtering: 1.584s
  - Total aggregation: 0.225s
  - Total model transfer: 0.000s
  - Grand total: 1.810s
  - Mean acceptance rate: 0.693

BALANCE Algorithm Properties:
  - Model dimension: 1,174,986
  - No compression: Full parameter comparison
  - Theoretical complexity: O(deg(i)×d)
  - Approach: Full parameter filtering + averaging
