Device: cuda
Seed: 987654321
Loading 1 LEAF Sent140 train files...
LEAF Sent140 train: 254555 users, 908652 samples
Building vocabulary (max_size=10000)...
Vocabulary size: 10000
Loading 1 LEAF Sent140 test files...
LEAF Sent140 test: 254555 users, 286281 samples
Found 254555 train users, 254555 test users, 254555 common users
User sample counts range: 494 (max) to 1 (min)
Distributed ALL 254555 users across 20 clients
Users per client: 12727 (with 15 clients getting +1 user)
Train partition sizes: [44353, 44290, 44657, 44907, 44696, 45843, 45801, 45619, 45069, 45639, 45821, 45311, 45779, 46056, 45625, 45984, 46428, 44737, 45540, 46497]
Test partition sizes: [14232, 14235, 14266, 14217, 14238, 14373, 14346, 14334, 14294, 14373, 14344, 14302, 14354, 14362, 14320, 14395, 14389, 14257, 14251, 14399]
  Client 0: 44353 train samples, 2 unique classes
  Client 1: 44290 train samples, 2 unique classes
  Client 2: 44657 train samples, 2 unique classes
  Client 3: 44907 train samples, 2 unique classes
  Client 4: 44696 train samples, 2 unique classes
  Client 5: 45843 train samples, 2 unique classes
  Client 6: 45801 train samples, 2 unique classes
  Client 7: 45619 train samples, 2 unique classes
  Client 8: 45069 train samples, 2 unique classes
  Client 9: 45639 train samples, 2 unique classes
  Client 10: 45821 train samples, 2 unique classes
  Client 11: 45311 train samples, 2 unique classes
  Client 12: 45779 train samples, 2 unique classes
  Client 13: 46056 train samples, 2 unique classes
  Client 14: 45625 train samples, 2 unique classes
  Client 15: 45984 train samples, 2 unique classes
  Client 16: 46428 train samples, 2 unique classes
  Client 17: 44737 train samples, 2 unique classes
  Client 18: 45540 train samples, 2 unique classes
  Client 19: 46497 train samples, 2 unique classes
Will sample 4500 samples per client per epoch
Graph: erdos, nodes: 20, edges: 48
Degree statistics: avg=4.80, min=2, max=7
Attack: Compromised 2/20 nodes: [5, 13]
Attack type: krum, lambda: 1.0
Model variant: baseline
Model parameters: 1,174,986
Sketchguard Node 0:
  Model dim: 1,174,986 → Sketch size: 180
  Compression ratio: 6527.7x
  Using model parameters for aggregation, sketches for filtering
Sketchguard Node 1:
  Model dim: 1,174,986 → Sketch size: 180
  Compression ratio: 6527.7x
  Using model parameters for aggregation, sketches for filtering
Sketchguard Node 2:
  Model dim: 1,174,986 → Sketch size: 180
  Compression ratio: 6527.7x
  Using model parameters for aggregation, sketches for filtering
Sketchguard Node 3:
  Model dim: 1,174,986 → Sketch size: 180
  Compression ratio: 6527.7x
  Using model parameters for aggregation, sketches for filtering
Sketchguard Node 4:
  Model dim: 1,174,986 → Sketch size: 180
  Compression ratio: 6527.7x
  Using model parameters for aggregation, sketches for filtering
Sketchguard Node 5:
  Model dim: 1,174,986 → Sketch size: 180
  Compression ratio: 6527.7x
  Using model parameters for aggregation, sketches for filtering
Sketchguard Node 6:
  Model dim: 1,174,986 → Sketch size: 180
  Compression ratio: 6527.7x
  Using model parameters for aggregation, sketches for filtering
Sketchguard Node 7:
  Model dim: 1,174,986 → Sketch size: 180
  Compression ratio: 6527.7x
  Using model parameters for aggregation, sketches for filtering
Sketchguard Node 8:
  Model dim: 1,174,986 → Sketch size: 180
  Compression ratio: 6527.7x
  Using model parameters for aggregation, sketches for filtering
Sketchguard Node 9:
  Model dim: 1,174,986 → Sketch size: 180
  Compression ratio: 6527.7x
  Using model parameters for aggregation, sketches for filtering
Sketchguard Node 10:
  Model dim: 1,174,986 → Sketch size: 180
  Compression ratio: 6527.7x
  Using model parameters for aggregation, sketches for filtering
Sketchguard Node 11:
  Model dim: 1,174,986 → Sketch size: 180
  Compression ratio: 6527.7x
  Using model parameters for aggregation, sketches for filtering
Sketchguard Node 12:
  Model dim: 1,174,986 → Sketch size: 180
  Compression ratio: 6527.7x
  Using model parameters for aggregation, sketches for filtering
Sketchguard Node 13:
  Model dim: 1,174,986 → Sketch size: 180
  Compression ratio: 6527.7x
  Using model parameters for aggregation, sketches for filtering
Sketchguard Node 14:
  Model dim: 1,174,986 → Sketch size: 180
  Compression ratio: 6527.7x
  Using model parameters for aggregation, sketches for filtering
Sketchguard Node 15:
  Model dim: 1,174,986 → Sketch size: 180
  Compression ratio: 6527.7x
  Using model parameters for aggregation, sketches for filtering
Sketchguard Node 16:
  Model dim: 1,174,986 → Sketch size: 180
  Compression ratio: 6527.7x
  Using model parameters for aggregation, sketches for filtering
Sketchguard Node 17:
  Model dim: 1,174,986 → Sketch size: 180
  Compression ratio: 6527.7x
  Using model parameters for aggregation, sketches for filtering
Sketchguard Node 18:
  Model dim: 1,174,986 → Sketch size: 180
  Compression ratio: 6527.7x
  Using model parameters for aggregation, sketches for filtering
Sketchguard Node 19:
  Model dim: 1,174,986 → Sketch size: 180
  Compression ratio: 6527.7x
  Using model parameters for aggregation, sketches for filtering
Sketchguard ALGORITHM (Sketch-based Filtering + State Aggregation)
  - Model dimension: 1,174,986 parameters
  - Config: SketchguardConfig(gamma=2, kappa=1, alpha=0.5, min_neighbors=1, sketch_size=180, network_seed=987654321, attack_detection_window=5)
  - Sketch size: 180
  - Compression ratio: 6527.7x
  - Complexity: O(d + N×k) = O(1,174,986 + 20×180)
  - Theoretical speedup vs BALANCE: 19.9x
Initial test acc across nodes: mean=0.4953 ± 0.0174
Round 001: test acc mean=0.5382 ± 0.0343 | min=0.4884 max=0.6009
         : test loss mean=0.7201 ± 0.0650
         : individual accs = ['0.549607', '0.589533', '0.516262', '0.504537', '0.600927', '0.572462', '0.594870', '0.504325', '0.558626', '0.537536', '0.539041', '0.505384', '0.497074', '0.533979', '0.507402', '0.488433', '0.546390', '0.504103', '0.533506', '0.580179']
         : correct/total = [(7822, 14232), (8392, 14235), (7365, 14266), (7173, 14217), (8556, 14238), (8228, 14373), (8534, 14346), (7229, 14334), (7985, 14294), (7726, 14373), (7732, 14344), (7228, 14302), (7135, 14354), (7669, 14362), (7266, 14320), (7031, 14395), (7862, 14389), (7187, 14257), (7603, 14251), (8354, 14399)]
         : compromised: 0.5532, honest: 0.5365
         : sketchguard stats = ['Node 0: acc_rate=1.000', 'Node 1: acc_rate=1.000', 'Node 2: acc_rate=1.000']...
Round 002: test acc mean=0.5684 ± 0.0430 | min=0.4952 max=0.6378
         : test loss mean=0.6866 ± 0.0044
         : individual accs = ['0.613828', '0.514366', '0.608440', '0.597032', '0.497612', '0.504070', '0.557926', '0.617832', '0.581573', '0.495165', '0.595719', '0.585443', '0.559147', '0.552291', '0.531494', '0.610629', '0.524706', '0.587992', '0.595186', '0.637753']
         : correct/total = [(8736, 14232), (7322, 14235), (8680, 14266), (8488, 14217), (7085, 14238), (7245, 14373), (8004, 14346), (8856, 14334), (8313, 14294), (7117, 14373), (8545, 14344), (8373, 14302), (8026, 14354), (7932, 14362), (7611, 14320), (8790, 14395), (7550, 14389), (8383, 14257), (8482, 14251), (9183, 14399)]
         : compromised: 0.5282, honest: 0.5729
         : sketchguard stats = ['Node 0: acc_rate=1.000', 'Node 1: acc_rate=1.000', 'Node 2: acc_rate=1.000']...
Round 003: test acc mean=0.6000 ± 0.0306 | min=0.5132 max=0.6382
         : test loss mean=0.6791 ± 0.0054
         : individual accs = ['0.513210', '0.550193', '0.622809', '0.618907', '0.627616', '0.629096', '0.588317', '0.587135', '0.638170', '0.604675', '0.609941', '0.613131', '0.614881', '0.617602', '0.589804', '0.616881', '0.560289', '0.628323', '0.598765', '0.570387']
         : correct/total = [(7304, 14232), (7832, 14235), (8885, 14266), (8799, 14217), (8936, 14238), (9042, 14373), (8440, 14346), (8416, 14334), (9122, 14294), (8691, 14373), (8749, 14344), (8769, 14302), (8826, 14354), (8870, 14362), (8446, 14320), (8880, 14395), (8062, 14389), (8958, 14257), (8533, 14251), (8213, 14399)]
         : compromised: 0.6233, honest: 0.5974
         : sketchguard stats = ['Node 0: acc_rate=1.000', 'Node 1: acc_rate=1.000', 'Node 2: acc_rate=1.000']...
Round 004: test acc mean=0.6200 ± 0.0138 | min=0.5870 max=0.6392
         : test loss mean=0.6723 ± 0.0068
         : individual accs = ['0.606802', '0.596136', '0.628277', '0.631849', '0.611322', '0.632227', '0.630908', '0.623273', '0.629565', '0.621513', '0.634063', '0.624248', '0.612094', '0.586966', '0.611592', '0.626120', '0.599555', '0.621239', '0.632517', '0.639211']
         : correct/total = [(8636, 14232), (8486, 14235), (8963, 14266), (8983, 14217), (8704, 14238), (9087, 14373), (9051, 14346), (8934, 14334), (8999, 14294), (8933, 14373), (9095, 14344), (8928, 14302), (8786, 14354), (8430, 14362), (8758, 14320), (9013, 14395), (8627, 14389), (8857, 14257), (9014, 14251), (9204, 14399)]
         : compromised: 0.6096, honest: 0.6211
         : sketchguard stats = ['Node 0: acc_rate=1.000', 'Node 1: acc_rate=1.000', 'Node 2: acc_rate=1.000']...
Round 005: test acc mean=0.6334 ± 0.0132 | min=0.5965 max=0.6495
         : test loss mean=0.6639 ± 0.0085
         : individual accs = ['0.596543', '0.641236', '0.627506', '0.640712', '0.649459', '0.639185', '0.641642', '0.635482', '0.635931', '0.626313', '0.639083', '0.636345', '0.638289', '0.629021', '0.641131', '0.646683', '0.614497', '0.636109', '0.606343', '0.645878']
         : correct/total = [(8490, 14232), (9128, 14235), (8952, 14266), (9109, 14217), (9247, 14238), (9187, 14373), (9205, 14346), (9109, 14334), (9090, 14294), (9002, 14373), (9167, 14344), (9101, 14302), (9162, 14354), (9034, 14362), (9181, 14320), (9309, 14395), (8842, 14389), (9069, 14257), (8641, 14251), (9300, 14399)]
         : compromised: 0.6341, honest: 0.6333
         : sketchguard stats = ['Node 0: acc_rate=1.000', 'Node 1: acc_rate=1.000', 'Node 2: acc_rate=1.000']...
Round 006: test acc mean=0.6381 ± 0.0122 | min=0.6127 max=0.6523
         : test loss mean=0.6527 ± 0.0078
         : individual accs = ['0.638420', '0.648261', '0.621618', '0.644580', '0.643770', '0.648021', '0.646591', '0.651249', '0.640479', '0.643011', '0.620956', '0.616767', '0.644420', '0.637168', '0.641969', '0.644321', '0.646675', '0.618784', '0.612659', '0.652268']
         : correct/total = [(9086, 14232), (9228, 14235), (8868, 14266), (9164, 14217), (9166, 14238), (9314, 14373), (9276, 14346), (9335, 14334), (9155, 14294), (9242, 14373), (8907, 14344), (8821, 14302), (9250, 14354), (9151, 14362), (9193, 14320), (9275, 14395), (9305, 14389), (8822, 14257), (8731, 14251), (9392, 14399)]
         : compromised: 0.6426, honest: 0.6376
         : sketchguard stats = ['Node 0: acc_rate=1.000', 'Node 1: acc_rate=1.000', 'Node 2: acc_rate=1.000']...
Round 007: test acc mean=0.6385 ± 0.0136 | min=0.6016 max=0.6553
         : test loss mean=0.6435 ± 0.0079
         : individual accs = ['0.645166', '0.646154', '0.639703', '0.638531', '0.653744', '0.655326', '0.646034', '0.631715', '0.641248', '0.640159', '0.633645', '0.601594', '0.648112', '0.612171', '0.650279', '0.646683', '0.641323', '0.638353', '0.615185', '0.644906']
         : correct/total = [(9182, 14232), (9198, 14235), (9126, 14266), (9078, 14217), (9308, 14238), (9419, 14373), (9268, 14346), (9055, 14334), (9166, 14294), (9201, 14373), (9089, 14344), (8604, 14302), (9303, 14354), (8792, 14362), (9312, 14320), (9309, 14395), (9228, 14389), (9101, 14257), (8767, 14251), (9286, 14399)]
         : compromised: 0.6337, honest: 0.6390
         : sketchguard stats = ['Node 0: acc_rate=1.000', 'Node 1: acc_rate=1.000', 'Node 2: acc_rate=1.000']...
Round 008: test acc mean=0.6482 ± 0.0111 | min=0.6159 max=0.6583
         : test loss mean=0.6338 ± 0.0070
         : individual accs = ['0.644955', '0.621145', '0.615940', '0.656046', '0.647001', '0.653100', '0.658302', '0.655853', '0.655730', '0.654561', '0.653862', '0.653475', '0.646719', '0.641484', '0.654818', '0.651546', '0.651539', '0.648944', '0.640446', '0.657962']
         : correct/total = [(9179, 14232), (8842, 14235), (8787, 14266), (9327, 14217), (9212, 14238), (9387, 14373), (9444, 14346), (9401, 14334), (9373, 14294), (9408, 14373), (9379, 14344), (9346, 14302), (9283, 14354), (9213, 14362), (9377, 14320), (9379, 14395), (9375, 14389), (9252, 14257), (9127, 14251), (9474, 14399)]
         : compromised: 0.6473, honest: 0.6483
         : sketchguard stats = ['Node 0: acc_rate=1.000', 'Node 1: acc_rate=1.000', 'Node 2: acc_rate=1.000']...
Round 009: test acc mean=0.6554 ± 0.0085 | min=0.6289 max=0.6648
         : test loss mean=0.6267 ± 0.0061
         : individual accs = ['0.628935', '0.663576', '0.655615', '0.660196', '0.661610', '0.664232', '0.660602', '0.646644', '0.660067', '0.645585', '0.647448', '0.651238', '0.653407', '0.653669', '0.662221', '0.654950', '0.664813', '0.660938', '0.650972', '0.662129']
         : correct/total = [(8951, 14232), (9446, 14235), (9353, 14266), (9386, 14217), (9420, 14238), (9547, 14373), (9477, 14346), (9269, 14334), (9435, 14294), (9279, 14373), (9287, 14344), (9314, 14302), (9379, 14354), (9388, 14362), (9483, 14320), (9428, 14395), (9566, 14389), (9423, 14257), (9277, 14251), (9534, 14399)]
         : compromised: 0.6590, honest: 0.6551
         : sketchguard stats = ['Node 0: acc_rate=1.000', 'Node 1: acc_rate=1.000', 'Node 2: acc_rate=1.000']...
Round 010: test acc mean=0.6625 ± 0.0085 | min=0.6377 max=0.6740
         : test loss mean=0.6175 ± 0.0064
         : individual accs = ['0.662310', '0.670109', '0.637740', '0.663220', '0.670319', '0.670493', '0.669594', '0.673992', '0.661396', '0.656300', '0.666202', '0.664243', '0.662185', '0.661120', '0.665992', '0.662313', '0.666273', '0.667321', '0.646130', '0.652476']
         : correct/total = [(9426, 14232), (9539, 14235), (9098, 14266), (9429, 14217), (9544, 14238), (9637, 14373), (9606, 14346), (9661, 14334), (9454, 14294), (9433, 14373), (9556, 14344), (9500, 14302), (9505, 14354), (9495, 14362), (9537, 14320), (9534, 14395), (9587, 14389), (9514, 14257), (9208, 14251), (9395, 14399)]
         : compromised: 0.6658, honest: 0.6621
         : sketchguard stats = ['Node 0: acc_rate=1.000', 'Node 1: acc_rate=1.000', 'Node 2: acc_rate=1.000']...

=== FINAL RESULTS ===
Dataset: sent140, Nodes: 20, Graph: erdos, Aggregation: sketchguard
Attack: krum, 10.0% compromised
Final accuracy - Compromised: 0.6658, Honest: 0.6621
Overall test accuracy: mean=0.6625 ± 0.0085

=== Sketchguard SUMMARY ===
Node 0: acceptance=1.000
Node 1: acceptance=1.000
Node 2: acceptance=1.000
Node 3: acceptance=0.775
Node 4: acceptance=1.000
Node 5: acceptance=1.000
Node 6: acceptance=1.000
Node 7: acceptance=0.820
Node 8: acceptance=1.000
Node 9: acceptance=1.000
Node 10: acceptance=1.000
Node 11: acceptance=0.743
Node 12: acceptance=0.871
Node 13: acceptance=1.000
Node 14: acceptance=0.743
Node 15: acceptance=0.850
Node 16: acceptance=1.000
Node 17: acceptance=0.820
Node 18: acceptance=1.000
Node 19: acceptance=1.000

=== PARALLEL EXECUTION TIME (realistic for distributed system) ===
  COMMUNICATION (max across nodes):
    - Sketch transfer: 0.000s (0.0%)
    - Model fetch (accepted): 0.000s (0.0%)
  COMPUTATION (max across nodes):
    - Sketching: 0.301s (95.2%)
    - Filtering: 0.001s (0.3%)
    - Aggregation: 0.014s (4.5%)
  TOTALS:
    - Total computation: 0.316s (100.0%)
    - Total communication: 0.000s (0.0%)
    - Total parallel time: 0.316s

=== PER-NODE AVERAGE TIME ===
  - Sketching: 0.238s
  - Filtering: 0.000s
  - Aggregation: 0.010s
  - Sketch transfer: 0.000s
  - Model fetch: 0.000s
  - Total per node: 0.248s

=== TOTAL COMPUTATIONAL WORK (sum across all nodes) ===
  - Total sketching: 4.764s
  - Total filtering: 0.009s
  - Total aggregation: 0.196s
  - Total sketch transfer: 0.000s
  - Total model fetch: 0.000s
  - Grand total: 4.968s
  - Mean acceptance rate: 0.931

Sketchguard Algorithm Properties:
  - Original dimension: 1,174,986
  - Sketch size: 180
  - Compression ratio: 19.9x
  - Single repetition: No repetitions needed
  - Theoretical complexity: O(d + N×k)
  - Approach: Sketch filtering + state aggregation
