Device: cuda
Seed: 987654321
Loading 1 LEAF Sent140 train files...
LEAF Sent140 train: 254555 users, 908652 samples
Building vocabulary (max_size=10000)...
Vocabulary size: 10000
Loading 1 LEAF Sent140 test files...
LEAF Sent140 test: 254555 users, 286281 samples
Found 254555 train users, 254555 test users, 254555 common users
User sample counts range: 494 (max) to 1 (min)
Distributed ALL 254555 users across 20 clients
Users per client: 12727 (with 15 clients getting +1 user)
Train partition sizes: [44353, 44290, 44657, 44907, 44696, 45843, 45801, 45619, 45069, 45639, 45821, 45311, 45779, 46056, 45625, 45984, 46428, 44737, 45540, 46497]
Test partition sizes: [14232, 14235, 14266, 14217, 14238, 14373, 14346, 14334, 14294, 14373, 14344, 14302, 14354, 14362, 14320, 14395, 14389, 14257, 14251, 14399]
  Client 0: 44353 train samples, 2 unique classes
  Client 1: 44290 train samples, 2 unique classes
  Client 2: 44657 train samples, 2 unique classes
  Client 3: 44907 train samples, 2 unique classes
  Client 4: 44696 train samples, 2 unique classes
  Client 5: 45843 train samples, 2 unique classes
  Client 6: 45801 train samples, 2 unique classes
  Client 7: 45619 train samples, 2 unique classes
  Client 8: 45069 train samples, 2 unique classes
  Client 9: 45639 train samples, 2 unique classes
  Client 10: 45821 train samples, 2 unique classes
  Client 11: 45311 train samples, 2 unique classes
  Client 12: 45779 train samples, 2 unique classes
  Client 13: 46056 train samples, 2 unique classes
  Client 14: 45625 train samples, 2 unique classes
  Client 15: 45984 train samples, 2 unique classes
  Client 16: 46428 train samples, 2 unique classes
  Client 17: 44737 train samples, 2 unique classes
  Client 18: 45540 train samples, 2 unique classes
  Client 19: 46497 train samples, 2 unique classes
Will sample 4500 samples per client per epoch
Graph: erdos, nodes: 20, edges: 126
Degree statistics: avg=12.60, min=8, max=16
Attack: Compromised 14/20 nodes: [1, 2, 3, 5, 6, 8, 11, 12, 13, 14, 15, 17, 18, 19]
Attack type: directed_deviation, lambda: 1.0
Model variant: baseline
Model parameters: 1,174,986
BALANCE algorithm:
Balance Config: BALANCEConfig(gamma=2, kappa=1, alpha=0.5, min_neighbors=1)
  - Model dimension: 1,174,986 parameters
  - Complexity: O(N×d) = O(20×1,174,986)
Initial test acc across nodes: mean=0.4965 ± 0.0152
Round 001: test acc mean=0.5000 ± 0.0071 | min=0.4858 max=0.5120
         : test loss mean=2.8833 ± 1.0629
         : individual accs = ['0.507448', '0.503899', '0.500701', '0.507913', '0.496980', '0.493773', '0.511292', '0.502023', '0.493914', '0.503374', '0.490379', '0.490980', '0.495820', '0.511976', '0.491341', '0.503647', '0.502259', '0.504033', '0.485790', '0.503160']
         : correct/total = [(7222, 14232), (7173, 14235), (7143, 14266), (7221, 14217), (7076, 14238), (7097, 14373), (7335, 14346), (7196, 14334), (7060, 14294), (7235, 14373), (7034, 14344), (7022, 14302), (7117, 14354), (7353, 14362), (7036, 14320), (7250, 14395), (7227, 14389), (7186, 14257), (6923, 14251), (7245, 14399)]
         : compromised: 0.4999, honest: 0.5004
Round 002: test acc mean=0.5045 ± 0.0095 | min=0.4862 max=0.5240
         : test loss mean=0.9801 ± 0.7667
         : individual accs = ['0.517847', '0.494837', '0.508762', '0.504326', '0.501896', '0.504348', '0.513174', '0.509488', '0.488876', '0.520629', '0.504950', '0.506433', '0.486206', '0.524022', '0.508520', '0.503508', '0.497463', '0.495265', '0.499614', '0.499757']
         : correct/total = [(7370, 14232), (7044, 14235), (7258, 14266), (7170, 14217), (7146, 14238), (7249, 14373), (7362, 14346), (7303, 14334), (6988, 14294), (7483, 14373), (7243, 14344), (7243, 14302), (6979, 14354), (7526, 14362), (7282, 14320), (7248, 14395), (7158, 14389), (7061, 14257), (7120, 14251), (7196, 14399)]
         : compromised: 0.5027, honest: 0.5087
Round 003: test acc mean=0.5092 ± 0.0152 | min=0.4831 max=0.5393
         : test loss mean=0.7381 ± 0.0868
         : individual accs = ['0.527333', '0.528767', '0.509603', '0.499754', '0.514468', '0.493634', '0.500070', '0.504046', '0.490416', '0.539345', '0.523285', '0.490421', '0.519367', '0.483080', '0.504888', '0.503717', '0.500382', '0.502630', '0.534559', '0.513716']
         : correct/total = [(7505, 14232), (7527, 14235), (7270, 14266), (7105, 14217), (7325, 14238), (7095, 14373), (7174, 14346), (7225, 14334), (7010, 14294), (7752, 14373), (7506, 14344), (7014, 14302), (7455, 14354), (6938, 14362), (7230, 14320), (7251, 14395), (7200, 14389), (7166, 14257), (7618, 14251), (7397, 14399)]
         : compromised: 0.5053, honest: 0.5181
Round 004: test acc mean=0.5255 ± 0.0170 | min=0.4913 max=0.5625
         : test loss mean=0.7044 ± 0.0245
         : individual accs = ['0.544337', '0.538602', '0.526707', '0.520011', '0.562509', '0.517220', '0.505437', '0.538510', '0.491255', '0.546650', '0.537646', '0.502587', '0.527449', '0.513786', '0.510615', '0.515804', '0.537007', '0.511258', '0.536383', '0.527120']
         : correct/total = [(7747, 14232), (7667, 14235), (7514, 14266), (7393, 14217), (8009, 14238), (7434, 14373), (7251, 14346), (7719, 14334), (7022, 14294), (7857, 14373), (7712, 14344), (7188, 14302), (7571, 14354), (7379, 14362), (7312, 14320), (7425, 14395), (7727, 14389), (7289, 14257), (7644, 14251), (7590, 14399)]
         : compromised: 0.5174, honest: 0.5444
Round 005: test acc mean=0.5610 ± 0.0118 | min=0.5283 max=0.5815
         : test loss mean=0.6833 ± 0.0054
         : individual accs = ['0.575675', '0.568247', '0.541217', '0.558486', '0.581542', '0.567731', '0.557926', '0.564532', '0.528334', '0.571419', '0.567973', '0.562509', '0.552599', '0.555215', '0.560824', '0.555610', '0.560011', '0.558883', '0.575679', '0.555525']
         : correct/total = [(8193, 14232), (8089, 14235), (7721, 14266), (7940, 14217), (8280, 14238), (8160, 14373), (8004, 14346), (8092, 14334), (7552, 14294), (8213, 14373), (8147, 14344), (8045, 14302), (7932, 14354), (7974, 14362), (8031, 14320), (7998, 14395), (8058, 14389), (7968, 14257), (8204, 14251), (7999, 14399)]
         : compromised: 0.5571, honest: 0.5702
Round 006: test acc mean=0.5807 ± 0.0053 | min=0.5723 max=0.5901
         : test loss mean=0.6741 ± 0.0022
         : individual accs = ['0.590149', '0.581524', '0.574583', '0.573257', '0.589549', '0.589021', '0.584693', '0.581415', '0.575066', '0.580881', '0.579127', '0.586421', '0.572314', '0.583484', '0.575349', '0.579715', '0.580930', '0.578032', '0.583678', '0.575040']
         : correct/total = [(8399, 14232), (8278, 14235), (8197, 14266), (8150, 14217), (8394, 14238), (8466, 14373), (8388, 14346), (8334, 14334), (8220, 14294), (8349, 14373), (8307, 14344), (8387, 14302), (8215, 14354), (8380, 14362), (8239, 14320), (8345, 14395), (8359, 14389), (8241, 14257), (8318, 14251), (8280, 14399)]
         : compromised: 0.5794, honest: 0.5837
Round 007: test acc mean=0.5944 ± 0.0052 | min=0.5846 max=0.6041
         : test loss mean=0.6671 ± 0.0022
         : individual accs = ['0.602726', '0.590657', '0.586920', '0.584582', '0.603034', '0.598344', '0.598425', '0.591252', '0.595495', '0.604119', '0.595371', '0.596490', '0.594608', '0.595739', '0.593296', '0.592775', '0.592605', '0.586870', '0.588731', '0.595180']
         : correct/total = [(8578, 14232), (8408, 14235), (8373, 14266), (8311, 14217), (8586, 14238), (8600, 14373), (8585, 14346), (8475, 14334), (8512, 14294), (8683, 14373), (8540, 14344), (8531, 14302), (8535, 14354), (8556, 14362), (8496, 14320), (8533, 14395), (8527, 14389), (8367, 14257), (8390, 14251), (8570, 14399)]
         : compromised: 0.5927, honest: 0.5982
Round 008: test acc mean=0.6028 ± 0.0035 | min=0.5944 max=0.6077
         : test loss mean=0.6623 ± 0.0020
         : individual accs = ['0.606380', '0.599087', '0.594420', '0.598509', '0.606476', '0.603493', '0.604698', '0.601507', '0.602421', '0.607737', '0.605061', '0.602223', '0.601505', '0.606113', '0.605517', '0.603821', '0.602196', '0.596830', '0.601221', '0.606709']
         : correct/total = [(8630, 14232), (8528, 14235), (8480, 14266), (8509, 14217), (8635, 14238), (8674, 14373), (8675, 14346), (8622, 14334), (8611, 14294), (8735, 14373), (8679, 14344), (8613, 14302), (8634, 14354), (8705, 14362), (8671, 14320), (8692, 14395), (8665, 14389), (8509, 14257), (8568, 14251), (8736, 14399)]
         : compromised: 0.6019, honest: 0.6049
Round 009: test acc mean=0.6090 ± 0.0033 | min=0.6043 max=0.6160
         : test loss mean=0.6584 ± 0.0017
         : individual accs = ['0.611017', '0.605971', '0.605566', '0.606176', '0.614412', '0.606206', '0.609856', '0.605763', '0.608157', '0.616016', '0.608338', '0.606978', '0.609865', '0.612101', '0.609008', '0.609587', '0.609841', '0.604265', '0.605642', '0.614626']
         : correct/total = [(8696, 14232), (8626, 14235), (8639, 14266), (8618, 14217), (8748, 14238), (8713, 14373), (8749, 14346), (8683, 14334), (8693, 14294), (8854, 14373), (8726, 14344), (8681, 14302), (8754, 14354), (8791, 14362), (8721, 14320), (8775, 14395), (8775, 14389), (8615, 14257), (8631, 14251), (8850, 14399)]
         : compromised: 0.6081, honest: 0.6109
Round 010: test acc mean=0.6145 ± 0.0041 | min=0.6064 max=0.6231
         : test loss mean=0.6535 ± 0.0017
         : individual accs = ['0.618184', '0.612504', '0.613346', '0.610255', '0.623121', '0.609407', '0.613621', '0.612530', '0.614663', '0.620817', '0.620190', '0.611733', '0.612164', '0.618577', '0.613897', '0.616256', '0.613316', '0.606439', '0.611887', '0.617960']
         : correct/total = [(8798, 14232), (8719, 14235), (8750, 14266), (8676, 14217), (8872, 14238), (8759, 14373), (8803, 14346), (8780, 14334), (8786, 14294), (8923, 14373), (8896, 14344), (8749, 14302), (8787, 14354), (8884, 14362), (8791, 14320), (8871, 14395), (8825, 14389), (8646, 14257), (8720, 14251), (8898, 14399)]
         : compromised: 0.6131, honest: 0.6180

=== FINAL RESULTS ===
Dataset: sent140, Nodes: 20, Graph: erdos, Aggregation: balance
Attack: directed_deviation, 70.0% compromised
Final accuracy - Compromised: 0.6131, Honest: 0.6180
Overall test accuracy: mean=0.6145 ± 0.0041

=== BALANCE SUMMARY ===
Node 0: acceptance=0.381
Node 1: acceptance=0.427
Node 2: acceptance=0.400
Node 3: acceptance=0.438
Node 4: acceptance=0.427
Node 5: acceptance=0.340
Node 6: acceptance=0.357
Node 7: acceptance=0.357
Node 8: acceptance=0.360
Node 9: acceptance=0.377
Node 10: acceptance=0.300
Node 11: acceptance=0.421
Node 12: acceptance=0.400
Node 13: acceptance=0.308
Node 14: acceptance=0.340
Node 15: acceptance=0.345
Node 16: acceptance=0.308
Node 17: acceptance=0.500
Node 18: acceptance=0.381
Node 19: acceptance=0.381

=== PARALLEL EXECUTION TIME (realistic for distributed system) ===
  COMMUNICATION (max across nodes):
    - Full model transfer: 0.000s (0.0%)
  COMPUTATION (max across nodes):
    - Filtering: 0.068s (83.7%)
    - Aggregation: 0.013s (16.3%)
  TOTALS:
    - Total computation: 0.081s (100.0%)
    - Total communication: 0.000s (0.0%)
    - Total parallel time: 0.081s

=== PER-NODE AVERAGE TIME ===
  - Filtering: 0.054s
  - Aggregation: 0.007s
  - Model transfer: 0.000s
  - Total per node: 0.061s

=== TOTAL COMPUTATIONAL WORK (sum across all nodes) ===
  - Total filtering: 1.078s
  - Total aggregation: 0.136s
  - Total model transfer: 0.000s
  - Grand total: 1.213s
  - Mean acceptance rate: 0.377

BALANCE Algorithm Properties:
  - Model dimension: 1,174,986
  - No compression: Full parameter comparison
  - Theoretical complexity: O(deg(i)×d)
  - Approach: Full parameter filtering + averaging
