Device: cuda
Seed: 987654321
Loading 1 LEAF Sent140 train files...
LEAF Sent140 train: 254555 users, 908652 samples
Building vocabulary (max_size=10000)...
Vocabulary size: 10000
Loading 1 LEAF Sent140 test files...
LEAF Sent140 test: 254555 users, 286281 samples
Found 254555 train users, 254555 test users, 254555 common users
User sample counts range: 494 (max) to 1 (min)
Distributed ALL 254555 users across 20 clients
Users per client: 12727 (with 15 clients getting +1 user)
Train partition sizes: [44353, 44290, 44657, 44907, 44696, 45843, 45801, 45619, 45069, 45639, 45821, 45311, 45779, 46056, 45625, 45984, 46428, 44737, 45540, 46497]
Test partition sizes: [14232, 14235, 14266, 14217, 14238, 14373, 14346, 14334, 14294, 14373, 14344, 14302, 14354, 14362, 14320, 14395, 14389, 14257, 14251, 14399]
  Client 0: 44353 train samples, 2 unique classes
  Client 1: 44290 train samples, 2 unique classes
  Client 2: 44657 train samples, 2 unique classes
  Client 3: 44907 train samples, 2 unique classes
  Client 4: 44696 train samples, 2 unique classes
  Client 5: 45843 train samples, 2 unique classes
  Client 6: 45801 train samples, 2 unique classes
  Client 7: 45619 train samples, 2 unique classes
  Client 8: 45069 train samples, 2 unique classes
  Client 9: 45639 train samples, 2 unique classes
  Client 10: 45821 train samples, 2 unique classes
  Client 11: 45311 train samples, 2 unique classes
  Client 12: 45779 train samples, 2 unique classes
  Client 13: 46056 train samples, 2 unique classes
  Client 14: 45625 train samples, 2 unique classes
  Client 15: 45984 train samples, 2 unique classes
  Client 16: 46428 train samples, 2 unique classes
  Client 17: 44737 train samples, 2 unique classes
  Client 18: 45540 train samples, 2 unique classes
  Client 19: 46497 train samples, 2 unique classes
Will sample 4500 samples per client per epoch
Graph: fully, nodes: 20, edges: 190
Degree statistics: avg=19.00, min=19, max=19
Attack: Compromised 14/20 nodes: [1, 2, 3, 5, 6, 8, 11, 12, 13, 14, 15, 17, 18, 19]
Attack type: backdoor, lambda: 1.0
Backdoor target label: 1, trigger size: 3
Model variant: baseline
Model parameters: 1,174,986
Initial test acc across nodes: mean=0.4953 ± 0.0174
Backdoor attack: Created poisoned datasets for 14 compromised nodes
Round 001: test acc mean=0.5011 ± 0.0076 | min=0.4864 max=0.5169
         : test loss mean=11.6314 ± 4.5317
         : individual accs = ['0.509345', '0.516895', '0.496075', '0.514244', '0.490518', '0.499896', '0.500000', '0.511581', '0.495593', '0.496208', '0.495538', '0.500140', '0.505295', '0.486423', '0.506494', '0.504550', '0.498714', '0.495756', '0.502421', '0.496701']
         : correct/total = [(7249, 14232), (7358, 14235), (7077, 14266), (7311, 14217), (6984, 14238), (7185, 14373), (7173, 14346), (7333, 14334), (7084, 14294), (7132, 14373), (7108, 14344), (7153, 14302), (7253, 14354), (6986, 14362), (7253, 14320), (7263, 14395), (7176, 14389), (7068, 14257), (7160, 14251), (7152, 14399)]
         : compromised: 0.5015, honest: 0.5003
Round 002: test acc mean=0.5051 ± 0.0056 | min=0.4923 max=0.5168
         : test loss mean=45.0911 ± 0.5642
         : individual accs = ['0.507729', '0.516754', '0.512828', '0.515228', '0.505549', '0.504140', '0.499930', '0.507255', '0.501259', '0.505114', '0.501952', '0.506992', '0.496656', '0.492271', '0.507402', '0.502258', '0.506985', '0.505085', '0.504175', '0.502118']
         : correct/total = [(7226, 14232), (7356, 14235), (7316, 14266), (7325, 14217), (7198, 14238), (7246, 14373), (7172, 14346), (7271, 14334), (7165, 14294), (7260, 14373), (7200, 14344), (7251, 14302), (7129, 14354), (7070, 14362), (7266, 14320), (7230, 14395), (7295, 14389), (7201, 14257), (7185, 14251), (7230, 14399)]
         : compromised: 0.5048, honest: 0.5058
Round 003: test acc mean=0.5051 ± 0.0055 | min=0.4932 max=0.5170
         : test loss mean=41.0839 ± 0.4894
         : individual accs = ['0.507378', '0.516965', '0.513038', '0.515088', '0.505478', '0.504140', '0.500209', '0.507255', '0.501819', '0.504766', '0.501603', '0.506153', '0.497144', '0.493176', '0.507402', '0.502258', '0.507471', '0.504664', '0.504386', '0.501910']
         : correct/total = [(7221, 14232), (7359, 14235), (7319, 14266), (7323, 14217), (7197, 14238), (7246, 14373), (7176, 14346), (7271, 14334), (7173, 14294), (7255, 14373), (7195, 14344), (7239, 14302), (7136, 14354), (7083, 14362), (7266, 14320), (7230, 14395), (7302, 14389), (7195, 14257), (7188, 14251), (7227, 14399)]
         : compromised: 0.5049, honest: 0.5057
Round 004: test acc mean=0.5052 ± 0.0054 | min=0.4932 max=0.5169
         : test loss mean=109.3581 ± 1.3418
         : individual accs = ['0.507518', '0.516895', '0.512968', '0.515228', '0.505478', '0.504279', '0.500139', '0.507255', '0.501959', '0.504835', '0.501813', '0.506083', '0.497213', '0.493176', '0.507123', '0.502327', '0.507540', '0.504664', '0.504526', '0.502118']
         : correct/total = [(7223, 14232), (7358, 14235), (7318, 14266), (7325, 14217), (7197, 14238), (7248, 14373), (7175, 14346), (7271, 14334), (7175, 14294), (7256, 14373), (7198, 14344), (7238, 14302), (7137, 14354), (7083, 14362), (7262, 14320), (7231, 14395), (7303, 14389), (7195, 14257), (7190, 14251), (7230, 14399)]
         : compromised: 0.5049, honest: 0.5057
Round 005: test acc mean=0.5081 ± 0.0049 | min=0.4956 max=0.5150
         : test loss mean=33.9211 ± 0.4468
         : individual accs = ['0.511523', '0.495609', '0.507570', '0.505522', '0.502458', '0.509497', '0.506413', '0.504535', '0.510004', '0.505949', '0.509481', '0.508810', '0.511495', '0.500279', '0.513338', '0.515040', '0.505664', '0.514274', '0.509648', '0.514897']
         : correct/total = [(7280, 14232), (7055, 14235), (7241, 14266), (7187, 14217), (7154, 14238), (7323, 14373), (7265, 14346), (7232, 14334), (7290, 14294), (7272, 14373), (7308, 14344), (7277, 14302), (7342, 14354), (7185, 14362), (7351, 14320), (7414, 14395), (7276, 14389), (7332, 14257), (7263, 14251), (7414, 14399)]
         : compromised: 0.5087, honest: 0.5066
Round 006: test acc mean=0.4986 ± 0.0050 | min=0.4862 max=0.5091
         : test loss mean=37.6279 ± 0.4563
         : individual accs = ['0.494238', '0.501721', '0.486191', '0.490610', '0.500281', '0.497182', '0.500279', '0.500907', '0.503428', '0.498365', '0.500627', '0.496924', '0.505782', '0.500975', '0.496159', '0.509135', '0.500313', '0.493933', '0.495193', '0.499132']
         : correct/total = [(7034, 14232), (7142, 14235), (6936, 14266), (6975, 14217), (7123, 14238), (7146, 14373), (7177, 14346), (7180, 14334), (7196, 14294), (7163, 14373), (7181, 14344), (7107, 14302), (7260, 14354), (7195, 14362), (7105, 14320), (7329, 14395), (7199, 14389), (7042, 14257), (7057, 14251), (7187, 14399)]
         : compromised: 0.4983, honest: 0.4991
Round 007: test acc mean=0.4996 ± 0.0052 | min=0.4924 max=0.5124
         : test loss mean=34.6004 ± 0.4477
         : individual accs = ['0.495644', '0.492378', '0.496145', '0.492931', '0.497331', '0.499200', '0.504461', '0.504325', '0.505177', '0.497252', '0.492540', '0.494406', '0.500906', '0.507172', '0.496648', '0.500938', '0.500174', '0.503963', '0.497649', '0.512397']
         : correct/total = [(7054, 14232), (7009, 14235), (7078, 14266), (7008, 14217), (7081, 14238), (7175, 14373), (7237, 14346), (7229, 14334), (7221, 14294), (7147, 14373), (7065, 14344), (7071, 14302), (7190, 14354), (7284, 14362), (7112, 14320), (7211, 14395), (7197, 14389), (7185, 14257), (7092, 14251), (7378, 14399)]
         : compromised: 0.5003, honest: 0.4979
Round 008: test acc mean=0.4950 ± 0.0043 | min=0.4869 max=0.5052
         : test loss mean=26.8368 ± 0.3897
         : individual accs = ['0.498595', '0.498771', '0.501122', '0.505170', '0.489816', '0.491199', '0.494981', '0.493233', '0.494753', '0.494956', '0.499651', '0.496224', '0.494009', '0.486910', '0.495461', '0.496214', '0.496004', '0.495125', '0.489439', '0.488506']
         : correct/total = [(7096, 14232), (7100, 14235), (7149, 14266), (7182, 14217), (6974, 14238), (7060, 14373), (7101, 14346), (7070, 14334), (7072, 14294), (7114, 14373), (7167, 14344), (7097, 14302), (7091, 14354), (6993, 14362), (7095, 14320), (7143, 14395), (7137, 14389), (7059, 14257), (6975, 14251), (7034, 14399)]
         : compromised: 0.4948, honest: 0.4954
Round 009: test acc mean=0.5086 ± 0.0057 | min=0.4976 max=0.5236
         : test loss mean=27.1252 ± 0.3923
         : individual accs = ['0.502881', '0.502494', '0.509533', '0.502005', '0.497612', '0.512906', '0.505367', '0.506069', '0.512942', '0.509845', '0.502301', '0.506992', '0.515048', '0.523604', '0.509846', '0.510594', '0.514004', '0.510135', '0.507894', '0.510730']
         : correct/total = [(7157, 14232), (7153, 14235), (7269, 14266), (7137, 14217), (7085, 14238), (7372, 14373), (7250, 14346), (7254, 14334), (7332, 14294), (7328, 14373), (7205, 14344), (7251, 14302), (7393, 14354), (7520, 14362), (7301, 14320), (7350, 14395), (7396, 14389), (7273, 14257), (7238, 14251), (7354, 14399)]
         : compromised: 0.5100, honest: 0.5055
Round 010: test acc mean=0.4936 ± 0.0042 | min=0.4833 max=0.4998
         : test loss mean=49.8762 ± 0.4870
         : individual accs = ['0.495714', '0.492940', '0.486962', '0.493705', '0.493047', '0.498852', '0.495609', '0.487024', '0.497621', '0.491129', '0.495190', '0.499790', '0.498676', '0.496867', '0.494134', '0.490170', '0.493502', '0.491548', '0.483264', '0.495521']
         : correct/total = [(7055, 14232), (7017, 14235), (6947, 14266), (7019, 14217), (7020, 14238), (7170, 14373), (7110, 14346), (6981, 14334), (7113, 14294), (7059, 14373), (7103, 14344), (7148, 14302), (7158, 14354), (7136, 14362), (7076, 14320), (7056, 14395), (7101, 14389), (7008, 14257), (6887, 14251), (7135, 14399)]
         : compromised: 0.4940, honest: 0.4926

=== FINAL RESULTS ===
Dataset: sent140, Nodes: 20, Graph: fully, Aggregation: d-fedavg
Attack: backdoor, 70.0% compromised
Final accuracy - Compromised: 0.4940, Honest: 0.4926
Overall test accuracy: mean=0.4936 ± 0.0042

=== BACKDOOR ATTACK SUCCESS RATE (ASR) ===
Target label: 1
Trigger size: 3x3
Overall ASR: 0.8156 ± 0.0038
Honest nodes ASR: 0.8168 ± 0.0037
Compromised nodes ASR: 0.8151 ± 0.0037
Note: Higher ASR indicates more successful backdoor attack
