Device: cuda
Seed: 987654321
Loading 1 LEAF Sent140 train files...
LEAF Sent140 train: 254555 users, 908652 samples
Building vocabulary (max_size=10000)...
Vocabulary size: 10000
Loading 1 LEAF Sent140 test files...
LEAF Sent140 test: 254555 users, 286281 samples
Found 254555 train users, 254555 test users, 254555 common users
User sample counts range: 494 (max) to 1 (min)
Distributed ALL 254555 users across 20 clients
Users per client: 12727 (with 15 clients getting +1 user)
Train partition sizes: [44353, 44290, 44657, 44907, 44696, 45843, 45801, 45619, 45069, 45639, 45821, 45311, 45779, 46056, 45625, 45984, 46428, 44737, 45540, 46497]
Test partition sizes: [14232, 14235, 14266, 14217, 14238, 14373, 14346, 14334, 14294, 14373, 14344, 14302, 14354, 14362, 14320, 14395, 14389, 14257, 14251, 14399]
  Client 0: 44353 train samples, 2 unique classes
  Client 1: 44290 train samples, 2 unique classes
  Client 2: 44657 train samples, 2 unique classes
  Client 3: 44907 train samples, 2 unique classes
  Client 4: 44696 train samples, 2 unique classes
  Client 5: 45843 train samples, 2 unique classes
  Client 6: 45801 train samples, 2 unique classes
  Client 7: 45619 train samples, 2 unique classes
  Client 8: 45069 train samples, 2 unique classes
  Client 9: 45639 train samples, 2 unique classes
  Client 10: 45821 train samples, 2 unique classes
  Client 11: 45311 train samples, 2 unique classes
  Client 12: 45779 train samples, 2 unique classes
  Client 13: 46056 train samples, 2 unique classes
  Client 14: 45625 train samples, 2 unique classes
  Client 15: 45984 train samples, 2 unique classes
  Client 16: 46428 train samples, 2 unique classes
  Client 17: 44737 train samples, 2 unique classes
  Client 18: 45540 train samples, 2 unique classes
  Client 19: 46497 train samples, 2 unique classes
Will sample 4500 samples per client per epoch
Graph: erdos, nodes: 20, edges: 48
Degree statistics: avg=4.80, min=2, max=7
Attack: Compromised 8/20 nodes: [1, 5, 11, 12, 13, 14, 17, 18]
Attack type: directed_deviation, lambda: 1.0
Model variant: baseline
Model parameters: 1,174,986
Initial test acc across nodes: mean=0.4965 ± 0.0152
Round 001: test acc mean=0.5043 ± 0.0215 | min=0.4889 max=0.5931
         : test loss mean=6.9286 ± 6.4619
         : individual accs = ['0.593100', '0.511275', '0.488855', '0.494900', '0.495435', '0.502331', '0.491705', '0.514581', '0.493914', '0.500313', '0.497839', '0.497413', '0.492964', '0.503830', '0.501746', '0.496909', '0.505942', '0.502700', '0.491334', '0.508924']
         : correct/total = [(8441, 14232), (7278, 14235), (6974, 14266), (7036, 14217), (7054, 14238), (7220, 14373), (7054, 14346), (7376, 14334), (7060, 14294), (7191, 14373), (7141, 14344), (7114, 14302), (7076, 14354), (7236, 14362), (7185, 14320), (7153, 14395), (7280, 14389), (7167, 14257), (7002, 14251), (7328, 14399)]
         : compromised: 0.5004, honest: 0.5069
Round 002: test acc mean=0.5010 ± 0.0078 | min=0.4872 max=0.5159
         : test loss mean=5.9173 ± 5.0308
         : individual accs = ['0.515880', '0.513172', '0.494673', '0.499543', '0.495786', '0.498504', '0.493936', '0.501744', '0.498811', '0.506644', '0.487242', '0.497832', '0.511495', '0.511210', '0.487849', '0.505384', '0.501355', '0.503191', '0.492036', '0.503924']
         : correct/total = [(7342, 14232), (7305, 14235), (7057, 14266), (7102, 14217), (7059, 14238), (7165, 14373), (7086, 14346), (7192, 14334), (7130, 14294), (7282, 14373), (6989, 14344), (7120, 14302), (7342, 14354), (7342, 14362), (6986, 14320), (7275, 14395), (7214, 14389), (7174, 14257), (7012, 14251), (7256, 14399)]
         : compromised: 0.5019, honest: 0.5004
Round 003: test acc mean=0.5076 ± 0.0101 | min=0.4893 max=0.5225
         : test loss mean=1.7613 ± 1.3291
         : individual accs = ['0.520096', '0.521531', '0.517594', '0.509249', '0.489956', '0.489320', '0.503904', '0.510604', '0.511893', '0.505392', '0.505229', '0.511607', '0.522502', '0.491227', '0.505028', '0.507121', '0.492251', '0.516308', '0.505859', '0.514480']
         : correct/total = [(7402, 14232), (7424, 14235), (7384, 14266), (7240, 14217), (6976, 14238), (7033, 14373), (7229, 14346), (7319, 14334), (7317, 14294), (7264, 14373), (7247, 14344), (7317, 14302), (7500, 14354), (7055, 14362), (7232, 14320), (7300, 14395), (7083, 14389), (7361, 14257), (7209, 14251), (7408, 14399)]
         : compromised: 0.5079, honest: 0.5073
Round 004: test acc mean=0.5092 ± 0.0128 | min=0.4868 max=0.5493
         : test loss mean=3.7402 ± 5.1010
         : individual accs = ['0.549255', '0.518300', '0.499930', '0.505451', '0.506391', '0.501844', '0.495887', '0.509418', '0.511683', '0.525638', '0.507320', '0.507202', '0.486763', '0.522281', '0.498115', '0.506009', '0.505386', '0.513362', '0.514701', '0.499549']
         : correct/total = [(7817, 14232), (7378, 14235), (7132, 14266), (7186, 14217), (7210, 14238), (7213, 14373), (7114, 14346), (7302, 14334), (7314, 14294), (7555, 14373), (7277, 14344), (7254, 14302), (6987, 14354), (7501, 14362), (7133, 14320), (7284, 14395), (7272, 14389), (7319, 14257), (7335, 14251), (7193, 14399)]
         : compromised: 0.5078, honest: 0.5102
Round 005: test acc mean=0.5031 ± 0.0080 | min=0.4893 max=0.5162
         : test loss mean=1.8614 ± 1.8357
         : individual accs = ['0.514615', '0.509589', '0.515772', '0.497362', '0.489254', '0.497878', '0.505855', '0.504674', '0.516231', '0.500591', '0.508645', '0.491050', '0.506270', '0.492132', '0.504190', '0.498090', '0.504205', '0.493652', '0.511262', '0.500799']
         : correct/total = [(7324, 14232), (7254, 14235), (7358, 14266), (7071, 14217), (6966, 14238), (7156, 14373), (7257, 14346), (7234, 14334), (7379, 14294), (7195, 14373), (7296, 14344), (7023, 14302), (7267, 14354), (7068, 14362), (7220, 14320), (7170, 14395), (7255, 14389), (7038, 14257), (7286, 14251), (7211, 14399)]
         : compromised: 0.5008, honest: 0.5047
Round 006: test acc mean=0.5038 ± 0.0101 | min=0.4783 max=0.5260
         : test loss mean=2.4966 ± 2.8036
         : individual accs = ['0.525998', '0.509449', '0.503925', '0.513259', '0.506602', '0.505183', '0.489753', '0.505023', '0.500560', '0.505253', '0.506553', '0.503356', '0.487808', '0.478276', '0.495950', '0.512331', '0.501633', '0.501789', '0.509438', '0.514063']
         : correct/total = [(7486, 14232), (7252, 14235), (7189, 14266), (7297, 14217), (7213, 14238), (7261, 14373), (7026, 14346), (7239, 14334), (7155, 14294), (7262, 14373), (7266, 14344), (7199, 14302), (7002, 14354), (6869, 14362), (7102, 14320), (7375, 14395), (7218, 14389), (7154, 14257), (7260, 14251), (7402, 14399)]
         : compromised: 0.4989, honest: 0.5071
Round 007: test acc mean=0.5006 ± 0.0077 | min=0.4873 max=0.5148
         : test loss mean=1.6002 ± 1.2887
         : individual accs = ['0.514826', '0.498279', '0.487312', '0.498347', '0.492344', '0.495652', '0.503485', '0.504814', '0.497412', '0.489251', '0.497142', '0.494686', '0.507663', '0.490252', '0.504120', '0.505592', '0.512544', '0.499123', '0.511262', '0.507049']
         : correct/total = [(7327, 14232), (7093, 14235), (6952, 14266), (7085, 14217), (7010, 14238), (7124, 14373), (7223, 14346), (7236, 14334), (7110, 14294), (7032, 14373), (7131, 14344), (7075, 14302), (7287, 14354), (7041, 14362), (7219, 14320), (7278, 14395), (7375, 14389), (7116, 14257), (7286, 14251), (7301, 14399)]
         : compromised: 0.5001, honest: 0.5008
Round 008: test acc mean=0.5023 ± 0.0100 | min=0.4822 max=0.5319
         : test loss mean=2.2152 ± 2.5568
         : individual accs = ['0.512366', '0.504812', '0.511496', '0.503693', '0.503090', '0.493356', '0.500767', '0.505372', '0.495173', '0.502818', '0.505089', '0.488743', '0.494218', '0.482245', '0.500140', '0.505384', '0.505247', '0.493652', '0.506631', '0.531912']
         : correct/total = [(7292, 14232), (7186, 14235), (7297, 14266), (7161, 14217), (7163, 14238), (7091, 14373), (7184, 14346), (7244, 14334), (7078, 14294), (7227, 14373), (7245, 14344), (6990, 14302), (7094, 14354), (6926, 14362), (7162, 14320), (7275, 14395), (7270, 14389), (7038, 14257), (7220, 14251), (7659, 14399)]
         : compromised: 0.4955, honest: 0.5069
Round 009: test acc mean=0.4996 ± 0.0078 | min=0.4900 max=0.5157
         : test loss mean=1.7762 ± 1.9042
         : individual accs = ['0.515669', '0.514647', '0.505958', '0.492650', '0.498314', '0.492034', '0.490032', '0.499372', '0.491465', '0.504766', '0.497142', '0.500979', '0.493173', '0.495962', '0.505307', '0.490379', '0.503023', '0.490706', '0.510210', '0.501146']
         : correct/total = [(7339, 14232), (7326, 14235), (7218, 14266), (7004, 14217), (7095, 14238), (7072, 14373), (7030, 14346), (7158, 14334), (7025, 14294), (7255, 14373), (7131, 14344), (7165, 14302), (7079, 14354), (7123, 14362), (7236, 14320), (7059, 14395), (7238, 14389), (6996, 14257), (7271, 14251), (7216, 14399)]
         : compromised: 0.5004, honest: 0.4992
Round 010: test acc mean=0.4992 ± 0.0121 | min=0.4726 max=0.5299
         : test loss mean=1.9948 ± 2.2885
         : individual accs = ['0.529862', '0.515139', '0.494462', '0.490399', '0.507515', '0.494817', '0.491496', '0.493233', '0.504897', '0.498852', '0.509830', '0.504894', '0.487948', '0.493873', '0.472626', '0.501633', '0.510390', '0.488953', '0.487755', '0.505591']
         : correct/total = [(7541, 14232), (7333, 14235), (7054, 14266), (6972, 14217), (7226, 14238), (7112, 14373), (7051, 14346), (7070, 14334), (7217, 14294), (7170, 14373), (7313, 14344), (7221, 14302), (7004, 14354), (7093, 14362), (6768, 14320), (7221, 14395), (7344, 14389), (6971, 14257), (6951, 14251), (7280, 14399)]
         : compromised: 0.4933, honest: 0.5032

=== FINAL RESULTS ===
Dataset: sent140, Nodes: 20, Graph: erdos, Aggregation: krum
Attack: directed_deviation, 40.0% compromised
Final accuracy - Compromised: 0.4933, Honest: 0.5032
Overall test accuracy: mean=0.4992 ± 0.0121
