Device: cuda
Seed: 987654321
Loading 1 LEAF Sent140 train files...
LEAF Sent140 train: 254555 users, 908652 samples
Building vocabulary (max_size=10000)...
Vocabulary size: 10000
Loading 1 LEAF Sent140 test files...
LEAF Sent140 test: 254555 users, 286281 samples
Found 254555 train users, 254555 test users, 254555 common users
User sample counts range: 494 (max) to 1 (min)
Distributed ALL 254555 users across 20 clients
Users per client: 12727 (with 15 clients getting +1 user)
Train partition sizes: [44353, 44290, 44657, 44907, 44696, 45843, 45801, 45619, 45069, 45639, 45821, 45311, 45779, 46056, 45625, 45984, 46428, 44737, 45540, 46497]
Test partition sizes: [14232, 14235, 14266, 14217, 14238, 14373, 14346, 14334, 14294, 14373, 14344, 14302, 14354, 14362, 14320, 14395, 14389, 14257, 14251, 14399]
  Client 0: 44353 train samples, 2 unique classes
  Client 1: 44290 train samples, 2 unique classes
  Client 2: 44657 train samples, 2 unique classes
  Client 3: 44907 train samples, 2 unique classes
  Client 4: 44696 train samples, 2 unique classes
  Client 5: 45843 train samples, 2 unique classes
  Client 6: 45801 train samples, 2 unique classes
  Client 7: 45619 train samples, 2 unique classes
  Client 8: 45069 train samples, 2 unique classes
  Client 9: 45639 train samples, 2 unique classes
  Client 10: 45821 train samples, 2 unique classes
  Client 11: 45311 train samples, 2 unique classes
  Client 12: 45779 train samples, 2 unique classes
  Client 13: 46056 train samples, 2 unique classes
  Client 14: 45625 train samples, 2 unique classes
  Client 15: 45984 train samples, 2 unique classes
  Client 16: 46428 train samples, 2 unique classes
  Client 17: 44737 train samples, 2 unique classes
  Client 18: 45540 train samples, 2 unique classes
  Client 19: 46497 train samples, 2 unique classes
Will sample 4500 samples per client per epoch
Graph: ring, nodes: 20, edges: 20
Degree statistics: avg=2.00, min=2, max=2
Attack: Compromised 10/20 nodes: [1, 2, 5, 11, 12, 13, 14, 15, 17, 18]
Attack type: directed_deviation, lambda: 1.0
Model variant: baseline
Model parameters: 1,174,986
Initial test acc across nodes: mean=0.4953 ± 0.0174
Round 001: test acc mean=0.5041 ± 0.0103 | min=0.4894 max=0.5338
         : test loss mean=8.6942 ± 10.7281
         : individual accs = ['0.499227', '0.514366', '0.500210', '0.512837', '0.496137', '0.489390', '0.502509', '0.524766', '0.502169', '0.533779', '0.496933', '0.501049', '0.500418', '0.506545', '0.499441', '0.500104', '0.505734', '0.507260', '0.494772', '0.494757']
         : correct/total = [(7105, 14232), (7322, 14235), (7136, 14266), (7291, 14217), (7064, 14238), (7034, 14373), (7209, 14346), (7522, 14334), (7178, 14294), (7672, 14373), (7128, 14344), (7166, 14302), (7183, 14354), (7275, 14362), (7152, 14320), (7199, 14395), (7277, 14389), (7232, 14257), (7051, 14251), (7124, 14399)]
         : compromised: 0.5014, honest: 0.5069
Round 002: test acc mean=0.4947 ± 0.0087 | min=0.4788 max=0.5091
         : test loss mean=4.7072 ± 3.1279
         : individual accs = ['0.489812', '0.492729', '0.483597', '0.493353', '0.495294', '0.499826', '0.481110', '0.505093', '0.509095', '0.504905', '0.478806', '0.491190', '0.505922', '0.503342', '0.503911', '0.495658', '0.482313', '0.493722', '0.493299', '0.490451']
         : correct/total = [(6971, 14232), (7014, 14235), (6899, 14266), (7014, 14217), (7052, 14238), (7184, 14373), (6902, 14346), (7240, 14334), (7277, 14294), (7257, 14373), (6868, 14344), (7025, 14302), (7262, 14354), (7229, 14362), (7216, 14320), (7135, 14395), (6940, 14389), (7039, 14257), (7030, 14251), (7062, 14399)]
         : compromised: 0.4963, honest: 0.4930
Round 003: test acc mean=0.5047 ± 0.0089 | min=0.4863 max=0.5260
         : test loss mean=2.3165 ± 1.6511
         : individual accs = ['0.516934', '0.515420', '0.504696', '0.504326', '0.508147', '0.502887', '0.501812', '0.503837', '0.526025', '0.505531', '0.503277', '0.504265', '0.509753', '0.512533', '0.497905', '0.496353', '0.487803', '0.486287', '0.501438', '0.505035']
         : correct/total = [(7357, 14232), (7337, 14235), (7200, 14266), (7170, 14217), (7235, 14238), (7228, 14373), (7199, 14346), (7222, 14334), (7519, 14294), (7266, 14373), (7219, 14344), (7212, 14302), (7317, 14354), (7361, 14362), (7130, 14320), (7145, 14395), (7019, 14389), (6933, 14257), (7146, 14251), (7272, 14399)]
         : compromised: 0.5032, honest: 0.5063
Round 004: test acc mean=0.5065 ± 0.0099 | min=0.4857 max=0.5366
         : test loss mean=2.3542 ± 2.0954
         : individual accs = ['0.504918', '0.500386', '0.513388', '0.509601', '0.509341', '0.507549', '0.512547', '0.536626', '0.504687', '0.504557', '0.514431', '0.507481', '0.495402', '0.490948', '0.504958', '0.507259', '0.510529', '0.509013', '0.485650', '0.500868']
         : correct/total = [(7186, 14232), (7123, 14235), (7324, 14266), (7245, 14217), (7252, 14238), (7295, 14373), (7353, 14346), (7692, 14334), (7214, 14294), (7252, 14373), (7379, 14344), (7258, 14302), (7111, 14354), (7051, 14362), (7231, 14320), (7302, 14395), (7346, 14389), (7257, 14257), (6921, 14251), (7212, 14399)]
         : compromised: 0.5022, honest: 0.5108
Round 005: test acc mean=0.5091 ± 0.0145 | min=0.4900 max=0.5616
         : test loss mean=1.4759 ± 0.9253
         : individual accs = ['0.506254', '0.514085', '0.495093', '0.490047', '0.501264', '0.501496', '0.513662', '0.498116', '0.561634', '0.510888', '0.500070', '0.511047', '0.524314', '0.516711', '0.515782', '0.503786', '0.498228', '0.501999', '0.508947', '0.509410']
         : correct/total = [(7205, 14232), (7318, 14235), (7063, 14266), (6967, 14217), (7137, 14238), (7208, 14373), (7369, 14346), (7140, 14334), (8028, 14294), (7343, 14373), (7173, 14344), (7309, 14302), (7526, 14354), (7421, 14362), (7386, 14320), (7252, 14395), (7169, 14389), (7157, 14257), (7253, 14251), (7335, 14399)]
         : compromised: 0.5093, honest: 0.5090
Round 006: test acc mean=0.5023 ± 0.0139 | min=0.4771 max=0.5479
         : test loss mean=1.7865 ± 1.3126
         : individual accs = ['0.497962', '0.501510', '0.485210', '0.506225', '0.507515', '0.502679', '0.512686', '0.547928', '0.519029', '0.496417', '0.491425', '0.477066', '0.500209', '0.511349', '0.492947', '0.501285', '0.493293', '0.500596', '0.502351', '0.499201']
         : correct/total = [(7087, 14232), (7139, 14235), (6922, 14266), (7197, 14217), (7226, 14238), (7225, 14373), (7355, 14346), (7854, 14334), (7419, 14294), (7135, 14373), (7049, 14344), (6823, 14302), (7180, 14354), (7344, 14362), (7059, 14320), (7216, 14395), (7098, 14389), (7137, 14257), (7159, 14251), (7188, 14399)]
         : compromised: 0.4975, honest: 0.5072
Round 007: test acc mean=0.5112 ± 0.0280 | min=0.4844 max=0.6100
         : test loss mean=1.5403 ± 1.1118
         : individual accs = ['0.507448', '0.501440', '0.484368', '0.500598', '0.503020', '0.509914', '0.503276', '0.569136', '0.609976', '0.509984', '0.494004', '0.502937', '0.491710', '0.492550', '0.499651', '0.509899', '0.514143', '0.518202', '0.501368', '0.500382']
         : correct/total = [(7222, 14232), (7138, 14235), (6910, 14266), (7117, 14217), (7162, 14238), (7329, 14373), (7220, 14346), (8158, 14334), (8719, 14294), (7330, 14373), (7086, 14344), (7193, 14302), (7058, 14354), (7074, 14362), (7155, 14320), (7340, 14395), (7398, 14389), (7388, 14257), (7145, 14251), (7205, 14399)]
         : compromised: 0.5012, honest: 0.5212
Round 008: test acc mean=0.5134 ± 0.0264 | min=0.4869 max=0.5925
         : test loss mean=1.9286 ± 1.9576
         : individual accs = ['0.509626', '0.495399', '0.486892', '0.512555', '0.514749', '0.500035', '0.516172', '0.577508', '0.592486', '0.538023', '0.514083', '0.489512', '0.506270', '0.507381', '0.497975', '0.496006', '0.499965', '0.502209', '0.498000', '0.512327']
         : correct/total = [(7253, 14232), (7052, 14235), (6946, 14266), (7287, 14217), (7329, 14238), (7187, 14373), (7405, 14346), (8278, 14334), (8469, 14294), (7733, 14373), (7374, 14344), (7001, 14302), (7267, 14354), (7287, 14362), (7131, 14320), (7140, 14395), (7194, 14389), (7160, 14257), (7097, 14251), (7377, 14399)]
         : compromised: 0.4980, honest: 0.5287
Round 009: test acc mean=0.5242 ± 0.0348 | min=0.4944 max=0.6183
         : test loss mean=1.5126 ± 1.1700
         : individual accs = ['0.511523', '0.510573', '0.494392', '0.498206', '0.506953', '0.514715', '0.522236', '0.618320', '0.615783', '0.573088', '0.535346', '0.511187', '0.515396', '0.508146', '0.511941', '0.508440', '0.504413', '0.502841', '0.506140', '0.515105']
         : correct/total = [(7280, 14232), (7268, 14235), (7053, 14266), (7083, 14217), (7218, 14238), (7398, 14373), (7492, 14346), (8863, 14334), (8802, 14294), (8237, 14373), (7679, 14344), (7311, 14302), (7398, 14354), (7298, 14362), (7331, 14320), (7319, 14395), (7258, 14389), (7169, 14257), (7213, 14251), (7417, 14399)]
         : compromised: 0.5084, honest: 0.5401
Round 010: test acc mean=0.5262 ± 0.0442 | min=0.4922 max=0.6304
         : test loss mean=1.8513 ± 1.9329
         : individual accs = ['0.531408', '0.500738', '0.492219', '0.519308', '0.503863', '0.508105', '0.528231', '0.627948', '0.630404', '0.623182', '0.508366', '0.506083', '0.505643', '0.506963', '0.495251', '0.502675', '0.495378', '0.501929', '0.495334', '0.540801']
         : correct/total = [(7563, 14232), (7128, 14235), (7022, 14266), (7383, 14217), (7174, 14238), (7303, 14373), (7578, 14346), (9001, 14334), (9011, 14294), (8957, 14373), (7292, 14344), (7238, 14302), (7258, 14354), (7281, 14362), (7092, 14320), (7236, 14395), (7128, 14389), (7156, 14257), (7059, 14251), (7787, 14399)]
         : compromised: 0.5015, honest: 0.5509

=== FINAL RESULTS ===
Dataset: sent140, Nodes: 20, Graph: ring, Aggregation: d-fedavg
Attack: directed_deviation, 50.0% compromised
Final accuracy - Compromised: 0.5015, Honest: 0.5509
Overall test accuracy: mean=0.5262 ± 0.0442
