Device: cuda
Seed: 987654321
Loading 1 LEAF Sent140 train files...
LEAF Sent140 train: 254555 users, 908652 samples
Building vocabulary (max_size=10000)...
Vocabulary size: 10000
Loading 1 LEAF Sent140 test files...
LEAF Sent140 test: 254555 users, 286281 samples
Found 254555 train users, 254555 test users, 254555 common users
User sample counts range: 494 (max) to 1 (min)
Distributed ALL 254555 users across 20 clients
Users per client: 12727 (with 15 clients getting +1 user)
Train partition sizes: [44353, 44290, 44657, 44907, 44696, 45843, 45801, 45619, 45069, 45639, 45821, 45311, 45779, 46056, 45625, 45984, 46428, 44737, 45540, 46497]
Test partition sizes: [14232, 14235, 14266, 14217, 14238, 14373, 14346, 14334, 14294, 14373, 14344, 14302, 14354, 14362, 14320, 14395, 14389, 14257, 14251, 14399]
  Client 0: 44353 train samples, 2 unique classes
  Client 1: 44290 train samples, 2 unique classes
  Client 2: 44657 train samples, 2 unique classes
  Client 3: 44907 train samples, 2 unique classes
  Client 4: 44696 train samples, 2 unique classes
  Client 5: 45843 train samples, 2 unique classes
  Client 6: 45801 train samples, 2 unique classes
  Client 7: 45619 train samples, 2 unique classes
  Client 8: 45069 train samples, 2 unique classes
  Client 9: 45639 train samples, 2 unique classes
  Client 10: 45821 train samples, 2 unique classes
  Client 11: 45311 train samples, 2 unique classes
  Client 12: 45779 train samples, 2 unique classes
  Client 13: 46056 train samples, 2 unique classes
  Client 14: 45625 train samples, 2 unique classes
  Client 15: 45984 train samples, 2 unique classes
  Client 16: 46428 train samples, 2 unique classes
  Client 17: 44737 train samples, 2 unique classes
  Client 18: 45540 train samples, 2 unique classes
  Client 19: 46497 train samples, 2 unique classes
Will sample 4500 samples per client per epoch
Graph: erdos, nodes: 20, edges: 99
Degree statistics: avg=9.90, min=7, max=14
Attack: Compromised 12/20 nodes: [1, 2, 3, 5, 8, 11, 12, 13, 14, 15, 17, 18]
Attack type: gaussian, lambda: 1.0
Model variant: baseline
Model parameters: 1,174,986
BALANCE algorithm:
Balance Config: BALANCEConfig(gamma=2, kappa=1, alpha=0.5, min_neighbors=1)
  - Model dimension: 1,174,986 parameters
  - Complexity: O(N×d) = O(20×1,174,986)
Initial test acc across nodes: mean=0.4965 ± 0.0152
Round 001: test acc mean=0.5471 ± 0.0181 | min=0.5090 max=0.5800
         : test loss mean=0.6915 ± 0.0005
         : individual accs = ['0.518479', '0.550825', '0.519767', '0.564254', '0.552255', '0.539623', '0.539593', '0.573950', '0.553659', '0.579976', '0.542875', '0.558453', '0.559287', '0.546999', '0.557961', '0.522959', '0.561123', '0.509013', '0.550207', '0.540871']
         : correct/total = [(7379, 14232), (7841, 14235), (7415, 14266), (8022, 14217), (7863, 14238), (7756, 14373), (7741, 14346), (8227, 14334), (7914, 14294), (8336, 14373), (7787, 14344), (7987, 14302), (8028, 14354), (7856, 14362), (7990, 14320), (7528, 14395), (8074, 14389), (7257, 14257), (7841, 14251), (7788, 14399)]
         : compromised: 0.5444, honest: 0.5511
Round 002: test acc mean=0.4970 ± 0.0100 | min=0.4861 max=0.5332
         : test loss mean=0.6931 ± 0.0005
         : individual accs = ['0.489109', '0.486266', '0.486051', '0.492228', '0.497331', '0.493843', '0.497560', '0.500488', '0.488457', '0.493008', '0.499024', '0.492658', '0.499512', '0.508564', '0.495810', '0.498367', '0.533185', '0.503051', '0.488738', '0.496354']
         : correct/total = [(6961, 14232), (6922, 14235), (6934, 14266), (6998, 14217), (7081, 14238), (7098, 14373), (7138, 14346), (7174, 14334), (6982, 14294), (7086, 14373), (7158, 14344), (7046, 14302), (7170, 14354), (7304, 14362), (7100, 14320), (7174, 14395), (7672, 14389), (7172, 14257), (6965, 14251), (7147, 14399)]
         : compromised: 0.4945, honest: 0.5008
Round 003: test acc mean=0.4949 ± 0.0056 | min=0.4861 max=0.5086
         : test loss mean=0.6938 ± 0.0004
         : individual accs = ['0.489109', '0.486266', '0.486051', '0.492228', '0.494100', '0.493843', '0.497560', '0.495186', '0.488457', '0.493008', '0.499024', '0.492029', '0.499512', '0.508564', '0.495810', '0.498367', '0.499757', '0.503051', '0.488738', '0.496354']
         : correct/total = [(6961, 14232), (6922, 14235), (6934, 14266), (6998, 14217), (7035, 14238), (7098, 14373), (7138, 14346), (7098, 14334), (6982, 14294), (7086, 14373), (7158, 14344), (7037, 14302), (7170, 14354), (7304, 14362), (7100, 14320), (7174, 14395), (7191, 14389), (7172, 14257), (6965, 14251), (7147, 14399)]
         : compromised: 0.4944, honest: 0.4955
Round 004: test acc mean=0.4949 ± 0.0056 | min=0.4861 max=0.5086
         : test loss mean=0.6938 ± 0.0003
         : individual accs = ['0.489109', '0.486266', '0.486051', '0.492228', '0.494100', '0.493843', '0.497560', '0.495186', '0.488457', '0.493008', '0.499024', '0.492029', '0.499512', '0.508564', '0.495810', '0.498367', '0.499757', '0.503051', '0.488738', '0.496354']
         : correct/total = [(6961, 14232), (6922, 14235), (6934, 14266), (6998, 14217), (7035, 14238), (7098, 14373), (7138, 14346), (7098, 14334), (6982, 14294), (7086, 14373), (7158, 14344), (7037, 14302), (7170, 14354), (7304, 14362), (7100, 14320), (7174, 14395), (7191, 14389), (7172, 14257), (6965, 14251), (7147, 14399)]
         : compromised: 0.4944, honest: 0.4955
Round 005: test acc mean=0.4949 ± 0.0056 | min=0.4861 max=0.5086
         : test loss mean=0.6939 ± 0.0004
         : individual accs = ['0.489109', '0.486266', '0.486051', '0.492228', '0.494100', '0.493843', '0.497560', '0.495186', '0.488457', '0.493008', '0.499024', '0.492029', '0.499512', '0.508564', '0.495810', '0.498367', '0.499757', '0.503051', '0.488738', '0.496354']
         : correct/total = [(6961, 14232), (6922, 14235), (6934, 14266), (6998, 14217), (7035, 14238), (7098, 14373), (7138, 14346), (7098, 14334), (6982, 14294), (7086, 14373), (7158, 14344), (7037, 14302), (7170, 14354), (7304, 14362), (7100, 14320), (7174, 14395), (7191, 14389), (7172, 14257), (6965, 14251), (7147, 14399)]
         : compromised: 0.4944, honest: 0.4955
Round 006: test acc mean=0.4949 ± 0.0056 | min=0.4861 max=0.5086
         : test loss mean=0.6938 ± 0.0004
         : individual accs = ['0.489109', '0.486266', '0.486051', '0.492228', '0.494100', '0.493843', '0.497560', '0.495186', '0.488457', '0.493008', '0.499024', '0.492029', '0.499512', '0.508564', '0.495810', '0.498367', '0.499757', '0.503051', '0.488738', '0.496354']
         : correct/total = [(6961, 14232), (6922, 14235), (6934, 14266), (6998, 14217), (7035, 14238), (7098, 14373), (7138, 14346), (7098, 14334), (6982, 14294), (7086, 14373), (7158, 14344), (7037, 14302), (7170, 14354), (7304, 14362), (7100, 14320), (7174, 14395), (7191, 14389), (7172, 14257), (6965, 14251), (7147, 14399)]
         : compromised: 0.4944, honest: 0.4955
Round 007: test acc mean=0.4949 ± 0.0056 | min=0.4861 max=0.5086
         : test loss mean=0.6938 ± 0.0003
         : individual accs = ['0.489109', '0.486266', '0.486051', '0.492228', '0.494100', '0.493843', '0.497560', '0.495186', '0.488457', '0.493008', '0.499024', '0.492029', '0.499512', '0.508564', '0.495810', '0.498367', '0.499757', '0.503051', '0.488738', '0.496354']
         : correct/total = [(6961, 14232), (6922, 14235), (6934, 14266), (6998, 14217), (7035, 14238), (7098, 14373), (7138, 14346), (7098, 14334), (6982, 14294), (7086, 14373), (7158, 14344), (7037, 14302), (7170, 14354), (7304, 14362), (7100, 14320), (7174, 14395), (7191, 14389), (7172, 14257), (6965, 14251), (7147, 14399)]
         : compromised: 0.4944, honest: 0.4955
Round 008: test acc mean=0.4949 ± 0.0056 | min=0.4861 max=0.5086
         : test loss mean=0.6937 ± 0.0004
         : individual accs = ['0.489109', '0.486266', '0.486051', '0.492228', '0.494100', '0.493843', '0.497560', '0.495186', '0.488457', '0.493008', '0.499024', '0.492029', '0.499512', '0.508564', '0.495810', '0.498367', '0.499757', '0.503051', '0.488738', '0.496354']
         : correct/total = [(6961, 14232), (6922, 14235), (6934, 14266), (6998, 14217), (7035, 14238), (7098, 14373), (7138, 14346), (7098, 14334), (6982, 14294), (7086, 14373), (7158, 14344), (7037, 14302), (7170, 14354), (7304, 14362), (7100, 14320), (7174, 14395), (7191, 14389), (7172, 14257), (6965, 14251), (7147, 14399)]
         : compromised: 0.4944, honest: 0.4955
Round 009: test acc mean=0.4949 ± 0.0056 | min=0.4861 max=0.5086
         : test loss mean=0.6936 ± 0.0004
         : individual accs = ['0.489109', '0.486266', '0.486051', '0.492228', '0.494100', '0.493843', '0.497560', '0.495186', '0.488457', '0.493008', '0.499024', '0.492029', '0.499512', '0.508564', '0.495810', '0.498367', '0.499757', '0.503051', '0.488738', '0.496354']
         : correct/total = [(6961, 14232), (6922, 14235), (6934, 14266), (6998, 14217), (7035, 14238), (7098, 14373), (7138, 14346), (7098, 14334), (6982, 14294), (7086, 14373), (7158, 14344), (7037, 14302), (7170, 14354), (7304, 14362), (7100, 14320), (7174, 14395), (7191, 14389), (7172, 14257), (6965, 14251), (7147, 14399)]
         : compromised: 0.4944, honest: 0.4955
Round 010: test acc mean=0.4949 ± 0.0056 | min=0.4861 max=0.5086
         : test loss mean=0.6936 ± 0.0004
         : individual accs = ['0.489109', '0.486266', '0.486051', '0.492228', '0.494100', '0.493843', '0.497560', '0.495186', '0.488457', '0.493008', '0.499024', '0.492029', '0.499512', '0.508564', '0.495810', '0.498367', '0.499757', '0.503051', '0.488738', '0.496354']
         : correct/total = [(6961, 14232), (6922, 14235), (6934, 14266), (6998, 14217), (7035, 14238), (7098, 14373), (7138, 14346), (7098, 14334), (6982, 14294), (7086, 14373), (7158, 14344), (7037, 14302), (7170, 14354), (7304, 14362), (7100, 14320), (7174, 14395), (7191, 14389), (7172, 14257), (6965, 14251), (7147, 14399)]
         : compromised: 0.4944, honest: 0.4955

=== FINAL RESULTS ===
Dataset: sent140, Nodes: 20, Graph: erdos, Aggregation: balance
Attack: gaussian, 60.0% compromised
Final accuracy - Compromised: 0.4944, Honest: 0.4955
Overall test accuracy: mean=0.4949 ± 0.0056

=== BALANCE SUMMARY ===
Node 0: acceptance=0.417
Node 1: acceptance=0.500
Node 2: acceptance=0.500
Node 3: acceptance=0.571
Node 4: acceptance=0.333
Node 5: acceptance=0.400
Node 6: acceptance=0.333
Node 7: acceptance=0.273
Node 8: acceptance=0.286
Node 9: acceptance=0.545
Node 10: acceptance=0.500
Node 11: acceptance=0.333
Node 12: acceptance=0.500
Node 13: acceptance=0.333
Node 14: acceptance=0.357
Node 15: acceptance=0.444
Node 16: acceptance=0.286
Node 17: acceptance=0.625
Node 18: acceptance=0.333
Node 19: acceptance=0.300

=== PARALLEL EXECUTION TIME (realistic for distributed system) ===
  COMMUNICATION (max across nodes):
    - Full model transfer: 0.000s (0.0%)
  COMPUTATION (max across nodes):
    - Filtering: 0.059s (80.9%)
    - Aggregation: 0.014s (19.1%)
  TOTALS:
    - Total computation: 0.073s (100.0%)
    - Total communication: 0.000s (0.0%)
    - Total parallel time: 0.073s

=== PER-NODE AVERAGE TIME ===
  - Filtering: 0.043s
  - Aggregation: 0.006s
  - Model transfer: 0.000s
  - Total per node: 0.050s

=== TOTAL COMPUTATIONAL WORK (sum across all nodes) ===
  - Total filtering: 0.866s
  - Total aggregation: 0.127s
  - Total model transfer: 0.000s
  - Grand total: 0.994s
  - Mean acceptance rate: 0.409

BALANCE Algorithm Properties:
  - Model dimension: 1,174,986
  - No compression: Full parameter comparison
  - Theoretical complexity: O(deg(i)×d)
  - Approach: Full parameter filtering + averaging
