Device: cuda
Seed: 987654321
Loading 1 LEAF Sent140 train files...
LEAF Sent140 train: 254555 users, 908652 samples
Building vocabulary (max_size=10000)...
Vocabulary size: 10000
Loading 1 LEAF Sent140 test files...
LEAF Sent140 test: 254555 users, 286281 samples
Found 254555 train users, 254555 test users, 254555 common users
User sample counts range: 494 (max) to 1 (min)
Distributed ALL 254555 users across 20 clients
Users per client: 12727 (with 15 clients getting +1 user)
Train partition sizes: [44353, 44290, 44657, 44907, 44696, 45843, 45801, 45619, 45069, 45639, 45821, 45311, 45779, 46056, 45625, 45984, 46428, 44737, 45540, 46497]
Test partition sizes: [14232, 14235, 14266, 14217, 14238, 14373, 14346, 14334, 14294, 14373, 14344, 14302, 14354, 14362, 14320, 14395, 14389, 14257, 14251, 14399]
  Client 0: 44353 train samples, 2 unique classes
  Client 1: 44290 train samples, 2 unique classes
  Client 2: 44657 train samples, 2 unique classes
  Client 3: 44907 train samples, 2 unique classes
  Client 4: 44696 train samples, 2 unique classes
  Client 5: 45843 train samples, 2 unique classes
  Client 6: 45801 train samples, 2 unique classes
  Client 7: 45619 train samples, 2 unique classes
  Client 8: 45069 train samples, 2 unique classes
  Client 9: 45639 train samples, 2 unique classes
  Client 10: 45821 train samples, 2 unique classes
  Client 11: 45311 train samples, 2 unique classes
  Client 12: 45779 train samples, 2 unique classes
  Client 13: 46056 train samples, 2 unique classes
  Client 14: 45625 train samples, 2 unique classes
  Client 15: 45984 train samples, 2 unique classes
  Client 16: 46428 train samples, 2 unique classes
  Client 17: 44737 train samples, 2 unique classes
  Client 18: 45540 train samples, 2 unique classes
  Client 19: 46497 train samples, 2 unique classes
Will sample 4500 samples per client per epoch
Graph: erdos, nodes: 20, edges: 48
Degree statistics: avg=4.80, min=2, max=7
Attack: Compromised 16/20 nodes: [1, 2, 3, 5, 6, 8, 9, 10, 11, 12, 13, 14, 15, 17, 18, 19]
Attack type: krum, lambda: 1.0
Model variant: baseline
Model parameters: 1,174,986
BALANCE algorithm:
Balance Config: BALANCEConfig(gamma=2, kappa=1, alpha=0.5, min_neighbors=1)
  - Model dimension: 1,174,986 parameters
  - Complexity: O(N×d) = O(20×1,174,986)
Initial test acc across nodes: mean=0.4965 ± 0.0152
Round 001: test acc mean=0.5006 ± 0.0055 | min=0.4880 max=0.5121
         : test loss mean=3.4705 ± 1.8853
         : individual accs = ['0.501546', '0.504742', '0.501963', '0.492298', '0.506953', '0.496069', '0.503416', '0.512069', '0.496152', '0.503792', '0.496654', '0.500909', '0.502299', '0.487954', '0.506564', '0.501841', '0.499270', '0.502560', '0.502281', '0.492326']
         : correct/total = [(7138, 14232), (7185, 14235), (7161, 14266), (6999, 14217), (7218, 14238), (7130, 14373), (7222, 14346), (7340, 14334), (7092, 14294), (7241, 14373), (7124, 14344), (7164, 14302), (7210, 14354), (7008, 14362), (7254, 14320), (7224, 14395), (7184, 14389), (7165, 14257), (7158, 14251), (7089, 14399)]
         : compromised: 0.4995, honest: 0.5050
Round 002: test acc mean=0.4989 ± 0.0091 | min=0.4880 max=0.5187
         : test loss mean=3.6204 ± 2.1195
         : individual accs = ['0.492482', '0.506498', '0.497126', '0.493705', '0.500773', '0.513532', '0.493866', '0.492465', '0.506716', '0.488903', '0.518684', '0.499860', '0.489480', '0.512603', '0.496159', '0.509344', '0.488359', '0.488041', '0.490211', '0.498507']
         : correct/total = [(7009, 14232), (7210, 14235), (7092, 14266), (7019, 14217), (7130, 14238), (7381, 14373), (7085, 14346), (7059, 14334), (7243, 14294), (7027, 14373), (7440, 14344), (7149, 14302), (7026, 14354), (7362, 14362), (7105, 14320), (7332, 14395), (7027, 14389), (6958, 14257), (6986, 14251), (7178, 14399)]
         : compromised: 0.5002, honest: 0.4935
Round 003: test acc mean=0.5044 ± 0.0096 | min=0.4889 max=0.5323
         : test loss mean=1.8447 ± 0.8077
         : individual accs = ['0.503232', '0.517878', '0.504486', '0.505029', '0.497893', '0.504905', '0.508922', '0.501326', '0.532251', '0.516315', '0.501743', '0.511187', '0.498676', '0.494499', '0.494483', '0.511080', '0.499965', '0.496668', '0.488948', '0.497812']
         : correct/total = [(7162, 14232), (7372, 14235), (7197, 14266), (7180, 14217), (7089, 14238), (7257, 14373), (7301, 14346), (7186, 14334), (7608, 14294), (7421, 14373), (7197, 14344), (7311, 14302), (7158, 14354), (7102, 14362), (7081, 14320), (7357, 14395), (7194, 14389), (7081, 14257), (6968, 14251), (7168, 14399)]
         : compromised: 0.5053, honest: 0.5006
Round 004: test acc mean=0.5015 ± 0.0062 | min=0.4905 max=0.5133
         : test loss mean=2.1813 ± 1.6439
         : individual accs = ['0.496135', '0.503969', '0.506449', '0.490469', '0.503020', '0.503931', '0.505786', '0.510744', '0.497901', '0.494190', '0.496375', '0.496854', '0.513306', '0.506475', '0.496089', '0.503647', '0.510251', '0.493091', '0.502000', '0.498854']
         : correct/total = [(7061, 14232), (7174, 14235), (7225, 14266), (6973, 14217), (7162, 14238), (7243, 14373), (7256, 14346), (7321, 14334), (7117, 14294), (7103, 14373), (7120, 14344), (7106, 14302), (7368, 14354), (7274, 14362), (7104, 14320), (7250, 14395), (7342, 14389), (7030, 14257), (7154, 14251), (7183, 14399)]
         : compromised: 0.5006, honest: 0.5050
Round 005: test acc mean=0.5061 ± 0.0068 | min=0.4952 max=0.5192
         : test loss mean=1.1539 ± 0.3830
         : individual accs = ['0.504005', '0.503267', '0.498598', '0.519167', '0.513836', '0.495234', '0.498885', '0.516325', '0.505877', '0.504766', '0.508784', '0.517130', '0.506270', '0.512394', '0.504469', '0.496006', '0.500035', '0.508522', '0.499684', '0.507882']
         : correct/total = [(7173, 14232), (7164, 14235), (7113, 14266), (7381, 14217), (7316, 14238), (7118, 14373), (7157, 14346), (7401, 14334), (7231, 14294), (7255, 14373), (7298, 14344), (7396, 14302), (7267, 14354), (7359, 14362), (7224, 14320), (7140, 14395), (7195, 14389), (7250, 14257), (7121, 14251), (7313, 14399)]
         : compromised: 0.5054, honest: 0.5086
Round 006: test acc mean=0.5058 ± 0.0112 | min=0.4887 max=0.5280
         : test loss mean=1.4645 ± 1.0579
         : individual accs = ['0.505340', '0.514506', '0.492430', '0.494408', '0.528024', '0.516315', '0.510526', '0.527766', '0.510774', '0.506018', '0.517708', '0.500839', '0.491570', '0.511071', '0.498743', '0.488711', '0.498019', '0.509294', '0.495053', '0.498924']
         : correct/total = [(7192, 14232), (7324, 14235), (7025, 14266), (7029, 14217), (7518, 14238), (7421, 14373), (7324, 14346), (7565, 14334), (7301, 14294), (7273, 14373), (7426, 14344), (7163, 14302), (7056, 14354), (7340, 14362), (7142, 14320), (7035, 14395), (7166, 14389), (7261, 14257), (7055, 14251), (7184, 14399)]
         : compromised: 0.5036, honest: 0.5148
Round 007: test acc mean=0.5133 ± 0.0099 | min=0.4937 max=0.5322
         : test loss mean=1.0244 ± 0.4911
         : individual accs = ['0.516863', '0.504320', '0.505608', '0.514314', '0.530763', '0.526612', '0.493726', '0.532231', '0.502588', '0.514089', '0.523424', '0.517061', '0.504737', '0.512185', '0.501466', '0.515943', '0.503927', '0.514344', '0.512736', '0.519133']
         : correct/total = [(7356, 14232), (7179, 14235), (7213, 14266), (7312, 14217), (7557, 14238), (7569, 14373), (7083, 14346), (7629, 14334), (7184, 14294), (7389, 14373), (7508, 14344), (7395, 14302), (7245, 14354), (7356, 14362), (7181, 14320), (7427, 14395), (7251, 14389), (7333, 14257), (7307, 14251), (7475, 14399)]
         : compromised: 0.5114, honest: 0.5209
Round 008: test acc mean=0.5159 ± 0.0125 | min=0.4955 max=0.5380
         : test loss mean=0.9922 ± 0.5230
         : individual accs = ['0.512999', '0.513945', '0.499579', '0.495534', '0.530833', '0.531622', '0.504531', '0.531394', '0.513642', '0.514367', '0.537995', '0.500000', '0.515396', '0.515597', '0.504190', '0.527197', '0.514351', '0.516448', '0.536103', '0.503021']
         : correct/total = [(7301, 14232), (7316, 14235), (7127, 14266), (7045, 14217), (7558, 14238), (7641, 14373), (7238, 14346), (7617, 14334), (7342, 14294), (7393, 14373), (7717, 14344), (7151, 14302), (7398, 14354), (7405, 14362), (7220, 14320), (7589, 14395), (7401, 14389), (7363, 14257), (7640, 14251), (7243, 14399)]
         : compromised: 0.5143, honest: 0.5224
Round 009: test acc mean=0.5209 ± 0.0125 | min=0.4976 max=0.5394
         : test loss mean=1.0184 ± 0.6322
         : individual accs = ['0.519604', '0.509730', '0.525025', '0.508124', '0.536382', '0.539414', '0.514569', '0.538440', '0.524626', '0.515620', '0.531860', '0.506293', '0.522920', '0.497633', '0.512570', '0.537409', '0.524011', '0.518622', '0.534419', '0.500243']
         : correct/total = [(7395, 14232), (7256, 14235), (7490, 14266), (7224, 14217), (7637, 14238), (7753, 14373), (7382, 14346), (7718, 14334), (7499, 14294), (7411, 14373), (7629, 14344), (7241, 14302), (7506, 14354), (7147, 14362), (7340, 14320), (7736, 14395), (7540, 14389), (7394, 14257), (7616, 14251), (7203, 14399)]
         : compromised: 0.5187, honest: 0.5296
Round 010: test acc mean=0.5261 ± 0.0223 | min=0.4835 max=0.5620
         : test loss mean=0.8099 ± 0.2325
         : individual accs = ['0.525998', '0.526379', '0.516262', '0.491876', '0.551903', '0.556808', '0.526558', '0.561951', '0.514622', '0.521464', '0.547267', '0.483499', '0.527379', '0.491575', '0.526327', '0.558458', '0.528459', '0.524444', '0.543892', '0.497048']
         : correct/total = [(7486, 14232), (7493, 14235), (7365, 14266), (6993, 14217), (7858, 14238), (8003, 14373), (7554, 14346), (8055, 14334), (7356, 14294), (7495, 14373), (7850, 14344), (6915, 14302), (7570, 14354), (7060, 14362), (7537, 14320), (8039, 14395), (7604, 14389), (7477, 14257), (7751, 14251), (7157, 14399)]
         : compromised: 0.5221, honest: 0.5421

=== FINAL RESULTS ===
Dataset: sent140, Nodes: 20, Graph: erdos, Aggregation: balance
Attack: krum, 80.0% compromised
Final accuracy - Compromised: 0.5221, Honest: 0.5421
Overall test accuracy: mean=0.5261 ± 0.0223

=== BALANCE SUMMARY ===
Node 0: acceptance=0.500
Node 1: acceptance=0.250
Node 2: acceptance=0.360
Node 3: acceptance=0.200
Node 4: acceptance=0.475
Node 5: acceptance=0.360
Node 6: acceptance=0.360
Node 7: acceptance=0.440
Node 8: acceptance=0.650
Node 9: acceptance=0.533
Node 10: acceptance=0.400
Node 11: acceptance=0.200
Node 12: acceptance=0.371
Node 13: acceptance=0.200
Node 14: acceptance=0.486
Node 15: acceptance=0.417
Node 16: acceptance=0.600
Node 17: acceptance=0.300
Node 18: acceptance=0.475
Node 19: acceptance=0.200

=== PARALLEL EXECUTION TIME (realistic for distributed system) ===
  COMMUNICATION (max across nodes):
    - Full model transfer: 0.000s (0.0%)
  COMPUTATION (max across nodes):
    - Filtering: 0.033s (74.5%)
    - Aggregation: 0.011s (25.5%)
  TOTALS:
    - Total computation: 0.045s (100.0%)
    - Total communication: 0.000s (0.0%)
    - Total parallel time: 0.045s

=== PER-NODE AVERAGE TIME ===
  - Filtering: 0.023s
  - Aggregation: 0.005s
  - Model transfer: 0.000s
  - Total per node: 0.028s

=== TOTAL COMPUTATIONAL WORK (sum across all nodes) ===
  - Total filtering: 0.465s
  - Total aggregation: 0.104s
  - Total model transfer: 0.000s
  - Grand total: 0.569s
  - Mean acceptance rate: 0.389

BALANCE Algorithm Properties:
  - Model dimension: 1,174,986
  - No compression: Full parameter comparison
  - Theoretical complexity: O(deg(i)×d)
  - Approach: Full parameter filtering + averaging
