Device: cuda
Seed: 987654321
Loading 1 LEAF Sent140 train files...
LEAF Sent140 train: 254555 users, 908652 samples
Building vocabulary (max_size=10000)...
Vocabulary size: 10000
Loading 1 LEAF Sent140 test files...
LEAF Sent140 test: 254555 users, 286281 samples
Found 254555 train users, 254555 test users, 254555 common users
User sample counts range: 494 (max) to 1 (min)
Distributed ALL 254555 users across 20 clients
Users per client: 12727 (with 15 clients getting +1 user)
Train partition sizes: [44353, 44290, 44657, 44907, 44696, 45843, 45801, 45619, 45069, 45639, 45821, 45311, 45779, 46056, 45625, 45984, 46428, 44737, 45540, 46497]
Test partition sizes: [14232, 14235, 14266, 14217, 14238, 14373, 14346, 14334, 14294, 14373, 14344, 14302, 14354, 14362, 14320, 14395, 14389, 14257, 14251, 14399]
  Client 0: 44353 train samples, 2 unique classes
  Client 1: 44290 train samples, 2 unique classes
  Client 2: 44657 train samples, 2 unique classes
  Client 3: 44907 train samples, 2 unique classes
  Client 4: 44696 train samples, 2 unique classes
  Client 5: 45843 train samples, 2 unique classes
  Client 6: 45801 train samples, 2 unique classes
  Client 7: 45619 train samples, 2 unique classes
  Client 8: 45069 train samples, 2 unique classes
  Client 9: 45639 train samples, 2 unique classes
  Client 10: 45821 train samples, 2 unique classes
  Client 11: 45311 train samples, 2 unique classes
  Client 12: 45779 train samples, 2 unique classes
  Client 13: 46056 train samples, 2 unique classes
  Client 14: 45625 train samples, 2 unique classes
  Client 15: 45984 train samples, 2 unique classes
  Client 16: 46428 train samples, 2 unique classes
  Client 17: 44737 train samples, 2 unique classes
  Client 18: 45540 train samples, 2 unique classes
  Client 19: 46497 train samples, 2 unique classes
Will sample 4500 samples per client per epoch
Graph: ring, nodes: 20, edges: 20
Degree statistics: avg=2.00, min=2, max=2
Attack: Compromised 16/20 nodes: [1, 2, 3, 5, 6, 8, 9, 10, 11, 12, 13, 14, 15, 17, 18, 19]
Attack type: backdoor, lambda: 1.0
Backdoor target label: 1, trigger size: 3
Model variant: baseline
Model parameters: 1,174,986
BALANCE algorithm:
Balance Config: BALANCEConfig(gamma=2, kappa=1, alpha=0.5, min_neighbors=1)
  - Model dimension: 1,174,986 parameters
  - Complexity: O(N×d) = O(20×1,174,986)
Initial test acc across nodes: mean=0.4965 ± 0.0152
Backdoor attack: Created poisoned datasets for 16 compromised nodes
Round 001: test acc mean=0.4991 ± 0.0083 | min=0.4837 max=0.5156
         : test loss mean=30.7353 ± 16.7308
         : individual accs = ['0.492060', '0.498771', '0.485840', '0.509038', '0.495645', '0.498922', '0.503625', '0.495605', '0.515601', '0.494051', '0.503207', '0.483709', '0.502926', '0.514065', '0.499930', '0.501285', '0.492112', '0.502771', '0.488246', '0.505035']
         : correct/total = [(7003, 14232), (7100, 14235), (6931, 14266), (7237, 14217), (7057, 14238), (7171, 14373), (7225, 14346), (7104, 14334), (7370, 14294), (7101, 14373), (7218, 14344), (6918, 14302), (7219, 14354), (7383, 14362), (7159, 14320), (7216, 14395), (7081, 14389), (7168, 14257), (6958, 14251), (7272, 14399)]
         : compromised: 0.5004, honest: 0.4939
Round 002: test acc mean=0.5036 ± 0.0046 | min=0.4926 max=0.5105
         : test loss mean=1358.6553 ± 740.8695
         : individual accs = ['0.510469', '0.510432', '0.505888', '0.508476', '0.505619', '0.503374', '0.496654', '0.505511', '0.501399', '0.505601', '0.505229', '0.505454', '0.500488', '0.501671', '0.506355', '0.500313', '0.499896', '0.492600', '0.509578', '0.497743']
         : correct/total = [(7265, 14232), (7266, 14235), (7217, 14266), (7229, 14217), (7199, 14238), (7235, 14373), (7125, 14346), (7246, 14334), (7167, 14294), (7267, 14373), (7247, 14344), (7229, 14302), (7184, 14354), (7205, 14362), (7251, 14320), (7202, 14395), (7193, 14389), (7023, 14257), (7262, 14251), (7167, 14399)]
         : compromised: 0.5032, honest: 0.5054
Round 003: test acc mean=0.4953 ± 0.0056 | min=0.4834 max=0.5054
         : test loss mean=146938.0988 ± 96793.1277
         : individual accs = ['0.489109', '0.496031', '0.493411', '0.497855', '0.494100', '0.496278', '0.503485', '0.495186', '0.487827', '0.495512', '0.503695', '0.491610', '0.486276', '0.498607', '0.495810', '0.497881', '0.499757', '0.505366', '0.483405', '0.495034']
         : correct/total = [(6961, 14232), (7061, 14235), (7039, 14266), (7078, 14217), (7035, 14238), (7133, 14373), (7223, 14346), (7098, 14334), (6973, 14294), (7122, 14373), (7225, 14344), (7031, 14302), (6980, 14354), (7161, 14362), (7100, 14320), (7167, 14395), (7191, 14389), (7205, 14257), (6889, 14251), (7128, 14399)]
         : compromised: 0.4955, honest: 0.4945
Round 004: test acc mean=0.5010 ± 0.0069 | min=0.4826 max=0.5132
         : test loss mean=12052664.7181 ± 7637440.5984
         : individual accs = ['0.511102', '0.500808', '0.500000', '0.503693', '0.504706', '0.500939', '0.498048', '0.504953', '0.492724', '0.513184', '0.502510', '0.509020', '0.505295', '0.491923', '0.501536', '0.500174', '0.500521', '0.482640', '0.492667', '0.502952']
         : correct/total = [(7274, 14232), (7129, 14235), (7133, 14266), (7161, 14217), (7186, 14238), (7200, 14373), (7145, 14346), (7238, 14334), (7043, 14294), (7376, 14373), (7208, 14344), (7280, 14302), (7253, 14354), (7065, 14362), (7182, 14320), (7200, 14395), (7202, 14389), (6881, 14257), (7021, 14251), (7242, 14399)]
         : compromised: 0.4999, honest: 0.5053
Round 005: test acc mean=0.4972 ± 0.0050 | min=0.4891 max=0.5112
         : test loss mean=819686665.3730 ± 468170307.7957
         : individual accs = ['0.489109', '0.491886', '0.493831', '0.500879', '0.493960', '0.495443', '0.505576', '0.495117', '0.492444', '0.495304', '0.498397', '0.493427', '0.502020', '0.511210', '0.497346', '0.498090', '0.499757', '0.496318', '0.493650', '0.501076']
         : correct/total = [(6961, 14232), (7002, 14235), (7045, 14266), (7121, 14217), (7033, 14238), (7121, 14373), (7253, 14346), (7097, 14334), (7039, 14294), (7119, 14373), (7149, 14344), (7057, 14302), (7206, 14354), (7342, 14362), (7122, 14320), (7170, 14395), (7191, 14389), (7076, 14257), (7035, 14251), (7215, 14399)]
         : compromised: 0.4979, honest: 0.4945
Round 006: test acc mean=0.5035 ± 0.0051 | min=0.4937 max=0.5112
         : test loss mean=60600453738.3748 ± 31912053239.1532
         : individual accs = ['0.510891', '0.509940', '0.511215', '0.500598', '0.505900', '0.503722', '0.506552', '0.504814', '0.508955', '0.506297', '0.496026', '0.504475', '0.494705', '0.497772', '0.504609', '0.500590', '0.500243', '0.493652', '0.506842', '0.502813']
         : correct/total = [(7271, 14232), (7259, 14235), (7293, 14266), (7117, 14217), (7203, 14238), (7240, 14373), (7267, 14346), (7236, 14334), (7275, 14294), (7277, 14373), (7115, 14344), (7215, 14302), (7101, 14354), (7149, 14362), (7226, 14320), (7206, 14395), (7198, 14389), (7038, 14257), (7223, 14251), (7240, 14399)]
         : compromised: 0.5030, honest: 0.5055
Round 007: test acc mean=0.4976 ± 0.0050 | min=0.4885 max=0.5087
         : test loss mean=5884060989708.2676 ± 3323722667929.1807
         : individual accs = ['0.489109', '0.493994', '0.488504', '0.499472', '0.494100', '0.500383', '0.502509', '0.495186', '0.500350', '0.492521', '0.502928', '0.498602', '0.498467', '0.508704', '0.497486', '0.503925', '0.499757', '0.494564', '0.492316', '0.499340']
         : correct/total = [(6961, 14232), (7032, 14235), (6969, 14266), (7101, 14217), (7035, 14238), (7192, 14373), (7209, 14346), (7098, 14334), (7152, 14294), (7079, 14373), (7214, 14344), (7131, 14302), (7155, 14354), (7306, 14362), (7124, 14320), (7254, 14395), (7191, 14389), (7051, 14257), (7016, 14251), (7190, 14399)]
         : compromised: 0.4984, honest: 0.4945
Round 008: test acc mean=0.5035 ± 0.0057 | min=0.4892 max=0.5127
         : test loss mean=559895843254440.0000 ± 320420605828469.1250
         : individual accs = ['0.510891', '0.509378', '0.512688', '0.505381', '0.505900', '0.502331', '0.506901', '0.504814', '0.505177', '0.507827', '0.501325', '0.506573', '0.501672', '0.492202', '0.500908', '0.499965', '0.500243', '0.489163', '0.508175', '0.498021']
         : correct/total = [(7271, 14232), (7251, 14235), (7314, 14266), (7185, 14217), (7203, 14238), (7220, 14373), (7272, 14346), (7236, 14334), (7221, 14294), (7299, 14373), (7191, 14344), (7245, 14302), (7201, 14354), (7069, 14362), (7173, 14320), (7197, 14395), (7198, 14389), (6974, 14257), (7242, 14251), (7171, 14399)]
         : compromised: 0.5030, honest: 0.5055
Round 009: test acc mean=0.4969 ± 0.0056 | min=0.4865 max=0.5095
         : test loss mean=58442104705706776.0000 ± 36590757716385080.0000
         : individual accs = ['0.489179', '0.490762', '0.486471', '0.497151', '0.494100', '0.495721', '0.506901', '0.495117', '0.498181', '0.491616', '0.500558', '0.495106', '0.499164', '0.509539', '0.496369', '0.502466', '0.499757', '0.500526', '0.490773', '0.499201']
         : correct/total = [(6962, 14232), (6986, 14235), (6940, 14266), (7068, 14217), (7035, 14238), (7125, 14373), (7272, 14346), (7097, 14334), (7121, 14294), (7066, 14373), (7180, 14344), (7081, 14302), (7165, 14354), (7318, 14362), (7108, 14320), (7233, 14395), (7191, 14389), (7136, 14257), (6994, 14251), (7188, 14399)]
         : compromised: 0.4975, honest: 0.4945
Round 010: test acc mean=0.5030 ± 0.0056 | min=0.4926 max=0.5138
         : test loss mean=5904263166590818304.0000 ± 3437975274458320384.0000
         : individual accs = ['0.507589', '0.511907', '0.513809', '0.502075', '0.501334', '0.503514', '0.501464', '0.497419', '0.508675', '0.507062', '0.500558', '0.506223', '0.500070', '0.492619', '0.503212', '0.501494', '0.495517', '0.493512', '0.509929', '0.501771']
         : correct/total = [(7224, 14232), (7287, 14235), (7330, 14266), (7138, 14217), (7138, 14238), (7237, 14373), (7194, 14346), (7130, 14334), (7271, 14294), (7288, 14373), (7180, 14344), (7240, 14302), (7178, 14354), (7075, 14362), (7206, 14320), (7219, 14395), (7130, 14389), (7036, 14257), (7267, 14251), (7225, 14399)]
         : compromised: 0.5036, honest: 0.5005

=== FINAL RESULTS ===
Dataset: sent140, Nodes: 20, Graph: ring, Aggregation: balance
Attack: backdoor, 80.0% compromised
Final accuracy - Compromised: 0.5036, Honest: 0.5005
Overall test accuracy: mean=0.5030 ± 0.0056

=== BACKDOOR ATTACK SUCCESS RATE (ASR) ===
Target label: 1
Trigger size: 3x3
Overall ASR: 0.5995 ± 0.3362
Honest nodes ASR: 0.0684 ± 0.0025
Compromised nodes ASR: 0.7323 ± 0.2305
Note: Higher ASR indicates more successful backdoor attack

=== BALANCE SUMMARY ===
Node 0: acceptance=0.300
Node 1: acceptance=0.700
Node 2: acceptance=0.400
Node 3: acceptance=0.700
Node 4: acceptance=0.300
Node 5: acceptance=0.700
Node 6: acceptance=0.700
Node 7: acceptance=0.300
Node 8: acceptance=0.700
Node 9: acceptance=0.700
Node 10: acceptance=0.400
Node 11: acceptance=0.500
Node 12: acceptance=0.500
Node 13: acceptance=0.400
Node 14: acceptance=0.400
Node 15: acceptance=0.700
Node 16: acceptance=0.300
Node 17: acceptance=0.700
Node 18: acceptance=0.500
Node 19: acceptance=0.800

=== PARALLEL EXECUTION TIME (realistic for distributed system) ===
  COMMUNICATION (max across nodes):
    - Full model transfer: 0.000s (0.0%)
  COMPUTATION (max across nodes):
    - Filtering: 0.020s (60.7%)
    - Aggregation: 0.013s (39.3%)
  TOTALS:
    - Total computation: 0.033s (100.0%)
    - Total communication: 0.000s (0.0%)
    - Total parallel time: 0.033s

=== PER-NODE AVERAGE TIME ===
  - Filtering: 0.012s
  - Aggregation: 0.005s
  - Model transfer: 0.000s
  - Total per node: 0.018s

=== TOTAL COMPUTATIONAL WORK (sum across all nodes) ===
  - Total filtering: 0.250s
  - Total aggregation: 0.103s
  - Total model transfer: 0.000s
  - Grand total: 0.353s
  - Mean acceptance rate: 0.535

BALANCE Algorithm Properties:
  - Model dimension: 1,174,986
  - No compression: Full parameter comparison
  - Theoretical complexity: O(deg(i)×d)
  - Approach: Full parameter filtering + averaging
