Device: cuda
Seed: 987654321
Loading 1 LEAF Sent140 train files...
LEAF Sent140 train: 254555 users, 908652 samples
Building vocabulary (max_size=10000)...
Vocabulary size: 10000
Loading 1 LEAF Sent140 test files...
LEAF Sent140 test: 254555 users, 286281 samples
Found 254555 train users, 254555 test users, 254555 common users
User sample counts range: 494 (max) to 1 (min)
Distributed ALL 254555 users across 20 clients
Users per client: 12727 (with 15 clients getting +1 user)
Train partition sizes: [44353, 44290, 44657, 44907, 44696, 45843, 45801, 45619, 45069, 45639, 45821, 45311, 45779, 46056, 45625, 45984, 46428, 44737, 45540, 46497]
Test partition sizes: [14232, 14235, 14266, 14217, 14238, 14373, 14346, 14334, 14294, 14373, 14344, 14302, 14354, 14362, 14320, 14395, 14389, 14257, 14251, 14399]
  Client 0: 44353 train samples, 2 unique classes
  Client 1: 44290 train samples, 2 unique classes
  Client 2: 44657 train samples, 2 unique classes
  Client 3: 44907 train samples, 2 unique classes
  Client 4: 44696 train samples, 2 unique classes
  Client 5: 45843 train samples, 2 unique classes
  Client 6: 45801 train samples, 2 unique classes
  Client 7: 45619 train samples, 2 unique classes
  Client 8: 45069 train samples, 2 unique classes
  Client 9: 45639 train samples, 2 unique classes
  Client 10: 45821 train samples, 2 unique classes
  Client 11: 45311 train samples, 2 unique classes
  Client 12: 45779 train samples, 2 unique classes
  Client 13: 46056 train samples, 2 unique classes
  Client 14: 45625 train samples, 2 unique classes
  Client 15: 45984 train samples, 2 unique classes
  Client 16: 46428 train samples, 2 unique classes
  Client 17: 44737 train samples, 2 unique classes
  Client 18: 45540 train samples, 2 unique classes
  Client 19: 46497 train samples, 2 unique classes
Will sample 4500 samples per client per epoch
Graph: erdos, nodes: 20, edges: 99
Degree statistics: avg=9.90, min=7, max=14
Attack: Compromised 4/20 nodes: [5, 12, 13, 17]
Attack type: directed_deviation, lambda: 1.0
Model variant: baseline
Model parameters: 1,174,986
Initial test acc across nodes: mean=0.4953 ± 0.0174
Round 001: test acc mean=0.5008 ± 0.0125 | min=0.4801 max=0.5365
         : test loss mean=1.4305 ± 0.8990
         : individual accs = ['0.521150', '0.512680', '0.513038', '0.487796', '0.536522', '0.499409', '0.480064', '0.496512', '0.500770', '0.495234', '0.498466', '0.496784', '0.507176', '0.497215', '0.488268', '0.501216', '0.503301', '0.493161', '0.486352', '0.500451']
         : correct/total = [(7417, 14232), (7298, 14235), (7319, 14266), (6935, 14217), (7639, 14238), (7178, 14373), (6887, 14346), (7117, 14334), (7158, 14294), (7118, 14373), (7150, 14344), (7105, 14302), (7280, 14354), (7141, 14362), (6992, 14320), (7215, 14395), (7242, 14389), (7031, 14257), (6931, 14251), (7206, 14399)]
         : compromised: 0.4992, honest: 0.5012
Round 002: test acc mean=0.4999 ± 0.0067 | min=0.4912 max=0.5147
         : test loss mean=1.4532 ± 0.7077
         : individual accs = ['0.501827', '0.500667', '0.514650', '0.510867', '0.499649', '0.496904', '0.494633', '0.500698', '0.510914', '0.495165', '0.505926', '0.499371', '0.492058', '0.493664', '0.499511', '0.491490', '0.491904', '0.501368', '0.491194', '0.505105']
         : correct/total = [(7142, 14232), (7127, 14235), (7342, 14266), (7263, 14217), (7114, 14238), (7142, 14373), (7096, 14346), (7177, 14334), (7303, 14294), (7117, 14373), (7257, 14344), (7142, 14302), (7063, 14354), (7090, 14362), (7153, 14320), (7075, 14395), (7078, 14389), (7148, 14257), (7000, 14251), (7273, 14399)]
         : compromised: 0.4960, honest: 0.5008
Round 003: test acc mean=0.4978 ± 0.0101 | min=0.4809 max=0.5195
         : test loss mean=0.7604 ± 0.1696
         : individual accs = ['0.513912', '0.483035', '0.493201', '0.484490', '0.491783', '0.496973', '0.499791', '0.494070', '0.498111', '0.501426', '0.519520', '0.493847', '0.488993', '0.513926', '0.497486', '0.480861', '0.493849', '0.507821', '0.505298', '0.498160']
         : correct/total = [(7314, 14232), (6876, 14235), (7036, 14266), (6888, 14217), (7002, 14238), (7143, 14373), (7170, 14346), (7082, 14334), (7120, 14294), (7207, 14373), (7452, 14344), (7063, 14302), (7019, 14354), (7381, 14362), (7124, 14320), (6922, 14395), (7106, 14389), (7240, 14257), (7201, 14251), (7173, 14399)]
         : compromised: 0.5019, honest: 0.4968
Round 004: test acc mean=0.5050 ± 0.0321 | min=0.4668 max=0.5960
         : test loss mean=0.7777 ± 0.1342
         : individual accs = ['0.499016', '0.491886', '0.551171', '0.470563', '0.503512', '0.492729', '0.493866', '0.495814', '0.500070', '0.596048', '0.489682', '0.493288', '0.475059', '0.578819', '0.493785', '0.499687', '0.499757', '0.505576', '0.466844', '0.502604']
         : correct/total = [(7102, 14232), (7002, 14235), (7863, 14266), (6690, 14217), (7169, 14238), (7082, 14373), (7085, 14346), (7107, 14334), (7148, 14294), (8567, 14373), (7024, 14344), (7055, 14302), (6819, 14354), (8313, 14362), (7071, 14320), (7193, 14395), (7191, 14389), (7208, 14257), (6653, 14251), (7237, 14399)]
         : compromised: 0.5130, honest: 0.5030
Round 005: test acc mean=0.5486 ± 0.0286 | min=0.5024 max=0.6069
         : test loss mean=0.7016 ± 0.0587
         : individual accs = ['0.572091', '0.557429', '0.519277', '0.552789', '0.606897', '0.555834', '0.557298', '0.579810', '0.520638', '0.527378', '0.502440', '0.588449', '0.529817', '0.509121', '0.560615', '0.566516', '0.577802', '0.517290', '0.556452', '0.514550']
         : correct/total = [(8142, 14232), (7935, 14235), (7408, 14266), (7859, 14217), (8641, 14238), (7989, 14373), (7995, 14346), (8311, 14334), (7442, 14294), (7580, 14373), (7207, 14344), (8416, 14302), (7605, 14354), (7312, 14362), (8028, 14320), (8155, 14395), (8314, 14389), (7375, 14257), (7930, 14251), (7409, 14399)]
         : compromised: 0.5280, honest: 0.5538
Round 006: test acc mean=0.5431 ± 0.0329 | min=0.4980 max=0.6244
         : test loss mean=0.7143 ± 0.0782
         : individual accs = ['0.532532', '0.533966', '0.555867', '0.524865', '0.577679', '0.534683', '0.562526', '0.550091', '0.514971', '0.624435', '0.504601', '0.566774', '0.497980', '0.600473', '0.536522', '0.575894', '0.537355', '0.505927', '0.508105', '0.516286']
         : correct/total = [(7579, 14232), (7601, 14235), (7930, 14266), (7462, 14217), (8225, 14238), (7685, 14373), (8070, 14346), (7885, 14334), (7361, 14294), (8975, 14373), (7238, 14344), (8106, 14302), (7148, 14354), (8624, 14362), (7683, 14320), (8290, 14395), (7732, 14389), (7213, 14257), (7241, 14251), (7434, 14399)]
         : compromised: 0.5348, honest: 0.5452
Round 007: test acc mean=0.5796 ± 0.0383 | min=0.4991 max=0.6265
         : test loss mean=0.6864 ± 0.0545
         : individual accs = ['0.571599', '0.620372', '0.553694', '0.548850', '0.619750', '0.608363', '0.619755', '0.605065', '0.552540', '0.563905', '0.590909', '0.614879', '0.599066', '0.569767', '0.590084', '0.626537', '0.609980', '0.499053', '0.511613', '0.515869']
         : correct/total = [(8135, 14232), (8831, 14235), (7899, 14266), (7803, 14217), (8824, 14238), (8744, 14373), (8891, 14346), (8673, 14334), (7898, 14294), (8105, 14373), (8476, 14344), (8794, 14302), (8599, 14354), (8183, 14362), (8450, 14320), (9019, 14395), (8777, 14389), (7115, 14257), (7291, 14251), (7428, 14399)]
         : compromised: 0.5691, honest: 0.5822
Round 008: test acc mean=0.5890 ± 0.0198 | min=0.5327 max=0.6096
         : test loss mean=0.6918 ± 0.0648
         : individual accs = ['0.604132', '0.609554', '0.590004', '0.599845', '0.599312', '0.588117', '0.599122', '0.583926', '0.543725', '0.600918', '0.593907', '0.596001', '0.601644', '0.599220', '0.565014', '0.603334', '0.575857', '0.592200', '0.602414', '0.532745']
         : correct/total = [(8598, 14232), (8677, 14235), (8417, 14266), (8528, 14217), (8533, 14238), (8453, 14373), (8595, 14346), (8370, 14334), (7772, 14294), (8637, 14373), (8519, 14344), (8524, 14302), (8636, 14354), (8606, 14362), (8091, 14320), (8685, 14395), (8286, 14389), (8443, 14257), (8585, 14251), (7671, 14399)]
         : compromised: 0.5953, honest: 0.5875
Round 009: test acc mean=0.6019 ± 0.0300 | min=0.5292 max=0.6314
         : test loss mean=0.6763 ± 0.0570
         : individual accs = ['0.609401', '0.613066', '0.594140', '0.580291', '0.630987', '0.628609', '0.625192', '0.624808', '0.591857', '0.608015', '0.631414', '0.630541', '0.575031', '0.571578', '0.630447', '0.617784', '0.627771', '0.542050', '0.576451', '0.529203']
         : correct/total = [(8673, 14232), (8727, 14235), (8476, 14266), (8250, 14217), (8984, 14238), (9035, 14373), (8969, 14346), (8956, 14334), (8460, 14294), (8739, 14373), (9057, 14344), (9018, 14302), (8254, 14354), (8209, 14362), (9028, 14320), (8893, 14395), (9033, 14389), (7728, 14257), (8215, 14251), (7620, 14399)]
         : compromised: 0.5793, honest: 0.6076
Round 010: test acc mean=0.6023 ± 0.0183 | min=0.5491 max=0.6248
         : test loss mean=0.6744 ± 0.0435
         : individual accs = ['0.600689', '0.621567', '0.624772', '0.620454', '0.613288', '0.605441', '0.612923', '0.596484', '0.573807', '0.611146', '0.607432', '0.609845', '0.587362', '0.621292', '0.593575', '0.618062', '0.603656', '0.581399', '0.593713', '0.549135']
         : correct/total = [(8549, 14232), (8848, 14235), (8913, 14266), (8821, 14217), (8732, 14238), (8702, 14373), (8793, 14346), (8550, 14334), (8202, 14294), (8784, 14373), (8713, 14344), (8722, 14302), (8431, 14354), (8923, 14362), (8500, 14320), (8897, 14395), (8686, 14389), (8289, 14257), (8461, 14251), (7907, 14399)]
         : compromised: 0.5989, honest: 0.6032

=== FINAL RESULTS ===
Dataset: sent140, Nodes: 20, Graph: erdos, Aggregation: d-fedavg
Attack: directed_deviation, 20.0% compromised
Final accuracy - Compromised: 0.5989, Honest: 0.6032
Overall test accuracy: mean=0.6023 ± 0.0183
