Device: cuda
Seed: 987654321
Loading 1 LEAF Sent140 train files...
LEAF Sent140 train: 254555 users, 908652 samples
Building vocabulary (max_size=10000)...
Vocabulary size: 10000
Loading 1 LEAF Sent140 test files...
LEAF Sent140 test: 254555 users, 286281 samples
Found 254555 train users, 254555 test users, 254555 common users
User sample counts range: 494 (max) to 1 (min)
Distributed ALL 254555 users across 20 clients
Users per client: 12727 (with 15 clients getting +1 user)
Train partition sizes: [44353, 44290, 44657, 44907, 44696, 45843, 45801, 45619, 45069, 45639, 45821, 45311, 45779, 46056, 45625, 45984, 46428, 44737, 45540, 46497]
Test partition sizes: [14232, 14235, 14266, 14217, 14238, 14373, 14346, 14334, 14294, 14373, 14344, 14302, 14354, 14362, 14320, 14395, 14389, 14257, 14251, 14399]
  Client 0: 44353 train samples, 2 unique classes
  Client 1: 44290 train samples, 2 unique classes
  Client 2: 44657 train samples, 2 unique classes
  Client 3: 44907 train samples, 2 unique classes
  Client 4: 44696 train samples, 2 unique classes
  Client 5: 45843 train samples, 2 unique classes
  Client 6: 45801 train samples, 2 unique classes
  Client 7: 45619 train samples, 2 unique classes
  Client 8: 45069 train samples, 2 unique classes
  Client 9: 45639 train samples, 2 unique classes
  Client 10: 45821 train samples, 2 unique classes
  Client 11: 45311 train samples, 2 unique classes
  Client 12: 45779 train samples, 2 unique classes
  Client 13: 46056 train samples, 2 unique classes
  Client 14: 45625 train samples, 2 unique classes
  Client 15: 45984 train samples, 2 unique classes
  Client 16: 46428 train samples, 2 unique classes
  Client 17: 44737 train samples, 2 unique classes
  Client 18: 45540 train samples, 2 unique classes
  Client 19: 46497 train samples, 2 unique classes
Will sample 4500 samples per client per epoch
Graph: fully, nodes: 20, edges: 190
Degree statistics: avg=19.00, min=19, max=19
Attack: Compromised 14/20 nodes: [1, 2, 3, 5, 6, 8, 11, 12, 13, 14, 15, 17, 18, 19]
Attack type: directed_deviation, lambda: 1.0
Model variant: baseline
Model parameters: 1,174,986
Initial test acc across nodes: mean=0.4953 ± 0.0174
Round 001: test acc mean=0.5011 ± 0.0076 | min=0.4864 max=0.5169
         : test loss mean=11.6314 ± 4.5317
         : individual accs = ['0.509345', '0.516895', '0.496075', '0.514244', '0.490518', '0.499896', '0.500000', '0.511581', '0.495593', '0.496208', '0.495538', '0.500140', '0.505295', '0.486423', '0.506494', '0.504550', '0.498714', '0.495756', '0.502421', '0.496701']
         : correct/total = [(7249, 14232), (7358, 14235), (7077, 14266), (7311, 14217), (6984, 14238), (7185, 14373), (7173, 14346), (7333, 14334), (7084, 14294), (7132, 14373), (7108, 14344), (7153, 14302), (7253, 14354), (6986, 14362), (7253, 14320), (7263, 14395), (7176, 14389), (7068, 14257), (7160, 14251), (7152, 14399)]
         : compromised: 0.5015, honest: 0.5003
Round 002: test acc mean=0.5056 ± 0.0033 | min=0.4987 max=0.5120
         : test loss mean=7.7403 ± 0.0974
         : individual accs = ['0.507659', '0.509449', '0.510585', '0.511993', '0.508990', '0.508175', '0.498745', '0.505093', '0.502099', '0.504488', '0.499512', '0.503985', '0.505225', '0.507520', '0.504609', '0.504967', '0.505873', '0.505085', '0.506070', '0.502674']
         : correct/total = [(7225, 14232), (7252, 14235), (7284, 14266), (7279, 14217), (7247, 14238), (7304, 14373), (7155, 14346), (7240, 14334), (7177, 14294), (7251, 14373), (7165, 14344), (7208, 14302), (7252, 14354), (7289, 14362), (7226, 14320), (7269, 14395), (7279, 14389), (7201, 14257), (7212, 14251), (7238, 14399)]
         : compromised: 0.5058, honest: 0.5053
Round 003: test acc mean=0.4949 ± 0.0053 | min=0.4853 max=0.5032
         : test loss mean=0.9144 ± 0.0072
         : individual accs = ['0.492060', '0.503196', '0.498668', '0.496729', '0.496488', '0.493147', '0.489474', '0.501605', '0.498951', '0.501496', '0.495399', '0.493777', '0.495959', '0.502019', '0.489036', '0.490448', '0.487178', '0.487971', '0.498562', '0.485311']
         : correct/total = [(7003, 14232), (7163, 14235), (7114, 14266), (7062, 14217), (7069, 14238), (7088, 14373), (7022, 14346), (7190, 14334), (7132, 14294), (7208, 14373), (7106, 14344), (7062, 14302), (7119, 14354), (7210, 14362), (7003, 14320), (7060, 14395), (7010, 14389), (6957, 14257), (7105, 14251), (6988, 14399)]
         : compromised: 0.4945, honest: 0.4957
Round 004: test acc mean=0.5002 ± 0.0050 | min=0.4898 max=0.5093
         : test loss mean=2.1414 ± 0.0313
         : individual accs = ['0.496557', '0.490832', '0.489766', '0.496940', '0.499087', '0.499409', '0.499791', '0.503698', '0.505037', '0.496695', '0.502091', '0.494896', '0.509335', '0.507381', '0.497905', '0.500382', '0.503301', '0.503121', '0.501789', '0.505938']
         : correct/total = [(7067, 14232), (6987, 14235), (6987, 14266), (7065, 14217), (7106, 14238), (7178, 14373), (7170, 14346), (7220, 14334), (7219, 14294), (7139, 14373), (7202, 14344), (7078, 14302), (7311, 14354), (7287, 14362), (7130, 14320), (7203, 14395), (7242, 14389), (7173, 14257), (7151, 14251), (7285, 14399)]
         : compromised: 0.5002, honest: 0.5002
Round 005: test acc mean=0.4973 ± 0.0058 | min=0.4844 max=0.5096
         : test loss mean=0.7023 ± 0.0015
         : individual accs = ['0.495714', '0.484440', '0.489836', '0.486530', '0.496278', '0.500035', '0.502719', '0.496442', '0.498321', '0.498017', '0.501464', '0.495036', '0.506827', '0.509609', '0.494204', '0.500243', '0.494336', '0.496738', '0.498842', '0.499618']
         : correct/total = [(7055, 14232), (6896, 14235), (6988, 14266), (6917, 14217), (7066, 14238), (7187, 14373), (7212, 14346), (7116, 14334), (7123, 14294), (7158, 14373), (7193, 14344), (7080, 14302), (7275, 14354), (7319, 14362), (7077, 14320), (7201, 14395), (7113, 14389), (7082, 14257), (7109, 14251), (7194, 14399)]
         : compromised: 0.4974, honest: 0.4970
Round 006: test acc mean=0.5061 ± 0.0037 | min=0.4989 max=0.5117
         : test loss mean=0.7074 ± 0.0013
         : individual accs = ['0.508080', '0.507271', '0.502734', '0.511571', '0.511659', '0.508245', '0.502509', '0.508651', '0.504337', '0.504348', '0.498885', '0.505034', '0.504041', '0.511210', '0.507542', '0.500104', '0.503788', '0.506558', '0.503684', '0.511286']
         : correct/total = [(7231, 14232), (7221, 14235), (7172, 14266), (7273, 14217), (7285, 14238), (7305, 14373), (7209, 14346), (7291, 14334), (7209, 14294), (7249, 14373), (7156, 14344), (7223, 14302), (7235, 14354), (7342, 14362), (7268, 14320), (7199, 14395), (7249, 14389), (7222, 14257), (7178, 14251), (7362, 14399)]
         : compromised: 0.5062, honest: 0.5059
Round 007: test acc mean=0.5108 ± 0.0053 | min=0.5008 max=0.5183
         : test loss mean=0.6932 ± 0.0005
         : individual accs = ['0.502951', '0.500808', '0.502103', '0.505451', '0.510254', '0.509427', '0.518333', '0.511441', '0.510424', '0.508871', '0.513037', '0.518179', '0.517138', '0.517964', '0.513408', '0.516846', '0.507193', '0.507540', '0.509438', '0.514897']
         : correct/total = [(7158, 14232), (7129, 14235), (7163, 14266), (7186, 14217), (7265, 14238), (7322, 14373), (7436, 14346), (7331, 14334), (7296, 14294), (7314, 14373), (7359, 14344), (7411, 14302), (7423, 14354), (7439, 14362), (7352, 14320), (7440, 14395), (7298, 14389), (7236, 14257), (7260, 14251), (7414, 14399)]
         : compromised: 0.5116, honest: 0.5090
Round 008: test acc mean=0.5036 ± 0.0048 | min=0.4932 max=0.5106
         : test loss mean=0.7143 ± 0.0032
         : individual accs = ['0.500843', '0.493151', '0.498318', '0.493494', '0.500773', '0.506436', '0.510595', '0.499860', '0.504477', '0.506297', '0.505089', '0.503566', '0.505713', '0.508216', '0.500140', '0.509205', '0.504691', '0.503963', '0.506280', '0.510174']
         : correct/total = [(7128, 14232), (7020, 14235), (7109, 14266), (7016, 14217), (7130, 14238), (7279, 14373), (7325, 14346), (7165, 14334), (7211, 14294), (7277, 14373), (7245, 14344), (7202, 14302), (7259, 14354), (7299, 14362), (7162, 14320), (7330, 14395), (7262, 14389), (7185, 14257), (7215, 14251), (7346, 14399)]
         : compromised: 0.5038, honest: 0.5029
Round 009: test acc mean=0.4961 ± 0.0055 | min=0.4842 max=0.5082
         : test loss mean=0.6953 ± 0.0007
         : individual accs = ['0.493044', '0.484229', '0.488504', '0.486179', '0.496629', '0.498226', '0.499721', '0.496582', '0.498881', '0.494399', '0.500000', '0.495665', '0.504598', '0.508216', '0.493017', '0.498645', '0.492599', '0.497440', '0.496948', '0.498785']
         : correct/total = [(7017, 14232), (6893, 14235), (6969, 14266), (6912, 14217), (7071, 14238), (7161, 14373), (7169, 14346), (7118, 14334), (7131, 14294), (7106, 14373), (7172, 14344), (7089, 14302), (7243, 14354), (7299, 14362), (7060, 14320), (7178, 14395), (7088, 14389), (7092, 14257), (7082, 14251), (7182, 14399)]
         : compromised: 0.4964, honest: 0.4955
Round 010: test acc mean=0.5158 ± 0.0041 | min=0.5057 max=0.5214
         : test loss mean=0.7008 ± 0.0016
         : individual accs = ['0.509767', '0.513874', '0.513388', '0.505662', '0.512432', '0.520003', '0.517496', '0.517720', '0.512383', '0.520351', '0.521403', '0.514054', '0.518113', '0.517129', '0.519134', '0.520389', '0.517548', '0.512240', '0.512806', '0.519550']
         : correct/total = [(7255, 14232), (7315, 14235), (7324, 14266), (7189, 14217), (7296, 14238), (7474, 14373), (7424, 14346), (7421, 14334), (7324, 14294), (7479, 14373), (7479, 14344), (7352, 14302), (7437, 14354), (7427, 14362), (7434, 14320), (7491, 14395), (7447, 14389), (7303, 14257), (7308, 14251), (7481, 14399)]
         : compromised: 0.5154, honest: 0.5165

=== FINAL RESULTS ===
Dataset: sent140, Nodes: 20, Graph: fully, Aggregation: krum
Attack: directed_deviation, 70.0% compromised
Final accuracy - Compromised: 0.5154, Honest: 0.5165
Overall test accuracy: mean=0.5158 ± 0.0041
