Device: cuda
Seed: 987654321
Loading 1 LEAF Sent140 train files...
LEAF Sent140 train: 254555 users, 908652 samples
Building vocabulary (max_size=10000)...
Vocabulary size: 10000
Loading 1 LEAF Sent140 test files...
LEAF Sent140 test: 254555 users, 286281 samples
Found 254555 train users, 254555 test users, 254555 common users
User sample counts range: 494 (max) to 1 (min)
Distributed ALL 254555 users across 20 clients
Users per client: 12727 (with 15 clients getting +1 user)
Train partition sizes: [44353, 44290, 44657, 44907, 44696, 45843, 45801, 45619, 45069, 45639, 45821, 45311, 45779, 46056, 45625, 45984, 46428, 44737, 45540, 46497]
Test partition sizes: [14232, 14235, 14266, 14217, 14238, 14373, 14346, 14334, 14294, 14373, 14344, 14302, 14354, 14362, 14320, 14395, 14389, 14257, 14251, 14399]
  Client 0: 44353 train samples, 2 unique classes
  Client 1: 44290 train samples, 2 unique classes
  Client 2: 44657 train samples, 2 unique classes
  Client 3: 44907 train samples, 2 unique classes
  Client 4: 44696 train samples, 2 unique classes
  Client 5: 45843 train samples, 2 unique classes
  Client 6: 45801 train samples, 2 unique classes
  Client 7: 45619 train samples, 2 unique classes
  Client 8: 45069 train samples, 2 unique classes
  Client 9: 45639 train samples, 2 unique classes
  Client 10: 45821 train samples, 2 unique classes
  Client 11: 45311 train samples, 2 unique classes
  Client 12: 45779 train samples, 2 unique classes
  Client 13: 46056 train samples, 2 unique classes
  Client 14: 45625 train samples, 2 unique classes
  Client 15: 45984 train samples, 2 unique classes
  Client 16: 46428 train samples, 2 unique classes
  Client 17: 44737 train samples, 2 unique classes
  Client 18: 45540 train samples, 2 unique classes
  Client 19: 46497 train samples, 2 unique classes
Will sample 4500 samples per client per epoch
Graph: erdos, nodes: 20, edges: 99
Degree statistics: avg=9.90, min=7, max=14
Attack: Compromised 2/20 nodes: [5, 13]
Attack type: directed_deviation, lambda: 1.0
Model variant: baseline
Model parameters: 1,174,986
Initial test acc across nodes: mean=0.4965 ± 0.0152
Round 001: test acc mean=0.5030 ± 0.0112 | min=0.4772 max=0.5292
         : test loss mean=0.8092 ± 0.2741
         : individual accs = ['0.510188', '0.511275', '0.513879', '0.506506', '0.501967', '0.507758', '0.529207', '0.496791', '0.479222', '0.506992', '0.500976', '0.507831', '0.502160', '0.491018', '0.503980', '0.477249', '0.500243', '0.509855', '0.505719', '0.497882']
         : correct/total = [(7261, 14232), (7278, 14235), (7331, 14266), (7201, 14217), (7147, 14238), (7298, 14373), (7592, 14346), (7121, 14334), (6850, 14294), (7287, 14373), (7186, 14344), (7263, 14302), (7208, 14354), (7052, 14362), (7217, 14320), (6870, 14395), (7198, 14389), (7269, 14257), (7207, 14251), (7169, 14399)]
         : compromised: 0.4994, honest: 0.5034
Round 002: test acc mean=0.5028 ± 0.0110 | min=0.4861 max=0.5320
         : test loss mean=0.8335 ± 0.3041
         : individual accs = ['0.532040', '0.486477', '0.486121', '0.491173', '0.496348', '0.508592', '0.501255', '0.507465', '0.498881', '0.494817', '0.512828', '0.505104', '0.515745', '0.507172', '0.503701', '0.500104', '0.500591', '0.516378', '0.487685', '0.504063']
         : correct/total = [(7572, 14232), (6925, 14235), (6935, 14266), (6983, 14217), (7067, 14238), (7310, 14373), (7191, 14346), (7274, 14334), (7131, 14294), (7112, 14373), (7356, 14344), (7224, 14302), (7403, 14354), (7284, 14362), (7213, 14320), (7199, 14395), (7203, 14389), (7362, 14257), (6950, 14251), (7258, 14399)]
         : compromised: 0.5079, honest: 0.5023
Round 003: test acc mean=0.5010 ± 0.0129 | min=0.4863 max=0.5422
         : test loss mean=0.7201 ± 0.0837
         : individual accs = ['0.489109', '0.486266', '0.503365', '0.492087', '0.494100', '0.506018', '0.497560', '0.495186', '0.488457', '0.518263', '0.516941', '0.492029', '0.502996', '0.491436', '0.495810', '0.498367', '0.542150', '0.503051', '0.511262', '0.496423']
         : correct/total = [(6961, 14232), (6922, 14235), (7181, 14266), (6996, 14217), (7035, 14238), (7273, 14373), (7138, 14346), (7098, 14334), (6982, 14294), (7449, 14373), (7415, 14344), (7037, 14302), (7220, 14354), (7058, 14362), (7100, 14320), (7174, 14395), (7801, 14389), (7172, 14257), (7286, 14251), (7148, 14399)]
         : compromised: 0.4987, honest: 0.5013
Round 004: test acc mean=0.5106 ± 0.0118 | min=0.4916 max=0.5408
         : test loss mean=0.7380 ± 0.1063
         : individual accs = ['0.540823', '0.520618', '0.518435', '0.505381', '0.514609', '0.505810', '0.510316', '0.534743', '0.495732', '0.511306', '0.503974', '0.499720', '0.501602', '0.491575', '0.507961', '0.515665', '0.499757', '0.517781', '0.511403', '0.505521']
         : correct/total = [(7697, 14232), (7411, 14235), (7396, 14266), (7185, 14217), (7327, 14238), (7270, 14373), (7321, 14346), (7665, 14334), (7086, 14294), (7349, 14373), (7229, 14344), (7147, 14302), (7200, 14354), (7060, 14362), (7274, 14320), (7423, 14395), (7191, 14389), (7382, 14257), (7288, 14251), (7279, 14399)]
         : compromised: 0.4987, honest: 0.5120
Round 005: test acc mean=0.5096 ± 0.0260 | min=0.4891 max=0.5649
         : test loss mean=0.7029 ± 0.0315
         : individual accs = ['0.489109', '0.491324', '0.555166', '0.492087', '0.494100', '0.506088', '0.497630', '0.494977', '0.491395', '0.561887', '0.559049', '0.492099', '0.504598', '0.491505', '0.495810', '0.498298', '0.564945', '0.502841', '0.512245', '0.496423']
         : correct/total = [(6961, 14232), (6994, 14235), (7920, 14266), (6996, 14217), (7035, 14238), (7274, 14373), (7139, 14346), (7095, 14334), (7024, 14294), (8076, 14373), (8019, 14344), (7038, 14302), (7243, 14354), (7059, 14362), (7100, 14320), (7173, 14395), (8129, 14389), (7169, 14257), (7300, 14251), (7148, 14399)]
         : compromised: 0.4988, honest: 0.5108
Round 006: test acc mean=0.5205 ± 0.0256 | min=0.4861 max=0.5754
         : test loss mean=0.7383 ± 0.1124
         : individual accs = ['0.575393', '0.573937', '0.486051', '0.512485', '0.538910', '0.520907', '0.505925', '0.564532', '0.499580', '0.493077', '0.501046', '0.501818', '0.533719', '0.502715', '0.511872', '0.526224', '0.499757', '0.527811', '0.533156', '0.501285']
         : correct/total = [(8189, 14232), (8170, 14235), (6934, 14266), (7286, 14217), (7673, 14238), (7487, 14373), (7258, 14346), (8092, 14334), (7141, 14294), (7087, 14373), (7187, 14344), (7177, 14302), (7661, 14354), (7220, 14362), (7330, 14320), (7575, 14395), (7191, 14389), (7525, 14257), (7598, 14251), (7218, 14399)]
         : compromised: 0.5118, honest: 0.5215
Round 007: test acc mean=0.5155 ± 0.0346 | min=0.4863 max=0.5866
         : test loss mean=0.7048 ± 0.0394
         : individual accs = ['0.489109', '0.486266', '0.577317', '0.492228', '0.494100', '0.507131', '0.497560', '0.495186', '0.489856', '0.586586', '0.578151', '0.492029', '0.554410', '0.491436', '0.495810', '0.498367', '0.572451', '0.503051', '0.513227', '0.496493']
         : correct/total = [(6961, 14232), (6922, 14235), (8236, 14266), (6998, 14217), (7035, 14238), (7289, 14373), (7138, 14346), (7098, 14334), (7002, 14294), (8431, 14373), (8293, 14344), (7037, 14302), (7958, 14354), (7058, 14362), (7100, 14320), (7174, 14395), (8237, 14389), (7172, 14257), (7314, 14251), (7149, 14399)]
         : compromised: 0.4993, honest: 0.5173
Round 008: test acc mean=0.5288 ± 0.0323 | min=0.4861 max=0.5787
         : test loss mean=0.7308 ± 0.1004
         : individual accs = ['0.574129', '0.576115', '0.486051', '0.507280', '0.535188', '0.570932', '0.508783', '0.566904', '0.494403', '0.493008', '0.499233', '0.500909', '0.576007', '0.529453', '0.513198', '0.531990', '0.499757', '0.530336', '0.578696', '0.503785']
         : correct/total = [(8171, 14232), (8201, 14235), (6934, 14266), (7212, 14217), (7620, 14238), (8206, 14373), (7299, 14346), (8126, 14334), (7067, 14294), (7086, 14373), (7161, 14344), (7164, 14302), (8268, 14354), (7604, 14362), (7349, 14320), (7658, 14395), (7191, 14389), (7561, 14257), (8247, 14251), (7254, 14399)]
         : compromised: 0.5502, honest: 0.5264
Round 009: test acc mean=0.5186 ± 0.0379 | min=0.4863 max=0.5851
         : test loss mean=0.7035 ± 0.0413
         : individual accs = ['0.489109', '0.486266', '0.585097', '0.492228', '0.494100', '0.508732', '0.497769', '0.495186', '0.493354', '0.584151', '0.583310', '0.492379', '0.576773', '0.491575', '0.495810', '0.498367', '0.584822', '0.503051', '0.522630', '0.496979']
         : correct/total = [(6961, 14232), (6922, 14235), (8347, 14266), (6998, 14217), (7035, 14238), (7312, 14373), (7141, 14346), (7098, 14334), (7052, 14294), (8396, 14373), (8367, 14344), (7042, 14302), (8279, 14354), (7060, 14362), (7100, 14320), (7174, 14395), (8415, 14389), (7172, 14257), (7448, 14251), (7156, 14399)]
         : compromised: 0.5002, honest: 0.5206
Round 010: test acc mean=0.5387 ± 0.0373 | min=0.4861 max=0.6009
         : test loss mean=0.7166 ± 0.0838
         : individual accs = ['0.594435', '0.600913', '0.486051', '0.536189', '0.582245', '0.524177', '0.523142', '0.589717', '0.497971', '0.493008', '0.500279', '0.509859', '0.571966', '0.509748', '0.534358', '0.575061', '0.499757', '0.574595', '0.556522', '0.513022']
         : correct/total = [(8460, 14232), (8554, 14235), (6934, 14266), (7623, 14217), (8290, 14238), (7534, 14373), (7505, 14346), (8453, 14334), (7118, 14294), (7086, 14373), (7176, 14344), (7292, 14302), (8210, 14354), (7321, 14362), (7652, 14320), (8278, 14395), (7191, 14389), (8192, 14257), (7931, 14251), (7387, 14399)]
         : compromised: 0.5170, honest: 0.5411

=== FINAL RESULTS ===
Dataset: sent140, Nodes: 20, Graph: erdos, Aggregation: d-fedavg
Attack: directed_deviation, 10.0% compromised
Final accuracy - Compromised: 0.5170, Honest: 0.5411
Overall test accuracy: mean=0.5387 ± 0.0373
