Device: cuda
Seed: 987654321
Loading 1 LEAF Sent140 train files...
LEAF Sent140 train: 254555 users, 908652 samples
Building vocabulary (max_size=10000)...
Vocabulary size: 10000
Loading 1 LEAF Sent140 test files...
LEAF Sent140 test: 254555 users, 286281 samples
Found 254555 train users, 254555 test users, 254555 common users
User sample counts range: 494 (max) to 1 (min)
Distributed ALL 254555 users across 20 clients
Users per client: 12727 (with 15 clients getting +1 user)
Train partition sizes: [44353, 44290, 44657, 44907, 44696, 45843, 45801, 45619, 45069, 45639, 45821, 45311, 45779, 46056, 45625, 45984, 46428, 44737, 45540, 46497]
Test partition sizes: [14232, 14235, 14266, 14217, 14238, 14373, 14346, 14334, 14294, 14373, 14344, 14302, 14354, 14362, 14320, 14395, 14389, 14257, 14251, 14399]
  Client 0: 44353 train samples, 2 unique classes
  Client 1: 44290 train samples, 2 unique classes
  Client 2: 44657 train samples, 2 unique classes
  Client 3: 44907 train samples, 2 unique classes
  Client 4: 44696 train samples, 2 unique classes
  Client 5: 45843 train samples, 2 unique classes
  Client 6: 45801 train samples, 2 unique classes
  Client 7: 45619 train samples, 2 unique classes
  Client 8: 45069 train samples, 2 unique classes
  Client 9: 45639 train samples, 2 unique classes
  Client 10: 45821 train samples, 2 unique classes
  Client 11: 45311 train samples, 2 unique classes
  Client 12: 45779 train samples, 2 unique classes
  Client 13: 46056 train samples, 2 unique classes
  Client 14: 45625 train samples, 2 unique classes
  Client 15: 45984 train samples, 2 unique classes
  Client 16: 46428 train samples, 2 unique classes
  Client 17: 44737 train samples, 2 unique classes
  Client 18: 45540 train samples, 2 unique classes
  Client 19: 46497 train samples, 2 unique classes
Will sample 4500 samples per client per epoch
Graph: erdos, nodes: 20, edges: 48
Degree statistics: avg=4.80, min=2, max=7
Attack: Compromised 10/20 nodes: [1, 2, 5, 11, 12, 13, 14, 15, 17, 18]
Attack type: directed_deviation, lambda: 1.0
Model variant: baseline
Model parameters: 1,174,986
BALANCE algorithm:
Balance Config: BALANCEConfig(gamma=2, kappa=1, alpha=0.5, min_neighbors=1)
  - Model dimension: 1,174,986 parameters
  - Complexity: O(N×d) = O(20×1,174,986)
Initial test acc across nodes: mean=0.4953 ± 0.0174
Round 001: test acc mean=0.4985 ± 0.0106 | min=0.4854 max=0.5167
         : test loss mean=2.4084 ± 1.8202
         : individual accs = ['0.485385', '0.512469', '0.487803', '0.505592', '0.489324', '0.490294', '0.514429', '0.496512', '0.489856', '0.492173', '0.490658', '0.491400', '0.516720', '0.487606', '0.495740', '0.513859', '0.506359', '0.514344', '0.490632', '0.499340']
         : correct/total = [(6908, 14232), (7295, 14235), (6959, 14266), (7188, 14217), (6967, 14238), (7047, 14373), (7380, 14346), (7117, 14334), (7002, 14294), (7074, 14373), (7038, 14344), (7028, 14302), (7417, 14354), (7003, 14362), (7099, 14320), (7397, 14395), (7286, 14389), (7333, 14257), (6992, 14251), (7190, 14399)]
         : compromised: 0.5001, honest: 0.4970
Round 002: test acc mean=0.5024 ± 0.0103 | min=0.4843 max=0.5207
         : test loss mean=1.0881 ± 0.6264
         : individual accs = ['0.520096', '0.520688', '0.513599', '0.514877', '0.492555', '0.491199', '0.498397', '0.506209', '0.493634', '0.501009', '0.495259', '0.508880', '0.509405', '0.492341', '0.498743', '0.493922', '0.499131', '0.498352', '0.516244', '0.484270']
         : correct/total = [(7402, 14232), (7412, 14235), (7327, 14266), (7320, 14217), (7013, 14238), (7060, 14373), (7150, 14346), (7256, 14334), (7056, 14294), (7201, 14373), (7104, 14344), (7278, 14302), (7312, 14354), (7071, 14362), (7142, 14320), (7110, 14395), (7182, 14389), (7105, 14257), (7357, 14251), (6973, 14399)]
         : compromised: 0.5043, honest: 0.5005
Round 003: test acc mean=0.5135 ± 0.0224 | min=0.4858 max=0.5700
         : test loss mean=0.7399 ± 0.1532
         : individual accs = ['0.497822', '0.523639', '0.485840', '0.543223', '0.521070', '0.493495', '0.569985', '0.531464', '0.487967', '0.550198', '0.504950', '0.515382', '0.507524', '0.500627', '0.496997', '0.498854', '0.492390', '0.540296', '0.504245', '0.504202']
         : correct/total = [(7085, 14232), (7454, 14235), (6931, 14266), (7723, 14217), (7419, 14238), (7093, 14373), (8177, 14346), (7618, 14334), (6975, 14294), (7908, 14373), (7243, 14344), (7371, 14302), (7285, 14354), (7190, 14362), (7117, 14320), (7181, 14395), (7085, 14389), (7703, 14257), (7186, 14251), (7260, 14399)]
         : compromised: 0.5067, honest: 0.5203
Round 004: test acc mean=0.5496 ± 0.0315 | min=0.4943 max=0.5991
         : test loss mean=0.6844 ± 0.0087
         : individual accs = ['0.575675', '0.561503', '0.494322', '0.599072', '0.581894', '0.509984', '0.580580', '0.590066', '0.531622', '0.555138', '0.566578', '0.583695', '0.527518', '0.524300', '0.506983', '0.523932', '0.511710', '0.531669', '0.552102', '0.583582']
         : correct/total = [(8193, 14232), (7993, 14235), (7052, 14266), (8517, 14217), (8285, 14238), (7330, 14373), (8329, 14346), (8458, 14334), (7599, 14294), (7979, 14373), (8127, 14344), (8348, 14302), (7572, 14354), (7530, 14362), (7260, 14320), (7542, 14395), (7363, 14389), (7580, 14257), (7868, 14251), (8403, 14399)]
         : compromised: 0.5316, honest: 0.5676
Round 005: test acc mean=0.5958 ± 0.0281 | min=0.5159 max=0.6287
         : test loss mean=0.6669 ± 0.0117
         : individual accs = ['0.608699', '0.576396', '0.575074', '0.628684', '0.613288', '0.607528', '0.603443', '0.615739', '0.624038', '0.596953', '0.599205', '0.605650', '0.602201', '0.595878', '0.515922', '0.594859', '0.599625', '0.602020', '0.527823', '0.623724']
         : correct/total = [(8663, 14232), (8205, 14235), (8204, 14266), (8938, 14217), (8732, 14238), (8732, 14373), (8657, 14346), (8826, 14334), (8920, 14294), (8580, 14373), (8595, 14344), (8662, 14302), (8644, 14354), (8558, 14362), (7388, 14320), (8563, 14395), (8628, 14389), (8583, 14257), (7522, 14251), (8981, 14399)]
         : compromised: 0.5803, honest: 0.6113
Round 006: test acc mean=0.6204 ± 0.0228 | min=0.5437 max=0.6428
         : test loss mean=0.6524 ± 0.0147
         : individual accs = ['0.632940', '0.630207', '0.599958', '0.635225', '0.625228', '0.623391', '0.621846', '0.630738', '0.631034', '0.633897', '0.609732', '0.637254', '0.642817', '0.637585', '0.543715', '0.587287', '0.637153', '0.625447', '0.597221', '0.626016']
         : correct/total = [(9008, 14232), (8971, 14235), (8559, 14266), (9031, 14217), (8902, 14238), (8960, 14373), (8921, 14346), (9041, 14334), (9020, 14294), (9111, 14373), (8746, 14344), (9114, 14302), (9227, 14354), (9157, 14362), (7786, 14320), (8454, 14395), (9168, 14389), (8917, 14257), (8511, 14251), (9014, 14399)]
         : compromised: 0.6125, honest: 0.6284
Round 007: test acc mean=0.6384 ± 0.0111 | min=0.6103 max=0.6523
         : test loss mean=0.6352 ± 0.0101
         : individual accs = ['0.641301', '0.634914', '0.610262', '0.647464', '0.639767', '0.640785', '0.619824', '0.639807', '0.652302', '0.642802', '0.634551', '0.641798', '0.649923', '0.650606', '0.640084', '0.625148', '0.650497', '0.640527', '0.620448', '0.645600']
         : correct/total = [(9127, 14232), (9038, 14235), (8706, 14266), (9205, 14217), (9109, 14238), (9210, 14373), (8892, 14346), (9171, 14334), (9324, 14294), (9239, 14373), (9102, 14344), (9179, 14302), (9329, 14354), (9344, 14362), (9166, 14320), (8999, 14395), (9360, 14389), (9132, 14257), (8842, 14251), (9296, 14399)]
         : compromised: 0.6354, honest: 0.6414
Round 008: test acc mean=0.6459 ± 0.0076 | min=0.6289 max=0.6567
         : test loss mean=0.6272 ± 0.0081
         : individual accs = ['0.650857', '0.652547', '0.628908', '0.656749', '0.634429', '0.645377', '0.646313', '0.638133', '0.656219', '0.638976', '0.644032', '0.642498', '0.649296', '0.651789', '0.652165', '0.643418', '0.653833', '0.644315', '0.635394', '0.652198']
         : correct/total = [(9263, 14232), (9289, 14235), (8972, 14266), (9337, 14217), (9033, 14238), (9276, 14373), (9272, 14346), (9147, 14334), (9380, 14294), (9184, 14373), (9238, 14344), (9189, 14302), (9320, 14354), (9361, 14362), (9339, 14320), (9262, 14395), (9408, 14389), (9186, 14257), (9055, 14251), (9391, 14399)]
         : compromised: 0.6446, honest: 0.6472
Round 009: test acc mean=0.6440 ± 0.0140 | min=0.6157 max=0.6627
         : test loss mean=0.6259 ± 0.0102
         : individual accs = ['0.615655', '0.661328', '0.624422', '0.642189', '0.644824', '0.654839', '0.619824', '0.646923', '0.629355', '0.621930', '0.654350', '0.652566', '0.645604', '0.662651', '0.657332', '0.652727', '0.641949', '0.645928', '0.648446', '0.657962']
         : correct/total = [(8762, 14232), (9414, 14235), (8908, 14266), (9130, 14217), (9181, 14238), (9412, 14373), (8892, 14346), (9273, 14334), (8996, 14294), (8939, 14373), (9386, 14344), (9333, 14302), (9267, 14354), (9517, 14362), (9413, 14320), (9396, 14395), (9237, 14389), (9209, 14257), (9241, 14251), (9474, 14399)]
         : compromised: 0.6506, honest: 0.6375
Round 010: test acc mean=0.6590 ± 0.0087 | min=0.6369 max=0.6717
         : test loss mean=0.6124 ± 0.0064
         : individual accs = ['0.655635', '0.666315', '0.636899', '0.666878', '0.655008', '0.661379', '0.661508', '0.663109', '0.657828', '0.650177', '0.660764', '0.660187', '0.671659', '0.661816', '0.665433', '0.661827', '0.667663', '0.653995', '0.638482', '0.663171']
         : correct/total = [(9331, 14232), (9485, 14235), (9086, 14266), (9481, 14217), (9326, 14238), (9506, 14373), (9490, 14346), (9505, 14334), (9403, 14294), (9345, 14373), (9478, 14344), (9442, 14302), (9641, 14354), (9505, 14362), (9529, 14320), (9527, 14395), (9607, 14389), (9324, 14257), (9099, 14251), (9549, 14399)]
         : compromised: 0.6578, honest: 0.6602

=== FINAL RESULTS ===
Dataset: sent140, Nodes: 20, Graph: erdos, Aggregation: balance
Attack: directed_deviation, 50.0% compromised
Final accuracy - Compromised: 0.6578, Honest: 0.6602
Overall test accuracy: mean=0.6590 ± 0.0087

=== BALANCE SUMMARY ===
Node 0: acceptance=0.700
Node 1: acceptance=0.400
Node 2: acceptance=0.360
Node 3: acceptance=0.550
Node 4: acceptance=0.400
Node 5: acceptance=0.360
Node 6: acceptance=0.460
Node 7: acceptance=0.460
Node 8: acceptance=0.600
Node 9: acceptance=0.700
Node 10: acceptance=0.550
Node 11: acceptance=0.400
Node 12: acceptance=0.514
Node 13: acceptance=0.400
Node 14: acceptance=0.314
Node 15: acceptance=0.317
Node 16: acceptance=0.360
Node 17: acceptance=0.460
Node 18: acceptance=0.425
Node 19: acceptance=0.600

=== PARALLEL EXECUTION TIME (realistic for distributed system) ===
  COMMUNICATION (max across nodes):
    - Full model transfer: 0.000s (0.0%)
  COMPUTATION (max across nodes):
    - Filtering: 0.030s (71.1%)
    - Aggregation: 0.012s (28.8%)
  TOTALS:
    - Total computation: 0.042s (100.0%)
    - Total communication: 0.000s (0.0%)
    - Total parallel time: 0.042s

=== PER-NODE AVERAGE TIME ===
  - Filtering: 0.021s
  - Aggregation: 0.005s
  - Model transfer: 0.000s
  - Total per node: 0.027s

=== TOTAL COMPUTATIONAL WORK (sum across all nodes) ===
  - Total filtering: 0.428s
  - Total aggregation: 0.105s
  - Total model transfer: 0.000s
  - Grand total: 0.534s
  - Mean acceptance rate: 0.467

BALANCE Algorithm Properties:
  - Model dimension: 1,174,986
  - No compression: Full parameter comparison
  - Theoretical complexity: O(deg(i)×d)
  - Approach: Full parameter filtering + averaging
