Device: cuda
Seed: 987654321
Loading 1 LEAF Sent140 train files...
LEAF Sent140 train: 254555 users, 908652 samples
Building vocabulary (max_size=10000)...
Vocabulary size: 10000
Loading 1 LEAF Sent140 test files...
LEAF Sent140 test: 254555 users, 286281 samples
Found 254555 train users, 254555 test users, 254555 common users
User sample counts range: 494 (max) to 1 (min)
Distributed ALL 254555 users across 20 clients
Users per client: 12727 (with 15 clients getting +1 user)
Train partition sizes: [44353, 44290, 44657, 44907, 44696, 45843, 45801, 45619, 45069, 45639, 45821, 45311, 45779, 46056, 45625, 45984, 46428, 44737, 45540, 46497]
Test partition sizes: [14232, 14235, 14266, 14217, 14238, 14373, 14346, 14334, 14294, 14373, 14344, 14302, 14354, 14362, 14320, 14395, 14389, 14257, 14251, 14399]
  Client 0: 44353 train samples, 2 unique classes
  Client 1: 44290 train samples, 2 unique classes
  Client 2: 44657 train samples, 2 unique classes
  Client 3: 44907 train samples, 2 unique classes
  Client 4: 44696 train samples, 2 unique classes
  Client 5: 45843 train samples, 2 unique classes
  Client 6: 45801 train samples, 2 unique classes
  Client 7: 45619 train samples, 2 unique classes
  Client 8: 45069 train samples, 2 unique classes
  Client 9: 45639 train samples, 2 unique classes
  Client 10: 45821 train samples, 2 unique classes
  Client 11: 45311 train samples, 2 unique classes
  Client 12: 45779 train samples, 2 unique classes
  Client 13: 46056 train samples, 2 unique classes
  Client 14: 45625 train samples, 2 unique classes
  Client 15: 45984 train samples, 2 unique classes
  Client 16: 46428 train samples, 2 unique classes
  Client 17: 44737 train samples, 2 unique classes
  Client 18: 45540 train samples, 2 unique classes
  Client 19: 46497 train samples, 2 unique classes
Will sample 4500 samples per client per epoch
Graph: ring, nodes: 20, edges: 20
Degree statistics: avg=2.00, min=2, max=2
Attack: Compromised 8/20 nodes: [1, 5, 11, 12, 13, 14, 17, 18]
Attack type: krum, lambda: 1.0
Model variant: baseline
Model parameters: 1,174,986
BALANCE algorithm:
Balance Config: BALANCEConfig(gamma=2, kappa=1, alpha=0.5, min_neighbors=1)
  - Model dimension: 1,174,986 parameters
  - Complexity: O(N×d) = O(20×1,174,986)
Initial test acc across nodes: mean=0.4965 ± 0.0152
Round 001: test acc mean=0.5125 ± 0.0186 | min=0.4894 max=0.5544
         : test loss mean=1.8418 ± 1.4533
         : individual accs = ['0.489390', '0.553495', '0.515491', '0.554407', '0.504214', '0.509288', '0.509898', '0.526441', '0.518679', '0.540110', '0.500767', '0.518669', '0.501324', '0.504944', '0.493925', '0.502813', '0.489749', '0.521709', '0.501579', '0.493298']
         : correct/total = [(6965, 14232), (7879, 14235), (7354, 14266), (7882, 14217), (7179, 14238), (7320, 14373), (7315, 14346), (7546, 14334), (7414, 14294), (7763, 14373), (7183, 14344), (7418, 14302), (7196, 14354), (7252, 14362), (7073, 14320), (7238, 14395), (7047, 14389), (7438, 14257), (7148, 14251), (7103, 14399)]
         : compromised: 0.5131, honest: 0.5121
Round 002: test acc mean=0.4969 ± 0.0100 | min=0.4762 max=0.5124
         : test loss mean=1.5837 ± 1.0371
         : individual accs = ['0.512366', '0.476150', '0.491799', '0.479778', '0.497191', '0.504070', '0.480064', '0.504604', '0.488597', '0.507688', '0.491355', '0.505244', '0.500348', '0.508355', '0.504330', '0.498437', '0.491765', '0.499825', '0.491194', '0.504618']
         : correct/total = [(7292, 14232), (6778, 14235), (7016, 14266), (6821, 14217), (7079, 14238), (7245, 14373), (6887, 14346), (7233, 14334), (6984, 14294), (7297, 14373), (7048, 14344), (7226, 14302), (7182, 14354), (7301, 14362), (7222, 14320), (7175, 14395), (7076, 14389), (7126, 14257), (7000, 14251), (7266, 14399)]
         : compromised: 0.4987, honest: 0.4957
Round 003: test acc mean=0.5074 ± 0.0104 | min=0.4919 max=0.5341
         : test loss mean=0.9725 ± 0.5238
         : individual accs = ['0.534148', '0.492027', '0.507570', '0.506295', '0.515873', '0.509427', '0.509201', '0.505721', '0.509235', '0.507827', '0.511642', '0.500350', '0.501254', '0.491923', '0.498464', '0.511219', '0.506429', '0.505085', '0.494562', '0.530037']
         : correct/total = [(7602, 14232), (7004, 14235), (7241, 14266), (7198, 14217), (7345, 14238), (7322, 14373), (7305, 14346), (7249, 14334), (7279, 14294), (7299, 14373), (7339, 14344), (7156, 14302), (7195, 14354), (7065, 14362), (7138, 14320), (7359, 14395), (7287, 14389), (7201, 14257), (7048, 14251), (7632, 14399)]
         : compromised: 0.4991, honest: 0.5129
Round 004: test acc mean=0.5315 ± 0.0219 | min=0.4953 max=0.5764
         : test loss mean=0.9125 ± 0.5963
         : individual accs = ['0.537872', '0.550685', '0.547526', '0.554829', '0.561877', '0.524525', '0.555137', '0.576392', '0.513712', '0.546093', '0.548313', '0.508111', '0.506618', '0.512951', '0.513547', '0.509621', '0.514282', '0.519394', '0.495334', '0.532884']
         : correct/total = [(7655, 14232), (7839, 14235), (7811, 14266), (7888, 14217), (8000, 14238), (7539, 14373), (7964, 14346), (8262, 14334), (7343, 14294), (7849, 14373), (7865, 14344), (7267, 14302), (7272, 14354), (7367, 14362), (7354, 14320), (7336, 14395), (7400, 14389), (7405, 14257), (7059, 14251), (7673, 14399)]
         : compromised: 0.5164, honest: 0.5415
Round 005: test acc mean=0.5476 ± 0.0326 | min=0.4878 max=0.5989
         : test loss mean=0.8120 ± 0.3529
         : individual accs = ['0.536678', '0.541482', '0.565190', '0.577126', '0.573957', '0.528073', '0.592081', '0.588042', '0.568770', '0.598901', '0.589794', '0.566354', '0.497353', '0.487815', '0.513897', '0.522820', '0.516714', '0.522971', '0.524946', '0.538510']
         : correct/total = [(7638, 14232), (7708, 14235), (8063, 14266), (8205, 14217), (8172, 14238), (7590, 14373), (8494, 14346), (8429, 14334), (8130, 14294), (8608, 14373), (8460, 14344), (8100, 14302), (7139, 14354), (7006, 14362), (7359, 14320), (7526, 14395), (7435, 14389), (7456, 14257), (7481, 14251), (7754, 14399)]
         : compromised: 0.5229, honest: 0.5640
Round 006: test acc mean=0.5588 ± 0.0328 | min=0.5108 max=0.6071
         : test loss mean=0.9218 ± 0.7126
         : individual accs = ['0.538435', '0.534598', '0.583976', '0.592952', '0.584773', '0.537605', '0.598146', '0.595996', '0.582412', '0.607111', '0.602830', '0.594392', '0.510798', '0.514343', '0.528073', '0.528031', '0.527973', '0.532089', '0.540453', '0.540454']
         : correct/total = [(7663, 14232), (7610, 14235), (8331, 14266), (8430, 14217), (8326, 14238), (7727, 14373), (8581, 14346), (8543, 14334), (8325, 14294), (8726, 14373), (8647, 14344), (8501, 14302), (7332, 14354), (7387, 14362), (7562, 14320), (7601, 14395), (7597, 14389), (7586, 14257), (7702, 14251), (7782, 14399)]
         : compromised: 0.5365, honest: 0.5736
Round 007: test acc mean=0.5660 ± 0.0389 | min=0.4842 max=0.6152
         : test loss mean=0.7433 ± 0.1984
         : individual accs = ['0.548131', '0.550896', '0.591336', '0.599353', '0.594606', '0.585334', '0.602607', '0.602344', '0.596754', '0.615181', '0.610917', '0.605999', '0.484813', '0.484194', '0.532612', '0.538729', '0.537285', '0.543873', '0.549295', '0.546149']
         : correct/total = [(7801, 14232), (7842, 14235), (8436, 14266), (8521, 14217), (8466, 14238), (8413, 14373), (8645, 14346), (8634, 14334), (8530, 14294), (8842, 14373), (8763, 14344), (8667, 14302), (6959, 14354), (6954, 14362), (7627, 14320), (7755, 14395), (7731, 14389), (7754, 14257), (7828, 14251), (7864, 14399)]
         : compromised: 0.5421, honest: 0.5819
Round 008: test acc mean=0.5753 ± 0.0356 | min=0.5084 max=0.6177
         : test loss mean=0.9123 ± 0.7197
         : individual accs = ['0.553893', '0.581805', '0.597014', '0.604628', '0.594746', '0.608085', '0.607068', '0.607925', '0.609906', '0.617686', '0.616425', '0.612572', '0.508430', '0.513717', '0.534218', '0.544911', '0.539509', '0.548082', '0.552312', '0.553302']
         : correct/total = [(7883, 14232), (8282, 14235), (8517, 14266), (8596, 14217), (8468, 14238), (8740, 14373), (8709, 14346), (8714, 14334), (8718, 14294), (8878, 14373), (8842, 14344), (8761, 14302), (7298, 14354), (7378, 14362), (7650, 14320), (7844, 14395), (7763, 14389), (7814, 14257), (7871, 14251), (7967, 14399)]
         : compromised: 0.5574, honest: 0.5873
Round 009: test acc mean=0.5799 ± 0.0409 | min=0.4841 max=0.6205
         : test loss mean=0.7253 ± 0.1738
         : individual accs = ['0.559725', '0.603793', '0.604094', '0.611943', '0.600225', '0.619704', '0.612157', '0.614623', '0.614873', '0.616921', '0.620538', '0.618445', '0.492685', '0.484055', '0.547835', '0.560681', '0.547571', '0.553202', '0.555470', '0.559414']
         : correct/total = [(7966, 14232), (8595, 14235), (8618, 14266), (8700, 14217), (8546, 14238), (8907, 14373), (8782, 14346), (8810, 14334), (8789, 14294), (8867, 14373), (8901, 14344), (8845, 14302), (7072, 14354), (6952, 14362), (7845, 14320), (8071, 14395), (7879, 14389), (7887, 14257), (7916, 14251), (8055, 14399)]
         : compromised: 0.5594, honest: 0.5936
Round 010: test acc mean=0.5858 ± 0.0391 | min=0.5051 max=0.6267
         : test loss mean=0.8550 ± 0.5722
         : individual accs = ['0.566470', '0.609203', '0.610052', '0.616937', '0.610549', '0.624922', '0.619755', '0.619297', '0.621240', '0.622208', '0.626743', '0.620543', '0.505086', '0.508355', '0.546788', '0.558736', '0.546112', '0.556919', '0.562697', '0.564345']
         : correct/total = [(8062, 14232), (8672, 14235), (8703, 14266), (8771, 14217), (8693, 14238), (8982, 14373), (8891, 14346), (8877, 14334), (8880, 14294), (8943, 14373), (8990, 14344), (8875, 14302), (7250, 14354), (7301, 14362), (7830, 14320), (8043, 14395), (7858, 14389), (7940, 14257), (8019, 14251), (8126, 14399)]
         : compromised: 0.5668, honest: 0.5985

=== FINAL RESULTS ===
Dataset: sent140, Nodes: 20, Graph: ring, Aggregation: balance
Attack: krum, 40.0% compromised
Final accuracy - Compromised: 0.5668, Honest: 0.5985
Overall test accuracy: mean=0.5858 ± 0.0391

=== BALANCE SUMMARY ===
Node 0: acceptance=0.600
Node 1: acceptance=0.750
Node 2: acceptance=0.600
Node 3: acceptance=1.000
Node 4: acceptance=0.600
Node 5: acceptance=0.800
Node 6: acceptance=0.600
Node 7: acceptance=1.000
Node 8: acceptance=1.000
Node 9: acceptance=1.000
Node 10: acceptance=0.600
Node 11: acceptance=0.600
Node 12: acceptance=0.200
Node 13: acceptance=0.200
Node 14: acceptance=0.600
Node 15: acceptance=0.600
Node 16: acceptance=0.600
Node 17: acceptance=0.600
Node 18: acceptance=0.600
Node 19: acceptance=0.600

=== PARALLEL EXECUTION TIME (realistic for distributed system) ===
  COMMUNICATION (max across nodes):
    - Full model transfer: 0.000s (0.0%)
  COMPUTATION (max across nodes):
    - Filtering: 0.014s (57.8%)
    - Aggregation: 0.010s (42.2%)
  TOTALS:
    - Total computation: 0.025s (100.0%)
    - Total communication: 0.000s (0.0%)
    - Total parallel time: 0.025s

=== PER-NODE AVERAGE TIME ===
  - Filtering: 0.012s
  - Aggregation: 0.005s
  - Model transfer: 0.000s
  - Total per node: 0.017s

=== TOTAL COMPUTATIONAL WORK (sum across all nodes) ===
  - Total filtering: 0.240s
  - Total aggregation: 0.098s
  - Total model transfer: 0.000s
  - Grand total: 0.339s
  - Mean acceptance rate: 0.657

BALANCE Algorithm Properties:
  - Model dimension: 1,174,986
  - No compression: Full parameter comparison
  - Theoretical complexity: O(deg(i)×d)
  - Approach: Full parameter filtering + averaging
