Device: cuda
Seed: 987654321
Loading 1 LEAF Sent140 train files...
LEAF Sent140 train: 254555 users, 908652 samples
Building vocabulary (max_size=10000)...
Vocabulary size: 10000
Loading 1 LEAF Sent140 test files...
LEAF Sent140 test: 254555 users, 286281 samples
Found 254555 train users, 254555 test users, 254555 common users
User sample counts range: 494 (max) to 1 (min)
Distributed ALL 254555 users across 20 clients
Users per client: 12727 (with 15 clients getting +1 user)
Train partition sizes: [44353, 44290, 44657, 44907, 44696, 45843, 45801, 45619, 45069, 45639, 45821, 45311, 45779, 46056, 45625, 45984, 46428, 44737, 45540, 46497]
Test partition sizes: [14232, 14235, 14266, 14217, 14238, 14373, 14346, 14334, 14294, 14373, 14344, 14302, 14354, 14362, 14320, 14395, 14389, 14257, 14251, 14399]
  Client 0: 44353 train samples, 2 unique classes
  Client 1: 44290 train samples, 2 unique classes
  Client 2: 44657 train samples, 2 unique classes
  Client 3: 44907 train samples, 2 unique classes
  Client 4: 44696 train samples, 2 unique classes
  Client 5: 45843 train samples, 2 unique classes
  Client 6: 45801 train samples, 2 unique classes
  Client 7: 45619 train samples, 2 unique classes
  Client 8: 45069 train samples, 2 unique classes
  Client 9: 45639 train samples, 2 unique classes
  Client 10: 45821 train samples, 2 unique classes
  Client 11: 45311 train samples, 2 unique classes
  Client 12: 45779 train samples, 2 unique classes
  Client 13: 46056 train samples, 2 unique classes
  Client 14: 45625 train samples, 2 unique classes
  Client 15: 45984 train samples, 2 unique classes
  Client 16: 46428 train samples, 2 unique classes
  Client 17: 44737 train samples, 2 unique classes
  Client 18: 45540 train samples, 2 unique classes
  Client 19: 46497 train samples, 2 unique classes
Will sample 4500 samples per client per epoch
Graph: erdos, nodes: 20, edges: 99
Degree statistics: avg=9.90, min=7, max=14
Attack: Compromised 4/20 nodes: [5, 12, 13, 17]
Attack type: krum, lambda: 1.0
Model variant: baseline
Model parameters: 1,174,986
BALANCE algorithm:
Balance Config: BALANCEConfig(gamma=2, kappa=1, alpha=0.5, min_neighbors=1)
  - Model dimension: 1,174,986 parameters
  - Complexity: O(N×d) = O(20×1,174,986)
Initial test acc across nodes: mean=0.4953 ± 0.0174
Round 001: test acc mean=0.5074 ± 0.0196 | min=0.4721 max=0.5545
         : test loss mean=0.7965 ± 0.1345
         : individual accs = ['0.472105', '0.515420', '0.517314', '0.508124', '0.505619', '0.504070', '0.489335', '0.493721', '0.516091', '0.554373', '0.499094', '0.501538', '0.524732', '0.554519', '0.492179', '0.500868', '0.504691', '0.505155', '0.503544', '0.485034']
         : correct/total = [(6719, 14232), (7337, 14235), (7380, 14266), (7224, 14217), (7199, 14238), (7245, 14373), (7020, 14346), (7077, 14334), (7377, 14294), (7968, 14373), (7159, 14344), (7173, 14302), (7532, 14354), (7964, 14362), (7048, 14320), (7210, 14395), (7262, 14389), (7202, 14257), (7176, 14251), (6984, 14399)]
         : compromised: 0.5221, honest: 0.5037
Round 002: test acc mean=0.5440 ± 0.0385 | min=0.5014 max=0.6050
         : test loss mean=0.6896 ± 0.0028
         : individual accs = ['0.540472', '0.601897', '0.598486', '0.578251', '0.514679', '0.568427', '0.555137', '0.515697', '0.501399', '0.508453', '0.514013', '0.599566', '0.502856', '0.506893', '0.509148', '0.592845', '0.520676', '0.542751', '0.605010', '0.502396']
         : correct/total = [(7692, 14232), (8568, 14235), (8538, 14266), (8221, 14217), (7328, 14238), (8170, 14373), (7964, 14346), (7392, 14334), (7167, 14294), (7308, 14373), (7373, 14344), (8575, 14302), (7218, 14354), (7280, 14362), (7291, 14320), (8534, 14395), (7492, 14389), (7738, 14257), (8622, 14251), (7234, 14399)]
         : compromised: 0.5302, honest: 0.5474
Round 003: test acc mean=0.5371 ± 0.0377 | min=0.4944 max=0.6119
         : test loss mean=0.6888 ± 0.0014
         : individual accs = ['0.536327', '0.603512', '0.585308', '0.558346', '0.497050', '0.533222', '0.528301', '0.497628', '0.512593', '0.506018', '0.581497', '0.544260', '0.520482', '0.507868', '0.494413', '0.505801', '0.595802', '0.518061', '0.503473', '0.611917']
         : correct/total = [(7633, 14232), (8591, 14235), (8350, 14266), (7938, 14217), (7077, 14238), (7664, 14373), (7579, 14346), (7133, 14334), (7327, 14294), (7273, 14373), (8341, 14344), (7784, 14302), (7471, 14354), (7294, 14362), (7080, 14320), (7281, 14395), (8573, 14389), (7386, 14257), (7175, 14251), (8811, 14399)]
         : compromised: 0.5199, honest: 0.5414
Round 004: test acc mean=0.5780 ± 0.0406 | min=0.5075 max=0.6253
         : test loss mean=0.6859 ± 0.0019
         : individual accs = ['0.567594', '0.620583', '0.587621', '0.607090', '0.618977', '0.553329', '0.625261', '0.532231', '0.536589', '0.591804', '0.605131', '0.611033', '0.513446', '0.518382', '0.507472', '0.605974', '0.604907', '0.524304', '0.619044', '0.609070']
         : correct/total = [(8078, 14232), (8834, 14235), (8383, 14266), (8631, 14217), (8813, 14238), (7953, 14373), (8970, 14346), (7629, 14334), (7670, 14294), (8506, 14373), (8680, 14344), (8739, 14302), (7370, 14354), (7445, 14362), (7267, 14320), (8723, 14395), (8704, 14389), (7475, 14257), (8822, 14251), (8770, 14399)]
         : compromised: 0.5274, honest: 0.5906
Round 005: test acc mean=0.6232 ± 0.0113 | min=0.5982 max=0.6364
         : test loss mean=0.6766 ± 0.0028
         : individual accs = ['0.631394', '0.634703', '0.622038', '0.632764', '0.630426', '0.625896', '0.633347', '0.630668', '0.615503', '0.598205', '0.606456', '0.634247', '0.602201', '0.619830', '0.634846', '0.612088', '0.623115', '0.616259', '0.624097', '0.636433']
         : correct/total = [(8986, 14232), (9035, 14235), (8874, 14266), (8996, 14217), (8976, 14238), (8996, 14373), (9086, 14346), (9040, 14334), (8798, 14294), (8598, 14373), (8699, 14344), (9071, 14302), (8644, 14354), (8902, 14362), (9091, 14320), (8811, 14395), (8966, 14389), (8786, 14257), (8894, 14251), (9164, 14399)]
         : compromised: 0.6160, honest: 0.6250
Round 006: test acc mean=0.6335 ± 0.0102 | min=0.6082 max=0.6439
         : test loss mean=0.6573 ± 0.0043
         : individual accs = ['0.636875', '0.641939', '0.628277', '0.634241', '0.639697', '0.641133', '0.638296', '0.610018', '0.642857', '0.637376', '0.625558', '0.621731', '0.641354', '0.632781', '0.641061', '0.628760', '0.643478', '0.608192', '0.632307', '0.643864']
         : correct/total = [(9064, 14232), (9138, 14235), (8963, 14266), (9017, 14217), (9108, 14238), (9215, 14373), (9157, 14346), (8744, 14334), (9189, 14294), (9161, 14373), (8973, 14344), (8892, 14302), (9206, 14354), (9088, 14362), (9180, 14320), (9051, 14395), (9259, 14389), (8671, 14257), (9011, 14251), (9271, 14399)]
         : compromised: 0.6309, honest: 0.6341
Round 007: test acc mean=0.6398 ± 0.0091 | min=0.6176 max=0.6504
         : test loss mean=0.6409 ± 0.0052
         : individual accs = ['0.642777', '0.649034', '0.641665', '0.640993', '0.643068', '0.650386', '0.641154', '0.619367', '0.648314', '0.643707', '0.634760', '0.633758', '0.648112', '0.617602', '0.650279', '0.626815', '0.643408', '0.642211', '0.638482', '0.640322']
         : correct/total = [(9148, 14232), (9239, 14235), (9154, 14266), (9113, 14217), (9156, 14238), (9348, 14373), (9198, 14346), (8878, 14334), (9267, 14294), (9252, 14373), (9105, 14344), (9064, 14302), (9303, 14354), (8870, 14362), (9312, 14320), (9023, 14395), (9258, 14389), (9156, 14257), (9099, 14251), (9220, 14399)]
         : compromised: 0.6396, honest: 0.6399
Round 008: test acc mean=0.6481 ± 0.0068 | min=0.6297 max=0.6571
         : test loss mean=0.6308 ± 0.0046
         : individual accs = ['0.648257', '0.638497', '0.629679', '0.654006', '0.646720', '0.655604', '0.650983', '0.646505', '0.656359', '0.650247', '0.647100', '0.654943', '0.647346', '0.645662', '0.649372', '0.647516', '0.657099', '0.636249', '0.645358', '0.654768']
         : correct/total = [(9226, 14232), (9089, 14235), (8983, 14266), (9298, 14217), (9208, 14238), (9423, 14373), (9339, 14346), (9267, 14334), (9382, 14294), (9346, 14373), (9282, 14344), (9367, 14302), (9292, 14354), (9273, 14362), (9299, 14320), (9321, 14395), (9455, 14389), (9071, 14257), (9197, 14251), (9428, 14399)]
         : compromised: 0.6462, honest: 0.6486
Round 009: test acc mean=0.6530 ± 0.0078 | min=0.6274 max=0.6632
         : test loss mean=0.6258 ± 0.0062
         : individual accs = ['0.627389', '0.660555', '0.653091', '0.656186', '0.647352', '0.660335', '0.647776', '0.655016', '0.655590', '0.648368', '0.642220', '0.654104', '0.656193', '0.654923', '0.657891', '0.650712', '0.663215', '0.652241', '0.656305', '0.660879']
         : correct/total = [(8929, 14232), (9403, 14235), (9317, 14266), (9329, 14217), (9217, 14238), (9491, 14373), (9293, 14346), (9389, 14334), (9371, 14294), (9319, 14373), (9212, 14344), (9355, 14302), (9419, 14354), (9406, 14362), (9421, 14320), (9367, 14395), (9543, 14389), (9299, 14257), (9353, 14251), (9516, 14399)]
         : compromised: 0.6559, honest: 0.6523
Round 010: test acc mean=0.6612 ± 0.0084 | min=0.6314 max=0.6692
         : test loss mean=0.6173 ± 0.0067
         : individual accs = ['0.658165', '0.664981', '0.631431', '0.662165', '0.663506', '0.666110', '0.664018', '0.669178', '0.668462', '0.657274', '0.656023', '0.668718', '0.668594', '0.663765', '0.665573', '0.652518', '0.667732', '0.661920', '0.654761', '0.659837']
         : correct/total = [(9367, 14232), (9466, 14235), (9008, 14266), (9414, 14217), (9447, 14238), (9574, 14373), (9526, 14346), (9592, 14334), (9555, 14294), (9447, 14373), (9410, 14344), (9564, 14302), (9597, 14354), (9533, 14362), (9531, 14320), (9393, 14395), (9608, 14389), (9437, 14257), (9331, 14251), (9501, 14399)]
         : compromised: 0.6651, honest: 0.6603

=== FINAL RESULTS ===
Dataset: sent140, Nodes: 20, Graph: erdos, Aggregation: balance
Attack: krum, 20.0% compromised
Final accuracy - Compromised: 0.6651, Honest: 0.6603
Overall test accuracy: mean=0.6612 ± 0.0084

=== BALANCE SUMMARY ===
Node 0: acceptance=0.850
Node 1: acceptance=0.820
Node 2: acceptance=1.000
Node 3: acceptance=0.871
Node 4: acceptance=0.800
Node 5: acceptance=0.820
Node 6: acceptance=0.775
Node 7: acceptance=0.755
Node 8: acceptance=0.614
Node 9: acceptance=1.000
Node 10: acceptance=0.775
Node 11: acceptance=0.775
Node 12: acceptance=0.925
Node 13: acceptance=1.000
Node 14: acceptance=0.743
Node 15: acceptance=0.800
Node 16: acceptance=0.743
Node 17: acceptance=0.887
Node 18: acceptance=0.850
Node 19: acceptance=0.640

=== PARALLEL EXECUTION TIME (realistic for distributed system) ===
  COMMUNICATION (max across nodes):
    - Full model transfer: 0.000s (0.0%)
  COMPUTATION (max across nodes):
    - Filtering: 0.056s (78.2%)
    - Aggregation: 0.016s (21.8%)
  TOTALS:
    - Total computation: 0.071s (100.0%)
    - Total communication: 0.000s (0.0%)
    - Total parallel time: 0.071s

=== PER-NODE AVERAGE TIME ===
  - Filtering: 0.041s
  - Aggregation: 0.009s
  - Model transfer: 0.000s
  - Total per node: 0.049s

=== TOTAL COMPUTATIONAL WORK (sum across all nodes) ===
  - Total filtering: 0.812s
  - Total aggregation: 0.172s
  - Total model transfer: 0.000s
  - Grand total: 0.984s
  - Mean acceptance rate: 0.822

BALANCE Algorithm Properties:
  - Model dimension: 1,174,986
  - No compression: Full parameter comparison
  - Theoretical complexity: O(deg(i)×d)
  - Approach: Full parameter filtering + averaging
