Device: cuda
Seed: 987654321
Loading 1 LEAF Sent140 train files...
LEAF Sent140 train: 254555 users, 908652 samples
Building vocabulary (max_size=10000)...
Vocabulary size: 10000
Loading 1 LEAF Sent140 test files...
LEAF Sent140 test: 254555 users, 286281 samples
Found 254555 train users, 254555 test users, 254555 common users
User sample counts range: 494 (max) to 1 (min)
Distributed ALL 254555 users across 20 clients
Users per client: 12727 (with 15 clients getting +1 user)
Train partition sizes: [44353, 44290, 44657, 44907, 44696, 45843, 45801, 45619, 45069, 45639, 45821, 45311, 45779, 46056, 45625, 45984, 46428, 44737, 45540, 46497]
Test partition sizes: [14232, 14235, 14266, 14217, 14238, 14373, 14346, 14334, 14294, 14373, 14344, 14302, 14354, 14362, 14320, 14395, 14389, 14257, 14251, 14399]
  Client 0: 44353 train samples, 2 unique classes
  Client 1: 44290 train samples, 2 unique classes
  Client 2: 44657 train samples, 2 unique classes
  Client 3: 44907 train samples, 2 unique classes
  Client 4: 44696 train samples, 2 unique classes
  Client 5: 45843 train samples, 2 unique classes
  Client 6: 45801 train samples, 2 unique classes
  Client 7: 45619 train samples, 2 unique classes
  Client 8: 45069 train samples, 2 unique classes
  Client 9: 45639 train samples, 2 unique classes
  Client 10: 45821 train samples, 2 unique classes
  Client 11: 45311 train samples, 2 unique classes
  Client 12: 45779 train samples, 2 unique classes
  Client 13: 46056 train samples, 2 unique classes
  Client 14: 45625 train samples, 2 unique classes
  Client 15: 45984 train samples, 2 unique classes
  Client 16: 46428 train samples, 2 unique classes
  Client 17: 44737 train samples, 2 unique classes
  Client 18: 45540 train samples, 2 unique classes
  Client 19: 46497 train samples, 2 unique classes
Will sample 4500 samples per client per epoch
Graph: erdos, nodes: 20, edges: 99
Degree statistics: avg=9.90, min=7, max=14
Attack: Compromised 10/20 nodes: [1, 2, 5, 11, 12, 13, 14, 15, 17, 18]
Attack type: directed_deviation, lambda: 1.0
Model variant: baseline
Model parameters: 1,174,986
Initial test acc across nodes: mean=0.4953 ± 0.0174
Round 001: test acc mean=0.5005 ± 0.0080 | min=0.4822 max=0.5169
         : test loss mean=5.9716 ± 2.0158
         : individual accs = ['0.516934', '0.482192', '0.494252', '0.512204', '0.500913', '0.506436', '0.501115', '0.501256', '0.496712', '0.510193', '0.503904', '0.507202', '0.501463', '0.497215', '0.493156', '0.488711', '0.492529', '0.504875', '0.497719', '0.500451']
         : correct/total = [(7357, 14232), (6864, 14235), (7051, 14266), (7282, 14217), (7132, 14238), (7279, 14373), (7189, 14346), (7185, 14334), (7100, 14294), (7333, 14373), (7228, 14344), (7254, 14302), (7198, 14354), (7141, 14362), (7062, 14320), (7035, 14395), (7087, 14389), (7198, 14257), (7093, 14251), (7206, 14399)]
         : compromised: 0.4973, honest: 0.5036
Round 002: test acc mean=0.5067 ± 0.0082 | min=0.4899 max=0.5193
         : test loss mean=3.9818 ± 1.2267
         : individual accs = ['0.504286', '0.512891', '0.513669', '0.509531', '0.516646', '0.511028', '0.519309', '0.509279', '0.506926', '0.498922', '0.504253', '0.514194', '0.501533', '0.490670', '0.503073', '0.489892', '0.494892', '0.504033', '0.516806', '0.511772']
         : correct/total = [(7177, 14232), (7301, 14235), (7328, 14266), (7244, 14217), (7356, 14238), (7345, 14373), (7450, 14346), (7300, 14334), (7246, 14294), (7171, 14373), (7233, 14344), (7354, 14302), (7199, 14354), (7047, 14362), (7204, 14320), (7052, 14395), (7121, 14389), (7186, 14257), (7365, 14251), (7369, 14399)]
         : compromised: 0.5058, honest: 0.5076
Round 003: test acc mean=0.4977 ± 0.0106 | min=0.4775 max=0.5249
         : test loss mean=1.2350 ± 0.5353
         : individual accs = ['0.524944', '0.479663', '0.477499', '0.487374', '0.492063', '0.507479', '0.506413', '0.494140', '0.497342', '0.499478', '0.502858', '0.494127', '0.494078', '0.510444', '0.492668', '0.497812', '0.493432', '0.495686', '0.495193', '0.511772']
         : correct/total = [(7471, 14232), (6828, 14235), (6812, 14266), (6929, 14217), (7006, 14238), (7294, 14373), (7265, 14346), (7083, 14334), (7109, 14294), (7179, 14373), (7213, 14344), (7067, 14302), (7092, 14354), (7331, 14362), (7055, 14320), (7166, 14395), (7100, 14389), (7067, 14257), (7057, 14251), (7369, 14399)]
         : compromised: 0.4945, honest: 0.5010
Round 004: test acc mean=0.5017 ± 0.0059 | min=0.4880 max=0.5110
         : test loss mean=1.2299 ± 0.4684
         : individual accs = ['0.501265', '0.498419', '0.507781', '0.500950', '0.502950', '0.502261', '0.505646', '0.496163', '0.506506', '0.500661', '0.509342', '0.504125', '0.488017', '0.491088', '0.503771', '0.511011', '0.506776', '0.494003', '0.505789', '0.497465']
         : correct/total = [(7134, 14232), (7095, 14235), (7244, 14266), (7122, 14217), (7161, 14238), (7219, 14373), (7254, 14346), (7112, 14334), (7240, 14294), (7196, 14373), (7306, 14344), (7210, 14302), (7005, 14354), (7053, 14362), (7214, 14320), (7356, 14395), (7292, 14389), (7043, 14257), (7208, 14251), (7163, 14399)]
         : compromised: 0.5006, honest: 0.5028
Round 005: test acc mean=0.4997 ± 0.0098 | min=0.4731 max=0.5235
         : test loss mean=1.0074 ± 0.3050
         : individual accs = ['0.486509', '0.509519', '0.488013', '0.503271', '0.495716', '0.502261', '0.501046', '0.497349', '0.499930', '0.504766', '0.501185', '0.501398', '0.505364', '0.506615', '0.493645', '0.499826', '0.504205', '0.523462', '0.473090', '0.496007']
         : correct/total = [(6924, 14232), (7253, 14235), (6962, 14266), (7155, 14217), (7058, 14238), (7219, 14373), (7188, 14346), (7129, 14334), (7146, 14294), (7255, 14373), (7189, 14344), (7171, 14302), (7254, 14354), (7276, 14362), (7069, 14320), (7195, 14395), (7255, 14389), (7463, 14257), (6742, 14251), (7142, 14399)]
         : compromised: 0.5003, honest: 0.4990
Round 006: test acc mean=0.5099 ± 0.0097 | min=0.4969 max=0.5308
         : test loss mean=0.8687 ± 0.1964
         : individual accs = ['0.520096', '0.530594', '0.505327', '0.530843', '0.503161', '0.504975', '0.500558', '0.518976', '0.497691', '0.496904', '0.519730', '0.502028', '0.511913', '0.516014', '0.508380', '0.507746', '0.509625', '0.508522', '0.505859', '0.499062']
         : correct/total = [(7402, 14232), (7553, 14235), (7209, 14266), (7547, 14217), (7164, 14238), (7258, 14373), (7181, 14346), (7439, 14334), (7114, 14294), (7142, 14373), (7455, 14344), (7180, 14302), (7348, 14354), (7411, 14362), (7280, 14320), (7309, 14395), (7333, 14389), (7250, 14257), (7209, 14251), (7186, 14399)]
         : compromised: 0.5101, honest: 0.5097
Round 007: test acc mean=0.5018 ± 0.0089 | min=0.4870 max=0.5318
         : test loss mean=0.7564 ± 0.1226
         : individual accs = ['0.513912', '0.486969', '0.503645', '0.494760', '0.496278', '0.494608', '0.499024', '0.501953', '0.502588', '0.508314', '0.507041', '0.503636', '0.531838', '0.501601', '0.497696', '0.498645', '0.496004', '0.497440', '0.498351', '0.502049']
         : correct/total = [(7314, 14232), (6932, 14235), (7185, 14266), (7034, 14217), (7066, 14238), (7109, 14373), (7159, 14346), (7195, 14334), (7184, 14294), (7306, 14373), (7273, 14344), (7203, 14302), (7634, 14354), (7204, 14362), (7127, 14320), (7178, 14395), (7137, 14389), (7092, 14257), (7102, 14251), (7229, 14399)]
         : compromised: 0.5014, honest: 0.5022
Round 008: test acc mean=0.5154 ± 0.0105 | min=0.5003 max=0.5411
         : test loss mean=0.7713 ± 0.1078
         : individual accs = ['0.521922', '0.512680', '0.506098', '0.526834', '0.504916', '0.523273', '0.500279', '0.507116', '0.506786', '0.516176', '0.541062', '0.508041', '0.527031', '0.530010', '0.509008', '0.513442', '0.505108', '0.527530', '0.510210', '0.510591']
         : correct/total = [(7428, 14232), (7298, 14235), (7220, 14266), (7490, 14217), (7189, 14238), (7521, 14373), (7177, 14346), (7269, 14334), (7244, 14294), (7419, 14373), (7761, 14344), (7266, 14302), (7565, 14354), (7612, 14362), (7289, 14320), (7391, 14395), (7268, 14389), (7521, 14257), (7271, 14251), (7352, 14399)]
         : compromised: 0.5167, honest: 0.5141
Round 009: test acc mean=0.5015 ± 0.0113 | min=0.4829 max=0.5330
         : test loss mean=0.7170 ± 0.0716
         : individual accs = ['0.492763', '0.482894', '0.489836', '0.488429', '0.499508', '0.496208', '0.517845', '0.509976', '0.532951', '0.508801', '0.508296', '0.498602', '0.507106', '0.509121', '0.493017', '0.499062', '0.494197', '0.494985', '0.495685', '0.510383']
         : correct/total = [(7013, 14232), (6874, 14235), (6988, 14266), (6944, 14217), (7112, 14238), (7132, 14373), (7429, 14346), (7310, 14334), (7618, 14294), (7313, 14373), (7291, 14344), (7131, 14302), (7279, 14354), (7312, 14362), (7060, 14320), (7184, 14395), (7111, 14389), (7057, 14257), (7064, 14251), (7349, 14399)]
         : compromised: 0.4967, honest: 0.5063
Round 010: test acc mean=0.5197 ± 0.0078 | min=0.5095 max=0.5363
         : test loss mean=0.7437 ± 0.0592
         : individual accs = ['0.512296', '0.518932', '0.511706', '0.513892', '0.512712', '0.530091', '0.518821', '0.513255', '0.510494', '0.525986', '0.530396', '0.509579', '0.536297', '0.521376', '0.523813', '0.528864', '0.509486', '0.523252', '0.518490', '0.524620']
         : correct/total = [(7291, 14232), (7387, 14235), (7300, 14266), (7306, 14217), (7300, 14238), (7619, 14373), (7443, 14346), (7357, 14334), (7297, 14294), (7560, 14373), (7608, 14344), (7288, 14302), (7698, 14354), (7488, 14362), (7501, 14320), (7613, 14395), (7331, 14389), (7460, 14257), (7389, 14251), (7554, 14399)]
         : compromised: 0.5222, honest: 0.5172

=== FINAL RESULTS ===
Dataset: sent140, Nodes: 20, Graph: erdos, Aggregation: krum
Attack: directed_deviation, 50.0% compromised
Final accuracy - Compromised: 0.5222, Honest: 0.5172
Overall test accuracy: mean=0.5197 ± 0.0078
