Device: cuda
Seed: 987654321
Loading 1 LEAF Sent140 train files...
LEAF Sent140 train: 254555 users, 908652 samples
Building vocabulary (max_size=10000)...
Vocabulary size: 10000
Loading 1 LEAF Sent140 test files...
LEAF Sent140 test: 254555 users, 286281 samples
Found 254555 train users, 254555 test users, 254555 common users
User sample counts range: 494 (max) to 1 (min)
Distributed ALL 254555 users across 20 clients
Users per client: 12727 (with 15 clients getting +1 user)
Train partition sizes: [44353, 44290, 44657, 44907, 44696, 45843, 45801, 45619, 45069, 45639, 45821, 45311, 45779, 46056, 45625, 45984, 46428, 44737, 45540, 46497]
Test partition sizes: [14232, 14235, 14266, 14217, 14238, 14373, 14346, 14334, 14294, 14373, 14344, 14302, 14354, 14362, 14320, 14395, 14389, 14257, 14251, 14399]
  Client 0: 44353 train samples, 2 unique classes
  Client 1: 44290 train samples, 2 unique classes
  Client 2: 44657 train samples, 2 unique classes
  Client 3: 44907 train samples, 2 unique classes
  Client 4: 44696 train samples, 2 unique classes
  Client 5: 45843 train samples, 2 unique classes
  Client 6: 45801 train samples, 2 unique classes
  Client 7: 45619 train samples, 2 unique classes
  Client 8: 45069 train samples, 2 unique classes
  Client 9: 45639 train samples, 2 unique classes
  Client 10: 45821 train samples, 2 unique classes
  Client 11: 45311 train samples, 2 unique classes
  Client 12: 45779 train samples, 2 unique classes
  Client 13: 46056 train samples, 2 unique classes
  Client 14: 45625 train samples, 2 unique classes
  Client 15: 45984 train samples, 2 unique classes
  Client 16: 46428 train samples, 2 unique classes
  Client 17: 44737 train samples, 2 unique classes
  Client 18: 45540 train samples, 2 unique classes
  Client 19: 46497 train samples, 2 unique classes
Will sample 4500 samples per client per epoch
Graph: fully, nodes: 20, edges: 190
Degree statistics: avg=19.00, min=19, max=19
Attack: Compromised 4/20 nodes: [5, 12, 13, 17]
Attack type: backdoor, lambda: 1.0
Backdoor target label: 1, trigger size: 3
Model variant: baseline
Model parameters: 1,174,986
Initial test acc across nodes: mean=0.4953 ± 0.0174
Backdoor attack: Created poisoned datasets for 4 compromised nodes
Round 001: test acc mean=0.4982 ± 0.0061 | min=0.4872 max=0.5102
         : test loss mean=23.3127 ± 8.4782
         : individual accs = ['0.503583', '0.487460', '0.487172', '0.491032', '0.500000', '0.504418', '0.497909', '0.496791', '0.501329', '0.497461', '0.503346', '0.491050', '0.495820', '0.493942', '0.493366', '0.502119', '0.506498', '0.501227', '0.498351', '0.510174']
         : correct/total = [(7167, 14232), (6939, 14235), (6950, 14266), (6981, 14217), (7119, 14238), (7250, 14373), (7143, 14346), (7121, 14334), (7166, 14294), (7150, 14373), (7220, 14344), (7023, 14302), (7117, 14354), (7094, 14362), (7065, 14320), (7228, 14395), (7288, 14389), (7146, 14257), (7102, 14251), (7346, 14399)]
         : compromised: 0.4989, honest: 0.4980
Round 002: test acc mean=0.5049 ± 0.0056 | min=0.4930 max=0.5171
         : test loss mean=2.1934 ± 0.0239
         : individual accs = ['0.507589', '0.517106', '0.513178', '0.515510', '0.505338', '0.504070', '0.499861', '0.506767', '0.501889', '0.503931', '0.501046', '0.505524', '0.497492', '0.492968', '0.506983', '0.501702', '0.506985', '0.504945', '0.504105', '0.501840']
         : correct/total = [(7224, 14232), (7361, 14235), (7321, 14266), (7329, 14217), (7195, 14238), (7245, 14373), (7171, 14346), (7264, 14334), (7174, 14294), (7243, 14373), (7187, 14344), (7230, 14302), (7141, 14354), (7080, 14362), (7260, 14320), (7222, 14395), (7295, 14389), (7199, 14257), (7184, 14251), (7226, 14399)]
         : compromised: 0.4999, honest: 0.5062
Round 003: test acc mean=0.5126 ± 0.0039 | min=0.5068 max=0.5215
         : test loss mean=0.7796 ± 0.0047
         : individual accs = ['0.507026', '0.508325', '0.509884', '0.509812', '0.513766', '0.514924', '0.513662', '0.512348', '0.521478', '0.508175', '0.511712', '0.509929', '0.513446', '0.516223', '0.511732', '0.513581', '0.517896', '0.510977', '0.506842', '0.519481']
         : correct/total = [(7216, 14232), (7236, 14235), (7274, 14266), (7248, 14217), (7315, 14238), (7401, 14373), (7369, 14346), (7344, 14334), (7454, 14294), (7304, 14373), (7340, 14344), (7293, 14302), (7370, 14354), (7414, 14362), (7328, 14320), (7393, 14395), (7452, 14389), (7285, 14257), (7223, 14251), (7480, 14399)]
         : compromised: 0.5139, honest: 0.5122
Round 004: test acc mean=0.5061 ± 0.0044 | min=0.4977 max=0.5150
         : test loss mean=0.7140 ± 0.0022
         : individual accs = ['0.502530', '0.501300', '0.502594', '0.500457', '0.503652', '0.508384', '0.509759', '0.502093', '0.512313', '0.508801', '0.507599', '0.511117', '0.515048', '0.509748', '0.507332', '0.508163', '0.501286', '0.497720', '0.505017', '0.507049']
         : correct/total = [(7152, 14232), (7136, 14235), (7170, 14266), (7115, 14217), (7171, 14238), (7307, 14373), (7313, 14346), (7197, 14334), (7323, 14294), (7313, 14373), (7281, 14344), (7310, 14302), (7393, 14354), (7321, 14362), (7265, 14320), (7315, 14395), (7213, 14389), (7096, 14257), (7197, 14251), (7301, 14399)]
         : compromised: 0.5077, honest: 0.5057
Round 005: test acc mean=0.4973 ± 0.0031 | min=0.4903 max=0.5034
         : test loss mean=0.7368 ± 0.0026
         : individual accs = ['0.493114', '0.490341', '0.501051', '0.497011', '0.496629', '0.496347', '0.498257', '0.494140', '0.503428', '0.494330', '0.496166', '0.499930', '0.500836', '0.498468', '0.494064', '0.495311', '0.500313', '0.496949', '0.498912', '0.500104']
         : correct/total = [(7018, 14232), (6980, 14235), (7148, 14266), (7066, 14217), (7071, 14238), (7134, 14373), (7148, 14346), (7083, 14334), (7196, 14294), (7105, 14373), (7117, 14344), (7150, 14302), (7189, 14354), (7159, 14362), (7075, 14320), (7130, 14395), (7199, 14389), (7085, 14257), (7110, 14251), (7201, 14399)]
         : compromised: 0.4982, honest: 0.4971
Round 006: test acc mean=0.5118 ± 0.0048 | min=0.5019 max=0.5222
         : test loss mean=0.7044 ± 0.0016
         : individual accs = ['0.506183', '0.509800', '0.511916', '0.507210', '0.511940', '0.514646', '0.511362', '0.507883', '0.517280', '0.508732', '0.513107', '0.517130', '0.522224', '0.514761', '0.506494', '0.516429', '0.501911', '0.510276', '0.508947', '0.517328']
         : correct/total = [(7204, 14232), (7257, 14235), (7303, 14266), (7211, 14217), (7289, 14238), (7397, 14373), (7336, 14346), (7280, 14334), (7394, 14294), (7312, 14373), (7360, 14344), (7396, 14302), (7496, 14354), (7393, 14362), (7253, 14320), (7434, 14395), (7222, 14389), (7275, 14257), (7253, 14251), (7449, 14399)]
         : compromised: 0.5155, honest: 0.5109
Round 007: test acc mean=0.5335 ± 0.0046 | min=0.5244 max=0.5424
         : test loss mean=0.7074 ± 0.0024
         : individual accs = ['0.536537', '0.533263', '0.533646', '0.532954', '0.533853', '0.537814', '0.532831', '0.530766', '0.533650', '0.529326', '0.536182', '0.527129', '0.531141', '0.524439', '0.531355', '0.541994', '0.542359', '0.526759', '0.536243', '0.538579']
         : correct/total = [(7636, 14232), (7591, 14235), (7613, 14266), (7577, 14217), (7601, 14238), (7730, 14373), (7644, 14346), (7608, 14334), (7628, 14294), (7608, 14373), (7691, 14344), (7539, 14302), (7624, 14354), (7532, 14362), (7609, 14320), (7802, 14395), (7804, 14389), (7510, 14257), (7642, 14251), (7755, 14399)]
         : compromised: 0.5300, honest: 0.5344
Round 008: test acc mean=0.5133 ± 0.0043 | min=0.5042 max=0.5212
         : test loss mean=0.7432 ± 0.0031
         : individual accs = ['0.516161', '0.519073', '0.521169', '0.518464', '0.516013', '0.513184', '0.506971', '0.510465', '0.514342', '0.510262', '0.513455', '0.516012', '0.510311', '0.504178', '0.514106', '0.508788', '0.516436', '0.511468', '0.508315', '0.516286']
         : correct/total = [(7346, 14232), (7389, 14235), (7435, 14266), (7371, 14217), (7347, 14238), (7376, 14373), (7273, 14346), (7317, 14334), (7352, 14294), (7334, 14373), (7365, 14344), (7380, 14302), (7325, 14354), (7241, 14362), (7362, 14320), (7324, 14395), (7431, 14389), (7292, 14257), (7244, 14251), (7434, 14399)]
         : compromised: 0.5098, honest: 0.5141
Round 009: test acc mean=0.5081 ± 0.0059 | min=0.4949 max=0.5173
         : test loss mean=0.7021 ± 0.0015
         : individual accs = ['0.510188', '0.498490', '0.498808', '0.494900', '0.511659', '0.509010', '0.513523', '0.504535', '0.517350', '0.504209', '0.508017', '0.506083', '0.515048', '0.512463', '0.509218', '0.515804', '0.507749', '0.502841', '0.513578', '0.509133']
         : correct/total = [(7261, 14232), (7096, 14235), (7116, 14266), (7036, 14217), (7285, 14238), (7316, 14373), (7367, 14346), (7232, 14334), (7395, 14294), (7247, 14373), (7287, 14344), (7238, 14302), (7393, 14354), (7360, 14362), (7292, 14320), (7425, 14395), (7306, 14389), (7169, 14257), (7319, 14251), (7331, 14399)]
         : compromised: 0.5098, honest: 0.5077
Round 010: test acc mean=0.5220 ± 0.0044 | min=0.5117 max=0.5292
         : test loss mean=0.7053 ± 0.0018
         : individual accs = ['0.524030', '0.513453', '0.518225', '0.517549', '0.525565', '0.523342', '0.525582', '0.516534', '0.524276', '0.520559', '0.524400', '0.527688', '0.523756', '0.524022', '0.511732', '0.529212', '0.523038', '0.519604', '0.522419', '0.524203']
         : correct/total = [(7458, 14232), (7309, 14235), (7393, 14266), (7358, 14217), (7483, 14238), (7522, 14373), (7540, 14346), (7404, 14334), (7494, 14294), (7482, 14373), (7522, 14344), (7547, 14302), (7518, 14354), (7526, 14362), (7328, 14320), (7618, 14395), (7526, 14389), (7408, 14257), (7445, 14251), (7548, 14399)]
         : compromised: 0.5227, honest: 0.5218

=== FINAL RESULTS ===
Dataset: sent140, Nodes: 20, Graph: fully, Aggregation: krum
Attack: backdoor, 20.0% compromised
Final accuracy - Compromised: 0.5227, Honest: 0.5218
Overall test accuracy: mean=0.5220 ± 0.0044

=== BACKDOOR ATTACK SUCCESS RATE (ASR) ===
Target label: 1
Trigger size: 3x3
Overall ASR: 0.9244 ± 0.0022
Honest nodes ASR: 0.9237 ± 0.0017
Compromised nodes ASR: 0.9269 ± 0.0020
Note: Higher ASR indicates more successful backdoor attack
