Device: cuda
Seed: 987654321
Loading 1 LEAF Sent140 train files...
LEAF Sent140 train: 254555 users, 908652 samples
Building vocabulary (max_size=10000)...
Vocabulary size: 10000
Loading 1 LEAF Sent140 test files...
LEAF Sent140 test: 254555 users, 286281 samples
Found 254555 train users, 254555 test users, 254555 common users
User sample counts range: 494 (max) to 1 (min)
Distributed ALL 254555 users across 20 clients
Users per client: 12727 (with 15 clients getting +1 user)
Train partition sizes: [44353, 44290, 44657, 44907, 44696, 45843, 45801, 45619, 45069, 45639, 45821, 45311, 45779, 46056, 45625, 45984, 46428, 44737, 45540, 46497]
Test partition sizes: [14232, 14235, 14266, 14217, 14238, 14373, 14346, 14334, 14294, 14373, 14344, 14302, 14354, 14362, 14320, 14395, 14389, 14257, 14251, 14399]
  Client 0: 44353 train samples, 2 unique classes
  Client 1: 44290 train samples, 2 unique classes
  Client 2: 44657 train samples, 2 unique classes
  Client 3: 44907 train samples, 2 unique classes
  Client 4: 44696 train samples, 2 unique classes
  Client 5: 45843 train samples, 2 unique classes
  Client 6: 45801 train samples, 2 unique classes
  Client 7: 45619 train samples, 2 unique classes
  Client 8: 45069 train samples, 2 unique classes
  Client 9: 45639 train samples, 2 unique classes
  Client 10: 45821 train samples, 2 unique classes
  Client 11: 45311 train samples, 2 unique classes
  Client 12: 45779 train samples, 2 unique classes
  Client 13: 46056 train samples, 2 unique classes
  Client 14: 45625 train samples, 2 unique classes
  Client 15: 45984 train samples, 2 unique classes
  Client 16: 46428 train samples, 2 unique classes
  Client 17: 44737 train samples, 2 unique classes
  Client 18: 45540 train samples, 2 unique classes
  Client 19: 46497 train samples, 2 unique classes
Will sample 4500 samples per client per epoch
Graph: erdos, nodes: 20, edges: 126
Degree statistics: avg=12.60, min=8, max=16
Attack: Compromised 14/20 nodes: [1, 2, 3, 5, 6, 8, 11, 12, 13, 14, 15, 17, 18, 19]
Attack type: backdoor, lambda: 1.0
Backdoor target label: 1, trigger size: 3
Model variant: baseline
Model parameters: 1,174,986
Initial test acc across nodes: mean=0.4965 ± 0.0152
Backdoor attack: Created poisoned datasets for 14 compromised nodes
Round 001: test acc mean=0.5001 ± 0.0072 | min=0.4855 max=0.5125
         : test loss mean=11.2084 ± 4.2821
         : individual accs = ['0.510469', '0.510924', '0.497056', '0.503622', '0.495435', '0.493773', '0.503694', '0.497628', '0.485518', '0.506227', '0.495468', '0.492588', '0.496517', '0.512463', '0.495251', '0.493366', '0.499201', '0.497300', '0.506210', '0.510174']
         : correct/total = [(7265, 14232), (7273, 14235), (7091, 14266), (7160, 14217), (7054, 14238), (7097, 14373), (7226, 14346), (7133, 14334), (6940, 14294), (7276, 14373), (7107, 14344), (7045, 14302), (7127, 14354), (7360, 14362), (7092, 14320), (7102, 14395), (7183, 14389), (7090, 14257), (7214, 14251), (7346, 14399)]
         : compromised: 0.4999, honest: 0.5007
Round 002: test acc mean=0.5048 ± 0.0057 | min=0.4900 max=0.5118
         : test loss mean=28.1659 ± 5.6598
         : individual accs = ['0.511102', '0.511767', '0.511286', '0.508687', '0.510114', '0.504905', '0.502649', '0.505651', '0.508465', '0.507688', '0.502091', '0.506363', '0.504807', '0.490043', '0.500279', '0.504620', '0.494822', '0.497861', '0.510771', '0.502049']
         : correct/total = [(7274, 14232), (7285, 14235), (7294, 14266), (7232, 14217), (7263, 14238), (7257, 14373), (7211, 14346), (7248, 14334), (7268, 14294), (7297, 14373), (7202, 14344), (7242, 14302), (7246, 14354), (7038, 14362), (7164, 14320), (7264, 14395), (7120, 14389), (7098, 14257), (7279, 14251), (7229, 14399)]
         : compromised: 0.5046, honest: 0.5052
Round 003: test acc mean=0.5051 ± 0.0056 | min=0.4914 max=0.5139
         : test loss mean=17.1449 ± 2.2774
         : individual accs = ['0.510961', '0.513734', '0.513949', '0.507772', '0.505900', '0.506157', '0.502440', '0.504814', '0.511543', '0.506992', '0.500976', '0.507971', '0.500488', '0.491436', '0.504190', '0.501633', '0.500243', '0.496668', '0.511333', '0.503646']
         : correct/total = [(7272, 14232), (7313, 14235), (7332, 14266), (7219, 14217), (7203, 14238), (7275, 14373), (7208, 14346), (7236, 14334), (7312, 14294), (7287, 14373), (7186, 14344), (7265, 14302), (7184, 14354), (7058, 14362), (7220, 14320), (7221, 14395), (7198, 14389), (7081, 14257), (7287, 14251), (7252, 14399)]
         : compromised: 0.5052, honest: 0.5050
Round 004: test acc mean=0.4993 ± 0.0051 | min=0.4917 max=0.5091
         : test loss mean=9.1034 ± 1.1776
         : individual accs = ['0.498524', '0.505234', '0.494603', '0.500809', '0.504846', '0.497948', '0.493099', '0.499581', '0.491675', '0.496278', '0.509133', '0.494896', '0.498607', '0.504804', '0.499092', '0.504898', '0.507123', '0.493863', '0.498351', '0.491979']
         : correct/total = [(7095, 14232), (7192, 14235), (7056, 14266), (7120, 14217), (7188, 14238), (7157, 14373), (7074, 14346), (7161, 14334), (7028, 14294), (7133, 14373), (7303, 14344), (7078, 14302), (7157, 14354), (7250, 14362), (7147, 14320), (7268, 14395), (7297, 14389), (7041, 14257), (7102, 14251), (7084, 14399)]
         : compromised: 0.4978, honest: 0.5026
Round 005: test acc mean=0.4945 ± 0.0055 | min=0.4861 max=0.5084
         : test loss mean=11.2769 ± 0.6793
         : individual accs = ['0.489039', '0.486547', '0.486121', '0.490258', '0.494311', '0.494121', '0.497142', '0.493651', '0.488177', '0.493843', '0.498745', '0.491540', '0.498119', '0.508355', '0.495670', '0.498090', '0.500035', '0.502420', '0.488457', '0.494757']
         : correct/total = [(6960, 14232), (6926, 14235), (6935, 14266), (6970, 14217), (7038, 14238), (7102, 14373), (7132, 14346), (7076, 14334), (6978, 14294), (7098, 14373), (7154, 14344), (7030, 14302), (7150, 14354), (7301, 14362), (7098, 14320), (7170, 14395), (7195, 14389), (7163, 14257), (6961, 14251), (7124, 14399)]
         : compromised: 0.4943, honest: 0.4949
Round 006: test acc mean=0.4949 ± 0.0056 | min=0.4861 max=0.5085
         : test loss mean=36.4710 ± 2.7469
         : individual accs = ['0.489109', '0.486266', '0.486051', '0.492157', '0.494100', '0.493843', '0.497630', '0.495186', '0.488597', '0.493008', '0.499024', '0.492029', '0.499512', '0.508495', '0.495880', '0.498367', '0.499826', '0.503051', '0.488738', '0.496354']
         : correct/total = [(6961, 14232), (6922, 14235), (6934, 14266), (6997, 14217), (7035, 14238), (7098, 14373), (7139, 14346), (7098, 14334), (6984, 14294), (7086, 14373), (7158, 14344), (7037, 14302), (7170, 14354), (7303, 14362), (7101, 14320), (7174, 14395), (7192, 14389), (7172, 14257), (6965, 14251), (7147, 14399)]
         : compromised: 0.4948, honest: 0.4950
Round 007: test acc mean=0.4949 ± 0.0056 | min=0.4861 max=0.5086
         : test loss mean=17.2141 ± 2.6640
         : individual accs = ['0.489109', '0.486266', '0.486051', '0.492228', '0.494100', '0.493912', '0.497560', '0.495186', '0.488317', '0.493008', '0.499024', '0.492029', '0.499512', '0.508634', '0.495740', '0.498506', '0.499757', '0.503051', '0.488738', '0.496354']
         : correct/total = [(6961, 14232), (6922, 14235), (6934, 14266), (6998, 14217), (7035, 14238), (7099, 14373), (7138, 14346), (7098, 14334), (6980, 14294), (7086, 14373), (7158, 14344), (7037, 14302), (7170, 14354), (7305, 14362), (7099, 14320), (7176, 14395), (7191, 14389), (7172, 14257), (6965, 14251), (7147, 14399)]
         : compromised: 0.4948, honest: 0.4950
Round 008: test acc mean=0.5047 ± 0.0054 | min=0.4912 max=0.5143
         : test loss mean=12.4771 ± 5.6573
         : individual accs = ['0.506324', '0.514296', '0.514160', '0.505240', '0.496559', '0.506714', '0.502579', '0.504325', '0.511263', '0.505879', '0.500349', '0.505384', '0.500279', '0.491227', '0.504190', '0.502119', '0.500591', '0.506979', '0.510701', '0.504827']
         : correct/total = [(7206, 14232), (7321, 14235), (7335, 14266), (7183, 14217), (7070, 14238), (7283, 14373), (7210, 14346), (7229, 14334), (7308, 14294), (7271, 14373), (7177, 14344), (7228, 14302), (7181, 14354), (7055, 14362), (7220, 14320), (7228, 14395), (7203, 14389), (7228, 14257), (7278, 14251), (7269, 14399)]
         : compromised: 0.5057, honest: 0.5023
Round 009: test acc mean=0.5052 ± 0.0056 | min=0.4914 max=0.5139
         : test loss mean=16.4811 ± 1.5718
         : individual accs = ['0.510891', '0.513734', '0.513949', '0.507772', '0.505900', '0.506157', '0.502440', '0.504814', '0.511613', '0.506992', '0.500976', '0.507971', '0.500488', '0.491436', '0.504190', '0.501633', '0.500243', '0.496949', '0.511262', '0.503646']
         : correct/total = [(7271, 14232), (7313, 14235), (7332, 14266), (7219, 14217), (7203, 14238), (7275, 14373), (7208, 14346), (7236, 14334), (7313, 14294), (7287, 14373), (7186, 14344), (7265, 14302), (7184, 14354), (7058, 14362), (7220, 14320), (7221, 14395), (7198, 14389), (7085, 14257), (7286, 14251), (7252, 14399)]
         : compromised: 0.5052, honest: 0.5050
Round 010: test acc mean=0.5023 ± 0.0049 | min=0.4928 max=0.5106
         : test loss mean=12.2838 ± 2.7414
         : individual accs = ['0.508783', '0.510643', '0.506309', '0.508124', '0.506462', '0.502192', '0.493308', '0.502512', '0.503288', '0.503444', '0.501603', '0.505314', '0.500418', '0.495474', '0.501047', '0.500660', '0.492807', '0.496528', '0.507263', '0.499549']
         : correct/total = [(7241, 14232), (7269, 14235), (7223, 14266), (7224, 14217), (7211, 14238), (7218, 14373), (7077, 14346), (7203, 14334), (7194, 14294), (7236, 14373), (7195, 14344), (7227, 14302), (7183, 14354), (7116, 14362), (7175, 14320), (7207, 14395), (7091, 14389), (7079, 14257), (7229, 14251), (7193, 14399)]
         : compromised: 0.5022, honest: 0.5026

=== FINAL RESULTS ===
Dataset: sent140, Nodes: 20, Graph: erdos, Aggregation: d-fedavg
Attack: backdoor, 70.0% compromised
Final accuracy - Compromised: 0.5022, Honest: 0.5026
Overall test accuracy: mean=0.5023 ± 0.0049

=== BACKDOOR ATTACK SUCCESS RATE (ASR) ===
Target label: 1
Trigger size: 3x3
Overall ASR: 0.1619 ± 0.0967
Honest nodes ASR: 0.1196 ± 0.0675
Compromised nodes ASR: 0.1801 ± 0.1016
Note: Higher ASR indicates more successful backdoor attack
