Device: cuda
Seed: 987654321
Loading 1 LEAF Sent140 train files...
LEAF Sent140 train: 254555 users, 908652 samples
Building vocabulary (max_size=10000)...
Vocabulary size: 10000
Loading 1 LEAF Sent140 test files...
LEAF Sent140 test: 254555 users, 286281 samples
Found 254555 train users, 254555 test users, 254555 common users
User sample counts range: 494 (max) to 1 (min)
Distributed ALL 254555 users across 20 clients
Users per client: 12727 (with 15 clients getting +1 user)
Train partition sizes: [44353, 44290, 44657, 44907, 44696, 45843, 45801, 45619, 45069, 45639, 45821, 45311, 45779, 46056, 45625, 45984, 46428, 44737, 45540, 46497]
Test partition sizes: [14232, 14235, 14266, 14217, 14238, 14373, 14346, 14334, 14294, 14373, 14344, 14302, 14354, 14362, 14320, 14395, 14389, 14257, 14251, 14399]
  Client 0: 44353 train samples, 2 unique classes
  Client 1: 44290 train samples, 2 unique classes
  Client 2: 44657 train samples, 2 unique classes
  Client 3: 44907 train samples, 2 unique classes
  Client 4: 44696 train samples, 2 unique classes
  Client 5: 45843 train samples, 2 unique classes
  Client 6: 45801 train samples, 2 unique classes
  Client 7: 45619 train samples, 2 unique classes
  Client 8: 45069 train samples, 2 unique classes
  Client 9: 45639 train samples, 2 unique classes
  Client 10: 45821 train samples, 2 unique classes
  Client 11: 45311 train samples, 2 unique classes
  Client 12: 45779 train samples, 2 unique classes
  Client 13: 46056 train samples, 2 unique classes
  Client 14: 45625 train samples, 2 unique classes
  Client 15: 45984 train samples, 2 unique classes
  Client 16: 46428 train samples, 2 unique classes
  Client 17: 44737 train samples, 2 unique classes
  Client 18: 45540 train samples, 2 unique classes
  Client 19: 46497 train samples, 2 unique classes
Will sample 4500 samples per client per epoch
Graph: erdos, nodes: 20, edges: 48
Degree statistics: avg=4.80, min=2, max=7
Attack: Compromised 14/20 nodes: [1, 2, 3, 5, 6, 8, 11, 12, 13, 14, 15, 17, 18, 19]
Attack type: backdoor, lambda: 1.0
Backdoor target label: 1, trigger size: 3
Model variant: baseline
Model parameters: 1,174,986
Initial test acc across nodes: mean=0.4965 ± 0.0152
Backdoor attack: Created poisoned datasets for 14 compromised nodes
Round 001: test acc mean=0.4977 ± 0.0064 | min=0.4859 max=0.5071
         : test loss mean=13.0196 ± 8.3849
         : individual accs = ['0.506886', '0.489498', '0.490046', '0.507139', '0.503582', '0.498991', '0.502928', '0.498116', '0.496992', '0.506436', '0.493935', '0.491889', '0.493869', '0.497493', '0.501606', '0.498784', '0.503649', '0.485937', '0.486282', '0.499965']
         : correct/total = [(7214, 14232), (6968, 14235), (6991, 14266), (7210, 14217), (7170, 14238), (7172, 14373), (7215, 14346), (7140, 14334), (7104, 14294), (7279, 14373), (7085, 14344), (7035, 14302), (7089, 14354), (7145, 14362), (7183, 14320), (7180, 14395), (7247, 14389), (6928, 14257), (6930, 14251), (7199, 14399)]
         : compromised: 0.4958, honest: 0.5021
Round 002: test acc mean=0.5041 ± 0.0062 | min=0.4927 max=0.5129
         : test loss mean=17.7648 ± 9.8614
         : individual accs = ['0.509767', '0.510362', '0.507991', '0.501653', '0.511378', '0.501844', '0.495051', '0.502023', '0.506506', '0.506297', '0.493377', '0.512865', '0.492685', '0.511001', '0.504050', '0.508718', '0.504344', '0.496177', '0.508105', '0.496840']
         : correct/total = [(7255, 14232), (7265, 14235), (7247, 14266), (7132, 14217), (7281, 14238), (7213, 14373), (7102, 14346), (7196, 14334), (7240, 14294), (7277, 14373), (7077, 14344), (7335, 14302), (7072, 14354), (7339, 14362), (7218, 14320), (7323, 14395), (7257, 14389), (7074, 14257), (7241, 14251), (7154, 14399)]
         : compromised: 0.5038, honest: 0.5045
Round 003: test acc mean=0.5060 ± 0.0052 | min=0.4970 max=0.5156
         : test loss mean=16.1111 ± 16.2683
         : individual accs = ['0.508572', '0.513312', '0.514089', '0.507632', '0.505057', '0.505462', '0.500627', '0.505232', '0.511403', '0.507271', '0.500767', '0.515592', '0.499582', '0.508564', '0.503352', '0.501007', '0.499548', '0.497019', '0.510982', '0.505799']
         : correct/total = [(7238, 14232), (7307, 14235), (7334, 14266), (7217, 14217), (7191, 14238), (7265, 14373), (7182, 14346), (7242, 14334), (7310, 14294), (7291, 14373), (7183, 14344), (7374, 14302), (7171, 14354), (7304, 14362), (7208, 14320), (7212, 14395), (7188, 14389), (7086, 14257), (7282, 14251), (7283, 14399)]
         : compromised: 0.5067, honest: 0.5044
Round 004: test acc mean=0.5007 ± 0.0059 | min=0.4909 max=0.5124
         : test loss mean=10.2101 ± 7.3303
         : individual accs = ['0.512437', '0.506568', '0.511215', '0.505592', '0.498736', '0.495304', '0.505367', '0.499093', '0.500979', '0.502887', '0.501673', '0.495945', '0.494566', '0.508564', '0.495112', '0.497534', '0.492807', '0.497159', '0.501368', '0.490867']
         : correct/total = [(7293, 14232), (7211, 14235), (7293, 14266), (7188, 14217), (7101, 14238), (7119, 14373), (7250, 14346), (7154, 14334), (7161, 14294), (7228, 14373), (7196, 14344), (7093, 14302), (7099, 14354), (7304, 14362), (7090, 14320), (7162, 14395), (7091, 14389), (7088, 14257), (7145, 14251), (7068, 14399)]
         : compromised: 0.5004, honest: 0.5013
Round 005: test acc mean=0.5042 ± 0.0054 | min=0.4943 max=0.5150
         : test loss mean=4.0121 ± 1.4030
         : individual accs = ['0.506113', '0.510854', '0.513318', '0.507561', '0.501615', '0.494330', '0.507877', '0.495396', '0.514971', '0.506644', '0.502091', '0.495945', '0.508639', '0.500627', '0.505447', '0.502952', '0.503718', '0.503402', '0.503193', '0.500243']
         : correct/total = [(7203, 14232), (7272, 14235), (7323, 14266), (7216, 14217), (7142, 14238), (7105, 14373), (7286, 14346), (7101, 14334), (7361, 14294), (7282, 14373), (7202, 14344), (7093, 14302), (7301, 14354), (7190, 14362), (7238, 14320), (7240, 14395), (7248, 14389), (7177, 14257), (7171, 14251), (7203, 14399)]
         : compromised: 0.5050, honest: 0.5026
Round 006: test acc mean=0.4987 ± 0.0071 | min=0.4853 max=0.5105
         : test loss mean=5.5007 ± 2.7450
         : individual accs = ['0.488547', '0.498841', '0.485350', '0.500317', '0.504355', '0.499617', '0.493099', '0.510534', '0.485658', '0.500522', '0.497002', '0.490840', '0.492755', '0.508564', '0.505028', '0.500660', '0.500313', '0.501508', '0.501930', '0.508160']
         : correct/total = [(6953, 14232), (7101, 14235), (6924, 14266), (7113, 14217), (7181, 14238), (7181, 14373), (7074, 14346), (7318, 14334), (6942, 14294), (7194, 14373), (7129, 14344), (7020, 14302), (7073, 14354), (7304, 14362), (7232, 14320), (7207, 14395), (7199, 14389), (7150, 14257), (7153, 14251), (7317, 14399)]
         : compromised: 0.4980, honest: 0.5002
Round 007: test acc mean=0.4983 ± 0.0063 | min=0.4857 max=0.5084
         : test loss mean=3.1967 ± 1.4136
         : individual accs = ['0.508361', '0.488233', '0.502594', '0.505522', '0.492274', '0.504418', '0.497281', '0.496651', '0.493284', '0.493077', '0.489473', '0.503007', '0.504946', '0.497424', '0.497067', '0.496422', '0.505803', '0.503332', '0.500456', '0.485659']
         : correct/total = [(7235, 14232), (6950, 14235), (7170, 14266), (7187, 14217), (7009, 14238), (7250, 14373), (7134, 14346), (7119, 14334), (7051, 14294), (7087, 14373), (7021, 14344), (7194, 14302), (7248, 14354), (7144, 14362), (7118, 14320), (7146, 14395), (7278, 14389), (7176, 14257), (7132, 14251), (6993, 14399)]
         : compromised: 0.4985, honest: 0.4976
Round 008: test acc mean=0.5024 ± 0.0073 | min=0.4878 max=0.5126
         : test loss mean=4.0901 ± 2.6161
         : individual accs = ['0.503583', '0.512610', '0.504767', '0.491032', '0.502669', '0.487790', '0.509759', '0.508721', '0.500630', '0.508036', '0.505438', '0.509090', '0.506061', '0.508564', '0.490433', '0.490587', '0.500382', '0.501157', '0.496807', '0.508994']
         : correct/total = [(7167, 14232), (7297, 14235), (7201, 14266), (6981, 14217), (7157, 14238), (7011, 14373), (7313, 14346), (7292, 14334), (7156, 14294), (7302, 14373), (7250, 14344), (7281, 14302), (7264, 14354), (7304, 14362), (7023, 14320), (7062, 14395), (7200, 14389), (7145, 14257), (7080, 14251), (7329, 14399)]
         : compromised: 0.5013, honest: 0.5048
Round 009: test acc mean=0.4967 ± 0.0056 | min=0.4825 max=0.5037
         : test loss mean=3.8757 ± 3.2743
         : individual accs = ['0.502881', '0.490200', '0.496355', '0.493564', '0.502107', '0.494608', '0.503694', '0.502023', '0.497272', '0.496626', '0.499512', '0.497203', '0.501951', '0.501601', '0.495950', '0.482529', '0.491348', '0.486708', '0.502000', '0.496701']
         : correct/total = [(7157, 14232), (6978, 14235), (7081, 14266), (7017, 14217), (7149, 14238), (7109, 14373), (7226, 14346), (7196, 14334), (7108, 14294), (7138, 14373), (7165, 14344), (7111, 14302), (7205, 14354), (7204, 14362), (7102, 14320), (6946, 14395), (7070, 14389), (6939, 14257), (7154, 14251), (7152, 14399)]
         : compromised: 0.4957, honest: 0.4991
Round 010: test acc mean=0.5083 ± 0.0066 | min=0.4952 max=0.5253
         : test loss mean=4.5530 ± 3.3567
         : individual accs = ['0.511313', '0.516192', '0.513739', '0.508405', '0.507023', '0.504488', '0.502440', '0.506279', '0.511473', '0.506923', '0.498327', '0.511677', '0.495193', '0.525275', '0.511592', '0.506565', '0.501077', '0.511749', '0.513438', '0.501979']
         : correct/total = [(7277, 14232), (7348, 14235), (7329, 14266), (7228, 14217), (7219, 14238), (7251, 14373), (7208, 14346), (7257, 14334), (7311, 14294), (7286, 14373), (7148, 14344), (7318, 14302), (7108, 14354), (7544, 14362), (7326, 14320), (7292, 14395), (7210, 14389), (7296, 14257), (7317, 14251), (7228, 14399)]
         : compromised: 0.5096, honest: 0.5052

=== FINAL RESULTS ===
Dataset: sent140, Nodes: 20, Graph: erdos, Aggregation: krum
Attack: backdoor, 70.0% compromised
Final accuracy - Compromised: 0.5096, Honest: 0.5052
Overall test accuracy: mean=0.5083 ± 0.0066

=== BACKDOOR ATTACK SUCCESS RATE (ASR) ===
Target label: 1
Trigger size: 3x3
Overall ASR: 0.1540 ± 0.1627
Honest nodes ASR: 0.1852 ± 0.1730
Compromised nodes ASR: 0.1406 ± 0.1563
Note: Higher ASR indicates more successful backdoor attack
