Device: cuda
Seed: 987654321
Loading 1 LEAF Sent140 train files...
LEAF Sent140 train: 254555 users, 908652 samples
Building vocabulary (max_size=10000)...
Vocabulary size: 10000
Loading 1 LEAF Sent140 test files...
LEAF Sent140 test: 254555 users, 286281 samples
Found 254555 train users, 254555 test users, 254555 common users
User sample counts range: 494 (max) to 1 (min)
Distributed ALL 254555 users across 20 clients
Users per client: 12727 (with 15 clients getting +1 user)
Train partition sizes: [44353, 44290, 44657, 44907, 44696, 45843, 45801, 45619, 45069, 45639, 45821, 45311, 45779, 46056, 45625, 45984, 46428, 44737, 45540, 46497]
Test partition sizes: [14232, 14235, 14266, 14217, 14238, 14373, 14346, 14334, 14294, 14373, 14344, 14302, 14354, 14362, 14320, 14395, 14389, 14257, 14251, 14399]
  Client 0: 44353 train samples, 2 unique classes
  Client 1: 44290 train samples, 2 unique classes
  Client 2: 44657 train samples, 2 unique classes
  Client 3: 44907 train samples, 2 unique classes
  Client 4: 44696 train samples, 2 unique classes
  Client 5: 45843 train samples, 2 unique classes
  Client 6: 45801 train samples, 2 unique classes
  Client 7: 45619 train samples, 2 unique classes
  Client 8: 45069 train samples, 2 unique classes
  Client 9: 45639 train samples, 2 unique classes
  Client 10: 45821 train samples, 2 unique classes
  Client 11: 45311 train samples, 2 unique classes
  Client 12: 45779 train samples, 2 unique classes
  Client 13: 46056 train samples, 2 unique classes
  Client 14: 45625 train samples, 2 unique classes
  Client 15: 45984 train samples, 2 unique classes
  Client 16: 46428 train samples, 2 unique classes
  Client 17: 44737 train samples, 2 unique classes
  Client 18: 45540 train samples, 2 unique classes
  Client 19: 46497 train samples, 2 unique classes
Will sample 4500 samples per client per epoch
Graph: erdos, nodes: 20, edges: 48
Degree statistics: avg=4.80, min=2, max=7
Attack: Compromised 12/20 nodes: [1, 2, 3, 5, 8, 11, 12, 13, 14, 15, 17, 18]
Attack type: backdoor, lambda: 1.0
Backdoor target label: 1, trigger size: 3
Model variant: baseline
Model parameters: 1,174,986
Initial test acc across nodes: mean=0.4965 ± 0.0152
Backdoor attack: Created poisoned datasets for 12 compromised nodes
Round 001: test acc mean=0.5008 ± 0.0052 | min=0.4918 max=0.5129
         : test loss mean=9.3733 ± 5.3074
         : individual accs = ['0.508994', '0.502072', '0.502383', '0.512907', '0.506181', '0.502122', '0.494214', '0.504116', '0.495802', '0.496347', '0.493168', '0.491819', '0.499721', '0.502367', '0.497486', '0.497395', '0.499062', '0.501298', '0.506561', '0.501979']
         : correct/total = [(7244, 14232), (7147, 14235), (7167, 14266), (7292, 14217), (7207, 14238), (7217, 14373), (7090, 14346), (7226, 14334), (7087, 14294), (7134, 14373), (7074, 14344), (7034, 14302), (7173, 14354), (7215, 14362), (7124, 14320), (7160, 14395), (7181, 14389), (7147, 14257), (7219, 14251), (7228, 14399)]
         : compromised: 0.5010, honest: 0.5005
Round 002: test acc mean=0.5063 ± 0.0048 | min=0.4994 max=0.5144
         : test loss mean=30.4711 ± 15.5115
         : individual accs = ['0.511102', '0.514436', '0.514300', '0.505873', '0.506883', '0.505740', '0.501743', '0.505511', '0.512873', '0.507479', '0.500976', '0.507132', '0.499373', '0.508495', '0.508310', '0.501077', '0.500521', '0.499614', '0.511824', '0.502604']
         : correct/total = [(7274, 14232), (7323, 14235), (7337, 14266), (7192, 14217), (7217, 14238), (7269, 14373), (7198, 14346), (7246, 14334), (7331, 14294), (7294, 14373), (7186, 14344), (7253, 14302), (7168, 14354), (7303, 14362), (7279, 14320), (7213, 14395), (7202, 14389), (7123, 14257), (7294, 14251), (7237, 14399)]
         : compromised: 0.5074, honest: 0.5046
Round 003: test acc mean=0.5060 ± 0.0047 | min=0.4969 max=0.5139
         : test loss mean=35.7125 ± 73.9797
         : individual accs = ['0.510891', '0.513734', '0.513949', '0.507772', '0.505900', '0.506157', '0.502440', '0.504814', '0.511543', '0.506992', '0.500976', '0.507971', '0.500488', '0.508564', '0.504190', '0.501633', '0.500243', '0.496949', '0.511262', '0.503646']
         : correct/total = [(7271, 14232), (7313, 14235), (7332, 14266), (7219, 14217), (7203, 14238), (7275, 14373), (7208, 14346), (7236, 14334), (7312, 14294), (7287, 14373), (7186, 14344), (7265, 14302), (7184, 14354), (7304, 14362), (7220, 14320), (7221, 14395), (7198, 14389), (7085, 14257), (7286, 14251), (7252, 14399)]
         : compromised: 0.5070, honest: 0.5045
Round 004: test acc mean=0.4944 ± 0.0061 | min=0.4829 max=0.5086
         : test loss mean=21.1727 ± 14.7858
         : individual accs = ['0.482926', '0.487741', '0.486051', '0.491665', '0.494100', '0.493843', '0.497560', '0.495326', '0.488457', '0.493286', '0.499512', '0.492029', '0.490177', '0.508564', '0.496439', '0.498506', '0.499965', '0.503472', '0.488738', '0.499410']
         : correct/total = [(6873, 14232), (6943, 14235), (6934, 14266), (6990, 14217), (7035, 14238), (7098, 14373), (7138, 14346), (7100, 14334), (6982, 14294), (7090, 14373), (7165, 14344), (7037, 14302), (7036, 14354), (7304, 14362), (7109, 14320), (7176, 14395), (7194, 14389), (7178, 14257), (6965, 14251), (7191, 14399)]
         : compromised: 0.4938, honest: 0.4953
Round 005: test acc mean=0.4939 ± 0.0047 | min=0.4852 max=0.5030
         : test loss mean=16.6509 ± 8.6850
         : individual accs = ['0.489109', '0.486266', '0.485210', '0.492228', '0.494100', '0.493843', '0.497560', '0.495186', '0.488457', '0.493008', '0.499024', '0.491330', '0.499582', '0.491436', '0.496020', '0.498367', '0.499687', '0.502981', '0.489299', '0.496284']
         : correct/total = [(6961, 14232), (6922, 14235), (6922, 14266), (6998, 14217), (7035, 14238), (7098, 14373), (7138, 14346), (7098, 14334), (6982, 14294), (7086, 14373), (7158, 14344), (7027, 14302), (7171, 14354), (7058, 14362), (7103, 14320), (7174, 14395), (7190, 14389), (7171, 14257), (6973, 14251), (7146, 14399)]
         : compromised: 0.4929, honest: 0.4955
Round 006: test acc mean=0.5044 ± 0.0059 | min=0.4903 max=0.5139
         : test loss mean=12.1560 ± 8.9239
         : individual accs = ['0.508572', '0.512048', '0.513949', '0.506717', '0.506181', '0.506297', '0.502440', '0.501465', '0.511403', '0.506992', '0.502440', '0.507971', '0.497422', '0.490252', '0.504260', '0.501563', '0.500243', '0.493863', '0.510912', '0.502604']
         : correct/total = [(7238, 14232), (7289, 14235), (7332, 14266), (7204, 14217), (7207, 14238), (7277, 14373), (7208, 14346), (7188, 14334), (7310, 14294), (7287, 14373), (7207, 14344), (7265, 14302), (7140, 14354), (7041, 14362), (7221, 14320), (7220, 14395), (7198, 14389), (7041, 14257), (7281, 14251), (7237, 14399)]
         : compromised: 0.5047, honest: 0.5039
Round 007: test acc mean=0.5056 ± 0.0050 | min=0.4972 max=0.5143
         : test loss mean=9.9679 ± 5.9892
         : individual accs = ['0.510891', '0.513734', '0.514300', '0.507772', '0.504144', '0.508592', '0.502719', '0.502093', '0.510424', '0.507062', '0.498118', '0.507481', '0.500488', '0.508564', '0.504330', '0.501285', '0.499826', '0.497159', '0.511473', '0.502327']
         : correct/total = [(7271, 14232), (7313, 14235), (7337, 14266), (7219, 14217), (7178, 14238), (7310, 14373), (7212, 14346), (7197, 14334), (7296, 14294), (7288, 14373), (7145, 14344), (7258, 14302), (7184, 14354), (7304, 14362), (7222, 14320), (7216, 14395), (7192, 14389), (7088, 14257), (7289, 14251), (7233, 14399)]
         : compromised: 0.5071, honest: 0.5034
Round 008: test acc mean=0.4945 ± 0.0055 | min=0.4827 max=0.5086
         : test loss mean=10.6243 ± 8.0418
         : individual accs = ['0.482715', '0.492167', '0.486191', '0.492157', '0.494381', '0.493634', '0.497560', '0.494140', '0.488457', '0.493216', '0.499442', '0.492029', '0.496377', '0.508634', '0.495810', '0.498298', '0.499757', '0.500526', '0.488808', '0.495729']
         : correct/total = [(6870, 14232), (7006, 14235), (6936, 14266), (6997, 14217), (7039, 14238), (7095, 14373), (7138, 14346), (7083, 14334), (6982, 14294), (7089, 14373), (7164, 14344), (7037, 14302), (7125, 14354), (7305, 14362), (7100, 14320), (7173, 14395), (7191, 14389), (7136, 14257), (6966, 14251), (7138, 14399)]
         : compromised: 0.4944, honest: 0.4946
Round 009: test acc mean=0.4937 ± 0.0051 | min=0.4851 max=0.5031
         : test loss mean=8.3006 ± 1.9640
         : individual accs = ['0.489109', '0.486266', '0.485210', '0.492439', '0.494381', '0.491129', '0.496794', '0.495117', '0.488737', '0.493356', '0.499024', '0.492868', '0.499512', '0.489486', '0.497067', '0.498437', '0.500382', '0.503051', '0.485089', '0.496354']
         : correct/total = [(6961, 14232), (6922, 14235), (6922, 14266), (7001, 14217), (7039, 14238), (7059, 14373), (7127, 14346), (7097, 14334), (6986, 14294), (7091, 14373), (7158, 14344), (7049, 14302), (7170, 14354), (7030, 14362), (7118, 14320), (7175, 14395), (7200, 14389), (7172, 14257), (6913, 14251), (7147, 14399)]
         : compromised: 0.4924, honest: 0.4956
Round 010: test acc mean=0.5055 ± 0.0067 | min=0.4893 max=0.5209
         : test loss mean=14.5680 ± 11.8851
         : individual accs = ['0.520939', '0.513523', '0.513949', '0.507772', '0.505900', '0.506157', '0.502440', '0.504814', '0.511543', '0.507062', '0.500976', '0.507971', '0.500139', '0.489277', '0.504190', '0.501633', '0.500243', '0.496809', '0.511262', '0.503646']
         : correct/total = [(7414, 14232), (7310, 14235), (7332, 14266), (7219, 14217), (7203, 14238), (7275, 14373), (7208, 14346), (7236, 14334), (7312, 14294), (7288, 14373), (7186, 14344), (7265, 14302), (7179, 14354), (7027, 14362), (7220, 14320), (7221, 14395), (7198, 14389), (7083, 14257), (7286, 14251), (7252, 14399)]
         : compromised: 0.5054, honest: 0.5058

=== FINAL RESULTS ===
Dataset: sent140, Nodes: 20, Graph: erdos, Aggregation: krum
Attack: backdoor, 60.0% compromised
Final accuracy - Compromised: 0.5054, Honest: 0.5058
Overall test accuracy: mean=0.5055 ± 0.0067

=== BACKDOOR ATTACK SUCCESS RATE (ASR) ===
Target label: 1
Trigger size: 3x3
Overall ASR: 0.0242 ± 0.0636
Honest nodes ASR: 0.0271 ± 0.0716
Compromised nodes ASR: 0.0223 ± 0.0576
Note: Higher ASR indicates more successful backdoor attack
