Device: cuda
Seed: 987654321
Loading 1 LEAF Sent140 train files...
LEAF Sent140 train: 254555 users, 908652 samples
Building vocabulary (max_size=10000)...
Vocabulary size: 10000
Loading 1 LEAF Sent140 test files...
LEAF Sent140 test: 254555 users, 286281 samples
Found 254555 train users, 254555 test users, 254555 common users
User sample counts range: 494 (max) to 1 (min)
Distributed ALL 254555 users across 20 clients
Users per client: 12727 (with 15 clients getting +1 user)
Train partition sizes: [44353, 44290, 44657, 44907, 44696, 45843, 45801, 45619, 45069, 45639, 45821, 45311, 45779, 46056, 45625, 45984, 46428, 44737, 45540, 46497]
Test partition sizes: [14232, 14235, 14266, 14217, 14238, 14373, 14346, 14334, 14294, 14373, 14344, 14302, 14354, 14362, 14320, 14395, 14389, 14257, 14251, 14399]
  Client 0: 44353 train samples, 2 unique classes
  Client 1: 44290 train samples, 2 unique classes
  Client 2: 44657 train samples, 2 unique classes
  Client 3: 44907 train samples, 2 unique classes
  Client 4: 44696 train samples, 2 unique classes
  Client 5: 45843 train samples, 2 unique classes
  Client 6: 45801 train samples, 2 unique classes
  Client 7: 45619 train samples, 2 unique classes
  Client 8: 45069 train samples, 2 unique classes
  Client 9: 45639 train samples, 2 unique classes
  Client 10: 45821 train samples, 2 unique classes
  Client 11: 45311 train samples, 2 unique classes
  Client 12: 45779 train samples, 2 unique classes
  Client 13: 46056 train samples, 2 unique classes
  Client 14: 45625 train samples, 2 unique classes
  Client 15: 45984 train samples, 2 unique classes
  Client 16: 46428 train samples, 2 unique classes
  Client 17: 44737 train samples, 2 unique classes
  Client 18: 45540 train samples, 2 unique classes
  Client 19: 46497 train samples, 2 unique classes
Will sample 4500 samples per client per epoch
Graph: fully, nodes: 20, edges: 190
Degree statistics: avg=19.00, min=19, max=19
Attack: Compromised 4/20 nodes: [5, 12, 13, 17]
Attack type: directed_deviation, lambda: 1.0
Model variant: baseline
Model parameters: 1,174,986
Initial test acc across nodes: mean=0.4965 ± 0.0152
Round 001: test acc mean=0.4994 ± 0.0086 | min=0.4748 max=0.5120
         : test loss mean=1.0932 ± 0.2329
         : individual accs = ['0.494730', '0.486407', '0.474835', '0.492790', '0.491642', '0.506018', '0.496096', '0.510604', '0.508605', '0.502748', '0.503277', '0.495455', '0.500070', '0.511976', '0.499791', '0.498020', '0.499270', '0.500736', '0.508456', '0.505799']
         : correct/total = [(7041, 14232), (6924, 14235), (6774, 14266), (7006, 14217), (7000, 14238), (7273, 14373), (7117, 14346), (7319, 14334), (7270, 14294), (7226, 14373), (7219, 14344), (7086, 14302), (7178, 14354), (7353, 14362), (7157, 14320), (7169, 14395), (7184, 14389), (7139, 14257), (7246, 14251), (7283, 14399)]
         : compromised: 0.5047, honest: 0.4980
Round 002: test acc mean=0.4906 ± 0.0054 | min=0.4806 max=0.5045
         : test loss mean=1.7146 ± 0.0186
         : individual accs = ['0.491920', '0.480576', '0.483107', '0.485968', '0.489956', '0.488485', '0.496096', '0.489954', '0.486988', '0.489181', '0.494353', '0.489512', '0.494636', '0.504526', '0.489036', '0.494477', '0.496560', '0.494704', '0.483335', '0.488228']
         : correct/total = [(7001, 14232), (6841, 14235), (6892, 14266), (6909, 14217), (6976, 14238), (7021, 14373), (7117, 14346), (7023, 14334), (6961, 14294), (7031, 14373), (7091, 14344), (7001, 14302), (7100, 14354), (7246, 14362), (7003, 14320), (7118, 14395), (7145, 14389), (7053, 14257), (6888, 14251), (7030, 14399)]
         : compromised: 0.4956, honest: 0.4893
Round 003: test acc mean=0.5051 ± 0.0056 | min=0.4914 max=0.5139
         : test loss mean=0.6967 ± 0.0011
         : individual accs = ['0.510891', '0.513734', '0.513949', '0.507772', '0.505900', '0.506157', '0.502440', '0.504814', '0.511543', '0.506992', '0.500976', '0.507971', '0.500488', '0.491436', '0.504190', '0.501633', '0.500243', '0.496949', '0.511262', '0.503646']
         : correct/total = [(7271, 14232), (7313, 14235), (7332, 14266), (7219, 14217), (7203, 14238), (7275, 14373), (7208, 14346), (7236, 14334), (7312, 14294), (7287, 14373), (7186, 14344), (7265, 14302), (7184, 14354), (7058, 14362), (7220, 14320), (7221, 14395), (7198, 14389), (7085, 14257), (7286, 14251), (7252, 14399)]
         : compromised: 0.4988, honest: 0.5067
Round 004: test acc mean=0.5308 ± 0.0048 | min=0.5254 max=0.5398
         : test loss mean=0.7091 ± 0.0026
         : individual accs = ['0.528949', '0.526027', '0.526497', '0.535134', '0.525425', '0.526056', '0.535271', '0.526510', '0.529523', '0.529743', '0.533951', '0.527479', '0.530166', '0.539758', '0.530098', '0.539771', '0.535478', '0.537701', '0.525507', '0.526148']
         : correct/total = [(7528, 14232), (7488, 14235), (7511, 14266), (7608, 14217), (7481, 14238), (7561, 14373), (7679, 14346), (7547, 14334), (7569, 14294), (7614, 14373), (7659, 14344), (7544, 14302), (7610, 14354), (7752, 14362), (7591, 14320), (7770, 14395), (7705, 14389), (7666, 14257), (7489, 14251), (7576, 14399)]
         : compromised: 0.5334, honest: 0.5301
Round 005: test acc mean=0.4968 ± 0.0052 | min=0.4886 max=0.5099
         : test loss mean=0.6928 ± 0.0004
         : individual accs = ['0.489812', '0.489287', '0.488644', '0.492861', '0.497682', '0.496347', '0.499930', '0.496163', '0.491885', '0.495721', '0.501952', '0.493148', '0.501115', '0.509887', '0.497696', '0.501077', '0.500730', '0.503121', '0.492176', '0.496840']
         : correct/total = [(6971, 14232), (6965, 14235), (6971, 14266), (7007, 14217), (7086, 14238), (7134, 14373), (7172, 14346), (7112, 14334), (7031, 14294), (7125, 14373), (7200, 14344), (7053, 14302), (7193, 14354), (7323, 14362), (7127, 14320), (7213, 14395), (7205, 14389), (7173, 14257), (7014, 14251), (7154, 14399)]
         : compromised: 0.5026, honest: 0.4954
Round 006: test acc mean=0.5512 ± 0.0028 | min=0.5462 max=0.5563
         : test loss mean=0.6867 ± 0.0013
         : individual accs = ['0.552768', '0.551387', '0.546825', '0.548358', '0.553449', '0.550685', '0.554510', '0.550858', '0.553309', '0.548389', '0.548592', '0.552230', '0.551972', '0.556329', '0.546229', '0.554706', '0.551046', '0.554605', '0.547751', '0.550108']
         : correct/total = [(7867, 14232), (7849, 14235), (7801, 14266), (7796, 14217), (7880, 14238), (7915, 14373), (7955, 14346), (7896, 14334), (7909, 14294), (7882, 14373), (7869, 14344), (7898, 14302), (7923, 14354), (7990, 14362), (7822, 14320), (7985, 14395), (7929, 14389), (7907, 14257), (7806, 14251), (7921, 14399)]
         : compromised: 0.5534, honest: 0.5507
Round 007: test acc mean=0.5077 ± 0.0060 | min=0.4980 max=0.5205
         : test loss mean=0.6910 ± 0.0005
         : individual accs = ['0.498033', '0.498560', '0.500841', '0.503833', '0.512291', '0.504835', '0.512477', '0.513883', '0.500770', '0.505322', '0.511433', '0.504335', '0.513376', '0.520471', '0.504050', '0.511983', '0.511224', '0.513151', '0.502421', '0.509897']
         : correct/total = [(7088, 14232), (7097, 14235), (7145, 14266), (7163, 14217), (7294, 14238), (7256, 14373), (7352, 14346), (7366, 14334), (7158, 14294), (7263, 14373), (7336, 14344), (7213, 14302), (7369, 14354), (7475, 14362), (7218, 14320), (7370, 14395), (7356, 14389), (7316, 14257), (7160, 14251), (7342, 14399)]
         : compromised: 0.5130, honest: 0.5063
Round 008: test acc mean=0.5643 ± 0.0037 | min=0.5558 max=0.5702
         : test loss mean=0.6810 ± 0.0011
         : individual accs = ['0.569421', '0.564665', '0.557059', '0.562285', '0.567776', '0.559869', '0.561899', '0.563625', '0.566811', '0.555834', '0.563162', '0.568382', '0.564651', '0.566982', '0.564665', '0.567280', '0.565918', '0.570176', '0.561785', '0.564414']
         : correct/total = [(8104, 14232), (8038, 14235), (7947, 14266), (7994, 14217), (8084, 14238), (8047, 14373), (8061, 14346), (8079, 14334), (8102, 14294), (7989, 14373), (8078, 14344), (8129, 14302), (8105, 14354), (8143, 14362), (8086, 14320), (8166, 14395), (8143, 14389), (8129, 14257), (8006, 14251), (8127, 14399)]
         : compromised: 0.5654, honest: 0.5641
Round 009: test acc mean=0.5464 ± 0.0074 | min=0.5328 max=0.5647
         : test loss mean=0.6869 ± 0.0006
         : individual accs = ['0.546374', '0.536143', '0.532805', '0.536822', '0.554783', '0.551590', '0.544681', '0.552881', '0.545404', '0.540319', '0.552008', '0.541183', '0.548210', '0.564685', '0.538827', '0.554498', '0.546320', '0.545136', '0.549014', '0.546288']
         : correct/total = [(7776, 14232), (7632, 14235), (7601, 14266), (7632, 14217), (7899, 14238), (7928, 14373), (7814, 14346), (7925, 14334), (7796, 14294), (7766, 14373), (7918, 14344), (7740, 14302), (7869, 14354), (8110, 14362), (7716, 14320), (7982, 14395), (7861, 14389), (7772, 14257), (7824, 14251), (7866, 14399)]
         : compromised: 0.5524, honest: 0.5449
Round 010: test acc mean=0.5695 ± 0.0035 | min=0.5636 max=0.5758
         : test loss mean=0.6785 ± 0.0011
         : individual accs = ['0.570826', '0.567685', '0.563998', '0.571147', '0.575081', '0.566618', '0.572424', '0.568160', '0.570519', '0.563626', '0.568809', '0.565236', '0.573290', '0.567539', '0.569344', '0.575755', '0.573772', '0.573052', '0.566627', '0.567331']
         : correct/total = [(8124, 14232), (8081, 14235), (8046, 14266), (8120, 14217), (8188, 14238), (8144, 14373), (8212, 14346), (8144, 14334), (8155, 14294), (8101, 14373), (8159, 14344), (8084, 14302), (8229, 14354), (8151, 14362), (8153, 14320), (8288, 14395), (8256, 14389), (8170, 14257), (8075, 14251), (8169, 14399)]
         : compromised: 0.5701, honest: 0.5694

=== FINAL RESULTS ===
Dataset: sent140, Nodes: 20, Graph: fully, Aggregation: d-fedavg
Attack: directed_deviation, 20.0% compromised
Final accuracy - Compromised: 0.5701, Honest: 0.5694
Overall test accuracy: mean=0.5695 ± 0.0035
