Device: cuda
Seed: 987654321
Loading 1 LEAF Sent140 train files...
LEAF Sent140 train: 254555 users, 908652 samples
Building vocabulary (max_size=10000)...
Vocabulary size: 10000
Loading 1 LEAF Sent140 test files...
LEAF Sent140 test: 254555 users, 286281 samples
Found 254555 train users, 254555 test users, 254555 common users
User sample counts range: 494 (max) to 1 (min)
Distributed ALL 254555 users across 20 clients
Users per client: 12727 (with 15 clients getting +1 user)
Train partition sizes: [44353, 44290, 44657, 44907, 44696, 45843, 45801, 45619, 45069, 45639, 45821, 45311, 45779, 46056, 45625, 45984, 46428, 44737, 45540, 46497]
Test partition sizes: [14232, 14235, 14266, 14217, 14238, 14373, 14346, 14334, 14294, 14373, 14344, 14302, 14354, 14362, 14320, 14395, 14389, 14257, 14251, 14399]
  Client 0: 44353 train samples, 2 unique classes
  Client 1: 44290 train samples, 2 unique classes
  Client 2: 44657 train samples, 2 unique classes
  Client 3: 44907 train samples, 2 unique classes
  Client 4: 44696 train samples, 2 unique classes
  Client 5: 45843 train samples, 2 unique classes
  Client 6: 45801 train samples, 2 unique classes
  Client 7: 45619 train samples, 2 unique classes
  Client 8: 45069 train samples, 2 unique classes
  Client 9: 45639 train samples, 2 unique classes
  Client 10: 45821 train samples, 2 unique classes
  Client 11: 45311 train samples, 2 unique classes
  Client 12: 45779 train samples, 2 unique classes
  Client 13: 46056 train samples, 2 unique classes
  Client 14: 45625 train samples, 2 unique classes
  Client 15: 45984 train samples, 2 unique classes
  Client 16: 46428 train samples, 2 unique classes
  Client 17: 44737 train samples, 2 unique classes
  Client 18: 45540 train samples, 2 unique classes
  Client 19: 46497 train samples, 2 unique classes
Will sample 4500 samples per client per epoch
Graph: fully, nodes: 20, edges: 190
Degree statistics: avg=19.00, min=19, max=19
Attack: Compromised 2/20 nodes: [5, 13]
Attack type: directed_deviation, lambda: 1.0
Model variant: baseline
Model parameters: 1,174,986
Initial test acc across nodes: mean=0.4953 ± 0.0174
Round 001: test acc mean=0.6451 ± 0.0026 | min=0.6413 max=0.6496
         : test loss mean=0.6287 ± 0.0021
         : individual accs = ['0.646782', '0.647489', '0.641595', '0.643947', '0.645596', '0.649621', '0.648055', '0.648528', '0.643907', '0.641272', '0.643196', '0.643197', '0.641981', '0.642250', '0.646578', '0.644529', '0.647509', '0.647471', '0.641429', '0.647962']
         : correct/total = [(9205, 14232), (9217, 14235), (9153, 14266), (9155, 14217), (9192, 14238), (9337, 14373), (9297, 14346), (9296, 14334), (9204, 14294), (9217, 14373), (9226, 14344), (9199, 14302), (9215, 14354), (9224, 14362), (9259, 14320), (9278, 14395), (9317, 14389), (9231, 14257), (9141, 14251), (9330, 14399)]
         : compromised: 0.6459, honest: 0.6451
Round 002: test acc mean=0.6477 ± 0.0032 | min=0.6396 max=0.6532
         : test loss mean=0.6275 ± 0.0035
         : individual accs = ['0.647625', '0.648613', '0.639563', '0.646902', '0.653182', '0.650247', '0.648055', '0.650481', '0.646775', '0.648855', '0.644520', '0.650259', '0.646579', '0.652486', '0.647277', '0.644390', '0.650636', '0.646209', '0.642060', '0.648309']
         : correct/total = [(9217, 14232), (9233, 14235), (9124, 14266), (9197, 14217), (9300, 14238), (9346, 14373), (9297, 14346), (9324, 14334), (9245, 14294), (9326, 14373), (9245, 14344), (9300, 14302), (9281, 14354), (9371, 14362), (9269, 14320), (9276, 14395), (9362, 14389), (9213, 14257), (9150, 14251), (9335, 14399)]
         : compromised: 0.6514, honest: 0.6472
Round 003: test acc mean=0.6477 ± 0.0040 | min=0.6397 max=0.6568
         : test loss mean=0.6320 ± 0.0041
         : individual accs = ['0.647766', '0.646716', '0.640123', '0.639657', '0.649881', '0.652334', '0.649171', '0.649784', '0.646425', '0.649064', '0.645148', '0.648091', '0.650759', '0.656803', '0.648743', '0.645363', '0.650705', '0.646069', '0.640937', '0.649906']
         : correct/total = [(9219, 14232), (9206, 14235), (9132, 14266), (9094, 14217), (9253, 14238), (9376, 14373), (9313, 14346), (9314, 14334), (9240, 14294), (9329, 14373), (9254, 14344), (9269, 14302), (9341, 14354), (9433, 14362), (9290, 14320), (9290, 14395), (9363, 14389), (9211, 14257), (9134, 14251), (9358, 14399)]
         : compromised: 0.6546, honest: 0.6469
Round 004: test acc mean=0.6843 ± 0.0030 | min=0.6790 max=0.6910
         : test loss mean=0.5877 ± 0.0026
         : individual accs = ['0.683881', '0.691043', '0.679027', '0.685236', '0.684787', '0.684339', '0.683326', '0.688503', '0.680705', '0.681138', '0.682236', '0.685988', '0.683642', '0.688762', '0.683659', '0.681903', '0.685802', '0.684716', '0.680093', '0.687478']
         : correct/total = [(9733, 14232), (9837, 14235), (9687, 14266), (9742, 14217), (9750, 14238), (9836, 14373), (9803, 14346), (9869, 14334), (9730, 14294), (9790, 14373), (9786, 14344), (9811, 14302), (9813, 14354), (9892, 14362), (9790, 14320), (9816, 14395), (9868, 14389), (9762, 14257), (9692, 14251), (9899, 14399)]
         : compromised: 0.6866, honest: 0.6841
Round 005: test acc mean=0.6875 ± 0.0036 | min=0.6827 max=0.6952
         : test loss mean=0.5841 ± 0.0031
         : individual accs = ['0.682757', '0.695188', '0.684074', '0.687909', '0.688439', '0.691366', '0.683396', '0.690805', '0.684833', '0.682738', '0.685722', '0.690812', '0.690121', '0.686464', '0.686662', '0.683223', '0.686775', '0.689907', '0.685636', '0.693729']
         : correct/total = [(9717, 14232), (9896, 14235), (9759, 14266), (9780, 14217), (9802, 14238), (9937, 14373), (9804, 14346), (9902, 14334), (9789, 14294), (9813, 14373), (9836, 14344), (9880, 14302), (9906, 14354), (9859, 14362), (9833, 14320), (9835, 14395), (9882, 14389), (9836, 14257), (9771, 14251), (9989, 14399)]
         : compromised: 0.6889, honest: 0.6874
Round 006: test acc mean=0.6953 ± 0.0024 | min=0.6904 max=0.6998
         : test loss mean=0.5794 ± 0.0025
         : individual accs = ['0.695826', '0.699754', '0.694869', '0.697756', '0.694480', '0.696514', '0.696989', '0.695200', '0.699244', '0.691853', '0.693461', '0.693050', '0.696949', '0.695168', '0.693087', '0.690379', '0.693099', '0.698394', '0.693004', '0.695951']
         : correct/total = [(9903, 14232), (9961, 14235), (9913, 14266), (9920, 14217), (9888, 14238), (10011, 14373), (9999, 14346), (9965, 14334), (9995, 14294), (9944, 14373), (9947, 14344), (9912, 14302), (10004, 14354), (9984, 14362), (9925, 14320), (9938, 14395), (9973, 14389), (9957, 14257), (9876, 14251), (10021, 14399)]
         : compromised: 0.6958, honest: 0.6952
Round 007: test acc mean=0.6911 ± 0.0029 | min=0.6857 max=0.6979
         : test loss mean=0.5816 ± 0.0030
         : individual accs = ['0.691540', '0.697928', '0.692906', '0.695083', '0.690546', '0.687887', '0.689739', '0.692968', '0.692318', '0.685661', '0.692485', '0.691372', '0.689982', '0.688483', '0.687709', '0.686349', '0.693168', '0.692011', '0.690618', '0.692548']
         : correct/total = [(9842, 14232), (9935, 14235), (9885, 14266), (9882, 14217), (9832, 14238), (9887, 14373), (9895, 14346), (9933, 14334), (9896, 14294), (9855, 14373), (9933, 14344), (9888, 14302), (9904, 14354), (9888, 14362), (9848, 14320), (9880, 14395), (9974, 14389), (9866, 14257), (9842, 14251), (9972, 14399)]
         : compromised: 0.6882, honest: 0.6914
Round 008: test acc mean=0.7153 ± 0.0035 | min=0.7101 max=0.7224
         : test loss mean=0.5505 ± 0.0036
         : individual accs = ['0.710090', '0.719283', '0.710781', '0.716396', '0.716252', '0.718083', '0.714345', '0.716548', '0.715895', '0.710081', '0.711378', '0.714166', '0.722377', '0.718354', '0.713128', '0.715040', '0.714087', '0.719436', '0.710547', '0.719564']
         : correct/total = [(10106, 14232), (10239, 14235), (10140, 14266), (10185, 14217), (10198, 14238), (10321, 14373), (10248, 14346), (10271, 14334), (10233, 14294), (10206, 14373), (10204, 14344), (10214, 14302), (10369, 14354), (10317, 14362), (10212, 14320), (10293, 14395), (10275, 14389), (10257, 14257), (10126, 14251), (10361, 14399)]
         : compromised: 0.7182, honest: 0.7150
Round 009: test acc mean=0.6972 ± 0.0046 | min=0.6902 max=0.7060
         : test loss mean=0.5774 ± 0.0047
         : individual accs = ['0.694913', '0.698279', '0.690172', '0.693325', '0.705717', '0.698602', '0.699847', '0.696596', '0.693997', '0.693731', '0.694088', '0.696686', '0.705100', '0.705960', '0.693506', '0.694894', '0.696782', '0.698604', '0.690478', '0.703174']
         : correct/total = [(9890, 14232), (9940, 14235), (9846, 14266), (9857, 14217), (10048, 14238), (10041, 14373), (10040, 14346), (9985, 14334), (9920, 14294), (9971, 14373), (9956, 14344), (9964, 14302), (10121, 14354), (10139, 14362), (9931, 14320), (10003, 14395), (10026, 14389), (9960, 14257), (9840, 14251), (10125, 14399)]
         : compromised: 0.7023, honest: 0.6967
Round 010: test acc mean=0.7157 ± 0.0040 | min=0.7081 max=0.7214
         : test loss mean=0.5533 ± 0.0033
         : individual accs = ['0.710230', '0.719635', '0.708327', '0.714778', '0.720958', '0.721422', '0.716855', '0.717315', '0.716315', '0.711403', '0.715700', '0.715285', '0.719312', '0.721418', '0.712640', '0.713095', '0.716867', '0.715087', '0.708091', '0.719842']
         : correct/total = [(10108, 14232), (10244, 14235), (10105, 14266), (10162, 14217), (10265, 14238), (10369, 14373), (10284, 14346), (10282, 14334), (10239, 14294), (10225, 14373), (10266, 14344), (10230, 14302), (10325, 14354), (10361, 14362), (10205, 14320), (10265, 14395), (10315, 14389), (10195, 14257), (10091, 14251), (10365, 14399)]
         : compromised: 0.7214, honest: 0.7151

=== FINAL RESULTS ===
Dataset: sent140, Nodes: 20, Graph: fully, Aggregation: krum
Attack: directed_deviation, 10.0% compromised
Final accuracy - Compromised: 0.7214, Honest: 0.7151
Overall test accuracy: mean=0.7157 ± 0.0040
