Device: cuda
Seed: 987654321
Looking for images in: /home/student.unimelb.edu.au/mrangwala/Projects/Sketchguard/leaf/data/celeba/data/raw/img_align_celeba
Loading 1 LEAF CelebA train files...
LEAF CelebA train: 9343 users (celebrities), 177457 samples
Looking for images in: /home/student.unimelb.edu.au/mrangwala/Projects/Sketchguard/leaf/data/celeba/data/raw/img_align_celeba
Loading 1 LEAF CelebA test files...
LEAF CelebA test: 9343 users (celebrities), 22831 samples
Found 9343 train users, 9343 test users, 9343 common users
User sample counts range: 31 (max) to 4 (min)
Distributed ALL 9343 users across 20 clients
Users per client: 467 (with 3 clients getting +1 user)
Train partition sizes: [8843, 8998, 8728, 9034, 8866, 8946, 8873, 8776, 8816, 8801, 8913, 8656, 9115, 8921, 8699, 8823, 8912, 8766, 9102, 8869]
Test partition sizes: [1140, 1158, 1127, 1158, 1134, 1145, 1145, 1127, 1136, 1128, 1144, 1125, 1152, 1160, 1124, 1145, 1154, 1131, 1157, 1141]
  Client 0: 8843 train samples, 2 unique classes
  Client 1: 8998 train samples, 2 unique classes
  Client 2: 8728 train samples, 2 unique classes
  Client 3: 9034 train samples, 2 unique classes
  Client 4: 8866 train samples, 2 unique classes
  Client 5: 8946 train samples, 2 unique classes
  Client 6: 8873 train samples, 2 unique classes
  Client 7: 8776 train samples, 2 unique classes
  Client 8: 8816 train samples, 2 unique classes
  Client 9: 8801 train samples, 2 unique classes
  Client 10: 8913 train samples, 2 unique classes
  Client 11: 8656 train samples, 2 unique classes
  Client 12: 9115 train samples, 2 unique classes
  Client 13: 8921 train samples, 2 unique classes
  Client 14: 8699 train samples, 2 unique classes
  Client 15: 8823 train samples, 2 unique classes
  Client 16: 8912 train samples, 2 unique classes
  Client 17: 8766 train samples, 2 unique classes
  Client 18: 9102 train samples, 2 unique classes
  Client 19: 8869 train samples, 2 unique classes
Will sample 4500 samples per client per epoch
Graph: erdos, nodes: 20, edges: 99
Degree statistics: avg=9.90, min=7, max=14
Attack: Compromised 6/20 nodes: [5, 12, 13, 14, 17, 18]
Attack type: directed_deviation, lambda: 1.0
Model variant: baseline
Model parameters: 2,219,692
Initial test acc across nodes: mean=0.4978 ± 0.0208
Round 001: test acc mean=0.7027 ± 0.0634 | min=0.4551 max=0.7607
         : test loss mean=1907.1858 ± 8310.6780
         : individual accs = ['0.672807', '0.661485', '0.678793', '0.721071', '0.694004', '0.760699', '0.733624', '0.723159', '0.455106', '0.678191', '0.727273', '0.713778', '0.757812', '0.741379', '0.721530', '0.751965', '0.711438', '0.687003', '0.738980', '0.723926']
         : correct/total = [(767, 1140), (766, 1158), (765, 1127), (835, 1158), (787, 1134), (871, 1145), (840, 1145), (815, 1127), (517, 1136), (765, 1128), (832, 1144), (803, 1125), (873, 1152), (860, 1160), (811, 1124), (861, 1145), (821, 1154), (777, 1131), (855, 1157), (826, 1141)]
         : compromised: 0.7346, honest: 0.6890
Round 002: test acc mean=0.7237 ± 0.1339 | min=0.5069 max=0.8724
         : test loss mean=nan ± nan
         : individual accs = ['0.754386', '0.768566', '0.787045', '0.848014', '0.791887', '0.514410', '0.849782', '0.840284', '0.562500', '0.792553', '0.872378', '0.846222', '0.522569', '0.506897', '0.517794', '0.805240', '0.790295', '0.791335', '0.522040', '0.790535']
         : correct/total = [(860, 1140), (890, 1158), (887, 1127), (982, 1158), (898, 1134), (589, 1145), (973, 1145), (947, 1127), (639, 1136), (894, 1128), (998, 1144), (952, 1125), (602, 1152), (588, 1160), (582, 1124), (922, 1145), (912, 1154), (895, 1131), (604, 1157), (902, 1141)]
         : compromised: 0.5625, honest: 0.7928
Round 003: test acc mean=0.7545 ± 0.1516 | min=0.5069 max=0.8777
         : test loss mean=nan ± nan
         : individual accs = ['0.817544', '0.862694', '0.840284', '0.857513', '0.839506', '0.514410', '0.877729', '0.861579', '0.562500', '0.867021', '0.862762', '0.848000', '0.522569', '0.506897', '0.517794', '0.843668', '0.855286', '0.838196', '0.522040', '0.872918']
         : correct/total = [(932, 1140), (999, 1158), (947, 1127), (993, 1158), (952, 1134), (589, 1145), (1005, 1145), (971, 1127), (639, 1136), (978, 1128), (987, 1144), (954, 1125), (602, 1152), (588, 1160), (582, 1124), (966, 1145), (987, 1154), (948, 1131), (604, 1157), (996, 1141)]
         : compromised: 0.5703, honest: 0.8335
Round 004: test acc mean=0.7693 ± 0.1609 | min=0.5069 max=0.8934
         : test loss mean=nan ± nan
         : individual accs = ['0.877193', '0.875648', '0.863354', '0.874784', '0.880952', '0.514410', '0.887336', '0.881988', '0.562500', '0.857270', '0.893357', '0.871111', '0.522569', '0.506897', '0.517794', '0.850655', '0.868284', '0.870911', '0.522040', '0.886941']
         : correct/total = [(1000, 1140), (1014, 1158), (973, 1127), (1013, 1158), (999, 1134), (589, 1145), (1016, 1145), (994, 1127), (639, 1136), (967, 1128), (1022, 1144), (980, 1125), (602, 1152), (588, 1160), (582, 1124), (974, 1145), (1002, 1154), (985, 1131), (604, 1157), (1012, 1141)]
         : compromised: 0.5758, honest: 0.8522
Round 005: test acc mean=0.7754 ± 0.1654 | min=0.5069 max=0.9033
         : test loss mean=nan ± nan
         : individual accs = ['0.820175', '0.893782', '0.877551', '0.903282', '0.888889', '0.514410', '0.893450', '0.892635', '0.562500', '0.888298', '0.891608', '0.899556', '0.522569', '0.506897', '0.517794', '0.870742', '0.883882', '0.873563', '0.522040', '0.883436']
         : correct/total = [(935, 1140), (1035, 1158), (989, 1127), (1046, 1158), (1008, 1134), (589, 1145), (1023, 1145), (1006, 1127), (639, 1136), (1002, 1128), (1020, 1144), (1012, 1125), (602, 1152), (588, 1160), (582, 1124), (997, 1145), (1020, 1154), (988, 1131), (604, 1157), (1008, 1141)]
         : compromised: 0.5762, honest: 0.8607
Round 006: test acc mean=0.7794 ± 0.1675 | min=0.5069 max=0.9067
         : test loss mean=nan ± nan
         : individual accs = ['0.889474', '0.886010', '0.876664', '0.894646', '0.877425', '0.514410', '0.902183', '0.897072', '0.562500', '0.892730', '0.891608', '0.906667', '0.522569', '0.506897', '0.517794', '0.858515', '0.894281', '0.885057', '0.522040', '0.888694']
         : correct/total = [(1014, 1140), (1026, 1158), (988, 1127), (1036, 1158), (995, 1134), (589, 1145), (1033, 1145), (1011, 1127), (639, 1136), (1007, 1128), (1020, 1144), (1020, 1125), (602, 1152), (588, 1160), (582, 1124), (983, 1145), (1032, 1154), (1001, 1131), (604, 1157), (1014, 1141)]
         : compromised: 0.5781, honest: 0.8656
Round 007: test acc mean=0.7854 ± 0.1713 | min=0.5069 max=0.9049
         : test loss mean=nan ± nan
         : individual accs = ['0.902632', '0.903282', '0.896185', '0.904145', '0.888007', '0.514410', '0.901310', '0.896185', '0.562500', '0.898936', '0.903846', '0.904889', '0.522569', '0.506897', '0.517794', '0.882969', '0.897747', '0.893899', '0.522040', '0.888694']
         : correct/total = [(1029, 1140), (1046, 1158), (1010, 1127), (1047, 1158), (1007, 1134), (589, 1145), (1032, 1145), (1010, 1127), (639, 1136), (1014, 1128), (1034, 1144), (1018, 1125), (602, 1152), (588, 1160), (582, 1124), (1011, 1145), (1036, 1154), (1011, 1131), (604, 1157), (1014, 1141)]
         : compromised: 0.5796, honest: 0.8737
Round 008: test acc mean=0.7864 ± 0.1720 | min=0.5069 max=0.9120
         : test loss mean=nan ± nan
         : individual accs = ['0.902632', '0.906736', '0.888199', '0.888601', '0.896825', '0.514410', '0.902183', '0.908607', '0.562500', '0.905142', '0.902098', '0.912000', '0.522569', '0.506897', '0.517794', '0.893450', '0.902080', '0.885942', '0.522040', '0.887818']
         : correct/total = [(1029, 1140), (1050, 1158), (1001, 1127), (1029, 1158), (1017, 1134), (589, 1145), (1033, 1145), (1024, 1127), (639, 1136), (1021, 1128), (1032, 1144), (1026, 1125), (602, 1152), (588, 1160), (582, 1124), (1023, 1145), (1041, 1154), (1002, 1131), (604, 1157), (1013, 1141)]
         : compromised: 0.5783, honest: 0.8756
Round 009: test acc mean=0.7871 ± 0.1725 | min=0.5069 max=0.9131
         : test loss mean=nan ± nan
         : individual accs = ['0.897368', '0.899827', '0.891748', '0.906736', '0.905644', '0.514410', '0.905677', '0.909494', '0.562500', '0.913121', '0.903846', '0.908444', '0.522569', '0.506897', '0.517794', '0.878603', '0.895147', '0.885057', '0.522040', '0.895706']
         : correct/total = [(1023, 1140), (1042, 1158), (1005, 1127), (1050, 1158), (1027, 1134), (589, 1145), (1037, 1145), (1025, 1127), (639, 1136), (1030, 1128), (1034, 1144), (1022, 1125), (602, 1152), (588, 1160), (582, 1124), (1006, 1145), (1033, 1154), (1001, 1131), (604, 1157), (1022, 1141)]
         : compromised: 0.5781, honest: 0.8767
Round 010: test acc mean=0.7890 ± 0.1737 | min=0.5069 max=0.9147
         : test loss mean=nan ± nan
         : individual accs = ['0.896491', '0.907599', '0.893523', '0.914508', '0.907407', '0.514410', '0.905677', '0.910382', '0.562500', '0.902482', '0.908217', '0.914667', '0.522569', '0.506897', '0.517794', '0.892576', '0.898614', '0.887710', '0.522040', '0.893953']
         : correct/total = [(1022, 1140), (1051, 1158), (1007, 1127), (1059, 1158), (1029, 1134), (589, 1145), (1037, 1145), (1026, 1127), (639, 1136), (1018, 1128), (1039, 1144), (1029, 1125), (602, 1152), (588, 1160), (582, 1124), (1022, 1145), (1037, 1154), (1004, 1131), (604, 1157), (1020, 1141)]
         : compromised: 0.5786, honest: 0.8792

=== FINAL RESULTS ===
Dataset: celeba, Nodes: 20, Graph: erdos, Aggregation: krum
Attack: directed_deviation, 30.0% compromised
Final accuracy - Compromised: 0.5786, Honest: 0.8792
Overall test accuracy: mean=0.7890 ± 0.1737
