Device: cuda
Seed: 987654321
Looking for images in: /home/student.unimelb.edu.au/mrangwala/Projects/Sketchguard/leaf/data/celeba/data/raw/img_align_celeba
Loading 1 LEAF CelebA train files...
LEAF CelebA train: 9343 users (celebrities), 177457 samples
Looking for images in: /home/student.unimelb.edu.au/mrangwala/Projects/Sketchguard/leaf/data/celeba/data/raw/img_align_celeba
Loading 1 LEAF CelebA test files...
LEAF CelebA test: 9343 users (celebrities), 22831 samples
Found 9343 train users, 9343 test users, 9343 common users
User sample counts range: 31 (max) to 4 (min)
Distributed ALL 9343 users across 20 clients
Users per client: 467 (with 3 clients getting +1 user)
Train partition sizes: [8843, 8998, 8728, 9034, 8866, 8946, 8873, 8776, 8816, 8801, 8913, 8656, 9115, 8921, 8699, 8823, 8912, 8766, 9102, 8869]
Test partition sizes: [1140, 1158, 1127, 1158, 1134, 1145, 1145, 1127, 1136, 1128, 1144, 1125, 1152, 1160, 1124, 1145, 1154, 1131, 1157, 1141]
  Client 0: 8843 train samples, 2 unique classes
  Client 1: 8998 train samples, 2 unique classes
  Client 2: 8728 train samples, 2 unique classes
  Client 3: 9034 train samples, 2 unique classes
  Client 4: 8866 train samples, 2 unique classes
  Client 5: 8946 train samples, 2 unique classes
  Client 6: 8873 train samples, 2 unique classes
  Client 7: 8776 train samples, 2 unique classes
  Client 8: 8816 train samples, 2 unique classes
  Client 9: 8801 train samples, 2 unique classes
  Client 10: 8913 train samples, 2 unique classes
  Client 11: 8656 train samples, 2 unique classes
  Client 12: 9115 train samples, 2 unique classes
  Client 13: 8921 train samples, 2 unique classes
  Client 14: 8699 train samples, 2 unique classes
  Client 15: 8823 train samples, 2 unique classes
  Client 16: 8912 train samples, 2 unique classes
  Client 17: 8766 train samples, 2 unique classes
  Client 18: 9102 train samples, 2 unique classes
  Client 19: 8869 train samples, 2 unique classes
Will sample 4500 samples per client per epoch
Graph: fully, nodes: 20, edges: 190
Degree statistics: avg=19.00, min=19, max=19
Attack: Compromised 10/20 nodes: [1, 2, 5, 11, 12, 13, 14, 15, 17, 18]
Attack type: krum, lambda: 1.0
Model variant: baseline
Model parameters: 2,219,692
UBAR ALGORITHM (Two-Stage Byzantine-resilient)
  - Model dimension: 2,219,692 parameters
  - Rho parameter: 0.5
  - Stage 1: Distance-based filtering (select 50% closest neighbors)
  - Stage 2: Performance-based selection (loss comparison)
  - Complexity: O(deg(i)×d + deg(i)×inference)
Initial test acc across nodes: mean=0.4978 ± 0.0208
Round 001: test acc mean=0.6470 ± 0.0462 | min=0.5706 max=0.7158
         : test loss mean=0.6766 ± 0.0084
         : individual accs = ['0.625439', '0.668394', '0.608696', '0.620035', '0.597002', '0.658515', '0.699563', '0.623780', '0.573944', '0.699468', '0.685315', '0.614222', '0.661458', '0.698276', '0.640569', '0.710044', '0.715771', '0.583554', '0.685393', '0.570552']
         : correct/total = [(713, 1140), (774, 1158), (686, 1127), (718, 1158), (677, 1134), (754, 1145), (801, 1145), (703, 1127), (652, 1136), (789, 1128), (784, 1144), (691, 1125), (762, 1152), (810, 1160), (720, 1124), (813, 1145), (826, 1154), (660, 1131), (793, 1157), (651, 1141)]
         : compromised: 0.6529, honest: 0.6411
         : ubar stats = ['Node 0: s1=0.474, s2=0.111', 'Node 1: s1=0.474, s2=0.667', 'Node 2: s1=0.474, s2=0.111']...
Round 002: test acc mean=0.6712 ± 0.0669 | min=0.5196 max=0.7613
         : test loss mean=0.6449 ± 0.0431
         : individual accs = ['0.698246', '0.668394', '0.761313', '0.700345', '0.538801', '0.601747', '0.608734', '0.654836', '0.639085', '0.679965', '0.708916', '0.741333', '0.699653', '0.599138', '0.519573', '0.680349', '0.760832', '0.692308', '0.739844', '0.730938']
         : correct/total = [(796, 1140), (774, 1158), (858, 1127), (811, 1158), (611, 1134), (689, 1145), (697, 1145), (738, 1127), (726, 1136), (767, 1128), (811, 1144), (834, 1125), (806, 1152), (695, 1160), (584, 1124), (779, 1145), (878, 1154), (783, 1131), (856, 1157), (834, 1141)]
         : compromised: 0.6704, honest: 0.6721
         : ubar stats = ['Node 0: s1=0.474, s2=0.111', 'Node 1: s1=0.474, s2=0.611', 'Node 2: s1=0.474, s2=0.111']...
Round 003: test acc mean=0.7278 ± 0.0544 | min=0.6272 max=0.7911
         : test loss mean=0.5897 ± 0.0513
         : individual accs = ['0.627193', '0.735751', '0.789707', '0.740069', '0.646384', '0.728384', '0.773799', '0.690328', '0.745599', '0.743794', '0.765734', '0.791111', '0.684896', '0.715517', '0.644128', '0.771179', '0.788562', '0.778073', '0.768366', '0.627520']
         : correct/total = [(715, 1140), (852, 1158), (890, 1127), (857, 1158), (733, 1134), (834, 1145), (886, 1145), (778, 1127), (847, 1136), (839, 1128), (876, 1144), (890, 1125), (789, 1152), (830, 1160), (724, 1124), (883, 1145), (910, 1154), (880, 1131), (889, 1157), (716, 1141)]
         : compromised: 0.7407, honest: 0.7149
         : ubar stats = ['Node 0: s1=0.474, s2=0.111', 'Node 1: s1=0.474, s2=0.630', 'Node 2: s1=0.474, s2=0.111']...
Round 004: test acc mean=0.8092 ± 0.0233 | min=0.7534 max=0.8400
         : test loss mean=0.4599 ± 0.0364
         : individual accs = ['0.823684', '0.809154', '0.838509', '0.812608', '0.790123', '0.820961', '0.825328', '0.779059', '0.835387', '0.781028', '0.840035', '0.820444', '0.789931', '0.753448', '0.786477', '0.798253', '0.824090', '0.822281', '0.795160', '0.838738']
         : correct/total = [(939, 1140), (937, 1158), (945, 1127), (941, 1158), (896, 1134), (940, 1145), (945, 1145), (878, 1127), (949, 1136), (881, 1128), (961, 1144), (923, 1125), (910, 1152), (874, 1160), (884, 1124), (914, 1145), (951, 1154), (930, 1131), (920, 1157), (957, 1141)]
         : compromised: 0.8035, honest: 0.8150
         : ubar stats = ['Node 0: s1=0.474, s2=0.167', 'Node 1: s1=0.474, s2=0.639', 'Node 2: s1=0.474, s2=0.111']...
Round 005: test acc mean=0.8472 ± 0.0195 | min=0.7986 max=0.8759
         : test loss mean=0.3537 ± 0.0285
         : individual accs = ['0.843860', '0.872193', '0.842059', '0.860967', '0.843915', '0.818341', '0.862882', '0.842946', '0.859155', '0.871454', '0.875874', '0.839111', '0.832465', '0.825862', '0.842527', '0.843668', '0.868284', '0.833775', '0.798617', '0.865907']
         : correct/total = [(962, 1140), (1010, 1158), (949, 1127), (997, 1158), (957, 1134), (937, 1145), (988, 1145), (950, 1127), (976, 1136), (983, 1128), (1002, 1144), (944, 1125), (959, 1152), (958, 1160), (947, 1124), (966, 1145), (1002, 1154), (943, 1131), (924, 1157), (988, 1141)]
         : compromised: 0.8349, honest: 0.8595
         : ubar stats = ['Node 0: s1=0.474, s2=0.333', 'Node 1: s1=0.474, s2=0.622', 'Node 2: s1=0.474, s2=0.133']...
Round 006: test acc mean=0.8760 ± 0.0116 | min=0.8470 max=0.8943
         : test loss mean=0.2949 ± 0.0154
         : individual accs = ['0.873684', '0.882556', '0.876664', '0.887737', '0.856261', '0.894323', '0.884716', '0.867791', '0.878521', '0.881206', '0.890734', '0.878222', '0.868924', '0.877586', '0.870107', '0.861135', '0.889081', '0.872679', '0.847018', '0.881683']
         : correct/total = [(996, 1140), (1022, 1158), (988, 1127), (1028, 1158), (971, 1134), (1024, 1145), (1013, 1145), (978, 1127), (998, 1136), (994, 1128), (1019, 1144), (988, 1125), (1001, 1152), (1018, 1160), (978, 1124), (986, 1145), (1026, 1154), (987, 1131), (980, 1157), (1006, 1141)]
         : compromised: 0.8729, honest: 0.8791
         : ubar stats = ['Node 0: s1=0.474, s2=0.296', 'Node 1: s1=0.474, s2=0.648', 'Node 2: s1=0.474, s2=0.222']...
Round 007: test acc mean=0.8872 ± 0.0089 | min=0.8638 max=0.8969
         : test loss mean=0.2753 ± 0.0176
         : individual accs = ['0.894737', '0.896373', '0.884650', '0.886874', '0.880952', '0.896943', '0.888210', '0.895297', '0.890845', '0.884752', '0.892483', '0.887111', '0.885417', '0.887931', '0.895907', '0.863755', '0.891681', '0.881521', '0.865169', '0.893076']
         : correct/total = [(1020, 1140), (1038, 1158), (997, 1127), (1027, 1158), (999, 1134), (1027, 1145), (1017, 1145), (1009, 1127), (1012, 1136), (998, 1128), (1021, 1144), (998, 1125), (1020, 1152), (1030, 1160), (1007, 1124), (989, 1145), (1029, 1154), (997, 1131), (1001, 1157), (1019, 1141)]
         : compromised: 0.8845, honest: 0.8899
         : ubar stats = ['Node 0: s1=0.474, s2=0.349', 'Node 1: s1=0.474, s2=0.667', 'Node 2: s1=0.474, s2=0.270']...
Round 008: test acc mean=0.8881 ± 0.0092 | min=0.8716 max=0.9022
         : test loss mean=0.2694 ± 0.0152
         : individual accs = ['0.892982', '0.893782', '0.881988', '0.886874', '0.891534', '0.902183', '0.879476', '0.899734', '0.881162', '0.897163', '0.887238', '0.895111', '0.886285', '0.871552', '0.900356', '0.872489', '0.896880', '0.879752', '0.874676', '0.890447']
         : correct/total = [(1018, 1140), (1035, 1158), (994, 1127), (1027, 1158), (1011, 1134), (1033, 1145), (1007, 1145), (1014, 1127), (1001, 1136), (1012, 1128), (1015, 1144), (1007, 1125), (1021, 1152), (1011, 1160), (1012, 1124), (999, 1145), (1035, 1154), (995, 1131), (1012, 1157), (1016, 1141)]
         : compromised: 0.8858, honest: 0.8903
         : ubar stats = ['Node 0: s1=0.474, s2=0.319', 'Node 1: s1=0.474, s2=0.653', 'Node 2: s1=0.474, s2=0.347']...
Round 009: test acc mean=0.8935 ± 0.0107 | min=0.8583 max=0.9105
         : test loss mean=0.2581 ± 0.0191
         : individual accs = ['0.910526', '0.893782', '0.882875', '0.900691', '0.896825', '0.910044', '0.896943', '0.899734', '0.894366', '0.895390', '0.895105', '0.894222', '0.890625', '0.897414', '0.898577', '0.882096', '0.896014', '0.885057', '0.858254', '0.892200']
         : correct/total = [(1038, 1140), (1035, 1158), (995, 1127), (1043, 1158), (1017, 1134), (1042, 1145), (1027, 1145), (1014, 1127), (1016, 1136), (1010, 1128), (1024, 1144), (1006, 1125), (1026, 1152), (1041, 1160), (1010, 1124), (1010, 1145), (1034, 1154), (1001, 1131), (993, 1157), (1018, 1141)]
         : compromised: 0.8893, honest: 0.8978
         : ubar stats = ['Node 0: s1=0.474, s2=0.296', 'Node 1: s1=0.474, s2=0.630', 'Node 2: s1=0.474, s2=0.370']...
Round 010: test acc mean=0.8985 ± 0.0086 | min=0.8755 max=0.9128
         : test loss mean=0.2496 ± 0.0167
         : individual accs = ['0.909649', '0.900691', '0.889086', '0.912781', '0.897707', '0.908297', '0.897817', '0.904170', '0.890845', '0.902482', '0.901224', '0.902222', '0.897569', '0.898276', '0.903025', '0.884716', '0.904679', '0.890363', '0.875540', '0.899211']
         : correct/total = [(1037, 1140), (1043, 1158), (1002, 1127), (1057, 1158), (1018, 1134), (1040, 1145), (1028, 1145), (1019, 1127), (1012, 1136), (1018, 1128), (1031, 1144), (1015, 1125), (1034, 1152), (1042, 1160), (1015, 1124), (1013, 1145), (1044, 1154), (1007, 1131), (1013, 1157), (1026, 1141)]
         : compromised: 0.8950, honest: 0.9021
         : ubar stats = ['Node 0: s1=0.474, s2=0.278', 'Node 1: s1=0.474, s2=0.578', 'Node 2: s1=0.474, s2=0.356']...

=== FINAL RESULTS ===
Dataset: celeba, Nodes: 20, Graph: fully, Aggregation: ubar
Attack: krum, 50.0% compromised
Final accuracy - Compromised: 0.8950, Honest: 0.9021
Overall test accuracy: mean=0.8985 ± 0.0086

=== UBAR SUMMARY ===
Node 0: stage1=0.474, stage2=0.278, overall=0.132
Node 1: stage1=0.474, stage2=0.578, overall=0.274
Node 2: stage1=0.474, stage2=0.356, overall=0.168
Node 3: stage1=0.474, stage2=0.422, overall=0.200
Node 4: stage1=0.474, stage2=0.578, overall=0.274
Node 5: stage1=0.474, stage2=0.456, overall=0.216
Node 6: stage1=0.474, stage2=0.278, overall=0.132
Node 7: stage1=0.474, stage2=0.633, overall=0.300
Node 8: stage1=0.474, stage2=0.344, overall=0.163
Node 9: stage1=0.474, stage2=0.500, overall=0.237
Node 10: stage1=0.474, stage2=0.344, overall=0.163
Node 11: stage1=0.474, stage2=0.256, overall=0.121
Node 12: stage1=0.474, stage2=0.633, overall=0.300
Node 13: stage1=0.474, stage2=0.544, overall=0.258
Node 14: stage1=0.474, stage2=0.500, overall=0.237
Node 15: stage1=0.474, stage2=0.222, overall=0.105
Node 16: stage1=0.474, stage2=0.244, overall=0.116
Node 17: stage1=0.474, stage2=0.189, overall=0.089
Node 18: stage1=0.474, stage2=0.356, overall=0.168
Node 19: stage1=0.474, stage2=0.278, overall=0.132

=== PARALLEL EXECUTION TIME (realistic for distributed system) ===
  COMMUNICATION (max across nodes):
    - Full model transfer: 0.000s (0.0%)
  COMPUTATION (max across nodes):
    - Distance computation: 0.053s (15.5%)
    - Loss computation: 0.280s (82.2%)
    - Aggregation: 0.008s (2.2%)
  TOTALS:
    - Total computation: 0.341s (100.0%)
    - Total communication: 0.000s (0.0%)
    - Total parallel time: 0.341s

=== PER-NODE AVERAGE TIME ===
  - Distance computation: 0.049s
  - Loss computation: 0.237s
  - Aggregation: 0.005s
  - Model transfer: 0.000s
  - Total per node: 0.290s

=== TOTAL COMPUTATIONAL WORK (sum across all nodes) ===
  - Total distance computation: 0.972s
  - Total loss computation: 4.731s
  - Total aggregation: 0.103s
  - Total model transfer: 0.000s
  - Grand total: 5.807s
  - Mean Stage 1 acceptance rate: 0.474
  - Mean Stage 2 acceptance rate: 0.399
  - Overall acceptance rate: 0.189

UBAR Algorithm Properties:
  - Model dimension: 2,219,692
  - Rho parameter: 0.5
  - Two-stage approach: Distance filtering + loss evaluation
  - Stage 1 selects: 50% of neighbors
  - Stage 2 uses: Training sample loss comparison
  - Theoretical complexity: O(deg(i)×d + deg(i)×inference)
  - Approach: UBAR paper implementation
