Device: cuda
Seed: 987654321
Looking for images in: /home/student.unimelb.edu.au/mrangwala/Projects/Sketchguard/leaf/data/celeba/data/raw/img_align_celeba
Loading 1 LEAF CelebA train files...
LEAF CelebA train: 9343 users (celebrities), 177457 samples
Looking for images in: /home/student.unimelb.edu.au/mrangwala/Projects/Sketchguard/leaf/data/celeba/data/raw/img_align_celeba
Loading 1 LEAF CelebA test files...
LEAF CelebA test: 9343 users (celebrities), 22831 samples
Found 9343 train users, 9343 test users, 9343 common users
User sample counts range: 31 (max) to 4 (min)
Distributed ALL 9343 users across 20 clients
Users per client: 467 (with 3 clients getting +1 user)
Train partition sizes: [8843, 8998, 8728, 9034, 8866, 8946, 8873, 8776, 8816, 8801, 8913, 8656, 9115, 8921, 8699, 8823, 8912, 8766, 9102, 8869]
Test partition sizes: [1140, 1158, 1127, 1158, 1134, 1145, 1145, 1127, 1136, 1128, 1144, 1125, 1152, 1160, 1124, 1145, 1154, 1131, 1157, 1141]
  Client 0: 8843 train samples, 2 unique classes
  Client 1: 8998 train samples, 2 unique classes
  Client 2: 8728 train samples, 2 unique classes
  Client 3: 9034 train samples, 2 unique classes
  Client 4: 8866 train samples, 2 unique classes
  Client 5: 8946 train samples, 2 unique classes
  Client 6: 8873 train samples, 2 unique classes
  Client 7: 8776 train samples, 2 unique classes
  Client 8: 8816 train samples, 2 unique classes
  Client 9: 8801 train samples, 2 unique classes
  Client 10: 8913 train samples, 2 unique classes
  Client 11: 8656 train samples, 2 unique classes
  Client 12: 9115 train samples, 2 unique classes
  Client 13: 8921 train samples, 2 unique classes
  Client 14: 8699 train samples, 2 unique classes
  Client 15: 8823 train samples, 2 unique classes
  Client 16: 8912 train samples, 2 unique classes
  Client 17: 8766 train samples, 2 unique classes
  Client 18: 9102 train samples, 2 unique classes
  Client 19: 8869 train samples, 2 unique classes
Will sample 4500 samples per client per epoch
Graph: ring, nodes: 20, edges: 20
Degree statistics: avg=2.00, min=2, max=2
Attack: Compromised 12/20 nodes: [1, 2, 3, 5, 8, 11, 12, 13, 14, 15, 17, 18]
Attack type: backdoor, lambda: 1.0
Backdoor target label: 0, trigger size: 8
Model variant: baseline
Model parameters: 2,219,692
UBAR ALGORITHM (Two-Stage Byzantine-resilient)
  - Model dimension: 2,219,692 parameters
  - Rho parameter: 0.4
  - Stage 1: Distance-based filtering (select 40% closest neighbors)
  - Stage 2: Performance-based selection (loss comparison)
  - Complexity: O(deg(i)×d + deg(i)×inference)
Initial test acc across nodes: mean=0.4978 ± 0.0208
Backdoor attack: Created poisoned datasets for 12 compromised nodes
Round 001: test acc mean=0.5447 ± 0.0561 | min=0.4933 max=0.7185
         : test loss mean=9120.3091 ± 13580.9225
         : individual accs = ['0.578070', '0.508636', '0.493345', '0.535406', '0.522046', '0.514410', '0.555459', '0.520852', '0.562500', '0.676418', '0.718531', '0.518222', '0.522569', '0.506897', '0.517794', '0.520524', '0.514731', '0.508400', '0.522040', '0.577564']
         : correct/total = [(659, 1140), (589, 1158), (556, 1127), (620, 1158), (592, 1134), (589, 1145), (636, 1145), (587, 1127), (639, 1136), (763, 1128), (822, 1144), (583, 1125), (602, 1152), (588, 1160), (582, 1124), (596, 1145), (594, 1154), (575, 1131), (604, 1157), (659, 1141)]
         : compromised: 0.5192, honest: 0.5830
         : ubar stats = ['Node 0: s1=0.500, s2=1.000', 'Node 1: s1=0.500, s2=1.000', 'Node 2: s1=0.500, s2=1.000']...
Round 002: test acc mean=0.5845 ± 0.1121 | min=0.4862 max=0.7858
         : test loss mean=nan ± nan
         : individual accs = ['0.742105', '0.493092', '0.493345', '0.528497', '0.522046', '0.514410', '0.742358', '0.716060', '0.525528', '0.776596', '0.785839', '0.486222', '0.522569', '0.506897', '0.517794', '0.517031', '0.515598', '0.508400', '0.515125', '0.760736']
         : correct/total = [(846, 1140), (571, 1158), (556, 1127), (612, 1158), (592, 1134), (589, 1145), (850, 1145), (807, 1127), (597, 1136), (876, 1128), (899, 1144), (547, 1125), (602, 1152), (588, 1160), (582, 1124), (592, 1145), (595, 1154), (575, 1131), (596, 1157), (868, 1141)]
         : compromised: 0.5107, honest: 0.6952
         : ubar stats = ['Node 0: s1=0.500, s2=1.000', 'Node 1: s1=0.500, s2=1.000', 'Node 2: s1=0.500, s2=1.000']...
Round 003: test acc mean=0.6127 ± 0.1476 | min=0.4933 max=0.8776
         : test loss mean=nan ± nan
         : individual accs = ['0.835088', '0.508636', '0.493345', '0.528497', '0.522046', '0.514410', '0.803493', '0.803017', '0.562500', '0.865248', '0.877622', '0.498667', '0.522569', '0.506897', '0.517794', '0.517031', '0.515598', '0.508400', '0.522040', '0.831727']
         : correct/total = [(952, 1140), (589, 1158), (556, 1127), (612, 1158), (592, 1134), (589, 1145), (920, 1145), (905, 1127), (639, 1136), (976, 1128), (1004, 1144), (561, 1125), (602, 1152), (588, 1160), (582, 1124), (592, 1145), (595, 1154), (575, 1131), (604, 1157), (949, 1141)]
         : compromised: 0.5167, honest: 0.7567
         : ubar stats = ['Node 0: s1=0.500, s2=1.000', 'Node 1: s1=0.500, s2=1.000', 'Node 2: s1=0.500, s2=1.000']...
Round 004: test acc mean=0.6235 ± 0.1632 | min=0.4933 max=0.8830
         : test loss mean=nan ± nan
         : individual accs = ['0.864912', '0.508636', '0.493345', '0.528497', '0.522046', '0.514410', '0.871616', '0.859805', '0.562500', '0.882979', '0.882867', '0.498667', '0.522569', '0.506897', '0.517794', '0.517031', '0.515598', '0.508400', '0.522040', '0.868536']
         : correct/total = [(986, 1140), (589, 1158), (556, 1127), (612, 1158), (592, 1134), (589, 1145), (998, 1145), (969, 1127), (639, 1136), (996, 1128), (1010, 1144), (561, 1125), (602, 1152), (588, 1160), (582, 1124), (592, 1145), (595, 1154), (575, 1131), (604, 1157), (991, 1141)]
         : compromised: 0.5167, honest: 0.7835
         : ubar stats = ['Node 0: s1=0.500, s2=1.000', 'Node 1: s1=0.500, s2=1.000', 'Node 2: s1=0.500, s2=1.000']...
Round 005: test acc mean=0.6252 ± 0.1661 | min=0.4933 max=0.9012
         : test loss mean=nan ± nan
         : individual accs = ['0.838596', '0.508636', '0.493345', '0.528497', '0.522046', '0.514410', '0.888210', '0.881100', '0.562500', '0.895390', '0.901224', '0.498667', '0.522569', '0.506897', '0.517794', '0.517031', '0.515598', '0.508400', '0.522040', '0.860649']
         : correct/total = [(956, 1140), (589, 1158), (556, 1127), (612, 1158), (592, 1134), (589, 1145), (1017, 1145), (993, 1127), (639, 1136), (1010, 1128), (1031, 1144), (561, 1125), (602, 1152), (588, 1160), (582, 1124), (592, 1145), (595, 1154), (575, 1131), (604, 1157), (982, 1141)]
         : compromised: 0.5167, honest: 0.7879
         : ubar stats = ['Node 0: s1=0.500, s2=1.000', 'Node 1: s1=0.500, s2=1.000', 'Node 2: s1=0.500, s2=1.000']...
Round 006: test acc mean=0.6292 ± 0.1719 | min=0.4933 max=0.9066
         : test loss mean=nan ± nan
         : individual accs = ['0.890351', '0.508636', '0.493345', '0.528497', '0.522046', '0.514410', '0.906550', '0.886424', '0.562500', '0.886525', '0.891608', '0.498667', '0.522569', '0.506897', '0.517794', '0.517031', '0.515598', '0.508400', '0.522040', '0.884312']
         : correct/total = [(1015, 1140), (589, 1158), (556, 1127), (612, 1158), (592, 1134), (589, 1145), (1038, 1145), (999, 1127), (639, 1136), (1000, 1128), (1020, 1144), (561, 1125), (602, 1152), (588, 1160), (582, 1124), (592, 1145), (595, 1154), (575, 1131), (604, 1157), (1009, 1141)]
         : compromised: 0.5167, honest: 0.7979
         : ubar stats = ['Node 0: s1=0.500, s2=1.000', 'Node 1: s1=0.500, s2=1.000', 'Node 2: s1=0.500, s2=1.000']...
Round 007: test acc mean=0.6321 ± 0.1763 | min=0.4933 max=0.9060
         : test loss mean=nan ± nan
         : individual accs = ['0.896491', '0.508636', '0.493345', '0.528497', '0.522046', '0.514410', '0.900437', '0.901508', '0.562500', '0.906028', '0.902972', '0.498667', '0.522569', '0.506897', '0.517794', '0.517031', '0.515598', '0.508400', '0.522040', '0.896582']
         : correct/total = [(1022, 1140), (589, 1158), (556, 1127), (612, 1158), (592, 1134), (589, 1145), (1031, 1145), (1016, 1127), (639, 1136), (1022, 1128), (1033, 1144), (561, 1125), (602, 1152), (588, 1160), (582, 1124), (592, 1145), (595, 1154), (575, 1131), (604, 1157), (1023, 1141)]
         : compromised: 0.5167, honest: 0.8052
         : ubar stats = ['Node 0: s1=0.500, s2=1.000', 'Node 1: s1=0.500, s2=1.000', 'Node 2: s1=0.500, s2=1.000']...
Round 008: test acc mean=0.6304 ± 0.1737 | min=0.4933 max=0.9015
         : test loss mean=nan ± nan
         : individual accs = ['0.892105', '0.508636', '0.493345', '0.528497', '0.522046', '0.514410', '0.898690', '0.901508', '0.562500', '0.895390', '0.895979', '0.498667', '0.522569', '0.506897', '0.517794', '0.517031', '0.515598', '0.508400', '0.522040', '0.886065']
         : correct/total = [(1017, 1140), (589, 1158), (556, 1127), (612, 1158), (592, 1134), (589, 1145), (1029, 1145), (1016, 1127), (639, 1136), (1010, 1128), (1025, 1144), (561, 1125), (602, 1152), (588, 1160), (582, 1124), (592, 1145), (595, 1154), (575, 1131), (604, 1157), (1011, 1141)]
         : compromised: 0.5167, honest: 0.8009
         : ubar stats = ['Node 0: s1=0.500, s2=1.000', 'Node 1: s1=0.500, s2=1.000', 'Node 2: s1=0.500, s2=1.000']...
Round 009: test acc mean=0.6322 ± 0.1764 | min=0.4933 max=0.9066
         : test loss mean=nan ± nan
         : individual accs = ['0.901754', '0.508636', '0.493345', '0.528497', '0.522046', '0.514410', '0.906550', '0.904170', '0.562500', '0.897163', '0.899476', '0.498667', '0.522569', '0.506897', '0.517794', '0.517031', '0.515598', '0.508400', '0.522040', '0.895706']
         : correct/total = [(1028, 1140), (589, 1158), (556, 1127), (612, 1158), (592, 1134), (589, 1145), (1038, 1145), (1019, 1127), (639, 1136), (1012, 1128), (1029, 1144), (561, 1125), (602, 1152), (588, 1160), (582, 1124), (592, 1145), (595, 1154), (575, 1131), (604, 1157), (1022, 1141)]
         : compromised: 0.5167, honest: 0.8053
         : ubar stats = ['Node 0: s1=0.500, s2=1.000', 'Node 1: s1=0.500, s2=1.000', 'Node 2: s1=0.500, s2=1.000']...
Round 010: test acc mean=0.6324 ± 0.1767 | min=0.4933 max=0.9065
         : test loss mean=nan ± nan
         : individual accs = ['0.900000', '0.508636', '0.493345', '0.528497', '0.522046', '0.514410', '0.895197', '0.905945', '0.562500', '0.899823', '0.906469', '0.498667', '0.522569', '0.506897', '0.517794', '0.517031', '0.515598', '0.508400', '0.522040', '0.901840']
         : correct/total = [(1026, 1140), (589, 1158), (556, 1127), (612, 1158), (592, 1134), (589, 1145), (1025, 1145), (1021, 1127), (639, 1136), (1015, 1128), (1037, 1144), (561, 1125), (602, 1152), (588, 1160), (582, 1124), (592, 1145), (595, 1154), (575, 1131), (604, 1157), (1029, 1141)]
         : compromised: 0.5167, honest: 0.8059
         : ubar stats = ['Node 0: s1=0.500, s2=1.000', 'Node 1: s1=0.500, s2=1.000', 'Node 2: s1=0.500, s2=1.000']...

=== FINAL RESULTS ===
Dataset: celeba, Nodes: 20, Graph: ring, Aggregation: ubar
Attack: backdoor, 60.0% compromised
Final accuracy - Compromised: 0.5167, Honest: 0.8059
Overall test accuracy: mean=0.6324 ± 0.1767

=== BACKDOOR ATTACK SUCCESS RATE (ASR) ===
Target label: 0
Trigger size: 8x8
Overall ASR: 0.8657 ± 0.2054
Honest nodes ASR: 0.6642 ± 0.1945
Compromised nodes ASR: 1.0000 ± 0.0000
Note: Higher ASR indicates more successful backdoor attack

=== UBAR SUMMARY ===
Node 0: stage1=0.500, stage2=1.000, overall=0.500
Node 1: stage1=0.500, stage2=1.000, overall=0.500
Node 2: stage1=0.500, stage2=1.000, overall=0.500
Node 3: stage1=0.500, stage2=1.000, overall=0.500
Node 4: stage1=0.500, stage2=1.000, overall=0.500
Node 5: stage1=0.500, stage2=1.000, overall=0.500
Node 6: stage1=0.500, stage2=1.000, overall=0.500
Node 7: stage1=0.500, stage2=1.000, overall=0.500
Node 8: stage1=0.500, stage2=1.000, overall=0.500
Node 9: stage1=0.500, stage2=1.000, overall=0.500
Node 10: stage1=0.500, stage2=1.000, overall=0.500
Node 11: stage1=0.500, stage2=1.000, overall=0.500
Node 12: stage1=0.500, stage2=1.000, overall=0.500
Node 13: stage1=0.500, stage2=1.000, overall=0.500
Node 14: stage1=0.500, stage2=1.000, overall=0.500
Node 15: stage1=0.500, stage2=1.000, overall=0.500
Node 16: stage1=0.500, stage2=1.000, overall=0.500
Node 17: stage1=0.500, stage2=1.000, overall=0.500
Node 18: stage1=0.500, stage2=1.000, overall=0.500
Node 19: stage1=0.500, stage2=1.000, overall=0.500

=== PARALLEL EXECUTION TIME (realistic for distributed system) ===
  COMMUNICATION (max across nodes):
    - Full model transfer: 0.000s (0.0%)
  COMPUTATION (max across nodes):
    - Distance computation: 0.009s (4.9%)
    - Loss computation: 0.177s (93.2%)
    - Aggregation: 0.004s (2.0%)
  TOTALS:
    - Total computation: 0.190s (100.0%)
    - Total communication: 0.000s (0.0%)
    - Total parallel time: 0.190s

=== PER-NODE AVERAGE TIME ===
  - Distance computation: 0.006s
  - Loss computation: 0.141s
  - Aggregation: 0.003s
  - Model transfer: 0.000s
  - Total per node: 0.150s

=== TOTAL COMPUTATIONAL WORK (sum across all nodes) ===
  - Total distance computation: 0.118s
  - Total loss computation: 2.823s
  - Total aggregation: 0.054s
  - Total model transfer: 0.000s
  - Grand total: 2.995s
  - Mean Stage 1 acceptance rate: 0.500
  - Mean Stage 2 acceptance rate: 1.000
  - Overall acceptance rate: 0.500

UBAR Algorithm Properties:
  - Model dimension: 2,219,692
  - Rho parameter: 0.4
  - Two-stage approach: Distance filtering + loss evaluation
  - Stage 1 selects: 40% of neighbors
  - Stage 2 uses: Training sample loss comparison
  - Theoretical complexity: O(deg(i)×d + deg(i)×inference)
  - Approach: UBAR paper implementation
