Device: cuda
Seed: 987654321
Looking for images in: /home/student.unimelb.edu.au/mrangwala/Projects/Sketchguard/leaf/data/celeba/data/raw/img_align_celeba
Loading 1 LEAF CelebA train files...
LEAF CelebA train: 9343 users (celebrities), 177457 samples
Looking for images in: /home/student.unimelb.edu.au/mrangwala/Projects/Sketchguard/leaf/data/celeba/data/raw/img_align_celeba
Loading 1 LEAF CelebA test files...
LEAF CelebA test: 9343 users (celebrities), 22831 samples
Found 9343 train users, 9343 test users, 9343 common users
User sample counts range: 31 (max) to 4 (min)
Distributed ALL 9343 users across 20 clients
Users per client: 467 (with 3 clients getting +1 user)
Train partition sizes: [8843, 8998, 8728, 9034, 8866, 8946, 8873, 8776, 8816, 8801, 8913, 8656, 9115, 8921, 8699, 8823, 8912, 8766, 9102, 8869]
Test partition sizes: [1140, 1158, 1127, 1158, 1134, 1145, 1145, 1127, 1136, 1128, 1144, 1125, 1152, 1160, 1124, 1145, 1154, 1131, 1157, 1141]
  Client 0: 8843 train samples, 2 unique classes
  Client 1: 8998 train samples, 2 unique classes
  Client 2: 8728 train samples, 2 unique classes
  Client 3: 9034 train samples, 2 unique classes
  Client 4: 8866 train samples, 2 unique classes
  Client 5: 8946 train samples, 2 unique classes
  Client 6: 8873 train samples, 2 unique classes
  Client 7: 8776 train samples, 2 unique classes
  Client 8: 8816 train samples, 2 unique classes
  Client 9: 8801 train samples, 2 unique classes
  Client 10: 8913 train samples, 2 unique classes
  Client 11: 8656 train samples, 2 unique classes
  Client 12: 9115 train samples, 2 unique classes
  Client 13: 8921 train samples, 2 unique classes
  Client 14: 8699 train samples, 2 unique classes
  Client 15: 8823 train samples, 2 unique classes
  Client 16: 8912 train samples, 2 unique classes
  Client 17: 8766 train samples, 2 unique classes
  Client 18: 9102 train samples, 2 unique classes
  Client 19: 8869 train samples, 2 unique classes
Will sample 4500 samples per client per epoch
Graph: erdos, nodes: 20, edges: 126
Degree statistics: avg=12.60, min=8, max=16
Attack: Compromised 10/20 nodes: [1, 2, 5, 11, 12, 13, 14, 15, 17, 18]
Attack type: gaussian, lambda: 1.0
Model variant: baseline
Model parameters: 2,219,692
UBAR ALGORITHM (Two-Stage Byzantine-resilient)
  - Model dimension: 2,219,692 parameters
  - Rho parameter: 0.5
  - Stage 1: Distance-based filtering (select 50% closest neighbors)
  - Stage 2: Performance-based selection (loss comparison)
  - Complexity: O(deg(i)×d + deg(i)×inference)
Initial test acc across nodes: mean=0.4978 ± 0.0208
Round 001: test acc mean=0.6388 ± 0.0476 | min=0.5625 max=0.7197
         : test loss mean=0.6762 ± 0.0072
         : individual accs = ['0.625439', '0.645078', '0.608696', '0.696028', '0.617284', '0.662009', '0.599127', '0.624667', '0.562500', '0.673759', '0.579545', '0.614222', '0.647569', '0.706034', '0.639680', '0.719651', '0.715771', '0.583554', '0.685393', '0.570552']
         : correct/total = [(713, 1140), (747, 1158), (686, 1127), (806, 1158), (700, 1134), (758, 1145), (686, 1145), (704, 1127), (639, 1136), (760, 1128), (663, 1144), (691, 1125), (746, 1152), (819, 1160), (719, 1124), (824, 1145), (826, 1154), (660, 1131), (793, 1157), (651, 1141)]
         : compromised: 0.6512, honest: 0.6265
         : ubar stats = ['Node 0: s1=0.500, s2=0.125', 'Node 1: s1=0.455, s2=0.800', 'Node 2: s1=0.500, s2=0.167']...
Round 002: test acc mean=0.6846 ± 0.0673 | min=0.5178 max=0.7657
         : test loss mean=0.6456 ± 0.0345
         : individual accs = ['0.700877', '0.676166', '0.749778', '0.730570', '0.576720', '0.558079', '0.728384', '0.682343', '0.696303', '0.692376', '0.765734', '0.722667', '0.715278', '0.587931', '0.517794', '0.677729', '0.727903', '0.723254', '0.739844', '0.723050']
         : correct/total = [(799, 1140), (783, 1158), (845, 1127), (846, 1158), (654, 1134), (639, 1145), (834, 1145), (769, 1127), (791, 1136), (781, 1128), (876, 1144), (813, 1125), (824, 1152), (682, 1160), (582, 1124), (776, 1145), (840, 1154), (818, 1131), (856, 1157), (825, 1141)]
         : compromised: 0.6669, honest: 0.7024
         : ubar stats = ['Node 0: s1=0.500, s2=0.125', 'Node 1: s1=0.455, s2=0.600', 'Node 2: s1=0.500, s2=0.167']...
Round 003: test acc mean=0.7469 ± 0.0517 | min=0.6219 max=0.8260
         : test loss mean=0.5736 ± 0.0663
         : individual accs = ['0.804386', '0.750432', '0.803904', '0.793610', '0.649912', '0.688210', '0.752838', '0.716060', '0.739437', '0.738475', '0.826049', '0.781333', '0.700521', '0.718103', '0.621886', '0.781659', '0.794627', '0.763926', '0.774417', '0.738826']
         : correct/total = [(917, 1140), (869, 1158), (906, 1127), (919, 1158), (737, 1134), (788, 1145), (862, 1145), (807, 1127), (840, 1136), (833, 1128), (945, 1144), (879, 1125), (807, 1152), (833, 1160), (699, 1124), (895, 1145), (917, 1154), (864, 1131), (896, 1157), (843, 1141)]
         : compromised: 0.7384, honest: 0.7554
         : ubar stats = ['Node 0: s1=0.500, s2=0.167', 'Node 1: s1=0.455, s2=0.600', 'Node 2: s1=0.500, s2=0.167']...
Round 004: test acc mean=0.7996 ± 0.0326 | min=0.7362 max=0.8514
         : test loss mean=0.4837 ± 0.0568
         : individual accs = ['0.850000', '0.813472', '0.849157', '0.803972', '0.761905', '0.799127', '0.736245', '0.781721', '0.828345', '0.770390', '0.851399', '0.737778', '0.788194', '0.788793', '0.788256', '0.790393', '0.815425', '0.798408', '0.802074', '0.836985']
         : correct/total = [(969, 1140), (942, 1158), (957, 1127), (931, 1158), (864, 1134), (915, 1145), (843, 1145), (881, 1127), (941, 1136), (869, 1128), (974, 1144), (830, 1125), (908, 1152), (915, 1160), (886, 1124), (905, 1145), (941, 1154), (903, 1131), (928, 1157), (955, 1141)]
         : compromised: 0.7956, honest: 0.8036
         : ubar stats = ['Node 0: s1=0.500, s2=0.156', 'Node 1: s1=0.455, s2=0.550', 'Node 2: s1=0.500, s2=0.167']...
Round 005: test acc mean=0.8448 ± 0.0232 | min=0.7921 max=0.8826
         : test loss mean=0.3676 ± 0.0312
         : individual accs = ['0.838596', '0.882556', '0.856256', '0.839378', '0.840388', '0.792140', '0.857642', '0.826974', '0.867077', '0.867908', '0.875874', '0.832000', '0.828125', '0.825862', '0.838968', '0.837555', '0.867418', '0.851459', '0.801210', '0.868536']
         : correct/total = [(956, 1140), (1022, 1158), (965, 1127), (972, 1158), (953, 1134), (907, 1145), (982, 1145), (932, 1127), (985, 1136), (979, 1128), (1002, 1144), (936, 1125), (954, 1152), (958, 1160), (943, 1124), (959, 1145), (1001, 1154), (963, 1131), (927, 1157), (991, 1141)]
         : compromised: 0.8346, honest: 0.8550
         : ubar stats = ['Node 0: s1=0.500, s2=0.300', 'Node 1: s1=0.455, s2=0.520', 'Node 2: s1=0.500, s2=0.167']...
Round 006: test acc mean=0.8727 ± 0.0115 | min=0.8507 max=0.8916
         : test loss mean=0.3037 ± 0.0170
         : individual accs = ['0.870175', '0.876511', '0.874889', '0.873057', '0.853616', '0.889083', '0.877729', '0.866016', '0.885563', '0.879433', '0.891608', '0.882667', '0.862847', '0.867241', '0.867438', '0.850655', '0.882149', '0.867374', '0.853068', '0.882559']
         : correct/total = [(992, 1140), (1015, 1158), (986, 1127), (1011, 1158), (968, 1134), (1018, 1145), (1005, 1145), (976, 1127), (1006, 1136), (992, 1128), (1020, 1144), (993, 1125), (994, 1152), (1006, 1160), (975, 1124), (974, 1145), (1018, 1154), (981, 1131), (987, 1157), (1007, 1141)]
         : compromised: 0.8692, honest: 0.8762
         : ubar stats = ['Node 0: s1=0.500, s2=0.271', 'Node 1: s1=0.455, s2=0.533', 'Node 2: s1=0.500, s2=0.222']...
Round 007: test acc mean=0.8836 ± 0.0105 | min=0.8594 max=0.8981
         : test loss mean=0.2808 ± 0.0172
         : individual accs = ['0.885965', '0.898100', '0.881100', '0.866149', '0.873898', '0.895197', '0.882096', '0.892635', '0.889965', '0.890957', '0.889860', '0.891556', '0.878472', '0.892241', '0.872776', '0.859389', '0.892548', '0.880637', '0.868626', '0.890447']
         : correct/total = [(1010, 1140), (1040, 1158), (993, 1127), (1003, 1158), (991, 1134), (1025, 1145), (1010, 1145), (1006, 1127), (1011, 1136), (1005, 1128), (1018, 1144), (1003, 1125), (1012, 1152), (1035, 1160), (981, 1124), (984, 1145), (1030, 1154), (996, 1131), (1005, 1157), (1016, 1141)]
         : compromised: 0.8818, honest: 0.8855
         : ubar stats = ['Node 0: s1=0.500, s2=0.286', 'Node 1: s1=0.455, s2=0.571', 'Node 2: s1=0.500, s2=0.214']...
Round 008: test acc mean=0.8890 ± 0.0089 | min=0.8690 max=0.9039
         : test loss mean=0.2693 ± 0.0147
         : individual accs = ['0.887719', '0.892055', '0.884650', '0.879102', '0.886243', '0.903057', '0.890830', '0.893523', '0.885563', '0.892730', '0.896853', '0.900444', '0.890625', '0.891379', '0.903915', '0.868996', '0.894281', '0.877984', '0.874676', '0.885188']
         : correct/total = [(1012, 1140), (1033, 1158), (997, 1127), (1018, 1158), (1005, 1134), (1034, 1145), (1020, 1145), (1007, 1127), (1006, 1136), (1007, 1128), (1026, 1144), (1013, 1125), (1026, 1152), (1034, 1160), (1016, 1124), (995, 1145), (1032, 1154), (993, 1131), (1012, 1157), (1010, 1141)]
         : compromised: 0.8888, honest: 0.8892
         : ubar stats = ['Node 0: s1=0.500, s2=0.266', 'Node 1: s1=0.455, s2=0.600', 'Node 2: s1=0.500, s2=0.271']...
Round 009: test acc mean=0.8944 ± 0.0113 | min=0.8600 max=0.9138
         : test loss mean=0.2577 ± 0.0175
         : individual accs = ['0.903509', '0.897237', '0.880213', '0.896373', '0.896825', '0.904803', '0.896943', '0.902396', '0.902289', '0.894504', '0.901224', '0.913778', '0.896701', '0.893966', '0.899466', '0.881223', '0.889081', '0.881521', '0.859983', '0.895706']
         : correct/total = [(1030, 1140), (1039, 1158), (992, 1127), (1038, 1158), (1017, 1134), (1036, 1145), (1027, 1145), (1017, 1127), (1025, 1136), (1009, 1128), (1031, 1144), (1028, 1125), (1033, 1152), (1037, 1160), (1011, 1124), (1009, 1145), (1026, 1154), (997, 1131), (995, 1157), (1022, 1141)]
         : compromised: 0.8909, honest: 0.8979
         : ubar stats = ['Node 0: s1=0.500, s2=0.250', 'Node 1: s1=0.455, s2=0.622', 'Node 2: s1=0.500, s2=0.296']...
Round 010: test acc mean=0.8974 ± 0.0091 | min=0.8755 max=0.9096
         : test loss mean=0.2505 ± 0.0167
         : individual accs = ['0.903509', '0.900691', '0.881100', '0.908463', '0.894180', '0.904803', '0.894323', '0.902396', '0.896127', '0.909574', '0.902972', '0.901333', '0.904514', '0.900862', '0.901246', '0.889083', '0.902080', '0.881521', '0.875540', '0.893953']
         : correct/total = [(1030, 1140), (1043, 1158), (993, 1127), (1052, 1158), (1014, 1134), (1036, 1145), (1024, 1145), (1017, 1127), (1018, 1136), (1026, 1128), (1033, 1144), (1014, 1125), (1042, 1152), (1045, 1160), (1013, 1124), (1018, 1145), (1041, 1154), (997, 1131), (1013, 1157), (1020, 1141)]
         : compromised: 0.8941, honest: 0.9008
         : ubar stats = ['Node 0: s1=0.500, s2=0.237', 'Node 1: s1=0.455, s2=0.580', 'Node 2: s1=0.500, s2=0.283']...

=== FINAL RESULTS ===
Dataset: celeba, Nodes: 20, Graph: erdos, Aggregation: ubar
Attack: gaussian, 50.0% compromised
Final accuracy - Compromised: 0.8941, Honest: 0.9008
Overall test accuracy: mean=0.8974 ± 0.0091

=== UBAR SUMMARY ===
Node 0: stage1=0.500, stage2=0.237, overall=0.119
Node 1: stage1=0.455, stage2=0.580, overall=0.264
Node 2: stage1=0.500, stage2=0.283, overall=0.142
Node 3: stage1=0.500, stage2=0.400, overall=0.200
Node 4: stage1=0.455, stage2=0.560, overall=0.255
Node 5: stage1=0.467, stage2=0.643, overall=0.300
Node 6: stage1=0.500, stage2=0.286, overall=0.143
Node 7: stage1=0.500, stage2=0.557, overall=0.279
Node 8: stage1=0.500, stage2=0.400, overall=0.200
Node 9: stage1=0.462, stage2=0.500, overall=0.231
Node 10: stage1=0.444, stage2=0.300, overall=0.133
Node 11: stage1=0.500, stage2=0.314, overall=0.157
Node 12: stage1=0.500, stage2=0.683, overall=0.342
Node 13: stage1=0.462, stage2=0.533, overall=0.246
Node 14: stage1=0.467, stage2=0.543, overall=0.253
Node 15: stage1=0.455, stage2=0.360, overall=0.164
Node 16: stage1=0.462, stage2=0.250, overall=0.115
Node 17: stage1=0.444, stage2=0.300, overall=0.133
Node 18: stage1=0.500, stage2=0.475, overall=0.237
Node 19: stage1=0.500, stage2=0.250, overall=0.125

=== PARALLEL EXECUTION TIME (realistic for distributed system) ===
  COMMUNICATION (max across nodes):
    - Full model transfer: 0.000s (0.0%)
  COMPUTATION (max across nodes):
    - Distance computation: 0.045s (17.7%)
    - Loss computation: 0.205s (80.1%)
    - Aggregation: 0.006s (2.2%)
  TOTALS:
    - Total computation: 0.256s (100.0%)
    - Total communication: 0.000s (0.0%)
    - Total parallel time: 0.256s

=== PER-NODE AVERAGE TIME ===
  - Distance computation: 0.032s
  - Loss computation: 0.168s
  - Aggregation: 0.004s
  - Model transfer: 0.000s
  - Total per node: 0.203s

=== TOTAL COMPUTATIONAL WORK (sum across all nodes) ===
  - Total distance computation: 0.633s
  - Total loss computation: 3.354s
  - Total aggregation: 0.080s
  - Total model transfer: 0.000s
  - Grand total: 4.066s
  - Mean Stage 1 acceptance rate: 0.479
  - Mean Stage 2 acceptance rate: 0.423
  - Overall acceptance rate: 0.202

UBAR Algorithm Properties:
  - Model dimension: 2,219,692
  - Rho parameter: 0.5
  - Two-stage approach: Distance filtering + loss evaluation
  - Stage 1 selects: 50% of neighbors
  - Stage 2 uses: Training sample loss comparison
  - Theoretical complexity: O(deg(i)×d + deg(i)×inference)
  - Approach: UBAR paper implementation
