Device: cuda
Seed: 987654321
Looking for images in: /home/student.unimelb.edu.au/mrangwala/Projects/Sketchguard/leaf/data/celeba/data/raw/img_align_celeba
Loading 1 LEAF CelebA train files...
LEAF CelebA train: 9343 users (celebrities), 177457 samples
Looking for images in: /home/student.unimelb.edu.au/mrangwala/Projects/Sketchguard/leaf/data/celeba/data/raw/img_align_celeba
Loading 1 LEAF CelebA test files...
LEAF CelebA test: 9343 users (celebrities), 22831 samples
Found 9343 train users, 9343 test users, 9343 common users
User sample counts range: 31 (max) to 4 (min)
Distributed ALL 9343 users across 20 clients
Users per client: 467 (with 3 clients getting +1 user)
Train partition sizes: [8843, 8998, 8728, 9034, 8866, 8946, 8873, 8776, 8816, 8801, 8913, 8656, 9115, 8921, 8699, 8823, 8912, 8766, 9102, 8869]
Test partition sizes: [1140, 1158, 1127, 1158, 1134, 1145, 1145, 1127, 1136, 1128, 1144, 1125, 1152, 1160, 1124, 1145, 1154, 1131, 1157, 1141]
  Client 0: 8843 train samples, 2 unique classes
  Client 1: 8998 train samples, 2 unique classes
  Client 2: 8728 train samples, 2 unique classes
  Client 3: 9034 train samples, 2 unique classes
  Client 4: 8866 train samples, 2 unique classes
  Client 5: 8946 train samples, 2 unique classes
  Client 6: 8873 train samples, 2 unique classes
  Client 7: 8776 train samples, 2 unique classes
  Client 8: 8816 train samples, 2 unique classes
  Client 9: 8801 train samples, 2 unique classes
  Client 10: 8913 train samples, 2 unique classes
  Client 11: 8656 train samples, 2 unique classes
  Client 12: 9115 train samples, 2 unique classes
  Client 13: 8921 train samples, 2 unique classes
  Client 14: 8699 train samples, 2 unique classes
  Client 15: 8823 train samples, 2 unique classes
  Client 16: 8912 train samples, 2 unique classes
  Client 17: 8766 train samples, 2 unique classes
  Client 18: 9102 train samples, 2 unique classes
  Client 19: 8869 train samples, 2 unique classes
Will sample 4500 samples per client per epoch
Graph: erdos, nodes: 20, edges: 126
Degree statistics: avg=12.60, min=8, max=16
Attack: Compromised 6/20 nodes: [5, 12, 13, 14, 17, 18]
Attack type: directed_deviation, lambda: 1.0
Model variant: baseline
Model parameters: 2,219,692
BALANCE algorithm:
Balance Config: BALANCEConfig(gamma=2, kappa=1, alpha=0.5, min_neighbors=1)
  - Model dimension: 2,219,692 parameters
  - Complexity: O(N×d) = O(20×2,219,692)
Initial test acc across nodes: mean=0.4978 ± 0.0208
Round 001: test acc mean=0.6836 ± 0.0431 | min=0.5794 max=0.7269
         : test loss mean=0.6807 ± 0.0035
         : individual accs = ['0.709649', '0.678756', '0.625555', '0.719344', '0.579365', '0.703057', '0.702183', '0.600710', '0.628521', '0.709220', '0.668706', '0.720889', '0.721354', '0.705172', '0.661922', '0.726638', '0.719237', '0.701149', '0.726880', '0.664330']
         : correct/total = [(809, 1140), (786, 1158), (705, 1127), (833, 1158), (657, 1134), (805, 1145), (804, 1145), (677, 1127), (714, 1136), (800, 1128), (765, 1144), (811, 1125), (831, 1152), (818, 1160), (744, 1124), (832, 1145), (830, 1154), (793, 1131), (841, 1157), (758, 1141)]
         : compromised: 0.7033, honest: 0.6752
Round 002: test acc mean=0.6472 ± 0.0538 | min=0.5214 max=0.7179
         : test loss mean=0.6756 ± 0.0065
         : individual accs = ['0.647368', '0.659758', '0.660160', '0.638169', '0.530864', '0.533624', '0.662009', '0.646850', '0.673415', '0.644504', '0.670455', '0.658667', '0.717882', '0.652586', '0.521352', '0.690830', '0.697574', '0.655172', '0.701815', '0.680982']
         : correct/total = [(738, 1140), (764, 1158), (744, 1127), (739, 1158), (602, 1134), (611, 1145), (758, 1145), (729, 1127), (765, 1136), (727, 1128), (767, 1144), (741, 1125), (827, 1152), (757, 1160), (586, 1124), (791, 1145), (805, 1154), (741, 1131), (812, 1157), (777, 1141)]
         : compromised: 0.6304, honest: 0.6544
Round 003: test acc mean=0.6623 ± 0.0444 | min=0.5178 max=0.7132
         : test loss mean=0.6586 ± 0.0114
         : individual accs = ['0.634211', '0.673575', '0.688554', '0.695164', '0.634921', '0.579913', '0.651528', '0.670807', '0.710387', '0.691489', '0.672203', '0.684444', '0.649306', '0.682759', '0.517794', '0.682969', '0.713172', '0.651636', '0.685393', '0.674847']
         : correct/total = [(723, 1140), (780, 1158), (776, 1127), (805, 1158), (720, 1134), (664, 1145), (746, 1145), (756, 1127), (807, 1136), (780, 1128), (769, 1144), (770, 1125), (748, 1152), (792, 1160), (582, 1124), (782, 1145), (823, 1154), (737, 1131), (793, 1157), (770, 1141)]
         : compromised: 0.6278, honest: 0.6770
Round 004: test acc mean=0.7100 ± 0.0242 | min=0.6557 max=0.7452
         : test loss mean=0.6066 ± 0.0150
         : individual accs = ['0.700000', '0.709845', '0.718722', '0.736615', '0.690476', '0.701310', '0.718777', '0.683230', '0.720070', '0.727837', '0.743007', '0.744889', '0.697049', '0.715517', '0.655694', '0.726638', '0.745234', '0.709991', '0.684529', '0.671341']
         : correct/total = [(798, 1140), (822, 1158), (810, 1127), (853, 1158), (783, 1134), (803, 1145), (823, 1145), (770, 1127), (818, 1136), (821, 1128), (850, 1144), (838, 1125), (803, 1152), (830, 1160), (737, 1124), (832, 1145), (860, 1154), (803, 1131), (792, 1157), (766, 1141)]
         : compromised: 0.6940, honest: 0.7169
Round 005: test acc mean=0.7596 ± 0.0158 | min=0.7214 max=0.7831
         : test loss mean=0.5244 ± 0.0177
         : individual accs = ['0.753509', '0.768566', '0.721384', '0.764249', '0.763668', '0.758952', '0.779913', '0.752440', '0.759683', '0.782801', '0.779720', '0.783111', '0.742188', '0.756034', '0.750890', '0.758952', '0.774697', '0.762157', '0.738980', '0.739702']
         : correct/total = [(859, 1140), (890, 1158), (813, 1127), (885, 1158), (866, 1134), (869, 1145), (893, 1145), (848, 1127), (863, 1136), (883, 1128), (892, 1144), (881, 1125), (855, 1152), (877, 1160), (844, 1124), (869, 1145), (894, 1154), (862, 1131), (855, 1157), (844, 1141)]
         : compromised: 0.7515, honest: 0.7630
Round 006: test acc mean=0.7961 ± 0.0166 | min=0.7666 max=0.8260
         : test loss mean=0.4529 ± 0.0191
         : individual accs = ['0.781579', '0.821244', '0.806566', '0.800518', '0.789242', '0.815721', '0.796507', '0.766637', '0.797535', '0.821809', '0.826049', '0.808000', '0.794271', '0.788793', '0.767794', '0.793013', '0.789428', '0.792219', '0.770959', '0.793164']
         : correct/total = [(891, 1140), (951, 1158), (909, 1127), (927, 1158), (895, 1134), (934, 1145), (912, 1145), (864, 1127), (906, 1136), (927, 1128), (945, 1144), (909, 1125), (915, 1152), (915, 1160), (863, 1124), (908, 1145), (911, 1154), (896, 1131), (892, 1157), (905, 1141)]
         : compromised: 0.7883, honest: 0.7994
Round 007: test acc mean=0.8351 ± 0.0148 | min=0.8021 max=0.8590
         : test loss mean=0.3793 ± 0.0170
         : individual accs = ['0.832456', '0.857513', '0.839397', '0.827288', '0.826279', '0.841921', '0.840175', '0.827862', '0.840669', '0.859043', '0.855769', '0.851556', '0.817708', '0.834483', '0.822954', '0.814847', '0.841421', '0.822281', '0.802074', '0.845749']
         : correct/total = [(949, 1140), (993, 1158), (946, 1127), (958, 1158), (937, 1134), (964, 1145), (962, 1145), (933, 1127), (955, 1136), (969, 1128), (979, 1144), (958, 1125), (942, 1152), (968, 1160), (925, 1124), (933, 1145), (971, 1154), (930, 1131), (928, 1157), (965, 1141)]
         : compromised: 0.8236, honest: 0.8400
Round 008: test acc mean=0.8610 ± 0.0133 | min=0.8306 max=0.8836
         : test loss mean=0.3300 ± 0.0166
         : individual accs = ['0.853509', '0.881693', '0.866016', '0.848877', '0.847443', '0.878603', '0.862009', '0.859805', '0.855634', '0.869681', '0.862762', '0.883556', '0.857639', '0.870690', '0.872776', '0.848035', '0.871750', '0.843501', '0.830596', '0.856266']
         : correct/total = [(973, 1140), (1021, 1158), (976, 1127), (983, 1158), (961, 1134), (1006, 1145), (987, 1145), (969, 1127), (972, 1136), (981, 1128), (987, 1144), (994, 1125), (988, 1152), (1010, 1160), (981, 1124), (971, 1145), (1006, 1154), (954, 1131), (961, 1157), (977, 1141)]
         : compromised: 0.8590, honest: 0.8619
Round 009: test acc mean=0.8753 ± 0.0128 | min=0.8418 max=0.8925
         : test loss mean=0.2983 ± 0.0195
         : individual accs = ['0.871053', '0.891192', '0.866016', '0.881693', '0.862434', '0.885590', '0.884716', '0.879326', '0.875000', '0.886525', '0.892483', '0.892444', '0.870660', '0.870690', '0.879004', '0.862009', '0.876950', '0.854996', '0.841832', '0.880806']
         : correct/total = [(993, 1140), (1032, 1158), (976, 1127), (1021, 1158), (978, 1134), (1014, 1145), (1013, 1145), (991, 1127), (994, 1136), (1000, 1128), (1021, 1144), (1004, 1125), (1003, 1152), (1010, 1160), (988, 1124), (987, 1145), (1012, 1154), (967, 1131), (974, 1157), (1005, 1141)]
         : compromised: 0.8671, honest: 0.8788
Round 010: test acc mean=0.8849 ± 0.0092 | min=0.8660 max=0.8980
         : test loss mean=0.2783 ± 0.0154
         : individual accs = ['0.878947', '0.889465', '0.878438', '0.891192', '0.880071', '0.895197', '0.889956', '0.889086', '0.881162', '0.898050', '0.888112', '0.896000', '0.880208', '0.893966', '0.892349', '0.868122', '0.887348', '0.869142', '0.866033', '0.886065']
         : correct/total = [(1002, 1140), (1030, 1158), (990, 1127), (1032, 1158), (998, 1134), (1025, 1145), (1019, 1145), (1002, 1127), (1001, 1136), (1013, 1128), (1016, 1144), (1008, 1125), (1014, 1152), (1037, 1160), (1003, 1124), (994, 1145), (1024, 1154), (983, 1131), (1002, 1157), (1011, 1141)]
         : compromised: 0.8828, honest: 0.8859

=== FINAL RESULTS ===
Dataset: celeba, Nodes: 20, Graph: erdos, Aggregation: balance
Attack: directed_deviation, 30.0% compromised
Final accuracy - Compromised: 0.8828, Honest: 0.8859
Overall test accuracy: mean=0.8849 ± 0.0092

=== BALANCE SUMMARY ===
Node 0: acceptance=0.688
Node 1: acceptance=0.818
Node 2: acceptance=0.667
Node 3: acceptance=0.750
Node 4: acceptance=0.727
Node 5: acceptance=0.667
Node 6: acceptance=0.571
Node 7: acceptance=0.643
Node 8: acceptance=0.500
Node 9: acceptance=0.769
Node 10: acceptance=0.667
Node 11: acceptance=0.643
Node 12: acceptance=0.750
Node 13: acceptance=0.769
Node 14: acceptance=0.667
Node 15: acceptance=0.636
Node 16: acceptance=0.615
Node 17: acceptance=0.778
Node 18: acceptance=0.750
Node 19: acceptance=0.625

=== PARALLEL EXECUTION TIME (realistic for distributed system) ===
  COMMUNICATION (max across nodes):
    - Full model transfer: 0.000s (0.0%)
  COMPUTATION (max across nodes):
    - Filtering: 0.044s (76.9%)
    - Aggregation: 0.013s (23.0%)
  TOTALS:
    - Total computation: 0.057s (100.0%)
    - Total communication: 0.000s (0.0%)
    - Total parallel time: 0.057s

=== PER-NODE AVERAGE TIME ===
  - Filtering: 0.033s
  - Aggregation: 0.006s
  - Model transfer: 0.000s
  - Total per node: 0.039s

=== TOTAL COMPUTATIONAL WORK (sum across all nodes) ===
  - Total filtering: 0.667s
  - Total aggregation: 0.116s
  - Total model transfer: 0.000s
  - Grand total: 0.782s
  - Mean acceptance rate: 0.685

BALANCE Algorithm Properties:
  - Model dimension: 2,219,692
  - No compression: Full parameter comparison
  - Theoretical complexity: O(deg(i)×d)
  - Approach: Full parameter filtering + averaging
