Device: cuda
Seed: 987654321
Looking for images in: /home/student.unimelb.edu.au/mrangwala/Projects/Sketchguard/leaf/data/celeba/data/raw/img_align_celeba
Loading 1 LEAF CelebA train files...
LEAF CelebA train: 9343 users (celebrities), 177457 samples
Looking for images in: /home/student.unimelb.edu.au/mrangwala/Projects/Sketchguard/leaf/data/celeba/data/raw/img_align_celeba
Loading 1 LEAF CelebA test files...
LEAF CelebA test: 9343 users (celebrities), 22831 samples
Found 9343 train users, 9343 test users, 9343 common users
User sample counts range: 31 (max) to 4 (min)
Distributed ALL 9343 users across 20 clients
Users per client: 467 (with 3 clients getting +1 user)
Train partition sizes: [8843, 8998, 8728, 9034, 8866, 8946, 8873, 8776, 8816, 8801, 8913, 8656, 9115, 8921, 8699, 8823, 8912, 8766, 9102, 8869]
Test partition sizes: [1140, 1158, 1127, 1158, 1134, 1145, 1145, 1127, 1136, 1128, 1144, 1125, 1152, 1160, 1124, 1145, 1154, 1131, 1157, 1141]
  Client 0: 8843 train samples, 2 unique classes
  Client 1: 8998 train samples, 2 unique classes
  Client 2: 8728 train samples, 2 unique classes
  Client 3: 9034 train samples, 2 unique classes
  Client 4: 8866 train samples, 2 unique classes
  Client 5: 8946 train samples, 2 unique classes
  Client 6: 8873 train samples, 2 unique classes
  Client 7: 8776 train samples, 2 unique classes
  Client 8: 8816 train samples, 2 unique classes
  Client 9: 8801 train samples, 2 unique classes
  Client 10: 8913 train samples, 2 unique classes
  Client 11: 8656 train samples, 2 unique classes
  Client 12: 9115 train samples, 2 unique classes
  Client 13: 8921 train samples, 2 unique classes
  Client 14: 8699 train samples, 2 unique classes
  Client 15: 8823 train samples, 2 unique classes
  Client 16: 8912 train samples, 2 unique classes
  Client 17: 8766 train samples, 2 unique classes
  Client 18: 9102 train samples, 2 unique classes
  Client 19: 8869 train samples, 2 unique classes
Will sample 4500 samples per client per epoch
Graph: erdos, nodes: 20, edges: 48
Degree statistics: avg=4.80, min=2, max=7
Attack: Compromised 12/20 nodes: [1, 2, 3, 5, 8, 11, 12, 13, 14, 15, 17, 18]
Attack type: backdoor, lambda: 1.0
Backdoor target label: 0, trigger size: 8
Model variant: baseline
Model parameters: 2,219,692
UBAR ALGORITHM (Two-Stage Byzantine-resilient)
  - Model dimension: 2,219,692 parameters
  - Rho parameter: 0.4
  - Stage 1: Distance-based filtering (select 40% closest neighbors)
  - Stage 2: Performance-based selection (loss comparison)
  - Complexity: O(deg(i)×d + deg(i)×inference)
Initial test acc across nodes: mean=0.4978 ± 0.0208
Backdoor attack: Created poisoned datasets for 12 compromised nodes
Round 001: test acc mean=0.5574 ± 0.0629 | min=0.4942 max=0.7158
         : test loss mean=3534.3259 ± 4857.3642
         : individual accs = ['0.664035', '0.508636', '0.494232', '0.536269', '0.571429', '0.514410', '0.643668', '0.612245', '0.562500', '0.655142', '0.530594', '0.519111', '0.522569', '0.506897', '0.517794', '0.521397', '0.715771', '0.508400', '0.522040', '0.521472']
         : correct/total = [(757, 1140), (589, 1158), (557, 1127), (621, 1158), (648, 1134), (589, 1145), (737, 1145), (690, 1127), (639, 1136), (739, 1128), (607, 1144), (584, 1125), (602, 1152), (588, 1160), (582, 1124), (597, 1145), (826, 1154), (575, 1131), (604, 1157), (595, 1141)]
         : compromised: 0.5195, honest: 0.6143
         : ubar stats = ['Node 0: s1=0.333, s2=0.500', 'Node 1: s1=0.333, s2=1.000', 'Node 2: s1=0.400, s2=1.000']...
Round 002: test acc mean=0.6060 ± 0.1230 | min=0.4524 max=0.7828
         : test loss mean=nan ± nan
         : individual accs = ['0.750000', '0.490501', '0.492458', '0.526770', '0.690476', '0.514410', '0.765066', '0.736469', '0.552817', '0.782801', '0.771853', '0.498667', '0.516493', '0.506897', '0.517794', '0.452402', '0.769497', '0.503979', '0.518583', '0.762489']
         : correct/total = [(855, 1140), (568, 1158), (555, 1127), (610, 1158), (783, 1134), (589, 1145), (876, 1145), (830, 1127), (628, 1136), (883, 1128), (883, 1144), (561, 1125), (595, 1152), (588, 1160), (582, 1124), (518, 1145), (888, 1154), (570, 1131), (600, 1157), (870, 1141)]
         : compromised: 0.5076, honest: 0.7536
         : ubar stats = ['Node 0: s1=0.333, s2=0.500', 'Node 1: s1=0.333, s2=1.000', 'Node 2: s1=0.400, s2=1.000']...
Round 003: test acc mean=0.6462 ± 0.1595 | min=0.4933 max=0.8593
         : test loss mean=nan ± nan
         : individual accs = ['0.854386', '0.508636', '0.493345', '0.528497', '0.804233', '0.514410', '0.847162', '0.815439', '0.562500', '0.854610', '0.859266', '0.498667', '0.522569', '0.506897', '0.517794', '0.517031', '0.842288', '0.508400', '0.522040', '0.844873']
         : correct/total = [(974, 1140), (589, 1158), (556, 1127), (612, 1158), (912, 1134), (589, 1145), (970, 1145), (919, 1127), (639, 1136), (964, 1128), (983, 1144), (561, 1125), (602, 1152), (588, 1160), (582, 1124), (592, 1145), (972, 1154), (575, 1131), (604, 1157), (964, 1141)]
         : compromised: 0.5167, honest: 0.8403
         : ubar stats = ['Node 0: s1=0.333, s2=0.500', 'Node 1: s1=0.333, s2=0.833', 'Node 2: s1=0.400, s2=0.833']...
Round 004: test acc mean=0.6581 ± 0.1738 | min=0.4933 max=0.8864
         : test loss mean=nan ± nan
         : individual accs = ['0.871930', '0.508636', '0.493345', '0.528497', '0.847443', '0.514410', '0.869869', '0.857143', '0.562500', '0.881206', '0.886364', '0.498667', '0.522569', '0.506897', '0.517794', '0.517031', '0.875217', '0.508400', '0.522040', '0.872918']
         : correct/total = [(994, 1140), (589, 1158), (556, 1127), (612, 1158), (961, 1134), (589, 1145), (996, 1145), (966, 1127), (639, 1136), (994, 1128), (1014, 1144), (561, 1125), (602, 1152), (588, 1160), (582, 1124), (592, 1145), (1010, 1154), (575, 1131), (604, 1157), (996, 1141)]
         : compromised: 0.5167, honest: 0.8703
         : ubar stats = ['Node 0: s1=0.333, s2=0.500', 'Node 1: s1=0.333, s2=0.750', 'Node 2: s1=0.400, s2=0.750']...
Round 005: test acc mean=0.6606 ± 0.1768 | min=0.4933 max=0.8901
         : test loss mean=nan ± nan
         : individual accs = ['0.864035', '0.508636', '0.493345', '0.528497', '0.859788', '0.514410', '0.877729', '0.865129', '0.562500', '0.890071', '0.889860', '0.498667', '0.522569', '0.506897', '0.517794', '0.517031', '0.886482', '0.508400', '0.522040', '0.877301']
         : correct/total = [(985, 1140), (589, 1158), (556, 1127), (612, 1158), (975, 1134), (589, 1145), (1005, 1145), (975, 1127), (639, 1136), (1004, 1128), (1018, 1144), (561, 1125), (602, 1152), (588, 1160), (582, 1124), (592, 1145), (1023, 1154), (575, 1131), (604, 1157), (1001, 1141)]
         : compromised: 0.5167, honest: 0.8763
         : ubar stats = ['Node 0: s1=0.333, s2=0.500', 'Node 1: s1=0.333, s2=0.700', 'Node 2: s1=0.400, s2=0.700']...
Round 006: test acc mean=0.6657 ± 0.1829 | min=0.4933 max=0.8952
         : test loss mean=nan ± nan
         : individual accs = ['0.894737', '0.508636', '0.493345', '0.528497', '0.873898', '0.514410', '0.895197', '0.889086', '0.562500', '0.890957', '0.892483', '0.498667', '0.522569', '0.506897', '0.517794', '0.517031', '0.890815', '0.508400', '0.522040', '0.885188']
         : correct/total = [(1020, 1140), (589, 1158), (556, 1127), (612, 1158), (991, 1134), (589, 1145), (1025, 1145), (1002, 1127), (639, 1136), (1005, 1128), (1021, 1144), (561, 1125), (602, 1152), (588, 1160), (582, 1124), (592, 1145), (1028, 1154), (575, 1131), (604, 1157), (1010, 1141)]
         : compromised: 0.5167, honest: 0.8890
         : ubar stats = ['Node 0: s1=0.333, s2=0.500', 'Node 1: s1=0.333, s2=0.667', 'Node 2: s1=0.400, s2=0.667']...
Round 007: test acc mean=0.6678 ± 0.1855 | min=0.4933 max=0.9009
         : test loss mean=nan ± nan
         : individual accs = ['0.900877', '0.508636', '0.493345', '0.528497', '0.875661', '0.514410', '0.896070', '0.891748', '0.562500', '0.898936', '0.900350', '0.498667', '0.522569', '0.506897', '0.517794', '0.517031', '0.898614', '0.508400', '0.522040', '0.892200']
         : correct/total = [(1027, 1140), (589, 1158), (556, 1127), (612, 1158), (993, 1134), (589, 1145), (1026, 1145), (1005, 1127), (639, 1136), (1014, 1128), (1030, 1144), (561, 1125), (602, 1152), (588, 1160), (582, 1124), (592, 1145), (1037, 1154), (575, 1131), (604, 1157), (1018, 1141)]
         : compromised: 0.5167, honest: 0.8943
         : ubar stats = ['Node 0: s1=0.333, s2=0.500', 'Node 1: s1=0.333, s2=0.643', 'Node 2: s1=0.400, s2=0.643']...
Round 008: test acc mean=0.6675 ± 0.1852 | min=0.4933 max=0.9009
         : test loss mean=nan ± nan
         : individual accs = ['0.900877', '0.508636', '0.493345', '0.528497', '0.885362', '0.514410', '0.898690', '0.896185', '0.562500', '0.894504', '0.890734', '0.498667', '0.522569', '0.506897', '0.517794', '0.517031', '0.896880', '0.508400', '0.522040', '0.886941']
         : correct/total = [(1027, 1140), (589, 1158), (556, 1127), (612, 1158), (1004, 1134), (589, 1145), (1029, 1145), (1010, 1127), (639, 1136), (1009, 1128), (1019, 1144), (561, 1125), (602, 1152), (588, 1160), (582, 1124), (592, 1145), (1035, 1154), (575, 1131), (604, 1157), (1012, 1141)]
         : compromised: 0.5167, honest: 0.8938
         : ubar stats = ['Node 0: s1=0.333, s2=0.500', 'Node 1: s1=0.333, s2=0.625', 'Node 2: s1=0.400, s2=0.625']...
Round 009: test acc mean=0.6696 ± 0.1877 | min=0.4933 max=0.9081
         : test loss mean=nan ± nan
         : individual accs = ['0.900000', '0.508636', '0.493345', '0.528497', '0.895062', '0.514410', '0.897817', '0.905058', '0.562500', '0.889184', '0.904720', '0.498667', '0.522569', '0.506897', '0.517794', '0.517031', '0.908146', '0.508400', '0.522040', '0.890447']
         : correct/total = [(1026, 1140), (589, 1158), (556, 1127), (612, 1158), (1015, 1134), (589, 1145), (1028, 1145), (1020, 1127), (639, 1136), (1003, 1128), (1035, 1144), (561, 1125), (602, 1152), (588, 1160), (582, 1124), (592, 1145), (1048, 1154), (575, 1131), (604, 1157), (1016, 1141)]
         : compromised: 0.5167, honest: 0.8988
         : ubar stats = ['Node 0: s1=0.333, s2=0.500', 'Node 1: s1=0.333, s2=0.611', 'Node 2: s1=0.400, s2=0.611']...
Round 010: test acc mean=0.6706 ± 0.1889 | min=0.4933 max=0.9073
         : test loss mean=nan ± nan
         : individual accs = ['0.906140', '0.508636', '0.493345', '0.528497', '0.896825', '0.514410', '0.900437', '0.901508', '0.562500', '0.902482', '0.904720', '0.498667', '0.522569', '0.506897', '0.517794', '0.517031', '0.907279', '0.508400', '0.522040', '0.892200']
         : correct/total = [(1033, 1140), (589, 1158), (556, 1127), (612, 1158), (1017, 1134), (589, 1145), (1031, 1145), (1016, 1127), (639, 1136), (1018, 1128), (1035, 1144), (561, 1125), (602, 1152), (588, 1160), (582, 1124), (592, 1145), (1047, 1154), (575, 1131), (604, 1157), (1018, 1141)]
         : compromised: 0.5167, honest: 0.9014
         : ubar stats = ['Node 0: s1=0.333, s2=0.500', 'Node 1: s1=0.333, s2=0.600', 'Node 2: s1=0.400, s2=0.600']...

=== FINAL RESULTS ===
Dataset: celeba, Nodes: 20, Graph: erdos, Aggregation: ubar
Attack: backdoor, 60.0% compromised
Final accuracy - Compromised: 0.5167, Honest: 0.9014
Overall test accuracy: mean=0.6706 ± 0.1889

=== BACKDOOR ATTACK SUCCESS RATE (ASR) ===
Target label: 0
Trigger size: 8x8
Overall ASR: 0.8190 ± 0.2221
Honest nodes ASR: 0.5475 ± 0.0222
Compromised nodes ASR: 1.0000 ± 0.0000
Note: Higher ASR indicates more successful backdoor attack

=== UBAR SUMMARY ===
Node 0: stage1=0.333, stage2=0.500, overall=0.167
Node 1: stage1=0.333, stage2=0.600, overall=0.200
Node 2: stage1=0.400, stage2=0.600, overall=0.240
Node 3: stage1=0.250, stage2=1.000, overall=0.250
Node 4: stage1=0.250, stage2=1.000, overall=0.250
Node 5: stage1=0.400, stage2=0.550, overall=0.220
Node 6: stage1=0.400, stage2=0.500, overall=0.200
Node 7: stage1=0.400, stage2=0.650, overall=0.260
Node 8: stage1=0.500, stage2=1.000, overall=0.500
Node 9: stage1=0.333, stage2=1.000, overall=0.333
Node 10: stage1=0.250, stage2=1.000, overall=0.250
Node 11: stage1=0.286, stage2=0.600, overall=0.171
Node 12: stage1=0.286, stage2=0.600, overall=0.171
Node 13: stage1=0.250, stage2=1.000, overall=0.250
Node 14: stage1=0.286, stage2=0.550, overall=0.157
Node 15: stage1=0.333, stage2=0.600, overall=0.200
Node 16: stage1=0.400, stage2=0.500, overall=0.200
Node 17: stage1=0.400, stage2=0.600, overall=0.240
Node 18: stage1=0.250, stage2=1.000, overall=0.250
Node 19: stage1=0.500, stage2=1.000, overall=0.500

=== PARALLEL EXECUTION TIME (realistic for distributed system) ===
  COMMUNICATION (max across nodes):
    - Full model transfer: 0.000s (0.0%)
  COMPUTATION (max across nodes):
    - Distance computation: 0.019s (10.0%)
    - Loss computation: 0.171s (88.1%)
    - Aggregation: 0.004s (1.9%)
  TOTALS:
    - Total computation: 0.194s (100.0%)
    - Total communication: 0.000s (0.0%)
    - Total parallel time: 0.194s

=== PER-NODE AVERAGE TIME ===
  - Distance computation: 0.013s
  - Loss computation: 0.128s
  - Aggregation: 0.003s
  - Model transfer: 0.000s
  - Total per node: 0.143s

=== TOTAL COMPUTATIONAL WORK (sum across all nodes) ===
  - Total distance computation: 0.255s
  - Total loss computation: 2.550s
  - Total aggregation: 0.051s
  - Total model transfer: 0.000s
  - Grand total: 2.856s
  - Mean Stage 1 acceptance rate: 0.342
  - Mean Stage 2 acceptance rate: 0.742
  - Overall acceptance rate: 0.254

UBAR Algorithm Properties:
  - Model dimension: 2,219,692
  - Rho parameter: 0.4
  - Two-stage approach: Distance filtering + loss evaluation
  - Stage 1 selects: 40% of neighbors
  - Stage 2 uses: Training sample loss comparison
  - Theoretical complexity: O(deg(i)×d + deg(i)×inference)
  - Approach: UBAR paper implementation
