Device: cuda
Seed: 987654321
Looking for images in: /home/student.unimelb.edu.au/mrangwala/Projects/Sketchguard/leaf/data/celeba/data/raw/img_align_celeba
Loading 1 LEAF CelebA train files...
LEAF CelebA train: 9343 users (celebrities), 177457 samples
Looking for images in: /home/student.unimelb.edu.au/mrangwala/Projects/Sketchguard/leaf/data/celeba/data/raw/img_align_celeba
Loading 1 LEAF CelebA test files...
LEAF CelebA test: 9343 users (celebrities), 22831 samples
Found 9343 train users, 9343 test users, 9343 common users
User sample counts range: 31 (max) to 4 (min)
Distributed ALL 9343 users across 20 clients
Users per client: 467 (with 3 clients getting +1 user)
Train partition sizes: [8843, 8998, 8728, 9034, 8866, 8946, 8873, 8776, 8816, 8801, 8913, 8656, 9115, 8921, 8699, 8823, 8912, 8766, 9102, 8869]
Test partition sizes: [1140, 1158, 1127, 1158, 1134, 1145, 1145, 1127, 1136, 1128, 1144, 1125, 1152, 1160, 1124, 1145, 1154, 1131, 1157, 1141]
  Client 0: 8843 train samples, 2 unique classes
  Client 1: 8998 train samples, 2 unique classes
  Client 2: 8728 train samples, 2 unique classes
  Client 3: 9034 train samples, 2 unique classes
  Client 4: 8866 train samples, 2 unique classes
  Client 5: 8946 train samples, 2 unique classes
  Client 6: 8873 train samples, 2 unique classes
  Client 7: 8776 train samples, 2 unique classes
  Client 8: 8816 train samples, 2 unique classes
  Client 9: 8801 train samples, 2 unique classes
  Client 10: 8913 train samples, 2 unique classes
  Client 11: 8656 train samples, 2 unique classes
  Client 12: 9115 train samples, 2 unique classes
  Client 13: 8921 train samples, 2 unique classes
  Client 14: 8699 train samples, 2 unique classes
  Client 15: 8823 train samples, 2 unique classes
  Client 16: 8912 train samples, 2 unique classes
  Client 17: 8766 train samples, 2 unique classes
  Client 18: 9102 train samples, 2 unique classes
  Client 19: 8869 train samples, 2 unique classes
Will sample 4500 samples per client per epoch
Graph: fully, nodes: 20, edges: 190
Degree statistics: avg=19.00, min=19, max=19
Attack: Compromised 4/20 nodes: [5, 12, 13, 17]
Attack type: gaussian, lambda: 1.0
Model variant: baseline
Model parameters: 2,219,692
BALANCE algorithm:
Balance Config: BALANCEConfig(gamma=2, kappa=1, alpha=0.5, min_neighbors=1)
  - Model dimension: 2,219,692 parameters
  - Complexity: O(N×d) = O(20×2,219,692)
Initial test acc across nodes: mean=0.4978 ± 0.0208
Round 001: test acc mean=0.6935 ± 0.0315 | min=0.5979 max=0.7269
         : test loss mean=0.6809 ± 0.0034
         : individual accs = ['0.714035', '0.678756', '0.667258', '0.703800', '0.597884', '0.715284', '0.702183', '0.639752', '0.713028', '0.715426', '0.695804', '0.721778', '0.709201', '0.710345', '0.668149', '0.701310', '0.719237', '0.707339', '0.726880', '0.662577']
         : correct/total = [(814, 1140), (786, 1158), (752, 1127), (815, 1158), (678, 1134), (819, 1145), (804, 1145), (721, 1127), (810, 1136), (807, 1128), (796, 1144), (812, 1125), (817, 1152), (824, 1160), (751, 1124), (803, 1145), (830, 1154), (800, 1131), (841, 1157), (756, 1141)]
         : compromised: 0.7105, honest: 0.6892
Round 002: test acc mean=0.6468 ± 0.0517 | min=0.5220 max=0.7127
         : test loss mean=0.6792 ± 0.0048
         : individual accs = ['0.645614', '0.656304', '0.681455', '0.645078', '0.522046', '0.533624', '0.658515', '0.660160', '0.629401', '0.640071', '0.698427', '0.658667', '0.712674', '0.658621', '0.556940', '0.675109', '0.703640', '0.625995', '0.690579', '0.683611']
         : correct/total = [(736, 1140), (760, 1158), (768, 1127), (747, 1158), (592, 1134), (611, 1145), (754, 1145), (744, 1127), (715, 1136), (722, 1128), (799, 1144), (741, 1125), (821, 1152), (764, 1160), (626, 1124), (773, 1145), (812, 1154), (708, 1131), (799, 1157), (780, 1141)]
         : compromised: 0.6327, honest: 0.6504
Round 003: test acc mean=0.6296 ± 0.0506 | min=0.5196 max=0.6932
         : test loss mean=0.6698 ± 0.0077
         : individual accs = ['0.603509', '0.658031', '0.669920', '0.651986', '0.522046', '0.543231', '0.606987', '0.625555', '0.675176', '0.671986', '0.630245', '0.651556', '0.644965', '0.673276', '0.519573', '0.626201', '0.693241', '0.587091', '0.683665', '0.653812']
         : correct/total = [(688, 1140), (762, 1158), (755, 1127), (755, 1158), (592, 1134), (622, 1145), (695, 1145), (705, 1127), (767, 1136), (758, 1128), (721, 1144), (733, 1125), (743, 1152), (781, 1160), (584, 1124), (717, 1145), (800, 1154), (664, 1131), (791, 1157), (746, 1141)]
         : compromised: 0.6121, honest: 0.6340
Round 004: test acc mean=0.6824 ± 0.0245 | min=0.6423 max=0.7244
         : test loss mean=0.6325 ± 0.0107
         : individual accs = ['0.681579', '0.682211', '0.695652', '0.696028', '0.643739', '0.661135', '0.673362', '0.652174', '0.701585', '0.697695', '0.705420', '0.724444', '0.697049', '0.710345', '0.642349', '0.646288', '0.718371', '0.672856', '0.686258', '0.659071']
         : correct/total = [(777, 1140), (790, 1158), (784, 1127), (806, 1158), (730, 1134), (757, 1145), (771, 1145), (735, 1127), (797, 1136), (787, 1128), (807, 1144), (815, 1125), (803, 1152), (824, 1160), (722, 1124), (740, 1145), (829, 1154), (761, 1131), (794, 1157), (752, 1141)]
         : compromised: 0.6853, honest: 0.6816
Round 005: test acc mean=0.7424 ± 0.0168 | min=0.7063 max=0.7668
         : test loss mean=0.5524 ± 0.0154
         : individual accs = ['0.719298', '0.753886', '0.706300', '0.746114', '0.721340', '0.766812', '0.747598', '0.731145', '0.737676', '0.756206', '0.756119', '0.760000', '0.729167', '0.750862', '0.735765', '0.752838', '0.763432', '0.747126', '0.713915', '0.752848']
         : correct/total = [(820, 1140), (873, 1158), (796, 1127), (864, 1158), (818, 1134), (878, 1145), (856, 1145), (824, 1127), (838, 1136), (853, 1128), (865, 1144), (855, 1125), (840, 1152), (871, 1160), (827, 1124), (862, 1145), (881, 1154), (845, 1131), (826, 1157), (859, 1141)]
         : compromised: 0.7485, honest: 0.7409
Round 006: test acc mean=0.7819 ± 0.0160 | min=0.7577 max=0.8156
         : test loss mean=0.4726 ± 0.0149
         : individual accs = ['0.766667', '0.801382', '0.795918', '0.781520', '0.783069', '0.791266', '0.765066', '0.769299', '0.782570', '0.805851', '0.815559', '0.806222', '0.785590', '0.768103', '0.773132', '0.772926', '0.764298', '0.757737', '0.766638', '0.785276']
         : correct/total = [(874, 1140), (928, 1158), (897, 1127), (905, 1158), (888, 1134), (906, 1145), (876, 1145), (867, 1127), (889, 1136), (909, 1128), (933, 1144), (907, 1125), (905, 1152), (891, 1160), (869, 1124), (885, 1145), (882, 1154), (857, 1131), (887, 1157), (896, 1141)]
         : compromised: 0.7757, honest: 0.7835
Round 007: test acc mean=0.8240 ± 0.0153 | min=0.7908 max=0.8471
         : test loss mean=0.3990 ± 0.0168
         : individual accs = ['0.819298', '0.845423', '0.827862', '0.818653', '0.809524', '0.841921', '0.830568', '0.815439', '0.837148', '0.842199', '0.845280', '0.847111', '0.809028', '0.825000', '0.814057', '0.806114', '0.812825', '0.812555', '0.790838', '0.829097']
         : correct/total = [(934, 1140), (979, 1158), (933, 1127), (948, 1158), (918, 1134), (964, 1145), (951, 1145), (919, 1127), (951, 1136), (950, 1128), (967, 1144), (953, 1125), (932, 1152), (957, 1160), (915, 1124), (923, 1145), (938, 1154), (919, 1131), (915, 1157), (946, 1141)]
         : compromised: 0.8221, honest: 0.8245
Round 008: test acc mean=0.8537 ± 0.0112 | min=0.8271 max=0.8716
         : test loss mean=0.3427 ± 0.0142
         : individual accs = ['0.844737', '0.866149', '0.856256', '0.848877', '0.843034', '0.871616', '0.852402', '0.853594', '0.852113', '0.860816', '0.861888', '0.871111', '0.847222', '0.868103', '0.858541', '0.841921', '0.858752', '0.839080', '0.827139', '0.850131']
         : correct/total = [(963, 1140), (1003, 1158), (965, 1127), (983, 1158), (956, 1134), (998, 1145), (976, 1145), (962, 1127), (968, 1136), (971, 1128), (986, 1144), (980, 1125), (976, 1152), (1007, 1160), (965, 1124), (964, 1145), (991, 1154), (949, 1131), (957, 1157), (970, 1141)]
         : compromised: 0.8565, honest: 0.8530
Round 009: test acc mean=0.8686 ± 0.0137 | min=0.8410 max=0.8871
         : test loss mean=0.3106 ± 0.0226
         : individual accs = ['0.870175', '0.886874', '0.850932', '0.876511', '0.854497', '0.880349', '0.878603', '0.878438', '0.869718', '0.880319', '0.883741', '0.887111', '0.861979', '0.868966', '0.864769', '0.845415', '0.867418', '0.848806', '0.840968', '0.876424']
         : correct/total = [(992, 1140), (1027, 1158), (959, 1127), (1015, 1158), (969, 1134), (1008, 1145), (1006, 1145), (990, 1127), (988, 1136), (993, 1128), (1011, 1144), (998, 1125), (993, 1152), (1008, 1160), (972, 1124), (968, 1145), (1001, 1154), (960, 1131), (973, 1157), (1000, 1141)]
         : compromised: 0.8650, honest: 0.8695
Round 010: test acc mean=0.8834 ± 0.0092 | min=0.8600 max=0.8989
         : test loss mean=0.2850 ± 0.0159
         : individual accs = ['0.879825', '0.889465', '0.874889', '0.892055', '0.875661', '0.892576', '0.884716', '0.881988', '0.883803', '0.898936', '0.888986', '0.888000', '0.881944', '0.893103', '0.890569', '0.867249', '0.883882', '0.874447', '0.859983', '0.886065']
         : correct/total = [(1003, 1140), (1030, 1158), (986, 1127), (1033, 1158), (993, 1134), (1022, 1145), (1013, 1145), (994, 1127), (1004, 1136), (1014, 1128), (1017, 1144), (999, 1125), (1016, 1152), (1036, 1160), (1001, 1124), (993, 1145), (1020, 1154), (989, 1131), (995, 1157), (1011, 1141)]
         : compromised: 0.8855, honest: 0.8829

=== FINAL RESULTS ===
Dataset: celeba, Nodes: 20, Graph: fully, Aggregation: balance
Attack: gaussian, 20.0% compromised
Final accuracy - Compromised: 0.8855, Honest: 0.8829
Overall test accuracy: mean=0.8834 ± 0.0092

=== BALANCE SUMMARY ===
Node 0: acceptance=0.789
Node 1: acceptance=0.789
Node 2: acceptance=0.789
Node 3: acceptance=0.789
Node 4: acceptance=0.789
Node 5: acceptance=0.842
Node 6: acceptance=0.789
Node 7: acceptance=0.789
Node 8: acceptance=0.789
Node 9: acceptance=0.789
Node 10: acceptance=0.789
Node 11: acceptance=0.789
Node 12: acceptance=0.842
Node 13: acceptance=0.842
Node 14: acceptance=0.789
Node 15: acceptance=0.789
Node 16: acceptance=0.789
Node 17: acceptance=0.842
Node 18: acceptance=0.789
Node 19: acceptance=0.789

=== PARALLEL EXECUTION TIME (realistic for distributed system) ===
  COMMUNICATION (max across nodes):
    - Full model transfer: 0.000s (0.0%)
  COMPUTATION (max across nodes):
    - Filtering: 0.056s (80.5%)
    - Aggregation: 0.014s (19.5%)
  TOTALS:
    - Total computation: 0.069s (100.0%)
    - Total communication: 0.000s (0.0%)
    - Total parallel time: 0.069s

=== PER-NODE AVERAGE TIME ===
  - Filtering: 0.049s
  - Aggregation: 0.008s
  - Model transfer: 0.000s
  - Total per node: 0.056s

=== TOTAL COMPUTATIONAL WORK (sum across all nodes) ===
  - Total filtering: 0.973s
  - Total aggregation: 0.157s
  - Total model transfer: 0.000s
  - Grand total: 1.130s
  - Mean acceptance rate: 0.800

BALANCE Algorithm Properties:
  - Model dimension: 2,219,692
  - No compression: Full parameter comparison
  - Theoretical complexity: O(deg(i)×d)
  - Approach: Full parameter filtering + averaging
