Device: cuda
Seed: 987654321
Looking for images in: /home/student.unimelb.edu.au/mrangwala/Projects/Sketchguard/leaf/data/celeba/data/raw/img_align_celeba
Loading 1 LEAF CelebA train files...
LEAF CelebA train: 9343 users (celebrities), 177457 samples
Looking for images in: /home/student.unimelb.edu.au/mrangwala/Projects/Sketchguard/leaf/data/celeba/data/raw/img_align_celeba
Loading 1 LEAF CelebA test files...
LEAF CelebA test: 9343 users (celebrities), 22831 samples
Found 9343 train users, 9343 test users, 9343 common users
User sample counts range: 31 (max) to 4 (min)
Distributed ALL 9343 users across 20 clients
Users per client: 467 (with 3 clients getting +1 user)
Train partition sizes: [8843, 8998, 8728, 9034, 8866, 8946, 8873, 8776, 8816, 8801, 8913, 8656, 9115, 8921, 8699, 8823, 8912, 8766, 9102, 8869]
Test partition sizes: [1140, 1158, 1127, 1158, 1134, 1145, 1145, 1127, 1136, 1128, 1144, 1125, 1152, 1160, 1124, 1145, 1154, 1131, 1157, 1141]
  Client 0: 8843 train samples, 2 unique classes
  Client 1: 8998 train samples, 2 unique classes
  Client 2: 8728 train samples, 2 unique classes
  Client 3: 9034 train samples, 2 unique classes
  Client 4: 8866 train samples, 2 unique classes
  Client 5: 8946 train samples, 2 unique classes
  Client 6: 8873 train samples, 2 unique classes
  Client 7: 8776 train samples, 2 unique classes
  Client 8: 8816 train samples, 2 unique classes
  Client 9: 8801 train samples, 2 unique classes
  Client 10: 8913 train samples, 2 unique classes
  Client 11: 8656 train samples, 2 unique classes
  Client 12: 9115 train samples, 2 unique classes
  Client 13: 8921 train samples, 2 unique classes
  Client 14: 8699 train samples, 2 unique classes
  Client 15: 8823 train samples, 2 unique classes
  Client 16: 8912 train samples, 2 unique classes
  Client 17: 8766 train samples, 2 unique classes
  Client 18: 9102 train samples, 2 unique classes
  Client 19: 8869 train samples, 2 unique classes
Will sample 4500 samples per client per epoch
Graph: erdos, nodes: 20, edges: 126
Degree statistics: avg=12.60, min=8, max=16
Attack: Compromised 12/20 nodes: [1, 2, 3, 5, 8, 11, 12, 13, 14, 15, 17, 18]
Attack type: gaussian, lambda: 1.0
Model variant: baseline
Model parameters: 2,219,692
UBAR ALGORITHM (Two-Stage Byzantine-resilient)
  - Model dimension: 2,219,692 parameters
  - Rho parameter: 0.4
  - Stage 1: Distance-based filtering (select 40% closest neighbors)
  - Stage 2: Performance-based selection (loss comparison)
  - Complexity: O(deg(i)×d + deg(i)×inference)
Initial test acc across nodes: mean=0.4978 ± 0.0208
Round 001: test acc mean=0.6396 ± 0.0448 | min=0.5629 max=0.7205
         : test loss mean=0.6762 ± 0.0079
         : individual accs = ['0.683333', '0.670121', '0.608696', '0.699482', '0.601411', '0.650655', '0.643668', '0.623780', '0.583627', '0.656028', '0.562937', '0.615111', '0.720486', '0.650862', '0.601423', '0.706550', '0.585789', '0.583554', '0.685393', '0.658195']
         : correct/total = [(779, 1140), (776, 1158), (686, 1127), (810, 1158), (682, 1134), (745, 1145), (737, 1145), (703, 1127), (663, 1136), (740, 1128), (644, 1144), (692, 1125), (830, 1152), (755, 1160), (676, 1124), (809, 1145), (676, 1154), (660, 1131), (793, 1157), (751, 1141)]
         : compromised: 0.6480, honest: 0.6269
         : ubar stats = ['Node 0: s1=0.375, s2=0.167', 'Node 1: s1=0.364, s2=0.250', 'Node 2: s1=0.333, s2=0.250']...
Round 002: test acc mean=0.6866 ± 0.0636 | min=0.5285 max=0.7507
         : test loss mean=0.6292 ± 0.0393
         : individual accs = ['0.685965', '0.706390', '0.750665', '0.716753', '0.658730', '0.531004', '0.742358', '0.664596', '0.649648', '0.721631', '0.736014', '0.626667', '0.707465', '0.650000', '0.528470', '0.738865', '0.750433', '0.732980', '0.735523', '0.697634']
         : correct/total = [(782, 1140), (818, 1158), (846, 1127), (830, 1158), (747, 1134), (608, 1145), (850, 1145), (749, 1127), (738, 1136), (814, 1128), (842, 1144), (705, 1125), (815, 1152), (754, 1160), (594, 1124), (846, 1145), (866, 1154), (829, 1131), (851, 1157), (796, 1141)]
         : compromised: 0.6729, honest: 0.7072
         : ubar stats = ['Node 0: s1=0.375, s2=0.167', 'Node 1: s1=0.364, s2=0.375', 'Node 2: s1=0.333, s2=0.250']...
Round 003: test acc mean=0.7691 ± 0.0344 | min=0.7002 max=0.8111
         : test loss mean=0.5321 ± 0.0557
         : individual accs = ['0.800000', '0.807427', '0.799468', '0.785838', '0.736332', '0.731878', '0.806114', '0.725821', '0.771127', '0.799645', '0.803322', '0.759111', '0.750868', '0.731897', '0.700178', '0.715284', '0.811092', '0.799293', '0.777874', '0.769500']
         : correct/total = [(912, 1140), (935, 1158), (901, 1127), (910, 1158), (835, 1134), (838, 1145), (923, 1145), (818, 1127), (876, 1136), (902, 1128), (919, 1144), (854, 1125), (865, 1152), (849, 1160), (787, 1124), (819, 1145), (936, 1154), (904, 1131), (900, 1157), (878, 1141)]
         : compromised: 0.7609, honest: 0.7815
         : ubar stats = ['Node 0: s1=0.375, s2=0.222', 'Node 1: s1=0.364, s2=0.333', 'Node 2: s1=0.333, s2=0.250']...
Round 004: test acc mean=0.8285 ± 0.0202 | min=0.7969 max=0.8680
         : test loss mean=0.4077 ± 0.0343
         : individual accs = ['0.842982', '0.859240', '0.840284', '0.838515', '0.807760', '0.844541', '0.855022', '0.801242', '0.841549', '0.805851', '0.868007', '0.820444', '0.796875', '0.824138', '0.804270', '0.818341', '0.818891', '0.826702', '0.810717', '0.843996']
         : correct/total = [(961, 1140), (995, 1158), (947, 1127), (971, 1158), (916, 1134), (967, 1145), (979, 1145), (903, 1127), (956, 1136), (909, 1128), (993, 1144), (923, 1125), (918, 1152), (956, 1160), (904, 1124), (937, 1145), (945, 1154), (935, 1131), (938, 1157), (963, 1141)]
         : compromised: 0.8271, honest: 0.8305
         : ubar stats = ['Node 0: s1=0.375, s2=0.208', 'Node 1: s1=0.364, s2=0.312', 'Node 2: s1=0.333, s2=0.250']...
Round 005: test acc mean=0.8577 ± 0.0186 | min=0.8090 max=0.8843
         : test loss mean=0.3351 ± 0.0263
         : individual accs = ['0.829825', '0.884283', '0.848270', '0.882556', '0.857143', '0.842795', '0.867249', '0.854481', '0.850352', '0.880319', '0.875874', '0.840889', '0.851562', '0.872414', '0.863879', '0.854148', '0.872617', '0.844385', '0.808989', '0.871166']
         : correct/total = [(946, 1140), (1024, 1158), (956, 1127), (1022, 1158), (972, 1134), (965, 1145), (993, 1145), (963, 1127), (966, 1136), (993, 1128), (1002, 1144), (946, 1125), (981, 1152), (1012, 1160), (971, 1124), (978, 1145), (1007, 1154), (955, 1131), (936, 1157), (994, 1141)]
         : compromised: 0.8537, honest: 0.8636
         : ubar stats = ['Node 0: s1=0.375, s2=0.367', 'Node 1: s1=0.364, s2=0.400', 'Node 2: s1=0.333, s2=0.250']...
Round 006: test acc mean=0.8782 ± 0.0105 | min=0.8594 max=0.8987
         : test loss mean=0.2948 ± 0.0164
         : individual accs = ['0.880702', '0.882556', '0.870453', '0.885147', '0.868607', '0.898690', '0.883843', '0.878438', '0.889085', '0.882092', '0.894231', '0.861333', '0.880208', '0.879310', '0.866548', '0.859389', '0.881282', '0.876216', '0.860847', '0.884312']
         : correct/total = [(1004, 1140), (1022, 1158), (981, 1127), (1025, 1158), (985, 1134), (1029, 1145), (1012, 1145), (990, 1127), (1010, 1136), (995, 1128), (1023, 1144), (969, 1125), (1014, 1152), (1020, 1160), (974, 1124), (984, 1145), (1017, 1154), (991, 1131), (996, 1157), (1009, 1141)]
         : compromised: 0.8758, honest: 0.8817
         : ubar stats = ['Node 0: s1=0.375, s2=0.333', 'Node 1: s1=0.364, s2=0.500', 'Node 2: s1=0.333, s2=0.250']...
Round 007: test acc mean=0.8890 ± 0.0094 | min=0.8664 max=0.9048
         : test loss mean=0.2740 ± 0.0153
         : individual accs = ['0.900000', '0.898100', '0.887311', '0.893782', '0.880071', '0.904803', '0.888210', '0.894410', '0.897007', '0.896277', '0.890734', '0.886222', '0.882812', '0.887069', '0.896797', '0.866376', '0.891681', '0.873563', '0.874676', '0.890447']
         : correct/total = [(1026, 1140), (1040, 1158), (1000, 1127), (1035, 1158), (998, 1134), (1036, 1145), (1017, 1145), (1008, 1127), (1019, 1136), (1011, 1128), (1019, 1144), (997, 1125), (1017, 1152), (1029, 1160), (1008, 1124), (992, 1145), (1029, 1154), (988, 1131), (1012, 1157), (1016, 1141)]
         : compromised: 0.8874, honest: 0.8915
         : ubar stats = ['Node 0: s1=0.375, s2=0.310', 'Node 1: s1=0.364, s2=0.536', 'Node 2: s1=0.333, s2=0.250']...
Round 008: test acc mean=0.8899 ± 0.0094 | min=0.8671 max=0.9084
         : test loss mean=0.2677 ± 0.0162
         : individual accs = ['0.900000', '0.894646', '0.881988', '0.889465', '0.890653', '0.899563', '0.894323', '0.893523', '0.867077', '0.891844', '0.891608', '0.901333', '0.890625', '0.890517', '0.908363', '0.880349', '0.891681', '0.874447', '0.879862', '0.886065']
         : correct/total = [(1026, 1140), (1036, 1158), (994, 1127), (1030, 1158), (1010, 1134), (1030, 1145), (1024, 1145), (1007, 1127), (985, 1136), (1006, 1128), (1020, 1144), (1014, 1125), (1026, 1152), (1033, 1160), (1021, 1124), (1008, 1145), (1029, 1154), (989, 1131), (1018, 1157), (1011, 1141)]
         : compromised: 0.8882, honest: 0.8925
         : ubar stats = ['Node 0: s1=0.375, s2=0.312', 'Node 1: s1=0.364, s2=0.531', 'Node 2: s1=0.333, s2=0.250']...
Round 009: test acc mean=0.8945 ± 0.0110 | min=0.8608 max=0.9135
         : test loss mean=0.2579 ± 0.0181
         : individual accs = ['0.904386', '0.891192', '0.882875', '0.900691', '0.895944', '0.913537', '0.900437', '0.902396', '0.903169', '0.889184', '0.901224', '0.902222', '0.892361', '0.898276', '0.900356', '0.885590', '0.889081', '0.881521', '0.860847', '0.893953']
         : correct/total = [(1031, 1140), (1032, 1158), (995, 1127), (1043, 1158), (1016, 1134), (1046, 1145), (1031, 1145), (1017, 1127), (1026, 1136), (1003, 1128), (1031, 1144), (1015, 1125), (1028, 1152), (1042, 1160), (1012, 1124), (1014, 1145), (1026, 1154), (997, 1131), (996, 1157), (1020, 1141)]
         : compromised: 0.8927, honest: 0.8971
         : ubar stats = ['Node 0: s1=0.375, s2=0.296', 'Node 1: s1=0.364, s2=0.500', 'Node 2: s1=0.333, s2=0.278']...
Round 010: test acc mean=0.8977 ± 0.0089 | min=0.8799 max=0.9162
         : test loss mean=0.2492 ± 0.0151
         : individual accs = ['0.906140', '0.898100', '0.887311', '0.893782', '0.894180', '0.916157', '0.894323', '0.905945', '0.906690', '0.906028', '0.900350', '0.902222', '0.899306', '0.895690', '0.906584', '0.884716', '0.900347', '0.885942', '0.879862', '0.889571']
         : correct/total = [(1033, 1140), (1040, 1158), (1000, 1127), (1035, 1158), (1014, 1134), (1049, 1145), (1024, 1145), (1021, 1127), (1030, 1136), (1022, 1128), (1030, 1144), (1015, 1125), (1036, 1152), (1039, 1160), (1019, 1124), (1013, 1145), (1039, 1154), (1002, 1131), (1018, 1157), (1015, 1141)]
         : compromised: 0.8964, honest: 0.8996
         : ubar stats = ['Node 0: s1=0.375, s2=0.333', 'Node 1: s1=0.364, s2=0.475', 'Node 2: s1=0.333, s2=0.300']...

=== FINAL RESULTS ===
Dataset: celeba, Nodes: 20, Graph: erdos, Aggregation: ubar
Attack: gaussian, 60.0% compromised
Final accuracy - Compromised: 0.8964, Honest: 0.8996
Overall test accuracy: mean=0.8977 ± 0.0089

=== UBAR SUMMARY ===
Node 0: stage1=0.375, stage2=0.333, overall=0.125
Node 1: stage1=0.364, stage2=0.475, overall=0.173
Node 2: stage1=0.333, stage2=0.300, overall=0.100
Node 3: stage1=0.375, stage2=0.467, overall=0.175
Node 4: stage1=0.364, stage2=0.500, overall=0.182
Node 5: stage1=0.400, stage2=0.483, overall=0.193
Node 6: stage1=0.357, stage2=0.200, overall=0.071
Node 7: stage1=0.357, stage2=0.580, overall=0.207
Node 8: stage1=0.400, stage2=0.350, overall=0.140
Node 9: stage1=0.385, stage2=0.400, overall=0.154
Node 10: stage1=0.333, stage2=0.433, overall=0.144
Node 11: stage1=0.357, stage2=0.420, overall=0.150
Node 12: stage1=0.333, stage2=0.600, overall=0.200
Node 13: stage1=0.385, stage2=0.520, overall=0.200
Node 14: stage1=0.400, stage2=0.650, overall=0.260
Node 15: stage1=0.364, stage2=0.300, overall=0.109
Node 16: stage1=0.385, stage2=0.280, overall=0.108
Node 17: stage1=0.333, stage2=0.333, overall=0.111
Node 18: stage1=0.375, stage2=0.400, overall=0.150
Node 19: stage1=0.375, stage2=0.450, overall=0.169

=== PARALLEL EXECUTION TIME (realistic for distributed system) ===
  COMMUNICATION (max across nodes):
    - Full model transfer: 0.000s (0.0%)
  COMPUTATION (max across nodes):
    - Distance computation: 0.045s (17.7%)
    - Loss computation: 0.204s (80.2%)
    - Aggregation: 0.005s (2.1%)
  TOTALS:
    - Total computation: 0.254s (100.0%)
    - Total communication: 0.000s (0.0%)
    - Total parallel time: 0.254s

=== PER-NODE AVERAGE TIME ===
  - Distance computation: 0.032s
  - Loss computation: 0.174s
  - Aggregation: 0.004s
  - Model transfer: 0.000s
  - Total per node: 0.209s

=== TOTAL COMPUTATIONAL WORK (sum across all nodes) ===
  - Total distance computation: 0.630s
  - Total loss computation: 3.472s
  - Total aggregation: 0.072s
  - Total model transfer: 0.000s
  - Grand total: 4.174s
  - Mean Stage 1 acceptance rate: 0.367
  - Mean Stage 2 acceptance rate: 0.424
  - Overall acceptance rate: 0.156

UBAR Algorithm Properties:
  - Model dimension: 2,219,692
  - Rho parameter: 0.4
  - Two-stage approach: Distance filtering + loss evaluation
  - Stage 1 selects: 40% of neighbors
  - Stage 2 uses: Training sample loss comparison
  - Theoretical complexity: O(deg(i)×d + deg(i)×inference)
  - Approach: UBAR paper implementation
