Device: cuda
Seed: 987654321
Looking for images in: /home/student.unimelb.edu.au/mrangwala/Projects/Sketchguard/leaf/data/celeba/data/raw/img_align_celeba
Loading 1 LEAF CelebA train files...
LEAF CelebA train: 9343 users (celebrities), 177457 samples
Looking for images in: /home/student.unimelb.edu.au/mrangwala/Projects/Sketchguard/leaf/data/celeba/data/raw/img_align_celeba
Loading 1 LEAF CelebA test files...
LEAF CelebA test: 9343 users (celebrities), 22831 samples
Found 9343 train users, 9343 test users, 9343 common users
User sample counts range: 31 (max) to 4 (min)
Distributed ALL 9343 users across 20 clients
Users per client: 467 (with 3 clients getting +1 user)
Train partition sizes: [8843, 8998, 8728, 9034, 8866, 8946, 8873, 8776, 8816, 8801, 8913, 8656, 9115, 8921, 8699, 8823, 8912, 8766, 9102, 8869]
Test partition sizes: [1140, 1158, 1127, 1158, 1134, 1145, 1145, 1127, 1136, 1128, 1144, 1125, 1152, 1160, 1124, 1145, 1154, 1131, 1157, 1141]
  Client 0: 8843 train samples, 2 unique classes
  Client 1: 8998 train samples, 2 unique classes
  Client 2: 8728 train samples, 2 unique classes
  Client 3: 9034 train samples, 2 unique classes
  Client 4: 8866 train samples, 2 unique classes
  Client 5: 8946 train samples, 2 unique classes
  Client 6: 8873 train samples, 2 unique classes
  Client 7: 8776 train samples, 2 unique classes
  Client 8: 8816 train samples, 2 unique classes
  Client 9: 8801 train samples, 2 unique classes
  Client 10: 8913 train samples, 2 unique classes
  Client 11: 8656 train samples, 2 unique classes
  Client 12: 9115 train samples, 2 unique classes
  Client 13: 8921 train samples, 2 unique classes
  Client 14: 8699 train samples, 2 unique classes
  Client 15: 8823 train samples, 2 unique classes
  Client 16: 8912 train samples, 2 unique classes
  Client 17: 8766 train samples, 2 unique classes
  Client 18: 9102 train samples, 2 unique classes
  Client 19: 8869 train samples, 2 unique classes
Will sample 4500 samples per client per epoch
Graph: ring, nodes: 20, edges: 20
Degree statistics: avg=2.00, min=2, max=2
Attack: Compromised 10/20 nodes: [1, 2, 5, 11, 12, 13, 14, 15, 17, 18]
Attack type: backdoor, lambda: 1.0
Backdoor target label: 0, trigger size: 8
Model variant: baseline
Model parameters: 2,219,692
UBAR ALGORITHM (Two-Stage Byzantine-resilient)
  - Model dimension: 2,219,692 parameters
  - Rho parameter: 0.5
  - Stage 1: Distance-based filtering (select 50% closest neighbors)
  - Stage 2: Performance-based selection (loss comparison)
  - Complexity: O(deg(i)×d + deg(i)×inference)
Initial test acc across nodes: mean=0.4978 ± 0.0208
Backdoor attack: Created poisoned datasets for 10 compromised nodes
Round 001: test acc mean=0.5672 ± 0.0691 | min=0.4942 max=0.7177
         : test loss mean=8726.4322 ± 16179.0217
         : individual accs = ['0.578070', '0.508636', '0.494232', '0.641623', '0.640212', '0.514410', '0.555459', '0.622005', '0.685739', '0.677305', '0.717657', '0.518222', '0.522569', '0.506897', '0.517794', '0.520524', '0.515598', '0.508400', '0.522040', '0.576687']
         : correct/total = [(659, 1140), (589, 1158), (557, 1127), (743, 1158), (726, 1134), (589, 1145), (636, 1145), (701, 1127), (779, 1136), (764, 1128), (821, 1144), (583, 1125), (602, 1152), (588, 1160), (582, 1124), (596, 1145), (595, 1154), (575, 1131), (604, 1157), (658, 1141)]
         : compromised: 0.5134, honest: 0.6210
         : ubar stats = ['Node 0: s1=0.500, s2=1.000', 'Node 1: s1=0.500, s2=1.000', 'Node 2: s1=0.500, s2=1.000']...
Round 002: test acc mean=0.6192 ± 0.1213 | min=0.4827 max=0.7858
         : test loss mean=nan ± nan
         : individual accs = ['0.742105', '0.487910', '0.511979', '0.709845', '0.704586', '0.507424', '0.737991', '0.767524', '0.772887', '0.776596', '0.785839', '0.482667', '0.522569', '0.506897', '0.517794', '0.517031', '0.515598', '0.508400', '0.546240', '0.761613']
         : correct/total = [(846, 1140), (565, 1158), (577, 1127), (822, 1158), (799, 1134), (581, 1145), (845, 1145), (865, 1127), (878, 1136), (876, 1128), (899, 1144), (543, 1125), (602, 1152), (588, 1160), (582, 1124), (592, 1145), (595, 1154), (575, 1131), (632, 1157), (869, 1141)]
         : compromised: 0.5109, honest: 0.7275
         : ubar stats = ['Node 0: s1=0.500, s2=1.000', 'Node 1: s1=0.500, s2=1.000', 'Node 2: s1=0.500, s2=1.000']...
Round 003: test acc mean=0.6552 ± 0.1604 | min=0.4933 max=0.8785
         : test loss mean=nan ± nan
         : individual accs = ['0.835088', '0.508636', '0.493345', '0.785838', '0.794533', '0.514410', '0.797380', '0.841171', '0.847711', '0.867021', '0.878497', '0.498667', '0.522569', '0.506897', '0.517794', '0.517031', '0.515598', '0.508400', '0.522040', '0.830850']
         : correct/total = [(952, 1140), (589, 1158), (556, 1127), (910, 1158), (901, 1134), (589, 1145), (913, 1145), (948, 1127), (963, 1136), (978, 1128), (1005, 1144), (561, 1125), (602, 1152), (588, 1160), (582, 1124), (592, 1145), (595, 1154), (575, 1131), (604, 1157), (948, 1141)]
         : compromised: 0.5110, honest: 0.7994
         : ubar stats = ['Node 0: s1=0.500, s2=1.000', 'Node 1: s1=0.500, s2=1.000', 'Node 2: s1=0.500, s2=1.000']...
Round 004: test acc mean=0.6724 ± 0.1783 | min=0.4933 max=0.8830
         : test loss mean=nan ± nan
         : individual accs = ['0.864912', '0.508636', '0.493345', '0.865285', '0.841270', '0.514410', '0.873362', '0.874002', '0.870599', '0.882979', '0.882867', '0.498667', '0.522569', '0.506897', '0.517794', '0.517031', '0.515598', '0.508400', '0.522040', '0.867660']
         : correct/total = [(986, 1140), (589, 1158), (556, 1127), (1002, 1158), (954, 1134), (589, 1145), (1000, 1145), (985, 1127), (989, 1136), (996, 1128), (1010, 1144), (561, 1125), (602, 1152), (588, 1160), (582, 1124), (592, 1145), (595, 1154), (575, 1131), (604, 1157), (990, 1141)]
         : compromised: 0.5110, honest: 0.8339
         : ubar stats = ['Node 0: s1=0.500, s2=1.000', 'Node 1: s1=0.500, s2=1.000', 'Node 2: s1=0.500, s2=1.000']...
Round 005: test acc mean=0.6761 ± 0.1826 | min=0.4933 max=0.9003
         : test loss mean=nan ± nan
         : individual accs = ['0.837719', '0.508636', '0.493345', '0.884283', '0.865079', '0.514410', '0.878603', '0.887311', '0.882923', '0.897163', '0.900350', '0.498667', '0.522569', '0.506897', '0.517794', '0.517031', '0.515598', '0.508400', '0.522040', '0.862401']
         : correct/total = [(955, 1140), (589, 1158), (556, 1127), (1024, 1158), (981, 1134), (589, 1145), (1006, 1145), (1000, 1127), (1003, 1136), (1012, 1128), (1030, 1144), (561, 1125), (602, 1152), (588, 1160), (582, 1124), (592, 1145), (595, 1154), (575, 1131), (604, 1157), (984, 1141)]
         : compromised: 0.5110, honest: 0.8411
         : ubar stats = ['Node 0: s1=0.500, s2=1.000', 'Node 1: s1=0.500, s2=1.000', 'Node 2: s1=0.500, s2=1.000']...
Round 006: test acc mean=0.6804 ± 0.1870 | min=0.4933 max=0.8996
         : test loss mean=nan ± nan
         : individual accs = ['0.890351', '0.508636', '0.493345', '0.886874', '0.883598', '0.514410', '0.899563', '0.881988', '0.880282', '0.884752', '0.891608', '0.498667', '0.522569', '0.506897', '0.517794', '0.517031', '0.515598', '0.508400', '0.522040', '0.883436']
         : correct/total = [(1015, 1140), (589, 1158), (556, 1127), (1027, 1158), (1002, 1134), (589, 1145), (1030, 1145), (994, 1127), (1000, 1136), (998, 1128), (1020, 1144), (561, 1125), (602, 1152), (588, 1160), (582, 1124), (592, 1145), (595, 1154), (575, 1131), (604, 1157), (1008, 1141)]
         : compromised: 0.5110, honest: 0.8498
         : ubar stats = ['Node 0: s1=0.500, s2=1.000', 'Node 1: s1=0.500, s2=1.000', 'Node 2: s1=0.500, s2=1.000']...
Round 007: test acc mean=0.6840 ± 0.1910 | min=0.4933 max=0.9078
         : test loss mean=nan ± nan
         : individual accs = ['0.895614', '0.508636', '0.493345', '0.893782', '0.881834', '0.514410', '0.895197', '0.896185', '0.882923', '0.907801', '0.903846', '0.498667', '0.522569', '0.506897', '0.517794', '0.517031', '0.515598', '0.508400', '0.522040', '0.896582']
         : correct/total = [(1021, 1140), (589, 1158), (556, 1127), (1035, 1158), (1000, 1134), (589, 1145), (1025, 1145), (1010, 1127), (1003, 1136), (1024, 1128), (1034, 1144), (561, 1125), (602, 1152), (588, 1160), (582, 1124), (592, 1145), (595, 1154), (575, 1131), (604, 1157), (1023, 1141)]
         : compromised: 0.5110, honest: 0.8569
         : ubar stats = ['Node 0: s1=0.500, s2=1.000', 'Node 1: s1=0.500, s2=1.000', 'Node 2: s1=0.500, s2=1.000']...
Round 008: test acc mean=0.6827 ± 0.1896 | min=0.4933 max=0.9004
         : test loss mean=nan ± nan
         : individual accs = ['0.892105', '0.508636', '0.493345', '0.891192', '0.897707', '0.514410', '0.900437', '0.892635', '0.876761', '0.894504', '0.896853', '0.498667', '0.522569', '0.506897', '0.517794', '0.517031', '0.515598', '0.508400', '0.522040', '0.886941']
         : correct/total = [(1017, 1140), (589, 1158), (556, 1127), (1032, 1158), (1018, 1134), (589, 1145), (1031, 1145), (1006, 1127), (996, 1136), (1009, 1128), (1026, 1144), (561, 1125), (602, 1152), (588, 1160), (582, 1124), (592, 1145), (595, 1154), (575, 1131), (604, 1157), (1012, 1141)]
         : compromised: 0.5110, honest: 0.8545
         : ubar stats = ['Node 0: s1=0.500, s2=1.000', 'Node 1: s1=0.500, s2=1.000', 'Node 2: s1=0.500, s2=1.000']...
Round 009: test acc mean=0.6864 ± 0.1937 | min=0.4933 max=0.9136
         : test loss mean=nan ± nan
         : individual accs = ['0.900877', '0.508636', '0.493345', '0.913644', '0.902116', '0.514410', '0.904803', '0.898846', '0.889085', '0.898050', '0.901224', '0.498667', '0.522569', '0.506897', '0.517794', '0.517031', '0.515598', '0.508400', '0.522040', '0.894829']
         : correct/total = [(1027, 1140), (589, 1158), (556, 1127), (1058, 1158), (1023, 1134), (589, 1145), (1036, 1145), (1013, 1127), (1010, 1136), (1013, 1128), (1031, 1144), (561, 1125), (602, 1152), (588, 1160), (582, 1124), (592, 1145), (595, 1154), (575, 1131), (604, 1157), (1021, 1141)]
         : compromised: 0.5110, honest: 0.8619
         : ubar stats = ['Node 0: s1=0.500, s2=1.000', 'Node 1: s1=0.500, s2=1.000', 'Node 2: s1=0.500, s2=1.000']...
Round 010: test acc mean=0.6862 ± 0.1935 | min=0.4933 max=0.9076
         : test loss mean=nan ± nan
         : individual accs = ['0.899123', '0.508636', '0.493345', '0.907599', '0.902116', '0.514410', '0.896070', '0.905945', '0.882042', '0.898936', '0.906469', '0.498667', '0.522569', '0.506897', '0.517794', '0.517031', '0.515598', '0.508400', '0.522040', '0.900964']
         : correct/total = [(1025, 1140), (589, 1158), (556, 1127), (1051, 1158), (1023, 1134), (589, 1145), (1026, 1145), (1021, 1127), (1002, 1136), (1014, 1128), (1037, 1144), (561, 1125), (602, 1152), (588, 1160), (582, 1124), (592, 1145), (595, 1154), (575, 1131), (604, 1157), (1028, 1141)]
         : compromised: 0.5110, honest: 0.8615
         : ubar stats = ['Node 0: s1=0.500, s2=1.000', 'Node 1: s1=0.500, s2=1.000', 'Node 2: s1=0.500, s2=1.000']...

=== FINAL RESULTS ===
Dataset: celeba, Nodes: 20, Graph: ring, Aggregation: ubar
Attack: backdoor, 50.0% compromised
Final accuracy - Compromised: 0.5110, Honest: 0.8615
Overall test accuracy: mean=0.6862 ± 0.1935

=== BACKDOOR ATTACK SUCCESS RATE (ASR) ===
Target label: 0
Trigger size: 8x8
Overall ASR: 0.7982 ± 0.2236
Honest nodes ASR: 0.5964 ± 0.1361
Compromised nodes ASR: 1.0000 ± 0.0000
Note: Higher ASR indicates more successful backdoor attack

=== UBAR SUMMARY ===
Node 0: stage1=0.500, stage2=1.000, overall=0.500
Node 1: stage1=0.500, stage2=1.000, overall=0.500
Node 2: stage1=0.500, stage2=1.000, overall=0.500
Node 3: stage1=0.500, stage2=1.000, overall=0.500
Node 4: stage1=0.500, stage2=1.000, overall=0.500
Node 5: stage1=0.500, stage2=1.000, overall=0.500
Node 6: stage1=0.500, stage2=1.000, overall=0.500
Node 7: stage1=0.500, stage2=1.000, overall=0.500
Node 8: stage1=0.500, stage2=1.000, overall=0.500
Node 9: stage1=0.500, stage2=1.000, overall=0.500
Node 10: stage1=0.500, stage2=1.000, overall=0.500
Node 11: stage1=0.500, stage2=1.000, overall=0.500
Node 12: stage1=0.500, stage2=1.000, overall=0.500
Node 13: stage1=0.500, stage2=1.000, overall=0.500
Node 14: stage1=0.500, stage2=1.000, overall=0.500
Node 15: stage1=0.500, stage2=1.000, overall=0.500
Node 16: stage1=0.500, stage2=1.000, overall=0.500
Node 17: stage1=0.500, stage2=1.000, overall=0.500
Node 18: stage1=0.500, stage2=1.000, overall=0.500
Node 19: stage1=0.500, stage2=1.000, overall=0.500

=== PARALLEL EXECUTION TIME (realistic for distributed system) ===
  COMMUNICATION (max across nodes):
    - Full model transfer: 0.000s (0.0%)
  COMPUTATION (max across nodes):
    - Distance computation: 0.009s (4.8%)
    - Loss computation: 0.181s (93.3%)
    - Aggregation: 0.004s (1.9%)
  TOTALS:
    - Total computation: 0.194s (100.0%)
    - Total communication: 0.000s (0.0%)
    - Total parallel time: 0.194s

=== PER-NODE AVERAGE TIME ===
  - Distance computation: 0.006s
  - Loss computation: 0.149s
  - Aggregation: 0.003s
  - Model transfer: 0.000s
  - Total per node: 0.158s

=== TOTAL COMPUTATIONAL WORK (sum across all nodes) ===
  - Total distance computation: 0.117s
  - Total loss computation: 2.990s
  - Total aggregation: 0.053s
  - Total model transfer: 0.000s
  - Grand total: 3.160s
  - Mean Stage 1 acceptance rate: 0.500
  - Mean Stage 2 acceptance rate: 1.000
  - Overall acceptance rate: 0.500

UBAR Algorithm Properties:
  - Model dimension: 2,219,692
  - Rho parameter: 0.5
  - Two-stage approach: Distance filtering + loss evaluation
  - Stage 1 selects: 50% of neighbors
  - Stage 2 uses: Training sample loss comparison
  - Theoretical complexity: O(deg(i)×d + deg(i)×inference)
  - Approach: UBAR paper implementation
