Device: cuda
Seed: 987654321
Looking for images in: /home/student.unimelb.edu.au/mrangwala/Projects/Sketchguard/leaf/data/celeba/data/raw/img_align_celeba
Loading 1 LEAF CelebA train files...
LEAF CelebA train: 9343 users (celebrities), 177457 samples
Looking for images in: /home/student.unimelb.edu.au/mrangwala/Projects/Sketchguard/leaf/data/celeba/data/raw/img_align_celeba
Loading 1 LEAF CelebA test files...
LEAF CelebA test: 9343 users (celebrities), 22831 samples
Found 9343 train users, 9343 test users, 9343 common users
User sample counts range: 31 (max) to 4 (min)
Distributed ALL 9343 users across 20 clients
Users per client: 467 (with 3 clients getting +1 user)
Train partition sizes: [8843, 8998, 8728, 9034, 8866, 8946, 8873, 8776, 8816, 8801, 8913, 8656, 9115, 8921, 8699, 8823, 8912, 8766, 9102, 8869]
Test partition sizes: [1140, 1158, 1127, 1158, 1134, 1145, 1145, 1127, 1136, 1128, 1144, 1125, 1152, 1160, 1124, 1145, 1154, 1131, 1157, 1141]
  Client 0: 8843 train samples, 2 unique classes
  Client 1: 8998 train samples, 2 unique classes
  Client 2: 8728 train samples, 2 unique classes
  Client 3: 9034 train samples, 2 unique classes
  Client 4: 8866 train samples, 2 unique classes
  Client 5: 8946 train samples, 2 unique classes
  Client 6: 8873 train samples, 2 unique classes
  Client 7: 8776 train samples, 2 unique classes
  Client 8: 8816 train samples, 2 unique classes
  Client 9: 8801 train samples, 2 unique classes
  Client 10: 8913 train samples, 2 unique classes
  Client 11: 8656 train samples, 2 unique classes
  Client 12: 9115 train samples, 2 unique classes
  Client 13: 8921 train samples, 2 unique classes
  Client 14: 8699 train samples, 2 unique classes
  Client 15: 8823 train samples, 2 unique classes
  Client 16: 8912 train samples, 2 unique classes
  Client 17: 8766 train samples, 2 unique classes
  Client 18: 9102 train samples, 2 unique classes
  Client 19: 8869 train samples, 2 unique classes
Will sample 4500 samples per client per epoch
Graph: erdos, nodes: 20, edges: 48
Degree statistics: avg=4.80, min=2, max=7
Attack: Compromised 14/20 nodes: [1, 2, 3, 5, 6, 8, 11, 12, 13, 14, 15, 17, 18, 19]
Attack type: gaussian, lambda: 1.0
Model variant: baseline
Model parameters: 2,219,692
UBAR ALGORITHM (Two-Stage Byzantine-resilient)
  - Model dimension: 2,219,692 parameters
  - Rho parameter: 0.30000000000000004
  - Stage 1: Distance-based filtering (select 30% closest neighbors)
  - Stage 2: Performance-based selection (loss comparison)
  - Complexity: O(deg(i)×d + deg(i)×inference)
Initial test acc across nodes: mean=0.4978 ± 0.0208
Round 001: test acc mean=0.6247 ± 0.0549 | min=0.5000 max=0.7158
         : test loss mean=2420790.3145 ± 10551977.4015
         : individual accs = ['0.664035', '0.656304', '0.637977', '0.684801', '0.571429', '0.592140', '0.643668', '0.560781', '0.636444', '0.655142', '0.644231', '0.614222', '0.687500', '0.500000', '0.626335', '0.684716', '0.715771', '0.581786', '0.615385', '0.521472']
         : correct/total = [(757, 1140), (760, 1158), (719, 1127), (793, 1158), (648, 1134), (678, 1145), (737, 1145), (632, 1127), (723, 1136), (739, 1128), (737, 1144), (691, 1125), (792, 1152), (580, 1160), (704, 1124), (784, 1145), (826, 1154), (658, 1131), (712, 1157), (595, 1141)]
         : compromised: 0.6202, honest: 0.6352
         : ubar stats = ['Node 0: s1=0.167, s2=1.000', 'Node 1: s1=0.167, s2=1.000', 'Node 2: s1=0.200, s2=1.000']...
Round 002: test acc mean=0.7198 ± 0.0586 | min=0.5069 max=0.7828
         : test loss mean=nan ± nan
         : individual accs = ['0.750000', '0.676166', '0.753327', '0.745250', '0.666667', '0.716157', '0.765066', '0.685004', '0.753521', '0.782801', '0.719406', '0.778667', '0.734375', '0.506897', '0.712633', '0.743231', '0.769497', '0.702034', '0.700951', '0.735320']
         : correct/total = [(855, 1140), (783, 1158), (849, 1127), (863, 1158), (756, 1134), (820, 1145), (876, 1145), (772, 1127), (856, 1136), (883, 1128), (823, 1144), (876, 1125), (846, 1152), (588, 1160), (801, 1124), (851, 1145), (888, 1154), (794, 1131), (811, 1157), (839, 1141)]
         : compromised: 0.7160, honest: 0.7289
         : ubar stats = ['Node 0: s1=0.167, s2=1.000', 'Node 1: s1=0.167, s2=1.000', 'Node 2: s1=0.200, s2=1.000']...
Round 003: test acc mean=0.8055 ± 0.0726 | min=0.5069 max=0.8565
         : test loss mean=nan ± nan
         : individual accs = ['0.854386', '0.783247', '0.835847', '0.848877', '0.808642', '0.817467', '0.847162', '0.805679', '0.856514', '0.854610', '0.821678', '0.836444', '0.801215', '0.506897', '0.815836', '0.779913', '0.842288', '0.803714', '0.784788', '0.804557']
         : correct/total = [(974, 1140), (907, 1158), (942, 1127), (983, 1158), (917, 1134), (936, 1145), (970, 1145), (908, 1127), (973, 1136), (964, 1128), (940, 1144), (941, 1125), (923, 1152), (588, 1160), (917, 1124), (893, 1145), (972, 1154), (909, 1131), (908, 1157), (918, 1141)]
         : compromised: 0.7945, honest: 0.8312
         : ubar stats = ['Node 0: s1=0.167, s2=1.000', 'Node 1: s1=0.167, s2=1.000', 'Node 2: s1=0.200, s2=1.000']...
Round 004: test acc mean=0.8478 ± 0.0792 | min=0.5069 max=0.8874
         : test loss mean=nan ± nan
         : individual accs = ['0.873684', '0.868739', '0.866903', '0.873921', '0.868607', '0.867249', '0.868122', '0.866903', '0.880282', '0.887411', '0.875000', '0.872000', '0.858507', '0.506897', '0.858541', '0.839301', '0.879549', '0.854111', '0.835782', '0.855390']
         : correct/total = [(996, 1140), (1006, 1158), (977, 1127), (1012, 1158), (985, 1134), (993, 1145), (994, 1145), (977, 1127), (1000, 1136), (1001, 1128), (1001, 1144), (981, 1125), (989, 1152), (588, 1160), (965, 1124), (961, 1145), (1015, 1154), (966, 1131), (967, 1157), (976, 1141)]
         : compromised: 0.8361, honest: 0.8752
         : ubar stats = ['Node 0: s1=0.167, s2=1.000', 'Node 1: s1=0.167, s2=1.000', 'Node 2: s1=0.200, s2=1.000']...
Round 005: test acc mean=0.8553 ± 0.0817 | min=0.5069 max=0.8969
         : test loss mean=nan ± nan
         : individual accs = ['0.868421', '0.879965', '0.874889', '0.891192', '0.865079', '0.830568', '0.884716', '0.866903', '0.889085', '0.893617', '0.881993', '0.896889', '0.879340', '0.506897', '0.870996', '0.861135', '0.884749', '0.870911', '0.834054', '0.873795']
         : correct/total = [(990, 1140), (1019, 1158), (986, 1127), (1032, 1158), (981, 1134), (951, 1145), (1013, 1145), (977, 1127), (1010, 1136), (1008, 1128), (1009, 1144), (1009, 1125), (1013, 1152), (588, 1160), (979, 1124), (986, 1145), (1021, 1154), (985, 1131), (965, 1157), (997, 1141)]
         : compromised: 0.8460, honest: 0.8768
         : ubar stats = ['Node 0: s1=0.167, s2=1.000', 'Node 1: s1=0.167, s2=1.000', 'Node 2: s1=0.200, s2=1.000']...
Round 006: test acc mean=0.8709 ± 0.0844 | min=0.5069 max=0.9084
         : test loss mean=nan ± nan
         : individual accs = ['0.903509', '0.895509', '0.890861', '0.885147', '0.885362', '0.901310', '0.895197', '0.890861', '0.901408', '0.892730', '0.895105', '0.908444', '0.891493', '0.506897', '0.895907', '0.865502', '0.893414', '0.877984', '0.853068', '0.887818']
         : correct/total = [(1030, 1140), (1037, 1158), (1004, 1127), (1025, 1158), (1004, 1134), (1032, 1145), (1025, 1145), (1004, 1127), (1024, 1136), (1007, 1128), (1024, 1144), (1022, 1125), (1027, 1152), (588, 1160), (1007, 1124), (991, 1145), (1031, 1154), (993, 1131), (987, 1157), (1013, 1141)]
         : compromised: 0.8612, honest: 0.8935
         : ubar stats = ['Node 0: s1=0.167, s2=1.000', 'Node 1: s1=0.167, s2=1.000', 'Node 2: s1=0.200, s2=1.000']...
Round 007: test acc mean=0.8759 ± 0.0850 | min=0.5069 max=0.9086
         : test loss mean=nan ± nan
         : individual accs = ['0.894737', '0.902418', '0.891748', '0.904145', '0.886243', '0.904803', '0.896943', '0.908607', '0.895246', '0.903369', '0.897727', '0.897778', '0.892361', '0.506897', '0.892349', '0.879476', '0.898614', '0.888594', '0.884183', '0.892200']
         : correct/total = [(1020, 1140), (1045, 1158), (1005, 1127), (1047, 1158), (1005, 1134), (1036, 1145), (1027, 1145), (1024, 1127), (1017, 1136), (1019, 1128), (1027, 1144), (1010, 1125), (1028, 1152), (588, 1160), (1003, 1124), (1007, 1145), (1037, 1154), (1005, 1131), (1023, 1157), (1018, 1141)]
         : compromised: 0.8664, honest: 0.8982
         : ubar stats = ['Node 0: s1=0.167, s2=1.000', 'Node 1: s1=0.167, s2=1.000', 'Node 2: s1=0.200, s2=1.000']...
Round 008: test acc mean=0.8797 ± 0.0858 | min=0.5069 max=0.9129
         : test loss mean=nan ± nan
         : individual accs = ['0.904386', '0.900691', '0.891748', '0.903282', '0.895062', '0.911790', '0.901310', '0.909494', '0.894366', '0.897163', '0.900350', '0.912889', '0.901910', '0.506897', '0.906584', '0.888210', '0.899480', '0.886826', '0.886776', '0.893953']
         : correct/total = [(1031, 1140), (1043, 1158), (1005, 1127), (1046, 1158), (1015, 1134), (1044, 1145), (1032, 1145), (1025, 1127), (1016, 1136), (1012, 1128), (1030, 1144), (1027, 1125), (1039, 1152), (588, 1160), (1019, 1124), (1017, 1145), (1038, 1154), (1003, 1131), (1026, 1157), (1020, 1141)]
         : compromised: 0.8705, honest: 0.9010
         : ubar stats = ['Node 0: s1=0.167, s2=1.000', 'Node 1: s1=0.167, s2=1.000', 'Node 2: s1=0.200, s2=1.000']...
Round 009: test acc mean=0.8799 ± 0.0862 | min=0.5069 max=0.9147
         : test loss mean=nan ± nan
         : individual accs = ['0.907018', '0.891192', '0.890861', '0.902418', '0.902116', '0.907424', '0.904803', '0.911269', '0.900528', '0.895390', '0.899476', '0.914667', '0.898438', '0.506897', '0.903025', '0.893450', '0.909879', '0.893899', '0.865169', '0.899211']
         : correct/total = [(1034, 1140), (1032, 1158), (1004, 1127), (1045, 1158), (1023, 1134), (1039, 1145), (1036, 1145), (1027, 1127), (1023, 1136), (1010, 1128), (1029, 1144), (1029, 1125), (1035, 1152), (588, 1160), (1015, 1124), (1023, 1145), (1050, 1154), (1011, 1131), (1001, 1157), (1026, 1141)]
         : compromised: 0.8694, honest: 0.9042
         : ubar stats = ['Node 0: s1=0.167, s2=1.000', 'Node 1: s1=0.167, s2=1.000', 'Node 2: s1=0.200, s2=1.000']...
Round 010: test acc mean=0.8811 ± 0.0862 | min=0.5069 max=0.9175
         : test loss mean=nan ± nan
         : individual accs = ['0.900000', '0.902418', '0.894410', '0.907599', '0.904762', '0.901310', '0.903930', '0.917480', '0.898768', '0.903369', '0.900350', '0.897778', '0.901910', '0.506897', '0.905694', '0.897817', '0.907279', '0.893899', '0.878133', '0.898335']
         : correct/total = [(1026, 1140), (1045, 1158), (1008, 1127), (1051, 1158), (1026, 1134), (1032, 1145), (1035, 1145), (1034, 1127), (1021, 1136), (1019, 1128), (1030, 1144), (1010, 1125), (1039, 1152), (588, 1160), (1018, 1124), (1028, 1145), (1047, 1154), (1011, 1131), (1016, 1157), (1025, 1141)]
         : compromised: 0.8706, honest: 0.9055
         : ubar stats = ['Node 0: s1=0.167, s2=1.000', 'Node 1: s1=0.167, s2=1.000', 'Node 2: s1=0.200, s2=1.000']...

=== FINAL RESULTS ===
Dataset: celeba, Nodes: 20, Graph: erdos, Aggregation: ubar
Attack: gaussian, 70.0% compromised
Final accuracy - Compromised: 0.8706, Honest: 0.9055
Overall test accuracy: mean=0.8811 ± 0.0862

=== UBAR SUMMARY ===
Node 0: stage1=0.167, stage2=1.000, overall=0.167
Node 1: stage1=0.167, stage2=1.000, overall=0.167
Node 2: stage1=0.200, stage2=1.000, overall=0.200
Node 3: stage1=0.250, stage2=1.000, overall=0.250
Node 4: stage1=0.250, stage2=1.000, overall=0.250
Node 5: stage1=0.200, stage2=1.000, overall=0.200
Node 6: stage1=0.200, stage2=1.000, overall=0.200
Node 7: stage1=0.200, stage2=1.000, overall=0.200
Node 8: stage1=0.500, stage2=1.000, overall=0.500
Node 9: stage1=0.333, stage2=1.000, overall=0.333
Node 10: stage1=0.250, stage2=1.000, overall=0.250
Node 11: stage1=0.286, stage2=0.500, overall=0.143
Node 12: stage1=0.286, stage2=0.650, overall=0.186
Node 13: stage1=0.250, stage2=1.000, overall=0.250
Node 14: stage1=0.286, stage2=0.500, overall=0.143
Node 15: stage1=0.167, stage2=1.000, overall=0.167
Node 16: stage1=0.200, stage2=1.000, overall=0.200
Node 17: stage1=0.200, stage2=1.000, overall=0.200
Node 18: stage1=0.250, stage2=1.000, overall=0.250
Node 19: stage1=0.500, stage2=1.000, overall=0.500

=== PARALLEL EXECUTION TIME (realistic for distributed system) ===
  COMMUNICATION (max across nodes):
    - Full model transfer: 0.000s (0.0%)
  COMPUTATION (max across nodes):
    - Distance computation: 0.022s (11.5%)
    - Loss computation: 0.165s (86.5%)
    - Aggregation: 0.004s (2.0%)
  TOTALS:
    - Total computation: 0.191s (100.0%)
    - Total communication: 0.000s (0.0%)
    - Total parallel time: 0.191s

=== PER-NODE AVERAGE TIME ===
  - Distance computation: 0.013s
  - Loss computation: 0.129s
  - Aggregation: 0.003s
  - Model transfer: 0.000s
  - Total per node: 0.144s

=== TOTAL COMPUTATIONAL WORK (sum across all nodes) ===
  - Total distance computation: 0.266s
  - Total loss computation: 2.571s
  - Total aggregation: 0.051s
  - Total model transfer: 0.000s
  - Grand total: 2.888s
  - Mean Stage 1 acceptance rate: 0.257
  - Mean Stage 2 acceptance rate: 0.932
  - Overall acceptance rate: 0.240

UBAR Algorithm Properties:
  - Model dimension: 2,219,692
  - Rho parameter: 0.30000000000000004
  - Two-stage approach: Distance filtering + loss evaluation
  - Stage 1 selects: 30% of neighbors
  - Stage 2 uses: Training sample loss comparison
  - Theoretical complexity: O(deg(i)×d + deg(i)×inference)
  - Approach: UBAR paper implementation
