Device: cuda
Seed: 987654321
Looking for images in: /home/student.unimelb.edu.au/mrangwala/Projects/Sketchguard/leaf/data/celeba/data/raw/img_align_celeba
Loading 1 LEAF CelebA train files...
LEAF CelebA train: 9343 users (celebrities), 177457 samples
Looking for images in: /home/student.unimelb.edu.au/mrangwala/Projects/Sketchguard/leaf/data/celeba/data/raw/img_align_celeba
Loading 1 LEAF CelebA test files...
LEAF CelebA test: 9343 users (celebrities), 22831 samples
Found 9343 train users, 9343 test users, 9343 common users
User sample counts range: 31 (max) to 4 (min)
Distributed ALL 9343 users across 20 clients
Users per client: 467 (with 3 clients getting +1 user)
Train partition sizes: [8843, 8998, 8728, 9034, 8866, 8946, 8873, 8776, 8816, 8801, 8913, 8656, 9115, 8921, 8699, 8823, 8912, 8766, 9102, 8869]
Test partition sizes: [1140, 1158, 1127, 1158, 1134, 1145, 1145, 1127, 1136, 1128, 1144, 1125, 1152, 1160, 1124, 1145, 1154, 1131, 1157, 1141]
  Client 0: 8843 train samples, 2 unique classes
  Client 1: 8998 train samples, 2 unique classes
  Client 2: 8728 train samples, 2 unique classes
  Client 3: 9034 train samples, 2 unique classes
  Client 4: 8866 train samples, 2 unique classes
  Client 5: 8946 train samples, 2 unique classes
  Client 6: 8873 train samples, 2 unique classes
  Client 7: 8776 train samples, 2 unique classes
  Client 8: 8816 train samples, 2 unique classes
  Client 9: 8801 train samples, 2 unique classes
  Client 10: 8913 train samples, 2 unique classes
  Client 11: 8656 train samples, 2 unique classes
  Client 12: 9115 train samples, 2 unique classes
  Client 13: 8921 train samples, 2 unique classes
  Client 14: 8699 train samples, 2 unique classes
  Client 15: 8823 train samples, 2 unique classes
  Client 16: 8912 train samples, 2 unique classes
  Client 17: 8766 train samples, 2 unique classes
  Client 18: 9102 train samples, 2 unique classes
  Client 19: 8869 train samples, 2 unique classes
Will sample 4500 samples per client per epoch
Graph: erdos, nodes: 20, edges: 99
Degree statistics: avg=9.90, min=7, max=14
Attack: Compromised 4/20 nodes: [5, 12, 13, 17]
Attack type: directed_deviation, lambda: 1.0
Model variant: baseline
Model parameters: 2,219,692
BALANCE algorithm:
Balance Config: BALANCEConfig(gamma=2, kappa=1, alpha=0.5, min_neighbors=1)
  - Model dimension: 2,219,692 parameters
  - Complexity: O(N×d) = O(20×2,219,692)
Initial test acc across nodes: mean=0.4978 ± 0.0208
Round 001: test acc mean=0.6706 ± 0.0468 | min=0.5353 max=0.7226
         : test loss mean=0.6808 ± 0.0037
         : individual accs = ['0.701754', '0.676166', '0.621118', '0.718480', '0.535273', '0.667249', '0.695197', '0.604259', '0.628521', '0.711879', '0.667832', '0.712000', '0.710938', '0.714655', '0.663701', '0.663755', '0.667244', '0.704686', '0.722558', '0.624890']
         : correct/total = [(800, 1140), (783, 1158), (700, 1127), (832, 1158), (607, 1134), (764, 1145), (796, 1145), (681, 1127), (714, 1136), (803, 1128), (764, 1144), (801, 1125), (819, 1152), (829, 1160), (746, 1124), (760, 1145), (770, 1154), (797, 1131), (836, 1157), (713, 1141)]
         : compromised: 0.6994, honest: 0.6634
Round 002: test acc mean=0.6418 ± 0.0485 | min=0.5214 max=0.7066
         : test loss mean=0.6753 ± 0.0070
         : individual accs = ['0.646491', '0.661485', '0.651287', '0.628670', '0.522928', '0.521397', '0.649782', '0.669920', '0.646127', '0.646277', '0.676573', '0.672889', '0.706597', '0.643103', '0.560498', '0.659389', '0.675043', '0.656057', '0.688850', '0.652936']
         : correct/total = [(737, 1140), (766, 1158), (734, 1127), (728, 1158), (593, 1134), (597, 1145), (744, 1145), (755, 1127), (734, 1136), (729, 1128), (774, 1144), (757, 1125), (814, 1152), (746, 1160), (630, 1124), (755, 1145), (779, 1154), (742, 1131), (797, 1157), (745, 1141)]
         : compromised: 0.6318, honest: 0.6443
Round 003: test acc mean=0.6582 ± 0.0450 | min=0.5555 max=0.7289
         : test loss mean=0.6595 ± 0.0125
         : individual accs = ['0.623684', '0.673575', '0.669033', '0.697755', '0.615520', '0.555459', '0.647162', '0.672582', '0.728873', '0.690603', '0.675699', '0.674667', '0.634549', '0.669828', '0.561388', '0.669869', '0.709705', '0.619805', '0.719101', '0.655565']
         : correct/total = [(711, 1140), (780, 1158), (754, 1127), (808, 1158), (698, 1134), (636, 1145), (741, 1145), (758, 1127), (828, 1136), (779, 1128), (773, 1144), (759, 1125), (731, 1152), (777, 1160), (631, 1124), (767, 1145), (819, 1154), (701, 1131), (832, 1157), (748, 1141)]
         : compromised: 0.6199, honest: 0.6678
Round 004: test acc mean=0.7054 ± 0.0279 | min=0.6328 max=0.7496
         : test loss mean=0.6119 ± 0.0189
         : individual accs = ['0.707895', '0.707254', '0.697427', '0.734888', '0.680776', '0.679476', '0.708297', '0.672582', '0.744718', '0.720745', '0.733392', '0.730667', '0.693576', '0.684483', '0.691281', '0.725764', '0.749567', '0.688771', '0.723423', '0.632778']
         : correct/total = [(807, 1140), (819, 1158), (786, 1127), (851, 1158), (772, 1134), (778, 1145), (811, 1145), (758, 1127), (846, 1136), (813, 1128), (839, 1144), (822, 1125), (799, 1152), (794, 1160), (777, 1124), (831, 1145), (865, 1154), (779, 1131), (837, 1157), (722, 1141)]
         : compromised: 0.6866, honest: 0.7101
Round 005: test acc mean=0.7660 ± 0.0219 | min=0.7169 max=0.8028
         : test loss mean=0.5259 ± 0.0227
         : individual accs = ['0.754386', '0.763385', '0.719610', '0.774611', '0.762787', '0.770306', '0.787773', '0.761313', '0.802817', '0.781028', '0.788462', '0.784000', '0.731771', '0.757759', '0.769573', '0.773799', '0.788562', '0.759505', '0.771824', '0.716915']
         : correct/total = [(860, 1140), (884, 1158), (811, 1127), (897, 1158), (865, 1134), (882, 1145), (902, 1145), (858, 1127), (912, 1136), (881, 1128), (902, 1144), (882, 1125), (843, 1152), (879, 1160), (865, 1124), (886, 1145), (910, 1154), (859, 1131), (893, 1157), (818, 1141)]
         : compromised: 0.7548, honest: 0.7688
Round 006: test acc mean=0.8036 ± 0.0176 | min=0.7560 max=0.8336
         : test loss mean=0.4433 ± 0.0207
         : individual accs = ['0.793860', '0.817789', '0.810115', '0.818653', '0.798060', '0.820961', '0.803493', '0.784383', '0.833627', '0.809397', '0.828671', '0.811556', '0.805556', '0.794828', '0.790036', '0.810480', '0.812825', '0.755968', '0.784788', '0.786152']
         : correct/total = [(905, 1140), (947, 1158), (913, 1127), (948, 1158), (905, 1134), (940, 1145), (920, 1145), (884, 1127), (947, 1136), (913, 1128), (948, 1144), (913, 1125), (928, 1152), (922, 1160), (888, 1124), (928, 1145), (938, 1154), (855, 1131), (908, 1157), (897, 1141)]
         : compromised: 0.7943, honest: 0.8059
Round 007: test acc mean=0.8473 ± 0.0131 | min=0.8211 max=0.8693
         : test loss mean=0.3585 ± 0.0133
         : individual accs = ['0.843860', '0.861831', '0.846495', '0.855786', '0.842152', '0.848908', '0.860262', '0.841171', '0.848592', '0.865248', '0.853147', '0.869333', '0.829861', '0.852586', '0.842527', '0.827948', '0.861352', '0.826702', '0.821089', '0.846626']
         : correct/total = [(962, 1140), (998, 1158), (954, 1127), (991, 1158), (955, 1134), (972, 1145), (985, 1145), (948, 1127), (964, 1136), (976, 1128), (976, 1144), (978, 1125), (956, 1152), (989, 1160), (947, 1124), (948, 1145), (994, 1154), (935, 1131), (950, 1157), (966, 1141)]
         : compromised: 0.8395, honest: 0.8492
Round 008: test acc mean=0.8687 ± 0.0098 | min=0.8470 max=0.8830
         : test loss mean=0.3148 ± 0.0127
         : individual accs = ['0.873684', '0.879965', '0.865129', '0.870466', '0.858025', '0.882969', '0.870742', '0.872227', '0.870599', '0.872340', '0.877622', '0.877333', '0.857639', '0.863793', '0.880783', '0.859389', '0.876083', '0.850575', '0.847018', '0.868536']
         : correct/total = [(996, 1140), (1019, 1158), (975, 1127), (1008, 1158), (973, 1134), (1011, 1145), (997, 1145), (983, 1127), (989, 1136), (984, 1128), (1004, 1144), (987, 1125), (988, 1152), (1002, 1160), (990, 1124), (984, 1145), (1011, 1154), (962, 1131), (980, 1157), (991, 1141)]
         : compromised: 0.8637, honest: 0.8700
Round 009: test acc mean=0.8762 ± 0.0119 | min=0.8479 max=0.8921
         : test loss mean=0.2945 ± 0.0226
         : individual accs = ['0.883333', '0.892055', '0.861579', '0.883420', '0.873016', '0.891703', '0.883843', '0.881988', '0.876761', '0.877660', '0.888112', '0.888000', '0.867188', '0.880172', '0.872776', '0.855022', '0.878683', '0.860301', '0.847882', '0.879930']
         : correct/total = [(1007, 1140), (1033, 1158), (971, 1127), (1023, 1158), (990, 1134), (1021, 1145), (1012, 1145), (994, 1127), (996, 1136), (990, 1128), (1016, 1144), (999, 1125), (999, 1152), (1021, 1160), (981, 1124), (979, 1145), (1014, 1154), (973, 1131), (981, 1157), (1004, 1141)]
         : compromised: 0.8748, honest: 0.8765
Round 010: test acc mean=0.8864 ± 0.0083 | min=0.8660 max=0.8998
         : test loss mean=0.2753 ± 0.0151
         : individual accs = ['0.894737', '0.891192', '0.878438', '0.894646', '0.875661', '0.888210', '0.889083', '0.888199', '0.892606', '0.899823', '0.889860', '0.890667', '0.881076', '0.888793', '0.893238', '0.872489', '0.889081', '0.877100', '0.866033', '0.886941']
         : correct/total = [(1020, 1140), (1032, 1158), (990, 1127), (1036, 1158), (993, 1134), (1017, 1145), (1018, 1145), (1001, 1127), (1014, 1136), (1015, 1128), (1018, 1144), (1002, 1125), (1015, 1152), (1031, 1160), (1004, 1124), (999, 1145), (1026, 1154), (992, 1131), (1002, 1157), (1012, 1141)]
         : compromised: 0.8838, honest: 0.8870

=== FINAL RESULTS ===
Dataset: celeba, Nodes: 20, Graph: erdos, Aggregation: balance
Attack: directed_deviation, 20.0% compromised
Final accuracy - Compromised: 0.8838, Honest: 0.8870
Overall test accuracy: mean=0.8864 ± 0.0083

=== BALANCE SUMMARY ===
Node 0: acceptance=0.833
Node 1: acceptance=0.800
Node 2: acceptance=1.000
Node 3: acceptance=0.857
Node 4: acceptance=0.778
Node 5: acceptance=0.800
Node 6: acceptance=0.750
Node 7: acceptance=0.727
Node 8: acceptance=0.571
Node 9: acceptance=1.000
Node 10: acceptance=0.750
Node 11: acceptance=0.750
Node 12: acceptance=0.917
Node 13: acceptance=1.000
Node 14: acceptance=0.714
Node 15: acceptance=0.778
Node 16: acceptance=0.714
Node 17: acceptance=0.875
Node 18: acceptance=0.833
Node 19: acceptance=0.600

=== PARALLEL EXECUTION TIME (realistic for distributed system) ===
  COMMUNICATION (max across nodes):
    - Full model transfer: 0.000s (0.0%)
  COMPUTATION (max across nodes):
    - Filtering: 0.039s (74.9%)
    - Aggregation: 0.013s (25.1%)
  TOTALS:
    - Total computation: 0.053s (100.0%)
    - Total communication: 0.000s (0.0%)
    - Total parallel time: 0.053s

=== PER-NODE AVERAGE TIME ===
  - Filtering: 0.027s
  - Aggregation: 0.006s
  - Model transfer: 0.000s
  - Total per node: 0.033s

=== TOTAL COMPUTATIONAL WORK (sum across all nodes) ===
  - Total filtering: 0.541s
  - Total aggregation: 0.112s
  - Total model transfer: 0.000s
  - Grand total: 0.653s
  - Mean acceptance rate: 0.802

BALANCE Algorithm Properties:
  - Model dimension: 2,219,692
  - No compression: Full parameter comparison
  - Theoretical complexity: O(deg(i)×d)
  - Approach: Full parameter filtering + averaging
