Device: cuda
Seed: 987654321
Looking for images in: /home/student.unimelb.edu.au/mrangwala/Projects/Sketchguard/leaf/data/celeba/data/raw/img_align_celeba
Loading 1 LEAF CelebA train files...
LEAF CelebA train: 9343 users (celebrities), 177457 samples
Looking for images in: /home/student.unimelb.edu.au/mrangwala/Projects/Sketchguard/leaf/data/celeba/data/raw/img_align_celeba
Loading 1 LEAF CelebA test files...
LEAF CelebA test: 9343 users (celebrities), 22831 samples
Found 9343 train users, 9343 test users, 9343 common users
User sample counts range: 31 (max) to 4 (min)
Distributed ALL 9343 users across 20 clients
Users per client: 467 (with 3 clients getting +1 user)
Train partition sizes: [8843, 8998, 8728, 9034, 8866, 8946, 8873, 8776, 8816, 8801, 8913, 8656, 9115, 8921, 8699, 8823, 8912, 8766, 9102, 8869]
Test partition sizes: [1140, 1158, 1127, 1158, 1134, 1145, 1145, 1127, 1136, 1128, 1144, 1125, 1152, 1160, 1124, 1145, 1154, 1131, 1157, 1141]
  Client 0: 8843 train samples, 2 unique classes
  Client 1: 8998 train samples, 2 unique classes
  Client 2: 8728 train samples, 2 unique classes
  Client 3: 9034 train samples, 2 unique classes
  Client 4: 8866 train samples, 2 unique classes
  Client 5: 8946 train samples, 2 unique classes
  Client 6: 8873 train samples, 2 unique classes
  Client 7: 8776 train samples, 2 unique classes
  Client 8: 8816 train samples, 2 unique classes
  Client 9: 8801 train samples, 2 unique classes
  Client 10: 8913 train samples, 2 unique classes
  Client 11: 8656 train samples, 2 unique classes
  Client 12: 9115 train samples, 2 unique classes
  Client 13: 8921 train samples, 2 unique classes
  Client 14: 8699 train samples, 2 unique classes
  Client 15: 8823 train samples, 2 unique classes
  Client 16: 8912 train samples, 2 unique classes
  Client 17: 8766 train samples, 2 unique classes
  Client 18: 9102 train samples, 2 unique classes
  Client 19: 8869 train samples, 2 unique classes
Will sample 4500 samples per client per epoch
Graph: erdos, nodes: 20, edges: 99
Degree statistics: avg=9.90, min=7, max=14
Attack: Compromised 12/20 nodes: [1, 2, 3, 5, 8, 11, 12, 13, 14, 15, 17, 18]
Attack type: gaussian, lambda: 1.0
Model variant: baseline
Model parameters: 2,219,692
BALANCE algorithm:
Balance Config: BALANCEConfig(gamma=2, kappa=1, alpha=0.5, min_neighbors=1)
  - Model dimension: 2,219,692 parameters
  - Complexity: O(N×d) = O(20×2,219,692)
Initial test acc across nodes: mean=0.4978 ± 0.0208
Round 001: test acc mean=0.6438 ± 0.0599 | min=0.5256 max=0.7274
         : test loss mean=0.6807 ± 0.0042
         : individual accs = ['0.689474', '0.684801', '0.533274', '0.710708', '0.525573', '0.599127', '0.639301', '0.624667', '0.573063', '0.702128', '0.619755', '0.704889', '0.727431', '0.677586', '0.587189', '0.666376', '0.688042', '0.649867', '0.700951', '0.572305']
         : correct/total = [(786, 1140), (793, 1158), (601, 1127), (823, 1158), (596, 1134), (686, 1145), (732, 1145), (704, 1127), (651, 1136), (792, 1128), (709, 1144), (793, 1125), (838, 1152), (786, 1160), (660, 1124), (763, 1145), (794, 1154), (735, 1131), (811, 1157), (653, 1141)]
         : compromised: 0.6513, honest: 0.6327
Round 002: test acc mean=0.6431 ± 0.0528 | min=0.5356 max=0.7366
         : test loss mean=0.6672 ± 0.0138
         : individual accs = ['0.659649', '0.673575', '0.578527', '0.664076', '0.599647', '0.542358', '0.622707', '0.678793', '0.692782', '0.685284', '0.687063', '0.592000', '0.694444', '0.589655', '0.535587', '0.654148', '0.736568', '0.637489', '0.671564', '0.666959']
         : correct/total = [(752, 1140), (780, 1158), (652, 1127), (769, 1158), (680, 1134), (621, 1145), (713, 1145), (765, 1127), (787, 1136), (773, 1128), (786, 1144), (666, 1125), (800, 1152), (684, 1160), (602, 1124), (749, 1145), (850, 1154), (721, 1131), (777, 1157), (761, 1141)]
         : compromised: 0.6272, honest: 0.6671
Round 003: test acc mean=0.7036 ± 0.0275 | min=0.6533 max=0.7790
         : test loss mean=0.6217 ± 0.0266
         : individual accs = ['0.711404', '0.702073', '0.687666', '0.723661', '0.682540', '0.696943', '0.724017', '0.702751', '0.712148', '0.735816', '0.723776', '0.653333', '0.675347', '0.709483', '0.677936', '0.701310', '0.779029', '0.656941', '0.707865', '0.708151']
         : correct/total = [(811, 1140), (813, 1158), (775, 1127), (838, 1158), (774, 1134), (798, 1145), (829, 1145), (792, 1127), (809, 1136), (830, 1128), (828, 1144), (735, 1125), (778, 1152), (823, 1160), (762, 1124), (803, 1145), (899, 1154), (743, 1131), (819, 1157), (808, 1141)]
         : compromised: 0.6921, honest: 0.7209
Round 004: test acc mean=0.7756 ± 0.0135 | min=0.7511 max=0.7963
         : test loss mean=0.5178 ± 0.0271
         : individual accs = ['0.790351', '0.768566', '0.776398', '0.766839', '0.794533', '0.782533', '0.774672', '0.771961', '0.776408', '0.794326', '0.796329', '0.782222', '0.770833', '0.756034', '0.778470', '0.752838', '0.783362', '0.756852', '0.751080', '0.787029']
         : correct/total = [(901, 1140), (890, 1158), (875, 1127), (888, 1158), (901, 1134), (896, 1145), (887, 1145), (870, 1127), (882, 1136), (896, 1128), (911, 1144), (880, 1125), (888, 1152), (877, 1160), (875, 1124), (862, 1145), (904, 1154), (856, 1131), (869, 1157), (898, 1141)]
         : compromised: 0.7683, honest: 0.7866
Round 005: test acc mean=0.8229 ± 0.0193 | min=0.7782 max=0.8570
         : test loss mean=0.4060 ± 0.0278
         : individual accs = ['0.830702', '0.846287', '0.811003', '0.811744', '0.820106', '0.778166', '0.829694', '0.827862', '0.840669', '0.851950', '0.834790', '0.823111', '0.799479', '0.807759', '0.828292', '0.810480', '0.857019', '0.815208', '0.795160', '0.837862']
         : correct/total = [(947, 1140), (980, 1158), (914, 1127), (940, 1158), (930, 1134), (891, 1145), (950, 1145), (933, 1127), (955, 1136), (961, 1128), (955, 1144), (926, 1125), (921, 1152), (937, 1160), (931, 1124), (928, 1145), (989, 1154), (922, 1131), (920, 1157), (956, 1141)]
         : compromised: 0.8139, honest: 0.8362
Round 006: test acc mean=0.8607 ± 0.0148 | min=0.8228 max=0.8817
         : test loss mean=0.3287 ± 0.0172
         : individual accs = ['0.862281', '0.881693', '0.863354', '0.867012', '0.848325', '0.865502', '0.867249', '0.849157', '0.873239', '0.874113', '0.877622', '0.874667', '0.843750', '0.849138', '0.854093', '0.845415', '0.880416', '0.847922', '0.822818', '0.865907']
         : correct/total = [(983, 1140), (1021, 1158), (973, 1127), (1004, 1158), (962, 1134), (991, 1145), (993, 1145), (957, 1127), (992, 1136), (986, 1128), (1004, 1144), (984, 1125), (972, 1152), (985, 1160), (960, 1124), (968, 1145), (1016, 1154), (959, 1131), (952, 1157), (988, 1141)]
         : compromised: 0.8574, honest: 0.8656
Round 007: test acc mean=0.8796 ± 0.0088 | min=0.8629 max=0.8955
         : test loss mean=0.2922 ± 0.0136
         : individual accs = ['0.876316', '0.895509', '0.882875', '0.875648', '0.874780', '0.894323', '0.890830', '0.880213', '0.881162', '0.889184', '0.882867', '0.880889', '0.869792', '0.881034', '0.880783', '0.862882', '0.880416', '0.867374', '0.863440', '0.880806']
         : correct/total = [(999, 1140), (1037, 1158), (995, 1127), (1014, 1158), (992, 1134), (1024, 1145), (1020, 1145), (992, 1127), (1001, 1136), (1003, 1128), (1010, 1144), (991, 1125), (1002, 1152), (1022, 1160), (990, 1124), (988, 1145), (1016, 1154), (981, 1131), (999, 1157), (1005, 1141)]
         : compromised: 0.8780, honest: 0.8819
Round 008: test acc mean=0.8833 ± 0.0103 | min=0.8646 max=0.9004
         : test loss mean=0.2812 ± 0.0152
         : individual accs = ['0.892982', '0.888601', '0.868678', '0.876511', '0.880952', '0.899563', '0.888210', '0.889973', '0.867077', '0.882979', '0.891608', '0.894222', '0.885417', '0.877586', '0.900356', '0.864629', '0.889948', '0.874447', '0.870354', '0.881683']
         : correct/total = [(1018, 1140), (1029, 1158), (979, 1127), (1015, 1158), (999, 1134), (1030, 1145), (1017, 1145), (1003, 1127), (985, 1136), (996, 1128), (1020, 1144), (1006, 1125), (1020, 1152), (1018, 1160), (1012, 1124), (990, 1145), (1027, 1154), (989, 1131), (1007, 1157), (1006, 1141)]
         : compromised: 0.8806, honest: 0.8873
Round 009: test acc mean=0.8928 ± 0.0114 | min=0.8539 max=0.9066
         : test loss mean=0.2648 ± 0.0193
         : individual accs = ['0.901754', '0.893782', '0.886424', '0.898964', '0.898589', '0.906550', '0.896943', '0.903283', '0.900528', '0.891844', '0.892483', '0.901333', '0.893229', '0.892241', '0.900356', '0.882969', '0.892548', '0.876216', '0.853933', '0.892200']
         : correct/total = [(1028, 1140), (1035, 1158), (999, 1127), (1041, 1158), (1019, 1134), (1038, 1145), (1027, 1145), (1018, 1127), (1023, 1136), (1006, 1128), (1021, 1144), (1014, 1125), (1029, 1152), (1035, 1160), (1012, 1124), (1011, 1145), (1030, 1154), (991, 1131), (988, 1157), (1018, 1141)]
         : compromised: 0.8905, honest: 0.8962
Round 010: test acc mean=0.8970 ± 0.0083 | min=0.8789 max=0.9096
         : test loss mean=0.2540 ± 0.0149
         : individual accs = ['0.902632', '0.899827', '0.889973', '0.904145', '0.893298', '0.908297', '0.895197', '0.903283', '0.892606', '0.909574', '0.893357', '0.899556', '0.901042', '0.900862', '0.908363', '0.889956', '0.898614', '0.878868', '0.880726', '0.890447']
         : correct/total = [(1029, 1140), (1042, 1158), (1003, 1127), (1047, 1158), (1013, 1134), (1040, 1145), (1025, 1145), (1018, 1127), (1014, 1136), (1026, 1128), (1022, 1144), (1012, 1125), (1038, 1152), (1045, 1160), (1021, 1124), (1019, 1145), (1037, 1154), (994, 1131), (1019, 1157), (1016, 1141)]
         : compromised: 0.8962, honest: 0.8983

=== FINAL RESULTS ===
Dataset: celeba, Nodes: 20, Graph: erdos, Aggregation: balance
Attack: gaussian, 60.0% compromised
Final accuracy - Compromised: 0.8962, Honest: 0.8983
Overall test accuracy: mean=0.8970 ± 0.0083

=== BALANCE SUMMARY ===
Node 0: acceptance=0.417
Node 1: acceptance=0.500
Node 2: acceptance=0.500
Node 3: acceptance=0.571
Node 4: acceptance=0.333
Node 5: acceptance=0.400
Node 6: acceptance=0.333
Node 7: acceptance=0.273
Node 8: acceptance=0.286
Node 9: acceptance=0.545
Node 10: acceptance=0.500
Node 11: acceptance=0.333
Node 12: acceptance=0.500
Node 13: acceptance=0.333
Node 14: acceptance=0.357
Node 15: acceptance=0.444
Node 16: acceptance=0.286
Node 17: acceptance=0.625
Node 18: acceptance=0.333
Node 19: acceptance=0.300

=== PARALLEL EXECUTION TIME (realistic for distributed system) ===
  COMMUNICATION (max across nodes):
    - Full model transfer: 0.000s (0.0%)
  COMPUTATION (max across nodes):
    - Filtering: 0.044s (78.3%)
    - Aggregation: 0.012s (21.7%)
  TOTALS:
    - Total computation: 0.057s (100.0%)
    - Total communication: 0.000s (0.0%)
    - Total parallel time: 0.057s

=== PER-NODE AVERAGE TIME ===
  - Filtering: 0.027s
  - Aggregation: 0.004s
  - Model transfer: 0.000s
  - Total per node: 0.032s

=== TOTAL COMPUTATIONAL WORK (sum across all nodes) ===
  - Total filtering: 0.549s
  - Total aggregation: 0.086s
  - Total model transfer: 0.000s
  - Grand total: 0.635s
  - Mean acceptance rate: 0.409

BALANCE Algorithm Properties:
  - Model dimension: 2,219,692
  - No compression: Full parameter comparison
  - Theoretical complexity: O(deg(i)×d)
  - Approach: Full parameter filtering + averaging
