Device: cuda
Seed: 987654321
Looking for images in: /home/student.unimelb.edu.au/mrangwala/Projects/Sketchguard/leaf/data/celeba/data/raw/img_align_celeba
Loading 1 LEAF CelebA train files...
LEAF CelebA train: 9343 users (celebrities), 177457 samples
Looking for images in: /home/student.unimelb.edu.au/mrangwala/Projects/Sketchguard/leaf/data/celeba/data/raw/img_align_celeba
Loading 1 LEAF CelebA test files...
LEAF CelebA test: 9343 users (celebrities), 22831 samples
Found 9343 train users, 9343 test users, 9343 common users
User sample counts range: 31 (max) to 4 (min)
Distributed ALL 9343 users across 20 clients
Users per client: 467 (with 3 clients getting +1 user)
Train partition sizes: [8843, 8998, 8728, 9034, 8866, 8946, 8873, 8776, 8816, 8801, 8913, 8656, 9115, 8921, 8699, 8823, 8912, 8766, 9102, 8869]
Test partition sizes: [1140, 1158, 1127, 1158, 1134, 1145, 1145, 1127, 1136, 1128, 1144, 1125, 1152, 1160, 1124, 1145, 1154, 1131, 1157, 1141]
  Client 0: 8843 train samples, 2 unique classes
  Client 1: 8998 train samples, 2 unique classes
  Client 2: 8728 train samples, 2 unique classes
  Client 3: 9034 train samples, 2 unique classes
  Client 4: 8866 train samples, 2 unique classes
  Client 5: 8946 train samples, 2 unique classes
  Client 6: 8873 train samples, 2 unique classes
  Client 7: 8776 train samples, 2 unique classes
  Client 8: 8816 train samples, 2 unique classes
  Client 9: 8801 train samples, 2 unique classes
  Client 10: 8913 train samples, 2 unique classes
  Client 11: 8656 train samples, 2 unique classes
  Client 12: 9115 train samples, 2 unique classes
  Client 13: 8921 train samples, 2 unique classes
  Client 14: 8699 train samples, 2 unique classes
  Client 15: 8823 train samples, 2 unique classes
  Client 16: 8912 train samples, 2 unique classes
  Client 17: 8766 train samples, 2 unique classes
  Client 18: 9102 train samples, 2 unique classes
  Client 19: 8869 train samples, 2 unique classes
Will sample 4500 samples per client per epoch
Graph: erdos, nodes: 20, edges: 99
Degree statistics: avg=9.90, min=7, max=14
Attack: Compromised 2/20 nodes: [5, 13]
Attack type: directed_deviation, lambda: 1.0
Model variant: baseline
Model parameters: 2,219,692
Initial test acc across nodes: mean=0.4978 ± 0.0208
Round 001: test acc mean=0.5065 ± 0.0168 | min=0.4788 max=0.5414
         : test loss mean=14.3728 ± 26.5210
         : individual accs = ['0.491228', '0.500864', '0.493345', '0.485320', '0.478836', '0.511790', '0.495197', '0.503993', '0.541373', '0.492021', '0.524476', '0.493333', '0.522569', '0.496552', '0.516014', '0.531878', '0.517331', '0.519010', '0.490925', '0.523225']
         : correct/total = [(560, 1140), (580, 1158), (556, 1127), (562, 1158), (543, 1134), (586, 1145), (567, 1145), (568, 1127), (615, 1136), (555, 1128), (600, 1144), (555, 1125), (602, 1152), (576, 1160), (580, 1124), (609, 1145), (597, 1154), (587, 1131), (568, 1157), (597, 1141)]
         : compromised: 0.5042, honest: 0.5067
Round 002: test acc mean=0.5159 ± 0.0220 | min=0.4773 max=0.5748
         : test loss mean=8.4870 ± 17.4880
         : individual accs = ['0.514035', '0.522453', '0.493345', '0.487047', '0.537919', '0.517031', '0.508297', '0.503993', '0.574824', '0.491135', '0.525350', '0.477333', '0.512153', '0.508621', '0.546263', '0.500437', '0.515598', '0.521662', '0.517718', '0.542507']
         : correct/total = [(586, 1140), (605, 1158), (556, 1127), (564, 1158), (610, 1134), (592, 1145), (582, 1145), (568, 1127), (653, 1136), (554, 1128), (601, 1144), (537, 1125), (590, 1152), (590, 1160), (614, 1124), (573, 1145), (595, 1154), (590, 1131), (599, 1157), (619, 1141)]
         : compromised: 0.5128, honest: 0.5162
Round 003: test acc mean=0.5545 ± 0.0766 | min=0.4996 max=0.7229
         : test loss mean=0.8886 ± 0.7117
         : individual accs = ['0.528947', '0.510363', '0.687666', '0.508636', '0.527337', '0.505677', '0.525764', '0.503993', '0.528169', '0.705674', '0.722902', '0.499556', '0.529514', '0.524138', '0.505338', '0.516157', '0.708839', '0.512821', '0.522040', '0.516214']
         : correct/total = [(603, 1140), (591, 1158), (775, 1127), (589, 1158), (598, 1134), (579, 1145), (602, 1145), (568, 1127), (600, 1136), (796, 1128), (827, 1144), (562, 1125), (610, 1152), (608, 1160), (568, 1124), (591, 1145), (818, 1154), (580, 1131), (604, 1157), (589, 1141)]
         : compromised: 0.5149, honest: 0.5589
Round 004: test acc mean=0.5539 ± 0.0355 | min=0.4933 max=0.6237
         : test loss mean=3.5826 ± 5.5232
         : individual accs = ['0.623684', '0.537997', '0.493345', '0.585492', '0.579365', '0.503930', '0.579913', '0.543922', '0.610035', '0.500000', '0.533217', '0.581333', '0.557292', '0.516379', '0.577402', '0.570306', '0.517331', '0.562334', '0.535004', '0.568799']
         : correct/total = [(711, 1140), (623, 1158), (556, 1127), (678, 1158), (657, 1134), (577, 1145), (664, 1145), (613, 1127), (693, 1136), (564, 1128), (610, 1144), (654, 1125), (642, 1152), (599, 1160), (649, 1124), (653, 1145), (597, 1154), (636, 1131), (619, 1157), (649, 1141)]
         : compromised: 0.5102, honest: 0.5587
Round 005: test acc mean=0.5651 ± 0.1085 | min=0.4514 max=0.7710
         : test loss mean=6.2985 ± 14.7316
         : individual accs = ['0.529825', '0.514680', '0.755989', '0.498273', '0.517637', '0.568559', '0.469869', '0.508429', '0.452465', '0.756206', '0.770979', '0.451556', '0.602431', '0.588793', '0.479537', '0.522271', '0.770364', '0.497790', '0.595506', '0.451358']
         : correct/total = [(604, 1140), (596, 1158), (852, 1127), (577, 1158), (587, 1134), (651, 1145), (538, 1145), (573, 1127), (514, 1136), (853, 1128), (882, 1144), (508, 1125), (694, 1152), (683, 1160), (539, 1124), (598, 1145), (889, 1154), (563, 1131), (689, 1157), (515, 1141)]
         : compromised: 0.5787, honest: 0.5636
Round 006: test acc mean=0.5646 ± 0.0590 | min=0.5103 max=0.7322
         : test loss mean=16.6888 ± 42.3487
         : individual accs = ['0.575439', '0.532815', '0.701863', '0.531952', '0.555556', '0.517031', '0.546725', '0.524401', '0.526408', '0.621454', '0.628497', '0.543111', '0.533854', '0.510345', '0.546263', '0.531004', '0.732236', '0.553492', '0.552290', '0.527607']
         : correct/total = [(656, 1140), (617, 1158), (791, 1127), (616, 1158), (630, 1134), (592, 1145), (626, 1145), (591, 1127), (598, 1136), (701, 1128), (719, 1144), (611, 1125), (615, 1152), (592, 1160), (614, 1124), (608, 1145), (845, 1154), (626, 1131), (639, 1157), (602, 1141)]
         : compromised: 0.5137, honest: 0.5703
Round 007: test acc mean=0.5215 ± 0.0211 | min=0.4960 max=0.5789
         : test loss mean=368.3569 ± 800.1154
         : individual accs = ['0.528947', '0.508636', '0.496007', '0.529361', '0.522046', '0.514410', '0.521397', '0.503993', '0.562500', '0.497340', '0.554196', '0.498667', '0.522569', '0.506897', '0.517794', '0.517031', '0.578856', '0.508400', '0.522040', '0.517967']
         : correct/total = [(603, 1140), (589, 1158), (559, 1127), (613, 1158), (592, 1134), (589, 1145), (597, 1145), (568, 1127), (639, 1136), (561, 1128), (634, 1144), (561, 1125), (602, 1152), (588, 1160), (582, 1124), (592, 1145), (668, 1154), (575, 1131), (604, 1157), (591, 1141)]
         : compromised: 0.5107, honest: 0.5227
Round 008: test acc mean=0.5039 ± 0.0263 | min=0.4439 max=0.5763
         : test loss mean=271.2174 ± 667.7257
         : individual accs = ['0.528070', '0.492228', '0.502218', '0.443869', '0.498236', '0.514410', '0.494323', '0.491571', '0.511444', '0.536348', '0.520105', '0.491556', '0.517361', '0.500862', '0.492883', '0.499563', '0.576256', '0.471264', '0.519447', '0.476775']
         : correct/total = [(602, 1140), (570, 1158), (566, 1127), (514, 1158), (565, 1134), (589, 1145), (566, 1145), (554, 1127), (581, 1136), (605, 1128), (595, 1144), (553, 1125), (596, 1152), (581, 1160), (554, 1124), (572, 1145), (665, 1154), (533, 1131), (601, 1157), (544, 1141)]
         : compromised: 0.5076, honest: 0.5035
Round 009: test acc mean=0.5067 ± 0.0213 | min=0.4715 max=0.5625
         : test loss mean=nan ± nan
         : individual accs = ['0.528947', '0.491364', '0.493345', '0.471503', '0.477954', '0.514410', '0.521397', '0.496007', '0.562500', '0.491135', '0.525350', '0.498667', '0.522569', '0.506897', '0.517794', '0.482969', '0.481802', '0.508400', '0.522040', '0.517967']
         : correct/total = [(603, 1140), (569, 1158), (556, 1127), (546, 1158), (542, 1134), (589, 1145), (597, 1145), (559, 1127), (639, 1136), (554, 1128), (601, 1144), (561, 1125), (602, 1152), (588, 1160), (582, 1124), (553, 1145), (556, 1154), (575, 1131), (604, 1157), (591, 1141)]
         : compromised: 0.5107, honest: 0.5062
Round 010: test acc mean=0.5164 ± 0.0150 | min=0.4911 max=0.5625
         : test loss mean=nan ± nan
         : individual accs = ['0.528947', '0.508636', '0.493345', '0.528497', '0.522046', '0.514410', '0.521397', '0.503993', '0.562500', '0.491135', '0.525350', '0.498667', '0.522569', '0.506897', '0.517794', '0.517031', '0.515598', '0.508400', '0.522040', '0.517967']
         : correct/total = [(603, 1140), (589, 1158), (556, 1127), (612, 1158), (592, 1134), (589, 1145), (597, 1145), (568, 1127), (639, 1136), (554, 1128), (601, 1144), (561, 1125), (602, 1152), (588, 1160), (582, 1124), (592, 1145), (595, 1154), (575, 1131), (604, 1157), (591, 1141)]
         : compromised: 0.5107, honest: 0.5170

=== FINAL RESULTS ===
Dataset: celeba, Nodes: 20, Graph: erdos, Aggregation: d-fedavg
Attack: directed_deviation, 10.0% compromised
Final accuracy - Compromised: 0.5107, Honest: 0.5170
Overall test accuracy: mean=0.5164 ± 0.0150
