Device: cuda
Seed: 987654321
Looking for images in: /home/student.unimelb.edu.au/mrangwala/Projects/Sketchguard/leaf/data/celeba/data/raw/img_align_celeba
Loading 1 LEAF CelebA train files...
LEAF CelebA train: 9343 users (celebrities), 177457 samples
Looking for images in: /home/student.unimelb.edu.au/mrangwala/Projects/Sketchguard/leaf/data/celeba/data/raw/img_align_celeba
Loading 1 LEAF CelebA test files...
LEAF CelebA test: 9343 users (celebrities), 22831 samples
Found 9343 train users, 9343 test users, 9343 common users
User sample counts range: 31 (max) to 4 (min)
Distributed ALL 9343 users across 20 clients
Users per client: 467 (with 3 clients getting +1 user)
Train partition sizes: [8843, 8998, 8728, 9034, 8866, 8946, 8873, 8776, 8816, 8801, 8913, 8656, 9115, 8921, 8699, 8823, 8912, 8766, 9102, 8869]
Test partition sizes: [1140, 1158, 1127, 1158, 1134, 1145, 1145, 1127, 1136, 1128, 1144, 1125, 1152, 1160, 1124, 1145, 1154, 1131, 1157, 1141]
  Client 0: 8843 train samples, 2 unique classes
  Client 1: 8998 train samples, 2 unique classes
  Client 2: 8728 train samples, 2 unique classes
  Client 3: 9034 train samples, 2 unique classes
  Client 4: 8866 train samples, 2 unique classes
  Client 5: 8946 train samples, 2 unique classes
  Client 6: 8873 train samples, 2 unique classes
  Client 7: 8776 train samples, 2 unique classes
  Client 8: 8816 train samples, 2 unique classes
  Client 9: 8801 train samples, 2 unique classes
  Client 10: 8913 train samples, 2 unique classes
  Client 11: 8656 train samples, 2 unique classes
  Client 12: 9115 train samples, 2 unique classes
  Client 13: 8921 train samples, 2 unique classes
  Client 14: 8699 train samples, 2 unique classes
  Client 15: 8823 train samples, 2 unique classes
  Client 16: 8912 train samples, 2 unique classes
  Client 17: 8766 train samples, 2 unique classes
  Client 18: 9102 train samples, 2 unique classes
  Client 19: 8869 train samples, 2 unique classes
Will sample 4500 samples per client per epoch
Graph: erdos, nodes: 20, edges: 99
Degree statistics: avg=9.90, min=7, max=14
Attack: Compromised 2/20 nodes: [5, 13]
Attack type: backdoor, lambda: 1.0
Backdoor target label: 0, trigger size: 8
Model variant: baseline
Model parameters: 2,219,692
Initial test acc across nodes: mean=0.4978 ± 0.0208
Backdoor attack: Created poisoned datasets for 2 compromised nodes
Round 001: test acc mean=0.7123 ± 0.0313 | min=0.6615 max=0.7729
         : test loss mean=0.5951 ± 0.0446
         : individual accs = ['0.671930', '0.661485', '0.678793', '0.699482', '0.693122', '0.735371', '0.772926', '0.710736', '0.763204', '0.679078', '0.727273', '0.705778', '0.756944', '0.739655', '0.739324', '0.710917', '0.711438', '0.686118', '0.677615', '0.723926']
         : correct/total = [(766, 1140), (766, 1158), (765, 1127), (810, 1158), (786, 1134), (842, 1145), (885, 1145), (801, 1127), (867, 1136), (766, 1128), (832, 1144), (794, 1125), (872, 1152), (858, 1160), (831, 1124), (814, 1145), (821, 1154), (776, 1131), (784, 1157), (826, 1141)]
         : compromised: 0.7375, honest: 0.7094
Round 002: test acc mean=0.8087 ± 0.0208 | min=0.7544 max=0.8454
         : test loss mean=0.4289 ± 0.0198
         : individual accs = ['0.754386', '0.826425', '0.787933', '0.817789', '0.811287', '0.845415', '0.807860', '0.821650', '0.777289', '0.825355', '0.831294', '0.822222', '0.817708', '0.818966', '0.808719', '0.786900', '0.790295', '0.813439', '0.791703', '0.817704']
         : correct/total = [(860, 1140), (957, 1158), (888, 1127), (947, 1158), (920, 1134), (968, 1145), (925, 1145), (926, 1127), (883, 1136), (931, 1128), (951, 1144), (925, 1125), (942, 1152), (950, 1160), (909, 1124), (901, 1145), (912, 1154), (920, 1131), (916, 1157), (933, 1141)]
         : compromised: 0.8322, honest: 0.8061
Round 003: test acc mean=0.8543 ± 0.0190 | min=0.8125 max=0.8855
         : test loss mean=0.3311 ± 0.0310
         : individual accs = ['0.860526', '0.860967', '0.836735', '0.859240', '0.858907', '0.880349', '0.868996', '0.839397', '0.812500', '0.839539', '0.885490', '0.864889', '0.865451', '0.830172', '0.867438', '0.824454', '0.867418', '0.852343', '0.836646', '0.873795']
         : correct/total = [(981, 1140), (997, 1158), (943, 1127), (995, 1158), (974, 1134), (1008, 1145), (995, 1145), (946, 1127), (923, 1136), (947, 1128), (1013, 1144), (973, 1125), (997, 1152), (963, 1160), (975, 1124), (944, 1145), (1001, 1154), (964, 1131), (968, 1157), (997, 1141)]
         : compromised: 0.8553, honest: 0.8542
Round 004: test acc mean=0.8766 ± 0.0085 | min=0.8608 max=0.8960
         : test loss mean=0.2924 ± 0.0137
         : individual accs = ['0.875439', '0.889465', '0.867791', '0.873057', '0.879189', '0.882969', '0.885590', '0.881100', '0.872359', '0.878546', '0.895979', '0.880000', '0.868056', '0.872414', '0.870107', '0.872489', '0.874350', '0.865606', '0.860847', '0.886941']
         : correct/total = [(998, 1140), (1030, 1158), (978, 1127), (1011, 1158), (997, 1134), (1011, 1145), (1014, 1145), (993, 1127), (991, 1136), (991, 1128), (1025, 1144), (990, 1125), (1000, 1152), (1012, 1160), (978, 1124), (999, 1145), (1009, 1154), (979, 1131), (996, 1157), (1012, 1141)]
         : compromised: 0.8777, honest: 0.8765
Round 005: test acc mean=0.8908 ± 0.0086 | min=0.8734 max=0.9030
         : test loss mean=0.2656 ± 0.0134
         : individual accs = ['0.891228', '0.898100', '0.879326', '0.898964', '0.880952', '0.900437', '0.895197', '0.897072', '0.888204', '0.899823', '0.902972', '0.896000', '0.891493', '0.880172', '0.892349', '0.873362', '0.896014', '0.885942', '0.875540', '0.892200']
         : correct/total = [(1016, 1140), (1040, 1158), (991, 1127), (1041, 1158), (999, 1134), (1031, 1145), (1025, 1145), (1011, 1127), (1009, 1136), (1015, 1128), (1033, 1144), (1008, 1125), (1027, 1152), (1021, 1160), (1003, 1124), (1000, 1145), (1034, 1154), (1002, 1131), (1013, 1157), (1018, 1141)]
         : compromised: 0.8903, honest: 0.8908
Round 006: test acc mean=0.8952 ± 0.0070 | min=0.8802 max=0.9084
         : test loss mean=0.2531 ± 0.0142
         : individual accs = ['0.891228', '0.899827', '0.880213', '0.898100', '0.897707', '0.898690', '0.896070', '0.905945', '0.895246', '0.901596', '0.895105', '0.908444', '0.892361', '0.896552', '0.893238', '0.881223', '0.898614', '0.892131', '0.884183', '0.898335']
         : correct/total = [(1016, 1140), (1042, 1158), (992, 1127), (1040, 1158), (1018, 1134), (1029, 1145), (1026, 1145), (1021, 1127), (1017, 1136), (1017, 1128), (1024, 1144), (1022, 1125), (1028, 1152), (1040, 1160), (1004, 1124), (1009, 1145), (1037, 1154), (1009, 1131), (1023, 1157), (1025, 1141)]
         : compromised: 0.8976, honest: 0.8950
Round 007: test acc mean=0.8958 ± 0.0070 | min=0.8825 max=0.9067
         : test loss mean=0.2525 ± 0.0130
         : individual accs = ['0.900877', '0.896373', '0.890861', '0.906736', '0.891534', '0.902183', '0.894323', '0.904170', '0.890845', '0.893617', '0.905594', '0.903111', '0.901910', '0.893103', '0.900356', '0.884716', '0.891681', '0.885057', '0.882455', '0.896582']
         : correct/total = [(1027, 1140), (1038, 1158), (1004, 1127), (1050, 1158), (1011, 1134), (1033, 1145), (1024, 1145), (1019, 1127), (1012, 1136), (1008, 1128), (1036, 1144), (1016, 1125), (1039, 1152), (1036, 1160), (1012, 1124), (1013, 1145), (1029, 1154), (1001, 1131), (1021, 1157), (1023, 1141)]
         : compromised: 0.8976, honest: 0.8956
Round 008: test acc mean=0.8976 ± 0.0075 | min=0.8807 max=0.9092
         : test loss mean=0.2460 ± 0.0152
         : individual accs = ['0.893860', '0.901554', '0.889973', '0.903282', '0.906526', '0.899563', '0.909170', '0.897959', '0.890845', '0.904255', '0.904720', '0.896889', '0.905382', '0.894828', '0.899466', '0.886463', '0.901213', '0.885057', '0.880726', '0.900088']
         : correct/total = [(1019, 1140), (1044, 1158), (1003, 1127), (1046, 1158), (1028, 1134), (1030, 1145), (1041, 1145), (1012, 1127), (1012, 1136), (1020, 1128), (1035, 1144), (1009, 1125), (1043, 1152), (1038, 1160), (1011, 1124), (1015, 1145), (1040, 1154), (1001, 1131), (1019, 1157), (1027, 1141)]
         : compromised: 0.8972, honest: 0.8976
Round 009: test acc mean=0.8971 ± 0.0121 | min=0.8700 max=0.9104
         : test loss mean=0.2472 ± 0.0233
         : individual accs = ['0.909649', '0.872193', '0.882875', '0.909326', '0.899471', '0.910044', '0.904803', '0.910382', '0.889965', '0.905142', '0.905594', '0.905778', '0.901042', '0.898276', '0.901246', '0.887336', '0.887348', '0.870027', '0.886776', '0.904470']
         : correct/total = [(1037, 1140), (1010, 1158), (995, 1127), (1053, 1158), (1020, 1134), (1042, 1145), (1036, 1145), (1026, 1127), (1011, 1136), (1021, 1128), (1036, 1144), (1019, 1125), (1038, 1152), (1042, 1160), (1013, 1124), (1016, 1145), (1024, 1154), (984, 1131), (1026, 1157), (1032, 1141)]
         : compromised: 0.9042, honest: 0.8963
Round 010: test acc mean=0.9011 ± 0.0082 | min=0.8781 max=0.9141
         : test loss mean=0.2392 ± 0.0155
         : individual accs = ['0.901754', '0.901554', '0.893523', '0.908463', '0.903880', '0.906550', '0.900437', '0.913931', '0.891725', '0.898936', '0.902098', '0.904000', '0.914062', '0.903448', '0.910142', '0.890830', '0.903813', '0.896552', '0.878133', '0.897458']
         : correct/total = [(1028, 1140), (1044, 1158), (1007, 1127), (1052, 1158), (1025, 1134), (1038, 1145), (1031, 1145), (1030, 1127), (1013, 1136), (1014, 1128), (1032, 1144), (1017, 1125), (1053, 1152), (1048, 1160), (1023, 1124), (1020, 1145), (1043, 1154), (1014, 1131), (1016, 1157), (1024, 1141)]
         : compromised: 0.9050, honest: 0.9006

=== FINAL RESULTS ===
Dataset: celeba, Nodes: 20, Graph: erdos, Aggregation: krum
Attack: backdoor, 10.0% compromised
Final accuracy - Compromised: 0.9050, Honest: 0.9006
Overall test accuracy: mean=0.9011 ± 0.0082

=== BACKDOOR ATTACK SUCCESS RATE (ASR) ===
Target label: 0
Trigger size: 8x8
Overall ASR: 0.5415 ± 0.0329
Honest nodes ASR: 0.5424 ± 0.0338
Compromised nodes ASR: 0.5331 ± 0.0213
Note: Higher ASR indicates more successful backdoor attack
