Device: cuda
Seed: 987654321
Looking for images in: /home/student.unimelb.edu.au/mrangwala/Projects/Sketchguard/leaf/data/celeba/data/raw/img_align_celeba
Loading 1 LEAF CelebA train files...
LEAF CelebA train: 9343 users (celebrities), 177457 samples
Looking for images in: /home/student.unimelb.edu.au/mrangwala/Projects/Sketchguard/leaf/data/celeba/data/raw/img_align_celeba
Loading 1 LEAF CelebA test files...
LEAF CelebA test: 9343 users (celebrities), 22831 samples
Found 9343 train users, 9343 test users, 9343 common users
User sample counts range: 31 (max) to 4 (min)
Distributed ALL 9343 users across 20 clients
Users per client: 467 (with 3 clients getting +1 user)
Train partition sizes: [8843, 8998, 8728, 9034, 8866, 8946, 8873, 8776, 8816, 8801, 8913, 8656, 9115, 8921, 8699, 8823, 8912, 8766, 9102, 8869]
Test partition sizes: [1140, 1158, 1127, 1158, 1134, 1145, 1145, 1127, 1136, 1128, 1144, 1125, 1152, 1160, 1124, 1145, 1154, 1131, 1157, 1141]
  Client 0: 8843 train samples, 2 unique classes
  Client 1: 8998 train samples, 2 unique classes
  Client 2: 8728 train samples, 2 unique classes
  Client 3: 9034 train samples, 2 unique classes
  Client 4: 8866 train samples, 2 unique classes
  Client 5: 8946 train samples, 2 unique classes
  Client 6: 8873 train samples, 2 unique classes
  Client 7: 8776 train samples, 2 unique classes
  Client 8: 8816 train samples, 2 unique classes
  Client 9: 8801 train samples, 2 unique classes
  Client 10: 8913 train samples, 2 unique classes
  Client 11: 8656 train samples, 2 unique classes
  Client 12: 9115 train samples, 2 unique classes
  Client 13: 8921 train samples, 2 unique classes
  Client 14: 8699 train samples, 2 unique classes
  Client 15: 8823 train samples, 2 unique classes
  Client 16: 8912 train samples, 2 unique classes
  Client 17: 8766 train samples, 2 unique classes
  Client 18: 9102 train samples, 2 unique classes
  Client 19: 8869 train samples, 2 unique classes
Will sample 4500 samples per client per epoch
Graph: erdos, nodes: 20, edges: 99
Degree statistics: avg=9.90, min=7, max=14
Attack: Compromised 16/20 nodes: [1, 2, 3, 5, 6, 8, 9, 10, 11, 12, 13, 14, 15, 17, 18, 19]
Attack type: backdoor, lambda: 1.0
Backdoor target label: 0, trigger size: 8
Model variant: baseline
Model parameters: 2,219,692
UBAR ALGORITHM (Two-Stage Byzantine-resilient)
  - Model dimension: 2,219,692 parameters
  - Rho parameter: 0.19999999999999996
  - Stage 1: Distance-based filtering (select 20% closest neighbors)
  - Stage 2: Performance-based selection (loss comparison)
  - Complexity: O(deg(i)×d + deg(i)×inference)
Initial test acc across nodes: mean=0.4978 ± 0.0208
Backdoor attack: Created poisoned datasets for 16 compromised nodes
Round 001: test acc mean=0.5401 ± 0.0571 | min=0.4938 max=0.7149
         : test loss mean=5683.1178 ± 10612.0701
         : individual accs = ['0.683333', '0.508636', '0.494232', '0.536269', '0.571429', '0.514410', '0.521397', '0.560781', '0.562500', '0.493794', '0.525350', '0.498667', '0.522569', '0.506897', '0.517794', '0.521397', '0.714905', '0.508400', '0.522040', '0.517967']
         : correct/total = [(779, 1140), (589, 1158), (557, 1127), (621, 1158), (648, 1134), (589, 1145), (597, 1145), (632, 1127), (639, 1136), (557, 1128), (601, 1144), (561, 1125), (602, 1152), (588, 1160), (582, 1124), (597, 1145), (825, 1154), (575, 1131), (604, 1157), (591, 1141)]
         : compromised: 0.5170, honest: 0.6326
         : ubar stats = ['Node 0: s1=0.167, s2=0.500', 'Node 1: s1=0.100, s2=1.000', 'Node 2: s1=0.125, s2=1.000']...
Round 002: test acc mean=0.5491 ± 0.0867 | min=0.4611 max=0.7686
         : test loss mean=nan ± nan
         : individual accs = ['0.735965', '0.468912', '0.498669', '0.531088', '0.666667', '0.515284', '0.519651', '0.685004', '0.552817', '0.485816', '0.517483', '0.498667', '0.511285', '0.496552', '0.522242', '0.461135', '0.768631', '0.514589', '0.513397', '0.517967']
         : correct/total = [(839, 1140), (543, 1158), (562, 1127), (615, 1158), (756, 1134), (590, 1145), (595, 1145), (772, 1127), (628, 1136), (548, 1128), (592, 1144), (561, 1125), (589, 1152), (576, 1160), (587, 1124), (528, 1145), (887, 1154), (582, 1131), (594, 1157), (591, 1141)]
         : compromised: 0.5078, honest: 0.7141
         : ubar stats = ['Node 0: s1=0.167, s2=0.500', 'Node 1: s1=0.100, s2=1.000', 'Node 2: s1=0.125, s2=1.000']...
Round 003: test acc mean=0.5777 ± 0.1244 | min=0.4911 max=0.8421
         : test loss mean=nan ± nan
         : individual accs = ['0.842105', '0.508636', '0.493345', '0.528497', '0.808642', '0.514410', '0.521397', '0.805679', '0.562500', '0.491135', '0.525350', '0.498667', '0.522569', '0.506897', '0.517794', '0.517031', '0.840555', '0.508400', '0.522040', '0.517967']
         : correct/total = [(960, 1140), (589, 1158), (556, 1127), (612, 1158), (917, 1134), (589, 1145), (597, 1145), (908, 1127), (639, 1136), (554, 1128), (601, 1144), (561, 1125), (602, 1152), (588, 1160), (582, 1124), (592, 1145), (970, 1154), (575, 1131), (604, 1157), (591, 1141)]
         : compromised: 0.5160, honest: 0.8242
         : ubar stats = ['Node 0: s1=0.167, s2=0.500', 'Node 1: s1=0.100, s2=1.000', 'Node 2: s1=0.125, s2=1.000']...
Round 004: test acc mean=0.5814 ± 0.1328 | min=0.4911 max=0.8695
         : test loss mean=nan ± nan
         : individual accs = ['0.767544', '0.508636', '0.493345', '0.528497', '0.869489', '0.514410', '0.521397', '0.866016', '0.562500', '0.491135', '0.525350', '0.498667', '0.522569', '0.506897', '0.517794', '0.517031', '0.867418', '0.508400', '0.522040', '0.517967']
         : correct/total = [(875, 1140), (589, 1158), (556, 1127), (612, 1158), (986, 1134), (589, 1145), (597, 1145), (976, 1127), (639, 1136), (554, 1128), (601, 1144), (561, 1125), (602, 1152), (588, 1160), (582, 1124), (592, 1145), (1001, 1154), (575, 1131), (604, 1157), (591, 1141)]
         : compromised: 0.5160, honest: 0.8426
         : ubar stats = ['Node 0: s1=0.167, s2=0.500', 'Node 1: s1=0.100, s2=1.000', 'Node 2: s1=0.125, s2=1.000']...
Round 005: test acc mean=0.5865 ± 0.1417 | min=0.4911 max=0.8804
         : test loss mean=nan ± nan
         : individual accs = ['0.860526', '0.508636', '0.493345', '0.528497', '0.865079', '0.514410', '0.521397', '0.866903', '0.562500', '0.491135', '0.525350', '0.498667', '0.522569', '0.506897', '0.517794', '0.517031', '0.880416', '0.508400', '0.522040', '0.517967']
         : correct/total = [(981, 1140), (589, 1158), (556, 1127), (612, 1158), (981, 1134), (589, 1145), (597, 1145), (977, 1127), (639, 1136), (554, 1128), (601, 1144), (561, 1125), (602, 1152), (588, 1160), (582, 1124), (592, 1145), (1016, 1154), (575, 1131), (604, 1157), (591, 1141)]
         : compromised: 0.5160, honest: 0.8682
         : ubar stats = ['Node 0: s1=0.167, s2=0.600', 'Node 1: s1=0.100, s2=1.000', 'Node 2: s1=0.125, s2=1.000']...
Round 006: test acc mean=0.5899 ± 0.1484 | min=0.4911 max=0.8900
         : test loss mean=nan ± nan
         : individual accs = ['0.876316', '0.508636', '0.493345', '0.528497', '0.885362', '0.514410', '0.521397', '0.889973', '0.562500', '0.491135', '0.525350', '0.498667', '0.522569', '0.506897', '0.517794', '0.517031', '0.889081', '0.508400', '0.522040', '0.517967']
         : correct/total = [(999, 1140), (589, 1158), (556, 1127), (612, 1158), (1004, 1134), (589, 1145), (597, 1145), (1003, 1127), (639, 1136), (554, 1128), (601, 1144), (561, 1125), (602, 1152), (588, 1160), (582, 1124), (592, 1145), (1026, 1154), (575, 1131), (604, 1157), (591, 1141)]
         : compromised: 0.5160, honest: 0.8852
         : ubar stats = ['Node 0: s1=0.167, s2=0.583', 'Node 1: s1=0.100, s2=1.000', 'Node 2: s1=0.125, s2=1.000']...
Round 007: test acc mean=0.5922 ± 0.1530 | min=0.4911 max=0.9086
         : test loss mean=nan ± nan
         : individual accs = ['0.897368', '0.508636', '0.493345', '0.528497', '0.886243', '0.514410', '0.521397', '0.908607', '0.562500', '0.491135', '0.525350', '0.498667', '0.522569', '0.506897', '0.517794', '0.517031', '0.894281', '0.508400', '0.522040', '0.517967']
         : correct/total = [(1023, 1140), (589, 1158), (556, 1127), (612, 1158), (1005, 1134), (589, 1145), (597, 1145), (1024, 1127), (639, 1136), (554, 1128), (601, 1144), (561, 1125), (602, 1152), (588, 1160), (582, 1124), (592, 1145), (1032, 1154), (575, 1131), (604, 1157), (591, 1141)]
         : compromised: 0.5160, honest: 0.8966
         : ubar stats = ['Node 0: s1=0.167, s2=0.571', 'Node 1: s1=0.100, s2=1.000', 'Node 2: s1=0.125, s2=1.000']...
Round 008: test acc mean=0.5927 ± 0.1540 | min=0.4911 max=0.9095
         : test loss mean=nan ± nan
         : individual accs = ['0.897368', '0.508636', '0.493345', '0.528497', '0.895062', '0.514410', '0.521397', '0.909494', '0.562500', '0.491135', '0.525350', '0.498667', '0.522569', '0.506897', '0.517794', '0.517031', '0.895147', '0.508400', '0.522040', '0.517967']
         : correct/total = [(1023, 1140), (589, 1158), (556, 1127), (612, 1158), (1015, 1134), (589, 1145), (597, 1145), (1025, 1127), (639, 1136), (554, 1128), (601, 1144), (561, 1125), (602, 1152), (588, 1160), (582, 1124), (592, 1145), (1033, 1154), (575, 1131), (604, 1157), (591, 1141)]
         : compromised: 0.5160, honest: 0.8993
         : ubar stats = ['Node 0: s1=0.167, s2=0.562', 'Node 1: s1=0.100, s2=1.000', 'Node 2: s1=0.125, s2=1.000']...
Round 009: test acc mean=0.5924 ± 0.1534 | min=0.4911 max=0.9104
         : test loss mean=nan ± nan
         : individual accs = ['0.879825', '0.508636', '0.493345', '0.528497', '0.901235', '0.514410', '0.521397', '0.910382', '0.562500', '0.491135', '0.525350', '0.498667', '0.522569', '0.506897', '0.517794', '0.517031', '0.899480', '0.508400', '0.522040', '0.517967']
         : correct/total = [(1003, 1140), (589, 1158), (556, 1127), (612, 1158), (1022, 1134), (589, 1145), (597, 1145), (1026, 1127), (639, 1136), (554, 1128), (601, 1144), (561, 1125), (602, 1152), (588, 1160), (582, 1124), (592, 1145), (1038, 1154), (575, 1131), (604, 1157), (591, 1141)]
         : compromised: 0.5160, honest: 0.8977
         : ubar stats = ['Node 0: s1=0.167, s2=0.556', 'Node 1: s1=0.100, s2=1.000', 'Node 2: s1=0.125, s2=1.000']...
Round 010: test acc mean=0.5940 ± 0.1565 | min=0.4911 max=0.9175
         : test loss mean=nan ± nan
         : individual accs = ['0.903509', '0.508636', '0.493345', '0.528497', '0.904762', '0.514410', '0.521397', '0.917480', '0.562500', '0.491135', '0.525350', '0.498667', '0.522569', '0.506897', '0.517794', '0.517031', '0.896880', '0.508400', '0.522040', '0.517967']
         : correct/total = [(1030, 1140), (589, 1158), (556, 1127), (612, 1158), (1026, 1134), (589, 1145), (597, 1145), (1034, 1127), (639, 1136), (554, 1128), (601, 1144), (561, 1125), (602, 1152), (588, 1160), (582, 1124), (592, 1145), (1035, 1154), (575, 1131), (604, 1157), (591, 1141)]
         : compromised: 0.5160, honest: 0.9057
         : ubar stats = ['Node 0: s1=0.167, s2=0.600', 'Node 1: s1=0.100, s2=1.000', 'Node 2: s1=0.125, s2=1.000']...

=== FINAL RESULTS ===
Dataset: celeba, Nodes: 20, Graph: erdos, Aggregation: ubar
Attack: backdoor, 80.0% compromised
Final accuracy - Compromised: 0.5160, Honest: 0.9057
Overall test accuracy: mean=0.5940 ± 0.1565

=== BACKDOOR ATTACK SUCCESS RATE (ASR) ===
Target label: 0
Trigger size: 8x8
Overall ASR: 0.9122 ± 0.1759
Honest nodes ASR: 0.5610 ± 0.0240
Compromised nodes ASR: 1.0000 ± 0.0000
Note: Higher ASR indicates more successful backdoor attack

=== UBAR SUMMARY ===
Node 0: stage1=0.167, stage2=0.600, overall=0.100
Node 1: stage1=0.100, stage2=1.000, overall=0.100
Node 2: stage1=0.125, stage2=1.000, overall=0.125
Node 3: stage1=0.143, stage2=1.000, overall=0.143
Node 4: stage1=0.111, stage2=1.000, overall=0.111
Node 5: stage1=0.100, stage2=1.000, overall=0.100
Node 6: stage1=0.167, stage2=0.500, overall=0.083
Node 7: stage1=0.182, stage2=0.500, overall=0.091
Node 8: stage1=0.143, stage2=1.000, overall=0.143
Node 9: stage1=0.182, stage2=0.600, overall=0.109
Node 10: stage1=0.125, stage2=1.000, overall=0.125
Node 11: stage1=0.167, stage2=0.550, overall=0.092
Node 12: stage1=0.167, stage2=0.600, overall=0.100
Node 13: stage1=0.111, stage2=1.000, overall=0.111
Node 14: stage1=0.143, stage2=0.600, overall=0.086
Node 15: stage1=0.111, stage2=1.000, overall=0.111
Node 16: stage1=0.143, stage2=1.000, overall=0.143
Node 17: stage1=0.125, stage2=1.000, overall=0.125
Node 18: stage1=0.167, stage2=0.600, overall=0.100
Node 19: stage1=0.100, stage2=1.000, overall=0.100

=== PARALLEL EXECUTION TIME (realistic for distributed system) ===
  COMMUNICATION (max across nodes):
    - Full model transfer: 0.000s (0.0%)
  COMPUTATION (max across nodes):
    - Distance computation: 0.034s (16.3%)
    - Loss computation: 0.173s (82.1%)
    - Aggregation: 0.003s (1.6%)
  TOTALS:
    - Total computation: 0.211s (100.0%)
    - Total communication: 0.000s (0.0%)
    - Total parallel time: 0.211s

=== PER-NODE AVERAGE TIME ===
  - Distance computation: 0.025s
  - Loss computation: 0.133s
  - Aggregation: 0.003s
  - Model transfer: 0.000s
  - Total per node: 0.161s

=== TOTAL COMPUTATIONAL WORK (sum across all nodes) ===
  - Total distance computation: 0.497s
  - Total loss computation: 2.668s
  - Total aggregation: 0.052s
  - Total model transfer: 0.000s
  - Grand total: 3.217s
  - Mean Stage 1 acceptance rate: 0.139
  - Mean Stage 2 acceptance rate: 0.827
  - Overall acceptance rate: 0.115

UBAR Algorithm Properties:
  - Model dimension: 2,219,692
  - Rho parameter: 0.19999999999999996
  - Two-stage approach: Distance filtering + loss evaluation
  - Stage 1 selects: 20% of neighbors
  - Stage 2 uses: Training sample loss comparison
  - Theoretical complexity: O(deg(i)×d + deg(i)×inference)
  - Approach: UBAR paper implementation
