Device: cuda
Seed: 987654321
Looking for images in: /home/student.unimelb.edu.au/mrangwala/Projects/Sketchguard/leaf/data/celeba/data/raw/img_align_celeba
Loading 1 LEAF CelebA train files...
LEAF CelebA train: 9343 users (celebrities), 177457 samples
Looking for images in: /home/student.unimelb.edu.au/mrangwala/Projects/Sketchguard/leaf/data/celeba/data/raw/img_align_celeba
Loading 1 LEAF CelebA test files...
LEAF CelebA test: 9343 users (celebrities), 22831 samples
Found 9343 train users, 9343 test users, 9343 common users
User sample counts range: 31 (max) to 4 (min)
Distributed ALL 9343 users across 20 clients
Users per client: 467 (with 3 clients getting +1 user)
Train partition sizes: [8843, 8998, 8728, 9034, 8866, 8946, 8873, 8776, 8816, 8801, 8913, 8656, 9115, 8921, 8699, 8823, 8912, 8766, 9102, 8869]
Test partition sizes: [1140, 1158, 1127, 1158, 1134, 1145, 1145, 1127, 1136, 1128, 1144, 1125, 1152, 1160, 1124, 1145, 1154, 1131, 1157, 1141]
  Client 0: 8843 train samples, 2 unique classes
  Client 1: 8998 train samples, 2 unique classes
  Client 2: 8728 train samples, 2 unique classes
  Client 3: 9034 train samples, 2 unique classes
  Client 4: 8866 train samples, 2 unique classes
  Client 5: 8946 train samples, 2 unique classes
  Client 6: 8873 train samples, 2 unique classes
  Client 7: 8776 train samples, 2 unique classes
  Client 8: 8816 train samples, 2 unique classes
  Client 9: 8801 train samples, 2 unique classes
  Client 10: 8913 train samples, 2 unique classes
  Client 11: 8656 train samples, 2 unique classes
  Client 12: 9115 train samples, 2 unique classes
  Client 13: 8921 train samples, 2 unique classes
  Client 14: 8699 train samples, 2 unique classes
  Client 15: 8823 train samples, 2 unique classes
  Client 16: 8912 train samples, 2 unique classes
  Client 17: 8766 train samples, 2 unique classes
  Client 18: 9102 train samples, 2 unique classes
  Client 19: 8869 train samples, 2 unique classes
Will sample 4500 samples per client per epoch
Graph: erdos, nodes: 20, edges: 126
Degree statistics: avg=12.60, min=8, max=16
Attack: Compromised 8/20 nodes: [1, 5, 11, 12, 13, 14, 17, 18]
Attack type: backdoor, lambda: 1.0
Backdoor target label: 0, trigger size: 8
Model variant: baseline
Model parameters: 2,219,692
Initial test acc across nodes: mean=0.4978 ± 0.0208
Backdoor attack: Created poisoned datasets for 8 compromised nodes
Round 001: test acc mean=0.6790 ± 0.0740 | min=0.4773 max=0.7569
         : test loss mean=1385.7568 ± 5835.3211
         : individual accs = ['0.671930', '0.661485', '0.678793', '0.721071', '0.693122', '0.547598', '0.701310', '0.710736', '0.722711', '0.679078', '0.477273', '0.705778', '0.756944', '0.739655', '0.739324', '0.752838', '0.694107', '0.524315', '0.677615', '0.723926']
         : correct/total = [(766, 1140), (766, 1158), (765, 1127), (835, 1158), (786, 1134), (627, 1145), (803, 1145), (801, 1127), (821, 1136), (766, 1128), (546, 1144), (794, 1125), (872, 1152), (858, 1160), (831, 1124), (862, 1145), (801, 1154), (593, 1131), (784, 1157), (826, 1141)]
         : compromised: 0.6691, honest: 0.6856
Round 002: test acc mean=0.7581 ± 0.1164 | min=0.4747 max=0.8356
         : test loss mean=1345255.3409 ± 4654807.2147
         : individual accs = ['0.822807', '0.826425', '0.787933', '0.817789', '0.817460', '0.485590', '0.807860', '0.821650', '0.777289', '0.825355', '0.474650', '0.835556', '0.817708', '0.799138', '0.808719', '0.786900', '0.790295', '0.491600', '0.791703', '0.776512']
         : correct/total = [(938, 1140), (957, 1158), (888, 1127), (947, 1158), (927, 1134), (556, 1145), (925, 1145), (926, 1127), (883, 1136), (931, 1128), (543, 1144), (940, 1125), (942, 1152), (927, 1160), (909, 1124), (901, 1145), (912, 1154), (556, 1131), (916, 1157), (886, 1141)]
         : compromised: 0.7321, honest: 0.7755
Round 003: test acc mean=0.7817 ± 0.1122 | min=0.5084 max=0.8526
         : test loss mean=751617734019.9983 ± 3276225746764.3765
         : individual accs = ['0.832456', '0.838515', '0.813665', '0.846287', '0.823633', '0.514410', '0.834934', '0.818988', '0.838028', '0.810284', '0.525350', '0.838222', '0.820312', '0.852586', '0.814947', '0.835808', '0.828423', '0.508400', '0.807260', '0.831727']
         : correct/total = [(949, 1140), (971, 1158), (917, 1127), (980, 1158), (934, 1134), (589, 1145), (956, 1145), (923, 1127), (952, 1136), (914, 1128), (601, 1144), (943, 1125), (945, 1152), (989, 1160), (916, 1124), (957, 1145), (956, 1154), (575, 1131), (934, 1157), (949, 1141)]
         : compromised: 0.7493, honest: 0.8033
Round 004: test acc mean=0.8110 ± 0.1244 | min=0.5084 max=0.8791
         : test loss mean=531378330034.7797 ± 1979756204139.6479
         : individual accs = ['0.876316', '0.852332', '0.853594', '0.871330', '0.860670', '0.514410', '0.873362', '0.874002', '0.853873', '0.875000', '0.525350', '0.879111', '0.856771', '0.855172', '0.855872', '0.851528', '0.868284', '0.508400', '0.839239', '0.875548']
         : correct/total = [(999, 1140), (987, 1158), (962, 1127), (1009, 1158), (976, 1134), (589, 1145), (1000, 1145), (985, 1127), (970, 1136), (987, 1128), (601, 1144), (989, 1125), (987, 1152), (992, 1160), (962, 1124), (975, 1145), (1002, 1154), (575, 1131), (971, 1157), (999, 1141)]
         : compromised: 0.7702, honest: 0.8382
Round 005: test acc mean=0.8060 ± 0.1496 | min=0.4820 max=0.9004
         : test loss mean=0.3624 ± 0.1659
         : individual accs = ['0.881579', '0.873057', '0.879326', '0.878238', '0.878307', '0.514410', '0.887336', '0.879326', '0.881162', '0.891844', '0.525350', '0.900444', '0.884549', '0.868966', '0.878114', '0.867249', '0.893414', '0.508400', '0.867761', '0.482033']
         : correct/total = [(1005, 1140), (1011, 1158), (991, 1127), (1017, 1158), (996, 1134), (589, 1145), (1016, 1145), (991, 1127), (1001, 1136), (1006, 1128), (601, 1144), (1013, 1125), (1019, 1152), (1008, 1160), (987, 1124), (993, 1145), (1031, 1154), (575, 1131), (1004, 1157), (550, 1141)]
         : compromised: 0.7870, honest: 0.8188
Round 006: test acc mean=0.7500 ± 0.1745 | min=0.4987 max=0.8980
         : test loss mean=0.4267 ± 0.1969
         : individual accs = ['0.889474', '0.853195', '0.861579', '0.880829', '0.891534', '0.514410', '0.521397', '0.503993', '0.889965', '0.898050', '0.525350', '0.498667', '0.888889', '0.868103', '0.859431', '0.862009', '0.896014', '0.508400', '0.871219', '0.517967']
         : correct/total = [(1014, 1140), (988, 1158), (971, 1127), (1020, 1158), (1011, 1134), (589, 1145), (597, 1145), (568, 1127), (1011, 1136), (1013, 1128), (601, 1144), (561, 1125), (1024, 1152), (1007, 1160), (966, 1124), (987, 1145), (1034, 1154), (575, 1131), (1008, 1157), (591, 1141)]
         : compromised: 0.7328, honest: 0.7615
Round 007: test acc mean=0.6485 ± 0.1788 | min=0.4987 max=0.9051
         : test loss mean=0.5406 ± 0.2076
         : individual accs = ['0.528947', '0.888601', '0.889973', '0.528497', '0.522046', '0.514410', '0.521397', '0.503993', '0.891725', '0.905142', '0.525350', '0.498667', '0.522569', '0.894828', '0.517794', '0.517031', '0.895147', '0.508400', '0.878133', '0.517967']
         : correct/total = [(603, 1140), (1029, 1158), (1003, 1127), (612, 1158), (592, 1134), (589, 1145), (597, 1145), (568, 1127), (1013, 1136), (1021, 1128), (601, 1144), (561, 1125), (602, 1152), (1038, 1160), (582, 1124), (592, 1145), (1033, 1154), (575, 1131), (1016, 1157), (591, 1141)]
         : compromised: 0.6529, honest: 0.6456
Round 008: test acc mean=0.4916 ± 0.0205 | min=0.4375 max=0.5289
         : test loss mean=0.9734 ± 0.2154
         : individual accs = ['0.528947', '0.508636', '0.506655', '0.471503', '0.522046', '0.485590', '0.478603', '0.496007', '0.437500', '0.491135', '0.474650', '0.501333', '0.477431', '0.506897', '0.482206', '0.482969', '0.484402', '0.491600', '0.522040', '0.482033']
         : correct/total = [(603, 1140), (589, 1158), (571, 1127), (546, 1158), (592, 1134), (556, 1145), (548, 1145), (559, 1127), (497, 1136), (554, 1128), (543, 1144), (564, 1125), (550, 1152), (588, 1160), (542, 1124), (553, 1145), (559, 1154), (556, 1131), (604, 1157), (550, 1141)]
         : compromised: 0.4970, honest: 0.4880
Round 009: test acc mean=0.4836 ± 0.0150 | min=0.4375 max=0.5089
         : test loss mean=1.3139 ± 0.1460
         : individual accs = ['0.471053', '0.491364', '0.506655', '0.471503', '0.477954', '0.485590', '0.478603', '0.496007', '0.437500', '0.508865', '0.474650', '0.501333', '0.477431', '0.493103', '0.482206', '0.482969', '0.484402', '0.491600', '0.477960', '0.482033']
         : correct/total = [(537, 1140), (569, 1158), (571, 1127), (546, 1158), (542, 1134), (556, 1145), (548, 1145), (559, 1127), (497, 1136), (574, 1128), (543, 1144), (564, 1125), (550, 1152), (572, 1160), (542, 1124), (553, 1145), (559, 1154), (556, 1131), (553, 1157), (550, 1141)]
         : compromised: 0.4876, honest: 0.4810
Round 010: test acc mean=0.4836 ± 0.0150 | min=0.4375 max=0.5089
         : test loss mean=1.4851 ± 0.2239
         : individual accs = ['0.471053', '0.491364', '0.506655', '0.471503', '0.477954', '0.485590', '0.478603', '0.496007', '0.437500', '0.508865', '0.474650', '0.501333', '0.477431', '0.493103', '0.482206', '0.482969', '0.484402', '0.491600', '0.477960', '0.482033']
         : correct/total = [(537, 1140), (569, 1158), (571, 1127), (546, 1158), (542, 1134), (556, 1145), (548, 1145), (559, 1127), (497, 1136), (574, 1128), (543, 1144), (564, 1125), (550, 1152), (572, 1160), (542, 1124), (553, 1145), (559, 1154), (556, 1131), (553, 1157), (550, 1141)]
         : compromised: 0.4876, honest: 0.4810

=== FINAL RESULTS ===
Dataset: celeba, Nodes: 20, Graph: erdos, Aggregation: krum
Attack: backdoor, 40.0% compromised
Final accuracy - Compromised: 0.4876, Honest: 0.4810
Overall test accuracy: mean=0.4836 ± 0.0150

=== BACKDOOR ATTACK SUCCESS RATE (ASR) ===
Target label: 0
Trigger size: 8x8
Overall ASR: 0.0000 ± 0.0000
Honest nodes ASR: 0.0000 ± 0.0000
Compromised nodes ASR: 0.0000 ± 0.0000
Note: Higher ASR indicates more successful backdoor attack
