Device: cuda
Seed: 987654321
Looking for images in: /home/student.unimelb.edu.au/mrangwala/Projects/Sketchguard/leaf/data/celeba/data/raw/img_align_celeba
Loading 1 LEAF CelebA train files...
LEAF CelebA train: 9343 users (celebrities), 177457 samples
Looking for images in: /home/student.unimelb.edu.au/mrangwala/Projects/Sketchguard/leaf/data/celeba/data/raw/img_align_celeba
Loading 1 LEAF CelebA test files...
LEAF CelebA test: 9343 users (celebrities), 22831 samples
Found 9343 train users, 9343 test users, 9343 common users
User sample counts range: 31 (max) to 4 (min)
Distributed ALL 9343 users across 20 clients
Users per client: 467 (with 3 clients getting +1 user)
Train partition sizes: [8843, 8998, 8728, 9034, 8866, 8946, 8873, 8776, 8816, 8801, 8913, 8656, 9115, 8921, 8699, 8823, 8912, 8766, 9102, 8869]
Test partition sizes: [1140, 1158, 1127, 1158, 1134, 1145, 1145, 1127, 1136, 1128, 1144, 1125, 1152, 1160, 1124, 1145, 1154, 1131, 1157, 1141]
  Client 0: 8843 train samples, 2 unique classes
  Client 1: 8998 train samples, 2 unique classes
  Client 2: 8728 train samples, 2 unique classes
  Client 3: 9034 train samples, 2 unique classes
  Client 4: 8866 train samples, 2 unique classes
  Client 5: 8946 train samples, 2 unique classes
  Client 6: 8873 train samples, 2 unique classes
  Client 7: 8776 train samples, 2 unique classes
  Client 8: 8816 train samples, 2 unique classes
  Client 9: 8801 train samples, 2 unique classes
  Client 10: 8913 train samples, 2 unique classes
  Client 11: 8656 train samples, 2 unique classes
  Client 12: 9115 train samples, 2 unique classes
  Client 13: 8921 train samples, 2 unique classes
  Client 14: 8699 train samples, 2 unique classes
  Client 15: 8823 train samples, 2 unique classes
  Client 16: 8912 train samples, 2 unique classes
  Client 17: 8766 train samples, 2 unique classes
  Client 18: 9102 train samples, 2 unique classes
  Client 19: 8869 train samples, 2 unique classes
Will sample 4500 samples per client per epoch
Graph: erdos, nodes: 20, edges: 99
Degree statistics: avg=9.90, min=7, max=14
Attack: Compromised 6/20 nodes: [5, 12, 13, 14, 17, 18]
Attack type: krum, lambda: 1.0
Model variant: baseline
Model parameters: 2,219,692
UBAR ALGORITHM (Two-Stage Byzantine-resilient)
  - Model dimension: 2,219,692 parameters
  - Rho parameter: 0.7
  - Stage 1: Distance-based filtering (select 70% closest neighbors)
  - Stage 2: Performance-based selection (loss comparison)
  - Complexity: O(deg(i)×d + deg(i)×inference)
Initial test acc across nodes: mean=0.4978 ± 0.0208
Round 001: test acc mean=0.6332 ± 0.0674 | min=0.5220 max=0.7205
         : test loss mean=0.6781 ± 0.0067
         : individual accs = ['0.625439', '0.693437', '0.563443', '0.701209', '0.529101', '0.654148', '0.685590', '0.534161', '0.573063', '0.681738', '0.530594', '0.614222', '0.720486', '0.688793', '0.663701', '0.707424', '0.715771', '0.646331', '0.522040', '0.613497']
         : correct/total = [(713, 1140), (803, 1158), (635, 1127), (812, 1158), (600, 1134), (749, 1145), (785, 1145), (602, 1127), (651, 1136), (769, 1128), (607, 1144), (691, 1125), (830, 1152), (799, 1160), (746, 1124), (810, 1145), (826, 1154), (731, 1131), (604, 1157), (700, 1141)]
         : compromised: 0.6492, honest: 0.6263
         : ubar stats = ['Node 0: s1=0.667, s2=0.125', 'Node 1: s1=0.700, s2=0.571', 'Node 2: s1=0.625, s2=0.200']...
Round 002: test acc mean=0.6697 ± 0.0767 | min=0.5187 max=0.7865
         : test loss mean=0.6415 ± 0.0436
         : individual accs = ['0.639474', '0.680484', '0.581189', '0.721934', '0.522928', '0.541485', '0.618341', '0.660160', '0.742958', '0.732270', '0.698427', '0.698667', '0.714410', '0.635345', '0.518683', '0.731004', '0.759965', '0.717065', '0.786517', '0.693252']
         : correct/total = [(729, 1140), (788, 1158), (655, 1127), (836, 1158), (593, 1134), (620, 1145), (708, 1145), (744, 1127), (844, 1136), (826, 1128), (799, 1144), (786, 1125), (823, 1152), (737, 1160), (583, 1124), (837, 1145), (877, 1154), (811, 1131), (910, 1157), (791, 1141)]
         : compromised: 0.6523, honest: 0.6772
         : ubar stats = ['Node 0: s1=0.667, s2=0.125', 'Node 1: s1=0.700, s2=0.643', 'Node 2: s1=0.625, s2=0.200']...
Round 003: test acc mean=0.7373 ± 0.0752 | min=0.5276 max=0.8546
         : test loss mean=0.5751 ± 0.0917
         : individual accs = ['0.751754', '0.699482', '0.810115', '0.822971', '0.636684', '0.644541', '0.697817', '0.719610', '0.756162', '0.854610', '0.756119', '0.805333', '0.689236', '0.726724', '0.527580', '0.824454', '0.765165', '0.793988', '0.756266', '0.708151']
         : correct/total = [(857, 1140), (810, 1158), (913, 1127), (953, 1158), (722, 1134), (738, 1145), (799, 1145), (811, 1127), (859, 1136), (964, 1128), (865, 1144), (906, 1125), (794, 1152), (843, 1160), (593, 1124), (944, 1145), (883, 1154), (898, 1131), (875, 1157), (808, 1141)]
         : compromised: 0.6897, honest: 0.7577
         : ubar stats = ['Node 0: s1=0.667, s2=0.167', 'Node 1: s1=0.700, s2=0.667', 'Node 2: s1=0.625, s2=0.200']...
Round 004: test acc mean=0.8013 ± 0.0462 | min=0.7349 max=0.8812
         : test loss mean=0.4720 ± 0.0942
         : individual accs = ['0.781579', '0.734888', '0.845608', '0.866149', '0.765432', '0.758079', '0.747598', '0.823425', '0.827465', '0.881206', '0.808566', '0.860444', '0.757812', '0.772414', '0.749110', '0.854148', '0.835355', '0.737401', '0.831461', '0.788782']
         : correct/total = [(891, 1140), (851, 1158), (953, 1127), (1003, 1158), (868, 1134), (868, 1145), (856, 1145), (928, 1127), (940, 1136), (994, 1128), (925, 1144), (968, 1125), (873, 1152), (896, 1160), (842, 1124), (978, 1145), (964, 1154), (834, 1131), (962, 1157), (900, 1141)]
         : compromised: 0.7677, honest: 0.8158
         : ubar stats = ['Node 0: s1=0.667, s2=0.156', 'Node 1: s1=0.700, s2=0.643', 'Node 2: s1=0.625, s2=0.200']...
Round 005: test acc mean=0.8528 ± 0.0264 | min=0.7569 max=0.8843
         : test loss mean=0.3663 ± 0.0586
         : individual accs = ['0.866667', '0.872193', '0.841171', '0.884283', '0.843915', '0.833188', '0.867249', '0.873114', '0.836268', '0.867021', '0.861014', '0.875556', '0.756944', '0.860345', '0.858541', '0.860262', '0.857886', '0.831123', '0.842697', '0.865907']
         : correct/total = [(988, 1140), (1010, 1158), (948, 1127), (1024, 1158), (957, 1134), (954, 1145), (993, 1145), (984, 1127), (950, 1136), (978, 1128), (985, 1144), (985, 1125), (872, 1152), (998, 1160), (965, 1124), (985, 1145), (990, 1154), (940, 1131), (975, 1157), (988, 1141)]
         : compromised: 0.8305, honest: 0.8623
         : ubar stats = ['Node 0: s1=0.667, s2=0.200', 'Node 1: s1=0.700, s2=0.629', 'Node 2: s1=0.625, s2=0.200']...
Round 006: test acc mean=0.8737 ± 0.0121 | min=0.8462 max=0.8908
         : test loss mean=0.3087 ± 0.0233
         : individual accs = ['0.887719', '0.875648', '0.872227', '0.881693', '0.865079', '0.885590', '0.879476', '0.882875', '0.871479', '0.884752', '0.881119', '0.887111', '0.863715', '0.869828', '0.857651', '0.851528', '0.890815', '0.846154', '0.867761', '0.871166']
         : correct/total = [(1012, 1140), (1014, 1158), (983, 1127), (1021, 1158), (981, 1134), (1014, 1145), (1007, 1145), (995, 1127), (990, 1136), (998, 1128), (1008, 1144), (998, 1125), (995, 1152), (1009, 1160), (964, 1124), (975, 1145), (1028, 1154), (957, 1131), (1004, 1157), (994, 1141)]
         : compromised: 0.8651, honest: 0.8773
         : ubar stats = ['Node 0: s1=0.667, s2=0.250', 'Node 1: s1=0.700, s2=0.667', 'Node 2: s1=0.625, s2=0.300']...
Round 007: test acc mean=0.8864 ± 0.0080 | min=0.8663 max=0.9004
         : test loss mean=0.2768 ± 0.0166
         : individual accs = ['0.890351', '0.893782', '0.881988', '0.889465', '0.888889', '0.890830', '0.889956', '0.889973', '0.878521', '0.897163', '0.890734', '0.900444', '0.866319', '0.885345', '0.883452', '0.874236', '0.891681', '0.876216', '0.880726', '0.888694']
         : correct/total = [(1015, 1140), (1035, 1158), (994, 1127), (1030, 1158), (1008, 1134), (1020, 1145), (1019, 1145), (1003, 1127), (998, 1136), (1012, 1128), (1019, 1144), (1013, 1125), (998, 1152), (1027, 1160), (993, 1124), (1001, 1145), (1029, 1154), (991, 1131), (1019, 1157), (1014, 1141)]
         : compromised: 0.8805, honest: 0.8890
         : ubar stats = ['Node 0: s1=0.667, s2=0.232', 'Node 1: s1=0.700, s2=0.633', 'Node 2: s1=0.625, s2=0.286']...
Round 008: test acc mean=0.8892 ± 0.0092 | min=0.8592 max=0.9012
         : test loss mean=0.2678 ± 0.0176
         : individual accs = ['0.890351', '0.891192', '0.889086', '0.896373', '0.895062', '0.891703', '0.885590', '0.892635', '0.859155', '0.894504', '0.895979', '0.899556', '0.881944', '0.894828', '0.901246', '0.879476', '0.894281', '0.885942', '0.879862', '0.884312']
         : correct/total = [(1015, 1140), (1032, 1158), (1002, 1127), (1038, 1158), (1015, 1134), (1021, 1145), (1014, 1145), (1006, 1127), (976, 1136), (1009, 1128), (1025, 1144), (1012, 1125), (1016, 1152), (1038, 1160), (1013, 1124), (1007, 1145), (1032, 1154), (1002, 1131), (1018, 1157), (1009, 1141)]
         : compromised: 0.8893, honest: 0.8891
         : ubar stats = ['Node 0: s1=0.667, s2=0.219', 'Node 1: s1=0.700, s2=0.643', 'Node 2: s1=0.625, s2=0.275']...
Round 009: test acc mean=0.8948 ± 0.0098 | min=0.8660 max=0.9100
         : test loss mean=0.2591 ± 0.0190
         : individual accs = ['0.900877', '0.885147', '0.883762', '0.900691', '0.898589', '0.910044', '0.895197', '0.900621', '0.901408', '0.890071', '0.902972', '0.904889', '0.894097', '0.900862', '0.899466', '0.882096', '0.899480', '0.886826', '0.866033', '0.893076']
         : correct/total = [(1027, 1140), (1025, 1158), (996, 1127), (1043, 1158), (1019, 1134), (1042, 1145), (1025, 1145), (1015, 1127), (1024, 1136), (1004, 1128), (1033, 1144), (1018, 1125), (1030, 1152), (1045, 1160), (1011, 1124), (1010, 1145), (1038, 1154), (1003, 1131), (1002, 1157), (1019, 1141)]
         : compromised: 0.8929, honest: 0.8956
         : ubar stats = ['Node 0: s1=0.667, s2=0.236', 'Node 1: s1=0.700, s2=0.587', 'Node 2: s1=0.625, s2=0.267']...
Round 010: test acc mean=0.8978 ± 0.0102 | min=0.8729 max=0.9128
         : test loss mean=0.2499 ± 0.0176
         : individual accs = ['0.907895', '0.900691', '0.880213', '0.904145', '0.904762', '0.910917', '0.899563', '0.897959', '0.892606', '0.902482', '0.909091', '0.903111', '0.894097', '0.893966', '0.912811', '0.886463', '0.902080', '0.884173', '0.872947', '0.895706']
         : correct/total = [(1035, 1140), (1043, 1158), (992, 1127), (1047, 1158), (1026, 1134), (1043, 1145), (1030, 1145), (1012, 1127), (1014, 1136), (1018, 1128), (1040, 1144), (1016, 1125), (1030, 1152), (1037, 1160), (1026, 1124), (1015, 1145), (1041, 1154), (1000, 1131), (1010, 1157), (1022, 1141)]
         : compromised: 0.8948, honest: 0.8991
         : ubar stats = ['Node 0: s1=0.667, s2=0.225', 'Node 1: s1=0.700, s2=0.557', 'Node 2: s1=0.625, s2=0.260']...

=== FINAL RESULTS ===
Dataset: celeba, Nodes: 20, Graph: erdos, Aggregation: ubar
Attack: krum, 30.0% compromised
Final accuracy - Compromised: 0.8948, Honest: 0.8991
Overall test accuracy: mean=0.8978 ± 0.0102

=== UBAR SUMMARY ===
Node 0: stage1=0.667, stage2=0.225, overall=0.150
Node 1: stage1=0.700, stage2=0.557, overall=0.390
Node 2: stage1=0.625, stage2=0.260, overall=0.163
Node 3: stage1=0.571, stage2=0.425, overall=0.243
Node 4: stage1=0.667, stage2=0.583, overall=0.389
Node 5: stage1=0.700, stage2=0.600, overall=0.420
Node 6: stage1=0.667, stage2=0.425, overall=0.283
Node 7: stage1=0.636, stage2=0.343, overall=0.218
Node 8: stage1=0.571, stage2=0.275, overall=0.157
Node 9: stage1=0.636, stage2=0.386, overall=0.245
Node 10: stage1=0.625, stage2=0.480, overall=0.300
Node 11: stage1=0.667, stage2=0.138, overall=0.092
Node 12: stage1=0.667, stage2=0.650, overall=0.433
Node 13: stage1=0.667, stage2=0.650, overall=0.433
Node 14: stage1=0.643, stage2=0.556, overall=0.357
Node 15: stage1=0.667, stage2=0.183, overall=0.122
Node 16: stage1=0.571, stage2=0.575, overall=0.329
Node 17: stage1=0.625, stage2=0.240, overall=0.150
Node 18: stage1=0.667, stage2=0.388, overall=0.258
Node 19: stage1=0.700, stage2=0.457, overall=0.320

=== PARALLEL EXECUTION TIME (realistic for distributed system) ===
  COMMUNICATION (max across nodes):
    - Full model transfer: 0.000s (0.0%)
  COMPUTATION (max across nodes):
    - Distance computation: 0.035s (14.7%)
    - Loss computation: 0.197s (82.4%)
    - Aggregation: 0.007s (2.8%)
  TOTALS:
    - Total computation: 0.239s (100.0%)
    - Total communication: 0.000s (0.0%)
    - Total parallel time: 0.239s

=== PER-NODE AVERAGE TIME ===
  - Distance computation: 0.025s
  - Loss computation: 0.156s
  - Aggregation: 0.004s
  - Model transfer: 0.000s
  - Total per node: 0.185s

=== TOTAL COMPUTATIONAL WORK (sum across all nodes) ===
  - Total distance computation: 0.502s
  - Total loss computation: 3.117s
  - Total aggregation: 0.087s
  - Total model transfer: 0.000s
  - Grand total: 3.706s
  - Mean Stage 1 acceptance rate: 0.647
  - Mean Stage 2 acceptance rate: 0.420
  - Overall acceptance rate: 0.272

UBAR Algorithm Properties:
  - Model dimension: 2,219,692
  - Rho parameter: 0.7
  - Two-stage approach: Distance filtering + loss evaluation
  - Stage 1 selects: 70% of neighbors
  - Stage 2 uses: Training sample loss comparison
  - Theoretical complexity: O(deg(i)×d + deg(i)×inference)
  - Approach: UBAR paper implementation
