Device: cuda
Seed: 987654321
Looking for images in: /home/student.unimelb.edu.au/mrangwala/Projects/Sketchguard/leaf/data/celeba/data/raw/img_align_celeba
Loading 1 LEAF CelebA train files...
LEAF CelebA train: 9343 users (celebrities), 177457 samples
Looking for images in: /home/student.unimelb.edu.au/mrangwala/Projects/Sketchguard/leaf/data/celeba/data/raw/img_align_celeba
Loading 1 LEAF CelebA test files...
LEAF CelebA test: 9343 users (celebrities), 22831 samples
Found 9343 train users, 9343 test users, 9343 common users
User sample counts range: 31 (max) to 4 (min)
Distributed ALL 9343 users across 20 clients
Users per client: 467 (with 3 clients getting +1 user)
Train partition sizes: [8843, 8998, 8728, 9034, 8866, 8946, 8873, 8776, 8816, 8801, 8913, 8656, 9115, 8921, 8699, 8823, 8912, 8766, 9102, 8869]
Test partition sizes: [1140, 1158, 1127, 1158, 1134, 1145, 1145, 1127, 1136, 1128, 1144, 1125, 1152, 1160, 1124, 1145, 1154, 1131, 1157, 1141]
  Client 0: 8843 train samples, 2 unique classes
  Client 1: 8998 train samples, 2 unique classes
  Client 2: 8728 train samples, 2 unique classes
  Client 3: 9034 train samples, 2 unique classes
  Client 4: 8866 train samples, 2 unique classes
  Client 5: 8946 train samples, 2 unique classes
  Client 6: 8873 train samples, 2 unique classes
  Client 7: 8776 train samples, 2 unique classes
  Client 8: 8816 train samples, 2 unique classes
  Client 9: 8801 train samples, 2 unique classes
  Client 10: 8913 train samples, 2 unique classes
  Client 11: 8656 train samples, 2 unique classes
  Client 12: 9115 train samples, 2 unique classes
  Client 13: 8921 train samples, 2 unique classes
  Client 14: 8699 train samples, 2 unique classes
  Client 15: 8823 train samples, 2 unique classes
  Client 16: 8912 train samples, 2 unique classes
  Client 17: 8766 train samples, 2 unique classes
  Client 18: 9102 train samples, 2 unique classes
  Client 19: 8869 train samples, 2 unique classes
Will sample 4500 samples per client per epoch
Graph: erdos, nodes: 20, edges: 126
Degree statistics: avg=12.60, min=8, max=16
Attack: Compromised 6/20 nodes: [5, 12, 13, 14, 17, 18]
Attack type: directed_deviation, lambda: 1.0
Model variant: baseline
Model parameters: 2,219,692
Initial test acc across nodes: mean=0.4978 ± 0.0208
Round 001: test acc mean=0.7099 ± 0.0284 | min=0.6615 max=0.7569
         : test loss mean=0.6006 ± 0.0421
         : individual accs = ['0.671930', '0.661485', '0.678793', '0.712435', '0.693122', '0.732751', '0.737991', '0.710736', '0.749120', '0.679078', '0.727273', '0.705778', '0.756944', '0.739655', '0.707295', '0.752838', '0.694107', '0.686118', '0.677615', '0.723926']
         : correct/total = [(766, 1140), (766, 1158), (765, 1127), (825, 1158), (786, 1134), (839, 1145), (845, 1145), (801, 1127), (851, 1136), (766, 1128), (832, 1144), (794, 1125), (872, 1152), (858, 1160), (795, 1124), (862, 1145), (801, 1154), (776, 1131), (784, 1157), (826, 1141)]
         : compromised: 0.7167, honest: 0.7070
Round 002: test acc mean=0.8088 ± 0.0211 | min=0.7696 max=0.8480
         : test loss mean=0.4271 ± 0.0234
         : individual accs = ['0.822807', '0.826425', '0.787933', '0.817789', '0.811287', '0.785153', '0.848035', '0.821650', '0.774648', '0.825355', '0.831294', '0.835556', '0.817708', '0.799138', '0.769573', '0.786900', '0.790295', '0.813439', '0.791703', '0.819457']
         : correct/total = [(938, 1140), (957, 1158), (888, 1127), (947, 1158), (920, 1134), (899, 1145), (971, 1145), (926, 1127), (880, 1136), (931, 1128), (951, 1144), (940, 1125), (942, 1152), (927, 1160), (865, 1124), (901, 1145), (912, 1154), (920, 1131), (916, 1157), (935, 1141)]
         : compromised: 0.7961, honest: 0.8142
Round 003: test acc mean=0.8399 ± 0.0202 | min=0.8034 max=0.8790
         : test loss mean=0.3585 ± 0.0370
         : individual accs = ['0.832456', '0.844560', '0.813665', '0.844560', '0.823633', '0.876856', '0.864629', '0.839397', '0.865317', '0.839539', '0.854021', '0.838222', '0.836806', '0.803448', '0.879004', '0.824454', '0.828423', '0.839965', '0.807260', '0.841367']
         : correct/total = [(949, 1140), (978, 1158), (917, 1127), (978, 1158), (934, 1134), (1004, 1145), (990, 1145), (946, 1127), (983, 1136), (947, 1128), (977, 1144), (943, 1125), (964, 1152), (932, 1160), (988, 1124), (944, 1145), (956, 1154), (950, 1131), (934, 1157), (960, 1141)]
         : compromised: 0.8406, honest: 0.8396
Round 004: test acc mean=0.8812 ± 0.0091 | min=0.8638 max=0.8978
         : test loss mean=0.2864 ± 0.0136
         : individual accs = ['0.886842', '0.886010', '0.879326', '0.873057', '0.878307', '0.889083', '0.873362', '0.897072', '0.889965', '0.886525', '0.891608', '0.897778', '0.875000', '0.881897', '0.870107', '0.863755', '0.878683', '0.873563', '0.870354', '0.882559']
         : correct/total = [(1011, 1140), (1026, 1158), (991, 1127), (1011, 1158), (996, 1134), (1018, 1145), (1000, 1145), (1011, 1127), (1011, 1136), (1000, 1128), (1020, 1144), (1010, 1125), (1008, 1152), (1023, 1160), (978, 1124), (989, 1145), (1014, 1154), (988, 1131), (1007, 1157), (1007, 1141)]
         : compromised: 0.8767, honest: 0.8832
Round 005: test acc mean=0.8826 ± 0.0107 | min=0.8608 max=0.9030
         : test loss mean=0.2756 ± 0.0146
         : individual accs = ['0.864912', '0.892919', '0.881988', '0.879965', '0.876543', '0.884716', '0.889083', '0.895297', '0.874120', '0.895390', '0.902972', '0.896889', '0.881076', '0.881897', '0.872776', '0.874236', '0.891681', '0.875332', '0.860847', '0.879930']
         : correct/total = [(986, 1140), (1034, 1158), (994, 1127), (1019, 1158), (994, 1134), (1013, 1145), (1018, 1145), (1009, 1127), (993, 1136), (1010, 1128), (1033, 1144), (1009, 1125), (1015, 1152), (1023, 1160), (981, 1124), (1001, 1145), (1029, 1154), (990, 1131), (996, 1157), (1004, 1141)]
         : compromised: 0.8761, honest: 0.8854
Round 006: test acc mean=0.8888 ± 0.0092 | min=0.8660 max=0.9009
         : test loss mean=0.2647 ± 0.0180
         : individual accs = ['0.900877', '0.897237', '0.866016', '0.893782', '0.886243', '0.897817', '0.900437', '0.897072', '0.889085', '0.889184', '0.890734', '0.895111', '0.891493', '0.875000', '0.891459', '0.878603', '0.887348', '0.890363', '0.872083', '0.886065']
         : correct/total = [(1027, 1140), (1039, 1158), (976, 1127), (1035, 1158), (1005, 1134), (1028, 1145), (1031, 1145), (1011, 1127), (1010, 1136), (1003, 1128), (1019, 1144), (1007, 1125), (1027, 1152), (1015, 1160), (1002, 1124), (1006, 1145), (1024, 1154), (1007, 1131), (1009, 1157), (1011, 1141)]
         : compromised: 0.8864, honest: 0.8898
Round 007: test acc mean=0.8933 ± 0.0100 | min=0.8742 max=0.9120
         : test loss mean=0.2549 ± 0.0187
         : individual accs = ['0.898246', '0.898100', '0.881988', '0.902418', '0.902998', '0.888210', '0.888210', '0.909494', '0.887324', '0.890071', '0.907343', '0.912000', '0.882812', '0.889655', '0.899466', '0.874236', '0.894281', '0.890363', '0.880726', '0.887818']
         : correct/total = [(1024, 1140), (1040, 1158), (994, 1127), (1045, 1158), (1024, 1134), (1017, 1145), (1017, 1145), (1025, 1127), (1008, 1136), (1004, 1128), (1038, 1144), (1026, 1125), (1017, 1152), (1032, 1160), (1011, 1124), (1001, 1145), (1032, 1154), (1007, 1131), (1019, 1157), (1013, 1141)]
         : compromised: 0.8885, honest: 0.8953
Round 008: test acc mean=0.8937 ± 0.0078 | min=0.8803 max=0.9059
         : test loss mean=0.2508 ± 0.0129
         : individual accs = ['0.896491', '0.899827', '0.885537', '0.905872', '0.884480', '0.895197', '0.902183', '0.897072', '0.897887', '0.880319', '0.890734', '0.895111', '0.900174', '0.901724', '0.897687', '0.889956', '0.902946', '0.881521', '0.880726', '0.887818']
         : correct/total = [(1022, 1140), (1042, 1158), (998, 1127), (1049, 1158), (1003, 1134), (1025, 1145), (1033, 1145), (1011, 1127), (1020, 1136), (993, 1128), (1019, 1144), (1007, 1125), (1037, 1152), (1046, 1160), (1009, 1124), (1019, 1145), (1042, 1154), (997, 1131), (1019, 1157), (1013, 1141)]
         : compromised: 0.8928, honest: 0.8940
Round 009: test acc mean=0.8943 ± 0.0126 | min=0.8632 max=0.9104
         : test loss mean=0.2510 ± 0.0199
         : individual accs = ['0.863158', '0.879102', '0.889086', '0.906736', '0.877425', '0.908297', '0.907424', '0.910382', '0.897007', '0.906915', '0.902972', '0.902222', '0.895833', '0.893103', '0.904804', '0.879476', '0.901213', '0.891247', '0.883319', '0.886065']
         : correct/total = [(984, 1140), (1018, 1158), (1002, 1127), (1050, 1158), (995, 1134), (1040, 1145), (1039, 1145), (1026, 1127), (1019, 1136), (1023, 1128), (1033, 1144), (1015, 1125), (1032, 1152), (1036, 1160), (1017, 1124), (1007, 1145), (1040, 1154), (1008, 1131), (1022, 1157), (1011, 1141)]
         : compromised: 0.8961, honest: 0.8935
Round 010: test acc mean=0.9016 ± 0.0100 | min=0.8764 max=0.9173
         : test loss mean=0.2352 ± 0.0158
         : individual accs = ['0.906140', '0.901554', '0.893523', '0.913644', '0.899471', '0.905677', '0.898690', '0.909494', '0.891725', '0.912234', '0.910839', '0.917333', '0.905382', '0.894828', '0.902135', '0.897817', '0.908146', '0.882405', '0.876404', '0.904470']
         : correct/total = [(1033, 1140), (1044, 1158), (1007, 1127), (1058, 1158), (1020, 1134), (1037, 1145), (1029, 1145), (1025, 1127), (1013, 1136), (1029, 1128), (1042, 1144), (1032, 1125), (1043, 1152), (1038, 1160), (1014, 1124), (1028, 1145), (1048, 1154), (998, 1131), (1014, 1157), (1032, 1141)]
         : compromised: 0.8945, honest: 0.9046

=== FINAL RESULTS ===
Dataset: celeba, Nodes: 20, Graph: erdos, Aggregation: krum
Attack: directed_deviation, 30.0% compromised
Final accuracy - Compromised: 0.8945, Honest: 0.9046
Overall test accuracy: mean=0.9016 ± 0.0100
