Device: cuda
Seed: 987654321
Looking for images in: /home/student.unimelb.edu.au/mrangwala/Projects/Sketchguard/leaf/data/celeba/data/raw/img_align_celeba
Loading 1 LEAF CelebA train files...
LEAF CelebA train: 9343 users (celebrities), 177457 samples
Looking for images in: /home/student.unimelb.edu.au/mrangwala/Projects/Sketchguard/leaf/data/celeba/data/raw/img_align_celeba
Loading 1 LEAF CelebA test files...
LEAF CelebA test: 9343 users (celebrities), 22831 samples
Found 9343 train users, 9343 test users, 9343 common users
User sample counts range: 31 (max) to 4 (min)
Distributed ALL 9343 users across 20 clients
Users per client: 467 (with 3 clients getting +1 user)
Train partition sizes: [8843, 8998, 8728, 9034, 8866, 8946, 8873, 8776, 8816, 8801, 8913, 8656, 9115, 8921, 8699, 8823, 8912, 8766, 9102, 8869]
Test partition sizes: [1140, 1158, 1127, 1158, 1134, 1145, 1145, 1127, 1136, 1128, 1144, 1125, 1152, 1160, 1124, 1145, 1154, 1131, 1157, 1141]
  Client 0: 8843 train samples, 2 unique classes
  Client 1: 8998 train samples, 2 unique classes
  Client 2: 8728 train samples, 2 unique classes
  Client 3: 9034 train samples, 2 unique classes
  Client 4: 8866 train samples, 2 unique classes
  Client 5: 8946 train samples, 2 unique classes
  Client 6: 8873 train samples, 2 unique classes
  Client 7: 8776 train samples, 2 unique classes
  Client 8: 8816 train samples, 2 unique classes
  Client 9: 8801 train samples, 2 unique classes
  Client 10: 8913 train samples, 2 unique classes
  Client 11: 8656 train samples, 2 unique classes
  Client 12: 9115 train samples, 2 unique classes
  Client 13: 8921 train samples, 2 unique classes
  Client 14: 8699 train samples, 2 unique classes
  Client 15: 8823 train samples, 2 unique classes
  Client 16: 8912 train samples, 2 unique classes
  Client 17: 8766 train samples, 2 unique classes
  Client 18: 9102 train samples, 2 unique classes
  Client 19: 8869 train samples, 2 unique classes
Will sample 4500 samples per client per epoch
Graph: erdos, nodes: 20, edges: 48
Degree statistics: avg=4.80, min=2, max=7
Attack: Compromised 12/20 nodes: [1, 2, 3, 5, 8, 11, 12, 13, 14, 15, 17, 18]
Attack type: directed_deviation, lambda: 1.0
Model variant: baseline
Model parameters: 2,219,692
Sketchguard Node 0:
  Model dim: 2,219,692 → Sketch size: 350
  Compression ratio: 6342.0x
  Using model parameters for aggregation, sketches for filtering
Sketchguard Node 1:
  Model dim: 2,219,692 → Sketch size: 350
  Compression ratio: 6342.0x
  Using model parameters for aggregation, sketches for filtering
Sketchguard Node 2:
  Model dim: 2,219,692 → Sketch size: 350
  Compression ratio: 6342.0x
  Using model parameters for aggregation, sketches for filtering
Sketchguard Node 3:
  Model dim: 2,219,692 → Sketch size: 350
  Compression ratio: 6342.0x
  Using model parameters for aggregation, sketches for filtering
Sketchguard Node 4:
  Model dim: 2,219,692 → Sketch size: 350
  Compression ratio: 6342.0x
  Using model parameters for aggregation, sketches for filtering
Sketchguard Node 5:
  Model dim: 2,219,692 → Sketch size: 350
  Compression ratio: 6342.0x
  Using model parameters for aggregation, sketches for filtering
Sketchguard Node 6:
  Model dim: 2,219,692 → Sketch size: 350
  Compression ratio: 6342.0x
  Using model parameters for aggregation, sketches for filtering
Sketchguard Node 7:
  Model dim: 2,219,692 → Sketch size: 350
  Compression ratio: 6342.0x
  Using model parameters for aggregation, sketches for filtering
Sketchguard Node 8:
  Model dim: 2,219,692 → Sketch size: 350
  Compression ratio: 6342.0x
  Using model parameters for aggregation, sketches for filtering
Sketchguard Node 9:
  Model dim: 2,219,692 → Sketch size: 350
  Compression ratio: 6342.0x
  Using model parameters for aggregation, sketches for filtering
Sketchguard Node 10:
  Model dim: 2,219,692 → Sketch size: 350
  Compression ratio: 6342.0x
  Using model parameters for aggregation, sketches for filtering
Sketchguard Node 11:
  Model dim: 2,219,692 → Sketch size: 350
  Compression ratio: 6342.0x
  Using model parameters for aggregation, sketches for filtering
Sketchguard Node 12:
  Model dim: 2,219,692 → Sketch size: 350
  Compression ratio: 6342.0x
  Using model parameters for aggregation, sketches for filtering
Sketchguard Node 13:
  Model dim: 2,219,692 → Sketch size: 350
  Compression ratio: 6342.0x
  Using model parameters for aggregation, sketches for filtering
Sketchguard Node 14:
  Model dim: 2,219,692 → Sketch size: 350
  Compression ratio: 6342.0x
  Using model parameters for aggregation, sketches for filtering
Sketchguard Node 15:
  Model dim: 2,219,692 → Sketch size: 350
  Compression ratio: 6342.0x
  Using model parameters for aggregation, sketches for filtering
Sketchguard Node 16:
  Model dim: 2,219,692 → Sketch size: 350
  Compression ratio: 6342.0x
  Using model parameters for aggregation, sketches for filtering
Sketchguard Node 17:
  Model dim: 2,219,692 → Sketch size: 350
  Compression ratio: 6342.0x
  Using model parameters for aggregation, sketches for filtering
Sketchguard Node 18:
  Model dim: 2,219,692 → Sketch size: 350
  Compression ratio: 6342.0x
  Using model parameters for aggregation, sketches for filtering
Sketchguard Node 19:
  Model dim: 2,219,692 → Sketch size: 350
  Compression ratio: 6342.0x
  Using model parameters for aggregation, sketches for filtering
Sketchguard ALGORITHM (Sketch-based Filtering + State Aggregation)
  - Model dimension: 2,219,692 parameters
  - Config: SketchguardConfig(gamma=2, kappa=1, alpha=0.5, min_neighbors=1, sketch_size=350, network_seed=987654321, attack_detection_window=5)
  - Sketch size: 350
  - Compression ratio: 6342.0x
  - Complexity: O(d + N×k) = O(2,219,692 + 20×350)
  - Theoretical speedup vs BALANCE: 19.9x
Initial test acc across nodes: mean=0.4978 ± 0.0208
Round 001: test acc mean=0.6286 ± 0.0611 | min=0.5043 max=0.7158
         : test loss mean=101.4189 ± 439.1219
         : individual accs = ['0.699123', '0.681347', '0.533274', '0.701209', '0.571429', '0.592140', '0.643668', '0.616681', '0.636444', '0.655142', '0.594406', '0.691556', '0.702257', '0.504310', '0.626335', '0.661135', '0.715771', '0.609195', '0.615385', '0.521472']
         : correct/total = [(797, 1140), (789, 1158), (601, 1127), (812, 1158), (648, 1134), (678, 1145), (737, 1145), (695, 1127), (723, 1136), (739, 1128), (680, 1144), (778, 1125), (809, 1152), (585, 1160), (704, 1124), (757, 1145), (826, 1154), (689, 1131), (712, 1157), (595, 1141)]
         : compromised: 0.6295, honest: 0.6272
         : sketchguard stats = ['Node 0: acc_rate=0.500', 'Node 1: acc_rate=0.500', 'Node 2: acc_rate=0.400']...
Round 002: test acc mean=0.6970 ± 0.0530 | min=0.5069 max=0.7582
         : test loss mean=nan ± nan
         : individual accs = ['0.704386', '0.685665', '0.657498', '0.707254', '0.666667', '0.731878', '0.739738', '0.689441', '0.734155', '0.750000', '0.733392', '0.664889', '0.709201', '0.506897', '0.712633', '0.685590', '0.758232', '0.660477', '0.700951', '0.741455']
         : correct/total = [(803, 1140), (794, 1158), (741, 1127), (819, 1158), (756, 1134), (838, 1145), (847, 1145), (777, 1127), (834, 1136), (846, 1128), (839, 1144), (748, 1125), (817, 1152), (588, 1160), (801, 1124), (785, 1145), (875, 1154), (747, 1131), (811, 1157), (846, 1141)]
         : compromised: 0.6798, honest: 0.7229
         : sketchguard stats = ['Node 0: acc_rate=0.500', 'Node 1: acc_rate=0.500', 'Node 2: acc_rate=0.400']...
Round 003: test acc mean=0.7746 ± 0.0741 | min=0.5069 max=0.8388
         : test loss mean=nan ± nan
         : individual accs = ['0.828947', '0.753022', '0.728483', '0.797064', '0.783069', '0.810480', '0.827948', '0.769299', '0.828345', '0.832447', '0.829545', '0.782222', '0.749132', '0.506897', '0.813167', '0.718777', '0.838821', '0.693192', '0.775281', '0.826468']
         : correct/total = [(945, 1140), (872, 1158), (821, 1127), (923, 1158), (888, 1134), (928, 1145), (948, 1145), (867, 1127), (941, 1136), (939, 1128), (949, 1144), (880, 1125), (863, 1152), (588, 1160), (914, 1124), (823, 1145), (968, 1154), (784, 1131), (897, 1157), (943, 1141)]
         : compromised: 0.7463, honest: 0.8171
         : sketchguard stats = ['Node 0: acc_rate=0.500', 'Node 1: acc_rate=0.500', 'Node 2: acc_rate=0.400']...
Round 004: test acc mean=0.8126 ± 0.0869 | min=0.5069 max=0.8785
         : test loss mean=nan ± nan
         : individual accs = ['0.858772', '0.793610', '0.641526', '0.857513', '0.836861', '0.848908', '0.867249', '0.832298', '0.873239', '0.878546', '0.870629', '0.800000', '0.825521', '0.506897', '0.838968', '0.794760', '0.859619', '0.781609', '0.824546', '0.860649']
         : correct/total = [(979, 1140), (919, 1158), (723, 1127), (993, 1158), (949, 1134), (972, 1145), (993, 1145), (938, 1127), (992, 1136), (991, 1128), (996, 1144), (900, 1125), (951, 1152), (588, 1160), (943, 1124), (910, 1145), (992, 1154), (884, 1131), (954, 1157), (982, 1141)]
         : compromised: 0.7823, honest: 0.8581
         : sketchguard stats = ['Node 0: acc_rate=0.500', 'Node 1: acc_rate=0.500', 'Node 2: acc_rate=0.400']...
Round 005: test acc mean=0.8405 ± 0.0816 | min=0.5069 max=0.8901
         : test loss mean=nan ± nan
         : individual accs = ['0.862281', '0.872193', '0.764862', '0.886874', '0.865961', '0.834934', '0.857642', '0.862467', '0.881162', '0.890071', '0.881119', '0.863111', '0.864583', '0.506897', '0.860320', '0.838428', '0.876950', '0.850575', '0.809853', '0.879930']
         : correct/total = [(983, 1140), (1010, 1158), (862, 1127), (1027, 1158), (982, 1134), (956, 1145), (982, 1145), (972, 1127), (1001, 1136), (1004, 1128), (1008, 1144), (971, 1125), (996, 1152), (588, 1160), (967, 1124), (960, 1145), (1012, 1154), (962, 1131), (937, 1157), (1004, 1141)]
         : compromised: 0.8195, honest: 0.8721
         : sketchguard stats = ['Node 0: acc_rate=0.500', 'Node 1: acc_rate=0.500', 'Node 2: acc_rate=0.400']...
Round 006: test acc mean=0.8530 ± 0.0846 | min=0.5069 max=0.8950
         : test loss mean=nan ± nan
         : individual accs = ['0.892982', '0.878238', '0.826974', '0.882556', '0.870370', '0.890830', '0.884716', '0.875776', '0.889965', '0.888298', '0.892483', '0.850667', '0.879340', '0.506897', '0.895018', '0.772926', '0.891681', '0.871795', '0.834054', '0.883436']
         : correct/total = [(1018, 1140), (1017, 1158), (932, 1127), (1022, 1158), (987, 1134), (1020, 1145), (1013, 1145), (987, 1127), (1011, 1136), (1002, 1128), (1021, 1144), (957, 1125), (1013, 1152), (588, 1160), (1006, 1124), (885, 1145), (1029, 1154), (986, 1131), (965, 1157), (1008, 1141)]
         : compromised: 0.8316, honest: 0.8850
         : sketchguard stats = ['Node 0: acc_rate=0.500', 'Node 1: acc_rate=0.472', 'Node 2: acc_rate=0.400']...
Round 007: test acc mean=0.8627 ± 0.0858 | min=0.5069 max=0.9033
         : test loss mean=nan ± nan
         : individual accs = ['0.899123', '0.895509', '0.814552', '0.903282', '0.879189', '0.900437', '0.895197', '0.893523', '0.891725', '0.891844', '0.890734', '0.879111', '0.889757', '0.506897', '0.892349', '0.797380', '0.895147', '0.877984', '0.875540', '0.885188']
         : correct/total = [(1025, 1140), (1037, 1158), (918, 1127), (1046, 1158), (997, 1134), (1031, 1145), (1025, 1145), (1007, 1127), (1013, 1136), (1006, 1128), (1019, 1144), (989, 1125), (1025, 1152), (588, 1160), (1003, 1124), (913, 1145), (1033, 1154), (993, 1131), (1013, 1157), (1010, 1141)]
         : compromised: 0.8437, honest: 0.8912
         : sketchguard stats = ['Node 0: acc_rate=0.500', 'Node 1: acc_rate=0.452', 'Node 2: acc_rate=0.400']...
Round 008: test acc mean=0.8675 ± 0.0841 | min=0.5069 max=0.9048
         : test loss mean=nan ± nan
         : individual accs = ['0.897368', '0.894646', '0.833185', '0.900691', '0.879189', '0.901310', '0.889083', '0.888199', '0.893486', '0.892730', '0.887238', '0.872889', '0.899306', '0.506897', '0.904804', '0.875109', '0.894281', '0.881521', '0.880726', '0.878177']
         : correct/total = [(1023, 1140), (1036, 1158), (939, 1127), (1043, 1158), (997, 1134), (1032, 1145), (1018, 1145), (1001, 1127), (1015, 1136), (1007, 1128), (1015, 1144), (982, 1125), (1036, 1152), (588, 1160), (1017, 1124), (1002, 1145), (1032, 1154), (997, 1131), (1019, 1157), (1002, 1141)]
         : compromised: 0.8537, honest: 0.8883
         : sketchguard stats = ['Node 0: acc_rate=0.500', 'Node 1: acc_rate=0.438', 'Node 2: acc_rate=0.350']...
Round 009: test acc mean=0.8737 ± 0.0849 | min=0.5069 max=0.9083
         : test loss mean=nan ± nan
         : individual accs = ['0.900000', '0.892919', '0.872227', '0.905872', '0.888889', '0.908297', '0.898690', '0.900621', '0.899648', '0.890957', '0.900350', '0.900444', '0.900174', '0.506897', '0.892349', '0.879476', '0.901213', '0.879752', '0.864304', '0.891323']
         : correct/total = [(1026, 1140), (1034, 1158), (983, 1127), (1049, 1158), (1008, 1134), (1040, 1145), (1029, 1145), (1015, 1127), (1022, 1136), (1005, 1128), (1030, 1144), (1013, 1125), (1037, 1152), (588, 1160), (1003, 1124), (1007, 1145), (1040, 1154), (995, 1131), (1000, 1157), (1017, 1141)]
         : compromised: 0.8585, honest: 0.8965
         : sketchguard stats = ['Node 0: acc_rate=0.500', 'Node 1: acc_rate=0.426', 'Node 2: acc_rate=0.333']...
Round 010: test acc mean=0.8790 ± 0.0859 | min=0.5069 max=0.9136
         : test loss mean=nan ± nan
         : individual accs = ['0.911404', '0.901554', '0.881100', '0.913644', '0.893298', '0.904803', '0.896070', '0.902396', '0.896127', '0.903369', '0.900350', '0.904889', '0.905382', '0.506897', '0.907473', '0.887336', '0.907279', '0.886826', '0.878133', '0.892200']
         : correct/total = [(1039, 1140), (1044, 1158), (993, 1127), (1058, 1158), (1013, 1134), (1036, 1145), (1026, 1145), (1017, 1127), (1018, 1136), (1019, 1128), (1030, 1144), (1018, 1125), (1043, 1152), (588, 1160), (1020, 1124), (1016, 1145), (1047, 1154), (1003, 1131), (1016, 1157), (1018, 1141)]
         : compromised: 0.8645, honest: 0.9008
         : sketchguard stats = ['Node 0: acc_rate=0.500', 'Node 1: acc_rate=0.417', 'Node 2: acc_rate=0.320']...

=== FINAL RESULTS ===
Dataset: celeba, Nodes: 20, Graph: erdos, Aggregation: sketchguard
Attack: directed_deviation, 60.0% compromised
Final accuracy - Compromised: 0.8645, Honest: 0.9008
Overall test accuracy: mean=0.8790 ± 0.0859

=== Sketchguard SUMMARY ===
Node 0: acceptance=0.500
Node 1: acceptance=0.417
Node 2: acceptance=0.320
Node 3: acceptance=0.500
Node 4: acceptance=0.250
Node 5: acceptance=0.200
Node 6: acceptance=0.200
Node 7: acceptance=0.400
Node 8: acceptance=0.500
Node 9: acceptance=0.333
Node 10: acceptance=0.500
Node 11: acceptance=0.229
Node 12: acceptance=0.486
Node 13: acceptance=0.000
Node 14: acceptance=0.143
Node 15: acceptance=0.283
Node 16: acceptance=0.200
Node 17: acceptance=0.480
Node 18: acceptance=0.250
Node 19: acceptance=0.500

=== PARALLEL EXECUTION TIME (realistic for distributed system) ===
  COMMUNICATION (max across nodes):
    - Sketch transfer: 0.000s (0.0%)
    - Model fetch (accepted): 0.000s (0.0%)
  COMPUTATION (max across nodes):
    - Sketching: 0.500s (97.4%)
    - Filtering: 0.001s (0.2%)
    - Aggregation: 0.012s (2.4%)
  TOTALS:
    - Total computation: 0.514s (100.0%)
    - Total communication: 0.000s (0.0%)
    - Total parallel time: 0.514s

=== PER-NODE AVERAGE TIME ===
  - Sketching: 0.354s
  - Filtering: 0.000s
  - Aggregation: 0.006s
  - Sketch transfer: 0.000s
  - Model fetch: 0.000s
  - Total per node: 0.361s

=== TOTAL COMPUTATIONAL WORK (sum across all nodes) ===
  - Total sketching: 7.084s
  - Total filtering: 0.009s
  - Total aggregation: 0.126s
  - Total sketch transfer: 0.000s
  - Total model fetch: 0.000s
  - Grand total: 7.220s
  - Mean acceptance rate: 0.335

Sketchguard Algorithm Properties:
  - Original dimension: 2,219,692
  - Sketch size: 350
  - Compression ratio: 19.9x
  - Single repetition: No repetitions needed
  - Theoretical complexity: O(d + N×k)
  - Approach: Sketch filtering + state aggregation
