Device: cuda
Seed: 987654321
Looking for images in: /home/student.unimelb.edu.au/mrangwala/Projects/Sketchguard/leaf/data/celeba/data/raw/img_align_celeba
Loading 1 LEAF CelebA train files...
LEAF CelebA train: 9343 users (celebrities), 177457 samples
Looking for images in: /home/student.unimelb.edu.au/mrangwala/Projects/Sketchguard/leaf/data/celeba/data/raw/img_align_celeba
Loading 1 LEAF CelebA test files...
LEAF CelebA test: 9343 users (celebrities), 22831 samples
Found 9343 train users, 9343 test users, 9343 common users
User sample counts range: 31 (max) to 4 (min)
Distributed ALL 9343 users across 20 clients
Users per client: 467 (with 3 clients getting +1 user)
Train partition sizes: [8843, 8998, 8728, 9034, 8866, 8946, 8873, 8776, 8816, 8801, 8913, 8656, 9115, 8921, 8699, 8823, 8912, 8766, 9102, 8869]
Test partition sizes: [1140, 1158, 1127, 1158, 1134, 1145, 1145, 1127, 1136, 1128, 1144, 1125, 1152, 1160, 1124, 1145, 1154, 1131, 1157, 1141]
  Client 0: 8843 train samples, 2 unique classes
  Client 1: 8998 train samples, 2 unique classes
  Client 2: 8728 train samples, 2 unique classes
  Client 3: 9034 train samples, 2 unique classes
  Client 4: 8866 train samples, 2 unique classes
  Client 5: 8946 train samples, 2 unique classes
  Client 6: 8873 train samples, 2 unique classes
  Client 7: 8776 train samples, 2 unique classes
  Client 8: 8816 train samples, 2 unique classes
  Client 9: 8801 train samples, 2 unique classes
  Client 10: 8913 train samples, 2 unique classes
  Client 11: 8656 train samples, 2 unique classes
  Client 12: 9115 train samples, 2 unique classes
  Client 13: 8921 train samples, 2 unique classes
  Client 14: 8699 train samples, 2 unique classes
  Client 15: 8823 train samples, 2 unique classes
  Client 16: 8912 train samples, 2 unique classes
  Client 17: 8766 train samples, 2 unique classes
  Client 18: 9102 train samples, 2 unique classes
  Client 19: 8869 train samples, 2 unique classes
Will sample 4500 samples per client per epoch
Graph: erdos, nodes: 20, edges: 126
Degree statistics: avg=12.60, min=8, max=16
Attack: Compromised 12/20 nodes: [1, 2, 3, 5, 8, 11, 12, 13, 14, 15, 17, 18]
Attack type: backdoor, lambda: 1.0
Backdoor target label: 0, trigger size: 8
Model variant: baseline
Model parameters: 2,219,692
UBAR ALGORITHM (Two-Stage Byzantine-resilient)
  - Model dimension: 2,219,692 parameters
  - Rho parameter: 0.4
  - Stage 1: Distance-based filtering (select 40% closest neighbors)
  - Stage 2: Performance-based selection (loss comparison)
  - Complexity: O(deg(i)×d + deg(i)×inference)
Initial test acc across nodes: mean=0.4978 ± 0.0208
Backdoor attack: Created poisoned datasets for 12 compromised nodes
Round 001: test acc mean=0.5626 ± 0.0593 | min=0.4942 max=0.6833
         : test loss mean=2376.3881 ± 2010.5806
         : individual accs = ['0.683333', '0.508636', '0.494232', '0.534542', '0.601411', '0.514410', '0.643668', '0.624667', '0.562500', '0.655142', '0.562937', '0.520000', '0.522569', '0.506897', '0.517794', '0.521397', '0.590121', '0.508400', '0.522040', '0.657318']
         : correct/total = [(779, 1140), (589, 1158), (557, 1127), (619, 1158), (682, 1134), (589, 1145), (737, 1145), (704, 1127), (639, 1136), (739, 1128), (644, 1144), (585, 1125), (602, 1152), (588, 1160), (582, 1124), (597, 1145), (681, 1154), (575, 1131), (604, 1157), (750, 1141)]
         : compromised: 0.5195, honest: 0.6273
         : ubar stats = ['Node 0: s1=0.375, s2=0.167', 'Node 1: s1=0.364, s2=1.000', 'Node 2: s1=0.333, s2=1.000']...
Round 002: test acc mean=0.5883 ± 0.0970 | min=0.4707 max=0.7487
         : test loss mean=451.5351 ± 941.4061
         : individual accs = ['0.686842', '0.504318', '0.491571', '0.525907', '0.657848', '0.514410', '0.743231', '0.664596', '0.562500', '0.687943', '0.735140', '0.498667', '0.517361', '0.509483', '0.520463', '0.470742', '0.748700', '0.509284', '0.521175', '0.695881']
         : correct/total = [(783, 1140), (584, 1158), (554, 1127), (609, 1158), (746, 1134), (589, 1145), (851, 1145), (749, 1127), (639, 1136), (776, 1128), (841, 1144), (561, 1125), (596, 1152), (591, 1160), (585, 1124), (539, 1145), (864, 1154), (576, 1131), (603, 1157), (794, 1141)]
         : compromised: 0.5122, honest: 0.7025
         : ubar stats = ['Node 0: s1=0.375, s2=0.167', 'Node 1: s1=0.364, s2=1.000', 'Node 2: s1=0.333, s2=1.000']...
Round 003: test acc mean=0.6043 ± 0.1468 | min=0.4375 max=0.8111
         : test loss mean=nan ± nan
         : individual accs = ['0.796491', '0.491364', '0.506655', '0.471503', '0.738095', '0.485590', '0.807860', '0.729370', '0.437500', '0.796986', '0.803322', '0.501333', '0.477431', '0.493103', '0.482206', '0.517031', '0.811092', '0.491600', '0.477960', '0.770377']
         : correct/total = [(908, 1140), (569, 1158), (571, 1127), (546, 1158), (837, 1134), (556, 1145), (925, 1145), (822, 1127), (497, 1136), (899, 1128), (919, 1144), (564, 1125), (550, 1152), (572, 1160), (542, 1124), (592, 1145), (936, 1154), (556, 1131), (553, 1157), (879, 1141)]
         : compromised: 0.4861, honest: 0.7817
         : ubar stats = ['Node 0: s1=0.375, s2=0.222', 'Node 1: s1=0.364, s2=1.000', 'Node 2: s1=0.333, s2=1.000']...
Round 004: test acc mean=0.6418 ± 0.1546 | min=0.4933 max=0.8671
         : test loss mean=nan ± nan
         : individual accs = ['0.842982', '0.508636', '0.493345', '0.528497', '0.804233', '0.514410', '0.857642', '0.802130', '0.562500', '0.807624', '0.867133', '0.498667', '0.522569', '0.506897', '0.517794', '0.517031', '0.810225', '0.508400', '0.522040', '0.843996']
         : correct/total = [(961, 1140), (589, 1158), (556, 1127), (612, 1158), (912, 1134), (589, 1145), (982, 1145), (904, 1127), (639, 1136), (911, 1128), (992, 1144), (561, 1125), (602, 1152), (588, 1160), (582, 1124), (592, 1145), (935, 1154), (575, 1131), (604, 1157), (963, 1141)]
         : compromised: 0.5167, honest: 0.8295
         : ubar stats = ['Node 0: s1=0.375, s2=0.208', 'Node 1: s1=0.364, s2=0.812', 'Node 2: s1=0.333, s2=0.812']...
Round 005: test acc mean=0.6557 ± 0.1710 | min=0.4933 max=0.8812
         : test loss mean=nan ± nan
         : individual accs = ['0.828070', '0.508636', '0.493345', '0.528497', '0.858025', '0.514410', '0.866376', '0.855368', '0.562500', '0.881206', '0.875874', '0.498667', '0.522569', '0.506897', '0.517794', '0.517031', '0.876950', '0.508400', '0.522040', '0.872042']
         : correct/total = [(944, 1140), (589, 1158), (556, 1127), (612, 1158), (973, 1134), (589, 1145), (992, 1145), (964, 1127), (639, 1136), (994, 1128), (1002, 1144), (561, 1125), (602, 1152), (588, 1160), (582, 1124), (592, 1145), (1012, 1154), (575, 1131), (604, 1157), (995, 1141)]
         : compromised: 0.5167, honest: 0.8642
         : ubar stats = ['Node 0: s1=0.375, s2=0.367', 'Node 1: s1=0.364, s2=0.700', 'Node 2: s1=0.333, s2=0.700']...
Round 006: test acc mean=0.6627 ± 0.1793 | min=0.4933 max=0.8899
         : test loss mean=nan ± nan
         : individual accs = ['0.882456', '0.508636', '0.493345', '0.528497', '0.871252', '0.514410', '0.884716', '0.878438', '0.562500', '0.882092', '0.889860', '0.498667', '0.522569', '0.506897', '0.517794', '0.517031', '0.881282', '0.508400', '0.522040', '0.883436']
         : correct/total = [(1006, 1140), (589, 1158), (556, 1127), (612, 1158), (988, 1134), (589, 1145), (1013, 1145), (990, 1127), (639, 1136), (995, 1128), (1018, 1144), (561, 1125), (602, 1152), (588, 1160), (582, 1124), (592, 1145), (1017, 1154), (575, 1131), (604, 1157), (1008, 1141)]
         : compromised: 0.5167, honest: 0.8817
         : ubar stats = ['Node 0: s1=0.375, s2=0.333', 'Node 1: s1=0.364, s2=0.625', 'Node 2: s1=0.333, s2=0.625']...
Round 007: test acc mean=0.6665 ± 0.1839 | min=0.4933 max=0.8972
         : test loss mean=nan ± nan
         : individual accs = ['0.896491', '0.508636', '0.493345', '0.528497', '0.880071', '0.514410', '0.885590', '0.893523', '0.562500', '0.897163', '0.893357', '0.498667', '0.522569', '0.506897', '0.517794', '0.517031', '0.894281', '0.508400', '0.522040', '0.888694']
         : correct/total = [(1022, 1140), (589, 1158), (556, 1127), (612, 1158), (998, 1134), (589, 1145), (1014, 1145), (1007, 1127), (639, 1136), (1012, 1128), (1022, 1144), (561, 1125), (602, 1152), (588, 1160), (582, 1124), (592, 1145), (1032, 1154), (575, 1131), (604, 1157), (1014, 1141)]
         : compromised: 0.5167, honest: 0.8911
         : ubar stats = ['Node 0: s1=0.375, s2=0.333', 'Node 1: s1=0.364, s2=0.571', 'Node 2: s1=0.333, s2=0.571']...
Round 008: test acc mean=0.6675 ± 0.1851 | min=0.4933 max=0.9009
         : test loss mean=nan ± nan
         : individual accs = ['0.900877', '0.508636', '0.493345', '0.528497', '0.889771', '0.514410', '0.894323', '0.897072', '0.562500', '0.893617', '0.894231', '0.498667', '0.522569', '0.506897', '0.517794', '0.517031', '0.893414', '0.508400', '0.522040', '0.886065']
         : correct/total = [(1027, 1140), (589, 1158), (556, 1127), (612, 1158), (1009, 1134), (589, 1145), (1024, 1145), (1011, 1127), (639, 1136), (1008, 1128), (1023, 1144), (561, 1125), (602, 1152), (588, 1160), (582, 1124), (592, 1145), (1031, 1154), (575, 1131), (604, 1157), (1011, 1141)]
         : compromised: 0.5167, honest: 0.8937
         : ubar stats = ['Node 0: s1=0.375, s2=0.333', 'Node 1: s1=0.364, s2=0.531', 'Node 2: s1=0.333, s2=0.531']...
Round 009: test acc mean=0.6694 ± 0.1874 | min=0.4933 max=0.9044
         : test loss mean=nan ± nan
         : individual accs = ['0.904386', '0.508636', '0.493345', '0.528497', '0.896825', '0.514410', '0.901310', '0.902396', '0.562500', '0.893617', '0.902098', '0.498667', '0.522569', '0.506897', '0.517794', '0.517031', '0.890815', '0.508400', '0.522040', '0.894829']
         : correct/total = [(1031, 1140), (589, 1158), (556, 1127), (612, 1158), (1017, 1134), (589, 1145), (1032, 1145), (1017, 1127), (639, 1136), (1008, 1128), (1032, 1144), (561, 1125), (602, 1152), (588, 1160), (582, 1124), (592, 1145), (1028, 1154), (575, 1131), (604, 1157), (1021, 1141)]
         : compromised: 0.5167, honest: 0.8983
         : ubar stats = ['Node 0: s1=0.375, s2=0.315', 'Node 1: s1=0.364, s2=0.500', 'Node 2: s1=0.333, s2=0.500']...
Round 010: test acc mean=0.6698 ± 0.1880 | min=0.4933 max=0.9059
         : test loss mean=nan ± nan
         : individual accs = ['0.903509', '0.508636', '0.493345', '0.528497', '0.894180', '0.514410', '0.895197', '0.905945', '0.562500', '0.903369', '0.899476', '0.498667', '0.522569', '0.506897', '0.517794', '0.517031', '0.903813', '0.508400', '0.522040', '0.890447']
         : correct/total = [(1030, 1140), (589, 1158), (556, 1127), (612, 1158), (1014, 1134), (589, 1145), (1025, 1145), (1021, 1127), (639, 1136), (1019, 1128), (1029, 1144), (561, 1125), (602, 1152), (588, 1160), (582, 1124), (592, 1145), (1043, 1154), (575, 1131), (604, 1157), (1016, 1141)]
         : compromised: 0.5167, honest: 0.8995
         : ubar stats = ['Node 0: s1=0.375, s2=0.350', 'Node 1: s1=0.364, s2=0.475', 'Node 2: s1=0.333, s2=0.475']...

=== FINAL RESULTS ===
Dataset: celeba, Nodes: 20, Graph: erdos, Aggregation: ubar
Attack: backdoor, 60.0% compromised
Final accuracy - Compromised: 0.5167, Honest: 0.8995
Overall test accuracy: mean=0.6698 ± 0.1880

=== BACKDOOR ATTACK SUCCESS RATE (ASR) ===
Target label: 0
Trigger size: 8x8
Overall ASR: 0.8187 ± 0.2227
Honest nodes ASR: 0.5467 ± 0.0255
Compromised nodes ASR: 1.0000 ± 0.0000
Note: Higher ASR indicates more successful backdoor attack

=== UBAR SUMMARY ===
Node 0: stage1=0.375, stage2=0.350, overall=0.131
Node 1: stage1=0.364, stage2=0.475, overall=0.173
Node 2: stage1=0.333, stage2=0.475, overall=0.158
Node 3: stage1=0.375, stage2=0.533, overall=0.200
Node 4: stage1=0.364, stage2=0.500, overall=0.182
Node 5: stage1=0.400, stage2=0.417, overall=0.167
Node 6: stage1=0.357, stage2=0.200, overall=0.071
Node 7: stage1=0.357, stage2=0.600, overall=0.214
Node 8: stage1=0.400, stage2=0.450, overall=0.180
Node 9: stage1=0.385, stage2=0.440, overall=0.169
Node 10: stage1=0.333, stage2=0.400, overall=0.133
Node 11: stage1=0.357, stage2=0.440, overall=0.157
Node 12: stage1=0.333, stage2=0.475, overall=0.158
Node 13: stage1=0.385, stage2=0.440, overall=0.169
Node 14: stage1=0.400, stage2=0.417, overall=0.167
Node 15: stage1=0.364, stage2=0.400, overall=0.145
Node 16: stage1=0.385, stage2=0.300, overall=0.115
Node 17: stage1=0.333, stage2=0.533, overall=0.178
Node 18: stage1=0.375, stage2=0.417, overall=0.156
Node 19: stage1=0.375, stage2=0.450, overall=0.169

=== PARALLEL EXECUTION TIME (realistic for distributed system) ===
  COMMUNICATION (max across nodes):
    - Full model transfer: 0.000s (0.0%)
  COMPUTATION (max across nodes):
    - Distance computation: 0.046s (18.3%)
    - Loss computation: 0.200s (79.7%)
    - Aggregation: 0.005s (1.9%)
  TOTALS:
    - Total computation: 0.251s (100.0%)
    - Total communication: 0.000s (0.0%)
    - Total parallel time: 0.251s

=== PER-NODE AVERAGE TIME ===
  - Distance computation: 0.033s
  - Loss computation: 0.169s
  - Aggregation: 0.003s
  - Model transfer: 0.000s
  - Total per node: 0.205s

=== TOTAL COMPUTATIONAL WORK (sum across all nodes) ===
  - Total distance computation: 0.653s
  - Total loss computation: 3.386s
  - Total aggregation: 0.068s
  - Total model transfer: 0.000s
  - Grand total: 4.106s
  - Mean Stage 1 acceptance rate: 0.367
  - Mean Stage 2 acceptance rate: 0.436
  - Overall acceptance rate: 0.160

UBAR Algorithm Properties:
  - Model dimension: 2,219,692
  - Rho parameter: 0.4
  - Two-stage approach: Distance filtering + loss evaluation
  - Stage 1 selects: 40% of neighbors
  - Stage 2 uses: Training sample loss comparison
  - Theoretical complexity: O(deg(i)×d + deg(i)×inference)
  - Approach: UBAR paper implementation
