Device: cuda
Seed: 987654321
Looking for images in: /home/student.unimelb.edu.au/mrangwala/Projects/Sketchguard/leaf/data/celeba/data/raw/img_align_celeba
Loading 1 LEAF CelebA train files...
LEAF CelebA train: 9343 users (celebrities), 177457 samples
Looking for images in: /home/student.unimelb.edu.au/mrangwala/Projects/Sketchguard/leaf/data/celeba/data/raw/img_align_celeba
Loading 1 LEAF CelebA test files...
LEAF CelebA test: 9343 users (celebrities), 22831 samples
Found 9343 train users, 9343 test users, 9343 common users
User sample counts range: 31 (max) to 4 (min)
Distributed ALL 9343 users across 20 clients
Users per client: 467 (with 3 clients getting +1 user)
Train partition sizes: [8843, 8998, 8728, 9034, 8866, 8946, 8873, 8776, 8816, 8801, 8913, 8656, 9115, 8921, 8699, 8823, 8912, 8766, 9102, 8869]
Test partition sizes: [1140, 1158, 1127, 1158, 1134, 1145, 1145, 1127, 1136, 1128, 1144, 1125, 1152, 1160, 1124, 1145, 1154, 1131, 1157, 1141]
  Client 0: 8843 train samples, 2 unique classes
  Client 1: 8998 train samples, 2 unique classes
  Client 2: 8728 train samples, 2 unique classes
  Client 3: 9034 train samples, 2 unique classes
  Client 4: 8866 train samples, 2 unique classes
  Client 5: 8946 train samples, 2 unique classes
  Client 6: 8873 train samples, 2 unique classes
  Client 7: 8776 train samples, 2 unique classes
  Client 8: 8816 train samples, 2 unique classes
  Client 9: 8801 train samples, 2 unique classes
  Client 10: 8913 train samples, 2 unique classes
  Client 11: 8656 train samples, 2 unique classes
  Client 12: 9115 train samples, 2 unique classes
  Client 13: 8921 train samples, 2 unique classes
  Client 14: 8699 train samples, 2 unique classes
  Client 15: 8823 train samples, 2 unique classes
  Client 16: 8912 train samples, 2 unique classes
  Client 17: 8766 train samples, 2 unique classes
  Client 18: 9102 train samples, 2 unique classes
  Client 19: 8869 train samples, 2 unique classes
Will sample 4500 samples per client per epoch
Graph: erdos, nodes: 20, edges: 99
Degree statistics: avg=9.90, min=7, max=14
Attack: Compromised 14/20 nodes: [1, 2, 3, 5, 6, 8, 11, 12, 13, 14, 15, 17, 18, 19]
Attack type: backdoor, lambda: 1.0
Backdoor target label: 0, trigger size: 8
Model variant: baseline
Model parameters: 2,219,692
UBAR ALGORITHM (Two-Stage Byzantine-resilient)
  - Model dimension: 2,219,692 parameters
  - Rho parameter: 0.30000000000000004
  - Stage 1: Distance-based filtering (select 30% closest neighbors)
  - Stage 2: Performance-based selection (loss comparison)
  - Complexity: O(deg(i)×d + deg(i)×inference)
Initial test acc across nodes: mean=0.4978 ± 0.0208
Backdoor attack: Created poisoned datasets for 14 compromised nodes
Round 001: test acc mean=0.5516 ± 0.0638 | min=0.4942 max=0.7158
         : test loss mean=3510.0476 ± 2782.5443
         : individual accs = ['0.664035', '0.508636', '0.494232', '0.534542', '0.522928', '0.514410', '0.521397', '0.576752', '0.562500', '0.699468', '0.579545', '0.520000', '0.522569', '0.506897', '0.517794', '0.521397', '0.715771', '0.508400', '0.522040', '0.517967']
         : correct/total = [(757, 1140), (589, 1158), (557, 1127), (619, 1158), (593, 1134), (589, 1145), (597, 1145), (650, 1127), (639, 1136), (789, 1128), (663, 1144), (585, 1125), (602, 1152), (588, 1160), (582, 1124), (597, 1145), (826, 1154), (575, 1131), (604, 1157), (591, 1141)]
         : compromised: 0.5195, honest: 0.6264
         : ubar stats = ['Node 0: s1=0.250, s2=0.333', 'Node 1: s1=0.300, s2=1.000', 'Node 2: s1=0.250, s2=1.000']...
Round 002: test acc mean=0.5770 ± 0.1051 | min=0.4559 max=0.7695
         : test loss mean=nan ± nan
         : individual accs = ['0.754386', '0.506045', '0.488909', '0.527634', '0.663139', '0.513537', '0.521397', '0.685004', '0.562500', '0.744681', '0.769231', '0.497778', '0.512153', '0.506897', '0.514235', '0.455895', '0.769497', '0.505747', '0.522040', '0.518843']
         : correct/total = [(860, 1140), (586, 1158), (551, 1127), (611, 1158), (752, 1134), (588, 1145), (597, 1145), (772, 1127), (639, 1136), (840, 1128), (880, 1144), (560, 1125), (590, 1152), (588, 1160), (578, 1124), (522, 1145), (888, 1154), (572, 1131), (604, 1157), (592, 1141)]
         : compromised: 0.5110, honest: 0.7310
         : ubar stats = ['Node 0: s1=0.250, s2=0.333', 'Node 1: s1=0.300, s2=1.000', 'Node 2: s1=0.250, s2=1.000']...
Round 003: test acc mean=0.6088 ± 0.1414 | min=0.4933 max=0.8412
         : test loss mean=nan ± nan
         : individual accs = ['0.841228', '0.508636', '0.493345', '0.528497', '0.769841', '0.514410', '0.521397', '0.805679', '0.562500', '0.837766', '0.840909', '0.498667', '0.522569', '0.506897', '0.517794', '0.517031', '0.840555', '0.508400', '0.522040', '0.517967']
         : correct/total = [(959, 1140), (589, 1158), (556, 1127), (612, 1158), (873, 1134), (589, 1145), (597, 1145), (908, 1127), (639, 1136), (945, 1128), (962, 1144), (561, 1125), (602, 1152), (588, 1160), (582, 1124), (592, 1145), (970, 1154), (575, 1131), (604, 1157), (591, 1141)]
         : compromised: 0.5172, honest: 0.8227
         : ubar stats = ['Node 0: s1=0.250, s2=0.444', 'Node 1: s1=0.300, s2=0.778', 'Node 2: s1=0.250, s2=0.833']...
Round 004: test acc mean=0.6197 ± 0.1574 | min=0.4933 max=0.8794
         : test loss mean=nan ± nan
         : individual accs = ['0.864912', '0.508636', '0.493345', '0.528497', '0.831570', '0.514410', '0.521397', '0.842059', '0.562500', '0.875887', '0.879371', '0.498667', '0.522569', '0.506897', '0.517794', '0.517031', '0.859619', '0.508400', '0.522040', '0.517967']
         : correct/total = [(986, 1140), (589, 1158), (556, 1127), (612, 1158), (943, 1134), (589, 1145), (597, 1145), (949, 1127), (639, 1136), (988, 1128), (1006, 1144), (561, 1125), (602, 1152), (588, 1160), (582, 1124), (592, 1145), (992, 1154), (575, 1131), (604, 1157), (591, 1141)]
         : compromised: 0.5172, honest: 0.8589
         : ubar stats = ['Node 0: s1=0.250, s2=0.417', 'Node 1: s1=0.300, s2=0.667', 'Node 2: s1=0.250, s2=0.750']...
Round 005: test acc mean=0.6231 ± 0.1625 | min=0.4933 max=0.8848
         : test loss mean=nan ± nan
         : individual accs = ['0.855263', '0.508636', '0.493345', '0.528497', '0.874780', '0.514410', '0.521397', '0.856256', '0.562500', '0.884752', '0.873252', '0.498667', '0.522569', '0.506897', '0.517794', '0.517031', '0.877816', '0.508400', '0.522040', '0.517967']
         : correct/total = [(975, 1140), (589, 1158), (556, 1127), (612, 1158), (992, 1134), (589, 1145), (597, 1145), (965, 1127), (639, 1136), (998, 1128), (999, 1144), (561, 1125), (602, 1152), (588, 1160), (582, 1124), (592, 1145), (1013, 1154), (575, 1131), (604, 1157), (591, 1141)]
         : compromised: 0.5172, honest: 0.8704
         : ubar stats = ['Node 0: s1=0.250, s2=0.533', 'Node 1: s1=0.300, s2=0.600', 'Node 2: s1=0.250, s2=0.700']...
Round 006: test acc mean=0.6277 ± 0.1694 | min=0.4933 max=0.8960
         : test loss mean=nan ± nan
         : individual accs = ['0.880702', '0.508636', '0.493345', '0.528497', '0.877425', '0.514410', '0.521397', '0.881988', '0.562500', '0.884752', '0.892483', '0.498667', '0.522569', '0.506897', '0.517794', '0.517031', '0.896014', '0.508400', '0.522040', '0.517967']
         : correct/total = [(1004, 1140), (589, 1158), (556, 1127), (612, 1158), (995, 1134), (589, 1145), (597, 1145), (994, 1127), (639, 1136), (998, 1128), (1021, 1144), (561, 1125), (602, 1152), (588, 1160), (582, 1124), (592, 1145), (1034, 1154), (575, 1131), (604, 1157), (591, 1141)]
         : compromised: 0.5172, honest: 0.8856
         : ubar stats = ['Node 0: s1=0.250, s2=0.500', 'Node 1: s1=0.300, s2=0.556', 'Node 2: s1=0.250, s2=0.667']...
Round 007: test acc mean=0.6306 ± 0.1738 | min=0.4933 max=0.9007
         : test loss mean=nan ± nan
         : individual accs = ['0.892105', '0.508636', '0.493345', '0.528497', '0.892416', '0.514410', '0.521397', '0.894410', '0.562500', '0.900709', '0.895979', '0.498667', '0.522569', '0.506897', '0.517794', '0.517031', '0.896014', '0.508400', '0.522040', '0.517967']
         : correct/total = [(1017, 1140), (589, 1158), (556, 1127), (612, 1158), (1012, 1134), (589, 1145), (597, 1145), (1008, 1127), (639, 1136), (1016, 1128), (1025, 1144), (561, 1125), (602, 1152), (588, 1160), (582, 1124), (592, 1145), (1034, 1154), (575, 1131), (604, 1157), (591, 1141)]
         : compromised: 0.5172, honest: 0.8953
         : ubar stats = ['Node 0: s1=0.250, s2=0.476', 'Node 1: s1=0.300, s2=0.524', 'Node 2: s1=0.250, s2=0.643']...
Round 008: test acc mean=0.6312 ± 0.1748 | min=0.4933 max=0.9035
         : test loss mean=nan ± nan
         : individual accs = ['0.903509', '0.508636', '0.493345', '0.528497', '0.892416', '0.514410', '0.521397', '0.903283', '0.562500', '0.891844', '0.896853', '0.498667', '0.522569', '0.506897', '0.517794', '0.517031', '0.896880', '0.508400', '0.522040', '0.517967']
         : correct/total = [(1030, 1140), (589, 1158), (556, 1127), (612, 1158), (1012, 1134), (589, 1145), (597, 1145), (1018, 1127), (639, 1136), (1006, 1128), (1026, 1144), (561, 1125), (602, 1152), (588, 1160), (582, 1124), (592, 1145), (1035, 1154), (575, 1131), (604, 1157), (591, 1141)]
         : compromised: 0.5172, honest: 0.8975
         : ubar stats = ['Node 0: s1=0.250, s2=0.458', 'Node 1: s1=0.300, s2=0.500', 'Node 2: s1=0.250, s2=0.625']...
Round 009: test acc mean=0.6321 ± 0.1761 | min=0.4933 max=0.9077
         : test loss mean=nan ± nan
         : individual accs = ['0.900877', '0.508636', '0.493345', '0.528497', '0.903880', '0.514410', '0.521397', '0.907720', '0.562500', '0.889184', '0.897727', '0.498667', '0.522569', '0.506897', '0.517794', '0.517031', '0.902080', '0.508400', '0.522040', '0.517967']
         : correct/total = [(1027, 1140), (589, 1158), (556, 1127), (612, 1158), (1025, 1134), (589, 1145), (597, 1145), (1023, 1127), (639, 1136), (1003, 1128), (1027, 1144), (561, 1125), (602, 1152), (588, 1160), (582, 1124), (592, 1145), (1041, 1154), (575, 1131), (604, 1157), (591, 1141)]
         : compromised: 0.5172, honest: 0.9002
         : ubar stats = ['Node 0: s1=0.250, s2=0.444', 'Node 1: s1=0.300, s2=0.481', 'Node 2: s1=0.250, s2=0.611']...
Round 010: test acc mean=0.6326 ± 0.1769 | min=0.4933 max=0.9090
         : test loss mean=nan ± nan
         : individual accs = ['0.901754', '0.508636', '0.493345', '0.528497', '0.902998', '0.514410', '0.521397', '0.901508', '0.562500', '0.899823', '0.896853', '0.498667', '0.522569', '0.506897', '0.517794', '0.517031', '0.909012', '0.508400', '0.522040', '0.517967']
         : correct/total = [(1028, 1140), (589, 1158), (556, 1127), (612, 1158), (1024, 1134), (589, 1145), (597, 1145), (1016, 1127), (639, 1136), (1015, 1128), (1026, 1144), (561, 1125), (602, 1152), (588, 1160), (582, 1124), (592, 1145), (1049, 1154), (575, 1131), (604, 1157), (591, 1141)]
         : compromised: 0.5172, honest: 0.9020
         : ubar stats = ['Node 0: s1=0.250, s2=0.433', 'Node 1: s1=0.300, s2=0.467', 'Node 2: s1=0.250, s2=0.600']...

=== FINAL RESULTS ===
Dataset: celeba, Nodes: 20, Graph: erdos, Aggregation: ubar
Attack: backdoor, 70.0% compromised
Final accuracy - Compromised: 0.5172, Honest: 0.9020
Overall test accuracy: mean=0.6326 ± 0.1769

=== BACKDOOR ATTACK SUCCESS RATE (ASR) ===
Target label: 0
Trigger size: 8x8
Overall ASR: 0.8664 ± 0.2049
Honest nodes ASR: 0.5548 ± 0.0338
Compromised nodes ASR: 1.0000 ± 0.0000
Note: Higher ASR indicates more successful backdoor attack

=== UBAR SUMMARY ===
Node 0: stage1=0.250, stage2=0.433, overall=0.108
Node 1: stage1=0.300, stage2=0.467, overall=0.140
Node 2: stage1=0.250, stage2=0.600, overall=0.150
Node 3: stage1=0.286, stage2=0.600, overall=0.171
Node 4: stage1=0.222, stage2=0.700, overall=0.156
Node 5: stage1=0.300, stage2=0.433, overall=0.130
Node 6: stage1=0.250, stage2=0.467, overall=0.117
Node 7: stage1=0.273, stage2=0.567, overall=0.155
Node 8: stage1=0.286, stage2=0.550, overall=0.157
Node 9: stage1=0.273, stage2=0.500, overall=0.136
Node 10: stage1=0.250, stage2=0.500, overall=0.125
Node 11: stage1=0.250, stage2=0.467, overall=0.117
Node 12: stage1=0.250, stage2=0.467, overall=0.117
Node 13: stage1=0.222, stage2=0.550, overall=0.122
Node 14: stage1=0.286, stage2=0.400, overall=0.114
Node 15: stage1=0.222, stage2=0.600, overall=0.133
Node 16: stage1=0.286, stage2=0.650, overall=0.186
Node 17: stage1=0.250, stage2=0.600, overall=0.150
Node 18: stage1=0.250, stage2=0.467, overall=0.117
Node 19: stage1=0.300, stage2=0.433, overall=0.130

=== PARALLEL EXECUTION TIME (realistic for distributed system) ===
  COMMUNICATION (max across nodes):
    - Full model transfer: 0.000s (0.0%)
  COMPUTATION (max across nodes):
    - Distance computation: 0.034s (15.8%)
    - Loss computation: 0.179s (82.4%)
    - Aggregation: 0.004s (1.8%)
  TOTALS:
    - Total computation: 0.217s (100.0%)
    - Total communication: 0.000s (0.0%)
    - Total parallel time: 0.217s

=== PER-NODE AVERAGE TIME ===
  - Distance computation: 0.025s
  - Loss computation: 0.139s
  - Aggregation: 0.003s
  - Model transfer: 0.000s
  - Total per node: 0.167s

=== TOTAL COMPUTATIONAL WORK (sum across all nodes) ===
  - Total distance computation: 0.503s
  - Total loss computation: 2.790s
  - Total aggregation: 0.056s
  - Total model transfer: 0.000s
  - Grand total: 3.349s
  - Mean Stage 1 acceptance rate: 0.263
  - Mean Stage 2 acceptance rate: 0.523
  - Overall acceptance rate: 0.137

UBAR Algorithm Properties:
  - Model dimension: 2,219,692
  - Rho parameter: 0.30000000000000004
  - Two-stage approach: Distance filtering + loss evaluation
  - Stage 1 selects: 30% of neighbors
  - Stage 2 uses: Training sample loss comparison
  - Theoretical complexity: O(deg(i)×d + deg(i)×inference)
  - Approach: UBAR paper implementation
