Device: cuda
Seed: 987654321
Looking for images in: /home/student.unimelb.edu.au/mrangwala/Projects/Sketchguard/leaf/data/celeba/data/raw/img_align_celeba
Loading 1 LEAF CelebA train files...
LEAF CelebA train: 9343 users (celebrities), 177457 samples
Looking for images in: /home/student.unimelb.edu.au/mrangwala/Projects/Sketchguard/leaf/data/celeba/data/raw/img_align_celeba
Loading 1 LEAF CelebA test files...
LEAF CelebA test: 9343 users (celebrities), 22831 samples
Found 9343 train users, 9343 test users, 9343 common users
User sample counts range: 31 (max) to 4 (min)
Distributed ALL 9343 users across 20 clients
Users per client: 467 (with 3 clients getting +1 user)
Train partition sizes: [8843, 8998, 8728, 9034, 8866, 8946, 8873, 8776, 8816, 8801, 8913, 8656, 9115, 8921, 8699, 8823, 8912, 8766, 9102, 8869]
Test partition sizes: [1140, 1158, 1127, 1158, 1134, 1145, 1145, 1127, 1136, 1128, 1144, 1125, 1152, 1160, 1124, 1145, 1154, 1131, 1157, 1141]
  Client 0: 8843 train samples, 2 unique classes
  Client 1: 8998 train samples, 2 unique classes
  Client 2: 8728 train samples, 2 unique classes
  Client 3: 9034 train samples, 2 unique classes
  Client 4: 8866 train samples, 2 unique classes
  Client 5: 8946 train samples, 2 unique classes
  Client 6: 8873 train samples, 2 unique classes
  Client 7: 8776 train samples, 2 unique classes
  Client 8: 8816 train samples, 2 unique classes
  Client 9: 8801 train samples, 2 unique classes
  Client 10: 8913 train samples, 2 unique classes
  Client 11: 8656 train samples, 2 unique classes
  Client 12: 9115 train samples, 2 unique classes
  Client 13: 8921 train samples, 2 unique classes
  Client 14: 8699 train samples, 2 unique classes
  Client 15: 8823 train samples, 2 unique classes
  Client 16: 8912 train samples, 2 unique classes
  Client 17: 8766 train samples, 2 unique classes
  Client 18: 9102 train samples, 2 unique classes
  Client 19: 8869 train samples, 2 unique classes
Will sample 4500 samples per client per epoch
Graph: fully, nodes: 20, edges: 190
Degree statistics: avg=19.00, min=19, max=19
Attack: Compromised 2/20 nodes: [5, 13]
Attack type: directed_deviation, lambda: 1.0
Model variant: baseline
Model parameters: 2,219,692
Initial test acc across nodes: mean=0.4978 ± 0.0208
Round 001: test acc mean=0.6938 ± 0.0140 | min=0.6615 max=0.7150
         : test loss mean=0.6409 ± 0.0037
         : individual accs = ['0.671930', '0.661485', '0.678793', '0.699482', '0.693122', '0.705677', '0.701310', '0.710736', '0.709507', '0.679078', '0.715035', '0.705778', '0.706597', '0.703448', '0.689502', '0.690830', '0.694107', '0.686118', '0.677615', '0.695004']
         : correct/total = [(766, 1140), (766, 1158), (765, 1127), (810, 1158), (786, 1134), (808, 1145), (803, 1145), (801, 1127), (806, 1136), (766, 1128), (818, 1144), (794, 1125), (814, 1152), (816, 1160), (775, 1124), (791, 1145), (801, 1154), (776, 1131), (784, 1157), (793, 1141)]
         : compromised: 0.7046, honest: 0.6926
Round 002: test acc mean=0.8231 ± 0.0115 | min=0.8003 max=0.8479
         : test loss mean=0.4136 ± 0.0113
         : individual accs = ['0.820175', '0.832470', '0.819876', '0.824698', '0.817460', '0.827074', '0.834061', '0.811890', '0.837148', '0.835993', '0.847902', '0.832889', '0.811632', '0.813793', '0.814057', '0.807860', '0.832756', '0.818744', '0.800346', '0.820333']
         : correct/total = [(935, 1140), (964, 1158), (924, 1127), (955, 1158), (927, 1134), (947, 1145), (955, 1145), (915, 1127), (951, 1136), (943, 1128), (970, 1144), (937, 1125), (935, 1152), (944, 1160), (915, 1124), (925, 1145), (961, 1154), (926, 1131), (926, 1157), (936, 1141)]
         : compromised: 0.8204, honest: 0.8233
Round 003: test acc mean=0.8480 ± 0.0111 | min=0.8220 max=0.8644
         : test loss mean=0.3425 ± 0.0130
         : individual accs = ['0.831579', '0.853195', '0.850044', '0.846287', '0.852734', '0.844541', '0.862009', '0.841171', '0.838908', '0.864362', '0.861014', '0.858667', '0.852431', '0.840517', '0.851423', '0.829694', '0.859619', '0.848806', '0.821953', '0.850131']
         : correct/total = [(948, 1140), (988, 1158), (958, 1127), (980, 1158), (967, 1134), (967, 1145), (987, 1145), (948, 1127), (953, 1136), (975, 1128), (985, 1144), (966, 1125), (982, 1152), (975, 1160), (957, 1124), (950, 1145), (992, 1154), (960, 1131), (951, 1157), (970, 1141)]
         : compromised: 0.8425, honest: 0.8486
Round 004: test acc mean=0.8521 ± 0.0082 | min=0.8358 max=0.8679
         : test loss mean=0.3297 ± 0.0178
         : individual accs = ['0.843860', '0.843696', '0.845608', '0.855786', '0.849206', '0.856769', '0.867249', '0.849157', '0.843310', '0.867908', '0.861888', '0.853333', '0.853299', '0.846552', '0.850534', '0.848908', '0.862218', '0.848806', '0.835782', '0.858019']
         : correct/total = [(962, 1140), (977, 1158), (953, 1127), (991, 1158), (963, 1134), (981, 1145), (993, 1145), (957, 1127), (958, 1136), (979, 1128), (986, 1144), (960, 1125), (983, 1152), (982, 1160), (956, 1124), (972, 1145), (995, 1154), (960, 1131), (967, 1157), (979, 1141)]
         : compromised: 0.8517, honest: 0.8521
Round 005: test acc mean=0.8809 ± 0.0095 | min=0.8591 max=0.9012
         : test loss mean=0.2773 ± 0.0143
         : individual accs = ['0.864035', '0.879965', '0.875776', '0.888601', '0.876543', '0.884716', '0.888210', '0.884650', '0.881162', '0.893617', '0.901224', '0.888000', '0.890625', '0.875000', '0.878114', '0.871616', '0.880416', '0.877100', '0.859118', '0.879053']
         : correct/total = [(985, 1140), (1019, 1158), (987, 1127), (1029, 1158), (994, 1134), (1013, 1145), (1017, 1145), (997, 1127), (1001, 1136), (1008, 1128), (1031, 1144), (999, 1125), (1026, 1152), (1015, 1160), (987, 1124), (998, 1145), (1016, 1154), (992, 1131), (994, 1157), (1003, 1141)]
         : compromised: 0.8799, honest: 0.8810
Round 006: test acc mean=0.8773 ± 0.0087 | min=0.8565 max=0.8901
         : test loss mean=0.2825 ± 0.0168
         : individual accs = ['0.858772', '0.868739', '0.876664', '0.881693', '0.874780', '0.875109', '0.888210', '0.883762', '0.870599', '0.890071', '0.889860', '0.880000', '0.883681', '0.875862', '0.879893', '0.873362', '0.883016', '0.878868', '0.856525', '0.876424']
         : correct/total = [(979, 1140), (1006, 1158), (988, 1127), (1021, 1158), (992, 1134), (1002, 1145), (1017, 1145), (996, 1127), (989, 1136), (1004, 1128), (1018, 1144), (990, 1125), (1018, 1152), (1016, 1160), (989, 1124), (1000, 1145), (1019, 1154), (994, 1131), (991, 1157), (1000, 1141)]
         : compromised: 0.8755, honest: 0.8775
Round 007: test acc mean=0.8967 ± 0.0084 | min=0.8773 max=0.9092
         : test loss mean=0.2485 ± 0.0138
         : individual accs = ['0.894737', '0.898964', '0.892635', '0.898100', '0.900353', '0.898690', '0.909170', '0.905945', '0.895246', '0.903369', '0.902972', '0.905778', '0.894097', '0.893966', '0.904804', '0.880349', '0.902946', '0.884173', '0.877269', '0.891323']
         : correct/total = [(1020, 1140), (1041, 1158), (1006, 1127), (1040, 1158), (1021, 1134), (1029, 1145), (1041, 1145), (1021, 1127), (1017, 1136), (1019, 1128), (1033, 1144), (1019, 1125), (1030, 1152), (1037, 1160), (1017, 1124), (1008, 1145), (1042, 1154), (1000, 1131), (1015, 1157), (1017, 1141)]
         : compromised: 0.8963, honest: 0.8968
Round 008: test acc mean=0.8983 ± 0.0077 | min=0.8842 max=0.9119
         : test loss mean=0.2430 ± 0.0149
         : individual accs = ['0.896491', '0.898100', '0.889086', '0.911917', '0.899471', '0.896943', '0.907424', '0.902396', '0.892606', '0.907801', '0.902098', '0.911111', '0.902778', '0.896552', '0.903025', '0.892576', '0.897747', '0.888594', '0.884183', '0.886065']
         : correct/total = [(1022, 1140), (1040, 1158), (1002, 1127), (1056, 1158), (1020, 1134), (1027, 1145), (1039, 1145), (1017, 1127), (1014, 1136), (1024, 1128), (1032, 1144), (1025, 1125), (1040, 1152), (1040, 1160), (1015, 1124), (1022, 1145), (1036, 1154), (1005, 1131), (1023, 1157), (1011, 1141)]
         : compromised: 0.8967, honest: 0.8985
Round 009: test acc mean=0.8991 ± 0.0079 | min=0.8799 max=0.9156
         : test loss mean=0.2403 ± 0.0158
         : individual accs = ['0.902632', '0.898100', '0.889973', '0.907599', '0.903880', '0.903057', '0.905677', '0.907720', '0.893486', '0.906028', '0.901224', '0.915556', '0.898438', '0.897414', '0.900356', '0.894323', '0.896880', '0.886826', '0.879862', '0.893953']
         : correct/total = [(1029, 1140), (1040, 1158), (1003, 1127), (1051, 1158), (1025, 1134), (1034, 1145), (1037, 1145), (1023, 1127), (1015, 1136), (1022, 1128), (1031, 1144), (1030, 1125), (1035, 1152), (1041, 1160), (1012, 1124), (1024, 1145), (1035, 1154), (1003, 1131), (1018, 1157), (1020, 1141)]
         : compromised: 0.9002, honest: 0.8990
Round 010: test acc mean=0.8992 ± 0.0087 | min=0.8807 max=0.9156
         : test loss mean=0.2463 ± 0.0168
         : individual accs = ['0.903509', '0.892055', '0.892635', '0.905872', '0.897707', '0.897817', '0.914410', '0.911269', '0.890845', '0.900709', '0.900350', '0.915556', '0.899306', '0.900000', '0.905694', '0.886463', '0.900347', '0.889478', '0.880726', '0.900088']
         : correct/total = [(1030, 1140), (1033, 1158), (1006, 1127), (1049, 1158), (1018, 1134), (1028, 1145), (1047, 1145), (1027, 1127), (1012, 1136), (1016, 1128), (1030, 1144), (1030, 1125), (1036, 1152), (1044, 1160), (1018, 1124), (1015, 1145), (1039, 1154), (1006, 1131), (1019, 1157), (1027, 1141)]
         : compromised: 0.8989, honest: 0.8993

=== FINAL RESULTS ===
Dataset: celeba, Nodes: 20, Graph: fully, Aggregation: krum
Attack: directed_deviation, 10.0% compromised
Final accuracy - Compromised: 0.8989, Honest: 0.8993
Overall test accuracy: mean=0.8992 ± 0.0087
