Device: cuda
Seed: 987654321
Loading 36 LEAF FEMNIST train files...
LEAF FEMNIST train: 3597 users, 734463 samples
Loading 36 LEAF FEMNIST test files...
LEAF FEMNIST test: 3597 users, 83388 samples
Found 3597 train users, 3597 test users, 3597 common users
User sample counts range: 525 (max) to 17 (min)
Distributed ALL 3597 users across 20 clients
Users per client: 179 (with 17 clients getting +1 user)
Train partition sizes: [36360, 37070, 35957, 38262, 36024, 37732, 36921, 38328, 36867, 37683, 36507, 36915, 36007, 37001, 35681, 35453, 36585, 36801, 35964, 36345]
Test partition sizes: [4128, 4203, 4081, 4333, 4091, 4287, 4193, 4349, 4191, 4277, 4143, 4193, 4093, 4197, 4052, 4029, 4153, 4183, 4084, 4128]
  Client 0: 36360 train samples, 62 unique classes
  Client 1: 37070 train samples, 62 unique classes
  Client 2: 35957 train samples, 62 unique classes
  Client 3: 38262 train samples, 62 unique classes
  Client 4: 36024 train samples, 62 unique classes
  Client 5: 37732 train samples, 62 unique classes
  Client 6: 36921 train samples, 62 unique classes
  Client 7: 38328 train samples, 62 unique classes
  Client 8: 36867 train samples, 62 unique classes
  Client 9: 37683 train samples, 62 unique classes
  Client 10: 36507 train samples, 62 unique classes
  Client 11: 36915 train samples, 62 unique classes
  Client 12: 36007 train samples, 62 unique classes
  Client 13: 37001 train samples, 62 unique classes
  Client 14: 35681 train samples, 62 unique classes
  Client 15: 35453 train samples, 62 unique classes
  Client 16: 36585 train samples, 62 unique classes
  Client 17: 36801 train samples, 62 unique classes
  Client 18: 35964 train samples, 62 unique classes
  Client 19: 36345 train samples, 62 unique classes
Will sample 4500 samples per client per epoch
Graph: fully, nodes: 20, edges: 190
Degree statistics: avg=19.00, min=19, max=19
Attack: Compromised 12/20 nodes: [1, 2, 3, 5, 8, 11, 12, 13, 14, 15, 17, 18]
Attack type: krum, lambda: 1.0
Model variant: baseline
Model parameters: 6,603,710
UBAR ALGORITHM (Two-Stage Byzantine-resilient)
  - Model dimension: 6,603,710 parameters
  - Rho parameter: 0.4
  - Stage 1: Distance-based filtering (select 40% closest neighbors)
  - Stage 2: Performance-based selection (loss comparison)
  - Complexity: O(deg(i)×d + deg(i)×inference)
Initial test acc across nodes: mean=0.0168 ± 0.0139
Round 001: test acc mean=0.0540 ± 0.0100 | min=0.0434 max=0.0935
         : test loss mean=4.0186 ± 0.0357
         : individual accs = ['0.093508', '0.052344', '0.048272', '0.043388', '0.057932', '0.059715', '0.057000', '0.051276', '0.053209', '0.047229', '0.050447', '0.054138', '0.050818', '0.046462', '0.048124', '0.050633', '0.058271', '0.050920', '0.057052', '0.050145']
         : correct/total = [(386, 4128), (220, 4203), (197, 4081), (188, 4333), (237, 4091), (256, 4287), (239, 4193), (223, 4349), (223, 4191), (202, 4277), (209, 4143), (227, 4193), (208, 4093), (195, 4197), (195, 4052), (204, 4029), (242, 4153), (213, 4183), (233, 4084), (207, 4128)]
         : compromised: 0.0513, honest: 0.0582
         : ubar stats = ['Node 0: s1=0.368, s2=0.571', 'Node 1: s1=0.368, s2=0.286', 'Node 2: s1=0.368, s2=0.143']...
Round 002: test acc mean=0.0515 ± 0.0045 | min=0.0420 max=0.0579
         : test loss mean=3.9278 ± 0.0279
         : individual accs = ['0.044574', '0.051630', '0.053418', '0.052850', '0.057932', '0.057150', '0.057000', '0.047827', '0.053209', '0.053776', '0.041999', '0.053899', '0.045688', '0.046938', '0.046397', '0.053860', '0.049362', '0.050920', '0.055583', '0.055475']
         : correct/total = [(184, 4128), (217, 4203), (218, 4081), (229, 4333), (237, 4091), (245, 4287), (239, 4193), (208, 4349), (223, 4191), (230, 4277), (174, 4143), (226, 4193), (187, 4093), (197, 4197), (188, 4052), (217, 4029), (205, 4153), (213, 4183), (227, 4084), (229, 4128)]
         : compromised: 0.0518, honest: 0.0510
         : ubar stats = ['Node 0: s1=0.368, s2=0.643', 'Node 1: s1=0.368, s2=0.500', 'Node 2: s1=0.368, s2=0.143']...
Round 003: test acc mean=0.0552 ± 0.0100 | min=0.0457 max=0.0945
         : test loss mean=3.7546 ± 0.0178
         : individual accs = ['0.059593', '0.047109', '0.050723', '0.048234', '0.057932', '0.048052', '0.057000', '0.051276', '0.053209', '0.047697', '0.051653', '0.053899', '0.058637', '0.045747', '0.061204', '0.056342', '0.054418', '0.056658', '0.094515', '0.050872']
         : correct/total = [(246, 4128), (198, 4203), (207, 4081), (209, 4333), (237, 4091), (206, 4287), (239, 4193), (223, 4349), (223, 4191), (204, 4277), (214, 4143), (226, 4193), (240, 4093), (192, 4197), (248, 4052), (227, 4029), (226, 4153), (237, 4183), (386, 4084), (210, 4128)]
         : compromised: 0.0562, honest: 0.0538
         : ubar stats = ['Node 0: s1=0.368, s2=0.762', 'Node 1: s1=0.368, s2=0.381', 'Node 2: s1=0.368, s2=0.143']...
Round 004: test acc mean=0.0578 ± 0.0117 | min=0.0451 max=0.0961
         : test loss mean=3.6916 ± 0.0147
         : individual accs = ['0.059593', '0.052344', '0.057584', '0.052850', '0.096065', '0.050618', '0.057000', '0.058174', '0.053209', '0.048398', '0.045619', '0.082995', '0.054239', '0.062426', '0.061204', '0.056590', '0.058271', '0.050920', '0.052889', '0.045058']
         : correct/total = [(246, 4128), (220, 4203), (235, 4081), (229, 4333), (393, 4091), (217, 4287), (239, 4193), (253, 4349), (223, 4191), (207, 4277), (189, 4143), (348, 4193), (222, 4093), (262, 4197), (248, 4052), (228, 4029), (242, 4153), (213, 4183), (216, 4084), (186, 4128)]
         : compromised: 0.0573, honest: 0.0585
         : ubar stats = ['Node 0: s1=0.368, s2=0.679', 'Node 1: s1=0.368, s2=0.321', 'Node 2: s1=0.368, s2=0.357']...
Round 005: test acc mean=0.0540 ± 0.0084 | min=0.0432 max=0.0851
         : test loss mean=3.6820 ± 0.0157
         : individual accs = ['0.059593', '0.052344', '0.048272', '0.052850', '0.057932', '0.050618', '0.057000', '0.047827', '0.043188', '0.053776', '0.055998', '0.046983', '0.045688', '0.085061', '0.051579', '0.054852', '0.058993', '0.050920', '0.055583', '0.050145']
         : correct/total = [(246, 4128), (220, 4203), (197, 4081), (229, 4333), (237, 4091), (217, 4287), (239, 4193), (208, 4349), (181, 4191), (230, 4277), (232, 4143), (197, 4193), (187, 4093), (357, 4197), (209, 4052), (221, 4029), (245, 4153), (213, 4183), (227, 4084), (207, 4128)]
         : compromised: 0.0532, honest: 0.0552
         : ubar stats = ['Node 0: s1=0.368, s2=0.686', 'Node 1: s1=0.368, s2=0.314', 'Node 2: s1=0.368, s2=0.314']...
Round 006: test acc mean=0.0560 ± 0.0120 | min=0.0446 max=0.1051
         : test loss mean=3.6803 ± 0.0167
         : individual accs = ['0.044574', '0.050916', '0.057584', '0.052850', '0.057932', '0.050618', '0.057000', '0.051276', '0.053209', '0.053776', '0.050447', '0.046983', '0.053750', '0.062426', '0.105133', '0.051378', '0.058271', '0.050920', '0.055583', '0.055475']
         : correct/total = [(184, 4128), (214, 4203), (235, 4081), (229, 4333), (237, 4091), (217, 4287), (239, 4193), (223, 4349), (223, 4191), (230, 4277), (209, 4143), (197, 4193), (220, 4093), (262, 4197), (426, 4052), (207, 4029), (242, 4153), (213, 4183), (227, 4084), (229, 4128)]
         : compromised: 0.0576, honest: 0.0536
         : ubar stats = ['Node 0: s1=0.368, s2=0.738', 'Node 1: s1=0.368, s2=0.286', 'Node 2: s1=0.368, s2=0.405']...
Round 007: test acc mean=0.0566 ± 0.0067 | min=0.0459 max=0.0809
         : test loss mean=3.6801 ± 0.0167
         : individual accs = ['0.059593', '0.052344', '0.057584', '0.057466', '0.051088', '0.050618', '0.057000', '0.058174', '0.053209', '0.053776', '0.055998', '0.053899', '0.058637', '0.062426', '0.051826', '0.056590', '0.058512', '0.045900', '0.055828', '0.080911']
         : correct/total = [(246, 4128), (220, 4203), (235, 4081), (249, 4333), (209, 4091), (217, 4287), (239, 4193), (253, 4349), (223, 4191), (230, 4277), (232, 4143), (226, 4193), (240, 4093), (262, 4197), (210, 4052), (228, 4029), (243, 4153), (192, 4183), (228, 4084), (334, 4128)]
         : compromised: 0.0547, honest: 0.0594
         : ubar stats = ['Node 0: s1=0.368, s2=0.714', 'Node 1: s1=0.368, s2=0.347', 'Node 2: s1=0.368, s2=0.469']...
Round 008: test acc mean=0.0553 ± 0.0087 | min=0.0456 max=0.0892
         : test loss mean=3.6800 ± 0.0170
         : individual accs = ['0.059593', '0.056388', '0.050723', '0.054235', '0.051088', '0.051318', '0.057954', '0.051276', '0.089239', '0.054244', '0.045619', '0.054615', '0.053750', '0.047177', '0.061204', '0.056342', '0.055141', '0.050920', '0.055583', '0.048692']
         : correct/total = [(246, 4128), (237, 4203), (207, 4081), (235, 4333), (209, 4091), (220, 4287), (243, 4193), (223, 4349), (374, 4191), (232, 4277), (189, 4143), (229, 4193), (220, 4093), (198, 4197), (248, 4052), (227, 4029), (229, 4153), (213, 4183), (227, 4084), (201, 4128)]
         : compromised: 0.0568, honest: 0.0530
         : ubar stats = ['Node 0: s1=0.368, s2=0.696', 'Node 1: s1=0.368, s2=0.411', 'Node 2: s1=0.368, s2=0.429']...
Round 009: test acc mean=0.0594 ± 0.0122 | min=0.0483 max=0.0970
         : test loss mean=3.6791 ± 0.0169
         : individual accs = ['0.059593', '0.052581', '0.048272', '0.052850', '0.051088', '0.049452', '0.080611', '0.058174', '0.053209', '0.055179', '0.055998', '0.053899', '0.058637', '0.062426', '0.096989', '0.081410', '0.058271', '0.050442', '0.052889', '0.055475']
         : correct/total = [(246, 4128), (221, 4203), (197, 4081), (229, 4333), (209, 4091), (212, 4287), (338, 4193), (253, 4349), (223, 4191), (236, 4277), (232, 4143), (226, 4193), (240, 4093), (262, 4197), (393, 4052), (328, 4029), (242, 4153), (211, 4183), (216, 4084), (229, 4128)]
         : compromised: 0.0594, honest: 0.0593
         : ubar stats = ['Node 0: s1=0.368, s2=0.651', 'Node 1: s1=0.368, s2=0.381', 'Node 2: s1=0.368, s2=0.444']...
Round 010: test acc mean=0.0561 ± 0.0057 | min=0.0457 max=0.0722
         : test loss mean=3.6790 ± 0.0171
         : individual accs = ['0.062984', '0.051868', '0.057584', '0.052850', '0.057932', '0.050618', '0.057477', '0.058174', '0.047960', '0.053776', '0.055998', '0.053899', '0.045688', '0.062426', '0.061204', '0.072226', '0.058271', '0.050920', '0.055583', '0.055475']
         : correct/total = [(260, 4128), (218, 4203), (235, 4081), (229, 4333), (237, 4091), (217, 4287), (241, 4193), (253, 4349), (201, 4191), (230, 4277), (232, 4143), (226, 4193), (187, 4093), (262, 4197), (248, 4052), (291, 4029), (242, 4153), (213, 4183), (227, 4084), (229, 4128)]
         : compromised: 0.0552, honest: 0.0575
         : ubar stats = ['Node 0: s1=0.368, s2=0.686', 'Node 1: s1=0.368, s2=0.357', 'Node 2: s1=0.368, s2=0.486']...

=== FINAL RESULTS ===
Dataset: femnist, Nodes: 20, Graph: fully, Aggregation: ubar
Attack: krum, 60.0% compromised
Final accuracy - Compromised: 0.0552, Honest: 0.0575
Overall test accuracy: mean=0.0561 ± 0.0057

=== UBAR SUMMARY ===
Node 0: stage1=0.368, stage2=0.686, overall=0.253
Node 1: stage1=0.368, stage2=0.357, overall=0.132
Node 2: stage1=0.368, stage2=0.486, overall=0.179
Node 3: stage1=0.368, stage2=0.600, overall=0.221
Node 4: stage1=0.368, stage2=0.471, overall=0.174
Node 5: stage1=0.368, stage2=0.429, overall=0.158
Node 6: stage1=0.368, stage2=0.443, overall=0.163
Node 7: stage1=0.368, stage2=0.557, overall=0.205
Node 8: stage1=0.368, stage2=0.600, overall=0.221
Node 9: stage1=0.368, stage2=0.357, overall=0.132
Node 10: stage1=0.368, stage2=0.314, overall=0.116
Node 11: stage1=0.368, stage2=0.386, overall=0.142
Node 12: stage1=0.368, stage2=0.400, overall=0.147
Node 13: stage1=0.368, stage2=0.629, overall=0.232
Node 14: stage1=0.368, stage2=0.643, overall=0.237
Node 15: stage1=0.368, stage2=0.643, overall=0.237
Node 16: stage1=0.368, stage2=0.400, overall=0.147
Node 17: stage1=0.368, stage2=0.429, overall=0.158
Node 18: stage1=0.368, stage2=0.600, overall=0.221
Node 19: stage1=0.368, stage2=0.386, overall=0.142

=== PARALLEL EXECUTION TIME (realistic for distributed system) ===
  COMMUNICATION (max across nodes):
    - Full model transfer: 0.000s (0.0%)
  COMPUTATION (max across nodes):
    - Distance computation: 0.072s (1.7%)
    - Loss computation: 4.252s (98.1%)
    - Aggregation: 0.009s (0.2%)
  TOTALS:
    - Total computation: 4.333s (100.0%)
    - Total communication: 0.000s (0.0%)
    - Total parallel time: 4.333s

=== PER-NODE AVERAGE TIME ===
  - Distance computation: 0.067s
  - Loss computation: 4.005s
  - Aggregation: 0.007s
  - Model transfer: 0.000s
  - Total per node: 4.079s

=== TOTAL COMPUTATIONAL WORK (sum across all nodes) ===
  - Total distance computation: 1.344s
  - Total loss computation: 80.096s
  - Total aggregation: 0.134s
  - Total model transfer: 0.000s
  - Grand total: 81.575s
  - Mean Stage 1 acceptance rate: 0.368
  - Mean Stage 2 acceptance rate: 0.491
  - Overall acceptance rate: 0.181

UBAR Algorithm Properties:
  - Model dimension: 6,603,710
  - Rho parameter: 0.4
  - Two-stage approach: Distance filtering + loss evaluation
  - Stage 1 selects: 40% of neighbors
  - Stage 2 uses: Training sample loss comparison
  - Theoretical complexity: O(deg(i)×d + deg(i)×inference)
  - Approach: UBAR paper implementation
