Device: cuda
Seed: 987654321
Loading 36 LEAF FEMNIST train files...
LEAF FEMNIST train: 3597 users, 734463 samples
Loading 36 LEAF FEMNIST test files...
LEAF FEMNIST test: 3597 users, 83388 samples
Found 3597 train users, 3597 test users, 3597 common users
User sample counts range: 525 (max) to 17 (min)
Distributed ALL 3597 users across 20 clients
Users per client: 179 (with 17 clients getting +1 user)
Train partition sizes: [36360, 37070, 35957, 38262, 36024, 37732, 36921, 38328, 36867, 37683, 36507, 36915, 36007, 37001, 35681, 35453, 36585, 36801, 35964, 36345]
Test partition sizes: [4128, 4203, 4081, 4333, 4091, 4287, 4193, 4349, 4191, 4277, 4143, 4193, 4093, 4197, 4052, 4029, 4153, 4183, 4084, 4128]
  Client 0: 36360 train samples, 62 unique classes
  Client 1: 37070 train samples, 62 unique classes
  Client 2: 35957 train samples, 62 unique classes
  Client 3: 38262 train samples, 62 unique classes
  Client 4: 36024 train samples, 62 unique classes
  Client 5: 37732 train samples, 62 unique classes
  Client 6: 36921 train samples, 62 unique classes
  Client 7: 38328 train samples, 62 unique classes
  Client 8: 36867 train samples, 62 unique classes
  Client 9: 37683 train samples, 62 unique classes
  Client 10: 36507 train samples, 62 unique classes
  Client 11: 36915 train samples, 62 unique classes
  Client 12: 36007 train samples, 62 unique classes
  Client 13: 37001 train samples, 62 unique classes
  Client 14: 35681 train samples, 62 unique classes
  Client 15: 35453 train samples, 62 unique classes
  Client 16: 36585 train samples, 62 unique classes
  Client 17: 36801 train samples, 62 unique classes
  Client 18: 35964 train samples, 62 unique classes
  Client 19: 36345 train samples, 62 unique classes
Will sample 4500 samples per client per epoch
Graph: erdos, nodes: 20, edges: 126
Degree statistics: avg=12.60, min=8, max=16
Attack: Compromised 8/20 nodes: [1, 5, 11, 12, 13, 14, 17, 18]
Attack type: backdoor, lambda: 1.0
Backdoor target label: 0, trigger size: 4
Model variant: baseline
Model parameters: 6,603,710
Initial test acc across nodes: mean=0.0168 ± 0.0139
Backdoor attack: Created poisoned datasets for 8 compromised nodes
Round 001: test acc mean=0.0160 ± 0.0140 | min=0.0019 max=0.0483
         : test loss mean=10844.2489 ± 6411.3762
         : individual accs = ['0.004360', '0.042589', '0.048272', '0.006462', '0.013933', '0.018428', '0.005724', '0.014716', '0.044619', '0.004442', '0.034033', '0.014548', '0.007818', '0.001906', '0.010612', '0.008687', '0.007224', '0.007172', '0.015181', '0.008479']
         : correct/total = [(18, 4128), (179, 4203), (197, 4081), (28, 4333), (57, 4091), (79, 4287), (24, 4193), (64, 4349), (187, 4191), (19, 4277), (141, 4143), (61, 4193), (32, 4093), (8, 4197), (43, 4052), (35, 4029), (30, 4153), (30, 4183), (62, 4084), (35, 4128)]
         : compromised: 0.0148, honest: 0.0167
Round 002: test acc mean=0.0478 ± 0.0031 | min=0.0383 max=0.0551
         : test loss mean=1185525390.5998 ± 746542978.3435
         : individual accs = ['0.047238', '0.048775', '0.050723', '0.038311', '0.047421', '0.048752', '0.048891', '0.045528', '0.047960', '0.047697', '0.047309', '0.045314', '0.049597', '0.045747', '0.046397', '0.051626', '0.055141', '0.045900', '0.048482', '0.048692']
         : correct/total = [(195, 4128), (205, 4203), (207, 4081), (166, 4333), (194, 4091), (209, 4287), (205, 4193), (198, 4349), (201, 4191), (204, 4277), (196, 4143), (190, 4193), (203, 4093), (192, 4197), (188, 4052), (208, 4029), (229, 4153), (192, 4183), (198, 4084), (201, 4128)]
         : compromised: 0.0474, honest: 0.0480
Round 003: test acc mean=0.0512 ± 0.0040 | min=0.0430 max=0.0582
         : test loss mean=29334124.7826 ± 68906465.9462
         : individual accs = ['0.050145', '0.048775', '0.053418', '0.052850', '0.043021', '0.045253', '0.057000', '0.058174', '0.049630', '0.043488', '0.055998', '0.049606', '0.054239', '0.049083', '0.051826', '0.051626', '0.052011', '0.049486', '0.052889', '0.054506']
         : correct/total = [(207, 4128), (205, 4203), (218, 4081), (229, 4333), (176, 4091), (194, 4287), (239, 4193), (253, 4349), (208, 4191), (186, 4277), (232, 4143), (208, 4193), (222, 4093), (206, 4197), (210, 4052), (208, 4029), (216, 4153), (207, 4183), (216, 4084), (225, 4128)]
         : compromised: 0.0501, honest: 0.0518
Round 004: test acc mean=0.0332 ± 0.0046 | min=0.0246 max=0.0396
         : test loss mean=679.4230 ± 259.6434
         : individual accs = ['0.029070', '0.036878', '0.026464', '0.031156', '0.037644', '0.036856', '0.035535', '0.035640', '0.037700', '0.025251', '0.039585', '0.036728', '0.036404', '0.037408', '0.032330', '0.026061', '0.030340', '0.024623', '0.032321', '0.035853']
         : correct/total = [(120, 4128), (155, 4203), (108, 4081), (135, 4333), (154, 4091), (158, 4287), (149, 4193), (155, 4349), (158, 4191), (108, 4277), (164, 4143), (154, 4193), (149, 4093), (157, 4197), (131, 4052), (105, 4029), (126, 4153), (103, 4183), (132, 4084), (148, 4128)]
         : compromised: 0.0342, honest: 0.0325
Round 005: test acc mean=0.0160 ± 0.0016 | min=0.0138 max=0.0188
         : test loss mean=30.0748 ± 6.9652
         : individual accs = ['0.016473', '0.015703', '0.014702', '0.018232', '0.014422', '0.018428', '0.018841', '0.018395', '0.013839', '0.015665', '0.016896', '0.014071', '0.016125', '0.015249', '0.018263', '0.014892', '0.014688', '0.016734', '0.014691', '0.013808']
         : correct/total = [(68, 4128), (66, 4203), (60, 4081), (79, 4333), (59, 4091), (79, 4287), (79, 4193), (80, 4349), (58, 4191), (67, 4277), (70, 4143), (59, 4193), (66, 4093), (64, 4197), (74, 4052), (60, 4029), (61, 4153), (70, 4183), (60, 4084), (57, 4128)]
         : compromised: 0.0162, honest: 0.0159
Round 006: test acc mean=0.0415 ± 0.0150 | min=0.0147 max=0.0549
         : test loss mean=29.4880 ± 10.9018
         : individual accs = ['0.049661', '0.015703', '0.054889', '0.018232', '0.052066', '0.045953', '0.043883', '0.053116', '0.051062', '0.015665', '0.047550', '0.054376', '0.052040', '0.015249', '0.045656', '0.050881', '0.051047', '0.048291', '0.014691', '0.050145']
         : correct/total = [(205, 4128), (66, 4203), (224, 4081), (79, 4333), (213, 4091), (197, 4287), (184, 4193), (231, 4349), (214, 4191), (67, 4277), (197, 4143), (228, 4193), (213, 4093), (64, 4197), (185, 4052), (205, 4029), (212, 4153), (202, 4183), (60, 4084), (207, 4128)]
         : compromised: 0.0365, honest: 0.0448
Round 007: test acc mean=0.0447 ± 0.0037 | min=0.0365 max=0.0512
         : test loss mean=54.5797 ± 15.3318
         : individual accs = ['0.045785', '0.042589', '0.048763', '0.036464', '0.043266', '0.047352', '0.042213', '0.041619', '0.040802', '0.046528', '0.051171', '0.041736', '0.050818', '0.049559', '0.046644', '0.041698', '0.040693', '0.045900', '0.045788', '0.044331']
         : correct/total = [(189, 4128), (179, 4203), (199, 4081), (158, 4333), (177, 4091), (203, 4287), (177, 4193), (181, 4349), (171, 4191), (199, 4277), (212, 4143), (175, 4193), (208, 4093), (208, 4197), (189, 4052), (168, 4029), (169, 4153), (192, 4183), (187, 4084), (183, 4128)]
         : compromised: 0.0463, honest: 0.0436
Round 008: test acc mean=0.0256 ± 0.0119 | min=0.0157 max=0.0513
         : test loss mean=7.9396 ± 1.4170
         : individual accs = ['0.019622', '0.020700', '0.022298', '0.018925', '0.016133', '0.048519', '0.048414', '0.051276', '0.022668', '0.026420', '0.017861', '0.046745', '0.020034', '0.018346', '0.021718', '0.022338', '0.015892', '0.019842', '0.017630', '0.015746']
         : correct/total = [(81, 4128), (87, 4203), (91, 4081), (82, 4333), (66, 4091), (208, 4287), (203, 4193), (223, 4349), (95, 4191), (113, 4277), (74, 4143), (196, 4193), (82, 4093), (77, 4197), (88, 4052), (90, 4029), (66, 4153), (83, 4183), (72, 4084), (65, 4128)]
         : compromised: 0.0267, honest: 0.0248
Round 009: test acc mean=0.0490 ± 0.0043 | min=0.0367 max=0.0545
         : test loss mean=27.0575 ± 5.7782
         : individual accs = ['0.050145', '0.048775', '0.053418', '0.043157', '0.043021', '0.045253', '0.050799', '0.045068', '0.049630', '0.036708', '0.048033', '0.049606', '0.054239', '0.049083', '0.051826', '0.051626', '0.052011', '0.049486', '0.052889', '0.054506']
         : correct/total = [(207, 4128), (205, 4203), (218, 4081), (187, 4333), (176, 4091), (194, 4287), (213, 4193), (196, 4349), (208, 4191), (157, 4277), (199, 4143), (208, 4193), (222, 4093), (206, 4197), (210, 4052), (208, 4029), (216, 4153), (207, 4183), (216, 4084), (225, 4128)]
         : compromised: 0.0501, honest: 0.0482
Round 010: test acc mean=0.0447 ± 0.0037 | min=0.0365 max=0.0512
         : test loss mean=182.5056 ± 55.0702
         : individual accs = ['0.045785', '0.042589', '0.048763', '0.036464', '0.043266', '0.047352', '0.042213', '0.041619', '0.040802', '0.046528', '0.051171', '0.041736', '0.050818', '0.049559', '0.046644', '0.041698', '0.040693', '0.045900', '0.045788', '0.044331']
         : correct/total = [(189, 4128), (179, 4203), (199, 4081), (158, 4333), (177, 4091), (203, 4287), (177, 4193), (181, 4349), (171, 4191), (199, 4277), (212, 4143), (175, 4193), (208, 4093), (208, 4197), (189, 4052), (168, 4029), (169, 4153), (192, 4183), (187, 4084), (183, 4128)]
         : compromised: 0.0463, honest: 0.0436

=== FINAL RESULTS ===
Dataset: femnist, Nodes: 20, Graph: erdos, Aggregation: d-fedavg
Attack: backdoor, 40.0% compromised
Final accuracy - Compromised: 0.0463, Honest: 0.0436
Overall test accuracy: mean=0.0447 ± 0.0037

=== BACKDOOR ATTACK SUCCESS RATE (ASR) ===
Target label: 0
Trigger size: 4x4
Overall ASR: 0.0000 ± 0.0000
Honest nodes ASR: 0.0000 ± 0.0000
Compromised nodes ASR: 0.0000 ± 0.0000
Note: Higher ASR indicates more successful backdoor attack
