Device: cuda
Seed: 987654321
Loading 36 LEAF FEMNIST train files...
LEAF FEMNIST train: 3597 users, 734463 samples
Loading 36 LEAF FEMNIST test files...
LEAF FEMNIST test: 3597 users, 83388 samples
Found 3597 train users, 3597 test users, 3597 common users
User sample counts range: 525 (max) to 17 (min)
Distributed ALL 3597 users across 20 clients
Users per client: 179 (with 17 clients getting +1 user)
Train partition sizes: [36360, 37070, 35957, 38262, 36024, 37732, 36921, 38328, 36867, 37683, 36507, 36915, 36007, 37001, 35681, 35453, 36585, 36801, 35964, 36345]
Test partition sizes: [4128, 4203, 4081, 4333, 4091, 4287, 4193, 4349, 4191, 4277, 4143, 4193, 4093, 4197, 4052, 4029, 4153, 4183, 4084, 4128]
  Client 0: 36360 train samples, 62 unique classes
  Client 1: 37070 train samples, 62 unique classes
  Client 2: 35957 train samples, 62 unique classes
  Client 3: 38262 train samples, 62 unique classes
  Client 4: 36024 train samples, 62 unique classes
  Client 5: 37732 train samples, 62 unique classes
  Client 6: 36921 train samples, 62 unique classes
  Client 7: 38328 train samples, 62 unique classes
  Client 8: 36867 train samples, 62 unique classes
  Client 9: 37683 train samples, 62 unique classes
  Client 10: 36507 train samples, 62 unique classes
  Client 11: 36915 train samples, 62 unique classes
  Client 12: 36007 train samples, 62 unique classes
  Client 13: 37001 train samples, 62 unique classes
  Client 14: 35681 train samples, 62 unique classes
  Client 15: 35453 train samples, 62 unique classes
  Client 16: 36585 train samples, 62 unique classes
  Client 17: 36801 train samples, 62 unique classes
  Client 18: 35964 train samples, 62 unique classes
  Client 19: 36345 train samples, 62 unique classes
Will sample 4500 samples per client per epoch
Graph: erdos, nodes: 20, edges: 126
Degree statistics: avg=12.60, min=8, max=16
Attack: Compromised 16/20 nodes: [1, 2, 3, 5, 6, 8, 9, 10, 11, 12, 13, 14, 15, 17, 18, 19]
Attack type: gaussian, lambda: 1.0
Model variant: baseline
Model parameters: 6,603,710
BALANCE algorithm:
Balance Config: BALANCEConfig(gamma=2, kappa=1, alpha=0.5, min_neighbors=1)
  - Model dimension: 6,603,710 parameters
  - Complexity: O(N×d) = O(20×6,603,710)
Initial test acc across nodes: mean=0.0168 ± 0.0139
Round 001: test acc mean=0.0549 ± 0.0117 | min=0.0434 max=0.1022
         : test loss mean=4.0231 ± 0.0187
         : individual accs = ['0.059593', '0.051630', '0.102181', '0.043388', '0.057932', '0.050618', '0.057000', '0.058174', '0.053209', '0.047463', '0.050447', '0.049606', '0.054239', '0.046938', '0.048124', '0.050633', '0.058271', '0.050920', '0.057052', '0.050145']
         : correct/total = [(246, 4128), (217, 4203), (417, 4081), (188, 4333), (237, 4091), (217, 4287), (239, 4193), (253, 4349), (223, 4191), (203, 4277), (209, 4143), (208, 4193), (222, 4093), (197, 4197), (195, 4052), (204, 4029), (242, 4153), (213, 4183), (233, 4084), (207, 4128)]
         : compromised: 0.0540, honest: 0.0585
Round 002: test acc mean=0.0540 ± 0.0033 | min=0.0469 max=0.0596
         : test loss mean=3.8350 ± 0.0459
         : individual accs = ['0.059593', '0.051630', '0.057584', '0.052850', '0.057932', '0.050618', '0.057000', '0.058174', '0.053209', '0.053776', '0.055998', '0.053899', '0.054239', '0.046938', '0.050346', '0.056342', '0.054418', '0.050920', '0.055583', '0.048450']
         : correct/total = [(246, 4128), (217, 4203), (235, 4081), (229, 4333), (237, 4091), (217, 4287), (239, 4193), (253, 4349), (223, 4191), (230, 4277), (232, 4143), (226, 4193), (222, 4093), (197, 4197), (204, 4052), (227, 4029), (226, 4153), (213, 4183), (227, 4084), (200, 4128)]
         : compromised: 0.0531, honest: 0.0575
Round 003: test acc mean=0.0556 ± 0.0043 | min=0.0475 max=0.0624
         : test loss mean=3.7024 ± 0.0162
         : individual accs = ['0.059593', '0.050916', '0.057584', '0.048465', '0.057932', '0.050618', '0.057000', '0.051276', '0.054880', '0.047463', '0.055998', '0.061770', '0.058637', '0.062426', '0.061204', '0.056342', '0.058271', '0.050203', '0.055583', '0.055475']
         : correct/total = [(246, 4128), (214, 4203), (235, 4081), (210, 4333), (237, 4091), (217, 4287), (239, 4193), (223, 4349), (230, 4191), (203, 4277), (232, 4143), (259, 4193), (240, 4093), (262, 4197), (248, 4052), (227, 4029), (242, 4153), (210, 4183), (227, 4084), (229, 4128)]
         : compromised: 0.0553, honest: 0.0568
Round 004: test acc mean=0.0579 ± 0.0086 | min=0.0456 max=0.0844
         : test loss mean=3.6836 ± 0.0161
         : individual accs = ['0.059593', '0.052344', '0.057584', '0.052850', '0.057932', '0.050618', '0.057000', '0.058174', '0.053209', '0.084405', '0.045619', '0.053899', '0.076961', '0.062426', '0.061204', '0.056590', '0.058271', '0.050920', '0.052889', '0.055475']
         : correct/total = [(246, 4128), (220, 4203), (235, 4081), (229, 4333), (237, 4091), (217, 4287), (239, 4193), (253, 4349), (223, 4191), (361, 4277), (189, 4143), (226, 4193), (315, 4093), (262, 4197), (248, 4052), (228, 4029), (242, 4153), (213, 4183), (216, 4084), (229, 4128)]
         : compromised: 0.0577, honest: 0.0585
Round 005: test acc mean=0.0586 ± 0.0148 | min=0.0469 max=0.1031
         : test loss mean=3.6806 ± 0.0165
         : individual accs = ['0.097868', '0.052344', '0.057584', '0.048234', '0.059154', '0.050618', '0.057000', '0.047827', '0.051062', '0.053776', '0.055998', '0.068209', '0.103103', '0.046938', '0.051579', '0.054852', '0.058271', '0.051159', '0.055583', '0.050145']
         : correct/total = [(404, 4128), (220, 4203), (235, 4081), (209, 4333), (242, 4091), (217, 4287), (239, 4193), (208, 4349), (214, 4191), (230, 4277), (232, 4143), (286, 4193), (422, 4093), (197, 4197), (209, 4052), (221, 4029), (242, 4153), (214, 4183), (227, 4084), (207, 4128)]
         : compromised: 0.0568, honest: 0.0658
Round 006: test acc mean=0.0542 ± 0.0059 | min=0.0420 max=0.0624
         : test loss mean=3.6795 ± 0.0168
         : individual accs = ['0.044574', '0.052344', '0.057584', '0.058620', '0.057932', '0.043387', '0.057000', '0.047827', '0.053209', '0.053776', '0.041999', '0.061770', '0.058637', '0.062426', '0.061204', '0.051378', '0.058271', '0.050920', '0.055583', '0.055475']
         : correct/total = [(184, 4128), (220, 4203), (235, 4081), (254, 4333), (237, 4091), (186, 4287), (239, 4193), (208, 4349), (223, 4191), (230, 4277), (174, 4143), (259, 4193), (240, 4093), (262, 4197), (248, 4052), (207, 4029), (242, 4153), (213, 4183), (227, 4084), (229, 4128)]
         : compromised: 0.0547, honest: 0.0522
Round 007: test acc mean=0.0558 ± 0.0081 | min=0.0435 max=0.0817
         : test loss mean=3.6793 ± 0.0164
         : individual accs = ['0.059593', '0.052344', '0.057584', '0.052850', '0.047421', '0.050618', '0.048891', '0.058174', '0.053209', '0.043488', '0.055998', '0.054376', '0.058637', '0.081725', '0.051826', '0.056590', '0.055141', '0.050920', '0.071499', '0.055959']
         : correct/total = [(246, 4128), (220, 4203), (235, 4081), (229, 4333), (194, 4091), (217, 4287), (205, 4193), (253, 4349), (223, 4191), (186, 4277), (232, 4143), (228, 4193), (240, 4093), (343, 4197), (210, 4052), (228, 4029), (229, 4153), (213, 4183), (292, 4084), (231, 4128)]
         : compromised: 0.0560, honest: 0.0551
Round 008: test acc mean=0.0565 ± 0.0133 | min=0.0432 max=0.1003
         : test loss mean=3.6793 ± 0.0167
         : individual accs = ['0.051599', '0.053771', '0.050723', '0.043157', '0.051088', '0.100303', '0.049130', '0.051276', '0.065855', '0.053075', '0.085928', '0.052707', '0.053750', '0.047415', '0.048124', '0.056342', '0.055141', '0.050203', '0.060970', '0.048450']
         : correct/total = [(213, 4128), (226, 4203), (207, 4081), (187, 4333), (209, 4091), (430, 4287), (206, 4193), (223, 4349), (276, 4191), (227, 4277), (356, 4143), (221, 4193), (220, 4093), (199, 4197), (195, 4052), (227, 4029), (229, 4153), (210, 4183), (249, 4084), (200, 4128)]
         : compromised: 0.0575, honest: 0.0523
Round 009: test acc mean=0.0572 ± 0.0171 | min=0.0439 max=0.1289
         : test loss mean=3.6774 ± 0.0171
         : individual accs = ['0.054264', '0.050916', '0.128890', '0.052850', '0.052066', '0.051085', '0.043883', '0.043918', '0.057981', '0.047463', '0.056481', '0.053899', '0.058637', '0.063140', '0.051579', '0.056342', '0.057308', '0.050920', '0.056317', '0.055475']
         : correct/total = [(224, 4128), (214, 4203), (526, 4081), (229, 4333), (213, 4091), (219, 4287), (184, 4193), (191, 4349), (243, 4191), (203, 4277), (234, 4143), (226, 4193), (240, 4093), (265, 4197), (209, 4052), (227, 4029), (238, 4153), (213, 4183), (230, 4084), (229, 4128)]
         : compromised: 0.0585, honest: 0.0519
Round 010: test acc mean=0.0642 ± 0.0158 | min=0.0480 max=0.1026
         : test loss mean=3.6765 ± 0.0173
         : individual accs = ['0.070736', '0.052344', '0.057584', '0.053312', '0.057932', '0.051551', '0.049130', '0.102552', '0.047960', '0.053776', '0.055998', '0.076079', '0.091131', '0.062426', '0.061451', '0.094564', '0.058512', '0.051638', '0.055583', '0.079215']
         : correct/total = [(292, 4128), (220, 4203), (235, 4081), (231, 4333), (237, 4091), (221, 4287), (206, 4193), (446, 4349), (201, 4191), (230, 4277), (232, 4143), (319, 4193), (373, 4093), (262, 4197), (249, 4052), (381, 4029), (243, 4153), (216, 4183), (227, 4084), (327, 4128)]
         : compromised: 0.0621, honest: 0.0724

=== FINAL RESULTS ===
Dataset: femnist, Nodes: 20, Graph: erdos, Aggregation: balance
Attack: gaussian, 80.0% compromised
Final accuracy - Compromised: 0.0621, Honest: 0.0724
Overall test accuracy: mean=0.0642 ± 0.0158

=== BALANCE SUMMARY ===
Node 0: acceptance=0.188
Node 1: acceptance=0.364
Node 2: acceptance=0.250
Node 3: acceptance=0.125
Node 4: acceptance=0.273
Node 5: acceptance=0.133
Node 6: acceptance=0.143
Node 7: acceptance=0.143
Node 8: acceptance=0.200
Node 9: acceptance=0.308
Node 10: acceptance=0.222
Node 11: acceptance=0.214
Node 12: acceptance=0.250
Node 13: acceptance=0.231
Node 14: acceptance=0.200
Node 15: acceptance=0.182
Node 16: acceptance=0.154
Node 17: acceptance=0.333
Node 18: acceptance=0.250
Node 19: acceptance=0.188

=== PARALLEL EXECUTION TIME (realistic for distributed system) ===
  COMMUNICATION (max across nodes):
    - Full model transfer: 0.000s (0.0%)
  COMPUTATION (max across nodes):
    - Filtering: 0.074s (84.9%)
    - Aggregation: 0.013s (15.1%)
  TOTALS:
    - Total computation: 0.087s (100.0%)
    - Total communication: 0.000s (0.0%)
    - Total parallel time: 0.087s

=== PER-NODE AVERAGE TIME ===
  - Filtering: 0.047s
  - Aggregation: 0.004s
  - Model transfer: 0.000s
  - Total per node: 0.051s

=== TOTAL COMPUTATIONAL WORK (sum across all nodes) ===
  - Total filtering: 0.934s
  - Total aggregation: 0.079s
  - Total model transfer: 0.000s
  - Grand total: 1.013s
  - Mean acceptance rate: 0.217

BALANCE Algorithm Properties:
  - Model dimension: 6,603,710
  - No compression: Full parameter comparison
  - Theoretical complexity: O(deg(i)×d)
  - Approach: Full parameter filtering + averaging
