Device: cuda
Seed: 987654321
Loading 36 LEAF FEMNIST train files...
LEAF FEMNIST train: 3597 users, 734463 samples
Loading 36 LEAF FEMNIST test files...
LEAF FEMNIST test: 3597 users, 83388 samples
Found 3597 train users, 3597 test users, 3597 common users
User sample counts range: 525 (max) to 17 (min)
Distributed ALL 3597 users across 20 clients
Users per client: 179 (with 17 clients getting +1 user)
Train partition sizes: [36360, 37070, 35957, 38262, 36024, 37732, 36921, 38328, 36867, 37683, 36507, 36915, 36007, 37001, 35681, 35453, 36585, 36801, 35964, 36345]
Test partition sizes: [4128, 4203, 4081, 4333, 4091, 4287, 4193, 4349, 4191, 4277, 4143, 4193, 4093, 4197, 4052, 4029, 4153, 4183, 4084, 4128]
  Client 0: 36360 train samples, 62 unique classes
  Client 1: 37070 train samples, 62 unique classes
  Client 2: 35957 train samples, 62 unique classes
  Client 3: 38262 train samples, 62 unique classes
  Client 4: 36024 train samples, 62 unique classes
  Client 5: 37732 train samples, 62 unique classes
  Client 6: 36921 train samples, 62 unique classes
  Client 7: 38328 train samples, 62 unique classes
  Client 8: 36867 train samples, 62 unique classes
  Client 9: 37683 train samples, 62 unique classes
  Client 10: 36507 train samples, 62 unique classes
  Client 11: 36915 train samples, 62 unique classes
  Client 12: 36007 train samples, 62 unique classes
  Client 13: 37001 train samples, 62 unique classes
  Client 14: 35681 train samples, 62 unique classes
  Client 15: 35453 train samples, 62 unique classes
  Client 16: 36585 train samples, 62 unique classes
  Client 17: 36801 train samples, 62 unique classes
  Client 18: 35964 train samples, 62 unique classes
  Client 19: 36345 train samples, 62 unique classes
Will sample 4500 samples per client per epoch
Graph: erdos, nodes: 20, edges: 48
Degree statistics: avg=4.80, min=2, max=7
Attack: Compromised 16/20 nodes: [1, 2, 3, 5, 6, 8, 9, 10, 11, 12, 13, 14, 15, 17, 18, 19]
Attack type: krum, lambda: 1.0
Model variant: baseline
Model parameters: 6,603,710
BALANCE algorithm:
Balance Config: BALANCEConfig(gamma=2, kappa=1, alpha=0.5, min_neighbors=1)
  - Model dimension: 6,603,710 parameters
  - Complexity: O(N×d) = O(20×6,603,710)
Initial test acc across nodes: mean=0.0168 ± 0.0139
Round 001: test acc mean=0.0470 ± 0.0153 | min=0.0073 max=0.0596
         : test loss mean=4025.8435 ± 8280.1632
         : individual accs = ['0.059593', '0.052344', '0.057584', '0.043157', '0.058910', '0.052484', '0.057000', '0.056105', '0.053209', '0.047463', '0.050447', '0.012879', '0.054239', '0.015487', '0.048124', '0.050633', '0.058271', '0.050920', '0.052889', '0.007267']
         : correct/total = [(246, 4128), (220, 4203), (235, 4081), (187, 4333), (241, 4091), (225, 4287), (239, 4193), (244, 4349), (223, 4191), (203, 4277), (209, 4143), (54, 4193), (222, 4093), (65, 4197), (195, 4052), (204, 4029), (242, 4153), (213, 4183), (216, 4084), (30, 4128)]
         : compromised: 0.0441, honest: 0.0582
Round 002: test acc mean=0.0531 ± 0.0050 | min=0.0434 max=0.0618
         : test loss mean=12054324.2645 ± 24291001.7371
         : individual accs = ['0.044574', '0.051630', '0.055134', '0.043388', '0.057932', '0.057849', '0.044598', '0.058174', '0.053209', '0.050503', '0.060101', '0.061770', '0.054239', '0.049559', '0.051579', '0.056590', '0.049362', '0.050920', '0.055583', '0.054506']
         : correct/total = [(184, 4128), (217, 4203), (225, 4081), (188, 4333), (237, 4091), (248, 4287), (187, 4193), (253, 4349), (223, 4191), (216, 4277), (249, 4143), (259, 4193), (222, 4093), (208, 4197), (209, 4052), (228, 4029), (205, 4153), (213, 4183), (227, 4084), (225, 4128)]
         : compromised: 0.0532, honest: 0.0525
Round 003: test acc mean=0.0564 ± 0.0143 | min=0.0281 max=0.0947
         : test loss mean=409221118.9403 ± 1299244141.9353
         : individual accs = ['0.059593', '0.052344', '0.050723', '0.047773', '0.093376', '0.048052', '0.057000', '0.094734', '0.053209', '0.047697', '0.055274', '0.028142', '0.058637', '0.049559', '0.061204', '0.056342', '0.058271', '0.050920', '0.055583', '0.048692']
         : correct/total = [(246, 4128), (220, 4203), (207, 4081), (207, 4333), (382, 4091), (206, 4287), (239, 4193), (412, 4349), (223, 4191), (204, 4277), (229, 4143), (118, 4193), (240, 4093), (208, 4197), (248, 4052), (227, 4029), (242, 4153), (213, 4183), (227, 4084), (201, 4128)]
         : compromised: 0.0513, honest: 0.0765
Round 004: test acc mean=0.0592 ± 0.0132 | min=0.0443 max=0.0954
         : test loss mean=51308940.4043 ± 114500431.8667
         : individual accs = ['0.059593', '0.052344', '0.057584', '0.044773', '0.082865', '0.095405', '0.057000', '0.081628', '0.053209', '0.053075', '0.069756', '0.045314', '0.058637', '0.045747', '0.061204', '0.056590', '0.058271', '0.050920', '0.055583', '0.044331']
         : correct/total = [(246, 4128), (220, 4203), (235, 4081), (194, 4333), (339, 4091), (409, 4287), (239, 4193), (355, 4349), (223, 4191), (227, 4277), (289, 4143), (190, 4193), (240, 4093), (192, 4197), (248, 4052), (228, 4029), (242, 4153), (213, 4183), (227, 4084), (183, 4128)]
         : compromised: 0.0563, honest: 0.0706
Round 005: test acc mean=0.0527 ± 0.0053 | min=0.0420 max=0.0624
         : test loss mean=13127017601.3983 ± 57087743123.5970
         : individual accs = ['0.059593', '0.052344', '0.057584', '0.052850', '0.045710', '0.043387', '0.057000', '0.047827', '0.051062', '0.053776', '0.041999', '0.054376', '0.058637', '0.062426', '0.051826', '0.051378', '0.058271', '0.050920', '0.055583', '0.048450']
         : correct/total = [(246, 4128), (220, 4203), (235, 4081), (229, 4333), (187, 4091), (186, 4287), (239, 4193), (208, 4349), (214, 4191), (230, 4277), (174, 4143), (228, 4193), (240, 4093), (262, 4197), (210, 4052), (207, 4029), (242, 4153), (213, 4183), (227, 4084), (200, 4128)]
         : compromised: 0.0527, honest: 0.0529
Round 006: test acc mean=0.0547 ± 0.0166 | min=0.0322 max=0.1218
         : test loss mean=3974790279.5504 ± 17324176118.6553
         : individual accs = ['0.051357', '0.052344', '0.121784', '0.048234', '0.051088', '0.043387', '0.051991', '0.051276', '0.049869', '0.043488', '0.050447', '0.053899', '0.058637', '0.062426', '0.061204', '0.051378', '0.052011', '0.050920', '0.055583', '0.032219']
         : correct/total = [(212, 4128), (220, 4203), (497, 4081), (209, 4333), (209, 4091), (186, 4287), (218, 4193), (223, 4349), (209, 4191), (186, 4277), (209, 4143), (226, 4193), (240, 4093), (262, 4197), (248, 4052), (207, 4029), (216, 4153), (213, 4183), (227, 4084), (133, 4128)]
         : compromised: 0.0555, honest: 0.0514
Round 007: test acc mean=0.0586 ± 0.0162 | min=0.0322 max=0.1054
         : test loss mean=2605463910.2348 ± 11356336334.8558
         : individual accs = ['0.081638', '0.048775', '0.057584', '0.052850', '0.047421', '0.050618', '0.105414', '0.045528', '0.053209', '0.083236', '0.055998', '0.049606', '0.058637', '0.062426', '0.052073', '0.056590', '0.079220', '0.050920', '0.048482', '0.032219']
         : correct/total = [(337, 4128), (205, 4203), (235, 4081), (229, 4333), (194, 4091), (217, 4287), (442, 4193), (198, 4349), (223, 4191), (356, 4277), (232, 4143), (208, 4193), (240, 4093), (262, 4197), (211, 4052), (228, 4029), (329, 4153), (213, 4183), (198, 4084), (133, 4128)]
         : compromised: 0.0574, honest: 0.0635
Round 008: test acc mean=0.0547 ± 0.0189 | min=0.0136 max=0.1236
         : test loss mean=385182178.4433 ± 1678895412.5643
         : individual accs = ['0.051599', '0.049013', '0.050723', '0.048234', '0.043021', '0.069279', '0.055807', '0.045068', '0.123598', '0.059387', '0.049722', '0.053899', '0.054728', '0.062426', '0.048124', '0.056342', '0.055141', '0.050442', '0.053134', '0.013566']
         : correct/total = [(213, 4128), (206, 4203), (207, 4081), (209, 4333), (176, 4091), (297, 4287), (234, 4193), (196, 4349), (518, 4191), (254, 4277), (206, 4143), (226, 4193), (224, 4093), (262, 4197), (195, 4052), (227, 4029), (229, 4153), (211, 4183), (217, 4084), (56, 4128)]
         : compromised: 0.0562, honest: 0.0487
Round 009: test acc mean=0.0654 ± 0.0238 | min=0.0136 max=0.1138
         : test loss mean=43.6873 ± 88.2072
         : individual accs = ['0.098110', '0.050916', '0.053908', '0.052850', '0.044977', '0.095171', '0.050799', '0.043918', '0.113815', '0.055880', '0.095824', '0.049606', '0.060347', '0.062426', '0.073297', '0.062298', '0.096797', '0.081042', '0.052400', '0.013566']
         : correct/total = [(405, 4128), (214, 4203), (220, 4081), (229, 4333), (184, 4091), (408, 4287), (213, 4193), (191, 4349), (477, 4191), (239, 4277), (397, 4143), (208, 4193), (247, 4093), (262, 4197), (297, 4052), (251, 4029), (402, 4153), (339, 4183), (214, 4084), (56, 4128)]
         : compromised: 0.0640, honest: 0.0710
Round 010: test acc mean=0.0690 ± 0.0283 | min=0.0093 max=0.1241
         : test loss mean=18.2458 ± 30.3960
         : individual accs = ['0.088663', '0.052819', '0.104141', '0.031156', '0.087509', '0.124096', '0.049130', '0.088526', '0.047960', '0.053776', '0.098721', '0.049606', '0.103103', '0.009292', '0.071076', '0.063043', '0.087407', '0.078652', '0.057297', '0.033430']
         : correct/total = [(366, 4128), (222, 4203), (425, 4081), (135, 4333), (358, 4091), (532, 4287), (206, 4193), (385, 4349), (201, 4191), (230, 4277), (409, 4143), (208, 4193), (422, 4093), (39, 4197), (288, 4052), (254, 4029), (363, 4153), (329, 4183), (234, 4084), (138, 4128)]
         : compromised: 0.0642, honest: 0.0880

=== FINAL RESULTS ===
Dataset: femnist, Nodes: 20, Graph: erdos, Aggregation: balance
Attack: krum, 80.0% compromised
Final accuracy - Compromised: 0.0642, Honest: 0.0880
Overall test accuracy: mean=0.0690 ± 0.0283

=== BALANCE SUMMARY ===
Node 0: acceptance=0.167
Node 1: acceptance=0.250
Node 2: acceptance=0.200
Node 3: acceptance=0.400
Node 4: acceptance=0.250
Node 5: acceptance=0.200
Node 6: acceptance=0.200
Node 7: acceptance=0.200
Node 8: acceptance=0.500
Node 9: acceptance=0.333
Node 10: acceptance=0.250
Node 11: acceptance=0.500
Node 12: acceptance=0.329
Node 13: acceptance=0.500
Node 14: acceptance=0.143
Node 15: acceptance=0.167
Node 16: acceptance=0.200
Node 17: acceptance=0.300
Node 18: acceptance=0.250
Node 19: acceptance=0.500

=== PARALLEL EXECUTION TIME (realistic for distributed system) ===
  COMMUNICATION (max across nodes):
    - Full model transfer: 0.000s (0.0%)
  COMPUTATION (max across nodes):
    - Filtering: 0.034s (75.8%)
    - Aggregation: 0.011s (24.2%)
  TOTALS:
    - Total computation: 0.045s (100.0%)
    - Total communication: 0.000s (0.0%)
    - Total parallel time: 0.045s

=== PER-NODE AVERAGE TIME ===
  - Filtering: 0.026s
  - Aggregation: 0.003s
  - Model transfer: 0.000s
  - Total per node: 0.029s

=== TOTAL COMPUTATIONAL WORK (sum across all nodes) ===
  - Total filtering: 0.513s
  - Total aggregation: 0.069s
  - Total model transfer: 0.000s
  - Grand total: 0.582s
  - Mean acceptance rate: 0.292

BALANCE Algorithm Properties:
  - Model dimension: 6,603,710
  - No compression: Full parameter comparison
  - Theoretical complexity: O(deg(i)×d)
  - Approach: Full parameter filtering + averaging
