Device: cuda
Seed: 987654321
Loading 36 LEAF FEMNIST train files...
LEAF FEMNIST train: 3597 users, 734463 samples
Loading 36 LEAF FEMNIST test files...
LEAF FEMNIST test: 3597 users, 83388 samples
Found 3597 train users, 3597 test users, 3597 common users
User sample counts range: 525 (max) to 17 (min)
Distributed ALL 3597 users across 20 clients
Users per client: 179 (with 17 clients getting +1 user)
Train partition sizes: [36360, 37070, 35957, 38262, 36024, 37732, 36921, 38328, 36867, 37683, 36507, 36915, 36007, 37001, 35681, 35453, 36585, 36801, 35964, 36345]
Test partition sizes: [4128, 4203, 4081, 4333, 4091, 4287, 4193, 4349, 4191, 4277, 4143, 4193, 4093, 4197, 4052, 4029, 4153, 4183, 4084, 4128]
  Client 0: 36360 train samples, 62 unique classes
  Client 1: 37070 train samples, 62 unique classes
  Client 2: 35957 train samples, 62 unique classes
  Client 3: 38262 train samples, 62 unique classes
  Client 4: 36024 train samples, 62 unique classes
  Client 5: 37732 train samples, 62 unique classes
  Client 6: 36921 train samples, 62 unique classes
  Client 7: 38328 train samples, 62 unique classes
  Client 8: 36867 train samples, 62 unique classes
  Client 9: 37683 train samples, 62 unique classes
  Client 10: 36507 train samples, 62 unique classes
  Client 11: 36915 train samples, 62 unique classes
  Client 12: 36007 train samples, 62 unique classes
  Client 13: 37001 train samples, 62 unique classes
  Client 14: 35681 train samples, 62 unique classes
  Client 15: 35453 train samples, 62 unique classes
  Client 16: 36585 train samples, 62 unique classes
  Client 17: 36801 train samples, 62 unique classes
  Client 18: 35964 train samples, 62 unique classes
  Client 19: 36345 train samples, 62 unique classes
Will sample 4500 samples per client per epoch
Graph: ring, nodes: 20, edges: 20
Degree statistics: avg=2.00, min=2, max=2
Attack: Compromised 6/20 nodes: [5, 12, 13, 14, 17, 18]
Attack type: directed_deviation, lambda: 1.0
Model variant: baseline
Model parameters: 6,603,710
Initial test acc across nodes: mean=0.0168 ± 0.0139
Round 001: test acc mean=0.0368 ± 0.0190 | min=0.0035 max=0.0553
         : test loss mean=31843.8048 ± 78039.0357
         : individual accs = ['0.051599', '0.051630', '0.055134', '0.047773', '0.006111', '0.003499', '0.049130', '0.053116', '0.054880', '0.048398', '0.055274', '0.045314', '0.025409', '0.024065', '0.051826', '0.023331', '0.010836', '0.012431', '0.055338', '0.010417']
         : correct/total = [(213, 4128), (217, 4203), (225, 4081), (207, 4333), (25, 4091), (15, 4287), (206, 4193), (231, 4349), (230, 4191), (207, 4277), (229, 4143), (190, 4193), (104, 4093), (101, 4197), (210, 4052), (94, 4029), (45, 4153), (52, 4183), (226, 4084), (43, 4128)]
         : compromised: 0.0288, honest: 0.0402
Round 002: test acc mean=0.0360 ± 0.0210 | min=0.0039 max=0.0578
         : test loss mean=198667990.0112 ± 340738270.2015
         : individual accs = ['0.050145', '0.046158', '0.050723', '0.052850', '0.004400', '0.057849', '0.005485', '0.043918', '0.051062', '0.055179', '0.047550', '0.004293', '0.003909', '0.049083', '0.045656', '0.053860', '0.044546', '0.045900', '0.004407', '0.003876']
         : correct/total = [(207, 4128), (194, 4203), (207, 4081), (229, 4333), (18, 4091), (248, 4287), (23, 4193), (191, 4349), (214, 4191), (236, 4277), (197, 4143), (18, 4193), (16, 4093), (206, 4197), (185, 4052), (217, 4029), (185, 4153), (192, 4183), (18, 4084), (16, 4128)]
         : compromised: 0.0345, honest: 0.0367
Round 003: test acc mean=0.0473 ± 0.0074 | min=0.0281 max=0.0657
         : test loss mean=795614138.9836 ± 2375353433.9499
         : individual accs = ['0.049661', '0.051154', '0.065670', '0.048465', '0.052066', '0.048052', '0.050799', '0.051276', '0.051539', '0.044891', '0.051171', '0.028142', '0.033716', '0.046938', '0.046644', '0.041698', '0.040693', '0.045900', '0.048482', '0.048692']
         : correct/total = [(205, 4128), (215, 4203), (268, 4081), (210, 4333), (213, 4091), (206, 4287), (213, 4193), (223, 4349), (216, 4191), (192, 4277), (212, 4143), (118, 4193), (138, 4093), (197, 4197), (189, 4052), (168, 4029), (169, 4153), (192, 4183), (198, 4084), (201, 4128)]
         : compromised: 0.0450, honest: 0.0483
Round 004: test acc mean=0.0456 ± 0.0079 | min=0.0281 max=0.0624
         : test loss mean=1535729270.5227 ± 4509984938.0415
         : individual accs = ['0.050145', '0.048775', '0.050723', '0.043157', '0.047421', '0.048052', '0.050799', '0.041389', '0.049630', '0.046528', '0.036688', '0.028142', '0.033716', '0.062426', '0.051579', '0.032266', '0.040212', '0.053311', '0.048482', '0.048692']
         : correct/total = [(207, 4128), (205, 4203), (207, 4081), (187, 4333), (194, 4091), (206, 4287), (213, 4193), (180, 4349), (208, 4191), (199, 4277), (152, 4143), (118, 4193), (138, 4093), (262, 4197), (209, 4052), (130, 4029), (167, 4153), (223, 4183), (198, 4084), (201, 4128)]
         : compromised: 0.0496, honest: 0.0439
Round 005: test acc mean=0.0441 ± 0.0089 | min=0.0176 max=0.0539
         : test loss mean=29475090875816244.0000 ± 128446764007333792.0000
         : individual accs = ['0.051599', '0.049726', '0.045087', '0.043388', '0.051088', '0.052484', '0.044598', '0.049207', '0.034359', '0.043488', '0.045619', '0.028142', '0.033716', '0.017632', '0.046397', '0.053860', '0.044546', '0.045900', '0.050196', '0.050145']
         : correct/total = [(213, 4128), (209, 4203), (184, 4081), (188, 4333), (209, 4091), (225, 4287), (187, 4193), (214, 4349), (144, 4191), (186, 4277), (189, 4143), (118, 4193), (138, 4093), (74, 4197), (188, 4052), (217, 4029), (185, 4153), (192, 4183), (205, 4084), (207, 4128)]
         : compromised: 0.0411, honest: 0.0453
Round 006: test acc mean=0.0433 ± 0.0138 | min=0.0137 max=0.0596
         : test loss mean=48387494334.7893 ± 210915490861.3521
         : individual accs = ['0.059593', '0.051630', '0.045087', '0.052850', '0.051088', '0.045953', '0.042213', '0.045068', '0.051062', '0.048398', '0.051653', '0.046745', '0.013682', '0.017632', '0.052073', '0.015637', '0.020708', '0.053311', '0.052155', '0.050388']
         : correct/total = [(246, 4128), (217, 4203), (184, 4081), (229, 4333), (209, 4091), (197, 4287), (177, 4193), (196, 4349), (214, 4191), (207, 4277), (214, 4143), (196, 4193), (56, 4093), (74, 4197), (211, 4052), (63, 4029), (86, 4153), (223, 4183), (213, 4084), (208, 4128)]
         : compromised: 0.0391, honest: 0.0452
Round 007: test acc mean=0.0407 ± 0.0143 | min=0.0153 max=0.0586
         : test loss mean=132828835582.3338 ± 578984159104.9532
         : individual accs = ['0.050145', '0.047109', '0.055134', '0.043388', '0.051088', '0.047352', '0.043883', '0.049207', '0.040802', '0.044891', '0.045619', '0.049606', '0.058637', '0.017632', '0.015301', '0.016629', '0.019745', '0.015778', '0.052155', '0.050388']
         : correct/total = [(207, 4128), (198, 4203), (225, 4081), (188, 4333), (209, 4091), (203, 4287), (184, 4193), (214, 4349), (171, 4191), (192, 4277), (189, 4143), (208, 4193), (240, 4093), (74, 4197), (62, 4052), (67, 4029), (82, 4153), (66, 4183), (213, 4084), (208, 4128)]
         : compromised: 0.0345, honest: 0.0434
Round 008: test acc mean=0.0426 ± 0.0147 | min=0.0156 max=0.0586
         : test loss mean=197139.1519 ± 504867.8680
         : individual accs = ['0.047238', '0.051630', '0.055134', '0.047773', '0.051088', '0.045953', '0.043883', '0.058174', '0.053209', '0.050503', '0.041999', '0.053899', '0.058637', '0.017632', '0.019743', '0.015637', '0.020708', '0.017213', '0.052155', '0.050388']
         : correct/total = [(195, 4128), (217, 4203), (225, 4081), (207, 4333), (209, 4091), (197, 4287), (184, 4193), (253, 4349), (223, 4191), (216, 4277), (174, 4143), (226, 4193), (240, 4093), (74, 4197), (80, 4052), (63, 4029), (86, 4153), (72, 4183), (213, 4084), (208, 4128)]
         : compromised: 0.0352, honest: 0.0458
Round 009: test acc mean=0.0499 ± 0.0081 | min=0.0176 max=0.0586
         : test loss mean=20762166343.6576 ± 90499858877.6367
         : individual accs = ['0.047238', '0.048775', '0.055134', '0.052850', '0.051088', '0.045953', '0.043883', '0.049207', '0.054880', '0.050503', '0.051171', '0.054376', '0.058637', '0.017632', '0.051579', '0.054852', '0.054418', '0.053311', '0.052155', '0.050388']
         : correct/total = [(195, 4128), (205, 4203), (225, 4081), (229, 4333), (209, 4091), (197, 4287), (184, 4193), (214, 4349), (230, 4191), (216, 4277), (212, 4143), (228, 4193), (240, 4093), (74, 4197), (209, 4052), (221, 4029), (226, 4153), (223, 4183), (213, 4084), (208, 4128)]
         : compromised: 0.0465, honest: 0.0513
Round 010: test acc mean=0.0448 ± 0.0120 | min=0.0214 max=0.0582
         : test loss mean=26645.0462 ± 78069.4306
         : individual accs = ['0.047238', '0.048775', '0.054889', '0.046619', '0.051088', '0.045953', '0.043883', '0.058174', '0.054880', '0.050503', '0.055998', '0.041736', '0.048620', '0.055278', '0.023198', '0.022834', '0.021430', '0.021516', '0.052155', '0.050388']
         : correct/total = [(195, 4128), (205, 4203), (224, 4081), (202, 4333), (209, 4091), (197, 4287), (184, 4193), (253, 4349), (230, 4191), (216, 4277), (232, 4143), (175, 4193), (199, 4093), (232, 4197), (94, 4052), (92, 4029), (89, 4153), (90, 4183), (213, 4084), (208, 4128)]
         : compromised: 0.0411, honest: 0.0463

=== FINAL RESULTS ===
Dataset: femnist, Nodes: 20, Graph: ring, Aggregation: d-fedavg
Attack: directed_deviation, 30.0% compromised
Final accuracy - Compromised: 0.0411, Honest: 0.0463
Overall test accuracy: mean=0.0448 ± 0.0120
