Device: cuda
Seed: 987654321
Loading 36 LEAF FEMNIST train files...
LEAF FEMNIST train: 3597 users, 734463 samples
Loading 36 LEAF FEMNIST test files...
LEAF FEMNIST test: 3597 users, 83388 samples
Found 3597 train users, 3597 test users, 3597 common users
User sample counts range: 525 (max) to 17 (min)
Distributed ALL 3597 users across 20 clients
Users per client: 179 (with 17 clients getting +1 user)
Train partition sizes: [36360, 37070, 35957, 38262, 36024, 37732, 36921, 38328, 36867, 37683, 36507, 36915, 36007, 37001, 35681, 35453, 36585, 36801, 35964, 36345]
Test partition sizes: [4128, 4203, 4081, 4333, 4091, 4287, 4193, 4349, 4191, 4277, 4143, 4193, 4093, 4197, 4052, 4029, 4153, 4183, 4084, 4128]
  Client 0: 36360 train samples, 62 unique classes
  Client 1: 37070 train samples, 62 unique classes
  Client 2: 35957 train samples, 62 unique classes
  Client 3: 38262 train samples, 62 unique classes
  Client 4: 36024 train samples, 62 unique classes
  Client 5: 37732 train samples, 62 unique classes
  Client 6: 36921 train samples, 62 unique classes
  Client 7: 38328 train samples, 62 unique classes
  Client 8: 36867 train samples, 62 unique classes
  Client 9: 37683 train samples, 62 unique classes
  Client 10: 36507 train samples, 62 unique classes
  Client 11: 36915 train samples, 62 unique classes
  Client 12: 36007 train samples, 62 unique classes
  Client 13: 37001 train samples, 62 unique classes
  Client 14: 35681 train samples, 62 unique classes
  Client 15: 35453 train samples, 62 unique classes
  Client 16: 36585 train samples, 62 unique classes
  Client 17: 36801 train samples, 62 unique classes
  Client 18: 35964 train samples, 62 unique classes
  Client 19: 36345 train samples, 62 unique classes
Will sample 4500 samples per client per epoch
Graph: erdos, nodes: 20, edges: 99
Degree statistics: avg=9.90, min=7, max=14
Attack: Compromised 16/20 nodes: [1, 2, 3, 5, 6, 8, 9, 10, 11, 12, 13, 14, 15, 17, 18, 19]
Attack type: backdoor, lambda: 1.0
Backdoor target label: 0, trigger size: 4
Model variant: baseline
Model parameters: 6,603,710
Initial test acc across nodes: mean=0.0168 ± 0.0139
Backdoor attack: Created poisoned datasets for 16 compromised nodes
Round 001: test acc mean=0.0155 ± 0.0129 | min=0.0028 max=0.0489
         : test loss mean=129151.5727 ± 71569.3911
         : individual accs = ['0.009205', '0.004283', '0.004901', '0.019386', '0.019066', '0.002799', '0.048891', '0.017245', '0.010499', '0.015665', '0.006758', '0.005724', '0.041534', '0.011437', '0.017029', '0.040457', '0.013725', '0.003825', '0.006611', '0.010659']
         : correct/total = [(38, 4128), (18, 4203), (20, 4081), (84, 4333), (78, 4091), (12, 4287), (205, 4193), (75, 4349), (44, 4191), (67, 4277), (28, 4143), (24, 4193), (170, 4093), (48, 4197), (69, 4052), (163, 4029), (57, 4153), (16, 4183), (27, 4084), (44, 4128)]
         : compromised: 0.0157, honest: 0.0148
Round 002: test acc mean=0.0495 ± 0.0079 | min=0.0323 max=0.0624
         : test loss mean=nan ± nan
         : individual accs = ['0.048934', '0.051630', '0.056114', '0.047773', '0.057932', '0.052484', '0.049130', '0.058174', '0.047960', '0.053075', '0.045619', '0.053899', '0.033716', '0.062426', '0.037759', '0.032266', '0.040212', '0.050203', '0.055583', '0.054506']
         : correct/total = [(202, 4128), (217, 4203), (229, 4081), (207, 4333), (237, 4091), (225, 4287), (206, 4193), (253, 4349), (201, 4191), (227, 4277), (189, 4143), (226, 4193), (138, 4093), (262, 4197), (153, 4052), (130, 4029), (167, 4153), (210, 4183), (227, 4084), (225, 4128)]
         : compromised: 0.0490, honest: 0.0513
Round 003: test acc mean=0.0440 ± 0.0099 | min=0.0259 max=0.0553
         : test loss mean=nan ± nan
         : individual accs = ['0.048934', '0.032834', '0.054889', '0.046619', '0.052066', '0.045953', '0.035535', '0.053116', '0.037700', '0.033668', '0.047550', '0.054376', '0.026142', '0.055278', '0.025913', '0.028295', '0.047195', '0.048291', '0.050196', '0.054506']
         : correct/total = [(202, 4128), (138, 4203), (224, 4081), (202, 4333), (213, 4091), (197, 4287), (149, 4193), (231, 4349), (158, 4191), (144, 4277), (197, 4143), (228, 4193), (107, 4093), (232, 4197), (105, 4052), (114, 4029), (196, 4153), (202, 4183), (205, 4084), (225, 4128)]
         : compromised: 0.0424, honest: 0.0503
Round 004: test acc mean=0.0336 ± 0.0080 | min=0.0259 max=0.0545
         : test loss mean=nan ± nan
         : individual accs = ['0.027132', '0.032834', '0.026954', '0.033003', '0.029333', '0.034756', '0.044598', '0.031272', '0.042233', '0.033668', '0.032585', '0.030766', '0.026142', '0.028354', '0.025913', '0.028295', '0.051288', '0.028927', '0.029383', '0.054506']
         : correct/total = [(112, 4128), (138, 4203), (110, 4081), (143, 4333), (120, 4091), (149, 4287), (187, 4193), (136, 4349), (177, 4191), (144, 4277), (135, 4143), (129, 4193), (107, 4093), (119, 4197), (105, 4052), (114, 4029), (213, 4153), (121, 4183), (120, 4084), (225, 4128)]
         : compromised: 0.0333, honest: 0.0348
Round 005: test acc mean=0.0312 ± 0.0059 | min=0.0259 max=0.0545
         : test loss mean=nan ± nan
         : individual accs = ['0.027132', '0.032834', '0.026954', '0.033003', '0.029333', '0.034756', '0.028619', '0.031272', '0.031496', '0.033668', '0.032585', '0.030766', '0.026142', '0.028354', '0.025913', '0.028295', '0.030821', '0.028927', '0.029383', '0.054506']
         : correct/total = [(112, 4128), (138, 4203), (110, 4081), (143, 4333), (120, 4091), (149, 4287), (120, 4193), (136, 4349), (132, 4191), (144, 4277), (135, 4143), (129, 4193), (107, 4093), (119, 4197), (105, 4052), (114, 4029), (128, 4153), (121, 4183), (120, 4084), (225, 4128)]
         : compromised: 0.0316, honest: 0.0296
Round 006: test acc mean=0.0321 ± 0.0071 | min=0.0259 max=0.0545
         : test loss mean=nan ± nan
         : individual accs = ['0.027132', '0.049726', '0.026954', '0.033003', '0.029333', '0.034756', '0.028619', '0.031272', '0.031496', '0.033668', '0.032585', '0.030766', '0.026142', '0.028354', '0.025913', '0.028295', '0.030821', '0.028927', '0.029383', '0.054506']
         : correct/total = [(112, 4128), (209, 4203), (110, 4081), (143, 4333), (120, 4091), (149, 4287), (120, 4193), (136, 4349), (132, 4191), (144, 4277), (135, 4143), (129, 4193), (107, 4093), (119, 4197), (105, 4052), (114, 4029), (128, 4153), (121, 4183), (120, 4084), (225, 4128)]
         : compromised: 0.0327, honest: 0.0296
Round 007: test acc mean=0.0312 ± 0.0059 | min=0.0259 max=0.0545
         : test loss mean=nan ± nan
         : individual accs = ['0.027132', '0.032834', '0.026954', '0.033003', '0.029333', '0.034756', '0.028619', '0.031272', '0.031496', '0.033668', '0.032585', '0.030766', '0.026142', '0.028354', '0.025913', '0.028295', '0.030821', '0.028927', '0.029383', '0.054506']
         : correct/total = [(112, 4128), (138, 4203), (110, 4081), (143, 4333), (120, 4091), (149, 4287), (120, 4193), (136, 4349), (132, 4191), (144, 4277), (135, 4143), (129, 4193), (107, 4093), (119, 4197), (105, 4052), (114, 4029), (128, 4153), (121, 4183), (120, 4084), (225, 4128)]
         : compromised: 0.0316, honest: 0.0296
Round 008: test acc mean=0.0312 ± 0.0059 | min=0.0259 max=0.0545
         : test loss mean=nan ± nan
         : individual accs = ['0.027132', '0.032834', '0.026954', '0.033003', '0.029333', '0.034756', '0.028619', '0.031272', '0.031496', '0.033668', '0.032585', '0.030766', '0.026142', '0.028354', '0.025913', '0.028295', '0.030821', '0.028927', '0.029383', '0.054506']
         : correct/total = [(112, 4128), (138, 4203), (110, 4081), (143, 4333), (120, 4091), (149, 4287), (120, 4193), (136, 4349), (132, 4191), (144, 4277), (135, 4143), (129, 4193), (107, 4093), (119, 4197), (105, 4052), (114, 4029), (128, 4153), (121, 4183), (120, 4084), (225, 4128)]
         : compromised: 0.0316, honest: 0.0296
Round 009: test acc mean=0.0312 ± 0.0059 | min=0.0259 max=0.0545
         : test loss mean=nan ± nan
         : individual accs = ['0.027132', '0.032834', '0.026954', '0.033003', '0.029333', '0.034756', '0.028619', '0.031272', '0.031496', '0.033668', '0.032585', '0.030766', '0.026142', '0.028354', '0.025913', '0.028295', '0.030821', '0.028927', '0.029383', '0.054506']
         : correct/total = [(112, 4128), (138, 4203), (110, 4081), (143, 4333), (120, 4091), (149, 4287), (120, 4193), (136, 4349), (132, 4191), (144, 4277), (135, 4143), (129, 4193), (107, 4093), (119, 4197), (105, 4052), (114, 4029), (128, 4153), (121, 4183), (120, 4084), (225, 4128)]
         : compromised: 0.0316, honest: 0.0296
Round 010: test acc mean=0.0312 ± 0.0059 | min=0.0259 max=0.0545
         : test loss mean=nan ± nan
         : individual accs = ['0.027132', '0.032834', '0.026954', '0.033003', '0.029333', '0.034756', '0.028619', '0.031272', '0.031496', '0.033668', '0.032585', '0.030766', '0.026142', '0.028354', '0.025913', '0.028295', '0.030821', '0.028927', '0.029383', '0.054506']
         : correct/total = [(112, 4128), (138, 4203), (110, 4081), (143, 4333), (120, 4091), (149, 4287), (120, 4193), (136, 4349), (132, 4191), (144, 4277), (135, 4143), (129, 4193), (107, 4093), (119, 4197), (105, 4052), (114, 4029), (128, 4153), (121, 4183), (120, 4084), (225, 4128)]
         : compromised: 0.0316, honest: 0.0296

=== FINAL RESULTS ===
Dataset: femnist, Nodes: 20, Graph: erdos, Aggregation: krum
Attack: backdoor, 80.0% compromised
Final accuracy - Compromised: 0.0316, Honest: 0.0296
Overall test accuracy: mean=0.0312 ± 0.0059

=== BACKDOOR ATTACK SUCCESS RATE (ASR) ===
Target label: 0
Trigger size: 4x4
Overall ASR: 0.0500 ± 0.2179
Honest nodes ASR: 0.0000 ± 0.0000
Compromised nodes ASR: 0.0625 ± 0.2421
Note: Higher ASR indicates more successful backdoor attack
