Device: cuda
Seed: 987654321
Loading 36 LEAF FEMNIST train files...
LEAF FEMNIST train: 3597 users, 734463 samples
Loading 36 LEAF FEMNIST test files...
LEAF FEMNIST test: 3597 users, 83388 samples
Found 3597 train users, 3597 test users, 3597 common users
User sample counts range: 525 (max) to 17 (min)
Distributed ALL 3597 users across 20 clients
Users per client: 179 (with 17 clients getting +1 user)
Train partition sizes: [36360, 37070, 35957, 38262, 36024, 37732, 36921, 38328, 36867, 37683, 36507, 36915, 36007, 37001, 35681, 35453, 36585, 36801, 35964, 36345]
Test partition sizes: [4128, 4203, 4081, 4333, 4091, 4287, 4193, 4349, 4191, 4277, 4143, 4193, 4093, 4197, 4052, 4029, 4153, 4183, 4084, 4128]
  Client 0: 36360 train samples, 62 unique classes
  Client 1: 37070 train samples, 62 unique classes
  Client 2: 35957 train samples, 62 unique classes
  Client 3: 38262 train samples, 62 unique classes
  Client 4: 36024 train samples, 62 unique classes
  Client 5: 37732 train samples, 62 unique classes
  Client 6: 36921 train samples, 62 unique classes
  Client 7: 38328 train samples, 62 unique classes
  Client 8: 36867 train samples, 62 unique classes
  Client 9: 37683 train samples, 62 unique classes
  Client 10: 36507 train samples, 62 unique classes
  Client 11: 36915 train samples, 62 unique classes
  Client 12: 36007 train samples, 62 unique classes
  Client 13: 37001 train samples, 62 unique classes
  Client 14: 35681 train samples, 62 unique classes
  Client 15: 35453 train samples, 62 unique classes
  Client 16: 36585 train samples, 62 unique classes
  Client 17: 36801 train samples, 62 unique classes
  Client 18: 35964 train samples, 62 unique classes
  Client 19: 36345 train samples, 62 unique classes
Will sample 4500 samples per client per epoch
Graph: ring, nodes: 20, edges: 20
Degree statistics: avg=2.00, min=2, max=2
Attack: Compromised 12/20 nodes: [1, 2, 3, 5, 8, 11, 12, 13, 14, 15, 17, 18]
Attack type: backdoor, lambda: 1.0
Backdoor target label: 0, trigger size: 4
Model variant: baseline
Model parameters: 6,603,710
Initial test acc across nodes: mean=0.0168 ± 0.0139
Backdoor attack: Created poisoned datasets for 12 compromised nodes
Round 001: test acc mean=0.0221 ± 0.0167 | min=0.0033 max=0.0579
         : test loss mean=107542.8092 ± 165321.4025
         : individual accs = ['0.016715', '0.003331', '0.045087', '0.024694', '0.057932', '0.033123', '0.046506', '0.013796', '0.035075', '0.020809', '0.006034', '0.004054', '0.033716', '0.045747', '0.016288', '0.006453', '0.003853', '0.006933', '0.006611', '0.014777']
         : correct/total = [(69, 4128), (14, 4203), (184, 4081), (107, 4333), (237, 4091), (142, 4287), (195, 4193), (60, 4349), (147, 4191), (89, 4277), (25, 4143), (17, 4193), (138, 4093), (192, 4197), (66, 4052), (26, 4029), (16, 4153), (29, 4183), (27, 4084), (61, 4128)]
         : compromised: 0.0218, honest: 0.0226
Round 002: test acc mean=0.0380 ± 0.0190 | min=0.0014 max=0.0578
         : test loss mean=21659294143.9653 ± 48400399409.4905
         : individual accs = ['0.050145', '0.048775', '0.013722', '0.047773', '0.044977', '0.057849', '0.050799', '0.045068', '0.047960', '0.002104', '0.001448', '0.049606', '0.013682', '0.013105', '0.013574', '0.051378', '0.049362', '0.051159', '0.052889', '0.054506']
         : correct/total = [(207, 4128), (205, 4203), (56, 4081), (207, 4333), (184, 4091), (248, 4287), (213, 4193), (196, 4349), (201, 4191), (9, 4277), (6, 4143), (208, 4193), (56, 4093), (55, 4197), (55, 4052), (207, 4029), (205, 4153), (214, 4183), (216, 4084), (225, 4128)]
         : compromised: 0.0385, honest: 0.0373
Round 003: test acc mean=0.0421 ± 0.0143 | min=0.0035 max=0.0542
         : test loss mean=58322234957682.4219 ± 174961466935704.8125
         : individual accs = ['0.044574', '0.046158', '0.053418', '0.044773', '0.047421', '0.048752', '0.050799', '0.045068', '0.049630', '0.003507', '0.004103', '0.049606', '0.054239', '0.049083', '0.051826', '0.027054', '0.032266', '0.040163', '0.048482', '0.050872']
         : correct/total = [(184, 4128), (194, 4203), (218, 4081), (194, 4333), (194, 4091), (209, 4287), (213, 4193), (196, 4349), (208, 4191), (15, 4277), (17, 4143), (208, 4193), (222, 4093), (206, 4197), (210, 4052), (109, 4029), (134, 4153), (168, 4183), (198, 4084), (210, 4128)]
         : compromised: 0.0469, honest: 0.0348
Round 004: test acc mean=0.0500 ± 0.0048 | min=0.0416 max=0.0618
         : test loss mean=138267452790.6940 ± 316171558124.4464
         : individual accs = ['0.047238', '0.048775', '0.053418', '0.048234', '0.045710', '0.048752', '0.042213', '0.041619', '0.044619', '0.047463', '0.055274', '0.061770', '0.054239', '0.049083', '0.051826', '0.054852', '0.054418', '0.053311', '0.048482', '0.048692']
         : correct/total = [(195, 4128), (205, 4203), (218, 4081), (209, 4333), (187, 4091), (209, 4287), (177, 4193), (181, 4349), (187, 4191), (203, 4277), (229, 4143), (259, 4193), (222, 4093), (206, 4197), (210, 4052), (221, 4029), (226, 4153), (223, 4183), (198, 4084), (201, 4128)]
         : compromised: 0.0514, honest: 0.0478
Round 005: test acc mean=0.0494 ± 0.0044 | min=0.0416 max=0.0578
         : test loss mean=10021074359.6454 ± 35655800760.0975
         : individual accs = ['0.047238', '0.048775', '0.053418', '0.047773', '0.044977', '0.057849', '0.042213', '0.041619', '0.043188', '0.047229', '0.051653', '0.046745', '0.054239', '0.049083', '0.051826', '0.054852', '0.054418', '0.053311', '0.048482', '0.048692']
         : correct/total = [(195, 4128), (205, 4203), (218, 4081), (207, 4333), (184, 4091), (248, 4287), (177, 4193), (181, 4349), (181, 4191), (202, 4277), (214, 4143), (196, 4193), (222, 4093), (206, 4197), (210, 4052), (221, 4029), (226, 4153), (223, 4183), (198, 4084), (201, 4128)]
         : compromised: 0.0508, honest: 0.0473
Round 006: test acc mean=0.0495 ± 0.0050 | min=0.0344 max=0.0549
         : test loss mean=7297779222.2306 ± 17869361729.3532
         : individual accs = ['0.047238', '0.051630', '0.053418', '0.046619', '0.052066', '0.045953', '0.043883', '0.053116', '0.034359', '0.050503', '0.041999', '0.049606', '0.054239', '0.049083', '0.051826', '0.054852', '0.054418', '0.053311', '0.052889', '0.048692']
         : correct/total = [(195, 4128), (217, 4203), (218, 4081), (202, 4333), (213, 4091), (197, 4287), (184, 4193), (231, 4349), (144, 4191), (216, 4277), (174, 4143), (208, 4193), (222, 4093), (206, 4197), (210, 4052), (221, 4029), (226, 4153), (223, 4183), (216, 4084), (201, 4128)]
         : compromised: 0.0498, honest: 0.0490
Round 007: test acc mean=0.0482 ± 0.0059 | min=0.0344 max=0.0549
         : test loss mean=2579013403.4578 ± 4261493168.8072
         : individual accs = ['0.048934', '0.050202', '0.053418', '0.046619', '0.052066', '0.045953', '0.043883', '0.053116', '0.034359', '0.039280', '0.036688', '0.046745', '0.054239', '0.049083', '0.051826', '0.054852', '0.054418', '0.053311', '0.050196', '0.043847']
         : correct/total = [(202, 4128), (211, 4203), (218, 4081), (202, 4333), (213, 4091), (197, 4287), (184, 4193), (231, 4349), (144, 4191), (168, 4277), (152, 4143), (196, 4193), (222, 4093), (206, 4197), (210, 4052), (221, 4029), (226, 4153), (223, 4183), (205, 4084), (181, 4128)]
         : compromised: 0.0492, honest: 0.0465
Round 008: test acc mean=0.0473 ± 0.0073 | min=0.0281 max=0.0549
         : test loss mean=19571728799.2830 ± 40978812041.6818
         : individual accs = ['0.048934', '0.050202', '0.053418', '0.046619', '0.052066', '0.045953', '0.046745', '0.047827', '0.034359', '0.039280', '0.036688', '0.028142', '0.054239', '0.049083', '0.051826', '0.054852', '0.054418', '0.053311', '0.054358', '0.043847']
         : correct/total = [(202, 4128), (211, 4203), (218, 4081), (202, 4333), (213, 4091), (197, 4287), (196, 4193), (208, 4349), (144, 4191), (168, 4277), (152, 4143), (118, 4193), (222, 4093), (206, 4197), (210, 4052), (221, 4029), (226, 4153), (223, 4183), (222, 4084), (181, 4128)]
         : compromised: 0.0480, honest: 0.0462
Round 009: test acc mean=0.0502 ± 0.0041 | min=0.0435 max=0.0596
         : test loss mean=6535778027975934476288.0000 ± 19616898560315929657344.0000
         : individual accs = ['0.059593', '0.047823', '0.053418', '0.047773', '0.044977', '0.046886', '0.046745', '0.047827', '0.049630', '0.043488', '0.048033', '0.049606', '0.054239', '0.049083', '0.051826', '0.054852', '0.054418', '0.053311', '0.045788', '0.055475']
         : correct/total = [(246, 4128), (201, 4203), (218, 4081), (207, 4333), (184, 4091), (201, 4287), (196, 4193), (208, 4349), (208, 4191), (186, 4277), (199, 4143), (208, 4193), (222, 4093), (206, 4197), (210, 4052), (221, 4029), (226, 4153), (223, 4183), (187, 4084), (229, 4128)]
         : compromised: 0.0504, honest: 0.0501
Round 010: test acc mean=0.0490 ± 0.0050 | min=0.0426 max=0.0582
         : test loss mean=nan ± nan
         : individual accs = ['0.045785', '0.042589', '0.053418', '0.043157', '0.043021', '0.045253', '0.057000', '0.058174', '0.043188', '0.047697', '0.047309', '0.045314', '0.054239', '0.049083', '0.051826', '0.054852', '0.054418', '0.053311', '0.045788', '0.044331']
         : correct/total = [(189, 4128), (179, 4203), (218, 4081), (187, 4333), (176, 4091), (194, 4287), (239, 4193), (253, 4349), (181, 4191), (204, 4277), (196, 4143), (190, 4193), (222, 4093), (206, 4197), (210, 4052), (221, 4029), (226, 4153), (223, 4183), (187, 4084), (183, 4128)]
         : compromised: 0.0485, honest: 0.0497

=== FINAL RESULTS ===
Dataset: femnist, Nodes: 20, Graph: ring, Aggregation: d-fedavg
Attack: backdoor, 60.0% compromised
Final accuracy - Compromised: 0.0485, Honest: 0.0497
Overall test accuracy: mean=0.0490 ± 0.0050

=== BACKDOOR ATTACK SUCCESS RATE (ASR) ===
Target label: 0
Trigger size: 4x4
Overall ASR: 0.3500 ± 0.4770
Honest nodes ASR: 0.1250 ± 0.3307
Compromised nodes ASR: 0.5000 ± 0.5000
Note: Higher ASR indicates more successful backdoor attack
