Device: cuda
Seed: 987654321
Loading 36 LEAF FEMNIST train files...
LEAF FEMNIST train: 3597 users, 734463 samples
Loading 36 LEAF FEMNIST test files...
LEAF FEMNIST test: 3597 users, 83388 samples
Found 3597 train users, 3597 test users, 3597 common users
User sample counts range: 525 (max) to 17 (min)
Distributed ALL 3597 users across 20 clients
Users per client: 179 (with 17 clients getting +1 user)
Train partition sizes: [36360, 37070, 35957, 38262, 36024, 37732, 36921, 38328, 36867, 37683, 36507, 36915, 36007, 37001, 35681, 35453, 36585, 36801, 35964, 36345]
Test partition sizes: [4128, 4203, 4081, 4333, 4091, 4287, 4193, 4349, 4191, 4277, 4143, 4193, 4093, 4197, 4052, 4029, 4153, 4183, 4084, 4128]
  Client 0: 36360 train samples, 62 unique classes
  Client 1: 37070 train samples, 62 unique classes
  Client 2: 35957 train samples, 62 unique classes
  Client 3: 38262 train samples, 62 unique classes
  Client 4: 36024 train samples, 62 unique classes
  Client 5: 37732 train samples, 62 unique classes
  Client 6: 36921 train samples, 62 unique classes
  Client 7: 38328 train samples, 62 unique classes
  Client 8: 36867 train samples, 62 unique classes
  Client 9: 37683 train samples, 62 unique classes
  Client 10: 36507 train samples, 62 unique classes
  Client 11: 36915 train samples, 62 unique classes
  Client 12: 36007 train samples, 62 unique classes
  Client 13: 37001 train samples, 62 unique classes
  Client 14: 35681 train samples, 62 unique classes
  Client 15: 35453 train samples, 62 unique classes
  Client 16: 36585 train samples, 62 unique classes
  Client 17: 36801 train samples, 62 unique classes
  Client 18: 35964 train samples, 62 unique classes
  Client 19: 36345 train samples, 62 unique classes
Will sample 4500 samples per client per epoch
Graph: erdos, nodes: 20, edges: 48
Degree statistics: avg=4.80, min=2, max=7
Attack: Compromised 10/20 nodes: [1, 2, 5, 11, 12, 13, 14, 15, 17, 18]
Attack type: directed_deviation, lambda: 1.0
Model variant: baseline
Model parameters: 6,603,710
Initial test acc across nodes: mean=0.0168 ± 0.0139
Round 001: test acc mean=0.0203 ± 0.0177 | min=0.0029 max=0.0516
         : test loss mean=58031.7144 ± 80526.0263
         : individual accs = ['0.004360', '0.051630', '0.019358', '0.012462', '0.012955', '0.050618', '0.007155', '0.017935', '0.003818', '0.003507', '0.010379', '0.006916', '0.042756', '0.005480', '0.023198', '0.051378', '0.050325', '0.017930', '0.010774', '0.002907']
         : correct/total = [(18, 4128), (217, 4203), (79, 4081), (54, 4333), (53, 4091), (217, 4287), (30, 4193), (78, 4349), (16, 4191), (15, 4277), (43, 4143), (29, 4193), (175, 4093), (23, 4197), (94, 4052), (207, 4029), (209, 4153), (75, 4183), (44, 4084), (12, 4128)]
         : compromised: 0.0280, honest: 0.0126
Round 002: test acc mean=0.0504 ± 0.0062 | min=0.0378 max=0.0596
         : test loss mean=239816499029621312.0000 ± 929502320402073088.0000
         : individual accs = ['0.059593', '0.052344', '0.056114', '0.043157', '0.043021', '0.050618', '0.048414', '0.043918', '0.042233', '0.048398', '0.055998', '0.046745', '0.058637', '0.047177', '0.037759', '0.056590', '0.058271', '0.050920', '0.052155', '0.055475']
         : correct/total = [(246, 4128), (220, 4203), (229, 4081), (187, 4333), (176, 4091), (217, 4287), (203, 4193), (191, 4349), (177, 4191), (207, 4277), (232, 4143), (196, 4193), (240, 4093), (198, 4197), (153, 4052), (228, 4029), (242, 4153), (213, 4183), (213, 4084), (229, 4128)]
         : compromised: 0.0509, honest: 0.0498
Round 003: test acc mean=0.0495 ± 0.0054 | min=0.0323 max=0.0578
         : test loss mean=154661874808621627342848.0000 ± 674155482709320013971456.0000
         : individual accs = ['0.047238', '0.048775', '0.045087', '0.052850', '0.052554', '0.057849', '0.048891', '0.049207', '0.053209', '0.047697', '0.055274', '0.049606', '0.049597', '0.046462', '0.032330', '0.054852', '0.044546', '0.045900', '0.052889', '0.055475']
         : correct/total = [(195, 4128), (205, 4203), (184, 4081), (229, 4333), (215, 4091), (248, 4287), (205, 4193), (214, 4349), (223, 4191), (204, 4277), (229, 4143), (208, 4193), (203, 4093), (195, 4197), (131, 4052), (221, 4029), (185, 4153), (192, 4183), (216, 4084), (229, 4128)]
         : compromised: 0.0483, honest: 0.0507
Round 004: test acc mean=0.0454 ± 0.0079 | min=0.0281 max=0.0539
         : test loss mean=28785352435678633095331840.0000 ± 112177004857766421500788736.0000
         : individual accs = ['0.050145', '0.051630', '0.035531', '0.044773', '0.052554', '0.052484', '0.048891', '0.049207', '0.037700', '0.047697', '0.045619', '0.028142', '0.053750', '0.049559', '0.032330', '0.053860', '0.030340', '0.045900', '0.048482', '0.050388']
         : correct/total = [(207, 4128), (217, 4203), (145, 4081), (194, 4333), (215, 4091), (225, 4287), (205, 4193), (214, 4349), (158, 4191), (204, 4277), (189, 4143), (118, 4193), (220, 4093), (208, 4197), (131, 4052), (217, 4029), (126, 4153), (192, 4183), (198, 4084), (208, 4128)]
         : compromised: 0.0452, honest: 0.0457
Round 005: test acc mean=0.0425 ± 0.0083 | min=0.0261 max=0.0544
         : test loss mean=2138513630887.5437 ± 7097477497132.6289
         : individual accs = ['0.049176', '0.047109', '0.035531', '0.038311', '0.052554', '0.052484', '0.035535', '0.049207', '0.044619', '0.036708', '0.045619', '0.036728', '0.049841', '0.028592', '0.051579', '0.026061', '0.054418', '0.039445', '0.032321', '0.045058']
         : correct/total = [(203, 4128), (198, 4203), (145, 4081), (166, 4333), (215, 4091), (225, 4287), (149, 4193), (214, 4349), (187, 4191), (157, 4277), (189, 4143), (154, 4193), (204, 4093), (120, 4197), (209, 4052), (105, 4029), (226, 4153), (165, 4183), (132, 4084), (186, 4128)]
         : compromised: 0.0400, honest: 0.0451
Round 006: test acc mean=0.0486 ± 0.0057 | min=0.0323 max=0.0551
         : test loss mean=1307361153814.8916 ± 3737990229018.0366
         : individual accs = ['0.049176', '0.047109', '0.055134', '0.044773', '0.052554', '0.052484', '0.053899', '0.049207', '0.051539', '0.047463', '0.045619', '0.045314', '0.054239', '0.037408', '0.051579', '0.053860', '0.054418', '0.049486', '0.032321', '0.045058']
         : correct/total = [(203, 4128), (198, 4203), (225, 4081), (194, 4333), (215, 4091), (225, 4287), (226, 4193), (214, 4349), (216, 4191), (203, 4277), (189, 4143), (190, 4193), (222, 4093), (157, 4197), (209, 4052), (217, 4029), (226, 4153), (207, 4183), (132, 4084), (186, 4128)]
         : compromised: 0.0479, honest: 0.0494
Round 007: test acc mean=0.0438 ± 0.0146 | min=0.0036 max=0.0551
         : test loss mean=66780204151.4569 ± 130978173618.7163
         : individual accs = ['0.050145', '0.048775', '0.055134', '0.043157', '0.052554', '0.052484', '0.003577', '0.049207', '0.051539', '0.047463', '0.048033', '0.053184', '0.049597', '0.004765', '0.032330', '0.050633', '0.030340', '0.045900', '0.052155', '0.054506']
         : correct/total = [(207, 4128), (205, 4203), (225, 4081), (187, 4333), (215, 4091), (225, 4287), (15, 4193), (214, 4349), (216, 4191), (203, 4277), (199, 4143), (223, 4193), (203, 4093), (20, 4197), (131, 4052), (204, 4029), (126, 4153), (192, 4183), (213, 4084), (225, 4128)]
         : compromised: 0.0445, honest: 0.0431
Round 008: test acc mean=0.0441 ± 0.0154 | min=0.0026 max=0.0582
         : test loss mean=206.6274 ± 180.3570
         : individual accs = ['0.050145', '0.049726', '0.026954', '0.036464', '0.057932', '0.050618', '0.042213', '0.058174', '0.049630', '0.043488', '0.055998', '0.046983', '0.050574', '0.045747', '0.003455', '0.050633', '0.002649', '0.053311', '0.052155', '0.055475']
         : correct/total = [(207, 4128), (209, 4203), (110, 4081), (158, 4333), (237, 4091), (217, 4287), (177, 4193), (253, 4349), (208, 4191), (186, 4277), (232, 4143), (197, 4193), (207, 4093), (192, 4197), (14, 4052), (204, 4029), (11, 4153), (223, 4183), (213, 4084), (229, 4128)]
         : compromised: 0.0430, honest: 0.0452
Round 009: test acc mean=0.0508 ± 0.0023 | min=0.0465 max=0.0549
         : test loss mean=10.6156 ± 13.8170
         : individual accs = ['0.051599', '0.047109', '0.050723', '0.047773', '0.051088', '0.052484', '0.053899', '0.051276', '0.047960', '0.053075', '0.050447', '0.053184', '0.049841', '0.046462', '0.050346', '0.054852', '0.049362', '0.053311', '0.052155', '0.048450']
         : correct/total = [(213, 4128), (198, 4203), (207, 4081), (207, 4333), (209, 4091), (225, 4287), (226, 4193), (223, 4349), (201, 4191), (227, 4277), (209, 4143), (223, 4193), (204, 4093), (195, 4197), (204, 4052), (221, 4029), (205, 4153), (223, 4183), (213, 4084), (200, 4128)]
         : compromised: 0.0510, honest: 0.0505
Round 010: test acc mean=0.0485 ± 0.0039 | min=0.0408 max=0.0545
         : test loss mean=30.0726 ± 45.8933
         : individual accs = ['0.045785', '0.050202', '0.045087', '0.048234', '0.043021', '0.052484', '0.046745', '0.045068', '0.040802', '0.046528', '0.048033', '0.045314', '0.048620', '0.045747', '0.051579', '0.053860', '0.054418', '0.050203', '0.054358', '0.054506']
         : correct/total = [(189, 4128), (211, 4203), (184, 4081), (209, 4333), (176, 4091), (225, 4287), (196, 4193), (196, 4349), (171, 4191), (199, 4277), (199, 4143), (190, 4193), (199, 4093), (192, 4197), (209, 4052), (217, 4029), (226, 4153), (210, 4183), (222, 4084), (225, 4128)]
         : compromised: 0.0497, honest: 0.0473

=== FINAL RESULTS ===
Dataset: femnist, Nodes: 20, Graph: erdos, Aggregation: d-fedavg
Attack: directed_deviation, 50.0% compromised
Final accuracy - Compromised: 0.0497, Honest: 0.0473
Overall test accuracy: mean=0.0485 ± 0.0039
