Device: cuda
Seed: 987654321
Loading 36 LEAF FEMNIST train files...
LEAF FEMNIST train: 3597 users, 734463 samples
Loading 36 LEAF FEMNIST test files...
LEAF FEMNIST test: 3597 users, 83388 samples
Found 3597 train users, 3597 test users, 3597 common users
User sample counts range: 525 (max) to 17 (min)
Distributed ALL 3597 users across 20 clients
Users per client: 179 (with 17 clients getting +1 user)
Train partition sizes: [36360, 37070, 35957, 38262, 36024, 37732, 36921, 38328, 36867, 37683, 36507, 36915, 36007, 37001, 35681, 35453, 36585, 36801, 35964, 36345]
Test partition sizes: [4128, 4203, 4081, 4333, 4091, 4287, 4193, 4349, 4191, 4277, 4143, 4193, 4093, 4197, 4052, 4029, 4153, 4183, 4084, 4128]
  Client 0: 36360 train samples, 62 unique classes
  Client 1: 37070 train samples, 62 unique classes
  Client 2: 35957 train samples, 62 unique classes
  Client 3: 38262 train samples, 62 unique classes
  Client 4: 36024 train samples, 62 unique classes
  Client 5: 37732 train samples, 62 unique classes
  Client 6: 36921 train samples, 62 unique classes
  Client 7: 38328 train samples, 62 unique classes
  Client 8: 36867 train samples, 62 unique classes
  Client 9: 37683 train samples, 62 unique classes
  Client 10: 36507 train samples, 62 unique classes
  Client 11: 36915 train samples, 62 unique classes
  Client 12: 36007 train samples, 62 unique classes
  Client 13: 37001 train samples, 62 unique classes
  Client 14: 35681 train samples, 62 unique classes
  Client 15: 35453 train samples, 62 unique classes
  Client 16: 36585 train samples, 62 unique classes
  Client 17: 36801 train samples, 62 unique classes
  Client 18: 35964 train samples, 62 unique classes
  Client 19: 36345 train samples, 62 unique classes
Will sample 4500 samples per client per epoch
Graph: erdos, nodes: 20, edges: 48
Degree statistics: avg=4.80, min=2, max=7
Attack: Compromised 14/20 nodes: [1, 2, 3, 5, 6, 8, 11, 12, 13, 14, 15, 17, 18, 19]
Attack type: backdoor, lambda: 1.0
Backdoor target label: 0, trigger size: 4
Model variant: baseline
Model parameters: 6,603,710
UBAR ALGORITHM (Two-Stage Byzantine-resilient)
  - Model dimension: 6,603,710 parameters
  - Rho parameter: 0.30000000000000004
  - Stage 1: Distance-based filtering (select 30% closest neighbors)
  - Stage 2: Performance-based selection (loss comparison)
  - Complexity: O(deg(i)×d + deg(i)×inference)
Initial test acc across nodes: mean=0.0168 ± 0.0139
Backdoor attack: Created poisoned datasets for 14 compromised nodes
Round 001: test acc mean=0.0518 ± 0.0042 | min=0.0432 max=0.0596
         : test loss mean=29597.1521 ± 35736.3383
         : individual accs = ['0.059593', '0.048775', '0.053418', '0.043157', '0.058910', '0.045253', '0.050799', '0.056105', '0.049630', '0.047463', '0.050447', '0.049606', '0.054239', '0.049083', '0.051826', '0.051626', '0.058271', '0.049486', '0.052889', '0.054506']
         : correct/total = [(246, 4128), (205, 4203), (218, 4081), (187, 4333), (241, 4091), (194, 4287), (213, 4193), (244, 4349), (208, 4191), (203, 4277), (209, 4143), (208, 4193), (222, 4093), (206, 4197), (210, 4052), (208, 4029), (242, 4153), (207, 4183), (216, 4084), (225, 4128)]
         : compromised: 0.0503, honest: 0.0551
         : ubar stats = ['Node 0: s1=0.167, s2=1.000', 'Node 1: s1=0.167, s2=1.000', 'Node 2: s1=0.200, s2=1.000']...
Round 002: test acc mean=0.0417 ± 0.0161 | min=0.0033 max=0.0662
         : test loss mean=14346.4521 ± 16104.6390
         : individual accs = ['0.044574', '0.042827', '0.066160', '0.039695', '0.057932', '0.013763', '0.003339', '0.058174', '0.032689', '0.050503', '0.060101', '0.016456', '0.024676', '0.037408', '0.051826', '0.040208', '0.049362', '0.049486', '0.052889', '0.042151']
         : correct/total = [(184, 4128), (180, 4203), (270, 4081), (172, 4333), (237, 4091), (59, 4287), (14, 4193), (253, 4349), (137, 4191), (216, 4277), (249, 4143), (69, 4193), (101, 4093), (157, 4197), (210, 4052), (162, 4029), (205, 4153), (207, 4183), (216, 4084), (174, 4128)]
         : compromised: 0.0367, honest: 0.0534
         : ubar stats = ['Node 0: s1=0.167, s2=1.000', 'Node 1: s1=0.167, s2=1.000', 'Node 2: s1=0.200, s2=1.000']...
Round 003: test acc mean=0.0470 ± 0.0184 | min=0.0250 max=0.0947
         : test loss mean=2597723554894990336.0000 ± 7136225560298024960.0000
         : individual accs = ['0.059593', '0.034737', '0.024994', '0.040157', '0.093376', '0.038955', '0.050799', '0.094734', '0.034359', '0.047697', '0.055274', '0.028142', '0.050574', '0.047177', '0.046644', '0.032266', '0.058271', '0.037533', '0.033301', '0.032219']
         : correct/total = [(246, 4128), (146, 4203), (102, 4081), (174, 4333), (382, 4091), (167, 4287), (213, 4193), (412, 4349), (144, 4191), (204, 4277), (229, 4143), (118, 4193), (207, 4093), (198, 4197), (189, 4052), (130, 4029), (242, 4153), (157, 4183), (136, 4084), (133, 4128)]
         : compromised: 0.0380, honest: 0.0682
         : ubar stats = ['Node 0: s1=0.167, s2=1.000', 'Node 1: s1=0.167, s2=1.000', 'Node 2: s1=0.200, s2=1.000']...
Round 004: test acc mean=0.0553 ± 0.0106 | min=0.0432 max=0.0829
         : test loss mean=nan ± nan
         : individual accs = ['0.059593', '0.048775', '0.053418', '0.043157', '0.082865', '0.045253', '0.050799', '0.081628', '0.049630', '0.053075', '0.069756', '0.045314', '0.054239', '0.049083', '0.051826', '0.051626', '0.058271', '0.049486', '0.052889', '0.054506']
         : correct/total = [(246, 4128), (205, 4203), (218, 4081), (187, 4333), (339, 4091), (194, 4287), (213, 4193), (355, 4349), (208, 4191), (227, 4277), (289, 4143), (190, 4193), (222, 4093), (206, 4197), (210, 4052), (208, 4029), (242, 4153), (207, 4183), (216, 4084), (225, 4128)]
         : compromised: 0.0500, honest: 0.0675
         : ubar stats = ['Node 0: s1=0.167, s2=1.000', 'Node 1: s1=0.167, s2=1.000', 'Node 2: s1=0.200, s2=1.000']...
Round 005: test acc mean=0.0506 ± 0.0044 | min=0.0420 max=0.0596
         : test loss mean=nan ± nan
         : individual accs = ['0.059593', '0.048775', '0.053418', '0.043157', '0.045710', '0.045253', '0.050799', '0.047827', '0.049630', '0.053776', '0.041999', '0.049606', '0.054239', '0.049083', '0.051826', '0.051626', '0.058271', '0.049486', '0.052889', '0.054506']
         : correct/total = [(246, 4128), (205, 4203), (218, 4081), (187, 4333), (187, 4091), (194, 4287), (213, 4193), (208, 4349), (208, 4191), (230, 4277), (174, 4143), (208, 4193), (222, 4093), (206, 4197), (210, 4052), (208, 4029), (242, 4153), (207, 4183), (216, 4084), (225, 4128)]
         : compromised: 0.0503, honest: 0.0512
         : ubar stats = ['Node 0: s1=0.167, s2=1.000', 'Node 1: s1=0.167, s2=1.000', 'Node 2: s1=0.200, s2=1.000']...
Round 006: test acc mean=0.0502 ± 0.0031 | min=0.0432 max=0.0545
         : test loss mean=nan ± nan
         : individual accs = ['0.051357', '0.048775', '0.053418', '0.043157', '0.051088', '0.045253', '0.050799', '0.051276', '0.049630', '0.043488', '0.050447', '0.049606', '0.054239', '0.049083', '0.051826', '0.051626', '0.052011', '0.049486', '0.052889', '0.054506']
         : correct/total = [(212, 4128), (205, 4203), (218, 4081), (187, 4333), (209, 4091), (194, 4287), (213, 4193), (223, 4349), (208, 4191), (186, 4277), (209, 4143), (208, 4193), (222, 4093), (206, 4197), (210, 4052), (208, 4029), (216, 4153), (207, 4183), (216, 4084), (225, 4128)]
         : compromised: 0.0503, honest: 0.0499
         : ubar stats = ['Node 0: s1=0.167, s2=1.000', 'Node 1: s1=0.167, s2=1.000', 'Node 2: s1=0.200, s2=1.000']...
Round 007: test acc mean=0.0549 ± 0.0116 | min=0.0432 max=0.0832
         : test loss mean=nan ± nan
         : individual accs = ['0.081638', '0.048775', '0.053418', '0.043157', '0.047421', '0.045253', '0.050799', '0.045528', '0.049630', '0.083236', '0.055998', '0.049606', '0.054239', '0.049083', '0.051826', '0.051626', '0.079220', '0.049486', '0.052889', '0.054506']
         : correct/total = [(337, 4128), (205, 4203), (218, 4081), (187, 4333), (194, 4091), (194, 4287), (213, 4193), (198, 4349), (208, 4191), (356, 4277), (232, 4143), (208, 4193), (222, 4093), (206, 4197), (210, 4052), (208, 4029), (329, 4153), (207, 4183), (216, 4084), (225, 4128)]
         : compromised: 0.0503, honest: 0.0655
         : ubar stats = ['Node 0: s1=0.167, s2=1.000', 'Node 1: s1=0.167, s2=1.000', 'Node 2: s1=0.200, s2=1.000']...
Round 008: test acc mean=0.0504 ± 0.0040 | min=0.0430 max=0.0594
         : test loss mean=nan ± nan
         : individual accs = ['0.051599', '0.048775', '0.053418', '0.043157', '0.043021', '0.045253', '0.050799', '0.045068', '0.049630', '0.059387', '0.049722', '0.049606', '0.054239', '0.049083', '0.051826', '0.051626', '0.055141', '0.049486', '0.052889', '0.054506']
         : correct/total = [(213, 4128), (205, 4203), (218, 4081), (187, 4333), (176, 4091), (194, 4287), (213, 4193), (196, 4349), (208, 4191), (254, 4277), (206, 4143), (208, 4193), (222, 4093), (206, 4197), (210, 4052), (208, 4029), (229, 4153), (207, 4183), (216, 4084), (225, 4128)]
         : compromised: 0.0503, honest: 0.0507
         : ubar stats = ['Node 0: s1=0.167, s2=1.000', 'Node 1: s1=0.167, s2=1.000', 'Node 2: s1=0.200, s2=1.000']...
Round 009: test acc mean=0.0570 ± 0.0171 | min=0.0432 max=0.0981
         : test loss mean=nan ± nan
         : individual accs = ['0.098110', '0.048775', '0.053418', '0.043157', '0.044977', '0.045253', '0.050799', '0.043918', '0.049630', '0.055880', '0.095824', '0.049606', '0.054239', '0.049083', '0.051826', '0.051626', '0.096797', '0.049486', '0.052889', '0.054506']
         : correct/total = [(405, 4128), (205, 4203), (218, 4081), (187, 4333), (184, 4091), (194, 4287), (213, 4193), (191, 4349), (208, 4191), (239, 4277), (397, 4143), (208, 4193), (222, 4093), (206, 4197), (210, 4052), (208, 4029), (402, 4153), (207, 4183), (216, 4084), (225, 4128)]
         : compromised: 0.0503, honest: 0.0726
         : ubar stats = ['Node 0: s1=0.167, s2=1.000', 'Node 1: s1=0.167, s2=1.000', 'Node 2: s1=0.200, s2=1.000']...
Round 010: test acc mean=0.0604 ± 0.0175 | min=0.0432 max=0.0987
         : test loss mean=nan ± nan
         : individual accs = ['0.088663', '0.048775', '0.053418', '0.043157', '0.087509', '0.045253', '0.050799', '0.088526', '0.049630', '0.053776', '0.098721', '0.049606', '0.054239', '0.049083', '0.051826', '0.051626', '0.087407', '0.049486', '0.052889', '0.054506']
         : correct/total = [(366, 4128), (205, 4203), (218, 4081), (187, 4333), (358, 4091), (194, 4287), (213, 4193), (385, 4349), (208, 4191), (230, 4277), (409, 4143), (208, 4193), (222, 4093), (206, 4197), (210, 4052), (208, 4029), (363, 4153), (207, 4183), (216, 4084), (225, 4128)]
         : compromised: 0.0503, honest: 0.0841
         : ubar stats = ['Node 0: s1=0.167, s2=1.000', 'Node 1: s1=0.167, s2=1.000', 'Node 2: s1=0.200, s2=1.000']...

=== FINAL RESULTS ===
Dataset: femnist, Nodes: 20, Graph: erdos, Aggregation: ubar
Attack: backdoor, 70.0% compromised
Final accuracy - Compromised: 0.0503, Honest: 0.0841
Overall test accuracy: mean=0.0604 ± 0.0175

=== BACKDOOR ATTACK SUCCESS RATE (ASR) ===
Target label: 0
Trigger size: 4x4
Overall ASR: 0.7010 ± 0.4567
Honest nodes ASR: 0.0035 ± 0.0077
Compromised nodes ASR: 1.0000 ± 0.0000
Note: Higher ASR indicates more successful backdoor attack

=== UBAR SUMMARY ===
Node 0: stage1=0.167, stage2=1.000, overall=0.167
Node 1: stage1=0.167, stage2=1.000, overall=0.167
Node 2: stage1=0.200, stage2=1.000, overall=0.200
Node 3: stage1=0.250, stage2=1.000, overall=0.250
Node 4: stage1=0.250, stage2=1.000, overall=0.250
Node 5: stage1=0.200, stage2=1.000, overall=0.200
Node 6: stage1=0.200, stage2=1.000, overall=0.200
Node 7: stage1=0.200, stage2=1.000, overall=0.200
Node 8: stage1=0.500, stage2=1.000, overall=0.500
Node 9: stage1=0.333, stage2=1.000, overall=0.333
Node 10: stage1=0.250, stage2=1.000, overall=0.250
Node 11: stage1=0.286, stage2=0.650, overall=0.186
Node 12: stage1=0.286, stage2=0.650, overall=0.186
Node 13: stage1=0.250, stage2=1.000, overall=0.250
Node 14: stage1=0.286, stage2=0.600, overall=0.171
Node 15: stage1=0.167, stage2=1.000, overall=0.167
Node 16: stage1=0.200, stage2=1.000, overall=0.200
Node 17: stage1=0.200, stage2=1.000, overall=0.200
Node 18: stage1=0.250, stage2=1.000, overall=0.250
Node 19: stage1=0.500, stage2=1.000, overall=0.500

=== PARALLEL EXECUTION TIME (realistic for distributed system) ===
  COMMUNICATION (max across nodes):
    - Full model transfer: 0.000s (0.0%)
  COMPUTATION (max across nodes):
    - Distance computation: 0.036s (0.6%)
    - Loss computation: 5.917s (99.3%)
    - Aggregation: 0.007s (0.1%)
  TOTALS:
    - Total computation: 5.960s (100.0%)
    - Total communication: 0.000s (0.0%)
    - Total parallel time: 5.960s

=== PER-NODE AVERAGE TIME ===
  - Distance computation: 0.025s
  - Loss computation: 4.225s
  - Aggregation: 0.005s
  - Model transfer: 0.000s
  - Total per node: 4.254s

=== TOTAL COMPUTATIONAL WORK (sum across all nodes) ===
  - Total distance computation: 0.493s
  - Total loss computation: 84.505s
  - Total aggregation: 0.091s
  - Total model transfer: 0.000s
  - Grand total: 85.089s
  - Mean Stage 1 acceptance rate: 0.257
  - Mean Stage 2 acceptance rate: 0.945
  - Overall acceptance rate: 0.243

UBAR Algorithm Properties:
  - Model dimension: 6,603,710
  - Rho parameter: 0.30000000000000004
  - Two-stage approach: Distance filtering + loss evaluation
  - Stage 1 selects: 30% of neighbors
  - Stage 2 uses: Training sample loss comparison
  - Theoretical complexity: O(deg(i)×d + deg(i)×inference)
  - Approach: UBAR paper implementation
