Device: cuda
Seed: 987654321
Loading 36 LEAF FEMNIST train files...
LEAF FEMNIST train: 3597 users, 734463 samples
Loading 36 LEAF FEMNIST test files...
LEAF FEMNIST test: 3597 users, 83388 samples
Found 3597 train users, 3597 test users, 3597 common users
User sample counts range: 525 (max) to 17 (min)
Distributed ALL 3597 users across 20 clients
Users per client: 179 (with 17 clients getting +1 user)
Train partition sizes: [36360, 37070, 35957, 38262, 36024, 37732, 36921, 38328, 36867, 37683, 36507, 36915, 36007, 37001, 35681, 35453, 36585, 36801, 35964, 36345]
Test partition sizes: [4128, 4203, 4081, 4333, 4091, 4287, 4193, 4349, 4191, 4277, 4143, 4193, 4093, 4197, 4052, 4029, 4153, 4183, 4084, 4128]
  Client 0: 36360 train samples, 62 unique classes
  Client 1: 37070 train samples, 62 unique classes
  Client 2: 35957 train samples, 62 unique classes
  Client 3: 38262 train samples, 62 unique classes
  Client 4: 36024 train samples, 62 unique classes
  Client 5: 37732 train samples, 62 unique classes
  Client 6: 36921 train samples, 62 unique classes
  Client 7: 38328 train samples, 62 unique classes
  Client 8: 36867 train samples, 62 unique classes
  Client 9: 37683 train samples, 62 unique classes
  Client 10: 36507 train samples, 62 unique classes
  Client 11: 36915 train samples, 62 unique classes
  Client 12: 36007 train samples, 62 unique classes
  Client 13: 37001 train samples, 62 unique classes
  Client 14: 35681 train samples, 62 unique classes
  Client 15: 35453 train samples, 62 unique classes
  Client 16: 36585 train samples, 62 unique classes
  Client 17: 36801 train samples, 62 unique classes
  Client 18: 35964 train samples, 62 unique classes
  Client 19: 36345 train samples, 62 unique classes
Will sample 4500 samples per client per epoch
Graph: erdos, nodes: 20, edges: 48
Degree statistics: avg=4.80, min=2, max=7
Attack: Compromised 8/20 nodes: [1, 5, 11, 12, 13, 14, 17, 18]
Attack type: backdoor, lambda: 1.0
Backdoor target label: 0, trigger size: 4
Model variant: baseline
Model parameters: 6,603,710
Initial test acc across nodes: mean=0.0168 ± 0.0139
Backdoor attack: Created poisoned datasets for 8 compromised nodes
Round 001: test acc mean=0.0235 ± 0.0197 | min=0.0039 max=0.0596
         : test loss mean=41425.3800 ± 94815.2839
         : individual accs = ['0.059593', '0.052344', '0.015927', '0.024694', '0.058176', '0.021693', '0.006201', '0.041389', '0.014078', '0.009586', '0.010138', '0.018841', '0.003909', '0.004765', '0.045410', '0.009432', '0.004093', '0.011475', '0.003918', '0.054506']
         : correct/total = [(246, 4128), (220, 4203), (65, 4081), (107, 4333), (238, 4091), (93, 4287), (26, 4193), (180, 4349), (59, 4191), (41, 4277), (42, 4143), (79, 4193), (16, 4093), (20, 4197), (184, 4052), (38, 4029), (17, 4153), (48, 4183), (16, 4084), (225, 4128)]
         : compromised: 0.0203, honest: 0.0257
Round 002: test acc mean=0.0455 ± 0.0145 | min=0.0036 max=0.0618
         : test loss mean=252934555724446.6562 ± 1101513396809755.8750
         : individual accs = ['0.044574', '0.047109', '0.053418', '0.048465', '0.051088', '0.045253', '0.043883', '0.053116', '0.004534', '0.053075', '0.048033', '0.061770', '0.052040', '0.055278', '0.045656', '0.050881', '0.051288', '0.003586', '0.052889', '0.045058']
         : correct/total = [(184, 4128), (198, 4203), (218, 4081), (210, 4333), (209, 4091), (194, 4287), (184, 4193), (231, 4349), (19, 4191), (227, 4277), (199, 4143), (259, 4193), (213, 4093), (232, 4197), (185, 4052), (205, 4029), (213, 4153), (15, 4183), (216, 4084), (186, 4128)]
         : compromised: 0.0454, honest: 0.0456
Round 003: test acc mean=0.0482 ± 0.0046 | min=0.0355 max=0.0596
         : test loss mean=208494113520.0156 ± 462929914996.6115
         : individual accs = ['0.059593', '0.048775', '0.035531', '0.046619', '0.052066', '0.045953', '0.048891', '0.049207', '0.049630', '0.044891', '0.047550', '0.046983', '0.049597', '0.045747', '0.045656', '0.050881', '0.044546', '0.046139', '0.051665', '0.054506']
         : correct/total = [(246, 4128), (205, 4203), (145, 4081), (202, 4333), (213, 4091), (197, 4287), (205, 4193), (214, 4349), (208, 4191), (192, 4277), (197, 4143), (197, 4193), (203, 4093), (192, 4197), (185, 4052), (205, 4029), (185, 4153), (193, 4183), (211, 4084), (225, 4128)]
         : compromised: 0.0476, honest: 0.0487
Round 004: test acc mean=0.0452 ± 0.0098 | min=0.0157 max=0.0553
         : test loss mean=7789281579.1478 ± 12836317223.8726
         : individual accs = ['0.015746', '0.050916', '0.024994', '0.046619', '0.052066', '0.045953', '0.043883', '0.053116', '0.042233', '0.044891', '0.047550', '0.054376', '0.052040', '0.055278', '0.032330', '0.050881', '0.044546', '0.045900', '0.050196', '0.050145']
         : correct/total = [(65, 4128), (214, 4203), (102, 4081), (202, 4333), (213, 4091), (197, 4287), (184, 4193), (231, 4349), (177, 4191), (192, 4277), (197, 4143), (228, 4193), (213, 4093), (232, 4197), (131, 4052), (205, 4029), (185, 4153), (192, 4183), (205, 4084), (207, 4128)]
         : compromised: 0.0484, honest: 0.0431
Round 005: test acc mean=0.0447 ± 0.0082 | min=0.0233 max=0.0549
         : test loss mean=1457651604.1448 ± 3717134830.7441
         : individual accs = ['0.027132', '0.048775', '0.054889', '0.046619', '0.052066', '0.045953', '0.035535', '0.043918', '0.034359', '0.044891', '0.047550', '0.054376', '0.049597', '0.047177', '0.046397', '0.050881', '0.044546', '0.045900', '0.050196', '0.023256']
         : correct/total = [(112, 4128), (205, 4203), (224, 4081), (202, 4333), (213, 4091), (197, 4287), (149, 4193), (191, 4349), (144, 4191), (192, 4277), (197, 4143), (228, 4193), (203, 4093), (198, 4197), (188, 4052), (205, 4029), (185, 4153), (192, 4183), (205, 4084), (96, 4128)]
         : compromised: 0.0485, honest: 0.0421
Round 006: test acc mean=0.0393 ± 0.0093 | min=0.0150 max=0.0578
         : test loss mean=20.2799 ± 17.7939
         : individual accs = ['0.048934', '0.036878', '0.035531', '0.038311', '0.044977', '0.057849', '0.035535', '0.035640', '0.037700', '0.036708', '0.039585', '0.036728', '0.036404', '0.055278', '0.046397', '0.026061', '0.044546', '0.045900', '0.032321', '0.015019']
         : correct/total = [(202, 4128), (155, 4203), (145, 4081), (166, 4333), (184, 4091), (248, 4287), (149, 4193), (155, 4349), (158, 4191), (157, 4277), (164, 4143), (154, 4193), (149, 4093), (232, 4197), (188, 4052), (105, 4029), (185, 4153), (192, 4183), (132, 4084), (62, 4128)]
         : compromised: 0.0435, honest: 0.0365
Round 007: test acc mean=0.0410 ± 0.0077 | min=0.0261 max=0.0526
         : test loss mean=11.7377 ± 9.4424
         : individual accs = ['0.044574', '0.036878', '0.035531', '0.046619', '0.052554', '0.052484', '0.043883', '0.047827', '0.037700', '0.044891', '0.039585', '0.036728', '0.052040', '0.037408', '0.032330', '0.026061', '0.030340', '0.039445', '0.032321', '0.050872']
         : correct/total = [(184, 4128), (155, 4203), (145, 4081), (202, 4333), (215, 4091), (225, 4287), (184, 4193), (208, 4349), (158, 4191), (192, 4277), (164, 4143), (154, 4193), (213, 4093), (157, 4197), (131, 4052), (105, 4029), (126, 4153), (165, 4183), (132, 4084), (210, 4128)]
         : compromised: 0.0400, honest: 0.0417
Round 008: test acc mean=0.0410 ± 0.0117 | min=0.0045 max=0.0578
         : test loss mean=8.3494 ± 6.9190
         : individual accs = ['0.050145', '0.036878', '0.055134', '0.038311', '0.044977', '0.057849', '0.053899', '0.043918', '0.004534', '0.050503', '0.039585', '0.036728', '0.049841', '0.037408', '0.032330', '0.026061', '0.047195', '0.039445', '0.032321', '0.043847']
         : correct/total = [(207, 4128), (155, 4203), (225, 4081), (166, 4333), (184, 4091), (248, 4287), (226, 4193), (191, 4349), (19, 4191), (216, 4277), (164, 4143), (154, 4193), (204, 4093), (157, 4197), (131, 4052), (105, 4029), (196, 4153), (165, 4183), (132, 4084), (181, 4128)]
         : compromised: 0.0404, honest: 0.0415
Round 009: test acc mean=0.0420 ± 0.0070 | min=0.0303 max=0.0526
         : test loss mean=5.5848 ± 1.5715
         : individual accs = ['0.050145', '0.036878', '0.035531', '0.038311', '0.052554', '0.052484', '0.043883', '0.043918', '0.037700', '0.044891', '0.047550', '0.036728', '0.052040', '0.037408', '0.032330', '0.050633', '0.030340', '0.039445', '0.032321', '0.044331']
         : correct/total = [(207, 4128), (155, 4203), (145, 4081), (166, 4333), (215, 4091), (225, 4287), (184, 4193), (191, 4349), (158, 4191), (192, 4277), (197, 4143), (154, 4193), (213, 4093), (157, 4197), (131, 4052), (204, 4029), (126, 4153), (165, 4183), (132, 4084), (183, 4128)]
         : compromised: 0.0400, honest: 0.0433
Round 010: test acc mean=0.0463 ± 0.0109 | min=0.0180 max=0.0586
         : test loss mean=16.1190 ± 19.7190
         : individual accs = ['0.048934', '0.048775', '0.054889', '0.052850', '0.057932', '0.050618', '0.057000', '0.058174', '0.051062', '0.018003', '0.055998', '0.036728', '0.058637', '0.037408', '0.046397', '0.026061', '0.044546', '0.045900', '0.032321', '0.043847']
         : correct/total = [(202, 4128), (205, 4203), (224, 4081), (229, 4333), (237, 4091), (217, 4287), (239, 4193), (253, 4349), (214, 4191), (77, 4277), (232, 4143), (154, 4193), (240, 4093), (157, 4197), (188, 4052), (105, 4029), (185, 4153), (192, 4183), (132, 4084), (181, 4128)]
         : compromised: 0.0446, honest: 0.0474

=== FINAL RESULTS ===
Dataset: femnist, Nodes: 20, Graph: erdos, Aggregation: krum
Attack: backdoor, 40.0% compromised
Final accuracy - Compromised: 0.0446, Honest: 0.0474
Overall test accuracy: mean=0.0463 ± 0.0109

=== BACKDOOR ATTACK SUCCESS RATE (ASR) ===
Target label: 0
Trigger size: 4x4
Overall ASR: 0.0000 ± 0.0000
Honest nodes ASR: 0.0000 ± 0.0000
Compromised nodes ASR: 0.0000 ± 0.0000
Note: Higher ASR indicates more successful backdoor attack
