Device: cuda
Seed: 987654321
Loading 36 LEAF FEMNIST train files...
LEAF FEMNIST train: 3597 users, 734463 samples
Loading 36 LEAF FEMNIST test files...
LEAF FEMNIST test: 3597 users, 83388 samples
Found 3597 train users, 3597 test users, 3597 common users
User sample counts range: 525 (max) to 17 (min)
Distributed ALL 3597 users across 20 clients
Users per client: 179 (with 17 clients getting +1 user)
Train partition sizes: [36360, 37070, 35957, 38262, 36024, 37732, 36921, 38328, 36867, 37683, 36507, 36915, 36007, 37001, 35681, 35453, 36585, 36801, 35964, 36345]
Test partition sizes: [4128, 4203, 4081, 4333, 4091, 4287, 4193, 4349, 4191, 4277, 4143, 4193, 4093, 4197, 4052, 4029, 4153, 4183, 4084, 4128]
  Client 0: 36360 train samples, 62 unique classes
  Client 1: 37070 train samples, 62 unique classes
  Client 2: 35957 train samples, 62 unique classes
  Client 3: 38262 train samples, 62 unique classes
  Client 4: 36024 train samples, 62 unique classes
  Client 5: 37732 train samples, 62 unique classes
  Client 6: 36921 train samples, 62 unique classes
  Client 7: 38328 train samples, 62 unique classes
  Client 8: 36867 train samples, 62 unique classes
  Client 9: 37683 train samples, 62 unique classes
  Client 10: 36507 train samples, 62 unique classes
  Client 11: 36915 train samples, 62 unique classes
  Client 12: 36007 train samples, 62 unique classes
  Client 13: 37001 train samples, 62 unique classes
  Client 14: 35681 train samples, 62 unique classes
  Client 15: 35453 train samples, 62 unique classes
  Client 16: 36585 train samples, 62 unique classes
  Client 17: 36801 train samples, 62 unique classes
  Client 18: 35964 train samples, 62 unique classes
  Client 19: 36345 train samples, 62 unique classes
Will sample 4500 samples per client per epoch
Graph: erdos, nodes: 20, edges: 126
Degree statistics: avg=12.60, min=8, max=16
Attack: Compromised 14/20 nodes: [1, 2, 3, 5, 6, 8, 11, 12, 13, 14, 15, 17, 18, 19]
Attack type: backdoor, lambda: 1.0
Backdoor target label: 0, trigger size: 4
Model variant: baseline
Model parameters: 6,603,710
BALANCE algorithm:
Balance Config: BALANCEConfig(gamma=2, kappa=1, alpha=0.5, min_neighbors=1)
  - Model dimension: 6,603,710 parameters
  - Complexity: O(N×d) = O(20×6,603,710)
Initial test acc across nodes: mean=0.0168 ± 0.0139
Backdoor attack: Created poisoned datasets for 14 compromised nodes
Round 001: test acc mean=0.0518 ± 0.0043 | min=0.0432 max=0.0596
         : test loss mean=21899.5783 ± 14441.6111
         : individual accs = ['0.059593', '0.048775', '0.053418', '0.043157', '0.057932', '0.045253', '0.050799', '0.058174', '0.049630', '0.047463', '0.050447', '0.049606', '0.054239', '0.049083', '0.051826', '0.051626', '0.058271', '0.049486', '0.052889', '0.054506']
         : correct/total = [(246, 4128), (205, 4203), (218, 4081), (187, 4333), (237, 4091), (194, 4287), (213, 4193), (253, 4349), (208, 4191), (203, 4277), (209, 4143), (208, 4193), (222, 4093), (206, 4197), (210, 4052), (208, 4029), (242, 4153), (207, 4183), (216, 4084), (225, 4128)]
         : compromised: 0.0503, honest: 0.0553
Round 002: test acc mean=0.0248 ± 0.0237 | min=0.0029 max=0.0582
         : test loss mean=568454.3286 ± 741531.4458
         : individual accs = ['0.044574', '0.002855', '0.006371', '0.006231', '0.057932', '0.004432', '0.005724', '0.058174', '0.005727', '0.053776', '0.055998', '0.004054', '0.003420', '0.003336', '0.018263', '0.004468', '0.054418', '0.049486', '0.052889', '0.004603']
         : correct/total = [(184, 4128), (12, 4203), (26, 4081), (27, 4333), (237, 4091), (19, 4287), (24, 4193), (253, 4349), (24, 4191), (230, 4277), (232, 4143), (17, 4193), (14, 4093), (14, 4197), (74, 4052), (18, 4029), (226, 4153), (207, 4183), (216, 4084), (19, 4128)]
         : compromised: 0.0123, honest: 0.0541
Round 003: test acc mean=0.0492 ± 0.0110 | min=0.0045 max=0.0596
         : test loss mean=nan ± nan
         : individual accs = ['0.059593', '0.048775', '0.053418', '0.043157', '0.057932', '0.045253', '0.050799', '0.051276', '0.049630', '0.047463', '0.055998', '0.049606', '0.054239', '0.049083', '0.050346', '0.051626', '0.058271', '0.004542', '0.052889', '0.050872']
         : correct/total = [(246, 4128), (205, 4203), (218, 4081), (187, 4333), (237, 4091), (194, 4287), (213, 4193), (223, 4349), (208, 4191), (203, 4277), (232, 4143), (208, 4193), (222, 4093), (206, 4197), (204, 4052), (208, 4029), (242, 4153), (19, 4183), (216, 4084), (210, 4128)]
         : compromised: 0.0467, honest: 0.0551
Round 004: test acc mean=0.0522 ± 0.0044 | min=0.0432 max=0.0596
         : test loss mean=nan ± nan
         : individual accs = ['0.059593', '0.048775', '0.053418', '0.043157', '0.057932', '0.045253', '0.050799', '0.058174', '0.049630', '0.048398', '0.057929', '0.049606', '0.054239', '0.049083', '0.051826', '0.051626', '0.058271', '0.049486', '0.052889', '0.054506']
         : correct/total = [(246, 4128), (205, 4203), (218, 4081), (187, 4333), (237, 4091), (194, 4287), (213, 4193), (253, 4349), (208, 4191), (207, 4277), (240, 4143), (208, 4193), (222, 4093), (206, 4197), (210, 4052), (208, 4029), (242, 4153), (207, 4183), (216, 4084), (225, 4128)]
         : compromised: 0.0503, honest: 0.0567
Round 005: test acc mean=0.0519 ± 0.0042 | min=0.0432 max=0.0596
         : test loss mean=nan ± nan
         : individual accs = ['0.059593', '0.048775', '0.053418', '0.043157', '0.057932', '0.045253', '0.050799', '0.047827', '0.049630', '0.053776', '0.055998', '0.049606', '0.054239', '0.049083', '0.051826', '0.051626', '0.058271', '0.049486', '0.052889', '0.054506']
         : correct/total = [(246, 4128), (205, 4203), (218, 4081), (187, 4333), (237, 4091), (194, 4287), (213, 4193), (208, 4349), (208, 4191), (230, 4277), (232, 4143), (208, 4193), (222, 4093), (206, 4197), (210, 4052), (208, 4029), (242, 4153), (207, 4183), (216, 4084), (225, 4128)]
         : compromised: 0.0503, honest: 0.0556
Round 006: test acc mean=0.0504 ± 0.0043 | min=0.0420 max=0.0583
         : test loss mean=nan ± nan
         : individual accs = ['0.044574', '0.048775', '0.053418', '0.043157', '0.057932', '0.045253', '0.050799', '0.047827', '0.049630', '0.053776', '0.041999', '0.049606', '0.054239', '0.049083', '0.051826', '0.051626', '0.058271', '0.049486', '0.052889', '0.054506']
         : correct/total = [(184, 4128), (205, 4203), (218, 4081), (187, 4333), (237, 4091), (194, 4287), (213, 4193), (208, 4349), (208, 4191), (230, 4277), (174, 4143), (208, 4193), (222, 4093), (206, 4197), (210, 4052), (208, 4029), (242, 4153), (207, 4183), (216, 4084), (225, 4128)]
         : compromised: 0.0503, honest: 0.0507
Round 007: test acc mean=0.0528 ± 0.0090 | min=0.0432 max=0.0874
         : test loss mean=nan ± nan
         : individual accs = ['0.059593', '0.048775', '0.053418', '0.043157', '0.047421', '0.045253', '0.050799', '0.058174', '0.049630', '0.043488', '0.055998', '0.049606', '0.054239', '0.049083', '0.051826', '0.051626', '0.087407', '0.049486', '0.052889', '0.054506']
         : correct/total = [(246, 4128), (205, 4203), (218, 4081), (187, 4333), (194, 4091), (194, 4287), (213, 4193), (253, 4349), (208, 4191), (186, 4277), (232, 4143), (208, 4193), (222, 4093), (206, 4197), (210, 4052), (208, 4029), (363, 4153), (207, 4183), (216, 4084), (225, 4128)]
         : compromised: 0.0503, honest: 0.0587
Round 008: test acc mean=0.0507 ± 0.0030 | min=0.0432 max=0.0551
         : test loss mean=nan ± nan
         : individual accs = ['0.051599', '0.048775', '0.053418', '0.043157', '0.051088', '0.045253', '0.050799', '0.051276', '0.049630', '0.053075', '0.046826', '0.049606', '0.054239', '0.049083', '0.051826', '0.051626', '0.055141', '0.049486', '0.052889', '0.054506']
         : correct/total = [(213, 4128), (205, 4203), (218, 4081), (187, 4333), (209, 4091), (194, 4287), (213, 4193), (223, 4349), (208, 4191), (227, 4277), (194, 4143), (208, 4193), (222, 4093), (206, 4197), (210, 4052), (208, 4029), (229, 4153), (207, 4183), (216, 4084), (225, 4128)]
         : compromised: 0.0503, honest: 0.0515
Round 009: test acc mean=0.0519 ± 0.0079 | min=0.0432 max=0.0833
         : test loss mean=nan ± nan
         : individual accs = ['0.051599', '0.048775', '0.053418', '0.043157', '0.052310', '0.045253', '0.050799', '0.043918', '0.049630', '0.047463', '0.055998', '0.049606', '0.054239', '0.049083', '0.051826', '0.051626', '0.083313', '0.049486', '0.052889', '0.054506']
         : correct/total = [(213, 4128), (205, 4203), (218, 4081), (187, 4333), (214, 4091), (194, 4287), (213, 4193), (191, 4349), (208, 4191), (203, 4277), (232, 4143), (208, 4193), (222, 4093), (206, 4197), (210, 4052), (208, 4029), (346, 4153), (207, 4183), (216, 4084), (225, 4128)]
         : compromised: 0.0503, honest: 0.0558
Round 010: test acc mean=0.0524 ± 0.0043 | min=0.0432 max=0.0596
         : test loss mean=nan ± nan
         : individual accs = ['0.059593', '0.048775', '0.053418', '0.043157', '0.057932', '0.045253', '0.050799', '0.058174', '0.049630', '0.053776', '0.055998', '0.049606', '0.054239', '0.049083', '0.051826', '0.051626', '0.058271', '0.049486', '0.052889', '0.054506']
         : correct/total = [(246, 4128), (205, 4203), (218, 4081), (187, 4333), (237, 4091), (194, 4287), (213, 4193), (253, 4349), (208, 4191), (230, 4277), (232, 4143), (208, 4193), (222, 4093), (206, 4197), (210, 4052), (208, 4029), (242, 4153), (207, 4183), (216, 4084), (225, 4128)]
         : compromised: 0.0503, honest: 0.0573

=== FINAL RESULTS ===
Dataset: femnist, Nodes: 20, Graph: erdos, Aggregation: balance
Attack: backdoor, 70.0% compromised
Final accuracy - Compromised: 0.0503, Honest: 0.0573
Overall test accuracy: mean=0.0524 ± 0.0043

=== BACKDOOR ATTACK SUCCESS RATE (ASR) ===
Target label: 0
Trigger size: 4x4
Overall ASR: 0.7000 ± 0.4583
Honest nodes ASR: 0.0000 ± 0.0000
Compromised nodes ASR: 1.0000 ± 0.0000
Note: Higher ASR indicates more successful backdoor attack

=== BALANCE SUMMARY ===
Node 0: acceptance=0.312
Node 1: acceptance=0.236
Node 2: acceptance=0.233
Node 3: acceptance=0.237
Node 4: acceptance=0.364
Node 5: acceptance=0.227
Node 6: acceptance=0.229
Node 7: acceptance=0.286
Node 8: acceptance=0.220
Node 9: acceptance=0.308
Node 10: acceptance=0.222
Node 11: acceptance=0.236
Node 12: acceptance=0.233
Node 13: acceptance=0.123
Node 14: acceptance=0.227
Node 15: acceptance=0.227
Node 16: acceptance=0.231
Node 17: acceptance=0.244
Node 18: acceptance=0.231
Node 19: acceptance=0.231

=== PARALLEL EXECUTION TIME (realistic for distributed system) ===
  COMMUNICATION (max across nodes):
    - Full model transfer: 0.000s (0.0%)
  COMPUTATION (max across nodes):
    - Filtering: 0.064s (83.8%)
    - Aggregation: 0.012s (16.2%)
  TOTALS:
    - Total computation: 0.077s (100.0%)
    - Total communication: 0.000s (0.0%)
    - Total parallel time: 0.077s

=== PER-NODE AVERAGE TIME ===
  - Filtering: 0.051s
  - Aggregation: 0.004s
  - Model transfer: 0.000s
  - Total per node: 0.055s

=== TOTAL COMPUTATIONAL WORK (sum across all nodes) ===
  - Total filtering: 1.014s
  - Total aggregation: 0.085s
  - Total model transfer: 0.000s
  - Grand total: 1.099s
  - Mean acceptance rate: 0.243

BALANCE Algorithm Properties:
  - Model dimension: 6,603,710
  - No compression: Full parameter comparison
  - Theoretical complexity: O(deg(i)×d)
  - Approach: Full parameter filtering + averaging
