Device: cuda
Seed: 987654321
Loading 36 LEAF FEMNIST train files...
LEAF FEMNIST train: 3597 users, 734463 samples
Loading 36 LEAF FEMNIST test files...
LEAF FEMNIST test: 3597 users, 83388 samples
Found 3597 train users, 3597 test users, 3597 common users
User sample counts range: 525 (max) to 17 (min)
Distributed ALL 3597 users across 20 clients
Users per client: 179 (with 17 clients getting +1 user)
Train partition sizes: [36360, 37070, 35957, 38262, 36024, 37732, 36921, 38328, 36867, 37683, 36507, 36915, 36007, 37001, 35681, 35453, 36585, 36801, 35964, 36345]
Test partition sizes: [4128, 4203, 4081, 4333, 4091, 4287, 4193, 4349, 4191, 4277, 4143, 4193, 4093, 4197, 4052, 4029, 4153, 4183, 4084, 4128]
  Client 0: 36360 train samples, 62 unique classes
  Client 1: 37070 train samples, 62 unique classes
  Client 2: 35957 train samples, 62 unique classes
  Client 3: 38262 train samples, 62 unique classes
  Client 4: 36024 train samples, 62 unique classes
  Client 5: 37732 train samples, 62 unique classes
  Client 6: 36921 train samples, 62 unique classes
  Client 7: 38328 train samples, 62 unique classes
  Client 8: 36867 train samples, 62 unique classes
  Client 9: 37683 train samples, 62 unique classes
  Client 10: 36507 train samples, 62 unique classes
  Client 11: 36915 train samples, 62 unique classes
  Client 12: 36007 train samples, 62 unique classes
  Client 13: 37001 train samples, 62 unique classes
  Client 14: 35681 train samples, 62 unique classes
  Client 15: 35453 train samples, 62 unique classes
  Client 16: 36585 train samples, 62 unique classes
  Client 17: 36801 train samples, 62 unique classes
  Client 18: 35964 train samples, 62 unique classes
  Client 19: 36345 train samples, 62 unique classes
Will sample 4500 samples per client per epoch
Graph: erdos, nodes: 20, edges: 126
Degree statistics: avg=12.60, min=8, max=16
Attack: Compromised 12/20 nodes: [1, 2, 3, 5, 8, 11, 12, 13, 14, 15, 17, 18]
Attack type: backdoor, lambda: 1.0
Backdoor target label: 0, trigger size: 4
Model variant: baseline
Model parameters: 6,603,710
Initial test acc across nodes: mean=0.0168 ± 0.0139
Backdoor attack: Created poisoned datasets for 12 compromised nodes
Round 001: test acc mean=0.0195 ± 0.0186 | min=0.0023 max=0.0576
         : test loss mean=39475.8569 ± 21024.3632
         : individual accs = ['0.005814', '0.049964', '0.057584', '0.023540', '0.005133', '0.003499', '0.016456', '0.004139', '0.009306', '0.002338', '0.010862', '0.004770', '0.003176', '0.045032', '0.019497', '0.041698', '0.005538', '0.028448', '0.050930', '0.002907']
         : correct/total = [(24, 4128), (210, 4203), (235, 4081), (102, 4333), (21, 4091), (15, 4287), (69, 4193), (18, 4349), (39, 4191), (10, 4277), (45, 4143), (20, 4193), (13, 4093), (189, 4197), (79, 4052), (168, 4029), (23, 4153), (119, 4183), (208, 4084), (12, 4128)]
         : compromised: 0.0281, honest: 0.0066
Round 002: test acc mean=0.0490 ± 0.0041 | min=0.0383 max=0.0560
         : test loss mean=6363.8575 ± 2619.4880
         : individual accs = ['0.049176', '0.047109', '0.048272', '0.038311', '0.044977', '0.048752', '0.046745', '0.045528', '0.054880', '0.047463', '0.055998', '0.045314', '0.049841', '0.046462', '0.051579', '0.054852', '0.049362', '0.053311', '0.052155', '0.050388']
         : correct/total = [(203, 4128), (198, 4203), (197, 4081), (166, 4333), (184, 4091), (209, 4287), (196, 4193), (198, 4349), (230, 4191), (203, 4277), (232, 4143), (190, 4193), (204, 4093), (195, 4197), (209, 4052), (221, 4029), (205, 4153), (223, 4183), (213, 4084), (208, 4128)]
         : compromised: 0.0492, honest: 0.0487
Round 003: test acc mean=0.0510 ± 0.0038 | min=0.0439 max=0.0578
         : test loss mean=10086.3884 ± 3954.0376
         : individual accs = ['0.049176', '0.047109', '0.055134', '0.047773', '0.044977', '0.057849', '0.053899', '0.043918', '0.051539', '0.047463', '0.055274', '0.053184', '0.049841', '0.045747', '0.051579', '0.054852', '0.054418', '0.053311', '0.052155', '0.050388']
         : correct/total = [(203, 4128), (198, 4203), (225, 4081), (207, 4333), (184, 4091), (248, 4287), (226, 4193), (191, 4349), (216, 4191), (203, 4277), (229, 4143), (223, 4193), (204, 4093), (192, 4197), (209, 4052), (221, 4029), (226, 4153), (223, 4183), (213, 4084), (208, 4128)]
         : compromised: 0.0517, honest: 0.0499
Round 004: test acc mean=0.0465 ± 0.0068 | min=0.0355 max=0.0551
         : test loss mean=2723.2650 ± 1455.6542
         : individual accs = ['0.049176', '0.047109', '0.055134', '0.038311', '0.044977', '0.036856', '0.035535', '0.035640', '0.051539', '0.047463', '0.039585', '0.036728', '0.049841', '0.045747', '0.051579', '0.054852', '0.054418', '0.053311', '0.052155', '0.050388']
         : correct/total = [(203, 4128), (198, 4203), (225, 4081), (166, 4333), (184, 4091), (158, 4287), (149, 4193), (155, 4349), (216, 4191), (203, 4277), (164, 4143), (154, 4193), (204, 4093), (192, 4197), (209, 4052), (221, 4029), (226, 4153), (223, 4183), (213, 4084), (208, 4128)]
         : compromised: 0.0478, honest: 0.0446
Round 005: test acc mean=0.0395 ± 0.0087 | min=0.0286 max=0.0578
         : test loss mean=358.2247 ± 613.4438
         : individual accs = ['0.030523', '0.034737', '0.035531', '0.040157', '0.042288', '0.057849', '0.053899', '0.043918', '0.037700', '0.039280', '0.055274', '0.053184', '0.033716', '0.028592', '0.037759', '0.032266', '0.030340', '0.037533', '0.033301', '0.032219']
         : correct/total = [(126, 4128), (146, 4203), (145, 4081), (174, 4333), (173, 4091), (248, 4287), (226, 4193), (191, 4349), (158, 4191), (168, 4277), (229, 4143), (223, 4193), (138, 4093), (120, 4197), (153, 4052), (130, 4029), (126, 4153), (157, 4183), (136, 4084), (133, 4128)]
         : compromised: 0.0385, honest: 0.0410
Round 006: test acc mean=0.0425 ± 0.0074 | min=0.0261 max=0.0539
         : test loss mean=15.8101 ± 3.7178
         : individual accs = ['0.047238', '0.032834', '0.045087', '0.044773', '0.029333', '0.048752', '0.048891', '0.045528', '0.044619', '0.033668', '0.032585', '0.045314', '0.026142', '0.045747', '0.046397', '0.053860', '0.044546', '0.037533', '0.048482', '0.048692']
         : correct/total = [(195, 4128), (138, 4203), (184, 4081), (194, 4333), (120, 4091), (209, 4287), (205, 4193), (198, 4349), (187, 4191), (144, 4277), (135, 4143), (190, 4193), (107, 4093), (192, 4197), (188, 4052), (217, 4029), (185, 4153), (157, 4183), (198, 4084), (201, 4128)]
         : compromised: 0.0433, honest: 0.0413
Round 007: test acc mean=0.0447 ± 0.0037 | min=0.0365 max=0.0512
         : test loss mean=28.9901 ± 4.5672
         : individual accs = ['0.045785', '0.042589', '0.048763', '0.036464', '0.043266', '0.047352', '0.042213', '0.041619', '0.040802', '0.046528', '0.051171', '0.041736', '0.050818', '0.049559', '0.046644', '0.041698', '0.040693', '0.045900', '0.045788', '0.044331']
         : correct/total = [(189, 4128), (179, 4203), (199, 4081), (158, 4333), (177, 4091), (203, 4287), (177, 4193), (181, 4349), (171, 4191), (199, 4277), (212, 4143), (175, 4193), (208, 4093), (208, 4197), (189, 4052), (168, 4029), (169, 4153), (192, 4183), (187, 4084), (183, 4128)]
         : compromised: 0.0448, honest: 0.0445
Round 008: test acc mean=0.0417 ± 0.0079 | min=0.0283 max=0.0515
         : test loss mean=6.0706 ± 0.9565
         : individual accs = ['0.045785', '0.042589', '0.048763', '0.036464', '0.043266', '0.034756', '0.028619', '0.031272', '0.051539', '0.046528', '0.051171', '0.030766', '0.050818', '0.049559', '0.046644', '0.028295', '0.030821', '0.045900', '0.045788', '0.044331']
         : correct/total = [(189, 4128), (179, 4203), (199, 4081), (158, 4333), (177, 4091), (149, 4287), (120, 4193), (136, 4349), (216, 4191), (199, 4277), (212, 4143), (129, 4193), (208, 4093), (208, 4197), (189, 4052), (114, 4029), (128, 4153), (192, 4183), (187, 4084), (183, 4128)]
         : compromised: 0.0427, honest: 0.0402
Round 009: test acc mean=0.0434 ± 0.0074 | min=0.0150 max=0.0512
         : test loss mean=5.8266 ± 0.4000
         : individual accs = ['0.045785', '0.042589', '0.048763', '0.036464', '0.043266', '0.047352', '0.042213', '0.041619', '0.015032', '0.046528', '0.051171', '0.041736', '0.050818', '0.049559', '0.046644', '0.041698', '0.040693', '0.045900', '0.045788', '0.044331']
         : correct/total = [(189, 4128), (179, 4203), (199, 4081), (158, 4333), (177, 4091), (203, 4287), (177, 4193), (181, 4349), (63, 4191), (199, 4277), (212, 4143), (175, 4193), (208, 4093), (208, 4197), (189, 4052), (168, 4029), (169, 4153), (192, 4183), (187, 4084), (183, 4128)]
         : compromised: 0.0427, honest: 0.0445
Round 010: test acc mean=0.0318 ± 0.0087 | min=0.0215 max=0.0516
         : test loss mean=4.2988 ± 0.6451
         : individual accs = ['0.027132', '0.051630', '0.026464', '0.033003', '0.029333', '0.030324', '0.030050', '0.028052', '0.051539', '0.033668', '0.032585', '0.024326', '0.026142', '0.026686', '0.021471', '0.024820', '0.026246', '0.050203', '0.029383', '0.033430']
         : correct/total = [(112, 4128), (217, 4203), (108, 4081), (143, 4333), (120, 4091), (130, 4287), (126, 4193), (122, 4349), (216, 4191), (144, 4277), (135, 4143), (102, 4193), (107, 4093), (112, 4197), (87, 4052), (100, 4029), (109, 4153), (210, 4183), (120, 4084), (138, 4128)]
         : compromised: 0.0330, honest: 0.0301

=== FINAL RESULTS ===
Dataset: femnist, Nodes: 20, Graph: erdos, Aggregation: krum
Attack: backdoor, 60.0% compromised
Final accuracy - Compromised: 0.0330, Honest: 0.0301
Overall test accuracy: mean=0.0318 ± 0.0087

=== BACKDOOR ATTACK SUCCESS RATE (ASR) ===
Target label: 0
Trigger size: 4x4
Overall ASR: 0.0000 ± 0.0000
Honest nodes ASR: 0.0000 ± 0.0000
Compromised nodes ASR: 0.0000 ± 0.0000
Note: Higher ASR indicates more successful backdoor attack
