Device: cuda
Seed: 987654321
Loading 36 LEAF FEMNIST train files...
LEAF FEMNIST train: 3597 users, 734463 samples
Loading 36 LEAF FEMNIST test files...
LEAF FEMNIST test: 3597 users, 83388 samples
Found 3597 train users, 3597 test users, 3597 common users
User sample counts range: 525 (max) to 17 (min)
Distributed ALL 3597 users across 20 clients
Users per client: 179 (with 17 clients getting +1 user)
Train partition sizes: [36360, 37070, 35957, 38262, 36024, 37732, 36921, 38328, 36867, 37683, 36507, 36915, 36007, 37001, 35681, 35453, 36585, 36801, 35964, 36345]
Test partition sizes: [4128, 4203, 4081, 4333, 4091, 4287, 4193, 4349, 4191, 4277, 4143, 4193, 4093, 4197, 4052, 4029, 4153, 4183, 4084, 4128]
  Client 0: 36360 train samples, 62 unique classes
  Client 1: 37070 train samples, 62 unique classes
  Client 2: 35957 train samples, 62 unique classes
  Client 3: 38262 train samples, 62 unique classes
  Client 4: 36024 train samples, 62 unique classes
  Client 5: 37732 train samples, 62 unique classes
  Client 6: 36921 train samples, 62 unique classes
  Client 7: 38328 train samples, 62 unique classes
  Client 8: 36867 train samples, 62 unique classes
  Client 9: 37683 train samples, 62 unique classes
  Client 10: 36507 train samples, 62 unique classes
  Client 11: 36915 train samples, 62 unique classes
  Client 12: 36007 train samples, 62 unique classes
  Client 13: 37001 train samples, 62 unique classes
  Client 14: 35681 train samples, 62 unique classes
  Client 15: 35453 train samples, 62 unique classes
  Client 16: 36585 train samples, 62 unique classes
  Client 17: 36801 train samples, 62 unique classes
  Client 18: 35964 train samples, 62 unique classes
  Client 19: 36345 train samples, 62 unique classes
Will sample 4500 samples per client per epoch
Graph: erdos, nodes: 20, edges: 48
Degree statistics: avg=4.80, min=2, max=7
Attack: Compromised 12/20 nodes: [1, 2, 3, 5, 8, 11, 12, 13, 14, 15, 17, 18]
Attack type: krum, lambda: 1.0
Model variant: baseline
Model parameters: 6,603,710
UBAR ALGORITHM (Two-Stage Byzantine-resilient)
  - Model dimension: 6,603,710 parameters
  - Rho parameter: 0.4
  - Stage 1: Distance-based filtering (select 40% closest neighbors)
  - Stage 2: Performance-based selection (loss comparison)
  - Complexity: O(deg(i)×d + deg(i)×inference)
Initial test acc across nodes: mean=0.0168 ± 0.0139
Round 001: test acc mean=0.0527 ± 0.0126 | min=0.0036 max=0.0683
         : test loss mean=941.8514 ± 4088.0642
         : individual accs = ['0.059593', '0.067095', '0.054153', '0.068313', '0.058910', '0.052484', '0.057000', '0.051276', '0.053209', '0.047463', '0.048033', '0.053899', '0.062790', '0.003574', '0.048124', '0.050633', '0.058271', '0.050920', '0.052889', '0.054506']
         : correct/total = [(246, 4128), (282, 4203), (221, 4081), (296, 4333), (241, 4091), (225, 4287), (239, 4193), (223, 4349), (223, 4191), (203, 4277), (199, 4143), (226, 4193), (257, 4093), (15, 4197), (195, 4052), (204, 4029), (242, 4153), (213, 4183), (216, 4084), (225, 4128)]
         : compromised: 0.0515, honest: 0.0544
         : ubar stats = ['Node 0: s1=0.333, s2=0.500', 'Node 1: s1=0.333, s2=0.500', 'Node 2: s1=0.400, s2=0.500']...
Round 002: test acc mean=0.0503 ± 0.0052 | min=0.0363 max=0.0582
         : test loss mean=296.5498 ± 1276.1876
         : individual accs = ['0.044574', '0.051630', '0.053418', '0.052850', '0.057932', '0.050618', '0.044598', '0.058174', '0.053209', '0.050503', '0.045619', '0.036251', '0.054239', '0.045747', '0.051579', '0.053860', '0.049362', '0.050920', '0.055583', '0.045058']
         : correct/total = [(184, 4128), (217, 4203), (218, 4081), (229, 4333), (237, 4091), (217, 4287), (187, 4193), (253, 4349), (223, 4191), (216, 4277), (189, 4143), (152, 4193), (222, 4093), (192, 4197), (209, 4052), (217, 4029), (205, 4153), (213, 4183), (227, 4084), (186, 4128)]
         : compromised: 0.0508, honest: 0.0495
         : ubar stats = ['Node 0: s1=0.333, s2=0.750', 'Node 1: s1=0.333, s2=0.500', 'Node 2: s1=0.400, s2=0.500']...
Round 003: test acc mean=0.0574 ± 0.0132 | min=0.0457 max=0.0961
         : test loss mean=6.3996 ± 11.8074
         : individual accs = ['0.059593', '0.047109', '0.050968', '0.048234', '0.096065', '0.048052', '0.057000', '0.093585', '0.053209', '0.047697', '0.055274', '0.053184', '0.058637', '0.045747', '0.061204', '0.056342', '0.058271', '0.052116', '0.055583', '0.050388']
         : correct/total = [(246, 4128), (198, 4203), (208, 4081), (209, 4333), (393, 4091), (206, 4287), (239, 4193), (407, 4349), (223, 4191), (204, 4277), (229, 4143), (223, 4193), (240, 4093), (192, 4197), (248, 4052), (227, 4029), (242, 4153), (218, 4183), (227, 4084), (208, 4128)]
         : compromised: 0.0525, honest: 0.0647
         : ubar stats = ['Node 0: s1=0.333, s2=0.833', 'Node 1: s1=0.333, s2=0.500', 'Node 2: s1=0.400, s2=0.500']...
Round 004: test acc mean=0.0553 ± 0.0095 | min=0.0451 max=0.0921
         : test loss mean=42707.6604 ± 186142.2105
         : individual accs = ['0.059593', '0.052344', '0.092134', '0.052850', '0.057932', '0.052484', '0.057000', '0.051276', '0.053209', '0.053075', '0.045619', '0.054376', '0.054239', '0.045747', '0.061204', '0.056590', '0.058271', '0.050920', '0.052889', '0.045058']
         : correct/total = [(246, 4128), (220, 4203), (376, 4081), (229, 4333), (237, 4091), (225, 4287), (239, 4193), (223, 4349), (223, 4191), (227, 4277), (189, 4143), (228, 4193), (222, 4093), (192, 4197), (248, 4052), (228, 4029), (242, 4153), (213, 4183), (216, 4084), (186, 4128)]
         : compromised: 0.0566, honest: 0.0535
         : ubar stats = ['Node 0: s1=0.333, s2=0.875', 'Node 1: s1=0.333, s2=0.500', 'Node 2: s1=0.400, s2=0.500']...
Round 005: test acc mean=0.0524 ± 0.0052 | min=0.0434 max=0.0609
         : test loss mean=1811253.7937 ± 7895056.1756
         : individual accs = ['0.059593', '0.052344', '0.045087', '0.060928', '0.045710', '0.043387', '0.057000', '0.047827', '0.051062', '0.053776', '0.055998', '0.046745', '0.058637', '0.045747', '0.051826', '0.051378', '0.058271', '0.050920', '0.055583', '0.055475']
         : correct/total = [(246, 4128), (220, 4203), (184, 4081), (264, 4333), (187, 4091), (186, 4287), (239, 4193), (208, 4349), (214, 4191), (230, 4277), (232, 4143), (196, 4193), (240, 4093), (192, 4197), (210, 4052), (207, 4029), (242, 4153), (213, 4183), (227, 4084), (229, 4128)]
         : compromised: 0.0511, honest: 0.0542
         : ubar stats = ['Node 0: s1=0.333, s2=0.900', 'Node 1: s1=0.333, s2=0.500', 'Node 2: s1=0.400, s2=0.500']...
Round 006: test acc mean=0.0530 ± 0.0098 | min=0.0434 max=0.0885
         : test loss mean=538144516.7124 ± 2345717549.2333
         : individual accs = ['0.044574', '0.088508', '0.057584', '0.052850', '0.051088', '0.043387', '0.043883', '0.051276', '0.049630', '0.043722', '0.050447', '0.061770', '0.058637', '0.045747', '0.061204', '0.051378', '0.049362', '0.050920', '0.055583', '0.048450']
         : correct/total = [(184, 4128), (372, 4203), (235, 4081), (229, 4333), (209, 4091), (186, 4287), (184, 4193), (223, 4349), (208, 4191), (187, 4277), (209, 4143), (259, 4193), (240, 4093), (192, 4197), (248, 4052), (207, 4029), (205, 4153), (213, 4183), (227, 4084), (200, 4128)]
         : compromised: 0.0564, honest: 0.0479
         : ubar stats = ['Node 0: s1=0.333, s2=0.917', 'Node 1: s1=0.333, s2=0.500', 'Node 2: s1=0.400, s2=0.583']...
Round 007: test acc mean=0.0530 ± 0.0057 | min=0.0447 max=0.0691
         : test loss mean=179005.0452 ± 780248.7733
         : individual accs = ['0.054021', '0.052344', '0.057584', '0.044773', '0.047421', '0.050618', '0.054376', '0.058174', '0.053209', '0.044657', '0.055998', '0.053899', '0.058637', '0.047891', '0.051826', '0.056590', '0.069107', '0.045900', '0.048482', '0.055475']
         : correct/total = [(223, 4128), (220, 4203), (235, 4081), (194, 4333), (194, 4091), (217, 4287), (228, 4193), (253, 4349), (223, 4191), (191, 4277), (232, 4143), (226, 4193), (240, 4093), (201, 4197), (210, 4052), (228, 4029), (287, 4153), (192, 4183), (198, 4084), (229, 4128)]
         : compromised: 0.0518, honest: 0.0549
         : ubar stats = ['Node 0: s1=0.333, s2=0.857', 'Node 1: s1=0.333, s2=0.571', 'Node 2: s1=0.400, s2=0.571']...
Round 008: test acc mean=0.0620 ± 0.0198 | min=0.0430 max=0.1176
         : test loss mean=87289642.5017 ± 380486714.3985
         : individual accs = ['0.051599', '0.058530', '0.050723', '0.074775', '0.043021', '0.048052', '0.049606', '0.086687', '0.117633', '0.054010', '0.095342', '0.053899', '0.053750', '0.046938', '0.048124', '0.056342', '0.055141', '0.050203', '0.052889', '0.093023']
         : correct/total = [(213, 4128), (246, 4203), (207, 4081), (324, 4333), (176, 4091), (206, 4287), (208, 4193), (377, 4349), (493, 4191), (231, 4277), (395, 4143), (226, 4193), (220, 4093), (197, 4197), (195, 4052), (227, 4029), (229, 4153), (210, 4183), (216, 4084), (384, 4128)]
         : compromised: 0.0593, honest: 0.0661
         : ubar stats = ['Node 0: s1=0.333, s2=0.875', 'Node 1: s1=0.333, s2=0.625', 'Node 2: s1=0.400, s2=0.562']...
Round 009: test acc mean=0.0691 ± 0.0179 | min=0.0450 max=0.1039
         : test loss mean=850317587.4768 ± 3706448417.6306
         : individual accs = ['0.085271', '0.050916', '0.103896', '0.093238', '0.044977', '0.052018', '0.050799', '0.069211', '0.078263', '0.084405', '0.077963', '0.054376', '0.084290', '0.046938', '0.090079', '0.056342', '0.052011', '0.084867', '0.050196', '0.072674']
         : correct/total = [(352, 4128), (214, 4203), (424, 4081), (404, 4333), (184, 4091), (223, 4287), (213, 4193), (301, 4349), (328, 4191), (361, 4277), (323, 4143), (228, 4193), (345, 4093), (197, 4197), (365, 4052), (227, 4029), (216, 4153), (355, 4183), (205, 4084), (300, 4128)]
         : compromised: 0.0705, honest: 0.0672
         : ubar stats = ['Node 0: s1=0.333, s2=0.833', 'Node 1: s1=0.333, s2=0.611', 'Node 2: s1=0.400, s2=0.556']...
Round 010: test acc mean=0.0625 ± 0.0137 | min=0.0469 max=0.0967
         : test loss mean=2861397.0855 ± 12472524.6277
         : individual accs = ['0.074612', '0.056864', '0.054889', '0.096700', '0.057932', '0.085608', '0.049130', '0.058404', '0.047960', '0.053776', '0.060101', '0.053899', '0.091620', '0.046938', '0.062438', '0.056342', '0.065254', '0.063830', '0.055583', '0.058140']
         : correct/total = [(308, 4128), (239, 4203), (224, 4081), (419, 4333), (237, 4091), (367, 4287), (206, 4193), (254, 4349), (201, 4191), (230, 4277), (249, 4143), (226, 4193), (375, 4093), (197, 4197), (253, 4052), (227, 4029), (271, 4153), (267, 4183), (227, 4084), (240, 4128)]
         : compromised: 0.0644, honest: 0.0597
         : ubar stats = ['Node 0: s1=0.333, s2=0.850', 'Node 1: s1=0.333, s2=0.600', 'Node 2: s1=0.400, s2=0.550']...

=== FINAL RESULTS ===
Dataset: femnist, Nodes: 20, Graph: erdos, Aggregation: ubar
Attack: krum, 60.0% compromised
Final accuracy - Compromised: 0.0644, Honest: 0.0597
Overall test accuracy: mean=0.0625 ± 0.0137

=== UBAR SUMMARY ===
Node 0: stage1=0.333, stage2=0.850, overall=0.283
Node 1: stage1=0.333, stage2=0.600, overall=0.200
Node 2: stage1=0.400, stage2=0.550, overall=0.220
Node 3: stage1=0.250, stage2=1.000, overall=0.250
Node 4: stage1=0.250, stage2=1.000, overall=0.250
Node 5: stage1=0.400, stage2=0.500, overall=0.200
Node 6: stage1=0.400, stage2=0.500, overall=0.200
Node 7: stage1=0.400, stage2=0.750, overall=0.300
Node 8: stage1=0.500, stage2=1.000, overall=0.500
Node 9: stage1=0.333, stage2=1.000, overall=0.333
Node 10: stage1=0.250, stage2=1.000, overall=0.250
Node 11: stage1=0.286, stage2=0.600, overall=0.171
Node 12: stage1=0.286, stage2=0.600, overall=0.171
Node 13: stage1=0.250, stage2=1.000, overall=0.250
Node 14: stage1=0.286, stage2=0.500, overall=0.143
Node 15: stage1=0.333, stage2=0.700, overall=0.233
Node 16: stage1=0.400, stage2=0.500, overall=0.200
Node 17: stage1=0.400, stage2=0.600, overall=0.240
Node 18: stage1=0.250, stage2=1.000, overall=0.250
Node 19: stage1=0.500, stage2=1.000, overall=0.500

=== PARALLEL EXECUTION TIME (realistic for distributed system) ===
  COMMUNICATION (max across nodes):
    - Full model transfer: 0.000s (0.0%)
  COMPUTATION (max across nodes):
    - Distance computation: 0.028s (0.7%)
    - Loss computation: 4.172s (99.2%)
    - Aggregation: 0.006s (0.2%)
  TOTALS:
    - Total computation: 4.206s (100.0%)
    - Total communication: 0.000s (0.0%)
    - Total parallel time: 4.206s

=== PER-NODE AVERAGE TIME ===
  - Distance computation: 0.023s
  - Loss computation: 3.926s
  - Aggregation: 0.005s
  - Model transfer: 0.000s
  - Total per node: 3.954s

=== TOTAL COMPUTATIONAL WORK (sum across all nodes) ===
  - Total distance computation: 0.460s
  - Total loss computation: 78.522s
  - Total aggregation: 0.090s
  - Total model transfer: 0.000s
  - Grand total: 79.072s
  - Mean Stage 1 acceptance rate: 0.342
  - Mean Stage 2 acceptance rate: 0.763
  - Overall acceptance rate: 0.261

UBAR Algorithm Properties:
  - Model dimension: 6,603,710
  - Rho parameter: 0.4
  - Two-stage approach: Distance filtering + loss evaluation
  - Stage 1 selects: 40% of neighbors
  - Stage 2 uses: Training sample loss comparison
  - Theoretical complexity: O(deg(i)×d + deg(i)×inference)
  - Approach: UBAR paper implementation
