Device: cuda
Seed: 987654321
Loading 36 LEAF FEMNIST train files...
LEAF FEMNIST train: 3597 users, 734463 samples
Loading 36 LEAF FEMNIST test files...
LEAF FEMNIST test: 3597 users, 83388 samples
Found 3597 train users, 3597 test users, 3597 common users
User sample counts range: 525 (max) to 17 (min)
Distributed ALL 3597 users across 20 clients
Users per client: 179 (with 17 clients getting +1 user)
Train partition sizes: [36360, 37070, 35957, 38262, 36024, 37732, 36921, 38328, 36867, 37683, 36507, 36915, 36007, 37001, 35681, 35453, 36585, 36801, 35964, 36345]
Test partition sizes: [4128, 4203, 4081, 4333, 4091, 4287, 4193, 4349, 4191, 4277, 4143, 4193, 4093, 4197, 4052, 4029, 4153, 4183, 4084, 4128]
  Client 0: 36360 train samples, 62 unique classes
  Client 1: 37070 train samples, 62 unique classes
  Client 2: 35957 train samples, 62 unique classes
  Client 3: 38262 train samples, 62 unique classes
  Client 4: 36024 train samples, 62 unique classes
  Client 5: 37732 train samples, 62 unique classes
  Client 6: 36921 train samples, 62 unique classes
  Client 7: 38328 train samples, 62 unique classes
  Client 8: 36867 train samples, 62 unique classes
  Client 9: 37683 train samples, 62 unique classes
  Client 10: 36507 train samples, 62 unique classes
  Client 11: 36915 train samples, 62 unique classes
  Client 12: 36007 train samples, 62 unique classes
  Client 13: 37001 train samples, 62 unique classes
  Client 14: 35681 train samples, 62 unique classes
  Client 15: 35453 train samples, 62 unique classes
  Client 16: 36585 train samples, 62 unique classes
  Client 17: 36801 train samples, 62 unique classes
  Client 18: 35964 train samples, 62 unique classes
  Client 19: 36345 train samples, 62 unique classes
Will sample 4500 samples per client per epoch
Graph: ring, nodes: 20, edges: 20
Degree statistics: avg=2.00, min=2, max=2
Attack: Compromised 10/20 nodes: [1, 2, 5, 11, 12, 13, 14, 15, 17, 18]
Attack type: directed_deviation, lambda: 1.0
Model variant: baseline
Model parameters: 6,603,710
Initial test acc across nodes: mean=0.0168 ± 0.0139
Round 001: test acc mean=0.0287 ± 0.0201 | min=0.0029 max=0.0624
         : test loss mean=91154.8476 ± 155486.4122
         : individual accs = ['0.016715', '0.003331', '0.044597', '0.018925', '0.021266', '0.041754', '0.057000', '0.053116', '0.054880', '0.048398', '0.045619', '0.005247', '0.012460', '0.062426', '0.037759', '0.007942', '0.017337', '0.016734', '0.005142', '0.002907']
         : correct/total = [(69, 4128), (14, 4203), (182, 4081), (82, 4333), (87, 4091), (179, 4287), (239, 4193), (231, 4349), (230, 4191), (207, 4277), (189, 4143), (22, 4193), (51, 4093), (262, 4197), (153, 4052), (32, 4029), (72, 4153), (70, 4183), (21, 4084), (12, 4128)]
         : compromised: 0.0237, honest: 0.0336
Round 002: test acc mean=0.0484 ± 0.0028 | min=0.0435 max=0.0542
         : test loss mean=346114917.9319 ± 662776106.9599
         : individual accs = ['0.047238', '0.048775', '0.045087', '0.044773', '0.047421', '0.048752', '0.048891', '0.043918', '0.051062', '0.043488', '0.047309', '0.045314', '0.054239', '0.049083', '0.051826', '0.051626', '0.052011', '0.049486', '0.048482', '0.048692']
         : correct/total = [(195, 4128), (205, 4203), (184, 4081), (194, 4333), (194, 4091), (209, 4287), (205, 4193), (191, 4349), (214, 4191), (186, 4277), (196, 4143), (190, 4193), (222, 4093), (206, 4197), (210, 4052), (208, 4029), (216, 4153), (207, 4183), (198, 4084), (201, 4128)]
         : compromised: 0.0493, honest: 0.0475
Round 003: test acc mean=0.0421 ± 0.0132 | min=0.0164 max=0.0582
         : test loss mean=1881395960.5795 ± 8067605813.9320
         : individual accs = ['0.050145', '0.048775', '0.050723', '0.044080', '0.043510', '0.018428', '0.018841', '0.058174', '0.054880', '0.043488', '0.045619', '0.046983', '0.016369', '0.024065', '0.023198', '0.050881', '0.051047', '0.048052', '0.050196', '0.054506']
         : correct/total = [(207, 4128), (205, 4203), (207, 4081), (191, 4333), (178, 4091), (79, 4287), (79, 4193), (253, 4349), (230, 4191), (186, 4277), (189, 4143), (197, 4193), (67, 4093), (101, 4197), (94, 4052), (205, 4029), (212, 4153), (201, 4183), (205, 4084), (225, 4128)]
         : compromised: 0.0378, honest: 0.0464
Round 004: test acc mean=0.0413 ± 0.0134 | min=0.0145 max=0.0549
         : test loss mean=1685197330.3302 ± 7249338314.2069
         : individual accs = ['0.016231', '0.018320', '0.035531', '0.048465', '0.051088', '0.038955', '0.033389', '0.041389', '0.053209', '0.053776', '0.045619', '0.046983', '0.048620', '0.049559', '0.047878', '0.054852', '0.054418', '0.053311', '0.019344', '0.014535']
         : correct/total = [(67, 4128), (77, 4203), (145, 4081), (210, 4333), (209, 4091), (167, 4287), (140, 4193), (180, 4349), (223, 4191), (230, 4277), (189, 4143), (197, 4193), (199, 4093), (208, 4197), (194, 4052), (221, 4029), (226, 4153), (223, 4183), (79, 4084), (60, 4128)]
         : compromised: 0.0413, honest: 0.0412
Round 005: test acc mean=0.0473 ± 0.0063 | min=0.0263 max=0.0539
         : test loss mean=12805082.4192 ± 44275166.8111
         : individual accs = ['0.051599', '0.049726', '0.045087', '0.043388', '0.052554', '0.038955', '0.043883', '0.045068', '0.042233', '0.053776', '0.026309', '0.053899', '0.048620', '0.049559', '0.047878', '0.051626', '0.052011', '0.049486', '0.051665', '0.048450']
         : correct/total = [(213, 4128), (209, 4203), (184, 4081), (188, 4333), (215, 4091), (167, 4287), (184, 4193), (196, 4349), (177, 4191), (230, 4277), (109, 4143), (226, 4193), (199, 4093), (208, 4197), (194, 4052), (208, 4029), (216, 4153), (207, 4183), (211, 4084), (200, 4128)]
         : compromised: 0.0487, honest: 0.0459
Round 006: test acc mean=0.0487 ± 0.0073 | min=0.0291 max=0.0583
         : test loss mean=7473275.6586 ± 31627197.7158
         : individual accs = ['0.029070', '0.047109', '0.052683', '0.043388', '0.052554', '0.038955', '0.057000', '0.043918', '0.053209', '0.053776', '0.045619', '0.046983', '0.054239', '0.049083', '0.051826', '0.056590', '0.058271', '0.050920', '0.052155', '0.035853']
         : correct/total = [(120, 4128), (198, 4203), (215, 4081), (188, 4333), (215, 4091), (167, 4287), (239, 4193), (191, 4349), (223, 4191), (230, 4277), (189, 4143), (197, 4193), (222, 4093), (206, 4197), (210, 4052), (228, 4029), (242, 4153), (213, 4183), (213, 4084), (148, 4128)]
         : compromised: 0.0501, honest: 0.0473
Round 007: test acc mean=0.0478 ± 0.0089 | min=0.0184 max=0.0582
         : test loss mean=1523.2799 ± 3416.7002
         : individual accs = ['0.051599', '0.042589', '0.057584', '0.038311', '0.037644', '0.018428', '0.053899', '0.058174', '0.053209', '0.053776', '0.041999', '0.046983', '0.048620', '0.049559', '0.047878', '0.056342', '0.055141', '0.050203', '0.045788', '0.048450']
         : correct/total = [(213, 4128), (179, 4203), (235, 4081), (166, 4333), (154, 4091), (79, 4287), (226, 4193), (253, 4349), (223, 4191), (230, 4277), (174, 4143), (197, 4193), (199, 4093), (208, 4197), (194, 4052), (227, 4029), (229, 4153), (210, 4183), (187, 4084), (200, 4128)]
         : compromised: 0.0464, honest: 0.0492
Round 008: test acc mean=0.0518 ± 0.0059 | min=0.0426 max=0.0624
         : test loss mean=43.8374 ± 53.7112
         : individual accs = ['0.050145', '0.042589', '0.052683', '0.043388', '0.052554', '0.052484', '0.057000', '0.058174', '0.053209', '0.053776', '0.055998', '0.046983', '0.058637', '0.062426', '0.061204', '0.053860', '0.044546', '0.045900', '0.045788', '0.045058']
         : correct/total = [(207, 4128), (179, 4203), (215, 4081), (188, 4333), (215, 4091), (225, 4287), (239, 4193), (253, 4349), (223, 4191), (230, 4277), (232, 4143), (197, 4193), (240, 4093), (262, 4197), (248, 4052), (217, 4029), (185, 4153), (192, 4183), (187, 4084), (186, 4128)]
         : compromised: 0.0523, honest: 0.0514
Round 009: test acc mean=0.0492 ± 0.0059 | min=0.0376 max=0.0582
         : test loss mean=8756470.5278 ± 20846619.5138
         : individual accs = ['0.050145', '0.042589', '0.057584', '0.038311', '0.037644', '0.047352', '0.049130', '0.058174', '0.053209', '0.053776', '0.041999', '0.046983', '0.054239', '0.049083', '0.051826', '0.056342', '0.055141', '0.050203', '0.045788', '0.045058']
         : correct/total = [(207, 4128), (179, 4203), (235, 4081), (166, 4333), (154, 4091), (203, 4287), (206, 4193), (253, 4349), (223, 4191), (230, 4277), (174, 4143), (197, 4193), (222, 4093), (206, 4197), (210, 4052), (227, 4029), (229, 4153), (210, 4183), (187, 4084), (186, 4128)]
         : compromised: 0.0502, honest: 0.0483
Round 010: test acc mean=0.0520 ± 0.0046 | min=0.0430 max=0.0596
         : test loss mean=40283825.1786 ± 95631512.4289
         : individual accs = ['0.059593', '0.047109', '0.057584', '0.043157', '0.043021', '0.050618', '0.057000', '0.058174', '0.053209', '0.053776', '0.055998', '0.046983', '0.054239', '0.049083', '0.051826', '0.050881', '0.051047', '0.048291', '0.052155', '0.055475']
         : correct/total = [(246, 4128), (198, 4203), (235, 4081), (187, 4333), (176, 4091), (217, 4287), (239, 4193), (253, 4349), (223, 4191), (230, 4277), (232, 4143), (197, 4193), (222, 4093), (206, 4197), (210, 4052), (205, 4029), (212, 4153), (202, 4183), (213, 4084), (229, 4128)]
         : compromised: 0.0509, honest: 0.0530

=== FINAL RESULTS ===
Dataset: femnist, Nodes: 20, Graph: ring, Aggregation: d-fedavg
Attack: directed_deviation, 50.0% compromised
Final accuracy - Compromised: 0.0509, Honest: 0.0530
Overall test accuracy: mean=0.0520 ± 0.0046
