Device: cuda
Seed: 987654321
Loading 36 LEAF FEMNIST train files...
LEAF FEMNIST train: 3597 users, 734463 samples
Loading 36 LEAF FEMNIST test files...
LEAF FEMNIST test: 3597 users, 83388 samples
Found 3597 train users, 3597 test users, 3597 common users
User sample counts range: 525 (max) to 17 (min)
Distributed ALL 3597 users across 20 clients
Users per client: 179 (with 17 clients getting +1 user)
Train partition sizes: [36360, 37070, 35957, 38262, 36024, 37732, 36921, 38328, 36867, 37683, 36507, 36915, 36007, 37001, 35681, 35453, 36585, 36801, 35964, 36345]
Test partition sizes: [4128, 4203, 4081, 4333, 4091, 4287, 4193, 4349, 4191, 4277, 4143, 4193, 4093, 4197, 4052, 4029, 4153, 4183, 4084, 4128]
  Client 0: 36360 train samples, 62 unique classes
  Client 1: 37070 train samples, 62 unique classes
  Client 2: 35957 train samples, 62 unique classes
  Client 3: 38262 train samples, 62 unique classes
  Client 4: 36024 train samples, 62 unique classes
  Client 5: 37732 train samples, 62 unique classes
  Client 6: 36921 train samples, 62 unique classes
  Client 7: 38328 train samples, 62 unique classes
  Client 8: 36867 train samples, 62 unique classes
  Client 9: 37683 train samples, 62 unique classes
  Client 10: 36507 train samples, 62 unique classes
  Client 11: 36915 train samples, 62 unique classes
  Client 12: 36007 train samples, 62 unique classes
  Client 13: 37001 train samples, 62 unique classes
  Client 14: 35681 train samples, 62 unique classes
  Client 15: 35453 train samples, 62 unique classes
  Client 16: 36585 train samples, 62 unique classes
  Client 17: 36801 train samples, 62 unique classes
  Client 18: 35964 train samples, 62 unique classes
  Client 19: 36345 train samples, 62 unique classes
Will sample 4500 samples per client per epoch
Graph: erdos, nodes: 20, edges: 99
Degree statistics: avg=9.90, min=7, max=14
Attack: Compromised 6/20 nodes: [5, 12, 13, 14, 17, 18]
Attack type: directed_deviation, lambda: 1.0
Model variant: baseline
Model parameters: 6,603,710
Initial test acc across nodes: mean=0.0168 ± 0.0139
Round 001: test acc mean=0.0133 ± 0.0132 | min=0.0037 max=0.0529
         : test loss mean=7416.6655 ± 15708.6503
         : individual accs = ['0.005814', '0.022127', '0.019358', '0.052850', '0.004155', '0.008631', '0.010971', '0.004139', '0.004772', '0.003741', '0.005793', '0.006916', '0.010017', '0.016679', '0.046397', '0.007942', '0.005538', '0.017213', '0.006366', '0.006298']
         : correct/total = [(24, 4128), (93, 4203), (79, 4081), (229, 4333), (17, 4091), (37, 4287), (46, 4193), (18, 4349), (20, 4191), (16, 4277), (24, 4143), (29, 4193), (41, 4093), (70, 4197), (188, 4052), (32, 4029), (23, 4153), (72, 4183), (26, 4084), (26, 4128)]
         : compromised: 0.0176, honest: 0.0115
Round 002: test acc mean=0.0476 ± 0.0031 | min=0.0445 max=0.0570
         : test loss mean=1002443.3823 ± 3745417.1475
         : individual accs = ['0.049176', '0.048775', '0.045087', '0.044773', '0.047421', '0.048752', '0.057000', '0.045528', '0.044619', '0.047697', '0.047309', '0.045314', '0.049597', '0.045747', '0.046397', '0.053860', '0.044546', '0.045900', '0.048482', '0.045058']
         : correct/total = [(203, 4128), (205, 4203), (184, 4081), (194, 4333), (194, 4091), (209, 4287), (239, 4193), (198, 4349), (187, 4191), (204, 4277), (196, 4143), (190, 4193), (203, 4093), (192, 4197), (188, 4052), (217, 4029), (185, 4153), (192, 4183), (198, 4084), (186, 4128)]
         : compromised: 0.0475, honest: 0.0476
Round 003: test acc mean=0.0450 ± 0.0113 | min=0.0161 max=0.0576
         : test loss mean=1756.8903 ± 7538.4446
         : individual accs = ['0.051599', '0.051630', '0.057584', '0.040157', '0.016133', '0.048052', '0.023372', '0.041389', '0.051062', '0.053075', '0.050447', '0.021703', '0.053750', '0.046938', '0.048124', '0.051378', '0.040693', '0.050203', '0.052889', '0.050145']
         : correct/total = [(213, 4128), (217, 4203), (235, 4081), (174, 4333), (66, 4091), (206, 4287), (98, 4193), (180, 4349), (214, 4191), (227, 4277), (209, 4143), (91, 4193), (220, 4093), (197, 4197), (195, 4052), (207, 4029), (169, 4153), (210, 4183), (216, 4084), (207, 4128)]
         : compromised: 0.0500, honest: 0.0429
Round 004: test acc mean=0.0491 ± 0.0074 | min=0.0178 max=0.0539
         : test loss mean=36.0632 ± 39.0949
         : individual accs = ['0.051599', '0.051630', '0.050723', '0.017771', '0.051088', '0.048052', '0.049130', '0.049207', '0.053209', '0.053075', '0.050447', '0.053899', '0.053750', '0.046938', '0.048124', '0.050633', '0.051288', '0.050203', '0.052889', '0.048450']
         : correct/total = [(213, 4128), (217, 4203), (207, 4081), (77, 4333), (209, 4091), (206, 4287), (206, 4193), (214, 4349), (223, 4191), (227, 4277), (209, 4143), (226, 4193), (220, 4093), (197, 4197), (195, 4052), (204, 4029), (213, 4153), (210, 4183), (216, 4084), (200, 4128)]
         : compromised: 0.0500, honest: 0.0487
Round 005: test acc mean=0.0443 ± 0.0144 | min=0.0159 max=0.0624
         : test loss mean=6.3108 ± 4.3528
         : individual accs = ['0.050145', '0.048775', '0.057584', '0.052850', '0.051088', '0.050618', '0.023372', '0.019545', '0.047960', '0.044891', '0.055998', '0.021703', '0.058637', '0.062426', '0.048124', '0.022338', '0.015892', '0.050203', '0.055583', '0.048450']
         : correct/total = [(207, 4128), (205, 4203), (235, 4081), (229, 4333), (209, 4091), (217, 4287), (98, 4193), (85, 4349), (201, 4191), (192, 4277), (232, 4143), (91, 4193), (240, 4093), (262, 4197), (195, 4052), (90, 4029), (66, 4153), (210, 4183), (227, 4084), (200, 4128)]
         : compromised: 0.0543, honest: 0.0400
Round 006: test acc mean=0.0491 ± 0.0109 | min=0.0044 max=0.0583
         : test loss mean=14.8964 ± 24.6311
         : individual accs = ['0.049661', '0.048775', '0.054889', '0.046619', '0.052066', '0.045953', '0.057000', '0.004369', '0.053209', '0.053776', '0.047550', '0.053899', '0.052040', '0.055278', '0.048124', '0.056342', '0.058271', '0.048291', '0.050196', '0.045058']
         : correct/total = [(205, 4128), (205, 4203), (224, 4081), (202, 4333), (213, 4091), (197, 4287), (239, 4193), (19, 4349), (223, 4191), (230, 4277), (197, 4143), (226, 4193), (213, 4093), (232, 4197), (195, 4052), (227, 4029), (242, 4153), (202, 4183), (205, 4084), (186, 4128)]
         : compromised: 0.0500, honest: 0.0487
Round 007: test acc mean=0.0452 ± 0.0149 | min=0.0150 max=0.0624
         : test loss mean=5.2274 ± 3.1677
         : individual accs = ['0.059593', '0.048775', '0.057584', '0.052850', '0.057932', '0.050618', '0.028619', '0.019545', '0.015032', '0.050503', '0.048033', '0.021703', '0.058637', '0.062426', '0.061204', '0.028295', '0.030821', '0.050920', '0.055583', '0.045058']
         : correct/total = [(246, 4128), (205, 4203), (235, 4081), (229, 4333), (237, 4091), (217, 4287), (120, 4193), (85, 4349), (63, 4191), (216, 4277), (199, 4143), (91, 4193), (240, 4093), (262, 4197), (248, 4052), (114, 4029), (128, 4153), (213, 4183), (227, 4084), (186, 4128)]
         : compromised: 0.0566, honest: 0.0403
Round 008: test acc mean=0.0509 ± 0.0044 | min=0.0451 max=0.0583
         : test loss mean=10.0491 ± 16.1988
         : individual accs = ['0.049661', '0.048775', '0.054889', '0.046619', '0.052066', '0.045953', '0.057000', '0.058174', '0.053209', '0.053776', '0.047550', '0.053899', '0.045688', '0.046462', '0.045656', '0.056590', '0.058271', '0.048291', '0.050930', '0.045058']
         : correct/total = [(205, 4128), (205, 4203), (224, 4081), (202, 4333), (213, 4091), (197, 4287), (239, 4193), (253, 4349), (223, 4191), (230, 4277), (197, 4143), (226, 4193), (187, 4093), (195, 4197), (185, 4052), (228, 4029), (242, 4153), (202, 4183), (208, 4084), (186, 4128)]
         : compromised: 0.0472, honest: 0.0525
Round 009: test acc mean=0.0453 ± 0.0138 | min=0.0150 max=0.0612
         : test loss mean=4.7420 ± 2.4217
         : individual accs = ['0.059593', '0.048775', '0.057584', '0.052850', '0.057932', '0.050618', '0.028619', '0.019545', '0.015032', '0.050503', '0.048033', '0.030766', '0.054239', '0.049083', '0.061204', '0.028295', '0.030821', '0.050920', '0.055583', '0.055475']
         : correct/total = [(246, 4128), (205, 4203), (235, 4081), (229, 4333), (237, 4091), (217, 4287), (120, 4193), (85, 4349), (63, 4191), (216, 4277), (199, 4143), (129, 4193), (222, 4093), (206, 4197), (248, 4052), (114, 4029), (128, 4153), (213, 4183), (227, 4084), (229, 4128)]
         : compromised: 0.0536, honest: 0.0417
Round 010: test acc mean=0.0508 ± 0.0045 | min=0.0420 max=0.0583
         : test loss mean=7.9768 ± 12.4315
         : individual accs = ['0.050145', '0.050916', '0.054889', '0.046619', '0.052554', '0.045953', '0.057000', '0.058174', '0.053209', '0.053776', '0.041999', '0.053899', '0.045688', '0.046462', '0.051826', '0.050633', '0.058271', '0.048291', '0.050930', '0.045058']
         : correct/total = [(207, 4128), (214, 4203), (224, 4081), (202, 4333), (215, 4091), (197, 4287), (239, 4193), (253, 4349), (223, 4191), (230, 4277), (174, 4143), (226, 4193), (187, 4093), (195, 4197), (210, 4052), (204, 4029), (242, 4153), (202, 4183), (208, 4084), (186, 4128)]
         : compromised: 0.0482, honest: 0.0519

=== FINAL RESULTS ===
Dataset: femnist, Nodes: 20, Graph: erdos, Aggregation: d-fedavg
Attack: directed_deviation, 30.0% compromised
Final accuracy - Compromised: 0.0482, Honest: 0.0519
Overall test accuracy: mean=0.0508 ± 0.0045
