Device: cuda
Seed: 987654321
Loading 36 LEAF FEMNIST train files...
LEAF FEMNIST train: 3597 users, 734463 samples
Loading 36 LEAF FEMNIST test files...
LEAF FEMNIST test: 3597 users, 83388 samples
Found 3597 train users, 3597 test users, 3597 common users
User sample counts range: 525 (max) to 17 (min)
Distributed ALL 3597 users across 20 clients
Users per client: 179 (with 17 clients getting +1 user)
Train partition sizes: [36360, 37070, 35957, 38262, 36024, 37732, 36921, 38328, 36867, 37683, 36507, 36915, 36007, 37001, 35681, 35453, 36585, 36801, 35964, 36345]
Test partition sizes: [4128, 4203, 4081, 4333, 4091, 4287, 4193, 4349, 4191, 4277, 4143, 4193, 4093, 4197, 4052, 4029, 4153, 4183, 4084, 4128]
  Client 0: 36360 train samples, 62 unique classes
  Client 1: 37070 train samples, 62 unique classes
  Client 2: 35957 train samples, 62 unique classes
  Client 3: 38262 train samples, 62 unique classes
  Client 4: 36024 train samples, 62 unique classes
  Client 5: 37732 train samples, 62 unique classes
  Client 6: 36921 train samples, 62 unique classes
  Client 7: 38328 train samples, 62 unique classes
  Client 8: 36867 train samples, 62 unique classes
  Client 9: 37683 train samples, 62 unique classes
  Client 10: 36507 train samples, 62 unique classes
  Client 11: 36915 train samples, 62 unique classes
  Client 12: 36007 train samples, 62 unique classes
  Client 13: 37001 train samples, 62 unique classes
  Client 14: 35681 train samples, 62 unique classes
  Client 15: 35453 train samples, 62 unique classes
  Client 16: 36585 train samples, 62 unique classes
  Client 17: 36801 train samples, 62 unique classes
  Client 18: 35964 train samples, 62 unique classes
  Client 19: 36345 train samples, 62 unique classes
Will sample 4500 samples per client per epoch
Graph: erdos, nodes: 20, edges: 126
Degree statistics: avg=12.60, min=8, max=16
Attack: Compromised 2/20 nodes: [5, 13]
Attack type: backdoor, lambda: 1.0
Backdoor target label: 0, trigger size: 4
Model variant: baseline
Model parameters: 6,603,710
Initial test acc across nodes: mean=0.0168 ± 0.0139
Backdoor attack: Created poisoned datasets for 2 compromised nodes
Round 001: test acc mean=0.0295 ± 0.0183 | min=0.0022 max=0.0566
         : test loss mean=90.2211 ± 149.8587
         : individual accs = ['0.013808', '0.051630', '0.045332', '0.018925', '0.020777', '0.047352', '0.044598', '0.047827', '0.012646', '0.012859', '0.055998', '0.006201', '0.034938', '0.013105', '0.006910', '0.056590', '0.051047', '0.022472', '0.002204', '0.024467']
         : correct/total = [(57, 4128), (217, 4203), (185, 4081), (82, 4333), (85, 4091), (203, 4287), (187, 4193), (208, 4349), (53, 4191), (55, 4277), (232, 4143), (26, 4193), (143, 4093), (55, 4197), (28, 4052), (228, 4029), (212, 4153), (94, 4183), (9, 4084), (101, 4128)]
         : compromised: 0.0302, honest: 0.0294
Round 002: test acc mean=0.0408 ± 0.0115 | min=0.0137 max=0.0512
         : test loss mean=579.1887 ± 923.7653
         : individual accs = ['0.045785', '0.042589', '0.048763', '0.015232', '0.043266', '0.047352', '0.042213', '0.041619', '0.040802', '0.046528', '0.051171', '0.049606', '0.013682', '0.049559', '0.046644', '0.013899', '0.040693', '0.045900', '0.045788', '0.044331']
         : correct/total = [(189, 4128), (179, 4203), (199, 4081), (66, 4333), (177, 4091), (203, 4287), (177, 4193), (181, 4349), (171, 4191), (199, 4277), (212, 4143), (208, 4193), (56, 4093), (208, 4197), (189, 4052), (56, 4029), (169, 4153), (192, 4183), (187, 4084), (183, 4128)]
         : compromised: 0.0485, honest: 0.0399
Round 003: test acc mean=0.0444 ± 0.0077 | min=0.0286 max=0.0582
         : test loss mean=4.2469 ± 0.3344
         : individual accs = ['0.051599', '0.048775', '0.035531', '0.044773', '0.047421', '0.048052', '0.035535', '0.058174', '0.037700', '0.047697', '0.047309', '0.036728', '0.049597', '0.028592', '0.037759', '0.056342', '0.044546', '0.050203', '0.033301', '0.048450']
         : correct/total = [(213, 4128), (205, 4203), (145, 4081), (194, 4333), (194, 4091), (206, 4287), (149, 4193), (253, 4349), (158, 4191), (204, 4277), (196, 4143), (154, 4193), (203, 4093), (120, 4197), (153, 4052), (227, 4029), (185, 4153), (210, 4183), (136, 4084), (200, 4128)]
         : compromised: 0.0383, honest: 0.0451
Round 004: test acc mean=0.0494 ± 0.0034 | min=0.0430 max=0.0551
         : test loss mean=4.2009 ± 0.3264
         : individual accs = ['0.050145', '0.048775', '0.053418', '0.043157', '0.043021', '0.045253', '0.050799', '0.043918', '0.049630', '0.047463', '0.048033', '0.049606', '0.049841', '0.049083', '0.051826', '0.051626', '0.055141', '0.049486', '0.052889', '0.054506']
         : correct/total = [(207, 4128), (205, 4203), (218, 4081), (187, 4333), (176, 4091), (194, 4287), (213, 4193), (191, 4349), (208, 4191), (203, 4277), (199, 4143), (208, 4193), (204, 4093), (206, 4197), (210, 4052), (208, 4029), (229, 4153), (207, 4183), (216, 4084), (225, 4128)]
         : compromised: 0.0472, honest: 0.0496
Round 005: test acc mean=0.0491 ± 0.0030 | min=0.0445 max=0.0545
         : test loss mean=4.0133 ± 0.1956
         : individual accs = ['0.050145', '0.048775', '0.053418', '0.044773', '0.047421', '0.045253', '0.050799', '0.045528', '0.049630', '0.047697', '0.047309', '0.049606', '0.049597', '0.049083', '0.051826', '0.053860', '0.044546', '0.045900', '0.052889', '0.054506']
         : correct/total = [(207, 4128), (205, 4203), (218, 4081), (194, 4333), (194, 4091), (194, 4287), (213, 4193), (198, 4349), (208, 4191), (204, 4277), (196, 4143), (208, 4193), (203, 4093), (206, 4197), (210, 4052), (217, 4029), (185, 4153), (192, 4183), (216, 4084), (225, 4128)]
         : compromised: 0.0472, honest: 0.0493
Round 006: test acc mean=0.0510 ± 0.0023 | min=0.0453 max=0.0551
         : test loss mean=4.2661 ± 0.2544
         : individual accs = ['0.049176', '0.051630', '0.053418', '0.047773', '0.051088', '0.045253', '0.050799', '0.051276', '0.049630', '0.053075', '0.050447', '0.049606', '0.053750', '0.049083', '0.051826', '0.054852', '0.055141', '0.050203', '0.052155', '0.050388']
         : correct/total = [(203, 4128), (217, 4203), (218, 4081), (207, 4333), (209, 4091), (194, 4287), (213, 4193), (223, 4349), (208, 4191), (227, 4277), (209, 4143), (208, 4193), (220, 4093), (206, 4197), (210, 4052), (221, 4029), (229, 4153), (210, 4183), (213, 4084), (208, 4128)]
         : compromised: 0.0472, honest: 0.0515
Round 007: test acc mean=0.0486 ± 0.0032 | min=0.0416 max=0.0539
         : test loss mean=3.9096 ± 0.1388
         : individual accs = ['0.050145', '0.048775', '0.053418', '0.044773', '0.047421', '0.045253', '0.050799', '0.041619', '0.049630', '0.046528', '0.047309', '0.049606', '0.050818', '0.049083', '0.051826', '0.053860', '0.044546', '0.045900', '0.052889', '0.048692']
         : correct/total = [(207, 4128), (205, 4203), (218, 4081), (194, 4333), (194, 4091), (194, 4287), (213, 4193), (181, 4349), (208, 4191), (199, 4277), (196, 4143), (208, 4193), (208, 4093), (206, 4197), (210, 4052), (217, 4029), (185, 4153), (192, 4183), (216, 4084), (201, 4128)]
         : compromised: 0.0472, honest: 0.0488
Round 008: test acc mean=0.0512 ± 0.0025 | min=0.0453 max=0.0563
         : test loss mean=4.0799 ± 0.1967
         : individual accs = ['0.051599', '0.051630', '0.053418', '0.048465', '0.051088', '0.045253', '0.050799', '0.051276', '0.049630', '0.053075', '0.050447', '0.049606', '0.053750', '0.049083', '0.051826', '0.056342', '0.055141', '0.050203', '0.052889', '0.048450']
         : correct/total = [(213, 4128), (217, 4203), (218, 4081), (210, 4333), (209, 4091), (194, 4287), (213, 4193), (223, 4349), (208, 4191), (227, 4277), (209, 4143), (208, 4193), (220, 4093), (206, 4197), (210, 4052), (227, 4029), (229, 4153), (210, 4183), (216, 4084), (200, 4128)]
         : compromised: 0.0472, honest: 0.0516
Round 009: test acc mean=0.0465 ± 0.0044 | min=0.0365 max=0.0534
         : test loss mean=3.8430 ± 0.1238
         : individual accs = ['0.050145', '0.042589', '0.053418', '0.036464', '0.043266', '0.045253', '0.050799', '0.041619', '0.049630', '0.046528', '0.051171', '0.049606', '0.050818', '0.049083', '0.051826', '0.041698', '0.040693', '0.045900', '0.045788', '0.044331']
         : correct/total = [(207, 4128), (179, 4203), (218, 4081), (158, 4333), (177, 4091), (194, 4287), (213, 4193), (181, 4349), (208, 4191), (199, 4277), (212, 4143), (208, 4193), (208, 4093), (206, 4197), (210, 4052), (168, 4029), (169, 4153), (192, 4183), (187, 4084), (183, 4128)]
         : compromised: 0.0472, honest: 0.0465
Round 010: test acc mean=0.0507 ± 0.0031 | min=0.0438 max=0.0563
         : test loss mean=4.0295 ± 0.1638
         : individual accs = ['0.050145', '0.051630', '0.053418', '0.047773', '0.051088', '0.045253', '0.050799', '0.051276', '0.049630', '0.053075', '0.050447', '0.049606', '0.053750', '0.049083', '0.051826', '0.056342', '0.055141', '0.046139', '0.052889', '0.043847']
         : correct/total = [(207, 4128), (217, 4203), (218, 4081), (207, 4333), (209, 4091), (194, 4287), (213, 4193), (223, 4349), (208, 4191), (227, 4277), (209, 4143), (208, 4193), (220, 4093), (206, 4197), (210, 4052), (227, 4029), (229, 4153), (193, 4183), (216, 4084), (181, 4128)]
         : compromised: 0.0472, honest: 0.0510

=== FINAL RESULTS ===
Dataset: femnist, Nodes: 20, Graph: erdos, Aggregation: d-fedavg
Attack: backdoor, 10.0% compromised
Final accuracy - Compromised: 0.0472, Honest: 0.0510
Overall test accuracy: mean=0.0507 ± 0.0031

=== BACKDOOR ATTACK SUCCESS RATE (ASR) ===
Target label: 0
Trigger size: 4x4
Overall ASR: 0.4500 ± 0.4975
Honest nodes ASR: 0.3889 ± 0.4875
Compromised nodes ASR: 1.0000 ± 0.0000
Note: Higher ASR indicates more successful backdoor attack
