Device: cuda
Seed: 987654321
Loading 36 LEAF FEMNIST train files...
LEAF FEMNIST train: 3597 users, 734463 samples
Loading 36 LEAF FEMNIST test files...
LEAF FEMNIST test: 3597 users, 83388 samples
Found 3597 train users, 3597 test users, 3597 common users
User sample counts range: 525 (max) to 17 (min)
Distributed ALL 3597 users across 20 clients
Users per client: 179 (with 17 clients getting +1 user)
Train partition sizes: [36360, 37070, 35957, 38262, 36024, 37732, 36921, 38328, 36867, 37683, 36507, 36915, 36007, 37001, 35681, 35453, 36585, 36801, 35964, 36345]
Test partition sizes: [4128, 4203, 4081, 4333, 4091, 4287, 4193, 4349, 4191, 4277, 4143, 4193, 4093, 4197, 4052, 4029, 4153, 4183, 4084, 4128]
  Client 0: 36360 train samples, 62 unique classes
  Client 1: 37070 train samples, 62 unique classes
  Client 2: 35957 train samples, 62 unique classes
  Client 3: 38262 train samples, 62 unique classes
  Client 4: 36024 train samples, 62 unique classes
  Client 5: 37732 train samples, 62 unique classes
  Client 6: 36921 train samples, 62 unique classes
  Client 7: 38328 train samples, 62 unique classes
  Client 8: 36867 train samples, 62 unique classes
  Client 9: 37683 train samples, 62 unique classes
  Client 10: 36507 train samples, 62 unique classes
  Client 11: 36915 train samples, 62 unique classes
  Client 12: 36007 train samples, 62 unique classes
  Client 13: 37001 train samples, 62 unique classes
  Client 14: 35681 train samples, 62 unique classes
  Client 15: 35453 train samples, 62 unique classes
  Client 16: 36585 train samples, 62 unique classes
  Client 17: 36801 train samples, 62 unique classes
  Client 18: 35964 train samples, 62 unique classes
  Client 19: 36345 train samples, 62 unique classes
Will sample 4500 samples per client per epoch
Graph: ring, nodes: 20, edges: 20
Degree statistics: avg=2.00, min=2, max=2
Attack: Compromised 4/20 nodes: [5, 12, 13, 17]
Attack type: directed_deviation, lambda: 1.0
Model variant: baseline
Model parameters: 6,603,710
Initial test acc across nodes: mean=0.0168 ± 0.0139
Round 001: test acc mean=0.0419 ± 0.0180 | min=0.0035 max=0.0624
         : test loss mean=7906.8947 ± 18801.7459
         : individual accs = ['0.051599', '0.051630', '0.055134', '0.047773', '0.006111', '0.003499', '0.049130', '0.053116', '0.054880', '0.048398', '0.055274', '0.045314', '0.025409', '0.024065', '0.062438', '0.056590', '0.051288', '0.005259', '0.040402', '0.050145']
         : correct/total = [(213, 4128), (217, 4203), (225, 4081), (207, 4333), (25, 4091), (15, 4287), (206, 4193), (231, 4349), (230, 4191), (207, 4277), (229, 4143), (190, 4193), (104, 4093), (101, 4197), (253, 4052), (228, 4029), (213, 4153), (22, 4183), (165, 4084), (207, 4128)]
         : compromised: 0.0146, honest: 0.0487
Round 002: test acc mean=0.0480 ± 0.0055 | min=0.0303 max=0.0552
         : test loss mean=58858499.3028 ± 148352864.2507
         : individual accs = ['0.051599', '0.046158', '0.050723', '0.052850', '0.052554', '0.030324', '0.042213', '0.043918', '0.051062', '0.055179', '0.047550', '0.046983', '0.050574', '0.047177', '0.051826', '0.050385', '0.040693', '0.045900', '0.051665', '0.050145']
         : correct/total = [(213, 4128), (194, 4203), (207, 4081), (229, 4333), (215, 4091), (130, 4287), (177, 4193), (191, 4349), (214, 4191), (236, 4277), (197, 4143), (197, 4193), (207, 4093), (198, 4197), (210, 4052), (203, 4029), (169, 4153), (192, 4183), (211, 4084), (207, 4128)]
         : compromised: 0.0435, honest: 0.0491
Round 003: test acc mean=0.0434 ± 0.0124 | min=0.0053 max=0.0657
         : test loss mean=921209593.0851 ± 2908055072.8012
         : individual accs = ['0.049176', '0.050916', '0.065670', '0.043157', '0.043021', '0.052484', '0.044598', '0.005289', '0.051539', '0.044891', '0.051653', '0.028142', '0.033716', '0.028592', '0.037759', '0.050385', '0.049362', '0.051159', '0.050930', '0.035853']
         : correct/total = [(203, 4128), (214, 4203), (268, 4081), (187, 4333), (176, 4091), (225, 4287), (187, 4193), (23, 4349), (216, 4191), (192, 4277), (214, 4143), (118, 4193), (138, 4093), (120, 4197), (153, 4052), (203, 4029), (205, 4153), (214, 4183), (208, 4084), (148, 4128)]
         : compromised: 0.0415, honest: 0.0439
Round 004: test acc mean=0.0454 ± 0.0074 | min=0.0281 max=0.0534
         : test loss mean=7337125890187290624.0000 ± 31981790274668294144.0000
         : individual accs = ['0.044574', '0.051630', '0.053418', '0.043157', '0.043021', '0.052484', '0.044598', '0.051276', '0.049630', '0.046528', '0.045619', '0.028142', '0.033716', '0.028592', '0.051826', '0.050881', '0.040212', '0.045900', '0.050930', '0.050872']
         : correct/total = [(184, 4128), (217, 4203), (218, 4081), (187, 4333), (176, 4091), (225, 4287), (187, 4193), (223, 4349), (208, 4191), (199, 4277), (189, 4143), (118, 4193), (138, 4093), (120, 4197), (210, 4052), (205, 4029), (167, 4153), (192, 4183), (208, 4084), (210, 4128)]
         : compromised: 0.0402, honest: 0.0466
Round 005: test acc mean=0.0473 ± 0.0094 | min=0.0250 max=0.0586
         : test loss mean=6509410.8785 ± 19686180.1424
         : individual accs = ['0.048934', '0.051630', '0.024994', '0.052850', '0.057932', '0.048052', '0.049130', '0.058174', '0.051062', '0.050503', '0.045619', '0.053899', '0.058637', '0.028592', '0.046397', '0.028295', '0.044546', '0.050203', '0.052889', '0.043847']
         : correct/total = [(202, 4128), (217, 4203), (102, 4081), (229, 4333), (237, 4091), (206, 4287), (206, 4193), (253, 4349), (214, 4191), (216, 4277), (189, 4143), (226, 4193), (240, 4093), (120, 4197), (188, 4052), (114, 4029), (185, 4153), (210, 4183), (216, 4084), (181, 4128)]
         : compromised: 0.0464, honest: 0.0475
Round 006: test acc mean=0.0470 ± 0.0095 | min=0.0241 max=0.0612
         : test loss mean=7490259.9202 ± 26977686.4796
         : individual accs = ['0.050145', '0.052344', '0.057584', '0.043388', '0.057932', '0.048052', '0.043883', '0.043918', '0.047960', '0.043488', '0.047550', '0.028142', '0.033716', '0.024065', '0.061204', '0.056590', '0.058271', '0.045900', '0.045788', '0.050145']
         : correct/total = [(207, 4128), (220, 4203), (235, 4081), (188, 4333), (237, 4091), (206, 4287), (184, 4193), (191, 4349), (201, 4191), (186, 4277), (197, 4143), (118, 4193), (138, 4093), (101, 4197), (248, 4052), (228, 4029), (242, 4153), (192, 4183), (187, 4084), (207, 4128)]
         : compromised: 0.0379, honest: 0.0493
Round 007: test acc mean=0.0443 ± 0.0118 | min=0.0214 max=0.0582
         : test loss mean=9394566.1237 ± 39183380.6815
         : individual accs = ['0.048934', '0.052344', '0.057584', '0.048465', '0.057932', '0.050618', '0.049130', '0.058174', '0.047960', '0.043488', '0.041999', '0.046983', '0.045688', '0.024065', '0.023198', '0.056590', '0.021430', '0.021516', '0.045788', '0.043847']
         : correct/total = [(202, 4128), (220, 4203), (235, 4081), (210, 4333), (237, 4091), (217, 4287), (206, 4193), (253, 4349), (201, 4191), (186, 4277), (174, 4143), (197, 4193), (187, 4093), (101, 4197), (94, 4052), (228, 4029), (89, 4153), (90, 4183), (187, 4084), (181, 4128)]
         : compromised: 0.0355, honest: 0.0465
Round 008: test acc mean=0.0509 ± 0.0041 | min=0.0432 max=0.0583
         : test loss mean=2264105559.3144 ± 9828540253.6106
         : individual accs = ['0.051599', '0.052344', '0.057584', '0.043157', '0.057932', '0.048052', '0.049130', '0.053116', '0.047960', '0.053075', '0.045619', '0.046983', '0.050574', '0.045747', '0.048124', '0.053860', '0.058271', '0.050920', '0.052889', '0.050145']
         : correct/total = [(213, 4128), (220, 4203), (235, 4081), (187, 4333), (237, 4091), (206, 4287), (206, 4193), (231, 4349), (201, 4191), (227, 4277), (189, 4143), (197, 4193), (207, 4093), (192, 4197), (195, 4052), (217, 4029), (242, 4153), (213, 4183), (216, 4084), (207, 4128)]
         : compromised: 0.0488, honest: 0.0514
Round 009: test acc mean=0.0521 ± 0.0053 | min=0.0422 max=0.0624
         : test loss mean=375329922.5885 ± 1364287125.7583
         : individual accs = ['0.051599', '0.052344', '0.057584', '0.048465', '0.057932', '0.048052', '0.049130', '0.051276', '0.042233', '0.048398', '0.055998', '0.061770', '0.054239', '0.062426', '0.051579', '0.056590', '0.051047', '0.051159', '0.045788', '0.043847']
         : correct/total = [(213, 4128), (220, 4203), (235, 4081), (210, 4333), (237, 4091), (206, 4287), (206, 4193), (223, 4349), (177, 4191), (207, 4277), (232, 4143), (259, 4193), (222, 4093), (262, 4197), (209, 4052), (228, 4029), (212, 4153), (214, 4183), (187, 4084), (181, 4128)]
         : compromised: 0.0540, honest: 0.0516
Round 010: test acc mean=0.0530 ± 0.0055 | min=0.0432 max=0.0624
         : test loss mean=30351.6406 ± 66775.9081
         : individual accs = ['0.051599', '0.052344', '0.057584', '0.043157', '0.057932', '0.048052', '0.049130', '0.045528', '0.047960', '0.053075', '0.045619', '0.061770', '0.053750', '0.062426', '0.061204', '0.056590', '0.058271', '0.050920', '0.052889', '0.050145']
         : correct/total = [(213, 4128), (220, 4203), (235, 4081), (187, 4333), (237, 4091), (206, 4287), (206, 4193), (198, 4349), (201, 4191), (227, 4277), (189, 4143), (259, 4193), (220, 4093), (262, 4197), (248, 4052), (228, 4029), (242, 4153), (213, 4183), (216, 4084), (207, 4128)]
         : compromised: 0.0538, honest: 0.0528

=== FINAL RESULTS ===
Dataset: femnist, Nodes: 20, Graph: ring, Aggregation: d-fedavg
Attack: directed_deviation, 20.0% compromised
Final accuracy - Compromised: 0.0538, Honest: 0.0528
Overall test accuracy: mean=0.0530 ± 0.0055
