Device: cuda
Seed: 987654321
Loading 36 LEAF FEMNIST train files...
LEAF FEMNIST train: 3597 users, 734463 samples
Loading 36 LEAF FEMNIST test files...
LEAF FEMNIST test: 3597 users, 83388 samples
Found 3597 train users, 3597 test users, 3597 common users
User sample counts range: 525 (max) to 17 (min)
Distributed ALL 3597 users across 20 clients
Users per client: 179 (with 17 clients getting +1 user)
Train partition sizes: [36360, 37070, 35957, 38262, 36024, 37732, 36921, 38328, 36867, 37683, 36507, 36915, 36007, 37001, 35681, 35453, 36585, 36801, 35964, 36345]
Test partition sizes: [4128, 4203, 4081, 4333, 4091, 4287, 4193, 4349, 4191, 4277, 4143, 4193, 4093, 4197, 4052, 4029, 4153, 4183, 4084, 4128]
  Client 0: 36360 train samples, 62 unique classes
  Client 1: 37070 train samples, 62 unique classes
  Client 2: 35957 train samples, 62 unique classes
  Client 3: 38262 train samples, 62 unique classes
  Client 4: 36024 train samples, 62 unique classes
  Client 5: 37732 train samples, 62 unique classes
  Client 6: 36921 train samples, 62 unique classes
  Client 7: 38328 train samples, 62 unique classes
  Client 8: 36867 train samples, 62 unique classes
  Client 9: 37683 train samples, 62 unique classes
  Client 10: 36507 train samples, 62 unique classes
  Client 11: 36915 train samples, 62 unique classes
  Client 12: 36007 train samples, 62 unique classes
  Client 13: 37001 train samples, 62 unique classes
  Client 14: 35681 train samples, 62 unique classes
  Client 15: 35453 train samples, 62 unique classes
  Client 16: 36585 train samples, 62 unique classes
  Client 17: 36801 train samples, 62 unique classes
  Client 18: 35964 train samples, 62 unique classes
  Client 19: 36345 train samples, 62 unique classes
Will sample 4500 samples per client per epoch
Graph: erdos, nodes: 20, edges: 99
Degree statistics: avg=9.90, min=7, max=14
Attack: Compromised 2/20 nodes: [5, 13]
Attack type: backdoor, lambda: 1.0
Backdoor target label: 0, trigger size: 4
Model variant: baseline
Model parameters: 6,603,710
Initial test acc across nodes: mean=0.0168 ± 0.0139
Backdoor attack: Created poisoned datasets for 2 compromised nodes
Round 001: test acc mean=0.0528 ± 0.0039 | min=0.0469 max=0.0618
         : test loss mean=3.6894 ± 0.0172
         : individual accs = ['0.051599', '0.052344', '0.048272', '0.048465', '0.051088', '0.050618', '0.049130', '0.051276', '0.053209', '0.053776', '0.050447', '0.061770', '0.053750', '0.046938', '0.061204', '0.056342', '0.058271', '0.050203', '0.052889', '0.054506']
         : correct/total = [(213, 4128), (220, 4203), (197, 4081), (210, 4333), (209, 4091), (217, 4287), (206, 4193), (223, 4349), (223, 4191), (230, 4277), (209, 4143), (259, 4193), (220, 4093), (197, 4197), (248, 4052), (227, 4029), (242, 4153), (210, 4183), (216, 4084), (225, 4128)]
         : compromised: 0.0488, honest: 0.0533
Round 002: test acc mean=0.0724 ± 0.0227 | min=0.0448 max=0.1032
         : test loss mean=3.6830 ± 0.0170
         : individual accs = ['0.094234', '0.048775', '0.103161', '0.044773', '0.047421', '0.048752', '0.087765', '0.094504', '0.054880', '0.053776', '0.047309', '0.093489', '0.099682', '0.097212', '0.092053', '0.093075', '0.054418', '0.050920', '0.093536', '0.048692']
         : correct/total = [(389, 4128), (205, 4203), (421, 4081), (194, 4333), (194, 4091), (209, 4287), (368, 4193), (411, 4349), (230, 4191), (230, 4277), (196, 4143), (392, 4193), (408, 4093), (408, 4197), (373, 4052), (375, 4029), (226, 4153), (213, 4183), (382, 4084), (201, 4128)]
         : compromised: 0.0730, honest: 0.0724
Round 003: test acc mean=0.0791 ± 0.0087 | min=0.0590 max=0.0937
         : test loss mean=3.6784 ± 0.0166
         : individual accs = ['0.087694', '0.075422', '0.080372', '0.082160', '0.068932', '0.070912', '0.093728', '0.084847', '0.067048', '0.071545', '0.072894', '0.081803', '0.080625', '0.075054', '0.080454', '0.091338', '0.089574', '0.059049', '0.082027', '0.086483']
         : correct/total = [(362, 4128), (317, 4203), (328, 4081), (356, 4333), (282, 4091), (304, 4287), (393, 4193), (369, 4349), (281, 4191), (306, 4277), (302, 4143), (343, 4193), (330, 4093), (315, 4197), (326, 4052), (368, 4029), (372, 4153), (247, 4183), (335, 4084), (357, 4128)]
         : compromised: 0.0730, honest: 0.0798
Round 004: test acc mean=0.0860 ± 0.0287 | min=0.0451 max=0.1200
         : test loss mean=3.6683 ± 0.0174
         : individual accs = ['0.117975', '0.109208', '0.111982', '0.075237', '0.114886', '0.109167', '0.105175', '0.045068', '0.053209', '0.053542', '0.089790', '0.119962', '0.054728', '0.046938', '0.060217', '0.117895', '0.114134', '0.109730', '0.052889', '0.057897']
         : correct/total = [(487, 4128), (459, 4203), (457, 4081), (326, 4333), (470, 4091), (468, 4287), (441, 4193), (196, 4349), (223, 4191), (229, 4277), (372, 4143), (503, 4193), (224, 4093), (197, 4197), (244, 4052), (475, 4029), (474, 4153), (459, 4183), (216, 4084), (239, 4128)]
         : compromised: 0.0781, honest: 0.0869
Round 005: test acc mean=0.0838 ± 0.0394 | min=0.0441 max=0.1609
         : test loss mean=3.6591 ± 0.0171
         : individual accs = ['0.109012', '0.047347', '0.087724', '0.062082', '0.058176', '0.158153', '0.054138', '0.044148', '0.124075', '0.047463', '0.155202', '0.098021', '0.050086', '0.111985', '0.051579', '0.054852', '0.054418', '0.094430', '0.052400', '0.160853']
         : correct/total = [(450, 4128), (199, 4203), (358, 4081), (269, 4333), (238, 4091), (678, 4287), (227, 4193), (192, 4349), (520, 4191), (203, 4277), (643, 4143), (411, 4193), (205, 4093), (470, 4197), (209, 4052), (221, 4029), (226, 4153), (395, 4183), (214, 4084), (664, 4128)]
         : compromised: 0.1351, honest: 0.0781
Round 006: test acc mean=0.1207 ± 0.0230 | min=0.0968 max=0.1645
         : test loss mean=3.6385 ± 0.0181
         : individual accs = ['0.164486', '0.096836', '0.118598', '0.134318', '0.105353', '0.150921', '0.103267', '0.103702', '0.153663', '0.102408', '0.156650', '0.105414', '0.102859', '0.108173', '0.112290', '0.110449', '0.107151', '0.164475', '0.103820', '0.108527']
         : correct/total = [(679, 4128), (407, 4203), (484, 4081), (582, 4333), (431, 4091), (647, 4287), (433, 4193), (451, 4349), (644, 4191), (438, 4277), (649, 4143), (442, 4193), (421, 4093), (454, 4197), (455, 4052), (445, 4029), (445, 4153), (688, 4183), (424, 4084), (448, 4128)]
         : compromised: 0.1295, honest: 0.1197
Round 007: test acc mean=0.1473 ± 0.0441 | min=0.0909 max=0.2063
         : test loss mean=3.5944 ± 0.0195
         : individual accs = ['0.125484', '0.197240', '0.141387', '0.090930', '0.127108', '0.096571', '0.190317', '0.098413', '0.122644', '0.190087', '0.102100', '0.128548', '0.205228', '0.197284', '0.206318', '0.106974', '0.201059', '0.092756', '0.203477', '0.122578']
         : correct/total = [(518, 4128), (829, 4203), (577, 4081), (394, 4333), (520, 4091), (414, 4287), (798, 4193), (428, 4349), (514, 4191), (813, 4277), (423, 4143), (539, 4193), (840, 4093), (828, 4197), (836, 4052), (431, 4029), (835, 4153), (388, 4183), (831, 4084), (506, 4128)]
         : compromised: 0.1469, honest: 0.1474
Round 008: test acc mean=0.2063 ± 0.0201 | min=0.1708 max=0.2449
         : test loss mean=3.4959 ± 0.0212
         : individual accs = ['0.194767', '0.237687', '0.209262', '0.181168', '0.197996', '0.229531', '0.187932', '0.193148', '0.170842', '0.227028', '0.198890', '0.201288', '0.223797', '0.236836', '0.203850', '0.210474', '0.199374', '0.194836', '0.244858', '0.183140']
         : correct/total = [(804, 4128), (999, 4203), (854, 4081), (785, 4333), (810, 4091), (984, 4287), (788, 4193), (840, 4349), (716, 4191), (971, 4277), (824, 4143), (844, 4193), (916, 4093), (994, 4197), (826, 4052), (848, 4029), (828, 4153), (815, 4183), (1000, 4084), (756, 4128)]
         : compromised: 0.2332, honest: 0.2034
Round 009: test acc mean=0.2810 ± 0.0141 | min=0.2501 max=0.3068
         : test loss mean=3.2355 ± 0.0277
         : individual accs = ['0.288275', '0.279324', '0.299681', '0.259866', '0.289905', '0.275017', '0.264965', '0.279375', '0.306848', '0.267945', '0.272266', '0.283568', '0.289274', '0.282345', '0.287019', '0.305287', '0.284132', '0.250060', '0.285504', '0.269380']
         : correct/total = [(1190, 4128), (1174, 4203), (1223, 4081), (1126, 4333), (1186, 4091), (1179, 4287), (1111, 4193), (1215, 4349), (1286, 4191), (1146, 4277), (1128, 4143), (1189, 4193), (1184, 4093), (1185, 4197), (1163, 4052), (1230, 4029), (1180, 4153), (1046, 4183), (1166, 4084), (1112, 4128)]
         : compromised: 0.2787, honest: 0.2813
Round 010: test acc mean=0.3417 ± 0.0127 | min=0.3222 max=0.3761
         : test loss mean=2.8260 ± 0.0301
         : individual accs = ['0.340601', '0.340233', '0.352120', '0.338103', '0.354681', '0.332167', '0.322204', '0.336859', '0.345025', '0.348609', '0.331161', '0.376103', '0.341314', '0.330474', '0.354146', '0.351452', '0.333975', '0.328472', '0.353575', '0.323643']
         : correct/total = [(1406, 4128), (1430, 4203), (1437, 4081), (1465, 4333), (1451, 4091), (1424, 4287), (1351, 4193), (1465, 4349), (1446, 4191), (1491, 4277), (1372, 4143), (1577, 4193), (1397, 4093), (1387, 4197), (1435, 4052), (1416, 4029), (1387, 4153), (1374, 4183), (1444, 4084), (1336, 4128)]
         : compromised: 0.3313, honest: 0.3429

=== FINAL RESULTS ===
Dataset: femnist, Nodes: 20, Graph: erdos, Aggregation: krum
Attack: backdoor, 10.0% compromised
Final accuracy - Compromised: 0.3313, Honest: 0.3429
Overall test accuracy: mean=0.3417 ± 0.0127

=== BACKDOOR ATTACK SUCCESS RATE (ASR) ===
Target label: 0
Trigger size: 4x4
Overall ASR: 0.0255 ± 0.0144
Honest nodes ASR: 0.0270 ± 0.0143
Compromised nodes ASR: 0.0122 ± 0.0058
Note: Higher ASR indicates more successful backdoor attack
