Device: cuda
Seed: 987654321
Loading 36 LEAF FEMNIST train files...
LEAF FEMNIST train: 3597 users, 734463 samples
Loading 36 LEAF FEMNIST test files...
LEAF FEMNIST test: 3597 users, 83388 samples
Found 3597 train users, 3597 test users, 3597 common users
User sample counts range: 525 (max) to 17 (min)
Distributed ALL 3597 users across 20 clients
Users per client: 179 (with 17 clients getting +1 user)
Train partition sizes: [36360, 37070, 35957, 38262, 36024, 37732, 36921, 38328, 36867, 37683, 36507, 36915, 36007, 37001, 35681, 35453, 36585, 36801, 35964, 36345]
Test partition sizes: [4128, 4203, 4081, 4333, 4091, 4287, 4193, 4349, 4191, 4277, 4143, 4193, 4093, 4197, 4052, 4029, 4153, 4183, 4084, 4128]
  Client 0: 36360 train samples, 62 unique classes
  Client 1: 37070 train samples, 62 unique classes
  Client 2: 35957 train samples, 62 unique classes
  Client 3: 38262 train samples, 62 unique classes
  Client 4: 36024 train samples, 62 unique classes
  Client 5: 37732 train samples, 62 unique classes
  Client 6: 36921 train samples, 62 unique classes
  Client 7: 38328 train samples, 62 unique classes
  Client 8: 36867 train samples, 62 unique classes
  Client 9: 37683 train samples, 62 unique classes
  Client 10: 36507 train samples, 62 unique classes
  Client 11: 36915 train samples, 62 unique classes
  Client 12: 36007 train samples, 62 unique classes
  Client 13: 37001 train samples, 62 unique classes
  Client 14: 35681 train samples, 62 unique classes
  Client 15: 35453 train samples, 62 unique classes
  Client 16: 36585 train samples, 62 unique classes
  Client 17: 36801 train samples, 62 unique classes
  Client 18: 35964 train samples, 62 unique classes
  Client 19: 36345 train samples, 62 unique classes
Will sample 4500 samples per client per epoch
Graph: erdos, nodes: 20, edges: 99
Degree statistics: avg=9.90, min=7, max=14
Attack: Compromised 2/20 nodes: [5, 13]
Attack type: backdoor, lambda: 1.0
Backdoor target label: 0, trigger size: 4
Model variant: baseline
Model parameters: 6,603,710
Initial test acc across nodes: mean=0.0168 ± 0.0139
Backdoor attack: Created poisoned datasets for 2 compromised nodes
Round 001: test acc mean=0.0345 ± 0.0205 | min=0.0036 max=0.0764
         : test loss mean=93.6972 ± 152.2620
         : individual accs = ['0.019138', '0.048775', '0.057584', '0.076390', '0.047421', '0.030324', '0.023372', '0.041619', '0.053209', '0.053776', '0.055998', '0.009778', '0.011727', '0.008339', '0.016535', '0.026309', '0.058271', '0.003586', '0.033301', '0.014777']
         : correct/total = [(79, 4128), (205, 4203), (235, 4081), (331, 4333), (194, 4091), (130, 4287), (98, 4193), (181, 4349), (223, 4191), (230, 4277), (232, 4143), (41, 4193), (48, 4093), (35, 4197), (67, 4052), (106, 4029), (242, 4153), (15, 4183), (136, 4084), (61, 4128)]
         : compromised: 0.0193, honest: 0.0362
Round 002: test acc mean=0.0358 ± 0.0169 | min=0.0032 max=0.0551
         : test loss mean=139.3751 ± 389.3366
         : individual accs = ['0.049176', '0.042113', '0.055134', '0.003231', '0.043266', '0.030324', '0.050560', '0.013566', '0.008113', '0.048398', '0.045619', '0.045314', '0.044222', '0.026686', '0.046890', '0.003227', '0.054418', '0.052833', '0.027914', '0.025194']
         : correct/total = [(203, 4128), (177, 4203), (225, 4081), (14, 4333), (177, 4091), (130, 4287), (212, 4193), (59, 4349), (34, 4191), (207, 4277), (189, 4143), (190, 4193), (181, 4093), (112, 4197), (190, 4052), (13, 4029), (226, 4153), (221, 4183), (114, 4084), (104, 4128)]
         : compromised: 0.0285, honest: 0.0366
Round 003: test acc mean=0.0400 ± 0.0141 | min=0.0107 max=0.0560
         : test loss mean=12.1278 ± 30.4102
         : individual accs = ['0.048934', '0.050202', '0.050723', '0.014078', '0.048643', '0.047586', '0.048891', '0.045528', '0.044619', '0.025251', '0.026309', '0.010732', '0.036404', '0.055992', '0.047878', '0.050385', '0.055141', '0.045900', '0.032321', '0.013566']
         : correct/total = [(202, 4128), (211, 4203), (207, 4081), (61, 4333), (199, 4091), (204, 4287), (205, 4193), (198, 4349), (187, 4191), (108, 4277), (109, 4143), (45, 4193), (149, 4093), (235, 4197), (194, 4052), (203, 4029), (229, 4153), (192, 4183), (132, 4084), (56, 4128)]
         : compromised: 0.0518, honest: 0.0386
Round 004: test acc mean=0.0307 ± 0.0171 | min=0.0117 max=0.0583
         : test loss mean=8.7387 ± 12.0218
         : individual accs = ['0.048934', '0.015941', '0.035531', '0.019617', '0.012955', '0.048519', '0.013356', '0.014486', '0.029349', '0.050503', '0.051653', '0.014787', '0.048620', '0.014058', '0.016782', '0.013403', '0.058271', '0.011714', '0.054358', '0.041667']
         : correct/total = [(202, 4128), (67, 4203), (145, 4081), (85, 4333), (53, 4091), (208, 4287), (56, 4193), (63, 4349), (123, 4191), (216, 4277), (214, 4143), (62, 4193), (199, 4093), (59, 4197), (68, 4052), (54, 4029), (242, 4153), (49, 4183), (222, 4084), (172, 4128)]
         : compromised: 0.0313, honest: 0.0307
Round 005: test acc mean=0.0493 ± 0.0034 | min=0.0430 max=0.0561
         : test loss mean=5.1130 ± 3.2019
         : individual accs = ['0.050145', '0.048775', '0.056114', '0.043157', '0.043021', '0.045253', '0.050799', '0.045068', '0.049630', '0.047229', '0.051653', '0.049606', '0.048620', '0.049083', '0.051826', '0.051626', '0.047195', '0.049486', '0.052889', '0.054506']
         : correct/total = [(207, 4128), (205, 4203), (229, 4081), (187, 4333), (176, 4091), (194, 4287), (213, 4193), (196, 4349), (208, 4191), (202, 4277), (214, 4143), (208, 4193), (199, 4093), (206, 4197), (210, 4052), (208, 4029), (196, 4153), (207, 4183), (216, 4084), (225, 4128)]
         : compromised: 0.0472, honest: 0.0495
Round 006: test acc mean=0.0328 ± 0.0093 | min=0.0203 max=0.0561
         : test loss mean=541.3345 ± 1903.4549
         : individual accs = ['0.020349', '0.032834', '0.056114', '0.033003', '0.029333', '0.034756', '0.032674', '0.031272', '0.023622', '0.047229', '0.048033', '0.026473', '0.024676', '0.028354', '0.029862', '0.028295', '0.047195', '0.028927', '0.029383', '0.023256']
         : correct/total = [(84, 4128), (138, 4203), (229, 4081), (143, 4333), (120, 4091), (149, 4287), (137, 4193), (136, 4349), (99, 4191), (202, 4277), (199, 4143), (111, 4193), (101, 4093), (119, 4197), (121, 4052), (114, 4029), (196, 4153), (121, 4183), (120, 4084), (96, 4128)]
         : compromised: 0.0316, honest: 0.0329
Round 007: test acc mean=0.0474 ± 0.0061 | min=0.0281 max=0.0561
         : test loss mean=130.9616 ± 529.9540
         : individual accs = ['0.050145', '0.049726', '0.056114', '0.038541', '0.052554', '0.047352', '0.043406', '0.028052', '0.049630', '0.047229', '0.044895', '0.040305', '0.050574', '0.054563', '0.051086', '0.050633', '0.047195', '0.048052', '0.051665', '0.045300']
         : correct/total = [(207, 4128), (209, 4203), (229, 4081), (167, 4333), (215, 4091), (203, 4287), (182, 4193), (122, 4349), (208, 4191), (202, 4277), (186, 4143), (169, 4193), (207, 4093), (229, 4197), (207, 4052), (204, 4029), (196, 4153), (201, 4183), (211, 4084), (187, 4128)]
         : compromised: 0.0510, honest: 0.0470
Round 008: test acc mean=0.0338 ± 0.0175 | min=0.0130 max=0.0527
         : test loss mean=4.4056 ± 0.9775
         : individual accs = ['0.013808', '0.015941', '0.052683', '0.043157', '0.012955', '0.014462', '0.050799', '0.014486', '0.051062', '0.048398', '0.045619', '0.049606', '0.017102', '0.014058', '0.052073', '0.013403', '0.051288', '0.049486', '0.015671', '0.050145']
         : correct/total = [(57, 4128), (67, 4203), (215, 4081), (187, 4333), (53, 4091), (62, 4287), (213, 4193), (63, 4349), (214, 4191), (207, 4277), (189, 4143), (208, 4193), (70, 4093), (59, 4197), (211, 4052), (54, 4029), (213, 4153), (207, 4183), (64, 4084), (207, 4128)]
         : compromised: 0.0143, honest: 0.0360
Round 009: test acc mean=0.0363 ± 0.0165 | min=0.0138 max=0.0663
         : test loss mean=10.9049 ± 21.5846
         : individual accs = ['0.013808', '0.020700', '0.052683', '0.047542', '0.045466', '0.014462', '0.043406', '0.019545', '0.066333', '0.048398', '0.045619', '0.048653', '0.017102', '0.014058', '0.047384', '0.050385', '0.051288', '0.042075', '0.015426', '0.021560']
         : correct/total = [(57, 4128), (87, 4203), (215, 4081), (206, 4333), (186, 4091), (62, 4287), (182, 4193), (85, 4349), (278, 4191), (207, 4277), (189, 4143), (204, 4193), (70, 4093), (59, 4197), (192, 4052), (203, 4029), (213, 4153), (176, 4183), (63, 4084), (89, 4128)]
         : compromised: 0.0143, honest: 0.0387
Round 010: test acc mean=0.0369 ± 0.0087 | min=0.0150 max=0.0549
         : test loss mean=8.4006 ± 11.8509
         : individual accs = ['0.030523', '0.034737', '0.054889', '0.040157', '0.042288', '0.038955', '0.033389', '0.041389', '0.015032', '0.044891', '0.047550', '0.028142', '0.033716', '0.028592', '0.037759', '0.032266', '0.051047', '0.037533', '0.033301', '0.032461']
         : correct/total = [(126, 4128), (146, 4203), (224, 4081), (174, 4333), (173, 4091), (167, 4287), (140, 4193), (180, 4349), (63, 4191), (192, 4277), (197, 4143), (118, 4193), (138, 4093), (120, 4197), (153, 4052), (130, 4029), (212, 4153), (157, 4183), (136, 4084), (134, 4128)]
         : compromised: 0.0338, honest: 0.0373

=== FINAL RESULTS ===
Dataset: femnist, Nodes: 20, Graph: erdos, Aggregation: d-fedavg
Attack: backdoor, 10.0% compromised
Final accuracy - Compromised: 0.0338, Honest: 0.0373
Overall test accuracy: mean=0.0369 ± 0.0087

=== BACKDOOR ATTACK SUCCESS RATE (ASR) ===
Target label: 0
Trigger size: 4x4
Overall ASR: 0.0000 ± 0.0000
Honest nodes ASR: 0.0000 ± 0.0000
Compromised nodes ASR: 0.0000 ± 0.0000
Note: Higher ASR indicates more successful backdoor attack
