Device: cuda
Seed: 987654321
Loading 36 LEAF FEMNIST train files...
LEAF FEMNIST train: 3597 users, 734463 samples
Loading 36 LEAF FEMNIST test files...
LEAF FEMNIST test: 3597 users, 83388 samples
Found 3597 train users, 3597 test users, 3597 common users
User sample counts range: 525 (max) to 17 (min)
Distributed ALL 3597 users across 20 clients
Users per client: 179 (with 17 clients getting +1 user)
Train partition sizes: [36360, 37070, 35957, 38262, 36024, 37732, 36921, 38328, 36867, 37683, 36507, 36915, 36007, 37001, 35681, 35453, 36585, 36801, 35964, 36345]
Test partition sizes: [4128, 4203, 4081, 4333, 4091, 4287, 4193, 4349, 4191, 4277, 4143, 4193, 4093, 4197, 4052, 4029, 4153, 4183, 4084, 4128]
  Client 0: 36360 train samples, 62 unique classes
  Client 1: 37070 train samples, 62 unique classes
  Client 2: 35957 train samples, 62 unique classes
  Client 3: 38262 train samples, 62 unique classes
  Client 4: 36024 train samples, 62 unique classes
  Client 5: 37732 train samples, 62 unique classes
  Client 6: 36921 train samples, 62 unique classes
  Client 7: 38328 train samples, 62 unique classes
  Client 8: 36867 train samples, 62 unique classes
  Client 9: 37683 train samples, 62 unique classes
  Client 10: 36507 train samples, 62 unique classes
  Client 11: 36915 train samples, 62 unique classes
  Client 12: 36007 train samples, 62 unique classes
  Client 13: 37001 train samples, 62 unique classes
  Client 14: 35681 train samples, 62 unique classes
  Client 15: 35453 train samples, 62 unique classes
  Client 16: 36585 train samples, 62 unique classes
  Client 17: 36801 train samples, 62 unique classes
  Client 18: 35964 train samples, 62 unique classes
  Client 19: 36345 train samples, 62 unique classes
Will sample 4500 samples per client per epoch
Graph: erdos, nodes: 20, edges: 48
Degree statistics: avg=4.80, min=2, max=7
Attack: Compromised 4/20 nodes: [5, 12, 13, 17]
Attack type: gaussian, lambda: 1.0
Model variant: baseline
Model parameters: 6,603,710
UBAR ALGORITHM (Two-Stage Byzantine-resilient)
  - Model dimension: 6,603,710 parameters
  - Rho parameter: 0.8
  - Stage 1: Distance-based filtering (select 80% closest neighbors)
  - Stage 2: Performance-based selection (loss comparison)
  - Complexity: O(deg(i)×d + deg(i)×inference)
Initial test acc across nodes: mean=0.0168 ± 0.0139
Round 001: test acc mean=0.0525 ± 0.0043 | min=0.0434 max=0.0596
         : test loss mean=3.9979 ± 0.0353
         : individual accs = ['0.059593', '0.052344', '0.057584', '0.043388', '0.058910', '0.050618', '0.057000', '0.051276', '0.049630', '0.050035', '0.049722', '0.055092', '0.050818', '0.045747', '0.048124', '0.050633', '0.058271', '0.050920', '0.055583', '0.054506']
         : correct/total = [(246, 4128), (220, 4203), (235, 4081), (188, 4333), (241, 4091), (217, 4287), (239, 4193), (223, 4349), (208, 4191), (214, 4277), (206, 4143), (231, 4193), (208, 4093), (192, 4197), (195, 4052), (204, 4029), (242, 4153), (213, 4183), (227, 4084), (225, 4128)]
         : compromised: 0.0495, honest: 0.0532
         : ubar stats = ['Node 0: s1=0.667, s2=1.000', 'Node 1: s1=0.667, s2=0.500', 'Node 2: s1=0.800, s2=0.250']...
Round 002: test acc mean=0.0529 ± 0.0051 | min=0.0446 max=0.0633
         : test loss mean=3.8256 ± 0.0730
         : individual accs = ['0.044574', '0.048775', '0.050723', '0.052850', '0.057932', '0.048752', '0.057000', '0.058174', '0.051062', '0.048398', '0.045619', '0.053899', '0.049597', '0.062426', '0.056269', '0.063291', '0.054418', '0.048291', '0.055583', '0.050388']
         : correct/total = [(184, 4128), (205, 4203), (207, 4081), (229, 4333), (237, 4091), (209, 4287), (239, 4193), (253, 4349), (214, 4191), (207, 4277), (189, 4143), (226, 4193), (203, 4093), (262, 4197), (228, 4052), (255, 4029), (226, 4153), (202, 4183), (227, 4084), (208, 4128)]
         : compromised: 0.0523, honest: 0.0531
         : ubar stats = ['Node 0: s1=0.667, s2=1.000', 'Node 1: s1=0.667, s2=0.500', 'Node 2: s1=0.800, s2=0.250']...
Round 003: test acc mean=0.0526 ± 0.0052 | min=0.0439 max=0.0655
         : test loss mean=3.7593 ± 0.0636
         : individual accs = ['0.059593', '0.051630', '0.050723', '0.048234', '0.057932', '0.050618', '0.049130', '0.043918', '0.047960', '0.050503', '0.055274', '0.053184', '0.065478', '0.045747', '0.061204', '0.056342', '0.051047', '0.050920', '0.052889', '0.050388']
         : correct/total = [(246, 4128), (217, 4203), (207, 4081), (209, 4333), (237, 4091), (217, 4287), (206, 4193), (191, 4349), (201, 4191), (216, 4277), (229, 4143), (223, 4193), (268, 4093), (192, 4197), (248, 4052), (227, 4029), (212, 4153), (213, 4183), (216, 4084), (208, 4128)]
         : compromised: 0.0532, honest: 0.0525
         : ubar stats = ['Node 0: s1=0.667, s2=0.917', 'Node 1: s1=0.667, s2=0.417', 'Node 2: s1=0.800, s2=0.250']...
Round 004: test acc mean=0.0559 ± 0.0086 | min=0.0451 max=0.0885
         : test loss mean=3.7182 ± 0.0296
         : individual accs = ['0.059593', '0.052344', '0.057584', '0.052850', '0.088487', '0.050618', '0.053899', '0.058174', '0.049630', '0.053075', '0.051653', '0.049606', '0.054239', '0.062426', '0.061204', '0.054852', '0.058271', '0.050920', '0.052889', '0.045058']
         : correct/total = [(246, 4128), (220, 4203), (235, 4081), (229, 4333), (362, 4091), (217, 4287), (226, 4193), (253, 4349), (208, 4191), (227, 4277), (214, 4143), (208, 4193), (222, 4093), (262, 4197), (248, 4052), (221, 4029), (242, 4153), (213, 4183), (216, 4084), (186, 4128)]
         : compromised: 0.0546, honest: 0.0562
         : ubar stats = ['Node 0: s1=0.667, s2=0.750', 'Node 1: s1=0.667, s2=0.375', 'Node 2: s1=0.800, s2=0.375']...
Round 005: test acc mean=0.0536 ± 0.0040 | min=0.0469 max=0.0596
         : test loss mean=3.7046 ± 0.0274
         : individual accs = ['0.059593', '0.052344', '0.053418', '0.058158', '0.057932', '0.057849', '0.057000', '0.047827', '0.047960', '0.053776', '0.055998', '0.046983', '0.058637', '0.046938', '0.051579', '0.054852', '0.051288', '0.050920', '0.052889', '0.055475']
         : correct/total = [(246, 4128), (220, 4203), (218, 4081), (252, 4333), (237, 4091), (248, 4287), (239, 4193), (208, 4349), (201, 4191), (230, 4277), (232, 4143), (197, 4193), (240, 4093), (197, 4197), (209, 4052), (221, 4029), (213, 4153), (213, 4183), (216, 4084), (229, 4128)]
         : compromised: 0.0536, honest: 0.0536
         : ubar stats = ['Node 0: s1=0.667, s2=0.800', 'Node 1: s1=0.667, s2=0.400', 'Node 2: s1=0.800, s2=0.450']...
Round 006: test acc mean=0.0551 ± 0.0067 | min=0.0434 max=0.0766
         : test loss mean=3.6879 ± 0.0194
         : individual accs = ['0.076550', '0.052344', '0.057584', '0.052850', '0.057932', '0.043387', '0.057000', '0.051276', '0.053209', '0.053776', '0.050447', '0.061770', '0.058637', '0.062426', '0.051826', '0.056838', '0.049362', '0.050920', '0.055583', '0.048450']
         : correct/total = [(316, 4128), (220, 4203), (235, 4081), (229, 4333), (237, 4091), (186, 4287), (239, 4193), (223, 4349), (223, 4191), (230, 4277), (209, 4143), (259, 4193), (240, 4093), (262, 4197), (210, 4052), (229, 4029), (205, 4153), (213, 4183), (227, 4084), (200, 4128)]
         : compromised: 0.0538, honest: 0.0554
         : ubar stats = ['Node 0: s1=0.667, s2=0.833', 'Node 1: s1=0.667, s2=0.375', 'Node 2: s1=0.800, s2=0.500']...
Round 007: test acc mean=0.0534 ± 0.0050 | min=0.0435 max=0.0624
         : test loss mean=3.6888 ± 0.0184
         : individual accs = ['0.059593', '0.052344', '0.057584', '0.044773', '0.047421', '0.050618', '0.048891', '0.058174', '0.053209', '0.043488', '0.055998', '0.053899', '0.058637', '0.062426', '0.051826', '0.056590', '0.058512', '0.050920', '0.048482', '0.055475']
         : correct/total = [(246, 4128), (220, 4203), (235, 4081), (194, 4333), (194, 4091), (217, 4287), (205, 4193), (253, 4349), (223, 4191), (186, 4277), (232, 4143), (226, 4193), (240, 4093), (262, 4197), (210, 4052), (228, 4029), (243, 4153), (213, 4183), (198, 4084), (229, 4128)]
         : compromised: 0.0557, honest: 0.0529
         : ubar stats = ['Node 0: s1=0.667, s2=0.786', 'Node 1: s1=0.667, s2=0.429', 'Node 2: s1=0.800, s2=0.500']...
Round 008: test acc mean=0.0558 ± 0.0107 | min=0.0430 max=0.0918
         : test loss mean=3.6843 ± 0.0178
         : individual accs = ['0.076066', '0.051630', '0.050723', '0.044773', '0.043021', '0.050618', '0.057000', '0.051276', '0.053209', '0.047697', '0.055998', '0.053899', '0.058637', '0.062426', '0.048124', '0.056590', '0.055141', '0.050920', '0.055583', '0.091812']
         : correct/total = [(314, 4128), (217, 4203), (207, 4081), (194, 4333), (176, 4091), (217, 4287), (239, 4193), (223, 4349), (223, 4191), (204, 4277), (232, 4143), (226, 4193), (240, 4093), (262, 4197), (195, 4052), (228, 4029), (229, 4153), (213, 4183), (227, 4084), (379, 4128)]
         : compromised: 0.0557, honest: 0.0558
         : ubar stats = ['Node 0: s1=0.667, s2=0.750', 'Node 1: s1=0.667, s2=0.406', 'Node 2: s1=0.800, s2=0.469']...
Round 009: test acc mean=0.0534 ± 0.0042 | min=0.0439 max=0.0624
         : test loss mean=3.6821 ± 0.0165
         : individual accs = ['0.050145', '0.050916', '0.052683', '0.052850', '0.052066', '0.050618', '0.050799', '0.043918', '0.049630', '0.061492', '0.055998', '0.053899', '0.058637', '0.062426', '0.051826', '0.056342', '0.051047', '0.050920', '0.056072', '0.055959']
         : correct/total = [(207, 4128), (214, 4203), (215, 4081), (229, 4333), (213, 4091), (217, 4287), (213, 4193), (191, 4349), (208, 4191), (263, 4277), (232, 4143), (226, 4193), (240, 4093), (262, 4197), (210, 4052), (227, 4029), (212, 4153), (213, 4183), (229, 4084), (231, 4128)]
         : compromised: 0.0557, honest: 0.0529
         : ubar stats = ['Node 0: s1=0.667, s2=0.778', 'Node 1: s1=0.667, s2=0.389', 'Node 2: s1=0.800, s2=0.444']...
Round 010: test acc mean=0.0556 ± 0.0038 | min=0.0480 max=0.0624
         : test loss mean=3.6810 ± 0.0176
         : individual accs = ['0.059593', '0.051630', '0.057584', '0.052850', '0.057932', '0.053884', '0.049130', '0.058174', '0.047960', '0.053776', '0.055998', '0.053899', '0.059858', '0.062426', '0.061204', '0.056590', '0.058271', '0.050920', '0.055583', '0.055475']
         : correct/total = [(246, 4128), (217, 4203), (235, 4081), (229, 4333), (237, 4091), (231, 4287), (206, 4193), (253, 4349), (201, 4191), (230, 4277), (232, 4143), (226, 4193), (245, 4093), (262, 4197), (248, 4052), (228, 4029), (242, 4153), (213, 4183), (227, 4084), (229, 4128)]
         : compromised: 0.0568, honest: 0.0554
         : ubar stats = ['Node 0: s1=0.667, s2=0.750', 'Node 1: s1=0.667, s2=0.400', 'Node 2: s1=0.800, s2=0.450']...

=== FINAL RESULTS ===
Dataset: femnist, Nodes: 20, Graph: erdos, Aggregation: ubar
Attack: gaussian, 20.0% compromised
Final accuracy - Compromised: 0.0568, Honest: 0.0554
Overall test accuracy: mean=0.0556 ± 0.0038

=== UBAR SUMMARY ===
Node 0: stage1=0.667, stage2=0.750, overall=0.500
Node 1: stage1=0.667, stage2=0.400, overall=0.267
Node 2: stage1=0.800, stage2=0.450, overall=0.360
Node 3: stage1=0.750, stage2=0.567, overall=0.425
Node 4: stage1=0.750, stage2=0.600, overall=0.450
Node 5: stage1=0.800, stage2=0.325, overall=0.260
Node 6: stage1=0.800, stage2=0.450, overall=0.360
Node 7: stage1=0.800, stage2=0.425, overall=0.340
Node 8: stage1=0.500, stage2=1.000, overall=0.500
Node 9: stage1=0.667, stage2=0.500, overall=0.333
Node 10: stage1=0.750, stage2=0.367, overall=0.275
Node 11: stage1=0.714, stage2=0.380, overall=0.271
Node 12: stage1=0.714, stage2=0.500, overall=0.357
Node 13: stage1=0.750, stage2=0.767, overall=0.575
Node 14: stage1=0.714, stage2=0.320, overall=0.229
Node 15: stage1=0.667, stage2=0.425, overall=0.283
Node 16: stage1=0.800, stage2=0.375, overall=0.300
Node 17: stage1=0.800, stage2=0.450, overall=0.360
Node 18: stage1=0.750, stage2=0.700, overall=0.525
Node 19: stage1=0.500, stage2=1.000, overall=0.500

=== PARALLEL EXECUTION TIME (realistic for distributed system) ===
  COMMUNICATION (max across nodes):
    - Full model transfer: 0.000s (0.0%)
  COMPUTATION (max across nodes):
    - Distance computation: 0.029s (0.7%)
    - Loss computation: 4.118s (98.9%)
    - Aggregation: 0.016s (0.4%)
  TOTALS:
    - Total computation: 4.163s (100.0%)
    - Total communication: 0.000s (0.0%)
    - Total parallel time: 4.163s

=== PER-NODE AVERAGE TIME ===
  - Distance computation: 0.019s
  - Loss computation: 3.889s
  - Aggregation: 0.008s
  - Model transfer: 0.000s
  - Total per node: 3.915s

=== TOTAL COMPUTATIONAL WORK (sum across all nodes) ===
  - Total distance computation: 0.374s
  - Total loss computation: 77.777s
  - Total aggregation: 0.150s
  - Total model transfer: 0.000s
  - Grand total: 78.302s
  - Mean Stage 1 acceptance rate: 0.718
  - Mean Stage 2 acceptance rate: 0.537
  - Overall acceptance rate: 0.386

UBAR Algorithm Properties:
  - Model dimension: 6,603,710
  - Rho parameter: 0.8
  - Two-stage approach: Distance filtering + loss evaluation
  - Stage 1 selects: 80% of neighbors
  - Stage 2 uses: Training sample loss comparison
  - Theoretical complexity: O(deg(i)×d + deg(i)×inference)
  - Approach: UBAR paper implementation
