Device: cuda
Seed: 987654321
Loading 36 LEAF FEMNIST train files...
LEAF FEMNIST train: 3597 users, 734463 samples
Loading 36 LEAF FEMNIST test files...
LEAF FEMNIST test: 3597 users, 83388 samples
Found 3597 train users, 3597 test users, 3597 common users
User sample counts range: 525 (max) to 17 (min)
Distributed ALL 3597 users across 20 clients
Users per client: 179 (with 17 clients getting +1 user)
Train partition sizes: [36360, 37070, 35957, 38262, 36024, 37732, 36921, 38328, 36867, 37683, 36507, 36915, 36007, 37001, 35681, 35453, 36585, 36801, 35964, 36345]
Test partition sizes: [4128, 4203, 4081, 4333, 4091, 4287, 4193, 4349, 4191, 4277, 4143, 4193, 4093, 4197, 4052, 4029, 4153, 4183, 4084, 4128]
  Client 0: 36360 train samples, 62 unique classes
  Client 1: 37070 train samples, 62 unique classes
  Client 2: 35957 train samples, 62 unique classes
  Client 3: 38262 train samples, 62 unique classes
  Client 4: 36024 train samples, 62 unique classes
  Client 5: 37732 train samples, 62 unique classes
  Client 6: 36921 train samples, 62 unique classes
  Client 7: 38328 train samples, 62 unique classes
  Client 8: 36867 train samples, 62 unique classes
  Client 9: 37683 train samples, 62 unique classes
  Client 10: 36507 train samples, 62 unique classes
  Client 11: 36915 train samples, 62 unique classes
  Client 12: 36007 train samples, 62 unique classes
  Client 13: 37001 train samples, 62 unique classes
  Client 14: 35681 train samples, 62 unique classes
  Client 15: 35453 train samples, 62 unique classes
  Client 16: 36585 train samples, 62 unique classes
  Client 17: 36801 train samples, 62 unique classes
  Client 18: 35964 train samples, 62 unique classes
  Client 19: 36345 train samples, 62 unique classes
Will sample 4500 samples per client per epoch
Graph: ring, nodes: 20, edges: 20
Degree statistics: avg=2.00, min=2, max=2
Attack: Compromised 16/20 nodes: [1, 2, 3, 5, 6, 8, 9, 10, 11, 12, 13, 14, 15, 17, 18, 19]
Attack type: directed_deviation, lambda: 1.0
Model variant: baseline
Model parameters: 6,603,710
Initial test acc across nodes: mean=0.0168 ± 0.0139
Round 001: test acc mean=0.0215 ± 0.0163 | min=0.0027 max=0.0582
         : test loss mean=171865.2891 ± 161891.8938
         : individual accs = ['0.008963', '0.051630', '0.024504', '0.036464', '0.052554', '0.032190', '0.018602', '0.058174', '0.011215', '0.013795', '0.010138', '0.014071', '0.003420', '0.027639', '0.002715', '0.013899', '0.014447', '0.004303', '0.017630', '0.013081']
         : correct/total = [(37, 4128), (217, 4203), (100, 4081), (158, 4333), (215, 4091), (138, 4287), (78, 4193), (253, 4349), (47, 4191), (59, 4277), (42, 4143), (59, 4193), (14, 4093), (116, 4197), (11, 4052), (56, 4029), (60, 4153), (18, 4183), (72, 4084), (54, 4128)]
         : compromised: 0.0185, honest: 0.0335
Round 002: test acc mean=0.0437 ± 0.0074 | min=0.0323 max=0.0549
         : test loss mean=83062720694.1550 ± 101439099820.7281
         : individual accs = ['0.051599', '0.051630', '0.035531', '0.043157', '0.043021', '0.045253', '0.051514', '0.042309', '0.047005', '0.036708', '0.039585', '0.036728', '0.036404', '0.037408', '0.032330', '0.054852', '0.054418', '0.053311', '0.032321', '0.048450']
         : correct/total = [(213, 4128), (217, 4203), (145, 4081), (187, 4333), (176, 4091), (194, 4287), (216, 4193), (184, 4349), (197, 4191), (157, 4277), (164, 4143), (154, 4193), (149, 4093), (157, 4197), (131, 4052), (221, 4029), (226, 4153), (223, 4183), (132, 4084), (200, 4128)]
         : compromised: 0.0426, honest: 0.0478
Round 003: test acc mean=0.0345 ± 0.0190 | min=0.0100 max=0.0545
         : test loss mean=52122834.0467 ± 124084625.4641
         : individual accs = ['0.050145', '0.048775', '0.010782', '0.043388', '0.052554', '0.052484', '0.048414', '0.051276', '0.043188', '0.012158', '0.010862', '0.012879', '0.010017', '0.014058', '0.010612', '0.051626', '0.052011', '0.049486', '0.010284', '0.054506']
         : correct/total = [(207, 4128), (205, 4203), (44, 4081), (188, 4333), (215, 4091), (225, 4287), (203, 4193), (223, 4349), (181, 4191), (52, 4277), (45, 4143), (54, 4193), (41, 4093), (59, 4197), (43, 4052), (208, 4029), (216, 4153), (207, 4183), (42, 4084), (225, 4128)]
         : compromised: 0.0302, honest: 0.0515
Round 004: test acc mean=0.0542 ± 0.0199 | min=0.0122 max=0.0882
         : test loss mean=78681.8783 ± 187421.1296
         : individual accs = ['0.085756', '0.078991', '0.057584', '0.052850', '0.057932', '0.050618', '0.057000', '0.058174', '0.053209', '0.053776', '0.055998', '0.053899', '0.058637', '0.062426', '0.061204', '0.012162', '0.013966', '0.015061', '0.055583', '0.088178']
         : correct/total = [(354, 4128), (332, 4203), (235, 4081), (229, 4333), (237, 4091), (217, 4287), (239, 4193), (253, 4349), (223, 4191), (230, 4277), (232, 4143), (226, 4193), (240, 4093), (262, 4197), (248, 4052), (49, 4029), (58, 4153), (63, 4183), (227, 4084), (364, 4128)]
         : compromised: 0.0542, honest: 0.0540
Round 005: test acc mean=0.0315 ± 0.0216 | min=0.0100 max=0.0596
         : test loss mean=5.5530 ± 2.8799
         : individual accs = ['0.059593', '0.052344', '0.010782', '0.052850', '0.057932', '0.050618', '0.057000', '0.058174', '0.053209', '0.012158', '0.010862', '0.012879', '0.010017', '0.014058', '0.010612', '0.012906', '0.013484', '0.015300', '0.010284', '0.055475']
         : correct/total = [(246, 4128), (220, 4203), (44, 4081), (229, 4333), (237, 4091), (217, 4287), (239, 4193), (253, 4349), (223, 4191), (52, 4277), (45, 4143), (54, 4193), (41, 4093), (59, 4197), (43, 4052), (52, 4029), (56, 4153), (64, 4183), (42, 4084), (229, 4128)]
         : compromised: 0.0276, honest: 0.0473
Round 006: test acc mean=0.0561 ± 0.0032 | min=0.0506 max=0.0624
         : test loss mean=441.6872 ± 1772.1446
         : individual accs = ['0.059593', '0.052344', '0.057584', '0.052850', '0.057932', '0.050618', '0.057000', '0.058404', '0.053448', '0.053776', '0.055998', '0.053899', '0.058637', '0.062426', '0.061204', '0.056590', '0.058271', '0.050920', '0.055583', '0.055475']
         : correct/total = [(246, 4128), (220, 4203), (235, 4081), (229, 4333), (237, 4091), (217, 4287), (239, 4193), (254, 4349), (224, 4191), (230, 4277), (232, 4143), (226, 4193), (240, 4093), (262, 4197), (248, 4052), (228, 4029), (242, 4153), (213, 4183), (227, 4084), (229, 4128)]
         : compromised: 0.0555, honest: 0.0586
Round 007: test acc mean=0.0523 ± 0.0057 | min=0.0344 max=0.0596
         : test loss mean=5.6495 ± 3.2461
         : individual accs = ['0.059593', '0.052344', '0.053418', '0.052850', '0.057932', '0.050618', '0.057000', '0.058174', '0.034359', '0.043488', '0.048033', '0.049606', '0.054239', '0.049083', '0.051826', '0.056590', '0.058271', '0.050920', '0.052889', '0.055475']
         : correct/total = [(246, 4128), (220, 4203), (218, 4081), (229, 4333), (237, 4091), (217, 4287), (239, 4193), (253, 4349), (144, 4191), (186, 4277), (199, 4143), (208, 4193), (222, 4093), (206, 4197), (210, 4052), (228, 4029), (242, 4153), (213, 4183), (216, 4084), (229, 4128)]
         : compromised: 0.0508, honest: 0.0585
Round 008: test acc mean=0.0506 ± 0.0057 | min=0.0367 max=0.0583
         : test loss mean=1165783.0714 ± 3373714.2465
         : individual accs = ['0.050145', '0.049726', '0.050723', '0.052850', '0.045710', '0.050618', '0.057000', '0.058174', '0.053209', '0.053075', '0.050447', '0.036728', '0.053750', '0.037408', '0.048124', '0.056590', '0.058271', '0.050920', '0.052889', '0.045058']
         : correct/total = [(207, 4128), (209, 4203), (207, 4081), (229, 4333), (187, 4091), (217, 4287), (239, 4193), (253, 4349), (223, 4191), (227, 4277), (209, 4143), (154, 4193), (220, 4093), (157, 4197), (195, 4052), (228, 4029), (242, 4153), (213, 4183), (216, 4084), (186, 4128)]
         : compromised: 0.0499, honest: 0.0531
Round 009: test acc mean=0.0500 ± 0.0035 | min=0.0435 max=0.0578
         : test loss mean=1329213.1560 ± 3164762.5342
         : individual accs = ['0.050145', '0.049726', '0.053418', '0.047773', '0.044977', '0.057849', '0.046745', '0.047827', '0.054880', '0.043488', '0.048033', '0.049606', '0.054239', '0.049083', '0.051826', '0.051378', '0.049362', '0.051159', '0.052889', '0.045058']
         : correct/total = [(207, 4128), (209, 4203), (218, 4081), (207, 4333), (184, 4091), (248, 4287), (196, 4193), (208, 4349), (230, 4191), (186, 4277), (199, 4143), (208, 4193), (222, 4093), (206, 4197), (210, 4052), (207, 4029), (205, 4153), (214, 4183), (216, 4084), (186, 4128)]
         : compromised: 0.0504, honest: 0.0481
Round 010: test acc mean=0.0550 ± 0.0042 | min=0.0461 max=0.0624
         : test loss mean=2663.3444 ± 6330.9388
         : individual accs = ['0.059593', '0.052344', '0.057584', '0.052850', '0.057932', '0.050618', '0.057000', '0.058174', '0.053209', '0.053776', '0.055998', '0.053899', '0.058637', '0.062426', '0.061204', '0.050385', '0.047195', '0.046139', '0.055583', '0.055475']
         : correct/total = [(246, 4128), (220, 4203), (235, 4081), (229, 4333), (237, 4091), (217, 4287), (239, 4193), (253, 4349), (223, 4191), (230, 4277), (232, 4143), (226, 4193), (240, 4093), (262, 4197), (248, 4052), (203, 4029), (196, 4153), (193, 4183), (227, 4084), (229, 4128)]
         : compromised: 0.0548, honest: 0.0557

=== FINAL RESULTS ===
Dataset: femnist, Nodes: 20, Graph: ring, Aggregation: krum
Attack: directed_deviation, 80.0% compromised
Final accuracy - Compromised: 0.0548, Honest: 0.0557
Overall test accuracy: mean=0.0550 ± 0.0042
