Device: cuda
Seed: 987654321
Loading 36 LEAF FEMNIST train files...
LEAF FEMNIST train: 3597 users, 734463 samples
Loading 36 LEAF FEMNIST test files...
LEAF FEMNIST test: 3597 users, 83388 samples
Found 3597 train users, 3597 test users, 3597 common users
User sample counts range: 525 (max) to 17 (min)
Distributed ALL 3597 users across 20 clients
Users per client: 179 (with 17 clients getting +1 user)
Train partition sizes: [36360, 37070, 35957, 38262, 36024, 37732, 36921, 38328, 36867, 37683, 36507, 36915, 36007, 37001, 35681, 35453, 36585, 36801, 35964, 36345]
Test partition sizes: [4128, 4203, 4081, 4333, 4091, 4287, 4193, 4349, 4191, 4277, 4143, 4193, 4093, 4197, 4052, 4029, 4153, 4183, 4084, 4128]
  Client 0: 36360 train samples, 62 unique classes
  Client 1: 37070 train samples, 62 unique classes
  Client 2: 35957 train samples, 62 unique classes
  Client 3: 38262 train samples, 62 unique classes
  Client 4: 36024 train samples, 62 unique classes
  Client 5: 37732 train samples, 62 unique classes
  Client 6: 36921 train samples, 62 unique classes
  Client 7: 38328 train samples, 62 unique classes
  Client 8: 36867 train samples, 62 unique classes
  Client 9: 37683 train samples, 62 unique classes
  Client 10: 36507 train samples, 62 unique classes
  Client 11: 36915 train samples, 62 unique classes
  Client 12: 36007 train samples, 62 unique classes
  Client 13: 37001 train samples, 62 unique classes
  Client 14: 35681 train samples, 62 unique classes
  Client 15: 35453 train samples, 62 unique classes
  Client 16: 36585 train samples, 62 unique classes
  Client 17: 36801 train samples, 62 unique classes
  Client 18: 35964 train samples, 62 unique classes
  Client 19: 36345 train samples, 62 unique classes
Will sample 4500 samples per client per epoch
Graph: erdos, nodes: 20, edges: 48
Degree statistics: avg=4.80, min=2, max=7
Attack: Compromised 16/20 nodes: [1, 2, 3, 5, 6, 8, 9, 10, 11, 12, 13, 14, 15, 17, 18, 19]
Attack type: directed_deviation, lambda: 1.0
Model variant: baseline
Model parameters: 6,603,710
UBAR ALGORITHM (Two-Stage Byzantine-resilient)
  - Model dimension: 6,603,710 parameters
  - Rho parameter: 0.19999999999999996
  - Stage 1: Distance-based filtering (select 20% closest neighbors)
  - Stage 2: Performance-based selection (loss comparison)
  - Complexity: O(deg(i)×d + deg(i)×inference)
Initial test acc across nodes: mean=0.0168 ± 0.0139
Round 001: test acc mean=0.0472 ± 0.0160 | min=0.0073 max=0.0596
         : test loss mean=3974.9023 ± 8153.7043
         : individual accs = ['0.059593', '0.052344', '0.057584', '0.052850', '0.058910', '0.052484', '0.057000', '0.056105', '0.053209', '0.047463', '0.050447', '0.007393', '0.054239', '0.015487', '0.048124', '0.050633', '0.058271', '0.050920', '0.052889', '0.007267']
         : correct/total = [(246, 4128), (220, 4203), (235, 4081), (229, 4333), (241, 4091), (225, 4287), (239, 4193), (244, 4349), (223, 4191), (203, 4277), (209, 4143), (31, 4193), (222, 4093), (65, 4197), (195, 4052), (204, 4029), (242, 4153), (213, 4183), (216, 4084), (30, 4128)]
         : compromised: 0.0444, honest: 0.0582
         : ubar stats = ['Node 0: s1=0.167, s2=1.000', 'Node 1: s1=0.167, s2=1.000', 'Node 2: s1=0.200, s2=1.000']...
Round 002: test acc mean=0.0525 ± 0.0061 | min=0.0365 max=0.0624
         : test loss mean=287052.4159 ± 758961.9929
         : individual accs = ['0.044574', '0.051630', '0.055134', '0.036464', '0.057932', '0.057849', '0.044598', '0.058174', '0.053209', '0.050503', '0.060101', '0.045314', '0.053506', '0.062426', '0.051579', '0.056590', '0.049362', '0.050920', '0.055583', '0.055475']
         : correct/total = [(184, 4128), (217, 4203), (225, 4081), (158, 4333), (237, 4091), (248, 4287), (187, 4193), (253, 4349), (223, 4191), (216, 4277), (249, 4143), (190, 4193), (219, 4093), (262, 4197), (209, 4052), (228, 4029), (205, 4153), (213, 4183), (227, 4084), (229, 4128)]
         : compromised: 0.0526, honest: 0.0525
         : ubar stats = ['Node 0: s1=0.167, s2=1.000', 'Node 1: s1=0.167, s2=1.000', 'Node 2: s1=0.200, s2=1.000']...
Round 003: test acc mean=0.0542 ± 0.0171 | min=0.0145 max=0.0947
         : test loss mean=26.7072 ± 51.4169
         : individual accs = ['0.059593', '0.047109', '0.050723', '0.047773', '0.093376', '0.048052', '0.057000', '0.094734', '0.053209', '0.047697', '0.055274', '0.028142', '0.058637', '0.045747', '0.061204', '0.056342', '0.058271', '0.050203', '0.055583', '0.014535']
         : correct/total = [(246, 4128), (198, 4203), (207, 4081), (207, 4333), (382, 4091), (206, 4287), (239, 4193), (412, 4349), (223, 4191), (204, 4277), (229, 4143), (118, 4193), (240, 4093), (192, 4197), (248, 4052), (227, 4029), (242, 4153), (210, 4183), (227, 4084), (60, 4128)]
         : compromised: 0.0486, honest: 0.0765
         : ubar stats = ['Node 0: s1=0.167, s2=1.000', 'Node 1: s1=0.167, s2=1.000', 'Node 2: s1=0.200, s2=1.000']...
Round 004: test acc mean=0.0587 ± 0.0142 | min=0.0281 max=0.0954
         : test loss mean=29.8905 ± 53.4331
         : individual accs = ['0.059593', '0.052344', '0.057584', '0.046619', '0.082865', '0.095405', '0.057000', '0.081628', '0.053209', '0.053075', '0.069756', '0.028142', '0.054239', '0.049559', '0.061204', '0.056590', '0.058271', '0.050920', '0.055583', '0.050872']
         : correct/total = [(246, 4128), (220, 4203), (235, 4081), (202, 4333), (339, 4091), (409, 4287), (239, 4193), (355, 4349), (223, 4191), (227, 4277), (289, 4143), (118, 4193), (222, 4093), (208, 4197), (248, 4052), (228, 4029), (242, 4153), (213, 4183), (227, 4084), (210, 4128)]
         : compromised: 0.0558, honest: 0.0706
         : ubar stats = ['Node 0: s1=0.167, s2=1.000', 'Node 1: s1=0.167, s2=1.000', 'Node 2: s1=0.200, s2=1.000']...
Round 005: test acc mean=0.0482 ± 0.0118 | min=0.0145 max=0.0596
         : test loss mean=7.9816 ± 8.6329
         : individual accs = ['0.059593', '0.052344', '0.057584', '0.017771', '0.045710', '0.043387', '0.057000', '0.047827', '0.051062', '0.053776', '0.041999', '0.049606', '0.058637', '0.045747', '0.051826', '0.051378', '0.058271', '0.050920', '0.055583', '0.014535']
         : correct/total = [(246, 4128), (220, 4203), (235, 4081), (77, 4333), (187, 4091), (186, 4287), (239, 4193), (208, 4349), (214, 4191), (230, 4277), (174, 4143), (208, 4193), (240, 4093), (192, 4197), (210, 4052), (207, 4029), (242, 4153), (213, 4183), (227, 4084), (60, 4128)]
         : compromised: 0.0471, honest: 0.0529
         : ubar stats = ['Node 0: s1=0.167, s2=1.000', 'Node 1: s1=0.167, s2=1.000', 'Node 2: s1=0.200, s2=1.000']...
Round 006: test acc mean=0.0484 ± 0.0212 | min=0.0131 max=0.1218
         : test loss mean=22.4251 ± 37.7808
         : individual accs = ['0.051357', '0.052344', '0.121784', '0.014309', '0.051088', '0.043387', '0.051991', '0.051276', '0.049869', '0.043488', '0.050447', '0.028142', '0.045688', '0.028592', '0.061204', '0.051378', '0.052011', '0.050920', '0.055583', '0.013081']
         : correct/total = [(212, 4128), (220, 4203), (497, 4081), (62, 4333), (209, 4091), (186, 4287), (218, 4193), (223, 4349), (209, 4191), (186, 4277), (209, 4143), (118, 4193), (187, 4093), (120, 4197), (248, 4052), (207, 4029), (216, 4153), (213, 4183), (227, 4084), (54, 4128)]
         : compromised: 0.0476, honest: 0.0514
         : ubar stats = ['Node 0: s1=0.167, s2=1.000', 'Node 1: s1=0.167, s2=1.000', 'Node 2: s1=0.200, s2=1.000']...
Round 007: test acc mean=0.0525 ± 0.0227 | min=0.0145 max=0.1054
         : test loss mean=7.4503 ± 7.5595
         : individual accs = ['0.081638', '0.052344', '0.057584', '0.017771', '0.047421', '0.050618', '0.105414', '0.045528', '0.053209', '0.083236', '0.055998', '0.019556', '0.058637', '0.019061', '0.052073', '0.056590', '0.079220', '0.050920', '0.048482', '0.014535']
         : correct/total = [(337, 4128), (220, 4203), (235, 4081), (77, 4333), (194, 4091), (217, 4287), (442, 4193), (198, 4349), (223, 4191), (356, 4277), (232, 4143), (82, 4193), (240, 4093), (80, 4197), (211, 4052), (228, 4029), (329, 4153), (213, 4183), (198, 4084), (60, 4128)]
         : compromised: 0.0498, honest: 0.0635
         : ubar stats = ['Node 0: s1=0.167, s2=1.000', 'Node 1: s1=0.167, s2=1.000', 'Node 2: s1=0.200, s2=1.000']...
Round 008: test acc mean=0.0482 ± 0.0264 | min=0.0057 max=0.1236
         : test loss mean=20.7478 ± 34.1756
         : individual accs = ['0.051599', '0.068285', '0.050723', '0.007154', '0.043021', '0.069279', '0.055807', '0.045068', '0.123598', '0.059387', '0.049722', '0.005724', '0.053750', '0.007148', '0.048124', '0.056342', '0.055141', '0.054028', '0.053134', '0.006298']
         : correct/total = [(213, 4128), (287, 4203), (207, 4081), (31, 4333), (176, 4091), (297, 4287), (234, 4193), (196, 4349), (518, 4191), (254, 4277), (206, 4143), (24, 4193), (220, 4093), (30, 4197), (195, 4052), (227, 4029), (229, 4153), (226, 4183), (217, 4084), (26, 4128)]
         : compromised: 0.0480, honest: 0.0487
         : ubar stats = ['Node 0: s1=0.167, s2=1.000', 'Node 1: s1=0.167, s2=1.000', 'Node 2: s1=0.200, s2=1.000']...
Round 009: test acc mean=0.0605 ± 0.0291 | min=0.0145 max=0.1138
         : test loss mean=7.1678 ± 7.0027
         : individual accs = ['0.098110', '0.050916', '0.053908', '0.017771', '0.044977', '0.095171', '0.050799', '0.043918', '0.113815', '0.055880', '0.095824', '0.019556', '0.069631', '0.019061', '0.073297', '0.062298', '0.096797', '0.081760', '0.052400', '0.014535']
         : correct/total = [(405, 4128), (214, 4203), (220, 4081), (77, 4333), (184, 4091), (408, 4287), (213, 4193), (191, 4349), (477, 4191), (239, 4277), (397, 4143), (82, 4193), (285, 4093), (80, 4197), (297, 4052), (251, 4029), (402, 4153), (342, 4183), (214, 4084), (60, 4128)]
         : compromised: 0.0579, honest: 0.0710
         : ubar stats = ['Node 0: s1=0.167, s2=1.000', 'Node 1: s1=0.167, s2=1.000', 'Node 2: s1=0.200, s2=1.000']...
Round 010: test acc mean=0.0659 ± 0.0351 | min=0.0057 max=0.1241
         : test loss mean=21.0427 ± 34.7670
         : individual accs = ['0.088663', '0.081846', '0.104141', '0.007154', '0.087509', '0.124096', '0.049130', '0.088526', '0.047960', '0.053776', '0.098721', '0.005724', '0.100904', '0.007148', '0.071076', '0.063043', '0.087407', '0.086063', '0.057297', '0.007267']
         : correct/total = [(366, 4128), (344, 4203), (425, 4081), (31, 4333), (358, 4091), (532, 4287), (206, 4193), (385, 4349), (201, 4191), (230, 4277), (409, 4143), (24, 4193), (413, 4093), (30, 4197), (288, 4052), (254, 4029), (363, 4153), (360, 4183), (234, 4084), (30, 4128)]
         : compromised: 0.0603, honest: 0.0880
         : ubar stats = ['Node 0: s1=0.167, s2=1.000', 'Node 1: s1=0.167, s2=1.000', 'Node 2: s1=0.200, s2=1.000']...

=== FINAL RESULTS ===
Dataset: femnist, Nodes: 20, Graph: erdos, Aggregation: ubar
Attack: directed_deviation, 80.0% compromised
Final accuracy - Compromised: 0.0603, Honest: 0.0880
Overall test accuracy: mean=0.0659 ± 0.0351

=== UBAR SUMMARY ===
Node 0: stage1=0.167, stage2=1.000, overall=0.167
Node 1: stage1=0.167, stage2=1.000, overall=0.167
Node 2: stage1=0.200, stage2=1.000, overall=0.200
Node 3: stage1=0.250, stage2=1.000, overall=0.250
Node 4: stage1=0.250, stage2=1.000, overall=0.250
Node 5: stage1=0.200, stage2=1.000, overall=0.200
Node 6: stage1=0.200, stage2=1.000, overall=0.200
Node 7: stage1=0.200, stage2=1.000, overall=0.200
Node 8: stage1=0.500, stage2=1.000, overall=0.500
Node 9: stage1=0.333, stage2=1.000, overall=0.333
Node 10: stage1=0.250, stage2=1.000, overall=0.250
Node 11: stage1=0.143, stage2=1.000, overall=0.143
Node 12: stage1=0.143, stage2=1.000, overall=0.143
Node 13: stage1=0.250, stage2=1.000, overall=0.250
Node 14: stage1=0.143, stage2=1.000, overall=0.143
Node 15: stage1=0.167, stage2=1.000, overall=0.167
Node 16: stage1=0.200, stage2=1.000, overall=0.200
Node 17: stage1=0.200, stage2=1.000, overall=0.200
Node 18: stage1=0.250, stage2=1.000, overall=0.250
Node 19: stage1=0.500, stage2=1.000, overall=0.500

=== PARALLEL EXECUTION TIME (realistic for distributed system) ===
  COMMUNICATION (max across nodes):
    - Full model transfer: 0.000s (0.0%)
  COMPUTATION (max across nodes):
    - Distance computation: 0.034s (0.8%)
    - Loss computation: 4.129s (99.0%)
    - Aggregation: 0.006s (0.1%)
  TOTALS:
    - Total computation: 4.168s (100.0%)
    - Total communication: 0.000s (0.0%)
    - Total parallel time: 4.168s

=== PER-NODE AVERAGE TIME ===
  - Distance computation: 0.024s
  - Loss computation: 3.899s
  - Aggregation: 0.004s
  - Model transfer: 0.000s
  - Total per node: 3.927s

=== TOTAL COMPUTATIONAL WORK (sum across all nodes) ===
  - Total distance computation: 0.481s
  - Total loss computation: 77.973s
  - Total aggregation: 0.088s
  - Total model transfer: 0.000s
  - Grand total: 78.543s
  - Mean Stage 1 acceptance rate: 0.236
  - Mean Stage 2 acceptance rate: 1.000
  - Overall acceptance rate: 0.236

UBAR Algorithm Properties:
  - Model dimension: 6,603,710
  - Rho parameter: 0.19999999999999996
  - Two-stage approach: Distance filtering + loss evaluation
  - Stage 1 selects: 20% of neighbors
  - Stage 2 uses: Training sample loss comparison
  - Theoretical complexity: O(deg(i)×d + deg(i)×inference)
  - Approach: UBAR paper implementation
