Device: cuda
Seed: 987654321
Loading 36 LEAF FEMNIST train files...
LEAF FEMNIST train: 3597 users, 734463 samples
Loading 36 LEAF FEMNIST test files...
LEAF FEMNIST test: 3597 users, 83388 samples
Found 3597 train users, 3597 test users, 3597 common users
User sample counts range: 525 (max) to 17 (min)
Distributed ALL 3597 users across 20 clients
Users per client: 179 (with 17 clients getting +1 user)
Train partition sizes: [36360, 37070, 35957, 38262, 36024, 37732, 36921, 38328, 36867, 37683, 36507, 36915, 36007, 37001, 35681, 35453, 36585, 36801, 35964, 36345]
Test partition sizes: [4128, 4203, 4081, 4333, 4091, 4287, 4193, 4349, 4191, 4277, 4143, 4193, 4093, 4197, 4052, 4029, 4153, 4183, 4084, 4128]
  Client 0: 36360 train samples, 62 unique classes
  Client 1: 37070 train samples, 62 unique classes
  Client 2: 35957 train samples, 62 unique classes
  Client 3: 38262 train samples, 62 unique classes
  Client 4: 36024 train samples, 62 unique classes
  Client 5: 37732 train samples, 62 unique classes
  Client 6: 36921 train samples, 62 unique classes
  Client 7: 38328 train samples, 62 unique classes
  Client 8: 36867 train samples, 62 unique classes
  Client 9: 37683 train samples, 62 unique classes
  Client 10: 36507 train samples, 62 unique classes
  Client 11: 36915 train samples, 62 unique classes
  Client 12: 36007 train samples, 62 unique classes
  Client 13: 37001 train samples, 62 unique classes
  Client 14: 35681 train samples, 62 unique classes
  Client 15: 35453 train samples, 62 unique classes
  Client 16: 36585 train samples, 62 unique classes
  Client 17: 36801 train samples, 62 unique classes
  Client 18: 35964 train samples, 62 unique classes
  Client 19: 36345 train samples, 62 unique classes
Will sample 4500 samples per client per epoch
Graph: ring, nodes: 20, edges: 20
Degree statistics: avg=2.00, min=2, max=2
Attack: Compromised 6/20 nodes: [5, 12, 13, 14, 17, 18]
Attack type: backdoor, lambda: 1.0
Backdoor target label: 0, trigger size: 4
Model variant: baseline
Model parameters: 6,603,710
BALANCE algorithm:
Balance Config: BALANCEConfig(gamma=2, kappa=1, alpha=0.5, min_neighbors=1)
  - Model dimension: 6,603,710 parameters
  - Complexity: O(N×d) = O(20×6,603,710)
Initial test acc across nodes: mean=0.0168 ± 0.0139
Backdoor attack: Created poisoned datasets for 6 compromised nodes
Round 001: test acc mean=0.0496 ± 0.0085 | min=0.0183 max=0.0613
         : test loss mean=13928.1084 ± 27796.8947
         : individual accs = ['0.061289', '0.051630', '0.055134', '0.047773', '0.043021', '0.045253', '0.044598', '0.053576', '0.047960', '0.050503', '0.055274', '0.060816', '0.054239', '0.018346', '0.051826', '0.050385', '0.047195', '0.049486', '0.052889', '0.050145']
         : correct/total = [(253, 4128), (217, 4203), (225, 4081), (207, 4333), (176, 4091), (194, 4287), (187, 4193), (233, 4349), (201, 4191), (216, 4277), (229, 4143), (255, 4193), (222, 4093), (77, 4197), (210, 4052), (203, 4029), (196, 4153), (207, 4183), (216, 4084), (207, 4128)]
         : compromised: 0.0453, honest: 0.0514
Round 002: test acc mean=0.0483 ± 0.0172 | min=0.0029 max=0.0847
         : test loss mean=56394.6806 ± 212459.6826
         : individual accs = ['0.044574', '0.051630', '0.055134', '0.052850', '0.057932', '0.052718', '0.084665', '0.053116', '0.051062', '0.048398', '0.045619', '0.046983', '0.002932', '0.062426', '0.048124', '0.054852', '0.054418', '0.045900', '0.003673', '0.048450']
         : correct/total = [(184, 4128), (217, 4203), (225, 4081), (229, 4333), (237, 4091), (226, 4287), (355, 4193), (231, 4349), (214, 4191), (207, 4277), (189, 4143), (197, 4193), (12, 4093), (262, 4197), (195, 4052), (221, 4029), (226, 4153), (192, 4183), (15, 4084), (200, 4128)]
         : compromised: 0.0360, honest: 0.0535
Round 003: test acc mean=0.0520 ± 0.0038 | min=0.0446 max=0.0596
         : test loss mean=nan ± nan
         : individual accs = ['0.059593', '0.050916', '0.050723', '0.052850', '0.057932', '0.048052', '0.044598', '0.051276', '0.047960', '0.047463', '0.055274', '0.053184', '0.054239', '0.049083', '0.048124', '0.056342', '0.055141', '0.049486', '0.052889', '0.055475']
         : correct/total = [(246, 4128), (214, 4203), (207, 4081), (229, 4333), (237, 4091), (206, 4287), (187, 4193), (223, 4349), (201, 4191), (203, 4277), (229, 4143), (223, 4193), (222, 4093), (206, 4197), (195, 4052), (227, 4029), (229, 4153), (207, 4183), (216, 4084), (229, 4128)]
         : compromised: 0.0503, honest: 0.0528
Round 004: test acc mean=0.0533 ± 0.0048 | min=0.0453 max=0.0600
         : test loss mean=nan ± nan
         : individual accs = ['0.059593', '0.052344', '0.057584', '0.052850', '0.057932', '0.045253', '0.057000', '0.059094', '0.049630', '0.048398', '0.045619', '0.046983', '0.054239', '0.049083', '0.051826', '0.057086', '0.059957', '0.049486', '0.052889', '0.058624']
         : correct/total = [(246, 4128), (220, 4203), (235, 4081), (229, 4333), (237, 4091), (194, 4287), (239, 4193), (257, 4349), (208, 4191), (207, 4277), (189, 4143), (197, 4193), (222, 4093), (206, 4197), (210, 4052), (230, 4029), (249, 4153), (207, 4183), (216, 4084), (242, 4128)]
         : compromised: 0.0505, honest: 0.0545
Round 005: test acc mean=0.0574 ± 0.0120 | min=0.0453 max=0.0879
         : test loss mean=nan ± nan
         : individual accs = ['0.059593', '0.052344', '0.057584', '0.052850', '0.057932', '0.045253', '0.046745', '0.047827', '0.051062', '0.053776', '0.055998', '0.056761', '0.054239', '0.049083', '0.051826', '0.087863', '0.087166', '0.049486', '0.052889', '0.078004']
         : correct/total = [(246, 4128), (220, 4203), (235, 4081), (229, 4333), (237, 4091), (194, 4287), (196, 4193), (208, 4349), (214, 4191), (230, 4277), (232, 4143), (238, 4193), (222, 4093), (206, 4197), (210, 4052), (354, 4029), (362, 4153), (207, 4183), (216, 4084), (322, 4128)]
         : compromised: 0.0505, honest: 0.0604
Round 006: test acc mean=0.0541 ± 0.0054 | min=0.0439 max=0.0683
         : test loss mean=nan ± nan
         : individual accs = ['0.068314', '0.054485', '0.057584', '0.052850', '0.057932', '0.045253', '0.043883', '0.053116', '0.053209', '0.053776', '0.050447', '0.061770', '0.054239', '0.049083', '0.051826', '0.056590', '0.058993', '0.049486', '0.052889', '0.056202']
         : correct/total = [(282, 4128), (229, 4203), (235, 4081), (229, 4333), (237, 4091), (194, 4287), (184, 4193), (231, 4349), (223, 4191), (230, 4277), (209, 4143), (259, 4193), (222, 4093), (206, 4197), (210, 4052), (228, 4029), (245, 4153), (207, 4183), (216, 4084), (232, 4128)]
         : compromised: 0.0505, honest: 0.0557
Round 007: test acc mean=0.0591 ± 0.0172 | min=0.0448 max=0.1065
         : test loss mean=nan ± nan
         : individual accs = ['0.059593', '0.052344', '0.057584', '0.044773', '0.047421', '0.045253', '0.079180', '0.058174', '0.053209', '0.053776', '0.055998', '0.053899', '0.054239', '0.049083', '0.051826', '0.106478', '0.106429', '0.049486', '0.052889', '0.050872']
         : correct/total = [(246, 4128), (220, 4203), (235, 4081), (194, 4333), (194, 4091), (194, 4287), (332, 4193), (253, 4349), (223, 4191), (230, 4277), (232, 4143), (226, 4193), (222, 4093), (206, 4197), (210, 4052), (429, 4029), (442, 4153), (207, 4183), (216, 4084), (210, 4128)]
         : compromised: 0.0505, honest: 0.0628
Round 008: test acc mean=0.0589 ± 0.0180 | min=0.0432 max=0.1289
         : test loss mean=nan ± nan
         : individual accs = ['0.050872', '0.074233', '0.053418', '0.043157', '0.053532', '0.045253', '0.049130', '0.051276', '0.073729', '0.068974', '0.055998', '0.053899', '0.054239', '0.049083', '0.051826', '0.061554', '0.057308', '0.049486', '0.052889', '0.128876']
         : correct/total = [(210, 4128), (312, 4203), (218, 4081), (187, 4333), (219, 4091), (194, 4287), (206, 4193), (223, 4349), (309, 4191), (295, 4277), (232, 4143), (226, 4193), (222, 4093), (206, 4197), (210, 4052), (248, 4029), (238, 4153), (207, 4183), (216, 4084), (532, 4128)]
         : compromised: 0.0505, honest: 0.0626
Round 009: test acc mean=0.0588 ± 0.0128 | min=0.0453 max=0.0886
         : test loss mean=nan ± nan
         : individual accs = ['0.059593', '0.050916', '0.057584', '0.052850', '0.057932', '0.045253', '0.053899', '0.066682', '0.053209', '0.048398', '0.088583', '0.053899', '0.054239', '0.049083', '0.051826', '0.087615', '0.085721', '0.049486', '0.052889', '0.055475']
         : correct/total = [(246, 4128), (214, 4203), (235, 4081), (229, 4333), (237, 4091), (194, 4287), (226, 4193), (290, 4349), (223, 4191), (207, 4277), (367, 4143), (226, 4193), (222, 4093), (206, 4197), (210, 4052), (353, 4029), (356, 4153), (207, 4183), (216, 4084), (229, 4128)]
         : compromised: 0.0505, honest: 0.0623
Round 010: test acc mean=0.0564 ± 0.0100 | min=0.0453 max=0.0819
         : test loss mean=nan ± nan
         : individual accs = ['0.052326', '0.055437', '0.057584', '0.052850', '0.057932', '0.045253', '0.049130', '0.051276', '0.047960', '0.053776', '0.055998', '0.054615', '0.054239', '0.049083', '0.051826', '0.078431', '0.081869', '0.049486', '0.052889', '0.076793']
         : correct/total = [(216, 4128), (233, 4203), (235, 4081), (229, 4333), (237, 4091), (194, 4287), (206, 4193), (223, 4349), (201, 4191), (230, 4277), (232, 4143), (229, 4193), (222, 4093), (206, 4197), (210, 4052), (316, 4029), (340, 4153), (207, 4183), (216, 4084), (317, 4128)]
         : compromised: 0.0505, honest: 0.0590

=== FINAL RESULTS ===
Dataset: femnist, Nodes: 20, Graph: ring, Aggregation: balance
Attack: backdoor, 30.0% compromised
Final accuracy - Compromised: 0.0505, Honest: 0.0590
Overall test accuracy: mean=0.0564 ± 0.0100

=== BACKDOOR ATTACK SUCCESS RATE (ASR) ===
Target label: 0
Trigger size: 4x4
Overall ASR: 0.3000 ± 0.4583
Honest nodes ASR: 0.0000 ± 0.0000
Compromised nodes ASR: 1.0000 ± 0.0000
Note: Higher ASR indicates more successful backdoor attack

=== BALANCE SUMMARY ===
Node 0: acceptance=1.000
Node 1: acceptance=1.000
Node 2: acceptance=1.000
Node 3: acceptance=1.000
Node 4: acceptance=0.500
Node 5: acceptance=0.300
Node 6: acceptance=0.500
Node 7: acceptance=1.000
Node 8: acceptance=1.000
Node 9: acceptance=1.000
Node 10: acceptance=1.000
Node 11: acceptance=0.500
Node 12: acceptance=0.150
Node 13: acceptance=0.100
Node 14: acceptance=0.250
Node 15: acceptance=0.500
Node 16: acceptance=0.500
Node 17: acceptance=0.150
Node 18: acceptance=0.250
Node 19: acceptance=0.500

=== PARALLEL EXECUTION TIME (realistic for distributed system) ===
  COMMUNICATION (max across nodes):
    - Full model transfer: 0.000s (0.0%)
  COMPUTATION (max across nodes):
    - Filtering: 0.021s (58.7%)
    - Aggregation: 0.015s (41.2%)
  TOTALS:
    - Total computation: 0.036s (100.0%)
    - Total communication: 0.000s (0.0%)
    - Total parallel time: 0.036s

=== PER-NODE AVERAGE TIME ===
  - Filtering: 0.012s
  - Aggregation: 0.004s
  - Model transfer: 0.000s
  - Total per node: 0.016s

=== TOTAL COMPUTATIONAL WORK (sum across all nodes) ===
  - Total filtering: 0.240s
  - Total aggregation: 0.085s
  - Total model transfer: 0.000s
  - Grand total: 0.325s
  - Mean acceptance rate: 0.610

BALANCE Algorithm Properties:
  - Model dimension: 6,603,710
  - No compression: Full parameter comparison
  - Theoretical complexity: O(deg(i)×d)
  - Approach: Full parameter filtering + averaging
