Device: cuda
Seed: 987654321
Loading 36 LEAF FEMNIST train files...
LEAF FEMNIST train: 3597 users, 734463 samples
Loading 36 LEAF FEMNIST test files...
LEAF FEMNIST test: 3597 users, 83388 samples
Found 3597 train users, 3597 test users, 3597 common users
User sample counts range: 525 (max) to 17 (min)
Distributed ALL 3597 users across 20 clients
Users per client: 179 (with 17 clients getting +1 user)
Train partition sizes: [36360, 37070, 35957, 38262, 36024, 37732, 36921, 38328, 36867, 37683, 36507, 36915, 36007, 37001, 35681, 35453, 36585, 36801, 35964, 36345]
Test partition sizes: [4128, 4203, 4081, 4333, 4091, 4287, 4193, 4349, 4191, 4277, 4143, 4193, 4093, 4197, 4052, 4029, 4153, 4183, 4084, 4128]
  Client 0: 36360 train samples, 62 unique classes
  Client 1: 37070 train samples, 62 unique classes
  Client 2: 35957 train samples, 62 unique classes
  Client 3: 38262 train samples, 62 unique classes
  Client 4: 36024 train samples, 62 unique classes
  Client 5: 37732 train samples, 62 unique classes
  Client 6: 36921 train samples, 62 unique classes
  Client 7: 38328 train samples, 62 unique classes
  Client 8: 36867 train samples, 62 unique classes
  Client 9: 37683 train samples, 62 unique classes
  Client 10: 36507 train samples, 62 unique classes
  Client 11: 36915 train samples, 62 unique classes
  Client 12: 36007 train samples, 62 unique classes
  Client 13: 37001 train samples, 62 unique classes
  Client 14: 35681 train samples, 62 unique classes
  Client 15: 35453 train samples, 62 unique classes
  Client 16: 36585 train samples, 62 unique classes
  Client 17: 36801 train samples, 62 unique classes
  Client 18: 35964 train samples, 62 unique classes
  Client 19: 36345 train samples, 62 unique classes
Will sample 4500 samples per client per epoch
Graph: erdos, nodes: 20, edges: 126
Degree statistics: avg=12.60, min=8, max=16
Attack: Compromised 14/20 nodes: [1, 2, 3, 5, 6, 8, 11, 12, 13, 14, 15, 17, 18, 19]
Attack type: directed_deviation, lambda: 1.0
Model variant: baseline
Model parameters: 6,603,710
BALANCE algorithm:
Balance Config: BALANCEConfig(gamma=2, kappa=1, alpha=0.5, min_neighbors=1)
  - Model dimension: 6,603,710 parameters
  - Complexity: O(N×d) = O(20×6,603,710)
Initial test acc across nodes: mean=0.0168 ± 0.0139
Round 001: test acc mean=0.0527 ± 0.0043 | min=0.0434 max=0.0596
         : test loss mean=4.0365 ± 0.0061
         : individual accs = ['0.059593', '0.051630', '0.055134', '0.043388', '0.057932', '0.056216', '0.057000', '0.058174', '0.053209', '0.047463', '0.050447', '0.053899', '0.050818', '0.046938', '0.048124', '0.050633', '0.058271', '0.050920', '0.054358', '0.050145']
         : correct/total = [(246, 4128), (217, 4203), (225, 4081), (188, 4333), (237, 4091), (241, 4287), (239, 4193), (253, 4349), (223, 4191), (203, 4277), (209, 4143), (226, 4193), (208, 4093), (197, 4197), (195, 4052), (204, 4029), (242, 4153), (213, 4183), (222, 4084), (207, 4128)]
         : compromised: 0.0516, honest: 0.0553
Round 002: test acc mean=0.0524 ± 0.0039 | min=0.0439 max=0.0582
         : test loss mean=3.8946 ± 0.0294
         : individual accs = ['0.044574', '0.051630', '0.055134', '0.052850', '0.057932', '0.050618', '0.043883', '0.058174', '0.053209', '0.053776', '0.055998', '0.053899', '0.054239', '0.046938', '0.050346', '0.056342', '0.054418', '0.050920', '0.055583', '0.048450']
         : correct/total = [(184, 4128), (217, 4203), (225, 4081), (229, 4333), (237, 4091), (217, 4287), (184, 4193), (253, 4349), (223, 4191), (230, 4277), (232, 4143), (226, 4193), (222, 4093), (197, 4197), (204, 4052), (227, 4029), (226, 4153), (213, 4183), (227, 4084), (200, 4128)]
         : compromised: 0.0517, honest: 0.0541
Round 003: test acc mean=0.0551 ± 0.0045 | min=0.0475 max=0.0624
         : test loss mean=3.7298 ± 0.0203
         : individual accs = ['0.059593', '0.050916', '0.050723', '0.048234', '0.057932', '0.050618', '0.057000', '0.051276', '0.054880', '0.047463', '0.055998', '0.061770', '0.058637', '0.062426', '0.061204', '0.056342', '0.058271', '0.050203', '0.052889', '0.055475']
         : correct/total = [(246, 4128), (214, 4203), (207, 4081), (209, 4333), (237, 4091), (217, 4287), (239, 4193), (223, 4349), (230, 4191), (203, 4277), (232, 4143), (259, 4193), (240, 4093), (262, 4197), (248, 4052), (227, 4029), (242, 4153), (210, 4183), (216, 4084), (229, 4128)]
         : compromised: 0.0551, honest: 0.0551
Round 004: test acc mean=0.0553 ± 0.0040 | min=0.0484 max=0.0624
         : test loss mean=3.6880 ± 0.0165
         : individual accs = ['0.059593', '0.052344', '0.057584', '0.052850', '0.057932', '0.050618', '0.058669', '0.058174', '0.053209', '0.048398', '0.057929', '0.053899', '0.054239', '0.062426', '0.061204', '0.056590', '0.058271', '0.050920', '0.052889', '0.048450']
         : correct/total = [(246, 4128), (220, 4203), (235, 4081), (229, 4333), (237, 4091), (217, 4287), (246, 4193), (253, 4349), (223, 4191), (207, 4277), (240, 4143), (226, 4193), (222, 4093), (262, 4197), (248, 4052), (228, 4029), (242, 4153), (213, 4183), (216, 4084), (200, 4128)]
         : compromised: 0.0547, honest: 0.0567
Round 005: test acc mean=0.0541 ± 0.0042 | min=0.0467 max=0.0610
         : test loss mean=3.6816 ± 0.0162
         : individual accs = ['0.059593', '0.052344', '0.057584', '0.052850', '0.057932', '0.050618', '0.057000', '0.047827', '0.051062', '0.053776', '0.055998', '0.046745', '0.058637', '0.046938', '0.051579', '0.054852', '0.058271', '0.050920', '0.055583', '0.061047']
         : correct/total = [(246, 4128), (220, 4203), (235, 4081), (229, 4333), (237, 4091), (217, 4287), (239, 4193), (208, 4349), (214, 4191), (230, 4277), (232, 4143), (196, 4193), (240, 4093), (197, 4197), (209, 4052), (221, 4029), (242, 4153), (213, 4183), (227, 4084), (252, 4128)]
         : compromised: 0.0534, honest: 0.0556
Round 006: test acc mean=0.0537 ± 0.0057 | min=0.0420 max=0.0624
         : test loss mean=3.6802 ± 0.0166
         : individual accs = ['0.044574', '0.052344', '0.057584', '0.052850', '0.057932', '0.043387', '0.057000', '0.047827', '0.053209', '0.053776', '0.041999', '0.061770', '0.053750', '0.062426', '0.061204', '0.051378', '0.058271', '0.050920', '0.055583', '0.055475']
         : correct/total = [(184, 4128), (220, 4203), (235, 4081), (229, 4333), (237, 4091), (186, 4287), (239, 4193), (208, 4349), (223, 4191), (230, 4277), (174, 4143), (259, 4193), (220, 4093), (262, 4197), (248, 4052), (207, 4029), (242, 4153), (213, 4183), (227, 4084), (229, 4128)]
         : compromised: 0.0549, honest: 0.0507
Round 007: test acc mean=0.0586 ± 0.0133 | min=0.0435 max=0.1028
         : test loss mean=3.6801 ± 0.0164
         : individual accs = ['0.059593', '0.052344', '0.057584', '0.052850', '0.047421', '0.050618', '0.102790', '0.058174', '0.053209', '0.043488', '0.055998', '0.053899', '0.058637', '0.068144', '0.051826', '0.056590', '0.087407', '0.050920', '0.055828', '0.055475']
         : correct/total = [(246, 4128), (220, 4203), (235, 4081), (229, 4333), (194, 4091), (217, 4287), (431, 4193), (253, 4349), (223, 4191), (186, 4277), (232, 4143), (226, 4193), (240, 4093), (286, 4197), (210, 4052), (228, 4029), (363, 4153), (213, 4183), (228, 4084), (229, 4128)]
         : compromised: 0.0586, honest: 0.0587
Round 008: test acc mean=0.0557 ± 0.0120 | min=0.0448 max=0.0921
         : test loss mean=3.6802 ± 0.0167
         : individual accs = ['0.051599', '0.051630', '0.050723', '0.044773', '0.051088', '0.085141', '0.052707', '0.051276', '0.092102', '0.053075', '0.046826', '0.067970', '0.053750', '0.047177', '0.048124', '0.056342', '0.055141', '0.051399', '0.055583', '0.048450']
         : correct/total = [(213, 4128), (217, 4203), (207, 4081), (194, 4333), (209, 4091), (365, 4287), (221, 4193), (223, 4349), (386, 4191), (227, 4277), (194, 4143), (285, 4193), (220, 4093), (198, 4197), (195, 4052), (227, 4029), (229, 4153), (215, 4183), (227, 4084), (200, 4128)]
         : compromised: 0.0576, honest: 0.0515
Round 009: test acc mean=0.0547 ± 0.0079 | min=0.0439 max=0.0833
         : test loss mean=3.6789 ± 0.0169
         : individual accs = ['0.051599', '0.050916', '0.048272', '0.052850', '0.052310', '0.050618', '0.054615', '0.043918', '0.053209', '0.047463', '0.055998', '0.053899', '0.058637', '0.062426', '0.051579', '0.062547', '0.083313', '0.050920', '0.052889', '0.055475']
         : correct/total = [(213, 4128), (214, 4203), (197, 4081), (229, 4333), (214, 4091), (217, 4287), (229, 4193), (191, 4349), (223, 4191), (203, 4277), (232, 4143), (226, 4193), (240, 4093), (262, 4197), (209, 4052), (252, 4029), (346, 4153), (213, 4183), (216, 4084), (229, 4128)]
         : compromised: 0.0542, honest: 0.0558
Round 010: test acc mean=0.0555 ± 0.0039 | min=0.0480 max=0.0624
         : test loss mean=3.6785 ± 0.0171
         : individual accs = ['0.059593', '0.052344', '0.057584', '0.052850', '0.057932', '0.050618', '0.049130', '0.058174', '0.047960', '0.053776', '0.055998', '0.054138', '0.059125', '0.062426', '0.061204', '0.056590', '0.058271', '0.050920', '0.055583', '0.055475']
         : correct/total = [(246, 4128), (220, 4203), (235, 4081), (229, 4333), (237, 4091), (217, 4287), (206, 4193), (253, 4349), (201, 4191), (230, 4277), (232, 4143), (227, 4193), (242, 4093), (262, 4197), (248, 4052), (228, 4029), (242, 4153), (213, 4183), (227, 4084), (229, 4128)]
         : compromised: 0.0547, honest: 0.0573

=== FINAL RESULTS ===
Dataset: femnist, Nodes: 20, Graph: erdos, Aggregation: balance
Attack: directed_deviation, 70.0% compromised
Final accuracy - Compromised: 0.0547, Honest: 0.0573
Overall test accuracy: mean=0.0555 ± 0.0039

=== BALANCE SUMMARY ===
Node 0: acceptance=0.312
Node 1: acceptance=0.364
Node 2: acceptance=0.333
Node 3: acceptance=0.375
Node 4: acceptance=0.364
Node 5: acceptance=0.267
Node 6: acceptance=0.286
Node 7: acceptance=0.286
Node 8: acceptance=0.200
Node 9: acceptance=0.308
Node 10: acceptance=0.222
Node 11: acceptance=0.357
Node 12: acceptance=0.333
Node 13: acceptance=0.231
Node 14: acceptance=0.267
Node 15: acceptance=0.273
Node 16: acceptance=0.231
Node 17: acceptance=0.444
Node 18: acceptance=0.312
Node 19: acceptance=0.312

=== PARALLEL EXECUTION TIME (realistic for distributed system) ===
  COMMUNICATION (max across nodes):
    - Full model transfer: 0.000s (0.0%)
  COMPUTATION (max across nodes):
    - Filtering: 0.063s (82.9%)
    - Aggregation: 0.013s (17.1%)
  TOTALS:
    - Total computation: 0.076s (100.0%)
    - Total communication: 0.000s (0.0%)
    - Total parallel time: 0.076s

=== PER-NODE AVERAGE TIME ===
  - Filtering: 0.050s
  - Aggregation: 0.004s
  - Model transfer: 0.000s
  - Total per node: 0.055s

=== TOTAL COMPUTATIONAL WORK (sum across all nodes) ===
  - Total filtering: 1.007s
  - Total aggregation: 0.088s
  - Total model transfer: 0.000s
  - Grand total: 1.094s
  - Mean acceptance rate: 0.304

BALANCE Algorithm Properties:
  - Model dimension: 6,603,710
  - No compression: Full parameter comparison
  - Theoretical complexity: O(deg(i)×d)
  - Approach: Full parameter filtering + averaging
