Device: cuda
Seed: 987654321
Loading 36 LEAF FEMNIST train files...
LEAF FEMNIST train: 3597 users, 734463 samples
Loading 36 LEAF FEMNIST test files...
LEAF FEMNIST test: 3597 users, 83388 samples
Found 3597 train users, 3597 test users, 3597 common users
User sample counts range: 525 (max) to 17 (min)
Distributed ALL 3597 users across 20 clients
Users per client: 179 (with 17 clients getting +1 user)
Train partition sizes: [36360, 37070, 35957, 38262, 36024, 37732, 36921, 38328, 36867, 37683, 36507, 36915, 36007, 37001, 35681, 35453, 36585, 36801, 35964, 36345]
Test partition sizes: [4128, 4203, 4081, 4333, 4091, 4287, 4193, 4349, 4191, 4277, 4143, 4193, 4093, 4197, 4052, 4029, 4153, 4183, 4084, 4128]
  Client 0: 36360 train samples, 62 unique classes
  Client 1: 37070 train samples, 62 unique classes
  Client 2: 35957 train samples, 62 unique classes
  Client 3: 38262 train samples, 62 unique classes
  Client 4: 36024 train samples, 62 unique classes
  Client 5: 37732 train samples, 62 unique classes
  Client 6: 36921 train samples, 62 unique classes
  Client 7: 38328 train samples, 62 unique classes
  Client 8: 36867 train samples, 62 unique classes
  Client 9: 37683 train samples, 62 unique classes
  Client 10: 36507 train samples, 62 unique classes
  Client 11: 36915 train samples, 62 unique classes
  Client 12: 36007 train samples, 62 unique classes
  Client 13: 37001 train samples, 62 unique classes
  Client 14: 35681 train samples, 62 unique classes
  Client 15: 35453 train samples, 62 unique classes
  Client 16: 36585 train samples, 62 unique classes
  Client 17: 36801 train samples, 62 unique classes
  Client 18: 35964 train samples, 62 unique classes
  Client 19: 36345 train samples, 62 unique classes
Will sample 4500 samples per client per epoch
Graph: ring, nodes: 20, edges: 20
Degree statistics: avg=2.00, min=2, max=2
Attack: Compromised 14/20 nodes: [1, 2, 3, 5, 6, 8, 11, 12, 13, 14, 15, 17, 18, 19]
Attack type: gaussian, lambda: 1.0
Model variant: baseline
Model parameters: 6,603,710
UBAR ALGORITHM (Two-Stage Byzantine-resilient)
  - Model dimension: 6,603,710 parameters
  - Rho parameter: 0.30000000000000004
  - Stage 1: Distance-based filtering (select 30% closest neighbors)
  - Stage 2: Performance-based selection (loss comparison)
  - Complexity: O(deg(i)×d + deg(i)×inference)
Initial test acc across nodes: mean=0.0168 ± 0.0139
Round 001: test acc mean=0.0347 ± 0.0204 | min=0.0027 max=0.0608
         : test loss mean=393632820.7974 ± 472633090.3192
         : individual accs = ['0.014777', '0.052344', '0.003676', '0.043157', '0.002689', '0.057849', '0.044598', '0.011497', '0.047960', '0.047463', '0.055274', '0.060816', '0.024432', '0.012628', '0.047878', '0.050385', '0.012280', '0.050920', '0.003673', '0.050145']
         : correct/total = [(61, 4128), (220, 4203), (15, 4081), (187, 4333), (11, 4091), (248, 4287), (187, 4193), (50, 4349), (201, 4191), (203, 4277), (229, 4143), (255, 4193), (100, 4093), (53, 4197), (194, 4052), (203, 4029), (51, 4153), (213, 4183), (15, 4084), (207, 4128)]
         : compromised: 0.0393, honest: 0.0240
         : ubar stats = ['Node 0: s1=0.500, s2=1.000', 'Node 1: s1=0.500, s2=1.000', 'Node 2: s1=0.500, s2=1.000']...
Round 002: test acc mean=0.0411 ± 0.0182 | min=0.0034 max=0.0583
         : test loss mean=nan ± nan
         : individual accs = ['0.047238', '0.048061', '0.057584', '0.004385', '0.043021', '0.045253', '0.050799', '0.045068', '0.051062', '0.048398', '0.045619', '0.046983', '0.050818', '0.055278', '0.051579', '0.005460', '0.058271', '0.009084', '0.054358', '0.003391']
         : correct/total = [(195, 4128), (202, 4203), (235, 4081), (19, 4333), (176, 4091), (194, 4287), (213, 4193), (196, 4349), (214, 4191), (207, 4277), (189, 4143), (197, 4193), (208, 4093), (232, 4197), (209, 4052), (22, 4029), (242, 4153), (38, 4183), (222, 4084), (14, 4128)]
         : compromised: 0.0381, honest: 0.0479
         : ubar stats = ['Node 0: s1=0.500, s2=1.000', 'Node 1: s1=0.500, s2=1.000', 'Node 2: s1=0.500, s2=1.000']...
Round 003: test acc mean=0.0502 ± 0.0048 | min=0.0417 max=0.0583
         : test loss mean=nan ± nan
         : individual accs = ['0.047238', '0.048775', '0.057584', '0.043157', '0.043021', '0.045253', '0.050799', '0.045068', '0.051539', '0.047463', '0.055274', '0.053184', '0.049841', '0.055278', '0.051579', '0.041698', '0.058271', '0.049486', '0.054358', '0.054506']
         : correct/total = [(195, 4128), (205, 4203), (235, 4081), (187, 4333), (176, 4091), (194, 4287), (213, 4193), (196, 4349), (216, 4191), (203, 4277), (229, 4143), (223, 4193), (204, 4093), (232, 4197), (209, 4052), (168, 4029), (242, 4153), (207, 4183), (222, 4084), (225, 4128)]
         : compromised: 0.0505, honest: 0.0494
         : ubar stats = ['Node 0: s1=0.500, s2=1.000', 'Node 1: s1=0.500, s2=1.000', 'Node 2: s1=0.500, s2=1.000']...
Round 004: test acc mean=0.0491 ± 0.0043 | min=0.0417 max=0.0576
         : test loss mean=nan ± nan
         : individual accs = ['0.047238', '0.048775', '0.057584', '0.043157', '0.043021', '0.045253', '0.050799', '0.045068', '0.049630', '0.048398', '0.045619', '0.046983', '0.050818', '0.055278', '0.051579', '0.041698', '0.052011', '0.049486', '0.054358', '0.054506']
         : correct/total = [(195, 4128), (205, 4203), (235, 4081), (187, 4333), (176, 4091), (194, 4287), (213, 4193), (196, 4349), (208, 4191), (207, 4277), (189, 4143), (197, 4193), (208, 4093), (232, 4197), (209, 4052), (168, 4029), (216, 4153), (207, 4183), (222, 4084), (225, 4128)]
         : compromised: 0.0500, honest: 0.0469
         : ubar stats = ['Node 0: s1=0.500, s2=1.000', 'Node 1: s1=0.500, s2=1.000', 'Node 2: s1=0.500, s2=1.000']...
Round 005: test acc mean=0.0534 ± 0.0154 | min=0.0417 max=0.1172
         : test loss mean=nan ± nan
         : individual accs = ['0.050145', '0.048775', '0.057584', '0.043157', '0.043021', '0.045253', '0.050799', '0.045068', '0.117156', '0.053776', '0.055998', '0.061054', '0.050818', '0.045747', '0.051579', '0.041698', '0.052011', '0.049486', '0.050930', '0.054506']
         : correct/total = [(207, 4128), (205, 4203), (235, 4081), (187, 4333), (176, 4091), (194, 4287), (213, 4193), (196, 4349), (491, 4191), (230, 4277), (232, 4143), (256, 4193), (208, 4093), (192, 4197), (209, 4052), (168, 4029), (216, 4153), (207, 4183), (208, 4084), (225, 4128)]
         : compromised: 0.0549, honest: 0.0500
         : ubar stats = ['Node 0: s1=0.500, s2=1.000', 'Node 1: s1=0.500, s2=1.000', 'Node 2: s1=0.500, s2=1.000']...
Round 006: test acc mean=0.0528 ± 0.0138 | min=0.0284 max=0.0910
         : test loss mean=nan ± nan
         : individual accs = ['0.050145', '0.048775', '0.057584', '0.043157', '0.043021', '0.045253', '0.050799', '0.045068', '0.053686', '0.090952', '0.086894', '0.061770', '0.050818', '0.028354', '0.051579', '0.041698', '0.052011', '0.049486', '0.050930', '0.054506']
         : correct/total = [(207, 4128), (205, 4203), (235, 4081), (187, 4333), (176, 4091), (194, 4287), (213, 4193), (196, 4349), (225, 4191), (389, 4277), (360, 4143), (259, 4193), (208, 4093), (119, 4197), (209, 4052), (168, 4029), (216, 4153), (207, 4183), (208, 4084), (225, 4128)]
         : compromised: 0.0492, honest: 0.0613
         : ubar stats = ['Node 0: s1=0.500, s2=1.000', 'Node 1: s1=0.500, s2=1.000', 'Node 2: s1=0.500, s2=1.000']...
Round 007: test acc mean=0.0509 ± 0.0055 | min=0.0417 max=0.0632
         : test loss mean=nan ± nan
         : individual accs = ['0.050145', '0.048775', '0.054889', '0.043157', '0.043021', '0.045253', '0.050799', '0.045068', '0.054880', '0.060556', '0.063239', '0.053899', '0.050818', '0.055278', '0.051579', '0.041698', '0.050084', '0.049486', '0.050930', '0.054506']
         : correct/total = [(207, 4128), (205, 4203), (224, 4081), (187, 4333), (176, 4091), (194, 4287), (213, 4193), (196, 4349), (230, 4191), (259, 4277), (262, 4143), (226, 4193), (208, 4093), (232, 4197), (209, 4052), (168, 4029), (208, 4153), (207, 4183), (208, 4084), (225, 4128)]
         : compromised: 0.0504, honest: 0.0520
         : ubar stats = ['Node 0: s1=0.500, s2=1.000', 'Node 1: s1=0.500, s2=1.000', 'Node 2: s1=0.500, s2=1.000']...
Round 008: test acc mean=0.0545 ± 0.0135 | min=0.0417 max=0.0990
         : test loss mean=nan ± nan
         : individual accs = ['0.050145', '0.048775', '0.054889', '0.043157', '0.043021', '0.045253', '0.050799', '0.045068', '0.099022', '0.073884', '0.077963', '0.054615', '0.049841', '0.049083', '0.051826', '0.041698', '0.052011', '0.049486', '0.055583', '0.054506']
         : correct/total = [(207, 4128), (205, 4203), (224, 4081), (187, 4333), (176, 4091), (194, 4287), (213, 4193), (196, 4349), (415, 4191), (316, 4277), (323, 4143), (229, 4193), (204, 4093), (206, 4197), (210, 4052), (168, 4029), (216, 4153), (207, 4183), (227, 4084), (225, 4128)]
         : compromised: 0.0535, honest: 0.0570
         : ubar stats = ['Node 0: s1=0.500, s2=1.000', 'Node 1: s1=0.500, s2=1.000', 'Node 2: s1=0.500, s2=1.000']...
Round 009: test acc mean=0.0530 ± 0.0128 | min=0.0417 max=0.1047
         : test loss mean=nan ± nan
         : individual accs = ['0.050145', '0.048775', '0.054889', '0.043157', '0.043021', '0.045253', '0.050799', '0.045068', '0.104748', '0.057751', '0.056481', '0.058908', '0.050818', '0.049083', '0.051826', '0.041698', '0.051288', '0.049486', '0.052889', '0.054506']
         : correct/total = [(207, 4128), (205, 4203), (224, 4081), (187, 4333), (176, 4091), (194, 4287), (213, 4193), (196, 4349), (439, 4191), (247, 4277), (234, 4143), (247, 4193), (208, 4093), (206, 4197), (210, 4052), (168, 4029), (213, 4153), (207, 4183), (216, 4084), (225, 4128)]
         : compromised: 0.0541, honest: 0.0506
         : ubar stats = ['Node 0: s1=0.500, s2=1.000', 'Node 1: s1=0.500, s2=1.000', 'Node 2: s1=0.500, s2=1.000']...
Round 010: test acc mean=0.0511 ± 0.0129 | min=0.0193 max=0.0928
         : test loss mean=nan ± nan
         : individual accs = ['0.050145', '0.048775', '0.063955', '0.043157', '0.043021', '0.045253', '0.050799', '0.045068', '0.055357', '0.053776', '0.055998', '0.092774', '0.049841', '0.049083', '0.051826', '0.041698', '0.058271', '0.049486', '0.019344', '0.054506']
         : correct/total = [(207, 4128), (205, 4203), (261, 4081), (187, 4333), (176, 4091), (194, 4287), (213, 4193), (196, 4349), (232, 4191), (230, 4277), (232, 4143), (389, 4193), (204, 4093), (206, 4197), (210, 4052), (168, 4029), (242, 4153), (207, 4183), (79, 4084), (225, 4128)]
         : compromised: 0.0511, honest: 0.0510
         : ubar stats = ['Node 0: s1=0.500, s2=1.000', 'Node 1: s1=0.500, s2=1.000', 'Node 2: s1=0.500, s2=1.000']...

=== FINAL RESULTS ===
Dataset: femnist, Nodes: 20, Graph: ring, Aggregation: ubar
Attack: gaussian, 70.0% compromised
Final accuracy - Compromised: 0.0511, Honest: 0.0510
Overall test accuracy: mean=0.0511 ± 0.0129

=== UBAR SUMMARY ===
Node 0: stage1=0.500, stage2=1.000, overall=0.500
Node 1: stage1=0.500, stage2=1.000, overall=0.500
Node 2: stage1=0.500, stage2=1.000, overall=0.500
Node 3: stage1=0.500, stage2=1.000, overall=0.500
Node 4: stage1=0.500, stage2=1.000, overall=0.500
Node 5: stage1=0.500, stage2=1.000, overall=0.500
Node 6: stage1=0.500, stage2=1.000, overall=0.500
Node 7: stage1=0.500, stage2=1.000, overall=0.500
Node 8: stage1=0.500, stage2=1.000, overall=0.500
Node 9: stage1=0.500, stage2=1.000, overall=0.500
Node 10: stage1=0.500, stage2=1.000, overall=0.500
Node 11: stage1=0.500, stage2=1.000, overall=0.500
Node 12: stage1=0.500, stage2=1.000, overall=0.500
Node 13: stage1=0.500, stage2=1.000, overall=0.500
Node 14: stage1=0.500, stage2=1.000, overall=0.500
Node 15: stage1=0.500, stage2=1.000, overall=0.500
Node 16: stage1=0.500, stage2=1.000, overall=0.500
Node 17: stage1=0.500, stage2=1.000, overall=0.500
Node 18: stage1=0.500, stage2=1.000, overall=0.500
Node 19: stage1=0.500, stage2=1.000, overall=0.500

=== PARALLEL EXECUTION TIME (realistic for distributed system) ===
  COMMUNICATION (max across nodes):
    - Full model transfer: 0.000s (0.0%)
  COMPUTATION (max across nodes):
    - Distance computation: 0.029s (0.7%)
    - Loss computation: 4.098s (98.9%)
    - Aggregation: 0.017s (0.4%)
  TOTALS:
    - Total computation: 4.145s (100.0%)
    - Total communication: 0.000s (0.0%)
    - Total parallel time: 4.145s

=== PER-NODE AVERAGE TIME ===
  - Distance computation: 0.011s
  - Loss computation: 3.873s
  - Aggregation: 0.009s
  - Model transfer: 0.000s
  - Total per node: 3.892s

=== TOTAL COMPUTATIONAL WORK (sum across all nodes) ===
  - Total distance computation: 0.218s
  - Total loss computation: 77.455s
  - Total aggregation: 0.172s
  - Total model transfer: 0.000s
  - Grand total: 77.846s
  - Mean Stage 1 acceptance rate: 0.500
  - Mean Stage 2 acceptance rate: 1.000
  - Overall acceptance rate: 0.500

UBAR Algorithm Properties:
  - Model dimension: 6,603,710
  - Rho parameter: 0.30000000000000004
  - Two-stage approach: Distance filtering + loss evaluation
  - Stage 1 selects: 30% of neighbors
  - Stage 2 uses: Training sample loss comparison
  - Theoretical complexity: O(deg(i)×d + deg(i)×inference)
  - Approach: UBAR paper implementation
