Device: cuda
Seed: 987654321
Loading 36 LEAF FEMNIST train files...
LEAF FEMNIST train: 3597 users, 734463 samples
Loading 36 LEAF FEMNIST test files...
LEAF FEMNIST test: 3597 users, 83388 samples
Found 3597 train users, 3597 test users, 3597 common users
User sample counts range: 525 (max) to 17 (min)
Distributed ALL 3597 users across 20 clients
Users per client: 179 (with 17 clients getting +1 user)
Train partition sizes: [36360, 37070, 35957, 38262, 36024, 37732, 36921, 38328, 36867, 37683, 36507, 36915, 36007, 37001, 35681, 35453, 36585, 36801, 35964, 36345]
Test partition sizes: [4128, 4203, 4081, 4333, 4091, 4287, 4193, 4349, 4191, 4277, 4143, 4193, 4093, 4197, 4052, 4029, 4153, 4183, 4084, 4128]
  Client 0: 36360 train samples, 62 unique classes
  Client 1: 37070 train samples, 62 unique classes
  Client 2: 35957 train samples, 62 unique classes
  Client 3: 38262 train samples, 62 unique classes
  Client 4: 36024 train samples, 62 unique classes
  Client 5: 37732 train samples, 62 unique classes
  Client 6: 36921 train samples, 62 unique classes
  Client 7: 38328 train samples, 62 unique classes
  Client 8: 36867 train samples, 62 unique classes
  Client 9: 37683 train samples, 62 unique classes
  Client 10: 36507 train samples, 62 unique classes
  Client 11: 36915 train samples, 62 unique classes
  Client 12: 36007 train samples, 62 unique classes
  Client 13: 37001 train samples, 62 unique classes
  Client 14: 35681 train samples, 62 unique classes
  Client 15: 35453 train samples, 62 unique classes
  Client 16: 36585 train samples, 62 unique classes
  Client 17: 36801 train samples, 62 unique classes
  Client 18: 35964 train samples, 62 unique classes
  Client 19: 36345 train samples, 62 unique classes
Will sample 4500 samples per client per epoch
Graph: erdos, nodes: 20, edges: 48
Degree statistics: avg=4.80, min=2, max=7
Attack: Compromised 8/20 nodes: [1, 5, 11, 12, 13, 14, 17, 18]
Attack type: directed_deviation, lambda: 1.0
Model variant: baseline
Model parameters: 6,603,710
Initial test acc across nodes: mean=0.0168 ± 0.0139
Round 001: test acc mean=0.0235 ± 0.0197 | min=0.0039 max=0.0596
         : test loss mean=41425.3800 ± 94815.2839
         : individual accs = ['0.059593', '0.052344', '0.015927', '0.024694', '0.058176', '0.021693', '0.006201', '0.041389', '0.014078', '0.009586', '0.010138', '0.018841', '0.003909', '0.004765', '0.045410', '0.009432', '0.004093', '0.011475', '0.003918', '0.054506']
         : correct/total = [(246, 4128), (220, 4203), (65, 4081), (107, 4333), (238, 4091), (93, 4287), (26, 4193), (180, 4349), (59, 4191), (41, 4277), (42, 4143), (79, 4193), (16, 4093), (20, 4197), (184, 4052), (38, 4029), (17, 4153), (48, 4183), (16, 4084), (225, 4128)]
         : compromised: 0.0203, honest: 0.0257
Round 002: test acc mean=0.0465 ± 0.0105 | min=0.0036 max=0.0576
         : test loss mean=884840890696612.2500 ± 3855864504639488.5000
         : individual accs = ['0.044574', '0.047109', '0.057584', '0.044773', '0.044977', '0.048752', '0.043883', '0.053116', '0.047960', '0.047697', '0.047309', '0.046983', '0.052040', '0.055278', '0.045656', '0.050881', '0.051288', '0.003586', '0.052155', '0.045058']
         : correct/total = [(184, 4128), (198, 4203), (235, 4081), (194, 4333), (184, 4091), (209, 4287), (184, 4193), (231, 4349), (201, 4191), (204, 4277), (196, 4143), (197, 4193), (213, 4093), (232, 4197), (185, 4052), (205, 4029), (213, 4153), (15, 4183), (213, 4084), (186, 4128)]
         : compromised: 0.0439, honest: 0.0483
Round 003: test acc mean=0.0456 ± 0.0088 | min=0.0148 max=0.0553
         : test loss mean=140223621901.8345 ± 509289588967.6415
         : individual accs = ['0.044574', '0.036878', '0.048518', '0.046619', '0.052066', '0.045953', '0.043883', '0.049207', '0.049630', '0.044891', '0.047550', '0.046983', '0.048620', '0.055278', '0.032330', '0.050881', '0.051047', '0.048291', '0.054358', '0.014777']
         : correct/total = [(184, 4128), (155, 4203), (198, 4081), (202, 4333), (213, 4091), (197, 4287), (184, 4193), (214, 4349), (208, 4191), (192, 4277), (197, 4143), (197, 4193), (199, 4093), (232, 4197), (131, 4052), (205, 4029), (212, 4153), (202, 4183), (222, 4084), (61, 4128)]
         : compromised: 0.0461, honest: 0.0453
Round 004: test acc mean=0.0488 ± 0.0052 | min=0.0323 max=0.0560
         : test loss mean=1852446235.2176 ± 6601972776.9742
         : individual accs = ['0.044574', '0.052344', '0.048272', '0.043388', '0.052554', '0.045953', '0.043883', '0.049207', '0.053209', '0.050503', '0.055998', '0.046983', '0.052040', '0.047177', '0.032330', '0.050633', '0.052011', '0.048291', '0.055583', '0.050872']
         : correct/total = [(184, 4128), (220, 4203), (197, 4081), (188, 4333), (215, 4091), (197, 4287), (184, 4193), (214, 4349), (223, 4191), (216, 4277), (232, 4143), (197, 4193), (213, 4093), (198, 4197), (131, 4052), (204, 4029), (216, 4153), (202, 4183), (227, 4084), (210, 4128)]
         : compromised: 0.0476, honest: 0.0496
Round 005: test acc mean=0.0535 ± 0.0048 | min=0.0462 max=0.0624
         : test loss mean=142.1833 ± 380.4527
         : individual accs = ['0.059593', '0.046158', '0.048272', '0.046619', '0.052554', '0.052484', '0.046745', '0.058174', '0.054880', '0.050503', '0.055998', '0.049606', '0.058637', '0.062426', '0.061204', '0.051626', '0.052011', '0.050920', '0.055583', '0.055475']
         : correct/total = [(246, 4128), (194, 4203), (197, 4081), (202, 4333), (215, 4091), (225, 4287), (196, 4193), (253, 4349), (230, 4191), (216, 4277), (232, 4143), (208, 4193), (240, 4093), (262, 4197), (248, 4052), (208, 4029), (216, 4153), (213, 4183), (227, 4084), (229, 4128)]
         : compromised: 0.0546, honest: 0.0527
Round 006: test acc mean=0.0512 ± 0.0055 | min=0.0356 max=0.0596
         : test loss mean=92.6523 ± 165.2689
         : individual accs = ['0.059593', '0.046158', '0.048272', '0.048234', '0.052554', '0.045253', '0.046745', '0.035640', '0.054880', '0.050503', '0.055998', '0.049606', '0.058637', '0.049083', '0.051826', '0.051626', '0.058271', '0.049486', '0.055583', '0.055475']
         : correct/total = [(246, 4128), (194, 4203), (197, 4081), (209, 4333), (215, 4091), (194, 4287), (196, 4193), (155, 4349), (230, 4191), (216, 4277), (232, 4143), (208, 4193), (240, 4093), (206, 4197), (210, 4052), (208, 4029), (242, 4153), (207, 4183), (227, 4084), (229, 4128)]
         : compromised: 0.0507, honest: 0.0515
Round 007: test acc mean=0.0526 ± 0.0053 | min=0.0430 max=0.0612
         : test loss mean=36.5927 ± 109.4931
         : individual accs = ['0.059593', '0.046158', '0.057584', '0.048234', '0.043021', '0.045253', '0.046745', '0.058174', '0.053209', '0.050503', '0.055998', '0.049606', '0.058637', '0.049083', '0.061204', '0.050881', '0.058271', '0.049486', '0.055583', '0.055475']
         : correct/total = [(246, 4128), (194, 4203), (235, 4081), (209, 4333), (176, 4091), (194, 4287), (196, 4193), (253, 4349), (223, 4191), (216, 4277), (232, 4143), (208, 4193), (240, 4093), (206, 4197), (248, 4052), (205, 4029), (242, 4153), (207, 4183), (227, 4084), (229, 4128)]
         : compromised: 0.0519, honest: 0.0531
Round 008: test acc mean=0.0526 ± 0.0053 | min=0.0430 max=0.0612
         : test loss mean=47.4486 ± 105.4899
         : individual accs = ['0.059593', '0.046158', '0.057584', '0.048234', '0.043021', '0.045253', '0.046745', '0.058174', '0.053209', '0.050503', '0.048033', '0.049606', '0.058637', '0.055278', '0.061204', '0.050633', '0.058271', '0.050920', '0.055583', '0.055475']
         : correct/total = [(246, 4128), (194, 4203), (235, 4081), (209, 4333), (176, 4091), (194, 4287), (196, 4193), (253, 4349), (223, 4191), (216, 4277), (199, 4143), (208, 4193), (240, 4093), (232, 4197), (248, 4052), (204, 4029), (242, 4153), (213, 4183), (227, 4084), (229, 4128)]
         : compromised: 0.0528, honest: 0.0525
Round 009: test acc mean=0.0541 ± 0.0052 | min=0.0430 max=0.0624
         : test loss mean=16.1162 ± 37.3779
         : individual accs = ['0.059593', '0.048775', '0.057584', '0.048234', '0.043021', '0.045253', '0.057000', '0.058174', '0.053209', '0.050503', '0.055998', '0.049606', '0.058637', '0.062426', '0.061204', '0.051626', '0.058271', '0.050920', '0.055583', '0.055475']
         : correct/total = [(246, 4128), (205, 4203), (235, 4081), (209, 4333), (176, 4091), (194, 4287), (239, 4193), (253, 4349), (223, 4191), (216, 4277), (232, 4143), (208, 4193), (240, 4093), (262, 4197), (248, 4052), (208, 4029), (242, 4153), (213, 4183), (227, 4084), (229, 4128)]
         : compromised: 0.0541, honest: 0.0541
Round 010: test acc mean=0.0549 ± 0.0046 | min=0.0430 max=0.0624
         : test loss mean=7.2992 ± 10.9984
         : individual accs = ['0.059593', '0.052344', '0.057584', '0.052850', '0.043021', '0.045953', '0.057000', '0.058174', '0.053209', '0.053776', '0.055998', '0.053899', '0.058637', '0.062426', '0.061204', '0.051626', '0.058271', '0.050920', '0.055583', '0.055475']
         : correct/total = [(246, 4128), (220, 4203), (235, 4081), (229, 4333), (176, 4091), (197, 4287), (239, 4193), (253, 4349), (223, 4191), (230, 4277), (232, 4143), (226, 4193), (240, 4093), (262, 4197), (248, 4052), (208, 4029), (242, 4153), (213, 4183), (227, 4084), (229, 4128)]
         : compromised: 0.0551, honest: 0.0547

=== FINAL RESULTS ===
Dataset: femnist, Nodes: 20, Graph: erdos, Aggregation: krum
Attack: directed_deviation, 40.0% compromised
Final accuracy - Compromised: 0.0551, Honest: 0.0547
Overall test accuracy: mean=0.0549 ± 0.0046
