Device: cuda
Seed: 987654321
Loading 36 LEAF FEMNIST train files...
LEAF FEMNIST train: 3597 users, 734463 samples
Loading 36 LEAF FEMNIST test files...
LEAF FEMNIST test: 3597 users, 83388 samples
Found 3597 train users, 3597 test users, 3597 common users
User sample counts range: 525 (max) to 17 (min)
Distributed ALL 3597 users across 20 clients
Users per client: 179 (with 17 clients getting +1 user)
Train partition sizes: [36360, 37070, 35957, 38262, 36024, 37732, 36921, 38328, 36867, 37683, 36507, 36915, 36007, 37001, 35681, 35453, 36585, 36801, 35964, 36345]
Test partition sizes: [4128, 4203, 4081, 4333, 4091, 4287, 4193, 4349, 4191, 4277, 4143, 4193, 4093, 4197, 4052, 4029, 4153, 4183, 4084, 4128]
  Client 0: 36360 train samples, 62 unique classes
  Client 1: 37070 train samples, 62 unique classes
  Client 2: 35957 train samples, 62 unique classes
  Client 3: 38262 train samples, 62 unique classes
  Client 4: 36024 train samples, 62 unique classes
  Client 5: 37732 train samples, 62 unique classes
  Client 6: 36921 train samples, 62 unique classes
  Client 7: 38328 train samples, 62 unique classes
  Client 8: 36867 train samples, 62 unique classes
  Client 9: 37683 train samples, 62 unique classes
  Client 10: 36507 train samples, 62 unique classes
  Client 11: 36915 train samples, 62 unique classes
  Client 12: 36007 train samples, 62 unique classes
  Client 13: 37001 train samples, 62 unique classes
  Client 14: 35681 train samples, 62 unique classes
  Client 15: 35453 train samples, 62 unique classes
  Client 16: 36585 train samples, 62 unique classes
  Client 17: 36801 train samples, 62 unique classes
  Client 18: 35964 train samples, 62 unique classes
  Client 19: 36345 train samples, 62 unique classes
Will sample 4500 samples per client per epoch
Graph: ring, nodes: 20, edges: 20
Degree statistics: avg=2.00, min=2, max=2
Attack: Compromised 14/20 nodes: [1, 2, 3, 5, 6, 8, 11, 12, 13, 14, 15, 17, 18, 19]
Attack type: krum, lambda: 1.0
Model variant: baseline
Model parameters: 6,603,710
UBAR ALGORITHM (Two-Stage Byzantine-resilient)
  - Model dimension: 6,603,710 parameters
  - Rho parameter: 0.30000000000000004
  - Stage 1: Distance-based filtering (select 30% closest neighbors)
  - Stage 2: Performance-based selection (loss comparison)
  - Complexity: O(deg(i)×d + deg(i)×inference)
Initial test acc across nodes: mean=0.0168 ± 0.0139
Round 001: test acc mean=0.0367 ± 0.0209 | min=0.0022 max=0.0608
         : test loss mean=9347.6593 ± 10883.7420
         : individual accs = ['0.011628', '0.052344', '0.013967', '0.043157', '0.052554', '0.057849', '0.044598', '0.057025', '0.047960', '0.047463', '0.055274', '0.060816', '0.006597', '0.018346', '0.004442', '0.050385', '0.002167', '0.050920', '0.006121', '0.050145']
         : correct/total = [(48, 4128), (220, 4203), (57, 4081), (187, 4333), (215, 4091), (248, 4287), (187, 4193), (248, 4349), (201, 4191), (203, 4277), (229, 4143), (255, 4193), (27, 4093), (77, 4197), (18, 4052), (203, 4029), (9, 4153), (213, 4183), (25, 4084), (207, 4128)]
         : compromised: 0.0363, honest: 0.0377
         : ubar stats = ['Node 0: s1=0.500, s2=1.000', 'Node 1: s1=0.500, s2=1.000', 'Node 2: s1=0.500, s2=1.000']...
Round 002: test acc mean=0.0486 ± 0.0082 | min=0.0176 max=0.0586
         : test loss mean=31438827.5013 ± 41118506.9509
         : individual accs = ['0.049661', '0.048775', '0.057584', '0.052850', '0.043021', '0.050618', '0.046745', '0.045068', '0.051062', '0.048398', '0.045619', '0.046983', '0.058637', '0.049083', '0.051826', '0.056590', '0.047195', '0.050920', '0.017630', '0.054506']
         : correct/total = [(205, 4128), (205, 4203), (235, 4081), (229, 4333), (176, 4091), (217, 4287), (196, 4193), (196, 4349), (214, 4191), (207, 4277), (189, 4143), (197, 4193), (240, 4093), (206, 4197), (210, 4052), (228, 4029), (196, 4153), (213, 4183), (72, 4084), (225, 4128)]
         : compromised: 0.0496, honest: 0.0465
         : ubar stats = ['Node 0: s1=0.500, s2=1.000', 'Node 1: s1=0.500, s2=1.000', 'Node 2: s1=0.500, s2=1.000']...
Round 003: test acc mean=0.0501 ± 0.0053 | min=0.0323 max=0.0612
         : test loss mean=86718379.3953 ± 222628562.8425
         : individual accs = ['0.050145', '0.048775', '0.053418', '0.048465', '0.051088', '0.048052', '0.044598', '0.049207', '0.051539', '0.047463', '0.055274', '0.053184', '0.052040', '0.049559', '0.061204', '0.051378', '0.049362', '0.051159', '0.032321', '0.054506']
         : correct/total = [(207, 4128), (205, 4203), (218, 4081), (210, 4333), (209, 4091), (206, 4287), (187, 4193), (214, 4349), (216, 4191), (203, 4277), (229, 4143), (223, 4193), (213, 4093), (208, 4197), (248, 4052), (207, 4029), (205, 4153), (214, 4183), (132, 4084), (225, 4128)]
         : compromised: 0.0500, honest: 0.0504
         : ubar stats = ['Node 0: s1=0.500, s2=1.000', 'Node 1: s1=0.500, s2=1.000', 'Node 2: s1=0.500, s2=1.000']...
Round 004: test acc mean=0.0486 ± 0.0081 | min=0.0189 max=0.0624
         : test loss mean=5358251.5158 ± 12645426.7376
         : individual accs = ['0.050145', '0.042589', '0.053418', '0.018925', '0.045710', '0.052484', '0.046745', '0.049207', '0.049630', '0.048398', '0.045619', '0.046983', '0.054239', '0.062426', '0.051826', '0.056590', '0.049362', '0.050920', '0.051665', '0.044331']
         : correct/total = [(207, 4128), (179, 4203), (218, 4081), (82, 4333), (187, 4091), (225, 4287), (196, 4193), (214, 4349), (208, 4191), (207, 4277), (189, 4143), (197, 4193), (222, 4093), (262, 4197), (210, 4052), (228, 4029), (205, 4153), (213, 4183), (211, 4084), (183, 4128)]
         : compromised: 0.0488, honest: 0.0481
         : ubar stats = ['Node 0: s1=0.500, s2=1.000', 'Node 1: s1=0.500, s2=1.000', 'Node 2: s1=0.500, s2=1.000']...
Round 005: test acc mean=0.0541 ± 0.0150 | min=0.0422 max=0.1172
         : test loss mean=806.3132 ± 933.4592
         : individual accs = ['0.050145', '0.051630', '0.053418', '0.044773', '0.045710', '0.048752', '0.042213', '0.049207', '0.117156', '0.053776', '0.055998', '0.061054', '0.054239', '0.047177', '0.051826', '0.051378', '0.052011', '0.051159', '0.052889', '0.048450']
         : correct/total = [(207, 4128), (217, 4203), (218, 4081), (194, 4333), (187, 4091), (209, 4287), (177, 4193), (214, 4349), (491, 4191), (230, 4277), (232, 4143), (256, 4193), (222, 4093), (198, 4197), (210, 4052), (207, 4029), (216, 4153), (214, 4183), (216, 4084), (200, 4128)]
         : compromised: 0.0554, honest: 0.0511
         : ubar stats = ['Node 0: s1=0.500, s2=1.000', 'Node 1: s1=0.500, s2=1.000', 'Node 2: s1=0.500, s2=1.000']...
Round 006: test acc mean=0.0546 ± 0.0121 | min=0.0422 max=0.0910
         : test loss mean=327.2131 ± 313.2096
         : individual accs = ['0.050145', '0.051630', '0.053418', '0.048234', '0.052554', '0.043387', '0.042213', '0.049207', '0.053686', '0.090952', '0.086894', '0.061770', '0.054239', '0.047177', '0.051826', '0.051378', '0.052011', '0.051159', '0.050930', '0.048450']
         : correct/total = [(207, 4128), (217, 4203), (218, 4081), (209, 4333), (215, 4091), (186, 4287), (177, 4193), (214, 4349), (225, 4191), (389, 4277), (360, 4143), (259, 4193), (222, 4093), (198, 4197), (210, 4052), (207, 4029), (216, 4153), (214, 4183), (208, 4084), (200, 4128)]
         : compromised: 0.0507, honest: 0.0636
         : ubar stats = ['Node 0: s1=0.500, s2=1.000', 'Node 1: s1=0.500, s2=1.000', 'Node 2: s1=0.500, s2=1.000']...
Round 007: test acc mean=0.0500 ± 0.0054 | min=0.0416 max=0.0632
         : test loss mean=80.6228 ± 59.5181
         : individual accs = ['0.050145', '0.051630', '0.052683', '0.043388', '0.045710', '0.043387', '0.044598', '0.041619', '0.054880', '0.060556', '0.063239', '0.053899', '0.045688', '0.047177', '0.051826', '0.051626', '0.049362', '0.049486', '0.050930', '0.048450']
         : correct/total = [(207, 4128), (217, 4203), (215, 4081), (188, 4333), (187, 4091), (186, 4287), (187, 4193), (181, 4349), (230, 4191), (259, 4277), (262, 4143), (226, 4193), (187, 4093), (198, 4197), (210, 4052), (208, 4029), (205, 4153), (207, 4183), (208, 4084), (200, 4128)]
         : compromised: 0.0493, honest: 0.0518
         : ubar stats = ['Node 0: s1=0.500, s2=1.000', 'Node 1: s1=0.500, s2=1.000', 'Node 2: s1=0.500, s2=1.000']...
Round 008: test acc mean=0.0553 ± 0.0128 | min=0.0434 max=0.0990
         : test loss mean=28.1039 ± 27.7458
         : individual accs = ['0.050145', '0.050916', '0.048272', '0.043388', '0.052554', '0.052484', '0.050799', '0.047827', '0.099022', '0.073884', '0.077963', '0.054615', '0.050574', '0.046462', '0.051826', '0.051378', '0.051288', '0.051159', '0.051665', '0.050145']
         : correct/total = [(207, 4128), (214, 4203), (197, 4081), (188, 4333), (215, 4091), (225, 4287), (213, 4193), (208, 4349), (415, 4191), (316, 4277), (323, 4143), (229, 4193), (207, 4093), (195, 4197), (210, 4052), (207, 4029), (213, 4153), (214, 4183), (211, 4084), (207, 4128)]
         : compromised: 0.0538, honest: 0.0589
         : ubar stats = ['Node 0: s1=0.500, s2=1.000', 'Node 1: s1=0.500, s2=1.000', 'Node 2: s1=0.500, s2=1.000']...
Round 009: test acc mean=0.0520 ± 0.0131 | min=0.0378 max=0.1047
         : test loss mean=26.4508 ± 59.3751
         : individual accs = ['0.044574', '0.048775', '0.048272', '0.052850', '0.045710', '0.050618', '0.042213', '0.047827', '0.104748', '0.057751', '0.056481', '0.058908', '0.045688', '0.045747', '0.037759', '0.051378', '0.049362', '0.051159', '0.050930', '0.048692']
         : correct/total = [(184, 4128), (205, 4203), (197, 4081), (229, 4333), (187, 4091), (217, 4287), (177, 4193), (208, 4349), (439, 4191), (247, 4277), (234, 4143), (247, 4193), (187, 4093), (192, 4197), (153, 4052), (207, 4029), (205, 4153), (214, 4183), (208, 4084), (201, 4128)]
         : compromised: 0.0527, honest: 0.0503
         : ubar stats = ['Node 0: s1=0.500, s2=1.000', 'Node 1: s1=0.500, s2=1.000', 'Node 2: s1=0.500, s2=1.000']...
Round 010: test acc mean=0.0509 ± 0.0102 | min=0.0439 max=0.0928
         : test loss mean=4.1944 ± 0.4298
         : individual accs = ['0.047238', '0.050916', '0.045087', '0.044773', '0.047421', '0.048752', '0.043883', '0.045528', '0.055357', '0.053776', '0.055998', '0.092774', '0.049597', '0.045747', '0.046397', '0.051378', '0.044546', '0.051159', '0.048482', '0.050145']
         : correct/total = [(195, 4128), (214, 4203), (184, 4081), (194, 4333), (194, 4091), (209, 4287), (184, 4193), (198, 4349), (232, 4191), (230, 4277), (232, 4143), (389, 4193), (203, 4093), (192, 4197), (188, 4052), (207, 4029), (185, 4153), (214, 4183), (198, 4084), (207, 4128)]
         : compromised: 0.0517, honest: 0.0491
         : ubar stats = ['Node 0: s1=0.500, s2=1.000', 'Node 1: s1=0.500, s2=1.000', 'Node 2: s1=0.500, s2=1.000']...

=== FINAL RESULTS ===
Dataset: femnist, Nodes: 20, Graph: ring, Aggregation: ubar
Attack: krum, 70.0% compromised
Final accuracy - Compromised: 0.0517, Honest: 0.0491
Overall test accuracy: mean=0.0509 ± 0.0102

=== UBAR SUMMARY ===
Node 0: stage1=0.500, stage2=1.000, overall=0.500
Node 1: stage1=0.500, stage2=1.000, overall=0.500
Node 2: stage1=0.500, stage2=1.000, overall=0.500
Node 3: stage1=0.500, stage2=1.000, overall=0.500
Node 4: stage1=0.500, stage2=1.000, overall=0.500
Node 5: stage1=0.500, stage2=1.000, overall=0.500
Node 6: stage1=0.500, stage2=1.000, overall=0.500
Node 7: stage1=0.500, stage2=1.000, overall=0.500
Node 8: stage1=0.500, stage2=1.000, overall=0.500
Node 9: stage1=0.500, stage2=1.000, overall=0.500
Node 10: stage1=0.500, stage2=1.000, overall=0.500
Node 11: stage1=0.500, stage2=1.000, overall=0.500
Node 12: stage1=0.500, stage2=1.000, overall=0.500
Node 13: stage1=0.500, stage2=1.000, overall=0.500
Node 14: stage1=0.500, stage2=1.000, overall=0.500
Node 15: stage1=0.500, stage2=1.000, overall=0.500
Node 16: stage1=0.500, stage2=1.000, overall=0.500
Node 17: stage1=0.500, stage2=1.000, overall=0.500
Node 18: stage1=0.500, stage2=1.000, overall=0.500
Node 19: stage1=0.500, stage2=1.000, overall=0.500

=== PARALLEL EXECUTION TIME (realistic for distributed system) ===
  COMMUNICATION (max across nodes):
    - Full model transfer: 0.000s (0.0%)
  COMPUTATION (max across nodes):
    - Distance computation: 0.036s (0.9%)
    - Loss computation: 4.078s (99.0%)
    - Aggregation: 0.006s (0.1%)
  TOTALS:
    - Total computation: 4.121s (100.0%)
    - Total communication: 0.000s (0.0%)
    - Total parallel time: 4.121s

=== PER-NODE AVERAGE TIME ===
  - Distance computation: 0.025s
  - Loss computation: 3.825s
  - Aggregation: 0.005s
  - Model transfer: 0.000s
  - Total per node: 3.855s

=== TOTAL COMPUTATIONAL WORK (sum across all nodes) ===
  - Total distance computation: 0.494s
  - Total loss computation: 76.509s
  - Total aggregation: 0.091s
  - Total model transfer: 0.000s
  - Grand total: 77.095s
  - Mean Stage 1 acceptance rate: 0.500
  - Mean Stage 2 acceptance rate: 1.000
  - Overall acceptance rate: 0.500

UBAR Algorithm Properties:
  - Model dimension: 6,603,710
  - Rho parameter: 0.30000000000000004
  - Two-stage approach: Distance filtering + loss evaluation
  - Stage 1 selects: 30% of neighbors
  - Stage 2 uses: Training sample loss comparison
  - Theoretical complexity: O(deg(i)×d + deg(i)×inference)
  - Approach: UBAR paper implementation
