Device: cuda
Seed: 987654321
Loading 36 LEAF FEMNIST train files...
LEAF FEMNIST train: 3597 users, 734463 samples
Loading 36 LEAF FEMNIST test files...
LEAF FEMNIST test: 3597 users, 83388 samples
Found 3597 train users, 3597 test users, 3597 common users
User sample counts range: 525 (max) to 17 (min)
Distributed ALL 3597 users across 20 clients
Users per client: 179 (with 17 clients getting +1 user)
Train partition sizes: [36360, 37070, 35957, 38262, 36024, 37732, 36921, 38328, 36867, 37683, 36507, 36915, 36007, 37001, 35681, 35453, 36585, 36801, 35964, 36345]
Test partition sizes: [4128, 4203, 4081, 4333, 4091, 4287, 4193, 4349, 4191, 4277, 4143, 4193, 4093, 4197, 4052, 4029, 4153, 4183, 4084, 4128]
  Client 0: 36360 train samples, 62 unique classes
  Client 1: 37070 train samples, 62 unique classes
  Client 2: 35957 train samples, 62 unique classes
  Client 3: 38262 train samples, 62 unique classes
  Client 4: 36024 train samples, 62 unique classes
  Client 5: 37732 train samples, 62 unique classes
  Client 6: 36921 train samples, 62 unique classes
  Client 7: 38328 train samples, 62 unique classes
  Client 8: 36867 train samples, 62 unique classes
  Client 9: 37683 train samples, 62 unique classes
  Client 10: 36507 train samples, 62 unique classes
  Client 11: 36915 train samples, 62 unique classes
  Client 12: 36007 train samples, 62 unique classes
  Client 13: 37001 train samples, 62 unique classes
  Client 14: 35681 train samples, 62 unique classes
  Client 15: 35453 train samples, 62 unique classes
  Client 16: 36585 train samples, 62 unique classes
  Client 17: 36801 train samples, 62 unique classes
  Client 18: 35964 train samples, 62 unique classes
  Client 19: 36345 train samples, 62 unique classes
Will sample 4500 samples per client per epoch
Graph: erdos, nodes: 20, edges: 126
Degree statistics: avg=12.60, min=8, max=16
Attack: Compromised 4/20 nodes: [5, 12, 13, 17]
Attack type: backdoor, lambda: 1.0
Backdoor target label: 0, trigger size: 4
Model variant: baseline
Model parameters: 6,603,710
Initial test acc across nodes: mean=0.0168 ± 0.0139
Backdoor attack: Created poisoned datasets for 4 compromised nodes
Round 001: test acc mean=0.0227 ± 0.0174 | min=0.0029 max=0.0579
         : test loss mean=628.7906 ± 833.7691
         : individual accs = ['0.004603', '0.046633', '0.022298', '0.036464', '0.057932', '0.006298', '0.013833', '0.041389', '0.010260', '0.018003', '0.016896', '0.004293', '0.053506', '0.005242', '0.031589', '0.041698', '0.002889', '0.004542', '0.013957', '0.021802']
         : correct/total = [(19, 4128), (196, 4203), (91, 4081), (158, 4333), (237, 4091), (27, 4287), (58, 4193), (180, 4349), (43, 4191), (77, 4277), (70, 4143), (18, 4193), (219, 4093), (22, 4197), (128, 4052), (168, 4029), (12, 4153), (19, 4183), (57, 4084), (90, 4128)]
         : compromised: 0.0174, honest: 0.0240
Round 002: test acc mean=0.0186 ± 0.0205 | min=0.0026 max=0.0549
         : test loss mean=3812.3021 ± 10249.4589
         : individual accs = ['0.003876', '0.004045', '0.002940', '0.044773', '0.045710', '0.005132', '0.004293', '0.003219', '0.054880', '0.003040', '0.047309', '0.007155', '0.003909', '0.046462', '0.050346', '0.003475', '0.033470', '0.002630', '0.003183', '0.003149']
         : correct/total = [(16, 4128), (17, 4203), (12, 4081), (194, 4333), (187, 4091), (22, 4287), (18, 4193), (14, 4349), (230, 4191), (13, 4277), (196, 4143), (30, 4193), (16, 4093), (195, 4197), (204, 4052), (14, 4029), (139, 4153), (11, 4183), (13, 4084), (13, 4128)]
         : compromised: 0.0145, honest: 0.0197
Round 003: test acc mean=0.0456 ± 0.0130 | min=0.0076 max=0.0563
         : test loss mean=5.6957 ± 1.1949
         : individual accs = ['0.051599', '0.051630', '0.050723', '0.007616', '0.044977', '0.052484', '0.044598', '0.043918', '0.042233', '0.047697', '0.055274', '0.053184', '0.009040', '0.046938', '0.051826', '0.056342', '0.051288', '0.053311', '0.052889', '0.045058']
         : correct/total = [(213, 4128), (217, 4203), (207, 4081), (33, 4333), (184, 4091), (225, 4287), (187, 4193), (191, 4349), (177, 4191), (204, 4277), (229, 4143), (223, 4193), (37, 4093), (197, 4197), (210, 4052), (227, 4029), (213, 4153), (223, 4183), (216, 4084), (186, 4128)]
         : compromised: 0.0404, honest: 0.0469
Round 004: test acc mean=0.0510 ± 0.0038 | min=0.0439 max=0.0578
         : test loss mean=15.2154 ± 4.5422
         : individual accs = ['0.049176', '0.047109', '0.055134', '0.047773', '0.044977', '0.057849', '0.053899', '0.043918', '0.051539', '0.047463', '0.055274', '0.053184', '0.049841', '0.045747', '0.051579', '0.054852', '0.054418', '0.053311', '0.052155', '0.050388']
         : correct/total = [(203, 4128), (198, 4203), (225, 4081), (207, 4333), (184, 4091), (248, 4287), (226, 4193), (191, 4349), (216, 4191), (203, 4277), (229, 4143), (223, 4193), (204, 4093), (192, 4197), (209, 4052), (221, 4029), (226, 4153), (223, 4183), (213, 4084), (208, 4128)]
         : compromised: 0.0517, honest: 0.0508
Round 005: test acc mean=0.0510 ± 0.0038 | min=0.0439 max=0.0578
         : test loss mean=19.5666 ± 4.4546
         : individual accs = ['0.049176', '0.047109', '0.055134', '0.047773', '0.044977', '0.057849', '0.053899', '0.043918', '0.051539', '0.047463', '0.055274', '0.053184', '0.049841', '0.045747', '0.051579', '0.054852', '0.054418', '0.053311', '0.052155', '0.050388']
         : correct/total = [(203, 4128), (198, 4203), (225, 4081), (207, 4333), (184, 4091), (248, 4287), (226, 4193), (191, 4349), (216, 4191), (203, 4277), (229, 4143), (223, 4193), (204, 4093), (192, 4197), (209, 4052), (221, 4029), (226, 4153), (223, 4183), (213, 4084), (208, 4128)]
         : compromised: 0.0517, honest: 0.0508
Round 006: test acc mean=0.0337 ± 0.0074 | min=0.0259 max=0.0498
         : test loss mean=28.4148 ± 6.4299
         : individual accs = ['0.027132', '0.032834', '0.026954', '0.047773', '0.029333', '0.034756', '0.028619', '0.031272', '0.031496', '0.047463', '0.032585', '0.030766', '0.049841', '0.045747', '0.025913', '0.028295', '0.030821', '0.028927', '0.029383', '0.033430']
         : correct/total = [(112, 4128), (138, 4203), (110, 4081), (207, 4333), (120, 4091), (149, 4287), (120, 4193), (136, 4349), (132, 4191), (203, 4277), (135, 4143), (129, 4193), (204, 4093), (192, 4197), (105, 4052), (114, 4029), (128, 4153), (121, 4183), (120, 4084), (138, 4128)]
         : compromised: 0.0398, honest: 0.0321
Round 007: test acc mean=0.0302 ± 0.0026 | min=0.0259 max=0.0348
         : test loss mean=29.8459 ± 6.3664
         : individual accs = ['0.027132', '0.032834', '0.026954', '0.033003', '0.029333', '0.034756', '0.028619', '0.031272', '0.031496', '0.033668', '0.032585', '0.030766', '0.026142', '0.028354', '0.025913', '0.028295', '0.030821', '0.028927', '0.029383', '0.033430']
         : correct/total = [(112, 4128), (138, 4203), (110, 4081), (143, 4333), (120, 4091), (149, 4287), (120, 4193), (136, 4349), (132, 4191), (144, 4277), (135, 4143), (129, 4193), (107, 4093), (119, 4197), (105, 4052), (114, 4029), (128, 4153), (121, 4183), (120, 4084), (138, 4128)]
         : compromised: 0.0295, honest: 0.0303
Round 008: test acc mean=0.0463 ± 0.0072 | min=0.0261 max=0.0561
         : test loss mean=20.1323 ± 4.5937
         : individual accs = ['0.048934', '0.050202', '0.056114', '0.033003', '0.048643', '0.048519', '0.048414', '0.051276', '0.043188', '0.033668', '0.051653', '0.046745', '0.026142', '0.049559', '0.047878', '0.050385', '0.047195', '0.046139', '0.054358', '0.043847']
         : correct/total = [(202, 4128), (211, 4203), (229, 4081), (143, 4333), (199, 4091), (208, 4287), (203, 4193), (223, 4349), (181, 4191), (144, 4277), (214, 4143), (196, 4193), (107, 4093), (208, 4197), (194, 4052), (203, 4029), (196, 4153), (193, 4183), (222, 4084), (181, 4128)]
         : compromised: 0.0426, honest: 0.0472
Round 009: test acc mean=0.0498 ± 0.0031 | min=0.0432 max=0.0561
         : test loss mean=27.4532 ± 9.0507
         : individual accs = ['0.048934', '0.050202', '0.056114', '0.043157', '0.048643', '0.045253', '0.050799', '0.051276', '0.049630', '0.047229', '0.048033', '0.049606', '0.048620', '0.049559', '0.051826', '0.050385', '0.052011', '0.046139', '0.054358', '0.054506']
         : correct/total = [(202, 4128), (211, 4203), (229, 4081), (187, 4333), (199, 4091), (194, 4287), (213, 4193), (223, 4349), (208, 4191), (202, 4277), (199, 4143), (208, 4193), (199, 4093), (208, 4197), (210, 4052), (203, 4029), (216, 4153), (193, 4183), (222, 4084), (225, 4128)]
         : compromised: 0.0474, honest: 0.0504
Round 010: test acc mean=0.0493 ± 0.0035 | min=0.0430 max=0.0545
         : test loss mean=53.7876 ± 9.7603
         : individual accs = ['0.050145', '0.048775', '0.053418', '0.043157', '0.043021', '0.045253', '0.050799', '0.045068', '0.049630', '0.043488', '0.048033', '0.049606', '0.054239', '0.049083', '0.051826', '0.051626', '0.052011', '0.049486', '0.052889', '0.054506']
         : correct/total = [(207, 4128), (205, 4203), (218, 4081), (187, 4333), (176, 4091), (194, 4287), (213, 4193), (196, 4349), (208, 4191), (186, 4277), (199, 4143), (208, 4193), (222, 4093), (206, 4197), (210, 4052), (208, 4029), (216, 4153), (207, 4183), (216, 4084), (225, 4128)]
         : compromised: 0.0495, honest: 0.0492

=== FINAL RESULTS ===
Dataset: femnist, Nodes: 20, Graph: erdos, Aggregation: d-fedavg
Attack: backdoor, 20.0% compromised
Final accuracy - Compromised: 0.0495, Honest: 0.0492
Overall test accuracy: mean=0.0493 ± 0.0035

=== BACKDOOR ATTACK SUCCESS RATE (ASR) ===
Target label: 0
Trigger size: 4x4
Overall ASR: 1.0000 ± 0.0000
Honest nodes ASR: 1.0000 ± 0.0000
Compromised nodes ASR: 1.0000 ± 0.0000
Note: Higher ASR indicates more successful backdoor attack
