Device: cuda
Seed: 987654321
Loading 36 LEAF FEMNIST train files...
LEAF FEMNIST train: 3597 users, 734463 samples
Loading 36 LEAF FEMNIST test files...
LEAF FEMNIST test: 3597 users, 83388 samples
Found 3597 train users, 3597 test users, 3597 common users
User sample counts range: 525 (max) to 17 (min)
Distributed ALL 3597 users across 20 clients
Users per client: 179 (with 17 clients getting +1 user)
Train partition sizes: [36360, 37070, 35957, 38262, 36024, 37732, 36921, 38328, 36867, 37683, 36507, 36915, 36007, 37001, 35681, 35453, 36585, 36801, 35964, 36345]
Test partition sizes: [4128, 4203, 4081, 4333, 4091, 4287, 4193, 4349, 4191, 4277, 4143, 4193, 4093, 4197, 4052, 4029, 4153, 4183, 4084, 4128]
  Client 0: 36360 train samples, 62 unique classes
  Client 1: 37070 train samples, 62 unique classes
  Client 2: 35957 train samples, 62 unique classes
  Client 3: 38262 train samples, 62 unique classes
  Client 4: 36024 train samples, 62 unique classes
  Client 5: 37732 train samples, 62 unique classes
  Client 6: 36921 train samples, 62 unique classes
  Client 7: 38328 train samples, 62 unique classes
  Client 8: 36867 train samples, 62 unique classes
  Client 9: 37683 train samples, 62 unique classes
  Client 10: 36507 train samples, 62 unique classes
  Client 11: 36915 train samples, 62 unique classes
  Client 12: 36007 train samples, 62 unique classes
  Client 13: 37001 train samples, 62 unique classes
  Client 14: 35681 train samples, 62 unique classes
  Client 15: 35453 train samples, 62 unique classes
  Client 16: 36585 train samples, 62 unique classes
  Client 17: 36801 train samples, 62 unique classes
  Client 18: 35964 train samples, 62 unique classes
  Client 19: 36345 train samples, 62 unique classes
Will sample 4500 samples per client per epoch
Graph: erdos, nodes: 20, edges: 99
Degree statistics: avg=9.90, min=7, max=14
Attack: Compromised 4/20 nodes: [5, 12, 13, 17]
Attack type: directed_deviation, lambda: 1.0
Model variant: baseline
Model parameters: 6,603,710
Initial test acc across nodes: mean=0.0168 ± 0.0139
Round 001: test acc mean=0.0260 ± 0.0194 | min=0.0048 max=0.0576
         : test loss mean=992.6429 ± 1218.3509
         : individual accs = ['0.005329', '0.051630', '0.057584', '0.016155', '0.016133', '0.047352', '0.006916', '0.012187', '0.012169', '0.053776', '0.011827', '0.004770', '0.016858', '0.045509', '0.005429', '0.052122', '0.006261', '0.042314', '0.014691', '0.041667']
         : correct/total = [(22, 4128), (217, 4203), (235, 4081), (70, 4333), (66, 4091), (203, 4287), (29, 4193), (53, 4349), (51, 4191), (230, 4277), (49, 4143), (20, 4193), (69, 4093), (191, 4197), (22, 4052), (210, 4029), (26, 4153), (177, 4183), (60, 4084), (172, 4128)]
         : compromised: 0.0380, honest: 0.0230
Round 002: test acc mean=0.0449 ± 0.0185 | min=0.0025 max=0.0624
         : test loss mean=2593.8429 ± 8794.1291
         : individual accs = ['0.059593', '0.050202', '0.048272', '0.043157', '0.048643', '0.050618', '0.057000', '0.002529', '0.053209', '0.036708', '0.051653', '0.003816', '0.058637', '0.062426', '0.061204', '0.056590', '0.004093', '0.050920', '0.055583', '0.043847']
         : correct/total = [(246, 4128), (211, 4203), (197, 4081), (187, 4333), (199, 4091), (217, 4287), (239, 4193), (11, 4349), (223, 4191), (157, 4277), (214, 4143), (16, 4193), (240, 4093), (262, 4197), (248, 4052), (228, 4029), (17, 4153), (213, 4183), (227, 4084), (181, 4128)]
         : compromised: 0.0557, honest: 0.0423
Round 003: test acc mean=0.0431 ± 0.0081 | min=0.0261 max=0.0576
         : test loss mean=62.1813 ± 168.3385
         : individual accs = ['0.050145', '0.046158', '0.057584', '0.043157', '0.037644', '0.036856', '0.035535', '0.045528', '0.044619', '0.053776', '0.039585', '0.036728', '0.054239', '0.049083', '0.032330', '0.026061', '0.044546', '0.039445', '0.052889', '0.035853']
         : correct/total = [(207, 4128), (194, 4203), (235, 4081), (187, 4333), (154, 4091), (158, 4287), (149, 4193), (198, 4349), (187, 4191), (230, 4277), (164, 4143), (154, 4193), (222, 4093), (206, 4197), (131, 4052), (105, 4029), (185, 4153), (165, 4183), (216, 4084), (148, 4128)]
         : compromised: 0.0449, honest: 0.0426
Round 004: test acc mean=0.0544 ± 0.0040 | min=0.0435 max=0.0612
         : test loss mean=11.7610 ± 10.0103
         : individual accs = ['0.059593', '0.052344', '0.053418', '0.052850', '0.057932', '0.050618', '0.057000', '0.058174', '0.053209', '0.043488', '0.055998', '0.053899', '0.054239', '0.049083', '0.061204', '0.056590', '0.058271', '0.050920', '0.052889', '0.055475']
         : correct/total = [(246, 4128), (220, 4203), (218, 4081), (229, 4333), (237, 4091), (217, 4287), (239, 4193), (253, 4349), (223, 4191), (186, 4277), (232, 4143), (226, 4193), (222, 4093), (206, 4197), (248, 4052), (228, 4029), (242, 4153), (213, 4183), (216, 4084), (229, 4128)]
         : compromised: 0.0512, honest: 0.0551
Round 005: test acc mean=0.0455 ± 0.0052 | min=0.0355 max=0.0534
         : test loss mean=4.8096 ± 3.1440
         : individual accs = ['0.050145', '0.048775', '0.053418', '0.043157', '0.037644', '0.036856', '0.035535', '0.045528', '0.044619', '0.043488', '0.048033', '0.036728', '0.049597', '0.045747', '0.046397', '0.051626', '0.044546', '0.045900', '0.052889', '0.048692']
         : correct/total = [(207, 4128), (205, 4203), (218, 4081), (187, 4333), (154, 4091), (158, 4287), (149, 4193), (198, 4349), (187, 4191), (186, 4277), (199, 4143), (154, 4193), (203, 4093), (192, 4197), (188, 4052), (208, 4029), (185, 4153), (192, 4183), (216, 4084), (201, 4128)]
         : compromised: 0.0445, honest: 0.0457
Round 006: test acc mean=0.0531 ± 0.0039 | min=0.0453 max=0.0612
         : test loss mean=7.2685 ± 6.9097
         : individual accs = ['0.051599', '0.051630', '0.053418', '0.048465', '0.057932', '0.045253', '0.057000', '0.058174', '0.053209', '0.050503', '0.048033', '0.053899', '0.053750', '0.049083', '0.061204', '0.051626', '0.058271', '0.050203', '0.052889', '0.055475']
         : correct/total = [(213, 4128), (217, 4203), (218, 4081), (210, 4333), (237, 4091), (194, 4287), (239, 4193), (253, 4349), (223, 4191), (216, 4277), (199, 4143), (226, 4193), (220, 4093), (206, 4197), (248, 4052), (208, 4029), (242, 4153), (210, 4183), (216, 4084), (229, 4128)]
         : compromised: 0.0496, honest: 0.0540
Round 007: test acc mean=0.0471 ± 0.0025 | min=0.0430 max=0.0514
         : test loss mean=4.3876 ± 1.5970
         : individual accs = ['0.050145', '0.048775', '0.045087', '0.044773', '0.043021', '0.043387', '0.050799', '0.045528', '0.044619', '0.047697', '0.048033', '0.049606', '0.049597', '0.045747', '0.046397', '0.051378', '0.044546', '0.045900', '0.048482', '0.048692']
         : correct/total = [(207, 4128), (205, 4203), (184, 4081), (194, 4333), (176, 4091), (186, 4287), (213, 4193), (198, 4349), (187, 4191), (204, 4277), (199, 4143), (208, 4193), (203, 4093), (192, 4197), (188, 4052), (207, 4029), (185, 4153), (192, 4183), (198, 4084), (201, 4128)]
         : compromised: 0.0462, honest: 0.0473
Round 008: test acc mean=0.0525 ± 0.0046 | min=0.0448 max=0.0612
         : test loss mean=6.4435 ± 5.9151
         : individual accs = ['0.047238', '0.051630', '0.053418', '0.044773', '0.057932', '0.048752', '0.057000', '0.058174', '0.053209', '0.050503', '0.047309', '0.053899', '0.049597', '0.045747', '0.061204', '0.056342', '0.058271', '0.050203', '0.048482', '0.055475']
         : correct/total = [(195, 4128), (217, 4203), (218, 4081), (194, 4333), (237, 4091), (209, 4287), (239, 4193), (253, 4349), (223, 4191), (216, 4277), (196, 4143), (226, 4193), (203, 4093), (192, 4197), (248, 4052), (227, 4029), (242, 4153), (210, 4183), (198, 4084), (229, 4128)]
         : compromised: 0.0486, honest: 0.0534
Round 009: test acc mean=0.0467 ± 0.0025 | min=0.0420 max=0.0514
         : test loss mean=4.4495 ± 2.2706
         : individual accs = ['0.050145', '0.048775', '0.045087', '0.043157', '0.045710', '0.043387', '0.046745', '0.045528', '0.044619', '0.047697', '0.041999', '0.049606', '0.049597', '0.045747', '0.046397', '0.051378', '0.044546', '0.045900', '0.048482', '0.048934']
         : correct/total = [(207, 4128), (205, 4203), (184, 4081), (187, 4333), (187, 4091), (186, 4287), (196, 4193), (198, 4349), (187, 4191), (204, 4277), (174, 4143), (208, 4193), (203, 4093), (192, 4197), (188, 4052), (207, 4029), (185, 4153), (192, 4183), (198, 4084), (202, 4128)]
         : compromised: 0.0462, honest: 0.0468
Round 010: test acc mean=0.0524 ± 0.0046 | min=0.0448 max=0.0612
         : test loss mean=6.0343 ± 5.4955
         : individual accs = ['0.051599', '0.051630', '0.048272', '0.044773', '0.057932', '0.048052', '0.057000', '0.058174', '0.053209', '0.050503', '0.047309', '0.053899', '0.049597', '0.045747', '0.061204', '0.056342', '0.058271', '0.050203', '0.048482', '0.055475']
         : correct/total = [(213, 4128), (217, 4203), (197, 4081), (194, 4333), (237, 4091), (206, 4287), (239, 4193), (253, 4349), (223, 4191), (216, 4277), (196, 4143), (226, 4193), (203, 4093), (192, 4197), (248, 4052), (227, 4029), (242, 4153), (210, 4183), (198, 4084), (229, 4128)]
         : compromised: 0.0484, honest: 0.0534

=== FINAL RESULTS ===
Dataset: femnist, Nodes: 20, Graph: erdos, Aggregation: d-fedavg
Attack: directed_deviation, 20.0% compromised
Final accuracy - Compromised: 0.0484, Honest: 0.0534
Overall test accuracy: mean=0.0524 ± 0.0046
