Device: cuda
Seed: 987654321
Loading 36 LEAF FEMNIST train files...
LEAF FEMNIST train: 3597 users, 734463 samples
Loading 36 LEAF FEMNIST test files...
LEAF FEMNIST test: 3597 users, 83388 samples
Found 3597 train users, 3597 test users, 3597 common users
User sample counts range: 525 (max) to 17 (min)
Distributed ALL 3597 users across 20 clients
Users per client: 179 (with 17 clients getting +1 user)
Train partition sizes: [36360, 37070, 35957, 38262, 36024, 37732, 36921, 38328, 36867, 37683, 36507, 36915, 36007, 37001, 35681, 35453, 36585, 36801, 35964, 36345]
Test partition sizes: [4128, 4203, 4081, 4333, 4091, 4287, 4193, 4349, 4191, 4277, 4143, 4193, 4093, 4197, 4052, 4029, 4153, 4183, 4084, 4128]
  Client 0: 36360 train samples, 62 unique classes
  Client 1: 37070 train samples, 62 unique classes
  Client 2: 35957 train samples, 62 unique classes
  Client 3: 38262 train samples, 62 unique classes
  Client 4: 36024 train samples, 62 unique classes
  Client 5: 37732 train samples, 62 unique classes
  Client 6: 36921 train samples, 62 unique classes
  Client 7: 38328 train samples, 62 unique classes
  Client 8: 36867 train samples, 62 unique classes
  Client 9: 37683 train samples, 62 unique classes
  Client 10: 36507 train samples, 62 unique classes
  Client 11: 36915 train samples, 62 unique classes
  Client 12: 36007 train samples, 62 unique classes
  Client 13: 37001 train samples, 62 unique classes
  Client 14: 35681 train samples, 62 unique classes
  Client 15: 35453 train samples, 62 unique classes
  Client 16: 36585 train samples, 62 unique classes
  Client 17: 36801 train samples, 62 unique classes
  Client 18: 35964 train samples, 62 unique classes
  Client 19: 36345 train samples, 62 unique classes
Will sample 4500 samples per client per epoch
Graph: fully, nodes: 20, edges: 190
Degree statistics: avg=19.00, min=19, max=19
Attack: Compromised 16/20 nodes: [1, 2, 3, 5, 6, 8, 9, 10, 11, 12, 13, 14, 15, 17, 18, 19]
Attack type: backdoor, lambda: 1.0
Backdoor target label: 0, trigger size: 4
Model variant: baseline
Model parameters: 6,603,710
BALANCE algorithm:
Balance Config: BALANCEConfig(gamma=2, kappa=1, alpha=0.5, min_neighbors=1)
  - Model dimension: 6,603,710 parameters
  - Complexity: O(N×d) = O(20×6,603,710)
Initial test acc across nodes: mean=0.0168 ± 0.0139
Backdoor attack: Created poisoned datasets for 16 compromised nodes
Round 001: test acc mean=0.0515 ± 0.0046 | min=0.0432 max=0.0596
         : test loss mean=24950.4491 ± 12598.8273
         : individual accs = ['0.059593', '0.048775', '0.053418', '0.043157', '0.057932', '0.045253', '0.050799', '0.058174', '0.049630', '0.043488', '0.048033', '0.049606', '0.054239', '0.049083', '0.051826', '0.051626', '0.058271', '0.049486', '0.052889', '0.054506']
         : correct/total = [(246, 4128), (205, 4203), (218, 4081), (187, 4333), (237, 4091), (194, 4287), (213, 4193), (253, 4349), (208, 4191), (186, 4277), (199, 4143), (208, 4193), (222, 4093), (206, 4197), (210, 4052), (208, 4029), (242, 4153), (207, 4183), (216, 4084), (225, 4128)]
         : compromised: 0.0497, honest: 0.0585
Round 002: test acc mean=0.0188 ± 0.0223 | min=0.0017 max=0.0596
         : test loss mean=1474253.0757 ± 1289543.4887
         : individual accs = ['0.059593', '0.001665', '0.003676', '0.003000', '0.057932', '0.004432', '0.003100', '0.058174', '0.005727', '0.003040', '0.022930', '0.004054', '0.003420', '0.004051', '0.005183', '0.021593', '0.058512', '0.045900', '0.006856', '0.002907']
         : correct/total = [(246, 4128), (7, 4203), (15, 4081), (13, 4333), (237, 4091), (19, 4287), (13, 4193), (253, 4349), (24, 4191), (13, 4277), (95, 4143), (17, 4193), (14, 4093), (17, 4197), (21, 4052), (87, 4029), (243, 4153), (192, 4183), (28, 4084), (12, 4128)]
         : compromised: 0.0088, honest: 0.0586
Round 003: test acc mean=0.0504 ± 0.0053 | min=0.0369 max=0.0596
         : test loss mean=1163694622292781824.0000 ± 5065806822472937472.0000
         : individual accs = ['0.059593', '0.046158', '0.053418', '0.043157', '0.057932', '0.036856', '0.050799', '0.051276', '0.049630', '0.043488', '0.048033', '0.049606', '0.054239', '0.049083', '0.048124', '0.051626', '0.058271', '0.049486', '0.052889', '0.054506']
         : correct/total = [(246, 4128), (194, 4203), (218, 4081), (187, 4333), (237, 4091), (158, 4287), (213, 4193), (223, 4349), (208, 4191), (186, 4277), (199, 4143), (208, 4193), (222, 4093), (206, 4197), (195, 4052), (208, 4029), (242, 4153), (207, 4183), (216, 4084), (225, 4128)]
         : compromised: 0.0488, honest: 0.0568
Round 004: test acc mean=0.0518 ± 0.0044 | min=0.0432 max=0.0596
         : test loss mean=nan ± nan
         : individual accs = ['0.059593', '0.048775', '0.053418', '0.043157', '0.057932', '0.050618', '0.050799', '0.058174', '0.049630', '0.043488', '0.048033', '0.049606', '0.054239', '0.049083', '0.051826', '0.051626', '0.058271', '0.049486', '0.052889', '0.054506']
         : correct/total = [(246, 4128), (205, 4203), (218, 4081), (187, 4333), (237, 4091), (217, 4287), (213, 4193), (253, 4349), (208, 4191), (186, 4277), (199, 4143), (208, 4193), (222, 4093), (206, 4197), (210, 4052), (208, 4029), (242, 4153), (207, 4183), (216, 4084), (225, 4128)]
         : compromised: 0.0501, honest: 0.0585
Round 005: test acc mean=0.0524 ± 0.0088 | min=0.0432 max=0.0865
         : test loss mean=nan ± nan
         : individual accs = ['0.086483', '0.048775', '0.053418', '0.043157', '0.058665', '0.045253', '0.050799', '0.047827', '0.049630', '0.043488', '0.048033', '0.049606', '0.054239', '0.049083', '0.051826', '0.051626', '0.058512', '0.049486', '0.052889', '0.054506']
         : correct/total = [(357, 4128), (205, 4203), (218, 4081), (187, 4333), (240, 4091), (194, 4287), (213, 4193), (208, 4349), (208, 4191), (186, 4277), (199, 4143), (208, 4193), (222, 4093), (206, 4197), (210, 4052), (208, 4029), (243, 4153), (207, 4183), (216, 4084), (225, 4128)]
         : compromised: 0.0497, honest: 0.0629
Round 006: test acc mean=0.0502 ± 0.0042 | min=0.0432 max=0.0583
         : test loss mean=nan ± nan
         : individual accs = ['0.044574', '0.048775', '0.053418', '0.043157', '0.057932', '0.045253', '0.050799', '0.047827', '0.049630', '0.043488', '0.048033', '0.049606', '0.054239', '0.049083', '0.051826', '0.051626', '0.058271', '0.049486', '0.052889', '0.054506']
         : correct/total = [(184, 4128), (205, 4203), (218, 4081), (187, 4333), (237, 4091), (194, 4287), (213, 4193), (208, 4349), (208, 4191), (186, 4277), (199, 4143), (208, 4193), (222, 4093), (206, 4197), (210, 4052), (208, 4029), (242, 4153), (207, 4183), (216, 4084), (225, 4128)]
         : compromised: 0.0497, honest: 0.0522
Round 007: test acc mean=0.0510 ± 0.0045 | min=0.0432 max=0.0596
         : test loss mean=nan ± nan
         : individual accs = ['0.059593', '0.048775', '0.053418', '0.043157', '0.047421', '0.045253', '0.050799', '0.058174', '0.049630', '0.043488', '0.048033', '0.049606', '0.054239', '0.049083', '0.051826', '0.051626', '0.058271', '0.049486', '0.052889', '0.054506']
         : correct/total = [(246, 4128), (205, 4203), (218, 4081), (187, 4333), (194, 4091), (194, 4287), (213, 4193), (253, 4349), (208, 4191), (186, 4277), (199, 4143), (208, 4193), (222, 4093), (206, 4197), (210, 4052), (208, 4029), (242, 4153), (207, 4183), (216, 4084), (225, 4128)]
         : compromised: 0.0497, honest: 0.0559
Round 008: test acc mean=0.0502 ± 0.0033 | min=0.0432 max=0.0551
         : test loss mean=nan ± nan
         : individual accs = ['0.051599', '0.048775', '0.053418', '0.043157', '0.051088', '0.045253', '0.050799', '0.051276', '0.049630', '0.043488', '0.048033', '0.049606', '0.054239', '0.049083', '0.051826', '0.051626', '0.055141', '0.049486', '0.052889', '0.054506']
         : correct/total = [(213, 4128), (205, 4203), (218, 4081), (187, 4333), (209, 4091), (194, 4287), (213, 4193), (223, 4349), (208, 4191), (186, 4277), (199, 4143), (208, 4193), (222, 4093), (206, 4197), (210, 4052), (208, 4029), (229, 4153), (207, 4183), (216, 4084), (225, 4128)]
         : compromised: 0.0497, honest: 0.0523
Round 009: test acc mean=0.0514 ± 0.0078 | min=0.0432 max=0.0824
         : test loss mean=nan ± nan
         : individual accs = ['0.053295', '0.048775', '0.053418', '0.043157', '0.052310', '0.045253', '0.050799', '0.045068', '0.049630', '0.043488', '0.048033', '0.049606', '0.054239', '0.049083', '0.051826', '0.051626', '0.082350', '0.049486', '0.052889', '0.054506']
         : correct/total = [(220, 4128), (205, 4203), (218, 4081), (187, 4333), (214, 4091), (194, 4287), (213, 4193), (196, 4349), (208, 4191), (186, 4277), (199, 4143), (208, 4193), (222, 4093), (206, 4197), (210, 4052), (208, 4029), (342, 4153), (207, 4183), (216, 4084), (225, 4128)]
         : compromised: 0.0497, honest: 0.0583
Round 010: test acc mean=0.0521 ± 0.0060 | min=0.0432 max=0.0693
         : test loss mean=nan ± nan
         : individual accs = ['0.069283', '0.048775', '0.053418', '0.043157', '0.057932', '0.045253', '0.050799', '0.060474', '0.049630', '0.043488', '0.048033', '0.049606', '0.054239', '0.049083', '0.051826', '0.051626', '0.058271', '0.049486', '0.052889', '0.054506']
         : correct/total = [(286, 4128), (205, 4203), (218, 4081), (187, 4333), (237, 4091), (194, 4287), (213, 4193), (263, 4349), (208, 4191), (186, 4277), (199, 4143), (208, 4193), (222, 4093), (206, 4197), (210, 4052), (208, 4029), (242, 4153), (207, 4183), (216, 4084), (225, 4128)]
         : compromised: 0.0497, honest: 0.0615

=== FINAL RESULTS ===
Dataset: femnist, Nodes: 20, Graph: fully, Aggregation: balance
Attack: backdoor, 80.0% compromised
Final accuracy - Compromised: 0.0497, Honest: 0.0615
Overall test accuracy: mean=0.0521 ± 0.0060

=== BACKDOOR ATTACK SUCCESS RATE (ASR) ===
Target label: 0
Trigger size: 4x4
Overall ASR: 0.8000 ± 0.4000
Honest nodes ASR: 0.0000 ± 0.0000
Compromised nodes ASR: 1.0000 ± 0.0000
Note: Higher ASR indicates more successful backdoor attack

=== BALANCE SUMMARY ===
Node 0: acceptance=0.158
Node 1: acceptance=0.221
Node 2: acceptance=0.321
Node 3: acceptance=0.321
Node 4: acceptance=0.158
Node 5: acceptance=0.321
Node 6: acceptance=0.321
Node 7: acceptance=0.158
Node 8: acceptance=0.321
Node 9: acceptance=0.321
Node 10: acceptance=0.221
Node 11: acceptance=0.321
Node 12: acceptance=0.321
Node 13: acceptance=0.221
Node 14: acceptance=0.321
Node 15: acceptance=0.321
Node 16: acceptance=0.158
Node 17: acceptance=0.221
Node 18: acceptance=0.321
Node 19: acceptance=0.321

=== PARALLEL EXECUTION TIME (realistic for distributed system) ===
  COMMUNICATION (max across nodes):
    - Full model transfer: 0.000s (0.0%)
  COMPUTATION (max across nodes):
    - Filtering: 0.077s (86.8%)
    - Aggregation: 0.012s (13.2%)
  TOTALS:
    - Total computation: 0.088s (100.0%)
    - Total communication: 0.000s (0.0%)
    - Total parallel time: 0.088s

=== PER-NODE AVERAGE TIME ===
  - Filtering: 0.070s
  - Aggregation: 0.005s
  - Model transfer: 0.000s
  - Total per node: 0.075s

=== TOTAL COMPUTATIONAL WORK (sum across all nodes) ===
  - Total filtering: 1.408s
  - Total aggregation: 0.100s
  - Total model transfer: 0.000s
  - Grand total: 1.508s
  - Mean acceptance rate: 0.268

BALANCE Algorithm Properties:
  - Model dimension: 6,603,710
  - No compression: Full parameter comparison
  - Theoretical complexity: O(deg(i)×d)
  - Approach: Full parameter filtering + averaging
