Device: cuda
Seed: 987654321
Loading 36 LEAF FEMNIST train files...
LEAF FEMNIST train: 3597 users, 734463 samples
Loading 36 LEAF FEMNIST test files...
LEAF FEMNIST test: 3597 users, 83388 samples
Found 3597 train users, 3597 test users, 3597 common users
User sample counts range: 525 (max) to 17 (min)
Distributed ALL 3597 users across 20 clients
Users per client: 179 (with 17 clients getting +1 user)
Train partition sizes: [36360, 37070, 35957, 38262, 36024, 37732, 36921, 38328, 36867, 37683, 36507, 36915, 36007, 37001, 35681, 35453, 36585, 36801, 35964, 36345]
Test partition sizes: [4128, 4203, 4081, 4333, 4091, 4287, 4193, 4349, 4191, 4277, 4143, 4193, 4093, 4197, 4052, 4029, 4153, 4183, 4084, 4128]
  Client 0: 36360 train samples, 62 unique classes
  Client 1: 37070 train samples, 62 unique classes
  Client 2: 35957 train samples, 62 unique classes
  Client 3: 38262 train samples, 62 unique classes
  Client 4: 36024 train samples, 62 unique classes
  Client 5: 37732 train samples, 62 unique classes
  Client 6: 36921 train samples, 62 unique classes
  Client 7: 38328 train samples, 62 unique classes
  Client 8: 36867 train samples, 62 unique classes
  Client 9: 37683 train samples, 62 unique classes
  Client 10: 36507 train samples, 62 unique classes
  Client 11: 36915 train samples, 62 unique classes
  Client 12: 36007 train samples, 62 unique classes
  Client 13: 37001 train samples, 62 unique classes
  Client 14: 35681 train samples, 62 unique classes
  Client 15: 35453 train samples, 62 unique classes
  Client 16: 36585 train samples, 62 unique classes
  Client 17: 36801 train samples, 62 unique classes
  Client 18: 35964 train samples, 62 unique classes
  Client 19: 36345 train samples, 62 unique classes
Will sample 4500 samples per client per epoch
Graph: erdos, nodes: 20, edges: 99
Degree statistics: avg=9.90, min=7, max=14
Attack: Compromised 8/20 nodes: [1, 5, 11, 12, 13, 14, 17, 18]
Attack type: backdoor, lambda: 1.0
Backdoor target label: 0, trigger size: 4
Model variant: baseline
Model parameters: 6,603,710
Initial test acc across nodes: mean=0.0168 ± 0.0139
Backdoor attack: Created poisoned datasets for 8 compromised nodes
Round 001: test acc mean=0.0345 ± 0.0210 | min=0.0029 max=0.0612
         : test loss mean=39743.9104 ± 80270.0009
         : individual accs = ['0.051599', '0.052344', '0.048272', '0.010155', '0.008800', '0.005365', '0.049130', '0.009657', '0.031019', '0.053776', '0.050447', '0.028858', '0.053750', '0.002859', '0.061204', '0.004468', '0.012521', '0.050203', '0.050930', '0.054506']
         : correct/total = [(213, 4128), (220, 4203), (197, 4081), (44, 4333), (36, 4091), (23, 4287), (206, 4193), (42, 4349), (130, 4191), (230, 4277), (209, 4143), (121, 4193), (220, 4093), (12, 4197), (248, 4052), (18, 4029), (52, 4153), (210, 4183), (208, 4084), (225, 4128)]
         : compromised: 0.0382, honest: 0.0320
Round 002: test acc mean=0.0485 ± 0.0150 | min=0.0021 max=0.0953
         : test loss mean=576316796.1661 ± 1208926785.6032
         : individual accs = ['0.050145', '0.046158', '0.095320', '0.043157', '0.043021', '0.045253', '0.050799', '0.045068', '0.049630', '0.050503', '0.045619', '0.002146', '0.053750', '0.049083', '0.051826', '0.051626', '0.052011', '0.049486', '0.050930', '0.045058']
         : correct/total = [(207, 4128), (194, 4203), (389, 4081), (187, 4333), (176, 4091), (194, 4287), (213, 4193), (196, 4349), (208, 4191), (216, 4277), (189, 4143), (9, 4193), (220, 4093), (206, 4197), (210, 4052), (208, 4029), (216, 4153), (207, 4183), (208, 4084), (186, 4128)]
         : compromised: 0.0436, honest: 0.0518
Round 003: test acc mean=0.0419 ± 0.0168 | min=0.0056 max=0.0635
         : test loss mean=191491144975.7242 ± 742676371005.2340
         : individual accs = ['0.005572', '0.006900', '0.045087', '0.040157', '0.052554', '0.050618', '0.033389', '0.031272', '0.053209', '0.046528', '0.063481', '0.045314', '0.005864', '0.047177', '0.061204', '0.050633', '0.044546', '0.045900', '0.052889', '0.055475']
         : correct/total = [(23, 4128), (29, 4203), (184, 4081), (174, 4333), (215, 4091), (217, 4287), (140, 4193), (136, 4349), (223, 4191), (199, 4277), (263, 4143), (190, 4193), (24, 4093), (198, 4197), (248, 4052), (204, 4029), (185, 4153), (192, 4183), (216, 4084), (229, 4128)]
         : compromised: 0.0395, honest: 0.0435
Round 004: test acc mean=0.0373 ± 0.0149 | min=0.0024 max=0.0560
         : test loss mean=1120101324114859721723215872.0000 ± 4882406302890075661388480512.0000
         : individual accs = ['0.027132', '0.050202', '0.055134', '0.018232', '0.029333', '0.045253', '0.033389', '0.041389', '0.049630', '0.047229', '0.055998', '0.030766', '0.045688', '0.049083', '0.037759', '0.014892', '0.014688', '0.045900', '0.002449', '0.050872']
         : correct/total = [(112, 4128), (211, 4203), (225, 4081), (79, 4333), (120, 4091), (194, 4287), (140, 4193), (180, 4349), (208, 4191), (202, 4277), (232, 4143), (129, 4193), (187, 4093), (206, 4197), (153, 4052), (60, 4029), (61, 4153), (192, 4183), (10, 4084), (210, 4128)]
         : compromised: 0.0384, honest: 0.0365
Round 005: test acc mean=0.0312 ± 0.0168 | min=0.0033 max=0.0551
         : test loss mean=76719384103.0669 ± 205772656144.1852
         : individual accs = ['0.044574', '0.032834', '0.055134', '0.043157', '0.044977', '0.045953', '0.048414', '0.004369', '0.049630', '0.003273', '0.003621', '0.030766', '0.014415', '0.012390', '0.025913', '0.041698', '0.014688', '0.028927', '0.029383', '0.050872']
         : correct/total = [(184, 4128), (138, 4203), (225, 4081), (187, 4333), (184, 4091), (197, 4287), (203, 4193), (19, 4349), (208, 4191), (14, 4277), (15, 4143), (129, 4193), (59, 4093), (52, 4197), (105, 4052), (168, 4029), (61, 4153), (121, 4183), (120, 4084), (210, 4128)]
         : compromised: 0.0276, honest: 0.0337
Round 006: test acc mean=0.0349 ± 0.0134 | min=0.0124 max=0.0551
         : test loss mean=83773543685.0890 ± 210961425115.0477
         : individual accs = ['0.044574', '0.032834', '0.055134', '0.036464', '0.029333', '0.045953', '0.048414', '0.013796', '0.051062', '0.015899', '0.050447', '0.030766', '0.014415', '0.012390', '0.025913', '0.041698', '0.040693', '0.028927', '0.029383', '0.050388']
         : correct/total = [(184, 4128), (138, 4203), (225, 4081), (158, 4333), (120, 4091), (197, 4287), (203, 4193), (60, 4349), (214, 4191), (68, 4277), (209, 4143), (129, 4193), (59, 4093), (52, 4197), (105, 4052), (168, 4029), (169, 4153), (121, 4183), (120, 4084), (208, 4128)]
         : compromised: 0.0276, honest: 0.0398
Round 007: test acc mean=0.0379 ± 0.0117 | min=0.0138 max=0.0531
         : test loss mean=166868116889.4017 ± 287866458010.4519
         : individual accs = ['0.044574', '0.032834', '0.026954', '0.036464', '0.044977', '0.045953', '0.048414', '0.013796', '0.051062', '0.053075', '0.050447', '0.030766', '0.014415', '0.047177', '0.025913', '0.041698', '0.040212', '0.028927', '0.029383', '0.050388']
         : correct/total = [(184, 4128), (138, 4203), (110, 4081), (158, 4333), (184, 4091), (197, 4287), (203, 4193), (60, 4349), (214, 4191), (227, 4277), (209, 4143), (129, 4193), (59, 4093), (198, 4197), (105, 4052), (168, 4029), (167, 4153), (121, 4183), (120, 4084), (208, 4128)]
         : compromised: 0.0319, honest: 0.0418
Round 008: test acc mean=0.0391 ± 0.0104 | min=0.0138 max=0.0527
         : test loss mean=19023313594.7123 ± 36541240823.5145
         : individual accs = ['0.044574', '0.032834', '0.052683', '0.036464', '0.043266', '0.045953', '0.033389', '0.013796', '0.051062', '0.048398', '0.045619', '0.030766', '0.050574', '0.028354', '0.025913', '0.041698', '0.047195', '0.028927', '0.029383', '0.050388']
         : correct/total = [(184, 4128), (138, 4203), (215, 4081), (158, 4333), (177, 4091), (197, 4287), (140, 4193), (60, 4349), (214, 4191), (207, 4277), (189, 4143), (129, 4193), (207, 4093), (119, 4197), (105, 4052), (168, 4029), (196, 4153), (121, 4183), (120, 4084), (208, 4128)]
         : compromised: 0.0341, honest: 0.0424
Round 009: test acc mean=0.0408 ± 0.0144 | min=0.0124 max=0.0583
         : test loss mean=85856677.5165 ± 374240092.7755
         : individual accs = ['0.044574', '0.032834', '0.052683', '0.043388', '0.052554', '0.018428', '0.042213', '0.013796', '0.013839', '0.048398', '0.039585', '0.053899', '0.050574', '0.012390', '0.046644', '0.056590', '0.058271', '0.039445', '0.045788', '0.050388']
         : correct/total = [(184, 4128), (138, 4203), (215, 4081), (188, 4333), (215, 4091), (79, 4287), (177, 4193), (60, 4349), (58, 4191), (207, 4277), (164, 4143), (226, 4193), (207, 4093), (52, 4197), (189, 4052), (228, 4029), (242, 4153), (165, 4183), (187, 4084), (208, 4128)]
         : compromised: 0.0375, honest: 0.0430
Round 010: test acc mean=0.0435 ± 0.0154 | min=0.0124 max=0.0612
         : test loss mean=67.2538 ± 146.0146
         : individual accs = ['0.044574', '0.052344', '0.052683', '0.043388', '0.052554', '0.015162', '0.044598', '0.051276', '0.013839', '0.048398', '0.015206', '0.041736', '0.050574', '0.012390', '0.061204', '0.056590', '0.058271', '0.048291', '0.055583', '0.050388']
         : correct/total = [(184, 4128), (220, 4203), (215, 4081), (188, 4333), (215, 4091), (65, 4287), (187, 4193), (223, 4349), (58, 4191), (207, 4277), (63, 4143), (175, 4193), (207, 4093), (52, 4197), (248, 4052), (228, 4029), (242, 4153), (202, 4183), (227, 4084), (208, 4128)]
         : compromised: 0.0422, honest: 0.0443

=== FINAL RESULTS ===
Dataset: femnist, Nodes: 20, Graph: erdos, Aggregation: krum
Attack: backdoor, 40.0% compromised
Final accuracy - Compromised: 0.0422, Honest: 0.0443
Overall test accuracy: mean=0.0435 ± 0.0154

=== BACKDOOR ATTACK SUCCESS RATE (ASR) ===
Target label: 0
Trigger size: 4x4
Overall ASR: 0.0000 ± 0.0000
Honest nodes ASR: 0.0000 ± 0.0000
Compromised nodes ASR: 0.0000 ± 0.0000
Note: Higher ASR indicates more successful backdoor attack
