Device: cuda
Seed: 987654321
Loading 36 LEAF FEMNIST train files...
LEAF FEMNIST train: 3597 users, 734463 samples
Loading 36 LEAF FEMNIST test files...
LEAF FEMNIST test: 3597 users, 83388 samples
Found 3597 train users, 3597 test users, 3597 common users
User sample counts range: 525 (max) to 17 (min)
Distributed ALL 3597 users across 20 clients
Users per client: 179 (with 17 clients getting +1 user)
Train partition sizes: [36360, 37070, 35957, 38262, 36024, 37732, 36921, 38328, 36867, 37683, 36507, 36915, 36007, 37001, 35681, 35453, 36585, 36801, 35964, 36345]
Test partition sizes: [4128, 4203, 4081, 4333, 4091, 4287, 4193, 4349, 4191, 4277, 4143, 4193, 4093, 4197, 4052, 4029, 4153, 4183, 4084, 4128]
  Client 0: 36360 train samples, 62 unique classes
  Client 1: 37070 train samples, 62 unique classes
  Client 2: 35957 train samples, 62 unique classes
  Client 3: 38262 train samples, 62 unique classes
  Client 4: 36024 train samples, 62 unique classes
  Client 5: 37732 train samples, 62 unique classes
  Client 6: 36921 train samples, 62 unique classes
  Client 7: 38328 train samples, 62 unique classes
  Client 8: 36867 train samples, 62 unique classes
  Client 9: 37683 train samples, 62 unique classes
  Client 10: 36507 train samples, 62 unique classes
  Client 11: 36915 train samples, 62 unique classes
  Client 12: 36007 train samples, 62 unique classes
  Client 13: 37001 train samples, 62 unique classes
  Client 14: 35681 train samples, 62 unique classes
  Client 15: 35453 train samples, 62 unique classes
  Client 16: 36585 train samples, 62 unique classes
  Client 17: 36801 train samples, 62 unique classes
  Client 18: 35964 train samples, 62 unique classes
  Client 19: 36345 train samples, 62 unique classes
Will sample 4500 samples per client per epoch
Graph: erdos, nodes: 20, edges: 126
Degree statistics: avg=12.60, min=8, max=16
Attack: Compromised 6/20 nodes: [5, 12, 13, 14, 17, 18]
Attack type: gaussian, lambda: 1.0
Model variant: baseline
Model parameters: 6,603,710
BALANCE algorithm:
Balance Config: BALANCEConfig(gamma=2, kappa=1, alpha=0.5, min_neighbors=1)
  - Model dimension: 6,603,710 parameters
  - Complexity: O(N×d) = O(20×6,603,710)
Initial test acc across nodes: mean=0.0168 ± 0.0139
Round 001: test acc mean=0.0563 ± 0.0098 | min=0.0434 max=0.0912
         : test loss mean=4.0423 ± 0.0053
         : individual accs = ['0.059593', '0.051630', '0.056604', '0.043388', '0.057932', '0.091206', '0.057000', '0.058174', '0.053209', '0.053776', '0.055998', '0.053899', '0.050818', '0.046938', '0.048124', '0.050633', '0.058271', '0.050920', '0.071009', '0.057171']
         : correct/total = [(246, 4128), (217, 4203), (231, 4081), (188, 4333), (237, 4091), (391, 4287), (239, 4193), (253, 4349), (223, 4191), (230, 4277), (232, 4143), (226, 4193), (208, 4093), (197, 4197), (195, 4052), (204, 4029), (242, 4153), (213, 4183), (290, 4084), (236, 4128)]
         : compromised: 0.0598, honest: 0.0548
Round 002: test acc mean=0.0586 ± 0.0135 | min=0.0469 max=0.1035
         : test loss mean=3.9537 ± 0.0133
         : individual accs = ['0.085029', '0.051630', '0.055134', '0.052850', '0.057932', '0.050618', '0.057000', '0.058174', '0.053209', '0.053776', '0.055998', '0.053899', '0.054239', '0.046938', '0.051826', '0.103500', '0.054418', '0.050920', '0.076885', '0.048450']
         : correct/total = [(351, 4128), (217, 4203), (225, 4081), (229, 4333), (237, 4091), (217, 4287), (239, 4193), (253, 4349), (223, 4191), (230, 4277), (232, 4143), (226, 4193), (222, 4093), (197, 4197), (210, 4052), (417, 4029), (226, 4153), (213, 4183), (314, 4084), (200, 4128)]
         : compromised: 0.0552, honest: 0.0601
Round 003: test acc mean=0.0541 ± 0.0049 | min=0.0457 max=0.0627
         : test loss mean=3.7975 ± 0.0165
         : individual accs = ['0.059593', '0.047109', '0.050723', '0.048234', '0.057932', '0.050618', '0.057000', '0.051276', '0.054880', '0.047463', '0.055998', '0.062724', '0.058637', '0.045747', '0.061204', '0.056342', '0.058271', '0.050203', '0.052889', '0.055475']
         : correct/total = [(246, 4128), (198, 4203), (207, 4081), (209, 4333), (237, 4091), (217, 4287), (239, 4193), (223, 4349), (230, 4191), (203, 4277), (232, 4143), (263, 4193), (240, 4093), (192, 4197), (248, 4052), (227, 4029), (242, 4153), (210, 4183), (216, 4084), (229, 4128)]
         : compromised: 0.0532, honest: 0.0545
Round 004: test acc mean=0.0548 ± 0.0045 | min=0.0456 max=0.0624
         : test loss mean=3.7034 ± 0.0145
         : individual accs = ['0.059593', '0.052344', '0.057584', '0.052850', '0.057932', '0.050618', '0.057000', '0.058174', '0.053209', '0.048398', '0.045619', '0.053899', '0.058637', '0.062426', '0.061204', '0.056590', '0.058271', '0.050920', '0.052889', '0.048450']
         : correct/total = [(246, 4128), (220, 4203), (235, 4081), (229, 4333), (237, 4091), (217, 4287), (239, 4193), (253, 4349), (223, 4191), (207, 4277), (189, 4143), (226, 4193), (240, 4093), (262, 4197), (248, 4052), (228, 4029), (242, 4153), (213, 4183), (216, 4084), (200, 4128)]
         : compromised: 0.0561, honest: 0.0543
Round 005: test acc mean=0.0538 ± 0.0039 | min=0.0467 max=0.0596
         : test loss mean=3.6835 ± 0.0158
         : individual accs = ['0.059593', '0.052344', '0.057584', '0.052850', '0.057932', '0.050618', '0.057000', '0.047827', '0.051062', '0.053776', '0.055998', '0.046745', '0.058637', '0.046938', '0.051579', '0.054852', '0.058271', '0.050920', '0.055583', '0.055475']
         : correct/total = [(246, 4128), (220, 4203), (235, 4081), (229, 4333), (237, 4091), (217, 4287), (239, 4193), (208, 4349), (214, 4191), (230, 4277), (232, 4143), (196, 4193), (240, 4093), (197, 4197), (209, 4052), (221, 4029), (242, 4153), (213, 4183), (227, 4084), (229, 4128)]
         : compromised: 0.0524, honest: 0.0544
Round 006: test acc mean=0.0549 ± 0.0043 | min=0.0446 max=0.0624
         : test loss mean=3.6801 ± 0.0166
         : individual accs = ['0.044574', '0.052344', '0.057584', '0.052850', '0.057932', '0.050618', '0.057000', '0.051276', '0.053209', '0.053776', '0.050447', '0.061770', '0.053750', '0.062426', '0.061204', '0.056590', '0.058271', '0.050920', '0.055583', '0.055475']
         : correct/total = [(184, 4128), (220, 4203), (235, 4081), (229, 4333), (237, 4091), (217, 4287), (239, 4193), (223, 4349), (223, 4191), (230, 4277), (209, 4143), (259, 4193), (220, 4093), (262, 4197), (248, 4052), (228, 4029), (242, 4153), (213, 4183), (227, 4084), (229, 4128)]
         : compromised: 0.0558, honest: 0.0545
Round 007: test acc mean=0.0566 ± 0.0101 | min=0.0435 max=0.0964
         : test loss mean=3.6800 ± 0.0164
         : individual accs = ['0.059593', '0.052344', '0.057584', '0.052850', '0.047421', '0.050618', '0.096351', '0.058174', '0.053209', '0.043488', '0.055998', '0.053899', '0.058637', '0.062426', '0.051826', '0.056590', '0.058271', '0.050920', '0.055583', '0.055475']
         : correct/total = [(246, 4128), (220, 4203), (235, 4081), (229, 4333), (194, 4091), (217, 4287), (404, 4193), (253, 4349), (223, 4191), (186, 4277), (232, 4143), (226, 4193), (240, 4093), (262, 4197), (210, 4052), (228, 4029), (242, 4153), (213, 4183), (227, 4084), (229, 4128)]
         : compromised: 0.0550, honest: 0.0572
Round 008: test acc mean=0.0572 ± 0.0102 | min=0.0422 max=0.0919
         : test loss mean=3.6799 ± 0.0168
         : individual accs = ['0.052568', '0.056150', '0.050723', '0.091853', '0.051088', '0.050618', '0.057000', '0.051276', '0.042233', '0.053075', '0.055998', '0.053899', '0.058637', '0.062426', '0.062685', '0.056342', '0.055141', '0.050920', '0.055583', '0.075581']
         : correct/total = [(217, 4128), (236, 4203), (207, 4081), (398, 4333), (209, 4091), (217, 4287), (239, 4193), (223, 4349), (177, 4191), (227, 4277), (232, 4143), (226, 4193), (240, 4093), (262, 4197), (254, 4052), (227, 4029), (229, 4153), (213, 4183), (227, 4084), (312, 4128)]
         : compromised: 0.0568, honest: 0.0574
Round 009: test acc mean=0.0557 ± 0.0058 | min=0.0477 max=0.0757
         : test loss mean=3.6791 ± 0.0168
         : individual accs = ['0.059593', '0.050916', '0.075717', '0.052850', '0.051821', '0.050618', '0.047699', '0.058174', '0.053209', '0.055646', '0.055998', '0.053899', '0.058637', '0.062426', '0.051826', '0.056838', '0.058512', '0.050920', '0.052889', '0.055475']
         : correct/total = [(246, 4128), (214, 4203), (309, 4081), (229, 4333), (212, 4091), (217, 4287), (200, 4193), (253, 4349), (223, 4191), (238, 4277), (232, 4143), (226, 4193), (240, 4093), (262, 4197), (210, 4052), (229, 4029), (243, 4153), (213, 4183), (216, 4084), (229, 4128)]
         : compromised: 0.0546, honest: 0.0562
Round 010: test acc mean=0.0552 ± 0.0037 | min=0.0480 max=0.0624
         : test loss mean=3.6789 ± 0.0173
         : individual accs = ['0.054021', '0.052344', '0.057584', '0.052850', '0.057932', '0.050618', '0.049130', '0.058174', '0.047960', '0.053776', '0.055998', '0.053899', '0.058637', '0.062426', '0.061204', '0.056342', '0.058271', '0.051159', '0.055583', '0.055475']
         : correct/total = [(223, 4128), (220, 4203), (235, 4081), (229, 4333), (237, 4091), (217, 4287), (206, 4193), (253, 4349), (201, 4191), (230, 4277), (232, 4143), (226, 4193), (240, 4093), (262, 4197), (248, 4052), (227, 4029), (242, 4153), (214, 4183), (227, 4084), (229, 4128)]
         : compromised: 0.0566, honest: 0.0546

=== FINAL RESULTS ===
Dataset: femnist, Nodes: 20, Graph: erdos, Aggregation: balance
Attack: gaussian, 30.0% compromised
Final accuracy - Compromised: 0.0566, Honest: 0.0546
Overall test accuracy: mean=0.0552 ± 0.0037

=== BALANCE SUMMARY ===
Node 0: acceptance=0.688
Node 1: acceptance=0.818
Node 2: acceptance=0.667
Node 3: acceptance=0.750
Node 4: acceptance=0.727
Node 5: acceptance=0.667
Node 6: acceptance=0.571
Node 7: acceptance=0.643
Node 8: acceptance=0.500
Node 9: acceptance=0.769
Node 10: acceptance=0.667
Node 11: acceptance=0.643
Node 12: acceptance=0.750
Node 13: acceptance=0.769
Node 14: acceptance=0.667
Node 15: acceptance=0.636
Node 16: acceptance=0.615
Node 17: acceptance=0.778
Node 18: acceptance=0.750
Node 19: acceptance=0.625

=== PARALLEL EXECUTION TIME (realistic for distributed system) ===
  COMMUNICATION (max across nodes):
    - Full model transfer: 0.000s (0.0%)
  COMPUTATION (max across nodes):
    - Filtering: 0.072s (81.8%)
    - Aggregation: 0.016s (18.2%)
  TOTALS:
    - Total computation: 0.088s (100.0%)
    - Total communication: 0.000s (0.0%)
    - Total parallel time: 0.088s

=== PER-NODE AVERAGE TIME ===
  - Filtering: 0.047s
  - Aggregation: 0.006s
  - Model transfer: 0.000s
  - Total per node: 0.053s

=== TOTAL COMPUTATIONAL WORK (sum across all nodes) ===
  - Total filtering: 0.942s
  - Total aggregation: 0.121s
  - Total model transfer: 0.000s
  - Grand total: 1.063s
  - Mean acceptance rate: 0.685

BALANCE Algorithm Properties:
  - Model dimension: 6,603,710
  - No compression: Full parameter comparison
  - Theoretical complexity: O(deg(i)×d)
  - Approach: Full parameter filtering + averaging
