Device: cuda
Seed: 987654321
Loading 36 LEAF FEMNIST train files...
LEAF FEMNIST train: 3597 users, 734463 samples
Loading 36 LEAF FEMNIST test files...
LEAF FEMNIST test: 3597 users, 83388 samples
Found 3597 train users, 3597 test users, 3597 common users
User sample counts range: 525 (max) to 17 (min)
Distributed ALL 3597 users across 20 clients
Users per client: 179 (with 17 clients getting +1 user)
Train partition sizes: [36360, 37070, 35957, 38262, 36024, 37732, 36921, 38328, 36867, 37683, 36507, 36915, 36007, 37001, 35681, 35453, 36585, 36801, 35964, 36345]
Test partition sizes: [4128, 4203, 4081, 4333, 4091, 4287, 4193, 4349, 4191, 4277, 4143, 4193, 4093, 4197, 4052, 4029, 4153, 4183, 4084, 4128]
  Client 0: 36360 train samples, 62 unique classes
  Client 1: 37070 train samples, 62 unique classes
  Client 2: 35957 train samples, 62 unique classes
  Client 3: 38262 train samples, 62 unique classes
  Client 4: 36024 train samples, 62 unique classes
  Client 5: 37732 train samples, 62 unique classes
  Client 6: 36921 train samples, 62 unique classes
  Client 7: 38328 train samples, 62 unique classes
  Client 8: 36867 train samples, 62 unique classes
  Client 9: 37683 train samples, 62 unique classes
  Client 10: 36507 train samples, 62 unique classes
  Client 11: 36915 train samples, 62 unique classes
  Client 12: 36007 train samples, 62 unique classes
  Client 13: 37001 train samples, 62 unique classes
  Client 14: 35681 train samples, 62 unique classes
  Client 15: 35453 train samples, 62 unique classes
  Client 16: 36585 train samples, 62 unique classes
  Client 17: 36801 train samples, 62 unique classes
  Client 18: 35964 train samples, 62 unique classes
  Client 19: 36345 train samples, 62 unique classes
Will sample 4500 samples per client per epoch
Graph: erdos, nodes: 20, edges: 48
Degree statistics: avg=4.80, min=2, max=7
Attack: Compromised 16/20 nodes: [1, 2, 3, 5, 6, 8, 9, 10, 11, 12, 13, 14, 15, 17, 18, 19]
Attack type: directed_deviation, lambda: 1.0
Model variant: baseline
Model parameters: 6,603,710
Initial test acc across nodes: mean=0.0168 ± 0.0139
Round 001: test acc mean=0.0202 ± 0.0137 | min=0.0029 max=0.0526
         : test loss mean=137468.6316 ± 97125.6812
         : individual accs = ['0.006541', '0.020700', '0.002940', '0.052619', '0.023466', '0.018661', '0.005247', '0.009657', '0.012646', '0.028057', '0.032344', '0.013117', '0.014903', '0.014058', '0.016288', '0.038471', '0.012521', '0.023189', '0.050441', '0.007267']
         : correct/total = [(27, 4128), (87, 4203), (12, 4081), (228, 4333), (96, 4091), (80, 4287), (22, 4193), (42, 4349), (53, 4191), (120, 4277), (134, 4143), (55, 4193), (61, 4093), (59, 4197), (66, 4052), (155, 4029), (52, 4153), (97, 4183), (206, 4084), (30, 4128)]
         : compromised: 0.0219, honest: 0.0130
Round 002: test acc mean=0.0499 ± 0.0045 | min=0.0430 max=0.0615
         : test loss mean=nan ± nan
         : individual accs = ['0.050145', '0.048775', '0.054889', '0.043157', '0.043021', '0.048519', '0.043883', '0.045068', '0.051062', '0.044891', '0.051653', '0.049606', '0.054239', '0.049083', '0.061451', '0.050385', '0.052011', '0.049486', '0.052889', '0.054506']
         : correct/total = [(207, 4128), (205, 4203), (224, 4081), (187, 4333), (176, 4091), (208, 4287), (184, 4193), (196, 4349), (214, 4191), (192, 4277), (214, 4143), (208, 4193), (222, 4093), (206, 4197), (249, 4052), (203, 4029), (216, 4153), (207, 4183), (216, 4084), (225, 4128)]
         : compromised: 0.0505, honest: 0.0476
Round 003: test acc mean=0.0493 ± 0.0035 | min=0.0430 max=0.0545
         : test loss mean=nan ± nan
         : individual accs = ['0.050145', '0.048775', '0.053418', '0.043157', '0.043021', '0.045253', '0.050799', '0.045068', '0.049630', '0.043488', '0.048033', '0.049606', '0.054239', '0.049083', '0.051826', '0.051626', '0.052011', '0.049486', '0.052889', '0.054506']
         : correct/total = [(207, 4128), (205, 4203), (218, 4081), (187, 4333), (176, 4091), (194, 4287), (213, 4193), (196, 4349), (208, 4191), (186, 4277), (199, 4143), (208, 4193), (222, 4093), (206, 4197), (210, 4052), (208, 4029), (216, 4153), (207, 4183), (216, 4084), (225, 4128)]
         : compromised: 0.0497, honest: 0.0476
Round 004: test acc mean=0.0493 ± 0.0035 | min=0.0430 max=0.0545
         : test loss mean=nan ± nan
         : individual accs = ['0.050145', '0.048775', '0.053418', '0.043157', '0.043021', '0.045253', '0.050799', '0.045068', '0.049630', '0.043488', '0.048033', '0.049606', '0.054239', '0.049083', '0.051826', '0.051626', '0.052011', '0.049486', '0.052889', '0.054506']
         : correct/total = [(207, 4128), (205, 4203), (218, 4081), (187, 4333), (176, 4091), (194, 4287), (213, 4193), (196, 4349), (208, 4191), (186, 4277), (199, 4143), (208, 4193), (222, 4093), (206, 4197), (210, 4052), (208, 4029), (216, 4153), (207, 4183), (216, 4084), (225, 4128)]
         : compromised: 0.0497, honest: 0.0476
Round 005: test acc mean=0.0493 ± 0.0035 | min=0.0430 max=0.0545
         : test loss mean=nan ± nan
         : individual accs = ['0.050145', '0.048775', '0.053418', '0.043157', '0.043021', '0.045253', '0.050799', '0.045068', '0.049630', '0.043488', '0.048033', '0.049606', '0.054239', '0.049083', '0.051826', '0.051626', '0.052011', '0.049486', '0.052889', '0.054506']
         : correct/total = [(207, 4128), (205, 4203), (218, 4081), (187, 4333), (176, 4091), (194, 4287), (213, 4193), (196, 4349), (208, 4191), (186, 4277), (199, 4143), (208, 4193), (222, 4093), (206, 4197), (210, 4052), (208, 4029), (216, 4153), (207, 4183), (216, 4084), (225, 4128)]
         : compromised: 0.0497, honest: 0.0476
Round 006: test acc mean=0.0493 ± 0.0035 | min=0.0430 max=0.0545
         : test loss mean=nan ± nan
         : individual accs = ['0.050145', '0.048775', '0.053418', '0.043157', '0.043021', '0.045253', '0.050799', '0.045068', '0.049630', '0.043488', '0.048033', '0.049606', '0.054239', '0.049083', '0.051826', '0.051626', '0.052011', '0.049486', '0.052889', '0.054506']
         : correct/total = [(207, 4128), (205, 4203), (218, 4081), (187, 4333), (176, 4091), (194, 4287), (213, 4193), (196, 4349), (208, 4191), (186, 4277), (199, 4143), (208, 4193), (222, 4093), (206, 4197), (210, 4052), (208, 4029), (216, 4153), (207, 4183), (216, 4084), (225, 4128)]
         : compromised: 0.0497, honest: 0.0476
Round 007: test acc mean=0.0493 ± 0.0035 | min=0.0430 max=0.0545
         : test loss mean=nan ± nan
         : individual accs = ['0.050145', '0.048775', '0.053418', '0.043157', '0.043021', '0.045253', '0.050799', '0.045068', '0.049630', '0.043488', '0.048033', '0.049606', '0.054239', '0.049083', '0.051826', '0.051626', '0.052011', '0.049486', '0.052889', '0.054506']
         : correct/total = [(207, 4128), (205, 4203), (218, 4081), (187, 4333), (176, 4091), (194, 4287), (213, 4193), (196, 4349), (208, 4191), (186, 4277), (199, 4143), (208, 4193), (222, 4093), (206, 4197), (210, 4052), (208, 4029), (216, 4153), (207, 4183), (216, 4084), (225, 4128)]
         : compromised: 0.0497, honest: 0.0476
Round 008: test acc mean=0.0493 ± 0.0035 | min=0.0430 max=0.0545
         : test loss mean=nan ± nan
         : individual accs = ['0.050145', '0.048775', '0.053418', '0.043157', '0.043021', '0.045253', '0.050799', '0.045068', '0.049630', '0.043488', '0.048033', '0.049606', '0.054239', '0.049083', '0.051826', '0.051626', '0.052011', '0.049486', '0.052889', '0.054506']
         : correct/total = [(207, 4128), (205, 4203), (218, 4081), (187, 4333), (176, 4091), (194, 4287), (213, 4193), (196, 4349), (208, 4191), (186, 4277), (199, 4143), (208, 4193), (222, 4093), (206, 4197), (210, 4052), (208, 4029), (216, 4153), (207, 4183), (216, 4084), (225, 4128)]
         : compromised: 0.0497, honest: 0.0476
Round 009: test acc mean=0.0493 ± 0.0035 | min=0.0430 max=0.0545
         : test loss mean=nan ± nan
         : individual accs = ['0.050145', '0.048775', '0.053418', '0.043157', '0.043021', '0.045253', '0.050799', '0.045068', '0.049630', '0.043488', '0.048033', '0.049606', '0.054239', '0.049083', '0.051826', '0.051626', '0.052011', '0.049486', '0.052889', '0.054506']
         : correct/total = [(207, 4128), (205, 4203), (218, 4081), (187, 4333), (176, 4091), (194, 4287), (213, 4193), (196, 4349), (208, 4191), (186, 4277), (199, 4143), (208, 4193), (222, 4093), (206, 4197), (210, 4052), (208, 4029), (216, 4153), (207, 4183), (216, 4084), (225, 4128)]
         : compromised: 0.0497, honest: 0.0476
Round 010: test acc mean=0.0493 ± 0.0035 | min=0.0430 max=0.0545
         : test loss mean=nan ± nan
         : individual accs = ['0.050145', '0.048775', '0.053418', '0.043157', '0.043021', '0.045253', '0.050799', '0.045068', '0.049630', '0.043488', '0.048033', '0.049606', '0.054239', '0.049083', '0.051826', '0.051626', '0.052011', '0.049486', '0.052889', '0.054506']
         : correct/total = [(207, 4128), (205, 4203), (218, 4081), (187, 4333), (176, 4091), (194, 4287), (213, 4193), (196, 4349), (208, 4191), (186, 4277), (199, 4143), (208, 4193), (222, 4093), (206, 4197), (210, 4052), (208, 4029), (216, 4153), (207, 4183), (216, 4084), (225, 4128)]
         : compromised: 0.0497, honest: 0.0476

=== FINAL RESULTS ===
Dataset: femnist, Nodes: 20, Graph: erdos, Aggregation: krum
Attack: directed_deviation, 80.0% compromised
Final accuracy - Compromised: 0.0497, Honest: 0.0476
Overall test accuracy: mean=0.0493 ± 0.0035
