Device: cuda
Seed: 987654321
Loading 36 LEAF FEMNIST train files...
LEAF FEMNIST train: 3597 users, 734463 samples
Loading 36 LEAF FEMNIST test files...
LEAF FEMNIST test: 3597 users, 83388 samples
Found 3597 train users, 3597 test users, 3597 common users
User sample counts range: 525 (max) to 17 (min)
Distributed ALL 3597 users across 20 clients
Users per client: 179 (with 17 clients getting +1 user)
Train partition sizes: [36360, 37070, 35957, 38262, 36024, 37732, 36921, 38328, 36867, 37683, 36507, 36915, 36007, 37001, 35681, 35453, 36585, 36801, 35964, 36345]
Test partition sizes: [4128, 4203, 4081, 4333, 4091, 4287, 4193, 4349, 4191, 4277, 4143, 4193, 4093, 4197, 4052, 4029, 4153, 4183, 4084, 4128]
  Client 0: 36360 train samples, 62 unique classes
  Client 1: 37070 train samples, 62 unique classes
  Client 2: 35957 train samples, 62 unique classes
  Client 3: 38262 train samples, 62 unique classes
  Client 4: 36024 train samples, 62 unique classes
  Client 5: 37732 train samples, 62 unique classes
  Client 6: 36921 train samples, 62 unique classes
  Client 7: 38328 train samples, 62 unique classes
  Client 8: 36867 train samples, 62 unique classes
  Client 9: 37683 train samples, 62 unique classes
  Client 10: 36507 train samples, 62 unique classes
  Client 11: 36915 train samples, 62 unique classes
  Client 12: 36007 train samples, 62 unique classes
  Client 13: 37001 train samples, 62 unique classes
  Client 14: 35681 train samples, 62 unique classes
  Client 15: 35453 train samples, 62 unique classes
  Client 16: 36585 train samples, 62 unique classes
  Client 17: 36801 train samples, 62 unique classes
  Client 18: 35964 train samples, 62 unique classes
  Client 19: 36345 train samples, 62 unique classes
Will sample 4500 samples per client per epoch
Graph: erdos, nodes: 20, edges: 48
Degree statistics: avg=4.80, min=2, max=7
Attack: Compromised 14/20 nodes: [1, 2, 3, 5, 6, 8, 11, 12, 13, 14, 15, 17, 18, 19]
Attack type: krum, lambda: 1.0
Model variant: baseline
Model parameters: 6,603,710
BALANCE algorithm:
Balance Config: BALANCEConfig(gamma=2, kappa=1, alpha=0.5, min_neighbors=1)
  - Model dimension: 6,603,710 parameters
  - Complexity: O(N×d) = O(20×6,603,710)
Initial test acc across nodes: mean=0.0168 ± 0.0139
Round 001: test acc mean=0.0506 ± 0.0112 | min=0.0048 max=0.0596
         : test loss mean=936.2233 ± 4063.4933
         : individual accs = ['0.059593', '0.052344', '0.057584', '0.043388', '0.058910', '0.052484', '0.057000', '0.051276', '0.053209', '0.047463', '0.050447', '0.053899', '0.054239', '0.004765', '0.048124', '0.050633', '0.058271', '0.050920', '0.052889', '0.054506']
         : correct/total = [(246, 4128), (220, 4203), (235, 4081), (188, 4333), (241, 4091), (225, 4287), (239, 4193), (223, 4349), (223, 4191), (203, 4277), (209, 4143), (226, 4193), (222, 4093), (20, 4197), (195, 4052), (204, 4029), (242, 4153), (213, 4183), (216, 4084), (225, 4128)]
         : compromised: 0.0490, honest: 0.0543
Round 002: test acc mean=0.0523 ± 0.0038 | min=0.0446 max=0.0582
         : test loss mean=1683.2783 ± 7320.8209
         : individual accs = ['0.044574', '0.051630', '0.057584', '0.052850', '0.057932', '0.050618', '0.046745', '0.058174', '0.053209', '0.050503', '0.055998', '0.046983', '0.054239', '0.049559', '0.051579', '0.056590', '0.049362', '0.050920', '0.055583', '0.050388']
         : correct/total = [(184, 4128), (217, 4203), (235, 4081), (229, 4333), (237, 4091), (217, 4287), (196, 4193), (253, 4349), (223, 4191), (216, 4277), (232, 4143), (197, 4193), (222, 4093), (208, 4197), (209, 4052), (228, 4029), (205, 4153), (213, 4183), (227, 4084), (208, 4128)]
         : compromised: 0.0520, honest: 0.0528
Round 003: test acc mean=0.0581 ± 0.0109 | min=0.0439 max=0.0948
         : test loss mean=3.9435 ± 0.9947
         : individual accs = ['0.059593', '0.052581', '0.057584', '0.047773', '0.094842', '0.048052', '0.057000', '0.043918', '0.053209', '0.077391', '0.055274', '0.061770', '0.058637', '0.062426', '0.061204', '0.056342', '0.058271', '0.050920', '0.055583', '0.050388']
         : correct/total = [(246, 4128), (221, 4203), (235, 4081), (207, 4333), (388, 4091), (206, 4287), (239, 4193), (191, 4349), (223, 4191), (331, 4277), (229, 4143), (259, 4193), (240, 4093), (262, 4197), (248, 4052), (227, 4029), (242, 4153), (213, 4183), (227, 4084), (208, 4128)]
         : compromised: 0.0552, honest: 0.0649
Round 004: test acc mean=0.0554 ± 0.0084 | min=0.0451 max=0.0859
         : test loss mean=1906.1994 ± 8292.8037
         : individual accs = ['0.059593', '0.052344', '0.057584', '0.048465', '0.058421', '0.056916', '0.057000', '0.049207', '0.053209', '0.053075', '0.085928', '0.049606', '0.058637', '0.045747', '0.061204', '0.056590', '0.058271', '0.048291', '0.052889', '0.045058']
         : correct/total = [(246, 4128), (220, 4203), (235, 4081), (210, 4333), (239, 4091), (244, 4287), (239, 4193), (214, 4349), (223, 4191), (227, 4277), (356, 4143), (208, 4193), (240, 4093), (192, 4197), (248, 4052), (228, 4029), (242, 4153), (202, 4183), (216, 4084), (186, 4128)]
         : compromised: 0.0531, honest: 0.0607
Round 005: test acc mean=0.0531 ± 0.0052 | min=0.0420 max=0.0624
         : test loss mean=5.4751 ± 7.7775
         : individual accs = ['0.059593', '0.052344', '0.057584', '0.052850', '0.045710', '0.043387', '0.057000', '0.047827', '0.051062', '0.053776', '0.041999', '0.053899', '0.058637', '0.062426', '0.051826', '0.051378', '0.058271', '0.050920', '0.055583', '0.055475']
         : correct/total = [(246, 4128), (220, 4203), (235, 4081), (229, 4333), (187, 4091), (186, 4287), (239, 4193), (208, 4349), (214, 4191), (230, 4277), (174, 4143), (226, 4193), (240, 4093), (262, 4197), (210, 4052), (207, 4029), (242, 4153), (213, 4183), (227, 4084), (229, 4128)]
         : compromised: 0.0539, honest: 0.0512
Round 006: test acc mean=0.0515 ± 0.0166 | min=0.0048 max=0.1041
         : test loss mean=9.2407 ± 24.1987
         : individual accs = ['0.044574', '0.052344', '0.104141', '0.052850', '0.051088', '0.043387', '0.043883', '0.051276', '0.049630', '0.043488', '0.050447', '0.061770', '0.058637', '0.004765', '0.061204', '0.051378', '0.049362', '0.050920', '0.055583', '0.048450']
         : correct/total = [(184, 4128), (220, 4203), (425, 4081), (229, 4333), (209, 4091), (186, 4287), (184, 4193), (223, 4349), (208, 4191), (186, 4277), (209, 4143), (259, 4193), (240, 4093), (20, 4197), (248, 4052), (207, 4029), (205, 4153), (213, 4183), (227, 4084), (200, 4128)]
         : compromised: 0.0528, honest: 0.0484
Round 007: test acc mean=0.0523 ± 0.0074 | min=0.0276 max=0.0633
         : test loss mean=50.4240 ± 203.7432
         : individual accs = ['0.060078', '0.048775', '0.057584', '0.054697', '0.047421', '0.050618', '0.053899', '0.058174', '0.053209', '0.043488', '0.055998', '0.049606', '0.058637', '0.027639', '0.051826', '0.056590', '0.063328', '0.050920', '0.048482', '0.055475']
         : correct/total = [(248, 4128), (205, 4203), (235, 4081), (237, 4333), (194, 4091), (217, 4287), (226, 4193), (253, 4349), (223, 4191), (186, 4277), (232, 4143), (208, 4193), (240, 4093), (116, 4197), (210, 4052), (228, 4029), (263, 4153), (213, 4183), (198, 4084), (229, 4128)]
         : compromised: 0.0513, honest: 0.0547
Round 008: test acc mean=0.0532 ± 0.0134 | min=0.0286 max=0.0964
         : test loss mean=9.2041 ± 24.0825
         : individual accs = ['0.051599', '0.048775', '0.050723', '0.044773', '0.043021', '0.048286', '0.049368', '0.045068', '0.080888', '0.053308', '0.051895', '0.053899', '0.053750', '0.028592', '0.048124', '0.056342', '0.055141', '0.051399', '0.052889', '0.096415']
         : correct/total = [(213, 4128), (205, 4203), (207, 4081), (194, 4333), (176, 4091), (207, 4287), (207, 4193), (196, 4349), (339, 4191), (228, 4277), (215, 4143), (226, 4193), (220, 4093), (120, 4197), (195, 4052), (227, 4029), (229, 4153), (215, 4183), (216, 4084), (398, 4128)]
         : compromised: 0.0546, honest: 0.0500
Round 009: test acc mean=0.0569 ± 0.0140 | min=0.0439 max=0.1000
         : test loss mean=230.8550 ± 990.2450
         : individual accs = ['0.050145', '0.050916', '0.048272', '0.052850', '0.044977', '0.052951', '0.050799', '0.043918', '0.057981', '0.054010', '0.063963', '0.093012', '0.058637', '0.049559', '0.099951', '0.054852', '0.052011', '0.050920', '0.050196', '0.058866']
         : correct/total = [(207, 4128), (214, 4203), (197, 4081), (229, 4333), (184, 4091), (227, 4287), (213, 4193), (191, 4349), (243, 4191), (231, 4277), (265, 4143), (390, 4193), (240, 4093), (208, 4197), (405, 4052), (221, 4029), (216, 4153), (213, 4183), (205, 4084), (243, 4128)]
         : compromised: 0.0593, honest: 0.0515
Round 010: test acc mean=0.0591 ± 0.0199 | min=0.0064 max=0.1054
         : test loss mean=19.6447 ± 69.6085
         : individual accs = ['0.059593', '0.052344', '0.105366', '0.052850', '0.058421', '0.087474', '0.049130', '0.058404', '0.047960', '0.053776', '0.055998', '0.053899', '0.100904', '0.006433', '0.061204', '0.056342', '0.060197', '0.050920', '0.055583', '0.055717']
         : correct/total = [(246, 4128), (220, 4203), (430, 4081), (229, 4333), (239, 4091), (375, 4287), (206, 4193), (254, 4349), (201, 4191), (230, 4277), (232, 4143), (226, 4193), (413, 4093), (27, 4197), (248, 4052), (227, 4029), (250, 4153), (213, 4183), (227, 4084), (230, 4128)]
         : compromised: 0.0597, honest: 0.0577

=== FINAL RESULTS ===
Dataset: femnist, Nodes: 20, Graph: erdos, Aggregation: balance
Attack: krum, 70.0% compromised
Final accuracy - Compromised: 0.0597, Honest: 0.0577
Overall test accuracy: mean=0.0591 ± 0.0199

=== BALANCE SUMMARY ===
Node 0: acceptance=0.333
Node 1: acceptance=0.250
Node 2: acceptance=0.200
Node 3: acceptance=0.250
Node 4: acceptance=0.250
Node 5: acceptance=0.200
Node 6: acceptance=0.200
Node 7: acceptance=0.400
Node 8: acceptance=0.500
Node 9: acceptance=0.333
Node 10: acceptance=0.250
Node 11: acceptance=0.214
Node 12: acceptance=0.343
Node 13: acceptance=0.100
Node 14: acceptance=0.143
Node 15: acceptance=0.167
Node 16: acceptance=0.200
Node 17: acceptance=0.460
Node 18: acceptance=0.250
Node 19: acceptance=0.500

=== PARALLEL EXECUTION TIME (realistic for distributed system) ===
  COMMUNICATION (max across nodes):
    - Full model transfer: 0.000s (0.0%)
  COMPUTATION (max across nodes):
    - Filtering: 0.031s (74.0%)
    - Aggregation: 0.011s (25.9%)
  TOTALS:
    - Total computation: 0.041s (100.0%)
    - Total communication: 0.000s (0.0%)
    - Total parallel time: 0.041s

=== PER-NODE AVERAGE TIME ===
  - Filtering: 0.025s
  - Aggregation: 0.003s
  - Model transfer: 0.000s
  - Total per node: 0.029s

=== TOTAL COMPUTATIONAL WORK (sum across all nodes) ===
  - Total filtering: 0.504s
  - Total aggregation: 0.067s
  - Total model transfer: 0.000s
  - Grand total: 0.572s
  - Mean acceptance rate: 0.277

BALANCE Algorithm Properties:
  - Model dimension: 6,603,710
  - No compression: Full parameter comparison
  - Theoretical complexity: O(deg(i)×d)
  - Approach: Full parameter filtering + averaging
