Device: cuda
Seed: 987654321
Loading 36 LEAF FEMNIST train files...
LEAF FEMNIST train: 3597 users, 734463 samples
Loading 36 LEAF FEMNIST test files...
LEAF FEMNIST test: 3597 users, 83388 samples
Found 3597 train users, 3597 test users, 3597 common users
User sample counts range: 525 (max) to 17 (min)
Distributed ALL 3597 users across 20 clients
Users per client: 179 (with 17 clients getting +1 user)
Train partition sizes: [36360, 37070, 35957, 38262, 36024, 37732, 36921, 38328, 36867, 37683, 36507, 36915, 36007, 37001, 35681, 35453, 36585, 36801, 35964, 36345]
Test partition sizes: [4128, 4203, 4081, 4333, 4091, 4287, 4193, 4349, 4191, 4277, 4143, 4193, 4093, 4197, 4052, 4029, 4153, 4183, 4084, 4128]
  Client 0: 36360 train samples, 62 unique classes
  Client 1: 37070 train samples, 62 unique classes
  Client 2: 35957 train samples, 62 unique classes
  Client 3: 38262 train samples, 62 unique classes
  Client 4: 36024 train samples, 62 unique classes
  Client 5: 37732 train samples, 62 unique classes
  Client 6: 36921 train samples, 62 unique classes
  Client 7: 38328 train samples, 62 unique classes
  Client 8: 36867 train samples, 62 unique classes
  Client 9: 37683 train samples, 62 unique classes
  Client 10: 36507 train samples, 62 unique classes
  Client 11: 36915 train samples, 62 unique classes
  Client 12: 36007 train samples, 62 unique classes
  Client 13: 37001 train samples, 62 unique classes
  Client 14: 35681 train samples, 62 unique classes
  Client 15: 35453 train samples, 62 unique classes
  Client 16: 36585 train samples, 62 unique classes
  Client 17: 36801 train samples, 62 unique classes
  Client 18: 35964 train samples, 62 unique classes
  Client 19: 36345 train samples, 62 unique classes
Will sample 4500 samples per client per epoch
Graph: erdos, nodes: 20, edges: 48
Degree statistics: avg=4.80, min=2, max=7
Attack: Compromised 12/20 nodes: [1, 2, 3, 5, 8, 11, 12, 13, 14, 15, 17, 18]
Attack type: krum, lambda: 1.0
Model variant: baseline
Model parameters: 6,603,710
BALANCE algorithm:
Balance Config: BALANCEConfig(gamma=2, kappa=1, alpha=0.5, min_neighbors=1)
  - Model dimension: 6,603,710 parameters
  - Complexity: O(N×d) = O(20×6,603,710)
Initial test acc across nodes: mean=0.0168 ± 0.0139
Round 001: test acc mean=0.0505 ± 0.0113 | min=0.0036 max=0.0596
         : test loss mean=941.8710 ± 4088.0597
         : individual accs = ['0.059593', '0.051630', '0.056849', '0.046619', '0.058910', '0.052484', '0.057000', '0.051276', '0.053209', '0.047463', '0.050447', '0.053899', '0.050818', '0.003574', '0.048124', '0.050633', '0.058271', '0.050920', '0.052889', '0.054506']
         : correct/total = [(246, 4128), (217, 4203), (232, 4081), (202, 4333), (241, 4091), (225, 4287), (239, 4193), (223, 4349), (223, 4191), (203, 4277), (209, 4143), (226, 4193), (208, 4093), (15, 4197), (195, 4052), (204, 4029), (242, 4153), (213, 4183), (216, 4084), (225, 4128)]
         : compromised: 0.0476, honest: 0.0547
Round 002: test acc mean=0.0528 ± 0.0076 | min=0.0446 max=0.0813
         : test loss mean=327.4103 ± 1410.6096
         : individual accs = ['0.044574', '0.051630', '0.055134', '0.052850', '0.057932', '0.050618', '0.046745', '0.058174', '0.053209', '0.050503', '0.081342', '0.046983', '0.054239', '0.045747', '0.051579', '0.053860', '0.049362', '0.050920', '0.055583', '0.045058']
         : correct/total = [(184, 4128), (217, 4203), (225, 4081), (229, 4333), (237, 4091), (217, 4287), (196, 4193), (253, 4349), (223, 4191), (216, 4277), (337, 4143), (197, 4193), (222, 4093), (192, 4197), (209, 4052), (217, 4029), (205, 4153), (213, 4183), (227, 4084), (186, 4128)]
         : compromised: 0.0519, honest: 0.0542
Round 003: test acc mean=0.0540 ± 0.0044 | min=0.0457 max=0.0612
         : test loss mean=8.2264 ± 19.5961
         : individual accs = ['0.059593', '0.052344', '0.057584', '0.048234', '0.047421', '0.048052', '0.057000', '0.051276', '0.053209', '0.059154', '0.055274', '0.053184', '0.058637', '0.045747', '0.061204', '0.056342', '0.058271', '0.051638', '0.055583', '0.050388']
         : correct/total = [(246, 4128), (220, 4203), (235, 4081), (209, 4333), (194, 4091), (206, 4287), (239, 4193), (223, 4349), (223, 4191), (253, 4277), (229, 4143), (223, 4193), (240, 4093), (192, 4197), (248, 4052), (227, 4029), (242, 4153), (216, 4183), (227, 4084), (208, 4128)]
         : compromised: 0.0535, honest: 0.0548
Round 004: test acc mean=0.0558 ± 0.0097 | min=0.0451 max=0.0927
         : test loss mean=51448.8599 ± 224244.2403
         : individual accs = ['0.059593', '0.052344', '0.057584', '0.048465', '0.057932', '0.053651', '0.057000', '0.092665', '0.053209', '0.053075', '0.046102', '0.057954', '0.058637', '0.045747', '0.061204', '0.056590', '0.058271', '0.048291', '0.052889', '0.045058']
         : correct/total = [(246, 4128), (220, 4203), (235, 4081), (210, 4333), (237, 4091), (230, 4287), (239, 4193), (403, 4349), (223, 4191), (227, 4277), (191, 4143), (243, 4193), (240, 4093), (192, 4197), (248, 4052), (228, 4029), (242, 4153), (202, 4183), (216, 4084), (186, 4128)]
         : compromised: 0.0539, honest: 0.0587
Round 005: test acc mean=0.0533 ± 0.0043 | min=0.0434 max=0.0596
         : test loss mean=1027669765.5722 ± 4479508639.3539
         : individual accs = ['0.059593', '0.052344', '0.057584', '0.053081', '0.045710', '0.043387', '0.057000', '0.047827', '0.051062', '0.053776', '0.055998', '0.053899', '0.058637', '0.049083', '0.051826', '0.054852', '0.058271', '0.050920', '0.055583', '0.055475']
         : correct/total = [(246, 4128), (220, 4203), (235, 4081), (230, 4333), (187, 4091), (186, 4287), (239, 4193), (208, 4349), (214, 4191), (230, 4277), (232, 4143), (226, 4193), (240, 4093), (206, 4197), (210, 4052), (221, 4029), (242, 4153), (213, 4183), (227, 4084), (229, 4128)]
         : compromised: 0.0527, honest: 0.0542
Round 006: test acc mean=0.0541 ± 0.0116 | min=0.0434 max=0.0998
         : test loss mean=4.9304 ± 5.3931
         : individual accs = ['0.099806', '0.052344', '0.057584', '0.052850', '0.051088', '0.043387', '0.043883', '0.051276', '0.049630', '0.043488', '0.050447', '0.061770', '0.058637', '0.049559', '0.061204', '0.051378', '0.049362', '0.050920', '0.055583', '0.048450']
         : correct/total = [(412, 4128), (220, 4203), (235, 4081), (229, 4333), (209, 4091), (186, 4287), (184, 4193), (223, 4349), (208, 4191), (186, 4277), (209, 4143), (259, 4193), (240, 4093), (208, 4197), (248, 4052), (207, 4029), (205, 4153), (213, 4183), (227, 4084), (200, 4128)]
         : compromised: 0.0537, honest: 0.0547
Round 007: test acc mean=0.0556 ± 0.0099 | min=0.0435 max=0.0944
         : test loss mean=40316074.9327 ± 175733680.3747
         : individual accs = ['0.060078', '0.052344', '0.057584', '0.094392', '0.047421', '0.050618', '0.053899', '0.058174', '0.053209', '0.043488', '0.055998', '0.053899', '0.058637', '0.049083', '0.051826', '0.056590', '0.060438', '0.050920', '0.048482', '0.055475']
         : correct/total = [(248, 4128), (220, 4203), (235, 4081), (409, 4333), (194, 4091), (217, 4287), (226, 4193), (253, 4349), (223, 4191), (186, 4277), (232, 4143), (226, 4193), (240, 4093), (206, 4197), (210, 4052), (228, 4029), (251, 4153), (213, 4183), (198, 4084), (229, 4128)]
         : compromised: 0.0565, honest: 0.0544
Round 008: test acc mean=0.0562 ± 0.0135 | min=0.0430 max=0.0985
         : test loss mean=6.5252 ± 12.3999
         : individual accs = ['0.051599', '0.051630', '0.050723', '0.066928', '0.043021', '0.048052', '0.049130', '0.045068', '0.061083', '0.053308', '0.098479', '0.053899', '0.053750', '0.045747', '0.048124', '0.056342', '0.055141', '0.050920', '0.052889', '0.087936']
         : correct/total = [(213, 4128), (217, 4203), (207, 4081), (290, 4333), (176, 4091), (206, 4287), (206, 4193), (196, 4349), (256, 4191), (228, 4277), (408, 4143), (226, 4193), (220, 4093), (192, 4197), (195, 4052), (227, 4029), (229, 4153), (213, 4183), (216, 4084), (363, 4128)]
         : compromised: 0.0533, honest: 0.0605
Round 009: test acc mean=0.0553 ± 0.0124 | min=0.0439 max=0.1002
         : test loss mean=3.9789 ± 1.3093
         : individual accs = ['0.050145', '0.050916', '0.078412', '0.052850', '0.044977', '0.050618', '0.050799', '0.043918', '0.054402', '0.050035', '0.055998', '0.053899', '0.058637', '0.045747', '0.100197', '0.054852', '0.052011', '0.050920', '0.050196', '0.056686']
         : correct/total = [(207, 4128), (214, 4203), (320, 4081), (229, 4333), (184, 4091), (217, 4287), (213, 4193), (191, 4349), (228, 4191), (214, 4277), (232, 4143), (226, 4193), (240, 4093), (192, 4197), (406, 4052), (221, 4029), (216, 4153), (213, 4183), (205, 4084), (234, 4128)]
         : compromised: 0.0585, honest: 0.0506
Round 010: test acc mean=0.0646 ± 0.0212 | min=0.0480 max=0.1216
         : test loss mean=6258262.8537 ± 27279119.3126
         : individual accs = ['0.103682', '0.121580', '0.058319', '0.052850', '0.057932', '0.077910', '0.049130', '0.058174', '0.047960', '0.053776', '0.055998', '0.054138', '0.112387', '0.049083', '0.061204', '0.056342', '0.058993', '0.050920', '0.055583', '0.055475']
         : correct/total = [(428, 4128), (511, 4203), (238, 4081), (229, 4333), (237, 4091), (334, 4287), (206, 4193), (253, 4349), (201, 4191), (230, 4277), (232, 4143), (227, 4193), (460, 4093), (206, 4197), (248, 4052), (227, 4029), (245, 4153), (213, 4183), (227, 4084), (229, 4128)]
         : compromised: 0.0665, honest: 0.0616

=== FINAL RESULTS ===
Dataset: femnist, Nodes: 20, Graph: erdos, Aggregation: balance
Attack: krum, 60.0% compromised
Final accuracy - Compromised: 0.0665, Honest: 0.0616
Overall test accuracy: mean=0.0646 ± 0.0212

=== BALANCE SUMMARY ===
Node 0: acceptance=0.500
Node 1: acceptance=0.383
Node 2: acceptance=0.320
Node 3: acceptance=0.500
Node 4: acceptance=0.250
Node 5: acceptance=0.200
Node 6: acceptance=0.200
Node 7: acceptance=0.400
Node 8: acceptance=0.500
Node 9: acceptance=0.333
Node 10: acceptance=0.500
Node 11: acceptance=0.214
Node 12: acceptance=0.471
Node 13: acceptance=0.400
Node 14: acceptance=0.143
Node 15: acceptance=0.250
Node 16: acceptance=0.200
Node 17: acceptance=0.460
Node 18: acceptance=0.250
Node 19: acceptance=0.500

=== PARALLEL EXECUTION TIME (realistic for distributed system) ===
  COMMUNICATION (max across nodes):
    - Full model transfer: 0.000s (0.0%)
  COMPUTATION (max across nodes):
    - Filtering: 0.032s (73.4%)
    - Aggregation: 0.012s (26.5%)
  TOTALS:
    - Total computation: 0.044s (100.0%)
    - Total communication: 0.000s (0.0%)
    - Total parallel time: 0.044s

=== PER-NODE AVERAGE TIME ===
  - Filtering: 0.025s
  - Aggregation: 0.004s
  - Model transfer: 0.000s
  - Total per node: 0.029s

=== TOTAL COMPUTATIONAL WORK (sum across all nodes) ===
  - Total filtering: 0.502s
  - Total aggregation: 0.070s
  - Total model transfer: 0.000s
  - Grand total: 0.572s
  - Mean acceptance rate: 0.349

BALANCE Algorithm Properties:
  - Model dimension: 6,603,710
  - No compression: Full parameter comparison
  - Theoretical complexity: O(deg(i)×d)
  - Approach: Full parameter filtering + averaging
