Device: cuda
Seed: 987654321
Loading 36 LEAF FEMNIST train files...
LEAF FEMNIST train: 3597 users, 734463 samples
Loading 36 LEAF FEMNIST test files...
LEAF FEMNIST test: 3597 users, 83388 samples
Found 3597 train users, 3597 test users, 3597 common users
User sample counts range: 525 (max) to 17 (min)
Distributed ALL 3597 users across 20 clients
Users per client: 179 (with 17 clients getting +1 user)
Train partition sizes: [36360, 37070, 35957, 38262, 36024, 37732, 36921, 38328, 36867, 37683, 36507, 36915, 36007, 37001, 35681, 35453, 36585, 36801, 35964, 36345]
Test partition sizes: [4128, 4203, 4081, 4333, 4091, 4287, 4193, 4349, 4191, 4277, 4143, 4193, 4093, 4197, 4052, 4029, 4153, 4183, 4084, 4128]
  Client 0: 36360 train samples, 62 unique classes
  Client 1: 37070 train samples, 62 unique classes
  Client 2: 35957 train samples, 62 unique classes
  Client 3: 38262 train samples, 62 unique classes
  Client 4: 36024 train samples, 62 unique classes
  Client 5: 37732 train samples, 62 unique classes
  Client 6: 36921 train samples, 62 unique classes
  Client 7: 38328 train samples, 62 unique classes
  Client 8: 36867 train samples, 62 unique classes
  Client 9: 37683 train samples, 62 unique classes
  Client 10: 36507 train samples, 62 unique classes
  Client 11: 36915 train samples, 62 unique classes
  Client 12: 36007 train samples, 62 unique classes
  Client 13: 37001 train samples, 62 unique classes
  Client 14: 35681 train samples, 62 unique classes
  Client 15: 35453 train samples, 62 unique classes
  Client 16: 36585 train samples, 62 unique classes
  Client 17: 36801 train samples, 62 unique classes
  Client 18: 35964 train samples, 62 unique classes
  Client 19: 36345 train samples, 62 unique classes
Will sample 4500 samples per client per epoch
Graph: erdos, nodes: 20, edges: 126
Degree statistics: avg=12.60, min=8, max=16
Attack: Compromised 10/20 nodes: [1, 2, 5, 11, 12, 13, 14, 15, 17, 18]
Attack type: backdoor, lambda: 1.0
Backdoor target label: 0, trigger size: 4
Model variant: baseline
Model parameters: 6,603,710
Initial test acc across nodes: mean=0.0168 ± 0.0139
Backdoor attack: Created poisoned datasets for 10 compromised nodes
Round 001: test acc mean=0.0154 ± 0.0147 | min=0.0019 max=0.0523
         : test loss mean=21449.3440 ± 10857.7749
         : individual accs = ['0.004845', '0.052344', '0.006861', '0.006462', '0.014422', '0.044087', '0.012163', '0.013336', '0.028156', '0.012859', '0.006276', '0.001908', '0.013193', '0.003812', '0.006663', '0.013651', '0.003612', '0.045900', '0.013957', '0.003391']
         : correct/total = [(20, 4128), (220, 4203), (28, 4081), (28, 4333), (59, 4091), (189, 4287), (51, 4193), (58, 4349), (118, 4191), (55, 4277), (26, 4143), (8, 4193), (54, 4093), (16, 4197), (27, 4052), (55, 4029), (15, 4153), (192, 4183), (57, 4084), (14, 4128)]
         : compromised: 0.0202, honest: 0.0106
Round 002: test acc mean=0.0489 ± 0.0085 | min=0.0150 max=0.0582
         : test loss mean=3207296257001.6079 ± 4767472870823.8916
         : individual accs = ['0.044574', '0.046158', '0.050723', '0.052850', '0.045710', '0.050618', '0.057000', '0.058174', '0.015032', '0.050503', '0.048033', '0.053899', '0.050574', '0.047177', '0.050346', '0.051378', '0.055141', '0.048291', '0.050930', '0.050872']
         : correct/total = [(184, 4128), (194, 4203), (207, 4081), (229, 4333), (187, 4091), (217, 4287), (239, 4193), (253, 4349), (63, 4191), (216, 4277), (199, 4143), (226, 4193), (207, 4093), (198, 4197), (204, 4052), (207, 4029), (229, 4153), (202, 4183), (208, 4084), (210, 4128)]
         : compromised: 0.0500, honest: 0.0478
Round 003: test acc mean=0.0429 ± 0.0070 | min=0.0322 max=0.0527
         : test loss mean=1165.1083 ± 551.1242
         : individual accs = ['0.050145', '0.049726', '0.052683', '0.040157', '0.052554', '0.048052', '0.044598', '0.049207', '0.042233', '0.039280', '0.036688', '0.046983', '0.033716', '0.047177', '0.037759', '0.032266', '0.051288', '0.037533', '0.033301', '0.032219']
         : correct/total = [(207, 4128), (209, 4203), (215, 4081), (174, 4333), (215, 4091), (206, 4287), (187, 4193), (214, 4349), (177, 4191), (168, 4277), (152, 4143), (197, 4193), (138, 4093), (198, 4197), (153, 4052), (130, 4029), (213, 4153), (157, 4183), (136, 4084), (133, 4128)]
         : compromised: 0.0419, honest: 0.0438
Round 004: test acc mean=0.0350 ± 0.0046 | min=0.0250 max=0.0423
         : test loss mean=279.2051 ± 110.1498
         : individual accs = ['0.030523', '0.034737', '0.024994', '0.040157', '0.042288', '0.038955', '0.033389', '0.041389', '0.034359', '0.039280', '0.036688', '0.028142', '0.033716', '0.028592', '0.037759', '0.032266', '0.040212', '0.037533', '0.033301', '0.032219']
         : correct/total = [(126, 4128), (146, 4203), (102, 4081), (174, 4333), (173, 4091), (167, 4287), (140, 4193), (180, 4349), (144, 4191), (168, 4277), (152, 4143), (118, 4193), (138, 4093), (120, 4197), (153, 4052), (130, 4029), (167, 4153), (157, 4183), (136, 4084), (133, 4128)]
         : compromised: 0.0330, honest: 0.0371
Round 005: test acc mean=0.0350 ± 0.0046 | min=0.0250 max=0.0423
         : test loss mean=53.2883 ± 14.7269
         : individual accs = ['0.030523', '0.034737', '0.024994', '0.040157', '0.042288', '0.038955', '0.033389', '0.041389', '0.034359', '0.039280', '0.036688', '0.028142', '0.033716', '0.028592', '0.037759', '0.032266', '0.040212', '0.037533', '0.033301', '0.032219']
         : correct/total = [(126, 4128), (146, 4203), (102, 4081), (174, 4333), (173, 4091), (167, 4287), (140, 4193), (180, 4349), (144, 4191), (168, 4277), (152, 4143), (118, 4193), (138, 4093), (120, 4197), (153, 4052), (130, 4029), (167, 4153), (157, 4183), (136, 4084), (133, 4128)]
         : compromised: 0.0330, honest: 0.0371
Round 006: test acc mean=0.0499 ± 0.0033 | min=0.0439 max=0.0553
         : test loss mean=26.3120 ± 5.6795
         : individual accs = ['0.049661', '0.050916', '0.054889', '0.046619', '0.052066', '0.045953', '0.043883', '0.053116', '0.051062', '0.044891', '0.047550', '0.054376', '0.052040', '0.055278', '0.045656', '0.050881', '0.051047', '0.048291', '0.050196', '0.050145']
         : correct/total = [(205, 4128), (214, 4203), (224, 4081), (202, 4333), (213, 4091), (197, 4287), (184, 4193), (231, 4349), (214, 4191), (192, 4277), (197, 4143), (228, 4193), (213, 4093), (232, 4197), (185, 4052), (205, 4029), (212, 4153), (202, 4183), (205, 4084), (207, 4128)]
         : compromised: 0.0508, honest: 0.0490
Round 007: test acc mean=0.0499 ± 0.0033 | min=0.0439 max=0.0553
         : test loss mean=7.9552 ± 1.3668
         : individual accs = ['0.049661', '0.050916', '0.054889', '0.046619', '0.052066', '0.045953', '0.043883', '0.053116', '0.051062', '0.044891', '0.047550', '0.054376', '0.052040', '0.055278', '0.045656', '0.050881', '0.051047', '0.048291', '0.050196', '0.050145']
         : correct/total = [(205, 4128), (214, 4203), (224, 4081), (202, 4333), (213, 4091), (197, 4287), (184, 4193), (231, 4349), (214, 4191), (192, 4277), (197, 4143), (228, 4193), (213, 4093), (232, 4197), (185, 4052), (205, 4029), (212, 4153), (202, 4183), (205, 4084), (207, 4128)]
         : compromised: 0.0508, honest: 0.0490
Round 008: test acc mean=0.0472 ± 0.0022 | min=0.0445 max=0.0539
         : test loss mean=4.6569 ± 0.1903
         : individual accs = ['0.047238', '0.048775', '0.045087', '0.044773', '0.047421', '0.048752', '0.048891', '0.045528', '0.044619', '0.047697', '0.047309', '0.045314', '0.049597', '0.045747', '0.046397', '0.053860', '0.044546', '0.045900', '0.048482', '0.048692']
         : correct/total = [(195, 4128), (205, 4203), (184, 4081), (194, 4333), (194, 4091), (209, 4287), (205, 4193), (198, 4349), (187, 4191), (204, 4277), (196, 4143), (190, 4193), (203, 4093), (192, 4197), (188, 4052), (217, 4029), (185, 4153), (192, 4183), (198, 4084), (201, 4128)]
         : compromised: 0.0478, honest: 0.0467
Round 009: test acc mean=0.0485 ± 0.0035 | min=0.0420 max=0.0561
         : test loss mean=3.9908 ± 0.0215
         : individual accs = ['0.044574', '0.046158', '0.056114', '0.046619', '0.045710', '0.043387', '0.046745', '0.047827', '0.054880', '0.050503', '0.041999', '0.049606', '0.045688', '0.046462', '0.050346', '0.051378', '0.049362', '0.051159', '0.050930', '0.050872']
         : correct/total = [(184, 4128), (194, 4203), (229, 4081), (202, 4333), (187, 4091), (186, 4287), (196, 4193), (208, 4349), (230, 4191), (216, 4277), (174, 4143), (208, 4193), (187, 4093), (195, 4197), (204, 4052), (207, 4029), (205, 4153), (214, 4183), (208, 4084), (210, 4128)]
         : compromised: 0.0491, honest: 0.0479
Round 010: test acc mean=0.0481 ± 0.0029 | min=0.0445 max=0.0539
         : test loss mean=4.1743 ± 0.0927
         : individual accs = ['0.047238', '0.048775', '0.045087', '0.044773', '0.047421', '0.048752', '0.048891', '0.045528', '0.044619', '0.053075', '0.050447', '0.045314', '0.053750', '0.045747', '0.046397', '0.053860', '0.044546', '0.050203', '0.048482', '0.048692']
         : correct/total = [(195, 4128), (205, 4203), (184, 4081), (194, 4333), (194, 4091), (209, 4287), (205, 4193), (198, 4349), (187, 4191), (227, 4277), (209, 4143), (190, 4193), (220, 4093), (192, 4197), (188, 4052), (217, 4029), (185, 4153), (210, 4183), (198, 4084), (201, 4128)]
         : compromised: 0.0486, honest: 0.0475

=== FINAL RESULTS ===
Dataset: femnist, Nodes: 20, Graph: erdos, Aggregation: krum
Attack: backdoor, 50.0% compromised
Final accuracy - Compromised: 0.0486, Honest: 0.0475
Overall test accuracy: mean=0.0481 ± 0.0029

=== BACKDOOR ATTACK SUCCESS RATE (ASR) ===
Target label: 0
Trigger size: 4x4
Overall ASR: 0.0000 ± 0.0000
Honest nodes ASR: 0.0000 ± 0.0000
Compromised nodes ASR: 0.0000 ± 0.0000
Note: Higher ASR indicates more successful backdoor attack
