Device: cuda
Seed: 987654321
Loading 36 LEAF FEMNIST train files...
LEAF FEMNIST train: 3597 users, 734463 samples
Loading 36 LEAF FEMNIST test files...
LEAF FEMNIST test: 3597 users, 83388 samples
Found 3597 train users, 3597 test users, 3597 common users
User sample counts range: 525 (max) to 17 (min)
Distributed ALL 3597 users across 20 clients
Users per client: 179 (with 17 clients getting +1 user)
Train partition sizes: [36360, 37070, 35957, 38262, 36024, 37732, 36921, 38328, 36867, 37683, 36507, 36915, 36007, 37001, 35681, 35453, 36585, 36801, 35964, 36345]
Test partition sizes: [4128, 4203, 4081, 4333, 4091, 4287, 4193, 4349, 4191, 4277, 4143, 4193, 4093, 4197, 4052, 4029, 4153, 4183, 4084, 4128]
  Client 0: 36360 train samples, 62 unique classes
  Client 1: 37070 train samples, 62 unique classes
  Client 2: 35957 train samples, 62 unique classes
  Client 3: 38262 train samples, 62 unique classes
  Client 4: 36024 train samples, 62 unique classes
  Client 5: 37732 train samples, 62 unique classes
  Client 6: 36921 train samples, 62 unique classes
  Client 7: 38328 train samples, 62 unique classes
  Client 8: 36867 train samples, 62 unique classes
  Client 9: 37683 train samples, 62 unique classes
  Client 10: 36507 train samples, 62 unique classes
  Client 11: 36915 train samples, 62 unique classes
  Client 12: 36007 train samples, 62 unique classes
  Client 13: 37001 train samples, 62 unique classes
  Client 14: 35681 train samples, 62 unique classes
  Client 15: 35453 train samples, 62 unique classes
  Client 16: 36585 train samples, 62 unique classes
  Client 17: 36801 train samples, 62 unique classes
  Client 18: 35964 train samples, 62 unique classes
  Client 19: 36345 train samples, 62 unique classes
Will sample 4500 samples per client per epoch
Graph: ring, nodes: 20, edges: 20
Degree statistics: avg=2.00, min=2, max=2
Attack: Compromised 12/20 nodes: [1, 2, 3, 5, 8, 11, 12, 13, 14, 15, 17, 18]
Attack type: directed_deviation, lambda: 1.0
Model variant: baseline
Model parameters: 6,603,710
Initial test acc across nodes: mean=0.0168 ± 0.0139
Round 001: test acc mean=0.0198 ± 0.0156 | min=0.0033 max=0.0579
         : test loss mean=86380.2653 ± 115802.4794
         : individual accs = ['0.016715', '0.003331', '0.038226', '0.024694', '0.057932', '0.033123', '0.046506', '0.013796', '0.035075', '0.020809', '0.006034', '0.004054', '0.033716', '0.007386', '0.015301', '0.006453', '0.003853', '0.006933', '0.006611', '0.014777']
         : correct/total = [(69, 4128), (14, 4203), (156, 4081), (107, 4333), (237, 4091), (142, 4287), (195, 4193), (60, 4349), (147, 4191), (89, 4277), (25, 4143), (17, 4193), (138, 4093), (31, 4197), (62, 4052), (26, 4029), (16, 4153), (29, 4183), (27, 4084), (61, 4128)]
         : compromised: 0.0179, honest: 0.0226
Round 002: test acc mean=0.0442 ± 0.0104 | min=0.0215 max=0.0578
         : test loss mean=27473223653.3699 ± 55410107230.7281
         : individual accs = ['0.048934', '0.050202', '0.026464', '0.047773', '0.044977', '0.057849', '0.042213', '0.041619', '0.043188', '0.047463', '0.055274', '0.053184', '0.027119', '0.026686', '0.021471', '0.051378', '0.049362', '0.051159', '0.054358', '0.043847']
         : correct/total = [(202, 4128), (211, 4203), (108, 4081), (207, 4333), (184, 4091), (248, 4287), (177, 4193), (181, 4349), (181, 4191), (203, 4277), (229, 4143), (223, 4193), (111, 4093), (112, 4197), (87, 4052), (207, 4029), (205, 4153), (214, 4183), (222, 4084), (181, 4128)]
         : compromised: 0.0426, honest: 0.0467
Round 003: test acc mean=0.0350 ± 0.0193 | min=0.0017 max=0.0545
         : test loss mean=2077145558800.1060 ± 6231795789195.9844
         : individual accs = ['0.050145', '0.048775', '0.004656', '0.044773', '0.047421', '0.048752', '0.050799', '0.045068', '0.001670', '0.048398', '0.045619', '0.053184', '0.003909', '0.004765', '0.003208', '0.026557', '0.030340', '0.039445', '0.048482', '0.054506']
         : correct/total = [(207, 4128), (205, 4203), (19, 4081), (194, 4333), (194, 4091), (209, 4287), (213, 4193), (196, 4349), (7, 4191), (207, 4277), (189, 4143), (223, 4193), (16, 4093), (20, 4197), (13, 4052), (107, 4029), (126, 4153), (165, 4183), (198, 4084), (225, 4128)]
         : compromised: 0.0273, honest: 0.0465
Round 004: test acc mean=0.0482 ± 0.0043 | min=0.0408 max=0.0553
         : test loss mean=nan ± nan
         : individual accs = ['0.047238', '0.048775', '0.053418', '0.043157', '0.043021', '0.045253', '0.042213', '0.041619', '0.040802', '0.047463', '0.055274', '0.053184', '0.054239', '0.049083', '0.051826', '0.050881', '0.051047', '0.048291', '0.048482', '0.048692']
         : correct/total = [(195, 4128), (205, 4203), (218, 4081), (187, 4333), (176, 4091), (194, 4287), (177, 4193), (181, 4349), (171, 4191), (203, 4277), (229, 4143), (223, 4193), (222, 4093), (206, 4197), (210, 4052), (205, 4029), (212, 4153), (202, 4183), (198, 4084), (201, 4128)]
         : compromised: 0.0489, honest: 0.0471
Round 005: test acc mean=0.0450 ± 0.0071 | min=0.0261 max=0.0542
         : test loss mean=nan ± nan
         : individual accs = ['0.050145', '0.048775', '0.053418', '0.043157', '0.043021', '0.045253', '0.042213', '0.041619', '0.040802', '0.046528', '0.051171', '0.046745', '0.054239', '0.049083', '0.051826', '0.026061', '0.030340', '0.039445', '0.051665', '0.045058']
         : correct/total = [(207, 4128), (205, 4203), (218, 4081), (187, 4333), (176, 4091), (194, 4287), (177, 4193), (181, 4349), (171, 4191), (199, 4277), (212, 4143), (196, 4193), (222, 4093), (206, 4197), (210, 4052), (105, 4029), (126, 4153), (165, 4183), (211, 4084), (186, 4128)]
         : compromised: 0.0459, honest: 0.0438
Round 006: test acc mean=0.0488 ± 0.0034 | min=0.0430 max=0.0542
         : test loss mean=nan ± nan
         : individual accs = ['0.050145', '0.049726', '0.053418', '0.043157', '0.043021', '0.045253', '0.048414', '0.051276', '0.043188', '0.047229', '0.051653', '0.046745', '0.054239', '0.049083', '0.051826', '0.050881', '0.051047', '0.048291', '0.051665', '0.045058']
         : correct/total = [(207, 4128), (209, 4203), (218, 4081), (187, 4333), (176, 4091), (194, 4287), (203, 4193), (223, 4349), (181, 4191), (202, 4277), (214, 4143), (196, 4193), (222, 4093), (206, 4197), (210, 4052), (205, 4029), (212, 4153), (202, 4183), (211, 4084), (186, 4128)]
         : compromised: 0.0490, honest: 0.0485
Round 007: test acc mean=0.0437 ± 0.0130 | min=0.0117 max=0.0542
         : test loss mean=nan ± nan
         : individual accs = ['0.051599', '0.051630', '0.053418', '0.043157', '0.043021', '0.045253', '0.048414', '0.051276', '0.043188', '0.047229', '0.051653', '0.046745', '0.054239', '0.049083', '0.051826', '0.013403', '0.016374', '0.011714', '0.052889', '0.048450']
         : correct/total = [(213, 4128), (217, 4203), (218, 4081), (187, 4333), (176, 4091), (194, 4287), (203, 4193), (223, 4349), (181, 4191), (202, 4277), (214, 4143), (196, 4193), (222, 4093), (206, 4197), (210, 4052), (54, 4029), (68, 4153), (49, 4183), (216, 4084), (200, 4128)]
         : compromised: 0.0430, honest: 0.0448
Round 008: test acc mean=0.0437 ± 0.0130 | min=0.0117 max=0.0542
         : test loss mean=nan ± nan
         : individual accs = ['0.051599', '0.051630', '0.053418', '0.043157', '0.043021', '0.045253', '0.048414', '0.051276', '0.043188', '0.047229', '0.051653', '0.046745', '0.054239', '0.049083', '0.051826', '0.013403', '0.016374', '0.011714', '0.052889', '0.048450']
         : correct/total = [(213, 4128), (217, 4203), (218, 4081), (187, 4333), (176, 4091), (194, 4287), (203, 4193), (223, 4349), (181, 4191), (202, 4277), (214, 4143), (196, 4193), (222, 4093), (206, 4197), (210, 4052), (54, 4029), (68, 4153), (49, 4183), (216, 4084), (200, 4128)]
         : compromised: 0.0430, honest: 0.0448
Round 009: test acc mean=0.0488 ± 0.0033 | min=0.0430 max=0.0542
         : test loss mean=nan ± nan
         : individual accs = ['0.047238', '0.049726', '0.053418', '0.043157', '0.043021', '0.045253', '0.048414', '0.051276', '0.043188', '0.047229', '0.051653', '0.046745', '0.054239', '0.049083', '0.051826', '0.050881', '0.051047', '0.048291', '0.051665', '0.048692']
         : correct/total = [(195, 4128), (209, 4203), (218, 4081), (187, 4333), (176, 4091), (194, 4287), (203, 4193), (223, 4349), (181, 4191), (202, 4277), (214, 4143), (196, 4193), (222, 4093), (206, 4197), (210, 4052), (205, 4029), (212, 4153), (202, 4183), (211, 4084), (201, 4128)]
         : compromised: 0.0490, honest: 0.0486
Round 010: test acc mean=0.0435 ± 0.0129 | min=0.0117 max=0.0542
         : test loss mean=nan ± nan
         : individual accs = ['0.050145', '0.051630', '0.053418', '0.043157', '0.043021', '0.045253', '0.048414', '0.051276', '0.043188', '0.047229', '0.051653', '0.046745', '0.054239', '0.049083', '0.051826', '0.013403', '0.016374', '0.011714', '0.052889', '0.045058']
         : correct/total = [(207, 4128), (217, 4203), (218, 4081), (187, 4333), (176, 4091), (194, 4287), (203, 4193), (223, 4349), (181, 4191), (202, 4277), (214, 4143), (196, 4193), (222, 4093), (206, 4197), (210, 4052), (54, 4029), (68, 4153), (49, 4183), (216, 4084), (186, 4128)]
         : compromised: 0.0430, honest: 0.0441

=== FINAL RESULTS ===
Dataset: femnist, Nodes: 20, Graph: ring, Aggregation: d-fedavg
Attack: directed_deviation, 60.0% compromised
Final accuracy - Compromised: 0.0430, Honest: 0.0441
Overall test accuracy: mean=0.0435 ± 0.0129
