Device: cuda
Seed: 987654321
Loading 36 LEAF FEMNIST train files...
LEAF FEMNIST train: 3597 users, 734463 samples
Loading 36 LEAF FEMNIST test files...
LEAF FEMNIST test: 3597 users, 83388 samples
Found 3597 train users, 3597 test users, 3597 common users
User sample counts range: 525 (max) to 17 (min)
Distributed ALL 3597 users across 20 clients
Users per client: 179 (with 17 clients getting +1 user)
Train partition sizes: [36360, 37070, 35957, 38262, 36024, 37732, 36921, 38328, 36867, 37683, 36507, 36915, 36007, 37001, 35681, 35453, 36585, 36801, 35964, 36345]
Test partition sizes: [4128, 4203, 4081, 4333, 4091, 4287, 4193, 4349, 4191, 4277, 4143, 4193, 4093, 4197, 4052, 4029, 4153, 4183, 4084, 4128]
  Client 0: 36360 train samples, 62 unique classes
  Client 1: 37070 train samples, 62 unique classes
  Client 2: 35957 train samples, 62 unique classes
  Client 3: 38262 train samples, 62 unique classes
  Client 4: 36024 train samples, 62 unique classes
  Client 5: 37732 train samples, 62 unique classes
  Client 6: 36921 train samples, 62 unique classes
  Client 7: 38328 train samples, 62 unique classes
  Client 8: 36867 train samples, 62 unique classes
  Client 9: 37683 train samples, 62 unique classes
  Client 10: 36507 train samples, 62 unique classes
  Client 11: 36915 train samples, 62 unique classes
  Client 12: 36007 train samples, 62 unique classes
  Client 13: 37001 train samples, 62 unique classes
  Client 14: 35681 train samples, 62 unique classes
  Client 15: 35453 train samples, 62 unique classes
  Client 16: 36585 train samples, 62 unique classes
  Client 17: 36801 train samples, 62 unique classes
  Client 18: 35964 train samples, 62 unique classes
  Client 19: 36345 train samples, 62 unique classes
Will sample 4500 samples per client per epoch
Graph: erdos, nodes: 20, edges: 126
Degree statistics: avg=12.60, min=8, max=16
Attack: Compromised 10/20 nodes: [1, 2, 5, 11, 12, 13, 14, 15, 17, 18]
Attack type: directed_deviation, lambda: 1.0
Model variant: baseline
Model parameters: 6,603,710
UBAR ALGORITHM (Two-Stage Byzantine-resilient)
  - Model dimension: 6,603,710 parameters
  - Rho parameter: 0.5
  - Stage 1: Distance-based filtering (select 50% closest neighbors)
  - Stage 2: Performance-based selection (loss comparison)
  - Complexity: O(deg(i)×d + deg(i)×inference)
Initial test acc across nodes: mean=0.0168 ± 0.0139
Round 001: test acc mean=0.0536 ± 0.0042 | min=0.0434 max=0.0596
         : test loss mean=4.0200 ± 0.0250
         : individual accs = ['0.059593', '0.052344', '0.055134', '0.043388', '0.057932', '0.057849', '0.057000', '0.058174', '0.053209', '0.057049', '0.050447', '0.049606', '0.050818', '0.055278', '0.048124', '0.050633', '0.058271', '0.050920', '0.057052', '0.050145']
         : correct/total = [(246, 4128), (220, 4203), (225, 4081), (188, 4333), (237, 4091), (248, 4287), (239, 4193), (253, 4349), (223, 4191), (244, 4277), (209, 4143), (208, 4193), (208, 4093), (232, 4197), (195, 4052), (204, 4029), (242, 4153), (213, 4183), (233, 4084), (207, 4128)]
         : compromised: 0.0528, honest: 0.0545
         : ubar stats = ['Node 0: s1=0.500, s2=0.500', 'Node 1: s1=0.455, s2=0.400', 'Node 2: s1=0.500, s2=0.167']...
Round 002: test acc mean=0.0511 ± 0.0041 | min=0.0439 max=0.0582
         : test loss mean=3.9104 ± 0.0507
         : individual accs = ['0.044574', '0.051630', '0.055134', '0.052850', '0.057932', '0.045953', '0.043883', '0.058174', '0.053209', '0.053776', '0.055998', '0.053899', '0.045688', '0.046938', '0.051826', '0.050881', '0.049362', '0.050920', '0.050196', '0.048450']
         : correct/total = [(184, 4128), (217, 4203), (225, 4081), (229, 4333), (237, 4091), (197, 4287), (184, 4193), (253, 4349), (223, 4191), (230, 4277), (232, 4143), (226, 4193), (187, 4093), (197, 4197), (210, 4052), (205, 4029), (205, 4153), (213, 4183), (205, 4084), (200, 4128)]
         : compromised: 0.0503, honest: 0.0518
         : ubar stats = ['Node 0: s1=0.500, s2=0.625', 'Node 1: s1=0.455, s2=0.700', 'Node 2: s1=0.500, s2=0.417']...
Round 003: test acc mean=0.0525 ± 0.0045 | min=0.0446 max=0.0612
         : test loss mean=3.7612 ± 0.0451
         : individual accs = ['0.059593', '0.049726', '0.050723', '0.048234', '0.057932', '0.050618', '0.044598', '0.051276', '0.054880', '0.047463', '0.055274', '0.053899', '0.058637', '0.045747', '0.061204', '0.056342', '0.049362', '0.050203', '0.052889', '0.050872']
         : correct/total = [(246, 4128), (209, 4203), (207, 4081), (209, 4333), (237, 4091), (217, 4287), (187, 4193), (223, 4349), (230, 4191), (203, 4277), (229, 4143), (226, 4193), (240, 4093), (192, 4197), (248, 4052), (227, 4029), (205, 4153), (210, 4183), (216, 4084), (210, 4128)]
         : compromised: 0.0530, honest: 0.0519
         : ubar stats = ['Node 0: s1=0.500, s2=0.625', 'Node 1: s1=0.455, s2=0.533', 'Node 2: s1=0.500, s2=0.333']...
Round 004: test acc mean=0.0561 ± 0.0113 | min=0.0435 max=0.1002
         : test loss mean=3.7122 ± 0.0195
         : individual accs = ['0.059593', '0.052344', '0.057584', '0.052850', '0.057932', '0.050618', '0.044598', '0.058174', '0.053209', '0.043488', '0.047550', '0.053899', '0.100171', '0.062426', '0.061204', '0.056590', '0.058271', '0.050920', '0.052889', '0.048450']
         : correct/total = [(246, 4128), (220, 4203), (235, 4081), (229, 4333), (237, 4091), (217, 4287), (187, 4193), (253, 4349), (223, 4191), (186, 4277), (197, 4143), (226, 4193), (410, 4093), (262, 4197), (248, 4052), (228, 4029), (242, 4153), (213, 4183), (216, 4084), (200, 4128)]
         : compromised: 0.0599, honest: 0.0524
         : ubar stats = ['Node 0: s1=0.500, s2=0.500', 'Node 1: s1=0.455, s2=0.450', 'Node 2: s1=0.500, s2=0.375']...
Round 005: test acc mean=0.0526 ± 0.0043 | min=0.0457 max=0.0596
         : test loss mean=3.6855 ± 0.0164
         : individual accs = ['0.059593', '0.046158', '0.057584', '0.052850', '0.057932', '0.050618', '0.057000', '0.047827', '0.051062', '0.053776', '0.055998', '0.046745', '0.045688', '0.046938', '0.051826', '0.054852', '0.058271', '0.050920', '0.055583', '0.050145']
         : correct/total = [(246, 4128), (194, 4203), (235, 4081), (229, 4333), (237, 4091), (217, 4287), (239, 4193), (208, 4349), (214, 4191), (230, 4277), (232, 4143), (196, 4193), (187, 4093), (197, 4197), (210, 4052), (221, 4029), (242, 4153), (213, 4183), (227, 4084), (207, 4128)]
         : compromised: 0.0507, honest: 0.0544
         : ubar stats = ['Node 0: s1=0.500, s2=0.550', 'Node 1: s1=0.455, s2=0.400', 'Node 2: s1=0.500, s2=0.367']...
Round 006: test acc mean=0.0546 ± 0.0046 | min=0.0446 max=0.0624
         : test loss mean=3.6834 ± 0.0166
         : individual accs = ['0.044574', '0.050916', '0.057584', '0.052850', '0.057932', '0.050618', '0.057000', '0.047827', '0.053209', '0.053776', '0.050447', '0.061770', '0.053750', '0.062426', '0.061204', '0.056590', '0.058271', '0.050920', '0.055583', '0.055475']
         : correct/total = [(184, 4128), (214, 4203), (235, 4081), (229, 4333), (237, 4091), (217, 4287), (239, 4193), (208, 4349), (223, 4191), (230, 4277), (209, 4143), (259, 4193), (220, 4093), (262, 4197), (248, 4052), (228, 4029), (242, 4153), (213, 4183), (227, 4084), (229, 4128)]
         : compromised: 0.0561, honest: 0.0531
         : ubar stats = ['Node 0: s1=0.500, s2=0.583', 'Node 1: s1=0.455, s2=0.367', 'Node 2: s1=0.500, s2=0.444']...
Round 007: test acc mean=0.0532 ± 0.0039 | min=0.0459 max=0.0586
         : test loss mean=3.6813 ± 0.0161
         : individual accs = ['0.050145', '0.052344', '0.057584', '0.052850', '0.047421', '0.050618', '0.057715', '0.058174', '0.053209', '0.047463', '0.055998', '0.053899', '0.058637', '0.046938', '0.051826', '0.056590', '0.055141', '0.045900', '0.055583', '0.055475']
         : correct/total = [(207, 4128), (220, 4203), (235, 4081), (229, 4333), (194, 4091), (217, 4287), (242, 4193), (253, 4349), (223, 4191), (203, 4277), (232, 4143), (226, 4193), (240, 4093), (197, 4197), (210, 4052), (228, 4029), (229, 4153), (192, 4183), (227, 4084), (229, 4128)]
         : compromised: 0.0530, honest: 0.0534
         : ubar stats = ['Node 0: s1=0.500, s2=0.518', 'Node 1: s1=0.455, s2=0.457', 'Node 2: s1=0.500, s2=0.452']...
Round 008: test acc mean=0.0549 ± 0.0093 | min=0.0422 max=0.0864
         : test loss mean=3.6808 ± 0.0169
         : individual accs = ['0.051599', '0.051630', '0.050723', '0.043157', '0.051088', '0.048052', '0.057000', '0.051276', '0.042233', '0.054244', '0.086411', '0.066539', '0.058637', '0.047177', '0.064659', '0.056342', '0.055141', '0.050920', '0.055583', '0.055475']
         : correct/total = [(213, 4128), (217, 4203), (207, 4081), (187, 4333), (209, 4091), (206, 4287), (239, 4193), (223, 4349), (177, 4191), (232, 4277), (358, 4143), (279, 4193), (240, 4093), (198, 4197), (262, 4052), (227, 4029), (229, 4153), (213, 4183), (227, 4084), (229, 4128)]
         : compromised: 0.0550, honest: 0.0548
         : ubar stats = ['Node 0: s1=0.500, s2=0.484', 'Node 1: s1=0.455, s2=0.525', 'Node 2: s1=0.500, s2=0.438']...
Round 009: test acc mean=0.0589 ± 0.0142 | min=0.0435 max=0.0987
         : test loss mean=3.6795 ± 0.0170
         : individual accs = ['0.059593', '0.050916', '0.048272', '0.052850', '0.052066', '0.051784', '0.050799', '0.058174', '0.053209', '0.043488', '0.088100', '0.053899', '0.058637', '0.062426', '0.051826', '0.085629', '0.098724', '0.050203', '0.052889', '0.055475']
         : correct/total = [(246, 4128), (214, 4203), (197, 4081), (229, 4333), (213, 4091), (222, 4287), (213, 4193), (253, 4349), (223, 4191), (186, 4277), (365, 4143), (226, 4193), (240, 4093), (262, 4197), (210, 4052), (345, 4029), (410, 4153), (210, 4183), (216, 4084), (229, 4128)]
         : compromised: 0.0566, honest: 0.0612
         : ubar stats = ['Node 0: s1=0.500, s2=0.458', 'Node 1: s1=0.455, s2=0.533', 'Node 2: s1=0.500, s2=0.426']...
Round 010: test acc mean=0.0593 ± 0.0136 | min=0.0480 max=0.0990
         : test loss mean=3.6794 ± 0.0171
         : individual accs = ['0.098110', '0.051630', '0.057584', '0.052850', '0.057932', '0.050618', '0.098974', '0.058174', '0.047960', '0.053776', '0.055998', '0.049606', '0.053750', '0.062426', '0.061204', '0.056342', '0.058271', '0.050203', '0.055583', '0.055475']
         : correct/total = [(405, 4128), (217, 4203), (235, 4081), (229, 4333), (237, 4091), (217, 4287), (415, 4193), (253, 4349), (201, 4191), (230, 4277), (232, 4143), (208, 4193), (220, 4093), (262, 4197), (248, 4052), (227, 4029), (242, 4153), (210, 4183), (227, 4084), (229, 4128)]
         : compromised: 0.0549, honest: 0.0638
         : ubar stats = ['Node 0: s1=0.500, s2=0.475', 'Node 1: s1=0.455, s2=0.500', 'Node 2: s1=0.500, s2=0.433']...

=== FINAL RESULTS ===
Dataset: femnist, Nodes: 20, Graph: erdos, Aggregation: ubar
Attack: directed_deviation, 50.0% compromised
Final accuracy - Compromised: 0.0549, Honest: 0.0638
Overall test accuracy: mean=0.0593 ± 0.0136

=== UBAR SUMMARY ===
Node 0: stage1=0.500, stage2=0.475, overall=0.237
Node 1: stage1=0.455, stage2=0.500, overall=0.227
Node 2: stage1=0.500, stage2=0.433, overall=0.217
Node 3: stage1=0.500, stage2=0.550, overall=0.275
Node 4: stage1=0.455, stage2=0.560, overall=0.255
Node 5: stage1=0.467, stage2=0.357, overall=0.167
Node 6: stage1=0.500, stage2=0.414, overall=0.207
Node 7: stage1=0.500, stage2=0.471, overall=0.236
Node 8: stage1=0.500, stage2=0.500, overall=0.250
Node 9: stage1=0.462, stage2=0.350, overall=0.162
Node 10: stage1=0.444, stage2=0.375, overall=0.167
Node 11: stage1=0.500, stage2=0.371, overall=0.186
Node 12: stage1=0.500, stage2=0.450, overall=0.225
Node 13: stage1=0.462, stage2=0.667, overall=0.308
Node 14: stage1=0.467, stage2=0.586, overall=0.273
Node 15: stage1=0.455, stage2=0.700, overall=0.318
Node 16: stage1=0.462, stage2=0.317, overall=0.146
Node 17: stage1=0.444, stage2=0.450, overall=0.200
Node 18: stage1=0.500, stage2=0.600, overall=0.300
Node 19: stage1=0.500, stage2=0.388, overall=0.194

=== PARALLEL EXECUTION TIME (realistic for distributed system) ===
  COMMUNICATION (max across nodes):
    - Full model transfer: 0.000s (0.0%)
  COMPUTATION (max across nodes):
    - Distance computation: 0.063s (1.5%)
    - Loss computation: 4.125s (98.3%)
    - Aggregation: 0.008s (0.2%)
  TOTALS:
    - Total computation: 4.197s (100.0%)
    - Total communication: 0.000s (0.0%)
    - Total parallel time: 4.197s

=== PER-NODE AVERAGE TIME ===
  - Distance computation: 0.049s
  - Loss computation: 3.861s
  - Aggregation: 0.006s
  - Model transfer: 0.000s
  - Total per node: 3.916s

=== TOTAL COMPUTATIONAL WORK (sum across all nodes) ===
  - Total distance computation: 0.983s
  - Total loss computation: 77.220s
  - Total aggregation: 0.124s
  - Total model transfer: 0.000s
  - Grand total: 78.328s
  - Mean Stage 1 acceptance rate: 0.479
  - Mean Stage 2 acceptance rate: 0.476
  - Overall acceptance rate: 0.228

UBAR Algorithm Properties:
  - Model dimension: 6,603,710
  - Rho parameter: 0.5
  - Two-stage approach: Distance filtering + loss evaluation
  - Stage 1 selects: 50% of neighbors
  - Stage 2 uses: Training sample loss comparison
  - Theoretical complexity: O(deg(i)×d + deg(i)×inference)
  - Approach: UBAR paper implementation
