Device: cuda
Seed: 987654321
Loading 36 LEAF FEMNIST train files...
LEAF FEMNIST train: 3597 users, 734463 samples
Loading 36 LEAF FEMNIST test files...
LEAF FEMNIST test: 3597 users, 83388 samples
Found 3597 train users, 3597 test users, 3597 common users
User sample counts range: 525 (max) to 17 (min)
Distributed ALL 3597 users across 20 clients
Users per client: 179 (with 17 clients getting +1 user)
Train partition sizes: [36360, 37070, 35957, 38262, 36024, 37732, 36921, 38328, 36867, 37683, 36507, 36915, 36007, 37001, 35681, 35453, 36585, 36801, 35964, 36345]
Test partition sizes: [4128, 4203, 4081, 4333, 4091, 4287, 4193, 4349, 4191, 4277, 4143, 4193, 4093, 4197, 4052, 4029, 4153, 4183, 4084, 4128]
  Client 0: 36360 train samples, 62 unique classes
  Client 1: 37070 train samples, 62 unique classes
  Client 2: 35957 train samples, 62 unique classes
  Client 3: 38262 train samples, 62 unique classes
  Client 4: 36024 train samples, 62 unique classes
  Client 5: 37732 train samples, 62 unique classes
  Client 6: 36921 train samples, 62 unique classes
  Client 7: 38328 train samples, 62 unique classes
  Client 8: 36867 train samples, 62 unique classes
  Client 9: 37683 train samples, 62 unique classes
  Client 10: 36507 train samples, 62 unique classes
  Client 11: 36915 train samples, 62 unique classes
  Client 12: 36007 train samples, 62 unique classes
  Client 13: 37001 train samples, 62 unique classes
  Client 14: 35681 train samples, 62 unique classes
  Client 15: 35453 train samples, 62 unique classes
  Client 16: 36585 train samples, 62 unique classes
  Client 17: 36801 train samples, 62 unique classes
  Client 18: 35964 train samples, 62 unique classes
  Client 19: 36345 train samples, 62 unique classes
Will sample 4500 samples per client per epoch
Graph: ring, nodes: 20, edges: 20
Degree statistics: avg=2.00, min=2, max=2
Attack: Compromised 8/20 nodes: [1, 5, 11, 12, 13, 14, 17, 18]
Attack type: backdoor, lambda: 1.0
Backdoor target label: 0, trigger size: 4
Model variant: baseline
Model parameters: 6,603,710
Initial test acc across nodes: mean=0.0168 ± 0.0139
Backdoor attack: Created poisoned datasets for 8 compromised nodes
Round 001: test acc mean=0.0297 ± 0.0177 | min=0.0045 max=0.0549
         : test loss mean=80776.1673 ± 200918.6739
         : individual accs = ['0.016715', '0.004521', '0.050723', '0.047773', '0.047421', '0.028691', '0.023372', '0.053116', '0.054880', '0.048398', '0.019792', '0.041736', '0.050574', '0.012152', '0.007651', '0.005709', '0.026005', '0.014583', '0.007591', '0.032219']
         : correct/total = [(69, 4128), (19, 4203), (207, 4081), (207, 4333), (194, 4091), (123, 4287), (98, 4193), (231, 4349), (230, 4191), (207, 4277), (82, 4143), (175, 4193), (207, 4093), (51, 4197), (31, 4052), (23, 4029), (108, 4153), (61, 4183), (31, 4084), (133, 4128)]
         : compromised: 0.0209, honest: 0.0355
Round 002: test acc mean=0.0479 ± 0.0040 | min=0.0356 max=0.0534
         : test loss mean=302865417.3457 ± 578242616.1908
         : individual accs = ['0.047238', '0.048775', '0.053418', '0.043157', '0.043021', '0.045253', '0.050799', '0.035640', '0.051062', '0.047463', '0.048033', '0.049606', '0.045688', '0.046462', '0.051826', '0.051626', '0.052011', '0.049486', '0.048482', '0.048692']
         : correct/total = [(195, 4128), (205, 4203), (218, 4081), (187, 4333), (176, 4091), (194, 4287), (213, 4193), (155, 4349), (214, 4191), (203, 4277), (199, 4143), (208, 4193), (187, 4093), (195, 4197), (210, 4052), (208, 4029), (216, 4153), (207, 4183), (198, 4084), (201, 4128)]
         : compromised: 0.0482, honest: 0.0477
Round 003: test acc mean=0.0436 ± 0.0114 | min=0.0044 max=0.0545
         : test loss mean=1804761187.8876 ± 5063864736.6605
         : individual accs = ['0.050145', '0.036878', '0.045087', '0.047773', '0.029333', '0.035223', '0.033389', '0.004369', '0.042233', '0.047463', '0.045619', '0.046983', '0.054239', '0.049083', '0.051826', '0.053860', '0.044546', '0.045900', '0.054358', '0.054506']
         : correct/total = [(207, 4128), (155, 4203), (184, 4081), (207, 4333), (120, 4091), (151, 4287), (140, 4193), (19, 4349), (177, 4191), (203, 4277), (189, 4143), (197, 4193), (222, 4093), (206, 4197), (210, 4052), (217, 4029), (185, 4153), (192, 4183), (222, 4084), (225, 4128)]
         : compromised: 0.0468, honest: 0.0415
Round 004: test acc mean=0.0440 ± 0.0117 | min=0.0044 max=0.0551
         : test loss mean=5084443902.8676 ± 14063008147.6675
         : individual accs = ['0.045785', '0.036878', '0.055134', '0.043157', '0.044977', '0.052484', '0.018841', '0.004369', '0.051539', '0.047229', '0.045619', '0.046983', '0.054239', '0.049083', '0.047878', '0.050385', '0.047195', '0.048291', '0.045788', '0.044331']
         : correct/total = [(189, 4128), (155, 4203), (225, 4081), (187, 4333), (184, 4091), (225, 4287), (79, 4193), (19, 4349), (216, 4191), (202, 4277), (189, 4143), (197, 4193), (222, 4093), (206, 4197), (194, 4052), (203, 4029), (196, 4153), (202, 4183), (187, 4084), (183, 4128)]
         : compromised: 0.0477, honest: 0.0415
Round 005: test acc mean=0.0475 ± 0.0084 | min=0.0188 max=0.0624
         : test loss mean=nan ± nan
         : individual accs = ['0.045785', '0.047109', '0.055134', '0.043157', '0.044977', '0.057849', '0.018841', '0.051276', '0.043188', '0.047229', '0.045619', '0.046983', '0.058637', '0.062426', '0.047878', '0.050385', '0.047195', '0.046139', '0.045788', '0.044331']
         : correct/total = [(189, 4128), (198, 4203), (225, 4081), (187, 4333), (184, 4091), (248, 4287), (79, 4193), (223, 4349), (181, 4191), (202, 4277), (189, 4143), (197, 4193), (240, 4093), (262, 4197), (194, 4052), (203, 4029), (196, 4153), (193, 4183), (187, 4084), (183, 4128)]
         : compromised: 0.0516, honest: 0.0448
Round 006: test acc mean=0.0490 ± 0.0052 | min=0.0334 max=0.0578
         : test loss mean=nan ± nan
         : individual accs = ['0.051599', '0.051630', '0.055134', '0.043157', '0.044977', '0.057849', '0.033389', '0.051276', '0.043188', '0.047229', '0.045619', '0.046983', '0.054239', '0.049083', '0.051826', '0.050633', '0.051288', '0.050203', '0.052889', '0.048450']
         : correct/total = [(213, 4128), (217, 4203), (225, 4081), (187, 4333), (184, 4091), (248, 4287), (140, 4193), (223, 4349), (181, 4191), (202, 4277), (189, 4143), (197, 4193), (222, 4093), (206, 4197), (210, 4052), (204, 4029), (213, 4153), (210, 4183), (216, 4084), (200, 4128)]
         : compromised: 0.0518, honest: 0.0472
Round 007: test acc mean=0.0502 ± 0.0043 | min=0.0423 max=0.0570
         : test loss mean=nan ± nan
         : individual accs = ['0.051599', '0.051630', '0.055134', '0.043157', '0.042288', '0.050618', '0.057000', '0.051276', '0.043188', '0.047229', '0.045619', '0.046983', '0.054239', '0.049083', '0.051826', '0.056342', '0.055141', '0.050203', '0.052889', '0.048450']
         : correct/total = [(213, 4128), (217, 4203), (225, 4081), (187, 4333), (173, 4091), (217, 4287), (239, 4193), (223, 4349), (181, 4191), (202, 4277), (189, 4143), (197, 4193), (222, 4093), (206, 4197), (210, 4052), (227, 4029), (229, 4153), (210, 4183), (216, 4084), (200, 4128)]
         : compromised: 0.0509, honest: 0.0497
Round 008: test acc mean=0.0463 ± 0.0114 | min=0.0059 max=0.0570
         : test loss mean=nan ± nan
         : individual accs = ['0.049661', '0.048775', '0.024994', '0.043157', '0.042288', '0.050618', '0.057000', '0.051276', '0.047960', '0.047229', '0.045619', '0.046983', '0.054239', '0.049083', '0.005923', '0.056342', '0.055141', '0.050203', '0.050196', '0.050145']
         : correct/total = [(205, 4128), (205, 4203), (102, 4081), (187, 4333), (173, 4091), (217, 4287), (239, 4193), (223, 4349), (201, 4191), (202, 4277), (189, 4143), (197, 4193), (222, 4093), (206, 4197), (24, 4052), (227, 4029), (229, 4153), (210, 4183), (205, 4084), (207, 4128)]
         : compromised: 0.0445, honest: 0.0476
Round 009: test acc mean=0.0498 ± 0.0040 | min=0.0423 max=0.0570
         : test loss mean=nan ± nan
         : individual accs = ['0.049661', '0.048775', '0.045087', '0.043157', '0.042288', '0.050618', '0.057000', '0.051276', '0.047960', '0.053776', '0.045619', '0.046983', '0.054239', '0.049083', '0.048124', '0.056342', '0.055141', '0.050203', '0.050196', '0.050145']
         : correct/total = [(205, 4128), (205, 4203), (184, 4081), (187, 4333), (173, 4091), (217, 4287), (239, 4193), (223, 4349), (201, 4191), (230, 4277), (189, 4143), (197, 4193), (222, 4093), (206, 4197), (195, 4052), (227, 4029), (229, 4153), (210, 4183), (205, 4084), (207, 4128)]
         : compromised: 0.0498, honest: 0.0498
Round 010: test acc mean=0.0480 ± 0.0061 | min=0.0250 max=0.0542
         : test loss mean=nan ± nan
         : individual accs = ['0.047238', '0.052581', '0.024994', '0.048465', '0.042288', '0.052484', '0.053899', '0.051276', '0.047960', '0.053776', '0.045619', '0.046983', '0.054239', '0.049083', '0.047878', '0.050385', '0.047195', '0.046139', '0.048482', '0.048692']
         : correct/total = [(195, 4128), (221, 4203), (102, 4081), (210, 4333), (173, 4091), (225, 4287), (226, 4193), (223, 4349), (201, 4191), (230, 4277), (189, 4143), (197, 4193), (222, 4093), (206, 4197), (194, 4052), (203, 4029), (196, 4153), (193, 4183), (198, 4084), (201, 4128)]
         : compromised: 0.0497, honest: 0.0468

=== FINAL RESULTS ===
Dataset: femnist, Nodes: 20, Graph: ring, Aggregation: d-fedavg
Attack: backdoor, 40.0% compromised
Final accuracy - Compromised: 0.0497, Honest: 0.0468
Overall test accuracy: mean=0.0480 ± 0.0061

=== BACKDOOR ATTACK SUCCESS RATE (ASR) ===
Target label: 0
Trigger size: 4x4
Overall ASR: 0.1000 ± 0.3000
Honest nodes ASR: 0.0000 ± 0.0000
Compromised nodes ASR: 0.2500 ± 0.4330
Note: Higher ASR indicates more successful backdoor attack
