Device: cuda
Seed: 987654321
Loading 36 LEAF FEMNIST train files...
LEAF FEMNIST train: 3597 users, 734463 samples
Loading 36 LEAF FEMNIST test files...
LEAF FEMNIST test: 3597 users, 83388 samples
Found 3597 train users, 3597 test users, 3597 common users
User sample counts range: 525 (max) to 17 (min)
Distributed ALL 3597 users across 20 clients
Users per client: 179 (with 17 clients getting +1 user)
Train partition sizes: [36360, 37070, 35957, 38262, 36024, 37732, 36921, 38328, 36867, 37683, 36507, 36915, 36007, 37001, 35681, 35453, 36585, 36801, 35964, 36345]
Test partition sizes: [4128, 4203, 4081, 4333, 4091, 4287, 4193, 4349, 4191, 4277, 4143, 4193, 4093, 4197, 4052, 4029, 4153, 4183, 4084, 4128]
  Client 0: 36360 train samples, 62 unique classes
  Client 1: 37070 train samples, 62 unique classes
  Client 2: 35957 train samples, 62 unique classes
  Client 3: 38262 train samples, 62 unique classes
  Client 4: 36024 train samples, 62 unique classes
  Client 5: 37732 train samples, 62 unique classes
  Client 6: 36921 train samples, 62 unique classes
  Client 7: 38328 train samples, 62 unique classes
  Client 8: 36867 train samples, 62 unique classes
  Client 9: 37683 train samples, 62 unique classes
  Client 10: 36507 train samples, 62 unique classes
  Client 11: 36915 train samples, 62 unique classes
  Client 12: 36007 train samples, 62 unique classes
  Client 13: 37001 train samples, 62 unique classes
  Client 14: 35681 train samples, 62 unique classes
  Client 15: 35453 train samples, 62 unique classes
  Client 16: 36585 train samples, 62 unique classes
  Client 17: 36801 train samples, 62 unique classes
  Client 18: 35964 train samples, 62 unique classes
  Client 19: 36345 train samples, 62 unique classes
Will sample 4500 samples per client per epoch
Graph: fully, nodes: 20, edges: 190
Degree statistics: avg=19.00, min=19, max=19
Attack: Compromised 10/20 nodes: [1, 2, 5, 11, 12, 13, 14, 15, 17, 18]
Attack type: backdoor, lambda: 1.0
Backdoor target label: 0, trigger size: 4
Model variant: baseline
Model parameters: 6,603,710
Initial test acc across nodes: mean=0.0168 ± 0.0139
Backdoor attack: Created poisoned datasets for 10 compromised nodes
Round 001: test acc mean=0.0163 ± 0.0160 | min=0.0019 max=0.0549
         : test loss mean=18468.6211 ± 4714.7218
         : individual accs = ['0.004845', '0.005710', '0.012987', '0.006000', '0.012711', '0.043387', '0.020033', '0.002759', '0.013362', '0.014029', '0.032826', '0.001908', '0.004398', '0.004289', '0.010118', '0.054852', '0.006742', '0.014583', '0.007346', '0.053295']
         : correct/total = [(20, 4128), (24, 4203), (53, 4081), (26, 4333), (52, 4091), (186, 4287), (84, 4193), (12, 4349), (56, 4191), (60, 4277), (136, 4143), (8, 4193), (18, 4093), (18, 4197), (41, 4052), (221, 4029), (28, 4153), (61, 4183), (30, 4084), (220, 4128)]
         : compromised: 0.0160, honest: 0.0167
Round 002: test acc mean=0.0350 ± 0.0046 | min=0.0250 max=0.0423
         : test loss mean=1450.5817 ± 24.2955
         : individual accs = ['0.030523', '0.034737', '0.024994', '0.040157', '0.042288', '0.038955', '0.033389', '0.041389', '0.034359', '0.039280', '0.036688', '0.028142', '0.033716', '0.028592', '0.037759', '0.032266', '0.040212', '0.037533', '0.033301', '0.032219']
         : correct/total = [(126, 4128), (146, 4203), (102, 4081), (174, 4333), (173, 4091), (167, 4287), (140, 4193), (180, 4349), (144, 4191), (168, 4277), (152, 4143), (118, 4193), (138, 4093), (120, 4197), (153, 4052), (130, 4029), (167, 4153), (157, 4183), (136, 4084), (133, 4128)]
         : compromised: 0.0330, honest: 0.0371
Round 003: test acc mean=0.0472 ± 0.0022 | min=0.0445 max=0.0539
         : test loss mean=889.0641 ± 13.9958
         : individual accs = ['0.047238', '0.048775', '0.045087', '0.044773', '0.047421', '0.048752', '0.048891', '0.045528', '0.044619', '0.047697', '0.047309', '0.045314', '0.049597', '0.045747', '0.046397', '0.053860', '0.044546', '0.045900', '0.048482', '0.048692']
         : correct/total = [(195, 4128), (205, 4203), (184, 4081), (194, 4333), (194, 4091), (209, 4287), (205, 4193), (198, 4349), (187, 4191), (204, 4277), (196, 4143), (190, 4193), (203, 4093), (192, 4197), (188, 4052), (217, 4029), (185, 4153), (192, 4183), (198, 4084), (201, 4128)]
         : compromised: 0.0478, honest: 0.0467
Round 004: test acc mean=0.0472 ± 0.0022 | min=0.0445 max=0.0539
         : test loss mean=565.1921 ± 6.3446
         : individual accs = ['0.047238', '0.048775', '0.045087', '0.044773', '0.047421', '0.048752', '0.048891', '0.045528', '0.044619', '0.047697', '0.047309', '0.045314', '0.049597', '0.045747', '0.046397', '0.053860', '0.044546', '0.045900', '0.048482', '0.048692']
         : correct/total = [(195, 4128), (205, 4203), (184, 4081), (194, 4333), (194, 4091), (209, 4287), (205, 4193), (198, 4349), (187, 4191), (204, 4277), (196, 4143), (190, 4193), (203, 4093), (192, 4197), (188, 4052), (217, 4029), (185, 4153), (192, 4183), (198, 4084), (201, 4128)]
         : compromised: 0.0478, honest: 0.0467
Round 005: test acc mean=0.0472 ± 0.0022 | min=0.0445 max=0.0539
         : test loss mean=183.6343 ± 2.4991
         : individual accs = ['0.047238', '0.048775', '0.045087', '0.044773', '0.047421', '0.048752', '0.048891', '0.045528', '0.044619', '0.047697', '0.047309', '0.045314', '0.049597', '0.045747', '0.046397', '0.053860', '0.044546', '0.045900', '0.048482', '0.048692']
         : correct/total = [(195, 4128), (205, 4203), (184, 4081), (194, 4333), (194, 4091), (209, 4287), (205, 4193), (198, 4349), (187, 4191), (204, 4277), (196, 4143), (190, 4193), (203, 4093), (192, 4197), (188, 4052), (217, 4029), (185, 4153), (192, 4183), (198, 4084), (201, 4128)]
         : compromised: 0.0478, honest: 0.0467
Round 006: test acc mean=0.0350 ± 0.0046 | min=0.0250 max=0.0423
         : test loss mean=9.9243 ± 0.1775
         : individual accs = ['0.030523', '0.034737', '0.024994', '0.040157', '0.042288', '0.038955', '0.033389', '0.041389', '0.034359', '0.039280', '0.036688', '0.028142', '0.033716', '0.028592', '0.037759', '0.032266', '0.040212', '0.037533', '0.033301', '0.032219']
         : correct/total = [(126, 4128), (146, 4203), (102, 4081), (174, 4333), (173, 4091), (167, 4287), (140, 4193), (180, 4349), (144, 4191), (168, 4277), (152, 4143), (118, 4193), (138, 4093), (120, 4197), (153, 4052), (130, 4029), (167, 4153), (157, 4183), (136, 4084), (133, 4128)]
         : compromised: 0.0330, honest: 0.0371
Round 007: test acc mean=0.0561 ± 0.0032 | min=0.0506 max=0.0624
         : test loss mean=4.2433 ± 0.0205
         : individual accs = ['0.059593', '0.052344', '0.057584', '0.052850', '0.057932', '0.050618', '0.057000', '0.058174', '0.053209', '0.053776', '0.055998', '0.053899', '0.058637', '0.062426', '0.061204', '0.056590', '0.058271', '0.050920', '0.055583', '0.055475']
         : correct/total = [(246, 4128), (220, 4203), (235, 4081), (229, 4333), (237, 4091), (217, 4287), (239, 4193), (253, 4349), (223, 4191), (230, 4277), (232, 4143), (226, 4193), (240, 4093), (262, 4197), (248, 4052), (228, 4029), (242, 4153), (213, 4183), (227, 4084), (229, 4128)]
         : compromised: 0.0560, honest: 0.0562
Round 008: test acc mean=0.0561 ± 0.0032 | min=0.0506 max=0.0624
         : test loss mean=4.5547 ± 0.0201
         : individual accs = ['0.059593', '0.052344', '0.057584', '0.052850', '0.057932', '0.050618', '0.057000', '0.058174', '0.053209', '0.053776', '0.055998', '0.053899', '0.058637', '0.062426', '0.061204', '0.056590', '0.058271', '0.050920', '0.055583', '0.055475']
         : correct/total = [(246, 4128), (220, 4203), (235, 4081), (229, 4333), (237, 4091), (217, 4287), (239, 4193), (253, 4349), (223, 4191), (230, 4277), (232, 4143), (226, 4193), (240, 4093), (262, 4197), (248, 4052), (228, 4029), (242, 4153), (213, 4183), (227, 4084), (229, 4128)]
         : compromised: 0.0560, honest: 0.0562
Round 009: test acc mean=0.0561 ± 0.0032 | min=0.0506 max=0.0624
         : test loss mean=4.3094 ± 0.0216
         : individual accs = ['0.059593', '0.052344', '0.057584', '0.052850', '0.057932', '0.050618', '0.057000', '0.058174', '0.053209', '0.053776', '0.055998', '0.053899', '0.058637', '0.062426', '0.061204', '0.056590', '0.058271', '0.050920', '0.055583', '0.055475']
         : correct/total = [(246, 4128), (220, 4203), (235, 4081), (229, 4333), (237, 4091), (217, 4287), (239, 4193), (253, 4349), (223, 4191), (230, 4277), (232, 4143), (226, 4193), (240, 4093), (262, 4197), (248, 4052), (228, 4029), (242, 4153), (213, 4183), (227, 4084), (229, 4128)]
         : compromised: 0.0560, honest: 0.0562
Round 010: test acc mean=0.0447 ± 0.0037 | min=0.0365 max=0.0512
         : test loss mean=4.4330 ± 0.0160
         : individual accs = ['0.045785', '0.042589', '0.048763', '0.036464', '0.043266', '0.047352', '0.042213', '0.041619', '0.040802', '0.046528', '0.051171', '0.041736', '0.050818', '0.049559', '0.046644', '0.041698', '0.040693', '0.045900', '0.045788', '0.044331']
         : correct/total = [(189, 4128), (179, 4203), (199, 4081), (158, 4333), (177, 4091), (203, 4287), (177, 4193), (181, 4349), (171, 4191), (199, 4277), (212, 4143), (175, 4193), (208, 4093), (208, 4197), (189, 4052), (168, 4029), (169, 4153), (192, 4183), (187, 4084), (183, 4128)]
         : compromised: 0.0461, honest: 0.0433

=== FINAL RESULTS ===
Dataset: femnist, Nodes: 20, Graph: fully, Aggregation: krum
Attack: backdoor, 50.0% compromised
Final accuracy - Compromised: 0.0461, Honest: 0.0433
Overall test accuracy: mean=0.0447 ± 0.0037

=== BACKDOOR ATTACK SUCCESS RATE (ASR) ===
Target label: 0
Trigger size: 4x4
Overall ASR: 0.0000 ± 0.0000
Honest nodes ASR: 0.0000 ± 0.0000
Compromised nodes ASR: 0.0000 ± 0.0000
Note: Higher ASR indicates more successful backdoor attack
