Device: cuda
Seed: 987654321
Loading 36 LEAF FEMNIST train files...
LEAF FEMNIST train: 3597 users, 734463 samples
Loading 36 LEAF FEMNIST test files...
LEAF FEMNIST test: 3597 users, 83388 samples
Found 3597 train users, 3597 test users, 3597 common users
User sample counts range: 525 (max) to 17 (min)
Distributed ALL 3597 users across 20 clients
Users per client: 179 (with 17 clients getting +1 user)
Train partition sizes: [36360, 37070, 35957, 38262, 36024, 37732, 36921, 38328, 36867, 37683, 36507, 36915, 36007, 37001, 35681, 35453, 36585, 36801, 35964, 36345]
Test partition sizes: [4128, 4203, 4081, 4333, 4091, 4287, 4193, 4349, 4191, 4277, 4143, 4193, 4093, 4197, 4052, 4029, 4153, 4183, 4084, 4128]
  Client 0: 36360 train samples, 62 unique classes
  Client 1: 37070 train samples, 62 unique classes
  Client 2: 35957 train samples, 62 unique classes
  Client 3: 38262 train samples, 62 unique classes
  Client 4: 36024 train samples, 62 unique classes
  Client 5: 37732 train samples, 62 unique classes
  Client 6: 36921 train samples, 62 unique classes
  Client 7: 38328 train samples, 62 unique classes
  Client 8: 36867 train samples, 62 unique classes
  Client 9: 37683 train samples, 62 unique classes
  Client 10: 36507 train samples, 62 unique classes
  Client 11: 36915 train samples, 62 unique classes
  Client 12: 36007 train samples, 62 unique classes
  Client 13: 37001 train samples, 62 unique classes
  Client 14: 35681 train samples, 62 unique classes
  Client 15: 35453 train samples, 62 unique classes
  Client 16: 36585 train samples, 62 unique classes
  Client 17: 36801 train samples, 62 unique classes
  Client 18: 35964 train samples, 62 unique classes
  Client 19: 36345 train samples, 62 unique classes
Will sample 4500 samples per client per epoch
Graph: erdos, nodes: 20, edges: 99
Degree statistics: avg=9.90, min=7, max=14
Attack: Compromised 8/20 nodes: [1, 5, 11, 12, 13, 14, 17, 18]
Attack type: directed_deviation, lambda: 1.0
Model variant: baseline
Model parameters: 6,603,710
Initial test acc across nodes: mean=0.0168 ± 0.0139
Round 001: test acc mean=0.0187 ± 0.0148 | min=0.0029 max=0.0527
         : test loss mean=14541.0894 ± 10008.5466
         : individual accs = ['0.006056', '0.020700', '0.052683', '0.010155', '0.008800', '0.005598', '0.004054', '0.009657', '0.031019', '0.029694', '0.019068', '0.031243', '0.036892', '0.002859', '0.004936', '0.004468', '0.012521', '0.021038', '0.049216', '0.012839']
         : correct/total = [(25, 4128), (87, 4203), (215, 4081), (44, 4333), (36, 4091), (24, 4287), (17, 4193), (42, 4349), (130, 4191), (127, 4277), (79, 4143), (131, 4193), (151, 4093), (12, 4197), (20, 4052), (18, 4029), (52, 4153), (88, 4183), (201, 4084), (53, 4128)]
         : compromised: 0.0216, honest: 0.0168
Round 002: test acc mean=0.0527 ± 0.0045 | min=0.0432 max=0.0624
         : test loss mean=347037.6959 ± 1068043.6626
         : individual accs = ['0.049176', '0.050202', '0.057584', '0.043157', '0.057932', '0.050618', '0.057000', '0.051276', '0.053209', '0.047697', '0.055998', '0.053899', '0.050574', '0.062426', '0.047878', '0.053860', '0.054418', '0.045900', '0.055583', '0.055475']
         : correct/total = [(203, 4128), (211, 4203), (235, 4081), (187, 4333), (237, 4091), (217, 4287), (239, 4193), (223, 4349), (223, 4191), (204, 4277), (232, 4143), (226, 4193), (207, 4093), (262, 4197), (194, 4052), (217, 4029), (226, 4153), (192, 4183), (227, 4084), (229, 4128)]
         : compromised: 0.0521, honest: 0.0531
Round 003: test acc mean=0.0479 ± 0.0068 | min=0.0214 max=0.0545
         : test loss mean=187.1169 ± 62.3434
         : individual accs = ['0.050145', '0.048775', '0.053418', '0.044773', '0.043021', '0.045253', '0.050799', '0.051276', '0.049630', '0.043488', '0.051653', '0.049606', '0.048620', '0.049559', '0.051826', '0.050385', '0.021430', '0.046139', '0.052889', '0.054506']
         : correct/total = [(207, 4128), (205, 4203), (218, 4081), (194, 4333), (176, 4091), (194, 4287), (213, 4193), (223, 4349), (208, 4191), (186, 4277), (214, 4143), (208, 4193), (199, 4093), (208, 4197), (210, 4052), (203, 4029), (89, 4153), (193, 4183), (216, 4084), (225, 4128)]
         : compromised: 0.0491, honest: 0.0470
Round 004: test acc mean=0.0487 ± 0.0036 | min=0.0430 max=0.0545
         : test loss mean=61.1912 ± 39.4299
         : individual accs = ['0.050145', '0.048775', '0.053418', '0.043157', '0.043021', '0.045253', '0.048414', '0.051276', '0.043188', '0.043488', '0.048033', '0.046745', '0.054239', '0.049083', '0.051826', '0.050385', '0.047195', '0.049486', '0.052889', '0.054506']
         : correct/total = [(207, 4128), (205, 4203), (218, 4081), (187, 4333), (176, 4091), (194, 4287), (203, 4193), (223, 4349), (181, 4191), (186, 4277), (199, 4143), (196, 4193), (222, 4093), (206, 4197), (210, 4052), (203, 4029), (196, 4153), (207, 4183), (216, 4084), (225, 4128)]
         : compromised: 0.0498, honest: 0.0480
Round 005: test acc mean=0.0493 ± 0.0035 | min=0.0430 max=0.0545
         : test loss mean=19.7904 ± 9.2533
         : individual accs = ['0.050145', '0.048775', '0.053418', '0.043157', '0.043021', '0.045253', '0.050799', '0.045068', '0.049630', '0.043488', '0.048033', '0.049606', '0.054239', '0.049083', '0.051826', '0.051626', '0.052011', '0.049486', '0.052889', '0.054506']
         : correct/total = [(207, 4128), (205, 4203), (218, 4081), (187, 4333), (176, 4091), (194, 4287), (213, 4193), (196, 4349), (208, 4191), (186, 4277), (199, 4143), (208, 4193), (222, 4093), (206, 4197), (210, 4052), (208, 4029), (216, 4153), (207, 4183), (216, 4084), (225, 4128)]
         : compromised: 0.0501, honest: 0.0487
Round 006: test acc mean=0.0382 ± 0.0150 | min=0.0158 max=0.0561
         : test loss mean=12.0786 ± 18.8115
         : individual accs = ['0.018653', '0.051630', '0.056114', '0.024233', '0.048643', '0.048519', '0.048414', '0.051276', '0.043188', '0.053075', '0.018344', '0.046745', '0.016858', '0.017632', '0.047878', '0.050385', '0.047195', '0.015778', '0.016405', '0.043847']
         : correct/total = [(77, 4128), (217, 4203), (229, 4081), (105, 4333), (199, 4091), (208, 4287), (203, 4193), (223, 4349), (181, 4191), (227, 4277), (76, 4143), (196, 4193), (69, 4093), (74, 4197), (194, 4052), (203, 4029), (196, 4153), (66, 4183), (67, 4084), (181, 4128)]
         : compromised: 0.0327, honest: 0.0419
Round 007: test acc mean=0.0442 ± 0.0113 | min=0.0281 max=0.0624
         : test loss mean=5.3093 ± 3.4680
         : individual accs = ['0.045785', '0.052344', '0.054889', '0.046619', '0.029333', '0.045953', '0.028619', '0.031272', '0.034359', '0.053776', '0.055998', '0.028142', '0.058637', '0.062426', '0.045656', '0.028295', '0.030821', '0.045900', '0.055583', '0.050145']
         : correct/total = [(189, 4128), (220, 4203), (224, 4081), (202, 4333), (120, 4091), (197, 4287), (120, 4193), (136, 4349), (144, 4191), (230, 4277), (232, 4143), (118, 4193), (240, 4093), (262, 4197), (185, 4052), (114, 4029), (128, 4153), (192, 4183), (227, 4084), (207, 4128)]
         : compromised: 0.0493, honest: 0.0408
Round 008: test acc mean=0.0493 ± 0.0053 | min=0.0365 max=0.0624
         : test loss mean=9.2086 ± 14.5575
         : individual accs = ['0.045785', '0.052344', '0.056114', '0.036464', '0.048643', '0.048519', '0.048414', '0.051276', '0.043188', '0.053776', '0.051171', '0.046745', '0.050818', '0.062426', '0.047878', '0.050385', '0.047195', '0.045900', '0.055583', '0.043847']
         : correct/total = [(189, 4128), (220, 4203), (229, 4081), (158, 4333), (199, 4091), (208, 4287), (203, 4193), (223, 4349), (181, 4191), (230, 4277), (212, 4143), (196, 4193), (208, 4093), (262, 4197), (194, 4052), (203, 4029), (196, 4153), (192, 4183), (227, 4084), (181, 4128)]
         : compromised: 0.0513, honest: 0.0480
Round 009: test acc mean=0.0484 ± 0.0094 | min=0.0293 max=0.0624
         : test loss mean=4.9617 ± 2.8805
         : individual accs = ['0.059593', '0.052344', '0.054889', '0.036464', '0.029333', '0.045953', '0.043883', '0.031272', '0.049630', '0.053075', '0.055998', '0.049606', '0.058637', '0.062426', '0.045656', '0.050881', '0.030821', '0.050920', '0.055583', '0.050145']
         : correct/total = [(246, 4128), (220, 4203), (224, 4081), (158, 4333), (120, 4091), (197, 4287), (184, 4193), (136, 4349), (208, 4191), (227, 4277), (232, 4143), (208, 4193), (240, 4093), (262, 4197), (185, 4052), (205, 4029), (128, 4153), (213, 4183), (227, 4084), (207, 4128)]
         : compromised: 0.0526, honest: 0.0455
Round 010: test acc mean=0.0476 ± 0.0042 | min=0.0365 max=0.0561
         : test loss mean=8.1834 ± 12.4438
         : individual accs = ['0.045785', '0.042589', '0.056114', '0.036464', '0.048643', '0.048519', '0.048414', '0.051276', '0.043188', '0.053776', '0.051171', '0.046745', '0.050818', '0.049559', '0.046644', '0.050385', '0.047195', '0.045900', '0.045788', '0.043847']
         : correct/total = [(189, 4128), (179, 4203), (229, 4081), (158, 4333), (199, 4091), (208, 4287), (203, 4193), (223, 4349), (181, 4191), (230, 4277), (212, 4143), (196, 4193), (208, 4093), (208, 4197), (189, 4052), (203, 4029), (196, 4153), (192, 4183), (187, 4084), (181, 4128)]
         : compromised: 0.0471, honest: 0.0480

=== FINAL RESULTS ===
Dataset: femnist, Nodes: 20, Graph: erdos, Aggregation: d-fedavg
Attack: directed_deviation, 40.0% compromised
Final accuracy - Compromised: 0.0471, Honest: 0.0480
Overall test accuracy: mean=0.0476 ± 0.0042
