Device: cuda
Seed: 987654321
Loading 36 LEAF FEMNIST train files...
LEAF FEMNIST train: 3597 users, 734463 samples
Loading 36 LEAF FEMNIST test files...
LEAF FEMNIST test: 3597 users, 83388 samples
Found 3597 train users, 3597 test users, 3597 common users
User sample counts range: 525 (max) to 17 (min)
Distributed ALL 3597 users across 20 clients
Users per client: 179 (with 17 clients getting +1 user)
Train partition sizes: [36360, 37070, 35957, 38262, 36024, 37732, 36921, 38328, 36867, 37683, 36507, 36915, 36007, 37001, 35681, 35453, 36585, 36801, 35964, 36345]
Test partition sizes: [4128, 4203, 4081, 4333, 4091, 4287, 4193, 4349, 4191, 4277, 4143, 4193, 4093, 4197, 4052, 4029, 4153, 4183, 4084, 4128]
  Client 0: 36360 train samples, 62 unique classes
  Client 1: 37070 train samples, 62 unique classes
  Client 2: 35957 train samples, 62 unique classes
  Client 3: 38262 train samples, 62 unique classes
  Client 4: 36024 train samples, 62 unique classes
  Client 5: 37732 train samples, 62 unique classes
  Client 6: 36921 train samples, 62 unique classes
  Client 7: 38328 train samples, 62 unique classes
  Client 8: 36867 train samples, 62 unique classes
  Client 9: 37683 train samples, 62 unique classes
  Client 10: 36507 train samples, 62 unique classes
  Client 11: 36915 train samples, 62 unique classes
  Client 12: 36007 train samples, 62 unique classes
  Client 13: 37001 train samples, 62 unique classes
  Client 14: 35681 train samples, 62 unique classes
  Client 15: 35453 train samples, 62 unique classes
  Client 16: 36585 train samples, 62 unique classes
  Client 17: 36801 train samples, 62 unique classes
  Client 18: 35964 train samples, 62 unique classes
  Client 19: 36345 train samples, 62 unique classes
Will sample 4500 samples per client per epoch
Graph: fully, nodes: 20, edges: 190
Degree statistics: avg=19.00, min=19, max=19
Attack: Compromised 2/20 nodes: [5, 13]
Attack type: backdoor, lambda: 1.0
Backdoor target label: 0, trigger size: 4
Model variant: baseline
Model parameters: 6,603,710
Initial test acc across nodes: mean=0.0168 ± 0.0139
Backdoor attack: Created poisoned datasets for 2 compromised nodes
Round 001: test acc mean=0.0225 ± 0.0166 | min=0.0017 max=0.0579
         : test loss mean=34.4676 ± 13.3639
         : individual accs = ['0.030523', '0.051630', '0.026464', '0.024694', '0.057932', '0.013296', '0.010017', '0.045068', '0.012169', '0.039280', '0.019792', '0.004770', '0.016858', '0.008101', '0.037759', '0.006453', '0.001686', '0.032991', '0.006121', '0.005087']
         : correct/total = [(126, 4128), (217, 4203), (108, 4081), (107, 4333), (237, 4091), (57, 4287), (42, 4193), (196, 4349), (51, 4191), (168, 4277), (82, 4143), (20, 4193), (69, 4093), (34, 4197), (153, 4052), (26, 4029), (7, 4153), (138, 4183), (25, 4084), (21, 4128)]
         : compromised: 0.0107, honest: 0.0238
Round 002: test acc mean=0.0089 ± 0.0026 | min=0.0051 max=0.0147
         : test loss mean=25.7789 ± 0.2889
         : individual accs = ['0.009205', '0.008089', '0.005146', '0.009693', '0.014666', '0.010264', '0.008586', '0.008508', '0.006442', '0.008885', '0.012551', '0.005247', '0.007818', '0.007386', '0.013574', '0.011665', '0.009391', '0.006933', '0.008815', '0.005329']
         : correct/total = [(38, 4128), (34, 4203), (21, 4081), (42, 4333), (60, 4091), (44, 4287), (36, 4193), (37, 4349), (27, 4191), (38, 4277), (52, 4143), (22, 4193), (32, 4093), (31, 4197), (55, 4052), (47, 4029), (39, 4153), (29, 4183), (36, 4084), (22, 4128)]
         : compromised: 0.0088, honest: 0.0089
Round 003: test acc mean=0.0069 ± 0.0011 | min=0.0054 max=0.0088
         : test loss mean=4.0276 ± 0.0028
         : individual accs = ['0.007510', '0.008089', '0.007596', '0.007154', '0.008800', '0.005365', '0.006678', '0.006438', '0.008590', '0.007949', '0.005552', '0.005724', '0.005619', '0.007148', '0.005676', '0.005709', '0.007224', '0.008606', '0.005877', '0.007267']
         : correct/total = [(31, 4128), (34, 4203), (31, 4081), (31, 4333), (36, 4091), (23, 4287), (28, 4193), (28, 4349), (36, 4191), (34, 4277), (23, 4143), (24, 4193), (23, 4093), (30, 4197), (23, 4052), (23, 4029), (30, 4153), (36, 4183), (24, 4084), (30, 4128)]
         : compromised: 0.0063, honest: 0.0070
Round 004: test acc mean=0.0482 ± 0.0031 | min=0.0420 max=0.0549
         : test loss mean=10.6878 ± 0.1169
         : individual accs = ['0.044574', '0.046158', '0.048272', '0.048234', '0.045710', '0.043387', '0.046745', '0.047827', '0.054880', '0.050503', '0.041999', '0.049606', '0.045688', '0.046462', '0.050346', '0.051378', '0.049362', '0.051159', '0.050930', '0.050872']
         : correct/total = [(184, 4128), (194, 4203), (197, 4081), (209, 4333), (187, 4091), (186, 4287), (196, 4193), (208, 4349), (230, 4191), (216, 4277), (174, 4143), (208, 4193), (187, 4093), (195, 4197), (204, 4052), (207, 4029), (205, 4153), (214, 4183), (208, 4084), (210, 4128)]
         : compromised: 0.0449, honest: 0.0486
Round 005: test acc mean=0.0482 ± 0.0031 | min=0.0420 max=0.0549
         : test loss mean=6.7282 ± 0.0245
         : individual accs = ['0.044574', '0.046158', '0.048272', '0.048234', '0.045710', '0.043387', '0.046745', '0.047827', '0.054880', '0.050503', '0.041999', '0.049606', '0.045688', '0.046462', '0.050346', '0.051378', '0.049362', '0.051159', '0.050930', '0.050872']
         : correct/total = [(184, 4128), (194, 4203), (197, 4081), (209, 4333), (187, 4091), (186, 4287), (196, 4193), (208, 4349), (230, 4191), (216, 4277), (174, 4143), (208, 4193), (187, 4093), (195, 4197), (204, 4052), (207, 4029), (205, 4153), (214, 4183), (208, 4084), (210, 4128)]
         : compromised: 0.0449, honest: 0.0486
Round 006: test acc mean=0.0482 ± 0.0031 | min=0.0420 max=0.0549
         : test loss mean=16.8819 ± 0.0653
         : individual accs = ['0.044574', '0.046158', '0.048272', '0.048234', '0.045710', '0.043387', '0.046745', '0.047827', '0.054880', '0.050503', '0.041999', '0.049606', '0.045688', '0.046462', '0.050346', '0.051378', '0.049362', '0.051159', '0.050930', '0.050872']
         : correct/total = [(184, 4128), (194, 4203), (197, 4081), (209, 4333), (187, 4091), (186, 4287), (196, 4193), (208, 4349), (230, 4191), (216, 4277), (174, 4143), (208, 4193), (187, 4093), (195, 4197), (204, 4052), (207, 4029), (205, 4153), (214, 4183), (208, 4084), (210, 4128)]
         : compromised: 0.0449, honest: 0.0486
Round 007: test acc mean=0.0482 ± 0.0031 | min=0.0420 max=0.0549
         : test loss mean=4.2634 ± 0.0139
         : individual accs = ['0.044574', '0.046158', '0.048272', '0.048234', '0.045710', '0.043387', '0.046745', '0.047827', '0.054880', '0.050503', '0.041999', '0.049606', '0.045688', '0.046462', '0.050346', '0.051378', '0.049362', '0.051159', '0.050930', '0.050872']
         : correct/total = [(184, 4128), (194, 4203), (197, 4081), (209, 4333), (187, 4091), (186, 4287), (196, 4193), (208, 4349), (230, 4191), (216, 4277), (174, 4143), (208, 4193), (187, 4093), (195, 4197), (204, 4052), (207, 4029), (205, 4153), (214, 4183), (208, 4084), (210, 4128)]
         : compromised: 0.0449, honest: 0.0486
Round 008: test acc mean=0.0493 ± 0.0035 | min=0.0430 max=0.0545
         : test loss mean=3.9513 ± 0.0240
         : individual accs = ['0.050145', '0.048775', '0.053418', '0.043157', '0.043021', '0.045253', '0.050799', '0.045068', '0.049630', '0.043488', '0.048033', '0.049606', '0.054239', '0.049083', '0.051826', '0.051626', '0.052011', '0.049486', '0.052889', '0.054506']
         : correct/total = [(207, 4128), (205, 4203), (218, 4081), (187, 4333), (176, 4091), (194, 4287), (213, 4193), (196, 4349), (208, 4191), (186, 4277), (199, 4143), (208, 4193), (222, 4093), (206, 4197), (210, 4052), (208, 4029), (216, 4153), (207, 4183), (216, 4084), (225, 4128)]
         : compromised: 0.0472, honest: 0.0495
Round 009: test acc mean=0.0259 ± 0.0025 | min=0.0215 max=0.0312
         : test loss mean=4.0313 ± 0.0279
         : individual accs = ['0.025921', '0.022603', '0.026464', '0.031156', '0.024933', '0.030324', '0.030050', '0.028052', '0.023622', '0.025251', '0.026309', '0.024326', '0.027119', '0.026686', '0.021471', '0.024820', '0.026246', '0.024623', '0.025220', '0.023256']
         : correct/total = [(107, 4128), (95, 4203), (108, 4081), (135, 4333), (102, 4091), (130, 4287), (126, 4193), (122, 4349), (99, 4191), (108, 4277), (109, 4143), (102, 4193), (111, 4093), (112, 4197), (87, 4052), (100, 4029), (109, 4153), (103, 4183), (103, 4084), (96, 4128)]
         : compromised: 0.0285, honest: 0.0256
Round 010: test acc mean=0.0493 ± 0.0035 | min=0.0430 max=0.0545
         : test loss mean=5.9012 ± 0.0495
         : individual accs = ['0.050145', '0.048775', '0.053418', '0.043157', '0.043021', '0.045253', '0.050799', '0.045068', '0.049630', '0.043488', '0.048033', '0.049606', '0.054239', '0.049083', '0.051826', '0.051626', '0.052011', '0.049486', '0.052889', '0.054506']
         : correct/total = [(207, 4128), (205, 4203), (218, 4081), (187, 4333), (176, 4091), (194, 4287), (213, 4193), (196, 4349), (208, 4191), (186, 4277), (199, 4143), (208, 4193), (222, 4093), (206, 4197), (210, 4052), (208, 4029), (216, 4153), (207, 4183), (216, 4084), (225, 4128)]
         : compromised: 0.0472, honest: 0.0495

=== FINAL RESULTS ===
Dataset: femnist, Nodes: 20, Graph: fully, Aggregation: d-fedavg
Attack: backdoor, 10.0% compromised
Final accuracy - Compromised: 0.0472, Honest: 0.0495
Overall test accuracy: mean=0.0493 ± 0.0035

=== BACKDOOR ATTACK SUCCESS RATE (ASR) ===
Target label: 0
Trigger size: 4x4
Overall ASR: 1.0000 ± 0.0000
Honest nodes ASR: 1.0000 ± 0.0000
Compromised nodes ASR: 1.0000 ± 0.0000
Note: Higher ASR indicates more successful backdoor attack
