Device: cuda
Seed: 987654321
Loading 36 LEAF FEMNIST train files...
LEAF FEMNIST train: 3597 users, 734463 samples
Loading 36 LEAF FEMNIST test files...
LEAF FEMNIST test: 3597 users, 83388 samples
Found 3597 train users, 3597 test users, 3597 common users
User sample counts range: 525 (max) to 17 (min)
Distributed ALL 3597 users across 20 clients
Users per client: 179 (with 17 clients getting +1 user)
Train partition sizes: [36360, 37070, 35957, 38262, 36024, 37732, 36921, 38328, 36867, 37683, 36507, 36915, 36007, 37001, 35681, 35453, 36585, 36801, 35964, 36345]
Test partition sizes: [4128, 4203, 4081, 4333, 4091, 4287, 4193, 4349, 4191, 4277, 4143, 4193, 4093, 4197, 4052, 4029, 4153, 4183, 4084, 4128]
  Client 0: 36360 train samples, 62 unique classes
  Client 1: 37070 train samples, 62 unique classes
  Client 2: 35957 train samples, 62 unique classes
  Client 3: 38262 train samples, 62 unique classes
  Client 4: 36024 train samples, 62 unique classes
  Client 5: 37732 train samples, 62 unique classes
  Client 6: 36921 train samples, 62 unique classes
  Client 7: 38328 train samples, 62 unique classes
  Client 8: 36867 train samples, 62 unique classes
  Client 9: 37683 train samples, 62 unique classes
  Client 10: 36507 train samples, 62 unique classes
  Client 11: 36915 train samples, 62 unique classes
  Client 12: 36007 train samples, 62 unique classes
  Client 13: 37001 train samples, 62 unique classes
  Client 14: 35681 train samples, 62 unique classes
  Client 15: 35453 train samples, 62 unique classes
  Client 16: 36585 train samples, 62 unique classes
  Client 17: 36801 train samples, 62 unique classes
  Client 18: 35964 train samples, 62 unique classes
  Client 19: 36345 train samples, 62 unique classes
Will sample 4500 samples per client per epoch
Graph: erdos, nodes: 20, edges: 126
Degree statistics: avg=12.60, min=8, max=16
Attack: Compromised 6/20 nodes: [5, 12, 13, 14, 17, 18]
Attack type: directed_deviation, lambda: 1.0
Model variant: baseline
Model parameters: 6,603,710
Initial test acc across nodes: mean=0.0168 ± 0.0139
Round 001: test acc mean=0.0137 ± 0.0138 | min=0.0029 max=0.0488
         : test loss mean=3516.4830 ± 2850.9214
         : individual accs = ['0.004118', '0.020700', '0.048763', '0.048234', '0.007822', '0.005365', '0.006439', '0.004369', '0.007874', '0.003040', '0.003138', '0.009301', '0.032250', '0.010007', '0.006170', '0.008439', '0.007224', '0.002869', '0.025220', '0.012839']
         : correct/total = [(17, 4128), (87, 4203), (199, 4081), (209, 4333), (32, 4091), (23, 4287), (27, 4193), (19, 4349), (33, 4191), (13, 4277), (13, 4143), (39, 4193), (132, 4093), (42, 4197), (25, 4052), (34, 4029), (30, 4153), (12, 4183), (103, 4084), (53, 4128)]
         : compromised: 0.0136, honest: 0.0137
Round 002: test acc mean=0.0481 ± 0.0048 | min=0.0312 max=0.0527
         : test loss mean=141.4734 ± 65.2966
         : individual accs = ['0.050145', '0.049726', '0.052683', '0.031156', '0.052554', '0.052484', '0.044598', '0.049207', '0.042233', '0.048398', '0.045619', '0.046983', '0.050574', '0.047177', '0.051826', '0.050633', '0.051288', '0.048291', '0.051665', '0.045058']
         : correct/total = [(207, 4128), (209, 4203), (215, 4081), (135, 4333), (215, 4091), (225, 4287), (187, 4193), (214, 4349), (177, 4191), (207, 4277), (189, 4143), (197, 4193), (207, 4093), (198, 4197), (210, 4052), (204, 4029), (213, 4153), (202, 4183), (211, 4084), (186, 4128)]
         : compromised: 0.0503, honest: 0.0472
Round 003: test acc mean=0.0380 ± 0.0068 | min=0.0261 max=0.0521
         : test loss mean=8.1754 ± 2.8606
         : individual accs = ['0.029070', '0.049726', '0.035531', '0.043388', '0.052066', '0.036856', '0.035535', '0.035640', '0.037700', '0.048398', '0.039585', '0.036728', '0.036404', '0.047177', '0.032330', '0.026061', '0.030340', '0.039445', '0.032321', '0.035853']
         : correct/total = [(120, 4128), (209, 4203), (145, 4081), (188, 4333), (213, 4091), (158, 4287), (149, 4193), (155, 4349), (158, 4191), (207, 4277), (164, 4143), (154, 4193), (149, 4093), (198, 4197), (131, 4052), (105, 4029), (126, 4153), (165, 4183), (132, 4084), (148, 4128)]
         : compromised: 0.0374, honest: 0.0383
Round 004: test acc mean=0.0498 ± 0.0031 | min=0.0422 max=0.0538
         : test loss mean=15.2583 ± 17.6815
         : individual accs = ['0.051599', '0.050916', '0.052683', '0.048465', '0.051088', '0.052484', '0.044598', '0.049207', '0.042233', '0.053075', '0.050447', '0.046983', '0.053750', '0.046938', '0.051826', '0.050633', '0.051288', '0.050203', '0.052889', '0.045058']
         : correct/total = [(213, 4128), (214, 4203), (215, 4081), (210, 4333), (209, 4091), (225, 4287), (187, 4193), (214, 4349), (177, 4191), (227, 4277), (209, 4143), (197, 4193), (220, 4093), (197, 4197), (210, 4052), (204, 4029), (213, 4153), (210, 4183), (216, 4084), (186, 4128)]
         : compromised: 0.0513, honest: 0.0492
Round 005: test acc mean=0.0419 ± 0.0082 | min=0.0250 max=0.0526
         : test loss mean=4.8315 ± 1.2514
         : individual accs = ['0.049661', '0.050916', '0.024994', '0.046619', '0.052554', '0.036856', '0.035535', '0.035640', '0.037700', '0.047697', '0.036688', '0.036728', '0.050574', '0.047177', '0.032330', '0.050881', '0.030340', '0.048291', '0.051665', '0.035853']
         : correct/total = [(205, 4128), (214, 4203), (102, 4081), (202, 4333), (215, 4091), (158, 4287), (149, 4193), (155, 4349), (158, 4191), (204, 4277), (152, 4143), (154, 4193), (207, 4093), (198, 4197), (131, 4052), (205, 4029), (126, 4153), (202, 4183), (211, 4084), (148, 4128)]
         : compromised: 0.0445, honest: 0.0408
Round 006: test acc mean=0.0492 ± 0.0035 | min=0.0422 max=0.0563
         : test loss mean=8.6933 ± 11.8522
         : individual accs = ['0.051599', '0.050202', '0.050723', '0.043157', '0.048643', '0.052484', '0.044598', '0.049207', '0.042233', '0.047229', '0.050447', '0.046983', '0.048620', '0.049559', '0.051826', '0.056342', '0.051288', '0.050203', '0.054358', '0.045058']
         : correct/total = [(213, 4128), (211, 4203), (207, 4081), (187, 4333), (199, 4091), (225, 4287), (187, 4193), (214, 4349), (177, 4191), (202, 4277), (209, 4143), (197, 4193), (199, 4093), (208, 4197), (210, 4052), (227, 4029), (213, 4153), (210, 4183), (222, 4084), (186, 4128)]
         : compromised: 0.0512, honest: 0.0484
Round 007: test acc mean=0.0497 ± 0.0051 | min=0.0355 max=0.0553
         : test loss mean=4.3033 ± 0.8683
         : individual accs = ['0.049661', '0.052344', '0.054889', '0.052850', '0.052066', '0.045953', '0.035535', '0.053116', '0.037700', '0.053776', '0.047550', '0.054376', '0.052040', '0.055278', '0.045656', '0.050881', '0.051047', '0.048291', '0.050196', '0.050145']
         : correct/total = [(205, 4128), (220, 4203), (224, 4081), (229, 4333), (213, 4091), (197, 4287), (149, 4193), (231, 4349), (158, 4191), (230, 4277), (197, 4143), (228, 4193), (213, 4093), (232, 4197), (185, 4052), (205, 4029), (212, 4153), (202, 4183), (205, 4084), (207, 4128)]
         : compromised: 0.0496, honest: 0.0497
Round 008: test acc mean=0.0495 ± 0.0032 | min=0.0422 max=0.0544
         : test loss mean=7.0809 ± 9.4942
         : individual accs = ['0.048934', '0.052344', '0.053418', '0.052850', '0.048643', '0.052484', '0.044598', '0.049207', '0.042233', '0.047229', '0.051653', '0.046983', '0.048620', '0.049559', '0.051826', '0.051626', '0.051288', '0.046139', '0.054358', '0.045058']
         : correct/total = [(202, 4128), (220, 4203), (218, 4081), (229, 4333), (199, 4091), (225, 4287), (187, 4193), (214, 4349), (177, 4191), (202, 4277), (214, 4143), (197, 4193), (199, 4093), (208, 4197), (210, 4052), (208, 4029), (213, 4153), (193, 4183), (222, 4084), (186, 4128)]
         : compromised: 0.0505, honest: 0.0490
Round 009: test acc mean=0.0504 ± 0.0064 | min=0.0355 max=0.0624
         : test loss mean=4.1025 ± 0.6869
         : individual accs = ['0.049661', '0.047109', '0.054889', '0.047773', '0.057932', '0.045953', '0.035535', '0.053116', '0.037700', '0.053776', '0.047550', '0.054376', '0.058637', '0.062426', '0.045656', '0.050881', '0.051047', '0.048291', '0.055583', '0.050145']
         : correct/total = [(205, 4128), (198, 4203), (224, 4081), (207, 4333), (237, 4091), (197, 4287), (149, 4193), (231, 4349), (158, 4191), (230, 4277), (197, 4143), (228, 4193), (240, 4093), (262, 4197), (185, 4052), (205, 4029), (212, 4153), (202, 4183), (227, 4084), (207, 4128)]
         : compromised: 0.0528, honest: 0.0494
Round 010: test acc mean=0.0498 ± 0.0036 | min=0.0422 max=0.0566
         : test loss mean=6.3763 ± 7.8359
         : individual accs = ['0.048934', '0.047109', '0.053418', '0.052850', '0.048643', '0.052484', '0.044598', '0.049207', '0.042233', '0.053776', '0.051653', '0.046983', '0.048620', '0.049559', '0.051826', '0.056590', '0.051288', '0.046139', '0.054358', '0.045058']
         : correct/total = [(202, 4128), (198, 4203), (218, 4081), (229, 4333), (199, 4091), (225, 4287), (187, 4193), (214, 4349), (177, 4191), (230, 4277), (214, 4143), (197, 4193), (199, 4093), (208, 4197), (210, 4052), (228, 4029), (213, 4153), (193, 4183), (222, 4084), (186, 4128)]
         : compromised: 0.0505, honest: 0.0495

=== FINAL RESULTS ===
Dataset: femnist, Nodes: 20, Graph: erdos, Aggregation: d-fedavg
Attack: directed_deviation, 30.0% compromised
Final accuracy - Compromised: 0.0505, Honest: 0.0495
Overall test accuracy: mean=0.0498 ± 0.0036
