Device: cuda
Seed: 987654321
Loading 36 LEAF FEMNIST train files...
LEAF FEMNIST train: 3597 users, 734463 samples
Loading 36 LEAF FEMNIST test files...
LEAF FEMNIST test: 3597 users, 83388 samples
Found 3597 train users, 3597 test users, 3597 common users
User sample counts range: 525 (max) to 17 (min)
Distributed ALL 3597 users across 20 clients
Users per client: 179 (with 17 clients getting +1 user)
Train partition sizes: [36360, 37070, 35957, 38262, 36024, 37732, 36921, 38328, 36867, 37683, 36507, 36915, 36007, 37001, 35681, 35453, 36585, 36801, 35964, 36345]
Test partition sizes: [4128, 4203, 4081, 4333, 4091, 4287, 4193, 4349, 4191, 4277, 4143, 4193, 4093, 4197, 4052, 4029, 4153, 4183, 4084, 4128]
  Client 0: 36360 train samples, 62 unique classes
  Client 1: 37070 train samples, 62 unique classes
  Client 2: 35957 train samples, 62 unique classes
  Client 3: 38262 train samples, 62 unique classes
  Client 4: 36024 train samples, 62 unique classes
  Client 5: 37732 train samples, 62 unique classes
  Client 6: 36921 train samples, 62 unique classes
  Client 7: 38328 train samples, 62 unique classes
  Client 8: 36867 train samples, 62 unique classes
  Client 9: 37683 train samples, 62 unique classes
  Client 10: 36507 train samples, 62 unique classes
  Client 11: 36915 train samples, 62 unique classes
  Client 12: 36007 train samples, 62 unique classes
  Client 13: 37001 train samples, 62 unique classes
  Client 14: 35681 train samples, 62 unique classes
  Client 15: 35453 train samples, 62 unique classes
  Client 16: 36585 train samples, 62 unique classes
  Client 17: 36801 train samples, 62 unique classes
  Client 18: 35964 train samples, 62 unique classes
  Client 19: 36345 train samples, 62 unique classes
Will sample 4500 samples per client per epoch
Graph: erdos, nodes: 20, edges: 126
Degree statistics: avg=12.60, min=8, max=16
Attack: Compromised 8/20 nodes: [1, 5, 11, 12, 13, 14, 17, 18]
Attack type: directed_deviation, lambda: 1.0
Model variant: baseline
Model parameters: 6,603,710
Initial test acc across nodes: mean=0.0168 ± 0.0139
Round 001: test acc mean=0.0160 ± 0.0140 | min=0.0019 max=0.0483
         : test loss mean=10844.2489 ± 6411.3762
         : individual accs = ['0.004360', '0.042589', '0.048272', '0.006462', '0.013933', '0.018428', '0.005724', '0.014716', '0.044619', '0.004442', '0.034033', '0.014548', '0.007818', '0.001906', '0.010612', '0.008687', '0.007224', '0.007172', '0.015181', '0.008479']
         : correct/total = [(18, 4128), (179, 4203), (197, 4081), (28, 4333), (57, 4091), (79, 4287), (24, 4193), (64, 4349), (187, 4191), (19, 4277), (141, 4143), (61, 4193), (32, 4093), (8, 4197), (43, 4052), (35, 4029), (30, 4153), (30, 4183), (62, 4084), (35, 4128)]
         : compromised: 0.0148, honest: 0.0167
Round 002: test acc mean=0.0479 ± 0.0033 | min=0.0383 max=0.0551
         : test loss mean=2689080959.0242 ± 1680721468.9781
         : individual accs = ['0.047238', '0.048775', '0.050723', '0.038311', '0.047421', '0.048752', '0.048891', '0.045528', '0.047960', '0.047697', '0.047309', '0.045314', '0.049597', '0.045747', '0.046397', '0.053860', '0.055141', '0.045900', '0.048482', '0.048692']
         : correct/total = [(195, 4128), (205, 4203), (207, 4081), (166, 4333), (194, 4091), (209, 4287), (205, 4193), (198, 4349), (201, 4191), (204, 4277), (196, 4143), (190, 4193), (203, 4093), (192, 4197), (188, 4052), (217, 4029), (229, 4153), (192, 4183), (198, 4084), (201, 4128)]
         : compromised: 0.0474, honest: 0.0482
Round 003: test acc mean=0.0501 ± 0.0039 | min=0.0420 max=0.0582
         : test loss mean=4951.4373 ± 6308.8905
         : individual accs = ['0.050145', '0.048775', '0.053418', '0.052850', '0.045710', '0.045253', '0.050799', '0.058174', '0.049630', '0.043488', '0.041999', '0.053899', '0.045688', '0.049083', '0.051826', '0.051626', '0.052011', '0.051159', '0.052889', '0.054506']
         : correct/total = [(207, 4128), (205, 4203), (218, 4081), (229, 4333), (187, 4091), (194, 4287), (213, 4193), (253, 4349), (208, 4191), (186, 4277), (174, 4143), (226, 4193), (187, 4093), (206, 4197), (210, 4052), (208, 4029), (216, 4153), (214, 4183), (216, 4084), (225, 4128)]
         : compromised: 0.0498, honest: 0.0504
Round 004: test acc mean=0.0485 ± 0.0035 | min=0.0407 max=0.0532
         : test loss mean=556.0997 ± 171.4787
         : individual accs = ['0.050145', '0.049726', '0.048763', '0.043388', '0.052554', '0.052484', '0.042213', '0.049207', '0.053209', '0.046528', '0.045619', '0.046983', '0.050574', '0.049559', '0.051826', '0.050633', '0.040693', '0.048291', '0.051665', '0.045058']
         : correct/total = [(207, 4128), (209, 4203), (199, 4081), (188, 4333), (215, 4091), (225, 4287), (177, 4193), (214, 4349), (223, 4191), (199, 4277), (189, 4143), (197, 4193), (207, 4093), (208, 4197), (210, 4052), (204, 4029), (169, 4153), (202, 4183), (211, 4084), (186, 4128)]
         : compromised: 0.0501, honest: 0.0473
Round 005: test acc mean=0.0472 ± 0.0022 | min=0.0445 max=0.0539
         : test loss mean=6.1622 ± 0.6856
         : individual accs = ['0.047238', '0.048775', '0.045087', '0.044773', '0.047421', '0.048752', '0.048891', '0.045528', '0.044619', '0.047697', '0.047309', '0.045314', '0.049597', '0.045747', '0.046397', '0.053860', '0.044546', '0.045900', '0.048482', '0.048692']
         : correct/total = [(195, 4128), (205, 4203), (184, 4081), (194, 4333), (194, 4091), (209, 4287), (205, 4193), (198, 4349), (187, 4191), (204, 4277), (196, 4143), (190, 4193), (203, 4093), (192, 4197), (188, 4052), (217, 4029), (185, 4153), (192, 4183), (198, 4084), (201, 4128)]
         : compromised: 0.0474, honest: 0.0471
Round 006: test acc mean=0.0394 ± 0.0184 | min=0.0025 max=0.0549
         : test loss mean=4.5132 ± 1.0203
         : individual accs = ['0.044574', '0.046158', '0.045087', '0.048234', '0.045710', '0.003266', '0.002623', '0.002529', '0.051539', '0.050503', '0.041999', '0.003816', '0.045688', '0.046462', '0.051826', '0.054852', '0.052011', '0.051159', '0.050930', '0.048692']
         : correct/total = [(184, 4128), (194, 4203), (184, 4081), (209, 4333), (187, 4091), (14, 4287), (11, 4193), (11, 4349), (216, 4191), (216, 4277), (174, 4143), (16, 4193), (187, 4093), (195, 4197), (210, 4052), (221, 4029), (216, 4153), (214, 4183), (208, 4084), (201, 4128)]
         : compromised: 0.0374, honest: 0.0407
Round 007: test acc mean=0.0487 ± 0.0032 | min=0.0417 max=0.0551
         : test loss mean=3.9973 ± 0.0304
         : individual accs = ['0.049661', '0.046158', '0.050723', '0.046619', '0.052066', '0.045953', '0.043883', '0.053116', '0.047960', '0.050503', '0.047550', '0.041736', '0.052040', '0.046462', '0.045656', '0.050881', '0.055141', '0.048291', '0.050196', '0.048450']
         : correct/total = [(205, 4128), (194, 4203), (207, 4081), (202, 4333), (213, 4091), (197, 4287), (184, 4193), (231, 4349), (201, 4191), (216, 4277), (197, 4143), (175, 4193), (213, 4093), (195, 4197), (185, 4052), (205, 4029), (229, 4153), (202, 4183), (205, 4084), (200, 4128)]
         : compromised: 0.0471, honest: 0.0497
Round 008: test acc mean=0.0461 ± 0.0103 | min=0.0033 max=0.0551
         : test loss mean=4.2327 ± 0.5943
         : individual accs = ['0.044574', '0.046158', '0.055134', '0.048234', '0.045710', '0.003266', '0.048891', '0.045528', '0.051539', '0.050503', '0.041999', '0.045314', '0.045688', '0.046462', '0.050346', '0.051378', '0.049362', '0.051159', '0.050930', '0.050388']
         : correct/total = [(184, 4128), (194, 4203), (225, 4081), (209, 4333), (187, 4091), (14, 4287), (205, 4193), (198, 4349), (216, 4191), (216, 4277), (174, 4143), (190, 4193), (187, 4093), (195, 4197), (204, 4052), (207, 4029), (205, 4153), (214, 4183), (208, 4084), (208, 4128)]
         : compromised: 0.0424, honest: 0.0486
Round 009: test acc mean=0.0514 ± 0.0064 | min=0.0365 max=0.0612
         : test loss mean=3.9510 ± 0.0216
         : individual accs = ['0.059593', '0.042589', '0.057584', '0.036464', '0.057932', '0.045953', '0.043883', '0.053116', '0.053209', '0.050503', '0.055998', '0.053899', '0.050818', '0.049559', '0.061204', '0.056590', '0.058271', '0.045900', '0.045788', '0.048450']
         : correct/total = [(246, 4128), (179, 4203), (235, 4081), (158, 4333), (237, 4091), (197, 4287), (184, 4193), (231, 4349), (223, 4191), (216, 4277), (232, 4143), (226, 4193), (208, 4093), (208, 4197), (248, 4052), (228, 4029), (242, 4153), (192, 4183), (187, 4084), (200, 4128)]
         : compromised: 0.0495, honest: 0.0526
Round 010: test acc mean=0.0484 ± 0.0031 | min=0.0420 max=0.0551
         : test loss mean=4.0567 ± 0.3135
         : individual accs = ['0.044574', '0.046158', '0.055134', '0.048234', '0.045710', '0.048752', '0.048891', '0.045528', '0.051539', '0.050503', '0.041999', '0.045314', '0.045688', '0.046462', '0.050346', '0.051378', '0.049362', '0.051159', '0.050930', '0.050388']
         : correct/total = [(184, 4128), (194, 4203), (225, 4081), (209, 4333), (187, 4091), (209, 4287), (205, 4193), (198, 4349), (216, 4191), (216, 4277), (174, 4143), (190, 4193), (187, 4093), (195, 4197), (204, 4052), (207, 4029), (205, 4153), (214, 4183), (208, 4084), (208, 4128)]
         : compromised: 0.0481, honest: 0.0486

=== FINAL RESULTS ===
Dataset: femnist, Nodes: 20, Graph: erdos, Aggregation: d-fedavg
Attack: directed_deviation, 40.0% compromised
Final accuracy - Compromised: 0.0481, Honest: 0.0486
Overall test accuracy: mean=0.0484 ± 0.0031
