Device: cuda
Seed: 987654321
Loading 36 LEAF FEMNIST train files...
LEAF FEMNIST train: 3597 users, 734463 samples
Loading 36 LEAF FEMNIST test files...
LEAF FEMNIST test: 3597 users, 83388 samples
Found 3597 train users, 3597 test users, 3597 common users
User sample counts range: 525 (max) to 17 (min)
Distributed ALL 3597 users across 20 clients
Users per client: 179 (with 17 clients getting +1 user)
Train partition sizes: [36360, 37070, 35957, 38262, 36024, 37732, 36921, 38328, 36867, 37683, 36507, 36915, 36007, 37001, 35681, 35453, 36585, 36801, 35964, 36345]
Test partition sizes: [4128, 4203, 4081, 4333, 4091, 4287, 4193, 4349, 4191, 4277, 4143, 4193, 4093, 4197, 4052, 4029, 4153, 4183, 4084, 4128]
  Client 0: 36360 train samples, 62 unique classes
  Client 1: 37070 train samples, 62 unique classes
  Client 2: 35957 train samples, 62 unique classes
  Client 3: 38262 train samples, 62 unique classes
  Client 4: 36024 train samples, 62 unique classes
  Client 5: 37732 train samples, 62 unique classes
  Client 6: 36921 train samples, 62 unique classes
  Client 7: 38328 train samples, 62 unique classes
  Client 8: 36867 train samples, 62 unique classes
  Client 9: 37683 train samples, 62 unique classes
  Client 10: 36507 train samples, 62 unique classes
  Client 11: 36915 train samples, 62 unique classes
  Client 12: 36007 train samples, 62 unique classes
  Client 13: 37001 train samples, 62 unique classes
  Client 14: 35681 train samples, 62 unique classes
  Client 15: 35453 train samples, 62 unique classes
  Client 16: 36585 train samples, 62 unique classes
  Client 17: 36801 train samples, 62 unique classes
  Client 18: 35964 train samples, 62 unique classes
  Client 19: 36345 train samples, 62 unique classes
Will sample 4500 samples per client per epoch
Graph: erdos, nodes: 20, edges: 99
Degree statistics: avg=9.90, min=7, max=14
Attack: Compromised 8/20 nodes: [1, 5, 11, 12, 13, 14, 17, 18]
Attack type: backdoor, lambda: 1.0
Backdoor target label: 0, trigger size: 4
Model variant: baseline
Model parameters: 6,603,710
Initial test acc across nodes: mean=0.0168 ± 0.0139
Backdoor attack: Created poisoned datasets for 8 compromised nodes
Round 001: test acc mean=0.0187 ± 0.0148 | min=0.0029 max=0.0527
         : test loss mean=14541.0894 ± 10008.5466
         : individual accs = ['0.006056', '0.020700', '0.052683', '0.010155', '0.008800', '0.005598', '0.004054', '0.009657', '0.031019', '0.029694', '0.019068', '0.031243', '0.036892', '0.002859', '0.004936', '0.004468', '0.012521', '0.021038', '0.049216', '0.012839']
         : correct/total = [(25, 4128), (87, 4203), (215, 4081), (44, 4333), (36, 4091), (24, 4287), (17, 4193), (42, 4349), (130, 4191), (127, 4277), (79, 4143), (131, 4193), (151, 4093), (12, 4197), (20, 4052), (18, 4029), (52, 4153), (88, 4183), (201, 4084), (53, 4128)]
         : compromised: 0.0216, honest: 0.0168
Round 002: test acc mean=0.0481 ± 0.0074 | min=0.0189 max=0.0545
         : test loss mean=276179.1883 ± 612404.5714
         : individual accs = ['0.050145', '0.048775', '0.053418', '0.018925', '0.043021', '0.045253', '0.050799', '0.045068', '0.049630', '0.043488', '0.048033', '0.049606', '0.054239', '0.049083', '0.051826', '0.051626', '0.051288', '0.049486', '0.052889', '0.054506']
         : correct/total = [(207, 4128), (205, 4203), (218, 4081), (82, 4333), (176, 4091), (194, 4287), (213, 4193), (196, 4349), (208, 4191), (186, 4277), (199, 4143), (208, 4193), (222, 4093), (206, 4197), (210, 4052), (208, 4029), (213, 4153), (207, 4183), (216, 4084), (225, 4128)]
         : compromised: 0.0501, honest: 0.0467
Round 003: test acc mean=0.0441 ± 0.0086 | min=0.0250 max=0.0542
         : test loss mean=491.7050 ± 153.5092
         : individual accs = ['0.027132', '0.048775', '0.024994', '0.043157', '0.042288', '0.045253', '0.048891', '0.045528', '0.049630', '0.047697', '0.048033', '0.028142', '0.054239', '0.049083', '0.046397', '0.053860', '0.044546', '0.049486', '0.051665', '0.032219']
         : correct/total = [(112, 4128), (205, 4203), (102, 4081), (187, 4333), (173, 4091), (194, 4287), (205, 4193), (198, 4349), (208, 4191), (204, 4277), (199, 4143), (118, 4193), (222, 4093), (206, 4197), (188, 4052), (217, 4029), (185, 4153), (207, 4183), (211, 4084), (133, 4128)]
         : compromised: 0.0466, honest: 0.0423
Round 004: test acc mean=0.0362 ± 0.0064 | min=0.0250 max=0.0539
         : test loss mean=364.0674 ± 120.4415
         : individual accs = ['0.030523', '0.034737', '0.024994', '0.040157', '0.042288', '0.038955', '0.033389', '0.041389', '0.031496', '0.039280', '0.036688', '0.028142', '0.033716', '0.028592', '0.037759', '0.053860', '0.044546', '0.037533', '0.033301', '0.033430']
         : correct/total = [(126, 4128), (146, 4203), (102, 4081), (174, 4333), (173, 4091), (167, 4287), (140, 4193), (180, 4349), (132, 4191), (168, 4277), (152, 4143), (118, 4193), (138, 4093), (120, 4197), (153, 4052), (217, 4029), (185, 4153), (157, 4183), (136, 4084), (138, 4128)]
         : compromised: 0.0341, honest: 0.0377
Round 005: test acc mean=0.0305 ± 0.0032 | min=0.0259 max=0.0393
         : test loss mean=277.3953 ± 83.4715
         : individual accs = ['0.027132', '0.032834', '0.026954', '0.033003', '0.029333', '0.034756', '0.028619', '0.031272', '0.031496', '0.039280', '0.032585', '0.030766', '0.026142', '0.028354', '0.025913', '0.028295', '0.030821', '0.028927', '0.029383', '0.033430']
         : correct/total = [(112, 4128), (138, 4203), (110, 4081), (143, 4333), (120, 4091), (149, 4287), (120, 4193), (136, 4349), (132, 4191), (168, 4277), (135, 4143), (129, 4193), (107, 4093), (119, 4197), (105, 4052), (114, 4029), (128, 4153), (121, 4183), (120, 4084), (138, 4128)]
         : compromised: 0.0296, honest: 0.0310
Round 006: test acc mean=0.0487 ± 0.0031 | min=0.0422 max=0.0527
         : test loss mean=96.5699 ± 25.5815
         : individual accs = ['0.050145', '0.049726', '0.052683', '0.043388', '0.052554', '0.052484', '0.044598', '0.049207', '0.042233', '0.048398', '0.045619', '0.046983', '0.050574', '0.047177', '0.051826', '0.050633', '0.051288', '0.048291', '0.051665', '0.045058']
         : correct/total = [(207, 4128), (209, 4203), (215, 4081), (188, 4333), (215, 4091), (225, 4287), (187, 4193), (214, 4349), (177, 4191), (207, 4277), (189, 4143), (197, 4193), (207, 4093), (198, 4197), (210, 4052), (204, 4029), (213, 4153), (202, 4183), (211, 4084), (186, 4128)]
         : compromised: 0.0498, honest: 0.0480
Round 007: test acc mean=0.0181 ± 0.0036 | min=0.0142 max=0.0315
         : test loss mean=22.1546 ± 5.7856
         : individual accs = ['0.016231', '0.018320', '0.014212', '0.017771', '0.015644', '0.014696', '0.020749', '0.018165', '0.031496', '0.015431', '0.016655', '0.019556', '0.017347', '0.019061', '0.019743', '0.015637', '0.020708', '0.017213', '0.019344', '0.014535']
         : correct/total = [(67, 4128), (77, 4203), (58, 4081), (77, 4333), (64, 4091), (63, 4287), (87, 4193), (79, 4349), (132, 4191), (66, 4277), (69, 4143), (82, 4193), (71, 4093), (80, 4197), (80, 4052), (63, 4029), (86, 4153), (72, 4183), (79, 4084), (60, 4128)]
         : compromised: 0.0182, honest: 0.0181
Round 008: test acc mean=0.0168 ± 0.0073 | min=0.0116 max=0.0477
         : test loss mean=13.6906 ± 3.1669
         : individual accs = ['0.011628', '0.016179', '0.016173', '0.014309', '0.015155', '0.017261', '0.016933', '0.014486', '0.014794', '0.047697', '0.018827', '0.013356', '0.014903', '0.013343', '0.019497', '0.014396', '0.013484', '0.015061', '0.015181', '0.013081']
         : correct/total = [(48, 4128), (68, 4203), (66, 4081), (62, 4333), (62, 4091), (74, 4287), (71, 4193), (63, 4349), (62, 4191), (204, 4277), (78, 4143), (56, 4193), (61, 4093), (56, 4197), (79, 4052), (58, 4029), (56, 4153), (63, 4183), (62, 4084), (54, 4128)]
         : compromised: 0.0156, honest: 0.0176
Round 009: test acc mean=0.0426 ± 0.0095 | min=0.0042 max=0.0512
         : test loss mean=6.7941 ± 0.7780
         : individual accs = ['0.045785', '0.042589', '0.048763', '0.036464', '0.043266', '0.047352', '0.042213', '0.041619', '0.040802', '0.004209', '0.051171', '0.041736', '0.050818', '0.049559', '0.046644', '0.041698', '0.040693', '0.045900', '0.045788', '0.044331']
         : correct/total = [(189, 4128), (179, 4203), (199, 4081), (158, 4333), (177, 4091), (203, 4287), (177, 4193), (181, 4349), (171, 4191), (18, 4277), (212, 4143), (175, 4193), (208, 4093), (208, 4197), (189, 4052), (168, 4029), (169, 4153), (192, 4183), (187, 4084), (183, 4128)]
         : compromised: 0.0463, honest: 0.0401
Round 010: test acc mean=0.0041 ± 0.0012 | min=0.0022 max=0.0061
         : test loss mean=6.4228 ± 0.7320
         : individual accs = ['0.004118', '0.003807', '0.003676', '0.005539', '0.002933', '0.003499', '0.005724', '0.002529', '0.004534', '0.004209', '0.002414', '0.003577', '0.003176', '0.004765', '0.005676', '0.002978', '0.002167', '0.004303', '0.006121', '0.005329']
         : correct/total = [(17, 4128), (16, 4203), (15, 4081), (24, 4333), (12, 4091), (15, 4287), (24, 4193), (11, 4349), (19, 4191), (18, 4277), (10, 4143), (15, 4193), (13, 4093), (20, 4197), (23, 4052), (12, 4029), (9, 4153), (18, 4183), (25, 4084), (22, 4128)]
         : compromised: 0.0044, honest: 0.0038

=== FINAL RESULTS ===
Dataset: femnist, Nodes: 20, Graph: erdos, Aggregation: d-fedavg
Attack: backdoor, 40.0% compromised
Final accuracy - Compromised: 0.0044, Honest: 0.0038
Overall test accuracy: mean=0.0041 ± 0.0012

=== BACKDOOR ATTACK SUCCESS RATE (ASR) ===
Target label: 0
Trigger size: 4x4
Overall ASR: 0.0000 ± 0.0000
Honest nodes ASR: 0.0000 ± 0.0000
Compromised nodes ASR: 0.0000 ± 0.0000
Note: Higher ASR indicates more successful backdoor attack
