Device: cuda
Seed: 987654321
Loading 36 LEAF FEMNIST train files...
LEAF FEMNIST train: 3597 users, 734463 samples
Loading 36 LEAF FEMNIST test files...
LEAF FEMNIST test: 3597 users, 83388 samples
Found 3597 train users, 3597 test users, 3597 common users
User sample counts range: 525 (max) to 17 (min)
Distributed ALL 3597 users across 20 clients
Users per client: 179 (with 17 clients getting +1 user)
Train partition sizes: [36360, 37070, 35957, 38262, 36024, 37732, 36921, 38328, 36867, 37683, 36507, 36915, 36007, 37001, 35681, 35453, 36585, 36801, 35964, 36345]
Test partition sizes: [4128, 4203, 4081, 4333, 4091, 4287, 4193, 4349, 4191, 4277, 4143, 4193, 4093, 4197, 4052, 4029, 4153, 4183, 4084, 4128]
  Client 0: 36360 train samples, 62 unique classes
  Client 1: 37070 train samples, 62 unique classes
  Client 2: 35957 train samples, 62 unique classes
  Client 3: 38262 train samples, 62 unique classes
  Client 4: 36024 train samples, 62 unique classes
  Client 5: 37732 train samples, 62 unique classes
  Client 6: 36921 train samples, 62 unique classes
  Client 7: 38328 train samples, 62 unique classes
  Client 8: 36867 train samples, 62 unique classes
  Client 9: 37683 train samples, 62 unique classes
  Client 10: 36507 train samples, 62 unique classes
  Client 11: 36915 train samples, 62 unique classes
  Client 12: 36007 train samples, 62 unique classes
  Client 13: 37001 train samples, 62 unique classes
  Client 14: 35681 train samples, 62 unique classes
  Client 15: 35453 train samples, 62 unique classes
  Client 16: 36585 train samples, 62 unique classes
  Client 17: 36801 train samples, 62 unique classes
  Client 18: 35964 train samples, 62 unique classes
  Client 19: 36345 train samples, 62 unique classes
Will sample 4500 samples per client per epoch
Graph: ring, nodes: 20, edges: 20
Degree statistics: avg=2.00, min=2, max=2
Attack: Compromised 2/20 nodes: [5, 13]
Attack type: backdoor, lambda: 1.0
Backdoor target label: 0, trigger size: 4
Model variant: baseline
Model parameters: 6,603,710
Initial test acc across nodes: mean=0.0168 ± 0.0139
Backdoor attack: Created poisoned datasets for 2 compromised nodes
Round 001: test acc mean=0.0447 ± 0.0159 | min=0.0035 max=0.0583
         : test loss mean=1310.8119 ± 2045.5433
         : individual accs = ['0.051599', '0.051630', '0.055134', '0.047773', '0.006111', '0.003499', '0.049130', '0.053116', '0.054880', '0.048398', '0.055274', '0.049606', '0.049597', '0.026686', '0.022211', '0.056590', '0.058271', '0.053311', '0.050196', '0.050145']
         : correct/total = [(213, 4128), (217, 4203), (225, 4081), (207, 4333), (25, 4091), (15, 4287), (206, 4193), (231, 4349), (230, 4191), (207, 4277), (229, 4143), (208, 4193), (203, 4093), (112, 4197), (90, 4052), (228, 4029), (242, 4153), (223, 4183), (205, 4084), (207, 4128)]
         : compromised: 0.0151, honest: 0.0479
Round 002: test acc mean=0.0461 ± 0.0120 | min=0.0044 max=0.0583
         : test loss mean=1043396.2183 ± 2089259.6065
         : individual accs = ['0.051599', '0.046158', '0.050723', '0.052850', '0.004400', '0.045253', '0.033389', '0.043918', '0.051062', '0.055179', '0.045619', '0.054376', '0.054239', '0.045747', '0.051826', '0.026061', '0.058271', '0.050920', '0.052889', '0.048450']
         : correct/total = [(213, 4128), (194, 4203), (207, 4081), (229, 4333), (18, 4091), (194, 4287), (140, 4193), (191, 4349), (214, 4191), (236, 4277), (189, 4143), (228, 4193), (222, 4093), (192, 4197), (210, 4052), (105, 4029), (242, 4153), (213, 4183), (216, 4084), (200, 4128)]
         : compromised: 0.0455, honest: 0.0462
Round 003: test acc mean=0.0516 ± 0.0091 | min=0.0188 max=0.0657
         : test loss mean=134299.3853 ± 585100.3323
         : individual accs = ['0.059593', '0.050916', '0.065670', '0.047773', '0.052066', '0.057849', '0.018841', '0.043918', '0.051539', '0.047463', '0.047550', '0.053184', '0.052040', '0.062426', '0.051826', '0.056590', '0.054418', '0.050203', '0.052889', '0.055475']
         : correct/total = [(246, 4128), (214, 4203), (268, 4081), (207, 4333), (213, 4091), (248, 4287), (79, 4193), (191, 4349), (216, 4191), (203, 4277), (197, 4143), (223, 4193), (213, 4093), (262, 4197), (210, 4052), (228, 4029), (226, 4153), (210, 4183), (216, 4084), (229, 4128)]
         : compromised: 0.0601, honest: 0.0507
Round 004: test acc mean=0.0520 ± 0.0046 | min=0.0434 max=0.0624
         : test loss mean=316765.4321 ± 1379252.7689
         : individual accs = ['0.059593', '0.047109', '0.050723', '0.043388', '0.051088', '0.057849', '0.050799', '0.051276', '0.051539', '0.047463', '0.047550', '0.054376', '0.053750', '0.062426', '0.051826', '0.050881', '0.058271', '0.048291', '0.052889', '0.048450']
         : correct/total = [(246, 4128), (198, 4203), (207, 4081), (188, 4333), (209, 4091), (248, 4287), (213, 4193), (223, 4349), (216, 4191), (203, 4277), (197, 4143), (228, 4193), (220, 4093), (262, 4197), (210, 4052), (205, 4029), (242, 4153), (202, 4183), (216, 4084), (200, 4128)]
         : compromised: 0.0601, honest: 0.0511
Round 005: test acc mean=0.0502 ± 0.0092 | min=0.0188 max=0.0624
         : test loss mean=24.6044 ± 35.4517
         : individual accs = ['0.049176', '0.051630', '0.057584', '0.038311', '0.051088', '0.048052', '0.018841', '0.058174', '0.042233', '0.047463', '0.051171', '0.046745', '0.052040', '0.062426', '0.061204', '0.051626', '0.058271', '0.050920', '0.052155', '0.055475']
         : correct/total = [(203, 4128), (217, 4203), (235, 4081), (166, 4333), (209, 4091), (206, 4287), (79, 4193), (253, 4349), (177, 4191), (203, 4277), (212, 4143), (196, 4193), (213, 4093), (262, 4197), (248, 4052), (208, 4029), (242, 4153), (213, 4183), (213, 4084), (229, 4128)]
         : compromised: 0.0552, honest: 0.0497
Round 006: test acc mean=0.0531 ± 0.0043 | min=0.0475 max=0.0624
         : test loss mean=23.7632 ± 43.6377
         : individual accs = ['0.051599', '0.051630', '0.057584', '0.052850', '0.051088', '0.057849', '0.053899', '0.049207', '0.047960', '0.047463', '0.048033', '0.054376', '0.049841', '0.062426', '0.061204', '0.050385', '0.058271', '0.050920', '0.055583', '0.050388']
         : correct/total = [(213, 4128), (217, 4203), (235, 4081), (229, 4333), (209, 4091), (248, 4287), (226, 4193), (214, 4349), (201, 4191), (203, 4277), (199, 4143), (228, 4193), (204, 4093), (262, 4197), (248, 4052), (203, 4029), (242, 4153), (213, 4183), (227, 4084), (208, 4128)]
         : compromised: 0.0601, honest: 0.0523
Round 007: test acc mean=0.0515 ± 0.0053 | min=0.0383 max=0.0612
         : test loss mean=12.4600 ± 17.3478
         : individual accs = ['0.051599', '0.051630', '0.057584', '0.038311', '0.051088', '0.048052', '0.057000', '0.051276', '0.051062', '0.047463', '0.051171', '0.041736', '0.053750', '0.047177', '0.061204', '0.050385', '0.058271', '0.050920', '0.055583', '0.055475']
         : correct/total = [(213, 4128), (217, 4203), (235, 4081), (166, 4333), (209, 4091), (206, 4287), (239, 4193), (223, 4349), (214, 4191), (203, 4277), (212, 4143), (175, 4193), (220, 4093), (198, 4197), (248, 4052), (203, 4029), (242, 4153), (213, 4183), (227, 4084), (229, 4128)]
         : compromised: 0.0476, honest: 0.0520
Round 008: test acc mean=0.0508 ± 0.0059 | min=0.0365 max=0.0612
         : test loss mean=9.5212 ± 11.2185
         : individual accs = ['0.051599', '0.052344', '0.057584', '0.036464', '0.051088', '0.048752', '0.053899', '0.049207', '0.047960', '0.053776', '0.048033', '0.041736', '0.053750', '0.046938', '0.061204', '0.041698', '0.058271', '0.050920', '0.055583', '0.055475']
         : correct/total = [(213, 4128), (220, 4203), (235, 4081), (158, 4333), (209, 4091), (209, 4287), (226, 4193), (214, 4349), (201, 4191), (230, 4277), (199, 4143), (175, 4193), (220, 4093), (197, 4197), (248, 4052), (168, 4029), (242, 4153), (213, 4183), (227, 4084), (229, 4128)]
         : compromised: 0.0478, honest: 0.0511
Round 009: test acc mean=0.0527 ± 0.0053 | min=0.0414 max=0.0624
         : test loss mean=8.9370 ± 10.3579
         : individual accs = ['0.051599', '0.052344', '0.057584', '0.048234', '0.051088', '0.048519', '0.057000', '0.041389', '0.051062', '0.053776', '0.051171', '0.041736', '0.053750', '0.062426', '0.061204', '0.050385', '0.058271', '0.050920', '0.055583', '0.055475']
         : correct/total = [(213, 4128), (220, 4203), (235, 4081), (209, 4333), (209, 4091), (208, 4287), (239, 4193), (180, 4349), (214, 4191), (230, 4277), (212, 4143), (175, 4193), (220, 4093), (262, 4197), (248, 4052), (203, 4029), (242, 4153), (213, 4183), (227, 4084), (229, 4128)]
         : compromised: 0.0555, honest: 0.0524
Round 010: test acc mean=0.0527 ± 0.0057 | min=0.0417 max=0.0624
         : test loss mean=8.1784 ± 8.6780
         : individual accs = ['0.059593', '0.052344', '0.057584', '0.046619', '0.051088', '0.048752', '0.053899', '0.049207', '0.047960', '0.053776', '0.055998', '0.041736', '0.049841', '0.062426', '0.061204', '0.041698', '0.058271', '0.050920', '0.055583', '0.055475']
         : correct/total = [(246, 4128), (220, 4203), (235, 4081), (202, 4333), (209, 4091), (209, 4287), (226, 4193), (214, 4349), (201, 4191), (230, 4277), (232, 4143), (175, 4193), (204, 4093), (262, 4197), (248, 4052), (168, 4029), (242, 4153), (213, 4183), (227, 4084), (229, 4128)]
         : compromised: 0.0556, honest: 0.0524

=== FINAL RESULTS ===
Dataset: femnist, Nodes: 20, Graph: ring, Aggregation: d-fedavg
Attack: backdoor, 10.0% compromised
Final accuracy - Compromised: 0.0556, Honest: 0.0524
Overall test accuracy: mean=0.0527 ± 0.0057

=== BACKDOOR ATTACK SUCCESS RATE (ASR) ===
Target label: 0
Trigger size: 4x4
Overall ASR: 0.0000 ± 0.0000
Honest nodes ASR: 0.0000 ± 0.0000
Compromised nodes ASR: 0.0000 ± 0.0000
Note: Higher ASR indicates more successful backdoor attack
