Device: cuda
Seed: 987654321
Loading 36 LEAF FEMNIST train files...
LEAF FEMNIST train: 3597 users, 734463 samples
Loading 36 LEAF FEMNIST test files...
LEAF FEMNIST test: 3597 users, 83388 samples
Found 3597 train users, 3597 test users, 3597 common users
User sample counts range: 525 (max) to 17 (min)
Distributed ALL 3597 users across 20 clients
Users per client: 179 (with 17 clients getting +1 user)
Train partition sizes: [36360, 37070, 35957, 38262, 36024, 37732, 36921, 38328, 36867, 37683, 36507, 36915, 36007, 37001, 35681, 35453, 36585, 36801, 35964, 36345]
Test partition sizes: [4128, 4203, 4081, 4333, 4091, 4287, 4193, 4349, 4191, 4277, 4143, 4193, 4093, 4197, 4052, 4029, 4153, 4183, 4084, 4128]
  Client 0: 36360 train samples, 62 unique classes
  Client 1: 37070 train samples, 62 unique classes
  Client 2: 35957 train samples, 62 unique classes
  Client 3: 38262 train samples, 62 unique classes
  Client 4: 36024 train samples, 62 unique classes
  Client 5: 37732 train samples, 62 unique classes
  Client 6: 36921 train samples, 62 unique classes
  Client 7: 38328 train samples, 62 unique classes
  Client 8: 36867 train samples, 62 unique classes
  Client 9: 37683 train samples, 62 unique classes
  Client 10: 36507 train samples, 62 unique classes
  Client 11: 36915 train samples, 62 unique classes
  Client 12: 36007 train samples, 62 unique classes
  Client 13: 37001 train samples, 62 unique classes
  Client 14: 35681 train samples, 62 unique classes
  Client 15: 35453 train samples, 62 unique classes
  Client 16: 36585 train samples, 62 unique classes
  Client 17: 36801 train samples, 62 unique classes
  Client 18: 35964 train samples, 62 unique classes
  Client 19: 36345 train samples, 62 unique classes
Will sample 4500 samples per client per epoch
Graph: erdos, nodes: 20, edges: 48
Degree statistics: avg=4.80, min=2, max=7
Attack: Compromised 2/20 nodes: [5, 13]
Attack type: directed_deviation, lambda: 1.0
Model variant: baseline
Model parameters: 6,603,710
Initial test acc across nodes: mean=0.0168 ± 0.0139
Round 001: test acc mean=0.0428 ± 0.0190 | min=0.0044 max=0.0727
         : test loss mean=227.9379 ± 374.4668
         : individual accs = ['0.044574', '0.052344', '0.054889', '0.005539', '0.057932', '0.004432', '0.046745', '0.072660', '0.053209', '0.053776', '0.048033', '0.045314', '0.020034', '0.024065', '0.046644', '0.050633', '0.058271', '0.007650', '0.055583', '0.054506']
         : correct/total = [(184, 4128), (220, 4203), (224, 4081), (24, 4333), (237, 4091), (19, 4287), (196, 4193), (316, 4349), (223, 4191), (230, 4277), (199, 4143), (190, 4193), (82, 4093), (101, 4197), (189, 4052), (204, 4029), (242, 4153), (32, 4183), (227, 4084), (225, 4128)]
         : compromised: 0.0142, honest: 0.0460
Round 002: test acc mean=0.0296 ± 0.0227 | min=0.0023 max=0.0570
         : test loss mean=8662.0308 ± 19806.9672
         : individual accs = ['0.044574', '0.046158', '0.050723', '0.003462', '0.048643', '0.003266', '0.057000', '0.002299', '0.053209', '0.047463', '0.045619', '0.004293', '0.003909', '0.014058', '0.003208', '0.003971', '0.055141', '0.004781', '0.050196', '0.050388']
         : correct/total = [(184, 4128), (194, 4203), (207, 4081), (15, 4333), (199, 4091), (14, 4287), (239, 4193), (10, 4349), (223, 4191), (203, 4277), (189, 4143), (18, 4193), (16, 4093), (59, 4197), (13, 4052), (16, 4029), (229, 4153), (20, 4183), (205, 4084), (208, 4128)]
         : compromised: 0.0087, honest: 0.0319
Round 003: test acc mean=0.0421 ± 0.0088 | min=0.0281 max=0.0596
         : test loss mean=50.0138 ± 134.6776
         : individual accs = ['0.059593', '0.034737', '0.050723', '0.040157', '0.051088', '0.038955', '0.057000', '0.041389', '0.042233', '0.039280', '0.036688', '0.028142', '0.033716', '0.028592', '0.048124', '0.032266', '0.040212', '0.037533', '0.052889', '0.048450']
         : correct/total = [(246, 4128), (146, 4203), (207, 4081), (174, 4333), (209, 4091), (167, 4287), (239, 4193), (180, 4349), (177, 4191), (168, 4277), (152, 4143), (118, 4193), (138, 4093), (120, 4197), (195, 4052), (130, 4029), (167, 4153), (157, 4183), (216, 4084), (200, 4128)]
         : compromised: 0.0338, honest: 0.0430
Round 004: test acc mean=0.0387 ± 0.0172 | min=0.0037 max=0.0582
         : test loss mean=1351.0521 ± 5374.8026
         : individual accs = ['0.051599', '0.048775', '0.048272', '0.052850', '0.045710', '0.038955', '0.046745', '0.058174', '0.054880', '0.044891', '0.036688', '0.053899', '0.010017', '0.017632', '0.003702', '0.009432', '0.040212', '0.011953', '0.050930', '0.048450']
         : correct/total = [(213, 4128), (205, 4203), (197, 4081), (229, 4333), (187, 4091), (167, 4287), (196, 4193), (253, 4349), (230, 4191), (192, 4277), (152, 4143), (226, 4193), (41, 4093), (74, 4197), (15, 4052), (38, 4029), (167, 4153), (50, 4183), (208, 4084), (200, 4128)]
         : compromised: 0.0283, honest: 0.0398
Round 005: test acc mean=0.0477 ± 0.0072 | min=0.0281 max=0.0563
         : test loss mean=11.4338 ± 29.7392
         : individual accs = ['0.050145', '0.051630', '0.053418', '0.040157', '0.043021', '0.048052', '0.049130', '0.041389', '0.049630', '0.053075', '0.050447', '0.028142', '0.053750', '0.046938', '0.048124', '0.056342', '0.055141', '0.050203', '0.052889', '0.032219']
         : correct/total = [(207, 4128), (217, 4203), (218, 4081), (174, 4333), (176, 4091), (206, 4287), (206, 4193), (180, 4349), (208, 4191), (227, 4277), (209, 4143), (118, 4193), (220, 4093), (197, 4197), (195, 4052), (227, 4029), (229, 4153), (210, 4183), (216, 4084), (133, 4128)]
         : compromised: 0.0475, honest: 0.0477
Round 006: test acc mean=0.0432 ± 0.0162 | min=0.0025 max=0.0586
         : test loss mean=6.9659 ± 8.1651
         : individual accs = ['0.050145', '0.046158', '0.048272', '0.002539', '0.045710', '0.045253', '0.046745', '0.058174', '0.049630', '0.050503', '0.041999', '0.005008', '0.058637', '0.049083', '0.010612', '0.056590', '0.049362', '0.050920', '0.050930', '0.048450']
         : correct/total = [(207, 4128), (194, 4203), (197, 4081), (11, 4333), (187, 4091), (194, 4287), (196, 4193), (253, 4349), (208, 4191), (216, 4277), (174, 4143), (21, 4193), (240, 4093), (206, 4197), (43, 4052), (228, 4029), (205, 4153), (213, 4183), (208, 4084), (200, 4128)]
         : compromised: 0.0472, honest: 0.0428
Round 007: test acc mean=0.0471 ± 0.0069 | min=0.0281 max=0.0563
         : test loss mean=4.6914 ± 2.0314
         : individual accs = ['0.051599', '0.051630', '0.053418', '0.040157', '0.051088', '0.043387', '0.048414', '0.041389', '0.049630', '0.047229', '0.048033', '0.028142', '0.053750', '0.046462', '0.037759', '0.056342', '0.052011', '0.037533', '0.052889', '0.050872']
         : correct/total = [(213, 4128), (217, 4203), (218, 4081), (174, 4333), (209, 4091), (186, 4287), (203, 4193), (180, 4349), (208, 4191), (202, 4277), (199, 4143), (118, 4193), (220, 4093), (195, 4197), (153, 4052), (227, 4029), (216, 4153), (157, 4183), (216, 4084), (210, 4128)]
         : compromised: 0.0449, honest: 0.0473
Round 008: test acc mean=0.0487 ± 0.0095 | min=0.0129 max=0.0612
         : test loss mean=5.1363 ± 3.1130
         : individual accs = ['0.051599', '0.046158', '0.048272', '0.052850', '0.045710', '0.043387', '0.046745', '0.058174', '0.049630', '0.050503', '0.041999', '0.012879', '0.058637', '0.049083', '0.061204', '0.056590', '0.049362', '0.050920', '0.050930', '0.048450']
         : correct/total = [(213, 4128), (194, 4203), (197, 4081), (229, 4333), (187, 4091), (186, 4287), (196, 4193), (253, 4349), (208, 4191), (216, 4277), (174, 4143), (54, 4193), (240, 4093), (206, 4197), (248, 4052), (228, 4029), (205, 4153), (213, 4183), (208, 4084), (200, 4128)]
         : compromised: 0.0462, honest: 0.0489
Round 009: test acc mean=0.0465 ± 0.0066 | min=0.0281 max=0.0563
         : test loss mean=4.4532 ± 1.6278
         : individual accs = ['0.044574', '0.051630', '0.048272', '0.040157', '0.048643', '0.043387', '0.049130', '0.041389', '0.047960', '0.053075', '0.048033', '0.028142', '0.053750', '0.046462', '0.037759', '0.056342', '0.049362', '0.037533', '0.052889', '0.050872']
         : correct/total = [(184, 4128), (217, 4203), (197, 4081), (174, 4333), (199, 4091), (186, 4287), (206, 4193), (180, 4349), (201, 4191), (227, 4277), (199, 4143), (118, 4193), (220, 4093), (195, 4197), (153, 4052), (227, 4029), (205, 4153), (157, 4183), (216, 4084), (210, 4128)]
         : compromised: 0.0449, honest: 0.0466
Round 010: test acc mean=0.0509 ± 0.0039 | min=0.0457 max=0.0612
         : test loss mean=4.7974 ± 2.5257
         : individual accs = ['0.051599', '0.046158', '0.048272', '0.052850', '0.045710', '0.048519', '0.046745', '0.058174', '0.047960', '0.050503', '0.055998', '0.053899', '0.049841', '0.049559', '0.061204', '0.050881', '0.049362', '0.050920', '0.050930', '0.048450']
         : correct/total = [(213, 4128), (194, 4203), (197, 4081), (229, 4333), (187, 4091), (208, 4287), (196, 4193), (253, 4349), (201, 4191), (216, 4277), (232, 4143), (226, 4193), (204, 4093), (208, 4197), (248, 4052), (205, 4029), (205, 4153), (213, 4183), (208, 4084), (200, 4128)]
         : compromised: 0.0490, honest: 0.0511

=== FINAL RESULTS ===
Dataset: femnist, Nodes: 20, Graph: erdos, Aggregation: d-fedavg
Attack: directed_deviation, 10.0% compromised
Final accuracy - Compromised: 0.0490, Honest: 0.0511
Overall test accuracy: mean=0.0509 ± 0.0039
