Device: cuda
Seed: 987654321
Loading 36 LEAF FEMNIST train files...
LEAF FEMNIST train: 3597 users, 734463 samples
Loading 36 LEAF FEMNIST test files...
LEAF FEMNIST test: 3597 users, 83388 samples
Found 3597 train users, 3597 test users, 3597 common users
User sample counts range: 525 (max) to 17 (min)
Distributed ALL 3597 users across 20 clients
Users per client: 179 (with 17 clients getting +1 user)
Train partition sizes: [36360, 37070, 35957, 38262, 36024, 37732, 36921, 38328, 36867, 37683, 36507, 36915, 36007, 37001, 35681, 35453, 36585, 36801, 35964, 36345]
Test partition sizes: [4128, 4203, 4081, 4333, 4091, 4287, 4193, 4349, 4191, 4277, 4143, 4193, 4093, 4197, 4052, 4029, 4153, 4183, 4084, 4128]
  Client 0: 36360 train samples, 62 unique classes
  Client 1: 37070 train samples, 62 unique classes
  Client 2: 35957 train samples, 62 unique classes
  Client 3: 38262 train samples, 62 unique classes
  Client 4: 36024 train samples, 62 unique classes
  Client 5: 37732 train samples, 62 unique classes
  Client 6: 36921 train samples, 62 unique classes
  Client 7: 38328 train samples, 62 unique classes
  Client 8: 36867 train samples, 62 unique classes
  Client 9: 37683 train samples, 62 unique classes
  Client 10: 36507 train samples, 62 unique classes
  Client 11: 36915 train samples, 62 unique classes
  Client 12: 36007 train samples, 62 unique classes
  Client 13: 37001 train samples, 62 unique classes
  Client 14: 35681 train samples, 62 unique classes
  Client 15: 35453 train samples, 62 unique classes
  Client 16: 36585 train samples, 62 unique classes
  Client 17: 36801 train samples, 62 unique classes
  Client 18: 35964 train samples, 62 unique classes
  Client 19: 36345 train samples, 62 unique classes
Will sample 4500 samples per client per epoch
Graph: ring, nodes: 20, edges: 20
Degree statistics: avg=2.00, min=2, max=2
Attack: Compromised 16/20 nodes: [1, 2, 3, 5, 6, 8, 9, 10, 11, 12, 13, 14, 15, 17, 18, 19]
Attack type: krum, lambda: 1.0
Model variant: baseline
Model parameters: 6,603,710
UBAR ALGORITHM (Two-Stage Byzantine-resilient)
  - Model dimension: 6,603,710 parameters
  - Rho parameter: 0.19999999999999996
  - Stage 1: Distance-based filtering (select 20% closest neighbors)
  - Stage 2: Performance-based selection (loss comparison)
  - Complexity: O(deg(i)×d + deg(i)×inference)
Initial test acc across nodes: mean=0.0168 ± 0.0139
Round 001: test acc mean=0.0324 ± 0.0195 | min=0.0032 max=0.0578
         : test loss mean=12455.2829 ± 11712.3245
         : individual accs = ['0.011628', '0.052344', '0.013967', '0.043157', '0.052554', '0.057849', '0.044598', '0.057025', '0.047960', '0.013795', '0.010138', '0.014071', '0.006108', '0.035978', '0.003208', '0.050385', '0.014929', '0.050920', '0.017630', '0.050145']
         : correct/total = [(48, 4128), (220, 4203), (57, 4081), (187, 4333), (215, 4091), (248, 4287), (187, 4193), (248, 4349), (201, 4191), (59, 4277), (42, 4143), (59, 4193), (25, 4093), (151, 4197), (13, 4052), (203, 4029), (62, 4153), (213, 4183), (72, 4084), (207, 4128)]
         : compromised: 0.0320, honest: 0.0340
         : ubar stats = ['Node 0: s1=0.500, s2=1.000', 'Node 1: s1=0.500, s2=1.000', 'Node 2: s1=0.500, s2=1.000']...
Round 002: test acc mean=0.0517 ± 0.0043 | min=0.0451 max=0.0596
         : test loss mean=92563645.3266 ± 96535171.5343
         : individual accs = ['0.059593', '0.048775', '0.057584', '0.052850', '0.057932', '0.050618', '0.046745', '0.045068', '0.054880', '0.047229', '0.055998', '0.046745', '0.048620', '0.049083', '0.051579', '0.056590', '0.047195', '0.048291', '0.054358', '0.054506']
         : correct/total = [(246, 4128), (205, 4203), (235, 4081), (229, 4333), (237, 4091), (217, 4287), (196, 4193), (196, 4349), (230, 4191), (202, 4277), (232, 4143), (196, 4193), (199, 4093), (206, 4197), (209, 4052), (228, 4029), (196, 4153), (202, 4183), (222, 4084), (225, 4128)]
         : compromised: 0.0515, honest: 0.0524
         : ubar stats = ['Node 0: s1=0.500, s2=1.000', 'Node 1: s1=0.500, s2=1.000', 'Node 2: s1=0.500, s2=1.000']...
Round 003: test acc mean=0.0493 ± 0.0054 | min=0.0378 max=0.0624
         : test loss mean=199875251.0715 ± 446411242.6387
         : individual accs = ['0.050145', '0.048775', '0.055134', '0.048465', '0.051088', '0.048052', '0.044598', '0.049207', '0.042233', '0.039280', '0.048033', '0.049606', '0.053750', '0.062426', '0.037759', '0.051378', '0.049362', '0.051159', '0.051665', '0.054506']
         : correct/total = [(207, 4128), (205, 4203), (225, 4081), (210, 4333), (209, 4091), (206, 4287), (187, 4193), (214, 4349), (177, 4191), (168, 4277), (199, 4143), (208, 4193), (220, 4093), (262, 4197), (153, 4052), (207, 4029), (205, 4153), (214, 4183), (211, 4084), (225, 4128)]
         : compromised: 0.0492, honest: 0.0500
         : ubar stats = ['Node 0: s1=0.500, s2=1.000', 'Node 1: s1=0.500, s2=1.000', 'Node 2: s1=0.500, s2=1.000']...
Round 004: test acc mean=0.0498 ± 0.0038 | min=0.0408 max=0.0549
         : test loss mean=309442263.2314 ± 729865028.2000
         : individual accs = ['0.050145', '0.048775', '0.053418', '0.046619', '0.052554', '0.045953', '0.044598', '0.049207', '0.040802', '0.043488', '0.048033', '0.049606', '0.054239', '0.049559', '0.051826', '0.054852', '0.052011', '0.053311', '0.051665', '0.054506']
         : correct/total = [(207, 4128), (205, 4203), (218, 4081), (202, 4333), (215, 4091), (197, 4287), (187, 4193), (214, 4349), (171, 4191), (186, 4277), (199, 4143), (208, 4193), (222, 4093), (208, 4197), (210, 4052), (221, 4029), (216, 4153), (223, 4183), (211, 4084), (225, 4128)]
         : compromised: 0.0495, honest: 0.0510
         : ubar stats = ['Node 0: s1=0.500, s2=1.000', 'Node 1: s1=0.500, s2=1.000', 'Node 2: s1=0.500, s2=1.000']...
Round 005: test acc mean=0.0473 ± 0.0085 | min=0.0147 max=0.0555
         : test loss mean=19348974.8200 ± 82104426.8788
         : individual accs = ['0.050145', '0.052344', '0.053418', '0.046619', '0.052554', '0.014696', '0.044598', '0.049207', '0.040802', '0.043488', '0.048033', '0.046983', '0.054239', '0.049559', '0.051826', '0.041698', '0.052011', '0.045900', '0.051665', '0.055475']
         : correct/total = [(207, 4128), (220, 4203), (218, 4081), (202, 4333), (215, 4091), (63, 4287), (187, 4193), (214, 4349), (171, 4191), (186, 4277), (199, 4143), (197, 4193), (222, 4093), (208, 4197), (210, 4052), (168, 4029), (216, 4153), (192, 4183), (211, 4084), (229, 4128)]
         : compromised: 0.0463, honest: 0.0510
         : ubar stats = ['Node 0: s1=0.500, s2=1.000', 'Node 1: s1=0.500, s2=1.000', 'Node 2: s1=0.500, s2=1.000']...
Round 006: test acc mean=0.0475 ± 0.0040 | min=0.0416 max=0.0542
         : test loss mean=10161.9126 ± 42994.6945
         : individual accs = ['0.050145', '0.052344', '0.053418', '0.043157', '0.043021', '0.045253', '0.044598', '0.041619', '0.042233', '0.046528', '0.048033', '0.041736', '0.054239', '0.049559', '0.051826', '0.050633', '0.052011', '0.048291', '0.045788', '0.045058']
         : correct/total = [(207, 4128), (220, 4203), (218, 4081), (187, 4333), (176, 4091), (194, 4287), (187, 4193), (181, 4349), (177, 4191), (199, 4277), (199, 4143), (175, 4193), (222, 4093), (208, 4197), (210, 4052), (204, 4029), (216, 4153), (202, 4183), (187, 4084), (186, 4128)]
         : compromised: 0.0477, honest: 0.0467
         : ubar stats = ['Node 0: s1=0.500, s2=1.000', 'Node 1: s1=0.500, s2=1.000', 'Node 2: s1=0.500, s2=1.000']...
Round 007: test acc mean=0.0467 ± 0.0038 | min=0.0407 max=0.0525
         : test loss mean=6052.6821 ± 26159.7332
         : individual accs = ['0.045785', '0.048775', '0.048272', '0.043157', '0.043266', '0.052484', '0.042213', '0.041619', '0.042233', '0.050503', '0.051171', '0.041736', '0.050818', '0.049559', '0.046644', '0.051626', '0.040693', '0.049486', '0.045788', '0.048692']
         : correct/total = [(189, 4128), (205, 4203), (197, 4081), (187, 4333), (177, 4091), (225, 4287), (177, 4193), (181, 4349), (177, 4191), (216, 4277), (212, 4143), (175, 4193), (208, 4093), (208, 4197), (189, 4052), (208, 4029), (169, 4153), (207, 4183), (187, 4084), (201, 4128)]
         : compromised: 0.0477, honest: 0.0428
         : ubar stats = ['Node 0: s1=0.500, s2=1.000', 'Node 1: s1=0.500, s2=1.000', 'Node 2: s1=0.500, s2=1.000']...
Round 008: test acc mean=0.0487 ± 0.0042 | min=0.0417 max=0.0563
         : test loss mean=9.4398 ± 13.1187
         : individual accs = ['0.049661', '0.048775', '0.054889', '0.043388', '0.043266', '0.048052', '0.044598', '0.053116', '0.042233', '0.047463', '0.047550', '0.041736', '0.052040', '0.055278', '0.045656', '0.056342', '0.051047', '0.050203', '0.050196', '0.048692']
         : correct/total = [(205, 4128), (205, 4203), (224, 4081), (188, 4333), (177, 4091), (206, 4287), (187, 4193), (231, 4349), (177, 4191), (203, 4277), (197, 4143), (175, 4193), (213, 4093), (232, 4197), (185, 4052), (227, 4029), (212, 4153), (210, 4183), (205, 4084), (201, 4128)]
         : compromised: 0.0486, honest: 0.0493
         : ubar stats = ['Node 0: s1=0.500, s2=1.000', 'Node 1: s1=0.500, s2=1.000', 'Node 2: s1=0.500, s2=1.000']...
Round 009: test acc mean=0.0480 ± 0.0037 | min=0.0416 max=0.0549
         : test loss mean=5.3627 ± 1.1121
         : individual accs = ['0.045785', '0.051630', '0.054889', '0.044773', '0.052066', '0.048752', '0.048891', '0.041619', '0.044619', '0.044891', '0.047550', '0.041736', '0.052040', '0.049559', '0.046644', '0.053860', '0.051047', '0.045900', '0.045788', '0.048450']
         : correct/total = [(189, 4128), (217, 4203), (224, 4081), (194, 4333), (213, 4091), (209, 4287), (205, 4193), (181, 4349), (187, 4191), (192, 4277), (197, 4143), (175, 4193), (213, 4093), (208, 4197), (189, 4052), (217, 4029), (212, 4153), (192, 4183), (187, 4084), (200, 4128)]
         : compromised: 0.0481, honest: 0.0476
         : ubar stats = ['Node 0: s1=0.500, s2=1.000', 'Node 1: s1=0.500, s2=1.000', 'Node 2: s1=0.500, s2=1.000']...
Round 010: test acc mean=0.0474 ± 0.0037 | min=0.0407 max=0.0563
         : test loss mean=4.1799 ± 0.1697
         : individual accs = ['0.045785', '0.048775', '0.048763', '0.048465', '0.043266', '0.048052', '0.049130', '0.041619', '0.047960', '0.044891', '0.051171', '0.041736', '0.050818', '0.049559', '0.046644', '0.056342', '0.040693', '0.050203', '0.045788', '0.048692']
         : correct/total = [(189, 4128), (205, 4203), (199, 4081), (210, 4333), (177, 4091), (206, 4287), (206, 4193), (181, 4349), (201, 4191), (192, 4277), (212, 4143), (175, 4193), (208, 4093), (208, 4197), (189, 4052), (227, 4029), (169, 4153), (210, 4183), (187, 4084), (201, 4128)]
         : compromised: 0.0486, honest: 0.0428
         : ubar stats = ['Node 0: s1=0.500, s2=1.000', 'Node 1: s1=0.500, s2=1.000', 'Node 2: s1=0.500, s2=1.000']...

=== FINAL RESULTS ===
Dataset: femnist, Nodes: 20, Graph: ring, Aggregation: ubar
Attack: krum, 80.0% compromised
Final accuracy - Compromised: 0.0486, Honest: 0.0428
Overall test accuracy: mean=0.0474 ± 0.0037

=== UBAR SUMMARY ===
Node 0: stage1=0.500, stage2=1.000, overall=0.500
Node 1: stage1=0.500, stage2=1.000, overall=0.500
Node 2: stage1=0.500, stage2=1.000, overall=0.500
Node 3: stage1=0.500, stage2=1.000, overall=0.500
Node 4: stage1=0.500, stage2=1.000, overall=0.500
Node 5: stage1=0.500, stage2=1.000, overall=0.500
Node 6: stage1=0.500, stage2=1.000, overall=0.500
Node 7: stage1=0.500, stage2=1.000, overall=0.500
Node 8: stage1=0.500, stage2=1.000, overall=0.500
Node 9: stage1=0.500, stage2=1.000, overall=0.500
Node 10: stage1=0.500, stage2=1.000, overall=0.500
Node 11: stage1=0.500, stage2=1.000, overall=0.500
Node 12: stage1=0.500, stage2=1.000, overall=0.500
Node 13: stage1=0.500, stage2=1.000, overall=0.500
Node 14: stage1=0.500, stage2=1.000, overall=0.500
Node 15: stage1=0.500, stage2=1.000, overall=0.500
Node 16: stage1=0.500, stage2=1.000, overall=0.500
Node 17: stage1=0.500, stage2=1.000, overall=0.500
Node 18: stage1=0.500, stage2=1.000, overall=0.500
Node 19: stage1=0.500, stage2=1.000, overall=0.500

=== PARALLEL EXECUTION TIME (realistic for distributed system) ===
  COMMUNICATION (max across nodes):
    - Full model transfer: 0.000s (0.0%)
  COMPUTATION (max across nodes):
    - Distance computation: 0.033s (0.8%)
    - Loss computation: 4.060s (99.1%)
    - Aggregation: 0.006s (0.2%)
  TOTALS:
    - Total computation: 4.099s (100.0%)
    - Total communication: 0.000s (0.0%)
    - Total parallel time: 4.099s

=== PER-NODE AVERAGE TIME ===
  - Distance computation: 0.023s
  - Loss computation: 3.833s
  - Aggregation: 0.005s
  - Model transfer: 0.000s
  - Total per node: 3.861s

=== TOTAL COMPUTATIONAL WORK (sum across all nodes) ===
  - Total distance computation: 0.466s
  - Total loss computation: 76.656s
  - Total aggregation: 0.091s
  - Total model transfer: 0.000s
  - Grand total: 77.213s
  - Mean Stage 1 acceptance rate: 0.500
  - Mean Stage 2 acceptance rate: 1.000
  - Overall acceptance rate: 0.500

UBAR Algorithm Properties:
  - Model dimension: 6,603,710
  - Rho parameter: 0.19999999999999996
  - Two-stage approach: Distance filtering + loss evaluation
  - Stage 1 selects: 20% of neighbors
  - Stage 2 uses: Training sample loss comparison
  - Theoretical complexity: O(deg(i)×d + deg(i)×inference)
  - Approach: UBAR paper implementation
