Device: cuda
Seed: 987654321
Loading 36 LEAF FEMNIST train files...
LEAF FEMNIST train: 3597 users, 734463 samples
Loading 36 LEAF FEMNIST test files...
LEAF FEMNIST test: 3597 users, 83388 samples
Found 3597 train users, 3597 test users, 3597 common users
User sample counts range: 525 (max) to 17 (min)
Distributed ALL 3597 users across 20 clients
Users per client: 179 (with 17 clients getting +1 user)
Train partition sizes: [36360, 37070, 35957, 38262, 36024, 37732, 36921, 38328, 36867, 37683, 36507, 36915, 36007, 37001, 35681, 35453, 36585, 36801, 35964, 36345]
Test partition sizes: [4128, 4203, 4081, 4333, 4091, 4287, 4193, 4349, 4191, 4277, 4143, 4193, 4093, 4197, 4052, 4029, 4153, 4183, 4084, 4128]
  Client 0: 36360 train samples, 62 unique classes
  Client 1: 37070 train samples, 62 unique classes
  Client 2: 35957 train samples, 62 unique classes
  Client 3: 38262 train samples, 62 unique classes
  Client 4: 36024 train samples, 62 unique classes
  Client 5: 37732 train samples, 62 unique classes
  Client 6: 36921 train samples, 62 unique classes
  Client 7: 38328 train samples, 62 unique classes
  Client 8: 36867 train samples, 62 unique classes
  Client 9: 37683 train samples, 62 unique classes
  Client 10: 36507 train samples, 62 unique classes
  Client 11: 36915 train samples, 62 unique classes
  Client 12: 36007 train samples, 62 unique classes
  Client 13: 37001 train samples, 62 unique classes
  Client 14: 35681 train samples, 62 unique classes
  Client 15: 35453 train samples, 62 unique classes
  Client 16: 36585 train samples, 62 unique classes
  Client 17: 36801 train samples, 62 unique classes
  Client 18: 35964 train samples, 62 unique classes
  Client 19: 36345 train samples, 62 unique classes
Will sample 4500 samples per client per epoch
Graph: erdos, nodes: 20, edges: 126
Degree statistics: avg=12.60, min=8, max=16
Attack: Compromised 8/20 nodes: [1, 5, 11, 12, 13, 14, 17, 18]
Attack type: directed_deviation, lambda: 1.0
Model variant: baseline
Model parameters: 6,603,710
Initial test acc across nodes: mean=0.0168 ± 0.0139
Round 001: test acc mean=0.0488 ± 0.0142 | min=0.0072 max=0.0757
         : test loss mean=21644.7935 ± 90538.9476
         : individual accs = ['0.051599', '0.052344', '0.057584', '0.048465', '0.057932', '0.018428', '0.049130', '0.051276', '0.053209', '0.053776', '0.034033', '0.049606', '0.053750', '0.046462', '0.051826', '0.075701', '0.058271', '0.007172', '0.050930', '0.055475']
         : correct/total = [(213, 4128), (220, 4203), (235, 4081), (210, 4333), (237, 4091), (79, 4287), (206, 4193), (223, 4349), (223, 4191), (230, 4277), (141, 4143), (208, 4193), (220, 4093), (195, 4197), (210, 4052), (305, 4029), (242, 4153), (30, 4183), (208, 4084), (229, 4128)]
         : compromised: 0.0413, honest: 0.0539
Round 002: test acc mean=0.0442 ± 0.0173 | min=0.0031 max=0.0586
         : test loss mean=253570951.6047 ± 1082445760.0897
         : individual accs = ['0.050145', '0.047109', '0.055134', '0.052850', '0.044977', '0.005598', '0.044598', '0.058174', '0.051539', '0.047463', '0.003621', '0.053899', '0.058637', '0.045747', '0.051579', '0.054852', '0.054418', '0.003108', '0.052155', '0.048450']
         : correct/total = [(207, 4128), (198, 4203), (225, 4081), (229, 4333), (184, 4091), (24, 4287), (187, 4193), (253, 4349), (216, 4191), (203, 4277), (15, 4143), (226, 4193), (240, 4093), (192, 4197), (209, 4052), (221, 4029), (226, 4153), (13, 4183), (213, 4084), (200, 4128)]
         : compromised: 0.0397, honest: 0.0472
Round 003: test acc mean=0.0579 ± 0.0076 | min=0.0434 max=0.0752
         : test loss mean=1586530558.8146 ± 6618263410.5601
         : individual accs = ['0.067103', '0.052344', '0.057584', '0.043388', '0.065021', '0.052484', '0.062247', '0.051276', '0.059174', '0.053776', '0.045619', '0.060816', '0.062301', '0.062426', '0.065893', '0.075205', '0.055141', '0.048291', '0.055828', '0.061289']
         : correct/total = [(277, 4128), (220, 4203), (235, 4081), (188, 4333), (266, 4091), (225, 4287), (261, 4193), (223, 4349), (248, 4191), (230, 4277), (189, 4143), (255, 4193), (255, 4093), (262, 4197), (267, 4052), (303, 4029), (229, 4153), (202, 4183), (228, 4084), (253, 4128)]
         : compromised: 0.0575, honest: 0.0581
Round 004: test acc mean=0.0661 ± 0.0248 | min=0.0451 max=0.1261
         : test loss mean=25150518.4060 ± 49425960.6246
         : individual accs = ['0.060078', '0.054485', '0.103896', '0.084468', '0.121731', '0.045253', '0.050799', '0.045068', '0.053925', '0.095394', '0.048033', '0.049606', '0.057659', '0.049797', '0.053060', '0.126086', '0.058993', '0.049486', '0.058031', '0.056202']
         : correct/total = [(248, 4128), (229, 4203), (424, 4081), (366, 4333), (498, 4091), (194, 4287), (213, 4193), (196, 4349), (226, 4191), (408, 4277), (199, 4143), (208, 4193), (236, 4093), (209, 4197), (215, 4052), (508, 4029), (245, 4153), (207, 4183), (237, 4084), (232, 4128)]
         : compromised: 0.0522, honest: 0.0754
Round 005: test acc mean=0.0830 ± 0.0408 | min=0.0402 max=0.1601
         : test loss mean=29706607.0488 ± 49580989.2087
         : individual accs = ['0.070979', '0.110159', '0.125704', '0.040157', '0.068687', '0.045253', '0.050799', '0.045068', '0.144118', '0.065233', '0.050447', '0.049606', '0.157586', '0.160114', '0.078973', '0.070737', '0.150975', '0.050203', '0.070519', '0.054506']
         : correct/total = [(293, 4128), (463, 4203), (513, 4081), (174, 4333), (281, 4091), (194, 4287), (213, 4193), (196, 4349), (604, 4191), (279, 4277), (209, 4143), (208, 4193), (645, 4093), (672, 4197), (320, 4052), (285, 4029), (627, 4153), (210, 4183), (288, 4084), (225, 4128)]
         : compromised: 0.0903, honest: 0.0781
Round 006: test acc mean=0.0717 ± 0.0457 | min=0.0364 max=0.1907
         : test loss mean=7825458953985043456.0000 ± 13663855314140958720.0000
         : individual accs = ['0.046027', '0.049013', '0.175202', '0.038311', '0.117575', '0.052484', '0.044598', '0.049207', '0.051062', '0.116203', '0.045619', '0.046983', '0.036404', '0.047653', '0.051579', '0.129064', '0.190706', '0.048291', '0.052889', '0.045058']
         : correct/total = [(190, 4128), (206, 4203), (715, 4081), (166, 4333), (481, 4091), (225, 4287), (187, 4193), (214, 4349), (214, 4191), (497, 4277), (189, 4143), (197, 4193), (149, 4093), (200, 4197), (209, 4052), (520, 4029), (792, 4153), (202, 4183), (216, 4084), (186, 4128)]
         : compromised: 0.0482, honest: 0.0874
Round 007: test acc mean=0.1368 ± 0.1028 | min=0.0434 max=0.2953
         : test loss mean=213196362.5735 ± 486848155.5384
         : individual accs = ['0.295300', '0.289079', '0.227885', '0.043388', '0.152286', '0.052484', '0.050799', '0.058174', '0.051062', '0.177227', '0.055274', '0.046983', '0.291229', '0.289969', '0.051826', '0.050633', '0.154587', '0.053311', '0.293830', '0.050872']
         : correct/total = [(1219, 4128), (1215, 4203), (930, 4081), (188, 4333), (623, 4091), (225, 4287), (213, 4193), (253, 4349), (214, 4191), (758, 4277), (229, 4143), (197, 4193), (1192, 4093), (1217, 4197), (210, 4052), (204, 4029), (642, 4153), (223, 4183), (1200, 4084), (210, 4128)]
         : compromised: 0.1711, honest: 0.1140
Round 008: test acc mean=0.0789 ± 0.0773 | min=0.0182 max=0.2497
         : test loss mean=229116952.5779 ± 625864736.3865
         : individual accs = ['0.242975', '0.022603', '0.249694', '0.018232', '0.204351', '0.052484', '0.044598', '0.049207', '0.053209', '0.025251', '0.055998', '0.046983', '0.053750', '0.026686', '0.051826', '0.024820', '0.225379', '0.048291', '0.025220', '0.055475']
         : correct/total = [(1003, 4128), (95, 4203), (1019, 4081), (79, 4333), (836, 4091), (225, 4287), (187, 4193), (214, 4349), (223, 4191), (108, 4277), (232, 4143), (197, 4193), (220, 4093), (112, 4197), (210, 4052), (100, 4029), (936, 4153), (202, 4183), (103, 4084), (229, 4128)]
         : compromised: 0.0410, honest: 0.1041
Round 009: test acc mean=0.1003 ± 0.1039 | min=0.0367 max=0.3305
         : test loss mean=2020916219.4177 ± 4124464202.9252
         : individual accs = ['0.294816', '0.049726', '0.298456', '0.048465', '0.330482', '0.047352', '0.044598', '0.049207', '0.053209', '0.036708', '0.050447', '0.046983', '0.050818', '0.046938', '0.051826', '0.056342', '0.306285', '0.048291', '0.045788', '0.048450']
         : correct/total = [(1217, 4128), (209, 4203), (1218, 4081), (210, 4333), (1352, 4091), (203, 4287), (187, 4193), (214, 4349), (223, 4191), (157, 4277), (209, 4143), (197, 4193), (208, 4093), (197, 4197), (210, 4052), (227, 4029), (1272, 4153), (202, 4183), (187, 4084), (200, 4128)]
         : compromised: 0.0485, honest: 0.1348
Round 010: test acc mean=0.0928 ± 0.1091 | min=0.0045 max=0.3648
         : test loss mean=4596673547.1635 ± 9426760130.4878
         : individual accs = ['0.356347', '0.049726', '0.052683', '0.048465', '0.332437', '0.052484', '0.048414', '0.051276', '0.004534', '0.053075', '0.045619', '0.046983', '0.050574', '0.047177', '0.051826', '0.056342', '0.364797', '0.048291', '0.051665', '0.043847']
         : correct/total = [(1471, 4128), (209, 4203), (215, 4081), (210, 4333), (1360, 4091), (225, 4287), (203, 4193), (223, 4349), (19, 4191), (227, 4277), (189, 4143), (197, 4193), (207, 4093), (198, 4197), (210, 4052), (227, 4029), (1515, 4153), (202, 4183), (211, 4084), (181, 4128)]
         : compromised: 0.0498, honest: 0.1215

=== FINAL RESULTS ===
Dataset: femnist, Nodes: 20, Graph: erdos, Aggregation: krum
Attack: directed_deviation, 40.0% compromised
Final accuracy - Compromised: 0.0498, Honest: 0.1215
Overall test accuracy: mean=0.0928 ± 0.1091
