Device: cuda
Seed: 987654321
Loading 36 LEAF FEMNIST train files...
LEAF FEMNIST train: 3597 users, 734463 samples
Loading 36 LEAF FEMNIST test files...
LEAF FEMNIST test: 3597 users, 83388 samples
Found 3597 train users, 3597 test users, 3597 common users
User sample counts range: 525 (max) to 17 (min)
Distributed ALL 3597 users across 20 clients
Users per client: 179 (with 17 clients getting +1 user)
Train partition sizes: [36360, 37070, 35957, 38262, 36024, 37732, 36921, 38328, 36867, 37683, 36507, 36915, 36007, 37001, 35681, 35453, 36585, 36801, 35964, 36345]
Test partition sizes: [4128, 4203, 4081, 4333, 4091, 4287, 4193, 4349, 4191, 4277, 4143, 4193, 4093, 4197, 4052, 4029, 4153, 4183, 4084, 4128]
  Client 0: 36360 train samples, 62 unique classes
  Client 1: 37070 train samples, 62 unique classes
  Client 2: 35957 train samples, 62 unique classes
  Client 3: 38262 train samples, 62 unique classes
  Client 4: 36024 train samples, 62 unique classes
  Client 5: 37732 train samples, 62 unique classes
  Client 6: 36921 train samples, 62 unique classes
  Client 7: 38328 train samples, 62 unique classes
  Client 8: 36867 train samples, 62 unique classes
  Client 9: 37683 train samples, 62 unique classes
  Client 10: 36507 train samples, 62 unique classes
  Client 11: 36915 train samples, 62 unique classes
  Client 12: 36007 train samples, 62 unique classes
  Client 13: 37001 train samples, 62 unique classes
  Client 14: 35681 train samples, 62 unique classes
  Client 15: 35453 train samples, 62 unique classes
  Client 16: 36585 train samples, 62 unique classes
  Client 17: 36801 train samples, 62 unique classes
  Client 18: 35964 train samples, 62 unique classes
  Client 19: 36345 train samples, 62 unique classes
Will sample 4500 samples per client per epoch
Graph: ring, nodes: 20, edges: 20
Degree statistics: avg=2.00, min=2, max=2
Attack: Compromised 12/20 nodes: [1, 2, 3, 5, 8, 11, 12, 13, 14, 15, 17, 18]
Attack type: backdoor, lambda: 1.0
Backdoor target label: 0, trigger size: 4
Model variant: baseline
Model parameters: 6,603,710
BALANCE algorithm:
Balance Config: BALANCEConfig(gamma=2, kappa=1, alpha=0.5, min_neighbors=1)
  - Model dimension: 6,603,710 parameters
  - Complexity: O(N×d) = O(20×6,603,710)
Initial test acc across nodes: mean=0.0168 ± 0.0139
Backdoor attack: Created poisoned datasets for 12 compromised nodes
Round 001: test acc mean=0.0457 ± 0.0100 | min=0.0077 max=0.0553
         : test loss mean=34465.6570 ± 35606.3065
         : individual accs = ['0.049661', '0.048775', '0.048272', '0.043157', '0.037155', '0.045253', '0.044598', '0.049207', '0.049630', '0.047463', '0.055274', '0.049606', '0.033960', '0.049083', '0.051826', '0.051626', '0.007705', '0.049486', '0.052889', '0.050145']
         : correct/total = [(205, 4128), (205, 4203), (197, 4081), (187, 4333), (152, 4091), (194, 4287), (187, 4193), (214, 4349), (208, 4191), (203, 4277), (229, 4143), (208, 4193), (139, 4093), (206, 4197), (210, 4052), (208, 4029), (32, 4153), (207, 4183), (216, 4084), (207, 4128)]
         : compromised: 0.0478, honest: 0.0427
Round 002: test acc mean=0.0424 ± 0.0184 | min=0.0016 max=0.0582
         : test loss mean=2214419753.8206 ± 6983351999.9005
         : individual accs = ['0.051599', '0.001665', '0.053418', '0.001616', '0.052554', '0.041288', '0.057000', '0.058174', '0.023383', '0.048398', '0.045619', '0.003100', '0.050574', '0.047177', '0.051826', '0.056590', '0.051288', '0.050920', '0.054358', '0.048450']
         : correct/total = [(213, 4128), (7, 4203), (218, 4081), (7, 4333), (215, 4091), (177, 4287), (239, 4193), (253, 4349), (98, 4191), (207, 4277), (189, 4143), (13, 4193), (207, 4093), (198, 4197), (210, 4052), (228, 4029), (213, 4153), (213, 4183), (222, 4084), (200, 4128)]
         : compromised: 0.0363, honest: 0.0516
Round 003: test acc mean=0.0503 ± 0.0042 | min=0.0430 max=0.0596
         : test loss mean=nan ± nan
         : individual accs = ['0.059593', '0.048775', '0.053418', '0.043157', '0.043021', '0.045253', '0.044598', '0.049207', '0.049630', '0.047463', '0.055274', '0.049606', '0.054239', '0.049083', '0.051826', '0.051626', '0.052011', '0.049486', '0.052889', '0.055475']
         : correct/total = [(246, 4128), (205, 4203), (218, 4081), (187, 4333), (176, 4091), (194, 4287), (187, 4193), (214, 4349), (208, 4191), (203, 4277), (229, 4143), (208, 4193), (222, 4093), (206, 4197), (210, 4052), (208, 4029), (216, 4153), (207, 4183), (216, 4084), (229, 4128)]
         : compromised: 0.0499, honest: 0.0508
Round 004: test acc mean=0.0574 ± 0.0167 | min=0.0430 max=0.0974
         : test loss mean=nan ± nan
         : individual accs = ['0.097384', '0.048775', '0.053418', '0.043157', '0.043021', '0.045253', '0.082518', '0.086917', '0.049630', '0.048398', '0.045619', '0.049606', '0.054239', '0.049083', '0.051826', '0.051626', '0.052011', '0.049486', '0.052889', '0.092539']
         : correct/total = [(402, 4128), (205, 4203), (218, 4081), (187, 4333), (176, 4091), (194, 4287), (346, 4193), (378, 4349), (208, 4191), (207, 4277), (189, 4143), (208, 4193), (222, 4093), (206, 4197), (210, 4052), (208, 4029), (216, 4153), (207, 4183), (216, 4084), (382, 4128)]
         : compromised: 0.0499, honest: 0.0686
Round 005: test acc mean=0.0535 ± 0.0114 | min=0.0430 max=0.0899
         : test loss mean=nan ± nan
         : individual accs = ['0.089874', '0.048775', '0.053418', '0.043157', '0.043021', '0.045253', '0.046745', '0.047827', '0.049630', '0.053776', '0.055998', '0.049606', '0.054239', '0.049083', '0.051826', '0.051626', '0.052011', '0.049486', '0.052889', '0.081638']
         : correct/total = [(371, 4128), (205, 4203), (218, 4081), (187, 4333), (176, 4091), (194, 4287), (196, 4193), (208, 4349), (208, 4191), (230, 4277), (232, 4143), (208, 4193), (222, 4093), (206, 4197), (210, 4052), (208, 4029), (216, 4153), (207, 4183), (216, 4084), (337, 4128)]
         : compromised: 0.0499, honest: 0.0589
Round 006: test acc mean=0.0559 ± 0.0137 | min=0.0430 max=0.0910
         : test loss mean=nan ± nan
         : individual accs = ['0.077035', '0.048775', '0.053418', '0.043157', '0.043021', '0.045253', '0.043883', '0.053346', '0.049630', '0.090952', '0.086894', '0.049606', '0.054239', '0.049083', '0.051826', '0.051626', '0.052011', '0.049486', '0.052889', '0.071221']
         : correct/total = [(318, 4128), (205, 4203), (218, 4081), (187, 4333), (176, 4091), (194, 4287), (184, 4193), (232, 4349), (208, 4191), (389, 4277), (360, 4143), (208, 4193), (222, 4093), (206, 4197), (210, 4052), (208, 4029), (216, 4153), (207, 4183), (216, 4084), (294, 4128)]
         : compromised: 0.0499, honest: 0.0648
Round 007: test acc mean=0.0642 ± 0.0284 | min=0.0430 max=0.1410
         : test loss mean=nan ± nan
         : individual accs = ['0.140988', '0.048775', '0.053418', '0.043157', '0.043021', '0.045253', '0.097544', '0.092205', '0.049630', '0.060556', '0.063239', '0.049606', '0.054239', '0.049083', '0.051826', '0.051626', '0.052011', '0.049486', '0.052889', '0.136386']
         : correct/total = [(582, 4128), (205, 4203), (218, 4081), (187, 4333), (176, 4091), (194, 4287), (409, 4193), (401, 4349), (208, 4191), (259, 4277), (262, 4143), (208, 4193), (222, 4093), (206, 4197), (210, 4052), (208, 4029), (216, 4153), (207, 4183), (216, 4084), (563, 4128)]
         : compromised: 0.0499, honest: 0.0857
Round 008: test acc mean=0.0617 ± 0.0288 | min=0.0430 max=0.1514
         : test loss mean=nan ± nan
         : individual accs = ['0.151405', '0.048775', '0.053418', '0.043157', '0.043021', '0.045253', '0.049130', '0.051276', '0.049630', '0.073884', '0.077963', '0.049606', '0.054239', '0.049083', '0.051826', '0.051626', '0.052011', '0.049486', '0.052889', '0.137112']
         : correct/total = [(625, 4128), (205, 4203), (218, 4081), (187, 4333), (176, 4091), (194, 4287), (206, 4193), (223, 4349), (208, 4191), (316, 4277), (323, 4143), (208, 4193), (222, 4093), (206, 4197), (210, 4052), (208, 4029), (216, 4153), (207, 4183), (216, 4084), (566, 4128)]
         : compromised: 0.0499, honest: 0.0795
Round 009: test acc mean=0.0528 ± 0.0064 | min=0.0430 max=0.0708
         : test loss mean=nan ± nan
         : individual accs = ['0.061773', '0.048775', '0.053418', '0.043157', '0.043021', '0.045253', '0.070832', '0.059784', '0.049630', '0.057751', '0.056481', '0.049606', '0.054239', '0.049083', '0.051826', '0.051626', '0.052011', '0.049486', '0.052889', '0.055717']
         : correct/total = [(255, 4128), (205, 4203), (218, 4081), (187, 4333), (176, 4091), (194, 4287), (297, 4193), (260, 4349), (208, 4191), (247, 4277), (234, 4143), (208, 4193), (222, 4093), (206, 4197), (210, 4052), (208, 4029), (216, 4153), (207, 4183), (216, 4084), (230, 4128)]
         : compromised: 0.0499, honest: 0.0572
Round 010: test acc mean=0.0558 ± 0.0152 | min=0.0430 max=0.1042
         : test loss mean=nan ± nan
         : individual accs = ['0.104167', '0.048775', '0.053418', '0.043157', '0.043021', '0.045253', '0.055092', '0.058634', '0.049630', '0.053776', '0.055998', '0.049606', '0.054239', '0.049083', '0.051826', '0.051626', '0.052011', '0.049486', '0.052889', '0.095203']
         : correct/total = [(430, 4128), (205, 4203), (218, 4081), (187, 4333), (176, 4091), (194, 4287), (231, 4193), (255, 4349), (208, 4191), (230, 4277), (232, 4143), (208, 4193), (222, 4093), (206, 4197), (210, 4052), (208, 4029), (216, 4153), (207, 4183), (216, 4084), (393, 4128)]
         : compromised: 0.0499, honest: 0.0647

=== FINAL RESULTS ===
Dataset: femnist, Nodes: 20, Graph: ring, Aggregation: balance
Attack: backdoor, 60.0% compromised
Final accuracy - Compromised: 0.0499, Honest: 0.0647
Overall test accuracy: mean=0.0558 ± 0.0152

=== BACKDOOR ATTACK SUCCESS RATE (ASR) ===
Target label: 0
Trigger size: 4x4
Overall ASR: 0.7000 ± 0.4583
Honest nodes ASR: 0.2500 ± 0.4330
Compromised nodes ASR: 1.0000 ± 0.0000
Note: Higher ASR indicates more successful backdoor attack

=== BALANCE SUMMARY ===
Node 0: acceptance=0.500
Node 1: acceptance=0.250
Node 2: acceptance=0.200
Node 3: acceptance=0.250
Node 4: acceptance=0.100
Node 5: acceptance=0.300
Node 6: acceptance=0.500
Node 7: acceptance=0.500
Node 8: acceptance=0.300
Node 9: acceptance=0.500
Node 10: acceptance=0.500
Node 11: acceptance=0.250
Node 12: acceptance=0.100
Node 13: acceptance=0.100
Node 14: acceptance=0.100
Node 15: acceptance=0.250
Node 16: acceptance=0.100
Node 17: acceptance=0.250
Node 18: acceptance=0.250
Node 19: acceptance=0.500

=== PARALLEL EXECUTION TIME (realistic for distributed system) ===
  COMMUNICATION (max across nodes):
    - Full model transfer: 0.000s (0.0%)
  COMPUTATION (max across nodes):
    - Filtering: 0.022s (65.4%)
    - Aggregation: 0.011s (34.6%)
  TOTALS:
    - Total computation: 0.033s (100.0%)
    - Total communication: 0.000s (0.0%)
    - Total parallel time: 0.033s

=== PER-NODE AVERAGE TIME ===
  - Filtering: 0.014s
  - Aggregation: 0.003s
  - Model transfer: 0.000s
  - Total per node: 0.018s

=== TOTAL COMPUTATIONAL WORK (sum across all nodes) ===
  - Total filtering: 0.284s
  - Total aggregation: 0.069s
  - Total model transfer: 0.000s
  - Grand total: 0.353s
  - Mean acceptance rate: 0.290

BALANCE Algorithm Properties:
  - Model dimension: 6,603,710
  - No compression: Full parameter comparison
  - Theoretical complexity: O(deg(i)×d)
  - Approach: Full parameter filtering + averaging
