Device: cuda
Seed: 987654321
Loading 36 LEAF FEMNIST train files...
LEAF FEMNIST train: 3597 users, 734463 samples
Loading 36 LEAF FEMNIST test files...
LEAF FEMNIST test: 3597 users, 83388 samples
Found 3597 train users, 3597 test users, 3597 common users
User sample counts range: 525 (max) to 17 (min)
Distributed ALL 3597 users across 20 clients
Users per client: 179 (with 17 clients getting +1 user)
Train partition sizes: [36360, 37070, 35957, 38262, 36024, 37732, 36921, 38328, 36867, 37683, 36507, 36915, 36007, 37001, 35681, 35453, 36585, 36801, 35964, 36345]
Test partition sizes: [4128, 4203, 4081, 4333, 4091, 4287, 4193, 4349, 4191, 4277, 4143, 4193, 4093, 4197, 4052, 4029, 4153, 4183, 4084, 4128]
  Client 0: 36360 train samples, 62 unique classes
  Client 1: 37070 train samples, 62 unique classes
  Client 2: 35957 train samples, 62 unique classes
  Client 3: 38262 train samples, 62 unique classes
  Client 4: 36024 train samples, 62 unique classes
  Client 5: 37732 train samples, 62 unique classes
  Client 6: 36921 train samples, 62 unique classes
  Client 7: 38328 train samples, 62 unique classes
  Client 8: 36867 train samples, 62 unique classes
  Client 9: 37683 train samples, 62 unique classes
  Client 10: 36507 train samples, 62 unique classes
  Client 11: 36915 train samples, 62 unique classes
  Client 12: 36007 train samples, 62 unique classes
  Client 13: 37001 train samples, 62 unique classes
  Client 14: 35681 train samples, 62 unique classes
  Client 15: 35453 train samples, 62 unique classes
  Client 16: 36585 train samples, 62 unique classes
  Client 17: 36801 train samples, 62 unique classes
  Client 18: 35964 train samples, 62 unique classes
  Client 19: 36345 train samples, 62 unique classes
Will sample 4500 samples per client per epoch
Graph: fully, nodes: 20, edges: 190
Degree statistics: avg=19.00, min=19, max=19
Attack: Compromised 6/20 nodes: [5, 12, 13, 14, 17, 18]
Attack type: directed_deviation, lambda: 1.0
Model variant: baseline
Model parameters: 6,603,710
Initial test acc across nodes: mean=0.0168 ± 0.0139
Round 001: test acc mean=0.0174 ± 0.0126 | min=0.0036 max=0.0434
         : test loss mean=2494.5843 ± 837.3715
         : individual accs = ['0.004603', '0.024030', '0.010782', '0.040157', '0.015400', '0.006065', '0.003577', '0.031272', '0.010260', '0.015431', '0.017861', '0.043406', '0.003909', '0.028354', '0.005923', '0.009680', '0.040212', '0.017452', '0.012977', '0.006056']
         : correct/total = [(19, 4128), (101, 4203), (44, 4081), (174, 4333), (63, 4091), (26, 4287), (15, 4193), (136, 4349), (43, 4191), (66, 4277), (74, 4143), (182, 4193), (16, 4093), (119, 4197), (24, 4052), (39, 4029), (167, 4153), (73, 4183), (53, 4084), (25, 4128)]
         : compromised: 0.0124, honest: 0.0195
Round 002: test acc mean=0.0561 ± 0.0032 | min=0.0506 max=0.0624
         : test loss mean=109.7201 ± 1.1269
         : individual accs = ['0.059593', '0.052344', '0.057584', '0.052850', '0.057932', '0.050618', '0.057000', '0.058174', '0.053209', '0.053776', '0.055998', '0.053899', '0.058637', '0.062426', '0.061204', '0.056590', '0.058271', '0.050920', '0.055583', '0.055475']
         : correct/total = [(246, 4128), (220, 4203), (235, 4081), (229, 4333), (237, 4091), (217, 4287), (239, 4193), (253, 4349), (223, 4191), (230, 4277), (232, 4143), (226, 4193), (240, 4093), (262, 4197), (248, 4052), (228, 4029), (242, 4153), (213, 4183), (227, 4084), (229, 4128)]
         : compromised: 0.0566, honest: 0.0559
Round 003: test acc mean=0.0447 ± 0.0037 | min=0.0365 max=0.0512
         : test loss mean=5.7150 ± 0.0802
         : individual accs = ['0.045785', '0.042589', '0.048763', '0.036464', '0.043266', '0.047352', '0.042213', '0.041619', '0.040802', '0.046528', '0.051171', '0.041736', '0.050818', '0.049559', '0.046644', '0.041698', '0.040693', '0.045900', '0.045788', '0.044331']
         : correct/total = [(189, 4128), (179, 4203), (199, 4081), (158, 4333), (177, 4091), (203, 4287), (177, 4193), (181, 4349), (171, 4191), (199, 4277), (212, 4143), (175, 4193), (208, 4093), (208, 4197), (189, 4052), (168, 4029), (169, 4153), (192, 4183), (187, 4084), (183, 4128)]
         : compromised: 0.0477, honest: 0.0434
Round 004: test acc mean=0.0510 ± 0.0038 | min=0.0439 max=0.0578
         : test loss mean=5.2696 ± 0.0754
         : individual accs = ['0.049176', '0.047109', '0.055134', '0.047773', '0.044977', '0.057849', '0.053899', '0.043918', '0.051539', '0.047463', '0.055274', '0.053184', '0.049841', '0.045747', '0.051579', '0.054852', '0.054418', '0.053311', '0.052155', '0.050388']
         : correct/total = [(203, 4128), (198, 4203), (225, 4081), (207, 4333), (184, 4091), (248, 4287), (226, 4193), (191, 4349), (216, 4191), (203, 4277), (229, 4143), (223, 4193), (204, 4093), (192, 4197), (209, 4052), (221, 4029), (226, 4153), (223, 4183), (213, 4084), (208, 4128)]
         : compromised: 0.0517, honest: 0.0507
Round 005: test acc mean=0.0447 ± 0.0037 | min=0.0365 max=0.0512
         : test loss mean=4.2398 ± 0.0154
         : individual accs = ['0.045785', '0.042589', '0.048763', '0.036464', '0.043266', '0.047352', '0.042213', '0.041619', '0.040802', '0.046528', '0.051171', '0.041736', '0.050818', '0.049559', '0.046644', '0.041698', '0.040693', '0.045900', '0.045788', '0.044331']
         : correct/total = [(189, 4128), (179, 4203), (199, 4081), (158, 4333), (177, 4091), (203, 4287), (177, 4193), (181, 4349), (171, 4191), (199, 4277), (212, 4143), (175, 4193), (208, 4093), (208, 4197), (189, 4052), (168, 4029), (169, 4153), (192, 4183), (187, 4084), (183, 4128)]
         : compromised: 0.0477, honest: 0.0434
Round 006: test acc mean=0.0487 ± 0.0031 | min=0.0422 max=0.0527
         : test loss mean=3.9719 ± 0.0280
         : individual accs = ['0.050145', '0.049726', '0.052683', '0.043388', '0.052554', '0.052484', '0.044598', '0.049207', '0.042233', '0.048398', '0.045619', '0.046983', '0.050574', '0.047177', '0.051826', '0.050633', '0.051288', '0.048291', '0.051665', '0.045058']
         : correct/total = [(207, 4128), (209, 4203), (215, 4081), (188, 4333), (215, 4091), (225, 4287), (187, 4193), (214, 4349), (177, 4191), (207, 4277), (189, 4143), (197, 4193), (207, 4093), (198, 4197), (210, 4052), (204, 4029), (213, 4153), (202, 4183), (211, 4084), (186, 4128)]
         : compromised: 0.0503, honest: 0.0480
Round 007: test acc mean=0.0514 ± 0.0034 | min=0.0469 max=0.0618
         : test loss mean=4.0133 ± 0.0073
         : individual accs = ['0.051599', '0.051630', '0.050723', '0.048465', '0.051088', '0.048052', '0.049130', '0.051276', '0.047960', '0.053075', '0.050447', '0.061770', '0.053750', '0.046938', '0.048124', '0.056342', '0.055141', '0.050203', '0.052889', '0.048450']
         : correct/total = [(213, 4128), (217, 4203), (207, 4081), (210, 4333), (209, 4091), (206, 4287), (206, 4193), (223, 4349), (201, 4191), (227, 4277), (209, 4143), (259, 4193), (220, 4093), (197, 4197), (195, 4052), (227, 4029), (229, 4153), (210, 4183), (216, 4084), (200, 4128)]
         : compromised: 0.0500, honest: 0.0519
Round 008: test acc mean=0.0561 ± 0.0032 | min=0.0506 max=0.0624
         : test loss mean=3.7344 ± 0.0211
         : individual accs = ['0.059593', '0.052344', '0.057584', '0.052850', '0.057932', '0.050618', '0.057000', '0.058174', '0.053209', '0.053776', '0.055998', '0.053899', '0.058637', '0.062426', '0.061204', '0.056590', '0.058271', '0.050920', '0.055583', '0.055475']
         : correct/total = [(246, 4128), (220, 4203), (235, 4081), (229, 4333), (237, 4091), (217, 4287), (239, 4193), (253, 4349), (223, 4191), (230, 4277), (232, 4143), (226, 4193), (240, 4093), (262, 4197), (248, 4052), (228, 4029), (242, 4153), (213, 4183), (227, 4084), (229, 4128)]
         : compromised: 0.0566, honest: 0.0559
Round 009: test acc mean=0.0514 ± 0.0034 | min=0.0469 max=0.0618
         : test loss mean=3.9248 ± 0.0078
         : individual accs = ['0.051599', '0.051630', '0.050723', '0.048465', '0.051088', '0.048052', '0.049130', '0.051276', '0.047960', '0.053075', '0.050447', '0.061770', '0.053750', '0.046938', '0.048124', '0.056342', '0.055141', '0.050203', '0.052889', '0.048450']
         : correct/total = [(213, 4128), (217, 4203), (207, 4081), (210, 4333), (209, 4091), (206, 4287), (206, 4193), (223, 4349), (201, 4191), (227, 4277), (209, 4143), (259, 4193), (220, 4093), (197, 4197), (195, 4052), (227, 4029), (229, 4153), (210, 4183), (216, 4084), (200, 4128)]
         : compromised: 0.0500, honest: 0.0519
Round 010: test acc mean=0.0561 ± 0.0032 | min=0.0506 max=0.0624
         : test loss mean=3.7077 ± 0.0208
         : individual accs = ['0.059593', '0.052344', '0.057584', '0.052850', '0.057932', '0.050618', '0.057000', '0.058174', '0.053209', '0.053776', '0.055998', '0.053899', '0.058637', '0.062426', '0.061204', '0.056590', '0.058271', '0.050920', '0.055583', '0.055475']
         : correct/total = [(246, 4128), (220, 4203), (235, 4081), (229, 4333), (237, 4091), (217, 4287), (239, 4193), (253, 4349), (223, 4191), (230, 4277), (232, 4143), (226, 4193), (240, 4093), (262, 4197), (248, 4052), (228, 4029), (242, 4153), (213, 4183), (227, 4084), (229, 4128)]
         : compromised: 0.0566, honest: 0.0559

=== FINAL RESULTS ===
Dataset: femnist, Nodes: 20, Graph: fully, Aggregation: d-fedavg
Attack: directed_deviation, 30.0% compromised
Final accuracy - Compromised: 0.0566, Honest: 0.0559
Overall test accuracy: mean=0.0561 ± 0.0032
