Device: cuda
Seed: 987654321
Loading 36 LEAF FEMNIST train files...
LEAF FEMNIST train: 3597 users, 734463 samples
Loading 36 LEAF FEMNIST test files...
LEAF FEMNIST test: 3597 users, 83388 samples
Found 3597 train users, 3597 test users, 3597 common users
User sample counts range: 525 (max) to 17 (min)
Distributed ALL 3597 users across 20 clients
Users per client: 179 (with 17 clients getting +1 user)
Train partition sizes: [36360, 37070, 35957, 38262, 36024, 37732, 36921, 38328, 36867, 37683, 36507, 36915, 36007, 37001, 35681, 35453, 36585, 36801, 35964, 36345]
Test partition sizes: [4128, 4203, 4081, 4333, 4091, 4287, 4193, 4349, 4191, 4277, 4143, 4193, 4093, 4197, 4052, 4029, 4153, 4183, 4084, 4128]
  Client 0: 36360 train samples, 62 unique classes
  Client 1: 37070 train samples, 62 unique classes
  Client 2: 35957 train samples, 62 unique classes
  Client 3: 38262 train samples, 62 unique classes
  Client 4: 36024 train samples, 62 unique classes
  Client 5: 37732 train samples, 62 unique classes
  Client 6: 36921 train samples, 62 unique classes
  Client 7: 38328 train samples, 62 unique classes
  Client 8: 36867 train samples, 62 unique classes
  Client 9: 37683 train samples, 62 unique classes
  Client 10: 36507 train samples, 62 unique classes
  Client 11: 36915 train samples, 62 unique classes
  Client 12: 36007 train samples, 62 unique classes
  Client 13: 37001 train samples, 62 unique classes
  Client 14: 35681 train samples, 62 unique classes
  Client 15: 35453 train samples, 62 unique classes
  Client 16: 36585 train samples, 62 unique classes
  Client 17: 36801 train samples, 62 unique classes
  Client 18: 35964 train samples, 62 unique classes
  Client 19: 36345 train samples, 62 unique classes
Will sample 4500 samples per client per epoch
Graph: erdos, nodes: 20, edges: 99
Degree statistics: avg=9.90, min=7, max=14
Attack: Compromised 14/20 nodes: [1, 2, 3, 5, 6, 8, 11, 12, 13, 14, 15, 17, 18, 19]
Attack type: directed_deviation, lambda: 1.0
Model variant: baseline
Model parameters: 6,603,710
Initial test acc across nodes: mean=0.0168 ± 0.0139
Round 001: test acc mean=0.0169 ± 0.0172 | min=0.0032 max=0.0564
         : test loss mean=90730.9553 ± 62548.2942
         : individual accs = ['0.013324', '0.052344', '0.056359', '0.008078', '0.004644', '0.003499', '0.003577', '0.006898', '0.014078', '0.044657', '0.004586', '0.007870', '0.005619', '0.045032', '0.019497', '0.003227', '0.005538', '0.015778', '0.004652', '0.019138']
         : correct/total = [(55, 4128), (220, 4203), (230, 4081), (35, 4333), (19, 4091), (15, 4287), (15, 4193), (30, 4349), (59, 4191), (191, 4277), (19, 4143), (33, 4193), (23, 4093), (189, 4197), (79, 4052), (13, 4029), (23, 4153), (66, 4183), (19, 4084), (79, 4128)]
         : compromised: 0.0185, honest: 0.0133
Round 002: test acc mean=0.0503 ± 0.0042 | min=0.0417 max=0.0624
         : test loss mean=121936996.0911 ± 442244396.2763
         : individual accs = ['0.049176', '0.048775', '0.055134', '0.048465', '0.048643', '0.048519', '0.049130', '0.051276', '0.051062', '0.047229', '0.050447', '0.053184', '0.050818', '0.062426', '0.046644', '0.041698', '0.054418', '0.045900', '0.055583', '0.048450']
         : correct/total = [(203, 4128), (205, 4203), (225, 4081), (210, 4333), (199, 4091), (208, 4287), (206, 4193), (223, 4349), (214, 4191), (202, 4277), (209, 4143), (223, 4193), (208, 4093), (262, 4197), (189, 4052), (168, 4029), (226, 4153), (192, 4183), (227, 4084), (200, 4128)]
         : compromised: 0.0504, honest: 0.0502
Round 003: test acc mean=0.0476 ± 0.0023 | min=0.0445 max=0.0539
         : test loss mean=321.1036 ± 106.8991
         : individual accs = ['0.047238', '0.048775', '0.045087', '0.044773', '0.047421', '0.048752', '0.048891', '0.045528', '0.051539', '0.047697', '0.047309', '0.045314', '0.049597', '0.045747', '0.046397', '0.053860', '0.044546', '0.045900', '0.048482', '0.048692']
         : correct/total = [(195, 4128), (205, 4203), (184, 4081), (194, 4333), (194, 4091), (209, 4287), (205, 4193), (198, 4349), (216, 4191), (204, 4277), (196, 4143), (190, 4193), (203, 4093), (192, 4197), (188, 4052), (217, 4029), (185, 4153), (192, 4183), (198, 4084), (201, 4128)]
         : compromised: 0.0480, honest: 0.0466
Round 004: test acc mean=0.0300 ± 0.0144 | min=0.0121 max=0.0489
         : test loss mean=104.1535 ± 172.0888
         : individual accs = ['0.013808', '0.024030', '0.019358', '0.024694', '0.020777', '0.048752', '0.048891', '0.025063', '0.044619', '0.014730', '0.012069', '0.045314', '0.017102', '0.045747', '0.046397', '0.013403', '0.016374', '0.021516', '0.048482', '0.048692']
         : correct/total = [(57, 4128), (101, 4203), (79, 4081), (107, 4333), (85, 4091), (209, 4287), (205, 4193), (109, 4349), (187, 4191), (63, 4277), (50, 4143), (190, 4193), (70, 4093), (192, 4197), (188, 4052), (54, 4029), (68, 4153), (90, 4183), (198, 4084), (201, 4128)]
         : compromised: 0.0355, honest: 0.0171
Round 005: test acc mean=0.0473 ± 0.0023 | min=0.0446 max=0.0539
         : test loss mean=11.2360 ± 8.5010
         : individual accs = ['0.044574', '0.046158', '0.045087', '0.044773', '0.047421', '0.048752', '0.048891', '0.045528', '0.044619', '0.050503', '0.047309', '0.045314', '0.049597', '0.045747', '0.046397', '0.053860', '0.049362', '0.045900', '0.048482', '0.048692']
         : correct/total = [(184, 4128), (194, 4203), (184, 4081), (194, 4333), (194, 4091), (209, 4287), (205, 4193), (198, 4349), (187, 4191), (216, 4277), (196, 4143), (190, 4193), (203, 4093), (192, 4197), (188, 4052), (217, 4029), (205, 4153), (192, 4183), (198, 4084), (201, 4128)]
         : compromised: 0.0473, honest: 0.0474
Round 006: test acc mean=0.0304 ± 0.0131 | min=0.0159 max=0.0489
         : test loss mean=72.8701 ± 148.5138
         : individual accs = ['0.019622', '0.020700', '0.022298', '0.018925', '0.016133', '0.048752', '0.048891', '0.019545', '0.044619', '0.026420', '0.017861', '0.045314', '0.020034', '0.045747', '0.037759', '0.022338', '0.015892', '0.019842', '0.048482', '0.048692']
         : correct/total = [(81, 4128), (87, 4203), (91, 4081), (82, 4333), (66, 4091), (209, 4287), (205, 4193), (85, 4349), (187, 4191), (113, 4277), (74, 4143), (190, 4193), (82, 4093), (192, 4197), (153, 4052), (90, 4029), (66, 4153), (83, 4183), (198, 4084), (201, 4128)]
         : compromised: 0.0352, honest: 0.0192
Round 007: test acc mean=0.0475 ± 0.0032 | min=0.0430 max=0.0544
         : test loss mean=5.3590 ± 3.6485
         : individual accs = ['0.050145', '0.048775', '0.048272', '0.043157', '0.043021', '0.045953', '0.043883', '0.045068', '0.044619', '0.043488', '0.048033', '0.054376', '0.045688', '0.045747', '0.045656', '0.051378', '0.052011', '0.049486', '0.050196', '0.050145']
         : correct/total = [(207, 4128), (205, 4203), (197, 4081), (187, 4333), (176, 4091), (197, 4287), (184, 4193), (196, 4349), (187, 4191), (186, 4277), (199, 4143), (228, 4193), (187, 4093), (192, 4197), (185, 4052), (207, 4029), (216, 4153), (207, 4183), (205, 4084), (207, 4128)]
         : compromised: 0.0477, honest: 0.0470
Round 008: test acc mean=0.0432 ± 0.0116 | min=0.0195 max=0.0551
         : test loss mean=73.2572 ± 147.8475
         : individual accs = ['0.051599', '0.051630', '0.022298', '0.048465', '0.051088', '0.048752', '0.048891', '0.019545', '0.044619', '0.053075', '0.050447', '0.045314', '0.020034', '0.045747', '0.037759', '0.022338', '0.055141', '0.050203', '0.048482', '0.048692']
         : correct/total = [(213, 4128), (217, 4203), (91, 4081), (210, 4333), (209, 4091), (209, 4287), (205, 4193), (85, 4349), (187, 4191), (227, 4277), (209, 4143), (190, 4193), (82, 4093), (192, 4197), (153, 4052), (90, 4029), (229, 4153), (210, 4183), (198, 4084), (201, 4128)]
         : compromised: 0.0417, honest: 0.0468
Round 009: test acc mean=0.0476 ± 0.0032 | min=0.0430 max=0.0544
         : test loss mean=5.3672 ± 3.8855
         : individual accs = ['0.050145', '0.048775', '0.048272', '0.043157', '0.043021', '0.045953', '0.043883', '0.047827', '0.044619', '0.043488', '0.048033', '0.054376', '0.045688', '0.045747', '0.045656', '0.051378', '0.052011', '0.049486', '0.050196', '0.050145']
         : correct/total = [(207, 4128), (205, 4203), (197, 4081), (187, 4333), (176, 4091), (197, 4287), (184, 4193), (208, 4349), (187, 4191), (186, 4277), (199, 4143), (228, 4193), (187, 4093), (192, 4197), (185, 4052), (207, 4029), (216, 4153), (207, 4183), (205, 4084), (207, 4128)]
         : compromised: 0.0477, honest: 0.0474
Round 010: test acc mean=0.0453 ± 0.0095 | min=0.0200 max=0.0551
         : test loss mean=74.3078 ± 149.8788
         : individual accs = ['0.051599', '0.051630', '0.022298', '0.048465', '0.051088', '0.048752', '0.048891', '0.051276', '0.044619', '0.053075', '0.050447', '0.045314', '0.020034', '0.045747', '0.037759', '0.032266', '0.055141', '0.050203', '0.048482', '0.048692']
         : correct/total = [(213, 4128), (217, 4203), (91, 4081), (210, 4333), (209, 4091), (209, 4287), (205, 4193), (223, 4349), (187, 4191), (227, 4277), (209, 4143), (190, 4193), (82, 4093), (192, 4197), (153, 4052), (130, 4029), (229, 4153), (210, 4183), (198, 4084), (201, 4128)]
         : compromised: 0.0424, honest: 0.0521

=== FINAL RESULTS ===
Dataset: femnist, Nodes: 20, Graph: erdos, Aggregation: d-fedavg
Attack: directed_deviation, 70.0% compromised
Final accuracy - Compromised: 0.0424, Honest: 0.0521
Overall test accuracy: mean=0.0453 ± 0.0095
