Device: cuda
Seed: 987654321
Loading 36 LEAF FEMNIST train files...
LEAF FEMNIST train: 3597 users, 734463 samples
Loading 36 LEAF FEMNIST test files...
LEAF FEMNIST test: 3597 users, 83388 samples
Found 3597 train users, 3597 test users, 3597 common users
User sample counts range: 525 (max) to 17 (min)
Distributed ALL 3597 users across 20 clients
Users per client: 179 (with 17 clients getting +1 user)
Train partition sizes: [36360, 37070, 35957, 38262, 36024, 37732, 36921, 38328, 36867, 37683, 36507, 36915, 36007, 37001, 35681, 35453, 36585, 36801, 35964, 36345]
Test partition sizes: [4128, 4203, 4081, 4333, 4091, 4287, 4193, 4349, 4191, 4277, 4143, 4193, 4093, 4197, 4052, 4029, 4153, 4183, 4084, 4128]
  Client 0: 36360 train samples, 62 unique classes
  Client 1: 37070 train samples, 62 unique classes
  Client 2: 35957 train samples, 62 unique classes
  Client 3: 38262 train samples, 62 unique classes
  Client 4: 36024 train samples, 62 unique classes
  Client 5: 37732 train samples, 62 unique classes
  Client 6: 36921 train samples, 62 unique classes
  Client 7: 38328 train samples, 62 unique classes
  Client 8: 36867 train samples, 62 unique classes
  Client 9: 37683 train samples, 62 unique classes
  Client 10: 36507 train samples, 62 unique classes
  Client 11: 36915 train samples, 62 unique classes
  Client 12: 36007 train samples, 62 unique classes
  Client 13: 37001 train samples, 62 unique classes
  Client 14: 35681 train samples, 62 unique classes
  Client 15: 35453 train samples, 62 unique classes
  Client 16: 36585 train samples, 62 unique classes
  Client 17: 36801 train samples, 62 unique classes
  Client 18: 35964 train samples, 62 unique classes
  Client 19: 36345 train samples, 62 unique classes
Will sample 4500 samples per client per epoch
Graph: erdos, nodes: 20, edges: 48
Degree statistics: avg=4.80, min=2, max=7
Attack: Compromised 6/20 nodes: [5, 12, 13, 14, 17, 18]
Attack type: directed_deviation, lambda: 1.0
Model variant: baseline
Model parameters: 6,603,710
Initial test acc across nodes: mean=0.0168 ± 0.0139
Round 001: test acc mean=0.0258 ± 0.0176 | min=0.0029 max=0.0545
         : test loss mean=9774.1700 ± 17184.0770
         : individual accs = ['0.040698', '0.052344', '0.002940', '0.045003', '0.019800', '0.022160', '0.008586', '0.044838', '0.006920', '0.053776', '0.023172', '0.019795', '0.033716', '0.007386', '0.014067', '0.007694', '0.039730', '0.004303', '0.014691', '0.054506']
         : correct/total = [(168, 4128), (220, 4203), (12, 4081), (195, 4333), (81, 4091), (95, 4287), (36, 4193), (195, 4349), (29, 4191), (230, 4277), (96, 4143), (83, 4193), (138, 4093), (31, 4197), (57, 4052), (31, 4029), (165, 4153), (18, 4183), (60, 4084), (225, 4128)]
         : compromised: 0.0161, honest: 0.0300
Round 002: test acc mean=0.0320 ± 0.0138 | min=0.0050 max=0.0496
         : test loss mean=13104786.9151 ± 35260763.7424
         : individual accs = ['0.047238', '0.048775', '0.019358', '0.024694', '0.020777', '0.022160', '0.019795', '0.045528', '0.005011', '0.047463', '0.019792', '0.025042', '0.049597', '0.024065', '0.046397', '0.022834', '0.044546', '0.045900', '0.017630', '0.043847']
         : correct/total = [(195, 4128), (205, 4203), (79, 4081), (107, 4333), (85, 4091), (95, 4287), (83, 4193), (198, 4349), (21, 4191), (203, 4277), (82, 4143), (105, 4193), (203, 4093), (101, 4197), (188, 4052), (92, 4029), (185, 4153), (192, 4183), (72, 4084), (181, 4128)]
         : compromised: 0.0343, honest: 0.0311
Round 003: test acc mean=0.0489 ± 0.0063 | min=0.0333 max=0.0612
         : test loss mean=433333804.1693 ± 1724058505.7999
         : individual accs = ['0.059593', '0.049726', '0.057584', '0.043388', '0.047421', '0.052484', '0.044598', '0.049207', '0.053209', '0.039280', '0.045619', '0.046983', '0.050574', '0.047177', '0.061204', '0.050633', '0.049362', '0.051159', '0.033301', '0.045058']
         : correct/total = [(246, 4128), (209, 4203), (235, 4081), (188, 4333), (194, 4091), (225, 4287), (187, 4193), (214, 4349), (223, 4191), (168, 4277), (189, 4143), (197, 4193), (207, 4093), (198, 4197), (248, 4052), (204, 4029), (205, 4153), (214, 4183), (136, 4084), (186, 4128)]
         : compromised: 0.0493, honest: 0.0487
Round 004: test acc mean=0.0491 ± 0.0038 | min=0.0402 max=0.0553
         : test loss mean=10558077.5980 ± 32266605.8941
         : individual accs = ['0.050145', '0.048775', '0.053418', '0.040157', '0.052554', '0.045953', '0.044598', '0.049207', '0.042233', '0.050503', '0.047309', '0.053899', '0.045688', '0.055278', '0.051579', '0.050633', '0.051288', '0.048291', '0.051665', '0.048450']
         : correct/total = [(207, 4128), (205, 4203), (218, 4081), (174, 4333), (215, 4091), (197, 4287), (187, 4193), (214, 4349), (177, 4191), (216, 4277), (196, 4143), (226, 4193), (187, 4093), (232, 4197), (209, 4052), (204, 4029), (213, 4153), (202, 4183), (211, 4084), (200, 4128)]
         : compromised: 0.0497, honest: 0.0488
Round 005: test acc mean=0.0476 ± 0.0062 | min=0.0291 max=0.0553
         : test loss mean=453.7023 ± 539.7867
         : individual accs = ['0.029070', '0.051630', '0.048272', '0.046619', '0.045710', '0.045953', '0.049130', '0.047827', '0.054880', '0.039280', '0.036688', '0.054376', '0.045688', '0.055278', '0.050346', '0.051378', '0.049362', '0.051159', '0.050930', '0.048450']
         : correct/total = [(120, 4128), (217, 4203), (197, 4081), (202, 4333), (187, 4091), (197, 4287), (206, 4193), (208, 4349), (230, 4191), (168, 4277), (152, 4143), (228, 4193), (187, 4093), (232, 4197), (204, 4052), (207, 4029), (205, 4153), (214, 4183), (208, 4084), (200, 4128)]
         : compromised: 0.0499, honest: 0.0466
Round 006: test acc mean=0.0479 ± 0.0043 | min=0.0367 max=0.0555
         : test loss mean=135.5088 ± 207.5953
         : individual accs = ['0.045785', '0.052344', '0.048272', '0.048234', '0.045710', '0.045953', '0.046745', '0.053116', '0.042233', '0.046528', '0.036688', '0.049606', '0.045688', '0.055278', '0.045656', '0.051378', '0.049362', '0.048291', '0.045788', '0.055475']
         : correct/total = [(189, 4128), (220, 4203), (197, 4081), (209, 4333), (187, 4091), (197, 4287), (196, 4193), (231, 4349), (177, 4191), (199, 4277), (152, 4143), (208, 4193), (187, 4093), (232, 4197), (185, 4052), (207, 4029), (205, 4153), (202, 4183), (187, 4084), (229, 4128)]
         : compromised: 0.0478, honest: 0.0480
Round 007: test acc mean=0.0485 ± 0.0055 | min=0.0365 max=0.0586
         : test loss mean=42.1911 ± 60.0079
         : individual accs = ['0.045785', '0.042589', '0.053418', '0.036464', '0.043021', '0.045253', '0.042213', '0.058174', '0.042233', '0.046528', '0.051171', '0.054376', '0.058637', '0.047177', '0.051826', '0.051626', '0.051047', '0.048291', '0.051665', '0.048450']
         : correct/total = [(189, 4128), (179, 4203), (218, 4081), (158, 4333), (176, 4091), (194, 4287), (177, 4193), (253, 4349), (177, 4191), (199, 4277), (212, 4143), (228, 4193), (240, 4093), (198, 4197), (210, 4052), (208, 4029), (212, 4153), (202, 4183), (211, 4084), (200, 4128)]
         : compromised: 0.0505, honest: 0.0476
Round 008: test acc mean=0.0487 ± 0.0045 | min=0.0365 max=0.0555
         : test loss mean=42.6561 ± 114.8489
         : individual accs = ['0.045785', '0.052344', '0.054889', '0.036464', '0.052554', '0.045253', '0.044598', '0.049207', '0.042233', '0.046528', '0.050447', '0.049606', '0.053750', '0.046938', '0.048124', '0.050881', '0.052011', '0.050203', '0.045788', '0.055475']
         : correct/total = [(189, 4128), (220, 4203), (224, 4081), (158, 4333), (215, 4091), (194, 4287), (187, 4193), (214, 4349), (177, 4191), (199, 4277), (209, 4143), (208, 4193), (220, 4093), (197, 4197), (195, 4052), (205, 4029), (216, 4153), (210, 4183), (187, 4084), (229, 4128)]
         : compromised: 0.0483, honest: 0.0488
Round 009: test acc mean=0.0502 ± 0.0063 | min=0.0365 max=0.0624
         : test loss mean=13.4738 ± 32.2637
         : individual accs = ['0.045785', '0.042589', '0.053418', '0.036464', '0.043021', '0.045253', '0.057000', '0.058174', '0.053209', '0.046528', '0.055998', '0.049606', '0.058637', '0.062426', '0.051826', '0.051626', '0.052011', '0.050920', '0.045788', '0.044331']
         : correct/total = [(189, 4128), (179, 4203), (218, 4081), (158, 4333), (176, 4091), (194, 4287), (239, 4193), (253, 4349), (223, 4191), (199, 4277), (232, 4143), (208, 4193), (240, 4093), (262, 4197), (210, 4052), (208, 4029), (216, 4153), (213, 4183), (187, 4084), (183, 4128)]
         : compromised: 0.0525, honest: 0.0493
Round 010: test acc mean=0.0449 ± 0.0084 | min=0.0250 max=0.0556
         : test loss mean=39.0867 ± 114.1088
         : individual accs = ['0.045785', '0.052344', '0.024994', '0.036464', '0.042288', '0.045253', '0.042213', '0.041619', '0.047960', '0.046528', '0.051171', '0.028142', '0.050818', '0.049559', '0.048124', '0.032266', '0.052011', '0.050203', '0.055583', '0.055475']
         : correct/total = [(189, 4128), (220, 4203), (102, 4081), (158, 4333), (173, 4091), (194, 4287), (177, 4193), (181, 4349), (201, 4191), (199, 4277), (212, 4143), (118, 4193), (208, 4093), (208, 4197), (195, 4052), (130, 4029), (216, 4153), (210, 4183), (227, 4084), (229, 4128)]
         : compromised: 0.0499, honest: 0.0428

=== FINAL RESULTS ===
Dataset: femnist, Nodes: 20, Graph: erdos, Aggregation: d-fedavg
Attack: directed_deviation, 30.0% compromised
Final accuracy - Compromised: 0.0499, Honest: 0.0428
Overall test accuracy: mean=0.0449 ± 0.0084
