Device: cuda
Seed: 987654321
Loading 36 LEAF FEMNIST train files...
LEAF FEMNIST train: 3597 users, 734463 samples
Loading 36 LEAF FEMNIST test files...
LEAF FEMNIST test: 3597 users, 83388 samples
Found 3597 train users, 3597 test users, 3597 common users
User sample counts range: 525 (max) to 17 (min)
Distributed ALL 3597 users across 20 clients
Users per client: 179 (with 17 clients getting +1 user)
Train partition sizes: [36360, 37070, 35957, 38262, 36024, 37732, 36921, 38328, 36867, 37683, 36507, 36915, 36007, 37001, 35681, 35453, 36585, 36801, 35964, 36345]
Test partition sizes: [4128, 4203, 4081, 4333, 4091, 4287, 4193, 4349, 4191, 4277, 4143, 4193, 4093, 4197, 4052, 4029, 4153, 4183, 4084, 4128]
  Client 0: 36360 train samples, 62 unique classes
  Client 1: 37070 train samples, 62 unique classes
  Client 2: 35957 train samples, 62 unique classes
  Client 3: 38262 train samples, 62 unique classes
  Client 4: 36024 train samples, 62 unique classes
  Client 5: 37732 train samples, 62 unique classes
  Client 6: 36921 train samples, 62 unique classes
  Client 7: 38328 train samples, 62 unique classes
  Client 8: 36867 train samples, 62 unique classes
  Client 9: 37683 train samples, 62 unique classes
  Client 10: 36507 train samples, 62 unique classes
  Client 11: 36915 train samples, 62 unique classes
  Client 12: 36007 train samples, 62 unique classes
  Client 13: 37001 train samples, 62 unique classes
  Client 14: 35681 train samples, 62 unique classes
  Client 15: 35453 train samples, 62 unique classes
  Client 16: 36585 train samples, 62 unique classes
  Client 17: 36801 train samples, 62 unique classes
  Client 18: 35964 train samples, 62 unique classes
  Client 19: 36345 train samples, 62 unique classes
Will sample 4500 samples per client per epoch
Graph: erdos, nodes: 20, edges: 99
Degree statistics: avg=9.90, min=7, max=14
Attack: Compromised 10/20 nodes: [1, 2, 5, 11, 12, 13, 14, 15, 17, 18]
Attack type: directed_deviation, lambda: 1.0
Model variant: baseline
Model parameters: 6,603,710
Initial test acc across nodes: mean=0.0168 ± 0.0139
Round 001: test acc mean=0.0194 ± 0.0175 | min=0.0028 max=0.0636
         : test loss mean=26946.2242 ± 17629.7123
         : individual accs = ['0.007267', '0.024030', '0.010782', '0.005770', '0.013200', '0.002799', '0.005962', '0.036560', '0.014794', '0.008183', '0.047309', '0.039113', '0.048864', '0.002859', '0.010612', '0.004468', '0.063569', '0.015061', '0.006611', '0.019864']
         : correct/total = [(30, 4128), (101, 4203), (44, 4081), (25, 4333), (54, 4091), (12, 4287), (25, 4193), (159, 4349), (62, 4191), (35, 4277), (196, 4143), (164, 4193), (200, 4093), (12, 4197), (43, 4052), (18, 4029), (264, 4153), (63, 4183), (27, 4084), (82, 4128)]
         : compromised: 0.0165, honest: 0.0222
Round 002: test acc mean=0.0493 ± 0.0032 | min=0.0434 max=0.0551
         : test loss mean=14862807.4824 ± 47878879.9683
         : individual accs = ['0.044574', '0.049726', '0.055134', '0.043388', '0.048643', '0.052484', '0.044598', '0.049207', '0.054880', '0.048398', '0.045619', '0.046983', '0.050574', '0.046462', '0.051826', '0.050633', '0.051288', '0.048291', '0.051665', '0.050872']
         : correct/total = [(184, 4128), (209, 4203), (225, 4081), (188, 4333), (199, 4091), (225, 4287), (187, 4193), (214, 4349), (230, 4191), (207, 4277), (189, 4143), (197, 4193), (207, 4093), (195, 4197), (210, 4052), (204, 4029), (213, 4153), (202, 4183), (211, 4084), (210, 4128)]
         : compromised: 0.0504, honest: 0.0481
Round 003: test acc mean=0.0488 ± 0.0033 | min=0.0434 max=0.0549
         : test loss mean=551.1957 ± 352.4889
         : individual accs = ['0.044574', '0.046158', '0.052683', '0.043388', '0.052554', '0.052484', '0.044598', '0.049207', '0.054880', '0.050503', '0.045619', '0.046983', '0.045688', '0.047177', '0.050346', '0.051378', '0.049362', '0.051159', '0.051665', '0.045058']
         : correct/total = [(184, 4128), (194, 4203), (215, 4081), (188, 4333), (215, 4091), (225, 4287), (187, 4193), (214, 4349), (230, 4191), (216, 4277), (189, 4143), (197, 4193), (187, 4093), (198, 4197), (204, 4052), (207, 4029), (205, 4153), (214, 4183), (211, 4084), (186, 4128)]
         : compromised: 0.0496, honest: 0.0480
Round 004: test acc mean=0.0482 ± 0.0030 | min=0.0420 max=0.0549
         : test loss mean=476.4436 ± 242.1612
         : individual accs = ['0.044574', '0.046158', '0.048272', '0.048234', '0.045710', '0.043387', '0.046745', '0.047827', '0.054880', '0.050503', '0.041999', '0.049606', '0.045688', '0.047177', '0.050346', '0.051378', '0.049362', '0.051159', '0.050930', '0.050872']
         : correct/total = [(184, 4128), (194, 4203), (197, 4081), (209, 4333), (187, 4091), (186, 4287), (196, 4193), (208, 4349), (230, 4191), (216, 4277), (174, 4143), (208, 4193), (187, 4093), (198, 4197), (204, 4052), (207, 4029), (205, 4153), (214, 4183), (208, 4084), (210, 4128)]
         : compromised: 0.0484, honest: 0.0481
Round 005: test acc mean=0.0482 ± 0.0031 | min=0.0420 max=0.0549
         : test loss mean=97.3908 ± 54.1407
         : individual accs = ['0.044574', '0.046158', '0.048272', '0.048234', '0.045710', '0.043387', '0.046745', '0.047827', '0.054880', '0.050503', '0.041999', '0.049606', '0.045688', '0.046462', '0.050346', '0.051378', '0.049362', '0.051159', '0.050930', '0.050872']
         : correct/total = [(184, 4128), (194, 4203), (197, 4081), (209, 4333), (187, 4091), (186, 4287), (196, 4193), (208, 4349), (230, 4191), (216, 4277), (174, 4143), (208, 4193), (187, 4093), (195, 4197), (204, 4052), (207, 4029), (205, 4153), (214, 4183), (208, 4084), (210, 4128)]
         : compromised: 0.0483, honest: 0.0481
Round 006: test acc mean=0.0449 ± 0.0065 | min=0.0286 max=0.0514
         : test loss mean=10.9087 ± 14.8885
         : individual accs = ['0.047238', '0.048775', '0.048272', '0.040157', '0.045710', '0.048752', '0.046745', '0.051276', '0.044619', '0.043488', '0.048033', '0.049606', '0.033716', '0.028592', '0.050346', '0.051378', '0.049362', '0.037533', '0.033301', '0.050872']
         : correct/total = [(195, 4128), (205, 4203), (197, 4081), (174, 4333), (187, 4091), (209, 4287), (196, 4193), (223, 4349), (187, 4191), (186, 4277), (199, 4143), (208, 4193), (138, 4093), (120, 4197), (204, 4052), (207, 4029), (205, 4153), (157, 4183), (136, 4084), (210, 4128)]
         : compromised: 0.0430, honest: 0.0468
Round 007: test acc mean=0.0545 ± 0.0048 | min=0.0435 max=0.0624
         : test loss mean=4.4839 ± 1.5959
         : individual accs = ['0.059593', '0.052344', '0.057584', '0.052850', '0.057932', '0.050618', '0.057000', '0.058174', '0.053209', '0.043488', '0.048033', '0.049606', '0.058637', '0.062426', '0.061204', '0.056590', '0.049362', '0.049486', '0.055583', '0.055475']
         : correct/total = [(246, 4128), (220, 4203), (235, 4081), (229, 4333), (237, 4091), (217, 4287), (239, 4193), (253, 4349), (223, 4191), (186, 4277), (199, 4143), (208, 4193), (240, 4093), (262, 4197), (248, 4052), (228, 4029), (205, 4153), (207, 4183), (227, 4084), (229, 4128)]
         : compromised: 0.0554, honest: 0.0535
Round 008: test acc mean=0.0255 ± 0.0137 | min=0.0124 max=0.0551
         : test loss mean=7.6568 ± 14.0503
         : individual accs = ['0.015746', '0.034737', '0.013722', '0.040157', '0.015400', '0.013063', '0.012402', '0.015406', '0.012646', '0.039280', '0.036688', '0.049606', '0.033716', '0.028592', '0.013574', '0.013899', '0.055141', '0.037533', '0.014691', '0.014777']
         : correct/total = [(65, 4128), (146, 4203), (56, 4081), (174, 4333), (63, 4091), (56, 4287), (52, 4193), (67, 4349), (53, 4191), (168, 4277), (152, 4143), (208, 4193), (138, 4093), (120, 4197), (55, 4052), (56, 4029), (229, 4153), (157, 4183), (60, 4084), (61, 4128)]
         : compromised: 0.0253, honest: 0.0258
Round 009: test acc mean=0.0552 ± 0.0050 | min=0.0393 max=0.0624
         : test loss mean=4.4548 ± 1.8887
         : individual accs = ['0.059593', '0.052344', '0.057584', '0.052850', '0.057932', '0.050618', '0.057000', '0.058174', '0.053209', '0.039280', '0.055998', '0.049606', '0.058637', '0.062426', '0.061204', '0.056590', '0.058271', '0.050920', '0.055583', '0.055475']
         : correct/total = [(246, 4128), (220, 4203), (235, 4081), (229, 4333), (237, 4091), (217, 4287), (239, 4193), (253, 4349), (223, 4191), (168, 4277), (232, 4143), (208, 4193), (240, 4093), (262, 4197), (248, 4052), (228, 4029), (242, 4153), (213, 4183), (227, 4084), (229, 4128)]
         : compromised: 0.0556, honest: 0.0548
Round 010: test acc mean=0.0328 ± 0.0128 | min=0.0136 max=0.0539
         : test loss mean=7.4777 ± 13.4646
         : individual accs = ['0.030523', '0.034737', '0.024994', '0.040157', '0.015400', '0.038955', '0.053899', '0.015406', '0.051539', '0.039280', '0.036688', '0.049606', '0.033716', '0.028592', '0.013574', '0.013899', '0.049362', '0.037533', '0.033301', '0.014777']
         : correct/total = [(126, 4128), (146, 4203), (102, 4081), (174, 4333), (63, 4091), (167, 4287), (226, 4193), (67, 4349), (216, 4191), (168, 4277), (152, 4143), (208, 4193), (138, 4093), (120, 4197), (55, 4052), (56, 4029), (205, 4153), (157, 4183), (136, 4084), (61, 4128)]
         : compromised: 0.0309, honest: 0.0347

=== FINAL RESULTS ===
Dataset: femnist, Nodes: 20, Graph: erdos, Aggregation: d-fedavg
Attack: directed_deviation, 50.0% compromised
Final accuracy - Compromised: 0.0309, Honest: 0.0347
Overall test accuracy: mean=0.0328 ± 0.0128
