Device: cuda
Seed: 987654321
Loading 36 LEAF FEMNIST train files...
LEAF FEMNIST train: 3597 users, 734463 samples
Loading 36 LEAF FEMNIST test files...
LEAF FEMNIST test: 3597 users, 83388 samples
Found 3597 train users, 3597 test users, 3597 common users
User sample counts range: 525 (max) to 17 (min)
Distributed ALL 3597 users across 20 clients
Users per client: 179 (with 17 clients getting +1 user)
Train partition sizes: [36360, 37070, 35957, 38262, 36024, 37732, 36921, 38328, 36867, 37683, 36507, 36915, 36007, 37001, 35681, 35453, 36585, 36801, 35964, 36345]
Test partition sizes: [4128, 4203, 4081, 4333, 4091, 4287, 4193, 4349, 4191, 4277, 4143, 4193, 4093, 4197, 4052, 4029, 4153, 4183, 4084, 4128]
  Client 0: 36360 train samples, 62 unique classes
  Client 1: 37070 train samples, 62 unique classes
  Client 2: 35957 train samples, 62 unique classes
  Client 3: 38262 train samples, 62 unique classes
  Client 4: 36024 train samples, 62 unique classes
  Client 5: 37732 train samples, 62 unique classes
  Client 6: 36921 train samples, 62 unique classes
  Client 7: 38328 train samples, 62 unique classes
  Client 8: 36867 train samples, 62 unique classes
  Client 9: 37683 train samples, 62 unique classes
  Client 10: 36507 train samples, 62 unique classes
  Client 11: 36915 train samples, 62 unique classes
  Client 12: 36007 train samples, 62 unique classes
  Client 13: 37001 train samples, 62 unique classes
  Client 14: 35681 train samples, 62 unique classes
  Client 15: 35453 train samples, 62 unique classes
  Client 16: 36585 train samples, 62 unique classes
  Client 17: 36801 train samples, 62 unique classes
  Client 18: 35964 train samples, 62 unique classes
  Client 19: 36345 train samples, 62 unique classes
Will sample 4500 samples per client per epoch
Graph: ring, nodes: 20, edges: 20
Degree statistics: avg=2.00, min=2, max=2
Attack: Compromised 8/20 nodes: [1, 5, 11, 12, 13, 14, 17, 18]
Attack type: backdoor, lambda: 1.0
Backdoor target label: 0, trigger size: 4
Model variant: baseline
Model parameters: 6,603,710
BALANCE algorithm:
Balance Config: BALANCEConfig(gamma=2, kappa=1, alpha=0.5, min_neighbors=1)
  - Model dimension: 6,603,710 parameters
  - Complexity: O(N×d) = O(20×6,603,710)
Initial test acc across nodes: mean=0.0168 ± 0.0139
Backdoor attack: Created poisoned datasets for 8 compromised nodes
Round 001: test acc mean=0.0501 ± 0.0035 | min=0.0430 max=0.0553
         : test loss mean=20244.7061 ± 33021.4542
         : individual accs = ['0.049661', '0.048775', '0.055134', '0.047773', '0.043021', '0.045253', '0.044598', '0.053576', '0.047960', '0.050503', '0.055274', '0.049606', '0.054239', '0.055278', '0.051826', '0.050385', '0.047195', '0.049486', '0.052889', '0.050145']
         : correct/total = [(205, 4128), (205, 4203), (225, 4081), (207, 4333), (176, 4091), (194, 4287), (187, 4193), (233, 4349), (201, 4191), (216, 4277), (229, 4143), (208, 4193), (222, 4093), (232, 4197), (210, 4052), (203, 4029), (196, 4153), (207, 4183), (216, 4084), (207, 4128)]
         : compromised: 0.0509, honest: 0.0496
Round 002: test acc mean=0.0470 ± 0.0189 | min=0.0036 max=0.0847
         : test loss mean=48113.6823 ± 99803.1159
         : individual accs = ['0.051599', '0.009993', '0.057584', '0.052850', '0.057932', '0.052484', '0.084665', '0.053116', '0.051062', '0.048398', '0.045619', '0.003577', '0.049597', '0.049559', '0.004195', '0.054852', '0.054418', '0.056180', '0.054358', '0.048450']
         : correct/total = [(213, 4128), (42, 4203), (235, 4081), (229, 4333), (237, 4091), (225, 4287), (355, 4193), (231, 4349), (214, 4191), (207, 4277), (189, 4143), (15, 4193), (203, 4093), (208, 4197), (17, 4052), (221, 4029), (226, 4153), (235, 4183), (222, 4084), (200, 4128)]
         : compromised: 0.0350, honest: 0.0550
Round 003: test acc mean=0.0526 ± 0.0065 | min=0.0446 max=0.0741
         : test loss mean=nan ± nan
         : individual accs = ['0.059593', '0.048775', '0.050968', '0.074083', '0.057932', '0.045253', '0.044598', '0.051276', '0.047960', '0.047463', '0.055274', '0.049606', '0.054239', '0.049083', '0.045656', '0.056342', '0.055141', '0.049486', '0.052889', '0.055475']
         : correct/total = [(246, 4128), (205, 4203), (208, 4081), (321, 4333), (237, 4091), (194, 4287), (187, 4193), (223, 4349), (201, 4191), (203, 4277), (229, 4143), (208, 4193), (222, 4093), (206, 4197), (185, 4052), (227, 4029), (229, 4153), (207, 4183), (216, 4084), (229, 4128)]
         : compromised: 0.0494, honest: 0.0547
Round 004: test acc mean=0.0569 ± 0.0134 | min=0.0453 max=0.0974
         : test loss mean=nan ± nan
         : individual accs = ['0.097384', '0.048775', '0.057584', '0.052850', '0.057932', '0.045253', '0.057000', '0.059094', '0.049630', '0.049334', '0.045619', '0.049606', '0.054239', '0.049083', '0.051826', '0.057086', '0.059957', '0.049486', '0.052889', '0.092539']
         : correct/total = [(402, 4128), (205, 4203), (235, 4081), (229, 4333), (237, 4091), (194, 4287), (239, 4193), (257, 4349), (208, 4191), (211, 4277), (189, 4143), (208, 4193), (222, 4093), (206, 4197), (210, 4052), (230, 4029), (249, 4153), (207, 4183), (216, 4084), (382, 4128)]
         : compromised: 0.0501, honest: 0.0613
Round 005: test acc mean=0.0598 ± 0.0152 | min=0.0453 max=0.0899
         : test loss mean=nan ± nan
         : individual accs = ['0.089874', '0.048775', '0.080372', '0.053312', '0.059154', '0.045253', '0.046745', '0.047827', '0.051062', '0.053776', '0.055998', '0.049606', '0.054239', '0.049083', '0.051826', '0.087863', '0.087166', '0.049486', '0.052889', '0.081638']
         : correct/total = [(371, 4128), (205, 4203), (328, 4081), (231, 4333), (242, 4091), (194, 4287), (196, 4193), (208, 4349), (214, 4191), (230, 4277), (232, 4143), (208, 4193), (222, 4093), (206, 4197), (210, 4052), (354, 4029), (362, 4153), (207, 4183), (216, 4084), (337, 4128)]
         : compromised: 0.0501, honest: 0.0662
Round 006: test acc mean=0.0544 ± 0.0076 | min=0.0439 max=0.0770
         : test loss mean=nan ± nan
         : individual accs = ['0.077035', '0.048775', '0.057584', '0.052850', '0.057932', '0.045253', '0.043883', '0.053116', '0.053209', '0.053776', '0.051171', '0.049606', '0.054239', '0.049083', '0.051826', '0.056590', '0.058993', '0.049486', '0.052889', '0.071221']
         : correct/total = [(318, 4128), (205, 4203), (235, 4081), (229, 4333), (237, 4091), (194, 4287), (184, 4193), (231, 4349), (223, 4191), (230, 4277), (212, 4143), (208, 4193), (222, 4093), (206, 4197), (210, 4052), (228, 4029), (245, 4153), (207, 4183), (216, 4084), (294, 4128)]
         : compromised: 0.0501, honest: 0.0573
Round 007: test acc mean=0.0670 ± 0.0294 | min=0.0448 max=0.1410
         : test loss mean=nan ± nan
         : individual accs = ['0.140988', '0.048775', '0.057584', '0.044773', '0.047421', '0.045253', '0.076795', '0.058174', '0.053209', '0.054010', '0.056239', '0.049606', '0.054239', '0.049083', '0.051826', '0.106478', '0.106429', '0.049486', '0.052889', '0.136386']
         : correct/total = [(582, 4128), (205, 4203), (235, 4081), (194, 4333), (194, 4091), (194, 4287), (322, 4193), (253, 4349), (223, 4191), (231, 4277), (233, 4143), (208, 4193), (222, 4093), (206, 4197), (210, 4052), (429, 4029), (442, 4153), (207, 4183), (216, 4084), (563, 4128)]
         : compromised: 0.0501, honest: 0.0782
Round 008: test acc mean=0.0641 ± 0.0281 | min=0.0452 max=0.1514
         : test loss mean=nan ± nan
         : individual accs = ['0.151405', '0.048775', '0.053418', '0.045234', '0.076998', '0.045253', '0.049130', '0.051276', '0.062038', '0.076923', '0.058895', '0.049606', '0.054239', '0.049083', '0.051826', '0.061554', '0.057308', '0.049486', '0.052889', '0.137112']
         : correct/total = [(625, 4128), (205, 4203), (218, 4081), (196, 4333), (315, 4091), (194, 4287), (206, 4193), (223, 4349), (260, 4191), (329, 4277), (244, 4143), (208, 4193), (222, 4093), (206, 4197), (210, 4052), (248, 4029), (238, 4153), (207, 4183), (216, 4084), (566, 4128)]
         : compromised: 0.0501, honest: 0.0734
Round 009: test acc mean=0.0561 ± 0.0111 | min=0.0453 max=0.0876
         : test loss mean=nan ± nan
         : individual accs = ['0.061773', '0.048775', '0.057584', '0.052850', '0.058176', '0.045253', '0.053899', '0.060704', '0.053209', '0.048398', '0.045619', '0.049606', '0.054239', '0.049083', '0.051826', '0.087615', '0.085721', '0.049486', '0.052889', '0.055717']
         : correct/total = [(255, 4128), (205, 4203), (235, 4081), (229, 4333), (238, 4091), (194, 4287), (226, 4193), (264, 4349), (223, 4191), (207, 4277), (189, 4143), (208, 4193), (222, 4093), (206, 4197), (210, 4052), (353, 4029), (356, 4153), (207, 4183), (216, 4084), (230, 4128)]
         : compromised: 0.0501, honest: 0.0601
Round 010: test acc mean=0.0594 ± 0.0163 | min=0.0453 max=0.1042
         : test loss mean=nan ± nan
         : individual accs = ['0.104167', '0.048775', '0.057584', '0.052850', '0.057932', '0.045253', '0.049130', '0.051276', '0.047960', '0.053776', '0.055998', '0.049606', '0.054239', '0.049083', '0.051826', '0.078431', '0.081869', '0.049486', '0.052889', '0.095203']
         : correct/total = [(430, 4128), (205, 4203), (235, 4081), (229, 4333), (237, 4091), (194, 4287), (206, 4193), (223, 4349), (201, 4191), (230, 4277), (232, 4143), (208, 4193), (222, 4093), (206, 4197), (210, 4052), (316, 4029), (340, 4153), (207, 4183), (216, 4084), (393, 4128)]
         : compromised: 0.0501, honest: 0.0655

=== FINAL RESULTS ===
Dataset: femnist, Nodes: 20, Graph: ring, Aggregation: balance
Attack: backdoor, 40.0% compromised
Final accuracy - Compromised: 0.0501, Honest: 0.0655
Overall test accuracy: mean=0.0594 ± 0.0163

=== BACKDOOR ATTACK SUCCESS RATE (ASR) ===
Target label: 0
Trigger size: 4x4
Overall ASR: 0.4000 ± 0.4899
Honest nodes ASR: 0.0000 ± 0.0000
Compromised nodes ASR: 1.0000 ± 0.0000
Note: Higher ASR indicates more successful backdoor attack

=== BALANCE SUMMARY ===
Node 0: acceptance=0.500
Node 1: acceptance=0.300
Node 2: acceptance=0.500
Node 3: acceptance=1.000
Node 4: acceptance=0.500
Node 5: acceptance=0.300
Node 6: acceptance=0.500
Node 7: acceptance=1.000
Node 8: acceptance=1.000
Node 9: acceptance=1.000
Node 10: acceptance=0.500
Node 11: acceptance=0.250
Node 12: acceptance=0.100
Node 13: acceptance=0.100
Node 14: acceptance=0.250
Node 15: acceptance=0.500
Node 16: acceptance=0.500
Node 17: acceptance=0.250
Node 18: acceptance=0.150
Node 19: acceptance=0.500

=== PARALLEL EXECUTION TIME (realistic for distributed system) ===
  COMMUNICATION (max across nodes):
    - Full model transfer: 0.000s (0.0%)
  COMPUTATION (max across nodes):
    - Filtering: 0.022s (68.8%)
    - Aggregation: 0.010s (31.2%)
  TOTALS:
    - Total computation: 0.031s (100.0%)
    - Total communication: 0.000s (0.0%)
    - Total parallel time: 0.032s

=== PER-NODE AVERAGE TIME ===
  - Filtering: 0.013s
  - Aggregation: 0.004s
  - Model transfer: 0.000s
  - Total per node: 0.017s

=== TOTAL COMPUTATIONAL WORK (sum across all nodes) ===
  - Total filtering: 0.262s
  - Total aggregation: 0.076s
  - Total model transfer: 0.000s
  - Grand total: 0.338s
  - Mean acceptance rate: 0.485

BALANCE Algorithm Properties:
  - Model dimension: 6,603,710
  - No compression: Full parameter comparison
  - Theoretical complexity: O(deg(i)×d)
  - Approach: Full parameter filtering + averaging
