Device: cuda
Seed: 987654321
Loading 36 LEAF FEMNIST train files...
LEAF FEMNIST train: 3597 users, 734463 samples
Loading 36 LEAF FEMNIST test files...
LEAF FEMNIST test: 3597 users, 83388 samples
Found 3597 train users, 3597 test users, 3597 common users
User sample counts range: 525 (max) to 17 (min)
Distributed ALL 3597 users across 20 clients
Users per client: 179 (with 17 clients getting +1 user)
Train partition sizes: [36360, 37070, 35957, 38262, 36024, 37732, 36921, 38328, 36867, 37683, 36507, 36915, 36007, 37001, 35681, 35453, 36585, 36801, 35964, 36345]
Test partition sizes: [4128, 4203, 4081, 4333, 4091, 4287, 4193, 4349, 4191, 4277, 4143, 4193, 4093, 4197, 4052, 4029, 4153, 4183, 4084, 4128]
  Client 0: 36360 train samples, 62 unique classes
  Client 1: 37070 train samples, 62 unique classes
  Client 2: 35957 train samples, 62 unique classes
  Client 3: 38262 train samples, 62 unique classes
  Client 4: 36024 train samples, 62 unique classes
  Client 5: 37732 train samples, 62 unique classes
  Client 6: 36921 train samples, 62 unique classes
  Client 7: 38328 train samples, 62 unique classes
  Client 8: 36867 train samples, 62 unique classes
  Client 9: 37683 train samples, 62 unique classes
  Client 10: 36507 train samples, 62 unique classes
  Client 11: 36915 train samples, 62 unique classes
  Client 12: 36007 train samples, 62 unique classes
  Client 13: 37001 train samples, 62 unique classes
  Client 14: 35681 train samples, 62 unique classes
  Client 15: 35453 train samples, 62 unique classes
  Client 16: 36585 train samples, 62 unique classes
  Client 17: 36801 train samples, 62 unique classes
  Client 18: 35964 train samples, 62 unique classes
  Client 19: 36345 train samples, 62 unique classes
Will sample 4500 samples per client per epoch
Graph: ring, nodes: 20, edges: 20
Degree statistics: avg=2.00, min=2, max=2
Attack: Compromised 14/20 nodes: [1, 2, 3, 5, 6, 8, 11, 12, 13, 14, 15, 17, 18, 19]
Attack type: directed_deviation, lambda: 1.0
Model variant: baseline
Model parameters: 6,603,710
Initial test acc across nodes: mean=0.0168 ± 0.0139
Round 001: test acc mean=0.0234 ± 0.0178 | min=0.0052 max=0.0582
         : test loss mean=109242.0630 ± 112740.6810
         : individual accs = ['0.008963', '0.051630', '0.024994', '0.036464', '0.052554', '0.032190', '0.018602', '0.058174', '0.006920', '0.039280', '0.011827', '0.009540', '0.005864', '0.015249', '0.005183', '0.005212', '0.006261', '0.049008', '0.014691', '0.015988']
         : correct/total = [(37, 4128), (217, 4203), (102, 4081), (158, 4333), (215, 4091), (138, 4287), (78, 4193), (253, 4349), (29, 4191), (168, 4277), (49, 4143), (40, 4193), (24, 4093), (64, 4197), (21, 4052), (21, 4029), (26, 4153), (205, 4183), (60, 4084), (66, 4128)]
         : compromised: 0.0208, honest: 0.0295
Round 002: test acc mean=0.0485 ± 0.0039 | min=0.0422 max=0.0539
         : test loss mean=13187609037.6068 ± 21684073782.7028
         : individual accs = ['0.047238', '0.048775', '0.050723', '0.043157', '0.043021', '0.045253', '0.053899', '0.043918', '0.042233', '0.048398', '0.045619', '0.046983', '0.053750', '0.046938', '0.048124', '0.053611', '0.053937', '0.052833', '0.052889', '0.048692']
         : correct/total = [(195, 4128), (205, 4203), (207, 4081), (187, 4333), (176, 4091), (194, 4287), (226, 4193), (191, 4349), (177, 4191), (207, 4277), (189, 4143), (197, 4193), (220, 4093), (197, 4197), (195, 4052), (216, 4029), (224, 4153), (221, 4183), (216, 4084), (201, 4128)]
         : compromised: 0.0491, honest: 0.0470
Round 003: test acc mean=0.0431 ± 0.0086 | min=0.0250 max=0.0545
         : test loss mean=47669223.7785 ± 96948582.9216
         : individual accs = ['0.050145', '0.048775', '0.024994', '0.048465', '0.051088', '0.048052', '0.033389', '0.041389', '0.034359', '0.043488', '0.048033', '0.049606', '0.033716', '0.028592', '0.037759', '0.051378', '0.049362', '0.051159', '0.033301', '0.054506']
         : correct/total = [(207, 4128), (205, 4203), (102, 4081), (210, 4333), (209, 4091), (206, 4287), (140, 4193), (180, 4349), (144, 4191), (186, 4277), (199, 4143), (208, 4193), (138, 4093), (120, 4197), (153, 4052), (207, 4029), (205, 4153), (214, 4183), (136, 4084), (225, 4128)]
         : compromised: 0.0413, honest: 0.0473
Round 004: test acc mean=0.0464 ± 0.0131 | min=0.0031 max=0.0579
         : test loss mean=21841423.1605 ± 25939806.4223
         : individual accs = ['0.050145', '0.049726', '0.050723', '0.052850', '0.057932', '0.050618', '0.003100', '0.047827', '0.013839', '0.047463', '0.055274', '0.049606', '0.053750', '0.046938', '0.048124', '0.051378', '0.049362', '0.051159', '0.052889', '0.045058']
         : correct/total = [(207, 4128), (209, 4203), (207, 4081), (229, 4333), (237, 4091), (217, 4287), (13, 4193), (208, 4349), (58, 4191), (203, 4277), (229, 4143), (208, 4193), (220, 4093), (197, 4197), (195, 4052), (207, 4029), (205, 4153), (214, 4183), (216, 4084), (186, 4128)]
         : compromised: 0.0443, honest: 0.0513
Round 005: test acc mean=0.0497 ± 0.0042 | min=0.0435 max=0.0583
         : test loss mean=1603642.1033 ± 6070889.1919
         : individual accs = ['0.050145', '0.049726', '0.048763', '0.047773', '0.044977', '0.057849', '0.050799', '0.045068', '0.054880', '0.043488', '0.048033', '0.049606', '0.050818', '0.049559', '0.046644', '0.056590', '0.058271', '0.050920', '0.045788', '0.045058']
         : correct/total = [(207, 4128), (209, 4203), (199, 4081), (207, 4333), (184, 4091), (248, 4287), (213, 4193), (196, 4349), (230, 4191), (186, 4277), (199, 4143), (208, 4193), (208, 4093), (208, 4197), (189, 4052), (228, 4029), (242, 4153), (213, 4183), (187, 4084), (186, 4128)]
         : compromised: 0.0503, honest: 0.0483
Round 006: test acc mean=0.0510 ± 0.0038 | min=0.0455 max=0.0596
         : test loss mean=7988577.0353 ± 16406962.1208
         : individual accs = ['0.059593', '0.052344', '0.048272', '0.052850', '0.057932', '0.050618', '0.048891', '0.045528', '0.053209', '0.047463', '0.055274', '0.046745', '0.045688', '0.046462', '0.050346', '0.051378', '0.049362', '0.051159', '0.050930', '0.055475']
         : correct/total = [(246, 4128), (220, 4203), (197, 4081), (229, 4333), (237, 4091), (217, 4287), (205, 4193), (198, 4349), (223, 4191), (203, 4277), (229, 4143), (196, 4193), (187, 4093), (195, 4197), (204, 4052), (207, 4029), (205, 4153), (214, 4183), (208, 4084), (229, 4128)]
         : compromised: 0.0503, honest: 0.0525
Round 007: test acc mean=0.0420 ± 0.0126 | min=0.0129 max=0.0578
         : test loss mean=38847.9319 ± 92254.3706
         : individual accs = ['0.045785', '0.042589', '0.048763', '0.047773', '0.044977', '0.057849', '0.044598', '0.049207', '0.034359', '0.043488', '0.048033', '0.053899', '0.050818', '0.049559', '0.046644', '0.012906', '0.013484', '0.015300', '0.045788', '0.044331']
         : correct/total = [(189, 4128), (179, 4203), (199, 4081), (207, 4333), (184, 4091), (248, 4287), (187, 4193), (214, 4349), (144, 4191), (186, 4277), (199, 4143), (226, 4193), (208, 4093), (208, 4197), (189, 4052), (52, 4029), (56, 4153), (64, 4183), (187, 4084), (183, 4128)]
         : compromised: 0.0425, honest: 0.0408
Round 008: test acc mean=0.0510 ± 0.0068 | min=0.0326 max=0.0596
         : test loss mean=6954735467234.4756 ± 12047443928191.8555
         : individual accs = ['0.059593', '0.052344', '0.053418', '0.052850', '0.057932', '0.050618', '0.053899', '0.043918', '0.051539', '0.033668', '0.032585', '0.053184', '0.054239', '0.049083', '0.051826', '0.056342', '0.055141', '0.050203', '0.052889', '0.055475']
         : correct/total = [(246, 4128), (220, 4203), (218, 4081), (229, 4333), (237, 4091), (217, 4287), (226, 4193), (191, 4349), (216, 4191), (144, 4277), (135, 4143), (223, 4193), (222, 4093), (206, 4197), (210, 4052), (227, 4029), (229, 4153), (210, 4183), (216, 4084), (229, 4128)]
         : compromised: 0.0527, honest: 0.0471
Round 009: test acc mean=0.0482 ± 0.0076 | min=0.0293 max=0.0596
         : test loss mean=5920970.7805 ± 20108607.0851
         : individual accs = ['0.059593', '0.052344', '0.048272', '0.033003', '0.029333', '0.034756', '0.053899', '0.043918', '0.051539', '0.047463', '0.055274', '0.053184', '0.045688', '0.046462', '0.050346', '0.051378', '0.049362', '0.051159', '0.050930', '0.055475']
         : correct/total = [(246, 4128), (220, 4203), (197, 4081), (143, 4333), (120, 4091), (149, 4287), (226, 4193), (191, 4349), (216, 4191), (203, 4277), (229, 4143), (223, 4193), (187, 4093), (195, 4197), (204, 4052), (207, 4029), (205, 4153), (214, 4183), (208, 4084), (229, 4128)]
         : compromised: 0.0485, honest: 0.0475
Round 010: test acc mean=0.0423 ± 0.0126 | min=0.0147 max=0.0539
         : test loss mean=3292689.5408 ± 7836192.5722
         : individual accs = ['0.050145', '0.049726', '0.048272', '0.048465', '0.029333', '0.034756', '0.043883', '0.053116', '0.051062', '0.046528', '0.051171', '0.053899', '0.045688', '0.046462', '0.050346', '0.014892', '0.014688', '0.016734', '0.050930', '0.045058']
         : correct/total = [(207, 4128), (209, 4203), (197, 4081), (210, 4333), (120, 4091), (149, 4287), (184, 4193), (231, 4349), (214, 4191), (199, 4277), (212, 4143), (226, 4193), (187, 4093), (195, 4197), (204, 4052), (60, 4029), (61, 4153), (70, 4183), (208, 4084), (186, 4128)]
         : compromised: 0.0429, honest: 0.0408

=== FINAL RESULTS ===
Dataset: femnist, Nodes: 20, Graph: ring, Aggregation: d-fedavg
Attack: directed_deviation, 70.0% compromised
Final accuracy - Compromised: 0.0429, Honest: 0.0408
Overall test accuracy: mean=0.0423 ± 0.0126
