Device: cuda
Seed: 987654321
Loading 36 LEAF FEMNIST train files...
LEAF FEMNIST train: 3597 users, 734463 samples
Loading 36 LEAF FEMNIST test files...
LEAF FEMNIST test: 3597 users, 83388 samples
Found 3597 train users, 3597 test users, 3597 common users
User sample counts range: 525 (max) to 17 (min)
Distributed ALL 3597 users across 20 clients
Users per client: 179 (with 17 clients getting +1 user)
Train partition sizes: [36360, 37070, 35957, 38262, 36024, 37732, 36921, 38328, 36867, 37683, 36507, 36915, 36007, 37001, 35681, 35453, 36585, 36801, 35964, 36345]
Test partition sizes: [4128, 4203, 4081, 4333, 4091, 4287, 4193, 4349, 4191, 4277, 4143, 4193, 4093, 4197, 4052, 4029, 4153, 4183, 4084, 4128]
  Client 0: 36360 train samples, 62 unique classes
  Client 1: 37070 train samples, 62 unique classes
  Client 2: 35957 train samples, 62 unique classes
  Client 3: 38262 train samples, 62 unique classes
  Client 4: 36024 train samples, 62 unique classes
  Client 5: 37732 train samples, 62 unique classes
  Client 6: 36921 train samples, 62 unique classes
  Client 7: 38328 train samples, 62 unique classes
  Client 8: 36867 train samples, 62 unique classes
  Client 9: 37683 train samples, 62 unique classes
  Client 10: 36507 train samples, 62 unique classes
  Client 11: 36915 train samples, 62 unique classes
  Client 12: 36007 train samples, 62 unique classes
  Client 13: 37001 train samples, 62 unique classes
  Client 14: 35681 train samples, 62 unique classes
  Client 15: 35453 train samples, 62 unique classes
  Client 16: 36585 train samples, 62 unique classes
  Client 17: 36801 train samples, 62 unique classes
  Client 18: 35964 train samples, 62 unique classes
  Client 19: 36345 train samples, 62 unique classes
Will sample 4500 samples per client per epoch
Graph: ring, nodes: 20, edges: 20
Degree statistics: avg=2.00, min=2, max=2
Attack: Compromised 16/20 nodes: [1, 2, 3, 5, 6, 8, 9, 10, 11, 12, 13, 14, 15, 17, 18, 19]
Attack type: krum, lambda: 1.0
Model variant: baseline
Model parameters: 6,603,710
BALANCE algorithm:
Balance Config: BALANCEConfig(gamma=2, kappa=1, alpha=0.5, min_neighbors=1)
  - Model dimension: 6,603,710 parameters
  - Complexity: O(N×d) = O(20×6,603,710)
Initial test acc across nodes: mean=0.0168 ± 0.0139
Round 001: test acc mean=0.0324 ± 0.0195 | min=0.0032 max=0.0578
         : test loss mean=12455.2829 ± 11712.3245
         : individual accs = ['0.011628', '0.052344', '0.013967', '0.043157', '0.052554', '0.057849', '0.044598', '0.057025', '0.047960', '0.013795', '0.010138', '0.014071', '0.006108', '0.035978', '0.003208', '0.050385', '0.014929', '0.050920', '0.017630', '0.050145']
         : correct/total = [(48, 4128), (220, 4203), (57, 4081), (187, 4333), (215, 4091), (248, 4287), (187, 4193), (248, 4349), (201, 4191), (59, 4277), (42, 4143), (59, 4193), (25, 4093), (151, 4197), (13, 4052), (203, 4029), (62, 4153), (213, 4183), (72, 4084), (207, 4128)]
         : compromised: 0.0320, honest: 0.0340
Round 002: test acc mean=0.0517 ± 0.0043 | min=0.0451 max=0.0596
         : test loss mean=92566339.5555 ± 96536117.9350
         : individual accs = ['0.059593', '0.048775', '0.057584', '0.052850', '0.057932', '0.050618', '0.046745', '0.045068', '0.054880', '0.047229', '0.055998', '0.046745', '0.048620', '0.049083', '0.051579', '0.056590', '0.047195', '0.048291', '0.054358', '0.054506']
         : correct/total = [(246, 4128), (205, 4203), (235, 4081), (229, 4333), (237, 4091), (217, 4287), (196, 4193), (196, 4349), (230, 4191), (202, 4277), (232, 4143), (196, 4193), (199, 4093), (206, 4197), (209, 4052), (228, 4029), (196, 4153), (202, 4183), (222, 4084), (225, 4128)]
         : compromised: 0.0515, honest: 0.0524
Round 003: test acc mean=0.0493 ± 0.0054 | min=0.0378 max=0.0624
         : test loss mean=199897631.4238 ± 446298756.4389
         : individual accs = ['0.050145', '0.048775', '0.055134', '0.048465', '0.051088', '0.048052', '0.044598', '0.049207', '0.042233', '0.039280', '0.048033', '0.049606', '0.053750', '0.062426', '0.037759', '0.051378', '0.049362', '0.051159', '0.051665', '0.054506']
         : correct/total = [(207, 4128), (205, 4203), (225, 4081), (210, 4333), (209, 4091), (206, 4287), (187, 4193), (214, 4349), (177, 4191), (168, 4277), (199, 4143), (208, 4193), (220, 4093), (262, 4197), (153, 4052), (207, 4029), (205, 4153), (214, 4183), (211, 4084), (225, 4128)]
         : compromised: 0.0492, honest: 0.0500
Round 004: test acc mean=0.0507 ± 0.0048 | min=0.0422 max=0.0609
         : test loss mean=309938849.7312 ± 730876946.8010
         : individual accs = ['0.050145', '0.060909', '0.053418', '0.046619', '0.052554', '0.045953', '0.044598', '0.049207', '0.042233', '0.043488', '0.048033', '0.049606', '0.054239', '0.049559', '0.051826', '0.054852', '0.052011', '0.053311', '0.051665', '0.060320']
         : correct/total = [(207, 4128), (256, 4203), (218, 4081), (202, 4333), (215, 4091), (197, 4287), (187, 4193), (214, 4349), (177, 4191), (186, 4277), (199, 4143), (208, 4193), (222, 4093), (208, 4197), (210, 4052), (221, 4029), (216, 4153), (223, 4183), (211, 4084), (249, 4128)]
         : compromised: 0.0507, honest: 0.0510
Round 005: test acc mean=0.0495 ± 0.0038 | min=0.0408 max=0.0555
         : test loss mean=128255.4974 ± 551991.6662
         : individual accs = ['0.050145', '0.052344', '0.053418', '0.046619', '0.052554', '0.045953', '0.044598', '0.049207', '0.040802', '0.043488', '0.048033', '0.046983', '0.054239', '0.047177', '0.051826', '0.051378', '0.052011', '0.051159', '0.051665', '0.055475']
         : correct/total = [(207, 4128), (220, 4203), (218, 4081), (202, 4333), (215, 4091), (197, 4287), (187, 4193), (214, 4349), (171, 4191), (186, 4277), (199, 4143), (197, 4193), (222, 4093), (198, 4197), (210, 4052), (207, 4029), (216, 4153), (214, 4183), (211, 4084), (229, 4128)]
         : compromised: 0.0491, honest: 0.0510
Round 006: test acc mean=0.0482 ± 0.0041 | min=0.0408 max=0.0542
         : test loss mean=42688.4956 ± 184592.0144
         : individual accs = ['0.050145', '0.050916', '0.053418', '0.043388', '0.043021', '0.052484', '0.044598', '0.041619', '0.040802', '0.043488', '0.048033', '0.046983', '0.054239', '0.046462', '0.051826', '0.050633', '0.052011', '0.048291', '0.051665', '0.050145']
         : correct/total = [(207, 4128), (214, 4203), (218, 4081), (188, 4333), (176, 4091), (225, 4287), (187, 4193), (181, 4349), (171, 4191), (186, 4277), (199, 4143), (197, 4193), (222, 4093), (195, 4197), (210, 4052), (204, 4029), (216, 4153), (202, 4183), (211, 4084), (207, 4128)]
         : compromised: 0.0486, honest: 0.0467
Round 007: test acc mean=0.0475 ± 0.0039 | min=0.0408 max=0.0542
         : test loss mean=3383.9276 ± 14515.6250
         : individual accs = ['0.050145', '0.048775', '0.048763', '0.043157', '0.043021', '0.045253', '0.042213', '0.041619', '0.040802', '0.043488', '0.048033', '0.046983', '0.054239', '0.049083', '0.051826', '0.051626', '0.052011', '0.049486', '0.051665', '0.048692']
         : correct/total = [(207, 4128), (205, 4203), (199, 4081), (187, 4333), (176, 4091), (194, 4287), (177, 4193), (181, 4349), (171, 4191), (186, 4277), (199, 4143), (197, 4193), (222, 4093), (206, 4197), (210, 4052), (208, 4029), (216, 4153), (207, 4183), (211, 4084), (201, 4128)]
         : compromised: 0.0478, honest: 0.0467
Round 008: test acc mean=0.0474 ± 0.0038 | min=0.0407 max=0.0532
         : test loss mean=31.2556 ± 20.7975
         : individual accs = ['0.045785', '0.051630', '0.048763', '0.043388', '0.043021', '0.052484', '0.044598', '0.041619', '0.042233', '0.046528', '0.051171', '0.053184', '0.050818', '0.049559', '0.046644', '0.051626', '0.040693', '0.049486', '0.045788', '0.048450']
         : correct/total = [(189, 4128), (217, 4203), (199, 4081), (188, 4333), (176, 4091), (225, 4287), (187, 4193), (181, 4349), (177, 4191), (199, 4277), (212, 4143), (223, 4193), (208, 4093), (208, 4197), (189, 4052), (208, 4029), (169, 4153), (207, 4183), (187, 4084), (200, 4128)]
         : compromised: 0.0485, honest: 0.0428
Round 009: test acc mean=0.0477 ± 0.0039 | min=0.0407 max=0.0563
         : test loss mean=6.0081 ± 8.5847
         : individual accs = ['0.045785', '0.048775', '0.048763', '0.048465', '0.043266', '0.048052', '0.043883', '0.041619', '0.051062', '0.046528', '0.051171', '0.041736', '0.050818', '0.049559', '0.051826', '0.056342', '0.040693', '0.050203', '0.045788', '0.048692']
         : correct/total = [(189, 4128), (205, 4203), (199, 4081), (210, 4333), (177, 4091), (206, 4287), (184, 4193), (181, 4349), (214, 4191), (199, 4277), (212, 4143), (175, 4193), (208, 4093), (208, 4197), (210, 4052), (227, 4029), (169, 4153), (210, 4183), (187, 4084), (201, 4128)]
         : compromised: 0.0489, honest: 0.0428
Round 010: test acc mean=0.0476 ± 0.0037 | min=0.0407 max=0.0563
         : test loss mean=4.4330 ± 0.3776
         : individual accs = ['0.045785', '0.051630', '0.048763', '0.048465', '0.043266', '0.048052', '0.049130', '0.041619', '0.047960', '0.046528', '0.051171', '0.041736', '0.050818', '0.049559', '0.046644', '0.056342', '0.040693', '0.050203', '0.045788', '0.048450']
         : correct/total = [(189, 4128), (217, 4203), (199, 4081), (210, 4333), (177, 4091), (206, 4287), (206, 4193), (181, 4349), (201, 4191), (199, 4277), (212, 4143), (175, 4193), (208, 4093), (208, 4197), (189, 4052), (227, 4029), (169, 4153), (210, 4183), (187, 4084), (200, 4128)]
         : compromised: 0.0488, honest: 0.0428

=== FINAL RESULTS ===
Dataset: femnist, Nodes: 20, Graph: ring, Aggregation: balance
Attack: krum, 80.0% compromised
Final accuracy - Compromised: 0.0488, Honest: 0.0428
Overall test accuracy: mean=0.0476 ± 0.0037

=== BALANCE SUMMARY ===
Node 0: acceptance=0.900
Node 1: acceptance=0.650
Node 2: acceptance=0.500
Node 3: acceptance=0.450
Node 4: acceptance=0.600
Node 5: acceptance=0.450
Node 6: acceptance=0.550
Node 7: acceptance=0.700
Node 8: acceptance=0.550
Node 9: acceptance=0.700
Node 10: acceptance=0.700
Node 11: acceptance=0.700
Node 12: acceptance=0.600
Node 13: acceptance=0.700
Node 14: acceptance=0.800
Node 15: acceptance=0.450
Node 16: acceptance=0.700
Node 17: acceptance=0.450
Node 18: acceptance=0.600
Node 19: acceptance=0.650

=== PARALLEL EXECUTION TIME (realistic for distributed system) ===
  COMMUNICATION (max across nodes):
    - Full model transfer: 0.001s (1.6%)
  COMPUTATION (max across nodes):
    - Filtering: 0.022s (63.8%)
    - Aggregation: 0.012s (34.6%)
  TOTALS:
    - Total computation: 0.034s (98.4%)
    - Total communication: 0.001s (1.6%)
    - Total parallel time: 0.034s

=== PER-NODE AVERAGE TIME ===
  - Filtering: 0.015s
  - Aggregation: 0.004s
  - Model transfer: 0.000s
  - Total per node: 0.019s

=== TOTAL COMPUTATIONAL WORK (sum across all nodes) ===
  - Total filtering: 0.298s
  - Total aggregation: 0.072s
  - Total model transfer: 0.001s
  - Grand total: 0.371s
  - Mean acceptance rate: 0.620

BALANCE Algorithm Properties:
  - Model dimension: 6,603,710
  - No compression: Full parameter comparison
  - Theoretical complexity: O(deg(i)×d)
  - Approach: Full parameter filtering + averaging
