Device: cuda
Seed: 987654321
Loading 36 LEAF FEMNIST train files...
LEAF FEMNIST train: 3597 users, 734463 samples
Loading 36 LEAF FEMNIST test files...
LEAF FEMNIST test: 3597 users, 83388 samples
Found 3597 train users, 3597 test users, 3597 common users
User sample counts range: 525 (max) to 17 (min)
Distributed ALL 3597 users across 20 clients
Users per client: 179 (with 17 clients getting +1 user)
Train partition sizes: [36360, 37070, 35957, 38262, 36024, 37732, 36921, 38328, 36867, 37683, 36507, 36915, 36007, 37001, 35681, 35453, 36585, 36801, 35964, 36345]
Test partition sizes: [4128, 4203, 4081, 4333, 4091, 4287, 4193, 4349, 4191, 4277, 4143, 4193, 4093, 4197, 4052, 4029, 4153, 4183, 4084, 4128]
  Client 0: 36360 train samples, 62 unique classes
  Client 1: 37070 train samples, 62 unique classes
  Client 2: 35957 train samples, 62 unique classes
  Client 3: 38262 train samples, 62 unique classes
  Client 4: 36024 train samples, 62 unique classes
  Client 5: 37732 train samples, 62 unique classes
  Client 6: 36921 train samples, 62 unique classes
  Client 7: 38328 train samples, 62 unique classes
  Client 8: 36867 train samples, 62 unique classes
  Client 9: 37683 train samples, 62 unique classes
  Client 10: 36507 train samples, 62 unique classes
  Client 11: 36915 train samples, 62 unique classes
  Client 12: 36007 train samples, 62 unique classes
  Client 13: 37001 train samples, 62 unique classes
  Client 14: 35681 train samples, 62 unique classes
  Client 15: 35453 train samples, 62 unique classes
  Client 16: 36585 train samples, 62 unique classes
  Client 17: 36801 train samples, 62 unique classes
  Client 18: 35964 train samples, 62 unique classes
  Client 19: 36345 train samples, 62 unique classes
Will sample 4500 samples per client per epoch
Graph: fully, nodes: 20, edges: 190
Degree statistics: avg=19.00, min=19, max=19
Attack: Compromised 8/20 nodes: [1, 5, 11, 12, 13, 14, 17, 18]
Attack type: directed_deviation, lambda: 1.0
Model variant: baseline
Model parameters: 6,603,710
Initial test acc across nodes: mean=0.0168 ± 0.0139
Round 001: test acc mean=0.0153 ± 0.0139 | min=0.0023 max=0.0523
         : test loss mean=7458.6142 ± 2150.6647
         : individual accs = ['0.006298', '0.052344', '0.007596', '0.023771', '0.002933', '0.011197', '0.013117', '0.021384', '0.005249', '0.002338', '0.010620', '0.006201', '0.033472', '0.005718', '0.046397', '0.002730', '0.015411', '0.023189', '0.007101', '0.009690']
         : correct/total = [(26, 4128), (220, 4203), (31, 4081), (103, 4333), (12, 4091), (48, 4287), (55, 4193), (93, 4349), (22, 4191), (10, 4277), (44, 4143), (26, 4193), (137, 4093), (24, 4197), (188, 4052), (11, 4029), (64, 4153), (97, 4183), (29, 4084), (40, 4128)]
         : compromised: 0.0232, honest: 0.0101
Round 002: test acc mean=0.0353 ± 0.0034 | min=0.0261 max=0.0396
         : test loss mean=391.6903 ± 5.1658
         : individual accs = ['0.029070', '0.036878', '0.035531', '0.038311', '0.037644', '0.036856', '0.035535', '0.035640', '0.037700', '0.036708', '0.039585', '0.036728', '0.036404', '0.037408', '0.032330', '0.026061', '0.030340', '0.039445', '0.032321', '0.035853']
         : correct/total = [(120, 4128), (155, 4203), (145, 4081), (166, 4333), (154, 4091), (158, 4287), (149, 4193), (155, 4349), (158, 4191), (157, 4277), (164, 4143), (154, 4193), (149, 4093), (157, 4197), (131, 4052), (105, 4029), (126, 4153), (165, 4183), (132, 4084), (148, 4128)]
         : compromised: 0.0360, honest: 0.0348
Round 003: test acc mean=0.0493 ± 0.0035 | min=0.0430 max=0.0545
         : test loss mean=52.2984 ± 1.1709
         : individual accs = ['0.050145', '0.048775', '0.053418', '0.043157', '0.043021', '0.045253', '0.050799', '0.045068', '0.049630', '0.043488', '0.048033', '0.049606', '0.054239', '0.049083', '0.051826', '0.051626', '0.052011', '0.049486', '0.052889', '0.054506']
         : correct/total = [(207, 4128), (205, 4203), (218, 4081), (187, 4333), (176, 4091), (194, 4287), (213, 4193), (196, 4349), (208, 4191), (186, 4277), (199, 4143), (208, 4193), (222, 4093), (206, 4197), (210, 4052), (208, 4029), (216, 4153), (207, 4183), (216, 4084), (225, 4128)]
         : compromised: 0.0501, honest: 0.0487
Round 004: test acc mean=0.0493 ± 0.0035 | min=0.0430 max=0.0545
         : test loss mean=7.0039 ± 0.0936
         : individual accs = ['0.050145', '0.048775', '0.053418', '0.043157', '0.043021', '0.045253', '0.050799', '0.045068', '0.049630', '0.043488', '0.048033', '0.049606', '0.054239', '0.049083', '0.051826', '0.051626', '0.052011', '0.049486', '0.052889', '0.054506']
         : correct/total = [(207, 4128), (205, 4203), (218, 4081), (187, 4333), (176, 4091), (194, 4287), (213, 4193), (196, 4349), (208, 4191), (186, 4277), (199, 4143), (208, 4193), (222, 4093), (206, 4197), (210, 4052), (208, 4029), (216, 4153), (207, 4183), (216, 4084), (225, 4128)]
         : compromised: 0.0501, honest: 0.0487
Round 005: test acc mean=0.0499 ± 0.0033 | min=0.0439 max=0.0553
         : test loss mean=4.1199 ± 0.0023
         : individual accs = ['0.049661', '0.050916', '0.054889', '0.046619', '0.052066', '0.045953', '0.043883', '0.053116', '0.051062', '0.044891', '0.047550', '0.054376', '0.052040', '0.055278', '0.045656', '0.050881', '0.051047', '0.048291', '0.050196', '0.050145']
         : correct/total = [(205, 4128), (214, 4203), (224, 4081), (202, 4333), (213, 4091), (197, 4287), (184, 4193), (231, 4349), (214, 4191), (192, 4277), (197, 4143), (228, 4193), (213, 4093), (232, 4197), (185, 4052), (205, 4029), (212, 4153), (202, 4183), (205, 4084), (207, 4128)]
         : compromised: 0.0503, honest: 0.0497
Round 006: test acc mean=0.0544 ± 0.0040 | min=0.0457 max=0.0612
         : test loss mean=4.0452 ± 0.0103
         : individual accs = ['0.059593', '0.052344', '0.057584', '0.052850', '0.057932', '0.050618', '0.057000', '0.058174', '0.051539', '0.047463', '0.055998', '0.053899', '0.049841', '0.045747', '0.061204', '0.056590', '0.058271', '0.050920', '0.055583', '0.055475']
         : correct/total = [(246, 4128), (220, 4203), (235, 4081), (229, 4333), (237, 4091), (217, 4287), (239, 4193), (253, 4349), (216, 4191), (203, 4277), (232, 4143), (226, 4193), (204, 4093), (192, 4197), (248, 4052), (228, 4029), (242, 4153), (213, 4183), (227, 4084), (229, 4128)]
         : compromised: 0.0525, honest: 0.0557
Round 007: test acc mean=0.0487 ± 0.0031 | min=0.0422 max=0.0527
         : test loss mean=4.0238 ± 0.0041
         : individual accs = ['0.050145', '0.049726', '0.052683', '0.043388', '0.052554', '0.052484', '0.044598', '0.049207', '0.042233', '0.048398', '0.045619', '0.046983', '0.050574', '0.047177', '0.051826', '0.050633', '0.051288', '0.048291', '0.051665', '0.045058']
         : correct/total = [(207, 4128), (209, 4203), (215, 4081), (188, 4333), (215, 4091), (225, 4287), (187, 4193), (214, 4349), (177, 4191), (207, 4277), (189, 4143), (197, 4193), (207, 4093), (198, 4197), (210, 4052), (204, 4029), (213, 4153), (202, 4183), (211, 4084), (186, 4128)]
         : compromised: 0.0498, honest: 0.0480
Round 008: test acc mean=0.0514 ± 0.0034 | min=0.0469 max=0.0618
         : test loss mean=3.9545 ± 0.0098
         : individual accs = ['0.051599', '0.051630', '0.050723', '0.048465', '0.051088', '0.048052', '0.049130', '0.051276', '0.047960', '0.053075', '0.050447', '0.061770', '0.053750', '0.046938', '0.048124', '0.056342', '0.055141', '0.050203', '0.052889', '0.048450']
         : correct/total = [(213, 4128), (217, 4203), (207, 4081), (210, 4333), (209, 4091), (206, 4287), (206, 4193), (223, 4349), (201, 4191), (227, 4277), (209, 4143), (259, 4193), (220, 4093), (197, 4197), (195, 4052), (227, 4029), (229, 4153), (210, 4183), (216, 4084), (200, 4128)]
         : compromised: 0.0517, honest: 0.0511
Round 009: test acc mean=0.0487 ± 0.0031 | min=0.0422 max=0.0527
         : test loss mean=3.9773 ± 0.0055
         : individual accs = ['0.050145', '0.049726', '0.052683', '0.043388', '0.052554', '0.052484', '0.044598', '0.049207', '0.042233', '0.048398', '0.045619', '0.046983', '0.050574', '0.047177', '0.051826', '0.050633', '0.051288', '0.048291', '0.051665', '0.045058']
         : correct/total = [(207, 4128), (209, 4203), (215, 4081), (188, 4333), (215, 4091), (225, 4287), (187, 4193), (214, 4349), (177, 4191), (207, 4277), (189, 4143), (197, 4193), (207, 4093), (198, 4197), (210, 4052), (204, 4029), (213, 4153), (202, 4183), (211, 4084), (186, 4128)]
         : compromised: 0.0498, honest: 0.0480
Round 010: test acc mean=0.0514 ± 0.0034 | min=0.0469 max=0.0618
         : test loss mean=3.8967 ± 0.0108
         : individual accs = ['0.051599', '0.051630', '0.050723', '0.048465', '0.051088', '0.048052', '0.049130', '0.051276', '0.047960', '0.053075', '0.050447', '0.061770', '0.053750', '0.046938', '0.048124', '0.056342', '0.055141', '0.050203', '0.052889', '0.048450']
         : correct/total = [(213, 4128), (217, 4203), (207, 4081), (210, 4333), (209, 4091), (206, 4287), (206, 4193), (223, 4349), (201, 4191), (227, 4277), (209, 4143), (259, 4193), (220, 4093), (197, 4197), (195, 4052), (227, 4029), (229, 4153), (210, 4183), (216, 4084), (200, 4128)]
         : compromised: 0.0517, honest: 0.0511

=== FINAL RESULTS ===
Dataset: femnist, Nodes: 20, Graph: fully, Aggregation: d-fedavg
Attack: directed_deviation, 40.0% compromised
Final accuracy - Compromised: 0.0517, Honest: 0.0511
Overall test accuracy: mean=0.0514 ± 0.0034
