Device: cuda
Seed: 987654321
Loading 36 LEAF FEMNIST train files...
LEAF FEMNIST train: 3597 users, 734463 samples
Loading 36 LEAF FEMNIST test files...
LEAF FEMNIST test: 3597 users, 83388 samples
Found 3597 train users, 3597 test users, 3597 common users
User sample counts range: 525 (max) to 17 (min)
Distributed ALL 3597 users across 20 clients
Users per client: 179 (with 17 clients getting +1 user)
Train partition sizes: [36360, 37070, 35957, 38262, 36024, 37732, 36921, 38328, 36867, 37683, 36507, 36915, 36007, 37001, 35681, 35453, 36585, 36801, 35964, 36345]
Test partition sizes: [4128, 4203, 4081, 4333, 4091, 4287, 4193, 4349, 4191, 4277, 4143, 4193, 4093, 4197, 4052, 4029, 4153, 4183, 4084, 4128]
  Client 0: 36360 train samples, 62 unique classes
  Client 1: 37070 train samples, 62 unique classes
  Client 2: 35957 train samples, 62 unique classes
  Client 3: 38262 train samples, 62 unique classes
  Client 4: 36024 train samples, 62 unique classes
  Client 5: 37732 train samples, 62 unique classes
  Client 6: 36921 train samples, 62 unique classes
  Client 7: 38328 train samples, 62 unique classes
  Client 8: 36867 train samples, 62 unique classes
  Client 9: 37683 train samples, 62 unique classes
  Client 10: 36507 train samples, 62 unique classes
  Client 11: 36915 train samples, 62 unique classes
  Client 12: 36007 train samples, 62 unique classes
  Client 13: 37001 train samples, 62 unique classes
  Client 14: 35681 train samples, 62 unique classes
  Client 15: 35453 train samples, 62 unique classes
  Client 16: 36585 train samples, 62 unique classes
  Client 17: 36801 train samples, 62 unique classes
  Client 18: 35964 train samples, 62 unique classes
  Client 19: 36345 train samples, 62 unique classes
Will sample 4500 samples per client per epoch
Graph: erdos, nodes: 20, edges: 48
Degree statistics: avg=4.80, min=2, max=7
Attack: Compromised 8/20 nodes: [1, 5, 11, 12, 13, 14, 17, 18]
Attack type: backdoor, lambda: 1.0
Backdoor target label: 0, trigger size: 4
Model variant: baseline
Model parameters: 6,603,710
Initial test acc across nodes: mean=0.0168 ± 0.0139
Backdoor attack: Created poisoned datasets for 8 compromised nodes
Round 001: test acc mean=0.0202 ± 0.0174 | min=0.0039 max=0.0582
         : test loss mean=22149.5125 ± 29947.8469
         : individual accs = ['0.040698', '0.004283', '0.015927', '0.024694', '0.058176', '0.021693', '0.006201', '0.041389', '0.014078', '0.009586', '0.010138', '0.018841', '0.003909', '0.004765', '0.045410', '0.009432', '0.004093', '0.011475', '0.003918', '0.054506']
         : correct/total = [(168, 4128), (18, 4203), (65, 4081), (107, 4333), (238, 4091), (93, 4287), (26, 4193), (180, 4349), (59, 4191), (41, 4277), (42, 4143), (79, 4193), (16, 4093), (20, 4197), (184, 4052), (38, 4029), (17, 4153), (48, 4183), (16, 4084), (225, 4128)]
         : compromised: 0.0143, honest: 0.0241
Round 002: test acc mean=0.0368 ± 0.0220 | min=0.0024 max=0.0618
         : test loss mean=191623672387467.8438 ± 835266829982799.2500
         : individual accs = ['0.003391', '0.002379', '0.053418', '0.048465', '0.051088', '0.045253', '0.050799', '0.051276', '0.004534', '0.053075', '0.048033', '0.061770', '0.004398', '0.046938', '0.003702', '0.051626', '0.055141', '0.003586', '0.052889', '0.045058']
         : correct/total = [(14, 4128), (10, 4203), (218, 4081), (210, 4333), (209, 4091), (194, 4287), (213, 4193), (223, 4349), (19, 4191), (227, 4277), (199, 4143), (259, 4193), (18, 4093), (197, 4197), (15, 4052), (208, 4029), (229, 4153), (15, 4183), (216, 4084), (186, 4128)]
         : compromised: 0.0276, honest: 0.0430
Round 003: test acc mean=0.0339 ± 0.0197 | min=0.0026 max=0.0579
         : test loss mean=69630630.0490 ± 273544879.5634
         : individual accs = ['0.048934', '0.050202', '0.004166', '0.044773', '0.057932', '0.045253', '0.002623', '0.049207', '0.002863', '0.003741', '0.045619', '0.046983', '0.033716', '0.047177', '0.037759', '0.050633', '0.004093', '0.037533', '0.051665', '0.012839']
         : correct/total = [(202, 4128), (211, 4203), (17, 4081), (194, 4333), (237, 4091), (194, 4287), (11, 4193), (214, 4349), (12, 4191), (16, 4277), (189, 4143), (197, 4193), (138, 4093), (198, 4197), (153, 4052), (204, 4029), (17, 4153), (157, 4183), (211, 4084), (53, 4128)]
         : compromised: 0.0438, honest: 0.0273
Round 004: test acc mean=0.0399 ± 0.0192 | min=0.0026 max=0.0549
         : test loss mean=25905534.7661 ± 56780472.5679
         : individual accs = ['0.029070', '0.049726', '0.052683', '0.002769', '0.052554', '0.052484', '0.002623', '0.049207', '0.002863', '0.003741', '0.045619', '0.053184', '0.050574', '0.047177', '0.051579', '0.054852', '0.051288', '0.048291', '0.052155', '0.045058']
         : correct/total = [(120, 4128), (209, 4203), (215, 4081), (12, 4333), (215, 4091), (225, 4287), (11, 4193), (214, 4349), (12, 4191), (16, 4277), (189, 4143), (223, 4193), (207, 4093), (198, 4197), (209, 4052), (221, 4029), (213, 4153), (202, 4183), (213, 4084), (186, 4128)]
         : compromised: 0.0506, honest: 0.0327
Round 005: test acc mean=0.0433 ± 0.0120 | min=0.0038 max=0.0582
         : test loss mean=5817.5208 ± 19154.4932
         : individual accs = ['0.045785', '0.050202', '0.035531', '0.043388', '0.052554', '0.052484', '0.044598', '0.058174', '0.051062', '0.036708', '0.055274', '0.003816', '0.050574', '0.047177', '0.032330', '0.050633', '0.030340', '0.048291', '0.032321', '0.043847']
         : correct/total = [(189, 4128), (211, 4203), (145, 4081), (188, 4333), (215, 4091), (225, 4287), (187, 4193), (253, 4349), (214, 4191), (157, 4277), (229, 4143), (16, 4193), (207, 4093), (198, 4197), (131, 4052), (204, 4029), (126, 4153), (202, 4183), (132, 4084), (181, 4128)]
         : compromised: 0.0396, honest: 0.0457
Round 006: test acc mean=0.0480 ± 0.0090 | min=0.0150 max=0.0582
         : test loss mean=8.0548 ± 7.5584
         : individual accs = ['0.045785', '0.050916', '0.054889', '0.046619', '0.057932', '0.052484', '0.048414', '0.058174', '0.053209', '0.047229', '0.055998', '0.036728', '0.048620', '0.047177', '0.045656', '0.050633', '0.047195', '0.046139', '0.050196', '0.015019']
         : correct/total = [(189, 4128), (214, 4203), (224, 4081), (202, 4333), (237, 4091), (225, 4287), (203, 4193), (253, 4349), (223, 4191), (202, 4277), (232, 4143), (154, 4193), (199, 4093), (198, 4197), (185, 4052), (204, 4029), (196, 4153), (193, 4183), (205, 4084), (62, 4128)]
         : compromised: 0.0472, honest: 0.0484
Round 007: test acc mean=0.0439 ± 0.0076 | min=0.0281 max=0.0526
         : test loss mean=15.9151 ± 12.0269
         : individual accs = ['0.045785', '0.048775', '0.035531', '0.044773', '0.052554', '0.048519', '0.043883', '0.051276', '0.051062', '0.044891', '0.045619', '0.028142', '0.052040', '0.047177', '0.032330', '0.050633', '0.030340', '0.048291', '0.032321', '0.043847']
         : correct/total = [(189, 4128), (205, 4203), (145, 4081), (194, 4333), (215, 4091), (208, 4287), (184, 4193), (223, 4349), (214, 4191), (192, 4277), (189, 4143), (118, 4193), (213, 4093), (198, 4197), (131, 4052), (204, 4029), (126, 4153), (202, 4183), (132, 4084), (181, 4128)]
         : compromised: 0.0422, honest: 0.0450
Round 008: test acc mean=0.0451 ± 0.0082 | min=0.0303 max=0.0596
         : test loss mean=16.7685 ± 13.6924
         : individual accs = ['0.059593', '0.036878', '0.035531', '0.044773', '0.052554', '0.052484', '0.048891', '0.035640', '0.037700', '0.036708', '0.055274', '0.045314', '0.049597', '0.047177', '0.046397', '0.050633', '0.030340', '0.053311', '0.032321', '0.050145']
         : correct/total = [(246, 4128), (155, 4203), (145, 4081), (194, 4333), (215, 4091), (225, 4287), (205, 4193), (155, 4349), (158, 4191), (157, 4277), (229, 4143), (190, 4193), (203, 4093), (198, 4197), (188, 4052), (204, 4029), (126, 4153), (223, 4183), (132, 4084), (207, 4128)]
         : compromised: 0.0454, honest: 0.0448
Round 009: test acc mean=0.0450 ± 0.0076 | min=0.0303 max=0.0582
         : test loss mean=14.8092 ± 12.7103
         : individual accs = ['0.048934', '0.036878', '0.035531', '0.043388', '0.052554', '0.052484', '0.048891', '0.058174', '0.044619', '0.047697', '0.045619', '0.045314', '0.049597', '0.047177', '0.032330', '0.050633', '0.030340', '0.053311', '0.032321', '0.043847']
         : correct/total = [(202, 4128), (155, 4203), (145, 4081), (188, 4333), (215, 4091), (225, 4287), (205, 4193), (253, 4349), (187, 4191), (204, 4277), (189, 4143), (190, 4193), (203, 4093), (198, 4197), (131, 4052), (204, 4029), (126, 4153), (223, 4183), (132, 4084), (181, 4128)]
         : compromised: 0.0437, honest: 0.0459
Round 010: test acc mean=0.0403 ± 0.0073 | min=0.0303 max=0.0578
         : test loss mean=16.2643 ± 13.7829
         : individual accs = ['0.045785', '0.036878', '0.035531', '0.038311', '0.048643', '0.057849', '0.035535', '0.035640', '0.037700', '0.036708', '0.039585', '0.036728', '0.036404', '0.045747', '0.032330', '0.053860', '0.030340', '0.039445', '0.032321', '0.050145']
         : correct/total = [(189, 4128), (155, 4203), (145, 4081), (166, 4333), (199, 4091), (248, 4287), (149, 4193), (155, 4349), (158, 4191), (157, 4277), (164, 4143), (154, 4193), (149, 4093), (192, 4197), (131, 4052), (217, 4029), (126, 4153), (165, 4183), (132, 4084), (207, 4128)]
         : compromised: 0.0397, honest: 0.0406

=== FINAL RESULTS ===
Dataset: femnist, Nodes: 20, Graph: erdos, Aggregation: d-fedavg
Attack: backdoor, 40.0% compromised
Final accuracy - Compromised: 0.0397, Honest: 0.0406
Overall test accuracy: mean=0.0403 ± 0.0073

=== BACKDOOR ATTACK SUCCESS RATE (ASR) ===
Target label: 0
Trigger size: 4x4
Overall ASR: 0.0000 ± 0.0000
Honest nodes ASR: 0.0000 ± 0.0000
Compromised nodes ASR: 0.0000 ± 0.0000
Note: Higher ASR indicates more successful backdoor attack
