Device: cuda
Seed: 987654321
Loading 36 LEAF FEMNIST train files...
LEAF FEMNIST train: 3597 users, 734463 samples
Loading 36 LEAF FEMNIST test files...
LEAF FEMNIST test: 3597 users, 83388 samples
Found 3597 train users, 3597 test users, 3597 common users
User sample counts range: 525 (max) to 17 (min)
Distributed ALL 3597 users across 20 clients
Users per client: 179 (with 17 clients getting +1 user)
Train partition sizes: [36360, 37070, 35957, 38262, 36024, 37732, 36921, 38328, 36867, 37683, 36507, 36915, 36007, 37001, 35681, 35453, 36585, 36801, 35964, 36345]
Test partition sizes: [4128, 4203, 4081, 4333, 4091, 4287, 4193, 4349, 4191, 4277, 4143, 4193, 4093, 4197, 4052, 4029, 4153, 4183, 4084, 4128]
  Client 0: 36360 train samples, 62 unique classes
  Client 1: 37070 train samples, 62 unique classes
  Client 2: 35957 train samples, 62 unique classes
  Client 3: 38262 train samples, 62 unique classes
  Client 4: 36024 train samples, 62 unique classes
  Client 5: 37732 train samples, 62 unique classes
  Client 6: 36921 train samples, 62 unique classes
  Client 7: 38328 train samples, 62 unique classes
  Client 8: 36867 train samples, 62 unique classes
  Client 9: 37683 train samples, 62 unique classes
  Client 10: 36507 train samples, 62 unique classes
  Client 11: 36915 train samples, 62 unique classes
  Client 12: 36007 train samples, 62 unique classes
  Client 13: 37001 train samples, 62 unique classes
  Client 14: 35681 train samples, 62 unique classes
  Client 15: 35453 train samples, 62 unique classes
  Client 16: 36585 train samples, 62 unique classes
  Client 17: 36801 train samples, 62 unique classes
  Client 18: 35964 train samples, 62 unique classes
  Client 19: 36345 train samples, 62 unique classes
Will sample 4500 samples per client per epoch
Graph: erdos, nodes: 20, edges: 99
Degree statistics: avg=9.90, min=7, max=14
Attack: Compromised 2/20 nodes: [5, 13]
Attack type: directed_deviation, lambda: 1.0
Model variant: baseline
Model parameters: 6,603,710
Initial test acc across nodes: mean=0.0168 ± 0.0139
Round 001: test acc mean=0.0345 ± 0.0205 | min=0.0036 max=0.0764
         : test loss mean=93.6972 ± 152.2620
         : individual accs = ['0.019138', '0.048775', '0.057584', '0.076390', '0.047421', '0.030324', '0.023372', '0.041619', '0.053209', '0.053776', '0.055998', '0.009778', '0.011727', '0.008339', '0.016535', '0.026309', '0.058271', '0.003586', '0.033301', '0.014777']
         : correct/total = [(79, 4128), (205, 4203), (235, 4081), (331, 4333), (194, 4091), (130, 4287), (98, 4193), (181, 4349), (223, 4191), (230, 4277), (232, 4143), (41, 4193), (48, 4093), (35, 4197), (67, 4052), (106, 4029), (242, 4153), (15, 4183), (136, 4084), (61, 4128)]
         : compromised: 0.0193, honest: 0.0362
Round 002: test acc mean=0.0400 ± 0.0167 | min=0.0048 max=0.0551
         : test loss mean=214.5777 ± 526.1347
         : individual accs = ['0.049176', '0.016179', '0.055134', '0.047773', '0.015155', '0.055050', '0.052468', '0.014486', '0.034121', '0.048398', '0.045619', '0.004770', '0.049841', '0.045985', '0.042448', '0.054852', '0.054418', '0.011953', '0.052155', '0.050388']
         : correct/total = [(203, 4128), (68, 4203), (225, 4081), (207, 4333), (62, 4091), (236, 4287), (220, 4193), (63, 4349), (143, 4191), (207, 4277), (189, 4143), (20, 4193), (204, 4093), (193, 4197), (172, 4052), (221, 4029), (226, 4153), (50, 4183), (213, 4084), (208, 4128)]
         : compromised: 0.0505, honest: 0.0389
Round 003: test acc mean=0.0499 ± 0.0048 | min=0.0372 max=0.0610
         : test loss mean=13.5862 ± 36.6960
         : individual accs = ['0.050145', '0.048775', '0.056114', '0.037157', '0.052554', '0.045253', '0.044360', '0.049207', '0.052971', '0.047229', '0.051653', '0.046983', '0.053750', '0.049083', '0.051826', '0.050633', '0.047195', '0.048291', '0.052889', '0.061047']
         : correct/total = [(207, 4128), (205, 4203), (229, 4081), (161, 4333), (215, 4091), (194, 4287), (186, 4193), (214, 4349), (222, 4191), (202, 4277), (214, 4143), (197, 4193), (220, 4093), (206, 4197), (210, 4052), (204, 4029), (196, 4153), (202, 4183), (216, 4084), (252, 4128)]
         : compromised: 0.0472, honest: 0.0502
Round 004: test acc mean=0.0495 ± 0.0053 | min=0.0331 max=0.0578
         : test loss mean=62.7611 ± 251.5508
         : individual accs = ['0.049176', '0.047109', '0.033080', '0.047773', '0.044977', '0.057849', '0.053899', '0.043918', '0.051539', '0.048398', '0.045619', '0.053184', '0.049841', '0.045747', '0.051579', '0.054852', '0.055141', '0.053311', '0.052155', '0.050388']
         : correct/total = [(203, 4128), (198, 4203), (135, 4081), (207, 4333), (184, 4091), (248, 4287), (226, 4193), (191, 4349), (216, 4191), (207, 4277), (189, 4143), (223, 4193), (204, 4093), (192, 4197), (209, 4052), (221, 4029), (229, 4153), (223, 4183), (213, 4084), (208, 4128)]
         : compromised: 0.0518, honest: 0.0492
Round 005: test acc mean=0.0499 ± 0.0036 | min=0.0430 max=0.0553
         : test loss mean=200.5737 ± 633.8571
         : individual accs = ['0.050145', '0.048775', '0.055134', '0.043157', '0.043021', '0.045253', '0.050799', '0.045068', '0.049630', '0.047463', '0.055274', '0.049606', '0.054239', '0.049083', '0.051826', '0.051626', '0.052011', '0.049486', '0.052889', '0.054506']
         : correct/total = [(207, 4128), (205, 4203), (225, 4081), (187, 4333), (176, 4091), (194, 4287), (213, 4193), (196, 4349), (208, 4191), (203, 4277), (229, 4143), (208, 4193), (222, 4093), (206, 4197), (210, 4052), (208, 4029), (216, 4153), (207, 4183), (216, 4084), (225, 4128)]
         : compromised: 0.0472, honest: 0.0503
Round 006: test acc mean=0.0507 ± 0.0033 | min=0.0439 max=0.0553
         : test loss mean=14.2975 ± 25.6167
         : individual accs = ['0.049176', '0.047109', '0.055134', '0.047773', '0.044977', '0.048519', '0.053899', '0.043918', '0.051539', '0.047463', '0.055274', '0.053184', '0.049841', '0.049559', '0.051579', '0.054852', '0.055141', '0.053311', '0.052155', '0.050388']
         : correct/total = [(203, 4128), (198, 4203), (225, 4081), (207, 4333), (184, 4091), (208, 4287), (226, 4193), (191, 4349), (216, 4191), (203, 4277), (229, 4143), (223, 4193), (204, 4093), (208, 4197), (209, 4052), (221, 4029), (229, 4153), (223, 4183), (213, 4084), (208, 4128)]
         : compromised: 0.0490, honest: 0.0509
Round 007: test acc mean=0.0499 ± 0.0036 | min=0.0430 max=0.0561
         : test loss mean=25.9374 ± 80.9526
         : individual accs = ['0.050145', '0.048775', '0.056114', '0.043157', '0.043021', '0.045253', '0.050799', '0.045068', '0.049630', '0.047229', '0.051653', '0.049606', '0.054239', '0.049083', '0.051826', '0.051626', '0.054418', '0.049486', '0.052889', '0.054506']
         : correct/total = [(207, 4128), (205, 4203), (229, 4081), (187, 4333), (176, 4091), (194, 4287), (213, 4193), (196, 4349), (208, 4191), (202, 4277), (214, 4143), (208, 4193), (222, 4093), (206, 4197), (210, 4052), (208, 4029), (226, 4153), (207, 4183), (216, 4084), (225, 4128)]
         : compromised: 0.0472, honest: 0.0502
Round 008: test acc mean=0.0501 ± 0.0034 | min=0.0439 max=0.0578
         : test loss mean=11.6516 ± 25.6217
         : individual accs = ['0.049176', '0.047109', '0.048272', '0.047773', '0.044977', '0.057849', '0.053899', '0.043918', '0.051539', '0.047463', '0.050447', '0.053184', '0.049841', '0.045747', '0.051579', '0.054852', '0.049362', '0.053311', '0.052155', '0.050388']
         : correct/total = [(203, 4128), (198, 4203), (197, 4081), (207, 4333), (184, 4091), (248, 4287), (226, 4193), (191, 4349), (216, 4191), (203, 4277), (209, 4143), (223, 4193), (204, 4093), (192, 4197), (209, 4052), (221, 4029), (205, 4153), (223, 4183), (213, 4084), (208, 4128)]
         : compromised: 0.0518, honest: 0.0500
Round 009: test acc mean=0.0486 ± 0.0037 | min=0.0430 max=0.0561
         : test loss mean=107.8660 ± 448.9689
         : individual accs = ['0.044574', '0.046158', '0.056114', '0.043157', '0.043021', '0.043387', '0.050799', '0.047827', '0.049630', '0.047229', '0.051653', '0.049606', '0.045688', '0.046462', '0.051826', '0.051626', '0.047195', '0.051159', '0.050930', '0.054506']
         : correct/total = [(184, 4128), (194, 4203), (229, 4081), (187, 4333), (176, 4091), (186, 4287), (213, 4193), (208, 4349), (208, 4191), (202, 4277), (214, 4143), (208, 4193), (187, 4093), (195, 4197), (210, 4052), (208, 4029), (196, 4153), (214, 4183), (208, 4084), (225, 4128)]
         : compromised: 0.0449, honest: 0.0490
Round 010: test acc mean=0.0499 ± 0.0038 | min=0.0420 max=0.0578
         : test loss mean=17.2058 ± 27.4169
         : individual accs = ['0.049176', '0.047109', '0.048272', '0.047773', '0.044977', '0.057849', '0.053899', '0.043918', '0.051539', '0.050503', '0.041999', '0.053184', '0.049841', '0.045747', '0.051579', '0.054852', '0.049362', '0.053311', '0.052155', '0.050388']
         : correct/total = [(203, 4128), (198, 4203), (197, 4081), (207, 4333), (184, 4091), (248, 4287), (226, 4193), (191, 4349), (216, 4191), (216, 4277), (174, 4143), (223, 4193), (204, 4093), (192, 4197), (209, 4052), (221, 4029), (205, 4153), (223, 4183), (213, 4084), (208, 4128)]
         : compromised: 0.0518, honest: 0.0497

=== FINAL RESULTS ===
Dataset: femnist, Nodes: 20, Graph: erdos, Aggregation: d-fedavg
Attack: directed_deviation, 10.0% compromised
Final accuracy - Compromised: 0.0518, Honest: 0.0497
Overall test accuracy: mean=0.0499 ± 0.0038
