Device: cuda
Seed: 987654321
Loading 36 LEAF FEMNIST train files...
LEAF FEMNIST train: 3597 users, 734463 samples
Loading 36 LEAF FEMNIST test files...
LEAF FEMNIST test: 3597 users, 83388 samples
Found 3597 train users, 3597 test users, 3597 common users
User sample counts range: 525 (max) to 17 (min)
Distributed ALL 3597 users across 20 clients
Users per client: 179 (with 17 clients getting +1 user)
Train partition sizes: [36360, 37070, 35957, 38262, 36024, 37732, 36921, 38328, 36867, 37683, 36507, 36915, 36007, 37001, 35681, 35453, 36585, 36801, 35964, 36345]
Test partition sizes: [4128, 4203, 4081, 4333, 4091, 4287, 4193, 4349, 4191, 4277, 4143, 4193, 4093, 4197, 4052, 4029, 4153, 4183, 4084, 4128]
  Client 0: 36360 train samples, 62 unique classes
  Client 1: 37070 train samples, 62 unique classes
  Client 2: 35957 train samples, 62 unique classes
  Client 3: 38262 train samples, 62 unique classes
  Client 4: 36024 train samples, 62 unique classes
  Client 5: 37732 train samples, 62 unique classes
  Client 6: 36921 train samples, 62 unique classes
  Client 7: 38328 train samples, 62 unique classes
  Client 8: 36867 train samples, 62 unique classes
  Client 9: 37683 train samples, 62 unique classes
  Client 10: 36507 train samples, 62 unique classes
  Client 11: 36915 train samples, 62 unique classes
  Client 12: 36007 train samples, 62 unique classes
  Client 13: 37001 train samples, 62 unique classes
  Client 14: 35681 train samples, 62 unique classes
  Client 15: 35453 train samples, 62 unique classes
  Client 16: 36585 train samples, 62 unique classes
  Client 17: 36801 train samples, 62 unique classes
  Client 18: 35964 train samples, 62 unique classes
  Client 19: 36345 train samples, 62 unique classes
Will sample 4500 samples per client per epoch
Graph: erdos, nodes: 20, edges: 126
Degree statistics: avg=12.60, min=8, max=16
Attack: Compromised 4/20 nodes: [5, 12, 13, 17]
Attack type: directed_deviation, lambda: 1.0
Model variant: baseline
Model parameters: 6,603,710
Initial test acc across nodes: mean=0.0168 ± 0.0139
Round 001: test acc mean=0.0227 ± 0.0174 | min=0.0029 max=0.0579
         : test loss mean=628.7906 ± 833.7691
         : individual accs = ['0.004603', '0.046633', '0.022298', '0.036464', '0.057932', '0.006298', '0.013833', '0.041389', '0.010260', '0.018003', '0.016896', '0.004293', '0.053506', '0.005242', '0.031589', '0.041698', '0.002889', '0.004542', '0.013957', '0.021802']
         : correct/total = [(19, 4128), (196, 4203), (91, 4081), (158, 4333), (237, 4091), (27, 4287), (58, 4193), (180, 4349), (43, 4191), (77, 4277), (70, 4143), (18, 4193), (219, 4093), (22, 4197), (128, 4052), (168, 4029), (12, 4153), (19, 4183), (57, 4084), (90, 4128)]
         : compromised: 0.0174, honest: 0.0240
Round 002: test acc mean=0.0050 ± 0.0009 | min=0.0031 max=0.0069
         : test loss mean=1969.8743 ± 4995.3077
         : individual accs = ['0.005572', '0.006900', '0.004166', '0.004385', '0.004644', '0.003499', '0.005724', '0.005289', '0.005488', '0.004442', '0.004345', '0.003100', '0.005864', '0.005718', '0.003702', '0.005460', '0.005057', '0.005498', '0.005142', '0.006056']
         : correct/total = [(23, 4128), (29, 4203), (17, 4081), (19, 4333), (19, 4091), (15, 4287), (24, 4193), (23, 4349), (23, 4191), (19, 4277), (18, 4143), (13, 4193), (24, 4093), (24, 4197), (15, 4052), (22, 4029), (21, 4153), (23, 4183), (21, 4084), (25, 4128)]
         : compromised: 0.0051, honest: 0.0050
Round 003: test acc mean=0.0528 ± 0.0051 | min=0.0439 max=0.0624
         : test loss mean=5.9871 ± 8.1971
         : individual accs = ['0.059593', '0.052344', '0.048272', '0.052850', '0.044977', '0.057849', '0.062247', '0.043918', '0.047960', '0.053776', '0.055274', '0.053184', '0.058637', '0.062426', '0.048124', '0.051378', '0.049362', '0.050920', '0.052155', '0.050388']
         : correct/total = [(246, 4128), (220, 4203), (197, 4081), (229, 4333), (184, 4091), (248, 4287), (261, 4193), (191, 4349), (201, 4191), (230, 4277), (229, 4143), (223, 4193), (240, 4093), (262, 4197), (195, 4052), (207, 4029), (205, 4153), (213, 4183), (213, 4084), (208, 4128)]
         : compromised: 0.0575, honest: 0.0516
Round 004: test acc mean=0.0426 ± 0.0200 | min=0.0017 max=0.0624
         : test loss mean=6.4969 ± 3.6313
         : individual accs = ['0.051599', '0.051630', '0.050723', '0.052850', '0.052066', '0.045953', '0.043883', '0.053116', '0.001670', '0.053776', '0.004586', '0.054376', '0.058637', '0.062426', '0.002962', '0.056342', '0.004334', '0.050203', '0.050196', '0.050145']
         : correct/total = [(213, 4128), (217, 4203), (207, 4081), (229, 4333), (213, 4091), (197, 4287), (184, 4193), (231, 4349), (7, 4191), (230, 4277), (19, 4143), (228, 4193), (240, 4093), (262, 4197), (12, 4052), (227, 4029), (18, 4153), (210, 4183), (205, 4084), (207, 4128)]
         : compromised: 0.0543, honest: 0.0396
Round 005: test acc mean=0.0487 ± 0.0027 | min=0.0439 max=0.0544
         : test loss mean=3.9232 ± 0.1218
         : individual accs = ['0.044574', '0.046158', '0.048272', '0.048234', '0.045710', '0.048052', '0.049130', '0.043918', '0.048199', '0.050503', '0.050447', '0.053184', '0.045688', '0.046462', '0.048124', '0.051378', '0.054418', '0.051159', '0.050930', '0.050388']
         : correct/total = [(184, 4128), (194, 4203), (197, 4081), (209, 4333), (187, 4091), (206, 4287), (206, 4193), (191, 4349), (202, 4191), (216, 4277), (209, 4143), (223, 4193), (187, 4093), (195, 4197), (195, 4052), (207, 4029), (226, 4153), (214, 4183), (208, 4084), (208, 4128)]
         : compromised: 0.0478, honest: 0.0490
Round 006: test acc mean=0.0474 ± 0.0107 | min=0.0039 max=0.0579
         : test loss mean=4.8871 ± 2.0837
         : individual accs = ['0.044574', '0.046158', '0.050723', '0.048234', '0.057932', '0.045953', '0.043883', '0.053116', '0.051062', '0.050503', '0.003862', '0.054376', '0.045688', '0.046462', '0.045656', '0.051378', '0.051047', '0.051159', '0.055583', '0.050145']
         : correct/total = [(184, 4128), (194, 4203), (207, 4081), (209, 4333), (237, 4091), (197, 4287), (184, 4193), (231, 4349), (214, 4191), (216, 4277), (16, 4143), (228, 4193), (187, 4093), (195, 4197), (185, 4052), (207, 4029), (212, 4153), (214, 4183), (227, 4084), (207, 4128)]
         : compromised: 0.0473, honest: 0.0474
Round 007: test acc mean=0.0488 ± 0.0025 | min=0.0446 max=0.0554
         : test loss mean=3.9022 ± 0.2566
         : individual accs = ['0.044574', '0.046158', '0.048272', '0.048234', '0.045710', '0.048052', '0.047460', '0.047827', '0.049392', '0.050503', '0.049964', '0.049606', '0.045688', '0.046462', '0.048124', '0.051378', '0.055382', '0.051159', '0.050930', '0.050145']
         : correct/total = [(184, 4128), (194, 4203), (197, 4081), (209, 4333), (187, 4091), (206, 4287), (199, 4193), (208, 4349), (207, 4191), (216, 4277), (207, 4143), (208, 4193), (187, 4093), (195, 4197), (195, 4052), (207, 4029), (230, 4153), (214, 4183), (208, 4084), (207, 4128)]
         : compromised: 0.0478, honest: 0.0490
Round 008: test acc mean=0.0490 ± 0.0029 | min=0.0439 max=0.0544
         : test loss mean=4.5675 ± 1.6073
         : individual accs = ['0.044574', '0.046158', '0.050723', '0.048234', '0.051088', '0.045953', '0.043883', '0.053116', '0.051062', '0.050503', '0.047550', '0.054376', '0.045688', '0.046462', '0.045656', '0.051378', '0.051047', '0.051159', '0.050930', '0.050145']
         : correct/total = [(184, 4128), (194, 4203), (207, 4081), (209, 4333), (209, 4091), (197, 4287), (184, 4193), (231, 4349), (214, 4191), (216, 4277), (197, 4143), (228, 4193), (187, 4093), (195, 4197), (185, 4052), (207, 4029), (212, 4153), (214, 4183), (208, 4084), (207, 4128)]
         : compromised: 0.0473, honest: 0.0494
Round 009: test acc mean=0.0487 ± 0.0024 | min=0.0446 max=0.0551
         : test loss mean=3.8420 ± 0.2091
         : individual accs = ['0.044574', '0.046158', '0.048272', '0.048234', '0.045710', '0.048052', '0.049130', '0.047827', '0.047960', '0.050503', '0.050205', '0.049606', '0.045688', '0.046462', '0.048124', '0.051378', '0.055141', '0.051159', '0.050930', '0.048450']
         : correct/total = [(184, 4128), (194, 4203), (197, 4081), (209, 4333), (187, 4091), (206, 4287), (206, 4193), (208, 4349), (201, 4191), (216, 4277), (208, 4143), (208, 4193), (187, 4093), (195, 4197), (195, 4052), (207, 4029), (229, 4153), (214, 4183), (208, 4084), (200, 4128)]
         : compromised: 0.0478, honest: 0.0489
Round 010: test acc mean=0.0487 ± 0.0030 | min=0.0439 max=0.0544
         : test loss mean=4.3867 ± 1.3134
         : individual accs = ['0.044574', '0.046158', '0.050723', '0.048234', '0.045710', '0.045953', '0.043883', '0.053116', '0.051062', '0.050503', '0.047550', '0.054376', '0.045688', '0.046462', '0.045656', '0.051378', '0.051047', '0.051159', '0.050930', '0.050145']
         : correct/total = [(184, 4128), (194, 4203), (207, 4081), (209, 4333), (187, 4091), (197, 4287), (184, 4193), (231, 4349), (214, 4191), (216, 4277), (197, 4143), (228, 4193), (187, 4093), (195, 4197), (185, 4052), (207, 4029), (212, 4153), (214, 4183), (208, 4084), (207, 4128)]
         : compromised: 0.0473, honest: 0.0491

=== FINAL RESULTS ===
Dataset: femnist, Nodes: 20, Graph: erdos, Aggregation: d-fedavg
Attack: directed_deviation, 20.0% compromised
Final accuracy - Compromised: 0.0473, Honest: 0.0491
Overall test accuracy: mean=0.0487 ± 0.0030
