Device: cuda
Seed: 987654321
Loading 36 LEAF FEMNIST train files...
LEAF FEMNIST train: 3597 users, 734463 samples
Loading 36 LEAF FEMNIST test files...
LEAF FEMNIST test: 3597 users, 83388 samples
Found 3597 train users, 3597 test users, 3597 common users
User sample counts range: 525 (max) to 17 (min)
Distributed ALL 3597 users across 20 clients
Users per client: 179 (with 17 clients getting +1 user)
Train partition sizes: [36360, 37070, 35957, 38262, 36024, 37732, 36921, 38328, 36867, 37683, 36507, 36915, 36007, 37001, 35681, 35453, 36585, 36801, 35964, 36345]
Test partition sizes: [4128, 4203, 4081, 4333, 4091, 4287, 4193, 4349, 4191, 4277, 4143, 4193, 4093, 4197, 4052, 4029, 4153, 4183, 4084, 4128]
  Client 0: 36360 train samples, 62 unique classes
  Client 1: 37070 train samples, 62 unique classes
  Client 2: 35957 train samples, 62 unique classes
  Client 3: 38262 train samples, 62 unique classes
  Client 4: 36024 train samples, 62 unique classes
  Client 5: 37732 train samples, 62 unique classes
  Client 6: 36921 train samples, 62 unique classes
  Client 7: 38328 train samples, 62 unique classes
  Client 8: 36867 train samples, 62 unique classes
  Client 9: 37683 train samples, 62 unique classes
  Client 10: 36507 train samples, 62 unique classes
  Client 11: 36915 train samples, 62 unique classes
  Client 12: 36007 train samples, 62 unique classes
  Client 13: 37001 train samples, 62 unique classes
  Client 14: 35681 train samples, 62 unique classes
  Client 15: 35453 train samples, 62 unique classes
  Client 16: 36585 train samples, 62 unique classes
  Client 17: 36801 train samples, 62 unique classes
  Client 18: 35964 train samples, 62 unique classes
  Client 19: 36345 train samples, 62 unique classes
Will sample 4500 samples per client per epoch
Graph: fully, nodes: 20, edges: 190
Degree statistics: avg=19.00, min=19, max=19
Attack: Compromised 16/20 nodes: [1, 2, 3, 5, 6, 8, 9, 10, 11, 12, 13, 14, 15, 17, 18, 19]
Attack type: krum, lambda: 1.0
Model variant: baseline
Model parameters: 6,603,710
UBAR ALGORITHM (Two-Stage Byzantine-resilient)
  - Model dimension: 6,603,710 parameters
  - Rho parameter: 0.19999999999999996
  - Stage 1: Distance-based filtering (select 20% closest neighbors)
  - Stage 2: Performance-based selection (loss comparison)
  - Complexity: O(deg(i)×d + deg(i)×inference)
Initial test acc across nodes: mean=0.0168 ± 0.0139
Round 001: test acc mean=0.0527 ± 0.0045 | min=0.0446 max=0.0628
         : test loss mean=3.9997 ± 0.0343
         : individual accs = ['0.059593', '0.052344', '0.055134', '0.046619', '0.057932', '0.050618', '0.044598', '0.056105', '0.053209', '0.053075', '0.050447', '0.053899', '0.062790', '0.046462', '0.048124', '0.050633', '0.058271', '0.050920', '0.052155', '0.050145']
         : correct/total = [(246, 4128), (220, 4203), (225, 4081), (202, 4333), (237, 4091), (217, 4287), (187, 4193), (244, 4349), (223, 4191), (227, 4277), (209, 4143), (226, 4193), (257, 4093), (195, 4197), (195, 4052), (204, 4029), (242, 4153), (213, 4183), (213, 4084), (207, 4128)]
         : compromised: 0.0513, honest: 0.0580
         : ubar stats = ['Node 0: s1=0.158, s2=1.000', 'Node 1: s1=0.158, s2=0.667', 'Node 2: s1=0.158, s2=0.333']...
Round 002: test acc mean=0.0551 ± 0.0034 | min=0.0469 max=0.0612
         : test loss mean=3.8343 ± 0.0575
         : individual accs = ['0.059593', '0.051630', '0.055134', '0.052850', '0.057932', '0.057849', '0.057000', '0.058174', '0.053209', '0.053776', '0.055998', '0.053899', '0.049597', '0.046938', '0.061204', '0.056590', '0.058271', '0.050920', '0.055583', '0.055475']
         : correct/total = [(246, 4128), (217, 4203), (225, 4081), (229, 4333), (237, 4091), (248, 4287), (239, 4193), (253, 4349), (223, 4191), (230, 4277), (232, 4143), (226, 4193), (203, 4093), (197, 4197), (248, 4052), (228, 4029), (242, 4153), (213, 4183), (227, 4084), (229, 4128)]
         : compromised: 0.0542, honest: 0.0585
         : ubar stats = ['Node 0: s1=0.158, s2=1.000', 'Node 1: s1=0.158, s2=0.500', 'Node 2: s1=0.158, s2=0.333']...
Round 003: test acc mean=0.0550 ± 0.0048 | min=0.0475 max=0.0655
         : test loss mean=3.7081 ± 0.0252
         : individual accs = ['0.059593', '0.050916', '0.050723', '0.052850', '0.057932', '0.048052', '0.057000', '0.051276', '0.047960', '0.047463', '0.055998', '0.061770', '0.058637', '0.065523', '0.061204', '0.056342', '0.055141', '0.050920', '0.055583', '0.055475']
         : correct/total = [(246, 4128), (214, 4203), (207, 4081), (229, 4333), (237, 4091), (206, 4287), (239, 4193), (223, 4349), (201, 4191), (203, 4277), (232, 4143), (259, 4193), (240, 4093), (275, 4197), (248, 4052), (227, 4029), (229, 4153), (213, 4183), (227, 4084), (229, 4128)]
         : compromised: 0.0548, honest: 0.0560
         : ubar stats = ['Node 0: s1=0.158, s2=1.000', 'Node 1: s1=0.158, s2=0.667', 'Node 2: s1=0.158, s2=0.333']...
Round 004: test acc mean=0.0550 ± 0.0042 | min=0.0456 max=0.0624
         : test loss mean=3.6843 ± 0.0152
         : individual accs = ['0.059593', '0.052344', '0.057584', '0.052850', '0.058176', '0.050618', '0.057000', '0.058174', '0.053209', '0.048398', '0.045619', '0.053899', '0.054239', '0.062426', '0.061204', '0.056590', '0.058271', '0.050920', '0.052889', '0.055475']
         : correct/total = [(246, 4128), (220, 4203), (235, 4081), (229, 4333), (238, 4091), (217, 4287), (239, 4193), (253, 4349), (223, 4191), (207, 4277), (189, 4143), (226, 4193), (222, 4093), (262, 4197), (248, 4052), (228, 4029), (242, 4153), (213, 4183), (216, 4084), (229, 4128)]
         : compromised: 0.0541, honest: 0.0586
         : ubar stats = ['Node 0: s1=0.158, s2=0.833', 'Node 1: s1=0.158, s2=0.583', 'Node 2: s1=0.158, s2=0.333']...
Round 005: test acc mean=0.0522 ± 0.0045 | min=0.0434 max=0.0596
         : test loss mean=3.6809 ± 0.0161
         : individual accs = ['0.059593', '0.046158', '0.052683', '0.053081', '0.058665', '0.043387', '0.057000', '0.047827', '0.051062', '0.054010', '0.055998', '0.049606', '0.045688', '0.046938', '0.051579', '0.054852', '0.058271', '0.050920', '0.055583', '0.050145']
         : correct/total = [(246, 4128), (194, 4203), (215, 4081), (230, 4333), (240, 4091), (186, 4287), (239, 4193), (208, 4349), (214, 4191), (231, 4277), (232, 4143), (208, 4193), (187, 4093), (197, 4197), (209, 4052), (221, 4029), (242, 4153), (213, 4183), (227, 4084), (207, 4128)]
         : compromised: 0.0512, honest: 0.0561
         : ubar stats = ['Node 0: s1=0.158, s2=0.800', 'Node 1: s1=0.158, s2=0.533', 'Node 2: s1=0.158, s2=0.333']...
Round 006: test acc mean=0.0572 ± 0.0092 | min=0.0446 max=0.0896
         : test loss mean=3.6803 ± 0.0172
         : individual accs = ['0.044574', '0.049964', '0.057584', '0.052850', '0.051088', '0.051318', '0.057238', '0.058174', '0.066094', '0.065233', '0.050447', '0.061770', '0.053750', '0.062426', '0.089585', '0.051378', '0.058271', '0.051159', '0.055583', '0.055475']
         : correct/total = [(184, 4128), (210, 4203), (235, 4081), (229, 4333), (209, 4091), (220, 4287), (240, 4193), (253, 4349), (277, 4191), (279, 4277), (209, 4143), (259, 4193), (220, 4093), (262, 4197), (363, 4052), (207, 4029), (242, 4153), (214, 4183), (227, 4084), (229, 4128)]
         : compromised: 0.0582, honest: 0.0530
         : ubar stats = ['Node 0: s1=0.158, s2=0.833', 'Node 1: s1=0.158, s2=0.500', 'Node 2: s1=0.158, s2=0.389']...
Round 007: test acc mean=0.0528 ± 0.0041 | min=0.0455 max=0.0596
         : test loss mean=3.6794 ± 0.0162
         : individual accs = ['0.059593', '0.052344', '0.057584', '0.052850', '0.047421', '0.048752', '0.048891', '0.045528', '0.053209', '0.053776', '0.053584', '0.053899', '0.058637', '0.046938', '0.051826', '0.056590', '0.058271', '0.051638', '0.056072', '0.048692']
         : correct/total = [(246, 4128), (220, 4203), (235, 4081), (229, 4333), (194, 4091), (209, 4287), (205, 4193), (198, 4349), (223, 4191), (230, 4277), (222, 4143), (226, 4193), (240, 4093), (197, 4197), (210, 4052), (228, 4029), (242, 4153), (216, 4183), (229, 4084), (201, 4128)]
         : compromised: 0.0528, honest: 0.0527
         : ubar stats = ['Node 0: s1=0.158, s2=0.762', 'Node 1: s1=0.158, s2=0.524', 'Node 2: s1=0.158, s2=0.429']...
Round 008: test acc mean=0.0598 ± 0.0139 | min=0.0481 max=0.0951
         : test loss mean=3.6792 ± 0.0172
         : individual accs = ['0.051599', '0.069236', '0.050723', '0.081006', '0.051577', '0.048752', '0.093251', '0.051276', '0.066571', '0.053075', '0.095100', '0.049606', '0.053750', '0.054086', '0.048124', '0.058575', '0.055141', '0.061200', '0.055583', '0.048450']
         : correct/total = [(213, 4128), (291, 4203), (207, 4081), (351, 4333), (211, 4091), (209, 4287), (391, 4193), (223, 4349), (279, 4191), (227, 4277), (394, 4143), (208, 4193), (220, 4093), (227, 4197), (195, 4052), (236, 4029), (229, 4153), (256, 4183), (227, 4084), (200, 4128)]
         : compromised: 0.0617, honest: 0.0524
         : ubar stats = ['Node 0: s1=0.158, s2=0.708', 'Node 1: s1=0.158, s2=0.500', 'Node 2: s1=0.158, s2=0.500']...
Round 009: test acc mean=0.0600 ± 0.0139 | min=0.0439 max=0.0921
         : test loss mean=3.6773 ± 0.0173
         : individual accs = ['0.057655', '0.050916', '0.092134', '0.052850', '0.087265', '0.050618', '0.050799', '0.043918', '0.055357', '0.047463', '0.050688', '0.053899', '0.076961', '0.062426', '0.051579', '0.056342', '0.063087', '0.087736', '0.052889', '0.055475']
         : correct/total = [(238, 4128), (214, 4203), (376, 4081), (229, 4333), (357, 4091), (217, 4287), (213, 4193), (191, 4349), (232, 4191), (203, 4277), (210, 4143), (226, 4193), (315, 4093), (262, 4197), (209, 4052), (227, 4029), (262, 4153), (367, 4183), (216, 4084), (229, 4128)]
         : compromised: 0.0593, honest: 0.0630
         : ubar stats = ['Node 0: s1=0.158, s2=0.741', 'Node 1: s1=0.158, s2=0.481', 'Node 2: s1=0.158, s2=0.519']...
Round 010: test acc mean=0.0629 ± 0.0240 | min=0.0480 max=0.1586
         : test loss mean=3.6765 ± 0.0175
         : individual accs = ['0.061047', '0.051630', '0.095810', '0.052850', '0.057932', '0.050618', '0.050083', '0.061853', '0.047960', '0.053776', '0.055998', '0.062247', '0.158563', '0.062426', '0.061204', '0.056590', '0.058271', '0.053072', '0.055583', '0.050388']
         : correct/total = [(252, 4128), (217, 4203), (391, 4081), (229, 4333), (237, 4091), (217, 4287), (210, 4193), (269, 4349), (201, 4191), (230, 4277), (232, 4143), (261, 4193), (649, 4093), (262, 4197), (248, 4052), (228, 4029), (242, 4153), (222, 4183), (227, 4084), (208, 4128)]
         : compromised: 0.0637, honest: 0.0598
         : ubar stats = ['Node 0: s1=0.158, s2=0.700', 'Node 1: s1=0.158, s2=0.467', 'Node 2: s1=0.158, s2=0.500']...

=== FINAL RESULTS ===
Dataset: femnist, Nodes: 20, Graph: fully, Aggregation: ubar
Attack: krum, 80.0% compromised
Final accuracy - Compromised: 0.0637, Honest: 0.0598
Overall test accuracy: mean=0.0629 ± 0.0240

=== UBAR SUMMARY ===
Node 0: stage1=0.158, stage2=0.700, overall=0.111
Node 1: stage1=0.158, stage2=0.467, overall=0.074
Node 2: stage1=0.158, stage2=0.500, overall=0.079
Node 3: stage1=0.158, stage2=0.533, overall=0.084
Node 4: stage1=0.158, stage2=0.667, overall=0.105
Node 5: stage1=0.158, stage2=0.567, overall=0.089
Node 6: stage1=0.158, stage2=0.500, overall=0.079
Node 7: stage1=0.158, stage2=0.533, overall=0.084
Node 8: stage1=0.158, stage2=0.500, overall=0.079
Node 9: stage1=0.158, stage2=0.367, overall=0.058
Node 10: stage1=0.158, stage2=0.500, overall=0.079
Node 11: stage1=0.158, stage2=0.600, overall=0.095
Node 12: stage1=0.158, stage2=0.600, overall=0.095
Node 13: stage1=0.158, stage2=0.567, overall=0.089
Node 14: stage1=0.158, stage2=0.733, overall=0.116
Node 15: stage1=0.158, stage2=0.667, overall=0.105
Node 16: stage1=0.158, stage2=0.600, overall=0.095
Node 17: stage1=0.158, stage2=0.533, overall=0.084
Node 18: stage1=0.158, stage2=0.600, overall=0.095
Node 19: stage1=0.158, stage2=0.567, overall=0.089

=== PARALLEL EXECUTION TIME (realistic for distributed system) ===
  COMMUNICATION (max across nodes):
    - Full model transfer: 0.000s (0.0%)
  COMPUTATION (max across nodes):
    - Distance computation: 0.071s (1.7%)
    - Loss computation: 4.102s (98.1%)
    - Aggregation: 0.007s (0.2%)
  TOTALS:
    - Total computation: 4.180s (100.0%)
    - Total communication: 0.000s (0.0%)
    - Total parallel time: 4.180s

=== PER-NODE AVERAGE TIME ===
  - Distance computation: 0.067s
  - Loss computation: 3.887s
  - Aggregation: 0.005s
  - Model transfer: 0.000s
  - Total per node: 3.960s

=== TOTAL COMPUTATIONAL WORK (sum across all nodes) ===
  - Total distance computation: 1.341s
  - Total loss computation: 77.750s
  - Total aggregation: 0.102s
  - Total model transfer: 0.000s
  - Grand total: 79.193s
  - Mean Stage 1 acceptance rate: 0.158
  - Mean Stage 2 acceptance rate: 0.565
  - Overall acceptance rate: 0.089

UBAR Algorithm Properties:
  - Model dimension: 6,603,710
  - Rho parameter: 0.19999999999999996
  - Two-stage approach: Distance filtering + loss evaluation
  - Stage 1 selects: 20% of neighbors
  - Stage 2 uses: Training sample loss comparison
  - Theoretical complexity: O(deg(i)×d + deg(i)×inference)
  - Approach: UBAR paper implementation
