Device: cuda
Seed: 987654321
Loading 36 LEAF FEMNIST train files...
LEAF FEMNIST train: 3597 users, 734463 samples
Loading 36 LEAF FEMNIST test files...
LEAF FEMNIST test: 3597 users, 83388 samples
Found 3597 train users, 3597 test users, 3597 common users
User sample counts range: 525 (max) to 17 (min)
Distributed ALL 3597 users across 20 clients
Users per client: 179 (with 17 clients getting +1 user)
Train partition sizes: [36360, 37070, 35957, 38262, 36024, 37732, 36921, 38328, 36867, 37683, 36507, 36915, 36007, 37001, 35681, 35453, 36585, 36801, 35964, 36345]
Test partition sizes: [4128, 4203, 4081, 4333, 4091, 4287, 4193, 4349, 4191, 4277, 4143, 4193, 4093, 4197, 4052, 4029, 4153, 4183, 4084, 4128]
  Client 0: 36360 train samples, 62 unique classes
  Client 1: 37070 train samples, 62 unique classes
  Client 2: 35957 train samples, 62 unique classes
  Client 3: 38262 train samples, 62 unique classes
  Client 4: 36024 train samples, 62 unique classes
  Client 5: 37732 train samples, 62 unique classes
  Client 6: 36921 train samples, 62 unique classes
  Client 7: 38328 train samples, 62 unique classes
  Client 8: 36867 train samples, 62 unique classes
  Client 9: 37683 train samples, 62 unique classes
  Client 10: 36507 train samples, 62 unique classes
  Client 11: 36915 train samples, 62 unique classes
  Client 12: 36007 train samples, 62 unique classes
  Client 13: 37001 train samples, 62 unique classes
  Client 14: 35681 train samples, 62 unique classes
  Client 15: 35453 train samples, 62 unique classes
  Client 16: 36585 train samples, 62 unique classes
  Client 17: 36801 train samples, 62 unique classes
  Client 18: 35964 train samples, 62 unique classes
  Client 19: 36345 train samples, 62 unique classes
Will sample 4500 samples per client per epoch
Graph: erdos, nodes: 20, edges: 48
Degree statistics: avg=4.80, min=2, max=7
Attack: Compromised 8/20 nodes: [1, 5, 11, 12, 13, 14, 17, 18]
Attack type: gaussian, lambda: 1.0
Model variant: baseline
Model parameters: 6,603,710
UBAR ALGORITHM (Two-Stage Byzantine-resilient)
  - Model dimension: 6,603,710 parameters
  - Rho parameter: 0.6
  - Stage 1: Distance-based filtering (select 60% closest neighbors)
  - Stage 2: Performance-based selection (loss comparison)
  - Complexity: O(deg(i)×d + deg(i)×inference)
Initial test acc across nodes: mean=0.0168 ± 0.0139
Round 001: test acc mean=0.0530 ± 0.0042 | min=0.0466 max=0.0627
         : test loss mean=3.9988 ± 0.0283
         : individual accs = ['0.059593', '0.051630', '0.054153', '0.046619', '0.058910', '0.052484', '0.062724', '0.051276', '0.053209', '0.047463', '0.050447', '0.050799', '0.050818', '0.047177', '0.051579', '0.050633', '0.058271', '0.050920', '0.057052', '0.054506']
         : correct/total = [(246, 4128), (217, 4203), (221, 4081), (202, 4333), (241, 4091), (225, 4287), (263, 4193), (223, 4349), (223, 4191), (203, 4277), (209, 4143), (213, 4193), (208, 4093), (198, 4197), (209, 4052), (204, 4029), (242, 4153), (213, 4183), (233, 4084), (225, 4128)]
         : compromised: 0.0516, honest: 0.0540
         : ubar stats = ['Node 0: s1=0.500, s2=1.000', 'Node 1: s1=0.500, s2=0.667', 'Node 2: s1=0.600, s2=0.333']...
Round 002: test acc mean=0.0531 ± 0.0081 | min=0.0446 max=0.0834
         : test loss mean=3.8001 ± 0.0781
         : individual accs = ['0.044574', '0.051630', '0.053418', '0.052850', '0.057932', '0.050618', '0.044598', '0.058174', '0.053209', '0.054945', '0.055274', '0.046983', '0.045688', '0.083393', '0.051579', '0.050633', '0.049362', '0.046139', '0.055583', '0.054506']
         : correct/total = [(184, 4128), (217, 4203), (218, 4081), (229, 4333), (237, 4091), (217, 4287), (187, 4193), (253, 4349), (223, 4191), (235, 4277), (229, 4143), (197, 4193), (187, 4093), (350, 4197), (209, 4052), (204, 4029), (205, 4153), (193, 4183), (227, 4084), (225, 4128)]
         : compromised: 0.0540, honest: 0.0525
         : ubar stats = ['Node 0: s1=0.500, s2=1.000', 'Node 1: s1=0.500, s2=0.667', 'Node 2: s1=0.600, s2=0.333']...
Round 003: test acc mean=0.0539 ± 0.0096 | min=0.0457 max=0.0919
         : test loss mean=3.7351 ± 0.0630
         : individual accs = ['0.059593', '0.047109', '0.050723', '0.048234', '0.091909', '0.048052', '0.049130', '0.051276', '0.053209', '0.047697', '0.055274', '0.053184', '0.058637', '0.045747', '0.048124', '0.056342', '0.058271', '0.050920', '0.055583', '0.048450']
         : correct/total = [(246, 4128), (198, 4203), (207, 4081), (209, 4333), (376, 4091), (206, 4287), (206, 4193), (223, 4349), (223, 4191), (204, 4277), (229, 4143), (223, 4193), (240, 4093), (192, 4197), (195, 4052), (227, 4029), (242, 4153), (213, 4183), (227, 4084), (200, 4128)]
         : compromised: 0.0509, honest: 0.0558
         : ubar stats = ['Node 0: s1=0.500, s2=0.778', 'Node 1: s1=0.500, s2=0.556', 'Node 2: s1=0.600, s2=0.333']...
Round 004: test acc mean=0.0589 ± 0.0091 | min=0.0456 max=0.0844
         : test loss mean=3.7330 ± 0.0610
         : individual accs = ['0.059593', '0.054961', '0.078412', '0.052850', '0.057932', '0.052718', '0.057000', '0.058174', '0.053209', '0.053075', '0.045619', '0.053899', '0.058637', '0.062426', '0.061204', '0.084388', '0.058271', '0.050920', '0.052889', '0.071221']
         : correct/total = [(246, 4128), (231, 4203), (320, 4081), (229, 4333), (237, 4091), (226, 4287), (239, 4193), (253, 4349), (223, 4191), (227, 4277), (189, 4143), (226, 4193), (240, 4093), (262, 4197), (248, 4052), (340, 4029), (242, 4153), (213, 4183), (216, 4084), (294, 4128)]
         : compromised: 0.0560, honest: 0.0608
         : ubar stats = ['Node 0: s1=0.500, s2=0.750', 'Node 1: s1=0.500, s2=0.500', 'Node 2: s1=0.600, s2=0.333']...
Round 005: test acc mean=0.0518 ± 0.0051 | min=0.0420 max=0.0596
         : test loss mean=3.7100 ± 0.0346
         : individual accs = ['0.059593', '0.052344', '0.057584', '0.052850', '0.045710', '0.043387', '0.057000', '0.047827', '0.051062', '0.053776', '0.041999', '0.047222', '0.058637', '0.046938', '0.051826', '0.054852', '0.058271', '0.050920', '0.055583', '0.048692']
         : correct/total = [(246, 4128), (220, 4203), (235, 4081), (229, 4333), (187, 4091), (186, 4287), (239, 4193), (208, 4349), (214, 4191), (230, 4277), (174, 4143), (198, 4193), (240, 4093), (197, 4197), (210, 4052), (221, 4029), (242, 4153), (213, 4183), (227, 4084), (201, 4128)]
         : compromised: 0.0509, honest: 0.0524
         : ubar stats = ['Node 0: s1=0.500, s2=0.800', 'Node 1: s1=0.500, s2=0.600', 'Node 2: s1=0.600, s2=0.400']...
Round 006: test acc mean=0.0529 ± 0.0052 | min=0.0434 max=0.0624
         : test loss mean=3.7047 ± 0.0394
         : individual accs = ['0.044574', '0.052344', '0.057584', '0.052850', '0.051088', '0.043387', '0.057000', '0.051276', '0.049630', '0.043488', '0.055998', '0.053899', '0.058637', '0.062426', '0.061204', '0.051378', '0.049362', '0.050920', '0.055583', '0.055475']
         : correct/total = [(184, 4128), (220, 4203), (235, 4081), (229, 4333), (209, 4091), (186, 4287), (239, 4193), (223, 4349), (208, 4191), (186, 4277), (232, 4143), (226, 4193), (240, 4093), (262, 4197), (248, 4052), (207, 4029), (205, 4153), (213, 4183), (227, 4084), (229, 4128)]
         : compromised: 0.0548, honest: 0.0516
         : ubar stats = ['Node 0: s1=0.500, s2=0.833', 'Node 1: s1=0.500, s2=0.556', 'Node 2: s1=0.600, s2=0.389']...
Round 007: test acc mean=0.0537 ± 0.0052 | min=0.0435 max=0.0624
         : test loss mean=3.7029 ± 0.0252
         : individual accs = ['0.059593', '0.052344', '0.057584', '0.044773', '0.047421', '0.050618', '0.050799', '0.058174', '0.053209', '0.043488', '0.055998', '0.053899', '0.058637', '0.062426', '0.051826', '0.056838', '0.060197', '0.045900', '0.055583', '0.055475']
         : correct/total = [(246, 4128), (220, 4203), (235, 4081), (194, 4333), (194, 4091), (217, 4287), (213, 4193), (253, 4349), (223, 4191), (186, 4277), (232, 4143), (226, 4193), (240, 4093), (262, 4197), (210, 4052), (229, 4029), (250, 4153), (192, 4183), (227, 4084), (229, 4128)]
         : compromised: 0.0539, honest: 0.0536
         : ubar stats = ['Node 0: s1=0.500, s2=0.762', 'Node 1: s1=0.500, s2=0.619', 'Node 2: s1=0.600, s2=0.429']...
Round 008: test acc mean=0.0552 ± 0.0086 | min=0.0430 max=0.0751
         : test loss mean=3.6885 ± 0.0186
         : individual accs = ['0.051841', '0.073043', '0.050723', '0.044773', '0.043021', '0.048052', '0.057000', '0.051276', '0.053925', '0.053308', '0.075066', '0.053899', '0.053750', '0.062426', '0.048124', '0.056342', '0.055141', '0.049486', '0.052889', '0.070736']
         : correct/total = [(214, 4128), (307, 4203), (207, 4081), (194, 4333), (176, 4091), (206, 4287), (239, 4193), (223, 4349), (226, 4191), (228, 4277), (311, 4143), (226, 4193), (220, 4093), (262, 4197), (195, 4052), (227, 4029), (229, 4153), (207, 4183), (216, 4084), (292, 4128)]
         : compromised: 0.0552, honest: 0.0553
         : ubar stats = ['Node 0: s1=0.500, s2=0.708', 'Node 1: s1=0.500, s2=0.583', 'Node 2: s1=0.600, s2=0.417']...
Round 009: test acc mean=0.0539 ± 0.0047 | min=0.0437 max=0.0624
         : test loss mean=3.7051 ± 0.0307
         : individual accs = ['0.061047', '0.050916', '0.057584', '0.052850', '0.044977', '0.050618', '0.050799', '0.058174', '0.055357', '0.043722', '0.057446', '0.053899', '0.058637', '0.062426', '0.051826', '0.051626', '0.052011', '0.050920', '0.057297', '0.056444']
         : correct/total = [(252, 4128), (214, 4203), (235, 4081), (229, 4333), (184, 4091), (217, 4287), (213, 4193), (253, 4349), (232, 4191), (187, 4277), (238, 4143), (226, 4193), (240, 4093), (262, 4197), (210, 4052), (208, 4029), (216, 4153), (213, 4183), (234, 4084), (233, 4128)]
         : compromised: 0.0546, honest: 0.0535
         : ubar stats = ['Node 0: s1=0.500, s2=0.667', 'Node 1: s1=0.500, s2=0.556', 'Node 2: s1=0.600, s2=0.444']...
Round 010: test acc mean=0.0583 ± 0.0125 | min=0.0453 max=0.0989
         : test loss mean=3.6933 ± 0.0220
         : individual accs = ['0.059593', '0.051630', '0.087724', '0.052850', '0.057932', '0.045253', '0.049130', '0.051276', '0.047960', '0.053776', '0.055998', '0.054138', '0.098949', '0.062426', '0.061204', '0.056342', '0.058753', '0.050920', '0.055583', '0.055475']
         : correct/total = [(246, 4128), (217, 4203), (358, 4081), (229, 4333), (237, 4091), (194, 4287), (206, 4193), (223, 4349), (201, 4191), (230, 4277), (232, 4143), (227, 4193), (405, 4093), (262, 4197), (248, 4052), (227, 4029), (244, 4153), (213, 4183), (227, 4084), (229, 4128)]
         : compromised: 0.0600, honest: 0.0572
         : ubar stats = ['Node 0: s1=0.500, s2=0.633', 'Node 1: s1=0.500, s2=0.533', 'Node 2: s1=0.600, s2=0.433']...

=== FINAL RESULTS ===
Dataset: femnist, Nodes: 20, Graph: erdos, Aggregation: ubar
Attack: gaussian, 40.0% compromised
Final accuracy - Compromised: 0.0600, Honest: 0.0572
Overall test accuracy: mean=0.0583 ± 0.0125

=== UBAR SUMMARY ===
Node 0: stage1=0.500, stage2=0.633, overall=0.317
Node 1: stage1=0.500, stage2=0.533, overall=0.267
Node 2: stage1=0.600, stage2=0.433, overall=0.260
Node 3: stage1=0.500, stage2=0.700, overall=0.350
Node 4: stage1=0.500, stage2=0.500, overall=0.250
Node 5: stage1=0.600, stage2=0.333, overall=0.200
Node 6: stage1=0.600, stage2=0.533, overall=0.320
Node 7: stage1=0.600, stage2=0.700, overall=0.420
Node 8: stage1=0.500, stage2=1.000, overall=0.500
Node 9: stage1=0.333, stage2=1.000, overall=0.333
Node 10: stage1=0.500, stage2=0.550, overall=0.275
Node 11: stage1=0.571, stage2=0.375, overall=0.214
Node 12: stage1=0.571, stage2=0.650, overall=0.371
Node 13: stage1=0.500, stage2=0.700, overall=0.350
Node 14: stage1=0.571, stage2=0.300, overall=0.171
Node 15: stage1=0.500, stage2=0.400, overall=0.200
Node 16: stage1=0.600, stage2=0.333, overall=0.200
Node 17: stage1=0.600, stage2=0.400, overall=0.240
Node 18: stage1=0.500, stage2=0.800, overall=0.400
Node 19: stage1=0.500, stage2=1.000, overall=0.500

=== PARALLEL EXECUTION TIME (realistic for distributed system) ===
  COMMUNICATION (max across nodes):
    - Full model transfer: 0.000s (0.0%)
  COMPUTATION (max across nodes):
    - Distance computation: 0.031s (0.7%)
    - Loss computation: 4.152s (99.0%)
    - Aggregation: 0.012s (0.3%)
  TOTALS:
    - Total computation: 4.195s (100.0%)
    - Total communication: 0.000s (0.0%)
    - Total parallel time: 4.195s

=== PER-NODE AVERAGE TIME ===
  - Distance computation: 0.018s
  - Loss computation: 3.927s
  - Aggregation: 0.005s
  - Model transfer: 0.000s
  - Total per node: 3.950s

=== TOTAL COMPUTATIONAL WORK (sum across all nodes) ===
  - Total distance computation: 0.355s
  - Total loss computation: 78.530s
  - Total aggregation: 0.109s
  - Total model transfer: 0.000s
  - Grand total: 78.994s
  - Mean Stage 1 acceptance rate: 0.532
  - Mean Stage 2 acceptance rate: 0.594
  - Overall acceptance rate: 0.316

UBAR Algorithm Properties:
  - Model dimension: 6,603,710
  - Rho parameter: 0.6
  - Two-stage approach: Distance filtering + loss evaluation
  - Stage 1 selects: 60% of neighbors
  - Stage 2 uses: Training sample loss comparison
  - Theoretical complexity: O(deg(i)×d + deg(i)×inference)
  - Approach: UBAR paper implementation
