Device: cuda
Seed: 987654321
Loading 1 LEAF Sent140 train files...
LEAF Sent140 train: 254555 users, 908652 samples
Building vocabulary (max_size=10000)...
Vocabulary size: 10000
Loading 1 LEAF Sent140 test files...
LEAF Sent140 test: 254555 users, 286281 samples
Found 254555 train users, 254555 test users, 254555 common users
User sample counts range: 494 (max) to 1 (min)
Distributed ALL 254555 users across 20 clients
Users per client: 12727 (with 15 clients getting +1 user)
Train partition sizes: [44353, 44290, 44657, 44907, 44696, 45843, 45801, 45619, 45069, 45639, 45821, 45311, 45779, 46056, 45625, 45984, 46428, 44737, 45540, 46497]
Test partition sizes: [14232, 14235, 14266, 14217, 14238, 14373, 14346, 14334, 14294, 14373, 14344, 14302, 14354, 14362, 14320, 14395, 14389, 14257, 14251, 14399]
  Client 0: 44353 train samples, 2 unique classes
  Client 1: 44290 train samples, 2 unique classes
  Client 2: 44657 train samples, 2 unique classes
  Client 3: 44907 train samples, 2 unique classes
  Client 4: 44696 train samples, 2 unique classes
  Client 5: 45843 train samples, 2 unique classes
  Client 6: 45801 train samples, 2 unique classes
  Client 7: 45619 train samples, 2 unique classes
  Client 8: 45069 train samples, 2 unique classes
  Client 9: 45639 train samples, 2 unique classes
  Client 10: 45821 train samples, 2 unique classes
  Client 11: 45311 train samples, 2 unique classes
  Client 12: 45779 train samples, 2 unique classes
  Client 13: 46056 train samples, 2 unique classes
  Client 14: 45625 train samples, 2 unique classes
  Client 15: 45984 train samples, 2 unique classes
  Client 16: 46428 train samples, 2 unique classes
  Client 17: 44737 train samples, 2 unique classes
  Client 18: 45540 train samples, 2 unique classes
  Client 19: 46497 train samples, 2 unique classes
Will sample 4500 samples per client per epoch
Graph: ring, nodes: 20, edges: 20
Degree statistics: avg=2.00, min=2, max=2
Attack: Compromised 6/20 nodes: [5, 12, 13, 14, 17, 18]
Attack type: backdoor, lambda: 1.0
Backdoor target label: 1, trigger size: 3
Model variant: baseline
Model parameters: 1,174,986
Initial test acc across nodes: mean=0.4965 ± 0.0152
Backdoor attack: Created poisoned datasets for 6 compromised nodes
Round 001: test acc mean=0.5030 ± 0.0089 | min=0.4860 max=0.5276
         : test loss mean=7.0992 ± 14.0603
         : individual accs = ['0.501897', '0.507130', '0.502383', '0.500035', '0.502669', '0.508384', '0.505716', '0.485977', '0.527564', '0.504905', '0.491007', '0.516361', '0.498537', '0.509261', '0.502723', '0.502049', '0.501494', '0.498913', '0.488317', '0.504479']
         : correct/total = [(7143, 14232), (7219, 14235), (7167, 14266), (7109, 14217), (7157, 14238), (7307, 14373), (7255, 14346), (6966, 14334), (7541, 14294), (7257, 14373), (7043, 14344), (7385, 14302), (7156, 14354), (7314, 14362), (7199, 14320), (7227, 14395), (7216, 14389), (7113, 14257), (6959, 14251), (7264, 14399)]
         : compromised: 0.5010, honest: 0.5038
Round 002: test acc mean=0.4989 ± 0.0110 | min=0.4854 max=0.5365
         : test loss mean=8.8950 ± 23.7319
         : individual accs = ['0.536537', '0.486196', '0.485981', '0.499965', '0.504144', '0.492242', '0.504322', '0.491419', '0.488387', '0.492938', '0.504601', '0.495595', '0.503274', '0.485378', '0.500419', '0.494755', '0.503649', '0.498211', '0.504807', '0.504341']
         : correct/total = [(7636, 14232), (6921, 14235), (6933, 14266), (7108, 14217), (7178, 14238), (7075, 14373), (7235, 14346), (7044, 14334), (6981, 14294), (7085, 14373), (7238, 14344), (7088, 14302), (7224, 14354), (6971, 14362), (7166, 14320), (7122, 14395), (7247, 14389), (7103, 14257), (7194, 14251), (7262, 14399)]
         : compromised: 0.4974, honest: 0.4995
Round 003: test acc mean=0.5032 ± 0.0053 | min=0.4914 max=0.5117
         : test loss mean=17.2470 ± 51.6627
         : individual accs = ['0.511664', '0.509730', '0.491378', '0.505522', '0.505689', '0.503931', '0.502231', '0.502721', '0.511543', '0.496417', '0.497490', '0.508670', '0.501463', '0.502228', '0.503073', '0.501355', '0.498853', '0.497019', '0.510490', '0.503507']
         : correct/total = [(7282, 14232), (7256, 14235), (7010, 14266), (7187, 14217), (7200, 14238), (7243, 14373), (7205, 14346), (7206, 14334), (7312, 14294), (7135, 14373), (7136, 14344), (7275, 14302), (7198, 14354), (7213, 14362), (7204, 14320), (7217, 14395), (7178, 14389), (7086, 14257), (7275, 14251), (7250, 14399)]
         : compromised: 0.5030, honest: 0.5033
Round 004: test acc mean=0.5059 ± 0.0080 | min=0.4941 max=0.5305
         : test loss mean=112.5546 ± 462.5143
         : individual accs = ['0.513631', '0.530453', '0.494112', '0.497433', '0.505057', '0.506157', '0.502719', '0.505581', '0.511333', '0.498156', '0.510248', '0.507551', '0.500627', '0.508704', '0.508589', '0.504828', '0.501981', '0.494845', '0.514490', '0.501840']
         : correct/total = [(7310, 14232), (7551, 14235), (7049, 14266), (7072, 14217), (7191, 14238), (7275, 14373), (7212, 14346), (7247, 14334), (7309, 14294), (7160, 14373), (7319, 14344), (7259, 14302), (7186, 14354), (7306, 14362), (7283, 14320), (7267, 14395), (7223, 14389), (7055, 14257), (7332, 14251), (7226, 14399)]
         : compromised: 0.5056, honest: 0.5061
Round 005: test acc mean=0.5032 ± 0.0086 | min=0.4876 max=0.5235
         : test loss mean=67.0744 ± 260.4424
         : individual accs = ['0.501405', '0.523498', '0.487593', '0.510305', '0.505057', '0.505044', '0.499373', '0.504395', '0.519029', '0.505322', '0.500418', '0.506782', '0.493033', '0.506197', '0.499511', '0.494894', '0.495517', '0.490566', '0.507192', '0.508716']
         : correct/total = [(7136, 14232), (7452, 14235), (6956, 14266), (7255, 14217), (7191, 14238), (7259, 14373), (7164, 14346), (7230, 14334), (7419, 14294), (7263, 14373), (7178, 14344), (7248, 14302), (7077, 14354), (7270, 14362), (7153, 14320), (7124, 14395), (7130, 14389), (6994, 14257), (7228, 14251), (7325, 14399)]
         : compromised: 0.5003, honest: 0.5045
Round 006: test acc mean=0.5072 ± 0.0101 | min=0.4945 max=0.5311
         : test loss mean=597.0044 ± 2564.6770
         : individual accs = ['0.512718', '0.515771', '0.495093', '0.530070', '0.508428', '0.503653', '0.503834', '0.505930', '0.531062', '0.518333', '0.495399', '0.506293', '0.498885', '0.508564', '0.502374', '0.504203', '0.496699', '0.494494', '0.509859', '0.501563']
         : correct/total = [(7297, 14232), (7342, 14235), (7063, 14266), (7536, 14217), (7239, 14238), (7239, 14373), (7228, 14346), (7252, 14334), (7591, 14294), (7450, 14373), (7106, 14344), (7241, 14302), (7161, 14354), (7304, 14362), (7194, 14320), (7258, 14395), (7147, 14389), (7050, 14257), (7266, 14251), (7222, 14399)]
         : compromised: 0.5030, honest: 0.5090
Round 007: test acc mean=0.5112 ± 0.0140 | min=0.4968 max=0.5479
         : test loss mean=1206.5252 ± 5217.9420
         : individual accs = ['0.519533', '0.547875', '0.538413', '0.513751', '0.501475', '0.505044', '0.501812', '0.505581', '0.529033', '0.527726', '0.500837', '0.500210', '0.502229', '0.510723', '0.504609', '0.497603', '0.497463', '0.496809', '0.513227', '0.509341']
         : correct/total = [(7394, 14232), (7799, 14235), (7681, 14266), (7304, 14217), (7140, 14238), (7259, 14373), (7199, 14346), (7247, 14334), (7562, 14294), (7585, 14373), (7184, 14344), (7154, 14302), (7209, 14354), (7335, 14362), (7226, 14320), (7163, 14395), (7158, 14389), (7083, 14257), (7314, 14251), (7334, 14399)]
         : compromised: 0.5054, honest: 0.5136
Round 008: test acc mean=0.5115 ± 0.0164 | min=0.4916 max=0.5513
         : test loss mean=2587.1961 ± 11250.4740
         : individual accs = ['0.508502', '0.551317', '0.548998', '0.508546', '0.502248', '0.503792', '0.500070', '0.493093', '0.526025', '0.535518', '0.503695', '0.504475', '0.500975', '0.505570', '0.491620', '0.510733', '0.508652', '0.521779', '0.503544', '0.499965']
         : correct/total = [(7237, 14232), (7848, 14235), (7832, 14266), (7230, 14217), (7151, 14238), (7241, 14373), (7174, 14346), (7068, 14334), (7519, 14294), (7697, 14373), (7225, 14344), (7215, 14302), (7191, 14354), (7261, 14362), (7040, 14320), (7352, 14395), (7319, 14389), (7439, 14257), (7176, 14251), (7199, 14399)]
         : compromised: 0.5045, honest: 0.5144
Round 009: test acc mean=0.5095 ± 0.0108 | min=0.4941 max=0.5368
         : test loss mean=8657.1244 ± 37689.8776
         : individual accs = ['0.504005', '0.536846', '0.529931', '0.509601', '0.510957', '0.518124', '0.503137', '0.501674', '0.516301', '0.516663', '0.494074', '0.506782', '0.503762', '0.521097', '0.504120', '0.499479', '0.500660', '0.496949', '0.513859', '0.502882']
         : correct/total = [(7173, 14232), (7642, 14235), (7560, 14266), (7245, 14217), (7275, 14238), (7447, 14373), (7218, 14346), (7191, 14334), (7380, 14294), (7426, 14373), (7087, 14344), (7248, 14302), (7231, 14354), (7484, 14362), (7219, 14320), (7190, 14395), (7204, 14389), (7085, 14257), (7323, 14251), (7241, 14399)]
         : compromised: 0.5097, honest: 0.5095
Round 010: test acc mean=0.5021 ± 0.0094 | min=0.4836 max=0.5151
         : test loss mean=37843.4123 ± 164927.4611
         : individual accs = ['0.504075', '0.500457', '0.513669', '0.512063', '0.506181', '0.514367', '0.504182', '0.505023', '0.507556', '0.506088', '0.510039', '0.515103', '0.502717', '0.490948', '0.491201', '0.486419', '0.483564', '0.486638', '0.502140', '0.499618']
         : correct/total = [(7174, 14232), (7124, 14235), (7328, 14266), (7280, 14217), (7207, 14238), (7393, 14373), (7233, 14346), (7239, 14334), (7255, 14294), (7274, 14373), (7316, 14344), (7367, 14302), (7216, 14354), (7051, 14362), (7034, 14320), (7002, 14395), (6958, 14389), (6938, 14257), (7156, 14251), (7194, 14399)]
         : compromised: 0.4980, honest: 0.5039

=== FINAL RESULTS ===
Dataset: sent140, Nodes: 20, Graph: ring, Aggregation: d-fedavg
Attack: backdoor, 30.0% compromised
Final accuracy - Compromised: 0.4980, Honest: 0.5039
Overall test accuracy: mean=0.5021 ± 0.0094

=== BACKDOOR ATTACK SUCCESS RATE (ASR) ===
Target label: 1
Trigger size: 3x3
Overall ASR: 0.4517 ± 0.2541
Honest nodes ASR: 0.4375 ± 0.2170
Compromised nodes ASR: 0.4846 ± 0.3223
Note: Higher ASR indicates more successful backdoor attack
