Device: cuda
Seed: 987654321
Loading 1 LEAF Sent140 train files...
LEAF Sent140 train: 254555 users, 908652 samples
Building vocabulary (max_size=10000)...
Vocabulary size: 10000
Loading 1 LEAF Sent140 test files...
LEAF Sent140 test: 254555 users, 286281 samples
Found 254555 train users, 254555 test users, 254555 common users
User sample counts range: 494 (max) to 1 (min)
Distributed ALL 254555 users across 20 clients
Users per client: 12727 (with 15 clients getting +1 user)
Train partition sizes: [44353, 44290, 44657, 44907, 44696, 45843, 45801, 45619, 45069, 45639, 45821, 45311, 45779, 46056, 45625, 45984, 46428, 44737, 45540, 46497]
Test partition sizes: [14232, 14235, 14266, 14217, 14238, 14373, 14346, 14334, 14294, 14373, 14344, 14302, 14354, 14362, 14320, 14395, 14389, 14257, 14251, 14399]
  Client 0: 44353 train samples, 2 unique classes
  Client 1: 44290 train samples, 2 unique classes
  Client 2: 44657 train samples, 2 unique classes
  Client 3: 44907 train samples, 2 unique classes
  Client 4: 44696 train samples, 2 unique classes
  Client 5: 45843 train samples, 2 unique classes
  Client 6: 45801 train samples, 2 unique classes
  Client 7: 45619 train samples, 2 unique classes
  Client 8: 45069 train samples, 2 unique classes
  Client 9: 45639 train samples, 2 unique classes
  Client 10: 45821 train samples, 2 unique classes
  Client 11: 45311 train samples, 2 unique classes
  Client 12: 45779 train samples, 2 unique classes
  Client 13: 46056 train samples, 2 unique classes
  Client 14: 45625 train samples, 2 unique classes
  Client 15: 45984 train samples, 2 unique classes
  Client 16: 46428 train samples, 2 unique classes
  Client 17: 44737 train samples, 2 unique classes
  Client 18: 45540 train samples, 2 unique classes
  Client 19: 46497 train samples, 2 unique classes
Will sample 4500 samples per client per epoch
Graph: erdos, nodes: 20, edges: 126
Degree statistics: avg=12.60, min=8, max=16
Attack: Compromised 8/20 nodes: [1, 5, 11, 12, 13, 14, 17, 18]
Attack type: krum, lambda: 1.0
Model variant: baseline
Model parameters: 1,174,986
Sketchguard Node 0:
  Model dim: 1,174,986 → Sketch size: 180
  Compression ratio: 6527.7x
  Using model parameters for aggregation, sketches for filtering
Sketchguard Node 1:
  Model dim: 1,174,986 → Sketch size: 180
  Compression ratio: 6527.7x
  Using model parameters for aggregation, sketches for filtering
Sketchguard Node 2:
  Model dim: 1,174,986 → Sketch size: 180
  Compression ratio: 6527.7x
  Using model parameters for aggregation, sketches for filtering
Sketchguard Node 3:
  Model dim: 1,174,986 → Sketch size: 180
  Compression ratio: 6527.7x
  Using model parameters for aggregation, sketches for filtering
Sketchguard Node 4:
  Model dim: 1,174,986 → Sketch size: 180
  Compression ratio: 6527.7x
  Using model parameters for aggregation, sketches for filtering
Sketchguard Node 5:
  Model dim: 1,174,986 → Sketch size: 180
  Compression ratio: 6527.7x
  Using model parameters for aggregation, sketches for filtering
Sketchguard Node 6:
  Model dim: 1,174,986 → Sketch size: 180
  Compression ratio: 6527.7x
  Using model parameters for aggregation, sketches for filtering
Sketchguard Node 7:
  Model dim: 1,174,986 → Sketch size: 180
  Compression ratio: 6527.7x
  Using model parameters for aggregation, sketches for filtering
Sketchguard Node 8:
  Model dim: 1,174,986 → Sketch size: 180
  Compression ratio: 6527.7x
  Using model parameters for aggregation, sketches for filtering
Sketchguard Node 9:
  Model dim: 1,174,986 → Sketch size: 180
  Compression ratio: 6527.7x
  Using model parameters for aggregation, sketches for filtering
Sketchguard Node 10:
  Model dim: 1,174,986 → Sketch size: 180
  Compression ratio: 6527.7x
  Using model parameters for aggregation, sketches for filtering
Sketchguard Node 11:
  Model dim: 1,174,986 → Sketch size: 180
  Compression ratio: 6527.7x
  Using model parameters for aggregation, sketches for filtering
Sketchguard Node 12:
  Model dim: 1,174,986 → Sketch size: 180
  Compression ratio: 6527.7x
  Using model parameters for aggregation, sketches for filtering
Sketchguard Node 13:
  Model dim: 1,174,986 → Sketch size: 180
  Compression ratio: 6527.7x
  Using model parameters for aggregation, sketches for filtering
Sketchguard Node 14:
  Model dim: 1,174,986 → Sketch size: 180
  Compression ratio: 6527.7x
  Using model parameters for aggregation, sketches for filtering
Sketchguard Node 15:
  Model dim: 1,174,986 → Sketch size: 180
  Compression ratio: 6527.7x
  Using model parameters for aggregation, sketches for filtering
Sketchguard Node 16:
  Model dim: 1,174,986 → Sketch size: 180
  Compression ratio: 6527.7x
  Using model parameters for aggregation, sketches for filtering
Sketchguard Node 17:
  Model dim: 1,174,986 → Sketch size: 180
  Compression ratio: 6527.7x
  Using model parameters for aggregation, sketches for filtering
Sketchguard Node 18:
  Model dim: 1,174,986 → Sketch size: 180
  Compression ratio: 6527.7x
  Using model parameters for aggregation, sketches for filtering
Sketchguard Node 19:
  Model dim: 1,174,986 → Sketch size: 180
  Compression ratio: 6527.7x
  Using model parameters for aggregation, sketches for filtering
Sketchguard ALGORITHM (Sketch-based Filtering + State Aggregation)
  - Model dimension: 1,174,986 parameters
  - Config: SketchguardConfig(gamma=2, kappa=1, alpha=0.5, min_neighbors=1, sketch_size=180, network_seed=987654321, attack_detection_window=5)
  - Sketch size: 180
  - Compression ratio: 6527.7x
  - Complexity: O(d + N×k) = O(1,174,986 + 20×180)
  - Theoretical speedup vs BALANCE: 19.9x
Initial test acc across nodes: mean=0.4965 ± 0.0152
Round 001: test acc mean=0.4989 ± 0.0103 | min=0.4820 max=0.5219
         : test loss mean=0.7219 ± 0.0237
         : individual accs = ['0.483488', '0.492729', '0.483527', '0.505803', '0.497261', '0.504905', '0.511014', '0.503767', '0.496362', '0.497113', '0.500767', '0.486785', '0.521945', '0.507520', '0.511243', '0.497048', '0.482035', '0.492249', '0.494562', '0.507813']
         : correct/total = [(6881, 14232), (7014, 14235), (6898, 14266), (7191, 14217), (7080, 14238), (7257, 14373), (7331, 14346), (7221, 14334), (7095, 14294), (7145, 14373), (7183, 14344), (6962, 14302), (7492, 14354), (7289, 14362), (7321, 14320), (7155, 14395), (6936, 14389), (7018, 14257), (7048, 14251), (7312, 14399)]
         : compromised: 0.5015, honest: 0.4972
         : sketchguard stats = ['Node 0: acc_rate=1.000', 'Node 1: acc_rate=1.000', 'Node 2: acc_rate=1.000']...
Round 002: test acc mean=0.5185 ± 0.0130 | min=0.4992 max=0.5494
         : test loss mean=0.6950 ± 0.0053
         : individual accs = ['0.514053', '0.512680', '0.527268', '0.508405', '0.540385', '0.532178', '0.510107', '0.512209', '0.512733', '0.528839', '0.504671', '0.524053', '0.507315', '0.520401', '0.499232', '0.549357', '0.501911', '0.516799', '0.513859', '0.533995']
         : correct/total = [(7316, 14232), (7298, 14235), (7522, 14266), (7228, 14217), (7694, 14238), (7649, 14373), (7318, 14346), (7342, 14334), (7329, 14294), (7601, 14373), (7239, 14344), (7495, 14302), (7282, 14354), (7474, 14362), (7149, 14320), (7908, 14395), (7222, 14389), (7368, 14257), (7323, 14251), (7689, 14399)]
         : compromised: 0.5158, honest: 0.5203
         : sketchguard stats = ['Node 0: acc_rate=0.781', 'Node 1: acc_rate=0.864', 'Node 2: acc_rate=0.750']...
Round 003: test acc mean=0.5398 ± 0.0149 | min=0.5088 max=0.5696
         : test loss mean=0.6873 ± 0.0031
         : individual accs = ['0.534429', '0.520759', '0.539675', '0.508757', '0.552044', '0.533570', '0.524258', '0.543324', '0.548062', '0.543728', '0.569646', '0.539715', '0.538038', '0.519844', '0.547696', '0.568183', '0.547988', '0.540015', '0.525437', '0.550316']
         : correct/total = [(7606, 14232), (7413, 14235), (7699, 14266), (7233, 14217), (7860, 14238), (7669, 14373), (7521, 14346), (7788, 14334), (7834, 14294), (7815, 14373), (8171, 14344), (7719, 14302), (7723, 14354), (7466, 14362), (7843, 14320), (8179, 14395), (7885, 14389), (7699, 14257), (7488, 14251), (7924, 14399)]
         : compromised: 0.5331, honest: 0.5442
         : sketchguard stats = ['Node 0: acc_rate=0.708', 'Node 1: acc_rate=0.818', 'Node 2: acc_rate=0.667']...
Round 004: test acc mean=0.5672 ± 0.0088 | min=0.5510 max=0.5841
         : test loss mean=0.6798 ± 0.0025
         : individual accs = ['0.563027', '0.557640', '0.574653', '0.557713', '0.584071', '0.564531', '0.558483', '0.582740', '0.570309', '0.568775', '0.571528', '0.559992', '0.555734', '0.563919', '0.566480', '0.577353', '0.573633', '0.567581', '0.550979', '0.574623']
         : correct/total = [(8013, 14232), (7938, 14235), (8198, 14266), (7929, 14217), (8316, 14238), (8114, 14373), (8012, 14346), (8353, 14334), (8152, 14294), (8175, 14373), (8198, 14344), (8009, 14302), (7977, 14354), (8099, 14362), (8112, 14320), (8311, 14395), (8254, 14389), (8092, 14257), (7852, 14251), (8274, 14399)]
         : compromised: 0.5609, honest: 0.5714
         : sketchguard stats = ['Node 0: acc_rate=0.672', 'Node 1: acc_rate=0.795', 'Node 2: acc_rate=0.625']...
Round 005: test acc mean=0.5950 ± 0.0041 | min=0.5840 max=0.6020
         : test loss mean=0.6678 ± 0.0019
         : individual accs = ['0.592257', '0.592483', '0.599047', '0.591194', '0.596011', '0.593752', '0.596403', '0.594600', '0.598223', '0.599249', '0.601994', '0.599077', '0.594747', '0.593928', '0.588897', '0.596179', '0.583988', '0.596128', '0.592239', '0.599764']
         : correct/total = [(8429, 14232), (8434, 14235), (8546, 14266), (8405, 14217), (8486, 14238), (8534, 14373), (8556, 14346), (8523, 14334), (8551, 14294), (8613, 14373), (8635, 14344), (8568, 14302), (8537, 14354), (8530, 14362), (8433, 14320), (8582, 14395), (8403, 14389), (8499, 14257), (8440, 14251), (8636, 14399)]
         : compromised: 0.5939, honest: 0.5957
         : sketchguard stats = ['Node 0: acc_rate=0.650', 'Node 1: acc_rate=0.782', 'Node 2: acc_rate=0.600']...
Round 006: test acc mean=0.6071 ± 0.0035 | min=0.5962 max=0.6111
         : test loss mean=0.6593 ± 0.0020
         : individual accs = ['0.606169', '0.604707', '0.610122', '0.608849', '0.608161', '0.608920', '0.610414', '0.606111', '0.603400', '0.608363', '0.611127', '0.609006', '0.610562', '0.604233', '0.596229', '0.604168', '0.603725', '0.609104', '0.609361', '0.608792']
         : correct/total = [(8627, 14232), (8608, 14235), (8704, 14266), (8656, 14217), (8659, 14238), (8752, 14373), (8757, 14346), (8688, 14334), (8625, 14294), (8744, 14373), (8766, 14344), (8710, 14302), (8764, 14354), (8678, 14362), (8538, 14320), (8697, 14395), (8687, 14389), (8684, 14257), (8684, 14251), (8766, 14399)]
         : compromised: 0.6065, honest: 0.6075
         : sketchguard stats = ['Node 0: acc_rate=0.635', 'Node 1: acc_rate=0.773', 'Node 2: acc_rate=0.583']...
Round 007: test acc mean=0.6159 ± 0.0025 | min=0.6119 max=0.6210
         : test loss mean=0.6531 ± 0.0018
         : individual accs = ['0.613687', '0.612153', '0.615590', '0.621017', '0.617011', '0.616990', '0.618361', '0.614134', '0.617182', '0.613511', '0.617680', '0.615019', '0.617459', '0.617881', '0.611872', '0.619590', '0.611856', '0.614716', '0.614553', '0.618237']
         : correct/total = [(8734, 14232), (8714, 14235), (8782, 14266), (8829, 14217), (8785, 14238), (8868, 14373), (8871, 14346), (8803, 14334), (8822, 14294), (8818, 14373), (8860, 14344), (8796, 14302), (8863, 14354), (8874, 14362), (8762, 14320), (8919, 14395), (8804, 14389), (8764, 14257), (8758, 14251), (8902, 14399)]
         : compromised: 0.6151, honest: 0.6165
         : sketchguard stats = ['Node 0: acc_rate=0.625', 'Node 1: acc_rate=0.766', 'Node 2: acc_rate=0.571']...
Round 008: test acc mean=0.6224 ± 0.0041 | min=0.6087 max=0.6276
         : test loss mean=0.6484 ± 0.0029
         : individual accs = ['0.621627', '0.622269', '0.622109', '0.626222', '0.617643', '0.620330', '0.621846', '0.620832', '0.627606', '0.620886', '0.625976', '0.608656', '0.627351', '0.624077', '0.620950', '0.625981', '0.621864', '0.624185', '0.623395', '0.624835']
         : correct/total = [(8847, 14232), (8858, 14235), (8875, 14266), (8903, 14217), (8794, 14238), (8916, 14373), (8921, 14346), (8899, 14334), (8971, 14294), (8924, 14373), (8979, 14344), (8705, 14302), (9005, 14354), (8963, 14362), (8892, 14320), (9011, 14395), (8948, 14389), (8899, 14257), (8884, 14251), (8997, 14399)]
         : compromised: 0.6214, honest: 0.6231
         : sketchguard stats = ['Node 0: acc_rate=0.617', 'Node 1: acc_rate=0.761', 'Node 2: acc_rate=0.562']...
Round 009: test acc mean=0.6273 ± 0.0036 | min=0.6169 max=0.6320
         : test loss mean=0.6435 ± 0.0028
         : individual accs = ['0.630410', '0.629505', '0.627085', '0.626363', '0.624666', '0.626383', '0.627074', '0.623064', '0.631174', '0.625757', '0.630508', '0.625017', '0.628954', '0.628882', '0.616899', '0.630914', '0.626173', '0.623413', '0.631184', '0.631988']
         : correct/total = [(8972, 14232), (8961, 14235), (8946, 14266), (8905, 14217), (8894, 14238), (9003, 14373), (8996, 14346), (8931, 14334), (9022, 14294), (8994, 14373), (9044, 14344), (8939, 14302), (9028, 14354), (9032, 14362), (8834, 14320), (9082, 14395), (9010, 14389), (8888, 14257), (8995, 14251), (9100, 14399)]
         : compromised: 0.6263, honest: 0.6279
         : sketchguard stats = ['Node 0: acc_rate=0.611', 'Node 1: acc_rate=0.758', 'Node 2: acc_rate=0.556']...
Round 010: test acc mean=0.6334 ± 0.0028 | min=0.6278 max=0.6393
         : test loss mean=0.6390 ± 0.0020
         : individual accs = ['0.633853', '0.636249', '0.632132', '0.639305', '0.629934', '0.632784', '0.633626', '0.633040', '0.635162', '0.631601', '0.636852', '0.627814', '0.631322', '0.632224', '0.630517', '0.635359', '0.632080', '0.630778', '0.635955', '0.637197']
         : correct/total = [(9021, 14232), (9057, 14235), (9018, 14266), (9089, 14217), (8969, 14238), (9095, 14373), (9090, 14346), (9074, 14334), (9079, 14294), (9078, 14373), (9135, 14344), (8979, 14302), (9062, 14354), (9080, 14362), (9029, 14320), (9146, 14395), (9095, 14389), (8993, 14257), (9063, 14251), (9175, 14399)]
         : compromised: 0.6322, honest: 0.6342
         : sketchguard stats = ['Node 0: acc_rate=0.606', 'Node 1: acc_rate=0.755', 'Node 2: acc_rate=0.550']...

=== FINAL RESULTS ===
Dataset: sent140, Nodes: 20, Graph: erdos, Aggregation: sketchguard
Attack: krum, 40.0% compromised
Final accuracy - Compromised: 0.6322, Honest: 0.6342
Overall test accuracy: mean=0.6334 ± 0.0028

=== Sketchguard SUMMARY ===
Node 0: acceptance=0.606
Node 1: acceptance=0.755
Node 2: acceptance=0.550
Node 3: acceptance=0.662
Node 4: acceptance=0.591
Node 5: acceptance=0.580
Node 6: acceptance=0.550
Node 7: acceptance=0.550
Node 8: acceptance=0.550
Node 9: acceptance=0.723
Node 10: acceptance=0.600
Node 11: acceptance=0.614
Node 12: acceptance=0.700
Node 13: acceptance=0.723
Node 14: acceptance=0.640
Node 15: acceptance=0.591
Node 16: acceptance=0.585
Node 17: acceptance=0.700
Node 18: acceptance=0.719
Node 19: acceptance=0.550

=== PARALLEL EXECUTION TIME (realistic for distributed system) ===
  COMMUNICATION (max across nodes):
    - Sketch transfer: 0.000s (0.0%)
    - Model fetch (accepted): 0.000s (0.0%)
  COMPUTATION (max across nodes):
    - Sketching: 0.466s (95.3%)
    - Filtering: 0.001s (0.2%)
    - Aggregation: 0.022s (4.4%)
  TOTALS:
    - Total computation: 0.489s (100.0%)
    - Total communication: 0.000s (0.0%)
    - Total parallel time: 0.489s

=== PER-NODE AVERAGE TIME ===
  - Sketching: 0.342s
  - Filtering: 0.001s
  - Aggregation: 0.016s
  - Sketch transfer: 0.000s
  - Model fetch: 0.000s
  - Total per node: 0.358s

=== TOTAL COMPUTATIONAL WORK (sum across all nodes) ===
  - Total sketching: 6.836s
  - Total filtering: 0.012s
  - Total aggregation: 0.314s
  - Total sketch transfer: 0.000s
  - Total model fetch: 0.000s
  - Grand total: 7.162s
  - Mean acceptance rate: 0.627

Sketchguard Algorithm Properties:
  - Original dimension: 1,174,986
  - Sketch size: 180
  - Compression ratio: 19.9x
  - Single repetition: No repetitions needed
  - Theoretical complexity: O(d + N×k)
  - Approach: Sketch filtering + state aggregation
