Device: cuda
Seed: 987654321
Loading 1 LEAF Sent140 train files...
LEAF Sent140 train: 254555 users, 908652 samples
Building vocabulary (max_size=10000)...
Vocabulary size: 10000
Loading 1 LEAF Sent140 test files...
LEAF Sent140 test: 254555 users, 286281 samples
Found 254555 train users, 254555 test users, 254555 common users
User sample counts range: 494 (max) to 1 (min)
Distributed ALL 254555 users across 20 clients
Users per client: 12727 (with 15 clients getting +1 user)
Train partition sizes: [44353, 44290, 44657, 44907, 44696, 45843, 45801, 45619, 45069, 45639, 45821, 45311, 45779, 46056, 45625, 45984, 46428, 44737, 45540, 46497]
Test partition sizes: [14232, 14235, 14266, 14217, 14238, 14373, 14346, 14334, 14294, 14373, 14344, 14302, 14354, 14362, 14320, 14395, 14389, 14257, 14251, 14399]
  Client 0: 44353 train samples, 2 unique classes
  Client 1: 44290 train samples, 2 unique classes
  Client 2: 44657 train samples, 2 unique classes
  Client 3: 44907 train samples, 2 unique classes
  Client 4: 44696 train samples, 2 unique classes
  Client 5: 45843 train samples, 2 unique classes
  Client 6: 45801 train samples, 2 unique classes
  Client 7: 45619 train samples, 2 unique classes
  Client 8: 45069 train samples, 2 unique classes
  Client 9: 45639 train samples, 2 unique classes
  Client 10: 45821 train samples, 2 unique classes
  Client 11: 45311 train samples, 2 unique classes
  Client 12: 45779 train samples, 2 unique classes
  Client 13: 46056 train samples, 2 unique classes
  Client 14: 45625 train samples, 2 unique classes
  Client 15: 45984 train samples, 2 unique classes
  Client 16: 46428 train samples, 2 unique classes
  Client 17: 44737 train samples, 2 unique classes
  Client 18: 45540 train samples, 2 unique classes
  Client 19: 46497 train samples, 2 unique classes
Will sample 4500 samples per client per epoch
Graph: erdos, nodes: 20, edges: 126
Degree statistics: avg=12.60, min=8, max=16
Attack: Compromised 6/20 nodes: [5, 12, 13, 14, 17, 18]
Attack type: directed_deviation, lambda: 1.0
Model variant: baseline
Model parameters: 1,174,986
Initial test acc across nodes: mean=0.4965 ± 0.0152
Round 001: test acc mean=0.5000 ± 0.0065 | min=0.4889 max=0.5181
         : test loss mean=23.5470 ± 8.6003
         : individual accs = ['0.502951', '0.505444', '0.503575', '0.496378', '0.518050', '0.491755', '0.494145', '0.494558', '0.512663', '0.493703', '0.499303', '0.498602', '0.500070', '0.501462', '0.500838', '0.498159', '0.501077', '0.499193', '0.499614', '0.488853']
         : correct/total = [(7158, 14232), (7195, 14235), (7184, 14266), (7057, 14217), (7376, 14238), (7068, 14373), (7089, 14346), (7089, 14334), (7328, 14294), (7096, 14373), (7162, 14344), (7131, 14302), (7178, 14354), (7202, 14362), (7172, 14320), (7171, 14395), (7210, 14389), (7117, 14257), (7120, 14251), (7039, 14399)]
         : compromised: 0.4988, honest: 0.5005
Round 002: test acc mean=0.4948 ± 0.0053 | min=0.4834 max=0.5016
         : test loss mean=29.8638 ± 7.0023
         : individual accs = ['0.487563', '0.488795', '0.485700', '0.492298', '0.483425', '0.494121', '0.499791', '0.497837', '0.491185', '0.499200', '0.501046', '0.491540', '0.495263', '0.501601', '0.496508', '0.500313', '0.498089', '0.499614', '0.492386', '0.498785']
         : correct/total = [(6939, 14232), (6958, 14235), (6929, 14266), (6999, 14217), (6883, 14238), (7102, 14373), (7170, 14346), (7136, 14334), (7021, 14294), (7175, 14373), (7187, 14344), (7030, 14302), (7109, 14354), (7204, 14362), (7110, 14320), (7202, 14395), (7167, 14389), (7123, 14257), (7017, 14251), (7182, 14399)]
         : compromised: 0.4966, honest: 0.4940
Round 003: test acc mean=0.5047 ± 0.0052 | min=0.4914 max=0.5139
         : test loss mean=5.2231 ± 1.2329
         : individual accs = ['0.510961', '0.504391', '0.513949', '0.507772', '0.505829', '0.506227', '0.502370', '0.504814', '0.511473', '0.506992', '0.500976', '0.507971', '0.500488', '0.491436', '0.504190', '0.502119', '0.500313', '0.497580', '0.511262', '0.503646']
         : correct/total = [(7272, 14232), (7180, 14235), (7332, 14266), (7219, 14217), (7202, 14238), (7276, 14373), (7207, 14346), (7236, 14334), (7311, 14294), (7287, 14373), (7186, 14344), (7265, 14302), (7184, 14354), (7058, 14362), (7220, 14320), (7228, 14395), (7199, 14389), (7094, 14257), (7286, 14251), (7252, 14399)]
         : compromised: 0.5019, honest: 0.5060
Round 004: test acc mean=0.5039 ± 0.0071 | min=0.4936 max=0.5157
         : test loss mean=5.4763 ± 6.4907
         : individual accs = ['0.513491', '0.501791', '0.507220', '0.505170', '0.515171', '0.494538', '0.500279', '0.515697', '0.494333', '0.504975', '0.503207', '0.505314', '0.510729', '0.504456', '0.493575', '0.510038', '0.496073', '0.495686', '0.510841', '0.496284']
         : correct/total = [(7308, 14232), (7143, 14235), (7236, 14266), (7182, 14217), (7335, 14238), (7108, 14373), (7177, 14346), (7392, 14334), (7066, 14294), (7258, 14373), (7218, 14344), (7227, 14302), (7331, 14354), (7245, 14362), (7068, 14320), (7342, 14395), (7138, 14389), (7067, 14257), (7280, 14251), (7146, 14399)]
         : compromised: 0.5016, honest: 0.5049
Round 005: test acc mean=0.5055 ± 0.0079 | min=0.4907 max=0.5167
         : test loss mean=5.4285 ± 5.3884
         : individual accs = ['0.498806', '0.511135', '0.512197', '0.506647', '0.507164', '0.510610', '0.507598', '0.516674', '0.499091', '0.506784', '0.498327', '0.504195', '0.490665', '0.516014', '0.497486', '0.513651', '0.516089', '0.494985', '0.508526', '0.492395']
         : correct/total = [(7099, 14232), (7276, 14235), (7307, 14266), (7203, 14217), (7221, 14238), (7339, 14373), (7282, 14346), (7406, 14334), (7134, 14294), (7284, 14373), (7148, 14344), (7211, 14302), (7043, 14354), (7411, 14362), (7124, 14320), (7394, 14395), (7426, 14389), (7057, 14257), (7247, 14251), (7090, 14399)]
         : compromised: 0.5030, honest: 0.5065
Round 006: test acc mean=0.5145 ± 0.0098 | min=0.4905 max=0.5249
         : test loss mean=1.8773 ± 2.5119
         : individual accs = ['0.522836', '0.520478', '0.515561', '0.522403', '0.518472', '0.492660', '0.494424', '0.520092', '0.490486', '0.517498', '0.511433', '0.513145', '0.524871', '0.520331', '0.517598', '0.521014', '0.518174', '0.519113', '0.513438', '0.516286']
         : correct/total = [(7441, 14232), (7409, 14235), (7355, 14266), (7427, 14217), (7382, 14238), (7081, 14373), (7093, 14346), (7455, 14334), (7011, 14294), (7438, 14373), (7336, 14344), (7339, 14302), (7534, 14354), (7473, 14362), (7412, 14320), (7500, 14395), (7456, 14389), (7401, 14257), (7317, 14251), (7434, 14399)]
         : compromised: 0.5147, honest: 0.5145
Round 007: test acc mean=0.5180 ± 0.0049 | min=0.5078 max=0.5265
         : test loss mean=0.7255 ± 0.0039
         : individual accs = ['0.521993', '0.513453', '0.509954', '0.516424', '0.507796', '0.517011', '0.515823', '0.525115', '0.516021', '0.512767', '0.520845', '0.520137', '0.526473', '0.525484', '0.521788', '0.520597', '0.517201', '0.517430', '0.519332', '0.514480']
         : correct/total = [(7429, 14232), (7309, 14235), (7275, 14266), (7342, 14217), (7230, 14238), (7431, 14373), (7400, 14346), (7527, 14334), (7376, 14294), (7370, 14373), (7471, 14344), (7439, 14302), (7557, 14354), (7547, 14362), (7472, 14320), (7494, 14395), (7442, 14389), (7377, 14257), (7401, 14251), (7408, 14399)]
         : compromised: 0.5213, honest: 0.5166
Round 008: test acc mean=0.5177 ± 0.0051 | min=0.5057 max=0.5243
         : test loss mean=0.7161 ± 0.0070
         : individual accs = ['0.519323', '0.512891', '0.515351', '0.510797', '0.518261', '0.519377', '0.523770', '0.524278', '0.516231', '0.509497', '0.522588', '0.511817', '0.521248', '0.519844', '0.522556', '0.518861', '0.521787', '0.521849', '0.505719', '0.518925']
         : correct/total = [(7391, 14232), (7301, 14235), (7352, 14266), (7262, 14217), (7379, 14238), (7465, 14373), (7514, 14346), (7515, 14334), (7379, 14294), (7323, 14373), (7496, 14344), (7320, 14302), (7482, 14354), (7466, 14362), (7483, 14320), (7469, 14395), (7508, 14389), (7440, 14257), (7207, 14251), (7472, 14399)]
         : compromised: 0.5184, honest: 0.5175
Round 009: test acc mean=0.5196 ± 0.0056 | min=0.5095 max=0.5311
         : test loss mean=0.7101 ± 0.0037
         : individual accs = ['0.516723', '0.513523', '0.509533', '0.521699', '0.519525', '0.512976', '0.517775', '0.524487', '0.517420', '0.520977', '0.528305', '0.510418', '0.531071', '0.527155', '0.522067', '0.522959', '0.520328', '0.522059', '0.513999', '0.519272']
         : correct/total = [(7354, 14232), (7310, 14235), (7269, 14266), (7417, 14217), (7397, 14238), (7373, 14373), (7428, 14346), (7518, 14334), (7396, 14294), (7488, 14373), (7578, 14344), (7300, 14302), (7623, 14354), (7571, 14362), (7476, 14320), (7528, 14395), (7487, 14389), (7443, 14257), (7325, 14251), (7477, 14399)]
         : compromised: 0.5216, honest: 0.5188
Round 010: test acc mean=0.5241 ± 0.0043 | min=0.5139 max=0.5307
         : test loss mean=0.7025 ± 0.0026
         : individual accs = ['0.525787', '0.525114', '0.525866', '0.520504', '0.527181', '0.513880', '0.523979', '0.530696', '0.518959', '0.515898', '0.527607', '0.523913', '0.529260', '0.524439', '0.525000', '0.526572', '0.525679', '0.525637', '0.517788', '0.528162']
         : correct/total = [(7483, 14232), (7475, 14235), (7502, 14266), (7400, 14217), (7506, 14238), (7386, 14373), (7517, 14346), (7607, 14334), (7418, 14294), (7415, 14373), (7568, 14344), (7493, 14302), (7597, 14354), (7532, 14362), (7518, 14320), (7580, 14395), (7564, 14389), (7494, 14257), (7379, 14251), (7605, 14399)]
         : compromised: 0.5227, honest: 0.5247

=== FINAL RESULTS ===
Dataset: sent140, Nodes: 20, Graph: erdos, Aggregation: krum
Attack: directed_deviation, 30.0% compromised
Final accuracy - Compromised: 0.5227, Honest: 0.5247
Overall test accuracy: mean=0.5241 ± 0.0043
