Device: cuda
Seed: 987654321
Loading 1 LEAF Sent140 train files...
LEAF Sent140 train: 254555 users, 908652 samples
Building vocabulary (max_size=10000)...
Vocabulary size: 10000
Loading 1 LEAF Sent140 test files...
LEAF Sent140 test: 254555 users, 286281 samples
Found 254555 train users, 254555 test users, 254555 common users
User sample counts range: 494 (max) to 1 (min)
Distributed ALL 254555 users across 20 clients
Users per client: 12727 (with 15 clients getting +1 user)
Train partition sizes: [44353, 44290, 44657, 44907, 44696, 45843, 45801, 45619, 45069, 45639, 45821, 45311, 45779, 46056, 45625, 45984, 46428, 44737, 45540, 46497]
Test partition sizes: [14232, 14235, 14266, 14217, 14238, 14373, 14346, 14334, 14294, 14373, 14344, 14302, 14354, 14362, 14320, 14395, 14389, 14257, 14251, 14399]
  Client 0: 44353 train samples, 2 unique classes
  Client 1: 44290 train samples, 2 unique classes
  Client 2: 44657 train samples, 2 unique classes
  Client 3: 44907 train samples, 2 unique classes
  Client 4: 44696 train samples, 2 unique classes
  Client 5: 45843 train samples, 2 unique classes
  Client 6: 45801 train samples, 2 unique classes
  Client 7: 45619 train samples, 2 unique classes
  Client 8: 45069 train samples, 2 unique classes
  Client 9: 45639 train samples, 2 unique classes
  Client 10: 45821 train samples, 2 unique classes
  Client 11: 45311 train samples, 2 unique classes
  Client 12: 45779 train samples, 2 unique classes
  Client 13: 46056 train samples, 2 unique classes
  Client 14: 45625 train samples, 2 unique classes
  Client 15: 45984 train samples, 2 unique classes
  Client 16: 46428 train samples, 2 unique classes
  Client 17: 44737 train samples, 2 unique classes
  Client 18: 45540 train samples, 2 unique classes
  Client 19: 46497 train samples, 2 unique classes
Will sample 4500 samples per client per epoch
Graph: fully, nodes: 20, edges: 190
Degree statistics: avg=19.00, min=19, max=19
Attack: Compromised 6/20 nodes: [5, 12, 13, 14, 17, 18]
Attack type: gaussian, lambda: 1.0
Model variant: baseline
Model parameters: 1,174,986
BALANCE algorithm:
Balance Config: BALANCEConfig(gamma=2, kappa=1, alpha=0.5, min_neighbors=1)
  - Model dimension: 1,174,986 parameters
  - Complexity: O(N×d) = O(20×1,174,986)
Initial test acc across nodes: mean=0.4965 ± 0.0152
Round 001: test acc mean=0.5548 ± 0.0290 | min=0.5004 max=0.6005
         : test loss mean=0.6913 ± 0.0005
         : individual accs = ['0.534570', '0.583140', '0.521730', '0.566857', '0.560051', '0.566757', '0.516032', '0.600530', '0.500420', '0.586447', '0.564905', '0.564257', '0.591612', '0.560437', '0.582472', '0.525599', '0.568837', '0.501718', '0.535682', '0.563997']
         : correct/total = [(7608, 14232), (8301, 14235), (7443, 14266), (8059, 14217), (7974, 14238), (8146, 14373), (7403, 14346), (8608, 14334), (7153, 14294), (8429, 14373), (8103, 14344), (8070, 14302), (8492, 14354), (8049, 14362), (8341, 14320), (7566, 14395), (8185, 14389), (7153, 14257), (7634, 14251), (8121, 14399)]
         : compromised: 0.5564, honest: 0.5541
Round 002: test acc mean=0.4949 ± 0.0056 | min=0.4861 max=0.5086
         : test loss mean=0.6934 ± 0.0002
         : individual accs = ['0.489109', '0.486266', '0.486051', '0.492228', '0.494100', '0.493843', '0.497560', '0.495186', '0.488457', '0.493008', '0.499024', '0.492029', '0.499512', '0.508564', '0.495810', '0.498367', '0.499757', '0.503051', '0.488738', '0.496354']
         : correct/total = [(6961, 14232), (6922, 14235), (6934, 14266), (6998, 14217), (7035, 14238), (7098, 14373), (7138, 14346), (7098, 14334), (6982, 14294), (7086, 14373), (7158, 14344), (7037, 14302), (7170, 14354), (7304, 14362), (7100, 14320), (7174, 14395), (7191, 14389), (7172, 14257), (6965, 14251), (7147, 14399)]
         : compromised: 0.4983, honest: 0.4934
Round 003: test acc mean=0.4949 ± 0.0056 | min=0.4861 max=0.5086
         : test loss mean=0.6940 ± 0.0003
         : individual accs = ['0.489109', '0.486266', '0.486051', '0.492228', '0.494100', '0.493843', '0.497560', '0.495186', '0.488457', '0.493008', '0.499024', '0.492029', '0.499512', '0.508564', '0.495810', '0.498367', '0.499757', '0.503051', '0.488738', '0.496354']
         : correct/total = [(6961, 14232), (6922, 14235), (6934, 14266), (6998, 14217), (7035, 14238), (7098, 14373), (7138, 14346), (7098, 14334), (6982, 14294), (7086, 14373), (7158, 14344), (7037, 14302), (7170, 14354), (7304, 14362), (7100, 14320), (7174, 14395), (7191, 14389), (7172, 14257), (6965, 14251), (7147, 14399)]
         : compromised: 0.4983, honest: 0.4934
Round 004: test acc mean=0.4949 ± 0.0056 | min=0.4861 max=0.5086
         : test loss mean=0.6940 ± 0.0003
         : individual accs = ['0.489109', '0.486266', '0.486051', '0.492228', '0.494100', '0.493843', '0.497560', '0.495186', '0.488457', '0.493008', '0.499024', '0.492029', '0.499512', '0.508564', '0.495810', '0.498367', '0.499757', '0.503051', '0.488738', '0.496354']
         : correct/total = [(6961, 14232), (6922, 14235), (6934, 14266), (6998, 14217), (7035, 14238), (7098, 14373), (7138, 14346), (7098, 14334), (6982, 14294), (7086, 14373), (7158, 14344), (7037, 14302), (7170, 14354), (7304, 14362), (7100, 14320), (7174, 14395), (7191, 14389), (7172, 14257), (6965, 14251), (7147, 14399)]
         : compromised: 0.4983, honest: 0.4934
Round 005: test acc mean=0.4949 ± 0.0056 | min=0.4861 max=0.5086
         : test loss mean=0.6941 ± 0.0004
         : individual accs = ['0.489109', '0.486266', '0.486051', '0.492228', '0.494100', '0.493843', '0.497560', '0.495186', '0.488457', '0.493008', '0.499024', '0.492029', '0.499512', '0.508564', '0.495810', '0.498367', '0.499757', '0.503051', '0.488738', '0.496354']
         : correct/total = [(6961, 14232), (6922, 14235), (6934, 14266), (6998, 14217), (7035, 14238), (7098, 14373), (7138, 14346), (7098, 14334), (6982, 14294), (7086, 14373), (7158, 14344), (7037, 14302), (7170, 14354), (7304, 14362), (7100, 14320), (7174, 14395), (7191, 14389), (7172, 14257), (6965, 14251), (7147, 14399)]
         : compromised: 0.4983, honest: 0.4934
Round 006: test acc mean=0.4949 ± 0.0056 | min=0.4861 max=0.5086
         : test loss mean=0.6941 ± 0.0003
         : individual accs = ['0.489109', '0.486266', '0.486051', '0.492228', '0.494100', '0.493843', '0.497560', '0.495186', '0.488457', '0.493008', '0.499024', '0.492029', '0.499512', '0.508564', '0.495810', '0.498367', '0.499757', '0.503051', '0.488738', '0.496354']
         : correct/total = [(6961, 14232), (6922, 14235), (6934, 14266), (6998, 14217), (7035, 14238), (7098, 14373), (7138, 14346), (7098, 14334), (6982, 14294), (7086, 14373), (7158, 14344), (7037, 14302), (7170, 14354), (7304, 14362), (7100, 14320), (7174, 14395), (7191, 14389), (7172, 14257), (6965, 14251), (7147, 14399)]
         : compromised: 0.4983, honest: 0.4934
Round 007: test acc mean=0.4949 ± 0.0056 | min=0.4861 max=0.5086
         : test loss mean=0.6941 ± 0.0003
         : individual accs = ['0.489109', '0.486266', '0.486051', '0.492228', '0.494100', '0.493843', '0.497560', '0.495186', '0.488457', '0.493008', '0.499024', '0.492029', '0.499512', '0.508564', '0.495810', '0.498367', '0.499757', '0.503051', '0.488738', '0.496354']
         : correct/total = [(6961, 14232), (6922, 14235), (6934, 14266), (6998, 14217), (7035, 14238), (7098, 14373), (7138, 14346), (7098, 14334), (6982, 14294), (7086, 14373), (7158, 14344), (7037, 14302), (7170, 14354), (7304, 14362), (7100, 14320), (7174, 14395), (7191, 14389), (7172, 14257), (6965, 14251), (7147, 14399)]
         : compromised: 0.4983, honest: 0.4934
Round 008: test acc mean=0.4949 ± 0.0056 | min=0.4861 max=0.5086
         : test loss mean=0.6941 ± 0.0003
         : individual accs = ['0.489109', '0.486266', '0.486051', '0.492228', '0.494100', '0.493843', '0.497560', '0.495186', '0.488457', '0.493008', '0.499024', '0.492029', '0.499512', '0.508564', '0.495810', '0.498367', '0.499757', '0.503051', '0.488738', '0.496354']
         : correct/total = [(6961, 14232), (6922, 14235), (6934, 14266), (6998, 14217), (7035, 14238), (7098, 14373), (7138, 14346), (7098, 14334), (6982, 14294), (7086, 14373), (7158, 14344), (7037, 14302), (7170, 14354), (7304, 14362), (7100, 14320), (7174, 14395), (7191, 14389), (7172, 14257), (6965, 14251), (7147, 14399)]
         : compromised: 0.4983, honest: 0.4934
Round 009: test acc mean=0.4949 ± 0.0056 | min=0.4861 max=0.5086
         : test loss mean=0.6941 ± 0.0004
         : individual accs = ['0.489109', '0.486266', '0.486051', '0.492228', '0.494100', '0.493843', '0.497560', '0.495186', '0.488457', '0.493008', '0.499024', '0.492029', '0.499512', '0.508564', '0.495810', '0.498367', '0.499757', '0.503051', '0.488738', '0.496354']
         : correct/total = [(6961, 14232), (6922, 14235), (6934, 14266), (6998, 14217), (7035, 14238), (7098, 14373), (7138, 14346), (7098, 14334), (6982, 14294), (7086, 14373), (7158, 14344), (7037, 14302), (7170, 14354), (7304, 14362), (7100, 14320), (7174, 14395), (7191, 14389), (7172, 14257), (6965, 14251), (7147, 14399)]
         : compromised: 0.4983, honest: 0.4934
Round 010: test acc mean=0.4949 ± 0.0056 | min=0.4861 max=0.5086
         : test loss mean=0.6942 ± 0.0004
         : individual accs = ['0.489109', '0.486266', '0.486051', '0.492228', '0.494100', '0.493843', '0.497560', '0.495186', '0.488457', '0.493008', '0.499024', '0.492029', '0.499512', '0.508564', '0.495810', '0.498367', '0.499757', '0.503051', '0.488738', '0.496354']
         : correct/total = [(6961, 14232), (6922, 14235), (6934, 14266), (6998, 14217), (7035, 14238), (7098, 14373), (7138, 14346), (7098, 14334), (6982, 14294), (7086, 14373), (7158, 14344), (7037, 14302), (7170, 14354), (7304, 14362), (7100, 14320), (7174, 14395), (7191, 14389), (7172, 14257), (6965, 14251), (7147, 14399)]
         : compromised: 0.4983, honest: 0.4934

=== FINAL RESULTS ===
Dataset: sent140, Nodes: 20, Graph: fully, Aggregation: balance
Attack: gaussian, 30.0% compromised
Final accuracy - Compromised: 0.4983, Honest: 0.4934
Overall test accuracy: mean=0.4949 ± 0.0056

=== BALANCE SUMMARY ===
Node 0: acceptance=0.684
Node 1: acceptance=0.684
Node 2: acceptance=0.684
Node 3: acceptance=0.684
Node 4: acceptance=0.684
Node 5: acceptance=0.737
Node 6: acceptance=0.684
Node 7: acceptance=0.684
Node 8: acceptance=0.684
Node 9: acceptance=0.684
Node 10: acceptance=0.684
Node 11: acceptance=0.684
Node 12: acceptance=0.737
Node 13: acceptance=0.737
Node 14: acceptance=0.737
Node 15: acceptance=0.684
Node 16: acceptance=0.684
Node 17: acceptance=0.737
Node 18: acceptance=0.737
Node 19: acceptance=0.684

=== PARALLEL EXECUTION TIME (realistic for distributed system) ===
  COMMUNICATION (max across nodes):
    - Full model transfer: 0.000s (0.0%)
  COMPUTATION (max across nodes):
    - Filtering: 0.089s (83.7%)
    - Aggregation: 0.017s (16.3%)
  TOTALS:
    - Total computation: 0.106s (100.0%)
    - Total communication: 0.000s (0.0%)
    - Total parallel time: 0.106s

=== PER-NODE AVERAGE TIME ===
  - Filtering: 0.080s
  - Aggregation: 0.011s
  - Model transfer: 0.000s
  - Total per node: 0.091s

=== TOTAL COMPUTATIONAL WORK (sum across all nodes) ===
  - Total filtering: 1.598s
  - Total aggregation: 0.226s
  - Total model transfer: 0.000s
  - Grand total: 1.825s
  - Mean acceptance rate: 0.700

BALANCE Algorithm Properties:
  - Model dimension: 1,174,986
  - No compression: Full parameter comparison
  - Theoretical complexity: O(deg(i)×d)
  - Approach: Full parameter filtering + averaging
