Device: cuda
Seed: 987654321
Loading 1 LEAF Sent140 train files...
LEAF Sent140 train: 254555 users, 908652 samples
Building vocabulary (max_size=10000)...
Vocabulary size: 10000
Loading 1 LEAF Sent140 test files...
LEAF Sent140 test: 254555 users, 286281 samples
Found 254555 train users, 254555 test users, 254555 common users
User sample counts range: 494 (max) to 1 (min)
Distributed ALL 254555 users across 20 clients
Users per client: 12727 (with 15 clients getting +1 user)
Train partition sizes: [44353, 44290, 44657, 44907, 44696, 45843, 45801, 45619, 45069, 45639, 45821, 45311, 45779, 46056, 45625, 45984, 46428, 44737, 45540, 46497]
Test partition sizes: [14232, 14235, 14266, 14217, 14238, 14373, 14346, 14334, 14294, 14373, 14344, 14302, 14354, 14362, 14320, 14395, 14389, 14257, 14251, 14399]
  Client 0: 44353 train samples, 2 unique classes
  Client 1: 44290 train samples, 2 unique classes
  Client 2: 44657 train samples, 2 unique classes
  Client 3: 44907 train samples, 2 unique classes
  Client 4: 44696 train samples, 2 unique classes
  Client 5: 45843 train samples, 2 unique classes
  Client 6: 45801 train samples, 2 unique classes
  Client 7: 45619 train samples, 2 unique classes
  Client 8: 45069 train samples, 2 unique classes
  Client 9: 45639 train samples, 2 unique classes
  Client 10: 45821 train samples, 2 unique classes
  Client 11: 45311 train samples, 2 unique classes
  Client 12: 45779 train samples, 2 unique classes
  Client 13: 46056 train samples, 2 unique classes
  Client 14: 45625 train samples, 2 unique classes
  Client 15: 45984 train samples, 2 unique classes
  Client 16: 46428 train samples, 2 unique classes
  Client 17: 44737 train samples, 2 unique classes
  Client 18: 45540 train samples, 2 unique classes
  Client 19: 46497 train samples, 2 unique classes
Will sample 4500 samples per client per epoch
Graph: erdos, nodes: 20, edges: 99
Degree statistics: avg=9.90, min=7, max=14
Attack: Compromised 4/20 nodes: [5, 12, 13, 17]
Attack type: backdoor, lambda: 1.0
Backdoor target label: 1, trigger size: 3
Model variant: baseline
Model parameters: 1,174,986
BALANCE algorithm:
Balance Config: BALANCEConfig(gamma=2, kappa=1, alpha=0.5, min_neighbors=1)
  - Model dimension: 1,174,986 parameters
  - Complexity: O(N×d) = O(20×1,174,986)
Initial test acc across nodes: mean=0.4953 ± 0.0174
Backdoor attack: Created poisoned datasets for 4 compromised nodes
Round 001: test acc mean=0.5066 ± 0.0168 | min=0.4719 max=0.5544
         : test loss mean=8.9395 ± 16.6030
         : individual accs = ['0.471894', '0.515349', '0.517314', '0.508124', '0.504706', '0.525290', '0.489614', '0.493791', '0.516650', '0.554373', '0.498745', '0.503426', '0.514700', '0.518660', '0.491969', '0.500868', '0.503788', '0.512660', '0.504175', '0.485311']
         : correct/total = [(6716, 14232), (7336, 14235), (7380, 14266), (7224, 14217), (7186, 14238), (7550, 14373), (7024, 14346), (7078, 14334), (7385, 14294), (7968, 14373), (7154, 14344), (7200, 14302), (7388, 14354), (7449, 14362), (7045, 14320), (7210, 14395), (7249, 14389), (7309, 14257), (7185, 14251), (6988, 14399)]
         : compromised: 0.5178, honest: 0.5038
Round 002: test acc mean=0.5378 ± 0.0392 | min=0.4908 max=0.6133
         : test loss mean=65.7101 ± 134.1223
         : individual accs = ['0.513561', '0.613277', '0.597925', '0.597172', '0.542773', '0.516454', '0.528161', '0.506209', '0.501819', '0.535379', '0.527956', '0.596770', '0.495820', '0.490809', '0.508729', '0.600556', '0.525610', '0.513081', '0.542278', '0.502049']
         : correct/total = [(7309, 14232), (8730, 14235), (8530, 14266), (8490, 14217), (7728, 14238), (7423, 14373), (7577, 14346), (7256, 14334), (7173, 14294), (7695, 14373), (7573, 14344), (8535, 14302), (7117, 14354), (7049, 14362), (7285, 14320), (8645, 14395), (7563, 14389), (7315, 14257), (7728, 14251), (7229, 14399)]
         : compromised: 0.5040, honest: 0.5463
Round 003: test acc mean=0.5393 ± 0.0380 | min=0.4889 max=0.6017
         : test loss mean=3140.7800 ± 6727.7526
         : individual accs = ['0.518550', '0.558483', '0.599327', '0.591053', '0.498876', '0.511167', '0.506134', '0.501814', '0.571359', '0.523342', '0.594604', '0.547476', '0.501672', '0.488929', '0.504818', '0.545467', '0.582250', '0.499895', '0.539471', '0.601708']
         : correct/total = [(7380, 14232), (7950, 14235), (8550, 14266), (8403, 14217), (7103, 14238), (7347, 14373), (7261, 14346), (7193, 14334), (8167, 14294), (7522, 14373), (8529, 14344), (7830, 14302), (7201, 14354), (7022, 14362), (7229, 14320), (7852, 14395), (8378, 14389), (7127, 14257), (7688, 14251), (8664, 14399)]
         : compromised: 0.5004, honest: 0.5490
Round 004: test acc mean=0.5743 ± 0.0456 | min=0.4937 max=0.6330
         : test loss mean=954061.2395 ± 2515190.1997
         : individual accs = ['0.580663', '0.622831', '0.565681', '0.599072', '0.618907', '0.503027', '0.615015', '0.552323', '0.578075', '0.585055', '0.601924', '0.609495', '0.493730', '0.504735', '0.515992', '0.607572', '0.578567', '0.499404', '0.621360', '0.633030']
         : correct/total = [(8264, 14232), (8866, 14235), (8070, 14266), (8517, 14217), (8812, 14238), (7230, 14373), (8823, 14346), (7917, 14334), (8263, 14294), (8409, 14373), (8634, 14344), (8717, 14302), (7087, 14354), (7249, 14362), (7389, 14320), (8746, 14395), (8325, 14389), (7120, 14257), (8855, 14251), (9115, 14399)]
         : compromised: 0.5002, honest: 0.5928
Round 005: test acc mean=0.5984 ± 0.0466 | min=0.4943 max=0.6382
         : test loss mean=18113770.6840 ± 37650117.9170
         : individual accs = ['0.623243', '0.631472', '0.621828', '0.632764', '0.631268', '0.499548', '0.630420', '0.638203', '0.601581', '0.611842', '0.600669', '0.620123', '0.520203', '0.518660', '0.614106', '0.621883', '0.613455', '0.494284', '0.604308', '0.637336']
         : correct/total = [(8870, 14232), (8989, 14235), (8871, 14266), (8996, 14217), (8988, 14238), (7180, 14373), (9044, 14346), (9148, 14334), (8599, 14294), (8794, 14373), (8616, 14344), (8869, 14302), (7467, 14354), (7449, 14362), (8794, 14320), (8952, 14395), (8827, 14389), (7047, 14257), (8612, 14251), (9177, 14399)]
         : compromised: 0.5082, honest: 0.6209
Round 006: test acc mean=0.6086 ± 0.0525 | min=0.4983 max=0.6471
         : test loss mean=2236307089.7140 ± 4515460217.8020
         : individual accs = ['0.640528', '0.640745', '0.629048', '0.633186', '0.639907', '0.512906', '0.636693', '0.612530', '0.641318', '0.635775', '0.624303', '0.618864', '0.498328', '0.506963', '0.640573', '0.632859', '0.644798', '0.501929', '0.634131', '0.647128']
         : correct/total = [(9116, 14232), (9121, 14235), (8974, 14266), (9002, 14217), (9111, 14238), (7372, 14373), (9134, 14346), (8780, 14334), (9167, 14294), (9138, 14373), (8955, 14344), (8851, 14302), (7153, 14354), (7281, 14362), (9173, 14320), (9110, 14395), (9278, 14389), (7156, 14257), (9037, 14251), (9318, 14399)]
         : compromised: 0.5050, honest: 0.6345
Round 007: test acc mean=0.6113 ± 0.0562 | min=0.4909 max=0.6499
         : test loss mean=160210926821.6977 ± 341872631800.0276
         : individual accs = ['0.643269', '0.649947', '0.640754', '0.639375', '0.642998', '0.503722', '0.641573', '0.619925', '0.648734', '0.643707', '0.633505', '0.632499', '0.505155', '0.490879', '0.648324', '0.625148', '0.642227', '0.499825', '0.635815', '0.637683']
         : correct/total = [(9155, 14232), (9252, 14235), (9141, 14266), (9090, 14217), (9155, 14238), (7240, 14373), (9204, 14346), (8886, 14334), (9273, 14294), (9252, 14373), (9087, 14344), (9046, 14302), (7251, 14354), (7050, 14362), (9284, 14320), (8999, 14395), (9241, 14389), (7126, 14257), (9061, 14251), (9182, 14399)]
         : compromised: 0.4999, honest: 0.6391
Round 008: test acc mean=0.6193 ± 0.0591 | min=0.4953 max=0.6572
         : test loss mean=20005706786650.8516 ± 43429867141222.5391
         : individual accs = ['0.648398', '0.637162', '0.630801', '0.653654', '0.646861', '0.502818', '0.652168', '0.645947', '0.656149', '0.651012', '0.647030', '0.655153', '0.510311', '0.495335', '0.649651', '0.647725', '0.657238', '0.498773', '0.644797', '0.655323']
         : correct/total = [(9228, 14232), (9070, 14235), (8999, 14266), (9293, 14217), (9210, 14238), (7227, 14373), (9356, 14346), (9259, 14334), (9379, 14294), (9357, 14373), (9281, 14344), (9370, 14302), (7325, 14354), (7114, 14362), (9303, 14320), (9324, 14395), (9457, 14389), (7111, 14257), (9189, 14251), (9436, 14399)]
         : compromised: 0.5018, honest: 0.6487
Round 009: test acc mean=0.6226 ± 0.0610 | min=0.4936 max=0.6627
         : test loss mean=1204159488841188.5000 ± 2620171193049159.0000
         : individual accs = ['0.629708', '0.660133', '0.654073', '0.656046', '0.646931', '0.499756', '0.648752', '0.657388', '0.655940', '0.650525', '0.641313', '0.654314', '0.510729', '0.493594', '0.657542', '0.650920', '0.662659', '0.502420', '0.656726', '0.661574']
         : correct/total = [(8962, 14232), (9397, 14235), (9331, 14266), (9327, 14217), (9211, 14238), (7183, 14373), (9307, 14346), (9423, 14334), (9376, 14294), (9350, 14373), (9199, 14344), (9358, 14302), (7331, 14354), (7089, 14362), (9416, 14320), (9370, 14395), (9535, 14389), (7163, 14257), (9359, 14251), (9526, 14399)]
         : compromised: 0.5016, honest: 0.6528
Round 010: test acc mean=0.6289 ± 0.0628 | min=0.4984 max=0.6687
         : test loss mean=110658524736086192.0000 ± 231526831869026624.0000
         : individual accs = ['0.657954', '0.664910', '0.632202', '0.662376', '0.663014', '0.503444', '0.664157', '0.667922', '0.667413', '0.656857', '0.656093', '0.668718', '0.498398', '0.517407', '0.665573', '0.652171', '0.668080', '0.498913', '0.654761', '0.657268']
         : correct/total = [(9364, 14232), (9465, 14235), (9019, 14266), (9417, 14217), (9440, 14238), (7236, 14373), (9528, 14346), (9574, 14334), (9540, 14294), (9441, 14373), (9411, 14344), (9564, 14302), (7154, 14354), (7431, 14362), (9531, 14320), (9388, 14395), (9613, 14389), (7113, 14257), (9331, 14251), (9464, 14399)]
         : compromised: 0.5045, honest: 0.6600

=== FINAL RESULTS ===
Dataset: sent140, Nodes: 20, Graph: erdos, Aggregation: balance
Attack: backdoor, 20.0% compromised
Final accuracy - Compromised: 0.5045, Honest: 0.6600
Overall test accuracy: mean=0.6289 ± 0.0628

=== BACKDOOR ATTACK SUCCESS RATE (ASR) ===
Target label: 1
Trigger size: 3x3
Overall ASR: 0.5734 ± 0.1721
Honest nodes ASR: 0.5059 ± 0.0742
Compromised nodes ASR: 0.8436 ± 0.1863
Note: Higher ASR indicates more successful backdoor attack

=== BALANCE SUMMARY ===
Node 0: acceptance=0.850
Node 1: acceptance=0.820
Node 2: acceptance=1.000
Node 3: acceptance=0.871
Node 4: acceptance=0.800
Node 5: acceptance=0.600
Node 6: acceptance=0.775
Node 7: acceptance=0.755
Node 8: acceptance=0.614
Node 9: acceptance=1.000
Node 10: acceptance=0.775
Node 11: acceptance=0.775
Node 12: acceptance=0.600
Node 13: acceptance=0.600
Node 14: acceptance=0.743
Node 15: acceptance=0.800
Node 16: acceptance=0.743
Node 17: acceptance=0.600
Node 18: acceptance=0.850
Node 19: acceptance=0.640

=== PARALLEL EXECUTION TIME (realistic for distributed system) ===
  COMMUNICATION (max across nodes):
    - Full model transfer: 0.000s (0.0%)
  COMPUTATION (max across nodes):
    - Filtering: 0.056s (77.8%)
    - Aggregation: 0.016s (22.2%)
  TOTALS:
    - Total computation: 0.071s (100.0%)
    - Total communication: 0.000s (0.0%)
    - Total parallel time: 0.071s

=== PER-NODE AVERAGE TIME ===
  - Filtering: 0.040s
  - Aggregation: 0.008s
  - Model transfer: 0.000s
  - Total per node: 0.049s

=== TOTAL COMPUTATIONAL WORK (sum across all nodes) ===
  - Total filtering: 0.806s
  - Total aggregation: 0.165s
  - Total model transfer: 0.000s
  - Grand total: 0.972s
  - Mean acceptance rate: 0.761

BALANCE Algorithm Properties:
  - Model dimension: 1,174,986
  - No compression: Full parameter comparison
  - Theoretical complexity: O(deg(i)×d)
  - Approach: Full parameter filtering + averaging
