Device: cuda
Seed: 987654321
Loading 1 LEAF Sent140 train files...
LEAF Sent140 train: 254555 users, 908652 samples
Building vocabulary (max_size=10000)...
Vocabulary size: 10000
Loading 1 LEAF Sent140 test files...
LEAF Sent140 test: 254555 users, 286281 samples
Found 254555 train users, 254555 test users, 254555 common users
User sample counts range: 494 (max) to 1 (min)
Distributed ALL 254555 users across 20 clients
Users per client: 12727 (with 15 clients getting +1 user)
Train partition sizes: [44353, 44290, 44657, 44907, 44696, 45843, 45801, 45619, 45069, 45639, 45821, 45311, 45779, 46056, 45625, 45984, 46428, 44737, 45540, 46497]
Test partition sizes: [14232, 14235, 14266, 14217, 14238, 14373, 14346, 14334, 14294, 14373, 14344, 14302, 14354, 14362, 14320, 14395, 14389, 14257, 14251, 14399]
  Client 0: 44353 train samples, 2 unique classes
  Client 1: 44290 train samples, 2 unique classes
  Client 2: 44657 train samples, 2 unique classes
  Client 3: 44907 train samples, 2 unique classes
  Client 4: 44696 train samples, 2 unique classes
  Client 5: 45843 train samples, 2 unique classes
  Client 6: 45801 train samples, 2 unique classes
  Client 7: 45619 train samples, 2 unique classes
  Client 8: 45069 train samples, 2 unique classes
  Client 9: 45639 train samples, 2 unique classes
  Client 10: 45821 train samples, 2 unique classes
  Client 11: 45311 train samples, 2 unique classes
  Client 12: 45779 train samples, 2 unique classes
  Client 13: 46056 train samples, 2 unique classes
  Client 14: 45625 train samples, 2 unique classes
  Client 15: 45984 train samples, 2 unique classes
  Client 16: 46428 train samples, 2 unique classes
  Client 17: 44737 train samples, 2 unique classes
  Client 18: 45540 train samples, 2 unique classes
  Client 19: 46497 train samples, 2 unique classes
Will sample 4500 samples per client per epoch
Graph: erdos, nodes: 20, edges: 48
Degree statistics: avg=4.80, min=2, max=7
Attack: Compromised 16/20 nodes: [1, 2, 3, 5, 6, 8, 9, 10, 11, 12, 13, 14, 15, 17, 18, 19]
Attack type: krum, lambda: 1.0
Model variant: baseline
Model parameters: 1,174,986
UBAR ALGORITHM (Two-Stage Byzantine-resilient)
  - Model dimension: 1,174,986 parameters
  - Rho parameter: 0.19999999999999996
  - Stage 1: Distance-based filtering (select 20% closest neighbors)
  - Stage 2: Performance-based selection (loss comparison)
  - Complexity: O(deg(i)×d + deg(i)×inference)
Initial test acc across nodes: mean=0.4965 ± 0.0152
Round 001: test acc mean=0.5253 ± 0.0279 | min=0.4805 max=0.5722
         : test loss mean=1.7395 ± 2.3930
         : individual accs = ['0.544056', '0.480506', '0.534417', '0.492650', '0.563984', '0.535170', '0.507040', '0.563555', '0.533581', '0.543589', '0.515407', '0.502098', '0.572175', '0.487258', '0.529818', '0.554081', '0.545903', '0.524023', '0.485369', '0.491423']
         : correct/total = [(7743, 14232), (6840, 14235), (7624, 14266), (7004, 14217), (8030, 14238), (7692, 14373), (7274, 14346), (8078, 14334), (7627, 14294), (7813, 14373), (7393, 14344), (7181, 14302), (8213, 14354), (6998, 14362), (7587, 14320), (7976, 14395), (7855, 14389), (7471, 14257), (6917, 14251), (7076, 14399)]
         : compromised: 0.5180, honest: 0.5544
         : ubar stats = ['Node 0: s1=0.167, s2=1.000', 'Node 1: s1=0.167, s2=1.000', 'Node 2: s1=0.200, s2=1.000']...
Round 002: test acc mean=0.5649 ± 0.0374 | min=0.4828 max=0.6080
         : test loss mean=1.3145 ± 1.2639
         : individual accs = ['0.591835', '0.534457', '0.579069', '0.482802', '0.607951', '0.583803', '0.560993', '0.605553', '0.570519', '0.576915', '0.595162', '0.503776', '0.596698', '0.501532', '0.563547', '0.570962', '0.595385', '0.584765', '0.588450', '0.503299']
         : correct/total = [(8423, 14232), (7608, 14235), (8261, 14266), (6864, 14217), (8656, 14238), (8391, 14373), (8048, 14346), (8680, 14334), (8155, 14294), (8292, 14373), (8537, 14344), (7205, 14302), (8565, 14354), (7203, 14362), (8070, 14320), (8219, 14395), (8567, 14389), (8337, 14257), (8386, 14251), (7247, 14399)]
         : compromised: 0.5560, honest: 0.6002
         : ubar stats = ['Node 0: s1=0.167, s2=1.000', 'Node 1: s1=0.167, s2=1.000', 'Node 2: s1=0.200, s2=1.000']...
Round 003: test acc mean=0.5820 ± 0.0448 | min=0.4820 max=0.6220
         : test loss mean=0.9812 ± 0.6280
         : individual accs = ['0.605115', '0.580049', '0.594771', '0.507913', '0.621997', '0.604954', '0.598703', '0.618460', '0.598853', '0.598553', '0.595859', '0.500420', '0.618364', '0.489834', '0.588966', '0.602431', '0.609563', '0.607982', '0.614343', '0.481978']
         : correct/total = [(8612, 14232), (8257, 14235), (8485, 14266), (7221, 14217), (8856, 14238), (8695, 14373), (8589, 14346), (8865, 14334), (8560, 14294), (8603, 14373), (8547, 14344), (7157, 14302), (8876, 14354), (7035, 14362), (8434, 14320), (8672, 14395), (8771, 14389), (8668, 14257), (8755, 14251), (6940, 14399)]
         : compromised: 0.5740, honest: 0.6138
         : ubar stats = ['Node 0: s1=0.167, s2=1.000', 'Node 1: s1=0.167, s2=1.000', 'Node 2: s1=0.200, s2=1.000']...
Round 004: test acc mean=0.5972 ± 0.0473 | min=0.4922 max=0.6286
         : test loss mean=0.9095 ± 0.5140
         : individual accs = ['0.620363', '0.618265', '0.615099', '0.492228', '0.626633', '0.628400', '0.616478', '0.623204', '0.616343', '0.615529', '0.628416', '0.503426', '0.628605', '0.516084', '0.607891', '0.623550', '0.618598', '0.622151', '0.621290', '0.501840']
         : correct/total = [(8829, 14232), (8801, 14235), (8775, 14266), (6998, 14217), (8922, 14238), (9032, 14373), (8844, 14346), (8933, 14334), (8810, 14294), (8847, 14373), (9014, 14344), (7200, 14302), (9023, 14354), (7412, 14362), (8705, 14320), (8976, 14395), (8901, 14389), (8870, 14257), (8854, 14251), (7226, 14399)]
         : compromised: 0.5910, honest: 0.6222
         : ubar stats = ['Node 0: s1=0.167, s2=1.000', 'Node 1: s1=0.167, s2=1.000', 'Node 2: s1=0.200, s2=1.000']...
Round 005: test acc mean=0.6055 ± 0.0482 | min=0.5052 max=0.6395
         : test loss mean=0.9836 ± 0.6815
         : individual accs = ['0.628443', '0.631963', '0.623230', '0.513188', '0.639486', '0.636402', '0.623519', '0.632971', '0.620050', '0.624574', '0.633993', '0.512236', '0.634736', '0.505222', '0.618156', '0.633762', '0.627702', '0.631129', '0.630763', '0.508091']
         : correct/total = [(8944, 14232), (8996, 14235), (8891, 14266), (7296, 14217), (9105, 14238), (9147, 14373), (8945, 14346), (9073, 14334), (8863, 14294), (8977, 14373), (9094, 14344), (7326, 14302), (9111, 14354), (7256, 14362), (8852, 14320), (9123, 14395), (9032, 14389), (8998, 14257), (8989, 14251), (7316, 14399)]
         : compromised: 0.5988, honest: 0.6322
         : ubar stats = ['Node 0: s1=0.167, s2=1.000', 'Node 1: s1=0.167, s2=1.000', 'Node 2: s1=0.200, s2=1.000']...
Round 006: test acc mean=0.6077 ± 0.0535 | min=0.4954 max=0.6434
         : test loss mean=0.8390 ± 0.3994
         : individual accs = ['0.631956', '0.633017', '0.631712', '0.495393', '0.641593', '0.643429', '0.631883', '0.641342', '0.626277', '0.633340', '0.636712', '0.505454', '0.640867', '0.498538', '0.621020', '0.636193', '0.628605', '0.636109', '0.635113', '0.505452']
         : correct/total = [(8994, 14232), (9011, 14235), (9012, 14266), (7043, 14217), (9135, 14238), (9248, 14373), (9065, 14346), (9193, 14334), (8952, 14294), (9103, 14373), (9133, 14344), (7229, 14302), (9199, 14354), (7160, 14362), (8893, 14320), (9158, 14395), (9045, 14389), (9069, 14257), (9051, 14251), (7278, 14399)]
         : compromised: 0.6007, honest: 0.6359
         : ubar stats = ['Node 0: s1=0.167, s2=1.000', 'Node 1: s1=0.167, s2=1.000', 'Node 2: s1=0.200, s2=1.000']...
Round 007: test acc mean=0.6130 ± 0.0523 | min=0.5042 max=0.6454
         : test loss mean=0.9341 ± 0.5977
         : individual accs = ['0.645447', '0.640955', '0.633254', '0.512415', '0.643700', '0.644681', '0.637739', '0.643714', '0.627116', '0.641481', '0.633436', '0.513355', '0.638219', '0.504178', '0.635405', '0.641125', '0.638682', '0.639475', '0.640025', '0.504757']
         : correct/total = [(9186, 14232), (9124, 14235), (9034, 14266), (7285, 14217), (9165, 14238), (9266, 14373), (9149, 14346), (9227, 14334), (8964, 14294), (9220, 14373), (9086, 14344), (7342, 14302), (9161, 14354), (7241, 14362), (9099, 14320), (9229, 14395), (9190, 14389), (9117, 14257), (9121, 14251), (7268, 14399)]
         : compromised: 0.6055, honest: 0.6429
         : ubar stats = ['Node 0: s1=0.167, s2=1.000', 'Node 1: s1=0.167, s2=1.000', 'Node 2: s1=0.200, s2=1.000']...
Round 008: test acc mean=0.6165 ± 0.0529 | min=0.5060 max=0.6491
         : test loss mean=0.8113 ± 0.3577
         : individual accs = ['0.648679', '0.649104', '0.642016', '0.514736', '0.640188', '0.643220', '0.642061', '0.642668', '0.637750', '0.638211', '0.645566', '0.506013', '0.642678', '0.508704', '0.640852', '0.647655', '0.641740', '0.643403', '0.640516', '0.514063']
         : correct/total = [(9232, 14232), (9240, 14235), (9159, 14266), (7318, 14217), (9115, 14238), (9245, 14373), (9211, 14346), (9212, 14334), (9116, 14294), (9173, 14373), (9260, 14344), (7237, 14302), (9225, 14354), (7306, 14362), (9177, 14320), (9323, 14395), (9234, 14389), (9173, 14257), (9128, 14251), (7402, 14399)]
         : compromised: 0.6098, honest: 0.6433
         : ubar stats = ['Node 0: s1=0.167, s2=1.000', 'Node 1: s1=0.167, s2=1.000', 'Node 2: s1=0.200, s2=1.000']...
Round 009: test acc mean=0.6192 ± 0.0546 | min=0.5056 max=0.6530
         : test loss mean=0.8950 ± 0.5319
         : individual accs = ['0.653035', '0.651071', '0.644189', '0.513329', '0.647774', '0.649621', '0.646940', '0.646993', '0.642367', '0.643498', '0.648355', '0.512935', '0.648251', '0.509261', '0.635405', '0.652101', '0.644937', '0.645157', '0.642271', '0.505591']
         : correct/total = [(9294, 14232), (9268, 14235), (9190, 14266), (7298, 14217), (9223, 14238), (9337, 14373), (9281, 14346), (9274, 14334), (9182, 14294), (9249, 14373), (9300, 14344), (7336, 14302), (9305, 14354), (7314, 14362), (9099, 14320), (9387, 14395), (9280, 14389), (9198, 14257), (9153, 14251), (7280, 14399)]
         : compromised: 0.6119, honest: 0.6482
         : ubar stats = ['Node 0: s1=0.167, s2=1.000', 'Node 1: s1=0.167, s2=1.000', 'Node 2: s1=0.200, s2=1.000']...
Round 010: test acc mean=0.6196 ± 0.0581 | min=0.4962 max=0.6570
         : test loss mean=0.8099 ± 0.3655
         : individual accs = ['0.657040', '0.654795', '0.647554', '0.510727', '0.651636', '0.648160', '0.648404', '0.650063', '0.643907', '0.646629', '0.650934', '0.496224', '0.649854', '0.503273', '0.644204', '0.649323', '0.647300', '0.642702', '0.644446', '0.504549']
         : correct/total = [(9351, 14232), (9321, 14235), (9238, 14266), (7261, 14217), (9278, 14238), (9316, 14373), (9302, 14346), (9318, 14334), (9204, 14294), (9294, 14373), (9337, 14344), (7097, 14302), (9328, 14354), (7228, 14362), (9225, 14320), (9347, 14395), (9314, 14389), (9163, 14257), (9184, 14251), (7265, 14399)]
         : compromised: 0.6116, honest: 0.6515
         : ubar stats = ['Node 0: s1=0.167, s2=1.000', 'Node 1: s1=0.167, s2=1.000', 'Node 2: s1=0.200, s2=1.000']...

=== FINAL RESULTS ===
Dataset: sent140, Nodes: 20, Graph: erdos, Aggregation: ubar
Attack: krum, 80.0% compromised
Final accuracy - Compromised: 0.6116, Honest: 0.6515
Overall test accuracy: mean=0.6196 ± 0.0581

=== UBAR SUMMARY ===
Node 0: stage1=0.167, stage2=1.000, overall=0.167
Node 1: stage1=0.167, stage2=1.000, overall=0.167
Node 2: stage1=0.200, stage2=1.000, overall=0.200
Node 3: stage1=0.250, stage2=1.000, overall=0.250
Node 4: stage1=0.250, stage2=1.000, overall=0.250
Node 5: stage1=0.200, stage2=1.000, overall=0.200
Node 6: stage1=0.200, stage2=1.000, overall=0.200
Node 7: stage1=0.200, stage2=1.000, overall=0.200
Node 8: stage1=0.500, stage2=1.000, overall=0.500
Node 9: stage1=0.333, stage2=1.000, overall=0.333
Node 10: stage1=0.250, stage2=1.000, overall=0.250
Node 11: stage1=0.143, stage2=1.000, overall=0.143
Node 12: stage1=0.143, stage2=1.000, overall=0.143
Node 13: stage1=0.250, stage2=1.000, overall=0.250
Node 14: stage1=0.143, stage2=1.000, overall=0.143
Node 15: stage1=0.167, stage2=1.000, overall=0.167
Node 16: stage1=0.200, stage2=1.000, overall=0.200
Node 17: stage1=0.200, stage2=1.000, overall=0.200
Node 18: stage1=0.250, stage2=1.000, overall=0.250
Node 19: stage1=0.500, stage2=1.000, overall=0.500

=== PARALLEL EXECUTION TIME (realistic for distributed system) ===
  COMMUNICATION (max across nodes):
    - Full model transfer: 0.000s (0.0%)
  COMPUTATION (max across nodes):
    - Distance computation: 0.030s (67.1%)
    - Loss computation: 0.012s (25.6%)
    - Aggregation: 0.003s (7.3%)
  TOTALS:
    - Total computation: 0.045s (100.0%)
    - Total communication: 0.000s (0.0%)
    - Total parallel time: 0.045s

=== PER-NODE AVERAGE TIME ===
  - Distance computation: 0.020s
  - Loss computation: 0.009s
  - Aggregation: 0.003s
  - Model transfer: 0.000s
  - Total per node: 0.032s

=== TOTAL COMPUTATIONAL WORK (sum across all nodes) ===
  - Total distance computation: 0.397s
  - Total loss computation: 0.180s
  - Total aggregation: 0.064s
  - Total model transfer: 0.000s
  - Grand total: 0.640s
  - Mean Stage 1 acceptance rate: 0.236
  - Mean Stage 2 acceptance rate: 1.000
  - Overall acceptance rate: 0.236

UBAR Algorithm Properties:
  - Model dimension: 1,174,986
  - Rho parameter: 0.19999999999999996
  - Two-stage approach: Distance filtering + loss evaluation
  - Stage 1 selects: 20% of neighbors
  - Stage 2 uses: Training sample loss comparison
  - Theoretical complexity: O(deg(i)×d + deg(i)×inference)
  - Approach: UBAR paper implementation
