Device: cuda
Seed: 987654321
Loading 1 LEAF Sent140 train files...
LEAF Sent140 train: 254555 users, 908652 samples
Building vocabulary (max_size=10000)...
Vocabulary size: 10000
Loading 1 LEAF Sent140 test files...
LEAF Sent140 test: 254555 users, 286281 samples
Found 254555 train users, 254555 test users, 254555 common users
User sample counts range: 494 (max) to 1 (min)
Distributed ALL 254555 users across 20 clients
Users per client: 12727 (with 15 clients getting +1 user)
Train partition sizes: [44353, 44290, 44657, 44907, 44696, 45843, 45801, 45619, 45069, 45639, 45821, 45311, 45779, 46056, 45625, 45984, 46428, 44737, 45540, 46497]
Test partition sizes: [14232, 14235, 14266, 14217, 14238, 14373, 14346, 14334, 14294, 14373, 14344, 14302, 14354, 14362, 14320, 14395, 14389, 14257, 14251, 14399]
  Client 0: 44353 train samples, 2 unique classes
  Client 1: 44290 train samples, 2 unique classes
  Client 2: 44657 train samples, 2 unique classes
  Client 3: 44907 train samples, 2 unique classes
  Client 4: 44696 train samples, 2 unique classes
  Client 5: 45843 train samples, 2 unique classes
  Client 6: 45801 train samples, 2 unique classes
  Client 7: 45619 train samples, 2 unique classes
  Client 8: 45069 train samples, 2 unique classes
  Client 9: 45639 train samples, 2 unique classes
  Client 10: 45821 train samples, 2 unique classes
  Client 11: 45311 train samples, 2 unique classes
  Client 12: 45779 train samples, 2 unique classes
  Client 13: 46056 train samples, 2 unique classes
  Client 14: 45625 train samples, 2 unique classes
  Client 15: 45984 train samples, 2 unique classes
  Client 16: 46428 train samples, 2 unique classes
  Client 17: 44737 train samples, 2 unique classes
  Client 18: 45540 train samples, 2 unique classes
  Client 19: 46497 train samples, 2 unique classes
Will sample 4500 samples per client per epoch
Graph: erdos, nodes: 20, edges: 126
Degree statistics: avg=12.60, min=8, max=16
Attack: Compromised 6/20 nodes: [5, 12, 13, 14, 17, 18]
Attack type: directed_deviation, lambda: 1.0
Model variant: baseline
Model parameters: 1,174,986
Initial test acc across nodes: mean=0.4953 ± 0.0174
Round 001: test acc mean=0.4994 ± 0.0072 | min=0.4842 max=0.5203
         : test loss mean=2.6099 ± 1.0898
         : individual accs = ['0.495292', '0.520337', '0.503084', '0.493001', '0.496067', '0.494956', '0.496375', '0.504883', '0.499720', '0.484241', '0.498954', '0.493427', '0.504598', '0.492271', '0.508310', '0.497742', '0.498019', '0.504173', '0.502912', '0.500521']
         : correct/total = [(7049, 14232), (7407, 14235), (7177, 14266), (7009, 14217), (7063, 14238), (7114, 14373), (7121, 14346), (7237, 14334), (7143, 14294), (6960, 14373), (7157, 14344), (7057, 14302), (7243, 14354), (7070, 14362), (7279, 14320), (7165, 14395), (7166, 14389), (7188, 14257), (7167, 14251), (7207, 14399)]
         : compromised: 0.5012, honest: 0.4987
Round 002: test acc mean=0.5023 ± 0.0085 | min=0.4860 max=0.5178
         : test loss mean=1.9733 ± 0.6553
         : individual accs = ['0.492201', '0.489989', '0.505538', '0.485968', '0.492977', '0.511445', '0.499651', '0.506488', '0.512593', '0.499339', '0.499163', '0.502237', '0.501463', '0.512881', '0.512430', '0.493991', '0.517757', '0.495756', '0.506842', '0.506702']
         : correct/total = [(7005, 14232), (6975, 14235), (7212, 14266), (6909, 14217), (7019, 14238), (7351, 14373), (7168, 14346), (7260, 14334), (7327, 14294), (7177, 14373), (7160, 14344), (7183, 14302), (7198, 14354), (7366, 14362), (7338, 14320), (7111, 14395), (7450, 14389), (7068, 14257), (7223, 14251), (7296, 14399)]
         : compromised: 0.5068, honest: 0.5003
Round 003: test acc mean=0.5043 ± 0.0132 | min=0.4839 max=0.5449
         : test loss mean=0.7146 ± 0.0308
         : individual accs = ['0.494238', '0.516965', '0.509603', '0.515088', '0.505759', '0.495999', '0.502719', '0.494907', '0.489296', '0.503514', '0.501534', '0.504125', '0.501811', '0.493942', '0.483939', '0.522126', '0.491973', '0.544925', '0.508877', '0.503716']
         : correct/total = [(7034, 14232), (7359, 14235), (7270, 14266), (7323, 14217), (7201, 14238), (7129, 14373), (7212, 14346), (7094, 14334), (6994, 14294), (7237, 14373), (7194, 14344), (7210, 14302), (7203, 14354), (7094, 14362), (6930, 14320), (7516, 14395), (7079, 14389), (7769, 14257), (7252, 14251), (7253, 14399)]
         : compromised: 0.5049, honest: 0.5040
Round 004: test acc mean=0.5072 ± 0.0079 | min=0.4925 max=0.5181
         : test loss mean=0.8607 ± 0.2166
         : individual accs = ['0.515037', '0.517738', '0.504626', '0.513751', '0.518121', '0.509775', '0.508225', '0.516813', '0.496292', '0.502748', '0.502440', '0.517340', '0.493033', '0.492480', '0.504330', '0.513442', '0.504205', '0.505716', '0.498562', '0.509966']
         : correct/total = [(7330, 14232), (7370, 14235), (7199, 14266), (7304, 14217), (7377, 14238), (7327, 14373), (7291, 14346), (7408, 14334), (7094, 14294), (7226, 14373), (7207, 14344), (7399, 14302), (7077, 14354), (7073, 14362), (7222, 14320), (7391, 14395), (7255, 14389), (7210, 14257), (7105, 14251), (7343, 14399)]
         : compromised: 0.5006, honest: 0.5101
Round 005: test acc mean=0.5111 ± 0.0148 | min=0.4926 max=0.5462
         : test loss mean=0.7217 ± 0.0783
         : individual accs = ['0.492622', '0.516263', '0.546194', '0.513329', '0.496559', '0.509080', '0.509062', '0.529371', '0.502379', '0.501496', '0.498397', '0.516291', '0.502856', '0.506754', '0.538966', '0.501494', '0.522691', '0.495336', '0.495614', '0.528162']
         : correct/total = [(7011, 14232), (7349, 14235), (7792, 14266), (7298, 14217), (7070, 14238), (7317, 14373), (7303, 14346), (7588, 14334), (7181, 14294), (7208, 14373), (7149, 14344), (7384, 14302), (7218, 14354), (7278, 14362), (7718, 14320), (7219, 14395), (7521, 14389), (7062, 14257), (7063, 14251), (7605, 14399)]
         : compromised: 0.5081, honest: 0.5125
Round 006: test acc mean=0.5154 ± 0.0130 | min=0.4931 max=0.5447
         : test loss mean=0.7394 ± 0.0945
         : individual accs = ['0.511102', '0.516965', '0.526847', '0.515017', '0.505549', '0.527308', '0.516939', '0.525813', '0.507696', '0.504766', '0.499512', '0.525031', '0.497213', '0.493107', '0.533939', '0.544703', '0.511085', '0.511608', '0.504596', '0.529134']
         : correct/total = [(7274, 14232), (7359, 14235), (7516, 14266), (7322, 14217), (7198, 14238), (7579, 14373), (7416, 14346), (7537, 14334), (7257, 14294), (7255, 14373), (7165, 14344), (7509, 14302), (7137, 14354), (7082, 14362), (7646, 14320), (7841, 14395), (7354, 14389), (7294, 14257), (7191, 14251), (7619, 14399)]
         : compromised: 0.5113, honest: 0.5172
Round 007: test acc mean=0.5281 ± 0.0294 | min=0.4926 max=0.5903
         : test loss mean=0.6987 ± 0.0367
         : individual accs = ['0.492622', '0.520337', '0.539885', '0.494830', '0.494451', '0.558617', '0.532483', '0.541579', '0.538128', '0.509080', '0.498397', '0.546707', '0.502856', '0.506824', '0.588198', '0.547343', '0.551810', '0.511959', '0.495614', '0.590319']
         : correct/total = [(7011, 14232), (7407, 14235), (7702, 14266), (7035, 14217), (7040, 14238), (8029, 14373), (7639, 14346), (7763, 14334), (7692, 14294), (7317, 14373), (7149, 14344), (7819, 14302), (7218, 14354), (7279, 14362), (8423, 14320), (7879, 14395), (7940, 14389), (7299, 14257), (7063, 14251), (8500, 14399)]
         : compromised: 0.5273, honest: 0.5284
Round 008: test acc mean=0.5500 ± 0.0249 | min=0.4964 max=0.5961
         : test loss mean=0.7093 ± 0.0642
         : individual accs = ['0.570616', '0.596066', '0.570868', '0.532250', '0.561245', '0.549642', '0.522724', '0.558323', '0.519379', '0.515480', '0.555145', '0.557055', '0.515745', '0.496449', '0.560265', '0.578882', '0.545556', '0.578032', '0.552102', '0.563581']
         : correct/total = [(8121, 14232), (8485, 14235), (8144, 14266), (7567, 14217), (7991, 14238), (7900, 14373), (7499, 14346), (8003, 14334), (7424, 14294), (7409, 14373), (7963, 14344), (7967, 14302), (7403, 14354), (7130, 14362), (8023, 14320), (8333, 14395), (7850, 14389), (8241, 14257), (7868, 14251), (8115, 14399)]
         : compromised: 0.5420, honest: 0.5534
Round 009: test acc mean=0.5466 ± 0.0395 | min=0.4945 max=0.6074
         : test loss mean=0.6878 ± 0.0215
         : individual accs = ['0.498033', '0.571409', '0.580401', '0.586059', '0.494522', '0.574062', '0.548724', '0.564811', '0.558486', '0.501287', '0.499024', '0.582296', '0.502856', '0.506824', '0.593156', '0.607433', '0.554104', '0.512240', '0.495685', '0.600250']
         : correct/total = [(7088, 14232), (8134, 14235), (8280, 14266), (8332, 14217), (7041, 14238), (8251, 14373), (7872, 14346), (8096, 14334), (7983, 14294), (7205, 14373), (7158, 14344), (8328, 14302), (7218, 14354), (7279, 14362), (8494, 14320), (8744, 14395), (7973, 14389), (7303, 14257), (7064, 14251), (8643, 14399)]
         : compromised: 0.5308, honest: 0.5533
Round 010: test acc mean=0.5713 ± 0.0247 | min=0.5200 max=0.6055
         : test loss mean=0.7046 ± 0.0675
         : individual accs = ['0.591765', '0.585880', '0.568414', '0.596680', '0.602613', '0.541501', '0.525373', '0.552811', '0.520008', '0.605510', '0.585820', '0.547965', '0.587362', '0.593720', '0.554399', '0.576659', '0.553687', '0.588834', '0.586345', '0.559900']
         : correct/total = [(8422, 14232), (8340, 14235), (8109, 14266), (8483, 14217), (8580, 14238), (7783, 14373), (7537, 14346), (7924, 14334), (7433, 14294), (8703, 14373), (8403, 14344), (7837, 14302), (8431, 14354), (8527, 14362), (7939, 14320), (8301, 14395), (7967, 14389), (8395, 14257), (8356, 14251), (8062, 14399)]
         : compromised: 0.5754, honest: 0.5695

=== FINAL RESULTS ===
Dataset: sent140, Nodes: 20, Graph: erdos, Aggregation: d-fedavg
Attack: directed_deviation, 30.0% compromised
Final accuracy - Compromised: 0.5754, Honest: 0.5695
Overall test accuracy: mean=0.5713 ± 0.0247
