Device: cuda
Seed: 987654321
Loading 1 LEAF Sent140 train files...
LEAF Sent140 train: 254555 users, 908652 samples
Building vocabulary (max_size=10000)...
Vocabulary size: 10000
Loading 1 LEAF Sent140 test files...
LEAF Sent140 test: 254555 users, 286281 samples
Found 254555 train users, 254555 test users, 254555 common users
User sample counts range: 494 (max) to 1 (min)
Distributed ALL 254555 users across 20 clients
Users per client: 12727 (with 15 clients getting +1 user)
Train partition sizes: [44353, 44290, 44657, 44907, 44696, 45843, 45801, 45619, 45069, 45639, 45821, 45311, 45779, 46056, 45625, 45984, 46428, 44737, 45540, 46497]
Test partition sizes: [14232, 14235, 14266, 14217, 14238, 14373, 14346, 14334, 14294, 14373, 14344, 14302, 14354, 14362, 14320, 14395, 14389, 14257, 14251, 14399]
  Client 0: 44353 train samples, 2 unique classes
  Client 1: 44290 train samples, 2 unique classes
  Client 2: 44657 train samples, 2 unique classes
  Client 3: 44907 train samples, 2 unique classes
  Client 4: 44696 train samples, 2 unique classes
  Client 5: 45843 train samples, 2 unique classes
  Client 6: 45801 train samples, 2 unique classes
  Client 7: 45619 train samples, 2 unique classes
  Client 8: 45069 train samples, 2 unique classes
  Client 9: 45639 train samples, 2 unique classes
  Client 10: 45821 train samples, 2 unique classes
  Client 11: 45311 train samples, 2 unique classes
  Client 12: 45779 train samples, 2 unique classes
  Client 13: 46056 train samples, 2 unique classes
  Client 14: 45625 train samples, 2 unique classes
  Client 15: 45984 train samples, 2 unique classes
  Client 16: 46428 train samples, 2 unique classes
  Client 17: 44737 train samples, 2 unique classes
  Client 18: 45540 train samples, 2 unique classes
  Client 19: 46497 train samples, 2 unique classes
Will sample 4500 samples per client per epoch
Graph: ring, nodes: 20, edges: 20
Degree statistics: avg=2.00, min=2, max=2
Attack: Compromised 16/20 nodes: [1, 2, 3, 5, 6, 8, 9, 10, 11, 12, 13, 14, 15, 17, 18, 19]
Attack type: directed_deviation, lambda: 1.0
Model variant: baseline
Model parameters: 1,174,986
BALANCE algorithm:
Balance Config: BALANCEConfig(gamma=2, kappa=1, alpha=0.5, min_neighbors=1)
  - Model dimension: 1,174,986 parameters
  - Complexity: O(N×d) = O(20×1,174,986)
Initial test acc across nodes: mean=0.4965 ± 0.0152
Round 001: test acc mean=0.5018 ± 0.0067 | min=0.4904 max=0.5167
         : test loss mean=4.2684 ± 2.6526
         : individual accs = ['0.500141', '0.511907', '0.490397', '0.501231', '0.506743', '0.502679', '0.494633', '0.493582', '0.516650', '0.496556', '0.497769', '0.498741', '0.507942', '0.504526', '0.513128', '0.494825', '0.500799', '0.503823', '0.496877', '0.503229']
         : correct/total = [(7118, 14232), (7287, 14235), (6996, 14266), (7126, 14217), (7215, 14238), (7225, 14373), (7096, 14346), (7075, 14334), (7385, 14294), (7137, 14373), (7140, 14344), (7133, 14302), (7291, 14354), (7246, 14362), (7348, 14320), (7123, 14395), (7206, 14389), (7183, 14257), (7081, 14251), (7246, 14399)]
         : compromised: 0.5022, honest: 0.5003
Round 002: test acc mean=0.5007 ± 0.0070 | min=0.4855 max=0.5109
         : test loss mean=3.6418 ± 2.2609
         : individual accs = ['0.499368', '0.493783', '0.510935', '0.507350', '0.500843', '0.510680', '0.501882', '0.485489', '0.509445', '0.499130', '0.503974', '0.503706', '0.493660', '0.499164', '0.487430', '0.495241', '0.501494', '0.497019', '0.508666', '0.505452']
         : correct/total = [(7107, 14232), (7029, 14235), (7289, 14266), (7213, 14217), (7131, 14238), (7340, 14373), (7200, 14346), (6959, 14334), (7282, 14294), (7174, 14373), (7229, 14344), (7204, 14302), (7086, 14354), (7169, 14362), (6980, 14320), (7129, 14395), (7216, 14389), (7086, 14257), (7249, 14251), (7278, 14399)]
         : compromised: 0.5017, honest: 0.4968
Round 003: test acc mean=0.4985 ± 0.0099 | min=0.4858 max=0.5293
         : test loss mean=1.3622 ± 0.4279
         : individual accs = ['0.492271', '0.489427', '0.491098', '0.509742', '0.502107', '0.497252', '0.491844', '0.529301', '0.487058', '0.493356', '0.485848', '0.498392', '0.491779', '0.505988', '0.501885', '0.511567', '0.494961', '0.502490', '0.492527', '0.500660']
         : correct/total = [(7006, 14232), (6967, 14235), (7006, 14266), (7247, 14217), (7149, 14238), (7147, 14373), (7056, 14346), (7587, 14334), (6962, 14294), (7091, 14373), (6969, 14344), (7128, 14302), (7059, 14354), (7267, 14362), (7187, 14320), (7364, 14395), (7122, 14389), (7164, 14257), (7019, 14251), (7209, 14399)]
         : compromised: 0.4969, honest: 0.5047
Round 004: test acc mean=0.4999 ± 0.0093 | min=0.4818 max=0.5138
         : test loss mean=1.4530 ± 0.5145
         : individual accs = ['0.504778', '0.489146', '0.511005', '0.501301', '0.502388', '0.507131', '0.500279', '0.493582', '0.507975', '0.503653', '0.513804', '0.502657', '0.495332', '0.481757', '0.488478', '0.484613', '0.512614', '0.488672', '0.508736', '0.499340']
         : correct/total = [(7184, 14232), (6963, 14235), (7290, 14266), (7127, 14217), (7153, 14238), (7289, 14373), (7177, 14346), (7075, 14334), (7261, 14294), (7239, 14373), (7370, 14344), (7189, 14302), (7110, 14354), (6919, 14362), (6995, 14320), (6976, 14395), (7376, 14389), (6967, 14257), (7250, 14251), (7190, 14399)]
         : compromised: 0.4990, honest: 0.5033
Round 005: test acc mean=0.5049 ± 0.0094 | min=0.4904 max=0.5312
         : test loss mean=1.6312 ± 0.7467
         : individual accs = ['0.503373', '0.511978', '0.491448', '0.531195', '0.498666', '0.517916', '0.517217', '0.502302', '0.490416', '0.503444', '0.501325', '0.503496', '0.507942', '0.509818', '0.504260', '0.499965', '0.500591', '0.502700', '0.491965', '0.507813']
         : correct/total = [(7164, 14232), (7288, 14235), (7011, 14266), (7552, 14217), (7100, 14238), (7444, 14373), (7420, 14346), (7200, 14334), (7010, 14294), (7236, 14373), (7191, 14344), (7201, 14302), (7291, 14354), (7322, 14362), (7221, 14320), (7197, 14395), (7203, 14389), (7167, 14257), (7011, 14251), (7312, 14399)]
         : compromised: 0.5058, honest: 0.5012
Round 006: test acc mean=0.5069 ± 0.0057 | min=0.4983 max=0.5229
         : test loss mean=1.0453 ± 0.2704
         : individual accs = ['0.509978', '0.522936', '0.511706', '0.507280', '0.507656', '0.505462', '0.503137', '0.505651', '0.515181', '0.502052', '0.504880', '0.503216', '0.500139', '0.498329', '0.503771', '0.505592', '0.507123', '0.509083', '0.500807', '0.514897']
         : correct/total = [(7258, 14232), (7444, 14235), (7300, 14266), (7212, 14217), (7228, 14238), (7265, 14373), (7218, 14346), (7248, 14334), (7364, 14294), (7216, 14373), (7242, 14344), (7197, 14302), (7179, 14354), (7157, 14362), (7214, 14320), (7278, 14395), (7297, 14389), (7258, 14257), (7137, 14251), (7414, 14399)]
         : compromised: 0.5068, honest: 0.5076
Round 007: test acc mean=0.4991 ± 0.0074 | min=0.4811 max=0.5151
         : test loss mean=1.0125 ± 0.2377
         : individual accs = ['0.496206', '0.481068', '0.487523', '0.492579', '0.495013', '0.494399', '0.501464', '0.499581', '0.501749', '0.501078', '0.515059', '0.499650', '0.503135', '0.511976', '0.503631', '0.498367', '0.499618', '0.503121', '0.503965', '0.493229']
         : correct/total = [(7062, 14232), (6848, 14235), (6955, 14266), (7003, 14217), (7048, 14238), (7106, 14373), (7194, 14346), (7161, 14334), (7172, 14294), (7202, 14373), (7388, 14344), (7146, 14302), (7222, 14354), (7353, 14362), (7212, 14320), (7174, 14395), (7189, 14389), (7173, 14257), (7182, 14251), (7102, 14399)]
         : compromised: 0.4995, honest: 0.4976
Round 008: test acc mean=0.5121 ± 0.0097 | min=0.4914 max=0.5270
         : test loss mean=0.8418 ± 0.1036
         : individual accs = ['0.515950', '0.508184', '0.523623', '0.507069', '0.526759', '0.502679', '0.501743', '0.515348', '0.511403', '0.526960', '0.519102', '0.516711', '0.511774', '0.521306', '0.512081', '0.501633', '0.523525', '0.496879', '0.508526', '0.491354']
         : correct/total = [(7343, 14232), (7234, 14235), (7470, 14266), (7209, 14217), (7500, 14238), (7225, 14373), (7198, 14346), (7387, 14334), (7310, 14294), (7574, 14373), (7446, 14344), (7390, 14302), (7346, 14354), (7487, 14362), (7333, 14320), (7221, 14395), (7533, 14389), (7084, 14257), (7247, 14251), (7075, 14399)]
         : compromised: 0.5101, honest: 0.5204
Round 009: test acc mean=0.5002 ± 0.0051 | min=0.4927 max=0.5097
         : test loss mean=0.8182 ± 0.0948
         : individual accs = ['0.492693', '0.493221', '0.492920', '0.493916', '0.504214', '0.492799', '0.506971', '0.503977', '0.499930', '0.495930', '0.504183', '0.503216', '0.498467', '0.509748', '0.506075', '0.498715', '0.501008', '0.503051', '0.501719', '0.500451']
         : correct/total = [(7012, 14232), (7021, 14235), (7032, 14266), (7022, 14217), (7179, 14238), (7083, 14373), (7273, 14346), (7224, 14334), (7146, 14294), (7128, 14373), (7232, 14344), (7197, 14302), (7155, 14354), (7321, 14362), (7247, 14320), (7179, 14395), (7209, 14389), (7172, 14257), (7150, 14251), (7206, 14399)]
         : compromised: 0.5001, honest: 0.5005
Round 010: test acc mean=0.5215 ± 0.0141 | min=0.4969 max=0.5396
         : test loss mean=0.7557 ± 0.0356
         : individual accs = ['0.537170', '0.513593', '0.524113', '0.506788', '0.533994', '0.505183', '0.502231', '0.532231', '0.511823', '0.537118', '0.526562', '0.533212', '0.529748', '0.539618', '0.533799', '0.501633', '0.534228', '0.496949', '0.526770', '0.503438']
         : correct/total = [(7645, 14232), (7311, 14235), (7477, 14266), (7205, 14217), (7603, 14238), (7261, 14373), (7205, 14346), (7629, 14334), (7316, 14294), (7720, 14373), (7553, 14344), (7626, 14302), (7604, 14354), (7750, 14362), (7644, 14320), (7221, 14395), (7687, 14389), (7085, 14257), (7507, 14251), (7249, 14399)]
         : compromised: 0.5183, honest: 0.5344

=== FINAL RESULTS ===
Dataset: sent140, Nodes: 20, Graph: ring, Aggregation: balance
Attack: directed_deviation, 80.0% compromised
Final accuracy - Compromised: 0.5183, Honest: 0.5344
Overall test accuracy: mean=0.5215 ± 0.0141

=== BALANCE SUMMARY ===
Node 0: acceptance=0.100
Node 1: acceptance=0.300
Node 2: acceptance=0.100
Node 3: acceptance=0.300
Node 4: acceptance=0.100
Node 5: acceptance=0.300
Node 6: acceptance=0.300
Node 7: acceptance=0.100
Node 8: acceptance=0.300
Node 9: acceptance=0.100
Node 10: acceptance=0.100
Node 11: acceptance=0.100
Node 12: acceptance=0.100
Node 13: acceptance=0.100
Node 14: acceptance=0.100
Node 15: acceptance=0.300
Node 16: acceptance=0.100
Node 17: acceptance=0.300
Node 18: acceptance=0.100
Node 19: acceptance=0.300

=== PARALLEL EXECUTION TIME (realistic for distributed system) ===
  COMMUNICATION (max across nodes):
    - Full model transfer: 0.000s (0.0%)
  COMPUTATION (max across nodes):
    - Filtering: 0.015s (58.2%)
    - Aggregation: 0.011s (41.8%)
  TOTALS:
    - Total computation: 0.027s (100.0%)
    - Total communication: 0.000s (0.0%)
    - Total parallel time: 0.027s

=== PER-NODE AVERAGE TIME ===
  - Filtering: 0.012s
  - Aggregation: 0.005s
  - Model transfer: 0.000s
  - Total per node: 0.017s

=== TOTAL COMPUTATIONAL WORK (sum across all nodes) ===
  - Total filtering: 0.247s
  - Total aggregation: 0.097s
  - Total model transfer: 0.000s
  - Grand total: 0.344s
  - Mean acceptance rate: 0.180

BALANCE Algorithm Properties:
  - Model dimension: 1,174,986
  - No compression: Full parameter comparison
  - Theoretical complexity: O(deg(i)×d)
  - Approach: Full parameter filtering + averaging
