Device: cuda
Seed: 987654321
Loading 1 LEAF Sent140 train files...
LEAF Sent140 train: 254555 users, 908652 samples
Building vocabulary (max_size=10000)...
Vocabulary size: 10000
Loading 1 LEAF Sent140 test files...
LEAF Sent140 test: 254555 users, 286281 samples
Found 254555 train users, 254555 test users, 254555 common users
User sample counts range: 494 (max) to 1 (min)
Distributed ALL 254555 users across 20 clients
Users per client: 12727 (with 15 clients getting +1 user)
Train partition sizes: [44353, 44290, 44657, 44907, 44696, 45843, 45801, 45619, 45069, 45639, 45821, 45311, 45779, 46056, 45625, 45984, 46428, 44737, 45540, 46497]
Test partition sizes: [14232, 14235, 14266, 14217, 14238, 14373, 14346, 14334, 14294, 14373, 14344, 14302, 14354, 14362, 14320, 14395, 14389, 14257, 14251, 14399]
  Client 0: 44353 train samples, 2 unique classes
  Client 1: 44290 train samples, 2 unique classes
  Client 2: 44657 train samples, 2 unique classes
  Client 3: 44907 train samples, 2 unique classes
  Client 4: 44696 train samples, 2 unique classes
  Client 5: 45843 train samples, 2 unique classes
  Client 6: 45801 train samples, 2 unique classes
  Client 7: 45619 train samples, 2 unique classes
  Client 8: 45069 train samples, 2 unique classes
  Client 9: 45639 train samples, 2 unique classes
  Client 10: 45821 train samples, 2 unique classes
  Client 11: 45311 train samples, 2 unique classes
  Client 12: 45779 train samples, 2 unique classes
  Client 13: 46056 train samples, 2 unique classes
  Client 14: 45625 train samples, 2 unique classes
  Client 15: 45984 train samples, 2 unique classes
  Client 16: 46428 train samples, 2 unique classes
  Client 17: 44737 train samples, 2 unique classes
  Client 18: 45540 train samples, 2 unique classes
  Client 19: 46497 train samples, 2 unique classes
Will sample 4500 samples per client per epoch
Graph: ring, nodes: 20, edges: 20
Degree statistics: avg=2.00, min=2, max=2
Attack: Compromised 4/20 nodes: [5, 12, 13, 17]
Attack type: directed_deviation, lambda: 1.0
Model variant: baseline
Model parameters: 1,174,986
Initial test acc across nodes: mean=0.4965 ± 0.0152
Round 001: test acc mean=0.5043 ± 0.0095 | min=0.4860 max=0.5276
         : test loss mean=2.5863 ± 3.0472
         : individual accs = ['0.501897', '0.507130', '0.502383', '0.500035', '0.502669', '0.508384', '0.505716', '0.485977', '0.527564', '0.504905', '0.491007', '0.516361', '0.498537', '0.500418', '0.498883', '0.513720', '0.502745', '0.494704', '0.501579', '0.521217']
         : correct/total = [(7143, 14232), (7219, 14235), (7167, 14266), (7109, 14217), (7157, 14238), (7307, 14373), (7255, 14346), (6966, 14334), (7541, 14294), (7257, 14373), (7043, 14344), (7385, 14302), (7156, 14354), (7187, 14362), (7144, 14320), (7395, 14395), (7234, 14389), (7053, 14257), (7148, 14251), (7505, 14399)]
         : compromised: 0.5005, honest: 0.5052
Round 002: test acc mean=0.4963 ± 0.0096 | min=0.4815 max=0.5176
         : test loss mean=2.5712 ± 3.3156
         : individual accs = ['0.490655', '0.486196', '0.485981', '0.517620', '0.501896', '0.486676', '0.503834', '0.504674', '0.488387', '0.492938', '0.494980', '0.498252', '0.492406', '0.515597', '0.503073', '0.503300', '0.499270', '0.485796', '0.481510', '0.492326']
         : correct/total = [(6983, 14232), (6921, 14235), (6933, 14266), (7359, 14217), (7146, 14238), (6995, 14373), (7228, 14346), (7234, 14334), (6981, 14294), (7085, 14373), (7100, 14344), (7126, 14302), (7068, 14354), (7405, 14362), (7204, 14320), (7245, 14395), (7184, 14389), (6926, 14257), (6862, 14251), (7089, 14399)]
         : compromised: 0.4951, honest: 0.4966
Round 003: test acc mean=0.5033 ± 0.0085 | min=0.4863 max=0.5223
         : test loss mean=1.0452 ± 0.5880
         : individual accs = ['0.501335', '0.486266', '0.522291', '0.514877', '0.503231', '0.509427', '0.504601', '0.500209', '0.511263', '0.494538', '0.502440', '0.494197', '0.503274', '0.495126', '0.499860', '0.500313', '0.517131', '0.496949', '0.499263', '0.509619']
         : correct/total = [(7135, 14232), (6922, 14235), (7451, 14266), (7320, 14217), (7165, 14238), (7322, 14373), (7239, 14346), (7170, 14334), (7308, 14294), (7108, 14373), (7207, 14344), (7068, 14302), (7224, 14354), (7111, 14362), (7158, 14320), (7202, 14395), (7441, 14389), (7085, 14257), (7115, 14251), (7338, 14399)]
         : compromised: 0.5012, honest: 0.5038
Round 004: test acc mean=0.5036 ± 0.0137 | min=0.4863 max=0.5371
         : test loss mean=1.3017 ± 1.0521
         : individual accs = ['0.505200', '0.486266', '0.486822', '0.537103', '0.508428', '0.493147', '0.500767', '0.504395', '0.512663', '0.526752', '0.500697', '0.506573', '0.495750', '0.499513', '0.502654', '0.531504', '0.494683', '0.496037', '0.491334', '0.491492']
         : correct/total = [(7190, 14232), (6922, 14235), (6945, 14266), (7636, 14217), (7239, 14238), (7088, 14373), (7184, 14346), (7230, 14334), (7328, 14294), (7571, 14373), (7182, 14344), (7245, 14302), (7116, 14354), (7174, 14362), (7198, 14320), (7651, 14395), (7118, 14389), (7072, 14257), (7002, 14251), (7077, 14399)]
         : compromised: 0.4961, honest: 0.5055
Round 005: test acc mean=0.5093 ± 0.0167 | min=0.4701 max=0.5396
         : test loss mean=0.9253 ± 0.4567
         : individual accs = ['0.529862', '0.486266', '0.509814', '0.539565', '0.503863', '0.497948', '0.516032', '0.507465', '0.512173', '0.526334', '0.513873', '0.501958', '0.486694', '0.499234', '0.511732', '0.530809', '0.511432', '0.470085', '0.501789', '0.529898']
         : correct/total = [(7541, 14232), (6922, 14235), (7273, 14266), (7671, 14217), (7174, 14238), (7157, 14373), (7403, 14346), (7274, 14334), (7321, 14294), (7565, 14373), (7371, 14344), (7179, 14302), (6986, 14354), (7170, 14362), (7328, 14320), (7641, 14395), (7359, 14389), (6702, 14257), (7151, 14251), (7630, 14399)]
         : compromised: 0.4885, honest: 0.5146
Round 006: test acc mean=0.5156 ± 0.0192 | min=0.4863 max=0.5556
         : test loss mean=1.0817 ± 0.7103
         : individual accs = ['0.546655', '0.486266', '0.531473', '0.548217', '0.507234', '0.497600', '0.507319', '0.506069', '0.534980', '0.555625', '0.505577', '0.519298', '0.496586', '0.508216', '0.508310', '0.537617', '0.510390', '0.497650', '0.500807', '0.506216']
         : correct/total = [(7780, 14232), (6922, 14235), (7582, 14266), (7794, 14217), (7222, 14238), (7152, 14373), (7278, 14346), (7254, 14334), (7647, 14294), (7986, 14373), (7252, 14344), (7427, 14302), (7128, 14354), (7299, 14362), (7279, 14320), (7739, 14395), (7344, 14389), (7095, 14257), (7137, 14251), (7289, 14399)]
         : compromised: 0.5000, honest: 0.5195
Round 007: test acc mean=0.5175 ± 0.0219 | min=0.4673 max=0.5558
         : test loss mean=0.8784 ± 0.4327
         : individual accs = ['0.548482', '0.490762', '0.497757', '0.555813', '0.519455', '0.467335', '0.525234', '0.523162', '0.536729', '0.542197', '0.511712', '0.519368', '0.489759', '0.500279', '0.523883', '0.519486', '0.529502', '0.497931', '0.507894', '0.544135']
         : correct/total = [(7806, 14232), (6986, 14235), (7101, 14266), (7902, 14217), (7396, 14238), (6717, 14373), (7535, 14346), (7499, 14334), (7672, 14294), (7793, 14373), (7340, 14344), (7428, 14302), (7030, 14354), (7185, 14362), (7502, 14320), (7478, 14395), (7619, 14389), (7099, 14257), (7238, 14251), (7835, 14399)]
         : compromised: 0.4888, honest: 0.5247
Round 008: test acc mean=0.5270 ± 0.0328 | min=0.4859 max=0.5835
         : test loss mean=0.9958 ± 0.6012
         : individual accs = ['0.580171', '0.490481', '0.582223', '0.583456', '0.504635', '0.485911', '0.504461', '0.534673', '0.559815', '0.577889', '0.540435', '0.524262', '0.501742', '0.501114', '0.504958', '0.548802', '0.506707', '0.501929', '0.498491', '0.508369']
         : correct/total = [(8257, 14232), (6982, 14235), (8306, 14266), (8295, 14217), (7185, 14238), (6984, 14373), (7237, 14346), (7664, 14334), (8002, 14294), (8306, 14373), (7752, 14344), (7498, 14302), (7202, 14354), (7197, 14362), (7231, 14320), (7900, 14395), (7291, 14389), (7156, 14257), (7104, 14251), (7320, 14399)]
         : compromised: 0.4977, honest: 0.5344
Round 009: test acc mean=0.5289 ± 0.0273 | min=0.4780 max=0.5777
         : test loss mean=0.8587 ± 0.4253
         : individual accs = ['0.575183', '0.567264', '0.523062', '0.563340', '0.525074', '0.478049', '0.530671', '0.538649', '0.555548', '0.577750', '0.521263', '0.519718', '0.495750', '0.498468', '0.528561', '0.510941', '0.527486', '0.494003', '0.507824', '0.538996']
         : correct/total = [(8186, 14232), (8075, 14235), (7462, 14266), (8009, 14217), (7476, 14238), (6871, 14373), (7613, 14346), (7721, 14334), (7941, 14294), (8304, 14373), (7477, 14344), (7433, 14302), (7116, 14354), (7159, 14362), (7569, 14320), (7355, 14395), (7590, 14389), (7043, 14257), (7237, 14251), (7761, 14399)]
         : compromised: 0.4916, honest: 0.5382
Round 010: test acc mean=0.5414 ± 0.0370 | min=0.4922 max=0.5944
         : test loss mean=0.9364 ± 0.5299
         : individual accs = ['0.593803', '0.588830', '0.589093', '0.574383', '0.506672', '0.492173', '0.509341', '0.567183', '0.590458', '0.594378', '0.565742', '0.522095', '0.499512', '0.508216', '0.516760', '0.558249', '0.514143', '0.508592', '0.498491', '0.529412']
         : correct/total = [(8451, 14232), (8382, 14235), (8404, 14266), (8166, 14217), (7214, 14238), (7074, 14373), (7307, 14346), (8130, 14334), (8440, 14294), (8543, 14373), (8115, 14344), (7467, 14302), (7170, 14354), (7299, 14362), (7400, 14320), (8036, 14395), (7398, 14389), (7251, 14257), (7104, 14251), (7623, 14399)]
         : compromised: 0.5021, honest: 0.5512

=== FINAL RESULTS ===
Dataset: sent140, Nodes: 20, Graph: ring, Aggregation: d-fedavg
Attack: directed_deviation, 20.0% compromised
Final accuracy - Compromised: 0.5021, Honest: 0.5512
Overall test accuracy: mean=0.5414 ± 0.0370
