Device: cuda
Seed: 987654321
Loading 1 LEAF Sent140 train files...
LEAF Sent140 train: 254555 users, 908652 samples
Building vocabulary (max_size=10000)...
Vocabulary size: 10000
Loading 1 LEAF Sent140 test files...
LEAF Sent140 test: 254555 users, 286281 samples
Found 254555 train users, 254555 test users, 254555 common users
User sample counts range: 494 (max) to 1 (min)
Distributed ALL 254555 users across 20 clients
Users per client: 12727 (with 15 clients getting +1 user)
Train partition sizes: [44353, 44290, 44657, 44907, 44696, 45843, 45801, 45619, 45069, 45639, 45821, 45311, 45779, 46056, 45625, 45984, 46428, 44737, 45540, 46497]
Test partition sizes: [14232, 14235, 14266, 14217, 14238, 14373, 14346, 14334, 14294, 14373, 14344, 14302, 14354, 14362, 14320, 14395, 14389, 14257, 14251, 14399]
  Client 0: 44353 train samples, 2 unique classes
  Client 1: 44290 train samples, 2 unique classes
  Client 2: 44657 train samples, 2 unique classes
  Client 3: 44907 train samples, 2 unique classes
  Client 4: 44696 train samples, 2 unique classes
  Client 5: 45843 train samples, 2 unique classes
  Client 6: 45801 train samples, 2 unique classes
  Client 7: 45619 train samples, 2 unique classes
  Client 8: 45069 train samples, 2 unique classes
  Client 9: 45639 train samples, 2 unique classes
  Client 10: 45821 train samples, 2 unique classes
  Client 11: 45311 train samples, 2 unique classes
  Client 12: 45779 train samples, 2 unique classes
  Client 13: 46056 train samples, 2 unique classes
  Client 14: 45625 train samples, 2 unique classes
  Client 15: 45984 train samples, 2 unique classes
  Client 16: 46428 train samples, 2 unique classes
  Client 17: 44737 train samples, 2 unique classes
  Client 18: 45540 train samples, 2 unique classes
  Client 19: 46497 train samples, 2 unique classes
Will sample 4500 samples per client per epoch
Graph: erdos, nodes: 20, edges: 126
Degree statistics: avg=12.60, min=8, max=16
Attack: Compromised 4/20 nodes: [5, 12, 13, 17]
Attack type: krum, lambda: 1.0
Model variant: baseline
Model parameters: 1,174,986
Sketchguard Node 0:
  Model dim: 1,174,986 → Sketch size: 180
  Compression ratio: 6527.7x
  Using model parameters for aggregation, sketches for filtering
Sketchguard Node 1:
  Model dim: 1,174,986 → Sketch size: 180
  Compression ratio: 6527.7x
  Using model parameters for aggregation, sketches for filtering
Sketchguard Node 2:
  Model dim: 1,174,986 → Sketch size: 180
  Compression ratio: 6527.7x
  Using model parameters for aggregation, sketches for filtering
Sketchguard Node 3:
  Model dim: 1,174,986 → Sketch size: 180
  Compression ratio: 6527.7x
  Using model parameters for aggregation, sketches for filtering
Sketchguard Node 4:
  Model dim: 1,174,986 → Sketch size: 180
  Compression ratio: 6527.7x
  Using model parameters for aggregation, sketches for filtering
Sketchguard Node 5:
  Model dim: 1,174,986 → Sketch size: 180
  Compression ratio: 6527.7x
  Using model parameters for aggregation, sketches for filtering
Sketchguard Node 6:
  Model dim: 1,174,986 → Sketch size: 180
  Compression ratio: 6527.7x
  Using model parameters for aggregation, sketches for filtering
Sketchguard Node 7:
  Model dim: 1,174,986 → Sketch size: 180
  Compression ratio: 6527.7x
  Using model parameters for aggregation, sketches for filtering
Sketchguard Node 8:
  Model dim: 1,174,986 → Sketch size: 180
  Compression ratio: 6527.7x
  Using model parameters for aggregation, sketches for filtering
Sketchguard Node 9:
  Model dim: 1,174,986 → Sketch size: 180
  Compression ratio: 6527.7x
  Using model parameters for aggregation, sketches for filtering
Sketchguard Node 10:
  Model dim: 1,174,986 → Sketch size: 180
  Compression ratio: 6527.7x
  Using model parameters for aggregation, sketches for filtering
Sketchguard Node 11:
  Model dim: 1,174,986 → Sketch size: 180
  Compression ratio: 6527.7x
  Using model parameters for aggregation, sketches for filtering
Sketchguard Node 12:
  Model dim: 1,174,986 → Sketch size: 180
  Compression ratio: 6527.7x
  Using model parameters for aggregation, sketches for filtering
Sketchguard Node 13:
  Model dim: 1,174,986 → Sketch size: 180
  Compression ratio: 6527.7x
  Using model parameters for aggregation, sketches for filtering
Sketchguard Node 14:
  Model dim: 1,174,986 → Sketch size: 180
  Compression ratio: 6527.7x
  Using model parameters for aggregation, sketches for filtering
Sketchguard Node 15:
  Model dim: 1,174,986 → Sketch size: 180
  Compression ratio: 6527.7x
  Using model parameters for aggregation, sketches for filtering
Sketchguard Node 16:
  Model dim: 1,174,986 → Sketch size: 180
  Compression ratio: 6527.7x
  Using model parameters for aggregation, sketches for filtering
Sketchguard Node 17:
  Model dim: 1,174,986 → Sketch size: 180
  Compression ratio: 6527.7x
  Using model parameters for aggregation, sketches for filtering
Sketchguard Node 18:
  Model dim: 1,174,986 → Sketch size: 180
  Compression ratio: 6527.7x
  Using model parameters for aggregation, sketches for filtering
Sketchguard Node 19:
  Model dim: 1,174,986 → Sketch size: 180
  Compression ratio: 6527.7x
  Using model parameters for aggregation, sketches for filtering
Sketchguard ALGORITHM (Sketch-based Filtering + State Aggregation)
  - Model dimension: 1,174,986 parameters
  - Config: SketchguardConfig(gamma=2, kappa=1, alpha=0.5, min_neighbors=1, sketch_size=180, network_seed=987654321, attack_detection_window=5)
  - Sketch size: 180
  - Compression ratio: 6527.7x
  - Complexity: O(d + N×k) = O(1,174,986 + 20×180)
  - Theoretical speedup vs BALANCE: 19.9x
Initial test acc across nodes: mean=0.4953 ± 0.0174
Round 001: test acc mean=0.5062 ± 0.0165 | min=0.4700 max=0.5467
         : test loss mean=0.6987 ± 0.0081
         : individual accs = ['0.469997', '0.501089', '0.510094', '0.515861', '0.504776', '0.517289', '0.506204', '0.507116', '0.510774', '0.546720', '0.503067', '0.488114', '0.509126', '0.515875', '0.507821', '0.534700', '0.493988', '0.495055', '0.506491', '0.479964']
         : correct/total = [(6689, 14232), (7133, 14235), (7277, 14266), (7334, 14217), (7187, 14238), (7435, 14373), (7262, 14346), (7269, 14334), (7301, 14294), (7858, 14373), (7216, 14344), (6981, 14302), (7308, 14354), (7409, 14362), (7272, 14320), (7697, 14395), (7108, 14389), (7058, 14257), (7218, 14251), (6911, 14399)]
         : compromised: 0.5093, honest: 0.5054
         : sketchguard stats = ['Node 0: acc_rate=1.000', 'Node 1: acc_rate=1.000', 'Node 2: acc_rate=1.000']...
Round 002: test acc mean=0.5796 ± 0.0337 | min=0.5047 max=0.6225
         : test loss mean=0.6831 ± 0.0051
         : individual accs = ['0.553752', '0.563330', '0.566452', '0.560667', '0.622489', '0.586169', '0.617315', '0.618041', '0.616692', '0.504766', '0.595371', '0.578590', '0.591403', '0.576870', '0.586802', '0.572282', '0.547919', '0.504735', '0.616097', '0.611501']
         : correct/total = [(7881, 14232), (8019, 14235), (8081, 14266), (7971, 14217), (8863, 14238), (8425, 14373), (8856, 14346), (8859, 14334), (8815, 14294), (7255, 14373), (8540, 14344), (8275, 14302), (8489, 14354), (8285, 14362), (8403, 14320), (8238, 14395), (7884, 14389), (7196, 14257), (8780, 14251), (8805, 14399)]
         : compromised: 0.5648, honest: 0.5833
         : sketchguard stats = ['Node 0: acc_rate=0.906', 'Node 1: acc_rate=0.909', 'Node 2: acc_rate=0.917']...
Round 003: test acc mean=0.6047 ± 0.0253 | min=0.5466 max=0.6294
         : test loss mean=0.6748 ± 0.0058
         : individual accs = ['0.616920', '0.629434', '0.602131', '0.623409', '0.626844', '0.590134', '0.622194', '0.546602', '0.627256', '0.611494', '0.621026', '0.607677', '0.613139', '0.588219', '0.570321', '0.625078', '0.628466', '0.553763', '0.619114', '0.570804']
         : correct/total = [(8780, 14232), (8960, 14235), (8590, 14266), (8863, 14217), (8925, 14238), (8482, 14373), (8926, 14346), (7835, 14334), (8966, 14294), (8789, 14373), (8908, 14344), (8691, 14302), (8801, 14354), (8448, 14362), (8167, 14320), (8998, 14395), (9043, 14389), (7895, 14257), (8823, 14251), (8219, 14399)]
         : compromised: 0.5863, honest: 0.6093
         : sketchguard stats = ['Node 0: acc_rate=0.875', 'Node 1: acc_rate=0.879', 'Node 2: acc_rate=0.889']...
Round 004: test acc mean=0.6334 ± 0.0088 | min=0.6082 max=0.6436
         : test loss mean=0.6552 ± 0.0049
         : individual accs = ['0.632870', '0.640183', '0.608229', '0.635296', '0.639556', '0.640646', '0.633068', '0.639598', '0.643627', '0.618451', '0.631274', '0.630401', '0.638777', '0.621501', '0.634707', '0.635915', '0.641462', '0.633443', '0.625289', '0.643447']
         : correct/total = [(9007, 14232), (9113, 14235), (8677, 14266), (9032, 14217), (9106, 14238), (9208, 14373), (9082, 14346), (9168, 14334), (9200, 14294), (8889, 14373), (9055, 14344), (9016, 14302), (9169, 14354), (8926, 14362), (9089, 14320), (9154, 14395), (9230, 14389), (9031, 14257), (8911, 14251), (9265, 14399)]
         : compromised: 0.6336, honest: 0.6333
         : sketchguard stats = ['Node 0: acc_rate=0.859', 'Node 1: acc_rate=0.864', 'Node 2: acc_rate=0.875']...
Round 005: test acc mean=0.6405 ± 0.0080 | min=0.6141 max=0.6489
         : test loss mean=0.6394 ± 0.0049
         : individual accs = ['0.641653', '0.647067', '0.635637', '0.631849', '0.647282', '0.641202', '0.644291', '0.634087', '0.648944', '0.614068', '0.636503', '0.642847', '0.644698', '0.640510', '0.648254', '0.640153', '0.648412', '0.636740', '0.636938', '0.648309']
         : correct/total = [(9132, 14232), (9211, 14235), (9068, 14266), (8983, 14217), (9216, 14238), (9216, 14373), (9243, 14346), (9089, 14334), (9276, 14294), (8826, 14373), (9130, 14344), (9194, 14302), (9254, 14354), (9199, 14362), (9283, 14320), (9215, 14395), (9330, 14389), (9078, 14257), (9077, 14251), (9335, 14399)]
         : compromised: 0.6408, honest: 0.6404
         : sketchguard stats = ['Node 0: acc_rate=0.850', 'Node 1: acc_rate=0.855', 'Node 2: acc_rate=0.867']...
Round 006: test acc mean=0.6496 ± 0.0057 | min=0.6360 max=0.6615
         : test loss mean=0.6273 ± 0.0038
         : individual accs = ['0.646571', '0.649947', '0.642296', '0.650278', '0.655499', '0.652404', '0.649380', '0.635970', '0.661466', '0.648299', '0.646612', '0.648371', '0.654103', '0.647681', '0.657891', '0.650087', '0.651470', '0.650277', '0.640025', '0.652893']
         : correct/total = [(9202, 14232), (9252, 14235), (9163, 14266), (9245, 14217), (9333, 14238), (9377, 14373), (9316, 14346), (9116, 14334), (9455, 14294), (9318, 14373), (9275, 14344), (9273, 14302), (9389, 14354), (9302, 14362), (9421, 14320), (9358, 14395), (9374, 14389), (9271, 14257), (9121, 14251), (9401, 14399)]
         : compromised: 0.6511, honest: 0.6492
         : sketchguard stats = ['Node 0: acc_rate=0.844', 'Node 1: acc_rate=0.848', 'Node 2: acc_rate=0.861']...
Round 007: test acc mean=0.6550 ± 0.0098 | min=0.6316 max=0.6683
         : test loss mean=0.6209 ± 0.0062
         : individual accs = ['0.653387', '0.663014', '0.653792', '0.657171', '0.664208', '0.662701', '0.647567', '0.631645', '0.668252', '0.657274', '0.646960', '0.659838', '0.665598', '0.648030', '0.667179', '0.633553', '0.662172', '0.653854', '0.649428', '0.654143']
         : correct/total = [(9299, 14232), (9438, 14235), (9327, 14266), (9343, 14217), (9457, 14238), (9525, 14373), (9290, 14346), (9054, 14334), (9552, 14294), (9447, 14373), (9280, 14344), (9437, 14302), (9554, 14354), (9307, 14362), (9554, 14320), (9120, 14395), (9528, 14389), (9322, 14257), (9255, 14251), (9419, 14399)]
         : compromised: 0.6575, honest: 0.6543
         : sketchguard stats = ['Node 0: acc_rate=0.839', 'Node 1: acc_rate=0.844', 'Node 2: acc_rate=0.857']...
Round 008: test acc mean=0.6610 ± 0.0089 | min=0.6316 max=0.6756
         : test loss mean=0.6142 ± 0.0060
         : individual accs = ['0.657603', '0.654022', '0.631642', '0.665049', '0.655078', '0.668058', '0.669315', '0.665969', '0.675598', '0.666458', '0.661113', '0.663683', '0.650620', '0.661468', '0.666969', '0.658701', '0.664118', '0.660588', '0.655673', '0.667824']
         : correct/total = [(9359, 14232), (9310, 14235), (9011, 14266), (9455, 14217), (9327, 14238), (9602, 14373), (9602, 14346), (9546, 14334), (9657, 14294), (9579, 14373), (9483, 14344), (9492, 14302), (9339, 14354), (9500, 14362), (9551, 14320), (9482, 14395), (9556, 14389), (9418, 14257), (9344, 14251), (9616, 14399)]
         : compromised: 0.6602, honest: 0.6612
         : sketchguard stats = ['Node 0: acc_rate=0.836', 'Node 1: acc_rate=0.841', 'Node 2: acc_rate=0.854']...
Round 009: test acc mean=0.6672 ± 0.0079 | min=0.6464 max=0.6789
         : test loss mean=0.6086 ± 0.0055
         : individual accs = ['0.650787', '0.669336', '0.667952', '0.672505', '0.662874', '0.674807', '0.655793', '0.666457', '0.678886', '0.667919', '0.646403', '0.663334', '0.668106', '0.669336', '0.671718', '0.667315', '0.676072', '0.670828', '0.671181', '0.671783']
         : correct/total = [(9262, 14232), (9528, 14235), (9529, 14266), (9561, 14217), (9438, 14238), (9699, 14373), (9408, 14346), (9553, 14334), (9704, 14294), (9600, 14373), (9272, 14344), (9487, 14302), (9590, 14354), (9613, 14362), (9619, 14320), (9606, 14395), (9728, 14389), (9564, 14257), (9565, 14251), (9673, 14399)]
         : compromised: 0.6708, honest: 0.6663
         : sketchguard stats = ['Node 0: acc_rate=0.833', 'Node 1: acc_rate=0.838', 'Node 2: acc_rate=0.852']...
Round 010: test acc mean=0.6754 ± 0.0059 | min=0.6584 max=0.6839
         : test loss mean=0.5999 ± 0.0047
         : individual accs = ['0.673061', '0.678469', '0.658419', '0.674685', '0.683874', '0.676755', '0.678586', '0.682015', '0.677767', '0.672581', '0.672337', '0.678157', '0.683224', '0.673722', '0.678422', '0.669330', '0.678365', '0.675808', '0.665216', '0.677617']
         : correct/total = [(9579, 14232), (9658, 14235), (9393, 14266), (9592, 14217), (9737, 14238), (9727, 14373), (9735, 14346), (9776, 14334), (9688, 14294), (9667, 14373), (9644, 14344), (9699, 14302), (9807, 14354), (9676, 14362), (9715, 14320), (9635, 14395), (9761, 14389), (9635, 14257), (9480, 14251), (9757, 14399)]
         : compromised: 0.6774, honest: 0.6749
         : sketchguard stats = ['Node 0: acc_rate=0.831', 'Node 1: acc_rate=0.836', 'Node 2: acc_rate=0.850']...

=== FINAL RESULTS ===
Dataset: sent140, Nodes: 20, Graph: erdos, Aggregation: sketchguard
Attack: krum, 20.0% compromised
Final accuracy - Compromised: 0.6774, Honest: 0.6749
Overall test accuracy: mean=0.6754 ± 0.0059

=== Sketchguard SUMMARY ===
Node 0: acceptance=0.831
Node 1: acceptance=0.836
Node 2: acceptance=0.850
Node 3: acceptance=0.887
Node 4: acceptance=0.836
Node 5: acceptance=0.820
Node 6: acceptance=0.743
Node 7: acceptance=0.807
Node 8: acceptance=0.730
Node 9: acceptance=0.931
Node 10: acceptance=0.700
Node 11: acceptance=0.807
Node 12: acceptance=0.925
Node 13: acceptance=0.931
Node 14: acceptance=0.760
Node 15: acceptance=0.836
Node 16: acceptance=0.792
Node 17: acceptance=0.900
Node 18: acceptance=0.831
Node 19: acceptance=0.775

=== PARALLEL EXECUTION TIME (realistic for distributed system) ===
  COMMUNICATION (max across nodes):
    - Sketch transfer: 0.000s (0.0%)
    - Model fetch (accepted): 0.000s (0.0%)
  COMPUTATION (max across nodes):
    - Sketching: 0.494s (95.0%)
    - Filtering: 0.001s (0.2%)
    - Aggregation: 0.025s (4.8%)
  TOTALS:
    - Total computation: 0.520s (100.0%)
    - Total communication: 0.000s (0.0%)
    - Total parallel time: 0.520s

=== PER-NODE AVERAGE TIME ===
  - Sketching: 0.410s
  - Filtering: 0.001s
  - Aggregation: 0.019s
  - Sketch transfer: 0.000s
  - Model fetch: 0.000s
  - Total per node: 0.429s

=== TOTAL COMPUTATIONAL WORK (sum across all nodes) ===
  - Total sketching: 8.205s
  - Total filtering: 0.013s
  - Total aggregation: 0.372s
  - Total sketch transfer: 0.000s
  - Total model fetch: 0.000s
  - Grand total: 8.590s
  - Mean acceptance rate: 0.827

Sketchguard Algorithm Properties:
  - Original dimension: 1,174,986
  - Sketch size: 180
  - Compression ratio: 19.9x
  - Single repetition: No repetitions needed
  - Theoretical complexity: O(d + N×k)
  - Approach: Sketch filtering + state aggregation
