Device: cuda
Seed: 987654321
Loading 1 LEAF Sent140 train files...
LEAF Sent140 train: 254555 users, 908652 samples
Building vocabulary (max_size=10000)...
Vocabulary size: 10000
Loading 1 LEAF Sent140 test files...
LEAF Sent140 test: 254555 users, 286281 samples
Found 254555 train users, 254555 test users, 254555 common users
User sample counts range: 494 (max) to 1 (min)
Distributed ALL 254555 users across 20 clients
Users per client: 12727 (with 15 clients getting +1 user)
Train partition sizes: [44353, 44290, 44657, 44907, 44696, 45843, 45801, 45619, 45069, 45639, 45821, 45311, 45779, 46056, 45625, 45984, 46428, 44737, 45540, 46497]
Test partition sizes: [14232, 14235, 14266, 14217, 14238, 14373, 14346, 14334, 14294, 14373, 14344, 14302, 14354, 14362, 14320, 14395, 14389, 14257, 14251, 14399]
  Client 0: 44353 train samples, 2 unique classes
  Client 1: 44290 train samples, 2 unique classes
  Client 2: 44657 train samples, 2 unique classes
  Client 3: 44907 train samples, 2 unique classes
  Client 4: 44696 train samples, 2 unique classes
  Client 5: 45843 train samples, 2 unique classes
  Client 6: 45801 train samples, 2 unique classes
  Client 7: 45619 train samples, 2 unique classes
  Client 8: 45069 train samples, 2 unique classes
  Client 9: 45639 train samples, 2 unique classes
  Client 10: 45821 train samples, 2 unique classes
  Client 11: 45311 train samples, 2 unique classes
  Client 12: 45779 train samples, 2 unique classes
  Client 13: 46056 train samples, 2 unique classes
  Client 14: 45625 train samples, 2 unique classes
  Client 15: 45984 train samples, 2 unique classes
  Client 16: 46428 train samples, 2 unique classes
  Client 17: 44737 train samples, 2 unique classes
  Client 18: 45540 train samples, 2 unique classes
  Client 19: 46497 train samples, 2 unique classes
Will sample 4500 samples per client per epoch
Graph: erdos, nodes: 20, edges: 126
Degree statistics: avg=12.60, min=8, max=16
Attack: Compromised 16/20 nodes: [1, 2, 3, 5, 6, 8, 9, 10, 11, 12, 13, 14, 15, 17, 18, 19]
Attack type: krum, lambda: 1.0
Model variant: baseline
Model parameters: 1,174,986
UBAR ALGORITHM (Two-Stage Byzantine-resilient)
  - Model dimension: 1,174,986 parameters
  - Rho parameter: 0.19999999999999996
  - Stage 1: Distance-based filtering (select 20% closest neighbors)
  - Stage 2: Performance-based selection (loss comparison)
  - Complexity: O(deg(i)×d + deg(i)×inference)
Initial test acc across nodes: mean=0.4965 ± 0.0152
Round 001: test acc mean=0.5350 ± 0.0200 | min=0.5066 max=0.5761
         : test loss mean=0.6911 ± 0.0015
         : individual accs = ['0.544056', '0.525395', '0.534417', '0.509601', '0.513977', '0.530509', '0.529416', '0.576113', '0.514132', '0.543589', '0.517987', '0.551391', '0.572175', '0.509052', '0.506564', '0.554081', '0.542359', '0.524023', '0.545646', '0.556080']
         : correct/total = [(7743, 14232), (7479, 14235), (7624, 14266), (7245, 14217), (7318, 14238), (7625, 14373), (7595, 14346), (8258, 14334), (7349, 14294), (7813, 14373), (7430, 14344), (7886, 14302), (8213, 14354), (7311, 14362), (7254, 14320), (7976, 14395), (7804, 14389), (7471, 14257), (7776, 14251), (8007, 14399)]
         : compromised: 0.5328, honest: 0.5441
         : ubar stats = ['Node 0: s1=0.188, s2=0.333', 'Node 1: s1=0.182, s2=1.000', 'Node 2: s1=0.167, s2=0.500']...
Round 002: test acc mean=0.5569 ± 0.0307 | min=0.5001 max=0.6050
         : test loss mean=0.6889 ± 0.0034
         : individual accs = ['0.590781', '0.500105', '0.577106', '0.563621', '0.556679', '0.520351', '0.534435', '0.589228', '0.553659', '0.582551', '0.544688', '0.605020', '0.587780', '0.513717', '0.500070', '0.588190', '0.559594', '0.554114', '0.580100', '0.537121']
         : correct/total = [(8408, 14232), (7119, 14235), (8233, 14266), (8013, 14217), (7926, 14238), (7479, 14373), (7667, 14346), (8446, 14334), (7914, 14294), (8373, 14373), (7813, 14344), (8653, 14302), (8437, 14354), (7378, 14362), (7161, 14320), (8467, 14395), (8052, 14389), (7900, 14257), (8267, 14251), (7734, 14399)]
         : compromised: 0.5527, honest: 0.5741
         : ubar stats = ['Node 0: s1=0.188, s2=0.333', 'Node 1: s1=0.182, s2=0.750', 'Node 2: s1=0.167, s2=0.500']...
Round 003: test acc mean=0.5483 ± 0.0254 | min=0.4997 max=0.5901
         : test loss mean=0.6878 ± 0.0023
         : individual accs = ['0.558249', '0.530523', '0.578298', '0.541886', '0.574378', '0.499687', '0.513871', '0.555811', '0.558346', '0.551172', '0.540435', '0.590057', '0.585760', '0.527921', '0.512640', '0.561237', '0.572729', '0.557481', '0.543050', '0.511633']
         : correct/total = [(7945, 14232), (7552, 14235), (8250, 14266), (7704, 14217), (8178, 14238), (7182, 14373), (7372, 14346), (7967, 14334), (7981, 14294), (7922, 14373), (7752, 14344), (8439, 14302), (8408, 14354), (7582, 14362), (7341, 14320), (8079, 14395), (8241, 14389), (7948, 14257), (7739, 14251), (7367, 14399)]
         : compromised: 0.5440, honest: 0.5653
         : ubar stats = ['Node 0: s1=0.188, s2=0.333', 'Node 1: s1=0.182, s2=0.833', 'Node 2: s1=0.167, s2=0.667']...
Round 004: test acc mean=0.5766 ± 0.0172 | min=0.5443 max=0.6039
         : test loss mean=0.6847 ± 0.0028
         : individual accs = ['0.583825', '0.580822', '0.589724', '0.552930', '0.590743', '0.545328', '0.566081', '0.582461', '0.590388', '0.573993', '0.568321', '0.597888', '0.603943', '0.573318', '0.544274', '0.589927', '0.584961', '0.582801', '0.584801', '0.546288']
         : correct/total = [(8309, 14232), (8268, 14235), (8413, 14266), (7861, 14217), (8411, 14238), (7838, 14373), (8121, 14346), (8349, 14334), (8439, 14294), (8250, 14373), (8152, 14344), (8551, 14302), (8669, 14354), (8234, 14362), (7794, 14320), (8492, 14395), (8417, 14389), (8309, 14257), (8334, 14251), (7866, 14399)]
         : compromised: 0.5744, honest: 0.5855
         : ubar stats = ['Node 0: s1=0.188, s2=0.500', 'Node 1: s1=0.182, s2=0.875', 'Node 2: s1=0.167, s2=0.750']...
Round 005: test acc mean=0.5965 ± 0.0111 | min=0.5747 max=0.6117
         : test loss mean=0.6776 ± 0.0052
         : individual accs = ['0.603078', '0.605760', '0.591406', '0.606527', '0.611392', '0.579559', '0.605535', '0.606530', '0.611725', '0.574689', '0.578360', '0.593763', '0.588268', '0.606113', '0.582193', '0.601528', '0.596914', '0.600687', '0.589713', '0.596847']
         : correct/total = [(8583, 14232), (8623, 14235), (8437, 14266), (8623, 14217), (8705, 14238), (8330, 14373), (8687, 14346), (8694, 14334), (8744, 14294), (8260, 14373), (8296, 14344), (8492, 14302), (8444, 14354), (8705, 14362), (8337, 14320), (8659, 14395), (8589, 14389), (8564, 14257), (8404, 14251), (8594, 14399)]
         : compromised: 0.5945, honest: 0.6045
         : ubar stats = ['Node 0: s1=0.188, s2=0.600', 'Node 1: s1=0.182, s2=0.800', 'Node 2: s1=0.167, s2=0.800']...
Round 006: test acc mean=0.6073 ± 0.0065 | min=0.5941 max=0.6174
         : test loss mean=0.6666 ± 0.0048
         : individual accs = ['0.610807', '0.616017', '0.605566', '0.614616', '0.610971', '0.608363', '0.611878', '0.611692', '0.609556', '0.599249', '0.610429', '0.604111', '0.608332', '0.617393', '0.594134', '0.602084', '0.606574', '0.611138', '0.595046', '0.597819']
         : correct/total = [(8693, 14232), (8769, 14235), (8639, 14266), (8738, 14217), (8699, 14238), (8744, 14373), (8778, 14346), (8768, 14334), (8713, 14294), (8613, 14373), (8756, 14344), (8640, 14302), (8732, 14354), (8867, 14362), (8508, 14320), (8667, 14395), (8728, 14389), (8713, 14257), (8480, 14251), (8608, 14399)]
         : compromised: 0.6066, honest: 0.6100
         : ubar stats = ['Node 0: s1=0.188, s2=0.667', 'Node 1: s1=0.182, s2=0.750', 'Node 2: s1=0.167, s2=0.750']...
Round 007: test acc mean=0.6189 ± 0.0042 | min=0.6105 max=0.6263
         : test loss mean=0.6551 ± 0.0027
         : individual accs = ['0.626335', '0.621567', '0.615519', '0.621017', '0.626071', '0.616642', '0.622822', '0.622506', '0.623548', '0.617825', '0.618168', '0.615928', '0.617598', '0.621014', '0.610475', '0.613407', '0.618042', '0.619696', '0.612448', '0.617543']
         : correct/total = [(8914, 14232), (8848, 14235), (8781, 14266), (8829, 14217), (8914, 14238), (8863, 14373), (8935, 14346), (8923, 14334), (8913, 14294), (8880, 14373), (8867, 14344), (8809, 14302), (8865, 14354), (8919, 14362), (8742, 14320), (8830, 14395), (8893, 14389), (8835, 14257), (8728, 14251), (8892, 14399)]
         : compromised: 0.6178, honest: 0.6232
         : ubar stats = ['Node 0: s1=0.188, s2=0.619', 'Node 1: s1=0.182, s2=0.714', 'Node 2: s1=0.167, s2=0.786']...
Round 008: test acc mean=0.6260 ± 0.0039 | min=0.6190 max=0.6332
         : test loss mean=0.6482 ± 0.0023
         : individual accs = ['0.633221', '0.628311', '0.619024', '0.629809', '0.628810', '0.623043', '0.629304', '0.627738', '0.630894', '0.623600', '0.628346', '0.621172', '0.629232', '0.627071', '0.618994', '0.622230', '0.622072', '0.627832', '0.623746', '0.626016']
         : correct/total = [(9012, 14232), (8944, 14235), (8831, 14266), (8954, 14217), (8953, 14238), (8955, 14373), (9028, 14346), (8998, 14334), (9018, 14294), (8963, 14373), (9013, 14344), (8884, 14302), (9032, 14354), (9006, 14362), (8864, 14320), (8957, 14395), (8951, 14389), (8951, 14257), (8889, 14251), (9014, 14399)]
         : compromised: 0.6255, honest: 0.6280
         : ubar stats = ['Node 0: s1=0.188, s2=0.583', 'Node 1: s1=0.182, s2=0.688', 'Node 2: s1=0.167, s2=0.812']...
Round 009: test acc mean=0.6319 ± 0.0040 | min=0.6239 max=0.6414
         : test loss mean=0.6429 ± 0.0020
         : individual accs = ['0.641442', '0.632877', '0.626595', '0.636492', '0.632743', '0.628122', '0.631465', '0.632692', '0.630964', '0.634453', '0.636642', '0.634946', '0.632576', '0.634731', '0.623883', '0.632372', '0.628883', '0.629445', '0.628447', '0.627613']
         : correct/total = [(9129, 14232), (9009, 14235), (8939, 14266), (9049, 14217), (9009, 14238), (9028, 14373), (9059, 14346), (9069, 14334), (9019, 14294), (9119, 14373), (9132, 14344), (9081, 14302), (9080, 14354), (9116, 14362), (8934, 14320), (9103, 14395), (9049, 14389), (8974, 14257), (8956, 14251), (9037, 14399)]
         : compromised: 0.6314, honest: 0.6339
         : ubar stats = ['Node 0: s1=0.188, s2=0.630', 'Node 1: s1=0.182, s2=0.667', 'Node 2: s1=0.167, s2=0.778']...
Round 010: test acc mean=0.6364 ± 0.0032 | min=0.6305 max=0.6440
         : test loss mean=0.6395 ± 0.0021
         : individual accs = ['0.640599', '0.641869', '0.633324', '0.637828', '0.638151', '0.633062', '0.633696', '0.634784', '0.636141', '0.638558', '0.643963', '0.636554', '0.638359', '0.638073', '0.630517', '0.635568', '0.633540', '0.634986', '0.634622', '0.633655']
         : correct/total = [(9117, 14232), (9137, 14235), (9035, 14266), (9068, 14217), (9086, 14238), (9099, 14373), (9091, 14346), (9099, 14334), (9093, 14294), (9178, 14373), (9237, 14344), (9104, 14302), (9163, 14354), (9164, 14362), (9029, 14320), (9149, 14395), (9116, 14389), (9053, 14257), (9044, 14251), (9124, 14399)]
         : compromised: 0.6363, honest: 0.6368
         : ubar stats = ['Node 0: s1=0.188, s2=0.633', 'Node 1: s1=0.182, s2=0.650', 'Node 2: s1=0.167, s2=0.750']...

=== FINAL RESULTS ===
Dataset: sent140, Nodes: 20, Graph: erdos, Aggregation: ubar
Attack: krum, 80.0% compromised
Final accuracy - Compromised: 0.6363, Honest: 0.6368
Overall test accuracy: mean=0.6364 ± 0.0032

=== UBAR SUMMARY ===
Node 0: stage1=0.188, stage2=0.633, overall=0.119
Node 1: stage1=0.182, stage2=0.650, overall=0.118
Node 2: stage1=0.167, stage2=0.750, overall=0.125
Node 3: stage1=0.125, stage2=1.000, overall=0.125
Node 4: stage1=0.182, stage2=0.700, overall=0.127
Node 5: stage1=0.133, stage2=0.850, overall=0.113
Node 6: stage1=0.143, stage2=0.600, overall=0.086
Node 7: stage1=0.143, stage2=0.800, overall=0.114
Node 8: stage1=0.100, stage2=1.000, overall=0.100
Node 9: stage1=0.154, stage2=0.700, overall=0.108
Node 10: stage1=0.111, stage2=1.000, overall=0.111
Node 11: stage1=0.143, stage2=0.650, overall=0.093
Node 12: stage1=0.167, stage2=0.750, overall=0.125
Node 13: stage1=0.154, stage2=0.900, overall=0.138
Node 14: stage1=0.133, stage2=0.900, overall=0.120
Node 15: stage1=0.182, stage2=0.600, overall=0.109
Node 16: stage1=0.154, stage2=0.750, overall=0.115
Node 17: stage1=0.111, stage2=1.000, overall=0.111
Node 18: stage1=0.188, stage2=0.633, overall=0.119
Node 19: stage1=0.188, stage2=0.867, overall=0.162

=== PARALLEL EXECUTION TIME (realistic for distributed system) ===
  COMMUNICATION (max across nodes):
    - Full model transfer: 0.000s (0.0%)
  COMPUTATION (max across nodes):
    - Distance computation: 0.073s (75.7%)
    - Loss computation: 0.018s (18.6%)
    - Aggregation: 0.006s (5.7%)
  TOTALS:
    - Total computation: 0.097s (100.0%)
    - Total communication: 0.000s (0.0%)
    - Total parallel time: 0.097s

=== PER-NODE AVERAGE TIME ===
  - Distance computation: 0.051s
  - Loss computation: 0.011s
  - Aggregation: 0.004s
  - Model transfer: 0.000s
  - Total per node: 0.066s

=== TOTAL COMPUTATIONAL WORK (sum across all nodes) ===
  - Total distance computation: 1.025s
  - Total loss computation: 0.219s
  - Total aggregation: 0.078s
  - Total model transfer: 0.000s
  - Grand total: 1.323s
  - Mean Stage 1 acceptance rate: 0.152
  - Mean Stage 2 acceptance rate: 0.787
  - Overall acceptance rate: 0.120

UBAR Algorithm Properties:
  - Model dimension: 1,174,986
  - Rho parameter: 0.19999999999999996
  - Two-stage approach: Distance filtering + loss evaluation
  - Stage 1 selects: 20% of neighbors
  - Stage 2 uses: Training sample loss comparison
  - Theoretical complexity: O(deg(i)×d + deg(i)×inference)
  - Approach: UBAR paper implementation
