Device: cuda
Seed: 987654321
Loading 1 LEAF Sent140 train files...
LEAF Sent140 train: 254555 users, 908652 samples
Building vocabulary (max_size=10000)...
Vocabulary size: 10000
Loading 1 LEAF Sent140 test files...
LEAF Sent140 test: 254555 users, 286281 samples
Found 254555 train users, 254555 test users, 254555 common users
User sample counts range: 494 (max) to 1 (min)
Distributed ALL 254555 users across 20 clients
Users per client: 12727 (with 15 clients getting +1 user)
Train partition sizes: [44353, 44290, 44657, 44907, 44696, 45843, 45801, 45619, 45069, 45639, 45821, 45311, 45779, 46056, 45625, 45984, 46428, 44737, 45540, 46497]
Test partition sizes: [14232, 14235, 14266, 14217, 14238, 14373, 14346, 14334, 14294, 14373, 14344, 14302, 14354, 14362, 14320, 14395, 14389, 14257, 14251, 14399]
  Client 0: 44353 train samples, 2 unique classes
  Client 1: 44290 train samples, 2 unique classes
  Client 2: 44657 train samples, 2 unique classes
  Client 3: 44907 train samples, 2 unique classes
  Client 4: 44696 train samples, 2 unique classes
  Client 5: 45843 train samples, 2 unique classes
  Client 6: 45801 train samples, 2 unique classes
  Client 7: 45619 train samples, 2 unique classes
  Client 8: 45069 train samples, 2 unique classes
  Client 9: 45639 train samples, 2 unique classes
  Client 10: 45821 train samples, 2 unique classes
  Client 11: 45311 train samples, 2 unique classes
  Client 12: 45779 train samples, 2 unique classes
  Client 13: 46056 train samples, 2 unique classes
  Client 14: 45625 train samples, 2 unique classes
  Client 15: 45984 train samples, 2 unique classes
  Client 16: 46428 train samples, 2 unique classes
  Client 17: 44737 train samples, 2 unique classes
  Client 18: 45540 train samples, 2 unique classes
  Client 19: 46497 train samples, 2 unique classes
Will sample 4500 samples per client per epoch
Graph: fully, nodes: 20, edges: 190
Degree statistics: avg=19.00, min=19, max=19
Attack: Compromised 12/20 nodes: [1, 2, 3, 5, 8, 11, 12, 13, 14, 15, 17, 18]
Attack type: backdoor, lambda: 1.0
Backdoor target label: 1, trigger size: 3
Model variant: baseline
Model parameters: 1,174,986
Initial test acc across nodes: mean=0.4965 ± 0.0152
Backdoor attack: Created poisoned datasets for 12 compromised nodes
Round 001: test acc mean=0.4985 ± 0.0071 | min=0.4814 max=0.5119
         : test loss mean=8.3816 ± 2.1425
         : individual accs = ['0.511875', '0.481419', '0.495374', '0.499894', '0.505197', '0.503305', '0.496863', '0.496163', '0.495383', '0.500591', '0.501185', '0.503007', '0.504459', '0.483011', '0.503911', '0.500799', '0.493015', '0.504594', '0.495965', '0.493506']
         : correct/total = [(7285, 14232), (6853, 14235), (7067, 14266), (7107, 14217), (7193, 14238), (7234, 14373), (7128, 14346), (7112, 14334), (7081, 14294), (7195, 14373), (7189, 14344), (7194, 14302), (7241, 14354), (6937, 14362), (7216, 14320), (7209, 14395), (7094, 14389), (7194, 14257), (7068, 14251), (7106, 14399)]
         : compromised: 0.4976, honest: 0.4998
Round 002: test acc mean=0.5063 ± 0.0048 | min=0.4965 max=0.5143
         : test loss mean=13.6871 ± 0.2082
         : individual accs = ['0.514264', '0.513172', '0.512547', '0.510094', '0.507866', '0.508592', '0.503067', '0.507744', '0.510004', '0.507549', '0.498536', '0.508041', '0.505852', '0.496519', '0.501816', '0.506009', '0.503718', '0.497510', '0.507754', '0.506077']
         : correct/total = [(7319, 14232), (7305, 14235), (7312, 14266), (7252, 14217), (7231, 14238), (7310, 14373), (7217, 14346), (7278, 14334), (7290, 14294), (7295, 14373), (7151, 14344), (7266, 14302), (7261, 14354), (7131, 14362), (7186, 14320), (7284, 14395), (7248, 14389), (7093, 14257), (7236, 14251), (7287, 14399)]
         : compromised: 0.5065, honest: 0.5061
Round 003: test acc mean=0.5051 ± 0.0056 | min=0.4914 max=0.5139
         : test loss mean=23.7185 ± 0.2591
         : individual accs = ['0.510891', '0.513734', '0.513949', '0.507772', '0.505900', '0.506157', '0.502440', '0.504814', '0.511543', '0.506992', '0.500976', '0.507971', '0.500488', '0.491436', '0.504190', '0.501633', '0.500243', '0.496949', '0.511262', '0.503646']
         : correct/total = [(7271, 14232), (7313, 14235), (7332, 14266), (7219, 14217), (7203, 14238), (7275, 14373), (7208, 14346), (7236, 14334), (7312, 14294), (7287, 14373), (7186, 14344), (7265, 14302), (7184, 14354), (7058, 14362), (7220, 14320), (7221, 14395), (7198, 14389), (7085, 14257), (7286, 14251), (7252, 14399)]
         : compromised: 0.5056, honest: 0.5045
Round 004: test acc mean=0.4945 ± 0.0052 | min=0.4860 max=0.5036
         : test loss mean=14.4673 ± 0.1975
         : individual accs = ['0.486017', '0.486407', '0.487102', '0.491946', '0.495294', '0.496139', '0.493029', '0.492535', '0.492444', '0.492382', '0.501464', '0.489442', '0.497771', '0.503551', '0.496159', '0.498298', '0.501355', '0.503051', '0.489299', '0.495937']
         : correct/total = [(6917, 14232), (6924, 14235), (6949, 14266), (6994, 14217), (7052, 14238), (7131, 14373), (7073, 14346), (7060, 14334), (7039, 14294), (7077, 14373), (7193, 14344), (7000, 14302), (7145, 14354), (7232, 14362), (7105, 14320), (7173, 14395), (7214, 14389), (7172, 14257), (6973, 14251), (7141, 14399)]
         : compromised: 0.4943, honest: 0.4948
Round 005: test acc mean=0.4938 ± 0.0052 | min=0.4851 max=0.5060
         : test loss mean=20.4495 ± 0.2262
         : individual accs = ['0.488547', '0.487109', '0.485139', '0.490680', '0.493328', '0.492869', '0.496863', '0.494768', '0.488177', '0.492103', '0.496793', '0.491050', '0.498049', '0.505988', '0.493994', '0.499410', '0.496421', '0.501929', '0.487475', '0.494826']
         : correct/total = [(6953, 14232), (6934, 14235), (6921, 14266), (6976, 14217), (7024, 14238), (7084, 14373), (7128, 14346), (7092, 14334), (6978, 14294), (7073, 14373), (7126, 14344), (7023, 14302), (7149, 14354), (7267, 14362), (7074, 14320), (7189, 14395), (7143, 14389), (7156, 14257), (6947, 14251), (7125, 14399)]
         : compromised: 0.4935, honest: 0.4942
Round 006: test acc mean=0.4948 ± 0.0056 | min=0.4859 max=0.5085
         : test loss mean=29.0534 ± 0.4497
         : individual accs = ['0.488758', '0.486407', '0.485911', '0.492368', '0.494241', '0.493634', '0.497421', '0.495326', '0.488737', '0.493564', '0.498815', '0.491330', '0.499512', '0.508495', '0.496089', '0.498367', '0.499270', '0.502841', '0.488597', '0.496146']
         : correct/total = [(6956, 14232), (6924, 14235), (6932, 14266), (7000, 14217), (7037, 14238), (7095, 14373), (7136, 14346), (7100, 14334), (6986, 14294), (7094, 14373), (7155, 14344), (7027, 14302), (7170, 14354), (7303, 14362), (7104, 14320), (7174, 14395), (7184, 14389), (7169, 14257), (6963, 14251), (7144, 14399)]
         : compromised: 0.4944, honest: 0.4954
Round 007: test acc mean=0.4949 ± 0.0056 | min=0.4861 max=0.5086
         : test loss mean=29.5464 ± 0.3251
         : individual accs = ['0.489109', '0.486266', '0.486051', '0.492228', '0.494100', '0.493843', '0.497560', '0.495186', '0.488457', '0.493008', '0.499024', '0.492029', '0.499512', '0.508564', '0.495810', '0.498367', '0.499757', '0.503051', '0.488738', '0.496354']
         : correct/total = [(6961, 14232), (6922, 14235), (6934, 14266), (6998, 14217), (7035, 14238), (7098, 14373), (7138, 14346), (7098, 14334), (6982, 14294), (7086, 14373), (7158, 14344), (7037, 14302), (7170, 14354), (7304, 14362), (7100, 14320), (7174, 14395), (7191, 14389), (7172, 14257), (6965, 14251), (7147, 14399)]
         : compromised: 0.4944, honest: 0.4955
Round 008: test acc mean=0.4920 ± 0.0040 | min=0.4804 max=0.4988
         : test loss mean=3.4000 ± 0.0401
         : individual accs = ['0.494660', '0.494064', '0.492289', '0.494267', '0.490167', '0.494190', '0.493866', '0.492884', '0.493983', '0.493843', '0.495399', '0.492588', '0.485579', '0.480365', '0.494274', '0.492463', '0.488429', '0.490776', '0.498842', '0.486353']
         : correct/total = [(7040, 14232), (7033, 14235), (7023, 14266), (7027, 14217), (6979, 14238), (7103, 14373), (7085, 14346), (7065, 14334), (7061, 14294), (7098, 14373), (7106, 14344), (7045, 14302), (6970, 14354), (6899, 14362), (7078, 14320), (7089, 14395), (7028, 14389), (6997, 14257), (7109, 14251), (7003, 14399)]
         : compromised: 0.4920, honest: 0.4920
Round 009: test acc mean=0.5051 ± 0.0056 | min=0.4914 max=0.5140
         : test loss mean=6.5098 ± 0.0656
         : individual accs = ['0.510961', '0.513734', '0.514019', '0.507772', '0.505829', '0.506088', '0.502370', '0.504744', '0.511543', '0.507062', '0.500837', '0.507971', '0.500488', '0.491436', '0.504190', '0.501633', '0.500243', '0.496949', '0.511333', '0.503577']
         : correct/total = [(7272, 14232), (7313, 14235), (7333, 14266), (7219, 14217), (7202, 14238), (7274, 14373), (7207, 14346), (7235, 14334), (7312, 14294), (7288, 14373), (7184, 14344), (7265, 14302), (7184, 14354), (7058, 14362), (7220, 14320), (7221, 14395), (7198, 14389), (7085, 14257), (7287, 14251), (7251, 14399)]
         : compromised: 0.5056, honest: 0.5045
Round 010: test acc mean=0.5049 ± 0.0056 | min=0.4908 max=0.5133
         : test loss mean=5.0577 ± 0.0682
         : individual accs = ['0.510750', '0.513312', '0.512477', '0.507702', '0.506110', '0.505183', '0.503067', '0.504256', '0.512033', '0.506297', '0.500906', '0.508600', '0.500975', '0.490809', '0.503142', '0.501563', '0.499409', '0.496388', '0.511192', '0.503299']
         : correct/total = [(7269, 14232), (7307, 14235), (7311, 14266), (7218, 14217), (7206, 14238), (7261, 14373), (7217, 14346), (7228, 14334), (7319, 14294), (7277, 14373), (7185, 14344), (7274, 14302), (7191, 14354), (7049, 14362), (7205, 14320), (7220, 14395), (7186, 14389), (7077, 14257), (7285, 14251), (7247, 14399)]
         : compromised: 0.5053, honest: 0.5043

=== FINAL RESULTS ===
Dataset: sent140, Nodes: 20, Graph: fully, Aggregation: krum
Attack: backdoor, 60.0% compromised
Final accuracy - Compromised: 0.5053, Honest: 0.5043
Overall test accuracy: mean=0.5049 ± 0.0056

=== BACKDOOR ATTACK SUCCESS RATE (ASR) ===
Target label: 1
Trigger size: 3x3
Overall ASR: 0.0034 ± 0.0005
Honest nodes ASR: 0.0037 ± 0.0004
Compromised nodes ASR: 0.0032 ± 0.0004
Note: Higher ASR indicates more successful backdoor attack
