Device: cuda
Seed: 987654321
Loading 1 LEAF Sent140 train files...
LEAF Sent140 train: 254555 users, 908652 samples
Building vocabulary (max_size=10000)...
Vocabulary size: 10000
Loading 1 LEAF Sent140 test files...
LEAF Sent140 test: 254555 users, 286281 samples
Found 254555 train users, 254555 test users, 254555 common users
User sample counts range: 494 (max) to 1 (min)
Distributed ALL 254555 users across 20 clients
Users per client: 12727 (with 15 clients getting +1 user)
Train partition sizes: [44353, 44290, 44657, 44907, 44696, 45843, 45801, 45619, 45069, 45639, 45821, 45311, 45779, 46056, 45625, 45984, 46428, 44737, 45540, 46497]
Test partition sizes: [14232, 14235, 14266, 14217, 14238, 14373, 14346, 14334, 14294, 14373, 14344, 14302, 14354, 14362, 14320, 14395, 14389, 14257, 14251, 14399]
  Client 0: 44353 train samples, 2 unique classes
  Client 1: 44290 train samples, 2 unique classes
  Client 2: 44657 train samples, 2 unique classes
  Client 3: 44907 train samples, 2 unique classes
  Client 4: 44696 train samples, 2 unique classes
  Client 5: 45843 train samples, 2 unique classes
  Client 6: 45801 train samples, 2 unique classes
  Client 7: 45619 train samples, 2 unique classes
  Client 8: 45069 train samples, 2 unique classes
  Client 9: 45639 train samples, 2 unique classes
  Client 10: 45821 train samples, 2 unique classes
  Client 11: 45311 train samples, 2 unique classes
  Client 12: 45779 train samples, 2 unique classes
  Client 13: 46056 train samples, 2 unique classes
  Client 14: 45625 train samples, 2 unique classes
  Client 15: 45984 train samples, 2 unique classes
  Client 16: 46428 train samples, 2 unique classes
  Client 17: 44737 train samples, 2 unique classes
  Client 18: 45540 train samples, 2 unique classes
  Client 19: 46497 train samples, 2 unique classes
Will sample 4500 samples per client per epoch
Graph: erdos, nodes: 20, edges: 126
Degree statistics: avg=12.60, min=8, max=16
Attack: Compromised 10/20 nodes: [1, 2, 5, 11, 12, 13, 14, 15, 17, 18]
Attack type: directed_deviation, lambda: 1.0
Model variant: baseline
Model parameters: 1,174,986
Initial test acc across nodes: mean=0.4965 ± 0.0152
Round 001: test acc mean=0.5024 ± 0.0080 | min=0.4893 max=0.5190
         : test loss mean=5.9707 ± 3.7663
         : individual accs = ['0.513842', '0.494415', '0.513318', '0.507069', '0.507234', '0.500313', '0.490450', '0.499233', '0.489296', '0.498713', '0.518963', '0.503356', '0.504807', '0.503133', '0.505028', '0.504203', '0.497533', '0.491548', '0.511683', '0.494201']
         : correct/total = [(7313, 14232), (7038, 14235), (7323, 14266), (7209, 14217), (7222, 14238), (7191, 14373), (7036, 14346), (7156, 14334), (6994, 14294), (7168, 14373), (7444, 14344), (7199, 14302), (7246, 14354), (7226, 14362), (7232, 14320), (7258, 14395), (7159, 14389), (7008, 14257), (7292, 14251), (7116, 14399)]
         : compromised: 0.5032, honest: 0.5017
Round 002: test acc mean=0.4941 ± 0.0064 | min=0.4813 max=0.5050
         : test loss mean=5.0873 ± 1.2576
         : individual accs = ['0.503935', '0.492167', '0.492640', '0.490610', '0.486655', '0.496904', '0.492263', '0.495047', '0.491605', '0.499965', '0.488567', '0.487764', '0.505016', '0.481270', '0.498534', '0.502119', '0.489193', '0.493933', '0.503965', '0.488923']
         : correct/total = [(7172, 14232), (7006, 14235), (7028, 14266), (6975, 14217), (6929, 14238), (7142, 14373), (7062, 14346), (7096, 14334), (7027, 14294), (7186, 14373), (7008, 14344), (6976, 14302), (7249, 14354), (6912, 14362), (7139, 14320), (7228, 14395), (7039, 14389), (7042, 14257), (7182, 14251), (7040, 14399)]
         : compromised: 0.4954, honest: 0.4927
Round 003: test acc mean=0.5063 ± 0.0061 | min=0.4928 max=0.5139
         : test loss mean=1.0749 ± 0.1614
         : individual accs = ['0.511383', '0.513874', '0.513178', '0.507561', '0.505900', '0.501148', '0.507877', '0.510744', '0.512453', '0.507062', '0.500697', '0.512446', '0.498676', '0.492828', '0.505796', '0.497673', '0.511780', '0.497229', '0.512596', '0.505799']
         : correct/total = [(7278, 14232), (7315, 14235), (7321, 14266), (7216, 14217), (7203, 14238), (7203, 14373), (7286, 14346), (7321, 14334), (7325, 14294), (7288, 14373), (7182, 14344), (7329, 14302), (7158, 14354), (7078, 14362), (7243, 14320), (7164, 14395), (7364, 14389), (7089, 14257), (7305, 14251), (7283, 14399)]
         : compromised: 0.5045, honest: 0.5081
Round 004: test acc mean=0.5009 ± 0.0052 | min=0.4900 max=0.5088
         : test loss mean=2.6274 ± 0.8635
         : individual accs = ['0.503865', '0.506147', '0.501472', '0.508757', '0.500983', '0.490016', '0.505298', '0.495326', '0.496642', '0.491060', '0.507041', '0.496015', '0.502578', '0.497076', '0.502933', '0.497742', '0.505803', '0.507260', '0.501860', '0.500868']
         : correct/total = [(7171, 14232), (7205, 14235), (7154, 14266), (7233, 14217), (7133, 14238), (7043, 14373), (7249, 14346), (7100, 14334), (7099, 14294), (7058, 14373), (7273, 14344), (7094, 14302), (7214, 14354), (7139, 14362), (7202, 14320), (7165, 14395), (7278, 14389), (7232, 14257), (7152, 14251), (7212, 14399)]
         : compromised: 0.5003, honest: 0.5016
Round 005: test acc mean=0.5082 ± 0.0085 | min=0.4915 max=0.5270
         : test loss mean=1.0477 ± 0.1268
         : individual accs = ['0.510891', '0.513734', '0.499860', '0.508335', '0.505900', '0.514854', '0.526976', '0.523580', '0.515251', '0.507271', '0.502301', '0.516152', '0.500418', '0.491505', '0.506983', '0.505731', '0.503510', '0.496879', '0.511192', '0.502674']
         : correct/total = [(7271, 14232), (7313, 14235), (7131, 14266), (7227, 14217), (7203, 14238), (7400, 14373), (7560, 14346), (7505, 14334), (7365, 14294), (7291, 14373), (7205, 14344), (7382, 14302), (7183, 14354), (7059, 14362), (7260, 14320), (7280, 14395), (7245, 14389), (7084, 14257), (7285, 14251), (7238, 14399)]
         : compromised: 0.5057, honest: 0.5107
Round 006: test acc mean=0.5082 ± 0.0055 | min=0.4986 max=0.5210
         : test loss mean=1.7273 ± 0.5621
         : individual accs = ['0.504497', '0.503548', '0.502313', '0.507913', '0.511659', '0.509636', '0.509619', '0.519046', '0.501469', '0.507897', '0.503695', '0.509439', '0.510798', '0.521028', '0.506006', '0.512956', '0.498575', '0.505787', '0.503965', '0.513369']
         : correct/total = [(7180, 14232), (7168, 14235), (7166, 14266), (7221, 14217), (7285, 14238), (7325, 14373), (7311, 14346), (7440, 14334), (7168, 14294), (7300, 14373), (7225, 14344), (7286, 14302), (7332, 14354), (7483, 14362), (7246, 14320), (7384, 14395), (7174, 14389), (7211, 14257), (7182, 14251), (7392, 14399)]
         : compromised: 0.5085, honest: 0.5078
Round 007: test acc mean=0.5151 ± 0.0114 | min=0.4919 max=0.5324
         : test loss mean=0.8764 ± 0.1966
         : individual accs = ['0.525927', '0.518651', '0.491939', '0.507069', '0.504355', '0.516454', '0.521539', '0.508232', '0.508465', '0.528630', '0.509690', '0.507412', '0.520064', '0.527016', '0.525908', '0.532407', '0.506151', '0.494985', '0.516385', '0.531217']
         : correct/total = [(7485, 14232), (7383, 14235), (7018, 14266), (7209, 14217), (7181, 14238), (7423, 14373), (7482, 14346), (7285, 14334), (7268, 14294), (7598, 14373), (7311, 14344), (7257, 14302), (7465, 14354), (7569, 14362), (7531, 14320), (7664, 14395), (7283, 14389), (7057, 14257), (7359, 14251), (7649, 14399)]
         : compromised: 0.5151, honest: 0.5151
Round 008: test acc mean=0.5060 ± 0.0042 | min=0.4972 max=0.5136
         : test loss mean=1.3738 ± 0.4300
         : individual accs = ['0.506535', '0.512399', '0.497196', '0.510656', '0.511589', '0.503096', '0.502997', '0.508302', '0.500700', '0.504557', '0.505229', '0.510768', '0.502996', '0.505918', '0.502654', '0.503230', '0.509903', '0.513572', '0.504666', '0.502813']
         : correct/total = [(7209, 14232), (7294, 14235), (7093, 14266), (7260, 14217), (7284, 14238), (7231, 14373), (7216, 14346), (7286, 14334), (7157, 14294), (7252, 14373), (7247, 14344), (7305, 14302), (7220, 14354), (7266, 14362), (7198, 14320), (7244, 14395), (7337, 14389), (7322, 14257), (7192, 14251), (7240, 14399)]
         : compromised: 0.5056, honest: 0.5063
Round 009: test acc mean=0.5219 ± 0.0140 | min=0.4969 max=0.5451
         : test loss mean=0.8727 ± 0.1434
         : individual accs = ['0.521079', '0.519564', '0.512758', '0.507421', '0.524933', '0.538858', '0.542033', '0.520301', '0.536519', '0.508175', '0.501813', '0.511537', '0.502647', '0.532377', '0.535126', '0.524835', '0.545139', '0.496879', '0.521227', '0.535732']
         : correct/total = [(7416, 14232), (7396, 14235), (7315, 14266), (7214, 14217), (7474, 14238), (7745, 14373), (7776, 14346), (7458, 14334), (7669, 14294), (7304, 14373), (7198, 14344), (7316, 14302), (7215, 14354), (7646, 14362), (7663, 14320), (7555, 14395), (7844, 14389), (7084, 14257), (7428, 14251), (7714, 14399)]
         : compromised: 0.5196, honest: 0.5243
Round 010: test acc mean=0.5090 ± 0.0049 | min=0.5008 max=0.5193
         : test loss mean=1.1295 ± 0.3510
         : individual accs = ['0.512366', '0.510011', '0.500771', '0.519308', '0.505478', '0.505044', '0.507249', '0.504325', '0.507975', '0.515828', '0.511991', '0.503286', '0.511216', '0.516572', '0.509637', '0.503022', '0.515185', '0.505366', '0.506280', '0.508438']
         : correct/total = [(7292, 14232), (7260, 14235), (7144, 14266), (7383, 14217), (7197, 14238), (7259, 14373), (7277, 14346), (7229, 14334), (7261, 14294), (7414, 14373), (7344, 14344), (7198, 14302), (7338, 14354), (7419, 14362), (7298, 14320), (7241, 14395), (7413, 14389), (7205, 14257), (7215, 14251), (7321, 14399)]
         : compromised: 0.5071, honest: 0.5108

=== FINAL RESULTS ===
Dataset: sent140, Nodes: 20, Graph: erdos, Aggregation: d-fedavg
Attack: directed_deviation, 50.0% compromised
Final accuracy - Compromised: 0.5071, Honest: 0.5108
Overall test accuracy: mean=0.5090 ± 0.0049
