Device: cuda
Seed: 987654321
Loading 1 LEAF Sent140 train files...
LEAF Sent140 train: 254555 users, 908652 samples
Building vocabulary (max_size=10000)...
Vocabulary size: 10000
Loading 1 LEAF Sent140 test files...
LEAF Sent140 test: 254555 users, 286281 samples
Found 254555 train users, 254555 test users, 254555 common users
User sample counts range: 494 (max) to 1 (min)
Distributed ALL 254555 users across 20 clients
Users per client: 12727 (with 15 clients getting +1 user)
Train partition sizes: [44353, 44290, 44657, 44907, 44696, 45843, 45801, 45619, 45069, 45639, 45821, 45311, 45779, 46056, 45625, 45984, 46428, 44737, 45540, 46497]
Test partition sizes: [14232, 14235, 14266, 14217, 14238, 14373, 14346, 14334, 14294, 14373, 14344, 14302, 14354, 14362, 14320, 14395, 14389, 14257, 14251, 14399]
  Client 0: 44353 train samples, 2 unique classes
  Client 1: 44290 train samples, 2 unique classes
  Client 2: 44657 train samples, 2 unique classes
  Client 3: 44907 train samples, 2 unique classes
  Client 4: 44696 train samples, 2 unique classes
  Client 5: 45843 train samples, 2 unique classes
  Client 6: 45801 train samples, 2 unique classes
  Client 7: 45619 train samples, 2 unique classes
  Client 8: 45069 train samples, 2 unique classes
  Client 9: 45639 train samples, 2 unique classes
  Client 10: 45821 train samples, 2 unique classes
  Client 11: 45311 train samples, 2 unique classes
  Client 12: 45779 train samples, 2 unique classes
  Client 13: 46056 train samples, 2 unique classes
  Client 14: 45625 train samples, 2 unique classes
  Client 15: 45984 train samples, 2 unique classes
  Client 16: 46428 train samples, 2 unique classes
  Client 17: 44737 train samples, 2 unique classes
  Client 18: 45540 train samples, 2 unique classes
  Client 19: 46497 train samples, 2 unique classes
Will sample 4500 samples per client per epoch
Graph: erdos, nodes: 20, edges: 99
Degree statistics: avg=9.90, min=7, max=14
Model variant: baseline
Model parameters: 1,174,986
Sketchguard Node 0:
  Model dim: 1,174,986 → Sketch size: 180
  Compression ratio: 6527.7x
  Using model parameters for aggregation, sketches for filtering
Sketchguard Node 1:
  Model dim: 1,174,986 → Sketch size: 180
  Compression ratio: 6527.7x
  Using model parameters for aggregation, sketches for filtering
Sketchguard Node 2:
  Model dim: 1,174,986 → Sketch size: 180
  Compression ratio: 6527.7x
  Using model parameters for aggregation, sketches for filtering
Sketchguard Node 3:
  Model dim: 1,174,986 → Sketch size: 180
  Compression ratio: 6527.7x
  Using model parameters for aggregation, sketches for filtering
Sketchguard Node 4:
  Model dim: 1,174,986 → Sketch size: 180
  Compression ratio: 6527.7x
  Using model parameters for aggregation, sketches for filtering
Sketchguard Node 5:
  Model dim: 1,174,986 → Sketch size: 180
  Compression ratio: 6527.7x
  Using model parameters for aggregation, sketches for filtering
Sketchguard Node 6:
  Model dim: 1,174,986 → Sketch size: 180
  Compression ratio: 6527.7x
  Using model parameters for aggregation, sketches for filtering
Sketchguard Node 7:
  Model dim: 1,174,986 → Sketch size: 180
  Compression ratio: 6527.7x
  Using model parameters for aggregation, sketches for filtering
Sketchguard Node 8:
  Model dim: 1,174,986 → Sketch size: 180
  Compression ratio: 6527.7x
  Using model parameters for aggregation, sketches for filtering
Sketchguard Node 9:
  Model dim: 1,174,986 → Sketch size: 180
  Compression ratio: 6527.7x
  Using model parameters for aggregation, sketches for filtering
Sketchguard Node 10:
  Model dim: 1,174,986 → Sketch size: 180
  Compression ratio: 6527.7x
  Using model parameters for aggregation, sketches for filtering
Sketchguard Node 11:
  Model dim: 1,174,986 → Sketch size: 180
  Compression ratio: 6527.7x
  Using model parameters for aggregation, sketches for filtering
Sketchguard Node 12:
  Model dim: 1,174,986 → Sketch size: 180
  Compression ratio: 6527.7x
  Using model parameters for aggregation, sketches for filtering
Sketchguard Node 13:
  Model dim: 1,174,986 → Sketch size: 180
  Compression ratio: 6527.7x
  Using model parameters for aggregation, sketches for filtering
Sketchguard Node 14:
  Model dim: 1,174,986 → Sketch size: 180
  Compression ratio: 6527.7x
  Using model parameters for aggregation, sketches for filtering
Sketchguard Node 15:
  Model dim: 1,174,986 → Sketch size: 180
  Compression ratio: 6527.7x
  Using model parameters for aggregation, sketches for filtering
Sketchguard Node 16:
  Model dim: 1,174,986 → Sketch size: 180
  Compression ratio: 6527.7x
  Using model parameters for aggregation, sketches for filtering
Sketchguard Node 17:
  Model dim: 1,174,986 → Sketch size: 180
  Compression ratio: 6527.7x
  Using model parameters for aggregation, sketches for filtering
Sketchguard Node 18:
  Model dim: 1,174,986 → Sketch size: 180
  Compression ratio: 6527.7x
  Using model parameters for aggregation, sketches for filtering
Sketchguard Node 19:
  Model dim: 1,174,986 → Sketch size: 180
  Compression ratio: 6527.7x
  Using model parameters for aggregation, sketches for filtering
Sketchguard ALGORITHM (Sketch-based Filtering + State Aggregation)
  - Model dimension: 1,174,986 parameters
  - Config: SketchguardConfig(gamma=2, kappa=1, alpha=0.5, min_neighbors=1, sketch_size=180, network_seed=987654321, attack_detection_window=5)
  - Sketch size: 180
  - Compression ratio: 6527.7x
  - Complexity: O(d + N×k) = O(1,174,986 + 20×180)
  - Theoretical speedup vs BALANCE: 19.9x
Initial test acc across nodes: mean=0.4953 ± 0.0174
Round 001: test acc mean=0.5665 ± 0.0381 | min=0.5059 max=0.6288
         : test loss mean=0.6898 ± 0.0006
         : individual accs = ['0.548553', '0.587004', '0.517314', '0.505944', '0.606124', '0.565922', '0.628816', '0.618948', '0.572478', '0.554373', '0.522518', '0.567543', '0.612791', '0.554519', '0.516550', '0.575755', '0.523247', '0.602160', '0.532173', '0.618098']
         : correct/total = [(7807, 14232), (8356, 14235), (7380, 14266), (7193, 14217), (8630, 14238), (8134, 14373), (9021, 14346), (8872, 14334), (8183, 14294), (7968, 14373), (7495, 14344), (8117, 14302), (8796, 14354), (7964, 14362), (7397, 14320), (8288, 14395), (7529, 14389), (8585, 14257), (7584, 14251), (8900, 14399)]
         : sketchguard stats = ['Node 0: acc_rate=1.000', 'Node 1: acc_rate=1.000', 'Node 2: acc_rate=1.000']...
Round 002: test acc mean=0.5753 ± 0.0468 | min=0.4925 max=0.6328
         : test loss mean=0.6901 ± 0.0007
         : individual accs = ['0.616006', '0.629786', '0.588532', '0.587114', '0.569181', '0.560217', '0.519657', '0.632761', '0.609836', '0.613581', '0.525376', '0.591735', '0.502856', '0.626236', '0.492528', '0.569781', '0.528598', '0.620537', '0.621079', '0.500174']
         : correct/total = [(8767, 14232), (8965, 14235), (8396, 14266), (8347, 14217), (8104, 14238), (8052, 14373), (7455, 14346), (9070, 14334), (8717, 14294), (8819, 14373), (7536, 14344), (8463, 14302), (7218, 14354), (8994, 14362), (7053, 14320), (8202, 14395), (7606, 14389), (8847, 14257), (8851, 14251), (7202, 14399)]
         : sketchguard stats = ['Node 0: acc_rate=1.000', 'Node 1: acc_rate=1.000', 'Node 2: acc_rate=1.000']...
Round 003: test acc mean=0.5334 ± 0.0381 | min=0.4933 max=0.5943
         : test loss mean=0.6900 ± 0.0008
         : individual accs = ['0.563730', '0.524131', '0.590986', '0.514314', '0.591586', '0.585890', '0.499791', '0.493303', '0.506017', '0.515828', '0.498397', '0.567963', '0.502926', '0.526807', '0.496508', '0.497881', '0.510251', '0.594305', '0.588380', '0.499410']
         : correct/total = [(8023, 14232), (7461, 14235), (8431, 14266), (7312, 14217), (8423, 14238), (8421, 14373), (7170, 14346), (7071, 14334), (7233, 14294), (7414, 14373), (7149, 14344), (8123, 14302), (7219, 14354), (7566, 14362), (7110, 14320), (7167, 14395), (7342, 14389), (8473, 14257), (8385, 14251), (7191, 14399)]
         : sketchguard stats = ['Node 0: acc_rate=1.000', 'Node 1: acc_rate=1.000', 'Node 2: acc_rate=1.000']...
Round 004: test acc mean=0.5546 ± 0.0457 | min=0.4922 max=0.6291
         : test loss mean=0.6882 ± 0.0015
         : individual accs = ['0.550028', '0.629083', '0.492219', '0.507491', '0.506813', '0.628400', '0.553116', '0.506837', '0.584651', '0.604954', '0.498397', '0.558453', '0.503274', '0.609456', '0.504190', '0.527197', '0.585864', '0.563162', '0.612027', '0.565942']
         : correct/total = [(7828, 14232), (8955, 14235), (7022, 14266), (7215, 14217), (7216, 14238), (9032, 14373), (7935, 14346), (7265, 14334), (8357, 14294), (8695, 14373), (7149, 14344), (7987, 14302), (7224, 14354), (8753, 14362), (7220, 14320), (7589, 14395), (8430, 14389), (8029, 14257), (8722, 14251), (8149, 14399)]
         : sketchguard stats = ['Node 0: acc_rate=1.000', 'Node 1: acc_rate=1.000', 'Node 2: acc_rate=1.000']...
Round 005: test acc mean=0.5906 ± 0.0343 | min=0.5171 max=0.6390
         : test loss mean=0.6829 ± 0.0025
         : individual accs = ['0.624087', '0.626695', '0.619164', '0.566575', '0.638994', '0.598970', '0.539035', '0.635761', '0.567931', '0.572949', '0.581428', '0.611593', '0.517068', '0.604303', '0.573464', '0.528031', '0.580235', '0.612120', '0.593993', '0.619487']
         : correct/total = [(8882, 14232), (8921, 14235), (8833, 14266), (8055, 14217), (9098, 14238), (8609, 14373), (7733, 14346), (9113, 14334), (8118, 14294), (8235, 14373), (8340, 14344), (8747, 14302), (7422, 14354), (8679, 14362), (8212, 14320), (7601, 14395), (8349, 14389), (8727, 14257), (8465, 14251), (8920, 14399)]
         : sketchguard stats = ['Node 0: acc_rate=1.000', 'Node 1: acc_rate=1.000', 'Node 2: acc_rate=1.000']...
Round 006: test acc mean=0.6321 ± 0.0134 | min=0.5829 max=0.6468
         : test loss mean=0.6665 ± 0.0042
         : individual accs = ['0.635680', '0.641939', '0.633254', '0.632623', '0.625579', '0.639254', '0.621079', '0.641482', '0.640758', '0.634871', '0.615937', '0.582856', '0.637941', '0.631040', '0.639665', '0.635429', '0.646814', '0.632882', '0.632868', '0.640044']
         : correct/total = [(9047, 14232), (9138, 14235), (9034, 14266), (8994, 14217), (8907, 14238), (9188, 14373), (8910, 14346), (9195, 14334), (9159, 14294), (9125, 14373), (8835, 14344), (8336, 14302), (9157, 14354), (9063, 14362), (9160, 14320), (9147, 14395), (9307, 14389), (9023, 14257), (9019, 14251), (9216, 14399)]
         : sketchguard stats = ['Node 0: acc_rate=1.000', 'Node 1: acc_rate=1.000', 'Node 2: acc_rate=1.000']...
Round 007: test acc mean=0.6327 ± 0.0156 | min=0.5938 max=0.6481
         : test loss mean=0.6485 ± 0.0065
         : individual accs = ['0.639685', '0.644538', '0.633885', '0.634381', '0.648125', '0.646699', '0.634114', '0.611274', '0.646915', '0.641481', '0.626673', '0.604111', '0.645256', '0.593789', '0.643994', '0.614588', '0.639308', '0.642141', '0.617430', '0.645739']
         : correct/total = [(9104, 14232), (9175, 14235), (9043, 14266), (9019, 14217), (9228, 14238), (9295, 14373), (9097, 14346), (8762, 14334), (9247, 14294), (9220, 14373), (8989, 14344), (8640, 14302), (9262, 14354), (8528, 14362), (9222, 14320), (8847, 14395), (9199, 14389), (9155, 14257), (8799, 14251), (9298, 14399)]
         : sketchguard stats = ['Node 0: acc_rate=1.000', 'Node 1: acc_rate=1.000', 'Node 2: acc_rate=1.000']...
Round 008: test acc mean=0.6460 ± 0.0065 | min=0.6334 max=0.6553
         : test loss mean=0.6345 ± 0.0046
         : individual accs = ['0.644885', '0.633368', '0.636338', '0.655061', '0.645034', '0.645307', '0.651192', '0.644691', '0.654960', '0.650247', '0.649331', '0.655293', '0.643793', '0.635636', '0.646648', '0.647794', '0.647370', '0.640668', '0.637710', '0.654907']
         : correct/total = [(9178, 14232), (9016, 14235), (9078, 14266), (9313, 14217), (9184, 14238), (9275, 14373), (9342, 14346), (9241, 14334), (9362, 14294), (9346, 14373), (9314, 14344), (9372, 14302), (9241, 14354), (9129, 14362), (9260, 14320), (9325, 14395), (9315, 14389), (9134, 14257), (9088, 14251), (9430, 14399)]
         : sketchguard stats = ['Node 0: acc_rate=1.000', 'Node 1: acc_rate=1.000', 'Node 2: acc_rate=1.000']...
Round 009: test acc mean=0.6549 ± 0.0095 | min=0.6194 max=0.6641
         : test loss mean=0.6265 ± 0.0064
         : individual accs = ['0.619379', '0.661187', '0.652390', '0.658718', '0.653603', '0.659779', '0.657047', '0.663946', '0.658318', '0.648855', '0.644660', '0.656971', '0.660513', '0.654644', '0.660056', '0.652727', '0.664118', '0.656309', '0.652586', '0.662060']
         : correct/total = [(8815, 14232), (9412, 14235), (9307, 14266), (9365, 14217), (9306, 14238), (9483, 14373), (9426, 14346), (9517, 14334), (9410, 14294), (9326, 14373), (9247, 14344), (9396, 14302), (9481, 14354), (9402, 14362), (9452, 14320), (9396, 14395), (9556, 14389), (9357, 14257), (9300, 14251), (9533, 14399)]
         : sketchguard stats = ['Node 0: acc_rate=1.000', 'Node 1: acc_rate=1.000', 'Node 2: acc_rate=1.000']...
Round 010: test acc mean=0.6628 ± 0.0076 | min=0.6392 max=0.6732
         : test loss mean=0.6185 ± 0.0064
         : individual accs = ['0.660975', '0.667791', '0.639212', '0.668003', '0.669055', '0.667154', '0.668618', '0.673225', '0.665034', '0.655674', '0.663413', '0.666061', '0.671799', '0.660354', '0.665503', '0.659396', '0.667315', '0.657642', '0.655252', '0.655393']
         : correct/total = [(9407, 14232), (9506, 14235), (9119, 14266), (9497, 14217), (9526, 14238), (9589, 14373), (9592, 14346), (9650, 14334), (9506, 14294), (9424, 14373), (9516, 14344), (9526, 14302), (9643, 14354), (9484, 14362), (9530, 14320), (9492, 14395), (9602, 14389), (9376, 14257), (9338, 14251), (9437, 14399)]
         : sketchguard stats = ['Node 0: acc_rate=1.000', 'Node 1: acc_rate=1.000', 'Node 2: acc_rate=1.000']...

=== FINAL RESULTS ===
Dataset: sent140, Nodes: 20, Graph: erdos, Aggregation: sketchguard
Overall test accuracy: mean=0.6628 ± 0.0076

=== Sketchguard SUMMARY ===
Node 0: acceptance=1.000
Node 1: acceptance=1.000
Node 2: acceptance=1.000
Node 3: acceptance=1.000
Node 4: acceptance=1.000
Node 5: acceptance=1.000
Node 6: acceptance=1.000
Node 7: acceptance=1.000
Node 8: acceptance=1.000
Node 9: acceptance=1.000
Node 10: acceptance=1.000
Node 11: acceptance=1.000
Node 12: acceptance=1.000
Node 13: acceptance=1.000
Node 14: acceptance=1.000
Node 15: acceptance=1.000
Node 16: acceptance=1.000
Node 17: acceptance=1.000
Node 18: acceptance=1.000
Node 19: acceptance=1.000

=== PARALLEL EXECUTION TIME (realistic for distributed system) ===
  COMMUNICATION (max across nodes):
    - Sketch transfer: 0.000s (0.0%)
    - Model fetch (accepted): 0.000s (0.0%)
  COMPUTATION (max across nodes):
    - Sketching: 0.507s (94.7%)
    - Filtering: 0.001s (0.2%)
    - Aggregation: 0.027s (5.1%)
  TOTALS:
    - Total computation: 0.535s (100.0%)
    - Total communication: 0.000s (0.0%)
    - Total parallel time: 0.535s

=== PER-NODE AVERAGE TIME ===
  - Sketching: 0.395s
  - Filtering: 0.001s
  - Aggregation: 0.018s
  - Sketch transfer: 0.000s
  - Model fetch: 0.000s
  - Total per node: 0.413s

=== TOTAL COMPUTATIONAL WORK (sum across all nodes) ===
  - Total sketching: 7.897s
  - Total filtering: 0.012s
  - Total aggregation: 0.351s
  - Total sketch transfer: 0.000s
  - Total model fetch: 0.000s
  - Grand total: 8.260s
  - Mean acceptance rate: 1.000

Sketchguard Algorithm Properties:
  - Original dimension: 1,174,986
  - Sketch size: 180
  - Compression ratio: 19.9x
  - Single repetition: No repetitions needed
  - Theoretical complexity: O(d + N×k)
  - Approach: Sketch filtering + state aggregation
