Device: cuda
Seed: 987654321
Loading 1 LEAF Sent140 train files...
LEAF Sent140 train: 254555 users, 908652 samples
Building vocabulary (max_size=10000)...
Vocabulary size: 10000
Loading 1 LEAF Sent140 test files...
LEAF Sent140 test: 254555 users, 286281 samples
Found 254555 train users, 254555 test users, 254555 common users
User sample counts range: 494 (max) to 1 (min)
Distributed ALL 254555 users across 20 clients
Users per client: 12727 (with 15 clients getting +1 user)
Train partition sizes: [44353, 44290, 44657, 44907, 44696, 45843, 45801, 45619, 45069, 45639, 45821, 45311, 45779, 46056, 45625, 45984, 46428, 44737, 45540, 46497]
Test partition sizes: [14232, 14235, 14266, 14217, 14238, 14373, 14346, 14334, 14294, 14373, 14344, 14302, 14354, 14362, 14320, 14395, 14389, 14257, 14251, 14399]
  Client 0: 44353 train samples, 2 unique classes
  Client 1: 44290 train samples, 2 unique classes
  Client 2: 44657 train samples, 2 unique classes
  Client 3: 44907 train samples, 2 unique classes
  Client 4: 44696 train samples, 2 unique classes
  Client 5: 45843 train samples, 2 unique classes
  Client 6: 45801 train samples, 2 unique classes
  Client 7: 45619 train samples, 2 unique classes
  Client 8: 45069 train samples, 2 unique classes
  Client 9: 45639 train samples, 2 unique classes
  Client 10: 45821 train samples, 2 unique classes
  Client 11: 45311 train samples, 2 unique classes
  Client 12: 45779 train samples, 2 unique classes
  Client 13: 46056 train samples, 2 unique classes
  Client 14: 45625 train samples, 2 unique classes
  Client 15: 45984 train samples, 2 unique classes
  Client 16: 46428 train samples, 2 unique classes
  Client 17: 44737 train samples, 2 unique classes
  Client 18: 45540 train samples, 2 unique classes
  Client 19: 46497 train samples, 2 unique classes
Will sample 4500 samples per client per epoch
Graph: fully, nodes: 20, edges: 190
Degree statistics: avg=19.00, min=19, max=19
Attack: Compromised 12/20 nodes: [1, 2, 3, 5, 8, 11, 12, 13, 14, 15, 17, 18]
Attack type: krum, lambda: 1.0
Model variant: baseline
Model parameters: 1,174,986
BALANCE algorithm:
Balance Config: BALANCEConfig(gamma=2, kappa=1, alpha=0.5, min_neighbors=1)
  - Model dimension: 1,174,986 parameters
  - Complexity: O(N×d) = O(20×1,174,986)
Initial test acc across nodes: mean=0.4965 ± 0.0152
Round 001: test acc mean=0.4945 ± 0.0087 | min=0.4740 max=0.5062
         : test loss mean=2.3311 ± 0.6996
         : individual accs = ['0.492482', '0.474043', '0.483948', '0.505170', '0.501405', '0.502052', '0.503764', '0.497768', '0.493004', '0.489320', '0.499721', '0.493777', '0.494705', '0.489347', '0.474441', '0.496909', '0.497463', '0.506207', '0.500526', '0.494757']
         : correct/total = [(7009, 14232), (6748, 14235), (6904, 14266), (7182, 14217), (7139, 14238), (7216, 14373), (7227, 14346), (7135, 14334), (7047, 14294), (7033, 14373), (7168, 14344), (7062, 14302), (7101, 14354), (7028, 14362), (6794, 14320), (7153, 14395), (7158, 14389), (7217, 14257), (7133, 14251), (7124, 14399)]
         : compromised: 0.4928, honest: 0.4971
Round 002: test acc mean=0.5064 ± 0.0080 | min=0.4930 max=0.5229
         : test loss mean=0.7293 ± 0.0244
         : individual accs = ['0.516301', '0.494837', '0.503435', '0.505944', '0.508358', '0.496347', '0.503904', '0.516953', '0.522877', '0.494121', '0.504392', '0.505664', '0.502856', '0.514552', '0.504888', '0.512331', '0.493015', '0.512941', '0.502070', '0.512466']
         : correct/total = [(7348, 14232), (7044, 14235), (7182, 14266), (7193, 14217), (7238, 14238), (7134, 14373), (7229, 14346), (7410, 14334), (7474, 14294), (7102, 14373), (7235, 14344), (7232, 14302), (7218, 14354), (7390, 14362), (7230, 14320), (7375, 14395), (7094, 14389), (7313, 14257), (7155, 14251), (7379, 14399)]
         : compromised: 0.5066, honest: 0.5062
Round 003: test acc mean=0.5065 ± 0.0139 | min=0.4912 max=0.5400
         : test loss mean=0.7038 ± 0.0083
         : individual accs = ['0.509767', '0.504882', '0.494112', '0.504115', '0.505127', '0.498295', '0.513105', '0.503977', '0.495453', '0.495791', '0.491216', '0.493917', '0.527797', '0.525902', '0.496858', '0.539979', '0.508513', '0.498632', '0.491544', '0.531634']
         : correct/total = [(7255, 14232), (7187, 14235), (7049, 14266), (7167, 14217), (7192, 14238), (7162, 14373), (7361, 14346), (7224, 14334), (7082, 14294), (7126, 14373), (7046, 14344), (7064, 14302), (7576, 14354), (7553, 14362), (7115, 14320), (7773, 14395), (7317, 14389), (7109, 14257), (7005, 14251), (7655, 14399)]
         : compromised: 0.5060, honest: 0.5074
Round 004: test acc mean=0.5223 ± 0.0151 | min=0.4938 max=0.5508
         : test loss mean=0.6942 ± 0.0041
         : individual accs = ['0.526560', '0.525395', '0.510655', '0.502497', '0.538137', '0.520072', '0.524746', '0.550788', '0.496082', '0.537536', '0.539947', '0.521186', '0.539780', '0.505501', '0.519693', '0.525808', '0.524150', '0.510065', '0.493790', '0.532815']
         : correct/total = [(7494, 14232), (7479, 14235), (7285, 14266), (7144, 14217), (7662, 14238), (7475, 14373), (7528, 14346), (7895, 14334), (7091, 14294), (7726, 14373), (7745, 14344), (7454, 14302), (7748, 14354), (7260, 14362), (7442, 14320), (7569, 14395), (7542, 14389), (7272, 14257), (7037, 14251), (7672, 14399)]
         : compromised: 0.5142, honest: 0.5343
Round 005: test acc mean=0.5658 ± 0.0102 | min=0.5411 max=0.5825
         : test loss mean=0.6811 ± 0.0032
         : individual accs = ['0.575112', '0.572251', '0.562386', '0.557783', '0.568970', '0.556112', '0.569706', '0.580159', '0.553309', '0.568496', '0.582543', '0.568032', '0.559983', '0.573458', '0.568156', '0.567072', '0.569115', '0.547731', '0.541085', '0.573929']
         : correct/total = [(8185, 14232), (8146, 14235), (8023, 14266), (7930, 14217), (8101, 14238), (7993, 14373), (8173, 14346), (8316, 14334), (7909, 14294), (8171, 14373), (8356, 14344), (8124, 14302), (8038, 14354), (8236, 14362), (8136, 14320), (8163, 14395), (8189, 14389), (7809, 14257), (7711, 14251), (8264, 14399)]
         : compromised: 0.5606, honest: 0.5735
Round 006: test acc mean=0.5858 ± 0.0045 | min=0.5785 max=0.5939
         : test loss mean=0.6730 ± 0.0019
         : individual accs = ['0.586706', '0.587636', '0.587481', '0.580643', '0.589760', '0.580324', '0.593894', '0.591321', '0.579404', '0.587421', '0.589724', '0.586841', '0.584854', '0.591700', '0.587360', '0.580132', '0.584752', '0.579856', '0.578486', '0.587124']
         : correct/total = [(8350, 14232), (8365, 14235), (8381, 14266), (8255, 14217), (8397, 14238), (8341, 14373), (8520, 14346), (8476, 14334), (8282, 14294), (8443, 14373), (8459, 14344), (8393, 14302), (8395, 14354), (8498, 14362), (8411, 14320), (8351, 14395), (8414, 14389), (8267, 14257), (8244, 14251), (8454, 14399)]
         : compromised: 0.5837, honest: 0.5888
Round 007: test acc mean=0.5961 ± 0.0028 | min=0.5920 max=0.6024
         : test loss mean=0.6667 ± 0.0014
         : individual accs = ['0.597948', '0.595012', '0.591967', '0.594640', '0.596362', '0.595422', '0.599679', '0.597042', '0.592556', '0.599527', '0.598996', '0.596420', '0.593841', '0.602423', '0.599581', '0.593678', '0.593022', '0.594234', '0.592730', '0.597750']
         : correct/total = [(8510, 14232), (8470, 14235), (8445, 14266), (8454, 14217), (8491, 14238), (8558, 14373), (8603, 14346), (8558, 14334), (8470, 14294), (8617, 14373), (8592, 14344), (8530, 14302), (8524, 14354), (8652, 14362), (8586, 14320), (8546, 14395), (8533, 14389), (8472, 14257), (8447, 14251), (8607, 14399)]
         : compromised: 0.5952, honest: 0.5975
Round 008: test acc mean=0.6023 ± 0.0032 | min=0.5946 max=0.6078
         : test loss mean=0.6625 ± 0.0018
         : individual accs = ['0.603921', '0.606252', '0.594560', '0.598931', '0.598188', '0.602866', '0.604280', '0.602414', '0.602910', '0.604188', '0.607850', '0.601105', '0.600808', '0.606044', '0.605796', '0.602154', '0.599694', '0.603212', '0.597291', '0.603236']
         : correct/total = [(8595, 14232), (8630, 14235), (8482, 14266), (8515, 14217), (8517, 14238), (8665, 14373), (8669, 14346), (8635, 14334), (8618, 14294), (8684, 14373), (8719, 14344), (8597, 14302), (8624, 14354), (8704, 14362), (8675, 14320), (8668, 14395), (8629, 14389), (8600, 14257), (8512, 14251), (8686, 14399)]
         : compromised: 0.6018, honest: 0.6030
Round 009: test acc mean=0.6074 ± 0.0029 | min=0.6019 max=0.6132
         : test loss mean=0.6586 ± 0.0016
         : individual accs = ['0.610245', '0.609484', '0.603743', '0.606176', '0.605984', '0.609267', '0.613202', '0.609041', '0.604449', '0.608432', '0.609732', '0.607467', '0.601923', '0.611823', '0.604399', '0.606044', '0.605463', '0.607000', '0.604098', '0.609278']
         : correct/total = [(8685, 14232), (8676, 14235), (8613, 14266), (8618, 14217), (8628, 14238), (8757, 14373), (8797, 14346), (8730, 14334), (8640, 14294), (8745, 14373), (8746, 14344), (8688, 14302), (8640, 14354), (8787, 14362), (8655, 14320), (8724, 14395), (8712, 14389), (8654, 14257), (8609, 14251), (8773, 14399)]
         : compromised: 0.6063, honest: 0.6089
Round 010: test acc mean=0.6128 ± 0.0028 | min=0.6071 max=0.6196
         : test loss mean=0.6547 ± 0.0012
         : individual accs = ['0.613266', '0.615104', '0.607108', '0.610888', '0.613288', '0.611702', '0.614387', '0.619576', '0.613334', '0.614625', '0.613776', '0.612432', '0.611189', '0.614121', '0.614874', '0.611740', '0.607130', '0.614154', '0.609220', '0.614418']
         : correct/total = [(8728, 14232), (8756, 14235), (8661, 14266), (8685, 14217), (8732, 14238), (8792, 14373), (8814, 14346), (8881, 14334), (8767, 14294), (8834, 14373), (8804, 14344), (8759, 14302), (8773, 14354), (8820, 14362), (8805, 14320), (8806, 14395), (8736, 14389), (8756, 14257), (8682, 14251), (8847, 14399)]
         : compromised: 0.6122, honest: 0.6138

=== FINAL RESULTS ===
Dataset: sent140, Nodes: 20, Graph: fully, Aggregation: balance
Attack: krum, 60.0% compromised
Final accuracy - Compromised: 0.6122, Honest: 0.6138
Overall test accuracy: mean=0.6128 ± 0.0028

=== BALANCE SUMMARY ===
Node 0: acceptance=0.432
Node 1: acceptance=0.479
Node 2: acceptance=0.479
Node 3: acceptance=0.479
Node 4: acceptance=0.432
Node 5: acceptance=0.479
Node 6: acceptance=0.432
Node 7: acceptance=0.432
Node 8: acceptance=0.479
Node 9: acceptance=0.432
Node 10: acceptance=0.432
Node 11: acceptance=0.479
Node 12: acceptance=0.479
Node 13: acceptance=0.479
Node 14: acceptance=0.479
Node 15: acceptance=0.479
Node 16: acceptance=0.432
Node 17: acceptance=0.479
Node 18: acceptance=0.479
Node 19: acceptance=0.432

=== PARALLEL EXECUTION TIME (realistic for distributed system) ===
  COMMUNICATION (max across nodes):
    - Full model transfer: 0.000s (0.0%)
  COMPUTATION (max across nodes):
    - Filtering: 0.086s (85.8%)
    - Aggregation: 0.014s (14.2%)
  TOTALS:
    - Total computation: 0.100s (100.0%)
    - Total communication: 0.000s (0.0%)
    - Total parallel time: 0.100s

=== PER-NODE AVERAGE TIME ===
  - Filtering: 0.080s
  - Aggregation: 0.009s
  - Model transfer: 0.000s
  - Total per node: 0.089s

=== TOTAL COMPUTATIONAL WORK (sum across all nodes) ===
  - Total filtering: 1.592s
  - Total aggregation: 0.179s
  - Total model transfer: 0.000s
  - Grand total: 1.772s
  - Mean acceptance rate: 0.460

BALANCE Algorithm Properties:
  - Model dimension: 1,174,986
  - No compression: Full parameter comparison
  - Theoretical complexity: O(deg(i)×d)
  - Approach: Full parameter filtering + averaging
