Device: cuda
Seed: 987654321
Loading 1 LEAF Sent140 train files...
LEAF Sent140 train: 254555 users, 908652 samples
Building vocabulary (max_size=10000)...
Vocabulary size: 10000
Loading 1 LEAF Sent140 test files...
LEAF Sent140 test: 254555 users, 286281 samples
Found 254555 train users, 254555 test users, 254555 common users
User sample counts range: 494 (max) to 1 (min)
Distributed ALL 254555 users across 20 clients
Users per client: 12727 (with 15 clients getting +1 user)
Train partition sizes: [44353, 44290, 44657, 44907, 44696, 45843, 45801, 45619, 45069, 45639, 45821, 45311, 45779, 46056, 45625, 45984, 46428, 44737, 45540, 46497]
Test partition sizes: [14232, 14235, 14266, 14217, 14238, 14373, 14346, 14334, 14294, 14373, 14344, 14302, 14354, 14362, 14320, 14395, 14389, 14257, 14251, 14399]
  Client 0: 44353 train samples, 2 unique classes
  Client 1: 44290 train samples, 2 unique classes
  Client 2: 44657 train samples, 2 unique classes
  Client 3: 44907 train samples, 2 unique classes
  Client 4: 44696 train samples, 2 unique classes
  Client 5: 45843 train samples, 2 unique classes
  Client 6: 45801 train samples, 2 unique classes
  Client 7: 45619 train samples, 2 unique classes
  Client 8: 45069 train samples, 2 unique classes
  Client 9: 45639 train samples, 2 unique classes
  Client 10: 45821 train samples, 2 unique classes
  Client 11: 45311 train samples, 2 unique classes
  Client 12: 45779 train samples, 2 unique classes
  Client 13: 46056 train samples, 2 unique classes
  Client 14: 45625 train samples, 2 unique classes
  Client 15: 45984 train samples, 2 unique classes
  Client 16: 46428 train samples, 2 unique classes
  Client 17: 44737 train samples, 2 unique classes
  Client 18: 45540 train samples, 2 unique classes
  Client 19: 46497 train samples, 2 unique classes
Will sample 4500 samples per client per epoch
Graph: fully, nodes: 20, edges: 190
Degree statistics: avg=19.00, min=19, max=19
Attack: Compromised 4/20 nodes: [5, 12, 13, 17]
Attack type: directed_deviation, lambda: 1.0
Model variant: baseline
Model parameters: 1,174,986
Initial test acc across nodes: mean=0.4953 ± 0.0174
Round 001: test acc mean=0.4984 ± 0.0063 | min=0.4842 max=0.5086
         : test loss mean=1.0910 ± 0.2320
         : individual accs = ['0.503373', '0.489498', '0.484158', '0.489273', '0.491150', '0.505740', '0.499094', '0.498186', '0.497272', '0.499269', '0.501673', '0.490071', '0.496099', '0.508564', '0.501746', '0.501494', '0.503788', '0.499053', '0.503123', '0.504618']
         : correct/total = [(7164, 14232), (6968, 14235), (6907, 14266), (6956, 14217), (6993, 14238), (7269, 14373), (7160, 14346), (7141, 14334), (7108, 14294), (7176, 14373), (7196, 14344), (7009, 14302), (7121, 14354), (7304, 14362), (7185, 14320), (7219, 14395), (7249, 14389), (7115, 14257), (7170, 14251), (7266, 14399)]
         : compromised: 0.5024, honest: 0.4974
Round 002: test acc mean=0.4857 ± 0.0055 | min=0.4769 max=0.4955
         : test loss mean=0.9820 ± 0.0084
         : individual accs = ['0.484472', '0.483246', '0.483247', '0.481396', '0.479281', '0.492312', '0.478182', '0.488280', '0.478173', '0.484589', '0.484314', '0.476856', '0.482932', '0.483986', '0.488338', '0.495033', '0.495517', '0.492811', '0.490001', '0.490867']
         : correct/total = [(6895, 14232), (6879, 14235), (6894, 14266), (6844, 14217), (6824, 14238), (7076, 14373), (6860, 14346), (6999, 14334), (6835, 14294), (6965, 14373), (6947, 14344), (6820, 14302), (6932, 14354), (6951, 14362), (6993, 14320), (7126, 14395), (7130, 14389), (7026, 14257), (6983, 14251), (7068, 14399)]
         : compromised: 0.4880, honest: 0.4851
Round 003: test acc mean=0.4957 ± 0.0035 | min=0.4861 max=0.5021
         : test loss mean=0.6936 ± 0.0002
         : individual accs = ['0.491920', '0.486126', '0.491799', '0.492861', '0.498174', '0.497252', '0.498118', '0.496093', '0.495593', '0.498435', '0.498048', '0.493987', '0.500139', '0.502089', '0.491341', '0.496214', '0.495517', '0.495546', '0.496597', '0.497535']
         : correct/total = [(7001, 14232), (6920, 14235), (7016, 14266), (7007, 14217), (7093, 14238), (7147, 14373), (7146, 14346), (7111, 14334), (7084, 14294), (7164, 14373), (7144, 14344), (7065, 14302), (7179, 14354), (7211, 14362), (7036, 14320), (7143, 14395), (7130, 14389), (7065, 14257), (7077, 14251), (7164, 14399)]
         : compromised: 0.4988, honest: 0.4949
Round 004: test acc mean=0.5129 ± 0.0058 | min=0.5007 max=0.5261
         : test loss mean=0.7156 ± 0.0028
         : individual accs = ['0.508080', '0.500738', '0.504486', '0.504396', '0.515873', '0.512419', '0.520284', '0.514302', '0.515601', '0.512558', '0.515128', '0.509789', '0.514491', '0.526111', '0.509288', '0.516499', '0.516158', '0.517781', '0.507894', '0.516911']
         : correct/total = [(7231, 14232), (7128, 14235), (7197, 14266), (7171, 14217), (7345, 14238), (7365, 14373), (7464, 14346), (7372, 14334), (7370, 14294), (7367, 14373), (7389, 14344), (7291, 14302), (7385, 14354), (7556, 14362), (7293, 14320), (7435, 14395), (7427, 14389), (7382, 14257), (7238, 14251), (7443, 14399)]
         : compromised: 0.5177, honest: 0.5117
Round 005: test acc mean=0.6146 ± 0.0037 | min=0.6033 max=0.6197
         : test loss mean=0.6613 ± 0.0017
         : individual accs = ['0.610736', '0.615244', '0.603252', '0.612576', '0.618626', '0.615668', '0.614806', '0.616018', '0.614873', '0.618173', '0.610081', '0.611243', '0.615020', '0.614817', '0.619693', '0.614033', '0.618528', '0.613944', '0.614553', '0.619487']
         : correct/total = [(8692, 14232), (8758, 14235), (8606, 14266), (8709, 14217), (8808, 14238), (8849, 14373), (8820, 14346), (8830, 14334), (8789, 14294), (8885, 14373), (8751, 14344), (8742, 14302), (8828, 14354), (8830, 14362), (8874, 14320), (8839, 14395), (8900, 14389), (8753, 14257), (8758, 14251), (8920, 14399)]
         : compromised: 0.6149, honest: 0.6145
Round 006: test acc mean=0.5788 ± 0.0035 | min=0.5725 max=0.5864
         : test loss mean=0.6784 ± 0.0011
         : individual accs = ['0.572934', '0.582157', '0.582013', '0.582472', '0.580489', '0.578028', '0.573888', '0.579461', '0.576606', '0.580742', '0.572504', '0.575654', '0.580326', '0.577914', '0.579679', '0.578326', '0.583710', '0.576699', '0.576872', '0.586430']
         : correct/total = [(8154, 14232), (8287, 14235), (8303, 14266), (8281, 14217), (8265, 14238), (8308, 14373), (8233, 14346), (8306, 14334), (8242, 14294), (8347, 14373), (8212, 14344), (8233, 14302), (8330, 14354), (8300, 14362), (8301, 14320), (8325, 14395), (8399, 14389), (8222, 14257), (8221, 14251), (8444, 14399)]
         : compromised: 0.5782, honest: 0.5790
Round 007: test acc mean=0.6314 ± 0.0038 | min=0.6239 max=0.6390
         : test loss mean=0.6441 ± 0.0019
         : individual accs = ['0.629146', '0.633790', '0.623931', '0.631005', '0.632322', '0.632158', '0.629792', '0.637715', '0.635162', '0.631601', '0.625976', '0.632709', '0.631949', '0.627977', '0.639036', '0.626120', '0.635833', '0.629165', '0.629008', '0.634558']
         : correct/total = [(8954, 14232), (9022, 14235), (8901, 14266), (8971, 14217), (9003, 14238), (9086, 14373), (9035, 14346), (9141, 14334), (9079, 14294), (9078, 14373), (8979, 14344), (9049, 14302), (9071, 14354), (9019, 14362), (9151, 14320), (9013, 14395), (9149, 14389), (8970, 14257), (8964, 14251), (9137, 14399)]
         : compromised: 0.6303, honest: 0.6317
Round 008: test acc mean=0.6102 ± 0.0038 | min=0.6037 max=0.6193
         : test loss mean=0.6579 ± 0.0017
         : individual accs = ['0.604202', '0.611521', '0.608159', '0.613210', '0.619329', '0.608572', '0.611529', '0.612948', '0.612425', '0.608989', '0.604922', '0.609495', '0.612373', '0.608411', '0.612291', '0.610976', '0.613385', '0.604826', '0.603747', '0.612820']
         : correct/total = [(8599, 14232), (8705, 14235), (8676, 14266), (8718, 14217), (8818, 14238), (8747, 14373), (8773, 14346), (8786, 14334), (8754, 14294), (8753, 14373), (8677, 14344), (8717, 14302), (8790, 14354), (8738, 14362), (8768, 14320), (8795, 14395), (8826, 14389), (8623, 14257), (8604, 14251), (8824, 14399)]
         : compromised: 0.6085, honest: 0.6106
Round 009: test acc mean=0.6368 ± 0.0043 | min=0.6296 max=0.6441
         : test loss mean=0.6383 ± 0.0024
         : individual accs = ['0.635048', '0.639059', '0.629609', '0.631357', '0.636185', '0.639045', '0.633835', '0.643993', '0.642367', '0.635636', '0.631972', '0.640330', '0.634527', '0.640022', '0.644064', '0.632789', '0.635068', '0.637301', '0.631745', '0.642822']
         : correct/total = [(9038, 14232), (9097, 14235), (8982, 14266), (8976, 14217), (9058, 14238), (9185, 14373), (9093, 14346), (9231, 14334), (9182, 14294), (9136, 14373), (9065, 14344), (9158, 14302), (9108, 14354), (9192, 14362), (9223, 14320), (9109, 14395), (9138, 14389), (9086, 14257), (9003, 14251), (9256, 14399)]
         : compromised: 0.6377, honest: 0.6366
Round 010: test acc mean=0.6256 ± 0.0039 | min=0.6191 max=0.6312
         : test loss mean=0.6462 ± 0.0018
         : individual accs = ['0.619098', '0.628100', '0.620356', '0.629458', '0.630917', '0.621513', '0.628189', '0.631226', '0.630194', '0.626313', '0.620120', '0.626835', '0.625888', '0.624008', '0.625209', '0.628135', '0.630065', '0.621589', '0.619676', '0.625113']
         : correct/total = [(8811, 14232), (8941, 14235), (8850, 14266), (8949, 14217), (8983, 14238), (8933, 14373), (9012, 14346), (9048, 14334), (9008, 14294), (9002, 14373), (8895, 14344), (8965, 14302), (8984, 14354), (8962, 14362), (8953, 14320), (9042, 14395), (9066, 14389), (8862, 14257), (8831, 14251), (9001, 14399)]
         : compromised: 0.6232, honest: 0.6262

=== FINAL RESULTS ===
Dataset: sent140, Nodes: 20, Graph: fully, Aggregation: d-fedavg
Attack: directed_deviation, 20.0% compromised
Final accuracy - Compromised: 0.6232, Honest: 0.6262
Overall test accuracy: mean=0.6256 ± 0.0039
