Device: cuda
Seed: 987654321
Loading 1 LEAF Sent140 train files...
LEAF Sent140 train: 254555 users, 908652 samples
Building vocabulary (max_size=10000)...
Vocabulary size: 10000
Loading 1 LEAF Sent140 test files...
LEAF Sent140 test: 254555 users, 286281 samples
Found 254555 train users, 254555 test users, 254555 common users
User sample counts range: 494 (max) to 1 (min)
Distributed ALL 254555 users across 20 clients
Users per client: 12727 (with 15 clients getting +1 user)
Train partition sizes: [44353, 44290, 44657, 44907, 44696, 45843, 45801, 45619, 45069, 45639, 45821, 45311, 45779, 46056, 45625, 45984, 46428, 44737, 45540, 46497]
Test partition sizes: [14232, 14235, 14266, 14217, 14238, 14373, 14346, 14334, 14294, 14373, 14344, 14302, 14354, 14362, 14320, 14395, 14389, 14257, 14251, 14399]
  Client 0: 44353 train samples, 2 unique classes
  Client 1: 44290 train samples, 2 unique classes
  Client 2: 44657 train samples, 2 unique classes
  Client 3: 44907 train samples, 2 unique classes
  Client 4: 44696 train samples, 2 unique classes
  Client 5: 45843 train samples, 2 unique classes
  Client 6: 45801 train samples, 2 unique classes
  Client 7: 45619 train samples, 2 unique classes
  Client 8: 45069 train samples, 2 unique classes
  Client 9: 45639 train samples, 2 unique classes
  Client 10: 45821 train samples, 2 unique classes
  Client 11: 45311 train samples, 2 unique classes
  Client 12: 45779 train samples, 2 unique classes
  Client 13: 46056 train samples, 2 unique classes
  Client 14: 45625 train samples, 2 unique classes
  Client 15: 45984 train samples, 2 unique classes
  Client 16: 46428 train samples, 2 unique classes
  Client 17: 44737 train samples, 2 unique classes
  Client 18: 45540 train samples, 2 unique classes
  Client 19: 46497 train samples, 2 unique classes
Will sample 4500 samples per client per epoch
Graph: ring, nodes: 20, edges: 20
Degree statistics: avg=2.00, min=2, max=2
Attack: Compromised 16/20 nodes: [1, 2, 3, 5, 6, 8, 9, 10, 11, 12, 13, 14, 15, 17, 18, 19]
Attack type: directed_deviation, lambda: 1.0
Model variant: baseline
Model parameters: 1,174,986
Initial test acc across nodes: mean=0.4953 ± 0.0174
Round 001: test acc mean=0.5011 ± 0.0067 | min=0.4882 max=0.5128
         : test loss mean=15.3335 ± 6.5754
         : individual accs = ['0.508994', '0.508254', '0.488224', '0.505662', '0.500913', '0.500522', '0.501464', '0.492884', '0.512523', '0.512767', '0.495887', '0.504755', '0.502926', '0.497493', '0.494483', '0.495311', '0.507610', '0.493933', '0.494281', '0.502257']
         : correct/total = [(7244, 14232), (7235, 14235), (6965, 14266), (7189, 14217), (7132, 14238), (7194, 14373), (7194, 14346), (7065, 14334), (7326, 14294), (7370, 14373), (7113, 14344), (7219, 14302), (7219, 14354), (7145, 14362), (7081, 14320), (7130, 14395), (7304, 14389), (7042, 14257), (7044, 14251), (7232, 14399)]
         : compromised: 0.5007, honest: 0.5026
Round 002: test acc mean=0.5024 ± 0.0059 | min=0.4904 max=0.5120
         : test loss mean=14.2629 ± 5.4547
         : individual accs = ['0.503935', '0.509308', '0.511987', '0.509742', '0.501826', '0.501565', '0.499791', '0.509069', '0.503918', '0.504905', '0.501325', '0.505664', '0.498885', '0.492898', '0.507542', '0.502119', '0.492599', '0.490426', '0.505579', '0.495729']
         : correct/total = [(7172, 14232), (7250, 14235), (7304, 14266), (7247, 14217), (7145, 14238), (7209, 14373), (7170, 14346), (7297, 14334), (7203, 14294), (7257, 14373), (7191, 14344), (7232, 14302), (7161, 14354), (7079, 14362), (7268, 14320), (7228, 14395), (7088, 14389), (6992, 14257), (7205, 14251), (7138, 14399)]
         : compromised: 0.5026, honest: 0.5019
Round 003: test acc mean=0.5009 ± 0.0115 | min=0.4833 max=0.5206
         : test loss mean=2.9073 ± 1.5668
         : individual accs = ['0.492763', '0.483316', '0.517104', '0.520644', '0.509763', '0.509219', '0.492541', '0.483466', '0.494263', '0.511028', '0.506484', '0.514474', '0.500975', '0.501253', '0.509358', '0.485655', '0.484606', '0.493021', '0.509999', '0.497882']
         : correct/total = [(7013, 14232), (6880, 14235), (7377, 14266), (7402, 14217), (7258, 14238), (7319, 14373), (7066, 14346), (6930, 14334), (7065, 14294), (7345, 14373), (7265, 14344), (7358, 14302), (7191, 14354), (7199, 14362), (7294, 14320), (6991, 14395), (6973, 14389), (7029, 14257), (7268, 14251), (7169, 14399)]
         : compromised: 0.5030, honest: 0.4926
Round 004: test acc mean=0.5039 ± 0.0053 | min=0.4939 max=0.5191
         : test loss mean=4.0389 ± 2.7773
         : individual accs = ['0.506324', '0.519143', '0.512898', '0.501301', '0.501334', '0.507062', '0.502440', '0.503279', '0.503638', '0.503931', '0.502928', '0.505174', '0.496238', '0.493942', '0.507263', '0.501355', '0.499548', '0.499193', '0.505087', '0.505105']
         : correct/total = [(7206, 14232), (7390, 14235), (7317, 14266), (7127, 14217), (7138, 14238), (7288, 14373), (7208, 14346), (7214, 14334), (7199, 14294), (7243, 14373), (7214, 14344), (7225, 14302), (7123, 14354), (7094, 14362), (7264, 14320), (7217, 14395), (7188, 14389), (7117, 14257), (7198, 14251), (7273, 14399)]
         : compromised: 0.5042, honest: 0.5026
Round 005: test acc mean=0.5043 ± 0.0095 | min=0.4900 max=0.5192
         : test loss mean=1.3403 ± 0.5280
         : individual accs = ['0.502038', '0.495890', '0.519207', '0.515932', '0.502388', '0.505879', '0.499442', '0.494279', '0.491745', '0.518890', '0.507738', '0.514194', '0.508499', '0.504038', '0.516620', '0.493644', '0.489958', '0.497440', '0.514420', '0.493854']
         : correct/total = [(7145, 14232), (7059, 14235), (7407, 14266), (7335, 14217), (7153, 14238), (7271, 14373), (7165, 14346), (7085, 14334), (7029, 14294), (7458, 14373), (7283, 14344), (7354, 14302), (7299, 14354), (7239, 14362), (7398, 14320), (7106, 14395), (7050, 14389), (7092, 14257), (7331, 14251), (7111, 14399)]
         : compromised: 0.5061, honest: 0.4972
Round 006: test acc mean=0.5031 ± 0.0056 | min=0.4918 max=0.5152
         : test loss mean=2.2569 ± 1.5853
         : individual accs = ['0.503232', '0.506287', '0.508201', '0.515228', '0.502037', '0.503792', '0.497351', '0.496791', '0.500000', '0.506366', '0.502858', '0.509090', '0.497840', '0.491784', '0.506425', '0.499757', '0.499687', '0.497300', '0.505508', '0.512119']
         : correct/total = [(7162, 14232), (7207, 14235), (7250, 14266), (7325, 14217), (7148, 14238), (7241, 14373), (7135, 14346), (7121, 14334), (7147, 14294), (7278, 14373), (7213, 14344), (7281, 14302), (7146, 14354), (7063, 14362), (7252, 14320), (7194, 14395), (7190, 14389), (7090, 14257), (7204, 14251), (7374, 14399)]
         : compromised: 0.5037, honest: 0.5004
Round 007: test acc mean=0.5015 ± 0.0081 | min=0.4825 max=0.5117
         : test loss mean=1.4491 ± 0.7974
         : individual accs = ['0.482504', '0.488444', '0.511215', '0.510867', '0.497893', '0.494469', '0.503555', '0.504325', '0.507626', '0.507966', '0.508993', '0.511677', '0.500766', '0.502298', '0.509008', '0.498715', '0.492877', '0.496107', '0.507473', '0.493229']
         : correct/total = [(6867, 14232), (6953, 14235), (7293, 14266), (7263, 14217), (7089, 14238), (7107, 14373), (7224, 14346), (7229, 14334), (7256, 14294), (7301, 14373), (7301, 14344), (7318, 14302), (7188, 14354), (7214, 14362), (7289, 14320), (7179, 14395), (7092, 14389), (7073, 14257), (7232, 14251), (7102, 14399)]
         : compromised: 0.5033, honest: 0.4944
Round 008: test acc mean=0.5038 ± 0.0087 | min=0.4874 max=0.5198
         : test loss mean=2.8775 ± 2.5920
         : individual accs = ['0.502108', '0.517035', '0.511215', '0.493775', '0.491080', '0.487442', '0.519796', '0.516604', '0.516440', '0.505601', '0.503137', '0.502377', '0.497771', '0.496310', '0.508031', '0.499548', '0.501911', '0.501789', '0.505438', '0.498924']
         : correct/total = [(7146, 14232), (7360, 14235), (7293, 14266), (7020, 14217), (6992, 14238), (7006, 14373), (7457, 14346), (7405, 14334), (7382, 14294), (7267, 14373), (7217, 14344), (7185, 14302), (7145, 14354), (7128, 14362), (7275, 14320), (7191, 14395), (7222, 14389), (7154, 14257), (7203, 14251), (7184, 14399)]
         : compromised: 0.5040, honest: 0.5029
Round 009: test acc mean=0.5011 ± 0.0083 | min=0.4907 max=0.5166
         : test loss mean=1.3717 ± 0.7969
         : individual accs = ['0.513912', '0.516614', '0.490677', '0.510234', '0.513064', '0.509149', '0.503346', '0.501605', '0.501049', '0.490781', '0.493238', '0.497623', '0.497701', '0.490739', '0.500349', '0.497812', '0.492321', '0.495406', '0.494562', '0.510938']
         : correct/total = [(7314, 14232), (7354, 14235), (7000, 14266), (7254, 14217), (7305, 14238), (7318, 14373), (7221, 14346), (7190, 14334), (7162, 14294), (7054, 14373), (7075, 14344), (7117, 14302), (7144, 14354), (7048, 14362), (7165, 14320), (7166, 14395), (7084, 14389), (7063, 14257), (7048, 14251), (7357, 14399)]
         : compromised: 0.5000, honest: 0.5052
Round 010: test acc mean=0.5068 ± 0.0087 | min=0.4872 max=0.5208
         : test loss mean=1.7955 ± 1.3060
         : individual accs = ['0.508994', '0.520759', '0.518996', '0.507280', '0.512502', '0.500661', '0.495748', '0.500977', '0.502798', '0.511236', '0.504532', '0.518039', '0.508430', '0.511837', '0.514455', '0.496492', '0.487178', '0.493863', '0.508666', '0.512466']
         : correct/total = [(7244, 14232), (7413, 14235), (7404, 14266), (7212, 14217), (7297, 14238), (7196, 14373), (7112, 14346), (7181, 14334), (7187, 14294), (7348, 14373), (7237, 14344), (7409, 14302), (7298, 14354), (7351, 14362), (7367, 14320), (7147, 14395), (7010, 14389), (7041, 14257), (7249, 14251), (7379, 14399)]
         : compromised: 0.5079, honest: 0.5024

=== FINAL RESULTS ===
Dataset: sent140, Nodes: 20, Graph: ring, Aggregation: d-fedavg
Attack: directed_deviation, 80.0% compromised
Final accuracy - Compromised: 0.5079, Honest: 0.5024
Overall test accuracy: mean=0.5068 ± 0.0087
