Device: cuda
Seed: 987654321
Loading 1 LEAF Sent140 train files...
LEAF Sent140 train: 254555 users, 908652 samples
Building vocabulary (max_size=10000)...
Vocabulary size: 10000
Loading 1 LEAF Sent140 test files...
LEAF Sent140 test: 254555 users, 286281 samples
Found 254555 train users, 254555 test users, 254555 common users
User sample counts range: 494 (max) to 1 (min)
Distributed ALL 254555 users across 20 clients
Users per client: 12727 (with 15 clients getting +1 user)
Train partition sizes: [44353, 44290, 44657, 44907, 44696, 45843, 45801, 45619, 45069, 45639, 45821, 45311, 45779, 46056, 45625, 45984, 46428, 44737, 45540, 46497]
Test partition sizes: [14232, 14235, 14266, 14217, 14238, 14373, 14346, 14334, 14294, 14373, 14344, 14302, 14354, 14362, 14320, 14395, 14389, 14257, 14251, 14399]
  Client 0: 44353 train samples, 2 unique classes
  Client 1: 44290 train samples, 2 unique classes
  Client 2: 44657 train samples, 2 unique classes
  Client 3: 44907 train samples, 2 unique classes
  Client 4: 44696 train samples, 2 unique classes
  Client 5: 45843 train samples, 2 unique classes
  Client 6: 45801 train samples, 2 unique classes
  Client 7: 45619 train samples, 2 unique classes
  Client 8: 45069 train samples, 2 unique classes
  Client 9: 45639 train samples, 2 unique classes
  Client 10: 45821 train samples, 2 unique classes
  Client 11: 45311 train samples, 2 unique classes
  Client 12: 45779 train samples, 2 unique classes
  Client 13: 46056 train samples, 2 unique classes
  Client 14: 45625 train samples, 2 unique classes
  Client 15: 45984 train samples, 2 unique classes
  Client 16: 46428 train samples, 2 unique classes
  Client 17: 44737 train samples, 2 unique classes
  Client 18: 45540 train samples, 2 unique classes
  Client 19: 46497 train samples, 2 unique classes
Will sample 4500 samples per client per epoch
Graph: ring, nodes: 20, edges: 20
Degree statistics: avg=2.00, min=2, max=2
Attack: Compromised 8/20 nodes: [1, 5, 11, 12, 13, 14, 17, 18]
Attack type: gaussian, lambda: 1.0
Model variant: baseline
Model parameters: 1,174,986
Sketchguard Node 0:
  Model dim: 1,174,986 → Sketch size: 180
  Compression ratio: 6527.7x
  Using model parameters for aggregation, sketches for filtering
Sketchguard Node 1:
  Model dim: 1,174,986 → Sketch size: 180
  Compression ratio: 6527.7x
  Using model parameters for aggregation, sketches for filtering
Sketchguard Node 2:
  Model dim: 1,174,986 → Sketch size: 180
  Compression ratio: 6527.7x
  Using model parameters for aggregation, sketches for filtering
Sketchguard Node 3:
  Model dim: 1,174,986 → Sketch size: 180
  Compression ratio: 6527.7x
  Using model parameters for aggregation, sketches for filtering
Sketchguard Node 4:
  Model dim: 1,174,986 → Sketch size: 180
  Compression ratio: 6527.7x
  Using model parameters for aggregation, sketches for filtering
Sketchguard Node 5:
  Model dim: 1,174,986 → Sketch size: 180
  Compression ratio: 6527.7x
  Using model parameters for aggregation, sketches for filtering
Sketchguard Node 6:
  Model dim: 1,174,986 → Sketch size: 180
  Compression ratio: 6527.7x
  Using model parameters for aggregation, sketches for filtering
Sketchguard Node 7:
  Model dim: 1,174,986 → Sketch size: 180
  Compression ratio: 6527.7x
  Using model parameters for aggregation, sketches for filtering
Sketchguard Node 8:
  Model dim: 1,174,986 → Sketch size: 180
  Compression ratio: 6527.7x
  Using model parameters for aggregation, sketches for filtering
Sketchguard Node 9:
  Model dim: 1,174,986 → Sketch size: 180
  Compression ratio: 6527.7x
  Using model parameters for aggregation, sketches for filtering
Sketchguard Node 10:
  Model dim: 1,174,986 → Sketch size: 180
  Compression ratio: 6527.7x
  Using model parameters for aggregation, sketches for filtering
Sketchguard Node 11:
  Model dim: 1,174,986 → Sketch size: 180
  Compression ratio: 6527.7x
  Using model parameters for aggregation, sketches for filtering
Sketchguard Node 12:
  Model dim: 1,174,986 → Sketch size: 180
  Compression ratio: 6527.7x
  Using model parameters for aggregation, sketches for filtering
Sketchguard Node 13:
  Model dim: 1,174,986 → Sketch size: 180
  Compression ratio: 6527.7x
  Using model parameters for aggregation, sketches for filtering
Sketchguard Node 14:
  Model dim: 1,174,986 → Sketch size: 180
  Compression ratio: 6527.7x
  Using model parameters for aggregation, sketches for filtering
Sketchguard Node 15:
  Model dim: 1,174,986 → Sketch size: 180
  Compression ratio: 6527.7x
  Using model parameters for aggregation, sketches for filtering
Sketchguard Node 16:
  Model dim: 1,174,986 → Sketch size: 180
  Compression ratio: 6527.7x
  Using model parameters for aggregation, sketches for filtering
Sketchguard Node 17:
  Model dim: 1,174,986 → Sketch size: 180
  Compression ratio: 6527.7x
  Using model parameters for aggregation, sketches for filtering
Sketchguard Node 18:
  Model dim: 1,174,986 → Sketch size: 180
  Compression ratio: 6527.7x
  Using model parameters for aggregation, sketches for filtering
Sketchguard Node 19:
  Model dim: 1,174,986 → Sketch size: 180
  Compression ratio: 6527.7x
  Using model parameters for aggregation, sketches for filtering
Sketchguard ALGORITHM (Sketch-based Filtering + State Aggregation)
  - Model dimension: 1,174,986 parameters
  - Config: SketchguardConfig(gamma=2, kappa=1, alpha=0.5, min_neighbors=1, sketch_size=180, network_seed=987654321, attack_detection_window=5)
  - Sketch size: 180
  - Compression ratio: 6527.7x
  - Complexity: O(d + N×k) = O(1,174,986 + 20×180)
  - Theoretical speedup vs BALANCE: 19.9x
Initial test acc across nodes: mean=0.4953 ± 0.0174
Round 001: test acc mean=0.5494 ± 0.0348 | min=0.4917 max=0.6236
         : test loss mean=160.1083 ± 479.3851
         : individual accs = ['0.583263', '0.623604', '0.545142', '0.566575', '0.566021', '0.508592', '0.590687', '0.576531', '0.501189', '0.572254', '0.545176', '0.516291', '0.492755', '0.491714', '0.529050', '0.546440', '0.558621', '0.561408', '0.528594', '0.584902']
         : correct/total = [(8301, 14232), (8877, 14235), (7777, 14266), (8055, 14217), (8059, 14238), (7310, 14373), (8474, 14346), (8264, 14334), (7164, 14294), (8225, 14373), (7820, 14344), (7384, 14302), (7073, 14354), (7062, 14362), (7576, 14320), (7866, 14395), (8038, 14389), (8004, 14257), (7533, 14251), (8422, 14399)]
         : compromised: 0.5315, honest: 0.5614
         : sketchguard stats = ['Node 0: acc_rate=0.500', 'Node 1: acc_rate=1.000', 'Node 2: acc_rate=0.500']...
Round 002: test acc mean=0.6142 ± 0.0410 | min=0.4877 max=0.6426
         : test loss mean=49.9828 ± 149.2561
         : individual accs = ['0.639755', '0.613347', '0.617342', '0.632553', '0.637941', '0.611633', '0.631117', '0.627250', '0.623548', '0.620608', '0.627440', '0.630401', '0.500697', '0.487676', '0.620461', '0.635221', '0.637918', '0.615768', '0.631675', '0.642614']
         : correct/total = [(9105, 14232), (8731, 14235), (8807, 14266), (8993, 14217), (9083, 14238), (8791, 14373), (9054, 14346), (8991, 14334), (8913, 14294), (8920, 14373), (9000, 14344), (9016, 14302), (7187, 14354), (7004, 14362), (8885, 14320), (9144, 14395), (9179, 14389), (8779, 14257), (9002, 14251), (9253, 14399)]
         : compromised: 0.5890, honest: 0.6311
         : sketchguard stats = ['Node 0: acc_rate=0.500', 'Node 1: acc_rate=1.000', 'Node 2: acc_rate=0.500']...
Round 003: test acc mean=0.6187 ± 0.0403 | min=0.4912 max=0.6433
         : test loss mean=41.5025 ± 122.7862
         : individual accs = ['0.630410', '0.634141', '0.630380', '0.639516', '0.641944', '0.622974', '0.622403', '0.622715', '0.623129', '0.633479', '0.634481', '0.643267', '0.508639', '0.491227', '0.632053', '0.639389', '0.640976', '0.619836', '0.627324', '0.635877']
         : correct/total = [(8972, 14232), (9027, 14235), (8993, 14266), (9092, 14217), (9140, 14238), (8954, 14373), (8929, 14346), (8926, 14334), (8907, 14294), (9105, 14373), (9101, 14344), (9200, 14302), (7301, 14354), (7055, 14362), (9051, 14320), (9204, 14395), (9223, 14389), (8837, 14257), (8940, 14251), (9156, 14399)]
         : compromised: 0.5974, honest: 0.6329
         : sketchguard stats = ['Node 0: acc_rate=0.500', 'Node 1: acc_rate=1.000', 'Node 2: acc_rate=0.500']...
Round 004: test acc mean=0.6265 ± 0.0435 | min=0.4934 max=0.6556
         : test loss mean=101.2885 ± 325.6912
         : individual accs = ['0.654300', '0.634141', '0.641315', '0.642470', '0.646650', '0.642942', '0.641573', '0.640366', '0.633413', '0.628470', '0.624442', '0.638232', '0.502926', '0.493385', '0.628352', '0.646127', '0.647648', '0.643403', '0.643253', '0.655601']
         : correct/total = [(9312, 14232), (9027, 14235), (9149, 14266), (9134, 14217), (9207, 14238), (9241, 14373), (9204, 14346), (9179, 14334), (9054, 14294), (9033, 14373), (8957, 14344), (9128, 14302), (7219, 14354), (7086, 14362), (8998, 14320), (9301, 14395), (9319, 14389), (9173, 14257), (9167, 14251), (9440, 14399)]
         : compromised: 0.6033, honest: 0.6419
         : sketchguard stats = ['Node 0: acc_rate=0.500', 'Node 1: acc_rate=1.000', 'Node 2: acc_rate=0.500']...
Round 005: test acc mean=0.6306 ± 0.0425 | min=0.5047 max=0.6584
         : test loss mean=58.4014 ± 173.7867
         : individual accs = ['0.651771', '0.632525', '0.645030', '0.646128', '0.658449', '0.630975', '0.640318', '0.639528', '0.640898', '0.645029', '0.633854', '0.635296', '0.505573', '0.504735', '0.647486', '0.648628', '0.652373', '0.650487', '0.649639', '0.653795']
         : correct/total = [(9276, 14232), (9004, 14235), (9202, 14266), (9186, 14217), (9375, 14238), (9069, 14373), (9186, 14346), (9167, 14334), (9161, 14294), (9271, 14373), (9092, 14344), (9086, 14302), (7257, 14354), (7249, 14362), (9272, 14320), (9337, 14395), (9387, 14389), (9274, 14257), (9258, 14251), (9414, 14399)]
         : compromised: 0.6071, honest: 0.6463
         : sketchguard stats = ['Node 0: acc_rate=0.500', 'Node 1: acc_rate=1.000', 'Node 2: acc_rate=0.500']...
Round 006: test acc mean=0.6352 ± 0.0460 | min=0.4939 max=0.6625
         : test loss mean=41.1460 ± 122.1439
         : individual accs = ['0.657181', '0.639902', '0.649446', '0.649926', '0.656342', '0.641063', '0.646522', '0.649295', '0.640129', '0.643359', '0.637828', '0.638372', '0.504877', '0.493942', '0.658589', '0.659882', '0.662311', '0.658063', '0.654480', '0.662477']
         : correct/total = [(9353, 14232), (9109, 14235), (9265, 14266), (9240, 14217), (9345, 14238), (9214, 14373), (9275, 14346), (9307, 14334), (9150, 14294), (9247, 14373), (9149, 14344), (9130, 14302), (7247, 14354), (7094, 14362), (9431, 14320), (9499, 14395), (9530, 14389), (9382, 14257), (9327, 14251), (9539, 14399)]
         : compromised: 0.6112, honest: 0.6512
         : sketchguard stats = ['Node 0: acc_rate=0.500', 'Node 1: acc_rate=1.000', 'Node 2: acc_rate=0.500']...
Round 007: test acc mean=0.6365 ± 0.0492 | min=0.4861 max=0.6694
         : test loss mean=74.9785 ± 223.9745
         : individual accs = ['0.662591', '0.607376', '0.647624', '0.657874', '0.665051', '0.651986', '0.650216', '0.648528', '0.645236', '0.646560', '0.641383', '0.639421', '0.503205', '0.486074', '0.652304', '0.665578', '0.669400', '0.666129', '0.654340', '0.668380']
         : correct/total = [(9430, 14232), (8646, 14235), (9239, 14266), (9353, 14217), (9469, 14238), (9371, 14373), (9328, 14346), (9296, 14334), (9223, 14294), (9293, 14373), (9200, 14344), (9145, 14302), (7223, 14354), (6981, 14362), (9341, 14320), (9581, 14395), (9632, 14389), (9497, 14257), (9325, 14251), (9624, 14399)]
         : compromised: 0.6076, honest: 0.6557
         : sketchguard stats = ['Node 0: acc_rate=0.500', 'Node 1: acc_rate=0.857', 'Node 2: acc_rate=0.500']...
Round 008: test acc mean=0.6415 ± 0.0482 | min=0.4952 max=0.6719
         : test loss mean=101.4172 ± 303.0568
         : individual accs = ['0.669196', '0.652336', '0.660031', '0.653443', '0.655991', '0.649830', '0.640597', '0.639528', '0.647684', '0.649899', '0.648146', '0.650189', '0.504946', '0.495196', '0.667388', '0.668704', '0.671763', '0.670127', '0.663111', '0.671852']
         : correct/total = [(9524, 14232), (9286, 14235), (9416, 14266), (9290, 14217), (9340, 14238), (9340, 14373), (9190, 14346), (9167, 14334), (9258, 14294), (9341, 14373), (9297, 14344), (9299, 14302), (7248, 14354), (7112, 14362), (9557, 14320), (9626, 14395), (9666, 14389), (9554, 14257), (9450, 14251), (9674, 14399)]
         : compromised: 0.6191, honest: 0.6564
         : sketchguard stats = ['Node 0: acc_rate=0.500', 'Node 1: acc_rate=0.812', 'Node 2: acc_rate=0.500']...
Round 009: test acc mean=0.6416 ± 0.0477 | min=0.5016 max=0.6775
         : test loss mean=102.4245 ± 306.8622
         : individual accs = ['0.648468', '0.654162', '0.661012', '0.657874', '0.667790', '0.652473', '0.616757', '0.641900', '0.643837', '0.650386', '0.645915', '0.652706', '0.507663', '0.501601', '0.674022', '0.672664', '0.677531', '0.673844', '0.671251', '0.659768']
         : correct/total = [(9229, 14232), (9312, 14235), (9430, 14266), (9353, 14217), (9508, 14238), (9378, 14373), (8848, 14346), (9201, 14334), (9203, 14294), (9348, 14373), (9265, 14344), (9335, 14302), (7287, 14354), (7204, 14362), (9652, 14320), (9683, 14395), (9749, 14389), (9607, 14257), (9566, 14251), (9500, 14399)]
         : compromised: 0.6235, honest: 0.6537
         : sketchguard stats = ['Node 0: acc_rate=0.500', 'Node 1: acc_rate=0.778', 'Node 2: acc_rate=0.500']...
Round 010: test acc mean=0.6499 ± 0.0521 | min=0.4951 max=0.6864
         : test loss mean=101.0177 ± 302.5190
         : individual accs = ['0.672780', '0.669406', '0.662414', '0.658578', '0.663506', '0.666180', '0.657953', '0.661923', '0.649084', '0.654491', '0.652886', '0.656132', '0.498467', '0.495126', '0.678073', '0.685099', '0.686427', '0.677351', '0.671251', '0.680325']
         : correct/total = [(9575, 14232), (9529, 14235), (9450, 14266), (9363, 14217), (9447, 14238), (9575, 14373), (9439, 14346), (9488, 14334), (9278, 14294), (9407, 14373), (9365, 14344), (9384, 14302), (7155, 14354), (7111, 14362), (9710, 14320), (9862, 14395), (9877, 14389), (9657, 14257), (9566, 14251), (9796, 14399)]
         : compromised: 0.6265, honest: 0.6655
         : sketchguard stats = ['Node 0: acc_rate=0.500', 'Node 1: acc_rate=0.750', 'Node 2: acc_rate=0.500']...

=== FINAL RESULTS ===
Dataset: sent140, Nodes: 20, Graph: ring, Aggregation: sketchguard
Attack: gaussian, 40.0% compromised
Final accuracy - Compromised: 0.6265, Honest: 0.6655
Overall test accuracy: mean=0.6499 ± 0.0521

=== Sketchguard SUMMARY ===
Node 0: acceptance=0.500
Node 1: acceptance=0.750
Node 2: acceptance=0.500
Node 3: acceptance=1.000
Node 4: acceptance=0.500
Node 5: acceptance=0.750
Node 6: acceptance=0.500
Node 7: acceptance=1.000
Node 8: acceptance=1.000
Node 9: acceptance=1.000
Node 10: acceptance=0.500
Node 11: acceptance=0.500
Node 12: acceptance=0.500
Node 13: acceptance=0.500
Node 14: acceptance=0.500
Node 15: acceptance=0.500
Node 16: acceptance=0.500
Node 17: acceptance=0.500
Node 18: acceptance=0.500
Node 19: acceptance=0.500

=== PARALLEL EXECUTION TIME (realistic for distributed system) ===
  COMMUNICATION (max across nodes):
    - Sketch transfer: 0.000s (0.0%)
    - Model fetch (accepted): 0.000s (0.0%)
  COMPUTATION (max across nodes):
    - Sketching: 0.220s (95.8%)
    - Filtering: 0.001s (0.3%)
    - Aggregation: 0.009s (4.0%)
  TOTALS:
    - Total computation: 0.229s (100.0%)
    - Total communication: 0.000s (0.0%)
    - Total parallel time: 0.229s

=== PER-NODE AVERAGE TIME ===
  - Sketching: 0.158s
  - Filtering: 0.000s
  - Aggregation: 0.006s
  - Sketch transfer: 0.000s
  - Model fetch: 0.000s
  - Total per node: 0.164s

=== TOTAL COMPUTATIONAL WORK (sum across all nodes) ===
  - Total sketching: 3.151s
  - Total filtering: 0.006s
  - Total aggregation: 0.118s
  - Total sketch transfer: 0.000s
  - Total model fetch: 0.000s
  - Grand total: 3.275s
  - Mean acceptance rate: 0.625

Sketchguard Algorithm Properties:
  - Original dimension: 1,174,986
  - Sketch size: 180
  - Compression ratio: 19.9x
  - Single repetition: No repetitions needed
  - Theoretical complexity: O(d + N×k)
  - Approach: Sketch filtering + state aggregation
