Device: cuda
Seed: 987654321
Loading 1 LEAF Sent140 train files...
LEAF Sent140 train: 254555 users, 908652 samples
Building vocabulary (max_size=10000)...
Vocabulary size: 10000
Loading 1 LEAF Sent140 test files...
LEAF Sent140 test: 254555 users, 286281 samples
Found 254555 train users, 254555 test users, 254555 common users
User sample counts range: 494 (max) to 1 (min)
Distributed ALL 254555 users across 20 clients
Users per client: 12727 (with 15 clients getting +1 user)
Train partition sizes: [44353, 44290, 44657, 44907, 44696, 45843, 45801, 45619, 45069, 45639, 45821, 45311, 45779, 46056, 45625, 45984, 46428, 44737, 45540, 46497]
Test partition sizes: [14232, 14235, 14266, 14217, 14238, 14373, 14346, 14334, 14294, 14373, 14344, 14302, 14354, 14362, 14320, 14395, 14389, 14257, 14251, 14399]
  Client 0: 44353 train samples, 2 unique classes
  Client 1: 44290 train samples, 2 unique classes
  Client 2: 44657 train samples, 2 unique classes
  Client 3: 44907 train samples, 2 unique classes
  Client 4: 44696 train samples, 2 unique classes
  Client 5: 45843 train samples, 2 unique classes
  Client 6: 45801 train samples, 2 unique classes
  Client 7: 45619 train samples, 2 unique classes
  Client 8: 45069 train samples, 2 unique classes
  Client 9: 45639 train samples, 2 unique classes
  Client 10: 45821 train samples, 2 unique classes
  Client 11: 45311 train samples, 2 unique classes
  Client 12: 45779 train samples, 2 unique classes
  Client 13: 46056 train samples, 2 unique classes
  Client 14: 45625 train samples, 2 unique classes
  Client 15: 45984 train samples, 2 unique classes
  Client 16: 46428 train samples, 2 unique classes
  Client 17: 44737 train samples, 2 unique classes
  Client 18: 45540 train samples, 2 unique classes
  Client 19: 46497 train samples, 2 unique classes
Will sample 4500 samples per client per epoch
Graph: ring, nodes: 20, edges: 20
Degree statistics: avg=2.00, min=2, max=2
Attack: Compromised 12/20 nodes: [1, 2, 3, 5, 8, 11, 12, 13, 14, 15, 17, 18]
Attack type: krum, lambda: 1.0
Model variant: baseline
Model parameters: 1,174,986
UBAR ALGORITHM (Two-Stage Byzantine-resilient)
  - Model dimension: 1,174,986 parameters
  - Rho parameter: 0.4
  - Stage 1: Distance-based filtering (select 40% closest neighbors)
  - Stage 2: Performance-based selection (loss comparison)
  - Complexity: O(deg(i)×d + deg(i)×inference)
Initial test acc across nodes: mean=0.4965 ± 0.0152
Round 001: test acc mean=0.5242 ± 0.0182 | min=0.4993 max=0.5627
         : test loss mean=2.4309 ± 2.7522
         : individual accs = ['0.548974', '0.523147', '0.504206', '0.515017', '0.500632', '0.517846', '0.562666', '0.553858', '0.511613', '0.526473', '0.515965', '0.533562', '0.499303', '0.518939', '0.506494', '0.525669', '0.501286', '0.542050', '0.533226', '0.543649']
         : correct/total = [(7813, 14232), (7447, 14235), (7193, 14266), (7322, 14217), (7128, 14238), (7443, 14373), (8072, 14346), (7939, 14334), (7313, 14294), (7567, 14373), (7401, 14344), (7631, 14302), (7167, 14354), (7453, 14362), (7253, 14320), (7567, 14395), (7213, 14389), (7728, 14257), (7599, 14251), (7828, 14399)]
         : compromised: 0.5193, honest: 0.5317
         : ubar stats = ['Node 0: s1=0.500, s2=1.000', 'Node 1: s1=0.500, s2=1.000', 'Node 2: s1=0.500, s2=1.000']...
Round 002: test acc mean=0.5445 ± 0.0418 | min=0.4923 max=0.6106
         : test loss mean=2.0284 ± 2.0719
         : individual accs = ['0.590008', '0.561784', '0.511636', '0.520011', '0.495997', '0.556808', '0.610623', '0.606530', '0.569610', '0.582829', '0.585750', '0.551811', '0.500836', '0.492341', '0.504190', '0.497673', '0.496212', '0.492670', '0.573925', '0.589208']
         : correct/total = [(8397, 14232), (7997, 14235), (7299, 14266), (7393, 14217), (7062, 14238), (8003, 14373), (8760, 14346), (8694, 14334), (8142, 14294), (8377, 14373), (8402, 14344), (7892, 14302), (7189, 14354), (7071, 14362), (7220, 14320), (7164, 14395), (7140, 14389), (7024, 14257), (8179, 14251), (8484, 14399)]
         : compromised: 0.5278, honest: 0.5696
         : ubar stats = ['Node 0: s1=0.500, s2=1.000', 'Node 1: s1=0.500, s2=1.000', 'Node 2: s1=0.500, s2=1.000']...
Round 003: test acc mean=0.5581 ± 0.0520 | min=0.4901 max=0.6182
         : test loss mean=1.0374 ± 0.4365
         : individual accs = ['0.614601', '0.605620', '0.490116', '0.494127', '0.504355', '0.597300', '0.615851', '0.615390', '0.606408', '0.594865', '0.598578', '0.569431', '0.520134', '0.495822', '0.495740', '0.506148', '0.506707', '0.505085', '0.606694', '0.618237']
         : correct/total = [(8747, 14232), (8621, 14235), (6992, 14266), (7025, 14217), (7181, 14238), (8585, 14373), (8835, 14346), (8821, 14334), (8668, 14294), (8550, 14373), (8586, 14344), (8144, 14302), (7466, 14354), (7121, 14362), (7099, 14320), (7286, 14395), (7291, 14389), (7201, 14257), (8646, 14251), (8902, 14399)]
         : compromised: 0.5411, honest: 0.5836
         : ubar stats = ['Node 0: s1=0.500, s2=1.000', 'Node 1: s1=0.500, s2=1.000', 'Node 2: s1=0.500, s2=1.000']...
Round 004: test acc mean=0.5680 ± 0.0602 | min=0.4914 max=0.6308
         : test loss mean=1.2969 ± 0.9696
         : individual accs = ['0.624719', '0.622129', '0.506519', '0.515228', '0.503441', '0.628887', '0.624843', '0.624669', '0.621100', '0.619634', '0.617610', '0.605440', '0.498398', '0.493176', '0.502165', '0.491421', '0.506359', '0.499614', '0.624167', '0.630808']
         : correct/total = [(8891, 14232), (8856, 14235), (7226, 14266), (7325, 14217), (7168, 14238), (9039, 14373), (8964, 14346), (8954, 14334), (8878, 14294), (8906, 14373), (8859, 14344), (8659, 14302), (7154, 14354), (7083, 14362), (7191, 14320), (7074, 14395), (7286, 14389), (7123, 14257), (8895, 14251), (9083, 14399)]
         : compromised: 0.5507, honest: 0.5940
         : ubar stats = ['Node 0: s1=0.500, s2=1.000', 'Node 1: s1=0.500, s2=1.000', 'Node 2: s1=0.500, s2=1.000']...
Round 005: test acc mean=0.5698 ± 0.0652 | min=0.4867 max=0.6379
         : test loss mean=0.9924 ± 0.5019
         : individual accs = ['0.629427', '0.629926', '0.497406', '0.492509', '0.493819', '0.637863', '0.634323', '0.632831', '0.627676', '0.626313', '0.622211', '0.613201', '0.504319', '0.488790', '0.486662', '0.508649', '0.498575', '0.512871', '0.629359', '0.630252']
         : correct/total = [(8958, 14232), (8967, 14235), (7096, 14266), (7002, 14217), (7031, 14238), (9168, 14373), (9100, 14346), (9071, 14334), (8972, 14294), (9002, 14373), (8925, 14344), (8770, 14302), (7239, 14354), (7020, 14362), (6969, 14320), (7322, 14395), (7174, 14389), (7312, 14257), (8969, 14251), (9075, 14399)]
         : compromised: 0.5524, honest: 0.5960
         : ubar stats = ['Node 0: s1=0.500, s2=1.000', 'Node 1: s1=0.500, s2=1.000', 'Node 2: s1=0.500, s2=1.000']...
Round 006: test acc mean=0.5775 ± 0.0630 | min=0.4943 max=0.6387
         : test loss mean=1.1560 ± 0.7799
         : individual accs = ['0.635399', '0.638497', '0.515772', '0.494338', '0.511378', '0.638211', '0.638715', '0.637575', '0.626766', '0.632645', '0.626325', '0.629143', '0.509335', '0.512324', '0.511173', '0.504689', '0.511363', '0.502490', '0.635464', '0.638447']
         : correct/total = [(9043, 14232), (9089, 14235), (7358, 14266), (7028, 14217), (7281, 14238), (9173, 14373), (9163, 14346), (9139, 14334), (8959, 14294), (9093, 14373), (8984, 14344), (8998, 14302), (7311, 14354), (7358, 14362), (7320, 14320), (7265, 14395), (7358, 14389), (7164, 14257), (9056, 14251), (9193, 14399)]
         : compromised: 0.5599, honest: 0.6040
         : ubar stats = ['Node 0: s1=0.500, s2=1.000', 'Node 1: s1=0.500, s2=1.000', 'Node 2: s1=0.500, s2=1.000']...
Round 007: test acc mean=0.5741 ± 0.0711 | min=0.4868 max=0.6456
         : test loss mean=0.9502 ± 0.4591
         : individual accs = ['0.643831', '0.637162', '0.498738', '0.493142', '0.492485', '0.641898', '0.639412', '0.632412', '0.630125', '0.641133', '0.635806', '0.629702', '0.499443', '0.488024', '0.486802', '0.499757', '0.499687', '0.503472', '0.643253', '0.645600']
         : correct/total = [(9163, 14232), (9070, 14235), (7115, 14266), (7011, 14217), (7012, 14238), (9226, 14373), (9173, 14346), (9065, 14334), (9007, 14294), (9215, 14373), (9120, 14344), (9006, 14302), (7169, 14354), (7009, 14362), (6971, 14320), (7194, 14395), (7190, 14389), (7178, 14257), (9167, 14251), (9296, 14399)]
         : compromised: 0.5543, honest: 0.6038
         : ubar stats = ['Node 0: s1=0.500, s2=1.000', 'Node 1: s1=0.500, s2=1.000', 'Node 2: s1=0.500, s2=1.000']...
Round 008: test acc mean=0.5821 ± 0.0663 | min=0.4932 max=0.6474
         : test loss mean=1.1710 ± 0.8063
         : individual accs = ['0.645587', '0.638848', '0.510444', '0.493212', '0.509201', '0.640437', '0.642827', '0.638621', '0.642367', '0.643777', '0.637340', '0.635785', '0.506758', '0.500766', '0.508939', '0.518513', '0.513031', '0.521288', '0.647393', '0.646503']
         : correct/total = [(9188, 14232), (9094, 14235), (7282, 14266), (7012, 14217), (7250, 14238), (9205, 14373), (9222, 14346), (9154, 14334), (9182, 14294), (9253, 14373), (9142, 14344), (9093, 14302), (7274, 14354), (7192, 14362), (7288, 14320), (7464, 14395), (7382, 14389), (7432, 14257), (9226, 14251), (9309, 14399)]
         : compromised: 0.5637, honest: 0.6096
         : ubar stats = ['Node 0: s1=0.500, s2=1.000', 'Node 1: s1=0.500, s2=1.000', 'Node 2: s1=0.500, s2=1.000']...
Round 009: test acc mean=0.5776 ± 0.0744 | min=0.4796 max=0.6526
         : test loss mean=0.9311 ± 0.4392
         : individual accs = ['0.648960', '0.649315', '0.500771', '0.479637', '0.490518', '0.644890', '0.645197', '0.644203', '0.645656', '0.640994', '0.634342', '0.637603', '0.492964', '0.498329', '0.492598', '0.502883', '0.499896', '0.502630', '0.647604', '0.652615']
         : correct/total = [(9236, 14232), (9243, 14235), (7144, 14266), (6819, 14217), (6984, 14238), (9269, 14373), (9256, 14346), (9234, 14334), (9229, 14294), (9213, 14373), (9099, 14344), (9119, 14302), (7076, 14354), (7157, 14362), (7054, 14320), (7239, 14395), (7193, 14389), (7166, 14257), (9229, 14251), (9397, 14399)]
         : compromised: 0.5579, honest: 0.6071
         : ubar stats = ['Node 0: s1=0.500, s2=1.000', 'Node 1: s1=0.500, s2=1.000', 'Node 2: s1=0.500, s2=1.000']...
Round 010: test acc mean=0.5840 ± 0.0704 | min=0.4901 max=0.6530
         : test loss mean=1.1352 ± 0.7553
         : individual accs = ['0.650365', '0.652968', '0.522781', '0.512415', '0.509060', '0.645516', '0.646591', '0.646435', '0.651042', '0.645446', '0.641662', '0.641099', '0.508569', '0.505640', '0.510964', '0.490101', '0.505734', '0.493091', '0.647463', '0.652476']
         : correct/total = [(9256, 14232), (9295, 14235), (7458, 14266), (7285, 14217), (7248, 14238), (9278, 14373), (9276, 14346), (9266, 14334), (9306, 14294), (9277, 14373), (9204, 14344), (9169, 14302), (7300, 14354), (7262, 14362), (7317, 14320), (7055, 14395), (7277, 14389), (7030, 14257), (9227, 14251), (9395, 14399)]
         : compromised: 0.5651, honest: 0.6122
         : ubar stats = ['Node 0: s1=0.500, s2=1.000', 'Node 1: s1=0.500, s2=1.000', 'Node 2: s1=0.500, s2=1.000']...

=== FINAL RESULTS ===
Dataset: sent140, Nodes: 20, Graph: ring, Aggregation: ubar
Attack: krum, 60.0% compromised
Final accuracy - Compromised: 0.5651, Honest: 0.6122
Overall test accuracy: mean=0.5840 ± 0.0704

=== UBAR SUMMARY ===
Node 0: stage1=0.500, stage2=1.000, overall=0.500
Node 1: stage1=0.500, stage2=1.000, overall=0.500
Node 2: stage1=0.500, stage2=1.000, overall=0.500
Node 3: stage1=0.500, stage2=1.000, overall=0.500
Node 4: stage1=0.500, stage2=1.000, overall=0.500
Node 5: stage1=0.500, stage2=1.000, overall=0.500
Node 6: stage1=0.500, stage2=1.000, overall=0.500
Node 7: stage1=0.500, stage2=1.000, overall=0.500
Node 8: stage1=0.500, stage2=1.000, overall=0.500
Node 9: stage1=0.500, stage2=1.000, overall=0.500
Node 10: stage1=0.500, stage2=1.000, overall=0.500
Node 11: stage1=0.500, stage2=1.000, overall=0.500
Node 12: stage1=0.500, stage2=1.000, overall=0.500
Node 13: stage1=0.500, stage2=1.000, overall=0.500
Node 14: stage1=0.500, stage2=1.000, overall=0.500
Node 15: stage1=0.500, stage2=1.000, overall=0.500
Node 16: stage1=0.500, stage2=1.000, overall=0.500
Node 17: stage1=0.500, stage2=1.000, overall=0.500
Node 18: stage1=0.500, stage2=1.000, overall=0.500
Node 19: stage1=0.500, stage2=1.000, overall=0.500

=== PARALLEL EXECUTION TIME (realistic for distributed system) ===
  COMMUNICATION (max across nodes):
    - Full model transfer: 0.000s (0.0%)
  COMPUTATION (max across nodes):
    - Distance computation: 0.011s (36.4%)
    - Loss computation: 0.015s (50.3%)
    - Aggregation: 0.004s (13.3%)
  TOTALS:
    - Total computation: 0.030s (100.0%)
    - Total communication: 0.000s (0.0%)
    - Total parallel time: 0.030s

=== PER-NODE AVERAGE TIME ===
  - Distance computation: 0.009s
  - Loss computation: 0.009s
  - Aggregation: 0.003s
  - Model transfer: 0.000s
  - Total per node: 0.021s

=== TOTAL COMPUTATIONAL WORK (sum across all nodes) ===
  - Total distance computation: 0.176s
  - Total loss computation: 0.180s
  - Total aggregation: 0.066s
  - Total model transfer: 0.000s
  - Grand total: 0.422s
  - Mean Stage 1 acceptance rate: 0.500
  - Mean Stage 2 acceptance rate: 1.000
  - Overall acceptance rate: 0.500

UBAR Algorithm Properties:
  - Model dimension: 1,174,986
  - Rho parameter: 0.4
  - Two-stage approach: Distance filtering + loss evaluation
  - Stage 1 selects: 40% of neighbors
  - Stage 2 uses: Training sample loss comparison
  - Theoretical complexity: O(deg(i)×d + deg(i)×inference)
  - Approach: UBAR paper implementation
