Device: cuda
Seed: 987654321
Loading 1 LEAF Sent140 train files...
LEAF Sent140 train: 254555 users, 908652 samples
Building vocabulary (max_size=10000)...
Vocabulary size: 10000
Loading 1 LEAF Sent140 test files...
LEAF Sent140 test: 254555 users, 286281 samples
Found 254555 train users, 254555 test users, 254555 common users
User sample counts range: 494 (max) to 1 (min)
Distributed ALL 254555 users across 20 clients
Users per client: 12727 (with 15 clients getting +1 user)
Train partition sizes: [44353, 44290, 44657, 44907, 44696, 45843, 45801, 45619, 45069, 45639, 45821, 45311, 45779, 46056, 45625, 45984, 46428, 44737, 45540, 46497]
Test partition sizes: [14232, 14235, 14266, 14217, 14238, 14373, 14346, 14334, 14294, 14373, 14344, 14302, 14354, 14362, 14320, 14395, 14389, 14257, 14251, 14399]
  Client 0: 44353 train samples, 2 unique classes
  Client 1: 44290 train samples, 2 unique classes
  Client 2: 44657 train samples, 2 unique classes
  Client 3: 44907 train samples, 2 unique classes
  Client 4: 44696 train samples, 2 unique classes
  Client 5: 45843 train samples, 2 unique classes
  Client 6: 45801 train samples, 2 unique classes
  Client 7: 45619 train samples, 2 unique classes
  Client 8: 45069 train samples, 2 unique classes
  Client 9: 45639 train samples, 2 unique classes
  Client 10: 45821 train samples, 2 unique classes
  Client 11: 45311 train samples, 2 unique classes
  Client 12: 45779 train samples, 2 unique classes
  Client 13: 46056 train samples, 2 unique classes
  Client 14: 45625 train samples, 2 unique classes
  Client 15: 45984 train samples, 2 unique classes
  Client 16: 46428 train samples, 2 unique classes
  Client 17: 44737 train samples, 2 unique classes
  Client 18: 45540 train samples, 2 unique classes
  Client 19: 46497 train samples, 2 unique classes
Will sample 4500 samples per client per epoch
Graph: erdos, nodes: 20, edges: 48
Degree statistics: avg=4.80, min=2, max=7
Attack: Compromised 14/20 nodes: [1, 2, 3, 5, 6, 8, 11, 12, 13, 14, 15, 17, 18, 19]
Attack type: gaussian, lambda: 1.0
Model variant: baseline
Model parameters: 1,174,986
UBAR ALGORITHM (Two-Stage Byzantine-resilient)
  - Model dimension: 1,174,986 parameters
  - Rho parameter: 0.30000000000000004
  - Stage 1: Distance-based filtering (select 30% closest neighbors)
  - Stage 2: Performance-based selection (loss comparison)
  - Complexity: O(deg(i)×d + deg(i)×inference)
Initial test acc across nodes: mean=0.4965 ± 0.0152
Round 001: test acc mean=0.5260 ± 0.0251 | min=0.4797 max=0.5722
         : test loss mean=56.5713 ± 243.5746
         : individual accs = ['0.539770', '0.480506', '0.534417', '0.523106', '0.563984', '0.535170', '0.507040', '0.517999', '0.533581', '0.543589', '0.515407', '0.533562', '0.572175', '0.501462', '0.529818', '0.554081', '0.545903', '0.524023', '0.485369', '0.479686']
         : correct/total = [(7682, 14232), (6840, 14235), (7624, 14266), (7437, 14217), (8030, 14238), (7692, 14373), (7274, 14346), (7425, 14334), (7627, 14294), (7813, 14373), (7393, 14344), (7631, 14302), (8213, 14354), (7202, 14362), (7587, 14320), (7976, 14395), (7855, 14389), (7471, 14257), (6917, 14251), (6907, 14399)]
         : compromised: 0.5210, honest: 0.5378
         : ubar stats = ['Node 0: s1=0.167, s2=1.000', 'Node 1: s1=0.167, s2=1.000', 'Node 2: s1=0.200, s2=1.000']...
Round 002: test acc mean=0.5696 ± 0.0284 | min=0.4926 max=0.5978
         : test loss mean=47.3226 ± 203.2869
         : individual accs = ['0.596262', '0.531507', '0.573041', '0.525216', '0.597837', '0.557852', '0.547539', '0.595089', '0.586680', '0.596535', '0.595231', '0.573976', '0.589522', '0.492619', '0.563827', '0.580757', '0.580304', '0.583924', '0.587818', '0.536496']
         : correct/total = [(8486, 14232), (7566, 14235), (8175, 14266), (7467, 14217), (8512, 14238), (8018, 14373), (7855, 14346), (8530, 14334), (8386, 14294), (8574, 14373), (8538, 14344), (8209, 14302), (8462, 14354), (7075, 14362), (8074, 14320), (8360, 14395), (8350, 14389), (8325, 14257), (8377, 14251), (7725, 14399)]
         : compromised: 0.5593, honest: 0.5935
         : ubar stats = ['Node 0: s1=0.167, s2=1.000', 'Node 1: s1=0.167, s2=1.000', 'Node 2: s1=0.200, s2=1.000']...
Round 003: test acc mean=0.5924 ± 0.0268 | min=0.4878 max=0.6165
         : test loss mean=138.8040 ± 602.0980
         : individual accs = ['0.610315', '0.564594', '0.599958', '0.597594', '0.616519', '0.595561', '0.593127', '0.602274', '0.602281', '0.615599', '0.601715', '0.580059', '0.606451', '0.487815', '0.579050', '0.599792', '0.601154', '0.603353', '0.600168', '0.589624']
         : correct/total = [(8686, 14232), (8037, 14235), (8559, 14266), (8496, 14217), (8778, 14238), (8560, 14373), (8509, 14346), (8633, 14334), (8609, 14294), (8848, 14373), (8631, 14344), (8296, 14302), (8705, 14354), (7006, 14362), (8292, 14320), (8634, 14395), (8650, 14389), (8602, 14257), (8553, 14251), (8490, 14399)]
         : compromised: 0.5857, honest: 0.6079
         : ubar stats = ['Node 0: s1=0.167, s2=1.000', 'Node 1: s1=0.167, s2=1.000', 'Node 2: s1=0.200, s2=1.000']...
Round 004: test acc mean=0.6094 ± 0.0305 | min=0.4834 max=0.6268
         : test loss mean=68.4662 ± 295.5707
         : individual accs = ['0.620363', '0.601686', '0.612645', '0.619962', '0.626773', '0.617338', '0.613481', '0.624459', '0.619701', '0.626105', '0.624373', '0.597818', '0.615856', '0.483359', '0.586941', '0.624314', '0.618389', '0.617451', '0.613571', '0.622821']
         : correct/total = [(8829, 14232), (8565, 14235), (8740, 14266), (8814, 14217), (8924, 14238), (8873, 14373), (8801, 14346), (8951, 14334), (8858, 14294), (8999, 14373), (8956, 14344), (8550, 14302), (8840, 14354), (6942, 14362), (8405, 14320), (8987, 14395), (8898, 14389), (8803, 14257), (8744, 14251), (8968, 14399)]
         : compromised: 0.6034, honest: 0.6234
         : ubar stats = ['Node 0: s1=0.167, s2=1.000', 'Node 1: s1=0.167, s2=1.000', 'Node 2: s1=0.200, s2=1.000']...
Round 005: test acc mean=0.6200 ± 0.0282 | min=0.4987 max=0.6342
         : test loss mean=51.8454 ± 223.1692
         : individual accs = ['0.624438', '0.621005', '0.624702', '0.627488', '0.632673', '0.629096', '0.626237', '0.630947', '0.623758', '0.634245', '0.627719', '0.615438', '0.626237', '0.498747', '0.615852', '0.631886', '0.629231', '0.626990', '0.624728', '0.629071']
         : correct/total = [(8887, 14232), (8840, 14235), (8912, 14266), (8921, 14217), (9008, 14238), (9042, 14373), (8984, 14346), (9044, 14334), (8916, 14294), (9116, 14373), (9004, 14344), (8802, 14302), (8989, 14354), (7163, 14362), (8819, 14320), (9096, 14395), (9054, 14389), (8939, 14257), (8903, 14251), (9058, 14399)]
         : compromised: 0.6158, honest: 0.6299
         : ubar stats = ['Node 0: s1=0.167, s2=1.000', 'Node 1: s1=0.167, s2=1.000', 'Node 2: s1=0.200, s2=1.000']...
Round 006: test acc mean=0.6261 ± 0.0298 | min=0.4996 max=0.6427
         : test loss mean=67.6613 ± 292.1342
         : individual accs = ['0.633853', '0.631612', '0.634796', '0.635436', '0.638994', '0.636471', '0.633278', '0.633598', '0.632433', '0.642733', '0.632250', '0.610474', '0.633343', '0.499582', '0.618785', '0.636402', '0.633053', '0.635197', '0.634482', '0.635669']
         : correct/total = [(9021, 14232), (8991, 14235), (9056, 14266), (9034, 14217), (9098, 14238), (9148, 14373), (9085, 14346), (9082, 14334), (9040, 14294), (9238, 14373), (9069, 14344), (8731, 14302), (9091, 14354), (7175, 14362), (8861, 14320), (9161, 14395), (9109, 14389), (9056, 14257), (9042, 14251), (9153, 14399)]
         : compromised: 0.6220, honest: 0.6357
         : ubar stats = ['Node 0: s1=0.167, s2=1.000', 'Node 1: s1=0.167, s2=1.000', 'Node 2: s1=0.200, s2=1.000']...
Round 007: test acc mean=0.6302 ± 0.0329 | min=0.4908 max=0.6500
         : test loss mean=56.6554 ± 244.1717
         : individual accs = ['0.645096', '0.638145', '0.637039', '0.645495', '0.642506', '0.636819', '0.637808', '0.629203', '0.639499', '0.650038', '0.631274', '0.611733', '0.628954', '0.490809', '0.635824', '0.641264', '0.643686', '0.637231', '0.642130', '0.639003']
         : correct/total = [(9181, 14232), (9084, 14235), (9088, 14266), (9177, 14217), (9148, 14238), (9153, 14373), (9150, 14346), (9019, 14334), (9141, 14294), (9343, 14373), (9055, 14344), (8749, 14302), (9028, 14354), (7049, 14362), (9105, 14320), (9231, 14395), (9262, 14389), (9085, 14257), (9151, 14251), (9201, 14399)]
         : compromised: 0.6258, honest: 0.6403
         : ubar stats = ['Node 0: s1=0.167, s2=1.000', 'Node 1: s1=0.167, s2=1.000', 'Node 2: s1=0.200, s2=1.000']...
Round 008: test acc mean=0.6324 ± 0.0363 | min=0.4779 max=0.6500
         : test loss mean=43.2527 ± 185.7685
         : individual accs = ['0.637015', '0.647910', '0.643278', '0.641978', '0.641663', '0.636471', '0.640318', '0.639947', '0.641528', '0.649969', '0.639361', '0.635086', '0.610004', '0.477928', '0.642528', '0.647933', '0.646536', '0.641089', '0.640446', '0.646434']
         : correct/total = [(9066, 14232), (9223, 14235), (9177, 14266), (9127, 14217), (9136, 14238), (9148, 14373), (9186, 14346), (9173, 14334), (9170, 14294), (9342, 14373), (9171, 14344), (9083, 14302), (8756, 14354), (6864, 14362), (9201, 14320), (9327, 14395), (9303, 14389), (9140, 14257), (9127, 14251), (9308, 14399)]
         : compromised: 0.6281, honest: 0.6424
         : ubar stats = ['Node 0: s1=0.167, s2=1.000', 'Node 1: s1=0.167, s2=1.000', 'Node 2: s1=0.200, s2=1.000']...
Round 009: test acc mean=0.6378 ± 0.0352 | min=0.4863 max=0.6547
         : test loss mean=47.4272 ± 203.9809
         : individual accs = ['0.650436', '0.654724', '0.648956', '0.646269', '0.648616', '0.643498', '0.649449', '0.639249', '0.646005', '0.653587', '0.640198', '0.644805', '0.630835', '0.486283', '0.636173', '0.650573', '0.650914', '0.644806', '0.646130', '0.644698']
         : correct/total = [(9257, 14232), (9320, 14235), (9258, 14266), (9188, 14217), (9235, 14238), (9249, 14373), (9317, 14346), (9163, 14334), (9234, 14294), (9394, 14373), (9183, 14344), (9222, 14302), (9055, 14354), (6984, 14362), (9110, 14320), (9365, 14395), (9366, 14389), (9193, 14257), (9208, 14251), (9283, 14399)]
         : compromised: 0.6338, honest: 0.6472
         : ubar stats = ['Node 0: s1=0.167, s2=1.000', 'Node 1: s1=0.167, s2=1.000', 'Node 2: s1=0.200, s2=1.000']...
Round 010: test acc mean=0.6403 ± 0.0339 | min=0.4935 max=0.6542
         : test loss mean=41.8878 ± 179.8531
         : individual accs = ['0.653035', '0.654162', '0.646572', '0.652529', '0.654024', '0.643011', '0.651401', '0.644133', '0.643347', '0.653656', '0.642429', '0.647042', '0.643375', '0.493455', '0.647765', '0.649184', '0.651748', '0.644806', '0.641288', '0.648239']
         : correct/total = [(9294, 14232), (9312, 14235), (9224, 14266), (9277, 14217), (9312, 14238), (9242, 14373), (9345, 14346), (9233, 14334), (9196, 14294), (9395, 14373), (9215, 14344), (9254, 14302), (9235, 14354), (7087, 14362), (9276, 14320), (9345, 14395), (9378, 14389), (9193, 14257), (9139, 14251), (9334, 14399)]
         : compromised: 0.6362, honest: 0.6498
         : ubar stats = ['Node 0: s1=0.167, s2=1.000', 'Node 1: s1=0.167, s2=1.000', 'Node 2: s1=0.200, s2=1.000']...

=== FINAL RESULTS ===
Dataset: sent140, Nodes: 20, Graph: erdos, Aggregation: ubar
Attack: gaussian, 70.0% compromised
Final accuracy - Compromised: 0.6362, Honest: 0.6498
Overall test accuracy: mean=0.6403 ± 0.0339

=== UBAR SUMMARY ===
Node 0: stage1=0.167, stage2=1.000, overall=0.167
Node 1: stage1=0.167, stage2=1.000, overall=0.167
Node 2: stage1=0.200, stage2=1.000, overall=0.200
Node 3: stage1=0.250, stage2=1.000, overall=0.250
Node 4: stage1=0.250, stage2=1.000, overall=0.250
Node 5: stage1=0.200, stage2=1.000, overall=0.200
Node 6: stage1=0.200, stage2=1.000, overall=0.200
Node 7: stage1=0.200, stage2=1.000, overall=0.200
Node 8: stage1=0.500, stage2=1.000, overall=0.500
Node 9: stage1=0.333, stage2=1.000, overall=0.333
Node 10: stage1=0.250, stage2=1.000, overall=0.250
Node 11: stage1=0.286, stage2=0.700, overall=0.200
Node 12: stage1=0.286, stage2=0.650, overall=0.186
Node 13: stage1=0.250, stage2=1.000, overall=0.250
Node 14: stage1=0.286, stage2=0.500, overall=0.143
Node 15: stage1=0.167, stage2=1.000, overall=0.167
Node 16: stage1=0.200, stage2=1.000, overall=0.200
Node 17: stage1=0.200, stage2=1.000, overall=0.200
Node 18: stage1=0.250, stage2=1.000, overall=0.250
Node 19: stage1=0.500, stage2=1.000, overall=0.500

=== PARALLEL EXECUTION TIME (realistic for distributed system) ===
  COMMUNICATION (max across nodes):
    - Full model transfer: 0.000s (0.0%)
  COMPUTATION (max across nodes):
    - Distance computation: 0.034s (64.1%)
    - Loss computation: 0.015s (28.6%)
    - Aggregation: 0.004s (7.3%)
  TOTALS:
    - Total computation: 0.053s (100.0%)
    - Total communication: 0.000s (0.0%)
    - Total parallel time: 0.053s

=== PER-NODE AVERAGE TIME ===
  - Distance computation: 0.020s
  - Loss computation: 0.009s
  - Aggregation: 0.003s
  - Model transfer: 0.000s
  - Total per node: 0.033s

=== TOTAL COMPUTATIONAL WORK (sum across all nodes) ===
  - Total distance computation: 0.409s
  - Total loss computation: 0.183s
  - Total aggregation: 0.065s
  - Total model transfer: 0.000s
  - Grand total: 0.657s
  - Mean Stage 1 acceptance rate: 0.257
  - Mean Stage 2 acceptance rate: 0.943
  - Overall acceptance rate: 0.242

UBAR Algorithm Properties:
  - Model dimension: 1,174,986
  - Rho parameter: 0.30000000000000004
  - Two-stage approach: Distance filtering + loss evaluation
  - Stage 1 selects: 30% of neighbors
  - Stage 2 uses: Training sample loss comparison
  - Theoretical complexity: O(deg(i)×d + deg(i)×inference)
  - Approach: UBAR paper implementation
