Device: cuda
Seed: 987654321
Loading 1 LEAF Sent140 train files...
LEAF Sent140 train: 254555 users, 908652 samples
Building vocabulary (max_size=10000)...
Vocabulary size: 10000
Loading 1 LEAF Sent140 test files...
LEAF Sent140 test: 254555 users, 286281 samples
Found 254555 train users, 254555 test users, 254555 common users
User sample counts range: 494 (max) to 1 (min)
Distributed ALL 254555 users across 20 clients
Users per client: 12727 (with 15 clients getting +1 user)
Train partition sizes: [44353, 44290, 44657, 44907, 44696, 45843, 45801, 45619, 45069, 45639, 45821, 45311, 45779, 46056, 45625, 45984, 46428, 44737, 45540, 46497]
Test partition sizes: [14232, 14235, 14266, 14217, 14238, 14373, 14346, 14334, 14294, 14373, 14344, 14302, 14354, 14362, 14320, 14395, 14389, 14257, 14251, 14399]
  Client 0: 44353 train samples, 2 unique classes
  Client 1: 44290 train samples, 2 unique classes
  Client 2: 44657 train samples, 2 unique classes
  Client 3: 44907 train samples, 2 unique classes
  Client 4: 44696 train samples, 2 unique classes
  Client 5: 45843 train samples, 2 unique classes
  Client 6: 45801 train samples, 2 unique classes
  Client 7: 45619 train samples, 2 unique classes
  Client 8: 45069 train samples, 2 unique classes
  Client 9: 45639 train samples, 2 unique classes
  Client 10: 45821 train samples, 2 unique classes
  Client 11: 45311 train samples, 2 unique classes
  Client 12: 45779 train samples, 2 unique classes
  Client 13: 46056 train samples, 2 unique classes
  Client 14: 45625 train samples, 2 unique classes
  Client 15: 45984 train samples, 2 unique classes
  Client 16: 46428 train samples, 2 unique classes
  Client 17: 44737 train samples, 2 unique classes
  Client 18: 45540 train samples, 2 unique classes
  Client 19: 46497 train samples, 2 unique classes
Will sample 4500 samples per client per epoch
Graph: fully, nodes: 20, edges: 190
Degree statistics: avg=19.00, min=19, max=19
Attack: Compromised 8/20 nodes: [1, 5, 11, 12, 13, 14, 17, 18]
Attack type: backdoor, lambda: 1.0
Backdoor target label: 1, trigger size: 3
Model variant: baseline
Model parameters: 1,174,986
Sketchguard Node 0:
  Model dim: 1,174,986 → Sketch size: 180
  Compression ratio: 6527.7x
  Using model parameters for aggregation, sketches for filtering
Sketchguard Node 1:
  Model dim: 1,174,986 → Sketch size: 180
  Compression ratio: 6527.7x
  Using model parameters for aggregation, sketches for filtering
Sketchguard Node 2:
  Model dim: 1,174,986 → Sketch size: 180
  Compression ratio: 6527.7x
  Using model parameters for aggregation, sketches for filtering
Sketchguard Node 3:
  Model dim: 1,174,986 → Sketch size: 180
  Compression ratio: 6527.7x
  Using model parameters for aggregation, sketches for filtering
Sketchguard Node 4:
  Model dim: 1,174,986 → Sketch size: 180
  Compression ratio: 6527.7x
  Using model parameters for aggregation, sketches for filtering
Sketchguard Node 5:
  Model dim: 1,174,986 → Sketch size: 180
  Compression ratio: 6527.7x
  Using model parameters for aggregation, sketches for filtering
Sketchguard Node 6:
  Model dim: 1,174,986 → Sketch size: 180
  Compression ratio: 6527.7x
  Using model parameters for aggregation, sketches for filtering
Sketchguard Node 7:
  Model dim: 1,174,986 → Sketch size: 180
  Compression ratio: 6527.7x
  Using model parameters for aggregation, sketches for filtering
Sketchguard Node 8:
  Model dim: 1,174,986 → Sketch size: 180
  Compression ratio: 6527.7x
  Using model parameters for aggregation, sketches for filtering
Sketchguard Node 9:
  Model dim: 1,174,986 → Sketch size: 180
  Compression ratio: 6527.7x
  Using model parameters for aggregation, sketches for filtering
Sketchguard Node 10:
  Model dim: 1,174,986 → Sketch size: 180
  Compression ratio: 6527.7x
  Using model parameters for aggregation, sketches for filtering
Sketchguard Node 11:
  Model dim: 1,174,986 → Sketch size: 180
  Compression ratio: 6527.7x
  Using model parameters for aggregation, sketches for filtering
Sketchguard Node 12:
  Model dim: 1,174,986 → Sketch size: 180
  Compression ratio: 6527.7x
  Using model parameters for aggregation, sketches for filtering
Sketchguard Node 13:
  Model dim: 1,174,986 → Sketch size: 180
  Compression ratio: 6527.7x
  Using model parameters for aggregation, sketches for filtering
Sketchguard Node 14:
  Model dim: 1,174,986 → Sketch size: 180
  Compression ratio: 6527.7x
  Using model parameters for aggregation, sketches for filtering
Sketchguard Node 15:
  Model dim: 1,174,986 → Sketch size: 180
  Compression ratio: 6527.7x
  Using model parameters for aggregation, sketches for filtering
Sketchguard Node 16:
  Model dim: 1,174,986 → Sketch size: 180
  Compression ratio: 6527.7x
  Using model parameters for aggregation, sketches for filtering
Sketchguard Node 17:
  Model dim: 1,174,986 → Sketch size: 180
  Compression ratio: 6527.7x
  Using model parameters for aggregation, sketches for filtering
Sketchguard Node 18:
  Model dim: 1,174,986 → Sketch size: 180
  Compression ratio: 6527.7x
  Using model parameters for aggregation, sketches for filtering
Sketchguard Node 19:
  Model dim: 1,174,986 → Sketch size: 180
  Compression ratio: 6527.7x
  Using model parameters for aggregation, sketches for filtering
Sketchguard ALGORITHM (Sketch-based Filtering + State Aggregation)
  - Model dimension: 1,174,986 parameters
  - Config: SketchguardConfig(gamma=2, kappa=1, alpha=0.5, min_neighbors=1, sketch_size=180, network_seed=987654321, attack_detection_window=5)
  - Sketch size: 180
  - Compression ratio: 6527.7x
  - Complexity: O(d + N×k) = O(1,174,986 + 20×180)
  - Theoretical speedup vs BALANCE: 19.9x
Initial test acc across nodes: mean=0.4953 ± 0.0174
Backdoor attack: Created poisoned datasets for 8 compromised nodes
Round 001: test acc mean=0.5116 ± 0.0084 | min=0.4980 max=0.5240
         : test loss mean=15.6496 ± 18.4058
         : individual accs = ['0.509486', '0.519564', '0.513038', '0.514595', '0.514187', '0.523342', '0.499791', '0.506976', '0.510564', '0.502192', '0.500000', '0.522235', '0.521179', '0.524022', '0.513827', '0.497951', '0.503996', '0.522410', '0.510350', '0.503160']
         : correct/total = [(7251, 14232), (7396, 14235), (7319, 14266), (7316, 14217), (7321, 14238), (7522, 14373), (7170, 14346), (7267, 14334), (7298, 14294), (7218, 14373), (7172, 14344), (7469, 14302), (7481, 14354), (7526, 14362), (7358, 14320), (7168, 14395), (7252, 14389), (7448, 14257), (7273, 14251), (7245, 14399)]
         : compromised: 0.5196, honest: 0.5063
         : sketchguard stats = ['Node 0: acc_rate=1.000', 'Node 1: acc_rate=1.000', 'Node 2: acc_rate=1.000']...
Round 002: test acc mean=0.5590 ± 0.0499 | min=0.4940 max=0.6201
         : test loss mean=199.2736 ± 253.3589
         : individual accs = ['0.611017', '0.513874', '0.590705', '0.615531', '0.602051', '0.500313', '0.593894', '0.610367', '0.597384', '0.542615', '0.604922', '0.504894', '0.496377', '0.494012', '0.500978', '0.604377', '0.578497', '0.498562', '0.499895', '0.620113']
         : correct/total = [(8696, 14232), (7315, 14235), (8427, 14266), (8751, 14217), (8572, 14238), (7191, 14373), (8520, 14346), (8749, 14334), (8539, 14294), (7799, 14373), (8677, 14344), (7221, 14302), (7125, 14354), (7095, 14362), (7174, 14320), (8700, 14395), (8324, 14389), (7108, 14257), (7124, 14251), (8929, 14399)]
         : compromised: 0.5011, honest: 0.5976
         : sketchguard stats = ['Node 0: acc_rate=0.789', 'Node 1: acc_rate=1.000', 'Node 2: acc_rate=0.789']...
Round 003: test acc mean=0.5718 ± 0.0567 | min=0.4869 max=0.6309
         : test loss mean=8466.4606 ± 11652.7946
         : individual accs = ['0.609472', '0.513031', '0.612435', '0.613491', '0.627406', '0.500870', '0.613830', '0.620901', '0.626836', '0.624087', '0.609593', '0.486925', '0.500209', '0.505431', '0.506355', '0.621466', '0.630899', '0.506067', '0.506140', '0.601083']
         : correct/total = [(8674, 14232), (7303, 14235), (8737, 14266), (8722, 14217), (8933, 14238), (7199, 14373), (8806, 14346), (8900, 14334), (8960, 14294), (8970, 14373), (8744, 14344), (6964, 14302), (7180, 14354), (7259, 14362), (7251, 14320), (8946, 14395), (9078, 14389), (7215, 14257), (7213, 14251), (8655, 14399)]
         : compromised: 0.5031, honest: 0.6176
         : sketchguard stats = ['Node 0: acc_rate=0.719', 'Node 1: acc_rate=1.000', 'Node 2: acc_rate=0.719']...
Round 004: test acc mean=0.5827 ± 0.0693 | min=0.4883 max=0.6450
         : test loss mean=3558987.2453 ± 6004210.1645
         : individual accs = ['0.638702', '0.491043', '0.624211', '0.642048', '0.641452', '0.495373', '0.643385', '0.644970', '0.637960', '0.633062', '0.633017', '0.488253', '0.494287', '0.506336', '0.512011', '0.641334', '0.643547', '0.497720', '0.500175', '0.644767']
         : correct/total = [(9090, 14232), (6990, 14235), (8905, 14266), (9128, 14217), (9133, 14238), (7120, 14373), (9230, 14346), (9245, 14334), (9119, 14294), (9099, 14373), (9080, 14344), (6983, 14302), (7095, 14354), (7272, 14362), (7332, 14320), (9232, 14395), (9260, 14389), (7096, 14257), (7128, 14251), (9284, 14399)]
         : compromised: 0.4982, honest: 0.6390
         : sketchguard stats = ['Node 0: acc_rate=0.684', 'Node 1: acc_rate=1.000', 'Node 2: acc_rate=0.684']...
Round 005: test acc mean=0.5900 ± 0.0690 | min=0.4974 max=0.6580
         : test loss mean=75066008.8827 ± 100211070.0774
         : individual accs = ['0.648187', '0.516825', '0.639563', '0.651333', '0.653392', '0.509636', '0.648543', '0.639319', '0.650203', '0.635080', '0.638664', '0.508041', '0.499234', '0.506545', '0.497416', '0.637444', '0.658003', '0.504314', '0.505649', '0.653240']
         : correct/total = [(9225, 14232), (7357, 14235), (9124, 14266), (9260, 14217), (9303, 14238), (7325, 14373), (9304, 14346), (9164, 14334), (9294, 14294), (9128, 14373), (9161, 14344), (7266, 14302), (7166, 14354), (7275, 14362), (7123, 14320), (9176, 14395), (9468, 14389), (7190, 14257), (7206, 14251), (9406, 14399)]
         : compromised: 0.5060, honest: 0.6461
         : sketchguard stats = ['Node 0: acc_rate=0.663', 'Node 1: acc_rate=1.000', 'Node 2: acc_rate=0.663']...
Round 006: test acc mean=0.5939 ± 0.0769 | min=0.4852 max=0.6618
         : test loss mean=3614635462.3405 ± 4977693331.6510
         : individual accs = ['0.655354', '0.495188', '0.646572', '0.660829', '0.649951', '0.496973', '0.661090', '0.661016', '0.658388', '0.656161', '0.647518', '0.498602', '0.488296', '0.485239', '0.516899', '0.657659', '0.661756', '0.507961', '0.512245', '0.660115']
         : correct/total = [(9327, 14232), (7049, 14235), (9224, 14266), (9395, 14217), (9254, 14238), (7143, 14373), (9484, 14346), (9475, 14334), (9411, 14294), (9431, 14373), (9288, 14344), (7131, 14302), (7009, 14354), (6969, 14362), (7402, 14320), (9467, 14395), (9522, 14389), (7242, 14257), (7300, 14251), (9505, 14399)]
         : compromised: 0.5002, honest: 0.6564
         : sketchguard stats = ['Node 0: acc_rate=0.649', 'Node 1: acc_rate=1.000', 'Node 2: acc_rate=0.649']...
Round 007: test acc mean=0.5989 ± 0.0762 | min=0.4958 max=0.6667
         : test loss mean=411797737311.4917 ± 586662813565.9962
         : individual accs = ['0.664488', '0.510783', '0.656386', '0.662306', '0.666667', '0.503931', '0.658581', '0.660597', '0.663355', '0.665832', '0.653026', '0.505104', '0.495820', '0.509261', '0.503492', '0.653143', '0.661895', '0.501368', '0.516595', '0.664491']
         : correct/total = [(9457, 14232), (7271, 14235), (9364, 14266), (9416, 14217), (9492, 14238), (7243, 14373), (9448, 14346), (9469, 14334), (9482, 14294), (9570, 14373), (9367, 14344), (7224, 14302), (7117, 14354), (7314, 14362), (7210, 14320), (9402, 14395), (9524, 14389), (7148, 14257), (7362, 14251), (9568, 14399)]
         : compromised: 0.5058, honest: 0.6609
         : sketchguard stats = ['Node 0: acc_rate=0.639', 'Node 1: acc_rate=0.857', 'Node 2: acc_rate=0.639']...
Round 008: test acc mean=0.6007 ± 0.0829 | min=0.4906 max=0.6753
         : test loss mean=32861775511337.0078 ± 43939622769699.5469
         : individual accs = ['0.667721', '0.490551', '0.658769', '0.672716', '0.667299', '0.503027', '0.671964', '0.660597', '0.672100', '0.671328', '0.664668', '0.503636', '0.493242', '0.492968', '0.505796', '0.667801', '0.675308', '0.502069', '0.503754', '0.667963']
         : correct/total = [(9503, 14232), (6983, 14235), (9398, 14266), (9564, 14217), (9501, 14238), (7230, 14373), (9640, 14346), (9469, 14334), (9607, 14294), (9649, 14373), (9534, 14344), (7203, 14302), (7080, 14354), (7080, 14362), (7243, 14320), (9613, 14395), (9717, 14389), (7158, 14257), (7179, 14251), (9618, 14399)]
         : compromised: 0.4994, honest: 0.6682
         : sketchguard stats = ['Node 0: acc_rate=0.632', 'Node 1: acc_rate=0.750', 'Node 2: acc_rate=0.632']...
Round 009: test acc mean=0.6011 ± 0.0786 | min=0.4827 max=0.6731
         : test loss mean=2667783460896549.0000 ± 3385464526827601.0000
         : individual accs = ['0.643831', '0.519986', '0.664447', '0.671590', '0.668703', '0.506297', '0.661299', '0.669527', '0.669302', '0.659918', '0.659021', '0.500909', '0.482653', '0.507659', '0.501746', '0.665856', '0.673084', '0.507891', '0.517437', '0.671644']
         : correct/total = [(9163, 14232), (7402, 14235), (9479, 14266), (9548, 14217), (9521, 14238), (7277, 14373), (9487, 14346), (9597, 14334), (9567, 14294), (9485, 14373), (9453, 14344), (7164, 14302), (6928, 14354), (7291, 14362), (7185, 14320), (9585, 14395), (9685, 14389), (7241, 14257), (7374, 14251), (9671, 14399)]
         : compromised: 0.5056, honest: 0.6649
         : sketchguard stats = ['Node 0: acc_rate=0.626', 'Node 1: acc_rate=0.667', 'Node 2: acc_rate=0.626']...
Round 010: test acc mean=0.6080 ± 0.0858 | min=0.4913 max=0.6863
         : test loss mean=315105980508813184.0000 ± 494659439879207168.0000
         : individual accs = ['0.676293', '0.503969', '0.654844', '0.680805', '0.684717', '0.504348', '0.683745', '0.679713', '0.686302', '0.677172', '0.679518', '0.500350', '0.497701', '0.491296', '0.501327', '0.671483', '0.683300', '0.526619', '0.502491', '0.673866']
         : correct/total = [(9625, 14232), (7174, 14235), (9342, 14266), (9679, 14217), (9749, 14238), (7249, 14373), (9809, 14346), (9743, 14334), (9810, 14294), (9733, 14373), (9747, 14344), (7156, 14302), (7144, 14354), (7056, 14362), (7179, 14320), (9666, 14395), (9832, 14389), (7508, 14257), (7161, 14251), (9703, 14399)]
         : compromised: 0.5035, honest: 0.6776
         : sketchguard stats = ['Node 0: acc_rate=0.621', 'Node 1: acc_rate=0.600', 'Node 2: acc_rate=0.621']...

=== FINAL RESULTS ===
Dataset: sent140, Nodes: 20, Graph: fully, Aggregation: sketchguard
Attack: backdoor, 40.0% compromised
Final accuracy - Compromised: 0.5035, Honest: 0.6776
Overall test accuracy: mean=0.6080 ± 0.0858

=== BACKDOOR ATTACK SUCCESS RATE (ASR) ===
Target label: 1
Trigger size: 3x3
Overall ASR: 0.5934 ± 0.2409
Honest nodes ASR: 0.4948 ± 0.0656
Compromised nodes ASR: 0.7413 ± 0.3196
Note: Higher ASR indicates more successful backdoor attack

=== Sketchguard SUMMARY ===
Node 0: acceptance=0.621
Node 1: acceptance=0.600
Node 2: acceptance=0.621
Node 3: acceptance=0.621
Node 4: acceptance=0.621
Node 5: acceptance=0.600
Node 6: acceptance=0.621
Node 7: acceptance=0.621
Node 8: acceptance=0.621
Node 9: acceptance=0.621
Node 10: acceptance=0.621
Node 11: acceptance=0.600
Node 12: acceptance=0.600
Node 13: acceptance=0.600
Node 14: acceptance=0.600
Node 15: acceptance=0.621
Node 16: acceptance=0.621
Node 17: acceptance=0.600
Node 18: acceptance=0.600
Node 19: acceptance=0.621

=== PARALLEL EXECUTION TIME (realistic for distributed system) ===
  COMMUNICATION (max across nodes):
    - Sketch transfer: 0.000s (0.0%)
    - Model fetch (accepted): 0.000s (0.0%)
  COMPUTATION (max across nodes):
    - Sketching: 0.506s (95.3%)
    - Filtering: 0.001s (0.2%)
    - Aggregation: 0.024s (4.5%)
  TOTALS:
    - Total computation: 0.531s (100.0%)
    - Total communication: 0.000s (0.0%)
    - Total parallel time: 0.531s

=== PER-NODE AVERAGE TIME ===
  - Sketching: 0.461s
  - Filtering: 0.001s
  - Aggregation: 0.021s
  - Sketch transfer: 0.000s
  - Model fetch: 0.000s
  - Total per node: 0.483s

=== TOTAL COMPUTATIONAL WORK (sum across all nodes) ===
  - Total sketching: 9.216s
  - Total filtering: 0.016s
  - Total aggregation: 0.419s
  - Total sketch transfer: 0.000s
  - Total model fetch: 0.000s
  - Grand total: 9.651s
  - Mean acceptance rate: 0.613

Sketchguard Algorithm Properties:
  - Original dimension: 1,174,986
  - Sketch size: 180
  - Compression ratio: 19.9x
  - Single repetition: No repetitions needed
  - Theoretical complexity: O(d + N×k)
  - Approach: Sketch filtering + state aggregation
