Device: cuda
Seed: 987654321
Loading 1 LEAF Sent140 train files...
LEAF Sent140 train: 254555 users, 908652 samples
Building vocabulary (max_size=10000)...
Vocabulary size: 10000
Loading 1 LEAF Sent140 test files...
LEAF Sent140 test: 254555 users, 286281 samples
Found 254555 train users, 254555 test users, 254555 common users
User sample counts range: 494 (max) to 1 (min)
Distributed ALL 254555 users across 20 clients
Users per client: 12727 (with 15 clients getting +1 user)
Train partition sizes: [44353, 44290, 44657, 44907, 44696, 45843, 45801, 45619, 45069, 45639, 45821, 45311, 45779, 46056, 45625, 45984, 46428, 44737, 45540, 46497]
Test partition sizes: [14232, 14235, 14266, 14217, 14238, 14373, 14346, 14334, 14294, 14373, 14344, 14302, 14354, 14362, 14320, 14395, 14389, 14257, 14251, 14399]
  Client 0: 44353 train samples, 2 unique classes
  Client 1: 44290 train samples, 2 unique classes
  Client 2: 44657 train samples, 2 unique classes
  Client 3: 44907 train samples, 2 unique classes
  Client 4: 44696 train samples, 2 unique classes
  Client 5: 45843 train samples, 2 unique classes
  Client 6: 45801 train samples, 2 unique classes
  Client 7: 45619 train samples, 2 unique classes
  Client 8: 45069 train samples, 2 unique classes
  Client 9: 45639 train samples, 2 unique classes
  Client 10: 45821 train samples, 2 unique classes
  Client 11: 45311 train samples, 2 unique classes
  Client 12: 45779 train samples, 2 unique classes
  Client 13: 46056 train samples, 2 unique classes
  Client 14: 45625 train samples, 2 unique classes
  Client 15: 45984 train samples, 2 unique classes
  Client 16: 46428 train samples, 2 unique classes
  Client 17: 44737 train samples, 2 unique classes
  Client 18: 45540 train samples, 2 unique classes
  Client 19: 46497 train samples, 2 unique classes
Will sample 4500 samples per client per epoch
Graph: erdos, nodes: 20, edges: 126
Degree statistics: avg=12.60, min=8, max=16
Attack: Compromised 6/20 nodes: [5, 12, 13, 14, 17, 18]
Attack type: backdoor, lambda: 1.0
Backdoor target label: 1, trigger size: 3
Model variant: baseline
Model parameters: 1,174,986
Initial test acc across nodes: mean=0.4953 ± 0.0174
Backdoor attack: Created poisoned datasets for 6 compromised nodes
Round 001: test acc mean=0.5009 ± 0.0052 | min=0.4879 max=0.5116
         : test loss mean=23.4432 ± 8.5932
         : individual accs = ['0.509345', '0.502143', '0.503365', '0.499894', '0.511589', '0.502331', '0.503764', '0.501186', '0.493284', '0.496556', '0.498885', '0.500350', '0.502647', '0.487885', '0.496229', '0.498090', '0.499340', '0.505506', '0.505368', '0.499618']
         : correct/total = [(7249, 14232), (7148, 14235), (7181, 14266), (7107, 14217), (7284, 14238), (7220, 14373), (7227, 14346), (7184, 14334), (7051, 14294), (7137, 14373), (7156, 14344), (7156, 14302), (7215, 14354), (7007, 14362), (7106, 14320), (7170, 14395), (7185, 14389), (7207, 14257), (7202, 14251), (7194, 14399)]
         : compromised: 0.5000, honest: 0.5012
Round 002: test acc mean=0.5086 ± 0.0051 | min=0.4978 max=0.5157
         : test loss mean=3.4707 ± 6.4502
         : individual accs = ['0.509767', '0.515701', '0.507641', '0.514314', '0.514258', '0.509914', '0.506134', '0.501256', '0.497761', '0.507271', '0.501394', '0.503916', '0.513028', '0.504874', '0.512919', '0.514067', '0.502745', '0.514554', '0.510701', '0.509271']
         : correct/total = [(7255, 14232), (7341, 14235), (7242, 14266), (7312, 14217), (7322, 14238), (7329, 14373), (7261, 14346), (7185, 14334), (7115, 14294), (7291, 14373), (7192, 14344), (7207, 14302), (7364, 14354), (7251, 14362), (7345, 14320), (7400, 14395), (7234, 14389), (7336, 14257), (7278, 14251), (7333, 14399)]
         : compromised: 0.5110, honest: 0.5075
Round 003: test acc mean=0.5010 ± 0.0050 | min=0.4899 max=0.5113
         : test loss mean=1.4971 ± 2.7981
         : individual accs = ['0.506394', '0.489919', '0.495724', '0.509812', '0.506532', '0.498226', '0.498676', '0.502163', '0.498181', '0.497043', '0.500488', '0.501888', '0.506131', '0.511349', '0.497137', '0.500313', '0.498575', '0.503262', '0.498842', '0.498854']
         : correct/total = [(7207, 14232), (6974, 14235), (7072, 14266), (7248, 14217), (7212, 14238), (7161, 14373), (7154, 14346), (7198, 14334), (7121, 14294), (7144, 14373), (7179, 14344), (7178, 14302), (7265, 14354), (7344, 14362), (7119, 14320), (7202, 14395), (7174, 14389), (7175, 14257), (7109, 14251), (7183, 14399)]
         : compromised: 0.5025, honest: 0.5003
Round 004: test acc mean=0.4969 ± 0.0119 | min=0.4790 max=0.5219
         : test loss mean=1.1579 ± 1.6374
         : individual accs = ['0.492201', '0.478960', '0.484929', '0.480762', '0.490518', '0.497878', '0.521888', '0.489187', '0.515951', '0.494747', '0.493656', '0.493218', '0.494914', '0.497772', '0.487919', '0.519416', '0.515255', '0.500736', '0.490913', '0.498021']
         : correct/total = [(7005, 14232), (6818, 14235), (6918, 14266), (6835, 14217), (6984, 14238), (7156, 14373), (7487, 14346), (7012, 14334), (7375, 14294), (7111, 14373), (7081, 14344), (7054, 14302), (7104, 14354), (7149, 14362), (6987, 14320), (7477, 14395), (7414, 14389), (7139, 14257), (6996, 14251), (7171, 14399)]
         : compromised: 0.4950, honest: 0.4978
Round 005: test acc mean=0.4998 ± 0.0050 | min=0.4856 max=0.5062
         : test loss mean=1.7775 ± 4.3589
         : individual accs = ['0.499789', '0.505374', '0.504486', '0.485616', '0.505619', '0.490155', '0.500627', '0.496721', '0.501679', '0.498643', '0.500976', '0.502727', '0.502508', '0.501601', '0.496089', '0.495450', '0.506151', '0.503402', '0.500667', '0.497465']
         : correct/total = [(7113, 14232), (7194, 14235), (7197, 14266), (6904, 14217), (7199, 14238), (7045, 14373), (7182, 14346), (7120, 14334), (7171, 14294), (7167, 14373), (7186, 14344), (7190, 14302), (7213, 14354), (7204, 14362), (7104, 14320), (7132, 14395), (7283, 14389), (7177, 14257), (7135, 14251), (7163, 14399)]
         : compromised: 0.4991, honest: 0.5001
Round 006: test acc mean=0.5058 ± 0.0050 | min=0.4967 max=0.5166
         : test loss mean=3.5216 ± 12.1301
         : individual accs = ['0.504356', '0.497787', '0.502033', '0.496659', '0.505127', '0.506644', '0.507737', '0.506907', '0.501959', '0.500522', '0.510039', '0.507132', '0.513794', '0.516641', '0.501117', '0.507329', '0.509834', '0.504945', '0.503894', '0.511911']
         : correct/total = [(7178, 14232), (7086, 14235), (7162, 14266), (7061, 14217), (7192, 14238), (7282, 14373), (7284, 14346), (7266, 14334), (7175, 14294), (7194, 14373), (7316, 14344), (7253, 14302), (7375, 14354), (7420, 14362), (7176, 14320), (7303, 14395), (7336, 14389), (7199, 14257), (7181, 14251), (7371, 14399)]
         : compromised: 0.5078, honest: 0.5050
Round 007: test acc mean=0.5195 ± 0.0105 | min=0.4967 max=0.5326
         : test loss mean=1.6100 ± 3.9171
         : individual accs = ['0.525576', '0.532209', '0.523903', '0.496729', '0.521351', '0.532596', '0.506483', '0.510395', '0.497901', '0.529048', '0.506553', '0.530206', '0.519646', '0.519008', '0.518366', '0.529073', '0.525471', '0.514765', '0.523753', '0.526148']
         : correct/total = [(7480, 14232), (7576, 14235), (7474, 14266), (7062, 14217), (7423, 14238), (7655, 14373), (7266, 14346), (7316, 14334), (7117, 14294), (7604, 14373), (7266, 14344), (7583, 14302), (7459, 14354), (7454, 14362), (7423, 14320), (7616, 14395), (7561, 14389), (7339, 14257), (7464, 14251), (7576, 14399)]
         : compromised: 0.5214, honest: 0.5186
Round 008: test acc mean=0.5061 ± 0.0089 | min=0.4931 max=0.5247
         : test loss mean=1.9215 ± 5.2078
         : individual accs = ['0.501897', '0.493080', '0.493831', '0.503411', '0.500421', '0.511654', '0.520772', '0.514162', '0.499860', '0.500313', '0.517568', '0.500210', '0.524662', '0.509678', '0.497835', '0.502327', '0.501147', '0.519254', '0.500947', '0.508855']
         : correct/total = [(7143, 14232), (7019, 14235), (7045, 14266), (7157, 14217), (7125, 14238), (7354, 14373), (7471, 14346), (7370, 14334), (7145, 14294), (7191, 14373), (7424, 14344), (7154, 14302), (7531, 14354), (7320, 14362), (7129, 14320), (7231, 14395), (7211, 14389), (7403, 14257), (7139, 14251), (7327, 14399)]
         : compromised: 0.5107, honest: 0.5041
Round 009: test acc mean=0.5063 ± 0.0071 | min=0.4961 max=0.5282
         : test loss mean=3.8381 ± 13.6430
         : individual accs = ['0.500211', '0.503688', '0.496075', '0.496237', '0.502880', '0.507410', '0.508853', '0.504744', '0.498181', '0.504140', '0.512270', '0.505104', '0.513446', '0.515736', '0.502584', '0.505592', '0.506776', '0.528162', '0.506771', '0.506980']
         : correct/total = [(7119, 14232), (7170, 14235), (7077, 14266), (7055, 14217), (7160, 14238), (7293, 14373), (7300, 14346), (7235, 14334), (7121, 14294), (7246, 14373), (7348, 14344), (7224, 14302), (7370, 14354), (7407, 14362), (7197, 14320), (7278, 14395), (7292, 14389), (7530, 14257), (7222, 14251), (7300, 14399)]
         : compromised: 0.5124, honest: 0.5037
Round 010: test acc mean=0.5039 ± 0.0073 | min=0.4952 max=0.5297
         : test loss mean=2.3827 ± 7.3091
         : individual accs = ['0.498806', '0.495961', '0.495233', '0.496940', '0.503301', '0.503235', '0.508016', '0.500698', '0.501049', '0.504001', '0.503486', '0.500280', '0.508221', '0.509609', '0.499441', '0.529698', '0.511432', '0.501578', '0.505438', '0.502465']
         : correct/total = [(7099, 14232), (7060, 14235), (7065, 14266), (7065, 14217), (7166, 14238), (7233, 14373), (7288, 14346), (7177, 14334), (7162, 14294), (7244, 14373), (7222, 14344), (7155, 14302), (7295, 14354), (7319, 14362), (7152, 14320), (7625, 14395), (7359, 14389), (7151, 14257), (7203, 14251), (7235, 14399)]
         : compromised: 0.5046, honest: 0.5037

=== FINAL RESULTS ===
Dataset: sent140, Nodes: 20, Graph: erdos, Aggregation: krum
Attack: backdoor, 30.0% compromised
Final accuracy - Compromised: 0.5046, Honest: 0.5037
Overall test accuracy: mean=0.5039 ± 0.0073

=== BACKDOOR ATTACK SUCCESS RATE (ASR) ===
Target label: 1
Trigger size: 3x3
Overall ASR: 0.6242 ± 0.1833
Honest nodes ASR: 0.5981 ± 0.2137
Compromised nodes ASR: 0.6853 ± 0.0078
Note: Higher ASR indicates more successful backdoor attack
