Device: cuda
Seed: 987654321
Loading 1 LEAF Sent140 train files...
LEAF Sent140 train: 254555 users, 908652 samples
Building vocabulary (max_size=10000)...
Vocabulary size: 10000
Loading 1 LEAF Sent140 test files...
LEAF Sent140 test: 254555 users, 286281 samples
Found 254555 train users, 254555 test users, 254555 common users
User sample counts range: 494 (max) to 1 (min)
Distributed ALL 254555 users across 20 clients
Users per client: 12727 (with 15 clients getting +1 user)
Train partition sizes: [44353, 44290, 44657, 44907, 44696, 45843, 45801, 45619, 45069, 45639, 45821, 45311, 45779, 46056, 45625, 45984, 46428, 44737, 45540, 46497]
Test partition sizes: [14232, 14235, 14266, 14217, 14238, 14373, 14346, 14334, 14294, 14373, 14344, 14302, 14354, 14362, 14320, 14395, 14389, 14257, 14251, 14399]
  Client 0: 44353 train samples, 2 unique classes
  Client 1: 44290 train samples, 2 unique classes
  Client 2: 44657 train samples, 2 unique classes
  Client 3: 44907 train samples, 2 unique classes
  Client 4: 44696 train samples, 2 unique classes
  Client 5: 45843 train samples, 2 unique classes
  Client 6: 45801 train samples, 2 unique classes
  Client 7: 45619 train samples, 2 unique classes
  Client 8: 45069 train samples, 2 unique classes
  Client 9: 45639 train samples, 2 unique classes
  Client 10: 45821 train samples, 2 unique classes
  Client 11: 45311 train samples, 2 unique classes
  Client 12: 45779 train samples, 2 unique classes
  Client 13: 46056 train samples, 2 unique classes
  Client 14: 45625 train samples, 2 unique classes
  Client 15: 45984 train samples, 2 unique classes
  Client 16: 46428 train samples, 2 unique classes
  Client 17: 44737 train samples, 2 unique classes
  Client 18: 45540 train samples, 2 unique classes
  Client 19: 46497 train samples, 2 unique classes
Will sample 4500 samples per client per epoch
Graph: fully, nodes: 20, edges: 190
Degree statistics: avg=19.00, min=19, max=19
Attack: Compromised 8/20 nodes: [1, 5, 11, 12, 13, 14, 17, 18]
Attack type: directed_deviation, lambda: 1.0
Model variant: baseline
Model parameters: 1,174,986
Initial test acc across nodes: mean=0.4965 ± 0.0152
Round 001: test acc mean=0.5010 ± 0.0084 | min=0.4835 max=0.5134
         : test loss mean=3.9442 ± 1.1079
         : individual accs = ['0.510891', '0.488655', '0.483527', '0.488078', '0.509903', '0.494121', '0.509341', '0.501744', '0.507346', '0.513393', '0.501603', '0.504125', '0.488366', '0.494987', '0.502374', '0.503300', '0.501286', '0.502280', '0.509298', '0.505035']
         : correct/total = [(7271, 14232), (6956, 14235), (6898, 14266), (6939, 14217), (7260, 14238), (7102, 14373), (7307, 14346), (7192, 14334), (7252, 14294), (7379, 14373), (7195, 14344), (7210, 14302), (7010, 14354), (7109, 14362), (7194, 14320), (7245, 14395), (7213, 14389), (7161, 14257), (7258, 14251), (7272, 14399)]
         : compromised: 0.4980, honest: 0.5030
Round 002: test acc mean=0.5005 ± 0.0059 | min=0.4883 max=0.5168
         : test loss mean=3.7980 ± 0.0528
         : individual accs = ['0.498946', '0.495258', '0.488294', '0.497714', '0.497120', '0.502748', '0.501324', '0.497488', '0.497202', '0.498017', '0.503486', '0.494057', '0.497910', '0.516780', '0.508240', '0.503022', '0.507540', '0.505366', '0.499474', '0.499201']
         : correct/total = [(7101, 14232), (7050, 14235), (6966, 14266), (7076, 14217), (7078, 14238), (7226, 14373), (7192, 14346), (7131, 14334), (7107, 14294), (7158, 14373), (7222, 14344), (7066, 14302), (7147, 14354), (7422, 14362), (7278, 14320), (7241, 14395), (7303, 14389), (7205, 14257), (7118, 14251), (7188, 14399)]
         : compromised: 0.5025, honest: 0.4991
Round 003: test acc mean=0.4963 ± 0.0056 | min=0.4830 max=0.5044
         : test loss mean=0.7612 ± 0.0029
         : individual accs = ['0.501194', '0.502494', '0.504416', '0.503130', '0.491572', '0.495512', '0.496375', '0.494698', '0.502658', '0.496904', '0.493935', '0.498392', '0.488993', '0.483011', '0.501397', '0.491282', '0.492599', '0.491197', '0.503403', '0.492395']
         : correct/total = [(7133, 14232), (7153, 14235), (7196, 14266), (7153, 14217), (6999, 14238), (7122, 14373), (7121, 14346), (7091, 14334), (7185, 14294), (7142, 14373), (7085, 14344), (7128, 14302), (7019, 14354), (6937, 14362), (7180, 14320), (7072, 14395), (7088, 14389), (7003, 14257), (7174, 14251), (7090, 14399)]
         : compromised: 0.4955, honest: 0.4968
Round 004: test acc mean=0.5019 ± 0.0035 | min=0.4944 max=0.5112
         : test loss mean=1.3292 ± 0.0107
         : individual accs = ['0.500984', '0.494415', '0.501262', '0.505170', '0.502037', '0.511236', '0.500976', '0.500977', '0.504617', '0.500800', '0.497699', '0.505803', '0.499443', '0.499025', '0.502165', '0.503994', '0.505178', '0.502981', '0.498281', '0.500382']
         : correct/total = [(7130, 14232), (7038, 14235), (7151, 14266), (7182, 14217), (7148, 14238), (7348, 14373), (7187, 14346), (7181, 14334), (7213, 14294), (7198, 14373), (7139, 14344), (7234, 14302), (7169, 14354), (7167, 14362), (7191, 14320), (7255, 14395), (7269, 14389), (7171, 14257), (7101, 14251), (7205, 14399)]
         : compromised: 0.5017, honest: 0.5020
Round 005: test acc mean=0.5268 ± 0.0038 | min=0.5195 max=0.5341
         : test loss mean=0.6982 ± 0.0017
         : individual accs = ['0.526279', '0.520478', '0.522151', '0.522192', '0.527040', '0.525151', '0.525931', '0.530278', '0.525395', '0.525638', '0.528095', '0.533632', '0.526055', '0.530428', '0.527095', '0.528239', '0.528598', '0.530617', '0.519542', '0.534134']
         : correct/total = [(7490, 14232), (7409, 14235), (7449, 14266), (7424, 14217), (7504, 14238), (7548, 14373), (7545, 14346), (7601, 14334), (7510, 14294), (7555, 14373), (7575, 14344), (7632, 14302), (7551, 14354), (7618, 14362), (7548, 14320), (7604, 14395), (7606, 14389), (7565, 14257), (7404, 14251), (7691, 14399)]
         : compromised: 0.5266, honest: 0.5270
Round 006: test acc mean=0.5058 ± 0.0044 | min=0.4932 max=0.5128
         : test loss mean=0.9217 ± 0.0081
         : individual accs = ['0.509837', '0.511697', '0.507570', '0.507210', '0.507515', '0.507201', '0.505786', '0.506907', '0.505037', '0.512767', '0.502091', '0.508321', '0.499930', '0.493246', '0.503003', '0.505662', '0.506985', '0.507891', '0.499404', '0.508438']
         : correct/total = [(7256, 14232), (7284, 14235), (7241, 14266), (7211, 14217), (7226, 14238), (7290, 14373), (7256, 14346), (7266, 14334), (7219, 14294), (7370, 14373), (7202, 14344), (7270, 14302), (7176, 14354), (7084, 14362), (7203, 14320), (7279, 14395), (7295, 14389), (7241, 14257), (7117, 14251), (7321, 14399)]
         : compromised: 0.5038, honest: 0.5072
Round 007: test acc mean=0.5320 ± 0.0052 | min=0.5202 max=0.5414
         : test loss mean=0.7049 ± 0.0035
         : individual accs = ['0.520236', '0.530102', '0.527268', '0.533938', '0.537435', '0.531761', '0.535132', '0.529720', '0.528334', '0.529395', '0.532418', '0.527269', '0.539850', '0.541429', '0.533450', '0.534144', '0.534923', '0.535176', '0.522419', '0.536009']
         : correct/total = [(7404, 14232), (7546, 14235), (7522, 14266), (7591, 14217), (7652, 14238), (7643, 14373), (7677, 14346), (7593, 14334), (7552, 14294), (7609, 14373), (7637, 14344), (7541, 14302), (7749, 14354), (7776, 14362), (7639, 14320), (7689, 14395), (7697, 14389), (7630, 14257), (7445, 14251), (7718, 14399)]
         : compromised: 0.5327, honest: 0.5316
Round 008: test acc mean=0.5144 ± 0.0041 | min=0.5068 max=0.5197
         : test loss mean=0.7726 ± 0.0050
         : individual accs = ['0.514755', '0.511837', '0.508832', '0.509531', '0.518612', '0.519724', '0.518960', '0.508023', '0.516720', '0.518333', '0.509551', '0.516641', '0.518183', '0.515945', '0.516341', '0.518027', '0.510737', '0.517500', '0.506771', '0.512952']
         : correct/total = [(7326, 14232), (7286, 14235), (7259, 14266), (7244, 14217), (7384, 14238), (7470, 14373), (7445, 14346), (7282, 14334), (7386, 14294), (7450, 14373), (7309, 14344), (7389, 14302), (7438, 14354), (7410, 14362), (7394, 14320), (7457, 14395), (7349, 14389), (7378, 14257), (7222, 14251), (7386, 14399)]
         : compromised: 0.5154, honest: 0.5138
Round 009: test acc mean=0.5715 ± 0.0056 | min=0.5626 max=0.5833
         : test loss mean=0.6823 ± 0.0040
         : individual accs = ['0.567945', '0.566351', '0.562596', '0.581698', '0.571569', '0.575106', '0.576328', '0.566974', '0.566741', '0.568496', '0.573550', '0.568732', '0.575728', '0.583345', '0.570182', '0.564432', '0.574884', '0.575857', '0.564592', '0.575734']
         : correct/total = [(8083, 14232), (8062, 14235), (8026, 14266), (8270, 14217), (8138, 14238), (8266, 14373), (8268, 14346), (8127, 14334), (8101, 14294), (8171, 14373), (8227, 14344), (8134, 14302), (8264, 14354), (8378, 14362), (8165, 14320), (8125, 14395), (8272, 14389), (8210, 14257), (8046, 14251), (8290, 14399)]
         : compromised: 0.5725, honest: 0.5709
Round 010: test acc mean=0.5215 ± 0.0043 | min=0.5112 max=0.5305
         : test loss mean=0.7285 ± 0.0030
         : individual accs = ['0.517707', '0.516895', '0.520889', '0.520222', '0.520228', '0.522438', '0.520563', '0.520301', '0.520218', '0.522229', '0.525376', '0.522794', '0.528912', '0.521306', '0.527165', '0.530531', '0.521926', '0.523111', '0.511192', '0.515244']
         : correct/total = [(7368, 14232), (7358, 14235), (7431, 14266), (7396, 14217), (7407, 14238), (7509, 14373), (7468, 14346), (7458, 14334), (7436, 14294), (7506, 14373), (7536, 14344), (7477, 14302), (7592, 14354), (7487, 14362), (7549, 14320), (7637, 14395), (7510, 14389), (7458, 14257), (7285, 14251), (7419, 14399)]
         : compromised: 0.5217, honest: 0.5213

=== FINAL RESULTS ===
Dataset: sent140, Nodes: 20, Graph: fully, Aggregation: d-fedavg
Attack: directed_deviation, 40.0% compromised
Final accuracy - Compromised: 0.5217, Honest: 0.5213
Overall test accuracy: mean=0.5215 ± 0.0043
