Device: cuda
Seed: 987654321
Loading 1 LEAF Sent140 train files...
LEAF Sent140 train: 254555 users, 908652 samples
Building vocabulary (max_size=10000)...
Vocabulary size: 10000
Loading 1 LEAF Sent140 test files...
LEAF Sent140 test: 254555 users, 286281 samples
Found 254555 train users, 254555 test users, 254555 common users
User sample counts range: 494 (max) to 1 (min)
Distributed ALL 254555 users across 20 clients
Users per client: 12727 (with 15 clients getting +1 user)
Train partition sizes: [44353, 44290, 44657, 44907, 44696, 45843, 45801, 45619, 45069, 45639, 45821, 45311, 45779, 46056, 45625, 45984, 46428, 44737, 45540, 46497]
Test partition sizes: [14232, 14235, 14266, 14217, 14238, 14373, 14346, 14334, 14294, 14373, 14344, 14302, 14354, 14362, 14320, 14395, 14389, 14257, 14251, 14399]
  Client 0: 44353 train samples, 2 unique classes
  Client 1: 44290 train samples, 2 unique classes
  Client 2: 44657 train samples, 2 unique classes
  Client 3: 44907 train samples, 2 unique classes
  Client 4: 44696 train samples, 2 unique classes
  Client 5: 45843 train samples, 2 unique classes
  Client 6: 45801 train samples, 2 unique classes
  Client 7: 45619 train samples, 2 unique classes
  Client 8: 45069 train samples, 2 unique classes
  Client 9: 45639 train samples, 2 unique classes
  Client 10: 45821 train samples, 2 unique classes
  Client 11: 45311 train samples, 2 unique classes
  Client 12: 45779 train samples, 2 unique classes
  Client 13: 46056 train samples, 2 unique classes
  Client 14: 45625 train samples, 2 unique classes
  Client 15: 45984 train samples, 2 unique classes
  Client 16: 46428 train samples, 2 unique classes
  Client 17: 44737 train samples, 2 unique classes
  Client 18: 45540 train samples, 2 unique classes
  Client 19: 46497 train samples, 2 unique classes
Will sample 4500 samples per client per epoch
Graph: ring, nodes: 20, edges: 20
Degree statistics: avg=2.00, min=2, max=2
Attack: Compromised 12/20 nodes: [1, 2, 3, 5, 8, 11, 12, 13, 14, 15, 17, 18]
Attack type: directed_deviation, lambda: 1.0
Model variant: baseline
Model parameters: 1,174,986
Initial test acc across nodes: mean=0.4953 ± 0.0174
Round 001: test acc mean=0.4985 ± 0.0061 | min=0.4858 max=0.5144
         : test loss mean=9.6358 ± 5.8134
         : individual accs = ['0.499227', '0.514366', '0.497126', '0.485827', '0.495856', '0.499061', '0.494702', '0.502442', '0.506576', '0.503374', '0.496026', '0.494127', '0.497840', '0.502785', '0.503631', '0.494408', '0.495448', '0.497440', '0.501368', '0.488923']
         : correct/total = [(7105, 14232), (7322, 14235), (7092, 14266), (6907, 14217), (7060, 14238), (7173, 14373), (7097, 14346), (7202, 14334), (7241, 14294), (7235, 14373), (7115, 14344), (7067, 14302), (7146, 14354), (7221, 14362), (7212, 14320), (7117, 14395), (7129, 14389), (7092, 14257), (7145, 14251), (7040, 14399)]
         : compromised: 0.4995, honest: 0.4970
Round 002: test acc mean=0.4944 ± 0.0053 | min=0.4824 max=0.5044
         : test loss mean=11.3538 ± 6.6782
         : individual accs = ['0.489531', '0.482403', '0.486471', '0.484912', '0.494732', '0.495930', '0.496166', '0.488489', '0.499370', '0.496626', '0.497072', '0.496364', '0.499373', '0.504387', '0.494972', '0.497951', '0.496212', '0.497791', '0.494772', '0.494895']
         : correct/total = [(6967, 14232), (6867, 14235), (6940, 14266), (6894, 14217), (7044, 14238), (7128, 14373), (7118, 14346), (7002, 14334), (7138, 14294), (7138, 14373), (7130, 14344), (7099, 14302), (7168, 14354), (7244, 14362), (7088, 14320), (7168, 14395), (7140, 14389), (7097, 14257), (7051, 14251), (7126, 14399)]
         : compromised: 0.4946, honest: 0.4942
Round 003: test acc mean=0.5047 ± 0.0053 | min=0.4964 max=0.5154
         : test loss mean=3.5474 ± 1.9825
         : individual accs = ['0.506043', '0.503618', '0.513739', '0.515088', '0.505478', '0.504140', '0.500488', '0.507255', '0.501749', '0.505670', '0.502858', '0.508810', '0.506758', '0.499234', '0.515433', '0.499201', '0.500104', '0.500877', '0.496386', '0.500174']
         : correct/total = [(7202, 14232), (7169, 14235), (7329, 14266), (7323, 14217), (7197, 14238), (7246, 14373), (7180, 14346), (7271, 14334), (7172, 14294), (7268, 14373), (7213, 14344), (7277, 14302), (7274, 14354), (7170, 14362), (7381, 14320), (7186, 14395), (7196, 14389), (7141, 14257), (7074, 14251), (7202, 14399)]
         : compromised: 0.5054, honest: 0.5035
Round 004: test acc mean=0.4970 ± 0.0064 | min=0.4850 max=0.5132
         : test loss mean=3.8070 ± 3.3725
         : individual accs = ['0.492060', '0.489287', '0.491378', '0.484983', '0.494171', '0.495860', '0.499721', '0.493233', '0.494963', '0.495791', '0.497351', '0.491679', '0.513167', '0.506336', '0.503771', '0.502327', '0.503093', '0.500807', '0.496948', '0.493993']
         : correct/total = [(7003, 14232), (6965, 14235), (7010, 14266), (6895, 14217), (7036, 14238), (7127, 14373), (7169, 14346), (7070, 14334), (7075, 14294), (7126, 14373), (7134, 14344), (7032, 14302), (7366, 14354), (7272, 14362), (7214, 14320), (7231, 14395), (7239, 14389), (7140, 14257), (7082, 14251), (7113, 14399)]
         : compromised: 0.4976, honest: 0.4962
Round 005: test acc mean=0.5052 ± 0.0087 | min=0.4858 max=0.5199
         : test loss mean=2.4887 ± 2.3821
         : individual accs = ['0.502530', '0.517457', '0.504276', '0.515158', '0.505408', '0.498574', '0.514917', '0.519883', '0.499230', '0.519168', '0.509621', '0.503216', '0.485788', '0.490043', '0.500489', '0.502258', '0.505039', '0.504103', '0.505789', '0.500799']
         : correct/total = [(7152, 14232), (7366, 14235), (7194, 14266), (7324, 14217), (7196, 14238), (7166, 14373), (7387, 14346), (7452, 14334), (7136, 14294), (7462, 14373), (7310, 14344), (7197, 14302), (6973, 14354), (7038, 14362), (7167, 14320), (7230, 14395), (7267, 14389), (7187, 14257), (7208, 14251), (7211, 14399)]
         : compromised: 0.5022, honest: 0.5097
Round 006: test acc mean=0.4994 ± 0.0087 | min=0.4809 max=0.5146
         : test loss mean=3.4492 ± 3.7897
         : individual accs = ['0.493395', '0.480857', '0.491378', '0.484912', '0.494662', '0.498295', '0.510944', '0.514581', '0.496712', '0.507410', '0.510597', '0.495315', '0.505713', '0.505222', '0.491061', '0.507190', '0.503440', '0.500526', '0.494141', '0.501424']
         : correct/total = [(7022, 14232), (6845, 14235), (7010, 14266), (6894, 14217), (7043, 14238), (7162, 14373), (7330, 14346), (7376, 14334), (7100, 14294), (7293, 14373), (7324, 14344), (7084, 14302), (7259, 14354), (7256, 14362), (7032, 14320), (7301, 14395), (7244, 14389), (7136, 14257), (7042, 14251), (7220, 14399)]
         : compromised: 0.4959, honest: 0.5046
Round 007: test acc mean=0.5089 ± 0.0091 | min=0.4946 max=0.5279
         : test loss mean=2.3952 ± 2.3316
         : individual accs = ['0.506956', '0.510783', '0.510725', '0.515299', '0.504916', '0.502748', '0.527882', '0.523650', '0.503708', '0.523621', '0.523982', '0.502657', '0.498189', '0.494569', '0.506564', '0.502119', '0.506846', '0.503893', '0.506561', '0.502257']
         : correct/total = [(7215, 14232), (7271, 14235), (7286, 14266), (7326, 14217), (7189, 14238), (7226, 14373), (7573, 14346), (7506, 14334), (7200, 14294), (7526, 14373), (7516, 14344), (7189, 14302), (7151, 14354), (7103, 14362), (7254, 14320), (7228, 14395), (7293, 14389), (7184, 14257), (7219, 14251), (7232, 14399)]
         : compromised: 0.5048, honest: 0.5150
Round 008: test acc mean=0.5037 ± 0.0149 | min=0.4823 max=0.5394
         : test loss mean=3.0801 ± 3.2292
         : individual accs = ['0.496908', '0.482262', '0.485700', '0.484912', '0.494522', '0.497600', '0.539384', '0.537115', '0.497272', '0.514854', '0.515547', '0.494406', '0.501602', '0.510375', '0.494064', '0.514276', '0.505386', '0.509434', '0.494562', '0.504479']
         : correct/total = [(7072, 14232), (6865, 14235), (6929, 14266), (6894, 14217), (7041, 14238), (7152, 14373), (7738, 14346), (7699, 14334), (7108, 14294), (7400, 14373), (7395, 14344), (7071, 14302), (7200, 14354), (7330, 14362), (7075, 14320), (7403, 14395), (7272, 14389), (7263, 14257), (7048, 14251), (7264, 14399)]
         : compromised: 0.4972, honest: 0.5135
Round 009: test acc mean=0.5113 ± 0.0149 | min=0.4927 max=0.5515
         : test loss mean=2.2533 ± 2.1260
         : individual accs = ['0.521501', '0.517387', '0.510725', '0.514666', '0.505549', '0.492660', '0.513523', '0.508651', '0.504967', '0.549990', '0.551450', '0.501608', '0.499721', '0.494778', '0.505377', '0.502466', '0.506359', '0.504314', '0.504947', '0.515452']
         : correct/total = [(7422, 14232), (7365, 14235), (7286, 14266), (7317, 14217), (7198, 14238), (7081, 14373), (7367, 14346), (7291, 14334), (7218, 14294), (7905, 14373), (7910, 14344), (7174, 14302), (7173, 14354), (7106, 14362), (7237, 14320), (7233, 14395), (7286, 14389), (7190, 14257), (7196, 14251), (7422, 14399)]
         : compromised: 0.5045, honest: 0.5216
Round 010: test acc mean=0.5011 ± 0.0129 | min=0.4839 max=0.5322
         : test loss mean=3.1116 ± 3.2466
         : individual accs = ['0.493325', '0.483878', '0.492359', '0.484983', '0.494592', '0.497252', '0.517566', '0.519953', '0.490765', '0.532178', '0.525655', '0.498112', '0.506061', '0.508146', '0.494972', '0.498715', '0.493780', '0.496318', '0.494211', '0.499479']
         : correct/total = [(7021, 14232), (6888, 14235), (7024, 14266), (6895, 14217), (7042, 14238), (7147, 14373), (7425, 14346), (7453, 14334), (7015, 14294), (7649, 14373), (7540, 14344), (7124, 14302), (7264, 14354), (7298, 14362), (7088, 14320), (7179, 14395), (7105, 14389), (7076, 14257), (7043, 14251), (7192, 14399)]
         : compromised: 0.4955, honest: 0.5096

=== FINAL RESULTS ===
Dataset: sent140, Nodes: 20, Graph: ring, Aggregation: d-fedavg
Attack: directed_deviation, 60.0% compromised
Final accuracy - Compromised: 0.4955, Honest: 0.5096
Overall test accuracy: mean=0.5011 ± 0.0129
