Device: cuda
Seed: 987654321
Loading 1 LEAF Sent140 train files...
LEAF Sent140 train: 254555 users, 908652 samples
Building vocabulary (max_size=10000)...
Vocabulary size: 10000
Loading 1 LEAF Sent140 test files...
LEAF Sent140 test: 254555 users, 286281 samples
Found 254555 train users, 254555 test users, 254555 common users
User sample counts range: 494 (max) to 1 (min)
Distributed ALL 254555 users across 20 clients
Users per client: 12727 (with 15 clients getting +1 user)
Train partition sizes: [44353, 44290, 44657, 44907, 44696, 45843, 45801, 45619, 45069, 45639, 45821, 45311, 45779, 46056, 45625, 45984, 46428, 44737, 45540, 46497]
Test partition sizes: [14232, 14235, 14266, 14217, 14238, 14373, 14346, 14334, 14294, 14373, 14344, 14302, 14354, 14362, 14320, 14395, 14389, 14257, 14251, 14399]
  Client 0: 44353 train samples, 2 unique classes
  Client 1: 44290 train samples, 2 unique classes
  Client 2: 44657 train samples, 2 unique classes
  Client 3: 44907 train samples, 2 unique classes
  Client 4: 44696 train samples, 2 unique classes
  Client 5: 45843 train samples, 2 unique classes
  Client 6: 45801 train samples, 2 unique classes
  Client 7: 45619 train samples, 2 unique classes
  Client 8: 45069 train samples, 2 unique classes
  Client 9: 45639 train samples, 2 unique classes
  Client 10: 45821 train samples, 2 unique classes
  Client 11: 45311 train samples, 2 unique classes
  Client 12: 45779 train samples, 2 unique classes
  Client 13: 46056 train samples, 2 unique classes
  Client 14: 45625 train samples, 2 unique classes
  Client 15: 45984 train samples, 2 unique classes
  Client 16: 46428 train samples, 2 unique classes
  Client 17: 44737 train samples, 2 unique classes
  Client 18: 45540 train samples, 2 unique classes
  Client 19: 46497 train samples, 2 unique classes
Will sample 4500 samples per client per epoch
Graph: ring, nodes: 20, edges: 20
Degree statistics: avg=2.00, min=2, max=2
Attack: Compromised 10/20 nodes: [1, 2, 5, 11, 12, 13, 14, 15, 17, 18]
Attack type: backdoor, lambda: 1.0
Backdoor target label: 1, trigger size: 3
Model variant: baseline
Model parameters: 1,174,986
BALANCE algorithm:
Balance Config: BALANCEConfig(gamma=2, kappa=1, alpha=0.5, min_neighbors=1)
  - Model dimension: 1,174,986 parameters
  - Complexity: O(N×d) = O(20×1,174,986)
Initial test acc across nodes: mean=0.4965 ± 0.0152
Backdoor attack: Created poisoned datasets for 10 compromised nodes
Round 001: test acc mean=0.5026 ± 0.0131 | min=0.4850 max=0.5401
         : test loss mean=19.7957 ± 19.3417
         : individual accs = ['0.489390', '0.500597', '0.486331', '0.505100', '0.498595', '0.496486', '0.504461', '0.526441', '0.518679', '0.540110', '0.494841', '0.494686', '0.505295', '0.508982', '0.499511', '0.499965', '0.503232', '0.504454', '0.489439', '0.484964']
         : correct/total = [(6965, 14232), (7126, 14235), (6938, 14266), (7181, 14217), (7099, 14238), (7136, 14373), (7237, 14346), (7546, 14334), (7414, 14294), (7763, 14373), (7098, 14344), (7075, 14302), (7253, 14354), (7310, 14362), (7153, 14320), (7197, 14395), (7241, 14389), (7192, 14257), (6975, 14251), (6983, 14399)]
         : compromised: 0.4986, honest: 0.5066
Round 002: test acc mean=0.5008 ± 0.0100 | min=0.4858 max=0.5260
         : test loss mean=776.6626 ± 803.1519
         : individual accs = ['0.494379', '0.519354', '0.496004', '0.496800', '0.501615', '0.492382', '0.492890', '0.526022', '0.488597', '0.510332', '0.498954', '0.513145', '0.501533', '0.485796', '0.506006', '0.503856', '0.491765', '0.493793', '0.498772', '0.503160']
         : correct/total = [(7036, 14232), (7393, 14235), (7076, 14266), (7063, 14217), (7142, 14238), (7077, 14373), (7071, 14346), (7540, 14334), (6984, 14294), (7335, 14373), (7157, 14344), (7339, 14302), (7199, 14354), (6977, 14362), (7246, 14320), (7253, 14395), (7076, 14389), (7040, 14257), (7108, 14251), (7245, 14399)]
         : compromised: 0.5011, honest: 0.5005
Round 003: test acc mean=0.5004 ± 0.0065 | min=0.4808 max=0.5107
         : test loss mean=81005.9019 ± 119583.4254
         : individual accs = ['0.510680', '0.500176', '0.480793', '0.508476', '0.504565', '0.495304', '0.503555', '0.505023', '0.492864', '0.501635', '0.499861', '0.503146', '0.507315', '0.506754', '0.497416', '0.495241', '0.499687', '0.494774', '0.500316', '0.501007']
         : correct/total = [(7268, 14232), (7120, 14235), (6859, 14266), (7229, 14217), (7184, 14238), (7119, 14373), (7224, 14346), (7239, 14334), (7045, 14294), (7210, 14373), (7170, 14344), (7196, 14302), (7282, 14354), (7278, 14362), (7123, 14320), (7129, 14395), (7190, 14389), (7054, 14257), (7130, 14251), (7214, 14399)]
         : compromised: 0.4981, honest: 0.5027
Round 004: test acc mean=0.5049 ± 0.0082 | min=0.4893 max=0.5191
         : test loss mean=5030363.3135 ± 5109830.0906
         : individual accs = ['0.502248', '0.507130', '0.493691', '0.510164', '0.505338', '0.489320', '0.510944', '0.505023', '0.517350', '0.516733', '0.508993', '0.505034', '0.496726', '0.495405', '0.503422', '0.505245', '0.506637', '0.490356', '0.519121', '0.509758']
         : correct/total = [(7148, 14232), (7219, 14235), (7043, 14266), (7253, 14217), (7195, 14238), (7033, 14373), (7330, 14346), (7239, 14334), (7395, 14294), (7427, 14373), (7301, 14344), (7223, 14302), (7130, 14354), (7115, 14362), (7209, 14320), (7273, 14395), (7290, 14389), (6991, 14257), (7398, 14251), (7340, 14399)]
         : compromised: 0.5005, honest: 0.5093
Round 005: test acc mean=0.5049 ± 0.0088 | min=0.4893 max=0.5238
         : test loss mean=334939188.2874 ± 346396493.8363
         : individual accs = ['0.508432', '0.496382', '0.489345', '0.512977', '0.509271', '0.498782', '0.506134', '0.502302', '0.522597', '0.523760', '0.505438', '0.501538', '0.495332', '0.498538', '0.506774', '0.510316', '0.508305', '0.492460', '0.498211', '0.511980']
         : correct/total = [(7236, 14232), (7066, 14235), (6981, 14266), (7293, 14217), (7251, 14238), (7169, 14373), (7261, 14346), (7200, 14334), (7470, 14294), (7528, 14373), (7250, 14344), (7173, 14302), (7110, 14354), (7160, 14362), (7257, 14320), (7346, 14395), (7314, 14389), (7021, 14257), (7100, 14251), (7372, 14399)]
         : compromised: 0.4988, honest: 0.5111
Round 006: test acc mean=0.5072 ± 0.0160 | min=0.4897 max=0.5644
         : test loss mean=25899770854.3597 ± 26974693212.4870
         : individual accs = ['0.520377', '0.500035', '0.491168', '0.507983', '0.506321', '0.489668', '0.502231', '0.491140', '0.564363', '0.529743', '0.502301', '0.505594', '0.502787', '0.495822', '0.502793', '0.511289', '0.505942', '0.498001', '0.507473', '0.508716']
         : correct/total = [(7406, 14232), (7118, 14235), (7007, 14266), (7222, 14217), (7209, 14238), (7038, 14373), (7205, 14346), (7040, 14334), (8067, 14294), (7614, 14373), (7205, 14344), (7231, 14302), (7217, 14354), (7121, 14362), (7200, 14320), (7360, 14395), (7280, 14389), (7100, 14257), (7232, 14251), (7325, 14399)]
         : compromised: 0.5005, honest: 0.5139
Round 007: test acc mean=0.5069 ± 0.0124 | min=0.4917 max=0.5452
         : test loss mean=2118554796283.4844 ± 2206555230695.4331
         : individual accs = ['0.520236', '0.505515', '0.491658', '0.508898', '0.500632', '0.493216', '0.502579', '0.496930', '0.545194', '0.530022', '0.503834', '0.507971', '0.500975', '0.503064', '0.495740', '0.502675', '0.507054', '0.503893', '0.501860', '0.515939']
         : correct/total = [(7404, 14232), (7196, 14235), (7014, 14266), (7235, 14217), (7128, 14238), (7089, 14373), (7210, 14346), (7123, 14334), (7793, 14294), (7618, 14373), (7227, 14344), (7265, 14302), (7191, 14354), (7225, 14362), (7099, 14320), (7236, 14395), (7296, 14389), (7184, 14257), (7152, 14251), (7429, 14399)]
         : compromised: 0.5007, honest: 0.5131
Round 008: test acc mean=0.5039 ± 0.0086 | min=0.4912 max=0.5256
         : test loss mean=179348259513273.7188 ± 186560324827231.5000
         : individual accs = ['0.502178', '0.501932', '0.494182', '0.494267', '0.500773', '0.491199', '0.500209', '0.508860', '0.523926', '0.511236', '0.500349', '0.502797', '0.501672', '0.511001', '0.497067', '0.502536', '0.506359', '0.498562', '0.525647', '0.503785']
         : correct/total = [(7147, 14232), (7145, 14235), (7050, 14266), (7027, 14217), (7130, 14238), (7060, 14373), (7176, 14346), (7294, 14334), (7489, 14294), (7348, 14373), (7177, 14344), (7191, 14302), (7201, 14354), (7339, 14362), (7118, 14320), (7234, 14395), (7286, 14389), (7108, 14257), (7491, 14251), (7254, 14399)]
         : compromised: 0.5027, honest: 0.5052
Round 009: test acc mean=0.5066 ± 0.0069 | min=0.4929 max=0.5246
         : test loss mean=15870436204925738.0000 ± 16551996915417630.0000
         : individual accs = ['0.506605', '0.514366', '0.498528', '0.508335', '0.506602', '0.492938', '0.502161', '0.515069', '0.524556', '0.508940', '0.501534', '0.508670', '0.504041', '0.506754', '0.498603', '0.506009', '0.506012', '0.501718', '0.516034', '0.503646']
         : correct/total = [(7210, 14232), (7322, 14235), (7112, 14266), (7227, 14217), (7213, 14238), (7085, 14373), (7204, 14346), (7383, 14334), (7498, 14294), (7315, 14373), (7194, 14344), (7275, 14302), (7235, 14354), (7278, 14362), (7140, 14320), (7284, 14395), (7281, 14389), (7153, 14257), (7354, 14251), (7252, 14399)]
         : compromised: 0.5048, honest: 0.5083
Round 010: test acc mean=0.5045 ± 0.0060 | min=0.4932 max=0.5206
         : test loss mean=1322416717792669184.0000 ± 1387768115082591488.0000
         : individual accs = ['0.510891', '0.498560', '0.506309', '0.501161', '0.500913', '0.502818', '0.500836', '0.493163', '0.520638', '0.515341', '0.499791', '0.498532', '0.505643', '0.504178', '0.503841', '0.504411', '0.501911', '0.510206', '0.506912', '0.504063']
         : correct/total = [(7271, 14232), (7097, 14235), (7223, 14266), (7125, 14217), (7132, 14238), (7227, 14373), (7185, 14346), (7069, 14334), (7442, 14294), (7407, 14373), (7169, 14344), (7130, 14302), (7258, 14354), (7241, 14362), (7215, 14320), (7261, 14395), (7222, 14389), (7274, 14257), (7224, 14251), (7258, 14399)]
         : compromised: 0.5041, honest: 0.5049

=== FINAL RESULTS ===
Dataset: sent140, Nodes: 20, Graph: ring, Aggregation: balance
Attack: backdoor, 50.0% compromised
Final accuracy - Compromised: 0.5041, Honest: 0.5049
Overall test accuracy: mean=0.5045 ± 0.0060

=== BACKDOOR ATTACK SUCCESS RATE (ASR) ===
Target label: 1
Trigger size: 3x3
Overall ASR: 0.6300 ± 0.4007
Honest nodes ASR: 0.2755 ± 0.2641
Compromised nodes ASR: 0.9844 ± 0.0129
Note: Higher ASR indicates more successful backdoor attack

=== BALANCE SUMMARY ===
Node 0: acceptance=0.850
Node 1: acceptance=0.700
Node 2: acceptance=0.700
Node 3: acceptance=0.900
Node 4: acceptance=0.800
Node 5: acceptance=0.700
Node 6: acceptance=1.000
Node 7: acceptance=1.000
Node 8: acceptance=1.000
Node 9: acceptance=1.000
Node 10: acceptance=1.000
Node 11: acceptance=0.700
Node 12: acceptance=0.700
Node 13: acceptance=0.600
Node 14: acceptance=0.800
Node 15: acceptance=0.700
Node 16: acceptance=0.000
Node 17: acceptance=0.700
Node 18: acceptance=0.700
Node 19: acceptance=1.000

=== PARALLEL EXECUTION TIME (realistic for distributed system) ===
  COMMUNICATION (max across nodes):
    - Full model transfer: 0.000s (0.0%)
  COMPUTATION (max across nodes):
    - Filtering: 0.018s (62.1%)
    - Aggregation: 0.011s (37.9%)
  TOTALS:
    - Total computation: 0.029s (100.0%)
    - Total communication: 0.000s (0.0%)
    - Total parallel time: 0.029s

=== PER-NODE AVERAGE TIME ===
  - Filtering: 0.012s
  - Aggregation: 0.005s
  - Model transfer: 0.000s
  - Total per node: 0.017s

=== TOTAL COMPUTATIONAL WORK (sum across all nodes) ===
  - Total filtering: 0.243s
  - Total aggregation: 0.102s
  - Total model transfer: 0.000s
  - Grand total: 0.344s
  - Mean acceptance rate: 0.777

BALANCE Algorithm Properties:
  - Model dimension: 1,174,986
  - No compression: Full parameter comparison
  - Theoretical complexity: O(deg(i)×d)
  - Approach: Full parameter filtering + averaging
