Device: cuda
Seed: 987654321
Loading 1 LEAF Sent140 train files...
LEAF Sent140 train: 254555 users, 908652 samples
Building vocabulary (max_size=10000)...
Vocabulary size: 10000
Loading 1 LEAF Sent140 test files...
LEAF Sent140 test: 254555 users, 286281 samples
Found 254555 train users, 254555 test users, 254555 common users
User sample counts range: 494 (max) to 1 (min)
Distributed ALL 254555 users across 20 clients
Users per client: 12727 (with 15 clients getting +1 user)
Train partition sizes: [44353, 44290, 44657, 44907, 44696, 45843, 45801, 45619, 45069, 45639, 45821, 45311, 45779, 46056, 45625, 45984, 46428, 44737, 45540, 46497]
Test partition sizes: [14232, 14235, 14266, 14217, 14238, 14373, 14346, 14334, 14294, 14373, 14344, 14302, 14354, 14362, 14320, 14395, 14389, 14257, 14251, 14399]
  Client 0: 44353 train samples, 2 unique classes
  Client 1: 44290 train samples, 2 unique classes
  Client 2: 44657 train samples, 2 unique classes
  Client 3: 44907 train samples, 2 unique classes
  Client 4: 44696 train samples, 2 unique classes
  Client 5: 45843 train samples, 2 unique classes
  Client 6: 45801 train samples, 2 unique classes
  Client 7: 45619 train samples, 2 unique classes
  Client 8: 45069 train samples, 2 unique classes
  Client 9: 45639 train samples, 2 unique classes
  Client 10: 45821 train samples, 2 unique classes
  Client 11: 45311 train samples, 2 unique classes
  Client 12: 45779 train samples, 2 unique classes
  Client 13: 46056 train samples, 2 unique classes
  Client 14: 45625 train samples, 2 unique classes
  Client 15: 45984 train samples, 2 unique classes
  Client 16: 46428 train samples, 2 unique classes
  Client 17: 44737 train samples, 2 unique classes
  Client 18: 45540 train samples, 2 unique classes
  Client 19: 46497 train samples, 2 unique classes
Will sample 4500 samples per client per epoch
Graph: fully, nodes: 20, edges: 190
Degree statistics: avg=19.00, min=19, max=19
Attack: Compromised 12/20 nodes: [1, 2, 3, 5, 8, 11, 12, 13, 14, 15, 17, 18]
Attack type: directed_deviation, lambda: 1.0
Model variant: baseline
Model parameters: 1,174,986
Initial test acc across nodes: mean=0.4965 ± 0.0152
Round 001: test acc mean=0.4985 ± 0.0071 | min=0.4814 max=0.5119
         : test loss mean=8.3816 ± 2.1425
         : individual accs = ['0.511875', '0.481419', '0.495374', '0.499894', '0.505197', '0.503305', '0.496863', '0.496163', '0.495383', '0.500591', '0.501185', '0.503007', '0.504459', '0.483011', '0.503911', '0.500799', '0.493015', '0.504594', '0.495965', '0.493506']
         : correct/total = [(7285, 14232), (6853, 14235), (7067, 14266), (7107, 14217), (7193, 14238), (7234, 14373), (7128, 14346), (7112, 14334), (7081, 14294), (7195, 14373), (7189, 14344), (7194, 14302), (7241, 14354), (6937, 14362), (7216, 14320), (7209, 14395), (7094, 14389), (7194, 14257), (7068, 14251), (7106, 14399)]
         : compromised: 0.4976, honest: 0.4998
Round 002: test acc mean=0.4982 ± 0.0045 | min=0.4895 max=0.5080
         : test loss mean=7.9513 ± 0.0873
         : individual accs = ['0.489460', '0.497647', '0.498248', '0.500457', '0.496699', '0.498087', '0.501185', '0.500349', '0.499160', '0.497391', '0.492262', '0.497972', '0.500766', '0.501601', '0.505377', '0.501494', '0.493919', '0.507961', '0.491123', '0.493020']
         : correct/total = [(6966, 14232), (7084, 14235), (7108, 14266), (7115, 14217), (7072, 14238), (7159, 14373), (7190, 14346), (7172, 14334), (7135, 14294), (7149, 14373), (7061, 14344), (7122, 14302), (7188, 14354), (7204, 14362), (7237, 14320), (7219, 14395), (7107, 14389), (7242, 14257), (6999, 14251), (7099, 14399)]
         : compromised: 0.5000, honest: 0.4955
Round 003: test acc mean=0.5166 ± 0.0043 | min=0.5066 max=0.5228
         : test loss mean=0.9331 ± 0.0076
         : individual accs = ['0.520166', '0.519354', '0.522151', '0.522754', '0.520579', '0.519098', '0.516311', '0.515278', '0.518959', '0.515967', '0.506832', '0.516222', '0.516650', '0.512115', '0.514665', '0.506634', '0.515950', '0.515186', '0.521297', '0.516216']
         : correct/total = [(7403, 14232), (7393, 14235), (7449, 14266), (7432, 14217), (7412, 14238), (7461, 14373), (7407, 14346), (7386, 14334), (7418, 14294), (7416, 14373), (7270, 14344), (7383, 14302), (7416, 14354), (7355, 14362), (7370, 14320), (7293, 14395), (7424, 14389), (7345, 14257), (7429, 14251), (7433, 14399)]
         : compromised: 0.5171, honest: 0.5159
Round 004: test acc mean=0.5058 ± 0.0036 | min=0.4983 max=0.5146
         : test loss mean=2.9241 ± 0.0318
         : individual accs = ['0.507659', '0.501862', '0.509253', '0.505873', '0.503722', '0.506366', '0.508086', '0.500000', '0.507975', '0.514646', '0.505996', '0.510278', '0.506967', '0.504526', '0.503003', '0.505453', '0.502884', '0.507540', '0.505298', '0.498298']
         : correct/total = [(7225, 14232), (7144, 14235), (7265, 14266), (7192, 14217), (7172, 14238), (7278, 14373), (7289, 14346), (7167, 14334), (7261, 14294), (7397, 14373), (7258, 14344), (7298, 14302), (7277, 14354), (7246, 14362), (7203, 14320), (7276, 14395), (7236, 14389), (7236, 14257), (7201, 14251), (7175, 14399)]
         : compromised: 0.5062, honest: 0.5052
Round 005: test acc mean=0.5092 ± 0.0049 | min=0.4969 max=0.5176
         : test loss mean=0.8920 ± 0.0107
         : individual accs = ['0.513491', '0.517597', '0.516893', '0.511993', '0.509060', '0.512071', '0.512129', '0.509767', '0.513502', '0.508105', '0.512828', '0.507691', '0.504668', '0.496867', '0.508869', '0.505801', '0.505386', '0.501438', '0.508035', '0.507327']
         : correct/total = [(7308, 14232), (7368, 14235), (7374, 14266), (7279, 14217), (7248, 14238), (7360, 14373), (7347, 14346), (7307, 14334), (7340, 14294), (7303, 14373), (7356, 14344), (7261, 14302), (7244, 14354), (7136, 14362), (7287, 14320), (7281, 14395), (7272, 14389), (7149, 14257), (7240, 14251), (7305, 14399)]
         : compromised: 0.5088, honest: 0.5098
Round 006: test acc mean=0.5085 ± 0.0037 | min=0.4992 max=0.5157
         : test loss mean=1.4808 ± 0.0146
         : individual accs = ['0.512577', '0.499192', '0.510024', '0.507632', '0.507304', '0.504070', '0.508713', '0.512837', '0.504547', '0.511584', '0.508645', '0.507272', '0.508012', '0.515736', '0.506983', '0.511080', '0.503927', '0.508312', '0.508245', '0.512605']
         : correct/total = [(7295, 14232), (7106, 14235), (7276, 14266), (7217, 14217), (7223, 14238), (7245, 14373), (7298, 14346), (7351, 14334), (7212, 14294), (7353, 14373), (7296, 14344), (7255, 14302), (7292, 14354), (7407, 14362), (7260, 14320), (7357, 14395), (7251, 14389), (7247, 14257), (7243, 14251), (7381, 14399)]
         : compromised: 0.5076, honest: 0.5098
Round 007: test acc mean=0.5440 ± 0.0057 | min=0.5332 max=0.5545
         : test loss mean=0.7156 ± 0.0042
         : individual accs = ['0.544407', '0.537408', '0.533156', '0.541746', '0.539753', '0.542267', '0.542102', '0.549602', '0.545893', '0.546650', '0.535137', '0.547266', '0.554480', '0.549366', '0.540014', '0.554429', '0.543749', '0.541278', '0.539752', '0.550872']
         : correct/total = [(7748, 14232), (7650, 14235), (7606, 14266), (7702, 14217), (7685, 14238), (7794, 14373), (7777, 14346), (7878, 14334), (7803, 14294), (7857, 14373), (7676, 14344), (7827, 14302), (7959, 14354), (7890, 14362), (7733, 14320), (7981, 14395), (7824, 14389), (7717, 14257), (7692, 14251), (7932, 14399)]
         : compromised: 0.5439, honest: 0.5440
Round 008: test acc mean=0.5027 ± 0.0040 | min=0.4934 max=0.5093
         : test loss mean=1.0508 ± 0.0132
         : individual accs = ['0.507307', '0.493361', '0.505187', '0.499402', '0.504074', '0.496626', '0.508365', '0.502930', '0.502519', '0.506644', '0.506553', '0.500420', '0.499652', '0.509261', '0.500628', '0.502397', '0.505873', '0.504524', '0.498421', '0.500799']
         : correct/total = [(7220, 14232), (7023, 14235), (7207, 14266), (7100, 14217), (7177, 14238), (7138, 14373), (7293, 14346), (7209, 14334), (7183, 14294), (7282, 14373), (7266, 14344), (7157, 14302), (7172, 14354), (7314, 14362), (7169, 14320), (7232, 14395), (7279, 14389), (7193, 14257), (7103, 14251), (7211, 14399)]
         : compromised: 0.5010, honest: 0.5053
Round 009: test acc mean=0.5563 ± 0.0026 | min=0.5524 max=0.5609
         : test loss mean=0.6881 ± 0.0013
         : individual accs = ['0.556352', '0.553354', '0.555727', '0.560667', '0.560121', '0.557156', '0.558135', '0.554625', '0.558836', '0.556321', '0.556051', '0.557894', '0.552390', '0.552430', '0.553701', '0.556513', '0.555146', '0.552501', '0.560943', '0.557191']
         : correct/total = [(7918, 14232), (7877, 14235), (7928, 14266), (7971, 14217), (7975, 14238), (8008, 14373), (8007, 14346), (7950, 14334), (7988, 14294), (7996, 14373), (7976, 14344), (7979, 14302), (7929, 14354), (7934, 14362), (7929, 14320), (8011, 14395), (7988, 14389), (7877, 14257), (7994, 14251), (8023, 14399)]
         : compromised: 0.5560, honest: 0.5567
Round 010: test acc mean=0.5034 ± 0.0033 | min=0.4988 max=0.5111
         : test loss mean=0.8617 ± 0.0064
         : individual accs = ['0.500070', '0.501932', '0.499860', '0.503482', '0.504916', '0.505183', '0.499582', '0.504814', '0.508885', '0.500313', '0.504322', '0.505594', '0.511147', '0.507589', '0.499022', '0.503091', '0.503996', '0.501017', '0.498842', '0.504827']
         : correct/total = [(7117, 14232), (7145, 14235), (7131, 14266), (7158, 14217), (7189, 14238), (7261, 14373), (7167, 14346), (7236, 14334), (7274, 14294), (7191, 14373), (7234, 14344), (7231, 14302), (7337, 14354), (7290, 14362), (7146, 14320), (7242, 14395), (7252, 14389), (7143, 14257), (7109, 14251), (7269, 14399)]
         : compromised: 0.5038, honest: 0.5029

=== FINAL RESULTS ===
Dataset: sent140, Nodes: 20, Graph: fully, Aggregation: krum
Attack: directed_deviation, 60.0% compromised
Final accuracy - Compromised: 0.5038, Honest: 0.5029
Overall test accuracy: mean=0.5034 ± 0.0033
