Device: cuda
Seed: 987654321
Loading 1 LEAF Sent140 train files...
LEAF Sent140 train: 254555 users, 908652 samples
Building vocabulary (max_size=10000)...
Vocabulary size: 10000
Loading 1 LEAF Sent140 test files...
LEAF Sent140 test: 254555 users, 286281 samples
Found 254555 train users, 254555 test users, 254555 common users
User sample counts range: 494 (max) to 1 (min)
Distributed ALL 254555 users across 20 clients
Users per client: 12727 (with 15 clients getting +1 user)
Train partition sizes: [44353, 44290, 44657, 44907, 44696, 45843, 45801, 45619, 45069, 45639, 45821, 45311, 45779, 46056, 45625, 45984, 46428, 44737, 45540, 46497]
Test partition sizes: [14232, 14235, 14266, 14217, 14238, 14373, 14346, 14334, 14294, 14373, 14344, 14302, 14354, 14362, 14320, 14395, 14389, 14257, 14251, 14399]
  Client 0: 44353 train samples, 2 unique classes
  Client 1: 44290 train samples, 2 unique classes
  Client 2: 44657 train samples, 2 unique classes
  Client 3: 44907 train samples, 2 unique classes
  Client 4: 44696 train samples, 2 unique classes
  Client 5: 45843 train samples, 2 unique classes
  Client 6: 45801 train samples, 2 unique classes
  Client 7: 45619 train samples, 2 unique classes
  Client 8: 45069 train samples, 2 unique classes
  Client 9: 45639 train samples, 2 unique classes
  Client 10: 45821 train samples, 2 unique classes
  Client 11: 45311 train samples, 2 unique classes
  Client 12: 45779 train samples, 2 unique classes
  Client 13: 46056 train samples, 2 unique classes
  Client 14: 45625 train samples, 2 unique classes
  Client 15: 45984 train samples, 2 unique classes
  Client 16: 46428 train samples, 2 unique classes
  Client 17: 44737 train samples, 2 unique classes
  Client 18: 45540 train samples, 2 unique classes
  Client 19: 46497 train samples, 2 unique classes
Will sample 4500 samples per client per epoch
Graph: erdos, nodes: 20, edges: 48
Degree statistics: avg=4.80, min=2, max=7
Attack: Compromised 6/20 nodes: [5, 12, 13, 14, 17, 18]
Attack type: backdoor, lambda: 1.0
Backdoor target label: 1, trigger size: 3
Model variant: baseline
Model parameters: 1,174,986
Initial test acc across nodes: mean=0.4965 ± 0.0152
Backdoor attack: Created poisoned datasets for 6 compromised nodes
Round 001: test acc mean=0.5203 ± 0.0405 | min=0.4840 max=0.6098
         : test loss mean=18.6823 ± 14.4340
         : individual accs = ['0.593100', '0.609835', '0.513879', '0.496659', '0.498946', '0.496973', '0.497072', '0.494907', '0.600392', '0.505810', '0.501673', '0.492379', '0.506967', '0.509678', '0.494972', '0.507190', '0.501981', '0.502280', '0.483966', '0.596986']
         : correct/total = [(8441, 14232), (8681, 14235), (7331, 14266), (7061, 14217), (7104, 14238), (7143, 14373), (7131, 14346), (7094, 14334), (8582, 14294), (7270, 14373), (7196, 14344), (7042, 14302), (7277, 14354), (7320, 14362), (7088, 14320), (7301, 14395), (7223, 14389), (7161, 14257), (6897, 14251), (8596, 14399)]
         : compromised: 0.4991, honest: 0.5293
Round 002: test acc mean=0.5234 ± 0.0480 | min=0.4880 max=0.6235
         : test loss mean=19.4978 ± 16.4740
         : individual accs = ['0.489250', '0.620513', '0.509533', '0.492579', '0.507726', '0.510193', '0.623519', '0.491349', '0.611865', '0.503235', '0.509272', '0.502447', '0.494357', '0.490322', '0.504399', '0.498854', '0.495656', '0.507821', '0.488036', '0.617126']
         : correct/total = [(6963, 14232), (8833, 14235), (7269, 14266), (7003, 14217), (7229, 14238), (7333, 14373), (8945, 14346), (7043, 14334), (8746, 14294), (7233, 14373), (7305, 14344), (7186, 14302), (7096, 14354), (7042, 14362), (7223, 14320), (7181, 14395), (7132, 14389), (7240, 14257), (6955, 14251), (8886, 14399)]
         : compromised: 0.4992, honest: 0.5338
Round 003: test acc mean=0.5293 ± 0.0574 | min=0.4872 max=0.6309
         : test loss mean=4.3524 ± 5.3452
         : individual accs = ['0.628724', '0.630488', '0.487172', '0.492509', '0.496067', '0.491825', '0.497700', '0.504186', '0.624598', '0.495234', '0.630926', '0.492309', '0.496935', '0.509609', '0.495950', '0.496422', '0.496977', '0.497510', '0.493299', '0.626710']
         : correct/total = [(8948, 14232), (8975, 14235), (6950, 14266), (7002, 14217), (7063, 14238), (7069, 14373), (7140, 14346), (7227, 14334), (8928, 14294), (7118, 14373), (9050, 14344), (7041, 14302), (7133, 14354), (7319, 14362), (7102, 14320), (7146, 14395), (7151, 14389), (7093, 14257), (7030, 14251), (9024, 14399)]
         : compromised: 0.4975, honest: 0.5429
Round 004: test acc mean=0.5279 ± 0.0554 | min=0.4863 max=0.6408
         : test loss mean=6.4581 ± 6.0618
         : individual accs = ['0.639193', '0.486266', '0.514580', '0.492298', '0.507094', '0.496695', '0.499233', '0.501605', '0.630824', '0.506923', '0.640825', '0.502937', '0.505713', '0.487467', '0.504050', '0.498437', '0.496282', '0.500245', '0.507473', '0.640461']
         : correct/total = [(9097, 14232), (6922, 14235), (7341, 14266), (6999, 14217), (7220, 14238), (7139, 14373), (7162, 14346), (7190, 14334), (9017, 14294), (7286, 14373), (9192, 14344), (7193, 14302), (7259, 14354), (7001, 14362), (7218, 14320), (7175, 14395), (7141, 14389), (7132, 14257), (7232, 14251), (9222, 14399)]
         : compromised: 0.5003, honest: 0.5398
Round 005: test acc mean=0.5199 ± 0.0512 | min=0.4747 max=0.6441
         : test loss mean=5.1635 ± 4.3782
         : individual accs = ['0.505902', '0.528627', '0.490257', '0.516705', '0.474716', '0.501983', '0.502719', '0.485280', '0.626836', '0.521673', '0.644102', '0.499441', '0.489271', '0.485726', '0.494274', '0.490240', '0.502537', '0.492179', '0.503193', '0.643309']
         : correct/total = [(7200, 14232), (7525, 14235), (6994, 14266), (7346, 14217), (6759, 14238), (7215, 14373), (7212, 14346), (6956, 14334), (8960, 14294), (7498, 14373), (9239, 14344), (7143, 14302), (7023, 14354), (6976, 14362), (7078, 14320), (7057, 14395), (7231, 14389), (7017, 14257), (7171, 14251), (9263, 14399)]
         : compromised: 0.4944, honest: 0.5309
Round 006: test acc mean=0.5317 ± 0.0520 | min=0.4793 max=0.6491
         : test loss mean=4.3585 ± 4.4094
         : individual accs = ['0.532322', '0.515630', '0.510865', '0.570655', '0.496910', '0.504418', '0.570612', '0.504116', '0.634112', '0.506644', '0.646960', '0.499301', '0.497074', '0.511280', '0.479260', '0.502536', '0.505664', '0.485726', '0.510420', '0.649073']
         : correct/total = [(7576, 14232), (7340, 14235), (7288, 14266), (8113, 14217), (7075, 14238), (7250, 14373), (8186, 14346), (7226, 14334), (9064, 14294), (7282, 14373), (9280, 14344), (7141, 14302), (7135, 14354), (7343, 14362), (6863, 14320), (7234, 14395), (7276, 14389), (6925, 14257), (7274, 14251), (9346, 14399)]
         : compromised: 0.4980, honest: 0.5461
Round 007: test acc mean=0.5318 ± 0.0558 | min=0.4861 max=0.6591
         : test loss mean=33.1198 ± 29.2268
         : individual accs = ['0.544618', '0.516754', '0.486121', '0.570585', '0.495435', '0.496069', '0.575282', '0.499721', '0.639429', '0.512767', '0.655326', '0.494267', '0.496168', '0.507938', '0.497346', '0.501563', '0.497950', '0.500245', '0.488387', '0.659143']
         : correct/total = [(7751, 14232), (7356, 14235), (6935, 14266), (8112, 14217), (7054, 14238), (7130, 14373), (8253, 14346), (7163, 14334), (9140, 14294), (7370, 14373), (9400, 14344), (7069, 14302), (7122, 14354), (7295, 14362), (7122, 14320), (7220, 14395), (7165, 14389), (7132, 14257), (6960, 14251), (9491, 14399)]
         : compromised: 0.4977, honest: 0.5464
Round 008: test acc mean=0.5363 ± 0.0611 | min=0.4934 max=0.6645
         : test loss mean=4.5964 ± 5.0247
         : individual accs = ['0.542721', '0.501862', '0.494182', '0.604980', '0.498595', '0.501635', '0.599679', '0.496721', '0.653561', '0.518263', '0.664041', '0.494406', '0.494914', '0.506615', '0.500209', '0.495519', '0.496768', '0.493372', '0.502982', '0.664491']
         : correct/total = [(7724, 14232), (7144, 14235), (7050, 14266), (8601, 14217), (7099, 14238), (7210, 14373), (8603, 14346), (7120, 14334), (9342, 14294), (7449, 14373), (9525, 14344), (7071, 14302), (7104, 14354), (7276, 14362), (7163, 14320), (7133, 14395), (7148, 14389), (7034, 14257), (7168, 14251), (9568, 14399)]
         : compromised: 0.5000, honest: 0.5518
Round 009: test acc mean=0.5380 ± 0.0587 | min=0.4905 max=0.6671
         : test loss mean=14.4827 ± 14.3097
         : individual accs = ['0.553963', '0.497366', '0.511356', '0.613772', '0.504916', '0.497669', '0.553116', '0.509348', '0.652302', '0.506644', '0.665714', '0.509439', '0.505295', '0.490461', '0.504190', '0.501077', '0.500104', '0.508312', '0.508245', '0.667060']
         : correct/total = [(7884, 14232), (7080, 14235), (7295, 14266), (8726, 14217), (7189, 14238), (7153, 14373), (7935, 14346), (7301, 14334), (9324, 14294), (7282, 14373), (9549, 14344), (7286, 14302), (7253, 14354), (7044, 14362), (7220, 14320), (7213, 14395), (7196, 14389), (7247, 14257), (7243, 14251), (9605, 14399)]
         : compromised: 0.5024, honest: 0.5533
Round 010: test acc mean=0.5393 ± 0.0601 | min=0.4965 max=0.6713
         : test loss mean=14.5194 ± 12.4421
         : individual accs = ['0.553612', '0.502353', '0.509884', '0.615109', '0.505900', '0.506575', '0.553743', '0.503349', '0.659927', '0.513532', '0.667945', '0.505454', '0.500279', '0.496867', '0.500419', '0.501771', '0.499479', '0.496458', '0.521788', '0.671297']
         : correct/total = [(7879, 14232), (7151, 14235), (7274, 14266), (8745, 14217), (7203, 14238), (7281, 14373), (7944, 14346), (7215, 14334), (9433, 14294), (7381, 14373), (9581, 14344), (7229, 14302), (7181, 14354), (7136, 14362), (7166, 14320), (7223, 14395), (7187, 14389), (7078, 14257), (7436, 14251), (9666, 14399)]
         : compromised: 0.5037, honest: 0.5545

=== FINAL RESULTS ===
Dataset: sent140, Nodes: 20, Graph: erdos, Aggregation: krum
Attack: backdoor, 30.0% compromised
Final accuracy - Compromised: 0.5037, Honest: 0.5545
Overall test accuracy: mean=0.5393 ± 0.0601

=== BACKDOOR ATTACK SUCCESS RATE (ASR) ===
Target label: 1
Trigger size: 3x3
Overall ASR: 0.2433 ± 0.2560
Honest nodes ASR: 0.2762 ± 0.2737
Compromised nodes ASR: 0.1667 ± 0.1876
Note: Higher ASR indicates more successful backdoor attack
