Device: cuda
Seed: 987654321
Loading 1 LEAF Sent140 train files...
LEAF Sent140 train: 254555 users, 908652 samples
Building vocabulary (max_size=10000)...
Vocabulary size: 10000
Loading 1 LEAF Sent140 test files...
LEAF Sent140 test: 254555 users, 286281 samples
Found 254555 train users, 254555 test users, 254555 common users
User sample counts range: 494 (max) to 1 (min)
Distributed ALL 254555 users across 20 clients
Users per client: 12727 (with 15 clients getting +1 user)
Train partition sizes: [44353, 44290, 44657, 44907, 44696, 45843, 45801, 45619, 45069, 45639, 45821, 45311, 45779, 46056, 45625, 45984, 46428, 44737, 45540, 46497]
Test partition sizes: [14232, 14235, 14266, 14217, 14238, 14373, 14346, 14334, 14294, 14373, 14344, 14302, 14354, 14362, 14320, 14395, 14389, 14257, 14251, 14399]
  Client 0: 44353 train samples, 2 unique classes
  Client 1: 44290 train samples, 2 unique classes
  Client 2: 44657 train samples, 2 unique classes
  Client 3: 44907 train samples, 2 unique classes
  Client 4: 44696 train samples, 2 unique classes
  Client 5: 45843 train samples, 2 unique classes
  Client 6: 45801 train samples, 2 unique classes
  Client 7: 45619 train samples, 2 unique classes
  Client 8: 45069 train samples, 2 unique classes
  Client 9: 45639 train samples, 2 unique classes
  Client 10: 45821 train samples, 2 unique classes
  Client 11: 45311 train samples, 2 unique classes
  Client 12: 45779 train samples, 2 unique classes
  Client 13: 46056 train samples, 2 unique classes
  Client 14: 45625 train samples, 2 unique classes
  Client 15: 45984 train samples, 2 unique classes
  Client 16: 46428 train samples, 2 unique classes
  Client 17: 44737 train samples, 2 unique classes
  Client 18: 45540 train samples, 2 unique classes
  Client 19: 46497 train samples, 2 unique classes
Will sample 4500 samples per client per epoch
Graph: erdos, nodes: 20, edges: 126
Degree statistics: avg=12.60, min=8, max=16
Attack: Compromised 16/20 nodes: [1, 2, 3, 5, 6, 8, 9, 10, 11, 12, 13, 14, 15, 17, 18, 19]
Attack type: backdoor, lambda: 1.0
Backdoor target label: 1, trigger size: 3
Model variant: baseline
Model parameters: 1,174,986
Initial test acc across nodes: mean=0.4953 ± 0.0174
Backdoor attack: Created poisoned datasets for 16 compromised nodes
Round 001: test acc mean=0.5003 ± 0.0068 | min=0.4898 max=0.5194
         : test loss mean=14.5387 ± 3.9059
         : individual accs = ['0.505972', '0.519354', '0.492149', '0.489766', '0.503652', '0.501635', '0.500836', '0.495465', '0.495173', '0.498504', '0.492122', '0.506153', '0.497562', '0.496519', '0.505377', '0.491768', '0.507332', '0.501789', '0.502140', '0.503438']
         : correct/total = [(7201, 14232), (7393, 14235), (7021, 14266), (6963, 14217), (7171, 14238), (7210, 14373), (7185, 14346), (7102, 14334), (7078, 14294), (7165, 14373), (7059, 14344), (7239, 14302), (7142, 14354), (7131, 14362), (7237, 14320), (7079, 14395), (7300, 14389), (7154, 14257), (7156, 14251), (7249, 14399)]
         : compromised: 0.4996, honest: 0.5031
Round 002: test acc mean=0.5049 ± 0.0062 | min=0.4926 max=0.5182
         : test loss mean=50.5710 ± 14.7192
         : individual accs = ['0.505551', '0.518230', '0.514510', '0.515299', '0.505127', '0.505392', '0.498676', '0.507186', '0.501189', '0.505114', '0.501115', '0.506433', '0.496586', '0.492619', '0.506844', '0.497742', '0.507401', '0.507751', '0.502491', '0.501979']
         : correct/total = [(7195, 14232), (7377, 14235), (7340, 14266), (7326, 14217), (7192, 14238), (7264, 14373), (7154, 14346), (7270, 14334), (7164, 14294), (7260, 14373), (7188, 14344), (7243, 14302), (7128, 14354), (7075, 14362), (7258, 14320), (7165, 14395), (7301, 14389), (7239, 14257), (7161, 14251), (7228, 14399)]
         : compromised: 0.5045, honest: 0.5063
Round 003: test acc mean=0.5051 ± 0.0054 | min=0.4932 max=0.5168
         : test loss mean=56.2144 ± 9.5016
         : individual accs = ['0.507518', '0.516754', '0.513038', '0.515088', '0.505549', '0.504140', '0.500209', '0.507255', '0.501819', '0.504627', '0.501603', '0.506153', '0.497213', '0.493176', '0.507402', '0.502397', '0.507471', '0.504314', '0.504315', '0.501979']
         : correct/total = [(7223, 14232), (7356, 14235), (7319, 14266), (7323, 14217), (7198, 14238), (7246, 14373), (7176, 14346), (7271, 14334), (7173, 14294), (7253, 14373), (7195, 14344), (7239, 14302), (7137, 14354), (7083, 14362), (7266, 14320), (7232, 14395), (7302, 14389), (7190, 14257), (7187, 14251), (7228, 14399)]
         : compromised: 0.5046, honest: 0.5069
Round 004: test acc mean=0.4953 ± 0.0054 | min=0.4849 max=0.5068
         : test loss mean=52.6538 ± 19.1827
         : individual accs = ['0.492622', '0.484861', '0.486962', '0.484983', '0.495505', '0.496695', '0.499791', '0.492954', '0.498181', '0.495443', '0.500976', '0.493987', '0.502856', '0.506824', '0.493087', '0.497881', '0.492529', '0.495686', '0.495825', '0.498368']
         : correct/total = [(7011, 14232), (6902, 14235), (6947, 14266), (6895, 14217), (7055, 14238), (7139, 14373), (7170, 14346), (7066, 14334), (7121, 14294), (7121, 14373), (7186, 14344), (7065, 14302), (7218, 14354), (7279, 14362), (7061, 14320), (7167, 14395), (7087, 14389), (7067, 14257), (7066, 14251), (7176, 14399)]
         : compromised: 0.4958, honest: 0.4934
Round 005: test acc mean=0.4956 ± 0.0053 | min=0.4845 max=0.5084
         : test loss mean=23.2589 ± 3.9518
         : individual accs = ['0.493325', '0.484510', '0.488714', '0.487445', '0.494030', '0.495165', '0.500418', '0.493024', '0.497062', '0.496556', '0.499861', '0.494406', '0.504110', '0.508425', '0.493156', '0.498506', '0.493988', '0.495125', '0.495474', '0.498993']
         : correct/total = [(7021, 14232), (6897, 14235), (6972, 14266), (6930, 14217), (7034, 14238), (7117, 14373), (7179, 14346), (7067, 14334), (7105, 14294), (7137, 14373), (7170, 14344), (7071, 14302), (7236, 14354), (7302, 14362), (7062, 14320), (7176, 14395), (7108, 14389), (7059, 14257), (7061, 14251), (7185, 14399)]
         : compromised: 0.4961, honest: 0.4936
Round 006: test acc mean=0.4946 ± 0.0054 | min=0.4830 max=0.5070
         : test loss mean=73.5515 ± 20.5284
         : individual accs = ['0.492622', '0.483035', '0.486682', '0.484912', '0.494522', '0.495860', '0.495051', '0.492605', '0.498181', '0.495234', '0.498397', '0.493987', '0.502856', '0.507032', '0.492598', '0.497742', '0.491904', '0.495336', '0.495614', '0.498090']
         : correct/total = [(7011, 14232), (6876, 14235), (6943, 14266), (6894, 14217), (7041, 14238), (7127, 14373), (7102, 14346), (7061, 14334), (7121, 14294), (7118, 14373), (7149, 14344), (7065, 14302), (7218, 14354), (7282, 14362), (7054, 14320), (7165, 14395), (7078, 14389), (7062, 14257), (7063, 14251), (7172, 14399)]
         : compromised: 0.4950, honest: 0.4929
Round 007: test acc mean=0.4949 ± 0.0059 | min=0.4806 max=0.5067
         : test loss mean=47.2359 ± 8.7612
         : individual accs = ['0.491779', '0.480646', '0.490186', '0.484701', '0.494311', '0.496973', '0.498954', '0.492326', '0.500560', '0.493564', '0.499163', '0.493427', '0.503832', '0.506684', '0.492388', '0.498437', '0.490861', '0.493442', '0.496456', '0.499062']
         : correct/total = [(6999, 14232), (6842, 14235), (6993, 14266), (6891, 14217), (7038, 14238), (7143, 14373), (7158, 14346), (7057, 14334), (7155, 14294), (7094, 14373), (7160, 14344), (7057, 14302), (7232, 14354), (7277, 14362), (7051, 14320), (7175, 14395), (7063, 14389), (7035, 14257), (7075, 14251), (7186, 14399)]
         : compromised: 0.4955, honest: 0.4923
Round 008: test acc mean=0.5051 ± 0.0053 | min=0.4930 max=0.5168
         : test loss mean=81.0842 ± 16.2885
         : individual accs = ['0.507307', '0.516825', '0.512968', '0.513048', '0.505408', '0.505462', '0.500836', '0.506976', '0.501819', '0.504905', '0.501603', '0.506363', '0.497004', '0.493037', '0.507472', '0.502258', '0.507332', '0.504664', '0.504666', '0.501910']
         : correct/total = [(7220, 14232), (7357, 14235), (7318, 14266), (7294, 14217), (7196, 14238), (7265, 14373), (7185, 14346), (7267, 14334), (7173, 14294), (7257, 14373), (7195, 14344), (7242, 14302), (7134, 14354), (7081, 14362), (7267, 14320), (7230, 14395), (7300, 14389), (7195, 14257), (7192, 14251), (7227, 14399)]
         : compromised: 0.5047, honest: 0.5068
Round 009: test acc mean=0.5051 ± 0.0055 | min=0.4932 max=0.5170
         : test loss mean=372.0668 ± 80.7179
         : individual accs = ['0.507378', '0.516965', '0.513038', '0.515088', '0.505478', '0.504140', '0.500209', '0.507255', '0.501819', '0.504766', '0.501603', '0.506153', '0.497144', '0.493176', '0.507402', '0.502258', '0.507471', '0.504664', '0.504386', '0.501910']
         : correct/total = [(7221, 14232), (7359, 14235), (7319, 14266), (7323, 14217), (7197, 14238), (7246, 14373), (7176, 14346), (7271, 14334), (7173, 14294), (7255, 14373), (7195, 14344), (7239, 14302), (7136, 14354), (7083, 14362), (7266, 14320), (7230, 14395), (7302, 14389), (7195, 14257), (7188, 14251), (7227, 14399)]
         : compromised: 0.5047, honest: 0.5069
Round 010: test acc mean=0.5051 ± 0.0055 | min=0.4932 max=0.5170
         : test loss mean=477.2615 ± 76.7293
         : individual accs = ['0.507378', '0.516965', '0.513038', '0.515088', '0.505478', '0.504140', '0.500209', '0.507255', '0.501819', '0.504766', '0.501603', '0.506153', '0.497144', '0.493176', '0.507402', '0.502258', '0.507471', '0.504664', '0.504386', '0.501910']
         : correct/total = [(7221, 14232), (7359, 14235), (7319, 14266), (7323, 14217), (7197, 14238), (7246, 14373), (7176, 14346), (7271, 14334), (7173, 14294), (7255, 14373), (7195, 14344), (7239, 14302), (7136, 14354), (7083, 14362), (7266, 14320), (7230, 14395), (7302, 14389), (7195, 14257), (7188, 14251), (7227, 14399)]
         : compromised: 0.5047, honest: 0.5069

=== FINAL RESULTS ===
Dataset: sent140, Nodes: 20, Graph: erdos, Aggregation: d-fedavg
Attack: backdoor, 80.0% compromised
Final accuracy - Compromised: 0.5047, Honest: 0.5069
Overall test accuracy: mean=0.5051 ± 0.0055

=== BACKDOOR ATTACK SUCCESS RATE (ASR) ===
Target label: 1
Trigger size: 3x3
Overall ASR: 0.0000 ± 0.0000
Honest nodes ASR: 0.0000 ± 0.0000
Compromised nodes ASR: 0.0000 ± 0.0000
Note: Higher ASR indicates more successful backdoor attack
