Device: cuda
Seed: 987654321
Loading 1 LEAF Sent140 train files...
LEAF Sent140 train: 254555 users, 908652 samples
Building vocabulary (max_size=10000)...
Vocabulary size: 10000
Loading 1 LEAF Sent140 test files...
LEAF Sent140 test: 254555 users, 286281 samples
Found 254555 train users, 254555 test users, 254555 common users
User sample counts range: 494 (max) to 1 (min)
Distributed ALL 254555 users across 20 clients
Users per client: 12727 (with 15 clients getting +1 user)
Train partition sizes: [44353, 44290, 44657, 44907, 44696, 45843, 45801, 45619, 45069, 45639, 45821, 45311, 45779, 46056, 45625, 45984, 46428, 44737, 45540, 46497]
Test partition sizes: [14232, 14235, 14266, 14217, 14238, 14373, 14346, 14334, 14294, 14373, 14344, 14302, 14354, 14362, 14320, 14395, 14389, 14257, 14251, 14399]
  Client 0: 44353 train samples, 2 unique classes
  Client 1: 44290 train samples, 2 unique classes
  Client 2: 44657 train samples, 2 unique classes
  Client 3: 44907 train samples, 2 unique classes
  Client 4: 44696 train samples, 2 unique classes
  Client 5: 45843 train samples, 2 unique classes
  Client 6: 45801 train samples, 2 unique classes
  Client 7: 45619 train samples, 2 unique classes
  Client 8: 45069 train samples, 2 unique classes
  Client 9: 45639 train samples, 2 unique classes
  Client 10: 45821 train samples, 2 unique classes
  Client 11: 45311 train samples, 2 unique classes
  Client 12: 45779 train samples, 2 unique classes
  Client 13: 46056 train samples, 2 unique classes
  Client 14: 45625 train samples, 2 unique classes
  Client 15: 45984 train samples, 2 unique classes
  Client 16: 46428 train samples, 2 unique classes
  Client 17: 44737 train samples, 2 unique classes
  Client 18: 45540 train samples, 2 unique classes
  Client 19: 46497 train samples, 2 unique classes
Will sample 4500 samples per client per epoch
Graph: fully, nodes: 20, edges: 190
Degree statistics: avg=19.00, min=19, max=19
Attack: Compromised 14/20 nodes: [1, 2, 3, 5, 6, 8, 11, 12, 13, 14, 15, 17, 18, 19]
Attack type: backdoor, lambda: 1.0
Backdoor target label: 1, trigger size: 3
Model variant: baseline
Model parameters: 1,174,986
Initial test acc across nodes: mean=0.4965 ± 0.0152
Backdoor attack: Created poisoned datasets for 14 compromised nodes
Round 001: test acc mean=0.5019 ± 0.0065 | min=0.4918 max=0.5158
         : test loss mean=11.6198 ± 4.5031
         : individual accs = ['0.507518', '0.513874', '0.492149', '0.503271', '0.494100', '0.505044', '0.495399', '0.503070', '0.492235', '0.506714', '0.491843', '0.500629', '0.515814', '0.497911', '0.499860', '0.503508', '0.503996', '0.504314', '0.506140', '0.501424']
         : correct/total = [(7223, 14232), (7315, 14235), (7021, 14266), (7155, 14217), (7035, 14238), (7259, 14373), (7107, 14346), (7211, 14334), (7036, 14294), (7283, 14373), (7055, 14344), (7160, 14302), (7404, 14354), (7151, 14362), (7158, 14320), (7248, 14395), (7252, 14389), (7190, 14257), (7213, 14251), (7220, 14399)]
         : compromised: 0.5023, honest: 0.5012
Round 002: test acc mean=0.5045 ± 0.0052 | min=0.4922 max=0.5131
         : test loss mean=35.2367 ± 0.3917
         : individual accs = ['0.508853', '0.512750', '0.513108', '0.508265', '0.504144', '0.504348', '0.501324', '0.504604', '0.510564', '0.506784', '0.501673', '0.507761', '0.499582', '0.492202', '0.502514', '0.501355', '0.498853', '0.497229', '0.510069', '0.504688']
         : correct/total = [(7242, 14232), (7299, 14235), (7320, 14266), (7226, 14217), (7178, 14238), (7249, 14373), (7192, 14346), (7233, 14334), (7298, 14294), (7284, 14373), (7196, 14344), (7262, 14302), (7171, 14354), (7069, 14362), (7196, 14320), (7217, 14395), (7178, 14389), (7089, 14257), (7269, 14251), (7267, 14399)]
         : compromised: 0.5047, honest: 0.5042
Round 003: test acc mean=0.5051 ± 0.0056 | min=0.4914 max=0.5139
         : test loss mean=36.8907 ± 0.4247
         : individual accs = ['0.510891', '0.513734', '0.513949', '0.507772', '0.505900', '0.506157', '0.502440', '0.504814', '0.511543', '0.506992', '0.500976', '0.507971', '0.500488', '0.491436', '0.504190', '0.501633', '0.500243', '0.496949', '0.511262', '0.503646']
         : correct/total = [(7271, 14232), (7313, 14235), (7332, 14266), (7219, 14217), (7203, 14238), (7275, 14373), (7208, 14346), (7236, 14334), (7312, 14294), (7287, 14373), (7186, 14344), (7265, 14302), (7184, 14354), (7058, 14362), (7220, 14320), (7221, 14395), (7198, 14389), (7085, 14257), (7286, 14251), (7252, 14399)]
         : compromised: 0.5052, honest: 0.5050
Round 004: test acc mean=0.4963 ± 0.0052 | min=0.4863 max=0.5048
         : test loss mean=21.9093 ± 0.3398
         : individual accs = ['0.501546', '0.502705', '0.502944', '0.493916', '0.497542', '0.494121', '0.489126', '0.492117', '0.504757', '0.500522', '0.486266', '0.503146', '0.494287', '0.493246', '0.495950', '0.493505', '0.491904', '0.490215', '0.502561', '0.495104']
         : correct/total = [(7138, 14232), (7156, 14235), (7175, 14266), (7022, 14217), (7084, 14238), (7102, 14373), (7017, 14346), (7054, 14334), (7215, 14294), (7194, 14373), (6975, 14344), (7196, 14302), (7095, 14354), (7084, 14362), (7102, 14320), (7104, 14395), (7078, 14389), (6989, 14257), (7162, 14251), (7129, 14399)]
         : compromised: 0.4968, honest: 0.4950
Round 005: test acc mean=0.4949 ± 0.0056 | min=0.4861 max=0.5086
         : test loss mean=46.7577 ± 0.5316
         : individual accs = ['0.489109', '0.486266', '0.486051', '0.492228', '0.494100', '0.493843', '0.497560', '0.495186', '0.488457', '0.493008', '0.499024', '0.492029', '0.499512', '0.508564', '0.495810', '0.498367', '0.499757', '0.503051', '0.488738', '0.496354']
         : correct/total = [(6961, 14232), (6922, 14235), (6934, 14266), (6998, 14217), (7035, 14238), (7098, 14373), (7138, 14346), (7098, 14334), (6982, 14294), (7086, 14373), (7158, 14344), (7037, 14302), (7170, 14354), (7304, 14362), (7100, 14320), (7174, 14395), (7191, 14389), (7172, 14257), (6965, 14251), (7147, 14399)]
         : compromised: 0.4948, honest: 0.4950
Round 006: test acc mean=0.4949 ± 0.0056 | min=0.4861 max=0.5086
         : test loss mean=159.2817 ± 1.7679
         : individual accs = ['0.489109', '0.486266', '0.486051', '0.492228', '0.494100', '0.493843', '0.497560', '0.495186', '0.488457', '0.493008', '0.499024', '0.492029', '0.499512', '0.508564', '0.495810', '0.498367', '0.499757', '0.503051', '0.488738', '0.496354']
         : correct/total = [(6961, 14232), (6922, 14235), (6934, 14266), (6998, 14217), (7035, 14238), (7098, 14373), (7138, 14346), (7098, 14334), (6982, 14294), (7086, 14373), (7158, 14344), (7037, 14302), (7170, 14354), (7304, 14362), (7100, 14320), (7174, 14395), (7191, 14389), (7172, 14257), (6965, 14251), (7147, 14399)]
         : compromised: 0.4948, honest: 0.4950
Round 007: test acc mean=0.4949 ± 0.0056 | min=0.4861 max=0.5086
         : test loss mean=117.7984 ± 1.3797
         : individual accs = ['0.489109', '0.486266', '0.486051', '0.492228', '0.494100', '0.493843', '0.497560', '0.495186', '0.488457', '0.493008', '0.499024', '0.492029', '0.499512', '0.508564', '0.495810', '0.498367', '0.499757', '0.503051', '0.488738', '0.496354']
         : correct/total = [(6961, 14232), (6922, 14235), (6934, 14266), (6998, 14217), (7035, 14238), (7098, 14373), (7138, 14346), (7098, 14334), (6982, 14294), (7086, 14373), (7158, 14344), (7037, 14302), (7170, 14354), (7304, 14362), (7100, 14320), (7174, 14395), (7191, 14389), (7172, 14257), (6965, 14251), (7147, 14399)]
         : compromised: 0.4948, honest: 0.4950
Round 008: test acc mean=0.4880 ± 0.0039 | min=0.4768 max=0.4928
         : test loss mean=10.4374 ± 0.1042
         : individual accs = ['0.490514', '0.486828', '0.480443', '0.489555', '0.490799', '0.491129', '0.492751', '0.486605', '0.485378', '0.490016', '0.488706', '0.490491', '0.490107', '0.486701', '0.484078', '0.490031', '0.491973', '0.491197', '0.485720', '0.476769']
         : correct/total = [(6981, 14232), (6930, 14235), (6854, 14266), (6960, 14217), (6988, 14238), (7059, 14373), (7069, 14346), (6975, 14334), (6938, 14294), (7043, 14373), (7010, 14344), (7015, 14302), (7035, 14354), (6990, 14362), (6932, 14320), (7054, 14395), (7079, 14389), (7003, 14257), (6922, 14251), (6865, 14399)]
         : compromised: 0.4872, honest: 0.4898
Round 009: test acc mean=0.5027 ± 0.0047 | min=0.4923 max=0.5127
         : test loss mean=1.4741 ± 0.0221
         : individual accs = ['0.507518', '0.503407', '0.507500', '0.503130', '0.498946', '0.500244', '0.498118', '0.505442', '0.512663', '0.507201', '0.503416', '0.504125', '0.498607', '0.492341', '0.505447', '0.501007', '0.504066', '0.495265', '0.506912', '0.498854']
         : correct/total = [(7223, 14232), (7166, 14235), (7240, 14266), (7153, 14217), (7104, 14238), (7190, 14373), (7146, 14346), (7245, 14334), (7328, 14294), (7290, 14373), (7221, 14344), (7210, 14302), (7157, 14354), (7071, 14362), (7238, 14320), (7212, 14395), (7253, 14389), (7061, 14257), (7224, 14251), (7183, 14399)]
         : compromised: 0.5020, honest: 0.5044
Round 010: test acc mean=0.5072 ± 0.0061 | min=0.4935 max=0.5191
         : test loss mean=6.2919 ± 0.1256
         : individual accs = ['0.510680', '0.519073', '0.513879', '0.511078', '0.505619', '0.508384', '0.502997', '0.505442', '0.514831', '0.514089', '0.507320', '0.508181', '0.501045', '0.493455', '0.502723', '0.501910', '0.501494', '0.499825', '0.513508', '0.508508']
         : correct/total = [(7268, 14232), (7389, 14235), (7331, 14266), (7266, 14217), (7199, 14238), (7307, 14373), (7216, 14346), (7245, 14334), (7359, 14294), (7389, 14373), (7277, 14344), (7268, 14302), (7192, 14354), (7087, 14362), (7199, 14320), (7225, 14395), (7216, 14389), (7126, 14257), (7318, 14251), (7322, 14399)]
         : compromised: 0.5071, honest: 0.5074

=== FINAL RESULTS ===
Dataset: sent140, Nodes: 20, Graph: fully, Aggregation: d-fedavg
Attack: backdoor, 70.0% compromised
Final accuracy - Compromised: 0.5071, Honest: 0.5074
Overall test accuracy: mean=0.5072 ± 0.0061

=== BACKDOOR ATTACK SUCCESS RATE (ASR) ===
Target label: 1
Trigger size: 3x3
Overall ASR: 0.1503 ± 0.0035
Honest nodes ASR: 0.1509 ± 0.0018
Compromised nodes ASR: 0.1501 ± 0.0040
Note: Higher ASR indicates more successful backdoor attack
