Device: cuda
Seed: 987654321
Loading 1 LEAF Sent140 train files...
LEAF Sent140 train: 254555 users, 908652 samples
Building vocabulary (max_size=10000)...
Vocabulary size: 10000
Loading 1 LEAF Sent140 test files...
LEAF Sent140 test: 254555 users, 286281 samples
Found 254555 train users, 254555 test users, 254555 common users
User sample counts range: 494 (max) to 1 (min)
Distributed ALL 254555 users across 20 clients
Users per client: 12727 (with 15 clients getting +1 user)
Train partition sizes: [44353, 44290, 44657, 44907, 44696, 45843, 45801, 45619, 45069, 45639, 45821, 45311, 45779, 46056, 45625, 45984, 46428, 44737, 45540, 46497]
Test partition sizes: [14232, 14235, 14266, 14217, 14238, 14373, 14346, 14334, 14294, 14373, 14344, 14302, 14354, 14362, 14320, 14395, 14389, 14257, 14251, 14399]
  Client 0: 44353 train samples, 2 unique classes
  Client 1: 44290 train samples, 2 unique classes
  Client 2: 44657 train samples, 2 unique classes
  Client 3: 44907 train samples, 2 unique classes
  Client 4: 44696 train samples, 2 unique classes
  Client 5: 45843 train samples, 2 unique classes
  Client 6: 45801 train samples, 2 unique classes
  Client 7: 45619 train samples, 2 unique classes
  Client 8: 45069 train samples, 2 unique classes
  Client 9: 45639 train samples, 2 unique classes
  Client 10: 45821 train samples, 2 unique classes
  Client 11: 45311 train samples, 2 unique classes
  Client 12: 45779 train samples, 2 unique classes
  Client 13: 46056 train samples, 2 unique classes
  Client 14: 45625 train samples, 2 unique classes
  Client 15: 45984 train samples, 2 unique classes
  Client 16: 46428 train samples, 2 unique classes
  Client 17: 44737 train samples, 2 unique classes
  Client 18: 45540 train samples, 2 unique classes
  Client 19: 46497 train samples, 2 unique classes
Will sample 4500 samples per client per epoch
Graph: ring, nodes: 20, edges: 20
Degree statistics: avg=2.00, min=2, max=2
Attack: Compromised 10/20 nodes: [1, 2, 5, 11, 12, 13, 14, 15, 17, 18]
Attack type: backdoor, lambda: 1.0
Backdoor target label: 1, trigger size: 3
Model variant: baseline
Model parameters: 1,174,986
Initial test acc across nodes: mean=0.4953 ± 0.0174
Backdoor attack: Created poisoned datasets for 10 compromised nodes
Round 001: test acc mean=0.5039 ± 0.0105 | min=0.4894 max=0.5338
         : test loss mean=19.9955 ± 36.5513
         : individual accs = ['0.499227', '0.514366', '0.500210', '0.512837', '0.496137', '0.489390', '0.502509', '0.524766', '0.502169', '0.533779', '0.496933', '0.501049', '0.502856', '0.506824', '0.492528', '0.500104', '0.505734', '0.507260', '0.494772', '0.494757']
         : correct/total = [(7105, 14232), (7322, 14235), (7136, 14266), (7291, 14217), (7064, 14238), (7034, 14373), (7209, 14346), (7522, 14334), (7178, 14294), (7672, 14373), (7128, 14344), (7166, 14302), (7218, 14354), (7279, 14362), (7053, 14320), (7199, 14395), (7277, 14389), (7232, 14257), (7051, 14251), (7124, 14399)]
         : compromised: 0.5009, honest: 0.5069
Round 002: test acc mean=0.4962 ± 0.0065 | min=0.4853 max=0.5091
         : test loss mean=34.8452 ± 53.0815
         : individual accs = ['0.494379', '0.487812', '0.486962', '0.485334', '0.492977', '0.499269', '0.499024', '0.505093', '0.509095', '0.504905', '0.489334', '0.495735', '0.497144', '0.493176', '0.507332', '0.496700', '0.490792', '0.494915', '0.495685', '0.498507']
         : correct/total = [(7036, 14232), (6944, 14235), (6947, 14266), (6900, 14217), (7019, 14238), (7176, 14373), (7159, 14346), (7240, 14334), (7277, 14294), (7257, 14373), (7019, 14344), (7090, 14302), (7136, 14354), (7083, 14362), (7265, 14320), (7150, 14395), (7062, 14389), (7056, 14257), (7064, 14251), (7178, 14399)]
         : compromised: 0.4955, honest: 0.4969
Round 003: test acc mean=0.5045 ± 0.0082 | min=0.4929 max=0.5260
         : test loss mean=52.9420 ± 111.0129
         : individual accs = ['0.497189', '0.508957', '0.509673', '0.518675', '0.507304', '0.504209', '0.500139', '0.511162', '0.526025', '0.503861', '0.496235', '0.499511', '0.497144', '0.492898', '0.507891', '0.495936', '0.506359', '0.496247', '0.511543', '0.499410']
         : correct/total = [(7076, 14232), (7245, 14235), (7271, 14266), (7374, 14217), (7223, 14238), (7247, 14373), (7175, 14346), (7327, 14334), (7519, 14294), (7242, 14373), (7118, 14344), (7144, 14302), (7136, 14354), (7079, 14362), (7273, 14320), (7139, 14395), (7286, 14389), (7075, 14257), (7290, 14251), (7191, 14399)]
         : compromised: 0.5024, honest: 0.5066
Round 004: test acc mean=0.5069 ± 0.0050 | min=0.4997 max=0.5170
         : test loss mean=67.4019 ± 121.1386
         : individual accs = ['0.507659', '0.516965', '0.513318', '0.513470', '0.506462', '0.504070', '0.499930', '0.513674', '0.502588', '0.510610', '0.501185', '0.506642', '0.507872', '0.512394', '0.499651', '0.502188', '0.507401', '0.504735', '0.504807', '0.502188']
         : correct/total = [(7225, 14232), (7359, 14235), (7323, 14266), (7300, 14217), (7211, 14238), (7245, 14373), (7172, 14346), (7363, 14334), (7184, 14294), (7339, 14373), (7189, 14344), (7246, 14302), (7290, 14354), (7359, 14362), (7155, 14320), (7229, 14395), (7301, 14389), (7196, 14257), (7194, 14251), (7231, 14399)]
         : compromised: 0.5073, honest: 0.5065
Round 005: test acc mean=0.5022 ± 0.0120 | min=0.4848 max=0.5380
         : test loss mean=456.4533 ± 1061.8122
         : individual accs = ['0.498665', '0.490832', '0.494532', '0.484772', '0.495013', '0.496626', '0.504879', '0.497209', '0.537988', '0.498574', '0.500627', '0.493707', '0.497980', '0.497354', '0.504469', '0.519625', '0.514490', '0.521498', '0.498351', '0.497118']
         : correct/total = [(7097, 14232), (6987, 14235), (7055, 14266), (6892, 14217), (7048, 14238), (7138, 14373), (7243, 14346), (7127, 14334), (7690, 14294), (7166, 14373), (7181, 14344), (7061, 14302), (7148, 14354), (7143, 14362), (7224, 14320), (7480, 14395), (7403, 14389), (7435, 14257), (7102, 14251), (7158, 14399)]
         : compromised: 0.5015, honest: 0.5029
Round 006: test acc mean=0.4988 ± 0.0090 | min=0.4828 max=0.5196
         : test loss mean=2103.3886 ± 4985.8975
         : individual accs = ['0.511031', '0.494907', '0.497757', '0.494056', '0.491150', '0.512767', '0.484525', '0.499791', '0.519589', '0.504835', '0.496375', '0.499650', '0.491849', '0.492619', '0.482821', '0.491699', '0.498645', '0.499264', '0.504807', '0.507813']
         : correct/total = [(7273, 14232), (7045, 14235), (7101, 14266), (7024, 14217), (6993, 14238), (7370, 14373), (6951, 14346), (7164, 14334), (7427, 14294), (7256, 14373), (7120, 14344), (7146, 14302), (7060, 14354), (7075, 14362), (6914, 14320), (7078, 14395), (7175, 14389), (7118, 14257), (7194, 14251), (7312, 14399)]
         : compromised: 0.4968, honest: 0.5008
Round 007: test acc mean=0.5056 ± 0.0123 | min=0.4836 max=0.5297
         : test loss mean=10121.8183 ± 24073.8687
         : individual accs = ['0.505551', '0.509308', '0.503575', '0.520433', '0.511167', '0.507062', '0.505298', '0.493442', '0.499860', '0.506157', '0.502649', '0.501888', '0.529748', '0.524857', '0.527304', '0.483640', '0.487317', '0.488322', '0.502702', '0.501354']
         : correct/total = [(7195, 14232), (7250, 14235), (7184, 14266), (7399, 14217), (7278, 14238), (7288, 14373), (7249, 14346), (7073, 14334), (7145, 14294), (7275, 14373), (7210, 14344), (7178, 14302), (7604, 14354), (7538, 14362), (7551, 14320), (6962, 14395), (7012, 14389), (6962, 14257), (7164, 14251), (7219, 14399)]
         : compromised: 0.5078, honest: 0.5033
Round 008: test acc mean=0.5015 ± 0.0072 | min=0.4859 max=0.5159
         : test loss mean=93677.8021 ± 223061.5099
         : individual accs = ['0.491568', '0.503337', '0.512057', '0.515861', '0.504846', '0.503444', '0.501743', '0.509000', '0.501259', '0.493912', '0.501046', '0.506433', '0.497422', '0.494639', '0.489944', '0.502605', '0.505734', '0.504384', '0.504035', '0.485867']
         : correct/total = [(6996, 14232), (7165, 14235), (7305, 14266), (7334, 14217), (7188, 14238), (7236, 14373), (7198, 14346), (7296, 14334), (7165, 14294), (7099, 14373), (7187, 14344), (7243, 14302), (7140, 14354), (7104, 14362), (7016, 14320), (7235, 14395), (7277, 14389), (7191, 14257), (7183, 14251), (6996, 14399)]
         : compromised: 0.5018, honest: 0.5011
Round 009: test acc mean=0.4994 ± 0.0087 | min=0.4854 max=0.5168
         : test loss mean=754084.4267 ± 1795343.7134
         : individual accs = ['0.499438', '0.488795', '0.494673', '0.485405', '0.494803', '0.504557', '0.494145', '0.515697', '0.502658', '0.495234', '0.491076', '0.486505', '0.511077', '0.506127', '0.516830', '0.496422', '0.503649', '0.503332', '0.494702', '0.503716']
         : correct/total = [(7108, 14232), (6958, 14235), (7057, 14266), (6901, 14217), (7045, 14238), (7252, 14373), (7089, 14346), (7392, 14334), (7185, 14294), (7118, 14373), (7044, 14344), (6958, 14302), (7336, 14354), (7269, 14362), (7401, 14320), (7146, 14395), (7247, 14389), (7176, 14257), (7050, 14251), (7253, 14399)]
         : compromised: 0.5003, honest: 0.4986
Round 010: test acc mean=0.5015 ± 0.0086 | min=0.4825 max=0.5232
         : test loss mean=5771058.2609 ± 13743018.5881
         : individual accs = ['0.509205', '0.512329', '0.497406', '0.523247', '0.511027', '0.497878', '0.496515', '0.494000', '0.506436', '0.499687', '0.499791', '0.497972', '0.491501', '0.495126', '0.482472', '0.498645', '0.501842', '0.500035', '0.509578', '0.504410']
         : correct/total = [(7247, 14232), (7293, 14235), (7096, 14266), (7439, 14217), (7276, 14238), (7156, 14373), (7123, 14346), (7081, 14334), (7239, 14294), (7182, 14373), (7169, 14344), (7122, 14302), (7055, 14354), (7111, 14362), (6909, 14320), (7178, 14395), (7221, 14389), (7129, 14257), (7262, 14251), (7263, 14399)]
         : compromised: 0.4983, honest: 0.5046

=== FINAL RESULTS ===
Dataset: sent140, Nodes: 20, Graph: ring, Aggregation: krum
Attack: backdoor, 50.0% compromised
Final accuracy - Compromised: 0.4983, Honest: 0.5046
Overall test accuracy: mean=0.5015 ± 0.0086

=== BACKDOOR ATTACK SUCCESS RATE (ASR) ===
Target label: 1
Trigger size: 3x3
Overall ASR: 0.3852 ± 0.3558
Honest nodes ASR: 0.4090 ± 0.3833
Compromised nodes ASR: 0.3614 ± 0.3242
Note: Higher ASR indicates more successful backdoor attack
