Device: cuda
Seed: 987654321
Loading 1 LEAF Sent140 train files...
LEAF Sent140 train: 254555 users, 908652 samples
Building vocabulary (max_size=10000)...
Vocabulary size: 10000
Loading 1 LEAF Sent140 test files...
LEAF Sent140 test: 254555 users, 286281 samples
Found 254555 train users, 254555 test users, 254555 common users
User sample counts range: 494 (max) to 1 (min)
Distributed ALL 254555 users across 20 clients
Users per client: 12727 (with 15 clients getting +1 user)
Train partition sizes: [44353, 44290, 44657, 44907, 44696, 45843, 45801, 45619, 45069, 45639, 45821, 45311, 45779, 46056, 45625, 45984, 46428, 44737, 45540, 46497]
Test partition sizes: [14232, 14235, 14266, 14217, 14238, 14373, 14346, 14334, 14294, 14373, 14344, 14302, 14354, 14362, 14320, 14395, 14389, 14257, 14251, 14399]
  Client 0: 44353 train samples, 2 unique classes
  Client 1: 44290 train samples, 2 unique classes
  Client 2: 44657 train samples, 2 unique classes
  Client 3: 44907 train samples, 2 unique classes
  Client 4: 44696 train samples, 2 unique classes
  Client 5: 45843 train samples, 2 unique classes
  Client 6: 45801 train samples, 2 unique classes
  Client 7: 45619 train samples, 2 unique classes
  Client 8: 45069 train samples, 2 unique classes
  Client 9: 45639 train samples, 2 unique classes
  Client 10: 45821 train samples, 2 unique classes
  Client 11: 45311 train samples, 2 unique classes
  Client 12: 45779 train samples, 2 unique classes
  Client 13: 46056 train samples, 2 unique classes
  Client 14: 45625 train samples, 2 unique classes
  Client 15: 45984 train samples, 2 unique classes
  Client 16: 46428 train samples, 2 unique classes
  Client 17: 44737 train samples, 2 unique classes
  Client 18: 45540 train samples, 2 unique classes
  Client 19: 46497 train samples, 2 unique classes
Will sample 4500 samples per client per epoch
Graph: erdos, nodes: 20, edges: 126
Degree statistics: avg=12.60, min=8, max=16
Attack: Compromised 2/20 nodes: [5, 13]
Attack type: directed_deviation, lambda: 1.0
Model variant: baseline
Model parameters: 1,174,986
Initial test acc across nodes: mean=0.4965 ± 0.0152
Round 001: test acc mean=0.5506 ± 0.0492 | min=0.4921 max=0.6098
         : test loss mean=10.9075 ± 11.0441
         : individual accs = ['0.505481', '0.609835', '0.503645', '0.607512', '0.595519', '0.497182', '0.502788', '0.593903', '0.492095', '0.602797', '0.604573', '0.496924', '0.585412', '0.518451', '0.495251', '0.601806', '0.595385', '0.596339', '0.498632', '0.508369']
         : correct/total = [(7194, 14232), (8681, 14235), (7185, 14266), (8637, 14217), (8479, 14238), (7146, 14373), (7213, 14346), (8513, 14334), (7034, 14294), (8664, 14373), (8672, 14344), (7107, 14302), (8403, 14354), (7446, 14362), (7092, 14320), (8663, 14395), (8567, 14389), (8502, 14257), (7106, 14251), (7320, 14399)]
         : compromised: 0.5078, honest: 0.5553
Round 002: test acc mean=0.6070 ± 0.0324 | min=0.5081 max=0.6249
         : test loss mean=2.1273 ± 4.4328
         : individual accs = ['0.617201', '0.607236', '0.512547', '0.624886', '0.618205', '0.619912', '0.617315', '0.621529', '0.508115', '0.622000', '0.620538', '0.616208', '0.618434', '0.613981', '0.617947', '0.620841', '0.615192', '0.616189', '0.615395', '0.616918']
         : correct/total = [(8784, 14232), (8644, 14235), (7312, 14266), (8884, 14217), (8802, 14238), (8910, 14373), (8856, 14346), (8909, 14334), (7263, 14294), (8940, 14373), (8901, 14344), (8813, 14302), (8877, 14354), (8818, 14362), (8849, 14320), (8937, 14395), (8852, 14389), (8785, 14257), (8770, 14251), (8883, 14399)]
         : compromised: 0.6169, honest: 0.6059
Round 003: test acc mean=0.6279 ± 0.0046 | min=0.6201 max=0.6356
         : test loss mean=0.6439 ± 0.0032
         : individual accs = ['0.629918', '0.625149', '0.620847', '0.635577', '0.630987', '0.623182', '0.626168', '0.628645', '0.625227', '0.634314', '0.620120', '0.626276', '0.635642', '0.631528', '0.624651', '0.632581', '0.621864', '0.626920', '0.626061', '0.631641']
         : correct/total = [(8965, 14232), (8899, 14235), (8857, 14266), (9036, 14217), (8984, 14238), (8957, 14373), (8983, 14346), (9011, 14334), (8937, 14294), (9117, 14373), (8895, 14344), (8957, 14302), (9124, 14354), (9070, 14362), (8945, 14320), (9106, 14395), (8948, 14389), (8938, 14257), (8922, 14251), (9095, 14399)]
         : compromised: 0.6274, honest: 0.6279
Round 004: test acc mean=0.6329 ± 0.0038 | min=0.6267 max=0.6406
         : test loss mean=0.6382 ± 0.0024
         : individual accs = ['0.637226', '0.637513', '0.630240', '0.631779', '0.634359', '0.626939', '0.634602', '0.632971', '0.627466', '0.640576', '0.630717', '0.630262', '0.630835', '0.635914', '0.626746', '0.637860', '0.636111', '0.629656', '0.630833', '0.634766']
         : correct/total = [(9069, 14232), (9075, 14235), (8991, 14266), (8982, 14217), (9032, 14238), (9011, 14373), (9104, 14346), (9073, 14334), (8969, 14294), (9207, 14373), (9047, 14344), (9014, 14302), (9055, 14354), (9133, 14362), (8975, 14320), (9182, 14395), (9153, 14389), (8977, 14257), (8990, 14251), (9140, 14399)]
         : compromised: 0.6314, honest: 0.6330
Round 005: test acc mean=0.6389 ± 0.0042 | min=0.6327 max=0.6469
         : test loss mean=0.6330 ± 0.0027
         : individual accs = ['0.637999', '0.646927', '0.632693', '0.634452', '0.642014', '0.635288', '0.643106', '0.637435', '0.634602', '0.643985', '0.644032', '0.636974', '0.639613', '0.642320', '0.634148', '0.644113', '0.641601', '0.633934', '0.634762', '0.638517']
         : correct/total = [(9080, 14232), (9209, 14235), (9026, 14266), (9020, 14217), (9141, 14238), (9131, 14373), (9226, 14346), (9137, 14334), (9071, 14294), (9256, 14373), (9238, 14344), (9110, 14302), (9181, 14354), (9225, 14362), (9081, 14320), (9272, 14395), (9232, 14389), (9038, 14257), (9046, 14251), (9194, 14399)]
         : compromised: 0.6388, honest: 0.6389
Round 006: test acc mean=0.6446 ± 0.0043 | min=0.6361 max=0.6544
         : test loss mean=0.6284 ± 0.0035
         : individual accs = ['0.649874', '0.648051', '0.642016', '0.645284', '0.642506', '0.636123', '0.646243', '0.642110', '0.644816', '0.654352', '0.643405', '0.646413', '0.643305', '0.651232', '0.638547', '0.647447', '0.642435', '0.637932', '0.644376', '0.644628']
         : correct/total = [(9249, 14232), (9225, 14235), (9159, 14266), (9174, 14217), (9148, 14238), (9143, 14373), (9271, 14346), (9204, 14334), (9217, 14294), (9405, 14373), (9229, 14344), (9245, 14302), (9234, 14354), (9353, 14362), (9144, 14320), (9320, 14395), (9244, 14389), (9095, 14257), (9183, 14251), (9282, 14399)]
         : compromised: 0.6437, honest: 0.6447
Round 007: test acc mean=0.6466 ± 0.0063 | min=0.6361 max=0.6592
         : test loss mean=0.6256 ± 0.0043
         : individual accs = ['0.647695', '0.649526', '0.636058', '0.652318', '0.640539', '0.636749', '0.647498', '0.643854', '0.639639', '0.659153', '0.648912', '0.640470', '0.650829', '0.657777', '0.646578', '0.655853', '0.644034', '0.642421', '0.645569', '0.646434']
         : correct/total = [(9218, 14232), (9246, 14235), (9074, 14266), (9274, 14217), (9120, 14238), (9152, 14373), (9289, 14346), (9229, 14334), (9143, 14294), (9474, 14373), (9308, 14344), (9160, 14302), (9342, 14354), (9447, 14362), (9259, 14320), (9441, 14395), (9267, 14389), (9159, 14257), (9200, 14251), (9308, 14399)]
         : compromised: 0.6473, honest: 0.6465
Round 008: test acc mean=0.6562 ± 0.0033 | min=0.6494 max=0.6645
         : test loss mean=0.6169 ± 0.0026
         : individual accs = ['0.657251', '0.664489', '0.651619', '0.657171', '0.659362', '0.649412', '0.657465', '0.652295', '0.656149', '0.658457', '0.656930', '0.656482', '0.657656', '0.657012', '0.652514', '0.660438', '0.657099', '0.654065', '0.653147', '0.655879']
         : correct/total = [(9354, 14232), (9459, 14235), (9296, 14266), (9343, 14217), (9388, 14238), (9334, 14373), (9432, 14346), (9350, 14334), (9379, 14294), (9464, 14373), (9423, 14344), (9389, 14302), (9440, 14354), (9436, 14362), (9344, 14320), (9507, 14395), (9455, 14389), (9325, 14257), (9308, 14251), (9444, 14399)]
         : compromised: 0.6532, honest: 0.6566
Round 009: test acc mean=0.6608 ± 0.0039 | min=0.6535 max=0.6692
         : test loss mean=0.6128 ± 0.0029
         : individual accs = ['0.668283', '0.669196', '0.656105', '0.659492', '0.662944', '0.654700', '0.664715', '0.659481', '0.653491', '0.663605', '0.662437', '0.661376', '0.663090', '0.660980', '0.661243', '0.659257', '0.658559', '0.658343', '0.657708', '0.661713']
         : correct/total = [(9511, 14232), (9526, 14235), (9360, 14266), (9376, 14217), (9439, 14238), (9410, 14373), (9536, 14346), (9453, 14334), (9341, 14294), (9538, 14373), (9502, 14344), (9459, 14302), (9518, 14354), (9493, 14362), (9469, 14320), (9490, 14395), (9476, 14389), (9386, 14257), (9373, 14251), (9528, 14399)]
         : compromised: 0.6578, honest: 0.6612
Round 010: test acc mean=0.6658 ± 0.0038 | min=0.6581 max=0.6724
         : test loss mean=0.6082 ± 0.0031
         : individual accs = ['0.671796', '0.672357', '0.658068', '0.665190', '0.664770', '0.661657', '0.669106', '0.664574', '0.667903', '0.668615', '0.663622', '0.665292', '0.666574', '0.662443', '0.664735', '0.671414', '0.664396', '0.658904', '0.666199', '0.668727']
         : correct/total = [(9561, 14232), (9571, 14235), (9388, 14266), (9457, 14217), (9465, 14238), (9510, 14373), (9599, 14346), (9526, 14334), (9547, 14294), (9610, 14373), (9519, 14344), (9515, 14302), (9568, 14354), (9514, 14362), (9519, 14320), (9665, 14395), (9560, 14389), (9394, 14257), (9494, 14251), (9629, 14399)]
         : compromised: 0.6620, honest: 0.6662

=== FINAL RESULTS ===
Dataset: sent140, Nodes: 20, Graph: erdos, Aggregation: krum
Attack: directed_deviation, 10.0% compromised
Final accuracy - Compromised: 0.6620, Honest: 0.6662
Overall test accuracy: mean=0.6658 ± 0.0038
