Device: cuda
Seed: 987654321
Loading 1 LEAF Sent140 train files...
LEAF Sent140 train: 254555 users, 908652 samples
Building vocabulary (max_size=10000)...
Vocabulary size: 10000
Loading 1 LEAF Sent140 test files...
LEAF Sent140 test: 254555 users, 286281 samples
Found 254555 train users, 254555 test users, 254555 common users
User sample counts range: 494 (max) to 1 (min)
Distributed ALL 254555 users across 20 clients
Users per client: 12727 (with 15 clients getting +1 user)
Train partition sizes: [44353, 44290, 44657, 44907, 44696, 45843, 45801, 45619, 45069, 45639, 45821, 45311, 45779, 46056, 45625, 45984, 46428, 44737, 45540, 46497]
Test partition sizes: [14232, 14235, 14266, 14217, 14238, 14373, 14346, 14334, 14294, 14373, 14344, 14302, 14354, 14362, 14320, 14395, 14389, 14257, 14251, 14399]
  Client 0: 44353 train samples, 2 unique classes
  Client 1: 44290 train samples, 2 unique classes
  Client 2: 44657 train samples, 2 unique classes
  Client 3: 44907 train samples, 2 unique classes
  Client 4: 44696 train samples, 2 unique classes
  Client 5: 45843 train samples, 2 unique classes
  Client 6: 45801 train samples, 2 unique classes
  Client 7: 45619 train samples, 2 unique classes
  Client 8: 45069 train samples, 2 unique classes
  Client 9: 45639 train samples, 2 unique classes
  Client 10: 45821 train samples, 2 unique classes
  Client 11: 45311 train samples, 2 unique classes
  Client 12: 45779 train samples, 2 unique classes
  Client 13: 46056 train samples, 2 unique classes
  Client 14: 45625 train samples, 2 unique classes
  Client 15: 45984 train samples, 2 unique classes
  Client 16: 46428 train samples, 2 unique classes
  Client 17: 44737 train samples, 2 unique classes
  Client 18: 45540 train samples, 2 unique classes
  Client 19: 46497 train samples, 2 unique classes
Will sample 4500 samples per client per epoch
Graph: erdos, nodes: 20, edges: 126
Degree statistics: avg=12.60, min=8, max=16
Attack: Compromised 12/20 nodes: [1, 2, 3, 5, 8, 11, 12, 13, 14, 15, 17, 18]
Attack type: gaussian, lambda: 1.0
Model variant: baseline
Model parameters: 1,174,986
UBAR ALGORITHM (Two-Stage Byzantine-resilient)
  - Model dimension: 1,174,986 parameters
  - Rho parameter: 0.4
  - Stage 1: Distance-based filtering (select 40% closest neighbors)
  - Stage 2: Performance-based selection (loss comparison)
  - Complexity: O(deg(i)×d + deg(i)×inference)
Initial test acc across nodes: mean=0.4953 ± 0.0174
Round 001: test acc mean=0.5615 ± 0.0318 | min=0.4962 max=0.6137
         : test loss mean=0.6890 ± 0.0020
         : individual accs = ['0.571951', '0.591078', '0.570517', '0.496237', '0.613710', '0.543867', '0.602956', '0.613158', '0.554289', '0.575245', '0.524400', '0.515103', '0.573429', '0.557374', '0.543226', '0.579437', '0.521787', '0.564004', '0.533647', '0.584902']
         : correct/total = [(8140, 14232), (8414, 14235), (8139, 14266), (7055, 14217), (8738, 14238), (7817, 14373), (8650, 14346), (8789, 14334), (7923, 14294), (8268, 14373), (7522, 14344), (7367, 14302), (8231, 14354), (8005, 14362), (7779, 14320), (8341, 14395), (7508, 14389), (8041, 14257), (7605, 14251), (8422, 14399)]
         : compromised: 0.5519, honest: 0.5760
         : ubar stats = ['Node 0: s1=0.375, s2=0.833', 'Node 1: s1=0.364, s2=0.250', 'Node 2: s1=0.333, s2=0.250']...
Round 002: test acc mean=0.5850 ± 0.0496 | min=0.4929 max=0.6428
         : test loss mean=0.6823 ± 0.0104
         : individual accs = ['0.629286', '0.642782', '0.532315', '0.634592', '0.631549', '0.530300', '0.592569', '0.632203', '0.533581', '0.632227', '0.618098', '0.552370', '0.521109', '0.615165', '0.492947', '0.612157', '0.515880', '0.605878', '0.537717', '0.636294']
         : correct/total = [(8956, 14232), (9150, 14235), (7594, 14266), (9022, 14217), (8992, 14238), (7622, 14373), (8501, 14346), (9062, 14334), (7627, 14294), (9087, 14373), (8866, 14344), (7900, 14302), (7480, 14354), (8835, 14362), (7059, 14320), (8812, 14395), (7423, 14389), (8638, 14257), (7663, 14251), (9162, 14399)]
         : compromised: 0.5676, honest: 0.6110
         : ubar stats = ['Node 0: s1=0.375, s2=0.833', 'Node 1: s1=0.364, s2=0.250', 'Node 2: s1=0.333, s2=0.250']...
Round 003: test acc mean=0.6022 ± 0.0466 | min=0.5083 max=0.6449
         : test loss mean=0.6693 ± 0.0153
         : individual accs = ['0.618817', '0.644889', '0.595962', '0.598087', '0.637449', '0.629096', '0.522445', '0.568648', '0.636631', '0.639185', '0.518823', '0.644875', '0.630904', '0.596644', '0.519623', '0.508301', '0.637223', '0.624255', '0.627254', '0.644142']
         : correct/total = [(8807, 14232), (9180, 14235), (8502, 14266), (8503, 14217), (9076, 14238), (9042, 14373), (7495, 14346), (8151, 14334), (9100, 14294), (9187, 14373), (7442, 14344), (9223, 14302), (9056, 14354), (8569, 14362), (7441, 14320), (7317, 14395), (9169, 14389), (8900, 14257), (8939, 14251), (9275, 14399)]
         : compromised: 0.6047, honest: 0.5983
         : ubar stats = ['Node 0: s1=0.375, s2=0.667', 'Node 1: s1=0.364, s2=0.250', 'Node 2: s1=0.333, s2=0.417']...
Round 004: test acc mean=0.6309 ± 0.0238 | min=0.5313 max=0.6484
         : test loss mean=0.6520 ± 0.0113
         : individual accs = ['0.639896', '0.531296', '0.625403', '0.634663', '0.617011', '0.648438', '0.636972', '0.637994', '0.644886', '0.639880', '0.637409', '0.641798', '0.634039', '0.630901', '0.635265', '0.638972', '0.634373', '0.635688', '0.632657', '0.641017']
         : correct/total = [(9107, 14232), (7563, 14235), (8922, 14266), (9023, 14217), (8785, 14238), (9320, 14373), (9138, 14346), (9145, 14334), (9218, 14294), (9197, 14373), (9143, 14344), (9179, 14302), (9101, 14354), (9061, 14362), (9097, 14320), (9198, 14395), (9128, 14389), (9063, 14257), (9016, 14251), (9230, 14399)]
         : compromised: 0.6278, honest: 0.6356
         : ubar stats = ['Node 0: s1=0.375, s2=0.542', 'Node 1: s1=0.364, s2=0.250', 'Node 2: s1=0.333, s2=0.375']...
Round 005: test acc mean=0.6401 ± 0.0072 | min=0.6165 max=0.6528
         : test loss mean=0.6476 ± 0.0083
         : individual accs = ['0.645166', '0.642079', '0.639352', '0.632412', '0.646861', '0.652752', '0.642688', '0.647830', '0.644466', '0.644055', '0.639989', '0.638093', '0.633830', '0.641554', '0.635056', '0.616534', '0.638682', '0.641299', '0.639253', '0.640322']
         : correct/total = [(9182, 14232), (9140, 14235), (9121, 14266), (8991, 14217), (9210, 14238), (9382, 14373), (9220, 14346), (9286, 14334), (9212, 14294), (9257, 14373), (9180, 14344), (9126, 14302), (9098, 14354), (9214, 14362), (9094, 14320), (8875, 14395), (9190, 14389), (9143, 14257), (9110, 14251), (9220, 14399)]
         : compromised: 0.6381, honest: 0.6432
         : ubar stats = ['Node 0: s1=0.375, s2=0.567', 'Node 1: s1=0.364, s2=0.250', 'Node 2: s1=0.333, s2=0.400']...
Round 006: test acc mean=0.6477 ± 0.0049 | min=0.6374 max=0.6563
         : test loss mean=0.6333 ± 0.0033
         : individual accs = ['0.648187', '0.651633', '0.640123', '0.651403', '0.652830', '0.653378', '0.641224', '0.654179', '0.646495', '0.644542', '0.644241', '0.643476', '0.652571', '0.647472', '0.647975', '0.648211', '0.647509', '0.645297', '0.637359', '0.656296']
         : correct/total = [(9225, 14232), (9276, 14235), (9132, 14266), (9261, 14217), (9295, 14238), (9391, 14373), (9199, 14346), (9377, 14334), (9241, 14294), (9264, 14373), (9241, 14344), (9203, 14302), (9367, 14354), (9299, 14362), (9279, 14320), (9331, 14395), (9317, 14389), (9200, 14257), (9083, 14251), (9450, 14399)]
         : compromised: 0.6471, honest: 0.6486
         : ubar stats = ['Node 0: s1=0.375, s2=0.528', 'Node 1: s1=0.364, s2=0.250', 'Node 2: s1=0.333, s2=0.500']...
Round 007: test acc mean=0.6495 ± 0.0095 | min=0.6256 max=0.6617
         : test loss mean=0.6296 ± 0.0074
         : individual accs = ['0.652473', '0.658307', '0.631642', '0.649223', '0.653111', '0.661657', '0.653004', '0.631715', '0.656989', '0.650525', '0.643893', '0.656971', '0.659955', '0.653809', '0.652933', '0.625564', '0.644381', '0.652942', '0.649428', '0.651504']
         : correct/total = [(9286, 14232), (9371, 14235), (9011, 14266), (9230, 14217), (9299, 14238), (9510, 14373), (9368, 14346), (9055, 14334), (9391, 14294), (9350, 14373), (9236, 14344), (9396, 14302), (9473, 14354), (9390, 14362), (9350, 14320), (9005, 14395), (9272, 14389), (9309, 14257), (9255, 14251), (9381, 14399)]
         : compromised: 0.6508, honest: 0.6476
         : ubar stats = ['Node 0: s1=0.375, s2=0.476', 'Node 1: s1=0.364, s2=0.250', 'Node 2: s1=0.333, s2=0.571']...
Round 008: test acc mean=0.6533 ± 0.0066 | min=0.6370 max=0.6637
         : test loss mean=0.6247 ± 0.0056
         : individual accs = ['0.656689', '0.661047', '0.636969', '0.654779', '0.637519', '0.663675', '0.658650', '0.655435', '0.657269', '0.652126', '0.650376', '0.656132', '0.648042', '0.652068', '0.648743', '0.658909', '0.655084', '0.653153', '0.653358', '0.656712']
         : correct/total = [(9346, 14232), (9410, 14235), (9087, 14266), (9309, 14217), (9077, 14238), (9539, 14373), (9449, 14346), (9395, 14334), (9395, 14294), (9373, 14373), (9329, 14344), (9384, 14302), (9302, 14354), (9365, 14362), (9290, 14320), (9485, 14395), (9426, 14389), (9312, 14257), (9311, 14251), (9456, 14399)]
         : compromised: 0.6537, honest: 0.6528
         : ubar stats = ['Node 0: s1=0.375, s2=0.521', 'Node 1: s1=0.364, s2=0.250', 'Node 2: s1=0.333, s2=0.594']...
Round 009: test acc mean=0.6541 ± 0.0101 | min=0.6242 max=0.6680
         : test loss mean=0.6224 ± 0.0075
         : individual accs = ['0.640528', '0.655497', '0.651409', '0.643736', '0.652690', '0.667641', '0.646591', '0.660109', '0.649783', '0.624156', '0.657487', '0.658090', '0.666783', '0.656663', '0.656983', '0.647378', '0.658003', '0.658273', '0.661918', '0.667963']
         : correct/total = [(9116, 14232), (9331, 14235), (9293, 14266), (9152, 14217), (9293, 14238), (9596, 14373), (9276, 14346), (9462, 14334), (9288, 14294), (8971, 14373), (9431, 14344), (9412, 14302), (9571, 14354), (9431, 14362), (9408, 14320), (9319, 14395), (9468, 14389), (9385, 14257), (9433, 14251), (9618, 14399)]
         : compromised: 0.6562, honest: 0.6509
         : ubar stats = ['Node 0: s1=0.375, s2=0.481', 'Node 1: s1=0.364, s2=0.250', 'Node 2: s1=0.333, s2=0.583']...
Round 010: test acc mean=0.6615 ± 0.0075 | min=0.6468 max=0.6715
         : test loss mean=0.6159 ± 0.0057
         : individual accs = ['0.663435', '0.671092', '0.648885', '0.665049', '0.665262', '0.671537', '0.664645', '0.670364', '0.650483', '0.648090', '0.660694', '0.664033', '0.667828', '0.659031', '0.659986', '0.646752', '0.661617', '0.663253', '0.658620', '0.669005']
         : correct/total = [(9442, 14232), (9553, 14235), (9257, 14266), (9455, 14217), (9472, 14238), (9652, 14373), (9535, 14346), (9609, 14334), (9298, 14294), (9315, 14373), (9477, 14344), (9497, 14302), (9586, 14354), (9465, 14362), (9451, 14320), (9310, 14395), (9520, 14389), (9456, 14257), (9386, 14251), (9633, 14399)]
         : compromised: 0.6605, honest: 0.6629
         : ubar stats = ['Node 0: s1=0.375, s2=0.500', 'Node 1: s1=0.364, s2=0.250', 'Node 2: s1=0.333, s2=0.600']...

=== FINAL RESULTS ===
Dataset: sent140, Nodes: 20, Graph: erdos, Aggregation: ubar
Attack: gaussian, 60.0% compromised
Final accuracy - Compromised: 0.6605, Honest: 0.6629
Overall test accuracy: mean=0.6615 ± 0.0075

=== UBAR SUMMARY ===
Node 0: stage1=0.375, stage2=0.500, overall=0.188
Node 1: stage1=0.364, stage2=0.250, overall=0.091
Node 2: stage1=0.333, stage2=0.600, overall=0.200
Node 3: stage1=0.375, stage2=0.433, overall=0.162
Node 4: stage1=0.364, stage2=0.450, overall=0.164
Node 5: stage1=0.400, stage2=0.483, overall=0.193
Node 6: stage1=0.357, stage2=0.500, overall=0.179
Node 7: stage1=0.357, stage2=0.600, overall=0.214
Node 8: stage1=0.400, stage2=0.350, overall=0.140
Node 9: stage1=0.385, stage2=0.400, overall=0.154
Node 10: stage1=0.333, stage2=0.567, overall=0.189
Node 11: stage1=0.357, stage2=0.700, overall=0.250
Node 12: stage1=0.333, stage2=0.400, overall=0.133
Node 13: stage1=0.385, stage2=0.640, overall=0.246
Node 14: stage1=0.400, stage2=0.683, overall=0.273
Node 15: stage1=0.364, stage2=0.400, overall=0.145
Node 16: stage1=0.385, stage2=0.500, overall=0.192
Node 17: stage1=0.333, stage2=0.500, overall=0.167
Node 18: stage1=0.375, stage2=0.517, overall=0.194
Node 19: stage1=0.375, stage2=0.317, overall=0.119

=== PARALLEL EXECUTION TIME (realistic for distributed system) ===
  COMMUNICATION (max across nodes):
    - Full model transfer: 0.000s (0.0%)
  COMPUTATION (max across nodes):
    - Distance computation: 0.069s (67.9%)
    - Loss computation: 0.025s (24.6%)
    - Aggregation: 0.008s (7.5%)
  TOTALS:
    - Total computation: 0.101s (100.0%)
    - Total communication: 0.000s (0.0%)
    - Total parallel time: 0.101s

=== PER-NODE AVERAGE TIME ===
  - Distance computation: 0.048s
  - Loss computation: 0.018s
  - Aggregation: 0.005s
  - Model transfer: 0.000s
  - Total per node: 0.071s

=== TOTAL COMPUTATIONAL WORK (sum across all nodes) ===
  - Total distance computation: 0.950s
  - Total loss computation: 0.364s
  - Total aggregation: 0.100s
  - Total model transfer: 0.000s
  - Grand total: 1.415s
  - Mean Stage 1 acceptance rate: 0.367
  - Mean Stage 2 acceptance rate: 0.490
  - Overall acceptance rate: 0.180

UBAR Algorithm Properties:
  - Model dimension: 1,174,986
  - Rho parameter: 0.4
  - Two-stage approach: Distance filtering + loss evaluation
  - Stage 1 selects: 40% of neighbors
  - Stage 2 uses: Training sample loss comparison
  - Theoretical complexity: O(deg(i)×d + deg(i)×inference)
  - Approach: UBAR paper implementation
