Device: cuda
Seed: 987654321
Loading 1 LEAF Sent140 train files...
LEAF Sent140 train: 254555 users, 908652 samples
Building vocabulary (max_size=10000)...
Vocabulary size: 10000
Loading 1 LEAF Sent140 test files...
LEAF Sent140 test: 254555 users, 286281 samples
Found 254555 train users, 254555 test users, 254555 common users
User sample counts range: 494 (max) to 1 (min)
Distributed ALL 254555 users across 20 clients
Users per client: 12727 (with 15 clients getting +1 user)
Train partition sizes: [44353, 44290, 44657, 44907, 44696, 45843, 45801, 45619, 45069, 45639, 45821, 45311, 45779, 46056, 45625, 45984, 46428, 44737, 45540, 46497]
Test partition sizes: [14232, 14235, 14266, 14217, 14238, 14373, 14346, 14334, 14294, 14373, 14344, 14302, 14354, 14362, 14320, 14395, 14389, 14257, 14251, 14399]
  Client 0: 44353 train samples, 2 unique classes
  Client 1: 44290 train samples, 2 unique classes
  Client 2: 44657 train samples, 2 unique classes
  Client 3: 44907 train samples, 2 unique classes
  Client 4: 44696 train samples, 2 unique classes
  Client 5: 45843 train samples, 2 unique classes
  Client 6: 45801 train samples, 2 unique classes
  Client 7: 45619 train samples, 2 unique classes
  Client 8: 45069 train samples, 2 unique classes
  Client 9: 45639 train samples, 2 unique classes
  Client 10: 45821 train samples, 2 unique classes
  Client 11: 45311 train samples, 2 unique classes
  Client 12: 45779 train samples, 2 unique classes
  Client 13: 46056 train samples, 2 unique classes
  Client 14: 45625 train samples, 2 unique classes
  Client 15: 45984 train samples, 2 unique classes
  Client 16: 46428 train samples, 2 unique classes
  Client 17: 44737 train samples, 2 unique classes
  Client 18: 45540 train samples, 2 unique classes
  Client 19: 46497 train samples, 2 unique classes
Will sample 4500 samples per client per epoch
Graph: erdos, nodes: 20, edges: 126
Degree statistics: avg=12.60, min=8, max=16
Attack: Compromised 4/20 nodes: [5, 12, 13, 17]
Attack type: backdoor, lambda: 1.0
Backdoor target label: 1, trigger size: 3
Model variant: baseline
Model parameters: 1,174,986
Initial test acc across nodes: mean=0.4965 ± 0.0152
Backdoor attack: Created poisoned datasets for 4 compromised nodes
Round 001: test acc mean=0.5103 ± 0.0288 | min=0.4920 max=0.5988
         : test loss mean=22.9304 ± 13.7287
         : individual accs = ['0.504989', '0.504672', '0.503996', '0.592530', '0.499227', '0.501009', '0.502788', '0.504116', '0.497481', '0.598831', '0.510388', '0.502587', '0.499373', '0.493246', '0.496020', '0.501563', '0.499965', '0.491969', '0.504456', '0.495937']
         : correct/total = [(7187, 14232), (7184, 14235), (7190, 14266), (8424, 14217), (7108, 14238), (7201, 14373), (7213, 14346), (7226, 14334), (7111, 14294), (8607, 14373), (7321, 14344), (7188, 14302), (7168, 14354), (7084, 14362), (7103, 14320), (7220, 14395), (7194, 14389), (7014, 14257), (7189, 14251), (7141, 14399)]
         : compromised: 0.4964, honest: 0.5137
Round 002: test acc mean=0.5147 ± 0.0337 | min=0.4963 max=0.6139
         : test loss mean=28.3440 ± 12.9352
         : individual accs = ['0.496417', '0.506498', '0.502033', '0.613913', '0.510957', '0.500661', '0.514847', '0.499442', '0.522597', '0.613720', '0.500279', '0.505034', '0.497980', '0.502646', '0.507193', '0.500243', '0.498575', '0.497650', '0.507473', '0.496284']
         : correct/total = [(7065, 14232), (7210, 14235), (7162, 14266), (8728, 14217), (7275, 14238), (7196, 14373), (7386, 14346), (7159, 14334), (7470, 14294), (8821, 14373), (7176, 14344), (7223, 14302), (7148, 14354), (7219, 14362), (7263, 14320), (7201, 14395), (7174, 14389), (7095, 14257), (7232, 14251), (7146, 14399)]
         : compromised: 0.4997, honest: 0.5185
Round 003: test acc mean=0.5513 ± 0.0601 | min=0.4925 max=0.6324
         : test loss mean=2.2720 ± 1.4869
         : individual accs = ['0.622541', '0.514577', '0.503785', '0.623409', '0.504074', '0.624574', '0.632441', '0.626413', '0.495243', '0.504627', '0.621305', '0.621242', '0.493939', '0.492480', '0.500838', '0.497256', '0.506707', '0.508242', '0.507473', '0.624974']
         : correct/total = [(8860, 14232), (7325, 14235), (7187, 14266), (8863, 14217), (7177, 14238), (8977, 14373), (9073, 14346), (8979, 14334), (7079, 14294), (7253, 14373), (8912, 14344), (8885, 14302), (7090, 14354), (7073, 14362), (7172, 14320), (7158, 14395), (7291, 14389), (7246, 14257), (7232, 14251), (8999, 14399)]
         : compromised: 0.5298, honest: 0.5567
Round 004: test acc mean=0.5558 ± 0.0639 | min=0.4962 max=0.6418
         : test loss mean=0.7994 ± 0.1319
         : individual accs = ['0.504005', '0.641798', '0.499509', '0.639657', '0.504846', '0.631531', '0.510247', '0.632552', '0.497901', '0.498365', '0.634063', '0.629912', '0.630486', '0.506824', '0.508380', '0.509552', '0.496212', '0.630988', '0.498842', '0.510244']
         : correct/total = [(7173, 14232), (9136, 14235), (7126, 14266), (9094, 14217), (7188, 14238), (9077, 14373), (7320, 14346), (9067, 14334), (7117, 14294), (7163, 14373), (9095, 14344), (9009, 14302), (9050, 14354), (7279, 14362), (7280, 14320), (7335, 14395), (7140, 14389), (8996, 14257), (7109, 14251), (7347, 14399)]
         : compromised: 0.6000, honest: 0.5448
Round 005: test acc mean=0.5067 ± 0.0042 | min=0.4983 max=0.5139
         : test loss mean=2.3095 ± 6.5355
         : individual accs = ['0.505410', '0.498349', '0.512267', '0.504889', '0.503512', '0.505810', '0.509410', '0.512069', '0.507416', '0.507062', '0.501255', '0.499860', '0.504946', '0.511489', '0.509288', '0.506078', '0.505873', '0.513853', '0.502561', '0.511772']
         : correct/total = [(7193, 14232), (7094, 14235), (7308, 14266), (7178, 14217), (7169, 14238), (7270, 14373), (7308, 14346), (7340, 14334), (7253, 14294), (7288, 14373), (7190, 14344), (7149, 14302), (7248, 14354), (7346, 14362), (7293, 14320), (7285, 14395), (7279, 14389), (7326, 14257), (7162, 14251), (7369, 14399)]
         : compromised: 0.5090, honest: 0.5061
Round 006: test acc mean=0.5079 ± 0.0036 | min=0.5012 max=0.5153
         : test loss mean=0.7702 ± 0.0110
         : individual accs = ['0.509064', '0.513945', '0.507921', '0.505733', '0.511940', '0.508592', '0.511362', '0.505651', '0.506996', '0.511097', '0.509551', '0.501189', '0.505922', '0.504526', '0.507123', '0.509899', '0.503093', '0.515326', '0.502281', '0.507188']
         : correct/total = [(7245, 14232), (7316, 14235), (7246, 14266), (7190, 14217), (7289, 14238), (7310, 14373), (7336, 14346), (7248, 14334), (7247, 14294), (7346, 14373), (7309, 14344), (7168, 14302), (7262, 14354), (7246, 14362), (7262, 14320), (7340, 14395), (7239, 14389), (7347, 14257), (7158, 14251), (7303, 14399)]
         : compromised: 0.5086, honest: 0.5078
Round 007: test acc mean=0.5100 ± 0.0042 | min=0.5006 max=0.5179
         : test loss mean=0.7387 ± 0.0042
         : individual accs = ['0.511383', '0.508395', '0.503996', '0.510516', '0.510676', '0.509080', '0.511292', '0.506209', '0.505667', '0.511793', '0.517289', '0.500629', '0.506758', '0.511071', '0.513059', '0.516429', '0.507749', '0.517921', '0.507754', '0.511841']
         : correct/total = [(7278, 14232), (7237, 14235), (7190, 14266), (7258, 14217), (7271, 14238), (7317, 14373), (7335, 14346), (7256, 14334), (7228, 14294), (7356, 14373), (7420, 14344), (7160, 14302), (7274, 14354), (7340, 14362), (7347, 14320), (7434, 14395), (7306, 14389), (7384, 14257), (7236, 14251), (7370, 14399)]
         : compromised: 0.5112, honest: 0.5097
Round 008: test acc mean=0.5095 ± 0.0041 | min=0.5023 max=0.5179
         : test loss mean=0.7280 ± 0.0033
         : individual accs = ['0.512507', '0.517878', '0.506028', '0.510867', '0.512502', '0.513045', '0.504670', '0.508302', '0.504198', '0.514437', '0.506832', '0.506992', '0.502299', '0.516920', '0.509427', '0.509344', '0.506359', '0.506909', '0.511894', '0.509410']
         : correct/total = [(7294, 14232), (7372, 14235), (7219, 14266), (7263, 14217), (7297, 14238), (7374, 14373), (7240, 14346), (7286, 14334), (7207, 14294), (7394, 14373), (7270, 14344), (7251, 14302), (7210, 14354), (7424, 14362), (7295, 14320), (7332, 14395), (7286, 14389), (7227, 14257), (7295, 14251), (7335, 14399)]
         : compromised: 0.5098, honest: 0.5095
Round 009: test acc mean=0.5086 ± 0.0034 | min=0.5029 max=0.5162
         : test loss mean=0.7241 ± 0.0034
         : individual accs = ['0.502881', '0.507201', '0.505958', '0.505803', '0.509552', '0.506992', '0.510804', '0.506628', '0.503568', '0.511584', '0.513246', '0.507481', '0.505991', '0.516223', '0.510894', '0.510594', '0.506290', '0.509925', '0.506701', '0.513786']
         : correct/total = [(7157, 14232), (7220, 14235), (7218, 14266), (7191, 14217), (7255, 14238), (7287, 14373), (7328, 14346), (7262, 14334), (7198, 14294), (7353, 14373), (7362, 14344), (7258, 14302), (7263, 14354), (7414, 14362), (7316, 14320), (7350, 14395), (7285, 14389), (7270, 14257), (7221, 14251), (7398, 14399)]
         : compromised: 0.5098, honest: 0.5083
Round 010: test acc mean=0.5125 ± 0.0029 | min=0.5070 max=0.5184
         : test loss mean=0.7123 ± 0.0019
         : individual accs = ['0.507378', '0.513804', '0.515071', '0.510023', '0.511448', '0.511863', '0.511223', '0.513464', '0.512942', '0.512767', '0.513525', '0.506992', '0.515814', '0.517268', '0.515712', '0.518444', '0.510390', '0.509785', '0.512104', '0.510105']
         : correct/total = [(7221, 14232), (7314, 14235), (7348, 14266), (7251, 14217), (7282, 14238), (7357, 14373), (7334, 14346), (7360, 14334), (7332, 14294), (7370, 14373), (7366, 14344), (7251, 14302), (7404, 14354), (7429, 14362), (7385, 14320), (7463, 14395), (7344, 14389), (7268, 14257), (7298, 14251), (7345, 14399)]
         : compromised: 0.5137, honest: 0.5122

=== FINAL RESULTS ===
Dataset: sent140, Nodes: 20, Graph: erdos, Aggregation: krum
Attack: backdoor, 20.0% compromised
Final accuracy - Compromised: 0.5137, Honest: 0.5122
Overall test accuracy: mean=0.5125 ± 0.0029

=== BACKDOOR ATTACK SUCCESS RATE (ASR) ===
Target label: 1
Trigger size: 3x3
Overall ASR: 0.3439 ± 0.0311
Honest nodes ASR: 0.3457 ± 0.0295
Compromised nodes ASR: 0.3369 ± 0.0359
Note: Higher ASR indicates more successful backdoor attack
