Device: cuda
Seed: 987654321
Loading 1 LEAF Sent140 train files...
LEAF Sent140 train: 254555 users, 908652 samples
Building vocabulary (max_size=10000)...
Vocabulary size: 10000
Loading 1 LEAF Sent140 test files...
LEAF Sent140 test: 254555 users, 286281 samples
Found 254555 train users, 254555 test users, 254555 common users
User sample counts range: 494 (max) to 1 (min)
Distributed ALL 254555 users across 20 clients
Users per client: 12727 (with 15 clients getting +1 user)
Train partition sizes: [44353, 44290, 44657, 44907, 44696, 45843, 45801, 45619, 45069, 45639, 45821, 45311, 45779, 46056, 45625, 45984, 46428, 44737, 45540, 46497]
Test partition sizes: [14232, 14235, 14266, 14217, 14238, 14373, 14346, 14334, 14294, 14373, 14344, 14302, 14354, 14362, 14320, 14395, 14389, 14257, 14251, 14399]
  Client 0: 44353 train samples, 2 unique classes
  Client 1: 44290 train samples, 2 unique classes
  Client 2: 44657 train samples, 2 unique classes
  Client 3: 44907 train samples, 2 unique classes
  Client 4: 44696 train samples, 2 unique classes
  Client 5: 45843 train samples, 2 unique classes
  Client 6: 45801 train samples, 2 unique classes
  Client 7: 45619 train samples, 2 unique classes
  Client 8: 45069 train samples, 2 unique classes
  Client 9: 45639 train samples, 2 unique classes
  Client 10: 45821 train samples, 2 unique classes
  Client 11: 45311 train samples, 2 unique classes
  Client 12: 45779 train samples, 2 unique classes
  Client 13: 46056 train samples, 2 unique classes
  Client 14: 45625 train samples, 2 unique classes
  Client 15: 45984 train samples, 2 unique classes
  Client 16: 46428 train samples, 2 unique classes
  Client 17: 44737 train samples, 2 unique classes
  Client 18: 45540 train samples, 2 unique classes
  Client 19: 46497 train samples, 2 unique classes
Will sample 4500 samples per client per epoch
Graph: erdos, nodes: 20, edges: 48
Degree statistics: avg=4.80, min=2, max=7
Attack: Compromised 12/20 nodes: [1, 2, 3, 5, 8, 11, 12, 13, 14, 15, 17, 18]
Attack type: directed_deviation, lambda: 1.0
Model variant: baseline
Model parameters: 1,174,986
Initial test acc across nodes: mean=0.4953 ± 0.0174
Round 001: test acc mean=0.5000 ± 0.0060 | min=0.4890 max=0.5154
         : test loss mean=9.1234 ± 4.7549
         : individual accs = ['0.510259', '0.499473', '0.498528', '0.515439', '0.504706', '0.504348', '0.500558', '0.489047', '0.501679', '0.496695', '0.492262', '0.496084', '0.502160', '0.500070', '0.497975', '0.496700', '0.504483', '0.492179', '0.502070', '0.495729']
         : correct/total = [(7262, 14232), (7110, 14235), (7112, 14266), (7328, 14217), (7186, 14238), (7249, 14373), (7181, 14346), (7010, 14334), (7171, 14294), (7139, 14373), (7061, 14344), (7095, 14302), (7208, 14354), (7182, 14362), (7131, 14320), (7150, 14395), (7259, 14389), (7017, 14257), (7155, 14251), (7138, 14399)]
         : compromised: 0.5006, honest: 0.4992
Round 002: test acc mean=0.5020 ± 0.0062 | min=0.4901 max=0.5133
         : test loss mean=9.0215 ± 5.7701
         : individual accs = ['0.506535', '0.503899', '0.504767', '0.513259', '0.503020', '0.502192', '0.496375', '0.495326', '0.490066', '0.504140', '0.512897', '0.507831', '0.499303', '0.490739', '0.501816', '0.500660', '0.494058', '0.503191', '0.504035', '0.506494']
         : correct/total = [(7209, 14232), (7173, 14235), (7201, 14266), (7297, 14217), (7162, 14238), (7218, 14373), (7121, 14346), (7100, 14334), (7005, 14294), (7246, 14373), (7357, 14344), (7263, 14302), (7167, 14354), (7048, 14362), (7186, 14320), (7207, 14395), (7109, 14389), (7174, 14257), (7183, 14251), (7293, 14399)]
         : compromised: 0.5018, honest: 0.5024
Round 003: test acc mean=0.4959 ± 0.0101 | min=0.4715 max=0.5074
         : test loss mean=2.4162 ± 1.0812
         : individual accs = ['0.501405', '0.480084', '0.489065', '0.507350', '0.495435', '0.496347', '0.506064', '0.493024', '0.500280', '0.491547', '0.503416', '0.502377', '0.504807', '0.471522', '0.503492', '0.496075', '0.506846', '0.489584', '0.475686', '0.503090']
         : correct/total = [(7136, 14232), (6834, 14235), (6977, 14266), (7213, 14217), (7054, 14238), (7134, 14373), (7260, 14346), (7067, 14334), (7151, 14294), (7065, 14373), (7221, 14344), (7185, 14302), (7246, 14354), (6772, 14362), (7210, 14320), (7141, 14395), (7293, 14389), (6980, 14257), (6779, 14251), (7244, 14399)]
         : compromised: 0.4931, honest: 0.5001
Round 004: test acc mean=0.5011 ± 0.0076 | min=0.4824 max=0.5148
         : test loss mean=4.7440 ± 3.9576
         : individual accs = ['0.482364', '0.499824', '0.512477', '0.488218', '0.501826', '0.502400', '0.497769', '0.498186', '0.500630', '0.499339', '0.495817', '0.511327', '0.505504', '0.494360', '0.507961', '0.500382', '0.514838', '0.504945', '0.505929', '0.497187']
         : correct/total = [(6865, 14232), (7115, 14235), (7311, 14266), (6941, 14217), (7145, 14238), (7221, 14373), (7141, 14346), (7141, 14334), (7156, 14294), (7177, 14373), (7112, 14344), (7313, 14302), (7256, 14354), (7100, 14362), (7274, 14320), (7203, 14395), (7408, 14389), (7199, 14257), (7210, 14251), (7159, 14399)]
         : compromised: 0.5028, honest: 0.4984
Round 005: test acc mean=0.4983 ± 0.0083 | min=0.4808 max=0.5143
         : test loss mean=2.0537 ± 1.5412
         : individual accs = ['0.500492', '0.499052', '0.484509', '0.505803', '0.489114', '0.498017', '0.506692', '0.496023', '0.493704', '0.491964', '0.501673', '0.495665', '0.480772', '0.499861', '0.512849', '0.504828', '0.514282', '0.501578', '0.497719', '0.491631']
         : correct/total = [(7123, 14232), (7104, 14235), (6912, 14266), (7191, 14217), (6964, 14238), (7158, 14373), (7269, 14346), (7110, 14334), (7057, 14294), (7071, 14373), (7196, 14344), (7089, 14302), (6901, 14354), (7179, 14362), (7344, 14320), (7267, 14395), (7400, 14389), (7151, 14257), (7093, 14251), (7079, 14399)]
         : compromised: 0.4979, honest: 0.4990
Round 006: test acc mean=0.5018 ± 0.0057 | min=0.4865 max=0.5096
         : test loss mean=3.0669 ± 2.6583
         : individual accs = ['0.496838', '0.508535', '0.506239', '0.505240', '0.508569', '0.503235', '0.499024', '0.508093', '0.496642', '0.502331', '0.499861', '0.505803', '0.486485', '0.493873', '0.500978', '0.498923', '0.504969', '0.503332', '0.509578', '0.497535']
         : correct/total = [(7071, 14232), (7239, 14235), (7222, 14266), (7183, 14217), (7241, 14238), (7233, 14373), (7159, 14346), (7283, 14334), (7099, 14294), (7220, 14373), (7170, 14344), (7234, 14302), (6983, 14354), (7093, 14362), (7174, 14320), (7182, 14395), (7266, 14389), (7176, 14257), (7262, 14251), (7164, 14399)]
         : compromised: 0.5016, honest: 0.5022
Round 007: test acc mean=0.4991 ± 0.0076 | min=0.4814 max=0.5125
         : test loss mean=1.6712 ± 1.4532
         : individual accs = ['0.497752', '0.492097', '0.481424', '0.497995', '0.500000', '0.493982', '0.512477', '0.492186', '0.502588', '0.496486', '0.506065', '0.495665', '0.491570', '0.506058', '0.503841', '0.499201', '0.491556', '0.511047', '0.499333', '0.510591']
         : correct/total = [(7084, 14232), (7005, 14235), (6868, 14266), (7080, 14217), (7119, 14238), (7100, 14373), (7352, 14346), (7055, 14334), (7184, 14294), (7136, 14373), (7259, 14344), (7089, 14302), (7056, 14354), (7268, 14362), (7215, 14320), (7186, 14395), (7073, 14389), (7286, 14257), (7116, 14251), (7352, 14399)]
         : compromised: 0.4979, honest: 0.5009
Round 008: test acc mean=0.5019 ± 0.0055 | min=0.4919 max=0.5136
         : test loss mean=2.6216 ± 2.5018
         : individual accs = ['0.496838', '0.498349', '0.511286', '0.503904', '0.506040', '0.502679', '0.494563', '0.507395', '0.499160', '0.499687', '0.501673', '0.500489', '0.513585', '0.491854', '0.505656', '0.496144', '0.495517', '0.501999', '0.503193', '0.507674']
         : correct/total = [(7071, 14232), (7094, 14235), (7294, 14266), (7164, 14217), (7205, 14238), (7225, 14373), (7095, 14346), (7273, 14334), (7135, 14294), (7182, 14373), (7196, 14344), (7158, 14302), (7372, 14354), (7064, 14362), (7241, 14320), (7142, 14395), (7130, 14389), (7157, 14257), (7171, 14251), (7310, 14399)]
         : compromised: 0.5024, honest: 0.5012
Round 009: test acc mean=0.4956 ± 0.0067 | min=0.4798 max=0.5075
         : test loss mean=1.3701 ± 1.1549
         : individual accs = ['0.495503', '0.483527', '0.494182', '0.490680', '0.497823', '0.503096', '0.485919', '0.493163', '0.491185', '0.498435', '0.499512', '0.497133', '0.496586', '0.504456', '0.479818', '0.499271', '0.494961', '0.507470', '0.499474', '0.500243']
         : correct/total = [(7052, 14232), (6883, 14235), (7050, 14266), (6976, 14217), (7088, 14238), (7231, 14373), (6971, 14346), (7069, 14334), (7021, 14294), (7164, 14373), (7165, 14344), (7110, 14302), (7128, 14354), (7245, 14362), (6871, 14320), (7187, 14395), (7122, 14389), (7235, 14257), (7118, 14251), (7203, 14399)]
         : compromised: 0.4956, honest: 0.4957
Round 010: test acc mean=0.5023 ± 0.0070 | min=0.4890 max=0.5222
         : test loss mean=2.3959 ± 2.3866
         : individual accs = ['0.496557', '0.489006', '0.509463', '0.497503', '0.503020', '0.504348', '0.501743', '0.506558', '0.501399', '0.503792', '0.506065', '0.501678', '0.506131', '0.489347', '0.505866', '0.495797', '0.505873', '0.498141', '0.501719', '0.522189']
         : correct/total = [(7067, 14232), (6961, 14235), (7268, 14266), (7073, 14217), (7162, 14238), (7249, 14373), (7198, 14346), (7261, 14334), (7167, 14294), (7241, 14373), (7259, 14344), (7175, 14302), (7265, 14354), (7028, 14362), (7244, 14320), (7137, 14395), (7279, 14389), (7102, 14257), (7150, 14251), (7519, 14399)]
         : compromised: 0.5000, honest: 0.5057

=== FINAL RESULTS ===
Dataset: sent140, Nodes: 20, Graph: erdos, Aggregation: krum
Attack: directed_deviation, 60.0% compromised
Final accuracy - Compromised: 0.5000, Honest: 0.5057
Overall test accuracy: mean=0.5023 ± 0.0070
