Device: cuda
Seed: 987654321
Loading 1 LEAF Sent140 train files...
LEAF Sent140 train: 254555 users, 908652 samples
Building vocabulary (max_size=10000)...
Vocabulary size: 10000
Loading 1 LEAF Sent140 test files...
LEAF Sent140 test: 254555 users, 286281 samples
Found 254555 train users, 254555 test users, 254555 common users
User sample counts range: 494 (max) to 1 (min)
Distributed ALL 254555 users across 20 clients
Users per client: 12727 (with 15 clients getting +1 user)
Train partition sizes: [44353, 44290, 44657, 44907, 44696, 45843, 45801, 45619, 45069, 45639, 45821, 45311, 45779, 46056, 45625, 45984, 46428, 44737, 45540, 46497]
Test partition sizes: [14232, 14235, 14266, 14217, 14238, 14373, 14346, 14334, 14294, 14373, 14344, 14302, 14354, 14362, 14320, 14395, 14389, 14257, 14251, 14399]
  Client 0: 44353 train samples, 2 unique classes
  Client 1: 44290 train samples, 2 unique classes
  Client 2: 44657 train samples, 2 unique classes
  Client 3: 44907 train samples, 2 unique classes
  Client 4: 44696 train samples, 2 unique classes
  Client 5: 45843 train samples, 2 unique classes
  Client 6: 45801 train samples, 2 unique classes
  Client 7: 45619 train samples, 2 unique classes
  Client 8: 45069 train samples, 2 unique classes
  Client 9: 45639 train samples, 2 unique classes
  Client 10: 45821 train samples, 2 unique classes
  Client 11: 45311 train samples, 2 unique classes
  Client 12: 45779 train samples, 2 unique classes
  Client 13: 46056 train samples, 2 unique classes
  Client 14: 45625 train samples, 2 unique classes
  Client 15: 45984 train samples, 2 unique classes
  Client 16: 46428 train samples, 2 unique classes
  Client 17: 44737 train samples, 2 unique classes
  Client 18: 45540 train samples, 2 unique classes
  Client 19: 46497 train samples, 2 unique classes
Will sample 4500 samples per client per epoch
Graph: fully, nodes: 20, edges: 190
Degree statistics: avg=19.00, min=19, max=19
Attack: Compromised 10/20 nodes: [1, 2, 5, 11, 12, 13, 14, 15, 17, 18]
Attack type: gaussian, lambda: 1.0
Model variant: baseline
Model parameters: 1,174,986
Sketchguard Node 0:
  Model dim: 1,174,986 → Sketch size: 180
  Compression ratio: 6527.7x
  Using model parameters for aggregation, sketches for filtering
Sketchguard Node 1:
  Model dim: 1,174,986 → Sketch size: 180
  Compression ratio: 6527.7x
  Using model parameters for aggregation, sketches for filtering
Sketchguard Node 2:
  Model dim: 1,174,986 → Sketch size: 180
  Compression ratio: 6527.7x
  Using model parameters for aggregation, sketches for filtering
Sketchguard Node 3:
  Model dim: 1,174,986 → Sketch size: 180
  Compression ratio: 6527.7x
  Using model parameters for aggregation, sketches for filtering
Sketchguard Node 4:
  Model dim: 1,174,986 → Sketch size: 180
  Compression ratio: 6527.7x
  Using model parameters for aggregation, sketches for filtering
Sketchguard Node 5:
  Model dim: 1,174,986 → Sketch size: 180
  Compression ratio: 6527.7x
  Using model parameters for aggregation, sketches for filtering
Sketchguard Node 6:
  Model dim: 1,174,986 → Sketch size: 180
  Compression ratio: 6527.7x
  Using model parameters for aggregation, sketches for filtering
Sketchguard Node 7:
  Model dim: 1,174,986 → Sketch size: 180
  Compression ratio: 6527.7x
  Using model parameters for aggregation, sketches for filtering
Sketchguard Node 8:
  Model dim: 1,174,986 → Sketch size: 180
  Compression ratio: 6527.7x
  Using model parameters for aggregation, sketches for filtering
Sketchguard Node 9:
  Model dim: 1,174,986 → Sketch size: 180
  Compression ratio: 6527.7x
  Using model parameters for aggregation, sketches for filtering
Sketchguard Node 10:
  Model dim: 1,174,986 → Sketch size: 180
  Compression ratio: 6527.7x
  Using model parameters for aggregation, sketches for filtering
Sketchguard Node 11:
  Model dim: 1,174,986 → Sketch size: 180
  Compression ratio: 6527.7x
  Using model parameters for aggregation, sketches for filtering
Sketchguard Node 12:
  Model dim: 1,174,986 → Sketch size: 180
  Compression ratio: 6527.7x
  Using model parameters for aggregation, sketches for filtering
Sketchguard Node 13:
  Model dim: 1,174,986 → Sketch size: 180
  Compression ratio: 6527.7x
  Using model parameters for aggregation, sketches for filtering
Sketchguard Node 14:
  Model dim: 1,174,986 → Sketch size: 180
  Compression ratio: 6527.7x
  Using model parameters for aggregation, sketches for filtering
Sketchguard Node 15:
  Model dim: 1,174,986 → Sketch size: 180
  Compression ratio: 6527.7x
  Using model parameters for aggregation, sketches for filtering
Sketchguard Node 16:
  Model dim: 1,174,986 → Sketch size: 180
  Compression ratio: 6527.7x
  Using model parameters for aggregation, sketches for filtering
Sketchguard Node 17:
  Model dim: 1,174,986 → Sketch size: 180
  Compression ratio: 6527.7x
  Using model parameters for aggregation, sketches for filtering
Sketchguard Node 18:
  Model dim: 1,174,986 → Sketch size: 180
  Compression ratio: 6527.7x
  Using model parameters for aggregation, sketches for filtering
Sketchguard Node 19:
  Model dim: 1,174,986 → Sketch size: 180
  Compression ratio: 6527.7x
  Using model parameters for aggregation, sketches for filtering
Sketchguard ALGORITHM (Sketch-based Filtering + State Aggregation)
  - Model dimension: 1,174,986 parameters
  - Config: SketchguardConfig(gamma=2, kappa=1, alpha=0.5, min_neighbors=1, sketch_size=180, network_seed=987654321, attack_detection_window=5)
  - Sketch size: 180
  - Compression ratio: 6527.7x
  - Complexity: O(d + N×k) = O(1,174,986 + 20×180)
  - Theoretical speedup vs BALANCE: 19.9x
Initial test acc across nodes: mean=0.4953 ± 0.0174
Round 001: test acc mean=0.5658 ± 0.0412 | min=0.4998 max=0.6367
         : test loss mean=0.6897 ± 0.0008
         : individual accs = ['0.582279', '0.557359', '0.517734', '0.514384', '0.636676', '0.560774', '0.623170', '0.625227', '0.504967', '0.555069', '0.522309', '0.544679', '0.627073', '0.543657', '0.567039', '0.573532', '0.499826', '0.592902', '0.566487', '0.601014']
         : correct/total = [(8287, 14232), (7934, 14235), (7386, 14266), (7313, 14217), (9065, 14238), (8060, 14373), (8940, 14346), (8962, 14334), (7218, 14294), (7978, 14373), (7492, 14344), (7790, 14302), (9001, 14354), (7808, 14362), (8120, 14320), (8256, 14395), (7192, 14389), (8453, 14257), (8073, 14251), (8654, 14399)]
         : compromised: 0.5651, honest: 0.5665
         : sketchguard stats = ['Node 0: acc_rate=0.474', 'Node 1: acc_rate=0.526', 'Node 2: acc_rate=0.526']...
Round 002: test acc mean=0.5412 ± 0.0474 | min=0.4856 max=0.6246
         : test loss mean=0.6905 ± 0.0013
         : individual accs = ['0.583263', '0.485564', '0.499860', '0.614687', '0.494873', '0.515480', '0.505089', '0.539277', '0.580383', '0.624643', '0.518753', '0.523214', '0.502856', '0.514552', '0.492598', '0.512192', '0.585725', '0.617942', '0.610203', '0.502535']
         : correct/total = [(8301, 14232), (6912, 14235), (7131, 14266), (8739, 14217), (7046, 14238), (7409, 14373), (7246, 14346), (7730, 14334), (8296, 14294), (8978, 14373), (7441, 14344), (7483, 14302), (7218, 14354), (7390, 14362), (7054, 14320), (7373, 14395), (8428, 14389), (8810, 14257), (8696, 14251), (7236, 14399)]
         : compromised: 0.5274, honest: 0.5549
         : sketchguard stats = ['Node 0: acc_rate=0.474', 'Node 1: acc_rate=0.526', 'Node 2: acc_rate=0.526']...
Round 003: test acc mean=0.5172 ± 0.0293 | min=0.4844 max=0.6171
         : test loss mean=0.6897 ± 0.0018
         : individual accs = ['0.523398', '0.484370', '0.495724', '0.524443', '0.516716', '0.526543', '0.499930', '0.494489', '0.511683', '0.532596', '0.498397', '0.617116', '0.502926', '0.507589', '0.492598', '0.497742', '0.520120', '0.538542', '0.561575', '0.498090']
         : correct/total = [(7449, 14232), (6895, 14235), (7072, 14266), (7456, 14217), (7357, 14238), (7568, 14373), (7172, 14346), (7088, 14334), (7314, 14294), (7655, 14373), (7149, 14344), (8826, 14302), (7219, 14354), (7290, 14362), (7054, 14320), (7165, 14395), (7484, 14389), (7678, 14257), (8003, 14251), (7172, 14399)]
         : compromised: 0.5225, honest: 0.5120
         : sketchguard stats = ['Node 0: acc_rate=0.474', 'Node 1: acc_rate=0.526', 'Node 2: acc_rate=0.526']...
Round 004: test acc mean=0.5649 ± 0.0405 | min=0.5028 max=0.6337
         : test loss mean=0.6834 ± 0.0029
         : individual accs = ['0.578977', '0.511416', '0.604094', '0.566927', '0.573817', '0.599944', '0.616618', '0.531743', '0.525325', '0.633688', '0.556539', '0.529087', '0.513515', '0.554031', '0.502793', '0.529420', '0.622281', '0.543593', '0.625289', '0.578235']
         : correct/total = [(8240, 14232), (7280, 14235), (8618, 14266), (8060, 14217), (8170, 14238), (8623, 14373), (8846, 14346), (7622, 14334), (7509, 14294), (9108, 14373), (7983, 14344), (7567, 14302), (7371, 14354), (7957, 14362), (7200, 14320), (7621, 14395), (8954, 14389), (7750, 14257), (8911, 14251), (8326, 14399)]
         : compromised: 0.5513, honest: 0.5784
         : sketchguard stats = ['Node 0: acc_rate=0.474', 'Node 1: acc_rate=0.526', 'Node 2: acc_rate=0.526']...
Round 005: test acc mean=0.6316 ± 0.0107 | min=0.6063 max=0.6500
         : test loss mean=0.6645 ± 0.0041
         : individual accs = ['0.636383', '0.628662', '0.606267', '0.628684', '0.638011', '0.642802', '0.641363', '0.649993', '0.626207', '0.636471', '0.623536', '0.635016', '0.617598', '0.609943', '0.632332', '0.641264', '0.627076', '0.637722', '0.632868', '0.640183']
         : correct/total = [(9057, 14232), (8949, 14235), (8649, 14266), (8938, 14217), (9084, 14238), (9239, 14373), (9201, 14346), (9317, 14334), (8951, 14294), (9148, 14373), (8944, 14344), (9082, 14302), (8865, 14354), (8760, 14362), (9055, 14320), (9231, 14395), (9023, 14389), (9092, 14257), (9019, 14251), (9218, 14399)]
         : compromised: 0.6284, honest: 0.6348
         : sketchguard stats = ['Node 0: acc_rate=0.474', 'Node 1: acc_rate=0.526', 'Node 2: acc_rate=0.526']...
Round 006: test acc mean=0.6446 ± 0.0063 | min=0.6254 max=0.6539
         : test loss mean=0.6389 ± 0.0031
         : individual accs = ['0.645025', '0.649175', '0.636478', '0.646691', '0.641452', '0.652752', '0.646034', '0.653900', '0.648734', '0.644611', '0.642499', '0.647951', '0.643166', '0.643156', '0.647346', '0.645571', '0.650914', '0.625377', '0.635394', '0.646364']
         : correct/total = [(9180, 14232), (9241, 14235), (9080, 14266), (9194, 14217), (9133, 14238), (9382, 14373), (9268, 14346), (9373, 14334), (9273, 14294), (9265, 14373), (9216, 14344), (9267, 14302), (9232, 14354), (9237, 14362), (9270, 14320), (9293, 14395), (9366, 14389), (8916, 14257), (9055, 14251), (9307, 14399)]
         : compromised: 0.6426, honest: 0.6466
         : sketchguard stats = ['Node 0: acc_rate=0.474', 'Node 1: acc_rate=0.526', 'Node 2: acc_rate=0.526']...
Round 007: test acc mean=0.6492 ± 0.0069 | min=0.6312 max=0.6601
         : test loss mean=0.6306 ± 0.0047
         : individual accs = ['0.647976', '0.655638', '0.631221', '0.648238', '0.650583', '0.660057', '0.652307', '0.645110', '0.656079', '0.653100', '0.640337', '0.651657', '0.655218', '0.642250', '0.655726', '0.643348', '0.654667', '0.654345', '0.641709', '0.644281']
         : correct/total = [(9222, 14232), (9333, 14235), (9005, 14266), (9216, 14217), (9263, 14238), (9487, 14373), (9358, 14346), (9247, 14334), (9378, 14294), (9387, 14373), (9185, 14344), (9320, 14302), (9405, 14354), (9224, 14362), (9390, 14320), (9261, 14395), (9420, 14389), (9329, 14257), (9145, 14251), (9277, 14399)]
         : compromised: 0.6491, honest: 0.6493
         : sketchguard stats = ['Node 0: acc_rate=0.474', 'Node 1: acc_rate=0.526', 'Node 2: acc_rate=0.526']...
Round 008: test acc mean=0.6562 ± 0.0050 | min=0.6452 max=0.6654
         : test loss mean=0.6242 ± 0.0036
         : individual accs = ['0.654370', '0.656200', '0.647694', '0.661110', '0.649951', '0.665414', '0.659487', '0.645249', '0.662026', '0.659500', '0.655396', '0.659768', '0.652780', '0.655340', '0.652304', '0.659673', '0.659045', '0.659045', '0.650621', '0.659282']
         : correct/total = [(9313, 14232), (9341, 14235), (9240, 14266), (9399, 14217), (9254, 14238), (9564, 14373), (9461, 14346), (9249, 14334), (9463, 14294), (9479, 14373), (9401, 14344), (9436, 14302), (9370, 14354), (9412, 14362), (9341, 14320), (9496, 14395), (9483, 14389), (9396, 14257), (9272, 14251), (9493, 14399)]
         : compromised: 0.6559, honest: 0.6565
         : sketchguard stats = ['Node 0: acc_rate=0.474', 'Node 1: acc_rate=0.526', 'Node 2: acc_rate=0.526']...
Round 009: test acc mean=0.6581 ± 0.0090 | min=0.6272 max=0.6687
         : test loss mean=0.6218 ± 0.0073
         : individual accs = ['0.627248', '0.667861', '0.657928', '0.657171', '0.660275', '0.668684', '0.653771', '0.661225', '0.652092', '0.663118', '0.655884', '0.652286', '0.664693', '0.667804', '0.649232', '0.652588', '0.663910', '0.663393', '0.659743', '0.663102']
         : correct/total = [(8927, 14232), (9507, 14235), (9386, 14266), (9343, 14217), (9401, 14238), (9611, 14373), (9379, 14346), (9478, 14334), (9321, 14294), (9531, 14373), (9408, 14344), (9329, 14302), (9541, 14354), (9591, 14362), (9297, 14320), (9394, 14395), (9553, 14389), (9458, 14257), (9402, 14251), (9548, 14399)]
         : compromised: 0.6604, honest: 0.6558
         : sketchguard stats = ['Node 0: acc_rate=0.474', 'Node 1: acc_rate=0.526', 'Node 2: acc_rate=0.526']...
Round 010: test acc mean=0.6681 ± 0.0066 | min=0.6479 max=0.6792
         : test loss mean=0.6125 ± 0.0060
         : individual accs = ['0.662662', '0.672849', '0.647904', '0.671309', '0.675306', '0.674807', '0.674055', '0.679224', '0.670771', '0.666806', '0.665784', '0.668927', '0.672008', '0.667943', '0.662640', '0.661688', '0.668844', '0.669005', '0.661427', '0.668102']
         : correct/total = [(9431, 14232), (9578, 14235), (9243, 14266), (9544, 14217), (9615, 14238), (9699, 14373), (9670, 14346), (9736, 14334), (9588, 14294), (9584, 14373), (9550, 14344), (9567, 14302), (9646, 14354), (9593, 14362), (9489, 14320), (9525, 14395), (9624, 14389), (9538, 14257), (9426, 14251), (9620, 14399)]
         : compromised: 0.6659, honest: 0.6703
         : sketchguard stats = ['Node 0: acc_rate=0.474', 'Node 1: acc_rate=0.526', 'Node 2: acc_rate=0.526']...

=== FINAL RESULTS ===
Dataset: sent140, Nodes: 20, Graph: fully, Aggregation: sketchguard
Attack: gaussian, 50.0% compromised
Final accuracy - Compromised: 0.6659, Honest: 0.6703
Overall test accuracy: mean=0.6681 ± 0.0066

=== Sketchguard SUMMARY ===
Node 0: acceptance=0.474
Node 1: acceptance=0.526
Node 2: acceptance=0.526
Node 3: acceptance=0.474
Node 4: acceptance=0.474
Node 5: acceptance=0.526
Node 6: acceptance=0.474
Node 7: acceptance=0.474
Node 8: acceptance=0.474
Node 9: acceptance=0.474
Node 10: acceptance=0.474
Node 11: acceptance=0.526
Node 12: acceptance=0.526
Node 13: acceptance=0.526
Node 14: acceptance=0.526
Node 15: acceptance=0.526
Node 16: acceptance=0.474
Node 17: acceptance=0.526
Node 18: acceptance=0.526
Node 19: acceptance=0.474

=== PARALLEL EXECUTION TIME (realistic for distributed system) ===
  COMMUNICATION (max across nodes):
    - Sketch transfer: 0.000s (0.0%)
    - Model fetch (accepted): 0.000s (0.0%)
  COMPUTATION (max across nodes):
    - Sketching: 0.465s (94.8%)
    - Filtering: 0.003s (0.5%)
    - Aggregation: 0.023s (4.7%)
  TOTALS:
    - Total computation: 0.491s (100.0%)
    - Total communication: 0.000s (0.0%)
    - Total parallel time: 0.491s

=== PER-NODE AVERAGE TIME ===
  - Sketching: 0.414s
  - Filtering: 0.001s
  - Aggregation: 0.019s
  - Sketch transfer: 0.000s
  - Model fetch: 0.000s
  - Total per node: 0.434s

=== TOTAL COMPUTATIONAL WORK (sum across all nodes) ===
  - Total sketching: 8.283s
  - Total filtering: 0.019s
  - Total aggregation: 0.372s
  - Total sketch transfer: 0.000s
  - Total model fetch: 0.000s
  - Grand total: 8.673s
  - Mean acceptance rate: 0.500

Sketchguard Algorithm Properties:
  - Original dimension: 1,174,986
  - Sketch size: 180
  - Compression ratio: 19.9x
  - Single repetition: No repetitions needed
  - Theoretical complexity: O(d + N×k)
  - Approach: Sketch filtering + state aggregation
