Device: cuda
Seed: 987654321
Loading 1 LEAF Sent140 train files...
LEAF Sent140 train: 254555 users, 908652 samples
Building vocabulary (max_size=10000)...
Vocabulary size: 10000
Loading 1 LEAF Sent140 test files...
LEAF Sent140 test: 254555 users, 286281 samples
Found 254555 train users, 254555 test users, 254555 common users
User sample counts range: 494 (max) to 1 (min)
Distributed ALL 254555 users across 20 clients
Users per client: 12727 (with 15 clients getting +1 user)
Train partition sizes: [44353, 44290, 44657, 44907, 44696, 45843, 45801, 45619, 45069, 45639, 45821, 45311, 45779, 46056, 45625, 45984, 46428, 44737, 45540, 46497]
Test partition sizes: [14232, 14235, 14266, 14217, 14238, 14373, 14346, 14334, 14294, 14373, 14344, 14302, 14354, 14362, 14320, 14395, 14389, 14257, 14251, 14399]
  Client 0: 44353 train samples, 2 unique classes
  Client 1: 44290 train samples, 2 unique classes
  Client 2: 44657 train samples, 2 unique classes
  Client 3: 44907 train samples, 2 unique classes
  Client 4: 44696 train samples, 2 unique classes
  Client 5: 45843 train samples, 2 unique classes
  Client 6: 45801 train samples, 2 unique classes
  Client 7: 45619 train samples, 2 unique classes
  Client 8: 45069 train samples, 2 unique classes
  Client 9: 45639 train samples, 2 unique classes
  Client 10: 45821 train samples, 2 unique classes
  Client 11: 45311 train samples, 2 unique classes
  Client 12: 45779 train samples, 2 unique classes
  Client 13: 46056 train samples, 2 unique classes
  Client 14: 45625 train samples, 2 unique classes
  Client 15: 45984 train samples, 2 unique classes
  Client 16: 46428 train samples, 2 unique classes
  Client 17: 44737 train samples, 2 unique classes
  Client 18: 45540 train samples, 2 unique classes
  Client 19: 46497 train samples, 2 unique classes
Will sample 4500 samples per client per epoch
Graph: erdos, nodes: 20, edges: 99
Degree statistics: avg=9.90, min=7, max=14
Attack: Compromised 6/20 nodes: [5, 12, 13, 14, 17, 18]
Attack type: directed_deviation, lambda: 1.0
Model variant: baseline
Model parameters: 1,174,986
Initial test acc across nodes: mean=0.4965 ± 0.0152
Round 001: test acc mean=0.5022 ± 0.0242 | min=0.4837 max=0.6028
         : test loss mean=22.4290 ± 9.3697
         : individual accs = ['0.511172', '0.489708', '0.483738', '0.493283', '0.497191', '0.508175', '0.494075', '0.501535', '0.487127', '0.602797', '0.497421', '0.490980', '0.495472', '0.495683', '0.510615', '0.500313', '0.496629', '0.493021', '0.490562', '0.505174']
         : correct/total = [(7275, 14232), (6971, 14235), (6901, 14266), (7013, 14217), (7079, 14238), (7304, 14373), (7088, 14346), (7189, 14334), (6963, 14294), (8664, 14373), (7135, 14344), (7022, 14302), (7112, 14354), (7119, 14362), (7312, 14320), (7202, 14395), (7146, 14389), (7029, 14257), (6991, 14251), (7274, 14399)]
         : compromised: 0.4989, honest: 0.5037
Round 002: test acc mean=0.5102 ± 0.0264 | min=0.4909 max=0.6217
         : test loss mean=25.6418 ± 8.9314
         : individual accs = ['0.505059', '0.499192', '0.515001', '0.508687', '0.511308', '0.496834', '0.506831', '0.510604', '0.502099', '0.621652', '0.505996', '0.510698', '0.511495', '0.490879', '0.508799', '0.497117', '0.498367', '0.494985', '0.511333', '0.496493']
         : correct/total = [(7188, 14232), (7106, 14235), (7347, 14266), (7232, 14217), (7280, 14238), (7141, 14373), (7271, 14346), (7319, 14334), (7177, 14294), (8935, 14373), (7258, 14344), (7304, 14302), (7342, 14354), (7050, 14362), (7286, 14320), (7156, 14395), (7171, 14389), (7057, 14257), (7287, 14251), (7149, 14399)]
         : compromised: 0.5024, honest: 0.5135
Round 003: test acc mean=0.5194 ± 0.0461 | min=0.4887 max=0.6315
         : test loss mean=2.3342 ± 1.4939
         : individual accs = ['0.489531', '0.507903', '0.631501', '0.499683', '0.629161', '0.494121', '0.497560', '0.495396', '0.500070', '0.491129', '0.503277', '0.493497', '0.512331', '0.513508', '0.500419', '0.498576', '0.622281', '0.501929', '0.488667', '0.518022']
         : correct/total = [(6967, 14232), (7230, 14235), (9009, 14266), (7104, 14217), (8958, 14238), (7102, 14373), (7138, 14346), (7101, 14334), (7148, 14294), (7059, 14373), (7219, 14344), (7058, 14302), (7354, 14354), (7375, 14362), (7166, 14320), (7177, 14395), (8954, 14389), (7156, 14257), (6964, 14251), (7459, 14399)]
         : compromised: 0.5018, honest: 0.5270
Round 004: test acc mean=0.5148 ± 0.0297 | min=0.4928 max=0.6387
         : test loss mean=9.4843 ± 6.6452
         : individual accs = ['0.520939', '0.524412', '0.638721', '0.517831', '0.499789', '0.498991', '0.506901', '0.497209', '0.497202', '0.505740', '0.511712', '0.511397', '0.522920', '0.492759', '0.506215', '0.503717', '0.510181', '0.513502', '0.511122', '0.504549']
         : correct/total = [(7414, 14232), (7465, 14235), (9112, 14266), (7362, 14217), (7116, 14238), (7172, 14373), (7272, 14346), (7127, 14334), (7107, 14294), (7269, 14373), (7340, 14344), (7314, 14302), (7506, 14354), (7077, 14362), (7249, 14320), (7251, 14395), (7341, 14389), (7321, 14257), (7284, 14251), (7265, 14399)]
         : compromised: 0.5076, honest: 0.5179
Round 005: test acc mean=0.4955 ± 0.0082 | min=0.4819 max=0.5109
         : test loss mean=8.6326 ± 6.2846
         : individual accs = ['0.483207', '0.481911', '0.490677', '0.489695', '0.497542', '0.489181', '0.500906', '0.502442', '0.490206', '0.508314', '0.495468', '0.496364', '0.499791', '0.510932', '0.482542', '0.494825', '0.501911', '0.506769', '0.489510', '0.498160']
         : correct/total = [(6877, 14232), (6860, 14235), (7000, 14266), (6962, 14217), (7084, 14238), (7031, 14373), (7186, 14346), (7202, 14334), (7007, 14294), (7306, 14373), (7107, 14344), (7099, 14302), (7174, 14354), (7338, 14362), (6910, 14320), (7123, 14395), (7222, 14389), (7225, 14257), (6976, 14251), (7173, 14399)]
         : compromised: 0.4965, honest: 0.4951
Round 006: test acc mean=0.5083 ± 0.0076 | min=0.4939 max=0.5242
         : test loss mean=3.7630 ± 1.9331
         : individual accs = ['0.504848', '0.517808', '0.524183', '0.516987', '0.493890', '0.506157', '0.498676', '0.501186', '0.507416', '0.511515', '0.519241', '0.495665', '0.505782', '0.505083', '0.507193', '0.509969', '0.510390', '0.506137', '0.514420', '0.509758']
         : correct/total = [(7185, 14232), (7371, 14235), (7478, 14266), (7350, 14217), (7032, 14238), (7275, 14373), (7154, 14346), (7184, 14334), (7253, 14294), (7352, 14373), (7448, 14344), (7089, 14302), (7260, 14354), (7254, 14362), (7263, 14320), (7341, 14395), (7344, 14389), (7216, 14257), (7331, 14251), (7340, 14399)]
         : compromised: 0.5075, honest: 0.5087
Round 007: test acc mean=0.5001 ± 0.0075 | min=0.4852 max=0.5109
         : test loss mean=7.7763 ± 6.5414
         : individual accs = ['0.491639', '0.510432', '0.508762', '0.496307', '0.500913', '0.507827', '0.489126', '0.496093', '0.488597', '0.498226', '0.509900', '0.497902', '0.501881', '0.510862', '0.485196', '0.498020', '0.505734', '0.496949', '0.506350', '0.500729']
         : correct/total = [(6997, 14232), (7266, 14235), (7258, 14266), (7056, 14217), (7132, 14238), (7299, 14373), (7017, 14346), (7111, 14334), (6984, 14294), (7161, 14373), (7314, 14344), (7121, 14302), (7204, 14354), (7337, 14362), (6948, 14320), (7169, 14395), (7277, 14389), (7085, 14257), (7216, 14251), (7210, 14399)]
         : compromised: 0.5015, honest: 0.4995
Round 008: test acc mean=0.5057 ± 0.0065 | min=0.4949 max=0.5231
         : test loss mean=11.8486 ± 6.7789
         : individual accs = ['0.497892', '0.506217', '0.523062', '0.512274', '0.494943', '0.509149', '0.499721', '0.504535', '0.511124', '0.500104', '0.506135', '0.506433', '0.500557', '0.503273', '0.512151', '0.502327', '0.504274', '0.515115', '0.500526', '0.503646']
         : correct/total = [(7086, 14232), (7206, 14235), (7462, 14266), (7283, 14217), (7047, 14238), (7318, 14373), (7169, 14346), (7232, 14334), (7306, 14294), (7188, 14373), (7260, 14344), (7243, 14302), (7185, 14354), (7228, 14362), (7334, 14320), (7231, 14395), (7256, 14389), (7344, 14257), (7133, 14251), (7252, 14399)]
         : compromised: 0.5068, honest: 0.5052
Round 009: test acc mean=0.5028 ± 0.0048 | min=0.4909 max=0.5112
         : test loss mean=1.9799 ± 0.5038
         : individual accs = ['0.501194', '0.510221', '0.500561', '0.499402', '0.504565', '0.507340', '0.500139', '0.502232', '0.509235', '0.511236', '0.502579', '0.502377', '0.506897', '0.505501', '0.490922', '0.499410', '0.502328', '0.502630', '0.503473', '0.494270']
         : correct/total = [(7133, 14232), (7263, 14235), (7141, 14266), (7100, 14217), (7184, 14238), (7292, 14373), (7175, 14346), (7199, 14334), (7279, 14294), (7348, 14373), (7209, 14344), (7185, 14302), (7276, 14354), (7260, 14362), (7030, 14320), (7189, 14395), (7228, 14389), (7166, 14257), (7175, 14251), (7117, 14399)]
         : compromised: 0.5028, honest: 0.5028
Round 010: test acc mean=0.5031 ± 0.0052 | min=0.4912 max=0.5130
         : test loss mean=7.9929 ± 8.6083
         : individual accs = ['0.506886', '0.510292', '0.504767', '0.506577', '0.502528', '0.504070', '0.501952', '0.493303', '0.501959', '0.513045', '0.497560', '0.508390', '0.501115', '0.491227', '0.502514', '0.496700', '0.507679', '0.505296', '0.503754', '0.503368']
         : correct/total = [(7214, 14232), (7264, 14235), (7201, 14266), (7202, 14217), (7155, 14238), (7245, 14373), (7201, 14346), (7071, 14334), (7175, 14294), (7374, 14373), (7137, 14344), (7271, 14302), (7193, 14354), (7055, 14362), (7196, 14320), (7150, 14395), (7305, 14389), (7204, 14257), (7179, 14251), (7248, 14399)]
         : compromised: 0.5013, honest: 0.5039

=== FINAL RESULTS ===
Dataset: sent140, Nodes: 20, Graph: erdos, Aggregation: krum
Attack: directed_deviation, 30.0% compromised
Final accuracy - Compromised: 0.5013, Honest: 0.5039
Overall test accuracy: mean=0.5031 ± 0.0052
