Device: cuda
Seed: 987654321
Loading 1 LEAF Sent140 train files...
LEAF Sent140 train: 254555 users, 908652 samples
Building vocabulary (max_size=10000)...
Vocabulary size: 10000
Loading 1 LEAF Sent140 test files...
LEAF Sent140 test: 254555 users, 286281 samples
Found 254555 train users, 254555 test users, 254555 common users
User sample counts range: 494 (max) to 1 (min)
Distributed ALL 254555 users across 20 clients
Users per client: 12727 (with 15 clients getting +1 user)
Train partition sizes: [44353, 44290, 44657, 44907, 44696, 45843, 45801, 45619, 45069, 45639, 45821, 45311, 45779, 46056, 45625, 45984, 46428, 44737, 45540, 46497]
Test partition sizes: [14232, 14235, 14266, 14217, 14238, 14373, 14346, 14334, 14294, 14373, 14344, 14302, 14354, 14362, 14320, 14395, 14389, 14257, 14251, 14399]
  Client 0: 44353 train samples, 2 unique classes
  Client 1: 44290 train samples, 2 unique classes
  Client 2: 44657 train samples, 2 unique classes
  Client 3: 44907 train samples, 2 unique classes
  Client 4: 44696 train samples, 2 unique classes
  Client 5: 45843 train samples, 2 unique classes
  Client 6: 45801 train samples, 2 unique classes
  Client 7: 45619 train samples, 2 unique classes
  Client 8: 45069 train samples, 2 unique classes
  Client 9: 45639 train samples, 2 unique classes
  Client 10: 45821 train samples, 2 unique classes
  Client 11: 45311 train samples, 2 unique classes
  Client 12: 45779 train samples, 2 unique classes
  Client 13: 46056 train samples, 2 unique classes
  Client 14: 45625 train samples, 2 unique classes
  Client 15: 45984 train samples, 2 unique classes
  Client 16: 46428 train samples, 2 unique classes
  Client 17: 44737 train samples, 2 unique classes
  Client 18: 45540 train samples, 2 unique classes
  Client 19: 46497 train samples, 2 unique classes
Will sample 4500 samples per client per epoch
Graph: erdos, nodes: 20, edges: 48
Degree statistics: avg=4.80, min=2, max=7
Attack: Compromised 2/20 nodes: [5, 13]
Attack type: krum, lambda: 1.0
Model variant: baseline
Model parameters: 1,174,986
BALANCE algorithm:
Balance Config: BALANCEConfig(gamma=2, kappa=1, alpha=0.5, min_neighbors=1)
  - Model dimension: 1,174,986 parameters
  - Complexity: O(N×d) = O(20×1,174,986)
Initial test acc across nodes: mean=0.4965 ± 0.0152
Round 001: test acc mean=0.5310 ± 0.0228 | min=0.4964 max=0.5686
         : test loss mean=0.7286 ± 0.1015
         : individual accs = ['0.545391', '0.568599', '0.526987', '0.503341', '0.523037', '0.554721', '0.522376', '0.501884', '0.565832', '0.547137', '0.525028', '0.505803', '0.501533', '0.559811', '0.534218', '0.505662', '0.556328', '0.496388', '0.535892', '0.540524']
         : correct/total = [(7762, 14232), (8094, 14235), (7518, 14266), (7156, 14217), (7447, 14238), (7973, 14373), (7494, 14346), (7194, 14334), (8088, 14294), (7864, 14373), (7531, 14344), (7234, 14302), (7199, 14354), (8040, 14362), (7650, 14320), (7279, 14395), (8005, 14389), (7077, 14257), (7637, 14251), (7783, 14399)]
         : compromised: 0.5573, honest: 0.5281
Round 002: test acc mean=0.5058 ± 0.0173 | min=0.4861 max=0.5612
         : test loss mean=0.6930 ± 0.0014
         : individual accs = ['0.489250', '0.513734', '0.486051', '0.497222', '0.495505', '0.498782', '0.498466', '0.522185', '0.488737', '0.503931', '0.505508', '0.507551', '0.561168', '0.491854', '0.502025', '0.509552', '0.499757', '0.536789', '0.511824', '0.496562']
         : correct/total = [(6963, 14232), (7313, 14235), (6934, 14266), (7069, 14217), (7055, 14238), (7169, 14373), (7151, 14346), (7485, 14334), (6986, 14294), (7243, 14373), (7251, 14344), (7259, 14302), (8055, 14354), (7064, 14362), (7189, 14320), (7335, 14395), (7191, 14389), (7653, 14257), (7294, 14251), (7150, 14399)]
         : compromised: 0.4953, honest: 0.5070
Round 003: test acc mean=0.5144 ± 0.0301 | min=0.4861 max=0.5772
         : test loss mean=0.6925 ± 0.0014
         : individual accs = ['0.489109', '0.486266', '0.486051', '0.554618', '0.494100', '0.493843', '0.497560', '0.577229', '0.488457', '0.550685', '0.499024', '0.523493', '0.499512', '0.538017', '0.558310', '0.500452', '0.499757', '0.567230', '0.488387', '0.496354']
         : correct/total = [(6961, 14232), (6922, 14235), (6934, 14266), (7885, 14217), (7035, 14238), (7098, 14373), (7138, 14346), (8274, 14334), (6982, 14294), (7915, 14373), (7158, 14344), (7487, 14302), (7170, 14354), (7727, 14362), (7995, 14320), (7204, 14395), (7191, 14389), (8087, 14257), (6960, 14251), (7147, 14399)]
         : compromised: 0.5159, honest: 0.5143
Round 004: test acc mean=0.5049 ± 0.0222 | min=0.4861 max=0.5638
         : test loss mean=0.6929 ± 0.0009
         : individual accs = ['0.489109', '0.486266', '0.486051', '0.552930', '0.494100', '0.493843', '0.497560', '0.495256', '0.488457', '0.549294', '0.499024', '0.563837', '0.499512', '0.508564', '0.502374', '0.498367', '0.499757', '0.509224', '0.488738', '0.496354']
         : correct/total = [(6961, 14232), (6922, 14235), (6934, 14266), (7861, 14217), (7035, 14238), (7098, 14373), (7138, 14346), (7099, 14334), (6982, 14294), (7895, 14373), (7158, 14344), (8064, 14302), (7170, 14354), (7304, 14362), (7194, 14320), (7174, 14395), (7191, 14389), (7260, 14257), (6965, 14251), (7147, 14399)]
         : compromised: 0.5012, honest: 0.5053
Round 005: test acc mean=0.4951 ± 0.0055 | min=0.4861 max=0.5086
         : test loss mean=0.6934 ± 0.0007
         : individual accs = ['0.489109', '0.486266', '0.486051', '0.495956', '0.494100', '0.493843', '0.497560', '0.495186', '0.488457', '0.494051', '0.499024', '0.492449', '0.499512', '0.508564', '0.495810', '0.498367', '0.499757', '0.503051', '0.488738', '0.496354']
         : correct/total = [(6961, 14232), (6922, 14235), (6934, 14266), (7051, 14217), (7035, 14238), (7098, 14373), (7138, 14346), (7098, 14334), (6982, 14294), (7101, 14373), (7158, 14344), (7043, 14302), (7170, 14354), (7304, 14362), (7100, 14320), (7174, 14395), (7191, 14389), (7172, 14257), (6965, 14251), (7147, 14399)]
         : compromised: 0.5012, honest: 0.4944
Round 006: test acc mean=0.4949 ± 0.0056 | min=0.4861 max=0.5086
         : test loss mean=0.6937 ± 0.0005
         : individual accs = ['0.489109', '0.486266', '0.486051', '0.492228', '0.494100', '0.493843', '0.497560', '0.495186', '0.488457', '0.493008', '0.499024', '0.492029', '0.499512', '0.508564', '0.495810', '0.498367', '0.499757', '0.503051', '0.488738', '0.496354']
         : correct/total = [(6961, 14232), (6922, 14235), (6934, 14266), (6998, 14217), (7035, 14238), (7098, 14373), (7138, 14346), (7098, 14334), (6982, 14294), (7086, 14373), (7158, 14344), (7037, 14302), (7170, 14354), (7304, 14362), (7100, 14320), (7174, 14395), (7191, 14389), (7172, 14257), (6965, 14251), (7147, 14399)]
         : compromised: 0.5012, honest: 0.4941
Round 007: test acc mean=0.4949 ± 0.0056 | min=0.4861 max=0.5086
         : test loss mean=0.6938 ± 0.0003
         : individual accs = ['0.489109', '0.486266', '0.486051', '0.492228', '0.494100', '0.493843', '0.497560', '0.495186', '0.488457', '0.493008', '0.499024', '0.492029', '0.499512', '0.508564', '0.495810', '0.498367', '0.499757', '0.503051', '0.488738', '0.496354']
         : correct/total = [(6961, 14232), (6922, 14235), (6934, 14266), (6998, 14217), (7035, 14238), (7098, 14373), (7138, 14346), (7098, 14334), (6982, 14294), (7086, 14373), (7158, 14344), (7037, 14302), (7170, 14354), (7304, 14362), (7100, 14320), (7174, 14395), (7191, 14389), (7172, 14257), (6965, 14251), (7147, 14399)]
         : compromised: 0.5012, honest: 0.4941
Round 008: test acc mean=0.4949 ± 0.0056 | min=0.4861 max=0.5086
         : test loss mean=0.6939 ± 0.0004
         : individual accs = ['0.489109', '0.486266', '0.486051', '0.492228', '0.494100', '0.493843', '0.497560', '0.495186', '0.488457', '0.493008', '0.499024', '0.492029', '0.499512', '0.508564', '0.495810', '0.498367', '0.499757', '0.503051', '0.488738', '0.496354']
         : correct/total = [(6961, 14232), (6922, 14235), (6934, 14266), (6998, 14217), (7035, 14238), (7098, 14373), (7138, 14346), (7098, 14334), (6982, 14294), (7086, 14373), (7158, 14344), (7037, 14302), (7170, 14354), (7304, 14362), (7100, 14320), (7174, 14395), (7191, 14389), (7172, 14257), (6965, 14251), (7147, 14399)]
         : compromised: 0.5012, honest: 0.4941
Round 009: test acc mean=0.4949 ± 0.0056 | min=0.4861 max=0.5086
         : test loss mean=0.6940 ± 0.0004
         : individual accs = ['0.489109', '0.486266', '0.486051', '0.492228', '0.494100', '0.493843', '0.497560', '0.495186', '0.488457', '0.493008', '0.499024', '0.492029', '0.499512', '0.508564', '0.495810', '0.498367', '0.499757', '0.503051', '0.488738', '0.496354']
         : correct/total = [(6961, 14232), (6922, 14235), (6934, 14266), (6998, 14217), (7035, 14238), (7098, 14373), (7138, 14346), (7098, 14334), (6982, 14294), (7086, 14373), (7158, 14344), (7037, 14302), (7170, 14354), (7304, 14362), (7100, 14320), (7174, 14395), (7191, 14389), (7172, 14257), (6965, 14251), (7147, 14399)]
         : compromised: 0.5012, honest: 0.4941
Round 010: test acc mean=0.4949 ± 0.0056 | min=0.4861 max=0.5086
         : test loss mean=0.6941 ± 0.0004
         : individual accs = ['0.489109', '0.486266', '0.486051', '0.492228', '0.494100', '0.493843', '0.497560', '0.495186', '0.488457', '0.493008', '0.499024', '0.492029', '0.499512', '0.508564', '0.495810', '0.498367', '0.499757', '0.503051', '0.488738', '0.496354']
         : correct/total = [(6961, 14232), (6922, 14235), (6934, 14266), (6998, 14217), (7035, 14238), (7098, 14373), (7138, 14346), (7098, 14334), (6982, 14294), (7086, 14373), (7158, 14344), (7037, 14302), (7170, 14354), (7304, 14362), (7100, 14320), (7174, 14395), (7191, 14389), (7172, 14257), (6965, 14251), (7147, 14399)]
         : compromised: 0.5012, honest: 0.4941

=== FINAL RESULTS ===
Dataset: sent140, Nodes: 20, Graph: erdos, Aggregation: balance
Attack: krum, 10.0% compromised
Final accuracy - Compromised: 0.5012, Honest: 0.4941
Overall test accuracy: mean=0.4949 ± 0.0056

=== BALANCE SUMMARY ===
Node 0: acceptance=1.000
Node 1: acceptance=1.000
Node 2: acceptance=1.000
Node 3: acceptance=0.775
Node 4: acceptance=1.000
Node 5: acceptance=1.000
Node 6: acceptance=1.000
Node 7: acceptance=0.820
Node 8: acceptance=1.000
Node 9: acceptance=1.000
Node 10: acceptance=1.000
Node 11: acceptance=0.743
Node 12: acceptance=0.871
Node 13: acceptance=1.000
Node 14: acceptance=0.743
Node 15: acceptance=0.850
Node 16: acceptance=1.000
Node 17: acceptance=0.820
Node 18: acceptance=1.000
Node 19: acceptance=1.000

=== PARALLEL EXECUTION TIME (realistic for distributed system) ===
  COMMUNICATION (max across nodes):
    - Full model transfer: 0.000s (0.0%)
  COMPUTATION (max across nodes):
    - Filtering: 0.042s (75.0%)
    - Aggregation: 0.014s (24.9%)
  TOTALS:
    - Total computation: 0.056s (100.0%)
    - Total communication: 0.000s (0.0%)
    - Total parallel time: 0.056s

=== PER-NODE AVERAGE TIME ===
  - Filtering: 0.024s
  - Aggregation: 0.007s
  - Model transfer: 0.000s
  - Total per node: 0.030s

=== TOTAL COMPUTATIONAL WORK (sum across all nodes) ===
  - Total filtering: 0.473s
  - Total aggregation: 0.135s
  - Total model transfer: 0.000s
  - Grand total: 0.608s
  - Mean acceptance rate: 0.931

BALANCE Algorithm Properties:
  - Model dimension: 1,174,986
  - No compression: Full parameter comparison
  - Theoretical complexity: O(deg(i)×d)
  - Approach: Full parameter filtering + averaging
