Device: cuda
Seed: 987654321
Loading 1 LEAF Sent140 train files...
LEAF Sent140 train: 254555 users, 908652 samples
Building vocabulary (max_size=10000)...
Vocabulary size: 10000
Loading 1 LEAF Sent140 test files...
LEAF Sent140 test: 254555 users, 286281 samples
Found 254555 train users, 254555 test users, 254555 common users
User sample counts range: 494 (max) to 1 (min)
Distributed ALL 254555 users across 20 clients
Users per client: 12727 (with 15 clients getting +1 user)
Train partition sizes: [44353, 44290, 44657, 44907, 44696, 45843, 45801, 45619, 45069, 45639, 45821, 45311, 45779, 46056, 45625, 45984, 46428, 44737, 45540, 46497]
Test partition sizes: [14232, 14235, 14266, 14217, 14238, 14373, 14346, 14334, 14294, 14373, 14344, 14302, 14354, 14362, 14320, 14395, 14389, 14257, 14251, 14399]
  Client 0: 44353 train samples, 2 unique classes
  Client 1: 44290 train samples, 2 unique classes
  Client 2: 44657 train samples, 2 unique classes
  Client 3: 44907 train samples, 2 unique classes
  Client 4: 44696 train samples, 2 unique classes
  Client 5: 45843 train samples, 2 unique classes
  Client 6: 45801 train samples, 2 unique classes
  Client 7: 45619 train samples, 2 unique classes
  Client 8: 45069 train samples, 2 unique classes
  Client 9: 45639 train samples, 2 unique classes
  Client 10: 45821 train samples, 2 unique classes
  Client 11: 45311 train samples, 2 unique classes
  Client 12: 45779 train samples, 2 unique classes
  Client 13: 46056 train samples, 2 unique classes
  Client 14: 45625 train samples, 2 unique classes
  Client 15: 45984 train samples, 2 unique classes
  Client 16: 46428 train samples, 2 unique classes
  Client 17: 44737 train samples, 2 unique classes
  Client 18: 45540 train samples, 2 unique classes
  Client 19: 46497 train samples, 2 unique classes
Will sample 4500 samples per client per epoch
Graph: erdos, nodes: 20, edges: 99
Degree statistics: avg=9.90, min=7, max=14
Attack: Compromised 16/20 nodes: [1, 2, 3, 5, 6, 8, 9, 10, 11, 12, 13, 14, 15, 17, 18, 19]
Attack type: backdoor, lambda: 1.0
Backdoor target label: 1, trigger size: 3
Model variant: baseline
Model parameters: 1,174,986
Initial test acc across nodes: mean=0.4965 ± 0.0152
Backdoor attack: Created poisoned datasets for 16 compromised nodes
Round 001: test acc mean=0.4976 ± 0.0063 | min=0.4820 max=0.5113
         : test loss mean=14.6418 ± 5.8899
         : individual accs = ['0.507448', '0.501651', '0.501262', '0.496096', '0.489816', '0.492869', '0.500627', '0.496582', '0.511333', '0.495095', '0.500837', '0.493427', '0.500209', '0.482036', '0.497905', '0.488156', '0.499826', '0.497650', '0.499404', '0.499549']
         : correct/total = [(7222, 14232), (7141, 14235), (7151, 14266), (7053, 14217), (6974, 14238), (7084, 14373), (7182, 14346), (7118, 14334), (7309, 14294), (7116, 14373), (7184, 14344), (7057, 14302), (7180, 14354), (6923, 14362), (7130, 14320), (7027, 14395), (7192, 14389), (7095, 14257), (7117, 14251), (7193, 14399)]
         : compromised: 0.4974, honest: 0.4984
Round 002: test acc mean=0.5039 ± 0.0051 | min=0.4955 max=0.5124
         : test loss mean=33.8021 ± 8.3643
         : individual accs = ['0.503443', '0.511626', '0.510094', '0.505592', '0.507445', '0.504070', '0.507528', '0.502093', '0.512383', '0.500661', '0.501534', '0.507901', '0.500766', '0.495544', '0.502444', '0.503230', '0.496004', '0.498632', '0.510280', '0.495868']
         : correct/total = [(7165, 14232), (7283, 14235), (7277, 14266), (7188, 14217), (7225, 14238), (7245, 14373), (7281, 14346), (7197, 14334), (7324, 14294), (7196, 14373), (7194, 14344), (7264, 14302), (7188, 14354), (7117, 14362), (7195, 14320), (7244, 14395), (7137, 14389), (7109, 14257), (7272, 14251), (7140, 14399)]
         : compromised: 0.5043, honest: 0.5022
Round 003: test acc mean=0.5048 ± 0.0059 | min=0.4914 max=0.5139
         : test loss mean=55.6844 ± 20.7960
         : individual accs = ['0.510891', '0.513734', '0.513949', '0.507772', '0.505900', '0.506157', '0.502440', '0.504814', '0.511543', '0.506992', '0.500976', '0.507971', '0.500488', '0.491436', '0.504190', '0.501633', '0.500243', '0.496949', '0.511262', '0.496354']
         : correct/total = [(7271, 14232), (7313, 14235), (7332, 14266), (7219, 14217), (7203, 14238), (7275, 14373), (7208, 14346), (7236, 14334), (7312, 14294), (7287, 14373), (7186, 14344), (7265, 14302), (7184, 14354), (7058, 14362), (7220, 14320), (7221, 14395), (7198, 14389), (7085, 14257), (7286, 14251), (7147, 14399)]
         : compromised: 0.5046, honest: 0.5055
Round 004: test acc mean=0.5048 ± 0.0059 | min=0.4914 max=0.5139
         : test loss mean=189.0175 ± 48.1839
         : individual accs = ['0.510891', '0.513734', '0.513949', '0.507772', '0.505900', '0.506157', '0.502440', '0.504814', '0.511543', '0.506992', '0.500976', '0.507971', '0.500488', '0.491436', '0.504190', '0.501633', '0.500243', '0.496949', '0.511262', '0.496354']
         : correct/total = [(7271, 14232), (7313, 14235), (7332, 14266), (7219, 14217), (7203, 14238), (7275, 14373), (7208, 14346), (7236, 14334), (7312, 14294), (7287, 14373), (7186, 14344), (7265, 14302), (7184, 14354), (7058, 14362), (7220, 14320), (7221, 14395), (7198, 14389), (7085, 14257), (7286, 14251), (7147, 14399)]
         : compromised: 0.5046, honest: 0.5055
Round 005: test acc mean=0.5048 ± 0.0059 | min=0.4914 max=0.5139
         : test loss mean=98.4485 ± 26.1344
         : individual accs = ['0.510891', '0.513734', '0.513949', '0.507772', '0.505900', '0.506157', '0.502440', '0.504814', '0.511543', '0.506992', '0.500976', '0.507971', '0.500488', '0.491436', '0.504190', '0.501633', '0.500243', '0.496949', '0.511262', '0.496354']
         : correct/total = [(7271, 14232), (7313, 14235), (7332, 14266), (7219, 14217), (7203, 14238), (7275, 14373), (7208, 14346), (7236, 14334), (7312, 14294), (7287, 14373), (7186, 14344), (7265, 14302), (7184, 14354), (7058, 14362), (7220, 14320), (7221, 14395), (7198, 14389), (7085, 14257), (7286, 14251), (7147, 14399)]
         : compromised: 0.5046, honest: 0.5055
Round 006: test acc mean=0.5049 ± 0.0057 | min=0.4948 max=0.5156
         : test loss mean=134.9872 ± 86.3219
         : individual accs = ['0.511172', '0.513734', '0.515561', '0.507491', '0.505900', '0.506157', '0.502370', '0.502651', '0.511613', '0.506992', '0.500976', '0.508321', '0.500488', '0.494848', '0.504260', '0.501633', '0.500243', '0.496949', '0.511262', '0.496354']
         : correct/total = [(7275, 14232), (7313, 14235), (7355, 14266), (7215, 14217), (7203, 14238), (7275, 14373), (7207, 14346), (7205, 14334), (7313, 14294), (7287, 14373), (7186, 14344), (7270, 14302), (7184, 14354), (7107, 14362), (7221, 14320), (7221, 14395), (7198, 14389), (7085, 14257), (7286, 14251), (7147, 14399)]
         : compromised: 0.5049, honest: 0.5050
Round 007: test acc mean=0.5044 ± 0.0056 | min=0.4918 max=0.5143
         : test loss mean=50.8854 ± 32.3583
         : individual accs = ['0.507378', '0.513734', '0.511075', '0.507772', '0.505338', '0.504975', '0.501812', '0.504883', '0.514272', '0.507897', '0.501743', '0.507551', '0.500348', '0.491784', '0.503771', '0.501285', '0.499201', '0.496949', '0.509578', '0.496979']
         : correct/total = [(7221, 14232), (7313, 14235), (7291, 14266), (7219, 14217), (7195, 14238), (7258, 14373), (7199, 14346), (7237, 14334), (7351, 14294), (7300, 14373), (7197, 14344), (7259, 14302), (7182, 14354), (7063, 14362), (7214, 14320), (7216, 14395), (7183, 14389), (7085, 14257), (7262, 14251), (7156, 14399)]
         : compromised: 0.5045, honest: 0.5042
Round 008: test acc mean=0.4962 ± 0.0068 | min=0.4858 max=0.5121
         : test loss mean=73.0709 ± 73.9414
         : individual accs = ['0.489531', '0.486758', '0.485840', '0.493775', '0.494451', '0.494817', '0.497560', '0.512139', '0.488387', '0.493843', '0.500976', '0.491819', '0.499861', '0.509469', '0.496089', '0.501355', '0.500382', '0.500245', '0.489439', '0.496354']
         : correct/total = [(6967, 14232), (6929, 14235), (6931, 14266), (7020, 14217), (7040, 14238), (7112, 14373), (7138, 14346), (7341, 14334), (6981, 14294), (7098, 14373), (7186, 14344), (7034, 14302), (7175, 14354), (7317, 14362), (7104, 14320), (7217, 14395), (7200, 14389), (7132, 14257), (6975, 14251), (7147, 14399)]
         : compromised: 0.4954, honest: 0.4991
Round 009: test acc mean=0.4959 ± 0.0075 | min=0.4861 max=0.5178
         : test loss mean=262.7830 ± 74.9242
         : individual accs = ['0.489109', '0.486266', '0.486051', '0.492228', '0.494100', '0.493843', '0.497560', '0.495186', '0.488457', '0.493008', '0.499024', '0.492029', '0.499512', '0.508564', '0.495810', '0.498367', '0.499757', '0.503051', '0.488738', '0.517814']
         : correct/total = [(6961, 14232), (6922, 14235), (6934, 14266), (6998, 14217), (7035, 14238), (7098, 14373), (7138, 14346), (7098, 14334), (6982, 14294), (7086, 14373), (7158, 14344), (7037, 14302), (7170, 14354), (7304, 14362), (7100, 14320), (7174, 14395), (7191, 14389), (7172, 14257), (6965, 14251), (7456, 14399)]
         : compromised: 0.4963, honest: 0.4945
Round 010: test acc mean=0.4952 ± 0.0059 | min=0.4861 max=0.5086
         : test loss mean=363.8309 ± 151.3604
         : individual accs = ['0.489109', '0.486266', '0.486051', '0.492228', '0.494100', '0.493843', '0.497560', '0.495186', '0.488457', '0.493008', '0.499024', '0.492029', '0.499512', '0.508564', '0.495810', '0.498367', '0.499757', '0.503051', '0.488738', '0.503507']
         : correct/total = [(6961, 14232), (6922, 14235), (6934, 14266), (6998, 14217), (7035, 14238), (7098, 14373), (7138, 14346), (7098, 14334), (6982, 14294), (7086, 14373), (7158, 14344), (7037, 14302), (7170, 14354), (7304, 14362), (7100, 14320), (7174, 14395), (7191, 14389), (7172, 14257), (6965, 14251), (7250, 14399)]
         : compromised: 0.4954, honest: 0.4945

=== FINAL RESULTS ===
Dataset: sent140, Nodes: 20, Graph: erdos, Aggregation: krum
Attack: backdoor, 80.0% compromised
Final accuracy - Compromised: 0.4954, Honest: 0.4945
Overall test accuracy: mean=0.4952 ± 0.0059

=== BACKDOOR ATTACK SUCCESS RATE (ASR) ===
Target label: 1
Trigger size: 3x3
Overall ASR: 0.9501 ± 0.2177
Honest nodes ASR: 1.0000 ± 0.0000
Compromised nodes ASR: 0.9376 ± 0.2418
Note: Higher ASR indicates more successful backdoor attack
