Device: cuda
Seed: 987654321
Loading 1 LEAF Sent140 train files...
LEAF Sent140 train: 254555 users, 908652 samples
Building vocabulary (max_size=10000)...
Vocabulary size: 10000
Loading 1 LEAF Sent140 test files...
LEAF Sent140 test: 254555 users, 286281 samples
Found 254555 train users, 254555 test users, 254555 common users
User sample counts range: 494 (max) to 1 (min)
Distributed ALL 254555 users across 20 clients
Users per client: 12727 (with 15 clients getting +1 user)
Train partition sizes: [44353, 44290, 44657, 44907, 44696, 45843, 45801, 45619, 45069, 45639, 45821, 45311, 45779, 46056, 45625, 45984, 46428, 44737, 45540, 46497]
Test partition sizes: [14232, 14235, 14266, 14217, 14238, 14373, 14346, 14334, 14294, 14373, 14344, 14302, 14354, 14362, 14320, 14395, 14389, 14257, 14251, 14399]
  Client 0: 44353 train samples, 2 unique classes
  Client 1: 44290 train samples, 2 unique classes
  Client 2: 44657 train samples, 2 unique classes
  Client 3: 44907 train samples, 2 unique classes
  Client 4: 44696 train samples, 2 unique classes
  Client 5: 45843 train samples, 2 unique classes
  Client 6: 45801 train samples, 2 unique classes
  Client 7: 45619 train samples, 2 unique classes
  Client 8: 45069 train samples, 2 unique classes
  Client 9: 45639 train samples, 2 unique classes
  Client 10: 45821 train samples, 2 unique classes
  Client 11: 45311 train samples, 2 unique classes
  Client 12: 45779 train samples, 2 unique classes
  Client 13: 46056 train samples, 2 unique classes
  Client 14: 45625 train samples, 2 unique classes
  Client 15: 45984 train samples, 2 unique classes
  Client 16: 46428 train samples, 2 unique classes
  Client 17: 44737 train samples, 2 unique classes
  Client 18: 45540 train samples, 2 unique classes
  Client 19: 46497 train samples, 2 unique classes
Will sample 4500 samples per client per epoch
Graph: ring, nodes: 20, edges: 20
Degree statistics: avg=2.00, min=2, max=2
Attack: Compromised 14/20 nodes: [1, 2, 3, 5, 6, 8, 11, 12, 13, 14, 15, 17, 18, 19]
Attack type: directed_deviation, lambda: 1.0
Model variant: baseline
Model parameters: 1,174,986
Initial test acc across nodes: mean=0.4953 ± 0.0174
Round 001: test acc mean=0.5026 ± 0.0087 | min=0.4856 max=0.5232
         : test loss mean=12.3115 ± 7.5783
         : individual accs = ['0.508994', '0.508254', '0.491588', '0.505662', '0.500913', '0.500522', '0.501464', '0.492884', '0.523157', '0.512697', '0.485639', '0.506363', '0.496168', '0.494917', '0.498115', '0.501771', '0.518591', '0.499755', '0.500596', '0.504271']
         : correct/total = [(7244, 14232), (7235, 14235), (7013, 14266), (7189, 14217), (7132, 14238), (7194, 14373), (7194, 14346), (7065, 14334), (7478, 14294), (7369, 14373), (6966, 14344), (7242, 14302), (7122, 14354), (7108, 14362), (7133, 14320), (7223, 14395), (7462, 14389), (7125, 14257), (7134, 14251), (7261, 14399)]
         : compromised: 0.5023, honest: 0.5033
Round 002: test acc mean=0.5043 ± 0.0075 | min=0.4858 max=0.5176
         : test loss mean=10.3817 ± 5.1981
         : individual accs = ['0.510188', '0.514717', '0.485770', '0.507561', '0.501264', '0.507201', '0.506064', '0.517581', '0.506576', '0.503374', '0.501882', '0.496294', '0.502508', '0.505779', '0.493715', '0.514345', '0.509278', '0.505226', '0.494492', '0.502674']
         : correct/total = [(7261, 14232), (7327, 14235), (6930, 14266), (7216, 14217), (7137, 14238), (7290, 14373), (7260, 14346), (7419, 14334), (7241, 14294), (7235, 14373), (7199, 14344), (7098, 14302), (7213, 14354), (7264, 14362), (7070, 14320), (7404, 14395), (7328, 14389), (7203, 14257), (7047, 14251), (7238, 14399)]
         : compromised: 0.5031, honest: 0.5073
Round 003: test acc mean=0.4970 ± 0.0060 | min=0.4860 max=0.5078
         : test loss mean=3.7166 ± 2.5233
         : individual accs = ['0.492693', '0.488514', '0.485981', '0.489203', '0.494873', '0.501565', '0.495399', '0.497558', '0.498041', '0.507758', '0.505996', '0.493427', '0.503414', '0.507589', '0.491969', '0.496075', '0.493432', '0.501718', '0.495755', '0.498715']
         : correct/total = [(7012, 14232), (6954, 14235), (6933, 14266), (6955, 14217), (7046, 14238), (7209, 14373), (7107, 14346), (7132, 14334), (7119, 14294), (7298, 14373), (7258, 14344), (7057, 14302), (7226, 14354), (7290, 14362), (7045, 14320), (7141, 14395), (7100, 14389), (7153, 14257), (7065, 14251), (7181, 14399)]
         : compromised: 0.4962, honest: 0.4987
Round 004: test acc mean=0.5017 ± 0.0067 | min=0.4881 max=0.5173
         : test loss mean=3.0280 ± 1.3221
         : individual accs = ['0.506464', '0.513031', '0.499439', '0.512485', '0.504074', '0.501635', '0.493029', '0.502372', '0.517280', '0.497461', '0.488148', '0.500210', '0.504389', '0.493942', '0.499721', '0.497048', '0.501077', '0.498773', '0.500175', '0.503716']
         : correct/total = [(7208, 14232), (7303, 14235), (7125, 14266), (7286, 14217), (7177, 14238), (7210, 14373), (7073, 14346), (7201, 14334), (7394, 14294), (7150, 14373), (7002, 14344), (7154, 14302), (7240, 14354), (7094, 14362), (7156, 14320), (7155, 14395), (7210, 14389), (7111, 14257), (7128, 14251), (7253, 14399)]
         : compromised: 0.5025, honest: 0.4999
Round 005: test acc mean=0.5010 ± 0.0074 | min=0.4808 max=0.5114
         : test loss mean=1.8640 ± 1.1798
         : individual accs = ['0.500422', '0.498630', '0.505257', '0.507632', '0.504635', '0.503374', '0.495818', '0.500558', '0.505457', '0.480763', '0.483547', '0.505524', '0.500627', '0.510235', '0.503701', '0.504342', '0.497533', '0.498352', '0.502000', '0.511424']
         : correct/total = [(7122, 14232), (7098, 14235), (7208, 14266), (7217, 14217), (7185, 14238), (7235, 14373), (7113, 14346), (7175, 14334), (7225, 14294), (6910, 14373), (6936, 14344), (7230, 14302), (7186, 14354), (7328, 14362), (7213, 14320), (7260, 14395), (7159, 14389), (7105, 14257), (7154, 14251), (7364, 14399)]
         : compromised: 0.5037, honest: 0.4946
Round 006: test acc mean=0.5025 ± 0.0085 | min=0.4878 max=0.5164
         : test loss mean=1.9728 ± 1.7666
         : individual accs = ['0.510891', '0.515841', '0.497056', '0.516354', '0.506672', '0.504140', '0.512756', '0.507744', '0.487757', '0.501565', '0.503486', '0.501189', '0.487878', '0.492132', '0.487919', '0.505453', '0.504344', '0.507540', '0.495965', '0.503993']
         : correct/total = [(7271, 14232), (7343, 14235), (7091, 14266), (7341, 14217), (7214, 14238), (7246, 14373), (7356, 14346), (7278, 14334), (6972, 14294), (7209, 14373), (7222, 14344), (7168, 14302), (7003, 14354), (7068, 14362), (6987, 14320), (7276, 14395), (7257, 14389), (7236, 14257), (7068, 14251), (7257, 14399)]
         : compromised: 0.5011, honest: 0.5058
Round 007: test acc mean=0.5003 ± 0.0073 | min=0.4808 max=0.5146
         : test loss mean=1.2840 ± 0.8252
         : individual accs = ['0.510329', '0.508746', '0.494322', '0.514595', '0.505197', '0.503514', '0.497072', '0.501465', '0.508115', '0.493564', '0.495608', '0.480842', '0.498885', '0.495544', '0.505307', '0.502049', '0.497950', '0.498492', '0.493439', '0.500174']
         : correct/total = [(7263, 14232), (7242, 14235), (7052, 14266), (7316, 14217), (7193, 14238), (7237, 14373), (7131, 14346), (7188, 14334), (7263, 14294), (7094, 14373), (7109, 14344), (6877, 14302), (7161, 14354), (7117, 14362), (7236, 14320), (7227, 14395), (7165, 14389), (7107, 14257), (7032, 14251), (7202, 14399)]
         : compromised: 0.5001, honest: 0.5007
Round 008: test acc mean=0.5013 ± 0.0104 | min=0.4794 max=0.5207
         : test loss mean=1.7413 ± 1.5037
         : individual accs = ['0.495433', '0.486336', '0.504626', '0.509109', '0.497401', '0.495930', '0.511083', '0.509488', '0.495103', '0.513045', '0.520706', '0.496714', '0.509823', '0.503760', '0.507053', '0.487878', '0.479394', '0.488602', '0.512034', '0.502118']
         : correct/total = [(7051, 14232), (6923, 14235), (7199, 14266), (7238, 14217), (7082, 14238), (7128, 14373), (7332, 14346), (7303, 14334), (7077, 14294), (7374, 14373), (7469, 14344), (7104, 14302), (7318, 14354), (7235, 14362), (7261, 14320), (7023, 14395), (6898, 14389), (6966, 14257), (7297, 14251), (7230, 14399)]
         : compromised: 0.5007, honest: 0.5026
Round 009: test acc mean=0.4982 ± 0.0143 | min=0.4785 max=0.5382
         : test loss mean=1.4632 ± 1.1547
         : individual accs = ['0.493957', '0.495118', '0.498388', '0.482380', '0.479281', '0.478467', '0.497351', '0.482489', '0.500490', '0.538231', '0.529908', '0.489162', '0.500836', '0.505640', '0.501117', '0.498784', '0.494753', '0.496107', '0.499263', '0.502535']
         : correct/total = [(7030, 14232), (7048, 14235), (7110, 14266), (6858, 14217), (6824, 14238), (6877, 14373), (7135, 14346), (6916, 14334), (7154, 14294), (7736, 14373), (7601, 14344), (6996, 14302), (7189, 14354), (7262, 14362), (7176, 14320), (7180, 14395), (7119, 14389), (7073, 14257), (7115, 14251), (7236, 14399)]
         : compromised: 0.4961, honest: 0.5031
Round 010: test acc mean=0.5064 ± 0.0143 | min=0.4870 max=0.5471
         : test loss mean=1.6346 ± 1.4243
         : individual accs = ['0.511242', '0.509940', '0.508482', '0.489203', '0.499860', '0.498713', '0.498048', '0.486954', '0.495942', '0.540110', '0.547058', '0.503356', '0.502160', '0.499443', '0.500349', '0.500382', '0.502954', '0.505296', '0.509929', '0.518369']
         : correct/total = [(7276, 14232), (7259, 14235), (7254, 14266), (6955, 14217), (7117, 14238), (7168, 14373), (7145, 14346), (6980, 14334), (7089, 14294), (7763, 14373), (7847, 14344), (7199, 14302), (7208, 14354), (7173, 14362), (7165, 14320), (7203, 14395), (7237, 14389), (7204, 14257), (7267, 14251), (7464, 14399)]
         : compromised: 0.5028, honest: 0.5147

=== FINAL RESULTS ===
Dataset: sent140, Nodes: 20, Graph: ring, Aggregation: krum
Attack: directed_deviation, 70.0% compromised
Final accuracy - Compromised: 0.5028, Honest: 0.5147
Overall test accuracy: mean=0.5064 ± 0.0143
