Device: cuda
Seed: 987654321
Loading 1 LEAF Sent140 train files...
LEAF Sent140 train: 254555 users, 908652 samples
Building vocabulary (max_size=10000)...
Vocabulary size: 10000
Loading 1 LEAF Sent140 test files...
LEAF Sent140 test: 254555 users, 286281 samples
Found 254555 train users, 254555 test users, 254555 common users
User sample counts range: 494 (max) to 1 (min)
Distributed ALL 254555 users across 20 clients
Users per client: 12727 (with 15 clients getting +1 user)
Train partition sizes: [44353, 44290, 44657, 44907, 44696, 45843, 45801, 45619, 45069, 45639, 45821, 45311, 45779, 46056, 45625, 45984, 46428, 44737, 45540, 46497]
Test partition sizes: [14232, 14235, 14266, 14217, 14238, 14373, 14346, 14334, 14294, 14373, 14344, 14302, 14354, 14362, 14320, 14395, 14389, 14257, 14251, 14399]
  Client 0: 44353 train samples, 2 unique classes
  Client 1: 44290 train samples, 2 unique classes
  Client 2: 44657 train samples, 2 unique classes
  Client 3: 44907 train samples, 2 unique classes
  Client 4: 44696 train samples, 2 unique classes
  Client 5: 45843 train samples, 2 unique classes
  Client 6: 45801 train samples, 2 unique classes
  Client 7: 45619 train samples, 2 unique classes
  Client 8: 45069 train samples, 2 unique classes
  Client 9: 45639 train samples, 2 unique classes
  Client 10: 45821 train samples, 2 unique classes
  Client 11: 45311 train samples, 2 unique classes
  Client 12: 45779 train samples, 2 unique classes
  Client 13: 46056 train samples, 2 unique classes
  Client 14: 45625 train samples, 2 unique classes
  Client 15: 45984 train samples, 2 unique classes
  Client 16: 46428 train samples, 2 unique classes
  Client 17: 44737 train samples, 2 unique classes
  Client 18: 45540 train samples, 2 unique classes
  Client 19: 46497 train samples, 2 unique classes
Will sample 4500 samples per client per epoch
Graph: erdos, nodes: 20, edges: 48
Degree statistics: avg=4.80, min=2, max=7
Attack: Compromised 4/20 nodes: [5, 12, 13, 17]
Attack type: backdoor, lambda: 1.0
Backdoor target label: 1, trigger size: 3
Model variant: baseline
Model parameters: 1,174,986
Initial test acc across nodes: mean=0.4965 ± 0.0152
Backdoor attack: Created poisoned datasets for 4 compromised nodes
Round 001: test acc mean=0.5055 ± 0.0140 | min=0.4914 max=0.5541
         : test loss mean=2.1246 ± 2.8296
         : individual accs = ['0.512858', '0.499754', '0.515491', '0.508616', '0.522616', '0.496626', '0.497142', '0.504814', '0.554079', '0.505810', '0.493586', '0.509229', '0.497074', '0.491366', '0.497486', '0.499132', '0.492043', '0.492951', '0.509648', '0.508924']
         : correct/total = [(7299, 14232), (7114, 14235), (7354, 14266), (7231, 14217), (7441, 14238), (7138, 14373), (7132, 14346), (7236, 14334), (7920, 14294), (7270, 14373), (7080, 14344), (7283, 14302), (7135, 14354), (7057, 14362), (7124, 14320), (7185, 14395), (7080, 14389), (7028, 14257), (7263, 14251), (7328, 14399)]
         : compromised: 0.4945, honest: 0.5082
Round 002: test acc mean=0.5074 ± 0.0070 | min=0.4836 max=0.5158
         : test loss mean=1.6389 ± 1.4282
         : individual accs = ['0.497611', '0.513664', '0.507641', '0.508335', '0.509201', '0.507131', '0.515823', '0.504116', '0.512733', '0.507201', '0.504183', '0.512935', '0.504459', '0.483568', '0.510335', '0.512539', '0.514212', '0.512450', '0.506070', '0.504132']
         : correct/total = [(7082, 14232), (7312, 14235), (7242, 14266), (7227, 14217), (7250, 14238), (7289, 14373), (7400, 14346), (7226, 14334), (7329, 14294), (7290, 14373), (7232, 14344), (7336, 14302), (7241, 14354), (6945, 14362), (7308, 14320), (7378, 14395), (7399, 14389), (7306, 14257), (7212, 14251), (7259, 14399)]
         : compromised: 0.5019, honest: 0.5088
Round 003: test acc mean=0.5060 ± 0.0115 | min=0.4851 max=0.5348
         : test loss mean=0.7499 ± 0.1105
         : individual accs = ['0.510961', '0.495118', '0.500280', '0.503622', '0.528024', '0.513463', '0.502231', '0.495256', '0.534840', '0.513463', '0.501185', '0.506573', '0.500418', '0.505640', '0.517737', '0.501007', '0.509764', '0.490496', '0.485089', '0.504966']
         : correct/total = [(7272, 14232), (7048, 14235), (7137, 14266), (7160, 14217), (7518, 14238), (7380, 14373), (7205, 14346), (7099, 14334), (7645, 14294), (7380, 14373), (7189, 14344), (7245, 14302), (7183, 14354), (7262, 14362), (7414, 14320), (7212, 14395), (7335, 14389), (6993, 14257), (6913, 14251), (7271, 14399)]
         : compromised: 0.5025, honest: 0.5069
Round 004: test acc mean=0.5055 ± 0.0110 | min=0.4928 max=0.5418
         : test loss mean=0.9750 ± 0.3863
         : individual accs = ['0.492763', '0.513172', '0.513739', '0.496589', '0.502107', '0.499269', '0.503485', '0.498744', '0.541836', '0.493008', '0.500558', '0.508460', '0.498746', '0.508286', '0.500908', '0.499548', '0.506846', '0.499193', '0.510982', '0.521842']
         : correct/total = [(7013, 14232), (7305, 14235), (7329, 14266), (7060, 14217), (7149, 14238), (7176, 14373), (7223, 14346), (7149, 14334), (7745, 14294), (7086, 14373), (7180, 14344), (7272, 14302), (7159, 14354), (7300, 14362), (7173, 14320), (7191, 14395), (7293, 14389), (7117, 14257), (7282, 14251), (7514, 14399)]
         : compromised: 0.5014, honest: 0.5065
Round 005: test acc mean=0.5150 ± 0.0132 | min=0.4903 max=0.5434
         : test loss mean=0.7494 ± 0.1298
         : individual accs = ['0.543423', '0.521602', '0.515351', '0.506647', '0.527813', '0.506227', '0.522236', '0.513534', '0.535749', '0.525638', '0.500976', '0.508390', '0.501254', '0.490322', '0.518645', '0.513303', '0.526930', '0.496879', '0.521648', '0.503507']
         : correct/total = [(7734, 14232), (7425, 14235), (7352, 14266), (7203, 14217), (7515, 14238), (7276, 14373), (7492, 14346), (7361, 14334), (7658, 14294), (7555, 14373), (7186, 14344), (7271, 14302), (7195, 14354), (7042, 14362), (7427, 14320), (7389, 14395), (7582, 14389), (7084, 14257), (7434, 14251), (7250, 14399)]
         : compromised: 0.4987, honest: 0.5191
Round 006: test acc mean=0.5229 ± 0.0195 | min=0.4735 max=0.5671
         : test loss mean=0.8027 ± 0.2386
         : individual accs = ['0.530776', '0.540218', '0.512758', '0.518042', '0.516927', '0.507479', '0.549003', '0.514790', '0.546453', '0.542406', '0.520636', '0.511047', '0.532465', '0.473541', '0.505866', '0.523793', '0.520676', '0.512450', '0.511262', '0.567053']
         : correct/total = [(7554, 14232), (7690, 14235), (7315, 14266), (7365, 14217), (7360, 14238), (7294, 14373), (7876, 14346), (7379, 14334), (7811, 14294), (7796, 14373), (7468, 14344), (7309, 14302), (7643, 14354), (6801, 14362), (7244, 14320), (7540, 14395), (7492, 14389), (7306, 14257), (7286, 14251), (8165, 14399)]
         : compromised: 0.5065, honest: 0.5270
Round 007: test acc mean=0.5292 ± 0.0200 | min=0.4942 max=0.5631
         : test loss mean=0.7284 ± 0.1131
         : individual accs = ['0.494238', '0.533895', '0.532174', '0.532883', '0.555415', '0.503583', '0.528998', '0.542277', '0.563103', '0.527378', '0.502440', '0.510488', '0.501324', '0.516432', '0.509148', '0.551789', '0.547224', '0.544504', '0.535752', '0.551774']
         : correct/total = [(7034, 14232), (7600, 14235), (7592, 14266), (7576, 14217), (7908, 14238), (7238, 14373), (7589, 14346), (7773, 14334), (8049, 14294), (7580, 14373), (7207, 14344), (7301, 14302), (7196, 14354), (7417, 14362), (7291, 14320), (7943, 14395), (7874, 14389), (7763, 14257), (7635, 14251), (7945, 14399)]
         : compromised: 0.5165, honest: 0.5324
Round 008: test acc mean=0.5256 ± 0.0172 | min=0.5056 max=0.5627
         : test loss mean=0.7566 ± 0.1562
         : individual accs = ['0.535062', '0.512961', '0.512758', '0.543223', '0.524090', '0.506505', '0.553325', '0.515767', '0.553869', '0.562652', '0.545524', '0.513565', '0.522084', '0.509261', '0.510126', '0.519139', '0.517409', '0.505646', '0.514350', '0.534759']
         : correct/total = [(7615, 14232), (7302, 14235), (7315, 14266), (7723, 14217), (7462, 14238), (7280, 14373), (7938, 14346), (7393, 14334), (7917, 14294), (8087, 14373), (7825, 14344), (7345, 14302), (7494, 14354), (7314, 14362), (7305, 14320), (7473, 14395), (7445, 14389), (7209, 14257), (7330, 14251), (7700, 14399)]
         : compromised: 0.5109, honest: 0.5293
Round 009: test acc mean=0.5406 ± 0.0265 | min=0.4931 max=0.5786
         : test loss mean=0.7179 ± 0.1005
         : individual accs = ['0.493817', '0.530804', '0.536731', '0.535415', '0.578592', '0.519585', '0.545936', '0.555114', '0.572618', '0.538579', '0.541969', '0.522934', '0.501672', '0.493107', '0.514176', '0.577006', '0.552227', '0.568212', '0.557294', '0.575665']
         : correct/total = [(7028, 14232), (7556, 14235), (7657, 14266), (7612, 14217), (8238, 14238), (7468, 14373), (7832, 14346), (7957, 14334), (8185, 14294), (7741, 14373), (7774, 14344), (7479, 14302), (7201, 14354), (7082, 14362), (7363, 14320), (8306, 14395), (7946, 14389), (8101, 14257), (7942, 14251), (8289, 14399)]
         : compromised: 0.5206, honest: 0.5456
Round 010: test acc mean=0.5348 ± 0.0212 | min=0.5032 max=0.5763
         : test loss mean=0.7415 ± 0.1389
         : individual accs = ['0.547499', '0.540569', '0.526567', '0.549202', '0.532448', '0.511236', '0.548724', '0.521139', '0.576326', '0.565366', '0.556818', '0.512725', '0.520343', '0.503203', '0.518785', '0.529420', '0.513448', '0.516238', '0.531191', '0.575526']
         : correct/total = [(7792, 14232), (7695, 14235), (7512, 14266), (7808, 14217), (7581, 14238), (7348, 14373), (7872, 14346), (7470, 14334), (8238, 14294), (8126, 14373), (7987, 14344), (7333, 14302), (7469, 14354), (7227, 14362), (7429, 14320), (7621, 14395), (7388, 14389), (7360, 14257), (7570, 14251), (8287, 14399)]
         : compromised: 0.5128, honest: 0.5404

=== FINAL RESULTS ===
Dataset: sent140, Nodes: 20, Graph: erdos, Aggregation: d-fedavg
Attack: backdoor, 20.0% compromised
Final accuracy - Compromised: 0.5128, Honest: 0.5404
Overall test accuracy: mean=0.5348 ± 0.0212

=== BACKDOOR ATTACK SUCCESS RATE (ASR) ===
Target label: 1
Trigger size: 3x3
Overall ASR: 0.5053 ± 0.1999
Honest nodes ASR: 0.5261 ± 0.1896
Compromised nodes ASR: 0.4219 ± 0.2176
Note: Higher ASR indicates more successful backdoor attack
