Device: cuda
Seed: 987654321
Loading 1 LEAF Sent140 train files...
LEAF Sent140 train: 254555 users, 908652 samples
Building vocabulary (max_size=10000)...
Vocabulary size: 10000
Loading 1 LEAF Sent140 test files...
LEAF Sent140 test: 254555 users, 286281 samples
Found 254555 train users, 254555 test users, 254555 common users
User sample counts range: 494 (max) to 1 (min)
Distributed ALL 254555 users across 20 clients
Users per client: 12727 (with 15 clients getting +1 user)
Train partition sizes: [44353, 44290, 44657, 44907, 44696, 45843, 45801, 45619, 45069, 45639, 45821, 45311, 45779, 46056, 45625, 45984, 46428, 44737, 45540, 46497]
Test partition sizes: [14232, 14235, 14266, 14217, 14238, 14373, 14346, 14334, 14294, 14373, 14344, 14302, 14354, 14362, 14320, 14395, 14389, 14257, 14251, 14399]
  Client 0: 44353 train samples, 2 unique classes
  Client 1: 44290 train samples, 2 unique classes
  Client 2: 44657 train samples, 2 unique classes
  Client 3: 44907 train samples, 2 unique classes
  Client 4: 44696 train samples, 2 unique classes
  Client 5: 45843 train samples, 2 unique classes
  Client 6: 45801 train samples, 2 unique classes
  Client 7: 45619 train samples, 2 unique classes
  Client 8: 45069 train samples, 2 unique classes
  Client 9: 45639 train samples, 2 unique classes
  Client 10: 45821 train samples, 2 unique classes
  Client 11: 45311 train samples, 2 unique classes
  Client 12: 45779 train samples, 2 unique classes
  Client 13: 46056 train samples, 2 unique classes
  Client 14: 45625 train samples, 2 unique classes
  Client 15: 45984 train samples, 2 unique classes
  Client 16: 46428 train samples, 2 unique classes
  Client 17: 44737 train samples, 2 unique classes
  Client 18: 45540 train samples, 2 unique classes
  Client 19: 46497 train samples, 2 unique classes
Will sample 4500 samples per client per epoch
Graph: erdos, nodes: 20, edges: 126
Degree statistics: avg=12.60, min=8, max=16
Attack: Compromised 2/20 nodes: [5, 13]
Attack type: backdoor, lambda: 1.0
Backdoor target label: 1, trigger size: 3
Model variant: baseline
Model parameters: 1,174,986
Initial test acc across nodes: mean=0.4965 ± 0.0152
Backdoor attack: Created poisoned datasets for 2 compromised nodes
Round 001: test acc mean=0.5021 ± 0.0090 | min=0.4844 max=0.5271
         : test loss mean=0.7423 ± 0.0698
         : individual accs = ['0.506886', '0.513242', '0.504346', '0.527115', '0.498666', '0.495373', '0.499651', '0.503418', '0.490695', '0.506992', '0.502231', '0.512935', '0.498955', '0.492132', '0.484427', '0.498159', '0.499757', '0.507330', '0.496386', '0.503090']
         : correct/total = [(7214, 14232), (7306, 14235), (7195, 14266), (7494, 14217), (7100, 14238), (7120, 14373), (7168, 14346), (7216, 14334), (7014, 14294), (7287, 14373), (7204, 14344), (7336, 14302), (7162, 14354), (7068, 14362), (6937, 14320), (7171, 14395), (7191, 14389), (7233, 14257), (7074, 14251), (7244, 14399)]
         : compromised: 0.4938, honest: 0.5030
Round 002: test acc mean=0.5030 ± 0.0093 | min=0.4772 max=0.5228
         : test loss mean=0.7180 ± 0.0263
         : individual accs = ['0.510118', '0.511416', '0.494603', '0.501020', '0.501054', '0.507479', '0.511501', '0.501046', '0.490206', '0.505322', '0.515616', '0.522794', '0.498537', '0.477162', '0.502514', '0.501980', '0.500174', '0.498001', '0.504245', '0.504479']
         : correct/total = [(7260, 14232), (7280, 14235), (7056, 14266), (7123, 14217), (7134, 14238), (7294, 14373), (7338, 14346), (7182, 14334), (7007, 14294), (7263, 14373), (7396, 14344), (7477, 14302), (7156, 14354), (6853, 14362), (7196, 14320), (7226, 14395), (7197, 14389), (7100, 14257), (7186, 14251), (7264, 14399)]
         : compromised: 0.4923, honest: 0.5041
Round 003: test acc mean=0.5011 ± 0.0140 | min=0.4770 max=0.5231
         : test loss mean=0.6949 ± 0.0041
         : individual accs = ['0.506605', '0.523147', '0.480303', '0.510656', '0.521843', '0.499130', '0.481110', '0.512418', '0.491745', '0.510610', '0.505368', '0.479234', '0.518322', '0.476953', '0.492318', '0.515665', '0.504691', '0.496809', '0.498281', '0.496354']
         : correct/total = [(7210, 14232), (7447, 14235), (6852, 14266), (7260, 14217), (7430, 14238), (7174, 14373), (6902, 14346), (7345, 14334), (7029, 14294), (7339, 14373), (7249, 14344), (6854, 14302), (7440, 14354), (6850, 14362), (7050, 14320), (7423, 14395), (7262, 14389), (7083, 14257), (7101, 14251), (7147, 14399)]
         : compromised: 0.4880, honest: 0.5025
Round 004: test acc mean=0.5404 ± 0.0205 | min=0.5046 max=0.5771
         : test loss mean=0.6947 ± 0.0249
         : individual accs = ['0.547499', '0.538672', '0.518716', '0.577126', '0.543545', '0.558478', '0.536874', '0.522464', '0.519729', '0.515063', '0.572922', '0.534121', '0.508012', '0.549088', '0.554399', '0.532129', '0.504552', '0.565477', '0.552172', '0.557053']
         : correct/total = [(7792, 14232), (7668, 14235), (7400, 14266), (8205, 14217), (7739, 14238), (8027, 14373), (7702, 14346), (7489, 14334), (7429, 14294), (7403, 14373), (8218, 14344), (7639, 14302), (7292, 14354), (7886, 14362), (7939, 14320), (7660, 14395), (7260, 14389), (8062, 14257), (7869, 14251), (8021, 14399)]
         : compromised: 0.5538, honest: 0.5389
Round 005: test acc mean=0.5101 ± 0.0237 | min=0.4757 max=0.5519
         : test loss mean=0.6938 ± 0.0035
         : individual accs = ['0.489812', '0.540499', '0.480163', '0.494056', '0.545933', '0.494330', '0.497421', '0.551905', '0.475724', '0.531552', '0.501255', '0.491679', '0.539641', '0.506824', '0.494763', '0.544564', '0.529432', '0.503191', '0.491053', '0.497535']
         : correct/total = [(6971, 14232), (7694, 14235), (6850, 14266), (7024, 14217), (7773, 14238), (7105, 14373), (7136, 14346), (7911, 14334), (6800, 14294), (7640, 14373), (7190, 14344), (7032, 14302), (7746, 14354), (7279, 14362), (7085, 14320), (7839, 14395), (7618, 14389), (7174, 14257), (6998, 14251), (7164, 14399)]
         : compromised: 0.5006, honest: 0.5111
Round 006: test acc mean=0.5607 ± 0.0208 | min=0.5200 max=0.5909
         : test loss mean=0.6980 ± 0.0416
         : individual accs = ['0.553331', '0.589111', '0.521099', '0.579166', '0.590884', '0.551799', '0.540569', '0.571997', '0.520008', '0.569262', '0.590212', '0.534680', '0.562840', '0.554867', '0.549791', '0.589302', '0.562861', '0.568773', '0.552382', '0.560317']
         : correct/total = [(7875, 14232), (8386, 14235), (7434, 14266), (8234, 14217), (8413, 14238), (7931, 14373), (7755, 14346), (8199, 14334), (7433, 14294), (8182, 14373), (8466, 14344), (7647, 14302), (8079, 14354), (7969, 14362), (7873, 14320), (8483, 14395), (8099, 14389), (8109, 14257), (7872, 14251), (8068, 14399)]
         : compromised: 0.5533, honest: 0.5615
Round 007: test acc mean=0.5208 ± 0.0345 | min=0.4886 max=0.5757
         : test loss mean=0.6920 ± 0.0034
         : individual accs = ['0.489250', '0.571549', '0.488644', '0.493775', '0.575713', '0.493843', '0.497839', '0.572694', '0.495173', '0.556599', '0.504183', '0.491889', '0.564999', '0.508704', '0.495810', '0.574158', '0.552088', '0.503472', '0.489088', '0.496632']
         : correct/total = [(6963, 14232), (8136, 14235), (6971, 14266), (7020, 14217), (8197, 14238), (7098, 14373), (7142, 14346), (8209, 14334), (7078, 14294), (8000, 14373), (7232, 14344), (7035, 14302), (8110, 14354), (7306, 14362), (7100, 14320), (8265, 14395), (7944, 14389), (7178, 14257), (6970, 14251), (7151, 14399)]
         : compromised: 0.5013, honest: 0.5230
Round 008: test acc mean=0.5769 ± 0.0213 | min=0.5306 max=0.6027
         : test loss mean=0.6897 ± 0.0401
         : individual accs = ['0.574480', '0.602669', '0.532805', '0.598861', '0.599663', '0.572462', '0.555834', '0.591042', '0.530642', '0.594309', '0.598229', '0.548874', '0.587711', '0.571926', '0.567318', '0.601945', '0.586976', '0.579856', '0.566978', '0.574832']
         : correct/total = [(8176, 14232), (8579, 14235), (7601, 14266), (8514, 14217), (8538, 14238), (8228, 14373), (7974, 14346), (8472, 14334), (7585, 14294), (8542, 14373), (8581, 14344), (7850, 14302), (8436, 14354), (8214, 14362), (8124, 14320), (8665, 14395), (8446, 14389), (8267, 14257), (8080, 14251), (8277, 14399)]
         : compromised: 0.5722, honest: 0.5774
Round 009: test acc mean=0.5323 ± 0.0406 | min=0.4918 max=0.5990
         : test loss mean=0.6893 ± 0.0042
         : individual accs = ['0.491779', '0.596417', '0.504907', '0.518886', '0.598961', '0.495095', '0.498885', '0.588949', '0.508815', '0.572532', '0.525725', '0.492588', '0.581162', '0.508634', '0.497835', '0.593053', '0.569671', '0.509294', '0.492948', '0.499687']
         : correct/total = [(6999, 14232), (8490, 14235), (7203, 14266), (7377, 14217), (8528, 14238), (7116, 14373), (7157, 14346), (8442, 14334), (7273, 14294), (8229, 14373), (7541, 14344), (7045, 14302), (8342, 14354), (7305, 14362), (7129, 14320), (8537, 14395), (8197, 14389), (7261, 14257), (7025, 14251), (7195, 14399)]
         : compromised: 0.5019, honest: 0.5357
Round 010: test acc mean=0.5866 ± 0.0206 | min=0.5386 max=0.6086
         : test loss mean=0.6830 ± 0.0372
         : individual accs = ['0.584668', '0.607727', '0.543810', '0.606176', '0.607459', '0.586586', '0.567615', '0.600321', '0.538618', '0.600918', '0.604155', '0.559502', '0.608611', '0.580490', '0.576047', '0.607016', '0.598096', '0.591148', '0.579187', '0.584763']
         : correct/total = [(8321, 14232), (8651, 14235), (7758, 14266), (8618, 14217), (8649, 14238), (8431, 14373), (8143, 14346), (8605, 14334), (7699, 14294), (8637, 14373), (8666, 14344), (8002, 14302), (8736, 14354), (8337, 14362), (8249, 14320), (8738, 14395), (8606, 14389), (8428, 14257), (8254, 14251), (8420, 14399)]
         : compromised: 0.5835, honest: 0.5870

=== FINAL RESULTS ===
Dataset: sent140, Nodes: 20, Graph: erdos, Aggregation: d-fedavg
Attack: backdoor, 10.0% compromised
Final accuracy - Compromised: 0.5835, Honest: 0.5870
Overall test accuracy: mean=0.5866 ± 0.0206

=== BACKDOOR ATTACK SUCCESS RATE (ASR) ===
Target label: 1
Trigger size: 3x3
Overall ASR: 0.6215 ± 0.1451
Honest nodes ASR: 0.6106 ± 0.1486
Compromised nodes ASR: 0.7194 ± 0.0312
Note: Higher ASR indicates more successful backdoor attack
