Device: cuda
Seed: 987654321
Loading 1 LEAF Sent140 train files...
LEAF Sent140 train: 254555 users, 908652 samples
Building vocabulary (max_size=10000)...
Vocabulary size: 10000
Loading 1 LEAF Sent140 test files...
LEAF Sent140 test: 254555 users, 286281 samples
Found 254555 train users, 254555 test users, 254555 common users
User sample counts range: 494 (max) to 1 (min)
Distributed ALL 254555 users across 20 clients
Users per client: 12727 (with 15 clients getting +1 user)
Train partition sizes: [44353, 44290, 44657, 44907, 44696, 45843, 45801, 45619, 45069, 45639, 45821, 45311, 45779, 46056, 45625, 45984, 46428, 44737, 45540, 46497]
Test partition sizes: [14232, 14235, 14266, 14217, 14238, 14373, 14346, 14334, 14294, 14373, 14344, 14302, 14354, 14362, 14320, 14395, 14389, 14257, 14251, 14399]
  Client 0: 44353 train samples, 2 unique classes
  Client 1: 44290 train samples, 2 unique classes
  Client 2: 44657 train samples, 2 unique classes
  Client 3: 44907 train samples, 2 unique classes
  Client 4: 44696 train samples, 2 unique classes
  Client 5: 45843 train samples, 2 unique classes
  Client 6: 45801 train samples, 2 unique classes
  Client 7: 45619 train samples, 2 unique classes
  Client 8: 45069 train samples, 2 unique classes
  Client 9: 45639 train samples, 2 unique classes
  Client 10: 45821 train samples, 2 unique classes
  Client 11: 45311 train samples, 2 unique classes
  Client 12: 45779 train samples, 2 unique classes
  Client 13: 46056 train samples, 2 unique classes
  Client 14: 45625 train samples, 2 unique classes
  Client 15: 45984 train samples, 2 unique classes
  Client 16: 46428 train samples, 2 unique classes
  Client 17: 44737 train samples, 2 unique classes
  Client 18: 45540 train samples, 2 unique classes
  Client 19: 46497 train samples, 2 unique classes
Will sample 4500 samples per client per epoch
Graph: fully, nodes: 20, edges: 190
Degree statistics: avg=19.00, min=19, max=19
Attack: Compromised 8/20 nodes: [1, 5, 11, 12, 13, 14, 17, 18]
Attack type: backdoor, lambda: 1.0
Backdoor target label: 1, trigger size: 3
Model variant: baseline
Model parameters: 1,174,986
Sketchguard Node 0:
  Model dim: 1,174,986 → Sketch size: 180
  Compression ratio: 6527.7x
  Using model parameters for aggregation, sketches for filtering
Sketchguard Node 1:
  Model dim: 1,174,986 → Sketch size: 180
  Compression ratio: 6527.7x
  Using model parameters for aggregation, sketches for filtering
Sketchguard Node 2:
  Model dim: 1,174,986 → Sketch size: 180
  Compression ratio: 6527.7x
  Using model parameters for aggregation, sketches for filtering
Sketchguard Node 3:
  Model dim: 1,174,986 → Sketch size: 180
  Compression ratio: 6527.7x
  Using model parameters for aggregation, sketches for filtering
Sketchguard Node 4:
  Model dim: 1,174,986 → Sketch size: 180
  Compression ratio: 6527.7x
  Using model parameters for aggregation, sketches for filtering
Sketchguard Node 5:
  Model dim: 1,174,986 → Sketch size: 180
  Compression ratio: 6527.7x
  Using model parameters for aggregation, sketches for filtering
Sketchguard Node 6:
  Model dim: 1,174,986 → Sketch size: 180
  Compression ratio: 6527.7x
  Using model parameters for aggregation, sketches for filtering
Sketchguard Node 7:
  Model dim: 1,174,986 → Sketch size: 180
  Compression ratio: 6527.7x
  Using model parameters for aggregation, sketches for filtering
Sketchguard Node 8:
  Model dim: 1,174,986 → Sketch size: 180
  Compression ratio: 6527.7x
  Using model parameters for aggregation, sketches for filtering
Sketchguard Node 9:
  Model dim: 1,174,986 → Sketch size: 180
  Compression ratio: 6527.7x
  Using model parameters for aggregation, sketches for filtering
Sketchguard Node 10:
  Model dim: 1,174,986 → Sketch size: 180
  Compression ratio: 6527.7x
  Using model parameters for aggregation, sketches for filtering
Sketchguard Node 11:
  Model dim: 1,174,986 → Sketch size: 180
  Compression ratio: 6527.7x
  Using model parameters for aggregation, sketches for filtering
Sketchguard Node 12:
  Model dim: 1,174,986 → Sketch size: 180
  Compression ratio: 6527.7x
  Using model parameters for aggregation, sketches for filtering
Sketchguard Node 13:
  Model dim: 1,174,986 → Sketch size: 180
  Compression ratio: 6527.7x
  Using model parameters for aggregation, sketches for filtering
Sketchguard Node 14:
  Model dim: 1,174,986 → Sketch size: 180
  Compression ratio: 6527.7x
  Using model parameters for aggregation, sketches for filtering
Sketchguard Node 15:
  Model dim: 1,174,986 → Sketch size: 180
  Compression ratio: 6527.7x
  Using model parameters for aggregation, sketches for filtering
Sketchguard Node 16:
  Model dim: 1,174,986 → Sketch size: 180
  Compression ratio: 6527.7x
  Using model parameters for aggregation, sketches for filtering
Sketchguard Node 17:
  Model dim: 1,174,986 → Sketch size: 180
  Compression ratio: 6527.7x
  Using model parameters for aggregation, sketches for filtering
Sketchguard Node 18:
  Model dim: 1,174,986 → Sketch size: 180
  Compression ratio: 6527.7x
  Using model parameters for aggregation, sketches for filtering
Sketchguard Node 19:
  Model dim: 1,174,986 → Sketch size: 180
  Compression ratio: 6527.7x
  Using model parameters for aggregation, sketches for filtering
Sketchguard ALGORITHM (Sketch-based Filtering + State Aggregation)
  - Model dimension: 1,174,986 parameters
  - Config: SketchguardConfig(gamma=2, kappa=1, alpha=0.5, min_neighbors=1, sketch_size=180, network_seed=987654321, attack_detection_window=5)
  - Sketch size: 180
  - Compression ratio: 6527.7x
  - Complexity: O(d + N×k) = O(1,174,986 + 20×180)
  - Theoretical speedup vs BALANCE: 19.9x
Initial test acc across nodes: mean=0.4965 ± 0.0152
Backdoor attack: Created poisoned datasets for 8 compromised nodes
Round 001: test acc mean=0.5048 ± 0.0081 | min=0.4916 max=0.5210
         : test loss mean=14.2847 ± 17.4555
         : individual accs = ['0.511523', '0.504672', '0.515982', '0.507843', '0.521000', '0.495165', '0.502440', '0.504883', '0.516510', '0.514089', '0.498397', '0.496784', '0.500557', '0.512324', '0.502933', '0.497951', '0.493363', '0.505296', '0.491615', '0.502952']
         : correct/total = [(7280, 14232), (7184, 14235), (7361, 14266), (7220, 14217), (7418, 14238), (7117, 14373), (7208, 14346), (7237, 14334), (7383, 14294), (7389, 14373), (7149, 14344), (7105, 14302), (7185, 14354), (7358, 14362), (7202, 14320), (7168, 14395), (7099, 14389), (7204, 14257), (7006, 14251), (7242, 14399)]
         : compromised: 0.5012, honest: 0.5072
         : sketchguard stats = ['Node 0: acc_rate=1.000', 'Node 1: acc_rate=1.000', 'Node 2: acc_rate=1.000']...
Round 002: test acc mean=0.5374 ± 0.0318 | min=0.4922 max=0.5853
         : test loss mean=515.0393 ± 633.9355
         : individual accs = ['0.537943', '0.506428', '0.585308', '0.525779', '0.570867', '0.507966', '0.544333', '0.583298', '0.569330', '0.560217', '0.564138', '0.502657', '0.499094', '0.492202', '0.507123', '0.575617', '0.540969', '0.509224', '0.497018', '0.568512']
         : correct/total = [(7656, 14232), (7209, 14235), (8350, 14266), (7475, 14217), (8128, 14238), (7301, 14373), (7809, 14346), (8361, 14334), (8138, 14294), (8052, 14373), (8092, 14344), (7189, 14302), (7164, 14354), (7069, 14362), (7262, 14320), (8286, 14395), (7784, 14389), (7260, 14257), (7083, 14251), (8186, 14399)]
         : compromised: 0.5027, honest: 0.5605
         : sketchguard stats = ['Node 0: acc_rate=0.789', 'Node 1: acc_rate=1.000', 'Node 2: acc_rate=0.789']...
Round 003: test acc mean=0.5562 ± 0.0503 | min=0.4798 max=0.6037
         : test loss mean=36368.5451 ± 46622.8588
         : individual accs = ['0.582279', '0.489217', '0.603743', '0.603362', '0.592710', '0.504488', '0.602189', '0.597530', '0.599202', '0.594587', '0.597811', '0.485526', '0.502020', '0.503481', '0.495321', '0.598263', '0.593300', '0.501648', '0.479826', '0.598375']
         : correct/total = [(8287, 14232), (6964, 14235), (8613, 14266), (8578, 14217), (8439, 14238), (7251, 14373), (8639, 14346), (8565, 14334), (8565, 14294), (8546, 14373), (8575, 14344), (6944, 14302), (7206, 14354), (7231, 14362), (7093, 14320), (8612, 14395), (8537, 14389), (7152, 14257), (6838, 14251), (8616, 14399)]
         : compromised: 0.4952, honest: 0.5969
         : sketchguard stats = ['Node 0: acc_rate=0.719', 'Node 1: acc_rate=1.000', 'Node 2: acc_rate=0.719']...
Round 004: test acc mean=0.5664 ± 0.0544 | min=0.4939 max=0.6157
         : test loss mean=3962418.0279 ± 5067190.2224
         : individual accs = ['0.611580', '0.493923', '0.611664', '0.615671', '0.610479', '0.499965', '0.613133', '0.607437', '0.611655', '0.612677', '0.610499', '0.507761', '0.498885', '0.502646', '0.498883', '0.608961', '0.604629', '0.499123', '0.497509', '0.610181']
         : correct/total = [(8704, 14232), (7031, 14235), (8726, 14266), (8753, 14217), (8692, 14238), (7186, 14373), (8796, 14346), (8707, 14334), (8743, 14294), (8806, 14373), (8757, 14344), (7262, 14302), (7161, 14354), (7219, 14362), (7144, 14320), (8766, 14395), (8700, 14389), (7116, 14257), (7090, 14251), (8786, 14399)]
         : compromised: 0.4998, honest: 0.6107
         : sketchguard stats = ['Node 0: acc_rate=0.684', 'Node 1: acc_rate=1.000', 'Node 2: acc_rate=0.684']...
Round 005: test acc mean=0.5714 ± 0.0599 | min=0.4917 max=0.6252
         : test loss mean=255820187.8521 ± 316490679.5479
         : individual accs = ['0.622681', '0.494696', '0.621688', '0.624534', '0.616028', '0.493634', '0.623867', '0.620762', '0.620820', '0.625200', '0.617819', '0.491679', '0.497213', '0.518103', '0.491690', '0.617437', '0.612621', '0.496037', '0.504526', '0.616918']
         : correct/total = [(8862, 14232), (7042, 14235), (8869, 14266), (8879, 14217), (8771, 14238), (7095, 14373), (8950, 14346), (8898, 14334), (8874, 14294), (8986, 14373), (8862, 14344), (7032, 14302), (7137, 14354), (7441, 14362), (7041, 14320), (8888, 14395), (8815, 14389), (7072, 14257), (7190, 14251), (8883, 14399)]
         : compromised: 0.4984, honest: 0.6200
         : sketchguard stats = ['Node 0: acc_rate=0.663', 'Node 1: acc_rate=1.000', 'Node 2: acc_rate=0.663']...
Round 006: test acc mean=0.5750 ± 0.0619 | min=0.4821 max=0.6336
         : test loss mean=20703314684.8309 ± 25759089762.0382
         : individual accs = ['0.627108', '0.499403', '0.624842', '0.628754', '0.623753', '0.482084', '0.633626', '0.621111', '0.626557', '0.628540', '0.629392', '0.503076', '0.497422', '0.506336', '0.505447', '0.623689', '0.613455', '0.502841', '0.499404', '0.622474']
         : correct/total = [(8925, 14232), (7109, 14235), (8914, 14266), (8939, 14217), (8881, 14238), (6929, 14373), (9090, 14346), (8903, 14334), (8956, 14294), (9034, 14373), (9028, 14344), (7195, 14302), (7140, 14354), (7272, 14362), (7238, 14320), (8978, 14395), (8827, 14389), (7169, 14257), (7117, 14251), (8963, 14399)]
         : compromised: 0.4995, honest: 0.6253
         : sketchguard stats = ['Node 0: acc_rate=0.649', 'Node 1: acc_rate=1.000', 'Node 2: acc_rate=0.649']...
Round 007: test acc mean=0.5807 ± 0.0646 | min=0.4934 max=0.6388
         : test loss mean=1654796147624.7349 ± 2063726101373.2107
         : individual accs = ['0.635750', '0.502986', '0.630660', '0.638813', '0.627897', '0.496834', '0.638436', '0.630389', '0.635651', '0.635358', '0.634272', '0.502237', '0.493382', '0.502994', '0.500768', '0.634734', '0.627771', '0.508101', '0.506771', '0.629766']
         : correct/total = [(9048, 14232), (7160, 14235), (8997, 14266), (9082, 14217), (8940, 14238), (7141, 14373), (9159, 14346), (9036, 14334), (9086, 14294), (9132, 14373), (9098, 14344), (7183, 14302), (7082, 14354), (7224, 14362), (7171, 14320), (9137, 14395), (9033, 14389), (7244, 14257), (7222, 14251), (9068, 14399)]
         : compromised: 0.5018, honest: 0.6333
         : sketchguard stats = ['Node 0: acc_rate=0.639', 'Node 1: acc_rate=0.857', 'Node 2: acc_rate=0.639']...
Round 008: test acc mean=0.5814 ± 0.0677 | min=0.4849 max=0.6435
         : test loss mean=127849058724020.8438 ± 158716492079190.2812
         : individual accs = ['0.639404', '0.500105', '0.636338', '0.643525', '0.626212', '0.497669', '0.643315', '0.631994', '0.638170', '0.636054', '0.634690', '0.502517', '0.484882', '0.496658', '0.499022', '0.641403', '0.635485', '0.495476', '0.514771', '0.630460']
         : correct/total = [(9100, 14232), (7119, 14235), (9078, 14266), (9149, 14217), (8916, 14238), (7153, 14373), (9229, 14346), (9059, 14334), (9122, 14294), (9142, 14373), (9104, 14344), (7187, 14302), (6960, 14354), (7133, 14362), (7146, 14320), (9233, 14395), (9144, 14389), (7064, 14257), (7336, 14251), (9078, 14399)]
         : compromised: 0.4989, honest: 0.6364
         : sketchguard stats = ['Node 0: acc_rate=0.632', 'Node 1: acc_rate=0.750', 'Node 2: acc_rate=0.632']...
Round 009: test acc mean=0.5837 ± 0.0670 | min=0.4972 max=0.6442
         : test loss mean=10842486999712736.0000 ± 13508349676113968.0000
         : individual accs = ['0.641091', '0.502283', '0.640264', '0.637758', '0.630355', '0.501357', '0.644221', '0.634436', '0.641528', '0.634801', '0.638804', '0.498322', '0.497213', '0.504247', '0.507612', '0.643904', '0.636667', '0.500245', '0.503333', '0.636086']
         : correct/total = [(9124, 14232), (7150, 14235), (9134, 14266), (9067, 14217), (8975, 14238), (7206, 14373), (9242, 14346), (9094, 14334), (9170, 14294), (9124, 14373), (9163, 14344), (7127, 14302), (7137, 14354), (7242, 14362), (7269, 14320), (9269, 14395), (9161, 14389), (7132, 14257), (7173, 14251), (9159, 14399)]
         : compromised: 0.5018, honest: 0.6383
         : sketchguard stats = ['Node 0: acc_rate=0.626', 'Node 1: acc_rate=0.667', 'Node 2: acc_rate=0.626']...
Round 010: test acc mean=0.5860 ± 0.0702 | min=0.4985 max=0.6484
         : test loss mean=885712747515907200.0000 ± 1100417071341710720.0000
         : individual accs = ['0.644393', '0.498560', '0.643488', '0.648449', '0.632743', '0.503305', '0.646940', '0.637087', '0.646215', '0.646142', '0.643265', '0.500629', '0.501602', '0.498468', '0.498673', '0.647169', '0.641184', '0.500105', '0.499333', '0.641295']
         : correct/total = [(9171, 14232), (7097, 14235), (9180, 14266), (9219, 14217), (9009, 14238), (7234, 14373), (9281, 14346), (9132, 14334), (9237, 14294), (9287, 14373), (9227, 14344), (7160, 14302), (7200, 14354), (7159, 14362), (7141, 14320), (9316, 14395), (9226, 14389), (7130, 14257), (7116, 14251), (9234, 14399)]
         : compromised: 0.5001, honest: 0.6432
         : sketchguard stats = ['Node 0: acc_rate=0.621', 'Node 1: acc_rate=0.600', 'Node 2: acc_rate=0.621']...

=== FINAL RESULTS ===
Dataset: sent140, Nodes: 20, Graph: fully, Aggregation: sketchguard
Attack: backdoor, 40.0% compromised
Final accuracy - Compromised: 0.5001, Honest: 0.6432
Overall test accuracy: mean=0.5860 ± 0.0702

=== BACKDOOR ATTACK SUCCESS RATE (ASR) ===
Target label: 1
Trigger size: 3x3
Overall ASR: 0.6706 ± 0.2627
Honest nodes ASR: 0.4579 ± 0.0427
Compromised nodes ASR: 0.9896 ± 0.0120
Note: Higher ASR indicates more successful backdoor attack

=== Sketchguard SUMMARY ===
Node 0: acceptance=0.621
Node 1: acceptance=0.600
Node 2: acceptance=0.621
Node 3: acceptance=0.621
Node 4: acceptance=0.621
Node 5: acceptance=0.600
Node 6: acceptance=0.621
Node 7: acceptance=0.621
Node 8: acceptance=0.621
Node 9: acceptance=0.621
Node 10: acceptance=0.621
Node 11: acceptance=0.600
Node 12: acceptance=0.600
Node 13: acceptance=0.600
Node 14: acceptance=0.600
Node 15: acceptance=0.621
Node 16: acceptance=0.621
Node 17: acceptance=0.600
Node 18: acceptance=0.600
Node 19: acceptance=0.621

=== PARALLEL EXECUTION TIME (realistic for distributed system) ===
  COMMUNICATION (max across nodes):
    - Sketch transfer: 0.000s (0.0%)
    - Model fetch (accepted): 0.000s (0.0%)
  COMPUTATION (max across nodes):
    - Sketching: 0.507s (95.0%)
    - Filtering: 0.002s (0.4%)
    - Aggregation: 0.024s (4.6%)
  TOTALS:
    - Total computation: 0.534s (100.0%)
    - Total communication: 0.000s (0.0%)
    - Total parallel time: 0.534s

=== PER-NODE AVERAGE TIME ===
  - Sketching: 0.462s
  - Filtering: 0.001s
  - Aggregation: 0.022s
  - Sketch transfer: 0.000s
  - Model fetch: 0.000s
  - Total per node: 0.484s

=== TOTAL COMPUTATIONAL WORK (sum across all nodes) ===
  - Total sketching: 9.231s
  - Total filtering: 0.017s
  - Total aggregation: 0.432s
  - Total sketch transfer: 0.000s
  - Total model fetch: 0.000s
  - Grand total: 9.681s
  - Mean acceptance rate: 0.613

Sketchguard Algorithm Properties:
  - Original dimension: 1,174,986
  - Sketch size: 180
  - Compression ratio: 19.9x
  - Single repetition: No repetitions needed
  - Theoretical complexity: O(d + N×k)
  - Approach: Sketch filtering + state aggregation
