Device: cuda
Seed: 987654321
Loading 1 LEAF Sent140 train files...
LEAF Sent140 train: 254555 users, 908652 samples
Building vocabulary (max_size=10000)...
Vocabulary size: 10000
Loading 1 LEAF Sent140 test files...
LEAF Sent140 test: 254555 users, 286281 samples
Found 254555 train users, 254555 test users, 254555 common users
User sample counts range: 494 (max) to 1 (min)
Distributed ALL 254555 users across 20 clients
Users per client: 12727 (with 15 clients getting +1 user)
Train partition sizes: [44353, 44290, 44657, 44907, 44696, 45843, 45801, 45619, 45069, 45639, 45821, 45311, 45779, 46056, 45625, 45984, 46428, 44737, 45540, 46497]
Test partition sizes: [14232, 14235, 14266, 14217, 14238, 14373, 14346, 14334, 14294, 14373, 14344, 14302, 14354, 14362, 14320, 14395, 14389, 14257, 14251, 14399]
  Client 0: 44353 train samples, 2 unique classes
  Client 1: 44290 train samples, 2 unique classes
  Client 2: 44657 train samples, 2 unique classes
  Client 3: 44907 train samples, 2 unique classes
  Client 4: 44696 train samples, 2 unique classes
  Client 5: 45843 train samples, 2 unique classes
  Client 6: 45801 train samples, 2 unique classes
  Client 7: 45619 train samples, 2 unique classes
  Client 8: 45069 train samples, 2 unique classes
  Client 9: 45639 train samples, 2 unique classes
  Client 10: 45821 train samples, 2 unique classes
  Client 11: 45311 train samples, 2 unique classes
  Client 12: 45779 train samples, 2 unique classes
  Client 13: 46056 train samples, 2 unique classes
  Client 14: 45625 train samples, 2 unique classes
  Client 15: 45984 train samples, 2 unique classes
  Client 16: 46428 train samples, 2 unique classes
  Client 17: 44737 train samples, 2 unique classes
  Client 18: 45540 train samples, 2 unique classes
  Client 19: 46497 train samples, 2 unique classes
Will sample 4500 samples per client per epoch
Graph: erdos, nodes: 20, edges: 48
Degree statistics: avg=4.80, min=2, max=7
Attack: Compromised 10/20 nodes: [1, 2, 5, 11, 12, 13, 14, 15, 17, 18]
Attack type: backdoor, lambda: 1.0
Backdoor target label: 1, trigger size: 3
Model variant: baseline
Model parameters: 1,174,986
BALANCE algorithm:
Balance Config: BALANCEConfig(gamma=2, kappa=1, alpha=0.5, min_neighbors=1)
  - Model dimension: 1,174,986 parameters
  - Complexity: O(N×d) = O(20×1,174,986)
Initial test acc across nodes: mean=0.4965 ± 0.0152
Backdoor attack: Created poisoned datasets for 10 compromised nodes
Round 001: test acc mean=0.4998 ± 0.0091 | min=0.4807 max=0.5259
         : test loss mean=18.4603 ± 17.5918
         : individual accs = ['0.502600', '0.509027', '0.486541', '0.505381', '0.480685', '0.487720', '0.525931', '0.500907', '0.499021', '0.492729', '0.499442', '0.496574', '0.499791', '0.508425', '0.503841', '0.499896', '0.501772', '0.500175', '0.497088', '0.497743']
         : correct/total = [(7153, 14232), (7246, 14235), (6941, 14266), (7185, 14217), (6844, 14238), (7010, 14373), (7545, 14346), (7180, 14334), (7133, 14294), (7082, 14373), (7164, 14344), (7102, 14302), (7174, 14354), (7302, 14362), (7215, 14320), (7196, 14395), (7220, 14389), (7131, 14257), (7084, 14251), (7167, 14399)]
         : compromised: 0.4989, honest: 0.5006
Round 002: test acc mean=0.4988 ± 0.0108 | min=0.4840 max=0.5326
         : test loss mean=680.5738 ± 695.6800
         : individual accs = ['0.494871', '0.503548', '0.508832', '0.487796', '0.489324', '0.501078', '0.492611', '0.504744', '0.483979', '0.487094', '0.532627', '0.501189', '0.499930', '0.484194', '0.492109', '0.507954', '0.499201', '0.504314', '0.500316', '0.500521']
         : correct/total = [(7043, 14232), (7168, 14235), (7259, 14266), (6935, 14217), (6967, 14238), (7202, 14373), (7067, 14346), (7235, 14334), (6918, 14294), (7001, 14373), (7640, 14344), (7168, 14302), (7176, 14354), (6954, 14362), (7047, 14320), (7312, 14395), (7183, 14389), (7190, 14257), (7130, 14251), (7207, 14399)]
         : compromised: 0.5003, honest: 0.4973
Round 003: test acc mean=0.5090 ± 0.0110 | min=0.4914 max=0.5354
         : test loss mean=39388.4663 ± 40539.9038
         : individual accs = ['0.509134', '0.504180', '0.502664', '0.528171', '0.505478', '0.501565', '0.531228', '0.491419', '0.510914', '0.499339', '0.535416', '0.504755', '0.520900', '0.505431', '0.507821', '0.505731', '0.499131', '0.506979', '0.505017', '0.503924']
         : correct/total = [(7246, 14232), (7177, 14235), (7171, 14266), (7509, 14217), (7197, 14238), (7209, 14373), (7621, 14346), (7044, 14334), (7303, 14294), (7177, 14373), (7680, 14344), (7219, 14302), (7477, 14354), (7259, 14362), (7272, 14320), (7280, 14395), (7182, 14389), (7228, 14257), (7197, 14251), (7256, 14399)]
         : compromised: 0.5065, honest: 0.5114
Round 004: test acc mean=0.5026 ± 0.0133 | min=0.4868 max=0.5440
         : test loss mean=6177107.0868 ± 7244563.3389
         : individual accs = ['0.497822', '0.508535', '0.497126', '0.543997', '0.504706', '0.491825', '0.513523', '0.502023', '0.505387', '0.529395', '0.493168', '0.498881', '0.492964', '0.490182', '0.499022', '0.490934', '0.500660', '0.486778', '0.503052', '0.502674']
         : correct/total = [(7085, 14232), (7239, 14235), (7092, 14266), (7734, 14217), (7186, 14238), (7069, 14373), (7367, 14346), (7196, 14334), (7224, 14294), (7609, 14373), (7074, 14344), (7135, 14302), (7076, 14354), (7040, 14362), (7146, 14320), (7067, 14395), (7204, 14389), (6940, 14257), (7169, 14251), (7238, 14399)]
         : compromised: 0.4959, honest: 0.5093
Round 005: test acc mean=0.5029 ± 0.0152 | min=0.4827 max=0.5624
         : test loss mean=328189585.1117 ± 339345743.5687
         : individual accs = ['0.498243', '0.482684', '0.493341', '0.562355', '0.505900', '0.496626', '0.495957', '0.505163', '0.510914', '0.493008', '0.510527', '0.505524', '0.502508', '0.490322', '0.504120', '0.493296', '0.500660', '0.501227', '0.502912', '0.503368']
         : correct/total = [(7091, 14232), (6871, 14235), (7038, 14266), (7995, 14217), (7203, 14238), (7138, 14373), (7115, 14346), (7241, 14334), (7303, 14294), (7086, 14373), (7323, 14344), (7230, 14302), (7213, 14354), (7042, 14362), (7219, 14320), (7101, 14395), (7204, 14389), (7146, 14257), (7167, 14251), (7248, 14399)]
         : compromised: 0.4973, honest: 0.5086
Round 006: test acc mean=0.5063 ± 0.0167 | min=0.4889 max=0.5681
         : test loss mean=24325747065.2225 ± 24949284883.9326
         : individual accs = ['0.506886', '0.488936', '0.494182', '0.568052', '0.504635', '0.505810', '0.523142', '0.493372', '0.502519', '0.522368', '0.497142', '0.512446', '0.504459', '0.501393', '0.508659', '0.491004', '0.497950', '0.498071', '0.502561', '0.502118']
         : correct/total = [(7214, 14232), (6960, 14235), (7050, 14266), (8076, 14217), (7185, 14238), (7270, 14373), (7505, 14346), (7072, 14334), (7183, 14294), (7508, 14373), (7131, 14344), (7329, 14302), (7241, 14354), (7201, 14362), (7284, 14320), (7068, 14395), (7165, 14389), (7101, 14257), (7162, 14251), (7230, 14399)]
         : compromised: 0.5008, honest: 0.5118
Round 007: test acc mean=0.5039 ± 0.0141 | min=0.4885 max=0.5566
         : test loss mean=1994505402658.6606 ± 2042985773708.1375
         : individual accs = ['0.508642', '0.502845', '0.495163', '0.556587', '0.510044', '0.507618', '0.497003', '0.499233', '0.522177', '0.502400', '0.497142', '0.505174', '0.502996', '0.491366', '0.500628', '0.488503', '0.497116', '0.494143', '0.499684', '0.500382']
         : correct/total = [(7239, 14232), (7158, 14235), (7064, 14266), (7913, 14217), (7262, 14238), (7296, 14373), (7130, 14346), (7156, 14334), (7464, 14294), (7221, 14373), (7131, 14344), (7225, 14302), (7220, 14354), (7057, 14362), (7169, 14320), (7032, 14395), (7153, 14389), (7045, 14257), (7121, 14251), (7205, 14399)]
         : compromised: 0.4988, honest: 0.5091
Round 008: test acc mean=0.5063 ± 0.0150 | min=0.4892 max=0.5550
         : test loss mean=163783899089034.6250 ± 167640267671611.0625
         : individual accs = ['0.504918', '0.491184', '0.496635', '0.554969', '0.509482', '0.502192', '0.527394', '0.505511', '0.507346', '0.524943', '0.494423', '0.516711', '0.505922', '0.500070', '0.503631', '0.494269', '0.490792', '0.489233', '0.501579', '0.504688']
         : correct/total = [(7186, 14232), (6992, 14235), (7085, 14266), (7890, 14217), (7254, 14238), (7218, 14373), (7566, 14346), (7246, 14334), (7252, 14294), (7545, 14373), (7092, 14344), (7390, 14302), (7262, 14354), (7182, 14362), (7212, 14320), (7115, 14395), (7062, 14389), (6975, 14257), (7148, 14251), (7267, 14399)]
         : compromised: 0.5001, honest: 0.5124
Round 009: test acc mean=0.5077 ± 0.0179 | min=0.4940 max=0.5688
         : test loss mean=13983579872865728.0000 ± 14338919509938272.0000
         : individual accs = ['0.501897', '0.494345', '0.494392', '0.568756', '0.501334', '0.502748', '0.541754', '0.508651', '0.507556', '0.527726', '0.503555', '0.504335', '0.496517', '0.499861', '0.503561', '0.501702', '0.497950', '0.499264', '0.494000', '0.503924']
         : correct/total = [(7143, 14232), (7037, 14235), (7053, 14266), (8086, 14217), (7138, 14238), (7226, 14373), (7772, 14346), (7291, 14334), (7255, 14294), (7585, 14373), (7223, 14344), (7213, 14302), (7127, 14354), (7179, 14362), (7211, 14320), (7222, 14395), (7165, 14389), (7118, 14257), (7040, 14251), (7256, 14399)]
         : compromised: 0.4991, honest: 0.5163
Round 010: test acc mean=0.5085 ± 0.0189 | min=0.4849 max=0.5676
         : test loss mean=1187482418329672960.0000 ± 1215117468207707136.0000
         : individual accs = ['0.509556', '0.500597', '0.484929', '0.567560', '0.506391', '0.501844', '0.539454', '0.504046', '0.499160', '0.542128', '0.502858', '0.514893', '0.502229', '0.504804', '0.503352', '0.496700', '0.498367', '0.499334', '0.496667', '0.494618']
         : correct/total = [(7252, 14232), (7126, 14235), (6918, 14266), (8069, 14217), (7210, 14238), (7213, 14373), (7739, 14346), (7225, 14334), (7135, 14294), (7792, 14373), (7213, 14344), (7364, 14302), (7209, 14354), (7250, 14362), (7208, 14320), (7150, 14395), (7171, 14389), (7119, 14257), (7078, 14251), (7122, 14399)]
         : compromised: 0.5005, honest: 0.5164

=== FINAL RESULTS ===
Dataset: sent140, Nodes: 20, Graph: erdos, Aggregation: balance
Attack: backdoor, 50.0% compromised
Final accuracy - Compromised: 0.5005, Honest: 0.5164
Overall test accuracy: mean=0.5085 ± 0.0189

=== BACKDOOR ATTACK SUCCESS RATE (ASR) ===
Target label: 1
Trigger size: 3x3
Overall ASR: 0.6860 ± 0.3336
Honest nodes ASR: 0.3810 ± 0.1909
Compromised nodes ASR: 0.9911 ± 0.0074
Note: Higher ASR indicates more successful backdoor attack

=== BALANCE SUMMARY ===
Node 0: acceptance=0.633
Node 1: acceptance=0.700
Node 2: acceptance=0.700
Node 3: acceptance=0.550
Node 4: acceptance=0.900
Node 5: acceptance=0.700
Node 6: acceptance=0.460
Node 7: acceptance=0.440
Node 8: acceptance=1.000
Node 9: acceptance=0.700
Node 10: acceptance=0.550
Node 11: acceptance=0.700
Node 12: acceptance=0.700
Node 13: acceptance=0.700
Node 14: acceptance=0.700
Node 15: acceptance=0.700
Node 16: acceptance=1.000
Node 17: acceptance=0.700
Node 18: acceptance=0.800
Node 19: acceptance=1.000

=== PARALLEL EXECUTION TIME (realistic for distributed system) ===
  COMMUNICATION (max across nodes):
    - Full model transfer: 0.000s (0.0%)
  COMPUTATION (max across nodes):
    - Filtering: 0.034s (72.9%)
    - Aggregation: 0.013s (27.1%)
  TOTALS:
    - Total computation: 0.047s (100.0%)
    - Total communication: 0.000s (0.0%)
    - Total parallel time: 0.047s

=== PER-NODE AVERAGE TIME ===
  - Filtering: 0.024s
  - Aggregation: 0.006s
  - Model transfer: 0.000s
  - Total per node: 0.030s

=== TOTAL COMPUTATIONAL WORK (sum across all nodes) ===
  - Total filtering: 0.472s
  - Total aggregation: 0.121s
  - Total model transfer: 0.000s
  - Grand total: 0.593s
  - Mean acceptance rate: 0.717

BALANCE Algorithm Properties:
  - Model dimension: 1,174,986
  - No compression: Full parameter comparison
  - Theoretical complexity: O(deg(i)×d)
  - Approach: Full parameter filtering + averaging
