Device: cuda
Seed: 987654321
Loading 1 LEAF Sent140 train files...
LEAF Sent140 train: 254555 users, 908652 samples
Building vocabulary (max_size=10000)...
Vocabulary size: 10000
Loading 1 LEAF Sent140 test files...
LEAF Sent140 test: 254555 users, 286281 samples
Found 254555 train users, 254555 test users, 254555 common users
User sample counts range: 494 (max) to 1 (min)
Distributed ALL 254555 users across 20 clients
Users per client: 12727 (with 15 clients getting +1 user)
Train partition sizes: [44353, 44290, 44657, 44907, 44696, 45843, 45801, 45619, 45069, 45639, 45821, 45311, 45779, 46056, 45625, 45984, 46428, 44737, 45540, 46497]
Test partition sizes: [14232, 14235, 14266, 14217, 14238, 14373, 14346, 14334, 14294, 14373, 14344, 14302, 14354, 14362, 14320, 14395, 14389, 14257, 14251, 14399]
  Client 0: 44353 train samples, 2 unique classes
  Client 1: 44290 train samples, 2 unique classes
  Client 2: 44657 train samples, 2 unique classes
  Client 3: 44907 train samples, 2 unique classes
  Client 4: 44696 train samples, 2 unique classes
  Client 5: 45843 train samples, 2 unique classes
  Client 6: 45801 train samples, 2 unique classes
  Client 7: 45619 train samples, 2 unique classes
  Client 8: 45069 train samples, 2 unique classes
  Client 9: 45639 train samples, 2 unique classes
  Client 10: 45821 train samples, 2 unique classes
  Client 11: 45311 train samples, 2 unique classes
  Client 12: 45779 train samples, 2 unique classes
  Client 13: 46056 train samples, 2 unique classes
  Client 14: 45625 train samples, 2 unique classes
  Client 15: 45984 train samples, 2 unique classes
  Client 16: 46428 train samples, 2 unique classes
  Client 17: 44737 train samples, 2 unique classes
  Client 18: 45540 train samples, 2 unique classes
  Client 19: 46497 train samples, 2 unique classes
Will sample 4500 samples per client per epoch
Graph: ring, nodes: 20, edges: 20
Degree statistics: avg=2.00, min=2, max=2
Attack: Compromised 14/20 nodes: [1, 2, 3, 5, 6, 8, 11, 12, 13, 14, 15, 17, 18, 19]
Attack type: directed_deviation, lambda: 1.0
Model variant: baseline
Model parameters: 1,174,986
Initial test acc across nodes: mean=0.4965 ± 0.0152
Round 001: test acc mean=0.5000 ± 0.0098 | min=0.4836 max=0.5216
         : test loss mean=12.4050 ± 7.7216
         : individual accs = ['0.503373', '0.511275', '0.483597', '0.496518', '0.509552', '0.499965', '0.513732', '0.493721', '0.521617', '0.498295', '0.485778', '0.497972', '0.496168', '0.489625', '0.499791', '0.496283', '0.514977', '0.502911', '0.495404', '0.488992']
         : correct/total = [(7164, 14232), (7278, 14235), (6899, 14266), (7059, 14217), (7255, 14238), (7186, 14373), (7370, 14346), (7077, 14334), (7456, 14294), (7162, 14373), (6968, 14344), (7122, 14302), (7122, 14354), (7032, 14362), (7157, 14320), (7144, 14395), (7410, 14389), (7170, 14257), (7060, 14251), (7041, 14399)]
         : compromised: 0.4996, honest: 0.5009
Round 002: test acc mean=0.5002 ± 0.0052 | min=0.4887 max=0.5097
         : test loss mean=9.8601 ± 3.1455
         : individual accs = ['0.506254', '0.505655', '0.497547', '0.499191', '0.502599', '0.497530', '0.493029', '0.496372', '0.506926', '0.493077', '0.494702', '0.488673', '0.505713', '0.499861', '0.500559', '0.500243', '0.500730', '0.502490', '0.503544', '0.509688']
         : correct/total = [(7205, 14232), (7198, 14235), (7098, 14266), (7097, 14217), (7156, 14238), (7151, 14373), (7073, 14346), (7115, 14334), (7246, 14294), (7087, 14373), (7096, 14344), (6989, 14302), (7259, 14354), (7179, 14362), (7168, 14320), (7201, 14395), (7205, 14389), (7164, 14257), (7176, 14251), (7339, 14399)]
         : compromised: 0.5008, honest: 0.4990
Round 003: test acc mean=0.4989 ± 0.0071 | min=0.4880 max=0.5085
         : test loss mean=3.4957 ± 2.2253
         : individual accs = ['0.504356', '0.494134', '0.506659', '0.508335', '0.503231', '0.508453', '0.488011', '0.500907', '0.488177', '0.504905', '0.505229', '0.496364', '0.497422', '0.491227', '0.503561', '0.488850', '0.495726', '0.489514', '0.494281', '0.508160']
         : correct/total = [(7178, 14232), (7034, 14235), (7228, 14266), (7227, 14217), (7165, 14238), (7308, 14373), (7001, 14346), (7180, 14334), (6978, 14294), (7257, 14373), (7247, 14344), (7099, 14302), (7140, 14354), (7055, 14362), (7211, 14320), (7037, 14395), (7133, 14389), (6979, 14257), (7044, 14251), (7317, 14399)]
         : compromised: 0.4974, honest: 0.5024
Round 004: test acc mean=0.5009 ± 0.0050 | min=0.4910 max=0.5086
         : test loss mean=6.6519 ± 3.3393
         : individual accs = ['0.503092', '0.507833', '0.491028', '0.494900', '0.496629', '0.494260', '0.508574', '0.507255', '0.501749', '0.506784', '0.507599', '0.502098', '0.501324', '0.493037', '0.499162', '0.501355', '0.498575', '0.500947', '0.501438', '0.499549']
         : correct/total = [(7160, 14232), (7229, 14235), (7005, 14266), (7036, 14217), (7071, 14238), (7104, 14373), (7296, 14346), (7271, 14334), (7172, 14294), (7284, 14373), (7281, 14344), (7181, 14302), (7196, 14354), (7081, 14362), (7148, 14320), (7217, 14395), (7174, 14389), (7142, 14257), (7146, 14251), (7193, 14399)]
         : compromised: 0.4998, honest: 0.5033
Round 005: test acc mean=0.4996 ± 0.0066 | min=0.4871 max=0.5088
         : test loss mean=3.8755 ± 1.9372
         : individual accs = ['0.487212', '0.487109', '0.494673', '0.507491', '0.505689', '0.506018', '0.495051', '0.501326', '0.496362', '0.508523', '0.507948', '0.495315', '0.503832', '0.508843', '0.499721', '0.498298', '0.500869', '0.501789', '0.493369', '0.492326']
         : correct/total = [(6934, 14232), (6934, 14235), (7057, 14266), (7215, 14217), (7200, 14238), (7273, 14373), (7102, 14346), (7186, 14334), (7095, 14294), (7309, 14373), (7286, 14344), (7084, 14302), (7232, 14354), (7308, 14362), (7156, 14320), (7173, 14395), (7207, 14389), (7154, 14257), (7031, 14251), (7089, 14399)]
         : compromised: 0.4986, honest: 0.5019
Round 006: test acc mean=0.5040 ± 0.0057 | min=0.4942 max=0.5158
         : test loss mean=4.7658 ± 2.9819
         : individual accs = ['0.504075', '0.501791', '0.502594', '0.496378', '0.501334', '0.500104', '0.506343', '0.503418', '0.508955', '0.515828', '0.508645', '0.508181', '0.495472', '0.494221', '0.505936', '0.506773', '0.504830', '0.514414', '0.504386', '0.496701']
         : correct/total = [(7174, 14232), (7143, 14235), (7170, 14266), (7057, 14217), (7138, 14238), (7188, 14373), (7264, 14346), (7216, 14334), (7275, 14294), (7414, 14373), (7296, 14344), (7268, 14302), (7112, 14354), (7098, 14362), (7245, 14320), (7295, 14395), (7264, 14389), (7334, 14257), (7188, 14251), (7152, 14399)]
         : compromised: 0.5030, honest: 0.5064
Round 007: test acc mean=0.5010 ± 0.0110 | min=0.4859 max=0.5294
         : test loss mean=3.8960 ± 2.9816
         : individual accs = ['0.485877', '0.488093', '0.486752', '0.506506', '0.506602', '0.504696', '0.503067', '0.507046', '0.485938', '0.520977', '0.529350', '0.503916', '0.499930', '0.508355', '0.496089', '0.501494', '0.501425', '0.501438', '0.489931', '0.491909']
         : correct/total = [(6915, 14232), (6948, 14235), (6944, 14266), (7201, 14217), (7213, 14238), (7254, 14373), (7217, 14346), (7268, 14334), (6946, 14294), (7488, 14373), (7593, 14344), (7207, 14302), (7176, 14354), (7301, 14362), (7104, 14320), (7219, 14395), (7215, 14389), (7149, 14257), (6982, 14251), (7083, 14399)]
         : compromised: 0.4977, honest: 0.5085
Round 008: test acc mean=0.4990 ± 0.0063 | min=0.4876 max=0.5102
         : test loss mean=3.5345 ± 3.0452
         : individual accs = ['0.504146', '0.494837', '0.498598', '0.500035', '0.493257', '0.498156', '0.504601', '0.502651', '0.509025', '0.510193', '0.510109', '0.497133', '0.490734', '0.487606', '0.492807', '0.501494', '0.494614', '0.501438', '0.492457', '0.495590']
         : correct/total = [(7175, 14232), (7044, 14235), (7113, 14266), (7109, 14217), (7023, 14238), (7160, 14373), (7239, 14346), (7205, 14334), (7276, 14294), (7333, 14373), (7317, 14344), (7110, 14302), (7044, 14354), (7003, 14362), (7057, 14320), (7219, 14395), (7117, 14389), (7149, 14257), (7018, 14251), (7136, 14399)]
         : compromised: 0.4975, honest: 0.5025
Round 009: test acc mean=0.5033 ± 0.0105 | min=0.4825 max=0.5287
         : test loss mean=2.8967 ± 2.8379
         : individual accs = ['0.506535', '0.497366', '0.482546', '0.506928', '0.507656', '0.508592', '0.512965', '0.507186', '0.493704', '0.523203', '0.528723', '0.498672', '0.497144', '0.507381', '0.492877', '0.500799', '0.500382', '0.504875', '0.489650', '0.498993']
         : correct/total = [(7209, 14232), (7080, 14235), (6884, 14266), (7207, 14217), (7228, 14238), (7310, 14373), (7359, 14346), (7270, 14334), (7057, 14294), (7520, 14373), (7584, 14344), (7132, 14302), (7136, 14354), (7287, 14362), (7058, 14320), (7209, 14395), (7200, 14389), (7198, 14257), (6978, 14251), (7185, 14399)]
         : compromised: 0.4995, honest: 0.5123
Round 010: test acc mean=0.5047 ± 0.0070 | min=0.4931 max=0.5214
         : test loss mean=2.8862 ± 2.6584
         : individual accs = ['0.507026', '0.504110', '0.505468', '0.507983', '0.501475', '0.512767', '0.502231', '0.508302', '0.510494', '0.517359', '0.521403', '0.493078', '0.501463', '0.506754', '0.502514', '0.496700', '0.495795', '0.498211', '0.503403', '0.497396']
         : correct/total = [(7216, 14232), (7176, 14235), (7211, 14266), (7222, 14217), (7140, 14238), (7370, 14373), (7205, 14346), (7286, 14334), (7297, 14294), (7436, 14373), (7479, 14344), (7052, 14302), (7198, 14354), (7278, 14362), (7196, 14320), (7150, 14395), (7134, 14389), (7103, 14257), (7174, 14251), (7162, 14399)]
         : compromised: 0.5030, honest: 0.5086

=== FINAL RESULTS ===
Dataset: sent140, Nodes: 20, Graph: ring, Aggregation: krum
Attack: directed_deviation, 70.0% compromised
Final accuracy - Compromised: 0.5030, Honest: 0.5086
Overall test accuracy: mean=0.5047 ± 0.0070
