Device: cuda
Seed: 987654321
Loading 1 LEAF Sent140 train files...
LEAF Sent140 train: 254555 users, 908652 samples
Building vocabulary (max_size=10000)...
Vocabulary size: 10000
Loading 1 LEAF Sent140 test files...
LEAF Sent140 test: 254555 users, 286281 samples
Found 254555 train users, 254555 test users, 254555 common users
User sample counts range: 494 (max) to 1 (min)
Distributed ALL 254555 users across 20 clients
Users per client: 12727 (with 15 clients getting +1 user)
Train partition sizes: [44353, 44290, 44657, 44907, 44696, 45843, 45801, 45619, 45069, 45639, 45821, 45311, 45779, 46056, 45625, 45984, 46428, 44737, 45540, 46497]
Test partition sizes: [14232, 14235, 14266, 14217, 14238, 14373, 14346, 14334, 14294, 14373, 14344, 14302, 14354, 14362, 14320, 14395, 14389, 14257, 14251, 14399]
  Client 0: 44353 train samples, 2 unique classes
  Client 1: 44290 train samples, 2 unique classes
  Client 2: 44657 train samples, 2 unique classes
  Client 3: 44907 train samples, 2 unique classes
  Client 4: 44696 train samples, 2 unique classes
  Client 5: 45843 train samples, 2 unique classes
  Client 6: 45801 train samples, 2 unique classes
  Client 7: 45619 train samples, 2 unique classes
  Client 8: 45069 train samples, 2 unique classes
  Client 9: 45639 train samples, 2 unique classes
  Client 10: 45821 train samples, 2 unique classes
  Client 11: 45311 train samples, 2 unique classes
  Client 12: 45779 train samples, 2 unique classes
  Client 13: 46056 train samples, 2 unique classes
  Client 14: 45625 train samples, 2 unique classes
  Client 15: 45984 train samples, 2 unique classes
  Client 16: 46428 train samples, 2 unique classes
  Client 17: 44737 train samples, 2 unique classes
  Client 18: 45540 train samples, 2 unique classes
  Client 19: 46497 train samples, 2 unique classes
Will sample 4500 samples per client per epoch
Graph: ring, nodes: 20, edges: 20
Degree statistics: avg=2.00, min=2, max=2
Attack: Compromised 6/20 nodes: [5, 12, 13, 14, 17, 18]
Attack type: directed_deviation, lambda: 1.0
Model variant: baseline
Model parameters: 1,174,986
Initial test acc across nodes: mean=0.4965 ± 0.0152
Round 001: test acc mean=0.5028 ± 0.0088 | min=0.4860 max=0.5276
         : test loss mean=5.1092 ± 6.9957
         : individual accs = ['0.501897', '0.507130', '0.502383', '0.500035', '0.502669', '0.508384', '0.505716', '0.485977', '0.527564', '0.504905', '0.491007', '0.516361', '0.498537', '0.504595', '0.502723', '0.502049', '0.501494', '0.498913', '0.488317', '0.504479']
         : correct/total = [(7143, 14232), (7219, 14235), (7167, 14266), (7109, 14217), (7157, 14238), (7307, 14373), (7255, 14346), (6966, 14334), (7541, 14294), (7257, 14373), (7043, 14344), (7385, 14302), (7156, 14354), (7247, 14362), (7199, 14320), (7227, 14395), (7216, 14389), (7113, 14257), (6959, 14251), (7264, 14399)]
         : compromised: 0.5002, honest: 0.5038
Round 002: test acc mean=0.5024 ± 0.0122 | min=0.4860 max=0.5365
         : test loss mean=4.1294 ± 4.1382
         : individual accs = ['0.536537', '0.486196', '0.485981', '0.499965', '0.509622', '0.516385', '0.487801', '0.491419', '0.488387', '0.492938', '0.504601', '0.493777', '0.507245', '0.506058', '0.510056', '0.508371', '0.502467', '0.514344', '0.498211', '0.508230']
         : correct/total = [(7636, 14232), (6921, 14235), (6933, 14266), (7108, 14217), (7256, 14238), (7422, 14373), (6998, 14346), (7044, 14334), (6981, 14294), (7085, 14373), (7238, 14344), (7062, 14302), (7281, 14354), (7268, 14362), (7304, 14320), (7318, 14395), (7230, 14389), (7333, 14257), (7100, 14251), (7318, 14399)]
         : compromised: 0.5087, honest: 0.4997
Round 003: test acc mean=0.5021 ± 0.0100 | min=0.4754 max=0.5181
         : test loss mean=1.5847 ± 1.4372
         : individual accs = ['0.502811', '0.509730', '0.491378', '0.493986', '0.503863', '0.509567', '0.497072', '0.493651', '0.511543', '0.496417', '0.502858', '0.475388', '0.503483', '0.493525', '0.502444', '0.518097', '0.513517', '0.494915', '0.513859', '0.513508']
         : correct/total = [(7156, 14232), (7256, 14235), (7010, 14266), (7023, 14217), (7174, 14238), (7324, 14373), (7131, 14346), (7076, 14334), (7312, 14294), (7135, 14373), (7213, 14344), (6799, 14302), (7227, 14354), (7088, 14362), (7195, 14320), (7458, 14395), (7389, 14389), (7056, 14257), (7323, 14251), (7394, 14399)]
         : compromised: 0.5030, honest: 0.5017
Round 004: test acc mean=0.5016 ± 0.0126 | min=0.4771 max=0.5411
         : test loss mean=2.0907 ± 2.0164
         : individual accs = ['0.485736', '0.491465', '0.488785', '0.506506', '0.513485', '0.516733', '0.493657', '0.505511', '0.477123', '0.541084', '0.503416', '0.499790', '0.499721', '0.499861', '0.503003', '0.501077', '0.501494', '0.505085', '0.497860', '0.501146']
         : correct/total = [(6913, 14232), (6996, 14235), (6973, 14266), (7201, 14217), (7311, 14238), (7427, 14373), (7082, 14346), (7246, 14334), (6820, 14294), (7777, 14373), (7221, 14344), (7148, 14302), (7173, 14354), (7179, 14362), (7203, 14320), (7213, 14395), (7216, 14389), (7201, 14257), (7095, 14251), (7216, 14399)]
         : compromised: 0.5037, honest: 0.5007
Round 005: test acc mean=0.5166 ± 0.0202 | min=0.4873 max=0.5831
         : test loss mean=1.5855 ± 1.5369
         : individual accs = ['0.521501', '0.583070', '0.506379', '0.527537', '0.503582', '0.509636', '0.487314', '0.518627', '0.511613', '0.533570', '0.536113', '0.505594', '0.509544', '0.487676', '0.502723', '0.522404', '0.518869', '0.497440', '0.523472', '0.525314']
         : correct/total = [(7422, 14232), (8300, 14235), (7224, 14266), (7500, 14217), (7170, 14238), (7325, 14373), (6991, 14346), (7434, 14334), (7313, 14294), (7669, 14373), (7690, 14344), (7231, 14302), (7314, 14354), (7004, 14362), (7199, 14320), (7520, 14395), (7466, 14389), (7092, 14257), (7460, 14251), (7564, 14399)]
         : compromised: 0.5051, honest: 0.5215
Round 006: test acc mean=0.5179 ± 0.0189 | min=0.4939 max=0.5597
         : test loss mean=1.7025 ± 1.5803
         : individual accs = ['0.528316', '0.559747', '0.514440', '0.556869', '0.515943', '0.522716', '0.507598', '0.504814', '0.525465', '0.559173', '0.509412', '0.502168', '0.510938', '0.510305', '0.506355', '0.507190', '0.510946', '0.493863', '0.498632', '0.512952']
         : correct/total = [(7519, 14232), (7968, 14235), (7339, 14266), (7917, 14217), (7346, 14238), (7513, 14373), (7282, 14346), (7236, 14334), (7511, 14294), (8037, 14373), (7307, 14344), (7182, 14302), (7334, 14354), (7329, 14362), (7251, 14320), (7301, 14395), (7352, 14389), (7041, 14257), (7106, 14251), (7386, 14399)]
         : compromised: 0.5071, honest: 0.5225
Round 007: test acc mean=0.5235 ± 0.0271 | min=0.4922 max=0.6001
         : test loss mean=1.5740 ± 1.5610
         : individual accs = ['0.532532', '0.600140', '0.528810', '0.499754', '0.502177', '0.510332', '0.505298', '0.529440', '0.521617', '0.585542', '0.550823', '0.514334', '0.507803', '0.492202', '0.499302', '0.524071', '0.520606', '0.498282', '0.520525', '0.525523']
         : correct/total = [(7579, 14232), (8543, 14235), (7544, 14266), (7105, 14217), (7150, 14238), (7335, 14373), (7249, 14346), (7589, 14334), (7456, 14294), (8416, 14373), (7901, 14344), (7356, 14302), (7289, 14354), (7069, 14362), (7150, 14320), (7544, 14395), (7491, 14389), (7104, 14257), (7418, 14251), (7567, 14399)]
         : compromised: 0.5047, honest: 0.5315
Round 008: test acc mean=0.5248 ± 0.0265 | min=0.5007 max=0.5904
         : test loss mean=1.5988 ± 1.4998
         : individual accs = ['0.568086', '0.590376', '0.531614', '0.550186', '0.517840', '0.501565', '0.505298', '0.505163', '0.564503', '0.563905', '0.523494', '0.512026', '0.507454', '0.505640', '0.504399', '0.515040', '0.510042', '0.501789', '0.500737', '0.517119']
         : correct/total = [(8085, 14232), (8404, 14235), (7584, 14266), (7822, 14217), (7373, 14238), (7209, 14373), (7249, 14346), (7241, 14334), (8069, 14294), (8105, 14373), (7509, 14344), (7323, 14302), (7284, 14354), (7262, 14362), (7223, 14320), (7414, 14395), (7339, 14389), (7154, 14257), (7136, 14251), (7446, 14399)]
         : compromised: 0.5036, honest: 0.5339
Round 009: test acc mean=0.5353 ± 0.0339 | min=0.4957 max=0.6117
         : test loss mean=1.5666 ± 1.6037
         : individual accs = ['0.542931', '0.611661', '0.571639', '0.519660', '0.498946', '0.508384', '0.512686', '0.523580', '0.578215', '0.602240', '0.561001', '0.529227', '0.507036', '0.495683', '0.497765', '0.546509', '0.547641', '0.496458', '0.521858', '0.533023']
         : correct/total = [(7727, 14232), (8707, 14235), (8155, 14266), (7388, 14217), (7104, 14238), (7307, 14373), (7355, 14346), (7505, 14334), (8265, 14294), (8656, 14373), (8047, 14344), (7569, 14302), (7278, 14354), (7119, 14362), (7128, 14320), (7867, 14395), (7880, 14389), (7078, 14257), (7437, 14251), (7675, 14399)]
         : compromised: 0.5045, honest: 0.5485
Round 010: test acc mean=0.5381 ± 0.0359 | min=0.5026 max=0.6108
         : test loss mean=1.5332 ± 1.4245
         : individual accs = ['0.581928', '0.610818', '0.580331', '0.590701', '0.517418', '0.506157', '0.514359', '0.512697', '0.585980', '0.591665', '0.552566', '0.512096', '0.515814', '0.507102', '0.516969', '0.517402', '0.517965', '0.502560', '0.507543', '0.519342']
         : correct/total = [(8282, 14232), (8695, 14235), (8279, 14266), (8398, 14217), (7367, 14238), (7275, 14373), (7379, 14346), (7349, 14334), (8376, 14294), (8504, 14373), (7926, 14344), (7324, 14302), (7404, 14354), (7283, 14362), (7403, 14320), (7448, 14395), (7453, 14389), (7165, 14257), (7233, 14251), (7478, 14399)]
         : compromised: 0.5094, honest: 0.5504

=== FINAL RESULTS ===
Dataset: sent140, Nodes: 20, Graph: ring, Aggregation: d-fedavg
Attack: directed_deviation, 30.0% compromised
Final accuracy - Compromised: 0.5094, Honest: 0.5504
Overall test accuracy: mean=0.5381 ± 0.0359
