Device: cuda
Seed: 987654321
Loading 1 LEAF Sent140 train files...
LEAF Sent140 train: 254555 users, 908652 samples
Building vocabulary (max_size=10000)...
Vocabulary size: 10000
Loading 1 LEAF Sent140 test files...
LEAF Sent140 test: 254555 users, 286281 samples
Found 254555 train users, 254555 test users, 254555 common users
User sample counts range: 494 (max) to 1 (min)
Distributed ALL 254555 users across 20 clients
Users per client: 12727 (with 15 clients getting +1 user)
Train partition sizes: [44353, 44290, 44657, 44907, 44696, 45843, 45801, 45619, 45069, 45639, 45821, 45311, 45779, 46056, 45625, 45984, 46428, 44737, 45540, 46497]
Test partition sizes: [14232, 14235, 14266, 14217, 14238, 14373, 14346, 14334, 14294, 14373, 14344, 14302, 14354, 14362, 14320, 14395, 14389, 14257, 14251, 14399]
  Client 0: 44353 train samples, 2 unique classes
  Client 1: 44290 train samples, 2 unique classes
  Client 2: 44657 train samples, 2 unique classes
  Client 3: 44907 train samples, 2 unique classes
  Client 4: 44696 train samples, 2 unique classes
  Client 5: 45843 train samples, 2 unique classes
  Client 6: 45801 train samples, 2 unique classes
  Client 7: 45619 train samples, 2 unique classes
  Client 8: 45069 train samples, 2 unique classes
  Client 9: 45639 train samples, 2 unique classes
  Client 10: 45821 train samples, 2 unique classes
  Client 11: 45311 train samples, 2 unique classes
  Client 12: 45779 train samples, 2 unique classes
  Client 13: 46056 train samples, 2 unique classes
  Client 14: 45625 train samples, 2 unique classes
  Client 15: 45984 train samples, 2 unique classes
  Client 16: 46428 train samples, 2 unique classes
  Client 17: 44737 train samples, 2 unique classes
  Client 18: 45540 train samples, 2 unique classes
  Client 19: 46497 train samples, 2 unique classes
Will sample 4500 samples per client per epoch
Graph: erdos, nodes: 20, edges: 48
Degree statistics: avg=4.80, min=2, max=7
Attack: Compromised 8/20 nodes: [1, 5, 11, 12, 13, 14, 17, 18]
Attack type: backdoor, lambda: 1.0
Backdoor target label: 1, trigger size: 3
Model variant: baseline
Model parameters: 1,174,986
Initial test acc across nodes: mean=0.4965 ± 0.0152
Backdoor attack: Created poisoned datasets for 8 compromised nodes
Round 001: test acc mean=0.5004 ± 0.0071 | min=0.4889 max=0.5146
         : test loss mean=5.1570 ± 4.0395
         : individual accs = ['0.512858', '0.507552', '0.488855', '0.494900', '0.495435', '0.502331', '0.491705', '0.514581', '0.493914', '0.500313', '0.497839', '0.497413', '0.492964', '0.503830', '0.501746', '0.502744', '0.505942', '0.502700', '0.491334', '0.508924']
         : correct/total = [(7299, 14232), (7225, 14235), (6974, 14266), (7036, 14217), (7054, 14238), (7220, 14373), (7054, 14346), (7376, 14334), (7060, 14294), (7191, 14373), (7141, 14344), (7114, 14302), (7076, 14354), (7236, 14362), (7185, 14320), (7237, 14395), (7280, 14389), (7167, 14257), (7002, 14251), (7328, 14399)]
         : compromised: 0.5000, honest: 0.5007
Round 002: test acc mean=0.5021 ± 0.0070 | min=0.4910 max=0.5149
         : test loss mean=5.5547 ± 3.5026
         : individual accs = ['0.501757', '0.501159', '0.494532', '0.493705', '0.498946', '0.498713', '0.508504', '0.509069', '0.510564', '0.498991', '0.511015', '0.506433', '0.496308', '0.494639', '0.514874', '0.512400', '0.502606', '0.493372', '0.490983', '0.503924']
         : correct/total = [(7141, 14232), (7134, 14235), (7055, 14266), (7019, 14217), (7104, 14238), (7168, 14373), (7295, 14346), (7297, 14334), (7298, 14294), (7172, 14373), (7330, 14344), (7243, 14302), (7124, 14354), (7104, 14362), (7373, 14320), (7376, 14395), (7232, 14389), (7034, 14257), (6997, 14251), (7256, 14399)]
         : compromised: 0.4996, honest: 0.5038
Round 003: test acc mean=0.5039 ± 0.0103 | min=0.4852 max=0.5229
         : test loss mean=1.4078 ± 1.2110
         : individual accs = ['0.513702', '0.515701', '0.510655', '0.507702', '0.497472', '0.510749', '0.505367', '0.514232', '0.498531', '0.522925', '0.503765', '0.497763', '0.514351', '0.485935', '0.504469', '0.502188', '0.496004', '0.506137', '0.485440', '0.485242']
         : correct/total = [(7311, 14232), (7341, 14235), (7285, 14266), (7218, 14217), (7083, 14238), (7341, 14373), (7250, 14346), (7371, 14334), (7126, 14294), (7516, 14373), (7226, 14344), (7119, 14302), (7383, 14354), (6979, 14362), (7224, 14320), (7229, 14395), (7137, 14389), (7216, 14257), (6918, 14251), (6987, 14399)]
         : compromised: 0.5026, honest: 0.5048
Round 004: test acc mean=0.4986 ± 0.0078 | min=0.4840 max=0.5139
         : test loss mean=3.0404 ± 2.6868
         : individual accs = ['0.496135', '0.510432', '0.501262', '0.500035', '0.501264', '0.498087', '0.500906', '0.497279', '0.496152', '0.488694', '0.513943', '0.493288', '0.484046', '0.507311', '0.485754', '0.496144', '0.494127', '0.498492', '0.497088', '0.512258']
         : correct/total = [(7061, 14232), (7266, 14235), (7151, 14266), (7109, 14217), (7137, 14238), (7159, 14373), (7186, 14346), (7128, 14334), (7092, 14294), (7024, 14373), (7372, 14344), (7055, 14302), (6948, 14354), (7286, 14362), (6956, 14320), (7142, 14395), (7110, 14389), (7107, 14257), (7084, 14251), (7376, 14399)]
         : compromised: 0.4968, honest: 0.4999
Round 005: test acc mean=0.4965 ± 0.0053 | min=0.4863 max=0.5061
         : test loss mean=1.7813 ± 1.3259
         : individual accs = ['0.496065', '0.496312', '0.486331', '0.490610', '0.500632', '0.500174', '0.495469', '0.497977', '0.492514', '0.501148', '0.493028', '0.489302', '0.500836', '0.506058', '0.492458', '0.488920', '0.503718', '0.496037', '0.499825', '0.502743']
         : correct/total = [(7060, 14232), (7065, 14235), (6938, 14266), (6975, 14217), (7128, 14238), (7189, 14373), (7108, 14346), (7138, 14334), (7040, 14294), (7203, 14373), (7072, 14344), (6998, 14302), (7189, 14354), (7268, 14362), (7052, 14320), (7038, 14395), (7248, 14389), (7072, 14257), (7123, 14251), (7239, 14399)]
         : compromised: 0.4976, honest: 0.4958
Round 006: test acc mean=0.5009 ± 0.0074 | min=0.4882 max=0.5144
         : test loss mean=1.9038 ± 1.7320
         : individual accs = ['0.490163', '0.490692', '0.508271', '0.489625', '0.501615', '0.506297', '0.510386', '0.504814', '0.500210', '0.497391', '0.500767', '0.496504', '0.498258', '0.514413', '0.503631', '0.498854', '0.499270', '0.506418', '0.488176', '0.512258']
         : correct/total = [(6976, 14232), (6985, 14235), (7251, 14266), (6961, 14217), (7142, 14238), (7277, 14373), (7322, 14346), (7236, 14334), (7150, 14294), (7149, 14373), (7183, 14344), (7101, 14302), (7152, 14354), (7388, 14362), (7212, 14320), (7181, 14395), (7184, 14389), (7220, 14257), (6957, 14251), (7376, 14399)]
         : compromised: 0.5005, honest: 0.5011
Round 007: test acc mean=0.5036 ± 0.0055 | min=0.4923 max=0.5129
         : test loss mean=1.6335 ± 1.5705
         : individual accs = ['0.492271', '0.504320', '0.512337', '0.506506', '0.504706', '0.508245', '0.503067', '0.500209', '0.512942', '0.504348', '0.503904', '0.503636', '0.504946', '0.500975', '0.505447', '0.507607', '0.496282', '0.493793', '0.497088', '0.509827']
         : correct/total = [(7006, 14232), (7179, 14235), (7309, 14266), (7201, 14217), (7186, 14238), (7305, 14373), (7217, 14346), (7170, 14334), (7332, 14294), (7249, 14373), (7228, 14344), (7203, 14302), (7248, 14354), (7195, 14362), (7238, 14320), (7307, 14395), (7141, 14389), (7040, 14257), (7084, 14251), (7341, 14399)]
         : compromised: 0.5023, honest: 0.5045
Round 008: test acc mean=0.5016 ± 0.0079 | min=0.4862 max=0.5176
         : test loss mean=1.3485 ± 0.8666
         : individual accs = ['0.490233', '0.503618', '0.502313', '0.502638', '0.496839', '0.505114', '0.494145', '0.517581', '0.502938', '0.507827', '0.508366', '0.487344', '0.503483', '0.497911', '0.486173', '0.498854', '0.504274', '0.515466', '0.502631', '0.504202']
         : correct/total = [(6977, 14232), (7169, 14235), (7166, 14266), (7146, 14217), (7074, 14238), (7260, 14373), (7089, 14346), (7419, 14334), (7189, 14294), (7299, 14373), (7292, 14344), (6970, 14302), (7227, 14354), (7151, 14362), (6962, 14320), (7181, 14395), (7256, 14389), (7349, 14257), (7163, 14251), (7260, 14399)]
         : compromised: 0.5002, honest: 0.5025
Round 009: test acc mean=0.4957 ± 0.0062 | min=0.4854 max=0.5054
         : test loss mean=1.4335 ± 1.0829
         : individual accs = ['0.485807', '0.490551', '0.500070', '0.485405', '0.502318', '0.505392', '0.490032', '0.497907', '0.496712', '0.494260', '0.494980', '0.489162', '0.499443', '0.488859', '0.504609', '0.497673', '0.494266', '0.503191', '0.489299', '0.503854']
         : correct/total = [(6914, 14232), (6983, 14235), (7134, 14266), (6901, 14217), (7152, 14238), (7264, 14373), (7030, 14346), (7137, 14334), (7100, 14294), (7104, 14373), (7100, 14344), (6996, 14302), (7169, 14354), (7021, 14362), (7226, 14320), (7164, 14395), (7112, 14389), (7174, 14257), (6973, 14251), (7255, 14399)]
         : compromised: 0.4963, honest: 0.4953
Round 010: test acc mean=0.5035 ± 0.0062 | min=0.4901 max=0.5155
         : test loss mean=3.4038 ± 3.9458
         : individual accs = ['0.496065', '0.490060', '0.515491', '0.507350', '0.503020', '0.508384', '0.501185', '0.511302', '0.511613', '0.508523', '0.499373', '0.508041', '0.501951', '0.496449', '0.500908', '0.504759', '0.500382', '0.500666', '0.496527', '0.508438']
         : correct/total = [(7060, 14232), (6976, 14235), (7354, 14266), (7213, 14217), (7162, 14238), (7307, 14373), (7190, 14346), (7329, 14334), (7313, 14294), (7309, 14373), (7163, 14344), (7266, 14302), (7205, 14354), (7130, 14362), (7173, 14320), (7266, 14395), (7200, 14389), (7138, 14257), (7076, 14251), (7321, 14399)]
         : compromised: 0.5004, honest: 0.5056

=== FINAL RESULTS ===
Dataset: sent140, Nodes: 20, Graph: erdos, Aggregation: d-fedavg
Attack: backdoor, 40.0% compromised
Final accuracy - Compromised: 0.5004, Honest: 0.5056
Overall test accuracy: mean=0.5035 ± 0.0062

=== BACKDOOR ATTACK SUCCESS RATE (ASR) ===
Target label: 1
Trigger size: 3x3
Overall ASR: 0.1654 ± 0.2364
Honest nodes ASR: 0.1582 ± 0.2567
Compromised nodes ASR: 0.1762 ± 0.2018
Note: Higher ASR indicates more successful backdoor attack
