Device: cuda
Seed: 987654321
Loading 1 LEAF Sent140 train files...
LEAF Sent140 train: 254555 users, 908652 samples
Building vocabulary (max_size=10000)...
Vocabulary size: 10000
Loading 1 LEAF Sent140 test files...
LEAF Sent140 test: 254555 users, 286281 samples
Found 254555 train users, 254555 test users, 254555 common users
User sample counts range: 494 (max) to 1 (min)
Distributed ALL 254555 users across 20 clients
Users per client: 12727 (with 15 clients getting +1 user)
Train partition sizes: [44353, 44290, 44657, 44907, 44696, 45843, 45801, 45619, 45069, 45639, 45821, 45311, 45779, 46056, 45625, 45984, 46428, 44737, 45540, 46497]
Test partition sizes: [14232, 14235, 14266, 14217, 14238, 14373, 14346, 14334, 14294, 14373, 14344, 14302, 14354, 14362, 14320, 14395, 14389, 14257, 14251, 14399]
  Client 0: 44353 train samples, 2 unique classes
  Client 1: 44290 train samples, 2 unique classes
  Client 2: 44657 train samples, 2 unique classes
  Client 3: 44907 train samples, 2 unique classes
  Client 4: 44696 train samples, 2 unique classes
  Client 5: 45843 train samples, 2 unique classes
  Client 6: 45801 train samples, 2 unique classes
  Client 7: 45619 train samples, 2 unique classes
  Client 8: 45069 train samples, 2 unique classes
  Client 9: 45639 train samples, 2 unique classes
  Client 10: 45821 train samples, 2 unique classes
  Client 11: 45311 train samples, 2 unique classes
  Client 12: 45779 train samples, 2 unique classes
  Client 13: 46056 train samples, 2 unique classes
  Client 14: 45625 train samples, 2 unique classes
  Client 15: 45984 train samples, 2 unique classes
  Client 16: 46428 train samples, 2 unique classes
  Client 17: 44737 train samples, 2 unique classes
  Client 18: 45540 train samples, 2 unique classes
  Client 19: 46497 train samples, 2 unique classes
Will sample 4500 samples per client per epoch
Graph: ring, nodes: 20, edges: 20
Degree statistics: avg=2.00, min=2, max=2
Attack: Compromised 2/20 nodes: [5, 13]
Attack type: backdoor, lambda: 1.0
Backdoor target label: 1, trigger size: 3
Model variant: baseline
Model parameters: 1,174,986
Initial test acc across nodes: mean=0.4965 ± 0.0152
Backdoor attack: Created poisoned datasets for 2 compromised nodes
Round 001: test acc mean=0.5071 ± 0.0108 | min=0.4860 max=0.5315
         : test loss mean=1.3227 ± 1.0358
         : individual accs = ['0.501897', '0.507130', '0.502383', '0.500035', '0.502669', '0.508384', '0.505716', '0.485977', '0.527564', '0.504905', '0.491007', '0.531534', '0.497492', '0.509121', '0.514316', '0.513720', '0.499409', '0.505646', '0.512736', '0.521217']
         : correct/total = [(7143, 14232), (7219, 14235), (7167, 14266), (7109, 14217), (7157, 14238), (7307, 14373), (7255, 14346), (6966, 14334), (7541, 14294), (7257, 14373), (7043, 14344), (7602, 14302), (7141, 14354), (7312, 14362), (7365, 14320), (7395, 14395), (7186, 14389), (7209, 14257), (7307, 14251), (7505, 14399)]
         : compromised: 0.5088, honest: 0.5070
Round 002: test acc mean=0.4985 ± 0.0085 | min=0.4860 max=0.5173
         : test loss mean=1.3168 ± 0.9708
         : individual accs = ['0.490655', '0.486196', '0.485981', '0.515861', '0.497893', '0.502400', '0.492332', '0.502232', '0.488457', '0.492938', '0.503277', '0.500769', '0.517347', '0.495683', '0.505307', '0.503300', '0.499757', '0.503542', '0.488808', '0.496284']
         : correct/total = [(6983, 14232), (6921, 14235), (6933, 14266), (7334, 14217), (7089, 14238), (7221, 14373), (7063, 14346), (7199, 14334), (6982, 14294), (7085, 14373), (7219, 14344), (7162, 14302), (7426, 14354), (7119, 14362), (7236, 14320), (7245, 14395), (7191, 14389), (7179, 14257), (6966, 14251), (7146, 14399)]
         : compromised: 0.4990, honest: 0.4984
Round 003: test acc mean=0.4980 ± 0.0104 | min=0.4815 max=0.5217
         : test loss mean=0.8013 ± 0.2176
         : individual accs = ['0.489109', '0.486266', '0.494673', '0.521699', '0.501826', '0.493147', '0.505925', '0.493303', '0.511473', '0.492938', '0.481456', '0.490561', '0.505643', '0.490600', '0.493436', '0.519972', '0.499618', '0.503051', '0.488738', '0.496354']
         : correct/total = [(6961, 14232), (6922, 14235), (7057, 14266), (7417, 14217), (7145, 14238), (7088, 14373), (7258, 14346), (7071, 14334), (7311, 14294), (7085, 14373), (6906, 14344), (7016, 14302), (7258, 14354), (7046, 14362), (7066, 14320), (7485, 14395), (7189, 14389), (7172, 14257), (6965, 14251), (7147, 14399)]
         : compromised: 0.4919, honest: 0.4987
Round 004: test acc mean=0.5019 ± 0.0131 | min=0.4803 max=0.5349
         : test loss mean=0.8543 ± 0.2852
         : individual accs = ['0.489109', '0.486266', '0.526006', '0.490188', '0.497542', '0.509636', '0.501603', '0.503907', '0.506646', '0.493008', '0.501603', '0.497693', '0.503762', '0.480295', '0.507053', '0.534908', '0.519842', '0.503051', '0.488738', '0.496354']
         : correct/total = [(6961, 14232), (6922, 14235), (7504, 14266), (6969, 14217), (7084, 14238), (7325, 14373), (7196, 14346), (7223, 14334), (7242, 14294), (7086, 14373), (7195, 14344), (7118, 14302), (7231, 14354), (6898, 14362), (7261, 14320), (7700, 14395), (7480, 14389), (7172, 14257), (6965, 14251), (7147, 14399)]
         : compromised: 0.4950, honest: 0.5026
Round 005: test acc mean=0.5096 ± 0.0206 | min=0.4863 max=0.5540
         : test loss mean=0.7564 ± 0.1357
         : individual accs = ['0.489109', '0.486266', '0.509884', '0.553985', '0.510254', '0.494330', '0.504601', '0.489605', '0.528334', '0.498156', '0.516871', '0.527129', '0.516859', '0.490252', '0.496927', '0.538798', '0.553409', '0.503051', '0.488738', '0.496354']
         : correct/total = [(6961, 14232), (6922, 14235), (7274, 14266), (7876, 14217), (7265, 14238), (7105, 14373), (7239, 14346), (7018, 14334), (7552, 14294), (7160, 14373), (7414, 14344), (7539, 14302), (7419, 14354), (7041, 14362), (7116, 14320), (7756, 14395), (7963, 14389), (7172, 14257), (6965, 14251), (7147, 14399)]
         : compromised: 0.4923, honest: 0.5116
Round 006: test acc mean=0.5191 ± 0.0283 | min=0.4836 max=0.5805
         : test loss mean=0.7850 ± 0.1773
         : individual accs = ['0.489109', '0.486266', '0.580471', '0.546669', '0.513345', '0.508592', '0.501115', '0.510395', '0.539947', '0.511445', '0.547546', '0.527619', '0.513794', '0.483568', '0.500628', '0.557068', '0.572660', '0.505787', '0.488738', '0.496354']
         : correct/total = [(6961, 14232), (6922, 14235), (8281, 14266), (7772, 14217), (7309, 14238), (7310, 14373), (7189, 14346), (7316, 14334), (7718, 14294), (7351, 14373), (7854, 14344), (7546, 14302), (7375, 14354), (6945, 14362), (7169, 14320), (8019, 14395), (8240, 14389), (7211, 14257), (6965, 14251), (7147, 14399)]
         : compromised: 0.4961, honest: 0.5216
Round 007: test acc mean=0.5182 ± 0.0264 | min=0.4791 max=0.5647
         : test loss mean=0.7392 ± 0.1031
         : individual accs = ['0.489109', '0.486266', '0.527408', '0.555743', '0.507023', '0.499687', '0.513174', '0.479141', '0.557087', '0.561678', '0.518684', '0.549084', '0.527170', '0.509191', '0.497067', '0.525460', '0.564737', '0.511047', '0.488738', '0.496354']
         : correct/total = [(6961, 14232), (6922, 14235), (7524, 14266), (7901, 14217), (7219, 14238), (7182, 14373), (7362, 14346), (6868, 14334), (7963, 14294), (8073, 14373), (7440, 14344), (7853, 14302), (7567, 14354), (7313, 14362), (7118, 14320), (7564, 14395), (8126, 14389), (7286, 14257), (6965, 14251), (7147, 14399)]
         : compromised: 0.5044, honest: 0.5197
Round 008: test acc mean=0.5323 ± 0.0368 | min=0.4863 max=0.5927
         : test loss mean=0.7516 ± 0.1249
         : individual accs = ['0.489109', '0.486266', '0.592668', '0.558908', '0.513204', '0.499478', '0.500767', '0.557207', '0.534140', '0.586447', '0.582055', '0.521955', '0.516093', '0.493176', '0.513617', '0.579993', '0.569602', '0.566318', '0.488527', '0.496354']
         : correct/total = [(6961, 14232), (6922, 14235), (8455, 14266), (7946, 14217), (7307, 14238), (7179, 14373), (7184, 14346), (7987, 14334), (7635, 14294), (8429, 14373), (8349, 14344), (7465, 14302), (7408, 14354), (7083, 14362), (7355, 14320), (8349, 14395), (8196, 14389), (8074, 14257), (6962, 14251), (7147, 14399)]
         : compromised: 0.4963, honest: 0.5363
Round 009: test acc mean=0.5316 ± 0.0337 | min=0.4856 max=0.5880
         : test loss mean=0.7270 ± 0.0817
         : individual accs = ['0.489109', '0.509168', '0.587971', '0.576282', '0.515171', '0.485563', '0.517705', '0.495047', '0.567091', '0.577332', '0.544339', '0.547686', '0.527936', '0.506893', '0.506075', '0.553734', '0.570783', '0.567932', '0.490422', '0.496354']
         : correct/total = [(6961, 14232), (7248, 14235), (8388, 14266), (8193, 14217), (7335, 14238), (6979, 14373), (7427, 14346), (7096, 14334), (8106, 14294), (8298, 14373), (7808, 14344), (7833, 14302), (7578, 14354), (7280, 14362), (7247, 14320), (7971, 14395), (8213, 14389), (8097, 14257), (6989, 14251), (7147, 14399)]
         : compromised: 0.4962, honest: 0.5356
Round 010: test acc mean=0.5421 ± 0.0396 | min=0.4891 max=0.6007
         : test loss mean=0.7378 ± 0.1060
         : individual accs = ['0.489109', '0.547383', '0.600659', '0.589857', '0.514609', '0.502887', '0.503694', '0.570811', '0.538618', '0.595631', '0.594953', '0.533422', '0.519576', '0.495753', '0.517598', '0.580132', '0.573216', '0.586799', '0.490001', '0.496354']
         : correct/total = [(6961, 14232), (7792, 14235), (8569, 14266), (8386, 14217), (7327, 14238), (7228, 14373), (7226, 14346), (8182, 14334), (7699, 14294), (8561, 14373), (8534, 14344), (7629, 14302), (7458, 14354), (7120, 14362), (7412, 14320), (8351, 14395), (8248, 14389), (8366, 14257), (6983, 14251), (7147, 14399)]
         : compromised: 0.4993, honest: 0.5468

=== FINAL RESULTS ===
Dataset: sent140, Nodes: 20, Graph: ring, Aggregation: d-fedavg
Attack: backdoor, 10.0% compromised
Final accuracy - Compromised: 0.4993, Honest: 0.5468
Overall test accuracy: mean=0.5421 ± 0.0396

=== BACKDOOR ATTACK SUCCESS RATE (ASR) ===
Target label: 1
Trigger size: 3x3
Overall ASR: 0.5982 ± 0.2420
Honest nodes ASR: 0.6199 ± 0.2370
Compromised nodes ASR: 0.4035 ± 0.1946
Note: Higher ASR indicates more successful backdoor attack
