Device: cuda
Seed: 987654321
Loading 1 LEAF Sent140 train files...
LEAF Sent140 train: 254555 users, 908652 samples
Building vocabulary (max_size=10000)...
Vocabulary size: 10000
Loading 1 LEAF Sent140 test files...
LEAF Sent140 test: 254555 users, 286281 samples
Found 254555 train users, 254555 test users, 254555 common users
User sample counts range: 494 (max) to 1 (min)
Distributed ALL 254555 users across 20 clients
Users per client: 12727 (with 15 clients getting +1 user)
Train partition sizes: [44353, 44290, 44657, 44907, 44696, 45843, 45801, 45619, 45069, 45639, 45821, 45311, 45779, 46056, 45625, 45984, 46428, 44737, 45540, 46497]
Test partition sizes: [14232, 14235, 14266, 14217, 14238, 14373, 14346, 14334, 14294, 14373, 14344, 14302, 14354, 14362, 14320, 14395, 14389, 14257, 14251, 14399]
  Client 0: 44353 train samples, 2 unique classes
  Client 1: 44290 train samples, 2 unique classes
  Client 2: 44657 train samples, 2 unique classes
  Client 3: 44907 train samples, 2 unique classes
  Client 4: 44696 train samples, 2 unique classes
  Client 5: 45843 train samples, 2 unique classes
  Client 6: 45801 train samples, 2 unique classes
  Client 7: 45619 train samples, 2 unique classes
  Client 8: 45069 train samples, 2 unique classes
  Client 9: 45639 train samples, 2 unique classes
  Client 10: 45821 train samples, 2 unique classes
  Client 11: 45311 train samples, 2 unique classes
  Client 12: 45779 train samples, 2 unique classes
  Client 13: 46056 train samples, 2 unique classes
  Client 14: 45625 train samples, 2 unique classes
  Client 15: 45984 train samples, 2 unique classes
  Client 16: 46428 train samples, 2 unique classes
  Client 17: 44737 train samples, 2 unique classes
  Client 18: 45540 train samples, 2 unique classes
  Client 19: 46497 train samples, 2 unique classes
Will sample 4500 samples per client per epoch
Graph: erdos, nodes: 20, edges: 99
Degree statistics: avg=9.90, min=7, max=14
Attack: Compromised 6/20 nodes: [5, 12, 13, 14, 17, 18]
Attack type: directed_deviation, lambda: 1.0
Model variant: baseline
Model parameters: 1,174,986
Sketchguard Node 0:
  Model dim: 1,174,986 → Sketch size: 180
  Compression ratio: 6527.7x
  Using model parameters for aggregation, sketches for filtering
Sketchguard Node 1:
  Model dim: 1,174,986 → Sketch size: 180
  Compression ratio: 6527.7x
  Using model parameters for aggregation, sketches for filtering
Sketchguard Node 2:
  Model dim: 1,174,986 → Sketch size: 180
  Compression ratio: 6527.7x
  Using model parameters for aggregation, sketches for filtering
Sketchguard Node 3:
  Model dim: 1,174,986 → Sketch size: 180
  Compression ratio: 6527.7x
  Using model parameters for aggregation, sketches for filtering
Sketchguard Node 4:
  Model dim: 1,174,986 → Sketch size: 180
  Compression ratio: 6527.7x
  Using model parameters for aggregation, sketches for filtering
Sketchguard Node 5:
  Model dim: 1,174,986 → Sketch size: 180
  Compression ratio: 6527.7x
  Using model parameters for aggregation, sketches for filtering
Sketchguard Node 6:
  Model dim: 1,174,986 → Sketch size: 180
  Compression ratio: 6527.7x
  Using model parameters for aggregation, sketches for filtering
Sketchguard Node 7:
  Model dim: 1,174,986 → Sketch size: 180
  Compression ratio: 6527.7x
  Using model parameters for aggregation, sketches for filtering
Sketchguard Node 8:
  Model dim: 1,174,986 → Sketch size: 180
  Compression ratio: 6527.7x
  Using model parameters for aggregation, sketches for filtering
Sketchguard Node 9:
  Model dim: 1,174,986 → Sketch size: 180
  Compression ratio: 6527.7x
  Using model parameters for aggregation, sketches for filtering
Sketchguard Node 10:
  Model dim: 1,174,986 → Sketch size: 180
  Compression ratio: 6527.7x
  Using model parameters for aggregation, sketches for filtering
Sketchguard Node 11:
  Model dim: 1,174,986 → Sketch size: 180
  Compression ratio: 6527.7x
  Using model parameters for aggregation, sketches for filtering
Sketchguard Node 12:
  Model dim: 1,174,986 → Sketch size: 180
  Compression ratio: 6527.7x
  Using model parameters for aggregation, sketches for filtering
Sketchguard Node 13:
  Model dim: 1,174,986 → Sketch size: 180
  Compression ratio: 6527.7x
  Using model parameters for aggregation, sketches for filtering
Sketchguard Node 14:
  Model dim: 1,174,986 → Sketch size: 180
  Compression ratio: 6527.7x
  Using model parameters for aggregation, sketches for filtering
Sketchguard Node 15:
  Model dim: 1,174,986 → Sketch size: 180
  Compression ratio: 6527.7x
  Using model parameters for aggregation, sketches for filtering
Sketchguard Node 16:
  Model dim: 1,174,986 → Sketch size: 180
  Compression ratio: 6527.7x
  Using model parameters for aggregation, sketches for filtering
Sketchguard Node 17:
  Model dim: 1,174,986 → Sketch size: 180
  Compression ratio: 6527.7x
  Using model parameters for aggregation, sketches for filtering
Sketchguard Node 18:
  Model dim: 1,174,986 → Sketch size: 180
  Compression ratio: 6527.7x
  Using model parameters for aggregation, sketches for filtering
Sketchguard Node 19:
  Model dim: 1,174,986 → Sketch size: 180
  Compression ratio: 6527.7x
  Using model parameters for aggregation, sketches for filtering
Sketchguard ALGORITHM (Sketch-based Filtering + State Aggregation)
  - Model dimension: 1,174,986 parameters
  - Config: SketchguardConfig(gamma=2, kappa=1, alpha=0.5, min_neighbors=1, sketch_size=180, network_seed=987654321, attack_detection_window=5)
  - Sketch size: 180
  - Compression ratio: 6527.7x
  - Complexity: O(d + N×k) = O(1,174,986 + 20×180)
  - Theoretical speedup vs BALANCE: 19.9x
Initial test acc across nodes: mean=0.4953 ± 0.0174
Round 001: test acc mean=0.5086 ± 0.0098 | min=0.4863 max=0.5279
         : test loss mean=0.7182 ± 0.0296
         : individual accs = ['0.497611', '0.511907', '0.510094', '0.512274', '0.495786', '0.502679', '0.510595', '0.525603', '0.506156', '0.520977', '0.510109', '0.519018', '0.527936', '0.512115', '0.505796', '0.506773', '0.507262', '0.503472', '0.486282', '0.498646']
         : correct/total = [(7082, 14232), (7287, 14235), (7277, 14266), (7283, 14217), (7059, 14238), (7225, 14373), (7325, 14346), (7534, 14334), (7235, 14294), (7488, 14373), (7317, 14344), (7423, 14302), (7578, 14354), (7355, 14362), (7243, 14320), (7295, 14395), (7299, 14389), (7178, 14257), (6930, 14251), (7180, 14399)]
         : compromised: 0.5064, honest: 0.5095
         : sketchguard stats = ['Node 0: acc_rate=1.000', 'Node 1: acc_rate=1.000', 'Node 2: acc_rate=1.000']...
Round 002: test acc mean=0.5638 ± 0.0288 | min=0.5136 max=0.6219
         : test loss mean=0.6833 ± 0.0063
         : individual accs = ['0.560146', '0.540639', '0.594911', '0.577056', '0.566512', '0.564670', '0.605883', '0.621948', '0.545823', '0.548528', '0.536322', '0.589288', '0.584854', '0.575686', '0.559846', '0.589649', '0.561818', '0.514484', '0.523753', '0.513577']
         : correct/total = [(7972, 14232), (7696, 14235), (8487, 14266), (8204, 14217), (8066, 14238), (8116, 14373), (8692, 14346), (8915, 14334), (7802, 14294), (7884, 14373), (7693, 14344), (8428, 14302), (8395, 14354), (8268, 14362), (8017, 14320), (8488, 14395), (8084, 14389), (7335, 14257), (7464, 14251), (7395, 14399)]
         : compromised: 0.5539, honest: 0.5680
         : sketchguard stats = ['Node 0: acc_rate=0.833', 'Node 1: acc_rate=0.900', 'Node 2: acc_rate=0.875']...
Round 003: test acc mean=0.6048 ± 0.0177 | min=0.5660 max=0.6270
         : test loss mean=0.6671 ± 0.0046
         : individual accs = ['0.618255', '0.622480', '0.619795', '0.623901', '0.592148', '0.597300', '0.601143', '0.627041', '0.612285', '0.624643', '0.587493', '0.604391', '0.615926', '0.595599', '0.617388', '0.576172', '0.565988', '0.604826', '0.615676', '0.574345']
         : correct/total = [(8799, 14232), (8861, 14235), (8842, 14266), (8870, 14217), (8431, 14238), (8585, 14373), (8624, 14346), (8988, 14334), (8752, 14294), (8978, 14373), (8427, 14344), (8644, 14302), (8841, 14354), (8554, 14362), (8841, 14320), (8294, 14395), (8144, 14389), (8623, 14257), (8774, 14251), (8270, 14399)]
         : compromised: 0.6078, honest: 0.6036
         : sketchguard stats = ['Node 0: acc_rate=0.778', 'Node 1: acc_rate=0.867', 'Node 2: acc_rate=0.833']...
Round 004: test acc mean=0.6341 ± 0.0070 | min=0.6186 max=0.6496
         : test loss mean=0.6459 ± 0.0038
         : individual accs = ['0.638139', '0.635476', '0.629118', '0.638672', '0.646439', '0.635149', '0.635369', '0.649574', '0.637610', '0.626522', '0.634969', '0.631380', '0.641563', '0.625052', '0.634288', '0.618618', '0.630899', '0.631620', '0.627465', '0.633377']
         : correct/total = [(9082, 14232), (9046, 14235), (8975, 14266), (9080, 14217), (9204, 14238), (9129, 14373), (9115, 14346), (9311, 14334), (9114, 14294), (9005, 14373), (9108, 14344), (9030, 14302), (9209, 14354), (8977, 14362), (9083, 14320), (8905, 14395), (9078, 14389), (9005, 14257), (8942, 14251), (9120, 14399)]
         : compromised: 0.6325, honest: 0.6347
         : sketchguard stats = ['Node 0: acc_rate=0.750', 'Node 1: acc_rate=0.850', 'Node 2: acc_rate=0.812']...
Round 005: test acc mean=0.6425 ± 0.0072 | min=0.6245 max=0.6522
         : test loss mean=0.6338 ± 0.0046
         : individual accs = ['0.646150', '0.651423', '0.642016', '0.652177', '0.645245', '0.644751', '0.641991', '0.624529', '0.648734', '0.624713', '0.640616', '0.636345', '0.650063', '0.641136', '0.645112', '0.638972', '0.646119', '0.646560', '0.639464', '0.643100']
         : correct/total = [(9196, 14232), (9273, 14235), (9159, 14266), (9272, 14217), (9187, 14238), (9267, 14373), (9210, 14346), (8952, 14334), (9273, 14294), (8979, 14373), (9189, 14344), (9101, 14302), (9331, 14354), (9208, 14362), (9238, 14320), (9198, 14395), (9297, 14389), (9218, 14257), (9113, 14251), (9260, 14399)]
         : compromised: 0.6445, honest: 0.6416
         : sketchguard stats = ['Node 0: acc_rate=0.733', 'Node 1: acc_rate=0.840', 'Node 2: acc_rate=0.800']...
Round 006: test acc mean=0.6531 ± 0.0071 | min=0.6309 max=0.6619
         : test loss mean=0.6226 ± 0.0048
         : individual accs = ['0.653457', '0.660485', '0.648956', '0.657945', '0.660556', '0.661936', '0.654189', '0.655504', '0.657059', '0.656230', '0.646472', '0.630891', '0.641494', '0.651511', '0.654120', '0.657242', '0.655987', '0.653013', '0.647674', '0.656712']
         : correct/total = [(9300, 14232), (9402, 14235), (9258, 14266), (9354, 14217), (9405, 14238), (9514, 14373), (9385, 14346), (9396, 14334), (9392, 14294), (9432, 14373), (9273, 14344), (9023, 14302), (9208, 14354), (9357, 14362), (9367, 14320), (9461, 14395), (9439, 14389), (9310, 14257), (9230, 14251), (9456, 14399)]
         : compromised: 0.6516, honest: 0.6537
         : sketchguard stats = ['Node 0: acc_rate=0.722', 'Node 1: acc_rate=0.833', 'Node 2: acc_rate=0.792']...
Round 007: test acc mean=0.6585 ± 0.0073 | min=0.6458 max=0.6703
         : test loss mean=0.6158 ± 0.0049
         : individual accs = ['0.654862', '0.670320', '0.660732', '0.664979', '0.664349', '0.668267', '0.649380', '0.645877', '0.663355', '0.666110', '0.648146', '0.659488', '0.665459', '0.650118', '0.658450', '0.645849', '0.657447', '0.657922', '0.656094', '0.663796']
         : correct/total = [(9320, 14232), (9542, 14235), (9426, 14266), (9454, 14217), (9459, 14238), (9605, 14373), (9316, 14346), (9258, 14334), (9482, 14294), (9574, 14373), (9297, 14344), (9432, 14302), (9552, 14354), (9337, 14362), (9429, 14320), (9297, 14395), (9460, 14389), (9380, 14257), (9350, 14251), (9558, 14399)]
         : compromised: 0.6594, honest: 0.6582
         : sketchguard stats = ['Node 0: acc_rate=0.714', 'Node 1: acc_rate=0.829', 'Node 2: acc_rate=0.786']...
Round 008: test acc mean=0.6644 ± 0.0072 | min=0.6403 max=0.6742
         : test loss mean=0.6096 ± 0.0054
         : individual accs = ['0.662381', '0.663224', '0.640264', '0.672223', '0.660626', '0.674181', '0.667782', '0.670643', '0.665454', '0.670215', '0.667178', '0.664872', '0.657169', '0.664253', '0.664595', '0.666898', '0.667802', '0.662411', '0.655673', '0.670324']
         : correct/total = [(9427, 14232), (9441, 14235), (9134, 14266), (9557, 14217), (9406, 14238), (9690, 14373), (9580, 14346), (9613, 14334), (9512, 14294), (9633, 14373), (9570, 14344), (9509, 14302), (9433, 14354), (9540, 14362), (9517, 14320), (9600, 14395), (9609, 14389), (9444, 14257), (9344, 14251), (9652, 14399)]
         : compromised: 0.6630, honest: 0.6650
         : sketchguard stats = ['Node 0: acc_rate=0.708', 'Node 1: acc_rate=0.825', 'Node 2: acc_rate=0.781']...
Round 009: test acc mean=0.6677 ± 0.0066 | min=0.6504 max=0.6772
         : test loss mean=0.6059 ± 0.0045
         : individual accs = ['0.653035', '0.672638', '0.667671', '0.671098', '0.671021', '0.677172', '0.663251', '0.669108', '0.664615', '0.659361', '0.650376', '0.672074', '0.669569', '0.672469', '0.668087', '0.669816', '0.673431', '0.670969', '0.672023', '0.666505']
         : correct/total = [(9294, 14232), (9575, 14235), (9525, 14266), (9541, 14217), (9554, 14238), (9733, 14373), (9515, 14346), (9591, 14334), (9500, 14294), (9477, 14373), (9329, 14344), (9612, 14302), (9611, 14354), (9658, 14362), (9567, 14320), (9642, 14395), (9690, 14389), (9566, 14257), (9577, 14251), (9597, 14399)]
         : compromised: 0.6717, honest: 0.6660
         : sketchguard stats = ['Node 0: acc_rate=0.704', 'Node 1: acc_rate=0.822', 'Node 2: acc_rate=0.778']...
Round 010: test acc mean=0.6764 ± 0.0066 | min=0.6561 max=0.6845
         : test loss mean=0.5968 ± 0.0054
         : individual accs = ['0.677206', '0.682613', '0.656105', '0.677288', '0.680011', '0.683643', '0.678447', '0.684457', '0.670071', '0.673555', '0.679099', '0.677528', '0.683085', '0.675463', '0.676466', '0.673359', '0.676836', '0.680648', '0.664164', '0.677408']
         : correct/total = [(9638, 14232), (9717, 14235), (9360, 14266), (9629, 14217), (9682, 14238), (9826, 14373), (9733, 14346), (9811, 14334), (9578, 14294), (9681, 14373), (9741, 14344), (9690, 14302), (9805, 14354), (9701, 14362), (9687, 14320), (9693, 14395), (9739, 14389), (9704, 14257), (9465, 14251), (9754, 14399)]
         : compromised: 0.6772, honest: 0.6760
         : sketchguard stats = ['Node 0: acc_rate=0.700', 'Node 1: acc_rate=0.820', 'Node 2: acc_rate=0.775']...

=== FINAL RESULTS ===
Dataset: sent140, Nodes: 20, Graph: erdos, Aggregation: sketchguard
Attack: directed_deviation, 30.0% compromised
Final accuracy - Compromised: 0.6772, Honest: 0.6760
Overall test accuracy: mean=0.6764 ± 0.0066

=== Sketchguard SUMMARY ===
Node 0: acceptance=0.700
Node 1: acceptance=0.820
Node 2: acceptance=0.775
Node 3: acceptance=0.743
Node 4: acceptance=0.700
Node 5: acceptance=0.730
Node 6: acceptance=0.625
Node 7: acceptance=0.591
Node 8: acceptance=0.357
Node 9: acceptance=0.918
Node 10: acceptance=0.775
Node 11: acceptance=0.625
Node 12: acceptance=0.775
Node 13: acceptance=0.800
Node 14: acceptance=0.679
Node 15: acceptance=0.600
Node 16: acceptance=0.614
Node 17: acceptance=0.775
Node 18: acceptance=0.775
Node 19: acceptance=0.640

=== PARALLEL EXECUTION TIME (realistic for distributed system) ===
  COMMUNICATION (max across nodes):
    - Sketch transfer: 0.000s (0.0%)
    - Model fetch (accepted): 0.000s (0.0%)
  COMPUTATION (max across nodes):
    - Sketching: 0.421s (95.0%)
    - Filtering: 0.001s (0.2%)
    - Aggregation: 0.021s (4.8%)
  TOTALS:
    - Total computation: 0.443s (100.0%)
    - Total communication: 0.000s (0.0%)
    - Total parallel time: 0.443s

=== PER-NODE AVERAGE TIME ===
  - Sketching: 0.318s
  - Filtering: 0.001s
  - Aggregation: 0.014s
  - Sketch transfer: 0.000s
  - Model fetch: 0.000s
  - Total per node: 0.332s

=== TOTAL COMPUTATIONAL WORK (sum across all nodes) ===
  - Total sketching: 6.360s
  - Total filtering: 0.011s
  - Total aggregation: 0.274s
  - Total sketch transfer: 0.000s
  - Total model fetch: 0.000s
  - Grand total: 6.646s
  - Mean acceptance rate: 0.701

Sketchguard Algorithm Properties:
  - Original dimension: 1,174,986
  - Sketch size: 180
  - Compression ratio: 19.9x
  - Single repetition: No repetitions needed
  - Theoretical complexity: O(d + N×k)
  - Approach: Sketch filtering + state aggregation
