Device: cuda
Seed: 987654321
Loading 1 LEAF Sent140 train files...
LEAF Sent140 train: 254555 users, 908652 samples
Building vocabulary (max_size=10000)...
Vocabulary size: 10000
Loading 1 LEAF Sent140 test files...
LEAF Sent140 test: 254555 users, 286281 samples
Found 254555 train users, 254555 test users, 254555 common users
User sample counts range: 494 (max) to 1 (min)
Distributed ALL 254555 users across 20 clients
Users per client: 12727 (with 15 clients getting +1 user)
Train partition sizes: [44353, 44290, 44657, 44907, 44696, 45843, 45801, 45619, 45069, 45639, 45821, 45311, 45779, 46056, 45625, 45984, 46428, 44737, 45540, 46497]
Test partition sizes: [14232, 14235, 14266, 14217, 14238, 14373, 14346, 14334, 14294, 14373, 14344, 14302, 14354, 14362, 14320, 14395, 14389, 14257, 14251, 14399]
  Client 0: 44353 train samples, 2 unique classes
  Client 1: 44290 train samples, 2 unique classes
  Client 2: 44657 train samples, 2 unique classes
  Client 3: 44907 train samples, 2 unique classes
  Client 4: 44696 train samples, 2 unique classes
  Client 5: 45843 train samples, 2 unique classes
  Client 6: 45801 train samples, 2 unique classes
  Client 7: 45619 train samples, 2 unique classes
  Client 8: 45069 train samples, 2 unique classes
  Client 9: 45639 train samples, 2 unique classes
  Client 10: 45821 train samples, 2 unique classes
  Client 11: 45311 train samples, 2 unique classes
  Client 12: 45779 train samples, 2 unique classes
  Client 13: 46056 train samples, 2 unique classes
  Client 14: 45625 train samples, 2 unique classes
  Client 15: 45984 train samples, 2 unique classes
  Client 16: 46428 train samples, 2 unique classes
  Client 17: 44737 train samples, 2 unique classes
  Client 18: 45540 train samples, 2 unique classes
  Client 19: 46497 train samples, 2 unique classes
Will sample 4500 samples per client per epoch
Graph: erdos, nodes: 20, edges: 48
Degree statistics: avg=4.80, min=2, max=7
Attack: Compromised 12/20 nodes: [1, 2, 3, 5, 8, 11, 12, 13, 14, 15, 17, 18]
Attack type: gaussian, lambda: 1.0
Model variant: baseline
Model parameters: 1,174,986
BALANCE algorithm:
Balance Config: BALANCEConfig(gamma=2, kappa=1, alpha=0.5, min_neighbors=1)
  - Model dimension: 1,174,986 parameters
  - Complexity: O(N×d) = O(20×1,174,986)
Initial test acc across nodes: mean=0.4965 ± 0.0152
Round 001: test acc mean=0.5278 ± 0.0245 | min=0.4797 max=0.5705
         : test loss mean=50.1028 ± 215.3773
         : individual accs = ['0.537732', '0.531788', '0.522080', '0.516143', '0.563984', '0.535170', '0.507040', '0.570532', '0.533581', '0.543589', '0.503834', '0.523074', '0.567647', '0.499791', '0.529818', '0.543869', '0.545903', '0.515326', '0.485369', '0.479686']
         : correct/total = [(7653, 14232), (7570, 14235), (7448, 14266), (7338, 14217), (8030, 14238), (7692, 14373), (7274, 14346), (8178, 14334), (7627, 14294), (7813, 14373), (7227, 14344), (7481, 14302), (8148, 14354), (7178, 14362), (7587, 14320), (7829, 14395), (7855, 14389), (7347, 14257), (6917, 14251), (6907, 14399)]
         : compromised: 0.5253, honest: 0.5315
Round 002: test acc mean=0.5301 ± 0.0360 | min=0.4861 max=0.5973
         : test loss mean=24.2937 ± 102.8861
         : individual accs = ['0.542440', '0.486055', '0.486261', '0.492228', '0.597345', '0.566270', '0.523351', '0.568997', '0.538408', '0.573297', '0.504671', '0.500070', '0.499721', '0.493803', '0.565223', '0.499132', '0.560359', '0.503051', '0.587327', '0.513438']
         : correct/total = [(7720, 14232), (6919, 14235), (6937, 14266), (6998, 14217), (8505, 14238), (8139, 14373), (7508, 14346), (8156, 14334), (7696, 14294), (8240, 14373), (7239, 14344), (7152, 14302), (7173, 14354), (7092, 14362), (8094, 14320), (7185, 14395), (8063, 14389), (7172, 14257), (8370, 14251), (7393, 14399)]
         : compromised: 0.5181, honest: 0.5480
Round 003: test acc mean=0.5398 ± 0.0440 | min=0.4861 max=0.6190
         : test loss mean=31.8125 ± 135.6718
         : individual accs = ['0.556984', '0.486266', '0.486051', '0.497151', '0.619048', '0.567940', '0.542869', '0.599623', '0.561984', '0.580324', '0.515268', '0.492029', '0.499512', '0.490739', '0.583031', '0.498367', '0.575787', '0.503051', '0.608870', '0.531426']
         : correct/total = [(7927, 14232), (6922, 14235), (6934, 14266), (7068, 14217), (8814, 14238), (8163, 14373), (7788, 14346), (8595, 14334), (8033, 14294), (8341, 14373), (7391, 14344), (7037, 14302), (7170, 14354), (7048, 14362), (8349, 14320), (7174, 14395), (8285, 14389), (7172, 14257), (8677, 14251), (7652, 14399)]
         : compromised: 0.5229, honest: 0.5652
Round 004: test acc mean=0.5610 ± 0.0463 | min=0.4861 max=0.6201
         : test loss mean=14.0308 ± 58.1857
         : individual accs = ['0.590711', '0.499543', '0.486051', '0.556447', '0.620101', '0.607458', '0.579186', '0.610088', '0.595355', '0.601197', '0.569576', '0.492029', '0.535391', '0.500766', '0.578422', '0.498367', '0.595246', '0.504454', '0.617571', '0.582610']
         : correct/total = [(8407, 14232), (7111, 14235), (6934, 14266), (7911, 14217), (8829, 14238), (8731, 14373), (8309, 14346), (8745, 14334), (8510, 14294), (8641, 14373), (8170, 14344), (7037, 14302), (7685, 14354), (7192, 14362), (8283, 14320), (7174, 14395), (8565, 14389), (7192, 14257), (8801, 14251), (8389, 14399)]
         : compromised: 0.5393, honest: 0.5936
Round 005: test acc mean=0.5813 ± 0.0460 | min=0.4861 max=0.6288
         : test loss mean=15.6801 ± 65.4074
         : individual accs = ['0.601743', '0.594521', '0.486051', '0.596750', '0.628810', '0.620330', '0.599819', '0.615530', '0.599972', '0.603423', '0.602273', '0.492029', '0.586457', '0.492619', '0.596858', '0.498367', '0.604003', '0.580136', '0.624377', '0.601292']
         : correct/total = [(8564, 14232), (8463, 14235), (6934, 14266), (8484, 14217), (8953, 14238), (8916, 14373), (8605, 14346), (8823, 14334), (8576, 14294), (8673, 14373), (8639, 14344), (7037, 14302), (8418, 14354), (7075, 14362), (8547, 14320), (7174, 14395), (8691, 14389), (8271, 14257), (8898, 14251), (8658, 14399)]
         : compromised: 0.5640, honest: 0.6071
Round 006: test acc mean=0.5919 ± 0.0494 | min=0.4861 max=0.6334
         : test loss mean=8.6956 ± 35.0045
         : individual accs = ['0.610455', '0.608500', '0.486051', '0.606176', '0.633446', '0.624435', '0.611460', '0.623622', '0.616273', '0.616921', '0.618935', '0.492029', '0.616971', '0.501253', '0.599791', '0.498506', '0.611787', '0.617100', '0.629570', '0.615251']
         : correct/total = [(8688, 14232), (8662, 14235), (6934, 14266), (8618, 14217), (9019, 14238), (8975, 14373), (8772, 14346), (8939, 14334), (8809, 14294), (8867, 14373), (8878, 14344), (7037, 14302), (8856, 14354), (7199, 14362), (8589, 14320), (7176, 14395), (8803, 14389), (8798, 14257), (8972, 14251), (8859, 14399)]
         : compromised: 0.5747, honest: 0.6177
Round 007: test acc mean=0.6162 ± 0.0257 | min=0.5196 max=0.6360
         : test loss mean=73.5539 ± 317.7611
         : individual accs = ['0.623735', '0.621988', '0.608720', '0.620876', '0.636044', '0.631392', '0.623519', '0.627668', '0.620610', '0.633271', '0.623257', '0.573906', '0.626655', '0.519566', '0.618925', '0.607086', '0.625269', '0.622782', '0.634622', '0.624627']
         : correct/total = [(8877, 14232), (8854, 14235), (8684, 14266), (8827, 14217), (9056, 14238), (9075, 14373), (8945, 14346), (8997, 14334), (8871, 14294), (9102, 14373), (8940, 14344), (8208, 14302), (8995, 14354), (7462, 14362), (8863, 14320), (8739, 14395), (8997, 14389), (8879, 14257), (9044, 14251), (8994, 14399)]
         : compromised: 0.6089, honest: 0.6272
Round 008: test acc mean=0.6241 ± 0.0272 | min=0.5070 max=0.6384
         : test loss mean=69.4710 ± 300.0009
         : individual accs = ['0.630481', '0.628240', '0.619094', '0.628262', '0.638432', '0.631253', '0.628398', '0.628157', '0.630264', '0.635288', '0.628346', '0.629353', '0.634527', '0.506963', '0.625908', '0.632233', '0.631941', '0.628463', '0.634341', '0.631988']
         : correct/total = [(8973, 14232), (8943, 14235), (8832, 14266), (8932, 14217), (9090, 14238), (9073, 14373), (9015, 14346), (9004, 14334), (9009, 14294), (9131, 14373), (9013, 14344), (9001, 14302), (9108, 14354), (7281, 14362), (8963, 14320), (9101, 14395), (9093, 14389), (8960, 14257), (9040, 14251), (9100, 14399)]
         : compromised: 0.6191, honest: 0.6316
Round 009: test acc mean=0.6276 ± 0.0315 | min=0.4921 max=0.6423
         : test loss mean=122.0211 ± 529.0859
         : individual accs = ['0.638210', '0.638707', '0.627226', '0.629809', '0.642085', '0.636889', '0.635299', '0.629064', '0.637960', '0.641063', '0.633714', '0.630122', '0.642260', '0.492062', '0.621159', '0.636679', '0.640072', '0.631058', '0.634903', '0.634072']
         : correct/total = [(9083, 14232), (9092, 14235), (8948, 14266), (8954, 14217), (9142, 14238), (9154, 14373), (9114, 14346), (9017, 14334), (9119, 14294), (9214, 14373), (9090, 14344), (9012, 14302), (9219, 14354), (7067, 14362), (8895, 14320), (9165, 14395), (9210, 14389), (8997, 14257), (9048, 14251), (9130, 14399)]
         : compromised: 0.6216, honest: 0.6367
Round 010: test acc mean=0.6311 ± 0.0320 | min=0.4931 max=0.6471
         : test loss mean=57.0576 ± 245.9300
         : individual accs = ['0.642636', '0.644398', '0.632763', '0.636773', '0.647141', '0.637236', '0.640666', '0.636598', '0.639289', '0.643220', '0.639083', '0.631380', '0.643932', '0.493107', '0.634497', '0.633275', '0.645285', '0.630638', '0.634131', '0.635391']
         : correct/total = [(9146, 14232), (9173, 14235), (9027, 14266), (9053, 14217), (9214, 14238), (9159, 14373), (9191, 14346), (9125, 14334), (9138, 14294), (9245, 14373), (9167, 14344), (9030, 14302), (9243, 14354), (7082, 14362), (9086, 14320), (9116, 14395), (9285, 14389), (8991, 14257), (9037, 14251), (9149, 14399)]
         : compromised: 0.6243, honest: 0.6413

=== FINAL RESULTS ===
Dataset: sent140, Nodes: 20, Graph: erdos, Aggregation: balance
Attack: gaussian, 60.0% compromised
Final accuracy - Compromised: 0.6243, Honest: 0.6413
Overall test accuracy: mean=0.6311 ± 0.0320

=== BALANCE SUMMARY ===
Node 0: acceptance=0.500
Node 1: acceptance=0.383
Node 2: acceptance=0.320
Node 3: acceptance=0.500
Node 4: acceptance=0.250
Node 5: acceptance=0.200
Node 6: acceptance=0.200
Node 7: acceptance=0.400
Node 8: acceptance=0.500
Node 9: acceptance=0.333
Node 10: acceptance=0.500
Node 11: acceptance=0.214
Node 12: acceptance=0.471
Node 13: acceptance=0.500
Node 14: acceptance=0.143
Node 15: acceptance=0.250
Node 16: acceptance=0.200
Node 17: acceptance=0.460
Node 18: acceptance=0.250
Node 19: acceptance=0.500

=== PARALLEL EXECUTION TIME (realistic for distributed system) ===
  COMMUNICATION (max across nodes):
    - Full model transfer: 0.000s (0.0%)
  COMPUTATION (max across nodes):
    - Filtering: 0.035s (73.8%)
    - Aggregation: 0.013s (26.2%)
  TOTALS:
    - Total computation: 0.048s (100.0%)
    - Total communication: 0.000s (0.0%)
    - Total parallel time: 0.048s

=== PER-NODE AVERAGE TIME ===
  - Filtering: 0.023s
  - Aggregation: 0.005s
  - Model transfer: 0.000s
  - Total per node: 0.029s

=== TOTAL COMPUTATIONAL WORK (sum across all nodes) ===
  - Total filtering: 0.470s
  - Total aggregation: 0.103s
  - Total model transfer: 0.000s
  - Grand total: 0.573s
  - Mean acceptance rate: 0.354

BALANCE Algorithm Properties:
  - Model dimension: 1,174,986
  - No compression: Full parameter comparison
  - Theoretical complexity: O(deg(i)×d)
  - Approach: Full parameter filtering + averaging
