Device: cuda
Seed: 987654321
Loading 1 LEAF Sent140 train files...
LEAF Sent140 train: 254555 users, 908652 samples
Building vocabulary (max_size=10000)...
Vocabulary size: 10000
Loading 1 LEAF Sent140 test files...
LEAF Sent140 test: 254555 users, 286281 samples
Found 254555 train users, 254555 test users, 254555 common users
User sample counts range: 494 (max) to 1 (min)
Distributed ALL 254555 users across 20 clients
Users per client: 12727 (with 15 clients getting +1 user)
Train partition sizes: [44353, 44290, 44657, 44907, 44696, 45843, 45801, 45619, 45069, 45639, 45821, 45311, 45779, 46056, 45625, 45984, 46428, 44737, 45540, 46497]
Test partition sizes: [14232, 14235, 14266, 14217, 14238, 14373, 14346, 14334, 14294, 14373, 14344, 14302, 14354, 14362, 14320, 14395, 14389, 14257, 14251, 14399]
  Client 0: 44353 train samples, 2 unique classes
  Client 1: 44290 train samples, 2 unique classes
  Client 2: 44657 train samples, 2 unique classes
  Client 3: 44907 train samples, 2 unique classes
  Client 4: 44696 train samples, 2 unique classes
  Client 5: 45843 train samples, 2 unique classes
  Client 6: 45801 train samples, 2 unique classes
  Client 7: 45619 train samples, 2 unique classes
  Client 8: 45069 train samples, 2 unique classes
  Client 9: 45639 train samples, 2 unique classes
  Client 10: 45821 train samples, 2 unique classes
  Client 11: 45311 train samples, 2 unique classes
  Client 12: 45779 train samples, 2 unique classes
  Client 13: 46056 train samples, 2 unique classes
  Client 14: 45625 train samples, 2 unique classes
  Client 15: 45984 train samples, 2 unique classes
  Client 16: 46428 train samples, 2 unique classes
  Client 17: 44737 train samples, 2 unique classes
  Client 18: 45540 train samples, 2 unique classes
  Client 19: 46497 train samples, 2 unique classes
Will sample 4500 samples per client per epoch
Graph: fully, nodes: 20, edges: 190
Degree statistics: avg=19.00, min=19, max=19
Attack: Compromised 10/20 nodes: [1, 2, 5, 11, 12, 13, 14, 15, 17, 18]
Attack type: directed_deviation, lambda: 1.0
Model variant: baseline
Model parameters: 1,174,986
Initial test acc across nodes: mean=0.4965 ± 0.0152
Round 001: test acc mean=0.5018 ± 0.0065 | min=0.4910 max=0.5169
         : test loss mean=5.8102 ± 1.7352
         : individual accs = ['0.512648', '0.509449', '0.505047', '0.499683', '0.506321', '0.516941', '0.500558', '0.501186', '0.490975', '0.494817', '0.500279', '0.497483', '0.500209', '0.491784', '0.494832', '0.500938', '0.504691', '0.507470', '0.501860', '0.498576']
         : correct/total = [(7296, 14232), (7252, 14235), (7205, 14266), (7104, 14217), (7209, 14238), (7430, 14373), (7181, 14346), (7184, 14334), (7018, 14294), (7112, 14373), (7176, 14344), (7115, 14302), (7180, 14354), (7063, 14362), (7086, 14320), (7211, 14395), (7262, 14389), (7235, 14257), (7152, 14251), (7179, 14399)]
         : compromised: 0.5026, honest: 0.5010
Round 002: test acc mean=0.4990 ± 0.0042 | min=0.4918 max=0.5081
         : test loss mean=4.5610 ± 0.0430
         : individual accs = ['0.497189', '0.498209', '0.491869', '0.499894', '0.491783', '0.498713', '0.501603', '0.496093', '0.497202', '0.496208', '0.503974', '0.503985', '0.508081', '0.504247', '0.499022', '0.502466', '0.500869', '0.499404', '0.492948', '0.495798']
         : correct/total = [(7076, 14232), (7092, 14235), (7017, 14266), (7107, 14217), (7002, 14238), (7168, 14373), (7196, 14346), (7111, 14334), (7107, 14294), (7132, 14373), (7229, 14344), (7208, 14302), (7293, 14354), (7242, 14362), (7146, 14320), (7233, 14395), (7207, 14389), (7120, 14257), (7025, 14251), (7139, 14399)]
         : compromised: 0.4999, honest: 0.4981
Round 003: test acc mean=0.5051 ± 0.0056 | min=0.4916 max=0.5144
         : test loss mean=1.4026 ± 0.0212
         : individual accs = ['0.510891', '0.513734', '0.514370', '0.507632', '0.505829', '0.505740', '0.502440', '0.504744', '0.511823', '0.507131', '0.500837', '0.507621', '0.500488', '0.491575', '0.504190', '0.501494', '0.500313', '0.496879', '0.511122', '0.503577']
         : correct/total = [(7271, 14232), (7313, 14235), (7338, 14266), (7217, 14217), (7202, 14238), (7269, 14373), (7208, 14346), (7235, 14334), (7316, 14294), (7289, 14373), (7184, 14344), (7260, 14302), (7184, 14354), (7060, 14362), (7220, 14320), (7219, 14395), (7199, 14389), (7084, 14257), (7284, 14251), (7251, 14399)]
         : compromised: 0.5047, honest: 0.5055
Round 004: test acc mean=0.5077 ± 0.0042 | min=0.4987 max=0.5142
         : test loss mean=1.9277 ± 0.0232
         : individual accs = ['0.507729', '0.507763', '0.511426', '0.506084', '0.506391', '0.510123', '0.510107', '0.508023', '0.510914', '0.503235', '0.514152', '0.504475', '0.512679', '0.507032', '0.512291', '0.501910', '0.506081', '0.501017', '0.498702', '0.513161']
         : correct/total = [(7226, 14232), (7228, 14235), (7296, 14266), (7195, 14217), (7210, 14238), (7332, 14373), (7318, 14346), (7282, 14334), (7303, 14294), (7233, 14373), (7375, 14344), (7215, 14302), (7359, 14354), (7282, 14362), (7336, 14320), (7225, 14395), (7282, 14389), (7143, 14257), (7107, 14251), (7389, 14399)]
         : compromised: 0.5067, honest: 0.5086
Round 005: test acc mean=0.5520 ± 0.0037 | min=0.5428 max=0.5591
         : test loss mean=0.7305 ± 0.0033
         : individual accs = ['0.551574', '0.559115', '0.551872', '0.553844', '0.550499', '0.555069', '0.547400', '0.555044', '0.552190', '0.555347', '0.553472', '0.550063', '0.542776', '0.549923', '0.554260', '0.558388', '0.550420', '0.549204', '0.550628', '0.548163']
         : correct/total = [(7850, 14232), (7959, 14235), (7873, 14266), (7874, 14217), (7838, 14238), (7978, 14373), (7853, 14346), (7956, 14334), (7893, 14294), (7982, 14373), (7939, 14344), (7867, 14302), (7791, 14354), (7898, 14362), (7937, 14320), (8038, 14395), (7920, 14389), (7830, 14257), (7847, 14251), (7893, 14399)]
         : compromised: 0.5521, honest: 0.5518
Round 006: test acc mean=0.5054 ± 0.0036 | min=0.4991 max=0.5116
         : test loss mean=1.2475 ± 0.0098
         : individual accs = ['0.509626', '0.508254', '0.509533', '0.502145', '0.503231', '0.505949', '0.505089', '0.504535', '0.508395', '0.506784', '0.502440', '0.508390', '0.509126', '0.499304', '0.511592', '0.499062', '0.502120', '0.506418', '0.505158', '0.500382']
         : correct/total = [(7253, 14232), (7235, 14235), (7269, 14266), (7139, 14217), (7165, 14238), (7272, 14373), (7246, 14346), (7232, 14334), (7267, 14294), (7284, 14373), (7207, 14344), (7271, 14302), (7308, 14354), (7171, 14362), (7326, 14320), (7184, 14395), (7225, 14389), (7220, 14257), (7199, 14251), (7205, 14399)]
         : compromised: 0.5063, honest: 0.5045
Round 007: test acc mean=0.5525 ± 0.0058 | min=0.5414 max=0.5666
         : test loss mean=0.7095 ± 0.0051
         : individual accs = ['0.549044', '0.553776', '0.544932', '0.552226', '0.551412', '0.554025', '0.556253', '0.550649', '0.543165', '0.552216', '0.561838', '0.555447', '0.554898', '0.566634', '0.547765', '0.555262', '0.553548', '0.557200', '0.541436', '0.548163']
         : correct/total = [(7814, 14232), (7883, 14235), (7774, 14266), (7851, 14217), (7851, 14238), (7963, 14373), (7980, 14346), (7893, 14334), (7764, 14294), (7937, 14373), (8059, 14344), (7944, 14302), (7965, 14354), (8138, 14362), (7844, 14320), (7993, 14395), (7965, 14389), (7944, 14257), (7716, 14251), (7893, 14399)]
         : compromised: 0.5531, honest: 0.5519
Round 008: test acc mean=0.5039 ± 0.0036 | min=0.4949 max=0.5098
         : test loss mean=0.9184 ± 0.0058
         : individual accs = ['0.505129', '0.509589', '0.494883', '0.500879', '0.502950', '0.506505', '0.509759', '0.508162', '0.501679', '0.503861', '0.506414', '0.504265', '0.506967', '0.499513', '0.504330', '0.500035', '0.504900', '0.500666', '0.502982', '0.504410']
         : correct/total = [(7189, 14232), (7254, 14235), (7060, 14266), (7121, 14217), (7161, 14238), (7280, 14373), (7313, 14346), (7284, 14334), (7171, 14294), (7242, 14373), (7264, 14344), (7212, 14302), (7277, 14354), (7174, 14362), (7222, 14320), (7198, 14395), (7265, 14389), (7138, 14257), (7168, 14251), (7263, 14399)]
         : compromised: 0.5030, honest: 0.5048
Round 009: test acc mean=0.5872 ± 0.0040 | min=0.5815 max=0.5950
         : test loss mean=0.6708 ± 0.0024
         : individual accs = ['0.583895', '0.591219', '0.585518', '0.586200', '0.592288', '0.586447', '0.581486', '0.583857', '0.584441', '0.584638', '0.593558', '0.584604', '0.590010', '0.595042', '0.582402', '0.588468', '0.591216', '0.591569', '0.584170', '0.583304']
         : correct/total = [(8310, 14232), (8416, 14235), (8353, 14266), (8334, 14217), (8433, 14238), (8429, 14373), (8342, 14346), (8369, 14334), (8354, 14294), (8403, 14373), (8514, 14344), (8361, 14302), (8469, 14354), (8546, 14362), (8340, 14320), (8471, 14395), (8507, 14389), (8434, 14257), (8325, 14251), (8399, 14399)]
         : compromised: 0.5879, honest: 0.5865
Round 010: test acc mean=0.5093 ± 0.0041 | min=0.5005 max=0.5196
         : test loss mean=0.7919 ± 0.0041
         : individual accs = ['0.505270', '0.505796', '0.505678', '0.510305', '0.513836', '0.509080', '0.511223', '0.516325', '0.508675', '0.500522', '0.506344', '0.510348', '0.513097', '0.507589', '0.507123', '0.507746', '0.508027', '0.519604', '0.509227', '0.509202']
         : correct/total = [(7191, 14232), (7200, 14235), (7214, 14266), (7255, 14217), (7316, 14238), (7317, 14373), (7334, 14346), (7401, 14334), (7271, 14294), (7194, 14373), (7263, 14344), (7299, 14302), (7365, 14354), (7290, 14362), (7262, 14320), (7309, 14395), (7310, 14389), (7408, 14257), (7257, 14251), (7332, 14399)]
         : compromised: 0.5095, honest: 0.5090

=== FINAL RESULTS ===
Dataset: sent140, Nodes: 20, Graph: fully, Aggregation: krum
Attack: directed_deviation, 50.0% compromised
Final accuracy - Compromised: 0.5095, Honest: 0.5090
Overall test accuracy: mean=0.5093 ± 0.0041
