Device: cuda
Seed: 987654321
Loading 1 LEAF Sent140 train files...
LEAF Sent140 train: 254555 users, 908652 samples
Building vocabulary (max_size=10000)...
Vocabulary size: 10000
Loading 1 LEAF Sent140 test files...
LEAF Sent140 test: 254555 users, 286281 samples
Found 254555 train users, 254555 test users, 254555 common users
User sample counts range: 494 (max) to 1 (min)
Distributed ALL 254555 users across 20 clients
Users per client: 12727 (with 15 clients getting +1 user)
Train partition sizes: [44353, 44290, 44657, 44907, 44696, 45843, 45801, 45619, 45069, 45639, 45821, 45311, 45779, 46056, 45625, 45984, 46428, 44737, 45540, 46497]
Test partition sizes: [14232, 14235, 14266, 14217, 14238, 14373, 14346, 14334, 14294, 14373, 14344, 14302, 14354, 14362, 14320, 14395, 14389, 14257, 14251, 14399]
  Client 0: 44353 train samples, 2 unique classes
  Client 1: 44290 train samples, 2 unique classes
  Client 2: 44657 train samples, 2 unique classes
  Client 3: 44907 train samples, 2 unique classes
  Client 4: 44696 train samples, 2 unique classes
  Client 5: 45843 train samples, 2 unique classes
  Client 6: 45801 train samples, 2 unique classes
  Client 7: 45619 train samples, 2 unique classes
  Client 8: 45069 train samples, 2 unique classes
  Client 9: 45639 train samples, 2 unique classes
  Client 10: 45821 train samples, 2 unique classes
  Client 11: 45311 train samples, 2 unique classes
  Client 12: 45779 train samples, 2 unique classes
  Client 13: 46056 train samples, 2 unique classes
  Client 14: 45625 train samples, 2 unique classes
  Client 15: 45984 train samples, 2 unique classes
  Client 16: 46428 train samples, 2 unique classes
  Client 17: 44737 train samples, 2 unique classes
  Client 18: 45540 train samples, 2 unique classes
  Client 19: 46497 train samples, 2 unique classes
Will sample 4500 samples per client per epoch
Graph: ring, nodes: 20, edges: 20
Degree statistics: avg=2.00, min=2, max=2
Attack: Compromised 6/20 nodes: [5, 12, 13, 14, 17, 18]
Attack type: gaussian, lambda: 1.0
Model variant: baseline
Model parameters: 1,174,986
UBAR ALGORITHM (Two-Stage Byzantine-resilient)
  - Model dimension: 1,174,986 parameters
  - Rho parameter: 0.7
  - Stage 1: Distance-based filtering (select 70% closest neighbors)
  - Stage 2: Performance-based selection (loss comparison)
  - Complexity: O(deg(i)×d + deg(i)×inference)
Initial test acc across nodes: mean=0.4953 ± 0.0174
Round 001: test acc mean=0.5522 ± 0.0302 | min=0.4893 max=0.5940
         : test loss mean=73.2391 ± 316.2419
         : individual accs = ['0.583263', '0.593818', '0.580331', '0.565942', '0.566021', '0.511375', '0.590687', '0.593972', '0.550091', '0.547763', '0.513246', '0.516291', '0.532395', '0.489347', '0.529050', '0.546440', '0.558621', '0.561408', '0.528594', '0.584902']
         : correct/total = [(8301, 14232), (8453, 14235), (8279, 14266), (8046, 14217), (8059, 14238), (7350, 14373), (8474, 14346), (8514, 14334), (7863, 14294), (7873, 14373), (7362, 14344), (7384, 14302), (7642, 14354), (7028, 14362), (7576, 14320), (7866, 14395), (8038, 14389), (8004, 14257), (7533, 14251), (8422, 14399)]
         : compromised: 0.5254, honest: 0.5637
         : ubar stats = ['Node 0: s1=0.500, s2=1.000', 'Node 1: s1=0.500, s2=1.000', 'Node 2: s1=0.500, s2=1.000']...
Round 002: test acc mean=0.6284 ± 0.0315 | min=0.4953 max=0.6480
         : test loss mean=39.7346 ± 170.3751
         : individual accs = ['0.640880', '0.632455', '0.638301', '0.640219', '0.647984', '0.636541', '0.638645', '0.646156', '0.629145', '0.622000', '0.636642', '0.639841', '0.640797', '0.495335', '0.619693', '0.633692', '0.637084', '0.618784', '0.630201', '0.644003']
         : correct/total = [(9121, 14232), (9003, 14235), (9106, 14266), (9102, 14217), (9226, 14238), (9149, 14373), (9162, 14346), (9262, 14334), (8993, 14294), (8940, 14373), (9132, 14344), (9151, 14302), (9198, 14354), (7114, 14362), (8874, 14320), (9122, 14395), (9167, 14389), (8822, 14257), (8981, 14251), (9273, 14399)]
         : compromised: 0.6069, honest: 0.6376
         : ubar stats = ['Node 0: s1=0.500, s2=1.000', 'Node 1: s1=0.500, s2=1.000', 'Node 2: s1=0.500, s2=1.000']...
Round 003: test acc mean=0.6301 ± 0.0335 | min=0.4899 max=0.6559
         : test loss mean=56.6315 ± 244.0691
         : individual accs = ['0.631113', '0.623744', '0.636829', '0.648660', '0.651356', '0.645238', '0.624983', '0.638831', '0.635511', '0.643637', '0.647936', '0.655852', '0.639682', '0.489904', '0.628701', '0.639667', '0.639516', '0.619836', '0.625640', '0.636016']
         : correct/total = [(8982, 14232), (8879, 14235), (9085, 14266), (9222, 14217), (9274, 14238), (9274, 14373), (8966, 14346), (9157, 14334), (9084, 14294), (9251, 14373), (9294, 14344), (9380, 14302), (9182, 14354), (7036, 14362), (9003, 14320), (9208, 14395), (9202, 14389), (8837, 14257), (8916, 14251), (9158, 14399)]
         : compromised: 0.6082, honest: 0.6395
         : ubar stats = ['Node 0: s1=0.500, s2=1.000', 'Node 1: s1=0.500, s2=1.000', 'Node 2: s1=0.500, s2=1.000']...
Round 004: test acc mean=0.6407 ± 0.0316 | min=0.5069 max=0.6592
         : test loss mean=44.4960 ± 191.2210
         : individual accs = ['0.655495', '0.642150', '0.647343', '0.650207', '0.656904', '0.654213', '0.643246', '0.653272', '0.637400', '0.637724', '0.651980', '0.659209', '0.652710', '0.506893', '0.628282', '0.645849', '0.647856', '0.645998', '0.641639', '0.656434']
         : correct/total = [(9329, 14232), (9141, 14235), (9235, 14266), (9244, 14217), (9353, 14238), (9403, 14373), (9228, 14346), (9364, 14334), (9111, 14294), (9166, 14373), (9352, 14344), (9428, 14302), (9369, 14354), (7280, 14362), (8997, 14320), (9297, 14395), (9322, 14389), (9210, 14257), (9144, 14251), (9452, 14399)]
         : compromised: 0.6216, honest: 0.6489
         : ubar stats = ['Node 0: s1=0.500, s2=1.000', 'Node 1: s1=0.500, s2=1.000', 'Node 2: s1=0.500, s2=1.000']...
Round 005: test acc mean=0.6468 ± 0.0316 | min=0.5107 max=0.6643
         : test loss mean=46.8522 ± 201.5153
         : individual accs = ['0.651068', '0.654865', '0.645030', '0.658648', '0.664349', '0.650317', '0.648264', '0.655644', '0.656219', '0.657135', '0.654838', '0.661726', '0.659398', '0.510653', '0.649441', '0.651407', '0.655848', '0.648664', '0.650902', '0.652268']
         : correct/total = [(9266, 14232), (9322, 14235), (9202, 14266), (9364, 14217), (9459, 14238), (9347, 14373), (9300, 14346), (9398, 14334), (9380, 14294), (9445, 14373), (9393, 14344), (9464, 14302), (9465, 14354), (7334, 14362), (9300, 14320), (9377, 14395), (9437, 14389), (9248, 14257), (9276, 14251), (9392, 14399)]
         : compromised: 0.6282, honest: 0.6548
         : ubar stats = ['Node 0: s1=0.500, s2=1.000', 'Node 1: s1=0.500, s2=1.000', 'Node 2: s1=0.500, s2=1.000']...
Round 006: test acc mean=0.6512 ± 0.0325 | min=0.5116 max=0.6672
         : test loss mean=37.3817 ± 160.2593
         : individual accs = ['0.654370', '0.660485', '0.641946', '0.646831', '0.657466', '0.667223', '0.661787', '0.667155', '0.658878', '0.658874', '0.657348', '0.661096', '0.660164', '0.511558', '0.658240', '0.658076', '0.664535', '0.659536', '0.656656', '0.661157']
         : correct/total = [(9313, 14232), (9402, 14235), (9158, 14266), (9196, 14217), (9361, 14238), (9590, 14373), (9494, 14346), (9563, 14334), (9418, 14294), (9470, 14373), (9429, 14344), (9455, 14302), (9476, 14354), (7347, 14362), (9426, 14320), (9473, 14395), (9562, 14389), (9403, 14257), (9358, 14251), (9520, 14399)]
         : compromised: 0.6356, honest: 0.6579
         : ubar stats = ['Node 0: s1=0.500, s2=1.000', 'Node 1: s1=0.500, s2=1.000', 'Node 2: s1=0.500, s2=1.000']...
Round 007: test acc mean=0.6554 ± 0.0380 | min=0.4925 max=0.6741
         : test loss mean=43.7791 ± 188.1646
         : individual accs = ['0.662099', '0.662452', '0.644680', '0.663290', '0.673971', '0.674111', '0.670082', '0.673155', '0.664405', '0.668267', '0.659370', '0.664732', '0.666713', '0.492550', '0.652654', '0.661549', '0.666273', '0.665918', '0.654551', '0.667546']
         : correct/total = [(9423, 14232), (9430, 14235), (9197, 14266), (9430, 14217), (9596, 14238), (9689, 14373), (9613, 14346), (9649, 14334), (9497, 14294), (9605, 14373), (9458, 14344), (9507, 14302), (9570, 14354), (7074, 14362), (9346, 14320), (9523, 14395), (9587, 14389), (9494, 14257), (9328, 14251), (9612, 14399)]
         : compromised: 0.6344, honest: 0.6644
         : ubar stats = ['Node 0: s1=0.500, s2=1.000', 'Node 1: s1=0.500, s2=1.000', 'Node 2: s1=0.500, s2=1.000']...
Round 008: test acc mean=0.6591 ± 0.0344 | min=0.5131 max=0.6774
         : test loss mean=59.8877 ± 258.3996
         : individual accs = ['0.668775', '0.651704', '0.649657', '0.652529', '0.666456', '0.677381', '0.662763', '0.671411', '0.665454', '0.672441', '0.666829', '0.676828', '0.677233', '0.513090', '0.666480', '0.668079', '0.671972', '0.668794', '0.664164', '0.670324']
         : correct/total = [(9518, 14232), (9277, 14235), (9268, 14266), (9277, 14217), (9489, 14238), (9736, 14373), (9508, 14346), (9624, 14334), (9512, 14294), (9665, 14373), (9565, 14344), (9680, 14302), (9721, 14354), (7369, 14362), (9544, 14320), (9617, 14395), (9669, 14389), (9535, 14257), (9465, 14251), (9652, 14399)]
         : compromised: 0.6445, honest: 0.6654
         : ubar stats = ['Node 0: s1=0.500, s2=1.000', 'Node 1: s1=0.500, s2=1.000', 'Node 2: s1=0.500, s2=1.000']...
Round 009: test acc mean=0.6584 ± 0.0410 | min=0.4834 max=0.6786
         : test loss mean=50.6148 ± 217.9870
         : individual accs = ['0.647203', '0.655357', '0.660802', '0.667370', '0.678607', '0.676198', '0.652935', '0.665481', '0.667203', '0.667154', '0.674080', '0.677947', '0.673680', '0.483359', '0.671858', '0.670997', '0.674891', '0.673424', '0.671041', '0.658101']
         : correct/total = [(9211, 14232), (9329, 14235), (9427, 14266), (9488, 14217), (9662, 14238), (9719, 14373), (9367, 14346), (9539, 14334), (9537, 14294), (9589, 14373), (9669, 14344), (9696, 14302), (9670, 14354), (6942, 14362), (9621, 14320), (9659, 14395), (9711, 14389), (9601, 14257), (9563, 14251), (9476, 14399)]
         : compromised: 0.6416, honest: 0.6656
         : ubar stats = ['Node 0: s1=0.500, s2=1.000', 'Node 1: s1=0.500, s2=1.000', 'Node 2: s1=0.500, s2=1.000']...
Round 010: test acc mean=0.6721 ± 0.0403 | min=0.4997 max=0.6936
         : test loss mean=43.7384 ± 188.0745
         : individual accs = ['0.673201', '0.672919', '0.661853', '0.678765', '0.689844', '0.689835', '0.682560', '0.693596', '0.677417', '0.682530', '0.684119', '0.689064', '0.690470', '0.499652', '0.678422', '0.683223', '0.684273', '0.679596', '0.669637', '0.681158']
         : correct/total = [(9581, 14232), (9579, 14235), (9442, 14266), (9650, 14217), (9822, 14238), (9915, 14373), (9792, 14346), (9942, 14334), (9683, 14294), (9810, 14373), (9813, 14344), (9855, 14302), (9911, 14354), (7176, 14362), (9715, 14320), (9835, 14395), (9846, 14389), (9689, 14257), (9543, 14251), (9808, 14399)]
         : compromised: 0.6513, honest: 0.6810
         : ubar stats = ['Node 0: s1=0.500, s2=1.000', 'Node 1: s1=0.500, s2=1.000', 'Node 2: s1=0.500, s2=1.000']...

=== FINAL RESULTS ===
Dataset: sent140, Nodes: 20, Graph: ring, Aggregation: ubar
Attack: gaussian, 30.0% compromised
Final accuracy - Compromised: 0.6513, Honest: 0.6810
Overall test accuracy: mean=0.6721 ± 0.0403

=== UBAR SUMMARY ===
Node 0: stage1=0.500, stage2=1.000, overall=0.500
Node 1: stage1=0.500, stage2=1.000, overall=0.500
Node 2: stage1=0.500, stage2=1.000, overall=0.500
Node 3: stage1=0.500, stage2=1.000, overall=0.500
Node 4: stage1=0.500, stage2=1.000, overall=0.500
Node 5: stage1=0.500, stage2=1.000, overall=0.500
Node 6: stage1=0.500, stage2=1.000, overall=0.500
Node 7: stage1=0.500, stage2=1.000, overall=0.500
Node 8: stage1=0.500, stage2=1.000, overall=0.500
Node 9: stage1=0.500, stage2=1.000, overall=0.500
Node 10: stage1=0.500, stage2=1.000, overall=0.500
Node 11: stage1=0.500, stage2=1.000, overall=0.500
Node 12: stage1=0.500, stage2=1.000, overall=0.500
Node 13: stage1=0.500, stage2=1.000, overall=0.500
Node 14: stage1=0.500, stage2=1.000, overall=0.500
Node 15: stage1=0.500, stage2=1.000, overall=0.500
Node 16: stage1=0.500, stage2=1.000, overall=0.500
Node 17: stage1=0.500, stage2=1.000, overall=0.500
Node 18: stage1=0.500, stage2=1.000, overall=0.500
Node 19: stage1=0.500, stage2=1.000, overall=0.500

=== PARALLEL EXECUTION TIME (realistic for distributed system) ===
  COMMUNICATION (max across nodes):
    - Full model transfer: 0.000s (0.1%)
  COMPUTATION (max across nodes):
    - Distance computation: 0.021s (54.3%)
    - Loss computation: 0.015s (37.2%)
    - Aggregation: 0.003s (8.5%)
  TOTALS:
    - Total computation: 0.039s (99.9%)
    - Total communication: 0.000s (0.1%)
    - Total parallel time: 0.039s

=== PER-NODE AVERAGE TIME ===
  - Distance computation: 0.008s
  - Loss computation: 0.008s
  - Aggregation: 0.003s
  - Model transfer: 0.000s
  - Total per node: 0.020s

=== TOTAL COMPUTATIONAL WORK (sum across all nodes) ===
  - Total distance computation: 0.170s
  - Total loss computation: 0.168s
  - Total aggregation: 0.064s
  - Total model transfer: 0.000s
  - Grand total: 0.402s
  - Mean Stage 1 acceptance rate: 0.500
  - Mean Stage 2 acceptance rate: 1.000
  - Overall acceptance rate: 0.500

UBAR Algorithm Properties:
  - Model dimension: 1,174,986
  - Rho parameter: 0.7
  - Two-stage approach: Distance filtering + loss evaluation
  - Stage 1 selects: 70% of neighbors
  - Stage 2 uses: Training sample loss comparison
  - Theoretical complexity: O(deg(i)×d + deg(i)×inference)
  - Approach: UBAR paper implementation
