Device: cuda
Seed: 987654321
Loading 1 LEAF Sent140 train files...
LEAF Sent140 train: 254555 users, 908652 samples
Building vocabulary (max_size=10000)...
Vocabulary size: 10000
Loading 1 LEAF Sent140 test files...
LEAF Sent140 test: 254555 users, 286281 samples
Found 254555 train users, 254555 test users, 254555 common users
User sample counts range: 494 (max) to 1 (min)
Distributed ALL 254555 users across 20 clients
Users per client: 12727 (with 15 clients getting +1 user)
Train partition sizes: [44353, 44290, 44657, 44907, 44696, 45843, 45801, 45619, 45069, 45639, 45821, 45311, 45779, 46056, 45625, 45984, 46428, 44737, 45540, 46497]
Test partition sizes: [14232, 14235, 14266, 14217, 14238, 14373, 14346, 14334, 14294, 14373, 14344, 14302, 14354, 14362, 14320, 14395, 14389, 14257, 14251, 14399]
  Client 0: 44353 train samples, 2 unique classes
  Client 1: 44290 train samples, 2 unique classes
  Client 2: 44657 train samples, 2 unique classes
  Client 3: 44907 train samples, 2 unique classes
  Client 4: 44696 train samples, 2 unique classes
  Client 5: 45843 train samples, 2 unique classes
  Client 6: 45801 train samples, 2 unique classes
  Client 7: 45619 train samples, 2 unique classes
  Client 8: 45069 train samples, 2 unique classes
  Client 9: 45639 train samples, 2 unique classes
  Client 10: 45821 train samples, 2 unique classes
  Client 11: 45311 train samples, 2 unique classes
  Client 12: 45779 train samples, 2 unique classes
  Client 13: 46056 train samples, 2 unique classes
  Client 14: 45625 train samples, 2 unique classes
  Client 15: 45984 train samples, 2 unique classes
  Client 16: 46428 train samples, 2 unique classes
  Client 17: 44737 train samples, 2 unique classes
  Client 18: 45540 train samples, 2 unique classes
  Client 19: 46497 train samples, 2 unique classes
Will sample 4500 samples per client per epoch
Graph: erdos, nodes: 20, edges: 48
Degree statistics: avg=4.80, min=2, max=7
Attack: Compromised 4/20 nodes: [5, 12, 13, 17]
Attack type: backdoor, lambda: 1.0
Backdoor target label: 1, trigger size: 3
Model variant: baseline
Model parameters: 1,174,986
Initial test acc across nodes: mean=0.4953 ± 0.0174
Backdoor attack: Created poisoned datasets for 4 compromised nodes
Round 001: test acc mean=0.5027 ± 0.0098 | min=0.4852 max=0.5180
         : test loss mean=2.1082 ± 2.7852
         : individual accs = ['0.508010', '0.485213', '0.513038', '0.515580', '0.517980', '0.502122', '0.501115', '0.502651', '0.504687', '0.514367', '0.490449', '0.509579', '0.501115', '0.492411', '0.493645', '0.505175', '0.485857', '0.492320', '0.504386', '0.514272']
         : correct/total = [(7230, 14232), (6907, 14235), (7319, 14266), (7330, 14217), (7375, 14238), (7217, 14373), (7189, 14346), (7205, 14334), (7214, 14294), (7393, 14373), (7035, 14344), (7288, 14302), (7193, 14354), (7072, 14362), (7069, 14320), (7272, 14395), (6991, 14389), (7019, 14257), (7188, 14251), (7405, 14399)]
         : compromised: 0.4970, honest: 0.5041
Round 002: test acc mean=0.5047 ± 0.0086 | min=0.4899 max=0.5309
         : test loss mean=1.9893 ± 1.9700
         : individual accs = ['0.504146', '0.530875', '0.513038', '0.504185', '0.504495', '0.500522', '0.501673', '0.515488', '0.502868', '0.491755', '0.503904', '0.503496', '0.498816', '0.496310', '0.512291', '0.501910', '0.504830', '0.503682', '0.489931', '0.510591']
         : correct/total = [(7175, 14232), (7557, 14235), (7319, 14266), (7168, 14217), (7183, 14238), (7194, 14373), (7197, 14346), (7389, 14334), (7188, 14294), (7068, 14373), (7228, 14344), (7201, 14302), (7160, 14354), (7128, 14362), (7336, 14320), (7225, 14395), (7264, 14389), (7181, 14257), (6982, 14251), (7352, 14399)]
         : compromised: 0.4998, honest: 0.5060
Round 003: test acc mean=0.4990 ± 0.0110 | min=0.4655 max=0.5121
         : test loss mean=0.7765 ± 0.1554
         : individual accs = ['0.498103', '0.507903', '0.512057', '0.481747', '0.505619', '0.491895', '0.498954', '0.465536', '0.500070', '0.504001', '0.499582', '0.509160', '0.511495', '0.491714', '0.501955', '0.502744', '0.484884', '0.505085', '0.504315', '0.502813']
         : correct/total = [(7089, 14232), (7230, 14235), (7305, 14266), (6849, 14217), (7199, 14238), (7070, 14373), (7158, 14346), (6673, 14334), (7148, 14294), (7244, 14373), (7166, 14344), (7282, 14302), (7342, 14354), (7062, 14362), (7188, 14320), (7237, 14395), (6977, 14389), (7201, 14257), (7187, 14251), (7240, 14399)]
         : compromised: 0.5000, honest: 0.4987
Round 004: test acc mean=0.5058 ± 0.0264 | min=0.4848 max=0.5988
         : test loss mean=1.1653 ± 0.7290
         : individual accs = ['0.491006', '0.519143', '0.505117', '0.484842', '0.492625', '0.498643', '0.498954', '0.491768', '0.598783', '0.517498', '0.494004', '0.492798', '0.491013', '0.507311', '0.490084', '0.492949', '0.495795', '0.491758', '0.504877', '0.556844']
         : correct/total = [(6988, 14232), (7390, 14235), (7206, 14266), (6893, 14217), (7014, 14238), (7167, 14373), (7158, 14346), (7049, 14334), (8559, 14294), (7438, 14373), (7086, 14344), (7048, 14302), (7048, 14354), (7286, 14362), (7018, 14320), (7096, 14395), (7134, 14389), (7011, 14257), (7195, 14251), (8018, 14399)]
         : compromised: 0.4972, honest: 0.5079
Round 005: test acc mean=0.5025 ± 0.0096 | min=0.4780 max=0.5190
         : test loss mean=0.8747 ± 0.4357
         : individual accs = ['0.507378', '0.517035', '0.513038', '0.515088', '0.502669', '0.503792', '0.478043', '0.499023', '0.506156', '0.518959', '0.494841', '0.499161', '0.494566', '0.493176', '0.504888', '0.496561', '0.507123', '0.489444', '0.504386', '0.504341']
         : correct/total = [(7221, 14232), (7360, 14235), (7319, 14266), (7323, 14217), (7157, 14238), (7241, 14373), (6858, 14346), (7153, 14334), (7235, 14294), (7459, 14373), (7098, 14344), (7139, 14302), (7099, 14354), (7083, 14362), (7230, 14320), (7148, 14395), (7297, 14389), (6978, 14257), (7188, 14251), (7262, 14399)]
         : compromised: 0.4952, honest: 0.5043
Round 006: test acc mean=0.5126 ± 0.0160 | min=0.4932 max=0.5595
         : test loss mean=0.8274 ± 0.2087
         : individual accs = ['0.508853', '0.523709', '0.502313', '0.544911', '0.523318', '0.501844', '0.500349', '0.507883', '0.503848', '0.559452', '0.518823', '0.525591', '0.497144', '0.493176', '0.499930', '0.512122', '0.512544', '0.504875', '0.504526', '0.506077']
         : correct/total = [(7242, 14232), (7455, 14235), (7166, 14266), (7747, 14217), (7451, 14238), (7213, 14373), (7178, 14346), (7280, 14334), (7202, 14294), (8041, 14373), (7442, 14344), (7517, 14302), (7136, 14354), (7083, 14362), (7159, 14320), (7372, 14395), (7375, 14389), (7198, 14257), (7190, 14251), (7287, 14399)]
         : compromised: 0.4993, honest: 0.5159
Round 007: test acc mean=0.5157 ± 0.0292 | min=0.4783 max=0.6145
         : test loss mean=0.7538 ± 0.1174
         : individual accs = ['0.512226', '0.517106', '0.513038', '0.577618', '0.506391', '0.522160', '0.500279', '0.507814', '0.614524', '0.516733', '0.501603', '0.478325', '0.497144', '0.493176', '0.522626', '0.502258', '0.513795', '0.504664', '0.505228', '0.507257']
         : correct/total = [(7290, 14232), (7361, 14235), (7319, 14266), (8212, 14217), (7210, 14238), (7505, 14373), (7177, 14346), (7279, 14334), (8784, 14294), (7427, 14373), (7195, 14344), (6841, 14302), (7136, 14354), (7083, 14362), (7484, 14320), (7230, 14395), (7393, 14389), (7195, 14257), (7200, 14251), (7304, 14399)]
         : compromised: 0.5043, honest: 0.5186
Round 008: test acc mean=0.5265 ± 0.0384 | min=0.4925 max=0.6080
         : test loss mean=0.8450 ± 0.3804
         : individual accs = ['0.554595', '0.608008', '0.522501', '0.492509', '0.499227', '0.496765', '0.510177', '0.496372', '0.536169', '0.579698', '0.514431', '0.494756', '0.497144', '0.493176', '0.493645', '0.545953', '0.501494', '0.505366', '0.580801', '0.607820']
         : correct/total = [(7893, 14232), (8655, 14235), (7454, 14266), (7002, 14217), (7108, 14238), (7140, 14373), (7319, 14346), (7115, 14334), (7664, 14294), (8332, 14373), (7379, 14344), (7076, 14302), (7136, 14354), (7083, 14362), (7069, 14320), (7859, 14395), (7216, 14389), (7205, 14257), (8277, 14251), (8752, 14399)]
         : compromised: 0.4981, honest: 0.5336
Round 009: test acc mean=0.5517 ± 0.0417 | min=0.4932 max=0.6207
         : test loss mean=0.7320 ± 0.1203
         : individual accs = ['0.579680', '0.517597', '0.522080', '0.595133', '0.589057', '0.507201', '0.608811', '0.523859', '0.620750', '0.514924', '0.595441', '0.513704', '0.500697', '0.493176', '0.505936', '0.598124', '0.557857', '0.568072', '0.526279', '0.595389']
         : correct/total = [(8250, 14232), (7368, 14235), (7448, 14266), (8461, 14217), (8387, 14238), (7290, 14373), (8734, 14346), (7509, 14334), (8873, 14294), (7401, 14373), (8541, 14344), (7347, 14302), (7187, 14354), (7083, 14362), (7245, 14320), (8610, 14395), (8027, 14389), (8099, 14257), (7500, 14251), (8573, 14399)]
         : compromised: 0.5173, honest: 0.5603
Round 010: test acc mean=0.5544 ± 0.0479 | min=0.4932 max=0.6352
         : test loss mean=0.8529 ± 0.3966
         : individual accs = ['0.597878', '0.615525', '0.550820', '0.581839', '0.538980', '0.498156', '0.585111', '0.527208', '0.588499', '0.618312', '0.528862', '0.496574', '0.497144', '0.493176', '0.493645', '0.583814', '0.508444', '0.528582', '0.620027', '0.635183']
         : correct/total = [(8509, 14232), (8762, 14235), (7858, 14266), (8272, 14217), (7674, 14238), (7160, 14373), (8394, 14346), (7557, 14334), (8412, 14294), (8887, 14373), (7586, 14344), (7102, 14302), (7136, 14354), (7083, 14362), (7069, 14320), (8404, 14395), (7316, 14389), (7536, 14257), (8836, 14251), (9146, 14399)]
         : compromised: 0.5043, honest: 0.5669

=== FINAL RESULTS ===
Dataset: sent140, Nodes: 20, Graph: erdos, Aggregation: d-fedavg
Attack: backdoor, 20.0% compromised
Final accuracy - Compromised: 0.5043, Honest: 0.5669
Overall test accuracy: mean=0.5544 ± 0.0479

=== BACKDOOR ATTACK SUCCESS RATE (ASR) ===
Target label: 1
Trigger size: 3x3
Overall ASR: 0.5485 ± 0.3512
Honest nodes ASR: 0.6114 ± 0.3077
Compromised nodes ASR: 0.2967 ± 0.3984
Note: Higher ASR indicates more successful backdoor attack
