Device: cuda
Seed: 987654321
Loading 1 LEAF Sent140 train files...
LEAF Sent140 train: 254555 users, 908652 samples
Building vocabulary (max_size=10000)...
Vocabulary size: 10000
Loading 1 LEAF Sent140 test files...
LEAF Sent140 test: 254555 users, 286281 samples
Found 254555 train users, 254555 test users, 254555 common users
User sample counts range: 494 (max) to 1 (min)
Distributed ALL 254555 users across 20 clients
Users per client: 12727 (with 15 clients getting +1 user)
Train partition sizes: [44353, 44290, 44657, 44907, 44696, 45843, 45801, 45619, 45069, 45639, 45821, 45311, 45779, 46056, 45625, 45984, 46428, 44737, 45540, 46497]
Test partition sizes: [14232, 14235, 14266, 14217, 14238, 14373, 14346, 14334, 14294, 14373, 14344, 14302, 14354, 14362, 14320, 14395, 14389, 14257, 14251, 14399]
  Client 0: 44353 train samples, 2 unique classes
  Client 1: 44290 train samples, 2 unique classes
  Client 2: 44657 train samples, 2 unique classes
  Client 3: 44907 train samples, 2 unique classes
  Client 4: 44696 train samples, 2 unique classes
  Client 5: 45843 train samples, 2 unique classes
  Client 6: 45801 train samples, 2 unique classes
  Client 7: 45619 train samples, 2 unique classes
  Client 8: 45069 train samples, 2 unique classes
  Client 9: 45639 train samples, 2 unique classes
  Client 10: 45821 train samples, 2 unique classes
  Client 11: 45311 train samples, 2 unique classes
  Client 12: 45779 train samples, 2 unique classes
  Client 13: 46056 train samples, 2 unique classes
  Client 14: 45625 train samples, 2 unique classes
  Client 15: 45984 train samples, 2 unique classes
  Client 16: 46428 train samples, 2 unique classes
  Client 17: 44737 train samples, 2 unique classes
  Client 18: 45540 train samples, 2 unique classes
  Client 19: 46497 train samples, 2 unique classes
Will sample 4500 samples per client per epoch
Graph: ring, nodes: 20, edges: 20
Degree statistics: avg=2.00, min=2, max=2
Attack: Compromised 8/20 nodes: [1, 5, 11, 12, 13, 14, 17, 18]
Attack type: gaussian, lambda: 1.0
Model variant: baseline
Model parameters: 1,174,986
UBAR ALGORITHM (Two-Stage Byzantine-resilient)
  - Model dimension: 1,174,986 parameters
  - Rho parameter: 0.6
  - Stage 1: Distance-based filtering (select 60% closest neighbors)
  - Stage 2: Performance-based selection (loss comparison)
  - Complexity: O(deg(i)×d + deg(i)×inference)
Initial test acc across nodes: mean=0.4965 ± 0.0152
Round 001: test acc mean=0.5280 ± 0.0152 | min=0.5050 max=0.5627
         : test loss mean=103.9583 ± 310.5201
         : individual accs = ['0.548974', '0.523147', '0.532174', '0.515017', '0.517980', '0.517846', '0.562666', '0.553858', '0.511613', '0.526473', '0.515965', '0.533562', '0.513097', '0.505013', '0.524860', '0.525669', '0.513239', '0.542050', '0.533226', '0.543649']
         : correct/total = [(7813, 14232), (7447, 14235), (7592, 14266), (7322, 14217), (7375, 14238), (7443, 14373), (8072, 14346), (7939, 14334), (7313, 14294), (7567, 14373), (7401, 14344), (7631, 14302), (7365, 14354), (7253, 14362), (7516, 14320), (7567, 14395), (7385, 14389), (7728, 14257), (7599, 14251), (7828, 14399)]
         : compromised: 0.5241, honest: 0.5306
         : ubar stats = ['Node 0: s1=0.500, s2=1.000', 'Node 1: s1=0.500, s2=1.000', 'Node 2: s1=0.500, s2=1.000']...
Round 002: test acc mean=0.5625 ± 0.0281 | min=0.5036 max=0.6111
         : test loss mean=138.5426 ± 432.9703
         : individual accs = ['0.590289', '0.561363', '0.532455', '0.560948', '0.560191', '0.555277', '0.611111', '0.607995', '0.576046', '0.583107', '0.585959', '0.550622', '0.503623', '0.509748', '0.530936', '0.559778', '0.557579', '0.548923', '0.574977', '0.588860']
         : correct/total = [(8401, 14232), (7991, 14235), (7596, 14266), (7975, 14217), (7976, 14238), (7981, 14373), (8767, 14346), (8715, 14334), (8234, 14294), (8381, 14373), (8405, 14344), (7875, 14302), (7229, 14354), (7321, 14362), (7603, 14320), (8058, 14395), (8023, 14389), (7826, 14257), (8194, 14251), (8479, 14399)]
         : compromised: 0.5419, honest: 0.5762
         : ubar stats = ['Node 0: s1=0.500, s2=1.000', 'Node 1: s1=0.500, s2=1.000', 'Node 2: s1=0.500, s2=1.000']...
Round 003: test acc mean=0.5844 ± 0.0334 | min=0.4942 max=0.6159
         : test loss mean=83.3748 ± 248.1199
         : individual accs = ['0.614250', '0.605479', '0.575564', '0.602518', '0.599593', '0.596326', '0.614527', '0.615948', '0.606408', '0.593752', '0.598229', '0.568452', '0.505852', '0.494151', '0.552584', '0.581869', '0.576760', '0.564004', '0.606063', '0.615529']
         : correct/total = [(8742, 14232), (8619, 14235), (8211, 14266), (8566, 14217), (8537, 14238), (8571, 14373), (8816, 14346), (8829, 14334), (8668, 14294), (8534, 14373), (8581, 14344), (8130, 14302), (7261, 14354), (7097, 14362), (7913, 14320), (8376, 14395), (8299, 14389), (8041, 14257), (8637, 14251), (8863, 14399)]
         : compromised: 0.5616, honest: 0.5996
         : ubar stats = ['Node 0: s1=0.500, s2=1.000', 'Node 1: s1=0.500, s2=1.000', 'Node 2: s1=0.500, s2=1.000']...
Round 004: test acc mean=0.6038 ± 0.0345 | min=0.5037 max=0.6309
         : test loss mean=181.0465 ± 595.1899
         : individual accs = ['0.624508', '0.622620', '0.612435', '0.616586', '0.611392', '0.628818', '0.625331', '0.624459', '0.620750', '0.619495', '0.617331', '0.604880', '0.503692', '0.509261', '0.586941', '0.599236', '0.598582', '0.593673', '0.624307', '0.630877']
         : correct/total = [(8888, 14232), (8863, 14235), (8737, 14266), (8766, 14217), (8705, 14238), (9038, 14373), (8971, 14346), (8951, 14334), (8873, 14294), (8904, 14373), (8855, 14344), (8651, 14302), (7230, 14354), (7314, 14362), (8405, 14320), (8626, 14395), (8613, 14389), (8464, 14257), (8897, 14251), (9084, 14399)]
         : compromised: 0.5843, honest: 0.6167
         : ubar stats = ['Node 0: s1=0.500, s2=1.000', 'Node 1: s1=0.500, s2=1.000', 'Node 2: s1=0.500, s2=1.000']...
Round 005: test acc mean=0.6122 ± 0.0364 | min=0.5003 max=0.6382
         : test loss mean=115.6602 ± 347.1023
         : individual accs = ['0.628302', '0.629996', '0.620917', '0.630794', '0.630707', '0.638211', '0.634602', '0.633040', '0.627256', '0.625687', '0.622490', '0.613271', '0.500348', '0.513926', '0.603561', '0.613824', '0.609007', '0.606579', '0.630973', '0.630183']
         : correct/total = [(8942, 14232), (8968, 14235), (8858, 14266), (8968, 14217), (8980, 14238), (9173, 14373), (9104, 14346), (9074, 14334), (8966, 14294), (8993, 14373), (8929, 14344), (8771, 14302), (7182, 14354), (7381, 14362), (8643, 14320), (8836, 14395), (8763, 14389), (8648, 14257), (8992, 14251), (9074, 14399)]
         : compromised: 0.5921, honest: 0.6256
         : ubar stats = ['Node 0: s1=0.500, s2=1.000', 'Node 1: s1=0.500, s2=1.000', 'Node 2: s1=0.500, s2=1.000']...
Round 006: test acc mean=0.6146 ± 0.0436 | min=0.4872 max=0.6383
         : test loss mean=128.6418 ± 384.0284
         : individual accs = ['0.634556', '0.637935', '0.634165', '0.638039', '0.635693', '0.638350', '0.637321', '0.635831', '0.627886', '0.632575', '0.626534', '0.628863', '0.488644', '0.487188', '0.601676', '0.613268', '0.608312', '0.612892', '0.635394', '0.637128']
         : correct/total = [(9031, 14232), (9081, 14235), (9047, 14266), (9071, 14217), (9051, 14238), (9175, 14373), (9143, 14346), (9114, 14334), (8975, 14294), (9092, 14373), (8987, 14344), (8994, 14302), (7014, 14354), (6997, 14362), (8616, 14320), (8828, 14395), (8753, 14389), (8738, 14257), (9055, 14251), (9174, 14399)]
         : compromised: 0.5914, honest: 0.6301
         : ubar stats = ['Node 0: s1=0.500, s2=1.000', 'Node 1: s1=0.500, s2=1.000', 'Node 2: s1=0.500, s2=1.000']...
Round 007: test acc mean=0.6226 ± 0.0396 | min=0.5032 max=0.6461
         : test loss mean=100.1288 ± 307.6350
         : individual accs = ['0.643971', '0.636108', '0.636899', '0.646128', '0.643700', '0.640507', '0.638575', '0.632831', '0.629005', '0.642107', '0.636433', '0.630751', '0.503205', '0.508843', '0.620182', '0.629802', '0.622698', '0.621449', '0.643744', '0.645045']
         : correct/total = [(9165, 14232), (9055, 14235), (9086, 14266), (9186, 14217), (9165, 14238), (9206, 14373), (9161, 14346), (9071, 14334), (8991, 14294), (9229, 14373), (9129, 14344), (9021, 14302), (7223, 14354), (7308, 14362), (8881, 14320), (9066, 14395), (8960, 14389), (8860, 14257), (9174, 14251), (9288, 14399)]
         : compromised: 0.6006, honest: 0.6373
         : ubar stats = ['Node 0: s1=0.500, s2=1.000', 'Node 1: s1=0.500, s2=1.000', 'Node 2: s1=0.500, s2=1.000']...
Round 008: test acc mean=0.6254 ± 0.0436 | min=0.4923 max=0.6467
         : test loss mean=125.2256 ± 373.8874
         : individual accs = ['0.644674', '0.638145', '0.643067', '0.646058', '0.643840', '0.640646', '0.642618', '0.639319', '0.642927', '0.642942', '0.636015', '0.637044', '0.492337', '0.498538', '0.631355', '0.636124', '0.630134', '0.628183', '0.646691', '0.646642']
         : correct/total = [(9175, 14232), (9084, 14235), (9174, 14266), (9185, 14217), (9167, 14238), (9208, 14373), (9219, 14346), (9164, 14334), (9190, 14294), (9241, 14373), (9123, 14344), (9111, 14302), (7067, 14354), (7160, 14362), (9041, 14320), (9157, 14395), (9067, 14389), (8956, 14257), (9216, 14251), (9311, 14399)]
         : compromised: 0.6016, honest: 0.6412
         : ubar stats = ['Node 0: s1=0.500, s2=1.000', 'Node 1: s1=0.500, s2=1.000', 'Node 2: s1=0.500, s2=1.000']...
Round 009: test acc mean=0.6277 ± 0.0450 | min=0.4856 max=0.6527
         : test loss mean=95.1817 ± 291.3743
         : individual accs = ['0.648187', '0.648051', '0.645311', '0.643596', '0.646018', '0.645098', '0.644431', '0.643226', '0.645236', '0.641689', '0.634969', '0.637533', '0.485579', '0.502019', '0.631913', '0.641751', '0.637223', '0.633022', '0.645709', '0.652684']
         : correct/total = [(9225, 14232), (9225, 14235), (9206, 14266), (9150, 14217), (9198, 14238), (9272, 14373), (9245, 14346), (9220, 14334), (9223, 14294), (9223, 14373), (9108, 14344), (9118, 14302), (6970, 14354), (7210, 14362), (9049, 14320), (9238, 14395), (9169, 14389), (9025, 14257), (9202, 14251), (9398, 14399)]
         : compromised: 0.6036, honest: 0.6437
         : ubar stats = ['Node 0: s1=0.500, s2=1.000', 'Node 1: s1=0.500, s2=1.000', 'Node 2: s1=0.500, s2=1.000']...
Round 010: test acc mean=0.6315 ± 0.0449 | min=0.4974 max=0.6532
         : test loss mean=109.7336 ± 327.3200
         : individual accs = ['0.651279', '0.653249', '0.646152', '0.651544', '0.652269', '0.645307', '0.646243', '0.646644', '0.650553', '0.645307', '0.642220', '0.640190', '0.497353', '0.497633', '0.640712', '0.645224', '0.639447', '0.639195', '0.648165', '0.651851']
         : correct/total = [(9269, 14232), (9299, 14235), (9218, 14266), (9263, 14217), (9287, 14238), (9275, 14373), (9271, 14346), (9269, 14334), (9299, 14294), (9275, 14373), (9212, 14344), (9156, 14302), (7139, 14354), (7147, 14362), (9175, 14320), (9288, 14395), (9201, 14389), (9113, 14257), (9237, 14251), (9386, 14399)]
         : compromised: 0.6077, honest: 0.6474
         : ubar stats = ['Node 0: s1=0.500, s2=1.000', 'Node 1: s1=0.500, s2=1.000', 'Node 2: s1=0.500, s2=1.000']...

=== FINAL RESULTS ===
Dataset: sent140, Nodes: 20, Graph: ring, Aggregation: ubar
Attack: gaussian, 40.0% compromised
Final accuracy - Compromised: 0.6077, Honest: 0.6474
Overall test accuracy: mean=0.6315 ± 0.0449

=== UBAR SUMMARY ===
Node 0: stage1=0.500, stage2=1.000, overall=0.500
Node 1: stage1=0.500, stage2=1.000, overall=0.500
Node 2: stage1=0.500, stage2=1.000, overall=0.500
Node 3: stage1=0.500, stage2=1.000, overall=0.500
Node 4: stage1=0.500, stage2=1.000, overall=0.500
Node 5: stage1=0.500, stage2=1.000, overall=0.500
Node 6: stage1=0.500, stage2=1.000, overall=0.500
Node 7: stage1=0.500, stage2=1.000, overall=0.500
Node 8: stage1=0.500, stage2=1.000, overall=0.500
Node 9: stage1=0.500, stage2=1.000, overall=0.500
Node 10: stage1=0.500, stage2=1.000, overall=0.500
Node 11: stage1=0.500, stage2=1.000, overall=0.500
Node 12: stage1=0.500, stage2=1.000, overall=0.500
Node 13: stage1=0.500, stage2=1.000, overall=0.500
Node 14: stage1=0.500, stage2=1.000, overall=0.500
Node 15: stage1=0.500, stage2=1.000, overall=0.500
Node 16: stage1=0.500, stage2=1.000, overall=0.500
Node 17: stage1=0.500, stage2=1.000, overall=0.500
Node 18: stage1=0.500, stage2=1.000, overall=0.500
Node 19: stage1=0.500, stage2=1.000, overall=0.500

=== PARALLEL EXECUTION TIME (realistic for distributed system) ===
  COMMUNICATION (max across nodes):
    - Full model transfer: 0.000s (0.1%)
  COMPUTATION (max across nodes):
    - Distance computation: 0.021s (49.6%)
    - Loss computation: 0.018s (41.7%)
    - Aggregation: 0.004s (8.7%)
  TOTALS:
    - Total computation: 0.042s (99.9%)
    - Total communication: 0.000s (0.1%)
    - Total parallel time: 0.042s

=== PER-NODE AVERAGE TIME ===
  - Distance computation: 0.009s
  - Loss computation: 0.009s
  - Aggregation: 0.003s
  - Model transfer: 0.000s
  - Total per node: 0.022s

=== TOTAL COMPUTATIONAL WORK (sum across all nodes) ===
  - Total distance computation: 0.180s
  - Total loss computation: 0.186s
  - Total aggregation: 0.065s
  - Total model transfer: 0.000s
  - Grand total: 0.431s
  - Mean Stage 1 acceptance rate: 0.500
  - Mean Stage 2 acceptance rate: 1.000
  - Overall acceptance rate: 0.500

UBAR Algorithm Properties:
  - Model dimension: 1,174,986
  - Rho parameter: 0.6
  - Two-stage approach: Distance filtering + loss evaluation
  - Stage 1 selects: 60% of neighbors
  - Stage 2 uses: Training sample loss comparison
  - Theoretical complexity: O(deg(i)×d + deg(i)×inference)
  - Approach: UBAR paper implementation
