Device: cuda
Seed: 987654321
Loading 1 LEAF Sent140 train files...
LEAF Sent140 train: 254555 users, 908652 samples
Building vocabulary (max_size=10000)...
Vocabulary size: 10000
Loading 1 LEAF Sent140 test files...
LEAF Sent140 test: 254555 users, 286281 samples
Found 254555 train users, 254555 test users, 254555 common users
User sample counts range: 494 (max) to 1 (min)
Distributed ALL 254555 users across 20 clients
Users per client: 12727 (with 15 clients getting +1 user)
Train partition sizes: [44353, 44290, 44657, 44907, 44696, 45843, 45801, 45619, 45069, 45639, 45821, 45311, 45779, 46056, 45625, 45984, 46428, 44737, 45540, 46497]
Test partition sizes: [14232, 14235, 14266, 14217, 14238, 14373, 14346, 14334, 14294, 14373, 14344, 14302, 14354, 14362, 14320, 14395, 14389, 14257, 14251, 14399]
  Client 0: 44353 train samples, 2 unique classes
  Client 1: 44290 train samples, 2 unique classes
  Client 2: 44657 train samples, 2 unique classes
  Client 3: 44907 train samples, 2 unique classes
  Client 4: 44696 train samples, 2 unique classes
  Client 5: 45843 train samples, 2 unique classes
  Client 6: 45801 train samples, 2 unique classes
  Client 7: 45619 train samples, 2 unique classes
  Client 8: 45069 train samples, 2 unique classes
  Client 9: 45639 train samples, 2 unique classes
  Client 10: 45821 train samples, 2 unique classes
  Client 11: 45311 train samples, 2 unique classes
  Client 12: 45779 train samples, 2 unique classes
  Client 13: 46056 train samples, 2 unique classes
  Client 14: 45625 train samples, 2 unique classes
  Client 15: 45984 train samples, 2 unique classes
  Client 16: 46428 train samples, 2 unique classes
  Client 17: 44737 train samples, 2 unique classes
  Client 18: 45540 train samples, 2 unique classes
  Client 19: 46497 train samples, 2 unique classes
Will sample 4500 samples per client per epoch
Graph: fully, nodes: 20, edges: 190
Degree statistics: avg=19.00, min=19, max=19
Attack: Compromised 8/20 nodes: [1, 5, 11, 12, 13, 14, 17, 18]
Attack type: directed_deviation, lambda: 1.0
Model variant: baseline
Model parameters: 1,174,986
Initial test acc across nodes: mean=0.4953 ± 0.0174
Round 001: test acc mean=0.5000 ± 0.0058 | min=0.4870 max=0.5077
         : test loss mean=25.0444 ± 8.3757
         : individual accs = ['0.506464', '0.487039', '0.492990', '0.499121', '0.502669', '0.493077', '0.500418', '0.492814', '0.500979', '0.507062', '0.501394', '0.503985', '0.507733', '0.496449', '0.495670', '0.506704', '0.507540', '0.497861', '0.495474', '0.505105']
         : correct/total = [(7208, 14232), (6933, 14235), (7033, 14266), (7096, 14217), (7157, 14238), (7087, 14373), (7179, 14346), (7064, 14334), (7161, 14294), (7288, 14373), (7192, 14344), (7208, 14302), (7288, 14354), (7130, 14362), (7098, 14320), (7294, 14395), (7303, 14389), (7098, 14257), (7061, 14251), (7273, 14399)]
         : compromised: 0.4972, honest: 0.5019
Round 002: test acc mean=0.5053 ± 0.0047 | min=0.4980 max=0.5154
         : test loss mean=1.0439 ± 0.0085
         : individual accs = ['0.502178', '0.514436', '0.510444', '0.515439', '0.506181', '0.502887', '0.498118', '0.505093', '0.501119', '0.510471', '0.501952', '0.506642', '0.498049', '0.499513', '0.502933', '0.505940', '0.507610', '0.505716', '0.507964', '0.503785']
         : correct/total = [(7147, 14232), (7323, 14235), (7282, 14266), (7328, 14217), (7207, 14238), (7228, 14373), (7146, 14346), (7240, 14334), (7163, 14294), (7337, 14373), (7200, 14344), (7246, 14302), (7149, 14354), (7174, 14362), (7202, 14320), (7283, 14395), (7304, 14389), (7210, 14257), (7239, 14251), (7254, 14399)]
         : compromised: 0.5048, honest: 0.5057
Round 003: test acc mean=0.5081 ± 0.0034 | min=0.5003 max=0.5145
         : test loss mean=0.6950 ± 0.0007
         : individual accs = ['0.509275', '0.500738', '0.507010', '0.507983', '0.509763', '0.506714', '0.508434', '0.507674', '0.508395', '0.505253', '0.500349', '0.506293', '0.514491', '0.513577', '0.508031', '0.510872', '0.511085', '0.509644', '0.509719', '0.507535']
         : correct/total = [(7248, 14232), (7128, 14235), (7233, 14266), (7222, 14217), (7258, 14238), (7283, 14373), (7294, 14346), (7277, 14334), (7267, 14294), (7262, 14373), (7177, 14344), (7241, 14302), (7385, 14354), (7376, 14362), (7275, 14320), (7354, 14395), (7354, 14389), (7266, 14257), (7264, 14251), (7308, 14399)]
         : compromised: 0.5087, honest: 0.5078
Round 004: test acc mean=0.4905 ± 0.0054 | min=0.4800 max=0.5054
         : test loss mean=0.7589 ± 0.0088
         : individual accs = ['0.479975', '0.482684', '0.481915', '0.491524', '0.505408', '0.491686', '0.487732', '0.497070', '0.486428', '0.493495', '0.490937', '0.489023', '0.491292', '0.494360', '0.488198', '0.494269', '0.491278', '0.491197', '0.492457', '0.488437']
         : correct/total = [(6831, 14232), (6871, 14235), (6875, 14266), (6988, 14217), (7196, 14238), (7067, 14373), (6997, 14346), (7125, 14334), (6953, 14294), (7093, 14373), (7042, 14344), (6994, 14302), (7052, 14354), (7100, 14362), (6991, 14320), (7115, 14395), (7069, 14389), (7003, 14257), (7018, 14251), (7033, 14399)]
         : compromised: 0.4901, honest: 0.4907
Round 005: test acc mean=0.5052 ± 0.0055 | min=0.4928 max=0.5130
         : test loss mean=0.6948 ± 0.0006
         : individual accs = ['0.503583', '0.495680', '0.500701', '0.501723', '0.503371', '0.508245', '0.512129', '0.504814', '0.508675', '0.498087', '0.510666', '0.500350', '0.508430', '0.508425', '0.492807', '0.507815', '0.508305', '0.511608', '0.505228', '0.512952']
         : correct/total = [(7167, 14232), (7056, 14235), (7143, 14266), (7133, 14217), (7167, 14238), (7305, 14373), (7347, 14346), (7236, 14334), (7271, 14294), (7159, 14373), (7325, 14344), (7156, 14302), (7298, 14354), (7302, 14362), (7057, 14320), (7310, 14395), (7314, 14389), (7294, 14257), (7200, 14251), (7386, 14399)]
         : compromised: 0.5038, honest: 0.5061
Round 006: test acc mean=0.5086 ± 0.0047 | min=0.5013 max=0.5174
         : test loss mean=0.8975 ± 0.0086
         : individual accs = ['0.511734', '0.501721', '0.509183', '0.506295', '0.509341', '0.512280', '0.515405', '0.501535', '0.505037', '0.503096', '0.512409', '0.501259', '0.514282', '0.512812', '0.505517', '0.511289', '0.505247', '0.517360', '0.507333', '0.509758']
         : correct/total = [(7283, 14232), (7142, 14235), (7264, 14266), (7198, 14217), (7252, 14238), (7363, 14373), (7394, 14346), (7189, 14334), (7219, 14294), (7231, 14373), (7350, 14344), (7169, 14302), (7382, 14354), (7365, 14362), (7239, 14320), (7360, 14395), (7270, 14389), (7376, 14257), (7230, 14251), (7340, 14399)]
         : compromised: 0.5091, honest: 0.5084
Round 007: test acc mean=0.5087 ± 0.0045 | min=0.5016 max=0.5176
         : test loss mean=0.7054 ± 0.0021
         : individual accs = ['0.511664', '0.502564', '0.501612', '0.507913', '0.505900', '0.511097', '0.511641', '0.515836', '0.513292', '0.517637', '0.503207', '0.504894', '0.510589', '0.506545', '0.513757', '0.508857', '0.510529', '0.506839', '0.502631', '0.506771']
         : correct/total = [(7282, 14232), (7154, 14235), (7156, 14266), (7221, 14217), (7203, 14238), (7346, 14373), (7340, 14346), (7394, 14334), (7337, 14294), (7440, 14373), (7218, 14344), (7221, 14302), (7329, 14354), (7275, 14362), (7357, 14320), (7325, 14395), (7346, 14389), (7226, 14257), (7163, 14251), (7297, 14399)]
         : compromised: 0.5074, honest: 0.5096
Round 008: test acc mean=0.4974 ± 0.0049 | min=0.4854 max=0.5061
         : test loss mean=0.8679 ± 0.0045
         : individual accs = ['0.495995', '0.485353', '0.490747', '0.489836', '0.497261', '0.499339', '0.501882', '0.494349', '0.500140', '0.496208', '0.498745', '0.493078', '0.503971', '0.506127', '0.497207', '0.501007', '0.498228', '0.498632', '0.497649', '0.502396']
         : correct/total = [(7059, 14232), (6909, 14235), (7001, 14266), (6964, 14217), (7080, 14238), (7177, 14373), (7200, 14346), (7086, 14334), (7149, 14294), (7132, 14373), (7154, 14344), (7052, 14302), (7234, 14354), (7269, 14362), (7120, 14320), (7212, 14395), (7169, 14389), (7109, 14257), (7092, 14251), (7234, 14399)]
         : compromised: 0.4977, honest: 0.4972
Round 009: test acc mean=0.5010 ± 0.0062 | min=0.4901 max=0.5136
         : test loss mean=0.6948 ± 0.0006
         : individual accs = ['0.497189', '0.490130', '0.496986', '0.490328', '0.496488', '0.503861', '0.499582', '0.503488', '0.496782', '0.496417', '0.506414', '0.506782', '0.511634', '0.513647', '0.494553', '0.504967', '0.504135', '0.500456', '0.504877', '0.501285']
         : correct/total = [(7076, 14232), (6977, 14235), (7090, 14266), (6971, 14217), (7069, 14238), (7242, 14373), (7167, 14346), (7217, 14334), (7101, 14294), (7135, 14373), (7264, 14344), (7248, 14302), (7344, 14354), (7377, 14362), (7082, 14320), (7269, 14395), (7254, 14389), (7135, 14257), (7195, 14251), (7218, 14399)]
         : compromised: 0.5032, honest: 0.4995
Round 010: test acc mean=0.5032 ± 0.0057 | min=0.4933 max=0.5161
         : test loss mean=0.7668 ± 0.0049
         : individual accs = ['0.506745', '0.514787', '0.510585', '0.516143', '0.504284', '0.500174', '0.497491', '0.503698', '0.496782', '0.503166', '0.496723', '0.503216', '0.500418', '0.493316', '0.504120', '0.499548', '0.507262', '0.504103', '0.500947', '0.500451']
         : correct/total = [(7212, 14232), (7328, 14235), (7284, 14266), (7338, 14217), (7180, 14238), (7189, 14373), (7137, 14346), (7220, 14334), (7101, 14294), (7232, 14373), (7125, 14344), (7197, 14302), (7183, 14354), (7085, 14362), (7219, 14320), (7191, 14395), (7299, 14389), (7187, 14257), (7139, 14251), (7206, 14399)]
         : compromised: 0.5026, honest: 0.5036

=== FINAL RESULTS ===
Dataset: sent140, Nodes: 20, Graph: fully, Aggregation: krum
Attack: directed_deviation, 40.0% compromised
Final accuracy - Compromised: 0.5026, Honest: 0.5036
Overall test accuracy: mean=0.5032 ± 0.0057
