Device: cuda
Seed: 987654321
Loading 1 LEAF Sent140 train files...
LEAF Sent140 train: 254555 users, 908652 samples
Building vocabulary (max_size=10000)...
Vocabulary size: 10000
Loading 1 LEAF Sent140 test files...
LEAF Sent140 test: 254555 users, 286281 samples
Found 254555 train users, 254555 test users, 254555 common users
User sample counts range: 494 (max) to 1 (min)
Distributed ALL 254555 users across 20 clients
Users per client: 12727 (with 15 clients getting +1 user)
Train partition sizes: [44353, 44290, 44657, 44907, 44696, 45843, 45801, 45619, 45069, 45639, 45821, 45311, 45779, 46056, 45625, 45984, 46428, 44737, 45540, 46497]
Test partition sizes: [14232, 14235, 14266, 14217, 14238, 14373, 14346, 14334, 14294, 14373, 14344, 14302, 14354, 14362, 14320, 14395, 14389, 14257, 14251, 14399]
  Client 0: 44353 train samples, 2 unique classes
  Client 1: 44290 train samples, 2 unique classes
  Client 2: 44657 train samples, 2 unique classes
  Client 3: 44907 train samples, 2 unique classes
  Client 4: 44696 train samples, 2 unique classes
  Client 5: 45843 train samples, 2 unique classes
  Client 6: 45801 train samples, 2 unique classes
  Client 7: 45619 train samples, 2 unique classes
  Client 8: 45069 train samples, 2 unique classes
  Client 9: 45639 train samples, 2 unique classes
  Client 10: 45821 train samples, 2 unique classes
  Client 11: 45311 train samples, 2 unique classes
  Client 12: 45779 train samples, 2 unique classes
  Client 13: 46056 train samples, 2 unique classes
  Client 14: 45625 train samples, 2 unique classes
  Client 15: 45984 train samples, 2 unique classes
  Client 16: 46428 train samples, 2 unique classes
  Client 17: 44737 train samples, 2 unique classes
  Client 18: 45540 train samples, 2 unique classes
  Client 19: 46497 train samples, 2 unique classes
Will sample 4500 samples per client per epoch
Graph: ring, nodes: 20, edges: 20
Degree statistics: avg=2.00, min=2, max=2
Attack: Compromised 16/20 nodes: [1, 2, 3, 5, 6, 8, 9, 10, 11, 12, 13, 14, 15, 17, 18, 19]
Attack type: krum, lambda: 1.0
Model variant: baseline
Model parameters: 1,174,986
BALANCE algorithm:
Balance Config: BALANCEConfig(gamma=2, kappa=1, alpha=0.5, min_neighbors=1)
  - Model dimension: 1,174,986 parameters
  - Complexity: O(N×d) = O(20×1,174,986)
Initial test acc across nodes: mean=0.4965 ± 0.0152
Round 001: test acc mean=0.5010 ± 0.0075 | min=0.4891 max=0.5167
         : test loss mean=4.1688 ± 2.3427
         : individual accs = ['0.503232', '0.511907', '0.494392', '0.501231', '0.489114', '0.502679', '0.494633', '0.492535', '0.516650', '0.513602', '0.504671', '0.509369', '0.502578', '0.495753', '0.493994', '0.494825', '0.491556', '0.503823', '0.500947', '0.503229']
         : correct/total = [(7162, 14232), (7287, 14235), (7053, 14266), (7126, 14217), (6964, 14238), (7225, 14373), (7096, 14346), (7060, 14334), (7385, 14294), (7382, 14373), (7239, 14344), (7285, 14302), (7214, 14354), (7120, 14362), (7074, 14320), (7123, 14395), (7073, 14389), (7183, 14257), (7139, 14251), (7246, 14399)]
         : compromised: 0.5028, honest: 0.4941
Round 002: test acc mean=0.5006 ± 0.0055 | min=0.4906 max=0.5125
         : test loss mean=4.3021 ± 1.7064
         : individual accs = ['0.504497', '0.496101', '0.501682', '0.499613', '0.509271', '0.508940', '0.500279', '0.498814', '0.496922', '0.512489', '0.493238', '0.505594', '0.500975', '0.490600', '0.496229', '0.497395', '0.499757', '0.500035', '0.505649', '0.494479']
         : correct/total = [(7180, 14232), (7062, 14235), (7157, 14266), (7103, 14217), (7251, 14238), (7315, 14373), (7177, 14346), (7150, 14334), (7103, 14294), (7366, 14373), (7075, 14344), (7231, 14302), (7191, 14354), (7046, 14362), (7106, 14320), (7160, 14395), (7191, 14389), (7129, 14257), (7206, 14251), (7120, 14399)]
         : compromised: 0.5000, honest: 0.5031
Round 003: test acc mean=0.4971 ± 0.0087 | min=0.4840 max=0.5172
         : test loss mean=1.9715 ± 0.5456
         : individual accs = ['0.488055', '0.504601', '0.490817', '0.497433', '0.501334', '0.500244', '0.517217', '0.484024', '0.500000', '0.493008', '0.485639', '0.486785', '0.488505', '0.512812', '0.494972', '0.506078', '0.495795', '0.496949', '0.493158', '0.504688']
         : correct/total = [(6946, 14232), (7183, 14235), (7002, 14266), (7072, 14217), (7138, 14238), (7190, 14373), (7420, 14346), (6938, 14334), (7147, 14294), (7086, 14373), (6966, 14344), (6962, 14302), (7012, 14354), (7365, 14362), (7088, 14320), (7285, 14395), (7134, 14389), (7085, 14257), (7028, 14251), (7267, 14399)]
         : compromised: 0.4983, honest: 0.4923
Round 004: test acc mean=0.5026 ± 0.0056 | min=0.4893 max=0.5107
         : test loss mean=2.6099 ± 1.0599
         : individual accs = ['0.502530', '0.508254', '0.509603', '0.509883', '0.498455', '0.503861', '0.505089', '0.495326', '0.505947', '0.507618', '0.510736', '0.501259', '0.496377', '0.489277', '0.499791', '0.503786', '0.497046', '0.498071', '0.507333', '0.500868']
         : correct/total = [(7152, 14232), (7235, 14235), (7270, 14266), (7249, 14217), (7097, 14238), (7242, 14373), (7246, 14346), (7100, 14334), (7232, 14294), (7296, 14373), (7326, 14344), (7169, 14302), (7125, 14354), (7027, 14362), (7157, 14320), (7252, 14395), (7152, 14389), (7101, 14257), (7230, 14251), (7212, 14399)]
         : compromised: 0.5036, honest: 0.4983
Round 005: test acc mean=0.4991 ± 0.0050 | min=0.4903 max=0.5060
         : test loss mean=1.3851 ± 0.2088
         : individual accs = ['0.497119', '0.505444', '0.490257', '0.502778', '0.497050', '0.504696', '0.505995', '0.496651', '0.494193', '0.492242', '0.503277', '0.494756', '0.501881', '0.505361', '0.492249', '0.503439', '0.497394', '0.493512', '0.500596', '0.503993']
         : correct/total = [(7075, 14232), (7195, 14235), (6994, 14266), (7148, 14217), (7077, 14238), (7254, 14373), (7259, 14346), (7119, 14334), (7064, 14294), (7075, 14373), (7219, 14344), (7076, 14302), (7204, 14354), (7258, 14362), (7049, 14320), (7247, 14395), (7157, 14389), (7036, 14257), (7134, 14251), (7257, 14399)]
         : compromised: 0.4997, honest: 0.4971
Round 006: test acc mean=0.5044 ± 0.0064 | min=0.4909 max=0.5191
         : test loss mean=2.4130 ± 0.9118
         : individual accs = ['0.502600', '0.509168', '0.513318', '0.503060', '0.511659', '0.509219', '0.502161', '0.503558', '0.497971', '0.501913', '0.503277', '0.508460', '0.502578', '0.500905', '0.519134', '0.493018', '0.504066', '0.490917', '0.509648', '0.502257']
         : correct/total = [(7153, 14232), (7248, 14235), (7323, 14266), (7152, 14217), (7285, 14238), (7319, 14373), (7204, 14346), (7218, 14334), (7118, 14294), (7214, 14373), (7219, 14344), (7272, 14302), (7214, 14354), (7194, 14362), (7434, 14320), (7097, 14395), (7253, 14389), (6999, 14257), (7263, 14251), (7232, 14399)]
         : compromised: 0.5042, honest: 0.5055
Round 007: test acc mean=0.5015 ± 0.0062 | min=0.4877 max=0.5166
         : test loss mean=1.1413 ± 0.2344
         : individual accs = ['0.499087', '0.503196', '0.496425', '0.497573', '0.502669', '0.516594', '0.504879', '0.495605', '0.502938', '0.487720', '0.501325', '0.495595', '0.506758', '0.497772', '0.499721', '0.505036', '0.499131', '0.502630', '0.501158', '0.513925']
         : correct/total = [(7103, 14232), (7163, 14235), (7082, 14266), (7074, 14217), (7157, 14238), (7425, 14373), (7243, 14346), (7104, 14334), (7189, 14294), (7010, 14373), (7191, 14344), (7088, 14302), (7274, 14354), (7149, 14362), (7156, 14320), (7270, 14395), (7182, 14389), (7166, 14257), (7142, 14251), (7400, 14399)]
         : compromised: 0.5021, honest: 0.4991
Round 008: test acc mean=0.5051 ± 0.0042 | min=0.4970 max=0.5127
         : test loss mean=3.0681 ± 0.7083
         : individual accs = ['0.511804', '0.509659', '0.503224', '0.503130', '0.506251', '0.499756', '0.510595', '0.507325', '0.501259', '0.508105', '0.503625', '0.505803', '0.512749', '0.499791', '0.501536', '0.503647', '0.504205', '0.497019', '0.509298', '0.503299']
         : correct/total = [(7284, 14232), (7255, 14235), (7179, 14266), (7153, 14217), (7208, 14238), (7183, 14373), (7325, 14346), (7272, 14334), (7165, 14294), (7303, 14373), (7224, 14344), (7234, 14302), (7360, 14354), (7178, 14362), (7182, 14320), (7250, 14395), (7255, 14389), (7086, 14257), (7258, 14251), (7247, 14399)]
         : compromised: 0.5045, honest: 0.5074
Round 009: test acc mean=0.5003 ± 0.0103 | min=0.4768 max=0.5211
         : test loss mean=1.2606 ± 0.5420
         : individual accs = ['0.497752', '0.511556', '0.500140', '0.503341', '0.505759', '0.490364', '0.505576', '0.502581', '0.498461', '0.488068', '0.505996', '0.521116', '0.479866', '0.476814', '0.502654', '0.504898', '0.513031', '0.500877', '0.494492', '0.501979']
         : correct/total = [(7084, 14232), (7282, 14235), (7135, 14266), (7156, 14217), (7201, 14238), (7048, 14373), (7253, 14346), (7204, 14334), (7125, 14294), (7015, 14373), (7258, 14344), (7453, 14302), (6888, 14354), (6848, 14362), (7198, 14320), (7268, 14395), (7382, 14389), (7141, 14257), (7047, 14251), (7228, 14399)]
         : compromised: 0.4991, honest: 0.5048
Round 010: test acc mean=0.5021 ± 0.0054 | min=0.4934 max=0.5152
         : test loss mean=3.8443 ± 0.7805
         : individual accs = ['0.495503', '0.506498', '0.507711', '0.505029', '0.503933', '0.493425', '0.501394', '0.499930', '0.496572', '0.503861', '0.497839', '0.506712', '0.505295', '0.495056', '0.497835', '0.515248', '0.504900', '0.496668', '0.507614', '0.501007']
         : correct/total = [(7052, 14232), (7210, 14235), (7243, 14266), (7180, 14217), (7175, 14238), (7092, 14373), (7193, 14346), (7166, 14334), (7098, 14294), (7242, 14373), (7141, 14344), (7247, 14302), (7253, 14354), (7110, 14362), (7129, 14320), (7417, 14395), (7265, 14389), (7081, 14257), (7234, 14251), (7214, 14399)]
         : compromised: 0.5024, honest: 0.5011

=== FINAL RESULTS ===
Dataset: sent140, Nodes: 20, Graph: ring, Aggregation: balance
Attack: krum, 80.0% compromised
Final accuracy - Compromised: 0.5024, Honest: 0.5011
Overall test accuracy: mean=0.5021 ± 0.0054

=== BALANCE SUMMARY ===
Node 0: acceptance=0.200
Node 1: acceptance=0.700
Node 2: acceptance=0.200
Node 3: acceptance=0.600
Node 4: acceptance=0.200
Node 5: acceptance=0.600
Node 6: acceptance=0.600
Node 7: acceptance=0.200
Node 8: acceptance=0.600
Node 9: acceptance=0.200
Node 10: acceptance=0.200
Node 11: acceptance=0.200
Node 12: acceptance=0.200
Node 13: acceptance=0.200
Node 14: acceptance=0.200
Node 15: acceptance=0.600
Node 16: acceptance=0.200
Node 17: acceptance=0.600
Node 18: acceptance=0.200
Node 19: acceptance=0.700

=== PARALLEL EXECUTION TIME (realistic for distributed system) ===
  COMMUNICATION (max across nodes):
    - Full model transfer: 0.000s (0.0%)
  COMPUTATION (max across nodes):
    - Filtering: 0.016s (59.7%)
    - Aggregation: 0.011s (40.3%)
  TOTALS:
    - Total computation: 0.026s (100.0%)
    - Total communication: 0.000s (0.0%)
    - Total parallel time: 0.026s

=== PER-NODE AVERAGE TIME ===
  - Filtering: 0.013s
  - Aggregation: 0.005s
  - Model transfer: 0.000s
  - Total per node: 0.018s

=== TOTAL COMPUTATIONAL WORK (sum across all nodes) ===
  - Total filtering: 0.259s
  - Total aggregation: 0.096s
  - Total model transfer: 0.000s
  - Grand total: 0.356s
  - Mean acceptance rate: 0.370

BALANCE Algorithm Properties:
  - Model dimension: 1,174,986
  - No compression: Full parameter comparison
  - Theoretical complexity: O(deg(i)×d)
  - Approach: Full parameter filtering + averaging
