Device: cuda
Seed: 987654321
Loading 1 LEAF Sent140 train files...
LEAF Sent140 train: 254555 users, 908652 samples
Building vocabulary (max_size=10000)...
Vocabulary size: 10000
Loading 1 LEAF Sent140 test files...
LEAF Sent140 test: 254555 users, 286281 samples
Found 254555 train users, 254555 test users, 254555 common users
User sample counts range: 494 (max) to 1 (min)
Distributed ALL 254555 users across 20 clients
Users per client: 12727 (with 15 clients getting +1 user)
Train partition sizes: [44353, 44290, 44657, 44907, 44696, 45843, 45801, 45619, 45069, 45639, 45821, 45311, 45779, 46056, 45625, 45984, 46428, 44737, 45540, 46497]
Test partition sizes: [14232, 14235, 14266, 14217, 14238, 14373, 14346, 14334, 14294, 14373, 14344, 14302, 14354, 14362, 14320, 14395, 14389, 14257, 14251, 14399]
  Client 0: 44353 train samples, 2 unique classes
  Client 1: 44290 train samples, 2 unique classes
  Client 2: 44657 train samples, 2 unique classes
  Client 3: 44907 train samples, 2 unique classes
  Client 4: 44696 train samples, 2 unique classes
  Client 5: 45843 train samples, 2 unique classes
  Client 6: 45801 train samples, 2 unique classes
  Client 7: 45619 train samples, 2 unique classes
  Client 8: 45069 train samples, 2 unique classes
  Client 9: 45639 train samples, 2 unique classes
  Client 10: 45821 train samples, 2 unique classes
  Client 11: 45311 train samples, 2 unique classes
  Client 12: 45779 train samples, 2 unique classes
  Client 13: 46056 train samples, 2 unique classes
  Client 14: 45625 train samples, 2 unique classes
  Client 15: 45984 train samples, 2 unique classes
  Client 16: 46428 train samples, 2 unique classes
  Client 17: 44737 train samples, 2 unique classes
  Client 18: 45540 train samples, 2 unique classes
  Client 19: 46497 train samples, 2 unique classes
Will sample 4500 samples per client per epoch
Graph: erdos, nodes: 20, edges: 48
Degree statistics: avg=4.80, min=2, max=7
Attack: Compromised 12/20 nodes: [1, 2, 3, 5, 8, 11, 12, 13, 14, 15, 17, 18]
Attack type: backdoor, lambda: 1.0
Backdoor target label: 1, trigger size: 3
Model variant: baseline
Model parameters: 1,174,986
BALANCE algorithm:
Balance Config: BALANCEConfig(gamma=2, kappa=1, alpha=0.5, min_neighbors=1)
  - Model dimension: 1,174,986 parameters
  - Complexity: O(N×d) = O(20×1,174,986)
Initial test acc across nodes: mean=0.4965 ± 0.0152
Backdoor attack: Created poisoned datasets for 12 compromised nodes
Round 001: test acc mean=0.4979 ± 0.0073 | min=0.4849 max=0.5127
         : test loss mean=24.0283 ± 20.3864
         : individual accs = ['0.493606', '0.502775', '0.484929', '0.500598', '0.505268', '0.495860', '0.491566', '0.503698', '0.505317', '0.488207', '0.487033', '0.494127', '0.498049', '0.506197', '0.503561', '0.497534', '0.512683', '0.504033', '0.491544', '0.492048']
         : correct/total = [(7025, 14232), (7157, 14235), (6918, 14266), (7117, 14217), (7194, 14238), (7127, 14373), (7052, 14346), (7220, 14334), (7223, 14294), (7017, 14373), (6986, 14344), (7067, 14302), (7149, 14354), (7270, 14362), (7211, 14320), (7162, 14395), (7377, 14389), (7186, 14257), (7005, 14251), (7085, 14399)]
         : compromised: 0.4987, honest: 0.4968
Round 002: test acc mean=0.4995 ± 0.0069 | min=0.4854 max=0.5145
         : test loss mean=901.3667 ± 751.4861
         : individual accs = ['0.506183', '0.503688', '0.498808', '0.507421', '0.496699', '0.495304', '0.495539', '0.504674', '0.514482', '0.488903', '0.493656', '0.505384', '0.508639', '0.485378', '0.495391', '0.497812', '0.501216', '0.492670', '0.499123', '0.498368']
         : correct/total = [(7204, 14232), (7170, 14235), (7116, 14266), (7214, 14217), (7072, 14238), (7119, 14373), (7109, 14346), (7234, 14334), (7354, 14294), (7027, 14373), (7081, 14344), (7228, 14302), (7301, 14354), (6971, 14362), (7094, 14320), (7166, 14395), (7212, 14389), (7024, 14257), (7113, 14251), (7176, 14399)]
         : compromised: 0.5003, honest: 0.4982
Round 003: test acc mean=0.5017 ± 0.0080 | min=0.4840 max=0.5208
         : test loss mean=55384.2693 ± 53376.3300
         : individual accs = ['0.502319', '0.491816', '0.498528', '0.493564', '0.505900', '0.497600', '0.502440', '0.520790', '0.499860', '0.507062', '0.506065', '0.501538', '0.497980', '0.518521', '0.496369', '0.500035', '0.500243', '0.506278', '0.483966', '0.503646']
         : correct/total = [(7149, 14232), (7001, 14235), (7112, 14266), (7017, 14217), (7203, 14238), (7152, 14373), (7208, 14346), (7465, 14334), (7145, 14294), (7288, 14373), (7259, 14344), (7173, 14302), (7148, 14354), (7447, 14362), (7108, 14320), (7198, 14395), (7198, 14389), (7218, 14257), (6897, 14251), (7252, 14399)]
         : compromised: 0.4988, honest: 0.5061
Round 004: test acc mean=0.4997 ± 0.0059 | min=0.4878 max=0.5112
         : test loss mean=7297706.1394 ± 6506787.2094
         : individual accs = ['0.501546', '0.495328', '0.487803', '0.503904', '0.502458', '0.506436', '0.500070', '0.496233', '0.498741', '0.505949', '0.511154', '0.492728', '0.496308', '0.505988', '0.492249', '0.491004', '0.496560', '0.504103', '0.502421', '0.502327']
         : correct/total = [(7138, 14232), (7051, 14235), (6959, 14266), (7164, 14217), (7154, 14238), (7279, 14373), (7174, 14346), (7113, 14334), (7129, 14294), (7272, 14373), (7332, 14344), (7047, 14302), (7124, 14354), (7267, 14362), (7049, 14320), (7068, 14395), (7145, 14389), (7187, 14257), (7160, 14251), (7233, 14399)]
         : compromised: 0.4981, honest: 0.5020
Round 005: test acc mean=0.5012 ± 0.0054 | min=0.4917 max=0.5100
         : test loss mean=387978299.9636 ± 321662912.0986
         : individual accs = ['0.506043', '0.491675', '0.499720', '0.505522', '0.505127', '0.497739', '0.502021', '0.499930', '0.502029', '0.506784', '0.508714', '0.493008', '0.496168', '0.509957', '0.506145', '0.492949', '0.500313', '0.493652', '0.502982', '0.503785']
         : correct/total = [(7202, 14232), (6999, 14235), (7129, 14266), (7187, 14217), (7192, 14238), (7154, 14373), (7202, 14346), (7166, 14334), (7176, 14294), (7284, 14373), (7297, 14344), (7051, 14302), (7122, 14354), (7324, 14362), (7248, 14320), (7096, 14395), (7199, 14389), (7038, 14257), (7168, 14251), (7254, 14399)]
         : compromised: 0.4993, honest: 0.5041
Round 006: test acc mean=0.5041 ± 0.0063 | min=0.4907 max=0.5156
         : test loss mean=29484882652.8642 ± 24419667302.7532
         : individual accs = ['0.510259', '0.490692', '0.499089', '0.509883', '0.505970', '0.505879', '0.505228', '0.504256', '0.507626', '0.494121', '0.515616', '0.502168', '0.497771', '0.505222', '0.515154', '0.500590', '0.505108', '0.498702', '0.509648', '0.499479']
         : correct/total = [(7262, 14232), (6985, 14235), (7120, 14266), (7249, 14217), (7204, 14238), (7271, 14373), (7248, 14346), (7228, 14334), (7256, 14294), (7102, 14373), (7396, 14344), (7182, 14302), (7145, 14354), (7256, 14362), (7377, 14320), (7206, 14395), (7268, 14389), (7110, 14257), (7263, 14251), (7192, 14399)]
         : compromised: 0.5035, honest: 0.5050
Round 007: test acc mean=0.5047 ± 0.0063 | min=0.4912 max=0.5164
         : test loss mean=2445616985959.1328 ± 2041337877785.8093
         : individual accs = ['0.511945', '0.498981', '0.498949', '0.501794', '0.506040', '0.503305', '0.516381', '0.511093', '0.496502', '0.505183', '0.503765', '0.508600', '0.491222', '0.502855', '0.513687', '0.501355', '0.500313', '0.501368', '0.515052', '0.505382']
         : correct/total = [(7286, 14232), (7103, 14235), (7118, 14266), (7134, 14217), (7205, 14238), (7234, 14373), (7408, 14346), (7326, 14334), (7097, 14294), (7261, 14373), (7226, 14344), (7274, 14302), (7051, 14354), (7222, 14362), (7356, 14320), (7217, 14395), (7199, 14389), (7148, 14257), (7340, 14251), (7277, 14399)]
         : compromised: 0.5028, honest: 0.5075
Round 008: test acc mean=0.5021 ± 0.0052 | min=0.4945 max=0.5168
         : test loss mean=202914395567728.8750 ± 169530201660610.9375
         : individual accs = ['0.504005', '0.494485', '0.501963', '0.507069', '0.500702', '0.504766', '0.501324', '0.496651', '0.498741', '0.505670', '0.500906', '0.510278', '0.495750', '0.498259', '0.516830', '0.501563', '0.498645', '0.497720', '0.505508', '0.500313']
         : correct/total = [(7173, 14232), (7039, 14235), (7161, 14266), (7209, 14217), (7129, 14238), (7255, 14373), (7192, 14346), (7119, 14334), (7129, 14294), (7268, 14373), (7185, 14344), (7298, 14302), (7116, 14354), (7156, 14362), (7401, 14320), (7220, 14395), (7175, 14389), (7096, 14257), (7204, 14251), (7204, 14399)]
         : compromised: 0.5027, honest: 0.5010
Round 009: test acc mean=0.5029 ± 0.0076 | min=0.4879 max=0.5129
         : test loss mean=17120214254860960.0000 ± 14458438318238540.0000
         : individual accs = ['0.512929', '0.505023', '0.509884', '0.498066', '0.509903', '0.509497', '0.489335', '0.498954', '0.497412', '0.506505', '0.503834', '0.509299', '0.499025', '0.508286', '0.505866', '0.494825', '0.487873', '0.490987', '0.508666', '0.511216']
         : correct/total = [(7300, 14232), (7189, 14235), (7274, 14266), (7081, 14217), (7260, 14238), (7323, 14373), (7020, 14346), (7152, 14334), (7110, 14294), (7280, 14373), (7227, 14344), (7284, 14302), (7163, 14354), (7300, 14362), (7244, 14320), (7123, 14395), (7020, 14389), (7000, 14257), (7249, 14251), (7361, 14399)]
         : compromised: 0.5031, honest: 0.5026
Round 010: test acc mean=0.5017 ± 0.0072 | min=0.4817 max=0.5129
         : test loss mean=1429286656254795264.0000 ± 1210130691011795456.0000
         : individual accs = ['0.481661', '0.504039', '0.502944', '0.501583', '0.504495', '0.504766', '0.506064', '0.497000', '0.491325', '0.509358', '0.502510', '0.512516', '0.499652', '0.502924', '0.498813', '0.504759', '0.492529', '0.497440', '0.512946', '0.507605']
         : correct/total = [(6855, 14232), (7175, 14235), (7175, 14266), (7131, 14217), (7183, 14238), (7255, 14373), (7260, 14346), (7124, 14334), (7023, 14294), (7321, 14373), (7208, 14344), (7330, 14302), (7172, 14354), (7223, 14362), (7143, 14320), (7266, 14395), (7087, 14389), (7092, 14257), (7310, 14251), (7309, 14399)]
         : compromised: 0.5028, honest: 0.5002

=== FINAL RESULTS ===
Dataset: sent140, Nodes: 20, Graph: erdos, Aggregation: balance
Attack: backdoor, 60.0% compromised
Final accuracy - Compromised: 0.5028, Honest: 0.5002
Overall test accuracy: mean=0.5017 ± 0.0072

=== BACKDOOR ATTACK SUCCESS RATE (ASR) ===
Target label: 1
Trigger size: 3x3
Overall ASR: 0.7162 ± 0.3773
Honest nodes ASR: 0.3003 ± 0.2599
Compromised nodes ASR: 0.9935 ± 0.0048
Note: Higher ASR indicates more successful backdoor attack

=== BALANCE SUMMARY ===
Node 0: acceptance=0.400
Node 1: acceptance=0.600
Node 2: acceptance=0.600
Node 3: acceptance=0.600
Node 4: acceptance=0.900
Node 5: acceptance=0.700
Node 6: acceptance=0.700
Node 7: acceptance=0.440
Node 8: acceptance=0.700
Node 9: acceptance=1.000
Node 10: acceptance=0.550
Node 11: acceptance=0.600
Node 12: acceptance=0.600
Node 13: acceptance=0.600
Node 14: acceptance=0.700
Node 15: acceptance=0.600
Node 16: acceptance=0.800
Node 17: acceptance=0.600
Node 18: acceptance=0.700
Node 19: acceptance=1.000

=== PARALLEL EXECUTION TIME (realistic for distributed system) ===
  COMMUNICATION (max across nodes):
    - Full model transfer: 0.000s (0.0%)
  COMPUTATION (max across nodes):
    - Filtering: 0.035s (75.3%)
    - Aggregation: 0.012s (24.7%)
  TOTALS:
    - Total computation: 0.047s (100.0%)
    - Total communication: 0.000s (0.0%)
    - Total parallel time: 0.047s

=== PER-NODE AVERAGE TIME ===
  - Filtering: 0.024s
  - Aggregation: 0.006s
  - Model transfer: 0.000s
  - Total per node: 0.030s

=== TOTAL COMPUTATIONAL WORK (sum across all nodes) ===
  - Total filtering: 0.473s
  - Total aggregation: 0.122s
  - Total model transfer: 0.000s
  - Grand total: 0.594s
  - Mean acceptance rate: 0.669

BALANCE Algorithm Properties:
  - Model dimension: 1,174,986
  - No compression: Full parameter comparison
  - Theoretical complexity: O(deg(i)×d)
  - Approach: Full parameter filtering + averaging
