Device: cuda
Seed: 987654321
Loading 1 LEAF Sent140 train files...
LEAF Sent140 train: 254555 users, 908652 samples
Building vocabulary (max_size=10000)...
Vocabulary size: 10000
Loading 1 LEAF Sent140 test files...
LEAF Sent140 test: 254555 users, 286281 samples
Found 254555 train users, 254555 test users, 254555 common users
User sample counts range: 494 (max) to 1 (min)
Distributed ALL 254555 users across 20 clients
Users per client: 12727 (with 15 clients getting +1 user)
Train partition sizes: [44353, 44290, 44657, 44907, 44696, 45843, 45801, 45619, 45069, 45639, 45821, 45311, 45779, 46056, 45625, 45984, 46428, 44737, 45540, 46497]
Test partition sizes: [14232, 14235, 14266, 14217, 14238, 14373, 14346, 14334, 14294, 14373, 14344, 14302, 14354, 14362, 14320, 14395, 14389, 14257, 14251, 14399]
  Client 0: 44353 train samples, 2 unique classes
  Client 1: 44290 train samples, 2 unique classes
  Client 2: 44657 train samples, 2 unique classes
  Client 3: 44907 train samples, 2 unique classes
  Client 4: 44696 train samples, 2 unique classes
  Client 5: 45843 train samples, 2 unique classes
  Client 6: 45801 train samples, 2 unique classes
  Client 7: 45619 train samples, 2 unique classes
  Client 8: 45069 train samples, 2 unique classes
  Client 9: 45639 train samples, 2 unique classes
  Client 10: 45821 train samples, 2 unique classes
  Client 11: 45311 train samples, 2 unique classes
  Client 12: 45779 train samples, 2 unique classes
  Client 13: 46056 train samples, 2 unique classes
  Client 14: 45625 train samples, 2 unique classes
  Client 15: 45984 train samples, 2 unique classes
  Client 16: 46428 train samples, 2 unique classes
  Client 17: 44737 train samples, 2 unique classes
  Client 18: 45540 train samples, 2 unique classes
  Client 19: 46497 train samples, 2 unique classes
Will sample 4500 samples per client per epoch
Graph: ring, nodes: 20, edges: 20
Degree statistics: avg=2.00, min=2, max=2
Attack: Compromised 10/20 nodes: [1, 2, 5, 11, 12, 13, 14, 15, 17, 18]
Attack type: directed_deviation, lambda: 1.0
Model variant: baseline
Model parameters: 1,174,986
BALANCE algorithm:
Balance Config: BALANCEConfig(gamma=2, kappa=1, alpha=0.5, min_neighbors=1)
  - Model dimension: 1,174,986 parameters
  - Complexity: O(N×d) = O(20×1,174,986)
Initial test acc across nodes: mean=0.4953 ± 0.0174
Round 001: test acc mean=0.5059 ± 0.0250 | min=0.4806 max=0.5765
         : test loss mean=2.5222 ± 2.7706
         : individual accs = ['0.480607', '0.515982', '0.494953', '0.519378', '0.497682', '0.508592', '0.500139', '0.576531', '0.501189', '0.572254', '0.482641', '0.507272', '0.494148', '0.492898', '0.513059', '0.485446', '0.500382', '0.490847', '0.491895', '0.491909']
         : correct/total = [(6840, 14232), (7345, 14235), (7061, 14266), (7384, 14217), (7086, 14238), (7310, 14373), (7175, 14346), (8264, 14334), (7164, 14294), (8225, 14373), (6923, 14344), (7255, 14302), (7093, 14354), (7079, 14362), (7347, 14320), (6988, 14395), (7200, 14389), (6998, 14257), (7010, 14251), (7083, 14399)]
         : compromised: 0.4995, honest: 0.5123
Round 002: test acc mean=0.5059 ± 0.0282 | min=0.4711 max=0.6241
         : test loss mean=1.4029 ± 0.9214
         : individual accs = ['0.499157', '0.502424', '0.505187', '0.500809', '0.497963', '0.504557', '0.497281', '0.493024', '0.624108', '0.508105', '0.502301', '0.497763', '0.503483', '0.500418', '0.493575', '0.471136', '0.503093', '0.504454', '0.503544', '0.505868']
         : correct/total = [(7104, 14232), (7152, 14235), (7207, 14266), (7120, 14217), (7090, 14238), (7252, 14373), (7134, 14346), (7067, 14334), (8921, 14294), (7303, 14373), (7205, 14344), (7119, 14302), (7227, 14354), (7187, 14362), (7068, 14320), (6782, 14395), (7239, 14389), (7192, 14257), (7176, 14251), (7284, 14399)]
         : compromised: 0.4987, honest: 0.5132
Round 003: test acc mean=0.5165 ± 0.0223 | min=0.4903 max=0.5643
         : test loss mean=0.8415 ± 0.2612
         : individual accs = ['0.515107', '0.501300', '0.498458', '0.558697', '0.564265', '0.501496', '0.550188', '0.528743', '0.542465', '0.516663', '0.539598', '0.499301', '0.490316', '0.513020', '0.512221', '0.497325', '0.493988', '0.496177', '0.498983', '0.511147']
         : correct/total = [(7331, 14232), (7136, 14235), (7111, 14266), (7943, 14217), (8034, 14238), (7208, 14373), (7893, 14346), (7579, 14334), (7754, 14294), (7426, 14373), (7740, 14344), (7141, 14302), (7038, 14354), (7368, 14362), (7335, 14320), (7159, 14395), (7108, 14389), (7074, 14257), (7111, 14251), (7360, 14399)]
         : compromised: 0.5009, honest: 0.5321
Round 004: test acc mean=0.5556 ± 0.0459 | min=0.4939 max=0.6252
         : test loss mean=0.7956 ± 0.2367
         : individual accs = ['0.547147', '0.541763', '0.567573', '0.580643', '0.591024', '0.564322', '0.612923', '0.619297', '0.574437', '0.625200', '0.616564', '0.608307', '0.503762', '0.495335', '0.493855', '0.498090', '0.504135', '0.497861', '0.520385', '0.549552']
         : correct/total = [(7787, 14232), (7712, 14235), (8097, 14266), (8255, 14217), (8415, 14238), (8111, 14373), (8793, 14346), (8877, 14334), (8211, 14294), (8986, 14373), (8844, 14344), (8700, 14302), (7231, 14354), (7114, 14362), (7072, 14320), (7170, 14395), (7254, 14389), (7098, 14257), (7416, 14251), (7913, 14399)]
         : compromised: 0.5291, honest: 0.5821
Round 005: test acc mean=0.5771 ± 0.0517 | min=0.4965 max=0.6418
         : test loss mean=0.8295 ± 0.3319
         : individual accs = ['0.583404', '0.583562', '0.597715', '0.599634', '0.607178', '0.579628', '0.637390', '0.637854', '0.627466', '0.641828', '0.634690', '0.625857', '0.505991', '0.507938', '0.508101', '0.501702', '0.507401', '0.496528', '0.571258', '0.587332']
         : correct/total = [(8303, 14232), (8307, 14235), (8527, 14266), (8525, 14217), (8645, 14238), (8331, 14373), (9144, 14346), (9143, 14334), (8969, 14294), (9225, 14373), (9104, 14344), (8951, 14302), (7263, 14354), (7295, 14362), (7276, 14320), (7222, 14395), (7301, 14389), (7079, 14257), (8141, 14251), (8457, 14399)]
         : compromised: 0.5478, honest: 0.6064
Round 006: test acc mean=0.5832 ± 0.0579 | min=0.4923 max=0.6510
         : test loss mean=0.7245 ± 0.1433
         : individual accs = ['0.602234', '0.602950', '0.606968', '0.610607', '0.612094', '0.564739', '0.644012', '0.650970', '0.636841', '0.644820', '0.637409', '0.643966', '0.492337', '0.501462', '0.505656', '0.502466', '0.501355', '0.498282', '0.600940', '0.603375']
         : correct/total = [(8571, 14232), (8583, 14235), (8659, 14266), (8681, 14217), (8715, 14238), (8117, 14373), (9239, 14346), (9331, 14334), (9103, 14294), (9268, 14373), (9143, 14344), (9210, 14302), (7067, 14354), (7202, 14362), (7241, 14320), (7233, 14395), (7214, 14389), (7104, 14257), (8564, 14251), (8688, 14399)]
         : compromised: 0.5520, honest: 0.6144
Round 007: test acc mean=0.5902 ± 0.0557 | min=0.4967 max=0.6506
         : test loss mean=0.8600 ± 0.4600
         : individual accs = ['0.609612', '0.614542', '0.618043', '0.623549', '0.624175', '0.591595', '0.647010', '0.625017', '0.639709', '0.650595', '0.643335', '0.649420', '0.515884', '0.520123', '0.509707', '0.506495', '0.496699', '0.501648', '0.604659', '0.612473']
         : correct/total = [(8676, 14232), (8748, 14235), (8817, 14266), (8865, 14217), (8887, 14238), (8503, 14373), (9282, 14346), (8959, 14334), (9144, 14294), (9351, 14373), (9228, 14344), (9288, 14302), (7405, 14354), (7470, 14362), (7299, 14320), (7291, 14395), (7147, 14389), (7152, 14257), (8617, 14251), (8819, 14399)]
         : compromised: 0.5632, honest: 0.6172
Round 008: test acc mean=0.5919 ± 0.0614 | min=0.4885 max=0.6586
         : test loss mean=0.6836 ± 0.0773
         : individual accs = ['0.626967', '0.622901', '0.624702', '0.619751', '0.623683', '0.613651', '0.632232', '0.624111', '0.643976', '0.658109', '0.652538', '0.658579', '0.501184', '0.495474', '0.488547', '0.504481', '0.514073', '0.498352', '0.613431', '0.621988']
         : correct/total = [(8923, 14232), (8867, 14235), (8912, 14266), (8811, 14217), (8880, 14238), (8820, 14373), (9070, 14346), (8946, 14334), (9205, 14294), (9459, 14373), (9360, 14344), (9419, 14302), (7194, 14354), (7116, 14362), (6996, 14320), (7262, 14395), (7397, 14389), (7105, 14257), (8742, 14251), (8956, 14399)]
         : compromised: 0.5621, honest: 0.6217
Round 009: test acc mean=0.6001 ± 0.0601 | min=0.4968 max=0.6614
         : test loss mean=0.7932 ± 0.3623
         : individual accs = ['0.632167', '0.627819', '0.631782', '0.629528', '0.633305', '0.661379', '0.626516', '0.651458', '0.642297', '0.648160', '0.641453', '0.658579', '0.520203', '0.517616', '0.509567', '0.506565', '0.507262', '0.496809', '0.625991', '0.634280']
         : correct/total = [(8997, 14232), (8937, 14235), (9013, 14266), (8950, 14217), (9017, 14238), (9506, 14373), (8988, 14346), (9338, 14334), (9181, 14294), (9316, 14373), (9201, 14344), (9419, 14302), (7467, 14354), (7434, 14362), (7297, 14320), (7292, 14395), (7299, 14389), (7083, 14257), (8921, 14251), (9133, 14399)]
         : compromised: 0.5756, honest: 0.6246
Round 010: test acc mean=0.6071 ± 0.0672 | min=0.4958 max=0.6723
         : test loss mean=0.6639 ± 0.0651
         : individual accs = ['0.637648', '0.637373', '0.640264', '0.635225', '0.638643', '0.672302', '0.668618', '0.667225', '0.651742', '0.662492', '0.659161', '0.664103', '0.511704', '0.499443', '0.514106', '0.499132', '0.517062', '0.495827', '0.632517', '0.636711']
         : correct/total = [(9075, 14232), (9073, 14235), (9134, 14266), (9031, 14217), (9093, 14238), (9663, 14373), (9592, 14346), (9564, 14334), (9316, 14294), (9522, 14373), (9455, 14344), (9498, 14302), (7345, 14354), (7173, 14362), (7362, 14320), (7185, 14395), (7440, 14389), (7069, 14257), (9014, 14251), (9168, 14399)]
         : compromised: 0.5767, honest: 0.6375

=== FINAL RESULTS ===
Dataset: sent140, Nodes: 20, Graph: ring, Aggregation: balance
Attack: directed_deviation, 50.0% compromised
Final accuracy - Compromised: 0.5767, Honest: 0.6375
Overall test accuracy: mean=0.6071 ± 0.0672

=== BALANCE SUMMARY ===
Node 0: acceptance=0.600
Node 1: acceptance=0.550
Node 2: acceptance=0.550
Node 3: acceptance=0.600
Node 4: acceptance=0.600
Node 5: acceptance=0.800
Node 6: acceptance=0.600
Node 7: acceptance=1.000
Node 8: acceptance=1.000
Node 9: acceptance=1.000
Node 10: acceptance=0.600
Node 11: acceptance=0.550
Node 12: acceptance=0.200
Node 13: acceptance=0.200
Node 14: acceptance=0.200
Node 15: acceptance=0.550
Node 16: acceptance=0.100
Node 17: acceptance=0.550
Node 18: acceptance=0.550
Node 19: acceptance=0.600

=== PARALLEL EXECUTION TIME (realistic for distributed system) ===
  COMMUNICATION (max across nodes):
    - Full model transfer: 0.000s (0.1%)
  COMPUTATION (max across nodes):
    - Filtering: 0.012s (52.2%)
    - Aggregation: 0.011s (47.7%)
  TOTALS:
    - Total computation: 0.023s (99.9%)
    - Total communication: 0.000s (0.1%)
    - Total parallel time: 0.023s

=== PER-NODE AVERAGE TIME ===
  - Filtering: 0.011s
  - Aggregation: 0.005s
  - Model transfer: 0.000s
  - Total per node: 0.016s

=== TOTAL COMPUTATIONAL WORK (sum across all nodes) ===
  - Total filtering: 0.217s
  - Total aggregation: 0.097s
  - Total model transfer: 0.000s
  - Grand total: 0.315s
  - Mean acceptance rate: 0.570

BALANCE Algorithm Properties:
  - Model dimension: 1,174,986
  - No compression: Full parameter comparison
  - Theoretical complexity: O(deg(i)×d)
  - Approach: Full parameter filtering + averaging
