Device: cuda
Seed: 987654321
Loading 1 LEAF Sent140 train files...
LEAF Sent140 train: 254555 users, 908652 samples
Building vocabulary (max_size=10000)...
Vocabulary size: 10000
Loading 1 LEAF Sent140 test files...
LEAF Sent140 test: 254555 users, 286281 samples
Found 254555 train users, 254555 test users, 254555 common users
User sample counts range: 494 (max) to 1 (min)
Distributed ALL 254555 users across 20 clients
Users per client: 12727 (with 15 clients getting +1 user)
Train partition sizes: [44353, 44290, 44657, 44907, 44696, 45843, 45801, 45619, 45069, 45639, 45821, 45311, 45779, 46056, 45625, 45984, 46428, 44737, 45540, 46497]
Test partition sizes: [14232, 14235, 14266, 14217, 14238, 14373, 14346, 14334, 14294, 14373, 14344, 14302, 14354, 14362, 14320, 14395, 14389, 14257, 14251, 14399]
  Client 0: 44353 train samples, 2 unique classes
  Client 1: 44290 train samples, 2 unique classes
  Client 2: 44657 train samples, 2 unique classes
  Client 3: 44907 train samples, 2 unique classes
  Client 4: 44696 train samples, 2 unique classes
  Client 5: 45843 train samples, 2 unique classes
  Client 6: 45801 train samples, 2 unique classes
  Client 7: 45619 train samples, 2 unique classes
  Client 8: 45069 train samples, 2 unique classes
  Client 9: 45639 train samples, 2 unique classes
  Client 10: 45821 train samples, 2 unique classes
  Client 11: 45311 train samples, 2 unique classes
  Client 12: 45779 train samples, 2 unique classes
  Client 13: 46056 train samples, 2 unique classes
  Client 14: 45625 train samples, 2 unique classes
  Client 15: 45984 train samples, 2 unique classes
  Client 16: 46428 train samples, 2 unique classes
  Client 17: 44737 train samples, 2 unique classes
  Client 18: 45540 train samples, 2 unique classes
  Client 19: 46497 train samples, 2 unique classes
Will sample 4500 samples per client per epoch
Graph: erdos, nodes: 20, edges: 126
Degree statistics: avg=12.60, min=8, max=16
Attack: Compromised 4/20 nodes: [5, 12, 13, 17]
Attack type: directed_deviation, lambda: 1.0
Model variant: baseline
Model parameters: 1,174,986
BALANCE algorithm:
Balance Config: BALANCEConfig(gamma=2, kappa=1, alpha=0.5, min_neighbors=1)
  - Model dimension: 1,174,986 parameters
  - Complexity: O(N×d) = O(20×1,174,986)
Initial test acc across nodes: mean=0.4965 ± 0.0152
Round 001: test acc mean=0.4991 ± 0.0143 | min=0.4741 max=0.5268
         : test loss mean=0.7472 ± 0.0721
         : individual accs = ['0.487774', '0.474113', '0.483037', '0.506295', '0.492766', '0.496834', '0.500139', '0.524836', '0.503638', '0.492660', '0.510109', '0.495595', '0.501324', '0.526807', '0.485754', '0.525043', '0.496699', '0.476889', '0.501298', '0.499896']
         : correct/total = [(6942, 14232), (6749, 14235), (6891, 14266), (7198, 14217), (7016, 14238), (7141, 14373), (7175, 14346), (7523, 14334), (7199, 14294), (7081, 14373), (7317, 14344), (7088, 14302), (7196, 14354), (7566, 14362), (6956, 14320), (7558, 14395), (7147, 14389), (6799, 14257), (7144, 14251), (7198, 14399)]
         : compromised: 0.5005, honest: 0.4987
Round 002: test acc mean=0.5155 ± 0.0201 | min=0.4861 max=0.5534
         : test loss mean=0.6924 ± 0.0022
         : individual accs = ['0.500843', '0.531577', '0.486051', '0.515791', '0.553449', '0.490503', '0.497979', '0.515697', '0.497342', '0.544424', '0.543293', '0.513704', '0.498885', '0.508564', '0.532891', '0.513720', '0.507471', '0.496247', '0.509087', '0.552122']
         : correct/total = [(7128, 14232), (7567, 14235), (6934, 14266), (7333, 14217), (7880, 14238), (7050, 14373), (7144, 14346), (7392, 14334), (7109, 14294), (7825, 14373), (7793, 14344), (7347, 14302), (7161, 14354), (7304, 14362), (7631, 14320), (7395, 14395), (7302, 14389), (7075, 14257), (7255, 14251), (7950, 14399)]
         : compromised: 0.4986, honest: 0.5197
Round 003: test acc mean=0.5077 ± 0.0199 | min=0.4861 max=0.5505
         : test loss mean=0.6930 ± 0.0008
         : individual accs = ['0.489109', '0.525465', '0.486051', '0.492087', '0.539542', '0.493843', '0.497351', '0.505232', '0.488387', '0.493008', '0.540365', '0.492029', '0.499512', '0.508564', '0.530936', '0.501216', '0.529780', '0.502911', '0.488597', '0.550524']
         : correct/total = [(6961, 14232), (7480, 14235), (6934, 14266), (6996, 14217), (7682, 14238), (7098, 14373), (7135, 14346), (7242, 14334), (6981, 14294), (7086, 14373), (7751, 14344), (7037, 14302), (7170, 14354), (7304, 14362), (7603, 14320), (7215, 14395), (7623, 14389), (7170, 14257), (6963, 14251), (7927, 14399)]
         : compromised: 0.5012, honest: 0.5094
Round 004: test acc mean=0.4967 ± 0.0108 | min=0.4861 max=0.5369
         : test loss mean=0.6933 ± 0.0003
         : individual accs = ['0.489109', '0.486266', '0.486121', '0.492228', '0.494100', '0.493843', '0.497560', '0.495186', '0.488107', '0.493008', '0.536949', '0.492029', '0.499512', '0.508564', '0.495810', '0.498367', '0.499826', '0.503051', '0.488738', '0.496354']
         : correct/total = [(6961, 14232), (6922, 14235), (6935, 14266), (6998, 14217), (7035, 14238), (7098, 14373), (7138, 14346), (7098, 14334), (6977, 14294), (7086, 14373), (7702, 14344), (7037, 14302), (7170, 14354), (7304, 14362), (7100, 14320), (7174, 14395), (7192, 14389), (7172, 14257), (6965, 14251), (7147, 14399)]
         : compromised: 0.5012, honest: 0.4956
Round 005: test acc mean=0.4949 ± 0.0056 | min=0.4861 max=0.5086
         : test loss mean=0.6937 ± 0.0003
         : individual accs = ['0.489109', '0.486266', '0.486051', '0.492228', '0.494100', '0.493843', '0.497560', '0.495186', '0.488457', '0.493008', '0.499024', '0.492029', '0.499512', '0.508564', '0.495810', '0.498367', '0.499757', '0.503051', '0.488738', '0.496354']
         : correct/total = [(6961, 14232), (6922, 14235), (6934, 14266), (6998, 14217), (7035, 14238), (7098, 14373), (7138, 14346), (7098, 14334), (6982, 14294), (7086, 14373), (7158, 14344), (7037, 14302), (7170, 14354), (7304, 14362), (7100, 14320), (7174, 14395), (7191, 14389), (7172, 14257), (6965, 14251), (7147, 14399)]
         : compromised: 0.5012, honest: 0.4933
Round 006: test acc mean=0.4949 ± 0.0056 | min=0.4861 max=0.5086
         : test loss mean=0.6938 ± 0.0003
         : individual accs = ['0.489109', '0.486266', '0.486051', '0.492228', '0.494100', '0.493843', '0.497560', '0.495186', '0.488457', '0.493008', '0.499024', '0.492029', '0.499512', '0.508564', '0.495810', '0.498367', '0.499757', '0.503051', '0.488738', '0.496354']
         : correct/total = [(6961, 14232), (6922, 14235), (6934, 14266), (6998, 14217), (7035, 14238), (7098, 14373), (7138, 14346), (7098, 14334), (6982, 14294), (7086, 14373), (7158, 14344), (7037, 14302), (7170, 14354), (7304, 14362), (7100, 14320), (7174, 14395), (7191, 14389), (7172, 14257), (6965, 14251), (7147, 14399)]
         : compromised: 0.5012, honest: 0.4933
Round 007: test acc mean=0.4949 ± 0.0056 | min=0.4861 max=0.5086
         : test loss mean=0.6938 ± 0.0003
         : individual accs = ['0.489109', '0.486266', '0.486051', '0.492228', '0.494100', '0.493843', '0.497560', '0.495186', '0.488457', '0.493008', '0.499024', '0.492029', '0.499512', '0.508564', '0.495810', '0.498367', '0.499757', '0.503051', '0.488738', '0.496354']
         : correct/total = [(6961, 14232), (6922, 14235), (6934, 14266), (6998, 14217), (7035, 14238), (7098, 14373), (7138, 14346), (7098, 14334), (6982, 14294), (7086, 14373), (7158, 14344), (7037, 14302), (7170, 14354), (7304, 14362), (7100, 14320), (7174, 14395), (7191, 14389), (7172, 14257), (6965, 14251), (7147, 14399)]
         : compromised: 0.5012, honest: 0.4933
Round 008: test acc mean=0.4949 ± 0.0056 | min=0.4861 max=0.5086
         : test loss mean=0.6938 ± 0.0003
         : individual accs = ['0.489109', '0.486266', '0.486051', '0.492228', '0.494100', '0.493843', '0.497560', '0.495186', '0.488457', '0.493008', '0.499024', '0.492029', '0.499512', '0.508564', '0.495810', '0.498367', '0.499757', '0.503051', '0.488738', '0.496354']
         : correct/total = [(6961, 14232), (6922, 14235), (6934, 14266), (6998, 14217), (7035, 14238), (7098, 14373), (7138, 14346), (7098, 14334), (6982, 14294), (7086, 14373), (7158, 14344), (7037, 14302), (7170, 14354), (7304, 14362), (7100, 14320), (7174, 14395), (7191, 14389), (7172, 14257), (6965, 14251), (7147, 14399)]
         : compromised: 0.5012, honest: 0.4933
Round 009: test acc mean=0.4949 ± 0.0056 | min=0.4861 max=0.5086
         : test loss mean=0.6938 ± 0.0004
         : individual accs = ['0.489109', '0.486266', '0.486051', '0.492228', '0.494100', '0.493843', '0.497560', '0.495186', '0.488457', '0.493008', '0.499024', '0.492029', '0.499512', '0.508564', '0.495810', '0.498367', '0.499757', '0.503051', '0.488738', '0.496354']
         : correct/total = [(6961, 14232), (6922, 14235), (6934, 14266), (6998, 14217), (7035, 14238), (7098, 14373), (7138, 14346), (7098, 14334), (6982, 14294), (7086, 14373), (7158, 14344), (7037, 14302), (7170, 14354), (7304, 14362), (7100, 14320), (7174, 14395), (7191, 14389), (7172, 14257), (6965, 14251), (7147, 14399)]
         : compromised: 0.5012, honest: 0.4933
Round 010: test acc mean=0.4949 ± 0.0056 | min=0.4861 max=0.5086
         : test loss mean=0.6938 ± 0.0004
         : individual accs = ['0.489109', '0.486266', '0.486051', '0.492228', '0.494100', '0.493843', '0.497560', '0.495186', '0.488457', '0.493008', '0.499024', '0.492029', '0.499512', '0.508564', '0.495810', '0.498367', '0.499757', '0.503051', '0.488738', '0.496354']
         : correct/total = [(6961, 14232), (6922, 14235), (6934, 14266), (6998, 14217), (7035, 14238), (7098, 14373), (7138, 14346), (7098, 14334), (6982, 14294), (7086, 14373), (7158, 14344), (7037, 14302), (7170, 14354), (7304, 14362), (7100, 14320), (7174, 14395), (7191, 14389), (7172, 14257), (6965, 14251), (7147, 14399)]
         : compromised: 0.5012, honest: 0.4933

=== FINAL RESULTS ===
Dataset: sent140, Nodes: 20, Graph: erdos, Aggregation: balance
Attack: directed_deviation, 20.0% compromised
Final accuracy - Compromised: 0.5012, Honest: 0.4933
Overall test accuracy: mean=0.4949 ± 0.0056

=== BALANCE SUMMARY ===
Node 0: acceptance=0.831
Node 1: acceptance=0.836
Node 2: acceptance=0.850
Node 3: acceptance=0.887
Node 4: acceptance=0.836
Node 5: acceptance=0.820
Node 6: acceptance=0.743
Node 7: acceptance=0.807
Node 8: acceptance=0.730
Node 9: acceptance=0.931
Node 10: acceptance=0.700
Node 11: acceptance=0.807
Node 12: acceptance=0.925
Node 13: acceptance=0.931
Node 14: acceptance=0.760
Node 15: acceptance=0.836
Node 16: acceptance=0.792
Node 17: acceptance=0.900
Node 18: acceptance=0.831
Node 19: acceptance=0.775

=== PARALLEL EXECUTION TIME (realistic for distributed system) ===
  COMMUNICATION (max across nodes):
    - Full model transfer: 0.000s (0.0%)
  COMPUTATION (max across nodes):
    - Filtering: 0.071s (79.3%)
    - Aggregation: 0.019s (20.7%)
  TOTALS:
    - Total computation: 0.090s (100.0%)
    - Total communication: 0.000s (0.0%)
    - Total parallel time: 0.090s

=== PER-NODE AVERAGE TIME ===
  - Filtering: 0.055s
  - Aggregation: 0.010s
  - Model transfer: 0.000s
  - Total per node: 0.065s

=== TOTAL COMPUTATIONAL WORK (sum across all nodes) ===
  - Total filtering: 1.097s
  - Total aggregation: 0.199s
  - Total model transfer: 0.000s
  - Grand total: 1.297s
  - Mean acceptance rate: 0.827

BALANCE Algorithm Properties:
  - Model dimension: 1,174,986
  - No compression: Full parameter comparison
  - Theoretical complexity: O(deg(i)×d)
  - Approach: Full parameter filtering + averaging
