Device: cuda
Seed: 987654321
Loading 1 LEAF Sent140 train files...
LEAF Sent140 train: 254555 users, 908652 samples
Building vocabulary (max_size=10000)...
Vocabulary size: 10000
Loading 1 LEAF Sent140 test files...
LEAF Sent140 test: 254555 users, 286281 samples
Found 254555 train users, 254555 test users, 254555 common users
User sample counts range: 494 (max) to 1 (min)
Distributed ALL 254555 users across 20 clients
Users per client: 12727 (with 15 clients getting +1 user)
Train partition sizes: [44353, 44290, 44657, 44907, 44696, 45843, 45801, 45619, 45069, 45639, 45821, 45311, 45779, 46056, 45625, 45984, 46428, 44737, 45540, 46497]
Test partition sizes: [14232, 14235, 14266, 14217, 14238, 14373, 14346, 14334, 14294, 14373, 14344, 14302, 14354, 14362, 14320, 14395, 14389, 14257, 14251, 14399]
  Client 0: 44353 train samples, 2 unique classes
  Client 1: 44290 train samples, 2 unique classes
  Client 2: 44657 train samples, 2 unique classes
  Client 3: 44907 train samples, 2 unique classes
  Client 4: 44696 train samples, 2 unique classes
  Client 5: 45843 train samples, 2 unique classes
  Client 6: 45801 train samples, 2 unique classes
  Client 7: 45619 train samples, 2 unique classes
  Client 8: 45069 train samples, 2 unique classes
  Client 9: 45639 train samples, 2 unique classes
  Client 10: 45821 train samples, 2 unique classes
  Client 11: 45311 train samples, 2 unique classes
  Client 12: 45779 train samples, 2 unique classes
  Client 13: 46056 train samples, 2 unique classes
  Client 14: 45625 train samples, 2 unique classes
  Client 15: 45984 train samples, 2 unique classes
  Client 16: 46428 train samples, 2 unique classes
  Client 17: 44737 train samples, 2 unique classes
  Client 18: 45540 train samples, 2 unique classes
  Client 19: 46497 train samples, 2 unique classes
Will sample 4500 samples per client per epoch
Graph: erdos, nodes: 20, edges: 48
Degree statistics: avg=4.80, min=2, max=7
Attack: Compromised 16/20 nodes: [1, 2, 3, 5, 6, 8, 9, 10, 11, 12, 13, 14, 15, 17, 18, 19]
Attack type: gaussian, lambda: 1.0
Model variant: baseline
Model parameters: 1,174,986
Sketchguard Node 0:
  Model dim: 1,174,986 → Sketch size: 180
  Compression ratio: 6527.7x
  Using model parameters for aggregation, sketches for filtering
Sketchguard Node 1:
  Model dim: 1,174,986 → Sketch size: 180
  Compression ratio: 6527.7x
  Using model parameters for aggregation, sketches for filtering
Sketchguard Node 2:
  Model dim: 1,174,986 → Sketch size: 180
  Compression ratio: 6527.7x
  Using model parameters for aggregation, sketches for filtering
Sketchguard Node 3:
  Model dim: 1,174,986 → Sketch size: 180
  Compression ratio: 6527.7x
  Using model parameters for aggregation, sketches for filtering
Sketchguard Node 4:
  Model dim: 1,174,986 → Sketch size: 180
  Compression ratio: 6527.7x
  Using model parameters for aggregation, sketches for filtering
Sketchguard Node 5:
  Model dim: 1,174,986 → Sketch size: 180
  Compression ratio: 6527.7x
  Using model parameters for aggregation, sketches for filtering
Sketchguard Node 6:
  Model dim: 1,174,986 → Sketch size: 180
  Compression ratio: 6527.7x
  Using model parameters for aggregation, sketches for filtering
Sketchguard Node 7:
  Model dim: 1,174,986 → Sketch size: 180
  Compression ratio: 6527.7x
  Using model parameters for aggregation, sketches for filtering
Sketchguard Node 8:
  Model dim: 1,174,986 → Sketch size: 180
  Compression ratio: 6527.7x
  Using model parameters for aggregation, sketches for filtering
Sketchguard Node 9:
  Model dim: 1,174,986 → Sketch size: 180
  Compression ratio: 6527.7x
  Using model parameters for aggregation, sketches for filtering
Sketchguard Node 10:
  Model dim: 1,174,986 → Sketch size: 180
  Compression ratio: 6527.7x
  Using model parameters for aggregation, sketches for filtering
Sketchguard Node 11:
  Model dim: 1,174,986 → Sketch size: 180
  Compression ratio: 6527.7x
  Using model parameters for aggregation, sketches for filtering
Sketchguard Node 12:
  Model dim: 1,174,986 → Sketch size: 180
  Compression ratio: 6527.7x
  Using model parameters for aggregation, sketches for filtering
Sketchguard Node 13:
  Model dim: 1,174,986 → Sketch size: 180
  Compression ratio: 6527.7x
  Using model parameters for aggregation, sketches for filtering
Sketchguard Node 14:
  Model dim: 1,174,986 → Sketch size: 180
  Compression ratio: 6527.7x
  Using model parameters for aggregation, sketches for filtering
Sketchguard Node 15:
  Model dim: 1,174,986 → Sketch size: 180
  Compression ratio: 6527.7x
  Using model parameters for aggregation, sketches for filtering
Sketchguard Node 16:
  Model dim: 1,174,986 → Sketch size: 180
  Compression ratio: 6527.7x
  Using model parameters for aggregation, sketches for filtering
Sketchguard Node 17:
  Model dim: 1,174,986 → Sketch size: 180
  Compression ratio: 6527.7x
  Using model parameters for aggregation, sketches for filtering
Sketchguard Node 18:
  Model dim: 1,174,986 → Sketch size: 180
  Compression ratio: 6527.7x
  Using model parameters for aggregation, sketches for filtering
Sketchguard Node 19:
  Model dim: 1,174,986 → Sketch size: 180
  Compression ratio: 6527.7x
  Using model parameters for aggregation, sketches for filtering
Sketchguard ALGORITHM (Sketch-based Filtering + State Aggregation)
  - Model dimension: 1,174,986 parameters
  - Config: SketchguardConfig(gamma=2, kappa=1, alpha=0.5, min_neighbors=1, sketch_size=180, network_seed=987654321, attack_detection_window=5)
  - Sketch size: 180
  - Compression ratio: 6527.7x
  - Complexity: O(d + N×k) = O(1,174,986 + 20×180)
  - Theoretical speedup vs BALANCE: 19.9x
Initial test acc across nodes: mean=0.4965 ± 0.0152
Round 001: test acc mean=0.5273 ± 0.0232 | min=0.4854 max=0.5640
         : test loss mean=200.3770 ± 406.4251
         : individual accs = ['0.544056', '0.514787', '0.534417', '0.499965', '0.563984', '0.535170', '0.507040', '0.563555', '0.533581', '0.543589', '0.515407', '0.501958', '0.550160', '0.495892', '0.529818', '0.554081', '0.545903', '0.530406', '0.485369', '0.496632']
         : correct/total = [(7743, 14232), (7328, 14235), (7624, 14266), (7108, 14217), (8030, 14238), (7692, 14373), (7274, 14346), (8078, 14334), (7627, 14294), (7813, 14373), (7393, 14344), (7179, 14302), (7897, 14354), (7122, 14362), (7587, 14320), (7976, 14395), (7855, 14389), (7562, 14257), (6917, 14251), (7151, 14399)]
         : compromised: 0.5205, honest: 0.5544
         : sketchguard stats = ['Node 0: acc_rate=0.167', 'Node 1: acc_rate=0.333', 'Node 2: acc_rate=0.200']...
Round 002: test acc mean=0.5554 ± 0.0405 | min=0.4885 max=0.6075
         : test loss mean=79.6450 ± 161.4245
         : individual accs = ['0.593592', '0.489498', '0.577597', '0.495323', '0.607529', '0.584777', '0.561202', '0.604716', '0.567861', '0.575941', '0.594186', '0.507272', '0.511286', '0.488511', '0.565433', '0.570406', '0.593787', '0.518552', '0.587468', '0.512952']
         : correct/total = [(8448, 14232), (6968, 14235), (8240, 14266), (7042, 14217), (8650, 14238), (8405, 14373), (8051, 14346), (8668, 14334), (8117, 14294), (8278, 14373), (8523, 14344), (7255, 14302), (7339, 14354), (7016, 14362), (8097, 14320), (8211, 14395), (8544, 14389), (7393, 14257), (8372, 14251), (7386, 14399)]
         : compromised: 0.5443, honest: 0.5999
         : sketchguard stats = ['Node 0: acc_rate=0.167', 'Node 1: acc_rate=0.333', 'Node 2: acc_rate=0.200']...
Round 003: test acc mean=0.5671 ± 0.0507 | min=0.4924 max=0.6216
         : test loss mean=87.8241 ± 208.7209
         : individual accs = ['0.604975', '0.493923', '0.594350', '0.495393', '0.621646', '0.605162', '0.597588', '0.619018', '0.597663', '0.598066', '0.596486', '0.492449', '0.518183', '0.493107', '0.587081', '0.603265', '0.608659', '0.507470', '0.613641', '0.494062']
         : correct/total = [(8610, 14232), (7031, 14235), (8479, 14266), (7043, 14217), (8851, 14238), (8698, 14373), (8573, 14346), (8873, 14334), (8543, 14294), (8596, 14373), (8556, 14344), (7043, 14302), (7438, 14354), (7082, 14362), (8407, 14320), (8684, 14395), (8758, 14389), (7235, 14257), (8745, 14251), (7114, 14399)]
         : compromised: 0.5555, honest: 0.6136
         : sketchguard stats = ['Node 0: acc_rate=0.167', 'Node 1: acc_rate=0.333', 'Node 2: acc_rate=0.200']...
Round 004: test acc mean=0.5892 ± 0.0498 | min=0.4899 max=0.6281
         : test loss mean=124.4946 ± 356.1291
         : individual accs = ['0.619871', '0.562557', '0.616501', '0.496800', '0.627476', '0.627705', '0.615921', '0.623413', '0.616482', '0.617060', '0.628137', '0.495805', '0.608959', '0.489904', '0.608589', '0.623203', '0.618806', '0.562320', '0.622062', '0.502465']
         : correct/total = [(8822, 14232), (8008, 14235), (8795, 14266), (7063, 14217), (8934, 14238), (9022, 14373), (8836, 14346), (8936, 14334), (8812, 14294), (8869, 14373), (9010, 14344), (7091, 14302), (8741, 14354), (7036, 14362), (8715, 14320), (8971, 14395), (8904, 14389), (8017, 14257), (8865, 14251), (7235, 14399)]
         : compromised: 0.5809, honest: 0.6224
         : sketchguard stats = ['Node 0: acc_rate=0.167', 'Node 1: acc_rate=0.333', 'Node 2: acc_rate=0.200']...
Round 005: test acc mean=0.5998 ± 0.0525 | min=0.4896 max=0.6401
         : test loss mean=74.0484 ± 159.8196
         : individual accs = ['0.627951', '0.626625', '0.623370', '0.494760', '0.640118', '0.636402', '0.623379', '0.634366', '0.618441', '0.624296', '0.633784', '0.491610', '0.622057', '0.489625', '0.617318', '0.633623', '0.627285', '0.585607', '0.631184', '0.513647']
         : correct/total = [(8937, 14232), (8920, 14235), (8893, 14266), (7034, 14217), (9114, 14238), (9147, 14373), (8943, 14346), (9093, 14334), (8840, 14294), (8973, 14373), (9091, 14344), (7031, 14302), (8929, 14354), (7032, 14362), (8840, 14320), (9121, 14395), (9026, 14389), (8349, 14257), (8995, 14251), (7396, 14399)]
         : compromised: 0.5916, honest: 0.6324
         : sketchguard stats = ['Node 0: acc_rate=0.167', 'Node 1: acc_rate=0.300', 'Node 2: acc_rate=0.200']...
Round 006: test acc mean=0.6090 ± 0.0496 | min=0.5036 max=0.6435
         : test loss mean=68.4945 ± 143.4640
         : individual accs = ['0.632237', '0.637092', '0.631221', '0.503622', '0.641733', '0.643498', '0.632371', '0.640993', '0.627396', '0.632784', '0.636921', '0.508321', '0.634457', '0.513508', '0.621369', '0.635568', '0.629439', '0.626920', '0.634552', '0.515800']
         : correct/total = [(8998, 14232), (9069, 14235), (9005, 14266), (7160, 14217), (9137, 14238), (9249, 14373), (9072, 14346), (9188, 14334), (8968, 14294), (9095, 14373), (9136, 14344), (7270, 14302), (9107, 14354), (7375, 14362), (8898, 14320), (9149, 14395), (9057, 14389), (8938, 14257), (9043, 14251), (7427, 14399)]
         : compromised: 0.6022, honest: 0.6361
         : sketchguard stats = ['Node 0: acc_rate=0.167', 'Node 1: acc_rate=0.278', 'Node 2: acc_rate=0.200']...
Round 007: test acc mean=0.6115 ± 0.0560 | min=0.4932 max=0.6452
         : test loss mean=224.8186 ± 480.5116
         : individual accs = ['0.645166', '0.644046', '0.634235', '0.506577', '0.643279', '0.644472', '0.636972', '0.643017', '0.627956', '0.641968', '0.634412', '0.503636', '0.642469', '0.493176', '0.634916', '0.640917', '0.638265', '0.638984', '0.640025', '0.496493']
         : correct/total = [(9182, 14232), (9168, 14235), (9048, 14266), (7202, 14217), (9159, 14238), (9263, 14373), (9138, 14346), (9217, 14334), (8976, 14294), (9227, 14373), (9100, 14344), (7203, 14302), (9222, 14354), (7083, 14362), (9092, 14320), (9226, 14395), (9184, 14389), (9110, 14257), (9121, 14251), (7149, 14399)]
         : compromised: 0.6038, honest: 0.6424
         : sketchguard stats = ['Node 0: acc_rate=0.167', 'Node 1: acc_rate=0.262', 'Node 2: acc_rate=0.200']...
Round 008: test acc mean=0.6162 ± 0.0534 | min=0.5064 max=0.6493
         : test loss mean=225.4367 ± 471.0970
         : individual accs = ['0.647625', '0.647137', '0.642437', '0.508898', '0.639064', '0.642246', '0.643036', '0.642528', '0.637540', '0.638976', '0.644799', '0.510558', '0.647346', '0.512255', '0.639106', '0.649323', '0.641115', '0.641860', '0.641499', '0.506355']
         : correct/total = [(9217, 14232), (9212, 14235), (9165, 14266), (7235, 14217), (9099, 14238), (9231, 14373), (9225, 14346), (9210, 14334), (9113, 14294), (9184, 14373), (9249, 14344), (7302, 14302), (9292, 14354), (7357, 14362), (9152, 14320), (9347, 14395), (9225, 14389), (9151, 14257), (9142, 14251), (7291, 14399)]
         : compromised: 0.6096, honest: 0.6426
         : sketchguard stats = ['Node 0: acc_rate=0.167', 'Node 1: acc_rate=0.250', 'Node 2: acc_rate=0.200']...
Round 009: test acc mean=0.6167 ± 0.0599 | min=0.4848 max=0.6535
         : test loss mean=217.7794 ± 446.0379
         : individual accs = ['0.653457', '0.652055', '0.644469', '0.484772', '0.647493', '0.650317', '0.646870', '0.647761', '0.642018', '0.643846', '0.648634', '0.495525', '0.648112', '0.495613', '0.634148', '0.651893', '0.646953', '0.643544', '0.642902', '0.514272']
         : correct/total = [(9300, 14232), (9282, 14235), (9194, 14266), (6892, 14217), (9219, 14238), (9347, 14373), (9280, 14346), (9285, 14334), (9177, 14294), (9254, 14373), (9304, 14344), (7087, 14302), (9303, 14354), (7118, 14362), (9081, 14320), (9384, 14395), (9309, 14389), (9175, 14257), (9162, 14251), (7405, 14399)]
         : compromised: 0.6087, honest: 0.6489
         : sketchguard stats = ['Node 0: acc_rate=0.167', 'Node 1: acc_rate=0.241', 'Node 2: acc_rate=0.200']...
Round 010: test acc mean=0.6180 ± 0.0612 | min=0.4863 max=0.6565
         : test loss mean=233.3696 ± 487.6396
         : individual accs = ['0.656478', '0.655497', '0.646783', '0.502497', '0.650162', '0.646490', '0.648334', '0.649714', '0.642088', '0.646907', '0.651074', '0.486296', '0.653546', '0.491366', '0.644623', '0.648767', '0.648064', '0.642702', '0.644235', '0.503993']
         : correct/total = [(9343, 14232), (9331, 14235), (9227, 14266), (7144, 14217), (9257, 14238), (9292, 14373), (9301, 14346), (9313, 14334), (9178, 14294), (9298, 14373), (9339, 14344), (6955, 14302), (9381, 14354), (7057, 14362), (9231, 14320), (9339, 14395), (9325, 14389), (9163, 14257), (9181, 14251), (7257, 14399)]
         : compromised: 0.6097, honest: 0.6511
         : sketchguard stats = ['Node 0: acc_rate=0.167', 'Node 1: acc_rate=0.233', 'Node 2: acc_rate=0.200']...

=== FINAL RESULTS ===
Dataset: sent140, Nodes: 20, Graph: erdos, Aggregation: sketchguard
Attack: gaussian, 80.0% compromised
Final accuracy - Compromised: 0.6097, Honest: 0.6511
Overall test accuracy: mean=0.6180 ± 0.0612

=== Sketchguard SUMMARY ===
Node 0: acceptance=0.167
Node 1: acceptance=0.233
Node 2: acceptance=0.200
Node 3: acceptance=0.500
Node 4: acceptance=0.250
Node 5: acceptance=0.200
Node 6: acceptance=0.200
Node 7: acceptance=0.200
Node 8: acceptance=0.500
Node 9: acceptance=0.333
Node 10: acceptance=0.250
Node 11: acceptance=0.500
Node 12: acceptance=0.329
Node 13: acceptance=0.500
Node 14: acceptance=0.143
Node 15: acceptance=0.167
Node 16: acceptance=0.200
Node 17: acceptance=0.280
Node 18: acceptance=0.250
Node 19: acceptance=0.500

=== PARALLEL EXECUTION TIME (realistic for distributed system) ===
  COMMUNICATION (max across nodes):
    - Sketch transfer: 0.000s (0.0%)
    - Model fetch (accepted): 0.000s (0.0%)
  COMPUTATION (max across nodes):
    - Sketching: 0.274s (95.5%)
    - Filtering: 0.001s (0.3%)
    - Aggregation: 0.012s (4.1%)
  TOTALS:
    - Total computation: 0.286s (100.0%)
    - Total communication: 0.000s (0.0%)
    - Total parallel time: 0.286s

=== PER-NODE AVERAGE TIME ===
  - Sketching: 0.193s
  - Filtering: 0.000s
  - Aggregation: 0.007s
  - Sketch transfer: 0.000s
  - Model fetch: 0.000s
  - Total per node: 0.201s

=== TOTAL COMPUTATIONAL WORK (sum across all nodes) ===
  - Total sketching: 3.860s
  - Total filtering: 0.008s
  - Total aggregation: 0.146s
  - Total sketch transfer: 0.000s
  - Total model fetch: 0.000s
  - Grand total: 4.014s
  - Mean acceptance rate: 0.295

Sketchguard Algorithm Properties:
  - Original dimension: 1,174,986
  - Sketch size: 180
  - Compression ratio: 19.9x
  - Single repetition: No repetitions needed
  - Theoretical complexity: O(d + N×k)
  - Approach: Sketch filtering + state aggregation
