Device: cuda
Seed: 987654321
Loading 1 LEAF Sent140 train files...
LEAF Sent140 train: 254555 users, 908652 samples
Building vocabulary (max_size=10000)...
Vocabulary size: 10000
Loading 1 LEAF Sent140 test files...
LEAF Sent140 test: 254555 users, 286281 samples
Found 254555 train users, 254555 test users, 254555 common users
User sample counts range: 494 (max) to 1 (min)
Distributed ALL 254555 users across 20 clients
Users per client: 12727 (with 15 clients getting +1 user)
Train partition sizes: [44353, 44290, 44657, 44907, 44696, 45843, 45801, 45619, 45069, 45639, 45821, 45311, 45779, 46056, 45625, 45984, 46428, 44737, 45540, 46497]
Test partition sizes: [14232, 14235, 14266, 14217, 14238, 14373, 14346, 14334, 14294, 14373, 14344, 14302, 14354, 14362, 14320, 14395, 14389, 14257, 14251, 14399]
  Client 0: 44353 train samples, 2 unique classes
  Client 1: 44290 train samples, 2 unique classes
  Client 2: 44657 train samples, 2 unique classes
  Client 3: 44907 train samples, 2 unique classes
  Client 4: 44696 train samples, 2 unique classes
  Client 5: 45843 train samples, 2 unique classes
  Client 6: 45801 train samples, 2 unique classes
  Client 7: 45619 train samples, 2 unique classes
  Client 8: 45069 train samples, 2 unique classes
  Client 9: 45639 train samples, 2 unique classes
  Client 10: 45821 train samples, 2 unique classes
  Client 11: 45311 train samples, 2 unique classes
  Client 12: 45779 train samples, 2 unique classes
  Client 13: 46056 train samples, 2 unique classes
  Client 14: 45625 train samples, 2 unique classes
  Client 15: 45984 train samples, 2 unique classes
  Client 16: 46428 train samples, 2 unique classes
  Client 17: 44737 train samples, 2 unique classes
  Client 18: 45540 train samples, 2 unique classes
  Client 19: 46497 train samples, 2 unique classes
Will sample 4500 samples per client per epoch
Graph: erdos, nodes: 20, edges: 126
Degree statistics: avg=12.60, min=8, max=16
Attack: Compromised 12/20 nodes: [1, 2, 3, 5, 8, 11, 12, 13, 14, 15, 17, 18]
Attack type: backdoor, lambda: 1.0
Backdoor target label: 1, trigger size: 3
Model variant: baseline
Model parameters: 1,174,986
BALANCE algorithm:
Balance Config: BALANCEConfig(gamma=2, kappa=1, alpha=0.5, min_neighbors=1)
  - Model dimension: 1,174,986 parameters
  - Complexity: O(N×d) = O(20×1,174,986)
Initial test acc across nodes: mean=0.4965 ± 0.0152
Backdoor attack: Created poisoned datasets for 12 compromised nodes
Round 001: test acc mean=0.4984 ± 0.0057 | min=0.4848 max=0.5077
         : test loss mean=22.3190 ± 18.9884
         : individual accs = ['0.496627', '0.501932', '0.484789', '0.499332', '0.498244', '0.495791', '0.487035', '0.501116', '0.496082', '0.503653', '0.492262', '0.500489', '0.501324', '0.507729', '0.499511', '0.501007', '0.505942', '0.504384', '0.491965', '0.498160']
         : correct/total = [(7068, 14232), (7145, 14235), (6916, 14266), (7099, 14217), (7094, 14238), (7126, 14373), (6987, 14346), (7183, 14334), (7091, 14294), (7239, 14373), (7061, 14344), (7158, 14302), (7196, 14354), (7292, 14362), (7153, 14320), (7212, 14395), (7280, 14389), (7191, 14257), (7011, 14251), (7173, 14399)]
         : compromised: 0.4987, honest: 0.4979
Round 002: test acc mean=0.5023 ± 0.0106 | min=0.4803 max=0.5287
         : test loss mean=792.8827 ± 657.0783
         : individual accs = ['0.508080', '0.506568', '0.506519', '0.506295', '0.518612', '0.503722', '0.480273', '0.484303', '0.499720', '0.496486', '0.493865', '0.504055', '0.494775', '0.502507', '0.493156', '0.501910', '0.528668', '0.500666', '0.502070', '0.513994']
         : correct/total = [(7231, 14232), (7211, 14235), (7226, 14266), (7198, 14217), (7384, 14238), (7240, 14373), (6890, 14346), (6942, 14334), (7143, 14294), (7136, 14373), (7084, 14344), (7209, 14302), (7102, 14354), (7217, 14362), (7062, 14320), (7225, 14395), (7607, 14389), (7138, 14257), (7155, 14251), (7401, 14399)]
         : compromised: 0.5018, honest: 0.5030
Round 003: test acc mean=0.5051 ± 0.0105 | min=0.4908 max=0.5356
         : test loss mean=50169.7173 ± 41485.1617
         : individual accs = ['0.499016', '0.494485', '0.490817', '0.500739', '0.535609', '0.498922', '0.496654', '0.512278', '0.498671', '0.508175', '0.511154', '0.506852', '0.500348', '0.512881', '0.503492', '0.493991', '0.525679', '0.500456', '0.505017', '0.507049']
         : correct/total = [(7102, 14232), (7039, 14235), (7002, 14266), (7119, 14217), (7626, 14238), (7171, 14373), (7125, 14346), (7343, 14334), (7128, 14294), (7304, 14373), (7332, 14344), (7249, 14302), (7182, 14354), (7366, 14362), (7210, 14320), (7111, 14395), (7564, 14389), (7135, 14257), (7197, 14251), (7301, 14399)]
         : compromised: 0.5006, honest: 0.5120
Round 004: test acc mean=0.5116 ± 0.0198 | min=0.4826 max=0.5540
         : test loss mean=6654477.6447 ± 5789732.2678
         : individual accs = ['0.530003', '0.514015', '0.503224', '0.482591', '0.540034', '0.504835', '0.505228', '0.536975', '0.489156', '0.532248', '0.554030', '0.484478', '0.504528', '0.509261', '0.484846', '0.501077', '0.511363', '0.499334', '0.510982', '0.534273']
         : correct/total = [(7543, 14232), (7317, 14235), (7179, 14266), (6861, 14217), (7689, 14238), (7256, 14373), (7248, 14346), (7697, 14334), (6992, 14294), (7650, 14373), (7947, 14344), (6929, 14302), (7242, 14354), (7314, 14362), (6943, 14320), (7213, 14395), (7358, 14389), (7119, 14257), (7282, 14251), (7693, 14399)]
         : compromised: 0.4990, honest: 0.5305
Round 005: test acc mean=0.5224 ± 0.0257 | min=0.4952 max=0.5667
         : test loss mean=378219517.4216 ± 313784267.0172
         : individual accs = ['0.557265', '0.502072', '0.506169', '0.495182', '0.547619', '0.498156', '0.526906', '0.564323', '0.497761', '0.566688', '0.560374', '0.499301', '0.508987', '0.515388', '0.500908', '0.508996', '0.534714', '0.498843', '0.503052', '0.554691']
         : correct/total = [(7931, 14232), (7147, 14235), (7221, 14266), (7040, 14217), (7797, 14238), (7160, 14373), (7559, 14346), (8089, 14334), (7115, 14294), (8145, 14373), (8038, 14344), (7141, 14302), (7306, 14354), (7402, 14362), (7173, 14320), (7327, 14395), (7694, 14389), (7112, 14257), (7169, 14251), (7987, 14399)]
         : compromised: 0.5029, honest: 0.5516
Round 006: test acc mean=0.5319 ± 0.0388 | min=0.4943 max=0.5890
         : test loss mean=29031475729.9783 ± 24034319229.7892
         : individual accs = ['0.578064', '0.499333', '0.500841', '0.498277', '0.570024', '0.501913', '0.569427', '0.581903', '0.494613', '0.588952', '0.586517', '0.494267', '0.505643', '0.507520', '0.497626', '0.504064', '0.574536', '0.502771', '0.499123', '0.582818']
         : correct/total = [(8227, 14232), (7108, 14235), (7145, 14266), (7084, 14217), (8116, 14238), (7214, 14373), (8169, 14346), (8341, 14334), (7070, 14294), (8465, 14373), (8413, 14344), (7069, 14302), (7258, 14354), (7289, 14362), (7126, 14320), (7256, 14395), (8267, 14389), (7168, 14257), (7113, 14251), (8392, 14399)]
         : compromised: 0.5005, honest: 0.5790
Round 007: test acc mean=0.5402 ± 0.0444 | min=0.4954 max=0.6013
         : test loss mean=2396180976523.3071 ± 1976330389034.8586
         : individual accs = ['0.590008', '0.501932', '0.504767', '0.497503', '0.589198', '0.508175', '0.592848', '0.597461', '0.495383', '0.601336', '0.597532', '0.504755', '0.510171', '0.513995', '0.498743', '0.507259', '0.586490', '0.503332', '0.504666', '0.599139']
         : correct/total = [(8397, 14232), (7145, 14235), (7201, 14266), (7073, 14217), (8389, 14238), (7304, 14373), (8505, 14346), (8564, 14334), (7081, 14294), (8643, 14373), (8571, 14344), (7219, 14302), (7323, 14354), (7382, 14362), (7142, 14320), (7302, 14395), (8439, 14389), (7176, 14257), (7192, 14251), (8627, 14399)]
         : compromised: 0.5042, honest: 0.5943
Round 008: test acc mean=0.5427 ± 0.0497 | min=0.4959 max=0.6078
         : test loss mean=200518090796747.0625 ± 166251477767148.4062
         : individual accs = ['0.601461', '0.496031', '0.499089', '0.498417', '0.603175', '0.506157', '0.601143', '0.607786', '0.496992', '0.606415', '0.604992', '0.502727', '0.504041', '0.509748', '0.495950', '0.503856', '0.598930', '0.503472', '0.510280', '0.603445']
         : correct/total = [(8560, 14232), (7061, 14235), (7120, 14266), (7086, 14217), (8588, 14238), (7275, 14373), (8624, 14346), (8712, 14334), (7104, 14294), (8716, 14373), (8678, 14344), (7190, 14302), (7235, 14354), (7321, 14362), (7102, 14320), (7253, 14395), (8618, 14389), (7178, 14257), (7272, 14251), (8689, 14399)]
         : compromised: 0.5022, honest: 0.6034
Round 009: test acc mean=0.5440 ± 0.0526 | min=0.4949 max=0.6114
         : test loss mean=16901467797097104.0000 ± 14063511830797064.0000
         : individual accs = ['0.604694', '0.504110', '0.502734', '0.500246', '0.606616', '0.504975', '0.608462', '0.610716', '0.494893', '0.611355', '0.608547', '0.495595', '0.498398', '0.509957', '0.502095', '0.502397', '0.607617', '0.498702', '0.499193', '0.608306']
         : correct/total = [(8606, 14232), (7176, 14235), (7172, 14266), (7112, 14217), (8637, 14238), (7258, 14373), (8729, 14346), (8754, 14334), (7074, 14294), (8787, 14373), (8729, 14344), (7088, 14302), (7154, 14354), (7324, 14362), (7190, 14320), (7232, 14395), (8743, 14389), (7110, 14257), (7114, 14251), (8759, 14399)]
         : compromised: 0.5011, honest: 0.6083
Round 010: test acc mean=0.5457 ± 0.0548 | min=0.4947 max=0.6163
         : test loss mean=1438267810082510592.0000 ± 1204243112190618112.0000
         : individual accs = ['0.608207', '0.503829', '0.499229', '0.500528', '0.612305', '0.505392', '0.610205', '0.616157', '0.496502', '0.612955', '0.613288', '0.496714', '0.497213', '0.509748', '0.494693', '0.510455', '0.611648', '0.497580', '0.500667', '0.616293']
         : correct/total = [(8656, 14232), (7172, 14235), (7122, 14266), (7116, 14217), (8718, 14238), (7264, 14373), (8754, 14346), (8832, 14334), (7097, 14294), (8810, 14373), (8797, 14344), (7104, 14302), (7137, 14354), (7321, 14362), (7084, 14320), (7348, 14395), (8801, 14389), (7094, 14257), (7135, 14251), (8874, 14399)]
         : compromised: 0.5010, honest: 0.6126

=== FINAL RESULTS ===
Dataset: sent140, Nodes: 20, Graph: erdos, Aggregation: balance
Attack: backdoor, 60.0% compromised
Final accuracy - Compromised: 0.5010, Honest: 0.6126
Overall test accuracy: mean=0.5457 ± 0.0548

=== BACKDOOR ATTACK SUCCESS RATE (ASR) ===
Target label: 1
Trigger size: 3x3
Overall ASR: 0.8082 ± 0.2255
Honest nodes ASR: 0.5328 ± 0.0269
Compromised nodes ASR: 0.9918 ± 0.0054
Note: Higher ASR indicates more successful backdoor attack

=== BALANCE SUMMARY ===
Node 0: acceptance=0.494
Node 1: acceptance=0.800
Node 2: acceptance=0.900
Node 3: acceptance=0.800
Node 4: acceptance=0.509
Node 5: acceptance=0.800
Node 6: acceptance=0.421
Node 7: acceptance=0.421
Node 8: acceptance=0.800
Node 9: acceptance=0.515
Node 10: acceptance=0.500
Node 11: acceptance=0.800
Node 12: acceptance=0.800
Node 13: acceptance=0.800
Node 14: acceptance=0.800
Node 15: acceptance=0.800
Node 16: acceptance=0.377
Node 17: acceptance=0.800
Node 18: acceptance=0.800
Node 19: acceptance=0.438

=== PARALLEL EXECUTION TIME (realistic for distributed system) ===
  COMMUNICATION (max across nodes):
    - Full model transfer: 0.000s (0.0%)
  COMPUTATION (max across nodes):
    - Filtering: 0.068s (81.0%)
    - Aggregation: 0.016s (19.0%)
  TOTALS:
    - Total computation: 0.084s (100.0%)
    - Total communication: 0.000s (0.0%)
    - Total parallel time: 0.084s

=== PER-NODE AVERAGE TIME ===
  - Filtering: 0.055s
  - Aggregation: 0.009s
  - Model transfer: 0.000s
  - Total per node: 0.064s

=== TOTAL COMPUTATIONAL WORK (sum across all nodes) ===
  - Total filtering: 1.095s
  - Total aggregation: 0.179s
  - Total model transfer: 0.000s
  - Grand total: 1.274s
  - Mean acceptance rate: 0.669

BALANCE Algorithm Properties:
  - Model dimension: 1,174,986
  - No compression: Full parameter comparison
  - Theoretical complexity: O(deg(i)×d)
  - Approach: Full parameter filtering + averaging
