Device: cuda
Seed: 987654321
Loading 1 LEAF Sent140 train files...
LEAF Sent140 train: 254555 users, 908652 samples
Building vocabulary (max_size=10000)...
Vocabulary size: 10000
Loading 1 LEAF Sent140 test files...
LEAF Sent140 test: 254555 users, 286281 samples
Found 254555 train users, 254555 test users, 254555 common users
User sample counts range: 494 (max) to 1 (min)
Distributed ALL 254555 users across 20 clients
Users per client: 12727 (with 15 clients getting +1 user)
Train partition sizes: [44353, 44290, 44657, 44907, 44696, 45843, 45801, 45619, 45069, 45639, 45821, 45311, 45779, 46056, 45625, 45984, 46428, 44737, 45540, 46497]
Test partition sizes: [14232, 14235, 14266, 14217, 14238, 14373, 14346, 14334, 14294, 14373, 14344, 14302, 14354, 14362, 14320, 14395, 14389, 14257, 14251, 14399]
  Client 0: 44353 train samples, 2 unique classes
  Client 1: 44290 train samples, 2 unique classes
  Client 2: 44657 train samples, 2 unique classes
  Client 3: 44907 train samples, 2 unique classes
  Client 4: 44696 train samples, 2 unique classes
  Client 5: 45843 train samples, 2 unique classes
  Client 6: 45801 train samples, 2 unique classes
  Client 7: 45619 train samples, 2 unique classes
  Client 8: 45069 train samples, 2 unique classes
  Client 9: 45639 train samples, 2 unique classes
  Client 10: 45821 train samples, 2 unique classes
  Client 11: 45311 train samples, 2 unique classes
  Client 12: 45779 train samples, 2 unique classes
  Client 13: 46056 train samples, 2 unique classes
  Client 14: 45625 train samples, 2 unique classes
  Client 15: 45984 train samples, 2 unique classes
  Client 16: 46428 train samples, 2 unique classes
  Client 17: 44737 train samples, 2 unique classes
  Client 18: 45540 train samples, 2 unique classes
  Client 19: 46497 train samples, 2 unique classes
Will sample 4500 samples per client per epoch
Graph: ring, nodes: 20, edges: 20
Degree statistics: avg=2.00, min=2, max=2
Attack: Compromised 8/20 nodes: [1, 5, 11, 12, 13, 14, 17, 18]
Attack type: krum, lambda: 1.0
Model variant: baseline
Model parameters: 1,174,986
UBAR ALGORITHM (Two-Stage Byzantine-resilient)
  - Model dimension: 1,174,986 parameters
  - Rho parameter: 0.6
  - Stage 1: Distance-based filtering (select 60% closest neighbors)
  - Stage 2: Performance-based selection (loss comparison)
  - Complexity: O(deg(i)×d + deg(i)×inference)
Initial test acc across nodes: mean=0.4965 ± 0.0152
Round 001: test acc mean=0.5274 ± 0.0160 | min=0.5013 max=0.5627
         : test loss mean=1.1693 ± 1.4817
         : individual accs = ['0.548974', '0.523147', '0.532174', '0.515017', '0.517980', '0.517846', '0.562666', '0.553858', '0.511613', '0.526473', '0.515965', '0.533562', '0.501254', '0.505152', '0.524860', '0.525669', '0.513239', '0.542050', '0.533226', '0.543649']
         : correct/total = [(7813, 14232), (7447, 14235), (7592, 14266), (7322, 14217), (7375, 14238), (7443, 14373), (8072, 14346), (7939, 14334), (7313, 14294), (7567, 14373), (7401, 14344), (7631, 14302), (7195, 14354), (7255, 14362), (7516, 14320), (7567, 14395), (7385, 14389), (7728, 14257), (7599, 14251), (7828, 14399)]
         : compromised: 0.5226, honest: 0.5306
         : ubar stats = ['Node 0: s1=0.500, s2=1.000', 'Node 1: s1=0.500, s2=1.000', 'Node 2: s1=0.500, s2=1.000']...
Round 002: test acc mean=0.5615 ± 0.0301 | min=0.4963 max=0.6111
         : test loss mean=0.9855 ± 0.9649
         : individual accs = ['0.590289', '0.561363', '0.532455', '0.560948', '0.560191', '0.555277', '0.611111', '0.607995', '0.576046', '0.583107', '0.585959', '0.550622', '0.496308', '0.497076', '0.530936', '0.559778', '0.557579', '0.548923', '0.574977', '0.588860']
         : correct/total = [(8401, 14232), (7991, 14235), (7596, 14266), (7975, 14217), (7976, 14238), (7981, 14373), (8767, 14346), (8715, 14334), (8234, 14294), (8381, 14373), (8405, 14344), (7875, 14302), (7124, 14354), (7139, 14362), (7603, 14320), (8058, 14395), (8023, 14389), (7826, 14257), (8194, 14251), (8479, 14399)]
         : compromised: 0.5394, honest: 0.5762
         : ubar stats = ['Node 0: s1=0.500, s2=1.000', 'Node 1: s1=0.500, s2=1.000', 'Node 2: s1=0.500, s2=1.000']...
Round 003: test acc mean=0.5849 ± 0.0340 | min=0.4895 max=0.6191
         : test loss mean=0.8483 ± 0.5375
         : individual accs = ['0.615936', '0.605760', '0.575354', '0.601955', '0.600295', '0.596813', '0.615712', '0.616227', '0.606618', '0.593752', '0.598369', '0.569641', '0.489480', '0.508286', '0.554818', '0.582494', '0.577663', '0.564004', '0.606484', '0.619140']
         : correct/total = [(8766, 14232), (8623, 14235), (8208, 14266), (8558, 14217), (8547, 14238), (8578, 14373), (8833, 14346), (8833, 14334), (8671, 14294), (8534, 14373), (8583, 14344), (8147, 14302), (7026, 14354), (7300, 14362), (7945, 14320), (8385, 14395), (8312, 14389), (8041, 14257), (8643, 14251), (8915, 14399)]
         : compromised: 0.5619, honest: 0.6003
         : ubar stats = ['Node 0: s1=0.500, s2=1.000', 'Node 1: s1=0.500, s2=1.000', 'Node 2: s1=0.500, s2=1.000']...
Round 004: test acc mean=0.6036 ± 0.0349 | min=0.5033 max=0.6295
         : test loss mean=0.7594 ± 0.3093
         : individual accs = ['0.625141', '0.622480', '0.612575', '0.614124', '0.609496', '0.628957', '0.625052', '0.624669', '0.621589', '0.619564', '0.618098', '0.604671', '0.503274', '0.506684', '0.587151', '0.599861', '0.598652', '0.595637', '0.625149', '0.629488']
         : correct/total = [(8897, 14232), (8861, 14235), (8739, 14266), (8731, 14217), (8678, 14238), (9040, 14373), (8967, 14346), (8954, 14334), (8885, 14294), (8905, 14373), (8866, 14344), (8648, 14302), (7224, 14354), (7277, 14362), (8408, 14320), (8635, 14395), (8614, 14389), (8492, 14257), (8909, 14251), (9064, 14399)]
         : compromised: 0.5843, honest: 0.6165
         : ubar stats = ['Node 0: s1=0.500, s2=1.000', 'Node 1: s1=0.500, s2=1.000', 'Node 2: s1=0.500, s2=1.000']...
Round 005: test acc mean=0.6120 ± 0.0375 | min=0.5033 max=0.6386
         : test loss mean=0.7674 ± 0.3596
         : individual accs = ['0.629075', '0.631261', '0.623020', '0.629739', '0.630215', '0.638628', '0.634951', '0.632552', '0.628446', '0.625896', '0.622281', '0.612012', '0.503692', '0.503342', '0.602514', '0.614172', '0.608103', '0.606930', '0.631885', '0.630530']
         : correct/total = [(8953, 14232), (8986, 14235), (8888, 14266), (8953, 14217), (8973, 14238), (9179, 14373), (9109, 14346), (9067, 14334), (8983, 14294), (8996, 14373), (8926, 14344), (8753, 14302), (7230, 14354), (7229, 14362), (8628, 14320), (8841, 14395), (8750, 14389), (8653, 14257), (9005, 14251), (9079, 14399)]
         : compromised: 0.5913, honest: 0.6257
         : ubar stats = ['Node 0: s1=0.500, s2=1.000', 'Node 1: s1=0.500, s2=1.000', 'Node 2: s1=0.500, s2=1.000']...
Round 006: test acc mean=0.6165 ± 0.0385 | min=0.5032 max=0.6396
         : test loss mean=0.7335 ± 0.2722
         : individual accs = ['0.634978', '0.638567', '0.634025', '0.638813', '0.636255', '0.637793', '0.639621', '0.636319', '0.627886', '0.631879', '0.625279', '0.628374', '0.508360', '0.503203', '0.602654', '0.611949', '0.607756', '0.613804', '0.634271', '0.638169']
         : correct/total = [(9037, 14232), (9090, 14235), (9045, 14266), (9082, 14217), (9059, 14238), (9167, 14373), (9176, 14346), (9121, 14334), (8975, 14294), (9082, 14373), (8969, 14344), (8987, 14302), (7297, 14354), (7227, 14362), (8630, 14320), (8809, 14395), (8745, 14389), (8751, 14257), (9039, 14251), (9189, 14399)]
         : compromised: 0.5959, honest: 0.6302
         : ubar stats = ['Node 0: s1=0.500, s2=1.000', 'Node 1: s1=0.500, s2=1.000', 'Node 2: s1=0.500, s2=1.000']...
Round 007: test acc mean=0.6231 ± 0.0383 | min=0.5104 max=0.6461
         : test loss mean=0.7418 ± 0.3148
         : individual accs = ['0.644463', '0.637794', '0.637460', '0.645706', '0.642927', '0.641828', '0.638506', '0.632622', '0.627536', '0.641341', '0.636015', '0.629982', '0.510868', '0.510375', '0.619483', '0.629177', '0.623532', '0.622642', '0.643744', '0.646087']
         : correct/total = [(9172, 14232), (9079, 14235), (9094, 14266), (9180, 14217), (9154, 14238), (9225, 14373), (9160, 14346), (9068, 14334), (8970, 14294), (9218, 14373), (9123, 14344), (9010, 14302), (7333, 14354), (7330, 14362), (8871, 14320), (9057, 14395), (8972, 14389), (8877, 14257), (9174, 14251), (9303, 14399)]
         : compromised: 0.6021, honest: 0.6371
         : ubar stats = ['Node 0: s1=0.500, s2=1.000', 'Node 1: s1=0.500, s2=1.000', 'Node 2: s1=0.500, s2=1.000']...
Round 008: test acc mean=0.6265 ± 0.0405 | min=0.5055 max=0.6473
         : test loss mean=0.7240 ± 0.2708
         : individual accs = ['0.645096', '0.641236', '0.642437', '0.645987', '0.643840', '0.640785', '0.642967', '0.637575', '0.641248', '0.643081', '0.636573', '0.637114', '0.506758', '0.505501', '0.630656', '0.636054', '0.631385', '0.629024', '0.645779', '0.647337']
         : correct/total = [(9181, 14232), (9128, 14235), (9165, 14266), (9184, 14217), (9167, 14238), (9210, 14373), (9224, 14346), (9139, 14334), (9166, 14294), (9243, 14373), (9131, 14344), (9112, 14302), (7274, 14354), (7260, 14362), (9031, 14320), (9156, 14395), (9085, 14389), (8968, 14257), (9203, 14251), (9321, 14399)]
         : compromised: 0.6046, honest: 0.6411
         : ubar stats = ['Node 0: s1=0.500, s2=1.000', 'Node 1: s1=0.500, s2=1.000', 'Node 2: s1=0.500, s2=1.000']...
Round 009: test acc mean=0.6293 ± 0.0401 | min=0.5084 max=0.6511
         : test loss mean=0.7306 ± 0.2982
         : individual accs = ['0.646852', '0.647418', '0.644610', '0.644580', '0.645807', '0.644472', '0.645685', '0.644342', '0.645516', '0.642246', '0.635597', '0.638302', '0.508360', '0.511628', '0.630307', '0.643348', '0.637084', '0.633093', '0.645849', '0.651087']
         : correct/total = [(9206, 14232), (9216, 14235), (9196, 14266), (9164, 14217), (9195, 14238), (9263, 14373), (9263, 14346), (9236, 14334), (9227, 14294), (9231, 14373), (9117, 14344), (9129, 14302), (7297, 14354), (7348, 14362), (9026, 14320), (9261, 14395), (9167, 14389), (9026, 14257), (9204, 14251), (9375, 14399)]
         : compromised: 0.6074, honest: 0.6439
         : ubar stats = ['Node 0: s1=0.500, s2=1.000', 'Node 1: s1=0.500, s2=1.000', 'Node 2: s1=0.500, s2=1.000']...
Round 010: test acc mean=0.6325 ± 0.0420 | min=0.5063 max=0.6528
         : test loss mean=0.7192 ± 0.2720
         : individual accs = ['0.651138', '0.652406', '0.647343', '0.651685', '0.652198', '0.645655', '0.646870', '0.645947', '0.650763', '0.644681', '0.640825', '0.641029', '0.508081', '0.506336', '0.640363', '0.645849', '0.638891', '0.638774', '0.648095', '0.652754']
         : correct/total = [(9267, 14232), (9287, 14235), (9235, 14266), (9265, 14217), (9286, 14238), (9280, 14373), (9280, 14346), (9259, 14334), (9302, 14294), (9266, 14373), (9192, 14344), (9168, 14302), (7293, 14354), (7272, 14362), (9170, 14320), (9297, 14395), (9193, 14389), (9107, 14257), (9236, 14251), (9399, 14399)]
         : compromised: 0.6101, honest: 0.6474
         : ubar stats = ['Node 0: s1=0.500, s2=1.000', 'Node 1: s1=0.500, s2=1.000', 'Node 2: s1=0.500, s2=1.000']...

=== FINAL RESULTS ===
Dataset: sent140, Nodes: 20, Graph: ring, Aggregation: ubar
Attack: krum, 40.0% compromised
Final accuracy - Compromised: 0.6101, Honest: 0.6474
Overall test accuracy: mean=0.6325 ± 0.0420

=== UBAR SUMMARY ===
Node 0: stage1=0.500, stage2=1.000, overall=0.500
Node 1: stage1=0.500, stage2=1.000, overall=0.500
Node 2: stage1=0.500, stage2=1.000, overall=0.500
Node 3: stage1=0.500, stage2=1.000, overall=0.500
Node 4: stage1=0.500, stage2=1.000, overall=0.500
Node 5: stage1=0.500, stage2=1.000, overall=0.500
Node 6: stage1=0.500, stage2=1.000, overall=0.500
Node 7: stage1=0.500, stage2=1.000, overall=0.500
Node 8: stage1=0.500, stage2=1.000, overall=0.500
Node 9: stage1=0.500, stage2=1.000, overall=0.500
Node 10: stage1=0.500, stage2=1.000, overall=0.500
Node 11: stage1=0.500, stage2=1.000, overall=0.500
Node 12: stage1=0.500, stage2=1.000, overall=0.500
Node 13: stage1=0.500, stage2=1.000, overall=0.500
Node 14: stage1=0.500, stage2=1.000, overall=0.500
Node 15: stage1=0.500, stage2=1.000, overall=0.500
Node 16: stage1=0.500, stage2=1.000, overall=0.500
Node 17: stage1=0.500, stage2=1.000, overall=0.500
Node 18: stage1=0.500, stage2=1.000, overall=0.500
Node 19: stage1=0.500, stage2=1.000, overall=0.500

=== PARALLEL EXECUTION TIME (realistic for distributed system) ===
  COMMUNICATION (max across nodes):
    - Full model transfer: 0.000s (0.1%)
  COMPUTATION (max across nodes):
    - Distance computation: 0.011s (38.4%)
    - Loss computation: 0.014s (49.3%)
    - Aggregation: 0.003s (12.2%)
  TOTALS:
    - Total computation: 0.028s (99.9%)
    - Total communication: 0.000s (0.1%)
    - Total parallel time: 0.028s

=== PER-NODE AVERAGE TIME ===
  - Distance computation: 0.009s
  - Loss computation: 0.009s
  - Aggregation: 0.003s
  - Model transfer: 0.000s
  - Total per node: 0.021s

=== TOTAL COMPUTATIONAL WORK (sum across all nodes) ===
  - Total distance computation: 0.179s
  - Total loss computation: 0.179s
  - Total aggregation: 0.066s
  - Total model transfer: 0.000s
  - Grand total: 0.424s
  - Mean Stage 1 acceptance rate: 0.500
  - Mean Stage 2 acceptance rate: 1.000
  - Overall acceptance rate: 0.500

UBAR Algorithm Properties:
  - Model dimension: 1,174,986
  - Rho parameter: 0.6
  - Two-stage approach: Distance filtering + loss evaluation
  - Stage 1 selects: 60% of neighbors
  - Stage 2 uses: Training sample loss comparison
  - Theoretical complexity: O(deg(i)×d + deg(i)×inference)
  - Approach: UBAR paper implementation
