Device: cuda
Seed: 987654321
Loading 1 LEAF Sent140 train files...
LEAF Sent140 train: 254555 users, 908652 samples
Building vocabulary (max_size=10000)...
Vocabulary size: 10000
Loading 1 LEAF Sent140 test files...
LEAF Sent140 test: 254555 users, 286281 samples
Found 254555 train users, 254555 test users, 254555 common users
User sample counts range: 494 (max) to 1 (min)
Distributed ALL 254555 users across 20 clients
Users per client: 12727 (with 15 clients getting +1 user)
Train partition sizes: [44353, 44290, 44657, 44907, 44696, 45843, 45801, 45619, 45069, 45639, 45821, 45311, 45779, 46056, 45625, 45984, 46428, 44737, 45540, 46497]
Test partition sizes: [14232, 14235, 14266, 14217, 14238, 14373, 14346, 14334, 14294, 14373, 14344, 14302, 14354, 14362, 14320, 14395, 14389, 14257, 14251, 14399]
  Client 0: 44353 train samples, 2 unique classes
  Client 1: 44290 train samples, 2 unique classes
  Client 2: 44657 train samples, 2 unique classes
  Client 3: 44907 train samples, 2 unique classes
  Client 4: 44696 train samples, 2 unique classes
  Client 5: 45843 train samples, 2 unique classes
  Client 6: 45801 train samples, 2 unique classes
  Client 7: 45619 train samples, 2 unique classes
  Client 8: 45069 train samples, 2 unique classes
  Client 9: 45639 train samples, 2 unique classes
  Client 10: 45821 train samples, 2 unique classes
  Client 11: 45311 train samples, 2 unique classes
  Client 12: 45779 train samples, 2 unique classes
  Client 13: 46056 train samples, 2 unique classes
  Client 14: 45625 train samples, 2 unique classes
  Client 15: 45984 train samples, 2 unique classes
  Client 16: 46428 train samples, 2 unique classes
  Client 17: 44737 train samples, 2 unique classes
  Client 18: 45540 train samples, 2 unique classes
  Client 19: 46497 train samples, 2 unique classes
Will sample 4500 samples per client per epoch
Graph: erdos, nodes: 20, edges: 48
Degree statistics: avg=4.80, min=2, max=7
Attack: Compromised 8/20 nodes: [1, 5, 11, 12, 13, 14, 17, 18]
Attack type: directed_deviation, lambda: 1.0
Model variant: baseline
Model parameters: 1,174,986
BALANCE algorithm:
Balance Config: BALANCEConfig(gamma=2, kappa=1, alpha=0.5, min_neighbors=1)
  - Model dimension: 1,174,986 parameters
  - Complexity: O(N×d) = O(20×1,174,986)
Initial test acc across nodes: mean=0.4965 ± 0.0152
Round 001: test acc mean=0.5020 ± 0.0116 | min=0.4847 max=0.5405
         : test loss mean=1.6710 ± 1.0397
         : individual accs = ['0.488758', '0.511486', '0.510234', '0.499613', '0.492063', '0.494260', '0.493657', '0.505790', '0.504058', '0.501426', '0.495817', '0.493148', '0.484673', '0.502019', '0.501327', '0.514206', '0.501425', '0.496318', '0.508245', '0.540524']
         : correct/total = [(6956, 14232), (7281, 14235), (7279, 14266), (7103, 14217), (7006, 14238), (7104, 14373), (7082, 14346), (7250, 14334), (7205, 14294), (7207, 14373), (7112, 14344), (7053, 14302), (6957, 14354), (7210, 14362), (7179, 14320), (7402, 14395), (7215, 14389), (7076, 14257), (7243, 14251), (7783, 14399)]
         : compromised: 0.4989, honest: 0.5040
Round 002: test acc mean=0.5079 ± 0.0123 | min=0.4862 max=0.5276
         : test loss mean=1.1962 ± 1.0510
         : individual accs = ['0.505832', '0.513874', '0.498598', '0.520082', '0.496769', '0.519237', '0.486198', '0.510465', '0.495103', '0.501913', '0.503555', '0.521885', '0.521109', '0.527573', '0.515852', '0.527197', '0.503162', '0.505997', '0.497439', '0.486353']
         : correct/total = [(7199, 14232), (7315, 14235), (7113, 14266), (7394, 14217), (7073, 14238), (7463, 14373), (6975, 14346), (7317, 14334), (7077, 14294), (7214, 14373), (7223, 14344), (7464, 14302), (7480, 14354), (7577, 14362), (7387, 14320), (7589, 14395), (7240, 14389), (7214, 14257), (7089, 14251), (7003, 14399)]
         : compromised: 0.5154, honest: 0.5029
Round 003: test acc mean=0.5197 ± 0.0215 | min=0.4842 max=0.5653
         : test loss mean=0.7131 ± 0.0388
         : individual accs = ['0.490163', '0.554408', '0.530492', '0.536681', '0.503933', '0.501496', '0.521260', '0.523929', '0.522247', '0.526056', '0.533882', '0.505733', '0.497631', '0.542264', '0.506634', '0.541160', '0.514351', '0.492530', '0.484177', '0.565317']
         : correct/total = [(6976, 14232), (7892, 14235), (7568, 14266), (7630, 14217), (7175, 14238), (7208, 14373), (7478, 14346), (7510, 14334), (7465, 14294), (7561, 14373), (7658, 14344), (7233, 14302), (7143, 14354), (7788, 14362), (7255, 14320), (7790, 14395), (7401, 14389), (7022, 14257), (6900, 14251), (8140, 14399)]
         : compromised: 0.5106, honest: 0.5258
Round 004: test acc mean=0.5360 ± 0.0234 | min=0.5009 max=0.5927
         : test loss mean=0.6919 ± 0.0103
         : individual accs = ['0.527965', '0.565227', '0.547385', '0.554055', '0.534204', '0.511375', '0.508365', '0.567322', '0.547852', '0.523969', '0.555912', '0.533282', '0.500906', '0.539340', '0.505587', '0.532685', '0.523247', '0.542821', '0.505649', '0.592680']
         : correct/total = [(7514, 14232), (8046, 14235), (7809, 14266), (7877, 14217), (7606, 14238), (7350, 14373), (7293, 14346), (8132, 14334), (7831, 14294), (7531, 14373), (7974, 14344), (7627, 14302), (7190, 14354), (7746, 14362), (7240, 14320), (7668, 14395), (7529, 14389), (7739, 14257), (7206, 14251), (8534, 14399)]
         : compromised: 0.5255, honest: 0.5430
Round 005: test acc mean=0.5519 ± 0.0271 | min=0.5048 max=0.5953
         : test loss mean=0.6840 ± 0.0077
         : individual accs = ['0.550660', '0.553354', '0.538553', '0.578462', '0.583298', '0.579698', '0.522654', '0.595298', '0.563103', '0.536840', '0.575084', '0.519787', '0.504807', '0.554588', '0.547975', '0.515943', '0.545347', '0.580837', '0.507824', '0.583096']
         : correct/total = [(7837, 14232), (7877, 14235), (7683, 14266), (8224, 14217), (8305, 14238), (8332, 14373), (7498, 14346), (8533, 14334), (8049, 14294), (7716, 14373), (8249, 14344), (7434, 14302), (7246, 14354), (7965, 14362), (7847, 14320), (7427, 14395), (7847, 14389), (8281, 14257), (7237, 14251), (8396, 14399)]
         : compromised: 0.5436, honest: 0.5574
Round 006: test acc mean=0.5675 ± 0.0288 | min=0.4922 max=0.6074
         : test loss mean=0.6785 ± 0.0099
         : individual accs = ['0.577993', '0.528908', '0.571569', '0.577126', '0.603526', '0.606763', '0.538478', '0.607367', '0.582482', '0.556182', '0.593140', '0.558593', '0.546259', '0.567400', '0.492249', '0.554359', '0.574606', '0.593954', '0.533857', '0.585110']
         : correct/total = [(8226, 14232), (7529, 14235), (8154, 14266), (8205, 14217), (8593, 14238), (8721, 14373), (7725, 14346), (8706, 14334), (8326, 14294), (7994, 14373), (8508, 14344), (7989, 14302), (7841, 14354), (8149, 14362), (7049, 14320), (7980, 14395), (8268, 14389), (8468, 14257), (7608, 14251), (8425, 14399)]
         : compromised: 0.5535, honest: 0.5768
Round 007: test acc mean=0.5837 ± 0.0237 | min=0.5198 max=0.6160
         : test loss mean=0.6725 ± 0.0100
         : individual accs = ['0.589025', '0.519775', '0.572480', '0.592530', '0.615957', '0.611911', '0.558553', '0.612390', '0.596264', '0.581298', '0.596695', '0.579779', '0.598230', '0.577496', '0.534358', '0.585759', '0.588644', '0.604896', '0.571609', '0.586638']
         : correct/total = [(8383, 14232), (7399, 14235), (8167, 14266), (8424, 14217), (8770, 14238), (8795, 14373), (8013, 14346), (8778, 14334), (8523, 14294), (8355, 14373), (8559, 14344), (8292, 14302), (8587, 14354), (8294, 14362), (7652, 14320), (8432, 14395), (8470, 14389), (8624, 14257), (8146, 14251), (8447, 14399)]
         : compromised: 0.5748, honest: 0.5897
Round 008: test acc mean=0.5972 ± 0.0153 | min=0.5644 max=0.6203
         : test loss mean=0.6663 ± 0.0088
         : individual accs = ['0.592116', '0.564384', '0.580822', '0.598720', '0.617502', '0.620330', '0.573470', '0.618808', '0.604869', '0.592500', '0.609175', '0.586002', '0.599066', '0.600752', '0.572975', '0.608336', '0.603586', '0.609595', '0.590695', '0.599972']
         : correct/total = [(8427, 14232), (8034, 14235), (8286, 14266), (8512, 14217), (8792, 14238), (8916, 14373), (8227, 14346), (8870, 14334), (8646, 14294), (8516, 14373), (8738, 14344), (8381, 14302), (8599, 14354), (8628, 14362), (8205, 14320), (8757, 14395), (8685, 14389), (8691, 14257), (8418, 14251), (8639, 14399)]
         : compromised: 0.5930, honest: 0.6000
Round 009: test acc mean=0.6069 ± 0.0120 | min=0.5767 max=0.6255
         : test loss mean=0.6607 ± 0.0075
         : individual accs = ['0.607083', '0.592624', '0.595892', '0.603714', '0.624526', '0.623809', '0.594800', '0.625506', '0.615503', '0.608780', '0.611266', '0.599846', '0.606033', '0.613772', '0.576746', '0.615561', '0.609424', '0.616329', '0.593151', '0.603028']
         : correct/total = [(8640, 14232), (8436, 14235), (8501, 14266), (8583, 14217), (8892, 14238), (8966, 14373), (8533, 14346), (8966, 14334), (8798, 14294), (8750, 14373), (8768, 14344), (8579, 14302), (8699, 14354), (8815, 14362), (8259, 14320), (8861, 14395), (8769, 14389), (8787, 14257), (8453, 14251), (8683, 14399)]
         : compromised: 0.6028, honest: 0.6096
Round 010: test acc mean=0.6158 ± 0.0075 | min=0.5994 max=0.6308
         : test loss mean=0.6553 ± 0.0056
         : individual accs = ['0.612423', '0.616017', '0.599397', '0.615953', '0.630847', '0.618938', '0.608741', '0.627948', '0.618861', '0.617338', '0.620817', '0.613271', '0.613488', '0.622476', '0.601047', '0.618826', '0.615679', '0.622571', '0.610764', '0.610251']
         : correct/total = [(8716, 14232), (8769, 14235), (8551, 14266), (8757, 14217), (8982, 14238), (8896, 14373), (8733, 14346), (9001, 14334), (8846, 14294), (8873, 14373), (8905, 14344), (8771, 14302), (8806, 14354), (8940, 14362), (8607, 14320), (8908, 14395), (8859, 14389), (8876, 14257), (8704, 14251), (8787, 14399)]
         : compromised: 0.6148, honest: 0.6164

=== FINAL RESULTS ===
Dataset: sent140, Nodes: 20, Graph: erdos, Aggregation: balance
Attack: directed_deviation, 40.0% compromised
Final accuracy - Compromised: 0.6148, Honest: 0.6164
Overall test accuracy: mean=0.6158 ± 0.0075

=== BALANCE SUMMARY ===
Node 0: acceptance=0.850
Node 1: acceptance=0.633
Node 2: acceptance=0.460
Node 3: acceptance=0.550
Node 4: acceptance=0.400
Node 5: acceptance=0.360
Node 6: acceptance=0.640
Node 7: acceptance=0.640
Node 8: acceptance=0.600
Node 9: acceptance=0.700
Node 10: acceptance=0.550
Node 11: acceptance=0.457
Node 12: acceptance=0.714
Node 13: acceptance=0.550
Node 14: acceptance=0.443
Node 15: acceptance=0.400
Node 16: acceptance=0.360
Node 17: acceptance=0.480
Node 18: acceptance=0.575
Node 19: acceptance=1.000

=== PARALLEL EXECUTION TIME (realistic for distributed system) ===
  COMMUNICATION (max across nodes):
    - Full model transfer: 0.000s (0.0%)
  COMPUTATION (max across nodes):
    - Filtering: 0.035s (73.6%)
    - Aggregation: 0.013s (26.3%)
  TOTALS:
    - Total computation: 0.047s (100.0%)
    - Total communication: 0.000s (0.0%)
    - Total parallel time: 0.047s

=== PER-NODE AVERAGE TIME ===
  - Filtering: 0.024s
  - Aggregation: 0.006s
  - Model transfer: 0.000s
  - Total per node: 0.029s

=== TOTAL COMPUTATIONAL WORK (sum across all nodes) ===
  - Total filtering: 0.475s
  - Total aggregation: 0.111s
  - Total model transfer: 0.000s
  - Grand total: 0.586s
  - Mean acceptance rate: 0.568

BALANCE Algorithm Properties:
  - Model dimension: 1,174,986
  - No compression: Full parameter comparison
  - Theoretical complexity: O(deg(i)×d)
  - Approach: Full parameter filtering + averaging
