Device: cuda
Seed: 987654321
Loading 1 LEAF Sent140 train files...
LEAF Sent140 train: 254555 users, 908652 samples
Building vocabulary (max_size=10000)...
Vocabulary size: 10000
Loading 1 LEAF Sent140 test files...
LEAF Sent140 test: 254555 users, 286281 samples
Found 254555 train users, 254555 test users, 254555 common users
User sample counts range: 494 (max) to 1 (min)
Distributed ALL 254555 users across 20 clients
Users per client: 12727 (with 15 clients getting +1 user)
Train partition sizes: [44353, 44290, 44657, 44907, 44696, 45843, 45801, 45619, 45069, 45639, 45821, 45311, 45779, 46056, 45625, 45984, 46428, 44737, 45540, 46497]
Test partition sizes: [14232, 14235, 14266, 14217, 14238, 14373, 14346, 14334, 14294, 14373, 14344, 14302, 14354, 14362, 14320, 14395, 14389, 14257, 14251, 14399]
  Client 0: 44353 train samples, 2 unique classes
  Client 1: 44290 train samples, 2 unique classes
  Client 2: 44657 train samples, 2 unique classes
  Client 3: 44907 train samples, 2 unique classes
  Client 4: 44696 train samples, 2 unique classes
  Client 5: 45843 train samples, 2 unique classes
  Client 6: 45801 train samples, 2 unique classes
  Client 7: 45619 train samples, 2 unique classes
  Client 8: 45069 train samples, 2 unique classes
  Client 9: 45639 train samples, 2 unique classes
  Client 10: 45821 train samples, 2 unique classes
  Client 11: 45311 train samples, 2 unique classes
  Client 12: 45779 train samples, 2 unique classes
  Client 13: 46056 train samples, 2 unique classes
  Client 14: 45625 train samples, 2 unique classes
  Client 15: 45984 train samples, 2 unique classes
  Client 16: 46428 train samples, 2 unique classes
  Client 17: 44737 train samples, 2 unique classes
  Client 18: 45540 train samples, 2 unique classes
  Client 19: 46497 train samples, 2 unique classes
Will sample 4500 samples per client per epoch
Graph: erdos, nodes: 20, edges: 99
Degree statistics: avg=9.90, min=7, max=14
Attack: Compromised 14/20 nodes: [1, 2, 3, 5, 6, 8, 11, 12, 13, 14, 15, 17, 18, 19]
Attack type: backdoor, lambda: 1.0
Backdoor target label: 1, trigger size: 3
Model variant: baseline
Model parameters: 1,174,986
Initial test acc across nodes: mean=0.4965 ± 0.0152
Backdoor attack: Created poisoned datasets for 14 compromised nodes
Round 001: test acc mean=0.5010 ± 0.0066 | min=0.4878 max=0.5137
         : test loss mean=12.6975 ± 6.1390
         : individual accs = ['0.511172', '0.490762', '0.487803', '0.494830', '0.497682', '0.513671', '0.496933', '0.509907', '0.495872', '0.500591', '0.498048', '0.501888', '0.507454', '0.495683', '0.506844', '0.506495', '0.500452', '0.500386', '0.504526', '0.499132']
         : correct/total = [(7275, 14232), (6986, 14235), (6959, 14266), (7035, 14217), (7086, 14238), (7383, 14373), (7129, 14346), (7309, 14334), (7088, 14294), (7195, 14373), (7144, 14344), (7178, 14302), (7284, 14354), (7119, 14362), (7258, 14320), (7291, 14395), (7201, 14389), (7134, 14257), (7190, 14251), (7187, 14399)]
         : compromised: 0.5002, honest: 0.5030
Round 002: test acc mean=0.5047 ± 0.0056 | min=0.4900 max=0.5138
         : test loss mean=31.9698 ± 11.5215
         : individual accs = ['0.511594', '0.511556', '0.513809', '0.501372', '0.502248', '0.506366', '0.500279', '0.505860', '0.510144', '0.506366', '0.501255', '0.508600', '0.501324', '0.490043', '0.504469', '0.506217', '0.498575', '0.498071', '0.510280', '0.506216']
         : correct/total = [(7281, 14232), (7282, 14235), (7330, 14266), (7128, 14217), (7151, 14238), (7278, 14373), (7177, 14346), (7251, 14334), (7292, 14294), (7278, 14373), (7190, 14344), (7274, 14302), (7196, 14354), (7038, 14362), (7224, 14320), (7287, 14395), (7174, 14389), (7101, 14257), (7272, 14251), (7289, 14399)]
         : compromised: 0.5049, honest: 0.5043
Round 003: test acc mean=0.5051 ± 0.0056 | min=0.4914 max=0.5139
         : test loss mean=23.1694 ± 4.2618
         : individual accs = ['0.510891', '0.513734', '0.513949', '0.507772', '0.505900', '0.506157', '0.502440', '0.504814', '0.511543', '0.506992', '0.500976', '0.507971', '0.500488', '0.491436', '0.504190', '0.501633', '0.500243', '0.496949', '0.511262', '0.503646']
         : correct/total = [(7271, 14232), (7313, 14235), (7332, 14266), (7219, 14217), (7203, 14238), (7275, 14373), (7208, 14346), (7236, 14334), (7312, 14294), (7287, 14373), (7186, 14344), (7265, 14302), (7184, 14354), (7058, 14362), (7220, 14320), (7221, 14395), (7198, 14389), (7085, 14257), (7286, 14251), (7252, 14399)]
         : compromised: 0.5052, honest: 0.5050
Round 004: test acc mean=0.4961 ± 0.0054 | min=0.4851 max=0.5088
         : test loss mean=13.9075 ± 7.5664
         : individual accs = ['0.494309', '0.490762', '0.485069', '0.496026', '0.489605', '0.495791', '0.499094', '0.496442', '0.490276', '0.496139', '0.495468', '0.493078', '0.502926', '0.508843', '0.494763', '0.499201', '0.500313', '0.504875', '0.491895', '0.496354']
         : correct/total = [(7035, 14232), (6986, 14235), (6920, 14266), (7052, 14217), (6971, 14238), (7126, 14373), (7160, 14346), (7116, 14334), (7008, 14294), (7131, 14373), (7107, 14344), (7052, 14302), (7219, 14354), (7308, 14362), (7085, 14320), (7186, 14395), (7199, 14389), (7198, 14257), (7010, 14251), (7147, 14399)]
         : compromised: 0.4964, honest: 0.4954
Round 005: test acc mean=0.4949 ± 0.0056 | min=0.4860 max=0.5086
         : test loss mean=15.3419 ± 0.7803
         : individual accs = ['0.489179', '0.486266', '0.485981', '0.492298', '0.494171', '0.493843', '0.497630', '0.495396', '0.488597', '0.492938', '0.499024', '0.492239', '0.499582', '0.508564', '0.495601', '0.498506', '0.499757', '0.503191', '0.488808', '0.496284']
         : correct/total = [(6962, 14232), (6922, 14235), (6933, 14266), (6999, 14217), (7036, 14238), (7098, 14373), (7139, 14346), (7101, 14334), (6984, 14294), (7085, 14373), (7158, 14344), (7040, 14302), (7171, 14354), (7304, 14362), (7097, 14320), (7176, 14395), (7191, 14389), (7174, 14257), (6966, 14251), (7146, 14399)]
         : compromised: 0.4948, honest: 0.4951
Round 006: test acc mean=0.4991 ± 0.0061 | min=0.4821 max=0.5092
         : test loss mean=6.0102 ± 3.3507
         : individual accs = ['0.494730', '0.504812', '0.506028', '0.502005', '0.494873', '0.503583', '0.502649', '0.497628', '0.509235', '0.493077', '0.498675', '0.501678', '0.494914', '0.492411', '0.499441', '0.495241', '0.482104', '0.504735', '0.504947', '0.499826']
         : correct/total = [(7041, 14232), (7186, 14235), (7219, 14266), (7137, 14217), (7046, 14238), (7238, 14373), (7211, 14346), (7133, 14334), (7279, 14294), (7087, 14373), (7153, 14344), (7175, 14302), (7104, 14354), (7072, 14362), (7152, 14320), (7129, 14395), (6937, 14389), (7196, 14257), (7196, 14251), (7197, 14399)]
         : compromised: 0.5015, honest: 0.4935
Round 007: test acc mean=0.5050 ± 0.0052 | min=0.4945 max=0.5143
         : test loss mean=5.1502 ± 0.8702
         : individual accs = ['0.509837', '0.514296', '0.510304', '0.505451', '0.504355', '0.504279', '0.506483', '0.503907', '0.513152', '0.507271', '0.500627', '0.502657', '0.502856', '0.498886', '0.504260', '0.499062', '0.498923', '0.494494', '0.513227', '0.505452']
         : correct/total = [(7256, 14232), (7321, 14235), (7280, 14266), (7186, 14217), (7181, 14238), (7248, 14373), (7266, 14346), (7223, 14334), (7335, 14294), (7291, 14373), (7181, 14344), (7189, 14302), (7218, 14354), (7165, 14362), (7221, 14320), (7184, 14395), (7179, 14389), (7050, 14257), (7314, 14251), (7278, 14399)]
         : compromised: 0.5053, honest: 0.5042
Round 008: test acc mean=0.5006 ± 0.0064 | min=0.4917 max=0.5137
         : test loss mean=4.4952 ± 1.0658
         : individual accs = ['0.500913', '0.513734', '0.503295', '0.493142', '0.500140', '0.511932', '0.497560', '0.499512', '0.492025', '0.499061', '0.506762', '0.491679', '0.503274', '0.493107', '0.500489', '0.512053', '0.496421', '0.495686', '0.499053', '0.503021']
         : correct/total = [(7129, 14232), (7313, 14235), (7180, 14266), (7011, 14217), (7121, 14238), (7358, 14373), (7138, 14346), (7160, 14334), (7033, 14294), (7173, 14373), (7269, 14344), (7032, 14302), (7224, 14354), (7082, 14362), (7167, 14320), (7371, 14395), (7143, 14389), (7067, 14257), (7112, 14251), (7243, 14399)]
         : compromised: 0.5007, honest: 0.5005
Round 009: test acc mean=0.5011 ± 0.0043 | min=0.4924 max=0.5098
         : test loss mean=2.8728 ± 0.4886
         : individual accs = ['0.503162', '0.496242', '0.497547', '0.500528', '0.504003', '0.497461', '0.501185', '0.505442', '0.505037', '0.497948', '0.509760', '0.495455', '0.505364', '0.505779', '0.503142', '0.503856', '0.501077', '0.500947', '0.496176', '0.492395']
         : correct/total = [(7161, 14232), (7064, 14235), (7098, 14266), (7116, 14217), (7176, 14238), (7150, 14373), (7190, 14346), (7245, 14334), (7219, 14294), (7157, 14373), (7312, 14344), (7086, 14302), (7254, 14354), (7264, 14362), (7205, 14320), (7253, 14395), (7210, 14389), (7142, 14257), (7071, 14251), (7090, 14399)]
         : compromised: 0.5001, honest: 0.5036
Round 010: test acc mean=0.5006 ± 0.0081 | min=0.4809 max=0.5155
         : test loss mean=2.8900 ± 1.6778
         : individual accs = ['0.510750', '0.515490', '0.495794', '0.505522', '0.497331', '0.497878', '0.489474', '0.512348', '0.502239', '0.499269', '0.496235', '0.494476', '0.507803', '0.480922', '0.504050', '0.508163', '0.500452', '0.503472', '0.492246', '0.497951']
         : correct/total = [(7269, 14232), (7338, 14235), (7073, 14266), (7187, 14217), (7081, 14238), (7156, 14373), (7022, 14346), (7344, 14334), (7179, 14294), (7176, 14373), (7118, 14344), (7072, 14302), (7289, 14354), (6907, 14362), (7218, 14320), (7315, 14395), (7201, 14389), (7178, 14257), (7015, 14251), (7170, 14399)]
         : compromised: 0.4997, honest: 0.5027

=== FINAL RESULTS ===
Dataset: sent140, Nodes: 20, Graph: erdos, Aggregation: krum
Attack: backdoor, 70.0% compromised
Final accuracy - Compromised: 0.4997, Honest: 0.5027
Overall test accuracy: mean=0.5006 ± 0.0081

=== BACKDOOR ATTACK SUCCESS RATE (ASR) ===
Target label: 1
Trigger size: 3x3
Overall ASR: 0.3865 ± 0.1045
Honest nodes ASR: 0.3782 ± 0.0922
Compromised nodes ASR: 0.3901 ± 0.1092
Note: Higher ASR indicates more successful backdoor attack
