Device: cuda
Seed: 987654321
Loading 1 LEAF Sent140 train files...
LEAF Sent140 train: 254555 users, 908652 samples
Building vocabulary (max_size=10000)...
Vocabulary size: 10000
Loading 1 LEAF Sent140 test files...
LEAF Sent140 test: 254555 users, 286281 samples
Found 254555 train users, 254555 test users, 254555 common users
User sample counts range: 494 (max) to 1 (min)
Distributed ALL 254555 users across 20 clients
Users per client: 12727 (with 15 clients getting +1 user)
Train partition sizes: [44353, 44290, 44657, 44907, 44696, 45843, 45801, 45619, 45069, 45639, 45821, 45311, 45779, 46056, 45625, 45984, 46428, 44737, 45540, 46497]
Test partition sizes: [14232, 14235, 14266, 14217, 14238, 14373, 14346, 14334, 14294, 14373, 14344, 14302, 14354, 14362, 14320, 14395, 14389, 14257, 14251, 14399]
  Client 0: 44353 train samples, 2 unique classes
  Client 1: 44290 train samples, 2 unique classes
  Client 2: 44657 train samples, 2 unique classes
  Client 3: 44907 train samples, 2 unique classes
  Client 4: 44696 train samples, 2 unique classes
  Client 5: 45843 train samples, 2 unique classes
  Client 6: 45801 train samples, 2 unique classes
  Client 7: 45619 train samples, 2 unique classes
  Client 8: 45069 train samples, 2 unique classes
  Client 9: 45639 train samples, 2 unique classes
  Client 10: 45821 train samples, 2 unique classes
  Client 11: 45311 train samples, 2 unique classes
  Client 12: 45779 train samples, 2 unique classes
  Client 13: 46056 train samples, 2 unique classes
  Client 14: 45625 train samples, 2 unique classes
  Client 15: 45984 train samples, 2 unique classes
  Client 16: 46428 train samples, 2 unique classes
  Client 17: 44737 train samples, 2 unique classes
  Client 18: 45540 train samples, 2 unique classes
  Client 19: 46497 train samples, 2 unique classes
Will sample 4500 samples per client per epoch
Graph: erdos, nodes: 20, edges: 99
Degree statistics: avg=9.90, min=7, max=14
Attack: Compromised 4/20 nodes: [5, 12, 13, 17]
Attack type: directed_deviation, lambda: 1.0
Model variant: baseline
Model parameters: 1,174,986
BALANCE algorithm:
Balance Config: BALANCEConfig(gamma=2, kappa=1, alpha=0.5, min_neighbors=1)
  - Model dimension: 1,174,986 parameters
  - Complexity: O(N×d) = O(20×1,174,986)
Initial test acc across nodes: mean=0.4965 ± 0.0152
Round 001: test acc mean=0.5078 ± 0.0249 | min=0.4846 max=0.5882
         : test loss mean=0.8017 ± 0.1400
         : individual accs = ['0.487282', '0.512750', '0.522781', '0.506647', '0.510395', '0.498991', '0.484595', '0.486536', '0.510424', '0.588186', '0.498466', '0.501259', '0.503971', '0.559462', '0.491201', '0.510733', '0.490653', '0.514554', '0.489229', '0.487673']
         : correct/total = [(6935, 14232), (7299, 14235), (7458, 14266), (7203, 14217), (7267, 14238), (7172, 14373), (6952, 14346), (6974, 14334), (7296, 14294), (8454, 14373), (7150, 14344), (7169, 14302), (7234, 14354), (8035, 14362), (7034, 14320), (7352, 14395), (7060, 14389), (7336, 14257), (6972, 14251), (7022, 14399)]
         : compromised: 0.5192, honest: 0.5049
Round 002: test acc mean=0.5101 ± 0.0129 | min=0.4859 max=0.5360
         : test loss mean=0.6948 ± 0.0090
         : individual accs = ['0.515739', '0.514015', '0.485911', '0.508124', '0.535960', '0.520003', '0.502021', '0.502093', '0.524486', '0.493008', '0.528165', '0.532233', '0.500488', '0.508564', '0.497346', '0.505523', '0.508027', '0.500456', '0.517297', '0.503438']
         : correct/total = [(7340, 14232), (7317, 14235), (6932, 14266), (7224, 14217), (7631, 14238), (7474, 14373), (7202, 14346), (7197, 14334), (7497, 14294), (7086, 14373), (7576, 14344), (7612, 14302), (7184, 14354), (7304, 14362), (7122, 14320), (7277, 14395), (7310, 14389), (7135, 14257), (7372, 14251), (7249, 14399)]
         : compromised: 0.5074, honest: 0.5108
Round 003: test acc mean=0.5113 ± 0.0188 | min=0.4861 max=0.5608
         : test loss mean=0.6926 ± 0.0008
         : individual accs = ['0.517004', '0.531788', '0.486051', '0.492439', '0.521562', '0.494399', '0.501115', '0.554974', '0.510494', '0.493008', '0.516104', '0.560761', '0.499303', '0.508564', '0.507821', '0.502466', '0.502050', '0.503051', '0.514420', '0.507674']
         : correct/total = [(7358, 14232), (7570, 14235), (6934, 14266), (7001, 14217), (7426, 14238), (7106, 14373), (7189, 14346), (7955, 14334), (7297, 14294), (7086, 14373), (7403, 14344), (8020, 14302), (7167, 14354), (7304, 14362), (7272, 14320), (7233, 14395), (7224, 14389), (7172, 14257), (7331, 14251), (7310, 14399)]
         : compromised: 0.5013, honest: 0.5137
Round 004: test acc mean=0.5042 ± 0.0190 | min=0.4860 max=0.5610
         : test loss mean=0.6929 ± 0.0005
         : individual accs = ['0.490795', '0.485985', '0.486051', '0.492228', '0.494030', '0.493843', '0.497560', '0.495326', '0.513782', '0.493008', '0.514919', '0.537967', '0.499512', '0.508564', '0.495810', '0.499340', '0.533533', '0.503051', '0.488597', '0.561011']
         : correct/total = [(6985, 14232), (6918, 14235), (6934, 14266), (6998, 14217), (7034, 14238), (7098, 14373), (7138, 14346), (7100, 14334), (7344, 14294), (7086, 14373), (7386, 14344), (7694, 14302), (7170, 14354), (7304, 14362), (7100, 14320), (7188, 14395), (7677, 14389), (7172, 14257), (6963, 14251), (8078, 14399)]
         : compromised: 0.5012, honest: 0.5050
Round 005: test acc mean=0.4948 ± 0.0056 | min=0.4861 max=0.5086
         : test loss mean=0.6934 ± 0.0004
         : individual accs = ['0.489109', '0.486266', '0.486051', '0.492228', '0.494100', '0.493843', '0.497560', '0.495186', '0.488107', '0.493008', '0.499024', '0.492029', '0.499512', '0.508564', '0.495810', '0.498367', '0.499757', '0.503051', '0.488738', '0.496562']
         : correct/total = [(6961, 14232), (6922, 14235), (6934, 14266), (6998, 14217), (7035, 14238), (7098, 14373), (7138, 14346), (7098, 14334), (6977, 14294), (7086, 14373), (7158, 14344), (7037, 14302), (7170, 14354), (7304, 14362), (7100, 14320), (7174, 14395), (7191, 14389), (7172, 14257), (6965, 14251), (7150, 14399)]
         : compromised: 0.5012, honest: 0.4932
Round 006: test acc mean=0.4948 ± 0.0056 | min=0.4861 max=0.5086
         : test loss mean=0.6936 ± 0.0003
         : individual accs = ['0.489109', '0.486266', '0.486051', '0.492228', '0.494100', '0.493843', '0.497560', '0.495186', '0.488317', '0.493008', '0.499024', '0.492029', '0.499512', '0.508564', '0.495810', '0.498367', '0.499757', '0.503051', '0.488738', '0.496354']
         : correct/total = [(6961, 14232), (6922, 14235), (6934, 14266), (6998, 14217), (7035, 14238), (7098, 14373), (7138, 14346), (7098, 14334), (6980, 14294), (7086, 14373), (7158, 14344), (7037, 14302), (7170, 14354), (7304, 14362), (7100, 14320), (7174, 14395), (7191, 14389), (7172, 14257), (6965, 14251), (7147, 14399)]
         : compromised: 0.5012, honest: 0.4932
Round 007: test acc mean=0.4949 ± 0.0056 | min=0.4861 max=0.5086
         : test loss mean=0.6936 ± 0.0003
         : individual accs = ['0.489109', '0.486266', '0.486051', '0.492228', '0.494100', '0.493843', '0.497560', '0.495186', '0.488457', '0.493008', '0.499024', '0.492029', '0.499512', '0.508564', '0.495810', '0.498367', '0.499757', '0.503051', '0.488738', '0.496354']
         : correct/total = [(6961, 14232), (6922, 14235), (6934, 14266), (6998, 14217), (7035, 14238), (7098, 14373), (7138, 14346), (7098, 14334), (6982, 14294), (7086, 14373), (7158, 14344), (7037, 14302), (7170, 14354), (7304, 14362), (7100, 14320), (7174, 14395), (7191, 14389), (7172, 14257), (6965, 14251), (7147, 14399)]
         : compromised: 0.5012, honest: 0.4933
Round 008: test acc mean=0.4949 ± 0.0056 | min=0.4861 max=0.5086
         : test loss mean=0.6935 ± 0.0003
         : individual accs = ['0.489109', '0.486266', '0.486051', '0.492228', '0.494100', '0.493843', '0.497560', '0.495186', '0.488457', '0.493008', '0.499024', '0.492029', '0.499512', '0.508564', '0.495810', '0.498367', '0.499757', '0.503051', '0.488738', '0.496354']
         : correct/total = [(6961, 14232), (6922, 14235), (6934, 14266), (6998, 14217), (7035, 14238), (7098, 14373), (7138, 14346), (7098, 14334), (6982, 14294), (7086, 14373), (7158, 14344), (7037, 14302), (7170, 14354), (7304, 14362), (7100, 14320), (7174, 14395), (7191, 14389), (7172, 14257), (6965, 14251), (7147, 14399)]
         : compromised: 0.5012, honest: 0.4933
Round 009: test acc mean=0.4949 ± 0.0056 | min=0.4861 max=0.5086
         : test loss mean=0.6935 ± 0.0004
         : individual accs = ['0.489109', '0.486266', '0.486051', '0.492228', '0.494100', '0.493843', '0.497560', '0.495186', '0.488457', '0.493008', '0.499024', '0.492029', '0.499512', '0.508564', '0.495810', '0.498367', '0.499757', '0.503051', '0.488738', '0.496354']
         : correct/total = [(6961, 14232), (6922, 14235), (6934, 14266), (6998, 14217), (7035, 14238), (7098, 14373), (7138, 14346), (7098, 14334), (6982, 14294), (7086, 14373), (7158, 14344), (7037, 14302), (7170, 14354), (7304, 14362), (7100, 14320), (7174, 14395), (7191, 14389), (7172, 14257), (6965, 14251), (7147, 14399)]
         : compromised: 0.5012, honest: 0.4933
Round 010: test acc mean=0.4949 ± 0.0056 | min=0.4861 max=0.5086
         : test loss mean=0.6935 ± 0.0004
         : individual accs = ['0.489109', '0.486266', '0.486051', '0.492228', '0.494100', '0.493843', '0.497560', '0.495186', '0.488457', '0.493008', '0.499024', '0.492029', '0.499512', '0.508564', '0.495810', '0.498367', '0.499757', '0.503051', '0.488738', '0.496354']
         : correct/total = [(6961, 14232), (6922, 14235), (6934, 14266), (6998, 14217), (7035, 14238), (7098, 14373), (7138, 14346), (7098, 14334), (6982, 14294), (7086, 14373), (7158, 14344), (7037, 14302), (7170, 14354), (7304, 14362), (7100, 14320), (7174, 14395), (7191, 14389), (7172, 14257), (6965, 14251), (7147, 14399)]
         : compromised: 0.5012, honest: 0.4933

=== FINAL RESULTS ===
Dataset: sent140, Nodes: 20, Graph: erdos, Aggregation: balance
Attack: directed_deviation, 20.0% compromised
Final accuracy - Compromised: 0.5012, Honest: 0.4933
Overall test accuracy: mean=0.4949 ± 0.0056

=== BALANCE SUMMARY ===
Node 0: acceptance=0.850
Node 1: acceptance=0.820
Node 2: acceptance=1.000
Node 3: acceptance=0.871
Node 4: acceptance=0.800
Node 5: acceptance=0.820
Node 6: acceptance=0.775
Node 7: acceptance=0.755
Node 8: acceptance=0.614
Node 9: acceptance=1.000
Node 10: acceptance=0.775
Node 11: acceptance=0.775
Node 12: acceptance=0.925
Node 13: acceptance=1.000
Node 14: acceptance=0.743
Node 15: acceptance=0.800
Node 16: acceptance=0.743
Node 17: acceptance=0.887
Node 18: acceptance=0.850
Node 19: acceptance=0.640

=== PARALLEL EXECUTION TIME (realistic for distributed system) ===
  COMMUNICATION (max across nodes):
    - Full model transfer: 0.000s (0.0%)
  COMPUTATION (max across nodes):
    - Filtering: 0.060s (79.5%)
    - Aggregation: 0.015s (20.4%)
  TOTALS:
    - Total computation: 0.075s (100.0%)
    - Total communication: 0.000s (0.0%)
    - Total parallel time: 0.075s

=== PER-NODE AVERAGE TIME ===
  - Filtering: 0.044s
  - Aggregation: 0.009s
  - Model transfer: 0.000s
  - Total per node: 0.052s

=== TOTAL COMPUTATIONAL WORK (sum across all nodes) ===
  - Total filtering: 0.876s
  - Total aggregation: 0.170s
  - Total model transfer: 0.000s
  - Grand total: 1.046s
  - Mean acceptance rate: 0.822

BALANCE Algorithm Properties:
  - Model dimension: 1,174,986
  - No compression: Full parameter comparison
  - Theoretical complexity: O(deg(i)×d)
  - Approach: Full parameter filtering + averaging
