Device: cuda
Seed: 987654321
Loading 1 LEAF Sent140 train files...
LEAF Sent140 train: 254555 users, 908652 samples
Building vocabulary (max_size=10000)...
Vocabulary size: 10000
Loading 1 LEAF Sent140 test files...
LEAF Sent140 test: 254555 users, 286281 samples
Found 254555 train users, 254555 test users, 254555 common users
User sample counts range: 494 (max) to 1 (min)
Distributed ALL 254555 users across 20 clients
Users per client: 12727 (with 15 clients getting +1 user)
Train partition sizes: [44353, 44290, 44657, 44907, 44696, 45843, 45801, 45619, 45069, 45639, 45821, 45311, 45779, 46056, 45625, 45984, 46428, 44737, 45540, 46497]
Test partition sizes: [14232, 14235, 14266, 14217, 14238, 14373, 14346, 14334, 14294, 14373, 14344, 14302, 14354, 14362, 14320, 14395, 14389, 14257, 14251, 14399]
  Client 0: 44353 train samples, 2 unique classes
  Client 1: 44290 train samples, 2 unique classes
  Client 2: 44657 train samples, 2 unique classes
  Client 3: 44907 train samples, 2 unique classes
  Client 4: 44696 train samples, 2 unique classes
  Client 5: 45843 train samples, 2 unique classes
  Client 6: 45801 train samples, 2 unique classes
  Client 7: 45619 train samples, 2 unique classes
  Client 8: 45069 train samples, 2 unique classes
  Client 9: 45639 train samples, 2 unique classes
  Client 10: 45821 train samples, 2 unique classes
  Client 11: 45311 train samples, 2 unique classes
  Client 12: 45779 train samples, 2 unique classes
  Client 13: 46056 train samples, 2 unique classes
  Client 14: 45625 train samples, 2 unique classes
  Client 15: 45984 train samples, 2 unique classes
  Client 16: 46428 train samples, 2 unique classes
  Client 17: 44737 train samples, 2 unique classes
  Client 18: 45540 train samples, 2 unique classes
  Client 19: 46497 train samples, 2 unique classes
Will sample 4500 samples per client per epoch
Graph: erdos, nodes: 20, edges: 99
Degree statistics: avg=9.90, min=7, max=14
Attack: Compromised 2/20 nodes: [5, 13]
Attack type: gaussian, lambda: 1.0
Model variant: baseline
Model parameters: 1,174,986
BALANCE algorithm:
Balance Config: BALANCEConfig(gamma=2, kappa=1, alpha=0.5, min_neighbors=1)
  - Model dimension: 1,174,986 parameters
  - Complexity: O(N×d) = O(20×1,174,986)
Initial test acc across nodes: mean=0.4953 ± 0.0174
Round 001: test acc mean=0.5701 ± 0.0381 | min=0.5173 max=0.6256
         : test loss mean=0.6897 ± 0.0006
         : individual accs = ['0.553893', '0.585880', '0.517314', '0.520433', '0.616308', '0.565922', '0.625610', '0.620273', '0.612425', '0.554373', '0.522518', '0.561110', '0.613000', '0.554519', '0.523324', '0.573880', '0.523247', '0.607421', '0.535822', '0.615598']
         : correct/total = [(7883, 14232), (8340, 14235), (7380, 14266), (7399, 14217), (8775, 14238), (8134, 14373), (8975, 14346), (8891, 14334), (8754, 14294), (7968, 14373), (7495, 14344), (8025, 14302), (8799, 14354), (7964, 14362), (7494, 14320), (8261, 14395), (7529, 14389), (8660, 14257), (7636, 14251), (8864, 14399)]
         : compromised: 0.5602, honest: 0.5712
Round 002: test acc mean=0.5721 ± 0.0441 | min=0.4926 max=0.6339
         : test loss mean=0.6900 ± 0.0007
         : individual accs = ['0.624789', '0.621848', '0.585868', '0.589154', '0.552816', '0.538718', '0.525582', '0.633947', '0.586680', '0.588325', '0.541481', '0.618025', '0.502856', '0.593720', '0.492598', '0.555749', '0.540482', '0.620467', '0.623465', '0.505591']
         : correct/total = [(8892, 14232), (8852, 14235), (8358, 14266), (8376, 14217), (7871, 14238), (7743, 14373), (7540, 14346), (9087, 14334), (8386, 14294), (8456, 14373), (7767, 14344), (8839, 14302), (7218, 14354), (8527, 14362), (7054, 14320), (8000, 14395), (7777, 14389), (8846, 14257), (8885, 14251), (7280, 14399)]
         : compromised: 0.5662, honest: 0.5728
Round 003: test acc mean=0.5328 ± 0.0333 | min=0.4927 max=0.5957
         : test loss mean=0.6897 ± 0.0011
         : individual accs = ['0.536046', '0.512821', '0.573251', '0.582612', '0.562649', '0.534196', '0.499791', '0.492745', '0.518539', '0.559173', '0.498397', '0.549084', '0.503762', '0.508216', '0.495391', '0.497742', '0.506498', '0.595707', '0.586064', '0.542329']
         : correct/total = [(7629, 14232), (7300, 14235), (8178, 14266), (8283, 14217), (8011, 14238), (7678, 14373), (7170, 14346), (7063, 14334), (7412, 14294), (8037, 14373), (7149, 14344), (7853, 14302), (7231, 14354), (7299, 14362), (7094, 14320), (7165, 14395), (7288, 14389), (8493, 14257), (8352, 14251), (7809, 14399)]
         : compromised: 0.5212, honest: 0.5340
Round 004: test acc mean=0.5582 ± 0.0406 | min=0.4950 max=0.6341
         : test loss mean=0.6873 ± 0.0015
         : individual accs = ['0.532392', '0.627257', '0.494953', '0.544137', '0.603175', '0.534961', '0.554161', '0.562718', '0.634112', '0.603771', '0.503904', '0.592784', '0.506131', '0.525902', '0.524860', '0.522959', '0.568837', '0.547240', '0.603466', '0.576637']
         : correct/total = [(7577, 14232), (8929, 14235), (7061, 14266), (7736, 14217), (8588, 14238), (7689, 14373), (7950, 14346), (8066, 14334), (9064, 14294), (8678, 14373), (7228, 14344), (8478, 14302), (7265, 14354), (7553, 14362), (7516, 14320), (7528, 14395), (8185, 14389), (7802, 14257), (8600, 14251), (8303, 14399)]
         : compromised: 0.5304, honest: 0.5613
Round 005: test acc mean=0.6059 ± 0.0314 | min=0.5366 max=0.6363
         : test loss mean=0.6805 ± 0.0025
         : individual accs = ['0.627108', '0.632736', '0.622950', '0.629458', '0.636325', '0.630209', '0.560993', '0.630599', '0.613194', '0.570375', '0.594813', '0.634876', '0.542845', '0.536555', '0.602025', '0.633831', '0.570088', '0.610577', '0.612589', '0.626155']
         : correct/total = [(8925, 14232), (9007, 14235), (8887, 14266), (8949, 14217), (9060, 14238), (9058, 14373), (8048, 14346), (9039, 14334), (8765, 14294), (8198, 14373), (8532, 14344), (9080, 14302), (7792, 14354), (7706, 14362), (8621, 14320), (9124, 14395), (8203, 14389), (8705, 14257), (8730, 14251), (9016, 14399)]
         : compromised: 0.5834, honest: 0.6084
Round 006: test acc mean=0.6332 ± 0.0095 | min=0.6042 max=0.6429
         : test loss mean=0.6628 ± 0.0034
         : individual accs = ['0.639685', '0.642852', '0.632413', '0.633326', '0.635553', '0.638350', '0.627213', '0.636668', '0.636141', '0.635984', '0.624373', '0.614669', '0.639125', '0.632711', '0.642318', '0.637444', '0.642227', '0.604194', '0.628377', '0.641295']
         : correct/total = [(9104, 14232), (9151, 14235), (9022, 14266), (9004, 14217), (9049, 14238), (9175, 14373), (8998, 14346), (9126, 14334), (9093, 14294), (9141, 14373), (8956, 14344), (8791, 14302), (9174, 14354), (9087, 14362), (9198, 14320), (9176, 14395), (9241, 14389), (8614, 14257), (8955, 14251), (9234, 14399)]
         : compromised: 0.6355, honest: 0.6330
Round 007: test acc mean=0.6368 ± 0.0132 | min=0.5984 max=0.6496
         : test loss mean=0.6464 ± 0.0060
         : individual accs = ['0.644744', '0.641447', '0.639422', '0.643596', '0.649248', '0.644820', '0.642967', '0.649644', '0.649223', '0.642663', '0.629113', '0.619704', '0.644838', '0.613076', '0.646089', '0.598402', '0.628049', '0.637582', '0.629008', '0.642545']
         : correct/total = [(9176, 14232), (9131, 14235), (9122, 14266), (9150, 14217), (9244, 14238), (9268, 14373), (9224, 14346), (9312, 14334), (9280, 14294), (9237, 14373), (9024, 14344), (8863, 14302), (9256, 14354), (8805, 14362), (9252, 14320), (8614, 14395), (9037, 14389), (9090, 14257), (8964, 14251), (9252, 14399)]
         : compromised: 0.6289, honest: 0.6377
Round 008: test acc mean=0.6464 ± 0.0070 | min=0.6315 max=0.6560
         : test loss mean=0.6338 ± 0.0046
         : individual accs = ['0.645025', '0.631542', '0.639212', '0.655975', '0.642576', '0.652960', '0.651053', '0.649365', '0.655800', '0.649273', '0.645078', '0.652147', '0.639682', '0.643434', '0.651676', '0.647308', '0.650497', '0.636038', '0.635534', '0.654282']
         : correct/total = [(9180, 14232), (8990, 14235), (9119, 14266), (9326, 14217), (9149, 14238), (9385, 14373), (9340, 14346), (9308, 14334), (9374, 14294), (9332, 14373), (9253, 14344), (9327, 14302), (9182, 14354), (9241, 14362), (9332, 14320), (9318, 14395), (9360, 14389), (9068, 14257), (9057, 14251), (9421, 14399)]
         : compromised: 0.6482, honest: 0.6462
Round 009: test acc mean=0.6515 ± 0.0095 | min=0.6150 max=0.6622
         : test loss mean=0.6285 ± 0.0067
         : individual accs = ['0.615022', '0.662241', '0.652460', '0.655202', '0.649319', '0.657344', '0.647219', '0.655504', '0.655730', '0.648160', '0.642708', '0.654174', '0.650759', '0.652695', '0.655866', '0.651059', '0.659949', '0.653714', '0.652796', '0.658935']
         : correct/total = [(8753, 14232), (9427, 14235), (9308, 14266), (9315, 14217), (9245, 14238), (9448, 14373), (9285, 14346), (9396, 14334), (9373, 14294), (9316, 14373), (9219, 14344), (9356, 14302), (9341, 14354), (9374, 14362), (9392, 14320), (9372, 14395), (9496, 14389), (9320, 14257), (9303, 14251), (9488, 14399)]
         : compromised: 0.6550, honest: 0.6512
Round 010: test acc mean=0.6597 ± 0.0097 | min=0.6267 max=0.6699
         : test loss mean=0.6212 ± 0.0082
         : individual accs = ['0.659992', '0.667510', '0.626735', '0.665612', '0.665262', '0.666319', '0.665900', '0.669876', '0.660837', '0.651708', '0.655257', '0.661865', '0.667967', '0.661189', '0.664665', '0.658145', '0.666690', '0.659676', '0.654901', '0.644211']
         : correct/total = [(9393, 14232), (9502, 14235), (8941, 14266), (9463, 14217), (9472, 14238), (9577, 14373), (9553, 14346), (9602, 14334), (9446, 14294), (9367, 14373), (9399, 14344), (9466, 14302), (9588, 14354), (9496, 14362), (9518, 14320), (9474, 14395), (9593, 14389), (9405, 14257), (9333, 14251), (9276, 14399)]
         : compromised: 0.6638, honest: 0.6593

=== FINAL RESULTS ===
Dataset: sent140, Nodes: 20, Graph: erdos, Aggregation: balance
Attack: gaussian, 10.0% compromised
Final accuracy - Compromised: 0.6638, Honest: 0.6593
Overall test accuracy: mean=0.6597 ± 0.0097

=== BALANCE SUMMARY ===
Node 0: acceptance=0.917
Node 1: acceptance=0.900
Node 2: acceptance=1.000
Node 3: acceptance=0.857
Node 4: acceptance=0.889
Node 5: acceptance=1.000
Node 6: acceptance=0.833
Node 7: acceptance=0.909
Node 8: acceptance=0.714
Node 9: acceptance=1.000
Node 10: acceptance=1.000
Node 11: acceptance=0.833
Node 12: acceptance=0.917
Node 13: acceptance=1.000
Node 14: acceptance=0.857
Node 15: acceptance=0.889
Node 16: acceptance=1.000
Node 17: acceptance=0.875
Node 18: acceptance=0.917
Node 19: acceptance=0.800

=== PARALLEL EXECUTION TIME (realistic for distributed system) ===
  COMMUNICATION (max across nodes):
    - Full model transfer: 0.000s (0.0%)
  COMPUTATION (max across nodes):
    - Filtering: 0.057s (78.4%)
    - Aggregation: 0.016s (21.6%)
  TOTALS:
    - Total computation: 0.073s (100.0%)
    - Total communication: 0.000s (0.0%)
    - Total parallel time: 0.073s

=== PER-NODE AVERAGE TIME ===
  - Filtering: 0.041s
  - Aggregation: 0.009s
  - Model transfer: 0.000s
  - Total per node: 0.050s

=== TOTAL COMPUTATIONAL WORK (sum across all nodes) ===
  - Total filtering: 0.817s
  - Total aggregation: 0.186s
  - Total model transfer: 0.000s
  - Grand total: 1.003s
  - Mean acceptance rate: 0.905

BALANCE Algorithm Properties:
  - Model dimension: 1,174,986
  - No compression: Full parameter comparison
  - Theoretical complexity: O(deg(i)×d)
  - Approach: Full parameter filtering + averaging
