Device: cuda
Seed: 987654321
Loading 1 LEAF Sent140 train files...
LEAF Sent140 train: 254555 users, 908652 samples
Building vocabulary (max_size=10000)...
Vocabulary size: 10000
Loading 1 LEAF Sent140 test files...
LEAF Sent140 test: 254555 users, 286281 samples
Found 254555 train users, 254555 test users, 254555 common users
User sample counts range: 494 (max) to 1 (min)
Distributed ALL 254555 users across 20 clients
Users per client: 12727 (with 15 clients getting +1 user)
Train partition sizes: [44353, 44290, 44657, 44907, 44696, 45843, 45801, 45619, 45069, 45639, 45821, 45311, 45779, 46056, 45625, 45984, 46428, 44737, 45540, 46497]
Test partition sizes: [14232, 14235, 14266, 14217, 14238, 14373, 14346, 14334, 14294, 14373, 14344, 14302, 14354, 14362, 14320, 14395, 14389, 14257, 14251, 14399]
  Client 0: 44353 train samples, 2 unique classes
  Client 1: 44290 train samples, 2 unique classes
  Client 2: 44657 train samples, 2 unique classes
  Client 3: 44907 train samples, 2 unique classes
  Client 4: 44696 train samples, 2 unique classes
  Client 5: 45843 train samples, 2 unique classes
  Client 6: 45801 train samples, 2 unique classes
  Client 7: 45619 train samples, 2 unique classes
  Client 8: 45069 train samples, 2 unique classes
  Client 9: 45639 train samples, 2 unique classes
  Client 10: 45821 train samples, 2 unique classes
  Client 11: 45311 train samples, 2 unique classes
  Client 12: 45779 train samples, 2 unique classes
  Client 13: 46056 train samples, 2 unique classes
  Client 14: 45625 train samples, 2 unique classes
  Client 15: 45984 train samples, 2 unique classes
  Client 16: 46428 train samples, 2 unique classes
  Client 17: 44737 train samples, 2 unique classes
  Client 18: 45540 train samples, 2 unique classes
  Client 19: 46497 train samples, 2 unique classes
Will sample 4500 samples per client per epoch
Graph: erdos, nodes: 20, edges: 99
Degree statistics: avg=9.90, min=7, max=14
Attack: Compromised 8/20 nodes: [1, 5, 11, 12, 13, 14, 17, 18]
Attack type: directed_deviation, lambda: 1.0
Model variant: baseline
Model parameters: 1,174,986
Initial test acc across nodes: mean=0.4965 ± 0.0152
Round 001: test acc mean=0.5024 ± 0.0063 | min=0.4905 max=0.5137
         : test loss mean=4.9773 ± 2.6387
         : individual accs = ['0.513702', '0.500035', '0.492500', '0.508405', '0.496980', '0.499756', '0.497700', '0.506628', '0.509864', '0.508732', '0.500697', '0.493288', '0.512958', '0.490461', '0.502095', '0.503022', '0.499131', '0.504314', '0.503754', '0.503716']
         : correct/total = [(7311, 14232), (7118, 14235), (7026, 14266), (7228, 14217), (7076, 14238), (7183, 14373), (7140, 14346), (7262, 14334), (7288, 14294), (7312, 14373), (7182, 14344), (7055, 14302), (7363, 14354), (7044, 14362), (7190, 14320), (7241, 14395), (7182, 14389), (7190, 14257), (7179, 14251), (7253, 14399)]
         : compromised: 0.5008, honest: 0.5034
Round 002: test acc mean=0.5041 ± 0.0064 | min=0.4921 max=0.5165
         : test loss mean=4.3705 ± 2.0571
         : individual accs = ['0.503443', '0.510081', '0.516473', '0.496167', '0.498666', '0.509080', '0.498745', '0.502791', '0.513782', '0.504140', '0.510109', '0.504265', '0.493451', '0.492062', '0.501187', '0.503647', '0.503093', '0.511819', '0.501509', '0.506563']
         : correct/total = [(7165, 14232), (7261, 14235), (7368, 14266), (7054, 14217), (7100, 14238), (7317, 14373), (7155, 14346), (7207, 14334), (7344, 14294), (7246, 14373), (7317, 14344), (7212, 14302), (7083, 14354), (7067, 14362), (7177, 14320), (7250, 14395), (7239, 14389), (7297, 14257), (7147, 14251), (7294, 14399)]
         : compromised: 0.5029, honest: 0.5048
Round 003: test acc mean=0.5033 ± 0.0119 | min=0.4820 max=0.5292
         : test loss mean=0.9588 ± 0.2657
         : individual accs = ['0.489109', '0.507411', '0.523062', '0.496659', '0.509763', '0.529187', '0.498745', '0.498465', '0.516371', '0.495095', '0.497769', '0.500979', '0.499234', '0.508495', '0.481983', '0.498784', '0.499340', '0.503191', '0.488738', '0.522884']
         : correct/total = [(6961, 14232), (7223, 14235), (7462, 14266), (7061, 14217), (7258, 14238), (7606, 14373), (7155, 14346), (7145, 14334), (7381, 14294), (7116, 14373), (7140, 14344), (7165, 14302), (7166, 14354), (7303, 14362), (6902, 14320), (7180, 14395), (7185, 14389), (7174, 14257), (6965, 14251), (7529, 14399)]
         : compromised: 0.5024, honest: 0.5038
Round 004: test acc mean=0.5002 ± 0.0062 | min=0.4914 max=0.5105
         : test loss mean=2.0612 ± 0.8952
         : individual accs = ['0.495082', '0.492448', '0.507220', '0.502145', '0.508007', '0.503305', '0.510526', '0.505930', '0.507835', '0.493356', '0.493586', '0.505733', '0.492755', '0.491436', '0.500279', '0.501285', '0.504900', '0.492530', '0.496316', '0.499687']
         : correct/total = [(7046, 14232), (7010, 14235), (7236, 14266), (7139, 14217), (7233, 14238), (7234, 14373), (7324, 14346), (7252, 14334), (7259, 14294), (7091, 14373), (7080, 14344), (7233, 14302), (7073, 14354), (7058, 14362), (7164, 14320), (7216, 14395), (7265, 14389), (7022, 14257), (7073, 14251), (7195, 14399)]
         : compromised: 0.4969, honest: 0.5025
Round 005: test acc mean=0.5047 ± 0.0100 | min=0.4893 max=0.5272
         : test loss mean=0.9256 ± 0.2558
         : individual accs = ['0.489320', '0.498560', '0.525866', '0.493353', '0.504003', '0.519029', '0.505367', '0.508441', '0.498461', '0.506436', '0.491634', '0.495036', '0.507315', '0.509957', '0.499022', '0.502744', '0.507471', '0.504735', '0.500316', '0.527189']
         : correct/total = [(6964, 14232), (7097, 14235), (7502, 14266), (7014, 14217), (7176, 14238), (7460, 14373), (7250, 14346), (7288, 14334), (7125, 14294), (7279, 14373), (7052, 14344), (7080, 14302), (7282, 14354), (7324, 14362), (7146, 14320), (7237, 14395), (7302, 14389), (7196, 14257), (7130, 14251), (7591, 14399)]
         : compromised: 0.5042, honest: 0.5050
Round 006: test acc mean=0.5058 ± 0.0077 | min=0.4907 max=0.5179
         : test loss mean=1.3102 ± 0.4990
         : individual accs = ['0.490725', '0.494345', '0.509814', '0.509461', '0.503863', '0.510262', '0.511571', '0.507535', '0.511543', '0.517916', '0.507320', '0.516991', '0.495332', '0.503830', '0.499232', '0.505523', '0.510946', '0.497861', '0.496807', '0.515522']
         : correct/total = [(6984, 14232), (7037, 14235), (7273, 14266), (7243, 14217), (7174, 14238), (7334, 14373), (7339, 14346), (7275, 14334), (7312, 14294), (7444, 14373), (7277, 14344), (7394, 14302), (7110, 14354), (7236, 14362), (7149, 14320), (7277, 14395), (7352, 14389), (7098, 14257), (7080, 14251), (7423, 14399)]
         : compromised: 0.5018, honest: 0.5085
Round 007: test acc mean=0.5100 ± 0.0127 | min=0.4908 max=0.5407
         : test loss mean=0.8295 ± 0.1675
         : individual accs = ['0.491568', '0.512540', '0.540656', '0.499121', '0.512151', '0.504001', '0.514220', '0.511441', '0.499510', '0.500035', '0.504810', '0.500210', '0.490804', '0.531402', '0.509846', '0.505106', '0.517270', '0.504875', '0.522630', '0.527745']
         : correct/total = [(6996, 14232), (7296, 14235), (7713, 14266), (7096, 14217), (7292, 14238), (7244, 14373), (7377, 14346), (7331, 14334), (7140, 14294), (7187, 14373), (7241, 14344), (7154, 14302), (7045, 14354), (7632, 14362), (7301, 14320), (7271, 14395), (7443, 14389), (7198, 14257), (7448, 14251), (7599, 14399)]
         : compromised: 0.5095, honest: 0.5103
Round 008: test acc mean=0.5093 ± 0.0048 | min=0.5011 max=0.5200
         : test loss mean=1.0227 ± 0.3075
         : individual accs = ['0.502881', '0.503337', '0.501051', '0.511852', '0.510816', '0.505879', '0.511362', '0.508162', '0.520008', '0.515620', '0.513525', '0.507412', '0.505573', '0.511767', '0.509008', '0.505384', '0.512336', '0.511258', '0.503684', '0.514411']
         : correct/total = [(7157, 14232), (7165, 14235), (7148, 14266), (7277, 14217), (7273, 14238), (7271, 14373), (7336, 14346), (7284, 14334), (7433, 14294), (7411, 14373), (7366, 14344), (7257, 14302), (7257, 14354), (7350, 14362), (7289, 14320), (7275, 14395), (7372, 14389), (7289, 14257), (7178, 14251), (7407, 14399)]
         : compromised: 0.5072, honest: 0.5106
Round 009: test acc mean=0.5198 ± 0.0186 | min=0.4905 max=0.5529
         : test loss mean=0.7660 ± 0.1172
         : individual accs = ['0.498454', '0.517106', '0.545282', '0.508546', '0.531535', '0.541084', '0.546215', '0.526441', '0.506436', '0.498504', '0.517289', '0.505244', '0.502508', '0.490531', '0.515223', '0.548454', '0.528181', '0.501718', '0.515052', '0.552886']
         : correct/total = [(7094, 14232), (7361, 14235), (7779, 14266), (7230, 14217), (7568, 14238), (7777, 14373), (7836, 14346), (7546, 14334), (7239, 14294), (7165, 14373), (7420, 14344), (7226, 14302), (7213, 14354), (7045, 14362), (7378, 14320), (7895, 14395), (7600, 14389), (7153, 14257), (7340, 14251), (7961, 14399)]
         : compromised: 0.5111, honest: 0.5257
Round 010: test acc mean=0.5081 ± 0.0068 | min=0.4931 max=0.5189
         : test loss mean=0.9019 ± 0.2203
         : individual accs = ['0.510540', '0.493080', '0.502453', '0.508827', '0.503933', '0.516107', '0.511083', '0.505372', '0.511893', '0.518890', '0.509900', '0.510069', '0.502647', '0.518451', '0.505237', '0.503439', '0.504691', '0.515256', '0.495263', '0.514133']
         : correct/total = [(7266, 14232), (7019, 14235), (7168, 14266), (7234, 14217), (7175, 14238), (7418, 14373), (7332, 14346), (7244, 14334), (7317, 14294), (7458, 14373), (7314, 14344), (7295, 14302), (7215, 14354), (7446, 14362), (7235, 14320), (7247, 14395), (7262, 14389), (7346, 14257), (7058, 14251), (7403, 14399)]
         : compromised: 0.5070, honest: 0.5088

=== FINAL RESULTS ===
Dataset: sent140, Nodes: 20, Graph: erdos, Aggregation: d-fedavg
Attack: directed_deviation, 40.0% compromised
Final accuracy - Compromised: 0.5070, Honest: 0.5088
Overall test accuracy: mean=0.5081 ± 0.0068
