Device: cuda
Seed: 987654321
Loading 1 LEAF Sent140 train files...
LEAF Sent140 train: 254555 users, 908652 samples
Building vocabulary (max_size=10000)...
Vocabulary size: 10000
Loading 1 LEAF Sent140 test files...
LEAF Sent140 test: 254555 users, 286281 samples
Found 254555 train users, 254555 test users, 254555 common users
User sample counts range: 494 (max) to 1 (min)
Distributed ALL 254555 users across 20 clients
Users per client: 12727 (with 15 clients getting +1 user)
Train partition sizes: [44353, 44290, 44657, 44907, 44696, 45843, 45801, 45619, 45069, 45639, 45821, 45311, 45779, 46056, 45625, 45984, 46428, 44737, 45540, 46497]
Test partition sizes: [14232, 14235, 14266, 14217, 14238, 14373, 14346, 14334, 14294, 14373, 14344, 14302, 14354, 14362, 14320, 14395, 14389, 14257, 14251, 14399]
  Client 0: 44353 train samples, 2 unique classes
  Client 1: 44290 train samples, 2 unique classes
  Client 2: 44657 train samples, 2 unique classes
  Client 3: 44907 train samples, 2 unique classes
  Client 4: 44696 train samples, 2 unique classes
  Client 5: 45843 train samples, 2 unique classes
  Client 6: 45801 train samples, 2 unique classes
  Client 7: 45619 train samples, 2 unique classes
  Client 8: 45069 train samples, 2 unique classes
  Client 9: 45639 train samples, 2 unique classes
  Client 10: 45821 train samples, 2 unique classes
  Client 11: 45311 train samples, 2 unique classes
  Client 12: 45779 train samples, 2 unique classes
  Client 13: 46056 train samples, 2 unique classes
  Client 14: 45625 train samples, 2 unique classes
  Client 15: 45984 train samples, 2 unique classes
  Client 16: 46428 train samples, 2 unique classes
  Client 17: 44737 train samples, 2 unique classes
  Client 18: 45540 train samples, 2 unique classes
  Client 19: 46497 train samples, 2 unique classes
Will sample 4500 samples per client per epoch
Graph: fully, nodes: 20, edges: 190
Degree statistics: avg=19.00, min=19, max=19
Attack: Compromised 14/20 nodes: [1, 2, 3, 5, 6, 8, 11, 12, 13, 14, 15, 17, 18, 19]
Attack type: gaussian, lambda: 1.0
Model variant: baseline
Model parameters: 1,174,986
BALANCE algorithm:
Balance Config: BALANCEConfig(gamma=2, kappa=1, alpha=0.5, min_neighbors=1)
  - Model dimension: 1,174,986 parameters
  - Complexity: O(N×d) = O(20×1,174,986)
Initial test acc across nodes: mean=0.4965 ± 0.0152
Round 001: test acc mean=0.5470 ± 0.0264 | min=0.4964 max=0.5954
         : test loss mean=0.6914 ± 0.0006
         : individual accs = ['0.531619', '0.581735', '0.521940', '0.566646', '0.528024', '0.560147', '0.517775', '0.595437', '0.496362', '0.586795', '0.548383', '0.547056', '0.562631', '0.542543', '0.559986', '0.510524', '0.575092', '0.514133', '0.545295', '0.548094']
         : correct/total = [(7566, 14232), (8281, 14235), (7446, 14266), (8056, 14217), (7518, 14238), (8051, 14373), (7428, 14346), (8535, 14334), (7095, 14294), (8434, 14373), (7866, 14344), (7824, 14302), (8076, 14354), (7792, 14362), (8019, 14320), (7349, 14395), (8275, 14389), (7330, 14257), (7771, 14251), (7892, 14399)]
         : compromised: 0.5411, honest: 0.5609
Round 002: test acc mean=0.4949 ± 0.0056 | min=0.4861 max=0.5086
         : test loss mean=0.6932 ± 0.0004
         : individual accs = ['0.489039', '0.486336', '0.486051', '0.492228', '0.494100', '0.493843', '0.497560', '0.495465', '0.488457', '0.493008', '0.499024', '0.492449', '0.499512', '0.508564', '0.495810', '0.498367', '0.500799', '0.503051', '0.488738', '0.496354']
         : correct/total = [(6960, 14232), (6923, 14235), (6934, 14266), (6998, 14217), (7035, 14238), (7098, 14373), (7138, 14346), (7102, 14334), (6982, 14294), (7086, 14373), (7158, 14344), (7043, 14302), (7170, 14354), (7304, 14362), (7100, 14320), (7174, 14395), (7206, 14389), (7172, 14257), (6965, 14251), (7147, 14399)]
         : compromised: 0.4948, honest: 0.4952
Round 003: test acc mean=0.4949 ± 0.0056 | min=0.4861 max=0.5086
         : test loss mean=0.6938 ± 0.0003
         : individual accs = ['0.489109', '0.486266', '0.486051', '0.492228', '0.494100', '0.493843', '0.497560', '0.495186', '0.488457', '0.493008', '0.499024', '0.492029', '0.499512', '0.508564', '0.495810', '0.498367', '0.499757', '0.503051', '0.488738', '0.496354']
         : correct/total = [(6961, 14232), (6922, 14235), (6934, 14266), (6998, 14217), (7035, 14238), (7098, 14373), (7138, 14346), (7098, 14334), (6982, 14294), (7086, 14373), (7158, 14344), (7037, 14302), (7170, 14354), (7304, 14362), (7100, 14320), (7174, 14395), (7191, 14389), (7172, 14257), (6965, 14251), (7147, 14399)]
         : compromised: 0.4948, honest: 0.4950
Round 004: test acc mean=0.4949 ± 0.0056 | min=0.4861 max=0.5086
         : test loss mean=0.6935 ± 0.0003
         : individual accs = ['0.489109', '0.486266', '0.486051', '0.492228', '0.494100', '0.493843', '0.497560', '0.495186', '0.488457', '0.493008', '0.499024', '0.492029', '0.499512', '0.508564', '0.495810', '0.498367', '0.499757', '0.503051', '0.488738', '0.496354']
         : correct/total = [(6961, 14232), (6922, 14235), (6934, 14266), (6998, 14217), (7035, 14238), (7098, 14373), (7138, 14346), (7098, 14334), (6982, 14294), (7086, 14373), (7158, 14344), (7037, 14302), (7170, 14354), (7304, 14362), (7100, 14320), (7174, 14395), (7191, 14389), (7172, 14257), (6965, 14251), (7147, 14399)]
         : compromised: 0.4948, honest: 0.4950
Round 005: test acc mean=0.4949 ± 0.0056 | min=0.4861 max=0.5086
         : test loss mean=0.6933 ± 0.0004
         : individual accs = ['0.489109', '0.486266', '0.486051', '0.492228', '0.494100', '0.493843', '0.497560', '0.495186', '0.488457', '0.493008', '0.499024', '0.492029', '0.499512', '0.508564', '0.495810', '0.498367', '0.499757', '0.503051', '0.488738', '0.496354']
         : correct/total = [(6961, 14232), (6922, 14235), (6934, 14266), (6998, 14217), (7035, 14238), (7098, 14373), (7138, 14346), (7098, 14334), (6982, 14294), (7086, 14373), (7158, 14344), (7037, 14302), (7170, 14354), (7304, 14362), (7100, 14320), (7174, 14395), (7191, 14389), (7172, 14257), (6965, 14251), (7147, 14399)]
         : compromised: 0.4948, honest: 0.4950
Round 006: test acc mean=0.4949 ± 0.0056 | min=0.4861 max=0.5086
         : test loss mean=0.6930 ± 0.0004
         : individual accs = ['0.489109', '0.486266', '0.486051', '0.492228', '0.494100', '0.493843', '0.497560', '0.495186', '0.488457', '0.493008', '0.499024', '0.492029', '0.499512', '0.508564', '0.495810', '0.498367', '0.499757', '0.503051', '0.488738', '0.496354']
         : correct/total = [(6961, 14232), (6922, 14235), (6934, 14266), (6998, 14217), (7035, 14238), (7098, 14373), (7138, 14346), (7098, 14334), (6982, 14294), (7086, 14373), (7158, 14344), (7037, 14302), (7170, 14354), (7304, 14362), (7100, 14320), (7174, 14395), (7191, 14389), (7172, 14257), (6965, 14251), (7147, 14399)]
         : compromised: 0.4948, honest: 0.4950
Round 007: test acc mean=0.4949 ± 0.0056 | min=0.4861 max=0.5086
         : test loss mean=0.6926 ± 0.0003
         : individual accs = ['0.489109', '0.486266', '0.486051', '0.492228', '0.494100', '0.493843', '0.497560', '0.495186', '0.488457', '0.493008', '0.499024', '0.492029', '0.499512', '0.508564', '0.495810', '0.498367', '0.499757', '0.503051', '0.488738', '0.496354']
         : correct/total = [(6961, 14232), (6922, 14235), (6934, 14266), (6998, 14217), (7035, 14238), (7098, 14373), (7138, 14346), (7098, 14334), (6982, 14294), (7086, 14373), (7158, 14344), (7037, 14302), (7170, 14354), (7304, 14362), (7100, 14320), (7174, 14395), (7191, 14389), (7172, 14257), (6965, 14251), (7147, 14399)]
         : compromised: 0.4948, honest: 0.4950
Round 008: test acc mean=0.4951 ± 0.0055 | min=0.4861 max=0.5086
         : test loss mean=0.6921 ± 0.0004
         : individual accs = ['0.489109', '0.486266', '0.486051', '0.492298', '0.494171', '0.493843', '0.497560', '0.495396', '0.488527', '0.493147', '0.499024', '0.492449', '0.499512', '0.508564', '0.495810', '0.498367', '0.500452', '0.503051', '0.491404', '0.496423']
         : correct/total = [(6961, 14232), (6922, 14235), (6934, 14266), (6999, 14217), (7036, 14238), (7098, 14373), (7138, 14346), (7101, 14334), (6983, 14294), (7088, 14373), (7158, 14344), (7043, 14302), (7170, 14354), (7304, 14362), (7100, 14320), (7174, 14395), (7201, 14389), (7172, 14257), (7003, 14251), (7148, 14399)]
         : compromised: 0.4950, honest: 0.4952
Round 009: test acc mean=0.4958 ± 0.0053 | min=0.4868 max=0.5089
         : test loss mean=0.6915 ± 0.0004
         : individual accs = ['0.490795', '0.487179', '0.486752', '0.493845', '0.494732', '0.493912', '0.497560', '0.495814', '0.488597', '0.493147', '0.499163', '0.493427', '0.499582', '0.508912', '0.495810', '0.498437', '0.501008', '0.503612', '0.496456', '0.497257']
         : correct/total = [(6985, 14232), (6935, 14235), (6944, 14266), (7021, 14217), (7044, 14238), (7099, 14373), (7138, 14346), (7107, 14334), (6984, 14294), (7088, 14373), (7160, 14344), (7057, 14302), (7171, 14354), (7309, 14362), (7100, 14320), (7175, 14395), (7209, 14389), (7180, 14257), (7075, 14251), (7160, 14399)]
         : compromised: 0.4958, honest: 0.4958
Round 010: test acc mean=0.5034 ± 0.0062 | min=0.4924 max=0.5162
         : test loss mean=0.6905 ± 0.0004
         : individual accs = ['0.495925', '0.507973', '0.502523', '0.510164', '0.506602', '0.496069', '0.498745', '0.509418', '0.492444', '0.496765', '0.504044', '0.505733', '0.502856', '0.516223', '0.497067', '0.501841', '0.511780', '0.507049', '0.496597', '0.508021']
         : correct/total = [(7058, 14232), (7231, 14235), (7169, 14266), (7253, 14217), (7213, 14238), (7130, 14373), (7155, 14346), (7302, 14334), (7039, 14294), (7140, 14373), (7230, 14344), (7233, 14302), (7218, 14354), (7414, 14362), (7118, 14320), (7224, 14395), (7364, 14389), (7229, 14257), (7077, 14251), (7315, 14399)]
         : compromised: 0.5031, honest: 0.5041

=== FINAL RESULTS ===
Dataset: sent140, Nodes: 20, Graph: fully, Aggregation: balance
Attack: gaussian, 70.0% compromised
Final accuracy - Compromised: 0.5031, Honest: 0.5041
Overall test accuracy: mean=0.5034 ± 0.0062

=== BALANCE SUMMARY ===
Node 0: acceptance=0.263
Node 1: acceptance=0.316
Node 2: acceptance=0.316
Node 3: acceptance=0.316
Node 4: acceptance=0.263
Node 5: acceptance=0.316
Node 6: acceptance=0.316
Node 7: acceptance=0.263
Node 8: acceptance=0.316
Node 9: acceptance=0.263
Node 10: acceptance=0.263
Node 11: acceptance=0.316
Node 12: acceptance=0.316
Node 13: acceptance=0.316
Node 14: acceptance=0.316
Node 15: acceptance=0.316
Node 16: acceptance=0.263
Node 17: acceptance=0.316
Node 18: acceptance=0.316
Node 19: acceptance=0.316

=== PARALLEL EXECUTION TIME (realistic for distributed system) ===
  COMMUNICATION (max across nodes):
    - Full model transfer: 0.000s (0.0%)
  COMPUTATION (max across nodes):
    - Filtering: 0.089s (85.3%)
    - Aggregation: 0.015s (14.7%)
  TOTALS:
    - Total computation: 0.104s (100.0%)
    - Total communication: 0.000s (0.0%)
    - Total parallel time: 0.104s

=== PER-NODE AVERAGE TIME ===
  - Filtering: 0.079s
  - Aggregation: 0.007s
  - Model transfer: 0.000s
  - Total per node: 0.086s

=== TOTAL COMPUTATIONAL WORK (sum across all nodes) ===
  - Total filtering: 1.576s
  - Total aggregation: 0.149s
  - Total model transfer: 0.000s
  - Grand total: 1.725s
  - Mean acceptance rate: 0.300

BALANCE Algorithm Properties:
  - Model dimension: 1,174,986
  - No compression: Full parameter comparison
  - Theoretical complexity: O(deg(i)×d)
  - Approach: Full parameter filtering + averaging
