Device: cuda
Seed: 987654321
Loading 1 LEAF Sent140 train files...
LEAF Sent140 train: 254555 users, 908652 samples
Building vocabulary (max_size=10000)...
Vocabulary size: 10000
Loading 1 LEAF Sent140 test files...
LEAF Sent140 test: 254555 users, 286281 samples
Found 254555 train users, 254555 test users, 254555 common users
User sample counts range: 494 (max) to 1 (min)
Distributed ALL 254555 users across 20 clients
Users per client: 12727 (with 15 clients getting +1 user)
Train partition sizes: [44353, 44290, 44657, 44907, 44696, 45843, 45801, 45619, 45069, 45639, 45821, 45311, 45779, 46056, 45625, 45984, 46428, 44737, 45540, 46497]
Test partition sizes: [14232, 14235, 14266, 14217, 14238, 14373, 14346, 14334, 14294, 14373, 14344, 14302, 14354, 14362, 14320, 14395, 14389, 14257, 14251, 14399]
  Client 0: 44353 train samples, 2 unique classes
  Client 1: 44290 train samples, 2 unique classes
  Client 2: 44657 train samples, 2 unique classes
  Client 3: 44907 train samples, 2 unique classes
  Client 4: 44696 train samples, 2 unique classes
  Client 5: 45843 train samples, 2 unique classes
  Client 6: 45801 train samples, 2 unique classes
  Client 7: 45619 train samples, 2 unique classes
  Client 8: 45069 train samples, 2 unique classes
  Client 9: 45639 train samples, 2 unique classes
  Client 10: 45821 train samples, 2 unique classes
  Client 11: 45311 train samples, 2 unique classes
  Client 12: 45779 train samples, 2 unique classes
  Client 13: 46056 train samples, 2 unique classes
  Client 14: 45625 train samples, 2 unique classes
  Client 15: 45984 train samples, 2 unique classes
  Client 16: 46428 train samples, 2 unique classes
  Client 17: 44737 train samples, 2 unique classes
  Client 18: 45540 train samples, 2 unique classes
  Client 19: 46497 train samples, 2 unique classes
Will sample 4500 samples per client per epoch
Graph: ring, nodes: 20, edges: 20
Degree statistics: avg=2.00, min=2, max=2
Attack: Compromised 6/20 nodes: [5, 12, 13, 14, 17, 18]
Attack type: gaussian, lambda: 1.0
Model variant: baseline
Model parameters: 1,174,986
Sketchguard Node 0:
  Model dim: 1,174,986 → Sketch size: 180
  Compression ratio: 6527.7x
  Using model parameters for aggregation, sketches for filtering
Sketchguard Node 1:
  Model dim: 1,174,986 → Sketch size: 180
  Compression ratio: 6527.7x
  Using model parameters for aggregation, sketches for filtering
Sketchguard Node 2:
  Model dim: 1,174,986 → Sketch size: 180
  Compression ratio: 6527.7x
  Using model parameters for aggregation, sketches for filtering
Sketchguard Node 3:
  Model dim: 1,174,986 → Sketch size: 180
  Compression ratio: 6527.7x
  Using model parameters for aggregation, sketches for filtering
Sketchguard Node 4:
  Model dim: 1,174,986 → Sketch size: 180
  Compression ratio: 6527.7x
  Using model parameters for aggregation, sketches for filtering
Sketchguard Node 5:
  Model dim: 1,174,986 → Sketch size: 180
  Compression ratio: 6527.7x
  Using model parameters for aggregation, sketches for filtering
Sketchguard Node 6:
  Model dim: 1,174,986 → Sketch size: 180
  Compression ratio: 6527.7x
  Using model parameters for aggregation, sketches for filtering
Sketchguard Node 7:
  Model dim: 1,174,986 → Sketch size: 180
  Compression ratio: 6527.7x
  Using model parameters for aggregation, sketches for filtering
Sketchguard Node 8:
  Model dim: 1,174,986 → Sketch size: 180
  Compression ratio: 6527.7x
  Using model parameters for aggregation, sketches for filtering
Sketchguard Node 9:
  Model dim: 1,174,986 → Sketch size: 180
  Compression ratio: 6527.7x
  Using model parameters for aggregation, sketches for filtering
Sketchguard Node 10:
  Model dim: 1,174,986 → Sketch size: 180
  Compression ratio: 6527.7x
  Using model parameters for aggregation, sketches for filtering
Sketchguard Node 11:
  Model dim: 1,174,986 → Sketch size: 180
  Compression ratio: 6527.7x
  Using model parameters for aggregation, sketches for filtering
Sketchguard Node 12:
  Model dim: 1,174,986 → Sketch size: 180
  Compression ratio: 6527.7x
  Using model parameters for aggregation, sketches for filtering
Sketchguard Node 13:
  Model dim: 1,174,986 → Sketch size: 180
  Compression ratio: 6527.7x
  Using model parameters for aggregation, sketches for filtering
Sketchguard Node 14:
  Model dim: 1,174,986 → Sketch size: 180
  Compression ratio: 6527.7x
  Using model parameters for aggregation, sketches for filtering
Sketchguard Node 15:
  Model dim: 1,174,986 → Sketch size: 180
  Compression ratio: 6527.7x
  Using model parameters for aggregation, sketches for filtering
Sketchguard Node 16:
  Model dim: 1,174,986 → Sketch size: 180
  Compression ratio: 6527.7x
  Using model parameters for aggregation, sketches for filtering
Sketchguard Node 17:
  Model dim: 1,174,986 → Sketch size: 180
  Compression ratio: 6527.7x
  Using model parameters for aggregation, sketches for filtering
Sketchguard Node 18:
  Model dim: 1,174,986 → Sketch size: 180
  Compression ratio: 6527.7x
  Using model parameters for aggregation, sketches for filtering
Sketchguard Node 19:
  Model dim: 1,174,986 → Sketch size: 180
  Compression ratio: 6527.7x
  Using model parameters for aggregation, sketches for filtering
Sketchguard ALGORITHM (Sketch-based Filtering + State Aggregation)
  - Model dimension: 1,174,986 parameters
  - Config: SketchguardConfig(gamma=2, kappa=1, alpha=0.5, min_neighbors=1, sketch_size=180, network_seed=987654321, attack_detection_window=5)
  - Sketch size: 180
  - Compression ratio: 6527.7x
  - Complexity: O(d + N×k) = O(1,174,986 + 20×180)
  - Theoretical speedup vs BALANCE: 19.9x
Initial test acc across nodes: mean=0.4953 ± 0.0174
Round 001: test acc mean=0.5495 ± 0.0334 | min=0.4985 max=0.6236
         : test loss mean=61.0142 ± 262.9499
         : individual accs = ['0.583263', '0.623604', '0.535118', '0.566575', '0.566021', '0.508592', '0.590687', '0.576531', '0.501189', '0.572254', '0.509481', '0.516291', '0.532395', '0.498538', '0.529050', '0.546440', '0.558621', '0.561408', '0.528594', '0.584902']
         : correct/total = [(8301, 14232), (8877, 14235), (7634, 14266), (8055, 14217), (8059, 14238), (7310, 14373), (8474, 14346), (8264, 14334), (7164, 14294), (8225, 14373), (7308, 14344), (7384, 14302), (7642, 14354), (7160, 14362), (7576, 14320), (7866, 14395), (8038, 14389), (8004, 14257), (7533, 14251), (8422, 14399)]
         : compromised: 0.5264, honest: 0.5594
         : sketchguard stats = ['Node 0: acc_rate=1.000', 'Node 1: acc_rate=1.000', 'Node 2: acc_rate=1.000']...
Round 002: test acc mean=0.6230 ± 0.0315 | min=0.4940 max=0.6442
         : test loss mean=34.3727 ± 146.9476
         : individual accs = ['0.641020', '0.644187', '0.635497', '0.625097', '0.640399', '0.619843', '0.632999', '0.627738', '0.622639', '0.608572', '0.624094', '0.637114', '0.641076', '0.494012', '0.622277', '0.635221', '0.637084', '0.603142', '0.627605', '0.640739']
         : correct/total = [(9123, 14232), (9170, 14235), (9066, 14266), (8887, 14217), (9118, 14238), (8909, 14373), (9081, 14346), (8998, 14334), (8900, 14294), (8747, 14373), (8952, 14344), (9112, 14302), (9202, 14354), (7095, 14362), (8911, 14320), (9144, 14395), (9167, 14389), (8599, 14257), (8944, 14251), (9226, 14399)]
         : compromised: 0.6013, honest: 0.6323
         : sketchguard stats = ['Node 0: acc_rate=1.000', 'Node 1: acc_rate=1.000', 'Node 2: acc_rate=1.000']...
Round 003: test acc mean=0.6268 ± 0.0288 | min=0.5068 max=0.6455
         : test loss mean=51.5664 ± 221.9440
         : individual accs = ['0.631464', '0.642079', '0.638231', '0.637617', '0.642717', '0.639880', '0.620382', '0.619157', '0.611795', '0.634245', '0.637897', '0.645504', '0.629859', '0.506824', '0.631913', '0.640639', '0.641532', '0.624956', '0.628377', '0.630460']
         : correct/total = [(8987, 14232), (9140, 14235), (9105, 14266), (9065, 14217), (9151, 14238), (9197, 14373), (8900, 14346), (8875, 14334), (8745, 14294), (9116, 14373), (9150, 14344), (9232, 14302), (9041, 14354), (7279, 14362), (9049, 14320), (9222, 14395), (9231, 14389), (8910, 14257), (8955, 14251), (9078, 14399)]
         : compromised: 0.6103, honest: 0.6338
         : sketchguard stats = ['Node 0: acc_rate=1.000', 'Node 1: acc_rate=1.000', 'Node 2: acc_rate=1.000']...
Round 004: test acc mean=0.6337 ± 0.0343 | min=0.4878 max=0.6525
         : test loss mean=22.5862 ± 95.6612
         : individual accs = ['0.647766', '0.643625', '0.645381', '0.646269', '0.648757', '0.643150', '0.641363', '0.637366', '0.630334', '0.621026', '0.640895', '0.642847', '0.644629', '0.487815', '0.626816', '0.645294', '0.648759', '0.643263', '0.635464', '0.652545']
         : correct/total = [(9219, 14232), (9162, 14235), (9207, 14266), (9188, 14217), (9237, 14238), (9244, 14373), (9201, 14346), (9136, 14334), (9010, 14294), (8926, 14373), (9193, 14344), (9194, 14302), (9253, 14354), (7006, 14362), (8976, 14320), (9289, 14395), (9335, 14389), (9171, 14257), (9056, 14251), (9396, 14399)]
         : compromised: 0.6135, honest: 0.6423
         : sketchguard stats = ['Node 0: acc_rate=1.000', 'Node 1: acc_rate=1.000', 'Node 2: acc_rate=1.000']...
Round 005: test acc mean=0.6383 ± 0.0317 | min=0.5024 max=0.6542
         : test loss mean=30.5922 ± 130.5788
         : individual accs = ['0.647625', '0.649596', '0.644329', '0.647957', '0.652971', '0.636402', '0.640527', '0.644482', '0.639709', '0.646351', '0.630577', '0.636974', '0.654173', '0.502437', '0.650140', '0.651268', '0.650566', '0.649576', '0.640727', '0.649212']
         : correct/total = [(9217, 14232), (9247, 14235), (9192, 14266), (9212, 14217), (9297, 14238), (9147, 14373), (9189, 14346), (9238, 14334), (9144, 14294), (9290, 14373), (9045, 14344), (9110, 14302), (9390, 14354), (7216, 14362), (9310, 14320), (9375, 14395), (9361, 14389), (9261, 14257), (9131, 14251), (9348, 14399)]
         : compromised: 0.6222, honest: 0.6452
         : sketchguard stats = ['Node 0: acc_rate=1.000', 'Node 1: acc_rate=1.000', 'Node 2: acc_rate=1.000']...
Round 006: test acc mean=0.6422 ± 0.0320 | min=0.5067 max=0.6622
         : test loss mean=38.3141 ± 164.2648
         : individual accs = ['0.653527', '0.649666', '0.645030', '0.654076', '0.657325', '0.638558', '0.644152', '0.649226', '0.639639', '0.640228', '0.640756', '0.639561', '0.642469', '0.506684', '0.659078', '0.658562', '0.662242', '0.657431', '0.646621', '0.659004']
         : correct/total = [(9301, 14232), (9248, 14235), (9202, 14266), (9299, 14217), (9359, 14238), (9178, 14373), (9241, 14346), (9306, 14334), (9143, 14294), (9202, 14373), (9191, 14344), (9147, 14302), (9222, 14354), (7277, 14362), (9438, 14320), (9480, 14395), (9529, 14389), (9373, 14257), (9215, 14251), (9489, 14399)]
         : compromised: 0.6251, honest: 0.6495
         : sketchguard stats = ['Node 0: acc_rate=1.000', 'Node 1: acc_rate=1.000', 'Node 2: acc_rate=1.000']...
Round 007: test acc mean=0.6450 ± 0.0366 | min=0.4911 max=0.6697
         : test loss mean=88.5352 ± 383.1896
         : individual accs = ['0.660132', '0.653600', '0.626384', '0.657171', '0.662382', '0.646072', '0.652168', '0.647342', '0.644816', '0.651917', '0.642359', '0.645714', '0.653546', '0.491088', '0.658799', '0.664536', '0.669748', '0.665147', '0.647323', '0.660115']
         : correct/total = [(9395, 14232), (9304, 14235), (8936, 14266), (9343, 14217), (9431, 14238), (9286, 14373), (9356, 14346), (9279, 14334), (9217, 14294), (9370, 14373), (9214, 14344), (9235, 14302), (9381, 14354), (7053, 14362), (9434, 14320), (9566, 14395), (9637, 14389), (9483, 14257), (9225, 14251), (9505, 14399)]
         : compromised: 0.6270, honest: 0.6527
         : sketchguard stats = ['Node 0: acc_rate=1.000', 'Node 1: acc_rate=1.000', 'Node 2: acc_rate=1.000']...
Round 008: test acc mean=0.6472 ± 0.0364 | min=0.4944 max=0.6737
         : test loss mean=98.4031 ± 426.2180
         : individual accs = ['0.660202', '0.653741', '0.658349', '0.653935', '0.647212', '0.652056', '0.639621', '0.635552', '0.646565', '0.649969', '0.649540', '0.652916', '0.659955', '0.494360', '0.667737', '0.668982', '0.673709', '0.669075', '0.648446', '0.662129']
         : correct/total = [(9396, 14232), (9306, 14235), (9392, 14266), (9297, 14217), (9215, 14238), (9372, 14373), (9176, 14346), (9110, 14334), (9242, 14294), (9342, 14373), (9317, 14344), (9338, 14302), (9473, 14354), (7100, 14362), (9562, 14320), (9630, 14395), (9694, 14389), (9539, 14257), (9241, 14251), (9534, 14399)]
         : compromised: 0.6319, honest: 0.6537
         : sketchguard stats = ['Node 0: acc_rate=1.000', 'Node 1: acc_rate=1.000', 'Node 2: acc_rate=1.000']...
Round 009: test acc mean=0.6490 ± 0.0348 | min=0.5095 max=0.6777
         : test loss mean=31.4817 ± 134.5267
         : individual accs = ['0.647133', '0.662662', '0.662905', '0.660477', '0.661469', '0.666736', '0.618012', '0.639668', '0.641808', '0.648299', '0.652817', '0.658439', '0.656333', '0.509469', '0.672416', '0.669469', '0.672736', '0.677702', '0.657919', '0.643309']
         : correct/total = [(9210, 14232), (9433, 14235), (9457, 14266), (9390, 14217), (9418, 14238), (9583, 14373), (8866, 14346), (9169, 14334), (9174, 14294), (9318, 14373), (9364, 14344), (9417, 14302), (9421, 14354), (7317, 14362), (9629, 14320), (9637, 14395), (9680, 14389), (9662, 14257), (9376, 14251), (9263, 14399)]
         : compromised: 0.6401, honest: 0.6528
         : sketchguard stats = ['Node 0: acc_rate=1.000', 'Node 1: acc_rate=1.000', 'Node 2: acc_rate=1.000']...
Round 010: test acc mean=0.6584 ± 0.0359 | min=0.5070 max=0.6853
         : test loss mean=127.3094 ± 552.2676
         : individual accs = ['0.664770', '0.665332', '0.665779', '0.667511', '0.670811', '0.665901', '0.657605', '0.658853', '0.654191', '0.651082', '0.659021', '0.659069', '0.663160', '0.506963', '0.678073', '0.685307', '0.684690', '0.678123', '0.660585', '0.670463']
         : correct/total = [(9461, 14232), (9471, 14235), (9498, 14266), (9490, 14217), (9551, 14238), (9571, 14373), (9434, 14346), (9444, 14334), (9351, 14294), (9358, 14373), (9453, 14344), (9426, 14302), (9519, 14354), (7281, 14362), (9710, 14320), (9865, 14395), (9852, 14389), (9668, 14257), (9414, 14251), (9654, 14399)]
         : compromised: 0.6421, honest: 0.6653
         : sketchguard stats = ['Node 0: acc_rate=1.000', 'Node 1: acc_rate=1.000', 'Node 2: acc_rate=1.000']...

=== FINAL RESULTS ===
Dataset: sent140, Nodes: 20, Graph: ring, Aggregation: sketchguard
Attack: gaussian, 30.0% compromised
Final accuracy - Compromised: 0.6421, Honest: 0.6653
Overall test accuracy: mean=0.6584 ± 0.0359

=== Sketchguard SUMMARY ===
Node 0: acceptance=1.000
Node 1: acceptance=1.000
Node 2: acceptance=1.000
Node 3: acceptance=1.000
Node 4: acceptance=0.500
Node 5: acceptance=0.750
Node 6: acceptance=0.500
Node 7: acceptance=1.000
Node 8: acceptance=1.000
Node 9: acceptance=1.000
Node 10: acceptance=1.000
Node 11: acceptance=0.500
Node 12: acceptance=0.500
Node 13: acceptance=0.500
Node 14: acceptance=0.500
Node 15: acceptance=0.500
Node 16: acceptance=0.500
Node 17: acceptance=0.500
Node 18: acceptance=0.500
Node 19: acceptance=0.500

=== PARALLEL EXECUTION TIME (realistic for distributed system) ===
  COMMUNICATION (max across nodes):
    - Sketch transfer: 0.000s (0.0%)
    - Model fetch (accepted): 0.000s (0.0%)
  COMPUTATION (max across nodes):
    - Sketching: 0.204s (93.8%)
    - Filtering: 0.001s (0.3%)
    - Aggregation: 0.013s (5.9%)
  TOTALS:
    - Total computation: 0.217s (100.0%)
    - Total communication: 0.000s (0.0%)
    - Total parallel time: 0.217s

=== PER-NODE AVERAGE TIME ===
  - Sketching: 0.155s
  - Filtering: 0.000s
  - Aggregation: 0.006s
  - Sketch transfer: 0.000s
  - Model fetch: 0.000s
  - Total per node: 0.162s

=== TOTAL COMPUTATIONAL WORK (sum across all nodes) ===
  - Total sketching: 3.109s
  - Total filtering: 0.006s
  - Total aggregation: 0.119s
  - Total sketch transfer: 0.000s
  - Total model fetch: 0.000s
  - Grand total: 3.234s
  - Mean acceptance rate: 0.713

Sketchguard Algorithm Properties:
  - Original dimension: 1,174,986
  - Sketch size: 180
  - Compression ratio: 19.9x
  - Single repetition: No repetitions needed
  - Theoretical complexity: O(d + N×k)
  - Approach: Sketch filtering + state aggregation
