Device: cuda
Seed: 987654321
Loading 1 LEAF Sent140 train files...
LEAF Sent140 train: 254555 users, 908652 samples
Building vocabulary (max_size=10000)...
Vocabulary size: 10000
Loading 1 LEAF Sent140 test files...
LEAF Sent140 test: 254555 users, 286281 samples
Found 254555 train users, 254555 test users, 254555 common users
User sample counts range: 494 (max) to 1 (min)
Distributed ALL 254555 users across 20 clients
Users per client: 12727 (with 15 clients getting +1 user)
Train partition sizes: [44353, 44290, 44657, 44907, 44696, 45843, 45801, 45619, 45069, 45639, 45821, 45311, 45779, 46056, 45625, 45984, 46428, 44737, 45540, 46497]
Test partition sizes: [14232, 14235, 14266, 14217, 14238, 14373, 14346, 14334, 14294, 14373, 14344, 14302, 14354, 14362, 14320, 14395, 14389, 14257, 14251, 14399]
  Client 0: 44353 train samples, 2 unique classes
  Client 1: 44290 train samples, 2 unique classes
  Client 2: 44657 train samples, 2 unique classes
  Client 3: 44907 train samples, 2 unique classes
  Client 4: 44696 train samples, 2 unique classes
  Client 5: 45843 train samples, 2 unique classes
  Client 6: 45801 train samples, 2 unique classes
  Client 7: 45619 train samples, 2 unique classes
  Client 8: 45069 train samples, 2 unique classes
  Client 9: 45639 train samples, 2 unique classes
  Client 10: 45821 train samples, 2 unique classes
  Client 11: 45311 train samples, 2 unique classes
  Client 12: 45779 train samples, 2 unique classes
  Client 13: 46056 train samples, 2 unique classes
  Client 14: 45625 train samples, 2 unique classes
  Client 15: 45984 train samples, 2 unique classes
  Client 16: 46428 train samples, 2 unique classes
  Client 17: 44737 train samples, 2 unique classes
  Client 18: 45540 train samples, 2 unique classes
  Client 19: 46497 train samples, 2 unique classes
Will sample 4500 samples per client per epoch
Graph: ring, nodes: 20, edges: 20
Degree statistics: avg=2.00, min=2, max=2
Attack: Compromised 2/20 nodes: [5, 13]
Attack type: gaussian, lambda: 1.0
Model variant: baseline
Model parameters: 1,174,986
BALANCE algorithm:
Balance Config: BALANCEConfig(gamma=2, kappa=1, alpha=0.5, min_neighbors=1)
  - Model dimension: 1,174,986 parameters
  - Complexity: O(N×d) = O(20×1,174,986)
Initial test acc across nodes: mean=0.4965 ± 0.0152
Round 001: test acc mean=0.5298 ± 0.0198 | min=0.4980 max=0.5627
         : test loss mean=0.6918 ± 0.0011
         : individual accs = ['0.511031', '0.553495', '0.515211', '0.554407', '0.517980', '0.509288', '0.562666', '0.526441', '0.518679', '0.540110', '0.498048', '0.560621', '0.505713', '0.546790', '0.524860', '0.540396', '0.524776', '0.521218', '0.508736', '0.555941']
         : correct/total = [(7273, 14232), (7879, 14235), (7350, 14266), (7882, 14217), (7375, 14238), (7320, 14373), (8072, 14346), (7546, 14334), (7414, 14294), (7763, 14373), (7144, 14344), (8018, 14302), (7259, 14354), (7853, 14362), (7516, 14320), (7779, 14395), (7551, 14389), (7431, 14257), (7250, 14251), (8005, 14399)]
         : compromised: 0.5280, honest: 0.5300
Round 002: test acc mean=0.5206 ± 0.0310 | min=0.4886 max=0.6042
         : test loss mean=0.6905 ± 0.0033
         : individual accs = ['0.491568', '0.508114', '0.488925', '0.504607', '0.526759', '0.493912', '0.604210', '0.553300', '0.488597', '0.498782', '0.513385', '0.562299', '0.584297', '0.514204', '0.526047', '0.508093', '0.504552', '0.517570', '0.503754', '0.519203']
         : correct/total = [(6996, 14232), (7233, 14235), (6975, 14266), (7174, 14217), (7500, 14238), (7099, 14373), (8668, 14346), (7931, 14334), (6984, 14294), (7169, 14373), (7364, 14344), (8042, 14302), (8387, 14354), (7385, 14362), (7533, 14320), (7314, 14395), (7260, 14389), (7379, 14257), (7179, 14251), (7476, 14399)]
         : compromised: 0.5041, honest: 0.5224
Round 003: test acc mean=0.5212 ± 0.0385 | min=0.4860 max=0.6066
         : test loss mean=0.6893 ± 0.0054
         : individual accs = ['0.489179', '0.486266', '0.485981', '0.524091', '0.563913', '0.493843', '0.605116', '0.559718', '0.488597', '0.493147', '0.499930', '0.564536', '0.606590', '0.508564', '0.553282', '0.507746', '0.499757', '0.503051', '0.491334', '0.499896']
         : correct/total = [(6962, 14232), (6922, 14235), (6933, 14266), (7451, 14217), (8029, 14238), (7098, 14373), (8681, 14346), (8023, 14334), (6984, 14294), (7088, 14373), (7171, 14344), (8074, 14302), (8707, 14354), (7304, 14362), (7923, 14320), (7309, 14395), (7191, 14389), (7172, 14257), (7002, 14251), (7198, 14399)]
         : compromised: 0.5012, honest: 0.5235
Round 004: test acc mean=0.5298 ± 0.0439 | min=0.4871 max=0.6138
         : test loss mean=0.6878 ± 0.0071
         : individual accs = ['0.489250', '0.487109', '0.496355', '0.561933', '0.580067', '0.493843', '0.606998', '0.585461', '0.489226', '0.493286', '0.500418', '0.587051', '0.613836', '0.508564', '0.569344', '0.536575', '0.499757', '0.503121', '0.494000', '0.499479']
         : correct/total = [(6963, 14232), (6934, 14235), (7081, 14266), (7989, 14217), (8259, 14238), (7098, 14373), (8708, 14346), (8392, 14334), (6993, 14294), (7090, 14373), (7178, 14344), (8396, 14302), (8811, 14354), (7304, 14362), (8153, 14320), (7724, 14395), (7191, 14389), (7173, 14257), (7040, 14251), (7192, 14399)]
         : compromised: 0.5012, honest: 0.5330
Round 005: test acc mean=0.5342 ± 0.0500 | min=0.4863 max=0.6222
         : test loss mean=0.6863 ± 0.0091
         : individual accs = ['0.489109', '0.486266', '0.488504', '0.572273', '0.591445', '0.493843', '0.622194', '0.617622', '0.493983', '0.492938', '0.501325', '0.589358', '0.616553', '0.508495', '0.577165', '0.553039', '0.499826', '0.503051', '0.490281', '0.496493']
         : correct/total = [(6961, 14232), (6922, 14235), (6969, 14266), (8136, 14217), (8421, 14238), (7098, 14373), (8926, 14346), (8853, 14334), (7061, 14294), (7085, 14373), (7191, 14344), (8429, 14302), (8850, 14354), (7303, 14362), (8265, 14320), (7961, 14395), (7192, 14389), (7172, 14257), (6987, 14251), (7149, 14399)]
         : compromised: 0.5012, honest: 0.5379
Round 006: test acc mean=0.5398 ± 0.0498 | min=0.4863 max=0.6223
         : test loss mean=0.6843 ± 0.0112
         : individual accs = ['0.489109', '0.486266', '0.505257', '0.584019', '0.594044', '0.493843', '0.622264', '0.619925', '0.522317', '0.493703', '0.545315', '0.614180', '0.614672', '0.508564', '0.567528', '0.546579', '0.499965', '0.503121', '0.489018', '0.496354']
         : correct/total = [(6961, 14232), (6922, 14235), (7208, 14266), (8303, 14217), (8458, 14238), (7098, 14373), (8927, 14346), (8886, 14334), (7466, 14294), (7096, 14373), (7822, 14344), (8784, 14302), (8823, 14354), (7304, 14362), (8127, 14320), (7868, 14395), (7194, 14389), (7173, 14257), (6969, 14251), (7147, 14399)]
         : compromised: 0.5012, honest: 0.5441
Round 007: test acc mean=0.5455 ± 0.0523 | min=0.4864 max=0.6223
         : test loss mean=0.6821 ± 0.0132
         : individual accs = ['0.489109', '0.486407', '0.532104', '0.598509', '0.606476', '0.493843', '0.621497', '0.618739', '0.523017', '0.493703', '0.551450', '0.620123', '0.622266', '0.509121', '0.583589', '0.570198', '0.500799', '0.503051', '0.488808', '0.496354']
         : correct/total = [(6961, 14232), (6924, 14235), (7591, 14266), (8509, 14217), (8635, 14238), (7098, 14373), (8916, 14346), (8869, 14334), (7476, 14294), (7096, 14373), (7910, 14344), (8869, 14302), (8932, 14354), (7312, 14362), (8357, 14320), (8208, 14395), (7206, 14389), (7172, 14257), (6966, 14251), (7147, 14399)]
         : compromised: 0.5015, honest: 0.5503
Round 008: test acc mean=0.5651 ± 0.0532 | min=0.4863 max=0.6299
         : test loss mean=0.6782 ± 0.0146
         : individual accs = ['0.489109', '0.486266', '0.541357', '0.610115', '0.611954', '0.593752', '0.629862', '0.625296', '0.573597', '0.500035', '0.592094', '0.623060', '0.625749', '0.607158', '0.590852', '0.591177', '0.520676', '0.503542', '0.490702', '0.496354']
         : correct/total = [(6961, 14232), (6922, 14235), (7723, 14266), (8674, 14217), (8713, 14238), (8534, 14373), (9036, 14346), (8963, 14334), (8199, 14294), (7187, 14373), (8493, 14344), (8911, 14302), (8982, 14354), (8720, 14362), (8461, 14320), (8510, 14395), (7492, 14389), (7179, 14257), (6993, 14251), (7147, 14399)]
         : compromised: 0.6005, honest: 0.5612
Round 009: test acc mean=0.5699 ± 0.0552 | min=0.4874 max=0.6352
         : test loss mean=0.6735 ± 0.0175
         : individual accs = ['0.489109', '0.487390', '0.582504', '0.612436', '0.615466', '0.635219', '0.629792', '0.628087', '0.562404', '0.497391', '0.584914', '0.621801', '0.630277', '0.629160', '0.581075', '0.581105', '0.532977', '0.505927', '0.493860', '0.496354']
         : correct/total = [(6961, 14232), (6938, 14235), (8310, 14266), (8707, 14217), (8763, 14238), (9130, 14373), (9035, 14346), (9003, 14334), (8039, 14294), (7149, 14373), (8390, 14344), (8893, 14302), (9047, 14354), (9036, 14362), (8321, 14320), (8365, 14395), (7669, 14389), (7213, 14257), (7038, 14251), (7147, 14399)]
         : compromised: 0.6322, honest: 0.5629
Round 010: test acc mean=0.5834 ± 0.0555 | min=0.4887 max=0.6398
         : test loss mean=0.6694 ± 0.0196
         : individual accs = ['0.489109', '0.504110', '0.608720', '0.617148', '0.617432', '0.639811', '0.634393', '0.630599', '0.615783', '0.540875', '0.611405', '0.630891', '0.639195', '0.636332', '0.598464', '0.600973', '0.562861', '0.504594', '0.488667', '0.496354']
         : correct/total = [(6961, 14232), (7176, 14235), (8684, 14266), (8774, 14217), (8791, 14238), (9196, 14373), (9101, 14346), (9039, 14334), (8802, 14294), (7774, 14373), (8770, 14344), (9023, 14302), (9175, 14354), (9139, 14362), (8570, 14320), (8651, 14395), (8099, 14389), (7194, 14257), (6964, 14251), (7147, 14399)]
         : compromised: 0.6381, honest: 0.5773

=== FINAL RESULTS ===
Dataset: sent140, Nodes: 20, Graph: ring, Aggregation: balance
Attack: gaussian, 10.0% compromised
Final accuracy - Compromised: 0.6381, Honest: 0.5773
Overall test accuracy: mean=0.5834 ± 0.0555

=== BALANCE SUMMARY ===
Node 0: acceptance=1.000
Node 1: acceptance=1.000
Node 2: acceptance=1.000
Node 3: acceptance=1.000
Node 4: acceptance=0.500
Node 5: acceptance=0.800
Node 6: acceptance=0.500
Node 7: acceptance=1.000
Node 8: acceptance=1.000
Node 9: acceptance=1.000
Node 10: acceptance=1.000
Node 11: acceptance=1.000
Node 12: acceptance=0.500
Node 13: acceptance=0.800
Node 14: acceptance=0.500
Node 15: acceptance=1.000
Node 16: acceptance=1.000
Node 17: acceptance=1.000
Node 18: acceptance=1.000
Node 19: acceptance=1.000

=== PARALLEL EXECUTION TIME (realistic for distributed system) ===
  COMMUNICATION (max across nodes):
    - Full model transfer: 0.000s (0.0%)
  COMPUTATION (max across nodes):
    - Filtering: 0.026s (69.3%)
    - Aggregation: 0.012s (30.7%)
  TOTALS:
    - Total computation: 0.038s (100.0%)
    - Total communication: 0.000s (0.0%)
    - Total parallel time: 0.038s

=== PER-NODE AVERAGE TIME ===
  - Filtering: 0.013s
  - Aggregation: 0.006s
  - Model transfer: 0.000s
  - Total per node: 0.018s

=== TOTAL COMPUTATIONAL WORK (sum across all nodes) ===
  - Total filtering: 0.251s
  - Total aggregation: 0.116s
  - Total model transfer: 0.000s
  - Grand total: 0.367s
  - Mean acceptance rate: 0.880

BALANCE Algorithm Properties:
  - Model dimension: 1,174,986
  - No compression: Full parameter comparison
  - Theoretical complexity: O(deg(i)×d)
  - Approach: Full parameter filtering + averaging
