Device: cuda
Seed: 987654321
Loading 1 LEAF Sent140 train files...
LEAF Sent140 train: 254555 users, 908652 samples
Building vocabulary (max_size=10000)...
Vocabulary size: 10000
Loading 1 LEAF Sent140 test files...
LEAF Sent140 test: 254555 users, 286281 samples
Found 254555 train users, 254555 test users, 254555 common users
User sample counts range: 494 (max) to 1 (min)
Distributed ALL 254555 users across 20 clients
Users per client: 12727 (with 15 clients getting +1 user)
Train partition sizes: [44353, 44290, 44657, 44907, 44696, 45843, 45801, 45619, 45069, 45639, 45821, 45311, 45779, 46056, 45625, 45984, 46428, 44737, 45540, 46497]
Test partition sizes: [14232, 14235, 14266, 14217, 14238, 14373, 14346, 14334, 14294, 14373, 14344, 14302, 14354, 14362, 14320, 14395, 14389, 14257, 14251, 14399]
  Client 0: 44353 train samples, 2 unique classes
  Client 1: 44290 train samples, 2 unique classes
  Client 2: 44657 train samples, 2 unique classes
  Client 3: 44907 train samples, 2 unique classes
  Client 4: 44696 train samples, 2 unique classes
  Client 5: 45843 train samples, 2 unique classes
  Client 6: 45801 train samples, 2 unique classes
  Client 7: 45619 train samples, 2 unique classes
  Client 8: 45069 train samples, 2 unique classes
  Client 9: 45639 train samples, 2 unique classes
  Client 10: 45821 train samples, 2 unique classes
  Client 11: 45311 train samples, 2 unique classes
  Client 12: 45779 train samples, 2 unique classes
  Client 13: 46056 train samples, 2 unique classes
  Client 14: 45625 train samples, 2 unique classes
  Client 15: 45984 train samples, 2 unique classes
  Client 16: 46428 train samples, 2 unique classes
  Client 17: 44737 train samples, 2 unique classes
  Client 18: 45540 train samples, 2 unique classes
  Client 19: 46497 train samples, 2 unique classes
Will sample 4500 samples per client per epoch
Graph: erdos, nodes: 20, edges: 99
Degree statistics: avg=9.90, min=7, max=14
Attack: Compromised 16/20 nodes: [1, 2, 3, 5, 6, 8, 9, 10, 11, 12, 13, 14, 15, 17, 18, 19]
Attack type: directed_deviation, lambda: 1.0
Model variant: baseline
Model parameters: 1,174,986
UBAR ALGORITHM (Two-Stage Byzantine-resilient)
  - Model dimension: 1,174,986 parameters
  - Rho parameter: 0.19999999999999996
  - Stage 1: Distance-based filtering (select 20% closest neighbors)
  - Stage 2: Performance-based selection (loss comparison)
  - Complexity: O(deg(i)×d + deg(i)×inference)
Initial test acc across nodes: mean=0.4965 ± 0.0152
Round 001: test acc mean=0.5286 ± 0.0248 | min=0.4805 max=0.5722
         : test loss mean=0.8797 ± 0.8216
         : individual accs = ['0.544056', '0.480506', '0.487593', '0.509601', '0.513204', '0.535170', '0.507040', '0.563555', '0.533581', '0.543589', '0.517987', '0.551951', '0.572175', '0.539410', '0.506564', '0.554081', '0.545903', '0.524023', '0.545646', '0.495729']
         : correct/total = [(7743, 14232), (6840, 14235), (6956, 14266), (7245, 14217), (7307, 14238), (7692, 14373), (7274, 14346), (8078, 14334), (7627, 14294), (7813, 14373), (7430, 14344), (7894, 14302), (8213, 14354), (7747, 14362), (7254, 14320), (7976, 14395), (7855, 14389), (7471, 14257), (7776, 14251), (7138, 14399)]
         : compromised: 0.5253, honest: 0.5417
         : ubar stats = ['Node 0: s1=0.167, s2=0.500', 'Node 1: s1=0.100, s2=1.000', 'Node 2: s1=0.125, s2=1.000']...
Round 002: test acc mean=0.5628 ± 0.0351 | min=0.4816 max=0.6000
         : test loss mean=0.8076 ± 0.5281
         : individual accs = ['0.593873', '0.534668', '0.508902', '0.574031', '0.599733', '0.585473', '0.562108', '0.599972', '0.565622', '0.575176', '0.546152', '0.592784', '0.596837', '0.529244', '0.496299', '0.568948', '0.594482', '0.556428', '0.593572', '0.481631']
         : correct/total = [(8452, 14232), (7611, 14235), (7260, 14266), (8161, 14217), (8539, 14238), (8415, 14373), (8064, 14346), (8600, 14334), (8085, 14294), (8267, 14373), (7834, 14344), (8478, 14302), (8567, 14354), (7601, 14362), (7107, 14320), (8190, 14395), (8554, 14389), (7933, 14257), (8459, 14251), (6935, 14399)]
         : compromised: 0.5542, honest: 0.5970
         : ubar stats = ['Node 0: s1=0.167, s2=0.500', 'Node 1: s1=0.100, s2=1.000', 'Node 2: s1=0.125, s2=1.000']...
Round 003: test acc mean=0.5896 ± 0.0252 | min=0.5120 max=0.6089
         : test loss mean=0.7622 ± 0.3644
         : individual accs = ['0.587338', '0.600281', '0.597154', '0.583456', '0.606757', '0.598275', '0.598703', '0.607855', '0.600182', '0.575454', '0.588120', '0.604741', '0.608263', '0.607297', '0.525978', '0.591525', '0.608868', '0.595497', '0.594835', '0.512049']
         : correct/total = [(8359, 14232), (8545, 14235), (8519, 14266), (8295, 14217), (8639, 14238), (8599, 14373), (8589, 14346), (8713, 14334), (8579, 14294), (8271, 14373), (8436, 14344), (8649, 14302), (8731, 14354), (8722, 14362), (7532, 14320), (8515, 14395), (8761, 14389), (8490, 14257), (8477, 14251), (7373, 14399)]
         : compromised: 0.5864, honest: 0.6027
         : ubar stats = ['Node 0: s1=0.167, s2=0.500', 'Node 1: s1=0.100, s2=1.000', 'Node 2: s1=0.125, s2=1.000']...
Round 004: test acc mean=0.6019 ± 0.0297 | min=0.4914 max=0.6193
         : test loss mean=0.7621 ± 0.4145
         : individual accs = ['0.612704', '0.619319', '0.610613', '0.609763', '0.614272', '0.615181', '0.597658', '0.618041', '0.602071', '0.612677', '0.608547', '0.612222', '0.615787', '0.615235', '0.544274', '0.611393', '0.610883', '0.606790', '0.610133', '0.491354']
         : correct/total = [(8720, 14232), (8816, 14235), (8711, 14266), (8669, 14217), (8746, 14238), (8842, 14373), (8574, 14346), (8859, 14334), (8606, 14294), (8806, 14373), (8729, 14344), (8756, 14302), (8839, 14354), (8836, 14362), (7794, 14320), (8801, 14395), (8790, 14389), (8651, 14257), (8695, 14251), (7075, 14399)]
         : compromised: 0.5989, honest: 0.6140
         : ubar stats = ['Node 0: s1=0.167, s2=0.500', 'Node 1: s1=0.100, s2=1.000', 'Node 2: s1=0.125, s2=1.000']...
Round 005: test acc mean=0.6138 ± 0.0267 | min=0.5021 max=0.6297
         : test loss mean=0.7774 ± 0.5300
         : individual accs = ['0.616358', '0.622410', '0.622809', '0.625237', '0.629723', '0.625757', '0.615781', '0.628506', '0.609417', '0.612329', '0.615588', '0.622011', '0.625401', '0.627280', '0.595531', '0.621535', '0.615818', '0.620327', '0.621079', '0.502118']
         : correct/total = [(8772, 14232), (8860, 14235), (8885, 14266), (8889, 14217), (8966, 14238), (8994, 14373), (8834, 14346), (9009, 14334), (8711, 14294), (8801, 14373), (8830, 14344), (8896, 14302), (8977, 14354), (9009, 14362), (8528, 14320), (8947, 14395), (8861, 14389), (8844, 14257), (8851, 14251), (7230, 14399)]
         : compromised: 0.6115, honest: 0.6226
         : ubar stats = ['Node 0: s1=0.167, s2=0.600', 'Node 1: s1=0.100, s2=1.000', 'Node 2: s1=0.125, s2=1.000']...
Round 006: test acc mean=0.6201 ± 0.0250 | min=0.5169 max=0.6352
         : test loss mean=0.7162 ± 0.2953
         : individual accs = ['0.619098', '0.627889', '0.631782', '0.630583', '0.635061', '0.634106', '0.622473', '0.635203', '0.613334', '0.622139', '0.622211', '0.630751', '0.632855', '0.631737', '0.602235', '0.624453', '0.615609', '0.625447', '0.628447', '0.516911']
         : correct/total = [(8811, 14232), (8938, 14235), (9013, 14266), (8965, 14217), (9042, 14238), (9114, 14373), (8930, 14346), (9105, 14334), (8767, 14294), (8942, 14373), (8925, 14344), (9021, 14302), (9084, 14354), (9073, 14362), (8624, 14320), (8989, 14395), (8858, 14389), (8917, 14257), (8956, 14251), (7443, 14399)]
         : compromised: 0.6186, honest: 0.6262
         : ubar stats = ['Node 0: s1=0.167, s2=0.583', 'Node 1: s1=0.100, s2=1.000', 'Node 2: s1=0.125, s2=1.000']...
Round 007: test acc mean=0.6257 ± 0.0282 | min=0.5059 max=0.6409
         : test loss mean=0.7121 ± 0.2945
         : individual accs = ['0.635540', '0.621777', '0.637740', '0.636351', '0.640820', '0.640854', '0.629862', '0.638901', '0.627606', '0.630140', '0.624861', '0.639211', '0.630835', '0.636471', '0.619064', '0.631956', '0.625061', '0.629515', '0.632377', '0.505868']
         : correct/total = [(9045, 14232), (8851, 14235), (9098, 14266), (9047, 14217), (9124, 14238), (9211, 14373), (9036, 14346), (9158, 14334), (8971, 14294), (9057, 14373), (8963, 14344), (9142, 14302), (9055, 14354), (9141, 14362), (8865, 14320), (9097, 14395), (8994, 14389), (8975, 14257), (9012, 14251), (7284, 14399)]
         : compromised: 0.6234, honest: 0.6351
         : ubar stats = ['Node 0: s1=0.167, s2=0.643', 'Node 1: s1=0.100, s2=1.000', 'Node 2: s1=0.125, s2=1.000']...
Round 008: test acc mean=0.6291 ± 0.0274 | min=0.5114 max=0.6436
         : test loss mean=0.6945 ± 0.2346
         : individual accs = ['0.635399', '0.634633', '0.638581', '0.643596', '0.637168', '0.639880', '0.632232', '0.637226', '0.631664', '0.630836', '0.636015', '0.630821', '0.633412', '0.636193', '0.626327', '0.640500', '0.625686', '0.639335', '0.640446', '0.511355']
         : correct/total = [(9043, 14232), (9034, 14235), (9110, 14266), (9150, 14217), (9072, 14238), (9197, 14373), (9070, 14346), (9134, 14334), (9029, 14294), (9067, 14373), (9123, 14344), (9022, 14302), (9092, 14354), (9137, 14362), (8969, 14320), (9220, 14395), (9003, 14389), (9115, 14257), (9127, 14251), (7363, 14399)]
         : compromised: 0.6279, honest: 0.6339
         : ubar stats = ['Node 0: s1=0.167, s2=0.688', 'Node 1: s1=0.100, s2=1.000', 'Node 2: s1=0.125, s2=1.000']...
Round 009: test acc mean=0.6315 ± 0.0314 | min=0.4968 max=0.6457
         : test loss mean=0.6845 ± 0.2058
         : individual accs = ['0.643971', '0.638497', '0.644329', '0.643807', '0.643279', '0.645725', '0.632232', '0.638901', '0.635441', '0.635428', '0.638176', '0.641519', '0.638428', '0.636610', '0.621369', '0.641403', '0.629717', '0.642071', '0.642551', '0.496840']
         : correct/total = [(9165, 14232), (9089, 14235), (9192, 14266), (9153, 14217), (9159, 14238), (9281, 14373), (9070, 14346), (9158, 14334), (9083, 14294), (9133, 14373), (9154, 14344), (9175, 14302), (9164, 14354), (9143, 14362), (8898, 14320), (9233, 14395), (9061, 14389), (9154, 14257), (9157, 14251), (7154, 14399)]
         : compromised: 0.6297, honest: 0.6390
         : ubar stats = ['Node 0: s1=0.167, s2=0.722', 'Node 1: s1=0.100, s2=1.000', 'Node 2: s1=0.125, s2=1.000']...
Round 010: test acc mean=0.6345 ± 0.0312 | min=0.4996 max=0.6495
         : test loss mean=0.7079 ± 0.3178
         : individual accs = ['0.647836', '0.641798', '0.640334', '0.649504', '0.648757', '0.642176', '0.636763', '0.645319', '0.637260', '0.640924', '0.643475', '0.639561', '0.646301', '0.636959', '0.633589', '0.640500', '0.634304', '0.642491', '0.641920', '0.499618']
         : correct/total = [(9220, 14232), (9136, 14235), (9135, 14266), (9234, 14217), (9237, 14238), (9230, 14373), (9135, 14346), (9250, 14334), (9109, 14294), (9212, 14373), (9230, 14344), (9147, 14302), (9277, 14354), (9148, 14362), (9073, 14320), (9220, 14395), (9127, 14389), (9160, 14257), (9148, 14251), (7194, 14399)]
         : compromised: 0.6321, honest: 0.6441
         : ubar stats = ['Node 0: s1=0.167, s2=0.750', 'Node 1: s1=0.100, s2=1.000', 'Node 2: s1=0.125, s2=1.000']...

=== FINAL RESULTS ===
Dataset: sent140, Nodes: 20, Graph: erdos, Aggregation: ubar
Attack: directed_deviation, 80.0% compromised
Final accuracy - Compromised: 0.6321, Honest: 0.6441
Overall test accuracy: mean=0.6345 ± 0.0312

=== UBAR SUMMARY ===
Node 0: stage1=0.167, stage2=0.750, overall=0.125
Node 1: stage1=0.100, stage2=1.000, overall=0.100
Node 2: stage1=0.125, stage2=1.000, overall=0.125
Node 3: stage1=0.143, stage2=1.000, overall=0.143
Node 4: stage1=0.111, stage2=1.000, overall=0.111
Node 5: stage1=0.100, stage2=1.000, overall=0.100
Node 6: stage1=0.167, stage2=0.500, overall=0.083
Node 7: stage1=0.182, stage2=0.500, overall=0.091
Node 8: stage1=0.143, stage2=1.000, overall=0.143
Node 9: stage1=0.182, stage2=0.600, overall=0.109
Node 10: stage1=0.125, stage2=1.000, overall=0.125
Node 11: stage1=0.167, stage2=0.500, overall=0.083
Node 12: stage1=0.167, stage2=0.600, overall=0.100
Node 13: stage1=0.111, stage2=1.000, overall=0.111
Node 14: stage1=0.143, stage2=0.900, overall=0.129
Node 15: stage1=0.111, stage2=1.000, overall=0.111
Node 16: stage1=0.143, stage2=1.000, overall=0.143
Node 17: stage1=0.125, stage2=1.000, overall=0.125
Node 18: stage1=0.167, stage2=0.650, overall=0.108
Node 19: stage1=0.100, stage2=1.000, overall=0.100

=== PARALLEL EXECUTION TIME (realistic for distributed system) ===
  COMMUNICATION (max across nodes):
    - Full model transfer: 0.000s (0.0%)
  COMPUTATION (max across nodes):
    - Distance computation: 0.055s (75.7%)
    - Loss computation: 0.013s (18.3%)
    - Aggregation: 0.004s (6.0%)
  TOTALS:
    - Total computation: 0.073s (100.0%)
    - Total communication: 0.000s (0.0%)
    - Total parallel time: 0.073s

=== PER-NODE AVERAGE TIME ===
  - Distance computation: 0.041s
  - Loss computation: 0.010s
  - Aggregation: 0.003s
  - Model transfer: 0.000s
  - Total per node: 0.054s

=== TOTAL COMPUTATIONAL WORK (sum across all nodes) ===
  - Total distance computation: 0.820s
  - Total loss computation: 0.193s
  - Total aggregation: 0.069s
  - Total model transfer: 0.000s
  - Grand total: 1.082s
  - Mean Stage 1 acceptance rate: 0.139
  - Mean Stage 2 acceptance rate: 0.850
  - Overall acceptance rate: 0.118

UBAR Algorithm Properties:
  - Model dimension: 1,174,986
  - Rho parameter: 0.19999999999999996
  - Two-stage approach: Distance filtering + loss evaluation
  - Stage 1 selects: 20% of neighbors
  - Stage 2 uses: Training sample loss comparison
  - Theoretical complexity: O(deg(i)×d + deg(i)×inference)
  - Approach: UBAR paper implementation
