Device: cuda
Seed: 987654321
Loading 1 LEAF Sent140 train files...
LEAF Sent140 train: 254555 users, 908652 samples
Building vocabulary (max_size=10000)...
Vocabulary size: 10000
Loading 1 LEAF Sent140 test files...
LEAF Sent140 test: 254555 users, 286281 samples
Found 254555 train users, 254555 test users, 254555 common users
User sample counts range: 494 (max) to 1 (min)
Distributed ALL 254555 users across 20 clients
Users per client: 12727 (with 15 clients getting +1 user)
Train partition sizes: [44353, 44290, 44657, 44907, 44696, 45843, 45801, 45619, 45069, 45639, 45821, 45311, 45779, 46056, 45625, 45984, 46428, 44737, 45540, 46497]
Test partition sizes: [14232, 14235, 14266, 14217, 14238, 14373, 14346, 14334, 14294, 14373, 14344, 14302, 14354, 14362, 14320, 14395, 14389, 14257, 14251, 14399]
  Client 0: 44353 train samples, 2 unique classes
  Client 1: 44290 train samples, 2 unique classes
  Client 2: 44657 train samples, 2 unique classes
  Client 3: 44907 train samples, 2 unique classes
  Client 4: 44696 train samples, 2 unique classes
  Client 5: 45843 train samples, 2 unique classes
  Client 6: 45801 train samples, 2 unique classes
  Client 7: 45619 train samples, 2 unique classes
  Client 8: 45069 train samples, 2 unique classes
  Client 9: 45639 train samples, 2 unique classes
  Client 10: 45821 train samples, 2 unique classes
  Client 11: 45311 train samples, 2 unique classes
  Client 12: 45779 train samples, 2 unique classes
  Client 13: 46056 train samples, 2 unique classes
  Client 14: 45625 train samples, 2 unique classes
  Client 15: 45984 train samples, 2 unique classes
  Client 16: 46428 train samples, 2 unique classes
  Client 17: 44737 train samples, 2 unique classes
  Client 18: 45540 train samples, 2 unique classes
  Client 19: 46497 train samples, 2 unique classes
Will sample 4500 samples per client per epoch
Graph: fully, nodes: 20, edges: 190
Degree statistics: avg=19.00, min=19, max=19
Attack: Compromised 8/20 nodes: [1, 5, 11, 12, 13, 14, 17, 18]
Attack type: directed_deviation, lambda: 1.0
Model variant: baseline
Model parameters: 1,174,986
BALANCE algorithm:
Balance Config: BALANCEConfig(gamma=2, kappa=1, alpha=0.5, min_neighbors=1)
  - Model dimension: 1,174,986 parameters
  - Complexity: O(N×d) = O(20×1,174,986)
Initial test acc across nodes: mean=0.4965 ± 0.0152
Round 001: test acc mean=0.5037 ± 0.0142 | min=0.4748 max=0.5386
         : test loss mean=1.2190 ± 0.2910
         : individual accs = ['0.497049', '0.495118', '0.493271', '0.493845', '0.513064', '0.499896', '0.502440', '0.530626', '0.511403', '0.505462', '0.502370', '0.504964', '0.474781', '0.538574', '0.485824', '0.502397', '0.505734', '0.496107', '0.521998', '0.499201']
         : correct/total = [(7074, 14232), (7048, 14235), (7037, 14266), (7021, 14217), (7305, 14238), (7185, 14373), (7208, 14346), (7606, 14334), (7310, 14294), (7265, 14373), (7206, 14344), (7222, 14302), (6815, 14354), (7735, 14362), (6957, 14320), (7232, 14395), (7277, 14389), (7073, 14257), (7439, 14251), (7188, 14399)]
         : compromised: 0.5022, honest: 0.5047
Round 002: test acc mean=0.5174 ± 0.0152 | min=0.4948 max=0.5515
         : test loss mean=0.6944 ± 0.0048
         : individual accs = ['0.527403', '0.513523', '0.530422', '0.502638', '0.533361', '0.503444', '0.530531', '0.524417', '0.528823', '0.512489', '0.516104', '0.543421', '0.503901', '0.551455', '0.506844', '0.500313', '0.511015', '0.510837', '0.494772', '0.501354']
         : correct/total = [(7506, 14232), (7310, 14235), (7567, 14266), (7146, 14217), (7594, 14238), (7236, 14373), (7611, 14346), (7517, 14334), (7559, 14294), (7366, 14373), (7403, 14344), (7772, 14302), (7233, 14354), (7920, 14362), (7258, 14320), (7202, 14395), (7353, 14389), (7283, 14257), (7051, 14251), (7219, 14399)]
         : compromised: 0.5160, honest: 0.5182
Round 003: test acc mean=0.5132 ± 0.0136 | min=0.4921 max=0.5428
         : test loss mean=0.6946 ± 0.0040
         : individual accs = ['0.511102', '0.513734', '0.521590', '0.507913', '0.511659', '0.506157', '0.541475', '0.504814', '0.542815', '0.534892', '0.526492', '0.513844', '0.500418', '0.492062', '0.504260', '0.515874', '0.503301', '0.497159', '0.511052', '0.503646']
         : correct/total = [(7274, 14232), (7313, 14235), (7441, 14266), (7221, 14217), (7285, 14238), (7275, 14373), (7768, 14346), (7236, 14334), (7759, 14294), (7688, 14373), (7552, 14344), (7349, 14302), (7183, 14354), (7067, 14362), (7221, 14320), (7426, 14395), (7242, 14389), (7088, 14257), (7283, 14251), (7252, 14399)]
         : compromised: 0.5048, honest: 0.5188
Round 004: test acc mean=0.5201 ± 0.0220 | min=0.4930 max=0.5690
         : test loss mean=0.6909 ± 0.0024
         : individual accs = ['0.563097', '0.513102', '0.523202', '0.509038', '0.558365', '0.506157', '0.548794', '0.505093', '0.568980', '0.531413', '0.511294', '0.510838', '0.502438', '0.493037', '0.526536', '0.507607', '0.501355', '0.496949', '0.511122', '0.512952']
         : correct/total = [(8014, 14232), (7304, 14235), (7464, 14266), (7237, 14217), (7950, 14238), (7275, 14373), (7873, 14346), (7240, 14334), (8133, 14294), (7638, 14373), (7334, 14344), (7306, 14302), (7212, 14354), (7081, 14362), (7540, 14320), (7307, 14395), (7214, 14389), (7085, 14257), (7284, 14251), (7386, 14399)]
         : compromised: 0.5075, honest: 0.5284
Round 005: test acc mean=0.5750 ± 0.0080 | min=0.5496 max=0.5858
         : test loss mean=0.6851 ± 0.0021
         : individual accs = ['0.571810', '0.577169', '0.574723', '0.573187', '0.581261', '0.582968', '0.575561', '0.565648', '0.579684', '0.585821', '0.581985', '0.571948', '0.567438', '0.549575', '0.581145', '0.580340', '0.568490', '0.572841', '0.576310', '0.582193']
         : correct/total = [(8138, 14232), (8216, 14235), (8199, 14266), (8149, 14217), (8276, 14238), (8379, 14373), (8257, 14346), (8108, 14334), (8286, 14294), (8420, 14373), (8348, 14344), (8180, 14302), (8145, 14354), (7893, 14362), (8322, 14320), (8354, 14395), (8180, 14389), (8167, 14257), (8213, 14251), (8383, 14399)]
         : compromised: 0.5724, honest: 0.5767
Round 006: test acc mean=0.5922 ± 0.0042 | min=0.5838 max=0.6023
         : test loss mean=0.6740 ± 0.0022
         : individual accs = ['0.591133', '0.587496', '0.593649', '0.593233', '0.592710', '0.594517', '0.590199', '0.602344', '0.592836', '0.595213', '0.594255', '0.591945', '0.592727', '0.596574', '0.583799', '0.590830', '0.591494', '0.587641', '0.584099', '0.597055']
         : correct/total = [(8413, 14232), (8363, 14235), (8469, 14266), (8434, 14217), (8439, 14238), (8545, 14373), (8467, 14346), (8634, 14334), (8474, 14294), (8555, 14373), (8524, 14344), (8466, 14302), (8508, 14354), (8568, 14362), (8360, 14320), (8505, 14395), (8511, 14389), (8378, 14257), (8324, 14251), (8597, 14399)]
         : compromised: 0.5898, honest: 0.5937
Round 007: test acc mean=0.6054 ± 0.0034 | min=0.5972 max=0.6118
         : test loss mean=0.6614 ± 0.0016
         : individual accs = ['0.603288', '0.597190', '0.603042', '0.609904', '0.605001', '0.607806', '0.604419', '0.607576', '0.605149', '0.611842', '0.603528', '0.604111', '0.603804', '0.604582', '0.601047', '0.606947', '0.610049', '0.605106', '0.602344', '0.610320']
         : correct/total = [(8586, 14232), (8501, 14235), (8603, 14266), (8671, 14217), (8614, 14238), (8736, 14373), (8671, 14346), (8709, 14334), (8650, 14294), (8794, 14373), (8657, 14344), (8640, 14302), (8667, 14354), (8683, 14362), (8607, 14320), (8737, 14395), (8778, 14389), (8627, 14257), (8584, 14251), (8788, 14399)]
         : compromised: 0.6032, honest: 0.6068
Round 008: test acc mean=0.6147 ± 0.0029 | min=0.6087 max=0.6194
         : test loss mean=0.6534 ± 0.0016
         : individual accs = ['0.608699', '0.611661', '0.614678', '0.616586', '0.610549', '0.618312', '0.615363', '0.616227', '0.619351', '0.615181', '0.612591', '0.610824', '0.616065', '0.614678', '0.611034', '0.617506', '0.613941', '0.615838', '0.615606', '0.619001']
         : correct/total = [(8663, 14232), (8707, 14235), (8769, 14266), (8766, 14217), (8693, 14238), (8887, 14373), (8828, 14346), (8833, 14334), (8853, 14294), (8842, 14373), (8787, 14344), (8736, 14302), (8843, 14354), (8828, 14362), (8750, 14320), (8889, 14395), (8834, 14389), (8780, 14257), (8773, 14251), (8913, 14399)]
         : compromised: 0.6143, honest: 0.6150
Round 009: test acc mean=0.6221 ± 0.0044 | min=0.6084 max=0.6279
         : test loss mean=0.6476 ± 0.0027
         : individual accs = ['0.619660', '0.620724', '0.624141', '0.621720', '0.617432', '0.627009', '0.627213', '0.618669', '0.627676', '0.623043', '0.620678', '0.625017', '0.621569', '0.621501', '0.608380', '0.627857', '0.618737', '0.622571', '0.623255', '0.625460']
         : correct/total = [(8819, 14232), (8836, 14235), (8904, 14266), (8839, 14217), (8791, 14238), (9012, 14373), (8998, 14346), (8868, 14334), (8972, 14294), (8955, 14373), (8903, 14344), (8939, 14302), (8922, 14354), (8926, 14362), (8712, 14320), (9038, 14395), (8903, 14389), (8876, 14257), (8882, 14251), (9006, 14399)]
         : compromised: 0.6213, honest: 0.6227
Round 010: test acc mean=0.6308 ± 0.0035 | min=0.6224 max=0.6382
         : test loss mean=0.6415 ± 0.0019
         : individual accs = ['0.632448', '0.635125', '0.631501', '0.638250', '0.622419', '0.631044', '0.633905', '0.628715', '0.633483', '0.633619', '0.629810', '0.629982', '0.629511', '0.627977', '0.629749', '0.634873', '0.625756', '0.627692', '0.628237', '0.631294']
         : correct/total = [(9001, 14232), (9041, 14235), (9009, 14266), (9074, 14217), (8862, 14238), (9070, 14373), (9094, 14346), (9012, 14334), (9055, 14294), (9107, 14373), (9034, 14344), (9010, 14302), (9036, 14354), (9019, 14362), (9018, 14320), (9139, 14395), (9004, 14389), (8949, 14257), (8953, 14251), (9090, 14399)]
         : compromised: 0.6299, honest: 0.6313

=== FINAL RESULTS ===
Dataset: sent140, Nodes: 20, Graph: fully, Aggregation: balance
Attack: directed_deviation, 40.0% compromised
Final accuracy - Compromised: 0.6299, Honest: 0.6313
Overall test accuracy: mean=0.6308 ± 0.0035

=== BALANCE SUMMARY ===
Node 0: acceptance=0.621
Node 1: acceptance=0.668
Node 2: acceptance=0.621
Node 3: acceptance=0.621
Node 4: acceptance=0.621
Node 5: acceptance=0.668
Node 6: acceptance=0.621
Node 7: acceptance=0.621
Node 8: acceptance=0.621
Node 9: acceptance=0.621
Node 10: acceptance=0.621
Node 11: acceptance=0.668
Node 12: acceptance=0.668
Node 13: acceptance=0.668
Node 14: acceptance=0.668
Node 15: acceptance=0.621
Node 16: acceptance=0.621
Node 17: acceptance=0.668
Node 18: acceptance=0.668
Node 19: acceptance=0.621

=== PARALLEL EXECUTION TIME (realistic for distributed system) ===
  COMMUNICATION (max across nodes):
    - Full model transfer: 0.000s (0.0%)
  COMPUTATION (max across nodes):
    - Filtering: 0.084s (83.7%)
    - Aggregation: 0.016s (16.3%)
  TOTALS:
    - Total computation: 0.101s (100.0%)
    - Total communication: 0.000s (0.0%)
    - Total parallel time: 0.101s

=== PER-NODE AVERAGE TIME ===
  - Filtering: 0.079s
  - Aggregation: 0.011s
  - Model transfer: 0.000s
  - Total per node: 0.090s

=== TOTAL COMPUTATIONAL WORK (sum across all nodes) ===
  - Total filtering: 1.587s
  - Total aggregation: 0.215s
  - Total model transfer: 0.000s
  - Grand total: 1.802s
  - Mean acceptance rate: 0.640

BALANCE Algorithm Properties:
  - Model dimension: 1,174,986
  - No compression: Full parameter comparison
  - Theoretical complexity: O(deg(i)×d)
  - Approach: Full parameter filtering + averaging
