Device: cuda
Seed: 987654321
Loading 1 LEAF Sent140 train files...
LEAF Sent140 train: 254555 users, 908652 samples
Building vocabulary (max_size=10000)...
Vocabulary size: 10000
Loading 1 LEAF Sent140 test files...
LEAF Sent140 test: 254555 users, 286281 samples
Found 254555 train users, 254555 test users, 254555 common users
User sample counts range: 494 (max) to 1 (min)
Distributed ALL 254555 users across 20 clients
Users per client: 12727 (with 15 clients getting +1 user)
Train partition sizes: [44353, 44290, 44657, 44907, 44696, 45843, 45801, 45619, 45069, 45639, 45821, 45311, 45779, 46056, 45625, 45984, 46428, 44737, 45540, 46497]
Test partition sizes: [14232, 14235, 14266, 14217, 14238, 14373, 14346, 14334, 14294, 14373, 14344, 14302, 14354, 14362, 14320, 14395, 14389, 14257, 14251, 14399]
  Client 0: 44353 train samples, 2 unique classes
  Client 1: 44290 train samples, 2 unique classes
  Client 2: 44657 train samples, 2 unique classes
  Client 3: 44907 train samples, 2 unique classes
  Client 4: 44696 train samples, 2 unique classes
  Client 5: 45843 train samples, 2 unique classes
  Client 6: 45801 train samples, 2 unique classes
  Client 7: 45619 train samples, 2 unique classes
  Client 8: 45069 train samples, 2 unique classes
  Client 9: 45639 train samples, 2 unique classes
  Client 10: 45821 train samples, 2 unique classes
  Client 11: 45311 train samples, 2 unique classes
  Client 12: 45779 train samples, 2 unique classes
  Client 13: 46056 train samples, 2 unique classes
  Client 14: 45625 train samples, 2 unique classes
  Client 15: 45984 train samples, 2 unique classes
  Client 16: 46428 train samples, 2 unique classes
  Client 17: 44737 train samples, 2 unique classes
  Client 18: 45540 train samples, 2 unique classes
  Client 19: 46497 train samples, 2 unique classes
Will sample 4500 samples per client per epoch
Graph: erdos, nodes: 20, edges: 126
Degree statistics: avg=12.60, min=8, max=16
Attack: Compromised 14/20 nodes: [1, 2, 3, 5, 6, 8, 11, 12, 13, 14, 15, 17, 18, 19]
Attack type: gaussian, lambda: 1.0
Model variant: baseline
Model parameters: 1,174,986
BALANCE algorithm:
Balance Config: BALANCEConfig(gamma=2, kappa=1, alpha=0.5, min_neighbors=1)
  - Model dimension: 1,174,986 parameters
  - Complexity: O(N×d) = O(20×1,174,986)
Initial test acc across nodes: mean=0.4965 ± 0.0152
Round 001: test acc mean=0.5443 ± 0.0220 | min=0.5107 max=0.5902
         : test loss mean=0.6915 ± 0.0006
         : individual accs = ['0.531619', '0.551809', '0.534908', '0.558205', '0.531676', '0.568357', '0.533598', '0.587833', '0.539387', '0.590204', '0.510666', '0.538736', '0.543263', '0.522768', '0.559637', '0.512192', '0.564528', '0.513081', '0.541366', '0.552052']
         : correct/total = [(7566, 14232), (7855, 14235), (7631, 14266), (7936, 14217), (7570, 14238), (8169, 14373), (7655, 14346), (8426, 14334), (7710, 14294), (8483, 14373), (7325, 14344), (7705, 14302), (7798, 14354), (7508, 14362), (8014, 14320), (7373, 14395), (8123, 14389), (7315, 14257), (7715, 14251), (7949, 14399)]
         : compromised: 0.5407, honest: 0.5528
Round 002: test acc mean=0.4967 ± 0.0081 | min=0.4861 max=0.5207
         : test loss mean=0.6930 ± 0.0004
         : individual accs = ['0.489531', '0.486055', '0.486051', '0.492228', '0.495294', '0.493703', '0.497560', '0.495256', '0.488876', '0.502331', '0.503207', '0.491889', '0.499582', '0.508564', '0.495810', '0.498437', '0.520745', '0.503051', '0.488808', '0.496354']
         : correct/total = [(6967, 14232), (6919, 14235), (6934, 14266), (6998, 14217), (7052, 14238), (7096, 14373), (7138, 14346), (7099, 14334), (6988, 14294), (7220, 14373), (7218, 14344), (7035, 14302), (7171, 14354), (7304, 14362), (7100, 14320), (7175, 14395), (7493, 14389), (7172, 14257), (6966, 14251), (7147, 14399)]
         : compromised: 0.4948, honest: 0.5011
Round 003: test acc mean=0.4949 ± 0.0056 | min=0.4861 max=0.5086
         : test loss mean=0.6934 ± 0.0004
         : individual accs = ['0.489109', '0.486266', '0.486051', '0.492228', '0.494100', '0.493843', '0.497560', '0.495186', '0.488457', '0.493008', '0.499024', '0.492029', '0.499512', '0.508564', '0.495810', '0.498367', '0.499757', '0.503051', '0.488738', '0.496354']
         : correct/total = [(6961, 14232), (6922, 14235), (6934, 14266), (6998, 14217), (7035, 14238), (7098, 14373), (7138, 14346), (7098, 14334), (6982, 14294), (7086, 14373), (7158, 14344), (7037, 14302), (7170, 14354), (7304, 14362), (7100, 14320), (7174, 14395), (7191, 14389), (7172, 14257), (6965, 14251), (7147, 14399)]
         : compromised: 0.4948, honest: 0.4950
Round 004: test acc mean=0.4948 ± 0.0056 | min=0.4861 max=0.5086
         : test loss mean=0.6931 ± 0.0004
         : individual accs = ['0.489109', '0.486266', '0.486051', '0.492228', '0.494100', '0.493843', '0.497560', '0.495186', '0.488387', '0.493008', '0.499024', '0.492029', '0.499512', '0.508564', '0.495810', '0.498367', '0.499757', '0.503051', '0.488738', '0.496354']
         : correct/total = [(6961, 14232), (6922, 14235), (6934, 14266), (6998, 14217), (7035, 14238), (7098, 14373), (7138, 14346), (7098, 14334), (6981, 14294), (7086, 14373), (7158, 14344), (7037, 14302), (7170, 14354), (7304, 14362), (7100, 14320), (7174, 14395), (7191, 14389), (7172, 14257), (6965, 14251), (7147, 14399)]
         : compromised: 0.4948, honest: 0.4950
Round 005: test acc mean=0.4949 ± 0.0056 | min=0.4861 max=0.5086
         : test loss mean=0.6928 ± 0.0004
         : individual accs = ['0.489109', '0.486266', '0.486051', '0.492228', '0.494100', '0.493843', '0.497560', '0.495186', '0.488457', '0.493008', '0.499024', '0.492029', '0.499512', '0.508564', '0.495810', '0.498367', '0.499757', '0.503051', '0.488738', '0.496354']
         : correct/total = [(6961, 14232), (6922, 14235), (6934, 14266), (6998, 14217), (7035, 14238), (7098, 14373), (7138, 14346), (7098, 14334), (6982, 14294), (7086, 14373), (7158, 14344), (7037, 14302), (7170, 14354), (7304, 14362), (7100, 14320), (7174, 14395), (7191, 14389), (7172, 14257), (6965, 14251), (7147, 14399)]
         : compromised: 0.4948, honest: 0.4950
Round 006: test acc mean=0.4949 ± 0.0056 | min=0.4861 max=0.5086
         : test loss mean=0.6922 ± 0.0004
         : individual accs = ['0.489109', '0.486266', '0.486051', '0.492298', '0.494100', '0.493843', '0.497560', '0.495186', '0.488597', '0.493077', '0.499094', '0.491959', '0.499512', '0.508564', '0.495810', '0.498367', '0.499757', '0.503051', '0.488667', '0.496354']
         : correct/total = [(6961, 14232), (6922, 14235), (6934, 14266), (6999, 14217), (7035, 14238), (7098, 14373), (7138, 14346), (7098, 14334), (6984, 14294), (7087, 14373), (7159, 14344), (7036, 14302), (7170, 14354), (7304, 14362), (7100, 14320), (7174, 14395), (7191, 14389), (7172, 14257), (6964, 14251), (7147, 14399)]
         : compromised: 0.4948, honest: 0.4951
Round 007: test acc mean=0.4959 ± 0.0048 | min=0.4870 max=0.5086
         : test loss mean=0.6915 ± 0.0003
         : individual accs = ['0.493044', '0.487039', '0.490887', '0.492228', '0.495505', '0.493982', '0.497560', '0.496442', '0.491115', '0.493216', '0.500418', '0.492169', '0.499512', '0.508634', '0.496229', '0.498437', '0.500452', '0.502981', '0.492386', '0.496354']
         : correct/total = [(7017, 14232), (6933, 14235), (7003, 14266), (6998, 14217), (7055, 14238), (7100, 14373), (7138, 14346), (7116, 14334), (7020, 14294), (7089, 14373), (7178, 14344), (7039, 14302), (7170, 14354), (7305, 14362), (7106, 14320), (7175, 14395), (7201, 14389), (7171, 14257), (7017, 14251), (7147, 14399)]
         : compromised: 0.4957, honest: 0.4965
Round 008: test acc mean=0.5054 ± 0.0088 | min=0.4933 max=0.5323
         : test loss mean=0.6903 ± 0.0004
         : individual accs = ['0.495433', '0.494204', '0.493341', '0.501794', '0.505619', '0.497391', '0.497909', '0.506418', '0.509235', '0.502887', '0.506205', '0.511886', '0.506549', '0.510026', '0.500279', '0.502536', '0.519355', '0.507330', '0.532314', '0.508021']
         : correct/total = [(7051, 14232), (7035, 14235), (7038, 14266), (7134, 14217), (7199, 14238), (7149, 14373), (7143, 14346), (7259, 14334), (7279, 14294), (7228, 14373), (7261, 14344), (7321, 14302), (7271, 14354), (7325, 14362), (7164, 14320), (7234, 14395), (7473, 14389), (7233, 14257), (7586, 14251), (7315, 14399)]
         : compromised: 0.5052, honest: 0.5060
Round 009: test acc mean=0.5248 ± 0.0132 | min=0.5029 max=0.5534
         : test loss mean=0.6888 ± 0.0004
         : individual accs = ['0.519252', '0.540429', '0.528599', '0.525779', '0.538629', '0.513671', '0.513732', '0.520301', '0.511263', '0.509984', '0.513316', '0.524332', '0.524592', '0.547486', '0.502863', '0.512192', '0.533324', '0.536298', '0.553365', '0.527259']
         : correct/total = [(7390, 14232), (7693, 14235), (7541, 14266), (7475, 14217), (7669, 14238), (7383, 14373), (7370, 14346), (7458, 14334), (7308, 14294), (7330, 14373), (7363, 14344), (7499, 14302), (7530, 14354), (7863, 14362), (7201, 14320), (7373, 14395), (7674, 14389), (7646, 14257), (7886, 14251), (7592, 14399)]
         : compromised: 0.5258, honest: 0.5225
Round 010: test acc mean=0.5711 ± 0.0137 | min=0.5416 max=0.5910
         : test loss mean=0.6858 ± 0.0005
         : individual accs = ['0.570475', '0.586934', '0.583345', '0.587395', '0.590954', '0.557991', '0.541614', '0.588601', '0.557437', '0.567453', '0.568740', '0.567683', '0.563815', '0.579724', '0.543994', '0.573880', '0.580930', '0.579084', '0.561154', '0.570178']
         : correct/total = [(8119, 14232), (8355, 14235), (8322, 14266), (8351, 14217), (8414, 14238), (8020, 14373), (7770, 14346), (8437, 14334), (7968, 14294), (8156, 14373), (8158, 14344), (8119, 14302), (8093, 14354), (8326, 14362), (7790, 14320), (8261, 14395), (8359, 14389), (8256, 14257), (7997, 14251), (8210, 14399)]
         : compromised: 0.5682, honest: 0.5779

=== FINAL RESULTS ===
Dataset: sent140, Nodes: 20, Graph: erdos, Aggregation: balance
Attack: gaussian, 70.0% compromised
Final accuracy - Compromised: 0.5682, Honest: 0.5779
Overall test accuracy: mean=0.5711 ± 0.0137

=== BALANCE SUMMARY ===
Node 0: acceptance=0.312
Node 1: acceptance=0.364
Node 2: acceptance=0.333
Node 3: acceptance=0.375
Node 4: acceptance=0.364
Node 5: acceptance=0.267
Node 6: acceptance=0.286
Node 7: acceptance=0.286
Node 8: acceptance=0.200
Node 9: acceptance=0.308
Node 10: acceptance=0.222
Node 11: acceptance=0.357
Node 12: acceptance=0.333
Node 13: acceptance=0.231
Node 14: acceptance=0.267
Node 15: acceptance=0.273
Node 16: acceptance=0.231
Node 17: acceptance=0.444
Node 18: acceptance=0.312
Node 19: acceptance=0.312

=== PARALLEL EXECUTION TIME (realistic for distributed system) ===
  COMMUNICATION (max across nodes):
    - Full model transfer: 0.000s (0.0%)
  COMPUTATION (max across nodes):
    - Filtering: 0.079s (84.9%)
    - Aggregation: 0.014s (15.1%)
  TOTALS:
    - Total computation: 0.093s (100.0%)
    - Total communication: 0.000s (0.0%)
    - Total parallel time: 0.093s

=== PER-NODE AVERAGE TIME ===
  - Filtering: 0.055s
  - Aggregation: 0.006s
  - Model transfer: 0.000s
  - Total per node: 0.061s

=== TOTAL COMPUTATIONAL WORK (sum across all nodes) ===
  - Total filtering: 1.091s
  - Total aggregation: 0.125s
  - Total model transfer: 0.000s
  - Grand total: 1.216s
  - Mean acceptance rate: 0.304

BALANCE Algorithm Properties:
  - Model dimension: 1,174,986
  - No compression: Full parameter comparison
  - Theoretical complexity: O(deg(i)×d)
  - Approach: Full parameter filtering + averaging
