Device: cuda
Seed: 987654321
Loading 1 LEAF Sent140 train files...
LEAF Sent140 train: 254555 users, 908652 samples
Building vocabulary (max_size=10000)...
Vocabulary size: 10000
Loading 1 LEAF Sent140 test files...
LEAF Sent140 test: 254555 users, 286281 samples
Found 254555 train users, 254555 test users, 254555 common users
User sample counts range: 494 (max) to 1 (min)
Distributed ALL 254555 users across 20 clients
Users per client: 12727 (with 15 clients getting +1 user)
Train partition sizes: [44353, 44290, 44657, 44907, 44696, 45843, 45801, 45619, 45069, 45639, 45821, 45311, 45779, 46056, 45625, 45984, 46428, 44737, 45540, 46497]
Test partition sizes: [14232, 14235, 14266, 14217, 14238, 14373, 14346, 14334, 14294, 14373, 14344, 14302, 14354, 14362, 14320, 14395, 14389, 14257, 14251, 14399]
  Client 0: 44353 train samples, 2 unique classes
  Client 1: 44290 train samples, 2 unique classes
  Client 2: 44657 train samples, 2 unique classes
  Client 3: 44907 train samples, 2 unique classes
  Client 4: 44696 train samples, 2 unique classes
  Client 5: 45843 train samples, 2 unique classes
  Client 6: 45801 train samples, 2 unique classes
  Client 7: 45619 train samples, 2 unique classes
  Client 8: 45069 train samples, 2 unique classes
  Client 9: 45639 train samples, 2 unique classes
  Client 10: 45821 train samples, 2 unique classes
  Client 11: 45311 train samples, 2 unique classes
  Client 12: 45779 train samples, 2 unique classes
  Client 13: 46056 train samples, 2 unique classes
  Client 14: 45625 train samples, 2 unique classes
  Client 15: 45984 train samples, 2 unique classes
  Client 16: 46428 train samples, 2 unique classes
  Client 17: 44737 train samples, 2 unique classes
  Client 18: 45540 train samples, 2 unique classes
  Client 19: 46497 train samples, 2 unique classes
Will sample 4500 samples per client per epoch
Graph: erdos, nodes: 20, edges: 126
Degree statistics: avg=12.60, min=8, max=16
Attack: Compromised 14/20 nodes: [1, 2, 3, 5, 6, 8, 11, 12, 13, 14, 15, 17, 18, 19]
Attack type: backdoor, lambda: 1.0
Backdoor target label: 1, trigger size: 3
Model variant: baseline
Model parameters: 1,174,986
Initial test acc across nodes: mean=0.4953 ± 0.0174
Backdoor attack: Created poisoned datasets for 14 compromised nodes
Round 001: test acc mean=0.5001 ± 0.0073 | min=0.4882 max=0.5140
         : test loss mean=11.1868 ± 4.2108
         : individual accs = ['0.511313', '0.514015', '0.500350', '0.499261', '0.488201', '0.495443', '0.499373', '0.492186', '0.494123', '0.503235', '0.492192', '0.496854', '0.495611', '0.510723', '0.494413', '0.494338', '0.496838', '0.503612', '0.507263', '0.511702']
         : correct/total = [(7277, 14232), (7317, 14235), (7138, 14266), (7098, 14217), (6951, 14238), (7121, 14373), (7164, 14346), (7055, 14334), (7063, 14294), (7233, 14373), (7060, 14344), (7106, 14302), (7114, 14354), (7335, 14362), (7080, 14320), (7116, 14395), (7149, 14389), (7180, 14257), (7229, 14251), (7368, 14399)]
         : compromised: 0.5012, honest: 0.4973
Round 002: test acc mean=0.4981 ± 0.0070 | min=0.4826 max=0.5110
         : test loss mean=15.5975 ± 5.1186
         : individual accs = ['0.495433', '0.495609', '0.482616', '0.484490', '0.502809', '0.496904', '0.505855', '0.497279', '0.505597', '0.495721', '0.499582', '0.495245', '0.503762', '0.509748', '0.497626', '0.497464', '0.492390', '0.510977', '0.499053', '0.493229']
         : correct/total = [(7051, 14232), (7055, 14235), (6885, 14266), (6888, 14217), (7159, 14238), (7142, 14373), (7257, 14346), (7128, 14334), (7227, 14294), (7125, 14373), (7166, 14344), (7083, 14302), (7231, 14354), (7321, 14362), (7126, 14320), (7161, 14395), (7085, 14389), (7285, 14257), (7112, 14251), (7102, 14399)]
         : compromised: 0.4984, honest: 0.4972
Round 003: test acc mean=0.4960 ± 0.0054 | min=0.4829 max=0.5075
         : test loss mean=10.4382 ± 1.9542
         : individual accs = ['0.492693', '0.482894', '0.488224', '0.488359', '0.495786', '0.494190', '0.502231', '0.497070', '0.498671', '0.498087', '0.498466', '0.500210', '0.500836', '0.507520', '0.492737', '0.498090', '0.492321', '0.496598', '0.496456', '0.499410']
         : correct/total = [(7012, 14232), (6874, 14235), (6965, 14266), (6943, 14217), (7059, 14238), (7103, 14373), (7205, 14346), (7125, 14334), (7128, 14294), (7159, 14373), (7150, 14344), (7154, 14302), (7189, 14354), (7289, 14362), (7056, 14320), (7170, 14395), (7084, 14389), (7080, 14257), (7075, 14251), (7191, 14399)]
         : compromised: 0.4962, honest: 0.4957
Round 004: test acc mean=0.5002 ± 0.0043 | min=0.4933 max=0.5100
         : test loss mean=12.9802 ± 3.2895
         : individual accs = ['0.502811', '0.504812', '0.502874', '0.509953', '0.494873', '0.502818', '0.497909', '0.505023', '0.501609', '0.493773', '0.501603', '0.503566', '0.498607', '0.494151', '0.501117', '0.495033', '0.500730', '0.500666', '0.493299', '0.497882']
         : correct/total = [(7156, 14232), (7186, 14235), (7174, 14266), (7250, 14217), (7046, 14238), (7227, 14373), (7143, 14346), (7239, 14334), (7170, 14294), (7097, 14373), (7195, 14344), (7202, 14302), (7157, 14354), (7097, 14362), (7176, 14320), (7126, 14395), (7205, 14389), (7138, 14257), (7030, 14251), (7169, 14399)]
         : compromised: 0.5003, honest: 0.4998
Round 005: test acc mean=0.4994 ± 0.0044 | min=0.4873 max=0.5066
         : test loss mean=5.3761 ± 0.4168
         : individual accs = ['0.497822', '0.498700', '0.492430', '0.506577', '0.501896', '0.496834', '0.504043', '0.506069', '0.502239', '0.495304', '0.501115', '0.503426', '0.497910', '0.498120', '0.498254', '0.500590', '0.487317', '0.500456', '0.499333', '0.499757']
         : correct/total = [(7085, 14232), (7099, 14235), (7025, 14266), (7202, 14217), (7146, 14238), (7141, 14373), (7231, 14346), (7254, 14334), (7179, 14294), (7119, 14373), (7188, 14344), (7200, 14302), (7147, 14354), (7154, 14362), (7135, 14320), (7206, 14395), (7012, 14389), (7135, 14257), (7116, 14251), (7196, 14399)]
         : compromised: 0.4999, honest: 0.4983
Round 006: test acc mean=0.5084 ± 0.0077 | min=0.4916 max=0.5231
         : test loss mean=9.2949 ± 1.8450
         : individual accs = ['0.506956', '0.509168', '0.514650', '0.510234', '0.515522', '0.523064', '0.502719', '0.509069', '0.497481', '0.510262', '0.515337', '0.513704', '0.512192', '0.491645', '0.505237', '0.504064', '0.501842', '0.519745', '0.507894', '0.496562']
         : correct/total = [(7215, 14232), (7248, 14235), (7342, 14266), (7254, 14217), (7340, 14238), (7518, 14373), (7212, 14346), (7297, 14334), (7111, 14294), (7334, 14373), (7392, 14344), (7347, 14302), (7352, 14354), (7061, 14362), (7235, 14320), (7256, 14395), (7221, 14389), (7410, 14257), (7238, 14251), (7150, 14399)]
         : compromised: 0.5077, honest: 0.5098
Round 007: test acc mean=0.5082 ± 0.0069 | min=0.4938 max=0.5193
         : test loss mean=19.1566 ± 5.1156
         : individual accs = ['0.510821', '0.515841', '0.511706', '0.515369', '0.515662', '0.506644', '0.500279', '0.507674', '0.502728', '0.519307', '0.500837', '0.509649', '0.496029', '0.493803', '0.509078', '0.503508', '0.512475', '0.511959', '0.516174', '0.504132']
         : correct/total = [(7270, 14232), (7343, 14235), (7300, 14266), (7327, 14217), (7342, 14238), (7282, 14373), (7177, 14346), (7277, 14334), (7186, 14294), (7464, 14373), (7184, 14344), (7289, 14302), (7120, 14354), (7092, 14362), (7290, 14320), (7248, 14395), (7374, 14389), (7299, 14257), (7356, 14251), (7259, 14399)]
         : compromised: 0.5069, honest: 0.5111
Round 008: test acc mean=0.5049 ± 0.0055 | min=0.4932 max=0.5169
         : test loss mean=33.0354 ± 9.1287
         : individual accs = ['0.507237', '0.516895', '0.512968', '0.515299', '0.505057', '0.504001', '0.499024', '0.506209', '0.501329', '0.504975', '0.501603', '0.505314', '0.498467', '0.493176', '0.507402', '0.502188', '0.507332', '0.503823', '0.504456', '0.501563']
         : correct/total = [(7219, 14232), (7358, 14235), (7318, 14266), (7326, 14217), (7191, 14238), (7244, 14373), (7159, 14346), (7256, 14334), (7166, 14294), (7258, 14373), (7195, 14344), (7227, 14302), (7155, 14354), (7083, 14362), (7266, 14320), (7229, 14395), (7300, 14389), (7183, 14257), (7189, 14251), (7222, 14399)]
         : compromised: 0.5047, honest: 0.5054
Round 009: test acc mean=0.5051 ± 0.0055 | min=0.4932 max=0.5169
         : test loss mean=54.2268 ± 8.0027
         : individual accs = ['0.507589', '0.516895', '0.513108', '0.515088', '0.505478', '0.504905', '0.500418', '0.507116', '0.501819', '0.504696', '0.499930', '0.506083', '0.497144', '0.493246', '0.507402', '0.502258', '0.507401', '0.504664', '0.504386', '0.501840']
         : correct/total = [(7224, 14232), (7358, 14235), (7320, 14266), (7323, 14217), (7197, 14238), (7257, 14373), (7179, 14346), (7269, 14334), (7173, 14294), (7254, 14373), (7171, 14344), (7238, 14302), (7136, 14354), (7084, 14362), (7266, 14320), (7230, 14395), (7301, 14389), (7195, 14257), (7188, 14251), (7226, 14399)]
         : compromised: 0.5049, honest: 0.5054
Round 010: test acc mean=0.5051 ± 0.0055 | min=0.4932 max=0.5170
         : test loss mean=92.0234 ± 47.2661
         : individual accs = ['0.507378', '0.516965', '0.513038', '0.515017', '0.505478', '0.504140', '0.500209', '0.507255', '0.501819', '0.504766', '0.501673', '0.506153', '0.497144', '0.493176', '0.507402', '0.502258', '0.507471', '0.504664', '0.504386', '0.501910']
         : correct/total = [(7221, 14232), (7359, 14235), (7319, 14266), (7322, 14217), (7197, 14238), (7246, 14373), (7176, 14346), (7271, 14334), (7173, 14294), (7255, 14373), (7196, 14344), (7239, 14302), (7136, 14354), (7083, 14362), (7266, 14320), (7230, 14395), (7302, 14389), (7195, 14257), (7188, 14251), (7227, 14399)]
         : compromised: 0.5049, honest: 0.5057

=== FINAL RESULTS ===
Dataset: sent140, Nodes: 20, Graph: erdos, Aggregation: krum
Attack: backdoor, 70.0% compromised
Final accuracy - Compromised: 0.5049, Honest: 0.5057
Overall test accuracy: mean=0.5051 ± 0.0055

=== BACKDOOR ATTACK SUCCESS RATE (ASR) ===
Target label: 1
Trigger size: 3x3
Overall ASR: 0.0000 ± 0.0001
Honest nodes ASR: 0.0001 ± 0.0002
Compromised nodes ASR: 0.0000 ± 0.0000
Note: Higher ASR indicates more successful backdoor attack
