Device: cuda
Seed: 987654321
Loading 1 LEAF Sent140 train files...
LEAF Sent140 train: 254555 users, 908652 samples
Building vocabulary (max_size=10000)...
Vocabulary size: 10000
Loading 1 LEAF Sent140 test files...
LEAF Sent140 test: 254555 users, 286281 samples
Found 254555 train users, 254555 test users, 254555 common users
User sample counts range: 494 (max) to 1 (min)
Distributed ALL 254555 users across 20 clients
Users per client: 12727 (with 15 clients getting +1 user)
Train partition sizes: [44353, 44290, 44657, 44907, 44696, 45843, 45801, 45619, 45069, 45639, 45821, 45311, 45779, 46056, 45625, 45984, 46428, 44737, 45540, 46497]
Test partition sizes: [14232, 14235, 14266, 14217, 14238, 14373, 14346, 14334, 14294, 14373, 14344, 14302, 14354, 14362, 14320, 14395, 14389, 14257, 14251, 14399]
  Client 0: 44353 train samples, 2 unique classes
  Client 1: 44290 train samples, 2 unique classes
  Client 2: 44657 train samples, 2 unique classes
  Client 3: 44907 train samples, 2 unique classes
  Client 4: 44696 train samples, 2 unique classes
  Client 5: 45843 train samples, 2 unique classes
  Client 6: 45801 train samples, 2 unique classes
  Client 7: 45619 train samples, 2 unique classes
  Client 8: 45069 train samples, 2 unique classes
  Client 9: 45639 train samples, 2 unique classes
  Client 10: 45821 train samples, 2 unique classes
  Client 11: 45311 train samples, 2 unique classes
  Client 12: 45779 train samples, 2 unique classes
  Client 13: 46056 train samples, 2 unique classes
  Client 14: 45625 train samples, 2 unique classes
  Client 15: 45984 train samples, 2 unique classes
  Client 16: 46428 train samples, 2 unique classes
  Client 17: 44737 train samples, 2 unique classes
  Client 18: 45540 train samples, 2 unique classes
  Client 19: 46497 train samples, 2 unique classes
Will sample 4500 samples per client per epoch
Graph: erdos, nodes: 20, edges: 126
Degree statistics: avg=12.60, min=8, max=16
Attack: Compromised 14/20 nodes: [1, 2, 3, 5, 6, 8, 11, 12, 13, 14, 15, 17, 18, 19]
Attack type: directed_deviation, lambda: 1.0
Model variant: baseline
Model parameters: 1,174,986
Sketchguard Node 0:
  Model dim: 1,174,986 → Sketch size: 180
  Compression ratio: 6527.7x
  Using model parameters for aggregation, sketches for filtering
Sketchguard Node 1:
  Model dim: 1,174,986 → Sketch size: 180
  Compression ratio: 6527.7x
  Using model parameters for aggregation, sketches for filtering
Sketchguard Node 2:
  Model dim: 1,174,986 → Sketch size: 180
  Compression ratio: 6527.7x
  Using model parameters for aggregation, sketches for filtering
Sketchguard Node 3:
  Model dim: 1,174,986 → Sketch size: 180
  Compression ratio: 6527.7x
  Using model parameters for aggregation, sketches for filtering
Sketchguard Node 4:
  Model dim: 1,174,986 → Sketch size: 180
  Compression ratio: 6527.7x
  Using model parameters for aggregation, sketches for filtering
Sketchguard Node 5:
  Model dim: 1,174,986 → Sketch size: 180
  Compression ratio: 6527.7x
  Using model parameters for aggregation, sketches for filtering
Sketchguard Node 6:
  Model dim: 1,174,986 → Sketch size: 180
  Compression ratio: 6527.7x
  Using model parameters for aggregation, sketches for filtering
Sketchguard Node 7:
  Model dim: 1,174,986 → Sketch size: 180
  Compression ratio: 6527.7x
  Using model parameters for aggregation, sketches for filtering
Sketchguard Node 8:
  Model dim: 1,174,986 → Sketch size: 180
  Compression ratio: 6527.7x
  Using model parameters for aggregation, sketches for filtering
Sketchguard Node 9:
  Model dim: 1,174,986 → Sketch size: 180
  Compression ratio: 6527.7x
  Using model parameters for aggregation, sketches for filtering
Sketchguard Node 10:
  Model dim: 1,174,986 → Sketch size: 180
  Compression ratio: 6527.7x
  Using model parameters for aggregation, sketches for filtering
Sketchguard Node 11:
  Model dim: 1,174,986 → Sketch size: 180
  Compression ratio: 6527.7x
  Using model parameters for aggregation, sketches for filtering
Sketchguard Node 12:
  Model dim: 1,174,986 → Sketch size: 180
  Compression ratio: 6527.7x
  Using model parameters for aggregation, sketches for filtering
Sketchguard Node 13:
  Model dim: 1,174,986 → Sketch size: 180
  Compression ratio: 6527.7x
  Using model parameters for aggregation, sketches for filtering
Sketchguard Node 14:
  Model dim: 1,174,986 → Sketch size: 180
  Compression ratio: 6527.7x
  Using model parameters for aggregation, sketches for filtering
Sketchguard Node 15:
  Model dim: 1,174,986 → Sketch size: 180
  Compression ratio: 6527.7x
  Using model parameters for aggregation, sketches for filtering
Sketchguard Node 16:
  Model dim: 1,174,986 → Sketch size: 180
  Compression ratio: 6527.7x
  Using model parameters for aggregation, sketches for filtering
Sketchguard Node 17:
  Model dim: 1,174,986 → Sketch size: 180
  Compression ratio: 6527.7x
  Using model parameters for aggregation, sketches for filtering
Sketchguard Node 18:
  Model dim: 1,174,986 → Sketch size: 180
  Compression ratio: 6527.7x
  Using model parameters for aggregation, sketches for filtering
Sketchguard Node 19:
  Model dim: 1,174,986 → Sketch size: 180
  Compression ratio: 6527.7x
  Using model parameters for aggregation, sketches for filtering
Sketchguard ALGORITHM (Sketch-based Filtering + State Aggregation)
  - Model dimension: 1,174,986 parameters
  - Config: SketchguardConfig(gamma=2, kappa=1, alpha=0.5, min_neighbors=1, sketch_size=180, network_seed=987654321, attack_detection_window=5)
  - Sketch size: 180
  - Compression ratio: 6527.7x
  - Complexity: O(d + N×k) = O(1,174,986 + 20×180)
  - Theoretical speedup vs BALANCE: 19.9x
Initial test acc across nodes: mean=0.4965 ± 0.0152
Round 001: test acc mean=0.5001 ± 0.0142 | min=0.4707 max=0.5311
         : test loss mean=0.7627 ± 0.0512
         : individual accs = ['0.518550', '0.490060', '0.498458', '0.492087', '0.502107', '0.478675', '0.486686', '0.507814', '0.524766', '0.496765', '0.509133', '0.508670', '0.470670', '0.531124', '0.498045', '0.496770', '0.491417', '0.506839', '0.491895', '0.501979']
         : correct/total = [(7380, 14232), (6976, 14235), (7111, 14266), (6996, 14217), (7149, 14238), (6880, 14373), (6982, 14346), (7279, 14334), (7501, 14294), (7140, 14373), (7303, 14344), (7275, 14302), (6756, 14354), (7628, 14362), (7132, 14320), (7151, 14395), (7071, 14389), (7226, 14257), (7010, 14251), (7228, 14399)]
         : compromised: 0.4983, honest: 0.5043
         : sketchguard stats = ['Node 0: acc_rate=1.000', 'Node 1: acc_rate=1.000', 'Node 2: acc_rate=1.000']...
Round 002: test acc mean=0.5163 ± 0.0174 | min=0.4741 max=0.5499
         : test loss mean=0.7103 ± 0.0552
         : individual accs = ['0.549888', '0.508044', '0.525025', '0.488711', '0.523177', '0.533500', '0.516729', '0.536696', '0.515741', '0.531135', '0.507529', '0.517550', '0.474084', '0.505152', '0.540223', '0.508649', '0.510946', '0.498702', '0.523683', '0.511077']
         : correct/total = [(7826, 14232), (7232, 14235), (7490, 14266), (6948, 14217), (7449, 14238), (7668, 14373), (7413, 14346), (7693, 14334), (7372, 14294), (7634, 14373), (7280, 14344), (7402, 14302), (6805, 14354), (7255, 14362), (7736, 14320), (7322, 14395), (7352, 14389), (7110, 14257), (7463, 14251), (7359, 14399)]
         : compromised: 0.5119, honest: 0.5266
         : sketchguard stats = ['Node 0: acc_rate=0.656', 'Node 1: acc_rate=0.682', 'Node 2: acc_rate=0.667']...
Round 003: test acc mean=0.5628 ± 0.0180 | min=0.5144 max=0.5860
         : test loss mean=0.6807 ± 0.0063
         : individual accs = ['0.581225', '0.575764', '0.540726', '0.550468', '0.579084', '0.581646', '0.555346', '0.578903', '0.556737', '0.585960', '0.570552', '0.560970', '0.514351', '0.542473', '0.581494', '0.551580', '0.576135', '0.545697', '0.569013', '0.557747']
         : correct/total = [(8272, 14232), (8196, 14235), (7714, 14266), (7826, 14217), (8245, 14238), (8360, 14373), (7967, 14346), (8298, 14334), (7958, 14294), (8422, 14373), (8184, 14344), (8023, 14302), (7383, 14354), (7791, 14362), (8327, 14320), (7940, 14395), (8290, 14389), (7780, 14257), (8109, 14251), (8031, 14399)]
         : compromised: 0.5560, honest: 0.5786
         : sketchguard stats = ['Node 0: acc_rate=0.542', 'Node 1: acc_rate=0.576', 'Node 2: acc_rate=0.556']...
Round 004: test acc mean=0.5971 ± 0.0066 | min=0.5770 max=0.6071
         : test loss mean=0.6645 ± 0.0058
         : individual accs = ['0.603148', '0.604636', '0.601079', '0.591545', '0.603666', '0.603006', '0.590548', '0.598019', '0.601231', '0.607111', '0.599972', '0.592644', '0.576982', '0.593720', '0.596718', '0.592011', '0.601084', '0.594655', '0.595046', '0.596014']
         : correct/total = [(8584, 14232), (8607, 14235), (8575, 14266), (8410, 14217), (8595, 14238), (8667, 14373), (8472, 14346), (8572, 14334), (8594, 14294), (8726, 14373), (8606, 14344), (8476, 14302), (8282, 14354), (8527, 14362), (8545, 14320), (8522, 14395), (8649, 14389), (8478, 14257), (8480, 14251), (8582, 14399)]
         : compromised: 0.5950, honest: 0.6022
         : sketchguard stats = ['Node 0: acc_rate=0.484', 'Node 1: acc_rate=0.523', 'Node 2: acc_rate=0.500']...
Round 005: test acc mean=0.6084 ± 0.0045 | min=0.6009 max=0.6159
         : test loss mean=0.6561 ± 0.0032
         : individual accs = ['0.608839', '0.614682', '0.609281', '0.602518', '0.615185', '0.614068', '0.604141', '0.609879', '0.610956', '0.615947', '0.609593', '0.601035', '0.600878', '0.609177', '0.604399', '0.605280', '0.611856', '0.607070', '0.605712', '0.606639']
         : correct/total = [(8665, 14232), (8750, 14235), (8692, 14266), (8566, 14217), (8759, 14238), (8826, 14373), (8667, 14346), (8742, 14334), (8733, 14294), (8853, 14373), (8744, 14344), (8596, 14302), (8625, 14354), (8749, 14362), (8655, 14320), (8713, 14395), (8804, 14389), (8655, 14257), (8632, 14251), (8735, 14399)]
         : compromised: 0.6068, honest: 0.6119
         : sketchguard stats = ['Node 0: acc_rate=0.450', 'Node 1: acc_rate=0.491', 'Node 2: acc_rate=0.467']...
Round 006: test acc mean=0.6179 ± 0.0047 | min=0.6098 max=0.6255
         : test loss mean=0.6492 ± 0.0029
         : individual accs = ['0.620784', '0.624166', '0.622319', '0.609763', '0.622419', '0.623391', '0.620940', '0.618041', '0.615783', '0.625548', '0.620817', '0.611313', '0.622266', '0.617045', '0.612570', '0.610629', '0.613455', '0.614575', '0.616448', '0.615112']
         : correct/total = [(8835, 14232), (8885, 14235), (8878, 14266), (8669, 14217), (8862, 14238), (8960, 14373), (8908, 14346), (8859, 14334), (8802, 14294), (8991, 14373), (8905, 14344), (8743, 14302), (8932, 14354), (8862, 14362), (8772, 14320), (8790, 14395), (8827, 14389), (8762, 14257), (8785, 14251), (8857, 14399)]
         : compromised: 0.6169, honest: 0.6202
         : sketchguard stats = ['Node 0: acc_rate=0.427', 'Node 1: acc_rate=0.470', 'Node 2: acc_rate=0.444']...
Round 007: test acc mean=0.6259 ± 0.0036 | min=0.6188 max=0.6324
         : test loss mean=0.6431 ± 0.0021
         : individual accs = ['0.629216', '0.624939', '0.627436', '0.622987', '0.630707', '0.626661', '0.628050', '0.620064', '0.632433', '0.631531', '0.624861', '0.618795', '0.628605', '0.624983', '0.626536', '0.624731', '0.625895', '0.623413', '0.620588', '0.626363']
         : correct/total = [(8955, 14232), (8896, 14235), (8951, 14266), (8857, 14217), (8980, 14238), (9007, 14373), (9010, 14346), (8888, 14334), (9040, 14294), (9077, 14373), (8963, 14344), (8850, 14302), (9023, 14354), (8976, 14362), (8972, 14320), (8993, 14395), (9006, 14389), (8888, 14257), (8844, 14251), (9019, 14399)]
         : compromised: 0.6255, honest: 0.6270
         : sketchguard stats = ['Node 0: acc_rate=0.411', 'Node 1: acc_rate=0.455', 'Node 2: acc_rate=0.429']...
Round 008: test acc mean=0.6293 ± 0.0043 | min=0.6187 max=0.6369
         : test loss mean=0.6406 ± 0.0033
         : individual accs = ['0.628092', '0.627468', '0.631431', '0.626503', '0.629372', '0.627148', '0.630838', '0.619715', '0.635441', '0.632645', '0.628834', '0.618725', '0.636896', '0.629439', '0.631983', '0.631052', '0.630829', '0.629235', '0.626623', '0.632961']
         : correct/total = [(8939, 14232), (8932, 14235), (9008, 14266), (8907, 14217), (8961, 14238), (9014, 14373), (9050, 14346), (8883, 14334), (9083, 14294), (9093, 14373), (9020, 14344), (8849, 14302), (9142, 14354), (9040, 14362), (9050, 14320), (9084, 14395), (9077, 14389), (8971, 14257), (8930, 14251), (9114, 14399)]
         : compromised: 0.6297, honest: 0.6282
         : sketchguard stats = ['Node 0: acc_rate=0.398', 'Node 1: acc_rate=0.443', 'Node 2: acc_rate=0.417']...
Round 009: test acc mean=0.6374 ± 0.0035 | min=0.6322 max=0.6432
         : test loss mean=0.6343 ± 0.0021
         : individual accs = ['0.638210', '0.643133', '0.637880', '0.635085', '0.641804', '0.635288', '0.635508', '0.638273', '0.642647', '0.642315', '0.637061', '0.632219', '0.643166', '0.632502', '0.633240', '0.634804', '0.637084', '0.636319', '0.633920', '0.636989']
         : correct/total = [(9083, 14232), (9155, 14235), (9100, 14266), (9029, 14217), (9138, 14238), (9131, 14373), (9117, 14346), (9149, 14334), (9186, 14294), (9232, 14373), (9138, 14344), (9042, 14302), (9232, 14354), (9084, 14362), (9068, 14320), (9138, 14395), (9167, 14389), (9072, 14257), (9034, 14251), (9172, 14399)]
         : compromised: 0.6366, honest: 0.6391
         : sketchguard stats = ['Node 0: acc_rate=0.389', 'Node 1: acc_rate=0.434', 'Node 2: acc_rate=0.407']...
Round 010: test acc mean=0.6411 ± 0.0034 | min=0.6331 max=0.6477
         : test loss mean=0.6313 ± 0.0019
         : individual accs = ['0.640458', '0.647699', '0.637810', '0.638039', '0.646790', '0.641689', '0.638575', '0.644761', '0.640968', '0.646142', '0.641592', '0.633128', '0.644071', '0.638769', '0.641969', '0.639041', '0.640559', '0.638564', '0.638832', '0.642058']
         : correct/total = [(9115, 14232), (9220, 14235), (9099, 14266), (9071, 14217), (9209, 14238), (9223, 14373), (9161, 14346), (9242, 14334), (9162, 14294), (9287, 14373), (9203, 14344), (9055, 14302), (9245, 14354), (9174, 14362), (9193, 14320), (9199, 14395), (9217, 14389), (9104, 14257), (9104, 14251), (9245, 14399)]
         : compromised: 0.6401, honest: 0.6434
         : sketchguard stats = ['Node 0: acc_rate=0.381', 'Node 1: acc_rate=0.427', 'Node 2: acc_rate=0.400']...

=== FINAL RESULTS ===
Dataset: sent140, Nodes: 20, Graph: erdos, Aggregation: sketchguard
Attack: directed_deviation, 70.0% compromised
Final accuracy - Compromised: 0.6401, Honest: 0.6434
Overall test accuracy: mean=0.6411 ± 0.0034

=== Sketchguard SUMMARY ===
Node 0: acceptance=0.381
Node 1: acceptance=0.427
Node 2: acceptance=0.400
Node 3: acceptance=0.438
Node 4: acceptance=0.427
Node 5: acceptance=0.340
Node 6: acceptance=0.357
Node 7: acceptance=0.357
Node 8: acceptance=0.280
Node 9: acceptance=0.377
Node 10: acceptance=0.300
Node 11: acceptance=0.421
Node 12: acceptance=0.433
Node 13: acceptance=0.308
Node 14: acceptance=0.340
Node 15: acceptance=0.345
Node 16: acceptance=0.308
Node 17: acceptance=0.500
Node 18: acceptance=0.381
Node 19: acceptance=0.381

=== PARALLEL EXECUTION TIME (realistic for distributed system) ===
  COMMUNICATION (max across nodes):
    - Sketch transfer: 0.000s (0.0%)
    - Model fetch (accepted): 0.000s (0.0%)
  COMPUTATION (max across nodes):
    - Sketching: 0.351s (95.3%)
    - Filtering: 0.001s (0.3%)
    - Aggregation: 0.016s (4.3%)
  TOTALS:
    - Total computation: 0.368s (100.0%)
    - Total communication: 0.000s (0.0%)
    - Total parallel time: 0.368s

=== PER-NODE AVERAGE TIME ===
  - Sketching: 0.291s
  - Filtering: 0.001s
  - Aggregation: 0.012s
  - Sketch transfer: 0.000s
  - Model fetch: 0.000s
  - Total per node: 0.303s

=== TOTAL COMPUTATIONAL WORK (sum across all nodes) ===
  - Total sketching: 5.814s
  - Total filtering: 0.014s
  - Total aggregation: 0.230s
  - Total sketch transfer: 0.000s
  - Total model fetch: 0.000s
  - Grand total: 6.058s
  - Mean acceptance rate: 0.375

Sketchguard Algorithm Properties:
  - Original dimension: 1,174,986
  - Sketch size: 180
  - Compression ratio: 19.9x
  - Single repetition: No repetitions needed
  - Theoretical complexity: O(d + N×k)
  - Approach: Sketch filtering + state aggregation
