Device: cuda
Seed: 987654321
Loading 1 LEAF Sent140 train files...
LEAF Sent140 train: 254555 users, 908652 samples
Building vocabulary (max_size=10000)...
Vocabulary size: 10000
Loading 1 LEAF Sent140 test files...
LEAF Sent140 test: 254555 users, 286281 samples
Found 254555 train users, 254555 test users, 254555 common users
User sample counts range: 494 (max) to 1 (min)
Distributed ALL 254555 users across 20 clients
Users per client: 12727 (with 15 clients getting +1 user)
Train partition sizes: [44353, 44290, 44657, 44907, 44696, 45843, 45801, 45619, 45069, 45639, 45821, 45311, 45779, 46056, 45625, 45984, 46428, 44737, 45540, 46497]
Test partition sizes: [14232, 14235, 14266, 14217, 14238, 14373, 14346, 14334, 14294, 14373, 14344, 14302, 14354, 14362, 14320, 14395, 14389, 14257, 14251, 14399]
  Client 0: 44353 train samples, 2 unique classes
  Client 1: 44290 train samples, 2 unique classes
  Client 2: 44657 train samples, 2 unique classes
  Client 3: 44907 train samples, 2 unique classes
  Client 4: 44696 train samples, 2 unique classes
  Client 5: 45843 train samples, 2 unique classes
  Client 6: 45801 train samples, 2 unique classes
  Client 7: 45619 train samples, 2 unique classes
  Client 8: 45069 train samples, 2 unique classes
  Client 9: 45639 train samples, 2 unique classes
  Client 10: 45821 train samples, 2 unique classes
  Client 11: 45311 train samples, 2 unique classes
  Client 12: 45779 train samples, 2 unique classes
  Client 13: 46056 train samples, 2 unique classes
  Client 14: 45625 train samples, 2 unique classes
  Client 15: 45984 train samples, 2 unique classes
  Client 16: 46428 train samples, 2 unique classes
  Client 17: 44737 train samples, 2 unique classes
  Client 18: 45540 train samples, 2 unique classes
  Client 19: 46497 train samples, 2 unique classes
Will sample 4500 samples per client per epoch
Graph: erdos, nodes: 20, edges: 48
Degree statistics: avg=4.80, min=2, max=7
Attack: Compromised 2/20 nodes: [5, 13]
Attack type: backdoor, lambda: 1.0
Backdoor target label: 1, trigger size: 3
Model variant: baseline
Model parameters: 1,174,986
Initial test acc across nodes: mean=0.4965 ± 0.0152
Backdoor attack: Created poisoned datasets for 2 compromised nodes
Round 001: test acc mean=0.5088 ± 0.0126 | min=0.4951 max=0.5541
         : test loss mean=0.9042 ± 0.3683
         : individual accs = ['0.506745', '0.499754', '0.515491', '0.500598', '0.505127', '0.505322', '0.525024', '0.506279', '0.554079', '0.505810', '0.501882', '0.508041', '0.518740', '0.510096', '0.495112', '0.497464', '0.500660', '0.500596', '0.509648', '0.508924']
         : correct/total = [(7212, 14232), (7114, 14235), (7354, 14266), (7117, 14217), (7192, 14238), (7263, 14373), (7532, 14346), (7257, 14334), (7920, 14294), (7270, 14373), (7199, 14344), (7266, 14302), (7446, 14354), (7326, 14362), (7090, 14320), (7161, 14395), (7204, 14389), (7137, 14257), (7263, 14251), (7328, 14399)]
         : compromised: 0.5077, honest: 0.5089
Round 002: test acc mean=0.4972 ± 0.0082 | min=0.4831 max=0.5107
         : test loss mean=0.8778 ± 0.3058
         : individual accs = ['0.489109', '0.510713', '0.486121', '0.483084', '0.505689', '0.500800', '0.502091', '0.490791', '0.488457', '0.498852', '0.502022', '0.490001', '0.485440', '0.510723', '0.499162', '0.507051', '0.501772', '0.500526', '0.495614', '0.496354']
         : correct/total = [(6961, 14232), (7270, 14235), (6935, 14266), (6868, 14217), (7200, 14238), (7198, 14373), (7203, 14346), (7035, 14334), (6982, 14294), (7170, 14373), (7201, 14344), (7008, 14302), (6968, 14354), (7335, 14362), (7148, 14320), (7299, 14395), (7220, 14389), (7136, 14257), (7063, 14251), (7147, 14399)]
         : compromised: 0.5058, honest: 0.4963
Round 003: test acc mean=0.5002 ± 0.0104 | min=0.4769 max=0.5159
         : test loss mean=0.7081 ± 0.0404
         : individual accs = ['0.489109', '0.476923', '0.513178', '0.506928', '0.505619', '0.506157', '0.499861', '0.496791', '0.488457', '0.512210', '0.514222', '0.498672', '0.500627', '0.479877', '0.501257', '0.501702', '0.515880', '0.506278', '0.494421', '0.496354']
         : correct/total = [(6961, 14232), (6789, 14235), (7321, 14266), (7207, 14217), (7199, 14238), (7275, 14373), (7171, 14346), (7121, 14334), (6982, 14294), (7362, 14373), (7376, 14344), (7132, 14302), (7186, 14354), (6892, 14362), (7178, 14320), (7222, 14395), (7423, 14389), (7218, 14257), (7046, 14251), (7147, 14399)]
         : compromised: 0.4930, honest: 0.5010
Round 004: test acc mean=0.5051 ± 0.0136 | min=0.4861 max=0.5282
         : test loss mean=0.7415 ± 0.1113
         : individual accs = ['0.508080', '0.486266', '0.486051', '0.510164', '0.494100', '0.506157', '0.497351', '0.519394', '0.488107', '0.511932', '0.528165', '0.517410', '0.527100', '0.490670', '0.507402', '0.527892', '0.499757', '0.508662', '0.488667', '0.499340']
         : correct/total = [(7231, 14232), (6922, 14235), (6934, 14266), (7253, 14217), (7035, 14238), (7275, 14373), (7135, 14346), (7445, 14334), (6977, 14294), (7358, 14373), (7576, 14344), (7400, 14302), (7566, 14354), (7047, 14362), (7266, 14320), (7599, 14395), (7191, 14389), (7252, 14257), (6964, 14251), (7190, 14399)]
         : compromised: 0.4984, honest: 0.5059
Round 005: test acc mean=0.5127 ± 0.0162 | min=0.4885 max=0.5407
         : test loss mean=0.9091 ± 0.3861
         : individual accs = ['0.488687', '0.518089', '0.529861', '0.527608', '0.508709', '0.508175', '0.535550', '0.506000', '0.488457', '0.509497', '0.529769', '0.526849', '0.497074', '0.497772', '0.513547', '0.500521', '0.540691', '0.496388', '0.534419', '0.496354']
         : correct/total = [(6955, 14232), (7375, 14235), (7559, 14266), (7501, 14217), (7243, 14238), (7304, 14373), (7683, 14346), (7253, 14334), (6982, 14294), (7323, 14373), (7599, 14344), (7535, 14302), (7135, 14354), (7149, 14362), (7354, 14320), (7205, 14395), (7780, 14389), (7077, 14257), (7616, 14251), (7147, 14399)]
         : compromised: 0.5030, honest: 0.5138
Round 006: test acc mean=0.5076 ± 0.0181 | min=0.4870 max=0.5667
         : test loss mean=0.8534 ± 0.3066
         : individual accs = ['0.510891', '0.511837', '0.487032', '0.501372', '0.508288', '0.505879', '0.538756', '0.496930', '0.499160', '0.525986', '0.515547', '0.488673', '0.500627', '0.491505', '0.501746', '0.501771', '0.501981', '0.492811', '0.505017', '0.566706']
         : correct/total = [(7271, 14232), (7286, 14235), (6948, 14266), (7128, 14217), (7237, 14238), (7271, 14373), (7729, 14346), (7123, 14334), (7135, 14294), (7560, 14373), (7395, 14344), (6989, 14302), (7186, 14354), (7059, 14362), (7185, 14320), (7223, 14395), (7223, 14389), (7026, 14257), (7197, 14251), (8160, 14399)]
         : compromised: 0.4987, honest: 0.5086
Round 007: test acc mean=0.5099 ± 0.0085 | min=0.4973 max=0.5289
         : test loss mean=0.9062 ± 0.2293
         : individual accs = ['0.528949', '0.513312', '0.513949', '0.500246', '0.505900', '0.526125', '0.502370', '0.513674', '0.519099', '0.507131', '0.512897', '0.497273', '0.500418', '0.516920', '0.501187', '0.504898', '0.500243', '0.511398', '0.511262', '0.509827']
         : correct/total = [(7528, 14232), (7307, 14235), (7332, 14266), (7112, 14217), (7203, 14238), (7562, 14373), (7207, 14346), (7363, 14334), (7420, 14294), (7289, 14373), (7357, 14344), (7112, 14302), (7183, 14354), (7424, 14362), (7177, 14320), (7268, 14395), (7198, 14389), (7291, 14257), (7286, 14251), (7341, 14399)]
         : compromised: 0.5215, honest: 0.5086
Round 008: test acc mean=0.5100 ± 0.0173 | min=0.4942 max=0.5784
         : test loss mean=1.0428 ± 0.3713
         : individual accs = ['0.517496', '0.515771', '0.516473', '0.499472', '0.505970', '0.502748', '0.502788', '0.500698', '0.578355', '0.509636', '0.504880', '0.495455', '0.504528', '0.494221', '0.498743', '0.509830', '0.501494', '0.508592', '0.523121', '0.510660']
         : correct/total = [(7365, 14232), (7342, 14235), (7368, 14266), (7101, 14217), (7204, 14238), (7226, 14373), (7213, 14346), (7177, 14334), (8267, 14294), (7325, 14373), (7242, 14344), (7086, 14302), (7242, 14354), (7098, 14362), (7142, 14320), (7339, 14395), (7216, 14389), (7251, 14257), (7455, 14251), (7353, 14399)]
         : compromised: 0.4985, honest: 0.5113
Round 009: test acc mean=0.5192 ± 0.0223 | min=0.4912 max=0.5893
         : test loss mean=0.9397 ± 0.3902
         : individual accs = ['0.554736', '0.519143', '0.545282', '0.512133', '0.527953', '0.507549', '0.526767', '0.506279', '0.589338', '0.503514', '0.515337', '0.504335', '0.500836', '0.491157', '0.504888', '0.501494', '0.524845', '0.501298', '0.518771', '0.528648']
         : correct/total = [(7895, 14232), (7390, 14235), (7779, 14266), (7281, 14217), (7517, 14238), (7295, 14373), (7557, 14346), (7257, 14334), (8424, 14294), (7237, 14373), (7392, 14344), (7213, 14302), (7189, 14354), (7054, 14362), (7230, 14320), (7219, 14395), (7552, 14389), (7147, 14257), (7393, 14251), (7612, 14399)]
         : compromised: 0.4994, honest: 0.5214
Round 010: test acc mean=0.5138 ± 0.0203 | min=0.4942 max=0.5839
         : test loss mean=1.7811 ± 1.1916
         : individual accs = ['0.538435', '0.525184', '0.524113', '0.507913', '0.506602', '0.507340', '0.504391', '0.505232', '0.583881', '0.508175', '0.503834', '0.507831', '0.500557', '0.494221', '0.503352', '0.501841', '0.500104', '0.496949', '0.513508', '0.541843']
         : correct/total = [(7663, 14232), (7476, 14235), (7477, 14266), (7221, 14217), (7213, 14238), (7292, 14373), (7236, 14346), (7242, 14334), (8346, 14294), (7304, 14373), (7227, 14344), (7263, 14302), (7185, 14354), (7098, 14362), (7208, 14320), (7224, 14395), (7196, 14389), (7085, 14257), (7318, 14251), (7802, 14399)]
         : compromised: 0.5008, honest: 0.5152

=== FINAL RESULTS ===
Dataset: sent140, Nodes: 20, Graph: erdos, Aggregation: d-fedavg
Attack: backdoor, 10.0% compromised
Final accuracy - Compromised: 0.5008, Honest: 0.5152
Overall test accuracy: mean=0.5138 ± 0.0203

=== BACKDOOR ATTACK SUCCESS RATE (ASR) ===
Target label: 1
Trigger size: 3x3
Overall ASR: 0.0758 ± 0.1234
Honest nodes ASR: 0.0801 ± 0.1294
Compromised nodes ASR: 0.0367 ± 0.0070
Note: Higher ASR indicates more successful backdoor attack
