Device: cuda
Seed: 987654321
Loading 1 LEAF Sent140 train files...
LEAF Sent140 train: 254555 users, 908652 samples
Building vocabulary (max_size=10000)...
Vocabulary size: 10000
Loading 1 LEAF Sent140 test files...
LEAF Sent140 test: 254555 users, 286281 samples
Found 254555 train users, 254555 test users, 254555 common users
User sample counts range: 494 (max) to 1 (min)
Distributed ALL 254555 users across 20 clients
Users per client: 12727 (with 15 clients getting +1 user)
Train partition sizes: [44353, 44290, 44657, 44907, 44696, 45843, 45801, 45619, 45069, 45639, 45821, 45311, 45779, 46056, 45625, 45984, 46428, 44737, 45540, 46497]
Test partition sizes: [14232, 14235, 14266, 14217, 14238, 14373, 14346, 14334, 14294, 14373, 14344, 14302, 14354, 14362, 14320, 14395, 14389, 14257, 14251, 14399]
  Client 0: 44353 train samples, 2 unique classes
  Client 1: 44290 train samples, 2 unique classes
  Client 2: 44657 train samples, 2 unique classes
  Client 3: 44907 train samples, 2 unique classes
  Client 4: 44696 train samples, 2 unique classes
  Client 5: 45843 train samples, 2 unique classes
  Client 6: 45801 train samples, 2 unique classes
  Client 7: 45619 train samples, 2 unique classes
  Client 8: 45069 train samples, 2 unique classes
  Client 9: 45639 train samples, 2 unique classes
  Client 10: 45821 train samples, 2 unique classes
  Client 11: 45311 train samples, 2 unique classes
  Client 12: 45779 train samples, 2 unique classes
  Client 13: 46056 train samples, 2 unique classes
  Client 14: 45625 train samples, 2 unique classes
  Client 15: 45984 train samples, 2 unique classes
  Client 16: 46428 train samples, 2 unique classes
  Client 17: 44737 train samples, 2 unique classes
  Client 18: 45540 train samples, 2 unique classes
  Client 19: 46497 train samples, 2 unique classes
Will sample 4500 samples per client per epoch
Graph: erdos, nodes: 20, edges: 48
Degree statistics: avg=4.80, min=2, max=7
Attack: Compromised 6/20 nodes: [5, 12, 13, 14, 17, 18]
Attack type: directed_deviation, lambda: 1.0
Model variant: baseline
Model parameters: 1,174,986
BALANCE algorithm:
Balance Config: BALANCEConfig(gamma=2, kappa=1, alpha=0.5, min_neighbors=1)
  - Model dimension: 1,174,986 parameters
  - Complexity: O(N×d) = O(20×1,174,986)
Initial test acc across nodes: mean=0.4965 ± 0.0152
Round 001: test acc mean=0.5110 ± 0.0212 | min=0.4888 max=0.5686
         : test loss mean=1.2752 ± 0.7024
         : individual accs = ['0.488758', '0.568599', '0.513318', '0.501020', '0.495926', '0.498087', '0.495121', '0.497209', '0.511893', '0.547137', '0.501394', '0.492029', '0.507454', '0.513995', '0.491969', '0.524140', '0.503162', '0.492530', '0.535892', '0.540524']
         : correct/total = [(6956, 14232), (8094, 14235), (7323, 14266), (7123, 14217), (7061, 14238), (7159, 14373), (7103, 14346), (7127, 14334), (7317, 14294), (7864, 14373), (7192, 14344), (7037, 14302), (7284, 14354), (7382, 14362), (7045, 14320), (7545, 14395), (7240, 14389), (7022, 14257), (7637, 14251), (7783, 14399)]
         : compromised: 0.5067, honest: 0.5129
Round 002: test acc mean=0.5082 ± 0.0144 | min=0.4852 max=0.5510
         : test loss mean=0.7426 ± 0.1449
         : individual accs = ['0.511242', '0.514998', '0.519978', '0.550960', '0.506532', '0.494330', '0.493517', '0.486745', '0.507975', '0.497321', '0.504880', '0.508740', '0.529399', '0.511558', '0.502235', '0.507121', '0.505039', '0.518272', '0.485159', '0.507327']
         : correct/total = [(7276, 14232), (7331, 14235), (7418, 14266), (7833, 14217), (7212, 14238), (7105, 14373), (7080, 14346), (6977, 14334), (7261, 14294), (7148, 14373), (7242, 14344), (7276, 14302), (7599, 14354), (7347, 14362), (7192, 14320), (7300, 14395), (7267, 14389), (7389, 14257), (6914, 14251), (7305, 14399)]
         : compromised: 0.5068, honest: 0.5087
Round 003: test acc mean=0.5207 ± 0.0191 | min=0.4904 max=0.5638
         : test loss mean=0.6938 ± 0.0075
         : individual accs = ['0.527473', '0.525395', '0.551241', '0.522614', '0.521351', '0.492103', '0.498745', '0.510953', '0.515951', '0.510888', '0.545803', '0.513774', '0.500766', '0.522142', '0.508240', '0.531296', '0.545695', '0.515747', '0.490352', '0.563789']
         : correct/total = [(7507, 14232), (7479, 14235), (7864, 14266), (7430, 14217), (7423, 14238), (7073, 14373), (7155, 14346), (7324, 14334), (7375, 14294), (7343, 14373), (7829, 14344), (7348, 14302), (7188, 14354), (7499, 14362), (7278, 14320), (7648, 14395), (7852, 14389), (7353, 14257), (6988, 14251), (8118, 14399)]
         : compromised: 0.5049, honest: 0.5275
Round 004: test acc mean=0.5399 ± 0.0297 | min=0.4900 max=0.5882
         : test loss mean=0.6889 ± 0.0040
         : individual accs = ['0.564221', '0.565789', '0.567994', '0.580924', '0.525284', '0.498365', '0.499582', '0.554137', '0.536939', '0.546859', '0.552844', '0.520067', '0.501393', '0.568514', '0.522137', '0.560681', '0.551880', '0.501298', '0.490001', '0.588235']
         : correct/total = [(8030, 14232), (8054, 14235), (8103, 14266), (8259, 14217), (7479, 14238), (7163, 14373), (7167, 14346), (7943, 14334), (7675, 14294), (7860, 14373), (7930, 14344), (7438, 14302), (7197, 14354), (8165, 14362), (7477, 14320), (8071, 14395), (7941, 14389), (7147, 14257), (6983, 14251), (8470, 14399)]
         : compromised: 0.5136, honest: 0.5511
Round 005: test acc mean=0.5609 ± 0.0335 | min=0.4891 max=0.5991
         : test loss mean=0.6860 ± 0.0050
         : individual accs = ['0.583755', '0.578995', '0.574373', '0.599072', '0.589549', '0.503166', '0.530392', '0.591252', '0.580523', '0.574341', '0.514361', '0.595721', '0.526682', '0.588915', '0.557053', '0.560542', '0.575023', '0.516658', '0.489088', '0.588791']
         : correct/total = [(8308, 14232), (8242, 14235), (8194, 14266), (8517, 14217), (8394, 14238), (7232, 14373), (7609, 14346), (8475, 14334), (8298, 14294), (8255, 14373), (7378, 14344), (8520, 14302), (7560, 14354), (8458, 14362), (7977, 14320), (8069, 14395), (8274, 14389), (7366, 14257), (6970, 14251), (8478, 14399)]
         : compromised: 0.5303, honest: 0.5740
Round 006: test acc mean=0.5722 ± 0.0326 | min=0.4941 max=0.6057
         : test loss mean=0.6835 ± 0.0061
         : individual accs = ['0.569491', '0.566140', '0.594701', '0.605121', '0.605703', '0.509149', '0.537432', '0.597112', '0.590877', '0.589299', '0.564835', '0.605160', '0.574265', '0.585782', '0.520531', '0.605627', '0.568281', '0.562040', '0.494071', '0.599347']
         : correct/total = [(8105, 14232), (8059, 14235), (8484, 14266), (8603, 14217), (8624, 14238), (7318, 14373), (7710, 14346), (8559, 14334), (8446, 14294), (8470, 14373), (8102, 14344), (8655, 14302), (8243, 14354), (8413, 14362), (7454, 14320), (8718, 14395), (8177, 14389), (8013, 14257), (7041, 14251), (8630, 14399)]
         : compromised: 0.5410, honest: 0.5857
Round 007: test acc mean=0.5900 ± 0.0201 | min=0.5479 max=0.6143
         : test loss mean=0.6794 ± 0.0070
         : individual accs = ['0.578485', '0.570917', '0.584607', '0.610326', '0.612797', '0.574828', '0.547888', '0.605135', '0.608647', '0.608432', '0.583589', '0.603552', '0.550021', '0.598733', '0.565433', '0.611046', '0.581416', '0.594796', '0.595116', '0.614348']
         : correct/total = [(8233, 14232), (8127, 14235), (8340, 14266), (8677, 14217), (8725, 14238), (8262, 14373), (7860, 14346), (8674, 14334), (8700, 14294), (8745, 14373), (8371, 14344), (8632, 14302), (7895, 14354), (8599, 14362), (8097, 14320), (8796, 14395), (8366, 14389), (8480, 14257), (8481, 14251), (8846, 14399)]
         : compromised: 0.5798, honest: 0.5944
Round 008: test acc mean=0.6032 ± 0.0134 | min=0.5738 max=0.6191
         : test loss mean=0.6734 ± 0.0074
         : individual accs = ['0.583263', '0.594380', '0.573812', '0.615179', '0.617432', '0.602727', '0.575282', '0.615390', '0.613334', '0.609894', '0.616355', '0.599846', '0.598161', '0.615444', '0.601117', '0.616186', '0.596845', '0.603002', '0.597712', '0.619140']
         : correct/total = [(8301, 14232), (8461, 14235), (8186, 14266), (8746, 14217), (8791, 14238), (8663, 14373), (8253, 14346), (8821, 14334), (8767, 14294), (8766, 14373), (8841, 14344), (8579, 14302), (8586, 14354), (8839, 14362), (8608, 14320), (8870, 14395), (8588, 14389), (8597, 14257), (8518, 14251), (8915, 14399)]
         : compromised: 0.6030, honest: 0.6033
Round 009: test acc mean=0.6146 ± 0.0066 | min=0.6009 max=0.6250
         : test loss mean=0.6650 ± 0.0065
         : individual accs = ['0.610315', '0.614120', '0.615940', '0.618766', '0.621717', '0.624991', '0.611251', '0.619925', '0.615083', '0.621026', '0.613079', '0.611593', '0.603873', '0.618438', '0.604260', '0.621952', '0.600876', '0.614505', '0.608168', '0.623099']
         : correct/total = [(8686, 14232), (8742, 14235), (8787, 14266), (8797, 14217), (8852, 14238), (8983, 14373), (8769, 14346), (8886, 14334), (8792, 14294), (8926, 14373), (8794, 14344), (8747, 14302), (8668, 14354), (8882, 14362), (8653, 14320), (8953, 14395), (8646, 14389), (8761, 14257), (8667, 14251), (8972, 14399)]
         : compromised: 0.6124, honest: 0.6156
Round 010: test acc mean=0.6211 ± 0.0051 | min=0.6086 max=0.6286
         : test loss mean=0.6564 ± 0.0048
         : individual accs = ['0.616568', '0.623674', '0.621968', '0.622213', '0.623753', '0.628609', '0.621079', '0.627738', '0.615223', '0.626592', '0.626255', '0.616627', '0.621151', '0.625749', '0.617598', '0.621813', '0.613455', '0.618082', '0.608589', '0.625668']
         : correct/total = [(8775, 14232), (8878, 14235), (8873, 14266), (8846, 14217), (8881, 14238), (9035, 14373), (8910, 14346), (8998, 14334), (8794, 14294), (9006, 14373), (8983, 14344), (8819, 14302), (8916, 14354), (8987, 14362), (8844, 14320), (8951, 14395), (8827, 14389), (8812, 14257), (8673, 14251), (9009, 14399)]
         : compromised: 0.6200, honest: 0.6216

=== FINAL RESULTS ===
Dataset: sent140, Nodes: 20, Graph: erdos, Aggregation: balance
Attack: directed_deviation, 30.0% compromised
Final accuracy - Compromised: 0.6200, Honest: 0.6216
Overall test accuracy: mean=0.6211 ± 0.0051

=== BALANCE SUMMARY ===
Node 0: acceptance=0.850
Node 1: acceptance=1.000
Node 2: acceptance=0.640
Node 3: acceptance=0.775
Node 4: acceptance=0.550
Node 5: acceptance=0.460
Node 6: acceptance=0.820
Node 7: acceptance=0.640
Node 8: acceptance=0.600
Node 9: acceptance=1.000
Node 10: acceptance=0.775
Node 11: acceptance=0.614
Node 12: acceptance=0.743
Node 13: acceptance=0.775
Node 14: acceptance=0.486
Node 15: acceptance=0.550
Node 16: acceptance=0.460
Node 17: acceptance=0.640
Node 18: acceptance=0.900
Node 19: acceptance=1.000

=== PARALLEL EXECUTION TIME (realistic for distributed system) ===
  COMMUNICATION (max across nodes):
    - Full model transfer: 0.000s (0.0%)
  COMPUTATION (max across nodes):
    - Filtering: 0.036s (73.7%)
    - Aggregation: 0.013s (26.3%)
  TOTALS:
    - Total computation: 0.049s (100.0%)
    - Total communication: 0.000s (0.0%)
    - Total parallel time: 0.049s

=== PER-NODE AVERAGE TIME ===
  - Filtering: 0.023s
  - Aggregation: 0.006s
  - Model transfer: 0.000s
  - Total per node: 0.029s

=== TOTAL COMPUTATIONAL WORK (sum across all nodes) ===
  - Total filtering: 0.467s
  - Total aggregation: 0.121s
  - Total model transfer: 0.000s
  - Grand total: 0.589s
  - Mean acceptance rate: 0.714

BALANCE Algorithm Properties:
  - Model dimension: 1,174,986
  - No compression: Full parameter comparison
  - Theoretical complexity: O(deg(i)×d)
  - Approach: Full parameter filtering + averaging
