Device: cuda
Seed: 987654321
Loading 1 LEAF Sent140 train files...
LEAF Sent140 train: 254555 users, 908652 samples
Building vocabulary (max_size=10000)...
Vocabulary size: 10000
Loading 1 LEAF Sent140 test files...
LEAF Sent140 test: 254555 users, 286281 samples
Found 254555 train users, 254555 test users, 254555 common users
User sample counts range: 494 (max) to 1 (min)
Distributed ALL 254555 users across 20 clients
Users per client: 12727 (with 15 clients getting +1 user)
Train partition sizes: [44353, 44290, 44657, 44907, 44696, 45843, 45801, 45619, 45069, 45639, 45821, 45311, 45779, 46056, 45625, 45984, 46428, 44737, 45540, 46497]
Test partition sizes: [14232, 14235, 14266, 14217, 14238, 14373, 14346, 14334, 14294, 14373, 14344, 14302, 14354, 14362, 14320, 14395, 14389, 14257, 14251, 14399]
  Client 0: 44353 train samples, 2 unique classes
  Client 1: 44290 train samples, 2 unique classes
  Client 2: 44657 train samples, 2 unique classes
  Client 3: 44907 train samples, 2 unique classes
  Client 4: 44696 train samples, 2 unique classes
  Client 5: 45843 train samples, 2 unique classes
  Client 6: 45801 train samples, 2 unique classes
  Client 7: 45619 train samples, 2 unique classes
  Client 8: 45069 train samples, 2 unique classes
  Client 9: 45639 train samples, 2 unique classes
  Client 10: 45821 train samples, 2 unique classes
  Client 11: 45311 train samples, 2 unique classes
  Client 12: 45779 train samples, 2 unique classes
  Client 13: 46056 train samples, 2 unique classes
  Client 14: 45625 train samples, 2 unique classes
  Client 15: 45984 train samples, 2 unique classes
  Client 16: 46428 train samples, 2 unique classes
  Client 17: 44737 train samples, 2 unique classes
  Client 18: 45540 train samples, 2 unique classes
  Client 19: 46497 train samples, 2 unique classes
Will sample 4500 samples per client per epoch
Graph: ring, nodes: 20, edges: 20
Degree statistics: avg=2.00, min=2, max=2
Attack: Compromised 10/20 nodes: [1, 2, 5, 11, 12, 13, 14, 15, 17, 18]
Attack type: gaussian, lambda: 1.0
Model variant: baseline
Model parameters: 1,174,986
BALANCE algorithm:
Balance Config: BALANCEConfig(gamma=2, kappa=1, alpha=0.5, min_neighbors=1)
  - Model dimension: 1,174,986 parameters
  - Complexity: O(N×d) = O(20×1,174,986)
Initial test acc across nodes: mean=0.4965 ± 0.0152
Round 001: test acc mean=0.5253 ± 0.0164 | min=0.4991 max=0.5627
         : test loss mean=188.3995 ± 377.6581
         : individual accs = ['0.548974', '0.523147', '0.532174', '0.515017', '0.517980', '0.509288', '0.562666', '0.526441', '0.518679', '0.540110', '0.515965', '0.533562', '0.500348', '0.510723', '0.507402', '0.525669', '0.499131', '0.542050', '0.533226', '0.543649']
         : correct/total = [(7813, 14232), (7447, 14235), (7592, 14266), (7322, 14217), (7375, 14238), (7320, 14373), (8072, 14346), (7546, 14334), (7414, 14294), (7763, 14373), (7401, 14344), (7631, 14302), (7182, 14354), (7335, 14362), (7266, 14320), (7567, 14395), (7182, 14389), (7728, 14257), (7599, 14251), (7828, 14399)]
         : compromised: 0.5218, honest: 0.5289
Round 002: test acc mean=0.5380 ± 0.0373 | min=0.4886 max=0.6070
         : test loss mean=214.0220 ± 338.8792
         : individual accs = ['0.590008', '0.563400', '0.534838', '0.558557', '0.558505', '0.493843', '0.606998', '0.556369', '0.488597', '0.523203', '0.569646', '0.549993', '0.507385', '0.496588', '0.502933', '0.501633', '0.495934', '0.495827', '0.575960', '0.589208']
         : correct/total = [(8397, 14232), (8020, 14235), (7630, 14266), (7941, 14217), (7952, 14238), (7098, 14373), (8708, 14346), (7975, 14334), (6984, 14294), (7520, 14373), (8171, 14344), (7866, 14302), (7283, 14354), (7132, 14362), (7202, 14320), (7221, 14395), (7136, 14389), (7069, 14257), (8208, 14251), (8484, 14399)]
         : compromised: 0.5222, honest: 0.5537
Round 003: test acc mean=0.5519 ± 0.0472 | min=0.4887 max=0.6173
         : test loss mean=251.1810 ± 434.4191
         : individual accs = ['0.615233', '0.605409', '0.574583', '0.603503', '0.599312', '0.493843', '0.604977', '0.560625', '0.488667', '0.526195', '0.564905', '0.554258', '0.504180', '0.504456', '0.503561', '0.498715', '0.504413', '0.506769', '0.606414', '0.617335']
         : correct/total = [(8756, 14232), (8618, 14235), (8197, 14266), (8580, 14217), (8533, 14238), (7098, 14373), (8679, 14346), (8036, 14334), (6985, 14294), (7563, 14373), (8103, 14344), (7927, 14302), (7237, 14354), (7245, 14362), (7211, 14320), (7179, 14395), (7258, 14389), (7225, 14257), (8642, 14251), (8889, 14399)]
         : compromised: 0.5352, honest: 0.5685
Round 004: test acc mean=0.5634 ± 0.0557 | min=0.4887 max=0.6304
         : test loss mean=161.5542 ± 274.4107
         : individual accs = ['0.625422', '0.623253', '0.610052', '0.614968', '0.610830', '0.493773', '0.605326', '0.585391', '0.497412', '0.574132', '0.594604', '0.591666', '0.488714', '0.500000', '0.497137', '0.503647', '0.504274', '0.492390', '0.624307', '0.630391']
         : correct/total = [(8901, 14232), (8872, 14235), (8703, 14266), (8743, 14217), (8697, 14238), (7097, 14373), (8684, 14346), (8391, 14334), (7110, 14294), (8252, 14373), (8529, 14344), (8462, 14302), (7015, 14354), (7181, 14362), (7119, 14320), (7250, 14395), (7256, 14389), (7020, 14257), (8897, 14251), (9077, 14399)]
         : compromised: 0.5425, honest: 0.5843
Round 005: test acc mean=0.5723 ± 0.0571 | min=0.4926 max=0.6313
         : test loss mean=166.4504 ± 269.7762
         : individual accs = ['0.629005', '0.629926', '0.621618', '0.631146', '0.630987', '0.493912', '0.622055', '0.615739', '0.523996', '0.574897', '0.595162', '0.594183', '0.503205', '0.505640', '0.492598', '0.504967', '0.502189', '0.512941', '0.630622', '0.631294']
         : correct/total = [(8952, 14232), (8967, 14235), (8868, 14266), (8973, 14217), (8984, 14238), (7099, 14373), (8924, 14346), (8826, 14334), (7490, 14294), (8263, 14373), (8537, 14344), (8498, 14302), (7223, 14354), (7262, 14362), (7054, 14320), (7269, 14395), (7226, 14389), (7313, 14257), (8987, 14251), (9090, 14399)]
         : compromised: 0.5490, honest: 0.5956
Round 006: test acc mean=0.5813 ± 0.0586 | min=0.4979 max=0.6387
         : test loss mean=277.3362 ± 558.7463
         : individual accs = ['0.635329', '0.638005', '0.633534', '0.638320', '0.634921', '0.501913', '0.622194', '0.618878', '0.589828', '0.603701', '0.605828', '0.607747', '0.497980', '0.508564', '0.504190', '0.511150', '0.503093', '0.497931', '0.634973', '0.638725']
         : correct/total = [(9042, 14232), (9082, 14235), (9038, 14266), (9075, 14217), (9040, 14238), (7214, 14373), (8926, 14346), (8871, 14334), (8431, 14294), (8677, 14373), (8690, 14344), (8692, 14302), (7148, 14354), (7304, 14362), (7220, 14320), (7358, 14395), (7239, 14389), (7099, 14257), (9049, 14251), (9197, 14399)]
         : compromised: 0.5536, honest: 0.6091
Round 007: test acc mean=0.5879 ± 0.0592 | min=0.4893 max=0.6458
         : test loss mean=221.3965 ± 416.5341
         : individual accs = ['0.643198', '0.634984', '0.638020', '0.645776', '0.643208', '0.585473', '0.622194', '0.617762', '0.599202', '0.611494', '0.609314', '0.610964', '0.490038', '0.508843', '0.496508', '0.504550', '0.518174', '0.489304', '0.644235', '0.645739']
         : correct/total = [(9154, 14232), (9039, 14235), (9102, 14266), (9181, 14217), (9158, 14238), (8415, 14373), (8926, 14346), (8855, 14334), (8565, 14294), (8789, 14373), (8740, 14344), (8738, 14302), (7034, 14354), (7308, 14362), (7110, 14320), (7263, 14395), (7456, 14389), (6976, 14257), (9181, 14251), (9298, 14399)]
         : compromised: 0.5603, honest: 0.6156
Round 008: test acc mean=0.5931 ± 0.0613 | min=0.4905 max=0.6469
         : test loss mean=383.6048 ± 777.9590
         : individual accs = ['0.645096', '0.639550', '0.642366', '0.645987', '0.643559', '0.634662', '0.628956', '0.625715', '0.612915', '0.616434', '0.612521', '0.614110', '0.490525', '0.507938', '0.499092', '0.500660', '0.498575', '0.510206', '0.646902', '0.646225']
         : correct/total = [(9181, 14232), (9104, 14235), (9164, 14266), (9184, 14217), (9163, 14238), (9122, 14373), (9023, 14346), (8969, 14334), (8761, 14294), (8860, 14373), (8786, 14344), (8783, 14302), (7041, 14354), (7295, 14362), (7147, 14320), (7207, 14395), (7174, 14389), (7274, 14257), (9219, 14251), (9305, 14399)]
         : compromised: 0.5686, honest: 0.6176
Round 009: test acc mean=0.5939 ± 0.0638 | min=0.4921 max=0.6526
         : test loss mean=377.9162 ± 778.8136
         : individual accs = ['0.649101', '0.648753', '0.644469', '0.643455', '0.645105', '0.635636', '0.631883', '0.628087', '0.616832', '0.619425', '0.612730', '0.613341', '0.492128', '0.510375', '0.495740', '0.495241', '0.498297', '0.497791', '0.646832', '0.652615']
         : correct/total = [(9238, 14232), (9235, 14235), (9194, 14266), (9148, 14217), (9185, 14238), (9136, 14373), (9065, 14346), (9003, 14334), (8817, 14294), (8903, 14373), (8789, 14344), (8772, 14302), (7064, 14354), (7330, 14362), (7099, 14320), (7129, 14395), (7170, 14389), (7097, 14257), (9218, 14251), (9397, 14399)]
         : compromised: 0.5680, honest: 0.6198
Round 010: test acc mean=0.5985 ± 0.0639 | min=0.4875 max=0.6530
         : test loss mean=335.0414 ± 669.3819
         : individual accs = ['0.651349', '0.652968', '0.646362', '0.652177', '0.651636', '0.638350', '0.634463', '0.629134', '0.624598', '0.630209', '0.623257', '0.622221', '0.487460', '0.508216', '0.510265', '0.497881', '0.499409', '0.510346', '0.647604', '0.651365']
         : correct/total = [(9270, 14232), (9295, 14235), (9221, 14266), (9272, 14217), (9278, 14238), (9175, 14373), (9102, 14346), (9018, 14334), (8928, 14294), (9058, 14373), (8940, 14344), (8899, 14302), (6997, 14354), (7299, 14362), (7307, 14320), (7167, 14395), (7186, 14389), (7276, 14257), (9229, 14251), (9379, 14399)]
         : compromised: 0.5722, honest: 0.6248

=== FINAL RESULTS ===
Dataset: sent140, Nodes: 20, Graph: ring, Aggregation: balance
Attack: gaussian, 50.0% compromised
Final accuracy - Compromised: 0.5722, Honest: 0.6248
Overall test accuracy: mean=0.5985 ± 0.0639

=== BALANCE SUMMARY ===
Node 0: acceptance=0.500
Node 1: acceptance=0.500
Node 2: acceptance=0.500
Node 3: acceptance=0.500
Node 4: acceptance=0.500
Node 5: acceptance=0.800
Node 6: acceptance=0.500
Node 7: acceptance=1.000
Node 8: acceptance=1.000
Node 9: acceptance=1.000
Node 10: acceptance=0.500
Node 11: acceptance=0.500
Node 12: acceptance=0.500
Node 13: acceptance=0.500
Node 14: acceptance=0.500
Node 15: acceptance=0.500
Node 16: acceptance=0.500
Node 17: acceptance=0.450
Node 18: acceptance=0.500
Node 19: acceptance=0.500

=== PARALLEL EXECUTION TIME (realistic for distributed system) ===
  COMMUNICATION (max across nodes):
    - Full model transfer: 0.000s (0.0%)
  COMPUTATION (max across nodes):
    - Filtering: 0.025s (65.2%)
    - Aggregation: 0.013s (34.8%)
  TOTALS:
    - Total computation: 0.039s (100.0%)
    - Total communication: 0.000s (0.0%)
    - Total parallel time: 0.039s

=== PER-NODE AVERAGE TIME ===
  - Filtering: 0.012s
  - Aggregation: 0.006s
  - Model transfer: 0.000s
  - Total per node: 0.018s

=== TOTAL COMPUTATIONAL WORK (sum across all nodes) ===
  - Total filtering: 0.250s
  - Total aggregation: 0.116s
  - Total model transfer: 0.000s
  - Grand total: 0.366s
  - Mean acceptance rate: 0.588

BALANCE Algorithm Properties:
  - Model dimension: 1,174,986
  - No compression: Full parameter comparison
  - Theoretical complexity: O(deg(i)×d)
  - Approach: Full parameter filtering + averaging
