Device: cuda
Seed: 987654321
Loading 1 LEAF Sent140 train files...
LEAF Sent140 train: 254555 users, 908652 samples
Building vocabulary (max_size=10000)...
Vocabulary size: 10000
Loading 1 LEAF Sent140 test files...
LEAF Sent140 test: 254555 users, 286281 samples
Found 254555 train users, 254555 test users, 254555 common users
User sample counts range: 494 (max) to 1 (min)
Distributed ALL 254555 users across 20 clients
Users per client: 12727 (with 15 clients getting +1 user)
Train partition sizes: [44353, 44290, 44657, 44907, 44696, 45843, 45801, 45619, 45069, 45639, 45821, 45311, 45779, 46056, 45625, 45984, 46428, 44737, 45540, 46497]
Test partition sizes: [14232, 14235, 14266, 14217, 14238, 14373, 14346, 14334, 14294, 14373, 14344, 14302, 14354, 14362, 14320, 14395, 14389, 14257, 14251, 14399]
  Client 0: 44353 train samples, 2 unique classes
  Client 1: 44290 train samples, 2 unique classes
  Client 2: 44657 train samples, 2 unique classes
  Client 3: 44907 train samples, 2 unique classes
  Client 4: 44696 train samples, 2 unique classes
  Client 5: 45843 train samples, 2 unique classes
  Client 6: 45801 train samples, 2 unique classes
  Client 7: 45619 train samples, 2 unique classes
  Client 8: 45069 train samples, 2 unique classes
  Client 9: 45639 train samples, 2 unique classes
  Client 10: 45821 train samples, 2 unique classes
  Client 11: 45311 train samples, 2 unique classes
  Client 12: 45779 train samples, 2 unique classes
  Client 13: 46056 train samples, 2 unique classes
  Client 14: 45625 train samples, 2 unique classes
  Client 15: 45984 train samples, 2 unique classes
  Client 16: 46428 train samples, 2 unique classes
  Client 17: 44737 train samples, 2 unique classes
  Client 18: 45540 train samples, 2 unique classes
  Client 19: 46497 train samples, 2 unique classes
Will sample 4500 samples per client per epoch
Graph: erdos, nodes: 20, edges: 48
Degree statistics: avg=4.80, min=2, max=7
Attack: Compromised 6/20 nodes: [5, 12, 13, 14, 17, 18]
Attack type: directed_deviation, lambda: 1.0
Model variant: baseline
Model parameters: 1,174,986
Initial test acc across nodes: mean=0.4953 ± 0.0174
Round 001: test acc mean=0.5025 ± 0.0101 | min=0.4852 max=0.5228
         : test loss mean=3.1834 ± 2.5683
         : individual accs = ['0.508010', '0.485213', '0.513879', '0.506084', '0.491080', '0.490920', '0.490659', '0.491628', '0.505177', '0.514367', '0.501743', '0.497902', '0.500697', '0.512394', '0.494204', '0.522820', '0.493432', '0.505787', '0.509087', '0.514272']
         : correct/total = [(7230, 14232), (6907, 14235), (7331, 14266), (7195, 14217), (6992, 14238), (7056, 14373), (7039, 14346), (7047, 14334), (7221, 14294), (7393, 14373), (7197, 14344), (7121, 14302), (7187, 14354), (7359, 14362), (7077, 14320), (7526, 14395), (7100, 14389), (7211, 14257), (7255, 14251), (7405, 14399)]
         : compromised: 0.5022, honest: 0.5026
Round 002: test acc mean=0.5057 ± 0.0101 | min=0.4916 max=0.5392
         : test loss mean=2.8423 ± 2.0618
         : individual accs = ['0.504918', '0.501510', '0.509253', '0.539214', '0.491642', '0.508523', '0.499861', '0.510744', '0.500070', '0.504766', '0.511503', '0.500909', '0.509196', '0.492480', '0.504330', '0.500243', '0.521023', '0.502490', '0.499193', '0.501910']
         : correct/total = [(7186, 14232), (7139, 14235), (7265, 14266), (7666, 14217), (7000, 14238), (7309, 14373), (7171, 14346), (7321, 14334), (7148, 14294), (7255, 14373), (7337, 14344), (7164, 14302), (7309, 14354), (7073, 14362), (7222, 14320), (7201, 14395), (7497, 14389), (7164, 14257), (7114, 14251), (7227, 14399)]
         : compromised: 0.5027, honest: 0.5070
Round 003: test acc mean=0.5004 ± 0.0136 | min=0.4748 max=0.5261
         : test loss mean=1.0597 ± 0.6313
         : individual accs = ['0.509556', '0.520337', '0.502594', '0.485053', '0.526127', '0.488625', '0.484456', '0.495465', '0.481950', '0.505670', '0.498397', '0.496924', '0.493660', '0.522908', '0.509148', '0.505036', '0.500938', '0.493231', '0.474844', '0.513438']
         : correct/total = [(7252, 14232), (7407, 14235), (7170, 14266), (6896, 14217), (7491, 14238), (7023, 14373), (6950, 14346), (7102, 14334), (6889, 14294), (7268, 14373), (7149, 14344), (7107, 14302), (7086, 14354), (7510, 14362), (7291, 14320), (7270, 14395), (7208, 14389), (7032, 14257), (6767, 14251), (7393, 14399)]
         : compromised: 0.4971, honest: 0.5019
Round 004: test acc mean=0.5085 ± 0.0101 | min=0.4932 max=0.5277
         : test loss mean=1.3765 ± 0.8914
         : individual accs = ['0.510118', '0.522936', '0.509603', '0.523669', '0.502458', '0.496347', '0.504810', '0.504186', '0.493214', '0.527726', '0.524122', '0.515173', '0.516093', '0.511349', '0.508310', '0.503647', '0.505178', '0.500175', '0.495614', '0.496076']
         : correct/total = [(7260, 14232), (7444, 14235), (7270, 14266), (7445, 14217), (7154, 14238), (7134, 14373), (7242, 14346), (7227, 14334), (7050, 14294), (7585, 14373), (7518, 14344), (7368, 14302), (7408, 14354), (7344, 14362), (7279, 14320), (7250, 14395), (7269, 14389), (7131, 14257), (7063, 14251), (7143, 14399)]
         : compromised: 0.5046, honest: 0.5102
Round 005: test acc mean=0.5036 ± 0.0084 | min=0.4854 max=0.5225
         : test loss mean=1.0267 ± 0.4876
         : individual accs = ['0.522485', '0.513242', '0.508552', '0.485405', '0.507445', '0.498295', '0.505925', '0.494070', '0.502728', '0.507340', '0.498885', '0.501888', '0.497910', '0.495335', '0.507053', '0.505175', '0.509486', '0.508662', '0.490632', '0.511772']
         : correct/total = [(7436, 14232), (7306, 14235), (7255, 14266), (6901, 14217), (7225, 14238), (7162, 14373), (7258, 14346), (7082, 14334), (7186, 14294), (7292, 14373), (7156, 14344), (7178, 14302), (7147, 14354), (7114, 14362), (7261, 14320), (7272, 14395), (7331, 14389), (7252, 14257), (6992, 14251), (7369, 14399)]
         : compromised: 0.4996, honest: 0.5053
Round 006: test acc mean=0.5133 ± 0.0155 | min=0.4926 max=0.5527
         : test loss mean=1.0630 ± 0.5401
         : individual accs = ['0.512296', '0.492589', '0.506239', '0.539565', '0.503652', '0.495652', '0.522166', '0.502930', '0.519099', '0.495304', '0.552705', '0.510069', '0.520064', '0.515457', '0.508101', '0.509899', '0.507054', '0.519184', '0.495614', '0.538649']
         : correct/total = [(7291, 14232), (7012, 14235), (7222, 14266), (7671, 14217), (7171, 14238), (7124, 14373), (7491, 14346), (7209, 14334), (7420, 14294), (7119, 14373), (7928, 14344), (7295, 14302), (7465, 14354), (7403, 14362), (7276, 14320), (7340, 14395), (7296, 14389), (7402, 14257), (7063, 14251), (7756, 14399)]
         : compromised: 0.5090, honest: 0.5152
Round 007: test acc mean=0.5088 ± 0.0136 | min=0.4848 max=0.5425
         : test loss mean=0.9022 ± 0.3668
         : individual accs = ['0.493325', '0.523428', '0.513739', '0.484842', '0.525144', '0.500035', '0.525582', '0.492745', '0.508115', '0.517916', '0.498466', '0.511747', '0.507594', '0.498399', '0.506075', '0.492810', '0.512822', '0.513572', '0.506771', '0.542468']
         : correct/total = [(7021, 14232), (7451, 14235), (7329, 14266), (6893, 14217), (7477, 14238), (7187, 14373), (7540, 14346), (7063, 14334), (7263, 14294), (7444, 14373), (7150, 14344), (7319, 14302), (7286, 14354), (7158, 14362), (7247, 14320), (7094, 14395), (7379, 14389), (7322, 14257), (7222, 14251), (7811, 14399)]
         : compromised: 0.5054, honest: 0.5102
Round 008: test acc mean=0.5142 ± 0.0253 | min=0.4836 max=0.5977
         : test loss mean=0.9309 ± 0.3755
         : individual accs = ['0.506745', '0.483597', '0.507711', '0.565520', '0.496488', '0.504488', '0.513105', '0.527766', '0.530922', '0.495721', '0.508924', '0.502237', '0.514909', '0.513786', '0.506215', '0.498576', '0.510112', '0.504314', '0.495614', '0.597680']
         : correct/total = [(7212, 14232), (6884, 14235), (7243, 14266), (8040, 14217), (7069, 14238), (7251, 14373), (7361, 14346), (7565, 14334), (7589, 14294), (7125, 14373), (7300, 14344), (7183, 14302), (7391, 14354), (7379, 14362), (7249, 14320), (7177, 14395), (7340, 14389), (7190, 14257), (7063, 14251), (8606, 14399)]
         : compromised: 0.5066, honest: 0.5175
Round 009: test acc mean=0.5147 ± 0.0216 | min=0.4810 max=0.5571
         : test loss mean=0.8097 ± 0.2796
         : individual accs = ['0.493676', '0.492799', '0.518506', '0.532250', '0.540877', '0.502400', '0.555904', '0.495675', '0.552050', '0.500939', '0.557097', '0.510698', '0.505713', '0.495822', '0.505028', '0.512470', '0.511363', '0.509083', '0.481019', '0.521147']
         : correct/total = [(7026, 14232), (7015, 14235), (7397, 14266), (7567, 14217), (7701, 14238), (7221, 14373), (7975, 14346), (7105, 14334), (7891, 14294), (7200, 14373), (7991, 14344), (7304, 14302), (7259, 14354), (7121, 14362), (7232, 14320), (7377, 14395), (7358, 14389), (7258, 14257), (6855, 14251), (7504, 14399)]
         : compromised: 0.4998, honest: 0.5211
Round 010: test acc mean=0.5225 ± 0.0276 | min=0.4938 max=0.6007
         : test loss mean=0.8752 ± 0.3350
         : individual accs = ['0.517566', '0.537548', '0.519978', '0.546669', '0.505829', '0.493773', '0.501952', '0.535580', '0.532811', '0.582829', '0.523146', '0.501538', '0.527031', '0.513786', '0.509218', '0.495033', '0.499062', '0.510837', '0.495685', '0.600736']
         : correct/total = [(7366, 14232), (7652, 14235), (7418, 14266), (7772, 14217), (7202, 14238), (7097, 14373), (7201, 14346), (7677, 14334), (7616, 14294), (8377, 14373), (7504, 14344), (7173, 14302), (7565, 14354), (7379, 14362), (7292, 14320), (7126, 14395), (7181, 14389), (7283, 14257), (7064, 14251), (8650, 14399)]
         : compromised: 0.5084, honest: 0.5286

=== FINAL RESULTS ===
Dataset: sent140, Nodes: 20, Graph: erdos, Aggregation: d-fedavg
Attack: directed_deviation, 30.0% compromised
Final accuracy - Compromised: 0.5084, Honest: 0.5286
Overall test accuracy: mean=0.5225 ± 0.0276
