Device: cuda
Seed: 987654321
Loading 1 LEAF Sent140 train files...
LEAF Sent140 train: 254555 users, 908652 samples
Building vocabulary (max_size=10000)...
Vocabulary size: 10000
Loading 1 LEAF Sent140 test files...
LEAF Sent140 test: 254555 users, 286281 samples
Found 254555 train users, 254555 test users, 254555 common users
User sample counts range: 494 (max) to 1 (min)
Distributed ALL 254555 users across 20 clients
Users per client: 12727 (with 15 clients getting +1 user)
Train partition sizes: [44353, 44290, 44657, 44907, 44696, 45843, 45801, 45619, 45069, 45639, 45821, 45311, 45779, 46056, 45625, 45984, 46428, 44737, 45540, 46497]
Test partition sizes: [14232, 14235, 14266, 14217, 14238, 14373, 14346, 14334, 14294, 14373, 14344, 14302, 14354, 14362, 14320, 14395, 14389, 14257, 14251, 14399]
  Client 0: 44353 train samples, 2 unique classes
  Client 1: 44290 train samples, 2 unique classes
  Client 2: 44657 train samples, 2 unique classes
  Client 3: 44907 train samples, 2 unique classes
  Client 4: 44696 train samples, 2 unique classes
  Client 5: 45843 train samples, 2 unique classes
  Client 6: 45801 train samples, 2 unique classes
  Client 7: 45619 train samples, 2 unique classes
  Client 8: 45069 train samples, 2 unique classes
  Client 9: 45639 train samples, 2 unique classes
  Client 10: 45821 train samples, 2 unique classes
  Client 11: 45311 train samples, 2 unique classes
  Client 12: 45779 train samples, 2 unique classes
  Client 13: 46056 train samples, 2 unique classes
  Client 14: 45625 train samples, 2 unique classes
  Client 15: 45984 train samples, 2 unique classes
  Client 16: 46428 train samples, 2 unique classes
  Client 17: 44737 train samples, 2 unique classes
  Client 18: 45540 train samples, 2 unique classes
  Client 19: 46497 train samples, 2 unique classes
Will sample 4500 samples per client per epoch
Graph: erdos, nodes: 20, edges: 99
Degree statistics: avg=9.90, min=7, max=14
Attack: Compromised 10/20 nodes: [1, 2, 5, 11, 12, 13, 14, 15, 17, 18]
Attack type: backdoor, lambda: 1.0
Backdoor target label: 1, trigger size: 3
Model variant: baseline
Model parameters: 1,174,986
Initial test acc across nodes: mean=0.4965 ± 0.0152
Backdoor attack: Created poisoned datasets for 10 compromised nodes
Round 001: test acc mean=0.4998 ± 0.0078 | min=0.4842 max=0.5138
         : test loss mean=5.9770 ± 1.9631
         : individual accs = ['0.507729', '0.484229', '0.486121', '0.501794', '0.504846', '0.502818', '0.506901', '0.496721', '0.506856', '0.513811', '0.500627', '0.510348', '0.501881', '0.493594', '0.496369', '0.486488', '0.496282', '0.495195', '0.500807', '0.503507']
         : correct/total = [(7226, 14232), (6893, 14235), (6935, 14266), (7134, 14217), (7188, 14238), (7227, 14373), (7272, 14346), (7120, 14334), (7245, 14294), (7385, 14373), (7181, 14344), (7299, 14302), (7204, 14354), (7089, 14362), (7108, 14320), (7003, 14395), (7141, 14389), (7060, 14257), (7137, 14251), (7250, 14399)]
         : compromised: 0.4958, honest: 0.5039
Round 002: test acc mean=0.5039 ± 0.0047 | min=0.4958 max=0.5143
         : test loss mean=9.2296 ± 2.3232
         : individual accs = ['0.506886', '0.506358', '0.509673', '0.504537', '0.510886', '0.502122', '0.500349', '0.502721', '0.509235', '0.506227', '0.498187', '0.502307', '0.502856', '0.495822', '0.506145', '0.501702', '0.501425', '0.497440', '0.514350', '0.499549']
         : correct/total = [(7214, 14232), (7208, 14235), (7271, 14266), (7173, 14217), (7274, 14238), (7217, 14373), (7178, 14346), (7206, 14334), (7279, 14294), (7276, 14373), (7146, 14344), (7184, 14302), (7218, 14354), (7121, 14362), (7248, 14320), (7222, 14395), (7215, 14389), (7092, 14257), (7330, 14251), (7193, 14399)]
         : compromised: 0.5039, honest: 0.5040
Round 003: test acc mean=0.5051 ± 0.0056 | min=0.4914 max=0.5139
         : test loss mean=5.4262 ± 2.0104
         : individual accs = ['0.510891', '0.513874', '0.513949', '0.507561', '0.505689', '0.506157', '0.502370', '0.504883', '0.511543', '0.506992', '0.500976', '0.507761', '0.500488', '0.491436', '0.504260', '0.501771', '0.500243', '0.497089', '0.511262', '0.503646']
         : correct/total = [(7271, 14232), (7315, 14235), (7332, 14266), (7216, 14217), (7200, 14238), (7275, 14373), (7207, 14346), (7237, 14334), (7312, 14294), (7287, 14373), (7186, 14344), (7262, 14302), (7184, 14354), (7058, 14362), (7221, 14320), (7223, 14395), (7198, 14389), (7087, 14257), (7286, 14251), (7252, 14399)]
         : compromised: 0.5048, honest: 0.5055
Round 004: test acc mean=0.4949 ± 0.0057 | min=0.4859 max=0.5092
         : test loss mean=17.9609 ± 6.7712
         : individual accs = ['0.489320', '0.486055', '0.485911', '0.492228', '0.494100', '0.493634', '0.497421', '0.495186', '0.488177', '0.493773', '0.499930', '0.492029', '0.500000', '0.509191', '0.495950', '0.498367', '0.499757', '0.502841', '0.488527', '0.496146']
         : correct/total = [(6964, 14232), (6919, 14235), (6932, 14266), (6998, 14217), (7035, 14238), (7095, 14373), (7136, 14346), (7098, 14334), (6978, 14294), (7097, 14373), (7171, 14344), (7037, 14302), (7177, 14354), (7313, 14362), (7102, 14320), (7174, 14395), (7191, 14389), (7169, 14257), (6962, 14251), (7144, 14399)]
         : compromised: 0.4953, honest: 0.4946
Round 005: test acc mean=0.4949 ± 0.0056 | min=0.4861 max=0.5086
         : test loss mean=29.9965 ± 3.7445
         : individual accs = ['0.489109', '0.486266', '0.486051', '0.492228', '0.494100', '0.493843', '0.497560', '0.495186', '0.488457', '0.493008', '0.499024', '0.492029', '0.499512', '0.508564', '0.495810', '0.498367', '0.499757', '0.503051', '0.488738', '0.496354']
         : correct/total = [(6961, 14232), (6922, 14235), (6934, 14266), (6998, 14217), (7035, 14238), (7098, 14373), (7138, 14346), (7098, 14334), (6982, 14294), (7086, 14373), (7158, 14344), (7037, 14302), (7170, 14354), (7304, 14362), (7100, 14320), (7174, 14395), (7191, 14389), (7172, 14257), (6965, 14251), (7147, 14399)]
         : compromised: 0.4952, honest: 0.4945
Round 006: test acc mean=0.5023 ± 0.0057 | min=0.4930 max=0.5130
         : test loss mean=10.9713 ± 5.9953
         : individual accs = ['0.496065', '0.493010', '0.512968', '0.496237', '0.504706', '0.498017', '0.501812', '0.504744', '0.510354', '0.493008', '0.499024', '0.507901', '0.500139', '0.512603', '0.506215', '0.499548', '0.500521', '0.501578', '0.503824', '0.503438']
         : correct/total = [(7060, 14232), (7018, 14235), (7318, 14266), (7055, 14217), (7186, 14238), (7158, 14373), (7199, 14346), (7235, 14334), (7295, 14294), (7086, 14373), (7158, 14344), (7264, 14302), (7179, 14354), (7362, 14362), (7249, 14320), (7191, 14395), (7202, 14389), (7151, 14257), (7180, 14251), (7249, 14399)]
         : compromised: 0.5036, honest: 0.5010
Round 007: test acc mean=0.5082 ± 0.0074 | min=0.4922 max=0.5191
         : test loss mean=3.1757 ± 2.7152
         : individual accs = ['0.506675', '0.515911', '0.519136', '0.496167', '0.514890', '0.514298', '0.502997', '0.508372', '0.516790', '0.492242', '0.498885', '0.509719', '0.513097', '0.500766', '0.514176', '0.507468', '0.503440', '0.503472', '0.517437', '0.508716']
         : correct/total = [(7211, 14232), (7344, 14235), (7406, 14266), (7054, 14217), (7331, 14238), (7392, 14373), (7216, 14346), (7287, 14334), (7387, 14294), (7075, 14373), (7156, 14344), (7290, 14302), (7365, 14354), (7192, 14362), (7363, 14320), (7305, 14395), (7244, 14389), (7178, 14257), (7374, 14251), (7325, 14399)]
         : compromised: 0.5115, honest: 0.5049
Round 008: test acc mean=0.4964 ± 0.0052 | min=0.4864 max=0.5073
         : test loss mean=3.2934 ± 1.7611
         : individual accs = ['0.500773', '0.499824', '0.487102', '0.507280', '0.494803', '0.500522', '0.497839', '0.495326', '0.491815', '0.487720', '0.496863', '0.491959', '0.501324', '0.486423', '0.499651', '0.499271', '0.499896', '0.495055', '0.498000', '0.496076']
         : correct/total = [(7127, 14232), (7115, 14235), (6949, 14266), (7212, 14217), (7045, 14238), (7194, 14373), (7142, 14346), (7100, 14334), (7030, 14294), (7010, 14373), (7127, 14344), (7036, 14302), (7196, 14354), (6986, 14362), (7155, 14320), (7187, 14395), (7193, 14389), (7058, 14257), (7097, 14251), (7143, 14399)]
         : compromised: 0.4959, honest: 0.4968
Round 009: test acc mean=0.4939 ± 0.0063 | min=0.4835 max=0.5094
         : test loss mean=1.2228 ± 0.6396
         : individual accs = ['0.488758', '0.485774', '0.485280', '0.496448', '0.490870', '0.493773', '0.497491', '0.495117', '0.483490', '0.499617', '0.503555', '0.493218', '0.487878', '0.509400', '0.494623', '0.498020', '0.498923', '0.492109', '0.488808', '0.495243']
         : correct/total = [(6956, 14232), (6915, 14235), (6923, 14266), (7058, 14217), (6989, 14238), (7097, 14373), (7137, 14346), (7097, 14334), (6911, 14294), (7181, 14373), (7223, 14344), (7054, 14302), (7003, 14354), (7316, 14362), (7083, 14320), (7169, 14395), (7179, 14389), (7016, 14257), (6966, 14251), (7131, 14399)]
         : compromised: 0.4929, honest: 0.4950
Round 010: test acc mean=0.4937 ± 0.0056 | min=0.4812 max=0.5024
         : test loss mean=1.7933 ± 0.6303
         : individual accs = ['0.496065', '0.493923', '0.487102', '0.494830', '0.494030', '0.481250', '0.497491', '0.494768', '0.489226', '0.499896', '0.502370', '0.492099', '0.487042', '0.482523', '0.494972', '0.500382', '0.499618', '0.496668', '0.492527', '0.497048']
         : correct/total = [(7060, 14232), (7031, 14235), (6949, 14266), (7035, 14217), (7034, 14238), (6917, 14373), (7137, 14346), (7092, 14334), (6993, 14294), (7185, 14373), (7206, 14344), (7038, 14302), (6991, 14354), (6930, 14362), (7088, 14320), (7203, 14395), (7189, 14389), (7081, 14257), (7019, 14251), (7157, 14399)]
         : compromised: 0.4908, honest: 0.4965

=== FINAL RESULTS ===
Dataset: sent140, Nodes: 20, Graph: erdos, Aggregation: krum
Attack: backdoor, 50.0% compromised
Final accuracy - Compromised: 0.4908, Honest: 0.4965
Overall test accuracy: mean=0.4937 ± 0.0056

=== BACKDOOR ATTACK SUCCESS RATE (ASR) ===
Target label: 1
Trigger size: 3x3
Overall ASR: 0.8971 ± 0.1435
Honest nodes ASR: 0.8834 ± 0.1579
Compromised nodes ASR: 0.9109 ± 0.1259
Note: Higher ASR indicates more successful backdoor attack
