Device: cuda
Seed: 987654321
Loading 1 LEAF Sent140 train files...
LEAF Sent140 train: 254555 users, 908652 samples
Building vocabulary (max_size=10000)...
Vocabulary size: 10000
Loading 1 LEAF Sent140 test files...
LEAF Sent140 test: 254555 users, 286281 samples
Found 254555 train users, 254555 test users, 254555 common users
User sample counts range: 494 (max) to 1 (min)
Distributed ALL 254555 users across 20 clients
Users per client: 12727 (with 15 clients getting +1 user)
Train partition sizes: [44353, 44290, 44657, 44907, 44696, 45843, 45801, 45619, 45069, 45639, 45821, 45311, 45779, 46056, 45625, 45984, 46428, 44737, 45540, 46497]
Test partition sizes: [14232, 14235, 14266, 14217, 14238, 14373, 14346, 14334, 14294, 14373, 14344, 14302, 14354, 14362, 14320, 14395, 14389, 14257, 14251, 14399]
  Client 0: 44353 train samples, 2 unique classes
  Client 1: 44290 train samples, 2 unique classes
  Client 2: 44657 train samples, 2 unique classes
  Client 3: 44907 train samples, 2 unique classes
  Client 4: 44696 train samples, 2 unique classes
  Client 5: 45843 train samples, 2 unique classes
  Client 6: 45801 train samples, 2 unique classes
  Client 7: 45619 train samples, 2 unique classes
  Client 8: 45069 train samples, 2 unique classes
  Client 9: 45639 train samples, 2 unique classes
  Client 10: 45821 train samples, 2 unique classes
  Client 11: 45311 train samples, 2 unique classes
  Client 12: 45779 train samples, 2 unique classes
  Client 13: 46056 train samples, 2 unique classes
  Client 14: 45625 train samples, 2 unique classes
  Client 15: 45984 train samples, 2 unique classes
  Client 16: 46428 train samples, 2 unique classes
  Client 17: 44737 train samples, 2 unique classes
  Client 18: 45540 train samples, 2 unique classes
  Client 19: 46497 train samples, 2 unique classes
Will sample 4500 samples per client per epoch
Graph: fully, nodes: 20, edges: 190
Degree statistics: avg=19.00, min=19, max=19
Attack: Compromised 12/20 nodes: [1, 2, 3, 5, 8, 11, 12, 13, 14, 15, 17, 18]
Attack type: directed_deviation, lambda: 1.0
Model variant: baseline
Model parameters: 1,174,986
BALANCE algorithm:
Balance Config: BALANCEConfig(gamma=2, kappa=1, alpha=0.5, min_neighbors=1)
  - Model dimension: 1,174,986 parameters
  - Complexity: O(N×d) = O(20×1,174,986)
Initial test acc across nodes: mean=0.4965 ± 0.0152
Round 001: test acc mean=0.4943 ± 0.0090 | min=0.4729 max=0.5071
         : test loss mean=2.3324 ± 0.7008
         : individual accs = ['0.493957', '0.472919', '0.483597', '0.504677', '0.502599', '0.501983', '0.502649', '0.496233', '0.492374', '0.489042', '0.499163', '0.493148', '0.494078', '0.488790', '0.473254', '0.496283', '0.497324', '0.507119', '0.500526', '0.495729']
         : correct/total = [(7030, 14232), (6732, 14235), (6899, 14266), (7175, 14217), (7156, 14238), (7215, 14373), (7211, 14346), (7113, 14334), (7038, 14294), (7029, 14373), (7160, 14344), (7053, 14302), (7092, 14354), (7020, 14362), (6777, 14320), (7144, 14395), (7156, 14389), (7230, 14257), (7133, 14251), (7138, 14399)]
         : compromised: 0.4924, honest: 0.4971
Round 002: test acc mean=0.5084 ± 0.0128 | min=0.4739 max=0.5312
         : test loss mean=0.7238 ± 0.0168
         : individual accs = ['0.531197', '0.492589', '0.518786', '0.506858', '0.501545', '0.487163', '0.508295', '0.502791', '0.515181', '0.505879', '0.511224', '0.505594', '0.518671', '0.523325', '0.516760', '0.504967', '0.512822', '0.510556', '0.520735', '0.473922']
         : correct/total = [(7560, 14232), (7012, 14235), (7401, 14266), (7206, 14217), (7141, 14238), (7002, 14373), (7292, 14346), (7207, 14334), (7364, 14294), (7271, 14373), (7333, 14344), (7231, 14302), (7445, 14354), (7516, 14362), (7400, 14320), (7269, 14395), (7379, 14389), (7279, 14257), (7421, 14251), (6824, 14399)]
         : compromised: 0.5101, honest: 0.5060
Round 003: test acc mean=0.5077 ± 0.0132 | min=0.4866 max=0.5334
         : test loss mean=0.7037 ± 0.0075
         : individual accs = ['0.498595', '0.525044', '0.490887', '0.504466', '0.497682', '0.499965', '0.524327', '0.512697', '0.500700', '0.486607', '0.502649', '0.503216', '0.522781', '0.525414', '0.512919', '0.533380', '0.500035', '0.502420', '0.489650', '0.519689']
         : correct/total = [(7096, 14232), (7474, 14235), (7003, 14266), (7172, 14217), (7086, 14238), (7186, 14373), (7522, 14346), (7349, 14334), (7157, 14294), (6994, 14373), (7210, 14344), (7197, 14302), (7504, 14354), (7546, 14362), (7345, 14320), (7678, 14395), (7195, 14389), (7163, 14257), (6978, 14251), (7483, 14399)]
         : compromised: 0.5092, honest: 0.5053
Round 004: test acc mean=0.5223 ± 0.0152 | min=0.4882 max=0.5452
         : test loss mean=0.6943 ± 0.0051
         : individual accs = ['0.535624', '0.522304', '0.509673', '0.488218', '0.537224', '0.537327', '0.520424', '0.530138', '0.504547', '0.529048', '0.535206', '0.513075', '0.545214', '0.509400', '0.530307', '0.527614', '0.531309', '0.503121', '0.499053', '0.536496']
         : correct/total = [(7623, 14232), (7435, 14235), (7271, 14266), (6941, 14217), (7649, 14238), (7723, 14373), (7466, 14346), (7599, 14334), (7212, 14294), (7604, 14373), (7677, 14344), (7338, 14302), (7826, 14354), (7316, 14362), (7594, 14320), (7595, 14395), (7645, 14389), (7173, 14257), (7112, 14251), (7725, 14399)]
         : compromised: 0.5158, honest: 0.5319
Round 005: test acc mean=0.5675 ± 0.0091 | min=0.5433 max=0.5816
         : test loss mean=0.6806 ± 0.0031
         : individual accs = ['0.571810', '0.569582', '0.561405', '0.552578', '0.576064', '0.565157', '0.576328', '0.577578', '0.558976', '0.567870', '0.581637', '0.562998', '0.569528', '0.572831', '0.568715', '0.568600', '0.573772', '0.556639', '0.543260', '0.574207']
         : correct/total = [(8138, 14232), (8108, 14235), (8009, 14266), (7856, 14217), (8202, 14238), (8123, 14373), (8268, 14346), (8279, 14334), (7990, 14294), (8162, 14373), (8343, 14344), (8052, 14302), (8175, 14354), (8227, 14362), (8144, 14320), (8185, 14395), (8256, 14389), (7936, 14257), (7742, 14251), (8268, 14399)]
         : compromised: 0.5625, honest: 0.5749
Round 006: test acc mean=0.5847 ± 0.0041 | min=0.5749 max=0.5916
         : test loss mean=0.6723 ± 0.0021
         : individual accs = ['0.585793', '0.585739', '0.583275', '0.580291', '0.586950', '0.584568', '0.589572', '0.587415', '0.577655', '0.587282', '0.590839', '0.585303', '0.586457', '0.591561', '0.586383', '0.580688', '0.581138', '0.583503', '0.574907', '0.585527']
         : correct/total = [(8337, 14232), (8338, 14235), (8321, 14266), (8250, 14217), (8357, 14238), (8402, 14373), (8458, 14346), (8420, 14334), (8257, 14294), (8441, 14373), (8475, 14344), (8371, 14302), (8418, 14354), (8496, 14362), (8397, 14320), (8359, 14395), (8362, 14389), (8319, 14257), (8193, 14251), (8431, 14399)]
         : compromised: 0.5834, honest: 0.5868
Round 007: test acc mean=0.5951 ± 0.0038 | min=0.5880 max=0.6008
         : test loss mean=0.6664 ± 0.0017
         : individual accs = ['0.598862', '0.592273', '0.588041', '0.592811', '0.598258', '0.589230', '0.599610', '0.598019', '0.590947', '0.598553', '0.599763', '0.594183', '0.596419', '0.600822', '0.597416', '0.589788', '0.593439', '0.597321', '0.592239', '0.594902']
         : correct/total = [(8523, 14232), (8431, 14235), (8389, 14266), (8428, 14217), (8518, 14238), (8469, 14373), (8602, 14346), (8572, 14334), (8447, 14294), (8603, 14373), (8603, 14344), (8498, 14302), (8561, 14354), (8629, 14362), (8555, 14320), (8490, 14395), (8539, 14389), (8516, 14257), (8440, 14251), (8566, 14399)]
         : compromised: 0.5935, honest: 0.5977
Round 008: test acc mean=0.6010 ± 0.0032 | min=0.5955 max=0.6079
         : test loss mean=0.6625 ± 0.0020
         : individual accs = ['0.605888', '0.601264', '0.595472', '0.602870', '0.599663', '0.599944', '0.603234', '0.602623', '0.598993', '0.602171', '0.607920', '0.596420', '0.597882', '0.605139', '0.600768', '0.600069', '0.598374', '0.603563', '0.596730', '0.600945']
         : correct/total = [(8623, 14232), (8559, 14235), (8495, 14266), (8571, 14217), (8538, 14238), (8623, 14373), (8654, 14346), (8638, 14334), (8562, 14294), (8655, 14373), (8720, 14344), (8530, 14302), (8582, 14354), (8691, 14362), (8603, 14320), (8638, 14395), (8610, 14389), (8605, 14257), (8504, 14251), (8653, 14399)]
         : compromised: 0.5999, honest: 0.6026
Round 009: test acc mean=0.6065 ± 0.0037 | min=0.5990 max=0.6122
         : test loss mean=0.6587 ± 0.0019
         : individual accs = ['0.609331', '0.607376', '0.602271', '0.609482', '0.607599', '0.604954', '0.610832', '0.610367', '0.598993', '0.607041', '0.612242', '0.603412', '0.605197', '0.612241', '0.602584', '0.603473', '0.602613', '0.610086', '0.603045', '0.606153']
         : correct/total = [(8672, 14232), (8646, 14235), (8592, 14266), (8665, 14217), (8651, 14238), (8695, 14373), (8763, 14346), (8749, 14334), (8562, 14294), (8725, 14373), (8782, 14344), (8630, 14302), (8687, 14354), (8793, 14362), (8629, 14320), (8687, 14395), (8671, 14389), (8698, 14257), (8594, 14251), (8728, 14399)]
         : compromised: 0.6053, honest: 0.6083
Round 010: test acc mean=0.6116 ± 0.0029 | min=0.6058 max=0.6160
         : test loss mean=0.6548 ± 0.0016
         : individual accs = ['0.612212', '0.613769', '0.605776', '0.613843', '0.616028', '0.610102', '0.611529', '0.616018', '0.608997', '0.613651', '0.615519', '0.608726', '0.609447', '0.612867', '0.611872', '0.611949', '0.608590', '0.613663', '0.606764', '0.611570']
         : correct/total = [(8713, 14232), (8737, 14235), (8642, 14266), (8727, 14217), (8771, 14238), (8769, 14373), (8773, 14346), (8830, 14334), (8705, 14294), (8820, 14373), (8829, 14344), (8706, 14302), (8748, 14354), (8802, 14362), (8762, 14320), (8809, 14395), (8757, 14389), (8749, 14257), (8647, 14251), (8806, 14399)]
         : compromised: 0.6106, honest: 0.6131

=== FINAL RESULTS ===
Dataset: sent140, Nodes: 20, Graph: fully, Aggregation: balance
Attack: directed_deviation, 60.0% compromised
Final accuracy - Compromised: 0.6106, Honest: 0.6131
Overall test accuracy: mean=0.6116 ± 0.0029

=== BALANCE SUMMARY ===
Node 0: acceptance=0.432
Node 1: acceptance=0.479
Node 2: acceptance=0.479
Node 3: acceptance=0.479
Node 4: acceptance=0.432
Node 5: acceptance=0.479
Node 6: acceptance=0.432
Node 7: acceptance=0.432
Node 8: acceptance=0.479
Node 9: acceptance=0.432
Node 10: acceptance=0.432
Node 11: acceptance=0.479
Node 12: acceptance=0.479
Node 13: acceptance=0.479
Node 14: acceptance=0.479
Node 15: acceptance=0.479
Node 16: acceptance=0.432
Node 17: acceptance=0.479
Node 18: acceptance=0.479
Node 19: acceptance=0.432

=== PARALLEL EXECUTION TIME (realistic for distributed system) ===
  COMMUNICATION (max across nodes):
    - Full model transfer: 0.000s (0.0%)
  COMPUTATION (max across nodes):
    - Filtering: 0.082s (85.1%)
    - Aggregation: 0.014s (14.9%)
  TOTALS:
    - Total computation: 0.096s (100.0%)
    - Total communication: 0.000s (0.0%)
    - Total parallel time: 0.096s

=== PER-NODE AVERAGE TIME ===
  - Filtering: 0.079s
  - Aggregation: 0.009s
  - Model transfer: 0.000s
  - Total per node: 0.088s

=== TOTAL COMPUTATIONAL WORK (sum across all nodes) ===
  - Total filtering: 1.576s
  - Total aggregation: 0.179s
  - Total model transfer: 0.000s
  - Grand total: 1.755s
  - Mean acceptance rate: 0.460

BALANCE Algorithm Properties:
  - Model dimension: 1,174,986
  - No compression: Full parameter comparison
  - Theoretical complexity: O(deg(i)×d)
  - Approach: Full parameter filtering + averaging
