Device: cuda
Seed: 987654321
Loading 1 LEAF Sent140 train files...
LEAF Sent140 train: 254555 users, 908652 samples
Building vocabulary (max_size=10000)...
Vocabulary size: 10000
Loading 1 LEAF Sent140 test files...
LEAF Sent140 test: 254555 users, 286281 samples
Found 254555 train users, 254555 test users, 254555 common users
User sample counts range: 494 (max) to 1 (min)
Distributed ALL 254555 users across 20 clients
Users per client: 12727 (with 15 clients getting +1 user)
Train partition sizes: [44353, 44290, 44657, 44907, 44696, 45843, 45801, 45619, 45069, 45639, 45821, 45311, 45779, 46056, 45625, 45984, 46428, 44737, 45540, 46497]
Test partition sizes: [14232, 14235, 14266, 14217, 14238, 14373, 14346, 14334, 14294, 14373, 14344, 14302, 14354, 14362, 14320, 14395, 14389, 14257, 14251, 14399]
  Client 0: 44353 train samples, 2 unique classes
  Client 1: 44290 train samples, 2 unique classes
  Client 2: 44657 train samples, 2 unique classes
  Client 3: 44907 train samples, 2 unique classes
  Client 4: 44696 train samples, 2 unique classes
  Client 5: 45843 train samples, 2 unique classes
  Client 6: 45801 train samples, 2 unique classes
  Client 7: 45619 train samples, 2 unique classes
  Client 8: 45069 train samples, 2 unique classes
  Client 9: 45639 train samples, 2 unique classes
  Client 10: 45821 train samples, 2 unique classes
  Client 11: 45311 train samples, 2 unique classes
  Client 12: 45779 train samples, 2 unique classes
  Client 13: 46056 train samples, 2 unique classes
  Client 14: 45625 train samples, 2 unique classes
  Client 15: 45984 train samples, 2 unique classes
  Client 16: 46428 train samples, 2 unique classes
  Client 17: 44737 train samples, 2 unique classes
  Client 18: 45540 train samples, 2 unique classes
  Client 19: 46497 train samples, 2 unique classes
Will sample 4500 samples per client per epoch
Graph: erdos, nodes: 20, edges: 99
Degree statistics: avg=9.90, min=7, max=14
Attack: Compromised 6/20 nodes: [5, 12, 13, 14, 17, 18]
Attack type: backdoor, lambda: 1.0
Backdoor target label: 1, trigger size: 3
Model variant: baseline
Model parameters: 1,174,986
Initial test acc across nodes: mean=0.4953 ± 0.0174
Backdoor attack: Created poisoned datasets for 6 compromised nodes
Round 001: test acc mean=0.5063 ± 0.0318 | min=0.4855 max=0.6413
         : test loss mean=22.2974 ± 9.3919
         : individual accs = ['0.511804', '0.485494', '0.486331', '0.488218', '0.501896', '0.511515', '0.504879', '0.508441', '0.498181', '0.641272', '0.495329', '0.497203', '0.495054', '0.498259', '0.505517', '0.499618', '0.502120', '0.500807', '0.491895', '0.501771']
         : correct/total = [(7284, 14232), (6911, 14235), (6938, 14266), (6941, 14217), (7146, 14238), (7352, 14373), (7243, 14346), (7288, 14334), (7121, 14294), (9217, 14373), (7105, 14344), (7111, 14302), (7106, 14354), (7156, 14362), (7239, 14320), (7192, 14395), (7225, 14389), (7140, 14257), (7010, 14251), (7225, 14399)]
         : compromised: 0.5005, honest: 0.5088
Round 002: test acc mean=0.5420 ± 0.0688 | min=0.4922 max=0.6644
         : test loss mean=9.1025 ± 11.9099
         : individual accs = ['0.495925', '0.498068', '0.658068', '0.663361', '0.664419', '0.505531', '0.499512', '0.495186', '0.499440', '0.660683', '0.498745', '0.492239', '0.504319', '0.507311', '0.507542', '0.657798', '0.502884', '0.508382', '0.509789', '0.511702']
         : correct/total = [(7058, 14232), (7090, 14235), (9388, 14266), (9431, 14217), (9460, 14238), (7266, 14373), (7166, 14346), (7098, 14334), (7139, 14294), (9496, 14373), (7154, 14344), (7040, 14302), (7239, 14354), (7286, 14362), (7268, 14320), (9469, 14395), (7236, 14389), (7248, 14257), (7265, 14251), (7368, 14399)]
         : compromised: 0.5071, honest: 0.5570
Round 003: test acc mean=0.6089 ± 0.0704 | min=0.4945 max=0.6740
         : test loss mean=6.1892 ± 10.6789
         : individual accs = ['0.669547', '0.644819', '0.666269', '0.657593', '0.673971', '0.504279', '0.642270', '0.644621', '0.497901', '0.653169', '0.655814', '0.653895', '0.646440', '0.661886', '0.513547', '0.494477', '0.507471', '0.645507', '0.648586', '0.495243']
         : correct/total = [(9529, 14232), (9179, 14235), (9505, 14266), (9349, 14217), (9596, 14238), (7248, 14373), (9214, 14346), (9240, 14334), (7117, 14294), (9388, 14373), (9407, 14344), (9352, 14302), (9279, 14354), (9506, 14362), (7354, 14320), (7118, 14395), (7302, 14389), (9203, 14257), (9243, 14251), (7131, 14399)]
         : compromised: 0.6034, honest: 0.6112
Round 004: test acc mean=0.6654 ± 0.0379 | min=0.5052 max=0.6869
         : test loss mean=1.1017 ± 2.1852
         : individual accs = ['0.662662', '0.686828', '0.673840', '0.682844', '0.684155', '0.673415', '0.681375', '0.663667', '0.505247', '0.686426', '0.665923', '0.670536', '0.682597', '0.686882', '0.660475', '0.658145', '0.681840', '0.667041', '0.670409', '0.663796']
         : correct/total = [(9431, 14232), (9777, 14235), (9613, 14266), (9708, 14217), (9741, 14238), (9679, 14373), (9775, 14346), (9513, 14334), (7222, 14294), (9866, 14373), (9552, 14344), (9590, 14302), (9798, 14354), (9865, 14362), (9458, 14320), (9474, 14395), (9811, 14389), (9510, 14257), (9554, 14251), (9558, 14399)]
         : compromised: 0.6735, honest: 0.6619
Round 005: test acc mean=0.6759 ± 0.0421 | min=0.4998 max=0.7009
         : test loss mean=2.0574 ± 6.3974
         : individual accs = ['0.692173', '0.700948', '0.690803', '0.670043', '0.694971', '0.696445', '0.666179', '0.689340', '0.499790', '0.667710', '0.692415', '0.673123', '0.690330', '0.667108', '0.664944', '0.686766', '0.691987', '0.694817', '0.689776', '0.698382']
         : correct/total = [(9851, 14232), (9978, 14235), (9855, 14266), (9526, 14217), (9895, 14238), (10010, 14373), (9557, 14346), (9881, 14334), (7144, 14294), (9597, 14373), (9932, 14344), (9627, 14302), (9909, 14354), (9581, 14362), (9522, 14320), (9886, 14395), (9957, 14389), (9906, 14257), (9830, 14251), (10056, 14399)]
         : compromised: 0.6839, honest: 0.6725
Round 006: test acc mean=0.6944 ± 0.0448 | min=0.5000 max=0.7106
         : test loss mean=2.3679 ± 7.8503
         : individual accs = ['0.705101', '0.709449', '0.700967', '0.699304', '0.710563', '0.707368', '0.706748', '0.705525', '0.500000', '0.702219', '0.693461', '0.706754', '0.706563', '0.705334', '0.703003', '0.701910', '0.709778', '0.706179', '0.698898', '0.707896']
         : correct/total = [(10035, 14232), (10099, 14235), (10000, 14266), (9942, 14217), (10117, 14238), (10167, 14373), (10139, 14346), (10113, 14334), (7147, 14294), (10093, 14373), (9947, 14344), (10108, 14302), (10142, 14354), (10130, 14362), (10067, 14320), (10104, 14395), (10213, 14389), (10068, 14257), (9960, 14251), (10193, 14399)]
         : compromised: 0.7046, honest: 0.6900
Round 007: test acc mean=0.6780 ± 0.0439 | min=0.5006 max=0.7182
         : test loss mean=3.1667 ± 11.2602
         : individual accs = ['0.708825', '0.672006', '0.675522', '0.704438', '0.673620', '0.718222', '0.680259', '0.683550', '0.500560', '0.669171', '0.707195', '0.673402', '0.710603', '0.705473', '0.671159', '0.677249', '0.698728', '0.663043', '0.675040', '0.692687']
         : correct/total = [(10088, 14232), (9566, 14235), (9637, 14266), (10015, 14217), (9591, 14238), (10323, 14373), (9759, 14346), (9798, 14334), (7155, 14294), (9618, 14373), (10144, 14344), (9631, 14302), (10200, 14354), (10132, 14362), (9611, 14320), (9749, 14395), (10054, 14389), (9453, 14257), (9620, 14251), (9974, 14399)]
         : compromised: 0.6906, honest: 0.6727
Round 008: test acc mean=0.6913 ± 0.0436 | min=0.5056 max=0.7194
         : test loss mean=1.3622 ± 3.4567
         : individual accs = ['0.712338', '0.703407', '0.710781', '0.687909', '0.692864', '0.700202', '0.691412', '0.696386', '0.505597', '0.691714', '0.702175', '0.692560', '0.696949', '0.699276', '0.695670', '0.695728', '0.715686', '0.719436', '0.696092', '0.719286']
         : correct/total = [(10138, 14232), (10013, 14235), (10140, 14266), (9780, 14217), (9865, 14238), (10064, 14373), (9919, 14346), (9982, 14334), (7227, 14294), (9942, 14373), (10072, 14344), (9905, 14302), (10004, 14354), (10043, 14362), (9962, 14320), (10015, 14395), (10298, 14389), (10257, 14257), (9920, 14251), (10357, 14399)]
         : compromised: 0.7013, honest: 0.6870
Round 009: test acc mean=0.6988 ± 0.0469 | min=0.4994 max=0.7296
         : test loss mean=1.8338 ± 5.5542
         : individual accs = ['0.699269', '0.711275', '0.693187', '0.723711', '0.701573', '0.715856', '0.687718', '0.721850', '0.499440', '0.717526', '0.710959', '0.729618', '0.704403', '0.722044', '0.705656', '0.701702', '0.701995', '0.710668', '0.700933', '0.717480']
         : correct/total = [(9952, 14232), (10125, 14235), (9889, 14266), (10289, 14217), (9989, 14238), (10289, 14373), (9866, 14346), (10347, 14334), (7139, 14294), (10313, 14373), (10198, 14344), (10435, 14302), (10111, 14354), (10370, 14362), (10105, 14320), (10101, 14395), (10101, 14389), (10132, 14257), (9989, 14251), (10331, 14399)]
         : compromised: 0.7099, honest: 0.6941
Round 010: test acc mean=0.7083 ± 0.0486 | min=0.4975 max=0.7286
         : test loss mean=2.4796 ± 8.4299
         : individual accs = ['0.723791', '0.728627', '0.712183', '0.717240', '0.721941', '0.718848', '0.714345', '0.716967', '0.497481', '0.712238', '0.716258', '0.718221', '0.727045', '0.717449', '0.720670', '0.717402', '0.724581', '0.726731', '0.713213', '0.720536']
         : correct/total = [(10301, 14232), (10372, 14235), (10160, 14266), (10197, 14217), (10279, 14238), (10332, 14373), (10248, 14346), (10277, 14334), (7111, 14294), (10237, 14373), (10274, 14344), (10272, 14302), (10436, 14354), (10304, 14362), (10320, 14320), (10327, 14395), (10426, 14389), (10361, 14257), (10164, 14251), (10375, 14399)]
         : compromised: 0.7207, honest: 0.7030

=== FINAL RESULTS ===
Dataset: sent140, Nodes: 20, Graph: erdos, Aggregation: krum
Attack: backdoor, 30.0% compromised
Final accuracy - Compromised: 0.7207, Honest: 0.7030
Overall test accuracy: mean=0.7083 ± 0.0486

=== BACKDOOR ATTACK SUCCESS RATE (ASR) ===
Target label: 1
Trigger size: 3x3
Overall ASR: 0.5043 ± 0.1291
Honest nodes ASR: 0.5309 ± 0.1435
Compromised nodes ASR: 0.4421 ± 0.0442
Note: Higher ASR indicates more successful backdoor attack
