Device: cuda
Seed: 987654321
Loading 1 LEAF Sent140 train files...
LEAF Sent140 train: 254555 users, 908652 samples
Building vocabulary (max_size=10000)...
Vocabulary size: 10000
Loading 1 LEAF Sent140 test files...
LEAF Sent140 test: 254555 users, 286281 samples
Found 254555 train users, 254555 test users, 254555 common users
User sample counts range: 494 (max) to 1 (min)
Distributed ALL 254555 users across 20 clients
Users per client: 12727 (with 15 clients getting +1 user)
Train partition sizes: [44353, 44290, 44657, 44907, 44696, 45843, 45801, 45619, 45069, 45639, 45821, 45311, 45779, 46056, 45625, 45984, 46428, 44737, 45540, 46497]
Test partition sizes: [14232, 14235, 14266, 14217, 14238, 14373, 14346, 14334, 14294, 14373, 14344, 14302, 14354, 14362, 14320, 14395, 14389, 14257, 14251, 14399]
  Client 0: 44353 train samples, 2 unique classes
  Client 1: 44290 train samples, 2 unique classes
  Client 2: 44657 train samples, 2 unique classes
  Client 3: 44907 train samples, 2 unique classes
  Client 4: 44696 train samples, 2 unique classes
  Client 5: 45843 train samples, 2 unique classes
  Client 6: 45801 train samples, 2 unique classes
  Client 7: 45619 train samples, 2 unique classes
  Client 8: 45069 train samples, 2 unique classes
  Client 9: 45639 train samples, 2 unique classes
  Client 10: 45821 train samples, 2 unique classes
  Client 11: 45311 train samples, 2 unique classes
  Client 12: 45779 train samples, 2 unique classes
  Client 13: 46056 train samples, 2 unique classes
  Client 14: 45625 train samples, 2 unique classes
  Client 15: 45984 train samples, 2 unique classes
  Client 16: 46428 train samples, 2 unique classes
  Client 17: 44737 train samples, 2 unique classes
  Client 18: 45540 train samples, 2 unique classes
  Client 19: 46497 train samples, 2 unique classes
Will sample 4500 samples per client per epoch
Graph: erdos, nodes: 20, edges: 126
Degree statistics: avg=12.60, min=8, max=16
Attack: Compromised 14/20 nodes: [1, 2, 3, 5, 6, 8, 11, 12, 13, 14, 15, 17, 18, 19]
Attack type: directed_deviation, lambda: 1.0
Model variant: baseline
Model parameters: 1,174,986
Initial test acc across nodes: mean=0.4965 ± 0.0152
Round 001: test acc mean=0.5001 ± 0.0072 | min=0.4855 max=0.5125
         : test loss mean=11.2084 ± 4.2821
         : individual accs = ['0.510469', '0.510924', '0.497056', '0.503622', '0.495435', '0.493773', '0.503694', '0.497628', '0.485518', '0.506227', '0.495468', '0.492588', '0.496517', '0.512463', '0.495251', '0.493366', '0.499201', '0.497300', '0.506210', '0.510174']
         : correct/total = [(7265, 14232), (7273, 14235), (7091, 14266), (7160, 14217), (7054, 14238), (7097, 14373), (7226, 14346), (7133, 14334), (6940, 14294), (7276, 14373), (7107, 14344), (7045, 14302), (7127, 14354), (7360, 14362), (7092, 14320), (7102, 14395), (7183, 14389), (7090, 14257), (7214, 14251), (7346, 14399)]
         : compromised: 0.4999, honest: 0.5007
Round 002: test acc mean=0.5044 ± 0.0048 | min=0.4947 max=0.5128
         : test loss mean=8.9664 ± 1.7861
         : individual accs = ['0.501546', '0.510643', '0.511846', '0.499332', '0.498244', '0.506436', '0.501673', '0.508441', '0.506017', '0.494747', '0.501115', '0.512795', '0.500906', '0.506615', '0.505866', '0.508857', '0.503023', '0.508452', '0.504105', '0.498298']
         : correct/total = [(7138, 14232), (7269, 14235), (7302, 14266), (7099, 14217), (7094, 14238), (7279, 14373), (7197, 14346), (7288, 14334), (7233, 14294), (7111, 14373), (7188, 14344), (7334, 14302), (7190, 14354), (7276, 14362), (7244, 14320), (7325, 14395), (7238, 14389), (7249, 14257), (7184, 14251), (7175, 14399)]
         : compromised: 0.5058, honest: 0.5012
Round 003: test acc mean=0.4943 ± 0.0061 | min=0.4858 max=0.5109
         : test loss mean=2.2694 ± 0.4065
         : individual accs = ['0.487634', '0.488655', '0.485840', '0.492157', '0.494100', '0.492938', '0.493169', '0.491768', '0.489646', '0.494538', '0.496863', '0.487834', '0.499721', '0.510862', '0.496439', '0.499826', '0.494822', '0.505015', '0.486703', '0.496493']
         : correct/total = [(6940, 14232), (6956, 14235), (6931, 14266), (6997, 14217), (7035, 14238), (7085, 14373), (7075, 14346), (7049, 14334), (6999, 14294), (7108, 14373), (7127, 14344), (6977, 14302), (7173, 14354), (7337, 14362), (7109, 14320), (7195, 14395), (7120, 14389), (7200, 14257), (6936, 14251), (7149, 14399)]
         : compromised: 0.4947, honest: 0.4933
Round 004: test acc mean=0.5049 ± 0.0044 | min=0.4982 max=0.5150
         : test loss mean=4.4399 ± 0.8125
         : individual accs = ['0.507167', '0.505304', '0.508201', '0.498699', '0.499649', '0.501426', '0.507737', '0.503070', '0.508325', '0.501078', '0.498187', '0.508530', '0.506200', '0.509678', '0.498673', '0.500938', '0.509000', '0.506558', '0.514981', '0.503785']
         : correct/total = [(7218, 14232), (7193, 14235), (7250, 14266), (7090, 14217), (7114, 14238), (7207, 14373), (7284, 14346), (7211, 14334), (7266, 14294), (7202, 14373), (7146, 14344), (7273, 14302), (7266, 14354), (7320, 14362), (7141, 14320), (7211, 14395), (7324, 14389), (7222, 14257), (7339, 14251), (7254, 14399)]
         : compromised: 0.5056, honest: 0.5030
Round 005: test acc mean=0.5105 ± 0.0130 | min=0.4778 max=0.5308
         : test loss mean=1.2415 ± 0.3639
         : individual accs = ['0.523047', '0.515420', '0.477779', '0.496307', '0.521702', '0.506088', '0.497003', '0.530836', '0.499860', '0.520142', '0.518126', '0.524892', '0.514491', '0.513299', '0.502723', '0.505245', '0.490722', '0.521077', '0.510982', '0.520175']
         : correct/total = [(7444, 14232), (7337, 14235), (6816, 14266), (7056, 14217), (7428, 14238), (7274, 14373), (7130, 14346), (7609, 14334), (7145, 14294), (7476, 14373), (7432, 14344), (7507, 14302), (7385, 14354), (7372, 14362), (7199, 14320), (7273, 14395), (7061, 14389), (7429, 14257), (7282, 14251), (7490, 14399)]
         : compromised: 0.5075, honest: 0.5174
Round 006: test acc mean=0.5037 ± 0.0036 | min=0.4964 max=0.5118
         : test loss mean=2.6431 ± 0.5542
         : individual accs = ['0.502951', '0.511837', '0.497477', '0.498699', '0.507023', '0.507340', '0.502928', '0.503418', '0.507346', '0.506992', '0.502858', '0.505664', '0.499861', '0.496449', '0.502793', '0.502327', '0.503301', '0.503191', '0.504947', '0.506355']
         : correct/total = [(7158, 14232), (7286, 14235), (7097, 14266), (7090, 14217), (7219, 14238), (7292, 14373), (7215, 14346), (7216, 14334), (7252, 14294), (7287, 14373), (7213, 14344), (7232, 14302), (7175, 14354), (7130, 14362), (7200, 14320), (7231, 14395), (7242, 14389), (7174, 14257), (7196, 14251), (7291, 14399)]
         : compromised: 0.5034, honest: 0.5044
Round 007: test acc mean=0.5091 ± 0.0146 | min=0.4803 max=0.5356
         : test loss mean=0.9860 ± 0.1915
         : individual accs = ['0.535624', '0.516895', '0.504066', '0.517127', '0.507023', '0.520768', '0.513174', '0.533836', '0.494543', '0.517568', '0.514292', '0.531324', '0.503901', '0.491157', '0.480307', '0.499896', '0.492321', '0.513011', '0.494702', '0.500938']
         : correct/total = [(7623, 14232), (7358, 14235), (7191, 14266), (7352, 14217), (7219, 14238), (7485, 14373), (7362, 14346), (7652, 14334), (7069, 14294), (7439, 14373), (7377, 14344), (7599, 14302), (7233, 14354), (7054, 14362), (6878, 14320), (7196, 14395), (7084, 14389), (7314, 14257), (7050, 14251), (7213, 14399)]
         : compromised: 0.5058, honest: 0.5168
Round 008: test acc mean=0.5045 ± 0.0049 | min=0.4960 max=0.5122
         : test loss mean=1.8823 ± 0.4992
         : individual accs = ['0.506464', '0.503267', '0.505327', '0.511360', '0.499579', '0.509219', '0.500418', '0.496023', '0.512243', '0.500731', '0.506832', '0.510138', '0.506688', '0.496310', '0.505028', '0.499896', '0.504622', '0.498422', '0.511192', '0.505660']
         : correct/total = [(7208, 14232), (7164, 14235), (7209, 14266), (7270, 14217), (7113, 14238), (7319, 14373), (7179, 14346), (7110, 14334), (7322, 14294), (7197, 14373), (7270, 14344), (7296, 14302), (7273, 14354), (7128, 14362), (7232, 14320), (7196, 14395), (7261, 14389), (7106, 14257), (7285, 14251), (7281, 14399)]
         : compromised: 0.5054, honest: 0.5024
Round 009: test acc mean=0.5126 ± 0.0110 | min=0.4946 max=0.5360
         : test loss mean=0.9377 ± 0.2009
         : individual accs = ['0.522836', '0.536003', '0.518085', '0.521840', '0.503441', '0.495373', '0.511432', '0.504116', '0.504337', '0.514019', '0.523494', '0.511257', '0.529887', '0.494639', '0.502793', '0.502952', '0.510390', '0.525005', '0.507754', '0.513161']
         : correct/total = [(7441, 14232), (7630, 14235), (7391, 14266), (7419, 14217), (7168, 14238), (7120, 14373), (7337, 14346), (7226, 14334), (7209, 14294), (7388, 14373), (7509, 14344), (7312, 14302), (7606, 14354), (7104, 14362), (7200, 14320), (7240, 14395), (7344, 14389), (7485, 14257), (7236, 14251), (7389, 14399)]
         : compromised: 0.5125, honest: 0.5130
Round 010: test acc mean=0.4990 ± 0.0047 | min=0.4888 max=0.5074
         : test loss mean=1.6951 ± 0.4798
         : individual accs = ['0.497260', '0.500386', '0.493201', '0.496940', '0.488833', '0.501148', '0.498676', '0.499860', '0.498111', '0.495095', '0.507390', '0.505244', '0.505713', '0.494499', '0.503282', '0.501980', '0.499548', '0.491829', '0.503965', '0.497673']
         : correct/total = [(7077, 14232), (7123, 14235), (7036, 14266), (7065, 14217), (6960, 14238), (7203, 14373), (7154, 14346), (7165, 14334), (7120, 14294), (7116, 14373), (7278, 14344), (7226, 14302), (7259, 14354), (7102, 14362), (7207, 14320), (7226, 14395), (7188, 14389), (7012, 14257), (7182, 14251), (7166, 14399)]
         : compromised: 0.4995, honest: 0.4980

=== FINAL RESULTS ===
Dataset: sent140, Nodes: 20, Graph: erdos, Aggregation: krum
Attack: directed_deviation, 70.0% compromised
Final accuracy - Compromised: 0.4995, Honest: 0.4980
Overall test accuracy: mean=0.4990 ± 0.0047
