Device: cuda
Seed: 987654321
Loading 1 LEAF Sent140 train files...
LEAF Sent140 train: 254555 users, 908652 samples
Building vocabulary (max_size=10000)...
Vocabulary size: 10000
Loading 1 LEAF Sent140 test files...
LEAF Sent140 test: 254555 users, 286281 samples
Found 254555 train users, 254555 test users, 254555 common users
User sample counts range: 494 (max) to 1 (min)
Distributed ALL 254555 users across 20 clients
Users per client: 12727 (with 15 clients getting +1 user)
Train partition sizes: [44353, 44290, 44657, 44907, 44696, 45843, 45801, 45619, 45069, 45639, 45821, 45311, 45779, 46056, 45625, 45984, 46428, 44737, 45540, 46497]
Test partition sizes: [14232, 14235, 14266, 14217, 14238, 14373, 14346, 14334, 14294, 14373, 14344, 14302, 14354, 14362, 14320, 14395, 14389, 14257, 14251, 14399]
  Client 0: 44353 train samples, 2 unique classes
  Client 1: 44290 train samples, 2 unique classes
  Client 2: 44657 train samples, 2 unique classes
  Client 3: 44907 train samples, 2 unique classes
  Client 4: 44696 train samples, 2 unique classes
  Client 5: 45843 train samples, 2 unique classes
  Client 6: 45801 train samples, 2 unique classes
  Client 7: 45619 train samples, 2 unique classes
  Client 8: 45069 train samples, 2 unique classes
  Client 9: 45639 train samples, 2 unique classes
  Client 10: 45821 train samples, 2 unique classes
  Client 11: 45311 train samples, 2 unique classes
  Client 12: 45779 train samples, 2 unique classes
  Client 13: 46056 train samples, 2 unique classes
  Client 14: 45625 train samples, 2 unique classes
  Client 15: 45984 train samples, 2 unique classes
  Client 16: 46428 train samples, 2 unique classes
  Client 17: 44737 train samples, 2 unique classes
  Client 18: 45540 train samples, 2 unique classes
  Client 19: 46497 train samples, 2 unique classes
Will sample 4500 samples per client per epoch
Graph: fully, nodes: 20, edges: 190
Degree statistics: avg=19.00, min=19, max=19
Attack: Compromised 8/20 nodes: [1, 5, 11, 12, 13, 14, 17, 18]
Attack type: directed_deviation, lambda: 1.0
Model variant: baseline
Model parameters: 1,174,986
Initial test acc across nodes: mean=0.4953 ± 0.0174
Round 001: test acc mean=0.4998 ± 0.0073 | min=0.4858 max=0.5159
         : test loss mean=3.9637 ± 1.1056
         : individual accs = ['0.511383', '0.485774', '0.490046', '0.486390', '0.505970', '0.495721', '0.497351', '0.502930', '0.500140', '0.506923', '0.499303', '0.503636', '0.497910', '0.498747', '0.494972', '0.503230', '0.515950', '0.495827', '0.501158', '0.501840']
         : correct/total = [(7278, 14232), (6915, 14235), (6991, 14266), (6915, 14217), (7204, 14238), (7125, 14373), (7135, 14346), (7209, 14334), (7149, 14294), (7286, 14373), (7162, 14344), (7203, 14302), (7147, 14354), (7163, 14362), (7088, 14320), (7244, 14395), (7424, 14389), (7069, 14257), (7142, 14251), (7226, 14399)]
         : compromised: 0.4967, honest: 0.5018
Round 002: test acc mean=0.4947 ± 0.0054 | min=0.4849 max=0.5077
         : test loss mean=4.0739 ± 0.0478
         : individual accs = ['0.489812', '0.485072', '0.488855', '0.484912', '0.492696', '0.495443', '0.499233', '0.491698', '0.496082', '0.495234', '0.500697', '0.492449', '0.501324', '0.507659', '0.491969', '0.497673', '0.493363', '0.497791', '0.499754', '0.493229']
         : correct/total = [(6971, 14232), (6905, 14235), (6974, 14266), (6894, 14217), (7015, 14238), (7121, 14373), (7162, 14346), (7048, 14334), (7091, 14294), (7118, 14373), (7182, 14344), (7043, 14302), (7196, 14354), (7291, 14362), (7045, 14320), (7164, 14395), (7099, 14389), (7097, 14257), (7122, 14251), (7102, 14399)]
         : compromised: 0.4964, honest: 0.4936
Round 003: test acc mean=0.4952 ± 0.0055 | min=0.4837 max=0.5064
         : test loss mean=0.7605 ± 0.0052
         : individual accs = ['0.493325', '0.483667', '0.487102', '0.484420', '0.494803', '0.496973', '0.500488', '0.492535', '0.498321', '0.495373', '0.498466', '0.494476', '0.503483', '0.506406', '0.493017', '0.497603', '0.492807', '0.495967', '0.496456', '0.499062']
         : correct/total = [(7021, 14232), (6885, 14235), (6949, 14266), (6887, 14217), (7045, 14238), (7143, 14373), (7180, 14346), (7060, 14334), (7123, 14294), (7120, 14373), (7150, 14344), (7072, 14302), (7227, 14354), (7273, 14362), (7060, 14320), (7163, 14395), (7091, 14389), (7071, 14257), (7075, 14251), (7186, 14399)]
         : compromised: 0.4963, honest: 0.4945
Round 004: test acc mean=0.5004 ± 0.0031 | min=0.4951 max=0.5053
         : test loss mean=0.8346 ± 0.0043
         : individual accs = ['0.505270', '0.504601', '0.502944', '0.499191', '0.495716', '0.498435', '0.503137', '0.500907', '0.499930', '0.499896', '0.503416', '0.502727', '0.498398', '0.495753', '0.504190', '0.496214', '0.498923', '0.501859', '0.501719', '0.495104']
         : correct/total = [(7191, 14232), (7183, 14235), (7175, 14266), (7097, 14217), (7058, 14238), (7164, 14373), (7218, 14346), (7180, 14334), (7146, 14294), (7185, 14373), (7221, 14344), (7190, 14302), (7154, 14354), (7120, 14362), (7220, 14320), (7143, 14395), (7179, 14389), (7155, 14257), (7150, 14251), (7129, 14399)]
         : compromised: 0.5010, honest: 0.5001
Round 005: test acc mean=0.5698 ± 0.0048 | min=0.5583 max=0.5757
         : test loss mean=0.6821 ± 0.0007
         : individual accs = ['0.570053', '0.575132', '0.558250', '0.575719', '0.573676', '0.572045', '0.569566', '0.571229', '0.568001', '0.574062', '0.575502', '0.564327', '0.559844', '0.564336', '0.567039', '0.571865', '0.572451', '0.570948', '0.569293', '0.572818']
         : correct/total = [(8113, 14232), (8187, 14235), (7964, 14266), (8185, 14217), (8168, 14238), (8222, 14373), (8171, 14346), (8188, 14334), (8119, 14294), (8251, 14373), (8255, 14344), (8071, 14302), (8036, 14354), (8105, 14362), (8120, 14320), (8232, 14395), (8237, 14389), (8140, 14257), (8113, 14251), (8248, 14399)]
         : compromised: 0.5679, honest: 0.5711
Round 006: test acc mean=0.5170 ± 0.0042 | min=0.5092 max=0.5278
         : test loss mean=0.6982 ± 0.0012
         : individual accs = ['0.517285', '0.521180', '0.520819', '0.513892', '0.517207', '0.515689', '0.520633', '0.511651', '0.518050', '0.511236', '0.519869', '0.516501', '0.512401', '0.509191', '0.517598', '0.519972', '0.527834', '0.514344', '0.517788', '0.516216']
         : correct/total = [(7362, 14232), (7419, 14235), (7430, 14266), (7306, 14217), (7364, 14238), (7412, 14373), (7469, 14346), (7334, 14334), (7405, 14294), (7348, 14373), (7457, 14344), (7387, 14302), (7355, 14354), (7313, 14362), (7412, 14320), (7485, 14395), (7595, 14389), (7333, 14257), (7379, 14251), (7433, 14399)]
         : compromised: 0.5156, honest: 0.5179
Round 007: test acc mean=0.5686 ± 0.0052 | min=0.5583 max=0.5786
         : test loss mean=0.6723 ± 0.0012
         : individual accs = ['0.575885', '0.575061', '0.567083', '0.574875', '0.570937', '0.566479', '0.560365', '0.570253', '0.570589', '0.558339', '0.570482', '0.567963', '0.561446', '0.562874', '0.564036', '0.568044', '0.578636', '0.569545', '0.571328', '0.568095']
         : correct/total = [(8196, 14232), (8186, 14235), (8090, 14266), (8173, 14217), (8129, 14238), (8142, 14373), (8039, 14346), (8174, 14334), (8156, 14294), (8025, 14373), (8183, 14344), (8123, 14302), (8059, 14354), (8084, 14362), (8077, 14320), (8177, 14395), (8326, 14389), (8120, 14257), (8142, 14251), (8180, 14399)]
         : compromised: 0.5673, honest: 0.5695
Round 008: test acc mean=0.5367 ± 0.0039 | min=0.5275 max=0.5452
         : test loss mean=0.6899 ± 0.0013
         : individual accs = ['0.534359', '0.532912', '0.534978', '0.527537', '0.533080', '0.538023', '0.535759', '0.540045', '0.534420', '0.541571', '0.536740', '0.536289', '0.537342', '0.534675', '0.536453', '0.533935', '0.543888', '0.538192', '0.539260', '0.545246']
         : correct/total = [(7605, 14232), (7586, 14235), (7632, 14266), (7500, 14217), (7590, 14238), (7733, 14373), (7686, 14346), (7741, 14334), (7639, 14294), (7784, 14373), (7699, 14344), (7670, 14302), (7713, 14354), (7679, 14362), (7682, 14320), (7686, 14395), (7826, 14389), (7673, 14257), (7685, 14251), (7851, 14399)]
         : compromised: 0.5366, honest: 0.5368
Round 009: test acc mean=0.5949 ± 0.0062 | min=0.5833 max=0.6110
         : test loss mean=0.6618 ± 0.0020
         : individual accs = ['0.596051', '0.611029', '0.591056', '0.602377', '0.592920', '0.591317', '0.590130', '0.593275', '0.601301', '0.591247', '0.597602', '0.595931', '0.593493', '0.583345', '0.588757', '0.589927', '0.605949', '0.591148', '0.595046', '0.596500']
         : correct/total = [(8483, 14232), (8698, 14235), (8432, 14266), (8564, 14217), (8442, 14238), (8499, 14373), (8466, 14346), (8504, 14334), (8595, 14294), (8498, 14373), (8572, 14344), (8523, 14302), (8519, 14354), (8378, 14362), (8431, 14320), (8492, 14395), (8719, 14389), (8428, 14257), (8480, 14251), (8589, 14399)]
         : compromised: 0.5938, honest: 0.5957
Round 010: test acc mean=0.5424 ± 0.0036 | min=0.5347 max=0.5492
         : test loss mean=0.6886 ± 0.0012
         : individual accs = ['0.544547', '0.547313', '0.542759', '0.541605', '0.540736', '0.545537', '0.540081', '0.537882', '0.542675', '0.538927', '0.545036', '0.549154', '0.539083', '0.534744', '0.540154', '0.545745', '0.542776', '0.546609', '0.537927', '0.545385']
         : correct/total = [(7750, 14232), (7791, 14235), (7743, 14266), (7700, 14217), (7699, 14238), (7841, 14373), (7748, 14346), (7710, 14334), (7757, 14294), (7746, 14373), (7818, 14344), (7854, 14302), (7738, 14354), (7680, 14362), (7735, 14320), (7856, 14395), (7810, 14389), (7793, 14257), (7666, 14251), (7853, 14399)]
         : compromised: 0.5426, honest: 0.5423

=== FINAL RESULTS ===
Dataset: sent140, Nodes: 20, Graph: fully, Aggregation: d-fedavg
Attack: directed_deviation, 40.0% compromised
Final accuracy - Compromised: 0.5426, Honest: 0.5423
Overall test accuracy: mean=0.5424 ± 0.0036
