Device: cuda
Seed: 987654321
Loading 1 LEAF Sent140 train files...
LEAF Sent140 train: 254555 users, 908652 samples
Building vocabulary (max_size=10000)...
Vocabulary size: 10000
Loading 1 LEAF Sent140 test files...
LEAF Sent140 test: 254555 users, 286281 samples
Found 254555 train users, 254555 test users, 254555 common users
User sample counts range: 494 (max) to 1 (min)
Distributed ALL 254555 users across 20 clients
Users per client: 12727 (with 15 clients getting +1 user)
Train partition sizes: [44353, 44290, 44657, 44907, 44696, 45843, 45801, 45619, 45069, 45639, 45821, 45311, 45779, 46056, 45625, 45984, 46428, 44737, 45540, 46497]
Test partition sizes: [14232, 14235, 14266, 14217, 14238, 14373, 14346, 14334, 14294, 14373, 14344, 14302, 14354, 14362, 14320, 14395, 14389, 14257, 14251, 14399]
  Client 0: 44353 train samples, 2 unique classes
  Client 1: 44290 train samples, 2 unique classes
  Client 2: 44657 train samples, 2 unique classes
  Client 3: 44907 train samples, 2 unique classes
  Client 4: 44696 train samples, 2 unique classes
  Client 5: 45843 train samples, 2 unique classes
  Client 6: 45801 train samples, 2 unique classes
  Client 7: 45619 train samples, 2 unique classes
  Client 8: 45069 train samples, 2 unique classes
  Client 9: 45639 train samples, 2 unique classes
  Client 10: 45821 train samples, 2 unique classes
  Client 11: 45311 train samples, 2 unique classes
  Client 12: 45779 train samples, 2 unique classes
  Client 13: 46056 train samples, 2 unique classes
  Client 14: 45625 train samples, 2 unique classes
  Client 15: 45984 train samples, 2 unique classes
  Client 16: 46428 train samples, 2 unique classes
  Client 17: 44737 train samples, 2 unique classes
  Client 18: 45540 train samples, 2 unique classes
  Client 19: 46497 train samples, 2 unique classes
Will sample 4500 samples per client per epoch
Graph: ring, nodes: 20, edges: 20
Degree statistics: avg=2.00, min=2, max=2
Attack: Compromised 14/20 nodes: [1, 2, 3, 5, 6, 8, 11, 12, 13, 14, 15, 17, 18, 19]
Attack type: backdoor, lambda: 1.0
Backdoor target label: 1, trigger size: 3
Model variant: baseline
Model parameters: 1,174,986
Initial test acc across nodes: mean=0.4953 ± 0.0174
Backdoor attack: Created poisoned datasets for 14 compromised nodes
Round 001: test acc mean=0.5029 ± 0.0092 | min=0.4856 max=0.5232
         : test loss mean=24.7259 ± 29.2724
         : individual accs = ['0.508994', '0.508254', '0.486892', '0.505662', '0.500913', '0.500522', '0.501464', '0.492884', '0.523157', '0.512697', '0.485639', '0.506363', '0.503623', '0.507589', '0.492598', '0.501771', '0.518591', '0.499755', '0.495614', '0.504271']
         : correct/total = [(7244, 14232), (7235, 14235), (6946, 14266), (7189, 14217), (7132, 14238), (7194, 14373), (7194, 14346), (7065, 14334), (7478, 14294), (7369, 14373), (6966, 14344), (7242, 14302), (7229, 14354), (7290, 14362), (7054, 14320), (7223, 14395), (7462, 14389), (7125, 14257), (7063, 14251), (7261, 14399)]
         : compromised: 0.5027, honest: 0.5033
Round 002: test acc mean=0.4964 ± 0.0065 | min=0.4830 max=0.5120
         : test loss mean=64.9013 ± 20.1514
         : individual accs = ['0.492622', '0.483035', '0.511987', '0.484912', '0.494522', '0.495860', '0.499791', '0.492745', '0.498181', '0.495234', '0.498397', '0.493847', '0.496865', '0.493316', '0.507472', '0.497742', '0.492529', '0.495336', '0.504737', '0.498090']
         : correct/total = [(7011, 14232), (6876, 14235), (7304, 14266), (6894, 14217), (7041, 14238), (7127, 14373), (7170, 14346), (7063, 14334), (7121, 14294), (7118, 14373), (7149, 14344), (7063, 14302), (7132, 14354), (7085, 14362), (7267, 14320), (7165, 14395), (7087, 14389), (7062, 14257), (7193, 14251), (7172, 14399)]
         : compromised: 0.4972, honest: 0.4943
Round 003: test acc mean=0.4965 ± 0.0066 | min=0.4829 max=0.5128
         : test loss mean=119.0860 ± 122.7495
         : individual accs = ['0.493184', '0.482894', '0.512828', '0.484912', '0.494522', '0.495860', '0.499791', '0.492745', '0.498181', '0.495652', '0.498745', '0.494756', '0.497422', '0.493107', '0.507542', '0.497951', '0.492390', '0.495406', '0.504456', '0.498090']
         : correct/total = [(7019, 14232), (6874, 14235), (7316, 14266), (6894, 14217), (7041, 14238), (7127, 14373), (7170, 14346), (7063, 14334), (7121, 14294), (7124, 14373), (7154, 14344), (7076, 14302), (7140, 14354), (7082, 14362), (7268, 14320), (7168, 14395), (7085, 14389), (7063, 14257), (7189, 14251), (7172, 14399)]
         : compromised: 0.4974, honest: 0.4945
Round 004: test acc mean=0.4945 ± 0.0050 | min=0.4819 max=0.5011
         : test loss mean=46.3019 ± 28.4027
         : individual accs = ['0.491147', '0.481911', '0.483808', '0.489203', '0.501054', '0.500244', '0.499373', '0.492814', '0.497901', '0.494190', '0.497699', '0.496015', '0.493591', '0.499930', '0.493087', '0.498090', '0.492460', '0.495967', '0.493930', '0.497673']
         : correct/total = [(6990, 14232), (6860, 14235), (6902, 14266), (6955, 14217), (7134, 14238), (7190, 14373), (7164, 14346), (7064, 14334), (7117, 14294), (7103, 14373), (7139, 14344), (7094, 14302), (7085, 14354), (7180, 14362), (7061, 14320), (7170, 14395), (7086, 14389), (7071, 14257), (7039, 14251), (7166, 14399)]
         : compromised: 0.4943, honest: 0.4949
Round 005: test acc mean=0.4956 ± 0.0079 | min=0.4818 max=0.5100
         : test loss mean=77.7282 ± 76.5798
         : individual accs = ['0.490514', '0.481841', '0.509533', '0.485053', '0.492063', '0.490642', '0.496654', '0.489954', '0.488317', '0.502400', '0.507460', '0.489302', '0.496795', '0.491296', '0.506704', '0.497951', '0.492599', '0.495336', '0.509999', '0.497465']
         : correct/total = [(6981, 14232), (6859, 14235), (7269, 14266), (6896, 14217), (7006, 14238), (7052, 14373), (7125, 14346), (7023, 14334), (6980, 14294), (7221, 14373), (7279, 14344), (6998, 14302), (7131, 14354), (7056, 14362), (7256, 14320), (7168, 14395), (7088, 14389), (7062, 14257), (7268, 14251), (7163, 14399)]
         : compromised: 0.4955, honest: 0.4958
Round 006: test acc mean=0.4966 ± 0.0072 | min=0.4813 max=0.5089
         : test loss mean=284.6974 ± 425.5181
         : individual accs = ['0.496346', '0.481349', '0.488084', '0.504326', '0.508920', '0.505392', '0.491078', '0.483396', '0.502029', '0.495165', '0.498187', '0.493427', '0.503901', '0.505292', '0.491411', '0.498506', '0.492529', '0.496177', '0.495474', '0.501076']
         : correct/total = [(7064, 14232), (6852, 14235), (6963, 14266), (7170, 14217), (7246, 14238), (7264, 14373), (7045, 14346), (6929, 14334), (7176, 14294), (7117, 14373), (7146, 14344), (7057, 14302), (7233, 14354), (7257, 14362), (7037, 14320), (7176, 14395), (7087, 14389), (7074, 14257), (7061, 14251), (7215, 14399)]
         : compromised: 0.4970, honest: 0.4958
Round 007: test acc mean=0.4940 ± 0.0046 | min=0.4857 max=0.5001
         : test loss mean=668.8168 ± 1038.1937
         : individual accs = ['0.495503', '0.485845', '0.487943', '0.485686', '0.498104', '0.498087', '0.500070', '0.492396', '0.498671', '0.494886', '0.498954', '0.493637', '0.488296', '0.491714', '0.497835', '0.497673', '0.492460', '0.495336', '0.487755', '0.498646']
         : correct/total = [(7052, 14232), (6916, 14235), (6961, 14266), (6905, 14217), (7092, 14238), (7159, 14373), (7174, 14346), (7058, 14334), (7128, 14294), (7113, 14373), (7157, 14344), (7060, 14302), (7009, 14354), (7062, 14362), (7129, 14320), (7164, 14395), (7086, 14389), (7062, 14257), (6951, 14251), (7180, 14399)]
         : compromised: 0.4934, honest: 0.4954
Round 008: test acc mean=0.4972 ± 0.0052 | min=0.4874 max=0.5088
         : test loss mean=1034.8509 ± 1714.7093
         : individual accs = ['0.493817', '0.487390', '0.492710', '0.488570', '0.493047', '0.496556', '0.500767', '0.493512', '0.501539', '0.498991', '0.502370', '0.495875', '0.504946', '0.508843', '0.498464', '0.498229', '0.492877', '0.495967', '0.499474', '0.500590']
         : correct/total = [(7028, 14232), (6938, 14235), (7029, 14266), (6946, 14217), (7020, 14238), (7137, 14373), (7184, 14346), (7074, 14334), (7169, 14294), (7172, 14373), (7206, 14344), (7092, 14302), (7248, 14354), (7308, 14362), (7138, 14320), (7172, 14395), (7092, 14389), (7071, 14257), (7118, 14251), (7208, 14399)]
         : compromised: 0.4979, honest: 0.4958
Round 009: test acc mean=0.4939 ± 0.0050 | min=0.4831 max=0.5047
         : test loss mean=3698.7812 ± 6282.4444
         : individual accs = ['0.492763', '0.483105', '0.488995', '0.487656', '0.495786', '0.495095', '0.501603', '0.494349', '0.498321', '0.488764', '0.489473', '0.494546', '0.498119', '0.504735', '0.489944', '0.497325', '0.491626', '0.495406', '0.492316', '0.498368']
         : correct/total = [(7013, 14232), (6877, 14235), (6976, 14266), (6933, 14217), (7059, 14238), (7116, 14373), (7196, 14346), (7086, 14334), (7123, 14294), (7025, 14373), (7021, 14344), (7073, 14302), (7150, 14354), (7249, 14362), (7016, 14320), (7159, 14395), (7074, 14389), (7063, 14257), (7016, 14251), (7176, 14399)]
         : compromised: 0.4947, honest: 0.4921
Round 010: test acc mean=0.4947 ± 0.0069 | min=0.4822 max=0.5088
         : test loss mean=14126.3444 ± 24371.4285
         : individual accs = ['0.492833', '0.483246', '0.494813', '0.485686', '0.499579', '0.500591', '0.501534', '0.494419', '0.497691', '0.486816', '0.482223', '0.497133', '0.506270', '0.508773', '0.494064', '0.493366', '0.488915', '0.491758', '0.495965', '0.498298']
         : correct/total = [(7014, 14232), (6879, 14235), (7059, 14266), (6905, 14217), (7113, 14238), (7195, 14373), (7195, 14346), (7087, 14334), (7114, 14294), (6997, 14373), (6917, 14344), (7110, 14302), (7267, 14354), (7307, 14362), (7075, 14320), (7102, 14395), (7035, 14389), (7011, 14257), (7068, 14251), (7175, 14399)]
         : compromised: 0.4964, honest: 0.4908

=== FINAL RESULTS ===
Dataset: sent140, Nodes: 20, Graph: ring, Aggregation: krum
Attack: backdoor, 70.0% compromised
Final accuracy - Compromised: 0.4964, Honest: 0.4908
Overall test accuracy: mean=0.4947 ± 0.0069

=== BACKDOOR ATTACK SUCCESS RATE (ASR) ===
Target label: 1
Trigger size: 3x3
Overall ASR: 0.9555 ± 0.0529
Honest nodes ASR: 0.9442 ± 0.0481
Compromised nodes ASR: 0.9603 ± 0.0541
Note: Higher ASR indicates more successful backdoor attack
