Device: cuda
Seed: 987654321
Loading 1 LEAF Sent140 train files...
LEAF Sent140 train: 254555 users, 908652 samples
Building vocabulary (max_size=10000)...
Vocabulary size: 10000
Loading 1 LEAF Sent140 test files...
LEAF Sent140 test: 254555 users, 286281 samples
Found 254555 train users, 254555 test users, 254555 common users
User sample counts range: 494 (max) to 1 (min)
Distributed ALL 254555 users across 20 clients
Users per client: 12727 (with 15 clients getting +1 user)
Train partition sizes: [44353, 44290, 44657, 44907, 44696, 45843, 45801, 45619, 45069, 45639, 45821, 45311, 45779, 46056, 45625, 45984, 46428, 44737, 45540, 46497]
Test partition sizes: [14232, 14235, 14266, 14217, 14238, 14373, 14346, 14334, 14294, 14373, 14344, 14302, 14354, 14362, 14320, 14395, 14389, 14257, 14251, 14399]
  Client 0: 44353 train samples, 2 unique classes
  Client 1: 44290 train samples, 2 unique classes
  Client 2: 44657 train samples, 2 unique classes
  Client 3: 44907 train samples, 2 unique classes
  Client 4: 44696 train samples, 2 unique classes
  Client 5: 45843 train samples, 2 unique classes
  Client 6: 45801 train samples, 2 unique classes
  Client 7: 45619 train samples, 2 unique classes
  Client 8: 45069 train samples, 2 unique classes
  Client 9: 45639 train samples, 2 unique classes
  Client 10: 45821 train samples, 2 unique classes
  Client 11: 45311 train samples, 2 unique classes
  Client 12: 45779 train samples, 2 unique classes
  Client 13: 46056 train samples, 2 unique classes
  Client 14: 45625 train samples, 2 unique classes
  Client 15: 45984 train samples, 2 unique classes
  Client 16: 46428 train samples, 2 unique classes
  Client 17: 44737 train samples, 2 unique classes
  Client 18: 45540 train samples, 2 unique classes
  Client 19: 46497 train samples, 2 unique classes
Will sample 4500 samples per client per epoch
Graph: erdos, nodes: 20, edges: 48
Degree statistics: avg=4.80, min=2, max=7
Attack: Compromised 12/20 nodes: [1, 2, 3, 5, 8, 11, 12, 13, 14, 15, 17, 18]
Attack type: directed_deviation, lambda: 1.0
Model variant: baseline
Model parameters: 1,174,986
Initial test acc across nodes: mean=0.4965 ± 0.0152
Round 001: test acc mean=0.5003 ± 0.0055 | min=0.4918 max=0.5129
         : test loss mean=9.1323 ± 4.7516
         : individual accs = ['0.508994', '0.502072', '0.502383', '0.512907', '0.506181', '0.502122', '0.494214', '0.504116', '0.495802', '0.496347', '0.493168', '0.491819', '0.499721', '0.492341', '0.497486', '0.497395', '0.499062', '0.501298', '0.506561', '0.501979']
         : correct/total = [(7244, 14232), (7147, 14235), (7167, 14266), (7292, 14217), (7207, 14238), (7217, 14373), (7090, 14346), (7226, 14334), (7087, 14294), (7134, 14373), (7074, 14344), (7034, 14302), (7173, 14354), (7071, 14362), (7124, 14320), (7160, 14395), (7181, 14389), (7147, 14257), (7219, 14251), (7228, 14399)]
         : compromised: 0.5002, honest: 0.5005
Round 002: test acc mean=0.5037 ± 0.0062 | min=0.4935 max=0.5136
         : test loss mean=8.1515 ± 3.9635
         : individual accs = ['0.500141', '0.506709', '0.507711', '0.497011', '0.500843', '0.496208', '0.513593', '0.513046', '0.505247', '0.509149', '0.501255', '0.493497', '0.508151', '0.511489', '0.508659', '0.497881', '0.509139', '0.494634', '0.498140', '0.500660']
         : correct/total = [(7118, 14232), (7213, 14235), (7243, 14266), (7066, 14217), (7131, 14238), (7132, 14373), (7368, 14346), (7354, 14334), (7222, 14294), (7318, 14373), (7190, 14344), (7058, 14302), (7294, 14354), (7346, 14362), (7284, 14320), (7167, 14395), (7326, 14389), (7052, 14257), (7099, 14251), (7209, 14399)]
         : compromised: 0.5021, honest: 0.5060
Round 003: test acc mean=0.4976 ± 0.0117 | min=0.4829 max=0.5389
         : test loss mean=2.1708 ± 1.2897
         : individual accs = ['0.493606', '0.498911', '0.491588', '0.505100', '0.497401', '0.493216', '0.504810', '0.488628', '0.491955', '0.491964', '0.492192', '0.482870', '0.503623', '0.483986', '0.499232', '0.538868', '0.507332', '0.485726', '0.502421', '0.497951']
         : correct/total = [(7025, 14232), (7102, 14235), (7013, 14266), (7181, 14217), (7082, 14238), (7089, 14373), (7242, 14346), (7004, 14334), (7032, 14294), (7071, 14373), (7060, 14344), (6906, 14302), (7229, 14354), (6951, 14362), (7149, 14320), (7757, 14395), (7300, 14389), (6925, 14257), (7160, 14251), (7170, 14399)]
         : compromised: 0.4981, honest: 0.4967
Round 004: test acc mean=0.5042 ± 0.0070 | min=0.4894 max=0.5256
         : test loss mean=3.9417 ± 2.1173
         : individual accs = ['0.504778', '0.498419', '0.507500', '0.508335', '0.507094', '0.495791', '0.506831', '0.504953', '0.501749', '0.501913', '0.510736', '0.504265', '0.505086', '0.497215', '0.506634', '0.498576', '0.503440', '0.489374', '0.506491', '0.525592']
         : correct/total = [(7184, 14232), (7095, 14235), (7240, 14266), (7227, 14217), (7220, 14238), (7126, 14373), (7271, 14346), (7238, 14334), (7172, 14294), (7214, 14373), (7326, 14344), (7212, 14302), (7250, 14354), (7141, 14362), (7255, 14320), (7177, 14395), (7244, 14389), (6977, 14257), (7218, 14251), (7568, 14399)]
         : compromised: 0.5016, honest: 0.5082
Round 005: test acc mean=0.5019 ± 0.0059 | min=0.4920 max=0.5140
         : test loss mean=2.0427 ± 1.3383
         : individual accs = ['0.495714', '0.508606', '0.504276', '0.494056', '0.508288', '0.503861', '0.501394', '0.514023', '0.500140', '0.507758', '0.512270', '0.503985', '0.499025', '0.501184', '0.496299', '0.495867', '0.498714', '0.501929', '0.498281', '0.492048']
         : correct/total = [(7055, 14232), (7240, 14235), (7194, 14266), (7024, 14217), (7237, 14238), (7242, 14373), (7193, 14346), (7368, 14334), (7149, 14294), (7298, 14373), (7348, 14344), (7208, 14302), (7163, 14354), (7198, 14362), (7107, 14320), (7138, 14395), (7176, 14389), (7156, 14257), (7101, 14251), (7085, 14399)]
         : compromised: 0.5006, honest: 0.5038
Round 006: test acc mean=0.5037 ± 0.0080 | min=0.4900 max=0.5202
         : test loss mean=2.8041 ± 1.6478
         : individual accs = ['0.493184', '0.508254', '0.491799', '0.494478', '0.520228', '0.509636', '0.509550', '0.508930', '0.510914', '0.509497', '0.506274', '0.497763', '0.502160', '0.502924', '0.500349', '0.489962', '0.507123', '0.493442', '0.504526', '0.513786']
         : correct/total = [(7019, 14232), (7235, 14235), (7016, 14266), (7030, 14217), (7407, 14238), (7325, 14373), (7310, 14346), (7295, 14334), (7303, 14294), (7323, 14373), (7262, 14344), (7119, 14302), (7208, 14354), (7223, 14362), (7165, 14320), (7053, 14395), (7297, 14389), (7035, 14257), (7190, 14251), (7398, 14399)]
         : compromised: 0.5005, honest: 0.5086
Round 007: test acc mean=0.5036 ± 0.0072 | min=0.4911 max=0.5147
         : test loss mean=1.9340 ± 1.3225
         : individual accs = ['0.492622', '0.506287', '0.496285', '0.514736', '0.512712', '0.507618', '0.498188', '0.511372', '0.503568', '0.501774', '0.513107', '0.502937', '0.506827', '0.510305', '0.491131', '0.508024', '0.495378', '0.491057', '0.503333', '0.504479']
         : correct/total = [(7011, 14232), (7207, 14235), (7080, 14266), (7318, 14217), (7300, 14238), (7296, 14373), (7147, 14346), (7330, 14334), (7198, 14294), (7212, 14373), (7360, 14344), (7193, 14302), (7275, 14354), (7329, 14362), (7033, 14320), (7313, 14395), (7128, 14389), (7001, 14257), (7173, 14251), (7264, 14399)]
         : compromised: 0.5035, honest: 0.5037
Round 008: test acc mean=0.5032 ± 0.0071 | min=0.4872 max=0.5127
         : test loss mean=2.2889 ± 1.4282
         : individual accs = ['0.501335', '0.506287', '0.496495', '0.504255', '0.501826', '0.501287', '0.510735', '0.509000', '0.505317', '0.504418', '0.511921', '0.494896', '0.504737', '0.488372', '0.512709', '0.487183', '0.507818', '0.497510', '0.511543', '0.506424']
         : correct/total = [(7135, 14232), (7207, 14235), (7083, 14266), (7169, 14217), (7145, 14238), (7205, 14373), (7327, 14346), (7296, 14334), (7223, 14294), (7250, 14373), (7343, 14344), (7078, 14302), (7245, 14354), (7014, 14362), (7342, 14320), (7013, 14395), (7307, 14389), (7093, 14257), (7290, 14251), (7292, 14399)]
         : compromised: 0.5009, honest: 0.5067
Round 009: test acc mean=0.5051 ± 0.0067 | min=0.4949 max=0.5235
         : test loss mean=1.8695 ± 1.3887
         : individual accs = ['0.502459', '0.499684', '0.495864', '0.504466', '0.523458', '0.500313', '0.499442', '0.514023', '0.503008', '0.498017', '0.509133', '0.506433', '0.503692', '0.510375', '0.505796', '0.513303', '0.503510', '0.504384', '0.494913', '0.509966']
         : correct/total = [(7151, 14232), (7113, 14235), (7074, 14266), (7172, 14217), (7453, 14238), (7191, 14373), (7165, 14346), (7368, 14334), (7190, 14294), (7158, 14373), (7303, 14344), (7243, 14302), (7230, 14354), (7330, 14362), (7243, 14320), (7389, 14395), (7245, 14389), (7191, 14257), (7053, 14251), (7343, 14399)]
         : compromised: 0.5035, honest: 0.5075
Round 010: test acc mean=0.5037 ± 0.0078 | min=0.4872 max=0.5162
         : test loss mean=1.9693 ± 1.2589
         : individual accs = ['0.505340', '0.508606', '0.496075', '0.501583', '0.516224', '0.507966', '0.508156', '0.512627', '0.501189', '0.504209', '0.511015', '0.490701', '0.501324', '0.491227', '0.499651', '0.487183', '0.510390', '0.502420', '0.502772', '0.515036']
         : correct/total = [(7192, 14232), (7240, 14235), (7077, 14266), (7131, 14217), (7350, 14238), (7301, 14373), (7290, 14346), (7348, 14334), (7164, 14294), (7247, 14373), (7330, 14344), (7018, 14302), (7196, 14354), (7055, 14362), (7155, 14320), (7013, 14395), (7344, 14389), (7163, 14257), (7165, 14251), (7416, 14399)]
         : compromised: 0.4992, honest: 0.5104

=== FINAL RESULTS ===
Dataset: sent140, Nodes: 20, Graph: erdos, Aggregation: d-fedavg
Attack: directed_deviation, 60.0% compromised
Final accuracy - Compromised: 0.4992, Honest: 0.5104
Overall test accuracy: mean=0.5037 ± 0.0078
