Device: cuda
Seed: 987654321
Loading 1 LEAF Sent140 train files...
LEAF Sent140 train: 254555 users, 908652 samples
Building vocabulary (max_size=10000)...
Vocabulary size: 10000
Loading 1 LEAF Sent140 test files...
LEAF Sent140 test: 254555 users, 286281 samples
Found 254555 train users, 254555 test users, 254555 common users
User sample counts range: 494 (max) to 1 (min)
Distributed ALL 254555 users across 20 clients
Users per client: 12727 (with 15 clients getting +1 user)
Train partition sizes: [44353, 44290, 44657, 44907, 44696, 45843, 45801, 45619, 45069, 45639, 45821, 45311, 45779, 46056, 45625, 45984, 46428, 44737, 45540, 46497]
Test partition sizes: [14232, 14235, 14266, 14217, 14238, 14373, 14346, 14334, 14294, 14373, 14344, 14302, 14354, 14362, 14320, 14395, 14389, 14257, 14251, 14399]
  Client 0: 44353 train samples, 2 unique classes
  Client 1: 44290 train samples, 2 unique classes
  Client 2: 44657 train samples, 2 unique classes
  Client 3: 44907 train samples, 2 unique classes
  Client 4: 44696 train samples, 2 unique classes
  Client 5: 45843 train samples, 2 unique classes
  Client 6: 45801 train samples, 2 unique classes
  Client 7: 45619 train samples, 2 unique classes
  Client 8: 45069 train samples, 2 unique classes
  Client 9: 45639 train samples, 2 unique classes
  Client 10: 45821 train samples, 2 unique classes
  Client 11: 45311 train samples, 2 unique classes
  Client 12: 45779 train samples, 2 unique classes
  Client 13: 46056 train samples, 2 unique classes
  Client 14: 45625 train samples, 2 unique classes
  Client 15: 45984 train samples, 2 unique classes
  Client 16: 46428 train samples, 2 unique classes
  Client 17: 44737 train samples, 2 unique classes
  Client 18: 45540 train samples, 2 unique classes
  Client 19: 46497 train samples, 2 unique classes
Will sample 4500 samples per client per epoch
Graph: erdos, nodes: 20, edges: 99
Degree statistics: avg=9.90, min=7, max=14
Attack: Compromised 8/20 nodes: [1, 5, 11, 12, 13, 14, 17, 18]
Attack type: backdoor, lambda: 1.0
Backdoor target label: 1, trigger size: 3
Model variant: baseline
Model parameters: 1,174,986
Initial test acc across nodes: mean=0.4965 ± 0.0152
Backdoor attack: Created poisoned datasets for 8 compromised nodes
Round 001: test acc mean=0.5024 ± 0.0063 | min=0.4905 max=0.5137
         : test loss mean=4.9773 ± 2.6387
         : individual accs = ['0.513702', '0.500035', '0.492500', '0.508405', '0.496980', '0.499756', '0.497700', '0.506628', '0.509864', '0.508732', '0.500697', '0.493288', '0.512958', '0.490461', '0.502095', '0.503022', '0.499131', '0.504314', '0.503754', '0.503716']
         : correct/total = [(7311, 14232), (7118, 14235), (7026, 14266), (7228, 14217), (7076, 14238), (7183, 14373), (7140, 14346), (7262, 14334), (7288, 14294), (7312, 14373), (7182, 14344), (7055, 14302), (7363, 14354), (7044, 14362), (7190, 14320), (7241, 14395), (7182, 14389), (7190, 14257), (7179, 14251), (7253, 14399)]
         : compromised: 0.5008, honest: 0.5034
Round 002: test acc mean=0.5007 ± 0.0052 | min=0.4903 max=0.5083
         : test loss mean=4.0893 ± 1.5215
         : individual accs = ['0.508291', '0.499684', '0.495233', '0.497855', '0.494873', '0.506505', '0.503206', '0.508302', '0.505667', '0.497461', '0.493726', '0.490281', '0.495611', '0.504804', '0.497765', '0.505592', '0.504552', '0.496458', '0.503263', '0.504063']
         : correct/total = [(7234, 14232), (7113, 14235), (7065, 14266), (7078, 14217), (7046, 14238), (7280, 14373), (7219, 14346), (7286, 14334), (7228, 14294), (7150, 14373), (7082, 14344), (7012, 14302), (7114, 14354), (7250, 14362), (7128, 14320), (7278, 14395), (7260, 14389), (7078, 14257), (7172, 14251), (7258, 14399)]
         : compromised: 0.4993, honest: 0.5016
Round 003: test acc mean=0.5033 ± 0.0078 | min=0.4911 max=0.5257
         : test loss mean=2.3096 ± 0.5779
         : individual accs = ['0.506113', '0.511416', '0.514931', '0.497925', '0.507726', '0.499896', '0.502928', '0.502302', '0.500630', '0.491060', '0.496235', '0.525731', '0.501324', '0.510583', '0.500279', '0.500313', '0.500104', '0.495406', '0.507614', '0.494479']
         : correct/total = [(7203, 14232), (7280, 14235), (7346, 14266), (7079, 14217), (7229, 14238), (7185, 14373), (7215, 14346), (7200, 14334), (7156, 14294), (7058, 14373), (7118, 14344), (7519, 14302), (7196, 14354), (7333, 14362), (7164, 14320), (7202, 14395), (7196, 14389), (7063, 14257), (7234, 14251), (7120, 14399)]
         : compromised: 0.5065, honest: 0.5012
Round 004: test acc mean=0.4955 ± 0.0062 | min=0.4836 max=0.5084
         : test loss mean=3.6752 ± 1.1637
         : individual accs = ['0.496627', '0.489357', '0.497547', '0.503060', '0.501264', '0.494678', '0.497212', '0.500140', '0.483629', '0.496904', '0.506065', '0.497763', '0.488296', '0.489138', '0.490223', '0.490934', '0.491417', '0.508382', '0.497298', '0.489965']
         : correct/total = [(7068, 14232), (6966, 14235), (7098, 14266), (7152, 14217), (7137, 14238), (7110, 14373), (7133, 14346), (7169, 14334), (6913, 14294), (7142, 14373), (7259, 14344), (7119, 14302), (7009, 14354), (7025, 14362), (7020, 14320), (7067, 14395), (7071, 14389), (7248, 14257), (7087, 14251), (7055, 14399)]
         : compromised: 0.4944, honest: 0.4962
Round 005: test acc mean=0.4979 ± 0.0043 | min=0.4876 max=0.5054
         : test loss mean=7.5001 ± 2.3295
         : individual accs = ['0.499649', '0.494275', '0.493831', '0.492439', '0.501826', '0.503027', '0.500836', '0.503907', '0.487617', '0.493495', '0.500418', '0.496644', '0.499721', '0.498399', '0.498115', '0.496422', '0.501911', '0.505366', '0.494351', '0.495729']
         : correct/total = [(7111, 14232), (7036, 14235), (7045, 14266), (7001, 14217), (7145, 14238), (7230, 14373), (7185, 14346), (7223, 14334), (6970, 14294), (7093, 14373), (7178, 14344), (7103, 14302), (7173, 14354), (7158, 14362), (7133, 14320), (7146, 14395), (7222, 14389), (7205, 14257), (7045, 14251), (7138, 14399)]
         : compromised: 0.4987, honest: 0.4973
Round 006: test acc mean=0.4943 ± 0.0072 | min=0.4834 max=0.5117
         : test loss mean=6.4531 ± 1.3852
         : individual accs = ['0.496908', '0.493291', '0.483387', '0.503693', '0.485110', '0.497461', '0.487314', '0.491838', '0.486988', '0.500591', '0.511712', '0.489302', '0.500070', '0.483359', '0.491969', '0.495311', '0.498923', '0.498352', '0.500456', '0.490312']
         : correct/total = [(7072, 14232), (7022, 14235), (6896, 14266), (7161, 14217), (6907, 14238), (7150, 14373), (6991, 14346), (7050, 14334), (6961, 14294), (7195, 14373), (7340, 14344), (6998, 14302), (7178, 14354), (6942, 14362), (7045, 14320), (7130, 14395), (7179, 14389), (7105, 14257), (7132, 14251), (7060, 14399)]
         : compromised: 0.4943, honest: 0.4943
Round 007: test acc mean=0.5003 ± 0.0052 | min=0.4909 max=0.5105
         : test loss mean=14.2197 ± 3.9099
         : individual accs = ['0.506183', '0.510502', '0.505187', '0.494760', '0.505829', '0.503374', '0.495539', '0.500070', '0.507416', '0.501635', '0.497909', '0.502587', '0.492476', '0.490879', '0.498254', '0.497256', '0.496907', '0.495195', '0.505087', '0.498993']
         : correct/total = [(7204, 14232), (7267, 14235), (7207, 14266), (7034, 14217), (7202, 14238), (7235, 14373), (7109, 14346), (7168, 14334), (7253, 14294), (7210, 14373), (7142, 14344), (7188, 14302), (7069, 14354), (7050, 14362), (7135, 14320), (7158, 14395), (7150, 14389), (7060, 14257), (7198, 14251), (7185, 14399)]
         : compromised: 0.4998, honest: 0.5006
Round 008: test acc mean=0.5051 ± 0.0056 | min=0.4914 max=0.5139
         : test loss mean=59.6720 ± 16.1126
         : individual accs = ['0.510680', '0.513734', '0.513949', '0.507561', '0.505900', '0.506157', '0.502440', '0.504814', '0.511543', '0.506714', '0.500767', '0.507971', '0.500418', '0.491436', '0.504120', '0.501633', '0.500313', '0.496949', '0.511192', '0.503646']
         : correct/total = [(7268, 14232), (7313, 14235), (7332, 14266), (7216, 14217), (7203, 14238), (7275, 14373), (7208, 14346), (7236, 14334), (7312, 14294), (7283, 14373), (7183, 14344), (7265, 14302), (7183, 14354), (7058, 14362), (7219, 14320), (7221, 14395), (7199, 14389), (7085, 14257), (7285, 14251), (7252, 14399)]
         : compromised: 0.5040, honest: 0.5058
Round 009: test acc mean=0.5051 ± 0.0056 | min=0.4914 max=0.5139
         : test loss mean=87.1522 ± 19.1268
         : individual accs = ['0.510891', '0.513734', '0.513949', '0.507772', '0.505900', '0.506157', '0.502440', '0.504814', '0.511543', '0.506992', '0.500976', '0.507971', '0.500488', '0.491436', '0.504190', '0.501633', '0.500243', '0.496949', '0.511262', '0.503646']
         : correct/total = [(7271, 14232), (7313, 14235), (7332, 14266), (7219, 14217), (7203, 14238), (7275, 14373), (7208, 14346), (7236, 14334), (7312, 14294), (7287, 14373), (7186, 14344), (7265, 14302), (7184, 14354), (7058, 14362), (7220, 14320), (7221, 14395), (7198, 14389), (7085, 14257), (7286, 14251), (7252, 14399)]
         : compromised: 0.5040, honest: 0.5059
Round 010: test acc mean=0.5051 ± 0.0056 | min=0.4914 max=0.5139
         : test loss mean=96.7136 ± 20.6519
         : individual accs = ['0.510891', '0.513734', '0.513949', '0.507772', '0.505900', '0.506157', '0.502440', '0.504814', '0.511543', '0.506992', '0.500976', '0.507971', '0.500488', '0.491436', '0.504190', '0.501633', '0.500243', '0.496949', '0.511262', '0.503646']
         : correct/total = [(7271, 14232), (7313, 14235), (7332, 14266), (7219, 14217), (7203, 14238), (7275, 14373), (7208, 14346), (7236, 14334), (7312, 14294), (7287, 14373), (7186, 14344), (7265, 14302), (7184, 14354), (7058, 14362), (7220, 14320), (7221, 14395), (7198, 14389), (7085, 14257), (7286, 14251), (7252, 14399)]
         : compromised: 0.5040, honest: 0.5059

=== FINAL RESULTS ===
Dataset: sent140, Nodes: 20, Graph: erdos, Aggregation: d-fedavg
Attack: backdoor, 40.0% compromised
Final accuracy - Compromised: 0.5040, Honest: 0.5059
Overall test accuracy: mean=0.5051 ± 0.0056

=== BACKDOOR ATTACK SUCCESS RATE (ASR) ===
Target label: 1
Trigger size: 3x3
Overall ASR: 0.0000 ± 0.0000
Honest nodes ASR: 0.0000 ± 0.0000
Compromised nodes ASR: 0.0000 ± 0.0000
Note: Higher ASR indicates more successful backdoor attack
