Device: cuda
Seed: 987654321
Loading 1 LEAF Sent140 train files...
LEAF Sent140 train: 254555 users, 908652 samples
Building vocabulary (max_size=10000)...
Vocabulary size: 10000
Loading 1 LEAF Sent140 test files...
LEAF Sent140 test: 254555 users, 286281 samples
Found 254555 train users, 254555 test users, 254555 common users
User sample counts range: 494 (max) to 1 (min)
Distributed ALL 254555 users across 20 clients
Users per client: 12727 (with 15 clients getting +1 user)
Train partition sizes: [44353, 44290, 44657, 44907, 44696, 45843, 45801, 45619, 45069, 45639, 45821, 45311, 45779, 46056, 45625, 45984, 46428, 44737, 45540, 46497]
Test partition sizes: [14232, 14235, 14266, 14217, 14238, 14373, 14346, 14334, 14294, 14373, 14344, 14302, 14354, 14362, 14320, 14395, 14389, 14257, 14251, 14399]
  Client 0: 44353 train samples, 2 unique classes
  Client 1: 44290 train samples, 2 unique classes
  Client 2: 44657 train samples, 2 unique classes
  Client 3: 44907 train samples, 2 unique classes
  Client 4: 44696 train samples, 2 unique classes
  Client 5: 45843 train samples, 2 unique classes
  Client 6: 45801 train samples, 2 unique classes
  Client 7: 45619 train samples, 2 unique classes
  Client 8: 45069 train samples, 2 unique classes
  Client 9: 45639 train samples, 2 unique classes
  Client 10: 45821 train samples, 2 unique classes
  Client 11: 45311 train samples, 2 unique classes
  Client 12: 45779 train samples, 2 unique classes
  Client 13: 46056 train samples, 2 unique classes
  Client 14: 45625 train samples, 2 unique classes
  Client 15: 45984 train samples, 2 unique classes
  Client 16: 46428 train samples, 2 unique classes
  Client 17: 44737 train samples, 2 unique classes
  Client 18: 45540 train samples, 2 unique classes
  Client 19: 46497 train samples, 2 unique classes
Will sample 4500 samples per client per epoch
Graph: erdos, nodes: 20, edges: 48
Degree statistics: avg=4.80, min=2, max=7
Attack: Compromised 16/20 nodes: [1, 2, 3, 5, 6, 8, 9, 10, 11, 12, 13, 14, 15, 17, 18, 19]
Attack type: gaussian, lambda: 1.0
Model variant: baseline
Model parameters: 1,174,986
UBAR ALGORITHM (Two-Stage Byzantine-resilient)
  - Model dimension: 1,174,986 parameters
  - Rho parameter: 0.19999999999999996
  - Stage 1: Distance-based filtering (select 20% closest neighbors)
  - Stage 2: Performance-based selection (loss comparison)
  - Complexity: O(deg(i)×d + deg(i)×inference)
Initial test acc across nodes: mean=0.4965 ± 0.0152
Round 001: test acc mean=0.5262 ± 0.0269 | min=0.4805 max=0.5722
         : test loss mean=179.5654 ± 362.1050
         : individual accs = ['0.544056', '0.480506', '0.534417', '0.499121', '0.563984', '0.535170', '0.507040', '0.563555', '0.533581', '0.543589', '0.515407', '0.489862', '0.572175', '0.504595', '0.529818', '0.554081', '0.545903', '0.524023', '0.485369', '0.498715']
         : correct/total = [(7743, 14232), (6840, 14235), (7624, 14266), (7096, 14217), (8030, 14238), (7692, 14373), (7274, 14346), (8078, 14334), (7627, 14294), (7813, 14373), (7393, 14344), (7006, 14302), (8213, 14354), (7247, 14362), (7587, 14320), (7976, 14395), (7855, 14389), (7471, 14257), (6917, 14251), (7181, 14399)]
         : compromised: 0.5192, honest: 0.5544
         : ubar stats = ['Node 0: s1=0.167, s2=1.000', 'Node 1: s1=0.167, s2=1.000', 'Node 2: s1=0.200, s2=1.000']...
Round 002: test acc mean=0.5669 ± 0.0336 | min=0.5026 max=0.6080
         : test loss mean=249.8454 ± 546.3725
         : individual accs = ['0.591835', '0.534457', '0.579069', '0.502567', '0.607951', '0.583803', '0.560993', '0.605553', '0.570519', '0.576915', '0.595162', '0.514124', '0.596698', '0.509678', '0.563547', '0.570962', '0.595385', '0.584765', '0.588450', '0.506077']
         : correct/total = [(8423, 14232), (7608, 14235), (8261, 14266), (7145, 14217), (8656, 14238), (8391, 14373), (8048, 14346), (8680, 14334), (8155, 14294), (8292, 14373), (8537, 14344), (7353, 14302), (8565, 14354), (7320, 14362), (8070, 14320), (8219, 14395), (8567, 14389), (8337, 14257), (8386, 14251), (7287, 14399)]
         : compromised: 0.5586, honest: 0.6002
         : ubar stats = ['Node 0: s1=0.167, s2=1.000', 'Node 1: s1=0.167, s2=1.000', 'Node 2: s1=0.200, s2=1.000']...
Round 003: test acc mean=0.5830 ± 0.0422 | min=0.4953 max=0.6219
         : test loss mean=287.1719 ± 608.1494
         : individual accs = ['0.605467', '0.578995', '0.594560', '0.495252', '0.621927', '0.605302', '0.598146', '0.618390', '0.598223', '0.597996', '0.596974', '0.508111', '0.617737', '0.501114', '0.587779', '0.602987', '0.609076', '0.608192', '0.613220', '0.499757']
         : correct/total = [(8617, 14232), (8242, 14235), (8482, 14266), (7041, 14217), (8855, 14238), (8700, 14373), (8581, 14346), (8864, 14334), (8551, 14294), (8595, 14373), (8563, 14344), (7267, 14302), (8867, 14354), (7197, 14362), (8417, 14320), (8680, 14395), (8764, 14389), (8671, 14257), (8739, 14251), (7196, 14399)]
         : compromised: 0.5753, honest: 0.6137
         : ubar stats = ['Node 0: s1=0.167, s2=1.000', 'Node 1: s1=0.167, s2=1.000', 'Node 2: s1=0.200, s2=1.000']...
Round 004: test acc mean=0.5977 ± 0.0469 | min=0.4893 max=0.6293
         : test loss mean=287.6440 ± 654.2304
         : individual accs = ['0.620152', '0.618757', '0.614608', '0.512063', '0.627125', '0.628192', '0.615991', '0.623273', '0.617462', '0.615807', '0.628416', '0.489302', '0.629302', '0.515806', '0.608659', '0.623133', '0.618528', '0.621870', '0.622904', '0.502327']
         : correct/total = [(8826, 14232), (8808, 14235), (8768, 14266), (7280, 14217), (8929, 14238), (9029, 14373), (8837, 14346), (8934, 14334), (8826, 14294), (8851, 14373), (9014, 14344), (6998, 14302), (9033, 14354), (7408, 14362), (8716, 14320), (8970, 14395), (8900, 14389), (8866, 14257), (8877, 14251), (7233, 14399)]
         : compromised: 0.5915, honest: 0.6223
         : ubar stats = ['Node 0: s1=0.167, s2=1.000', 'Node 1: s1=0.167, s2=1.000', 'Node 2: s1=0.200, s2=1.000']...
Round 005: test acc mean=0.6036 ± 0.0520 | min=0.4920 max=0.6410
         : test loss mean=258.8386 ± 529.5459
         : individual accs = ['0.628162', '0.630699', '0.622950', '0.502778', '0.640961', '0.636958', '0.624076', '0.632971', '0.620050', '0.624783', '0.634202', '0.503916', '0.634179', '0.491993', '0.618017', '0.632650', '0.627910', '0.631058', '0.631464', '0.502327']
         : correct/total = [(8940, 14232), (8978, 14235), (8887, 14266), (7148, 14217), (9126, 14238), (9155, 14373), (8953, 14346), (9073, 14334), (8863, 14294), (8980, 14373), (9097, 14344), (7207, 14302), (9103, 14354), (7066, 14362), (8850, 14320), (9107, 14395), (9035, 14389), (8997, 14257), (8999, 14251), (7233, 14399)]
         : compromised: 0.5964, honest: 0.6325
         : ubar stats = ['Node 0: s1=0.167, s2=1.000', 'Node 1: s1=0.167, s2=1.000', 'Node 2: s1=0.200, s2=1.000']...
Round 006: test acc mean=0.6077 ± 0.0532 | min=0.4935 max=0.6429
         : test loss mean=203.7899 ± 437.7596
         : individual accs = ['0.630270', '0.633579', '0.631642', '0.501372', '0.641172', '0.642872', '0.632302', '0.641203', '0.626277', '0.632366', '0.636991', '0.498881', '0.641006', '0.514135', '0.621439', '0.635012', '0.627702', '0.637231', '0.635955', '0.493506']
         : correct/total = [(8970, 14232), (9019, 14235), (9011, 14266), (7128, 14217), (9129, 14238), (9240, 14373), (9071, 14346), (9191, 14334), (8952, 14294), (9089, 14373), (9137, 14344), (7135, 14302), (9201, 14354), (7384, 14362), (8899, 14320), (9141, 14395), (9032, 14389), (9085, 14257), (9063, 14251), (7106, 14399)]
         : compromised: 0.6009, honest: 0.6351
         : ubar stats = ['Node 0: s1=0.167, s2=1.000', 'Node 1: s1=0.167, s2=1.000', 'Node 2: s1=0.200, s2=1.000']...
Round 007: test acc mean=0.6116 ± 0.0551 | min=0.4905 max=0.6443
         : test loss mean=257.3939 ± 563.8784
         : individual accs = ['0.644323', '0.640042', '0.634446', '0.490539', '0.643840', '0.643916', '0.636902', '0.643784', '0.627676', '0.642107', '0.632878', '0.507551', '0.637662', '0.514622', '0.635894', '0.640431', '0.638960', '0.640457', '0.640657', '0.495243']
         : correct/total = [(9170, 14232), (9111, 14235), (9051, 14266), (6974, 14217), (9167, 14238), (9255, 14373), (9137, 14346), (9228, 14334), (8972, 14294), (9229, 14373), (9078, 14344), (7259, 14302), (9153, 14354), (7391, 14362), (9106, 14320), (9219, 14395), (9194, 14389), (9131, 14257), (9130, 14251), (7131, 14399)]
         : compromised: 0.6038, honest: 0.6427
         : ubar stats = ['Node 0: s1=0.167, s2=1.000', 'Node 1: s1=0.167, s2=1.000', 'Node 2: s1=0.200, s2=1.000']...
Round 008: test acc mean=0.6143 ± 0.0572 | min=0.4877 max=0.6480
         : test loss mean=189.5144 ± 384.0231
         : individual accs = ['0.647203', '0.647980', '0.642226', '0.497081', '0.640610', '0.644333', '0.641085', '0.643296', '0.637190', '0.638628', '0.645427', '0.501328', '0.644907', '0.515249', '0.639316', '0.647516', '0.642157', '0.642281', '0.641008', '0.487742']
         : correct/total = [(9211, 14232), (9224, 14235), (9162, 14266), (7067, 14217), (9121, 14238), (9261, 14373), (9197, 14346), (9221, 14334), (9108, 14294), (9179, 14373), (9258, 14344), (7170, 14302), (9257, 14354), (7400, 14362), (9155, 14320), (9321, 14395), (9240, 14389), (9157, 14257), (9135, 14251), (7023, 14399)]
         : compromised: 0.6071, honest: 0.6433
         : ubar stats = ['Node 0: s1=0.167, s2=1.000', 'Node 1: s1=0.167, s2=1.000', 'Node 2: s1=0.200, s2=1.000']...
Round 009: test acc mean=0.6170 ± 0.0593 | min=0.4913 max=0.6537
         : test loss mean=413.9992 ± 1032.5578
         : individual accs = ['0.653668', '0.651001', '0.643698', '0.507350', '0.648968', '0.649969', '0.645476', '0.647761', '0.641388', '0.644681', '0.649540', '0.505174', '0.648809', '0.491296', '0.633799', '0.652379', '0.646605', '0.644596', '0.642622', '0.492118']
         : correct/total = [(9303, 14232), (9267, 14235), (9183, 14266), (7213, 14217), (9240, 14238), (9342, 14373), (9260, 14346), (9285, 14334), (9168, 14294), (9266, 14373), (9317, 14344), (7225, 14302), (9313, 14354), (7056, 14362), (9076, 14320), (9391, 14395), (9304, 14389), (9190, 14257), (9158, 14251), (7086, 14399)]
         : compromised: 0.6090, honest: 0.6493
         : ubar stats = ['Node 0: s1=0.167, s2=1.000', 'Node 1: s1=0.167, s2=1.000', 'Node 2: s1=0.200, s2=1.000']...
Round 010: test acc mean=0.6189 ± 0.0590 | min=0.4929 max=0.6565
         : test loss mean=300.9748 ± 620.1482
         : individual accs = ['0.656478', '0.654584', '0.646362', '0.492931', '0.651777', '0.648577', '0.647288', '0.648109', '0.642927', '0.648021', '0.651004', '0.509509', '0.649296', '0.498886', '0.643366', '0.648836', '0.648064', '0.643544', '0.644165', '0.503368']
         : correct/total = [(9343, 14232), (9318, 14235), (9221, 14266), (7008, 14217), (9280, 14238), (9322, 14373), (9286, 14346), (9290, 14334), (9190, 14294), (9314, 14373), (9338, 14344), (7287, 14302), (9320, 14354), (7165, 14362), (9213, 14320), (9340, 14395), (9325, 14389), (9175, 14257), (9180, 14251), (7248, 14399)]
         : compromised: 0.6108, honest: 0.6511
         : ubar stats = ['Node 0: s1=0.167, s2=1.000', 'Node 1: s1=0.167, s2=1.000', 'Node 2: s1=0.200, s2=1.000']...

=== FINAL RESULTS ===
Dataset: sent140, Nodes: 20, Graph: erdos, Aggregation: ubar
Attack: gaussian, 80.0% compromised
Final accuracy - Compromised: 0.6108, Honest: 0.6511
Overall test accuracy: mean=0.6189 ± 0.0590

=== UBAR SUMMARY ===
Node 0: stage1=0.167, stage2=1.000, overall=0.167
Node 1: stage1=0.167, stage2=1.000, overall=0.167
Node 2: stage1=0.200, stage2=1.000, overall=0.200
Node 3: stage1=0.250, stage2=1.000, overall=0.250
Node 4: stage1=0.250, stage2=1.000, overall=0.250
Node 5: stage1=0.200, stage2=1.000, overall=0.200
Node 6: stage1=0.200, stage2=1.000, overall=0.200
Node 7: stage1=0.200, stage2=1.000, overall=0.200
Node 8: stage1=0.500, stage2=1.000, overall=0.500
Node 9: stage1=0.333, stage2=1.000, overall=0.333
Node 10: stage1=0.250, stage2=1.000, overall=0.250
Node 11: stage1=0.143, stage2=1.000, overall=0.143
Node 12: stage1=0.143, stage2=1.000, overall=0.143
Node 13: stage1=0.250, stage2=1.000, overall=0.250
Node 14: stage1=0.143, stage2=1.000, overall=0.143
Node 15: stage1=0.167, stage2=1.000, overall=0.167
Node 16: stage1=0.200, stage2=1.000, overall=0.200
Node 17: stage1=0.200, stage2=1.000, overall=0.200
Node 18: stage1=0.250, stage2=1.000, overall=0.250
Node 19: stage1=0.500, stage2=1.000, overall=0.500

=== PARALLEL EXECUTION TIME (realistic for distributed system) ===
  COMMUNICATION (max across nodes):
    - Full model transfer: 0.000s (0.0%)
  COMPUTATION (max across nodes):
    - Distance computation: 0.035s (67.0%)
    - Loss computation: 0.014s (26.5%)
    - Aggregation: 0.003s (6.5%)
  TOTALS:
    - Total computation: 0.052s (100.0%)
    - Total communication: 0.000s (0.0%)
    - Total parallel time: 0.052s

=== PER-NODE AVERAGE TIME ===
  - Distance computation: 0.021s
  - Loss computation: 0.009s
  - Aggregation: 0.003s
  - Model transfer: 0.000s
  - Total per node: 0.032s

=== TOTAL COMPUTATIONAL WORK (sum across all nodes) ===
  - Total distance computation: 0.414s
  - Total loss computation: 0.171s
  - Total aggregation: 0.065s
  - Total model transfer: 0.000s
  - Grand total: 0.649s
  - Mean Stage 1 acceptance rate: 0.236
  - Mean Stage 2 acceptance rate: 1.000
  - Overall acceptance rate: 0.236

UBAR Algorithm Properties:
  - Model dimension: 1,174,986
  - Rho parameter: 0.19999999999999996
  - Two-stage approach: Distance filtering + loss evaluation
  - Stage 1 selects: 20% of neighbors
  - Stage 2 uses: Training sample loss comparison
  - Theoretical complexity: O(deg(i)×d + deg(i)×inference)
  - Approach: UBAR paper implementation
