Device: cuda
Seed: 987654321
Loading 1 LEAF Sent140 train files...
LEAF Sent140 train: 254555 users, 908652 samples
Building vocabulary (max_size=10000)...
Vocabulary size: 10000
Loading 1 LEAF Sent140 test files...
LEAF Sent140 test: 254555 users, 286281 samples
Found 254555 train users, 254555 test users, 254555 common users
User sample counts range: 494 (max) to 1 (min)
Distributed ALL 254555 users across 20 clients
Users per client: 12727 (with 15 clients getting +1 user)
Train partition sizes: [44353, 44290, 44657, 44907, 44696, 45843, 45801, 45619, 45069, 45639, 45821, 45311, 45779, 46056, 45625, 45984, 46428, 44737, 45540, 46497]
Test partition sizes: [14232, 14235, 14266, 14217, 14238, 14373, 14346, 14334, 14294, 14373, 14344, 14302, 14354, 14362, 14320, 14395, 14389, 14257, 14251, 14399]
  Client 0: 44353 train samples, 2 unique classes
  Client 1: 44290 train samples, 2 unique classes
  Client 2: 44657 train samples, 2 unique classes
  Client 3: 44907 train samples, 2 unique classes
  Client 4: 44696 train samples, 2 unique classes
  Client 5: 45843 train samples, 2 unique classes
  Client 6: 45801 train samples, 2 unique classes
  Client 7: 45619 train samples, 2 unique classes
  Client 8: 45069 train samples, 2 unique classes
  Client 9: 45639 train samples, 2 unique classes
  Client 10: 45821 train samples, 2 unique classes
  Client 11: 45311 train samples, 2 unique classes
  Client 12: 45779 train samples, 2 unique classes
  Client 13: 46056 train samples, 2 unique classes
  Client 14: 45625 train samples, 2 unique classes
  Client 15: 45984 train samples, 2 unique classes
  Client 16: 46428 train samples, 2 unique classes
  Client 17: 44737 train samples, 2 unique classes
  Client 18: 45540 train samples, 2 unique classes
  Client 19: 46497 train samples, 2 unique classes
Will sample 4500 samples per client per epoch
Graph: fully, nodes: 20, edges: 190
Degree statistics: avg=19.00, min=19, max=19
Attack: Compromised 8/20 nodes: [1, 5, 11, 12, 13, 14, 17, 18]
Attack type: gaussian, lambda: 1.0
Model variant: baseline
Model parameters: 1,174,986
BALANCE algorithm:
Balance Config: BALANCEConfig(gamma=2, kappa=1, alpha=0.5, min_neighbors=1)
  - Model dimension: 1,174,986 parameters
  - Complexity: O(N×d) = O(20×1,174,986)
Initial test acc across nodes: mean=0.4953 ± 0.0174
Round 001: test acc mean=0.5638 ± 0.0438 | min=0.4984 max=0.6353
         : test loss mean=0.6897 ± 0.0008
         : individual accs = ['0.566610', '0.569512', '0.518435', '0.516002', '0.629934', '0.546441', '0.624564', '0.628157', '0.504058', '0.551659', '0.512340', '0.535450', '0.635293', '0.541707', '0.552514', '0.570893', '0.498367', '0.603563', '0.555540', '0.615251']
         : correct/total = [(8064, 14232), (8107, 14235), (7396, 14266), (7336, 14217), (8969, 14238), (7854, 14373), (8960, 14346), (9004, 14334), (7205, 14294), (7929, 14373), (7349, 14344), (7658, 14302), (9119, 14354), (7780, 14362), (7912, 14320), (8218, 14395), (7171, 14389), (8605, 14257), (7917, 14251), (8859, 14399)]
         : compromised: 0.5675, honest: 0.5614
Round 002: test acc mean=0.5438 ± 0.0441 | min=0.4926 max=0.6197
         : test loss mean=0.6906 ± 0.0011
         : individual accs = ['0.619730', '0.493994', '0.497827', '0.571991', '0.495084', '0.509080', '0.500836', '0.534812', '0.532111', '0.591456', '0.532278', '0.552860', '0.502856', '0.595182', '0.492598', '0.562556', '0.618459', '0.563583', '0.610133', '0.498924']
         : correct/total = [(8820, 14232), (7032, 14235), (7102, 14266), (8132, 14217), (7049, 14238), (7317, 14373), (7185, 14346), (7666, 14334), (7606, 14294), (8501, 14373), (7635, 14344), (7907, 14302), (7218, 14354), (8548, 14362), (7054, 14320), (8098, 14395), (8899, 14389), (8035, 14257), (8695, 14251), (7184, 14399)]
         : compromised: 0.5400, honest: 0.5463
Round 003: test acc mean=0.5125 ± 0.0326 | min=0.4853 max=0.6214
         : test loss mean=0.6905 ± 0.0011
         : individual accs = ['0.494941', '0.485283', '0.509884', '0.516846', '0.506602', '0.590134', '0.499791', '0.493651', '0.502169', '0.509427', '0.498397', '0.621382', '0.502856', '0.507520', '0.492598', '0.498020', '0.496143', '0.523462', '0.502772', '0.498090']
         : correct/total = [(7044, 14232), (6908, 14235), (7274, 14266), (7348, 14217), (7213, 14238), (8482, 14373), (7170, 14346), (7076, 14334), (7178, 14294), (7322, 14373), (7149, 14344), (8887, 14302), (7218, 14354), (7289, 14362), (7054, 14320), (7169, 14395), (7139, 14389), (7463, 14257), (7165, 14251), (7172, 14399)]
         : compromised: 0.5283, honest: 0.5020
Round 004: test acc mean=0.5732 ± 0.0414 | min=0.4928 max=0.6253
         : test loss mean=0.6860 ± 0.0020
         : individual accs = ['0.543985', '0.591078', '0.620566', '0.584793', '0.539893', '0.616573', '0.618082', '0.560765', '0.552050', '0.616294', '0.582822', '0.528458', '0.507385', '0.571787', '0.492807', '0.568114', '0.625339', '0.511328', '0.621360', '0.610945']
         : correct/total = [(7742, 14232), (8414, 14235), (8853, 14266), (8314, 14217), (7687, 14238), (8862, 14373), (8867, 14346), (8038, 14334), (7891, 14294), (8858, 14373), (8360, 14344), (7558, 14302), (7283, 14354), (8212, 14362), (7057, 14320), (8178, 14395), (8998, 14389), (7290, 14257), (8855, 14251), (8797, 14399)]
         : compromised: 0.5551, honest: 0.5853
Round 005: test acc mean=0.6206 ± 0.0227 | min=0.5581 max=0.6440
         : test loss mean=0.6738 ± 0.0034
         : individual accs = ['0.631605', '0.639550', '0.598346', '0.615531', '0.637870', '0.639880', '0.626865', '0.643993', '0.619631', '0.631462', '0.635806', '0.636484', '0.589661', '0.558140', '0.580517', '0.632164', '0.601918', '0.633022', '0.621781', '0.638378']
         : correct/total = [(8989, 14232), (9104, 14235), (8536, 14266), (8751, 14217), (9082, 14238), (9197, 14373), (8993, 14346), (9231, 14334), (8857, 14294), (9076, 14373), (9120, 14344), (9103, 14302), (8464, 14354), (8016, 14362), (8313, 14320), (9100, 14395), (8661, 14389), (9025, 14257), (8861, 14251), (9192, 14399)]
         : compromised: 0.6124, honest: 0.6261
Round 006: test acc mean=0.6423 ± 0.0050 | min=0.6297 max=0.6490
         : test loss mean=0.6472 ± 0.0025
         : individual accs = ['0.640599', '0.649034', '0.636128', '0.642752', '0.638994', '0.648438', '0.643246', '0.640505', '0.643976', '0.645307', '0.633714', '0.643407', '0.649018', '0.643991', '0.645601', '0.644460', '0.644590', '0.629726', '0.636376', '0.646781']
         : correct/total = [(9117, 14232), (9239, 14235), (9075, 14266), (9138, 14217), (9098, 14238), (9320, 14373), (9228, 14346), (9181, 14334), (9205, 14294), (9275, 14373), (9090, 14344), (9202, 14302), (9316, 14354), (9249, 14362), (9245, 14320), (9277, 14395), (9275, 14389), (8978, 14257), (9069, 14251), (9313, 14399)]
         : compromised: 0.6432, honest: 0.6418
Round 007: test acc mean=0.6464 ± 0.0088 | min=0.6287 max=0.6608
         : test loss mean=0.6340 ± 0.0052
         : individual accs = ['0.645377', '0.660766', '0.641385', '0.645424', '0.650091', '0.659640', '0.654189', '0.642040', '0.647964', '0.653517', '0.628695', '0.643197', '0.654382', '0.630135', '0.651955', '0.636610', '0.651122', '0.646279', '0.633429', '0.651851']
         : correct/total = [(9185, 14232), (9406, 14235), (9150, 14266), (9176, 14217), (9256, 14238), (9481, 14373), (9385, 14346), (9203, 14334), (9262, 14294), (9393, 14373), (9018, 14344), (9199, 14302), (9393, 14354), (9050, 14362), (9336, 14320), (9164, 14395), (9369, 14389), (9214, 14257), (9027, 14251), (9386, 14399)]
         : compromised: 0.6475, honest: 0.6457
Round 008: test acc mean=0.6541 ± 0.0052 | min=0.6444 max=0.6606
         : test loss mean=0.6257 ± 0.0042
         : individual accs = ['0.652965', '0.653390', '0.644399', '0.659703', '0.652479', '0.660614', '0.656420', '0.645737', '0.659018', '0.659222', '0.652817', '0.657740', '0.646928', '0.653530', '0.649511', '0.660368', '0.658767', '0.653644', '0.645920', '0.659699']
         : correct/total = [(9293, 14232), (9301, 14235), (9193, 14266), (9379, 14217), (9290, 14238), (9495, 14373), (9417, 14346), (9256, 14334), (9420, 14294), (9475, 14373), (9364, 14344), (9407, 14302), (9286, 14354), (9386, 14362), (9301, 14320), (9506, 14395), (9479, 14389), (9319, 14257), (9205, 14251), (9499, 14399)]
         : compromised: 0.6527, honest: 0.6551
Round 009: test acc mean=0.6590 ± 0.0075 | min=0.6343 max=0.6697
         : test loss mean=0.6222 ± 0.0074
         : individual accs = ['0.634275', '0.667650', '0.654984', '0.661391', '0.656764', '0.669728', '0.660602', '0.656272', '0.653491', '0.660753', '0.658185', '0.652916', '0.666504', '0.663626', '0.657682', '0.651685', '0.664257', '0.663884', '0.661568', '0.663866']
         : correct/total = [(9027, 14232), (9504, 14235), (9344, 14266), (9403, 14217), (9351, 14238), (9626, 14373), (9477, 14346), (9407, 14334), (9341, 14294), (9497, 14373), (9441, 14344), (9338, 14302), (9567, 14354), (9531, 14362), (9418, 14320), (9381, 14395), (9558, 14389), (9465, 14257), (9428, 14251), (9559, 14399)]
         : compromised: 0.6629, honest: 0.6564
Round 010: test acc mean=0.6664 ± 0.0070 | min=0.6427 max=0.6755
         : test loss mean=0.6148 ± 0.0071
         : individual accs = ['0.664910', '0.671092', '0.642717', '0.670184', '0.672426', '0.668893', '0.675519', '0.669039', '0.666294', '0.663884', '0.663065', '0.669906', '0.673680', '0.669196', '0.668156', '0.660577', '0.668636', '0.669776', '0.658059', '0.661435']
         : correct/total = [(9463, 14232), (9553, 14235), (9169, 14266), (9528, 14217), (9574, 14238), (9614, 14373), (9691, 14346), (9590, 14334), (9524, 14294), (9542, 14373), (9511, 14344), (9581, 14302), (9670, 14354), (9611, 14362), (9568, 14320), (9509, 14395), (9621, 14389), (9549, 14257), (9378, 14251), (9524, 14399)]
         : compromised: 0.6686, honest: 0.6649

=== FINAL RESULTS ===
Dataset: sent140, Nodes: 20, Graph: fully, Aggregation: balance
Attack: gaussian, 40.0% compromised
Final accuracy - Compromised: 0.6686, Honest: 0.6649
Overall test accuracy: mean=0.6664 ± 0.0070

=== BALANCE SUMMARY ===
Node 0: acceptance=0.579
Node 1: acceptance=0.632
Node 2: acceptance=0.579
Node 3: acceptance=0.579
Node 4: acceptance=0.579
Node 5: acceptance=0.632
Node 6: acceptance=0.579
Node 7: acceptance=0.579
Node 8: acceptance=0.579
Node 9: acceptance=0.579
Node 10: acceptance=0.579
Node 11: acceptance=0.632
Node 12: acceptance=0.632
Node 13: acceptance=0.632
Node 14: acceptance=0.632
Node 15: acceptance=0.579
Node 16: acceptance=0.579
Node 17: acceptance=0.632
Node 18: acceptance=0.632
Node 19: acceptance=0.579

=== PARALLEL EXECUTION TIME (realistic for distributed system) ===
  COMMUNICATION (max across nodes):
    - Full model transfer: 0.000s (0.0%)
  COMPUTATION (max across nodes):
    - Filtering: 0.084s (83.7%)
    - Aggregation: 0.016s (16.2%)
  TOTALS:
    - Total computation: 0.100s (100.0%)
    - Total communication: 0.000s (0.0%)
    - Total parallel time: 0.100s

=== PER-NODE AVERAGE TIME ===
  - Filtering: 0.075s
  - Aggregation: 0.010s
  - Model transfer: 0.000s
  - Total per node: 0.085s

=== TOTAL COMPUTATIONAL WORK (sum across all nodes) ===
  - Total filtering: 1.494s
  - Total aggregation: 0.204s
  - Total model transfer: 0.000s
  - Grand total: 1.698s
  - Mean acceptance rate: 0.600

BALANCE Algorithm Properties:
  - Model dimension: 1,174,986
  - No compression: Full parameter comparison
  - Theoretical complexity: O(deg(i)×d)
  - Approach: Full parameter filtering + averaging
