Device: cuda
Seed: 987654321
Loading 1 LEAF Sent140 train files...
LEAF Sent140 train: 254555 users, 908652 samples
Building vocabulary (max_size=10000)...
Vocabulary size: 10000
Loading 1 LEAF Sent140 test files...
LEAF Sent140 test: 254555 users, 286281 samples
Found 254555 train users, 254555 test users, 254555 common users
User sample counts range: 494 (max) to 1 (min)
Distributed ALL 254555 users across 20 clients
Users per client: 12727 (with 15 clients getting +1 user)
Train partition sizes: [44353, 44290, 44657, 44907, 44696, 45843, 45801, 45619, 45069, 45639, 45821, 45311, 45779, 46056, 45625, 45984, 46428, 44737, 45540, 46497]
Test partition sizes: [14232, 14235, 14266, 14217, 14238, 14373, 14346, 14334, 14294, 14373, 14344, 14302, 14354, 14362, 14320, 14395, 14389, 14257, 14251, 14399]
  Client 0: 44353 train samples, 2 unique classes
  Client 1: 44290 train samples, 2 unique classes
  Client 2: 44657 train samples, 2 unique classes
  Client 3: 44907 train samples, 2 unique classes
  Client 4: 44696 train samples, 2 unique classes
  Client 5: 45843 train samples, 2 unique classes
  Client 6: 45801 train samples, 2 unique classes
  Client 7: 45619 train samples, 2 unique classes
  Client 8: 45069 train samples, 2 unique classes
  Client 9: 45639 train samples, 2 unique classes
  Client 10: 45821 train samples, 2 unique classes
  Client 11: 45311 train samples, 2 unique classes
  Client 12: 45779 train samples, 2 unique classes
  Client 13: 46056 train samples, 2 unique classes
  Client 14: 45625 train samples, 2 unique classes
  Client 15: 45984 train samples, 2 unique classes
  Client 16: 46428 train samples, 2 unique classes
  Client 17: 44737 train samples, 2 unique classes
  Client 18: 45540 train samples, 2 unique classes
  Client 19: 46497 train samples, 2 unique classes
Will sample 4500 samples per client per epoch
Graph: erdos, nodes: 20, edges: 48
Degree statistics: avg=4.80, min=2, max=7
Attack: Compromised 10/20 nodes: [1, 2, 5, 11, 12, 13, 14, 15, 17, 18]
Attack type: backdoor, lambda: 1.0
Backdoor target label: 1, trigger size: 3
Model variant: baseline
Model parameters: 1,174,986
Initial test acc across nodes: mean=0.4965 ± 0.0152
Backdoor attack: Created poisoned datasets for 10 compromised nodes
Round 001: test acc mean=0.5007 ± 0.0090 | min=0.4838 max=0.5155
         : test loss mean=8.5411 ± 7.7472
         : individual accs = ['0.515458', '0.512961', '0.488434', '0.504255', '0.485110', '0.494956', '0.509759', '0.483815', '0.507975', '0.493216', '0.511294', '0.500559', '0.501324', '0.491575', '0.497975', '0.511844', '0.501077', '0.501438', '0.503544', '0.496701']
         : correct/total = [(7336, 14232), (7302, 14235), (6968, 14266), (7169, 14217), (6907, 14238), (7114, 14373), (7313, 14346), (6935, 14334), (7261, 14294), (7089, 14373), (7334, 14344), (7159, 14302), (7196, 14354), (7060, 14362), (7131, 14320), (7368, 14395), (7210, 14389), (7149, 14257), (7176, 14251), (7152, 14399)]
         : compromised: 0.5005, honest: 0.5009
Round 002: test acc mean=0.5044 ± 0.0070 | min=0.4907 max=0.5183
         : test loss mean=11.2526 ± 7.4744
         : individual accs = ['0.518269', '0.511135', '0.512127', '0.514525', '0.501334', '0.508523', '0.498954', '0.503000', '0.511963', '0.506784', '0.503067', '0.509509', '0.500418', '0.490670', '0.505237', '0.496839', '0.500243', '0.496458', '0.495685', '0.504063']
         : correct/total = [(7376, 14232), (7276, 14235), (7306, 14266), (7315, 14217), (7138, 14238), (7309, 14373), (7158, 14346), (7210, 14334), (7318, 14294), (7284, 14373), (7216, 14344), (7287, 14302), (7183, 14354), (7047, 14362), (7235, 14320), (7152, 14395), (7198, 14389), (7078, 14257), (7064, 14251), (7258, 14399)]
         : compromised: 0.5027, honest: 0.5062
Round 003: test acc mean=0.5056 ± 0.0059 | min=0.4911 max=0.5146
         : test loss mean=4.2782 ± 2.8456
         : individual accs = ['0.510750', '0.513664', '0.514580', '0.507772', '0.512923', '0.507340', '0.502231', '0.504883', '0.511543', '0.506853', '0.503625', '0.507761', '0.500209', '0.491088', '0.504399', '0.501285', '0.499826', '0.496879', '0.510771', '0.504132']
         : correct/total = [(7269, 14232), (7312, 14235), (7341, 14266), (7219, 14217), (7303, 14238), (7292, 14373), (7205, 14346), (7237, 14334), (7312, 14294), (7285, 14373), (7224, 14344), (7262, 14302), (7180, 14354), (7053, 14362), (7223, 14320), (7216, 14395), (7192, 14389), (7084, 14257), (7279, 14251), (7259, 14399)]
         : compromised: 0.5048, honest: 0.5065
Round 004: test acc mean=0.4979 ± 0.0053 | min=0.4868 max=0.5093
         : test loss mean=6.1377 ± 4.1395
         : individual accs = ['0.493114', '0.497155', '0.486822', '0.489977', '0.500562', '0.502539', '0.499651', '0.498116', '0.488667', '0.492799', '0.501882', '0.497832', '0.499443', '0.509330', '0.496020', '0.502258', '0.502398', '0.501718', '0.500035', '0.497187']
         : correct/total = [(7018, 14232), (7077, 14235), (6945, 14266), (6966, 14217), (7127, 14238), (7223, 14373), (7168, 14346), (7140, 14334), (6985, 14294), (7083, 14373), (7199, 14344), (7120, 14302), (7169, 14354), (7315, 14362), (7103, 14320), (7230, 14395), (7229, 14389), (7153, 14257), (7126, 14251), (7159, 14399)]
         : compromised: 0.4993, honest: 0.4964
Round 005: test acc mean=0.4989 ± 0.0084 | min=0.4767 max=0.5135
         : test loss mean=1.7548 ± 1.1646
         : individual accs = ['0.502740', '0.492870', '0.513459', '0.500176', '0.501194', '0.494260', '0.488289', '0.505511', '0.498811', '0.504209', '0.497421', '0.507412', '0.476662', '0.489277', '0.503492', '0.496909', '0.499201', '0.491758', '0.503824', '0.511494']
         : correct/total = [(7155, 14232), (7016, 14235), (7325, 14266), (7111, 14217), (7136, 14238), (7104, 14373), (7005, 14346), (7246, 14334), (7130, 14294), (7247, 14373), (7135, 14344), (7257, 14302), (6842, 14354), (7027, 14362), (7210, 14320), (7153, 14395), (7183, 14389), (7011, 14257), (7180, 14251), (7365, 14399)]
         : compromised: 0.4970, honest: 0.5009
Round 006: test acc mean=0.4968 ± 0.0059 | min=0.4839 max=0.5091
         : test loss mean=2.7631 ± 1.6988
         : individual accs = ['0.500562', '0.487601', '0.498037', '0.487656', '0.500562', '0.500939', '0.502440', '0.499023', '0.483909', '0.498991', '0.495747', '0.497972', '0.490804', '0.509121', '0.493017', '0.496075', '0.493015', '0.499544', '0.499053', '0.502257']
         : correct/total = [(7124, 14232), (6941, 14235), (7105, 14266), (6933, 14217), (7127, 14238), (7200, 14373), (7208, 14346), (7153, 14334), (6917, 14294), (7172, 14373), (7111, 14344), (7122, 14302), (7045, 14354), (7312, 14362), (7060, 14320), (7141, 14395), (7094, 14389), (7122, 14257), (7112, 14251), (7232, 14399)]
         : compromised: 0.4972, honest: 0.4964
Round 007: test acc mean=0.4993 ± 0.0059 | min=0.4918 max=0.5136
         : test loss mean=1.7360 ± 1.2998
         : individual accs = ['0.500492', '0.497014', '0.513599', '0.499613', '0.505619', '0.502192', '0.491775', '0.495605', '0.493564', '0.498991', '0.496305', '0.506083', '0.493173', '0.491923', '0.493506', '0.500174', '0.496907', '0.494354', '0.507263', '0.507327']
         : correct/total = [(7123, 14232), (7075, 14235), (7327, 14266), (7103, 14217), (7199, 14238), (7218, 14373), (7055, 14346), (7104, 14334), (7055, 14294), (7172, 14373), (7119, 14344), (7238, 14302), (7079, 14354), (7065, 14362), (7067, 14320), (7200, 14395), (7150, 14389), (7048, 14257), (7229, 14251), (7305, 14399)]
         : compromised: 0.4999, honest: 0.4986
Round 008: test acc mean=0.4995 ± 0.0072 | min=0.4902 max=0.5205
         : test loss mean=2.1747 ± 1.4487
         : individual accs = ['0.509978', '0.490762', '0.496145', '0.494549', '0.505408', '0.491199', '0.504391', '0.499093', '0.493564', '0.502400', '0.504462', '0.500070', '0.494566', '0.520540', '0.494274', '0.496839', '0.496699', '0.503051', '0.490211', '0.502257']
         : correct/total = [(7258, 14232), (6986, 14235), (7078, 14266), (7031, 14217), (7196, 14238), (7060, 14373), (7236, 14346), (7154, 14334), (7055, 14294), (7221, 14373), (7236, 14344), (7152, 14302), (7099, 14354), (7476, 14362), (7078, 14320), (7152, 14395), (7147, 14389), (7172, 14257), (6986, 14251), (7232, 14399)]
         : compromised: 0.4978, honest: 0.5013
Round 009: test acc mean=0.4992 ± 0.0070 | min=0.4863 max=0.5128
         : test loss mean=1.7338 ± 1.4333
         : individual accs = ['0.495925', '0.501300', '0.512758', '0.496096', '0.506321', '0.499687', '0.491705', '0.506349', '0.487617', '0.496208', '0.499512', '0.508530', '0.492824', '0.486283', '0.502235', '0.500243', '0.498714', '0.492811', '0.510350', '0.497743']
         : correct/total = [(7058, 14232), (7136, 14235), (7315, 14266), (7053, 14217), (7209, 14238), (7182, 14373), (7054, 14346), (7258, 14334), (6970, 14294), (7132, 14373), (7165, 14344), (7273, 14302), (7074, 14354), (6984, 14362), (7192, 14320), (7201, 14395), (7176, 14389), (7026, 14257), (7273, 14251), (7167, 14399)]
         : compromised: 0.5007, honest: 0.4976
Round 010: test acc mean=0.4992 ± 0.0062 | min=0.4876 max=0.5104
         : test loss mean=2.4899 ± 1.8821
         : individual accs = ['0.508010', '0.487601', '0.492149', '0.503763', '0.500632', '0.493356', '0.506274', '0.501953', '0.492095', '0.510401', '0.497560', '0.495106', '0.502856', '0.496170', '0.495461', '0.498715', '0.501425', '0.509574', '0.493018', '0.497257']
         : correct/total = [(7230, 14232), (6941, 14235), (7021, 14266), (7162, 14217), (7128, 14238), (7091, 14373), (7263, 14346), (7195, 14334), (7034, 14294), (7336, 14373), (7137, 14344), (7081, 14302), (7218, 14354), (7126, 14362), (7095, 14320), (7179, 14395), (7215, 14389), (7265, 14257), (7026, 14251), (7160, 14399)]
         : compromised: 0.4964, honest: 0.5019

=== FINAL RESULTS ===
Dataset: sent140, Nodes: 20, Graph: erdos, Aggregation: krum
Attack: backdoor, 50.0% compromised
Final accuracy - Compromised: 0.4964, Honest: 0.5019
Overall test accuracy: mean=0.4992 ± 0.0062

=== BACKDOOR ATTACK SUCCESS RATE (ASR) ===
Target label: 1
Trigger size: 3x3
Overall ASR: 0.8175 ± 0.1572
Honest nodes ASR: 0.7342 ± 0.1836
Compromised nodes ASR: 0.9009 ± 0.0431
Note: Higher ASR indicates more successful backdoor attack
