Device: cuda
Seed: 987654321
Loading 1 LEAF Sent140 train files...
LEAF Sent140 train: 254555 users, 908652 samples
Building vocabulary (max_size=10000)...
Vocabulary size: 10000
Loading 1 LEAF Sent140 test files...
LEAF Sent140 test: 254555 users, 286281 samples
Found 254555 train users, 254555 test users, 254555 common users
User sample counts range: 494 (max) to 1 (min)
Distributed ALL 254555 users across 20 clients
Users per client: 12727 (with 15 clients getting +1 user)
Train partition sizes: [44353, 44290, 44657, 44907, 44696, 45843, 45801, 45619, 45069, 45639, 45821, 45311, 45779, 46056, 45625, 45984, 46428, 44737, 45540, 46497]
Test partition sizes: [14232, 14235, 14266, 14217, 14238, 14373, 14346, 14334, 14294, 14373, 14344, 14302, 14354, 14362, 14320, 14395, 14389, 14257, 14251, 14399]
  Client 0: 44353 train samples, 2 unique classes
  Client 1: 44290 train samples, 2 unique classes
  Client 2: 44657 train samples, 2 unique classes
  Client 3: 44907 train samples, 2 unique classes
  Client 4: 44696 train samples, 2 unique classes
  Client 5: 45843 train samples, 2 unique classes
  Client 6: 45801 train samples, 2 unique classes
  Client 7: 45619 train samples, 2 unique classes
  Client 8: 45069 train samples, 2 unique classes
  Client 9: 45639 train samples, 2 unique classes
  Client 10: 45821 train samples, 2 unique classes
  Client 11: 45311 train samples, 2 unique classes
  Client 12: 45779 train samples, 2 unique classes
  Client 13: 46056 train samples, 2 unique classes
  Client 14: 45625 train samples, 2 unique classes
  Client 15: 45984 train samples, 2 unique classes
  Client 16: 46428 train samples, 2 unique classes
  Client 17: 44737 train samples, 2 unique classes
  Client 18: 45540 train samples, 2 unique classes
  Client 19: 46497 train samples, 2 unique classes
Will sample 4500 samples per client per epoch
Graph: erdos, nodes: 20, edges: 99
Degree statistics: avg=9.90, min=7, max=14
Attack: Compromised 14/20 nodes: [1, 2, 3, 5, 6, 8, 11, 12, 13, 14, 15, 17, 18, 19]
Attack type: directed_deviation, lambda: 1.0
Model variant: baseline
Model parameters: 1,174,986
Initial test acc across nodes: mean=0.4953 ± 0.0174
Round 001: test acc mean=0.5006 ± 0.0066 | min=0.4870 max=0.5117
         : test loss mean=12.6695 ± 6.0869
         : individual accs = ['0.511664', '0.486969', '0.487733', '0.500739', '0.503161', '0.510958', '0.500209', '0.496582', '0.496992', '0.505879', '0.502579', '0.508950', '0.502090', '0.495962', '0.498324', '0.504064', '0.509000', '0.494845', '0.497719', '0.497604']
         : correct/total = [(7282, 14232), (6932, 14235), (6958, 14266), (7119, 14217), (7164, 14238), (7344, 14373), (7176, 14346), (7118, 14334), (7104, 14294), (7271, 14373), (7209, 14344), (7279, 14302), (7207, 14354), (7123, 14362), (7136, 14320), (7256, 14395), (7324, 14389), (7055, 14257), (7093, 14251), (7165, 14399)]
         : compromised: 0.4988, honest: 0.5048
Round 002: test acc mean=0.5014 ± 0.0054 | min=0.4914 max=0.5111
         : test loss mean=10.5770 ± 4.1267
         : individual accs = ['0.506464', '0.510643', '0.511075', '0.504959', '0.496559', '0.499548', '0.494284', '0.493931', '0.499650', '0.501705', '0.502719', '0.504335', '0.494218', '0.491366', '0.504888', '0.503369', '0.503718', '0.501298', '0.505929', '0.496979']
         : correct/total = [(7208, 14232), (7269, 14235), (7291, 14266), (7179, 14217), (7070, 14238), (7180, 14373), (7091, 14346), (7080, 14334), (7142, 14294), (7211, 14373), (7211, 14344), (7213, 14302), (7094, 14354), (7057, 14362), (7230, 14320), (7246, 14395), (7248, 14389), (7147, 14257), (7210, 14251), (7156, 14399)]
         : compromised: 0.5016, honest: 0.5008
Round 003: test acc mean=0.4954 ± 0.0066 | min=0.4813 max=0.5104
         : test loss mean=2.1270 ± 0.7448
         : individual accs = ['0.505762', '0.484861', '0.497757', '0.485194', '0.494662', '0.495999', '0.497560', '0.491907', '0.498321', '0.490155', '0.498048', '0.510418', '0.502020', '0.481340', '0.493296', '0.497603', '0.498853', '0.494985', '0.493720', '0.496354']
         : correct/total = [(7198, 14232), (6902, 14235), (7101, 14266), (6898, 14217), (7043, 14238), (7129, 14373), (7138, 14346), (7051, 14334), (7123, 14294), (7045, 14373), (7144, 14344), (7300, 14302), (7206, 14354), (6913, 14362), (7064, 14320), (7163, 14395), (7178, 14389), (7057, 14257), (7036, 14251), (7147, 14399)]
         : compromised: 0.4950, honest: 0.4966
Round 004: test acc mean=0.4988 ± 0.0070 | min=0.4862 max=0.5141
         : test loss mean=2.1776 ± 0.9600
         : individual accs = ['0.498735', '0.488444', '0.504066', '0.486179', '0.490448', '0.509914', '0.502858', '0.492256', '0.499510', '0.493843', '0.499303', '0.497413', '0.506758', '0.505361', '0.504539', '0.495797', '0.497811', '0.494634', '0.514139', '0.494895']
         : correct/total = [(7098, 14232), (6953, 14235), (7191, 14266), (6912, 14217), (6983, 14238), (7329, 14373), (7214, 14346), (7056, 14334), (7140, 14294), (7098, 14373), (7162, 14344), (7114, 14302), (7274, 14354), (7258, 14362), (7225, 14320), (7137, 14395), (7163, 14389), (7052, 14257), (7327, 14251), (7126, 14399)]
         : compromised: 0.5003, honest: 0.4954
Round 005: test acc mean=0.5029 ± 0.0110 | min=0.4831 max=0.5209
         : test loss mean=0.9551 ± 0.3613
         : individual accs = ['0.495011', '0.483105', '0.512267', '0.487515', '0.496278', '0.520907', '0.511850', '0.500907', '0.509794', '0.486189', '0.498466', '0.519927', '0.497353', '0.517825', '0.505447', '0.491768', '0.500730', '0.498702', '0.513508', '0.509480']
         : correct/total = [(7045, 14232), (6877, 14235), (7308, 14266), (6931, 14217), (7066, 14238), (7487, 14373), (7343, 14346), (7180, 14334), (7287, 14294), (6988, 14373), (7150, 14344), (7436, 14302), (7139, 14354), (7437, 14362), (7238, 14320), (7079, 14395), (7205, 14389), (7110, 14257), (7318, 14251), (7336, 14399)]
         : compromised: 0.5057, honest: 0.4963
Round 006: test acc mean=0.5094 ± 0.0054 | min=0.5006 max=0.5195
         : test loss mean=1.1798 ± 0.5920
         : individual accs = ['0.508994', '0.519283', '0.514440', '0.519519', '0.505900', '0.508453', '0.500558', '0.513953', '0.510144', '0.510471', '0.516732', '0.512096', '0.503414', '0.505361', '0.510754', '0.509899', '0.502120', '0.501087', '0.508175', '0.506632']
         : correct/total = [(7244, 14232), (7392, 14235), (7339, 14266), (7386, 14217), (7203, 14238), (7308, 14373), (7181, 14346), (7367, 14334), (7292, 14294), (7337, 14373), (7412, 14344), (7324, 14302), (7226, 14354), (7258, 14362), (7314, 14320), (7340, 14395), (7225, 14389), (7144, 14257), (7242, 14251), (7295, 14399)]
         : compromised: 0.5093, honest: 0.5097
Round 007: test acc mean=0.4945 ± 0.0139 | min=0.4772 max=0.5188
         : test loss mean=0.8923 ± 0.4139
         : individual accs = ['0.487282', '0.477204', '0.494182', '0.487937', '0.480615', '0.517359', '0.511920', '0.482768', '0.515111', '0.478049', '0.494353', '0.518809', '0.489759', '0.496379', '0.485265', '0.478152', '0.480853', '0.497370', '0.502702', '0.513994']
         : correct/total = [(6935, 14232), (6793, 14235), (7050, 14266), (6937, 14217), (6843, 14238), (7436, 14373), (7344, 14346), (6920, 14334), (7363, 14294), (6871, 14373), (7091, 14344), (7420, 14302), (7030, 14354), (7129, 14362), (6949, 14320), (6883, 14395), (6919, 14389), (7091, 14257), (7164, 14251), (7401, 14399)]
         : compromised: 0.4990, honest: 0.4840
Round 008: test acc mean=0.5037 ± 0.0077 | min=0.4888 max=0.5163
         : test loss mean=1.0267 ± 0.4746
         : individual accs = ['0.503935', '0.513453', '0.516333', '0.488781', '0.499719', '0.510054', '0.495121', '0.504814', '0.502449', '0.494608', '0.496793', '0.512656', '0.507036', '0.497006', '0.515852', '0.511914', '0.496629', '0.496809', '0.507122', '0.503646']
         : correct/total = [(7172, 14232), (7309, 14235), (7366, 14266), (6949, 14217), (7115, 14238), (7331, 14373), (7103, 14346), (7236, 14334), (7182, 14294), (7109, 14373), (7126, 14344), (7332, 14302), (7278, 14354), (7138, 14362), (7387, 14320), (7369, 14395), (7146, 14389), (7083, 14257), (7227, 14251), (7252, 14399)]
         : compromised: 0.5056, honest: 0.4994
Round 009: test acc mean=0.4991 ± 0.0075 | min=0.4842 max=0.5127
         : test loss mean=0.8769 ± 0.3736
         : individual accs = ['0.492622', '0.484159', '0.512688', '0.484983', '0.497120', '0.497252', '0.504879', '0.499860', '0.506996', '0.495095', '0.499582', '0.509719', '0.507733', '0.499861', '0.491690', '0.507121', '0.493641', '0.495686', '0.502210', '0.499062']
         : correct/total = [(7011, 14232), (6892, 14235), (7314, 14266), (6895, 14217), (7078, 14238), (7147, 14373), (7243, 14346), (7165, 14334), (7247, 14294), (7116, 14373), (7166, 14344), (7290, 14302), (7288, 14354), (7179, 14362), (7041, 14320), (7300, 14395), (7103, 14389), (7067, 14257), (7157, 14251), (7186, 14399)]
         : compromised: 0.5003, honest: 0.4963
Round 010: test acc mean=0.5147 ± 0.0082 | min=0.4984 max=0.5307
         : test loss mean=0.9866 ± 0.4674
         : individual accs = ['0.512366', '0.530664', '0.521520', '0.512555', '0.514328', '0.512280', '0.513244', '0.512139', '0.500630', '0.516872', '0.520566', '0.519298', '0.515745', '0.502158', '0.523953', '0.515387', '0.529293', '0.498422', '0.513297', '0.508508']
         : correct/total = [(7292, 14232), (7554, 14235), (7440, 14266), (7287, 14217), (7323, 14238), (7363, 14373), (7363, 14346), (7341, 14334), (7156, 14294), (7429, 14373), (7467, 14344), (7427, 14302), (7403, 14354), (7212, 14362), (7503, 14320), (7419, 14395), (7616, 14389), (7106, 14257), (7315, 14251), (7322, 14399)]
         : compromised: 0.5134, honest: 0.5176

=== FINAL RESULTS ===
Dataset: sent140, Nodes: 20, Graph: erdos, Aggregation: krum
Attack: directed_deviation, 70.0% compromised
Final accuracy - Compromised: 0.5134, Honest: 0.5176
Overall test accuracy: mean=0.5147 ± 0.0082
