Device: cuda
Seed: 987654321
Loading 1 LEAF Sent140 train files...
LEAF Sent140 train: 254555 users, 908652 samples
Building vocabulary (max_size=10000)...
Vocabulary size: 10000
Loading 1 LEAF Sent140 test files...
LEAF Sent140 test: 254555 users, 286281 samples
Found 254555 train users, 254555 test users, 254555 common users
User sample counts range: 494 (max) to 1 (min)
Distributed ALL 254555 users across 20 clients
Users per client: 12727 (with 15 clients getting +1 user)
Train partition sizes: [44353, 44290, 44657, 44907, 44696, 45843, 45801, 45619, 45069, 45639, 45821, 45311, 45779, 46056, 45625, 45984, 46428, 44737, 45540, 46497]
Test partition sizes: [14232, 14235, 14266, 14217, 14238, 14373, 14346, 14334, 14294, 14373, 14344, 14302, 14354, 14362, 14320, 14395, 14389, 14257, 14251, 14399]
  Client 0: 44353 train samples, 2 unique classes
  Client 1: 44290 train samples, 2 unique classes
  Client 2: 44657 train samples, 2 unique classes
  Client 3: 44907 train samples, 2 unique classes
  Client 4: 44696 train samples, 2 unique classes
  Client 5: 45843 train samples, 2 unique classes
  Client 6: 45801 train samples, 2 unique classes
  Client 7: 45619 train samples, 2 unique classes
  Client 8: 45069 train samples, 2 unique classes
  Client 9: 45639 train samples, 2 unique classes
  Client 10: 45821 train samples, 2 unique classes
  Client 11: 45311 train samples, 2 unique classes
  Client 12: 45779 train samples, 2 unique classes
  Client 13: 46056 train samples, 2 unique classes
  Client 14: 45625 train samples, 2 unique classes
  Client 15: 45984 train samples, 2 unique classes
  Client 16: 46428 train samples, 2 unique classes
  Client 17: 44737 train samples, 2 unique classes
  Client 18: 45540 train samples, 2 unique classes
  Client 19: 46497 train samples, 2 unique classes
Will sample 4500 samples per client per epoch
Graph: erdos, nodes: 20, edges: 99
Degree statistics: avg=9.90, min=7, max=14
Attack: Compromised 8/20 nodes: [1, 5, 11, 12, 13, 14, 17, 18]
Attack type: gaussian, lambda: 1.0
Model variant: baseline
Model parameters: 1,174,986
UBAR ALGORITHM (Two-Stage Byzantine-resilient)
  - Model dimension: 1,174,986 parameters
  - Rho parameter: 0.6
  - Stage 1: Distance-based filtering (select 60% closest neighbors)
  - Stage 2: Performance-based selection (loss comparison)
  - Complexity: O(deg(i)×d + deg(i)×inference)
Initial test acc across nodes: mean=0.4965 ± 0.0152
Round 001: test acc mean=0.5350 ± 0.0178 | min=0.5068 max=0.5832
         : test loss mean=0.6917 ± 0.0006
         : individual accs = ['0.536046', '0.523147', '0.530142', '0.523106', '0.524231', '0.531691', '0.525512', '0.530417', '0.533581', '0.583246', '0.517987', '0.540204', '0.524941', '0.560507', '0.537500', '0.525669', '0.566474', '0.524023', '0.506842', '0.555594']
         : correct/total = [(7629, 14232), (7447, 14235), (7563, 14266), (7437, 14217), (7464, 14238), (7642, 14373), (7539, 14346), (7603, 14334), (7627, 14294), (8383, 14373), (7430, 14344), (7726, 14302), (7535, 14354), (8050, 14362), (7697, 14320), (7567, 14395), (8151, 14389), (7471, 14257), (7223, 14251), (8000, 14399)]
         : compromised: 0.5311, honest: 0.5377
         : ubar stats = ['Node 0: s1=0.583, s2=0.143', 'Node 1: s1=0.600, s2=0.167', 'Node 2: s1=0.500, s2=0.500']...
Round 002: test acc mean=0.5229 ± 0.0325 | min=0.4915 max=0.5863
         : test loss mean=0.6918 ± 0.0018
         : individual accs = ['0.586284', '0.582086', '0.579139', '0.491454', '0.498595', '0.494399', '0.497560', '0.563067', '0.560095', '0.497808', '0.499163', '0.518809', '0.539571', '0.508564', '0.495810', '0.533866', '0.517757', '0.495195', '0.502982', '0.496354']
         : correct/total = [(8344, 14232), (8286, 14235), (8262, 14266), (6987, 14217), (7099, 14238), (7106, 14373), (7138, 14346), (8071, 14334), (8006, 14294), (7155, 14373), (7160, 14344), (7420, 14302), (7745, 14354), (7304, 14362), (7100, 14320), (7685, 14395), (7450, 14389), (7060, 14257), (7168, 14251), (7147, 14399)]
         : compromised: 0.5172, honest: 0.5268
         : ubar stats = ['Node 0: s1=0.583, s2=0.357', 'Node 1: s1=0.600, s2=0.167', 'Node 2: s1=0.500, s2=0.375']...
Round 003: test acc mean=0.5037 ± 0.0195 | min=0.4884 max=0.5680
         : test loss mean=0.6925 ± 0.0017
         : individual accs = ['0.545039', '0.524131', '0.488434', '0.492298', '0.494451', '0.493843', '0.497560', '0.495186', '0.568001', '0.493008', '0.499024', '0.492029', '0.499512', '0.508564', '0.495810', '0.498367', '0.499757', '0.503051', '0.488738', '0.496354']
         : correct/total = [(7757, 14232), (7461, 14235), (6968, 14266), (6999, 14217), (7040, 14238), (7098, 14373), (7138, 14346), (7098, 14334), (8119, 14294), (7086, 14373), (7158, 14344), (7037, 14302), (7170, 14354), (7304, 14362), (7100, 14320), (7174, 14395), (7191, 14389), (7172, 14257), (6965, 14251), (7147, 14399)]
         : compromised: 0.5007, honest: 0.5056
         : ubar stats = ['Node 0: s1=0.583, s2=0.333', 'Node 1: s1=0.600, s2=0.444', 'Node 2: s1=0.500, s2=0.583']...
Round 004: test acc mean=0.5075 ± 0.0300 | min=0.4866 max=0.5937
         : test loss mean=0.6919 ± 0.0034
         : individual accs = ['0.593662', '0.486617', '0.487242', '0.492228', '0.507937', '0.493843', '0.497560', '0.495186', '0.593326', '0.493008', '0.499024', '0.492029', '0.499512', '0.508564', '0.495810', '0.498367', '0.527069', '0.503051', '0.488738', '0.496354']
         : correct/total = [(8449, 14232), (6927, 14235), (6951, 14266), (6998, 14217), (7232, 14238), (7098, 14373), (7138, 14346), (7098, 14334), (8481, 14294), (7086, 14373), (7158, 14344), (7037, 14302), (7170, 14354), (7304, 14362), (7100, 14320), (7174, 14395), (7584, 14389), (7172, 14257), (6965, 14251), (7147, 14399)]
         : compromised: 0.4960, honest: 0.5151
         : ubar stats = ['Node 0: s1=0.583, s2=0.286', 'Node 1: s1=0.600, s2=0.417', 'Node 2: s1=0.500, s2=0.625']...
Round 005: test acc mean=0.5120 ± 0.0347 | min=0.4861 max=0.6020
         : test loss mean=0.6911 ± 0.0049
         : individual accs = ['0.572934', '0.486266', '0.486051', '0.492228', '0.547057', '0.493843', '0.497560', '0.495186', '0.602001', '0.493008', '0.499024', '0.492029', '0.499512', '0.508564', '0.495810', '0.498367', '0.590660', '0.503051', '0.488738', '0.498229']
         : correct/total = [(8154, 14232), (6922, 14235), (6934, 14266), (6998, 14217), (7789, 14238), (7098, 14373), (7138, 14346), (7098, 14334), (8605, 14294), (7086, 14373), (7158, 14344), (7037, 14302), (7170, 14354), (7304, 14362), (7100, 14320), (7174, 14395), (8499, 14389), (7172, 14257), (6965, 14251), (7174, 14399)]
         : compromised: 0.4960, honest: 0.5227
         : ubar stats = ['Node 0: s1=0.583, s2=0.371', 'Node 1: s1=0.600, s2=0.467', 'Node 2: s1=0.500, s2=0.650']...
Round 006: test acc mean=0.5277 ± 0.0411 | min=0.4889 max=0.6055
         : test loss mean=0.6886 ± 0.0060
         : individual accs = ['0.587971', '0.542185', '0.512968', '0.492228', '0.584914', '0.552494', '0.502231', '0.495326', '0.605499', '0.493008', '0.499024', '0.492029', '0.511286', '0.508564', '0.495810', '0.498367', '0.591424', '0.503051', '0.488948', '0.597125']
         : correct/total = [(8368, 14232), (7718, 14235), (7318, 14266), (6998, 14217), (8328, 14238), (7941, 14373), (7205, 14346), (7100, 14334), (8655, 14294), (7086, 14373), (7158, 14344), (7037, 14302), (7339, 14354), (7304, 14362), (7100, 14320), (7174, 14395), (8510, 14389), (7172, 14257), (6968, 14251), (8598, 14399)]
         : compromised: 0.5118, honest: 0.5383
         : ubar stats = ['Node 0: s1=0.583, s2=0.405', 'Node 1: s1=0.600, s2=0.472', 'Node 2: s1=0.500, s2=0.667']...
Round 007: test acc mean=0.5601 ± 0.0458 | min=0.4922 max=0.6125
         : test loss mean=0.6833 ± 0.0087
         : individual accs = ['0.611088', '0.593116', '0.594490', '0.492228', '0.604650', '0.588604', '0.589433', '0.586577', '0.612425', '0.493008', '0.499024', '0.530415', '0.598857', '0.508634', '0.526536', '0.501285', '0.608312', '0.528512', '0.522490', '0.612543']
         : correct/total = [(8697, 14232), (8443, 14235), (8481, 14266), (6998, 14217), (8609, 14238), (8460, 14373), (8456, 14346), (8408, 14334), (8754, 14294), (7086, 14373), (7158, 14344), (7586, 14302), (8596, 14354), (7305, 14362), (7540, 14320), (7216, 14395), (8753, 14389), (7535, 14257), (7446, 14251), (8820, 14399)]
         : compromised: 0.5496, honest: 0.5671
         : ubar stats = ['Node 0: s1=0.583, s2=0.367', 'Node 1: s1=0.600, s2=0.476', 'Node 2: s1=0.500, s2=0.679']...
Round 008: test acc mean=0.5838 ± 0.0421 | min=0.4922 max=0.6220
         : test loss mean=0.6745 ± 0.0119
         : individual accs = ['0.616920', '0.610397', '0.597084', '0.492228', '0.608653', '0.611007', '0.610344', '0.589019', '0.622009', '0.493008', '0.539110', '0.604811', '0.619827', '0.556051', '0.503561', '0.582772', '0.612482', '0.590026', '0.595537', '0.621432']
         : correct/total = [(8780, 14232), (8689, 14235), (8518, 14266), (6998, 14217), (8666, 14238), (8782, 14373), (8756, 14346), (8443, 14334), (8891, 14294), (7086, 14373), (7733, 14344), (8650, 14302), (8897, 14354), (7986, 14362), (7211, 14320), (8389, 14395), (8813, 14389), (8412, 14257), (8487, 14251), (8948, 14399)]
         : compromised: 0.5864, honest: 0.5821
         : ubar stats = ['Node 0: s1=0.583, s2=0.357', 'Node 1: s1=0.600, s2=0.458', 'Node 2: s1=0.500, s2=0.656']...
Round 009: test acc mean=0.6056 ± 0.0288 | min=0.5045 max=0.6282
         : test loss mean=0.6641 ± 0.0121
         : individual accs = ['0.626405', '0.624728', '0.610963', '0.504466', '0.618696', '0.622626', '0.627562', '0.610088', '0.628166', '0.552494', '0.598508', '0.614390', '0.611258', '0.611266', '0.588687', '0.607780', '0.621516', '0.612822', '0.594485', '0.624141']
         : correct/total = [(8915, 14232), (8893, 14235), (8716, 14266), (7172, 14217), (8809, 14238), (8949, 14373), (9003, 14346), (8745, 14334), (8979, 14294), (7941, 14373), (8585, 14344), (8787, 14302), (8774, 14354), (8779, 14362), (8430, 14320), (8749, 14395), (8943, 14389), (8737, 14257), (8472, 14251), (8987, 14399)]
         : compromised: 0.6100, honest: 0.6026
         : ubar stats = ['Node 0: s1=0.583, s2=0.333', 'Node 1: s1=0.600, s2=0.444', 'Node 2: s1=0.500, s2=0.611']...
Round 010: test acc mean=0.6192 ± 0.0149 | min=0.5668 max=0.6331
         : test loss mean=0.6560 ± 0.0116
         : individual accs = ['0.632940', '0.632525', '0.622179', '0.607231', '0.624315', '0.633062', '0.620940', '0.618878', '0.629845', '0.566827', '0.619353', '0.621661', '0.621569', '0.621432', '0.594413', '0.620910', '0.625339', '0.623694', '0.615606', '0.631016']
         : correct/total = [(9008, 14232), (9004, 14235), (8876, 14266), (8633, 14217), (8889, 14238), (9099, 14373), (8908, 14346), (8871, 14334), (9003, 14294), (8147, 14373), (8884, 14344), (8891, 14302), (8922, 14354), (8925, 14362), (8512, 14320), (8938, 14395), (8998, 14389), (8892, 14257), (8773, 14251), (9086, 14399)]
         : compromised: 0.6205, honest: 0.6183
         : ubar stats = ['Node 0: s1=0.583, s2=0.329', 'Node 1: s1=0.600, s2=0.483', 'Node 2: s1=0.500, s2=0.575']...

=== FINAL RESULTS ===
Dataset: sent140, Nodes: 20, Graph: erdos, Aggregation: ubar
Attack: gaussian, 40.0% compromised
Final accuracy - Compromised: 0.6205, Honest: 0.6183
Overall test accuracy: mean=0.6192 ± 0.0149

=== UBAR SUMMARY ===
Node 0: stage1=0.583, stage2=0.329, overall=0.192
Node 1: stage1=0.600, stage2=0.483, overall=0.290
Node 2: stage1=0.500, stage2=0.575, overall=0.287
Node 3: stage1=0.571, stage2=0.575, overall=0.329
Node 4: stage1=0.556, stage2=0.300, overall=0.167
Node 5: stage1=0.600, stage2=0.567, overall=0.340
Node 6: stage1=0.583, stage2=0.386, overall=0.225
Node 7: stage1=0.545, stage2=0.300, overall=0.164
Node 8: stage1=0.571, stage2=0.325, overall=0.186
Node 9: stage1=0.545, stage2=0.467, overall=0.255
Node 10: stage1=0.500, stage2=0.550, overall=0.275
Node 11: stage1=0.583, stage2=0.357, overall=0.208
Node 12: stage1=0.583, stage2=0.471, overall=0.275
Node 13: stage1=0.556, stage2=0.820, overall=0.456
Node 14: stage1=0.571, stage2=0.600, overall=0.343
Node 15: stage1=0.556, stage2=0.440, overall=0.244
Node 16: stage1=0.571, stage2=0.350, overall=0.200
Node 17: stage1=0.500, stage2=0.650, overall=0.325
Node 18: stage1=0.583, stage2=0.586, overall=0.342
Node 19: stage1=0.600, stage2=0.350, overall=0.210

=== PARALLEL EXECUTION TIME (realistic for distributed system) ===
  COMMUNICATION (max across nodes):
    - Full model transfer: 0.000s (0.0%)
  COMPUTATION (max across nodes):
    - Distance computation: 0.055s (56.0%)
    - Loss computation: 0.035s (35.3%)
    - Aggregation: 0.009s (8.7%)
  TOTALS:
    - Total computation: 0.099s (100.0%)
    - Total communication: 0.000s (0.0%)
    - Total parallel time: 0.099s

=== PER-NODE AVERAGE TIME ===
  - Distance computation: 0.040s
  - Loss computation: 0.022s
  - Aggregation: 0.006s
  - Model transfer: 0.000s
  - Total per node: 0.068s

=== TOTAL COMPUTATIONAL WORK (sum across all nodes) ===
  - Total distance computation: 0.807s
  - Total loss computation: 0.448s
  - Total aggregation: 0.110s
  - Total model transfer: 0.000s
  - Grand total: 1.365s
  - Mean Stage 1 acceptance rate: 0.563
  - Mean Stage 2 acceptance rate: 0.474
  - Overall acceptance rate: 0.267

UBAR Algorithm Properties:
  - Model dimension: 1,174,986
  - Rho parameter: 0.6
  - Two-stage approach: Distance filtering + loss evaluation
  - Stage 1 selects: 60% of neighbors
  - Stage 2 uses: Training sample loss comparison
  - Theoretical complexity: O(deg(i)×d + deg(i)×inference)
  - Approach: UBAR paper implementation
