Device: cuda
Seed: 987654321
Loading 1 LEAF Sent140 train files...
LEAF Sent140 train: 254555 users, 908652 samples
Building vocabulary (max_size=10000)...
Vocabulary size: 10000
Loading 1 LEAF Sent140 test files...
LEAF Sent140 test: 254555 users, 286281 samples
Found 254555 train users, 254555 test users, 254555 common users
User sample counts range: 494 (max) to 1 (min)
Distributed ALL 254555 users across 20 clients
Users per client: 12727 (with 15 clients getting +1 user)
Train partition sizes: [44353, 44290, 44657, 44907, 44696, 45843, 45801, 45619, 45069, 45639, 45821, 45311, 45779, 46056, 45625, 45984, 46428, 44737, 45540, 46497]
Test partition sizes: [14232, 14235, 14266, 14217, 14238, 14373, 14346, 14334, 14294, 14373, 14344, 14302, 14354, 14362, 14320, 14395, 14389, 14257, 14251, 14399]
  Client 0: 44353 train samples, 2 unique classes
  Client 1: 44290 train samples, 2 unique classes
  Client 2: 44657 train samples, 2 unique classes
  Client 3: 44907 train samples, 2 unique classes
  Client 4: 44696 train samples, 2 unique classes
  Client 5: 45843 train samples, 2 unique classes
  Client 6: 45801 train samples, 2 unique classes
  Client 7: 45619 train samples, 2 unique classes
  Client 8: 45069 train samples, 2 unique classes
  Client 9: 45639 train samples, 2 unique classes
  Client 10: 45821 train samples, 2 unique classes
  Client 11: 45311 train samples, 2 unique classes
  Client 12: 45779 train samples, 2 unique classes
  Client 13: 46056 train samples, 2 unique classes
  Client 14: 45625 train samples, 2 unique classes
  Client 15: 45984 train samples, 2 unique classes
  Client 16: 46428 train samples, 2 unique classes
  Client 17: 44737 train samples, 2 unique classes
  Client 18: 45540 train samples, 2 unique classes
  Client 19: 46497 train samples, 2 unique classes
Will sample 4500 samples per client per epoch
Graph: ring, nodes: 20, edges: 20
Degree statistics: avg=2.00, min=2, max=2
Attack: Compromised 6/20 nodes: [5, 12, 13, 14, 17, 18]
Attack type: directed_deviation, lambda: 1.0
Model variant: baseline
Model parameters: 1,174,986
BALANCE algorithm:
Balance Config: BALANCEConfig(gamma=2, kappa=1, alpha=0.5, min_neighbors=1)
  - Model dimension: 1,174,986 parameters
  - Complexity: O(N×d) = O(20×1,174,986)
Initial test acc across nodes: mean=0.4965 ± 0.0152
Round 001: test acc mean=0.5108 ± 0.0189 | min=0.4854 max=0.5544
         : test loss mean=1.4839 ± 0.9142
         : individual accs = ['0.511031', '0.553495', '0.515211', '0.554407', '0.507796', '0.509288', '0.503206', '0.526441', '0.518679', '0.540110', '0.498048', '0.499371', '0.494845', '0.497424', '0.504120', '0.498645', '0.489958', '0.485446', '0.508736', '0.498993']
         : correct/total = [(7273, 14232), (7879, 14235), (7350, 14266), (7882, 14217), (7230, 14238), (7320, 14373), (7219, 14346), (7546, 14334), (7414, 14294), (7763, 14373), (7144, 14344), (7142, 14302), (7103, 14354), (7144, 14362), (7219, 14320), (7178, 14395), (7050, 14389), (6921, 14257), (7250, 14251), (7185, 14399)]
         : compromised: 0.5000, honest: 0.5154
Round 002: test acc mean=0.4987 ± 0.0096 | min=0.4817 max=0.5151
         : test loss mean=1.2314 ± 0.7245
         : individual accs = ['0.511313', '0.508114', '0.487172', '0.511852', '0.505829', '0.500313', '0.497281', '0.502163', '0.488597', '0.497600', '0.481665', '0.490631', '0.489062', '0.500836', '0.487570', '0.505314', '0.506498', '0.486498', '0.515122', '0.500938']
         : correct/total = [(7277, 14232), (7233, 14235), (6950, 14266), (7277, 14217), (7202, 14238), (7191, 14373), (7134, 14346), (7198, 14334), (6984, 14294), (7152, 14373), (6909, 14344), (7017, 14302), (7020, 14354), (7193, 14362), (6982, 14320), (7274, 14395), (7288, 14389), (6936, 14257), (7341, 14251), (7213, 14399)]
         : compromised: 0.4966, honest: 0.4996
Round 003: test acc mean=0.5057 ± 0.0131 | min=0.4781 max=0.5269
         : test loss mean=0.8232 ± 0.2170
         : individual accs = ['0.526911', '0.522304', '0.486121', '0.521559', '0.511518', '0.499896', '0.509619', '0.493861', '0.488317', '0.522160', '0.500558', '0.499231', '0.505713', '0.478067', '0.493226', '0.508579', '0.512683', '0.503963', '0.508806', '0.521217']
         : correct/total = [(7499, 14232), (7435, 14235), (6935, 14266), (7415, 14217), (7283, 14238), (7185, 14373), (7311, 14346), (7079, 14334), (6980, 14294), (7505, 14373), (7180, 14344), (7140, 14302), (7259, 14354), (6866, 14362), (7063, 14320), (7321, 14395), (7377, 14389), (7185, 14257), (7251, 14251), (7505, 14399)]
         : compromised: 0.4983, honest: 0.5089
Round 004: test acc mean=0.5407 ± 0.0211 | min=0.5023 max=0.5721
         : test loss mean=0.7651 ± 0.2620
         : individual accs = ['0.570756', '0.548086', '0.553133', '0.562847', '0.559208', '0.531274', '0.552210', '0.556021', '0.541626', '0.525151', '0.560165', '0.550972', '0.502299', '0.519078', '0.516550', '0.512886', '0.517131', '0.512099', '0.549856', '0.572054']
         : correct/total = [(8123, 14232), (7802, 14235), (7891, 14266), (8002, 14217), (7962, 14238), (7636, 14373), (7922, 14346), (7970, 14334), (7742, 14294), (7548, 14373), (8035, 14344), (7880, 14302), (7210, 14354), (7455, 14362), (7397, 14320), (7383, 14395), (7441, 14389), (7301, 14257), (7836, 14251), (8237, 14399)]
         : compromised: 0.5219, honest: 0.5487
Round 005: test acc mean=0.5573 ± 0.0307 | min=0.4797 max=0.5906
         : test loss mean=0.7262 ± 0.1642
         : individual accs = ['0.588182', '0.573937', '0.547806', '0.582894', '0.578382', '0.559034', '0.589154', '0.590624', '0.554638', '0.531761', '0.577036', '0.579429', '0.570503', '0.479738', '0.524162', '0.523585', '0.524706', '0.512169', '0.567960', '0.590388']
         : correct/total = [(8371, 14232), (8170, 14235), (7815, 14266), (8287, 14217), (8235, 14238), (8035, 14373), (8452, 14346), (8466, 14334), (7928, 14294), (7643, 14373), (8277, 14344), (8287, 14302), (8189, 14354), (6890, 14362), (7506, 14320), (7537, 14395), (7550, 14389), (7302, 14257), (8094, 14251), (8501, 14399)]
         : compromised: 0.5356, honest: 0.5666
Round 006: test acc mean=0.5717 ± 0.0328 | min=0.5089 max=0.6051
         : test loss mean=0.7472 ± 0.2907
         : individual accs = ['0.602726', '0.591149', '0.579350', '0.589224', '0.588636', '0.573297', '0.598355', '0.605135', '0.586330', '0.565087', '0.595719', '0.595022', '0.589313', '0.508912', '0.516480', '0.520736', '0.519564', '0.520657', '0.589432', '0.599069']
         : correct/total = [(8578, 14232), (8415, 14235), (8265, 14266), (8377, 14217), (8381, 14238), (8240, 14373), (8584, 14346), (8674, 14334), (8381, 14294), (8122, 14373), (8545, 14344), (8510, 14302), (8459, 14354), (7309, 14362), (7396, 14320), (7496, 14395), (7476, 14389), (7423, 14257), (8400, 14251), (8626, 14399)]
         : compromised: 0.5497, honest: 0.5812
Round 007: test acc mean=0.5800 ± 0.0388 | min=0.4813 max=0.6113
         : test loss mean=0.7020 ± 0.1331
         : individual accs = ['0.608066', '0.602388', '0.583766', '0.601955', '0.601559', '0.580046', '0.607696', '0.611274', '0.599692', '0.588812', '0.599972', '0.603342', '0.610910', '0.481270', '0.518506', '0.526085', '0.527903', '0.526829', '0.608799', '0.610667']
         : correct/total = [(8654, 14232), (8575, 14235), (8328, 14266), (8558, 14217), (8565, 14238), (8337, 14373), (8718, 14346), (8762, 14334), (8572, 14294), (8463, 14373), (8606, 14344), (8629, 14302), (8769, 14354), (6912, 14362), (7425, 14320), (7573, 14395), (7596, 14389), (7511, 14257), (8676, 14251), (8793, 14399)]
         : compromised: 0.5544, honest: 0.5909
Round 008: test acc mean=0.5894 ± 0.0367 | min=0.5088 max=0.6205
         : test loss mean=0.7286 ± 0.2765
         : individual accs = ['0.615022', '0.610046', '0.597294', '0.609622', '0.609074', '0.590830', '0.614039', '0.615460', '0.610676', '0.603075', '0.607780', '0.611942', '0.616065', '0.508843', '0.528142', '0.531712', '0.532143', '0.536579', '0.618553', '0.620529']
         : correct/total = [(8753, 14232), (8684, 14235), (8521, 14266), (8667, 14217), (8672, 14238), (8492, 14373), (8809, 14346), (8822, 14334), (8729, 14294), (8668, 14373), (8718, 14344), (8752, 14302), (8843, 14354), (7308, 14362), (7563, 14320), (7654, 14395), (7657, 14389), (7650, 14257), (8815, 14251), (8935, 14399)]
         : compromised: 0.5665, honest: 0.5992
Round 009: test acc mean=0.5949 ± 0.0424 | min=0.4859 max=0.6250
         : test loss mean=0.6986 ± 0.1709
         : individual accs = ['0.621346', '0.617071', '0.616080', '0.616726', '0.616941', '0.619147', '0.622752', '0.623343', '0.615853', '0.612537', '0.612521', '0.616557', '0.622405', '0.485865', '0.526117', '0.536089', '0.534158', '0.535456', '0.622062', '0.624974']
         : correct/total = [(8843, 14232), (8784, 14235), (8789, 14266), (8768, 14217), (8784, 14238), (8899, 14373), (8934, 14346), (8935, 14334), (8803, 14294), (8804, 14373), (8786, 14344), (8818, 14302), (8934, 14354), (6978, 14362), (7534, 14320), (7717, 14395), (7686, 14389), (7634, 14257), (8865, 14251), (8999, 14399)]
         : compromised: 0.5685, honest: 0.6062
Round 010: test acc mean=0.6017 ± 0.0399 | min=0.5163 max=0.6303
         : test loss mean=0.7177 ± 0.2728
         : individual accs = ['0.625703', '0.621848', '0.620496', '0.625026', '0.625228', '0.630001', '0.630350', '0.625366', '0.621939', '0.621026', '0.617401', '0.620962', '0.628187', '0.516293', '0.535196', '0.543105', '0.537494', '0.534404', '0.626903', '0.628030']
         : correct/total = [(8905, 14232), (8852, 14235), (8852, 14266), (8886, 14217), (8902, 14238), (9055, 14373), (9043, 14346), (8964, 14334), (8890, 14294), (8926, 14373), (8856, 14344), (8881, 14302), (9017, 14354), (7415, 14362), (7664, 14320), (7818, 14395), (7734, 14389), (7619, 14257), (8934, 14251), (9043, 14399)]
         : compromised: 0.5785, honest: 0.6117

=== FINAL RESULTS ===
Dataset: sent140, Nodes: 20, Graph: ring, Aggregation: balance
Attack: directed_deviation, 30.0% compromised
Final accuracy - Compromised: 0.5785, Honest: 0.6117
Overall test accuracy: mean=0.6017 ± 0.0399

=== BALANCE SUMMARY ===
Node 0: acceptance=1.000
Node 1: acceptance=1.000
Node 2: acceptance=1.000
Node 3: acceptance=1.000
Node 4: acceptance=0.600
Node 5: acceptance=0.800
Node 6: acceptance=0.600
Node 7: acceptance=1.000
Node 8: acceptance=1.000
Node 9: acceptance=1.000
Node 10: acceptance=1.000
Node 11: acceptance=0.600
Node 12: acceptance=0.600
Node 13: acceptance=0.200
Node 14: acceptance=0.600
Node 15: acceptance=0.600
Node 16: acceptance=0.600
Node 17: acceptance=0.600
Node 18: acceptance=0.600
Node 19: acceptance=0.600

=== PARALLEL EXECUTION TIME (realistic for distributed system) ===
  COMMUNICATION (max across nodes):
    - Full model transfer: 0.000s (0.0%)
  COMPUTATION (max across nodes):
    - Filtering: 0.026s (68.8%)
    - Aggregation: 0.012s (31.2%)
  TOTALS:
    - Total computation: 0.037s (100.0%)
    - Total communication: 0.000s (0.0%)
    - Total parallel time: 0.037s

=== PER-NODE AVERAGE TIME ===
  - Filtering: 0.012s
  - Aggregation: 0.005s
  - Model transfer: 0.000s
  - Total per node: 0.018s

=== TOTAL COMPUTATIONAL WORK (sum across all nodes) ===
  - Total filtering: 0.248s
  - Total aggregation: 0.103s
  - Total model transfer: 0.000s
  - Grand total: 0.351s
  - Mean acceptance rate: 0.750

BALANCE Algorithm Properties:
  - Model dimension: 1,174,986
  - No compression: Full parameter comparison
  - Theoretical complexity: O(deg(i)×d)
  - Approach: Full parameter filtering + averaging
