Device: cuda
Seed: 987654321
Loading 1 LEAF Sent140 train files...
LEAF Sent140 train: 254555 users, 908652 samples
Building vocabulary (max_size=10000)...
Vocabulary size: 10000
Loading 1 LEAF Sent140 test files...
LEAF Sent140 test: 254555 users, 286281 samples
Found 254555 train users, 254555 test users, 254555 common users
User sample counts range: 494 (max) to 1 (min)
Distributed ALL 254555 users across 20 clients
Users per client: 12727 (with 15 clients getting +1 user)
Train partition sizes: [44353, 44290, 44657, 44907, 44696, 45843, 45801, 45619, 45069, 45639, 45821, 45311, 45779, 46056, 45625, 45984, 46428, 44737, 45540, 46497]
Test partition sizes: [14232, 14235, 14266, 14217, 14238, 14373, 14346, 14334, 14294, 14373, 14344, 14302, 14354, 14362, 14320, 14395, 14389, 14257, 14251, 14399]
  Client 0: 44353 train samples, 2 unique classes
  Client 1: 44290 train samples, 2 unique classes
  Client 2: 44657 train samples, 2 unique classes
  Client 3: 44907 train samples, 2 unique classes
  Client 4: 44696 train samples, 2 unique classes
  Client 5: 45843 train samples, 2 unique classes
  Client 6: 45801 train samples, 2 unique classes
  Client 7: 45619 train samples, 2 unique classes
  Client 8: 45069 train samples, 2 unique classes
  Client 9: 45639 train samples, 2 unique classes
  Client 10: 45821 train samples, 2 unique classes
  Client 11: 45311 train samples, 2 unique classes
  Client 12: 45779 train samples, 2 unique classes
  Client 13: 46056 train samples, 2 unique classes
  Client 14: 45625 train samples, 2 unique classes
  Client 15: 45984 train samples, 2 unique classes
  Client 16: 46428 train samples, 2 unique classes
  Client 17: 44737 train samples, 2 unique classes
  Client 18: 45540 train samples, 2 unique classes
  Client 19: 46497 train samples, 2 unique classes
Will sample 4500 samples per client per epoch
Graph: erdos, nodes: 20, edges: 48
Degree statistics: avg=4.80, min=2, max=7
Attack: Compromised 6/20 nodes: [5, 12, 13, 14, 17, 18]
Attack type: directed_deviation, lambda: 1.0
Model variant: baseline
Model parameters: 1,174,986
Initial test acc across nodes: mean=0.4965 ± 0.0152
Round 001: test acc mean=0.5025 ± 0.0087 | min=0.4897 max=0.5203
         : test loss mean=3.1701 ± 2.5339
         : individual accs = ['0.512858', '0.499754', '0.513318', '0.502286', '0.496980', '0.489738', '0.492054', '0.493512', '0.509165', '0.505810', '0.501325', '0.495945', '0.496517', '0.518591', '0.499511', '0.520250', '0.500521', '0.502841', '0.490843', '0.508924']
         : correct/total = [(7299, 14232), (7114, 14235), (7323, 14266), (7141, 14217), (7076, 14238), (7039, 14373), (7059, 14346), (7074, 14334), (7278, 14294), (7270, 14373), (7191, 14344), (7093, 14302), (7127, 14354), (7448, 14362), (7153, 14320), (7489, 14395), (7202, 14389), (7169, 14257), (6995, 14251), (7328, 14399)]
         : compromised: 0.4997, honest: 0.5038
Round 002: test acc mean=0.5024 ± 0.0066 | min=0.4918 max=0.5138
         : test loss mean=2.8647 ± 2.2950
         : individual accs = ['0.500070', '0.510362', '0.511846', '0.513821', '0.497752', '0.499200', '0.507180', '0.500419', '0.500560', '0.503166', '0.510527', '0.498672', '0.511913', '0.493107', '0.504818', '0.497951', '0.497672', '0.504314', '0.491755', '0.491979']
         : correct/total = [(7117, 14232), (7265, 14235), (7302, 14266), (7305, 14217), (7087, 14238), (7175, 14373), (7276, 14346), (7173, 14334), (7155, 14294), (7232, 14373), (7323, 14344), (7132, 14302), (7348, 14354), (7082, 14362), (7229, 14320), (7168, 14395), (7161, 14389), (7190, 14257), (7008, 14251), (7084, 14399)]
         : compromised: 0.5009, honest: 0.5030
Round 003: test acc mean=0.4975 ± 0.0136 | min=0.4769 max=0.5223
         : test loss mean=1.2681 ± 0.7530
         : individual accs = ['0.522344', '0.501159', '0.489976', '0.495956', '0.495365', '0.486955', '0.507946', '0.480954', '0.489786', '0.521603', '0.499512', '0.479024', '0.480493', '0.505918', '0.494204', '0.492185', '0.502189', '0.506067', '0.476879', '0.521772']
         : correct/total = [(7434, 14232), (7134, 14235), (6990, 14266), (7051, 14217), (7053, 14238), (6999, 14373), (7287, 14346), (6894, 14334), (7001, 14294), (7497, 14373), (7165, 14344), (6851, 14302), (6897, 14354), (7266, 14362), (7077, 14320), (7085, 14395), (7226, 14389), (7215, 14257), (6796, 14251), (7513, 14399)]
         : compromised: 0.4918, honest: 0.5000
Round 004: test acc mean=0.5050 ± 0.0070 | min=0.4957 max=0.5226
         : test loss mean=1.5777 ± 1.0281
         : individual accs = ['0.510821', '0.501159', '0.504837', '0.517971', '0.512923', '0.498156', '0.499791', '0.500698', '0.495732', '0.502957', '0.522588', '0.507691', '0.497213', '0.507311', '0.499092', '0.502119', '0.502467', '0.506628', '0.511262', '0.498507']
         : correct/total = [(7270, 14232), (7134, 14235), (7202, 14266), (7364, 14217), (7303, 14238), (7160, 14373), (7170, 14346), (7177, 14334), (7086, 14294), (7229, 14373), (7496, 14344), (7261, 14302), (7137, 14354), (7286, 14362), (7147, 14320), (7228, 14395), (7230, 14389), (7223, 14257), (7286, 14251), (7178, 14399)]
         : compromised: 0.5033, honest: 0.5057
Round 005: test acc mean=0.4992 ± 0.0105 | min=0.4766 max=0.5203
         : test loss mean=1.0452 ± 0.5570
         : individual accs = ['0.509064', '0.507622', '0.493411', '0.492228', '0.498876', '0.489112', '0.520284', '0.503279', '0.488247', '0.517289', '0.504880', '0.497063', '0.483489', '0.508355', '0.495531', '0.502397', '0.496560', '0.476608', '0.495825', '0.502882']
         : correct/total = [(7245, 14232), (7226, 14235), (7039, 14266), (6998, 14217), (7103, 14238), (7030, 14373), (7464, 14346), (7214, 14334), (6979, 14294), (7435, 14373), (7242, 14344), (7109, 14302), (6940, 14354), (7301, 14362), (7096, 14320), (7232, 14395), (7145, 14389), (6795, 14257), (7066, 14251), (7241, 14399)]
         : compromised: 0.4915, honest: 0.5024
Round 006: test acc mean=0.5108 ± 0.0073 | min=0.4999 max=0.5265
         : test loss mean=1.2877 ± 0.8017
         : individual accs = ['0.511523', '0.500105', '0.506869', '0.521699', '0.518191', '0.509636', '0.517636', '0.513255', '0.505247', '0.526543', '0.521472', '0.500839', '0.506758', '0.499861', '0.509916', '0.511080', '0.502884', '0.513362', '0.511824', '0.508160']
         : correct/total = [(7280, 14232), (7119, 14235), (7231, 14266), (7417, 14217), (7378, 14238), (7325, 14373), (7426, 14346), (7357, 14334), (7222, 14294), (7568, 14373), (7480, 14344), (7163, 14302), (7274, 14354), (7179, 14362), (7302, 14320), (7357, 14395), (7236, 14389), (7319, 14257), (7294, 14251), (7317, 14399)]
         : compromised: 0.5086, honest: 0.5118
Round 007: test acc mean=0.5054 ± 0.0104 | min=0.4924 max=0.5379
         : test loss mean=0.9538 ± 0.4757
         : individual accs = ['0.510680', '0.516895', '0.497196', '0.494267', '0.507937', '0.493703', '0.504670', '0.516743', '0.514622', '0.509427', '0.537856', '0.499930', '0.503205', '0.494430', '0.507123', '0.502397', '0.500521', '0.492390', '0.501438', '0.503299']
         : correct/total = [(7268, 14232), (7358, 14235), (7093, 14266), (7027, 14217), (7232, 14238), (7096, 14373), (7240, 14346), (7407, 14334), (7356, 14294), (7322, 14373), (7715, 14344), (7150, 14302), (7223, 14354), (7101, 14362), (7262, 14320), (7232, 14395), (7202, 14389), (7020, 14257), (7146, 14251), (7247, 14399)]
         : compromised: 0.4987, honest: 0.5083
Round 008: test acc mean=0.5140 ± 0.0102 | min=0.5029 max=0.5488
         : test loss mean=1.1205 ± 0.6429
         : individual accs = ['0.510891', '0.515139', '0.513459', '0.528241', '0.509692', '0.508175', '0.511153', '0.507814', '0.521198', '0.548807', '0.506344', '0.502867', '0.521666', '0.513786', '0.504399', '0.515248', '0.507471', '0.517921', '0.511403', '0.504618']
         : correct/total = [(7271, 14232), (7333, 14235), (7325, 14266), (7510, 14217), (7257, 14238), (7304, 14373), (7333, 14346), (7279, 14334), (7450, 14294), (7888, 14373), (7263, 14344), (7192, 14302), (7488, 14354), (7379, 14362), (7223, 14320), (7417, 14395), (7302, 14389), (7384, 14257), (7288, 14251), (7266, 14399)]
         : compromised: 0.5129, honest: 0.5145
Round 009: test acc mean=0.5107 ± 0.0152 | min=0.4887 max=0.5590
         : test loss mean=0.9147 ± 0.4431
         : individual accs = ['0.510891', '0.517035', '0.505468', '0.558979', '0.502037', '0.492382', '0.505507', '0.532371', '0.522037', '0.505183', '0.529002', '0.507062', '0.503274', '0.488651', '0.510196', '0.508301', '0.495934', '0.504524', '0.505789', '0.509063']
         : correct/total = [(7271, 14232), (7360, 14235), (7211, 14266), (7947, 14217), (7148, 14238), (7077, 14373), (7252, 14346), (7631, 14334), (7462, 14294), (7261, 14373), (7588, 14344), (7252, 14302), (7224, 14354), (7018, 14362), (7306, 14320), (7317, 14395), (7136, 14389), (7193, 14257), (7208, 14251), (7330, 14399)]
         : compromised: 0.5008, honest: 0.5149
Round 010: test acc mean=0.5128 ± 0.0113 | min=0.4994 max=0.5551
         : test loss mean=1.0141 ± 0.5151
         : individual accs = ['0.510891', '0.519705', '0.510164', '0.514877', '0.511729', '0.508175', '0.501603', '0.504465', '0.508535', '0.555069', '0.499373', '0.505314', '0.518183', '0.502994', '0.515852', '0.515248', '0.507332', '0.515396', '0.511333', '0.518994']
         : correct/total = [(7271, 14232), (7398, 14235), (7278, 14266), (7320, 14217), (7286, 14238), (7304, 14373), (7196, 14346), (7231, 14334), (7269, 14294), (7978, 14373), (7163, 14344), (7227, 14302), (7438, 14354), (7224, 14362), (7387, 14320), (7417, 14395), (7300, 14389), (7348, 14257), (7287, 14251), (7473, 14399)]
         : compromised: 0.5120, honest: 0.5131

=== FINAL RESULTS ===
Dataset: sent140, Nodes: 20, Graph: erdos, Aggregation: d-fedavg
Attack: directed_deviation, 30.0% compromised
Final accuracy - Compromised: 0.5120, Honest: 0.5131
Overall test accuracy: mean=0.5128 ± 0.0113
