Device: cuda
Seed: 987654321
Loading 1 LEAF Sent140 train files...
LEAF Sent140 train: 254555 users, 908652 samples
Building vocabulary (max_size=10000)...
Vocabulary size: 10000
Loading 1 LEAF Sent140 test files...
LEAF Sent140 test: 254555 users, 286281 samples
Found 254555 train users, 254555 test users, 254555 common users
User sample counts range: 494 (max) to 1 (min)
Distributed ALL 254555 users across 20 clients
Users per client: 12727 (with 15 clients getting +1 user)
Train partition sizes: [44353, 44290, 44657, 44907, 44696, 45843, 45801, 45619, 45069, 45639, 45821, 45311, 45779, 46056, 45625, 45984, 46428, 44737, 45540, 46497]
Test partition sizes: [14232, 14235, 14266, 14217, 14238, 14373, 14346, 14334, 14294, 14373, 14344, 14302, 14354, 14362, 14320, 14395, 14389, 14257, 14251, 14399]
  Client 0: 44353 train samples, 2 unique classes
  Client 1: 44290 train samples, 2 unique classes
  Client 2: 44657 train samples, 2 unique classes
  Client 3: 44907 train samples, 2 unique classes
  Client 4: 44696 train samples, 2 unique classes
  Client 5: 45843 train samples, 2 unique classes
  Client 6: 45801 train samples, 2 unique classes
  Client 7: 45619 train samples, 2 unique classes
  Client 8: 45069 train samples, 2 unique classes
  Client 9: 45639 train samples, 2 unique classes
  Client 10: 45821 train samples, 2 unique classes
  Client 11: 45311 train samples, 2 unique classes
  Client 12: 45779 train samples, 2 unique classes
  Client 13: 46056 train samples, 2 unique classes
  Client 14: 45625 train samples, 2 unique classes
  Client 15: 45984 train samples, 2 unique classes
  Client 16: 46428 train samples, 2 unique classes
  Client 17: 44737 train samples, 2 unique classes
  Client 18: 45540 train samples, 2 unique classes
  Client 19: 46497 train samples, 2 unique classes
Will sample 4500 samples per client per epoch
Graph: ring, nodes: 20, edges: 20
Degree statistics: avg=2.00, min=2, max=2
Attack: Compromised 2/20 nodes: [5, 13]
Attack type: directed_deviation, lambda: 1.0
Model variant: baseline
Model parameters: 1,174,986
UBAR ALGORITHM (Two-Stage Byzantine-resilient)
  - Model dimension: 1,174,986 parameters
  - Rho parameter: 0.9
  - Stage 1: Distance-based filtering (select 90% closest neighbors)
  - Stage 2: Performance-based selection (loss comparison)
  - Complexity: O(deg(i)×d + deg(i)×inference)
Initial test acc across nodes: mean=0.4965 ± 0.0152
Round 001: test acc mean=0.5276 ± 0.0182 | min=0.4927 max=0.5627
         : test loss mean=0.6913 ± 0.0014
         : individual accs = ['0.548974', '0.523147', '0.537852', '0.515017', '0.517980', '0.517846', '0.562666', '0.553858', '0.511613', '0.526473', '0.522170', '0.533562', '0.505713', '0.549993', '0.524860', '0.525252', '0.539648', '0.492670', '0.498842', '0.543649']
         : correct/total = [(7813, 14232), (7447, 14235), (7673, 14266), (7322, 14217), (7375, 14238), (7443, 14373), (8072, 14346), (7939, 14334), (7313, 14294), (7567, 14373), (7490, 14344), (7631, 14302), (7259, 14354), (7899, 14362), (7516, 14320), (7561, 14395), (7765, 14389), (7024, 14257), (7109, 14251), (7828, 14399)]
         : compromised: 0.5339, honest: 0.5269
         : ubar stats = ['Node 0: s1=0.500, s2=1.000', 'Node 1: s1=0.500, s2=1.000', 'Node 2: s1=0.500, s2=1.000']...
Round 002: test acc mean=0.5706 ± 0.0234 | min=0.5268 max=0.6080
         : test loss mean=0.6831 ± 0.0064
         : individual accs = ['0.592397', '0.565227', '0.570517', '0.560245', '0.559559', '0.559800', '0.608044', '0.605135', '0.573317', '0.559939', '0.602552', '0.600266', '0.589034', '0.549715', '0.543715', '0.550538', '0.571617', '0.534544', '0.526840', '0.588791']
         : correct/total = [(8431, 14232), (8046, 14235), (8139, 14266), (7965, 14217), (7967, 14238), (8046, 14373), (8723, 14346), (8674, 14334), (8195, 14294), (8048, 14373), (8643, 14344), (8585, 14302), (8455, 14354), (7895, 14362), (7786, 14320), (7925, 14395), (8225, 14389), (7621, 14257), (7508, 14251), (8478, 14399)]
         : compromised: 0.5548, honest: 0.5723
         : ubar stats = ['Node 0: s1=0.500, s2=1.000', 'Node 1: s1=0.500, s2=1.000', 'Node 2: s1=0.500, s2=1.000']...
Round 003: test acc mean=0.5974 ± 0.0179 | min=0.5430 max=0.6175
         : test loss mean=0.6695 ± 0.0098
         : individual accs = ['0.614741', '0.604004', '0.542969', '0.602096', '0.600014', '0.594865', '0.615154', '0.615739', '0.606268', '0.595561', '0.610569', '0.610264', '0.614533', '0.586269', '0.589944', '0.592358', '0.575509', '0.581399', '0.578907', '0.617473']
         : correct/total = [(8749, 14232), (8598, 14235), (7746, 14266), (8560, 14217), (8543, 14238), (8550, 14373), (8825, 14346), (8826, 14334), (8666, 14294), (8560, 14373), (8758, 14344), (8728, 14302), (8821, 14354), (8420, 14362), (8448, 14320), (8527, 14395), (8281, 14389), (8289, 14257), (8250, 14251), (8891, 14399)]
         : compromised: 0.5906, honest: 0.5982
         : ubar stats = ['Node 0: s1=0.500, s2=1.000', 'Node 1: s1=0.500, s2=1.000', 'Node 2: s1=0.500, s2=1.000']...
Round 004: test acc mean=0.6165 ± 0.0115 | min=0.5898 max=0.6305
         : test loss mean=0.6553 ± 0.0103
         : individual accs = ['0.624578', '0.622410', '0.589794', '0.615742', '0.611252', '0.628400', '0.624843', '0.624320', '0.621380', '0.630488', '0.619423', '0.626975', '0.625331', '0.612519', '0.611522', '0.612713', '0.594968', '0.604685', '0.599747', '0.629071']
         : correct/total = [(8889, 14232), (8860, 14235), (8414, 14266), (8754, 14217), (8703, 14238), (9032, 14373), (8964, 14346), (8949, 14334), (8882, 14294), (9062, 14373), (8885, 14344), (8967, 14302), (8976, 14354), (8797, 14362), (8757, 14320), (8820, 14395), (8561, 14389), (8621, 14257), (8547, 14251), (9058, 14399)]
         : compromised: 0.6205, honest: 0.6161
         : ubar stats = ['Node 0: s1=0.500, s2=1.000', 'Node 1: s1=0.500, s2=1.000', 'Node 2: s1=0.500, s2=1.000']...
Round 005: test acc mean=0.6248 ± 0.0112 | min=0.6031 max=0.6383
         : test loss mean=0.6472 ± 0.0080
         : individual accs = ['0.627670', '0.630980', '0.605636', '0.631990', '0.631128', '0.638280', '0.634253', '0.632412', '0.628585', '0.633201', '0.626952', '0.635156', '0.637314', '0.620387', '0.615712', '0.620632', '0.603725', '0.608754', '0.603116', '0.629766']
         : correct/total = [(8933, 14232), (8982, 14235), (8640, 14266), (8985, 14217), (8986, 14238), (9174, 14373), (9099, 14346), (9065, 14334), (8985, 14294), (9101, 14373), (8993, 14344), (9084, 14302), (9148, 14354), (8910, 14362), (8817, 14320), (8934, 14395), (8687, 14389), (8679, 14257), (8595, 14251), (9068, 14399)]
         : compromised: 0.6293, honest: 0.6243
         : ubar stats = ['Node 0: s1=0.500, s2=1.000', 'Node 1: s1=0.500, s2=1.000', 'Node 2: s1=0.500, s2=1.000']...
Round 006: test acc mean=0.6318 ± 0.0090 | min=0.6116 max=0.6425
         : test loss mean=0.6412 ± 0.0068
         : individual accs = ['0.635821', '0.638637', '0.629959', '0.638320', '0.636185', '0.638211', '0.639900', '0.637296', '0.627326', '0.642246', '0.630577', '0.642498', '0.634457', '0.634522', '0.616341', '0.627857', '0.611578', '0.620958', '0.614974', '0.638030']
         : correct/total = [(9049, 14232), (9091, 14235), (8987, 14266), (9075, 14217), (9058, 14238), (9173, 14373), (9180, 14346), (9135, 14334), (8967, 14294), (9231, 14373), (9045, 14344), (9189, 14302), (9107, 14354), (9113, 14362), (8826, 14320), (9038, 14395), (8800, 14389), (8853, 14257), (8764, 14251), (9187, 14399)]
         : compromised: 0.6364, honest: 0.6313
         : ubar stats = ['Node 0: s1=0.500, s2=1.000', 'Node 1: s1=0.500, s2=1.000', 'Node 2: s1=0.500, s2=1.000']...
Round 007: test acc mean=0.6365 ± 0.0081 | min=0.6213 max=0.6471
         : test loss mean=0.6383 ± 0.0060
         : individual accs = ['0.644323', '0.638918', '0.621337', '0.646198', '0.644192', '0.641620', '0.639342', '0.632831', '0.628655', '0.646629', '0.634063', '0.638093', '0.644559', '0.638490', '0.633450', '0.637305', '0.623462', '0.626569', '0.623044', '0.647059']
         : correct/total = [(9170, 14232), (9095, 14235), (8864, 14266), (9187, 14217), (9172, 14238), (9222, 14373), (9172, 14346), (9071, 14334), (8986, 14294), (9294, 14373), (9095, 14344), (9126, 14302), (9252, 14354), (9170, 14362), (9071, 14320), (9174, 14395), (8971, 14389), (8933, 14257), (8879, 14251), (9317, 14399)]
         : compromised: 0.6401, honest: 0.6361
         : ubar stats = ['Node 0: s1=0.500, s2=1.000', 'Node 1: s1=0.500, s2=1.000', 'Node 2: s1=0.500, s2=1.000']...
Round 008: test acc mean=0.6404 ± 0.0064 | min=0.6262 max=0.6498
         : test loss mean=0.6343 ± 0.0049
         : individual accs = ['0.643761', '0.641096', '0.636619', '0.646972', '0.643630', '0.644055', '0.642688', '0.636529', '0.641808', '0.649830', '0.637967', '0.643826', '0.648530', '0.640162', '0.637779', '0.643209', '0.626173', '0.629585', '0.627535', '0.646920']
         : correct/total = [(9162, 14232), (9126, 14235), (9082, 14266), (9198, 14217), (9164, 14238), (9257, 14373), (9220, 14346), (9124, 14334), (9174, 14294), (9340, 14373), (9151, 14344), (9208, 14302), (9309, 14354), (9194, 14362), (9133, 14320), (9259, 14395), (9010, 14389), (8976, 14257), (8943, 14251), (9315, 14399)]
         : compromised: 0.6421, honest: 0.6402
         : ubar stats = ['Node 0: s1=0.500, s2=1.000', 'Node 1: s1=0.500, s2=1.000', 'Node 2: s1=0.500, s2=1.000']...
Round 009: test acc mean=0.6437 ± 0.0068 | min=0.6296 max=0.6538
         : test loss mean=0.6314 ± 0.0050
         : individual accs = ['0.648679', '0.648472', '0.642857', '0.643103', '0.645526', '0.644959', '0.645128', '0.644551', '0.644816', '0.651917', '0.644730', '0.649000', '0.653825', '0.641624', '0.639316', '0.643487', '0.629648', '0.630147', '0.630061', '0.652129']
         : correct/total = [(9232, 14232), (9231, 14235), (9171, 14266), (9143, 14217), (9191, 14238), (9270, 14373), (9255, 14346), (9239, 14334), (9217, 14294), (9370, 14373), (9248, 14344), (9282, 14302), (9385, 14354), (9215, 14362), (9155, 14320), (9263, 14395), (9060, 14389), (8984, 14257), (8979, 14251), (9390, 14399)]
         : compromised: 0.6433, honest: 0.6437
         : ubar stats = ['Node 0: s1=0.500, s2=1.000', 'Node 1: s1=0.500, s2=1.000', 'Node 2: s1=0.500, s2=1.000']...
Round 010: test acc mean=0.6465 ± 0.0064 | min=0.6313 max=0.6565
         : test loss mean=0.6293 ± 0.0048
         : individual accs = ['0.651560', '0.652195', '0.643418', '0.651966', '0.651636', '0.646351', '0.646452', '0.645179', '0.651042', '0.654769', '0.641941', '0.646343', '0.656472', '0.645871', '0.642877', '0.646822', '0.631316', '0.634565', '0.638271', '0.651851']
         : correct/total = [(9273, 14232), (9284, 14235), (9179, 14266), (9269, 14217), (9278, 14238), (9290, 14373), (9274, 14346), (9248, 14334), (9306, 14294), (9411, 14373), (9208, 14344), (9244, 14302), (9423, 14354), (9276, 14362), (9206, 14320), (9311, 14395), (9084, 14389), (9047, 14257), (9096, 14251), (9386, 14399)]
         : compromised: 0.6461, honest: 0.6466
         : ubar stats = ['Node 0: s1=0.500, s2=1.000', 'Node 1: s1=0.500, s2=1.000', 'Node 2: s1=0.500, s2=1.000']...

=== FINAL RESULTS ===
Dataset: sent140, Nodes: 20, Graph: ring, Aggregation: ubar
Attack: directed_deviation, 10.0% compromised
Final accuracy - Compromised: 0.6461, Honest: 0.6466
Overall test accuracy: mean=0.6465 ± 0.0064

=== UBAR SUMMARY ===
Node 0: stage1=0.500, stage2=1.000, overall=0.500
Node 1: stage1=0.500, stage2=1.000, overall=0.500
Node 2: stage1=0.500, stage2=1.000, overall=0.500
Node 3: stage1=0.500, stage2=1.000, overall=0.500
Node 4: stage1=0.500, stage2=1.000, overall=0.500
Node 5: stage1=0.500, stage2=1.000, overall=0.500
Node 6: stage1=0.500, stage2=1.000, overall=0.500
Node 7: stage1=0.500, stage2=1.000, overall=0.500
Node 8: stage1=0.500, stage2=1.000, overall=0.500
Node 9: stage1=0.500, stage2=1.000, overall=0.500
Node 10: stage1=0.500, stage2=1.000, overall=0.500
Node 11: stage1=0.500, stage2=1.000, overall=0.500
Node 12: stage1=0.500, stage2=1.000, overall=0.500
Node 13: stage1=0.500, stage2=1.000, overall=0.500
Node 14: stage1=0.500, stage2=1.000, overall=0.500
Node 15: stage1=0.500, stage2=1.000, overall=0.500
Node 16: stage1=0.500, stage2=1.000, overall=0.500
Node 17: stage1=0.500, stage2=1.000, overall=0.500
Node 18: stage1=0.500, stage2=1.000, overall=0.500
Node 19: stage1=0.500, stage2=1.000, overall=0.500

=== PARALLEL EXECUTION TIME (realistic for distributed system) ===
  COMMUNICATION (max across nodes):
    - Full model transfer: 0.000s (0.0%)
  COMPUTATION (max across nodes):
    - Distance computation: 0.024s (62.2%)
    - Loss computation: 0.011s (29.0%)
    - Aggregation: 0.003s (8.8%)
  TOTALS:
    - Total computation: 0.039s (100.0%)
    - Total communication: 0.000s (0.0%)
    - Total parallel time: 0.039s

=== PER-NODE AVERAGE TIME ===
  - Distance computation: 0.009s
  - Loss computation: 0.008s
  - Aggregation: 0.003s
  - Model transfer: 0.000s
  - Total per node: 0.021s

=== TOTAL COMPUTATIONAL WORK (sum across all nodes) ===
  - Total distance computation: 0.185s
  - Total loss computation: 0.166s
  - Total aggregation: 0.064s
  - Total model transfer: 0.000s
  - Grand total: 0.415s
  - Mean Stage 1 acceptance rate: 0.500
  - Mean Stage 2 acceptance rate: 1.000
  - Overall acceptance rate: 0.500

UBAR Algorithm Properties:
  - Model dimension: 1,174,986
  - Rho parameter: 0.9
  - Two-stage approach: Distance filtering + loss evaluation
  - Stage 1 selects: 90% of neighbors
  - Stage 2 uses: Training sample loss comparison
  - Theoretical complexity: O(deg(i)×d + deg(i)×inference)
  - Approach: UBAR paper implementation
