Device: cuda
Seed: 987654321
Loading 1 LEAF Sent140 train files...
LEAF Sent140 train: 254555 users, 908652 samples
Building vocabulary (max_size=10000)...
Vocabulary size: 10000
Loading 1 LEAF Sent140 test files...
LEAF Sent140 test: 254555 users, 286281 samples
Found 254555 train users, 254555 test users, 254555 common users
User sample counts range: 494 (max) to 1 (min)
Distributed ALL 254555 users across 20 clients
Users per client: 12727 (with 15 clients getting +1 user)
Train partition sizes: [44353, 44290, 44657, 44907, 44696, 45843, 45801, 45619, 45069, 45639, 45821, 45311, 45779, 46056, 45625, 45984, 46428, 44737, 45540, 46497]
Test partition sizes: [14232, 14235, 14266, 14217, 14238, 14373, 14346, 14334, 14294, 14373, 14344, 14302, 14354, 14362, 14320, 14395, 14389, 14257, 14251, 14399]
  Client 0: 44353 train samples, 2 unique classes
  Client 1: 44290 train samples, 2 unique classes
  Client 2: 44657 train samples, 2 unique classes
  Client 3: 44907 train samples, 2 unique classes
  Client 4: 44696 train samples, 2 unique classes
  Client 5: 45843 train samples, 2 unique classes
  Client 6: 45801 train samples, 2 unique classes
  Client 7: 45619 train samples, 2 unique classes
  Client 8: 45069 train samples, 2 unique classes
  Client 9: 45639 train samples, 2 unique classes
  Client 10: 45821 train samples, 2 unique classes
  Client 11: 45311 train samples, 2 unique classes
  Client 12: 45779 train samples, 2 unique classes
  Client 13: 46056 train samples, 2 unique classes
  Client 14: 45625 train samples, 2 unique classes
  Client 15: 45984 train samples, 2 unique classes
  Client 16: 46428 train samples, 2 unique classes
  Client 17: 44737 train samples, 2 unique classes
  Client 18: 45540 train samples, 2 unique classes
  Client 19: 46497 train samples, 2 unique classes
Will sample 4500 samples per client per epoch
Graph: erdos, nodes: 20, edges: 48
Degree statistics: avg=4.80, min=2, max=7
Attack: Compromised 14/20 nodes: [1, 2, 3, 5, 6, 8, 11, 12, 13, 14, 15, 17, 18, 19]
Attack type: gaussian, lambda: 1.0
Model variant: baseline
Model parameters: 1,174,986
BALANCE algorithm:
Balance Config: BALANCEConfig(gamma=2, kappa=1, alpha=0.5, min_neighbors=1)
  - Model dimension: 1,174,986 parameters
  - Complexity: O(N×d) = O(20×1,174,986)
Initial test acc across nodes: mean=0.4953 ± 0.0174
Round 001: test acc mean=0.5592 ± 0.0322 | min=0.4962 max=0.6145
         : test loss mean=56.0535 ± 241.3297
         : individual accs = ['0.578415', '0.533685', '0.571008', '0.496237', '0.597907', '0.569749', '0.533389', '0.594112', '0.554289', '0.591526', '0.567973', '0.527758', '0.593214', '0.504526', '0.527025', '0.614519', '0.572938', '0.581188', '0.533647', '0.540038']
         : correct/total = [(8232, 14232), (7597, 14235), (8146, 14266), (7055, 14217), (8513, 14238), (8189, 14373), (7652, 14346), (8516, 14334), (7923, 14294), (8502, 14373), (8147, 14344), (7548, 14302), (8515, 14354), (7246, 14362), (7547, 14320), (8846, 14395), (8244, 14389), (8286, 14257), (7605, 14251), (7776, 14399)]
         : compromised: 0.5486, honest: 0.5838
Round 002: test acc mean=0.6079 ± 0.0409 | min=0.4931 max=0.6405
         : test loss mean=25.7440 ± 109.3295
         : individual accs = ['0.624016', '0.538040', '0.629328', '0.625659', '0.639697', '0.634384', '0.622055', '0.640226', '0.614663', '0.629931', '0.633296', '0.552161', '0.560750', '0.493107', '0.631075', '0.634109', '0.629161', '0.563443', '0.622833', '0.640531']
         : correct/total = [(8881, 14232), (7659, 14235), (8978, 14266), (8895, 14217), (9108, 14238), (9118, 14373), (8924, 14346), (9177, 14334), (8786, 14294), (9054, 14373), (9084, 14344), (7897, 14302), (8049, 14354), (7082, 14362), (9037, 14320), (9128, 14395), (9053, 14389), (8033, 14257), (8876, 14251), (9223, 14399)]
         : compromised: 0.5973, honest: 0.6327
Round 003: test acc mean=0.6160 ± 0.0375 | min=0.4942 max=0.6415
         : test loss mean=13.2337 ± 54.8470
         : individual accs = ['0.637507', '0.540288', '0.624282', '0.636562', '0.641452', '0.629931', '0.625958', '0.639040', '0.638380', '0.640367', '0.618726', '0.583695', '0.579978', '0.494151', '0.640852', '0.620215', '0.636250', '0.627692', '0.634061', '0.631155']
         : correct/total = [(9073, 14232), (7691, 14235), (8906, 14266), (9050, 14217), (9133, 14238), (9054, 14373), (8980, 14346), (9160, 14334), (9125, 14294), (9204, 14373), (8875, 14344), (8348, 14302), (8325, 14354), (7097, 14362), (9177, 14320), (8928, 14395), (9155, 14389), (8949, 14257), (9036, 14251), (9088, 14399)]
         : compromised: 0.6077, honest: 0.6356
Round 004: test acc mean=0.6349 ± 0.0332 | min=0.4944 max=0.6526
         : test loss mean=17.7623 ± 74.6402
         : individual accs = ['0.650646', '0.615666', '0.638581', '0.638883', '0.641312', '0.646907', '0.643106', '0.652574', '0.650483', '0.644611', '0.647239', '0.638372', '0.636896', '0.494360', '0.638547', '0.641403', '0.645771', '0.646279', '0.635815', '0.650115']
         : correct/total = [(9260, 14232), (8764, 14235), (9110, 14266), (9083, 14217), (9131, 14238), (9298, 14373), (9226, 14346), (9354, 14334), (9298, 14294), (9265, 14373), (9284, 14344), (9130, 14302), (9142, 14354), (7100, 14362), (9144, 14320), (9233, 14395), (9292, 14389), (9214, 14257), (9061, 14251), (9361, 14399)]
         : compromised: 0.6297, honest: 0.6470
Round 005: test acc mean=0.6397 ± 0.0359 | min=0.4844 max=0.6556
         : test loss mean=13.9262 ± 57.9584
         : individual accs = ['0.651771', '0.638918', '0.646642', '0.650278', '0.655640', '0.649690', '0.648543', '0.652574', '0.655030', '0.643011', '0.646124', '0.638093', '0.648391', '0.484403', '0.646858', '0.645432', '0.650497', '0.648103', '0.642481', '0.651017']
         : correct/total = [(9276, 14232), (9095, 14235), (9225, 14266), (9245, 14217), (9335, 14238), (9338, 14373), (9304, 14346), (9354, 14334), (9363, 14294), (9242, 14373), (9268, 14344), (9126, 14302), (9307, 14354), (6957, 14362), (9263, 14320), (9291, 14395), (9360, 14389), (9240, 14257), (9156, 14251), (9374, 14399)]
         : compromised: 0.6353, honest: 0.6499
Round 006: test acc mean=0.6434 ± 0.0320 | min=0.5106 max=0.6610
         : test loss mean=10.9149 ± 44.8506
         : individual accs = ['0.660413', '0.646927', '0.649657', '0.645776', '0.653884', '0.654978', '0.652168', '0.655574', '0.660977', '0.654561', '0.652468', '0.613760', '0.655636', '0.510583', '0.657472', '0.642028', '0.651053', '0.652241', '0.645428', '0.653240']
         : correct/total = [(9399, 14232), (9209, 14235), (9268, 14266), (9181, 14217), (9310, 14238), (9414, 14373), (9356, 14346), (9397, 14334), (9448, 14294), (9408, 14373), (9359, 14344), (8778, 14302), (9411, 14354), (7333, 14362), (9415, 14320), (9242, 14395), (9368, 14389), (9299, 14257), (9198, 14251), (9406, 14399)]
         : compromised: 0.6386, honest: 0.6547
Round 007: test acc mean=0.6451 ± 0.0353 | min=0.4934 max=0.6613
         : test loss mean=93.5431 ± 405.0403
         : individual accs = ['0.661256', '0.648894', '0.647273', '0.654991', '0.650091', '0.648647', '0.649449', '0.653621', '0.660627', '0.657761', '0.659021', '0.640610', '0.660722', '0.493385', '0.655587', '0.647447', '0.654945', '0.657431', '0.644586', '0.655393']
         : correct/total = [(9411, 14232), (9237, 14235), (9234, 14266), (9312, 14217), (9256, 14238), (9323, 14373), (9317, 14346), (9369, 14334), (9443, 14294), (9454, 14373), (9453, 14344), (9162, 14302), (9484, 14354), (7086, 14362), (9388, 14320), (9320, 14395), (9424, 14389), (9373, 14257), (9186, 14251), (9437, 14399)]
         : compromised: 0.6404, honest: 0.6561
Round 008: test acc mean=0.6488 ± 0.0383 | min=0.4849 max=0.6655
         : test loss mean=45.9307 ± 197.5164
         : individual accs = ['0.660132', '0.657604', '0.656456', '0.659351', '0.651988', '0.665484', '0.660323', '0.662272', '0.664265', '0.660127', '0.657697', '0.654943', '0.664066', '0.484891', '0.658450', '0.658701', '0.655570', '0.655187', '0.629710', '0.659074']
         : correct/total = [(9395, 14232), (9361, 14235), (9365, 14266), (9374, 14217), (9283, 14238), (9565, 14373), (9473, 14346), (9493, 14334), (9495, 14294), (9488, 14373), (9434, 14344), (9367, 14302), (9532, 14354), (6964, 14362), (9429, 14320), (9482, 14395), (9433, 14389), (9341, 14257), (8974, 14251), (9490, 14399)]
         : compromised: 0.6449, honest: 0.6580
Round 009: test acc mean=0.6498 ± 0.0339 | min=0.5063 max=0.6713
         : test loss mean=84.1142 ± 363.9625
         : individual accs = ['0.654160', '0.671303', '0.648114', '0.656749', '0.659081', '0.666806', '0.637042', '0.664853', '0.648174', '0.645307', '0.657766', '0.659069', '0.668594', '0.506336', '0.668506', '0.659187', '0.660991', '0.653644', '0.656445', '0.654073']
         : correct/total = [(9310, 14232), (9556, 14235), (9246, 14266), (9337, 14217), (9384, 14238), (9584, 14373), (9139, 14346), (9530, 14334), (9265, 14294), (9275, 14373), (9435, 14344), (9426, 14302), (9597, 14354), (7272, 14362), (9573, 14320), (9489, 14395), (9511, 14389), (9319, 14257), (9355, 14251), (9418, 14399)]
         : compromised: 0.6467, honest: 0.6570
Round 010: test acc mean=0.6579 ± 0.0365 | min=0.5009 max=0.6743
         : test loss mean=46.2563 ± 198.9801
         : individual accs = ['0.673904', '0.670320', '0.665148', '0.658578', '0.668774', '0.669380', '0.670570', '0.667853', '0.672870', '0.669311', '0.662368', '0.663054', '0.674307', '0.500905', '0.670251', '0.660785', '0.668149', '0.661219', '0.647323', '0.661990']
         : correct/total = [(9591, 14232), (9542, 14235), (9489, 14266), (9363, 14217), (9522, 14238), (9621, 14373), (9620, 14346), (9573, 14334), (9618, 14294), (9620, 14373), (9501, 14344), (9483, 14302), (9679, 14354), (7194, 14362), (9598, 14320), (9512, 14395), (9614, 14389), (9427, 14257), (9225, 14251), (9532, 14399)]
         : compromised: 0.6533, honest: 0.6684

=== FINAL RESULTS ===
Dataset: sent140, Nodes: 20, Graph: erdos, Aggregation: balance
Attack: gaussian, 70.0% compromised
Final accuracy - Compromised: 0.6533, Honest: 0.6684
Overall test accuracy: mean=0.6579 ± 0.0365

=== BALANCE SUMMARY ===
Node 0: acceptance=0.333
Node 1: acceptance=0.250
Node 2: acceptance=0.200
Node 3: acceptance=0.250
Node 4: acceptance=0.250
Node 5: acceptance=0.200
Node 6: acceptance=0.200
Node 7: acceptance=0.400
Node 8: acceptance=0.500
Node 9: acceptance=0.333
Node 10: acceptance=0.250
Node 11: acceptance=0.214
Node 12: acceptance=0.343
Node 13: acceptance=0.500
Node 14: acceptance=0.143
Node 15: acceptance=0.167
Node 16: acceptance=0.200
Node 17: acceptance=0.460
Node 18: acceptance=0.250
Node 19: acceptance=0.500

=== PARALLEL EXECUTION TIME (realistic for distributed system) ===
  COMMUNICATION (max across nodes):
    - Full model transfer: 0.000s (0.0%)
  COMPUTATION (max across nodes):
    - Filtering: 0.035s (75.7%)
    - Aggregation: 0.011s (24.3%)
  TOTALS:
    - Total computation: 0.046s (100.0%)
    - Total communication: 0.000s (0.0%)
    - Total parallel time: 0.046s

=== PER-NODE AVERAGE TIME ===
  - Filtering: 0.022s
  - Aggregation: 0.005s
  - Model transfer: 0.000s
  - Total per node: 0.027s

=== TOTAL COMPUTATIONAL WORK (sum across all nodes) ===
  - Total filtering: 0.435s
  - Total aggregation: 0.097s
  - Total model transfer: 0.000s
  - Grand total: 0.533s
  - Mean acceptance rate: 0.297

BALANCE Algorithm Properties:
  - Model dimension: 1,174,986
  - No compression: Full parameter comparison
  - Theoretical complexity: O(deg(i)×d)
  - Approach: Full parameter filtering + averaging
