Device: cuda
Seed: 987654321
Loading 1 LEAF Sent140 train files...
LEAF Sent140 train: 254555 users, 908652 samples
Building vocabulary (max_size=10000)...
Vocabulary size: 10000
Loading 1 LEAF Sent140 test files...
LEAF Sent140 test: 254555 users, 286281 samples
Found 254555 train users, 254555 test users, 254555 common users
User sample counts range: 494 (max) to 1 (min)
Distributed ALL 254555 users across 20 clients
Users per client: 12727 (with 15 clients getting +1 user)
Train partition sizes: [44353, 44290, 44657, 44907, 44696, 45843, 45801, 45619, 45069, 45639, 45821, 45311, 45779, 46056, 45625, 45984, 46428, 44737, 45540, 46497]
Test partition sizes: [14232, 14235, 14266, 14217, 14238, 14373, 14346, 14334, 14294, 14373, 14344, 14302, 14354, 14362, 14320, 14395, 14389, 14257, 14251, 14399]
  Client 0: 44353 train samples, 2 unique classes
  Client 1: 44290 train samples, 2 unique classes
  Client 2: 44657 train samples, 2 unique classes
  Client 3: 44907 train samples, 2 unique classes
  Client 4: 44696 train samples, 2 unique classes
  Client 5: 45843 train samples, 2 unique classes
  Client 6: 45801 train samples, 2 unique classes
  Client 7: 45619 train samples, 2 unique classes
  Client 8: 45069 train samples, 2 unique classes
  Client 9: 45639 train samples, 2 unique classes
  Client 10: 45821 train samples, 2 unique classes
  Client 11: 45311 train samples, 2 unique classes
  Client 12: 45779 train samples, 2 unique classes
  Client 13: 46056 train samples, 2 unique classes
  Client 14: 45625 train samples, 2 unique classes
  Client 15: 45984 train samples, 2 unique classes
  Client 16: 46428 train samples, 2 unique classes
  Client 17: 44737 train samples, 2 unique classes
  Client 18: 45540 train samples, 2 unique classes
  Client 19: 46497 train samples, 2 unique classes
Will sample 4500 samples per client per epoch
Graph: erdos, nodes: 20, edges: 126
Degree statistics: avg=12.60, min=8, max=16
Attack: Compromised 8/20 nodes: [1, 5, 11, 12, 13, 14, 17, 18]
Attack type: backdoor, lambda: 1.0
Backdoor target label: 1, trigger size: 3
Model variant: baseline
Model parameters: 1,174,986
Initial test acc across nodes: mean=0.4953 ± 0.0174
Backdoor attack: Created poisoned datasets for 8 compromised nodes
Round 001: test acc mean=0.4996 ± 0.0053 | min=0.4922 max=0.5104
         : test loss mean=20.4845 ± 8.7756
         : individual accs = ['0.510399', '0.499824', '0.507851', '0.506436', '0.494662', '0.499269', '0.502719', '0.497070', '0.506576', '0.494538', '0.501603', '0.504195', '0.500418', '0.493942', '0.492179', '0.497117', '0.492738', '0.500736', '0.494842', '0.494618']
         : correct/total = [(7264, 14232), (7115, 14235), (7245, 14266), (7200, 14217), (7043, 14238), (7176, 14373), (7212, 14346), (7125, 14334), (7241, 14294), (7108, 14373), (7195, 14344), (7211, 14302), (7183, 14354), (7094, 14362), (7048, 14320), (7156, 14395), (7090, 14389), (7139, 14257), (7052, 14251), (7122, 14399)]
         : compromised: 0.4982, honest: 0.5005
Round 002: test acc mean=0.4965 ± 0.0092 | min=0.4841 max=0.5175
         : test loss mean=17.3439 ± 11.2369
         : individual accs = ['0.500562', '0.517527', '0.489696', '0.484139', '0.491291', '0.495512', '0.504461', '0.491559', '0.490276', '0.505740', '0.490170', '0.495175', '0.485788', '0.512533', '0.485615', '0.496144', '0.485301', '0.501438', '0.504526', '0.502396']
         : correct/total = [(7124, 14232), (7367, 14235), (6986, 14266), (6883, 14217), (6995, 14238), (7122, 14373), (7237, 14346), (7046, 14334), (7008, 14294), (7269, 14373), (7031, 14344), (7082, 14302), (6973, 14354), (7361, 14362), (6954, 14320), (7142, 14395), (6983, 14389), (7149, 14257), (7190, 14251), (7234, 14399)]
         : compromised: 0.4998, honest: 0.4943
Round 003: test acc mean=0.5023 ± 0.0078 | min=0.4874 max=0.5120
         : test loss mean=14.4772 ± 12.3720
         : individual accs = ['0.496346', '0.487741', '0.497827', '0.503974', '0.510465', '0.512002', '0.492751', '0.509488', '0.490695', '0.508384', '0.496863', '0.506852', '0.508012', '0.508773', '0.506425', '0.487391', '0.504969', '0.504594', '0.511894', '0.499965']
         : correct/total = [(7064, 14232), (6943, 14235), (7102, 14266), (7165, 14217), (7268, 14238), (7359, 14373), (7069, 14346), (7303, 14334), (7014, 14294), (7307, 14373), (7127, 14344), (7249, 14302), (7292, 14354), (7307, 14362), (7252, 14320), (7016, 14395), (7266, 14389), (7194, 14257), (7295, 14251), (7199, 14399)]
         : compromised: 0.5058, honest: 0.4999
Round 004: test acc mean=0.5028 ± 0.0059 | min=0.4891 max=0.5123
         : test loss mean=23.9296 ± 11.0099
         : individual accs = ['0.504075', '0.512259', '0.512197', '0.489062', '0.502880', '0.500939', '0.506831', '0.503698', '0.509794', '0.494956', '0.502858', '0.498182', '0.507315', '0.506545', '0.501187', '0.503508', '0.500174', '0.491969', '0.502210', '0.505868']
         : correct/total = [(7174, 14232), (7292, 14235), (7307, 14266), (6953, 14217), (7160, 14238), (7200, 14373), (7271, 14346), (7220, 14334), (7287, 14294), (7114, 14373), (7213, 14344), (7125, 14302), (7282, 14354), (7275, 14362), (7177, 14320), (7248, 14395), (7197, 14389), (7014, 14257), (7157, 14251), (7284, 14399)]
         : compromised: 0.5026, honest: 0.5030
Round 005: test acc mean=0.4975 ± 0.0072 | min=0.4821 max=0.5138
         : test loss mean=16.9111 ± 5.3384
         : individual accs = ['0.495644', '0.513804', '0.490046', '0.487867', '0.495505', '0.497948', '0.504043', '0.495396', '0.498811', '0.482084', '0.487730', '0.495595', '0.502438', '0.505640', '0.491830', '0.504828', '0.498367', '0.496528', '0.501438', '0.503854']
         : correct/total = [(7054, 14232), (7314, 14235), (6991, 14266), (6936, 14217), (7055, 14238), (7157, 14373), (7231, 14346), (7101, 14334), (7130, 14294), (6929, 14373), (6996, 14344), (7088, 14302), (7212, 14354), (7262, 14362), (7043, 14320), (7267, 14395), (7171, 14389), (7079, 14257), (7146, 14251), (7255, 14399)]
         : compromised: 0.5007, honest: 0.4953
Round 006: test acc mean=0.4885 ± 0.0073 | min=0.4780 max=0.5059
         : test loss mean=24.1970 ± 7.1821
         : individual accs = ['0.483488', '0.485634', '0.491588', '0.483928', '0.494732', '0.489459', '0.480413', '0.478024', '0.494473', '0.480763', '0.505856', '0.485247', '0.487808', '0.501532', '0.484777', '0.481626', '0.491000', '0.498141', '0.482422', '0.488228']
         : correct/total = [(6881, 14232), (6913, 14235), (7013, 14266), (6880, 14217), (7044, 14238), (7035, 14373), (6892, 14346), (6852, 14334), (7068, 14294), (6910, 14373), (7256, 14344), (6940, 14302), (7002, 14354), (7203, 14362), (6942, 14320), (6933, 14395), (7065, 14389), (7102, 14257), (6875, 14251), (7030, 14399)]
         : compromised: 0.4894, honest: 0.4878
Round 007: test acc mean=0.4962 ± 0.0059 | min=0.4852 max=0.5076
         : test loss mean=74.6010 ± 22.2462
         : individual accs = ['0.495995', '0.487250', '0.487593', '0.490469', '0.485181', '0.495025', '0.505786', '0.497209', '0.500210', '0.498713', '0.495678', '0.500140', '0.502996', '0.507589', '0.492737', '0.493991', '0.493710', '0.494634', '0.496737', '0.502952']
         : correct/total = [(7059, 14232), (6936, 14235), (6956, 14266), (6973, 14217), (6908, 14238), (7115, 14373), (7256, 14346), (7127, 14334), (7150, 14294), (7168, 14373), (7110, 14344), (7153, 14302), (7220, 14354), (7290, 14362), (7056, 14320), (7111, 14395), (7104, 14389), (7052, 14257), (7079, 14251), (7242, 14399)]
         : compromised: 0.4971, honest: 0.4956
Round 008: test acc mean=0.4988 ± 0.0053 | min=0.4918 max=0.5109
         : test loss mean=135.6493 ± 43.0464
         : individual accs = ['0.501686', '0.504391', '0.495093', '0.510938', '0.502107', '0.502539', '0.493169', '0.499860', '0.493983', '0.500383', '0.507948', '0.504405', '0.495820', '0.491923', '0.500419', '0.495172', '0.493780', '0.491829', '0.496527', '0.494548']
         : correct/total = [(7140, 14232), (7180, 14235), (7063, 14266), (7264, 14217), (7149, 14238), (7223, 14373), (7075, 14346), (7165, 14334), (7061, 14294), (7192, 14373), (7286, 14344), (7214, 14302), (7117, 14354), (7065, 14362), (7166, 14320), (7128, 14395), (7105, 14389), (7012, 14257), (7076, 14251), (7121, 14399)]
         : compromised: 0.4985, honest: 0.4991
Round 009: test acc mean=0.4976 ± 0.0063 | min=0.4873 max=0.5127
         : test loss mean=99.8020 ± 38.6897
         : individual accs = ['0.502530', '0.490060', '0.503224', '0.512696', '0.495926', '0.497043', '0.488080', '0.496372', '0.504967', '0.502957', '0.498118', '0.491749', '0.495332', '0.487328', '0.489385', '0.498784', '0.499826', '0.502771', '0.493720', '0.501493']
         : correct/total = [(7152, 14232), (6976, 14235), (7179, 14266), (7289, 14217), (7061, 14238), (7144, 14373), (7002, 14346), (7115, 14334), (7218, 14294), (7229, 14373), (7145, 14344), (7033, 14302), (7110, 14354), (6999, 14362), (7008, 14320), (7180, 14395), (7192, 14389), (7168, 14257), (7036, 14251), (7221, 14399)]
         : compromised: 0.4934, honest: 0.5004
Round 010: test acc mean=0.4914 ± 0.0059 | min=0.4818 max=0.5052
         : test loss mean=41.4249 ± 10.5102
         : individual accs = ['0.487844', '0.490692', '0.490046', '0.481818', '0.486374', '0.483615', '0.489126', '0.495535', '0.498041', '0.495512', '0.492471', '0.491540', '0.505155', '0.497076', '0.495461', '0.499548', '0.491139', '0.486147', '0.485790', '0.484686']
         : correct/total = [(6943, 14232), (6985, 14235), (6991, 14266), (6850, 14217), (6925, 14238), (6951, 14373), (7017, 14346), (7103, 14334), (7119, 14294), (7122, 14373), (7064, 14344), (7030, 14302), (7251, 14354), (7139, 14362), (7095, 14320), (7191, 14395), (7067, 14389), (6931, 14257), (6923, 14251), (6979, 14399)]
         : compromised: 0.4919, honest: 0.4910

=== FINAL RESULTS ===
Dataset: sent140, Nodes: 20, Graph: erdos, Aggregation: krum
Attack: backdoor, 40.0% compromised
Final accuracy - Compromised: 0.4919, Honest: 0.4910
Overall test accuracy: mean=0.4914 ± 0.0059

=== BACKDOOR ATTACK SUCCESS RATE (ASR) ===
Target label: 1
Trigger size: 3x3
Overall ASR: 0.8184 ± 0.0891
Honest nodes ASR: 0.8120 ± 0.0847
Compromised nodes ASR: 0.8280 ± 0.0946
Note: Higher ASR indicates more successful backdoor attack
