Device: cuda
Seed: 987654321
Loading 1 LEAF Sent140 train files...
LEAF Sent140 train: 254555 users, 908652 samples
Building vocabulary (max_size=10000)...
Vocabulary size: 10000
Loading 1 LEAF Sent140 test files...
LEAF Sent140 test: 254555 users, 286281 samples
Found 254555 train users, 254555 test users, 254555 common users
User sample counts range: 494 (max) to 1 (min)
Distributed ALL 254555 users across 20 clients
Users per client: 12727 (with 15 clients getting +1 user)
Train partition sizes: [44353, 44290, 44657, 44907, 44696, 45843, 45801, 45619, 45069, 45639, 45821, 45311, 45779, 46056, 45625, 45984, 46428, 44737, 45540, 46497]
Test partition sizes: [14232, 14235, 14266, 14217, 14238, 14373, 14346, 14334, 14294, 14373, 14344, 14302, 14354, 14362, 14320, 14395, 14389, 14257, 14251, 14399]
  Client 0: 44353 train samples, 2 unique classes
  Client 1: 44290 train samples, 2 unique classes
  Client 2: 44657 train samples, 2 unique classes
  Client 3: 44907 train samples, 2 unique classes
  Client 4: 44696 train samples, 2 unique classes
  Client 5: 45843 train samples, 2 unique classes
  Client 6: 45801 train samples, 2 unique classes
  Client 7: 45619 train samples, 2 unique classes
  Client 8: 45069 train samples, 2 unique classes
  Client 9: 45639 train samples, 2 unique classes
  Client 10: 45821 train samples, 2 unique classes
  Client 11: 45311 train samples, 2 unique classes
  Client 12: 45779 train samples, 2 unique classes
  Client 13: 46056 train samples, 2 unique classes
  Client 14: 45625 train samples, 2 unique classes
  Client 15: 45984 train samples, 2 unique classes
  Client 16: 46428 train samples, 2 unique classes
  Client 17: 44737 train samples, 2 unique classes
  Client 18: 45540 train samples, 2 unique classes
  Client 19: 46497 train samples, 2 unique classes
Will sample 4500 samples per client per epoch
Graph: ring, nodes: 20, edges: 20
Degree statistics: avg=2.00, min=2, max=2
Attack: Compromised 8/20 nodes: [1, 5, 11, 12, 13, 14, 17, 18]
Attack type: backdoor, lambda: 1.0
Backdoor target label: 1, trigger size: 3
Model variant: baseline
Model parameters: 1,174,986
Initial test acc across nodes: mean=0.4965 ± 0.0152
Backdoor attack: Created poisoned datasets for 8 compromised nodes
Round 001: test acc mean=0.5037 ± 0.0098 | min=0.4860 max=0.5276
         : test loss mean=8.6883 ± 13.6643
         : individual accs = ['0.492411', '0.514787', '0.504276', '0.500035', '0.499438', '0.495512', '0.520912', '0.485977', '0.527564', '0.504905', '0.501603', '0.508390', '0.499791', '0.507520', '0.496299', '0.515457', '0.496212', '0.508452', '0.497018', '0.498437']
         : correct/total = [(7008, 14232), (7328, 14235), (7194, 14266), (7109, 14217), (7111, 14238), (7122, 14373), (7473, 14346), (6966, 14334), (7541, 14294), (7257, 14373), (7195, 14344), (7271, 14302), (7174, 14354), (7289, 14362), (7107, 14320), (7420, 14395), (7140, 14389), (7249, 14257), (7083, 14251), (7177, 14399)]
         : compromised: 0.5035, honest: 0.5039
Round 002: test acc mean=0.5037 ± 0.0065 | min=0.4885 max=0.5146
         : test loss mean=19.1022 ± 42.4043
         : individual accs = ['0.510821', '0.513031', '0.504626', '0.499191', '0.496348', '0.509497', '0.508016', '0.514581', '0.488457', '0.508036', '0.503625', '0.503216', '0.504946', '0.508077', '0.501397', '0.496283', '0.496490', '0.494774', '0.506210', '0.505521']
         : correct/total = [(7270, 14232), (7303, 14235), (7199, 14266), (7097, 14217), (7067, 14238), (7323, 14373), (7288, 14346), (7376, 14334), (6982, 14294), (7302, 14373), (7224, 14344), (7197, 14302), (7248, 14354), (7297, 14362), (7180, 14320), (7144, 14395), (7144, 14389), (7054, 14257), (7214, 14251), (7279, 14399)]
         : compromised: 0.5051, honest: 0.5027
Round 003: test acc mean=0.5056 ± 0.0096 | min=0.4877 max=0.5385
         : test loss mean=67.6262 ± 176.2787
         : individual accs = ['0.511383', '0.513312', '0.511636', '0.487726', '0.504706', '0.505601', '0.501603', '0.506976', '0.538478', '0.502052', '0.501673', '0.508880', '0.498189', '0.505083', '0.503561', '0.503369', '0.499687', '0.495967', '0.510982', '0.501493']
         : correct/total = [(7278, 14232), (7307, 14235), (7299, 14266), (6934, 14217), (7186, 14238), (7267, 14373), (7196, 14346), (7267, 14334), (7697, 14294), (7216, 14373), (7196, 14344), (7278, 14302), (7151, 14354), (7254, 14362), (7211, 14320), (7246, 14395), (7190, 14389), (7071, 14257), (7282, 14251), (7221, 14399)]
         : compromised: 0.5052, honest: 0.5059
Round 004: test acc mean=0.5052 ± 0.0057 | min=0.4946 max=0.5153
         : test loss mean=202.1420 ± 577.5459
         : individual accs = ['0.508361', '0.512961', '0.513599', '0.499050', '0.503371', '0.506088', '0.506552', '0.505302', '0.515251', '0.504279', '0.495538', '0.504125', '0.506827', '0.513508', '0.499860', '0.502813', '0.494614', '0.500807', '0.509719', '0.501285']
         : correct/total = [(7235, 14232), (7302, 14235), (7327, 14266), (7095, 14217), (7167, 14238), (7274, 14373), (7267, 14346), (7243, 14334), (7365, 14294), (7248, 14373), (7108, 14344), (7210, 14302), (7275, 14354), (7375, 14362), (7158, 14320), (7238, 14395), (7117, 14389), (7140, 14257), (7264, 14251), (7218, 14399)]
         : compromised: 0.5067, honest: 0.5042
Round 005: test acc mean=0.5072 ± 0.0067 | min=0.4974 max=0.5222
         : test loss mean=664.0195 ± 1953.9858
         : individual accs = ['0.515318', '0.514787', '0.513318', '0.500387', '0.497401', '0.502261', '0.503904', '0.511581', '0.499930', '0.509775', '0.505856', '0.514124', '0.510032', '0.522211', '0.497975', '0.505245', '0.497533', '0.508943', '0.508385', '0.504341']
         : correct/total = [(7334, 14232), (7328, 14235), (7323, 14266), (7114, 14217), (7082, 14238), (7219, 14373), (7229, 14346), (7333, 14334), (7146, 14294), (7327, 14373), (7256, 14344), (7353, 14302), (7321, 14354), (7500, 14362), (7131, 14320), (7273, 14395), (7159, 14389), (7256, 14257), (7245, 14251), (7262, 14399)]
         : compromised: 0.5098, honest: 0.5054
Round 006: test acc mean=0.5011 ± 0.0095 | min=0.4868 max=0.5264
         : test loss mean=5396.4590 ± 16152.6586
         : individual accs = ['0.503232', '0.491324', '0.511145', '0.493634', '0.506040', '0.506505', '0.504531', '0.486815', '0.526375', '0.501009', '0.494702', '0.503706', '0.495541', '0.504178', '0.502863', '0.503508', '0.489749', '0.496949', '0.486773', '0.514411']
         : correct/total = [(7162, 14232), (6994, 14235), (7292, 14266), (7018, 14217), (7205, 14238), (7280, 14373), (7238, 14346), (6978, 14334), (7524, 14294), (7201, 14373), (7096, 14344), (7204, 14302), (7113, 14354), (7241, 14362), (7201, 14320), (7248, 14395), (7047, 14389), (7085, 14257), (6937, 14251), (7407, 14399)]
         : compromised: 0.4985, honest: 0.5029
Round 007: test acc mean=0.5015 ± 0.0058 | min=0.4897 max=0.5105
         : test loss mean=32190.3837 ± 96535.8110
         : individual accs = ['0.502389', '0.499684', '0.510515', '0.489695', '0.495645', '0.499200', '0.509341', '0.504256', '0.504198', '0.505462', '0.495329', '0.510069', '0.494566', '0.497493', '0.498254', '0.500313', '0.498019', '0.497580', '0.510140', '0.507049']
         : correct/total = [(7150, 14232), (7113, 14235), (7283, 14266), (6962, 14217), (7057, 14238), (7175, 14373), (7307, 14346), (7228, 14334), (7207, 14294), (7265, 14373), (7105, 14344), (7295, 14302), (7099, 14354), (7145, 14362), (7135, 14320), (7202, 14395), (7166, 14389), (7094, 14257), (7270, 14251), (7301, 14399)]
         : compromised: 0.5009, honest: 0.5019
Round 008: test acc mean=0.5023 ± 0.0066 | min=0.4923 max=0.5194
         : test loss mean=276196.9593 ± 828658.3972
         : individual accs = ['0.498033', '0.506498', '0.505257', '0.504044', '0.506110', '0.497321', '0.504113', '0.514720', '0.499860', '0.502470', '0.494562', '0.501818', '0.508778', '0.519426', '0.500559', '0.494547', '0.495656', '0.496879', '0.503052', '0.492256']
         : correct/total = [(7088, 14232), (7210, 14235), (7208, 14266), (7166, 14217), (7206, 14238), (7148, 14373), (7232, 14346), (7378, 14334), (7145, 14294), (7222, 14373), (7094, 14344), (7177, 14302), (7303, 14354), (7460, 14362), (7168, 14320), (7119, 14395), (7132, 14389), (7084, 14257), (7169, 14251), (7088, 14399)]
         : compromised: 0.5043, honest: 0.5010
Round 009: test acc mean=0.4957 ± 0.0078 | min=0.4795 max=0.5120
         : test loss mean=2906596.4144 ± 8720110.4978
         : individual accs = ['0.488687', '0.494345', '0.487312', '0.503904', '0.494803', '0.497600', '0.491705', '0.498116', '0.511963', '0.499896', '0.504601', '0.495175', '0.500557', '0.491505', '0.496718', '0.481626', '0.490931', '0.501508', '0.504105', '0.479547']
         : correct/total = [(6955, 14232), (7037, 14235), (6952, 14266), (7164, 14217), (7045, 14238), (7152, 14373), (7054, 14346), (7140, 14334), (7318, 14294), (7185, 14373), (7238, 14344), (7082, 14302), (7185, 14354), (7059, 14362), (7113, 14320), (6933, 14395), (7064, 14389), (7150, 14257), (7184, 14251), (6905, 14399)]
         : compromised: 0.4977, honest: 0.4944
Round 010: test acc mean=0.4998 ± 0.0046 | min=0.4916 max=0.5095
         : test loss mean=17539345.0055 ± 52618444.8959
         : individual accs = ['0.500422', '0.503548', '0.491588', '0.497081', '0.493328', '0.493077', '0.501324', '0.502372', '0.504058', '0.499826', '0.500000', '0.501189', '0.502020', '0.509539', '0.501955', '0.502258', '0.506081', '0.493021', '0.496106', '0.497465']
         : correct/total = [(7122, 14232), (7168, 14235), (7013, 14266), (7067, 14217), (7024, 14238), (7087, 14373), (7192, 14346), (7201, 14334), (7205, 14294), (7184, 14373), (7172, 14344), (7168, 14302), (7206, 14354), (7318, 14362), (7188, 14320), (7230, 14395), (7282, 14389), (7029, 14257), (7070, 14251), (7163, 14399)]
         : compromised: 0.5001, honest: 0.4997

=== FINAL RESULTS ===
Dataset: sent140, Nodes: 20, Graph: ring, Aggregation: krum
Attack: backdoor, 40.0% compromised
Final accuracy - Compromised: 0.5001, Honest: 0.4997
Overall test accuracy: mean=0.4998 ± 0.0046

=== BACKDOOR ATTACK SUCCESS RATE (ASR) ===
Target label: 1
Trigger size: 3x3
Overall ASR: 0.7086 ± 0.2376
Honest nodes ASR: 0.6438 ± 0.2575
Compromised nodes ASR: 0.8058 ± 0.1612
Note: Higher ASR indicates more successful backdoor attack
