Device: cuda
Seed: 987654321
Loading 1 LEAF Sent140 train files...
LEAF Sent140 train: 254555 users, 908652 samples
Building vocabulary (max_size=10000)...
Vocabulary size: 10000
Loading 1 LEAF Sent140 test files...
LEAF Sent140 test: 254555 users, 286281 samples
Found 254555 train users, 254555 test users, 254555 common users
User sample counts range: 494 (max) to 1 (min)
Distributed ALL 254555 users across 20 clients
Users per client: 12727 (with 15 clients getting +1 user)
Train partition sizes: [44353, 44290, 44657, 44907, 44696, 45843, 45801, 45619, 45069, 45639, 45821, 45311, 45779, 46056, 45625, 45984, 46428, 44737, 45540, 46497]
Test partition sizes: [14232, 14235, 14266, 14217, 14238, 14373, 14346, 14334, 14294, 14373, 14344, 14302, 14354, 14362, 14320, 14395, 14389, 14257, 14251, 14399]
  Client 0: 44353 train samples, 2 unique classes
  Client 1: 44290 train samples, 2 unique classes
  Client 2: 44657 train samples, 2 unique classes
  Client 3: 44907 train samples, 2 unique classes
  Client 4: 44696 train samples, 2 unique classes
  Client 5: 45843 train samples, 2 unique classes
  Client 6: 45801 train samples, 2 unique classes
  Client 7: 45619 train samples, 2 unique classes
  Client 8: 45069 train samples, 2 unique classes
  Client 9: 45639 train samples, 2 unique classes
  Client 10: 45821 train samples, 2 unique classes
  Client 11: 45311 train samples, 2 unique classes
  Client 12: 45779 train samples, 2 unique classes
  Client 13: 46056 train samples, 2 unique classes
  Client 14: 45625 train samples, 2 unique classes
  Client 15: 45984 train samples, 2 unique classes
  Client 16: 46428 train samples, 2 unique classes
  Client 17: 44737 train samples, 2 unique classes
  Client 18: 45540 train samples, 2 unique classes
  Client 19: 46497 train samples, 2 unique classes
Will sample 4500 samples per client per epoch
Graph: erdos, nodes: 20, edges: 126
Degree statistics: avg=12.60, min=8, max=16
Attack: Compromised 10/20 nodes: [1, 2, 5, 11, 12, 13, 14, 15, 17, 18]
Attack type: directed_deviation, lambda: 1.0
Model variant: baseline
Model parameters: 1,174,986
BALANCE algorithm:
Balance Config: BALANCEConfig(gamma=2, kappa=1, alpha=0.5, min_neighbors=1)
  - Model dimension: 1,174,986 parameters
  - Complexity: O(N×d) = O(20×1,174,986)
Initial test acc across nodes: mean=0.4965 ± 0.0152
Round 001: test acc mean=0.5033 ± 0.0077 | min=0.4859 max=0.5158
         : test loss mean=1.6140 ± 0.5705
         : individual accs = ['0.496979', '0.485915', '0.513038', '0.510656', '0.495084', '0.489946', '0.504740', '0.496582', '0.506786', '0.509914', '0.515825', '0.505524', '0.504459', '0.505918', '0.502444', '0.510594', '0.510320', '0.505997', '0.494772', '0.501146']
         : correct/total = [(7073, 14232), (6917, 14235), (7319, 14266), (7260, 14217), (7049, 14238), (7042, 14373), (7241, 14346), (7118, 14334), (7244, 14294), (7329, 14373), (7399, 14344), (7230, 14302), (7241, 14354), (7266, 14362), (7195, 14320), (7350, 14395), (7343, 14389), (7214, 14257), (7051, 14251), (7216, 14399)]
         : compromised: 0.5019, honest: 0.5048
Round 002: test acc mean=0.5008 ± 0.0104 | min=0.4765 max=0.5167
         : test loss mean=0.7280 ± 0.0247
         : individual accs = ['0.484823', '0.505163', '0.504416', '0.511711', '0.505900', '0.498156', '0.510107', '0.485768', '0.516720', '0.516663', '0.505856', '0.506922', '0.476453', '0.495613', '0.503003', '0.502188', '0.487803', '0.499123', '0.504456', '0.495312']
         : correct/total = [(6900, 14232), (7191, 14235), (7196, 14266), (7275, 14217), (7203, 14238), (7160, 14373), (7318, 14346), (6963, 14334), (7386, 14294), (7426, 14373), (7256, 14344), (7250, 14302), (6839, 14354), (7118, 14362), (7203, 14320), (7229, 14395), (7019, 14389), (7116, 14257), (7189, 14251), (7132, 14399)]
         : compromised: 0.4995, honest: 0.5021
Round 003: test acc mean=0.5086 ± 0.0130 | min=0.4869 max=0.5478
         : test loss mean=0.7007 ± 0.0087
         : individual accs = ['0.506324', '0.510783', '0.516683', '0.506577', '0.505900', '0.495095', '0.509201', '0.504604', '0.509724', '0.547763', '0.501255', '0.515382', '0.487739', '0.523813', '0.514385', '0.504828', '0.506568', '0.497580', '0.486913', '0.521703']
         : correct/total = [(7206, 14232), (7271, 14235), (7371, 14266), (7202, 14217), (7203, 14238), (7116, 14373), (7305, 14346), (7233, 14334), (7286, 14294), (7873, 14373), (7190, 14344), (7371, 14302), (7001, 14354), (7523, 14362), (7366, 14320), (7267, 14395), (7289, 14389), (7094, 14257), (6939, 14251), (7512, 14399)]
         : compromised: 0.5053, honest: 0.5120
Round 004: test acc mean=0.5357 ± 0.0201 | min=0.4996 max=0.5686
         : test loss mean=0.6895 ± 0.0038
         : individual accs = ['0.541456', '0.541061', '0.525375', '0.521981', '0.563352', '0.520142', '0.568591', '0.567950', '0.517980', '0.564461', '0.512688', '0.549923', '0.530862', '0.525345', '0.529818', '0.499618', '0.528042', '0.507751', '0.545856', '0.552399']
         : correct/total = [(7706, 14232), (7702, 14235), (7495, 14266), (7421, 14217), (8021, 14238), (7476, 14373), (8157, 14346), (8141, 14334), (7404, 14294), (8113, 14373), (7354, 14344), (7865, 14302), (7620, 14354), (7545, 14362), (7587, 14320), (7192, 14395), (7598, 14389), (7239, 14257), (7779, 14251), (7954, 14399)]
         : compromised: 0.5276, honest: 0.5439
Round 005: test acc mean=0.5773 ± 0.0166 | min=0.5401 max=0.5994
         : test loss mean=0.6797 ± 0.0040
         : individual accs = ['0.575393', '0.595364', '0.571919', '0.561511', '0.594255', '0.544215', '0.598285', '0.599414', '0.562264', '0.582829', '0.569646', '0.556496', '0.540059', '0.588567', '0.582961', '0.589371', '0.583015', '0.581469', '0.585503', '0.582679']
         : correct/total = [(8189, 14232), (8475, 14235), (8159, 14266), (7983, 14217), (8461, 14238), (7822, 14373), (8583, 14346), (8592, 14334), (8037, 14294), (8377, 14373), (8171, 14344), (7959, 14302), (7752, 14354), (8453, 14362), (8348, 14320), (8484, 14395), (8389, 14389), (8290, 14257), (8344, 14251), (8390, 14399)]
         : compromised: 0.5736, honest: 0.5809
Round 006: test acc mean=0.6013 ± 0.0043 | min=0.5934 max=0.6081
         : test loss mean=0.6670 ± 0.0032
         : individual accs = ['0.596613', '0.604074', '0.597154', '0.599775', '0.606335', '0.600292', '0.605116', '0.606042', '0.593396', '0.605441', '0.605480', '0.596350', '0.595513', '0.605556', '0.596299', '0.600417', '0.599208', '0.608122', '0.599607', '0.604348']
         : correct/total = [(8491, 14232), (8599, 14235), (8519, 14266), (8527, 14217), (8633, 14238), (8628, 14373), (8681, 14346), (8687, 14334), (8482, 14294), (8702, 14373), (8685, 14344), (8529, 14302), (8548, 14354), (8697, 14362), (8539, 14320), (8643, 14395), (8622, 14389), (8670, 14257), (8545, 14251), (8702, 14399)]
         : compromised: 0.6003, honest: 0.6022
Round 007: test acc mean=0.6115 ± 0.0029 | min=0.6031 max=0.6155
         : test loss mean=0.6568 ± 0.0013
         : individual accs = ['0.607926', '0.612996', '0.608650', '0.614054', '0.611322', '0.615390', '0.611529', '0.610646', '0.614594', '0.613581', '0.610708', '0.612222', '0.609795', '0.608550', '0.612989', '0.612574', '0.603100', '0.615487', '0.610062', '0.613584']
         : correct/total = [(8652, 14232), (8726, 14235), (8683, 14266), (8730, 14217), (8704, 14238), (8845, 14373), (8773, 14346), (8753, 14334), (8785, 14294), (8819, 14373), (8760, 14344), (8756, 14302), (8753, 14354), (8740, 14362), (8778, 14320), (8818, 14395), (8678, 14389), (8775, 14257), (8694, 14251), (8835, 14399)]
         : compromised: 0.6119, honest: 0.6111
Round 008: test acc mean=0.6173 ± 0.0030 | min=0.6116 max=0.6240
         : test loss mean=0.6516 ± 0.0018
         : individual accs = ['0.611580', '0.620443', '0.614047', '0.620243', '0.619609', '0.618451', '0.615503', '0.615250', '0.621170', '0.616990', '0.616704', '0.614180', '0.616762', '0.624008', '0.617458', '0.618965', '0.612343', '0.620046', '0.615466', '0.617335']
         : correct/total = [(8704, 14232), (8832, 14235), (8760, 14266), (8818, 14217), (8822, 14238), (8889, 14373), (8830, 14346), (8819, 14334), (8879, 14294), (8868, 14373), (8846, 14344), (8784, 14302), (8853, 14354), (8962, 14362), (8842, 14320), (8910, 14395), (8811, 14389), (8840, 14257), (8771, 14251), (8889, 14399)]
         : compromised: 0.6180, honest: 0.6167
Round 009: test acc mean=0.6223 ± 0.0034 | min=0.6166 max=0.6296
         : test loss mean=0.6476 ± 0.0020
         : individual accs = ['0.619590', '0.628662', '0.618744', '0.625097', '0.620663', '0.623739', '0.623379', '0.619925', '0.622779', '0.623043', '0.620120', '0.619913', '0.619479', '0.629578', '0.616620', '0.626606', '0.617764', '0.625307', '0.620728', '0.623307']
         : correct/total = [(8818, 14232), (8949, 14235), (8827, 14266), (8887, 14217), (8837, 14238), (8965, 14373), (8943, 14346), (8886, 14334), (8902, 14294), (8955, 14373), (8895, 14344), (8866, 14302), (8892, 14354), (9042, 14362), (8830, 14320), (9020, 14395), (8889, 14389), (8915, 14257), (8846, 14251), (8975, 14399)]
         : compromised: 0.6229, honest: 0.6216
Round 010: test acc mean=0.6277 ± 0.0034 | min=0.6223 max=0.6364
         : test loss mean=0.6434 ± 0.0019
         : individual accs = ['0.622260', '0.632736', '0.623581', '0.630442', '0.628880', '0.629096', '0.626516', '0.628506', '0.628585', '0.626383', '0.626882', '0.625297', '0.624983', '0.636402', '0.625070', '0.632025', '0.624366', '0.630708', '0.624798', '0.626224']
         : correct/total = [(8856, 14232), (9007, 14235), (8896, 14266), (8963, 14217), (8954, 14238), (9042, 14373), (8988, 14346), (9009, 14334), (8985, 14294), (9003, 14373), (8992, 14344), (8943, 14302), (8971, 14354), (9140, 14362), (8951, 14320), (9098, 14395), (8984, 14389), (8992, 14257), (8904, 14251), (9017, 14399)]
         : compromised: 0.6285, honest: 0.6269

=== FINAL RESULTS ===
Dataset: sent140, Nodes: 20, Graph: erdos, Aggregation: balance
Attack: directed_deviation, 50.0% compromised
Final accuracy - Compromised: 0.6285, Honest: 0.6269
Overall test accuracy: mean=0.6277 ± 0.0034

=== BALANCE SUMMARY ===
Node 0: acceptance=0.550
Node 1: acceptance=0.591
Node 2: acceptance=0.475
Node 3: acceptance=0.662
Node 4: acceptance=0.509
Node 5: acceptance=0.520
Node 6: acceptance=0.486
Node 7: acceptance=0.486
Node 8: acceptance=0.460
Node 9: acceptance=0.585
Node 10: acceptance=0.600
Node 11: acceptance=0.550
Node 12: acceptance=0.625
Node 13: acceptance=0.585
Node 14: acceptance=0.520
Node 15: acceptance=0.509
Node 16: acceptance=0.446
Node 17: acceptance=0.700
Node 18: acceptance=0.606
Node 19: acceptance=0.494

=== PARALLEL EXECUTION TIME (realistic for distributed system) ===
  COMMUNICATION (max across nodes):
    - Full model transfer: 0.000s (0.0%)
  COMPUTATION (max across nodes):
    - Filtering: 0.066s (81.6%)
    - Aggregation: 0.015s (18.4%)
  TOTALS:
    - Total computation: 0.081s (100.0%)
    - Total communication: 0.000s (0.0%)
    - Total parallel time: 0.081s

=== PER-NODE AVERAGE TIME ===
  - Filtering: 0.054s
  - Aggregation: 0.008s
  - Model transfer: 0.000s
  - Total per node: 0.061s

=== TOTAL COMPUTATIONAL WORK (sum across all nodes) ===
  - Total filtering: 1.072s
  - Total aggregation: 0.158s
  - Total model transfer: 0.000s
  - Grand total: 1.229s
  - Mean acceptance rate: 0.548

BALANCE Algorithm Properties:
  - Model dimension: 1,174,986
  - No compression: Full parameter comparison
  - Theoretical complexity: O(deg(i)×d)
  - Approach: Full parameter filtering + averaging
