Device: cuda
Seed: 987654321
Loading 1 LEAF Sent140 train files...
LEAF Sent140 train: 254555 users, 908652 samples
Building vocabulary (max_size=10000)...
Vocabulary size: 10000
Loading 1 LEAF Sent140 test files...
LEAF Sent140 test: 254555 users, 286281 samples
Found 254555 train users, 254555 test users, 254555 common users
User sample counts range: 494 (max) to 1 (min)
Distributed ALL 254555 users across 20 clients
Users per client: 12727 (with 15 clients getting +1 user)
Train partition sizes: [44353, 44290, 44657, 44907, 44696, 45843, 45801, 45619, 45069, 45639, 45821, 45311, 45779, 46056, 45625, 45984, 46428, 44737, 45540, 46497]
Test partition sizes: [14232, 14235, 14266, 14217, 14238, 14373, 14346, 14334, 14294, 14373, 14344, 14302, 14354, 14362, 14320, 14395, 14389, 14257, 14251, 14399]
  Client 0: 44353 train samples, 2 unique classes
  Client 1: 44290 train samples, 2 unique classes
  Client 2: 44657 train samples, 2 unique classes
  Client 3: 44907 train samples, 2 unique classes
  Client 4: 44696 train samples, 2 unique classes
  Client 5: 45843 train samples, 2 unique classes
  Client 6: 45801 train samples, 2 unique classes
  Client 7: 45619 train samples, 2 unique classes
  Client 8: 45069 train samples, 2 unique classes
  Client 9: 45639 train samples, 2 unique classes
  Client 10: 45821 train samples, 2 unique classes
  Client 11: 45311 train samples, 2 unique classes
  Client 12: 45779 train samples, 2 unique classes
  Client 13: 46056 train samples, 2 unique classes
  Client 14: 45625 train samples, 2 unique classes
  Client 15: 45984 train samples, 2 unique classes
  Client 16: 46428 train samples, 2 unique classes
  Client 17: 44737 train samples, 2 unique classes
  Client 18: 45540 train samples, 2 unique classes
  Client 19: 46497 train samples, 2 unique classes
Will sample 4500 samples per client per epoch
Graph: erdos, nodes: 20, edges: 48
Degree statistics: avg=4.80, min=2, max=7
Attack: Compromised 16/20 nodes: [1, 2, 3, 5, 6, 8, 9, 10, 11, 12, 13, 14, 15, 17, 18, 19]
Attack type: gaussian, lambda: 1.0
Model variant: baseline
Model parameters: 1,174,986
BALANCE algorithm:
Balance Config: BALANCEConfig(gamma=2, kappa=1, alpha=0.5, min_neighbors=1)
  - Model dimension: 1,174,986 parameters
  - Complexity: O(N×d) = O(20×1,174,986)
Initial test acc across nodes: mean=0.4953 ± 0.0174
Round 001: test acc mean=0.5555 ± 0.0338 | min=0.4997 max=0.6145
         : test loss mean=176.8828 ± 356.0087
         : individual accs = ['0.571248', '0.533685', '0.571008', '0.506647', '0.597907', '0.569749', '0.533389', '0.595089', '0.554289', '0.591526', '0.567973', '0.499720', '0.593214', '0.505779', '0.527025', '0.614519', '0.572938', '0.558813', '0.533647', '0.512119']
         : correct/total = [(8130, 14232), (7597, 14235), (8146, 14266), (7203, 14217), (8513, 14238), (8189, 14373), (7652, 14346), (8530, 14334), (7923, 14294), (8502, 14373), (8147, 14344), (7147, 14302), (8515, 14354), (7264, 14362), (7547, 14320), (8846, 14395), (8244, 14389), (7967, 14257), (7605, 14251), (7374, 14399)]
         : compromised: 0.5483, honest: 0.5843
Round 002: test acc mean=0.5968 ± 0.0526 | min=0.4942 max=0.6446
         : test loss mean=56.8887 ± 117.0597
         : individual accs = ['0.638772', '0.573797', '0.614678', '0.516354', '0.639205', '0.638906', '0.630141', '0.644551', '0.617672', '0.609198', '0.632529', '0.496854', '0.603246', '0.505152', '0.627933', '0.639528', '0.642157', '0.544364', '0.626061', '0.494201']
         : correct/total = [(9091, 14232), (8168, 14235), (8769, 14266), (7341, 14217), (9101, 14238), (9183, 14373), (9040, 14346), (9239, 14334), (8829, 14294), (8756, 14373), (9073, 14344), (7106, 14302), (8659, 14354), (7255, 14362), (8992, 14320), (9206, 14395), (9240, 14389), (7761, 14257), (8922, 14251), (7116, 14399)]
         : compromised: 0.5857, honest: 0.6412
Round 003: test acc mean=0.6012 ± 0.0564 | min=0.4892 max=0.6498
         : test loss mean=64.1356 ± 133.2823
         : individual accs = ['0.636734', '0.582297', '0.617202', '0.499402', '0.647071', '0.633688', '0.627562', '0.649784', '0.642018', '0.637793', '0.627231', '0.492169', '0.616274', '0.492550', '0.642179', '0.625842', '0.638404', '0.591359', '0.635254', '0.489201']
         : correct/total = [(9062, 14232), (8289, 14235), (8805, 14266), (7100, 14217), (9213, 14238), (9108, 14373), (9003, 14346), (9314, 14334), (9177, 14294), (9167, 14373), (8997, 14344), (7039, 14302), (8846, 14354), (7074, 14362), (9196, 14320), (9009, 14395), (9186, 14389), (8431, 14257), (9053, 14251), (7044, 14399)]
         : compromised: 0.5908, honest: 0.6430
Round 004: test acc mean=0.6152 ± 0.0591 | min=0.4851 max=0.6545
         : test loss mean=104.6416 ± 303.8135
         : individual accs = ['0.651771', '0.601194', '0.642787', '0.485123', '0.651988', '0.652891', '0.648752', '0.649016', '0.651672', '0.646907', '0.651562', '0.493078', '0.648809', '0.518730', '0.633799', '0.643626', '0.654528', '0.637511', '0.637499', '0.501979']
         : correct/total = [(9276, 14232), (8558, 14235), (9170, 14266), (6897, 14217), (9283, 14238), (9384, 14373), (9307, 14346), (9303, 14334), (9315, 14294), (9298, 14373), (9346, 14344), (7052, 14302), (9313, 14354), (7450, 14362), (9076, 14320), (9265, 14395), (9418, 14389), (9089, 14257), (9085, 14251), (7228, 14399)]
         : compromised: 0.6060, honest: 0.6518
Round 005: test acc mean=0.6214 ± 0.0619 | min=0.4871 max=0.6614
         : test loss mean=67.2333 ± 151.7942
         : individual accs = ['0.658797', '0.639129', '0.647343', '0.512626', '0.660837', '0.651221', '0.656629', '0.661434', '0.660347', '0.651917', '0.653583', '0.487135', '0.656054', '0.487745', '0.648254', '0.650990', '0.656613', '0.635407', '0.644937', '0.507882']
         : correct/total = [(9376, 14232), (9098, 14235), (9235, 14266), (7288, 14217), (9409, 14238), (9360, 14373), (9420, 14346), (9481, 14334), (9439, 14294), (9370, 14373), (9375, 14344), (6967, 14302), (9417, 14354), (7005, 14362), (9283, 14320), (9371, 14395), (9448, 14389), (9059, 14257), (9191, 14251), (7313, 14399)]
         : compromised: 0.6120, honest: 0.6594
Round 006: test acc mean=0.6259 ± 0.0610 | min=0.4928 max=0.6666
         : test loss mean=71.5781 ± 152.0812
         : individual accs = ['0.653035', '0.645100', '0.652601', '0.492790', '0.663787', '0.663188', '0.658023', '0.665620', '0.661047', '0.657204', '0.659370', '0.509020', '0.666643', '0.508355', '0.658939', '0.654116', '0.654111', '0.635477', '0.651042', '0.508924']
         : correct/total = [(9294, 14232), (9183, 14235), (9310, 14266), (7006, 14217), (9451, 14238), (9532, 14373), (9440, 14346), (9541, 14334), (9449, 14294), (9446, 14373), (9458, 14344), (7280, 14302), (9569, 14354), (7301, 14362), (9436, 14320), (9416, 14395), (9412, 14389), (9060, 14257), (9278, 14251), (7328, 14399)]
         : compromised: 0.6176, honest: 0.6591
Round 007: test acc mean=0.6284 ± 0.0665 | min=0.4913 max=0.6731
         : test loss mean=209.3324 ± 444.2231
         : individual accs = ['0.661748', '0.652617', '0.660522', '0.501794', '0.673058', '0.662283', '0.665482', '0.667853', '0.668462', '0.658109', '0.666341', '0.493078', '0.665041', '0.491296', '0.663966', '0.660438', '0.664396', '0.650347', '0.643885', '0.498090']
         : correct/total = [(9418, 14232), (9290, 14235), (9423, 14266), (7134, 14217), (9583, 14238), (9519, 14373), (9547, 14346), (9573, 14334), (9555, 14294), (9459, 14373), (9558, 14344), (7052, 14302), (9546, 14354), (7056, 14362), (9508, 14320), (9507, 14395), (9560, 14389), (9272, 14257), (9176, 14251), (7172, 14399)]
         : compromised: 0.6189, honest: 0.6668
Round 008: test acc mean=0.6310 ± 0.0628 | min=0.4997 max=0.6746
         : test loss mean=203.6310 ± 424.2676
         : individual accs = ['0.658165', '0.650650', '0.660241', '0.499683', '0.664349', '0.669032', '0.674613', '0.667574', '0.670911', '0.665345', '0.667736', '0.510628', '0.666156', '0.509678', '0.665014', '0.665856', '0.659045', '0.658624', '0.630482', '0.506563']
         : correct/total = [(9367, 14232), (9262, 14235), (9419, 14266), (7104, 14217), (9459, 14238), (9616, 14373), (9678, 14346), (9569, 14334), (9590, 14294), (9563, 14373), (9578, 14344), (7303, 14302), (9562, 14354), (7320, 14362), (9523, 14320), (9585, 14395), (9483, 14389), (9390, 14257), (8985, 14251), (7294, 14399)]
         : compromised: 0.6232, honest: 0.6623
Round 009: test acc mean=0.6322 ± 0.0611 | min=0.5006 max=0.6788
         : test loss mean=286.9492 ± 699.6159
         : individual accs = ['0.655846', '0.673902', '0.648675', '0.500598', '0.673550', '0.678842', '0.633278', '0.673573', '0.645656', '0.638211', '0.674219', '0.506712', '0.665389', '0.515179', '0.672137', '0.662313', '0.660922', '0.670548', '0.665216', '0.528301']
         : correct/total = [(9334, 14232), (9593, 14235), (9254, 14266), (7117, 14217), (9590, 14238), (9757, 14373), (9085, 14346), (9655, 14334), (9229, 14294), (9173, 14373), (9671, 14344), (7247, 14302), (9551, 14354), (7399, 14362), (9625, 14320), (9534, 14395), (9510, 14389), (9560, 14257), (9480, 14251), (7607, 14399)]
         : compromised: 0.6237, honest: 0.6660
Round 010: test acc mean=0.6426 ± 0.0719 | min=0.4939 max=0.6871
         : test loss mean=224.6655 ± 451.3467
         : individual accs = ['0.684935', '0.678047', '0.673419', '0.501723', '0.679520', '0.677868', '0.677192', '0.683061', '0.687071', '0.678077', '0.679378', '0.503706', '0.686429', '0.493873', '0.676676', '0.668635', '0.678782', '0.681139', '0.664585', '0.497812']
         : correct/total = [(9748, 14232), (9652, 14235), (9607, 14266), (7133, 14217), (9675, 14238), (9743, 14373), (9715, 14346), (9791, 14334), (9821, 14294), (9746, 14373), (9745, 14344), (7204, 14302), (9853, 14354), (7093, 14362), (9690, 14320), (9625, 14395), (9767, 14389), (9711, 14257), (9471, 14251), (7168, 14399)]
         : compromised: 0.6329, honest: 0.6816

=== FINAL RESULTS ===
Dataset: sent140, Nodes: 20, Graph: erdos, Aggregation: balance
Attack: gaussian, 80.0% compromised
Final accuracy - Compromised: 0.6329, Honest: 0.6816
Overall test accuracy: mean=0.6426 ± 0.0719

=== BALANCE SUMMARY ===
Node 0: acceptance=0.167
Node 1: acceptance=0.250
Node 2: acceptance=0.200
Node 3: acceptance=0.500
Node 4: acceptance=0.250
Node 5: acceptance=0.200
Node 6: acceptance=0.200
Node 7: acceptance=0.200
Node 8: acceptance=0.500
Node 9: acceptance=0.333
Node 10: acceptance=0.250
Node 11: acceptance=0.500
Node 12: acceptance=0.329
Node 13: acceptance=0.500
Node 14: acceptance=0.143
Node 15: acceptance=0.167
Node 16: acceptance=0.200
Node 17: acceptance=0.300
Node 18: acceptance=0.250
Node 19: acceptance=0.500

=== PARALLEL EXECUTION TIME (realistic for distributed system) ===
  COMMUNICATION (max across nodes):
    - Full model transfer: 0.000s (0.0%)
  COMPUTATION (max across nodes):
    - Filtering: 0.035s (77.0%)
    - Aggregation: 0.011s (23.0%)
  TOTALS:
    - Total computation: 0.046s (100.0%)
    - Total communication: 0.000s (0.0%)
    - Total parallel time: 0.046s

=== PER-NODE AVERAGE TIME ===
  - Filtering: 0.022s
  - Aggregation: 0.005s
  - Model transfer: 0.000s
  - Total per node: 0.027s

=== TOTAL COMPUTATIONAL WORK (sum across all nodes) ===
  - Total filtering: 0.441s
  - Total aggregation: 0.099s
  - Total model transfer: 0.000s
  - Grand total: 0.541s
  - Mean acceptance rate: 0.297

BALANCE Algorithm Properties:
  - Model dimension: 1,174,986
  - No compression: Full parameter comparison
  - Theoretical complexity: O(deg(i)×d)
  - Approach: Full parameter filtering + averaging
