Device: cuda
Seed: 987654321
Loading 1 LEAF Sent140 train files...
LEAF Sent140 train: 254555 users, 908652 samples
Building vocabulary (max_size=10000)...
Vocabulary size: 10000
Loading 1 LEAF Sent140 test files...
LEAF Sent140 test: 254555 users, 286281 samples
Found 254555 train users, 254555 test users, 254555 common users
User sample counts range: 494 (max) to 1 (min)
Distributed ALL 254555 users across 20 clients
Users per client: 12727 (with 15 clients getting +1 user)
Train partition sizes: [44353, 44290, 44657, 44907, 44696, 45843, 45801, 45619, 45069, 45639, 45821, 45311, 45779, 46056, 45625, 45984, 46428, 44737, 45540, 46497]
Test partition sizes: [14232, 14235, 14266, 14217, 14238, 14373, 14346, 14334, 14294, 14373, 14344, 14302, 14354, 14362, 14320, 14395, 14389, 14257, 14251, 14399]
  Client 0: 44353 train samples, 2 unique classes
  Client 1: 44290 train samples, 2 unique classes
  Client 2: 44657 train samples, 2 unique classes
  Client 3: 44907 train samples, 2 unique classes
  Client 4: 44696 train samples, 2 unique classes
  Client 5: 45843 train samples, 2 unique classes
  Client 6: 45801 train samples, 2 unique classes
  Client 7: 45619 train samples, 2 unique classes
  Client 8: 45069 train samples, 2 unique classes
  Client 9: 45639 train samples, 2 unique classes
  Client 10: 45821 train samples, 2 unique classes
  Client 11: 45311 train samples, 2 unique classes
  Client 12: 45779 train samples, 2 unique classes
  Client 13: 46056 train samples, 2 unique classes
  Client 14: 45625 train samples, 2 unique classes
  Client 15: 45984 train samples, 2 unique classes
  Client 16: 46428 train samples, 2 unique classes
  Client 17: 44737 train samples, 2 unique classes
  Client 18: 45540 train samples, 2 unique classes
  Client 19: 46497 train samples, 2 unique classes
Will sample 4500 samples per client per epoch
Graph: erdos, nodes: 20, edges: 126
Degree statistics: avg=12.60, min=8, max=16
Attack: Compromised 6/20 nodes: [5, 12, 13, 14, 17, 18]
Attack type: backdoor, lambda: 1.0
Backdoor target label: 1, trigger size: 3
Model variant: baseline
Model parameters: 1,174,986
Initial test acc across nodes: mean=0.4965 ± 0.0152
Backdoor attack: Created poisoned datasets for 6 compromised nodes
Round 001: test acc mean=0.5000 ± 0.0083 | min=0.4735 max=0.5160
         : test loss mean=2.6059 ± 1.0794
         : individual accs = ['0.503162', '0.510081', '0.509533', '0.496800', '0.490659', '0.499130', '0.497839', '0.515976', '0.507765', '0.473457', '0.500000', '0.500769', '0.500488', '0.497076', '0.504120', '0.500382', '0.501077', '0.497440', '0.497509', '0.496632']
         : correct/total = [(7161, 14232), (7261, 14235), (7269, 14266), (7063, 14217), (6986, 14238), (7174, 14373), (7142, 14346), (7396, 14334), (7258, 14294), (6805, 14373), (7172, 14344), (7162, 14302), (7184, 14354), (7139, 14362), (7219, 14320), (7203, 14395), (7210, 14389), (7092, 14257), (7090, 14251), (7151, 14399)]
         : compromised: 0.4993, honest: 0.5003
Round 002: test acc mean=0.4998 ± 0.0046 | min=0.4881 max=0.5090
         : test loss mean=2.1165 ± 0.7536
         : individual accs = ['0.500141', '0.499192', '0.498458', '0.508968', '0.499579', '0.488068', '0.500418', '0.505163', '0.500909', '0.502052', '0.502370', '0.506293', '0.497980', '0.491157', '0.500279', '0.500729', '0.501008', '0.497650', '0.495053', '0.501215']
         : correct/total = [(7118, 14232), (7106, 14235), (7111, 14266), (7236, 14217), (7113, 14238), (7015, 14373), (7179, 14346), (7241, 14334), (7160, 14294), (7216, 14373), (7206, 14344), (7241, 14302), (7148, 14354), (7054, 14362), (7164, 14320), (7208, 14395), (7209, 14389), (7095, 14257), (7055, 14251), (7217, 14399)]
         : compromised: 0.4950, honest: 0.5019
Round 003: test acc mean=0.5131 ± 0.0165 | min=0.4701 max=0.5435
         : test loss mean=0.8331 ± 0.0753
         : individual accs = ['0.504918', '0.526800', '0.507360', '0.495041', '0.511659', '0.542893', '0.520912', '0.528952', '0.511054', '0.512071', '0.470092', '0.543490', '0.499164', '0.527016', '0.516899', '0.509969', '0.515255', '0.493512', '0.507894', '0.517050']
         : correct/total = [(7186, 14232), (7499, 14235), (7238, 14266), (7038, 14217), (7285, 14238), (7803, 14373), (7473, 14346), (7582, 14334), (7305, 14294), (7360, 14373), (6743, 14344), (7773, 14302), (7165, 14354), (7569, 14362), (7402, 14320), (7341, 14395), (7414, 14389), (7036, 14257), (7238, 14251), (7445, 14399)]
         : compromised: 0.5146, honest: 0.5125
Round 004: test acc mean=0.5088 ± 0.0050 | min=0.4996 max=0.5183
         : test loss mean=1.2970 ± 0.3518
         : individual accs = ['0.508502', '0.516473', '0.502874', '0.507983', '0.512923', '0.512976', '0.503276', '0.509697', '0.502169', '0.518263', '0.502579', '0.514054', '0.499582', '0.506615', '0.508799', '0.505175', '0.513031', '0.509083', '0.510490', '0.511841']
         : correct/total = [(7237, 14232), (7352, 14235), (7174, 14266), (7222, 14217), (7303, 14238), (7373, 14373), (7220, 14346), (7306, 14334), (7178, 14294), (7449, 14373), (7209, 14344), (7352, 14302), (7171, 14354), (7276, 14362), (7286, 14320), (7272, 14395), (7382, 14389), (7258, 14257), (7275, 14251), (7370, 14399)]
         : compromised: 0.5079, honest: 0.5092
Round 005: test acc mean=0.5049 ± 0.0066 | min=0.4951 max=0.5172
         : test loss mean=3.3112 ± 0.6468
         : individual accs = ['0.505200', '0.495609', '0.517244', '0.509109', '0.515592', '0.503514', '0.495121', '0.510744', '0.495663', '0.504835', '0.498048', '0.506852', '0.515187', '0.507450', '0.502374', '0.502675', '0.507749', '0.498211', '0.507824', '0.498021']
         : correct/total = [(7190, 14232), (7055, 14235), (7379, 14266), (7238, 14217), (7341, 14238), (7237, 14373), (7103, 14346), (7321, 14334), (7085, 14294), (7256, 14373), (7144, 14344), (7249, 14302), (7395, 14354), (7288, 14362), (7194, 14320), (7236, 14395), (7306, 14389), (7103, 14257), (7237, 14251), (7171, 14399)]
         : compromised: 0.5058, honest: 0.5045
Round 006: test acc mean=0.5017 ± 0.0062 | min=0.4908 max=0.5178
         : test loss mean=2.7340 ± 1.7386
         : individual accs = ['0.499368', '0.511837', '0.490817', '0.501020', '0.506743', '0.495860', '0.499373', '0.497209', '0.494543', '0.502400', '0.509272', '0.495106', '0.502856', '0.517825', '0.500349', '0.504828', '0.503232', '0.504103', '0.498000', '0.499479']
         : correct/total = [(7107, 14232), (7286, 14235), (7002, 14266), (7123, 14217), (7215, 14238), (7127, 14373), (7164, 14346), (7127, 14334), (7069, 14294), (7221, 14373), (7305, 14344), (7081, 14302), (7218, 14354), (7437, 14362), (7165, 14320), (7267, 14395), (7241, 14389), (7187, 14257), (7097, 14251), (7192, 14399)]
         : compromised: 0.5032, honest: 0.5011
Round 007: test acc mean=0.4990 ± 0.0106 | min=0.4780 max=0.5218
         : test loss mean=3.3131 ± 1.5610
         : individual accs = ['0.502178', '0.478047', '0.486051', '0.489133', '0.521773', '0.493843', '0.497560', '0.495186', '0.488457', '0.492799', '0.511991', '0.492029', '0.509126', '0.513369', '0.495810', '0.498367', '0.499757', '0.503893', '0.515262', '0.496354']
         : correct/total = [(7147, 14232), (6805, 14235), (6934, 14266), (6954, 14217), (7429, 14238), (7098, 14373), (7138, 14346), (7098, 14334), (6982, 14294), (7083, 14373), (7344, 14344), (7037, 14302), (7308, 14354), (7373, 14362), (7100, 14320), (7174, 14395), (7191, 14389), (7184, 14257), (7343, 14251), (7147, 14399)]
         : compromised: 0.5052, honest: 0.4964
Round 008: test acc mean=0.5025 ± 0.0104 | min=0.4864 max=0.5283
         : test loss mean=1.2842 ± 0.6174
         : individual accs = ['0.500773', '0.495680', '0.494112', '0.512274', '0.519736', '0.498087', '0.512547', '0.498256', '0.513012', '0.514576', '0.495329', '0.493008', '0.494078', '0.528339', '0.497626', '0.486419', '0.503579', '0.496247', '0.500947', '0.495868']
         : correct/total = [(7127, 14232), (7056, 14235), (7049, 14266), (7283, 14217), (7400, 14238), (7159, 14373), (7353, 14346), (7142, 14334), (7333, 14294), (7396, 14373), (7105, 14344), (7051, 14302), (7092, 14354), (7588, 14362), (7126, 14320), (7002, 14395), (7246, 14389), (7075, 14257), (7139, 14251), (7140, 14399)]
         : compromised: 0.5026, honest: 0.5025
Round 009: test acc mean=0.5085 ± 0.0138 | min=0.4833 max=0.5337
         : test loss mean=1.6301 ± 1.4166
         : individual accs = ['0.531619', '0.511978', '0.497266', '0.511922', '0.507304', '0.507827', '0.502509', '0.483326', '0.506576', '0.509567', '0.529908', '0.487694', '0.508290', '0.512742', '0.501816', '0.515248', '0.493919', '0.533703', '0.525577', '0.491562']
         : correct/total = [(7566, 14232), (7288, 14235), (7094, 14266), (7278, 14217), (7223, 14238), (7299, 14373), (7209, 14346), (6928, 14334), (7241, 14294), (7324, 14373), (7601, 14344), (6975, 14302), (7296, 14354), (7364, 14362), (7186, 14320), (7417, 14395), (7107, 14389), (7609, 14257), (7490, 14251), (7078, 14399)]
         : compromised: 0.5150, honest: 0.5057
Round 010: test acc mean=0.4942 ± 0.0095 | min=0.4708 max=0.5088
         : test loss mean=2.3785 ± 1.1000
         : individual accs = ['0.489109', '0.508816', '0.485911', '0.500035', '0.493890', '0.493843', '0.497700', '0.470769', '0.488457', '0.493843', '0.498954', '0.472661', '0.499512', '0.508564', '0.495810', '0.498367', '0.499618', '0.502981', '0.488808', '0.496215']
         : correct/total = [(6961, 14232), (7243, 14235), (6932, 14266), (7109, 14217), (7032, 14238), (7098, 14373), (7140, 14346), (6748, 14334), (6982, 14294), (7098, 14373), (7157, 14344), (6760, 14302), (7170, 14354), (7304, 14362), (7100, 14320), (7174, 14395), (7189, 14389), (7171, 14257), (6966, 14251), (7145, 14399)]
         : compromised: 0.4983, honest: 0.4925

=== FINAL RESULTS ===
Dataset: sent140, Nodes: 20, Graph: erdos, Aggregation: d-fedavg
Attack: backdoor, 30.0% compromised
Final accuracy - Compromised: 0.4983, Honest: 0.4925
Overall test accuracy: mean=0.4942 ± 0.0095

=== BACKDOOR ATTACK SUCCESS RATE (ASR) ===
Target label: 1
Trigger size: 3x3
Overall ASR: 0.9574 ± 0.1099
Honest nodes ASR: 0.9392 ± 0.1271
Compromised nodes ASR: 1.0000 ± 0.0001
Note: Higher ASR indicates more successful backdoor attack
