Device: cuda
Seed: 987654321
Loading 1 LEAF Sent140 train files...
LEAF Sent140 train: 254555 users, 908652 samples
Building vocabulary (max_size=10000)...
Vocabulary size: 10000
Loading 1 LEAF Sent140 test files...
LEAF Sent140 test: 254555 users, 286281 samples
Found 254555 train users, 254555 test users, 254555 common users
User sample counts range: 494 (max) to 1 (min)
Distributed ALL 254555 users across 20 clients
Users per client: 12727 (with 15 clients getting +1 user)
Train partition sizes: [44353, 44290, 44657, 44907, 44696, 45843, 45801, 45619, 45069, 45639, 45821, 45311, 45779, 46056, 45625, 45984, 46428, 44737, 45540, 46497]
Test partition sizes: [14232, 14235, 14266, 14217, 14238, 14373, 14346, 14334, 14294, 14373, 14344, 14302, 14354, 14362, 14320, 14395, 14389, 14257, 14251, 14399]
  Client 0: 44353 train samples, 2 unique classes
  Client 1: 44290 train samples, 2 unique classes
  Client 2: 44657 train samples, 2 unique classes
  Client 3: 44907 train samples, 2 unique classes
  Client 4: 44696 train samples, 2 unique classes
  Client 5: 45843 train samples, 2 unique classes
  Client 6: 45801 train samples, 2 unique classes
  Client 7: 45619 train samples, 2 unique classes
  Client 8: 45069 train samples, 2 unique classes
  Client 9: 45639 train samples, 2 unique classes
  Client 10: 45821 train samples, 2 unique classes
  Client 11: 45311 train samples, 2 unique classes
  Client 12: 45779 train samples, 2 unique classes
  Client 13: 46056 train samples, 2 unique classes
  Client 14: 45625 train samples, 2 unique classes
  Client 15: 45984 train samples, 2 unique classes
  Client 16: 46428 train samples, 2 unique classes
  Client 17: 44737 train samples, 2 unique classes
  Client 18: 45540 train samples, 2 unique classes
  Client 19: 46497 train samples, 2 unique classes
Will sample 4500 samples per client per epoch
Graph: ring, nodes: 20, edges: 20
Degree statistics: avg=2.00, min=2, max=2
Attack: Compromised 10/20 nodes: [1, 2, 5, 11, 12, 13, 14, 15, 17, 18]
Attack type: krum, lambda: 1.0
Model variant: baseline
Model parameters: 1,174,986
UBAR ALGORITHM (Two-Stage Byzantine-resilient)
  - Model dimension: 1,174,986 parameters
  - Rho parameter: 0.5
  - Stage 1: Distance-based filtering (select 50% closest neighbors)
  - Stage 2: Performance-based selection (loss comparison)
  - Complexity: O(deg(i)×d + deg(i)×inference)
Initial test acc across nodes: mean=0.4965 ± 0.0152
Round 001: test acc mean=0.5251 ± 0.0186 | min=0.4915 max=0.5627
         : test loss mean=2.0930 ± 3.2407
         : individual accs = ['0.548974', '0.523147', '0.532174', '0.515017', '0.517980', '0.517846', '0.562666', '0.553858', '0.511613', '0.526473', '0.515965', '0.533562', '0.494914', '0.491505', '0.507821', '0.525669', '0.503162', '0.542050', '0.533226', '0.543649']
         : correct/total = [(7813, 14232), (7447, 14235), (7592, 14266), (7322, 14217), (7375, 14238), (7443, 14373), (8072, 14346), (7939, 14334), (7313, 14294), (7567, 14373), (7401, 14344), (7631, 14302), (7104, 14354), (7059, 14362), (7272, 14320), (7567, 14395), (7240, 14389), (7728, 14257), (7599, 14251), (7828, 14399)]
         : compromised: 0.5202, honest: 0.5299
         : ubar stats = ['Node 0: s1=0.500, s2=1.000', 'Node 1: s1=0.500, s2=1.000', 'Node 2: s1=0.500, s2=1.000']...
Round 002: test acc mean=0.5514 ± 0.0389 | min=0.4873 max=0.6110
         : test loss mean=1.5924 ± 1.7842
         : individual accs = ['0.590008', '0.563400', '0.534838', '0.558557', '0.558505', '0.552286', '0.611041', '0.606530', '0.578355', '0.582133', '0.584914', '0.549993', '0.504250', '0.507729', '0.496020', '0.496283', '0.501008', '0.487269', '0.575960', '0.589208']
         : correct/total = [(8397, 14232), (8020, 14235), (7630, 14266), (7941, 14217), (7952, 14238), (7938, 14373), (8766, 14346), (8694, 14334), (8267, 14294), (8367, 14373), (8390, 14344), (7866, 14302), (7238, 14354), (7292, 14362), (7103, 14320), (7144, 14395), (7209, 14389), (6947, 14257), (8208, 14251), (8484, 14399)]
         : compromised: 0.5268, honest: 0.5760
         : ubar stats = ['Node 0: s1=0.500, s2=1.000', 'Node 1: s1=0.500, s2=1.000', 'Node 2: s1=0.500, s2=1.000']...
Round 003: test acc mean=0.5715 ± 0.0467 | min=0.4952 max=0.6171
         : test loss mean=1.0652 ± 0.7135
         : individual accs = ['0.615233', '0.604355', '0.574583', '0.601815', '0.598961', '0.595492', '0.614318', '0.616855', '0.606268', '0.595631', '0.598787', '0.569571', '0.502020', '0.495196', '0.505237', '0.496075', '0.510042', '0.506839', '0.604800', '0.617126']
         : correct/total = [(8756, 14232), (8603, 14235), (8197, 14266), (8556, 14217), (8528, 14238), (8559, 14373), (8813, 14346), (8842, 14334), (8666, 14294), (8561, 14373), (8589, 14344), (8146, 14302), (7206, 14354), (7112, 14362), (7235, 14320), (7141, 14395), (7339, 14389), (7226, 14257), (8619, 14251), (8886, 14399)]
         : compromised: 0.5454, honest: 0.5975
         : ubar stats = ['Node 0: s1=0.500, s2=1.000', 'Node 1: s1=0.500, s2=1.000', 'Node 2: s1=0.500, s2=1.000']...
Round 004: test acc mean=0.5838 ± 0.0555 | min=0.4946 max=0.6307
         : test loss mean=1.0876 ± 0.8390
         : individual accs = ['0.623946', '0.622761', '0.610472', '0.615882', '0.610760', '0.628400', '0.624704', '0.623762', '0.620890', '0.619495', '0.617819', '0.604671', '0.500488', '0.504944', '0.494553', '0.500313', '0.501842', '0.495827', '0.624658', '0.630738']
         : correct/total = [(8880, 14232), (8865, 14235), (8709, 14266), (8756, 14217), (8696, 14238), (9032, 14373), (8962, 14346), (8941, 14334), (8875, 14294), (8904, 14373), (8862, 14344), (8648, 14302), (7184, 14354), (7252, 14362), (7082, 14320), (7202, 14395), (7221, 14389), (7069, 14257), (8902, 14251), (9082, 14399)]
         : compromised: 0.5587, honest: 0.6090
         : ubar stats = ['Node 0: s1=0.500, s2=1.000', 'Node 1: s1=0.500, s2=1.000', 'Node 2: s1=0.500, s2=1.000']...
Round 005: test acc mean=0.5934 ± 0.0537 | min=0.5009 max=0.6383
         : test loss mean=0.8894 ± 0.4750
         : individual accs = ['0.628935', '0.630137', '0.620917', '0.630724', '0.630496', '0.638280', '0.633766', '0.632692', '0.628166', '0.624783', '0.622072', '0.613061', '0.506897', '0.506127', '0.503003', '0.526363', '0.500938', '0.529915', '0.630201', '0.629905']
         : correct/total = [(8951, 14232), (8970, 14235), (8858, 14266), (8967, 14217), (8977, 14238), (9174, 14373), (9092, 14346), (9069, 14334), (8979, 14294), (8980, 14373), (8923, 14344), (8768, 14302), (7276, 14354), (7269, 14362), (7203, 14320), (7577, 14395), (7208, 14389), (7555, 14257), (8981, 14251), (9070, 14399)]
         : compromised: 0.5705, honest: 0.6162
         : ubar stats = ['Node 0: s1=0.500, s2=1.000', 'Node 1: s1=0.500, s2=1.000', 'Node 2: s1=0.500, s2=1.000']...
Round 006: test acc mean=0.5961 ± 0.0590 | min=0.5012 max=0.6393
         : test loss mean=1.0337 ± 0.7748
         : individual accs = ['0.635961', '0.638145', '0.633815', '0.638180', '0.635272', '0.638419', '0.639272', '0.637017', '0.627886', '0.632297', '0.626603', '0.629073', '0.505295', '0.512046', '0.501187', '0.506982', '0.506568', '0.504594', '0.634762', '0.638655']
         : correct/total = [(9051, 14232), (9084, 14235), (9042, 14266), (9073, 14217), (9045, 14238), (9176, 14373), (9171, 14346), (9131, 14334), (8975, 14294), (9088, 14373), (8988, 14344), (8997, 14302), (7253, 14354), (7354, 14362), (7177, 14320), (7298, 14395), (7289, 14389), (7194, 14257), (9046, 14251), (9196, 14399)]
         : compromised: 0.5704, honest: 0.6218
         : ubar stats = ['Node 0: s1=0.500, s2=1.000', 'Node 1: s1=0.500, s2=1.000', 'Node 2: s1=0.500, s2=1.000']...
Round 007: test acc mean=0.5983 ± 0.0630 | min=0.4944 max=0.6463
         : test loss mean=0.8824 ± 0.4775
         : individual accs = ['0.643971', '0.637724', '0.637460', '0.646269', '0.644613', '0.641133', '0.639063', '0.633668', '0.630544', '0.640576', '0.635806', '0.630331', '0.514282', '0.502715', '0.505517', '0.496144', '0.501911', '0.494424', '0.643955', '0.645670']
         : correct/total = [(9165, 14232), (9078, 14235), (9094, 14266), (9188, 14217), (9178, 14238), (9215, 14373), (9168, 14346), (9083, 14334), (9013, 14294), (9207, 14373), (9120, 14344), (9015, 14302), (7382, 14354), (7220, 14362), (7239, 14320), (7142, 14395), (7222, 14389), (7049, 14257), (9177, 14251), (9297, 14399)]
         : compromised: 0.5704, honest: 0.6262
         : ubar stats = ['Node 0: s1=0.500, s2=1.000', 'Node 1: s1=0.500, s2=1.000', 'Node 2: s1=0.500, s2=1.000']...
Round 008: test acc mean=0.5998 ± 0.0650 | min=0.4866 max=0.6469
         : test loss mean=0.9845 ± 0.6941
         : individual accs = ['0.644815', '0.641096', '0.643067', '0.644932', '0.643279', '0.642942', '0.642967', '0.637226', '0.641318', '0.641968', '0.635597', '0.636904', '0.504807', '0.515040', '0.500768', '0.490656', '0.507610', '0.486568', '0.646621', '0.646920']
         : correct/total = [(9177, 14232), (9126, 14235), (9174, 14266), (9169, 14217), (9159, 14238), (9241, 14373), (9224, 14346), (9134, 14334), (9167, 14294), (9227, 14373), (9117, 14344), (9109, 14302), (7246, 14354), (7397, 14362), (7171, 14320), (7063, 14395), (7304, 14389), (6937, 14257), (9215, 14251), (9315, 14399)]
         : compromised: 0.5708, honest: 0.6287
         : ubar stats = ['Node 0: s1=0.500, s2=1.000', 'Node 1: s1=0.500, s2=1.000', 'Node 2: s1=0.500, s2=1.000']...
Round 009: test acc mean=0.6017 ± 0.0657 | min=0.4924 max=0.6517
         : test loss mean=0.8724 ± 0.4689
         : individual accs = ['0.647203', '0.648542', '0.644610', '0.644862', '0.645807', '0.644681', '0.644291', '0.643505', '0.646075', '0.641898', '0.636712', '0.638792', '0.503623', '0.503481', '0.508799', '0.492393', '0.508235', '0.492460', '0.645358', '0.651712']
         : correct/total = [(9211, 14232), (9232, 14235), (9196, 14266), (9168, 14217), (9195, 14238), (9266, 14373), (9243, 14346), (9224, 14334), (9235, 14294), (9226, 14373), (9133, 14344), (9136, 14302), (7229, 14354), (7231, 14362), (7286, 14320), (7088, 14395), (7313, 14389), (7021, 14257), (9197, 14251), (9384, 14399)]
         : compromised: 0.5723, honest: 0.6310
         : ubar stats = ['Node 0: s1=0.500, s2=1.000', 'Node 1: s1=0.500, s2=1.000', 'Node 2: s1=0.500, s2=1.000']...
Round 010: test acc mean=0.6042 ± 0.0671 | min=0.4938 max=0.6529
         : test loss mean=1.0179 ± 0.7681
         : individual accs = ['0.651700', '0.652898', '0.647133', '0.652177', '0.651777', '0.645725', '0.645825', '0.645458', '0.651252', '0.645864', '0.642150', '0.640470', '0.502787', '0.509957', '0.500698', '0.501146', '0.503371', '0.493793', '0.648165', '0.652615']
         : correct/total = [(9275, 14232), (9294, 14235), (9232, 14266), (9272, 14217), (9280, 14238), (9281, 14373), (9265, 14346), (9252, 14334), (9309, 14294), (9283, 14373), (9211, 14344), (9160, 14302), (7217, 14354), (7324, 14362), (7170, 14320), (7214, 14395), (7243, 14389), (7040, 14257), (9237, 14251), (9397, 14399)]
         : compromised: 0.5743, honest: 0.6342
         : ubar stats = ['Node 0: s1=0.500, s2=1.000', 'Node 1: s1=0.500, s2=1.000', 'Node 2: s1=0.500, s2=1.000']...

=== FINAL RESULTS ===
Dataset: sent140, Nodes: 20, Graph: ring, Aggregation: ubar
Attack: krum, 50.0% compromised
Final accuracy - Compromised: 0.5743, Honest: 0.6342
Overall test accuracy: mean=0.6042 ± 0.0671

=== UBAR SUMMARY ===
Node 0: stage1=0.500, stage2=1.000, overall=0.500
Node 1: stage1=0.500, stage2=1.000, overall=0.500
Node 2: stage1=0.500, stage2=1.000, overall=0.500
Node 3: stage1=0.500, stage2=1.000, overall=0.500
Node 4: stage1=0.500, stage2=1.000, overall=0.500
Node 5: stage1=0.500, stage2=1.000, overall=0.500
Node 6: stage1=0.500, stage2=1.000, overall=0.500
Node 7: stage1=0.500, stage2=1.000, overall=0.500
Node 8: stage1=0.500, stage2=1.000, overall=0.500
Node 9: stage1=0.500, stage2=1.000, overall=0.500
Node 10: stage1=0.500, stage2=1.000, overall=0.500
Node 11: stage1=0.500, stage2=1.000, overall=0.500
Node 12: stage1=0.500, stage2=1.000, overall=0.500
Node 13: stage1=0.500, stage2=1.000, overall=0.500
Node 14: stage1=0.500, stage2=1.000, overall=0.500
Node 15: stage1=0.500, stage2=1.000, overall=0.500
Node 16: stage1=0.500, stage2=1.000, overall=0.500
Node 17: stage1=0.500, stage2=1.000, overall=0.500
Node 18: stage1=0.500, stage2=1.000, overall=0.500
Node 19: stage1=0.500, stage2=1.000, overall=0.500

=== PARALLEL EXECUTION TIME (realistic for distributed system) ===
  COMMUNICATION (max across nodes):
    - Full model transfer: 0.000s (0.0%)
  COMPUTATION (max across nodes):
    - Distance computation: 0.014s (47.4%)
    - Loss computation: 0.012s (41.2%)
    - Aggregation: 0.003s (11.5%)
  TOTALS:
    - Total computation: 0.030s (100.0%)
    - Total communication: 0.000s (0.0%)
    - Total parallel time: 0.030s

=== PER-NODE AVERAGE TIME ===
  - Distance computation: 0.009s
  - Loss computation: 0.009s
  - Aggregation: 0.003s
  - Model transfer: 0.000s
  - Total per node: 0.022s

=== TOTAL COMPUTATIONAL WORK (sum across all nodes) ===
  - Total distance computation: 0.187s
  - Total loss computation: 0.181s
  - Total aggregation: 0.065s
  - Total model transfer: 0.000s
  - Grand total: 0.433s
  - Mean Stage 1 acceptance rate: 0.500
  - Mean Stage 2 acceptance rate: 1.000
  - Overall acceptance rate: 0.500

UBAR Algorithm Properties:
  - Model dimension: 1,174,986
  - Rho parameter: 0.5
  - Two-stage approach: Distance filtering + loss evaluation
  - Stage 1 selects: 50% of neighbors
  - Stage 2 uses: Training sample loss comparison
  - Theoretical complexity: O(deg(i)×d + deg(i)×inference)
  - Approach: UBAR paper implementation
