Device: cuda
Seed: 987654321
Loading 1 LEAF Sent140 train files...
LEAF Sent140 train: 254555 users, 908652 samples
Building vocabulary (max_size=10000)...
Vocabulary size: 10000
Loading 1 LEAF Sent140 test files...
LEAF Sent140 test: 254555 users, 286281 samples
Found 254555 train users, 254555 test users, 254555 common users
User sample counts range: 494 (max) to 1 (min)
Distributed ALL 254555 users across 20 clients
Users per client: 12727 (with 15 clients getting +1 user)
Train partition sizes: [44353, 44290, 44657, 44907, 44696, 45843, 45801, 45619, 45069, 45639, 45821, 45311, 45779, 46056, 45625, 45984, 46428, 44737, 45540, 46497]
Test partition sizes: [14232, 14235, 14266, 14217, 14238, 14373, 14346, 14334, 14294, 14373, 14344, 14302, 14354, 14362, 14320, 14395, 14389, 14257, 14251, 14399]
  Client 0: 44353 train samples, 2 unique classes
  Client 1: 44290 train samples, 2 unique classes
  Client 2: 44657 train samples, 2 unique classes
  Client 3: 44907 train samples, 2 unique classes
  Client 4: 44696 train samples, 2 unique classes
  Client 5: 45843 train samples, 2 unique classes
  Client 6: 45801 train samples, 2 unique classes
  Client 7: 45619 train samples, 2 unique classes
  Client 8: 45069 train samples, 2 unique classes
  Client 9: 45639 train samples, 2 unique classes
  Client 10: 45821 train samples, 2 unique classes
  Client 11: 45311 train samples, 2 unique classes
  Client 12: 45779 train samples, 2 unique classes
  Client 13: 46056 train samples, 2 unique classes
  Client 14: 45625 train samples, 2 unique classes
  Client 15: 45984 train samples, 2 unique classes
  Client 16: 46428 train samples, 2 unique classes
  Client 17: 44737 train samples, 2 unique classes
  Client 18: 45540 train samples, 2 unique classes
  Client 19: 46497 train samples, 2 unique classes
Will sample 4500 samples per client per epoch
Graph: fully, nodes: 20, edges: 190
Degree statistics: avg=19.00, min=19, max=19
Attack: Compromised 2/20 nodes: [5, 13]
Attack type: directed_deviation, lambda: 1.0
Model variant: baseline
Model parameters: 1,174,986
Sketchguard Node 0:
  Model dim: 1,174,986 → Sketch size: 180
  Compression ratio: 6527.7x
  Using model parameters for aggregation, sketches for filtering
Sketchguard Node 1:
  Model dim: 1,174,986 → Sketch size: 180
  Compression ratio: 6527.7x
  Using model parameters for aggregation, sketches for filtering
Sketchguard Node 2:
  Model dim: 1,174,986 → Sketch size: 180
  Compression ratio: 6527.7x
  Using model parameters for aggregation, sketches for filtering
Sketchguard Node 3:
  Model dim: 1,174,986 → Sketch size: 180
  Compression ratio: 6527.7x
  Using model parameters for aggregation, sketches for filtering
Sketchguard Node 4:
  Model dim: 1,174,986 → Sketch size: 180
  Compression ratio: 6527.7x
  Using model parameters for aggregation, sketches for filtering
Sketchguard Node 5:
  Model dim: 1,174,986 → Sketch size: 180
  Compression ratio: 6527.7x
  Using model parameters for aggregation, sketches for filtering
Sketchguard Node 6:
  Model dim: 1,174,986 → Sketch size: 180
  Compression ratio: 6527.7x
  Using model parameters for aggregation, sketches for filtering
Sketchguard Node 7:
  Model dim: 1,174,986 → Sketch size: 180
  Compression ratio: 6527.7x
  Using model parameters for aggregation, sketches for filtering
Sketchguard Node 8:
  Model dim: 1,174,986 → Sketch size: 180
  Compression ratio: 6527.7x
  Using model parameters for aggregation, sketches for filtering
Sketchguard Node 9:
  Model dim: 1,174,986 → Sketch size: 180
  Compression ratio: 6527.7x
  Using model parameters for aggregation, sketches for filtering
Sketchguard Node 10:
  Model dim: 1,174,986 → Sketch size: 180
  Compression ratio: 6527.7x
  Using model parameters for aggregation, sketches for filtering
Sketchguard Node 11:
  Model dim: 1,174,986 → Sketch size: 180
  Compression ratio: 6527.7x
  Using model parameters for aggregation, sketches for filtering
Sketchguard Node 12:
  Model dim: 1,174,986 → Sketch size: 180
  Compression ratio: 6527.7x
  Using model parameters for aggregation, sketches for filtering
Sketchguard Node 13:
  Model dim: 1,174,986 → Sketch size: 180
  Compression ratio: 6527.7x
  Using model parameters for aggregation, sketches for filtering
Sketchguard Node 14:
  Model dim: 1,174,986 → Sketch size: 180
  Compression ratio: 6527.7x
  Using model parameters for aggregation, sketches for filtering
Sketchguard Node 15:
  Model dim: 1,174,986 → Sketch size: 180
  Compression ratio: 6527.7x
  Using model parameters for aggregation, sketches for filtering
Sketchguard Node 16:
  Model dim: 1,174,986 → Sketch size: 180
  Compression ratio: 6527.7x
  Using model parameters for aggregation, sketches for filtering
Sketchguard Node 17:
  Model dim: 1,174,986 → Sketch size: 180
  Compression ratio: 6527.7x
  Using model parameters for aggregation, sketches for filtering
Sketchguard Node 18:
  Model dim: 1,174,986 → Sketch size: 180
  Compression ratio: 6527.7x
  Using model parameters for aggregation, sketches for filtering
Sketchguard Node 19:
  Model dim: 1,174,986 → Sketch size: 180
  Compression ratio: 6527.7x
  Using model parameters for aggregation, sketches for filtering
Sketchguard ALGORITHM (Sketch-based Filtering + State Aggregation)
  - Model dimension: 1,174,986 parameters
  - Config: SketchguardConfig(gamma=2, kappa=1, alpha=0.5, min_neighbors=1, sketch_size=180, network_seed=987654321, attack_detection_window=5)
  - Sketch size: 180
  - Compression ratio: 6527.7x
  - Complexity: O(d + N×k) = O(1,174,986 + 20×180)
  - Theoretical speedup vs BALANCE: 19.9x
Initial test acc across nodes: mean=0.4953 ± 0.0174
Round 001: test acc mean=0.5165 ± 0.0193 | min=0.5002 max=0.5676
         : test loss mean=0.6922 ± 0.0021
         : individual accs = ['0.507378', '0.517106', '0.513108', '0.553633', '0.505829', '0.510471', '0.500209', '0.509488', '0.501819', '0.507618', '0.512479', '0.506153', '0.567647', '0.552709', '0.507193', '0.503786', '0.507679', '0.504805', '0.538068', '0.502049']
         : correct/total = [(7221, 14232), (7361, 14235), (7320, 14266), (7871, 14217), (7202, 14238), (7337, 14373), (7176, 14346), (7303, 14334), (7173, 14294), (7296, 14373), (7351, 14344), (7239, 14302), (8148, 14354), (7938, 14362), (7263, 14320), (7252, 14395), (7305, 14389), (7197, 14257), (7668, 14251), (7229, 14399)]
         : compromised: 0.5316, honest: 0.5148
         : sketchguard stats = ['Node 0: acc_rate=1.000', 'Node 1: acc_rate=1.000', 'Node 2: acc_rate=1.000']...
Round 002: test acc mean=0.5817 ± 0.0372 | min=0.5246 max=0.6296
         : test loss mean=0.6870 ± 0.0015
         : individual accs = ['0.601251', '0.629575', '0.613907', '0.613210', '0.629232', '0.541780', '0.558832', '0.626203', '0.605009', '0.532387', '0.553681', '0.600056', '0.596349', '0.590238', '0.541411', '0.600278', '0.524567', '0.524655', '0.532875', '0.617960']
         : correct/total = [(8557, 14232), (8962, 14235), (8758, 14266), (8718, 14217), (8959, 14238), (7787, 14373), (8017, 14346), (8976, 14334), (8648, 14294), (7652, 14373), (7942, 14344), (8582, 14302), (8560, 14354), (8477, 14362), (7753, 14320), (8641, 14395), (7548, 14389), (7480, 14257), (7594, 14251), (8898, 14399)]
         : compromised: 0.5660, honest: 0.5834
         : sketchguard stats = ['Node 0: acc_rate=0.947', 'Node 1: acc_rate=0.947', 'Node 2: acc_rate=0.947']...
Round 003: test acc mean=0.6033 ± 0.0215 | min=0.5460 max=0.6269
         : test loss mean=0.6821 ± 0.0022
         : individual accs = ['0.597035', '0.621075', '0.584607', '0.610466', '0.620663', '0.624017', '0.599470', '0.580647', '0.615923', '0.617268', '0.626882', '0.546008', '0.618922', '0.611475', '0.596020', '0.612226', '0.617972', '0.598443', '0.612378', '0.555455']
         : correct/total = [(8497, 14232), (8841, 14235), (8340, 14266), (8679, 14217), (8837, 14238), (8969, 14373), (8600, 14346), (8323, 14334), (8804, 14294), (8872, 14373), (8992, 14344), (7809, 14302), (8884, 14354), (8782, 14362), (8535, 14320), (8813, 14395), (8892, 14389), (8532, 14257), (8727, 14251), (7998, 14399)]
         : compromised: 0.6177, honest: 0.6017
         : sketchguard stats = ['Node 0: acc_rate=0.930', 'Node 1: acc_rate=0.930', 'Node 2: acc_rate=0.930']...
Round 004: test acc mean=0.6229 ± 0.0159 | min=0.5719 max=0.6414
         : test loss mean=0.6697 ± 0.0040
         : individual accs = ['0.616287', '0.632174', '0.609421', '0.628895', '0.638643', '0.636819', '0.624146', '0.641412', '0.616063', '0.604188', '0.628067', '0.625787', '0.626306', '0.571856', '0.606983', '0.635776', '0.635485', '0.628253', '0.614624', '0.636919']
         : correct/total = [(8771, 14232), (8999, 14235), (8694, 14266), (8941, 14217), (9093, 14238), (9153, 14373), (8954, 14346), (9194, 14334), (8806, 14294), (8684, 14373), (9009, 14344), (8950, 14302), (8990, 14354), (8213, 14362), (8692, 14320), (9152, 14395), (9144, 14389), (8957, 14257), (8759, 14251), (9171, 14399)]
         : compromised: 0.6043, honest: 0.6250
         : sketchguard stats = ['Node 0: acc_rate=0.921', 'Node 1: acc_rate=0.921', 'Node 2: acc_rate=0.921']...
Round 005: test acc mean=0.6358 ± 0.0065 | min=0.6208 max=0.6459
         : test loss mean=0.6488 ± 0.0034
         : individual accs = ['0.637577', '0.636319', '0.632132', '0.634944', '0.639416', '0.639532', '0.639203', '0.624599', '0.645935', '0.620817', '0.635388', '0.641099', '0.635851', '0.631597', '0.642947', '0.644668', '0.642366', '0.631900', '0.626202', '0.634211']
         : correct/total = [(9074, 14232), (9058, 14235), (9018, 14266), (9027, 14217), (9104, 14238), (9192, 14373), (9170, 14346), (8953, 14334), (9233, 14294), (8923, 14373), (9114, 14344), (9169, 14302), (9127, 14354), (9071, 14362), (9207, 14320), (9280, 14395), (9243, 14389), (9009, 14257), (8924, 14251), (9132, 14399)]
         : compromised: 0.6356, honest: 0.6359
         : sketchguard stats = ['Node 0: acc_rate=0.916', 'Node 1: acc_rate=0.916', 'Node 2: acc_rate=0.916']...
Round 006: test acc mean=0.6451 ± 0.0048 | min=0.6365 max=0.6523
         : test loss mean=0.6344 ± 0.0033
         : individual accs = ['0.646150', '0.650720', '0.641035', '0.644510', '0.645386', '0.650456', '0.645546', '0.652225', '0.650273', '0.645168', '0.638664', '0.636484', '0.639891', '0.645314', '0.644204', '0.649739', '0.652304', '0.638213', '0.638622', '0.647684']
         : correct/total = [(9196, 14232), (9263, 14235), (9145, 14266), (9163, 14217), (9189, 14238), (9349, 14373), (9261, 14346), (9349, 14334), (9295, 14294), (9273, 14373), (9161, 14344), (9103, 14302), (9185, 14354), (9268, 14362), (9225, 14320), (9353, 14395), (9386, 14389), (9099, 14257), (9101, 14251), (9326, 14399)]
         : compromised: 0.6479, honest: 0.6448
         : sketchguard stats = ['Node 0: acc_rate=0.912', 'Node 1: acc_rate=0.912', 'Node 2: acc_rate=0.912']...
Round 007: test acc mean=0.6493 ± 0.0071 | min=0.6340 max=0.6593
         : test loss mean=0.6281 ± 0.0051
         : individual accs = ['0.653387', '0.656832', '0.647413', '0.652177', '0.656342', '0.659292', '0.650634', '0.634017', '0.655450', '0.652265', '0.637131', '0.651937', '0.653755', '0.641763', '0.655796', '0.635707', '0.652095', '0.647331', '0.643885', '0.649351']
         : correct/total = [(9299, 14232), (9350, 14235), (9236, 14266), (9272, 14217), (9345, 14238), (9476, 14373), (9334, 14346), (9088, 14334), (9369, 14294), (9375, 14373), (9139, 14344), (9324, 14302), (9384, 14354), (9217, 14362), (9391, 14320), (9151, 14395), (9383, 14389), (9229, 14257), (9176, 14251), (9350, 14399)]
         : compromised: 0.6505, honest: 0.6492
         : sketchguard stats = ['Node 0: acc_rate=0.910', 'Node 1: acc_rate=0.910', 'Node 2: acc_rate=0.910']...
Round 008: test acc mean=0.6573 ± 0.0062 | min=0.6403 max=0.6640
         : test loss mean=0.6204 ± 0.0052
         : individual accs = ['0.659219', '0.650158', '0.640264', '0.661532', '0.657958', '0.661866', '0.663739', '0.658853', '0.663985', '0.658944', '0.659370', '0.661516', '0.649436', '0.657499', '0.660405', '0.656756', '0.662659', '0.653083', '0.645849', '0.663032']
         : correct/total = [(9382, 14232), (9255, 14235), (9134, 14266), (9405, 14217), (9368, 14238), (9513, 14373), (9522, 14346), (9444, 14334), (9491, 14294), (9471, 14373), (9458, 14344), (9461, 14302), (9322, 14354), (9443, 14362), (9457, 14320), (9454, 14395), (9535, 14389), (9311, 14257), (9204, 14251), (9547, 14399)]
         : compromised: 0.6597, honest: 0.6570
         : sketchguard stats = ['Node 0: acc_rate=0.908', 'Node 1: acc_rate=0.908', 'Node 2: acc_rate=0.908']...
Round 009: test acc mean=0.6620 ± 0.0094 | min=0.6263 max=0.6732
         : test loss mean=0.6155 ± 0.0074
         : individual accs = ['0.626265', '0.669687', '0.660802', '0.666174', '0.658730', '0.671885', '0.663251', '0.662620', '0.666014', '0.662283', '0.653235', '0.656482', '0.665947', '0.661607', '0.665223', '0.660021', '0.673223', '0.665007', '0.663462', '0.667269']
         : correct/total = [(8913, 14232), (9533, 14235), (9427, 14266), (9471, 14217), (9379, 14238), (9657, 14373), (9515, 14346), (9498, 14334), (9520, 14294), (9519, 14373), (9370, 14344), (9389, 14302), (9559, 14354), (9502, 14362), (9526, 14320), (9501, 14395), (9687, 14389), (9481, 14257), (9455, 14251), (9608, 14399)]
         : compromised: 0.6667, honest: 0.6614
         : sketchguard stats = ['Node 0: acc_rate=0.906', 'Node 1: acc_rate=0.906', 'Node 2: acc_rate=0.906']...
Round 010: test acc mean=0.6717 ± 0.0060 | min=0.6563 max=0.6829
         : test loss mean=0.6061 ± 0.0047
         : individual accs = ['0.668142', '0.676572', '0.656316', '0.674474', '0.677132', '0.674807', '0.677192', '0.682852', '0.672730', '0.662144', '0.668293', '0.674871', '0.673192', '0.670450', '0.673115', '0.668149', '0.678365', '0.670618', '0.664024', '0.670185']
         : correct/total = [(9509, 14232), (9631, 14235), (9363, 14266), (9589, 14217), (9641, 14238), (9699, 14373), (9715, 14346), (9788, 14334), (9616, 14294), (9517, 14373), (9586, 14344), (9652, 14302), (9663, 14354), (9629, 14362), (9639, 14320), (9618, 14395), (9761, 14389), (9561, 14257), (9463, 14251), (9650, 14399)]
         : compromised: 0.6726, honest: 0.6716
         : sketchguard stats = ['Node 0: acc_rate=0.905', 'Node 1: acc_rate=0.905', 'Node 2: acc_rate=0.905']...

=== FINAL RESULTS ===
Dataset: sent140, Nodes: 20, Graph: fully, Aggregation: sketchguard
Attack: directed_deviation, 10.0% compromised
Final accuracy - Compromised: 0.6726, Honest: 0.6716
Overall test accuracy: mean=0.6717 ± 0.0060

=== Sketchguard SUMMARY ===
Node 0: acceptance=0.905
Node 1: acceptance=0.905
Node 2: acceptance=0.905
Node 3: acceptance=0.905
Node 4: acceptance=0.905
Node 5: acceptance=0.953
Node 6: acceptance=0.905
Node 7: acceptance=0.905
Node 8: acceptance=0.905
Node 9: acceptance=0.905
Node 10: acceptance=0.905
Node 11: acceptance=0.905
Node 12: acceptance=0.905
Node 13: acceptance=0.958
Node 14: acceptance=0.905
Node 15: acceptance=0.905
Node 16: acceptance=0.905
Node 17: acceptance=0.905
Node 18: acceptance=0.905
Node 19: acceptance=0.905

=== PARALLEL EXECUTION TIME (realistic for distributed system) ===
  COMMUNICATION (max across nodes):
    - Sketch transfer: 0.000s (0.0%)
    - Model fetch (accepted): 0.000s (0.0%)
  COMPUTATION (max across nodes):
    - Sketching: 0.670s (95.4%)
    - Filtering: 0.001s (0.2%)
    - Aggregation: 0.031s (4.4%)
  TOTALS:
    - Total computation: 0.703s (100.0%)
    - Total communication: 0.000s (0.0%)
    - Total parallel time: 0.703s

=== PER-NODE AVERAGE TIME ===
  - Sketching: 0.598s
  - Filtering: 0.001s
  - Aggregation: 0.028s
  - Sketch transfer: 0.000s
  - Model fetch: 0.000s
  - Total per node: 0.627s

=== TOTAL COMPUTATIONAL WORK (sum across all nodes) ===
  - Total sketching: 11.966s
  - Total filtering: 0.016s
  - Total aggregation: 0.559s
  - Total sketch transfer: 0.000s
  - Total model fetch: 0.000s
  - Grand total: 12.541s
  - Mean acceptance rate: 0.910

Sketchguard Algorithm Properties:
  - Original dimension: 1,174,986
  - Sketch size: 180
  - Compression ratio: 19.9x
  - Single repetition: No repetitions needed
  - Theoretical complexity: O(d + N×k)
  - Approach: Sketch filtering + state aggregation
