Device: cuda
Seed: 987654321
Loading 1 LEAF Sent140 train files...
LEAF Sent140 train: 254555 users, 908652 samples
Building vocabulary (max_size=10000)...
Vocabulary size: 10000
Loading 1 LEAF Sent140 test files...
LEAF Sent140 test: 254555 users, 286281 samples
Found 254555 train users, 254555 test users, 254555 common users
User sample counts range: 494 (max) to 1 (min)
Distributed ALL 254555 users across 20 clients
Users per client: 12727 (with 15 clients getting +1 user)
Train partition sizes: [44353, 44290, 44657, 44907, 44696, 45843, 45801, 45619, 45069, 45639, 45821, 45311, 45779, 46056, 45625, 45984, 46428, 44737, 45540, 46497]
Test partition sizes: [14232, 14235, 14266, 14217, 14238, 14373, 14346, 14334, 14294, 14373, 14344, 14302, 14354, 14362, 14320, 14395, 14389, 14257, 14251, 14399]
  Client 0: 44353 train samples, 2 unique classes
  Client 1: 44290 train samples, 2 unique classes
  Client 2: 44657 train samples, 2 unique classes
  Client 3: 44907 train samples, 2 unique classes
  Client 4: 44696 train samples, 2 unique classes
  Client 5: 45843 train samples, 2 unique classes
  Client 6: 45801 train samples, 2 unique classes
  Client 7: 45619 train samples, 2 unique classes
  Client 8: 45069 train samples, 2 unique classes
  Client 9: 45639 train samples, 2 unique classes
  Client 10: 45821 train samples, 2 unique classes
  Client 11: 45311 train samples, 2 unique classes
  Client 12: 45779 train samples, 2 unique classes
  Client 13: 46056 train samples, 2 unique classes
  Client 14: 45625 train samples, 2 unique classes
  Client 15: 45984 train samples, 2 unique classes
  Client 16: 46428 train samples, 2 unique classes
  Client 17: 44737 train samples, 2 unique classes
  Client 18: 45540 train samples, 2 unique classes
  Client 19: 46497 train samples, 2 unique classes
Will sample 4500 samples per client per epoch
Graph: ring, nodes: 20, edges: 20
Degree statistics: avg=2.00, min=2, max=2
Attack: Compromised 2/20 nodes: [5, 13]
Attack type: gaussian, lambda: 1.0
Model variant: baseline
Model parameters: 1,174,986
UBAR ALGORITHM (Two-Stage Byzantine-resilient)
  - Model dimension: 1,174,986 parameters
  - Rho parameter: 0.9
  - Stage 1: Distance-based filtering (select 90% closest neighbors)
  - Stage 2: Performance-based selection (loss comparison)
  - Complexity: O(deg(i)×d + deg(i)×inference)
Initial test acc across nodes: mean=0.4965 ± 0.0152
Round 001: test acc mean=0.5276 ± 0.0182 | min=0.4927 max=0.5627
         : test loss mean=0.6913 ± 0.0014
         : individual accs = ['0.548974', '0.523147', '0.537852', '0.515017', '0.517980', '0.517846', '0.562666', '0.553858', '0.511613', '0.526473', '0.522170', '0.533562', '0.505713', '0.549993', '0.524860', '0.525252', '0.539648', '0.492670', '0.498842', '0.543649']
         : correct/total = [(7813, 14232), (7447, 14235), (7673, 14266), (7322, 14217), (7375, 14238), (7443, 14373), (8072, 14346), (7939, 14334), (7313, 14294), (7567, 14373), (7490, 14344), (7631, 14302), (7259, 14354), (7899, 14362), (7516, 14320), (7561, 14395), (7765, 14389), (7024, 14257), (7109, 14251), (7828, 14399)]
         : compromised: 0.5339, honest: 0.5269
         : ubar stats = ['Node 0: s1=0.500, s2=1.000', 'Node 1: s1=0.500, s2=1.000', 'Node 2: s1=0.500, s2=1.000']...
Round 002: test acc mean=0.5706 ± 0.0234 | min=0.5268 max=0.6080
         : test loss mean=0.6831 ± 0.0064
         : individual accs = ['0.592397', '0.565227', '0.570517', '0.560245', '0.559559', '0.559800', '0.608044', '0.605135', '0.573317', '0.559939', '0.602552', '0.600266', '0.589034', '0.549715', '0.543715', '0.550538', '0.571617', '0.534544', '0.526840', '0.588791']
         : correct/total = [(8431, 14232), (8046, 14235), (8139, 14266), (7965, 14217), (7967, 14238), (8046, 14373), (8723, 14346), (8674, 14334), (8195, 14294), (8048, 14373), (8643, 14344), (8585, 14302), (8455, 14354), (7895, 14362), (7786, 14320), (7925, 14395), (8225, 14389), (7621, 14257), (7508, 14251), (8478, 14399)]
         : compromised: 0.5548, honest: 0.5723
         : ubar stats = ['Node 0: s1=0.500, s2=1.000', 'Node 1: s1=0.500, s2=1.000', 'Node 2: s1=0.500, s2=1.000']...
Round 003: test acc mean=0.5973 ± 0.0182 | min=0.5409 max=0.6177
         : test loss mean=0.6696 ± 0.0097
         : individual accs = ['0.615163', '0.605550', '0.540866', '0.601744', '0.599382', '0.597092', '0.615015', '0.616157', '0.605919', '0.593752', '0.608826', '0.610194', '0.614393', '0.586409', '0.590014', '0.592497', '0.575301', '0.581749', '0.579258', '0.617682']
         : correct/total = [(8755, 14232), (8620, 14235), (7716, 14266), (8555, 14217), (8534, 14238), (8582, 14373), (8823, 14346), (8832, 14334), (8661, 14294), (8534, 14373), (8733, 14344), (8727, 14302), (8819, 14354), (8422, 14362), (8449, 14320), (8529, 14395), (8278, 14389), (8294, 14257), (8255, 14251), (8894, 14399)]
         : compromised: 0.5918, honest: 0.5980
         : ubar stats = ['Node 0: s1=0.500, s2=1.000', 'Node 1: s1=0.500, s2=1.000', 'Node 2: s1=0.500, s2=1.000']...
Round 004: test acc mean=0.6167 ± 0.0115 | min=0.5915 max=0.6306
         : test loss mean=0.6553 ± 0.0103
         : individual accs = ['0.625562', '0.622761', '0.591546', '0.616375', '0.610900', '0.628331', '0.624286', '0.625785', '0.621939', '0.630557', '0.618865', '0.627954', '0.625192', '0.611892', '0.610265', '0.612435', '0.594899', '0.605176', '0.598625', '0.629697']
         : correct/total = [(8903, 14232), (8865, 14235), (8439, 14266), (8763, 14217), (8698, 14238), (9031, 14373), (8956, 14346), (8970, 14334), (8890, 14294), (9063, 14373), (8877, 14344), (8981, 14302), (8974, 14354), (8788, 14362), (8739, 14320), (8816, 14395), (8560, 14389), (8628, 14257), (8531, 14251), (9067, 14399)]
         : compromised: 0.6201, honest: 0.6163
         : ubar stats = ['Node 0: s1=0.500, s2=1.000', 'Node 1: s1=0.500, s2=1.000', 'Node 2: s1=0.500, s2=1.000']...
Round 005: test acc mean=0.6249 ± 0.0110 | min=0.6035 max=0.6383
         : test loss mean=0.6471 ± 0.0080
         : individual accs = ['0.628513', '0.632104', '0.606197', '0.631990', '0.630777', '0.638280', '0.634741', '0.633250', '0.627956', '0.632923', '0.627091', '0.633688', '0.636478', '0.621710', '0.616061', '0.620841', '0.603517', '0.608543', '0.603817', '0.630183']
         : correct/total = [(8945, 14232), (8998, 14235), (8648, 14266), (8985, 14217), (8981, 14238), (9174, 14373), (9106, 14346), (9077, 14334), (8976, 14294), (9097, 14373), (8995, 14344), (9063, 14302), (9136, 14354), (8929, 14362), (8822, 14320), (8937, 14395), (8684, 14389), (8676, 14257), (8605, 14251), (9074, 14399)]
         : compromised: 0.6300, honest: 0.6244
         : ubar stats = ['Node 0: s1=0.500, s2=1.000', 'Node 1: s1=0.500, s2=1.000', 'Node 2: s1=0.500, s2=1.000']...
Round 006: test acc mean=0.6318 ± 0.0091 | min=0.6112 max=0.6434
         : test loss mean=0.6413 ± 0.0069
         : individual accs = ['0.636523', '0.638637', '0.630170', '0.639164', '0.636185', '0.638280', '0.638924', '0.635343', '0.626836', '0.643359', '0.631274', '0.642917', '0.634109', '0.634661', '0.616620', '0.628621', '0.611161', '0.622712', '0.613781', '0.637475']
         : correct/total = [(9059, 14232), (9091, 14235), (8990, 14266), (9087, 14217), (9058, 14238), (9174, 14373), (9166, 14346), (9107, 14334), (8960, 14294), (9247, 14373), (9055, 14344), (9195, 14302), (9102, 14354), (9115, 14362), (8830, 14320), (9049, 14395), (8794, 14389), (8878, 14257), (8747, 14251), (9179, 14399)]
         : compromised: 0.6365, honest: 0.6313
         : ubar stats = ['Node 0: s1=0.500, s2=1.000', 'Node 1: s1=0.500, s2=1.000', 'Node 2: s1=0.500, s2=1.000']...
Round 007: test acc mean=0.6361 ± 0.0078 | min=0.6194 max=0.6457
         : test loss mean=0.6384 ± 0.0060
         : individual accs = ['0.643690', '0.637302', '0.619375', '0.645073', '0.643630', '0.641341', '0.639133', '0.633389', '0.629215', '0.645725', '0.633993', '0.637883', '0.643375', '0.638142', '0.633450', '0.637374', '0.623532', '0.627692', '0.623325', '0.645670']
         : correct/total = [(9161, 14232), (9072, 14235), (8836, 14266), (9171, 14217), (9164, 14238), (9218, 14373), (9169, 14346), (9079, 14334), (8994, 14294), (9281, 14373), (9094, 14344), (9123, 14302), (9235, 14354), (9165, 14362), (9071, 14320), (9175, 14395), (8972, 14389), (8949, 14257), (8883, 14251), (9297, 14399)]
         : compromised: 0.6397, honest: 0.6357
         : ubar stats = ['Node 0: s1=0.500, s2=1.000', 'Node 1: s1=0.500, s2=1.000', 'Node 2: s1=0.500, s2=1.000']...
Round 008: test acc mean=0.6402 ± 0.0062 | min=0.6268 max=0.6500
         : test loss mean=0.6343 ± 0.0048
         : individual accs = ['0.644323', '0.639902', '0.636408', '0.645495', '0.642506', '0.641411', '0.642479', '0.637715', '0.642647', '0.649969', '0.639292', '0.643896', '0.646997', '0.639744', '0.637709', '0.643209', '0.626798', '0.629656', '0.627324', '0.647128']
         : correct/total = [(9170, 14232), (9109, 14235), (9079, 14266), (9177, 14217), (9148, 14238), (9219, 14373), (9217, 14346), (9141, 14334), (9186, 14294), (9342, 14373), (9170, 14344), (9209, 14302), (9287, 14354), (9188, 14362), (9132, 14320), (9259, 14395), (9019, 14389), (8977, 14257), (8940, 14251), (9318, 14399)]
         : compromised: 0.6406, honest: 0.6402
         : ubar stats = ['Node 0: s1=0.500, s2=1.000', 'Node 1: s1=0.500, s2=1.000', 'Node 2: s1=0.500, s2=1.000']...
Round 009: test acc mean=0.6435 ± 0.0068 | min=0.6292 max=0.6524
         : test loss mean=0.6315 ± 0.0050
         : individual accs = ['0.647695', '0.648261', '0.643067', '0.643244', '0.645526', '0.644194', '0.644918', '0.644691', '0.644676', '0.651499', '0.645357', '0.649070', '0.652362', '0.642668', '0.638408', '0.643348', '0.629509', '0.629305', '0.629219', '0.652337']
         : correct/total = [(9218, 14232), (9228, 14235), (9174, 14266), (9145, 14217), (9191, 14238), (9259, 14373), (9252, 14346), (9241, 14334), (9215, 14294), (9364, 14373), (9257, 14344), (9283, 14302), (9364, 14354), (9230, 14362), (9142, 14320), (9261, 14395), (9058, 14389), (8972, 14257), (8967, 14251), (9393, 14399)]
         : compromised: 0.6434, honest: 0.6435
         : ubar stats = ['Node 0: s1=0.500, s2=1.000', 'Node 1: s1=0.500, s2=1.000', 'Node 2: s1=0.500, s2=1.000']...
Round 010: test acc mean=0.6465 ± 0.0066 | min=0.6311 max=0.6570
         : test loss mean=0.6292 ± 0.0050
         : individual accs = ['0.650576', '0.654022', '0.643628', '0.653302', '0.651707', '0.647255', '0.645894', '0.644482', '0.650063', '0.654630', '0.642080', '0.646972', '0.656960', '0.643573', '0.642109', '0.645988', '0.631107', '0.634565', '0.637920', '0.652198']
         : correct/total = [(9259, 14232), (9310, 14235), (9182, 14266), (9288, 14217), (9279, 14238), (9303, 14373), (9266, 14346), (9238, 14334), (9292, 14294), (9409, 14373), (9210, 14344), (9253, 14302), (9430, 14354), (9243, 14362), (9195, 14320), (9299, 14395), (9081, 14389), (9047, 14257), (9091, 14251), (9391, 14399)]
         : compromised: 0.6454, honest: 0.6466
         : ubar stats = ['Node 0: s1=0.500, s2=1.000', 'Node 1: s1=0.500, s2=1.000', 'Node 2: s1=0.500, s2=1.000']...

=== FINAL RESULTS ===
Dataset: sent140, Nodes: 20, Graph: ring, Aggregation: ubar
Attack: gaussian, 10.0% compromised
Final accuracy - Compromised: 0.6454, Honest: 0.6466
Overall test accuracy: mean=0.6465 ± 0.0066

=== UBAR SUMMARY ===
Node 0: stage1=0.500, stage2=1.000, overall=0.500
Node 1: stage1=0.500, stage2=1.000, overall=0.500
Node 2: stage1=0.500, stage2=1.000, overall=0.500
Node 3: stage1=0.500, stage2=1.000, overall=0.500
Node 4: stage1=0.500, stage2=1.000, overall=0.500
Node 5: stage1=0.500, stage2=1.000, overall=0.500
Node 6: stage1=0.500, stage2=1.000, overall=0.500
Node 7: stage1=0.500, stage2=1.000, overall=0.500
Node 8: stage1=0.500, stage2=1.000, overall=0.500
Node 9: stage1=0.500, stage2=1.000, overall=0.500
Node 10: stage1=0.500, stage2=1.000, overall=0.500
Node 11: stage1=0.500, stage2=1.000, overall=0.500
Node 12: stage1=0.500, stage2=1.000, overall=0.500
Node 13: stage1=0.500, stage2=1.000, overall=0.500
Node 14: stage1=0.500, stage2=1.000, overall=0.500
Node 15: stage1=0.500, stage2=1.000, overall=0.500
Node 16: stage1=0.500, stage2=1.000, overall=0.500
Node 17: stage1=0.500, stage2=1.000, overall=0.500
Node 18: stage1=0.500, stage2=1.000, overall=0.500
Node 19: stage1=0.500, stage2=1.000, overall=0.500

=== PARALLEL EXECUTION TIME (realistic for distributed system) ===
  COMMUNICATION (max across nodes):
    - Full model transfer: 0.000s (0.0%)
  COMPUTATION (max across nodes):
    - Distance computation: 0.025s (60.4%)
    - Loss computation: 0.013s (31.2%)
    - Aggregation: 0.003s (8.4%)
  TOTALS:
    - Total computation: 0.041s (100.0%)
    - Total communication: 0.000s (0.0%)
    - Total parallel time: 0.041s

=== PER-NODE AVERAGE TIME ===
  - Distance computation: 0.009s
  - Loss computation: 0.009s
  - Aggregation: 0.003s
  - Model transfer: 0.000s
  - Total per node: 0.021s

=== TOTAL COMPUTATIONAL WORK (sum across all nodes) ===
  - Total distance computation: 0.182s
  - Total loss computation: 0.175s
  - Total aggregation: 0.064s
  - Total model transfer: 0.000s
  - Grand total: 0.421s
  - Mean Stage 1 acceptance rate: 0.500
  - Mean Stage 2 acceptance rate: 1.000
  - Overall acceptance rate: 0.500

UBAR Algorithm Properties:
  - Model dimension: 1,174,986
  - Rho parameter: 0.9
  - Two-stage approach: Distance filtering + loss evaluation
  - Stage 1 selects: 90% of neighbors
  - Stage 2 uses: Training sample loss comparison
  - Theoretical complexity: O(deg(i)×d + deg(i)×inference)
  - Approach: UBAR paper implementation
