Device: cuda
Seed: 987654321
Loading 1 LEAF Sent140 train files...
LEAF Sent140 train: 254555 users, 908652 samples
Building vocabulary (max_size=10000)...
Vocabulary size: 10000
Loading 1 LEAF Sent140 test files...
LEAF Sent140 test: 254555 users, 286281 samples
Found 254555 train users, 254555 test users, 254555 common users
User sample counts range: 494 (max) to 1 (min)
Distributed ALL 254555 users across 20 clients
Users per client: 12727 (with 15 clients getting +1 user)
Train partition sizes: [44353, 44290, 44657, 44907, 44696, 45843, 45801, 45619, 45069, 45639, 45821, 45311, 45779, 46056, 45625, 45984, 46428, 44737, 45540, 46497]
Test partition sizes: [14232, 14235, 14266, 14217, 14238, 14373, 14346, 14334, 14294, 14373, 14344, 14302, 14354, 14362, 14320, 14395, 14389, 14257, 14251, 14399]
  Client 0: 44353 train samples, 2 unique classes
  Client 1: 44290 train samples, 2 unique classes
  Client 2: 44657 train samples, 2 unique classes
  Client 3: 44907 train samples, 2 unique classes
  Client 4: 44696 train samples, 2 unique classes
  Client 5: 45843 train samples, 2 unique classes
  Client 6: 45801 train samples, 2 unique classes
  Client 7: 45619 train samples, 2 unique classes
  Client 8: 45069 train samples, 2 unique classes
  Client 9: 45639 train samples, 2 unique classes
  Client 10: 45821 train samples, 2 unique classes
  Client 11: 45311 train samples, 2 unique classes
  Client 12: 45779 train samples, 2 unique classes
  Client 13: 46056 train samples, 2 unique classes
  Client 14: 45625 train samples, 2 unique classes
  Client 15: 45984 train samples, 2 unique classes
  Client 16: 46428 train samples, 2 unique classes
  Client 17: 44737 train samples, 2 unique classes
  Client 18: 45540 train samples, 2 unique classes
  Client 19: 46497 train samples, 2 unique classes
Will sample 4500 samples per client per epoch
Graph: erdos, nodes: 20, edges: 48
Degree statistics: avg=4.80, min=2, max=7
Attack: Compromised 2/20 nodes: [5, 13]
Attack type: backdoor, lambda: 1.0
Backdoor target label: 1, trigger size: 3
Model variant: baseline
Model parameters: 1,174,986
Initial test acc across nodes: mean=0.4953 ± 0.0174
Backdoor attack: Created poisoned datasets for 2 compromised nodes
Round 001: test acc mean=0.6101 ± 0.0554 | min=0.4904 max=0.6506
         : test loss mean=4.9044 ± 8.7170
         : individual accs = ['0.612493', '0.647489', '0.624912', '0.512063', '0.643138', '0.637167', '0.650634', '0.648737', '0.630125', '0.641272', '0.643196', '0.490351', '0.632576', '0.503830', '0.496578', '0.636332', '0.639238', '0.639195', '0.641429', '0.630738']
         : correct/total = [(8717, 14232), (9217, 14235), (8915, 14266), (7280, 14217), (9157, 14238), (9158, 14373), (9334, 14346), (9299, 14334), (9007, 14294), (9217, 14373), (9226, 14344), (7013, 14302), (9080, 14354), (7236, 14362), (7111, 14320), (9160, 14395), (9198, 14389), (9113, 14257), (9141, 14251), (9082, 14399)]
         : compromised: 0.5705, honest: 0.6145
Round 002: test acc mean=0.6476 ± 0.0383 | min=0.4928 max=0.6681
         : test loss mean=1.9555 ± 5.8369
         : individual accs = ['0.661959', '0.667580', '0.652671', '0.664134', '0.656764', '0.668128', '0.664575', '0.666667', '0.658738', '0.660196', '0.652677', '0.661865', '0.617459', '0.492759', '0.623184', '0.665231', '0.666064', '0.630357', '0.659182', '0.661852']
         : correct/total = [(9421, 14232), (9503, 14235), (9311, 14266), (9442, 14217), (9351, 14238), (9603, 14373), (9534, 14346), (9556, 14334), (9416, 14294), (9489, 14373), (9362, 14344), (9466, 14302), (8863, 14354), (7077, 14362), (8924, 14320), (9576, 14395), (9584, 14389), (8987, 14257), (9394, 14251), (9530, 14399)]
         : compromised: 0.5804, honest: 0.6551
Round 003: test acc mean=0.6595 ± 0.0167 | min=0.6230 max=0.6825
         : test loss mean=0.6142 ± 0.0164
         : individual accs = ['0.657813', '0.658237', '0.623020', '0.659844', '0.646018', '0.680373', '0.653562', '0.660388', '0.653071', '0.664927', '0.633436', '0.674801', '0.674098', '0.682217', '0.677863', '0.659673', '0.670165', '0.682542', '0.640587', '0.636780']
         : correct/total = [(9362, 14232), (9370, 14235), (8888, 14266), (9381, 14217), (9198, 14238), (9779, 14373), (9376, 14346), (9466, 14334), (9335, 14294), (9557, 14373), (9086, 14344), (9651, 14302), (9676, 14354), (9798, 14362), (9707, 14320), (9496, 14395), (9643, 14389), (9731, 14257), (9129, 14251), (9169, 14399)]
         : compromised: 0.6813, honest: 0.6570
Round 004: test acc mean=0.6792 ± 0.0106 | min=0.6643 max=0.6967
         : test loss mean=0.5939 ± 0.0104
         : individual accs = ['0.685427', '0.689708', '0.691785', '0.665401', '0.666737', '0.684060', '0.680608', '0.665132', '0.692179', '0.682599', '0.674149', '0.685638', '0.666156', '0.664392', '0.686592', '0.664328', '0.671555', '0.683875', '0.686759', '0.696715']
         : correct/total = [(9755, 14232), (9818, 14235), (9869, 14266), (9460, 14217), (9493, 14238), (9832, 14373), (9764, 14346), (9534, 14334), (9894, 14294), (9811, 14373), (9670, 14344), (9806, 14302), (9562, 14354), (9542, 14362), (9832, 14320), (9563, 14395), (9663, 14389), (9750, 14257), (9787, 14251), (10032, 14399)]
         : compromised: 0.6742, honest: 0.6797
Round 005: test acc mean=0.6926 ± 0.0049 | min=0.6818 max=0.7001
         : test loss mean=0.5790 ± 0.0050
         : individual accs = ['0.693016', '0.699262', '0.691154', '0.687416', '0.699045', '0.688931', '0.695176', '0.695689', '0.698825', '0.681834', '0.691997', '0.694938', '0.700084', '0.686673', '0.689246', '0.696283', '0.689624', '0.685418', '0.694057', '0.693173']
         : correct/total = [(9863, 14232), (9954, 14235), (9860, 14266), (9773, 14217), (9953, 14238), (9902, 14373), (9973, 14346), (9972, 14334), (9989, 14294), (9800, 14373), (9926, 14344), (9939, 14302), (10049, 14354), (9862, 14362), (9870, 14320), (10023, 14395), (9923, 14389), (9772, 14257), (9891, 14251), (9981, 14399)]
         : compromised: 0.6878, honest: 0.6931
Round 006: test acc mean=0.6959 ± 0.0102 | min=0.6737 max=0.7067
         : test loss mean=0.5755 ± 0.0124
         : individual accs = ['0.698707', '0.703337', '0.684074', '0.703524', '0.696165', '0.683852', '0.701659', '0.706293', '0.699944', '0.680582', '0.673731', '0.703049', '0.703288', '0.680964', '0.695810', '0.702605', '0.706720', '0.703304', '0.684022', '0.706091']
         : correct/total = [(9944, 14232), (10012, 14235), (9759, 14266), (10002, 14217), (9912, 14238), (9829, 14373), (10066, 14346), (10124, 14334), (10005, 14294), (9782, 14373), (9664, 14344), (10055, 14302), (10095, 14354), (9780, 14362), (9964, 14320), (10114, 14395), (10169, 14389), (10027, 14257), (9748, 14251), (10167, 14399)]
         : compromised: 0.6824, honest: 0.6974
Round 007: test acc mean=0.6977 ± 0.0102 | min=0.6756 max=0.7166
         : test loss mean=0.5712 ± 0.0106
         : individual accs = ['0.694351', '0.715209', '0.691574', '0.697264', '0.689774', '0.690044', '0.699916', '0.693735', '0.700504', '0.684687', '0.702524', '0.716613', '0.691654', '0.710625', '0.697556', '0.692949', '0.714157', '0.702743', '0.675602', '0.692479']
         : correct/total = [(9882, 14232), (10181, 14235), (9866, 14266), (9913, 14217), (9821, 14238), (9918, 14373), (10041, 14346), (9944, 14334), (10013, 14294), (9841, 14373), (10077, 14344), (10249, 14302), (9928, 14354), (10206, 14362), (9989, 14320), (9975, 14395), (10276, 14389), (10019, 14257), (9628, 14251), (9971, 14399)]
         : compromised: 0.7003, honest: 0.6974
Round 008: test acc mean=0.7002 ± 0.0147 | min=0.6690 max=0.7182
         : test loss mean=0.5682 ± 0.0124
         : individual accs = ['0.677347', '0.705444', '0.671807', '0.716326', '0.697008', '0.708551', '0.711069', '0.705804', '0.706031', '0.696445', '0.705940', '0.704587', '0.701686', '0.707840', '0.673045', '0.704272', '0.712419', '0.710949', '0.669006', '0.718175']
         : correct/total = [(9640, 14232), (10042, 14235), (9584, 14266), (10184, 14217), (9924, 14238), (10184, 14373), (10201, 14346), (10117, 14334), (10092, 14294), (10010, 14373), (10126, 14344), (10077, 14302), (10072, 14354), (10166, 14362), (9638, 14320), (10138, 14395), (10251, 14389), (10136, 14257), (9534, 14251), (10341, 14399)]
         : compromised: 0.7082, honest: 0.6993
Round 009: test acc mean=0.7121 ± 0.0096 | min=0.6874 max=0.7229
         : test loss mean=0.5565 ± 0.0108
         : individual accs = ['0.687395', '0.704953', '0.711412', '0.716818', '0.722503', '0.719752', '0.718528', '0.712362', '0.691409', '0.699436', '0.710820', '0.721717', '0.713460', '0.714803', '0.712430', '0.712747', '0.719647', '0.722873', '0.708161', '0.720050']
         : correct/total = [(9783, 14232), (10035, 14235), (10149, 14266), (10191, 14217), (10287, 14238), (10345, 14373), (10308, 14346), (10211, 14334), (9883, 14294), (10053, 14373), (10196, 14344), (10322, 14302), (10241, 14354), (10266, 14362), (10202, 14320), (10260, 14395), (10355, 14389), (10306, 14257), (10092, 14251), (10368, 14399)]
         : compromised: 0.7173, honest: 0.7115
Round 010: test acc mean=0.7120 ± 0.0162 | min=0.6694 max=0.7259
         : test loss mean=0.5538 ± 0.0150
         : individual accs = ['0.717678', '0.718370', '0.676293', '0.718787', '0.723557', '0.715230', '0.720061', '0.715223', '0.718833', '0.712725', '0.719395', '0.725912', '0.717082', '0.718911', '0.676816', '0.717541', '0.717354', '0.718244', '0.669427', '0.722342']
         : correct/total = [(10214, 14232), (10226, 14235), (9648, 14266), (10219, 14217), (10302, 14238), (10280, 14373), (10330, 14346), (10252, 14334), (10275, 14294), (10244, 14373), (10319, 14344), (10382, 14302), (10293, 14354), (10325, 14362), (9692, 14320), (10329, 14395), (10322, 14389), (10240, 14257), (9540, 14251), (10401, 14399)]
         : compromised: 0.7171, honest: 0.7114

=== FINAL RESULTS ===
Dataset: sent140, Nodes: 20, Graph: erdos, Aggregation: krum
Attack: backdoor, 10.0% compromised
Final accuracy - Compromised: 0.7171, Honest: 0.7114
Overall test accuracy: mean=0.7120 ± 0.0162

=== BACKDOOR ATTACK SUCCESS RATE (ASR) ===
Target label: 1
Trigger size: 3x3
Overall ASR: 0.5166 ± 0.0937
Honest nodes ASR: 0.5169 ± 0.0980
Compromised nodes ASR: 0.5138 ± 0.0385
Note: Higher ASR indicates more successful backdoor attack
