Device: cuda
Seed: 987654321
Loading 1 LEAF Sent140 train files...
LEAF Sent140 train: 254555 users, 908652 samples
Building vocabulary (max_size=10000)...
Vocabulary size: 10000
Loading 1 LEAF Sent140 test files...
LEAF Sent140 test: 254555 users, 286281 samples
Found 254555 train users, 254555 test users, 254555 common users
User sample counts range: 494 (max) to 1 (min)
Distributed ALL 254555 users across 20 clients
Users per client: 12727 (with 15 clients getting +1 user)
Train partition sizes: [44353, 44290, 44657, 44907, 44696, 45843, 45801, 45619, 45069, 45639, 45821, 45311, 45779, 46056, 45625, 45984, 46428, 44737, 45540, 46497]
Test partition sizes: [14232, 14235, 14266, 14217, 14238, 14373, 14346, 14334, 14294, 14373, 14344, 14302, 14354, 14362, 14320, 14395, 14389, 14257, 14251, 14399]
  Client 0: 44353 train samples, 2 unique classes
  Client 1: 44290 train samples, 2 unique classes
  Client 2: 44657 train samples, 2 unique classes
  Client 3: 44907 train samples, 2 unique classes
  Client 4: 44696 train samples, 2 unique classes
  Client 5: 45843 train samples, 2 unique classes
  Client 6: 45801 train samples, 2 unique classes
  Client 7: 45619 train samples, 2 unique classes
  Client 8: 45069 train samples, 2 unique classes
  Client 9: 45639 train samples, 2 unique classes
  Client 10: 45821 train samples, 2 unique classes
  Client 11: 45311 train samples, 2 unique classes
  Client 12: 45779 train samples, 2 unique classes
  Client 13: 46056 train samples, 2 unique classes
  Client 14: 45625 train samples, 2 unique classes
  Client 15: 45984 train samples, 2 unique classes
  Client 16: 46428 train samples, 2 unique classes
  Client 17: 44737 train samples, 2 unique classes
  Client 18: 45540 train samples, 2 unique classes
  Client 19: 46497 train samples, 2 unique classes
Will sample 4500 samples per client per epoch
Graph: ring, nodes: 20, edges: 20
Degree statistics: avg=2.00, min=2, max=2
Attack: Compromised 14/20 nodes: [1, 2, 3, 5, 6, 8, 11, 12, 13, 14, 15, 17, 18, 19]
Attack type: backdoor, lambda: 1.0
Backdoor target label: 1, trigger size: 3
Model variant: baseline
Model parameters: 1,174,986
BALANCE algorithm:
Balance Config: BALANCEConfig(gamma=2, kappa=1, alpha=0.5, min_neighbors=1)
  - Model dimension: 1,174,986 parameters
  - Complexity: O(N×d) = O(20×1,174,986)
Initial test acc across nodes: mean=0.4965 ± 0.0152
Backdoor attack: Created poisoned datasets for 14 compromised nodes
Round 001: test acc mean=0.5012 ± 0.0075 | min=0.4874 max=0.5185
         : test loss mean=28.3295 ± 20.3371
         : individual accs = ['0.503021', '0.498771', '0.487383', '0.509038', '0.497050', '0.498922', '0.503625', '0.495186', '0.518469', '0.510332', '0.505159', '0.493777', '0.494009', '0.511976', '0.493785', '0.499479', '0.503301', '0.505857', '0.492386', '0.503090']
         : correct/total = [(7159, 14232), (7100, 14235), (6953, 14266), (7237, 14217), (7077, 14238), (7171, 14373), (7225, 14346), (7098, 14334), (7411, 14294), (7335, 14373), (7246, 14344), (7062, 14302), (7091, 14354), (7353, 14362), (7071, 14320), (7190, 14395), (7242, 14389), (7212, 14257), (7017, 14251), (7244, 14399)]
         : compromised: 0.5008, honest: 0.5023
Round 002: test acc mean=0.5023 ± 0.0073 | min=0.4849 max=0.5135
         : test loss mean=1212.2186 ± 854.8758
         : individual accs = ['0.510540', '0.512399', '0.502594', '0.509320', '0.507234', '0.509080', '0.499233', '0.495744', '0.506856', '0.492869', '0.498466', '0.510069', '0.499512', '0.484891', '0.499860', '0.494060', '0.500452', '0.497019', '0.513508', '0.501424']
         : correct/total = [(7266, 14232), (7294, 14235), (7170, 14266), (7241, 14217), (7222, 14238), (7317, 14373), (7162, 14346), (7106, 14334), (7245, 14294), (7084, 14373), (7150, 14344), (7295, 14302), (7170, 14354), (6964, 14362), (7158, 14320), (7112, 14395), (7201, 14389), (7086, 14257), (7318, 14251), (7220, 14399)]
         : compromised: 0.5028, honest: 0.5009
Round 003: test acc mean=0.4961 ± 0.0075 | min=0.4778 max=0.5070
         : test loss mean=109309.3946 ± 96515.5839
         : individual accs = ['0.489109', '0.503969', '0.485490', '0.491173', '0.494100', '0.494399', '0.494772', '0.495186', '0.487197', '0.506992', '0.501115', '0.504335', '0.477776', '0.505292', '0.498045', '0.501355', '0.499757', '0.503121', '0.488667', '0.499896']
         : correct/total = [(6961, 14232), (7174, 14235), (6926, 14266), (6983, 14217), (7035, 14238), (7106, 14373), (7098, 14346), (7098, 14334), (6964, 14294), (7287, 14373), (7188, 14344), (7213, 14302), (6858, 14354), (7257, 14362), (7132, 14320), (7217, 14395), (7191, 14389), (7173, 14257), (6964, 14251), (7198, 14399)]
         : compromised: 0.4954, honest: 0.4977
Round 004: test acc mean=0.5016 ± 0.0063 | min=0.4914 max=0.5159
         : test loss mean=8836279.0195 ± 7348436.3163
         : individual accs = ['0.497611', '0.506849', '0.491448', '0.507069', '0.506672', '0.502400', '0.515893', '0.496163', '0.499930', '0.497043', '0.507948', '0.497063', '0.492128', '0.497145', '0.495740', '0.501077', '0.508305', '0.508522', '0.505087', '0.497257']
         : correct/total = [(7082, 14232), (7215, 14235), (7011, 14266), (7209, 14217), (7214, 14238), (7221, 14373), (7401, 14346), (7112, 14334), (7146, 14294), (7144, 14373), (7286, 14344), (7109, 14302), (7064, 14354), (7140, 14362), (7099, 14320), (7213, 14395), (7314, 14389), (7250, 14257), (7198, 14251), (7160, 14399)]
         : compromised: 0.5013, honest: 0.5023
Round 005: test acc mean=0.4992 ± 0.0071 | min=0.4857 max=0.5110
         : test loss mean=672357835.7202 ± 568363205.6494
         : individual accs = ['0.491358', '0.497436', '0.493341', '0.506577', '0.495856', '0.493077', '0.503694', '0.496233', '0.510984', '0.508871', '0.503137', '0.493288', '0.510311', '0.509539', '0.496229', '0.499687', '0.501842', '0.485656', '0.492527', '0.493437']
         : correct/total = [(6993, 14232), (7081, 14235), (7038, 14266), (7202, 14217), (7060, 14238), (7087, 14373), (7226, 14346), (7113, 14334), (7304, 14294), (7314, 14373), (7217, 14344), (7055, 14302), (7325, 14354), (7318, 14362), (7106, 14320), (7193, 14395), (7221, 14389), (6924, 14257), (7019, 14251), (7105, 14399)]
         : compromised: 0.4990, honest: 0.4995
Round 006: test acc mean=0.5014 ± 0.0079 | min=0.4864 max=0.5137
         : test loss mean=37574896215.7355 ± 26206689570.3207
         : individual accs = ['0.494028', '0.502845', '0.503715', '0.513681', '0.494732', '0.503374', '0.511223', '0.489605', '0.511194', '0.496765', '0.486405', '0.505244', '0.509126', '0.490322', '0.507193', '0.499132', '0.493154', '0.501859', '0.511894', '0.501771']
         : correct/total = [(7031, 14232), (7158, 14235), (7186, 14266), (7303, 14217), (7044, 14238), (7235, 14373), (7334, 14346), (7018, 14334), (7307, 14294), (7140, 14373), (6977, 14344), (7226, 14302), (7308, 14354), (7042, 14362), (7263, 14320), (7185, 14395), (7096, 14389), (7155, 14257), (7295, 14251), (7225, 14399)]
         : compromised: 0.5052, honest: 0.4924
Round 007: test acc mean=0.5033 ± 0.0061 | min=0.4947 max=0.5178
         : test loss mean=2998292672290.1924 ± 2069926867196.5698
         : individual accs = ['0.494660', '0.504882', '0.499720', '0.514384', '0.498806', '0.499965', '0.517845', '0.495256', '0.507486', '0.505114', '0.500279', '0.497832', '0.512470', '0.506893', '0.505726', '0.497881', '0.501981', '0.498702', '0.505719', '0.499965']
         : correct/total = [(7040, 14232), (7187, 14235), (7129, 14266), (7313, 14217), (7102, 14238), (7186, 14373), (7429, 14346), (7099, 14334), (7254, 14294), (7260, 14373), (7176, 14344), (7120, 14302), (7356, 14354), (7280, 14362), (7242, 14320), (7167, 14395), (7223, 14389), (7110, 14257), (7207, 14251), (7199, 14399)]
         : compromised: 0.5050, honest: 0.4993
Round 008: test acc mean=0.5023 ± 0.0079 | min=0.4872 max=0.5146
         : test loss mean=241101032925358.0625 ± 165075975285599.5000
         : individual accs = ['0.492201', '0.513383', '0.504907', '0.514595', '0.493960', '0.507897', '0.509550', '0.487233', '0.508325', '0.492590', '0.510248', '0.505594', '0.503483', '0.494499', '0.503841', '0.500938', '0.489332', '0.501929', '0.509719', '0.502327']
         : correct/total = [(7005, 14232), (7308, 14235), (7203, 14266), (7316, 14217), (7033, 14238), (7300, 14373), (7310, 14346), (6984, 14334), (7266, 14294), (7080, 14373), (7319, 14344), (7231, 14302), (7227, 14354), (7102, 14362), (7215, 14320), (7211, 14395), (7041, 14389), (7156, 14257), (7264, 14251), (7233, 14399)]
         : compromised: 0.5058, honest: 0.4943
Round 009: test acc mean=0.5042 ± 0.0057 | min=0.4935 max=0.5140
         : test loss mean=20533731731211748.0000 ± 14108253859564666.0000
         : individual accs = ['0.493465', '0.503267', '0.508271', '0.514032', '0.497472', '0.499339', '0.511153', '0.498535', '0.511893', '0.503583', '0.500906', '0.501189', '0.504737', '0.513926', '0.507472', '0.499618', '0.501286', '0.501789', '0.509999', '0.501632']
         : correct/total = [(7023, 14232), (7164, 14235), (7251, 14266), (7308, 14217), (7083, 14238), (7177, 14373), (7333, 14346), (7146, 14334), (7317, 14294), (7238, 14373), (7185, 14344), (7168, 14302), (7245, 14354), (7381, 14362), (7267, 14320), (7192, 14395), (7213, 14389), (7154, 14257), (7268, 14251), (7223, 14399)]
         : compromised: 0.5063, honest: 0.4992
Round 010: test acc mean=0.5014 ± 0.0077 | min=0.4812 max=0.5135
         : test loss mean=1658596647877003264.0000 ± 1139681402453199616.0000
         : individual accs = ['0.499930', '0.510432', '0.509954', '0.513540', '0.492063', '0.504627', '0.507110', '0.496791', '0.505807', '0.490573', '0.481177', '0.505733', '0.505364', '0.494499', '0.503701', '0.502536', '0.495378', '0.500035', '0.509017', '0.499687']
         : correct/total = [(7115, 14232), (7266, 14235), (7275, 14266), (7301, 14217), (7006, 14238), (7253, 14373), (7275, 14346), (7121, 14334), (7230, 14294), (7051, 14373), (6902, 14344), (7233, 14302), (7254, 14354), (7102, 14362), (7213, 14320), (7234, 14395), (7128, 14389), (7129, 14257), (7254, 14251), (7195, 14399)]
         : compromised: 0.5051, honest: 0.4927

=== FINAL RESULTS ===
Dataset: sent140, Nodes: 20, Graph: ring, Aggregation: balance
Attack: backdoor, 70.0% compromised
Final accuracy - Compromised: 0.5051, Honest: 0.4927
Overall test accuracy: mean=0.5014 ± 0.0077

=== BACKDOOR ATTACK SUCCESS RATE (ASR) ===
Target label: 1
Trigger size: 3x3
Overall ASR: 0.7783 ± 0.3485
Honest nodes ASR: 0.2916 ± 0.2573
Compromised nodes ASR: 0.9868 ± 0.0094
Note: Higher ASR indicates more successful backdoor attack

=== BALANCE SUMMARY ===
Node 0: acceptance=0.000
Node 1: acceptance=0.700
Node 2: acceptance=0.200
Node 3: acceptance=0.700
Node 4: acceptance=0.000
Node 5: acceptance=0.700
Node 6: acceptance=0.700
Node 7: acceptance=0.000
Node 8: acceptance=0.700
Node 9: acceptance=0.800
Node 10: acceptance=0.900
Node 11: acceptance=0.700
Node 12: acceptance=0.300
Node 13: acceptance=0.800
Node 14: acceptance=0.300
Node 15: acceptance=0.700
Node 16: acceptance=0.000
Node 17: acceptance=0.700
Node 18: acceptance=0.200
Node 19: acceptance=0.700

=== PARALLEL EXECUTION TIME (realistic for distributed system) ===
  COMMUNICATION (max across nodes):
    - Full model transfer: 0.000s (0.0%)
  COMPUTATION (max across nodes):
    - Filtering: 0.013s (55.9%)
    - Aggregation: 0.011s (44.1%)
  TOTALS:
    - Total computation: 0.024s (100.0%)
    - Total communication: 0.000s (0.0%)
    - Total parallel time: 0.024s

=== PER-NODE AVERAGE TIME ===
  - Filtering: 0.012s
  - Aggregation: 0.005s
  - Model transfer: 0.000s
  - Total per node: 0.017s

=== TOTAL COMPUTATIONAL WORK (sum across all nodes) ===
  - Total filtering: 0.238s
  - Total aggregation: 0.099s
  - Total model transfer: 0.000s
  - Grand total: 0.337s
  - Mean acceptance rate: 0.490

BALANCE Algorithm Properties:
  - Model dimension: 1,174,986
  - No compression: Full parameter comparison
  - Theoretical complexity: O(deg(i)×d)
  - Approach: Full parameter filtering + averaging
