Device: cuda
Seed: 987654321
Loading 1 LEAF Sent140 train files...
LEAF Sent140 train: 254555 users, 908652 samples
Building vocabulary (max_size=10000)...
Vocabulary size: 10000
Loading 1 LEAF Sent140 test files...
LEAF Sent140 test: 254555 users, 286281 samples
Found 254555 train users, 254555 test users, 254555 common users
User sample counts range: 494 (max) to 1 (min)
Distributed ALL 254555 users across 20 clients
Users per client: 12727 (with 15 clients getting +1 user)
Train partition sizes: [44353, 44290, 44657, 44907, 44696, 45843, 45801, 45619, 45069, 45639, 45821, 45311, 45779, 46056, 45625, 45984, 46428, 44737, 45540, 46497]
Test partition sizes: [14232, 14235, 14266, 14217, 14238, 14373, 14346, 14334, 14294, 14373, 14344, 14302, 14354, 14362, 14320, 14395, 14389, 14257, 14251, 14399]
  Client 0: 44353 train samples, 2 unique classes
  Client 1: 44290 train samples, 2 unique classes
  Client 2: 44657 train samples, 2 unique classes
  Client 3: 44907 train samples, 2 unique classes
  Client 4: 44696 train samples, 2 unique classes
  Client 5: 45843 train samples, 2 unique classes
  Client 6: 45801 train samples, 2 unique classes
  Client 7: 45619 train samples, 2 unique classes
  Client 8: 45069 train samples, 2 unique classes
  Client 9: 45639 train samples, 2 unique classes
  Client 10: 45821 train samples, 2 unique classes
  Client 11: 45311 train samples, 2 unique classes
  Client 12: 45779 train samples, 2 unique classes
  Client 13: 46056 train samples, 2 unique classes
  Client 14: 45625 train samples, 2 unique classes
  Client 15: 45984 train samples, 2 unique classes
  Client 16: 46428 train samples, 2 unique classes
  Client 17: 44737 train samples, 2 unique classes
  Client 18: 45540 train samples, 2 unique classes
  Client 19: 46497 train samples, 2 unique classes
Will sample 4500 samples per client per epoch
Graph: fully, nodes: 20, edges: 190
Degree statistics: avg=19.00, min=19, max=19
Attack: Compromised 2/20 nodes: [5, 13]
Attack type: backdoor, lambda: 1.0
Backdoor target label: 1, trigger size: 3
Model variant: baseline
Model parameters: 1,174,986
Initial test acc across nodes: mean=0.4965 ± 0.0152
Backdoor attack: Created poisoned datasets for 2 compromised nodes
Round 001: test acc mean=0.4987 ± 0.0066 | min=0.4882 max=0.5112
         : test loss mean=25.2886 ± 10.8005
         : individual accs = ['0.511172', '0.504882', '0.488154', '0.488289', '0.498174', '0.501635', '0.497351', '0.504674', '0.493424', '0.494469', '0.503207', '0.501189', '0.493382', '0.502367', '0.492947', '0.491907', '0.506359', '0.493091', '0.509719', '0.498368']
         : correct/total = [(7275, 14232), (7187, 14235), (6964, 14266), (6942, 14217), (7093, 14238), (7210, 14373), (7135, 14346), (7234, 14334), (7053, 14294), (7107, 14373), (7218, 14344), (7168, 14302), (7082, 14354), (7215, 14362), (7059, 14320), (7081, 14395), (7286, 14389), (7030, 14257), (7264, 14251), (7176, 14399)]
         : compromised: 0.5020, honest: 0.4984
Round 002: test acc mean=0.5017 ± 0.0047 | min=0.4951 max=0.5141
         : test loss mean=4.0373 ± 0.0526
         : individual accs = ['0.496627', '0.497295', '0.495093', '0.497995', '0.503371', '0.502192', '0.504810', '0.502232', '0.497691', '0.499061', '0.511015', '0.498322', '0.500975', '0.507450', '0.504050', '0.500938', '0.501842', '0.514133', '0.497930', '0.501007']
         : correct/total = [(7068, 14232), (7079, 14235), (7063, 14266), (7080, 14217), (7167, 14238), (7218, 14373), (7242, 14346), (7199, 14334), (7114, 14294), (7173, 14373), (7330, 14344), (7127, 14302), (7191, 14354), (7288, 14362), (7218, 14320), (7211, 14395), (7221, 14389), (7330, 14257), (7096, 14251), (7214, 14399)]
         : compromised: 0.5048, honest: 0.5014
Round 003: test acc mean=0.5097 ± 0.0052 | min=0.5009 max=0.5216
         : test loss mean=2.4134 ± 0.0307
         : individual accs = ['0.516161', '0.507552', '0.509463', '0.500879', '0.507796', '0.512350', '0.513453', '0.506837', '0.503498', '0.507201', '0.517638', '0.511677', '0.507454', '0.514900', '0.504469', '0.501702', '0.511085', '0.521638', '0.509999', '0.508994']
         : correct/total = [(7346, 14232), (7225, 14235), (7268, 14266), (7121, 14217), (7230, 14238), (7364, 14373), (7366, 14346), (7265, 14334), (7197, 14294), (7290, 14373), (7425, 14344), (7318, 14302), (7284, 14354), (7395, 14362), (7224, 14320), (7222, 14395), (7354, 14389), (7437, 14257), (7268, 14251), (7329, 14399)]
         : compromised: 0.5136, honest: 0.5093
Round 004: test acc mean=0.5086 ± 0.0036 | min=0.5032 max=0.5171
         : test loss mean=1.7783 ± 0.0176
         : individual accs = ['0.507237', '0.507060', '0.513108', '0.508546', '0.505127', '0.507410', '0.514429', '0.513185', '0.509235', '0.503166', '0.505508', '0.503426', '0.507385', '0.517059', '0.509078', '0.503717', '0.507818', '0.508312', '0.510350', '0.511008']
         : correct/total = [(7219, 14232), (7218, 14235), (7320, 14266), (7230, 14217), (7192, 14238), (7293, 14373), (7380, 14346), (7356, 14334), (7279, 14294), (7232, 14373), (7251, 14344), (7200, 14302), (7283, 14354), (7426, 14362), (7290, 14320), (7251, 14395), (7307, 14389), (7247, 14257), (7273, 14251), (7358, 14399)]
         : compromised: 0.5122, honest: 0.5082
Round 005: test acc mean=0.5069 ± 0.0032 | min=0.5009 max=0.5135
         : test loss mean=1.4503 ± 0.0138
         : individual accs = ['0.506254', '0.511837', '0.513529', '0.508757', '0.503301', '0.507271', '0.506971', '0.508860', '0.509025', '0.508245', '0.501325', '0.504125', '0.505782', '0.500905', '0.505098', '0.506426', '0.507818', '0.510346', '0.508736', '0.502882']
         : correct/total = [(7205, 14232), (7286, 14235), (7326, 14266), (7233, 14217), (7166, 14238), (7291, 14373), (7273, 14346), (7294, 14334), (7276, 14294), (7305, 14373), (7191, 14344), (7210, 14302), (7260, 14354), (7194, 14362), (7233, 14320), (7290, 14395), (7307, 14389), (7276, 14257), (7250, 14251), (7241, 14399)]
         : compromised: 0.5041, honest: 0.5072
Round 006: test acc mean=0.5091 ± 0.0040 | min=0.5021 max=0.5168
         : test loss mean=1.0914 ± 0.0098
         : individual accs = ['0.506464', '0.506006', '0.509954', '0.505944', '0.506743', '0.508175', '0.511711', '0.510883', '0.506156', '0.507271', '0.503974', '0.502098', '0.515605', '0.509330', '0.504120', '0.511914', '0.511919', '0.512731', '0.514210', '0.516772']
         : correct/total = [(7208, 14232), (7203, 14235), (7275, 14266), (7193, 14217), (7215, 14238), (7304, 14373), (7341, 14346), (7323, 14334), (7235, 14294), (7291, 14373), (7229, 14344), (7181, 14302), (7401, 14354), (7315, 14362), (7219, 14320), (7369, 14395), (7366, 14389), (7310, 14257), (7328, 14251), (7441, 14399)]
         : compromised: 0.5088, honest: 0.5091
Round 007: test acc mean=0.5030 ± 0.0046 | min=0.4954 max=0.5113
         : test loss mean=1.1045 ± 0.0089
         : individual accs = ['0.500773', '0.496101', '0.495444', '0.499191', '0.503301', '0.502331', '0.506901', '0.505302', '0.497412', '0.501218', '0.507111', '0.498462', '0.502717', '0.511280', '0.500698', '0.510524', '0.503996', '0.509995', '0.499404', '0.507605']
         : correct/total = [(7127, 14232), (7062, 14235), (7068, 14266), (7097, 14217), (7166, 14238), (7220, 14373), (7272, 14346), (7243, 14334), (7110, 14294), (7204, 14373), (7274, 14344), (7129, 14302), (7216, 14354), (7343, 14362), (7170, 14320), (7349, 14395), (7252, 14389), (7271, 14257), (7117, 14251), (7309, 14399)]
         : compromised: 0.5068, honest: 0.5026
Round 008: test acc mean=0.5058 ± 0.0036 | min=0.4993 max=0.5118
         : test loss mean=0.8693 ± 0.0073
         : individual accs = ['0.502740', '0.501791', '0.500491', '0.503693', '0.505478', '0.503096', '0.510456', '0.511790', '0.503638', '0.499339', '0.505438', '0.503985', '0.510032', '0.509469', '0.502374', '0.511150', '0.508861', '0.507049', '0.507543', '0.508369']
         : correct/total = [(7155, 14232), (7143, 14235), (7140, 14266), (7161, 14217), (7197, 14238), (7231, 14373), (7323, 14346), (7336, 14334), (7199, 14294), (7177, 14373), (7250, 14344), (7208, 14302), (7321, 14354), (7317, 14362), (7194, 14320), (7358, 14395), (7322, 14389), (7229, 14257), (7233, 14251), (7320, 14399)]
         : compromised: 0.5063, honest: 0.5058
Round 009: test acc mean=0.5190 ± 0.0033 | min=0.5133 max=0.5244
         : test loss mean=0.8277 ± 0.0057
         : individual accs = ['0.524382', '0.514998', '0.523412', '0.520926', '0.518542', '0.518124', '0.523909', '0.519674', '0.518959', '0.513532', '0.518056', '0.518389', '0.515814', '0.514135', '0.519553', '0.513303', '0.518591', '0.520376', '0.523683', '0.520870']
         : correct/total = [(7463, 14232), (7331, 14235), (7467, 14266), (7406, 14217), (7383, 14238), (7447, 14373), (7516, 14346), (7449, 14334), (7418, 14294), (7381, 14373), (7431, 14344), (7414, 14302), (7404, 14354), (7384, 14362), (7440, 14320), (7389, 14395), (7462, 14389), (7419, 14257), (7463, 14251), (7500, 14399)]
         : compromised: 0.5161, honest: 0.5193
Round 010: test acc mean=0.5077 ± 0.0039 | min=0.4988 max=0.5149
         : test loss mean=0.7991 ± 0.0058
         : individual accs = ['0.505481', '0.498771', '0.504556', '0.505662', '0.508498', '0.504905', '0.505995', '0.513325', '0.503008', '0.506923', '0.514919', '0.504825', '0.509475', '0.510096', '0.507472', '0.509344', '0.510668', '0.512590', '0.504456', '0.512605']
         : correct/total = [(7194, 14232), (7100, 14235), (7198, 14266), (7189, 14217), (7240, 14238), (7257, 14373), (7259, 14346), (7358, 14334), (7190, 14294), (7286, 14373), (7386, 14344), (7220, 14302), (7313, 14354), (7326, 14362), (7267, 14320), (7332, 14395), (7348, 14389), (7308, 14257), (7189, 14251), (7381, 14399)]
         : compromised: 0.5075, honest: 0.5077

=== FINAL RESULTS ===
Dataset: sent140, Nodes: 20, Graph: fully, Aggregation: krum
Attack: backdoor, 10.0% compromised
Final accuracy - Compromised: 0.5075, Honest: 0.5077
Overall test accuracy: mean=0.5077 ± 0.0039

=== BACKDOOR ATTACK SUCCESS RATE (ASR) ===
Target label: 1
Trigger size: 3x3
Overall ASR: 0.4412 ± 0.0034
Honest nodes ASR: 0.4411 ± 0.0036
Compromised nodes ASR: 0.4425 ± 0.0012
Note: Higher ASR indicates more successful backdoor attack
