Device: cuda
Seed: 987654321
Loading 1 LEAF Sent140 train files...
LEAF Sent140 train: 254555 users, 908652 samples
Building vocabulary (max_size=10000)...
Vocabulary size: 10000
Loading 1 LEAF Sent140 test files...
LEAF Sent140 test: 254555 users, 286281 samples
Found 254555 train users, 254555 test users, 254555 common users
User sample counts range: 494 (max) to 1 (min)
Distributed ALL 254555 users across 20 clients
Users per client: 12727 (with 15 clients getting +1 user)
Train partition sizes: [44353, 44290, 44657, 44907, 44696, 45843, 45801, 45619, 45069, 45639, 45821, 45311, 45779, 46056, 45625, 45984, 46428, 44737, 45540, 46497]
Test partition sizes: [14232, 14235, 14266, 14217, 14238, 14373, 14346, 14334, 14294, 14373, 14344, 14302, 14354, 14362, 14320, 14395, 14389, 14257, 14251, 14399]
  Client 0: 44353 train samples, 2 unique classes
  Client 1: 44290 train samples, 2 unique classes
  Client 2: 44657 train samples, 2 unique classes
  Client 3: 44907 train samples, 2 unique classes
  Client 4: 44696 train samples, 2 unique classes
  Client 5: 45843 train samples, 2 unique classes
  Client 6: 45801 train samples, 2 unique classes
  Client 7: 45619 train samples, 2 unique classes
  Client 8: 45069 train samples, 2 unique classes
  Client 9: 45639 train samples, 2 unique classes
  Client 10: 45821 train samples, 2 unique classes
  Client 11: 45311 train samples, 2 unique classes
  Client 12: 45779 train samples, 2 unique classes
  Client 13: 46056 train samples, 2 unique classes
  Client 14: 45625 train samples, 2 unique classes
  Client 15: 45984 train samples, 2 unique classes
  Client 16: 46428 train samples, 2 unique classes
  Client 17: 44737 train samples, 2 unique classes
  Client 18: 45540 train samples, 2 unique classes
  Client 19: 46497 train samples, 2 unique classes
Will sample 4500 samples per client per epoch
Graph: erdos, nodes: 20, edges: 99
Degree statistics: avg=9.90, min=7, max=14
Attack: Compromised 6/20 nodes: [5, 12, 13, 14, 17, 18]
Attack type: backdoor, lambda: 1.0
Backdoor target label: 1, trigger size: 3
Model variant: baseline
Model parameters: 1,174,986
Initial test acc across nodes: mean=0.4953 ± 0.0174
Backdoor attack: Created poisoned datasets for 6 compromised nodes
Round 001: test acc mean=0.4975 ± 0.0066 | min=0.4879 max=0.5096
         : test loss mean=2.9792 ± 2.2448
         : individual accs = ['0.509556', '0.488374', '0.487873', '0.494689', '0.490097', '0.499478', '0.499233', '0.501814', '0.498041', '0.504070', '0.492889', '0.487904', '0.506688', '0.489695', '0.505587', '0.502675', '0.503579', '0.499334', '0.495404', '0.492465']
         : correct/total = [(7252, 14232), (6952, 14235), (6960, 14266), (7033, 14217), (6978, 14238), (7179, 14373), (7162, 14346), (7193, 14334), (7119, 14294), (7245, 14373), (7070, 14344), (6978, 14302), (7273, 14354), (7033, 14362), (7240, 14320), (7236, 14395), (7246, 14389), (7119, 14257), (7060, 14251), (7091, 14399)]
         : compromised: 0.4994, honest: 0.4967
Round 002: test acc mean=0.4954 ± 0.0056 | min=0.4787 max=0.5052
         : test loss mean=2.7615 ± 1.5672
         : individual accs = ['0.492552', '0.489287', '0.495093', '0.478723', '0.497120', '0.499061', '0.495399', '0.497070', '0.495313', '0.488485', '0.492471', '0.492029', '0.496586', '0.505222', '0.501257', '0.502049', '0.497116', '0.493021', '0.501298', '0.498160']
         : correct/total = [(7010, 14232), (6965, 14235), (7063, 14266), (6806, 14217), (7078, 14238), (7173, 14373), (7107, 14346), (7125, 14334), (7080, 14294), (7021, 14373), (7064, 14344), (7037, 14302), (7128, 14354), (7256, 14362), (7178, 14320), (7227, 14395), (7153, 14389), (7029, 14257), (7144, 14251), (7173, 14399)]
         : compromised: 0.4994, honest: 0.4936
Round 003: test acc mean=0.4998 ± 0.0086 | min=0.4849 max=0.5168
         : test loss mean=1.1718 ± 0.5274
         : individual accs = ['0.488055', '0.484861', '0.491939', '0.516846', '0.509411', '0.501496', '0.500697', '0.497628', '0.503778', '0.507131', '0.485290', '0.505664', '0.496935', '0.490809', '0.502374', '0.499340', '0.513795', '0.495265', '0.499123', '0.505730']
         : correct/total = [(6946, 14232), (6902, 14235), (7018, 14266), (7348, 14217), (7253, 14238), (7208, 14373), (7183, 14346), (7133, 14334), (7201, 14294), (7289, 14373), (6961, 14344), (7232, 14302), (7133, 14354), (7049, 14362), (7194, 14320), (7188, 14395), (7393, 14389), (7061, 14257), (7113, 14251), (7282, 14399)]
         : compromised: 0.4977, honest: 0.5007
Round 004: test acc mean=0.5045 ± 0.0050 | min=0.4987 max=0.5142
         : test loss mean=3.7591 ± 2.8148
         : individual accs = ['0.502319', '0.514226', '0.512968', '0.513259', '0.504916', '0.504279', '0.499373', '0.507116', '0.501539', '0.512837', '0.498745', '0.506013', '0.499652', '0.499652', '0.501885', '0.501007', '0.506637', '0.501298', '0.502772', '0.499549']
         : correct/total = [(7149, 14232), (7320, 14235), (7318, 14266), (7297, 14217), (7189, 14238), (7248, 14373), (7164, 14346), (7269, 14334), (7169, 14294), (7371, 14373), (7154, 14344), (7237, 14302), (7172, 14354), (7176, 14362), (7187, 14320), (7212, 14395), (7290, 14389), (7147, 14257), (7165, 14251), (7193, 14399)]
         : compromised: 0.5016, honest: 0.5058
Round 005: test acc mean=0.5061 ± 0.0043 | min=0.4963 max=0.5144
         : test loss mean=5.6307 ± 2.5634
         : individual accs = ['0.509767', '0.514436', '0.511566', '0.513329', '0.504565', '0.503931', '0.502509', '0.505163', '0.504547', '0.512558', '0.504601', '0.506153', '0.502090', '0.496310', '0.505726', '0.503925', '0.508374', '0.504735', '0.501930', '0.506424']
         : correct/total = [(7255, 14232), (7323, 14235), (7298, 14266), (7298, 14217), (7184, 14238), (7243, 14373), (7209, 14346), (7241, 14334), (7212, 14294), (7367, 14373), (7238, 14344), (7239, 14302), (7207, 14354), (7128, 14362), (7242, 14320), (7254, 14395), (7315, 14389), (7196, 14257), (7153, 14251), (7292, 14399)]
         : compromised: 0.5025, honest: 0.5077
Round 006: test acc mean=0.5049 ± 0.0062 | min=0.4928 max=0.5187
         : test loss mean=5.7230 ± 2.2891
         : individual accs = ['0.508853', '0.515560', '0.511426', '0.518675', '0.509201', '0.505044', '0.499930', '0.506418', '0.500770', '0.492799', '0.502649', '0.507691', '0.498885', '0.494012', '0.506075', '0.503508', '0.506220', '0.503682', '0.504315', '0.501493']
         : correct/total = [(7242, 14232), (7339, 14235), (7296, 14266), (7374, 14217), (7250, 14238), (7259, 14373), (7172, 14346), (7259, 14334), (7158, 14294), (7083, 14373), (7210, 14344), (7261, 14302), (7161, 14354), (7095, 14362), (7247, 14320), (7248, 14395), (7284, 14389), (7181, 14257), (7187, 14251), (7221, 14399)]
         : compromised: 0.5020, honest: 0.5061
Round 007: test acc mean=0.5025 ± 0.0064 | min=0.4915 max=0.5181
         : test loss mean=3.8248 ± 2.0479
         : individual accs = ['0.501616', '0.518089', '0.507430', '0.513188', '0.502318', '0.493008', '0.496654', '0.503837', '0.495383', '0.499826', '0.504044', '0.500140', '0.494357', '0.491505', '0.506634', '0.506634', '0.507262', '0.504735', '0.502351', '0.500521']
         : correct/total = [(7139, 14232), (7375, 14235), (7239, 14266), (7296, 14217), (7152, 14238), (7086, 14373), (7125, 14346), (7222, 14334), (7081, 14294), (7184, 14373), (7230, 14344), (7153, 14302), (7096, 14354), (7059, 14362), (7255, 14320), (7293, 14395), (7299, 14389), (7196, 14257), (7159, 14251), (7207, 14399)]
         : compromised: 0.4988, honest: 0.5041
Round 008: test acc mean=0.4966 ± 0.0067 | min=0.4818 max=0.5113
         : test loss mean=4.4431 ± 1.8747
         : individual accs = ['0.498103', '0.493713', '0.486191', '0.500879', '0.492836', '0.492242', '0.503206', '0.494628', '0.506996', '0.497321', '0.511294', '0.500210', '0.502438', '0.491088', '0.493575', '0.500938', '0.481826', '0.497370', '0.494983', '0.491562']
         : correct/total = [(7089, 14232), (7028, 14235), (6936, 14266), (7121, 14217), (7017, 14238), (7075, 14373), (7219, 14346), (7090, 14334), (7247, 14294), (7148, 14373), (7334, 14344), (7154, 14302), (7212, 14354), (7053, 14362), (7068, 14320), (7211, 14395), (6933, 14389), (7091, 14257), (7054, 14251), (7078, 14399)]
         : compromised: 0.4953, honest: 0.4971
Round 009: test acc mean=0.4949 ± 0.0047 | min=0.4860 max=0.5060
         : test loss mean=9.6933 ± 9.1419
         : individual accs = ['0.495152', '0.488865', '0.492009', '0.486038', '0.493890', '0.498852', '0.500418', '0.494628', '0.497621', '0.491755', '0.505996', '0.491959', '0.501115', '0.501741', '0.490712', '0.493157', '0.493988', '0.493302', '0.493579', '0.492604']
         : correct/total = [(7047, 14232), (6959, 14235), (7019, 14266), (6910, 14217), (7032, 14238), (7170, 14373), (7179, 14346), (7090, 14334), (7113, 14294), (7068, 14373), (7258, 14344), (7036, 14302), (7193, 14354), (7206, 14362), (7027, 14320), (7099, 14395), (7108, 14389), (7033, 14257), (7034, 14251), (7093, 14399)]
         : compromised: 0.4966, honest: 0.4941
Round 010: test acc mean=0.4950 ± 0.0055 | min=0.4835 max=0.5085
         : test loss mean=18.8041 ± 9.5181
         : individual accs = ['0.492693', '0.483527', '0.487102', '0.486038', '0.495154', '0.495582', '0.499442', '0.492675', '0.498321', '0.494330', '0.498327', '0.493358', '0.502996', '0.508495', '0.492458', '0.497742', '0.492807', '0.494845', '0.496035', '0.498090']
         : correct/total = [(7012, 14232), (6883, 14235), (6949, 14266), (6910, 14217), (7050, 14238), (7123, 14373), (7165, 14346), (7062, 14334), (7123, 14294), (7105, 14373), (7148, 14344), (7056, 14302), (7220, 14354), (7303, 14362), (7052, 14320), (7165, 14395), (7091, 14389), (7055, 14257), (7069, 14251), (7172, 14399)]
         : compromised: 0.4984, honest: 0.4935

=== FINAL RESULTS ===
Dataset: sent140, Nodes: 20, Graph: erdos, Aggregation: d-fedavg
Attack: backdoor, 30.0% compromised
Final accuracy - Compromised: 0.4984, Honest: 0.4935
Overall test accuracy: mean=0.4950 ± 0.0055

=== BACKDOOR ATTACK SUCCESS RATE (ASR) ===
Target label: 1
Trigger size: 3x3
Overall ASR: 0.9892 ± 0.0115
Honest nodes ASR: 0.9894 ± 0.0121
Compromised nodes ASR: 0.9886 ± 0.0098
Note: Higher ASR indicates more successful backdoor attack
