Device: cuda
Seed: 987654321
Loading 1 LEAF Sent140 train files...
LEAF Sent140 train: 254555 users, 908652 samples
Building vocabulary (max_size=10000)...
Vocabulary size: 10000
Loading 1 LEAF Sent140 test files...
LEAF Sent140 test: 254555 users, 286281 samples
Found 254555 train users, 254555 test users, 254555 common users
User sample counts range: 494 (max) to 1 (min)
Distributed ALL 254555 users across 20 clients
Users per client: 12727 (with 15 clients getting +1 user)
Train partition sizes: [44353, 44290, 44657, 44907, 44696, 45843, 45801, 45619, 45069, 45639, 45821, 45311, 45779, 46056, 45625, 45984, 46428, 44737, 45540, 46497]
Test partition sizes: [14232, 14235, 14266, 14217, 14238, 14373, 14346, 14334, 14294, 14373, 14344, 14302, 14354, 14362, 14320, 14395, 14389, 14257, 14251, 14399]
  Client 0: 44353 train samples, 2 unique classes
  Client 1: 44290 train samples, 2 unique classes
  Client 2: 44657 train samples, 2 unique classes
  Client 3: 44907 train samples, 2 unique classes
  Client 4: 44696 train samples, 2 unique classes
  Client 5: 45843 train samples, 2 unique classes
  Client 6: 45801 train samples, 2 unique classes
  Client 7: 45619 train samples, 2 unique classes
  Client 8: 45069 train samples, 2 unique classes
  Client 9: 45639 train samples, 2 unique classes
  Client 10: 45821 train samples, 2 unique classes
  Client 11: 45311 train samples, 2 unique classes
  Client 12: 45779 train samples, 2 unique classes
  Client 13: 46056 train samples, 2 unique classes
  Client 14: 45625 train samples, 2 unique classes
  Client 15: 45984 train samples, 2 unique classes
  Client 16: 46428 train samples, 2 unique classes
  Client 17: 44737 train samples, 2 unique classes
  Client 18: 45540 train samples, 2 unique classes
  Client 19: 46497 train samples, 2 unique classes
Will sample 4500 samples per client per epoch
Graph: erdos, nodes: 20, edges: 126
Degree statistics: avg=12.60, min=8, max=16
Attack: Compromised 8/20 nodes: [1, 5, 11, 12, 13, 14, 17, 18]
Attack type: backdoor, lambda: 1.0
Backdoor target label: 1, trigger size: 3
Model variant: baseline
Model parameters: 1,174,986
BALANCE algorithm:
Balance Config: BALANCEConfig(gamma=2, kappa=1, alpha=0.5, min_neighbors=1)
  - Model dimension: 1,174,986 parameters
  - Complexity: O(N×d) = O(20×1,174,986)
Initial test acc across nodes: mean=0.4965 ± 0.0152
Backdoor attack: Created poisoned datasets for 8 compromised nodes
Round 001: test acc mean=0.5054 ± 0.0067 | min=0.4905 max=0.5200
         : test loss mean=13.8180 ± 17.1813
         : individual accs = ['0.496276', '0.508254', '0.515281', '0.512133', '0.520017', '0.498922', '0.503276', '0.507465', '0.508885', '0.506714', '0.508645', '0.499091', '0.500348', '0.508982', '0.508101', '0.501980', '0.508791', '0.503753', '0.490492', '0.499618']
         : correct/total = [(7063, 14232), (7235, 14235), (7351, 14266), (7281, 14217), (7404, 14238), (7171, 14373), (7220, 14346), (7274, 14334), (7274, 14294), (7283, 14373), (7296, 14344), (7138, 14302), (7182, 14354), (7310, 14362), (7276, 14320), (7226, 14395), (7321, 14389), (7182, 14257), (6990, 14251), (7194, 14399)]
         : compromised: 0.5022, honest: 0.5074
Round 002: test acc mean=0.5079 ± 0.0123 | min=0.4733 max=0.5286
         : test loss mean=549.5523 ± 679.6194
         : individual accs = ['0.473300', '0.506358', '0.508692', '0.511430', '0.515030', '0.509427', '0.499303', '0.512418', '0.528613', '0.518542', '0.502022', '0.498182', '0.492058', '0.508704', '0.504260', '0.522959', '0.516923', '0.504664', '0.499895', '0.525939']
         : correct/total = [(6736, 14232), (7208, 14235), (7257, 14266), (7271, 14217), (7333, 14238), (7322, 14373), (7163, 14346), (7345, 14334), (7556, 14294), (7453, 14373), (7201, 14344), (7125, 14302), (7063, 14354), (7306, 14362), (7221, 14320), (7528, 14395), (7438, 14389), (7195, 14257), (7124, 14251), (7573, 14399)]
         : compromised: 0.5029, honest: 0.5113
Round 003: test acc mean=0.5175 ± 0.0221 | min=0.4873 max=0.5620
         : test loss mean=30660.4400 ± 38270.8201
         : individual accs = ['0.521360', '0.493713', '0.562036', '0.522403', '0.549445', '0.493425', '0.534923', '0.553579', '0.518050', '0.520629', '0.543084', '0.497693', '0.488435', '0.512742', '0.503561', '0.500452', '0.506359', '0.504103', '0.487264', '0.536079']
         : correct/total = [(7420, 14232), (7028, 14235), (8018, 14266), (7427, 14217), (7823, 14238), (7092, 14373), (7674, 14346), (7935, 14334), (7405, 14294), (7483, 14373), (7790, 14344), (7118, 14302), (7011, 14354), (7364, 14362), (7211, 14320), (7204, 14395), (7286, 14389), (7187, 14257), (6944, 14251), (7719, 14399)]
         : compromised: 0.4976, honest: 0.5307
Round 004: test acc mean=0.5310 ± 0.0339 | min=0.4882 max=0.5863
         : test loss mean=4746775.4353 ± 6303381.8363
         : individual accs = ['0.572723', '0.497366', '0.576546', '0.570936', '0.509833', '0.495791', '0.555695', '0.558811', '0.512942', '0.586308', '0.543781', '0.502237', '0.502160', '0.488233', '0.502095', '0.516221', '0.564459', '0.503051', '0.489860', '0.571429']
         : correct/total = [(8151, 14232), (7080, 14235), (8225, 14266), (8117, 14217), (7259, 14238), (7126, 14373), (7972, 14346), (8010, 14334), (7332, 14294), (8427, 14373), (7800, 14344), (7183, 14302), (7208, 14354), (7012, 14362), (7190, 14320), (7431, 14395), (8122, 14389), (7172, 14257), (6981, 14251), (8228, 14399)]
         : compromised: 0.4976, honest: 0.5533
Round 005: test acc mean=0.5560 ± 0.0460 | min=0.4864 max=0.6049
         : test loss mean=240843735.0110 ± 297435824.0990
         : individual accs = ['0.597035', '0.494275', '0.571218', '0.604910', '0.588636', '0.502539', '0.587411', '0.594251', '0.585700', '0.600849', '0.596905', '0.503636', '0.508012', '0.489556', '0.513827', '0.592358', '0.593995', '0.486358', '0.507052', '0.601639']
         : correct/total = [(8497, 14232), (7036, 14235), (8149, 14266), (8600, 14217), (8381, 14238), (7223, 14373), (8427, 14346), (8518, 14334), (8372, 14294), (8636, 14373), (8562, 14344), (7203, 14302), (7292, 14354), (7031, 14362), (7358, 14320), (8527, 14395), (8547, 14389), (6934, 14257), (7226, 14251), (8663, 14399)]
         : compromised: 0.5007, honest: 0.5929
Round 006: test acc mean=0.5652 ± 0.0501 | min=0.4957 max=0.6112
         : test loss mean=18251537209.4198 ± 23137725528.8878
         : individual accs = ['0.611228', '0.504742', '0.606477', '0.610255', '0.610339', '0.497669', '0.608323', '0.606879', '0.600392', '0.609546', '0.608826', '0.507691', '0.507872', '0.511141', '0.511313', '0.597221', '0.592397', '0.495686', '0.498070', '0.608792']
         : correct/total = [(8699, 14232), (7185, 14235), (8652, 14266), (8676, 14217), (8690, 14238), (7153, 14373), (8727, 14346), (8699, 14334), (8582, 14294), (8761, 14373), (8733, 14344), (7261, 14302), (7290, 14354), (7341, 14362), (7322, 14320), (8597, 14395), (8524, 14389), (7067, 14257), (7098, 14251), (8766, 14399)]
         : compromised: 0.5043, honest: 0.6059
Round 007: test acc mean=0.5710 ± 0.0534 | min=0.4965 max=0.6187
         : test loss mean=1480602451166.4404 ± 1860804866362.6621
         : individual accs = ['0.615022', '0.511275', '0.613627', '0.617500', '0.614904', '0.502400', '0.612366', '0.615320', '0.615713', '0.618730', '0.613148', '0.512586', '0.500209', '0.507450', '0.507751', '0.610212', '0.612065', '0.496528', '0.508666', '0.615459']
         : correct/total = [(8753, 14232), (7278, 14235), (8754, 14266), (8779, 14217), (8755, 14238), (7221, 14373), (8785, 14346), (8820, 14334), (8801, 14294), (8893, 14373), (8795, 14344), (7331, 14302), (7180, 14354), (7288, 14362), (7271, 14320), (8784, 14395), (8807, 14389), (7079, 14257), (7249, 14251), (8862, 14399)]
         : compromised: 0.5059, honest: 0.6145
Round 008: test acc mean=0.5721 ± 0.0583 | min=0.4905 max=0.6234
         : test loss mean=121986579696988.2188 ± 153495794679762.6250
         : individual accs = ['0.619590', '0.510011', '0.620566', '0.623409', '0.609987', '0.500870', '0.619546', '0.620273', '0.620540', '0.620956', '0.620190', '0.501049', '0.490456', '0.507032', '0.502374', '0.620771', '0.618667', '0.496388', '0.498983', '0.620807']
         : correct/total = [(8818, 14232), (7260, 14235), (8853, 14266), (8863, 14217), (8685, 14238), (7199, 14373), (8888, 14346), (8891, 14334), (8870, 14294), (8925, 14373), (8896, 14344), (7166, 14302), (7040, 14354), (7282, 14362), (7194, 14320), (8936, 14395), (8902, 14389), (7077, 14257), (7111, 14251), (8939, 14399)]
         : compromised: 0.5009, honest: 0.6196
Round 009: test acc mean=0.5760 ± 0.0604 | min=0.4974 max=0.6302
         : test loss mean=10386387737004506.0000 ± 13158566505864622.0000
         : individual accs = ['0.625703', '0.508465', '0.627436', '0.623831', '0.619399', '0.504766', '0.627562', '0.621111', '0.626277', '0.630209', '0.625697', '0.497553', '0.497353', '0.508912', '0.503561', '0.629316', '0.620960', '0.498001', '0.498842', '0.625182']
         : correct/total = [(8905, 14232), (7238, 14235), (8951, 14266), (8869, 14217), (8819, 14238), (7255, 14373), (9003, 14346), (8903, 14334), (8952, 14294), (9058, 14373), (8975, 14344), (7116, 14302), (7139, 14354), (7309, 14362), (7211, 14320), (9059, 14395), (8935, 14389), (7100, 14257), (7109, 14251), (9002, 14399)]
         : compromised: 0.5022, honest: 0.6252
Round 010: test acc mean=0.5810 ± 0.0620 | min=0.4969 max=0.6350
         : test loss mean=864210846638946048.0000 ± 1094830131797944192.0000
         : individual accs = ['0.634064', '0.510011', '0.635006', '0.632342', '0.627406', '0.507201', '0.630350', '0.624808', '0.634112', '0.634453', '0.631274', '0.508181', '0.498049', '0.505779', '0.516341', '0.634456', '0.627285', '0.496879', '0.499474', '0.632058']
         : correct/total = [(9024, 14232), (7260, 14235), (9059, 14266), (8990, 14217), (8933, 14238), (7290, 14373), (9043, 14346), (8956, 14334), (9064, 14294), (9119, 14373), (9055, 14344), (7268, 14302), (7149, 14354), (7264, 14362), (7394, 14320), (9133, 14395), (9026, 14389), (7084, 14257), (7118, 14251), (9101, 14399)]
         : compromised: 0.5052, honest: 0.6315

=== FINAL RESULTS ===
Dataset: sent140, Nodes: 20, Graph: erdos, Aggregation: balance
Attack: backdoor, 40.0% compromised
Final accuracy - Compromised: 0.5052, Honest: 0.6315
Overall test accuracy: mean=0.5810 ± 0.0620

=== BACKDOOR ATTACK SUCCESS RATE (ASR) ===
Target label: 1
Trigger size: 3x3
Overall ASR: 0.6686 ± 0.2598
Honest nodes ASR: 0.4573 ± 0.0278
Compromised nodes ASR: 0.9856 ± 0.0108
Note: Higher ASR indicates more successful backdoor attack

=== BALANCE SUMMARY ===
Node 0: acceptance=0.606
Node 1: acceptance=0.600
Node 2: acceptance=0.550
Node 3: acceptance=0.662
Node 4: acceptance=0.591
Node 5: acceptance=0.700
Node 6: acceptance=0.550
Node 7: acceptance=0.550
Node 8: acceptance=0.550
Node 9: acceptance=0.723
Node 10: acceptance=0.600
Node 11: acceptance=0.600
Node 12: acceptance=0.600
Node 13: acceptance=0.600
Node 14: acceptance=0.600
Node 15: acceptance=0.591
Node 16: acceptance=0.585
Node 17: acceptance=0.600
Node 18: acceptance=0.600
Node 19: acceptance=0.550

=== PARALLEL EXECUTION TIME (realistic for distributed system) ===
  COMMUNICATION (max across nodes):
    - Full model transfer: 0.000s (0.0%)
  COMPUTATION (max across nodes):
    - Filtering: 0.070s (82.2%)
    - Aggregation: 0.015s (17.8%)
  TOTALS:
    - Total computation: 0.085s (100.0%)
    - Total communication: 0.000s (0.0%)
    - Total parallel time: 0.085s

=== PER-NODE AVERAGE TIME ===
  - Filtering: 0.054s
  - Aggregation: 0.008s
  - Model transfer: 0.000s
  - Total per node: 0.063s

=== TOTAL COMPUTATIONAL WORK (sum across all nodes) ===
  - Total filtering: 1.087s
  - Total aggregation: 0.165s
  - Total model transfer: 0.000s
  - Grand total: 1.252s
  - Mean acceptance rate: 0.600

BALANCE Algorithm Properties:
  - Model dimension: 1,174,986
  - No compression: Full parameter comparison
  - Theoretical complexity: O(deg(i)×d)
  - Approach: Full parameter filtering + averaging
