Device: cuda
Seed: 987654321
Loading 1 LEAF Sent140 train files...
LEAF Sent140 train: 254555 users, 908652 samples
Building vocabulary (max_size=10000)...
Vocabulary size: 10000
Loading 1 LEAF Sent140 test files...
LEAF Sent140 test: 254555 users, 286281 samples
Found 254555 train users, 254555 test users, 254555 common users
User sample counts range: 494 (max) to 1 (min)
Distributed ALL 254555 users across 20 clients
Users per client: 12727 (with 15 clients getting +1 user)
Train partition sizes: [44353, 44290, 44657, 44907, 44696, 45843, 45801, 45619, 45069, 45639, 45821, 45311, 45779, 46056, 45625, 45984, 46428, 44737, 45540, 46497]
Test partition sizes: [14232, 14235, 14266, 14217, 14238, 14373, 14346, 14334, 14294, 14373, 14344, 14302, 14354, 14362, 14320, 14395, 14389, 14257, 14251, 14399]
  Client 0: 44353 train samples, 2 unique classes
  Client 1: 44290 train samples, 2 unique classes
  Client 2: 44657 train samples, 2 unique classes
  Client 3: 44907 train samples, 2 unique classes
  Client 4: 44696 train samples, 2 unique classes
  Client 5: 45843 train samples, 2 unique classes
  Client 6: 45801 train samples, 2 unique classes
  Client 7: 45619 train samples, 2 unique classes
  Client 8: 45069 train samples, 2 unique classes
  Client 9: 45639 train samples, 2 unique classes
  Client 10: 45821 train samples, 2 unique classes
  Client 11: 45311 train samples, 2 unique classes
  Client 12: 45779 train samples, 2 unique classes
  Client 13: 46056 train samples, 2 unique classes
  Client 14: 45625 train samples, 2 unique classes
  Client 15: 45984 train samples, 2 unique classes
  Client 16: 46428 train samples, 2 unique classes
  Client 17: 44737 train samples, 2 unique classes
  Client 18: 45540 train samples, 2 unique classes
  Client 19: 46497 train samples, 2 unique classes
Will sample 4500 samples per client per epoch
Graph: erdos, nodes: 20, edges: 99
Degree statistics: avg=9.90, min=7, max=14
Attack: Compromised 6/20 nodes: [5, 12, 13, 14, 17, 18]
Attack type: backdoor, lambda: 1.0
Backdoor target label: 1, trigger size: 3
Model variant: baseline
Model parameters: 1,174,986
BALANCE algorithm:
Balance Config: BALANCEConfig(gamma=2, kappa=1, alpha=0.5, min_neighbors=1)
  - Model dimension: 1,174,986 parameters
  - Complexity: O(N×d) = O(20×1,174,986)
Initial test acc across nodes: mean=0.4965 ± 0.0152
Backdoor attack: Created poisoned datasets for 6 compromised nodes
Round 001: test acc mean=0.5004 ± 0.0092 | min=0.4838 max=0.5179
         : test loss mean=11.5069 ± 16.6867
         : individual accs = ['0.499789', '0.486758', '0.483808', '0.517901', '0.515592', '0.500104', '0.508644', '0.505930', '0.488876', '0.506923', '0.488915', '0.497133', '0.503205', '0.504874', '0.497277', '0.512261', '0.501286', '0.501298', '0.491965', '0.494618']
         : correct/total = [(7113, 14232), (6929, 14235), (6902, 14266), (7363, 14217), (7341, 14238), (7188, 14373), (7297, 14346), (7252, 14334), (6988, 14294), (7286, 14373), (7013, 14344), (7110, 14302), (7223, 14354), (7251, 14362), (7121, 14320), (7374, 14395), (7213, 14389), (7147, 14257), (7011, 14251), (7122, 14399)]
         : compromised: 0.4998, honest: 0.5006
Round 002: test acc mean=0.5088 ± 0.0131 | min=0.4900 max=0.5450
         : test loss mean=392.3809 ± 604.4352
         : individual accs = ['0.510750', '0.493642', '0.490046', '0.511571', '0.509833', '0.507618', '0.502928', '0.513744', '0.514412', '0.523551', '0.521821', '0.527619', '0.496656', '0.490043', '0.507402', '0.544981', '0.505039', '0.502981', '0.502491', '0.499410']
         : correct/total = [(7269, 14232), (7027, 14235), (6991, 14266), (7273, 14217), (7259, 14238), (7296, 14373), (7215, 14346), (7364, 14334), (7353, 14294), (7525, 14373), (7485, 14344), (7546, 14302), (7129, 14354), (7038, 14362), (7266, 14320), (7845, 14395), (7267, 14389), (7171, 14257), (7161, 14251), (7191, 14399)]
         : compromised: 0.5012, honest: 0.5121
Round 003: test acc mean=0.5084 ± 0.0151 | min=0.4860 max=0.5479
         : test loss mean=24659.2839 ± 38594.7997
         : individual accs = ['0.511594', '0.487039', '0.489556', '0.512344', '0.547900', '0.506923', '0.512408', '0.496791', '0.511054', '0.496486', '0.530257', '0.525381', '0.502787', '0.507868', '0.497626', '0.508163', '0.514212', '0.486007', '0.497018', '0.525662']
         : correct/total = [(7281, 14232), (6933, 14235), (6984, 14266), (7284, 14217), (7801, 14238), (7286, 14373), (7351, 14346), (7121, 14334), (7305, 14294), (7136, 14373), (7606, 14344), (7514, 14302), (7217, 14354), (7294, 14362), (7126, 14320), (7315, 14395), (7399, 14389), (6929, 14257), (7083, 14251), (7569, 14399)]
         : compromised: 0.4997, honest: 0.5121
Round 004: test acc mean=0.5136 ± 0.0204 | min=0.4819 max=0.5542
         : test loss mean=3073861.4644 ± 4759461.1882
         : individual accs = ['0.539207', '0.495820', '0.521380', '0.501301', '0.538418', '0.500522', '0.502997', '0.495535', '0.547363', '0.511723', '0.524331', '0.522654', '0.486624', '0.481897', '0.507472', '0.511844', '0.537285', '0.493372', '0.498842', '0.554205']
         : correct/total = [(7674, 14232), (7058, 14235), (7438, 14266), (7127, 14217), (7666, 14238), (7194, 14373), (7216, 14346), (7103, 14334), (7824, 14294), (7355, 14373), (7521, 14344), (7475, 14302), (6985, 14354), (6921, 14362), (7267, 14320), (7368, 14395), (7731, 14389), (7034, 14257), (7109, 14251), (7980, 14399)]
         : compromised: 0.4948, honest: 0.5217
Round 005: test acc mean=0.5190 ± 0.0221 | min=0.4919 max=0.5705
         : test loss mean=197296963.3444 ± 308726995.0656
         : individual accs = ['0.500281', '0.512329', '0.491869', '0.531195', '0.521141', '0.509706', '0.521609', '0.518278', '0.569260', '0.509010', '0.519730', '0.500420', '0.499164', '0.514483', '0.496508', '0.520320', '0.558065', '0.513713', '0.502912', '0.570456']
         : correct/total = [(7120, 14232), (7293, 14235), (7017, 14266), (7552, 14217), (7420, 14238), (7326, 14373), (7483, 14346), (7429, 14334), (8137, 14294), (7316, 14373), (7455, 14344), (7157, 14302), (7165, 14354), (7389, 14362), (7110, 14320), (7490, 14395), (8030, 14389), (7324, 14257), (7167, 14251), (8214, 14399)]
         : compromised: 0.5061, honest: 0.5246
Round 006: test acc mean=0.5270 ± 0.0293 | min=0.4839 max=0.5892
         : test loss mean=14607261578.2050 ± 22529458508.4246
         : individual accs = ['0.506464', '0.514577', '0.507010', '0.558416', '0.513064', '0.495512', '0.546215', '0.542835', '0.589198', '0.516246', '0.576478', '0.541043', '0.483907', '0.508773', '0.500489', '0.534005', '0.530266', '0.503823', '0.496106', '0.575248']
         : correct/total = [(7208, 14232), (7325, 14235), (7233, 14266), (7939, 14217), (7305, 14238), (7122, 14373), (7836, 14346), (7781, 14334), (8422, 14294), (7420, 14373), (8269, 14344), (7738, 14302), (6946, 14354), (7307, 14362), (7167, 14320), (7687, 14395), (7630, 14389), (7183, 14257), (7070, 14251), (8283, 14399)]
         : compromised: 0.4981, honest: 0.5394
Round 007: test acc mean=0.5445 ± 0.0324 | min=0.4927 max=0.5977
         : test loss mean=1105562904582.7974 ± 1699663111647.5522
         : individual accs = ['0.566681', '0.538883', '0.539955', '0.571218', '0.549305', '0.494538', '0.561899', '0.560625', '0.597663', '0.541084', '0.587702', '0.552930', '0.492685', '0.503273', '0.496439', '0.564015', '0.565918', '0.504664', '0.513438', '0.586291']
         : correct/total = [(8065, 14232), (7671, 14235), (7703, 14266), (8121, 14217), (7821, 14238), (7108, 14373), (8061, 14346), (8036, 14334), (8543, 14294), (7777, 14373), (8430, 14344), (7908, 14302), (7072, 14354), (7228, 14362), (7109, 14320), (8119, 14395), (8143, 14389), (7195, 14257), (7317, 14251), (8442, 14399)]
         : compromised: 0.5008, honest: 0.5632
Round 008: test acc mean=0.5586 ± 0.0396 | min=0.4880 max=0.6043
         : test loss mean=93557534567480.7188 ± 143431269042342.7812
         : individual accs = ['0.566962', '0.571268', '0.549208', '0.601533', '0.562509', '0.492799', '0.584902', '0.589438', '0.597034', '0.575871', '0.604294', '0.579499', '0.488017', '0.504874', '0.504050', '0.595346', '0.586212', '0.510696', '0.511262', '0.596639']
         : correct/total = [(8069, 14232), (8132, 14235), (7835, 14266), (8552, 14217), (8009, 14238), (7083, 14373), (8391, 14346), (8449, 14334), (8534, 14294), (8277, 14373), (8668, 14344), (8288, 14302), (7005, 14354), (7251, 14362), (7218, 14320), (8570, 14395), (8435, 14389), (7281, 14257), (7286, 14251), (8591, 14399)]
         : compromised: 0.5019, honest: 0.5829
Round 009: test acc mean=0.5740 ± 0.0463 | min=0.4964 max=0.6114
         : test loss mean=8076804170086709.0000 ± 12444511118495342.0000
         : individual accs = ['0.596473', '0.607306', '0.587411', '0.610677', '0.597486', '0.496695', '0.609368', '0.610506', '0.606688', '0.601058', '0.611405', '0.600126', '0.503135', '0.501532', '0.496439', '0.610976', '0.598721', '0.513502', '0.512666', '0.606848']
         : correct/total = [(8489, 14232), (8645, 14235), (8380, 14266), (8682, 14217), (8507, 14238), (7139, 14373), (8742, 14346), (8751, 14334), (8672, 14294), (8639, 14373), (8770, 14344), (8583, 14302), (7222, 14354), (7203, 14362), (7109, 14320), (8795, 14395), (8615, 14389), (7321, 14257), (7306, 14251), (8738, 14399)]
         : compromised: 0.5040, honest: 0.6039
Round 010: test acc mean=0.5809 ± 0.0518 | min=0.4883 max=0.6198
         : test loss mean=660723558558074496.0000 ± 1017382070333048448.0000
         : individual accs = ['0.613617', '0.619810', '0.605636', '0.617782', '0.612375', '0.488346', '0.615433', '0.615530', '0.611515', '0.614764', '0.619771', '0.614250', '0.515536', '0.504247', '0.492598', '0.614102', '0.611648', '0.506348', '0.506701', '0.617057']
         : correct/total = [(8733, 14232), (8823, 14235), (8640, 14266), (8783, 14217), (8719, 14238), (7019, 14373), (8829, 14346), (8823, 14334), (8741, 14294), (8836, 14373), (8890, 14344), (8785, 14302), (7400, 14354), (7242, 14362), (7054, 14320), (8840, 14395), (8801, 14389), (7219, 14257), (7221, 14251), (8885, 14399)]
         : compromised: 0.5023, honest: 0.6145

=== FINAL RESULTS ===
Dataset: sent140, Nodes: 20, Graph: erdos, Aggregation: balance
Attack: backdoor, 30.0% compromised
Final accuracy - Compromised: 0.5023, Honest: 0.6145
Overall test accuracy: mean=0.5809 ± 0.0518

=== BACKDOOR ATTACK SUCCESS RATE (ASR) ===
Target label: 1
Trigger size: 3x3
Overall ASR: 0.6510 ± 0.2248
Honest nodes ASR: 0.5059 ± 0.0443
Compromised nodes ASR: 0.9898 ± 0.0064
Note: Higher ASR indicates more successful backdoor attack

=== BALANCE SUMMARY ===
Node 0: acceptance=0.700
Node 1: acceptance=0.820
Node 2: acceptance=0.775
Node 3: acceptance=0.743
Node 4: acceptance=0.700
Node 5: acceptance=0.600
Node 6: acceptance=0.625
Node 7: acceptance=0.591
Node 8: acceptance=0.357
Node 9: acceptance=0.918
Node 10: acceptance=0.775
Node 11: acceptance=0.625
Node 12: acceptance=0.600
Node 13: acceptance=0.600
Node 14: acceptance=0.600
Node 15: acceptance=0.600
Node 16: acceptance=0.614
Node 17: acceptance=0.700
Node 18: acceptance=0.600
Node 19: acceptance=0.640

=== PARALLEL EXECUTION TIME (realistic for distributed system) ===
  COMMUNICATION (max across nodes):
    - Full model transfer: 0.000s (0.0%)
  COMPUTATION (max across nodes):
    - Filtering: 0.060s (80.7%)
    - Aggregation: 0.014s (19.3%)
  TOTALS:
    - Total computation: 0.075s (100.0%)
    - Total communication: 0.000s (0.0%)
    - Total parallel time: 0.075s

=== PER-NODE AVERAGE TIME ===
  - Filtering: 0.044s
  - Aggregation: 0.008s
  - Model transfer: 0.000s
  - Total per node: 0.051s

=== TOTAL COMPUTATIONAL WORK (sum across all nodes) ===
  - Total filtering: 0.871s
  - Total aggregation: 0.151s
  - Total model transfer: 0.000s
  - Grand total: 1.022s
  - Mean acceptance rate: 0.659

BALANCE Algorithm Properties:
  - Model dimension: 1,174,986
  - No compression: Full parameter comparison
  - Theoretical complexity: O(deg(i)×d)
  - Approach: Full parameter filtering + averaging
