Device: cuda
Seed: 987654321
Loading 1 LEAF Sent140 train files...
LEAF Sent140 train: 254555 users, 908652 samples
Building vocabulary (max_size=10000)...
Vocabulary size: 10000
Loading 1 LEAF Sent140 test files...
LEAF Sent140 test: 254555 users, 286281 samples
Found 254555 train users, 254555 test users, 254555 common users
User sample counts range: 494 (max) to 1 (min)
Distributed ALL 254555 users across 20 clients
Users per client: 12727 (with 15 clients getting +1 user)
Train partition sizes: [44353, 44290, 44657, 44907, 44696, 45843, 45801, 45619, 45069, 45639, 45821, 45311, 45779, 46056, 45625, 45984, 46428, 44737, 45540, 46497]
Test partition sizes: [14232, 14235, 14266, 14217, 14238, 14373, 14346, 14334, 14294, 14373, 14344, 14302, 14354, 14362, 14320, 14395, 14389, 14257, 14251, 14399]
  Client 0: 44353 train samples, 2 unique classes
  Client 1: 44290 train samples, 2 unique classes
  Client 2: 44657 train samples, 2 unique classes
  Client 3: 44907 train samples, 2 unique classes
  Client 4: 44696 train samples, 2 unique classes
  Client 5: 45843 train samples, 2 unique classes
  Client 6: 45801 train samples, 2 unique classes
  Client 7: 45619 train samples, 2 unique classes
  Client 8: 45069 train samples, 2 unique classes
  Client 9: 45639 train samples, 2 unique classes
  Client 10: 45821 train samples, 2 unique classes
  Client 11: 45311 train samples, 2 unique classes
  Client 12: 45779 train samples, 2 unique classes
  Client 13: 46056 train samples, 2 unique classes
  Client 14: 45625 train samples, 2 unique classes
  Client 15: 45984 train samples, 2 unique classes
  Client 16: 46428 train samples, 2 unique classes
  Client 17: 44737 train samples, 2 unique classes
  Client 18: 45540 train samples, 2 unique classes
  Client 19: 46497 train samples, 2 unique classes
Will sample 4500 samples per client per epoch
Graph: ring, nodes: 20, edges: 20
Degree statistics: avg=2.00, min=2, max=2
Attack: Compromised 2/20 nodes: [5, 13]
Attack type: gaussian, lambda: 1.0
Model variant: baseline
Model parameters: 1,174,986
Sketchguard Node 0:
  Model dim: 1,174,986 → Sketch size: 180
  Compression ratio: 6527.7x
  Using model parameters for aggregation, sketches for filtering
Sketchguard Node 1:
  Model dim: 1,174,986 → Sketch size: 180
  Compression ratio: 6527.7x
  Using model parameters for aggregation, sketches for filtering
Sketchguard Node 2:
  Model dim: 1,174,986 → Sketch size: 180
  Compression ratio: 6527.7x
  Using model parameters for aggregation, sketches for filtering
Sketchguard Node 3:
  Model dim: 1,174,986 → Sketch size: 180
  Compression ratio: 6527.7x
  Using model parameters for aggregation, sketches for filtering
Sketchguard Node 4:
  Model dim: 1,174,986 → Sketch size: 180
  Compression ratio: 6527.7x
  Using model parameters for aggregation, sketches for filtering
Sketchguard Node 5:
  Model dim: 1,174,986 → Sketch size: 180
  Compression ratio: 6527.7x
  Using model parameters for aggregation, sketches for filtering
Sketchguard Node 6:
  Model dim: 1,174,986 → Sketch size: 180
  Compression ratio: 6527.7x
  Using model parameters for aggregation, sketches for filtering
Sketchguard Node 7:
  Model dim: 1,174,986 → Sketch size: 180
  Compression ratio: 6527.7x
  Using model parameters for aggregation, sketches for filtering
Sketchguard Node 8:
  Model dim: 1,174,986 → Sketch size: 180
  Compression ratio: 6527.7x
  Using model parameters for aggregation, sketches for filtering
Sketchguard Node 9:
  Model dim: 1,174,986 → Sketch size: 180
  Compression ratio: 6527.7x
  Using model parameters for aggregation, sketches for filtering
Sketchguard Node 10:
  Model dim: 1,174,986 → Sketch size: 180
  Compression ratio: 6527.7x
  Using model parameters for aggregation, sketches for filtering
Sketchguard Node 11:
  Model dim: 1,174,986 → Sketch size: 180
  Compression ratio: 6527.7x
  Using model parameters for aggregation, sketches for filtering
Sketchguard Node 12:
  Model dim: 1,174,986 → Sketch size: 180
  Compression ratio: 6527.7x
  Using model parameters for aggregation, sketches for filtering
Sketchguard Node 13:
  Model dim: 1,174,986 → Sketch size: 180
  Compression ratio: 6527.7x
  Using model parameters for aggregation, sketches for filtering
Sketchguard Node 14:
  Model dim: 1,174,986 → Sketch size: 180
  Compression ratio: 6527.7x
  Using model parameters for aggregation, sketches for filtering
Sketchguard Node 15:
  Model dim: 1,174,986 → Sketch size: 180
  Compression ratio: 6527.7x
  Using model parameters for aggregation, sketches for filtering
Sketchguard Node 16:
  Model dim: 1,174,986 → Sketch size: 180
  Compression ratio: 6527.7x
  Using model parameters for aggregation, sketches for filtering
Sketchguard Node 17:
  Model dim: 1,174,986 → Sketch size: 180
  Compression ratio: 6527.7x
  Using model parameters for aggregation, sketches for filtering
Sketchguard Node 18:
  Model dim: 1,174,986 → Sketch size: 180
  Compression ratio: 6527.7x
  Using model parameters for aggregation, sketches for filtering
Sketchguard Node 19:
  Model dim: 1,174,986 → Sketch size: 180
  Compression ratio: 6527.7x
  Using model parameters for aggregation, sketches for filtering
Sketchguard ALGORITHM (Sketch-based Filtering + State Aggregation)
  - Model dimension: 1,174,986 parameters
  - Config: SketchguardConfig(gamma=2, kappa=1, alpha=0.5, min_neighbors=1, sketch_size=180, network_seed=987654321, attack_detection_window=5)
  - Sketch size: 180
  - Compression ratio: 6527.7x
  - Complexity: O(d + N×k) = O(1,174,986 + 20×180)
  - Theoretical speedup vs BALANCE: 19.9x
Initial test acc across nodes: mean=0.4965 ± 0.0152
Round 001: test acc mean=0.5298 ± 0.0198 | min=0.4980 max=0.5627
         : test loss mean=0.6918 ± 0.0011
         : individual accs = ['0.511031', '0.553495', '0.515211', '0.554407', '0.517980', '0.509288', '0.562666', '0.526441', '0.518679', '0.540110', '0.498048', '0.560621', '0.505713', '0.546790', '0.524860', '0.540396', '0.524776', '0.521218', '0.508736', '0.555941']
         : correct/total = [(7273, 14232), (7879, 14235), (7350, 14266), (7882, 14217), (7375, 14238), (7320, 14373), (8072, 14346), (7546, 14334), (7414, 14294), (7763, 14373), (7144, 14344), (8018, 14302), (7259, 14354), (7853, 14362), (7516, 14320), (7779, 14395), (7551, 14389), (7431, 14257), (7250, 14251), (8005, 14399)]
         : compromised: 0.5280, honest: 0.5300
         : sketchguard stats = ['Node 0: acc_rate=1.000', 'Node 1: acc_rate=1.000', 'Node 2: acc_rate=1.000']...
Round 002: test acc mean=0.5204 ± 0.0315 | min=0.4871 max=0.6050
         : test loss mean=0.6905 ± 0.0033
         : individual accs = ['0.491568', '0.504953', '0.487102', '0.503341', '0.524020', '0.493843', '0.605047', '0.556788', '0.488597', '0.498713', '0.514780', '0.562788', '0.584297', '0.514274', '0.528561', '0.509621', '0.504622', '0.515186', '0.502842', '0.517328']
         : correct/total = [(6996, 14232), (7188, 14235), (6949, 14266), (7156, 14217), (7461, 14238), (7098, 14373), (8680, 14346), (7981, 14334), (6984, 14294), (7168, 14373), (7384, 14344), (8049, 14302), (8387, 14354), (7386, 14362), (7569, 14320), (7336, 14395), (7261, 14389), (7345, 14257), (7166, 14251), (7449, 14399)]
         : compromised: 0.5041, honest: 0.5222
         : sketchguard stats = ['Node 0: acc_rate=1.000', 'Node 1: acc_rate=1.000', 'Node 2: acc_rate=1.000']...
Round 003: test acc mean=0.5217 ± 0.0391 | min=0.4860 max=0.6074
         : test loss mean=0.6893 ± 0.0054
         : individual accs = ['0.489179', '0.486196', '0.485981', '0.524654', '0.564686', '0.493843', '0.606232', '0.566904', '0.488597', '0.493147', '0.500209', '0.564047', '0.607427', '0.508564', '0.553142', '0.508440', '0.499757', '0.502981', '0.491194', '0.498924']
         : correct/total = [(6962, 14232), (6921, 14235), (6933, 14266), (7459, 14217), (8040, 14238), (7098, 14373), (8697, 14346), (8126, 14334), (6984, 14294), (7088, 14373), (7175, 14344), (8067, 14302), (8719, 14354), (7304, 14362), (7921, 14320), (7319, 14395), (7191, 14389), (7171, 14257), (7000, 14251), (7184, 14399)]
         : compromised: 0.5012, honest: 0.5240
         : sketchguard stats = ['Node 0: acc_rate=1.000', 'Node 1: acc_rate=1.000', 'Node 2: acc_rate=1.000']...
Round 004: test acc mean=0.5297 ± 0.0441 | min=0.4868 max=0.6127
         : test loss mean=0.6878 ± 0.0072
         : individual accs = ['0.489460', '0.486828', '0.492640', '0.562988', '0.580840', '0.493843', '0.605604', '0.585810', '0.489296', '0.493216', '0.500837', '0.589428', '0.612721', '0.508564', '0.569483', '0.537409', '0.499757', '0.503121', '0.493720', '0.499201']
         : correct/total = [(6966, 14232), (6930, 14235), (7028, 14266), (8004, 14217), (8270, 14238), (7098, 14373), (8688, 14346), (8397, 14334), (6994, 14294), (7089, 14373), (7184, 14344), (8430, 14302), (8795, 14354), (7304, 14362), (8155, 14320), (7736, 14395), (7191, 14389), (7173, 14257), (7036, 14251), (7188, 14399)]
         : compromised: 0.5012, honest: 0.5329
         : sketchguard stats = ['Node 0: acc_rate=1.000', 'Node 1: acc_rate=1.000', 'Node 2: acc_rate=1.000']...
Round 005: test acc mean=0.5340 ± 0.0499 | min=0.4863 max=0.6232
         : test loss mean=0.6863 ± 0.0091
         : individual accs = ['0.489109', '0.486266', '0.488434', '0.572273', '0.592148', '0.493843', '0.623170', '0.617901', '0.493494', '0.492938', '0.501394', '0.589218', '0.615787', '0.508495', '0.573953', '0.551372', '0.499965', '0.503121', '0.490843', '0.496562']
         : correct/total = [(6961, 14232), (6922, 14235), (6968, 14266), (8136, 14217), (8431, 14238), (7098, 14373), (8940, 14346), (8857, 14334), (7054, 14294), (7085, 14373), (7192, 14344), (8427, 14302), (8839, 14354), (7303, 14362), (8219, 14320), (7937, 14395), (7194, 14389), (7173, 14257), (6995, 14251), (7150, 14399)]
         : compromised: 0.5012, honest: 0.5377
         : sketchguard stats = ['Node 0: acc_rate=1.000', 'Node 1: acc_rate=1.000', 'Node 2: acc_rate=1.000']...
Round 006: test acc mean=0.5398 ± 0.0501 | min=0.4863 max=0.6236
         : test loss mean=0.6843 ± 0.0113
         : individual accs = ['0.489109', '0.486266', '0.505257', '0.584371', '0.594114', '0.493843', '0.623588', '0.620622', '0.520638', '0.493773', '0.543503', '0.614460', '0.614742', '0.508564', '0.567039', '0.547760', '0.499618', '0.503121', '0.489159', '0.496354']
         : correct/total = [(6961, 14232), (6922, 14235), (7208, 14266), (8308, 14217), (8459, 14238), (7098, 14373), (8946, 14346), (8896, 14334), (7442, 14294), (7097, 14373), (7796, 14344), (8788, 14302), (8824, 14354), (7304, 14362), (8120, 14320), (7885, 14395), (7189, 14389), (7173, 14257), (6971, 14251), (7147, 14399)]
         : compromised: 0.5012, honest: 0.5441
         : sketchguard stats = ['Node 0: acc_rate=1.000', 'Node 1: acc_rate=1.000', 'Node 2: acc_rate=1.000']...
Round 007: test acc mean=0.5501 ± 0.0517 | min=0.4862 max=0.6230
         : test loss mean=0.6818 ± 0.0132
         : individual accs = ['0.489109', '0.486196', '0.531263', '0.601041', '0.606265', '0.582272', '0.621428', '0.618320', '0.522317', '0.493703', '0.554169', '0.620752', '0.622962', '0.509121', '0.582263', '0.571240', '0.500799', '0.503051', '0.488948', '0.496354']
         : correct/total = [(6961, 14232), (6921, 14235), (7579, 14266), (8545, 14217), (8632, 14238), (8369, 14373), (8915, 14346), (8863, 14334), (7466, 14294), (7096, 14373), (7949, 14344), (8878, 14302), (8942, 14354), (7312, 14362), (8338, 14320), (8223, 14395), (7206, 14389), (7172, 14257), (6968, 14251), (7147, 14399)]
         : compromised: 0.5457, honest: 0.5506
         : sketchguard stats = ['Node 0: acc_rate=1.000', 'Node 1: acc_rate=1.000', 'Node 2: acc_rate=1.000']...
Round 008: test acc mean=0.5662 ± 0.0538 | min=0.4863 max=0.6299
         : test loss mean=0.6779 ± 0.0146
         : individual accs = ['0.489109', '0.486266', '0.542198', '0.610677', '0.612586', '0.611424', '0.629862', '0.625017', '0.575206', '0.500452', '0.593628', '0.622990', '0.627003', '0.602980', '0.591480', '0.591594', '0.520537', '0.503542', '0.490702', '0.496354']
         : correct/total = [(6961, 14232), (6922, 14235), (7735, 14266), (8682, 14217), (8722, 14238), (8788, 14373), (9036, 14346), (8959, 14334), (8222, 14294), (7193, 14373), (8515, 14344), (8910, 14302), (9000, 14354), (8660, 14362), (8470, 14320), (8516, 14395), (7490, 14389), (7179, 14257), (6993, 14251), (7147, 14399)]
         : compromised: 0.6072, honest: 0.5616
         : sketchguard stats = ['Node 0: acc_rate=1.000', 'Node 1: acc_rate=1.000', 'Node 2: acc_rate=1.000']...
Round 009: test acc mean=0.5688 ± 0.0545 | min=0.4877 max=0.6308
         : test loss mean=0.6739 ± 0.0171
         : individual accs = ['0.489109', '0.487671', '0.584677', '0.612647', '0.615536', '0.617686', '0.630768', '0.628157', '0.558976', '0.497600', '0.584844', '0.621801', '0.630347', '0.628951', '0.581494', '0.580757', '0.530614', '0.505506', '0.493018', '0.496354']
         : correct/total = [(6961, 14232), (6942, 14235), (8341, 14266), (8710, 14217), (8764, 14238), (8878, 14373), (9049, 14346), (9004, 14334), (7990, 14294), (7152, 14373), (8389, 14344), (8893, 14302), (9048, 14354), (9033, 14362), (8327, 14320), (8360, 14395), (7635, 14389), (7207, 14257), (7026, 14251), (7147, 14399)]
         : compromised: 0.6233, honest: 0.5628
         : sketchguard stats = ['Node 0: acc_rate=1.000', 'Node 1: acc_rate=1.000', 'Node 2: acc_rate=1.000']...
Round 010: test acc mean=0.5829 ± 0.0549 | min=0.4887 max=0.6388
         : test loss mean=0.6699 ± 0.0190
         : individual accs = ['0.489109', '0.502634', '0.610122', '0.617430', '0.617432', '0.626174', '0.634393', '0.631226', '0.616902', '0.547554', '0.611545', '0.630821', '0.638777', '0.636402', '0.597137', '0.599861', '0.560984', '0.504454', '0.488667', '0.496354']
         : correct/total = [(6961, 14232), (7155, 14235), (8704, 14266), (8778, 14217), (8791, 14238), (9000, 14373), (9101, 14346), (9048, 14334), (8818, 14294), (7870, 14373), (8772, 14344), (9022, 14302), (9169, 14354), (9140, 14362), (8551, 14320), (8635, 14395), (8072, 14389), (7192, 14257), (6964, 14251), (7147, 14399)]
         : compromised: 0.6313, honest: 0.5775
         : sketchguard stats = ['Node 0: acc_rate=1.000', 'Node 1: acc_rate=1.000', 'Node 2: acc_rate=1.000']...

=== FINAL RESULTS ===
Dataset: sent140, Nodes: 20, Graph: ring, Aggregation: sketchguard
Attack: gaussian, 10.0% compromised
Final accuracy - Compromised: 0.6313, Honest: 0.5775
Overall test accuracy: mean=0.5829 ± 0.0549

=== Sketchguard SUMMARY ===
Node 0: acceptance=1.000
Node 1: acceptance=1.000
Node 2: acceptance=1.000
Node 3: acceptance=1.000
Node 4: acceptance=0.500
Node 5: acceptance=0.750
Node 6: acceptance=0.500
Node 7: acceptance=1.000
Node 8: acceptance=1.000
Node 9: acceptance=1.000
Node 10: acceptance=1.000
Node 11: acceptance=1.000
Node 12: acceptance=0.500
Node 13: acceptance=0.800
Node 14: acceptance=0.500
Node 15: acceptance=1.000
Node 16: acceptance=1.000
Node 17: acceptance=1.000
Node 18: acceptance=1.000
Node 19: acceptance=1.000

=== PARALLEL EXECUTION TIME (realistic for distributed system) ===
  COMMUNICATION (max across nodes):
    - Sketch transfer: 0.000s (0.0%)
    - Model fetch (accepted): 0.000s (0.0%)
  COMPUTATION (max across nodes):
    - Sketching: 0.204s (95.1%)
    - Filtering: 0.001s (0.3%)
    - Aggregation: 0.010s (4.6%)
  TOTALS:
    - Total computation: 0.215s (100.0%)
    - Total communication: 0.000s (0.0%)
    - Total parallel time: 0.215s

=== PER-NODE AVERAGE TIME ===
  - Sketching: 0.158s
  - Filtering: 0.000s
  - Aggregation: 0.006s
  - Sketch transfer: 0.000s
  - Model fetch: 0.000s
  - Total per node: 0.164s

=== TOTAL COMPUTATIONAL WORK (sum across all nodes) ===
  - Total sketching: 3.157s
  - Total filtering: 0.006s
  - Total aggregation: 0.117s
  - Total sketch transfer: 0.000s
  - Total model fetch: 0.000s
  - Grand total: 3.280s
  - Mean acceptance rate: 0.878

Sketchguard Algorithm Properties:
  - Original dimension: 1,174,986
  - Sketch size: 180
  - Compression ratio: 19.9x
  - Single repetition: No repetitions needed
  - Theoretical complexity: O(d + N×k)
  - Approach: Sketch filtering + state aggregation
