Device: cuda
Seed: 987654321
Loading 1 LEAF Sent140 train files...
LEAF Sent140 train: 254555 users, 908652 samples
Building vocabulary (max_size=10000)...
Vocabulary size: 10000
Loading 1 LEAF Sent140 test files...
LEAF Sent140 test: 254555 users, 286281 samples
Found 254555 train users, 254555 test users, 254555 common users
User sample counts range: 494 (max) to 1 (min)
Distributed ALL 254555 users across 20 clients
Users per client: 12727 (with 15 clients getting +1 user)
Train partition sizes: [44353, 44290, 44657, 44907, 44696, 45843, 45801, 45619, 45069, 45639, 45821, 45311, 45779, 46056, 45625, 45984, 46428, 44737, 45540, 46497]
Test partition sizes: [14232, 14235, 14266, 14217, 14238, 14373, 14346, 14334, 14294, 14373, 14344, 14302, 14354, 14362, 14320, 14395, 14389, 14257, 14251, 14399]
  Client 0: 44353 train samples, 2 unique classes
  Client 1: 44290 train samples, 2 unique classes
  Client 2: 44657 train samples, 2 unique classes
  Client 3: 44907 train samples, 2 unique classes
  Client 4: 44696 train samples, 2 unique classes
  Client 5: 45843 train samples, 2 unique classes
  Client 6: 45801 train samples, 2 unique classes
  Client 7: 45619 train samples, 2 unique classes
  Client 8: 45069 train samples, 2 unique classes
  Client 9: 45639 train samples, 2 unique classes
  Client 10: 45821 train samples, 2 unique classes
  Client 11: 45311 train samples, 2 unique classes
  Client 12: 45779 train samples, 2 unique classes
  Client 13: 46056 train samples, 2 unique classes
  Client 14: 45625 train samples, 2 unique classes
  Client 15: 45984 train samples, 2 unique classes
  Client 16: 46428 train samples, 2 unique classes
  Client 17: 44737 train samples, 2 unique classes
  Client 18: 45540 train samples, 2 unique classes
  Client 19: 46497 train samples, 2 unique classes
Will sample 4500 samples per client per epoch
Graph: erdos, nodes: 20, edges: 126
Degree statistics: avg=12.60, min=8, max=16
Attack: Compromised 2/20 nodes: [5, 13]
Attack type: backdoor, lambda: 1.0
Backdoor target label: 1, trigger size: 3
Model variant: baseline
Model parameters: 1,174,986
Initial test acc across nodes: mean=0.4965 ± 0.0152
Backdoor attack: Created poisoned datasets for 2 compromised nodes
Round 001: test acc mean=0.5506 ± 0.0492 | min=0.4921 max=0.6098
         : test loss mean=10.9075 ± 11.0441
         : individual accs = ['0.505481', '0.609835', '0.503645', '0.607512', '0.595519', '0.497182', '0.502788', '0.593903', '0.492095', '0.602797', '0.604573', '0.496924', '0.585412', '0.518451', '0.495251', '0.601806', '0.595385', '0.596339', '0.498632', '0.508369']
         : correct/total = [(7194, 14232), (8681, 14235), (7185, 14266), (8637, 14217), (8479, 14238), (7146, 14373), (7213, 14346), (8513, 14334), (7034, 14294), (8664, 14373), (8672, 14344), (7107, 14302), (8403, 14354), (7446, 14362), (7092, 14320), (8663, 14395), (8567, 14389), (8502, 14257), (7106, 14251), (7320, 14399)]
         : compromised: 0.5078, honest: 0.5553
Round 002: test acc mean=0.6067 ± 0.0328 | min=0.5074 max=0.6249
         : test loss mean=2.7981 ± 6.4611
         : individual accs = ['0.617201', '0.607236', '0.510444', '0.624886', '0.618205', '0.618382', '0.617315', '0.621529', '0.507416', '0.622000', '0.620538', '0.616208', '0.618434', '0.613981', '0.613757', '0.620841', '0.615192', '0.617241', '0.615395', '0.618237']
         : correct/total = [(8784, 14232), (8644, 14235), (7282, 14266), (8884, 14217), (8802, 14238), (8888, 14373), (8856, 14346), (8909, 14334), (7253, 14294), (8940, 14373), (8901, 14344), (8813, 14302), (8877, 14354), (8818, 14362), (8789, 14320), (8937, 14395), (8852, 14389), (8800, 14257), (8770, 14251), (8902, 14399)]
         : compromised: 0.6162, honest: 0.6057
Round 003: test acc mean=0.6223 ± 0.0055 | min=0.6079 max=0.6316
         : test loss mean=0.6468 ± 0.0037
         : individual accs = ['0.620854', '0.625149', '0.620847', '0.630161', '0.623121', '0.620956', '0.621846', '0.613227', '0.607947', '0.620191', '0.628695', '0.618585', '0.617877', '0.631597', '0.622835', '0.629316', '0.621864', '0.622361', '0.626061', '0.623307']
         : correct/total = [(8836, 14232), (8899, 14235), (8857, 14266), (8959, 14217), (8872, 14238), (8925, 14373), (8921, 14346), (8790, 14334), (8690, 14294), (8914, 14373), (9018, 14344), (8847, 14302), (8869, 14354), (9071, 14362), (8919, 14320), (9059, 14395), (8948, 14389), (8873, 14257), (8922, 14251), (8975, 14399)]
         : compromised: 0.6263, honest: 0.6219
Round 004: test acc mean=0.6334 ± 0.0040 | min=0.6267 max=0.6407
         : test loss mean=0.6375 ± 0.0025
         : individual accs = ['0.635961', '0.640745', '0.630240', '0.636069', '0.634359', '0.632366', '0.634323', '0.630320', '0.627956', '0.640576', '0.629741', '0.629283', '0.630835', '0.636959', '0.626746', '0.639875', '0.636111', '0.631058', '0.631394', '0.634072']
         : correct/total = [(9051, 14232), (9121, 14235), (8991, 14266), (9043, 14217), (9032, 14238), (9089, 14373), (9100, 14346), (9035, 14334), (8976, 14294), (9207, 14373), (9033, 14344), (9000, 14302), (9055, 14354), (9148, 14362), (8975, 14320), (9211, 14395), (9153, 14389), (8997, 14257), (8998, 14251), (9130, 14399)]
         : compromised: 0.6347, honest: 0.6333
Round 005: test acc mean=0.6397 ± 0.0049 | min=0.6319 max=0.6494
         : test loss mean=0.6326 ± 0.0027
         : individual accs = ['0.642285', '0.649385', '0.632974', '0.641626', '0.632322', '0.636749', '0.641503', '0.631924', '0.632013', '0.646907', '0.639710', '0.639980', '0.640449', '0.644200', '0.634707', '0.645224', '0.642991', '0.638634', '0.637429', '0.642128']
         : correct/total = [(9141, 14232), (9244, 14235), (9030, 14266), (9122, 14217), (9003, 14238), (9152, 14373), (9203, 14346), (9058, 14334), (9034, 14294), (9298, 14373), (9176, 14344), (9153, 14302), (9193, 14354), (9252, 14362), (9089, 14320), (9288, 14395), (9252, 14389), (9105, 14257), (9084, 14251), (9246, 14399)]
         : compromised: 0.6405, honest: 0.6396
Round 006: test acc mean=0.6430 ± 0.0051 | min=0.6335 max=0.6544
         : test loss mean=0.6294 ± 0.0032
         : individual accs = ['0.644744', '0.647418', '0.634165', '0.648730', '0.654446', '0.644472', '0.639481', '0.647482', '0.633483', '0.643498', '0.645984', '0.646413', '0.643235', '0.645244', '0.637709', '0.646058', '0.642157', '0.639756', '0.636096', '0.639975']
         : correct/total = [(9176, 14232), (9216, 14235), (9047, 14266), (9223, 14217), (9318, 14238), (9263, 14373), (9174, 14346), (9281, 14334), (9055, 14294), (9249, 14373), (9266, 14344), (9245, 14302), (9233, 14354), (9267, 14362), (9132, 14320), (9300, 14395), (9240, 14389), (9121, 14257), (9065, 14251), (9215, 14399)]
         : compromised: 0.6449, honest: 0.6428
Round 007: test acc mean=0.6491 ± 0.0059 | min=0.6352 max=0.6569
         : test loss mean=0.6234 ± 0.0050
         : individual accs = ['0.656689', '0.645522', '0.635217', '0.650841', '0.642295', '0.650108', '0.653423', '0.644551', '0.638939', '0.656857', '0.655117', '0.651657', '0.653128', '0.654923', '0.648953', '0.644043', '0.652026', '0.643473', '0.651393', '0.653726']
         : correct/total = [(9346, 14232), (9189, 14235), (9062, 14266), (9253, 14217), (9145, 14238), (9344, 14373), (9374, 14346), (9239, 14334), (9133, 14294), (9441, 14373), (9397, 14344), (9320, 14302), (9375, 14354), (9406, 14362), (9293, 14320), (9271, 14395), (9382, 14389), (9174, 14257), (9283, 14251), (9413, 14399)]
         : compromised: 0.6525, honest: 0.6488
Round 008: test acc mean=0.6568 ± 0.0036 | min=0.6497 max=0.6638
         : test loss mean=0.6172 ± 0.0025
         : individual accs = ['0.657743', '0.663786', '0.650848', '0.658367', '0.656202', '0.654074', '0.661160', '0.656969', '0.654470', '0.659640', '0.656651', '0.655503', '0.656402', '0.660006', '0.656145', '0.663286', '0.652095', '0.654135', '0.649709', '0.658101']
         : correct/total = [(9361, 14232), (9449, 14235), (9285, 14266), (9360, 14217), (9343, 14238), (9401, 14373), (9485, 14346), (9417, 14334), (9355, 14294), (9481, 14373), (9419, 14344), (9375, 14302), (9422, 14354), (9479, 14362), (9396, 14320), (9548, 14395), (9383, 14389), (9326, 14257), (9259, 14251), (9476, 14399)]
         : compromised: 0.6570, honest: 0.6567
Round 009: test acc mean=0.6593 ± 0.0051 | min=0.6467 max=0.6688
         : test loss mean=0.6137 ± 0.0037
         : individual accs = ['0.663505', '0.668844', '0.652110', '0.660829', '0.663155', '0.656161', '0.659208', '0.654667', '0.646705', '0.663466', '0.663204', '0.653265', '0.661000', '0.661468', '0.657682', '0.667385', '0.658489', '0.659185', '0.655533', '0.660463']
         : correct/total = [(9443, 14232), (9521, 14235), (9303, 14266), (9395, 14217), (9442, 14238), (9431, 14373), (9457, 14346), (9384, 14334), (9244, 14294), (9536, 14373), (9513, 14344), (9343, 14302), (9488, 14354), (9500, 14362), (9418, 14320), (9607, 14395), (9475, 14389), (9398, 14257), (9342, 14251), (9510, 14399)]
         : compromised: 0.6588, honest: 0.6594
Round 010: test acc mean=0.6653 ± 0.0035 | min=0.6600 max=0.6731
         : test loss mean=0.6081 ± 0.0029
         : individual accs = ['0.669477', '0.673130', '0.661152', '0.663290', '0.666456', '0.661796', '0.669037', '0.664434', '0.664405', '0.667710', '0.665435', '0.665781', '0.665320', '0.660632', '0.665014', '0.671066', '0.660018', '0.661359', '0.663953', '0.666921']
         : correct/total = [(9528, 14232), (9582, 14235), (9432, 14266), (9430, 14217), (9489, 14238), (9512, 14373), (9598, 14346), (9524, 14334), (9497, 14294), (9597, 14373), (9545, 14344), (9522, 14302), (9550, 14354), (9488, 14362), (9523, 14320), (9660, 14395), (9497, 14389), (9429, 14257), (9462, 14251), (9603, 14399)]
         : compromised: 0.6612, honest: 0.6658

=== FINAL RESULTS ===
Dataset: sent140, Nodes: 20, Graph: erdos, Aggregation: krum
Attack: backdoor, 10.0% compromised
Final accuracy - Compromised: 0.6612, Honest: 0.6658
Overall test accuracy: mean=0.6653 ± 0.0035

=== BACKDOOR ATTACK SUCCESS RATE (ASR) ===
Target label: 1
Trigger size: 3x3
Overall ASR: 0.4072 ± 0.0288
Honest nodes ASR: 0.4088 ± 0.0298
Compromised nodes ASR: 0.3935 ± 0.0084
Note: Higher ASR indicates more successful backdoor attack
