Device: cuda
Seed: 987654321
Loading 1 LEAF Sent140 train files...
LEAF Sent140 train: 254555 users, 908652 samples
Building vocabulary (max_size=10000)...
Vocabulary size: 10000
Loading 1 LEAF Sent140 test files...
LEAF Sent140 test: 254555 users, 286281 samples
Found 254555 train users, 254555 test users, 254555 common users
User sample counts range: 494 (max) to 1 (min)
Distributed ALL 254555 users across 20 clients
Users per client: 12727 (with 15 clients getting +1 user)
Train partition sizes: [44353, 44290, 44657, 44907, 44696, 45843, 45801, 45619, 45069, 45639, 45821, 45311, 45779, 46056, 45625, 45984, 46428, 44737, 45540, 46497]
Test partition sizes: [14232, 14235, 14266, 14217, 14238, 14373, 14346, 14334, 14294, 14373, 14344, 14302, 14354, 14362, 14320, 14395, 14389, 14257, 14251, 14399]
  Client 0: 44353 train samples, 2 unique classes
  Client 1: 44290 train samples, 2 unique classes
  Client 2: 44657 train samples, 2 unique classes
  Client 3: 44907 train samples, 2 unique classes
  Client 4: 44696 train samples, 2 unique classes
  Client 5: 45843 train samples, 2 unique classes
  Client 6: 45801 train samples, 2 unique classes
  Client 7: 45619 train samples, 2 unique classes
  Client 8: 45069 train samples, 2 unique classes
  Client 9: 45639 train samples, 2 unique classes
  Client 10: 45821 train samples, 2 unique classes
  Client 11: 45311 train samples, 2 unique classes
  Client 12: 45779 train samples, 2 unique classes
  Client 13: 46056 train samples, 2 unique classes
  Client 14: 45625 train samples, 2 unique classes
  Client 15: 45984 train samples, 2 unique classes
  Client 16: 46428 train samples, 2 unique classes
  Client 17: 44737 train samples, 2 unique classes
  Client 18: 45540 train samples, 2 unique classes
  Client 19: 46497 train samples, 2 unique classes
Will sample 4500 samples per client per epoch
Graph: fully, nodes: 20, edges: 190
Degree statistics: avg=19.00, min=19, max=19
Attack: Compromised 6/20 nodes: [5, 12, 13, 14, 17, 18]
Attack type: directed_deviation, lambda: 1.0
Model variant: baseline
Model parameters: 1,174,986
Initial test acc across nodes: mean=0.4965 ± 0.0152
Round 001: test acc mean=0.4975 ± 0.0069 | min=0.4868 max=0.5115
         : test loss mean=22.8941 ± 6.0390
         : individual accs = ['0.511453', '0.487601', '0.492780', '0.489977', '0.507164', '0.502400', '0.496584', '0.497837', '0.506296', '0.491268', '0.503904', '0.495525', '0.494566', '0.492411', '0.492877', '0.500590', '0.504413', '0.504454', '0.491965', '0.486839']
         : correct/total = [(7279, 14232), (6941, 14235), (7030, 14266), (6966, 14217), (7221, 14238), (7221, 14373), (7124, 14346), (7136, 14334), (7237, 14294), (7061, 14373), (7228, 14344), (7087, 14302), (7099, 14354), (7072, 14362), (7058, 14320), (7206, 14395), (7258, 14389), (7192, 14257), (7011, 14251), (7010, 14399)]
         : compromised: 0.4964, honest: 0.4980
Round 002: test acc mean=0.4982 ± 0.0045 | min=0.4899 max=0.5065
         : test loss mean=15.3005 ± 0.1704
         : individual accs = ['0.506043', '0.497436', '0.505187', '0.506506', '0.498946', '0.492451', '0.496794', '0.496512', '0.496222', '0.499339', '0.495538', '0.496084', '0.495472', '0.494360', '0.500349', '0.493574', '0.498992', '0.489935', '0.500667', '0.504410']
         : correct/total = [(7202, 14232), (7081, 14235), (7207, 14266), (7201, 14217), (7104, 14238), (7078, 14373), (7127, 14346), (7117, 14334), (7093, 14294), (7177, 14373), (7108, 14344), (7095, 14302), (7112, 14354), (7100, 14362), (7165, 14320), (7105, 14395), (7180, 14389), (6985, 14257), (7135, 14251), (7263, 14399)]
         : compromised: 0.4955, honest: 0.4994
Round 003: test acc mean=0.4969 ± 0.0059 | min=0.4864 max=0.5095
         : test loss mean=3.1698 ± 0.0382
         : individual accs = ['0.489601', '0.486407', '0.489275', '0.492228', '0.499017', '0.498156', '0.499094', '0.497140', '0.489716', '0.495791', '0.501046', '0.495036', '0.501533', '0.509469', '0.498045', '0.502883', '0.500521', '0.506628', '0.490001', '0.495590']
         : correct/total = [(6968, 14232), (6924, 14235), (6980, 14266), (6998, 14217), (7105, 14238), (7160, 14373), (7160, 14346), (7126, 14334), (7000, 14294), (7126, 14373), (7187, 14344), (7080, 14302), (7199, 14354), (7317, 14362), (7132, 14320), (7239, 14395), (7202, 14389), (7223, 14257), (6983, 14251), (7136, 14399)]
         : compromised: 0.5006, honest: 0.4952
Round 004: test acc mean=0.5093 ± 0.0040 | min=0.5031 max=0.5158
         : test loss mean=0.7353 ± 0.0027
         : individual accs = ['0.503162', '0.510502', '0.515351', '0.513962', '0.515803', '0.509706', '0.507946', '0.504953', '0.511194', '0.505044', '0.510388', '0.511397', '0.514073', '0.509121', '0.503142', '0.505523', '0.505386', '0.513642', '0.510490', '0.504341']
         : correct/total = [(7161, 14232), (7267, 14235), (7352, 14266), (7307, 14217), (7344, 14238), (7326, 14373), (7287, 14346), (7238, 14334), (7307, 14294), (7259, 14373), (7321, 14344), (7314, 14302), (7379, 14354), (7312, 14362), (7205, 14320), (7277, 14395), (7272, 14389), (7323, 14257), (7275, 14251), (7262, 14399)]
         : compromised: 0.5100, honest: 0.5089
Round 005: test acc mean=0.5099 ± 0.0041 | min=0.5031 max=0.5197
         : test loss mean=0.7163 ± 0.0022
         : individual accs = ['0.505410', '0.506287', '0.509393', '0.513329', '0.510535', '0.513184', '0.510595', '0.509418', '0.516091', '0.506784', '0.516453', '0.507062', '0.510241', '0.506754', '0.505796', '0.503091', '0.506290', '0.519745', '0.511192', '0.509758']
         : correct/total = [(7193, 14232), (7207, 14235), (7267, 14266), (7298, 14217), (7269, 14238), (7376, 14373), (7325, 14346), (7302, 14334), (7377, 14294), (7284, 14373), (7408, 14344), (7252, 14302), (7324, 14354), (7278, 14362), (7243, 14320), (7242, 14395), (7285, 14389), (7410, 14257), (7285, 14251), (7340, 14399)]
         : compromised: 0.5112, honest: 0.5093
Round 006: test acc mean=0.5125 ± 0.0041 | min=0.5065 max=0.5210
         : test loss mean=0.7077 ± 0.0019
         : individual accs = ['0.507870', '0.511486', '0.512197', '0.517338', '0.518963', '0.520977', '0.511153', '0.506697', '0.520148', '0.510610', '0.514222', '0.506503', '0.511077', '0.512742', '0.510684', '0.510941', '0.510876', '0.516097', '0.510771', '0.509202']
         : correct/total = [(7228, 14232), (7281, 14235), (7307, 14266), (7355, 14217), (7389, 14238), (7488, 14373), (7333, 14346), (7263, 14334), (7435, 14294), (7339, 14373), (7376, 14344), (7244, 14302), (7336, 14354), (7364, 14362), (7313, 14320), (7355, 14395), (7351, 14389), (7358, 14257), (7279, 14251), (7332, 14399)]
         : compromised: 0.5137, honest: 0.5120
Round 007: test acc mean=0.5185 ± 0.0046 | min=0.5122 max=0.5288
         : test loss mean=0.7035 ± 0.0018
         : individual accs = ['0.517496', '0.524903', '0.515561', '0.518323', '0.528796', '0.525569', '0.515754', '0.515069', '0.527774', '0.517985', '0.517987', '0.512236', '0.517765', '0.517894', '0.516690', '0.513303', '0.514143', '0.521989', '0.516595', '0.515036']
         : correct/total = [(7365, 14232), (7472, 14235), (7355, 14266), (7369, 14217), (7529, 14238), (7554, 14373), (7399, 14346), (7383, 14334), (7544, 14294), (7445, 14373), (7430, 14344), (7326, 14302), (7432, 14354), (7438, 14362), (7399, 14320), (7389, 14395), (7398, 14389), (7442, 14257), (7362, 14251), (7416, 14399)]
         : compromised: 0.5194, honest: 0.5182
Round 008: test acc mean=0.5184 ± 0.0045 | min=0.5117 max=0.5258
         : test loss mean=0.7004 ± 0.0017
         : individual accs = ['0.514685', '0.513031', '0.513459', '0.513751', '0.521422', '0.521951', '0.522166', '0.519743', '0.514622', '0.513602', '0.523285', '0.517830', '0.523338', '0.524718', '0.511732', '0.521848', '0.515185', '0.525847', '0.514139', '0.522189']
         : correct/total = [(7325, 14232), (7303, 14235), (7325, 14266), (7304, 14217), (7424, 14238), (7502, 14373), (7491, 14346), (7450, 14334), (7356, 14294), (7382, 14373), (7506, 14344), (7406, 14302), (7512, 14354), (7536, 14362), (7328, 14320), (7512, 14395), (7413, 14389), (7497, 14257), (7327, 14251), (7519, 14399)]
         : compromised: 0.5203, honest: 0.5176
Round 009: test acc mean=0.5146 ± 0.0042 | min=0.5067 max=0.5225
         : test loss mean=0.7009 ± 0.0017
         : individual accs = ['0.517074', '0.519986', '0.513388', '0.520082', '0.521000', '0.520142', '0.514359', '0.513185', '0.522457', '0.513463', '0.512619', '0.514264', '0.513237', '0.507102', '0.512151', '0.511428', '0.506707', '0.512520', '0.512876', '0.513855']
         : correct/total = [(7359, 14232), (7402, 14235), (7324, 14266), (7394, 14217), (7418, 14238), (7476, 14373), (7379, 14346), (7356, 14334), (7468, 14294), (7380, 14373), (7353, 14344), (7355, 14302), (7367, 14354), (7283, 14362), (7334, 14320), (7362, 14395), (7291, 14389), (7307, 14257), (7309, 14251), (7399, 14399)]
         : compromised: 0.5130, honest: 0.5153
Round 010: test acc mean=0.5272 ± 0.0044 | min=0.5184 max=0.5356
         : test loss mean=0.6954 ± 0.0013
         : individual accs = ['0.527895', '0.534176', '0.521099', '0.529788', '0.535609', '0.529326', '0.533041', '0.527208', '0.530712', '0.523134', '0.528444', '0.526989', '0.525219', '0.527782', '0.518366', '0.524001', '0.522899', '0.530476', '0.522841', '0.524411']
         : correct/total = [(7513, 14232), (7604, 14235), (7434, 14266), (7532, 14217), (7626, 14238), (7608, 14373), (7647, 14346), (7557, 14334), (7586, 14294), (7519, 14373), (7580, 14344), (7537, 14302), (7539, 14354), (7580, 14362), (7423, 14320), (7543, 14395), (7524, 14389), (7563, 14257), (7451, 14251), (7551, 14399)]
         : compromised: 0.5257, honest: 0.5278

=== FINAL RESULTS ===
Dataset: sent140, Nodes: 20, Graph: fully, Aggregation: krum
Attack: directed_deviation, 30.0% compromised
Final accuracy - Compromised: 0.5257, Honest: 0.5278
Overall test accuracy: mean=0.5272 ± 0.0044
