Device: cuda
Seed: 987654321
Loading 1 LEAF Sent140 train files...
LEAF Sent140 train: 254555 users, 908652 samples
Building vocabulary (max_size=10000)...
Vocabulary size: 10000
Loading 1 LEAF Sent140 test files...
LEAF Sent140 test: 254555 users, 286281 samples
Found 254555 train users, 254555 test users, 254555 common users
User sample counts range: 494 (max) to 1 (min)
Distributed ALL 254555 users across 20 clients
Users per client: 12727 (with 15 clients getting +1 user)
Train partition sizes: [44353, 44290, 44657, 44907, 44696, 45843, 45801, 45619, 45069, 45639, 45821, 45311, 45779, 46056, 45625, 45984, 46428, 44737, 45540, 46497]
Test partition sizes: [14232, 14235, 14266, 14217, 14238, 14373, 14346, 14334, 14294, 14373, 14344, 14302, 14354, 14362, 14320, 14395, 14389, 14257, 14251, 14399]
  Client 0: 44353 train samples, 2 unique classes
  Client 1: 44290 train samples, 2 unique classes
  Client 2: 44657 train samples, 2 unique classes
  Client 3: 44907 train samples, 2 unique classes
  Client 4: 44696 train samples, 2 unique classes
  Client 5: 45843 train samples, 2 unique classes
  Client 6: 45801 train samples, 2 unique classes
  Client 7: 45619 train samples, 2 unique classes
  Client 8: 45069 train samples, 2 unique classes
  Client 9: 45639 train samples, 2 unique classes
  Client 10: 45821 train samples, 2 unique classes
  Client 11: 45311 train samples, 2 unique classes
  Client 12: 45779 train samples, 2 unique classes
  Client 13: 46056 train samples, 2 unique classes
  Client 14: 45625 train samples, 2 unique classes
  Client 15: 45984 train samples, 2 unique classes
  Client 16: 46428 train samples, 2 unique classes
  Client 17: 44737 train samples, 2 unique classes
  Client 18: 45540 train samples, 2 unique classes
  Client 19: 46497 train samples, 2 unique classes
Will sample 4500 samples per client per epoch
Graph: fully, nodes: 20, edges: 190
Degree statistics: avg=19.00, min=19, max=19
Attack: Compromised 6/20 nodes: [5, 12, 13, 14, 17, 18]
Attack type: backdoor, lambda: 1.0
Backdoor target label: 1, trigger size: 3
Model variant: baseline
Model parameters: 1,174,986
Initial test acc across nodes: mean=0.4953 ± 0.0174
Backdoor attack: Created poisoned datasets for 6 compromised nodes
Round 001: test acc mean=0.4963 ± 0.0066 | min=0.4842 max=0.5101
         : test loss mean=2.1358 ± 0.6956
         : individual accs = ['0.508994', '0.484159', '0.496004', '0.488781', '0.492906', '0.492869', '0.492681', '0.510116', '0.499720', '0.497391', '0.498675', '0.503007', '0.496726', '0.492132', '0.500070', '0.502327', '0.487317', '0.497791', '0.488597', '0.495451']
         : correct/total = [(7244, 14232), (6892, 14235), (7076, 14266), (6949, 14217), (7018, 14238), (7084, 14373), (7068, 14346), (7312, 14334), (7143, 14294), (7149, 14373), (7153, 14344), (7194, 14302), (7130, 14354), (7068, 14362), (7161, 14320), (7231, 14395), (7012, 14389), (7097, 14257), (6963, 14251), (7134, 14399)]
         : compromised: 0.4947, honest: 0.4970
Round 002: test acc mean=0.5063 ± 0.0051 | min=0.4992 max=0.5165
         : test loss mean=2.4827 ± 0.0364
         : individual accs = ['0.506183', '0.516473', '0.505187', '0.515088', '0.507585', '0.512071', '0.501046', '0.500698', '0.508885', '0.503722', '0.505926', '0.499580', '0.504319', '0.499443', '0.513897', '0.499201', '0.508374', '0.507680', '0.507052', '0.502882']
         : correct/total = [(7204, 14232), (7352, 14235), (7207, 14266), (7323, 14217), (7227, 14238), (7360, 14373), (7188, 14346), (7177, 14334), (7274, 14294), (7240, 14373), (7257, 14344), (7145, 14302), (7239, 14354), (7173, 14362), (7359, 14320), (7186, 14395), (7315, 14389), (7238, 14257), (7226, 14251), (7241, 14399)]
         : compromised: 0.5074, honest: 0.5058
Round 003: test acc mean=0.4953 ± 0.0051 | min=0.4856 max=0.5062
         : test loss mean=0.8916 ± 0.0095
         : individual accs = ['0.485596', '0.492167', '0.492640', '0.494408', '0.491010', '0.485633', '0.500279', '0.497488', '0.492095', '0.506227', '0.495468', '0.492379', '0.494775', '0.499791', '0.499791', '0.502188', '0.494475', '0.498492', '0.491264', '0.499479']
         : correct/total = [(6911, 14232), (7006, 14235), (7028, 14266), (7029, 14217), (6991, 14238), (6980, 14373), (7177, 14346), (7131, 14334), (7034, 14294), (7276, 14373), (7107, 14344), (7042, 14302), (7102, 14354), (7178, 14362), (7157, 14320), (7229, 14395), (7115, 14389), (7107, 14257), (7001, 14251), (7192, 14399)]
         : compromised: 0.4950, honest: 0.4954
Round 004: test acc mean=0.4968 ± 0.0057 | min=0.4838 max=0.5073
         : test loss mean=1.9950 ± 0.0242
         : individual accs = ['0.495152', '0.483808', '0.490467', '0.486671', '0.497261', '0.498991', '0.503485', '0.496512', '0.497062', '0.496278', '0.497211', '0.493148', '0.505434', '0.507311', '0.496858', '0.498715', '0.492529', '0.498211', '0.496597', '0.505035']
         : correct/total = [(7047, 14232), (6887, 14235), (6997, 14266), (6919, 14217), (7080, 14238), (7172, 14373), (7223, 14346), (7117, 14334), (7105, 14294), (7133, 14373), (7132, 14344), (7053, 14302), (7255, 14354), (7286, 14362), (7115, 14320), (7179, 14395), (7087, 14389), (7103, 14257), (7077, 14251), (7272, 14399)]
         : compromised: 0.5006, honest: 0.4952
Round 005: test acc mean=0.4998 ± 0.0048 | min=0.4910 max=0.5083
         : test loss mean=1.5414 ± 0.0364
         : individual accs = ['0.501265', '0.508254', '0.506239', '0.503060', '0.498666', '0.497669', '0.503904', '0.500349', '0.498741', '0.496556', '0.495190', '0.500559', '0.491013', '0.491923', '0.502933', '0.497673', '0.506985', '0.491758', '0.501649', '0.501493']
         : correct/total = [(7134, 14232), (7235, 14235), (7222, 14266), (7152, 14217), (7100, 14238), (7153, 14373), (7229, 14346), (7172, 14334), (7129, 14294), (7137, 14373), (7103, 14344), (7159, 14302), (7048, 14354), (7065, 14362), (7202, 14320), (7164, 14395), (7295, 14389), (7011, 14257), (7149, 14251), (7221, 14399)]
         : compromised: 0.4962, honest: 0.5014
Round 006: test acc mean=0.5115 ± 0.0054 | min=0.5029 max=0.5254
         : test loss mean=1.9074 ± 0.0251
         : individual accs = ['0.515739', '0.525395', '0.518716', '0.520996', '0.509833', '0.510193', '0.504810', '0.512418', '0.507486', '0.512002', '0.509412', '0.511886', '0.505295', '0.502924', '0.512360', '0.508788', '0.512961', '0.511187', '0.512666', '0.505452']
         : correct/total = [(7340, 14232), (7479, 14235), (7400, 14266), (7407, 14217), (7259, 14238), (7333, 14373), (7242, 14346), (7345, 14334), (7254, 14294), (7359, 14373), (7307, 14344), (7321, 14302), (7253, 14354), (7223, 14362), (7337, 14320), (7324, 14395), (7381, 14389), (7288, 14257), (7306, 14251), (7278, 14399)]
         : compromised: 0.5091, honest: 0.5126
Round 007: test acc mean=0.4952 ± 0.0052 | min=0.4844 max=0.5060
         : test loss mean=0.8074 ± 0.0072
         : individual accs = ['0.493817', '0.484440', '0.488154', '0.484842', '0.493328', '0.496347', '0.501115', '0.492675', '0.499230', '0.495721', '0.497142', '0.492798', '0.501533', '0.505988', '0.494064', '0.498784', '0.493293', '0.494845', '0.496456', '0.499410']
         : correct/total = [(7028, 14232), (6896, 14235), (6964, 14266), (6893, 14217), (7024, 14238), (7134, 14373), (7189, 14346), (7062, 14334), (7136, 14294), (7125, 14373), (7131, 14344), (7048, 14302), (7199, 14354), (7267, 14362), (7075, 14320), (7180, 14395), (7098, 14389), (7055, 14257), (7075, 14251), (7191, 14399)]
         : compromised: 0.4982, honest: 0.4939
Round 008: test acc mean=0.5135 ± 0.0041 | min=0.5063 max=0.5234
         : test loss mean=0.7016 ± 0.0015
         : individual accs = ['0.517004', '0.523428', '0.513318', '0.515299', '0.508920', '0.508662', '0.514778', '0.506279', '0.508115', '0.517289', '0.510178', '0.515173', '0.516581', '0.514065', '0.516899', '0.514484', '0.512127', '0.516588', '0.512806', '0.507119']
         : correct/total = [(7358, 14232), (7451, 14235), (7323, 14266), (7326, 14217), (7246, 14238), (7311, 14373), (7385, 14346), (7257, 14334), (7263, 14294), (7435, 14373), (7318, 14344), (7368, 14302), (7415, 14354), (7383, 14362), (7402, 14320), (7406, 14395), (7369, 14389), (7365, 14257), (7308, 14251), (7302, 14399)]
         : compromised: 0.5143, honest: 0.5131
Round 009: test acc mean=0.4959 ± 0.0056 | min=0.4836 max=0.5078
         : test loss mean=0.7309 ± 0.0037
         : individual accs = ['0.493325', '0.483597', '0.488714', '0.484631', '0.496839', '0.497252', '0.501673', '0.494140', '0.498951', '0.496139', '0.499024', '0.494476', '0.503344', '0.507798', '0.493017', '0.498090', '0.494544', '0.496318', '0.497088', '0.499687']
         : correct/total = [(7021, 14232), (6884, 14235), (6972, 14266), (6890, 14217), (7074, 14238), (7147, 14373), (7197, 14346), (7083, 14334), (7132, 14294), (7131, 14373), (7158, 14344), (7072, 14302), (7225, 14354), (7293, 14362), (7060, 14320), (7170, 14395), (7116, 14389), (7076, 14257), (7084, 14251), (7195, 14399)]
         : compromised: 0.4991, honest: 0.4946
Round 010: test acc mean=0.4949 ± 0.0055 | min=0.4830 max=0.5068
         : test loss mean=1.2850 ± 0.0133
         : individual accs = ['0.492622', '0.483035', '0.487032', '0.484912', '0.494522', '0.495860', '0.499791', '0.492745', '0.498181', '0.495234', '0.498397', '0.493847', '0.502856', '0.506824', '0.492598', '0.497742', '0.492529', '0.495336', '0.495614', '0.498090']
         : correct/total = [(7011, 14232), (6876, 14235), (6948, 14266), (6894, 14217), (7041, 14238), (7127, 14373), (7170, 14346), (7063, 14334), (7121, 14294), (7118, 14373), (7149, 14344), (7063, 14302), (7218, 14354), (7279, 14362), (7054, 14320), (7165, 14395), (7087, 14389), (7062, 14257), (7063, 14251), (7172, 14399)]
         : compromised: 0.4982, honest: 0.4935

=== FINAL RESULTS ===
Dataset: sent140, Nodes: 20, Graph: fully, Aggregation: d-fedavg
Attack: backdoor, 30.0% compromised
Final accuracy - Compromised: 0.4982, Honest: 0.4935
Overall test accuracy: mean=0.4949 ± 0.0055

=== BACKDOOR ATTACK SUCCESS RATE (ASR) ===
Target label: 1
Trigger size: 3x3
Overall ASR: 1.0000 ± 0.0000
Honest nodes ASR: 1.0000 ± 0.0000
Compromised nodes ASR: 1.0000 ± 0.0000
Note: Higher ASR indicates more successful backdoor attack
