Device: cuda
Seed: 987654321
Loading 1 LEAF Sent140 train files...
LEAF Sent140 train: 254555 users, 908652 samples
Building vocabulary (max_size=10000)...
Vocabulary size: 10000
Loading 1 LEAF Sent140 test files...
LEAF Sent140 test: 254555 users, 286281 samples
Found 254555 train users, 254555 test users, 254555 common users
User sample counts range: 494 (max) to 1 (min)
Distributed ALL 254555 users across 20 clients
Users per client: 12727 (with 15 clients getting +1 user)
Train partition sizes: [44353, 44290, 44657, 44907, 44696, 45843, 45801, 45619, 45069, 45639, 45821, 45311, 45779, 46056, 45625, 45984, 46428, 44737, 45540, 46497]
Test partition sizes: [14232, 14235, 14266, 14217, 14238, 14373, 14346, 14334, 14294, 14373, 14344, 14302, 14354, 14362, 14320, 14395, 14389, 14257, 14251, 14399]
  Client 0: 44353 train samples, 2 unique classes
  Client 1: 44290 train samples, 2 unique classes
  Client 2: 44657 train samples, 2 unique classes
  Client 3: 44907 train samples, 2 unique classes
  Client 4: 44696 train samples, 2 unique classes
  Client 5: 45843 train samples, 2 unique classes
  Client 6: 45801 train samples, 2 unique classes
  Client 7: 45619 train samples, 2 unique classes
  Client 8: 45069 train samples, 2 unique classes
  Client 9: 45639 train samples, 2 unique classes
  Client 10: 45821 train samples, 2 unique classes
  Client 11: 45311 train samples, 2 unique classes
  Client 12: 45779 train samples, 2 unique classes
  Client 13: 46056 train samples, 2 unique classes
  Client 14: 45625 train samples, 2 unique classes
  Client 15: 45984 train samples, 2 unique classes
  Client 16: 46428 train samples, 2 unique classes
  Client 17: 44737 train samples, 2 unique classes
  Client 18: 45540 train samples, 2 unique classes
  Client 19: 46497 train samples, 2 unique classes
Will sample 4500 samples per client per epoch
Graph: fully, nodes: 20, edges: 190
Degree statistics: avg=19.00, min=19, max=19
Attack: Compromised 12/20 nodes: [1, 2, 3, 5, 8, 11, 12, 13, 14, 15, 17, 18]
Attack type: directed_deviation, lambda: 1.0
Model variant: baseline
Model parameters: 1,174,986
Sketchguard Node 0:
  Model dim: 1,174,986 → Sketch size: 180
  Compression ratio: 6527.7x
  Using model parameters for aggregation, sketches for filtering
Sketchguard Node 1:
  Model dim: 1,174,986 → Sketch size: 180
  Compression ratio: 6527.7x
  Using model parameters for aggregation, sketches for filtering
Sketchguard Node 2:
  Model dim: 1,174,986 → Sketch size: 180
  Compression ratio: 6527.7x
  Using model parameters for aggregation, sketches for filtering
Sketchguard Node 3:
  Model dim: 1,174,986 → Sketch size: 180
  Compression ratio: 6527.7x
  Using model parameters for aggregation, sketches for filtering
Sketchguard Node 4:
  Model dim: 1,174,986 → Sketch size: 180
  Compression ratio: 6527.7x
  Using model parameters for aggregation, sketches for filtering
Sketchguard Node 5:
  Model dim: 1,174,986 → Sketch size: 180
  Compression ratio: 6527.7x
  Using model parameters for aggregation, sketches for filtering
Sketchguard Node 6:
  Model dim: 1,174,986 → Sketch size: 180
  Compression ratio: 6527.7x
  Using model parameters for aggregation, sketches for filtering
Sketchguard Node 7:
  Model dim: 1,174,986 → Sketch size: 180
  Compression ratio: 6527.7x
  Using model parameters for aggregation, sketches for filtering
Sketchguard Node 8:
  Model dim: 1,174,986 → Sketch size: 180
  Compression ratio: 6527.7x
  Using model parameters for aggregation, sketches for filtering
Sketchguard Node 9:
  Model dim: 1,174,986 → Sketch size: 180
  Compression ratio: 6527.7x
  Using model parameters for aggregation, sketches for filtering
Sketchguard Node 10:
  Model dim: 1,174,986 → Sketch size: 180
  Compression ratio: 6527.7x
  Using model parameters for aggregation, sketches for filtering
Sketchguard Node 11:
  Model dim: 1,174,986 → Sketch size: 180
  Compression ratio: 6527.7x
  Using model parameters for aggregation, sketches for filtering
Sketchguard Node 12:
  Model dim: 1,174,986 → Sketch size: 180
  Compression ratio: 6527.7x
  Using model parameters for aggregation, sketches for filtering
Sketchguard Node 13:
  Model dim: 1,174,986 → Sketch size: 180
  Compression ratio: 6527.7x
  Using model parameters for aggregation, sketches for filtering
Sketchguard Node 14:
  Model dim: 1,174,986 → Sketch size: 180
  Compression ratio: 6527.7x
  Using model parameters for aggregation, sketches for filtering
Sketchguard Node 15:
  Model dim: 1,174,986 → Sketch size: 180
  Compression ratio: 6527.7x
  Using model parameters for aggregation, sketches for filtering
Sketchguard Node 16:
  Model dim: 1,174,986 → Sketch size: 180
  Compression ratio: 6527.7x
  Using model parameters for aggregation, sketches for filtering
Sketchguard Node 17:
  Model dim: 1,174,986 → Sketch size: 180
  Compression ratio: 6527.7x
  Using model parameters for aggregation, sketches for filtering
Sketchguard Node 18:
  Model dim: 1,174,986 → Sketch size: 180
  Compression ratio: 6527.7x
  Using model parameters for aggregation, sketches for filtering
Sketchguard Node 19:
  Model dim: 1,174,986 → Sketch size: 180
  Compression ratio: 6527.7x
  Using model parameters for aggregation, sketches for filtering
Sketchguard ALGORITHM (Sketch-based Filtering + State Aggregation)
  - Model dimension: 1,174,986 parameters
  - Config: SketchguardConfig(gamma=2, kappa=1, alpha=0.5, min_neighbors=1, sketch_size=180, network_seed=987654321, attack_detection_window=5)
  - Sketch size: 180
  - Compression ratio: 6527.7x
  - Complexity: O(d + N×k) = O(1,174,986 + 20×180)
  - Theoretical speedup vs BALANCE: 19.9x
Initial test acc across nodes: mean=0.4965 ± 0.0152
Round 001: test acc mean=0.5034 ± 0.0102 | min=0.4780 max=0.5227
         : test loss mean=0.7243 ± 0.0237
         : individual accs = ['0.502740', '0.510854', '0.515772', '0.522684', '0.493890', '0.503931', '0.502300', '0.505023', '0.507066', '0.506366', '0.496514', '0.507621', '0.501672', '0.495962', '0.516899', '0.509205', '0.487386', '0.494213', '0.510631', '0.478019']
         : correct/total = [(7155, 14232), (7272, 14235), (7358, 14266), (7431, 14217), (7032, 14238), (7243, 14373), (7206, 14346), (7239, 14334), (7248, 14294), (7278, 14373), (7122, 14344), (7260, 14302), (7201, 14354), (7123, 14362), (7402, 14320), (7330, 14395), (7013, 14389), (7046, 14257), (7277, 14251), (6883, 14399)]
         : compromised: 0.5080, honest: 0.4965
         : sketchguard stats = ['Node 0: acc_rate=1.000', 'Node 1: acc_rate=1.000', 'Node 2: acc_rate=1.000']...
Round 002: test acc mean=0.5482 ± 0.0223 | min=0.5028 max=0.5837
         : test loss mean=0.7471 ± 0.1862
         : individual accs = ['0.566470', '0.543800', '0.532244', '0.502849', '0.564335', '0.519516', '0.568800', '0.583717', '0.525745', '0.571001', '0.578500', '0.552440', '0.510380', '0.543796', '0.574930', '0.533241', '0.557648', '0.544294', '0.540804', '0.549483']
         : correct/total = [(8062, 14232), (7741, 14235), (7593, 14266), (7149, 14217), (8035, 14238), (7467, 14373), (8160, 14346), (8367, 14334), (7515, 14294), (8207, 14373), (8298, 14344), (7901, 14302), (7326, 14354), (7810, 14362), (8233, 14320), (7676, 14395), (8024, 14389), (7760, 14257), (7707, 14251), (7912, 14399)]
         : compromised: 0.5353, honest: 0.5675
         : sketchguard stats = ['Node 0: acc_rate=0.684', 'Node 1: acc_rate=0.711', 'Node 2: acc_rate=0.711']...
Round 003: test acc mean=0.5875 ± 0.0239 | min=0.5137 max=0.6051
         : test loss mean=0.6700 ± 0.0084
         : individual accs = ['0.591062', '0.594029', '0.584957', '0.520504', '0.603034', '0.588256', '0.595358', '0.605135', '0.592836', '0.601197', '0.595998', '0.600615', '0.513724', '0.595808', '0.596089', '0.595901', '0.592119', '0.593393', '0.595116', '0.595111']
         : correct/total = [(8412, 14232), (8456, 14235), (8345, 14266), (7400, 14217), (8586, 14238), (8455, 14373), (8541, 14346), (8674, 14334), (8474, 14294), (8641, 14373), (8549, 14344), (8590, 14302), (7374, 14354), (8557, 14362), (8536, 14320), (8578, 14395), (8520, 14389), (8460, 14257), (8481, 14251), (8569, 14399)]
         : compromised: 0.5809, honest: 0.5974
         : sketchguard stats = ['Node 0: acc_rate=0.579', 'Node 1: acc_rate=0.614', 'Node 2: acc_rate=0.614']...
Round 004: test acc mean=0.5988 ± 0.0317 | min=0.5005 max=0.6153
         : test loss mean=0.6605 ± 0.0120
         : individual accs = ['0.605818', '0.605479', '0.606407', '0.507772', '0.612656', '0.610381', '0.608950', '0.615320', '0.609696', '0.612120', '0.610848', '0.610474', '0.500488', '0.609595', '0.607891', '0.607503', '0.602613', '0.608543', '0.610834', '0.612195']
         : correct/total = [(8622, 14232), (8619, 14235), (8651, 14266), (7219, 14217), (8723, 14238), (8773, 14373), (8736, 14346), (8820, 14334), (8715, 14294), (8798, 14373), (8762, 14344), (8731, 14302), (7184, 14354), (8755, 14362), (8705, 14320), (8745, 14395), (8671, 14389), (8676, 14257), (8705, 14251), (8815, 14399)]
         : compromised: 0.5913, honest: 0.6101
         : sketchguard stats = ['Node 0: acc_rate=0.526', 'Node 1: acc_rate=0.566', 'Node 2: acc_rate=0.566']...
Round 005: test acc mean=0.6128 ± 0.0067 | min=0.5896 max=0.6222
         : test loss mean=0.6548 ± 0.0071
         : individual accs = ['0.611228', '0.613628', '0.612996', '0.589576', '0.617573', '0.616434', '0.613411', '0.622157', '0.608927', '0.615947', '0.615519', '0.615858', '0.601992', '0.615235', '0.612709', '0.614102', '0.608868', '0.617661', '0.614343', '0.618376']
         : correct/total = [(8699, 14232), (8735, 14235), (8745, 14266), (8382, 14217), (8793, 14238), (8860, 14373), (8800, 14346), (8918, 14334), (8704, 14294), (8853, 14373), (8829, 14344), (8808, 14302), (8641, 14354), (8836, 14362), (8774, 14320), (8840, 14395), (8761, 14389), (8806, 14257), (8755, 14251), (8904, 14399)]
         : compromised: 0.6111, honest: 0.6154
         : sketchguard stats = ['Node 0: acc_rate=0.495', 'Node 1: acc_rate=0.537', 'Node 2: acc_rate=0.537']...
Round 006: test acc mean=0.6205 ± 0.0034 | min=0.6121 max=0.6262
         : test loss mean=0.6481 ± 0.0021
         : individual accs = ['0.617060', '0.626203', '0.618604', '0.620032', '0.620663', '0.622347', '0.620591', '0.624599', '0.615293', '0.624852', '0.624512', '0.623409', '0.621708', '0.622197', '0.618366', '0.617367', '0.612134', '0.620818', '0.618764', '0.619835']
         : correct/total = [(8782, 14232), (8914, 14235), (8825, 14266), (8815, 14217), (8837, 14238), (8945, 14373), (8903, 14346), (8953, 14334), (8795, 14294), (8981, 14373), (8958, 14344), (8916, 14302), (8924, 14354), (8936, 14362), (8855, 14320), (8887, 14395), (8808, 14389), (8851, 14257), (8818, 14251), (8925, 14399)]
         : compromised: 0.6204, honest: 0.6205
         : sketchguard stats = ['Node 0: acc_rate=0.474', 'Node 1: acc_rate=0.518', 'Node 2: acc_rate=0.518']...
Round 007: test acc mean=0.6255 ± 0.0029 | min=0.6181 max=0.6297
         : test loss mean=0.6434 ± 0.0017
         : individual accs = ['0.623946', '0.620162', '0.626314', '0.627840', '0.625720', '0.624991', '0.626446', '0.628924', '0.623199', '0.626939', '0.629462', '0.627535', '0.629650', '0.624913', '0.621718', '0.625495', '0.618111', '0.626149', '0.624939', '0.627335']
         : correct/total = [(8880, 14232), (8828, 14235), (8935, 14266), (8926, 14217), (8909, 14238), (8983, 14373), (8987, 14346), (9015, 14334), (8908, 14294), (9011, 14373), (9029, 14344), (8975, 14302), (9038, 14354), (8975, 14362), (8903, 14320), (9004, 14395), (8894, 14389), (8927, 14257), (8906, 14251), (9033, 14399)]
         : compromised: 0.6252, honest: 0.6259
         : sketchguard stats = ['Node 0: acc_rate=0.459', 'Node 1: acc_rate=0.504', 'Node 2: acc_rate=0.504']...
Round 008: test acc mean=0.6286 ± 0.0031 | min=0.6217 max=0.6339
         : test loss mean=0.6409 ± 0.0018
         : individual accs = ['0.626616', '0.623815', '0.629469', '0.628121', '0.626633', '0.623739', '0.631186', '0.631575', '0.628236', '0.631044', '0.633924', '0.627465', '0.633900', '0.627768', '0.626466', '0.631539', '0.621725', '0.629585', '0.628728', '0.629835']
         : correct/total = [(8918, 14232), (8880, 14235), (8980, 14266), (8930, 14217), (8922, 14238), (8965, 14373), (9055, 14346), (9053, 14334), (8980, 14294), (9070, 14373), (9093, 14344), (8974, 14302), (9099, 14354), (9016, 14362), (8971, 14320), (9091, 14395), (8946, 14389), (8976, 14257), (8960, 14251), (9069, 14399)]
         : compromised: 0.6282, honest: 0.6291
         : sketchguard stats = ['Node 0: acc_rate=0.447', 'Node 1: acc_rate=0.493', 'Node 2: acc_rate=0.493']...
Round 009: test acc mean=0.6332 ± 0.0021 | min=0.6267 max=0.6359
         : test loss mean=0.6371 ± 0.0016
         : individual accs = ['0.633572', '0.633860', '0.632273', '0.633889', '0.634710', '0.632505', '0.632999', '0.633877', '0.631874', '0.635636', '0.634621', '0.635855', '0.634736', '0.632851', '0.629050', '0.633137', '0.626729', '0.633303', '0.633359', '0.635669']
         : correct/total = [(9017, 14232), (9023, 14235), (9020, 14266), (9012, 14217), (9037, 14238), (9091, 14373), (9081, 14346), (9086, 14334), (9032, 14294), (9136, 14373), (9103, 14344), (9094, 14302), (9111, 14354), (9089, 14362), (9008, 14320), (9114, 14395), (9018, 14389), (9029, 14257), (9026, 14251), (9153, 14399)]
         : compromised: 0.6331, honest: 0.6335
         : sketchguard stats = ['Node 0: acc_rate=0.439', 'Node 1: acc_rate=0.485', 'Node 2: acc_rate=0.485']...
Round 010: test acc mean=0.6367 ± 0.0033 | min=0.6292 max=0.6420
         : test loss mean=0.6345 ± 0.0018
         : individual accs = ['0.635540', '0.636389', '0.634936', '0.641978', '0.639064', '0.635149', '0.635090', '0.638482', '0.634042', '0.638906', '0.639152', '0.639631', '0.641285', '0.634104', '0.631844', '0.640639', '0.629161', '0.633513', '0.634903', '0.639350']
         : correct/total = [(9045, 14232), (9059, 14235), (9058, 14266), (9127, 14217), (9099, 14238), (9129, 14373), (9111, 14346), (9152, 14334), (9063, 14294), (9183, 14373), (9168, 14344), (9148, 14302), (9205, 14354), (9107, 14362), (9048, 14320), (9222, 14395), (9053, 14389), (9032, 14257), (9048, 14251), (9206, 14399)]
         : compromised: 0.6365, honest: 0.6368
         : sketchguard stats = ['Node 0: acc_rate=0.432', 'Node 1: acc_rate=0.479', 'Node 2: acc_rate=0.479']...

=== FINAL RESULTS ===
Dataset: sent140, Nodes: 20, Graph: fully, Aggregation: sketchguard
Attack: directed_deviation, 60.0% compromised
Final accuracy - Compromised: 0.6365, Honest: 0.6368
Overall test accuracy: mean=0.6367 ± 0.0033

=== Sketchguard SUMMARY ===
Node 0: acceptance=0.432
Node 1: acceptance=0.479
Node 2: acceptance=0.479
Node 3: acceptance=0.537
Node 4: acceptance=0.432
Node 5: acceptance=0.479
Node 6: acceptance=0.432
Node 7: acceptance=0.432
Node 8: acceptance=0.479
Node 9: acceptance=0.432
Node 10: acceptance=0.432
Node 11: acceptance=0.479
Node 12: acceptance=0.537
Node 13: acceptance=0.479
Node 14: acceptance=0.479
Node 15: acceptance=0.479
Node 16: acceptance=0.432
Node 17: acceptance=0.479
Node 18: acceptance=0.479
Node 19: acceptance=0.432

=== PARALLEL EXECUTION TIME (realistic for distributed system) ===
  COMMUNICATION (max across nodes):
    - Sketch transfer: 0.000s (0.0%)
    - Model fetch (accepted): 0.000s (0.0%)
  COMPUTATION (max across nodes):
    - Sketching: 0.447s (94.6%)
    - Filtering: 0.001s (0.3%)
    - Aggregation: 0.024s (5.1%)
  TOTALS:
    - Total computation: 0.473s (100.0%)
    - Total communication: 0.000s (0.0%)
    - Total parallel time: 0.473s

=== PER-NODE AVERAGE TIME ===
  - Sketching: 0.391s
  - Filtering: 0.001s
  - Aggregation: 0.017s
  - Sketch transfer: 0.000s
  - Model fetch: 0.000s
  - Total per node: 0.409s

=== TOTAL COMPUTATIONAL WORK (sum across all nodes) ===
  - Total sketching: 7.826s
  - Total filtering: 0.016s
  - Total aggregation: 0.345s
  - Total sketch transfer: 0.000s
  - Total model fetch: 0.000s
  - Grand total: 8.187s
  - Mean acceptance rate: 0.466

Sketchguard Algorithm Properties:
  - Original dimension: 1,174,986
  - Sketch size: 180
  - Compression ratio: 19.9x
  - Single repetition: No repetitions needed
  - Theoretical complexity: O(d + N×k)
  - Approach: Sketch filtering + state aggregation
