Device: cuda
Seed: 987654321
Loading 1 LEAF Sent140 train files...
LEAF Sent140 train: 254555 users, 908652 samples
Building vocabulary (max_size=10000)...
Vocabulary size: 10000
Loading 1 LEAF Sent140 test files...
LEAF Sent140 test: 254555 users, 286281 samples
Found 254555 train users, 254555 test users, 254555 common users
User sample counts range: 494 (max) to 1 (min)
Distributed ALL 254555 users across 20 clients
Users per client: 12727 (with 15 clients getting +1 user)
Train partition sizes: [44353, 44290, 44657, 44907, 44696, 45843, 45801, 45619, 45069, 45639, 45821, 45311, 45779, 46056, 45625, 45984, 46428, 44737, 45540, 46497]
Test partition sizes: [14232, 14235, 14266, 14217, 14238, 14373, 14346, 14334, 14294, 14373, 14344, 14302, 14354, 14362, 14320, 14395, 14389, 14257, 14251, 14399]
  Client 0: 44353 train samples, 2 unique classes
  Client 1: 44290 train samples, 2 unique classes
  Client 2: 44657 train samples, 2 unique classes
  Client 3: 44907 train samples, 2 unique classes
  Client 4: 44696 train samples, 2 unique classes
  Client 5: 45843 train samples, 2 unique classes
  Client 6: 45801 train samples, 2 unique classes
  Client 7: 45619 train samples, 2 unique classes
  Client 8: 45069 train samples, 2 unique classes
  Client 9: 45639 train samples, 2 unique classes
  Client 10: 45821 train samples, 2 unique classes
  Client 11: 45311 train samples, 2 unique classes
  Client 12: 45779 train samples, 2 unique classes
  Client 13: 46056 train samples, 2 unique classes
  Client 14: 45625 train samples, 2 unique classes
  Client 15: 45984 train samples, 2 unique classes
  Client 16: 46428 train samples, 2 unique classes
  Client 17: 44737 train samples, 2 unique classes
  Client 18: 45540 train samples, 2 unique classes
  Client 19: 46497 train samples, 2 unique classes
Will sample 4500 samples per client per epoch
Graph: ring, nodes: 20, edges: 20
Degree statistics: avg=2.00, min=2, max=2
Attack: Compromised 8/20 nodes: [1, 5, 11, 12, 13, 14, 17, 18]
Attack type: directed_deviation, lambda: 1.0
Model variant: baseline
Model parameters: 1,174,986
Initial test acc across nodes: mean=0.4965 ± 0.0152
Round 001: test acc mean=0.5041 ± 0.0098 | min=0.4860 max=0.5276
         : test loss mean=5.9516 ± 6.7841
         : individual accs = ['0.492411', '0.514787', '0.504276', '0.500035', '0.499438', '0.495512', '0.520912', '0.485977', '0.527564', '0.504905', '0.501603', '0.508390', '0.508778', '0.506058', '0.496299', '0.515457', '0.496212', '0.508452', '0.497018', '0.498437']
         : correct/total = [(7008, 14232), (7328, 14235), (7194, 14266), (7109, 14217), (7111, 14238), (7122, 14373), (7473, 14346), (6966, 14334), (7541, 14294), (7257, 14373), (7195, 14344), (7271, 14302), (7303, 14354), (7268, 14362), (7107, 14320), (7420, 14395), (7140, 14389), (7249, 14257), (7083, 14251), (7177, 14399)]
         : compromised: 0.5044, honest: 0.5039
Round 002: test acc mean=0.4998 ± 0.0088 | min=0.4846 max=0.5146
         : test loss mean=4.2414 ± 3.6524
         : individual accs = ['0.491076', '0.512540', '0.506659', '0.499191', '0.508217', '0.484589', '0.506204', '0.514581', '0.488457', '0.508036', '0.504671', '0.500979', '0.494914', '0.488790', '0.498534', '0.496839', '0.489402', '0.499404', '0.512315', '0.491423']
         : correct/total = [(6989, 14232), (7296, 14235), (7228, 14266), (7097, 14217), (7236, 14238), (6965, 14373), (7262, 14346), (7376, 14334), (6982, 14294), (7302, 14373), (7239, 14344), (7165, 14302), (7104, 14354), (7020, 14362), (7139, 14320), (7152, 14395), (7042, 14389), (7120, 14257), (7301, 14251), (7076, 14399)]
         : compromised: 0.4990, honest: 0.5004
Round 003: test acc mean=0.5037 ± 0.0126 | min=0.4809 max=0.5385
         : test loss mean=1.6267 ± 1.2455
         : individual accs = ['0.491287', '0.510502', '0.489275', '0.502075', '0.503793', '0.495999', '0.508504', '0.522464', '0.538478', '0.488068', '0.510876', '0.504055', '0.512819', '0.513995', '0.496439', '0.503439', '0.505873', '0.498211', '0.496386', '0.480936']
         : correct/total = [(6992, 14232), (7267, 14235), (6980, 14266), (7138, 14217), (7173, 14238), (7129, 14373), (7295, 14346), (7489, 14334), (7697, 14294), (7015, 14373), (7328, 14344), (7209, 14302), (7361, 14354), (7382, 14362), (7109, 14320), (7247, 14395), (7279, 14389), (7103, 14257), (7074, 14251), (6925, 14399)]
         : compromised: 0.5036, honest: 0.5038
Round 004: test acc mean=0.5085 ± 0.0174 | min=0.4930 max=0.5603
         : test loss mean=2.4202 ± 2.2715
         : individual accs = ['0.503513', '0.501019', '0.514510', '0.495815', '0.508077', '0.505810', '0.503346', '0.560346', '0.510914', '0.555069', '0.495817', '0.493707', '0.500209', '0.503969', '0.501187', '0.506843', '0.503579', '0.493021', '0.513438', '0.500521']
         : correct/total = [(7166, 14232), (7132, 14235), (7340, 14266), (7049, 14217), (7234, 14238), (7270, 14373), (7221, 14346), (8032, 14334), (7303, 14294), (7978, 14373), (7112, 14344), (7061, 14302), (7180, 14354), (7238, 14362), (7177, 14320), (7296, 14395), (7246, 14389), (7029, 14257), (7317, 14251), (7207, 14399)]
         : compromised: 0.5015, honest: 0.5132
Round 005: test acc mean=0.5090 ± 0.0147 | min=0.4903 max=0.5557
         : test loss mean=1.7975 ± 1.6179
         : individual accs = ['0.500984', '0.495118', '0.492780', '0.508265', '0.498244', '0.506088', '0.524815', '0.512278', '0.555688', '0.519585', '0.527956', '0.494826', '0.507245', '0.512672', '0.499162', '0.515248', '0.511224', '0.504173', '0.490281', '0.502743']
         : correct/total = [(7130, 14232), (7048, 14235), (7030, 14266), (7226, 14217), (7094, 14238), (7274, 14373), (7529, 14346), (7343, 14334), (7943, 14294), (7468, 14373), (7573, 14344), (7077, 14302), (7281, 14354), (7363, 14362), (7148, 14320), (7417, 14395), (7356, 14389), (7188, 14257), (6987, 14251), (7239, 14399)]
         : compromised: 0.5012, honest: 0.5142
Round 006: test acc mean=0.5114 ± 0.0176 | min=0.4944 max=0.5596
         : test loss mean=2.0992 ± 2.0154
         : individual accs = ['0.507870', '0.497928', '0.521870', '0.506014', '0.512080', '0.526821', '0.510316', '0.559579', '0.536309', '0.547067', '0.494702', '0.498741', '0.500627', '0.497354', '0.501606', '0.504828', '0.507818', '0.494424', '0.499404', '0.503299']
         : correct/total = [(7228, 14232), (7088, 14235), (7445, 14266), (7194, 14217), (7291, 14238), (7572, 14373), (7321, 14346), (8021, 14334), (7666, 14294), (7863, 14373), (7096, 14344), (7133, 14302), (7186, 14354), (7143, 14362), (7183, 14320), (7267, 14395), (7307, 14389), (7049, 14257), (7117, 14251), (7247, 14399)]
         : compromised: 0.5021, honest: 0.5176
Round 007: test acc mean=0.5144 ± 0.0208 | min=0.4878 max=0.5791
         : test loss mean=1.8157 ± 1.7282
         : individual accs = ['0.517566', '0.496101', '0.497336', '0.496096', '0.503582', '0.506227', '0.536386', '0.513046', '0.579054', '0.548111', '0.532627', '0.505524', '0.501881', '0.508077', '0.500838', '0.517402', '0.517687', '0.501368', '0.487825', '0.521008']
         : correct/total = [(7366, 14232), (7062, 14235), (7095, 14266), (7053, 14217), (7170, 14238), (7276, 14373), (7695, 14346), (7354, 14334), (8277, 14294), (7878, 14373), (7640, 14344), (7230, 14302), (7204, 14354), (7297, 14362), (7172, 14320), (7448, 14395), (7449, 14389), (7148, 14257), (6952, 14251), (7502, 14399)]
         : compromised: 0.5010, honest: 0.5233
Round 008: test acc mean=0.5156 ± 0.0215 | min=0.4944 max=0.5818
         : test loss mean=1.9953 ± 2.0005
         : individual accs = ['0.511523', '0.499473', '0.512968', '0.524302', '0.512642', '0.514437', '0.520633', '0.581833', '0.551490', '0.552981', '0.503555', '0.500559', '0.507036', '0.494430', '0.497696', '0.505106', '0.504691', '0.502911', '0.502070', '0.511077']
         : correct/total = [(7280, 14232), (7110, 14235), (7318, 14266), (7454, 14217), (7299, 14238), (7394, 14373), (7469, 14346), (8340, 14334), (7883, 14294), (7948, 14373), (7223, 14344), (7159, 14302), (7278, 14354), (7101, 14362), (7127, 14320), (7271, 14395), (7262, 14389), (7170, 14257), (7155, 14251), (7359, 14399)]
         : compromised: 0.5023, honest: 0.5244
Round 009: test acc mean=0.5167 ± 0.0247 | min=0.4904 max=0.5848
         : test loss mean=1.7693 ± 1.7250
         : individual accs = ['0.519182', '0.491956', '0.502313', '0.496096', '0.504074', '0.506227', '0.539175', '0.513116', '0.584791', '0.567105', '0.525864', '0.498532', '0.505852', '0.509261', '0.490433', '0.540188', '0.529641', '0.498492', '0.491264', '0.520870']
         : correct/total = [(7389, 14232), (7003, 14235), (7166, 14266), (7053, 14217), (7177, 14238), (7276, 14373), (7735, 14346), (7355, 14334), (8359, 14294), (8151, 14373), (7543, 14344), (7130, 14302), (7261, 14354), (7314, 14362), (7023, 14320), (7776, 14395), (7621, 14389), (7107, 14257), (7001, 14251), (7500, 14399)]
         : compromised: 0.4990, honest: 0.5285
Round 010: test acc mean=0.5191 ± 0.0253 | min=0.4967 max=0.5862
         : test loss mean=1.8917 ± 1.8812
         : individual accs = ['0.509978', '0.496733', '0.523132', '0.549975', '0.521141', '0.503583', '0.520006', '0.586229', '0.564922', '0.564183', '0.512479', '0.502168', '0.500697', '0.498677', '0.504330', '0.503369', '0.509000', '0.498282', '0.503614', '0.509897']
         : correct/total = [(7258, 14232), (7071, 14235), (7463, 14266), (7819, 14217), (7420, 14238), (7238, 14373), (7460, 14346), (8403, 14334), (8075, 14294), (8109, 14373), (7351, 14344), (7182, 14302), (7187, 14354), (7162, 14362), (7222, 14320), (7246, 14395), (7324, 14389), (7104, 14257), (7177, 14251), (7342, 14399)]
         : compromised: 0.5010, honest: 0.5312

=== FINAL RESULTS ===
Dataset: sent140, Nodes: 20, Graph: ring, Aggregation: krum
Attack: directed_deviation, 40.0% compromised
Final accuracy - Compromised: 0.5010, Honest: 0.5312
Overall test accuracy: mean=0.5191 ± 0.0253
