Device: cuda
Seed: 987654321
Loading 1 LEAF Sent140 train files...
LEAF Sent140 train: 254555 users, 908652 samples
Building vocabulary (max_size=10000)...
Vocabulary size: 10000
Loading 1 LEAF Sent140 test files...
LEAF Sent140 test: 254555 users, 286281 samples
Found 254555 train users, 254555 test users, 254555 common users
User sample counts range: 494 (max) to 1 (min)
Distributed ALL 254555 users across 20 clients
Users per client: 12727 (with 15 clients getting +1 user)
Train partition sizes: [44353, 44290, 44657, 44907, 44696, 45843, 45801, 45619, 45069, 45639, 45821, 45311, 45779, 46056, 45625, 45984, 46428, 44737, 45540, 46497]
Test partition sizes: [14232, 14235, 14266, 14217, 14238, 14373, 14346, 14334, 14294, 14373, 14344, 14302, 14354, 14362, 14320, 14395, 14389, 14257, 14251, 14399]
  Client 0: 44353 train samples, 2 unique classes
  Client 1: 44290 train samples, 2 unique classes
  Client 2: 44657 train samples, 2 unique classes
  Client 3: 44907 train samples, 2 unique classes
  Client 4: 44696 train samples, 2 unique classes
  Client 5: 45843 train samples, 2 unique classes
  Client 6: 45801 train samples, 2 unique classes
  Client 7: 45619 train samples, 2 unique classes
  Client 8: 45069 train samples, 2 unique classes
  Client 9: 45639 train samples, 2 unique classes
  Client 10: 45821 train samples, 2 unique classes
  Client 11: 45311 train samples, 2 unique classes
  Client 12: 45779 train samples, 2 unique classes
  Client 13: 46056 train samples, 2 unique classes
  Client 14: 45625 train samples, 2 unique classes
  Client 15: 45984 train samples, 2 unique classes
  Client 16: 46428 train samples, 2 unique classes
  Client 17: 44737 train samples, 2 unique classes
  Client 18: 45540 train samples, 2 unique classes
  Client 19: 46497 train samples, 2 unique classes
Will sample 4500 samples per client per epoch
Graph: fully, nodes: 20, edges: 190
Degree statistics: avg=19.00, min=19, max=19
Attack: Compromised 4/20 nodes: [5, 12, 13, 17]
Attack type: backdoor, lambda: 1.0
Backdoor target label: 1, trigger size: 3
Model variant: baseline
Model parameters: 1,174,986
Initial test acc across nodes: mean=0.4965 ± 0.0152
Backdoor attack: Created poisoned datasets for 4 compromised nodes
Round 001: test acc mean=0.4982 ± 0.0059 | min=0.4872 max=0.5089
         : test loss mean=23.2990 ± 8.4266
         : individual accs = ['0.508924', '0.488303', '0.487242', '0.493775', '0.495084', '0.499339', '0.499651', '0.503977', '0.495872', '0.501357', '0.500906', '0.494826', '0.499512', '0.497076', '0.491341', '0.502466', '0.490444', '0.504594', '0.503333', '0.506563']
         : correct/total = [(7243, 14232), (6951, 14235), (6951, 14266), (7020, 14217), (7049, 14238), (7177, 14373), (7168, 14346), (7224, 14334), (7088, 14294), (7206, 14373), (7185, 14344), (7077, 14302), (7170, 14354), (7139, 14362), (7036, 14320), (7233, 14395), (7057, 14389), (7194, 14257), (7173, 14251), (7294, 14399)]
         : compromised: 0.5001, honest: 0.4978
Round 002: test acc mean=0.5020 ± 0.0054 | min=0.4876 max=0.5124
         : test loss mean=42.0535 ± 0.4836
         : individual accs = ['0.507026', '0.511626', '0.512407', '0.503060', '0.497120', '0.503583', '0.500209', '0.500488', '0.505247', '0.503166', '0.500070', '0.504475', '0.499512', '0.487606', '0.501955', '0.500313', '0.499826', '0.497089', '0.507754', '0.497604']
         : correct/total = [(7216, 14232), (7283, 14235), (7310, 14266), (7152, 14217), (7078, 14238), (7238, 14373), (7176, 14346), (7174, 14334), (7222, 14294), (7232, 14373), (7173, 14344), (7215, 14302), (7170, 14354), (7003, 14362), (7188, 14320), (7202, 14395), (7192, 14389), (7087, 14257), (7236, 14251), (7165, 14399)]
         : compromised: 0.4969, honest: 0.5033
Round 003: test acc mean=0.5068 ± 0.0041 | min=0.4985 max=0.5149
         : test loss mean=3.9776 ± 0.0404
         : individual accs = ['0.504075', '0.501229', '0.507430', '0.507843', '0.512432', '0.508314', '0.498466', '0.514860', '0.505737', '0.500452', '0.508575', '0.505384', '0.510311', '0.510723', '0.505517', '0.512122', '0.503996', '0.505857', '0.508877', '0.503299']
         : correct/total = [(7174, 14232), (7135, 14235), (7239, 14266), (7220, 14217), (7296, 14238), (7306, 14373), (7151, 14346), (7380, 14334), (7229, 14294), (7193, 14373), (7295, 14344), (7228, 14302), (7325, 14354), (7335, 14362), (7239, 14320), (7372, 14395), (7252, 14389), (7212, 14257), (7252, 14251), (7247, 14399)]
         : compromised: 0.5088, honest: 0.5063
Round 004: test acc mean=0.5130 ± 0.0044 | min=0.5049 max=0.5228
         : test loss mean=2.1062 ± 0.0275
         : individual accs = ['0.508432', '0.511205', '0.514720', '0.512626', '0.515452', '0.511793', '0.515266', '0.518278', '0.507765', '0.512628', '0.511015', '0.512935', '0.504877', '0.522838', '0.513338', '0.519416', '0.507610', '0.510416', '0.518911', '0.509827']
         : correct/total = [(7236, 14232), (7277, 14235), (7343, 14266), (7288, 14217), (7339, 14238), (7356, 14373), (7392, 14346), (7429, 14334), (7258, 14294), (7368, 14373), (7330, 14344), (7336, 14302), (7247, 14354), (7509, 14362), (7351, 14320), (7477, 14395), (7304, 14389), (7277, 14257), (7395, 14251), (7341, 14399)]
         : compromised: 0.5125, honest: 0.5131
Round 005: test acc mean=0.5002 ± 0.0035 | min=0.4949 max=0.5058
         : test loss mean=1.4376 ± 0.0156
         : individual accs = ['0.504356', '0.496523', '0.503084', '0.505803', '0.505057', '0.502331', '0.498048', '0.502372', '0.500420', '0.503235', '0.502440', '0.501189', '0.494914', '0.495335', '0.499162', '0.497395', '0.496768', '0.495756', '0.504035', '0.496146']
         : correct/total = [(7178, 14232), (7068, 14235), (7177, 14266), (7191, 14217), (7191, 14238), (7220, 14373), (7145, 14346), (7201, 14334), (7153, 14294), (7233, 14373), (7207, 14344), (7168, 14302), (7104, 14354), (7114, 14362), (7148, 14320), (7160, 14395), (7148, 14389), (7068, 14257), (7183, 14251), (7144, 14399)]
         : compromised: 0.4971, honest: 0.5010
Round 006: test acc mean=0.5033 ± 0.0046 | min=0.4963 max=0.5136
         : test loss mean=1.0053 ± 0.0098
         : individual accs = ['0.501124', '0.504250', '0.509183', '0.497151', '0.513555', '0.510262', '0.501464', '0.506488', '0.502379', '0.501844', '0.502510', '0.507481', '0.497910', '0.497006', '0.504330', '0.501910', '0.496282', '0.502911', '0.507684', '0.499410']
         : correct/total = [(7132, 14232), (7178, 14235), (7264, 14266), (7068, 14217), (7312, 14238), (7334, 14373), (7194, 14346), (7260, 14334), (7181, 14294), (7213, 14373), (7208, 14344), (7258, 14302), (7147, 14354), (7138, 14362), (7222, 14320), (7225, 14395), (7141, 14389), (7170, 14257), (7235, 14251), (7191, 14399)]
         : compromised: 0.5020, honest: 0.5036
Round 007: test acc mean=0.5039 ± 0.0052 | min=0.4901 max=0.5160
         : test loss mean=0.8855 ± 0.0075
         : individual accs = ['0.507097', '0.506709', '0.515982', '0.506506', '0.503020', '0.508523', '0.504461', '0.500907', '0.504128', '0.503792', '0.502789', '0.506573', '0.497492', '0.490113', '0.505237', '0.502952', '0.496421', '0.500947', '0.509087', '0.504688']
         : correct/total = [(7217, 14232), (7213, 14235), (7361, 14266), (7201, 14217), (7162, 14238), (7309, 14373), (7237, 14346), (7180, 14334), (7206, 14294), (7241, 14373), (7212, 14344), (7245, 14302), (7141, 14354), (7039, 14362), (7235, 14320), (7240, 14395), (7143, 14389), (7142, 14257), (7255, 14251), (7267, 14399)]
         : compromised: 0.4993, honest: 0.5050
Round 008: test acc mean=0.5060 ± 0.0046 | min=0.4979 max=0.5149
         : test loss mean=0.7992 ± 0.0053
         : individual accs = ['0.510259', '0.505655', '0.514931', '0.509249', '0.511167', '0.510262', '0.507737', '0.502163', '0.505877', '0.497948', '0.501046', '0.510069', '0.505155', '0.500766', '0.508589', '0.498367', '0.500938', '0.504805', '0.510210', '0.504271']
         : correct/total = [(7262, 14232), (7198, 14235), (7346, 14266), (7240, 14217), (7278, 14238), (7334, 14373), (7284, 14346), (7198, 14334), (7231, 14294), (7157, 14373), (7187, 14344), (7295, 14302), (7251, 14354), (7192, 14362), (7283, 14320), (7174, 14395), (7208, 14389), (7197, 14257), (7271, 14251), (7261, 14399)]
         : compromised: 0.5052, honest: 0.5062
Round 009: test acc mean=0.5156 ± 0.0044 | min=0.5061 max=0.5233
         : test loss mean=0.7598 ± 0.0038
         : individual accs = ['0.511734', '0.512540', '0.513879', '0.514666', '0.523318', '0.520629', '0.509410', '0.513744', '0.519169', '0.515063', '0.520008', '0.517690', '0.520552', '0.514761', '0.521927', '0.514067', '0.506081', '0.512450', '0.519051', '0.512119']
         : correct/total = [(7283, 14232), (7296, 14235), (7331, 14266), (7317, 14217), (7451, 14238), (7483, 14373), (7308, 14346), (7364, 14334), (7421, 14294), (7403, 14373), (7459, 14344), (7404, 14302), (7472, 14354), (7393, 14362), (7474, 14320), (7400, 14395), (7282, 14389), (7306, 14257), (7397, 14251), (7374, 14399)]
         : compromised: 0.5171, honest: 0.5153
Round 010: test acc mean=0.5085 ± 0.0044 | min=0.5017 max=0.5180
         : test loss mean=0.7629 ± 0.0037
         : individual accs = ['0.504497', '0.505515', '0.501682', '0.503552', '0.510886', '0.513741', '0.507528', '0.506000', '0.501889', '0.507479', '0.511364', '0.511747', '0.511565', '0.518034', '0.511522', '0.509621', '0.508722', '0.509224', '0.501930', '0.513438']
         : correct/total = [(7180, 14232), (7196, 14235), (7157, 14266), (7159, 14217), (7274, 14238), (7384, 14373), (7281, 14346), (7253, 14334), (7174, 14294), (7294, 14373), (7335, 14344), (7319, 14302), (7343, 14354), (7440, 14362), (7325, 14320), (7336, 14395), (7320, 14389), (7260, 14257), (7153, 14251), (7393, 14399)]
         : compromised: 0.5131, honest: 0.5073

=== FINAL RESULTS ===
Dataset: sent140, Nodes: 20, Graph: fully, Aggregation: krum
Attack: backdoor, 20.0% compromised
Final accuracy - Compromised: 0.5131, Honest: 0.5073
Overall test accuracy: mean=0.5085 ± 0.0044

=== BACKDOOR ATTACK SUCCESS RATE (ASR) ===
Target label: 1
Trigger size: 3x3
Overall ASR: 0.4986 ± 0.0050
Honest nodes ASR: 0.4989 ± 0.0052
Compromised nodes ASR: 0.4970 ± 0.0037
Note: Higher ASR indicates more successful backdoor attack
