Device: cuda
Seed: 987654321
Loading 1 LEAF Sent140 train files...
LEAF Sent140 train: 254555 users, 908652 samples
Building vocabulary (max_size=10000)...
Vocabulary size: 10000
Loading 1 LEAF Sent140 test files...
LEAF Sent140 test: 254555 users, 286281 samples
Found 254555 train users, 254555 test users, 254555 common users
User sample counts range: 494 (max) to 1 (min)
Distributed ALL 254555 users across 20 clients
Users per client: 12727 (with 15 clients getting +1 user)
Train partition sizes: [44353, 44290, 44657, 44907, 44696, 45843, 45801, 45619, 45069, 45639, 45821, 45311, 45779, 46056, 45625, 45984, 46428, 44737, 45540, 46497]
Test partition sizes: [14232, 14235, 14266, 14217, 14238, 14373, 14346, 14334, 14294, 14373, 14344, 14302, 14354, 14362, 14320, 14395, 14389, 14257, 14251, 14399]
  Client 0: 44353 train samples, 2 unique classes
  Client 1: 44290 train samples, 2 unique classes
  Client 2: 44657 train samples, 2 unique classes
  Client 3: 44907 train samples, 2 unique classes
  Client 4: 44696 train samples, 2 unique classes
  Client 5: 45843 train samples, 2 unique classes
  Client 6: 45801 train samples, 2 unique classes
  Client 7: 45619 train samples, 2 unique classes
  Client 8: 45069 train samples, 2 unique classes
  Client 9: 45639 train samples, 2 unique classes
  Client 10: 45821 train samples, 2 unique classes
  Client 11: 45311 train samples, 2 unique classes
  Client 12: 45779 train samples, 2 unique classes
  Client 13: 46056 train samples, 2 unique classes
  Client 14: 45625 train samples, 2 unique classes
  Client 15: 45984 train samples, 2 unique classes
  Client 16: 46428 train samples, 2 unique classes
  Client 17: 44737 train samples, 2 unique classes
  Client 18: 45540 train samples, 2 unique classes
  Client 19: 46497 train samples, 2 unique classes
Will sample 4500 samples per client per epoch
Graph: erdos, nodes: 20, edges: 48
Degree statistics: avg=4.80, min=2, max=7
Attack: Compromised 10/20 nodes: [1, 2, 5, 11, 12, 13, 14, 15, 17, 18]
Attack type: gaussian, lambda: 1.0
Model variant: baseline
Model parameters: 1,174,986
BALANCE algorithm:
Balance Config: BALANCEConfig(gamma=2, kappa=1, alpha=0.5, min_neighbors=1)
  - Model dimension: 1,174,986 parameters
  - Complexity: O(N×d) = O(20×1,174,986)
Initial test acc across nodes: mean=0.4965 ± 0.0152
Round 001: test acc mean=0.5334 ± 0.0213 | min=0.4797 max=0.5705
         : test loss mean=0.6916 ± 0.0013
         : individual accs = ['0.553049', '0.531788', '0.522080', '0.516143', '0.563984', '0.535170', '0.532134', '0.570532', '0.533581', '0.526265', '0.503834', '0.529786', '0.567647', '0.547347', '0.529818', '0.543869', '0.545903', '0.515326', '0.520174', '0.479686']
         : correct/total = [(7871, 14232), (7570, 14235), (7448, 14266), (7338, 14217), (8030, 14238), (7692, 14373), (7634, 14346), (8178, 14334), (7627, 14294), (7564, 14373), (7227, 14344), (7577, 14302), (8148, 14354), (7861, 14362), (7587, 14320), (7829, 14395), (7855, 14389), (7347, 14257), (7413, 14251), (6907, 14399)]
         : compromised: 0.5343, honest: 0.5325
Round 002: test acc mean=0.5197 ± 0.0331 | min=0.4863 max=0.5978
         : test loss mean=0.6907 ± 0.0034
         : individual accs = ['0.511734', '0.486266', '0.486682', '0.492087', '0.597767', '0.560982', '0.497560', '0.568857', '0.546663', '0.495165', '0.505926', '0.492938', '0.499373', '0.524161', '0.561034', '0.498784', '0.564528', '0.503051', '0.488527', '0.512397']
         : correct/total = [(7283, 14232), (6922, 14235), (6943, 14266), (6996, 14217), (8511, 14238), (8063, 14373), (7138, 14346), (8154, 14334), (7814, 14294), (7117, 14373), (7257, 14344), (7050, 14302), (7168, 14354), (7528, 14362), (8034, 14320), (7180, 14395), (8123, 14389), (7172, 14257), (6962, 14251), (7378, 14399)]
         : compromised: 0.5102, honest: 0.5293
Round 003: test acc mean=0.5222 ± 0.0398 | min=0.4861 max=0.6200
         : test loss mean=0.6897 ± 0.0056
         : individual accs = ['0.495854', '0.486266', '0.486051', '0.492228', '0.620031', '0.570305', '0.497560', '0.601367', '0.540017', '0.492869', '0.515407', '0.492029', '0.499512', '0.509261', '0.579260', '0.498367', '0.545486', '0.503051', '0.488738', '0.531079']
         : correct/total = [(7057, 14232), (6922, 14235), (6934, 14266), (6998, 14217), (8828, 14238), (8197, 14373), (7138, 14346), (8620, 14334), (7719, 14294), (7084, 14373), (7393, 14344), (7037, 14302), (7170, 14354), (7314, 14362), (8295, 14320), (7174, 14395), (7849, 14389), (7172, 14257), (6965, 14251), (7647, 14399)]
         : compromised: 0.5113, honest: 0.5332
Round 004: test acc mean=0.5327 ± 0.0465 | min=0.4861 max=0.6204
         : test loss mean=0.6877 ± 0.0081
         : individual accs = ['0.515528', '0.486266', '0.486051', '0.492228', '0.620382', '0.607667', '0.497560', '0.610227', '0.566461', '0.493008', '0.570134', '0.492029', '0.499512', '0.508634', '0.563827', '0.498367', '0.571131', '0.503051', '0.488738', '0.582818']
         : correct/total = [(7337, 14232), (6922, 14235), (6934, 14266), (6998, 14217), (8833, 14238), (8734, 14373), (7138, 14346), (8747, 14334), (8097, 14294), (7086, 14373), (8178, 14344), (7037, 14302), (7170, 14354), (7305, 14362), (8074, 14320), (7174, 14395), (8218, 14389), (7172, 14257), (6965, 14251), (8392, 14399)]
         : compromised: 0.5134, honest: 0.5519
Round 005: test acc mean=0.5395 ± 0.0518 | min=0.4861 max=0.6290
         : test loss mean=0.6849 ± 0.0114
         : individual accs = ['0.515318', '0.486336', '0.486051', '0.492228', '0.629021', '0.621165', '0.497560', '0.615948', '0.559955', '0.493077', '0.602482', '0.492029', '0.499582', '0.509887', '0.586802', '0.498367', '0.576552', '0.535526', '0.490843', '0.601500']
         : correct/total = [(7334, 14232), (6923, 14235), (6934, 14266), (6998, 14217), (8956, 14238), (8928, 14373), (7138, 14346), (8829, 14334), (8004, 14294), (7087, 14373), (8642, 14344), (7037, 14302), (7171, 14354), (7323, 14362), (8403, 14320), (7174, 14395), (8296, 14389), (7635, 14257), (6995, 14251), (8661, 14399)]
         : compromised: 0.5207, honest: 0.5584
Round 006: test acc mean=0.5478 ± 0.0557 | min=0.4861 max=0.6340
         : test loss mean=0.6813 ± 0.0146
         : individual accs = ['0.525998', '0.495258', '0.486051', '0.493634', '0.634008', '0.624713', '0.498118', '0.624250', '0.576606', '0.496417', '0.619144', '0.491959', '0.508221', '0.508843', '0.582123', '0.498367', '0.568698', '0.613313', '0.495263', '0.614834']
         : correct/total = [(7486, 14232), (7050, 14235), (6934, 14266), (7018, 14217), (9027, 14238), (8979, 14373), (7146, 14346), (8948, 14334), (8242, 14294), (7135, 14373), (8881, 14344), (7036, 14302), (7295, 14354), (7308, 14362), (8336, 14320), (7174, 14395), (8183, 14389), (8744, 14257), (7058, 14251), (8853, 14399)]
         : compromised: 0.5304, honest: 0.5652
Round 007: test acc mean=0.5663 ± 0.0545 | min=0.4861 max=0.6370
         : test loss mean=0.6765 ± 0.0176
         : individual accs = ['0.582490', '0.522796', '0.486051', '0.497222', '0.637028', '0.632018', '0.515335', '0.628227', '0.595704', '0.510888', '0.623257', '0.491889', '0.541313', '0.512255', '0.592039', '0.613894', '0.593439', '0.621870', '0.504035', '0.624418']
         : correct/total = [(8290, 14232), (7442, 14235), (6934, 14266), (7069, 14217), (9070, 14238), (9084, 14373), (7393, 14346), (9005, 14334), (8515, 14294), (7343, 14373), (8940, 14344), (7035, 14302), (7770, 14354), (7357, 14362), (8478, 14320), (8837, 14395), (8539, 14389), (8866, 14257), (7183, 14251), (8991, 14399)]
         : compromised: 0.5518, honest: 0.5808
Round 008: test acc mean=0.5849 ± 0.0428 | min=0.5202 max=0.6390
         : test loss mean=0.6712 ± 0.0192
         : individual accs = ['0.575464', '0.552511', '0.614188', '0.526060', '0.638994', '0.632992', '0.528301', '0.629343', '0.592276', '0.539692', '0.628346', '0.531464', '0.577609', '0.520192', '0.597626', '0.633137', '0.591494', '0.628674', '0.529086', '0.631294']
         : correct/total = [(8190, 14232), (7865, 14235), (8762, 14266), (7479, 14217), (9098, 14238), (9098, 14373), (7579, 14346), (9021, 14334), (8466, 14294), (7757, 14373), (9013, 14344), (7601, 14302), (8291, 14354), (7471, 14362), (8558, 14320), (9114, 14395), (8511, 14389), (8963, 14257), (7540, 14251), (9090, 14399)]
         : compromised: 0.5817, honest: 0.5881
Round 009: test acc mean=0.6026 ± 0.0272 | min=0.5536 max=0.6410
         : test loss mean=0.6661 ± 0.0192
         : individual accs = ['0.586565', '0.595434', '0.625964', '0.574242', '0.640961', '0.636749', '0.580650', '0.628854', '0.584441', '0.568427', '0.633645', '0.553559', '0.597116', '0.578749', '0.593436', '0.636957', '0.594621', '0.631409', '0.575749', '0.634002']
         : correct/total = [(8348, 14232), (8476, 14235), (8930, 14266), (8164, 14217), (9126, 14238), (9152, 14373), (8330, 14346), (9014, 14334), (8354, 14294), (8170, 14373), (9089, 14344), (7917, 14302), (8571, 14354), (8312, 14362), (8498, 14320), (9169, 14395), (8556, 14389), (9002, 14257), (8205, 14251), (9129, 14399)]
         : compromised: 0.6025, honest: 0.6026
Round 010: test acc mean=0.6138 ± 0.0192 | min=0.5817 max=0.6467
         : test loss mean=0.6606 ± 0.0175
         : individual accs = ['0.600126', '0.605760', '0.631011', '0.598368', '0.646720', '0.636471', '0.592012', '0.635203', '0.602840', '0.598762', '0.640059', '0.581737', '0.605963', '0.597410', '0.605377', '0.632650', '0.602752', '0.630708', '0.595607', '0.636225']
         : correct/total = [(8541, 14232), (8623, 14235), (9002, 14266), (8507, 14217), (9208, 14238), (9148, 14373), (8493, 14346), (9105, 14334), (8617, 14294), (8606, 14373), (9181, 14344), (8320, 14302), (8698, 14354), (8580, 14362), (8669, 14320), (9107, 14395), (8673, 14389), (8992, 14257), (8488, 14251), (9161, 14399)]
         : compromised: 0.6123, honest: 0.6153

=== FINAL RESULTS ===
Dataset: sent140, Nodes: 20, Graph: erdos, Aggregation: balance
Attack: gaussian, 50.0% compromised
Final accuracy - Compromised: 0.6123, Honest: 0.6153
Overall test accuracy: mean=0.6138 ± 0.0192

=== BALANCE SUMMARY ===
Node 0: acceptance=0.667
Node 1: acceptance=0.383
Node 2: acceptance=0.320
Node 3: acceptance=0.500
Node 4: acceptance=0.250
Node 5: acceptance=0.200
Node 6: acceptance=0.400
Node 7: acceptance=0.400
Node 8: acceptance=0.500
Node 9: acceptance=0.667
Node 10: acceptance=0.500
Node 11: acceptance=0.343
Node 12: acceptance=0.471
Node 13: acceptance=0.250
Node 14: acceptance=0.143
Node 15: acceptance=0.250
Node 16: acceptance=0.200
Node 17: acceptance=0.480
Node 18: acceptance=0.400
Node 19: acceptance=0.500

=== PARALLEL EXECUTION TIME (realistic for distributed system) ===
  COMMUNICATION (max across nodes):
    - Full model transfer: 0.000s (0.0%)
  COMPUTATION (max across nodes):
    - Filtering: 0.037s (75.1%)
    - Aggregation: 0.012s (24.9%)
  TOTALS:
    - Total computation: 0.049s (100.0%)
    - Total communication: 0.000s (0.0%)
    - Total parallel time: 0.049s

=== PER-NODE AVERAGE TIME ===
  - Filtering: 0.023s
  - Aggregation: 0.005s
  - Model transfer: 0.000s
  - Total per node: 0.028s

=== TOTAL COMPUTATIONAL WORK (sum across all nodes) ===
  - Total filtering: 0.463s
  - Total aggregation: 0.104s
  - Total model transfer: 0.000s
  - Grand total: 0.567s
  - Mean acceptance rate: 0.391

BALANCE Algorithm Properties:
  - Model dimension: 1,174,986
  - No compression: Full parameter comparison
  - Theoretical complexity: O(deg(i)×d)
  - Approach: Full parameter filtering + averaging
