Device: cuda
Seed: 987654321
Loading 1 LEAF Sent140 train files...
LEAF Sent140 train: 254555 users, 908652 samples
Building vocabulary (max_size=10000)...
Vocabulary size: 10000
Loading 1 LEAF Sent140 test files...
LEAF Sent140 test: 254555 users, 286281 samples
Found 254555 train users, 254555 test users, 254555 common users
User sample counts range: 494 (max) to 1 (min)
Distributed ALL 254555 users across 20 clients
Users per client: 12727 (with 15 clients getting +1 user)
Train partition sizes: [44353, 44290, 44657, 44907, 44696, 45843, 45801, 45619, 45069, 45639, 45821, 45311, 45779, 46056, 45625, 45984, 46428, 44737, 45540, 46497]
Test partition sizes: [14232, 14235, 14266, 14217, 14238, 14373, 14346, 14334, 14294, 14373, 14344, 14302, 14354, 14362, 14320, 14395, 14389, 14257, 14251, 14399]
  Client 0: 44353 train samples, 2 unique classes
  Client 1: 44290 train samples, 2 unique classes
  Client 2: 44657 train samples, 2 unique classes
  Client 3: 44907 train samples, 2 unique classes
  Client 4: 44696 train samples, 2 unique classes
  Client 5: 45843 train samples, 2 unique classes
  Client 6: 45801 train samples, 2 unique classes
  Client 7: 45619 train samples, 2 unique classes
  Client 8: 45069 train samples, 2 unique classes
  Client 9: 45639 train samples, 2 unique classes
  Client 10: 45821 train samples, 2 unique classes
  Client 11: 45311 train samples, 2 unique classes
  Client 12: 45779 train samples, 2 unique classes
  Client 13: 46056 train samples, 2 unique classes
  Client 14: 45625 train samples, 2 unique classes
  Client 15: 45984 train samples, 2 unique classes
  Client 16: 46428 train samples, 2 unique classes
  Client 17: 44737 train samples, 2 unique classes
  Client 18: 45540 train samples, 2 unique classes
  Client 19: 46497 train samples, 2 unique classes
Will sample 4500 samples per client per epoch
Graph: erdos, nodes: 20, edges: 48
Degree statistics: avg=4.80, min=2, max=7
Attack: Compromised 12/20 nodes: [1, 2, 3, 5, 8, 11, 12, 13, 14, 15, 17, 18]
Attack type: gaussian, lambda: 1.0
Model variant: baseline
Model parameters: 1,174,986
Sketchguard Node 0:
  Model dim: 1,174,986 → Sketch size: 180
  Compression ratio: 6527.7x
  Using model parameters for aggregation, sketches for filtering
Sketchguard Node 1:
  Model dim: 1,174,986 → Sketch size: 180
  Compression ratio: 6527.7x
  Using model parameters for aggregation, sketches for filtering
Sketchguard Node 2:
  Model dim: 1,174,986 → Sketch size: 180
  Compression ratio: 6527.7x
  Using model parameters for aggregation, sketches for filtering
Sketchguard Node 3:
  Model dim: 1,174,986 → Sketch size: 180
  Compression ratio: 6527.7x
  Using model parameters for aggregation, sketches for filtering
Sketchguard Node 4:
  Model dim: 1,174,986 → Sketch size: 180
  Compression ratio: 6527.7x
  Using model parameters for aggregation, sketches for filtering
Sketchguard Node 5:
  Model dim: 1,174,986 → Sketch size: 180
  Compression ratio: 6527.7x
  Using model parameters for aggregation, sketches for filtering
Sketchguard Node 6:
  Model dim: 1,174,986 → Sketch size: 180
  Compression ratio: 6527.7x
  Using model parameters for aggregation, sketches for filtering
Sketchguard Node 7:
  Model dim: 1,174,986 → Sketch size: 180
  Compression ratio: 6527.7x
  Using model parameters for aggregation, sketches for filtering
Sketchguard Node 8:
  Model dim: 1,174,986 → Sketch size: 180
  Compression ratio: 6527.7x
  Using model parameters for aggregation, sketches for filtering
Sketchguard Node 9:
  Model dim: 1,174,986 → Sketch size: 180
  Compression ratio: 6527.7x
  Using model parameters for aggregation, sketches for filtering
Sketchguard Node 10:
  Model dim: 1,174,986 → Sketch size: 180
  Compression ratio: 6527.7x
  Using model parameters for aggregation, sketches for filtering
Sketchguard Node 11:
  Model dim: 1,174,986 → Sketch size: 180
  Compression ratio: 6527.7x
  Using model parameters for aggregation, sketches for filtering
Sketchguard Node 12:
  Model dim: 1,174,986 → Sketch size: 180
  Compression ratio: 6527.7x
  Using model parameters for aggregation, sketches for filtering
Sketchguard Node 13:
  Model dim: 1,174,986 → Sketch size: 180
  Compression ratio: 6527.7x
  Using model parameters for aggregation, sketches for filtering
Sketchguard Node 14:
  Model dim: 1,174,986 → Sketch size: 180
  Compression ratio: 6527.7x
  Using model parameters for aggregation, sketches for filtering
Sketchguard Node 15:
  Model dim: 1,174,986 → Sketch size: 180
  Compression ratio: 6527.7x
  Using model parameters for aggregation, sketches for filtering
Sketchguard Node 16:
  Model dim: 1,174,986 → Sketch size: 180
  Compression ratio: 6527.7x
  Using model parameters for aggregation, sketches for filtering
Sketchguard Node 17:
  Model dim: 1,174,986 → Sketch size: 180
  Compression ratio: 6527.7x
  Using model parameters for aggregation, sketches for filtering
Sketchguard Node 18:
  Model dim: 1,174,986 → Sketch size: 180
  Compression ratio: 6527.7x
  Using model parameters for aggregation, sketches for filtering
Sketchguard Node 19:
  Model dim: 1,174,986 → Sketch size: 180
  Compression ratio: 6527.7x
  Using model parameters for aggregation, sketches for filtering
Sketchguard ALGORITHM (Sketch-based Filtering + State Aggregation)
  - Model dimension: 1,174,986 parameters
  - Config: SketchguardConfig(gamma=2, kappa=1, alpha=0.5, min_neighbors=1, sketch_size=180, network_seed=987654321, attack_detection_window=5)
  - Sketch size: 180
  - Compression ratio: 6527.7x
  - Complexity: O(d + N×k) = O(1,174,986 + 20×180)
  - Theoretical speedup vs BALANCE: 19.9x
Initial test acc across nodes: mean=0.4965 ± 0.0152
Round 001: test acc mean=0.5275 ± 0.0248 | min=0.4797 max=0.5705
         : test loss mean=55.1819 ± 237.5163
         : individual accs = ['0.537732', '0.531788', '0.522080', '0.516143', '0.563984', '0.535170', '0.507040', '0.570532', '0.533581', '0.543589', '0.503834', '0.523074', '0.567647', '0.494778', '0.529818', '0.543869', '0.545903', '0.515326', '0.485369', '0.479686']
         : correct/total = [(7653, 14232), (7570, 14235), (7448, 14266), (7338, 14217), (8030, 14238), (7692, 14373), (7274, 14346), (8178, 14334), (7627, 14294), (7813, 14373), (7227, 14344), (7481, 14302), (8148, 14354), (7106, 14362), (7587, 14320), (7829, 14395), (7855, 14389), (7347, 14257), (6917, 14251), (6907, 14399)]
         : compromised: 0.5249, honest: 0.5315
         : sketchguard stats = ['Node 0: acc_rate=0.500', 'Node 1: acc_rate=0.500', 'Node 2: acc_rate=0.400']...
Round 002: test acc mean=0.5306 ± 0.0364 | min=0.4860 max=0.5999
         : test loss mean=19.4855 ± 81.9278
         : individual accs = ['0.544266', '0.485985', '0.486682', '0.492157', '0.599874', '0.560774', '0.527604', '0.571578', '0.540227', '0.576637', '0.503974', '0.500420', '0.499861', '0.494430', '0.565154', '0.499132', '0.561401', '0.503051', '0.587117', '0.512258']
         : correct/total = [(7746, 14232), (6918, 14235), (6943, 14266), (6997, 14217), (8541, 14238), (8060, 14373), (7569, 14346), (8193, 14334), (7722, 14294), (8288, 14373), (7229, 14344), (7157, 14302), (7175, 14354), (7101, 14362), (8093, 14320), (7185, 14395), (8078, 14389), (7172, 14257), (8367, 14251), (7376, 14399)]
         : compromised: 0.5179, honest: 0.5497
         : sketchguard stats = ['Node 0: acc_rate=0.500', 'Node 1: acc_rate=0.500', 'Node 2: acc_rate=0.400']...
Round 003: test acc mean=0.5405 ± 0.0433 | min=0.4861 max=0.6205
         : test loss mean=10.8646 ± 44.3623
         : individual accs = ['0.554033', '0.486477', '0.486051', '0.496800', '0.620452', '0.571071', '0.543218', '0.601646', '0.560235', '0.577750', '0.515407', '0.492029', '0.499512', '0.506615', '0.583170', '0.498367', '0.572799', '0.503051', '0.609641', '0.531634']
         : correct/total = [(7885, 14232), (6925, 14235), (6934, 14266), (7063, 14217), (8834, 14238), (8208, 14373), (7793, 14346), (8624, 14334), (8008, 14294), (8304, 14373), (7393, 14344), (7037, 14302), (7170, 14354), (7276, 14362), (8351, 14320), (7174, 14395), (8242, 14389), (7172, 14257), (8688, 14251), (7655, 14399)]
         : compromised: 0.5244, honest: 0.5646
         : sketchguard stats = ['Node 0: acc_rate=0.500', 'Node 1: acc_rate=0.444', 'Node 2: acc_rate=0.400']...
Round 004: test acc mean=0.5666 ± 0.0409 | min=0.4861 max=0.6198
         : test loss mean=16.2973 ± 68.0670
         : individual accs = ['0.589798', '0.528978', '0.486051', '0.557783', '0.619820', '0.608085', '0.579534', '0.609739', '0.593606', '0.600640', '0.568879', '0.492029', '0.539780', '0.496240', '0.578352', '0.553664', '0.594690', '0.533071', '0.618834', '0.581638']
         : correct/total = [(8394, 14232), (7530, 14235), (6934, 14266), (7930, 14217), (8825, 14238), (8740, 14373), (8314, 14346), (8740, 14334), (8485, 14294), (8633, 14373), (8160, 14344), (7037, 14302), (7748, 14354), (7127, 14362), (8282, 14320), (7970, 14395), (8557, 14389), (7600, 14257), (8819, 14251), (8375, 14399)]
         : compromised: 0.5489, honest: 0.5931
         : sketchguard stats = ['Node 0: acc_rate=0.500', 'Node 1: acc_rate=0.417', 'Node 2: acc_rate=0.400']...
Round 005: test acc mean=0.5880 ± 0.0437 | min=0.4834 max=0.6293
         : test loss mean=21.3723 ± 90.2246
         : individual accs = ['0.601321', '0.598103', '0.486051', '0.596750', '0.629302', '0.621165', '0.599052', '0.616367', '0.599552', '0.603075', '0.602830', '0.492029', '0.585899', '0.483428', '0.597905', '0.619660', '0.603239', '0.598303', '0.624868', '0.600389']
         : correct/total = [(8558, 14232), (8514, 14235), (6934, 14266), (8484, 14217), (8960, 14238), (8928, 14373), (8594, 14346), (8835, 14334), (8570, 14294), (8668, 14373), (8647, 14344), (7037, 14302), (8410, 14354), (6943, 14362), (8562, 14320), (8920, 14395), (8680, 14389), (8530, 14257), (8905, 14251), (8645, 14399)]
         : compromised: 0.5753, honest: 0.6069
         : sketchguard stats = ['Node 0: acc_rate=0.500', 'Node 1: acc_rate=0.400', 'Node 2: acc_rate=0.400']...
Round 006: test acc mean=0.5982 ± 0.0453 | min=0.4861 max=0.6339
         : test loss mean=14.0157 ± 58.2035
         : individual accs = ['0.610596', '0.612645', '0.486051', '0.606668', '0.633867', '0.625339', '0.610972', '0.623273', '0.613264', '0.616921', '0.619144', '0.492029', '0.616901', '0.497772', '0.600349', '0.622091', '0.612621', '0.617802', '0.629500', '0.615251']
         : correct/total = [(8690, 14232), (8721, 14235), (6934, 14266), (8625, 14217), (9025, 14238), (8988, 14373), (8765, 14346), (8934, 14334), (8766, 14294), (8867, 14373), (8881, 14344), (7037, 14302), (8855, 14354), (7149, 14362), (8597, 14320), (8955, 14395), (8815, 14389), (8808, 14257), (8971, 14251), (8859, 14399)]
         : compromised: 0.5850, honest: 0.6178
         : sketchguard stats = ['Node 0: acc_rate=0.500', 'Node 1: acc_rate=0.389', 'Node 2: acc_rate=0.400']...
Round 007: test acc mean=0.6169 ± 0.0263 | min=0.5160 max=0.6364
         : test loss mean=74.7926 ± 323.1677
         : individual accs = ['0.622330', '0.621496', '0.605425', '0.620736', '0.636396', '0.632575', '0.622403', '0.627459', '0.620330', '0.633549', '0.623257', '0.575304', '0.627003', '0.516014', '0.619483', '0.625564', '0.626103', '0.623273', '0.633640', '0.624766']
         : correct/total = [(8857, 14232), (8847, 14235), (8637, 14266), (8825, 14217), (9061, 14238), (9092, 14373), (8929, 14346), (8994, 14334), (8867, 14294), (9106, 14373), (8940, 14344), (8228, 14302), (9000, 14354), (7411, 14362), (8871, 14320), (9005, 14395), (9009, 14389), (8886, 14257), (9030, 14251), (8996, 14399)]
         : compromised: 0.6101, honest: 0.6270
         : sketchguard stats = ['Node 0: acc_rate=0.500', 'Node 1: acc_rate=0.381', 'Node 2: acc_rate=0.371']...
Round 008: test acc mean=0.6245 ± 0.0266 | min=0.5097 max=0.6379
         : test loss mean=36.0545 ± 154.3444
         : individual accs = ['0.629848', '0.628732', '0.619936', '0.628473', '0.637870', '0.631183', '0.628886', '0.628785', '0.630824', '0.636471', '0.628207', '0.629283', '0.635502', '0.509748', '0.626187', '0.633692', '0.632150', '0.628393', '0.634061', '0.632058']
         : correct/total = [(8964, 14232), (8950, 14235), (8844, 14266), (8935, 14217), (9082, 14238), (9072, 14373), (9022, 14346), (9013, 14334), (9017, 14294), (9148, 14373), (9011, 14344), (9000, 14302), (9122, 14354), (7321, 14362), (8967, 14320), (9122, 14395), (9096, 14389), (8959, 14257), (9036, 14251), (9101, 14399)]
         : compromised: 0.6197, honest: 0.6318
         : sketchguard stats = ['Node 0: acc_rate=0.500', 'Node 1: acc_rate=0.375', 'Node 2: acc_rate=0.350']...
Round 009: test acc mean=0.6277 ± 0.0315 | min=0.4922 max=0.6422
         : test loss mean=46.3855 ± 199.3985
         : individual accs = ['0.638280', '0.638286', '0.627436', '0.630372', '0.641733', '0.637445', '0.634602', '0.629064', '0.638310', '0.640994', '0.634063', '0.629912', '0.642190', '0.492202', '0.621299', '0.637305', '0.639933', '0.631479', '0.634412', '0.635322']
         : correct/total = [(9084, 14232), (9086, 14235), (8951, 14266), (8962, 14217), (9137, 14238), (9162, 14373), (9104, 14346), (9017, 14334), (9124, 14294), (9213, 14373), (9095, 14344), (9009, 14302), (9218, 14354), (7069, 14362), (8897, 14320), (9174, 14395), (9208, 14389), (9003, 14257), (9041, 14251), (9148, 14399)]
         : compromised: 0.6217, honest: 0.6367
         : sketchguard stats = ['Node 0: acc_rate=0.500', 'Node 1: acc_rate=0.370', 'Node 2: acc_rate=0.333']...
Round 010: test acc mean=0.6320 ± 0.0286 | min=0.5093 max=0.6461
         : test loss mean=40.7914 ± 175.0274
         : individual accs = ['0.643409', '0.645311', '0.632413', '0.637828', '0.646088', '0.635636', '0.640666', '0.635552', '0.639289', '0.643220', '0.640128', '0.631870', '0.643793', '0.509261', '0.635126', '0.633831', '0.645424', '0.630497', '0.634412', '0.636641']
         : correct/total = [(9157, 14232), (9186, 14235), (9022, 14266), (9068, 14217), (9199, 14238), (9136, 14373), (9191, 14346), (9110, 14334), (9138, 14294), (9245, 14373), (9182, 14344), (9037, 14302), (9241, 14354), (7314, 14362), (9095, 14320), (9124, 14395), (9287, 14389), (8989, 14257), (9041, 14251), (9167, 14399)]
         : compromised: 0.6258, honest: 0.6414
         : sketchguard stats = ['Node 0: acc_rate=0.500', 'Node 1: acc_rate=0.367', 'Node 2: acc_rate=0.320']...

=== FINAL RESULTS ===
Dataset: sent140, Nodes: 20, Graph: erdos, Aggregation: sketchguard
Attack: gaussian, 60.0% compromised
Final accuracy - Compromised: 0.6258, Honest: 0.6414
Overall test accuracy: mean=0.6320 ± 0.0286

=== Sketchguard SUMMARY ===
Node 0: acceptance=0.500
Node 1: acceptance=0.367
Node 2: acceptance=0.320
Node 3: acceptance=0.500
Node 4: acceptance=0.250
Node 5: acceptance=0.200
Node 6: acceptance=0.200
Node 7: acceptance=0.400
Node 8: acceptance=0.500
Node 9: acceptance=0.333
Node 10: acceptance=0.500
Node 11: acceptance=0.229
Node 12: acceptance=0.471
Node 13: acceptance=0.500
Node 14: acceptance=0.143
Node 15: acceptance=0.217
Node 16: acceptance=0.200
Node 17: acceptance=0.440
Node 18: acceptance=0.250
Node 19: acceptance=0.500

=== PARALLEL EXECUTION TIME (realistic for distributed system) ===
  COMMUNICATION (max across nodes):
    - Sketch transfer: 0.000s (0.0%)
    - Model fetch (accepted): 0.000s (0.0%)
  COMPUTATION (max across nodes):
    - Sketching: 0.238s (94.0%)
    - Filtering: 0.001s (0.3%)
    - Aggregation: 0.014s (5.7%)
  TOTALS:
    - Total computation: 0.254s (100.0%)
    - Total communication: 0.000s (0.0%)
    - Total parallel time: 0.254s

=== PER-NODE AVERAGE TIME ===
  - Sketching: 0.173s
  - Filtering: 0.000s
  - Aggregation: 0.007s
  - Sketch transfer: 0.000s
  - Model fetch: 0.000s
  - Total per node: 0.181s

=== TOTAL COMPUTATIONAL WORK (sum across all nodes) ===
  - Total sketching: 3.470s
  - Total filtering: 0.008s
  - Total aggregation: 0.137s
  - Total sketch transfer: 0.000s
  - Total model fetch: 0.000s
  - Grand total: 3.614s
  - Mean acceptance rate: 0.351

Sketchguard Algorithm Properties:
  - Original dimension: 1,174,986
  - Sketch size: 180
  - Compression ratio: 19.9x
  - Single repetition: No repetitions needed
  - Theoretical complexity: O(d + N×k)
  - Approach: Sketch filtering + state aggregation
