Device: cuda
Seed: 987654321
Loading 1 LEAF Sent140 train files...
LEAF Sent140 train: 254555 users, 908652 samples
Building vocabulary (max_size=10000)...
Vocabulary size: 10000
Loading 1 LEAF Sent140 test files...
LEAF Sent140 test: 254555 users, 286281 samples
Found 254555 train users, 254555 test users, 254555 common users
User sample counts range: 494 (max) to 1 (min)
Distributed ALL 254555 users across 20 clients
Users per client: 12727 (with 15 clients getting +1 user)
Train partition sizes: [44353, 44290, 44657, 44907, 44696, 45843, 45801, 45619, 45069, 45639, 45821, 45311, 45779, 46056, 45625, 45984, 46428, 44737, 45540, 46497]
Test partition sizes: [14232, 14235, 14266, 14217, 14238, 14373, 14346, 14334, 14294, 14373, 14344, 14302, 14354, 14362, 14320, 14395, 14389, 14257, 14251, 14399]
  Client 0: 44353 train samples, 2 unique classes
  Client 1: 44290 train samples, 2 unique classes
  Client 2: 44657 train samples, 2 unique classes
  Client 3: 44907 train samples, 2 unique classes
  Client 4: 44696 train samples, 2 unique classes
  Client 5: 45843 train samples, 2 unique classes
  Client 6: 45801 train samples, 2 unique classes
  Client 7: 45619 train samples, 2 unique classes
  Client 8: 45069 train samples, 2 unique classes
  Client 9: 45639 train samples, 2 unique classes
  Client 10: 45821 train samples, 2 unique classes
  Client 11: 45311 train samples, 2 unique classes
  Client 12: 45779 train samples, 2 unique classes
  Client 13: 46056 train samples, 2 unique classes
  Client 14: 45625 train samples, 2 unique classes
  Client 15: 45984 train samples, 2 unique classes
  Client 16: 46428 train samples, 2 unique classes
  Client 17: 44737 train samples, 2 unique classes
  Client 18: 45540 train samples, 2 unique classes
  Client 19: 46497 train samples, 2 unique classes
Will sample 4500 samples per client per epoch
Graph: erdos, nodes: 20, edges: 99
Degree statistics: avg=9.90, min=7, max=14
Attack: Compromised 12/20 nodes: [1, 2, 3, 5, 8, 11, 12, 13, 14, 15, 17, 18]
Attack type: directed_deviation, lambda: 1.0
Model variant: baseline
Model parameters: 1,174,986
Initial test acc across nodes: mean=0.4965 ± 0.0152
Round 001: test acc mean=0.5019 ± 0.0064 | min=0.4878 max=0.5145
         : test loss mean=7.5256 ± 2.3549
         : individual accs = ['0.514545', '0.502705', '0.505748', '0.501583', '0.505829', '0.504140', '0.493169', '0.499442', '0.498811', '0.495234', '0.499930', '0.503216', '0.511425', '0.487815', '0.513547', '0.501771', '0.496768', '0.503051', '0.495825', '0.503090']
         : correct/total = [(7323, 14232), (7156, 14235), (7215, 14266), (7131, 14217), (7202, 14238), (7246, 14373), (7075, 14346), (7159, 14334), (7130, 14294), (7118, 14373), (7171, 14344), (7197, 14302), (7341, 14354), (7006, 14362), (7354, 14320), (7223, 14395), (7148, 14389), (7172, 14257), (7066, 14251), (7244, 14399)]
         : compromised: 0.5025, honest: 0.5010
Round 002: test acc mean=0.5043 ± 0.0041 | min=0.4967 max=0.5129
         : test loss mean=8.8040 ± 2.7744
         : individual accs = ['0.505200', '0.508957', '0.506028', '0.498699', '0.503371', '0.500591', '0.506274', '0.505093', '0.510564', '0.506018', '0.500139', '0.499930', '0.502647', '0.496658', '0.506215', '0.501355', '0.506220', '0.512871', '0.508806', '0.501354']
         : correct/total = [(7190, 14232), (7245, 14235), (7219, 14266), (7090, 14217), (7167, 14238), (7195, 14373), (7263, 14346), (7240, 14334), (7298, 14294), (7273, 14373), (7174, 14344), (7150, 14302), (7215, 14354), (7133, 14362), (7249, 14320), (7217, 14395), (7284, 14389), (7312, 14257), (7251, 14251), (7219, 14399)]
         : compromised: 0.5044, honest: 0.5042
Round 003: test acc mean=0.4961 ± 0.0059 | min=0.4863 max=0.5084
         : test loss mean=1.7558 ± 0.6091
         : individual accs = ['0.490022', '0.488795', '0.486261', '0.492439', '0.495294', '0.493843', '0.497212', '0.497698', '0.488177', '0.506505', '0.500279', '0.492239', '0.499582', '0.508355', '0.495531', '0.498090', '0.499965', '0.505085', '0.490492', '0.495659']
         : correct/total = [(6974, 14232), (6958, 14235), (6937, 14266), (7001, 14217), (7052, 14238), (7098, 14373), (7133, 14346), (7134, 14334), (6978, 14294), (7280, 14373), (7176, 14344), (7040, 14302), (7171, 14354), (7301, 14362), (7096, 14320), (7170, 14395), (7194, 14389), (7201, 14257), (6990, 14251), (7137, 14399)]
         : compromised: 0.4949, honest: 0.4978
Round 004: test acc mean=0.5033 ± 0.0076 | min=0.4829 max=0.5171
         : test loss mean=3.4411 ± 1.2742
         : individual accs = ['0.510891', '0.498209', '0.510935', '0.507772', '0.510044', '0.507340', '0.489474', '0.504674', '0.510074', '0.501774', '0.482920', '0.504125', '0.498119', '0.498050', '0.499721', '0.501980', '0.502954', '0.517149', '0.506140', '0.503021']
         : correct/total = [(7271, 14232), (7092, 14235), (7289, 14266), (7219, 14217), (7262, 14238), (7292, 14373), (7022, 14346), (7234, 14334), (7291, 14294), (7212, 14373), (6927, 14344), (7210, 14302), (7150, 14354), (7153, 14362), (7156, 14320), (7226, 14395), (7237, 14389), (7373, 14257), (7213, 14251), (7243, 14399)]
         : compromised: 0.5050, honest: 0.5007
Round 005: test acc mean=0.4979 ± 0.0070 | min=0.4878 max=0.5122
         : test loss mean=1.4800 ± 0.3561
         : individual accs = ['0.491287', '0.488514', '0.487943', '0.494338', '0.512221', '0.494399', '0.495957', '0.505860', '0.490206', '0.495165', '0.499721', '0.487764', '0.501811', '0.508355', '0.497835', '0.506634', '0.504622', '0.503051', '0.493930', '0.497535']
         : correct/total = [(6992, 14232), (6954, 14235), (6961, 14266), (7028, 14217), (7293, 14238), (7106, 14373), (7115, 14346), (7251, 14334), (7007, 14294), (7117, 14373), (7168, 14344), (6976, 14302), (7203, 14354), (7301, 14362), (7129, 14320), (7293, 14395), (7261, 14389), (7172, 14257), (7039, 14251), (7164, 14399)]
         : compromised: 0.4962, honest: 0.5003
Round 006: test acc mean=0.5051 ± 0.0042 | min=0.4961 max=0.5122
         : test loss mean=2.1439 ± 0.8665
         : individual accs = ['0.510118', '0.505374', '0.505958', '0.504959', '0.507726', '0.505253', '0.506552', '0.505232', '0.508885', '0.496069', '0.498327', '0.512166', '0.508499', '0.510583', '0.498464', '0.501146', '0.506846', '0.500807', '0.504737', '0.504202']
         : correct/total = [(7260, 14232), (7194, 14235), (7218, 14266), (7179, 14217), (7229, 14238), (7262, 14373), (7267, 14346), (7242, 14334), (7274, 14294), (7130, 14373), (7148, 14344), (7325, 14302), (7299, 14354), (7333, 14362), (7138, 14320), (7214, 14395), (7293, 14389), (7140, 14257), (7193, 14251), (7260, 14399)]
         : compromised: 0.5056, honest: 0.5044
Round 007: test acc mean=0.5027 ± 0.0064 | min=0.4874 max=0.5134
         : test loss mean=1.0409 ± 0.2823
         : individual accs = ['0.508291', '0.500386', '0.510935', '0.499543', '0.507515', '0.505879', '0.502300', '0.493233', '0.496572', '0.487372', '0.503695', '0.503216', '0.508987', '0.509539', '0.498953', '0.513442', '0.507540', '0.502911', '0.496527', '0.497326']
         : correct/total = [(7234, 14232), (7123, 14235), (7289, 14266), (7102, 14217), (7226, 14238), (7271, 14373), (7206, 14346), (7070, 14334), (7098, 14294), (7005, 14373), (7225, 14344), (7197, 14302), (7306, 14354), (7318, 14362), (7145, 14320), (7391, 14395), (7303, 14389), (7170, 14257), (7076, 14251), (7161, 14399)]
         : compromised: 0.5039, honest: 0.5009
Round 008: test acc mean=0.4991 ± 0.0055 | min=0.4838 max=0.5099
         : test loss mean=1.6721 ± 0.6467
         : individual accs = ['0.500773', '0.492097', '0.497897', '0.503200', '0.497472', '0.499896', '0.500627', '0.497907', '0.509934', '0.483754', '0.496933', '0.506223', '0.500627', '0.502785', '0.498813', '0.495589', '0.496421', '0.495686', '0.506982', '0.498021']
         : correct/total = [(7127, 14232), (7005, 14235), (7103, 14266), (7154, 14217), (7083, 14238), (7185, 14373), (7182, 14346), (7137, 14334), (7289, 14294), (6953, 14373), (7128, 14344), (7240, 14302), (7186, 14354), (7221, 14362), (7143, 14320), (7134, 14395), (7143, 14389), (7067, 14257), (7225, 14251), (7171, 14399)]
         : compromised: 0.5008, honest: 0.4965
Round 009: test acc mean=0.5055 ± 0.0090 | min=0.4926 max=0.5261
         : test loss mean=0.8988 ± 0.2071
         : individual accs = ['0.526068', '0.518932', '0.512267', '0.515158', '0.502248', '0.499687', '0.507946', '0.492605', '0.500979', '0.503235', '0.493098', '0.498881', '0.505016', '0.496519', '0.497067', '0.512331', '0.496977', '0.514765', '0.502210', '0.514133']
         : correct/total = [(7487, 14232), (7387, 14235), (7308, 14266), (7324, 14217), (7151, 14238), (7182, 14373), (7287, 14346), (7061, 14334), (7161, 14294), (7233, 14373), (7073, 14344), (7135, 14302), (7249, 14354), (7131, 14362), (7118, 14320), (7375, 14395), (7151, 14389), (7339, 14257), (7157, 14251), (7403, 14399)]
         : compromised: 0.5062, honest: 0.5045
Round 010: test acc mean=0.5024 ± 0.0063 | min=0.4881 max=0.5127
         : test loss mean=1.3226 ± 0.4819
         : individual accs = ['0.504918', '0.498068', '0.509042', '0.504326', '0.505268', '0.506297', '0.497839', '0.498674', '0.507556', '0.488137', '0.495190', '0.509160', '0.498467', '0.512742', '0.497067', '0.499687', '0.507401', '0.495195', '0.500737', '0.512397']
         : correct/total = [(7186, 14232), (7090, 14235), (7262, 14266), (7170, 14217), (7194, 14238), (7277, 14373), (7142, 14346), (7148, 14334), (7255, 14294), (7016, 14373), (7103, 14344), (7282, 14302), (7155, 14354), (7364, 14362), (7118, 14320), (7193, 14395), (7301, 14389), (7060, 14257), (7136, 14251), (7378, 14399)]
         : compromised: 0.5032, honest: 0.5012

=== FINAL RESULTS ===
Dataset: sent140, Nodes: 20, Graph: erdos, Aggregation: krum
Attack: directed_deviation, 60.0% compromised
Final accuracy - Compromised: 0.5032, Honest: 0.5012
Overall test accuracy: mean=0.5024 ± 0.0063
