Device: cuda
Seed: 987654321
Loading 1 LEAF Sent140 train files...
LEAF Sent140 train: 254555 users, 908652 samples
Building vocabulary (max_size=10000)...
Vocabulary size: 10000
Loading 1 LEAF Sent140 test files...
LEAF Sent140 test: 254555 users, 286281 samples
Found 254555 train users, 254555 test users, 254555 common users
User sample counts range: 494 (max) to 1 (min)
Distributed ALL 254555 users across 20 clients
Users per client: 12727 (with 15 clients getting +1 user)
Train partition sizes: [44353, 44290, 44657, 44907, 44696, 45843, 45801, 45619, 45069, 45639, 45821, 45311, 45779, 46056, 45625, 45984, 46428, 44737, 45540, 46497]
Test partition sizes: [14232, 14235, 14266, 14217, 14238, 14373, 14346, 14334, 14294, 14373, 14344, 14302, 14354, 14362, 14320, 14395, 14389, 14257, 14251, 14399]
  Client 0: 44353 train samples, 2 unique classes
  Client 1: 44290 train samples, 2 unique classes
  Client 2: 44657 train samples, 2 unique classes
  Client 3: 44907 train samples, 2 unique classes
  Client 4: 44696 train samples, 2 unique classes
  Client 5: 45843 train samples, 2 unique classes
  Client 6: 45801 train samples, 2 unique classes
  Client 7: 45619 train samples, 2 unique classes
  Client 8: 45069 train samples, 2 unique classes
  Client 9: 45639 train samples, 2 unique classes
  Client 10: 45821 train samples, 2 unique classes
  Client 11: 45311 train samples, 2 unique classes
  Client 12: 45779 train samples, 2 unique classes
  Client 13: 46056 train samples, 2 unique classes
  Client 14: 45625 train samples, 2 unique classes
  Client 15: 45984 train samples, 2 unique classes
  Client 16: 46428 train samples, 2 unique classes
  Client 17: 44737 train samples, 2 unique classes
  Client 18: 45540 train samples, 2 unique classes
  Client 19: 46497 train samples, 2 unique classes
Will sample 4500 samples per client per epoch
Graph: fully, nodes: 20, edges: 190
Degree statistics: avg=19.00, min=19, max=19
Attack: Compromised 10/20 nodes: [1, 2, 5, 11, 12, 13, 14, 15, 17, 18]
Attack type: directed_deviation, lambda: 1.0
Model variant: baseline
Model parameters: 1,174,986
Initial test acc across nodes: mean=0.4953 ± 0.0174
Round 001: test acc mean=0.5011 ± 0.0066 | min=0.4876 max=0.5125
         : test loss mean=5.7708 ± 1.7015
         : individual accs = ['0.508853', '0.511486', '0.500070', '0.494689', '0.487568', '0.509010', '0.502440', '0.503907', '0.502099', '0.497113', '0.495817', '0.492728', '0.497074', '0.499443', '0.491341', '0.504481', '0.512544', '0.503051', '0.505579', '0.502465']
         : correct/total = [(7242, 14232), (7281, 14235), (7134, 14266), (7033, 14217), (6942, 14238), (7316, 14373), (7208, 14346), (7223, 14334), (7177, 14294), (7145, 14373), (7112, 14344), (7047, 14302), (7135, 14354), (7173, 14362), (7036, 14320), (7262, 14395), (7375, 14389), (7172, 14257), (7205, 14251), (7235, 14399)]
         : compromised: 0.5014, honest: 0.5007
Round 002: test acc mean=0.4907 ± 0.0048 | min=0.4822 max=0.5014
         : test loss mean=4.8077 ± 0.0652
         : individual accs = ['0.484401', '0.487039', '0.492079', '0.487163', '0.482160', '0.491547', '0.490311', '0.490931', '0.496782', '0.493077', '0.492262', '0.492029', '0.501393', '0.497076', '0.485964', '0.492463', '0.483355', '0.492249', '0.495193', '0.487048']
         : correct/total = [(6894, 14232), (6933, 14235), (7020, 14266), (6926, 14217), (6865, 14238), (7065, 14373), (7034, 14346), (7037, 14334), (7101, 14294), (7087, 14373), (7061, 14344), (7037, 14302), (7197, 14354), (7139, 14362), (6959, 14320), (7089, 14395), (6955, 14389), (7018, 14257), (7057, 14251), (7013, 14399)]
         : compromised: 0.4927, honest: 0.4887
Round 003: test acc mean=0.4768 ± 0.0041 | min=0.4693 max=0.4857
         : test loss mean=0.7983 ± 0.0043
         : individual accs = ['0.485666', '0.478539', '0.476518', '0.472603', '0.480756', '0.471857', '0.479088', '0.478513', '0.475234', '0.479162', '0.477482', '0.476647', '0.473596', '0.469294', '0.482472', '0.481834', '0.473209', '0.475836', '0.478072', '0.469963']
         : correct/total = [(6912, 14232), (6812, 14235), (6798, 14266), (6719, 14217), (6845, 14238), (6782, 14373), (6873, 14346), (6859, 14334), (6793, 14294), (6887, 14373), (6849, 14344), (6817, 14302), (6798, 14354), (6740, 14362), (6909, 14320), (6936, 14395), (6809, 14389), (6784, 14257), (6813, 14251), (6767, 14399)]
         : compromised: 0.4765, honest: 0.4772
Round 004: test acc mean=0.5021 ± 0.0044 | min=0.4943 max=0.5102
         : test loss mean=0.9130 ± 0.0069
         : individual accs = ['0.505551', '0.498700', '0.506449', '0.510234', '0.508358', '0.499339', '0.495818', '0.505093', '0.497621', '0.494330', '0.502649', '0.505594', '0.498119', '0.499582', '0.507542', '0.497256', '0.501981', '0.504735', '0.499333', '0.504410']
         : correct/total = [(7195, 14232), (7099, 14235), (7225, 14266), (7254, 14217), (7238, 14238), (7177, 14373), (7113, 14346), (7240, 14334), (7113, 14294), (7105, 14373), (7210, 14344), (7231, 14302), (7150, 14354), (7175, 14362), (7268, 14320), (7158, 14395), (7223, 14389), (7196, 14257), (7116, 14251), (7263, 14399)]
         : compromised: 0.5017, honest: 0.5026
Round 005: test acc mean=0.4985 ± 0.0056 | min=0.4874 max=0.5079
         : test loss mean=0.6939 ± 0.0005
         : individual accs = ['0.495011', '0.488795', '0.489836', '0.487445', '0.500913', '0.501287', '0.503973', '0.496372', '0.503078', '0.499269', '0.504462', '0.496854', '0.507942', '0.507659', '0.497207', '0.501633', '0.494127', '0.495827', '0.498000', '0.499549']
         : correct/total = [(7045, 14232), (6958, 14235), (6988, 14266), (6930, 14217), (7132, 14238), (7205, 14373), (7230, 14346), (7115, 14334), (7191, 14294), (7176, 14373), (7236, 14344), (7106, 14302), (7291, 14354), (7291, 14362), (7120, 14320), (7221, 14395), (7110, 14389), (7069, 14257), (7097, 14251), (7193, 14399)]
         : compromised: 0.4985, honest: 0.4984
Round 006: test acc mean=0.5172 ± 0.0048 | min=0.5100 max=0.5291
         : test loss mean=0.7106 ± 0.0031
         : individual accs = ['0.521431', '0.529118', '0.520889', '0.518393', '0.510044', '0.513254', '0.515335', '0.521697', '0.510424', '0.515063', '0.512270', '0.519578', '0.510171', '0.513438', '0.517737', '0.516429', '0.517687', '0.516869', '0.524735', '0.518647']
         : correct/total = [(7421, 14232), (7532, 14235), (7431, 14266), (7370, 14217), (7262, 14238), (7377, 14373), (7393, 14346), (7478, 14334), (7296, 14294), (7403, 14373), (7348, 14344), (7431, 14302), (7323, 14354), (7374, 14362), (7414, 14320), (7434, 14395), (7449, 14389), (7369, 14257), (7478, 14251), (7468, 14399)]
         : compromised: 0.5182, honest: 0.5161
Round 007: test acc mean=0.5221 ± 0.0054 | min=0.5116 max=0.5327
         : test loss mean=0.6887 ± 0.0007
         : individual accs = ['0.517496', '0.514085', '0.511636', '0.513259', '0.525284', '0.526682', '0.526419', '0.521208', '0.521967', '0.520003', '0.527538', '0.521955', '0.532743', '0.530567', '0.518156', '0.524071', '0.522343', '0.519745', '0.521367', '0.526009']
         : correct/total = [(7365, 14232), (7318, 14235), (7299, 14266), (7297, 14217), (7479, 14238), (7570, 14373), (7552, 14346), (7471, 14334), (7461, 14294), (7474, 14373), (7567, 14344), (7465, 14302), (7647, 14354), (7620, 14362), (7420, 14320), (7544, 14395), (7516, 14389), (7410, 14257), (7430, 14251), (7574, 14399)]
         : compromised: 0.5221, honest: 0.5222
Round 008: test acc mean=0.5342 ± 0.0042 | min=0.5273 max=0.5441
         : test loss mean=0.7001 ± 0.0016
         : individual accs = ['0.530073', '0.530453', '0.533086', '0.527326', '0.535117', '0.535309', '0.535271', '0.533417', '0.535050', '0.544145', '0.535555', '0.533072', '0.529121', '0.536276', '0.528701', '0.529003', '0.538119', '0.538542', '0.535401', '0.540593']
         : correct/total = [(7544, 14232), (7551, 14235), (7605, 14266), (7497, 14217), (7619, 14238), (7694, 14373), (7679, 14346), (7646, 14334), (7648, 14294), (7821, 14373), (7682, 14344), (7624, 14302), (7595, 14354), (7702, 14362), (7571, 14320), (7615, 14395), (7743, 14389), (7678, 14257), (7630, 14251), (7784, 14399)]
         : compromised: 0.5329, honest: 0.5355
Round 009: test acc mean=0.5577 ± 0.0044 | min=0.5498 max=0.5680
         : test loss mean=0.6803 ± 0.0012
         : individual accs = ['0.553822', '0.553214', '0.550540', '0.549764', '0.561736', '0.560287', '0.562038', '0.558253', '0.556877', '0.554373', '0.557376', '0.560621', '0.567995', '0.562039', '0.553980', '0.561375', '0.556397', '0.556218', '0.555049', '0.561983']
         : correct/total = [(7882, 14232), (7875, 14235), (7854, 14266), (7816, 14217), (7998, 14238), (8053, 14373), (8063, 14346), (8002, 14334), (7960, 14294), (7968, 14373), (7995, 14344), (8018, 14302), (8153, 14354), (8072, 14362), (7933, 14320), (8081, 14395), (8006, 14389), (7930, 14257), (7910, 14251), (8092, 14399)]
         : compromised: 0.5581, honest: 0.5573
Round 010: test acc mean=0.5413 ± 0.0039 | min=0.5333 max=0.5471
         : test loss mean=0.6943 ± 0.0012
         : individual accs = ['0.533305', '0.542396', '0.538834', '0.541816', '0.542632', '0.540945', '0.546703', '0.536208', '0.543445', '0.546233', '0.539529', '0.538526', '0.543542', '0.542682', '0.534637', '0.541369', '0.546181', '0.543873', '0.536313', '0.547121']
         : correct/total = [(7590, 14232), (7721, 14235), (7687, 14266), (7703, 14217), (7726, 14238), (7775, 14373), (7843, 14346), (7686, 14334), (7768, 14294), (7851, 14373), (7739, 14344), (7702, 14302), (7802, 14354), (7794, 14362), (7656, 14320), (7793, 14395), (7859, 14389), (7754, 14257), (7643, 14251), (7878, 14399)]
         : compromised: 0.5403, honest: 0.5423

=== FINAL RESULTS ===
Dataset: sent140, Nodes: 20, Graph: fully, Aggregation: d-fedavg
Attack: directed_deviation, 50.0% compromised
Final accuracy - Compromised: 0.5403, Honest: 0.5423
Overall test accuracy: mean=0.5413 ± 0.0039
