Device: cuda
Seed: 987654321
Loading 1 LEAF Sent140 train files...
LEAF Sent140 train: 254555 users, 908652 samples
Building vocabulary (max_size=10000)...
Vocabulary size: 10000
Loading 1 LEAF Sent140 test files...
LEAF Sent140 test: 254555 users, 286281 samples
Found 254555 train users, 254555 test users, 254555 common users
User sample counts range: 494 (max) to 1 (min)
Distributed ALL 254555 users across 20 clients
Users per client: 12727 (with 15 clients getting +1 user)
Train partition sizes: [44353, 44290, 44657, 44907, 44696, 45843, 45801, 45619, 45069, 45639, 45821, 45311, 45779, 46056, 45625, 45984, 46428, 44737, 45540, 46497]
Test partition sizes: [14232, 14235, 14266, 14217, 14238, 14373, 14346, 14334, 14294, 14373, 14344, 14302, 14354, 14362, 14320, 14395, 14389, 14257, 14251, 14399]
  Client 0: 44353 train samples, 2 unique classes
  Client 1: 44290 train samples, 2 unique classes
  Client 2: 44657 train samples, 2 unique classes
  Client 3: 44907 train samples, 2 unique classes
  Client 4: 44696 train samples, 2 unique classes
  Client 5: 45843 train samples, 2 unique classes
  Client 6: 45801 train samples, 2 unique classes
  Client 7: 45619 train samples, 2 unique classes
  Client 8: 45069 train samples, 2 unique classes
  Client 9: 45639 train samples, 2 unique classes
  Client 10: 45821 train samples, 2 unique classes
  Client 11: 45311 train samples, 2 unique classes
  Client 12: 45779 train samples, 2 unique classes
  Client 13: 46056 train samples, 2 unique classes
  Client 14: 45625 train samples, 2 unique classes
  Client 15: 45984 train samples, 2 unique classes
  Client 16: 46428 train samples, 2 unique classes
  Client 17: 44737 train samples, 2 unique classes
  Client 18: 45540 train samples, 2 unique classes
  Client 19: 46497 train samples, 2 unique classes
Will sample 4500 samples per client per epoch
Graph: erdos, nodes: 20, edges: 126
Degree statistics: avg=12.60, min=8, max=16
Attack: Compromised 2/20 nodes: [5, 13]
Attack type: directed_deviation, lambda: 1.0
Model variant: baseline
Model parameters: 1,174,986
Initial test acc across nodes: mean=0.4953 ± 0.0174
Round 001: test acc mean=0.5681 ± 0.0682 | min=0.4908 max=0.6475
         : test loss mean=10.9050 ± 11.0755
         : individual accs = ['0.506254', '0.647489', '0.501192', '0.643947', '0.623613', '0.493425', '0.510595', '0.622018', '0.494543', '0.641272', '0.643196', '0.496784', '0.642469', '0.510026', '0.495461', '0.636332', '0.618181', '0.639195', '0.490843', '0.504479']
         : correct/total = [(7205, 14232), (9217, 14235), (7150, 14266), (9155, 14217), (8879, 14238), (7092, 14373), (7325, 14346), (8916, 14334), (7069, 14294), (9217, 14373), (9226, 14344), (7105, 14302), (9222, 14354), (7325, 14362), (7095, 14320), (9160, 14395), (8895, 14389), (9113, 14257), (6995, 14251), (7264, 14399)]
         : compromised: 0.5017, honest: 0.5754
Round 002: test acc mean=0.6346 ± 0.0295 | min=0.5149 max=0.6610
         : test loss mean=1.3489 ± 3.1462
         : individual accs = ['0.639474', '0.625641', '0.629048', '0.514947', '0.640118', '0.648855', '0.659208', '0.660806', '0.636911', '0.636541', '0.656302', '0.660957', '0.631183', '0.630831', '0.633729', '0.636332', '0.635694', '0.632111', '0.636166', '0.648101']
         : correct/total = [(9101, 14232), (8906, 14235), (8974, 14266), (7321, 14217), (9114, 14238), (9326, 14373), (9457, 14346), (9472, 14334), (9104, 14294), (9149, 14373), (9414, 14344), (9453, 14302), (9060, 14354), (9060, 14362), (9075, 14320), (9160, 14395), (9147, 14389), (9012, 14257), (9066, 14251), (9332, 14399)]
         : compromised: 0.6398, honest: 0.6341
Round 003: test acc mean=0.6562 ± 0.0153 | min=0.6338 max=0.6753
         : test loss mean=0.6191 ± 0.0156
         : individual accs = ['0.637366', '0.668072', '0.633815', '0.659281', '0.643700', '0.639811', '0.672801', '0.675317', '0.670771', '0.673068', '0.633993', '0.669487', '0.647624', '0.674627', '0.636522', '0.640361', '0.663145', '0.669075', '0.666760', '0.649073']
         : correct/total = [(9071, 14232), (9510, 14235), (9042, 14266), (9373, 14217), (9165, 14238), (9196, 14373), (9652, 14346), (9680, 14334), (9588, 14294), (9674, 14373), (9094, 14344), (9575, 14302), (9296, 14354), (9689, 14362), (9115, 14320), (9218, 14395), (9542, 14389), (9539, 14257), (9502, 14251), (9346, 14399)]
         : compromised: 0.6572, honest: 0.6561
Round 004: test acc mean=0.6704 ± 0.0089 | min=0.6439 max=0.6827
         : test loss mean=0.6026 ± 0.0085
         : individual accs = ['0.659711', '0.676291', '0.661503', '0.643877', '0.681978', '0.666458', '0.678377', '0.673434', '0.682734', '0.671259', '0.677496', '0.671514', '0.667549', '0.675602', '0.662221', '0.672178', '0.667385', '0.672442', '0.665637', '0.680464']
         : correct/total = [(9389, 14232), (9627, 14235), (9437, 14266), (9154, 14217), (9710, 14238), (9579, 14373), (9732, 14346), (9653, 14334), (9759, 14294), (9648, 14373), (9718, 14344), (9604, 14302), (9582, 14354), (9703, 14362), (9483, 14320), (9676, 14395), (9603, 14389), (9587, 14257), (9486, 14251), (9798, 14399)]
         : compromised: 0.6710, honest: 0.6703
Round 005: test acc mean=0.6854 ± 0.0034 | min=0.6781 max=0.6896
         : test loss mean=0.5868 ± 0.0027
         : individual accs = ['0.680157', '0.688725', '0.682462', '0.685447', '0.688791', '0.681486', '0.683745', '0.686549', '0.689450', '0.689626', '0.684328', '0.688575', '0.686917', '0.687578', '0.679958', '0.683710', '0.686497', '0.686610', '0.678058', '0.688381']
         : correct/total = [(9680, 14232), (9804, 14235), (9736, 14266), (9745, 14217), (9807, 14238), (9795, 14373), (9809, 14346), (9841, 14334), (9855, 14294), (9912, 14373), (9816, 14344), (9848, 14302), (9860, 14354), (9875, 14362), (9737, 14320), (9842, 14395), (9878, 14389), (9789, 14257), (9663, 14251), (9912, 14399)]
         : compromised: 0.6845, honest: 0.6854
Round 006: test acc mean=0.6826 ± 0.0108 | min=0.6698 max=0.7032
         : test loss mean=0.5863 ± 0.0091
         : individual accs = ['0.672639', '0.699403', '0.669844', '0.670746', '0.683874', '0.678912', '0.696640', '0.680689', '0.702253', '0.680860', '0.703221', '0.677807', '0.679532', '0.682565', '0.673813', '0.676624', '0.673640', '0.698043', '0.670409', '0.680186']
         : correct/total = [(9573, 14232), (9956, 14235), (9556, 14266), (9536, 14217), (9737, 14238), (9758, 14373), (9994, 14346), (9757, 14334), (10038, 14294), (9786, 14373), (10087, 14344), (9694, 14302), (9754, 14354), (9803, 14362), (9649, 14320), (9740, 14395), (9693, 14389), (9952, 14257), (9554, 14251), (9794, 14399)]
         : compromised: 0.6807, honest: 0.6828
Round 007: test acc mean=0.6934 ± 0.0099 | min=0.6548 max=0.7041
         : test loss mean=0.5777 ± 0.0092
         : individual accs = ['0.690556', '0.654795', '0.695149', '0.699163', '0.691740', '0.694775', '0.701589', '0.698479', '0.694977', '0.698323', '0.693600', '0.699203', '0.695834', '0.704080', '0.686732', '0.698715', '0.696713', '0.689696', '0.687811', '0.695465']
         : correct/total = [(9828, 14232), (9321, 14235), (9917, 14266), (9940, 14217), (9849, 14238), (9986, 14373), (10065, 14346), (10012, 14334), (9934, 14294), (10037, 14373), (9949, 14344), (10000, 14302), (9988, 14354), (10112, 14362), (9834, 14320), (10058, 14395), (10025, 14389), (9833, 14257), (9802, 14251), (10014, 14399)]
         : compromised: 0.6994, honest: 0.6927
Round 008: test acc mean=0.6939 ± 0.0123 | min=0.6816 max=0.7183
         : test loss mean=0.5749 ± 0.0127
         : individual accs = ['0.691259', '0.689989', '0.704823', '0.690441', '0.685138', '0.685104', '0.713997', '0.686131', '0.714076', '0.682112', '0.718279', '0.688156', '0.687056', '0.712784', '0.683031', '0.684196', '0.707554', '0.688504', '0.681636', '0.683797']
         : correct/total = [(9838, 14232), (9822, 14235), (10055, 14266), (9816, 14217), (9755, 14238), (9847, 14373), (10243, 14346), (9835, 14334), (10207, 14294), (9804, 14373), (10303, 14344), (9842, 14302), (9862, 14354), (10237, 14362), (9781, 14320), (9849, 14395), (10181, 14389), (9816, 14257), (9714, 14251), (9846, 14399)]
         : compromised: 0.6989, honest: 0.6933
Round 009: test acc mean=0.7099 ± 0.0068 | min=0.6894 max=0.7173
         : test loss mean=0.5581 ± 0.0082
         : individual accs = ['0.710722', '0.712259', '0.710080', '0.717029', '0.716112', '0.710429', '0.709396', '0.717315', '0.713096', '0.709594', '0.715351', '0.713537', '0.694928', '0.714455', '0.704469', '0.689406', '0.706303', '0.710598', '0.710055', '0.713383']
         : correct/total = [(10115, 14232), (10139, 14235), (10130, 14266), (10194, 14217), (10196, 14238), (10211, 14373), (10177, 14346), (10282, 14334), (10193, 14294), (10199, 14373), (10261, 14344), (10205, 14302), (9975, 14354), (10261, 14362), (10088, 14320), (9924, 14395), (10163, 14389), (10131, 14257), (10119, 14251), (10272, 14399)]
         : compromised: 0.7124, honest: 0.7096
Round 010: test acc mean=0.7119 ± 0.0048 | min=0.7027 max=0.7219
         : test loss mean=0.5616 ± 0.0081
         : individual accs = ['0.712128', '0.718230', '0.705454', '0.702680', '0.716042', '0.718152', '0.715252', '0.721850', '0.711487', '0.708064', '0.711656', '0.717942', '0.710603', '0.713202', '0.708799', '0.711914', '0.710265', '0.707652', '0.705775', '0.711855']
         : correct/total = [(10135, 14232), (10224, 14235), (10064, 14266), (9990, 14217), (10195, 14238), (10322, 14373), (10261, 14346), (10347, 14334), (10170, 14294), (10177, 14373), (10208, 14344), (10268, 14302), (10200, 14354), (10243, 14362), (10150, 14320), (10248, 14395), (10220, 14389), (10089, 14257), (10058, 14251), (10250, 14399)]
         : compromised: 0.7157, honest: 0.7115

=== FINAL RESULTS ===
Dataset: sent140, Nodes: 20, Graph: erdos, Aggregation: krum
Attack: directed_deviation, 10.0% compromised
Final accuracy - Compromised: 0.7157, Honest: 0.7115
Overall test accuracy: mean=0.7119 ± 0.0048
