Device: cuda
Seed: 987654321
Loading 1 LEAF Sent140 train files...
LEAF Sent140 train: 254555 users, 908652 samples
Building vocabulary (max_size=10000)...
Vocabulary size: 10000
Loading 1 LEAF Sent140 test files...
LEAF Sent140 test: 254555 users, 286281 samples
Found 254555 train users, 254555 test users, 254555 common users
User sample counts range: 494 (max) to 1 (min)
Distributed ALL 254555 users across 20 clients
Users per client: 12727 (with 15 clients getting +1 user)
Train partition sizes: [44353, 44290, 44657, 44907, 44696, 45843, 45801, 45619, 45069, 45639, 45821, 45311, 45779, 46056, 45625, 45984, 46428, 44737, 45540, 46497]
Test partition sizes: [14232, 14235, 14266, 14217, 14238, 14373, 14346, 14334, 14294, 14373, 14344, 14302, 14354, 14362, 14320, 14395, 14389, 14257, 14251, 14399]
  Client 0: 44353 train samples, 2 unique classes
  Client 1: 44290 train samples, 2 unique classes
  Client 2: 44657 train samples, 2 unique classes
  Client 3: 44907 train samples, 2 unique classes
  Client 4: 44696 train samples, 2 unique classes
  Client 5: 45843 train samples, 2 unique classes
  Client 6: 45801 train samples, 2 unique classes
  Client 7: 45619 train samples, 2 unique classes
  Client 8: 45069 train samples, 2 unique classes
  Client 9: 45639 train samples, 2 unique classes
  Client 10: 45821 train samples, 2 unique classes
  Client 11: 45311 train samples, 2 unique classes
  Client 12: 45779 train samples, 2 unique classes
  Client 13: 46056 train samples, 2 unique classes
  Client 14: 45625 train samples, 2 unique classes
  Client 15: 45984 train samples, 2 unique classes
  Client 16: 46428 train samples, 2 unique classes
  Client 17: 44737 train samples, 2 unique classes
  Client 18: 45540 train samples, 2 unique classes
  Client 19: 46497 train samples, 2 unique classes
Will sample 4500 samples per client per epoch
Graph: ring, nodes: 20, edges: 20
Degree statistics: avg=2.00, min=2, max=2
Attack: Compromised 12/20 nodes: [1, 2, 3, 5, 8, 11, 12, 13, 14, 15, 17, 18]
Attack type: directed_deviation, lambda: 1.0
Model variant: baseline
Model parameters: 1,174,986
Initial test acc across nodes: mean=0.4965 ± 0.0152
Round 001: test acc mean=0.4989 ± 0.0064 | min=0.4826 max=0.5096
         : test loss mean=9.6410 ± 5.8035
         : individual accs = ['0.492411', '0.509589', '0.498318', '0.482591', '0.498174', '0.500104', '0.497491', '0.493931', '0.508745', '0.507410', '0.501813', '0.496574', '0.505643', '0.503830', '0.497137', '0.494825', '0.495448', '0.504875', '0.497369', '0.492673']
         : correct/total = [(7008, 14232), (7254, 14235), (7109, 14266), (6861, 14217), (7093, 14238), (7188, 14373), (7137, 14346), (7080, 14334), (7272, 14294), (7293, 14373), (7198, 14344), (7102, 14302), (7258, 14354), (7236, 14362), (7119, 14320), (7123, 14395), (7129, 14389), (7198, 14257), (7088, 14251), (7094, 14399)]
         : compromised: 0.5000, honest: 0.4974
Round 002: test acc mean=0.4985 ± 0.0063 | min=0.4898 max=0.5116
         : test loss mean=11.9344 ± 7.7405
         : individual accs = ['0.493887', '0.492729', '0.502453', '0.493212', '0.498455', '0.501983', '0.499373', '0.493861', '0.494613', '0.493843', '0.489822', '0.490980', '0.510171', '0.510653', '0.498254', '0.501702', '0.498158', '0.511608', '0.493579', '0.500313']
         : correct/total = [(7029, 14232), (7014, 14235), (7168, 14266), (7012, 14217), (7097, 14238), (7215, 14373), (7164, 14346), (7079, 14334), (7070, 14294), (7098, 14373), (7026, 14344), (7022, 14302), (7323, 14354), (7334, 14362), (7135, 14320), (7222, 14395), (7168, 14389), (7294, 14257), (7034, 14251), (7204, 14399)]
         : compromised: 0.5002, honest: 0.4960
Round 003: test acc mean=0.5012 ± 0.0077 | min=0.4814 max=0.5118
         : test loss mean=6.0893 ± 6.4537
         : individual accs = ['0.485736', '0.506709', '0.506869', '0.507772', '0.505900', '0.506157', '0.501115', '0.504256', '0.511753', '0.500244', '0.493168', '0.506992', '0.498537', '0.493037', '0.503911', '0.502258', '0.501355', '0.497229', '0.510420', '0.481422']
         : correct/total = [(6913, 14232), (7213, 14235), (7231, 14266), (7219, 14217), (7203, 14238), (7275, 14373), (7189, 14346), (7228, 14334), (7315, 14294), (7190, 14373), (7074, 14344), (7251, 14302), (7156, 14354), (7081, 14362), (7216, 14320), (7230, 14395), (7214, 14389), (7089, 14257), (7274, 14251), (6932, 14399)]
         : compromised: 0.5043, honest: 0.4966
Round 004: test acc mean=0.4989 ± 0.0067 | min=0.4900 max=0.5119
         : test loss mean=6.5116 ± 4.6905
         : individual accs = ['0.496557', '0.496101', '0.491658', '0.499261', '0.497963', '0.511236', '0.509550', '0.509000', '0.496012', '0.494956', '0.503695', '0.498112', '0.502787', '0.511906', '0.495461', '0.489962', '0.491417', '0.492039', '0.491965', '0.498715']
         : correct/total = [(7067, 14232), (7062, 14235), (7014, 14266), (7098, 14217), (7090, 14238), (7348, 14373), (7310, 14346), (7296, 14334), (7090, 14294), (7114, 14373), (7225, 14344), (7124, 14302), (7217, 14354), (7352, 14362), (7095, 14320), (7053, 14395), (7071, 14389), (7015, 14257), (7011, 14251), (7181, 14399)]
         : compromised: 0.4980, honest: 0.5002
Round 005: test acc mean=0.5050 ± 0.0068 | min=0.4941 max=0.5205
         : test loss mean=3.6309 ± 2.3719
         : individual accs = ['0.510891', '0.502986', '0.520538', '0.497433', '0.496839', '0.494121', '0.496445', '0.501395', '0.511333', '0.512489', '0.506832', '0.499161', '0.515118', '0.505361', '0.505587', '0.504967', '0.503093', '0.498492', '0.507824', '0.508716']
         : correct/total = [(7271, 14232), (7160, 14235), (7426, 14266), (7072, 14217), (7074, 14238), (7102, 14373), (7122, 14346), (7187, 14334), (7309, 14294), (7366, 14373), (7270, 14344), (7139, 14302), (7394, 14354), (7258, 14362), (7240, 14320), (7269, 14395), (7239, 14389), (7107, 14257), (7237, 14251), (7325, 14399)]
         : compromised: 0.5052, honest: 0.5046
Round 006: test acc mean=0.5034 ± 0.0080 | min=0.4868 max=0.5207
         : test loss mean=5.5775 ± 4.9191
         : individual accs = ['0.502248', '0.492237', '0.486822', '0.502567', '0.493819', '0.497043', '0.510107', '0.520650', '0.501049', '0.508871', '0.507948', '0.502307', '0.501811', '0.508077', '0.501117', '0.506426', '0.509695', '0.514344', '0.492737', '0.508646']
         : correct/total = [(7148, 14232), (7007, 14235), (6945, 14266), (7145, 14217), (7031, 14238), (7144, 14373), (7318, 14346), (7463, 14334), (7162, 14294), (7314, 14373), (7286, 14344), (7184, 14302), (7203, 14354), (7297, 14362), (7176, 14320), (7290, 14395), (7334, 14389), (7333, 14257), (7022, 14251), (7324, 14399)]
         : compromised: 0.5005, honest: 0.5077
Round 007: test acc mean=0.5096 ± 0.0133 | min=0.4930 max=0.5440
         : test loss mean=2.8177 ± 1.8071
         : individual accs = ['0.524030', '0.504039', '0.512898', '0.508335', '0.503863', '0.508592', '0.502579', '0.505442', '0.510494', '0.540806', '0.543991', '0.501818', '0.499512', '0.492968', '0.503073', '0.500382', '0.502606', '0.498422', '0.504105', '0.524828']
         : correct/total = [(7458, 14232), (7175, 14235), (7317, 14266), (7227, 14217), (7174, 14238), (7310, 14373), (7210, 14346), (7245, 14334), (7297, 14294), (7773, 14373), (7803, 14344), (7177, 14302), (7170, 14354), (7080, 14362), (7204, 14320), (7203, 14395), (7232, 14389), (7106, 14257), (7184, 14251), (7557, 14399)]
         : compromised: 0.5037, honest: 0.5185
Round 008: test acc mean=0.5034 ± 0.0095 | min=0.4884 max=0.5229
         : test loss mean=4.0695 ± 3.6268
         : individual accs = ['0.501546', '0.493151', '0.488364', '0.490821', '0.493749', '0.491547', '0.512896', '0.513744', '0.499440', '0.508036', '0.509412', '0.497413', '0.501742', '0.508982', '0.503212', '0.522890', '0.514907', '0.514905', '0.494141', '0.507674']
         : correct/total = [(7138, 14232), (7020, 14235), (6967, 14266), (6978, 14217), (7030, 14238), (7065, 14373), (7358, 14346), (7364, 14334), (7139, 14294), (7302, 14373), (7307, 14344), (7114, 14302), (7202, 14354), (7310, 14362), (7206, 14320), (7527, 14395), (7409, 14389), (7341, 14257), (7042, 14251), (7310, 14399)]
         : compromised: 0.5006, honest: 0.5077
Round 009: test acc mean=0.5134 ± 0.0195 | min=0.4923 max=0.5558
         : test loss mean=2.6317 ± 1.9150
         : individual accs = ['0.545953', '0.504742', '0.513318', '0.506858', '0.505127', '0.500035', '0.508853', '0.510395', '0.510774', '0.555764', '0.552217', '0.506782', '0.499164', '0.492341', '0.498673', '0.505175', '0.502676', '0.500175', '0.499404', '0.550455']
         : correct/total = [(7770, 14232), (7185, 14235), (7323, 14266), (7206, 14217), (7192, 14238), (7187, 14373), (7300, 14346), (7316, 14334), (7301, 14294), (7988, 14373), (7921, 14344), (7248, 14302), (7165, 14354), (7071, 14362), (7141, 14320), (7272, 14395), (7233, 14389), (7131, 14257), (7117, 14251), (7926, 14399)]
         : compromised: 0.5031, honest: 0.5289
Round 010: test acc mean=0.5082 ± 0.0109 | min=0.4915 max=0.5258
         : test loss mean=3.8584 ± 3.8680
         : individual accs = ['0.511875', '0.491465', '0.493481', '0.503693', '0.496278', '0.503444', '0.516590', '0.517581', '0.504897', '0.514646', '0.518056', '0.497972', '0.500418', '0.512255', '0.496229', '0.525808', '0.521509', '0.522691', '0.494492', '0.520383']
         : correct/total = [(7285, 14232), (6996, 14235), (7040, 14266), (7161, 14217), (7066, 14238), (7236, 14373), (7411, 14346), (7419, 14334), (7217, 14294), (7397, 14373), (7431, 14344), (7122, 14302), (7183, 14354), (7357, 14362), (7106, 14320), (7569, 14395), (7504, 14389), (7452, 14257), (7047, 14251), (7493, 14399)]
         : compromised: 0.5039, honest: 0.5146

=== FINAL RESULTS ===
Dataset: sent140, Nodes: 20, Graph: ring, Aggregation: krum
Attack: directed_deviation, 60.0% compromised
Final accuracy - Compromised: 0.5039, Honest: 0.5146
Overall test accuracy: mean=0.5082 ± 0.0109
