Device: cuda
Seed: 987654321
Loading 1 LEAF Sent140 train files...
LEAF Sent140 train: 254555 users, 908652 samples
Building vocabulary (max_size=10000)...
Vocabulary size: 10000
Loading 1 LEAF Sent140 test files...
LEAF Sent140 test: 254555 users, 286281 samples
Found 254555 train users, 254555 test users, 254555 common users
User sample counts range: 494 (max) to 1 (min)
Distributed ALL 254555 users across 20 clients
Users per client: 12727 (with 15 clients getting +1 user)
Train partition sizes: [44353, 44290, 44657, 44907, 44696, 45843, 45801, 45619, 45069, 45639, 45821, 45311, 45779, 46056, 45625, 45984, 46428, 44737, 45540, 46497]
Test partition sizes: [14232, 14235, 14266, 14217, 14238, 14373, 14346, 14334, 14294, 14373, 14344, 14302, 14354, 14362, 14320, 14395, 14389, 14257, 14251, 14399]
  Client 0: 44353 train samples, 2 unique classes
  Client 1: 44290 train samples, 2 unique classes
  Client 2: 44657 train samples, 2 unique classes
  Client 3: 44907 train samples, 2 unique classes
  Client 4: 44696 train samples, 2 unique classes
  Client 5: 45843 train samples, 2 unique classes
  Client 6: 45801 train samples, 2 unique classes
  Client 7: 45619 train samples, 2 unique classes
  Client 8: 45069 train samples, 2 unique classes
  Client 9: 45639 train samples, 2 unique classes
  Client 10: 45821 train samples, 2 unique classes
  Client 11: 45311 train samples, 2 unique classes
  Client 12: 45779 train samples, 2 unique classes
  Client 13: 46056 train samples, 2 unique classes
  Client 14: 45625 train samples, 2 unique classes
  Client 15: 45984 train samples, 2 unique classes
  Client 16: 46428 train samples, 2 unique classes
  Client 17: 44737 train samples, 2 unique classes
  Client 18: 45540 train samples, 2 unique classes
  Client 19: 46497 train samples, 2 unique classes
Will sample 4500 samples per client per epoch
Graph: ring, nodes: 20, edges: 20
Degree statistics: avg=2.00, min=2, max=2
Attack: Compromised 12/20 nodes: [1, 2, 3, 5, 8, 11, 12, 13, 14, 15, 17, 18]
Attack type: gaussian, lambda: 1.0
Model variant: baseline
Model parameters: 1,174,986
BALANCE algorithm:
Balance Config: BALANCEConfig(gamma=2, kappa=1, alpha=0.5, min_neighbors=1)
  - Model dimension: 1,174,986 parameters
  - Complexity: O(N×d) = O(20×1,174,986)
Initial test acc across nodes: mean=0.4953 ± 0.0174
Round 001: test acc mean=0.5380 ± 0.0369 | min=0.4868 max=0.5940
         : test loss mean=278.9258 ± 429.8248
         : individual accs = ['0.583263', '0.593818', '0.486752', '0.565942', '0.504987', '0.508592', '0.590687', '0.593972', '0.501189', '0.547763', '0.545176', '0.516291', '0.500488', '0.494778', '0.499162', '0.546440', '0.504969', '0.561408', '0.528594', '0.584902']
         : correct/total = [(8301, 14232), (8453, 14235), (6944, 14266), (8046, 14217), (7190, 14238), (7310, 14373), (8474, 14346), (8514, 14334), (7164, 14294), (7873, 14373), (7820, 14344), (7384, 14302), (7184, 14354), (7106, 14362), (7148, 14320), (7866, 14395), (7266, 14389), (8004, 14257), (7533, 14251), (8422, 14399)]
         : compromised: 0.5253, honest: 0.5570
Round 002: test acc mean=0.5726 ± 0.0644 | min=0.4930 max=0.6455
         : test loss mean=337.2321 ± 421.4142
         : individual accs = ['0.640107', '0.632385', '0.506309', '0.508757', '0.496067', '0.625478', '0.638645', '0.645458', '0.556737', '0.640298', '0.630926', '0.628164', '0.512958', '0.509957', '0.493017', '0.495936', '0.507540', '0.507470', '0.633219', '0.642545']
         : correct/total = [(9110, 14232), (9002, 14235), (7223, 14266), (7233, 14217), (7063, 14238), (8990, 14373), (9162, 14346), (9252, 14334), (7958, 14294), (9203, 14373), (9050, 14344), (8984, 14302), (7363, 14354), (7324, 14362), (7060, 14320), (7139, 14395), (7303, 14389), (7235, 14257), (9024, 14251), (9252, 14399)]
         : compromised: 0.5509, honest: 0.6052
Round 003: test acc mean=0.5713 ± 0.0648 | min=0.4925 max=0.6457
         : test loss mean=270.4597 ± 328.5085
         : individual accs = ['0.632097', '0.618967', '0.497687', '0.505451', '0.510676', '0.644820', '0.622891', '0.634087', '0.560445', '0.645655', '0.640895', '0.643476', '0.507385', '0.512603', '0.492528', '0.498923', '0.494683', '0.500456', '0.625149', '0.636364']
         : correct/total = [(8996, 14232), (8811, 14235), (7100, 14266), (7186, 14217), (7271, 14238), (9268, 14373), (8936, 14346), (9089, 14334), (8011, 14294), (9280, 14373), (9193, 14344), (9203, 14302), (7283, 14354), (7362, 14362), (7053, 14320), (7182, 14395), (7118, 14389), (7135, 14257), (8909, 14251), (9163, 14399)]
         : compromised: 0.5507, honest: 0.6022
Round 004: test acc mean=0.5793 ± 0.0743 | min=0.4847 max=0.6555
         : test loss mean=269.0756 ± 369.3476
         : individual accs = ['0.653316', '0.643063', '0.503855', '0.485897', '0.490518', '0.655187', '0.645964', '0.654597', '0.623688', '0.647116', '0.643893', '0.641589', '0.492685', '0.506267', '0.503701', '0.501841', '0.510946', '0.484674', '0.642411', '0.655532']
         : correct/total = [(9298, 14232), (9154, 14235), (7188, 14266), (6908, 14217), (6984, 14238), (9417, 14373), (9267, 14346), (9383, 14334), (8915, 14294), (9301, 14373), (9236, 14344), (9176, 14302), (7072, 14354), (7271, 14362), (7213, 14320), (7224, 14395), (7352, 14389), (6910, 14257), (9155, 14251), (9439, 14399)]
         : compromised: 0.5571, honest: 0.6127
Round 005: test acc mean=0.5838 ± 0.0736 | min=0.4881 max=0.6584
         : test loss mean=242.2220 ± 304.7302
         : individual accs = ['0.648398', '0.654022', '0.506659', '0.514666', '0.488130', '0.654213', '0.649728', '0.658365', '0.638240', '0.656230', '0.650028', '0.639771', '0.506618', '0.498050', '0.495740', '0.501146', '0.507888', '0.505226', '0.651674', '0.650531']
         : correct/total = [(9228, 14232), (9310, 14235), (7228, 14266), (7317, 14217), (6950, 14238), (9403, 14373), (9321, 14346), (9437, 14334), (9123, 14294), (9432, 14373), (9324, 14344), (9150, 14302), (7272, 14354), (7153, 14362), (7099, 14320), (7214, 14395), (7308, 14389), (7203, 14257), (9287, 14251), (9367, 14399)]
         : compromised: 0.5638, honest: 0.6137
Round 006: test acc mean=0.5854 ± 0.0769 | min=0.4872 max=0.6673
         : test loss mean=234.9363 ± 294.5002
         : individual accs = ['0.655565', '0.660836', '0.493621', '0.487234', '0.512572', '0.666388', '0.658790', '0.667295', '0.623828', '0.653517', '0.651074', '0.641099', '0.502438', '0.493942', '0.505098', '0.522056', '0.498019', '0.496177', '0.654972', '0.663449']
         : correct/total = [(9330, 14232), (9407, 14235), (7042, 14266), (6927, 14217), (7298, 14238), (9578, 14373), (9451, 14346), (9565, 14334), (8917, 14294), (9393, 14373), (9339, 14344), (9169, 14302), (7212, 14354), (7094, 14362), (7233, 14320), (7515, 14395), (7166, 14389), (7074, 14257), (9334, 14251), (9553, 14399)]
         : compromised: 0.5623, honest: 0.6200
Round 007: test acc mean=0.5886 ± 0.0818 | min=0.4869 max=0.6761
         : test loss mean=427.9266 ± 598.9260
         : individual accs = ['0.663575', '0.661819', '0.501051', '0.511219', '0.501615', '0.672372', '0.669246', '0.676085', '0.644816', '0.666180', '0.657906', '0.653195', '0.494636', '0.493594', '0.486941', '0.494199', '0.502328', '0.502069', '0.651253', '0.668380']
         : correct/total = [(9444, 14232), (9421, 14235), (7148, 14266), (7268, 14217), (7142, 14238), (9664, 14373), (9601, 14346), (9691, 14334), (9217, 14294), (9575, 14373), (9437, 14344), (9342, 14302), (7100, 14354), (7089, 14362), (6973, 14320), (7114, 14395), (7228, 14389), (7158, 14257), (9281, 14251), (9624, 14399)]
         : compromised: 0.5639, honest: 0.6257
Round 008: test acc mean=0.5916 ± 0.0829 | min=0.4832 max=0.6770
         : test loss mean=387.4476 ± 564.0987
         : individual accs = ['0.668494', '0.651774', '0.497897', '0.483154', '0.498385', '0.676964', '0.663530', '0.669248', '0.665804', '0.670911', '0.666690', '0.662145', '0.499652', '0.499373', '0.513687', '0.502605', '0.503718', '0.503753', '0.662690', '0.672061']
         : correct/total = [(9514, 14232), (9278, 14235), (7103, 14266), (6869, 14217), (7096, 14238), (9730, 14373), (9519, 14346), (9593, 14334), (9517, 14294), (9643, 14373), (9563, 14344), (9470, 14302), (7172, 14354), (7172, 14362), (7356, 14320), (7235, 14395), (7248, 14389), (7182, 14257), (9444, 14251), (9677, 14399)]
         : compromised: 0.5683, honest: 0.6266
Round 009: test acc mean=0.5912 ± 0.0809 | min=0.4925 max=0.6800
         : test loss mean=480.6767 ± 703.3180
         : individual accs = ['0.647695', '0.649245', '0.495374', '0.519730', '0.505127', '0.675781', '0.651540', '0.663737', '0.658598', '0.680025', '0.674847', '0.673822', '0.493451', '0.499443', '0.492458', '0.506565', '0.506985', '0.502209', '0.669427', '0.657476']
         : correct/total = [(9218, 14232), (9242, 14235), (7067, 14266), (7389, 14217), (7192, 14238), (9713, 14373), (9347, 14346), (9514, 14334), (9414, 14294), (9774, 14373), (9680, 14344), (9637, 14302), (7083, 14354), (7173, 14362), (7052, 14320), (7292, 14395), (7295, 14389), (7160, 14257), (9540, 14251), (9467, 14399)]
         : compromised: 0.5697, honest: 0.6234
Round 010: test acc mean=0.5992 ± 0.0889 | min=0.4895 max=0.6921
         : test loss mean=350.7907 ± 481.8861
         : individual accs = ['0.672709', '0.673270', '0.518646', '0.493494', '0.501545', '0.691018', '0.682978', '0.692131', '0.669722', '0.682391', '0.681121', '0.675080', '0.504250', '0.505361', '0.504609', '0.489476', '0.490514', '0.503823', '0.671532', '0.680047']
         : correct/total = [(9574, 14232), (9584, 14235), (7399, 14266), (7016, 14217), (7141, 14238), (9932, 14373), (9798, 14346), (9921, 14334), (9573, 14294), (9808, 14373), (9770, 14344), (9655, 14302), (7238, 14354), (7258, 14362), (7226, 14320), (7046, 14395), (7058, 14389), (7183, 14257), (9570, 14251), (9792, 14399)]
         : compromised: 0.5750, honest: 0.6354

=== FINAL RESULTS ===
Dataset: sent140, Nodes: 20, Graph: ring, Aggregation: balance
Attack: gaussian, 60.0% compromised
Final accuracy - Compromised: 0.5750, Honest: 0.6354
Overall test accuracy: mean=0.5992 ± 0.0889

=== BALANCE SUMMARY ===
Node 0: acceptance=0.500
Node 1: acceptance=0.500
Node 2: acceptance=0.500
Node 3: acceptance=0.550
Node 4: acceptance=0.500
Node 5: acceptance=0.550
Node 6: acceptance=0.500
Node 7: acceptance=0.500
Node 8: acceptance=0.750
Node 9: acceptance=0.500
Node 10: acceptance=0.500
Node 11: acceptance=0.500
Node 12: acceptance=0.500
Node 13: acceptance=0.500
Node 14: acceptance=0.500
Node 15: acceptance=0.450
Node 16: acceptance=0.500
Node 17: acceptance=0.250
Node 18: acceptance=0.500
Node 19: acceptance=0.500

=== PARALLEL EXECUTION TIME (realistic for distributed system) ===
  COMMUNICATION (max across nodes):
    - Full model transfer: 0.000s (0.1%)
  COMPUTATION (max across nodes):
    - Filtering: 0.020s (57.0%)
    - Aggregation: 0.015s (42.9%)
  TOTALS:
    - Total computation: 0.035s (99.9%)
    - Total communication: 0.000s (0.1%)
    - Total parallel time: 0.035s

=== PER-NODE AVERAGE TIME ===
  - Filtering: 0.011s
  - Aggregation: 0.006s
  - Model transfer: 0.000s
  - Total per node: 0.017s

=== TOTAL COMPUTATIONAL WORK (sum across all nodes) ===
  - Total filtering: 0.226s
  - Total aggregation: 0.120s
  - Total model transfer: 0.000s
  - Grand total: 0.346s
  - Mean acceptance rate: 0.503

BALANCE Algorithm Properties:
  - Model dimension: 1,174,986
  - No compression: Full parameter comparison
  - Theoretical complexity: O(deg(i)×d)
  - Approach: Full parameter filtering + averaging
